################Setting ''_ optimizer_ null_ aware_ Antijoin 'is ON################
SET _optimizer_null_aware_antijoin=ON;
#VIEW
DROP TABLE IF EXISTS t2;
Warnings:
Note	1051	Unknown table 'test.t2'
DROP TABLE IF EXISTS t1;
Warnings:
Note	1051	Unknown table 'test.t1'
CREATE TABLE t1(c0 INT,c1 CHAR(50));
CREATE TABLE t2(c0 INT,c1 VARCHAR(50));
INSERT INTO t1 VALUES(1,'A');
INSERT INTO t1 VALUES(2,12);
INSERT INTO t1 VALUES(3,'A');
INSERT INTO t1 VALUES(4,NULL);
INSERT INTO t1 VALUES(5,'$ % &');
INSERT INTO t2 VALUES(1,12);
INSERT INTO t2 VALUES(2,'AB');
INSERT INTO t2 VALUES(3,'');
INSERT INTO t2 VALUES(4,NULL);
INSERT INTO t2 VALUES(5,'$%&');
CREATE OR REPLACE VIEW v1 AS SELECT * FROM t1;
CREATE OR REPLACE VIEW v2 AS SELECT * FROM t2;
SELECT * FROM v1 ORDER BY c0,c1;
c0	c1
1	A
2	12
3	A
4	NULL
5	$ % &
SELECT * FROM v2 ORDER BY c0,c1;
c0	c1
1	12
2	AB
3	
4	NULL
5	$%&
SELECT /*USE_HASH(v1,v2)*/ * FROM v1,v2 WHERE v1.c1 NOT IN (SELECT c1 FROM v2) ORDER BY v1.c0,v1.c1;
c0	c1	c0	c1
EXPLAIN BASIC SELECT /*USE_HASH(v1,v2),READ_CONSISTENCY (weak)*/ * FROM v1,v2 WHERE v1.c1 NOT IN (SELECT c1 FROM v2) ORDER BY v1.c0,v1.c1;
Query Plan
=======================================
|ID|OPERATOR                     |NAME|
---------------------------------------
|0 |SORT                         |    |
|1 |└─NESTED-LOOP JOIN CARTESIAN |    |
|2 |  ├─TABLE FULL SCAN          |t2  |
|3 |  └─MATERIAL                 |    |
|4 |    └─HASH RIGHT ANTI JOIN NA|    |
|5 |      ├─TABLE FULL SCAN      |t2  |
|6 |      └─TABLE FULL SCAN      |t1  |
=======================================
Outputs & filters:
-------------------------------------
  0 - output([t1.c0], [t1.c1], [t2.c0], [t2.c1]), filter(nil), rowset=16
      sort_keys([t1.c0, ASC], [t1.c1, ASC])
  1 - output([t1.c0], [t1.c1], [t2.c0], [t2.c1]), filter(nil), rowset=16
      conds(nil), nl_params_(nil), use_batch=false
  2 - output([t2.c0], [t2.c1]), filter(nil), rowset=16
      access([t2.c0], [t2.c1]), partitions(p0)
      is_index_back=false, is_global_index=false, 
      range_key([t2.__pk_increment]), range(MIN ; MAX)always true
  3 - output([t1.c0], [t1.c1]), filter(nil), rowset=16
  4 - output([t1.c0], [t1.c1]), filter(nil), rowset=16
      equal_conds([t1.c1 = t2.c1]), other_conds(nil)
  5 - output([t2.c1]), filter(nil), rowset=16
      access([t2.c1]), partitions(p0)
      is_index_back=false, is_global_index=false, 
      range_key([t2.__pk_increment]), range(MIN ; MAX)always true
  6 - output([t1.c0], [t1.c1]), filter(nil), rowset=16
      access([t1.c0], [t1.c1]), partitions(p0)
      is_index_back=false, is_global_index=false, 
      range_key([t1.__pk_increment]), range(MIN ; MAX)always true
SELECT /*USE_MERGE(v1,v2)*/ * FROM v1,v2 WHERE v1.c1 NOT IN (SELECT c1 FROM v2) ORDER BY v1.c0,v1.c1;
c0	c1	c0	c1
EXPLAIN BASIC SELECT /*USE_MERGE(v1,v2),READ_CONSISTENCY (weak)*/ * FROM v1,v2 WHERE v1.c1 NOT IN (SELECT c1 FROM v2) ORDER BY v1.c0,v1.c1;
Query Plan
=======================================
|ID|OPERATOR                     |NAME|
---------------------------------------
|0 |SORT                         |    |
|1 |└─NESTED-LOOP JOIN CARTESIAN |    |
|2 |  ├─TABLE FULL SCAN          |t2  |
|3 |  └─MATERIAL                 |    |
|4 |    └─HASH RIGHT ANTI JOIN NA|    |
|5 |      ├─TABLE FULL SCAN      |t2  |
|6 |      └─TABLE FULL SCAN      |t1  |
=======================================
Outputs & filters:
-------------------------------------
  0 - output([t1.c0], [t1.c1], [t2.c0], [t2.c1]), filter(nil), rowset=16
      sort_keys([t1.c0, ASC], [t1.c1, ASC])
  1 - output([t1.c0], [t1.c1], [t2.c0], [t2.c1]), filter(nil), rowset=16
      conds(nil), nl_params_(nil), use_batch=false
  2 - output([t2.c0], [t2.c1]), filter(nil), rowset=16
      access([t2.c0], [t2.c1]), partitions(p0)
      is_index_back=false, is_global_index=false, 
      range_key([t2.__pk_increment]), range(MIN ; MAX)always true
  3 - output([t1.c0], [t1.c1]), filter(nil), rowset=16
  4 - output([t1.c0], [t1.c1]), filter(nil), rowset=16
      equal_conds([t1.c1 = t2.c1]), other_conds(nil)
  5 - output([t2.c1]), filter(nil), rowset=16
      access([t2.c1]), partitions(p0)
      is_index_back=false, is_global_index=false, 
      range_key([t2.__pk_increment]), range(MIN ; MAX)always true
  6 - output([t1.c0], [t1.c1]), filter(nil), rowset=16
      access([t1.c0], [t1.c1]), partitions(p0)
      is_index_back=false, is_global_index=false, 
      range_key([t1.__pk_increment]), range(MIN ; MAX)always true
SELECT /*USE_HASH(v1,v2)*/ * FROM v1,v2 WHERE v1.c1 NOT IN (SELECT c1 FROM v2 WHERE c1 <>ALL (SELECT c1 FROM v1)) ORDER BY v1.c0,v1.c1;
c0	c1	c0	c1
1	A	5	$%&
1	A	2	AB
1	A	3	
1	A	1	12
1	A	4	NULL
2	12	3	
2	12	1	12
2	12	5	$%&
2	12	2	AB
2	12	4	NULL
3	A	5	$%&
3	A	1	12
3	A	2	AB
3	A	3	
3	A	4	NULL
4	NULL	3	
4	NULL	1	12
4	NULL	2	AB
4	NULL	4	NULL
4	NULL	5	$%&
5	$ % &	4	NULL
5	$ % &	3	
5	$ % &	2	AB
5	$ % &	5	$%&
5	$ % &	1	12
EXPLAIN BASIC SELECT /*USE_HASH(v1,v2),READ_CONSISTENCY (weak)*/ * FROM v1,v2 WHERE v1.c1 NOT IN (SELECT c1 FROM v2 WHERE c1 <>ALL (SELECT c1 FROM v1)) ORDER BY v1.c0,v1.c1;
Query Plan
========================================
|ID|OPERATOR                     |NAME |
----------------------------------------
|0 |SORT                         |     |
|1 |└─NESTED-LOOP JOIN CARTESIAN |     |
|2 |  ├─TABLE FULL SCAN          |t2   |
|3 |  └─MATERIAL                 |     |
|4 |    └─HASH RIGHT ANTI JOIN NA|     |
|5 |      ├─SUBPLAN SCAN         |VIEW2|
|6 |      │ └─HASH ANTI JOIN NA  |     |
|7 |      │   ├─TABLE FULL SCAN  |t2   |
|8 |      │   └─TABLE FULL SCAN  |t1   |
|9 |      └─TABLE FULL SCAN      |t1   |
========================================
Outputs & filters:
-------------------------------------
  0 - output([t1.c0], [t1.c1], [t2.c0], [t2.c1]), filter(nil), rowset=16
      sort_keys([t1.c0, ASC], [t1.c1, ASC])
  1 - output([t1.c0], [t1.c1], [t2.c0], [t2.c1]), filter(nil), rowset=16
      conds(nil), nl_params_(nil), use_batch=false
  2 - output([t2.c0], [t2.c1]), filter(nil), rowset=16
      access([t2.c0], [t2.c1]), partitions(p0)
      is_index_back=false, is_global_index=false, 
      range_key([t2.__pk_increment]), range(MIN ; MAX)always true
  3 - output([t1.c0], [t1.c1]), filter(nil), rowset=16
  4 - output([t1.c0], [t1.c1]), filter(nil), rowset=16
      equal_conds([t1.c1 = VIEW2.c1]), other_conds(nil)
  5 - output([VIEW2.c1]), filter(nil), rowset=16
      access([VIEW2.c1])
  6 - output([t2.c1]), filter(nil), rowset=16
      equal_conds([t2.c1 = t1.c1]), other_conds(nil)
  7 - output([t2.c1]), filter(nil), rowset=16
      access([t2.c1]), partitions(p0)
      is_index_back=false, is_global_index=false, 
      range_key([t2.__pk_increment]), range(MIN ; MAX)always true
  8 - output([t1.c1]), filter(nil), rowset=16
      access([t1.c1]), partitions(p0)
      is_index_back=false, is_global_index=false, 
      range_key([t1.__pk_increment]), range(MIN ; MAX)always true
  9 - output([t1.c0], [t1.c1]), filter(nil), rowset=16
      access([t1.c0], [t1.c1]), partitions(p0)
      is_index_back=false, is_global_index=false, 
      range_key([t1.__pk_increment]), range(MIN ; MAX)always true
SELECT /*+parallel(5) USE_HASH(v1,v2)*/ * FROM v1 JOIN v2 ON v1.c0=v2.c0 WHERE v1.c1 NOT IN (SELECT c1 FROM v2) ORDER BY v1.c0,v1.c1;
c0	c1	c0	c1
EXPLAIN BASIC SELECT /*+parallel(5) USE_HASH(v1,v2),READ_CONSISTENCY (weak)*/ * FROM v1 JOIN v2 ON v1.c0=v2.c0 WHERE v1.c1 NOT IN (SELECT c1 FROM v2) ORDER BY v1.c0,v1.c1;
Query Plan
==========================================================
|ID|OPERATOR                                    |NAME    |
----------------------------------------------------------
|0 |PX COORDINATOR MERGE SORT                   |        |
|1 |└─EXCHANGE OUT DISTR                        |:EX10002|
|2 |  └─SORT                                    |        |
|3 |    └─SHARED HASH JOIN                      |        |
|4 |      ├─EXCHANGE IN DISTR                   |        |
|5 |      │ └─EXCHANGE OUT DISTR (BC2HOST)      |:EX10001|
|6 |      │   └─SHARED HASH RIGHT ANTI JOIN NA  |        |
|7 |      │     ├─EXCHANGE IN DISTR             |        |
|8 |      │     │ └─EXCHANGE OUT DISTR (BC2HOST)|:EX10000|
|9 |      │     │   └─PX BLOCK ITERATOR         |        |
|10|      │     │     └─TABLE FULL SCAN         |t2      |
|11|      │     └─PX BLOCK ITERATOR             |        |
|12|      │       └─TABLE FULL SCAN             |t1      |
|13|      └─PX BLOCK ITERATOR                   |        |
|14|        └─TABLE FULL SCAN                   |t2      |
==========================================================
Outputs & filters:
-------------------------------------
  0 - output([INTERNAL_FUNCTION(t1.c0, t1.c1, t2.c0, t2.c1)]), filter(nil), rowset=16
      sort_keys([t1.c0, ASC], [t1.c1, ASC])
  1 - output([t1.c0], [t1.c1], [INTERNAL_FUNCTION(t1.c0, t1.c1, t2.c0, t2.c1)]), filter(nil), rowset=16
      dop=5
  2 - output([t1.c0], [t1.c1], [t2.c0], [t2.c1]), filter(nil), rowset=16
      sort_keys([t1.c0, ASC], [t1.c1, ASC])
  3 - output([t1.c0], [t1.c1], [t2.c0], [t2.c1]), filter(nil), rowset=16
      equal_conds([t1.c0 = t2.c0]), other_conds(nil)
  4 - output([t1.c0], [t1.c1]), filter(nil), rowset=16
  5 - output([t1.c0], [t1.c1]), filter(nil), rowset=16
      dop=5
  6 - output([t1.c0], [t1.c1]), filter(nil), rowset=16
      equal_conds([t1.c1 = t2.c1]), other_conds(nil)
  7 - output([t2.c1]), filter(nil), rowset=16
  8 - output([t2.c1]), filter(nil), rowset=16
      dop=5
  9 - output([t2.c1]), filter(nil), rowset=16
 10 - output([t2.c1]), filter(nil), rowset=16
      access([t2.c1]), partitions(p0)
      is_index_back=false, is_global_index=false, 
      range_key([t2.__pk_increment]), range(MIN ; MAX)always true
 11 - output([t1.c0], [t1.c1]), filter(nil), rowset=16
 12 - output([t1.c0], [t1.c1]), filter(nil), rowset=16
      access([t1.c0], [t1.c1]), partitions(p0)
      is_index_back=false, is_global_index=false, 
      range_key([t1.__pk_increment]), range(MIN ; MAX)always true
 13 - output([t2.c0], [t2.c1]), filter(nil), rowset=16
 14 - output([t2.c0], [t2.c1]), filter(nil), rowset=16
      access([t2.c0], [t2.c1]), partitions(p0)
      is_index_back=false, is_global_index=false, 
      range_key([t2.__pk_increment]), range(MIN ; MAX)always true
SELECT /*+parallel(2) USE_HASH(v1,v2)*/ * FROM v1  WHERE c1 <>ALL (SELECT c1 FROM v2) ORDER BY v1.c0,v1.c1;
c0	c1
EXPLAIN BASIC SELECT /*+parallel(2) USE_HASH(v1,v2),READ_CONSISTENCY (weak)*/ * FROM v1  WHERE c1 <>ALL (SELECT c1 FROM v2) ORDER BY v1.c0,v1.c1;
Query Plan
====================================================
|ID|OPERATOR                              |NAME    |
----------------------------------------------------
|0 |PX COORDINATOR MERGE SORT             |        |
|1 |└─EXCHANGE OUT DISTR                  |:EX10001|
|2 |  └─SORT                              |        |
|3 |    └─SHARED HASH RIGHT ANTI JOIN NA  |        |
|4 |      ├─EXCHANGE IN DISTR             |        |
|5 |      │ └─EXCHANGE OUT DISTR (BC2HOST)|:EX10000|
|6 |      │   └─PX BLOCK ITERATOR         |        |
|7 |      │     └─TABLE FULL SCAN         |t2      |
|8 |      └─PX BLOCK ITERATOR             |        |
|9 |        └─TABLE FULL SCAN             |t1      |
====================================================
Outputs & filters:
-------------------------------------
  0 - output([INTERNAL_FUNCTION(t1.c0, t1.c1)]), filter(nil), rowset=16
      sort_keys([t1.c0, ASC], [t1.c1, ASC])
  1 - output([t1.c0], [t1.c1], [INTERNAL_FUNCTION(t1.c0, t1.c1)]), filter(nil), rowset=16
      dop=2
  2 - output([t1.c0], [t1.c1]), filter(nil), rowset=16
      sort_keys([t1.c0, ASC], [t1.c1, ASC])
  3 - output([t1.c0], [t1.c1]), filter(nil), rowset=16
      equal_conds([t1.c1 = t2.c1]), other_conds(nil)
  4 - output([t2.c1]), filter(nil), rowset=16
  5 - output([t2.c1]), filter(nil), rowset=16
      dop=2
  6 - output([t2.c1]), filter(nil), rowset=16
  7 - output([t2.c1]), filter(nil), rowset=16
      access([t2.c1]), partitions(p0)
      is_index_back=false, is_global_index=false, 
      range_key([t2.__pk_increment]), range(MIN ; MAX)always true
  8 - output([t1.c0], [t1.c1]), filter(nil), rowset=16
  9 - output([t1.c0], [t1.c1]), filter(nil), rowset=16
      access([t1.c0], [t1.c1]), partitions(p0)
      is_index_back=false, is_global_index=false, 
      range_key([t1.__pk_increment]), range(MIN ; MAX)always true
SELECT /*USE_HASH(v1,v2)*/ * FROM v1,v2 WHERE v1.c1 NOT IN (SELECT c1 FROM v2 WHERE c1 IS NOT NULL) ORDER BY v1.c0,v1.c1;
c0	c1	c0	c1
1	A	1	12
1	A	2	AB
1	A	3	
1	A	4	NULL
1	A	5	$%&
3	A	1	12
3	A	2	AB
3	A	3	
3	A	4	NULL
3	A	5	$%&
5	$ % &	1	12
5	$ % &	2	AB
5	$ % &	3	
5	$ % &	4	NULL
5	$ % &	5	$%&
EXPLAIN BASIC SELECT /*USE_HASH(v1,v2),READ_CONSISTENCY (weak)*/ * FROM v1,v2 WHERE v1.c1 NOT IN (SELECT c1 FROM v2 WHERE c1 IS NOT NULL) ORDER BY v1.c0,v1.c1;
Query Plan
=========================================
|ID|OPERATOR                      |NAME |
-----------------------------------------
|0 |SORT                          |     |
|1 |└─NESTED-LOOP JOIN CARTESIAN  |     |
|2 |  ├─TABLE FULL SCAN           |t2   |
|3 |  └─MATERIAL                  |     |
|4 |    └─HASH RIGHT ANTI JOIN SNA|     |
|5 |      ├─SUBPLAN SCAN          |VIEW1|
|6 |      │ └─TABLE FULL SCAN     |t2   |
|7 |      └─TABLE FULL SCAN       |t1   |
=========================================
Outputs & filters:
-------------------------------------
  0 - output([t1.c0], [t1.c1], [t2.c0], [t2.c1]), filter(nil), rowset=16
      sort_keys([t1.c0, ASC], [t1.c1, ASC])
  1 - output([t1.c0], [t1.c1], [t2.c0], [t2.c1]), filter(nil), rowset=16
      conds(nil), nl_params_(nil), use_batch=false
  2 - output([t2.c0], [t2.c1]), filter(nil), rowset=16
      access([t2.c0], [t2.c1]), partitions(p0)
      is_index_back=false, is_global_index=false, 
      range_key([t2.__pk_increment]), range(MIN ; MAX)always true
  3 - output([t1.c0], [t1.c1]), filter(nil), rowset=16
  4 - output([t1.c0], [t1.c1]), filter(nil), rowset=16
      equal_conds([t1.c1 = VIEW1.c1]), other_conds(nil)
  5 - output([VIEW1.c1]), filter(nil), rowset=16
      access([VIEW1.c1])
  6 - output([t2.c1]), filter([t2.c1 IS NOT NULL]), rowset=16
      access([t2.c1]), partitions(p0)
      is_index_back=false, is_global_index=false, filter_before_indexback[false], 
      range_key([t2.__pk_increment]), range(MIN ; MAX)always true
  7 - output([t1.c0], [t1.c1]), filter(nil), rowset=16
      access([t1.c0], [t1.c1]), partitions(p0)
      is_index_back=false, is_global_index=false, 
      range_key([t1.__pk_increment]), range(MIN ; MAX)always true
SELECT /*USE_MERGE(v1,v2)*/ * FROM v1,v2 WHERE v1.c1 NOT IN (SELECT c1 FROM v2 WHERE c1 <>ALL(SELECT c1 FROM v1 WHERE c1 IS NOT NULL) AND c1 IS NOT NULL) ORDER BY v1.c0,v1.c1;
c0	c1	c0	c1
1	A	2	AB
1	A	3	
1	A	1	12
1	A	5	$%&
1	A	4	NULL
2	12	1	12
2	12	3	
2	12	4	NULL
2	12	2	AB
2	12	5	$%&
3	A	3	
3	A	5	$%&
3	A	2	AB
3	A	1	12
3	A	4	NULL
5	$ % &	4	NULL
5	$ % &	3	
5	$ % &	2	AB
5	$ % &	5	$%&
5	$ % &	1	12
EXPLAIN BASIC SELECT /*USE_MERGE(v1,v2),READ_CONSISTENCY (weak)*/ * FROM v1,v2 WHERE v1.c1 NOT IN (SELECT c1 FROM v2 WHERE c1 <>ALL(SELECT c1 FROM v1 WHERE c1 IS NOT NULL) AND c1 IS NOT NULL) ORDER BY v1.c0,v1.c1;
Query Plan
=========================================
|ID|OPERATOR                      |NAME |
-----------------------------------------
|0 |SORT                          |     |
|1 |└─NESTED-LOOP JOIN CARTESIAN  |     |
|2 |  ├─TABLE FULL SCAN           |t2   |
|3 |  └─MATERIAL                  |     |
|4 |    └─HASH RIGHT ANTI JOIN SNA|     |
|5 |      ├─SUBPLAN SCAN          |VIEW2|
|6 |      │ └─HASH ANTI JOIN      |     |
|7 |      │   ├─TABLE FULL SCAN   |t2   |
|8 |      │   └─SUBPLAN SCAN      |VIEW1|
|9 |      │     └─TABLE FULL SCAN |t1   |
|10|      └─TABLE FULL SCAN       |t1   |
=========================================
Outputs & filters:
-------------------------------------
  0 - output([t1.c0], [t1.c1], [t2.c0], [t2.c1]), filter(nil), rowset=16
      sort_keys([t1.c0, ASC], [t1.c1, ASC])
  1 - output([t1.c0], [t1.c1], [t2.c0], [t2.c1]), filter(nil), rowset=16
      conds(nil), nl_params_(nil), use_batch=false
  2 - output([t2.c0], [t2.c1]), filter(nil), rowset=16
      access([t2.c0], [t2.c1]), partitions(p0)
      is_index_back=false, is_global_index=false, 
      range_key([t2.__pk_increment]), range(MIN ; MAX)always true
  3 - output([t1.c0], [t1.c1]), filter(nil), rowset=16
  4 - output([t1.c0], [t1.c1]), filter(nil), rowset=16
      equal_conds([t1.c1 = VIEW2.c1]), other_conds(nil)
  5 - output([VIEW2.c1]), filter(nil), rowset=16
      access([VIEW2.c1])
  6 - output([t2.c1]), filter(nil), rowset=16
      equal_conds([t2.c1 = VIEW1.c1]), other_conds(nil)
  7 - output([t2.c1]), filter([t2.c1 IS NOT NULL]), rowset=16
      access([t2.c1]), partitions(p0)
      is_index_back=false, is_global_index=false, filter_before_indexback[false], 
      range_key([t2.__pk_increment]), range(MIN ; MAX)always true
  8 - output([VIEW1.c1]), filter(nil), rowset=16
      access([VIEW1.c1])
  9 - output([t1.c1]), filter([t1.c1 IS NOT NULL]), rowset=16
      access([t1.c1]), partitions(p0)
      is_index_back=false, is_global_index=false, filter_before_indexback[false], 
      range_key([t1.__pk_increment]), range(MIN ; MAX)always true
 10 - output([t1.c0], [t1.c1]), filter(nil), rowset=16
      access([t1.c0], [t1.c1]), partitions(p0)
      is_index_back=false, is_global_index=false, 
      range_key([t1.__pk_increment]), range(MIN ; MAX)always true
SELECT /*USE_HASH(v1,v2)*/ * FROM v1,v2 WHERE v1.c1 NOT IN (SELECT c1 FROM v2 WHERE c1 <>ALL (SELECT c1 FROM v1) AND c1 IS NOT NULL) ORDER BY v1.c0,v1.c1;
c0	c1	c0	c1
1	A	5	$%&
1	A	2	AB
1	A	3	
1	A	1	12
1	A	4	NULL
2	12	3	
2	12	1	12
2	12	5	$%&
2	12	2	AB
2	12	4	NULL
3	A	5	$%&
3	A	1	12
3	A	2	AB
3	A	3	
3	A	4	NULL
4	NULL	3	
4	NULL	1	12
4	NULL	2	AB
4	NULL	4	NULL
4	NULL	5	$%&
5	$ % &	4	NULL
5	$ % &	3	
5	$ % &	2	AB
5	$ % &	5	$%&
5	$ % &	1	12
EXPLAIN BASIC SELECT /*USE_HASH(v1,v2),READ_CONSISTENCY (weak)*/ * FROM v1,v2 WHERE v1.c1 NOT IN (SELECT c1 FROM v2 WHERE c1 <>ALL (SELECT c1 FROM v1) AND c1 IS NOT NULL) ORDER BY v1.c0,v1.c1;
Query Plan
=========================================
|ID|OPERATOR                      |NAME |
-----------------------------------------
|0 |SORT                          |     |
|1 |└─NESTED-LOOP JOIN CARTESIAN  |     |
|2 |  ├─TABLE FULL SCAN           |t2   |
|3 |  └─MATERIAL                  |     |
|4 |    └─HASH RIGHT ANTI JOIN SNA|     |
|5 |      ├─SUBPLAN SCAN          |VIEW2|
|6 |      │ └─HASH ANTI JOIN NA   |     |
|7 |      │   ├─TABLE FULL SCAN   |t2   |
|8 |      │   └─TABLE FULL SCAN   |t1   |
|9 |      └─TABLE FULL SCAN       |t1   |
=========================================
Outputs & filters:
-------------------------------------
  0 - output([t1.c0], [t1.c1], [t2.c0], [t2.c1]), filter(nil), rowset=16
      sort_keys([t1.c0, ASC], [t1.c1, ASC])
  1 - output([t1.c0], [t1.c1], [t2.c0], [t2.c1]), filter(nil), rowset=16
      conds(nil), nl_params_(nil), use_batch=false
  2 - output([t2.c0], [t2.c1]), filter(nil), rowset=16
      access([t2.c0], [t2.c1]), partitions(p0)
      is_index_back=false, is_global_index=false, 
      range_key([t2.__pk_increment]), range(MIN ; MAX)always true
  3 - output([t1.c0], [t1.c1]), filter(nil), rowset=16
  4 - output([t1.c0], [t1.c1]), filter(nil), rowset=16
      equal_conds([t1.c1 = VIEW2.c1]), other_conds(nil)
  5 - output([VIEW2.c1]), filter(nil), rowset=16
      access([VIEW2.c1])
  6 - output([t2.c1]), filter(nil), rowset=16
      equal_conds([t2.c1 = t1.c1]), other_conds(nil)
  7 - output([t2.c1]), filter([t2.c1 IS NOT NULL]), rowset=16
      access([t2.c1]), partitions(p0)
      is_index_back=false, is_global_index=false, filter_before_indexback[false], 
      range_key([t2.__pk_increment]), range(MIN ; MAX)always true
  8 - output([t1.c1]), filter(nil), rowset=16
      access([t1.c1]), partitions(p0)
      is_index_back=false, is_global_index=false, 
      range_key([t1.__pk_increment]), range(MIN ; MAX)always true
  9 - output([t1.c0], [t1.c1]), filter(nil), rowset=16
      access([t1.c0], [t1.c1]), partitions(p0)
      is_index_back=false, is_global_index=false, 
      range_key([t1.__pk_increment]), range(MIN ; MAX)always true
SELECT /*+parallel(5) USE_HASH(v1,v2)*/ * FROM v1 JOIN v2 ON v1.c0=v2.c0 WHERE v1.c1 NOT IN (SELECT c1 FROM v2 WHERE c1 IS NOT NULL) ORDER BY v1.c0,v1.c1;
c0	c1	c0	c1
1	A	1	12
3	A	3	
5	$ % &	5	$%&
EXPLAIN BASIC SELECT /*+parallel(5) USE_HASH(v1,v2),READ_CONSISTENCY (weak)*/ * FROM v1 JOIN v2 ON v1.c0=v2.c0 WHERE v1.c1 NOT IN (SELECT c1 FROM v2 WHERE c1 IS NOT NULL) ORDER BY v1.c0,v1.c1;
Query Plan
==========================================================
|ID|OPERATOR                                    |NAME    |
----------------------------------------------------------
|0 |PX COORDINATOR MERGE SORT                   |        |
|1 |└─EXCHANGE OUT DISTR                        |:EX10002|
|2 |  └─SORT                                    |        |
|3 |    └─SHARED HASH JOIN                      |        |
|4 |      ├─EXCHANGE IN DISTR                   |        |
|5 |      │ └─EXCHANGE OUT DISTR (BC2HOST)      |:EX10001|
|6 |      │   └─SHARED HASH RIGHT ANTI JOIN SNA |        |
|7 |      │     ├─EXCHANGE IN DISTR             |        |
|8 |      │     │ └─EXCHANGE OUT DISTR (BC2HOST)|:EX10000|
|9 |      │     │   └─SUBPLAN SCAN              |VIEW1   |
|10|      │     │     └─PX BLOCK ITERATOR       |        |
|11|      │     │       └─TABLE FULL SCAN       |t2      |
|12|      │     └─PX BLOCK ITERATOR             |        |
|13|      │       └─TABLE FULL SCAN             |t1      |
|14|      └─PX BLOCK ITERATOR                   |        |
|15|        └─TABLE FULL SCAN                   |t2      |
==========================================================
Outputs & filters:
-------------------------------------
  0 - output([INTERNAL_FUNCTION(t1.c0, t1.c1, t2.c0, t2.c1)]), filter(nil), rowset=16
      sort_keys([t1.c0, ASC], [t1.c1, ASC])
  1 - output([t1.c0], [t1.c1], [INTERNAL_FUNCTION(t1.c0, t1.c1, t2.c0, t2.c1)]), filter(nil), rowset=16
      dop=5
  2 - output([t1.c0], [t1.c1], [t2.c0], [t2.c1]), filter(nil), rowset=16
      sort_keys([t1.c0, ASC], [t1.c1, ASC])
  3 - output([t1.c0], [t1.c1], [t2.c0], [t2.c1]), filter(nil), rowset=16
      equal_conds([t1.c0 = t2.c0]), other_conds(nil)
  4 - output([t1.c0], [t1.c1]), filter(nil), rowset=16
  5 - output([t1.c0], [t1.c1]), filter(nil), rowset=16
      dop=5
  6 - output([t1.c0], [t1.c1]), filter(nil), rowset=16
      equal_conds([t1.c1 = VIEW1.c1]), other_conds(nil)
  7 - output([VIEW1.c1]), filter(nil), rowset=16
  8 - output([VIEW1.c1]), filter(nil), rowset=16
      dop=5
  9 - output([VIEW1.c1]), filter(nil), rowset=16
      access([VIEW1.c1])
 10 - output([t2.c1]), filter(nil), rowset=16
 11 - output([t2.c1]), filter([t2.c1 IS NOT NULL]), rowset=16
      access([t2.c1]), partitions(p0)
      is_index_back=false, is_global_index=false, filter_before_indexback[false], 
      range_key([t2.__pk_increment]), range(MIN ; MAX)always true
 12 - output([t1.c0], [t1.c1]), filter(nil), rowset=16
 13 - output([t1.c0], [t1.c1]), filter(nil), rowset=16
      access([t1.c0], [t1.c1]), partitions(p0)
      is_index_back=false, is_global_index=false, 
      range_key([t1.__pk_increment]), range(MIN ; MAX)always true
 14 - output([t2.c0], [t2.c1]), filter(nil), rowset=16
 15 - output([t2.c0], [t2.c1]), filter(nil), rowset=16
      access([t2.c0], [t2.c1]), partitions(p0)
      is_index_back=false, is_global_index=false, 
      range_key([t2.__pk_increment]), range(MIN ; MAX)always true
SELECT /*+parallel(2) USE_HASH(v1,v2)*/ * FROM v1  WHERE c1 <>ALL (SELECT c1 FROM v2 WHERE NOT EXISTS(SELECT c1 FROM v1 WHERE c1 IS NOT NULL)) ORDER BY v1.c0,v1.c1;
c0	c1
1	A
2	12
3	A
4	NULL
5	$ % &
EXPLAIN BASIC SELECT /*+parallel(2) USE_HASH(v1,v2),READ_CONSISTENCY (weak)*/ * FROM v1  WHERE c1 <>ALL (SELECT c1 FROM v2 WHERE NOT EXISTS(SELECT c1 FROM v1 WHERE c1 IS NOT NULL)) ORDER BY v1.c0,v1.c1;
Query Plan
=========================================================
|ID|OPERATOR                                   |NAME    |
---------------------------------------------------------
|0 |PX COORDINATOR MERGE SORT                  |        |
|1 |└─EXCHANGE OUT DISTR                       |:EX10002|
|2 |  └─SORT                                   |        |
|3 |    └─SHARED HASH RIGHT ANTI JOIN NA       |        |
|4 |      ├─EXCHANGE IN DISTR                  |        |
|5 |      │ └─EXCHANGE OUT DISTR (BC2HOST)     |:EX10001|
|6 |      │   └─MATERIAL                       |        |
|7 |      │     └─SUBPLAN SCAN                 |VIEW1   |
|8 |      │       └─SUBPLAN FILTER             |        |
|9 |      │         ├─MATERIAL                 |        |
|10|      │         │ └─PX COORDINATOR         |        |
|11|      │         │   └─EXCHANGE OUT DISTR   |:EX20000|
|12|      │         │     └─PX BLOCK ITERATOR  |        |
|13|      │         │       └─TABLE FULL SCAN  |t2      |
|14|      │         └─LIMIT                    |        |
|15|      │           └─EXCHANGE IN DISTR      |        |
|16|      │             └─EXCHANGE OUT DISTR   |:EX10000|
|17|      │               └─LIMIT              |        |
|18|      │                 └─PX BLOCK ITERATOR|        |
|19|      │                   └─TABLE FULL SCAN|t1      |
|20|      └─PX BLOCK ITERATOR                  |        |
|21|        └─TABLE FULL SCAN                  |t1      |
=========================================================
Outputs & filters:
-------------------------------------
  0 - output([INTERNAL_FUNCTION(t1.c0, t1.c1)]), filter(nil), rowset=16
      sort_keys([t1.c0, ASC], [t1.c1, ASC])
  1 - output([t1.c0], [t1.c1], [INTERNAL_FUNCTION(t1.c0, t1.c1)]), filter(nil), rowset=16
      dop=2
  2 - output([t1.c0], [t1.c1]), filter(nil), rowset=16
      sort_keys([t1.c0, ASC], [t1.c1, ASC])
  3 - output([t1.c0], [t1.c1]), filter(nil), rowset=16
      equal_conds([t1.c1 = VIEW1.c1]), other_conds(nil)
  4 - output([VIEW1.c1]), filter(nil), rowset=16
  5 - output([VIEW1.c1]), filter(nil), rowset=16
      is_single, dop=1
  6 - output([VIEW1.c1]), filter(nil), rowset=16
  7 - output([VIEW1.c1]), filter(nil), rowset=16
      access([VIEW1.c1])
  8 - output([t2.c1]), filter(nil), rowset=16
      exec_params_(nil), onetime_exprs_([(T_OP_NOT_EXISTS, subquery(1))(:0)]), init_plan_idxs_(nil), use_batch=false
  9 - output([t2.c1]), filter(nil), startup_filter([:0]), rowset=16
 10 - output([t2.c1]), filter(nil), rowset=16
 11 - output([t2.c1]), filter(nil), rowset=16
      dop=2
 12 - output([t2.c1]), filter(nil), rowset=16
 13 - output([t2.c1]), filter(nil), rowset=16
      access([t2.c1]), partitions(p0)
      is_index_back=false, is_global_index=false, 
      range_key([t2.__pk_increment]), range(MIN ; MAX)always true
 14 - output([1]), filter(nil), rowset=16
      limit(1), offset(nil)
 15 - output(nil), filter(nil), rowset=16
 16 - output(nil), filter(nil), rowset=16
      dop=2
 17 - output(nil), filter(nil), rowset=16
      limit(1), offset(nil)
 18 - output(nil), filter(nil), rowset=16
 19 - output(nil), filter([t1.c1 IS NOT NULL]), rowset=16
      access([t1.c1]), partitions(p0)
      limit(1), offset(nil), is_index_back=false, is_global_index=false, filter_before_indexback[false], 
      range_key([t1.__pk_increment]), range(MIN ; MAX)always true
 20 - output([t1.c0], [t1.c1]), filter(nil), rowset=16
 21 - output([t1.c0], [t1.c1]), filter(nil), rowset=16
      access([t1.c0], [t1.c1]), partitions(p0)
      is_index_back=false, is_global_index=false, 
      range_key([t1.__pk_increment]), range(MIN ; MAX)always true
INSERT INTO v1 SELECT c0,c1 FROM v2 WHERE c1 NOT IN (SELECT c1 FROM v1);
SELECT * FROM v1 ORDER BY c0,c1;
c0	c1
1	A
2	12
3	A
4	NULL
5	$ % &
EXPLAIN BASIC INSERT INTO v1 SELECT /*+READ_CONSISTENCY (weak)*/ c0,c1 FROM v2 WHERE c1 NOT IN (SELECT c1 FROM v1);
INSERT INTO (SELECT c0,c1 FROM v1 WHERE c1 <>ALL (SELECT c1 FROM v2)) VALUES(1,'不');
ERROR 42000: You have an error in your SQL syntax; check the manual that corresponds to your OceanBase version for the right syntax to use near '(SELECT c0,c1 FROM v1 WHERE c1 <>ALL (SELECT c1 FROM v2)) VALUES(1,'不')' at line 1
INSERT INTO v2 SELECT c0,c1 FROM v2 WHERE NOT EXISTS (SELECT c1 FROM v1);
SELECT * FROM v2 ORDER BY c0,c1;
c0	c1
1	12
2	AB
3	
4	NULL
5	$%&
EXPLAIN BASIC INSERT INTO v2 SELECT /*+READ_CONSISTENCY (weak)*/ c0,c1 FROM v2 WHERE NOT EXISTS (SELECT c1 FROM v1);
INSERT INTO v2 SELECT /*+parallel(2) USE_MERGE(v1) */ * FROM v1 WHERE c1 IN (SELECT /*+READ_CONSISTENCY (weak)*/ c1 FROM v2 WHERE c1 NOT IN (SELECT c1 FROM v1));
SELECT * FROM v2 ORDER BY c0,c1;
c0	c1
1	12
2	AB
3	
4	NULL
5	$%&
EXPLAIN BASIC INSERT INTO v2 SELECT /*+parallel(2) USE_MERGE(v1) ,READ_CONSISTENCY (weak)*/ * FROM v1 WHERE c1 IN (SELECT /*+READ_CONSISTENCY (weak)*/ c1 FROM v2 WHERE c1 NOT IN (SELECT c1 FROM v1));
INSERT INTO v2 SELECT /*+READ_CONSISTENCY (weak)*/ c0,c1 FROM v2 WHERE c1 IN (SELECT c1 FROM v1 WHERE c1 NOT IN (SELECT c1 FROM v2 WHERE c1 IS NOT NULL));
SELECT * FROM v2 ORDER BY c0,c1;
c0	c1
1	12
2	AB
3	
4	NULL
5	$%&
EXPLAIN BASIC INSERT INTO v2 SELECT /*+READ_CONSISTENCY (weak)*/ c0,c1 FROM v2 WHERE c1 IN (SELECT c1 FROM v1 WHERE c1 NOT IN (SELECT c1 FROM v2 WHERE c1 IS NOT NULL));
DROP TABLE IF EXISTS t2;
DROP TABLE IF EXISTS t1;
CREATE TABLE t1(c0 INT,c1 INT);
CREATE TABLE t2(c0 INT,c1 INT);
INSERT INTO t2 VALUES(0,0),(1,1),(2,1),(2,2),(4,3),(6,NULL);
INSERT INTO t1 VALUES(0,0),(1,2),(2,4),(2,6),(4,8),(5,NULL);
CREATE OR REPLACE VIEW v1 AS SELECT * FROM t1;
CREATE OR REPLACE VIEW v2 AS SELECT * FROM t2;
SELECT * FROM v2 ORDER BY c0;
c0	c1
0	0
1	1
2	1
2	2
4	3
6	NULL
SELECT * FROM v1 ORDER BY c0;
c0	c1
0	0
1	2
2	4
2	6
4	8
5	NULL
UPDATE v1 SET c1=c1+1 WHERE v1.c1 NOT IN (SELECT c1 FROM v2);
SELECT * FROM v1 ORDER BY c0,c1;
c0	c1
0	0
1	2
2	4
2	6
4	8
5	NULL
EXPLAIN BASIC UPDATE v1 SET c1=c1+1 WHERE c1 NOT IN (SELECT c1 FROM v2);
UPDATE (SELECT v1.c1 FROM v1 WHERE v1.c1 <>ALL (SELECT c1 FROM v2)) SET c1=c1+1;
ERROR HY000: The target table ANONYMOUS_VIEW1 of the UPDATE is not updatable
UPDATE v1 SET c1=c1+1 WHERE NOT EXISTS (SELECT c1 FROM v2);
SELECT * FROM v1 ORDER BY c0,c1;
c0	c1
0	0
1	2
2	4
2	6
4	8
5	NULL
EXPLAIN BASIC UPDATE v1 SET c1=c1+1 WHERE NOT EXISTS (SELECT /*+READ_CONSISTENCY (weak)*/ c1 FROM v2);
UPDATE v1 SET c1=c1+1 WHERE v1.c1 NOT IN (SELECT /*+parallel(2) USE_NLJ(v2)*/ c1 FROM v2 WHERE c1 IN(SELECT c1 FROM v1));
SELECT * FROM v1 ORDER BY c0,c1;
c0	c1
0	0
1	2
2	5
2	7
4	9
5	NULL
EXPLAIN BASIC UPDATE t1 SET c1=c1+1 WHERE t1.c1 NOT IN (SELECT /*+parallel(2) USE_NLJ(t2),READ_CONSISTENCY (weak) */ c1 FROM t2 WHERE c1 IN(SELECT c1 FROM t1));
UPDATE v1 SET c1=c1+1 WHERE v1.c1 <>ALL (SELECT v2.c1 FROM v1 JOIN v2 ON v1.c0=v2.c0 AND v2.c1 NOT IN (SELECT c1 FROM v1));
SELECT * FROM t1 ORDER BY c0,c1;
c0	c1
0	1
1	3
2	6
2	8
4	10
5	NULL
EXPLAIN BASIC UPDATE v1 SET c1=c1+1 WHERE v1.c1 <>ALL (SELECT /*+READ_CONSISTENCY (weak)*/ v2.c1 FROM v1 JOIN v2 ON v1.c0=v2.c0 AND v2.c1 NOT IN (SELECT c1 FROM v1));
UPDATE v1 SET c1=c1+1 WHERE v1.c1 NOT IN (SELECT /*+parallel(5) USE_HASH(v2) */ c1 FROM v2 WHERE c1 <>ALL(SELECT c1 FROM v1 WHERE c1 IS NOT NULL));
SELECT * FROM v1 ORDER BY c0,c1;
c0	c1
0	2
1	4
2	7
2	9
4	11
5	NULL
EXPLAIN BASIC UPDATE v1 SET c1=c1+1 WHERE v1.c1 NOT IN (SELECT /*+parallel(5) USE_HASH(v2),READ_CONSISTENCY (weak) */ c1 FROM v2 WHERE c1 <>ALL(SELECT c1 FROM v1 WHERE c1 IS NOT NULL));
DROP TABLE IF EXISTS t2;
DROP TABLE IF EXISTS t1;
CREATE TABLE t1(c0 INT,c1 CHAR(50));
CREATE TABLE t2(c0 INT,c1 VARCHAR(50));
INSERT INTO t1 VALUES(1,'A');
INSERT INTO t1 VALUES(2,12);
INSERT INTO t1 VALUES(3,'A');
INSERT INTO t1 VALUES(4,NULL);
INSERT INTO t1 VALUES(5,'$ % &');
INSERT INTO t2 VALUES(1,12);
INSERT INTO t2 VALUES(2,'AB');
INSERT INTO t2 VALUES(3,'');
INSERT INTO t2 VALUES(4,NULL);
INSERT INTO t2 VALUES(5,'$%&');
CREATE OR REPLACE VIEW v1 AS SELECT * FROM t1 WHERE c1 IN('A',NULL);
CREATE OR REPLACE VIEW v2 AS SELECT * FROM t2 WHERE c1 IN('AB','');
SELECT * FROM v1 ORDER BY c0,c1;
c0	c1
1	A
3	A
SELECT * FROM v2 ORDER BY c0,c1;
c0	c1
2	AB
3	
SELECT /*+USE_NL(v1,v2)*/ * FROM v1,v2 WHERE v1.c1 NOT IN(SELECT c1 FROM v2) ORDER BY v1.c0,v1.c1;
c0	c1	c0	c1
1	A	2	AB
1	A	3	
3	A	2	AB
3	A	3	
EXPLAIN BASIC SELECT /*+USE_NL(v1,v2),READ_CONSISTENCY (weak)*/ * FROM v1,v2 WHERE v1.c1 NOT IN(SELECT c1 FROM v2) ORDER BY v1.c0,v1.c1;
Query Plan
=================================================
|ID|OPERATOR                              |NAME |
-------------------------------------------------
|0 |SORT                                  |     |
|1 |└─NESTED-LOOP JOIN CARTESIAN          |     |
|2 |  ├─TABLE FULL SCAN                   |t2   |
|3 |  └─MATERIAL                          |     |
|4 |    └─NESTED-LOOP ANTI JOIN CARTESIAN |     |
|5 |      ├─TABLE FULL SCAN               |t1   |
|6 |      └─MATERIAL                      |     |
|7 |        └─SUBPLAN SCAN                |VIEW1|
|8 |          └─TABLE FULL SCAN           |t2   |
=================================================
Outputs & filters:
-------------------------------------
  0 - output([t1.c0], [t1.c1], [t2.c0], [t2.c1]), filter(nil), rowset=16
      sort_keys([t1.c0, ASC])
  1 - output([t1.c0], [t1.c1], [t2.c0], [t2.c1]), filter(nil), rowset=16
      conds(nil), nl_params_(nil), use_batch=false
  2 - output([t2.c1], [t2.c0]), filter([t2.c1 IN ('AB', '')]), rowset=16
      access([t2.c1], [t2.c0]), partitions(p0)
      is_index_back=false, is_global_index=false, filter_before_indexback[false], 
      range_key([t2.__pk_increment]), range(MIN ; MAX)always true
  3 - output([t1.c0], [t1.c1]), filter(nil), rowset=16
  4 - output([t1.c0], [t1.c1]), filter(nil), rowset=16
      conds(nil), nl_params_(nil), use_batch=false
  5 - output([t1.c1], [t1.c0]), filter([t1.c1 = 'A']), rowset=16
      access([t1.c1], [t1.c0]), partitions(p0)
      is_index_back=false, is_global_index=false, filter_before_indexback[false], 
      range_key([t1.__pk_increment]), range(MIN ; MAX)always true
  6 - output(nil), filter(nil), rowset=16
  7 - output(nil), filter(nil), rowset=16
      access(nil)
  8 - output([1]), filter([t2.c1 = 'A'], [t2.c1 IN ('AB', '')]), rowset=16
      access([t2.c1]), partitions(p0)
      limit(1), offset(nil), is_index_back=false, is_global_index=false, filter_before_indexback[false,false], 
      range_key([t2.__pk_increment]), range(MIN ; MAX)always true
SELECT /*+parallel(2) USE_HASH(v1,v2)*/ * FROM v1 WHERE c1 <>ALL(SELECT c1 FROM v2);
c0	c1
1	A
3	A
EXPLAIN BASIC SELECT /*+parallel(2) USE_HASH(v1,v2),READ_CONSISTENCY (weak)*/ * FROM v1 WHERE c1 <>ALL(SELECT c1 FROM v2) ORDER BY v1.c0,v1.c1;
Query Plan
=========================================================
|ID|OPERATOR                                   |NAME    |
---------------------------------------------------------
|0 |PX COORDINATOR MERGE SORT                  |        |
|1 |└─EXCHANGE OUT DISTR                       |:EX10002|
|2 |  └─SORT                                   |        |
|3 |    └─NESTED-LOOP ANTI JOIN CARTESIAN      |        |
|4 |      ├─PX BLOCK ITERATOR                  |        |
|5 |      │ └─TABLE FULL SCAN                  |t1      |
|6 |      └─MATERIAL                           |        |
|7 |        └─EXCHANGE IN DISTR                |        |
|8 |          └─EXCHANGE OUT DISTR (BROADCAST) |:EX10001|
|9 |            └─MATERIAL                     |        |
|10|              └─SUBPLAN SCAN               |VIEW1   |
|11|                └─LIMIT                    |        |
|12|                  └─EXCHANGE IN DISTR      |        |
|13|                    └─EXCHANGE OUT DISTR   |:EX10000|
|14|                      └─LIMIT              |        |
|15|                        └─PX BLOCK ITERATOR|        |
|16|                          └─TABLE FULL SCAN|t2      |
=========================================================
Outputs & filters:
-------------------------------------
  0 - output([INTERNAL_FUNCTION(t1.c0, t1.c1)]), filter(nil), rowset=16
      sort_keys([t1.c0, ASC])
  1 - output([t1.c0], [INTERNAL_FUNCTION(t1.c0, t1.c1)]), filter(nil), rowset=16
      dop=2
  2 - output([t1.c0], [t1.c1]), filter(nil), rowset=16
      sort_keys([t1.c0, ASC])
  3 - output([t1.c0], [t1.c1]), filter(nil), rowset=16
      conds(nil), nl_params_(nil), use_batch=false
  4 - output([t1.c1], [t1.c0]), filter(nil), rowset=16
  5 - output([t1.c1], [t1.c0]), filter([t1.c1 = 'A']), rowset=16
      access([t1.c1], [t1.c0]), partitions(p0)
      is_index_back=false, is_global_index=false, filter_before_indexback[false], 
      range_key([t1.__pk_increment]), range(MIN ; MAX)always true
  6 - output(nil), filter(nil), rowset=16
  7 - output(nil), filter(nil), rowset=16
  8 - output(nil), filter(nil), rowset=16
      is_single, dop=1
  9 - output(nil), filter(nil), rowset=16
 10 - output(nil), filter(nil), rowset=16
      access(nil)
 11 - output([1]), filter(nil), rowset=16
      limit(1), offset(nil)
 12 - output(nil), filter(nil), rowset=16
 13 - output(nil), filter(nil), rowset=16
      dop=2
 14 - output(nil), filter(nil), rowset=16
      limit(1), offset(nil)
 15 - output(nil), filter(nil), rowset=16
 16 - output(nil), filter([t2.c1 = 'A'], [t2.c1 IN ('AB', '')]), rowset=16
      access([t2.c1]), partitions(p0)
      limit(1), offset(nil), is_index_back=false, is_global_index=false, filter_before_indexback[false,false], 
      range_key([t2.__pk_increment]), range(MIN ; MAX)always true
SELECT /*+USE_HASH(v1,v2)*/ * FROM v1 LEFT JOIN v2 ON v1.c0=v2.c0 WHERE v1.c1 <>ALL (SELECT c1 FROM v2) ORDER BY v1.c0,v1.c1;
c0	c1	c0	c1
1	A	NULL	NULL
3	A	3	
EXPLAIN BASIC SELECT /*+USE_HASH(v1,v2),READ_CONSISTENCY (weak)*/ * FROM v1 LEFT JOIN v2 ON v1.c0=v2.c0 WHERE v1.c1 <>ALL (SELECT c1 FROM v2) ORDER BY v1.c0,v1.c1;
Query Plan
=============================================
|ID|OPERATOR                          |NAME |
---------------------------------------------
|0 |SORT                              |     |
|1 |└─NESTED-LOOP ANTI JOIN CARTESIAN |     |
|2 |  ├─HASH OUTER JOIN               |     |
|3 |  │ ├─TABLE FULL SCAN             |t1   |
|4 |  │ └─TABLE FULL SCAN             |t2   |
|5 |  └─MATERIAL                      |     |
|6 |    └─SUBPLAN SCAN                |VIEW1|
|7 |      └─TABLE FULL SCAN           |t2   |
=============================================
Outputs & filters:
-------------------------------------
  0 - output([t1.c0], [t1.c1], [t2.c0], [t2.c1]), filter(nil), rowset=16
      sort_keys([t1.c0, ASC])
  1 - output([t1.c0], [t1.c1], [t2.c0], [t2.c1]), filter(nil), rowset=16
      conds(nil), nl_params_(nil), use_batch=false
  2 - output([t1.c0], [t1.c1], [t2.c0], [t2.c1]), filter(nil), rowset=16
      equal_conds([t1.c0 = t2.c0]), other_conds(nil)
  3 - output([t1.c1], [t1.c0]), filter([t1.c1 = 'A']), rowset=16
      access([t1.c1], [t1.c0]), partitions(p0)
      is_index_back=false, is_global_index=false, filter_before_indexback[false], 
      range_key([t1.__pk_increment]), range(MIN ; MAX)always true
  4 - output([t2.c1], [t2.c0]), filter([t2.c1 IN ('AB', '')]), rowset=16
      access([t2.c1], [t2.c0]), partitions(p0)
      is_index_back=false, is_global_index=false, filter_before_indexback[false], 
      range_key([t2.__pk_increment]), range(MIN ; MAX)always true
  5 - output(nil), filter(nil), rowset=16
  6 - output(nil), filter(nil), rowset=16
      access(nil)
  7 - output([1]), filter([t2.c1 = 'A'], [t2.c1 IN ('AB', '')]), rowset=16
      access([t2.c1]), partitions(p0)
      limit(1), offset(nil), is_index_back=false, is_global_index=false, filter_before_indexback[false,false], 
      range_key([t2.__pk_increment]), range(MIN ; MAX)always true
SELECT /*+parallel(2) USE_HASH(v1,v2)*/ * FROM v1 RIGHT JOIN v2 ON v1.c0=v2.c0 WHERE v1.c1 NOT IN (SELECT c1 FROM v2) ORDER BY v1.c0,v1.c1;
c0	c1	c0	c1
3	A	3	
EXPLAIN BASIC SELECT /*+parallel(2) USE_HASH(v1,v2),READ_CONSISTENCY (weak)*/ * FROM v1 RIGHT JOIN v2 ON v1.c0=v2.c0 WHERE v1.c1 NOT IN (SELECT c1 FROM v2) ORDER BY v1.c0,v1.c1;
Query Plan
======================================================
|ID|OPERATOR                                |NAME    |
------------------------------------------------------
|0 |PX COORDINATOR MERGE SORT               |        |
|1 |└─EXCHANGE OUT DISTR                    |:EX10002|
|2 |  └─SORT                                |        |
|3 |    └─SHARED HASH RIGHT ANTI JOIN SNA   |        |
|4 |      ├─EXCHANGE IN DISTR               |        |
|5 |      │ └─EXCHANGE OUT DISTR (BC2HOST)  |:EX10000|
|6 |      │   └─SUBPLAN SCAN                |VIEW1   |
|7 |      │     └─PX BLOCK ITERATOR         |        |
|8 |      │       └─TABLE FULL SCAN         |t2      |
|9 |      └─SHARED HASH RIGHT OUTER JOIN    |        |
|10|        ├─EXCHANGE IN DISTR             |        |
|11|        │ └─EXCHANGE OUT DISTR (BC2HOST)|:EX10001|
|12|        │   └─PX BLOCK ITERATOR         |        |
|13|        │     └─TABLE FULL SCAN         |t1      |
|14|        └─PX BLOCK ITERATOR             |        |
|15|          └─TABLE FULL SCAN             |t2      |
======================================================
Outputs & filters:
-------------------------------------
  0 - output([INTERNAL_FUNCTION(t1.c0, t1.c1, t2.c0, t2.c1)]), filter(nil), rowset=16
      sort_keys([t1.c0, ASC], [t1.c1, ASC])
  1 - output([t1.c0], [t1.c1], [INTERNAL_FUNCTION(t1.c0, t1.c1, t2.c0, t2.c1)]), filter(nil), rowset=16
      dop=2
  2 - output([t1.c0], [t1.c1], [t2.c0], [t2.c1]), filter(nil), rowset=16
      sort_keys([t1.c0, ASC], [t1.c1, ASC])
  3 - output([t1.c0], [t1.c1], [t2.c0], [t2.c1]), filter(nil), rowset=16
      equal_conds([t1.c1 = VIEW1.c1]), other_conds(nil)
  4 - output([VIEW1.c1]), filter(nil), rowset=16
  5 - output([VIEW1.c1]), filter(nil), rowset=16
      dop=2
  6 - output([VIEW1.c1]), filter(nil), rowset=16
      access([VIEW1.c1])
  7 - output([t2.c1]), filter(nil), rowset=16
  8 - output([t2.c1]), filter([t2.c1 IN ('AB', '')]), rowset=16
      access([t2.c1]), partitions(p0)
      is_index_back=false, is_global_index=false, filter_before_indexback[false], 
      range_key([t2.__pk_increment]), range(MIN ; MAX)always true
  9 - output([t1.c0], [t1.c1], [t2.c0], [t2.c1]), filter(nil), rowset=16
      equal_conds([t1.c0 = t2.c0]), other_conds(nil)
 10 - output([t1.c0], [t1.c1]), filter(nil), rowset=16
 11 - output([t1.c0], [t1.c1]), filter(nil), rowset=16
      dop=2
 12 - output([t1.c1], [t1.c0]), filter(nil), rowset=16
 13 - output([t1.c1], [t1.c0]), filter([t1.c1 = 'A']), rowset=16
      access([t1.c1], [t1.c0]), partitions(p0)
      is_index_back=false, is_global_index=false, filter_before_indexback[false], 
      range_key([t1.__pk_increment]), range(MIN ; MAX)always true
 14 - output([t2.c1], [t2.c0]), filter(nil), rowset=16
 15 - output([t2.c1], [t2.c0]), filter([t2.c1 IN ('AB', '')]), rowset=16
      access([t2.c1], [t2.c0]), partitions(p0)
      is_index_back=false, is_global_index=false, filter_before_indexback[false], 
      range_key([t2.__pk_increment]), range(MIN ; MAX)always true
SELECT /*+parallel(5) USE_HASH(v1,v2)*/ * FROM v1  WHERE c1 <>ALL (SELECT c1 FROM v2 WHERE c1 NOT IN (SELECT c1 FROM v1)) ORDER BY v1.c0,v1.c1;
c0	c1
1	A
3	A
EXPLAIN BASIC SELECT /*+parallel(5) USE_HASH(v1,v2),READ_CONSISTENCY (weak)*/ * FROM v1  WHERE c1 <>ALL (SELECT c1 FROM v2 WHERE c1 NOT IN (SELECT c1 FROM v1)) ORDER BY v1.c0,v1.c1;
Query Plan
=============================================================================
|ID|OPERATOR                                                       |NAME    |
-----------------------------------------------------------------------------
|0 |PX COORDINATOR MERGE SORT                                      |        |
|1 |└─EXCHANGE OUT DISTR                                           |:EX10004|
|2 |  └─SORT                                                       |        |
|3 |    └─NESTED-LOOP ANTI JOIN CARTESIAN                          |        |
|4 |      ├─PX BLOCK ITERATOR                                      |        |
|5 |      │ └─TABLE FULL SCAN                                      |t1      |
|6 |      └─MATERIAL                                               |        |
|7 |        └─EXCHANGE IN DISTR                                    |        |
|8 |          └─EXCHANGE OUT DISTR (BROADCAST)                     |:EX10003|
|9 |            └─MATERIAL                                         |        |
|10|              └─SUBPLAN SCAN                                   |VIEW2   |
|11|                └─LIMIT                                        |        |
|12|                  └─EXCHANGE IN DISTR                          |        |
|13|                    └─EXCHANGE OUT DISTR                       |:EX10002|
|14|                      └─LIMIT                                  |        |
|15|                        └─NESTED-LOOP ANTI JOIN CARTESIAN      |        |
|16|                          ├─PX BLOCK ITERATOR                  |        |
|17|                          │ └─TABLE FULL SCAN                  |t2      |
|18|                          └─MATERIAL                           |        |
|19|                            └─EXCHANGE IN DISTR                |        |
|20|                              └─EXCHANGE OUT DISTR (BROADCAST) |:EX10001|
|21|                                └─MATERIAL                     |        |
|22|                                  └─SUBPLAN SCAN               |VIEW1   |
|23|                                    └─LIMIT                    |        |
|24|                                      └─EXCHANGE IN DISTR      |        |
|25|                                        └─EXCHANGE OUT DISTR   |:EX10000|
|26|                                          └─LIMIT              |        |
|27|                                            └─PX BLOCK ITERATOR|        |
|28|                                              └─TABLE FULL SCAN|t1      |
=============================================================================
Outputs & filters:
-------------------------------------
  0 - output([INTERNAL_FUNCTION(t1.c0, t1.c1)]), filter(nil), rowset=16
      sort_keys([t1.c0, ASC])
  1 - output([t1.c0], [INTERNAL_FUNCTION(t1.c0, t1.c1)]), filter(nil), rowset=16
      dop=5
  2 - output([t1.c0], [t1.c1]), filter(nil), rowset=16
      sort_keys([t1.c0, ASC])
  3 - output([t1.c0], [t1.c1]), filter(nil), rowset=16
      conds(nil), nl_params_(nil), use_batch=false
  4 - output([t1.c1], [t1.c0]), filter(nil), rowset=16
  5 - output([t1.c1], [t1.c0]), filter([t1.c1 = 'A']), rowset=16
      access([t1.c1], [t1.c0]), partitions(p0)
      is_index_back=false, is_global_index=false, filter_before_indexback[false], 
      range_key([t1.__pk_increment]), range(MIN ; MAX)always true
  6 - output(nil), filter(nil), rowset=16
  7 - output(nil), filter(nil), rowset=16
  8 - output(nil), filter(nil), rowset=16
      is_single, dop=1
  9 - output(nil), filter(nil), rowset=16
 10 - output(nil), filter(nil), rowset=16
      access(nil)
 11 - output([1]), filter(nil), rowset=16
      limit(1), offset(nil)
 12 - output(nil), filter(nil), rowset=16
 13 - output(nil), filter(nil), rowset=16
      dop=5
 14 - output(nil), filter(nil), rowset=16
      limit(1), offset(nil)
 15 - output(nil), filter(nil), rowset=16
      conds(nil), nl_params_(nil), use_batch=false
 16 - output(nil), filter(nil), rowset=16
 17 - output(nil), filter([t2.c1 = 'A'], [t2.c1 IN ('AB', '')]), rowset=16
      access([t2.c1]), partitions(p0)
      is_index_back=false, is_global_index=false, filter_before_indexback[false,false], 
      range_key([t2.__pk_increment]), range(MIN ; MAX)always true
 18 - output(nil), filter(nil), rowset=16
 19 - output(nil), filter(nil), rowset=16
 20 - output(nil), filter(nil), rowset=16
      is_single, dop=1
 21 - output(nil), filter(nil), rowset=16
 22 - output(nil), filter(nil), rowset=16
      access(nil)
 23 - output([1]), filter(nil), rowset=16
      limit(1), offset(nil)
 24 - output(nil), filter(nil), rowset=16
 25 - output(nil), filter(nil), rowset=16
      dop=5
 26 - output(nil), filter(nil), rowset=16
      limit(1), offset(nil)
 27 - output(nil), filter(nil), rowset=16
 28 - output(nil), filter([t1.c1 = 'A']), rowset=16
      access([t1.c1]), partitions(p0)
      limit(1), offset(nil), is_index_back=false, is_global_index=false, filter_before_indexback[false], 
      range_key([t1.__pk_increment]), range(MIN ; MAX)always true
SELECT /*+USE_NL(v1,v2)*/ * FROM v1,v2 WHERE v1.c1 NOT IN(SELECT c1 FROM v2 WHERE c1 IS NOT NULL) ORDER BY 1,2,3,4;
c0	c1	c0	c1
1	A	2	AB
1	A	3	
3	A	2	AB
3	A	3	
EXPLAIN BASIC SELECT /*+USE_NL(v1,v2),READ_CONSISTENCY (weak)*/ * FROM v1,v2 WHERE v1.c1 NOT IN(SELECT c1 FROM v2 WHERE c1 IS NOT NULL) ORDER BY 1,2,3,4;
Query Plan
=================================================
|ID|OPERATOR                              |NAME |
-------------------------------------------------
|0 |SORT                                  |     |
|1 |└─NESTED-LOOP JOIN CARTESIAN          |     |
|2 |  ├─TABLE FULL SCAN                   |t2   |
|3 |  └─MATERIAL                          |     |
|4 |    └─NESTED-LOOP ANTI JOIN CARTESIAN |     |
|5 |      ├─TABLE FULL SCAN               |t1   |
|6 |      └─MATERIAL                      |     |
|7 |        └─SUBPLAN SCAN                |VIEW1|
|8 |          └─TABLE FULL SCAN           |t2   |
=================================================
Outputs & filters:
-------------------------------------
  0 - output([t1.c0], [t1.c1], [t2.c0], [t2.c1]), filter(nil), rowset=16
      sort_keys([t1.c0, ASC], [t2.c0, ASC], [t2.c1, ASC])
  1 - output([t1.c0], [t2.c0], [t2.c1], [t1.c1]), filter(nil), rowset=16
      conds(nil), nl_params_(nil), use_batch=false
  2 - output([t2.c1], [t2.c0]), filter([t2.c1 IN ('AB', '')]), rowset=16
      access([t2.c1], [t2.c0]), partitions(p0)
      is_index_back=false, is_global_index=false, filter_before_indexback[false], 
      range_key([t2.__pk_increment]), range(MIN ; MAX)always true
  3 - output([t1.c0], [t1.c1]), filter(nil), rowset=16
  4 - output([t1.c0], [t1.c1]), filter(nil), rowset=16
      conds(nil), nl_params_(nil), use_batch=false
  5 - output([t1.c1], [t1.c0]), filter([t1.c1 = 'A']), rowset=16
      access([t1.c1], [t1.c0]), partitions(p0)
      is_index_back=false, is_global_index=false, filter_before_indexback[false], 
      range_key([t1.__pk_increment]), range(MIN ; MAX)always true
  6 - output(nil), filter(nil), rowset=16
  7 - output(nil), filter(nil), rowset=16
      access(nil)
  8 - output([1]), filter([t2.c1 = 'A'], [t2.c1 IN ('AB', '')]), rowset=16
      access([t2.c1]), partitions(p0)
      limit(1), offset(nil), is_index_back=false, is_global_index=false, filter_before_indexback[false,false], 
      range_key([t2.__pk_increment]), range(MIN ; MAX)always true
SELECT /*+parallel(2) USE_HASH(v1,v2)*/ * FROM v1 WHERE c1 <>ALL(SELECT c1 FROM v2 WHERE c1 IS NOT NULL) ORDER BY 1,2;
c0	c1
1	A
3	A
EXPLAIN BASIC SELECT /*+parallel(2) USE_HASH(v1,v2),READ_CONSISTENCY (weak)*/ * FROM v1 WHERE c1 <>ALL(SELECT c1 FROM v2 WHERE c1 IS NOT NULL) ORDER BY 1,2;
Query Plan
=========================================================
|ID|OPERATOR                                   |NAME    |
---------------------------------------------------------
|0 |PX COORDINATOR MERGE SORT                  |        |
|1 |└─EXCHANGE OUT DISTR                       |:EX10002|
|2 |  └─SORT                                   |        |
|3 |    └─NESTED-LOOP ANTI JOIN CARTESIAN      |        |
|4 |      ├─PX BLOCK ITERATOR                  |        |
|5 |      │ └─TABLE FULL SCAN                  |t1      |
|6 |      └─MATERIAL                           |        |
|7 |        └─EXCHANGE IN DISTR                |        |
|8 |          └─EXCHANGE OUT DISTR (BROADCAST) |:EX10001|
|9 |            └─MATERIAL                     |        |
|10|              └─SUBPLAN SCAN               |VIEW1   |
|11|                └─LIMIT                    |        |
|12|                  └─EXCHANGE IN DISTR      |        |
|13|                    └─EXCHANGE OUT DISTR   |:EX10000|
|14|                      └─LIMIT              |        |
|15|                        └─PX BLOCK ITERATOR|        |
|16|                          └─TABLE FULL SCAN|t2      |
=========================================================
Outputs & filters:
-------------------------------------
  0 - output([INTERNAL_FUNCTION(t1.c0, t1.c1)]), filter(nil), rowset=16
      sort_keys([t1.c0, ASC])
  1 - output([t1.c0], [INTERNAL_FUNCTION(t1.c0, t1.c1)]), filter(nil), rowset=16
      dop=2
  2 - output([t1.c0], [t1.c1]), filter(nil), rowset=16
      sort_keys([t1.c0, ASC])
  3 - output([t1.c0], [t1.c1]), filter(nil), rowset=16
      conds(nil), nl_params_(nil), use_batch=false
  4 - output([t1.c1], [t1.c0]), filter(nil), rowset=16
  5 - output([t1.c1], [t1.c0]), filter([t1.c1 = 'A']), rowset=16
      access([t1.c1], [t1.c0]), partitions(p0)
      is_index_back=false, is_global_index=false, filter_before_indexback[false], 
      range_key([t1.__pk_increment]), range(MIN ; MAX)always true
  6 - output(nil), filter(nil), rowset=16
  7 - output(nil), filter(nil), rowset=16
  8 - output(nil), filter(nil), rowset=16
      is_single, dop=1
  9 - output(nil), filter(nil), rowset=16
 10 - output(nil), filter(nil), rowset=16
      access(nil)
 11 - output([1]), filter(nil), rowset=16
      limit(1), offset(nil)
 12 - output(nil), filter(nil), rowset=16
 13 - output(nil), filter(nil), rowset=16
      dop=2
 14 - output(nil), filter(nil), rowset=16
      limit(1), offset(nil)
 15 - output(nil), filter(nil), rowset=16
 16 - output(nil), filter([t2.c1 = 'A'], [t2.c1 IN ('AB', '')]), rowset=16
      access([t2.c1]), partitions(p0)
      limit(1), offset(nil), is_index_back=false, is_global_index=false, filter_before_indexback[false,false], 
      range_key([t2.__pk_increment]), range(MIN ; MAX)always true
SELECT /*+USE_HASH(v1,v2)*/ * FROM v1 LEFT JOIN v2 ON v1.c0=v2.c0 WHERE v1.c1 <>ALL (SELECT c1 FROM v2 WHERE c1 IS NOT NULL)  ORDER BY 1,2,3,4;
c0	c1	c0	c1
1	A	NULL	NULL
3	A	3	
EXPLAIN BASIC SELECT /*+USE_HASH(v1,v2),READ_CONSISTENCY (weak)*/ * FROM v1 LEFT JOIN v2 ON v1.c0=v2.c0 WHERE v1.c1 <>ALL (SELECT c1 FROM v2 WHERE c1 IS NOT NULL)  ORDER BY 1,2,3,4;
Query Plan
=============================================
|ID|OPERATOR                          |NAME |
---------------------------------------------
|0 |SORT                              |     |
|1 |└─NESTED-LOOP ANTI JOIN CARTESIAN |     |
|2 |  ├─HASH OUTER JOIN               |     |
|3 |  │ ├─TABLE FULL SCAN             |t1   |
|4 |  │ └─TABLE FULL SCAN             |t2   |
|5 |  └─MATERIAL                      |     |
|6 |    └─SUBPLAN SCAN                |VIEW1|
|7 |      └─TABLE FULL SCAN           |t2   |
=============================================
Outputs & filters:
-------------------------------------
  0 - output([t1.c0], [t1.c1], [t2.c0], [t2.c1]), filter(nil), rowset=16
      sort_keys([t1.c0, ASC], [t2.c0, ASC], [t2.c1, ASC])
  1 - output([t1.c0], [t2.c0], [t2.c1], [t1.c1]), filter(nil), rowset=16
      conds(nil), nl_params_(nil), use_batch=false
  2 - output([t1.c0], [t2.c0], [t2.c1], [t1.c1]), filter(nil), rowset=16
      equal_conds([t1.c0 = t2.c0]), other_conds(nil)
  3 - output([t1.c1], [t1.c0]), filter([t1.c1 = 'A']), rowset=16
      access([t1.c1], [t1.c0]), partitions(p0)
      is_index_back=false, is_global_index=false, filter_before_indexback[false], 
      range_key([t1.__pk_increment]), range(MIN ; MAX)always true
  4 - output([t2.c1], [t2.c0]), filter([t2.c1 IN ('AB', '')]), rowset=16
      access([t2.c1], [t2.c0]), partitions(p0)
      is_index_back=false, is_global_index=false, filter_before_indexback[false], 
      range_key([t2.__pk_increment]), range(MIN ; MAX)always true
  5 - output(nil), filter(nil), rowset=16
  6 - output(nil), filter(nil), rowset=16
      access(nil)
  7 - output([1]), filter([t2.c1 = 'A'], [t2.c1 IN ('AB', '')]), rowset=16
      access([t2.c1]), partitions(p0)
      limit(1), offset(nil), is_index_back=false, is_global_index=false, filter_before_indexback[false,false], 
      range_key([t2.__pk_increment]), range(MIN ; MAX)always true
SELECT /*+parallel(2) USE_HASH(v1,v2)*/ * FROM v1 RIGHT JOIN v2 ON v1.c0=v2.c0 WHERE v1.c1 NOT IN (SELECT c1 FROM v2 WHERE c1 IS NOT NULL)  ORDER BY 1,2,3,4;
c0	c1	c0	c1
3	A	3	
EXPLAIN BASIC SELECT /*+parallel(2) USE_HASH(v1,v2),READ_CONSISTENCY (weak)*/ * FROM v1 RIGHT JOIN v2 ON v1.c0=v2.c0 WHERE v1.c1 NOT IN (SELECT c1 FROM v2 WHERE c1 IS NOT NULL)  ORDER BY 1,2,3,4;
Query Plan
======================================================
|ID|OPERATOR                                |NAME    |
------------------------------------------------------
|0 |PX COORDINATOR MERGE SORT               |        |
|1 |└─EXCHANGE OUT DISTR                    |:EX10002|
|2 |  └─SORT                                |        |
|3 |    └─SHARED HASH RIGHT ANTI JOIN SNA   |        |
|4 |      ├─EXCHANGE IN DISTR               |        |
|5 |      │ └─EXCHANGE OUT DISTR (BC2HOST)  |:EX10000|
|6 |      │   └─SUBPLAN SCAN                |VIEW1   |
|7 |      │     └─PX BLOCK ITERATOR         |        |
|8 |      │       └─TABLE FULL SCAN         |t2      |
|9 |      └─SHARED HASH RIGHT OUTER JOIN    |        |
|10|        ├─EXCHANGE IN DISTR             |        |
|11|        │ └─EXCHANGE OUT DISTR (BC2HOST)|:EX10001|
|12|        │   └─PX BLOCK ITERATOR         |        |
|13|        │     └─TABLE FULL SCAN         |t1      |
|14|        └─PX BLOCK ITERATOR             |        |
|15|          └─TABLE FULL SCAN             |t2      |
======================================================
Outputs & filters:
-------------------------------------
  0 - output([INTERNAL_FUNCTION(t1.c0, t1.c1, t2.c0, t2.c1)]), filter(nil), rowset=16
      sort_keys([t1.c0, ASC], [t1.c1, ASC], [t2.c0, ASC], [t2.c1, ASC])
  1 - output([t1.c0], [t1.c1], [t2.c0], [t2.c1], [INTERNAL_FUNCTION(t1.c0, t1.c1, t2.c0, t2.c1)]), filter(nil), rowset=16
      dop=2
  2 - output([t1.c0], [t1.c1], [t2.c0], [t2.c1]), filter(nil), rowset=16
      sort_keys([t1.c0, ASC], [t1.c1, ASC], [t2.c0, ASC], [t2.c1, ASC])
  3 - output([t1.c0], [t1.c1], [t2.c0], [t2.c1]), filter(nil), rowset=16
      equal_conds([t1.c1 = VIEW1.c1]), other_conds(nil)
  4 - output([VIEW1.c1]), filter(nil), rowset=16
  5 - output([VIEW1.c1]), filter(nil), rowset=16
      dop=2
  6 - output([VIEW1.c1]), filter(nil), rowset=16
      access([VIEW1.c1])
  7 - output([t2.c1]), filter(nil), rowset=16
  8 - output([t2.c1]), filter([t2.c1 IN ('AB', '')]), rowset=16
      access([t2.c1]), partitions(p0)
      is_index_back=false, is_global_index=false, filter_before_indexback[false], 
      range_key([t2.__pk_increment]), range(MIN ; MAX)always true
  9 - output([t1.c0], [t1.c1], [t2.c0], [t2.c1]), filter(nil), rowset=16
      equal_conds([t1.c0 = t2.c0]), other_conds(nil)
 10 - output([t1.c0], [t1.c1]), filter(nil), rowset=16
 11 - output([t1.c0], [t1.c1]), filter(nil), rowset=16
      dop=2
 12 - output([t1.c1], [t1.c0]), filter(nil), rowset=16
 13 - output([t1.c1], [t1.c0]), filter([t1.c1 = 'A']), rowset=16
      access([t1.c1], [t1.c0]), partitions(p0)
      is_index_back=false, is_global_index=false, filter_before_indexback[false], 
      range_key([t1.__pk_increment]), range(MIN ; MAX)always true
 14 - output([t2.c1], [t2.c0]), filter(nil), rowset=16
 15 - output([t2.c1], [t2.c0]), filter([t2.c1 IN ('AB', '')]), rowset=16
      access([t2.c1], [t2.c0]), partitions(p0)
      is_index_back=false, is_global_index=false, filter_before_indexback[false], 
      range_key([t2.__pk_increment]), range(MIN ; MAX)always true
SELECT /*+parallel(5) USE_HASH(v1,v2)*/ * FROM v1  WHERE c1 <>ALL (SELECT c1 FROM v2 WHERE c1 NOT IN (SELECT c1 FROM v1 WHERE c1 IS NOT NULL) AND c1 IS NOT NULL) ORDER BY v1.c0,v1.c1;
c0	c1
1	A
3	A
EXPLAIN BASIC SELECT /*+parallel(5) USE_HASH(v1,v2),READ_CONSISTENCY (weak)*/ * FROM v1  WHERE c1 <>ALL (SELECT c1 FROM v2 WHERE c1 NOT IN (SELECT c1 FROM v1 WHERE c1 IS NOT NULL) AND c1 IS NOT NULL) ORDER BY v1.c0,v1.c1;
Query Plan
=============================================================================
|ID|OPERATOR                                                       |NAME    |
-----------------------------------------------------------------------------
|0 |PX COORDINATOR MERGE SORT                                      |        |
|1 |└─EXCHANGE OUT DISTR                                           |:EX10004|
|2 |  └─SORT                                                       |        |
|3 |    └─NESTED-LOOP ANTI JOIN CARTESIAN                          |        |
|4 |      ├─PX BLOCK ITERATOR                                      |        |
|5 |      │ └─TABLE FULL SCAN                                      |t1      |
|6 |      └─MATERIAL                                               |        |
|7 |        └─EXCHANGE IN DISTR                                    |        |
|8 |          └─EXCHANGE OUT DISTR (BROADCAST)                     |:EX10003|
|9 |            └─MATERIAL                                         |        |
|10|              └─SUBPLAN SCAN                                   |VIEW2   |
|11|                └─LIMIT                                        |        |
|12|                  └─EXCHANGE IN DISTR                          |        |
|13|                    └─EXCHANGE OUT DISTR                       |:EX10002|
|14|                      └─LIMIT                                  |        |
|15|                        └─NESTED-LOOP ANTI JOIN CARTESIAN      |        |
|16|                          ├─PX BLOCK ITERATOR                  |        |
|17|                          │ └─TABLE FULL SCAN                  |t2      |
|18|                          └─MATERIAL                           |        |
|19|                            └─EXCHANGE IN DISTR                |        |
|20|                              └─EXCHANGE OUT DISTR (BROADCAST) |:EX10001|
|21|                                └─MATERIAL                     |        |
|22|                                  └─SUBPLAN SCAN               |VIEW1   |
|23|                                    └─LIMIT                    |        |
|24|                                      └─EXCHANGE IN DISTR      |        |
|25|                                        └─EXCHANGE OUT DISTR   |:EX10000|
|26|                                          └─LIMIT              |        |
|27|                                            └─PX BLOCK ITERATOR|        |
|28|                                              └─TABLE FULL SCAN|t1      |
=============================================================================
Outputs & filters:
-------------------------------------
  0 - output([INTERNAL_FUNCTION(t1.c0, t1.c1)]), filter(nil), rowset=16
      sort_keys([t1.c0, ASC])
  1 - output([t1.c0], [INTERNAL_FUNCTION(t1.c0, t1.c1)]), filter(nil), rowset=16
      dop=5
  2 - output([t1.c0], [t1.c1]), filter(nil), rowset=16
      sort_keys([t1.c0, ASC])
  3 - output([t1.c0], [t1.c1]), filter(nil), rowset=16
      conds(nil), nl_params_(nil), use_batch=false
  4 - output([t1.c1], [t1.c0]), filter(nil), rowset=16
  5 - output([t1.c1], [t1.c0]), filter([t1.c1 = 'A']), rowset=16
      access([t1.c1], [t1.c0]), partitions(p0)
      is_index_back=false, is_global_index=false, filter_before_indexback[false], 
      range_key([t1.__pk_increment]), range(MIN ; MAX)always true
  6 - output(nil), filter(nil), rowset=16
  7 - output(nil), filter(nil), rowset=16
  8 - output(nil), filter(nil), rowset=16
      is_single, dop=1
  9 - output(nil), filter(nil), rowset=16
 10 - output(nil), filter(nil), rowset=16
      access(nil)
 11 - output([1]), filter(nil), rowset=16
      limit(1), offset(nil)
 12 - output(nil), filter(nil), rowset=16
 13 - output(nil), filter(nil), rowset=16
      dop=5
 14 - output(nil), filter(nil), rowset=16
      limit(1), offset(nil)
 15 - output(nil), filter(nil), rowset=16
      conds(nil), nl_params_(nil), use_batch=false
 16 - output(nil), filter(nil), rowset=16
 17 - output(nil), filter([t2.c1 = 'A'], [t2.c1 IN ('AB', '')]), rowset=16
      access([t2.c1]), partitions(p0)
      is_index_back=false, is_global_index=false, filter_before_indexback[false,false], 
      range_key([t2.__pk_increment]), range(MIN ; MAX)always true
 18 - output(nil), filter(nil), rowset=16
 19 - output(nil), filter(nil), rowset=16
 20 - output(nil), filter(nil), rowset=16
      is_single, dop=1
 21 - output(nil), filter(nil), rowset=16
 22 - output(nil), filter(nil), rowset=16
      access(nil)
 23 - output([1]), filter(nil), rowset=16
      limit(1), offset(nil)
 24 - output(nil), filter(nil), rowset=16
 25 - output(nil), filter(nil), rowset=16
      dop=5
 26 - output(nil), filter(nil), rowset=16
      limit(1), offset(nil)
 27 - output(nil), filter(nil), rowset=16
 28 - output(nil), filter([t1.c1 = 'A']), rowset=16
      access([t1.c1]), partitions(p0)
      limit(1), offset(nil), is_index_back=false, is_global_index=false, filter_before_indexback[false], 
      range_key([t1.__pk_increment]), range(MIN ; MAX)always true
INSERT INTO v1 SELECT c0,c1 FROM v2 WHERE c1 NOT IN (SELECT c1 FROM v1);
SELECT * FROM v1 ORDER BY c0,c1;
c0	c1
1	A
3	A
EXPLAIN BASIC INSERT INTO v1 SELECT /*+READ_CONSISTENCY (weak)*/ c0,c1 FROM v2 WHERE c1 NOT IN (SELECT c1 FROM v1);
INSERT INTO (SELECT c0,c1 FROM v1 WHERE c1 <>ALL (SELECT c1 FROM v2)) VALUES(1,'不');
ERROR 42000: You have an error in your SQL syntax; check the manual that corresponds to your OceanBase version for the right syntax to use near '(SELECT c0,c1 FROM v1 WHERE c1 <>ALL (SELECT c1 FROM v2)) VALUES(1,'不')' at line 1
INSERT INTO v2 SELECT c0,c1 FROM v2 WHERE NOT EXISTS (SELECT c1 FROM v1);
SELECT * FROM v2 ORDER BY c0,c1;
c0	c1
2	AB
3	
EXPLAIN BASIC INSERT INTO v2 SELECT /*+READ_CONSISTENCY (weak)*/ c0,c1 FROM v2 WHERE NOT EXISTS (SELECT c1 FROM v1);
INSERT INTO v2 SELECT /*+parallel(2) USE_MERGE(v1) */ * FROM v1 WHERE c1 IN (SELECT /*+READ_CONSISTENCY (weak)*/ c1 FROM v2 WHERE c1 NOT IN (SELECT c1 FROM v1));
SELECT * FROM v2 ORDER BY c0,c1;
c0	c1
2	AB
3	
EXPLAIN BASIC INSERT INTO v2 SELECT /*+parallel(2) USE_MERGE(v1) ,READ_CONSISTENCY (weak)*/ * FROM v1 WHERE c1 IN (SELECT /*+READ_CONSISTENCY (weak)*/ c1 FROM v2 WHERE c1 NOT IN (SELECT c1 FROM v1));
INSERT INTO v2 SELECT c0,c1 FROM v2 WHERE c1 IN (SELECT c1 FROM v1 WHERE c1 NOT IN (SELECT c1 FROM v2 WHERE c1 IS NOT NULL));
SELECT * FROM v2 ORDER BY c0,c1;
c0	c1
2	AB
3	
EXPLAIN BASIC INSERT INTO v2 SELECT /*+READ_CONSISTENCY (weak)*/ c0,c1 FROM v2 WHERE c1 IN (SELECT c1 FROM v1 WHERE c1 NOT IN (SELECT c1 FROM v2 WHERE c1 IS NOT NULL));
DROP TABLE IF EXISTS t2;
DROP TABLE IF EXISTS t1;
CREATE TABLE t1(c0 INT,c1 INT);
CREATE TABLE t2(c0 INT,c1 DOUBLE(10,0));
INSERT INTO t1 VALUES(0,0),(1,1),(2,1),(2,2),(4,3),(6,NULL);
INSERT INTO t2 VALUES(0,0),(1,2),(2,4),(2,6),(4,8),(5,NULL);
CREATE OR REPLACE VIEW v1 AS SELECT * FROM t1 WHERE c1 IN(1,2,3,'');
CREATE OR REPLACE VIEW v2 AS SELECT * FROM t2 WHERE c1 IN(2,4,6,NULL);
SELECT * FROM v1 ORDER BY c0,c1;
c0	c1
0	0
1	1
2	1
2	2
4	3
SELECT * FROM v2 ORDER BY c0,c1;
c0	c1
1	2
2	4
2	6
#此处执行OB报错，MySQL成功，和山庭确认为已知问题，待修复后重新执行sql
UPDATE (SELECT v1.c1 FROM v1 WHERE v1.c1 <>ALL (SELECT c1 FROM v2)) SET c1=c1+1;
ERROR HY000: The target table ANONYMOUS_VIEW1 of the UPDATE is not updatable
UPDATE v1 SET c1=c1+1 WHERE NOT EXISTS (SELECT c1 FROM v2);
SELECT * FROM v1 ORDER BY c0,c1;
c0	c1
0	0
1	1
2	1
2	2
4	3
EXPLAIN BASIC UPDATE v1 SET c1=c1+1 WHERE NOT EXISTS (SELECT c1 FROM v2);
#此处执行OB报错，MySQL成功，和山庭确认为已知问题，待修复后重新执行sql
#此处执行OB报错，MySQL成功，和山庭确认为已知问题，待修复后重新执行sql
#此处执行OB报错，MySQL成功，和山庭确认为已知问题，待修复后重新执行sql
DROP TABLE IF EXISTS t2;
DROP TABLE IF EXISTS t1;
CREATE TABLE t1(c0 INT,c1 CHAR(50));
CREATE TABLE t2(c0 INT,c1 VARCHAR(50));
INSERT INTO t1 VALUES(1,'A');
INSERT INTO t1 VALUES(2,12);
INSERT INTO t1 VALUES(3,'A');
INSERT INTO t1 VALUES(4,NULL);
INSERT INTO t1 VALUES(5,'$ % &');
INSERT INTO t2 VALUES(1,12);
INSERT INTO t2 VALUES(2,'AB');
INSERT INTO t2 VALUES(3,'');
INSERT INTO t2 VALUES(4,NULL);
INSERT INTO t2 VALUES(5,'$%&');
CREATE OR REPLACE VIEW v1 AS SELECT * FROM t1 WHERE c1 NOT IN('A');
CREATE OR REPLACE VIEW v2 AS SELECT * FROM t2;
SELECT * FROM v1 ORDER BY c0,c1;
c0	c1
2	12
5	$ % &
SELECT * FROM v2 ORDER BY c0,c1;
c0	c1
1	12
2	AB
3	
4	NULL
5	$%&
SELECT /*+USE_NL(v1,v2)*/ * FROM v1,v2 WHERE v1.c1 NOT IN(SELECT c1 FROM v2) ORDER BY v1.c0,v1.c1;
c0	c1	c0	c1
EXPLAIN BASIC SELECT /*+USE_NL(v1,v2),READ_CONSISTENCY (weak)*/ * FROM v1,v2 WHERE v1.c1 NOT IN(SELECT c1 FROM v2) ORDER BY v1.c0,v1.c1;
Query Plan
=======================================
|ID|OPERATOR                     |NAME|
---------------------------------------
|0 |SORT                         |    |
|1 |└─NESTED-LOOP JOIN CARTESIAN |    |
|2 |  ├─TABLE FULL SCAN          |t2  |
|3 |  └─MATERIAL                 |    |
|4 |    └─HASH ANTI JOIN NA      |    |
|5 |      ├─TABLE FULL SCAN      |t1  |
|6 |      └─TABLE FULL SCAN      |t2  |
=======================================
Outputs & filters:
-------------------------------------
  0 - output([t1.c0], [t1.c1], [t2.c0], [t2.c1]), filter(nil), rowset=16
      sort_keys([t1.c0, ASC], [t1.c1, ASC])
  1 - output([t1.c0], [t1.c1], [t2.c0], [t2.c1]), filter(nil), rowset=16
      conds(nil), nl_params_(nil), use_batch=false
  2 - output([t2.c0], [t2.c1]), filter(nil), rowset=16
      access([t2.c0], [t2.c1]), partitions(p0)
      is_index_back=false, is_global_index=false, 
      range_key([t2.__pk_increment]), range(MIN ; MAX)always true
  3 - output([t1.c0], [t1.c1]), filter(nil), rowset=16
  4 - output([t1.c0], [t1.c1]), filter(nil), rowset=16
      equal_conds([t1.c1 = t2.c1]), other_conds(nil)
  5 - output([t1.c1], [t1.c0]), filter([t1.c1 != 'A']), rowset=16
      access([t1.c1], [t1.c0]), partitions(p0)
      is_index_back=false, is_global_index=false, filter_before_indexback[false], 
      range_key([t1.__pk_increment]), range(MIN ; MAX)always true
  6 - output([t2.c1]), filter(nil), rowset=16
      access([t2.c1]), partitions(p0)
      is_index_back=false, is_global_index=false, 
      range_key([t2.__pk_increment]), range(MIN ; MAX)always true
SELECT /*+parallel(2) USE_HASH(v1,v2)*/ * FROM v1 WHERE c1 <>ALL(SELECT c1 FROM v2) ORDER BY v1.c0,v1.c1;
c0	c1
EXPLAIN BASIC SELECT /*+parallel(2) USE_HASH(v1,v2),READ_CONSISTENCY (weak)*/ * FROM v1 WHERE c1 <>ALL(SELECT c1 FROM v2) ORDER BY v1.c0,v1.c1;
Query Plan
====================================================
|ID|OPERATOR                              |NAME    |
----------------------------------------------------
|0 |PX COORDINATOR MERGE SORT             |        |
|1 |└─EXCHANGE OUT DISTR                  |:EX10001|
|2 |  └─SORT                              |        |
|3 |    └─SHARED HASH RIGHT ANTI JOIN NA  |        |
|4 |      ├─EXCHANGE IN DISTR             |        |
|5 |      │ └─EXCHANGE OUT DISTR (BC2HOST)|:EX10000|
|6 |      │   └─PX BLOCK ITERATOR         |        |
|7 |      │     └─TABLE FULL SCAN         |t2      |
|8 |      └─PX BLOCK ITERATOR             |        |
|9 |        └─TABLE FULL SCAN             |t1      |
====================================================
Outputs & filters:
-------------------------------------
  0 - output([INTERNAL_FUNCTION(t1.c0, t1.c1)]), filter(nil), rowset=16
      sort_keys([t1.c0, ASC], [t1.c1, ASC])
  1 - output([t1.c0], [t1.c1], [INTERNAL_FUNCTION(t1.c0, t1.c1)]), filter(nil), rowset=16
      dop=2
  2 - output([t1.c0], [t1.c1]), filter(nil), rowset=16
      sort_keys([t1.c0, ASC], [t1.c1, ASC])
  3 - output([t1.c0], [t1.c1]), filter(nil), rowset=16
      equal_conds([t1.c1 = t2.c1]), other_conds(nil)
  4 - output([t2.c1]), filter(nil), rowset=16
  5 - output([t2.c1]), filter(nil), rowset=16
      dop=2
  6 - output([t2.c1]), filter(nil), rowset=16
  7 - output([t2.c1]), filter(nil), rowset=16
      access([t2.c1]), partitions(p0)
      is_index_back=false, is_global_index=false, 
      range_key([t2.__pk_increment]), range(MIN ; MAX)always true
  8 - output([t1.c1], [t1.c0]), filter(nil), rowset=16
  9 - output([t1.c1], [t1.c0]), filter([t1.c1 != 'A']), rowset=16
      access([t1.c1], [t1.c0]), partitions(p0)
      is_index_back=false, is_global_index=false, filter_before_indexback[false], 
      range_key([t1.__pk_increment]), range(MIN ; MAX)always true
SELECT /*+USE_HASH(v1,v2)*/ * FROM v1 LEFT JOIN v2 ON v1.c0=v2.c0 WHERE v1.c1 <>ALL (SELECT c1 FROM v2) ORDER BY 1,2,3,4;
c0	c1	c0	c1
EXPLAIN BASIC SELECT /*+USE_HASH(v1,v2),READ_CONSISTENCY (weak)*/ * FROM v1 LEFT JOIN v2 ON v1.c0=v2.c0 WHERE v1.c1 <>ALL (SELECT c1 FROM v2) ORDER BY 1,2,3,4;
Query Plan
===============================
|ID|OPERATOR             |NAME|
-------------------------------
|0 |SORT                 |    |
|1 |└─HASH OUTER JOIN    |    |
|2 |  ├─HASH ANTI JOIN NA|    |
|3 |  │ ├─TABLE FULL SCAN|t1  |
|4 |  │ └─TABLE FULL SCAN|t2  |
|5 |  └─TABLE FULL SCAN  |t2  |
===============================
Outputs & filters:
-------------------------------------
  0 - output([t1.c0], [t1.c1], [t2.c0], [t2.c1]), filter(nil), rowset=16
      sort_keys([t1.c0, ASC], [t1.c1, ASC], [t2.c0, ASC], [t2.c1, ASC])
  1 - output([t1.c0], [t1.c1], [t2.c0], [t2.c1]), filter(nil), rowset=16
      equal_conds([t1.c0 = t2.c0]), other_conds(nil)
  2 - output([t1.c0], [t1.c1]), filter(nil), rowset=16
      equal_conds([t1.c1 = t2.c1]), other_conds(nil)
  3 - output([t1.c1], [t1.c0]), filter([t1.c1 != 'A']), rowset=16
      access([t1.c1], [t1.c0]), partitions(p0)
      is_index_back=false, is_global_index=false, filter_before_indexback[false], 
      range_key([t1.__pk_increment]), range(MIN ; MAX)always true
  4 - output([t2.c1]), filter(nil), rowset=16
      access([t2.c1]), partitions(p0)
      is_index_back=false, is_global_index=false, 
      range_key([t2.__pk_increment]), range(MIN ; MAX)always true
  5 - output([t2.c0], [t2.c1]), filter(nil), rowset=16
      access([t2.c0], [t2.c1]), partitions(p0)
      is_index_back=false, is_global_index=false, 
      range_key([t2.__pk_increment]), range(MIN ; MAX)always true
SELECT /*+parallel(2) USE_HASH(v1,v2)*/ * FROM v1 RIGHT JOIN v2 ON v1.c0=v2.c0 WHERE v1.c1 NOT IN (SELECT c1 FROM v2) ORDER BY 1,2,3,4;
c0	c1	c0	c1
EXPLAIN BASIC SELECT /*+parallel(2) USE_HASH(v1,v2),READ_CONSISTENCY (weak)*/ * FROM v1 RIGHT JOIN v2 ON v1.c0=v2.c0 WHERE v1.c1 NOT IN (SELECT c1 FROM v2) ORDER BY 1,2,3,4;
Query Plan
======================================================
|ID|OPERATOR                                |NAME    |
------------------------------------------------------
|0 |PX COORDINATOR MERGE SORT               |        |
|1 |└─EXCHANGE OUT DISTR                    |:EX10002|
|2 |  └─SORT                                |        |
|3 |    └─SHARED HASH RIGHT ANTI JOIN NA    |        |
|4 |      ├─EXCHANGE IN DISTR               |        |
|5 |      │ └─EXCHANGE OUT DISTR (BC2HOST)  |:EX10000|
|6 |      │   └─PX BLOCK ITERATOR           |        |
|7 |      │     └─TABLE FULL SCAN           |t2      |
|8 |      └─SHARED HASH RIGHT OUTER JOIN    |        |
|9 |        ├─EXCHANGE IN DISTR             |        |
|10|        │ └─EXCHANGE OUT DISTR (BC2HOST)|:EX10001|
|11|        │   └─PX BLOCK ITERATOR         |        |
|12|        │     └─TABLE FULL SCAN         |t1      |
|13|        └─PX BLOCK ITERATOR             |        |
|14|          └─TABLE FULL SCAN             |t2      |
======================================================
Outputs & filters:
-------------------------------------
  0 - output([INTERNAL_FUNCTION(t1.c0, t1.c1, t2.c0, t2.c1)]), filter(nil), rowset=16
      sort_keys([t1.c0, ASC], [t1.c1, ASC], [t2.c0, ASC], [t2.c1, ASC])
  1 - output([t1.c0], [t1.c1], [t2.c0], [t2.c1], [INTERNAL_FUNCTION(t1.c0, t1.c1, t2.c0, t2.c1)]), filter(nil), rowset=16
      dop=2
  2 - output([t1.c0], [t1.c1], [t2.c0], [t2.c1]), filter(nil), rowset=16
      sort_keys([t1.c0, ASC], [t1.c1, ASC], [t2.c0, ASC], [t2.c1, ASC])
  3 - output([t1.c0], [t1.c1], [t2.c0], [t2.c1]), filter(nil), rowset=16
      equal_conds([t1.c1 = t2.c1]), other_conds(nil)
  4 - output([t2.c1]), filter(nil), rowset=16
  5 - output([t2.c1]), filter(nil), rowset=16
      dop=2
  6 - output([t2.c1]), filter(nil), rowset=16
  7 - output([t2.c1]), filter(nil), rowset=16
      access([t2.c1]), partitions(p0)
      is_index_back=false, is_global_index=false, 
      range_key([t2.__pk_increment]), range(MIN ; MAX)always true
  8 - output([t1.c0], [t1.c1], [t2.c0], [t2.c1]), filter(nil), rowset=16
      equal_conds([t1.c0 = t2.c0]), other_conds(nil)
  9 - output([t1.c0], [t1.c1]), filter(nil), rowset=16
 10 - output([t1.c0], [t1.c1]), filter(nil), rowset=16
      dop=2
 11 - output([t1.c1], [t1.c0]), filter(nil), rowset=16
 12 - output([t1.c1], [t1.c0]), filter([t1.c1 != 'A']), rowset=16
      access([t1.c1], [t1.c0]), partitions(p0)
      is_index_back=false, is_global_index=false, filter_before_indexback[false], 
      range_key([t1.__pk_increment]), range(MIN ; MAX)always true
 13 - output([t2.c0], [t2.c1]), filter(nil), rowset=16
 14 - output([t2.c0], [t2.c1]), filter(nil), rowset=16
      access([t2.c0], [t2.c1]), partitions(p0)
      is_index_back=false, is_global_index=false, 
      range_key([t2.__pk_increment]), range(MIN ; MAX)always true
SELECT /*+parallel(5) USE_HASH(v1,v2)*/ * FROM v1  WHERE c1 <>ALL (SELECT c1 FROM v2 WHERE c1 NOT IN (SELECT c1 FROM v1)) ORDER BY v1.c0,v1.c1;
c0	c1
2	12
5	$ % &
EXPLAIN BASIC SELECT /*+parallel(5) USE_HASH(v1,v2),READ_CONSISTENCY (weak)*/ * FROM v1  WHERE c1 <>ALL (SELECT c1 FROM v2 WHERE c1 NOT IN (SELECT c1 FROM v1)) ORDER BY v1.c0,v1.c1;
Query Plan
============================================================
|ID|OPERATOR                                      |NAME    |
------------------------------------------------------------
|0 |PX COORDINATOR MERGE SORT                     |        |
|1 |└─EXCHANGE OUT DISTR                          |:EX10002|
|2 |  └─SORT                                      |        |
|3 |    └─SHARED HASH RIGHT ANTI JOIN NA          |        |
|4 |      ├─EXCHANGE IN DISTR                     |        |
|5 |      │ └─EXCHANGE OUT DISTR (BC2HOST)        |:EX10001|
|6 |      │   └─SUBPLAN SCAN                      |VIEW2   |
|7 |      │     └─SHARED HASH RIGHT ANTI JOIN SNA |        |
|8 |      │       ├─EXCHANGE IN DISTR             |        |
|9 |      │       │ └─EXCHANGE OUT DISTR (BC2HOST)|:EX10000|
|10|      │       │   └─SUBPLAN SCAN              |VIEW1   |
|11|      │       │     └─PX BLOCK ITERATOR       |        |
|12|      │       │       └─TABLE FULL SCAN       |t1      |
|13|      │       └─PX BLOCK ITERATOR             |        |
|14|      │         └─TABLE FULL SCAN             |t2      |
|15|      └─PX BLOCK ITERATOR                     |        |
|16|        └─TABLE FULL SCAN                     |t1      |
============================================================
Outputs & filters:
-------------------------------------
  0 - output([INTERNAL_FUNCTION(t1.c0, t1.c1)]), filter(nil), rowset=16
      sort_keys([t1.c0, ASC], [t1.c1, ASC])
  1 - output([t1.c0], [t1.c1], [INTERNAL_FUNCTION(t1.c0, t1.c1)]), filter(nil), rowset=16
      dop=5
  2 - output([t1.c0], [t1.c1]), filter(nil), rowset=16
      sort_keys([t1.c0, ASC], [t1.c1, ASC])
  3 - output([t1.c0], [t1.c1]), filter(nil), rowset=16
      equal_conds([t1.c1 = VIEW2.c1]), other_conds(nil)
  4 - output([VIEW2.c1]), filter(nil), rowset=16
  5 - output([VIEW2.c1]), filter(nil), rowset=16
      dop=5
  6 - output([VIEW2.c1]), filter(nil), rowset=16
      access([VIEW2.c1])
  7 - output([t2.c1]), filter(nil), rowset=16
      equal_conds([t2.c1 = VIEW1.c1]), other_conds(nil)
  8 - output([VIEW1.c1]), filter(nil), rowset=16
  9 - output([VIEW1.c1]), filter(nil), rowset=16
      dop=5
 10 - output([VIEW1.c1]), filter(nil), rowset=16
      access([VIEW1.c1])
 11 - output([t1.c1]), filter(nil), rowset=16
 12 - output([t1.c1]), filter([t1.c1 != 'A']), rowset=16
      access([t1.c1]), partitions(p0)
      is_index_back=false, is_global_index=false, filter_before_indexback[false], 
      range_key([t1.__pk_increment]), range(MIN ; MAX)always true
 13 - output([t2.c1]), filter(nil), rowset=16
 14 - output([t2.c1]), filter(nil), rowset=16
      access([t2.c1]), partitions(p0)
      is_index_back=false, is_global_index=false, 
      range_key([t2.__pk_increment]), range(MIN ; MAX)always true
 15 - output([t1.c1], [t1.c0]), filter(nil), rowset=16
 16 - output([t1.c1], [t1.c0]), filter([t1.c1 != 'A']), rowset=16
      access([t1.c1], [t1.c0]), partitions(p0)
      is_index_back=false, is_global_index=false, filter_before_indexback[false], 
      range_key([t1.__pk_increment]), range(MIN ; MAX)always true
SELECT /*+USE_NL(v1,v2)*/ * FROM v1,v2 WHERE v1.c1 NOT IN(SELECT c1 FROM v2 WHERE c1 IS NOT NULL) ORDER BY 1,2,3,4;
c0	c1	c0	c1
5	$ % &	1	12
5	$ % &	2	AB
5	$ % &	3	
5	$ % &	4	NULL
5	$ % &	5	$%&
EXPLAIN BASIC SELECT /*+USE_NL(v1,v2),READ_CONSISTENCY (weak)*/ * FROM v1,v2 WHERE v1.c1 NOT IN(SELECT c1 FROM v2 WHERE c1 IS NOT NULL) ORDER BY 1,2,3,4;
Query Plan
========================================
|ID|OPERATOR                     |NAME |
----------------------------------------
|0 |SORT                         |     |
|1 |└─NESTED-LOOP JOIN CARTESIAN |     |
|2 |  ├─TABLE FULL SCAN          |t2   |
|3 |  └─MATERIAL                 |     |
|4 |    └─HASH ANTI JOIN         |     |
|5 |      ├─TABLE FULL SCAN      |t1   |
|6 |      └─SUBPLAN SCAN         |VIEW1|
|7 |        └─TABLE FULL SCAN    |t2   |
========================================
Outputs & filters:
-------------------------------------
  0 - output([t1.c0], [t1.c1], [t2.c0], [t2.c1]), filter(nil), rowset=16
      sort_keys([t1.c0, ASC], [t1.c1, ASC], [t2.c0, ASC], [t2.c1, ASC])
  1 - output([t1.c0], [t1.c1], [t2.c0], [t2.c1]), filter(nil), rowset=16
      conds(nil), nl_params_(nil), use_batch=false
  2 - output([t2.c0], [t2.c1]), filter(nil), rowset=16
      access([t2.c0], [t2.c1]), partitions(p0)
      is_index_back=false, is_global_index=false, 
      range_key([t2.__pk_increment]), range(MIN ; MAX)always true
  3 - output([t1.c0], [t1.c1]), filter(nil), rowset=16
  4 - output([t1.c0], [t1.c1]), filter(nil), rowset=16
      equal_conds([t1.c1 = VIEW1.c1]), other_conds(nil)
  5 - output([t1.c1], [t1.c0]), filter([t1.c1 != 'A']), rowset=16
      access([t1.c1], [t1.c0]), partitions(p0)
      is_index_back=false, is_global_index=false, filter_before_indexback[false], 
      range_key([t1.__pk_increment]), range(MIN ; MAX)always true
  6 - output([VIEW1.c1]), filter(nil), rowset=16
      access([VIEW1.c1])
  7 - output([t2.c1]), filter([t2.c1 != 'A'], [t2.c1 IS NOT NULL]), rowset=16
      access([t2.c1]), partitions(p0)
      is_index_back=false, is_global_index=false, filter_before_indexback[false,false], 
      range_key([t2.__pk_increment]), range(MIN ; MAX)always true
SELECT /*+parallel(2) USE_HASH(v1,v2)*/ * FROM v1 WHERE c1 <>ALL(SELECT c1 FROM v2 WHERE c1 IS NOT NULL) ORDER BY v1.c0,v1.c1;
c0	c1
5	$ % &
EXPLAIN BASIC SELECT /*+parallel(2) USE_HASH(v1,v2),READ_CONSISTENCY (weak)*/ * FROM v1 WHERE c1 <>ALL(SELECT c1 FROM v2 WHERE c1 IS NOT NULL) ORDER BY v1.c0,v1.c1;
Query Plan
====================================================
|ID|OPERATOR                              |NAME    |
----------------------------------------------------
|0 |PX COORDINATOR MERGE SORT             |        |
|1 |└─EXCHANGE OUT DISTR                  |:EX10001|
|2 |  └─SORT                              |        |
|3 |    └─SHARED HASH RIGHT ANTI JOIN     |        |
|4 |      ├─EXCHANGE IN DISTR             |        |
|5 |      │ └─EXCHANGE OUT DISTR (BC2HOST)|:EX10000|
|6 |      │   └─SUBPLAN SCAN              |VIEW1   |
|7 |      │     └─PX BLOCK ITERATOR       |        |
|8 |      │       └─TABLE FULL SCAN       |t2      |
|9 |      └─PX BLOCK ITERATOR             |        |
|10|        └─TABLE FULL SCAN             |t1      |
====================================================
Outputs & filters:
-------------------------------------
  0 - output([INTERNAL_FUNCTION(t1.c0, t1.c1)]), filter(nil), rowset=16
      sort_keys([t1.c0, ASC], [t1.c1, ASC])
  1 - output([t1.c0], [t1.c1], [INTERNAL_FUNCTION(t1.c0, t1.c1)]), filter(nil), rowset=16
      dop=2
  2 - output([t1.c0], [t1.c1]), filter(nil), rowset=16
      sort_keys([t1.c0, ASC], [t1.c1, ASC])
  3 - output([t1.c0], [t1.c1]), filter(nil), rowset=16
      equal_conds([t1.c1 = VIEW1.c1]), other_conds(nil)
  4 - output([VIEW1.c1]), filter(nil), rowset=16
  5 - output([VIEW1.c1]), filter(nil), rowset=16
      dop=2
  6 - output([VIEW1.c1]), filter(nil), rowset=16
      access([VIEW1.c1])
  7 - output([t2.c1]), filter(nil), rowset=16
  8 - output([t2.c1]), filter([t2.c1 != 'A'], [t2.c1 IS NOT NULL]), rowset=16
      access([t2.c1]), partitions(p0)
      is_index_back=false, is_global_index=false, filter_before_indexback[false,false], 
      range_key([t2.__pk_increment]), range(MIN ; MAX)always true
  9 - output([t1.c1], [t1.c0]), filter(nil), rowset=16
 10 - output([t1.c1], [t1.c0]), filter([t1.c1 != 'A']), rowset=16
      access([t1.c1], [t1.c0]), partitions(p0)
      is_index_back=false, is_global_index=false, filter_before_indexback[false], 
      range_key([t1.__pk_increment]), range(MIN ; MAX)always true
SELECT /*+USE_HASH(v1,v2)*/ * FROM v1 LEFT JOIN v2 ON v1.c0=v2.c0 WHERE v1.c1 <>ALL (SELECT c1 FROM v2 WHERE c1 IS NOT NULL) ORDER BY 1,2,3,4;
c0	c1	c0	c1
5	$ % &	5	$%&
EXPLAIN BASIC SELECT /*+USE_HASH(v1,v2),READ_CONSISTENCY (weak)*/ * FROM v1 LEFT JOIN v2 ON v1.c0=v2.c0 WHERE v1.c1 <>ALL (SELECT c1 FROM v2 WHERE c1 IS NOT NULL) ORDER BY 1,2,3,4;
Query Plan
==================================
|ID|OPERATOR               |NAME |
----------------------------------
|0 |SORT                   |     |
|1 |└─HASH OUTER JOIN      |     |
|2 |  ├─HASH ANTI JOIN     |     |
|3 |  │ ├─TABLE FULL SCAN  |t1   |
|4 |  │ └─SUBPLAN SCAN     |VIEW1|
|5 |  │   └─TABLE FULL SCAN|t2   |
|6 |  └─TABLE FULL SCAN    |t2   |
==================================
Outputs & filters:
-------------------------------------
  0 - output([t1.c0], [t1.c1], [t2.c0], [t2.c1]), filter(nil), rowset=16
      sort_keys([t1.c0, ASC], [t1.c1, ASC], [t2.c0, ASC], [t2.c1, ASC])
  1 - output([t1.c0], [t1.c1], [t2.c0], [t2.c1]), filter(nil), rowset=16
      equal_conds([t1.c0 = t2.c0]), other_conds(nil)
  2 - output([t1.c0], [t1.c1]), filter(nil), rowset=16
      equal_conds([t1.c1 = VIEW1.c1]), other_conds(nil)
  3 - output([t1.c1], [t1.c0]), filter([t1.c1 != 'A']), rowset=16
      access([t1.c1], [t1.c0]), partitions(p0)
      is_index_back=false, is_global_index=false, filter_before_indexback[false], 
      range_key([t1.__pk_increment]), range(MIN ; MAX)always true
  4 - output([VIEW1.c1]), filter(nil), rowset=16
      access([VIEW1.c1])
  5 - output([t2.c1]), filter([t2.c1 != 'A'], [t2.c1 IS NOT NULL]), rowset=16
      access([t2.c1]), partitions(p0)
      is_index_back=false, is_global_index=false, filter_before_indexback[false,false], 
      range_key([t2.__pk_increment]), range(MIN ; MAX)always true
  6 - output([t2.c0], [t2.c1]), filter(nil), rowset=16
      access([t2.c0], [t2.c1]), partitions(p0)
      is_index_back=false, is_global_index=false, 
      range_key([t2.__pk_increment]), range(MIN ; MAX)always true
SELECT /*+parallel(2) USE_HASH(v1,v2)*/ * FROM v1 RIGHT JOIN v2 ON v1.c0=v2.c0 WHERE v1.c1 NOT IN (SELECT c1 FROM v2 WHERE c1 IS NOT NULL) ORDER BY 1,2,3,4;
c0	c1	c0	c1
5	$ % &	5	$%&
EXPLAIN BASIC SELECT /*+parallel(2) USE_HASH(v1,v2),READ_CONSISTENCY (weak)*/ * FROM v1 RIGHT JOIN v2 ON v1.c0=v2.c0 WHERE v1.c1 NOT IN (SELECT c1 FROM v2 WHERE c1 IS NOT NULL) ORDER BY 1,2,3,4;
Query Plan
======================================================
|ID|OPERATOR                                |NAME    |
------------------------------------------------------
|0 |PX COORDINATOR MERGE SORT               |        |
|1 |└─EXCHANGE OUT DISTR                    |:EX10002|
|2 |  └─SORT                                |        |
|3 |    └─SHARED HASH RIGHT ANTI JOIN SNA   |        |
|4 |      ├─EXCHANGE IN DISTR               |        |
|5 |      │ └─EXCHANGE OUT DISTR (BC2HOST)  |:EX10000|
|6 |      │   └─SUBPLAN SCAN                |VIEW1   |
|7 |      │     └─PX BLOCK ITERATOR         |        |
|8 |      │       └─TABLE FULL SCAN         |t2      |
|9 |      └─SHARED HASH RIGHT OUTER JOIN    |        |
|10|        ├─EXCHANGE IN DISTR             |        |
|11|        │ └─EXCHANGE OUT DISTR (BC2HOST)|:EX10001|
|12|        │   └─PX BLOCK ITERATOR         |        |
|13|        │     └─TABLE FULL SCAN         |t1      |
|14|        └─PX BLOCK ITERATOR             |        |
|15|          └─TABLE FULL SCAN             |t2      |
======================================================
Outputs & filters:
-------------------------------------
  0 - output([INTERNAL_FUNCTION(t1.c0, t1.c1, t2.c0, t2.c1)]), filter(nil), rowset=16
      sort_keys([t1.c0, ASC], [t1.c1, ASC], [t2.c0, ASC], [t2.c1, ASC])
  1 - output([t1.c0], [t1.c1], [t2.c0], [t2.c1], [INTERNAL_FUNCTION(t1.c0, t1.c1, t2.c0, t2.c1)]), filter(nil), rowset=16
      dop=2
  2 - output([t1.c0], [t1.c1], [t2.c0], [t2.c1]), filter(nil), rowset=16
      sort_keys([t1.c0, ASC], [t1.c1, ASC], [t2.c0, ASC], [t2.c1, ASC])
  3 - output([t1.c0], [t1.c1], [t2.c0], [t2.c1]), filter(nil), rowset=16
      equal_conds([t1.c1 = VIEW1.c1]), other_conds(nil)
  4 - output([VIEW1.c1]), filter(nil), rowset=16
  5 - output([VIEW1.c1]), filter(nil), rowset=16
      dop=2
  6 - output([VIEW1.c1]), filter(nil), rowset=16
      access([VIEW1.c1])
  7 - output([t2.c1]), filter(nil), rowset=16
  8 - output([t2.c1]), filter([t2.c1 IS NOT NULL]), rowset=16
      access([t2.c1]), partitions(p0)
      is_index_back=false, is_global_index=false, filter_before_indexback[false], 
      range_key([t2.__pk_increment]), range(MIN ; MAX)always true
  9 - output([t1.c0], [t1.c1], [t2.c0], [t2.c1]), filter(nil), rowset=16
      equal_conds([t1.c0 = t2.c0]), other_conds(nil)
 10 - output([t1.c0], [t1.c1]), filter(nil), rowset=16
 11 - output([t1.c0], [t1.c1]), filter(nil), rowset=16
      dop=2
 12 - output([t1.c1], [t1.c0]), filter(nil), rowset=16
 13 - output([t1.c1], [t1.c0]), filter([t1.c1 != 'A']), rowset=16
      access([t1.c1], [t1.c0]), partitions(p0)
      is_index_back=false, is_global_index=false, filter_before_indexback[false], 
      range_key([t1.__pk_increment]), range(MIN ; MAX)always true
 14 - output([t2.c0], [t2.c1]), filter(nil), rowset=16
 15 - output([t2.c0], [t2.c1]), filter(nil), rowset=16
      access([t2.c0], [t2.c1]), partitions(p0)
      is_index_back=false, is_global_index=false, 
      range_key([t2.__pk_increment]), range(MIN ; MAX)always true
SELECT /*+parallel(5) USE_HASH(v1,v2)*/ * FROM v1  WHERE c1 <>ALL (SELECT c1 FROM v2 WHERE c1 NOT IN (SELECT c1 FROM v1 WHERE c1 IS NOT NULL) AND c1 IS NOT NULL) ORDER BY v1.c0,v1.c1;
c0	c1
2	12
5	$ % &
EXPLAIN BASIC SELECT /*+parallel(5) USE_HASH(v1,v2),READ_CONSISTENCY (weak)*/ * FROM v1  WHERE c1 <>ALL (SELECT c1 FROM v2 WHERE c1 NOT IN (SELECT c1 FROM v1 WHERE c1 IS NOT NULL) AND c1 IS NOT NULL) ORDER BY v1.c0,v1.c1;
Query Plan
============================================================
|ID|OPERATOR                                      |NAME    |
------------------------------------------------------------
|0 |PX COORDINATOR MERGE SORT                     |        |
|1 |└─EXCHANGE OUT DISTR                          |:EX10002|
|2 |  └─SORT                                      |        |
|3 |    └─SHARED HASH RIGHT ANTI JOIN             |        |
|4 |      ├─EXCHANGE IN DISTR                     |        |
|5 |      │ └─EXCHANGE OUT DISTR (BC2HOST)        |:EX10001|
|6 |      │   └─SUBPLAN SCAN                      |VIEW2   |
|7 |      │     └─SHARED HASH RIGHT ANTI JOIN     |        |
|8 |      │       ├─EXCHANGE IN DISTR             |        |
|9 |      │       │ └─EXCHANGE OUT DISTR (BC2HOST)|:EX10000|
|10|      │       │   └─SUBPLAN SCAN              |VIEW1   |
|11|      │       │     └─PX BLOCK ITERATOR       |        |
|12|      │       │       └─TABLE FULL SCAN       |t1      |
|13|      │       └─PX BLOCK ITERATOR             |        |
|14|      │         └─TABLE FULL SCAN             |t2      |
|15|      └─PX BLOCK ITERATOR                     |        |
|16|        └─TABLE FULL SCAN                     |t1      |
============================================================
Outputs & filters:
-------------------------------------
  0 - output([INTERNAL_FUNCTION(t1.c0, t1.c1)]), filter(nil), rowset=16
      sort_keys([t1.c0, ASC], [t1.c1, ASC])
  1 - output([t1.c0], [t1.c1], [INTERNAL_FUNCTION(t1.c0, t1.c1)]), filter(nil), rowset=16
      dop=5
  2 - output([t1.c0], [t1.c1]), filter(nil), rowset=16
      sort_keys([t1.c0, ASC], [t1.c1, ASC])
  3 - output([t1.c0], [t1.c1]), filter(nil), rowset=16
      equal_conds([t1.c1 = VIEW2.c1]), other_conds(nil)
  4 - output([VIEW2.c1]), filter(nil), rowset=16
  5 - output([VIEW2.c1]), filter(nil), rowset=16
      dop=5
  6 - output([VIEW2.c1]), filter(nil), rowset=16
      access([VIEW2.c1])
  7 - output([t2.c1]), filter(nil), rowset=16
      equal_conds([t2.c1 = VIEW1.c1]), other_conds(nil)
  8 - output([VIEW1.c1]), filter(nil), rowset=16
  9 - output([VIEW1.c1]), filter(nil), rowset=16
      dop=5
 10 - output([VIEW1.c1]), filter(nil), rowset=16
      access([VIEW1.c1])
 11 - output([t1.c1]), filter(nil), rowset=16
 12 - output([t1.c1]), filter([t1.c1 != 'A']), rowset=16
      access([t1.c1]), partitions(p0)
      is_index_back=false, is_global_index=false, filter_before_indexback[false], 
      range_key([t1.__pk_increment]), range(MIN ; MAX)always true
 13 - output([t2.c1]), filter(nil), rowset=16
 14 - output([t2.c1]), filter([t2.c1 != 'A'], [t2.c1 IS NOT NULL]), rowset=16
      access([t2.c1]), partitions(p0)
      is_index_back=false, is_global_index=false, filter_before_indexback[false,false], 
      range_key([t2.__pk_increment]), range(MIN ; MAX)always true
 15 - output([t1.c1], [t1.c0]), filter(nil), rowset=16
 16 - output([t1.c1], [t1.c0]), filter([t1.c1 != 'A']), rowset=16
      access([t1.c1], [t1.c0]), partitions(p0)
      is_index_back=false, is_global_index=false, filter_before_indexback[false], 
      range_key([t1.__pk_increment]), range(MIN ; MAX)always true
INSERT INTO v1 SELECT c0,c1 FROM v2 WHERE c1 NOT IN (SELECT c1 FROM v1);
SELECT * FROM v1 ORDER BY c0,c1;
c0	c1
2	12
2	AB
3	
5	$ % &
5	$%&
EXPLAIN BASIC INSERT INTO v1 SELECT /*+READ_CONSISTENCY (weak)*/ c0,c1 FROM v2 WHERE c1 NOT IN (SELECT c1 FROM v1);
INSERT INTO v2 SELECT c0,c1 FROM v2 WHERE NOT EXISTS (SELECT c1 FROM v1);
SELECT * FROM v2 ORDER BY c0,c1;
c0	c1
1	12
2	AB
3	
4	NULL
5	$%&
EXPLAIN BASIC INSERT INTO v2 SELECT /*+READ_CONSISTENCY (weak)*/ c0,c1 FROM v2 WHERE NOT EXISTS (SELECT c1 FROM v1);
INSERT INTO v2 SELECT /*+parallel(2) USE_MERGE(v1) */ * FROM v1 WHERE c1 IN (SELECT /*+READ_CONSISTENCY (weak)*/ c1 FROM v2 WHERE c1 NOT IN (SELECT c1 FROM v1));
SELECT * FROM v2 ORDER BY c0,c1;
c0	c1
1	12
2	AB
3	
4	NULL
5	$%&
EXPLAIN BASIC INSERT INTO v2 SELECT /*+parallel(2) USE_MERGE(v1) ,READ_CONSISTENCY (weak)*/ * FROM v1 WHERE c1 IN (SELECT /*+READ_CONSISTENCY (weak)*/ c1 FROM v2 WHERE c1 NOT IN (SELECT c1 FROM v1));
INSERT INTO v2 SELECT c0,c1 FROM v2 WHERE c1 IN (SELECT c1 FROM v1 WHERE c1 NOT IN (SELECT c1 FROM v2 WHERE c1 IS NOT NULL));
SELECT * FROM v2 ORDER BY c0,c1;
c0	c1
1	12
2	AB
3	
4	NULL
5	$%&
EXPLAIN BASIC INSERT INTO v2 SELECT /*+READ_CONSISTENCY (weak)*/ c0,c1 FROM v2 WHERE c1 IN (SELECT c1 FROM v1 WHERE c1 NOT IN (SELECT c1 FROM v2 WHERE c1 IS NOT NULL));
DROP TABLE IF EXISTS t2;
DROP TABLE IF EXISTS t1;
CREATE TABLE t1(c0 INT,c1 INT);
CREATE TABLE t2(c0 INT,c1 FLOAT(10,0));
INSERT INTO t1 VALUES(0,0),(1,1),(2,1),(2,2),(4,3),(6,NULL);
INSERT INTO t2 VALUES(0,0),(1,2),(2,4),(2,6),(4,8),(5,NULL);
CREATE OR REPLACE VIEW v1 AS SELECT * FROM t1 WHERE c1 NOT IN(3);
CREATE OR REPLACE VIEW v2 AS SELECT * FROM t2;
SELECT * FROM v1 ORDER BY c0,c1;
c0	c1
0	0
1	1
2	1
2	2
SELECT * FROM v2 ORDER BY c0,c1;
c0	c1
0	0
1	2
2	4
2	6
4	8
5	NULL
UPDATE v1 SET c1=c1+1 WHERE v1.c1 NOT IN (SELECT c1 FROM v2);
SELECT * FROM v1 ORDER BY c0,c1;
c0	c1
0	0
1	1
2	1
2	2
EXPLAIN BASIC UPDATE v1 SET c1=c1+1 WHERE c1 NOT IN (SELECT c1 FROM v2);
UPDATE v1 SET c1=c1+1 WHERE NOT EXISTS (SELECT c1 FROM v2);
SELECT * FROM v1 ORDER BY c0,c1;
c0	c1
0	0
1	1
2	1
2	2
EXPLAIN BASIC UPDATE v1 SET c1=c1+1 WHERE NOT EXISTS (SELECT c1 FROM v2);
UPDATE v1 SET c1=c1+1 WHERE v1.c1 NOT IN (SELECT /*+parallel(2) USE_NLJ(v2) */ c1 FROM v2 WHERE c1 IN(SELECT c1 FROM v1));
SELECT * FROM v1 ORDER BY c0,c1;
c0	c1
0	0
1	2
2	2
2	2
EXPLAIN BASIC UPDATE t1 SET c1=c1+1 WHERE t1.c1 NOT IN (SELECT /*+parallel(2) USE_NLJ(t2),READ_CONSISTENCY (weak) */ c1 FROM t2 WHERE c1 IN(SELECT c1 FROM t1));
UPDATE v1 SET c1=c1+1 WHERE v1.c1 <>ALL (SELECT /*+READ_CONSISTENCY (weak)*/ v2.c1 FROM v1 JOIN v2 ON v1.c0=v2.c0 AND v2.c1 NOT IN (SELECT c1 FROM v1));
SELECT * FROM t1 ORDER BY c0,c1;
c0	c1
0	1
1	3
2	3
2	3
4	3
6	NULL
EXPLAIN BASIC UPDATE v1 SET c1=c1+1 WHERE v1.c1 <>ALL (SELECT /*+READ_CONSISTENCY (weak)*/ v2.c1 FROM v1 JOIN v2 ON v1.c0=v2.c0 AND v2.c1 NOT IN (SELECT c1 FROM v1));
UPDATE v1 SET c1=c1+1 WHERE v1.c1 NOT IN (SELECT /*+parallel(5) USE_HASH(v2) */ c1 FROM v2 WHERE c1 <>ALL(SELECT c1 FROM t2 WHERE c1 IS NOT NULL));
SELECT * FROM v1 ORDER BY c0,c1;
c0	c1
0	2
EXPLAIN BASIC UPDATE v1 SET c1=c1+1 WHERE v1.c1 NOT IN (SELECT /*+parallel(5) USE_HASH(v2),READ_CONSISTENCY (weak) */ c1 FROM v2 WHERE c1 <>ALL(SELECT c1 FROM t2 WHERE c1 IS NOT NULL));
DROP TABLE IF EXISTS t2;
DROP TABLE IF EXISTS t1;
CREATE TABLE t1(c0 INT,c1 CHAR(50));
CREATE TABLE t2(c0 INT,c1 VARCHAR(50));
INSERT INTO t1 VALUES(1,'A');
INSERT INTO t1 VALUES(2,12);
INSERT INTO t1 VALUES(3,'A');
INSERT INTO t1 VALUES(4,NULL);
INSERT INTO t1 VALUES(5,'$ % &');
INSERT INTO t2 VALUES(1,12);
INSERT INTO t2 VALUES(2,'AB');
INSERT INTO t2 VALUES(3,'');
INSERT INTO t2 VALUES(4,NULL);
INSERT INTO t2 VALUES(5,'$%&');
CREATE OR REPLACE VIEW v1 AS SELECT * FROM t1 ;
CREATE OR REPLACE VIEW v2 AS SELECT * FROM t2 WHERE c1 NOT IN('AB');
SELECT * FROM v1 ORDER BY c0,c1;
c0	c1
1	A
2	12
3	A
4	NULL
5	$ % &
SELECT * FROM v2 ORDER BY c0,c1;
c0	c1
1	12
3	
5	$%&
SELECT /*+USE_NL(v1,v2)*/ * FROM v1,v2 WHERE v1.c1 NOT IN(SELECT c1 FROM v2) ORDER BY v1.c0,v1.c1;
c0	c1	c0	c1
1	A	1	12
1	A	3	
1	A	5	$%&
3	A	1	12
3	A	3	
3	A	5	$%&
5	$ % &	1	12
5	$ % &	3	
5	$ % &	5	$%&
EXPLAIN BASIC SELECT /*+USE_NL(v1,v2),READ_CONSISTENCY (weak)*/ * FROM v1,v2 WHERE v1.c1 NOT IN(SELECT c1 FROM v2) ORDER BY v1.c0,v1.c1;
Query Plan
========================================
|ID|OPERATOR                     |NAME |
----------------------------------------
|0 |SORT                         |     |
|1 |└─NESTED-LOOP JOIN CARTESIAN |     |
|2 |  ├─TABLE FULL SCAN          |t2   |
|3 |  └─MATERIAL                 |     |
|4 |    └─HASH ANTI JOIN SNA     |     |
|5 |      ├─TABLE FULL SCAN      |t1   |
|6 |      └─SUBPLAN SCAN         |VIEW1|
|7 |        └─TABLE FULL SCAN    |t2   |
========================================
Outputs & filters:
-------------------------------------
  0 - output([t1.c0], [t1.c1], [t2.c0], [t2.c1]), filter(nil), rowset=16
      sort_keys([t1.c0, ASC], [t1.c1, ASC])
  1 - output([t1.c0], [t1.c1], [t2.c0], [t2.c1]), filter(nil), rowset=16
      conds(nil), nl_params_(nil), use_batch=false
  2 - output([t2.c1], [t2.c0]), filter([t2.c1 != 'AB']), rowset=16
      access([t2.c1], [t2.c0]), partitions(p0)
      is_index_back=false, is_global_index=false, filter_before_indexback[false], 
      range_key([t2.__pk_increment]), range(MIN ; MAX)always true
  3 - output([t1.c0], [t1.c1]), filter(nil), rowset=16
  4 - output([t1.c0], [t1.c1]), filter(nil), rowset=16
      equal_conds([t1.c1 = VIEW1.c1]), other_conds(nil)
  5 - output([t1.c0], [t1.c1]), filter(nil), rowset=16
      access([t1.c0], [t1.c1]), partitions(p0)
      is_index_back=false, is_global_index=false, 
      range_key([t1.__pk_increment]), range(MIN ; MAX)always true
  6 - output([VIEW1.c1]), filter(nil), rowset=16
      access([VIEW1.c1])
  7 - output([t2.c1]), filter([t2.c1 != 'AB']), rowset=16
      access([t2.c1]), partitions(p0)
      is_index_back=false, is_global_index=false, filter_before_indexback[false], 
      range_key([t2.__pk_increment]), range(MIN ; MAX)always true
SELECT /*+parallel(2) USE_HASH(v1,v2)*/ * FROM v1 WHERE c1 <>ALL(SELECT c1 FROM v2) ORDER BY v1.c0,v1.c1;
c0	c1
1	A
3	A
5	$ % &
EXPLAIN BASIC SELECT /*+parallel(2) USE_HASH(v1,v2),READ_CONSISTENCY (weak)*/ * FROM v1 WHERE c1 <>ALL(SELECT c1 FROM v2) ORDER BY v1.c0,v1.c1;
Query Plan
====================================================
|ID|OPERATOR                              |NAME    |
----------------------------------------------------
|0 |PX COORDINATOR MERGE SORT             |        |
|1 |└─EXCHANGE OUT DISTR                  |:EX10001|
|2 |  └─SORT                              |        |
|3 |    └─SHARED HASH RIGHT ANTI JOIN SNA |        |
|4 |      ├─EXCHANGE IN DISTR             |        |
|5 |      │ └─EXCHANGE OUT DISTR (BC2HOST)|:EX10000|
|6 |      │   └─SUBPLAN SCAN              |VIEW1   |
|7 |      │     └─PX BLOCK ITERATOR       |        |
|8 |      │       └─TABLE FULL SCAN       |t2      |
|9 |      └─PX BLOCK ITERATOR             |        |
|10|        └─TABLE FULL SCAN             |t1      |
====================================================
Outputs & filters:
-------------------------------------
  0 - output([INTERNAL_FUNCTION(t1.c0, t1.c1)]), filter(nil), rowset=16
      sort_keys([t1.c0, ASC], [t1.c1, ASC])
  1 - output([t1.c0], [t1.c1], [INTERNAL_FUNCTION(t1.c0, t1.c1)]), filter(nil), rowset=16
      dop=2
  2 - output([t1.c0], [t1.c1]), filter(nil), rowset=16
      sort_keys([t1.c0, ASC], [t1.c1, ASC])
  3 - output([t1.c0], [t1.c1]), filter(nil), rowset=16
      equal_conds([t1.c1 = VIEW1.c1]), other_conds(nil)
  4 - output([VIEW1.c1]), filter(nil), rowset=16
  5 - output([VIEW1.c1]), filter(nil), rowset=16
      dop=2
  6 - output([VIEW1.c1]), filter(nil), rowset=16
      access([VIEW1.c1])
  7 - output([t2.c1]), filter(nil), rowset=16
  8 - output([t2.c1]), filter([t2.c1 != 'AB']), rowset=16
      access([t2.c1]), partitions(p0)
      is_index_back=false, is_global_index=false, filter_before_indexback[false], 
      range_key([t2.__pk_increment]), range(MIN ; MAX)always true
  9 - output([t1.c0], [t1.c1]), filter(nil), rowset=16
 10 - output([t1.c0], [t1.c1]), filter(nil), rowset=16
      access([t1.c0], [t1.c1]), partitions(p0)
      is_index_back=false, is_global_index=false, 
      range_key([t1.__pk_increment]), range(MIN ; MAX)always true
SELECT /*+USE_HASH(v1,v2)*/ * FROM v1 LEFT JOIN v2 ON v1.c0=v2.c0 WHERE v1.c1 <>ALL (SELECT c1 FROM v2) ORDER BY 1,2,3,4;
c0	c1	c0	c1
1	A	1	12
3	A	3	
5	$ % &	5	$%&
EXPLAIN BASIC SELECT /*+USE_HASH(v1,v2),READ_CONSISTENCY (weak)*/ * FROM v1 LEFT JOIN v2 ON v1.c0=v2.c0 WHERE v1.c1 <>ALL (SELECT c1 FROM v2) ORDER BY 1,2,3,4;
Query Plan
=======================================
|ID|OPERATOR                    |NAME |
---------------------------------------
|0 |SORT                        |     |
|1 |└─HASH OUTER JOIN           |     |
|2 |  ├─HASH RIGHT ANTI JOIN SNA|     |
|3 |  │ ├─SUBPLAN SCAN          |VIEW1|
|4 |  │ │ └─TABLE FULL SCAN     |t2   |
|5 |  │ └─TABLE FULL SCAN       |t1   |
|6 |  └─TABLE FULL SCAN         |t2   |
=======================================
Outputs & filters:
-------------------------------------
  0 - output([t1.c0], [t1.c1], [t2.c0], [t2.c1]), filter(nil), rowset=16
      sort_keys([t1.c0, ASC], [t1.c1, ASC], [t2.c0, ASC], [t2.c1, ASC])
  1 - output([t1.c0], [t1.c1], [t2.c0], [t2.c1]), filter(nil), rowset=16
      equal_conds([t1.c0 = t2.c0]), other_conds(nil)
  2 - output([t1.c0], [t1.c1]), filter(nil), rowset=16
      equal_conds([t1.c1 = VIEW1.c1]), other_conds(nil)
  3 - output([VIEW1.c1]), filter(nil), rowset=16
      access([VIEW1.c1])
  4 - output([t2.c1]), filter([t2.c1 != 'AB']), rowset=16
      access([t2.c1]), partitions(p0)
      is_index_back=false, is_global_index=false, filter_before_indexback[false], 
      range_key([t2.__pk_increment]), range(MIN ; MAX)always true
  5 - output([t1.c0], [t1.c1]), filter(nil), rowset=16
      access([t1.c0], [t1.c1]), partitions(p0)
      is_index_back=false, is_global_index=false, 
      range_key([t1.__pk_increment]), range(MIN ; MAX)always true
  6 - output([t2.c1], [t2.c0]), filter([t2.c1 != 'AB']), rowset=16
      access([t2.c1], [t2.c0]), partitions(p0)
      is_index_back=false, is_global_index=false, filter_before_indexback[false], 
      range_key([t2.__pk_increment]), range(MIN ; MAX)always true
SELECT /*+parallel(2) USE_HASH(v1,v2)*/ * FROM v1 RIGHT JOIN v2 ON v1.c0=v2.c0 WHERE v1.c1 NOT IN (SELECT c1 FROM v2) ORDER BY 1,2,3,4;
c0	c1	c0	c1
1	A	1	12
3	A	3	
5	$ % &	5	$%&
EXPLAIN BASIC SELECT /*+parallel(2) USE_HASH(v1,v2),READ_CONSISTENCY (weak)*/ * FROM v1 RIGHT JOIN v2 ON v1.c0=v2.c0 WHERE v1.c1 NOT IN (SELECT c1 FROM v2) ORDER BY 1,2,3,4;
Query Plan
======================================================
|ID|OPERATOR                                |NAME    |
------------------------------------------------------
|0 |PX COORDINATOR MERGE SORT               |        |
|1 |└─EXCHANGE OUT DISTR                    |:EX10002|
|2 |  └─SORT                                |        |
|3 |    └─SHARED HASH RIGHT ANTI JOIN SNA   |        |
|4 |      ├─EXCHANGE IN DISTR               |        |
|5 |      │ └─EXCHANGE OUT DISTR (BC2HOST)  |:EX10000|
|6 |      │   └─SUBPLAN SCAN                |VIEW1   |
|7 |      │     └─PX BLOCK ITERATOR         |        |
|8 |      │       └─TABLE FULL SCAN         |t2      |
|9 |      └─SHARED HASH RIGHT OUTER JOIN    |        |
|10|        ├─EXCHANGE IN DISTR             |        |
|11|        │ └─EXCHANGE OUT DISTR (BC2HOST)|:EX10001|
|12|        │   └─PX BLOCK ITERATOR         |        |
|13|        │     └─TABLE FULL SCAN         |t1      |
|14|        └─PX BLOCK ITERATOR             |        |
|15|          └─TABLE FULL SCAN             |t2      |
======================================================
Outputs & filters:
-------------------------------------
  0 - output([INTERNAL_FUNCTION(t1.c0, t1.c1, t2.c0, t2.c1)]), filter(nil), rowset=16
      sort_keys([t1.c0, ASC], [t1.c1, ASC], [t2.c0, ASC], [t2.c1, ASC])
  1 - output([t1.c0], [t1.c1], [t2.c0], [t2.c1], [INTERNAL_FUNCTION(t1.c0, t1.c1, t2.c0, t2.c1)]), filter(nil), rowset=16
      dop=2
  2 - output([t1.c0], [t1.c1], [t2.c0], [t2.c1]), filter(nil), rowset=16
      sort_keys([t1.c0, ASC], [t1.c1, ASC], [t2.c0, ASC], [t2.c1, ASC])
  3 - output([t1.c0], [t1.c1], [t2.c0], [t2.c1]), filter(nil), rowset=16
      equal_conds([t1.c1 = VIEW1.c1]), other_conds(nil)
  4 - output([VIEW1.c1]), filter(nil), rowset=16
  5 - output([VIEW1.c1]), filter(nil), rowset=16
      dop=2
  6 - output([VIEW1.c1]), filter(nil), rowset=16
      access([VIEW1.c1])
  7 - output([t2.c1]), filter(nil), rowset=16
  8 - output([t2.c1]), filter([t2.c1 != 'AB']), rowset=16
      access([t2.c1]), partitions(p0)
      is_index_back=false, is_global_index=false, filter_before_indexback[false], 
      range_key([t2.__pk_increment]), range(MIN ; MAX)always true
  9 - output([t1.c0], [t1.c1], [t2.c0], [t2.c1]), filter(nil), rowset=16
      equal_conds([t1.c0 = t2.c0]), other_conds(nil)
 10 - output([t1.c0], [t1.c1]), filter(nil), rowset=16
 11 - output([t1.c0], [t1.c1]), filter(nil), rowset=16
      dop=2
 12 - output([t1.c0], [t1.c1]), filter(nil), rowset=16
 13 - output([t1.c0], [t1.c1]), filter(nil), rowset=16
      access([t1.c0], [t1.c1]), partitions(p0)
      is_index_back=false, is_global_index=false, 
      range_key([t1.__pk_increment]), range(MIN ; MAX)always true
 14 - output([t2.c1], [t2.c0]), filter(nil), rowset=16
 15 - output([t2.c1], [t2.c0]), filter([t2.c1 != 'AB']), rowset=16
      access([t2.c1], [t2.c0]), partitions(p0)
      is_index_back=false, is_global_index=false, filter_before_indexback[false], 
      range_key([t2.__pk_increment]), range(MIN ; MAX)always true
SELECT /*+parallel(5) USE_HASH(v1,v2)*/ * FROM v1  WHERE c1 <>ALL (SELECT c1 FROM v2 WHERE c1 NOT IN (SELECT c1 FROM v1)) ORDER BY v1.c0,v1.c1;
c0	c1
1	A
2	12
3	A
4	NULL
5	$ % &
EXPLAIN BASIC SELECT /*+parallel(5) USE_HASH(v1,v2),READ_CONSISTENCY (weak)*/ * FROM v1  WHERE c1 <>ALL (SELECT c1 FROM v2 WHERE c1 NOT IN (SELECT c1 FROM v1)) ORDER BY v1.c0,v1.c1;
Query Plan
============================================================
|ID|OPERATOR                                      |NAME    |
------------------------------------------------------------
|0 |PX COORDINATOR MERGE SORT                     |        |
|1 |└─EXCHANGE OUT DISTR                          |:EX10002|
|2 |  └─SORT                                      |        |
|3 |    └─SHARED HASH RIGHT ANTI JOIN SNA         |        |
|4 |      ├─EXCHANGE IN DISTR                     |        |
|5 |      │ └─EXCHANGE OUT DISTR (BC2HOST)        |:EX10001|
|6 |      │   └─SUBPLAN SCAN                      |VIEW2   |
|7 |      │     └─SHARED HASH RIGHT ANTI JOIN NA  |        |
|8 |      │       ├─EXCHANGE IN DISTR             |        |
|9 |      │       │ └─EXCHANGE OUT DISTR (BC2HOST)|:EX10000|
|10|      │       │   └─PX BLOCK ITERATOR         |        |
|11|      │       │     └─TABLE FULL SCAN         |t1      |
|12|      │       └─PX BLOCK ITERATOR             |        |
|13|      │         └─TABLE FULL SCAN             |t2      |
|14|      └─PX BLOCK ITERATOR                     |        |
|15|        └─TABLE FULL SCAN                     |t1      |
============================================================
Outputs & filters:
-------------------------------------
  0 - output([INTERNAL_FUNCTION(t1.c0, t1.c1)]), filter(nil), rowset=16
      sort_keys([t1.c0, ASC], [t1.c1, ASC])
  1 - output([t1.c0], [t1.c1], [INTERNAL_FUNCTION(t1.c0, t1.c1)]), filter(nil), rowset=16
      dop=5
  2 - output([t1.c0], [t1.c1]), filter(nil), rowset=16
      sort_keys([t1.c0, ASC], [t1.c1, ASC])
  3 - output([t1.c0], [t1.c1]), filter(nil), rowset=16
      equal_conds([t1.c1 = VIEW2.c1]), other_conds(nil)
  4 - output([VIEW2.c1]), filter(nil), rowset=16
  5 - output([VIEW2.c1]), filter(nil), rowset=16
      dop=5
  6 - output([VIEW2.c1]), filter(nil), rowset=16
      access([VIEW2.c1])
  7 - output([t2.c1]), filter(nil), rowset=16
      equal_conds([t2.c1 = t1.c1]), other_conds(nil)
  8 - output([t1.c1]), filter(nil), rowset=16
  9 - output([t1.c1]), filter(nil), rowset=16
      dop=5
 10 - output([t1.c1]), filter(nil), rowset=16
 11 - output([t1.c1]), filter(nil), rowset=16
      access([t1.c1]), partitions(p0)
      is_index_back=false, is_global_index=false, 
      range_key([t1.__pk_increment]), range(MIN ; MAX)always true
 12 - output([t2.c1]), filter(nil), rowset=16
 13 - output([t2.c1]), filter([t2.c1 != 'AB']), rowset=16
      access([t2.c1]), partitions(p0)
      is_index_back=false, is_global_index=false, filter_before_indexback[false], 
      range_key([t2.__pk_increment]), range(MIN ; MAX)always true
 14 - output([t1.c0], [t1.c1]), filter(nil), rowset=16
 15 - output([t1.c0], [t1.c1]), filter(nil), rowset=16
      access([t1.c0], [t1.c1]), partitions(p0)
      is_index_back=false, is_global_index=false, 
      range_key([t1.__pk_increment]), range(MIN ; MAX)always true
SELECT /*+USE_NL(v1,v2)*/ * FROM v1,v2 WHERE v1.c1 NOT IN(SELECT c1 FROM v2 WHERE c1 IS NOT NULL) ORDER BY v1.c0,v1.c1;
c0	c1	c0	c1
1	A	1	12
1	A	3	
1	A	5	$%&
3	A	1	12
3	A	3	
3	A	5	$%&
5	$ % &	1	12
5	$ % &	3	
5	$ % &	5	$%&
EXPLAIN BASIC SELECT /*+USE_NL(v1,v2),READ_CONSISTENCY (weak)*/ * FROM v1,v2 WHERE v1.c1 NOT IN(SELECT c1 FROM v2 WHERE c1 IS NOT NULL) ORDER BY v1.c0,v1.c1;
Query Plan
========================================
|ID|OPERATOR                     |NAME |
----------------------------------------
|0 |SORT                         |     |
|1 |└─NESTED-LOOP JOIN CARTESIAN |     |
|2 |  ├─TABLE FULL SCAN          |t2   |
|3 |  └─MATERIAL                 |     |
|4 |    └─HASH ANTI JOIN SNA     |     |
|5 |      ├─TABLE FULL SCAN      |t1   |
|6 |      └─SUBPLAN SCAN         |VIEW1|
|7 |        └─TABLE FULL SCAN    |t2   |
========================================
Outputs & filters:
-------------------------------------
  0 - output([t1.c0], [t1.c1], [t2.c0], [t2.c1]), filter(nil), rowset=16
      sort_keys([t1.c0, ASC], [t1.c1, ASC])
  1 - output([t1.c0], [t1.c1], [t2.c0], [t2.c1]), filter(nil), rowset=16
      conds(nil), nl_params_(nil), use_batch=false
  2 - output([t2.c1], [t2.c0]), filter([t2.c1 != 'AB']), rowset=16
      access([t2.c1], [t2.c0]), partitions(p0)
      is_index_back=false, is_global_index=false, filter_before_indexback[false], 
      range_key([t2.__pk_increment]), range(MIN ; MAX)always true
  3 - output([t1.c0], [t1.c1]), filter(nil), rowset=16
  4 - output([t1.c0], [t1.c1]), filter(nil), rowset=16
      equal_conds([t1.c1 = VIEW1.c1]), other_conds(nil)
  5 - output([t1.c0], [t1.c1]), filter(nil), rowset=16
      access([t1.c0], [t1.c1]), partitions(p0)
      is_index_back=false, is_global_index=false, 
      range_key([t1.__pk_increment]), range(MIN ; MAX)always true
  6 - output([VIEW1.c1]), filter(nil), rowset=16
      access([VIEW1.c1])
  7 - output([t2.c1]), filter([t2.c1 != 'AB']), rowset=16
      access([t2.c1]), partitions(p0)
      is_index_back=false, is_global_index=false, filter_before_indexback[false], 
      range_key([t2.__pk_increment]), range(MIN ; MAX)always true
SELECT /*+parallel(2) USE_HASH(v1,v2)*/ * FROM v1 WHERE c1 <>ALL(SELECT c1 FROM v2 WHERE c1 IS NOT NULL) ORDER BY v1.c0,v1.c1;
c0	c1
1	A
3	A
5	$ % &
EXPLAIN BASIC SELECT /*+parallel(2) USE_HASH(v1,v2),READ_CONSISTENCY (weak)*/ * FROM v1 WHERE c1 <>ALL(SELECT c1 FROM v2 WHERE c1 IS NOT NULL) ORDER BY v1.c0,v1.c1;
Query Plan
====================================================
|ID|OPERATOR                              |NAME    |
----------------------------------------------------
|0 |PX COORDINATOR MERGE SORT             |        |
|1 |└─EXCHANGE OUT DISTR                  |:EX10001|
|2 |  └─SORT                              |        |
|3 |    └─SHARED HASH RIGHT ANTI JOIN SNA |        |
|4 |      ├─EXCHANGE IN DISTR             |        |
|5 |      │ └─EXCHANGE OUT DISTR (BC2HOST)|:EX10000|
|6 |      │   └─SUBPLAN SCAN              |VIEW1   |
|7 |      │     └─PX BLOCK ITERATOR       |        |
|8 |      │       └─TABLE FULL SCAN       |t2      |
|9 |      └─PX BLOCK ITERATOR             |        |
|10|        └─TABLE FULL SCAN             |t1      |
====================================================
Outputs & filters:
-------------------------------------
  0 - output([INTERNAL_FUNCTION(t1.c0, t1.c1)]), filter(nil), rowset=16
      sort_keys([t1.c0, ASC], [t1.c1, ASC])
  1 - output([t1.c0], [t1.c1], [INTERNAL_FUNCTION(t1.c0, t1.c1)]), filter(nil), rowset=16
      dop=2
  2 - output([t1.c0], [t1.c1]), filter(nil), rowset=16
      sort_keys([t1.c0, ASC], [t1.c1, ASC])
  3 - output([t1.c0], [t1.c1]), filter(nil), rowset=16
      equal_conds([t1.c1 = VIEW1.c1]), other_conds(nil)
  4 - output([VIEW1.c1]), filter(nil), rowset=16
  5 - output([VIEW1.c1]), filter(nil), rowset=16
      dop=2
  6 - output([VIEW1.c1]), filter(nil), rowset=16
      access([VIEW1.c1])
  7 - output([t2.c1]), filter(nil), rowset=16
  8 - output([t2.c1]), filter([t2.c1 != 'AB']), rowset=16
      access([t2.c1]), partitions(p0)
      is_index_back=false, is_global_index=false, filter_before_indexback[false], 
      range_key([t2.__pk_increment]), range(MIN ; MAX)always true
  9 - output([t1.c0], [t1.c1]), filter(nil), rowset=16
 10 - output([t1.c0], [t1.c1]), filter(nil), rowset=16
      access([t1.c0], [t1.c1]), partitions(p0)
      is_index_back=false, is_global_index=false, 
      range_key([t1.__pk_increment]), range(MIN ; MAX)always true
SELECT /*+USE_HASH(v1,v2)*/ * FROM v1 LEFT JOIN v2 ON v1.c0=v2.c0 WHERE v1.c1 <>ALL (SELECT c1 FROM v2 WHERE c1 IS NOT NULL) ORDER BY 1,2,3,4;
c0	c1	c0	c1
1	A	1	12
3	A	3	
5	$ % &	5	$%&
EXPLAIN BASIC SELECT /*+USE_HASH(v1,v2),READ_CONSISTENCY (weak)*/ * FROM v1 LEFT JOIN v2 ON v1.c0=v2.c0 WHERE v1.c1 <>ALL (SELECT c1 FROM v2 WHERE c1 IS NOT NULL) ORDER BY 1,2,3,4;
Query Plan
=======================================
|ID|OPERATOR                    |NAME |
---------------------------------------
|0 |SORT                        |     |
|1 |└─HASH OUTER JOIN           |     |
|2 |  ├─HASH RIGHT ANTI JOIN SNA|     |
|3 |  │ ├─SUBPLAN SCAN          |VIEW1|
|4 |  │ │ └─TABLE FULL SCAN     |t2   |
|5 |  │ └─TABLE FULL SCAN       |t1   |
|6 |  └─TABLE FULL SCAN         |t2   |
=======================================
Outputs & filters:
-------------------------------------
  0 - output([t1.c0], [t1.c1], [t2.c0], [t2.c1]), filter(nil), rowset=16
      sort_keys([t1.c0, ASC], [t1.c1, ASC], [t2.c0, ASC], [t2.c1, ASC])
  1 - output([t1.c0], [t1.c1], [t2.c0], [t2.c1]), filter(nil), rowset=16
      equal_conds([t1.c0 = t2.c0]), other_conds(nil)
  2 - output([t1.c0], [t1.c1]), filter(nil), rowset=16
      equal_conds([t1.c1 = VIEW1.c1]), other_conds(nil)
  3 - output([VIEW1.c1]), filter(nil), rowset=16
      access([VIEW1.c1])
  4 - output([t2.c1]), filter([t2.c1 != 'AB']), rowset=16
      access([t2.c1]), partitions(p0)
      is_index_back=false, is_global_index=false, filter_before_indexback[false], 
      range_key([t2.__pk_increment]), range(MIN ; MAX)always true
  5 - output([t1.c0], [t1.c1]), filter(nil), rowset=16
      access([t1.c0], [t1.c1]), partitions(p0)
      is_index_back=false, is_global_index=false, 
      range_key([t1.__pk_increment]), range(MIN ; MAX)always true
  6 - output([t2.c1], [t2.c0]), filter([t2.c1 != 'AB']), rowset=16
      access([t2.c1], [t2.c0]), partitions(p0)
      is_index_back=false, is_global_index=false, filter_before_indexback[false], 
      range_key([t2.__pk_increment]), range(MIN ; MAX)always true
SELECT /*+parallel(2) USE_HASH(v1,v2)*/ * FROM v1 RIGHT JOIN v2 ON v1.c0=v2.c0 WHERE v1.c1 NOT IN (SELECT c1 FROM v2 WHERE c1 IS NOT NULL) ORDER BY 1,2,3,4;
c0	c1	c0	c1
1	A	1	12
3	A	3	
5	$ % &	5	$%&
EXPLAIN BASIC SELECT /*+parallel(2) USE_HASH(v1,v2),READ_CONSISTENCY (weak)*/ * FROM v1 RIGHT JOIN v2 ON v1.c0=v2.c0 WHERE v1.c1 NOT IN (SELECT c1 FROM v2 WHERE c1 IS NOT NULL) ORDER BY 1,2,3,4;
Query Plan
======================================================
|ID|OPERATOR                                |NAME    |
------------------------------------------------------
|0 |PX COORDINATOR MERGE SORT               |        |
|1 |└─EXCHANGE OUT DISTR                    |:EX10002|
|2 |  └─SORT                                |        |
|3 |    └─SHARED HASH RIGHT ANTI JOIN SNA   |        |
|4 |      ├─EXCHANGE IN DISTR               |        |
|5 |      │ └─EXCHANGE OUT DISTR (BC2HOST)  |:EX10000|
|6 |      │   └─SUBPLAN SCAN                |VIEW1   |
|7 |      │     └─PX BLOCK ITERATOR         |        |
|8 |      │       └─TABLE FULL SCAN         |t2      |
|9 |      └─SHARED HASH RIGHT OUTER JOIN    |        |
|10|        ├─EXCHANGE IN DISTR             |        |
|11|        │ └─EXCHANGE OUT DISTR (BC2HOST)|:EX10001|
|12|        │   └─PX BLOCK ITERATOR         |        |
|13|        │     └─TABLE FULL SCAN         |t1      |
|14|        └─PX BLOCK ITERATOR             |        |
|15|          └─TABLE FULL SCAN             |t2      |
======================================================
Outputs & filters:
-------------------------------------
  0 - output([INTERNAL_FUNCTION(t1.c0, t1.c1, t2.c0, t2.c1)]), filter(nil), rowset=16
      sort_keys([t1.c0, ASC], [t1.c1, ASC], [t2.c0, ASC], [t2.c1, ASC])
  1 - output([t1.c0], [t1.c1], [t2.c0], [t2.c1], [INTERNAL_FUNCTION(t1.c0, t1.c1, t2.c0, t2.c1)]), filter(nil), rowset=16
      dop=2
  2 - output([t1.c0], [t1.c1], [t2.c0], [t2.c1]), filter(nil), rowset=16
      sort_keys([t1.c0, ASC], [t1.c1, ASC], [t2.c0, ASC], [t2.c1, ASC])
  3 - output([t1.c0], [t1.c1], [t2.c0], [t2.c1]), filter(nil), rowset=16
      equal_conds([t1.c1 = VIEW1.c1]), other_conds(nil)
  4 - output([VIEW1.c1]), filter(nil), rowset=16
  5 - output([VIEW1.c1]), filter(nil), rowset=16
      dop=2
  6 - output([VIEW1.c1]), filter(nil), rowset=16
      access([VIEW1.c1])
  7 - output([t2.c1]), filter(nil), rowset=16
  8 - output([t2.c1]), filter([t2.c1 != 'AB']), rowset=16
      access([t2.c1]), partitions(p0)
      is_index_back=false, is_global_index=false, filter_before_indexback[false], 
      range_key([t2.__pk_increment]), range(MIN ; MAX)always true
  9 - output([t1.c0], [t1.c1], [t2.c0], [t2.c1]), filter(nil), rowset=16
      equal_conds([t1.c0 = t2.c0]), other_conds(nil)
 10 - output([t1.c0], [t1.c1]), filter(nil), rowset=16
 11 - output([t1.c0], [t1.c1]), filter(nil), rowset=16
      dop=2
 12 - output([t1.c0], [t1.c1]), filter(nil), rowset=16
 13 - output([t1.c0], [t1.c1]), filter(nil), rowset=16
      access([t1.c0], [t1.c1]), partitions(p0)
      is_index_back=false, is_global_index=false, 
      range_key([t1.__pk_increment]), range(MIN ; MAX)always true
 14 - output([t2.c1], [t2.c0]), filter(nil), rowset=16
 15 - output([t2.c1], [t2.c0]), filter([t2.c1 != 'AB']), rowset=16
      access([t2.c1], [t2.c0]), partitions(p0)
      is_index_back=false, is_global_index=false, filter_before_indexback[false], 
      range_key([t2.__pk_increment]), range(MIN ; MAX)always true
SELECT /*+parallel(5) USE_HASH(v1,v2)*/ * FROM v1  WHERE c1 <>ALL (SELECT c1 FROM v2 WHERE c1 NOT IN (SELECT c1 FROM v1 WHERE c1 IS NOT NULL) AND c1 IS NOT NULL) ORDER BY v1.c0,v1.c1;
c0	c1
1	A
2	12
3	A
5	$ % &
EXPLAIN BASIC SELECT /*+parallel(5) USE_HASH(v1,v2),READ_CONSISTENCY (weak)*/ * FROM v1  WHERE c1 <>ALL (SELECT c1 FROM v2 WHERE c1 NOT IN (SELECT c1 FROM v1 WHERE c1 IS NOT NULL) AND c1 IS NOT NULL) ORDER BY v1.c0,v1.c1;
Query Plan
============================================================
|ID|OPERATOR                                      |NAME    |
------------------------------------------------------------
|0 |PX COORDINATOR MERGE SORT                     |        |
|1 |└─EXCHANGE OUT DISTR                          |:EX10002|
|2 |  └─SORT                                      |        |
|3 |    └─SHARED HASH RIGHT ANTI JOIN SNA         |        |
|4 |      ├─EXCHANGE IN DISTR                     |        |
|5 |      │ └─EXCHANGE OUT DISTR (BC2HOST)        |:EX10001|
|6 |      │   └─SUBPLAN SCAN                      |VIEW2   |
|7 |      │     └─SHARED HASH RIGHT ANTI JOIN     |        |
|8 |      │       ├─EXCHANGE IN DISTR             |        |
|9 |      │       │ └─EXCHANGE OUT DISTR (BC2HOST)|:EX10000|
|10|      │       │   └─SUBPLAN SCAN              |VIEW1   |
|11|      │       │     └─PX BLOCK ITERATOR       |        |
|12|      │       │       └─TABLE FULL SCAN       |t1      |
|13|      │       └─PX BLOCK ITERATOR             |        |
|14|      │         └─TABLE FULL SCAN             |t2      |
|15|      └─PX BLOCK ITERATOR                     |        |
|16|        └─TABLE FULL SCAN                     |t1      |
============================================================
Outputs & filters:
-------------------------------------
  0 - output([INTERNAL_FUNCTION(t1.c0, t1.c1)]), filter(nil), rowset=16
      sort_keys([t1.c0, ASC], [t1.c1, ASC])
  1 - output([t1.c0], [t1.c1], [INTERNAL_FUNCTION(t1.c0, t1.c1)]), filter(nil), rowset=16
      dop=5
  2 - output([t1.c0], [t1.c1]), filter(nil), rowset=16
      sort_keys([t1.c0, ASC], [t1.c1, ASC])
  3 - output([t1.c0], [t1.c1]), filter(nil), rowset=16
      equal_conds([t1.c1 = VIEW2.c1]), other_conds(nil)
  4 - output([VIEW2.c1]), filter(nil), rowset=16
  5 - output([VIEW2.c1]), filter(nil), rowset=16
      dop=5
  6 - output([VIEW2.c1]), filter(nil), rowset=16
      access([VIEW2.c1])
  7 - output([t2.c1]), filter(nil), rowset=16
      equal_conds([t2.c1 = VIEW1.c1]), other_conds(nil)
  8 - output([VIEW1.c1]), filter(nil), rowset=16
  9 - output([VIEW1.c1]), filter(nil), rowset=16
      dop=5
 10 - output([VIEW1.c1]), filter(nil), rowset=16
      access([VIEW1.c1])
 11 - output([t1.c1]), filter(nil), rowset=16
 12 - output([t1.c1]), filter([t1.c1 != 'AB'], [t1.c1 IS NOT NULL]), rowset=16
      access([t1.c1]), partitions(p0)
      is_index_back=false, is_global_index=false, filter_before_indexback[false,false], 
      range_key([t1.__pk_increment]), range(MIN ; MAX)always true
 13 - output([t2.c1]), filter(nil), rowset=16
 14 - output([t2.c1]), filter([t2.c1 != 'AB']), rowset=16
      access([t2.c1]), partitions(p0)
      is_index_back=false, is_global_index=false, filter_before_indexback[false], 
      range_key([t2.__pk_increment]), range(MIN ; MAX)always true
 15 - output([t1.c0], [t1.c1]), filter(nil), rowset=16
 16 - output([t1.c0], [t1.c1]), filter(nil), rowset=16
      access([t1.c0], [t1.c1]), partitions(p0)
      is_index_back=false, is_global_index=false, 
      range_key([t1.__pk_increment]), range(MIN ; MAX)always true
INSERT INTO v1 SELECT c0,c1 FROM v2 WHERE c1 NOT IN (SELECT c1 FROM v1);
SELECT * FROM v1 ORDER BY c0,c1;
c0	c1
1	A
2	12
3	A
4	NULL
5	$ % &
EXPLAIN BASIC INSERT INTO v1 SELECT /*+READ_CONSISTENCY (weak)*/ c0,c1 FROM v2 WHERE c1 NOT IN (SELECT c1 FROM v1);
INSERT INTO v2 SELECT c0,c1 FROM v2 WHERE NOT EXISTS (SELECT c1 FROM v1);
SELECT * FROM v2 ORDER BY c0,c1;
c0	c1
1	12
3	
5	$%&
EXPLAIN BASIC INSERT INTO v2 SELECT /*+READ_CONSISTENCY (weak)*/ c0,c1 FROM v2 WHERE NOT EXISTS (SELECT c1 FROM v1);
INSERT INTO v2 SELECT * FROM v1 WHERE c1 IN (SELECT c1 FROM v2 WHERE c1 NOT IN (SELECT c1 FROM v1));
SELECT * FROM v2 ORDER BY c0,c1;
c0	c1
1	12
3	
5	$%&
EXPLAIN BASIC INSERT INTO v2 SELECT /*+parallel(2) USE_MERGE(v1) ,READ_CONSISTENCY (weak)*/ * FROM v1 WHERE c1 IN (SELECT /*+READ_CONSISTENCY (weak)*/ c1 FROM v2 WHERE c1 NOT IN (SELECT c1 FROM v1));
INSERT INTO v2 SELECT c0,c1 FROM v2 WHERE c1 IN (SELECT c1 FROM v1 WHERE c1 NOT IN (SELECT c1 FROM v2 WHERE c1 IS NOT NULL));
SELECT * FROM v2 ORDER BY c0,c1;
c0	c1
1	12
3	
5	$%&
EXPLAIN BASIC INSERT INTO v2 SELECT /*+READ_CONSISTENCY (weak)*/ c0,c1 FROM v2 WHERE c1 IN (SELECT c1 FROM v1 WHERE c1 NOT IN (SELECT c1 FROM v2 WHERE c1 IS NOT NULL));
DROP TABLE IF EXISTS t2;
DROP TABLE IF EXISTS t1;
CREATE TABLE t1(c0 INT,c1 INT);
CREATE TABLE t2(c0 INT,c1 INT);
INSERT INTO t1 VALUES(0,0),(1,1),(2,1),(2,2),(4,3),(6,NULL);
INSERT INTO t2 VALUES(0,0),(1,2),(2,4),(2,6),(4,8),(5,NULL);
CREATE OR REPLACE VIEW v1 AS SELECT * FROM t1 ;
CREATE OR REPLACE VIEW v2 AS SELECT * FROM t2 WHERE c1 NOT IN('2');
SELECT * FROM v1 ORDER BY c0,c1;
c0	c1
0	0
1	1
2	1
2	2
4	3
6	NULL
SELECT * FROM v2 ORDER BY c0,c1;
c0	c1
0	0
2	4
2	6
4	8
UPDATE v1 SET c1=c1+1 WHERE v1.c1 NOT IN (SELECT c1 FROM v2);
SELECT * FROM v1 ORDER BY c0,c1;
c0	c1
0	0
1	2
2	2
2	3
4	4
6	NULL
EXPLAIN BASIC UPDATE v1 SET c1=c1+1 WHERE c1 NOT IN (SELECT c1 FROM v2);
UPDATE v1 SET c1=c1+1 WHERE NOT EXISTS (SELECT c1 FROM v2);
SELECT * FROM v1 ORDER BY c0,c1;
c0	c1
0	0
1	2
2	2
2	3
4	4
6	NULL
EXPLAIN BASIC UPDATE v1 SET c1=c1+1 WHERE NOT EXISTS (SELECT c1 FROM v2);
UPDATE v1 SET c1=c1+1 WHERE v1.c1 NOT IN (SELECT c1 FROM v2 WHERE c1 IN(SELECT c1 FROM t2));
SELECT * FROM v1 ORDER BY c0,c1;
c0	c1
0	0
1	3
2	3
2	4
4	4
6	NULL
EXPLAIN BASIC UPDATE t1 SET c1=c1+1 WHERE t1.c1 NOT IN (SELECT /*+parallel(2) USE_NLJ(t2) */ c1 FROM t2 WHERE c1 IN(SELECT c1 FROM t2));
UPDATE v1 SET c1=c1+1 WHERE v1.c1 <>ALL (SELECT v2.c1 FROM t2 JOIN v2 ON t2.c0=v2.c0 AND v2.c1 NOT IN (SELECT c1 FROM t2));
SELECT * FROM v1 ORDER BY c0,c1;
c0	c1
0	1
1	4
2	4
2	5
4	5
6	NULL
EXPLAIN BASIC UPDATE v1 SET c1=c1+1 WHERE v1.c1 <>ALL (SELECT /*+READ_CONSISTENCY (weak)*/ v2.c1 FROM v1 JOIN v2 ON v1.c0=v2.c0 AND v2.c1 NOT IN (SELECT c1 FROM t2));
UPDATE v1 SET c1=c1+1 WHERE v1.c1 NOT IN (SELECT /*+parallel(5) USE_HASH(v2) */ c1 FROM v2 WHERE c1 <>ALL(SELECT c1 FROM v1 WHERE c1 IS NOT NULL));
SELECT * FROM v1 ORDER BY c0,c1;
c0	c1
0	2
1	5
2	5
2	6
4	6
6	NULL
EXPLAIN BASIC UPDATE v1 SET c1=c1+1 WHERE v1.c1 NOT IN (SELECT /*+parallel(5) USE_HASH(v2),READ_CONSISTENCY (weak) */ c1 FROM v2 WHERE c1 <>ALL(SELECT c1 FROM v1 WHERE c1 IS NOT NULL));
#COPY TABLE
DROP VIEW v1 ;
DROP VIEW v2 ;
DROP TABLE IF EXISTS t2;
DROP TABLE IF EXISTS t1;
CREATE TABLE t1(c0 INT,c1 INT);
CREATE TABLE t2(c0 INT,c1 DOUBLE(10,0));
INSERT INTO t1 VALUES(0,0),(1,1),(2,1),(2,2),(4,3),(6,NULL);
INSERT INTO t2 VALUES(0,0),(1,2),(2,4),(2,6),(4,8),(5,NULL);
DROP TABLE IF EXISTS p2;
Warnings:
Note	1051	Unknown table 'test.p2'
DROP TABLE IF EXISTS p1;
Warnings:
Note	1051	Unknown table 'test.p1'
CREATE TABLE p1 AS SELECT * FROM t1;
CREATE TABLE p2 AS SELECT * FROM t2;
SELECT * FROM p1 ORDER BY c0,c1;
c0	c1
0	0
1	1
2	1
2	2
4	3
6	NULL
SELECT * FROM p2 ORDER BY c0,c1;
c0	c1
0	0
1	2
2	4
2	6
4	8
5	NULL
SELECT /*USE_HASH(p1,p2)*/ * FROM p1,p2 WHERE p1.c1 NOT IN (SELECT c1 FROM p2) ORDER BY p1.c0,p1.c1;
c0	c1	c0	c1
EXPLAIN BASIC SELECT /*USE_HASH(p1,p2),READ_CONSISTENCY (weak)*/ * FROM p1,p2 WHERE p1.c1 NOT IN (SELECT c1 FROM p2) ORDER BY p1.c0,p1.c1;
Query Plan
=======================================
|ID|OPERATOR                     |NAME|
---------------------------------------
|0 |SORT                         |    |
|1 |└─NESTED-LOOP JOIN CARTESIAN |    |
|2 |  ├─TABLE FULL SCAN          |p2  |
|3 |  └─MATERIAL                 |    |
|4 |    └─HASH RIGHT ANTI JOIN NA|    |
|5 |      ├─TABLE FULL SCAN      |p2  |
|6 |      └─TABLE FULL SCAN      |p1  |
=======================================
Outputs & filters:
-------------------------------------
  0 - output([p1.c0], [p1.c1], [p2.c0], [p2.c1]), filter(nil), rowset=16
      sort_keys([p1.c0, ASC], [p1.c1, ASC])
  1 - output([p1.c0], [p1.c1], [p2.c0], [p2.c1]), filter(nil), rowset=16
      conds(nil), nl_params_(nil), use_batch=false
  2 - output([p2.c0], [p2.c1]), filter(nil), rowset=16
      access([p2.c0], [p2.c1]), partitions(p0)
      is_index_back=false, is_global_index=false, 
      range_key([p2.__pk_increment]), range(MIN ; MAX)always true
  3 - output([p1.c0], [p1.c1]), filter(nil), rowset=16
  4 - output([p1.c0], [p1.c1]), filter(nil), rowset=16
      equal_conds([cast(p1.c1, DOUBLE(11, 0)) = p2.c1]), other_conds(nil)
  5 - output([p2.c1]), filter(nil), rowset=16
      access([p2.c1]), partitions(p0)
      is_index_back=false, is_global_index=false, 
      range_key([p2.__pk_increment]), range(MIN ; MAX)always true
  6 - output([p1.c1], [p1.c0]), filter(nil), rowset=16
      access([p1.c1], [p1.c0]), partitions(p0)
      is_index_back=false, is_global_index=false, 
      range_key([p1.__pk_increment]), range(MIN ; MAX)always true
SELECT /*USE_MERGE(p1,p2)*/ * FROM p1,p2 WHERE p1.c1 NOT IN (SELECT c1 FROM p2) ORDER BY p1.c0,p1.c1;
c0	c1	c0	c1
EXPLAIN BASIC SELECT /*USE_MERGE(p1,p2),READ_CONSISTENCY (weak)*/ * FROM p1,p2 WHERE p1.c1 NOT IN (SELECT c1 FROM p2) ORDER BY p1.c0,p1.c1;
Query Plan
=======================================
|ID|OPERATOR                     |NAME|
---------------------------------------
|0 |SORT                         |    |
|1 |└─NESTED-LOOP JOIN CARTESIAN |    |
|2 |  ├─TABLE FULL SCAN          |p2  |
|3 |  └─MATERIAL                 |    |
|4 |    └─HASH RIGHT ANTI JOIN NA|    |
|5 |      ├─TABLE FULL SCAN      |p2  |
|6 |      └─TABLE FULL SCAN      |p1  |
=======================================
Outputs & filters:
-------------------------------------
  0 - output([p1.c0], [p1.c1], [p2.c0], [p2.c1]), filter(nil), rowset=16
      sort_keys([p1.c0, ASC], [p1.c1, ASC])
  1 - output([p1.c0], [p1.c1], [p2.c0], [p2.c1]), filter(nil), rowset=16
      conds(nil), nl_params_(nil), use_batch=false
  2 - output([p2.c0], [p2.c1]), filter(nil), rowset=16
      access([p2.c0], [p2.c1]), partitions(p0)
      is_index_back=false, is_global_index=false, 
      range_key([p2.__pk_increment]), range(MIN ; MAX)always true
  3 - output([p1.c0], [p1.c1]), filter(nil), rowset=16
  4 - output([p1.c0], [p1.c1]), filter(nil), rowset=16
      equal_conds([cast(p1.c1, DOUBLE(11, 0)) = p2.c1]), other_conds(nil)
  5 - output([p2.c1]), filter(nil), rowset=16
      access([p2.c1]), partitions(p0)
      is_index_back=false, is_global_index=false, 
      range_key([p2.__pk_increment]), range(MIN ; MAX)always true
  6 - output([p1.c1], [p1.c0]), filter(nil), rowset=16
      access([p1.c1], [p1.c0]), partitions(p0)
      is_index_back=false, is_global_index=false, 
      range_key([p1.__pk_increment]), range(MIN ; MAX)always true
SELECT /*USE_HASH(p1,p2)*/ * FROM p1,p2 WHERE p1.c1 NOT IN (SELECT c1 FROM p2 WHERE c1 <>ALL (SELECT c1 FROM p1)) ORDER BY 1,2,3,4;
c0	c1	c0	c1
0	0	0	0
0	0	1	2
0	0	2	4
0	0	2	6
0	0	4	8
0	0	5	NULL
1	1	0	0
1	1	1	2
1	1	2	4
1	1	2	6
1	1	4	8
1	1	5	NULL
2	1	0	0
2	1	1	2
2	1	2	4
2	1	2	6
2	1	4	8
2	1	5	NULL
2	2	0	0
2	2	1	2
2	2	2	4
2	2	2	6
2	2	4	8
2	2	5	NULL
4	3	0	0
4	3	1	2
4	3	2	4
4	3	2	6
4	3	4	8
4	3	5	NULL
6	NULL	0	0
6	NULL	1	2
6	NULL	2	4
6	NULL	2	6
6	NULL	4	8
6	NULL	5	NULL
EXPLAIN BASIC SELECT /*USE_HASH(p1,p2),READ_CONSISTENCY (weak)*/ * FROM p1,p2 WHERE p1.c1 NOT IN (SELECT c1 FROM p2 WHERE c1 <>ALL (SELECT c1 FROM p1)) ORDER BY 1,2,3,4;
Query Plan
========================================
|ID|OPERATOR                     |NAME |
----------------------------------------
|0 |SORT                         |     |
|1 |└─NESTED-LOOP JOIN CARTESIAN |     |
|2 |  ├─TABLE FULL SCAN          |p2   |
|3 |  └─MATERIAL                 |     |
|4 |    └─HASH RIGHT ANTI JOIN NA|     |
|5 |      ├─SUBPLAN SCAN         |VIEW2|
|6 |      │ └─HASH ANTI JOIN NA  |     |
|7 |      │   ├─TABLE FULL SCAN  |p2   |
|8 |      │   └─TABLE FULL SCAN  |p1   |
|9 |      └─TABLE FULL SCAN      |p1   |
========================================
Outputs & filters:
-------------------------------------
  0 - output([p1.c0], [p1.c1], [p2.c0], [p2.c1]), filter(nil), rowset=16
      sort_keys([p1.c0, ASC], [p1.c1, ASC], [p2.c0, ASC], [p2.c1, ASC])
  1 - output([p1.c0], [p1.c1], [p2.c0], [p2.c1]), filter(nil), rowset=16
      conds(nil), nl_params_(nil), use_batch=false
  2 - output([p2.c0], [p2.c1]), filter(nil), rowset=16
      access([p2.c0], [p2.c1]), partitions(p0)
      is_index_back=false, is_global_index=false, 
      range_key([p2.__pk_increment]), range(MIN ; MAX)always true
  3 - output([p1.c0], [p1.c1]), filter(nil), rowset=16
  4 - output([p1.c0], [p1.c1]), filter(nil), rowset=16
      equal_conds([cast(p1.c1, DOUBLE(11, 0)) = VIEW2.c1]), other_conds(nil)
  5 - output([VIEW2.c1]), filter(nil), rowset=16
      access([VIEW2.c1])
  6 - output([p2.c1]), filter(nil), rowset=16
      equal_conds([p2.c1 = cast(p1.c1, DOUBLE(11, 0))]), other_conds(nil)
  7 - output([p2.c1]), filter(nil), rowset=16
      access([p2.c1]), partitions(p0)
      is_index_back=false, is_global_index=false, 
      range_key([p2.__pk_increment]), range(MIN ; MAX)always true
  8 - output([p1.c1]), filter(nil), rowset=16
      access([p1.c1]), partitions(p0)
      is_index_back=false, is_global_index=false, 
      range_key([p1.__pk_increment]), range(MIN ; MAX)always true
  9 - output([p1.c1], [p1.c0]), filter(nil), rowset=16
      access([p1.c1], [p1.c0]), partitions(p0)
      is_index_back=false, is_global_index=false, 
      range_key([p1.__pk_increment]), range(MIN ; MAX)always true
SELECT /*+parallel(5) USE_HASH(p1,p2)*/ * FROM p1 JOIN p2 ON p1.c0=p2.c0 WHERE p1.c1 NOT IN (SELECT c1 FROM p2) ORDER BY 1,2,3,4;
c0	c1	c0	c1
EXPLAIN BASIC SELECT /*+parallel(5) USE_HASH(p1,p2),READ_CONSISTENCY (weak)*/ * FROM p1 JOIN p2 ON p1.c0=p2.c0 WHERE p1.c1 NOT IN (SELECT c1 FROM p2) ORDER BY 1,2,3,4;
Query Plan
==========================================================
|ID|OPERATOR                                    |NAME    |
----------------------------------------------------------
|0 |PX COORDINATOR MERGE SORT                   |        |
|1 |└─EXCHANGE OUT DISTR                        |:EX10002|
|2 |  └─SORT                                    |        |
|3 |    └─SHARED HASH JOIN                      |        |
|4 |      ├─EXCHANGE IN DISTR                   |        |
|5 |      │ └─EXCHANGE OUT DISTR (BC2HOST)      |:EX10001|
|6 |      │   └─SHARED HASH RIGHT ANTI JOIN NA  |        |
|7 |      │     ├─EXCHANGE IN DISTR             |        |
|8 |      │     │ └─EXCHANGE OUT DISTR (BC2HOST)|:EX10000|
|9 |      │     │   └─PX BLOCK ITERATOR         |        |
|10|      │     │     └─TABLE FULL SCAN         |p2      |
|11|      │     └─PX BLOCK ITERATOR             |        |
|12|      │       └─TABLE FULL SCAN             |p1      |
|13|      └─PX BLOCK ITERATOR                   |        |
|14|        └─TABLE FULL SCAN                   |p2      |
==========================================================
Outputs & filters:
-------------------------------------
  0 - output([INTERNAL_FUNCTION(p1.c0, p1.c1, p2.c0, p2.c1)]), filter(nil), rowset=16
      sort_keys([p1.c0, ASC], [p1.c1, ASC], [p2.c1, ASC])
  1 - output([p1.c0], [p1.c1], [p2.c1], [INTERNAL_FUNCTION(p1.c0, p1.c1, p2.c0, p2.c1)]), filter(nil), rowset=16
      dop=5
  2 - output([p1.c0], [p1.c1], [p2.c1], [p2.c0]), filter(nil), rowset=16
      sort_keys([p1.c0, ASC], [p1.c1, ASC], [p2.c1, ASC])
  3 - output([p1.c0], [p1.c1], [p2.c1], [p2.c0]), filter(nil), rowset=16
      equal_conds([p1.c0 = p2.c0]), other_conds(nil)
  4 - output([p1.c0], [p1.c1]), filter(nil), rowset=16
  5 - output([p1.c0], [p1.c1]), filter(nil), rowset=16
      dop=5
  6 - output([p1.c0], [p1.c1]), filter(nil), rowset=16
      equal_conds([cast(p1.c1, DOUBLE(11, 0)) = p2.c1]), other_conds(nil)
  7 - output([p2.c1]), filter(nil), rowset=16
  8 - output([p2.c1]), filter(nil), rowset=16
      dop=5
  9 - output([p2.c1]), filter(nil), rowset=16
 10 - output([p2.c1]), filter(nil), rowset=16
      access([p2.c1]), partitions(p0)
      is_index_back=false, is_global_index=false, 
      range_key([p2.__pk_increment]), range(MIN ; MAX)always true
 11 - output([p1.c0], [p1.c1]), filter(nil), rowset=16
 12 - output([p1.c0], [p1.c1]), filter(nil), rowset=16
      access([p1.c0], [p1.c1]), partitions(p0)
      is_index_back=false, is_global_index=false, 
      range_key([p1.__pk_increment]), range(MIN ; MAX)always true
 13 - output([p2.c0], [p2.c1]), filter(nil), rowset=16
 14 - output([p2.c0], [p2.c1]), filter(nil), rowset=16
      access([p2.c0], [p2.c1]), partitions(p0)
      is_index_back=false, is_global_index=false, 
      range_key([p2.__pk_increment]), range(MIN ; MAX)always true
SELECT /*+parallel(2) USE_HASH(p1,p2)*/ * FROM p1  WHERE c1 <>ALL (SELECT c1 FROM p2) ORDER BY p1.c0,p1.c1;
c0	c1
EXPLAIN BASIC SELECT /*+parallel(2) USE_HASH(p1,p2),READ_CONSISTENCY (weak)*/ * FROM p1  WHERE c1 <>ALL (SELECT c1 FROM p2) ORDER BY p1.c0,p1.c1;
Query Plan
====================================================
|ID|OPERATOR                              |NAME    |
----------------------------------------------------
|0 |PX COORDINATOR MERGE SORT             |        |
|1 |└─EXCHANGE OUT DISTR                  |:EX10001|
|2 |  └─SORT                              |        |
|3 |    └─SHARED HASH RIGHT ANTI JOIN NA  |        |
|4 |      ├─EXCHANGE IN DISTR             |        |
|5 |      │ └─EXCHANGE OUT DISTR (BC2HOST)|:EX10000|
|6 |      │   └─PX BLOCK ITERATOR         |        |
|7 |      │     └─TABLE FULL SCAN         |p2      |
|8 |      └─PX BLOCK ITERATOR             |        |
|9 |        └─TABLE FULL SCAN             |p1      |
====================================================
Outputs & filters:
-------------------------------------
  0 - output([INTERNAL_FUNCTION(p1.c0, p1.c1)]), filter(nil), rowset=16
      sort_keys([p1.c0, ASC], [p1.c1, ASC])
  1 - output([p1.c0], [p1.c1], [INTERNAL_FUNCTION(p1.c0, p1.c1)]), filter(nil), rowset=16
      dop=2
  2 - output([p1.c0], [p1.c1]), filter(nil), rowset=16
      sort_keys([p1.c0, ASC], [p1.c1, ASC])
  3 - output([p1.c0], [p1.c1]), filter(nil), rowset=16
      equal_conds([cast(p1.c1, DOUBLE(11, 0)) = p2.c1]), other_conds(nil)
  4 - output([p2.c1]), filter(nil), rowset=16
  5 - output([p2.c1]), filter(nil), rowset=16
      dop=2
  6 - output([p2.c1]), filter(nil), rowset=16
  7 - output([p2.c1]), filter(nil), rowset=16
      access([p2.c1]), partitions(p0)
      is_index_back=false, is_global_index=false, 
      range_key([p2.__pk_increment]), range(MIN ; MAX)always true
  8 - output([p1.c1], [p1.c0]), filter(nil), rowset=16
  9 - output([p1.c1], [p1.c0]), filter(nil), rowset=16
      access([p1.c1], [p1.c0]), partitions(p0)
      is_index_back=false, is_global_index=false, 
      range_key([p1.__pk_increment]), range(MIN ; MAX)always true
SELECT /*USE_HASH(p1,p2)*/ * FROM p1,p2 WHERE p1.c1 NOT IN (SELECT c1 FROM p2 WHERE c1 IS NOT NULL) ORDER BY 1,2,3,4;
c0	c1	c0	c1
1	1	0	0
1	1	1	2
1	1	2	4
1	1	2	6
1	1	4	8
1	1	5	NULL
2	1	0	0
2	1	1	2
2	1	2	4
2	1	2	6
2	1	4	8
2	1	5	NULL
4	3	0	0
4	3	1	2
4	3	2	4
4	3	2	6
4	3	4	8
4	3	5	NULL
EXPLAIN BASIC SELECT /*USE_HASH(p1,p2),READ_CONSISTENCY (weak)*/ * FROM p1,p2 WHERE p1.c1 NOT IN (SELECT c1 FROM p2 WHERE c1 IS NOT NULL) ORDER BY 1,2,3,4;
Query Plan
=========================================
|ID|OPERATOR                      |NAME |
-----------------------------------------
|0 |SORT                          |     |
|1 |└─NESTED-LOOP JOIN CARTESIAN  |     |
|2 |  ├─TABLE FULL SCAN           |p2   |
|3 |  └─MATERIAL                  |     |
|4 |    └─HASH RIGHT ANTI JOIN SNA|     |
|5 |      ├─SUBPLAN SCAN          |VIEW1|
|6 |      │ └─TABLE FULL SCAN     |p2   |
|7 |      └─TABLE FULL SCAN       |p1   |
=========================================
Outputs & filters:
-------------------------------------
  0 - output([p1.c0], [p1.c1], [p2.c0], [p2.c1]), filter(nil), rowset=16
      sort_keys([p1.c0, ASC], [p1.c1, ASC], [p2.c0, ASC], [p2.c1, ASC])
  1 - output([p1.c0], [p1.c1], [p2.c0], [p2.c1]), filter(nil), rowset=16
      conds(nil), nl_params_(nil), use_batch=false
  2 - output([p2.c0], [p2.c1]), filter(nil), rowset=16
      access([p2.c0], [p2.c1]), partitions(p0)
      is_index_back=false, is_global_index=false, 
      range_key([p2.__pk_increment]), range(MIN ; MAX)always true
  3 - output([p1.c0], [p1.c1]), filter(nil), rowset=16
  4 - output([p1.c0], [p1.c1]), filter(nil), rowset=16
      equal_conds([cast(p1.c1, DOUBLE(11, 0)) = VIEW1.c1]), other_conds(nil)
  5 - output([VIEW1.c1]), filter(nil), rowset=16
      access([VIEW1.c1])
  6 - output([p2.c1]), filter([p2.c1 IS NOT NULL]), rowset=16
      access([p2.c1]), partitions(p0)
      is_index_back=false, is_global_index=false, filter_before_indexback[false], 
      range_key([p2.__pk_increment]), range(MIN ; MAX)always true
  7 - output([p1.c1], [p1.c0]), filter(nil), rowset=16
      access([p1.c1], [p1.c0]), partitions(p0)
      is_index_back=false, is_global_index=false, 
      range_key([p1.__pk_increment]), range(MIN ; MAX)always true
SELECT /*USE_MERGE(p1,p2)*/ * FROM p1,p2 WHERE p1.c1 NOT IN (SELECT c1 FROM p2 WHERE c1 <>ALL(SELECT c1 FROM p1 WHERE c1 IS NOT NULL) AND c1 IS NOT NULL) ORDER BY 1,2,3,4;
c0	c1	c0	c1
0	0	0	0
0	0	1	2
0	0	2	4
0	0	2	6
0	0	4	8
0	0	5	NULL
1	1	0	0
1	1	1	2
1	1	2	4
1	1	2	6
1	1	4	8
1	1	5	NULL
2	1	0	0
2	1	1	2
2	1	2	4
2	1	2	6
2	1	4	8
2	1	5	NULL
2	2	0	0
2	2	1	2
2	2	2	4
2	2	2	6
2	2	4	8
2	2	5	NULL
4	3	0	0
4	3	1	2
4	3	2	4
4	3	2	6
4	3	4	8
4	3	5	NULL
EXPLAIN BASIC SELECT /*USE_MERGE(p1,p2),READ_CONSISTENCY (weak)*/ * FROM p1,p2 WHERE p1.c1 NOT IN (SELECT c1 FROM p2 WHERE c1 <>ALL(SELECT c1 FROM p1 WHERE c1 IS NOT NULL) AND c1 IS NOT NULL) ORDER BY 1,2,3,4;
Query Plan
==========================================
|ID|OPERATOR                       |NAME |
------------------------------------------
|0 |SORT                           |     |
|1 |└─NESTED-LOOP JOIN CARTESIAN   |     |
|2 |  ├─TABLE FULL SCAN            |p2   |
|3 |  └─MATERIAL                   |     |
|4 |    └─HASH RIGHT ANTI JOIN SNA |     |
|5 |      ├─SUBPLAN SCAN           |VIEW2|
|6 |      │ └─HASH RIGHT ANTI JOIN |     |
|7 |      │   ├─SUBPLAN SCAN       |VIEW1|
|8 |      │   │ └─TABLE FULL SCAN  |p1   |
|9 |      │   └─TABLE FULL SCAN    |p2   |
|10|      └─TABLE FULL SCAN        |p1   |
==========================================
Outputs & filters:
-------------------------------------
  0 - output([p1.c0], [p1.c1], [p2.c0], [p2.c1]), filter(nil), rowset=16
      sort_keys([p1.c0, ASC], [p1.c1, ASC], [p2.c0, ASC], [p2.c1, ASC])
  1 - output([p1.c0], [p1.c1], [p2.c0], [p2.c1]), filter(nil), rowset=16
      conds(nil), nl_params_(nil), use_batch=false
  2 - output([p2.c0], [p2.c1]), filter(nil), rowset=16
      access([p2.c0], [p2.c1]), partitions(p0)
      is_index_back=false, is_global_index=false, 
      range_key([p2.__pk_increment]), range(MIN ; MAX)always true
  3 - output([p1.c0], [p1.c1]), filter(nil), rowset=16
  4 - output([p1.c0], [p1.c1]), filter(nil), rowset=16
      equal_conds([cast(p1.c1, DOUBLE(11, 0)) = VIEW2.c1]), other_conds(nil)
  5 - output([VIEW2.c1]), filter(nil), rowset=16
      access([VIEW2.c1])
  6 - output([p2.c1]), filter(nil), rowset=16
      equal_conds([p2.c1 = VIEW1.c1]), other_conds(nil)
  7 - output([VIEW1.c1]), filter(nil), rowset=16
      access([VIEW1.c1])
  8 - output([cast(p1.c1, DOUBLE(11, 0))]), filter([p1.c1 IS NOT NULL]), rowset=16
      access([p1.c1]), partitions(p0)
      is_index_back=false, is_global_index=false, filter_before_indexback[false], 
      range_key([p1.__pk_increment]), range(MIN ; MAX)always true
  9 - output([p2.c1]), filter([p2.c1 IS NOT NULL]), rowset=16
      access([p2.c1]), partitions(p0)
      is_index_back=false, is_global_index=false, filter_before_indexback[false], 
      range_key([p2.__pk_increment]), range(MIN ; MAX)always true
 10 - output([p1.c1], [p1.c0]), filter(nil), rowset=16
      access([p1.c1], [p1.c0]), partitions(p0)
      is_index_back=false, is_global_index=false, 
      range_key([p1.__pk_increment]), range(MIN ; MAX)always true
SELECT /*USE_HASH(p1,p2)*/ * FROM p1,p2 WHERE p1.c1 NOT IN (SELECT c1 FROM p2 WHERE c1 <>ALL (SELECT c1 FROM p1) AND c1 IS NOT NULL) ORDER BY 1,2,3,4;
c0	c1	c0	c1
0	0	0	0
0	0	1	2
0	0	2	4
0	0	2	6
0	0	4	8
0	0	5	NULL
1	1	0	0
1	1	1	2
1	1	2	4
1	1	2	6
1	1	4	8
1	1	5	NULL
2	1	0	0
2	1	1	2
2	1	2	4
2	1	2	6
2	1	4	8
2	1	5	NULL
2	2	0	0
2	2	1	2
2	2	2	4
2	2	2	6
2	2	4	8
2	2	5	NULL
4	3	0	0
4	3	1	2
4	3	2	4
4	3	2	6
4	3	4	8
4	3	5	NULL
6	NULL	0	0
6	NULL	1	2
6	NULL	2	4
6	NULL	2	6
6	NULL	4	8
6	NULL	5	NULL
EXPLAIN BASIC SELECT /*USE_HASH(p1,p2),READ_CONSISTENCY (weak)*/ * FROM p1,p2 WHERE p1.c1 NOT IN (SELECT c1 FROM p2 WHERE c1 <>ALL (SELECT c1 FROM p1) AND c1 IS NOT NULL) ORDER BY 1,2,3,4;
Query Plan
=========================================
|ID|OPERATOR                      |NAME |
-----------------------------------------
|0 |SORT                          |     |
|1 |└─NESTED-LOOP JOIN CARTESIAN  |     |
|2 |  ├─TABLE FULL SCAN           |p2   |
|3 |  └─MATERIAL                  |     |
|4 |    └─HASH RIGHT ANTI JOIN SNA|     |
|5 |      ├─SUBPLAN SCAN          |VIEW2|
|6 |      │ └─HASH ANTI JOIN NA   |     |
|7 |      │   ├─TABLE FULL SCAN   |p2   |
|8 |      │   └─TABLE FULL SCAN   |p1   |
|9 |      └─TABLE FULL SCAN       |p1   |
=========================================
Outputs & filters:
-------------------------------------
  0 - output([p1.c0], [p1.c1], [p2.c0], [p2.c1]), filter(nil), rowset=16
      sort_keys([p1.c0, ASC], [p1.c1, ASC], [p2.c0, ASC], [p2.c1, ASC])
  1 - output([p1.c0], [p1.c1], [p2.c0], [p2.c1]), filter(nil), rowset=16
      conds(nil), nl_params_(nil), use_batch=false
  2 - output([p2.c0], [p2.c1]), filter(nil), rowset=16
      access([p2.c0], [p2.c1]), partitions(p0)
      is_index_back=false, is_global_index=false, 
      range_key([p2.__pk_increment]), range(MIN ; MAX)always true
  3 - output([p1.c0], [p1.c1]), filter(nil), rowset=16
  4 - output([p1.c0], [p1.c1]), filter(nil), rowset=16
      equal_conds([cast(p1.c1, DOUBLE(11, 0)) = VIEW2.c1]), other_conds(nil)
  5 - output([VIEW2.c1]), filter(nil), rowset=16
      access([VIEW2.c1])
  6 - output([p2.c1]), filter(nil), rowset=16
      equal_conds([p2.c1 = cast(p1.c1, DOUBLE(11, 0))]), other_conds(nil)
  7 - output([p2.c1]), filter([p2.c1 IS NOT NULL]), rowset=16
      access([p2.c1]), partitions(p0)
      is_index_back=false, is_global_index=false, filter_before_indexback[false], 
      range_key([p2.__pk_increment]), range(MIN ; MAX)always true
  8 - output([p1.c1]), filter(nil), rowset=16
      access([p1.c1]), partitions(p0)
      is_index_back=false, is_global_index=false, 
      range_key([p1.__pk_increment]), range(MIN ; MAX)always true
  9 - output([p1.c1], [p1.c0]), filter(nil), rowset=16
      access([p1.c1], [p1.c0]), partitions(p0)
      is_index_back=false, is_global_index=false, 
      range_key([p1.__pk_increment]), range(MIN ; MAX)always true
SELECT /*+parallel(5) USE_HASH(p1,p2)*/ * FROM p1 JOIN p2 ON p1.c0=p2.c0 WHERE p1.c1 NOT IN (SELECT c1 FROM p2 WHERE c1 IS NOT NULL) ORDER BY 1,2,3,4;
c0	c1	c0	c1
1	1	1	2
2	1	2	4
2	1	2	6
4	3	4	8
EXPLAIN BASIC SELECT /*+parallel(5) USE_HASH(p1,p2),READ_CONSISTENCY (weak)*/ * FROM p1 JOIN p2 ON p1.c0=p2.c0 WHERE p1.c1 NOT IN (SELECT c1 FROM p2 WHERE c1 IS NOT NULL) ORDER BY 1,2,3,4;
Query Plan
==========================================================
|ID|OPERATOR                                    |NAME    |
----------------------------------------------------------
|0 |PX COORDINATOR MERGE SORT                   |        |
|1 |└─EXCHANGE OUT DISTR                        |:EX10002|
|2 |  └─SORT                                    |        |
|3 |    └─SHARED HASH JOIN                      |        |
|4 |      ├─EXCHANGE IN DISTR                   |        |
|5 |      │ └─EXCHANGE OUT DISTR (BC2HOST)      |:EX10001|
|6 |      │   └─SHARED HASH RIGHT ANTI JOIN SNA |        |
|7 |      │     ├─EXCHANGE IN DISTR             |        |
|8 |      │     │ └─EXCHANGE OUT DISTR (BC2HOST)|:EX10000|
|9 |      │     │   └─SUBPLAN SCAN              |VIEW1   |
|10|      │     │     └─PX BLOCK ITERATOR       |        |
|11|      │     │       └─TABLE FULL SCAN       |p2      |
|12|      │     └─PX BLOCK ITERATOR             |        |
|13|      │       └─TABLE FULL SCAN             |p1      |
|14|      └─PX BLOCK ITERATOR                   |        |
|15|        └─TABLE FULL SCAN                   |p2      |
==========================================================
Outputs & filters:
-------------------------------------
  0 - output([INTERNAL_FUNCTION(p1.c0, p1.c1, p2.c0, p2.c1)]), filter(nil), rowset=16
      sort_keys([p1.c0, ASC], [p1.c1, ASC], [p2.c1, ASC])
  1 - output([p1.c0], [p1.c1], [p2.c1], [INTERNAL_FUNCTION(p1.c0, p1.c1, p2.c0, p2.c1)]), filter(nil), rowset=16
      dop=5
  2 - output([p1.c0], [p1.c1], [p2.c1], [p2.c0]), filter(nil), rowset=16
      sort_keys([p1.c0, ASC], [p1.c1, ASC], [p2.c1, ASC])
  3 - output([p1.c0], [p1.c1], [p2.c1], [p2.c0]), filter(nil), rowset=16
      equal_conds([p1.c0 = p2.c0]), other_conds(nil)
  4 - output([p1.c0], [p1.c1]), filter(nil), rowset=16
  5 - output([p1.c0], [p1.c1]), filter(nil), rowset=16
      dop=5
  6 - output([p1.c0], [p1.c1]), filter(nil), rowset=16
      equal_conds([cast(p1.c1, DOUBLE(11, 0)) = VIEW1.c1]), other_conds(nil)
  7 - output([VIEW1.c1]), filter(nil), rowset=16
  8 - output([VIEW1.c1]), filter(nil), rowset=16
      dop=5
  9 - output([VIEW1.c1]), filter(nil), rowset=16
      access([VIEW1.c1])
 10 - output([p2.c1]), filter(nil), rowset=16
 11 - output([p2.c1]), filter([p2.c1 IS NOT NULL]), rowset=16
      access([p2.c1]), partitions(p0)
      is_index_back=false, is_global_index=false, filter_before_indexback[false], 
      range_key([p2.__pk_increment]), range(MIN ; MAX)always true
 12 - output([p1.c0], [p1.c1]), filter(nil), rowset=16
 13 - output([p1.c0], [p1.c1]), filter(nil), rowset=16
      access([p1.c0], [p1.c1]), partitions(p0)
      is_index_back=false, is_global_index=false, 
      range_key([p1.__pk_increment]), range(MIN ; MAX)always true
 14 - output([p2.c0], [p2.c1]), filter(nil), rowset=16
 15 - output([p2.c0], [p2.c1]), filter(nil), rowset=16
      access([p2.c0], [p2.c1]), partitions(p0)
      is_index_back=false, is_global_index=false, 
      range_key([p2.__pk_increment]), range(MIN ; MAX)always true
SELECT /*+parallel(2) USE_HASH(p1,p2)*/ * FROM p1  WHERE c1 <>ALL (SELECT c1 FROM p2 WHERE NOT EXISTS(SELECT c1 FROM p1 WHERE c1 IS NOT NULL)) ORDER BY p1.c0,p1.c1;
c0	c1
0	0
1	1
2	1
2	2
4	3
6	NULL
EXPLAIN BASIC SELECT /*+parallel(2) USE_HASH(p1,p2),READ_CONSISTENCY (weak)*/ * FROM p1  WHERE c1 <>ALL (SELECT c1 FROM p2 WHERE NOT EXISTS(SELECT c1 FROM p1 WHERE c1 IS NOT NULL)) ORDER BY p1.c0,p1.c1;
Query Plan
=========================================================
|ID|OPERATOR                                   |NAME    |
---------------------------------------------------------
|0 |PX COORDINATOR MERGE SORT                  |        |
|1 |└─EXCHANGE OUT DISTR                       |:EX10002|
|2 |  └─SORT                                   |        |
|3 |    └─SHARED HASH RIGHT ANTI JOIN NA       |        |
|4 |      ├─EXCHANGE IN DISTR                  |        |
|5 |      │ └─EXCHANGE OUT DISTR (BC2HOST)     |:EX10001|
|6 |      │   └─MATERIAL                       |        |
|7 |      │     └─SUBPLAN SCAN                 |VIEW1   |
|8 |      │       └─SUBPLAN FILTER             |        |
|9 |      │         ├─MATERIAL                 |        |
|10|      │         │ └─PX COORDINATOR         |        |
|11|      │         │   └─EXCHANGE OUT DISTR   |:EX20000|
|12|      │         │     └─PX BLOCK ITERATOR  |        |
|13|      │         │       └─TABLE FULL SCAN  |p2      |
|14|      │         └─LIMIT                    |        |
|15|      │           └─EXCHANGE IN DISTR      |        |
|16|      │             └─EXCHANGE OUT DISTR   |:EX10000|
|17|      │               └─LIMIT              |        |
|18|      │                 └─PX BLOCK ITERATOR|        |
|19|      │                   └─TABLE FULL SCAN|p1      |
|20|      └─PX BLOCK ITERATOR                  |        |
|21|        └─TABLE FULL SCAN                  |p1      |
=========================================================
Outputs & filters:
-------------------------------------
  0 - output([INTERNAL_FUNCTION(p1.c0, p1.c1)]), filter(nil), rowset=16
      sort_keys([p1.c0, ASC], [p1.c1, ASC])
  1 - output([p1.c0], [p1.c1], [INTERNAL_FUNCTION(p1.c0, p1.c1)]), filter(nil), rowset=16
      dop=2
  2 - output([p1.c0], [p1.c1]), filter(nil), rowset=16
      sort_keys([p1.c0, ASC], [p1.c1, ASC])
  3 - output([p1.c0], [p1.c1]), filter(nil), rowset=16
      equal_conds([cast(p1.c1, DOUBLE(11, 0)) = VIEW1.c1]), other_conds(nil)
  4 - output([VIEW1.c1]), filter(nil), rowset=16
  5 - output([VIEW1.c1]), filter(nil), rowset=16
      is_single, dop=1
  6 - output([VIEW1.c1]), filter(nil), rowset=16
  7 - output([VIEW1.c1]), filter(nil), rowset=16
      access([VIEW1.c1])
  8 - output([p2.c1]), filter(nil), rowset=16
      exec_params_(nil), onetime_exprs_([(T_OP_NOT_EXISTS, subquery(1))(:0)]), init_plan_idxs_(nil), use_batch=false
  9 - output([p2.c1]), filter(nil), startup_filter([:0]), rowset=16
 10 - output([p2.c1]), filter(nil), rowset=16
 11 - output([p2.c1]), filter(nil), rowset=16
      dop=2
 12 - output([p2.c1]), filter(nil), rowset=16
 13 - output([p2.c1]), filter(nil), rowset=16
      access([p2.c1]), partitions(p0)
      is_index_back=false, is_global_index=false, 
      range_key([p2.__pk_increment]), range(MIN ; MAX)always true
 14 - output([1]), filter(nil), rowset=16
      limit(1), offset(nil)
 15 - output(nil), filter(nil), rowset=16
 16 - output(nil), filter(nil), rowset=16
      dop=2
 17 - output(nil), filter(nil), rowset=16
      limit(1), offset(nil)
 18 - output(nil), filter(nil), rowset=16
 19 - output(nil), filter([p1.c1 IS NOT NULL]), rowset=16
      access([p1.c1]), partitions(p0)
      limit(1), offset(nil), is_index_back=false, is_global_index=false, filter_before_indexback[false], 
      range_key([p1.__pk_increment]), range(MIN ; MAX)always true
 20 - output([p1.c1], [p1.c0]), filter(nil), rowset=16
 21 - output([p1.c1], [p1.c0]), filter(nil), rowset=16
      access([p1.c1], [p1.c0]), partitions(p0)
      is_index_back=false, is_global_index=false, 
      range_key([p1.__pk_increment]), range(MIN ; MAX)always true
INSERT INTO p1 SELECT c0,c1 FROM p2 WHERE c1 NOT IN (SELECT c1 FROM p1);
SELECT * FROM p1 ORDER BY c0,c1;
c0	c1
0	0
1	1
2	1
2	2
4	3
6	NULL
EXPLAIN BASIC INSERT INTO p1 SELECT c0,c1 FROM p2 WHERE c1 NOT IN (SELECT c1 FROM p1);
INSERT INTO p2 SELECT c0,c1 FROM p2 WHERE NOT EXISTS (SELECT c1 FROM p1);
SELECT * FROM p2 ORDER BY c0,c1;
c0	c1
0	0
1	2
2	4
2	6
4	8
5	NULL
EXPLAIN BASIC INSERT INTO p2 SELECT /*+READ_CONSISTENCY (weak)*/ c0,c1 FROM p2 WHERE NOT EXISTS (SELECT c1 FROM p1);
INSERT INTO p2 SELECT /*+parallel(2) USE_MERGE(p1) */ * FROM p1 WHERE c1 IN (SELECT c1 FROM p2 WHERE c1 NOT IN (SELECT c1 FROM p1));
SELECT * FROM p2 ORDER BY c0,c1;
c0	c1
0	0
1	2
2	4
2	6
4	8
5	NULL
EXPLAIN BASIC INSERT INTO p2 SELECT /*+parallel(2) USE_MERGE(p1) ,READ_CONSISTENCY (weak)*/ * FROM p1 WHERE c1 IN (SELECT c1 FROM p2 WHERE c1 NOT IN (SELECT c1 FROM p1));
INSERT INTO p2 SELECT c0,c1 FROM p2 WHERE c1 IN (SELECT c1 FROM p1 WHERE c1 NOT IN (SELECT c1 FROM p2 WHERE c1 IS NOT NULL));
SELECT * FROM p2 ORDER BY c0,c1;
c0	c1
0	0
1	2
2	4
2	6
4	8
5	NULL
EXPLAIN BASIC INSERT INTO p2 SELECT /*+READ_CONSISTENCY (weak)*/ c0,c1 FROM p2 WHERE c1 IN (SELECT c1 FROM p1 WHERE c1 NOT IN (SELECT c1 FROM p2 WHERE c1 IS NOT NULL));
UPDATE p1 SET c1=c1+1 WHERE p1.c1 NOT IN (SELECT c1 FROM p2);
SELECT * FROM p1 ORDER BY c0,c1;
c0	c1
0	0
1	1
2	1
2	2
4	3
6	NULL
EXPLAIN BASIC UPDATE p1 SET c1=c1+1 WHERE p1.c1 NOT IN (SELECT c1 FROM p2);
UPDATE (SELECT p1.c1 FROM p1 WHERE p1.c1 <>ALL (SELECT c1 FROM p2)) SET c1=c1+1;
ERROR HY000: The target table ANONYMOUS_VIEW1 of the UPDATE is not updatable
UPDATE p1 SET c1=c1+1 WHERE NOT EXISTS (SELECT c1 FROM p2);
SELECT * FROM p1 ORDER BY c0,c1;
c0	c1
0	0
1	1
2	1
2	2
4	3
6	NULL
EXPLAIN BASIC UPDATE p1 SET c1=c1+1 WHERE NOT EXISTS (SELECT c1 FROM p2);
UPDATE p1 SET c1=c1+1 WHERE p1.c1 NOT IN (SELECT /*+parallel(2) USE_NLJ(p2) */ c1 FROM p2 WHERE c1 IN(SELECT c1 FROM p1));
SELECT * FROM p1 ORDER BY c0,c1;
c0	c1
0	0
1	2
2	2
2	2
4	4
6	NULL
EXPLAIN BASIC UPDATE p1 SET c1=c1+1 WHERE p1.c1 NOT IN (SELECT /*+parallel(2) USE_NLJ(p2),READ_CONSISTENCY (weak) */ c1 FROM p2 WHERE c1 IN(SELECT c1 FROM p1));
UPDATE p1 SET c1=c1+1 WHERE p1.c1 <>ALL (SELECT p2.c1 FROM t1 JOIN p2 ON t1.c0=p2.c0 AND p2.c1 NOT IN (SELECT c1 FROM t1));
SELECT * FROM p1 ORDER BY c0,c1;
c0	c1
0	1
1	3
2	3
2	3
4	5
6	NULL
EXPLAIN BASIC UPDATE p1 SET c1=c1+1 WHERE p1.c1 <>ALL (SELECT /*+READ_CONSISTENCY (weak)*/ p2.c1 FROM p1 JOIN p2 ON p1.c0=p2.c0 AND p2.c1 NOT IN (SELECT c1 FROM t1));
UPDATE p1 SET c1=c1+1 WHERE p1.c1 NOT IN (SELECT /*+parallel(5) USE_HASH(p2) */ c1 FROM p2 WHERE c1 <>ALL(SELECT c1 FROM p1 WHERE c1 IS NOT NULL));
SELECT * FROM p1 ORDER BY c0,c1;
c0	c1
0	2
1	4
2	4
2	4
4	6
6	NULL
EXPLAIN BASIC UPDATE p1 SET c1=c1+1 WHERE p1.c1 NOT IN (SELECT /*+parallel(5) USE_HASH(p2),READ_CONSISTENCY (weak) */ c1 FROM p2 WHERE c1 <>ALL(SELECT c1 FROM p1 WHERE c1 IS NOT NULL));
DROP TABLE IF EXISTS t2;
DROP TABLE IF EXISTS t1;
