purge recyclebin;
# 环境清理
DROP USER zhang;
ERROR HY000: Operation DROP USER failed for 'zhang'@'%'
CREATE USER 'zhang'@'%' IDENTIFIED BY 'zhang';
GRANT all ON *.* TO 'zhang'@'%';
CREATE DATABASE IF NOT EXISTS naaj_test;
USE naaj_test;
################Setting ''_ optimizer_ null_ aware_ Antijoin 'is ON################
SET _optimizer_null_aware_antijoin=ON;
#设置超时等待时间
SET wait_timeout=30000000;
SET ob_trx_timeout = 30000000;
SET ob_query_timeout = 30000000;
#Insert subquery
DROP TABLE IF EXISTS t2;
DROP TABLE IF EXISTS t1;
CREATE TABLE t1(c0 INT,c1 CHAR(10));
CREATE TABLE t2(c0 INT,c1 VARCHAR(10));
INSERT INTO t2 VALUES(0,'A'),(1,'中文'),(2,'# $ :'),(2,'12'),(4,22),(5,''),(6,NULL);
INSERT INTO t1 VALUES(0,'A'),(1,'中'),(2,'# $ :'),(2,'11'),(4,23),(5,NULL);
SELECT * FROM t2 ORDER BY c0;
c0	c1
0	A
1	中文
2	# $ :
2	12
4	22
5	
6	NULL
SELECT * FROM t1 ORDER BY c0;
c0	c1
0	A
1	中
2	# $ :
2	11
4	23
5	NULL
INSERT INTO t2 SELECT c0,c1 FROM t2 WHERE c1 NOT IN (SELECT c1 FROM t1);
SELECT * FROM t2 ORDER BY c0,c1;
c0	c1
0	A
1	中文
2	# $ :
2	12
4	22
5	
6	NULL
EXPLAIN BASIC INSERT INTO t2 SELECT /*+READ_CONSISTENCY (weak)*/ c0,c1 FROM t2 WHERE c1 NOT IN (SELECT c1 FROM t1);
INSERT INTO t2 SELECT c0,c1 FROM t2 WHERE c1 NOT IN (SELECT c1 FROM t2);
SELECT * FROM t2 ORDER BY c0,c1;
c0	c1
0	A
1	中文
2	# $ :
2	12
4	22
5	
6	NULL
EXPLAIN BASIC INSERT INTO t2 SELECT /*+READ_CONSISTENCY (weak)*/ c0,c1 FROM t2 WHERE c1 NOT IN (SELECT c1 FROM t2);
INSERT INTO t2 SELECT c0,c1 FROM t2 WHERE c1 <>ALL (SELECT c1 FROM t1);
SELECT * FROM t2 ORDER BY c0,c1;
c0	c1
0	A
1	中文
2	# $ :
2	12
4	22
5	
6	NULL
EXPLAIN BASIC INSERT INTO t2 SELECT /*+READ_CONSISTENCY (weak)*/ c0,c1 FROM t2 WHERE c1 <>ALL (SELECT c1 FROM t1);
INSERT INTO t2 SELECT c0,c1 FROM t2 WHERE c1 <>ALL (SELECT c1 FROM t2);
SELECT * FROM t2 ORDER BY c0,c1;
c0	c1
0	A
1	中文
2	# $ :
2	12
4	22
5	
6	NULL
EXPLAIN BASIC INSERT INTO t2 SELECT /*+READ_CONSISTENCY (weak)*/ c0,c1 FROM t2 WHERE c1 <>ALL (SELECT c1 FROM t2);
INSERT INTO t2 SELECT c0,c1 FROM t2 WHERE NOT EXISTS (SELECT c1 FROM t1);
SELECT * FROM t2 ORDER BY c0,c1;
c0	c1
0	A
1	中文
2	# $ :
2	12
4	22
5	
6	NULL
EXPLAIN BASIC INSERT INTO t2 SELECT /*+READ_CONSISTENCY (weak)*/ c0,c1 FROM t2 WHERE NOT EXISTS (SELECT c1 FROM t1);
INSERT INTO t2 SELECT c0,c1 FROM t2 WHERE c1 NOT IN (NULL,'A','11');
SELECT * FROM t2 ORDER BY c0,c1;
c0	c1
0	A
1	中文
2	# $ :
2	12
4	22
5	
6	NULL
EXPLAIN BASIC INSERT INTO t2 SELECT /*+READ_CONSISTENCY (weak)*/ c0,c1 FROM t2 WHERE c1 NOT IN (NULL,'A','11');
INSERT INTO t2 SELECT c0,c1 FROM t2 WHERE c1 <>ALL (NULL,'A','11');
ERROR 42000: You have an error in your SQL syntax; check the manual that corresponds to your OceanBase version for the right syntax to use near 'NULL,'A','11')' at line 1
DROP TABLE IF EXISTS t2;
DROP TABLE IF EXISTS t1;
CREATE TABLE t1(c0 INT,c1 CHAR(10));
CREATE TABLE t2(c0 INT,c1 VARCHAR(10));
INSERT INTO t2 VALUES(0,'A'),(1,'中文'),(2,'# $ :'),(2,'12'),(4,22),(5,''),(6,NULL);
INSERT INTO t1 VALUES(0,'A'),(1,'中'),(2,'# $ :'),(2,'11'),(4,23),(5,NULL);
SELECT * FROM t2 ORDER BY c0;
c0	c1
0	A
1	中文
2	# $ :
2	12
4	22
5	
6	NULL
SELECT * FROM t1 ORDER BY c0;
c0	c1
0	A
1	中
2	# $ :
2	11
4	23
5	NULL
INSERT INTO t2 SELECT c0,c1 FROM t2 WHERE c1 IN (SELECT c1 FROM t1 WHERE c1 NOT IN (SELECT c1 FROM t2));
SELECT * FROM t2 ORDER BY c0,c1;
c0	c1
0	A
1	中文
2	# $ :
2	12
4	22
5	
6	NULL
EXPLAIN BASIC INSERT INTO t2 SELECT /*+READ_CONSISTENCY (weak)*/ c0,c1 FROM t2 WHERE c1 IN (SELECT c1 FROM t1 WHERE c1 NOT IN (SELECT c1 FROM t2));
INSERT INTO t2 SELECT c0,c1 FROM t2 WHERE c1 <> (SELECT c1 FROM t1 WHERE c1 <>ALL (SELECT c1 FROM t2));
SELECT * FROM t2 ORDER BY c0,c1;
c0	c1
0	A
1	中文
2	# $ :
2	12
4	22
5	
6	NULL
EXPLAIN BASIC INSERT INTO t2 SELECT /*+READ_CONSISTENCY (weak)*/ c0,c1 FROM t2 WHERE c1 <> (SELECT c1 FROM t1 WHERE c1 <>ALL (SELECT c1 FROM t2));
INSERT INTO t2(c1) SELECT c1 FROM t2 WHERE NOT EXISTS (SELECT c1 FROM t1 WHERE c1 <>ALL (SELECT c1 FROM t2));
SELECT * FROM t2 ORDER BY c0,c1;
c0	c1
NULL	NULL
NULL	
NULL	# $ :
NULL	12
NULL	22
NULL	A
NULL	中文
0	A
1	中文
2	# $ :
2	12
4	22
5	
6	NULL
EXPLAIN BASIC INSERT INTO t2(c1) SELECT /*+READ_CONSISTENCY (weak)*/ c1 FROM t2 WHERE NOT EXISTS (SELECT c1 FROM t1 WHERE c1 <>ALL (SELECT c1 FROM t2));
INSERT INTO t2 SELECT c0,c1 FROM t2 WHERE c1 IN (SELECT c1 FROM t1 WHERE c1 NOT IN (NULL));
SELECT * FROM t2 ORDER BY c0,c1;
c0	c1
NULL	NULL
NULL	
NULL	# $ :
NULL	12
NULL	22
NULL	A
NULL	中文
0	A
1	中文
2	# $ :
2	12
4	22
5	
6	NULL
EXPLAIN BASIC INSERT INTO t2 SELECT /*+READ_CONSISTENCY (weak)*/ c0,c1 FROM t2 WHERE c1 IN (SELECT c1 FROM t1 WHERE c1 NOT IN (NULL));
INSERT INTO t2 SELECT c0,c1 FROM t2 WHERE c1 <>ALL (SELECT t1.c1 FROM t1 JOIN t2 ON t1.c0=t2.c0 AND t1.c1 NOT IN (SELECT c1 FROM t2));
SELECT * FROM t2 ORDER BY c0,c1;
c0	c1
NULL	NULL
NULL	NULL
NULL	
NULL	
NULL	# $ :
NULL	# $ :
NULL	12
NULL	12
NULL	22
NULL	22
NULL	A
NULL	A
NULL	中文
NULL	中文
0	A
0	A
1	中文
1	中文
2	# $ :
2	# $ :
2	12
2	12
4	22
4	22
5	
5	
6	NULL
6	NULL
EXPLAIN BASIC INSERT INTO t2 SELECT /*+READ_CONSISTENCY (weak)*/ c0,c1 FROM t2 WHERE c1 <>ALL (SELECT t1.c1 FROM t1 JOIN t2 ON t1.c0=t2.c0 AND t1.c1 NOT IN (SELECT c1 FROM t2));
INSERT INTO t2 SELECT c0,c1 FROM t2 WHERE c1 IN (SELECT t1.c1 FROM t1 JOIN t2 ON t1.c0=t2.c0 AND t1.c1 NOT IN (SELECT c1 FROM t2));
SELECT * FROM t2 ORDER BY c0,c1;
c0	c1
NULL	NULL
NULL	NULL
NULL	
NULL	
NULL	# $ :
NULL	# $ :
NULL	12
NULL	12
NULL	22
NULL	22
NULL	A
NULL	A
NULL	中文
NULL	中文
0	A
0	A
1	中文
1	中文
2	# $ :
2	# $ :
2	12
2	12
4	22
4	22
5	
5	
6	NULL
6	NULL
EXPLAIN BASIC INSERT INTO t2 SELECT /*+READ_CONSISTENCY (weak)*/ c0,c1 FROM t2 WHERE c1 IN (SELECT t1.c1 FROM t1 JOIN t2 ON t1.c0=t2.c0 AND t1.c1 NOT IN (SELECT c1 FROM t2));
DROP TABLE IF EXISTS t2;
DROP TABLE IF EXISTS t1;
CREATE TABLE t1(c0 INT,c1 CHAR(10));
CREATE TABLE t2(c0 INT,c1 VARCHAR(10));
INSERT INTO t2 VALUES(0,'A'),(1,'中文'),(2,'# $ :'),(2,'12'),(4,22),(5,''),(6,NULL);
INSERT INTO t1 VALUES(0,'A'),(1,'中'),(2,'# $ :'),(2,'11'),(4,23),(5,NULL);
SELECT * FROM t2 ORDER BY c0;
c0	c1
0	A
1	中文
2	# $ :
2	12
4	22
5	
6	NULL
SELECT * FROM t1 ORDER BY c0;
c0	c1
0	A
1	中
2	# $ :
2	11
4	23
5	NULL
INSERT INTO t2 SELECT /*+USE_HASH(t1) */ * FROM t1 WHERE c1 NOT IN (SELECT c1 FROM t2);
SELECT * FROM t2 ORDER BY c0,c1;
c0	c1
0	A
1	中文
2	# $ :
2	12
4	22
5	
6	NULL
EXPLAIN BASIC INSERT INTO t2 SELECT /*+USE_HASH(t1) READ_CONSISTENCY (weak)*/ * FROM t1 WHERE c1 NOT IN (SELECT c1 FROM t2);
INSERT INTO t2 SELECT /*+USE_NLJ(t2) */ * FROM t2 WHERE c1 <>ALL (SELECT c1 FROM t1);
SELECT * FROM t2 ORDER BY c0,c1;
c0	c1
0	A
1	中文
2	# $ :
2	12
4	22
5	
6	NULL
EXPLAIN BASIC INSERT INTO t2 SELECT /*+USE_NLJ(t2) READ_CONSISTENCY (weak)*/ * FROM t2 WHERE c1 <>ALL (SELECT c1 FROM t1);
INSERT INTO t2 SELECT /*+USE_NLJ(t2) */ * FROM t2 WHERE NOT EXISTS (SELECT c1 FROM t1);
SELECT * FROM t2 ORDER BY c0,c1;
c0	c1
0	A
1	中文
2	# $ :
2	12
4	22
5	
6	NULL
EXPLAIN BASIC INSERT INTO t2 SELECT /*+USE_NLJ(t2) READ_CONSISTENCY (weak)*/ * FROM t2 WHERE NOT EXISTS (SELECT c1 FROM t1);
INSERT INTO t2 SELECT /*+parallel(5) USE_HASH(t1) */ * FROM t1 WHERE c1 NOT IN (SELECT c1 FROM t2);
SELECT * FROM t2 ORDER BY c0,c1;
c0	c1
0	A
1	中文
2	# $ :
2	12
4	22
5	
6	NULL
EXPLAIN BASIC INSERT INTO t2 SELECT /*+parallel(5) USE_HASH(t1) READ_CONSISTENCY (weak)*/ * FROM t1 WHERE c1 NOT IN (SELECT c1 FROM t2);
INSERT INTO t2 SELECT /*+parallel(5) USE_MERGE(t1) */ * FROM t1 WHERE c1 <>ALL (SELECT c1 FROM t1);
SELECT * FROM t2 ORDER BY c0,c1;
c0	c1
0	A
1	中文
2	# $ :
2	12
4	22
5	
6	NULL
EXPLAIN BASIC INSERT INTO t2 SELECT /*+parallel(5) USE_NLJ(t1) READ_CONSISTENCY (weak)*/ * FROM t1 WHERE c1 <>ALL (SELECT c1 FROM t1);
INSERT INTO t2 SELECT /*+parallel(5) USE_HASH(t1) */ * FROM t1 WHERE NOT EXISTS (SELECT c1 FROM t1);
SELECT * FROM t2 ORDER BY c0,c1;
c0	c1
0	A
1	中文
2	# $ :
2	12
4	22
5	
6	NULL
EXPLAIN BASIC INSERT INTO t2 SELECT /*+parallel(5) USE_HASH(t1) READ_CONSISTENCY (weak)*/ * FROM t1 WHERE NOT EXISTS (SELECT c1 FROM t1);
INSERT INTO t2 SELECT /*+parallel(2) USE_MERGE(t1) */ * FROM t1 WHERE c1 IN (SELECT c1 FROM t2 WHERE c1 NOT IN (SELECT c1 FROM t1));
SELECT * FROM t2 ORDER BY c0,c1;
c0	c1
0	A
1	中文
2	# $ :
2	12
4	22
5	
6	NULL
EXPLAIN BASIC INSERT INTO t2 SELECT /*+parallel(2) USE_HASH(t1) READ_CONSISTENCY (weak)*/ * FROM t1 WHERE c1 IN (SELECT c1 FROM t2 WHERE c1 NOT IN (SELECT c1 FROM t1));
Query Plan
=====================================================================
|ID|OPERATOR                                        |NAME           |
---------------------------------------------------------------------
|0 |INSERT                                          |               |
|1 |└─PX COORDINATOR                                |               |
|2 |  └─EXCHANGE OUT DISTR                          |:EX10002       |
|3 |    └─SUBPLAN SCAN                              |ANONYMOUS_VIEW1|
|4 |      └─SHARED HASH RIGHT SEMI JOIN             |               |
|5 |        ├─EXCHANGE IN DISTR                     |               |
|6 |        │ └─EXCHANGE OUT DISTR (BC2HOST)        |:EX10001       |
|7 |        │   └─SUBPLAN SCAN                      |VIEW2          |
|8 |        │     └─SHARED HASH RIGHT ANTI JOIN NA  |               |
|9 |        │       ├─EXCHANGE IN DISTR             |               |
|10|        │       │ └─EXCHANGE OUT DISTR (BC2HOST)|:EX10000       |
|11|        │       │   └─PX BLOCK ITERATOR         |               |
|12|        │       │     └─TABLE FULL SCAN         |t1             |
|13|        │       └─PX BLOCK ITERATOR             |               |
|14|        │         └─TABLE FULL SCAN             |t2             |
|15|        └─PX BLOCK ITERATOR                     |               |
|16|          └─TABLE FULL SCAN                     |t1             |
=====================================================================
Outputs & filters:
-------------------------------------
  0 - output(nil), filter(nil)
      columns([{t2: ({t2: (t2.__pk_increment, t2.c0, t2.c1)})}]), partitions(p0), 
      column_values([T_HIDDEN_PK], [column_conv(INT,PS:(11,0),NULL,ANONYMOUS_VIEW1.c0)], [column_conv(VARCHAR,utf8mb4_general_ci,length:10,NULL,cast(ANONYMOUS_VIEW1.c1,
       VARCHAR(1048576)))])
  1 - output([ANONYMOUS_VIEW1.c0], [ANONYMOUS_VIEW1.c1]), filter(nil), rowset=16
  2 - output([ANONYMOUS_VIEW1.c0], [ANONYMOUS_VIEW1.c1]), filter(nil), rowset=16
      dop=2
  3 - output([ANONYMOUS_VIEW1.c0], [ANONYMOUS_VIEW1.c1]), filter(nil), rowset=16
      access([ANONYMOUS_VIEW1.c0], [ANONYMOUS_VIEW1.c1])
  4 - output([t1.c0], [t1.c1]), filter(nil), rowset=16
      equal_conds([t1.c1 = VIEW2.c1]), other_conds(nil)
  5 - output([VIEW2.c1]), filter(nil), rowset=16
  6 - output([VIEW2.c1]), filter(nil), rowset=16
      dop=2
  7 - output([VIEW2.c1]), filter(nil), rowset=16
      access([VIEW2.c1])
  8 - output([t2.c1]), filter(nil), rowset=16
      equal_conds([t2.c1 = t1.c1]), other_conds(nil)
  9 - output([t1.c1]), filter(nil), rowset=16
 10 - output([t1.c1]), filter(nil), rowset=16
      dop=2
 11 - output([t1.c1]), filter(nil), rowset=16
 12 - output([t1.c1]), filter(nil), rowset=16
      access([t1.c1]), partitions(p0)
      is_index_back=false, is_global_index=false, 
      range_key([t1.__pk_increment]), range(MIN ; MAX)always true
 13 - output([t2.c1]), filter(nil), rowset=16
 14 - output([t2.c1]), filter(nil), rowset=16
      access([t2.c1]), partitions(p0)
      is_index_back=false, is_global_index=false, 
      range_key([t2.__pk_increment]), range(MIN ; MAX)always true
 15 - output([t1.c1], [t1.c0]), filter(nil), rowset=16
 16 - output([t1.c1], [t1.c0]), filter(nil), rowset=16
      access([t1.c1], [t1.c0]), partitions(p0)
      is_index_back=false, is_global_index=false, 
      range_key([t1.__pk_increment]), range(MIN ; MAX)always true
INSERT INTO t2 SELECT /*+parallel(2) USE_NLJ(t1) */ * FROM t1 WHERE c1 <> (SELECT c1 FROM t1 WHERE c1 <>ALL (SELECT c1 FROM t2));
SELECT * FROM t2 ORDER BY c0,c1;
c0	c1
0	A
1	中文
2	# $ :
2	12
4	22
5	
6	NULL
EXPLAIN BASIC INSERT INTO t2 SELECT /*+parallel(2) USE_HASH(t1) READ_CONSISTENCY (weak)*/ * FROM t1 WHERE c1 <> (SELECT c1 FROM t1 WHERE c1 <>ALL (SELECT c1 FROM t2));
INSERT INTO t2 SELECT c0,c1 FROM t2 WHERE c1 NOT IN (SELECT c1 FROM t2 WHERE c1 IS NOT NULL);
SELECT * FROM t2 ORDER BY c0,c1;
c0	c1
0	A
1	中文
2	# $ :
2	12
4	22
5	
6	NULL
EXPLAIN BASIC INSERT INTO t2 SELECT /*+READ_CONSISTENCY (weak)*/ c0,c1 FROM t2 WHERE c1 NOT IN (SELECT c1 FROM t2 WHERE c1 IS NOT NULL);
INSERT INTO t2 SELECT c0,c1 FROM t2 WHERE c1 <>ALL (SELECT c1 FROM t1 WHERE c1 IS NOT NULL);
SELECT * FROM t2 ORDER BY c0,c1;
c0	c1
0	A
1	中文
1	中文
2	# $ :
2	12
2	12
4	22
4	22
5	
5	
6	NULL
EXPLAIN BASIC INSERT INTO t2 SELECT /*+READ_CONSISTENCY (weak)*/ c0,c1 FROM t2 WHERE c1 <>ALL (SELECT c1 FROM t1 WHERE c1 IS NOT NULL);
INSERT INTO t2 SELECT c0,c1 FROM t2 WHERE NOT EXISTS (SELECT c1 FROM t1 WHERE c1 IS NOT NULL);
SELECT * FROM t2 ORDER BY c0,c1;
c0	c1
0	A
1	中文
1	中文
2	# $ :
2	12
2	12
4	22
4	22
5	
5	
6	NULL
EXPLAIN BASIC INSERT INTO t2 SELECT /*+READ_CONSISTENCY (weak)*/ c0,c1 FROM t2 WHERE NOT EXISTS (SELECT c1 FROM t1 WHERE c1 IS NOT NULL);
INSERT INTO t2 SELECT c0,c1 FROM t2 WHERE c1 IN (SELECT c1 FROM t1 WHERE c1 NOT IN (SELECT c1 FROM t2 WHERE c1 IS NOT NULL));
SELECT * FROM t2 ORDER BY c0,c1;
c0	c1
0	A
1	中文
1	中文
2	# $ :
2	12
2	12
4	22
4	22
5	
5	
6	NULL
EXPLAIN BASIC INSERT INTO t2 SELECT /*+READ_CONSISTENCY (weak)*/ c0,c1 FROM t2 WHERE c1 IN (SELECT c1 FROM t1 WHERE c1 NOT IN (SELECT c1 FROM t2 WHERE c1 IS NOT NULL));
DROP TABLE IF EXISTS t2;
DROP TABLE IF EXISTS t1;
CREATE TABLE t1(c0 INT,c1 CHAR(10));
CREATE TABLE t2(c0 INT,c1 VARCHAR(10));
INSERT INTO t2 VALUES(0,'A'),(1,'中文'),(2,'# $ :'),(2,'12'),(4,22),(5,''),(6,NULL);
INSERT INTO t1 VALUES(0,'A'),(1,'中'),(2,'# $ :'),(2,'11'),(4,23),(5,NULL);
SELECT * FROM t2 ORDER BY c0;
c0	c1
0	A
1	中文
2	# $ :
2	12
4	22
5	
6	NULL
SELECT * FROM t1 ORDER BY c0;
c0	c1
0	A
1	中
2	# $ :
2	11
4	23
5	NULL
INSERT INTO t2 SELECT c0,c1 FROM t2 WHERE c1 IN (SELECT t1.c1 FROM t1 JOIN t2 ON t1.c0=t2.c0 AND t1.c1 NOT IN (SELECT c1 FROM t2 WHERE c1 IS NOT NULL));
SELECT * FROM t2 ORDER BY c0,c1;
c0	c1
0	A
1	中文
2	# $ :
2	12
4	22
5	
6	NULL
EXPLAIN BASIC INSERT INTO t2 SELECT /*+READ_CONSISTENCY (weak)*/ c0,c1 FROM t2 WHERE c1 IN (SELECT t1.c1 FROM t1 JOIN t2 ON t1.c0=t2.c0 AND t1.c1 NOT IN (SELECT c1 FROM t2 WHERE c1 IS NOT NULL));
INSERT INTO t2 SELECT /*+USE_NLJ(t2) */ * FROM t2 WHERE NOT EXISTS (SELECT c1 FROM t1 WHERE c1 IS NOT NULL);
SELECT * FROM t2 ORDER BY c0,c1;
c0	c1
0	A
1	中文
2	# $ :
2	12
4	22
5	
6	NULL
EXPLAIN BASIC INSERT INTO t2 SELECT /*+USE_NLJ(t2) READ_CONSISTENCY (weak)*/ * FROM t2 WHERE NOT EXISTS (SELECT c1 FROM t1 WHERE c1 IS NOT NULL);
INSERT INTO t2 SELECT /*+parallel(5) USE_HASH(t1) */ * FROM t1 WHERE c1 <>ALL (SELECT c1 FROM t1 WHERE c1 IS NOT NULL);
SELECT * FROM t2 ORDER BY c0,c1;
c0	c1
0	A
1	中文
2	# $ :
2	12
4	22
5	
6	NULL
EXPLAIN BASIC INSERT INTO t2 SELECT /*+parallel(5) USE_MERGE(t1) READ_CONSISTENCY (weak)*/ * FROM t1 WHERE c1 <>ALL (SELECT c1 FROM t1 WHERE c1 IS NOT NULL);
INSERT INTO t2 SELECT /*+parallel(5) USE_HASH(t1) */ * FROM t1 WHERE NOT EXISTS (SELECT c1 FROM t1  WHERE c1 IS NOT NULL);
SELECT * FROM t2 ORDER BY c0,c1;
c0	c1
0	A
1	中文
2	# $ :
2	12
4	22
5	
6	NULL
EXPLAIN BASIC INSERT INTO t2 SELECT /*+parallel(5) USE_HASH(t1) READ_CONSISTENCY (weak)*/ * FROM t1 WHERE NOT EXISTS (SELECT c1 FROM t1  WHERE c1 IS NOT NULL);
INSERT INTO t2 SELECT /*+parallel(2) USE_NLJ(t1) */ * FROM t1 WHERE c1 IN (SELECT c1 FROM t2 WHERE c1 NOT IN (SELECT c1 FROM t1 WHERE c1 IS NOT NULL));
SELECT * FROM t2 ORDER BY c0,c1;
c0	c1
0	A
1	中文
2	# $ :
2	12
4	22
5	
6	NULL
EXPLAIN BASIC INSERT INTO t2 SELECT /*+parallel(2) USE_HASH(t1) READ_CONSISTENCY (weak)*/ * FROM t1 WHERE c1 IN (SELECT c1 FROM t2 WHERE c1 NOT IN (SELECT c1 FROM t1 WHERE c1 IS NOT NULL));
INSERT INTO t2(c1) SELECT c1 FROM t2 WHERE NOT EXISTS (SELECT c1 FROM t1 WHERE c1 <>ALL (SELECT c1 FROM t2 WHERE c1 IS NOT NULL));
SELECT * FROM t2 ORDER BY c0,c1;
c0	c1
0	A
1	中文
2	# $ :
2	12
4	22
5	
6	NULL
EXPLAIN BASIC INSERT INTO t2(c1) SELECT c1 FROM t2 WHERE NOT EXISTS (SELECT c1 FROM t1 WHERE c1 <>ALL (SELECT c1 FROM t2 WHERE c1 IS NOT NULL));
INSERT INTO t2 SELECT c0,c1 FROM t2 WHERE c1 <>ALL (SELECT t1.c1 FROM t1 JOIN t2 ON t1.c0=t2.c0 AND t1.c1 NOT IN (SELECT c1 FROM t2 WHERE c1 IS NOT NULL));
SELECT * FROM t2 ORDER BY c0,c1;
c0	c1
0	A
0	A
1	中文
1	中文
2	# $ :
2	# $ :
2	12
2	12
4	22
4	22
5	
5	
6	NULL
EXPLAIN BASIC INSERT INTO t2 SELECT c0,c1 FROM t2 WHERE c1 <>ALL (SELECT t1.c1 FROM t1 JOIN t2 ON t1.c0=t2.c0 AND t1.c1 NOT IN (SELECT c1 FROM t2 WHERE c1 IS NOT NULL));
INSERT INTO t2 SELECT /*+USE_HASH(t1) */ * FROM t1 WHERE c1 NOT IN (SELECT c1 FROM t2 WHERE c1 IS NOT NULL);
SELECT * FROM t2 ORDER BY c0,c1;
c0	c1
0	A
0	A
1	中
1	中文
1	中文
2	# $ :
2	# $ :
2	11
2	12
2	12
4	22
4	22
4	23
5	
5	
6	NULL
EXPLAIN BASIC INSERT INTO t2 SELECT /*+USE_MERGE(t1) READ_CONSISTENCY (weak)*/ * FROM t1 WHERE c1 NOT IN (SELECT c1 FROM t2 WHERE c1 IS NOT NULL);
INSERT INTO t2 SELECT /*+parallel(2) USE_NLJ(t1) */ * FROM t1 WHERE c1 <>ANY (SELECT c1 FROM t1 WHERE c1 <>ALL (SELECT c1 FROM t2 WHERE c1 IS NOT NULL));
SELECT * FROM t2 ORDER BY c0,c1;
c0	c1
0	A
0	A
1	中
1	中文
1	中文
2	# $ :
2	# $ :
2	11
2	12
2	12
4	22
4	22
4	23
5	
5	
6	NULL
EXPLAIN BASIC INSERT INTO t2 SELECT /*+parallel(2) USE_HASH(t1) READ_CONSISTENCY (weak)*/ * FROM t1 WHERE c1 <>ANY (SELECT c1 FROM t1 WHERE c1 <>ALL (SELECT c1 FROM t2 WHERE c1 IS NOT NULL));
#Update subquery
DROP TABLE IF EXISTS t2;
DROP TABLE IF EXISTS t1;
CREATE TABLE t1(c0 INT,c1 INT);
CREATE TABLE t2(c0 INT,c1 INT);
INSERT INTO t2 VALUES(0,0),(1,1),(2,1),(2,2),(4,3),(5,3),(6,NULL);
INSERT INTO t1 VALUES(0,0),(1,2),(2,4),(2,6),(4,8),(5,NULL);
SELECT * FROM t2 ORDER BY c0;
c0	c1
0	0
1	1
2	1
2	2
4	3
5	3
6	NULL
SELECT * FROM t1 ORDER BY c0;
c0	c1
0	0
1	2
2	4
2	6
4	8
5	NULL
UPDATE t1 SET c1=c1+1 WHERE t1.c1 NOT IN (SELECT c1 FROM t2);
SELECT * FROM t1 ORDER BY c0,c1;
c0	c1
0	0
1	2
2	4
2	6
4	8
5	NULL
EXPLAIN BASIC UPDATE t1 SET c1=c1+1 WHERE c1 NOT IN (SELECT c1 FROM t2);
UPDATE (SELECT t1.c1 FROM t1 WHERE t1.c1 NOT IN (SELECT c1 FROM t2)) SET c1=c1+1;
ERROR HY000: The target table ANONYMOUS_VIEW1 of the UPDATE is not updatable
UPDATE t1 SET c1=c1+1 WHERE t1.c1 <>ALL (SELECT c1 FROM t2);
SELECT * FROM t1 ORDER BY c0,c1;
c0	c1
0	0
1	2
2	4
2	6
4	8
5	NULL
EXPLAIN BASIC UPDATE t1 SET c1=c1+1 WHERE c1 <>ALL (SELECT c1 FROM t2);
UPDATE (SELECT t1.c1 FROM t1 WHERE t1.c1 <>ALL (SELECT c1 FROM t2)) SET c1=c1+1;
ERROR HY000: The target table ANONYMOUS_VIEW1 of the UPDATE is not updatable
UPDATE t1 SET c1=c1+1 WHERE NOT EXISTS (SELECT c1 FROM t2);
SELECT * FROM t1 ORDER BY c0,c1;
c0	c1
0	0
1	2
2	4
2	6
4	8
5	NULL
EXPLAIN BASIC UPDATE t1 SET c1=c1+1 WHERE NOT EXISTS (SELECT c1 FROM t2);
UPDATE t1 SET c1=c1+1 WHERE t1.c1 IN (SELECT c1 FROM t2 WHERE c1 NOT IN (SELECT c1 FROM (SELECT * FROM t2 WHERE c1 > 1) tt));
SELECT * FROM t1 ORDER BY c0,c1;
c0	c1
0	1
1	2
2	4
2	6
4	8
5	NULL
EXPLAIN BASIC UPDATE t1 SET c1=c1+1 WHERE t1.c1 IN (SELECT c1 FROM t2 WHERE c1 NOT IN (SELECT c1 FROM (SELECT * FROM t2 WHERE c1 > 1) tt));
UPDATE t1 SET c1=c1+1 WHERE t1.c1 NOT IN (0,1,NULL);
SELECT * FROM t1 ORDER BY c0,c1;
c0	c1
0	1
1	2
2	4
2	6
4	8
5	NULL
EXPLAIN BASIC UPDATE t1 SET c1=c1+1 WHERE c1 NOT IN (0,1,NULL);
UPDATE (SELECT t1.c1 FROM t1 WHERE t1.c1 <>ALL (0,1,NULL)) SET c1=c1+1;
ERROR 42000: You have an error in your SQL syntax; check the manual that corresponds to your OceanBase version for the right syntax to use near '0,1,NULL)) SET c1=c1+1' at line 1
UPDATE t1 SET c1=c1+1 WHERE t1.c1 <>ALL (SELECT c1 FROM t2 WHERE c1 NOT IN (0,1,NULL));
SELECT * FROM t1 ORDER BY c0,c1;
c0	c1
0	2
1	3
2	5
2	7
4	9
5	NULL
EXPLAIN BASIC UPDATE t1 SET c1=c1+1 WHERE t1.c1 <>ALL (SELECT c1 FROM t2 WHERE c1 NOT IN (0,1,NULL));
UPDATE (SELECT t1.c1 FROM t1 WHERE t1.c1 NOT IN (SELECT c1 FROM t2 WHERE c1 NOT IN (0,1,NULL))) SET c1=c1+1;
ERROR HY000: The target table ANONYMOUS_VIEW1 of the UPDATE is not updatable
UPDATE t1 SET c1=c1+1 WHERE t1.c1 IN (SELECT t2.c1 FROM (SELECT * FROM t2 WHERE c1 NOT IN(SELECT c1 FROM t2 WHERE c0 > 2)) tt, t2
WHERE t1.c0=t2.c0 AND t2.c1 NOT IN (SELECT c1 FROM (SELECT * FROM t2 WHERE c1 NOT IN(SELECT c1 FROM t2 WHERE c0 > 4)) tt));
SELECT * FROM t1 ORDER BY c0,c1;
c0	c1
0	2
1	3
2	5
2	7
4	9
5	NULL
EXPLAIN BASIC UPDATE t1 SET c1=c1+1 WHERE t1.c1 IN (SELECT t2.c1 FROM (SELECT * FROM t2 WHERE c1 NOT IN(SELECT c1 FROM t2 WHERE c0 > 2)) tt, t2
WHERE t1.c0=t2.c0 AND t2.c1 NOT IN (SELECT c1 FROM (SELECT * FROM t2 WHERE c1 NOT IN(SELECT c1 FROM t2 WHERE c0 > 4)) tt));
UPDATE (SELECT t1.c1 FROM t1 WHERE t1.c1 <>ALL (SELECT t2.c1 FROM t1 JOIN t2 ON t1.c0=t2.c0 AND t2.c1 NOT IN (SELECT c1 FROM t1))) SET c1=c1+1;
ERROR HY000: The target table ANONYMOUS_VIEW1 of the UPDATE is not updatable
UPDATE t1 SET c1=c1+1 WHERE t1.c1 <>ALL (SELECT t2.c1 FROM (SELECT * FROM t2 WHERE c0 < 4) tt
LEFT JOIN t2 ON tt.c0=t2.c0 AND t2.c1 NOT IN (SELECT c1 FROM (SELECT * FROM t2 WHERE c0 > 4) tt));
SELECT * FROM t1 ORDER BY c0,c1;
c0	c1
0	2
1	3
2	5
2	7
4	9
5	NULL
EXPLAIN BASIC UPDATE t1 SET c1=c1+1 WHERE t1.c1 <>ALL (SELECT t2.c1 FROM (SELECT * FROM t2 WHERE c0 < 4) tt
LEFT JOIN t2 ON tt.c0=t2.c0 AND t2.c1 NOT IN (SELECT c1 FROM (SELECT * FROM t2 WHERE c0 > 4) tt));
UPDATE t1 SET c1=c1+1 WHERE t1.c1 <>ALL (SELECT /*+USE_HASH(t2) */ c1 FROM t2);
SELECT * FROM t1 ORDER BY c0,c1;
c0	c1
0	2
1	3
2	5
2	7
4	9
5	NULL
EXPLAIN BASIC UPDATE t1 SET c1=c1+1 WHERE t1.c1 <>ALL (SELECT /*+USE_HASH(t2) */ c1 FROM t2);
UPDATE t1 SET c1=c1+1 WHERE t1.c1 NOT IN (SELECT /*+USE_NLJ(t2) */ c1 FROM t2);
SELECT * FROM t1 ORDER BY c0,c1;
c0	c1
0	2
1	3
2	5
2	7
4	9
5	NULL
EXPLAIN BASIC UPDATE t1 SET c1=c1+1 WHERE t1.c1 NOT IN (SELECT /*+USE_NLJ(t2) */ c1 FROM t2);
UPDATE t1 SET c1=c1+1 WHERE t1.c1 <>ALL (SELECT /*+USE_HASH(t2) */ c1 FROM t2 WHERE c1 IN(SELECT c1 FROM (SELECT c1 FROM t2 WHERE c0 > 4) tt));
SELECT * FROM t1 ORDER BY c0,c1;
c0	c1
0	3
1	3
2	6
2	8
4	10
5	NULL
EXPLAIN BASIC UPDATE t1 SET c1=c1+1 WHERE t1.c1 <>ALL (SELECT /*+USE_HASH(t2) */ c1 FROM t2 WHERE c1 IN(SELECT c1 FROM (SELECT c1 FROM t2 WHERE c0 > 4) tt));
UPDATE t1 SET c1=c1+1 WHERE t1.c1 NOT IN (SELECT /*+parallel(2) USE_NLJ(t2) */ c1 FROM t2 WHERE c1 IN(SELECT c1 FROM (SELECT c1 FROM t2) tt));
SELECT * FROM t1 ORDER BY c0,c1;
c0	c1
0	3
1	3
2	7
2	9
4	11
5	NULL
EXPLAIN BASIC UPDATE t1 SET c1=c1+1 WHERE t1.c1 NOT IN (SELECT /*+parallel(2) USE_NLJ(t2) */ c1 FROM t2 WHERE c1 IN(SELECT c1 FROM (SELECT c1 FROM t2) tt));
UPDATE t1 SET c1=c1+1 WHERE t1.c1 <>ALL (SELECT /*+parallel(5) USE_MERGE(t2) */ c1 FROM t2 WHERE c1 NOT IN(SELECT c1 FROM (SELECT c1 FROM t2) tt));
SELECT * FROM t1 ORDER BY c0,c1;
c0	c1
0	4
1	4
2	8
2	10
4	12
5	NULL
EXPLAIN BASIC UPDATE t1 SET c1=c1+1 WHERE t1.c1 <>ALL (SELECT /*+parallel(5) USE_MERGE(t2) */ c1 FROM t2 WHERE c1 NOT IN(SELECT c1 FROM (SELECT c1 FROM t2) tt));
UPDATE t1 SET c1=c1+1 WHERE t1.c1 IN (SELECT /*+parallel(5) USE_HASH(t5) */ c1 FROM t2 WHERE c1 NOT IN(SELECT c1 FROM (SELECT c1 FROM t2) tt));
SELECT * FROM t1 ORDER BY c0,c1;
c0	c1
0	4
1	4
2	8
2	10
4	12
5	NULL
EXPLAIN BASIC UPDATE t1 SET c1=c1+1 WHERE t1.c1 IN (SELECT /*+parallel(5) USE_HASH(t5) */ c1 FROM t2 WHERE c1 NOT IN(SELECT c1 FROM (SELECT c1 FROM t2) tt));
#IS NOT NULL
DROP TABLE IF EXISTS t2;
DROP TABLE IF EXISTS t1;
CREATE TABLE t1(c0 INT,c1 INT);
CREATE TABLE t2(c0 INT,c1 INT);
INSERT INTO t2 VALUES(0,0),(1,1),(2,1),(2,2),(4,3),(5,3),(6,NULL);
INSERT INTO t1 VALUES(0,0),(1,2),(2,4),(2,6),(4,8),(5,NULL);
SELECT * FROM t2 ORDER BY c0;
c0	c1
0	0
1	1
2	1
2	2
4	3
5	3
6	NULL
SELECT * FROM t1 ORDER BY c0;
c0	c1
0	0
1	2
2	4
2	6
4	8
5	NULL
UPDATE (SELECT t1.c1 FROM t1 WHERE t1.c1 <>ALL (SELECT c1 FROM t2 WHERE c1 IS NOT NULL)) SET c1=c1+1;
ERROR HY000: The target table ANONYMOUS_VIEW1 of the UPDATE is not updatable
UPDATE t1 SET c1=c1+1 WHERE NOT EXISTS (SELECT c1 FROM t2 WHERE c1 IS NOT NULL);
SELECT * FROM t1 ORDER BY c0,c1;
c0	c1
0	0
1	2
2	4
2	6
4	8
5	NULL
EXPLAIN BASIC UPDATE t1 SET c1=c1+1 WHERE NOT EXISTS (SELECT c1 FROM t2 WHERE c1 IS NOT NULL);
UPDATE t1 SET c1=c1+1 WHERE t1.c1 IN (SELECT c1 FROM t2 WHERE c1 NOT IN (SELECT c1 FROM (SELECT * FROM t2 WHERE c0 > 2) tt WHERE c1 IS NOT NULL));
SELECT * FROM t1 ORDER BY c0,c1;
c0	c1
0	1
1	3
2	4
2	6
4	8
5	NULL
EXPLAIN BASIC UPDATE t1 SET c1=c1+1 WHERE t1.c1 IN (SELECT c1 FROM t2 WHERE c1 NOT IN (SELECT c1 FROM (SELECT * FROM t2 WHERE c0 > 2) tt WHERE c1 IS NOT NULL));
UPDATE t1 SET c1=c1+1 WHERE t1.c1 <>ALL (SELECT t2.c1 FROM (SELECT * FROM t2) tt LEFT JOIN t2 ON tt.c0=t2.c0 AND t2.c1 NOT IN (SELECT c1 FROM (SELECT * FROM t2) tt WHERE c1 IS NOT NULL));
SELECT * FROM t1 ORDER BY c0,c1;
c0	c1
0	1
1	3
2	4
2	6
4	8
5	NULL
EXPLAIN BASIC UPDATE t1 SET c1=c1+1 WHERE t1.c1 <>ALL (SELECT t2.c1 FROM (SELECT * FROM t2) tt LEFT JOIN t2 ON tt.c0=t2.c0 AND t2.c1 NOT IN (SELECT c1 FROM (SELECT * FROM t2) tt WHERE c1 IS NOT NULL));
UPDATE (SELECT t1.c1 FROM t1 WHERE t1.c1 IN (SELECT b.c1 FROM t1 a JOIN t1 b ON a.c0=b.c0 AND a.c1 NOT IN (SELECT c1 FROM t2 WHERE c1 IS NOT NULL))) SET c1=c1+1;
ERROR HY000: The target table ANONYMOUS_VIEW1 of the UPDATE is not updatable
UPDATE t1 SET c1=c1+1 WHERE t1.c1 <>ALL (SELECT /*+USE_HASH(t2) */ c1 FROM t2 WHERE c1 IN(SELECT c1 FROM (SELECT * FROM t2 WHERE c0 > 2) tt WHERE c1 IS NOT NULL));
SELECT * FROM t1 ORDER BY c0,c1;
c0	c1
0	2
1	3
2	5
2	7
4	9
5	NULL
EXPLAIN BASIC UPDATE t1 SET c1=c1+1 WHERE t1.c1 <>ALL (SELECT /*+USE_HASH(t2) */ c1 FROM t2 WHERE c1 IN(SELECT c1 FROM (SELECT * FROM t2 WHERE c0 > 2) tt WHERE c1 IS NOT NULL));
UPDATE t1 SET c1=c1+1 WHERE t1.c1 NOT IN (SELECT /*+parallel(2) USE_NLJ(t2) */ c1 FROM t2 WHERE c1 IN(SELECT c1 FROM (SELECT * FROM t2 WHERE c0 > 2) tt WHERE c1 IS NOT NULL));
SELECT * FROM t1 ORDER BY c0,c1;
c0	c1
0	3
1	3
2	6
2	8
4	10
5	NULL
EXPLAIN BASIC UPDATE t1 SET c1=c1+1 WHERE t1.c1 NOT IN (SELECT /*+parallel(2) USE_NLJ(t2) */ c1 FROM t2 WHERE c1 IN(SELECT c1 FROM (SELECT * FROM t2 WHERE c0 > 2) tt WHERE c1 IS NOT NULL));
UPDATE t1 SET c1=c1+1 WHERE t1.c1 <>ALL (SELECT /*+parallel(5) USE_MERGE(t2) */ c1 FROM t2 WHERE c1 NOT IN(SELECT c1 FROM (SELECT * FROM t2 WHERE c0 > 2) tt WHERE c1 IS NOT NULL));
SELECT * FROM t1 ORDER BY c0,c1;
c0	c1
0	4
1	4
2	7
2	9
4	11
5	NULL
EXPLAIN BASIC UPDATE t1 SET c1=c1+1 WHERE t1.c1 <>ALL (SELECT /*+parallel(5) USE_MERGE(t2) */ c1 FROM t2 WHERE c1 NOT IN(SELECT c1 FROM (SELECT * FROM t2 WHERE c0 > 2) tt WHERE c1 IS NOT NULL));
UPDATE t1 SET c1=c1+1 WHERE t1.c1 IN (SELECT /*+parallel(5) USE_HASH(t5) */ c1 FROM t2 WHERE c1 NOT IN(SELECT c1 FROM (SELECT * FROM t2 WHERE c0 > 2) tt WHERE c1 IS NOT NULL));
SELECT * FROM t1 ORDER BY c0,c1;
c0	c1
0	4
1	4
2	7
2	9
4	11
5	NULL
EXPLAIN BASIC UPDATE t1 SET c1=c1+1 WHERE t1.c1 IN (SELECT /*+parallel(5) USE_HASH(t5) */ c1 FROM t2 WHERE c1 NOT IN(SELECT c1 FROM (SELECT * FROM t2 WHERE c0 > 2) tt WHERE c1 IS NOT NULL));
#DELETE subquery
DROP TABLE IF EXISTS t2;
DROP TABLE IF EXISTS t1;
CREATE TABLE t1(c0 INT,c1 INT);
CREATE TABLE t2(c0 INT,c1 INT);
INSERT INTO t2 VALUES(0,0),(1,1),(2,1),(2,2),(4,3),(5,3),(6,NULL);
INSERT INTO t1 VALUES(0,0),(1,2),(2,4),(2,6),(4,8),(5,NULL);
SELECT * FROM t2 ORDER BY c0;
c0	c1
0	0
1	1
2	1
2	2
4	3
5	3
6	NULL
SELECT * FROM t1 ORDER BY c0;
c0	c1
0	0
1	2
2	4
2	6
4	8
5	NULL
DELETE FROM t1 WHERE c1 NOT IN (SELECT c1 FROM t2);
SELECT * FROM t1 ORDER BY c0,c1;
c0	c1
0	0
1	2
2	4
2	6
4	8
5	NULL
EXPLAIN BASIC DELETE FROM t1 WHERE c1 NOT IN (SELECT c1 FROM t2);
DELETE FROM t1 WHERE c1 <>ALL (SELECT c1 FROM t2);
SELECT * FROM t1 ORDER BY c0,c1;
c0	c1
0	0
1	2
2	4
2	6
4	8
5	NULL
EXPLAIN BASIC DELETE FROM t1 WHERE c1 <>ALL (SELECT c1 FROM t2);
DELETE FROM t1 WHERE NOT EXISTS (SELECT c1 FROM t2);
SELECT * FROM t1 ORDER BY c0,c1;
c0	c1
0	0
1	2
2	4
2	6
4	8
5	NULL
EXPLAIN BASIC DELETE FROM t1 WHERE NOT EXISTS (SELECT c1 FROM t2);
DELETE FROM t1 WHERE c1 NOT IN (0,2,NULL);
SELECT * FROM t1 ORDER BY c0,c1;
c0	c1
0	0
1	2
2	4
2	6
4	8
5	NULL
EXPLAIN BASIC DELETE FROM t1 WHERE c1 NOT IN (0,2,NULL);
DELETE FROM t1 WHERE c1 <>ALL (SELECT c1 FROM t2 WHERE c1 NOT IN (SELECT c1 FROM t2));
SELECT * FROM t1 ORDER BY c0,c1;
c0	c1
EXPLAIN BASIC DELETE FROM t1 WHERE c1 <>ALL (SELECT c1 FROM t2 WHERE c1 NOT IN (SELECT c1 FROM t2));
INSERT INTO t1 VALUES(0,0),(1,2),(2,4),(2,6),(4,8),(5,NULL);
SELECT * FROM t1 ORDER BY c0,c1;
c0	c1
0	0
1	2
2	4
2	6
4	8
5	NULL
DELETE FROM t1 WHERE NOT EXISTS (SELECT c1 FROM t2 WHERE c1 <>ALL (SELECT c1 FROM t2));
SELECT * FROM t1 ORDER BY c0,c1;
c0	c1
EXPLAIN BASIC DELETE FROM t1 WHERE NOT EXISTS (SELECT c1 FROM t2 WHERE c1 <>ALL (SELECT c1 FROM t2));
INSERT INTO t1 VALUES(0,0),(1,2),(2,4),(2,6),(4,8),(5,NULL);
SELECT * FROM t1 ORDER BY c0,c1;
c0	c1
0	0
1	2
2	4
2	6
4	8
5	NULL
DELETE FROM t1 WHERE c1 IN (SELECT t2.c1 FROM (SELECT * FROM t2) tt,t2 WHERE tt.c0=t2.c0 AND t2.c1 NOT IN (SELECT c1 FROM (SELECT * FROM t2) tt));
SELECT * FROM t1 ORDER BY c0,c1;
c0	c1
0	0
1	2
2	4
2	6
4	8
5	NULL
EXPLAIN BASIC DELETE FROM t1 WHERE c1 IN (SELECT t2.c1 FROM (SELECT * FROM t2) tt,t2 WHERE tt.c0=t2.c0 AND t2.c1 NOT IN (SELECT c1 FROM (SELECT * FROM t2) tt));
DELETE FROM t1 WHERE c1 IN (SELECT b.c1 FROM (SELECT * FROM t2 WHERE c0 > 3) a,t2 b WHERE a.c0=b.c0 AND b.c1 NOT IN (SELECT c1 FROM (SELECT * FROM t2 WHERE c0 > 2) tt));
SELECT * FROM t1 ORDER BY c0,c1;
c0	c1
0	0
1	2
2	4
2	6
4	8
5	NULL
EXPLAIN BASIC DELETE FROM t1 WHERE c1 IN (SELECT b.c1 FROM (SELECT * FROM t2 WHERE c0 > 3) a,t2 b WHERE a.c0=b.c0 AND b.c1 NOT IN (SELECT c1 FROM (SELECT * FROM t2 WHERE c0 > 2) tt));
DELETE FROM t1 WHERE c1 NOT IN (SELECT t2.c1 FROM (SELECT * FROM t2) tt LEFT JOIN t2 ON tt.c0=t2.c0 WHERE t2.c1 <>ALL (SELECT c1 FROM (SELECT * FROM t2) tt));
SELECT * FROM t1 ORDER BY c0,c1;
c0	c1
EXPLAIN BASIC DELETE FROM t1 WHERE c1 NOT IN (SELECT t2.c1 FROM (SELECT * FROM t2) tt LEFT JOIN t2 ON tt.c0=t2.c0 WHERE t2.c1 <>ALL (SELECT c1 FROM (SELECT * FROM t2) tt));
INSERT INTO t1 VALUES(0,0),(1,2),(2,4),(2,6),(4,8),(5,NULL);
SELECT * FROM t1 ORDER BY c0,c1;
c0	c1
0	0
1	2
2	4
2	6
4	8
5	NULL
DELETE FROM t1 WHERE c1 IN (SELECT /*+USE_HASH(t1,t2) */ t2.c1 FROM t2 RIGHT JOIN (SELECT * FROM t2 WHERE c0 > 3) tt ON tt.c0=t2.c0 WHERE t2.c1 NOT IN (SELECT c1 FROM (SELECT * FROM t2) tt));
SELECT * FROM t1 ORDER BY c0,c1;
c0	c1
0	0
1	2
2	4
2	6
4	8
5	NULL
EXPLAIN BASIC DELETE FROM t1 WHERE c1 IN (SELECT /*+USE_HASH(t1,t2) */ t2.c1 FROM t2 RIGHT JOIN (SELECT * FROM t2 WHERE c0 > 3) tt ON tt.c0=t2.c0 WHERE t2.c1 NOT IN (SELECT c1 FROM (SELECT * FROM t2) tt));
DELETE FROM t1 WHERE NOT EXISTS (SELECT /*+USE_NLJ(t1,t2) */ t2.c1 FROM (SELECT * FROM t2 WHERE c0 > 3) tt JOIN t2 ON tt.c0=t2.c0 WHERE t2.c1 <>ALL (SELECT c1 FROM (SELECT * FROM t2) tt));
SELECT * FROM t1 ORDER BY c0,c1;
c0	c1
EXPLAIN BASIC DELETE FROM t1 WHERE NOT EXISTS (SELECT /*+USE_NLJ(t1,t2) */ t2.c1 FROM (SELECT * FROM t2 WHERE c0 > 3) tt JOIN t2 ON tt.c0=t2.c0 WHERE t2.c1 <>ALL (SELECT c1 FROM (SELECT * FROM t2) tt));
INSERT INTO t1 VALUES(0,0),(1,2),(2,4),(2,6),(4,8),(5,NULL);
SELECT * FROM t1 ORDER BY c0,c1;
c0	c1
0	0
1	2
2	4
2	6
4	8
5	NULL
DELETE FROM t1 WHERE NOT EXISTS (SELECT /*+parallel(2) USE_HASH(t2) */ t2.c1 FROM (SELECT * FROM t2 WHERE c0 > 3) tt JOIN t2 ON tt.c0=t2.c0 WHERE t2.c1 <>ALL (SELECT c1 FROM (SELECT * FROM t2) tt));
SELECT * FROM t1 ORDER BY c0,c1;
c0	c1
EXPLAIN BASIC DELETE FROM t1 WHERE NOT EXISTS (SELECT /*+parallel(2) USE_HASH(t2) */ t2.c1 FROM (SELECT * FROM t2 WHERE c0 > 3) tt JOIN t2 ON tt.c0=t2.c0 WHERE t2.c1 <>ALL (SELECT c1 FROM (SELECT * FROM t2) tt));
INSERT INTO t1 VALUES(0,0),(1,2),(2,4),(2,6),(4,8),(5,NULL);
SELECT * FROM t1 ORDER BY c0,c1;
c0	c1
0	0
1	2
2	4
2	6
4	8
5	NULL
DELETE FROM t1 WHERE c1 NOT IN (SELECT /*+parallel(2) USE_HASH(t1,t2) */ t2.c1 FROM
(SELECT * FROM t2 WHERE c1 <>ALL(SELECT c1 FROM t2 WHERE c1>5)) tt JOIN t2
ON tt.c0=t2.c0 WHERE t2.c1 <>ALL (SELECT c1 FROM (SELECT * FROM t2 WHERE c1 NOT IN(SELECT c1 FROM t2 WHERE c1<5)) tt));
SELECT * FROM t1 ORDER BY c0,c1;
c0	c1
0	0
1	2
2	4
2	6
4	8
5	NULL
EXPLAIN BASIC DELETE FROM t1 WHERE c1 NOT IN (SELECT /*+parallel(2) USE_HASH(t1,t2) */ t2.c1 FROM
(SELECT * FROM t2 WHERE c1 <>ALL(SELECT c1 FROM t2 WHERE c1>5)) tt JOIN t2
ON tt.c0=t2.c0 WHERE t2.c1 <>ALL (SELECT c1 FROM (SELECT * FROM t2 WHERE c1 NOT IN(SELECT c1 FROM t2 WHERE c1<5)) tt));
DELETE FROM t1 WHERE c1 NOT IN(SELECT /*+parallel(5) USE_HASH(t2)*/ t2.c1 FROM t2 WHERE c1 IN (SELECT c1 FROM (SELECT * FROM t2 WHERE c1 NOT IN(SELECT c1 FROM t2 WHERE c1<5)) tt));
SELECT * FROM t1 ORDER BY c0,c1;
c0	c1
EXPLAIN BASIC DELETE FROM t1 WHERE c1 NOT IN(SELECT /*+parallel(5) USE_HASH(t2)*/ t2.c1 FROM t2 WHERE c1 IN (SELECT c1 FROM (SELECT * FROM t2 WHERE c1 NOT IN(SELECT c1 FROM t2 WHERE c1<5)) tt));
# IS NOT NULL
DROP TABLE IF EXISTS t2;
DROP TABLE IF EXISTS t1;
CREATE TABLE t1(c0 INT,c1 INT);
CREATE TABLE t2(c0 INT,c1 INT);
INSERT INTO t2 VALUES(0,0),(1,1),(2,1),(2,2),(4,3),(5,5),(6,NULL);
INSERT INTO t1 VALUES(0,0),(1,2),(2,4),(2,6),(4,8),(5,NULL);
SELECT * FROM t2 ORDER BY c0;
c0	c1
0	0
1	1
2	1
2	2
4	3
5	5
6	NULL
SELECT * FROM t1 ORDER BY c0;
c0	c1
0	0
1	2
2	4
2	6
4	8
5	NULL
DELETE FROM t1 WHERE c1 NOT IN (SELECT c1 FROM t2 WHERE c1 IS NOT NULL);
SELECT * FROM t1 ORDER BY c0,c1;
c0	c1
0	0
1	2
5	NULL
EXPLAIN BASIC DELETE FROM t1 WHERE c1 NOT IN (SELECT c1 FROM t2 WHERE c1 IS NOT NULL);
INSERT INTO t1 VALUES(2,4),(2,6),(4,8);
SELECT * FROM t1 ORDER BY c0;
c0	c1
0	0
1	2
2	4
2	6
4	8
5	NULL
DELETE FROM t1 WHERE NOT EXISTS (SELECT c1 FROM t2 WHERE c1 IS NOT NULL);
SELECT * FROM t1 ORDER BY c0,c1;
c0	c1
0	0
1	2
2	4
2	6
4	8
5	NULL
EXPLAIN BASIC DELETE FROM t1 WHERE NOT EXISTS (SELECT c1 FROM t2 WHERE c1 IS NOT NULL);
DELETE FROM t1 WHERE c1 <>ALL (SELECT c1 FROM t2 WHERE c1 NOT IN (SELECT c1 FROM t2 WHERE c1 IS NOT NULL));
SELECT * FROM t1 ORDER BY c0,c1;
c0	c1
EXPLAIN BASIC DELETE FROM t1 WHERE c1 <>ALL (SELECT c1 FROM t2 WHERE c1 NOT IN (SELECT c1 FROM t2 WHERE c1 IS NOT NULL));
INSERT INTO t1 VALUES(0,0),(1,2),(2,4),(2,6),(4,8),(5,NULL);
SELECT * FROM t1 ORDER BY c0,c1;
c0	c1
0	0
1	2
2	4
2	6
4	8
5	NULL
DELETE FROM t1 WHERE c1 NOT IN (SELECT c1 FROM t2 WHERE c1 <>ALL (SELECT c1 FROM t2 WHERE c1 IS NOT NULL) AND c1 IS NOT NULL);
SELECT * FROM t1 ORDER BY c0,c1;
c0	c1
EXPLAIN BASIC DELETE FROM t1 WHERE c1 NOT IN (SELECT c1 FROM t2 WHERE c1 <>ALL (SELECT c1 FROM t2 WHERE c1 IS NOT NULL) AND c1 IS NOT NULL);
DROP TABLE IF EXISTS t2;
DROP TABLE IF EXISTS t1;
CREATE TABLE t1(c0 INT,c1 INT);
CREATE TABLE t2(c0 INT,c1 INT);
INSERT INTO t2 VALUES(0,0),(1,1),(2,1),(2,2),(4,3),(5,5),(6,NULL);
INSERT INTO t1 VALUES(0,0),(1,2),(2,4),(2,6),(4,8),(5,NULL);
SELECT * FROM t2 ORDER BY c0;
c0	c1
0	0
1	1
2	1
2	2
4	3
5	5
6	NULL
SELECT * FROM t1 ORDER BY c0;
c0	c1
0	0
1	2
2	4
2	6
4	8
5	NULL
DELETE FROM t1 WHERE c1 IN (SELECT t2.c1 FROM (SELECT * FROM t2) tt,t2 WHERE tt.c0=t2.c0 AND t2.c1 NOT IN (SELECT c1 FROM (SELECT c1 FROM t2) tt WHERE c1 IS NOT NULL));
SELECT * FROM t1 ORDER BY c0,c1;
c0	c1
0	0
1	2
2	4
2	6
4	8
5	NULL
EXPLAIN BASIC DELETE FROM t1 WHERE c1 IN (SELECT t2.c1 FROM (SELECT * FROM t2) tt,t2 WHERE tt.c0=t2.c0 AND t2.c1 NOT IN (SELECT c1 FROM (SELECT c1 FROM t2) tt WHERE c1 IS NOT NULL));
DELETE FROM t1 WHERE c1 <>ALL (SELECT b.c1 FROM (SELECT * FROM t2) a,t2 b WHERE a.c0=b.c0 AND b.c1 NOT IN (SELECT c1 FROM (SELECT c1 FROM t2) tt) AND b.c1 IS NOT NULL);
SELECT * FROM t1 ORDER BY c0,c1;
c0	c1
EXPLAIN BASIC DELETE FROM t1 WHERE c1 <>ALL (SELECT b.c1 FROM (SELECT * FROM t2) a,t2 b WHERE a.c0=b.c0 AND b.c1 NOT IN (SELECT c1 FROM (SELECT c1 FROM t2) tt) AND b.c1 IS NOT NULL);
INSERT INTO t1 VALUES(0,0),(1,2),(2,4),(2,6),(4,8),(5,NULL);
SELECT * FROM t1 ORDER BY c0;
c0	c1
0	0
1	2
2	4
2	6
4	8
5	NULL
DELETE FROM t1 WHERE c1 NOT IN (SELECT t2.c1 FROM (SELECT * FROM t2) tt LEFT JOIN t2 ON tt.c0=t2.c0 WHERE t2.c1 <>ALL (SELECT c1 FROM (SELECT * FROM t2) tt WHERE c1 IS NOT NULL));
SELECT * FROM t1 ORDER BY c0,c1;
c0	c1
EXPLAIN BASIC DELETE FROM t1 WHERE c1 NOT IN (SELECT t2.c1 FROM (SELECT * FROM t2) tt LEFT JOIN t2 ON tt.c0=t2.c0 WHERE t2.c1 <>ALL (SELECT c1 FROM (SELECT * FROM t2) tt WHERE c1 IS NOT NULL));
INSERT INTO t1 VALUES(0,0),(1,2),(2,4),(2,6),(4,8);
SELECT * FROM t1 ORDER BY c0;
c0	c1
0	0
1	2
2	4
2	6
4	8
DELETE FROM t1 WHERE c1 IN (SELECT /*+USE_HASH(t2) */ t2.c1 FROM t2 RIGHT JOIN (SELECT * FROM t2) tt ON tt.c0=t2.c0 WHERE t2.c1 NOT IN (SELECT c1 FROM (SELECT c1 FROM t2) tt WHERE c1 IS NOT NULL));
SELECT * FROM t1 ORDER BY c0,c1;
c0	c1
0	0
1	2
2	4
2	6
4	8
EXPLAIN BASIC DELETE FROM t1 WHERE c1 IN (SELECT /*+USE_HASH(t2) */ t2.c1 FROM t2 RIGHT JOIN (SELECT * FROM t2) tt ON tt.c0=t2.c0 WHERE t2.c1 NOT IN (SELECT c1 FROM (SELECT c1 FROM t2) tt WHERE c1 IS NOT NULL));
DELETE FROM t1 WHERE NOT EXISTS (SELECT /*+USE_NLJ(t2) */ t2.c1 FROM (SELECT * FROM t2 WHERE c1 IS NOT NULL) tt
JOIN t2 ON tt.c0=t2.c0 WHERE t2.c1 <>ALL (SELECT c1 FROM (SELECT * FROM t2 WHERE c1 IS NOT NULL) tt WHERE c1 IS NOT NULL));
SELECT * FROM t1 ORDER BY c0,c1;
c0	c1
EXPLAIN BASIC DELETE FROM t1 WHERE NOT EXISTS (SELECT /*+USE_NLJ(t2) */ t2.c1 FROM (SELECT * FROM t2 WHERE c1 IS NOT NULL) tt
JOIN t2 ON tt.c0=t2.c0 WHERE t2.c1 <>ALL (SELECT c1 FROM (SELECT * FROM t2 WHERE c1 IS NOT NULL) tt WHERE c1 IS NOT NULL));
INSERT INTO t1 VALUES(0,0),(1,2),(2,4),(2,6),(4,8),(5,NULL);
SELECT * FROM t1 ORDER BY c0;
c0	c1
0	0
1	2
2	4
2	6
4	8
5	NULL
DELETE FROM t1 WHERE NOT EXISTS (SELECT /*+parallel(2) USE_HASH(t2) */ t2.c1 FROM
(SELECT * FROM t2 WHERE c1 IS NOT NULL) tt JOIN t2 ON tt.c0=t2.c0 WHERE
t2.c1 <>ALL (SELECT c1 FROM (SELECT * FROM t2 WHERE c1 IS NOT NULL) tt WHERE c1 IS NOT NULL));
SELECT * FROM t1 ORDER BY c0,c1;
c0	c1
EXPLAIN BASIC DELETE FROM t1 WHERE NOT EXISTS (SELECT /*+parallel(2) USE_HASH(t2) */ t2.c1 FROM
(SELECT * FROM t2 WHERE c1 IS NOT NULL) tt JOIN t2 ON tt.c0=t2.c0 WHERE
t2.c1 <>ALL (SELECT c1 FROM (SELECT * FROM t2 WHERE c1 IS NOT NULL) tt WHERE c1 IS NOT NULL));
INSERT INTO t1 VALUES(0,0),(1,2),(2,4),(2,6),(4,8),(5,NULL);
SELECT * FROM t1 ORDER BY c0;
c0	c1
0	0
1	2
2	4
2	6
4	8
5	NULL
DELETE FROM t1 WHERE c1 NOT IN (SELECT /*+parallel(2) USE_HASH(t2) */ t2.c1 FROM
(SELECT * FROM t2 WHERE c1 > 4 AND c1 IS NOT NULL) tt JOIN t2 ON tt.c0=t2.c0 WHERE t2.c1 <>ALL (SELECT c1 FROM (SELECT * FROM t2 WHERE c1 <=10 AND c1 IS NOT NULL) tt) AND t2.c1 IS NOT NULL);
SELECT * FROM t1 ORDER BY c0,c1;
c0	c1
EXPLAIN BASIC DELETE FROM t1 WHERE c1 NOT IN (SELECT /*+parallel(2) USE_HASH(t2) */ t2.c1 FROM
(SELECT * FROM t2 WHERE c1 > 4 AND c1 IS NOT NULL) tt JOIN t2 ON tt.c0=t2.c0 WHERE t2.c1 <>ALL (SELECT c1 FROM (SELECT * FROM t2 WHERE c1 <=10 AND c1 IS NOT NULL) tt) AND t2.c1 IS NOT NULL);
INSERT INTO t1 VALUES(0,0),(1,2),(2,4),(2,6),(4,8),(5,NULL);
SELECT * FROM t1 ORDER BY c0;
c0	c1
0	0
1	2
2	4
2	6
4	8
5	NULL
DELETE FROM t1 WHERE c1 NOT IN(SELECT /*+parallel(5) USE_HASH(t2)*/ t2.c1 FROM t2 WHERE c1 IN (SELECT c1 FROM (SELECT * FROM t2 WHERE c1 IS NOT NULL) tt WHERE tt.c1 IS NOT NULL));
SELECT * FROM t1 ORDER BY c0,c1;
c0	c1
0	0
1	2
5	NULL
EXPLAIN BASIC DELETE FROM t1 WHERE c1 NOT IN(SELECT /*+parallel(5) USE_HASH(t2)*/ t2.c1 FROM t2 WHERE c1 IN (SELECT c1 FROM (SELECT * FROM t2 WHERE c1 IS NOT NULL) tt WHERE tt.c1 IS NOT NULL));
DROP TABLE IF EXISTS t2;
DROP TABLE IF EXISTS t1;
DROP USER 'zhang'@'%';
DROP DATABASE naaj_test;
#########Empty recycle bin, delete test database, tables, etc##########
purge recyclebin;
ERROR HY000: OceanBase server has gone away
