purge recyclebin;
# 环境清理
DROP USER if exists zhang;
CREATE USER 'zhang'@'%' IDENTIFIED BY 'zhang';
GRANT all ON *.* TO 'zhang'@'%';
CREATE DATABASE IF NOT EXISTS naaj_test;
USE naaj_test;
################Setting ''_ optimizer_ null_ aware_ Antijoin 'is ON################
SET _optimizer_null_aware_antijoin=OFF;
#设置超时等待时间
SET wait_timeout=30000000;
SET ob_trx_timeout = 60000000;
SET ob_query_timeout = 60000000;
Create data
DROP TABLE IF EXISTS t2;
DROP TABLE IF EXISTS t1;
CREATE TABLE t1(c0 INT,c1 VARCHAR(50),c2 INT,c3 DATE);
CREATE TABLE t2(c0 INT,c1 VARCHAR(50),c2 INT,c3 TIMESTAMP);
CREATE PROCEDURE p1()
BEGIN
DECLARE i INT DEFAULT 1;
wh1:WHILE i <= 10000 DO
IF i < 1000 THEN
INSERT INTO t1 VALUES(i,i||'AB',10.235,'2020-12-11');
ELSEIF i < 2000 THEN
INSERT INTO t1 VALUES(i,i+1,0.225,'2021-11-01');
ELSEIF i < 4000 THEN
INSERT INTO t1 VALUES(i,'@ % *',110.352,'2020-10-21');
ELSEIF i < 6000 THEN
INSERT INTO t1 VALUES(i,'',210.5,'2022-01-31');
ELSEIF i < 8000 THEN
INSERT INTO t1 VALUES(i,NULL,10,'2023-06-26');
ELSE
INSERT INTO t1 VALUES(i,'中文',1023.567,'2024-12-07');
END IF;
SET i = i + 1;
END WHILE wh1;
END;
//
CREATE PROCEDURE p2()
BEGIN
DECLARE j INT DEFAULT 1;
wh2:WHILE j <= 5000 DO
IF MOD(j,11) = 0 THEN
INSERT INTO t2 VALUES(j,j||'AB',123.567,'2024-12-07 17:45:57.357');
ELSEIF MOD(j,7) = 0 THEN
INSERT INTO t2 VALUES(j,j+1,13.67,'2023-12-07 12:15:47.3547');
ELSEIF MOD(j,5) = 0 THEN
INSERT INTO t2 VALUES(j,'@%*',113.5627,'2022-12-07 16:05:37.1543');
ELSEIF MOD(j,3) = 0 THEN
INSERT INTO t2 VALUES(j,'',23.543,'2021-12-07 14:35:27.054');
ELSEIF MOD(j,2) = 0 THEN
INSERT INTO t2 VALUES(j,NULL,0.537,'2022-12-07 02:15:19.004');
ELSE
INSERT INTO t2 VALUES(j,'中',3.267,'2024-12-07 15:55:17.0004');
END IF;
SET j = j + 1;
END WHILE wh2;
END;
//
CALL p1();
CALL p2();
#DQL
SELECT COUNT(1) FROM t1;
COUNT(1)
10000
SELECT COUNT(1) FROM t2;
COUNT(1)
5000
SELECT * FROM t1 WHERE c1 NOT IN (SELECT c1 FROM t2);
c0	c1	c2	c3
EXPLAIN BASIC SELECT /*+READ_CONSISTENCY (weak)*/ * FROM t1 WHERE c1 NOT IN (SELECT c1 FROM t2);
Query Plan
================================
|ID|OPERATOR              |NAME|
--------------------------------
|0 |NESTED-LOOP ANTI JOIN |    |
|1 |├─TABLE FULL SCAN     |t1  |
|2 |└─MATERIAL            |    |
|3 |  └─TABLE FULL SCAN   |t2  |
================================
Outputs & filters:
-------------------------------------
  0 - output([t1.c0], [t1.c1], [t1.c2], [t1.c3]), filter(nil), rowset=256
      conds([(T_OP_OR, t1.c1 = t2.c1, t1.c1 IS NULL, t2.c1 IS NULL)]), nl_params_(nil), use_batch=false
  1 - output([t1.c1], [t1.c0], [t1.c2], [t1.c3]), filter(nil), rowset=256
      access([t1.c1], [t1.c0], [t1.c2], [t1.c3]), partitions(p0)
      is_index_back=false, is_global_index=false, 
      range_key([t1.__pk_increment]), range(MIN ; MAX)always true
  2 - output([t2.c1]), filter(nil), rowset=256
  3 - output([t2.c1]), filter(nil), rowset=256
      access([t2.c1]), partitions(p0)
      is_index_back=false, is_global_index=false, 
      range_key([t2.__pk_increment]), range(MIN ; MAX)always true
SELECT COUNT(c0) FROM t1 WHERE c1 <>ALL (SELECT c1 FROM t2 WHERE c1 IS NOT NULL);
COUNT(c0)
4871
EXPLAIN BASIC SELECT /*+READ_CONSISTENCY (weak)*/ * FROM t1 WHERE c1 <>ALL (SELECT c1 FROM t2 WHERE c1 IS NOT NULL);
Query Plan
=================================
|ID|OPERATOR              |NAME |
---------------------------------
|0 |NESTED-LOOP ANTI JOIN |     |
|1 |├─TABLE FULL SCAN     |t1   |
|2 |└─MATERIAL            |     |
|3 |  └─SUBPLAN SCAN      |VIEW1|
|4 |    └─TABLE FULL SCAN |t2   |
=================================
Outputs & filters:
-------------------------------------
  0 - output([t1.c0], [t1.c1], [t1.c2], [t1.c3]), filter(nil), rowset=256
      conds([t1.c1 = VIEW1.c1 OR t1.c1 IS NULL]), nl_params_(nil), use_batch=false
  1 - output([t1.c1], [t1.c0], [t1.c2], [t1.c3]), filter(nil), rowset=256
      access([t1.c1], [t1.c0], [t1.c2], [t1.c3]), partitions(p0)
      is_index_back=false, is_global_index=false, 
      range_key([t1.__pk_increment]), range(MIN ; MAX)always true
  2 - output([VIEW1.c1]), filter(nil), rowset=256
  3 - output([VIEW1.c1]), filter(nil), rowset=256
      access([VIEW1.c1])
  4 - output([t2.c1]), filter([t2.c1 IS NOT NULL]), rowset=256
      access([t2.c1]), partitions(p0)
      is_index_back=false, is_global_index=false, filter_before_indexback[false], 
      range_key([t2.__pk_increment]), range(MIN ; MAX)always true
#Specify hint
SELECT /*+USE_HASH(t1,t2) */ COUNT(c0) FROM t1 WHERE c1 NOT IN(SELECT c1 FROM t2 WHERE c1 <>ALL(SELECT c1 FROM t1 WHERE c0>1000));
COUNT(c0)
10000
EXPLAIN BASIC SELECT /*+USE_HASH(t1,t2) READ_CONSISTENCY (weak)*/ COUNT(c0) FROM t1 WHERE c1 NOT IN(SELECT c1 FROM t2 WHERE c1 <>ALL(SELECT c1 FROM t1 WHERE c0>1000));
Query Plan
=========================================
|ID|OPERATOR                      |NAME |
-----------------------------------------
|0 |SCALAR GROUP BY               |     |
|1 |└─NESTED-LOOP ANTI JOIN       |     |
|2 |  ├─TABLE FULL SCAN           |t1   |
|3 |  └─MATERIAL                  |     |
|4 |    └─SUBPLAN SCAN            |VIEW2|
|5 |      └─NESTED-LOOP ANTI JOIN |     |
|6 |        ├─TABLE FULL SCAN     |t2   |
|7 |        └─MATERIAL            |     |
|8 |          └─SUBPLAN SCAN      |VIEW1|
|9 |            └─TABLE FULL SCAN |t1   |
=========================================
Outputs & filters:
-------------------------------------
  0 - output([T_FUN_COUNT(t1.c0)]), filter(nil), rowset=256
      group(nil), agg_func([T_FUN_COUNT(t1.c0)])
  1 - output([t1.c0]), filter(nil), rowset=256
      conds([(T_OP_OR, t1.c1 = VIEW2.c1, t1.c1 IS NULL, VIEW2.c1 IS NULL)]), nl_params_(nil), use_batch=false
  2 - output([t1.c1], [t1.c0]), filter(nil), rowset=256
      access([t1.c1], [t1.c0]), partitions(p0)
      is_index_back=false, is_global_index=false, 
      range_key([t1.__pk_increment]), range(MIN ; MAX)always true
  3 - output([VIEW2.c1]), filter(nil), rowset=256
  4 - output([VIEW2.c1]), filter(nil), rowset=256
      access([VIEW2.c1])
  5 - output([t2.c1]), filter(nil), rowset=256
      conds([(T_OP_OR, t2.c1 = VIEW1.c1, t2.c1 IS NULL, VIEW1.c1 IS NULL)]), nl_params_(nil), use_batch=false
  6 - output([t2.c1]), filter(nil), rowset=256
      access([t2.c1]), partitions(p0)
      is_index_back=false, is_global_index=false, 
      range_key([t2.__pk_increment]), range(MIN ; MAX)always true
  7 - output([VIEW1.c1]), filter(nil), rowset=256
  8 - output([VIEW1.c1]), filter(nil), rowset=256
      access([VIEW1.c1])
  9 - output([t1.c1]), filter([t1.c0 > 1000]), rowset=256
      access([t1.c0], [t1.c1]), partitions(p0)
      is_index_back=false, is_global_index=false, filter_before_indexback[false], 
      range_key([t1.__pk_increment]), range(MIN ; MAX)always true
SELECT /*+USE_MERGE(t1,t2) */ COUNT(c0) FROM t1 WHERE c1 <>ALL(SELECT c1 FROM t2 WHERE c1 NOT IN(SELECT c1 FROM t1 WHERE c0>1000 AND c1 IS NOT NULL));
COUNT(c0)
7001
EXPLAIN BASIC SELECT /*+USE_MERGE(t1,t2) READ_CONSISTENCY (weak)*/ COUNT(c0) FROM t1 WHERE c1 <>ALL(SELECT c1 FROM t2 WHERE c1 NOT IN(SELECT c1 FROM t1 WHERE c0>1000 AND c1 IS NOT NULL));
Query Plan
=========================================
|ID|OPERATOR                      |NAME |
-----------------------------------------
|0 |SCALAR GROUP BY               |     |
|1 |└─NESTED-LOOP ANTI JOIN       |     |
|2 |  ├─TABLE FULL SCAN           |t1   |
|3 |  └─MATERIAL                  |     |
|4 |    └─SUBPLAN SCAN            |VIEW2|
|5 |      └─NESTED-LOOP ANTI JOIN |     |
|6 |        ├─TABLE FULL SCAN     |t2   |
|7 |        └─MATERIAL            |     |
|8 |          └─SUBPLAN SCAN      |VIEW1|
|9 |            └─TABLE FULL SCAN |t1   |
=========================================
Outputs & filters:
-------------------------------------
  0 - output([T_FUN_COUNT(t1.c0)]), filter(nil), rowset=256
      group(nil), agg_func([T_FUN_COUNT(t1.c0)])
  1 - output([t1.c0]), filter(nil), rowset=256
      conds([(T_OP_OR, t1.c1 = VIEW2.c1, t1.c1 IS NULL, VIEW2.c1 IS NULL)]), nl_params_(nil), use_batch=false
  2 - output([t1.c1], [t1.c0]), filter(nil), rowset=256
      access([t1.c1], [t1.c0]), partitions(p0)
      is_index_back=false, is_global_index=false, 
      range_key([t1.__pk_increment]), range(MIN ; MAX)always true
  3 - output([VIEW2.c1]), filter(nil), rowset=256
  4 - output([VIEW2.c1]), filter(nil), rowset=256
      access([VIEW2.c1])
  5 - output([t2.c1]), filter(nil), rowset=256
      conds([t2.c1 = VIEW1.c1 OR t2.c1 IS NULL]), nl_params_(nil), use_batch=false
  6 - output([t2.c1]), filter(nil), rowset=256
      access([t2.c1]), partitions(p0)
      is_index_back=false, is_global_index=false, 
      range_key([t2.__pk_increment]), range(MIN ; MAX)always true
  7 - output([VIEW1.c1]), filter(nil), rowset=256
  8 - output([VIEW1.c1]), filter(nil), rowset=256
      access([VIEW1.c1])
  9 - output([t1.c1]), filter([t1.c0 > 1000], [t1.c1 IS NOT NULL]), rowset=256
      access([t1.c0], [t1.c1]), partitions(p0)
      is_index_back=false, is_global_index=false, filter_before_indexback[false,false], 
      range_key([t1.__pk_increment]), range(MIN ; MAX)always true
SELECT /*+USE_NL(t1,t2) */ COUNT(c0) FROM t1 WHERE c1 <>ALL(SELECT c1 FROM t2 WHERE c1 NOT IN(SELECT c1 FROM t1 WHERE c0>1000) AND c1 IS NOT NULL);
COUNT(c0)
10000
EXPLAIN BASIC SELECT /*+USE_NL(t1,t2) READ_CONSISTENCY (weak)*/ COUNT(c0) FROM t1 WHERE c1 <>ALL(SELECT c1 FROM t2 WHERE c1 NOT IN(SELECT c1 FROM t1 WHERE c0>1000) AND c1 IS NOT NULL);
Query Plan
=========================================
|ID|OPERATOR                      |NAME |
-----------------------------------------
|0 |SCALAR GROUP BY               |     |
|1 |└─NESTED-LOOP ANTI JOIN       |     |
|2 |  ├─TABLE FULL SCAN           |t1   |
|3 |  └─MATERIAL                  |     |
|4 |    └─SUBPLAN SCAN            |VIEW2|
|5 |      └─NESTED-LOOP ANTI JOIN |     |
|6 |        ├─TABLE FULL SCAN     |t2   |
|7 |        └─MATERIAL            |     |
|8 |          └─SUBPLAN SCAN      |VIEW1|
|9 |            └─TABLE FULL SCAN |t1   |
=========================================
Outputs & filters:
-------------------------------------
  0 - output([T_FUN_COUNT(t1.c0)]), filter(nil), rowset=256
      group(nil), agg_func([T_FUN_COUNT(t1.c0)])
  1 - output([t1.c0]), filter(nil), rowset=256
      conds([t1.c1 = VIEW2.c1 OR t1.c1 IS NULL]), nl_params_(nil), use_batch=false
  2 - output([t1.c1], [t1.c0]), filter(nil), rowset=256
      access([t1.c1], [t1.c0]), partitions(p0)
      is_index_back=false, is_global_index=false, 
      range_key([t1.__pk_increment]), range(MIN ; MAX)always true
  3 - output([VIEW2.c1]), filter(nil), rowset=256
  4 - output([VIEW2.c1]), filter(nil), rowset=256
      access([VIEW2.c1])
  5 - output([t2.c1]), filter(nil), rowset=256
      conds([t2.c1 = VIEW1.c1 OR VIEW1.c1 IS NULL]), nl_params_(nil), use_batch=false
  6 - output([t2.c1]), filter([t2.c1 IS NOT NULL]), rowset=256
      access([t2.c1]), partitions(p0)
      is_index_back=false, is_global_index=false, filter_before_indexback[false], 
      range_key([t2.__pk_increment]), range(MIN ; MAX)always true
  7 - output([VIEW1.c1]), filter(nil), rowset=256
  8 - output([VIEW1.c1]), filter(nil), rowset=256
      access([VIEW1.c1])
  9 - output([t1.c1]), filter([t1.c0 > 1000]), rowset=256
      access([t1.c0], [t1.c1]), partitions(p0)
      is_index_back=false, is_global_index=false, filter_before_indexback[false], 
      range_key([t1.__pk_increment]), range(MIN ; MAX)always true
#Parallel execution
SELECT /*+PARALLEL(5) USE_HASH(t1,t2) */ COUNT(c0) FROM t1 WHERE c1 IN(SELECT c1 FROM t2 WHERE c1 NOT IN(SELECT c1 FROM t1 WHERE c0>1000));
COUNT(c0)
0
EXPLAIN BASIC SELECT /*+PARALLEL(5) USE_HASH(t1,t2) READ_CONSISTENCY (weak)*/ COUNT(c0) FROM t1 WHERE c1 IN(SELECT c1 FROM t2 WHERE c1 NOT IN(SELECT c1 FROM t1 WHERE c0>1000));
Query Plan
==================================================================
|ID|OPERATOR                                            |NAME    |
------------------------------------------------------------------
|0 |SCALAR GROUP BY                                     |        |
|1 |└─PX COORDINATOR                                    |        |
|2 |  └─EXCHANGE OUT DISTR                              |:EX10002|
|3 |    └─MERGE GROUP BY                                |        |
|4 |      └─SHARED HASH RIGHT SEMI JOIN                 |        |
|5 |        ├─EXCHANGE IN DISTR                         |        |
|6 |        │ └─EXCHANGE OUT DISTR (BC2HOST)            |:EX10001|
|7 |        │   └─SUBPLAN SCAN                          |VIEW2   |
|8 |        │     └─NESTED-LOOP ANTI JOIN               |        |
|9 |        │       ├─PX BLOCK ITERATOR                 |        |
|10|        │       │ └─TABLE FULL SCAN                 |t2      |
|11|        │       └─MATERIAL                          |        |
|12|        │         └─EXCHANGE IN DISTR               |        |
|13|        │           └─EXCHANGE OUT DISTR (BROADCAST)|:EX10000|
|14|        │             └─SUBPLAN SCAN                |VIEW1   |
|15|        │               └─PX BLOCK ITERATOR         |        |
|16|        │                 └─TABLE FULL SCAN         |t1      |
|17|        └─PX BLOCK ITERATOR                         |        |
|18|          └─TABLE FULL SCAN                         |t1      |
==================================================================
Outputs & filters:
-------------------------------------
  0 - output([T_FUN_COUNT_SUM(T_FUN_COUNT(t1.c0))]), filter(nil), rowset=256
      group(nil), agg_func([T_FUN_COUNT_SUM(T_FUN_COUNT(t1.c0))])
  1 - output([T_FUN_COUNT(t1.c0)]), filter(nil), rowset=256
  2 - output([T_FUN_COUNT(t1.c0)]), filter(nil), rowset=256
      dop=5
  3 - output([T_FUN_COUNT(t1.c0)]), filter(nil), rowset=256
      group(nil), agg_func([T_FUN_COUNT(t1.c0)])
  4 - output([t1.c0]), filter(nil), rowset=256
      equal_conds([t1.c1 = VIEW2.c1]), other_conds(nil)
  5 - output([VIEW2.c1]), filter(nil), rowset=256
  6 - output([VIEW2.c1]), filter(nil), rowset=256
      dop=5
  7 - output([VIEW2.c1]), filter(nil), rowset=256
      access([VIEW2.c1])
  8 - output([t2.c1]), filter(nil), rowset=256
      conds([(T_OP_OR, t2.c1 = VIEW1.c1, t2.c1 IS NULL, VIEW1.c1 IS NULL)]), nl_params_(nil), use_batch=false
  9 - output([t2.c1]), filter(nil), rowset=256
 10 - output([t2.c1]), filter(nil), rowset=256
      access([t2.c1]), partitions(p0)
      is_index_back=false, is_global_index=false, 
      range_key([t2.__pk_increment]), range(MIN ; MAX)always true
 11 - output([VIEW1.c1]), filter(nil), rowset=256
 12 - output([VIEW1.c1]), filter(nil), rowset=256
 13 - output([VIEW1.c1]), filter(nil), rowset=256
      dop=5
 14 - output([VIEW1.c1]), filter(nil), rowset=256
      access([VIEW1.c1])
 15 - output([t1.c1]), filter(nil), rowset=256
 16 - output([t1.c1]), filter([t1.c0 > 1000]), rowset=256
      access([t1.c0], [t1.c1]), partitions(p0)
      is_index_back=false, is_global_index=false, filter_before_indexback[false], 
      range_key([t1.__pk_increment]), range(MIN ; MAX)always true
 17 - output([t1.c1], [t1.c0]), filter(nil), rowset=256
 18 - output([t1.c1], [t1.c0]), filter(nil), rowset=256
      access([t1.c1], [t1.c0]), partitions(p0)
      is_index_back=false, is_global_index=false, 
      range_key([t1.__pk_increment]), range(MIN ; MAX)always true
SELECT /*+PARALLEL(2) USE_HASH(t1,t2) */ COUNT(c0) FROM t1 WHERE NOT EXISTS(SELECT c1 FROM t2 WHERE c1 <>ALL(SELECT c1 FROM t1 WHERE c0>10000 AND c1 IS NOT NULL));
COUNT(c0)
0
EXPLAIN BASIC SELECT /*+PARALLEL(2) USE_HASH(t1,t2) READ_CONSISTENCY (weak)*/ COUNT(c0) FROM t1 WHERE NOT EXISTS(SELECT c1 FROM t2 WHERE c1 <>ALL(SELECT c1 FROM t1 WHERE c0>1000 AND c1 IS NOT NULL));
Query Plan
==============================================================
|ID|OPERATOR                                        |NAME    |
--------------------------------------------------------------
|0 |SCALAR GROUP BY                                 |        |
|1 |└─SUBPLAN FILTER                                |        |
|2 |  ├─PX COORDINATOR                              |        |
|3 |  │ └─EXCHANGE OUT DISTR                        |:EX10000|
|4 |  │   └─PX BLOCK ITERATOR                       |        |
|5 |  │     └─TABLE FULL SCAN                       |t1      |
|6 |  └─LIMIT                                       |        |
|7 |    └─PX COORDINATOR                            |        |
|8 |      └─EXCHANGE OUT DISTR                      |:EX20001|
|9 |        └─LIMIT                                 |        |
|10|          └─NESTED-LOOP ANTI JOIN               |        |
|11|            ├─PX BLOCK ITERATOR                 |        |
|12|            │ └─TABLE FULL SCAN                 |t2      |
|13|            └─MATERIAL                          |        |
|14|              └─EXCHANGE IN DISTR               |        |
|15|                └─EXCHANGE OUT DISTR (BROADCAST)|:EX20000|
|16|                  └─SUBPLAN SCAN                |VIEW1   |
|17|                    └─PX BLOCK ITERATOR         |        |
|18|                      └─TABLE FULL SCAN         |t1      |
==============================================================
Outputs & filters:
-------------------------------------
  0 - output([T_FUN_COUNT(t1.c0)]), filter(nil), rowset=256
      group(nil), agg_func([T_FUN_COUNT(t1.c0)])
  1 - output([t1.c0]), filter(nil), rowset=256
      exec_params_(nil), onetime_exprs_([(T_OP_NOT_EXISTS, subquery(1))(:0)]), init_plan_idxs_(nil), use_batch=false
  2 - output([t1.c0]), filter(nil), startup_filter([:0]), rowset=256
  3 - output([t1.c0]), filter(nil), rowset=256
      dop=2
  4 - output([t1.c0]), filter(nil), rowset=256
  5 - output([t1.c0]), filter(nil), rowset=256
      access([t1.c0]), partitions(p0)
      is_index_back=false, is_global_index=false, 
      range_key([t1.__pk_increment]), range(MIN ; MAX)always true
  6 - output([1]), filter(nil), rowset=256
      limit(1), offset(nil)
  7 - output(nil), filter(nil), rowset=256
  8 - output(nil), filter(nil), rowset=256
      dop=2
  9 - output(nil), filter(nil), rowset=256
      limit(1), offset(nil)
 10 - output(nil), filter(nil), rowset=256
      conds([t2.c1 = VIEW1.c1 OR t2.c1 IS NULL]), nl_params_(nil), use_batch=false
 11 - output([t2.c1]), filter(nil), rowset=256
 12 - output([t2.c1]), filter(nil), rowset=256
      access([t2.c1]), partitions(p0)
      is_index_back=false, is_global_index=false, 
      range_key([t2.__pk_increment]), range(MIN ; MAX)always true
 13 - output([VIEW1.c1]), filter(nil), rowset=256
 14 - output([VIEW1.c1]), filter(nil), rowset=256
 15 - output([VIEW1.c1]), filter(nil), rowset=256
      dop=2
 16 - output([VIEW1.c1]), filter(nil), rowset=256
      access([VIEW1.c1])
 17 - output([t1.c1]), filter(nil), rowset=256
 18 - output([t1.c1]), filter([t1.c0 > 1000], [t1.c1 IS NOT NULL]), rowset=256
      access([t1.c0], [t1.c1]), partitions(p0)
      is_index_back=false, is_global_index=false, filter_before_indexback[false,false], 
      range_key([t1.__pk_increment]), range(MIN ; MAX)always true
SELECT /*+PARALLEL(2) USE_HASH(t1,t2) */ COUNT(c0) FROM t1 WHERE c1 NOT IN(SELECT c1 FROM t2 WHERE NOT EXISTS(SELECT c1 FROM t1 WHERE c0>1000 AND c1 IS NOT NULL) AND c1 IS NOT NULL);
COUNT(c0)
10000
EXPLAIN BASIC SELECT /*+PARALLEL(2) USE_HASH(t1,t2) READ_CONSISTENCY (weak)*/ COUNT(c0) FROM t1 WHERE c1 NOT IN(SELECT c1 FROM t2 WHERE NOT EXISTS(SELECT c1 FROM t1 WHERE c0>1000 AND c1 IS NOT NULL) AND c1 IS NOT NULL);
Query Plan
=============================================================
|ID|OPERATOR                                       |NAME    |
-------------------------------------------------------------
|0 |SCALAR GROUP BY                                |        |
|1 |└─PX COORDINATOR                               |        |
|2 |  └─EXCHANGE OUT DISTR                         |:EX10002|
|3 |    └─MERGE GROUP BY                           |        |
|4 |      └─NESTED-LOOP ANTI JOIN                  |        |
|5 |        ├─PX BLOCK ITERATOR                    |        |
|6 |        │ └─TABLE FULL SCAN                    |t1      |
|7 |        └─MATERIAL                             |        |
|8 |          └─EXCHANGE IN DISTR                  |        |
|9 |            └─EXCHANGE OUT DISTR (BROADCAST)   |:EX10001|
|10|              └─MATERIAL                       |        |
|11|                └─SUBPLAN SCAN                 |VIEW1   |
|12|                  └─SUBPLAN FILTER             |        |
|13|                    ├─MATERIAL                 |        |
|14|                    │ └─PX COORDINATOR         |        |
|15|                    │   └─EXCHANGE OUT DISTR   |:EX20000|
|16|                    │     └─PX BLOCK ITERATOR  |        |
|17|                    │       └─TABLE FULL SCAN  |t2      |
|18|                    └─LIMIT                    |        |
|19|                      └─EXCHANGE IN DISTR      |        |
|20|                        └─EXCHANGE OUT DISTR   |:EX10000|
|21|                          └─LIMIT              |        |
|22|                            └─PX BLOCK ITERATOR|        |
|23|                              └─TABLE FULL SCAN|t1      |
=============================================================
Outputs & filters:
-------------------------------------
  0 - output([T_FUN_COUNT_SUM(T_FUN_COUNT(t1.c0))]), filter(nil), rowset=256
      group(nil), agg_func([T_FUN_COUNT_SUM(T_FUN_COUNT(t1.c0))])
  1 - output([T_FUN_COUNT(t1.c0)]), filter(nil), rowset=256
  2 - output([T_FUN_COUNT(t1.c0)]), filter(nil), rowset=256
      dop=2
  3 - output([T_FUN_COUNT(t1.c0)]), filter(nil), rowset=256
      group(nil), agg_func([T_FUN_COUNT(t1.c0)])
  4 - output([t1.c0]), filter(nil), rowset=256
      conds([t1.c1 = VIEW1.c1 OR t1.c1 IS NULL]), nl_params_(nil), use_batch=false
  5 - output([t1.c1], [t1.c0]), filter(nil), rowset=256
  6 - output([t1.c1], [t1.c0]), filter(nil), rowset=256
      access([t1.c1], [t1.c0]), partitions(p0)
      is_index_back=false, is_global_index=false, 
      range_key([t1.__pk_increment]), range(MIN ; MAX)always true
  7 - output([VIEW1.c1]), filter(nil), rowset=256
  8 - output([VIEW1.c1]), filter(nil), rowset=256
  9 - output([VIEW1.c1]), filter(nil), rowset=256
      is_single, dop=1
 10 - output([VIEW1.c1]), filter(nil), rowset=256
 11 - output([VIEW1.c1]), filter(nil), rowset=256
      access([VIEW1.c1])
 12 - output([t2.c1]), filter(nil), rowset=256
      exec_params_(nil), onetime_exprs_([(T_OP_NOT_EXISTS, subquery(1))(:0)]), init_plan_idxs_(nil), use_batch=false
 13 - output([t2.c1]), filter(nil), startup_filter([:0]), rowset=256
 14 - output([t2.c1]), filter(nil), rowset=256
 15 - output([t2.c1]), filter(nil), rowset=256
      dop=2
 16 - output([t2.c1]), filter(nil), rowset=256
 17 - output([t2.c1]), filter([t2.c1 IS NOT NULL]), rowset=256
      access([t2.c1]), partitions(p0)
      is_index_back=false, is_global_index=false, filter_before_indexback[false], 
      range_key([t2.__pk_increment]), range(MIN ; MAX)always true
 18 - output([1]), filter(nil), rowset=256
      limit(1), offset(nil)
 19 - output(nil), filter(nil), rowset=256
 20 - output(nil), filter(nil), rowset=256
      dop=2
 21 - output(nil), filter(nil), rowset=256
      limit(1), offset(nil)
 22 - output(nil), filter(nil), rowset=256
 23 - output(nil), filter([t1.c0 > 1000], [t1.c1 IS NOT NULL]), rowset=256
      access([t1.c0], [t1.c1]), partitions(p0)
      limit(1), offset(nil), is_index_back=false, is_global_index=false, filter_before_indexback[false,false], 
      range_key([t1.__pk_increment]), range(MIN ; MAX)always true
#DML
#insert
INSERT INTO t1 SELECT /*+USE_HASH(t1,t2) */ * FROM t2 WHERE c1 <>ALL (SELECT c1 FROM t1 WHERE c1 NOT IN (SELECT c1 FROM t2)) AND c0<100;
SELECT COUNT(1) FROM t1;
COUNT(1)
10099
EXPLAIN BASIC INSERT INTO t1 SELECT /*+USE_HASH(t1,t2) */ * FROM t2 WHERE c1 <>ALL (SELECT c1 FROM t1 WHERE c1 NOT IN (SELECT c1 FROM t2)) AND c0<100;
INSERT INTO t1 SELECT /*+USE_HASH(t1,t2) */ t2.* FROM t1 LEFT JOIN t2 ON t1.c0=t2.c0 WHERE t2.c0<10 AND t2.c1 <>ALL (SELECT c1 FROM t1 WHERE c0<1000);
SELECT COUNT(1) FROM t1;
COUNT(1)
10099
EXPLAIN BASIC INSERT INTO t1 SELECT /*+USE_HASH(t1,t2) */ t2.* FROM t1 LEFT JOIN t2 ON t1.c0=t2.c0 WHERE t2.c0<10 AND t2.c1 <>ALL (SELECT c1 FROM t1 WHERE c0<1000);
INSERT INTO t1 SELECT /*+PARALLEL(2) USE_HASH(t1,t2) */ t2.* FROM t1,t2 WHERE t2.c0<10 AND t2.c1 NOT IN (SELECT c1 FROM t1 WHERE c0<1000 AND  c1 IS NOT NULL);
SELECT COUNT(1) FROM t1;
COUNT(1)
10099
EXPLAIN BASIC INSERT INTO t1 SELECT /*+PARALLEL(2) USE_HASH(t1,t2) */ t2.* FROM t1,t2 WHERE t2.c0<10 AND t2.c1 NOT IN (SELECT c1 FROM t1 WHERE c0<1000 AND  c1 IS NOT NULL);
#delete
DELETE FROM t1 WHERE c0 IN(SELECT /*+PARALLEL(2) USE_HASH(tt,t2) */ t2.c0 FROM (SELECT * FROM t2 WHERE c0 > 1000) tt,t2 WHERE
t2.c0<1000 AND t2.c1 NOT IN (SELECT c1 FROM (SELECT * FROM t2 WHERE c0 > 1000) tt WHERE c0<1000 AND  c1 IS NOT NULL));
SELECT COUNT(1) FROM t1;
COUNT(1)
9001
EXPLAIN BASIC DELETE FROM t1 WHERE c0 IN(SELECT /*+PARALLEL(2) USE_HASH(tt,t2) */ t2.c0 FROM (SELECT * FROM t2 WHERE c0 > 1000) tt,t2 WHERE
t2.c0<1000 AND t2.c1 NOT IN (SELECT c1 FROM (SELECT * FROM t2 WHERE c0 > 1000) tt WHERE c0<1000 AND  c1 IS NOT NULL));
DELETE FROM t1 WHERE c0 NOT IN(SELECT /*+PARALLEL(5) USE_HASH(tt,t2) */ t2.c0 FROM (SELECT * FROM t2 WHERE c1 NOT IN(SELECT c1 FROM t2 WHERE c1 IS NOT NULL)) tt,t2 WHERE
t2.c0<1000 AND t2.c1 NOT IN (SELECT c1 FROM (SELECT * FROM t2 WHERE c1 NOT IN(SELECT c1 FROM t2 WHERE c1 IS NOT NULL)) tt WHERE c0<1000));
SELECT COUNT(1) FROM t1;
COUNT(1)
0
EXPLAIN BASIC DELETE FROM t1 WHERE c0 NOT IN(SELECT /*+PARALLEL(5) USE_HASH(tt,t2) */ t2.c0 FROM (SELECT * FROM t2 WHERE c1 NOT IN(SELECT c1 FROM t2 WHERE c1 IS NOT NULL)) tt,t2 WHERE
t2.c0<1000 AND t2.c1 NOT IN (SELECT c1 FROM (SELECT * FROM t2 WHERE c1 NOT IN(SELECT c1 FROM t2 WHERE c1 IS NOT NULL)) tt WHERE c0<1000));
CALL p1();
SELECT count(1) FROM t1;
count(1)
10000
DELETE FROM t1 WHERE c1 NOT IN(SELECT /*+PARALLEL(2) USE_HASH(tt,t2) */ t2.c0 FROM
(SELECT * FROM t2 WHERE c1 NOT IN(SELECT c1 FROM t2 WHERE c1 IS NOT NULL)) tt RIGHT JOIN
t2 ON tt.c0=t2.c0 WHERE t2.c0<1000 AND
t2.c1 <>ALL (SELECT c1 FROM (SELECT * FROM t2 WHERE c1 NOT IN(SELECT c1 FROM t2 WHERE c1 IS NOT NULL)) tt WHERE c0<1000 AND c1 IS NOT NULL));
ERROR 22007: Truncated incorrect DECIMAL value: '@ % *'
SELECT COUNT(1) FROM t1;
COUNT(1)
10000
EXPLAIN BASIC DELETE FROM t1 WHERE c1 NOT IN(SELECT /*+PARALLEL(2) USE_HASH(tt,t2) */ t2.c0 FROM
(SELECT * FROM t2 WHERE c1 NOT IN(SELECT c1 FROM t2 WHERE c1 IS NOT NULL)) tt RIGHT JOIN
t2 ON tt.c0=t2.c0 WHERE t2.c0<1000 AND
t2.c1 <>ALL (SELECT c1 FROM (SELECT * FROM t2 WHERE c1 NOT IN(SELECT c1 FROM t2 WHERE c1 IS NOT NULL)) tt WHERE c0<1000 AND c1 IS NOT NULL));
DELETE FROM t1 WHERE c1 <>ALL(SELECT /*+PARALLEL(2) USE_HASH(tt,t2) */ t2.c1 FROM
(SELECT * FROM t2 WHERE c0>1000) tt RIGHT JOIN t2 ON tt.c0=t2.c0 WHERE t2.c0<1000 AND t2.c1 <>ALL (SELECT c1 FROM (SELECT * FROM t2 WHERE c0>1000) tt));
SELECT COUNT(1) FROM t1;
COUNT(1)
0
EXPLAIN BASIC DELETE FROM t1 WHERE c1 <>ALL(SELECT /*+PARALLEL(2) USE_HASH(tt,t2) */ t2.c1 FROM
(SELECT * FROM t2 WHERE c0>1000) tt RIGHT JOIN t2 ON tt.c0=t2.c0 WHERE t2.c0<1000 AND t2.c1 <>ALL (SELECT c1 FROM (SELECT * FROM t2 WHERE c0>1000) tt));
CALL p1();
SELECT count(1) FROM t1;
count(1)
10000
DELETE FROM t2 WHERE c1 NOT IN(SELECT /*+PARALLEL(2) USE_HASH(t1) */ t1.c1 FROM
(SELECT * FROM (SELECT * FROM t1 WHERE c1 <>ALL(SELECT c1 FROM t1 WHERE c1 IS NOT NULL AND c0 >2000)) a) tt LEFT JOIN t1
ON tt.c0=t1.c0 WHERE t1.c1 NOT IN (SELECT c1 FROM (SELECT * FROM t1 WHERE c1 <>ALL(SELECT c1 FROM t1 WHERE c1 IS NOT NULL AND c0 >2000)) tt));
SELECT COUNT(1) FROM t2;
COUNT(1)
0
EXPLAIN BASIC DELETE FROM t2 WHERE c1 NOT IN(SELECT /*+PARALLEL(2) USE_HASH(t1) */ t1.c1 FROM
(SELECT * FROM (SELECT * FROM t1 WHERE c1 <>ALL(SELECT c1 FROM t1 WHERE c1 IS NOT NULL AND c0 >2000)) a) tt LEFT JOIN t1
ON tt.c0=t1.c0 WHERE t1.c1 NOT IN (SELECT c1 FROM (SELECT * FROM t1 WHERE c1 <>ALL(SELECT c1 FROM t1 WHERE c1 IS NOT NULL AND c0 >2000)) tt));
DELETE FROM t2;
CALL p2();
SELECT count(1) FROM t1;
count(1)
10000
SELECT count(1) FROM t2;
count(1)
5000
DELETE FROM t2 WHERE NOT EXISTS(SELECT /*+USE_NL(t1,tt) */ t1.c1 FROM t1 JOIN
(SELECT * FROM t1 WHERE c1 <>ALL(SELECT c1 FROM t1 WHERE c1 IS NOT NULL AND c0 >2000)) tt
ON tt.c0=t1.c0 AND t1.c1 NOT IN (SELECT c1 FROM (SELECT c1 FROM t1 WHERE c1 IS NOT NULL AND c0 >2000) tt));
SELECT COUNT(1) FROM t2;
COUNT(1)
5000
EXPLAIN BASIC DELETE FROM t2 WHERE NOT EXISTS(SELECT /*+USE_NL(t1,tt) */ t1.c1 FROM t1 JOIN
(SELECT * FROM t1 WHERE c1 <>ALL(SELECT c1 FROM t1 WHERE c1 IS NOT NULL AND c0 >2000)) tt
ON tt.c0=t1.c0 AND t1.c1 NOT IN (SELECT c1 FROM (SELECT c1 FROM t1 WHERE c1 IS NOT NULL AND c0 >2000) tt));
DELETE FROM t2 WHERE c1 NOT IN(SELECT /*+USE_HASH(tt,t1) */ t1.c1 FROM
(SELECT * FROM t1 WHERE c1 <>ALL(SELECT c1 FROM t1 WHERE c1 IS NOT NULL AND c0 >2000)) tt JOIN t1
ON tt.c0=t1.c0 AND t1.c1 <>ALL (SELECT c1 FROM (SELECT * FROM t1 WHERE c1 <>ALL(SELECT c1 FROM t1 WHERE c1 IS NOT NULL AND c0 >2000)) tt WHERE c1 IS NOT NULL));
SELECT COUNT(1) FROM t2;
COUNT(1)
0
EXPLAIN BASIC DELETE FROM t2 WHERE c1 NOT IN(SELECT /*+USE_HASH(tt,t1) */ t1.c1 FROM
(SELECT * FROM t1 WHERE c1 <>ALL(SELECT c1 FROM t1 WHERE c1 IS NOT NULL AND c0 >2000)) tt JOIN t1
ON tt.c0=t1.c0 AND t1.c1 <>ALL (SELECT c1 FROM (SELECT * FROM t1 WHERE c1 <>ALL(SELECT c1 FROM t1 WHERE c1 IS NOT NULL AND c0 >2000)) tt WHERE c1 IS NOT NULL));
#update
DELETE FROM t2;
CALL p2();
SELECT count(1) FROM t2;
count(1)
5000
UPDATE t1 SET c0=c0+1 WHERE c1 NOT IN(SELECT c1 FROM t2);
EXPLAIN BASIC UPDATE t1 SET c0=c0+1 WHERE c1 NOT IN(SELECT c1 FROM t2);
UPDATE t1 INNER JOIN (SELECT * FROM t1 WHERE t1.c1 <>ALL (SELECT c1 FROM t2 WHERE c0 = 11)) tt ON t1.c0=tt.c0 SET t1.c2=1111;
SELECT COUNT(1) FROM t1 WHERE c2=1111;
COUNT(1)
7001
EXPLAIN BASIC UPDATE t1 INNER JOIN (SELECT * FROM t1 WHERE t1.c1 <>ALL (SELECT c1 FROM t2 WHERE c0 = 11)) tt ON t1.c0=tt.c0 SET t1.c2=1111;
UPDATE t1 SET c0=c0+1 WHERE t1.c1 NOT IN (SELECT /*+USE_HASH(t2) */ t2.c1 FROM (SELECT c1 FROM t2 WHERE c0 >2000) tt,t2 WHERE NOT EXISTS(SELECT c1 FROM t2 WHERE c0 >4000));
EXPLAIN BASIC UPDATE t1 SET c0=c0+1 WHERE t1.c1 NOT IN (SELECT /*+USE_HASH(t2) */ t2.c1 FROM (SELECT c1 FROM t2 WHERE c0 >2000) tt,t2 WHERE NOT EXISTS(SELECT c1 FROM t2 WHERE c0 >4000));
UPDATE t1 SET c0=c0+1 WHERE t1.c1 NOT IN (SELECT /*+parallel(2) NO_USE_HASH(t2) */ c1 FROM t2 WHERE c1 NOT IN(SELECT c1 FROM t2 WHERE c0 > 1000));
EXPLAIN BASIC UPDATE t1 SET c0=c0+1 WHERE t1.c1 NOT IN (SELECT /*+parallel(2) NO_USE_HASH(t2) */ c1 FROM t2 WHERE c1 NOT IN(SELECT c1 FROM t2 WHERE c0 > 1000));
UPDATE t1 SET c0=c0+1 WHERE t1.c1 NOT IN (SELECT /*+parallel(2) NO_USE_HASH(t2) */ c1 FROM t2 WHERE c1 NOT IN(SELECT c1 FROM t2));
EXPLAIN BASIC UPDATE t1 SET c0=c0+1 WHERE t1.c1 NOT IN (SELECT /*+parallel(2) NO_USE_HASH(t2) */ c1 FROM t2 WHERE c1 NOT IN(SELECT c1 FROM t2));
UPDATE t1 SET c0=c0+1 WHERE t1.c1 IN (SELECT /*+parallel(2) NO_USE_NLJ(t2) */ t2.c1 FROM (SELECT * FROM t2 WHERE c1 <>ALL(SELECT c1 FROM t2 WHERE c0<1000)) tt
JOIN t2 ON tt.c0=t2.c0 WHERE t2.c1 NOT IN(SELECT c1 FROM t2 WHERE c0 BETWEEN 1000 AND 4000));
EXPLAIN BASIC UPDATE t1 SET c0=c0+1 WHERE t1.c1 IN (SELECT /*+parallel(2) NO_USE_NLJ(t2) */ t2.c1 FROM (SELECT * FROM t2 WHERE c1 <>ALL(SELECT c1 FROM t2 WHERE c0<1000)) tt
JOIN t2 ON tt.c0=t2.c0 WHERE t2.c1 NOT IN(SELECT c1 FROM t2 WHERE c0 BETWEEN 1000 AND 4000));
UPDATE t1 SET c0=c0+1 WHERE t1.c1 NOT IN (SELECT /*+parallel(2) USE_HASH(tt,t2) */ t2.c1 FROM (SELECT * FROM t2 WHERE c1 <>ALL(SELECT c1 FROM t2 WHERE c0<1000)) tt
LEFT JOIN t2 ON tt.c0=t2.c0 WHERE t2.c1 <>ALL(SELECT c1 FROM t2 WHERE c1 IS NOT NULL));
EXPLAIN BASIC UPDATE t1 SET c0=c0+1 WHERE t1.c1 NOT IN (SELECT /*+parallel(2) USE_HASH(tt,t2) */ t2.c1 FROM (SELECT * FROM t2 WHERE c1 <>ALL(SELECT c1 FROM t2 WHERE c0<1000)) tt
LEFT JOIN t2 ON tt.c0=t2.c0 WHERE t2.c1 <>ALL(SELECT c1 FROM t2 WHERE c1 IS NOT NULL));
UPDATE t1 SET c0=c0+1 WHERE t1.c1 NOT IN (SELECT /*+parallel(2) USE_HASH(tt,t2) */ t2.c1 FROM (SELECT * FROM t2 WHERE c1 <>ALL(SELECT c1 FROM t2 WHERE c0<2000)) tt
RIGHT JOIN t2 ON tt.c0=t2.c0 WHERE tt.c1 <>ALL(SELECT c1 FROM t2 WHERE c0 BETWEEN 1000 AND 4000) AND t2.c1 IS NOT NULL);
EXPLAIN BASIC UPDATE t1 SET c0=c0+1 WHERE t1.c1 NOT IN (SELECT /*+parallel(2) USE_HASH(tt,t2) */ t2.c1 FROM (SELECT * FROM t2 WHERE c1 <>ALL(SELECT c1 FROM t2 WHERE c0<2000)) tt
RIGHT JOIN t2 ON tt.c0=t2.c0 WHERE tt.c1 <>ALL(SELECT c1 FROM t2 WHERE c0 BETWEEN 1000 AND 4000) AND t2.c1 IS NOT NULL);
DELETE FROM t1 WHERE 1=1;
CALL p1();
SELECT COUNT(1) FROM t1;
COUNT(1)
10000
SELECT COUNT(1) FROM t2;
COUNT(1)
5000
#使用if...then创建存储过程
CREATE PROCEDURE test_case1(IN v_c0 INT)
BEGIN
DECLARE v_count INT;
IF v_c0 > 4000 AND v_c0 <= 5000 THEN
INSERT INTO t1 SELECT /*+USE_HASH(t1,t2)*/ t2.* FROM t1 JOIN t2 ON t1.c0=t2.c0 WHERE t2.c1 NOT IN(SELECT c1 FROM t1 WHERE c0 >= v_c0);
ELSEIF v_c0 >= 3000 THEN
INSERT INTO t1 SELECT /*+parallel(5) USE_HASH(t1,t2)*/ t2.* FROM t1 JOIN t2 ON t1.c0=t2.c0 WHERE t2.c1 NOT IN(SELECT c1 FROM t1 WHERE c0 >= v_c0 AND c1 IS NOT NULL);
ELSEIF v_c0 >= 2000 THEN
UPDATE t1 SET c0=c0+1 WHERE c1 <>ALL(SELECT /*+USE_HASH(tt,t2)*/ t2.c1 FROM (SELECT * FROM t2 WHERE c0 >= v_c0) tt JOIN t2 ON tt.c0=t2.c0 WHERE t2.c1 NOT IN(SELECT c1 FROM (SELECT * FROM t2 WHERE c0 >= v_c0) tt WHERE c0 >= v_c0) AND t2.c1 IS NOT NULL);
ELSEIF v_c0 >= 1000 THEN
DELETE FROM t1 WHERE c0 <>ALL(SELECT /*+parallel(2) USE_HASH(tt,t2)*/ t2.c0 FROM (SELECT * FROM t2 WHERE c0 >= v_c0) tt RIGHT JOIN t2 ON tt.c0=t2.c0 WHERE t2.c1 NOT IN(SELECT c1 FROM (SELECT * FROM t2 WHERE c0 >= v_c0) tt WHERE c0 >= v_c0 AND c1 IS NOT NULL));
ELSE
DELETE FROM t1 WHERE c0 <>ALL(SELECT /*+parallel(2) USE_HASH(tt,t2)*/ t2.c0 FROM (SELECT * FROM t2 WHERE c0 <= v_c0) tt RIGHT JOIN t2 ON tt.c0=t2.c0 WHERE t2.c1 NOT IN(SELECT c1 FROM (SELECT * FROM t2 WHERE c0 <= v_c0) tt WHERE c0 <= v_c0 AND c1 IS NOT NULL) AND t2.c1 IS NOT NULL);
END IF;
SELECT COUNT(1) FROM t1 INTO v_count;
SELECT v_count;
END;
//
CALL test_case1(4433);
v_count
10000
CALL test_case1(3580);
v_count
12923
CALL test_case1(2560);
v_count
12923
CALL test_case1(1560);
v_count
306
CALL test_case1(560);
v_count
196
DROP PROCEDURE test_case1;
#使用with...on语法创建的存储过程
DELETE FROM t1 WHERE 1=1;
COMMIT;
CALL p1();
SELECT COUNT(1) FROM t1;
COUNT(1)
10000
SELECT COUNT(1) FROM t2;
COUNT(1)
5000
CREATE PROCEDURE test_case2(IN v_c0 INT)
BEGIN
DECLARE v_count INT;
IF v_c0 <= 1000 THEN
INSERT INTO t1
WITH
s1 AS (SELECT /*+USE_HASH(t1,t2)*/ t2.* FROM t1 JOIN t2 ON t1.c0=t2.c0 WHERE t2.c1 <>ALL(SELECT c1 FROM t1 WHERE c0 > v_c0)),
s2 AS (SELECT /*+USE_HASH(t1,t2)*/ t2.* FROM t1 JOIN t2 ON t1.c0=t2.c0 WHERE t2.c1 NOT IN(SELECT c1 FROM t1 WHERE c0 < v_c0 AND c1 IS NOT NULL))
SELECT s2.* FROM s1 ,s2 WHERE s2.c1 NOT IN(SELECT c1 FROM s1 WHERE c1 IS NOT NULL);
ELSEIF v_c0 <= 2000 THEN
INSERT INTO t1
WITH
s1 AS (SELECT /*+USE_HASH(t1,t2)*/ t1.* FROM t1 JOIN t2 ON t1.c0=t2.c0 WHERE t2.c1 NOT IN(SELECT c1 FROM t1 WHERE c0 > v_c0 AND c1 IS NOT NULL)),
s2 AS (SELECT /*+USE_HASH(t1,t2)*/ t2.* FROM t1 JOIN t2 ON t1.c0=t2.c0 WHERE t2.c1 <>ALL(SELECT c1 FROM t1 WHERE c0 < v_c0))
SELECT s2.* FROM s1 JOIN s2 ON s1.c0=s2.c0 WHERE s2.c1 NOT IN(SELECT c1 FROM s1 WHERE c1 IS NOT NULL);
ELSEIF v_c0 <= 3000 THEN
UPDATE t1 SET c0=c0+1 WHERE c1 <>ALL(SELECT s1.c1 FROM
(SELECT t2.c0,t2.c1 FROM (SELECT * FROM t2) tt1 JOIN t2 ON tt1.c0=t2.c0 WHERE t2.c1 NOT IN(SELECT c1 FROM (SELECT c1,c2 FROM t2 WHERE c0 >= v_c0) tt1 WHERE tt1.c2 < 200 AND tt1.c1 IS NOT NULL)) s1 LEFT JOIN
(SELECT t2.c0,t2.c1 FROM (SELECT * FROM t2) tt2 JOIN t2 ON tt2.c0=t2.c0 WHERE t2.c1 NOT IN(SELECT c1 FROM (SELECT c1,c2 FROM t2 WHERE c0 <= v_c0) tt2 WHERE tt2.c2 < 500 AND tt2.c1 IS NOT NULL)) s2
ON s1.c0=s2.c0 WHERE s2.c1 NOT IN(SELECT c1 FROM (SELECT t2.c0,t2.c1 FROM (SELECT * FROM t2) tt1 JOIN t2 ON tt1.c0=t2.c0 WHERE t2.c1 NOT IN(SELECT c1 FROM (SELECT c1,c2 FROM t2 WHERE c0 >= v_c0) tt1 WHERE tt1.c2 < 200 AND tt1.c1 IS NOT NULL)) s1 WHERE c0>4500 AND c0 IS NOT NULL));
ELSEIF v_c0 <= 4000 THEN
DELETE FROM t1 WHERE c0 <>ALL(SELECT s2.c1 FROM
(SELECT /*+USE_HASH(tt1,t2)*/ t2.c0,t2.c1 FROM (SELECT * FROM t2 WHERE c0 <= 3170) tt1 JOIN t2 ON tt1.c0=t2.c0 WHERE t2.c1 <>ALL(SELECT c1 FROM (SELECT c1 FROM t2 WHERE c0 <= v_c0) tt1 WHERE t2.c0 > v_c0 AND c1 IS NOT NULL)) s1 JOIN
(SELECT /*+USE_HASH(tt2,t2)*/ t2.c0,t2.c1 FROM (SELECT * FROM t2 WHERE c0 >= 3170) tt2 JOIN t2 ON tt2.c0=t2.c0 WHERE t2.c1 <>ALL(SELECT c1 FROM (SELECT c1 FROM t2 WHERE c0 >= v_c0) tt2 WHERE t2.c0 < v_c0)) s2
ON s1.c0=s2.c0 WHERE s2.c1 NOT IN(SELECT c1 FROM (SELECT /*+USE_HASH(tt1,t2)*/ t2.c0,t2.c1 FROM (SELECT * FROM t2 WHERE c0 <= v_c0) tt1 JOIN t2 ON tt1.c0=t2.c0 WHERE t2.c1 <>ALL(SELECT c1 FROM (SELECT c1 FROM t2 WHERE c0 <= v_c0) tt1 WHERE t2.c0 > 3170 AND c1 IS NOT NULL)) s1));
ELSE
DELETE FROM t1 WHERE c0 <>ALL(SELECT s2.c1 FROM
(SELECT /*+USE_HASH(tt1,t2)*/ t2.c0,t2.c1 FROM (SELECT * FROM t2 WHERE c0 > v_c0) tt1 JOIN t2 ON tt1.c0=t2.c0 WHERE t2.c1 NOT IN(SELECT c1 FROM (SELECT c1 FROM t2 WHERE c0 < v_c0) tt1 WHERE t2.c0 > v_c0)) s1,
(SELECT /*+USE_HASH(tt2,t2)*/ t2.c0,t2.c1 FROM (SELECT * FROM t2 WHERE c0 > v_c0) tt2 JOIN t2 ON tt2.c0=t2.c0 WHERE NOT EXISTS(SELECT c1 FROM (SELECT c1 FROM t2 WHERE c0 < v_c0) tt2 WHERE t2.c0 < v_c0)) s2
WHERE s2.c1 NOT IN(SELECT c1 FROM (SELECT t2.c0,t2.c1 FROM t2  WHERE t2.c1 NOT IN(SELECT c1 FROM (SELECT c1 FROM t2 WHERE c0 < v_c0) tt1 WHERE t2.c0 > v_c0)) s1));
END IF;
SELECT COUNT(1) FROM t1 INTO v_count;
SELECT v_count;
END;
//
CALL test_case2(1580);
v_count
12339
CALL test_case2(2170);
v_count
12339
CALL test_case2(3170);
v_count
0
#此处本地执行报超时错误，Jenkins执行成功，且有结果输出，故先不执行
DROP PROCEDURE test_case2;
#使用WHILE循环创建的存储过程
DELETE FROM t1 WHERE 1=1;
COMMIT;
CALL p1();
SELECT COUNT(1) FROM t1;
COUNT(1)
10000
SELECT COUNT(1) FROM t2;
COUNT(1)
5000
CREATE PROCEDURE test_case3(IN v_c0 INT)
BEGIN
DECLARE a INT DEFAULT 1;
DECLARE v_count INT;
wh1:WHILE a <=5 DO
INSERT INTO t1 SELECT /*+USE_HASH(tt,t2)*/ t2.* FROM (SELECT * FROM t2 WHERE c0 >= v_c0) tt RIGHT JOIN t2 ON tt.c0 = t2.c0 WHERE t2.c1 NOT IN(SELECT c1 FROM (SELECT * FROM t2 WHERE c0 >= v_c0) tt WHERE c0 > v_c0 AND c1 IS NOT NULL) AND t2.c0 BETWEEN a AND a*100;
DELETE FROM t1 WHERE c1 NOT IN(SELECT /*+USE_HASH(t2)*/ t2.c1 FROM t2 WHERE c1 IS NOT NULL AND c1 <>ALL(SELECT c1 FROM (SELECT * FROM t2 WHERE c0 <= v_c0) tt WHERE c0 < v_c0 AND c1 IS NOT NULL) AND t2.c0 BETWEEN a*400 AND a*700);
SET a = a + 1;
END WHILE wh1;
SELECT COUNT(1) FROM t1 INTO v_count;
SELECT v_count;
END;
//
CALL test_case3(5000);
v_count
0
DROP PROCEDURE test_case3;
#使用LOOP循环创建的存储过程
DELETE FROM t1 WHERE 1=1;
COMMIT;
CALL p1();
SELECT COUNT(1) FROM t1;
COUNT(1)
10000
SELECT COUNT(1) FROM t2;
COUNT(1)
5000
CREATE PROCEDURE test_case4(IN v_c0 INT)
BEGIN
DECLARE a INT DEFAULT 1;
DECLARE v_count INT;
loop1: LOOP
INSERT INTO t1 SELECT /*+USE_HASH(t1,t2)*/ t2.* FROM t1 LEFT JOIN t2 ON t1.c0 = t2.c0 WHERE
t2.c1 NOT IN(SELECT c1 FROM t1 WHERE c0 > v_c0 AND c1 IS NOT NULL) AND t2.c0 BETWEEN a AND a*100;COMMIT;
DELETE FROM t1 WHERE c1 NOT IN(SELECT /*+USE_HASH(t2)*/ t2.c1 FROM t2 WHERE c1 IS NOT NULL AND
c1 <>ALL(SELECT c1 FROM (SELECT * FROM t2 WHERE c1 NOT IN(SELECT c1 FROM t2 WHERE c0 <=v_c0 AND c1 IS NOT NULL)) tt WHERE c0 < v_c0 AND
c1 NOT IN(SELECT c1 FROM t2 WHERE c1 IS NOT NULL AND c0 > 1000*a)) AND t2.c0 BETWEEN a*300 AND a*700);COMMIT;
IF a = 3 THEN
LEAVE loop1;
END IF;
SET a = a + 1;
END LOOP;
SELECT COUNT(1) FROM t1 INTO v_count;
SELECT v_count;
END;
//
CALL test_case4(5000);
v_count
5504
DROP PROCEDURE test_case4;
#PARTITION TABLE
DELETE FROM t1 WHERE 1=1;
CALL p1();
SELECT COUNT(1) FROM t1;
COUNT(1)
10000
SELECT COUNT(1) FROM t2;
COUNT(1)
5000
DROP TABLE IF EXISTS test1;
CREATE TABLE test1(c0 INT,c1 INT)
PARTITION BY HASH(c1) PARTITIONS 3;
INSERT INTO test1 SELECT t1.c0,t1.c1 FROM t1 WHERE c1 IS NOT NULL AND c0 < 2000;
SELECT COUNT(1) FROM test1;
COUNT(1)
1999
CREATE PROCEDURE test_case6(IN v_c0 INT)
BEGIN
DECLARE v_count INT;
IF v_c0 <= 1000 THEN
INSERT INTO test1 SELECT t1.c0,t1.c2 FROM t1 JOIN t2 ON t1.c0=t2.c0 WHERE t2.c1 NOT IN (SELECT c1 FROM t1 WHERE c1 IS NOT NULL);
ELSEIF v_c0 <= 2000 THEN
UPDATE test1 SET c1 = c1 + v_c0 WHERE c1 <>ALL(SELECT /*+USE_HASH*/ t1.c0 FROM t1 LEFT JOIN t2 ON t1.c0 = t2.c0  WHERE t2.c1 NOT IN(SELECT c1 FROM t1 WHERE c1 IS NOT NULL));
ELSE
DELETE FROM test1 WHERE c1 NOT IN(SELECT /*+USE_HASH*/ t2.c0 FROM t1 RIGHT JOIN t2 ON t1.c0 = t2.c0 WHERE t1.c1 <>ALL(SELECT c1 FROM t2));
END IF;
SELECT COUNT(1) FROM test1 INTO v_count;
SELECT v_count;
END;
//
CALL test_case6(587);
v_count
4338
CALL test_case6(1587);
v_count
4338
CALL test_case6(2217);
v_count
0
DROP PROCEDURE test_case6;
DROP TABLE test1;
#调用 FUNCTION
CREATE FUNCTION f_test1(v_c0 INT,v_c1 VARCHAR(10))
RETURNS VARCHAR(100)
BEGIN
DECLARE v_count_t1 INT;
DECLARE v_count_t2 INT;
DECLARE v_count_t3 VARCHAR(100);
IF v_c0 <= 2000 AND v_c1 = '100AB' THEN
INSERT INTO t1 SELECT /*+USE_HASH(t1,t2)*/ t2.* FROM t2 WHERE
t2.c1 NOT IN(SELECT c1 FROM t1 WHERE c0 > v_c0 AND c1 IS NOT NULL) AND t2.c0 BETWEEN v_c0-100 AND v_c0;
DELETE FROM t2 WHERE c1 <>ALL(SELECT /*+USE_HASH(t1)*/ t1.c1 FROM t1 WHERE
c1 IS NOT NULL AND c1 NOT IN(SELECT c1 FROM t1 WHERE c0 < v_c0 AND c1 NOT IN(SELECT c1 FROM t1 WHERE c1 IS NOT NULL AND c0 > v_c0-100)) AND t1.c0 >= v_c0);
ELSEIF v_c0 <= 4000 AND v_c1 = '@ % *' THEN
INSERT INTO t2 SELECT /*+USE_HASH(t1,t2)*/ t1.* FROM t1 WHERE
t1.c1 NOT IN(SELECT c1 FROM t2 WHERE c0 > v_c0) AND t1.c0 BETWEEN v_c0-100 AND v_c0;
DELETE FROM t1 WHERE c1 <>ALL(SELECT /*+USE_HASH(t2)*/ t2.c1 FROM t2 WHERE
c1 IS NOT NULL AND c1 NOT IN(SELECT c1 FROM t2 WHERE c0 < v_c0 AND c1 NOT IN(SELECT c1 FROM t2 WHERE c0 > v_c0-100)) AND t2.c0 >= v_c0);
ELSE
INSERT INTO t1 SELECT /*+USE_HASH(t1,t2)*/ t2.* FROM t2 WHERE
t2.c1 NOT IN(SELECT c1 FROM t1 WHERE c0 > v_c0 AND c1 IS NOT NULL) AND t2.c0 BETWEEN v_c0-100 AND v_c0;
DELETE FROM t2 WHERE c1 <>ALL(SELECT /*+USE_NL(t1)*/ t1.c1 FROM t1 WHERE
c1 <>ALL(SELECT c1 FROM t1 WHERE c0 < v_c0 AND c1 <>ALL(SELECT c1 FROM t1 WHERE c0 > v_c0-100)) AND t1.c0 <= v_c0);
END IF;
SELECT COUNT(1) INTO v_count_t1 FROM t1;
SELECT COUNT(1) INTO v_count_t2 FROM t2;
SET v_count_t3 = CONCAT('t1表执行函数后条目合计：',v_count_t1,', t2表执行函数后条目合计：',v_count_t2);
RETURN v_count_t3;
END;
//
SELECT f_test1(3345,'100AB');
f_test1(3345,'100AB')
t1表执行函数后条目合计：10062, t2表执行函数后条目合计：3455
SELECT f_test1(1545,'100AB');
f_test1(1545,'100AB')
t1表执行函数后条目合计：10074, t2表执行函数后条目合计：3385
SELECT f_test1(4545,'100AB');
f_test1(4545,'100AB')
t1表执行函数后条目合计：10119, t2表执行函数后条目合计：3385
SELECT f_test1(2345,'@ % *');
f_test1(2345,'@ % *')
t1表执行函数后条目合计：3106, t2表执行函数后条目合计：3385
SELECT f_test1(5,'中');
f_test1(5,'中')
t1表执行函数后条目合计：3106, t2表执行函数后条目合计：1493
DROP FUNCTION f_test1;
DROP PROCEDURE p1;
DROP PROCEDURE p2;
DROP TABLE IF EXISTS t2;
DROP TABLE IF EXISTS t1;
DROP USER 'zhang'@'%';
DROP DATABASE naaj_test;
#########Empty recycle bin, delete test database, tables, etc##########
