purge recyclebin;
# 环境清理
DROP USER zhang;
ERROR HY000: Operation DROP USER failed for 'zhang'@'%'
CREATE USER 'zhang'@'%' IDENTIFIED BY 'zhang';
GRANT all ON *.* TO 'zhang'@'%';
CREATE DATABASE IF NOT EXISTS naaj_test;
USE naaj_test;
################Setting ''_ optimizer_ null_ aware_ Antijoin 'is OFF################
SET _optimizer_null_aware_antijoin=OFF;
DROP TABLE t1;
ERROR 42S02: Unknown table 'naaj_test.t1'
DROP TABLE t2;
ERROR 42S02: Unknown table 'naaj_test.t2'
#CHAR TYPE
CREATE TABLE t1(c0 INT,c1 CHAR(10));
CREATE TABLE t2(c0 INT,c1 CHAR(10));
INSERT INTO t1 VALUES(1,'A');
INSERT INTO t1 VALUES(2,12);
INSERT INTO t1 VALUES(3,'A');
INSERT INTO t1 VALUES(4,NULL);
INSERT INTO t1 VALUES(1,12);
INSERT INTO t2 VALUES(2,'AB');
INSERT INTO t2 VALUES(3,'');
INSERT INTO t2 VALUES(4,NULL);
SELECT * FROM t1 ORDER BY c0,c1;
c0	c1
1	12
1	A
2	12
3	A
4	NULL
SELECT * FROM t2 ORDER BY c0,c1;
c0	c1
2	AB
3	
4	NULL
#There are null values on the right side of the left table
#IF "_optimizer_null_aware_antijoin"=ON,EXPLAIN:HASH JOIN ANTI NA
SELECT * FROM t1 WHERE c1 NOT IN (SELECT c1 FROM t2) ORDER BY 1,2;
c0	c1
SELECT * FROM t1 WHERE NOT EXISTS (SELECT c1 FROM t2) ORDER BY 1,2;
c0	c1
#IF "_optimizer_null_aware_antijoin"=TRUE,EXPLAIN:HASH JOIN ANTI SNA
SELECT * FROM t1 WHERE c1 NOT IN (SELECT c1 FROM t2 WHERE t2.c1 IS NOT NULL) ORDER BY 1,2;
c0	c1
1	12
1	A
2	12
3	A
SELECT * FROM t1 WHERE NOT EXISTS (SELECT c1 FROM t2 WHERE t2.c1 IS NOT NULL) ORDER BY 1,2;
c0	c1
#INNER JOIN
#IF "_optimizer_null_aware_antijoin"=ON,EXPLAIN:HASH JOIN ANTI NA
SELECT * FROM t1 JOIN t2 ON t1.c0=t2.c0 AND t1.c1 NOT IN (SELECT c1 FROM t2) ORDER BY 1,2;
c0	c1	c0	c1
SELECT * FROM t1 JOIN t2 ON t1.c0=t2.c0 AND NOT EXISTS (SELECT c1 FROM t2) ORDER BY 1,2;
c0	c1	c0	c1
#IF "_optimizer_null_aware_antijoin"=TRUE,EXPLAIN:HASH JOIN ANTI SNA
SELECT * FROM t1 JOIN t2 ON t1.c0=t2.c0 AND t1.c1 NOT IN (SELECT c1 FROM t2 WHERE t2.c1 IS NOT NULL) ORDER BY 1,2;
c0	c1	c0	c1
2	12	2	AB
3	A	3	
SELECT * FROM t1 JOIN t2 ON t1.c0=t2.c0 AND NOT EXISTS (SELECT c1 FROM t2 WHERE t2.c1 IS NOT NULL) ORDER BY 1,2;
c0	c1	c0	c1
#RIGHT JOIN
#IF "_optimizer_null_aware_antijoin"=ON,EXPLAIN:HASH JOIN ANTI NA
SELECT * FROM t1 RIGHT JOIN t2 ON t1.c0=t2.c0 AND t1.c1 NOT IN (SELECT c1 FROM t2) ORDER BY 1,2,3;
c0	c1	c0	c1
NULL	NULL	2	AB
NULL	NULL	3	
NULL	NULL	4	NULL
SELECT * FROM t1 RIGHT JOIN t2 ON t1.c0=t2.c0 AND t1.c1 <>ALL (SELECT c1 FROM t2) ORDER BY 1,2,3;
c0	c1	c0	c1
NULL	NULL	2	AB
NULL	NULL	3	
NULL	NULL	4	NULL
SELECT * FROM t1 RIGHT JOIN t2 ON t1.c0=t2.c0 AND NOT EXISTS (SELECT c1 FROM t2) ORDER BY 1,2,3;
c0	c1	c0	c1
NULL	NULL	2	AB
NULL	NULL	3	
NULL	NULL	4	NULL
#IF "_optimizer_null_aware_antijoin"=ON,EXPLAIN:HASH JOIN ANTI SNA
SELECT * FROM t1 RIGHT JOIN t2 ON t1.c0=t2.c0 AND t1.c1 NOT IN (SELECT c1 FROM t2 WHERE t2.c1 IS NOT NULL) ORDER BY 1,2,3;
c0	c1	c0	c1
NULL	NULL	4	NULL
2	12	2	AB
3	A	3	
SELECT * FROM t1 RIGHT JOIN t2 ON t1.c0=t2.c0 AND t1.c1 <>ALL (SELECT c1 FROM t2 WHERE t2.c1 IS NOT NULL) ORDER BY 1,2,3;
c0	c1	c0	c1
NULL	NULL	4	NULL
2	12	2	AB
3	A	3	
SELECT * FROM t1 RIGHT JOIN t2 ON t1.c0=t2.c0 AND NOT EXISTS (SELECT c1 FROM t2 WHERE t2.c1 IS NOT NULL) ORDER BY 1,2,3;
c0	c1	c0	c1
NULL	NULL	2	AB
NULL	NULL	3	
NULL	NULL	4	NULL
#LEFT JOIN
#IF "_optimizer_null_aware_antijoin"=ON,EXPLAIN:HASH JOIN ANTI NA
SELECT * FROM t1 LEFT JOIN t2 ON t1.c0=t2.c0 WHERE t1.c1 NOT IN (SELECT c1 FROM t2) ORDER BY 1,2;
c0	c1	c0	c1
SELECT * FROM t1 LEFT JOIN t2 ON t1.c0=t2.c0 WHERE t1.c1 <>ALL (SELECT c1 FROM t2) ORDER BY 1,2;
c0	c1	c0	c1
SELECT * FROM t1 LEFT JOIN t2 ON t1.c0=t2.c0 WHERE NOT EXISTS (SELECT c1 FROM t2) ORDER BY 1,2;
c0	c1	c0	c1
#IF "_optimizer_null_aware_antijoin"=ON,EXPLAIN:HASH JOIN ANTI SNA
SELECT * FROM t1 LEFT JOIN t2 ON t1.c0=t2.c0 WHERE t1.c1 NOT IN (SELECT c1 FROM t2 WHERE t2.c1 IS NOT NULL) ORDER BY 1,2,3;
c0	c1	c0	c1
1	12	NULL	NULL
1	A	NULL	NULL
2	12	2	AB
3	A	3	
SELECT * FROM t1 LEFT JOIN t2 ON t1.c0=t2.c0 WHERE t1.c1 <>ALL (SELECT c1 FROM t2 WHERE t2.c1 IS NOT NULL) ORDER BY 1,2,3;
c0	c1	c0	c1
1	12	NULL	NULL
1	A	NULL	NULL
2	12	2	AB
3	A	3	
SELECT * FROM t1 LEFT JOIN t2 ON t1.c0=t2.c0 WHERE NOT EXISTS (SELECT c1 FROM t2 WHERE t2.c1 IS NOT NULL) ORDER BY 1,2,3;
c0	c1	c0	c1
#FULL JOIN
#IF "_optimizer_null_aware_antijoin"=ON,EXPLAIN:HASH JOIN ANTI NA
SELECT * FROM t1 FULL JOIN t2 ON t1.c0=t2.c0 WHERE t1.c1 NOT IN (SELECT c1 FROM t2) ORDER BY 1,2;
c0	c1	c0	c1
SELECT * FROM t1 FULL JOIN t2 ON t1.c0=t2.c0 WHERE t1.c1 <>ALL (SELECT c1 FROM t2) ORDER BY 1,2;
c0	c1	c0	c1
SELECT * FROM t1 FULL JOIN t2 ON t1.c0=t2.c0 WHERE NOT EXISTS (SELECT c1 FROM t2) ORDER BY 1,2;
c0	c1	c0	c1
#IF "_optimizer_null_aware_antijoin"=ON,EXPLAIN:HASH JOIN ANTI SNA
SELECT * FROM t1 FULL JOIN t2 ON t1.c0=t2.c0 WHERE t1.c1 NOT IN (SELECT c1 FROM t2 WHERE t2.c1 IS NOT NULL) ORDER BY 1,2,3;
c0	c1	c0	c1
1	12	NULL	NULL
1	A	NULL	NULL
2	12	2	AB
3	A	3	
SELECT * FROM t1 FULL JOIN t2 ON t1.c0=t2.c0 WHERE t1.c1 <>ALL (SELECT c1 FROM t2 WHERE t2.c1 IS NOT NULL) ORDER BY 1,2,3;
c0	c1	c0	c1
1	12	NULL	NULL
1	A	NULL	NULL
2	12	2	AB
3	A	3	
SELECT * FROM t1 FULL JOIN t2 ON t1.c0=t2.c0 WHERE NOT EXISTS (SELECT c1 FROM t2 WHERE t2.c1 IS NOT NULL) ORDER BY 1,2,3;
c0	c1	c0	c1
#HINT
#IF "_optimizer_null_aware_antijoin"=ON,EXPLAIN:HASH JOIN ANTI NA
SELECT /*+USE_HASH(t1,t2)*/ * FROM t1 WHERE c1 NOT IN (SELECT c1 FROM t2) ORDER BY 1,2;
c0	c1
SELECT /*+USE_HASH(t1,t2)*/ * FROM t1 JOIN t2 ON t1.c0=t2.c0 AND t1.c1 <>ALL (SELECT c1 FROM t2) ORDER BY 1,2;
c0	c1	c0	c1
SELECT /*+USE_HASH(t1,t2)*/ * FROM t1 RIGHT JOIN t2 ON t1.c0=t2.c0 WHERE t1.c1 NOT IN (SELECT c1 FROM t2) ORDER BY 1,2;
c0	c1	c0	c1
SELECT /*+USE_NLJ(t1,t2)*/ * FROM t1 RIGHT JOIN t2 ON t1.c0=t2.c0 WHERE t1.c1 NOT IN (SELECT c1 FROM t2) ORDER BY 1,2;
c0	c1	c0	c1
SELECT /*+USE_MJ(t1,t2)*/ * FROM t1 JOIN t2 ON t1.c0=t2.c0 AND t1.c1 <>ALL (SELECT c1 FROM t2) ORDER BY 1,2;
c0	c1	c0	c1
SELECT /*+USE_HASH(t1,t2)*/ * FROM t1 WHERE NOT EXISTS (SELECT c1 FROM t2) ORDER BY 1,2;
c0	c1
SELECT /*+USE_HASH(t1,t2)*/ * FROM t1 WHERE c1 NOT IN (SELECT c1 FROM t2) ORDER BY 1,2;
c0	c1
SELECT /*+USE_NL(t1,t2)*/ * FROM t1 JOIN t2 ON t1.c0=t2.c0 AND t1.c1 <>ALL (SELECT c1 FROM t2) ORDER BY 1,2;
c0	c1	c0	c1
SELECT /*+USE_MJ(t1,t2)*/ * FROM t1 JOIN t2 ON t1.c0=t2.c0 AND t1.c1 <>ALL (SELECT c1 FROM t2) ORDER BY 1,2;
c0	c1	c0	c1
#IF "_optimizer_null_aware_antijoin"=ON,EXPLAIN:HASH JOIN ANTI SNA
SELECT /*+USE_HASH(t1,t2)*/ * FROM t1 WHERE c1 NOT IN (SELECT c1 FROM t2 WHERE t2.c1 IS NOT NULL) ORDER BY 1,2;
c0	c1
1	12
1	A
2	12
3	A
SELECT /*+USE_HASH(t1,t2)*/ * FROM t1 JOIN t2 ON t1.c0=t2.c0 AND t1.c1 <>ALL (SELECT c1 FROM t2 WHERE t2.c1 IS NOT NULL) ORDER BY 1,2;
c0	c1	c0	c1
2	12	2	AB
3	A	3	
SELECT /*+USE_HASH(t1,t2)*/ * FROM t1 RIGHT JOIN t2 ON t1.c0=t2.c0 WHERE t1.c1 NOT IN (SELECT c1 FROM t2 WHERE t2.c1 IS NOT NULL) ORDER BY 1,2;
c0	c1	c0	c1
2	12	2	AB
3	A	3	
SELECT /*+USE_NLJ(t1,t2)*/ * FROM t1 RIGHT JOIN t2 ON t1.c0=t2.c0 WHERE t1.c1 NOT IN (SELECT c1 FROM t2 WHERE t2.c1 IS NOT NULL) ORDER BY 1,2;
c0	c1	c0	c1
2	12	2	AB
3	A	3	
SELECT /*+USE_MJ(t1,t2)*/ * FROM t1 JOIN t2 ON t1.c0=t2.c0 AND t1.c1 <>ALL (SELECT c1 FROM t2 WHERE t2.c1 IS NOT NULL) ORDER BY 1,2;
c0	c1	c0	c1
2	12	2	AB
3	A	3	
SELECT /*+USE_HASH(t1,t2)*/ * FROM t1 WHERE NOT EXISTS (SELECT c1 FROM t2 WHERE t2.c1 IS NOT NULL) ORDER BY 1,2;
c0	c1
SELECT /*+USE_HASH(t1,t2)*/ * FROM t1 WHERE c1 NOT IN (SELECT c1 FROM t2 WHERE t2.c1 IS NOT NULL) ORDER BY 1,2;
c0	c1
1	12
1	A
2	12
3	A
SELECT /*+USE_NL(t1,t2)*/ * FROM t1 JOIN t2 ON t1.c0=t2.c0 AND t1.c1 <>ALL (SELECT c1 FROM t2 WHERE t2.c1 IS NOT NULL) ORDER BY 1,2;
c0	c1	c0	c1
2	12	2	AB
3	A	3	
SELECT /*+USE_MJ(t1,t2)*/ * FROM t1 JOIN t2 ON t1.c0=t2.c0 AND t1.c1 <>ALL (SELECT c1 FROM t2 WHERE t2.c1 IS NOT NULL) ORDER BY 1,2;
c0	c1	c0	c1
2	12	2	AB
3	A	3	
#PARALLEL
#IF "_optimizer_null_aware_antijoin"=ON,EXPLAIN:HASH JOIN ANTI NA
SELECT /*+parallel(2) USE_HASH(t1,t2)*/ * FROM t1 WHERE c1 NOT IN (SELECT c1 FROM t2) ORDER BY 1,2;
c0	c1
SELECT /*+parallel(2) USE_HASH(t1,t2)*/ * FROM t1 WHERE c1 <>ALL (SELECT c1 FROM t2) ORDER BY 1,2;
c0	c1
SELECT /*+parallel(2) USE_NL(t1,t2)*/ * FROM t1 WHERE c1 <>ALL (SELECT c1 FROM t2) ORDER BY 1,2;
c0	c1
SELECT /*+parallel(2) USE_HASH(t1,t2)*/ * FROM t1 WHERE NOT EXISTS (SELECT c1 FROM t2) ORDER BY 1,2;
c0	c1
SELECT /*+parallel(5) USE_HASH(t1,t2)*/ * FROM t1 WHERE c1 NOT IN (SELECT c1 FROM t2) ORDER BY 1,2;
c0	c1
SELECT /*+parallel(5) USE_NLJ(t1,t2)*/ * FROM t1 WHERE c1 NOT IN (SELECT c1 FROM t2) ORDER BY 1,2;
c0	c1
SELECT /*+parallel(5) USE_HASH(t1,t2)*/ * FROM t1 WHERE c1 <>ALL (SELECT c1 FROM t2) ORDER BY 1,2;
c0	c1
SELECT /*+parallel(5) USE_MJ(t1,t2)*/ * FROM t1 WHERE c1 NOT IN (SELECT c1 FROM t2) ORDER BY 1,2;
c0	c1
SELECT /*+parallel(5) USE_HASH(t1,t2)*/ * FROM t1 WHERE NOT EXISTS (SELECT c1 FROM t2) ORDER BY 1,2;
c0	c1
SELECT /*+parallel(2) USE_HASH(t1,t2)*/ * FROM t1,t2 WHERE t1.c0=t2.c0 AND t1.c1 NOT IN (SELECT c1 FROM t2) ORDER BY 1,2;
c0	c1	c0	c1
SELECT /*+parallel(2) USE_HASH(t1,t2)*/ * FROM t1,t2 WHERE t1.c0=t2.c0 AND t1.c1 <>ALL (SELECT c1 FROM t2) ORDER BY 1,2;
c0	c1	c0	c1
SELECT /*+parallel(2) USE_MJ(t1,t2)*/ * FROM t1,t2 WHERE t1.c0=t2.c0 AND t1.c1 <>ALL (SELECT c1 FROM t2) ORDER BY 1,2;
c0	c1	c0	c1
SELECT /*+parallel(2) USE_NL(t1,t2)*/ * FROM t1,t2 WHERE t1.c0=t2.c0 AND t1.c1 NOT IN (SELECT c1 FROM t2) ORDER BY 1,2;
c0	c1	c0	c1
SELECT /*+parallel(2) USE_HASH(t1,t2)*/ * FROM t1,t2 WHERE t1.c0=t2.c0 AND NOT EXISTS (SELECT c1 FROM t2) ORDER BY 1,2;
c0	c1	c0	c1
#IF "_optimizer_null_aware_antijoin"=ON,EXPLAIN:HASH JOIN ANTI SNA
SELECT /*+parallel(2) USE_HASH(t1,t2)*/ * FROM t1 WHERE c1 NOT IN (SELECT c1 FROM t2 WHERE t2.c1 IS NOT NULL) ORDER BY 1,2;
c0	c1
1	12
1	A
2	12
3	A
SELECT /*+parallel(2) USE_HASH(t1,t2)*/ * FROM t1 WHERE c1 <>ALL (SELECT c1 FROM t2 WHERE t2.c1 IS NOT NULL) ORDER BY 1,2;
c0	c1
1	12
1	A
2	12
3	A
SELECT /*+parallel(2) USE_NL(t1,t2)*/ * FROM t1 WHERE c1 <>ALL (SELECT c1 FROM t2 WHERE t2.c1 IS NOT NULL) ORDER BY 1,2;
c0	c1
1	12
1	A
2	12
3	A
SELECT /*+parallel(2) USE_HASH(t1,t2)*/ * FROM t1 WHERE NOT EXISTS (SELECT c1 FROM t2 WHERE t2.c1 IS NOT NULL) ORDER BY 1,2;
c0	c1
SELECT /*+parallel(5) USE_HASH(t1,t2)*/ * FROM t1 WHERE c1 NOT IN (SELECT c1 FROM t2 WHERE t2.c1 IS NOT NULL) ORDER BY 1,2;
c0	c1
1	12
1	A
2	12
3	A
SELECT /*+parallel(5) USE_NLJ(t1,t2)*/ * FROM t1 WHERE c1 NOT IN (SELECT c1 FROM t2 WHERE t2.c1 IS NOT NULL) ORDER BY 1,2;
c0	c1
1	12
1	A
2	12
3	A
SELECT /*+parallel(5) USE_HASH(t1,t2)*/ * FROM t1 WHERE c1 <>ALL (SELECT c1 FROM t2 WHERE t2.c1 IS NOT NULL) ORDER BY 1,2;
c0	c1
1	12
1	A
2	12
3	A
SELECT /*+parallel(5) USE_MJ(t1,t2)*/ * FROM t1 WHERE c1 NOT IN (SELECT c1 FROM t2 WHERE t2.c1 IS NOT NULL) ORDER BY 1,2;
c0	c1
1	12
1	A
2	12
3	A
SELECT /*+parallel(5) USE_HASH(t1,t2)*/ * FROM t1 WHERE NOT EXISTS (SELECT c1 FROM t2 WHERE t2.c1 IS NOT NULL) ORDER BY 1,2;
c0	c1
SELECT /*+parallel(2) USE_HASH(t1,t2)*/ * FROM t1,t2 WHERE t1.c0=t2.c0 AND t1.c1 NOT IN (SELECT c1 FROM t2 WHERE t2.c1 IS NOT NULL) ORDER BY 1,2;
c0	c1	c0	c1
2	12	2	AB
3	A	3	
SELECT /*+parallel(2) USE_HASH(t1,t2)*/ * FROM t1,t2 WHERE t1.c0=t2.c0 AND t1.c1 <>ALL (SELECT c1 FROM t2 WHERE t2.c1 IS NOT NULL) ORDER BY 1,2;
c0	c1	c0	c1
2	12	2	AB
3	A	3	
SELECT /*+parallel(2) USE_MJ(t1,t2)*/ * FROM t1,t2 WHERE t1.c0=t2.c0 AND t1.c1 <>ALL (SELECT c1 FROM t2 WHERE t2.c1 IS NOT NULL) ORDER BY 1,2;
c0	c1	c0	c1
2	12	2	AB
3	A	3	
SELECT /*+parallel(2) USE_NL(t1,t2)*/ * FROM t1,t2 WHERE t1.c0=t2.c0 AND t1.c1 NOT IN (SELECT c1 FROM t2 WHERE t2.c1 IS NOT NULL) ORDER BY 1,2;
c0	c1	c0	c1
2	12	2	AB
3	A	3	
SELECT /*+parallel(2) USE_HASH(t1,t2)*/ * FROM t1,t2 WHERE t1.c0=t2.c0 AND NOT EXISTS (SELECT c1 FROM t2 WHERE t2.c1 IS NOT NULL) ORDER BY 1,2;
c0	c1	c0	c1
#There are null values on the right table
DELETE FROM t1 WHERE c0=4;
SELECT * FROM t1 ORDER BY c0,c1;
c0	c1
1	12
1	A
2	12
3	A
#IF "_optimizer_null_aware_antijoin"=ON,EXPLAIN:HASH JOIN ANTI NA
SELECT * FROM t1 WHERE c1 NOT IN (SELECT c1 FROM t2) ORDER BY 1,2;
c0	c1
SELECT * FROM t1 WHERE NOT EXISTS (SELECT c1 FROM t2) ORDER BY 1,2;
c0	c1
#IF "_optimizer_null_aware_antijoin"=TRUE,EXPLAIN:HASH JOIN ANTI SNA
SELECT * FROM t1 WHERE c1 NOT IN (SELECT c1 FROM t2 WHERE t2.c1 IS NOT NULL) ORDER BY 1,2;
c0	c1
1	12
1	A
2	12
3	A
SELECT * FROM t1 WHERE NOT EXISTS (SELECT c1 FROM t2 WHERE t2.c1 IS NOT NULL) ORDER BY 1,2;
c0	c1
#INNER JOIN
#IF "_optimizer_null_aware_antijoin"=ON,EXPLAIN:HASH JOIN ANTI NA
SELECT * FROM t1 JOIN t2 ON t1.c0=t2.c0 AND t1.c1 NOT IN (SELECT c1 FROM t2) ORDER BY 1,2;
c0	c1	c0	c1
SELECT * FROM t1 JOIN t2 ON t1.c0=t2.c0 AND NOT EXISTS (SELECT c1 FROM t2) ORDER BY 1,2;
c0	c1	c0	c1
#IF "_optimizer_null_aware_antijoin"=TRUE,EXPLAIN:HASH JOIN ANTI SNA
SELECT * FROM t1 JOIN t2 ON t1.c0=t2.c0 AND t1.c1 NOT IN (SELECT c1 FROM t2 WHERE t2.c1 IS NOT NULL) ORDER BY 1,2;
c0	c1	c0	c1
2	12	2	AB
3	A	3	
SELECT * FROM t1 JOIN t2 ON t1.c0=t2.c0 AND NOT EXISTS (SELECT c1 FROM t2 WHERE t2.c1 IS NOT NULL) ORDER BY 1,2;
c0	c1	c0	c1
#RIGHT JOIN
#IF "_optimizer_null_aware_antijoin"=ON,EXPLAIN:HASH JOIN ANTI NA
SELECT * FROM t1 RIGHT JOIN t2 ON t1.c0=t2.c0 AND t1.c1 NOT IN (SELECT c1 FROM t2) ORDER BY 1,2,3;
c0	c1	c0	c1
NULL	NULL	2	AB
NULL	NULL	3	
NULL	NULL	4	NULL
SELECT * FROM t1 RIGHT JOIN t2 ON t1.c0=t2.c0 AND t1.c1 <>ALL (SELECT c1 FROM t2) ORDER BY 1,2,3;
c0	c1	c0	c1
NULL	NULL	2	AB
NULL	NULL	3	
NULL	NULL	4	NULL
SELECT * FROM t1 RIGHT JOIN t2 ON t1.c0=t2.c0 AND NOT EXISTS (SELECT c1 FROM t2) ORDER BY 1,2,3;
c0	c1	c0	c1
NULL	NULL	2	AB
NULL	NULL	3	
NULL	NULL	4	NULL
#IF "_optimizer_null_aware_antijoin"=ON,EXPLAIN:HASH JOIN ANTI SNA
SELECT * FROM t1 RIGHT JOIN t2 ON t1.c0=t2.c0 AND t1.c1 NOT IN (SELECT c1 FROM t2 WHERE t2.c1 IS NOT NULL) ORDER BY 1,2,3;
c0	c1	c0	c1
NULL	NULL	4	NULL
2	12	2	AB
3	A	3	
SELECT * FROM t1 RIGHT JOIN t2 ON t1.c0=t2.c0 AND t1.c1 <>ALL (SELECT c1 FROM t2 WHERE t2.c1 IS NOT NULL) ORDER BY 1,2,3;
c0	c1	c0	c1
NULL	NULL	4	NULL
2	12	2	AB
3	A	3	
SELECT * FROM t1 RIGHT JOIN t2 ON t1.c0=t2.c0 AND NOT EXISTS (SELECT c1 FROM t2 WHERE t2.c1 IS NOT NULL) ORDER BY 1,2,3;
c0	c1	c0	c1
NULL	NULL	2	AB
NULL	NULL	3	
NULL	NULL	4	NULL
#LEFT JOIN
#IF "_optimizer_null_aware_antijoin"=ON,EXPLAIN:HASH JOIN ANTI NA
SELECT * FROM t1 LEFT JOIN t2 ON t1.c0=t2.c0 WHERE t1.c1 NOT IN (SELECT c1 FROM t2) ORDER BY 1,2;
c0	c1	c0	c1
SELECT * FROM t1 LEFT JOIN t2 ON t1.c0=t2.c0 WHERE t1.c1 <>ALL (SELECT c1 FROM t2) ORDER BY 1,2;
c0	c1	c0	c1
SELECT * FROM t1 LEFT JOIN t2 ON t1.c0=t2.c0 WHERE NOT EXISTS (SELECT c1 FROM t2) ORDER BY 1,2;
c0	c1	c0	c1
#IF "_optimizer_null_aware_antijoin"=ON,EXPLAIN:HASH JOIN ANTI SNA
SELECT * FROM t1 LEFT JOIN t2 ON t1.c0=t2.c0 WHERE t1.c1 NOT IN (SELECT c1 FROM t2 WHERE t2.c1 IS NOT NULL) ORDER BY 1,2,3;
c0	c1	c0	c1
1	12	NULL	NULL
1	A	NULL	NULL
2	12	2	AB
3	A	3	
SELECT * FROM t1 LEFT JOIN t2 ON t1.c0=t2.c0 WHERE t1.c1 <>ALL (SELECT c1 FROM t2 WHERE t2.c1 IS NOT NULL) ORDER BY 1,2,3;
c0	c1	c0	c1
1	12	NULL	NULL
1	A	NULL	NULL
2	12	2	AB
3	A	3	
SELECT * FROM t1 LEFT JOIN t2 ON t1.c0=t2.c0 WHERE NOT EXISTS (SELECT c1 FROM t2 WHERE t2.c1 IS NOT NULL) ORDER BY 1,2,3;
c0	c1	c0	c1
#FULL JOIN
#IF "_optimizer_null_aware_antijoin"=ON,EXPLAIN:HASH JOIN ANTI NA
SELECT * FROM t1 FULL JOIN t2 ON t1.c0=t2.c0 WHERE t1.c1 NOT IN (SELECT c1 FROM t2) ORDER BY 1,2;
c0	c1	c0	c1
SELECT * FROM t1 FULL JOIN t2 ON t1.c0=t2.c0 WHERE t1.c1 <>ALL (SELECT c1 FROM t2) ORDER BY 1,2;
c0	c1	c0	c1
SELECT * FROM t1 FULL JOIN t2 ON t1.c0=t2.c0 WHERE NOT EXISTS (SELECT c1 FROM t2) ORDER BY 1,2;
c0	c1	c0	c1
#IF "_optimizer_null_aware_antijoin"=ON,EXPLAIN:HASH JOIN ANTI SNA
SELECT * FROM t1 FULL JOIN t2 ON t1.c0=t2.c0 WHERE t1.c1 NOT IN (SELECT c1 FROM t2 WHERE t2.c1 IS NOT NULL) ORDER BY 1,2,3;
c0	c1	c0	c1
1	12	NULL	NULL
1	A	NULL	NULL
2	12	2	AB
3	A	3	
SELECT * FROM t1 FULL JOIN t2 ON t1.c0=t2.c0 WHERE t1.c1 <>ALL (SELECT c1 FROM t2 WHERE t2.c1 IS NOT NULL) ORDER BY 1,2,3;
c0	c1	c0	c1
1	12	NULL	NULL
1	A	NULL	NULL
2	12	2	AB
3	A	3	
SELECT * FROM t1 FULL JOIN t2 ON t1.c0=t2.c0 WHERE NOT EXISTS (SELECT c1 FROM t2 WHERE t2.c1 IS NOT NULL) ORDER BY 1,2,3;
c0	c1	c0	c1
#HINT
#IF "_optimizer_null_aware_antijoin"=ON,EXPLAIN:HASH JOIN ANTI NA
SELECT /*+USE_HASH(t1,t2)*/ * FROM t1 WHERE c1 NOT IN (SELECT c1 FROM t2) ORDER BY 1,2;
c0	c1
SELECT /*+USE_HASH(t1,t2)*/ * FROM t1 JOIN t2 ON t1.c0=t2.c0 AND t1.c1 <>ALL (SELECT c1 FROM t2) ORDER BY 1,2;
c0	c1	c0	c1
SELECT /*+USE_HASH(t1,t2)*/ * FROM t1 RIGHT JOIN t2 ON t1.c0=t2.c0 WHERE t1.c1 NOT IN (SELECT c1 FROM t2) ORDER BY 1,2;
c0	c1	c0	c1
SELECT /*+USE_NLJ(t1,t2)*/ * FROM t1 RIGHT JOIN t2 ON t1.c0=t2.c0 WHERE t1.c1 NOT IN (SELECT c1 FROM t2) ORDER BY 1,2;
c0	c1	c0	c1
SELECT /*+USE_MJ(t1,t2)*/ * FROM t1 JOIN t2 ON t1.c0=t2.c0 AND t1.c1 <>ALL (SELECT c1 FROM t2) ORDER BY 1,2;
c0	c1	c0	c1
SELECT /*+USE_HASH(t1,t2)*/ * FROM t1 WHERE NOT EXISTS (SELECT c1 FROM t2) ORDER BY 1,2;
c0	c1
SELECT /*+USE_HASH(t1,t2)*/ * FROM t1 WHERE c1 NOT IN (SELECT c1 FROM t2) ORDER BY 1,2;
c0	c1
SELECT /*+USE_NL(t1,t2)*/ * FROM t1 JOIN t2 ON t1.c0=t2.c0 AND t1.c1 <>ALL (SELECT c1 FROM t2) ORDER BY 1,2;
c0	c1	c0	c1
SELECT /*+USE_MJ(t1,t2)*/ * FROM t1 JOIN t2 ON t1.c0=t2.c0 AND t1.c1 <>ALL (SELECT c1 FROM t2) ORDER BY 1,2;
c0	c1	c0	c1
#IF "_optimizer_null_aware_antijoin"=ON,EXPLAIN:HASH JOIN ANTI SNA
SELECT /*+USE_HASH(t1,t2)*/ * FROM t1 WHERE c1 NOT IN (SELECT c1 FROM t2 WHERE t2.c1 IS NOT NULL) ORDER BY 1,2;
c0	c1
1	12
1	A
2	12
3	A
SELECT /*+USE_HASH(t1,t2)*/ * FROM t1 JOIN t2 ON t1.c0=t2.c0 AND t1.c1 <>ALL (SELECT c1 FROM t2 WHERE t2.c1 IS NOT NULL) ORDER BY 1,2;
c0	c1	c0	c1
2	12	2	AB
3	A	3	
SELECT /*+USE_HASH(t1,t2)*/ * FROM t1 RIGHT JOIN t2 ON t1.c0=t2.c0 WHERE t1.c1 NOT IN (SELECT c1 FROM t2 WHERE t2.c1 IS NOT NULL) ORDER BY 1,2;
c0	c1	c0	c1
2	12	2	AB
3	A	3	
SELECT /*+USE_NLJ(t1,t2)*/ * FROM t1 RIGHT JOIN t2 ON t1.c0=t2.c0 WHERE t1.c1 NOT IN (SELECT c1 FROM t2 WHERE t2.c1 IS NOT NULL) ORDER BY 1,2;
c0	c1	c0	c1
2	12	2	AB
3	A	3	
SELECT /*+USE_MJ(t1,t2)*/ * FROM t1 JOIN t2 ON t1.c0=t2.c0 AND t1.c1 <>ALL (SELECT c1 FROM t2 WHERE t2.c1 IS NOT NULL) ORDER BY 1,2;
c0	c1	c0	c1
2	12	2	AB
3	A	3	
SELECT /*+USE_HASH(t1,t2)*/ * FROM t1 WHERE NOT EXISTS (SELECT c1 FROM t2 WHERE t2.c1 IS NOT NULL) ORDER BY 1,2;
c0	c1
SELECT /*+USE_HASH(t1,t2)*/ * FROM t1 WHERE c1 NOT IN (SELECT c1 FROM t2 WHERE t2.c1 IS NOT NULL) ORDER BY 1,2;
c0	c1
1	12
1	A
2	12
3	A
SELECT /*+USE_NL(t1,t2)*/ * FROM t1 JOIN t2 ON t1.c0=t2.c0 AND t1.c1 <>ALL (SELECT c1 FROM t2 WHERE t2.c1 IS NOT NULL) ORDER BY 1,2;
c0	c1	c0	c1
2	12	2	AB
3	A	3	
SELECT /*+USE_MJ(t1,t2)*/ * FROM t1 JOIN t2 ON t1.c0=t2.c0 AND t1.c1 <>ALL (SELECT c1 FROM t2 WHERE t2.c1 IS NOT NULL) ORDER BY 1,2;
c0	c1	c0	c1
2	12	2	AB
3	A	3	
#PARALLEL
#IF "_optimizer_null_aware_antijoin"=ON,EXPLAIN:HASH JOIN ANTI NA
SELECT /*+parallel(2) USE_HASH(t1,t2)*/ * FROM t1 WHERE c1 NOT IN (SELECT c1 FROM t2) ORDER BY 1,2;
c0	c1
SELECT /*+parallel(2) USE_HASH(t1,t2)*/ * FROM t1 WHERE c1 <>ALL (SELECT c1 FROM t2) ORDER BY 1,2;
c0	c1
SELECT /*+parallel(2) USE_NL(t1,t2)*/ * FROM t1 WHERE c1 <>ALL (SELECT c1 FROM t2) ORDER BY 1,2;
c0	c1
SELECT /*+parallel(2) USE_HASH(t1,t2)*/ * FROM t1 WHERE NOT EXISTS (SELECT c1 FROM t2) ORDER BY 1,2;
c0	c1
SELECT /*+parallel(5) USE_HASH(t1,t2)*/ * FROM t1 WHERE c1 NOT IN (SELECT c1 FROM t2) ORDER BY 1,2;
c0	c1
SELECT /*+parallel(5) USE_NLJ(t1,t2)*/ * FROM t1 WHERE c1 NOT IN (SELECT c1 FROM t2) ORDER BY 1,2;
c0	c1
SELECT /*+parallel(5) USE_HASH(t1,t2)*/ * FROM t1 WHERE c1 <>ALL (SELECT c1 FROM t2) ORDER BY 1,2;
c0	c1
SELECT /*+parallel(5) USE_MJ(t1,t2)*/ * FROM t1 WHERE c1 NOT IN (SELECT c1 FROM t2) ORDER BY 1,2;
c0	c1
SELECT /*+parallel(5) USE_HASH(t1,t2)*/ * FROM t1 WHERE NOT EXISTS (SELECT c1 FROM t2) ORDER BY 1,2;
c0	c1
SELECT /*+parallel(2) USE_HASH(t1,t2)*/ * FROM t1,t2 WHERE t1.c0=t2.c0 AND t1.c1 NOT IN (SELECT c1 FROM t2) ORDER BY 1,2;
c0	c1	c0	c1
SELECT /*+parallel(2) USE_HASH(t1,t2)*/ * FROM t1,t2 WHERE t1.c0=t2.c0 AND t1.c1 <>ALL (SELECT c1 FROM t2) ORDER BY 1,2;
c0	c1	c0	c1
SELECT /*+parallel(2) USE_MJ(t1,t2)*/ * FROM t1,t2 WHERE t1.c0=t2.c0 AND t1.c1 <>ALL (SELECT c1 FROM t2) ORDER BY 1,2;
c0	c1	c0	c1
SELECT /*+parallel(2) USE_NL(t1,t2)*/ * FROM t1,t2 WHERE t1.c0=t2.c0 AND t1.c1 NOT IN (SELECT c1 FROM t2) ORDER BY 1,2;
c0	c1	c0	c1
SELECT /*+parallel(2) USE_HASH(t1,t2)*/ * FROM t1,t2 WHERE t1.c0=t2.c0 AND NOT EXISTS (SELECT c1 FROM t2) ORDER BY 1,2;
c0	c1	c0	c1
#IF "_optimizer_null_aware_antijoin"=ON,EXPLAIN:HASH JOIN ANTI SNA
SELECT /*+parallel(2) USE_HASH(t1,t2)*/ * FROM t1 WHERE c1 NOT IN (SELECT c1 FROM t2 WHERE t2.c1 IS NOT NULL) ORDER BY 1,2;
c0	c1
1	12
1	A
2	12
3	A
SELECT /*+parallel(2) USE_HASH(t1,t2)*/ * FROM t1 WHERE c1 <>ALL (SELECT c1 FROM t2 WHERE t2.c1 IS NOT NULL) ORDER BY 1,2;
c0	c1
1	12
1	A
2	12
3	A
SELECT /*+parallel(2) USE_NL(t1,t2)*/ * FROM t1 WHERE c1 <>ALL (SELECT c1 FROM t2 WHERE t2.c1 IS NOT NULL) ORDER BY 1,2;
c0	c1
1	12
1	A
2	12
3	A
SELECT /*+parallel(2) USE_HASH(t1,t2)*/ * FROM t1 WHERE NOT EXISTS (SELECT c1 FROM t2 WHERE t2.c1 IS NOT NULL) ORDER BY 1,2;
c0	c1
SELECT /*+parallel(5) USE_HASH(t1,t2)*/ * FROM t1 WHERE c1 NOT IN (SELECT c1 FROM t2 WHERE t2.c1 IS NOT NULL) ORDER BY 1,2;
c0	c1
1	12
1	A
2	12
3	A
SELECT /*+parallel(5) USE_NLJ(t1,t2)*/ * FROM t1 WHERE c1 NOT IN (SELECT c1 FROM t2 WHERE t2.c1 IS NOT NULL) ORDER BY 1,2;
c0	c1
1	12
1	A
2	12
3	A
SELECT /*+parallel(5) USE_HASH(t1,t2)*/ * FROM t1 WHERE c1 <>ALL (SELECT c1 FROM t2 WHERE t2.c1 IS NOT NULL) ORDER BY 1,2;
c0	c1
1	12
1	A
2	12
3	A
SELECT /*+parallel(5) USE_MJ(t1,t2)*/ * FROM t1 WHERE c1 NOT IN (SELECT c1 FROM t2 WHERE t2.c1 IS NOT NULL) ORDER BY 1,2;
c0	c1
1	12
1	A
2	12
3	A
SELECT /*+parallel(5) USE_HASH(t1,t2)*/ * FROM t1 WHERE NOT EXISTS (SELECT c1 FROM t2 WHERE t2.c1 IS NOT NULL) ORDER BY 1,2;
c0	c1
SELECT /*+parallel(2) USE_HASH(t1,t2)*/ * FROM t1,t2 WHERE t1.c0=t2.c0 AND t1.c1 NOT IN (SELECT c1 FROM t2 WHERE t2.c1 IS NOT NULL) ORDER BY 1,2;
c0	c1	c0	c1
2	12	2	AB
3	A	3	
SELECT /*+parallel(2) USE_HASH(t1,t2)*/ * FROM t1,t2 WHERE t1.c0=t2.c0 AND t1.c1 <>ALL (SELECT c1 FROM t2 WHERE t2.c1 IS NOT NULL) ORDER BY 1,2;
c0	c1	c0	c1
2	12	2	AB
3	A	3	
SELECT /*+parallel(2) USE_MJ(t1,t2)*/ * FROM t1,t2 WHERE t1.c0=t2.c0 AND t1.c1 <>ALL (SELECT c1 FROM t2 WHERE t2.c1 IS NOT NULL) ORDER BY 1,2;
c0	c1	c0	c1
2	12	2	AB
3	A	3	
SELECT /*+parallel(2) USE_NL(t1,t2)*/ * FROM t1,t2 WHERE t1.c0=t2.c0 AND t1.c1 NOT IN (SELECT c1 FROM t2 WHERE t2.c1 IS NOT NULL) ORDER BY 1,2;
c0	c1	c0	c1
2	12	2	AB
3	A	3	
SELECT /*+parallel(2) USE_HASH(t1,t2)*/ * FROM t1,t2 WHERE t1.c0=t2.c0 AND NOT EXISTS (SELECT c1 FROM t2 WHERE t2.c1 IS NOT NULL) ORDER BY 1,2;
c0	c1	c0	c1
#There are null values on the left table
INSERT INTO t1 VALUES(4,NULL);
DELETE FROM t2 WHERE c0=4;
SELECT * FROM t2 ORDER BY c0,c1;
c0	c1
2	AB
3	
#IF "_optimizer_null_aware_antijoin"=ON,EXPLAIN:HASH JOIN ANTI NA
SELECT * FROM t1 WHERE c1 NOT IN (SELECT c1 FROM t2) ORDER BY 1,2;
c0	c1
1	12
1	A
2	12
3	A
SELECT * FROM t1 WHERE NOT EXISTS (SELECT c1 FROM t2) ORDER BY 1,2;
c0	c1
#IF "_optimizer_null_aware_antijoin"=TRUE,EXPLAIN:HASH JOIN ANTI SNA
SELECT * FROM t1 WHERE c1 NOT IN (SELECT c1 FROM t2 WHERE t2.c1 IS NOT NULL) ORDER BY 1,2;
c0	c1
1	12
1	A
2	12
3	A
SELECT * FROM t1 WHERE NOT EXISTS (SELECT c1 FROM t2 WHERE t2.c1 IS NOT NULL) ORDER BY 1,2;
c0	c1
#INNER JOIN
#IF "_optimizer_null_aware_antijoin"=ON,EXPLAIN:HASH JOIN ANTI NA
SELECT * FROM t1 JOIN t2 ON t1.c0=t2.c0 AND t1.c1 NOT IN (SELECT c1 FROM t2) ORDER BY 1,2;
c0	c1	c0	c1
2	12	2	AB
3	A	3	
SELECT * FROM t1 JOIN t2 ON t1.c0=t2.c0 AND NOT EXISTS (SELECT c1 FROM t2) ORDER BY 1,2;
c0	c1	c0	c1
#IF "_optimizer_null_aware_antijoin"=TRUE,EXPLAIN:HASH JOIN ANTI SNA
SELECT * FROM t1 JOIN t2 ON t1.c0=t2.c0 AND t1.c1 NOT IN (SELECT c1 FROM t2 WHERE t2.c1 IS NOT NULL) ORDER BY 1,2;
c0	c1	c0	c1
2	12	2	AB
3	A	3	
SELECT * FROM t1 JOIN t2 ON t1.c0=t2.c0 AND NOT EXISTS (SELECT c1 FROM t2 WHERE t2.c1 IS NOT NULL) ORDER BY 1,2;
c0	c1	c0	c1
#RIGHT JOIN
#IF "_optimizer_null_aware_antijoin"=ON,EXPLAIN:HASH JOIN ANTI NA
SELECT * FROM t1 RIGHT JOIN t2 ON t1.c0=t2.c0 AND t1.c1 NOT IN (SELECT c1 FROM t2) ORDER BY 1,2,3;
c0	c1	c0	c1
2	12	2	AB
3	A	3	
SELECT * FROM t1 RIGHT JOIN t2 ON t1.c0=t2.c0 AND t1.c1 <>ALL (SELECT c1 FROM t2) ORDER BY 1,2,3;
c0	c1	c0	c1
2	12	2	AB
3	A	3	
SELECT * FROM t1 RIGHT JOIN t2 ON t1.c0=t2.c0 AND NOT EXISTS (SELECT c1 FROM t2) ORDER BY 1,2,3;
c0	c1	c0	c1
NULL	NULL	2	AB
NULL	NULL	3	
#IF "_optimizer_null_aware_antijoin"=ON,EXPLAIN:HASH JOIN ANTI SNA
SELECT * FROM t1 RIGHT JOIN t2 ON t1.c0=t2.c0 AND t1.c1 NOT IN (SELECT c1 FROM t2 WHERE t2.c1 IS NOT NULL) ORDER BY 1,2,3;
c0	c1	c0	c1
2	12	2	AB
3	A	3	
SELECT * FROM t1 RIGHT JOIN t2 ON t1.c0=t2.c0 AND t1.c1 <>ALL (SELECT c1 FROM t2 WHERE t2.c1 IS NOT NULL) ORDER BY 1,2,3;
c0	c1	c0	c1
2	12	2	AB
3	A	3	
SELECT * FROM t1 RIGHT JOIN t2 ON t1.c0=t2.c0 AND NOT EXISTS (SELECT c1 FROM t2 WHERE t2.c1 IS NOT NULL) ORDER BY 1,2,3;
c0	c1	c0	c1
NULL	NULL	2	AB
NULL	NULL	3	
#LEFT JOIN
#IF "_optimizer_null_aware_antijoin"=ON,EXPLAIN:HASH JOIN ANTI NA
SELECT * FROM t1 LEFT JOIN t2 ON t1.c0=t2.c0 WHERE t1.c1 NOT IN (SELECT c1 FROM t2) ORDER BY 1,2;
c0	c1	c0	c1
1	12	NULL	NULL
1	A	NULL	NULL
2	12	2	AB
3	A	3	
SELECT * FROM t1 LEFT JOIN t2 ON t1.c0=t2.c0 WHERE t1.c1 <>ALL (SELECT c1 FROM t2) ORDER BY 1,2;
c0	c1	c0	c1
1	12	NULL	NULL
1	A	NULL	NULL
2	12	2	AB
3	A	3	
SELECT * FROM t1 LEFT JOIN t2 ON t1.c0=t2.c0 WHERE NOT EXISTS (SELECT c1 FROM t2) ORDER BY 1,2;
c0	c1	c0	c1
#IF "_optimizer_null_aware_antijoin"=ON,EXPLAIN:HASH JOIN ANTI SNA
SELECT * FROM t1 LEFT JOIN t2 ON t1.c0=t2.c0 WHERE t1.c1 NOT IN (SELECT c1 FROM t2 WHERE t2.c1 IS NOT NULL) ORDER BY 1,2,3;
c0	c1	c0	c1
1	12	NULL	NULL
1	A	NULL	NULL
2	12	2	AB
3	A	3	
SELECT * FROM t1 LEFT JOIN t2 ON t1.c0=t2.c0 WHERE t1.c1 <>ALL (SELECT c1 FROM t2 WHERE t2.c1 IS NOT NULL) ORDER BY 1,2,3;
c0	c1	c0	c1
1	12	NULL	NULL
1	A	NULL	NULL
2	12	2	AB
3	A	3	
SELECT * FROM t1 LEFT JOIN t2 ON t1.c0=t2.c0 WHERE NOT EXISTS (SELECT c1 FROM t2 WHERE t2.c1 IS NOT NULL) ORDER BY 1,2,3;
c0	c1	c0	c1
#FULL JOIN
#IF "_optimizer_null_aware_antijoin"=ON,EXPLAIN:HASH JOIN ANTI NA
SELECT * FROM t1 FULL JOIN t2 ON t1.c0=t2.c0 WHERE t1.c1 NOT IN (SELECT c1 FROM t2) ORDER BY 1,2;
c0	c1	c0	c1
1	12	NULL	NULL
1	A	NULL	NULL
2	12	2	AB
3	A	3	
SELECT * FROM t1 FULL JOIN t2 ON t1.c0=t2.c0 WHERE t1.c1 <>ALL (SELECT c1 FROM t2) ORDER BY 1,2;
c0	c1	c0	c1
1	12	NULL	NULL
1	A	NULL	NULL
2	12	2	AB
3	A	3	
SELECT * FROM t1 FULL JOIN t2 ON t1.c0=t2.c0 WHERE NOT EXISTS (SELECT c1 FROM t2) ORDER BY 1,2;
c0	c1	c0	c1
#IF "_optimizer_null_aware_antijoin"=ON,EXPLAIN:HASH JOIN ANTI SNA
SELECT * FROM t1 FULL JOIN t2 ON t1.c0=t2.c0 WHERE t1.c1 NOT IN (SELECT c1 FROM t2 WHERE t2.c1 IS NOT NULL) ORDER BY 1,2,3;
c0	c1	c0	c1
1	12	NULL	NULL
1	A	NULL	NULL
2	12	2	AB
3	A	3	
SELECT * FROM t1 FULL JOIN t2 ON t1.c0=t2.c0 WHERE t1.c1 <>ALL (SELECT c1 FROM t2 WHERE t2.c1 IS NOT NULL) ORDER BY 1,2,3;
c0	c1	c0	c1
1	12	NULL	NULL
1	A	NULL	NULL
2	12	2	AB
3	A	3	
SELECT * FROM t1 FULL JOIN t2 ON t1.c0=t2.c0 WHERE NOT EXISTS (SELECT c1 FROM t2 WHERE t2.c1 IS NOT NULL) ORDER BY 1,2,3;
c0	c1	c0	c1
#HINT
#IF "_optimizer_null_aware_antijoin"=ON,EXPLAIN:HASH JOIN ANTI NA
SELECT /*+USE_HASH(t1,t2)*/ * FROM t1 WHERE c1 NOT IN (SELECT c1 FROM t2) ORDER BY 1,2;
c0	c1
1	12
1	A
2	12
3	A
SELECT /*+USE_HASH(t1,t2)*/ * FROM t1 JOIN t2 ON t1.c0=t2.c0 AND t1.c1 <>ALL (SELECT c1 FROM t2) ORDER BY 1,2;
c0	c1	c0	c1
2	12	2	AB
3	A	3	
SELECT /*+USE_HASH(t1,t2)*/ * FROM t1 RIGHT JOIN t2 ON t1.c0=t2.c0 WHERE t1.c1 NOT IN (SELECT c1 FROM t2) ORDER BY 1,2;
c0	c1	c0	c1
2	12	2	AB
3	A	3	
SELECT /*+USE_NLJ(t1,t2)*/ * FROM t1 RIGHT JOIN t2 ON t1.c0=t2.c0 WHERE t1.c1 NOT IN (SELECT c1 FROM t2) ORDER BY 1,2;
c0	c1	c0	c1
2	12	2	AB
3	A	3	
SELECT /*+USE_MJ(t1,t2)*/ * FROM t1 JOIN t2 ON t1.c0=t2.c0 AND t1.c1 <>ALL (SELECT c1 FROM t2) ORDER BY 1,2;
c0	c1	c0	c1
2	12	2	AB
3	A	3	
SELECT /*+USE_HASH(t1,t2)*/ * FROM t1 WHERE NOT EXISTS (SELECT c1 FROM t2) ORDER BY 1,2;
c0	c1
SELECT /*+USE_HASH(t1,t2)*/ * FROM t1 WHERE c1 NOT IN (SELECT c1 FROM t2) ORDER BY 1,2;
c0	c1
1	12
1	A
2	12
3	A
SELECT /*+USE_NL(t1,t2)*/ * FROM t1 JOIN t2 ON t1.c0=t2.c0 AND t1.c1 <>ALL (SELECT c1 FROM t2) ORDER BY 1,2;
c0	c1	c0	c1
2	12	2	AB
3	A	3	
SELECT /*+USE_MJ(t1,t2)*/ * FROM t1 JOIN t2 ON t1.c0=t2.c0 AND t1.c1 <>ALL (SELECT c1 FROM t2) ORDER BY 1,2;
c0	c1	c0	c1
2	12	2	AB
3	A	3	
#IF "_optimizer_null_aware_antijoin"=ON,EXPLAIN:HASH JOIN ANTI SNA
SELECT /*+USE_HASH(t1,t2)*/ * FROM t1 WHERE c1 NOT IN (SELECT c1 FROM t2 WHERE t2.c1 IS NOT NULL) ORDER BY 1,2;
c0	c1
1	12
1	A
2	12
3	A
SELECT /*+USE_HASH(t1,t2)*/ * FROM t1 JOIN t2 ON t1.c0=t2.c0 AND t1.c1 <>ALL (SELECT c1 FROM t2 WHERE t2.c1 IS NOT NULL) ORDER BY 1,2;
c0	c1	c0	c1
2	12	2	AB
3	A	3	
SELECT /*+USE_HASH(t1,t2)*/ * FROM t1 RIGHT JOIN t2 ON t1.c0=t2.c0 WHERE t1.c1 NOT IN (SELECT c1 FROM t2 WHERE t2.c1 IS NOT NULL) ORDER BY 1,2;
c0	c1	c0	c1
2	12	2	AB
3	A	3	
SELECT /*+USE_NLJ(t1,t2)*/ * FROM t1 RIGHT JOIN t2 ON t1.c0=t2.c0 WHERE t1.c1 NOT IN (SELECT c1 FROM t2 WHERE t2.c1 IS NOT NULL) ORDER BY 1,2;
c0	c1	c0	c1
2	12	2	AB
3	A	3	
SELECT /*+USE_MJ(t1,t2)*/ * FROM t1 JOIN t2 ON t1.c0=t2.c0 AND t1.c1 <>ALL (SELECT c1 FROM t2 WHERE t2.c1 IS NOT NULL) ORDER BY 1,2;
c0	c1	c0	c1
2	12	2	AB
3	A	3	
SELECT /*+USE_HASH(t1,t2)*/ * FROM t1 WHERE NOT EXISTS (SELECT c1 FROM t2 WHERE t2.c1 IS NOT NULL) ORDER BY 1,2;
c0	c1
SELECT /*+USE_HASH(t1,t2)*/ * FROM t1 WHERE c1 NOT IN (SELECT c1 FROM t2 WHERE t2.c1 IS NOT NULL) ORDER BY 1,2;
c0	c1
1	12
1	A
2	12
3	A
SELECT /*+USE_NL(t1,t2)*/ * FROM t1 JOIN t2 ON t1.c0=t2.c0 AND t1.c1 <>ALL (SELECT c1 FROM t2 WHERE t2.c1 IS NOT NULL) ORDER BY 1,2;
c0	c1	c0	c1
2	12	2	AB
3	A	3	
SELECT /*+USE_MJ(t1,t2)*/ * FROM t1 JOIN t2 ON t1.c0=t2.c0 AND t1.c1 <>ALL (SELECT c1 FROM t2 WHERE t2.c1 IS NOT NULL) ORDER BY 1,2;
c0	c1	c0	c1
2	12	2	AB
3	A	3	
#PARALLEL
#IF "_optimizer_null_aware_antijoin"=ON,EXPLAIN:HASH JOIN ANTI NA
SELECT /*+parallel(2) USE_HASH(t1,t2)*/ * FROM t1 WHERE c1 NOT IN (SELECT c1 FROM t2) ORDER BY 1,2;
c0	c1
1	12
1	A
2	12
3	A
SELECT /*+parallel(2) USE_HASH(t1,t2)*/ * FROM t1 WHERE c1 <>ALL (SELECT c1 FROM t2) ORDER BY 1,2;
c0	c1
1	12
1	A
2	12
3	A
SELECT /*+parallel(2) USE_NL(t1,t2)*/ * FROM t1 WHERE c1 <>ALL (SELECT c1 FROM t2) ORDER BY 1,2;
c0	c1
1	12
1	A
2	12
3	A
SELECT /*+parallel(2) USE_HASH(t1,t2)*/ * FROM t1 WHERE NOT EXISTS (SELECT c1 FROM t2) ORDER BY 1,2;
c0	c1
SELECT /*+parallel(5) USE_HASH(t1,t2)*/ * FROM t1 WHERE c1 NOT IN (SELECT c1 FROM t2) ORDER BY 1,2;
c0	c1
1	12
1	A
2	12
3	A
SELECT /*+parallel(5) USE_NLJ(t1,t2)*/ * FROM t1 WHERE c1 NOT IN (SELECT c1 FROM t2) ORDER BY 1,2;
c0	c1
1	12
1	A
2	12
3	A
SELECT /*+parallel(5) USE_HASH(t1,t2)*/ * FROM t1 WHERE c1 <>ALL (SELECT c1 FROM t2) ORDER BY 1,2;
c0	c1
1	12
1	A
2	12
3	A
SELECT /*+parallel(5) USE_MJ(t1,t2)*/ * FROM t1 WHERE c1 NOT IN (SELECT c1 FROM t2) ORDER BY 1,2;
c0	c1
1	12
1	A
2	12
3	A
SELECT /*+parallel(5) USE_HASH(t1,t2)*/ * FROM t1 WHERE NOT EXISTS (SELECT c1 FROM t2) ORDER BY 1,2;
c0	c1
SELECT /*+parallel(2) USE_HASH(t1,t2)*/ * FROM t1,t2 WHERE t1.c0=t2.c0 AND t1.c1 NOT IN (SELECT c1 FROM t2) ORDER BY 1,2;
c0	c1	c0	c1
2	12	2	AB
3	A	3	
SELECT /*+parallel(2) USE_HASH(t1,t2)*/ * FROM t1,t2 WHERE t1.c0=t2.c0 AND t1.c1 <>ALL (SELECT c1 FROM t2) ORDER BY 1,2;
c0	c1	c0	c1
2	12	2	AB
3	A	3	
SELECT /*+parallel(2) USE_MJ(t1,t2)*/ * FROM t1,t2 WHERE t1.c0=t2.c0 AND t1.c1 <>ALL (SELECT c1 FROM t2) ORDER BY 1,2;
c0	c1	c0	c1
2	12	2	AB
3	A	3	
SELECT /*+parallel(2) USE_NL(t1,t2)*/ * FROM t1,t2 WHERE t1.c0=t2.c0 AND t1.c1 NOT IN (SELECT c1 FROM t2) ORDER BY 1,2;
c0	c1	c0	c1
2	12	2	AB
3	A	3	
SELECT /*+parallel(2) USE_HASH(t1,t2)*/ * FROM t1,t2 WHERE t1.c0=t2.c0 AND NOT EXISTS (SELECT c1 FROM t2) ORDER BY 1,2;
c0	c1	c0	c1
#IF "_optimizer_null_aware_antijoin"=ON,EXPLAIN:HASH JOIN ANTI SNA
SELECT /*+parallel(2) USE_HASH(t1,t2)*/ * FROM t1 WHERE c1 NOT IN (SELECT c1 FROM t2 WHERE t2.c1 IS NOT NULL) ORDER BY 1,2;
c0	c1
1	12
1	A
2	12
3	A
SELECT /*+parallel(2) USE_HASH(t1,t2)*/ * FROM t1 WHERE c1 <>ALL (SELECT c1 FROM t2 WHERE t2.c1 IS NOT NULL) ORDER BY 1,2;
c0	c1
1	12
1	A
2	12
3	A
SELECT /*+parallel(2) USE_NL(t1,t2)*/ * FROM t1 WHERE c1 <>ALL (SELECT c1 FROM t2 WHERE t2.c1 IS NOT NULL) ORDER BY 1,2;
c0	c1
1	12
1	A
2	12
3	A
SELECT /*+parallel(2) USE_HASH(t1,t2)*/ * FROM t1 WHERE NOT EXISTS (SELECT c1 FROM t2 WHERE t2.c1 IS NOT NULL) ORDER BY 1,2;
c0	c1
SELECT /*+parallel(5) USE_HASH(t1,t2)*/ * FROM t1 WHERE c1 NOT IN (SELECT c1 FROM t2 WHERE t2.c1 IS NOT NULL) ORDER BY 1,2;
c0	c1
1	12
1	A
2	12
3	A
SELECT /*+parallel(5) USE_NLJ(t1,t2)*/ * FROM t1 WHERE c1 NOT IN (SELECT c1 FROM t2 WHERE t2.c1 IS NOT NULL) ORDER BY 1,2;
c0	c1
1	12
1	A
2	12
3	A
SELECT /*+parallel(5) USE_HASH(t1,t2)*/ * FROM t1 WHERE c1 <>ALL (SELECT c1 FROM t2 WHERE t2.c1 IS NOT NULL) ORDER BY 1,2;
c0	c1
1	12
1	A
2	12
3	A
SELECT /*+parallel(5) USE_MJ(t1,t2)*/ * FROM t1 WHERE c1 NOT IN (SELECT c1 FROM t2 WHERE t2.c1 IS NOT NULL) ORDER BY 1,2;
c0	c1
1	12
1	A
2	12
3	A
SELECT /*+parallel(5) USE_HASH(t1,t2)*/ * FROM t1 WHERE NOT EXISTS (SELECT c1 FROM t2 WHERE t2.c1 IS NOT NULL) ORDER BY 1,2;
c0	c1
SELECT /*+parallel(2) USE_HASH(t1,t2)*/ * FROM t1,t2 WHERE t1.c0=t2.c0 AND t1.c1 NOT IN (SELECT c1 FROM t2 WHERE t2.c1 IS NOT NULL) ORDER BY 1,2;
c0	c1	c0	c1
2	12	2	AB
3	A	3	
SELECT /*+parallel(2) USE_HASH(t1,t2)*/ * FROM t1,t2 WHERE t1.c0=t2.c0 AND t1.c1 <>ALL (SELECT c1 FROM t2 WHERE t2.c1 IS NOT NULL) ORDER BY 1,2;
c0	c1	c0	c1
2	12	2	AB
3	A	3	
SELECT /*+parallel(2) USE_MJ(t1,t2)*/ * FROM t1,t2 WHERE t1.c0=t2.c0 AND t1.c1 <>ALL (SELECT c1 FROM t2 WHERE t2.c1 IS NOT NULL) ORDER BY 1,2;
c0	c1	c0	c1
2	12	2	AB
3	A	3	
SELECT /*+parallel(2) USE_NL(t1,t2)*/ * FROM t1,t2 WHERE t1.c0=t2.c0 AND t1.c1 NOT IN (SELECT c1 FROM t2 WHERE t2.c1 IS NOT NULL) ORDER BY 1,2;
c0	c1	c0	c1
2	12	2	AB
3	A	3	
SELECT /*+parallel(2) USE_HASH(t1,t2)*/ * FROM t1,t2 WHERE t1.c0=t2.c0 AND NOT EXISTS (SELECT c1 FROM t2 WHERE t2.c1 IS NOT NULL) ORDER BY 1,2;
c0	c1	c0	c1
#There are no null values in the left and right tables
DELETE FROM t1 WHERE c0=4;
SELECT * FROM t1 ORDER BY c0,c1;
c0	c1
1	12
1	A
2	12
3	A
SELECT * FROM t2 ORDER BY c0,c1;
c0	c1
2	AB
3	
#IF "_optimizer_null_aware_antijoin"=ON,EXPLAIN:HASH JOIN ANTI NA
SELECT * FROM t1 WHERE c1 NOT IN (SELECT c1 FROM t2) ORDER BY 1,2;
c0	c1
1	12
1	A
2	12
3	A
SELECT * FROM t1 WHERE NOT EXISTS (SELECT c1 FROM t2) ORDER BY 1,2;
c0	c1
#IF "_optimizer_null_aware_antijoin"=TRUE,EXPLAIN:HASH JOIN ANTI SNA
SELECT * FROM t1 WHERE c1 NOT IN (SELECT c1 FROM t2 WHERE t2.c1 IS NOT NULL) ORDER BY 1,2;
c0	c1
1	12
1	A
2	12
3	A
SELECT * FROM t1 WHERE NOT EXISTS (SELECT c1 FROM t2 WHERE t2.c1 IS NOT NULL) ORDER BY 1,2;
c0	c1
#INNER JOIN
#IF "_optimizer_null_aware_antijoin"=ON,EXPLAIN:HASH JOIN ANTI NA
SELECT * FROM t1 JOIN t2 ON t1.c0=t2.c0 AND t1.c1 NOT IN (SELECT c1 FROM t2) ORDER BY 1,2;
c0	c1	c0	c1
2	12	2	AB
3	A	3	
SELECT * FROM t1 JOIN t2 ON t1.c0=t2.c0 AND NOT EXISTS (SELECT c1 FROM t2) ORDER BY 1,2;
c0	c1	c0	c1
#IF "_optimizer_null_aware_antijoin"=TRUE,EXPLAIN:HASH JOIN ANTI SNA
SELECT * FROM t1 JOIN t2 ON t1.c0=t2.c0 AND t1.c1 NOT IN (SELECT c1 FROM t2 WHERE t2.c1 IS NOT NULL) ORDER BY 1,2;
c0	c1	c0	c1
2	12	2	AB
3	A	3	
SELECT * FROM t1 JOIN t2 ON t1.c0=t2.c0 AND NOT EXISTS (SELECT c1 FROM t2 WHERE t2.c1 IS NOT NULL) ORDER BY 1,2;
c0	c1	c0	c1
#RIGHT JOIN
#IF "_optimizer_null_aware_antijoin"=ON,EXPLAIN:HASH JOIN ANTI NA
SELECT * FROM t1 RIGHT JOIN t2 ON t1.c0=t2.c0 AND t1.c1 NOT IN (SELECT c1 FROM t2) ORDER BY 1,2,3;
c0	c1	c0	c1
2	12	2	AB
3	A	3	
SELECT * FROM t1 RIGHT JOIN t2 ON t1.c0=t2.c0 AND t1.c1 <>ALL (SELECT c1 FROM t2) ORDER BY 1,2,3;
c0	c1	c0	c1
2	12	2	AB
3	A	3	
SELECT * FROM t1 RIGHT JOIN t2 ON t1.c0=t2.c0 AND NOT EXISTS (SELECT c1 FROM t2) ORDER BY 1,2,3;
c0	c1	c0	c1
NULL	NULL	2	AB
NULL	NULL	3	
#IF "_optimizer_null_aware_antijoin"=ON,EXPLAIN:HASH JOIN ANTI SNA
SELECT * FROM t1 RIGHT JOIN t2 ON t1.c0=t2.c0 AND t1.c1 NOT IN (SELECT c1 FROM t2 WHERE t2.c1 IS NOT NULL) ORDER BY 1,2,3;
c0	c1	c0	c1
2	12	2	AB
3	A	3	
SELECT * FROM t1 RIGHT JOIN t2 ON t1.c0=t2.c0 AND t1.c1 <>ALL (SELECT c1 FROM t2 WHERE t2.c1 IS NOT NULL) ORDER BY 1,2,3;
c0	c1	c0	c1
2	12	2	AB
3	A	3	
SELECT * FROM t1 RIGHT JOIN t2 ON t1.c0=t2.c0 AND NOT EXISTS (SELECT c1 FROM t2 WHERE t2.c1 IS NOT NULL) ORDER BY 1,2,3;
c0	c1	c0	c1
NULL	NULL	2	AB
NULL	NULL	3	
#LEFT JOIN
#IF "_optimizer_null_aware_antijoin"=ON,EXPLAIN:HASH JOIN ANTI NA
SELECT * FROM t1 LEFT JOIN t2 ON t1.c0=t2.c0 WHERE t1.c1 NOT IN (SELECT c1 FROM t2) ORDER BY 1,2;
c0	c1	c0	c1
1	12	NULL	NULL
1	A	NULL	NULL
2	12	2	AB
3	A	3	
SELECT * FROM t1 LEFT JOIN t2 ON t1.c0=t2.c0 WHERE t1.c1 <>ALL (SELECT c1 FROM t2) ORDER BY 1,2;
c0	c1	c0	c1
1	12	NULL	NULL
1	A	NULL	NULL
2	12	2	AB
3	A	3	
SELECT * FROM t1 LEFT JOIN t2 ON t1.c0=t2.c0 WHERE NOT EXISTS (SELECT c1 FROM t2) ORDER BY 1,2;
c0	c1	c0	c1
#IF "_optimizer_null_aware_antijoin"=ON,EXPLAIN:HASH JOIN ANTI SNA
SELECT * FROM t1 LEFT JOIN t2 ON t1.c0=t2.c0 WHERE t1.c1 NOT IN (SELECT c1 FROM t2 WHERE t2.c1 IS NOT NULL) ORDER BY 1,2,3;
c0	c1	c0	c1
1	12	NULL	NULL
1	A	NULL	NULL
2	12	2	AB
3	A	3	
SELECT * FROM t1 LEFT JOIN t2 ON t1.c0=t2.c0 WHERE t1.c1 <>ALL (SELECT c1 FROM t2 WHERE t2.c1 IS NOT NULL) ORDER BY 1,2,3;
c0	c1	c0	c1
1	12	NULL	NULL
1	A	NULL	NULL
2	12	2	AB
3	A	3	
SELECT * FROM t1 LEFT JOIN t2 ON t1.c0=t2.c0 WHERE NOT EXISTS (SELECT c1 FROM t2 WHERE t2.c1 IS NOT NULL) ORDER BY 1,2,3;
c0	c1	c0	c1
#FULL JOIN
#IF "_optimizer_null_aware_antijoin"=ON,EXPLAIN:HASH JOIN ANTI NA
SELECT * FROM t1 FULL JOIN t2 ON t1.c0=t2.c0 WHERE t1.c1 NOT IN (SELECT c1 FROM t2) ORDER BY 1,2;
c0	c1	c0	c1
1	12	NULL	NULL
1	A	NULL	NULL
2	12	2	AB
3	A	3	
SELECT * FROM t1 FULL JOIN t2 ON t1.c0=t2.c0 WHERE t1.c1 <>ALL (SELECT c1 FROM t2) ORDER BY 1,2;
c0	c1	c0	c1
1	12	NULL	NULL
1	A	NULL	NULL
2	12	2	AB
3	A	3	
SELECT * FROM t1 FULL JOIN t2 ON t1.c0=t2.c0 WHERE NOT EXISTS (SELECT c1 FROM t2) ORDER BY 1,2;
c0	c1	c0	c1
#IF "_optimizer_null_aware_antijoin"=ON,EXPLAIN:HASH JOIN ANTI SNA
SELECT * FROM t1 FULL JOIN t2 ON t1.c0=t2.c0 WHERE t1.c1 NOT IN (SELECT c1 FROM t2 WHERE t2.c1 IS NOT NULL) ORDER BY 1,2,3;
c0	c1	c0	c1
1	12	NULL	NULL
1	A	NULL	NULL
2	12	2	AB
3	A	3	
SELECT * FROM t1 FULL JOIN t2 ON t1.c0=t2.c0 WHERE t1.c1 <>ALL (SELECT c1 FROM t2 WHERE t2.c1 IS NOT NULL) ORDER BY 1,2,3;
c0	c1	c0	c1
1	12	NULL	NULL
1	A	NULL	NULL
2	12	2	AB
3	A	3	
SELECT * FROM t1 FULL JOIN t2 ON t1.c0=t2.c0 WHERE NOT EXISTS (SELECT c1 FROM t2 WHERE t2.c1 IS NOT NULL) ORDER BY 1,2,3;
c0	c1	c0	c1
#HINT
#IF "_optimizer_null_aware_antijoin"=ON,EXPLAIN:HASH JOIN ANTI NA
SELECT /*+USE_HASH(t1,t2)*/ * FROM t1 WHERE c1 NOT IN (SELECT c1 FROM t2) ORDER BY 1,2;
c0	c1
1	12
1	A
2	12
3	A
SELECT /*+USE_HASH(t1,t2)*/ * FROM t1 JOIN t2 ON t1.c0=t2.c0 AND t1.c1 <>ALL (SELECT c1 FROM t2) ORDER BY 1,2;
c0	c1	c0	c1
2	12	2	AB
3	A	3	
SELECT /*+USE_HASH(t1,t2)*/ * FROM t1 RIGHT JOIN t2 ON t1.c0=t2.c0 WHERE t1.c1 NOT IN (SELECT c1 FROM t2) ORDER BY 1,2;
c0	c1	c0	c1
2	12	2	AB
3	A	3	
SELECT /*+USE_NLJ(t1,t2)*/ * FROM t1 RIGHT JOIN t2 ON t1.c0=t2.c0 WHERE t1.c1 NOT IN (SELECT c1 FROM t2) ORDER BY 1,2;
c0	c1	c0	c1
2	12	2	AB
3	A	3	
SELECT /*+USE_MJ(t1,t2)*/ * FROM t1 JOIN t2 ON t1.c0=t2.c0 AND t1.c1 <>ALL (SELECT c1 FROM t2) ORDER BY 1,2;
c0	c1	c0	c1
2	12	2	AB
3	A	3	
SELECT /*+USE_HASH(t1,t2)*/ * FROM t1 WHERE NOT EXISTS (SELECT c1 FROM t2) ORDER BY 1,2;
c0	c1
SELECT /*+USE_HASH(t1,t2)*/ * FROM t1 WHERE c1 NOT IN (SELECT c1 FROM t2) ORDER BY 1,2;
c0	c1
1	12
1	A
2	12
3	A
SELECT /*+USE_NL(t1,t2)*/ * FROM t1 JOIN t2 ON t1.c0=t2.c0 AND t1.c1 <>ALL (SELECT c1 FROM t2) ORDER BY 1,2;
c0	c1	c0	c1
2	12	2	AB
3	A	3	
SELECT /*+USE_MJ(t1,t2)*/ * FROM t1 JOIN t2 ON t1.c0=t2.c0 AND t1.c1 <>ALL (SELECT c1 FROM t2) ORDER BY 1,2;
c0	c1	c0	c1
2	12	2	AB
3	A	3	
#IF "_optimizer_null_aware_antijoin"=ON,EXPLAIN:HASH JOIN ANTI SNA
SELECT /*+USE_HASH(t1,t2)*/ * FROM t1 WHERE c1 NOT IN (SELECT c1 FROM t2 WHERE t2.c1 IS NOT NULL) ORDER BY 1,2;
c0	c1
1	12
1	A
2	12
3	A
SELECT /*+USE_HASH(t1,t2)*/ * FROM t1 JOIN t2 ON t1.c0=t2.c0 AND t1.c1 <>ALL (SELECT c1 FROM t2 WHERE t2.c1 IS NOT NULL) ORDER BY 1,2;
c0	c1	c0	c1
2	12	2	AB
3	A	3	
SELECT /*+USE_HASH(t1,t2)*/ * FROM t1 RIGHT JOIN t2 ON t1.c0=t2.c0 WHERE t1.c1 NOT IN (SELECT c1 FROM t2 WHERE t2.c1 IS NOT NULL) ORDER BY 1,2;
c0	c1	c0	c1
2	12	2	AB
3	A	3	
SELECT /*+USE_NLJ(t1,t2)*/ * FROM t1 RIGHT JOIN t2 ON t1.c0=t2.c0 WHERE t1.c1 NOT IN (SELECT c1 FROM t2 WHERE t2.c1 IS NOT NULL) ORDER BY 1,2;
c0	c1	c0	c1
2	12	2	AB
3	A	3	
SELECT /*+USE_MJ(t1,t2)*/ * FROM t1 JOIN t2 ON t1.c0=t2.c0 AND t1.c1 <>ALL (SELECT c1 FROM t2 WHERE t2.c1 IS NOT NULL) ORDER BY 1,2;
c0	c1	c0	c1
2	12	2	AB
3	A	3	
SELECT /*+USE_HASH(t1,t2)*/ * FROM t1 WHERE NOT EXISTS (SELECT c1 FROM t2 WHERE t2.c1 IS NOT NULL) ORDER BY 1,2;
c0	c1
SELECT /*+USE_HASH(t1,t2)*/ * FROM t1 WHERE c1 NOT IN (SELECT c1 FROM t2 WHERE t2.c1 IS NOT NULL) ORDER BY 1,2;
c0	c1
1	12
1	A
2	12
3	A
SELECT /*+USE_NL(t1,t2)*/ * FROM t1 JOIN t2 ON t1.c0=t2.c0 AND t1.c1 <>ALL (SELECT c1 FROM t2 WHERE t2.c1 IS NOT NULL) ORDER BY 1,2;
c0	c1	c0	c1
2	12	2	AB
3	A	3	
SELECT /*+USE_MJ(t1,t2)*/ * FROM t1 JOIN t2 ON t1.c0=t2.c0 AND t1.c1 <>ALL (SELECT c1 FROM t2 WHERE t2.c1 IS NOT NULL) ORDER BY 1,2;
c0	c1	c0	c1
2	12	2	AB
3	A	3	
#PARALLEL
#IF "_optimizer_null_aware_antijoin"=ON,EXPLAIN:HASH JOIN ANTI NA
SELECT /*+parallel(2) USE_HASH(t1,t2)*/ * FROM t1 WHERE c1 NOT IN (SELECT c1 FROM t2) ORDER BY 1,2;
c0	c1
1	12
1	A
2	12
3	A
SELECT /*+parallel(2) USE_HASH(t1,t2)*/ * FROM t1 WHERE c1 <>ALL (SELECT c1 FROM t2) ORDER BY 1,2;
c0	c1
1	12
1	A
2	12
3	A
SELECT /*+parallel(2) USE_NL(t1,t2)*/ * FROM t1 WHERE c1 <>ALL (SELECT c1 FROM t2) ORDER BY 1,2;
c0	c1
1	12
1	A
2	12
3	A
SELECT /*+parallel(2) USE_HASH(t1,t2)*/ * FROM t1 WHERE NOT EXISTS (SELECT c1 FROM t2) ORDER BY 1,2;
c0	c1
SELECT /*+parallel(5) USE_HASH(t1,t2)*/ * FROM t1 WHERE c1 NOT IN (SELECT c1 FROM t2) ORDER BY 1,2;
c0	c1
1	12
1	A
2	12
3	A
SELECT /*+parallel(5) USE_NLJ(t1,t2)*/ * FROM t1 WHERE c1 NOT IN (SELECT c1 FROM t2) ORDER BY 1,2;
c0	c1
1	12
1	A
2	12
3	A
SELECT /*+parallel(5) USE_HASH(t1,t2)*/ * FROM t1 WHERE c1 <>ALL (SELECT c1 FROM t2) ORDER BY 1,2;
c0	c1
1	12
1	A
2	12
3	A
SELECT /*+parallel(5) USE_MJ(t1,t2)*/ * FROM t1 WHERE c1 NOT IN (SELECT c1 FROM t2) ORDER BY 1,2;
c0	c1
1	12
1	A
2	12
3	A
SELECT /*+parallel(5) USE_HASH(t1,t2)*/ * FROM t1 WHERE NOT EXISTS (SELECT c1 FROM t2) ORDER BY 1,2;
c0	c1
SELECT /*+parallel(2) USE_HASH(t1,t2)*/ * FROM t1,t2 WHERE t1.c0=t2.c0 AND t1.c1 NOT IN (SELECT c1 FROM t2) ORDER BY 1,2;
c0	c1	c0	c1
2	12	2	AB
3	A	3	
SELECT /*+parallel(2) USE_HASH(t1,t2)*/ * FROM t1,t2 WHERE t1.c0=t2.c0 AND t1.c1 <>ALL (SELECT c1 FROM t2) ORDER BY 1,2;
c0	c1	c0	c1
2	12	2	AB
3	A	3	
SELECT /*+parallel(2) USE_MJ(t1,t2)*/ * FROM t1,t2 WHERE t1.c0=t2.c0 AND t1.c1 <>ALL (SELECT c1 FROM t2) ORDER BY 1,2;
c0	c1	c0	c1
2	12	2	AB
3	A	3	
SELECT /*+parallel(2) USE_NL(t1,t2)*/ * FROM t1,t2 WHERE t1.c0=t2.c0 AND t1.c1 NOT IN (SELECT c1 FROM t2) ORDER BY 1,2;
c0	c1	c0	c1
2	12	2	AB
3	A	3	
SELECT /*+parallel(2) USE_HASH(t1,t2)*/ * FROM t1,t2 WHERE t1.c0=t2.c0 AND NOT EXISTS (SELECT c1 FROM t2) ORDER BY 1,2;
c0	c1	c0	c1
#IF "_optimizer_null_aware_antijoin"=ON,EXPLAIN:HASH JOIN ANTI SNA
SELECT /*+parallel(2) USE_HASH(t1,t2)*/ * FROM t1 WHERE c1 NOT IN (SELECT c1 FROM t2 WHERE t2.c1 IS NOT NULL) ORDER BY 1,2;
c0	c1
1	12
1	A
2	12
3	A
SELECT /*+parallel(2) USE_HASH(t1,t2)*/ * FROM t1 WHERE c1 <>ALL (SELECT c1 FROM t2 WHERE t2.c1 IS NOT NULL) ORDER BY 1,2;
c0	c1
1	12
1	A
2	12
3	A
SELECT /*+parallel(2) USE_NL(t1,t2)*/ * FROM t1 WHERE c1 <>ALL (SELECT c1 FROM t2 WHERE t2.c1 IS NOT NULL) ORDER BY 1,2;
c0	c1
1	12
1	A
2	12
3	A
SELECT /*+parallel(2) USE_HASH(t1,t2)*/ * FROM t1 WHERE NOT EXISTS (SELECT c1 FROM t2 WHERE t2.c1 IS NOT NULL) ORDER BY 1,2;
c0	c1
SELECT /*+parallel(5) USE_HASH(t1,t2)*/ * FROM t1 WHERE c1 NOT IN (SELECT c1 FROM t2 WHERE t2.c1 IS NOT NULL) ORDER BY 1,2;
c0	c1
1	12
1	A
2	12
3	A
SELECT /*+parallel(5) USE_NLJ(t1,t2)*/ * FROM t1 WHERE c1 NOT IN (SELECT c1 FROM t2 WHERE t2.c1 IS NOT NULL) ORDER BY 1,2;
c0	c1
1	12
1	A
2	12
3	A
SELECT /*+parallel(5) USE_HASH(t1,t2)*/ * FROM t1 WHERE c1 <>ALL (SELECT c1 FROM t2 WHERE t2.c1 IS NOT NULL) ORDER BY 1,2;
c0	c1
1	12
1	A
2	12
3	A
SELECT /*+parallel(5) USE_MJ(t1,t2)*/ * FROM t1 WHERE c1 NOT IN (SELECT c1 FROM t2 WHERE t2.c1 IS NOT NULL) ORDER BY 1,2;
c0	c1
1	12
1	A
2	12
3	A
SELECT /*+parallel(5) USE_HASH(t1,t2)*/ * FROM t1 WHERE NOT EXISTS (SELECT c1 FROM t2 WHERE t2.c1 IS NOT NULL) ORDER BY 1,2;
c0	c1
SELECT /*+parallel(2) USE_HASH(t1,t2)*/ * FROM t1,t2 WHERE t1.c0=t2.c0 AND t1.c1 NOT IN (SELECT c1 FROM t2 WHERE t2.c1 IS NOT NULL) ORDER BY 1,2;
c0	c1	c0	c1
2	12	2	AB
3	A	3	
SELECT /*+parallel(2) USE_HASH(t1,t2)*/ * FROM t1,t2 WHERE t1.c0=t2.c0 AND t1.c1 <>ALL (SELECT c1 FROM t2 WHERE t2.c1 IS NOT NULL) ORDER BY 1,2;
c0	c1	c0	c1
2	12	2	AB
3	A	3	
SELECT /*+parallel(2) USE_MJ(t1,t2)*/ * FROM t1,t2 WHERE t1.c0=t2.c0 AND t1.c1 <>ALL (SELECT c1 FROM t2 WHERE t2.c1 IS NOT NULL) ORDER BY 1,2;
c0	c1	c0	c1
2	12	2	AB
3	A	3	
SELECT /*+parallel(2) USE_NL(t1,t2)*/ * FROM t1,t2 WHERE t1.c0=t2.c0 AND t1.c1 NOT IN (SELECT c1 FROM t2 WHERE t2.c1 IS NOT NULL) ORDER BY 1,2;
c0	c1	c0	c1
2	12	2	AB
3	A	3	
SELECT /*+parallel(2) USE_HASH(t1,t2)*/ * FROM t1,t2 WHERE t1.c0=t2.c0 AND NOT EXISTS (SELECT c1 FROM t2 WHERE t2.c1 IS NOT NULL) ORDER BY 1,2;
c0	c1	c0	c1
#Left table is empty
DELETE FROM t1;
INSERT INTO t2 VALUES(4,NULL);
SELECT * FROM t1 ORDER BY c0,c1;
c0	c1
SELECT * FROM t2 ORDER BY c0,c1;
c0	c1
2	AB
3	
4	NULL
#IF "_optimizer_null_aware_antijoin"=ON,EXPLAIN:HASH JOIN ANTI NA
SELECT * FROM t1 WHERE c1 NOT IN (SELECT c1 FROM t2) ORDER BY 1,2;
c0	c1
SELECT * FROM t1 WHERE NOT EXISTS (SELECT c1 FROM t2) ORDER BY 1,2;
c0	c1
#IF "_optimizer_null_aware_antijoin"=TRUE,EXPLAIN:HASH JOIN ANTI SNA
SELECT * FROM t1 WHERE c1 NOT IN (SELECT c1 FROM t2 WHERE t2.c1 IS NOT NULL) ORDER BY 1,2;
c0	c1
SELECT * FROM t1 WHERE NOT EXISTS (SELECT c1 FROM t2 WHERE t2.c1 IS NOT NULL) ORDER BY 1,2;
c0	c1
#INNER JOIN
#IF "_optimizer_null_aware_antijoin"=ON,EXPLAIN:HASH JOIN ANTI NA
SELECT * FROM t1 JOIN t2 ON t1.c0=t2.c0 AND t1.c1 NOT IN (SELECT c1 FROM t2) ORDER BY 1,2;
c0	c1	c0	c1
SELECT * FROM t1 JOIN t2 ON t1.c0=t2.c0 AND NOT EXISTS (SELECT c1 FROM t2) ORDER BY 1,2;
c0	c1	c0	c1
#IF "_optimizer_null_aware_antijoin"=TRUE,EXPLAIN:HASH JOIN ANTI SNA
SELECT * FROM t1 JOIN t2 ON t1.c0=t2.c0 AND t1.c1 NOT IN (SELECT c1 FROM t2 WHERE t2.c1 IS NOT NULL) ORDER BY 1,2;
c0	c1	c0	c1
SELECT * FROM t1 JOIN t2 ON t1.c0=t2.c0 AND NOT EXISTS (SELECT c1 FROM t2 WHERE t2.c1 IS NOT NULL) ORDER BY 1,2;
c0	c1	c0	c1
#RIGHT JOIN
#IF "_optimizer_null_aware_antijoin"=ON,EXPLAIN:HASH JOIN ANTI NA
SELECT * FROM t1 RIGHT JOIN t2 ON t1.c0=t2.c0 AND t1.c1 NOT IN (SELECT c1 FROM t2) ORDER BY 1,2,3;
c0	c1	c0	c1
NULL	NULL	2	AB
NULL	NULL	3	
NULL	NULL	4	NULL
SELECT * FROM t1 RIGHT JOIN t2 ON t1.c0=t2.c0 AND t1.c1 <>ALL (SELECT c1 FROM t2) ORDER BY 1,2,3;
c0	c1	c0	c1
NULL	NULL	2	AB
NULL	NULL	3	
NULL	NULL	4	NULL
SELECT * FROM t1 RIGHT JOIN t2 ON t1.c0=t2.c0 AND NOT EXISTS (SELECT c1 FROM t2) ORDER BY 1,2,3;
c0	c1	c0	c1
NULL	NULL	2	AB
NULL	NULL	3	
NULL	NULL	4	NULL
#IF "_optimizer_null_aware_antijoin"=ON,EXPLAIN:HASH JOIN ANTI SNA
SELECT * FROM t1 RIGHT JOIN t2 ON t1.c0=t2.c0 AND t1.c1 NOT IN (SELECT c1 FROM t2 WHERE t2.c1 IS NOT NULL) ORDER BY 1,2,3;
c0	c1	c0	c1
NULL	NULL	2	AB
NULL	NULL	3	
NULL	NULL	4	NULL
SELECT * FROM t1 RIGHT JOIN t2 ON t1.c0=t2.c0 AND t1.c1 <>ALL (SELECT c1 FROM t2 WHERE t2.c1 IS NOT NULL) ORDER BY 1,2,3;
c0	c1	c0	c1
NULL	NULL	2	AB
NULL	NULL	3	
NULL	NULL	4	NULL
SELECT * FROM t1 RIGHT JOIN t2 ON t1.c0=t2.c0 AND NOT EXISTS (SELECT c1 FROM t2 WHERE t2.c1 IS NOT NULL) ORDER BY 1,2,3;
c0	c1	c0	c1
NULL	NULL	2	AB
NULL	NULL	3	
NULL	NULL	4	NULL
#LEFT JOIN
#IF "_optimizer_null_aware_antijoin"=ON,EXPLAIN:HASH JOIN ANTI NA
SELECT * FROM t1 LEFT JOIN t2 ON t1.c0=t2.c0 WHERE t1.c1 NOT IN (SELECT c1 FROM t2) ORDER BY 1,2;
c0	c1	c0	c1
SELECT * FROM t1 LEFT JOIN t2 ON t1.c0=t2.c0 WHERE t1.c1 <>ALL (SELECT c1 FROM t2) ORDER BY 1,2;
c0	c1	c0	c1
SELECT * FROM t1 LEFT JOIN t2 ON t1.c0=t2.c0 WHERE NOT EXISTS (SELECT c1 FROM t2) ORDER BY 1,2;
c0	c1	c0	c1
#IF "_optimizer_null_aware_antijoin"=ON,EXPLAIN:HASH JOIN ANTI SNA
SELECT * FROM t1 LEFT JOIN t2 ON t1.c0=t2.c0 WHERE t1.c1 NOT IN (SELECT c1 FROM t2 WHERE t2.c1 IS NOT NULL) ORDER BY 1,2,3;
c0	c1	c0	c1
SELECT * FROM t1 LEFT JOIN t2 ON t1.c0=t2.c0 WHERE t1.c1 <>ALL (SELECT c1 FROM t2 WHERE t2.c1 IS NOT NULL) ORDER BY 1,2,3;
c0	c1	c0	c1
SELECT * FROM t1 LEFT JOIN t2 ON t1.c0=t2.c0 WHERE NOT EXISTS (SELECT c1 FROM t2 WHERE t2.c1 IS NOT NULL) ORDER BY 1,2,3;
c0	c1	c0	c1
#FULL JOIN
#IF "_optimizer_null_aware_antijoin"=ON,EXPLAIN:HASH JOIN ANTI NA
SELECT * FROM t1 FULL JOIN t2 ON t1.c0=t2.c0 WHERE t1.c1 NOT IN (SELECT c1 FROM t2) ORDER BY 1,2;
c0	c1	c0	c1
SELECT * FROM t1 FULL JOIN t2 ON t1.c0=t2.c0 WHERE t1.c1 <>ALL (SELECT c1 FROM t2) ORDER BY 1,2;
c0	c1	c0	c1
SELECT * FROM t1 FULL JOIN t2 ON t1.c0=t2.c0 WHERE NOT EXISTS (SELECT c1 FROM t2) ORDER BY 1,2;
c0	c1	c0	c1
#IF "_optimizer_null_aware_antijoin"=ON,EXPLAIN:HASH JOIN ANTI SNA
SELECT * FROM t1 FULL JOIN t2 ON t1.c0=t2.c0 WHERE t1.c1 NOT IN (SELECT c1 FROM t2 WHERE t2.c1 IS NOT NULL) ORDER BY 1,2,3;
c0	c1	c0	c1
SELECT * FROM t1 FULL JOIN t2 ON t1.c0=t2.c0 WHERE t1.c1 <>ALL (SELECT c1 FROM t2 WHERE t2.c1 IS NOT NULL) ORDER BY 1,2,3;
c0	c1	c0	c1
SELECT * FROM t1 FULL JOIN t2 ON t1.c0=t2.c0 WHERE NOT EXISTS (SELECT c1 FROM t2 WHERE t2.c1 IS NOT NULL) ORDER BY 1,2,3;
c0	c1	c0	c1
#HINT
#IF "_optimizer_null_aware_antijoin"=ON,EXPLAIN:HASH JOIN ANTI NA
SELECT /*+USE_HASH(t1,t2)*/ * FROM t1 WHERE c1 NOT IN (SELECT c1 FROM t2) ORDER BY 1,2;
c0	c1
SELECT /*+USE_HASH(t1,t2)*/ * FROM t1 JOIN t2 ON t1.c0=t2.c0 AND t1.c1 <>ALL (SELECT c1 FROM t2) ORDER BY 1,2;
c0	c1	c0	c1
SELECT /*+USE_HASH(t1,t2)*/ * FROM t1 RIGHT JOIN t2 ON t1.c0=t2.c0 WHERE t1.c1 NOT IN (SELECT c1 FROM t2) ORDER BY 1,2;
c0	c1	c0	c1
SELECT /*+USE_NLJ(t1,t2)*/ * FROM t1 RIGHT JOIN t2 ON t1.c0=t2.c0 WHERE t1.c1 NOT IN (SELECT c1 FROM t2) ORDER BY 1,2;
c0	c1	c0	c1
SELECT /*+USE_MJ(t1,t2)*/ * FROM t1 JOIN t2 ON t1.c0=t2.c0 AND t1.c1 <>ALL (SELECT c1 FROM t2) ORDER BY 1,2;
c0	c1	c0	c1
SELECT /*+USE_HASH(t1,t2)*/ * FROM t1 WHERE NOT EXISTS (SELECT c1 FROM t2) ORDER BY 1,2;
c0	c1
SELECT /*+USE_HASH(t1,t2)*/ * FROM t1 WHERE c1 NOT IN (SELECT c1 FROM t2) ORDER BY 1,2;
c0	c1
SELECT /*+USE_NL(t1,t2)*/ * FROM t1 JOIN t2 ON t1.c0=t2.c0 AND t1.c1 <>ALL (SELECT c1 FROM t2) ORDER BY 1,2;
c0	c1	c0	c1
SELECT /*+USE_MJ(t1,t2)*/ * FROM t1 JOIN t2 ON t1.c0=t2.c0 AND t1.c1 <>ALL (SELECT c1 FROM t2) ORDER BY 1,2;
c0	c1	c0	c1
#IF "_optimizer_null_aware_antijoin"=ON,EXPLAIN:HASH JOIN ANTI SNA
SELECT /*+USE_HASH(t1,t2)*/ * FROM t1 WHERE c1 NOT IN (SELECT c1 FROM t2 WHERE t2.c1 IS NOT NULL) ORDER BY 1,2;
c0	c1
SELECT /*+USE_HASH(t1,t2)*/ * FROM t1 JOIN t2 ON t1.c0=t2.c0 AND t1.c1 <>ALL (SELECT c1 FROM t2 WHERE t2.c1 IS NOT NULL) ORDER BY 1,2;
c0	c1	c0	c1
SELECT /*+USE_HASH(t1,t2)*/ * FROM t1 RIGHT JOIN t2 ON t1.c0=t2.c0 WHERE t1.c1 NOT IN (SELECT c1 FROM t2 WHERE t2.c1 IS NOT NULL) ORDER BY 1,2;
c0	c1	c0	c1
SELECT /*+USE_NLJ(t1,t2)*/ * FROM t1 RIGHT JOIN t2 ON t1.c0=t2.c0 WHERE t1.c1 NOT IN (SELECT c1 FROM t2 WHERE t2.c1 IS NOT NULL) ORDER BY 1,2;
c0	c1	c0	c1
SELECT /*+USE_MJ(t1,t2)*/ * FROM t1 JOIN t2 ON t1.c0=t2.c0 AND t1.c1 <>ALL (SELECT c1 FROM t2 WHERE t2.c1 IS NOT NULL) ORDER BY 1,2;
c0	c1	c0	c1
SELECT /*+USE_HASH(t1,t2)*/ * FROM t1 WHERE NOT EXISTS (SELECT c1 FROM t2 WHERE t2.c1 IS NOT NULL) ORDER BY 1,2;
c0	c1
SELECT /*+USE_HASH(t1,t2)*/ * FROM t1 WHERE c1 NOT IN (SELECT c1 FROM t2 WHERE t2.c1 IS NOT NULL) ORDER BY 1,2;
c0	c1
SELECT /*+USE_NL(t1,t2)*/ * FROM t1 JOIN t2 ON t1.c0=t2.c0 AND t1.c1 <>ALL (SELECT c1 FROM t2 WHERE t2.c1 IS NOT NULL) ORDER BY 1,2;
c0	c1	c0	c1
SELECT /*+USE_MJ(t1,t2)*/ * FROM t1 JOIN t2 ON t1.c0=t2.c0 AND t1.c1 <>ALL (SELECT c1 FROM t2 WHERE t2.c1 IS NOT NULL) ORDER BY 1,2;
c0	c1	c0	c1
#PARALLEL
#IF "_optimizer_null_aware_antijoin"=ON,EXPLAIN:HASH JOIN ANTI NA
SELECT /*+parallel(2) USE_HASH(t1,t2)*/ * FROM t1 WHERE c1 NOT IN (SELECT c1 FROM t2) ORDER BY 1,2;
c0	c1
SELECT /*+parallel(2) USE_HASH(t1,t2)*/ * FROM t1 WHERE c1 <>ALL (SELECT c1 FROM t2) ORDER BY 1,2;
c0	c1
SELECT /*+parallel(2) USE_NL(t1,t2)*/ * FROM t1 WHERE c1 <>ALL (SELECT c1 FROM t2) ORDER BY 1,2;
c0	c1
SELECT /*+parallel(2) USE_HASH(t1,t2)*/ * FROM t1 WHERE NOT EXISTS (SELECT c1 FROM t2) ORDER BY 1,2;
c0	c1
SELECT /*+parallel(5) USE_HASH(t1,t2)*/ * FROM t1 WHERE c1 NOT IN (SELECT c1 FROM t2) ORDER BY 1,2;
c0	c1
SELECT /*+parallel(5) USE_NLJ(t1,t2)*/ * FROM t1 WHERE c1 NOT IN (SELECT c1 FROM t2) ORDER BY 1,2;
c0	c1
SELECT /*+parallel(5) USE_HASH(t1,t2)*/ * FROM t1 WHERE c1 <>ALL (SELECT c1 FROM t2) ORDER BY 1,2;
c0	c1
SELECT /*+parallel(5) USE_MJ(t1,t2)*/ * FROM t1 WHERE c1 NOT IN (SELECT c1 FROM t2) ORDER BY 1,2;
c0	c1
SELECT /*+parallel(5) USE_HASH(t1,t2)*/ * FROM t1 WHERE NOT EXISTS (SELECT c1 FROM t2) ORDER BY 1,2;
c0	c1
SELECT /*+parallel(2) USE_HASH(t1,t2)*/ * FROM t1,t2 WHERE t1.c0=t2.c0 AND t1.c1 NOT IN (SELECT c1 FROM t2) ORDER BY 1,2;
c0	c1	c0	c1
SELECT /*+parallel(2) USE_HASH(t1,t2)*/ * FROM t1,t2 WHERE t1.c0=t2.c0 AND t1.c1 <>ALL (SELECT c1 FROM t2) ORDER BY 1,2;
c0	c1	c0	c1
SELECT /*+parallel(2) USE_MJ(t1,t2)*/ * FROM t1,t2 WHERE t1.c0=t2.c0 AND t1.c1 <>ALL (SELECT c1 FROM t2) ORDER BY 1,2;
c0	c1	c0	c1
SELECT /*+parallel(2) USE_NL(t1,t2)*/ * FROM t1,t2 WHERE t1.c0=t2.c0 AND t1.c1 NOT IN (SELECT c1 FROM t2) ORDER BY 1,2;
c0	c1	c0	c1
SELECT /*+parallel(2) USE_HASH(t1,t2)*/ * FROM t1,t2 WHERE t1.c0=t2.c0 AND NOT EXISTS (SELECT c1 FROM t2) ORDER BY 1,2;
c0	c1	c0	c1
#IF "_optimizer_null_aware_antijoin"=ON,EXPLAIN:HASH JOIN ANTI SNA
SELECT /*+parallel(2) USE_HASH(t1,t2)*/ * FROM t1 WHERE c1 NOT IN (SELECT c1 FROM t2 WHERE t2.c1 IS NOT NULL) ORDER BY 1,2;
c0	c1
SELECT /*+parallel(2) USE_HASH(t1,t2)*/ * FROM t1 WHERE c1 <>ALL (SELECT c1 FROM t2 WHERE t2.c1 IS NOT NULL) ORDER BY 1,2;
c0	c1
SELECT /*+parallel(2) USE_NL(t1,t2)*/ * FROM t1 WHERE c1 <>ALL (SELECT c1 FROM t2 WHERE t2.c1 IS NOT NULL) ORDER BY 1,2;
c0	c1
SELECT /*+parallel(2) USE_HASH(t1,t2)*/ * FROM t1 WHERE NOT EXISTS (SELECT c1 FROM t2 WHERE t2.c1 IS NOT NULL) ORDER BY 1,2;
c0	c1
SELECT /*+parallel(5) USE_HASH(t1,t2)*/ * FROM t1 WHERE c1 NOT IN (SELECT c1 FROM t2 WHERE t2.c1 IS NOT NULL) ORDER BY 1,2;
c0	c1
SELECT /*+parallel(5) USE_NLJ(t1,t2)*/ * FROM t1 WHERE c1 NOT IN (SELECT c1 FROM t2 WHERE t2.c1 IS NOT NULL) ORDER BY 1,2;
c0	c1
SELECT /*+parallel(5) USE_HASH(t1,t2)*/ * FROM t1 WHERE c1 <>ALL (SELECT c1 FROM t2 WHERE t2.c1 IS NOT NULL) ORDER BY 1,2;
c0	c1
SELECT /*+parallel(5) USE_MJ(t1,t2)*/ * FROM t1 WHERE c1 NOT IN (SELECT c1 FROM t2 WHERE t2.c1 IS NOT NULL) ORDER BY 1,2;
c0	c1
SELECT /*+parallel(5) USE_HASH(t1,t2)*/ * FROM t1 WHERE NOT EXISTS (SELECT c1 FROM t2 WHERE t2.c1 IS NOT NULL) ORDER BY 1,2;
c0	c1
SELECT /*+parallel(2) USE_HASH(t1,t2)*/ * FROM t1,t2 WHERE t1.c0=t2.c0 AND t1.c1 NOT IN (SELECT c1 FROM t2 WHERE t2.c1 IS NOT NULL) ORDER BY 1,2;
c0	c1	c0	c1
SELECT /*+parallel(2) USE_HASH(t1,t2)*/ * FROM t1,t2 WHERE t1.c0=t2.c0 AND t1.c1 <>ALL (SELECT c1 FROM t2 WHERE t2.c1 IS NOT NULL) ORDER BY 1,2;
c0	c1	c0	c1
SELECT /*+parallel(2) USE_MJ(t1,t2)*/ * FROM t1,t2 WHERE t1.c0=t2.c0 AND t1.c1 <>ALL (SELECT c1 FROM t2 WHERE t2.c1 IS NOT NULL) ORDER BY 1,2;
c0	c1	c0	c1
SELECT /*+parallel(2) USE_NL(t1,t2)*/ * FROM t1,t2 WHERE t1.c0=t2.c0 AND t1.c1 NOT IN (SELECT c1 FROM t2 WHERE t2.c1 IS NOT NULL) ORDER BY 1,2;
c0	c1	c0	c1
SELECT /*+parallel(2) USE_HASH(t1,t2)*/ * FROM t1,t2 WHERE t1.c0=t2.c0 AND NOT EXISTS (SELECT c1 FROM t2 WHERE t2.c1 IS NOT NULL) ORDER BY 1,2;
c0	c1	c0	c1
#right table is empty
DELETE FROM t2;
INSERT INTO t1 VALUES(1,'A');
INSERT INTO t1 VALUES(2,12);
INSERT INTO t1 VALUES(3,'A');
INSERT INTO t1 VALUES(4,NULL);
INSERT INTO t1 VALUES(1,12);
SELECT * FROM t1 ORDER BY c0,c1;
c0	c1
1	12
1	A
2	12
3	A
4	NULL
SELECT * FROM t2 ORDER BY c0,c1;
c0	c1
#IF "_optimizer_null_aware_antijoin"=ON,EXPLAIN:HASH JOIN ANTI NA
SELECT * FROM t1 WHERE c1 NOT IN (SELECT c1 FROM t2) ORDER BY 1,2;
c0	c1
1	12
1	A
2	12
3	A
4	NULL
SELECT * FROM t1 WHERE NOT EXISTS (SELECT c1 FROM t2) ORDER BY 1,2;
c0	c1
1	12
1	A
2	12
3	A
4	NULL
#IF "_optimizer_null_aware_antijoin"=TRUE,EXPLAIN:HASH JOIN ANTI SNA
SELECT * FROM t1 WHERE c1 NOT IN (SELECT c1 FROM t2 WHERE t2.c1 IS NOT NULL) ORDER BY 1,2;
c0	c1
1	12
1	A
2	12
3	A
4	NULL
SELECT * FROM t1 WHERE NOT EXISTS (SELECT c1 FROM t2 WHERE t2.c1 IS NOT NULL) ORDER BY 1,2;
c0	c1
1	12
1	A
2	12
3	A
4	NULL
#INNER JOIN
#IF "_optimizer_null_aware_antijoin"=ON,EXPLAIN:HASH JOIN ANTI NA
SELECT * FROM t1 JOIN t2 ON t1.c0=t2.c0 AND t1.c1 NOT IN (SELECT c1 FROM t2) ORDER BY 1,2;
c0	c1	c0	c1
SELECT * FROM t1 JOIN t2 ON t1.c0=t2.c0 AND NOT EXISTS (SELECT c1 FROM t2) ORDER BY 1,2;
c0	c1	c0	c1
#IF "_optimizer_null_aware_antijoin"=TRUE,EXPLAIN:HASH JOIN ANTI SNA
SELECT * FROM t1 JOIN t2 ON t1.c0=t2.c0 AND t1.c1 NOT IN (SELECT c1 FROM t2 WHERE t2.c1 IS NOT NULL) ORDER BY 1,2;
c0	c1	c0	c1
SELECT * FROM t1 JOIN t2 ON t1.c0=t2.c0 AND NOT EXISTS (SELECT c1 FROM t2 WHERE t2.c1 IS NOT NULL) ORDER BY 1,2;
c0	c1	c0	c1
#RIGHT JOIN
#IF "_optimizer_null_aware_antijoin"=ON,EXPLAIN:HASH JOIN ANTI NA
SELECT * FROM t1 RIGHT JOIN t2 ON t1.c0=t2.c0 AND t1.c1 NOT IN (SELECT c1 FROM t2) ORDER BY 1,2,3;
c0	c1	c0	c1
SELECT * FROM t1 RIGHT JOIN t2 ON t1.c0=t2.c0 AND t1.c1 <>ALL (SELECT c1 FROM t2) ORDER BY 1,2,3;
c0	c1	c0	c1
SELECT * FROM t1 RIGHT JOIN t2 ON t1.c0=t2.c0 AND NOT EXISTS (SELECT c1 FROM t2) ORDER BY 1,2,3;
c0	c1	c0	c1
#IF "_optimizer_null_aware_antijoin"=ON,EXPLAIN:HASH JOIN ANTI SNA
SELECT * FROM t1 RIGHT JOIN t2 ON t1.c0=t2.c0 AND t1.c1 NOT IN (SELECT c1 FROM t2 WHERE t2.c1 IS NOT NULL) ORDER BY 1,2,3;
c0	c1	c0	c1
SELECT * FROM t1 RIGHT JOIN t2 ON t1.c0=t2.c0 AND t1.c1 <>ALL (SELECT c1 FROM t2 WHERE t2.c1 IS NOT NULL) ORDER BY 1,2,3;
c0	c1	c0	c1
SELECT * FROM t1 RIGHT JOIN t2 ON t1.c0=t2.c0 AND NOT EXISTS (SELECT c1 FROM t2 WHERE t2.c1 IS NOT NULL) ORDER BY 1,2,3;
c0	c1	c0	c1
#LEFT JOIN
#IF "_optimizer_null_aware_antijoin"=ON,EXPLAIN:HASH JOIN ANTI NA
SELECT * FROM t1 LEFT JOIN t2 ON t1.c0=t2.c0 WHERE t1.c1 NOT IN (SELECT c1 FROM t2) ORDER BY 1,2;
c0	c1	c0	c1
1	12	NULL	NULL
1	A	NULL	NULL
2	12	NULL	NULL
3	A	NULL	NULL
4	NULL	NULL	NULL
SELECT * FROM t1 LEFT JOIN t2 ON t1.c0=t2.c0 WHERE t1.c1 <>ALL (SELECT c1 FROM t2) ORDER BY 1,2;
c0	c1	c0	c1
1	12	NULL	NULL
1	A	NULL	NULL
2	12	NULL	NULL
3	A	NULL	NULL
4	NULL	NULL	NULL
SELECT * FROM t1 LEFT JOIN t2 ON t1.c0=t2.c0 WHERE NOT EXISTS (SELECT c1 FROM t2) ORDER BY 1,2;
c0	c1	c0	c1
1	12	NULL	NULL
1	A	NULL	NULL
2	12	NULL	NULL
3	A	NULL	NULL
4	NULL	NULL	NULL
#IF "_optimizer_null_aware_antijoin"=ON,EXPLAIN:HASH JOIN ANTI SNA
SELECT * FROM t1 LEFT JOIN t2 ON t1.c0=t2.c0 WHERE t1.c1 NOT IN (SELECT c1 FROM t2 WHERE t2.c1 IS NOT NULL) ORDER BY 1,2,3;
c0	c1	c0	c1
1	12	NULL	NULL
1	A	NULL	NULL
2	12	NULL	NULL
3	A	NULL	NULL
4	NULL	NULL	NULL
SELECT * FROM t1 LEFT JOIN t2 ON t1.c0=t2.c0 WHERE t1.c1 <>ALL (SELECT c1 FROM t2 WHERE t2.c1 IS NOT NULL) ORDER BY 1,2,3;
c0	c1	c0	c1
1	12	NULL	NULL
1	A	NULL	NULL
2	12	NULL	NULL
3	A	NULL	NULL
4	NULL	NULL	NULL
SELECT * FROM t1 LEFT JOIN t2 ON t1.c0=t2.c0 WHERE NOT EXISTS (SELECT c1 FROM t2 WHERE t2.c1 IS NOT NULL) ORDER BY 1,2,3;
c0	c1	c0	c1
1	12	NULL	NULL
1	A	NULL	NULL
2	12	NULL	NULL
3	A	NULL	NULL
4	NULL	NULL	NULL
#FULL JOIN
#IF "_optimizer_null_aware_antijoin"=ON,EXPLAIN:HASH JOIN ANTI NA
SELECT * FROM t1 FULL JOIN t2 ON t1.c0=t2.c0 WHERE t1.c1 NOT IN (SELECT c1 FROM t2) ORDER BY 1,2;
c0	c1	c0	c1
1	12	NULL	NULL
1	A	NULL	NULL
2	12	NULL	NULL
3	A	NULL	NULL
4	NULL	NULL	NULL
SELECT * FROM t1 FULL JOIN t2 ON t1.c0=t2.c0 WHERE t1.c1 <>ALL (SELECT c1 FROM t2) ORDER BY 1,2;
c0	c1	c0	c1
1	12	NULL	NULL
1	A	NULL	NULL
2	12	NULL	NULL
3	A	NULL	NULL
4	NULL	NULL	NULL
SELECT * FROM t1 FULL JOIN t2 ON t1.c0=t2.c0 WHERE NOT EXISTS (SELECT c1 FROM t2) ORDER BY 1,2;
c0	c1	c0	c1
1	12	NULL	NULL
1	A	NULL	NULL
2	12	NULL	NULL
3	A	NULL	NULL
4	NULL	NULL	NULL
#IF "_optimizer_null_aware_antijoin"=ON,EXPLAIN:HASH JOIN ANTI SNA
SELECT * FROM t1 FULL JOIN t2 ON t1.c0=t2.c0 WHERE t1.c1 NOT IN (SELECT c1 FROM t2 WHERE t2.c1 IS NOT NULL) ORDER BY 1,2,3;
c0	c1	c0	c1
1	12	NULL	NULL
1	A	NULL	NULL
2	12	NULL	NULL
3	A	NULL	NULL
4	NULL	NULL	NULL
SELECT * FROM t1 FULL JOIN t2 ON t1.c0=t2.c0 WHERE t1.c1 <>ALL (SELECT c1 FROM t2 WHERE t2.c1 IS NOT NULL) ORDER BY 1,2,3;
c0	c1	c0	c1
1	12	NULL	NULL
1	A	NULL	NULL
2	12	NULL	NULL
3	A	NULL	NULL
4	NULL	NULL	NULL
SELECT * FROM t1 FULL JOIN t2 ON t1.c0=t2.c0 WHERE NOT EXISTS (SELECT c1 FROM t2 WHERE t2.c1 IS NOT NULL) ORDER BY 1,2,3;
c0	c1	c0	c1
1	12	NULL	NULL
1	A	NULL	NULL
2	12	NULL	NULL
3	A	NULL	NULL
4	NULL	NULL	NULL
#HINT
#IF "_optimizer_null_aware_antijoin"=ON,EXPLAIN:HASH JOIN ANTI NA
SELECT /*+USE_HASH(t1,t2)*/ * FROM t1 WHERE c1 NOT IN (SELECT c1 FROM t2) ORDER BY 1,2;
c0	c1
1	12
1	A
2	12
3	A
4	NULL
SELECT /*+USE_HASH(t1,t2)*/ * FROM t1 JOIN t2 ON t1.c0=t2.c0 AND t1.c1 <>ALL (SELECT c1 FROM t2) ORDER BY 1,2;
c0	c1	c0	c1
SELECT /*+USE_HASH(t1,t2)*/ * FROM t1 RIGHT JOIN t2 ON t1.c0=t2.c0 WHERE t1.c1 NOT IN (SELECT c1 FROM t2) ORDER BY 1,2;
c0	c1	c0	c1
SELECT /*+USE_NLJ(t1,t2)*/ * FROM t1 RIGHT JOIN t2 ON t1.c0=t2.c0 WHERE t1.c1 NOT IN (SELECT c1 FROM t2) ORDER BY 1,2;
c0	c1	c0	c1
SELECT /*+USE_MJ(t1,t2)*/ * FROM t1 JOIN t2 ON t1.c0=t2.c0 AND t1.c1 <>ALL (SELECT c1 FROM t2) ORDER BY 1,2;
c0	c1	c0	c1
SELECT /*+USE_HASH(t1,t2)*/ * FROM t1 WHERE NOT EXISTS (SELECT c1 FROM t2) ORDER BY 1,2;
c0	c1
1	12
1	A
2	12
3	A
4	NULL
SELECT /*+USE_HASH(t1,t2)*/ * FROM t1 WHERE c1 NOT IN (SELECT c1 FROM t2) ORDER BY 1,2;
c0	c1
1	12
1	A
2	12
3	A
4	NULL
SELECT /*+USE_NL(t1,t2)*/ * FROM t1 JOIN t2 ON t1.c0=t2.c0 AND t1.c1 <>ALL (SELECT c1 FROM t2) ORDER BY 1,2;
c0	c1	c0	c1
SELECT /*+USE_MJ(t1,t2)*/ * FROM t1 JOIN t2 ON t1.c0=t2.c0 AND t1.c1 <>ALL (SELECT c1 FROM t2) ORDER BY 1,2;
c0	c1	c0	c1
#IF "_optimizer_null_aware_antijoin"=ON,EXPLAIN:HASH JOIN ANTI SNA
SELECT /*+USE_HASH(t1,t2)*/ * FROM t1 WHERE c1 NOT IN (SELECT c1 FROM t2 WHERE t2.c1 IS NOT NULL) ORDER BY 1,2;
c0	c1
1	12
1	A
2	12
3	A
4	NULL
SELECT /*+USE_HASH(t1,t2)*/ * FROM t1 JOIN t2 ON t1.c0=t2.c0 AND t1.c1 <>ALL (SELECT c1 FROM t2 WHERE t2.c1 IS NOT NULL) ORDER BY 1,2;
c0	c1	c0	c1
SELECT /*+USE_HASH(t1,t2)*/ * FROM t1 RIGHT JOIN t2 ON t1.c0=t2.c0 WHERE t1.c1 NOT IN (SELECT c1 FROM t2 WHERE t2.c1 IS NOT NULL) ORDER BY 1,2;
c0	c1	c0	c1
SELECT /*+USE_NLJ(t1,t2)*/ * FROM t1 RIGHT JOIN t2 ON t1.c0=t2.c0 WHERE t1.c1 NOT IN (SELECT c1 FROM t2 WHERE t2.c1 IS NOT NULL) ORDER BY 1,2;
c0	c1	c0	c1
SELECT /*+USE_MJ(t1,t2)*/ * FROM t1 JOIN t2 ON t1.c0=t2.c0 AND t1.c1 <>ALL (SELECT c1 FROM t2 WHERE t2.c1 IS NOT NULL) ORDER BY 1,2;
c0	c1	c0	c1
SELECT /*+USE_HASH(t1,t2)*/ * FROM t1 WHERE NOT EXISTS (SELECT c1 FROM t2 WHERE t2.c1 IS NOT NULL) ORDER BY 1,2;
c0	c1
1	12
1	A
2	12
3	A
4	NULL
SELECT /*+USE_HASH(t1,t2)*/ * FROM t1 WHERE c1 NOT IN (SELECT c1 FROM t2 WHERE t2.c1 IS NOT NULL) ORDER BY 1,2;
c0	c1
1	12
1	A
2	12
3	A
4	NULL
SELECT /*+USE_NL(t1,t2)*/ * FROM t1 JOIN t2 ON t1.c0=t2.c0 AND t1.c1 <>ALL (SELECT c1 FROM t2 WHERE t2.c1 IS NOT NULL) ORDER BY 1,2;
c0	c1	c0	c1
SELECT /*+USE_MJ(t1,t2)*/ * FROM t1 JOIN t2 ON t1.c0=t2.c0 AND t1.c1 <>ALL (SELECT c1 FROM t2 WHERE t2.c1 IS NOT NULL) ORDER BY 1,2;
c0	c1	c0	c1
#PARALLEL
#IF "_optimizer_null_aware_antijoin"=ON,EXPLAIN:HASH JOIN ANTI NA
SELECT /*+parallel(2) USE_HASH(t1,t2)*/ * FROM t1 WHERE c1 NOT IN (SELECT c1 FROM t2) ORDER BY 1,2;
c0	c1
1	12
1	A
2	12
3	A
4	NULL
SELECT /*+parallel(2) USE_HASH(t1,t2)*/ * FROM t1 WHERE c1 <>ALL (SELECT c1 FROM t2) ORDER BY 1,2;
c0	c1
1	12
1	A
2	12
3	A
4	NULL
SELECT /*+parallel(2) USE_NL(t1,t2)*/ * FROM t1 WHERE c1 <>ALL (SELECT c1 FROM t2) ORDER BY 1,2;
c0	c1
1	12
1	A
2	12
3	A
4	NULL
SELECT /*+parallel(2) USE_HASH(t1,t2)*/ * FROM t1 WHERE NOT EXISTS (SELECT c1 FROM t2) ORDER BY 1,2;
c0	c1
1	12
1	A
2	12
3	A
4	NULL
SELECT /*+parallel(5) USE_HASH(t1,t2)*/ * FROM t1 WHERE c1 NOT IN (SELECT c1 FROM t2) ORDER BY 1,2;
c0	c1
1	12
1	A
2	12
3	A
4	NULL
SELECT /*+parallel(5) USE_NLJ(t1,t2)*/ * FROM t1 WHERE c1 NOT IN (SELECT c1 FROM t2) ORDER BY 1,2;
c0	c1
1	12
1	A
2	12
3	A
4	NULL
SELECT /*+parallel(5) USE_HASH(t1,t2)*/ * FROM t1 WHERE c1 <>ALL (SELECT c1 FROM t2) ORDER BY 1,2;
c0	c1
1	12
1	A
2	12
3	A
4	NULL
SELECT /*+parallel(5) USE_MJ(t1,t2)*/ * FROM t1 WHERE c1 NOT IN (SELECT c1 FROM t2) ORDER BY 1,2;
c0	c1
1	12
1	A
2	12
3	A
4	NULL
SELECT /*+parallel(5) USE_HASH(t1,t2)*/ * FROM t1 WHERE NOT EXISTS (SELECT c1 FROM t2) ORDER BY 1,2;
c0	c1
1	12
1	A
2	12
3	A
4	NULL
SELECT /*+parallel(2) USE_HASH(t1,t2)*/ * FROM t1,t2 WHERE t1.c0=t2.c0 AND t1.c1 NOT IN (SELECT c1 FROM t2) ORDER BY 1,2;
c0	c1	c0	c1
SELECT /*+parallel(2) USE_HASH(t1,t2)*/ * FROM t1,t2 WHERE t1.c0=t2.c0 AND t1.c1 <>ALL (SELECT c1 FROM t2) ORDER BY 1,2;
c0	c1	c0	c1
SELECT /*+parallel(2) USE_MJ(t1,t2)*/ * FROM t1,t2 WHERE t1.c0=t2.c0 AND t1.c1 <>ALL (SELECT c1 FROM t2) ORDER BY 1,2;
c0	c1	c0	c1
SELECT /*+parallel(2) USE_NL(t1,t2)*/ * FROM t1,t2 WHERE t1.c0=t2.c0 AND t1.c1 NOT IN (SELECT c1 FROM t2) ORDER BY 1,2;
c0	c1	c0	c1
SELECT /*+parallel(2) USE_HASH(t1,t2)*/ * FROM t1,t2 WHERE t1.c0=t2.c0 AND NOT EXISTS (SELECT c1 FROM t2) ORDER BY 1,2;
c0	c1	c0	c1
#IF "_optimizer_null_aware_antijoin"=ON,EXPLAIN:HASH JOIN ANTI SNA
SELECT /*+parallel(2) USE_HASH(t1,t2)*/ * FROM t1 WHERE c1 NOT IN (SELECT c1 FROM t2 WHERE t2.c1 IS NOT NULL) ORDER BY 1,2;
c0	c1
1	12
1	A
2	12
3	A
4	NULL
SELECT /*+parallel(2) USE_HASH(t1,t2)*/ * FROM t1 WHERE c1 <>ALL (SELECT c1 FROM t2 WHERE t2.c1 IS NOT NULL) ORDER BY 1,2;
c0	c1
1	12
1	A
2	12
3	A
4	NULL
SELECT /*+parallel(2) USE_NL(t1,t2)*/ * FROM t1 WHERE c1 <>ALL (SELECT c1 FROM t2 WHERE t2.c1 IS NOT NULL) ORDER BY 1,2;
c0	c1
1	12
1	A
2	12
3	A
4	NULL
SELECT /*+parallel(2) USE_HASH(t1,t2)*/ * FROM t1 WHERE NOT EXISTS (SELECT c1 FROM t2 WHERE t2.c1 IS NOT NULL) ORDER BY 1,2;
c0	c1
1	12
1	A
2	12
3	A
4	NULL
SELECT /*+parallel(5) USE_HASH(t1,t2)*/ * FROM t1 WHERE c1 NOT IN (SELECT c1 FROM t2 WHERE t2.c1 IS NOT NULL) ORDER BY 1,2;
c0	c1
1	12
1	A
2	12
3	A
4	NULL
SELECT /*+parallel(5) USE_NLJ(t1,t2)*/ * FROM t1 WHERE c1 NOT IN (SELECT c1 FROM t2 WHERE t2.c1 IS NOT NULL) ORDER BY 1,2;
c0	c1
1	12
1	A
2	12
3	A
4	NULL
SELECT /*+parallel(5) USE_HASH(t1,t2)*/ * FROM t1 WHERE c1 <>ALL (SELECT c1 FROM t2 WHERE t2.c1 IS NOT NULL) ORDER BY 1,2;
c0	c1
1	12
1	A
2	12
3	A
4	NULL
SELECT /*+parallel(5) USE_MJ(t1,t2)*/ * FROM t1 WHERE c1 NOT IN (SELECT c1 FROM t2 WHERE t2.c1 IS NOT NULL) ORDER BY 1,2;
c0	c1
1	12
1	A
2	12
3	A
4	NULL
SELECT /*+parallel(5) USE_HASH(t1,t2)*/ * FROM t1 WHERE NOT EXISTS (SELECT c1 FROM t2 WHERE t2.c1 IS NOT NULL) ORDER BY 1,2;
c0	c1
1	12
1	A
2	12
3	A
4	NULL
SELECT /*+parallel(2) USE_HASH(t1,t2)*/ * FROM t1,t2 WHERE t1.c0=t2.c0 AND t1.c1 NOT IN (SELECT c1 FROM t2 WHERE t2.c1 IS NOT NULL) ORDER BY 1,2;
c0	c1	c0	c1
SELECT /*+parallel(2) USE_HASH(t1,t2)*/ * FROM t1,t2 WHERE t1.c0=t2.c0 AND t1.c1 <>ALL (SELECT c1 FROM t2 WHERE t2.c1 IS NOT NULL) ORDER BY 1,2;
c0	c1	c0	c1
SELECT /*+parallel(2) USE_MJ(t1,t2)*/ * FROM t1,t2 WHERE t1.c0=t2.c0 AND t1.c1 <>ALL (SELECT c1 FROM t2 WHERE t2.c1 IS NOT NULL) ORDER BY 1,2;
c0	c1	c0	c1
SELECT /*+parallel(2) USE_NL(t1,t2)*/ * FROM t1,t2 WHERE t1.c0=t2.c0 AND t1.c1 NOT IN (SELECT c1 FROM t2 WHERE t2.c1 IS NOT NULL) ORDER BY 1,2;
c0	c1	c0	c1
SELECT /*+parallel(2) USE_HASH(t1,t2)*/ * FROM t1,t2 WHERE t1.c0=t2.c0 AND NOT EXISTS (SELECT c1 FROM t2 WHERE t2.c1 IS NOT NULL) ORDER BY 1,2;
c0	c1	c0	c1
#The left and right tables are empty
DELETE FROM t1;
SELECT * FROM t1 ORDER BY c0,c1;
c0	c1
SELECT * FROM t2 ORDER BY c0,c1;
c0	c1
#IF "_optimizer_null_aware_antijoin"=ON,EXPLAIN:HASH JOIN ANTI NA
SELECT * FROM t1 WHERE c1 NOT IN (SELECT c1 FROM t2) ORDER BY 1,2;
c0	c1
SELECT * FROM t1 WHERE NOT EXISTS (SELECT c1 FROM t2) ORDER BY 1,2;
c0	c1
#IF "_optimizer_null_aware_antijoin"=TRUE,EXPLAIN:HASH JOIN ANTI SNA
SELECT * FROM t1 WHERE c1 NOT IN (SELECT c1 FROM t2 WHERE t2.c1 IS NOT NULL) ORDER BY 1,2;
c0	c1
SELECT * FROM t1 WHERE NOT EXISTS (SELECT c1 FROM t2 WHERE t2.c1 IS NOT NULL) ORDER BY 1,2;
c0	c1
#INNER JOIN
#IF "_optimizer_null_aware_antijoin"=ON,EXPLAIN:HASH JOIN ANTI NA
SELECT * FROM t1 JOIN t2 ON t1.c0=t2.c0 AND t1.c1 NOT IN (SELECT c1 FROM t2) ORDER BY 1,2;
c0	c1	c0	c1
SELECT * FROM t1 JOIN t2 ON t1.c0=t2.c0 AND NOT EXISTS (SELECT c1 FROM t2) ORDER BY 1,2;
c0	c1	c0	c1
#IF "_optimizer_null_aware_antijoin"=TRUE,EXPLAIN:HASH JOIN ANTI SNA
SELECT * FROM t1 JOIN t2 ON t1.c0=t2.c0 AND t1.c1 NOT IN (SELECT c1 FROM t2 WHERE t2.c1 IS NOT NULL) ORDER BY 1,2;
c0	c1	c0	c1
SELECT * FROM t1 JOIN t2 ON t1.c0=t2.c0 AND NOT EXISTS (SELECT c1 FROM t2 WHERE t2.c1 IS NOT NULL) ORDER BY 1,2;
c0	c1	c0	c1
#RIGHT JOIN
#IF "_optimizer_null_aware_antijoin"=ON,EXPLAIN:HASH JOIN ANTI NA
SELECT * FROM t1 RIGHT JOIN t2 ON t1.c0=t2.c0 AND t1.c1 NOT IN (SELECT c1 FROM t2) ORDER BY 1,2,3;
c0	c1	c0	c1
SELECT * FROM t1 RIGHT JOIN t2 ON t1.c0=t2.c0 AND t1.c1 <>ALL (SELECT c1 FROM t2) ORDER BY 1,2,3;
c0	c1	c0	c1
SELECT * FROM t1 RIGHT JOIN t2 ON t1.c0=t2.c0 AND NOT EXISTS (SELECT c1 FROM t2) ORDER BY 1,2,3;
c0	c1	c0	c1
#IF "_optimizer_null_aware_antijoin"=ON,EXPLAIN:HASH JOIN ANTI SNA
SELECT * FROM t1 RIGHT JOIN t2 ON t1.c0=t2.c0 AND t1.c1 NOT IN (SELECT c1 FROM t2 WHERE t2.c1 IS NOT NULL) ORDER BY 1,2,3;
c0	c1	c0	c1
SELECT * FROM t1 RIGHT JOIN t2 ON t1.c0=t2.c0 AND t1.c1 <>ALL (SELECT c1 FROM t2 WHERE t2.c1 IS NOT NULL) ORDER BY 1,2,3;
c0	c1	c0	c1
SELECT * FROM t1 RIGHT JOIN t2 ON t1.c0=t2.c0 AND NOT EXISTS (SELECT c1 FROM t2 WHERE t2.c1 IS NOT NULL) ORDER BY 1,2,3;
c0	c1	c0	c1
#LEFT JOIN
#IF "_optimizer_null_aware_antijoin"=ON,EXPLAIN:HASH JOIN ANTI NA
SELECT * FROM t1 LEFT JOIN t2 ON t1.c0=t2.c0 WHERE t1.c1 NOT IN (SELECT c1 FROM t2) ORDER BY 1,2;
c0	c1	c0	c1
SELECT * FROM t1 LEFT JOIN t2 ON t1.c0=t2.c0 WHERE t1.c1 <>ALL (SELECT c1 FROM t2) ORDER BY 1,2;
c0	c1	c0	c1
SELECT * FROM t1 LEFT JOIN t2 ON t1.c0=t2.c0 WHERE NOT EXISTS (SELECT c1 FROM t2) ORDER BY 1,2;
c0	c1	c0	c1
#IF "_optimizer_null_aware_antijoin"=ON,EXPLAIN:HASH JOIN ANTI SNA
SELECT * FROM t1 LEFT JOIN t2 ON t1.c0=t2.c0 WHERE t1.c1 NOT IN (SELECT c1 FROM t2 WHERE t2.c1 IS NOT NULL) ORDER BY 1,2,3;
c0	c1	c0	c1
SELECT * FROM t1 LEFT JOIN t2 ON t1.c0=t2.c0 WHERE t1.c1 <>ALL (SELECT c1 FROM t2 WHERE t2.c1 IS NOT NULL) ORDER BY 1,2,3;
c0	c1	c0	c1
SELECT * FROM t1 LEFT JOIN t2 ON t1.c0=t2.c0 WHERE NOT EXISTS (SELECT c1 FROM t2 WHERE t2.c1 IS NOT NULL) ORDER BY 1,2,3;
c0	c1	c0	c1
#FULL JOIN
#IF "_optimizer_null_aware_antijoin"=ON,EXPLAIN:HASH JOIN ANTI NA
SELECT * FROM t1 FULL JOIN t2 ON t1.c0=t2.c0 WHERE t1.c1 NOT IN (SELECT c1 FROM t2) ORDER BY 1,2;
c0	c1	c0	c1
SELECT * FROM t1 FULL JOIN t2 ON t1.c0=t2.c0 WHERE t1.c1 <>ALL (SELECT c1 FROM t2) ORDER BY 1,2;
c0	c1	c0	c1
SELECT * FROM t1 FULL JOIN t2 ON t1.c0=t2.c0 WHERE NOT EXISTS (SELECT c1 FROM t2) ORDER BY 1,2;
c0	c1	c0	c1
#IF "_optimizer_null_aware_antijoin"=ON,EXPLAIN:HASH JOIN ANTI SNA
SELECT * FROM t1 FULL JOIN t2 ON t1.c0=t2.c0 WHERE t1.c1 NOT IN (SELECT c1 FROM t2 WHERE t2.c1 IS NOT NULL) ORDER BY 1,2,3;
c0	c1	c0	c1
SELECT * FROM t1 FULL JOIN t2 ON t1.c0=t2.c0 WHERE t1.c1 <>ALL (SELECT c1 FROM t2 WHERE t2.c1 IS NOT NULL) ORDER BY 1,2,3;
c0	c1	c0	c1
SELECT * FROM t1 FULL JOIN t2 ON t1.c0=t2.c0 WHERE NOT EXISTS (SELECT c1 FROM t2 WHERE t2.c1 IS NOT NULL) ORDER BY 1,2,3;
c0	c1	c0	c1
#HINT
#IF "_optimizer_null_aware_antijoin"=ON,EXPLAIN:HASH JOIN ANTI NA
SELECT /*+USE_HASH(t1,t2)*/ * FROM t1 WHERE c1 NOT IN (SELECT c1 FROM t2) ORDER BY 1,2;
c0	c1
SELECT /*+USE_HASH(t1,t2)*/ * FROM t1 JOIN t2 ON t1.c0=t2.c0 AND t1.c1 <>ALL (SELECT c1 FROM t2) ORDER BY 1,2;
c0	c1	c0	c1
SELECT /*+USE_HASH(t1,t2)*/ * FROM t1 RIGHT JOIN t2 ON t1.c0=t2.c0 WHERE t1.c1 NOT IN (SELECT c1 FROM t2) ORDER BY 1,2;
c0	c1	c0	c1
SELECT /*+USE_NLJ(t1,t2)*/ * FROM t1 RIGHT JOIN t2 ON t1.c0=t2.c0 WHERE t1.c1 NOT IN (SELECT c1 FROM t2) ORDER BY 1,2;
c0	c1	c0	c1
SELECT /*+USE_MJ(t1,t2)*/ * FROM t1 JOIN t2 ON t1.c0=t2.c0 AND t1.c1 <>ALL (SELECT c1 FROM t2) ORDER BY 1,2;
c0	c1	c0	c1
SELECT /*+USE_HASH(t1,t2)*/ * FROM t1 WHERE NOT EXISTS (SELECT c1 FROM t2) ORDER BY 1,2;
c0	c1
SELECT /*+USE_HASH(t1,t2)*/ * FROM t1 WHERE c1 NOT IN (SELECT c1 FROM t2) ORDER BY 1,2;
c0	c1
SELECT /*+USE_NL(t1,t2)*/ * FROM t1 JOIN t2 ON t1.c0=t2.c0 AND t1.c1 <>ALL (SELECT c1 FROM t2) ORDER BY 1,2;
c0	c1	c0	c1
SELECT /*+USE_MJ(t1,t2)*/ * FROM t1 JOIN t2 ON t1.c0=t2.c0 AND t1.c1 <>ALL (SELECT c1 FROM t2) ORDER BY 1,2;
c0	c1	c0	c1
#IF "_optimizer_null_aware_antijoin"=ON,EXPLAIN:HASH JOIN ANTI SNA
SELECT /*+USE_HASH(t1,t2)*/ * FROM t1 WHERE c1 NOT IN (SELECT c1 FROM t2 WHERE t2.c1 IS NOT NULL) ORDER BY 1,2;
c0	c1
SELECT /*+USE_HASH(t1,t2)*/ * FROM t1 JOIN t2 ON t1.c0=t2.c0 AND t1.c1 <>ALL (SELECT c1 FROM t2 WHERE t2.c1 IS NOT NULL) ORDER BY 1,2;
c0	c1	c0	c1
SELECT /*+USE_HASH(t1,t2)*/ * FROM t1 RIGHT JOIN t2 ON t1.c0=t2.c0 WHERE t1.c1 NOT IN (SELECT c1 FROM t2 WHERE t2.c1 IS NOT NULL) ORDER BY 1,2;
c0	c1	c0	c1
SELECT /*+USE_NLJ(t1,t2)*/ * FROM t1 RIGHT JOIN t2 ON t1.c0=t2.c0 WHERE t1.c1 NOT IN (SELECT c1 FROM t2 WHERE t2.c1 IS NOT NULL) ORDER BY 1,2;
c0	c1	c0	c1
SELECT /*+USE_MJ(t1,t2)*/ * FROM t1 JOIN t2 ON t1.c0=t2.c0 AND t1.c1 <>ALL (SELECT c1 FROM t2 WHERE t2.c1 IS NOT NULL) ORDER BY 1,2;
c0	c1	c0	c1
SELECT /*+USE_HASH(t1,t2)*/ * FROM t1 WHERE NOT EXISTS (SELECT c1 FROM t2 WHERE t2.c1 IS NOT NULL) ORDER BY 1,2;
c0	c1
SELECT /*+USE_HASH(t1,t2)*/ * FROM t1 WHERE c1 NOT IN (SELECT c1 FROM t2 WHERE t2.c1 IS NOT NULL) ORDER BY 1,2;
c0	c1
SELECT /*+USE_NL(t1,t2)*/ * FROM t1 JOIN t2 ON t1.c0=t2.c0 AND t1.c1 <>ALL (SELECT c1 FROM t2 WHERE t2.c1 IS NOT NULL) ORDER BY 1,2;
c0	c1	c0	c1
SELECT /*+USE_MJ(t1,t2)*/ * FROM t1 JOIN t2 ON t1.c0=t2.c0 AND t1.c1 <>ALL (SELECT c1 FROM t2 WHERE t2.c1 IS NOT NULL) ORDER BY 1,2;
c0	c1	c0	c1
#PARALLEL
#IF "_optimizer_null_aware_antijoin"=ON,EXPLAIN:HASH JOIN ANTI NA
SELECT /*+parallel(2) USE_HASH(t1,t2)*/ * FROM t1 WHERE c1 NOT IN (SELECT c1 FROM t2) ORDER BY 1,2;
c0	c1
SELECT /*+parallel(2) USE_HASH(t1,t2)*/ * FROM t1 WHERE c1 <>ALL (SELECT c1 FROM t2) ORDER BY 1,2;
c0	c1
SELECT /*+parallel(2) USE_NL(t1,t2)*/ * FROM t1 WHERE c1 <>ALL (SELECT c1 FROM t2) ORDER BY 1,2;
c0	c1
SELECT /*+parallel(2) USE_HASH(t1,t2)*/ * FROM t1 WHERE NOT EXISTS (SELECT c1 FROM t2) ORDER BY 1,2;
c0	c1
SELECT /*+parallel(5) USE_HASH(t1,t2)*/ * FROM t1 WHERE c1 NOT IN (SELECT c1 FROM t2) ORDER BY 1,2;
c0	c1
SELECT /*+parallel(5) USE_NLJ(t1,t2)*/ * FROM t1 WHERE c1 NOT IN (SELECT c1 FROM t2) ORDER BY 1,2;
c0	c1
SELECT /*+parallel(5) USE_HASH(t1,t2)*/ * FROM t1 WHERE c1 <>ALL (SELECT c1 FROM t2) ORDER BY 1,2;
c0	c1
SELECT /*+parallel(5) USE_MJ(t1,t2)*/ * FROM t1 WHERE c1 NOT IN (SELECT c1 FROM t2) ORDER BY 1,2;
c0	c1
SELECT /*+parallel(5) USE_HASH(t1,t2)*/ * FROM t1 WHERE NOT EXISTS (SELECT c1 FROM t2) ORDER BY 1,2;
c0	c1
SELECT /*+parallel(2) USE_HASH(t1,t2)*/ * FROM t1,t2 WHERE t1.c0=t2.c0 AND t1.c1 NOT IN (SELECT c1 FROM t2) ORDER BY 1,2;
c0	c1	c0	c1
SELECT /*+parallel(2) USE_HASH(t1,t2)*/ * FROM t1,t2 WHERE t1.c0=t2.c0 AND t1.c1 <>ALL (SELECT c1 FROM t2) ORDER BY 1,2;
c0	c1	c0	c1
SELECT /*+parallel(2) USE_MJ(t1,t2)*/ * FROM t1,t2 WHERE t1.c0=t2.c0 AND t1.c1 <>ALL (SELECT c1 FROM t2) ORDER BY 1,2;
c0	c1	c0	c1
SELECT /*+parallel(2) USE_NL(t1,t2)*/ * FROM t1,t2 WHERE t1.c0=t2.c0 AND t1.c1 NOT IN (SELECT c1 FROM t2) ORDER BY 1,2;
c0	c1	c0	c1
SELECT /*+parallel(2) USE_HASH(t1,t2)*/ * FROM t1,t2 WHERE t1.c0=t2.c0 AND NOT EXISTS (SELECT c1 FROM t2) ORDER BY 1,2;
c0	c1	c0	c1
#IF "_optimizer_null_aware_antijoin"=ON,EXPLAIN:HASH JOIN ANTI SNA
SELECT /*+parallel(2) USE_HASH(t1,t2)*/ * FROM t1 WHERE c1 NOT IN (SELECT c1 FROM t2 WHERE t2.c1 IS NOT NULL) ORDER BY 1,2;
c0	c1
SELECT /*+parallel(2) USE_HASH(t1,t2)*/ * FROM t1 WHERE c1 <>ALL (SELECT c1 FROM t2 WHERE t2.c1 IS NOT NULL) ORDER BY 1,2;
c0	c1
SELECT /*+parallel(2) USE_NL(t1,t2)*/ * FROM t1 WHERE c1 <>ALL (SELECT c1 FROM t2 WHERE t2.c1 IS NOT NULL) ORDER BY 1,2;
c0	c1
SELECT /*+parallel(2) USE_HASH(t1,t2)*/ * FROM t1 WHERE NOT EXISTS (SELECT c1 FROM t2 WHERE t2.c1 IS NOT NULL) ORDER BY 1,2;
c0	c1
SELECT /*+parallel(5) USE_HASH(t1,t2)*/ * FROM t1 WHERE c1 NOT IN (SELECT c1 FROM t2 WHERE t2.c1 IS NOT NULL) ORDER BY 1,2;
c0	c1
SELECT /*+parallel(5) USE_NLJ(t1,t2)*/ * FROM t1 WHERE c1 NOT IN (SELECT c1 FROM t2 WHERE t2.c1 IS NOT NULL) ORDER BY 1,2;
c0	c1
SELECT /*+parallel(5) USE_HASH(t1,t2)*/ * FROM t1 WHERE c1 <>ALL (SELECT c1 FROM t2 WHERE t2.c1 IS NOT NULL) ORDER BY 1,2;
c0	c1
SELECT /*+parallel(5) USE_MJ(t1,t2)*/ * FROM t1 WHERE c1 NOT IN (SELECT c1 FROM t2 WHERE t2.c1 IS NOT NULL) ORDER BY 1,2;
c0	c1
SELECT /*+parallel(5) USE_HASH(t1,t2)*/ * FROM t1 WHERE NOT EXISTS (SELECT c1 FROM t2 WHERE t2.c1 IS NOT NULL) ORDER BY 1,2;
c0	c1
SELECT /*+parallel(2) USE_HASH(t1,t2)*/ * FROM t1,t2 WHERE t1.c0=t2.c0 AND t1.c1 NOT IN (SELECT c1 FROM t2 WHERE t2.c1 IS NOT NULL) ORDER BY 1,2;
c0	c1	c0	c1
SELECT /*+parallel(2) USE_HASH(t1,t2)*/ * FROM t1,t2 WHERE t1.c0=t2.c0 AND t1.c1 <>ALL (SELECT c1 FROM t2 WHERE t2.c1 IS NOT NULL) ORDER BY 1,2;
c0	c1	c0	c1
SELECT /*+parallel(2) USE_MJ(t1,t2)*/ * FROM t1,t2 WHERE t1.c0=t2.c0 AND t1.c1 <>ALL (SELECT c1 FROM t2 WHERE t2.c1 IS NOT NULL) ORDER BY 1,2;
c0	c1	c0	c1
SELECT /*+parallel(2) USE_NL(t1,t2)*/ * FROM t1,t2 WHERE t1.c0=t2.c0 AND t1.c1 NOT IN (SELECT c1 FROM t2 WHERE t2.c1 IS NOT NULL) ORDER BY 1,2;
c0	c1	c0	c1
SELECT /*+parallel(2) USE_HASH(t1,t2)*/ * FROM t1,t2 WHERE t1.c0=t2.c0 AND NOT EXISTS (SELECT c1 FROM t2 WHERE t2.c1 IS NOT NULL) ORDER BY 1,2;
c0	c1	c0	c1
#VARCHAR TYPE
DROP TABLE t1;
DROP TABLE t2;
CREATE TABLE t1(c0 INT,c1 VARCHAR(10));
CREATE TABLE t2(c0 INT,c1 VARCHAR(10));
INSERT INTO t1 VALUES(1,'A');
INSERT INTO t1 VALUES(2,'A');
INSERT INTO t1 VALUES(3,12);
INSERT INTO t1 VALUES(4,NULL);
INSERT INTO t1 VALUES(5,'%-$');
INSERT INTO t1 VALUES(6,'AB');
INSERT INTO t1 VALUES(7,'');
INSERT INTO t2 VALUES(1,'AB');
INSERT INTO t2 VALUES(2,12);
INSERT INTO t2 VALUES(3,'AB');
INSERT INTO t2 VALUES(4,12);
INSERT INTO t2 VALUES(5,'');
INSERT INTO t2 VALUES(6,NULL);
INSERT INTO t2 VALUES(7,'%--$');
SELECT * FROM t1 ORDER BY c0,c1;
c0	c1
1	A
2	A
3	12
4	NULL
5	%-$
6	AB
7	
SELECT * FROM t2 ORDER BY c0,c1;
c0	c1
1	AB
2	12
3	AB
4	12
5	
6	NULL
7	%--$
#There are null values on the right side of the left table
#IF "_optimizer_null_aware_antijoin"=ON,EXPLAIN:HASH JOIN ANTI NA
SELECT * FROM t1 WHERE c1 NOT IN (SELECT c1 FROM t2) ORDER BY 1,2;
c0	c1
SELECT * FROM t1 WHERE NOT EXISTS (SELECT c1 FROM t2) ORDER BY 1,2;
c0	c1
#IF "_optimizer_null_aware_antijoin"=TRUE,EXPLAIN:HASH JOIN ANTI SNA
SELECT * FROM t1 WHERE c1 NOT IN (SELECT c1 FROM t2 WHERE t2.c1 IS NOT NULL) ORDER BY 1,2;
c0	c1
1	A
2	A
5	%-$
SELECT * FROM t1 WHERE NOT EXISTS (SELECT c1 FROM t2 WHERE t2.c1 IS NOT NULL) ORDER BY 1,2;
c0	c1
#INNER JOIN
#IF "_optimizer_null_aware_antijoin"=ON,EXPLAIN:HASH JOIN ANTI NA
SELECT * FROM t1 JOIN t2 ON t1.c0=t2.c0 AND t1.c1 NOT IN (SELECT c1 FROM t2) ORDER BY 1,2;
c0	c1	c0	c1
SELECT * FROM t1 JOIN t2 ON t1.c0=t2.c0 AND NOT EXISTS (SELECT c1 FROM t2) ORDER BY 1,2;
c0	c1	c0	c1
#IF "_optimizer_null_aware_antijoin"=TRUE,EXPLAIN:HASH JOIN ANTI SNA
SELECT * FROM t1 JOIN t2 ON t1.c0=t2.c0 AND t1.c1 NOT IN (SELECT c1 FROM t2 WHERE t2.c1 IS NOT NULL) ORDER BY 1,2;
c0	c1	c0	c1
1	A	1	AB
2	A	2	12
5	%-$	5	
SELECT * FROM t1 JOIN t2 ON t1.c0=t2.c0 AND NOT EXISTS (SELECT c1 FROM t2 WHERE t2.c1 IS NOT NULL) ORDER BY 1,2;
c0	c1	c0	c1
#RIGHT JOIN
#IF "_optimizer_null_aware_antijoin"=ON,EXPLAIN:HASH JOIN ANTI NA
SELECT * FROM t1 RIGHT JOIN t2 ON t1.c0=t2.c0 AND t1.c1 NOT IN (SELECT c1 FROM t2) ORDER BY 1,2,3;
c0	c1	c0	c1
NULL	NULL	1	AB
NULL	NULL	2	12
NULL	NULL	3	AB
NULL	NULL	4	12
NULL	NULL	5	
NULL	NULL	6	NULL
NULL	NULL	7	%--$
SELECT * FROM t1 RIGHT JOIN t2 ON t1.c0=t2.c0 AND t1.c1 <>ALL (SELECT c1 FROM t2) ORDER BY 1,2,3;
c0	c1	c0	c1
NULL	NULL	1	AB
NULL	NULL	2	12
NULL	NULL	3	AB
NULL	NULL	4	12
NULL	NULL	5	
NULL	NULL	6	NULL
NULL	NULL	7	%--$
SELECT * FROM t1 RIGHT JOIN t2 ON t1.c0=t2.c0 AND NOT EXISTS (SELECT c1 FROM t2) ORDER BY 1,2,3;
c0	c1	c0	c1
NULL	NULL	1	AB
NULL	NULL	2	12
NULL	NULL	3	AB
NULL	NULL	4	12
NULL	NULL	5	
NULL	NULL	6	NULL
NULL	NULL	7	%--$
#IF "_optimizer_null_aware_antijoin"=ON,EXPLAIN:HASH JOIN ANTI SNA
SELECT * FROM t1 RIGHT JOIN t2 ON t1.c0=t2.c0 AND t1.c1 NOT IN (SELECT c1 FROM t2 WHERE t2.c1 IS NOT NULL) ORDER BY 1,2,3;
c0	c1	c0	c1
NULL	NULL	3	AB
NULL	NULL	4	12
NULL	NULL	6	NULL
NULL	NULL	7	%--$
1	A	1	AB
2	A	2	12
5	%-$	5	
SELECT * FROM t1 RIGHT JOIN t2 ON t1.c0=t2.c0 AND t1.c1 <>ALL (SELECT c1 FROM t2 WHERE t2.c1 IS NOT NULL) ORDER BY 1,2,3;
c0	c1	c0	c1
NULL	NULL	3	AB
NULL	NULL	4	12
NULL	NULL	6	NULL
NULL	NULL	7	%--$
1	A	1	AB
2	A	2	12
5	%-$	5	
SELECT * FROM t1 RIGHT JOIN t2 ON t1.c0=t2.c0 AND NOT EXISTS (SELECT c1 FROM t2 WHERE t2.c1 IS NOT NULL) ORDER BY 1,2,3;
c0	c1	c0	c1
NULL	NULL	1	AB
NULL	NULL	2	12
NULL	NULL	3	AB
NULL	NULL	4	12
NULL	NULL	5	
NULL	NULL	6	NULL
NULL	NULL	7	%--$
#LEFT JOIN
#IF "_optimizer_null_aware_antijoin"=ON,EXPLAIN:HASH JOIN ANTI NA
SELECT * FROM t1 LEFT JOIN t2 ON t1.c0=t2.c0 WHERE t1.c1 NOT IN (SELECT c1 FROM t2) ORDER BY 1,2;
c0	c1	c0	c1
SELECT * FROM t1 LEFT JOIN t2 ON t1.c0=t2.c0 WHERE t1.c1 <>ALL (SELECT c1 FROM t2) ORDER BY 1,2;
c0	c1	c0	c1
SELECT * FROM t1 LEFT JOIN t2 ON t1.c0=t2.c0 WHERE NOT EXISTS (SELECT c1 FROM t2) ORDER BY 1,2;
c0	c1	c0	c1
#IF "_optimizer_null_aware_antijoin"=ON,EXPLAIN:HASH JOIN ANTI SNA
SELECT * FROM t1 LEFT JOIN t2 ON t1.c0=t2.c0 WHERE t1.c1 NOT IN (SELECT c1 FROM t2 WHERE t2.c1 IS NOT NULL) ORDER BY 1,2,3;
c0	c1	c0	c1
1	A	1	AB
2	A	2	12
5	%-$	5	
SELECT * FROM t1 LEFT JOIN t2 ON t1.c0=t2.c0 WHERE t1.c1 <>ALL (SELECT c1 FROM t2 WHERE t2.c1 IS NOT NULL) ORDER BY 1,2,3;
c0	c1	c0	c1
1	A	1	AB
2	A	2	12
5	%-$	5	
SELECT * FROM t1 LEFT JOIN t2 ON t1.c0=t2.c0 WHERE NOT EXISTS (SELECT c1 FROM t2 WHERE t2.c1 IS NOT NULL) ORDER BY 1,2,3;
c0	c1	c0	c1
#FULL JOIN
#IF "_optimizer_null_aware_antijoin"=ON,EXPLAIN:HASH JOIN ANTI NA
SELECT * FROM t1 FULL JOIN t2 ON t1.c0=t2.c0 WHERE t1.c1 NOT IN (SELECT c1 FROM t2) ORDER BY 1,2;
c0	c1	c0	c1
SELECT * FROM t1 FULL JOIN t2 ON t1.c0=t2.c0 WHERE t1.c1 <>ALL (SELECT c1 FROM t2) ORDER BY 1,2;
c0	c1	c0	c1
SELECT * FROM t1 FULL JOIN t2 ON t1.c0=t2.c0 WHERE NOT EXISTS (SELECT c1 FROM t2) ORDER BY 1,2;
c0	c1	c0	c1
#IF "_optimizer_null_aware_antijoin"=ON,EXPLAIN:HASH JOIN ANTI SNA
SELECT * FROM t1 FULL JOIN t2 ON t1.c0=t2.c0 WHERE t1.c1 NOT IN (SELECT c1 FROM t2 WHERE t2.c1 IS NOT NULL) ORDER BY 1,2,3;
c0	c1	c0	c1
1	A	1	AB
2	A	2	12
5	%-$	5	
SELECT * FROM t1 FULL JOIN t2 ON t1.c0=t2.c0 WHERE t1.c1 <>ALL (SELECT c1 FROM t2 WHERE t2.c1 IS NOT NULL) ORDER BY 1,2,3;
c0	c1	c0	c1
1	A	1	AB
2	A	2	12
5	%-$	5	
SELECT * FROM t1 FULL JOIN t2 ON t1.c0=t2.c0 WHERE NOT EXISTS (SELECT c1 FROM t2 WHERE t2.c1 IS NOT NULL) ORDER BY 1,2,3;
c0	c1	c0	c1
#HINT
#IF "_optimizer_null_aware_antijoin"=ON,EXPLAIN:HASH JOIN ANTI NA
SELECT /*+USE_HASH(t1,t2)*/ * FROM t1 WHERE c1 NOT IN (SELECT c1 FROM t2) ORDER BY 1,2;
c0	c1
SELECT /*+USE_HASH(t1,t2)*/ * FROM t1 JOIN t2 ON t1.c0=t2.c0 AND t1.c1 <>ALL (SELECT c1 FROM t2) ORDER BY 1,2;
c0	c1	c0	c1
SELECT /*+USE_HASH(t1,t2)*/ * FROM t1 RIGHT JOIN t2 ON t1.c0=t2.c0 WHERE t1.c1 NOT IN (SELECT c1 FROM t2) ORDER BY 1,2;
c0	c1	c0	c1
SELECT /*+USE_NLJ(t1,t2)*/ * FROM t1 RIGHT JOIN t2 ON t1.c0=t2.c0 WHERE t1.c1 NOT IN (SELECT c1 FROM t2) ORDER BY 1,2;
c0	c1	c0	c1
SELECT /*+USE_MJ(t1,t2)*/ * FROM t1 JOIN t2 ON t1.c0=t2.c0 AND t1.c1 <>ALL (SELECT c1 FROM t2) ORDER BY 1,2;
c0	c1	c0	c1
SELECT /*+USE_HASH(t1,t2)*/ * FROM t1 WHERE NOT EXISTS (SELECT c1 FROM t2) ORDER BY 1,2;
c0	c1
SELECT /*+USE_HASH(t1,t2)*/ * FROM t1 WHERE c1 NOT IN (SELECT c1 FROM t2) ORDER BY 1,2;
c0	c1
SELECT /*+USE_NL(t1,t2)*/ * FROM t1 JOIN t2 ON t1.c0=t2.c0 AND t1.c1 <>ALL (SELECT c1 FROM t2) ORDER BY 1,2;
c0	c1	c0	c1
SELECT /*+USE_MJ(t1,t2)*/ * FROM t1 JOIN t2 ON t1.c0=t2.c0 AND t1.c1 <>ALL (SELECT c1 FROM t2) ORDER BY 1,2;
c0	c1	c0	c1
#IF "_optimizer_null_aware_antijoin"=ON,EXPLAIN:HASH JOIN ANTI SNA
SELECT /*+USE_HASH(t1,t2)*/ * FROM t1 WHERE c1 NOT IN (SELECT c1 FROM t2 WHERE t2.c1 IS NOT NULL) ORDER BY 1,2;
c0	c1
1	A
2	A
5	%-$
SELECT /*+USE_HASH(t1,t2)*/ * FROM t1 JOIN t2 ON t1.c0=t2.c0 AND t1.c1 <>ALL (SELECT c1 FROM t2 WHERE t2.c1 IS NOT NULL) ORDER BY 1,2;
c0	c1	c0	c1
1	A	1	AB
2	A	2	12
5	%-$	5	
SELECT /*+USE_HASH(t1,t2)*/ * FROM t1 RIGHT JOIN t2 ON t1.c0=t2.c0 WHERE t1.c1 NOT IN (SELECT c1 FROM t2 WHERE t2.c1 IS NOT NULL) ORDER BY 1,2;
c0	c1	c0	c1
1	A	1	AB
2	A	2	12
5	%-$	5	
SELECT /*+USE_NLJ(t1,t2)*/ * FROM t1 RIGHT JOIN t2 ON t1.c0=t2.c0 WHERE t1.c1 NOT IN (SELECT c1 FROM t2 WHERE t2.c1 IS NOT NULL) ORDER BY 1,2;
c0	c1	c0	c1
1	A	1	AB
2	A	2	12
5	%-$	5	
SELECT /*+USE_MJ(t1,t2)*/ * FROM t1 JOIN t2 ON t1.c0=t2.c0 AND t1.c1 <>ALL (SELECT c1 FROM t2 WHERE t2.c1 IS NOT NULL) ORDER BY 1,2;
c0	c1	c0	c1
1	A	1	AB
2	A	2	12
5	%-$	5	
SELECT /*+USE_HASH(t1,t2)*/ * FROM t1 WHERE NOT EXISTS (SELECT c1 FROM t2 WHERE t2.c1 IS NOT NULL) ORDER BY 1,2;
c0	c1
SELECT /*+USE_HASH(t1,t2)*/ * FROM t1 WHERE c1 NOT IN (SELECT c1 FROM t2 WHERE t2.c1 IS NOT NULL) ORDER BY 1,2;
c0	c1
1	A
2	A
5	%-$
SELECT /*+USE_NL(t1,t2)*/ * FROM t1 JOIN t2 ON t1.c0=t2.c0 AND t1.c1 <>ALL (SELECT c1 FROM t2 WHERE t2.c1 IS NOT NULL) ORDER BY 1,2;
c0	c1	c0	c1
1	A	1	AB
2	A	2	12
5	%-$	5	
SELECT /*+USE_MJ(t1,t2)*/ * FROM t1 JOIN t2 ON t1.c0=t2.c0 AND t1.c1 <>ALL (SELECT c1 FROM t2 WHERE t2.c1 IS NOT NULL) ORDER BY 1,2;
c0	c1	c0	c1
1	A	1	AB
2	A	2	12
5	%-$	5	
#PARALLEL
#IF "_optimizer_null_aware_antijoin"=ON,EXPLAIN:HASH JOIN ANTI NA
SELECT /*+parallel(2) USE_HASH(t1,t2)*/ * FROM t1 WHERE c1 NOT IN (SELECT c1 FROM t2) ORDER BY 1,2;
c0	c1
SELECT /*+parallel(2) USE_HASH(t1,t2)*/ * FROM t1 WHERE c1 <>ALL (SELECT c1 FROM t2) ORDER BY 1,2;
c0	c1
SELECT /*+parallel(2) USE_NL(t1,t2)*/ * FROM t1 WHERE c1 <>ALL (SELECT c1 FROM t2) ORDER BY 1,2;
c0	c1
SELECT /*+parallel(2) USE_HASH(t1,t2)*/ * FROM t1 WHERE NOT EXISTS (SELECT c1 FROM t2) ORDER BY 1,2;
c0	c1
SELECT /*+parallel(5) USE_HASH(t1,t2)*/ * FROM t1 WHERE c1 NOT IN (SELECT c1 FROM t2) ORDER BY 1,2;
c0	c1
SELECT /*+parallel(5) USE_NLJ(t1,t2)*/ * FROM t1 WHERE c1 NOT IN (SELECT c1 FROM t2) ORDER BY 1,2;
c0	c1
SELECT /*+parallel(5) USE_HASH(t1,t2)*/ * FROM t1 WHERE c1 <>ALL (SELECT c1 FROM t2) ORDER BY 1,2;
c0	c1
SELECT /*+parallel(5) USE_MJ(t1,t2)*/ * FROM t1 WHERE c1 NOT IN (SELECT c1 FROM t2) ORDER BY 1,2;
c0	c1
SELECT /*+parallel(5) USE_HASH(t1,t2)*/ * FROM t1 WHERE NOT EXISTS (SELECT c1 FROM t2) ORDER BY 1,2;
c0	c1
SELECT /*+parallel(2) USE_HASH(t1,t2)*/ * FROM t1,t2 WHERE t1.c0=t2.c0 AND t1.c1 NOT IN (SELECT c1 FROM t2) ORDER BY 1,2;
c0	c1	c0	c1
SELECT /*+parallel(2) USE_HASH(t1,t2)*/ * FROM t1,t2 WHERE t1.c0=t2.c0 AND t1.c1 <>ALL (SELECT c1 FROM t2) ORDER BY 1,2;
c0	c1	c0	c1
SELECT /*+parallel(2) USE_MJ(t1,t2)*/ * FROM t1,t2 WHERE t1.c0=t2.c0 AND t1.c1 <>ALL (SELECT c1 FROM t2) ORDER BY 1,2;
c0	c1	c0	c1
SELECT /*+parallel(2) USE_NL(t1,t2)*/ * FROM t1,t2 WHERE t1.c0=t2.c0 AND t1.c1 NOT IN (SELECT c1 FROM t2) ORDER BY 1,2;
c0	c1	c0	c1
SELECT /*+parallel(2) USE_HASH(t1,t2)*/ * FROM t1,t2 WHERE t1.c0=t2.c0 AND NOT EXISTS (SELECT c1 FROM t2) ORDER BY 1,2;
c0	c1	c0	c1
#IF "_optimizer_null_aware_antijoin"=ON,EXPLAIN:HASH JOIN ANTI SNA
SELECT /*+parallel(2) USE_HASH(t1,t2)*/ * FROM t1 WHERE c1 NOT IN (SELECT c1 FROM t2 WHERE t2.c1 IS NOT NULL) ORDER BY 1,2;
c0	c1
1	A
2	A
5	%-$
SELECT /*+parallel(2) USE_HASH(t1,t2)*/ * FROM t1 WHERE c1 <>ALL (SELECT c1 FROM t2 WHERE t2.c1 IS NOT NULL) ORDER BY 1,2;
c0	c1
1	A
2	A
5	%-$
SELECT /*+parallel(2) USE_NL(t1,t2)*/ * FROM t1 WHERE c1 <>ALL (SELECT c1 FROM t2 WHERE t2.c1 IS NOT NULL) ORDER BY 1,2;
c0	c1
1	A
2	A
5	%-$
SELECT /*+parallel(2) USE_HASH(t1,t2)*/ * FROM t1 WHERE NOT EXISTS (SELECT c1 FROM t2 WHERE t2.c1 IS NOT NULL) ORDER BY 1,2;
c0	c1
SELECT /*+parallel(5) USE_HASH(t1,t2)*/ * FROM t1 WHERE c1 NOT IN (SELECT c1 FROM t2 WHERE t2.c1 IS NOT NULL) ORDER BY 1,2;
c0	c1
1	A
2	A
5	%-$
SELECT /*+parallel(5) USE_NLJ(t1,t2)*/ * FROM t1 WHERE c1 NOT IN (SELECT c1 FROM t2 WHERE t2.c1 IS NOT NULL) ORDER BY 1,2;
c0	c1
1	A
2	A
5	%-$
SELECT /*+parallel(5) USE_HASH(t1,t2)*/ * FROM t1 WHERE c1 <>ALL (SELECT c1 FROM t2 WHERE t2.c1 IS NOT NULL) ORDER BY 1,2;
c0	c1
1	A
2	A
5	%-$
SELECT /*+parallel(5) USE_MJ(t1,t2)*/ * FROM t1 WHERE c1 NOT IN (SELECT c1 FROM t2 WHERE t2.c1 IS NOT NULL) ORDER BY 1,2;
c0	c1
1	A
2	A
5	%-$
SELECT /*+parallel(5) USE_HASH(t1,t2)*/ * FROM t1 WHERE NOT EXISTS (SELECT c1 FROM t2 WHERE t2.c1 IS NOT NULL) ORDER BY 1,2;
c0	c1
SELECT /*+parallel(2) USE_HASH(t1,t2)*/ * FROM t1,t2 WHERE t1.c0=t2.c0 AND t1.c1 NOT IN (SELECT c1 FROM t2 WHERE t2.c1 IS NOT NULL) ORDER BY 1,2;
c0	c1	c0	c1
1	A	1	AB
2	A	2	12
5	%-$	5	
SELECT /*+parallel(2) USE_HASH(t1,t2)*/ * FROM t1,t2 WHERE t1.c0=t2.c0 AND t1.c1 <>ALL (SELECT c1 FROM t2 WHERE t2.c1 IS NOT NULL) ORDER BY 1,2;
c0	c1	c0	c1
1	A	1	AB
2	A	2	12
5	%-$	5	
SELECT /*+parallel(2) USE_MJ(t1,t2)*/ * FROM t1,t2 WHERE t1.c0=t2.c0 AND t1.c1 <>ALL (SELECT c1 FROM t2 WHERE t2.c1 IS NOT NULL) ORDER BY 1,2;
c0	c1	c0	c1
1	A	1	AB
2	A	2	12
5	%-$	5	
SELECT /*+parallel(2) USE_NL(t1,t2)*/ * FROM t1,t2 WHERE t1.c0=t2.c0 AND t1.c1 NOT IN (SELECT c1 FROM t2 WHERE t2.c1 IS NOT NULL) ORDER BY 1,2;
c0	c1	c0	c1
1	A	1	AB
2	A	2	12
5	%-$	5	
SELECT /*+parallel(2) USE_HASH(t1,t2)*/ * FROM t1,t2 WHERE t1.c0=t2.c0 AND NOT EXISTS (SELECT c1 FROM t2 WHERE t2.c1 IS NOT NULL) ORDER BY 1,2;
c0	c1	c0	c1
#There are null values on the right table
DELETE FROM t1 WHERE c0 IN(4,7);
SELECT * FROM t1 ORDER BY c0,c1;
c0	c1
1	A
2	A
3	12
5	%-$
6	AB
#IF "_optimizer_null_aware_antijoin"=ON,EXPLAIN:HASH JOIN ANTI NA
SELECT * FROM t1 WHERE c1 NOT IN (SELECT c1 FROM t2) ORDER BY 1,2;
c0	c1
SELECT * FROM t1 WHERE NOT EXISTS (SELECT c1 FROM t2) ORDER BY 1,2;
c0	c1
#IF "_optimizer_null_aware_antijoin"=TRUE,EXPLAIN:HASH JOIN ANTI SNA
SELECT * FROM t1 WHERE c1 NOT IN (SELECT c1 FROM t2 WHERE t2.c1 IS NOT NULL) ORDER BY 1,2;
c0	c1
1	A
2	A
5	%-$
SELECT * FROM t1 WHERE NOT EXISTS (SELECT c1 FROM t2 WHERE t2.c1 IS NOT NULL) ORDER BY 1,2;
c0	c1
#INNER JOIN
#IF "_optimizer_null_aware_antijoin"=ON,EXPLAIN:HASH JOIN ANTI NA
SELECT * FROM t1 JOIN t2 ON t1.c0=t2.c0 AND t1.c1 NOT IN (SELECT c1 FROM t2) ORDER BY 1,2;
c0	c1	c0	c1
SELECT * FROM t1 JOIN t2 ON t1.c0=t2.c0 AND NOT EXISTS (SELECT c1 FROM t2) ORDER BY 1,2;
c0	c1	c0	c1
#IF "_optimizer_null_aware_antijoin"=TRUE,EXPLAIN:HASH JOIN ANTI SNA
SELECT * FROM t1 JOIN t2 ON t1.c0=t2.c0 AND t1.c1 NOT IN (SELECT c1 FROM t2 WHERE t2.c1 IS NOT NULL) ORDER BY 1,2;
c0	c1	c0	c1
1	A	1	AB
2	A	2	12
5	%-$	5	
SELECT * FROM t1 JOIN t2 ON t1.c0=t2.c0 AND NOT EXISTS (SELECT c1 FROM t2 WHERE t2.c1 IS NOT NULL) ORDER BY 1,2;
c0	c1	c0	c1
#RIGHT JOIN
#IF "_optimizer_null_aware_antijoin"=ON,EXPLAIN:HASH JOIN ANTI NA
SELECT * FROM t1 RIGHT JOIN t2 ON t1.c0=t2.c0 AND t1.c1 NOT IN (SELECT c1 FROM t2) ORDER BY 1,2,3;
c0	c1	c0	c1
NULL	NULL	1	AB
NULL	NULL	2	12
NULL	NULL	3	AB
NULL	NULL	4	12
NULL	NULL	5	
NULL	NULL	6	NULL
NULL	NULL	7	%--$
SELECT * FROM t1 RIGHT JOIN t2 ON t1.c0=t2.c0 AND t1.c1 <>ALL (SELECT c1 FROM t2) ORDER BY 1,2,3;
c0	c1	c0	c1
NULL	NULL	1	AB
NULL	NULL	2	12
NULL	NULL	3	AB
NULL	NULL	4	12
NULL	NULL	5	
NULL	NULL	6	NULL
NULL	NULL	7	%--$
SELECT * FROM t1 RIGHT JOIN t2 ON t1.c0=t2.c0 AND NOT EXISTS (SELECT c1 FROM t2) ORDER BY 1,2,3;
c0	c1	c0	c1
NULL	NULL	1	AB
NULL	NULL	2	12
NULL	NULL	3	AB
NULL	NULL	4	12
NULL	NULL	5	
NULL	NULL	6	NULL
NULL	NULL	7	%--$
#IF "_optimizer_null_aware_antijoin"=ON,EXPLAIN:HASH JOIN ANTI SNA
SELECT * FROM t1 RIGHT JOIN t2 ON t1.c0=t2.c0 AND t1.c1 NOT IN (SELECT c1 FROM t2 WHERE t2.c1 IS NOT NULL) ORDER BY 1,2,3;
c0	c1	c0	c1
NULL	NULL	3	AB
NULL	NULL	4	12
NULL	NULL	6	NULL
NULL	NULL	7	%--$
1	A	1	AB
2	A	2	12
5	%-$	5	
SELECT * FROM t1 RIGHT JOIN t2 ON t1.c0=t2.c0 AND t1.c1 <>ALL (SELECT c1 FROM t2 WHERE t2.c1 IS NOT NULL) ORDER BY 1,2,3;
c0	c1	c0	c1
NULL	NULL	3	AB
NULL	NULL	4	12
NULL	NULL	6	NULL
NULL	NULL	7	%--$
1	A	1	AB
2	A	2	12
5	%-$	5	
SELECT * FROM t1 RIGHT JOIN t2 ON t1.c0=t2.c0 AND NOT EXISTS (SELECT c1 FROM t2 WHERE t2.c1 IS NOT NULL) ORDER BY 1,2,3;
c0	c1	c0	c1
NULL	NULL	1	AB
NULL	NULL	2	12
NULL	NULL	3	AB
NULL	NULL	4	12
NULL	NULL	5	
NULL	NULL	6	NULL
NULL	NULL	7	%--$
#LEFT JOIN
#IF "_optimizer_null_aware_antijoin"=ON,EXPLAIN:HASH JOIN ANTI NA
SELECT * FROM t1 LEFT JOIN t2 ON t1.c0=t2.c0 WHERE t1.c1 NOT IN (SELECT c1 FROM t2) ORDER BY 1,2;
c0	c1	c0	c1
SELECT * FROM t1 LEFT JOIN t2 ON t1.c0=t2.c0 WHERE t1.c1 <>ALL (SELECT c1 FROM t2) ORDER BY 1,2;
c0	c1	c0	c1
SELECT * FROM t1 LEFT JOIN t2 ON t1.c0=t2.c0 WHERE NOT EXISTS (SELECT c1 FROM t2) ORDER BY 1,2;
c0	c1	c0	c1
#IF "_optimizer_null_aware_antijoin"=ON,EXPLAIN:HASH JOIN ANTI SNA
SELECT * FROM t1 LEFT JOIN t2 ON t1.c0=t2.c0 WHERE t1.c1 NOT IN (SELECT c1 FROM t2 WHERE t2.c1 IS NOT NULL) ORDER BY 1,2,3;
c0	c1	c0	c1
1	A	1	AB
2	A	2	12
5	%-$	5	
SELECT * FROM t1 LEFT JOIN t2 ON t1.c0=t2.c0 WHERE t1.c1 <>ALL (SELECT c1 FROM t2 WHERE t2.c1 IS NOT NULL) ORDER BY 1,2,3;
c0	c1	c0	c1
1	A	1	AB
2	A	2	12
5	%-$	5	
SELECT * FROM t1 LEFT JOIN t2 ON t1.c0=t2.c0 WHERE NOT EXISTS (SELECT c1 FROM t2 WHERE t2.c1 IS NOT NULL) ORDER BY 1,2,3;
c0	c1	c0	c1
#FULL JOIN
#IF "_optimizer_null_aware_antijoin"=ON,EXPLAIN:HASH JOIN ANTI NA
SELECT * FROM t1 FULL JOIN t2 ON t1.c0=t2.c0 WHERE t1.c1 NOT IN (SELECT c1 FROM t2) ORDER BY 1,2;
c0	c1	c0	c1
SELECT * FROM t1 FULL JOIN t2 ON t1.c0=t2.c0 WHERE t1.c1 <>ALL (SELECT c1 FROM t2) ORDER BY 1,2;
c0	c1	c0	c1
SELECT * FROM t1 FULL JOIN t2 ON t1.c0=t2.c0 WHERE NOT EXISTS (SELECT c1 FROM t2) ORDER BY 1,2;
c0	c1	c0	c1
#IF "_optimizer_null_aware_antijoin"=ON,EXPLAIN:HASH JOIN ANTI SNA
SELECT * FROM t1 FULL JOIN t2 ON t1.c0=t2.c0 WHERE t1.c1 NOT IN (SELECT c1 FROM t2 WHERE t2.c1 IS NOT NULL) ORDER BY 1,2,3;
c0	c1	c0	c1
1	A	1	AB
2	A	2	12
5	%-$	5	
SELECT * FROM t1 FULL JOIN t2 ON t1.c0=t2.c0 WHERE t1.c1 <>ALL (SELECT c1 FROM t2 WHERE t2.c1 IS NOT NULL) ORDER BY 1,2,3;
c0	c1	c0	c1
1	A	1	AB
2	A	2	12
5	%-$	5	
SELECT * FROM t1 FULL JOIN t2 ON t1.c0=t2.c0 WHERE NOT EXISTS (SELECT c1 FROM t2 WHERE t2.c1 IS NOT NULL) ORDER BY 1,2,3;
c0	c1	c0	c1
#HINT
#IF "_optimizer_null_aware_antijoin"=ON,EXPLAIN:HASH JOIN ANTI NA
SELECT /*+USE_HASH(t1,t2)*/ * FROM t1 WHERE c1 NOT IN (SELECT c1 FROM t2) ORDER BY 1,2;
c0	c1
SELECT /*+USE_HASH(t1,t2)*/ * FROM t1 JOIN t2 ON t1.c0=t2.c0 AND t1.c1 <>ALL (SELECT c1 FROM t2) ORDER BY 1,2;
c0	c1	c0	c1
SELECT /*+USE_HASH(t1,t2)*/ * FROM t1 RIGHT JOIN t2 ON t1.c0=t2.c0 WHERE t1.c1 NOT IN (SELECT c1 FROM t2) ORDER BY 1,2;
c0	c1	c0	c1
SELECT /*+USE_NLJ(t1,t2)*/ * FROM t1 RIGHT JOIN t2 ON t1.c0=t2.c0 WHERE t1.c1 NOT IN (SELECT c1 FROM t2) ORDER BY 1,2;
c0	c1	c0	c1
SELECT /*+USE_MJ(t1,t2)*/ * FROM t1 JOIN t2 ON t1.c0=t2.c0 AND t1.c1 <>ALL (SELECT c1 FROM t2) ORDER BY 1,2;
c0	c1	c0	c1
SELECT /*+USE_HASH(t1,t2)*/ * FROM t1 WHERE NOT EXISTS (SELECT c1 FROM t2) ORDER BY 1,2;
c0	c1
SELECT /*+USE_HASH(t1,t2)*/ * FROM t1 WHERE c1 NOT IN (SELECT c1 FROM t2) ORDER BY 1,2;
c0	c1
SELECT /*+USE_NL(t1,t2)*/ * FROM t1 JOIN t2 ON t1.c0=t2.c0 AND t1.c1 <>ALL (SELECT c1 FROM t2) ORDER BY 1,2;
c0	c1	c0	c1
SELECT /*+USE_MJ(t1,t2)*/ * FROM t1 JOIN t2 ON t1.c0=t2.c0 AND t1.c1 <>ALL (SELECT c1 FROM t2) ORDER BY 1,2;
c0	c1	c0	c1
#IF "_optimizer_null_aware_antijoin"=ON,EXPLAIN:HASH JOIN ANTI SNA
SELECT /*+USE_HASH(t1,t2)*/ * FROM t1 WHERE c1 NOT IN (SELECT c1 FROM t2 WHERE t2.c1 IS NOT NULL) ORDER BY 1,2;
c0	c1
1	A
2	A
5	%-$
SELECT /*+USE_HASH(t1,t2)*/ * FROM t1 JOIN t2 ON t1.c0=t2.c0 AND t1.c1 <>ALL (SELECT c1 FROM t2 WHERE t2.c1 IS NOT NULL) ORDER BY 1,2;
c0	c1	c0	c1
1	A	1	AB
2	A	2	12
5	%-$	5	
SELECT /*+USE_HASH(t1,t2)*/ * FROM t1 RIGHT JOIN t2 ON t1.c0=t2.c0 WHERE t1.c1 NOT IN (SELECT c1 FROM t2 WHERE t2.c1 IS NOT NULL) ORDER BY 1,2;
c0	c1	c0	c1
1	A	1	AB
2	A	2	12
5	%-$	5	
SELECT /*+USE_NLJ(t1,t2)*/ * FROM t1 RIGHT JOIN t2 ON t1.c0=t2.c0 WHERE t1.c1 NOT IN (SELECT c1 FROM t2 WHERE t2.c1 IS NOT NULL) ORDER BY 1,2;
c0	c1	c0	c1
1	A	1	AB
2	A	2	12
5	%-$	5	
SELECT /*+USE_MJ(t1,t2)*/ * FROM t1 JOIN t2 ON t1.c0=t2.c0 AND t1.c1 <>ALL (SELECT c1 FROM t2 WHERE t2.c1 IS NOT NULL) ORDER BY 1,2;
c0	c1	c0	c1
1	A	1	AB
2	A	2	12
5	%-$	5	
SELECT /*+USE_HASH(t1,t2)*/ * FROM t1 WHERE NOT EXISTS (SELECT c1 FROM t2 WHERE t2.c1 IS NOT NULL) ORDER BY 1,2;
c0	c1
SELECT /*+USE_HASH(t1,t2)*/ * FROM t1 WHERE c1 NOT IN (SELECT c1 FROM t2 WHERE t2.c1 IS NOT NULL) ORDER BY 1,2;
c0	c1
1	A
2	A
5	%-$
SELECT /*+USE_NL(t1,t2)*/ * FROM t1 JOIN t2 ON t1.c0=t2.c0 AND t1.c1 <>ALL (SELECT c1 FROM t2 WHERE t2.c1 IS NOT NULL) ORDER BY 1,2;
c0	c1	c0	c1
1	A	1	AB
2	A	2	12
5	%-$	5	
SELECT /*+USE_MJ(t1,t2)*/ * FROM t1 JOIN t2 ON t1.c0=t2.c0 AND t1.c1 <>ALL (SELECT c1 FROM t2 WHERE t2.c1 IS NOT NULL) ORDER BY 1,2;
c0	c1	c0	c1
1	A	1	AB
2	A	2	12
5	%-$	5	
#PARALLEL
#IF "_optimizer_null_aware_antijoin"=ON,EXPLAIN:HASH JOIN ANTI NA
SELECT /*+parallel(2) USE_HASH(t1,t2)*/ * FROM t1 WHERE c1 NOT IN (SELECT c1 FROM t2) ORDER BY 1,2;
c0	c1
SELECT /*+parallel(2) USE_HASH(t1,t2)*/ * FROM t1 WHERE c1 <>ALL (SELECT c1 FROM t2) ORDER BY 1,2;
c0	c1
SELECT /*+parallel(2) USE_NL(t1,t2)*/ * FROM t1 WHERE c1 <>ALL (SELECT c1 FROM t2) ORDER BY 1,2;
c0	c1
SELECT /*+parallel(2) USE_HASH(t1,t2)*/ * FROM t1 WHERE NOT EXISTS (SELECT c1 FROM t2) ORDER BY 1,2;
c0	c1
SELECT /*+parallel(5) USE_HASH(t1,t2)*/ * FROM t1 WHERE c1 NOT IN (SELECT c1 FROM t2) ORDER BY 1,2;
c0	c1
SELECT /*+parallel(5) USE_NLJ(t1,t2)*/ * FROM t1 WHERE c1 NOT IN (SELECT c1 FROM t2) ORDER BY 1,2;
c0	c1
SELECT /*+parallel(5) USE_HASH(t1,t2)*/ * FROM t1 WHERE c1 <>ALL (SELECT c1 FROM t2) ORDER BY 1,2;
c0	c1
SELECT /*+parallel(5) USE_MJ(t1,t2)*/ * FROM t1 WHERE c1 NOT IN (SELECT c1 FROM t2) ORDER BY 1,2;
c0	c1
SELECT /*+parallel(5) USE_HASH(t1,t2)*/ * FROM t1 WHERE NOT EXISTS (SELECT c1 FROM t2) ORDER BY 1,2;
c0	c1
SELECT /*+parallel(2) USE_HASH(t1,t2)*/ * FROM t1,t2 WHERE t1.c0=t2.c0 AND t1.c1 NOT IN (SELECT c1 FROM t2) ORDER BY 1,2;
c0	c1	c0	c1
SELECT /*+parallel(2) USE_HASH(t1,t2)*/ * FROM t1,t2 WHERE t1.c0=t2.c0 AND t1.c1 <>ALL (SELECT c1 FROM t2) ORDER BY 1,2;
c0	c1	c0	c1
SELECT /*+parallel(2) USE_MJ(t1,t2)*/ * FROM t1,t2 WHERE t1.c0=t2.c0 AND t1.c1 <>ALL (SELECT c1 FROM t2) ORDER BY 1,2;
c0	c1	c0	c1
SELECT /*+parallel(2) USE_NL(t1,t2)*/ * FROM t1,t2 WHERE t1.c0=t2.c0 AND t1.c1 NOT IN (SELECT c1 FROM t2) ORDER BY 1,2;
c0	c1	c0	c1
SELECT /*+parallel(2) USE_HASH(t1,t2)*/ * FROM t1,t2 WHERE t1.c0=t2.c0 AND NOT EXISTS (SELECT c1 FROM t2) ORDER BY 1,2;
c0	c1	c0	c1
#IF "_optimizer_null_aware_antijoin"=ON,EXPLAIN:HASH JOIN ANTI SNA
SELECT /*+parallel(2) USE_HASH(t1,t2)*/ * FROM t1 WHERE c1 NOT IN (SELECT c1 FROM t2 WHERE t2.c1 IS NOT NULL) ORDER BY 1,2;
c0	c1
1	A
2	A
5	%-$
SELECT /*+parallel(2) USE_HASH(t1,t2)*/ * FROM t1 WHERE c1 <>ALL (SELECT c1 FROM t2 WHERE t2.c1 IS NOT NULL) ORDER BY 1,2;
c0	c1
1	A
2	A
5	%-$
SELECT /*+parallel(2) USE_NL(t1,t2)*/ * FROM t1 WHERE c1 <>ALL (SELECT c1 FROM t2 WHERE t2.c1 IS NOT NULL) ORDER BY 1,2;
c0	c1
1	A
2	A
5	%-$
SELECT /*+parallel(2) USE_HASH(t1,t2)*/ * FROM t1 WHERE NOT EXISTS (SELECT c1 FROM t2 WHERE t2.c1 IS NOT NULL) ORDER BY 1,2;
c0	c1
SELECT /*+parallel(5) USE_HASH(t1,t2)*/ * FROM t1 WHERE c1 NOT IN (SELECT c1 FROM t2 WHERE t2.c1 IS NOT NULL) ORDER BY 1,2;
c0	c1
1	A
2	A
5	%-$
SELECT /*+parallel(5) USE_NLJ(t1,t2)*/ * FROM t1 WHERE c1 NOT IN (SELECT c1 FROM t2 WHERE t2.c1 IS NOT NULL) ORDER BY 1,2;
c0	c1
1	A
2	A
5	%-$
SELECT /*+parallel(5) USE_HASH(t1,t2)*/ * FROM t1 WHERE c1 <>ALL (SELECT c1 FROM t2 WHERE t2.c1 IS NOT NULL) ORDER BY 1,2;
c0	c1
1	A
2	A
5	%-$
SELECT /*+parallel(5) USE_MJ(t1,t2)*/ * FROM t1 WHERE c1 NOT IN (SELECT c1 FROM t2 WHERE t2.c1 IS NOT NULL) ORDER BY 1,2;
c0	c1
1	A
2	A
5	%-$
SELECT /*+parallel(5) USE_HASH(t1,t2)*/ * FROM t1 WHERE NOT EXISTS (SELECT c1 FROM t2 WHERE t2.c1 IS NOT NULL) ORDER BY 1,2;
c0	c1
SELECT /*+parallel(2) USE_HASH(t1,t2)*/ * FROM t1,t2 WHERE t1.c0=t2.c0 AND t1.c1 NOT IN (SELECT c1 FROM t2 WHERE t2.c1 IS NOT NULL) ORDER BY 1,2;
c0	c1	c0	c1
1	A	1	AB
2	A	2	12
5	%-$	5	
SELECT /*+parallel(2) USE_HASH(t1,t2)*/ * FROM t1,t2 WHERE t1.c0=t2.c0 AND t1.c1 <>ALL (SELECT c1 FROM t2 WHERE t2.c1 IS NOT NULL) ORDER BY 1,2;
c0	c1	c0	c1
1	A	1	AB
2	A	2	12
5	%-$	5	
SELECT /*+parallel(2) USE_MJ(t1,t2)*/ * FROM t1,t2 WHERE t1.c0=t2.c0 AND t1.c1 <>ALL (SELECT c1 FROM t2 WHERE t2.c1 IS NOT NULL) ORDER BY 1,2;
c0	c1	c0	c1
1	A	1	AB
2	A	2	12
5	%-$	5	
SELECT /*+parallel(2) USE_NL(t1,t2)*/ * FROM t1,t2 WHERE t1.c0=t2.c0 AND t1.c1 NOT IN (SELECT c1 FROM t2 WHERE t2.c1 IS NOT NULL) ORDER BY 1,2;
c0	c1	c0	c1
1	A	1	AB
2	A	2	12
5	%-$	5	
SELECT /*+parallel(2) USE_HASH(t1,t2)*/ * FROM t1,t2 WHERE t1.c0=t2.c0 AND NOT EXISTS (SELECT c1 FROM t2 WHERE t2.c1 IS NOT NULL) ORDER BY 1,2;
c0	c1	c0	c1
#There are null values on the left table
INSERT INTO t1 VALUES(4,NULL);
INSERT INTO t1 VALUES(7,'');
DELETE FROM t2 WHERE c0 IN(5,6);
SELECT * FROM t2 ORDER BY c0,c1;
c0	c1
1	AB
2	12
3	AB
4	12
7	%--$
#IF "_optimizer_null_aware_antijoin"=ON,EXPLAIN:HASH JOIN ANTI NA
SELECT * FROM t1 WHERE c1 NOT IN (SELECT c1 FROM t2) ORDER BY 1,2;
c0	c1
1	A
2	A
5	%-$
7	
SELECT * FROM t1 WHERE NOT EXISTS (SELECT c1 FROM t2) ORDER BY 1,2;
c0	c1
#IF "_optimizer_null_aware_antijoin"=TRUE,EXPLAIN:HASH JOIN ANTI SNA
SELECT * FROM t1 WHERE c1 NOT IN (SELECT c1 FROM t2 WHERE t2.c1 IS NOT NULL) ORDER BY 1,2;
c0	c1
1	A
2	A
5	%-$
7	
SELECT * FROM t1 WHERE NOT EXISTS (SELECT c1 FROM t2 WHERE t2.c1 IS NOT NULL) ORDER BY 1,2;
c0	c1
#INNER JOIN
#IF "_optimizer_null_aware_antijoin"=ON,EXPLAIN:HASH JOIN ANTI NA
SELECT * FROM t1 JOIN t2 ON t1.c0=t2.c0 AND t1.c1 NOT IN (SELECT c1 FROM t2) ORDER BY 1,2;
c0	c1	c0	c1
1	A	1	AB
2	A	2	12
7		7	%--$
SELECT * FROM t1 JOIN t2 ON t1.c0=t2.c0 AND NOT EXISTS (SELECT c1 FROM t2) ORDER BY 1,2;
c0	c1	c0	c1
#IF "_optimizer_null_aware_antijoin"=TRUE,EXPLAIN:HASH JOIN ANTI SNA
SELECT * FROM t1 JOIN t2 ON t1.c0=t2.c0 AND t1.c1 NOT IN (SELECT c1 FROM t2 WHERE t2.c1 IS NOT NULL) ORDER BY 1,2;
c0	c1	c0	c1
1	A	1	AB
2	A	2	12
7		7	%--$
SELECT * FROM t1 JOIN t2 ON t1.c0=t2.c0 AND NOT EXISTS (SELECT c1 FROM t2 WHERE t2.c1 IS NOT NULL) ORDER BY 1,2;
c0	c1	c0	c1
#RIGHT JOIN
#IF "_optimizer_null_aware_antijoin"=ON,EXPLAIN:HASH JOIN ANTI NA
SELECT * FROM t1 RIGHT JOIN t2 ON t1.c0=t2.c0 AND t1.c1 NOT IN (SELECT c1 FROM t2) ORDER BY 1,2,3;
c0	c1	c0	c1
NULL	NULL	3	AB
NULL	NULL	4	12
1	A	1	AB
2	A	2	12
7		7	%--$
SELECT * FROM t1 RIGHT JOIN t2 ON t1.c0=t2.c0 AND t1.c1 <>ALL (SELECT c1 FROM t2) ORDER BY 1,2,3;
c0	c1	c0	c1
NULL	NULL	3	AB
NULL	NULL	4	12
1	A	1	AB
2	A	2	12
7		7	%--$
SELECT * FROM t1 RIGHT JOIN t2 ON t1.c0=t2.c0 AND NOT EXISTS (SELECT c1 FROM t2) ORDER BY 1,2,3;
c0	c1	c0	c1
NULL	NULL	1	AB
NULL	NULL	2	12
NULL	NULL	3	AB
NULL	NULL	4	12
NULL	NULL	7	%--$
#IF "_optimizer_null_aware_antijoin"=ON,EXPLAIN:HASH JOIN ANTI SNA
SELECT * FROM t1 RIGHT JOIN t2 ON t1.c0=t2.c0 AND t1.c1 NOT IN (SELECT c1 FROM t2 WHERE t2.c1 IS NOT NULL) ORDER BY 1,2,3;
c0	c1	c0	c1
NULL	NULL	3	AB
NULL	NULL	4	12
1	A	1	AB
2	A	2	12
7		7	%--$
SELECT * FROM t1 RIGHT JOIN t2 ON t1.c0=t2.c0 AND t1.c1 <>ALL (SELECT c1 FROM t2 WHERE t2.c1 IS NOT NULL) ORDER BY 1,2,3;
c0	c1	c0	c1
NULL	NULL	3	AB
NULL	NULL	4	12
1	A	1	AB
2	A	2	12
7		7	%--$
SELECT * FROM t1 RIGHT JOIN t2 ON t1.c0=t2.c0 AND NOT EXISTS (SELECT c1 FROM t2 WHERE t2.c1 IS NOT NULL) ORDER BY 1,2,3;
c0	c1	c0	c1
NULL	NULL	1	AB
NULL	NULL	2	12
NULL	NULL	3	AB
NULL	NULL	4	12
NULL	NULL	7	%--$
#LEFT JOIN
#IF "_optimizer_null_aware_antijoin"=ON,EXPLAIN:HASH JOIN ANTI NA
SELECT * FROM t1 LEFT JOIN t2 ON t1.c0=t2.c0 WHERE t1.c1 NOT IN (SELECT c1 FROM t2) ORDER BY 1,2;
c0	c1	c0	c1
1	A	1	AB
2	A	2	12
5	%-$	NULL	NULL
7		7	%--$
SELECT * FROM t1 LEFT JOIN t2 ON t1.c0=t2.c0 WHERE t1.c1 <>ALL (SELECT c1 FROM t2) ORDER BY 1,2;
c0	c1	c0	c1
1	A	1	AB
2	A	2	12
5	%-$	NULL	NULL
7		7	%--$
SELECT * FROM t1 LEFT JOIN t2 ON t1.c0=t2.c0 WHERE NOT EXISTS (SELECT c1 FROM t2) ORDER BY 1,2;
c0	c1	c0	c1
#IF "_optimizer_null_aware_antijoin"=ON,EXPLAIN:HASH JOIN ANTI SNA
SELECT * FROM t1 LEFT JOIN t2 ON t1.c0=t2.c0 WHERE t1.c1 NOT IN (SELECT c1 FROM t2 WHERE t2.c1 IS NOT NULL) ORDER BY 1,2,3;
c0	c1	c0	c1
1	A	1	AB
2	A	2	12
5	%-$	NULL	NULL
7		7	%--$
SELECT * FROM t1 LEFT JOIN t2 ON t1.c0=t2.c0 WHERE t1.c1 <>ALL (SELECT c1 FROM t2 WHERE t2.c1 IS NOT NULL) ORDER BY 1,2,3;
c0	c1	c0	c1
1	A	1	AB
2	A	2	12
5	%-$	NULL	NULL
7		7	%--$
SELECT * FROM t1 LEFT JOIN t2 ON t1.c0=t2.c0 WHERE NOT EXISTS (SELECT c1 FROM t2 WHERE t2.c1 IS NOT NULL) ORDER BY 1,2,3;
c0	c1	c0	c1
#FULL JOIN
#IF "_optimizer_null_aware_antijoin"=ON,EXPLAIN:HASH JOIN ANTI NA
SELECT * FROM t1 FULL JOIN t2 ON t1.c0=t2.c0 WHERE t1.c1 NOT IN (SELECT c1 FROM t2) ORDER BY 1,2;
c0	c1	c0	c1
1	A	1	AB
2	A	2	12
5	%-$	NULL	NULL
7		7	%--$
SELECT * FROM t1 FULL JOIN t2 ON t1.c0=t2.c0 WHERE t1.c1 <>ALL (SELECT c1 FROM t2) ORDER BY 1,2;
c0	c1	c0	c1
1	A	1	AB
2	A	2	12
5	%-$	NULL	NULL
7		7	%--$
SELECT * FROM t1 FULL JOIN t2 ON t1.c0=t2.c0 WHERE NOT EXISTS (SELECT c1 FROM t2) ORDER BY 1,2;
c0	c1	c0	c1
#IF "_optimizer_null_aware_antijoin"=ON,EXPLAIN:HASH JOIN ANTI SNA
SELECT * FROM t1 FULL JOIN t2 ON t1.c0=t2.c0 WHERE t1.c1 NOT IN (SELECT c1 FROM t2 WHERE t2.c1 IS NOT NULL) ORDER BY 1,2,3;
c0	c1	c0	c1
1	A	1	AB
2	A	2	12
5	%-$	NULL	NULL
7		7	%--$
SELECT * FROM t1 FULL JOIN t2 ON t1.c0=t2.c0 WHERE t1.c1 <>ALL (SELECT c1 FROM t2 WHERE t2.c1 IS NOT NULL) ORDER BY 1,2,3;
c0	c1	c0	c1
1	A	1	AB
2	A	2	12
5	%-$	NULL	NULL
7		7	%--$
SELECT * FROM t1 FULL JOIN t2 ON t1.c0=t2.c0 WHERE NOT EXISTS (SELECT c1 FROM t2 WHERE t2.c1 IS NOT NULL) ORDER BY 1,2,3;
c0	c1	c0	c1
#HINT
#IF "_optimizer_null_aware_antijoin"=ON,EXPLAIN:HASH JOIN ANTI NA
SELECT /*+USE_HASH(t1,t2)*/ * FROM t1 WHERE c1 NOT IN (SELECT c1 FROM t2) ORDER BY 1,2;
c0	c1
1	A
2	A
5	%-$
7	
SELECT /*+USE_HASH(t1,t2)*/ * FROM t1 JOIN t2 ON t1.c0=t2.c0 AND t1.c1 <>ALL (SELECT c1 FROM t2) ORDER BY 1,2;
c0	c1	c0	c1
1	A	1	AB
2	A	2	12
7		7	%--$
SELECT /*+USE_HASH(t1,t2)*/ * FROM t1 RIGHT JOIN t2 ON t1.c0=t2.c0 WHERE t1.c1 NOT IN (SELECT c1 FROM t2) ORDER BY 1,2;
c0	c1	c0	c1
1	A	1	AB
2	A	2	12
7		7	%--$
SELECT /*+USE_NLJ(t1,t2)*/ * FROM t1 RIGHT JOIN t2 ON t1.c0=t2.c0 WHERE t1.c1 NOT IN (SELECT c1 FROM t2) ORDER BY 1,2;
c0	c1	c0	c1
1	A	1	AB
2	A	2	12
7		7	%--$
SELECT /*+USE_MJ(t1,t2)*/ * FROM t1 JOIN t2 ON t1.c0=t2.c0 AND t1.c1 <>ALL (SELECT c1 FROM t2) ORDER BY 1,2;
c0	c1	c0	c1
1	A	1	AB
2	A	2	12
7		7	%--$
SELECT /*+USE_HASH(t1,t2)*/ * FROM t1 WHERE NOT EXISTS (SELECT c1 FROM t2) ORDER BY 1,2;
c0	c1
SELECT /*+USE_HASH(t1,t2)*/ * FROM t1 WHERE c1 NOT IN (SELECT c1 FROM t2) ORDER BY 1,2;
c0	c1
1	A
2	A
5	%-$
7	
SELECT /*+USE_NL(t1,t2)*/ * FROM t1 JOIN t2 ON t1.c0=t2.c0 AND t1.c1 <>ALL (SELECT c1 FROM t2) ORDER BY 1,2;
c0	c1	c0	c1
1	A	1	AB
2	A	2	12
7		7	%--$
SELECT /*+USE_MJ(t1,t2)*/ * FROM t1 JOIN t2 ON t1.c0=t2.c0 AND t1.c1 <>ALL (SELECT c1 FROM t2) ORDER BY 1,2;
c0	c1	c0	c1
1	A	1	AB
2	A	2	12
7		7	%--$
#IF "_optimizer_null_aware_antijoin"=ON,EXPLAIN:HASH JOIN ANTI SNA
SELECT /*+USE_HASH(t1,t2)*/ * FROM t1 WHERE c1 NOT IN (SELECT c1 FROM t2 WHERE t2.c1 IS NOT NULL) ORDER BY 1,2;
c0	c1
1	A
2	A
5	%-$
7	
SELECT /*+USE_HASH(t1,t2)*/ * FROM t1 JOIN t2 ON t1.c0=t2.c0 AND t1.c1 <>ALL (SELECT c1 FROM t2 WHERE t2.c1 IS NOT NULL) ORDER BY 1,2;
c0	c1	c0	c1
1	A	1	AB
2	A	2	12
7		7	%--$
SELECT /*+USE_HASH(t1,t2)*/ * FROM t1 RIGHT JOIN t2 ON t1.c0=t2.c0 WHERE t1.c1 NOT IN (SELECT c1 FROM t2 WHERE t2.c1 IS NOT NULL) ORDER BY 1,2;
c0	c1	c0	c1
1	A	1	AB
2	A	2	12
7		7	%--$
SELECT /*+USE_NLJ(t1,t2)*/ * FROM t1 RIGHT JOIN t2 ON t1.c0=t2.c0 WHERE t1.c1 NOT IN (SELECT c1 FROM t2 WHERE t2.c1 IS NOT NULL) ORDER BY 1,2;
c0	c1	c0	c1
1	A	1	AB
2	A	2	12
7		7	%--$
SELECT /*+USE_MJ(t1,t2)*/ * FROM t1 JOIN t2 ON t1.c0=t2.c0 AND t1.c1 <>ALL (SELECT c1 FROM t2 WHERE t2.c1 IS NOT NULL) ORDER BY 1,2;
c0	c1	c0	c1
1	A	1	AB
2	A	2	12
7		7	%--$
SELECT /*+USE_HASH(t1,t2)*/ * FROM t1 WHERE NOT EXISTS (SELECT c1 FROM t2 WHERE t2.c1 IS NOT NULL) ORDER BY 1,2;
c0	c1
SELECT /*+USE_HASH(t1,t2)*/ * FROM t1 WHERE c1 NOT IN (SELECT c1 FROM t2 WHERE t2.c1 IS NOT NULL) ORDER BY 1,2;
c0	c1
1	A
2	A
5	%-$
7	
SELECT /*+USE_NL(t1,t2)*/ * FROM t1 JOIN t2 ON t1.c0=t2.c0 AND t1.c1 <>ALL (SELECT c1 FROM t2 WHERE t2.c1 IS NOT NULL) ORDER BY 1,2;
c0	c1	c0	c1
1	A	1	AB
2	A	2	12
7		7	%--$
SELECT /*+USE_MJ(t1,t2)*/ * FROM t1 JOIN t2 ON t1.c0=t2.c0 AND t1.c1 <>ALL (SELECT c1 FROM t2 WHERE t2.c1 IS NOT NULL) ORDER BY 1,2;
c0	c1	c0	c1
1	A	1	AB
2	A	2	12
7		7	%--$
#PARALLEL
#IF "_optimizer_null_aware_antijoin"=ON,EXPLAIN:HASH JOIN ANTI NA
SELECT /*+parallel(2) USE_HASH(t1,t2)*/ * FROM t1 WHERE c1 NOT IN (SELECT c1 FROM t2) ORDER BY 1,2;
c0	c1
1	A
2	A
5	%-$
7	
SELECT /*+parallel(2) USE_HASH(t1,t2)*/ * FROM t1 WHERE c1 <>ALL (SELECT c1 FROM t2) ORDER BY 1,2;
c0	c1
1	A
2	A
5	%-$
7	
SELECT /*+parallel(2) USE_NL(t1,t2)*/ * FROM t1 WHERE c1 <>ALL (SELECT c1 FROM t2) ORDER BY 1,2;
c0	c1
1	A
2	A
5	%-$
7	
SELECT /*+parallel(2) USE_HASH(t1,t2)*/ * FROM t1 WHERE NOT EXISTS (SELECT c1 FROM t2) ORDER BY 1,2;
c0	c1
SELECT /*+parallel(5) USE_HASH(t1,t2)*/ * FROM t1 WHERE c1 NOT IN (SELECT c1 FROM t2) ORDER BY 1,2;
c0	c1
1	A
2	A
5	%-$
7	
SELECT /*+parallel(5) USE_NLJ(t1,t2)*/ * FROM t1 WHERE c1 NOT IN (SELECT c1 FROM t2) ORDER BY 1,2;
c0	c1
1	A
2	A
5	%-$
7	
SELECT /*+parallel(5) USE_HASH(t1,t2)*/ * FROM t1 WHERE c1 <>ALL (SELECT c1 FROM t2) ORDER BY 1,2;
c0	c1
1	A
2	A
5	%-$
7	
SELECT /*+parallel(5) USE_MJ(t1,t2)*/ * FROM t1 WHERE c1 NOT IN (SELECT c1 FROM t2) ORDER BY 1,2;
c0	c1
1	A
2	A
5	%-$
7	
SELECT /*+parallel(5) USE_HASH(t1,t2)*/ * FROM t1 WHERE NOT EXISTS (SELECT c1 FROM t2) ORDER BY 1,2;
c0	c1
SELECT /*+parallel(2) USE_HASH(t1,t2)*/ * FROM t1,t2 WHERE t1.c0=t2.c0 AND t1.c1 NOT IN (SELECT c1 FROM t2) ORDER BY 1,2;
c0	c1	c0	c1
1	A	1	AB
2	A	2	12
7		7	%--$
SELECT /*+parallel(2) USE_HASH(t1,t2)*/ * FROM t1,t2 WHERE t1.c0=t2.c0 AND t1.c1 <>ALL (SELECT c1 FROM t2) ORDER BY 1,2;
c0	c1	c0	c1
1	A	1	AB
2	A	2	12
7		7	%--$
SELECT /*+parallel(2) USE_MJ(t1,t2)*/ * FROM t1,t2 WHERE t1.c0=t2.c0 AND t1.c1 <>ALL (SELECT c1 FROM t2) ORDER BY 1,2;
c0	c1	c0	c1
1	A	1	AB
2	A	2	12
7		7	%--$
SELECT /*+parallel(2) USE_NL(t1,t2)*/ * FROM t1,t2 WHERE t1.c0=t2.c0 AND t1.c1 NOT IN (SELECT c1 FROM t2) ORDER BY 1,2;
c0	c1	c0	c1
1	A	1	AB
2	A	2	12
7		7	%--$
SELECT /*+parallel(2) USE_HASH(t1,t2)*/ * FROM t1,t2 WHERE t1.c0=t2.c0 AND NOT EXISTS (SELECT c1 FROM t2) ORDER BY 1,2;
c0	c1	c0	c1
#IF "_optimizer_null_aware_antijoin"=ON,EXPLAIN:HASH JOIN ANTI SNA
SELECT /*+parallel(2) USE_HASH(t1,t2)*/ * FROM t1 WHERE c1 NOT IN (SELECT c1 FROM t2 WHERE t2.c1 IS NOT NULL) ORDER BY 1,2;
c0	c1
1	A
2	A
5	%-$
7	
SELECT /*+parallel(2) USE_HASH(t1,t2)*/ * FROM t1 WHERE c1 <>ALL (SELECT c1 FROM t2 WHERE t2.c1 IS NOT NULL) ORDER BY 1,2;
c0	c1
1	A
2	A
5	%-$
7	
SELECT /*+parallel(2) USE_NL(t1,t2)*/ * FROM t1 WHERE c1 <>ALL (SELECT c1 FROM t2 WHERE t2.c1 IS NOT NULL) ORDER BY 1,2;
c0	c1
1	A
2	A
5	%-$
7	
SELECT /*+parallel(2) USE_HASH(t1,t2)*/ * FROM t1 WHERE NOT EXISTS (SELECT c1 FROM t2 WHERE t2.c1 IS NOT NULL) ORDER BY 1,2;
c0	c1
SELECT /*+parallel(5) USE_HASH(t1,t2)*/ * FROM t1 WHERE c1 NOT IN (SELECT c1 FROM t2 WHERE t2.c1 IS NOT NULL) ORDER BY 1,2;
c0	c1
1	A
2	A
5	%-$
7	
SELECT /*+parallel(5) USE_NLJ(t1,t2)*/ * FROM t1 WHERE c1 NOT IN (SELECT c1 FROM t2 WHERE t2.c1 IS NOT NULL) ORDER BY 1,2;
c0	c1
1	A
2	A
5	%-$
7	
SELECT /*+parallel(5) USE_HASH(t1,t2)*/ * FROM t1 WHERE c1 <>ALL (SELECT c1 FROM t2 WHERE t2.c1 IS NOT NULL) ORDER BY 1,2;
c0	c1
1	A
2	A
5	%-$
7	
SELECT /*+parallel(5) USE_MJ(t1,t2)*/ * FROM t1 WHERE c1 NOT IN (SELECT c1 FROM t2 WHERE t2.c1 IS NOT NULL) ORDER BY 1,2;
c0	c1
1	A
2	A
5	%-$
7	
SELECT /*+parallel(5) USE_HASH(t1,t2)*/ * FROM t1 WHERE NOT EXISTS (SELECT c1 FROM t2 WHERE t2.c1 IS NOT NULL) ORDER BY 1,2;
c0	c1
SELECT /*+parallel(2) USE_HASH(t1,t2)*/ * FROM t1,t2 WHERE t1.c0=t2.c0 AND t1.c1 NOT IN (SELECT c1 FROM t2 WHERE t2.c1 IS NOT NULL) ORDER BY 1,2;
c0	c1	c0	c1
1	A	1	AB
2	A	2	12
7		7	%--$
SELECT /*+parallel(2) USE_HASH(t1,t2)*/ * FROM t1,t2 WHERE t1.c0=t2.c0 AND t1.c1 <>ALL (SELECT c1 FROM t2 WHERE t2.c1 IS NOT NULL) ORDER BY 1,2;
c0	c1	c0	c1
1	A	1	AB
2	A	2	12
7		7	%--$
SELECT /*+parallel(2) USE_MJ(t1,t2)*/ * FROM t1,t2 WHERE t1.c0=t2.c0 AND t1.c1 <>ALL (SELECT c1 FROM t2 WHERE t2.c1 IS NOT NULL) ORDER BY 1,2;
c0	c1	c0	c1
1	A	1	AB
2	A	2	12
7		7	%--$
SELECT /*+parallel(2) USE_NL(t1,t2)*/ * FROM t1,t2 WHERE t1.c0=t2.c0 AND t1.c1 NOT IN (SELECT c1 FROM t2 WHERE t2.c1 IS NOT NULL) ORDER BY 1,2;
c0	c1	c0	c1
1	A	1	AB
2	A	2	12
7		7	%--$
SELECT /*+parallel(2) USE_HASH(t1,t2)*/ * FROM t1,t2 WHERE t1.c0=t2.c0 AND NOT EXISTS (SELECT c1 FROM t2 WHERE t2.c1 IS NOT NULL) ORDER BY 1,2;
c0	c1	c0	c1
#There are no null values in the left and right tables
DELETE FROM t1 WHERE c0 IN(4,7);
SELECT * FROM t1 ORDER BY c0,c1;
c0	c1
1	A
2	A
3	12
5	%-$
6	AB
SELECT * FROM t2 ORDER BY c0,c1;
c0	c1
1	AB
2	12
3	AB
4	12
7	%--$
#IF "_optimizer_null_aware_antijoin"=ON,EXPLAIN:HASH JOIN ANTI NA
SELECT * FROM t1 WHERE c1 NOT IN (SELECT c1 FROM t2) ORDER BY 1,2;
c0	c1
1	A
2	A
5	%-$
SELECT * FROM t1 WHERE NOT EXISTS (SELECT c1 FROM t2) ORDER BY 1,2;
c0	c1
#IF "_optimizer_null_aware_antijoin"=TRUE,EXPLAIN:HASH JOIN ANTI SNA
SELECT * FROM t1 WHERE c1 NOT IN (SELECT c1 FROM t2 WHERE t2.c1 IS NOT NULL) ORDER BY 1,2;
c0	c1
1	A
2	A
5	%-$
SELECT * FROM t1 WHERE NOT EXISTS (SELECT c1 FROM t2 WHERE t2.c1 IS NOT NULL) ORDER BY 1,2;
c0	c1
#INNER JOIN
#IF "_optimizer_null_aware_antijoin"=ON,EXPLAIN:HASH JOIN ANTI NA
SELECT * FROM t1 JOIN t2 ON t1.c0=t2.c0 AND t1.c1 NOT IN (SELECT c1 FROM t2) ORDER BY 1,2;
c0	c1	c0	c1
1	A	1	AB
2	A	2	12
SELECT * FROM t1 JOIN t2 ON t1.c0=t2.c0 AND NOT EXISTS (SELECT c1 FROM t2) ORDER BY 1,2;
c0	c1	c0	c1
#IF "_optimizer_null_aware_antijoin"=TRUE,EXPLAIN:HASH JOIN ANTI SNA
SELECT * FROM t1 JOIN t2 ON t1.c0=t2.c0 AND t1.c1 NOT IN (SELECT c1 FROM t2 WHERE t2.c1 IS NOT NULL) ORDER BY 1,2;
c0	c1	c0	c1
1	A	1	AB
2	A	2	12
SELECT * FROM t1 JOIN t2 ON t1.c0=t2.c0 AND NOT EXISTS (SELECT c1 FROM t2 WHERE t2.c1 IS NOT NULL) ORDER BY 1,2;
c0	c1	c0	c1
#RIGHT JOIN
#IF "_optimizer_null_aware_antijoin"=ON,EXPLAIN:HASH JOIN ANTI NA
SELECT * FROM t1 RIGHT JOIN t2 ON t1.c0=t2.c0 AND t1.c1 NOT IN (SELECT c1 FROM t2) ORDER BY 1,2,3;
c0	c1	c0	c1
NULL	NULL	3	AB
NULL	NULL	4	12
NULL	NULL	7	%--$
1	A	1	AB
2	A	2	12
SELECT * FROM t1 RIGHT JOIN t2 ON t1.c0=t2.c0 AND t1.c1 <>ALL (SELECT c1 FROM t2) ORDER BY 1,2,3;
c0	c1	c0	c1
NULL	NULL	3	AB
NULL	NULL	4	12
NULL	NULL	7	%--$
1	A	1	AB
2	A	2	12
SELECT * FROM t1 RIGHT JOIN t2 ON t1.c0=t2.c0 AND NOT EXISTS (SELECT c1 FROM t2) ORDER BY 1,2,3;
c0	c1	c0	c1
NULL	NULL	1	AB
NULL	NULL	2	12
NULL	NULL	3	AB
NULL	NULL	4	12
NULL	NULL	7	%--$
#IF "_optimizer_null_aware_antijoin"=ON,EXPLAIN:HASH JOIN ANTI SNA
SELECT * FROM t1 RIGHT JOIN t2 ON t1.c0=t2.c0 AND t1.c1 NOT IN (SELECT c1 FROM t2 WHERE t2.c1 IS NOT NULL) ORDER BY 1,2,3;
c0	c1	c0	c1
NULL	NULL	3	AB
NULL	NULL	4	12
NULL	NULL	7	%--$
1	A	1	AB
2	A	2	12
SELECT * FROM t1 RIGHT JOIN t2 ON t1.c0=t2.c0 AND t1.c1 <>ALL (SELECT c1 FROM t2 WHERE t2.c1 IS NOT NULL) ORDER BY 1,2,3;
c0	c1	c0	c1
NULL	NULL	3	AB
NULL	NULL	4	12
NULL	NULL	7	%--$
1	A	1	AB
2	A	2	12
SELECT * FROM t1 RIGHT JOIN t2 ON t1.c0=t2.c0 AND NOT EXISTS (SELECT c1 FROM t2 WHERE t2.c1 IS NOT NULL) ORDER BY 1,2,3;
c0	c1	c0	c1
NULL	NULL	1	AB
NULL	NULL	2	12
NULL	NULL	3	AB
NULL	NULL	4	12
NULL	NULL	7	%--$
#LEFT JOIN
#IF "_optimizer_null_aware_antijoin"=ON,EXPLAIN:HASH JOIN ANTI NA
SELECT * FROM t1 LEFT JOIN t2 ON t1.c0=t2.c0 WHERE t1.c1 NOT IN (SELECT c1 FROM t2) ORDER BY 1,2;
c0	c1	c0	c1
1	A	1	AB
2	A	2	12
5	%-$	NULL	NULL
SELECT * FROM t1 LEFT JOIN t2 ON t1.c0=t2.c0 WHERE t1.c1 <>ALL (SELECT c1 FROM t2) ORDER BY 1,2;
c0	c1	c0	c1
1	A	1	AB
2	A	2	12
5	%-$	NULL	NULL
SELECT * FROM t1 LEFT JOIN t2 ON t1.c0=t2.c0 WHERE NOT EXISTS (SELECT c1 FROM t2) ORDER BY 1,2;
c0	c1	c0	c1
#IF "_optimizer_null_aware_antijoin"=ON,EXPLAIN:HASH JOIN ANTI SNA
SELECT * FROM t1 LEFT JOIN t2 ON t1.c0=t2.c0 WHERE t1.c1 NOT IN (SELECT c1 FROM t2 WHERE t2.c1 IS NOT NULL) ORDER BY 1,2,3;
c0	c1	c0	c1
1	A	1	AB
2	A	2	12
5	%-$	NULL	NULL
SELECT * FROM t1 LEFT JOIN t2 ON t1.c0=t2.c0 WHERE t1.c1 <>ALL (SELECT c1 FROM t2 WHERE t2.c1 IS NOT NULL) ORDER BY 1,2,3;
c0	c1	c0	c1
1	A	1	AB
2	A	2	12
5	%-$	NULL	NULL
SELECT * FROM t1 LEFT JOIN t2 ON t1.c0=t2.c0 WHERE NOT EXISTS (SELECT c1 FROM t2 WHERE t2.c1 IS NOT NULL) ORDER BY 1,2,3;
c0	c1	c0	c1
#FULL JOIN
#IF "_optimizer_null_aware_antijoin"=ON,EXPLAIN:HASH JOIN ANTI NA
SELECT * FROM t1 FULL JOIN t2 ON t1.c0=t2.c0 WHERE t1.c1 NOT IN (SELECT c1 FROM t2) ORDER BY 1,2;
c0	c1	c0	c1
1	A	1	AB
2	A	2	12
5	%-$	NULL	NULL
SELECT * FROM t1 FULL JOIN t2 ON t1.c0=t2.c0 WHERE t1.c1 <>ALL (SELECT c1 FROM t2) ORDER BY 1,2;
c0	c1	c0	c1
1	A	1	AB
2	A	2	12
5	%-$	NULL	NULL
SELECT * FROM t1 FULL JOIN t2 ON t1.c0=t2.c0 WHERE NOT EXISTS (SELECT c1 FROM t2) ORDER BY 1,2;
c0	c1	c0	c1
#IF "_optimizer_null_aware_antijoin"=ON,EXPLAIN:HASH JOIN ANTI SNA
SELECT * FROM t1 FULL JOIN t2 ON t1.c0=t2.c0 WHERE t1.c1 NOT IN (SELECT c1 FROM t2 WHERE t2.c1 IS NOT NULL) ORDER BY 1,2,3;
c0	c1	c0	c1
1	A	1	AB
2	A	2	12
5	%-$	NULL	NULL
SELECT * FROM t1 FULL JOIN t2 ON t1.c0=t2.c0 WHERE t1.c1 <>ALL (SELECT c1 FROM t2 WHERE t2.c1 IS NOT NULL) ORDER BY 1,2,3;
c0	c1	c0	c1
1	A	1	AB
2	A	2	12
5	%-$	NULL	NULL
SELECT * FROM t1 FULL JOIN t2 ON t1.c0=t2.c0 WHERE NOT EXISTS (SELECT c1 FROM t2 WHERE t2.c1 IS NOT NULL) ORDER BY 1,2,3;
c0	c1	c0	c1
#HINT
#IF "_optimizer_null_aware_antijoin"=ON,EXPLAIN:HASH JOIN ANTI NA
SELECT /*+USE_HASH(t1,t2)*/ * FROM t1 WHERE c1 NOT IN (SELECT c1 FROM t2) ORDER BY 1,2;
c0	c1
1	A
2	A
5	%-$
SELECT /*+USE_HASH(t1,t2)*/ * FROM t1 JOIN t2 ON t1.c0=t2.c0 AND t1.c1 <>ALL (SELECT c1 FROM t2) ORDER BY 1,2;
c0	c1	c0	c1
1	A	1	AB
2	A	2	12
SELECT /*+USE_HASH(t1,t2)*/ * FROM t1 RIGHT JOIN t2 ON t1.c0=t2.c0 WHERE t1.c1 NOT IN (SELECT c1 FROM t2) ORDER BY 1,2;
c0	c1	c0	c1
1	A	1	AB
2	A	2	12
SELECT /*+USE_NLJ(t1,t2)*/ * FROM t1 RIGHT JOIN t2 ON t1.c0=t2.c0 WHERE t1.c1 NOT IN (SELECT c1 FROM t2) ORDER BY 1,2;
c0	c1	c0	c1
1	A	1	AB
2	A	2	12
SELECT /*+USE_MJ(t1,t2)*/ * FROM t1 JOIN t2 ON t1.c0=t2.c0 AND t1.c1 <>ALL (SELECT c1 FROM t2) ORDER BY 1,2;
c0	c1	c0	c1
1	A	1	AB
2	A	2	12
SELECT /*+USE_HASH(t1,t2)*/ * FROM t1 WHERE NOT EXISTS (SELECT c1 FROM t2) ORDER BY 1,2;
c0	c1
SELECT /*+USE_HASH(t1,t2)*/ * FROM t1 WHERE c1 NOT IN (SELECT c1 FROM t2) ORDER BY 1,2;
c0	c1
1	A
2	A
5	%-$
SELECT /*+USE_NL(t1,t2)*/ * FROM t1 JOIN t2 ON t1.c0=t2.c0 AND t1.c1 <>ALL (SELECT c1 FROM t2) ORDER BY 1,2;
c0	c1	c0	c1
1	A	1	AB
2	A	2	12
SELECT /*+USE_MJ(t1,t2)*/ * FROM t1 JOIN t2 ON t1.c0=t2.c0 AND t1.c1 <>ALL (SELECT c1 FROM t2) ORDER BY 1,2;
c0	c1	c0	c1
1	A	1	AB
2	A	2	12
#IF "_optimizer_null_aware_antijoin"=ON,EXPLAIN:HASH JOIN ANTI SNA
SELECT /*+USE_HASH(t1,t2)*/ * FROM t1 WHERE c1 NOT IN (SELECT c1 FROM t2 WHERE t2.c1 IS NOT NULL) ORDER BY 1,2;
c0	c1
1	A
2	A
5	%-$
SELECT /*+USE_HASH(t1,t2)*/ * FROM t1 JOIN t2 ON t1.c0=t2.c0 AND t1.c1 <>ALL (SELECT c1 FROM t2 WHERE t2.c1 IS NOT NULL) ORDER BY 1,2;
c0	c1	c0	c1
1	A	1	AB
2	A	2	12
SELECT /*+USE_HASH(t1,t2)*/ * FROM t1 RIGHT JOIN t2 ON t1.c0=t2.c0 WHERE t1.c1 NOT IN (SELECT c1 FROM t2 WHERE t2.c1 IS NOT NULL) ORDER BY 1,2;
c0	c1	c0	c1
1	A	1	AB
2	A	2	12
SELECT /*+USE_NLJ(t1,t2)*/ * FROM t1 RIGHT JOIN t2 ON t1.c0=t2.c0 WHERE t1.c1 NOT IN (SELECT c1 FROM t2 WHERE t2.c1 IS NOT NULL) ORDER BY 1,2;
c0	c1	c0	c1
1	A	1	AB
2	A	2	12
SELECT /*+USE_MJ(t1,t2)*/ * FROM t1 JOIN t2 ON t1.c0=t2.c0 AND t1.c1 <>ALL (SELECT c1 FROM t2 WHERE t2.c1 IS NOT NULL) ORDER BY 1,2;
c0	c1	c0	c1
1	A	1	AB
2	A	2	12
SELECT /*+USE_HASH(t1,t2)*/ * FROM t1 WHERE NOT EXISTS (SELECT c1 FROM t2 WHERE t2.c1 IS NOT NULL) ORDER BY 1,2;
c0	c1
SELECT /*+USE_HASH(t1,t2)*/ * FROM t1 WHERE c1 NOT IN (SELECT c1 FROM t2 WHERE t2.c1 IS NOT NULL) ORDER BY 1,2;
c0	c1
1	A
2	A
5	%-$
SELECT /*+USE_NL(t1,t2)*/ * FROM t1 JOIN t2 ON t1.c0=t2.c0 AND t1.c1 <>ALL (SELECT c1 FROM t2 WHERE t2.c1 IS NOT NULL) ORDER BY 1,2;
c0	c1	c0	c1
1	A	1	AB
2	A	2	12
SELECT /*+USE_MJ(t1,t2)*/ * FROM t1 JOIN t2 ON t1.c0=t2.c0 AND t1.c1 <>ALL (SELECT c1 FROM t2 WHERE t2.c1 IS NOT NULL) ORDER BY 1,2;
c0	c1	c0	c1
1	A	1	AB
2	A	2	12
#PARALLEL
#IF "_optimizer_null_aware_antijoin"=ON,EXPLAIN:HASH JOIN ANTI NA
SELECT /*+parallel(2) USE_HASH(t1,t2)*/ * FROM t1 WHERE c1 NOT IN (SELECT c1 FROM t2) ORDER BY 1,2;
c0	c1
1	A
2	A
5	%-$
SELECT /*+parallel(2) USE_HASH(t1,t2)*/ * FROM t1 WHERE c1 <>ALL (SELECT c1 FROM t2) ORDER BY 1,2;
c0	c1
1	A
2	A
5	%-$
SELECT /*+parallel(2) USE_NL(t1,t2)*/ * FROM t1 WHERE c1 <>ALL (SELECT c1 FROM t2) ORDER BY 1,2;
c0	c1
1	A
2	A
5	%-$
SELECT /*+parallel(2) USE_HASH(t1,t2)*/ * FROM t1 WHERE NOT EXISTS (SELECT c1 FROM t2) ORDER BY 1,2;
c0	c1
SELECT /*+parallel(5) USE_HASH(t1,t2)*/ * FROM t1 WHERE c1 NOT IN (SELECT c1 FROM t2) ORDER BY 1,2;
c0	c1
1	A
2	A
5	%-$
SELECT /*+parallel(5) USE_NLJ(t1,t2)*/ * FROM t1 WHERE c1 NOT IN (SELECT c1 FROM t2) ORDER BY 1,2;
c0	c1
1	A
2	A
5	%-$
SELECT /*+parallel(5) USE_HASH(t1,t2)*/ * FROM t1 WHERE c1 <>ALL (SELECT c1 FROM t2) ORDER BY 1,2;
c0	c1
1	A
2	A
5	%-$
SELECT /*+parallel(5) USE_MJ(t1,t2)*/ * FROM t1 WHERE c1 NOT IN (SELECT c1 FROM t2) ORDER BY 1,2;
c0	c1
1	A
2	A
5	%-$
SELECT /*+parallel(5) USE_HASH(t1,t2)*/ * FROM t1 WHERE NOT EXISTS (SELECT c1 FROM t2) ORDER BY 1,2;
c0	c1
SELECT /*+parallel(2) USE_HASH(t1,t2)*/ * FROM t1,t2 WHERE t1.c0=t2.c0 AND t1.c1 NOT IN (SELECT c1 FROM t2) ORDER BY 1,2;
c0	c1	c0	c1
1	A	1	AB
2	A	2	12
SELECT /*+parallel(2) USE_HASH(t1,t2)*/ * FROM t1,t2 WHERE t1.c0=t2.c0 AND t1.c1 <>ALL (SELECT c1 FROM t2) ORDER BY 1,2;
c0	c1	c0	c1
1	A	1	AB
2	A	2	12
SELECT /*+parallel(2) USE_MJ(t1,t2)*/ * FROM t1,t2 WHERE t1.c0=t2.c0 AND t1.c1 <>ALL (SELECT c1 FROM t2) ORDER BY 1,2;
c0	c1	c0	c1
1	A	1	AB
2	A	2	12
SELECT /*+parallel(2) USE_NL(t1,t2)*/ * FROM t1,t2 WHERE t1.c0=t2.c0 AND t1.c1 NOT IN (SELECT c1 FROM t2) ORDER BY 1,2;
c0	c1	c0	c1
1	A	1	AB
2	A	2	12
SELECT /*+parallel(2) USE_HASH(t1,t2)*/ * FROM t1,t2 WHERE t1.c0=t2.c0 AND NOT EXISTS (SELECT c1 FROM t2) ORDER BY 1,2;
c0	c1	c0	c1
#IF "_optimizer_null_aware_antijoin"=ON,EXPLAIN:HASH JOIN ANTI SNA
SELECT /*+parallel(2) USE_HASH(t1,t2)*/ * FROM t1 WHERE c1 NOT IN (SELECT c1 FROM t2 WHERE t2.c1 IS NOT NULL) ORDER BY 1,2;
c0	c1
1	A
2	A
5	%-$
SELECT /*+parallel(2) USE_HASH(t1,t2)*/ * FROM t1 WHERE c1 <>ALL (SELECT c1 FROM t2 WHERE t2.c1 IS NOT NULL) ORDER BY 1,2;
c0	c1
1	A
2	A
5	%-$
SELECT /*+parallel(2) USE_NL(t1,t2)*/ * FROM t1 WHERE c1 <>ALL (SELECT c1 FROM t2 WHERE t2.c1 IS NOT NULL) ORDER BY 1,2;
c0	c1
1	A
2	A
5	%-$
SELECT /*+parallel(2) USE_HASH(t1,t2)*/ * FROM t1 WHERE NOT EXISTS (SELECT c1 FROM t2 WHERE t2.c1 IS NOT NULL) ORDER BY 1,2;
c0	c1
SELECT /*+parallel(5) USE_HASH(t1,t2)*/ * FROM t1 WHERE c1 NOT IN (SELECT c1 FROM t2 WHERE t2.c1 IS NOT NULL) ORDER BY 1,2;
c0	c1
1	A
2	A
5	%-$
SELECT /*+parallel(5) USE_NLJ(t1,t2)*/ * FROM t1 WHERE c1 NOT IN (SELECT c1 FROM t2 WHERE t2.c1 IS NOT NULL) ORDER BY 1,2;
c0	c1
1	A
2	A
5	%-$
SELECT /*+parallel(5) USE_HASH(t1,t2)*/ * FROM t1 WHERE c1 <>ALL (SELECT c1 FROM t2 WHERE t2.c1 IS NOT NULL) ORDER BY 1,2;
c0	c1
1	A
2	A
5	%-$
SELECT /*+parallel(5) USE_MJ(t1,t2)*/ * FROM t1 WHERE c1 NOT IN (SELECT c1 FROM t2 WHERE t2.c1 IS NOT NULL) ORDER BY 1,2;
c0	c1
1	A
2	A
5	%-$
SELECT /*+parallel(5) USE_HASH(t1,t2)*/ * FROM t1 WHERE NOT EXISTS (SELECT c1 FROM t2 WHERE t2.c1 IS NOT NULL) ORDER BY 1,2;
c0	c1
SELECT /*+parallel(2) USE_HASH(t1,t2)*/ * FROM t1,t2 WHERE t1.c0=t2.c0 AND t1.c1 NOT IN (SELECT c1 FROM t2 WHERE t2.c1 IS NOT NULL) ORDER BY 1,2;
c0	c1	c0	c1
1	A	1	AB
2	A	2	12
SELECT /*+parallel(2) USE_HASH(t1,t2)*/ * FROM t1,t2 WHERE t1.c0=t2.c0 AND t1.c1 <>ALL (SELECT c1 FROM t2 WHERE t2.c1 IS NOT NULL) ORDER BY 1,2;
c0	c1	c0	c1
1	A	1	AB
2	A	2	12
SELECT /*+parallel(2) USE_MJ(t1,t2)*/ * FROM t1,t2 WHERE t1.c0=t2.c0 AND t1.c1 <>ALL (SELECT c1 FROM t2 WHERE t2.c1 IS NOT NULL) ORDER BY 1,2;
c0	c1	c0	c1
1	A	1	AB
2	A	2	12
SELECT /*+parallel(2) USE_NL(t1,t2)*/ * FROM t1,t2 WHERE t1.c0=t2.c0 AND t1.c1 NOT IN (SELECT c1 FROM t2 WHERE t2.c1 IS NOT NULL) ORDER BY 1,2;
c0	c1	c0	c1
1	A	1	AB
2	A	2	12
SELECT /*+parallel(2) USE_HASH(t1,t2)*/ * FROM t1,t2 WHERE t1.c0=t2.c0 AND NOT EXISTS (SELECT c1 FROM t2 WHERE t2.c1 IS NOT NULL) ORDER BY 1,2;
c0	c1	c0	c1
#Left table is empty
DELETE FROM t1;
INSERT INTO t2 VALUES(5,'');
INSERT INTO t2 VALUES(6,NULL);
SELECT * FROM t1 ORDER BY c0,c1;
c0	c1
SELECT * FROM t2 ORDER BY c0,c1;
c0	c1
1	AB
2	12
3	AB
4	12
5	
6	NULL
7	%--$
#IF "_optimizer_null_aware_antijoin"=ON,EXPLAIN:HASH JOIN ANTI NA
SELECT * FROM t1 WHERE c1 NOT IN (SELECT c1 FROM t2) ORDER BY 1,2;
c0	c1
SELECT * FROM t1 WHERE NOT EXISTS (SELECT c1 FROM t2) ORDER BY 1,2;
c0	c1
#IF "_optimizer_null_aware_antijoin"=TRUE,EXPLAIN:HASH JOIN ANTI SNA
SELECT * FROM t1 WHERE c1 NOT IN (SELECT c1 FROM t2 WHERE t2.c1 IS NOT NULL) ORDER BY 1,2;
c0	c1
SELECT * FROM t1 WHERE NOT EXISTS (SELECT c1 FROM t2 WHERE t2.c1 IS NOT NULL) ORDER BY 1,2;
c0	c1
#INNER JOIN
#IF "_optimizer_null_aware_antijoin"=ON,EXPLAIN:HASH JOIN ANTI NA
SELECT * FROM t1 JOIN t2 ON t1.c0=t2.c0 AND t1.c1 NOT IN (SELECT c1 FROM t2) ORDER BY 1,2;
c0	c1	c0	c1
SELECT * FROM t1 JOIN t2 ON t1.c0=t2.c0 AND NOT EXISTS (SELECT c1 FROM t2) ORDER BY 1,2;
c0	c1	c0	c1
#IF "_optimizer_null_aware_antijoin"=TRUE,EXPLAIN:HASH JOIN ANTI SNA
SELECT * FROM t1 JOIN t2 ON t1.c0=t2.c0 AND t1.c1 NOT IN (SELECT c1 FROM t2 WHERE t2.c1 IS NOT NULL) ORDER BY 1,2;
c0	c1	c0	c1
SELECT * FROM t1 JOIN t2 ON t1.c0=t2.c0 AND NOT EXISTS (SELECT c1 FROM t2 WHERE t2.c1 IS NOT NULL) ORDER BY 1,2;
c0	c1	c0	c1
#RIGHT JOIN
#IF "_optimizer_null_aware_antijoin"=ON,EXPLAIN:HASH JOIN ANTI NA
SELECT * FROM t1 RIGHT JOIN t2 ON t1.c0=t2.c0 AND t1.c1 NOT IN (SELECT c1 FROM t2) ORDER BY 1,2,3;
c0	c1	c0	c1
NULL	NULL	1	AB
NULL	NULL	2	12
NULL	NULL	3	AB
NULL	NULL	4	12
NULL	NULL	5	
NULL	NULL	6	NULL
NULL	NULL	7	%--$
SELECT * FROM t1 RIGHT JOIN t2 ON t1.c0=t2.c0 AND t1.c1 <>ALL (SELECT c1 FROM t2) ORDER BY 1,2,3;
c0	c1	c0	c1
NULL	NULL	1	AB
NULL	NULL	2	12
NULL	NULL	3	AB
NULL	NULL	4	12
NULL	NULL	5	
NULL	NULL	6	NULL
NULL	NULL	7	%--$
SELECT * FROM t1 RIGHT JOIN t2 ON t1.c0=t2.c0 AND NOT EXISTS (SELECT c1 FROM t2) ORDER BY 1,2,3;
c0	c1	c0	c1
NULL	NULL	1	AB
NULL	NULL	2	12
NULL	NULL	3	AB
NULL	NULL	4	12
NULL	NULL	5	
NULL	NULL	6	NULL
NULL	NULL	7	%--$
#IF "_optimizer_null_aware_antijoin"=ON,EXPLAIN:HASH JOIN ANTI SNA
SELECT * FROM t1 RIGHT JOIN t2 ON t1.c0=t2.c0 AND t1.c1 NOT IN (SELECT c1 FROM t2 WHERE t2.c1 IS NOT NULL) ORDER BY 1,2,3;
c0	c1	c0	c1
NULL	NULL	1	AB
NULL	NULL	2	12
NULL	NULL	3	AB
NULL	NULL	4	12
NULL	NULL	5	
NULL	NULL	6	NULL
NULL	NULL	7	%--$
SELECT * FROM t1 RIGHT JOIN t2 ON t1.c0=t2.c0 AND t1.c1 <>ALL (SELECT c1 FROM t2 WHERE t2.c1 IS NOT NULL) ORDER BY 1,2,3;
c0	c1	c0	c1
NULL	NULL	1	AB
NULL	NULL	2	12
NULL	NULL	3	AB
NULL	NULL	4	12
NULL	NULL	5	
NULL	NULL	6	NULL
NULL	NULL	7	%--$
SELECT * FROM t1 RIGHT JOIN t2 ON t1.c0=t2.c0 AND NOT EXISTS (SELECT c1 FROM t2 WHERE t2.c1 IS NOT NULL) ORDER BY 1,2,3;
c0	c1	c0	c1
NULL	NULL	1	AB
NULL	NULL	2	12
NULL	NULL	3	AB
NULL	NULL	4	12
NULL	NULL	5	
NULL	NULL	6	NULL
NULL	NULL	7	%--$
#LEFT JOIN
#IF "_optimizer_null_aware_antijoin"=ON,EXPLAIN:HASH JOIN ANTI NA
SELECT * FROM t1 LEFT JOIN t2 ON t1.c0=t2.c0 WHERE t1.c1 NOT IN (SELECT c1 FROM t2) ORDER BY 1,2;
c0	c1	c0	c1
SELECT * FROM t1 LEFT JOIN t2 ON t1.c0=t2.c0 WHERE t1.c1 <>ALL (SELECT c1 FROM t2) ORDER BY 1,2;
c0	c1	c0	c1
SELECT * FROM t1 LEFT JOIN t2 ON t1.c0=t2.c0 WHERE NOT EXISTS (SELECT c1 FROM t2) ORDER BY 1,2;
c0	c1	c0	c1
#IF "_optimizer_null_aware_antijoin"=ON,EXPLAIN:HASH JOIN ANTI SNA
SELECT * FROM t1 LEFT JOIN t2 ON t1.c0=t2.c0 WHERE t1.c1 NOT IN (SELECT c1 FROM t2 WHERE t2.c1 IS NOT NULL) ORDER BY 1,2,3;
c0	c1	c0	c1
SELECT * FROM t1 LEFT JOIN t2 ON t1.c0=t2.c0 WHERE t1.c1 <>ALL (SELECT c1 FROM t2 WHERE t2.c1 IS NOT NULL) ORDER BY 1,2,3;
c0	c1	c0	c1
SELECT * FROM t1 LEFT JOIN t2 ON t1.c0=t2.c0 WHERE NOT EXISTS (SELECT c1 FROM t2 WHERE t2.c1 IS NOT NULL) ORDER BY 1,2,3;
c0	c1	c0	c1
#FULL JOIN
#IF "_optimizer_null_aware_antijoin"=ON,EXPLAIN:HASH JOIN ANTI NA
SELECT * FROM t1 FULL JOIN t2 ON t1.c0=t2.c0 WHERE t1.c1 NOT IN (SELECT c1 FROM t2) ORDER BY 1,2;
c0	c1	c0	c1
SELECT * FROM t1 FULL JOIN t2 ON t1.c0=t2.c0 WHERE t1.c1 <>ALL (SELECT c1 FROM t2) ORDER BY 1,2;
c0	c1	c0	c1
SELECT * FROM t1 FULL JOIN t2 ON t1.c0=t2.c0 WHERE NOT EXISTS (SELECT c1 FROM t2) ORDER BY 1,2;
c0	c1	c0	c1
#IF "_optimizer_null_aware_antijoin"=ON,EXPLAIN:HASH JOIN ANTI SNA
SELECT * FROM t1 FULL JOIN t2 ON t1.c0=t2.c0 WHERE t1.c1 NOT IN (SELECT c1 FROM t2 WHERE t2.c1 IS NOT NULL) ORDER BY 1,2,3;
c0	c1	c0	c1
SELECT * FROM t1 FULL JOIN t2 ON t1.c0=t2.c0 WHERE t1.c1 <>ALL (SELECT c1 FROM t2 WHERE t2.c1 IS NOT NULL) ORDER BY 1,2,3;
c0	c1	c0	c1
SELECT * FROM t1 FULL JOIN t2 ON t1.c0=t2.c0 WHERE NOT EXISTS (SELECT c1 FROM t2 WHERE t2.c1 IS NOT NULL) ORDER BY 1,2,3;
c0	c1	c0	c1
#HINT
#IF "_optimizer_null_aware_antijoin"=ON,EXPLAIN:HASH JOIN ANTI NA
SELECT /*+USE_HASH(t1,t2)*/ * FROM t1 WHERE c1 NOT IN (SELECT c1 FROM t2) ORDER BY 1,2;
c0	c1
SELECT /*+USE_HASH(t1,t2)*/ * FROM t1 JOIN t2 ON t1.c0=t2.c0 AND t1.c1 <>ALL (SELECT c1 FROM t2) ORDER BY 1,2;
c0	c1	c0	c1
SELECT /*+USE_HASH(t1,t2)*/ * FROM t1 RIGHT JOIN t2 ON t1.c0=t2.c0 WHERE t1.c1 NOT IN (SELECT c1 FROM t2) ORDER BY 1,2;
c0	c1	c0	c1
SELECT /*+USE_NLJ(t1,t2)*/ * FROM t1 RIGHT JOIN t2 ON t1.c0=t2.c0 WHERE t1.c1 NOT IN (SELECT c1 FROM t2) ORDER BY 1,2;
c0	c1	c0	c1
SELECT /*+USE_MJ(t1,t2)*/ * FROM t1 JOIN t2 ON t1.c0=t2.c0 AND t1.c1 <>ALL (SELECT c1 FROM t2) ORDER BY 1,2;
c0	c1	c0	c1
SELECT /*+USE_HASH(t1,t2)*/ * FROM t1 WHERE NOT EXISTS (SELECT c1 FROM t2) ORDER BY 1,2;
c0	c1
SELECT /*+USE_HASH(t1,t2)*/ * FROM t1 WHERE c1 NOT IN (SELECT c1 FROM t2) ORDER BY 1,2;
c0	c1
SELECT /*+USE_NL(t1,t2)*/ * FROM t1 JOIN t2 ON t1.c0=t2.c0 AND t1.c1 <>ALL (SELECT c1 FROM t2) ORDER BY 1,2;
c0	c1	c0	c1
SELECT /*+USE_MJ(t1,t2)*/ * FROM t1 JOIN t2 ON t1.c0=t2.c0 AND t1.c1 <>ALL (SELECT c1 FROM t2) ORDER BY 1,2;
c0	c1	c0	c1
#IF "_optimizer_null_aware_antijoin"=ON,EXPLAIN:HASH JOIN ANTI SNA
SELECT /*+USE_HASH(t1,t2)*/ * FROM t1 WHERE c1 NOT IN (SELECT c1 FROM t2 WHERE t2.c1 IS NOT NULL) ORDER BY 1,2;
c0	c1
SELECT /*+USE_HASH(t1,t2)*/ * FROM t1 JOIN t2 ON t1.c0=t2.c0 AND t1.c1 <>ALL (SELECT c1 FROM t2 WHERE t2.c1 IS NOT NULL) ORDER BY 1,2;
c0	c1	c0	c1
SELECT /*+USE_HASH(t1,t2)*/ * FROM t1 RIGHT JOIN t2 ON t1.c0=t2.c0 WHERE t1.c1 NOT IN (SELECT c1 FROM t2 WHERE t2.c1 IS NOT NULL) ORDER BY 1,2;
c0	c1	c0	c1
SELECT /*+USE_NLJ(t1,t2)*/ * FROM t1 RIGHT JOIN t2 ON t1.c0=t2.c0 WHERE t1.c1 NOT IN (SELECT c1 FROM t2 WHERE t2.c1 IS NOT NULL) ORDER BY 1,2;
c0	c1	c0	c1
SELECT /*+USE_MJ(t1,t2)*/ * FROM t1 JOIN t2 ON t1.c0=t2.c0 AND t1.c1 <>ALL (SELECT c1 FROM t2 WHERE t2.c1 IS NOT NULL) ORDER BY 1,2;
c0	c1	c0	c1
SELECT /*+USE_HASH(t1,t2)*/ * FROM t1 WHERE NOT EXISTS (SELECT c1 FROM t2 WHERE t2.c1 IS NOT NULL) ORDER BY 1,2;
c0	c1
SELECT /*+USE_HASH(t1,t2)*/ * FROM t1 WHERE c1 NOT IN (SELECT c1 FROM t2 WHERE t2.c1 IS NOT NULL) ORDER BY 1,2;
c0	c1
SELECT /*+USE_NL(t1,t2)*/ * FROM t1 JOIN t2 ON t1.c0=t2.c0 AND t1.c1 <>ALL (SELECT c1 FROM t2 WHERE t2.c1 IS NOT NULL) ORDER BY 1,2;
c0	c1	c0	c1
SELECT /*+USE_MJ(t1,t2)*/ * FROM t1 JOIN t2 ON t1.c0=t2.c0 AND t1.c1 <>ALL (SELECT c1 FROM t2 WHERE t2.c1 IS NOT NULL) ORDER BY 1,2;
c0	c1	c0	c1
#PARALLEL
#IF "_optimizer_null_aware_antijoin"=ON,EXPLAIN:HASH JOIN ANTI NA
SELECT /*+parallel(2) USE_HASH(t1,t2)*/ * FROM t1 WHERE c1 NOT IN (SELECT c1 FROM t2) ORDER BY 1,2;
c0	c1
SELECT /*+parallel(2) USE_HASH(t1,t2)*/ * FROM t1 WHERE c1 <>ALL (SELECT c1 FROM t2) ORDER BY 1,2;
c0	c1
SELECT /*+parallel(2) USE_NL(t1,t2)*/ * FROM t1 WHERE c1 <>ALL (SELECT c1 FROM t2) ORDER BY 1,2;
c0	c1
SELECT /*+parallel(2) USE_HASH(t1,t2)*/ * FROM t1 WHERE NOT EXISTS (SELECT c1 FROM t2) ORDER BY 1,2;
c0	c1
SELECT /*+parallel(5) USE_HASH(t1,t2)*/ * FROM t1 WHERE c1 NOT IN (SELECT c1 FROM t2) ORDER BY 1,2;
c0	c1
SELECT /*+parallel(5) USE_NLJ(t1,t2)*/ * FROM t1 WHERE c1 NOT IN (SELECT c1 FROM t2) ORDER BY 1,2;
c0	c1
SELECT /*+parallel(5) USE_HASH(t1,t2)*/ * FROM t1 WHERE c1 <>ALL (SELECT c1 FROM t2) ORDER BY 1,2;
c0	c1
SELECT /*+parallel(5) USE_MJ(t1,t2)*/ * FROM t1 WHERE c1 NOT IN (SELECT c1 FROM t2) ORDER BY 1,2;
c0	c1
SELECT /*+parallel(5) USE_HASH(t1,t2)*/ * FROM t1 WHERE NOT EXISTS (SELECT c1 FROM t2) ORDER BY 1,2;
c0	c1
SELECT /*+parallel(2) USE_HASH(t1,t2)*/ * FROM t1,t2 WHERE t1.c0=t2.c0 AND t1.c1 NOT IN (SELECT c1 FROM t2) ORDER BY 1,2;
c0	c1	c0	c1
SELECT /*+parallel(2) USE_HASH(t1,t2)*/ * FROM t1,t2 WHERE t1.c0=t2.c0 AND t1.c1 <>ALL (SELECT c1 FROM t2) ORDER BY 1,2;
c0	c1	c0	c1
SELECT /*+parallel(2) USE_MJ(t1,t2)*/ * FROM t1,t2 WHERE t1.c0=t2.c0 AND t1.c1 <>ALL (SELECT c1 FROM t2) ORDER BY 1,2;
c0	c1	c0	c1
SELECT /*+parallel(2) USE_NL(t1,t2)*/ * FROM t1,t2 WHERE t1.c0=t2.c0 AND t1.c1 NOT IN (SELECT c1 FROM t2) ORDER BY 1,2;
c0	c1	c0	c1
SELECT /*+parallel(2) USE_HASH(t1,t2)*/ * FROM t1,t2 WHERE t1.c0=t2.c0 AND NOT EXISTS (SELECT c1 FROM t2) ORDER BY 1,2;
c0	c1	c0	c1
#IF "_optimizer_null_aware_antijoin"=ON,EXPLAIN:HASH JOIN ANTI SNA
SELECT /*+parallel(2) USE_HASH(t1,t2)*/ * FROM t1 WHERE c1 NOT IN (SELECT c1 FROM t2 WHERE t2.c1 IS NOT NULL) ORDER BY 1,2;
c0	c1
SELECT /*+parallel(2) USE_HASH(t1,t2)*/ * FROM t1 WHERE c1 <>ALL (SELECT c1 FROM t2 WHERE t2.c1 IS NOT NULL) ORDER BY 1,2;
c0	c1
SELECT /*+parallel(2) USE_NL(t1,t2)*/ * FROM t1 WHERE c1 <>ALL (SELECT c1 FROM t2 WHERE t2.c1 IS NOT NULL) ORDER BY 1,2;
c0	c1
SELECT /*+parallel(2) USE_HASH(t1,t2)*/ * FROM t1 WHERE NOT EXISTS (SELECT c1 FROM t2 WHERE t2.c1 IS NOT NULL) ORDER BY 1,2;
c0	c1
SELECT /*+parallel(5) USE_HASH(t1,t2)*/ * FROM t1 WHERE c1 NOT IN (SELECT c1 FROM t2 WHERE t2.c1 IS NOT NULL) ORDER BY 1,2;
c0	c1
SELECT /*+parallel(5) USE_NLJ(t1,t2)*/ * FROM t1 WHERE c1 NOT IN (SELECT c1 FROM t2 WHERE t2.c1 IS NOT NULL) ORDER BY 1,2;
c0	c1
SELECT /*+parallel(5) USE_HASH(t1,t2)*/ * FROM t1 WHERE c1 <>ALL (SELECT c1 FROM t2 WHERE t2.c1 IS NOT NULL) ORDER BY 1,2;
c0	c1
SELECT /*+parallel(5) USE_MJ(t1,t2)*/ * FROM t1 WHERE c1 NOT IN (SELECT c1 FROM t2 WHERE t2.c1 IS NOT NULL) ORDER BY 1,2;
c0	c1
SELECT /*+parallel(5) USE_HASH(t1,t2)*/ * FROM t1 WHERE NOT EXISTS (SELECT c1 FROM t2 WHERE t2.c1 IS NOT NULL) ORDER BY 1,2;
c0	c1
SELECT /*+parallel(2) USE_HASH(t1,t2)*/ * FROM t1,t2 WHERE t1.c0=t2.c0 AND t1.c1 NOT IN (SELECT c1 FROM t2 WHERE t2.c1 IS NOT NULL) ORDER BY 1,2;
c0	c1	c0	c1
SELECT /*+parallel(2) USE_HASH(t1,t2)*/ * FROM t1,t2 WHERE t1.c0=t2.c0 AND t1.c1 <>ALL (SELECT c1 FROM t2 WHERE t2.c1 IS NOT NULL) ORDER BY 1,2;
c0	c1	c0	c1
SELECT /*+parallel(2) USE_MJ(t1,t2)*/ * FROM t1,t2 WHERE t1.c0=t2.c0 AND t1.c1 <>ALL (SELECT c1 FROM t2 WHERE t2.c1 IS NOT NULL) ORDER BY 1,2;
c0	c1	c0	c1
SELECT /*+parallel(2) USE_NL(t1,t2)*/ * FROM t1,t2 WHERE t1.c0=t2.c0 AND t1.c1 NOT IN (SELECT c1 FROM t2 WHERE t2.c1 IS NOT NULL) ORDER BY 1,2;
c0	c1	c0	c1
SELECT /*+parallel(2) USE_HASH(t1,t2)*/ * FROM t1,t2 WHERE t1.c0=t2.c0 AND NOT EXISTS (SELECT c1 FROM t2 WHERE t2.c1 IS NOT NULL) ORDER BY 1,2;
c0	c1	c0	c1
#right table is empty
DELETE FROM t2;
INSERT INTO t1 VALUES(1,'A');
INSERT INTO t1 VALUES(2,'A');
INSERT INTO t1 VALUES(3,12);
INSERT INTO t1 VALUES(4,NULL);
INSERT INTO t1 VALUES(5,'%-$');
INSERT INTO t1 VALUES(6,'AB');
INSERT INTO t1 VALUES(7,'');
SELECT * FROM t1 ORDER BY c0,c1;
c0	c1
1	A
2	A
3	12
4	NULL
5	%-$
6	AB
7	
SELECT * FROM t2 ORDER BY c0,c1;
c0	c1
#IF "_optimizer_null_aware_antijoin"=ON,EXPLAIN:HASH JOIN ANTI NA
SELECT * FROM t1 WHERE c1 NOT IN (SELECT c1 FROM t2) ORDER BY 1,2;
c0	c1
1	A
2	A
3	12
4	NULL
5	%-$
6	AB
7	
SELECT * FROM t1 WHERE NOT EXISTS (SELECT c1 FROM t2) ORDER BY 1,2;
c0	c1
1	A
2	A
3	12
4	NULL
5	%-$
6	AB
7	
#IF "_optimizer_null_aware_antijoin"=TRUE,EXPLAIN:HASH JOIN ANTI SNA
SELECT * FROM t1 WHERE c1 NOT IN (SELECT c1 FROM t2 WHERE t2.c1 IS NOT NULL) ORDER BY 1,2;
c0	c1
1	A
2	A
3	12
4	NULL
5	%-$
6	AB
7	
SELECT * FROM t1 WHERE NOT EXISTS (SELECT c1 FROM t2 WHERE t2.c1 IS NOT NULL) ORDER BY 1,2;
c0	c1
1	A
2	A
3	12
4	NULL
5	%-$
6	AB
7	
#INNER JOIN
#IF "_optimizer_null_aware_antijoin"=ON,EXPLAIN:HASH JOIN ANTI NA
SELECT * FROM t1 JOIN t2 ON t1.c0=t2.c0 AND t1.c1 NOT IN (SELECT c1 FROM t2) ORDER BY 1,2;
c0	c1	c0	c1
SELECT * FROM t1 JOIN t2 ON t1.c0=t2.c0 AND NOT EXISTS (SELECT c1 FROM t2) ORDER BY 1,2;
c0	c1	c0	c1
#IF "_optimizer_null_aware_antijoin"=TRUE,EXPLAIN:HASH JOIN ANTI SNA
SELECT * FROM t1 JOIN t2 ON t1.c0=t2.c0 AND t1.c1 NOT IN (SELECT c1 FROM t2 WHERE t2.c1 IS NOT NULL) ORDER BY 1,2;
c0	c1	c0	c1
SELECT * FROM t1 JOIN t2 ON t1.c0=t2.c0 AND NOT EXISTS (SELECT c1 FROM t2 WHERE t2.c1 IS NOT NULL) ORDER BY 1,2;
c0	c1	c0	c1
#RIGHT JOIN
#IF "_optimizer_null_aware_antijoin"=ON,EXPLAIN:HASH JOIN ANTI NA
SELECT * FROM t1 RIGHT JOIN t2 ON t1.c0=t2.c0 AND t1.c1 NOT IN (SELECT c1 FROM t2) ORDER BY 1,2,3;
c0	c1	c0	c1
SELECT * FROM t1 RIGHT JOIN t2 ON t1.c0=t2.c0 AND t1.c1 <>ALL (SELECT c1 FROM t2) ORDER BY 1,2,3;
c0	c1	c0	c1
SELECT * FROM t1 RIGHT JOIN t2 ON t1.c0=t2.c0 AND NOT EXISTS (SELECT c1 FROM t2) ORDER BY 1,2,3;
c0	c1	c0	c1
#IF "_optimizer_null_aware_antijoin"=ON,EXPLAIN:HASH JOIN ANTI SNA
SELECT * FROM t1 RIGHT JOIN t2 ON t1.c0=t2.c0 AND t1.c1 NOT IN (SELECT c1 FROM t2 WHERE t2.c1 IS NOT NULL) ORDER BY 1,2,3;
c0	c1	c0	c1
SELECT * FROM t1 RIGHT JOIN t2 ON t1.c0=t2.c0 AND t1.c1 <>ALL (SELECT c1 FROM t2 WHERE t2.c1 IS NOT NULL) ORDER BY 1,2,3;
c0	c1	c0	c1
SELECT * FROM t1 RIGHT JOIN t2 ON t1.c0=t2.c0 AND NOT EXISTS (SELECT c1 FROM t2 WHERE t2.c1 IS NOT NULL) ORDER BY 1,2,3;
c0	c1	c0	c1
#LEFT JOIN
#IF "_optimizer_null_aware_antijoin"=ON,EXPLAIN:HASH JOIN ANTI NA
SELECT * FROM t1 LEFT JOIN t2 ON t1.c0=t2.c0 WHERE t1.c1 NOT IN (SELECT c1 FROM t2) ORDER BY 1,2;
c0	c1	c0	c1
1	A	NULL	NULL
2	A	NULL	NULL
3	12	NULL	NULL
4	NULL	NULL	NULL
5	%-$	NULL	NULL
6	AB	NULL	NULL
7		NULL	NULL
SELECT * FROM t1 LEFT JOIN t2 ON t1.c0=t2.c0 WHERE t1.c1 <>ALL (SELECT c1 FROM t2) ORDER BY 1,2;
c0	c1	c0	c1
1	A	NULL	NULL
2	A	NULL	NULL
3	12	NULL	NULL
4	NULL	NULL	NULL
5	%-$	NULL	NULL
6	AB	NULL	NULL
7		NULL	NULL
SELECT * FROM t1 LEFT JOIN t2 ON t1.c0=t2.c0 WHERE NOT EXISTS (SELECT c1 FROM t2) ORDER BY 1,2;
c0	c1	c0	c1
1	A	NULL	NULL
2	A	NULL	NULL
3	12	NULL	NULL
4	NULL	NULL	NULL
5	%-$	NULL	NULL
6	AB	NULL	NULL
7		NULL	NULL
#IF "_optimizer_null_aware_antijoin"=ON,EXPLAIN:HASH JOIN ANTI SNA
SELECT * FROM t1 LEFT JOIN t2 ON t1.c0=t2.c0 WHERE t1.c1 NOT IN (SELECT c1 FROM t2 WHERE t2.c1 IS NOT NULL) ORDER BY 1,2,3;
c0	c1	c0	c1
1	A	NULL	NULL
2	A	NULL	NULL
3	12	NULL	NULL
4	NULL	NULL	NULL
5	%-$	NULL	NULL
6	AB	NULL	NULL
7		NULL	NULL
SELECT * FROM t1 LEFT JOIN t2 ON t1.c0=t2.c0 WHERE t1.c1 <>ALL (SELECT c1 FROM t2 WHERE t2.c1 IS NOT NULL) ORDER BY 1,2,3;
c0	c1	c0	c1
1	A	NULL	NULL
2	A	NULL	NULL
3	12	NULL	NULL
4	NULL	NULL	NULL
5	%-$	NULL	NULL
6	AB	NULL	NULL
7		NULL	NULL
SELECT * FROM t1 LEFT JOIN t2 ON t1.c0=t2.c0 WHERE NOT EXISTS (SELECT c1 FROM t2 WHERE t2.c1 IS NOT NULL) ORDER BY 1,2,3;
c0	c1	c0	c1
1	A	NULL	NULL
2	A	NULL	NULL
3	12	NULL	NULL
4	NULL	NULL	NULL
5	%-$	NULL	NULL
6	AB	NULL	NULL
7		NULL	NULL
#FULL JOIN
#IF "_optimizer_null_aware_antijoin"=ON,EXPLAIN:HASH JOIN ANTI NA
SELECT * FROM t1 FULL JOIN t2 ON t1.c0=t2.c0 WHERE t1.c1 NOT IN (SELECT c1 FROM t2) ORDER BY 1,2;
c0	c1	c0	c1
1	A	NULL	NULL
2	A	NULL	NULL
3	12	NULL	NULL
4	NULL	NULL	NULL
5	%-$	NULL	NULL
6	AB	NULL	NULL
7		NULL	NULL
SELECT * FROM t1 FULL JOIN t2 ON t1.c0=t2.c0 WHERE t1.c1 <>ALL (SELECT c1 FROM t2) ORDER BY 1,2;
c0	c1	c0	c1
1	A	NULL	NULL
2	A	NULL	NULL
3	12	NULL	NULL
4	NULL	NULL	NULL
5	%-$	NULL	NULL
6	AB	NULL	NULL
7		NULL	NULL
SELECT * FROM t1 FULL JOIN t2 ON t1.c0=t2.c0 WHERE NOT EXISTS (SELECT c1 FROM t2) ORDER BY 1,2;
c0	c1	c0	c1
1	A	NULL	NULL
2	A	NULL	NULL
3	12	NULL	NULL
4	NULL	NULL	NULL
5	%-$	NULL	NULL
6	AB	NULL	NULL
7		NULL	NULL
#IF "_optimizer_null_aware_antijoin"=ON,EXPLAIN:HASH JOIN ANTI SNA
SELECT * FROM t1 FULL JOIN t2 ON t1.c0=t2.c0 WHERE t1.c1 NOT IN (SELECT c1 FROM t2 WHERE t2.c1 IS NOT NULL) ORDER BY 1,2,3;
c0	c1	c0	c1
1	A	NULL	NULL
2	A	NULL	NULL
3	12	NULL	NULL
4	NULL	NULL	NULL
5	%-$	NULL	NULL
6	AB	NULL	NULL
7		NULL	NULL
SELECT * FROM t1 FULL JOIN t2 ON t1.c0=t2.c0 WHERE t1.c1 <>ALL (SELECT c1 FROM t2 WHERE t2.c1 IS NOT NULL) ORDER BY 1,2,3;
c0	c1	c0	c1
1	A	NULL	NULL
2	A	NULL	NULL
3	12	NULL	NULL
4	NULL	NULL	NULL
5	%-$	NULL	NULL
6	AB	NULL	NULL
7		NULL	NULL
SELECT * FROM t1 FULL JOIN t2 ON t1.c0=t2.c0 WHERE NOT EXISTS (SELECT c1 FROM t2 WHERE t2.c1 IS NOT NULL) ORDER BY 1,2,3;
c0	c1	c0	c1
1	A	NULL	NULL
2	A	NULL	NULL
3	12	NULL	NULL
4	NULL	NULL	NULL
5	%-$	NULL	NULL
6	AB	NULL	NULL
7		NULL	NULL
#HINT
#IF "_optimizer_null_aware_antijoin"=ON,EXPLAIN:HASH JOIN ANTI NA
SELECT /*+USE_HASH(t1,t2)*/ * FROM t1 WHERE c1 NOT IN (SELECT c1 FROM t2) ORDER BY 1,2;
c0	c1
1	A
2	A
3	12
4	NULL
5	%-$
6	AB
7	
SELECT /*+USE_HASH(t1,t2)*/ * FROM t1 JOIN t2 ON t1.c0=t2.c0 AND t1.c1 <>ALL (SELECT c1 FROM t2) ORDER BY 1,2;
c0	c1	c0	c1
SELECT /*+USE_HASH(t1,t2)*/ * FROM t1 RIGHT JOIN t2 ON t1.c0=t2.c0 WHERE t1.c1 NOT IN (SELECT c1 FROM t2) ORDER BY 1,2;
c0	c1	c0	c1
SELECT /*+USE_NLJ(t1,t2)*/ * FROM t1 RIGHT JOIN t2 ON t1.c0=t2.c0 WHERE t1.c1 NOT IN (SELECT c1 FROM t2) ORDER BY 1,2;
c0	c1	c0	c1
SELECT /*+USE_MJ(t1,t2)*/ * FROM t1 JOIN t2 ON t1.c0=t2.c0 AND t1.c1 <>ALL (SELECT c1 FROM t2) ORDER BY 1,2;
c0	c1	c0	c1
SELECT /*+USE_HASH(t1,t2)*/ * FROM t1 WHERE NOT EXISTS (SELECT c1 FROM t2) ORDER BY 1,2;
c0	c1
1	A
2	A
3	12
4	NULL
5	%-$
6	AB
7	
SELECT /*+USE_HASH(t1,t2)*/ * FROM t1 WHERE c1 NOT IN (SELECT c1 FROM t2) ORDER BY 1,2;
c0	c1
1	A
2	A
3	12
4	NULL
5	%-$
6	AB
7	
SELECT /*+USE_NL(t1,t2)*/ * FROM t1 JOIN t2 ON t1.c0=t2.c0 AND t1.c1 <>ALL (SELECT c1 FROM t2) ORDER BY 1,2;
c0	c1	c0	c1
SELECT /*+USE_MJ(t1,t2)*/ * FROM t1 JOIN t2 ON t1.c0=t2.c0 AND t1.c1 <>ALL (SELECT c1 FROM t2) ORDER BY 1,2;
c0	c1	c0	c1
#IF "_optimizer_null_aware_antijoin"=ON,EXPLAIN:HASH JOIN ANTI SNA
SELECT /*+USE_HASH(t1,t2)*/ * FROM t1 WHERE c1 NOT IN (SELECT c1 FROM t2 WHERE t2.c1 IS NOT NULL) ORDER BY 1,2;
c0	c1
1	A
2	A
3	12
4	NULL
5	%-$
6	AB
7	
SELECT /*+USE_HASH(t1,t2)*/ * FROM t1 JOIN t2 ON t1.c0=t2.c0 AND t1.c1 <>ALL (SELECT c1 FROM t2 WHERE t2.c1 IS NOT NULL) ORDER BY 1,2;
c0	c1	c0	c1
SELECT /*+USE_HASH(t1,t2)*/ * FROM t1 RIGHT JOIN t2 ON t1.c0=t2.c0 WHERE t1.c1 NOT IN (SELECT c1 FROM t2 WHERE t2.c1 IS NOT NULL) ORDER BY 1,2;
c0	c1	c0	c1
SELECT /*+USE_NLJ(t1,t2)*/ * FROM t1 RIGHT JOIN t2 ON t1.c0=t2.c0 WHERE t1.c1 NOT IN (SELECT c1 FROM t2 WHERE t2.c1 IS NOT NULL) ORDER BY 1,2;
c0	c1	c0	c1
SELECT /*+USE_MJ(t1,t2)*/ * FROM t1 JOIN t2 ON t1.c0=t2.c0 AND t1.c1 <>ALL (SELECT c1 FROM t2 WHERE t2.c1 IS NOT NULL) ORDER BY 1,2;
c0	c1	c0	c1
SELECT /*+USE_HASH(t1,t2)*/ * FROM t1 WHERE NOT EXISTS (SELECT c1 FROM t2 WHERE t2.c1 IS NOT NULL) ORDER BY 1,2;
c0	c1
1	A
2	A
3	12
4	NULL
5	%-$
6	AB
7	
SELECT /*+USE_HASH(t1,t2)*/ * FROM t1 WHERE c1 NOT IN (SELECT c1 FROM t2 WHERE t2.c1 IS NOT NULL) ORDER BY 1,2;
c0	c1
1	A
2	A
3	12
4	NULL
5	%-$
6	AB
7	
SELECT /*+USE_NL(t1,t2)*/ * FROM t1 JOIN t2 ON t1.c0=t2.c0 AND t1.c1 <>ALL (SELECT c1 FROM t2 WHERE t2.c1 IS NOT NULL) ORDER BY 1,2;
c0	c1	c0	c1
SELECT /*+USE_MJ(t1,t2)*/ * FROM t1 JOIN t2 ON t1.c0=t2.c0 AND t1.c1 <>ALL (SELECT c1 FROM t2 WHERE t2.c1 IS NOT NULL) ORDER BY 1,2;
c0	c1	c0	c1
#PARALLEL
#IF "_optimizer_null_aware_antijoin"=ON,EXPLAIN:HASH JOIN ANTI NA
SELECT /*+parallel(2) USE_HASH(t1,t2)*/ * FROM t1 WHERE c1 NOT IN (SELECT c1 FROM t2) ORDER BY 1,2;
c0	c1
1	A
2	A
3	12
4	NULL
5	%-$
6	AB
7	
SELECT /*+parallel(2) USE_HASH(t1,t2)*/ * FROM t1 WHERE c1 <>ALL (SELECT c1 FROM t2) ORDER BY 1,2;
c0	c1
1	A
2	A
3	12
4	NULL
5	%-$
6	AB
7	
SELECT /*+parallel(2) USE_NL(t1,t2)*/ * FROM t1 WHERE c1 <>ALL (SELECT c1 FROM t2) ORDER BY 1,2;
c0	c1
1	A
2	A
3	12
4	NULL
5	%-$
6	AB
7	
SELECT /*+parallel(2) USE_HASH(t1,t2)*/ * FROM t1 WHERE NOT EXISTS (SELECT c1 FROM t2) ORDER BY 1,2;
c0	c1
1	A
2	A
3	12
4	NULL
5	%-$
6	AB
7	
SELECT /*+parallel(5) USE_HASH(t1,t2)*/ * FROM t1 WHERE c1 NOT IN (SELECT c1 FROM t2) ORDER BY 1,2;
c0	c1
1	A
2	A
3	12
4	NULL
5	%-$
6	AB
7	
SELECT /*+parallel(5) USE_NLJ(t1,t2)*/ * FROM t1 WHERE c1 NOT IN (SELECT c1 FROM t2) ORDER BY 1,2;
c0	c1
1	A
2	A
3	12
4	NULL
5	%-$
6	AB
7	
SELECT /*+parallel(5) USE_HASH(t1,t2)*/ * FROM t1 WHERE c1 <>ALL (SELECT c1 FROM t2) ORDER BY 1,2;
c0	c1
1	A
2	A
3	12
4	NULL
5	%-$
6	AB
7	
SELECT /*+parallel(5) USE_MJ(t1,t2)*/ * FROM t1 WHERE c1 NOT IN (SELECT c1 FROM t2) ORDER BY 1,2;
c0	c1
1	A
2	A
3	12
4	NULL
5	%-$
6	AB
7	
SELECT /*+parallel(5) USE_HASH(t1,t2)*/ * FROM t1 WHERE NOT EXISTS (SELECT c1 FROM t2) ORDER BY 1,2;
c0	c1
1	A
2	A
3	12
4	NULL
5	%-$
6	AB
7	
SELECT /*+parallel(2) USE_HASH(t1,t2)*/ * FROM t1,t2 WHERE t1.c0=t2.c0 AND t1.c1 NOT IN (SELECT c1 FROM t2) ORDER BY 1,2;
c0	c1	c0	c1
SELECT /*+parallel(2) USE_HASH(t1,t2)*/ * FROM t1,t2 WHERE t1.c0=t2.c0 AND t1.c1 <>ALL (SELECT c1 FROM t2) ORDER BY 1,2;
c0	c1	c0	c1
SELECT /*+parallel(2) USE_MJ(t1,t2)*/ * FROM t1,t2 WHERE t1.c0=t2.c0 AND t1.c1 <>ALL (SELECT c1 FROM t2) ORDER BY 1,2;
c0	c1	c0	c1
SELECT /*+parallel(2) USE_NL(t1,t2)*/ * FROM t1,t2 WHERE t1.c0=t2.c0 AND t1.c1 NOT IN (SELECT c1 FROM t2) ORDER BY 1,2;
c0	c1	c0	c1
SELECT /*+parallel(2) USE_HASH(t1,t2)*/ * FROM t1,t2 WHERE t1.c0=t2.c0 AND NOT EXISTS (SELECT c1 FROM t2) ORDER BY 1,2;
c0	c1	c0	c1
#IF "_optimizer_null_aware_antijoin"=ON,EXPLAIN:HASH JOIN ANTI SNA
SELECT /*+parallel(2) USE_HASH(t1,t2)*/ * FROM t1 WHERE c1 NOT IN (SELECT c1 FROM t2 WHERE t2.c1 IS NOT NULL) ORDER BY 1,2;
c0	c1
1	A
2	A
3	12
4	NULL
5	%-$
6	AB
7	
SELECT /*+parallel(2) USE_HASH(t1,t2)*/ * FROM t1 WHERE c1 <>ALL (SELECT c1 FROM t2 WHERE t2.c1 IS NOT NULL) ORDER BY 1,2;
c0	c1
1	A
2	A
3	12
4	NULL
5	%-$
6	AB
7	
SELECT /*+parallel(2) USE_NL(t1,t2)*/ * FROM t1 WHERE c1 <>ALL (SELECT c1 FROM t2 WHERE t2.c1 IS NOT NULL) ORDER BY 1,2;
c0	c1
1	A
2	A
3	12
4	NULL
5	%-$
6	AB
7	
SELECT /*+parallel(2) USE_HASH(t1,t2)*/ * FROM t1 WHERE NOT EXISTS (SELECT c1 FROM t2 WHERE t2.c1 IS NOT NULL) ORDER BY 1,2;
c0	c1
1	A
2	A
3	12
4	NULL
5	%-$
6	AB
7	
SELECT /*+parallel(5) USE_HASH(t1,t2)*/ * FROM t1 WHERE c1 NOT IN (SELECT c1 FROM t2 WHERE t2.c1 IS NOT NULL) ORDER BY 1,2;
c0	c1
1	A
2	A
3	12
4	NULL
5	%-$
6	AB
7	
SELECT /*+parallel(5) USE_NLJ(t1,t2)*/ * FROM t1 WHERE c1 NOT IN (SELECT c1 FROM t2 WHERE t2.c1 IS NOT NULL) ORDER BY 1,2;
c0	c1
1	A
2	A
3	12
4	NULL
5	%-$
6	AB
7	
SELECT /*+parallel(5) USE_HASH(t1,t2)*/ * FROM t1 WHERE c1 <>ALL (SELECT c1 FROM t2 WHERE t2.c1 IS NOT NULL) ORDER BY 1,2;
c0	c1
1	A
2	A
3	12
4	NULL
5	%-$
6	AB
7	
SELECT /*+parallel(5) USE_MJ(t1,t2)*/ * FROM t1 WHERE c1 NOT IN (SELECT c1 FROM t2 WHERE t2.c1 IS NOT NULL) ORDER BY 1,2;
c0	c1
1	A
2	A
3	12
4	NULL
5	%-$
6	AB
7	
SELECT /*+parallel(5) USE_HASH(t1,t2)*/ * FROM t1 WHERE NOT EXISTS (SELECT c1 FROM t2 WHERE t2.c1 IS NOT NULL) ORDER BY 1,2;
c0	c1
1	A
2	A
3	12
4	NULL
5	%-$
6	AB
7	
SELECT /*+parallel(2) USE_HASH(t1,t2)*/ * FROM t1,t2 WHERE t1.c0=t2.c0 AND t1.c1 NOT IN (SELECT c1 FROM t2 WHERE t2.c1 IS NOT NULL) ORDER BY 1,2;
c0	c1	c0	c1
SELECT /*+parallel(2) USE_HASH(t1,t2)*/ * FROM t1,t2 WHERE t1.c0=t2.c0 AND t1.c1 <>ALL (SELECT c1 FROM t2 WHERE t2.c1 IS NOT NULL) ORDER BY 1,2;
c0	c1	c0	c1
SELECT /*+parallel(2) USE_MJ(t1,t2)*/ * FROM t1,t2 WHERE t1.c0=t2.c0 AND t1.c1 <>ALL (SELECT c1 FROM t2 WHERE t2.c1 IS NOT NULL) ORDER BY 1,2;
c0	c1	c0	c1
SELECT /*+parallel(2) USE_NL(t1,t2)*/ * FROM t1,t2 WHERE t1.c0=t2.c0 AND t1.c1 NOT IN (SELECT c1 FROM t2 WHERE t2.c1 IS NOT NULL) ORDER BY 1,2;
c0	c1	c0	c1
SELECT /*+parallel(2) USE_HASH(t1,t2)*/ * FROM t1,t2 WHERE t1.c0=t2.c0 AND NOT EXISTS (SELECT c1 FROM t2 WHERE t2.c1 IS NOT NULL) ORDER BY 1,2;
c0	c1	c0	c1
#The left and right tables are empty
DELETE FROM t2;
DELETE FROM t1;
SELECT * FROM t1 ORDER BY c0,c1;
c0	c1
SELECT * FROM t2 ORDER BY c0,c1;
c0	c1
#IF "_optimizer_null_aware_antijoin"=ON,EXPLAIN:HASH JOIN ANTI NA
SELECT * FROM t1 WHERE c1 NOT IN (SELECT c1 FROM t2) ORDER BY 1,2;
c0	c1
SELECT * FROM t1 WHERE NOT EXISTS (SELECT c1 FROM t2) ORDER BY 1,2;
c0	c1
#IF "_optimizer_null_aware_antijoin"=TRUE,EXPLAIN:HASH JOIN ANTI SNA
SELECT * FROM t1 WHERE c1 NOT IN (SELECT c1 FROM t2 WHERE t2.c1 IS NOT NULL) ORDER BY 1,2;
c0	c1
SELECT * FROM t1 WHERE NOT EXISTS (SELECT c1 FROM t2 WHERE t2.c1 IS NOT NULL) ORDER BY 1,2;
c0	c1
#INNER JOIN
#IF "_optimizer_null_aware_antijoin"=ON,EXPLAIN:HASH JOIN ANTI NA
SELECT * FROM t1 JOIN t2 ON t1.c0=t2.c0 AND t1.c1 NOT IN (SELECT c1 FROM t2) ORDER BY 1,2;
c0	c1	c0	c1
SELECT * FROM t1 JOIN t2 ON t1.c0=t2.c0 AND NOT EXISTS (SELECT c1 FROM t2) ORDER BY 1,2;
c0	c1	c0	c1
#IF "_optimizer_null_aware_antijoin"=TRUE,EXPLAIN:HASH JOIN ANTI SNA
SELECT * FROM t1 JOIN t2 ON t1.c0=t2.c0 AND t1.c1 NOT IN (SELECT c1 FROM t2 WHERE t2.c1 IS NOT NULL) ORDER BY 1,2;
c0	c1	c0	c1
SELECT * FROM t1 JOIN t2 ON t1.c0=t2.c0 AND NOT EXISTS (SELECT c1 FROM t2 WHERE t2.c1 IS NOT NULL) ORDER BY 1,2;
c0	c1	c0	c1
#RIGHT JOIN
#IF "_optimizer_null_aware_antijoin"=ON,EXPLAIN:HASH JOIN ANTI NA
SELECT * FROM t1 RIGHT JOIN t2 ON t1.c0=t2.c0 AND t1.c1 NOT IN (SELECT c1 FROM t2) ORDER BY 1,2,3;
c0	c1	c0	c1
SELECT * FROM t1 RIGHT JOIN t2 ON t1.c0=t2.c0 AND t1.c1 <>ALL (SELECT c1 FROM t2) ORDER BY 1,2,3;
c0	c1	c0	c1
SELECT * FROM t1 RIGHT JOIN t2 ON t1.c0=t2.c0 AND NOT EXISTS (SELECT c1 FROM t2) ORDER BY 1,2,3;
c0	c1	c0	c1
#IF "_optimizer_null_aware_antijoin"=ON,EXPLAIN:HASH JOIN ANTI SNA
SELECT * FROM t1 RIGHT JOIN t2 ON t1.c0=t2.c0 AND t1.c1 NOT IN (SELECT c1 FROM t2 WHERE t2.c1 IS NOT NULL) ORDER BY 1,2,3;
c0	c1	c0	c1
SELECT * FROM t1 RIGHT JOIN t2 ON t1.c0=t2.c0 AND t1.c1 <>ALL (SELECT c1 FROM t2 WHERE t2.c1 IS NOT NULL) ORDER BY 1,2,3;
c0	c1	c0	c1
SELECT * FROM t1 RIGHT JOIN t2 ON t1.c0=t2.c0 AND NOT EXISTS (SELECT c1 FROM t2 WHERE t2.c1 IS NOT NULL) ORDER BY 1,2,3;
c0	c1	c0	c1
#LEFT JOIN
#IF "_optimizer_null_aware_antijoin"=ON,EXPLAIN:HASH JOIN ANTI NA
SELECT * FROM t1 LEFT JOIN t2 ON t1.c0=t2.c0 WHERE t1.c1 NOT IN (SELECT c1 FROM t2) ORDER BY 1,2;
c0	c1	c0	c1
SELECT * FROM t1 LEFT JOIN t2 ON t1.c0=t2.c0 WHERE t1.c1 <>ALL (SELECT c1 FROM t2) ORDER BY 1,2;
c0	c1	c0	c1
SELECT * FROM t1 LEFT JOIN t2 ON t1.c0=t2.c0 WHERE NOT EXISTS (SELECT c1 FROM t2) ORDER BY 1,2;
c0	c1	c0	c1
#IF "_optimizer_null_aware_antijoin"=ON,EXPLAIN:HASH JOIN ANTI SNA
SELECT * FROM t1 LEFT JOIN t2 ON t1.c0=t2.c0 WHERE t1.c1 NOT IN (SELECT c1 FROM t2 WHERE t2.c1 IS NOT NULL) ORDER BY 1,2,3;
c0	c1	c0	c1
SELECT * FROM t1 LEFT JOIN t2 ON t1.c0=t2.c0 WHERE t1.c1 <>ALL (SELECT c1 FROM t2 WHERE t2.c1 IS NOT NULL) ORDER BY 1,2,3;
c0	c1	c0	c1
SELECT * FROM t1 LEFT JOIN t2 ON t1.c0=t2.c0 WHERE NOT EXISTS (SELECT c1 FROM t2 WHERE t2.c1 IS NOT NULL) ORDER BY 1,2,3;
c0	c1	c0	c1
#FULL JOIN
#IF "_optimizer_null_aware_antijoin"=ON,EXPLAIN:HASH JOIN ANTI NA
SELECT * FROM t1 FULL JOIN t2 ON t1.c0=t2.c0 WHERE t1.c1 NOT IN (SELECT c1 FROM t2) ORDER BY 1,2;
c0	c1	c0	c1
SELECT * FROM t1 FULL JOIN t2 ON t1.c0=t2.c0 WHERE t1.c1 <>ALL (SELECT c1 FROM t2) ORDER BY 1,2;
c0	c1	c0	c1
SELECT * FROM t1 FULL JOIN t2 ON t1.c0=t2.c0 WHERE NOT EXISTS (SELECT c1 FROM t2) ORDER BY 1,2;
c0	c1	c0	c1
#IF "_optimizer_null_aware_antijoin"=ON,EXPLAIN:HASH JOIN ANTI SNA
SELECT * FROM t1 FULL JOIN t2 ON t1.c0=t2.c0 WHERE t1.c1 NOT IN (SELECT c1 FROM t2 WHERE t2.c1 IS NOT NULL) ORDER BY 1,2,3;
c0	c1	c0	c1
SELECT * FROM t1 FULL JOIN t2 ON t1.c0=t2.c0 WHERE t1.c1 <>ALL (SELECT c1 FROM t2 WHERE t2.c1 IS NOT NULL) ORDER BY 1,2,3;
c0	c1	c0	c1
SELECT * FROM t1 FULL JOIN t2 ON t1.c0=t2.c0 WHERE NOT EXISTS (SELECT c1 FROM t2 WHERE t2.c1 IS NOT NULL) ORDER BY 1,2,3;
c0	c1	c0	c1
#HINT
#IF "_optimizer_null_aware_antijoin"=ON,EXPLAIN:HASH JOIN ANTI NA
SELECT /*+USE_HASH(t1,t2)*/ * FROM t1 WHERE c1 NOT IN (SELECT c1 FROM t2) ORDER BY 1,2;
c0	c1
SELECT /*+USE_HASH(t1,t2)*/ * FROM t1 JOIN t2 ON t1.c0=t2.c0 AND t1.c1 <>ALL (SELECT c1 FROM t2) ORDER BY 1,2;
c0	c1	c0	c1
SELECT /*+USE_HASH(t1,t2)*/ * FROM t1 RIGHT JOIN t2 ON t1.c0=t2.c0 WHERE t1.c1 NOT IN (SELECT c1 FROM t2) ORDER BY 1,2;
c0	c1	c0	c1
SELECT /*+USE_NLJ(t1,t2)*/ * FROM t1 RIGHT JOIN t2 ON t1.c0=t2.c0 WHERE t1.c1 NOT IN (SELECT c1 FROM t2) ORDER BY 1,2;
c0	c1	c0	c1
SELECT /*+USE_MJ(t1,t2)*/ * FROM t1 JOIN t2 ON t1.c0=t2.c0 AND t1.c1 <>ALL (SELECT c1 FROM t2) ORDER BY 1,2;
c0	c1	c0	c1
SELECT /*+USE_HASH(t1,t2)*/ * FROM t1 WHERE NOT EXISTS (SELECT c1 FROM t2) ORDER BY 1,2;
c0	c1
SELECT /*+USE_HASH(t1,t2)*/ * FROM t1 WHERE c1 NOT IN (SELECT c1 FROM t2) ORDER BY 1,2;
c0	c1
SELECT /*+USE_NL(t1,t2)*/ * FROM t1 JOIN t2 ON t1.c0=t2.c0 AND t1.c1 <>ALL (SELECT c1 FROM t2) ORDER BY 1,2;
c0	c1	c0	c1
SELECT /*+USE_MJ(t1,t2)*/ * FROM t1 JOIN t2 ON t1.c0=t2.c0 AND t1.c1 <>ALL (SELECT c1 FROM t2) ORDER BY 1,2;
c0	c1	c0	c1
#IF "_optimizer_null_aware_antijoin"=ON,EXPLAIN:HASH JOIN ANTI SNA
SELECT /*+USE_HASH(t1,t2)*/ * FROM t1 WHERE c1 NOT IN (SELECT c1 FROM t2 WHERE t2.c1 IS NOT NULL) ORDER BY 1,2;
c0	c1
SELECT /*+USE_HASH(t1,t2)*/ * FROM t1 JOIN t2 ON t1.c0=t2.c0 AND t1.c1 <>ALL (SELECT c1 FROM t2 WHERE t2.c1 IS NOT NULL) ORDER BY 1,2;
c0	c1	c0	c1
SELECT /*+USE_HASH(t1,t2)*/ * FROM t1 RIGHT JOIN t2 ON t1.c0=t2.c0 WHERE t1.c1 NOT IN (SELECT c1 FROM t2 WHERE t2.c1 IS NOT NULL) ORDER BY 1,2;
c0	c1	c0	c1
SELECT /*+USE_NLJ(t1,t2)*/ * FROM t1 RIGHT JOIN t2 ON t1.c0=t2.c0 WHERE t1.c1 NOT IN (SELECT c1 FROM t2 WHERE t2.c1 IS NOT NULL) ORDER BY 1,2;
c0	c1	c0	c1
SELECT /*+USE_MJ(t1,t2)*/ * FROM t1 JOIN t2 ON t1.c0=t2.c0 AND t1.c1 <>ALL (SELECT c1 FROM t2 WHERE t2.c1 IS NOT NULL) ORDER BY 1,2;
c0	c1	c0	c1
SELECT /*+USE_HASH(t1,t2)*/ * FROM t1 WHERE NOT EXISTS (SELECT c1 FROM t2 WHERE t2.c1 IS NOT NULL) ORDER BY 1,2;
c0	c1
SELECT /*+USE_HASH(t1,t2)*/ * FROM t1 WHERE c1 NOT IN (SELECT c1 FROM t2 WHERE t2.c1 IS NOT NULL) ORDER BY 1,2;
c0	c1
SELECT /*+USE_NL(t1,t2)*/ * FROM t1 JOIN t2 ON t1.c0=t2.c0 AND t1.c1 <>ALL (SELECT c1 FROM t2 WHERE t2.c1 IS NOT NULL) ORDER BY 1,2;
c0	c1	c0	c1
SELECT /*+USE_MJ(t1,t2)*/ * FROM t1 JOIN t2 ON t1.c0=t2.c0 AND t1.c1 <>ALL (SELECT c1 FROM t2 WHERE t2.c1 IS NOT NULL) ORDER BY 1,2;
c0	c1	c0	c1
#PARALLEL
#IF "_optimizer_null_aware_antijoin"=ON,EXPLAIN:HASH JOIN ANTI NA
SELECT /*+parallel(2) USE_HASH(t1,t2)*/ * FROM t1 WHERE c1 NOT IN (SELECT c1 FROM t2) ORDER BY 1,2;
c0	c1
SELECT /*+parallel(2) USE_HASH(t1,t2)*/ * FROM t1 WHERE c1 <>ALL (SELECT c1 FROM t2) ORDER BY 1,2;
c0	c1
SELECT /*+parallel(2) USE_NL(t1,t2)*/ * FROM t1 WHERE c1 <>ALL (SELECT c1 FROM t2) ORDER BY 1,2;
c0	c1
SELECT /*+parallel(2) USE_HASH(t1,t2)*/ * FROM t1 WHERE NOT EXISTS (SELECT c1 FROM t2) ORDER BY 1,2;
c0	c1
SELECT /*+parallel(5) USE_HASH(t1,t2)*/ * FROM t1 WHERE c1 NOT IN (SELECT c1 FROM t2) ORDER BY 1,2;
c0	c1
SELECT /*+parallel(5) USE_NLJ(t1,t2)*/ * FROM t1 WHERE c1 NOT IN (SELECT c1 FROM t2) ORDER BY 1,2;
c0	c1
SELECT /*+parallel(5) USE_HASH(t1,t2)*/ * FROM t1 WHERE c1 <>ALL (SELECT c1 FROM t2) ORDER BY 1,2;
c0	c1
SELECT /*+parallel(5) USE_MJ(t1,t2)*/ * FROM t1 WHERE c1 NOT IN (SELECT c1 FROM t2) ORDER BY 1,2;
c0	c1
SELECT /*+parallel(5) USE_HASH(t1,t2)*/ * FROM t1 WHERE NOT EXISTS (SELECT c1 FROM t2) ORDER BY 1,2;
c0	c1
SELECT /*+parallel(2) USE_HASH(t1,t2)*/ * FROM t1,t2 WHERE t1.c0=t2.c0 AND t1.c1 NOT IN (SELECT c1 FROM t2) ORDER BY 1,2;
c0	c1	c0	c1
SELECT /*+parallel(2) USE_HASH(t1,t2)*/ * FROM t1,t2 WHERE t1.c0=t2.c0 AND t1.c1 <>ALL (SELECT c1 FROM t2) ORDER BY 1,2;
c0	c1	c0	c1
SELECT /*+parallel(2) USE_MJ(t1,t2)*/ * FROM t1,t2 WHERE t1.c0=t2.c0 AND t1.c1 <>ALL (SELECT c1 FROM t2) ORDER BY 1,2;
c0	c1	c0	c1
SELECT /*+parallel(2) USE_NL(t1,t2)*/ * FROM t1,t2 WHERE t1.c0=t2.c0 AND t1.c1 NOT IN (SELECT c1 FROM t2) ORDER BY 1,2;
c0	c1	c0	c1
SELECT /*+parallel(2) USE_HASH(t1,t2)*/ * FROM t1,t2 WHERE t1.c0=t2.c0 AND NOT EXISTS (SELECT c1 FROM t2) ORDER BY 1,2;
c0	c1	c0	c1
#IF "_optimizer_null_aware_antijoin"=ON,EXPLAIN:HASH JOIN ANTI SNA
SELECT /*+parallel(2) USE_HASH(t1,t2)*/ * FROM t1 WHERE c1 NOT IN (SELECT c1 FROM t2 WHERE t2.c1 IS NOT NULL) ORDER BY 1,2;
c0	c1
SELECT /*+parallel(2) USE_HASH(t1,t2)*/ * FROM t1 WHERE c1 <>ALL (SELECT c1 FROM t2 WHERE t2.c1 IS NOT NULL) ORDER BY 1,2;
c0	c1
SELECT /*+parallel(2) USE_NL(t1,t2)*/ * FROM t1 WHERE c1 <>ALL (SELECT c1 FROM t2 WHERE t2.c1 IS NOT NULL) ORDER BY 1,2;
c0	c1
SELECT /*+parallel(2) USE_HASH(t1,t2)*/ * FROM t1 WHERE NOT EXISTS (SELECT c1 FROM t2 WHERE t2.c1 IS NOT NULL) ORDER BY 1,2;
c0	c1
SELECT /*+parallel(5) USE_HASH(t1,t2)*/ * FROM t1 WHERE c1 NOT IN (SELECT c1 FROM t2 WHERE t2.c1 IS NOT NULL) ORDER BY 1,2;
c0	c1
SELECT /*+parallel(5) USE_NLJ(t1,t2)*/ * FROM t1 WHERE c1 NOT IN (SELECT c1 FROM t2 WHERE t2.c1 IS NOT NULL) ORDER BY 1,2;
c0	c1
SELECT /*+parallel(5) USE_HASH(t1,t2)*/ * FROM t1 WHERE c1 <>ALL (SELECT c1 FROM t2 WHERE t2.c1 IS NOT NULL) ORDER BY 1,2;
c0	c1
SELECT /*+parallel(5) USE_MJ(t1,t2)*/ * FROM t1 WHERE c1 NOT IN (SELECT c1 FROM t2 WHERE t2.c1 IS NOT NULL) ORDER BY 1,2;
c0	c1
SELECT /*+parallel(5) USE_HASH(t1,t2)*/ * FROM t1 WHERE NOT EXISTS (SELECT c1 FROM t2 WHERE t2.c1 IS NOT NULL) ORDER BY 1,2;
c0	c1
SELECT /*+parallel(2) USE_HASH(t1,t2)*/ * FROM t1,t2 WHERE t1.c0=t2.c0 AND t1.c1 NOT IN (SELECT c1 FROM t2 WHERE t2.c1 IS NOT NULL) ORDER BY 1,2;
c0	c1	c0	c1
SELECT /*+parallel(2) USE_HASH(t1,t2)*/ * FROM t1,t2 WHERE t1.c0=t2.c0 AND t1.c1 <>ALL (SELECT c1 FROM t2 WHERE t2.c1 IS NOT NULL) ORDER BY 1,2;
c0	c1	c0	c1
SELECT /*+parallel(2) USE_MJ(t1,t2)*/ * FROM t1,t2 WHERE t1.c0=t2.c0 AND t1.c1 <>ALL (SELECT c1 FROM t2 WHERE t2.c1 IS NOT NULL) ORDER BY 1,2;
c0	c1	c0	c1
SELECT /*+parallel(2) USE_NL(t1,t2)*/ * FROM t1,t2 WHERE t1.c0=t2.c0 AND t1.c1 NOT IN (SELECT c1 FROM t2 WHERE t2.c1 IS NOT NULL) ORDER BY 1,2;
c0	c1	c0	c1
SELECT /*+parallel(2) USE_HASH(t1,t2)*/ * FROM t1,t2 WHERE t1.c0=t2.c0 AND NOT EXISTS (SELECT c1 FROM t2 WHERE t2.c1 IS NOT NULL) ORDER BY 1,2;
c0	c1	c0	c1
#BLOB TYPE
DROP TABLE t1;
DROP TABLE t2;
CREATE TABLE t1(c0 INT,c1 BLOB);
CREATE TABLE t2(c0 INT,c1 BLOB);
INSERT INTO t1 VALUES(1,'A');
INSERT INTO t1 VALUES(2,'12');
INSERT INTO t1 VALUES(3,'A');
INSERT INTO t1 VALUES(4,'');
INSERT INTO t1 VALUES(5,NULL);
INSERT INTO t2 VALUES(1,'AB');
INSERT INTO t2 VALUES(2,'12');
INSERT INTO t2 VALUES(3,'');
INSERT INTO t2 VALUES(4,NULL);
INSERT INTO t2 VALUES(5,'a');
SELECT * FROM t1 ORDER BY c0;
c0	c1
1	A
2	12
3	A
4	
5	NULL
SELECT * FROM t2 ORDER BY c0;
c0	c1
1	AB
2	12
3	
4	NULL
5	a
#There are null values on the right side of the left table
#IF "_optimizer_null_aware_antijoin"=ON,EXPLAIN:HASH JOIN ANTI NA
SELECT * FROM t1 WHERE c1 NOT IN (SELECT c1 FROM t2) ORDER BY 1,2;
c0	c1
SELECT * FROM t1 WHERE NOT EXISTS (SELECT c1 FROM t2) ORDER BY 1,2;
c0	c1
#IF "_optimizer_null_aware_antijoin"=TRUE,EXPLAIN:HASH JOIN ANTI SNA
SELECT * FROM t1 WHERE c1 NOT IN (SELECT c1 FROM t2 WHERE t2.c1 IS NOT NULL) ORDER BY 1,2;
c0	c1
1	A
3	A
SELECT * FROM t1 WHERE NOT EXISTS (SELECT c1 FROM t2 WHERE t2.c1 IS NOT NULL) ORDER BY 1,2;
c0	c1
#INNER JOIN
#IF "_optimizer_null_aware_antijoin"=ON,EXPLAIN:HASH JOIN ANTI NA
SELECT * FROM t1 JOIN t2 ON t1.c0=t2.c0 AND t1.c1 NOT IN (SELECT c1 FROM t2) ORDER BY 1,2;
c0	c1	c0	c1
SELECT * FROM t1 JOIN t2 ON t1.c0=t2.c0 AND NOT EXISTS (SELECT c1 FROM t2) ORDER BY 1,2;
c0	c1	c0	c1
#IF "_optimizer_null_aware_antijoin"=TRUE,EXPLAIN:HASH JOIN ANTI SNA
SELECT * FROM t1 JOIN t2 ON t1.c0=t2.c0 AND t1.c1 NOT IN (SELECT c1 FROM t2 WHERE t2.c1 IS NOT NULL) ORDER BY 1,2;
c0	c1	c0	c1
1	A	1	AB
3	A	3	
SELECT * FROM t1 JOIN t2 ON t1.c0=t2.c0 AND NOT EXISTS (SELECT c1 FROM t2 WHERE t2.c1 IS NOT NULL) ORDER BY 1,2;
c0	c1	c0	c1
#RIGHT JOIN
#IF "_optimizer_null_aware_antijoin"=ON,EXPLAIN:HASH JOIN ANTI NA
SELECT * FROM t1 RIGHT JOIN t2 ON t1.c0=t2.c0 AND t1.c1 NOT IN (SELECT c1 FROM t2) ORDER BY 1,2,3;
c0	c1	c0	c1
NULL	NULL	1	AB
NULL	NULL	2	12
NULL	NULL	3	
NULL	NULL	4	NULL
NULL	NULL	5	a
SELECT * FROM t1 RIGHT JOIN t2 ON t1.c0=t2.c0 AND t1.c1 <>ALL (SELECT c1 FROM t2) ORDER BY 1,2,3;
c0	c1	c0	c1
NULL	NULL	1	AB
NULL	NULL	2	12
NULL	NULL	3	
NULL	NULL	4	NULL
NULL	NULL	5	a
SELECT * FROM t1 RIGHT JOIN t2 ON t1.c0=t2.c0 AND NOT EXISTS (SELECT c1 FROM t2) ORDER BY 1,2,3;
c0	c1	c0	c1
NULL	NULL	1	AB
NULL	NULL	2	12
NULL	NULL	3	
NULL	NULL	4	NULL
NULL	NULL	5	a
#IF "_optimizer_null_aware_antijoin"=ON,EXPLAIN:HASH JOIN ANTI SNA
SELECT * FROM t1 RIGHT JOIN t2 ON t1.c0=t2.c0 AND t1.c1 NOT IN (SELECT c1 FROM t2 WHERE t2.c1 IS NOT NULL) ORDER BY 1,2,3;
c0	c1	c0	c1
NULL	NULL	2	12
NULL	NULL	4	NULL
NULL	NULL	5	a
1	A	1	AB
3	A	3	
SELECT * FROM t1 RIGHT JOIN t2 ON t1.c0=t2.c0 AND t1.c1 <>ALL (SELECT c1 FROM t2 WHERE t2.c1 IS NOT NULL) ORDER BY 1,2,3;
c0	c1	c0	c1
NULL	NULL	2	12
NULL	NULL	4	NULL
NULL	NULL	5	a
1	A	1	AB
3	A	3	
SELECT * FROM t1 RIGHT JOIN t2 ON t1.c0=t2.c0 AND NOT EXISTS (SELECT c1 FROM t2 WHERE t2.c1 IS NOT NULL) ORDER BY 1,2,3;
c0	c1	c0	c1
NULL	NULL	1	AB
NULL	NULL	2	12
NULL	NULL	3	
NULL	NULL	4	NULL
NULL	NULL	5	a
#LEFT JOIN
#IF "_optimizer_null_aware_antijoin"=ON,EXPLAIN:HASH JOIN ANTI NA
SELECT * FROM t1 LEFT JOIN t2 ON t1.c0=t2.c0 WHERE t1.c1 NOT IN (SELECT c1 FROM t2) ORDER BY 1,2;
c0	c1	c0	c1
SELECT * FROM t1 LEFT JOIN t2 ON t1.c0=t2.c0 WHERE t1.c1 <>ALL (SELECT c1 FROM t2) ORDER BY 1,2;
c0	c1	c0	c1
SELECT * FROM t1 LEFT JOIN t2 ON t1.c0=t2.c0 WHERE NOT EXISTS (SELECT c1 FROM t2) ORDER BY 1,2;
c0	c1	c0	c1
#IF "_optimizer_null_aware_antijoin"=ON,EXPLAIN:HASH JOIN ANTI SNA
SELECT * FROM t1 LEFT JOIN t2 ON t1.c0=t2.c0 WHERE t1.c1 NOT IN (SELECT c1 FROM t2 WHERE t2.c1 IS NOT NULL) ORDER BY 1,2,3;
c0	c1	c0	c1
1	A	1	AB
3	A	3	
SELECT * FROM t1 LEFT JOIN t2 ON t1.c0=t2.c0 WHERE t1.c1 <>ALL (SELECT c1 FROM t2 WHERE t2.c1 IS NOT NULL) ORDER BY 1,2,3;
c0	c1	c0	c1
1	A	1	AB
3	A	3	
SELECT * FROM t1 LEFT JOIN t2 ON t1.c0=t2.c0 WHERE NOT EXISTS (SELECT c1 FROM t2 WHERE t2.c1 IS NOT NULL) ORDER BY 1,2,3;
c0	c1	c0	c1
#FULL JOIN
#IF "_optimizer_null_aware_antijoin"=ON,EXPLAIN:HASH JOIN ANTI NA
SELECT * FROM t1 FULL JOIN t2 ON t1.c0=t2.c0 WHERE t1.c1 NOT IN (SELECT c1 FROM t2) ORDER BY 1,2;
c0	c1	c0	c1
SELECT * FROM t1 FULL JOIN t2 ON t1.c0=t2.c0 WHERE t1.c1 <>ALL (SELECT c1 FROM t2) ORDER BY 1,2;
c0	c1	c0	c1
SELECT * FROM t1 FULL JOIN t2 ON t1.c0=t2.c0 WHERE NOT EXISTS (SELECT c1 FROM t2) ORDER BY 1,2;
c0	c1	c0	c1
#IF "_optimizer_null_aware_antijoin"=ON,EXPLAIN:HASH JOIN ANTI SNA
SELECT * FROM t1 FULL JOIN t2 ON t1.c0=t2.c0 WHERE t1.c1 NOT IN (SELECT c1 FROM t2 WHERE t2.c1 IS NOT NULL) ORDER BY 1,2,3;
c0	c1	c0	c1
1	A	1	AB
3	A	3	
SELECT * FROM t1 FULL JOIN t2 ON t1.c0=t2.c0 WHERE t1.c1 <>ALL (SELECT c1 FROM t2 WHERE t2.c1 IS NOT NULL) ORDER BY 1,2,3;
c0	c1	c0	c1
1	A	1	AB
3	A	3	
SELECT * FROM t1 FULL JOIN t2 ON t1.c0=t2.c0 WHERE NOT EXISTS (SELECT c1 FROM t2 WHERE t2.c1 IS NOT NULL) ORDER BY 1,2,3;
c0	c1	c0	c1
#HINT
#IF "_optimizer_null_aware_antijoin"=ON,EXPLAIN:HASH JOIN ANTI NA
SELECT /*+USE_HASH(t1,t2)*/ * FROM t1 WHERE c1 NOT IN (SELECT c1 FROM t2) ORDER BY 1,2;
c0	c1
SELECT /*+USE_HASH(t1,t2)*/ * FROM t1 JOIN t2 ON t1.c0=t2.c0 AND t1.c1 <>ALL (SELECT c1 FROM t2) ORDER BY 1,2;
c0	c1	c0	c1
SELECT /*+USE_HASH(t1,t2)*/ * FROM t1 RIGHT JOIN t2 ON t1.c0=t2.c0 WHERE t1.c1 NOT IN (SELECT c1 FROM t2) ORDER BY 1,2;
c0	c1	c0	c1
SELECT /*+USE_NLJ(t1,t2)*/ * FROM t1 RIGHT JOIN t2 ON t1.c0=t2.c0 WHERE t1.c1 NOT IN (SELECT c1 FROM t2) ORDER BY 1,2;
c0	c1	c0	c1
SELECT /*+USE_MJ(t1,t2)*/ * FROM t1 JOIN t2 ON t1.c0=t2.c0 AND t1.c1 <>ALL (SELECT c1 FROM t2) ORDER BY 1,2;
c0	c1	c0	c1
SELECT /*+USE_HASH(t1,t2)*/ * FROM t1 WHERE NOT EXISTS (SELECT c1 FROM t2) ORDER BY 1,2;
c0	c1
SELECT /*+USE_HASH(t1,t2)*/ * FROM t1 WHERE c1 NOT IN (SELECT c1 FROM t2) ORDER BY 1,2;
c0	c1
SELECT /*+USE_NL(t1,t2)*/ * FROM t1 JOIN t2 ON t1.c0=t2.c0 AND t1.c1 <>ALL (SELECT c1 FROM t2) ORDER BY 1,2;
c0	c1	c0	c1
SELECT /*+USE_MJ(t1,t2)*/ * FROM t1 JOIN t2 ON t1.c0=t2.c0 AND t1.c1 <>ALL (SELECT c1 FROM t2) ORDER BY 1,2;
c0	c1	c0	c1
#IF "_optimizer_null_aware_antijoin"=ON,EXPLAIN:HASH JOIN ANTI SNA
SELECT /*+USE_HASH(t1,t2)*/ * FROM t1 WHERE c1 NOT IN (SELECT c1 FROM t2 WHERE t2.c1 IS NOT NULL) ORDER BY 1,2;
c0	c1
1	A
3	A
SELECT /*+USE_HASH(t1,t2)*/ * FROM t1 JOIN t2 ON t1.c0=t2.c0 AND t1.c1 <>ALL (SELECT c1 FROM t2 WHERE t2.c1 IS NOT NULL) ORDER BY 1,2;
c0	c1	c0	c1
1	A	1	AB
3	A	3	
SELECT /*+USE_HASH(t1,t2)*/ * FROM t1 RIGHT JOIN t2 ON t1.c0=t2.c0 WHERE t1.c1 NOT IN (SELECT c1 FROM t2 WHERE t2.c1 IS NOT NULL) ORDER BY 1,2;
c0	c1	c0	c1
1	A	1	AB
3	A	3	
SELECT /*+USE_NLJ(t1,t2)*/ * FROM t1 RIGHT JOIN t2 ON t1.c0=t2.c0 WHERE t1.c1 NOT IN (SELECT c1 FROM t2 WHERE t2.c1 IS NOT NULL) ORDER BY 1,2;
c0	c1	c0	c1
1	A	1	AB
3	A	3	
SELECT /*+USE_MJ(t1,t2)*/ * FROM t1 JOIN t2 ON t1.c0=t2.c0 AND t1.c1 <>ALL (SELECT c1 FROM t2 WHERE t2.c1 IS NOT NULL) ORDER BY 1,2;
c0	c1	c0	c1
1	A	1	AB
3	A	3	
SELECT /*+USE_HASH(t1,t2)*/ * FROM t1 WHERE NOT EXISTS (SELECT c1 FROM t2 WHERE t2.c1 IS NOT NULL) ORDER BY 1,2;
c0	c1
SELECT /*+USE_HASH(t1,t2)*/ * FROM t1 WHERE c1 NOT IN (SELECT c1 FROM t2 WHERE t2.c1 IS NOT NULL) ORDER BY 1,2;
c0	c1
1	A
3	A
SELECT /*+USE_NL(t1,t2)*/ * FROM t1 JOIN t2 ON t1.c0=t2.c0 AND t1.c1 <>ALL (SELECT c1 FROM t2 WHERE t2.c1 IS NOT NULL) ORDER BY 1,2;
c0	c1	c0	c1
1	A	1	AB
3	A	3	
SELECT /*+USE_MJ(t1,t2)*/ * FROM t1 JOIN t2 ON t1.c0=t2.c0 AND t1.c1 <>ALL (SELECT c1 FROM t2 WHERE t2.c1 IS NOT NULL) ORDER BY 1,2;
c0	c1	c0	c1
1	A	1	AB
3	A	3	
#PARALLEL
#IF "_optimizer_null_aware_antijoin"=ON,EXPLAIN:HASH JOIN ANTI NA
SELECT /*+parallel(2) USE_HASH(t1,t2)*/ * FROM t1 WHERE c1 NOT IN (SELECT c1 FROM t2) ORDER BY 1,2;
c0	c1
SELECT /*+parallel(2) USE_HASH(t1,t2)*/ * FROM t1 WHERE c1 <>ALL (SELECT c1 FROM t2) ORDER BY 1,2;
c0	c1
SELECT /*+parallel(2) USE_NL(t1,t2)*/ * FROM t1 WHERE c1 <>ALL (SELECT c1 FROM t2) ORDER BY 1,2;
c0	c1
SELECT /*+parallel(2) USE_HASH(t1,t2)*/ * FROM t1 WHERE NOT EXISTS (SELECT c1 FROM t2) ORDER BY 1,2;
c0	c1
SELECT /*+parallel(5) USE_HASH(t1,t2)*/ * FROM t1 WHERE c1 NOT IN (SELECT c1 FROM t2) ORDER BY 1,2;
c0	c1
SELECT /*+parallel(5) USE_NLJ(t1,t2)*/ * FROM t1 WHERE c1 NOT IN (SELECT c1 FROM t2) ORDER BY 1,2;
c0	c1
SELECT /*+parallel(5) USE_HASH(t1,t2)*/ * FROM t1 WHERE c1 <>ALL (SELECT c1 FROM t2) ORDER BY 1,2;
c0	c1
SELECT /*+parallel(5) USE_MJ(t1,t2)*/ * FROM t1 WHERE c1 NOT IN (SELECT c1 FROM t2) ORDER BY 1,2;
c0	c1
SELECT /*+parallel(5) USE_HASH(t1,t2)*/ * FROM t1 WHERE NOT EXISTS (SELECT c1 FROM t2) ORDER BY 1,2;
c0	c1
SELECT /*+parallel(2) USE_HASH(t1,t2)*/ * FROM t1,t2 WHERE t1.c0=t2.c0 AND t1.c1 NOT IN (SELECT c1 FROM t2) ORDER BY 1,2;
c0	c1	c0	c1
SELECT /*+parallel(2) USE_HASH(t1,t2)*/ * FROM t1,t2 WHERE t1.c0=t2.c0 AND t1.c1 <>ALL (SELECT c1 FROM t2) ORDER BY 1,2;
c0	c1	c0	c1
SELECT /*+parallel(2) USE_MJ(t1,t2)*/ * FROM t1,t2 WHERE t1.c0=t2.c0 AND t1.c1 <>ALL (SELECT c1 FROM t2) ORDER BY 1,2;
c0	c1	c0	c1
SELECT /*+parallel(2) USE_NL(t1,t2)*/ * FROM t1,t2 WHERE t1.c0=t2.c0 AND t1.c1 NOT IN (SELECT c1 FROM t2) ORDER BY 1,2;
c0	c1	c0	c1
SELECT /*+parallel(2) USE_HASH(t1,t2)*/ * FROM t1,t2 WHERE t1.c0=t2.c0 AND NOT EXISTS (SELECT c1 FROM t2) ORDER BY 1,2;
c0	c1	c0	c1
#IF "_optimizer_null_aware_antijoin"=ON,EXPLAIN:HASH JOIN ANTI SNA
SELECT /*+parallel(2) USE_HASH(t1,t2)*/ * FROM t1 WHERE c1 NOT IN (SELECT c1 FROM t2 WHERE t2.c1 IS NOT NULL) ORDER BY 1,2;
c0	c1
1	A
3	A
SELECT /*+parallel(2) USE_HASH(t1,t2)*/ * FROM t1 WHERE c1 <>ALL (SELECT c1 FROM t2 WHERE t2.c1 IS NOT NULL) ORDER BY 1,2;
c0	c1
1	A
3	A
SELECT /*+parallel(2) USE_NL(t1,t2)*/ * FROM t1 WHERE c1 <>ALL (SELECT c1 FROM t2 WHERE t2.c1 IS NOT NULL) ORDER BY 1,2;
c0	c1
1	A
3	A
SELECT /*+parallel(2) USE_HASH(t1,t2)*/ * FROM t1 WHERE NOT EXISTS (SELECT c1 FROM t2 WHERE t2.c1 IS NOT NULL) ORDER BY 1,2;
c0	c1
SELECT /*+parallel(5) USE_HASH(t1,t2)*/ * FROM t1 WHERE c1 NOT IN (SELECT c1 FROM t2 WHERE t2.c1 IS NOT NULL) ORDER BY 1,2;
c0	c1
1	A
3	A
SELECT /*+parallel(5) USE_NLJ(t1,t2)*/ * FROM t1 WHERE c1 NOT IN (SELECT c1 FROM t2 WHERE t2.c1 IS NOT NULL) ORDER BY 1,2;
c0	c1
1	A
3	A
SELECT /*+parallel(5) USE_HASH(t1,t2)*/ * FROM t1 WHERE c1 <>ALL (SELECT c1 FROM t2 WHERE t2.c1 IS NOT NULL) ORDER BY 1,2;
c0	c1
1	A
3	A
SELECT /*+parallel(5) USE_MJ(t1,t2)*/ * FROM t1 WHERE c1 NOT IN (SELECT c1 FROM t2 WHERE t2.c1 IS NOT NULL) ORDER BY 1,2;
c0	c1
1	A
3	A
SELECT /*+parallel(5) USE_HASH(t1,t2)*/ * FROM t1 WHERE NOT EXISTS (SELECT c1 FROM t2 WHERE t2.c1 IS NOT NULL) ORDER BY 1,2;
c0	c1
SELECT /*+parallel(2) USE_HASH(t1,t2)*/ * FROM t1,t2 WHERE t1.c0=t2.c0 AND t1.c1 NOT IN (SELECT c1 FROM t2 WHERE t2.c1 IS NOT NULL) ORDER BY 1,2;
c0	c1	c0	c1
1	A	1	AB
3	A	3	
SELECT /*+parallel(2) USE_HASH(t1,t2)*/ * FROM t1,t2 WHERE t1.c0=t2.c0 AND t1.c1 <>ALL (SELECT c1 FROM t2 WHERE t2.c1 IS NOT NULL) ORDER BY 1,2;
c0	c1	c0	c1
1	A	1	AB
3	A	3	
SELECT /*+parallel(2) USE_MJ(t1,t2)*/ * FROM t1,t2 WHERE t1.c0=t2.c0 AND t1.c1 <>ALL (SELECT c1 FROM t2 WHERE t2.c1 IS NOT NULL) ORDER BY 1,2;
c0	c1	c0	c1
1	A	1	AB
3	A	3	
SELECT /*+parallel(2) USE_NL(t1,t2)*/ * FROM t1,t2 WHERE t1.c0=t2.c0 AND t1.c1 NOT IN (SELECT c1 FROM t2 WHERE t2.c1 IS NOT NULL) ORDER BY 1,2;
c0	c1	c0	c1
1	A	1	AB
3	A	3	
SELECT /*+parallel(2) USE_HASH(t1,t2)*/ * FROM t1,t2 WHERE t1.c0=t2.c0 AND NOT EXISTS (SELECT c1 FROM t2 WHERE t2.c1 IS NOT NULL) ORDER BY 1,2;
c0	c1	c0	c1
#There are null values on the right table
DELETE FROM t1 WHERE c0 IN(4,5);
SELECT * FROM t1 ORDER BY c0;
c0	c1
1	A
2	12
3	A
#IF "_optimizer_null_aware_antijoin"=ON,EXPLAIN:HASH JOIN ANTI NA
SELECT * FROM t1 WHERE c1 NOT IN (SELECT c1 FROM t2) ORDER BY 1,2;
c0	c1
SELECT * FROM t1 WHERE NOT EXISTS (SELECT c1 FROM t2) ORDER BY 1,2;
c0	c1
#IF "_optimizer_null_aware_antijoin"=TRUE,EXPLAIN:HASH JOIN ANTI SNA
SELECT * FROM t1 WHERE c1 NOT IN (SELECT c1 FROM t2 WHERE t2.c1 IS NOT NULL) ORDER BY 1,2;
c0	c1
1	A
3	A
SELECT * FROM t1 WHERE NOT EXISTS (SELECT c1 FROM t2 WHERE t2.c1 IS NOT NULL) ORDER BY 1,2;
c0	c1
#INNER JOIN
#IF "_optimizer_null_aware_antijoin"=ON,EXPLAIN:HASH JOIN ANTI NA
SELECT * FROM t1 JOIN t2 ON t1.c0=t2.c0 AND t1.c1 NOT IN (SELECT c1 FROM t2) ORDER BY 1,2;
c0	c1	c0	c1
SELECT * FROM t1 JOIN t2 ON t1.c0=t2.c0 AND NOT EXISTS (SELECT c1 FROM t2) ORDER BY 1,2;
c0	c1	c0	c1
#IF "_optimizer_null_aware_antijoin"=TRUE,EXPLAIN:HASH JOIN ANTI SNA
SELECT * FROM t1 JOIN t2 ON t1.c0=t2.c0 AND t1.c1 NOT IN (SELECT c1 FROM t2 WHERE t2.c1 IS NOT NULL) ORDER BY 1,2;
c0	c1	c0	c1
1	A	1	AB
3	A	3	
SELECT * FROM t1 JOIN t2 ON t1.c0=t2.c0 AND NOT EXISTS (SELECT c1 FROM t2 WHERE t2.c1 IS NOT NULL) ORDER BY 1,2;
c0	c1	c0	c1
#RIGHT JOIN
#IF "_optimizer_null_aware_antijoin"=ON,EXPLAIN:HASH JOIN ANTI NA
SELECT * FROM t1 RIGHT JOIN t2 ON t1.c0=t2.c0 AND t1.c1 NOT IN (SELECT c1 FROM t2) ORDER BY 1,2,3;
c0	c1	c0	c1
NULL	NULL	1	AB
NULL	NULL	2	12
NULL	NULL	3	
NULL	NULL	4	NULL
NULL	NULL	5	a
SELECT * FROM t1 RIGHT JOIN t2 ON t1.c0=t2.c0 AND t1.c1 <>ALL (SELECT c1 FROM t2) ORDER BY 1,2,3;
c0	c1	c0	c1
NULL	NULL	1	AB
NULL	NULL	2	12
NULL	NULL	3	
NULL	NULL	4	NULL
NULL	NULL	5	a
SELECT * FROM t1 RIGHT JOIN t2 ON t1.c0=t2.c0 AND NOT EXISTS (SELECT c1 FROM t2) ORDER BY 1,2,3;
c0	c1	c0	c1
NULL	NULL	1	AB
NULL	NULL	2	12
NULL	NULL	3	
NULL	NULL	4	NULL
NULL	NULL	5	a
#IF "_optimizer_null_aware_antijoin"=ON,EXPLAIN:HASH JOIN ANTI SNA
SELECT * FROM t1 RIGHT JOIN t2 ON t1.c0=t2.c0 AND t1.c1 NOT IN (SELECT c1 FROM t2 WHERE t2.c1 IS NOT NULL) ORDER BY 1,2,3;
c0	c1	c0	c1
NULL	NULL	2	12
NULL	NULL	4	NULL
NULL	NULL	5	a
1	A	1	AB
3	A	3	
SELECT * FROM t1 RIGHT JOIN t2 ON t1.c0=t2.c0 AND t1.c1 <>ALL (SELECT c1 FROM t2 WHERE t2.c1 IS NOT NULL) ORDER BY 1,2,3;
c0	c1	c0	c1
NULL	NULL	2	12
NULL	NULL	4	NULL
NULL	NULL	5	a
1	A	1	AB
3	A	3	
SELECT * FROM t1 RIGHT JOIN t2 ON t1.c0=t2.c0 AND NOT EXISTS (SELECT c1 FROM t2 WHERE t2.c1 IS NOT NULL) ORDER BY 1,2,3;
c0	c1	c0	c1
NULL	NULL	1	AB
NULL	NULL	2	12
NULL	NULL	3	
NULL	NULL	4	NULL
NULL	NULL	5	a
#LEFT JOIN
#IF "_optimizer_null_aware_antijoin"=ON,EXPLAIN:HASH JOIN ANTI NA
SELECT * FROM t1 LEFT JOIN t2 ON t1.c0=t2.c0 WHERE t1.c1 NOT IN (SELECT c1 FROM t2) ORDER BY 1,2;
c0	c1	c0	c1
SELECT * FROM t1 LEFT JOIN t2 ON t1.c0=t2.c0 WHERE t1.c1 <>ALL (SELECT c1 FROM t2) ORDER BY 1,2;
c0	c1	c0	c1
SELECT * FROM t1 LEFT JOIN t2 ON t1.c0=t2.c0 WHERE NOT EXISTS (SELECT c1 FROM t2) ORDER BY 1,2;
c0	c1	c0	c1
#IF "_optimizer_null_aware_antijoin"=ON,EXPLAIN:HASH JOIN ANTI SNA
SELECT * FROM t1 LEFT JOIN t2 ON t1.c0=t2.c0 WHERE t1.c1 NOT IN (SELECT c1 FROM t2 WHERE t2.c1 IS NOT NULL) ORDER BY 1,2,3;
c0	c1	c0	c1
1	A	1	AB
3	A	3	
SELECT * FROM t1 LEFT JOIN t2 ON t1.c0=t2.c0 WHERE t1.c1 <>ALL (SELECT c1 FROM t2 WHERE t2.c1 IS NOT NULL) ORDER BY 1,2,3;
c0	c1	c0	c1
1	A	1	AB
3	A	3	
SELECT * FROM t1 LEFT JOIN t2 ON t1.c0=t2.c0 WHERE NOT EXISTS (SELECT c1 FROM t2 WHERE t2.c1 IS NOT NULL) ORDER BY 1,2,3;
c0	c1	c0	c1
#FULL JOIN
#IF "_optimizer_null_aware_antijoin"=ON,EXPLAIN:HASH JOIN ANTI NA
SELECT * FROM t1 FULL JOIN t2 ON t1.c0=t2.c0 WHERE t1.c1 NOT IN (SELECT c1 FROM t2) ORDER BY 1,2;
c0	c1	c0	c1
SELECT * FROM t1 FULL JOIN t2 ON t1.c0=t2.c0 WHERE t1.c1 <>ALL (SELECT c1 FROM t2) ORDER BY 1,2;
c0	c1	c0	c1
SELECT * FROM t1 FULL JOIN t2 ON t1.c0=t2.c0 WHERE NOT EXISTS (SELECT c1 FROM t2) ORDER BY 1,2;
c0	c1	c0	c1
#IF "_optimizer_null_aware_antijoin"=ON,EXPLAIN:HASH JOIN ANTI SNA
SELECT * FROM t1 FULL JOIN t2 ON t1.c0=t2.c0 WHERE t1.c1 NOT IN (SELECT c1 FROM t2 WHERE t2.c1 IS NOT NULL) ORDER BY 1,2,3;
c0	c1	c0	c1
1	A	1	AB
3	A	3	
SELECT * FROM t1 FULL JOIN t2 ON t1.c0=t2.c0 WHERE t1.c1 <>ALL (SELECT c1 FROM t2 WHERE t2.c1 IS NOT NULL) ORDER BY 1,2,3;
c0	c1	c0	c1
1	A	1	AB
3	A	3	
SELECT * FROM t1 FULL JOIN t2 ON t1.c0=t2.c0 WHERE NOT EXISTS (SELECT c1 FROM t2 WHERE t2.c1 IS NOT NULL) ORDER BY 1,2,3;
c0	c1	c0	c1
#HINT
#IF "_optimizer_null_aware_antijoin"=ON,EXPLAIN:HASH JOIN ANTI NA
SELECT /*+USE_HASH(t1,t2)*/ * FROM t1 WHERE c1 NOT IN (SELECT c1 FROM t2) ORDER BY 1,2;
c0	c1
SELECT /*+USE_HASH(t1,t2)*/ * FROM t1 JOIN t2 ON t1.c0=t2.c0 AND t1.c1 <>ALL (SELECT c1 FROM t2) ORDER BY 1,2;
c0	c1	c0	c1
SELECT /*+USE_HASH(t1,t2)*/ * FROM t1 RIGHT JOIN t2 ON t1.c0=t2.c0 WHERE t1.c1 NOT IN (SELECT c1 FROM t2) ORDER BY 1,2;
c0	c1	c0	c1
SELECT /*+USE_NLJ(t1,t2)*/ * FROM t1 RIGHT JOIN t2 ON t1.c0=t2.c0 WHERE t1.c1 NOT IN (SELECT c1 FROM t2) ORDER BY 1,2;
c0	c1	c0	c1
SELECT /*+USE_MJ(t1,t2)*/ * FROM t1 JOIN t2 ON t1.c0=t2.c0 AND t1.c1 <>ALL (SELECT c1 FROM t2) ORDER BY 1,2;
c0	c1	c0	c1
SELECT /*+USE_HASH(t1,t2)*/ * FROM t1 WHERE NOT EXISTS (SELECT c1 FROM t2) ORDER BY 1,2;
c0	c1
SELECT /*+USE_HASH(t1,t2)*/ * FROM t1 WHERE c1 NOT IN (SELECT c1 FROM t2) ORDER BY 1,2;
c0	c1
SELECT /*+USE_NL(t1,t2)*/ * FROM t1 JOIN t2 ON t1.c0=t2.c0 AND t1.c1 <>ALL (SELECT c1 FROM t2) ORDER BY 1,2;
c0	c1	c0	c1
SELECT /*+USE_MJ(t1,t2)*/ * FROM t1 JOIN t2 ON t1.c0=t2.c0 AND t1.c1 <>ALL (SELECT c1 FROM t2) ORDER BY 1,2;
c0	c1	c0	c1
#IF "_optimizer_null_aware_antijoin"=ON,EXPLAIN:HASH JOIN ANTI SNA
SELECT /*+USE_HASH(t1,t2)*/ * FROM t1 WHERE c1 NOT IN (SELECT c1 FROM t2 WHERE t2.c1 IS NOT NULL) ORDER BY 1,2;
c0	c1
1	A
3	A
SELECT /*+USE_HASH(t1,t2)*/ * FROM t1 JOIN t2 ON t1.c0=t2.c0 AND t1.c1 <>ALL (SELECT c1 FROM t2 WHERE t2.c1 IS NOT NULL) ORDER BY 1,2;
c0	c1	c0	c1
1	A	1	AB
3	A	3	
SELECT /*+USE_HASH(t1,t2)*/ * FROM t1 RIGHT JOIN t2 ON t1.c0=t2.c0 WHERE t1.c1 NOT IN (SELECT c1 FROM t2 WHERE t2.c1 IS NOT NULL) ORDER BY 1,2;
c0	c1	c0	c1
1	A	1	AB
3	A	3	
SELECT /*+USE_NLJ(t1,t2)*/ * FROM t1 RIGHT JOIN t2 ON t1.c0=t2.c0 WHERE t1.c1 NOT IN (SELECT c1 FROM t2 WHERE t2.c1 IS NOT NULL) ORDER BY 1,2;
c0	c1	c0	c1
1	A	1	AB
3	A	3	
SELECT /*+USE_MJ(t1,t2)*/ * FROM t1 JOIN t2 ON t1.c0=t2.c0 AND t1.c1 <>ALL (SELECT c1 FROM t2 WHERE t2.c1 IS NOT NULL) ORDER BY 1,2;
c0	c1	c0	c1
1	A	1	AB
3	A	3	
SELECT /*+USE_HASH(t1,t2)*/ * FROM t1 WHERE NOT EXISTS (SELECT c1 FROM t2 WHERE t2.c1 IS NOT NULL) ORDER BY 1,2;
c0	c1
SELECT /*+USE_HASH(t1,t2)*/ * FROM t1 WHERE c1 NOT IN (SELECT c1 FROM t2 WHERE t2.c1 IS NOT NULL) ORDER BY 1,2;
c0	c1
1	A
3	A
SELECT /*+USE_NL(t1,t2)*/ * FROM t1 JOIN t2 ON t1.c0=t2.c0 AND t1.c1 <>ALL (SELECT c1 FROM t2 WHERE t2.c1 IS NOT NULL) ORDER BY 1,2;
c0	c1	c0	c1
1	A	1	AB
3	A	3	
SELECT /*+USE_MJ(t1,t2)*/ * FROM t1 JOIN t2 ON t1.c0=t2.c0 AND t1.c1 <>ALL (SELECT c1 FROM t2 WHERE t2.c1 IS NOT NULL) ORDER BY 1,2;
c0	c1	c0	c1
1	A	1	AB
3	A	3	
#PARALLEL
#IF "_optimizer_null_aware_antijoin"=ON,EXPLAIN:HASH JOIN ANTI NA
SELECT /*+parallel(2) USE_HASH(t1,t2)*/ * FROM t1 WHERE c1 NOT IN (SELECT c1 FROM t2) ORDER BY 1,2;
c0	c1
SELECT /*+parallel(2) USE_HASH(t1,t2)*/ * FROM t1 WHERE c1 <>ALL (SELECT c1 FROM t2) ORDER BY 1,2;
c0	c1
SELECT /*+parallel(2) USE_NL(t1,t2)*/ * FROM t1 WHERE c1 <>ALL (SELECT c1 FROM t2) ORDER BY 1,2;
c0	c1
SELECT /*+parallel(2) USE_HASH(t1,t2)*/ * FROM t1 WHERE NOT EXISTS (SELECT c1 FROM t2) ORDER BY 1,2;
c0	c1
SELECT /*+parallel(5) USE_HASH(t1,t2)*/ * FROM t1 WHERE c1 NOT IN (SELECT c1 FROM t2) ORDER BY 1,2;
c0	c1
SELECT /*+parallel(5) USE_NLJ(t1,t2)*/ * FROM t1 WHERE c1 NOT IN (SELECT c1 FROM t2) ORDER BY 1,2;
c0	c1
SELECT /*+parallel(5) USE_HASH(t1,t2)*/ * FROM t1 WHERE c1 <>ALL (SELECT c1 FROM t2) ORDER BY 1,2;
c0	c1
SELECT /*+parallel(5) USE_MJ(t1,t2)*/ * FROM t1 WHERE c1 NOT IN (SELECT c1 FROM t2) ORDER BY 1,2;
c0	c1
SELECT /*+parallel(5) USE_HASH(t1,t2)*/ * FROM t1 WHERE NOT EXISTS (SELECT c1 FROM t2) ORDER BY 1,2;
c0	c1
SELECT /*+parallel(2) USE_HASH(t1,t2)*/ * FROM t1,t2 WHERE t1.c0=t2.c0 AND t1.c1 NOT IN (SELECT c1 FROM t2) ORDER BY 1,2;
c0	c1	c0	c1
SELECT /*+parallel(2) USE_HASH(t1,t2)*/ * FROM t1,t2 WHERE t1.c0=t2.c0 AND t1.c1 <>ALL (SELECT c1 FROM t2) ORDER BY 1,2;
c0	c1	c0	c1
SELECT /*+parallel(2) USE_MJ(t1,t2)*/ * FROM t1,t2 WHERE t1.c0=t2.c0 AND t1.c1 <>ALL (SELECT c1 FROM t2) ORDER BY 1,2;
c0	c1	c0	c1
SELECT /*+parallel(2) USE_NL(t1,t2)*/ * FROM t1,t2 WHERE t1.c0=t2.c0 AND t1.c1 NOT IN (SELECT c1 FROM t2) ORDER BY 1,2;
c0	c1	c0	c1
SELECT /*+parallel(2) USE_HASH(t1,t2)*/ * FROM t1,t2 WHERE t1.c0=t2.c0 AND NOT EXISTS (SELECT c1 FROM t2) ORDER BY 1,2;
c0	c1	c0	c1
#IF "_optimizer_null_aware_antijoin"=ON,EXPLAIN:HASH JOIN ANTI SNA
SELECT /*+parallel(2) USE_HASH(t1,t2)*/ * FROM t1 WHERE c1 NOT IN (SELECT c1 FROM t2 WHERE t2.c1 IS NOT NULL) ORDER BY 1,2;
c0	c1
1	A
3	A
SELECT /*+parallel(2) USE_HASH(t1,t2)*/ * FROM t1 WHERE c1 <>ALL (SELECT c1 FROM t2 WHERE t2.c1 IS NOT NULL) ORDER BY 1,2;
c0	c1
1	A
3	A
SELECT /*+parallel(2) USE_NL(t1,t2)*/ * FROM t1 WHERE c1 <>ALL (SELECT c1 FROM t2 WHERE t2.c1 IS NOT NULL) ORDER BY 1,2;
c0	c1
1	A
3	A
SELECT /*+parallel(2) USE_HASH(t1,t2)*/ * FROM t1 WHERE NOT EXISTS (SELECT c1 FROM t2 WHERE t2.c1 IS NOT NULL) ORDER BY 1,2;
c0	c1
SELECT /*+parallel(5) USE_HASH(t1,t2)*/ * FROM t1 WHERE c1 NOT IN (SELECT c1 FROM t2 WHERE t2.c1 IS NOT NULL) ORDER BY 1,2;
c0	c1
1	A
3	A
SELECT /*+parallel(5) USE_NLJ(t1,t2)*/ * FROM t1 WHERE c1 NOT IN (SELECT c1 FROM t2 WHERE t2.c1 IS NOT NULL) ORDER BY 1,2;
c0	c1
1	A
3	A
SELECT /*+parallel(5) USE_HASH(t1,t2)*/ * FROM t1 WHERE c1 <>ALL (SELECT c1 FROM t2 WHERE t2.c1 IS NOT NULL) ORDER BY 1,2;
c0	c1
1	A
3	A
SELECT /*+parallel(5) USE_MJ(t1,t2)*/ * FROM t1 WHERE c1 NOT IN (SELECT c1 FROM t2 WHERE t2.c1 IS NOT NULL) ORDER BY 1,2;
c0	c1
1	A
3	A
SELECT /*+parallel(5) USE_HASH(t1,t2)*/ * FROM t1 WHERE NOT EXISTS (SELECT c1 FROM t2 WHERE t2.c1 IS NOT NULL) ORDER BY 1,2;
c0	c1
SELECT /*+parallel(2) USE_HASH(t1,t2)*/ * FROM t1,t2 WHERE t1.c0=t2.c0 AND t1.c1 NOT IN (SELECT c1 FROM t2 WHERE t2.c1 IS NOT NULL) ORDER BY 1,2;
c0	c1	c0	c1
1	A	1	AB
3	A	3	
SELECT /*+parallel(2) USE_HASH(t1,t2)*/ * FROM t1,t2 WHERE t1.c0=t2.c0 AND t1.c1 <>ALL (SELECT c1 FROM t2 WHERE t2.c1 IS NOT NULL) ORDER BY 1,2;
c0	c1	c0	c1
1	A	1	AB
3	A	3	
SELECT /*+parallel(2) USE_MJ(t1,t2)*/ * FROM t1,t2 WHERE t1.c0=t2.c0 AND t1.c1 <>ALL (SELECT c1 FROM t2 WHERE t2.c1 IS NOT NULL) ORDER BY 1,2;
c0	c1	c0	c1
1	A	1	AB
3	A	3	
SELECT /*+parallel(2) USE_NL(t1,t2)*/ * FROM t1,t2 WHERE t1.c0=t2.c0 AND t1.c1 NOT IN (SELECT c1 FROM t2 WHERE t2.c1 IS NOT NULL) ORDER BY 1,2;
c0	c1	c0	c1
1	A	1	AB
3	A	3	
SELECT /*+parallel(2) USE_HASH(t1,t2)*/ * FROM t1,t2 WHERE t1.c0=t2.c0 AND NOT EXISTS (SELECT c1 FROM t2 WHERE t2.c1 IS NOT NULL) ORDER BY 1,2;
c0	c1	c0	c1
#There are null values on the left table
INSERT INTO t1 VALUES(4,'');
INSERT INTO t1 VALUES(5,NULL);
DELETE FROM t2 WHERE c0 IN(3,4);
SELECT * FROM t2 ORDER BY c0;
c0	c1
1	AB
2	12
5	a
#IF "_optimizer_null_aware_antijoin"=ON,EXPLAIN:HASH JOIN ANTI NA
SELECT * FROM t1 WHERE c1 NOT IN (SELECT c1 FROM t2) ORDER BY 1,2;
c0	c1
1	A
3	A
4	
SELECT * FROM t1 WHERE NOT EXISTS (SELECT c1 FROM t2) ORDER BY 1,2;
c0	c1
#IF "_optimizer_null_aware_antijoin"=TRUE,EXPLAIN:HASH JOIN ANTI SNA
SELECT * FROM t1 WHERE c1 NOT IN (SELECT c1 FROM t2 WHERE t2.c1 IS NOT NULL) ORDER BY 1,2;
c0	c1
1	A
3	A
4	
SELECT * FROM t1 WHERE NOT EXISTS (SELECT c1 FROM t2 WHERE t2.c1 IS NOT NULL) ORDER BY 1,2;
c0	c1
#INNER JOIN
#IF "_optimizer_null_aware_antijoin"=ON,EXPLAIN:HASH JOIN ANTI NA
SELECT * FROM t1 JOIN t2 ON t1.c0=t2.c0 AND t1.c1 NOT IN (SELECT c1 FROM t2) ORDER BY 1,2;
c0	c1	c0	c1
1	A	1	AB
SELECT * FROM t1 JOIN t2 ON t1.c0=t2.c0 AND NOT EXISTS (SELECT c1 FROM t2) ORDER BY 1,2;
c0	c1	c0	c1
#IF "_optimizer_null_aware_antijoin"=TRUE,EXPLAIN:HASH JOIN ANTI SNA
SELECT * FROM t1 JOIN t2 ON t1.c0=t2.c0 AND t1.c1 NOT IN (SELECT c1 FROM t2 WHERE t2.c1 IS NOT NULL) ORDER BY 1,2;
c0	c1	c0	c1
1	A	1	AB
SELECT * FROM t1 JOIN t2 ON t1.c0=t2.c0 AND NOT EXISTS (SELECT c1 FROM t2 WHERE t2.c1 IS NOT NULL) ORDER BY 1,2;
c0	c1	c0	c1
#RIGHT JOIN
#IF "_optimizer_null_aware_antijoin"=ON,EXPLAIN:HASH JOIN ANTI NA
SELECT * FROM t1 RIGHT JOIN t2 ON t1.c0=t2.c0 AND t1.c1 NOT IN (SELECT c1 FROM t2) ORDER BY 1,2,3;
c0	c1	c0	c1
NULL	NULL	2	12
NULL	NULL	5	a
1	A	1	AB
SELECT * FROM t1 RIGHT JOIN t2 ON t1.c0=t2.c0 AND t1.c1 <>ALL (SELECT c1 FROM t2) ORDER BY 1,2,3;
c0	c1	c0	c1
NULL	NULL	2	12
NULL	NULL	5	a
1	A	1	AB
SELECT * FROM t1 RIGHT JOIN t2 ON t1.c0=t2.c0 AND NOT EXISTS (SELECT c1 FROM t2) ORDER BY 1,2,3;
c0	c1	c0	c1
NULL	NULL	1	AB
NULL	NULL	2	12
NULL	NULL	5	a
#IF "_optimizer_null_aware_antijoin"=ON,EXPLAIN:HASH JOIN ANTI SNA
SELECT * FROM t1 RIGHT JOIN t2 ON t1.c0=t2.c0 AND t1.c1 NOT IN (SELECT c1 FROM t2 WHERE t2.c1 IS NOT NULL) ORDER BY 1,2,3;
c0	c1	c0	c1
NULL	NULL	2	12
NULL	NULL	5	a
1	A	1	AB
SELECT * FROM t1 RIGHT JOIN t2 ON t1.c0=t2.c0 AND t1.c1 <>ALL (SELECT c1 FROM t2 WHERE t2.c1 IS NOT NULL) ORDER BY 1,2,3;
c0	c1	c0	c1
NULL	NULL	2	12
NULL	NULL	5	a
1	A	1	AB
SELECT * FROM t1 RIGHT JOIN t2 ON t1.c0=t2.c0 AND NOT EXISTS (SELECT c1 FROM t2 WHERE t2.c1 IS NOT NULL) ORDER BY 1,2,3;
c0	c1	c0	c1
NULL	NULL	1	AB
NULL	NULL	2	12
NULL	NULL	5	a
#LEFT JOIN
#IF "_optimizer_null_aware_antijoin"=ON,EXPLAIN:HASH JOIN ANTI NA
SELECT * FROM t1 LEFT JOIN t2 ON t1.c0=t2.c0 WHERE t1.c1 NOT IN (SELECT c1 FROM t2) ORDER BY 1,2;
c0	c1	c0	c1
1	A	1	AB
3	A	NULL	NULL
4		NULL	NULL
SELECT * FROM t1 LEFT JOIN t2 ON t1.c0=t2.c0 WHERE t1.c1 <>ALL (SELECT c1 FROM t2) ORDER BY 1,2;
c0	c1	c0	c1
1	A	1	AB
3	A	NULL	NULL
4		NULL	NULL
SELECT * FROM t1 LEFT JOIN t2 ON t1.c0=t2.c0 WHERE NOT EXISTS (SELECT c1 FROM t2) ORDER BY 1,2;
c0	c1	c0	c1
#IF "_optimizer_null_aware_antijoin"=ON,EXPLAIN:HASH JOIN ANTI SNA
SELECT * FROM t1 LEFT JOIN t2 ON t1.c0=t2.c0 WHERE t1.c1 NOT IN (SELECT c1 FROM t2 WHERE t2.c1 IS NOT NULL) ORDER BY 1,2,3;
c0	c1	c0	c1
1	A	1	AB
3	A	NULL	NULL
4		NULL	NULL
SELECT * FROM t1 LEFT JOIN t2 ON t1.c0=t2.c0 WHERE t1.c1 <>ALL (SELECT c1 FROM t2 WHERE t2.c1 IS NOT NULL) ORDER BY 1,2,3;
c0	c1	c0	c1
1	A	1	AB
3	A	NULL	NULL
4		NULL	NULL
SELECT * FROM t1 LEFT JOIN t2 ON t1.c0=t2.c0 WHERE NOT EXISTS (SELECT c1 FROM t2 WHERE t2.c1 IS NOT NULL) ORDER BY 1,2,3;
c0	c1	c0	c1
#FULL JOIN
#IF "_optimizer_null_aware_antijoin"=ON,EXPLAIN:HASH JOIN ANTI NA
SELECT * FROM t1 FULL JOIN t2 ON t1.c0=t2.c0 WHERE t1.c1 NOT IN (SELECT c1 FROM t2) ORDER BY 1,2;
c0	c1	c0	c1
1	A	1	AB
3	A	NULL	NULL
4		NULL	NULL
SELECT * FROM t1 FULL JOIN t2 ON t1.c0=t2.c0 WHERE t1.c1 <>ALL (SELECT c1 FROM t2) ORDER BY 1,2;
c0	c1	c0	c1
1	A	1	AB
3	A	NULL	NULL
4		NULL	NULL
SELECT * FROM t1 FULL JOIN t2 ON t1.c0=t2.c0 WHERE NOT EXISTS (SELECT c1 FROM t2) ORDER BY 1,2;
c0	c1	c0	c1
#IF "_optimizer_null_aware_antijoin"=ON,EXPLAIN:HASH JOIN ANTI SNA
SELECT * FROM t1 FULL JOIN t2 ON t1.c0=t2.c0 WHERE t1.c1 NOT IN (SELECT c1 FROM t2 WHERE t2.c1 IS NOT NULL) ORDER BY 1,2,3;
c0	c1	c0	c1
1	A	1	AB
3	A	NULL	NULL
4		NULL	NULL
SELECT * FROM t1 FULL JOIN t2 ON t1.c0=t2.c0 WHERE t1.c1 <>ALL (SELECT c1 FROM t2 WHERE t2.c1 IS NOT NULL) ORDER BY 1,2,3;
c0	c1	c0	c1
1	A	1	AB
3	A	NULL	NULL
4		NULL	NULL
SELECT * FROM t1 FULL JOIN t2 ON t1.c0=t2.c0 WHERE NOT EXISTS (SELECT c1 FROM t2 WHERE t2.c1 IS NOT NULL) ORDER BY 1,2,3;
c0	c1	c0	c1
#HINT
#IF "_optimizer_null_aware_antijoin"=ON,EXPLAIN:HASH JOIN ANTI NA
SELECT /*+USE_HASH(t1,t2)*/ * FROM t1 WHERE c1 NOT IN (SELECT c1 FROM t2) ORDER BY 1,2;
c0	c1
1	A
3	A
4	
SELECT /*+USE_HASH(t1,t2)*/ * FROM t1 JOIN t2 ON t1.c0=t2.c0 AND t1.c1 <>ALL (SELECT c1 FROM t2) ORDER BY 1,2;
c0	c1	c0	c1
1	A	1	AB
SELECT /*+USE_HASH(t1,t2)*/ * FROM t1 RIGHT JOIN t2 ON t1.c0=t2.c0 WHERE t1.c1 NOT IN (SELECT c1 FROM t2) ORDER BY 1,2;
c0	c1	c0	c1
1	A	1	AB
SELECT /*+USE_NLJ(t1,t2)*/ * FROM t1 RIGHT JOIN t2 ON t1.c0=t2.c0 WHERE t1.c1 NOT IN (SELECT c1 FROM t2) ORDER BY 1,2;
c0	c1	c0	c1
1	A	1	AB
SELECT /*+USE_MJ(t1,t2)*/ * FROM t1 JOIN t2 ON t1.c0=t2.c0 AND t1.c1 <>ALL (SELECT c1 FROM t2) ORDER BY 1,2;
c0	c1	c0	c1
1	A	1	AB
SELECT /*+USE_HASH(t1,t2)*/ * FROM t1 WHERE NOT EXISTS (SELECT c1 FROM t2) ORDER BY 1,2;
c0	c1
SELECT /*+USE_HASH(t1,t2)*/ * FROM t1 WHERE c1 NOT IN (SELECT c1 FROM t2) ORDER BY 1,2;
c0	c1
1	A
3	A
4	
SELECT /*+USE_NL(t1,t2)*/ * FROM t1 JOIN t2 ON t1.c0=t2.c0 AND t1.c1 <>ALL (SELECT c1 FROM t2) ORDER BY 1,2;
c0	c1	c0	c1
1	A	1	AB
SELECT /*+USE_MJ(t1,t2)*/ * FROM t1 JOIN t2 ON t1.c0=t2.c0 AND t1.c1 <>ALL (SELECT c1 FROM t2) ORDER BY 1,2;
c0	c1	c0	c1
1	A	1	AB
#IF "_optimizer_null_aware_antijoin"=ON,EXPLAIN:HASH JOIN ANTI SNA
SELECT /*+USE_HASH(t1,t2)*/ * FROM t1 WHERE c1 NOT IN (SELECT c1 FROM t2 WHERE t2.c1 IS NOT NULL) ORDER BY 1,2;
c0	c1
1	A
3	A
4	
SELECT /*+USE_HASH(t1,t2)*/ * FROM t1 JOIN t2 ON t1.c0=t2.c0 AND t1.c1 <>ALL (SELECT c1 FROM t2 WHERE t2.c1 IS NOT NULL) ORDER BY 1,2;
c0	c1	c0	c1
1	A	1	AB
SELECT /*+USE_HASH(t1,t2)*/ * FROM t1 RIGHT JOIN t2 ON t1.c0=t2.c0 WHERE t1.c1 NOT IN (SELECT c1 FROM t2 WHERE t2.c1 IS NOT NULL) ORDER BY 1,2;
c0	c1	c0	c1
1	A	1	AB
SELECT /*+USE_NLJ(t1,t2)*/ * FROM t1 RIGHT JOIN t2 ON t1.c0=t2.c0 WHERE t1.c1 NOT IN (SELECT c1 FROM t2 WHERE t2.c1 IS NOT NULL) ORDER BY 1,2;
c0	c1	c0	c1
1	A	1	AB
SELECT /*+USE_MJ(t1,t2)*/ * FROM t1 JOIN t2 ON t1.c0=t2.c0 AND t1.c1 <>ALL (SELECT c1 FROM t2 WHERE t2.c1 IS NOT NULL) ORDER BY 1,2;
c0	c1	c0	c1
1	A	1	AB
SELECT /*+USE_HASH(t1,t2)*/ * FROM t1 WHERE NOT EXISTS (SELECT c1 FROM t2 WHERE t2.c1 IS NOT NULL) ORDER BY 1,2;
c0	c1
SELECT /*+USE_HASH(t1,t2)*/ * FROM t1 WHERE c1 NOT IN (SELECT c1 FROM t2 WHERE t2.c1 IS NOT NULL) ORDER BY 1,2;
c0	c1
1	A
3	A
4	
SELECT /*+USE_NL(t1,t2)*/ * FROM t1 JOIN t2 ON t1.c0=t2.c0 AND t1.c1 <>ALL (SELECT c1 FROM t2 WHERE t2.c1 IS NOT NULL) ORDER BY 1,2;
c0	c1	c0	c1
1	A	1	AB
SELECT /*+USE_MJ(t1,t2)*/ * FROM t1 JOIN t2 ON t1.c0=t2.c0 AND t1.c1 <>ALL (SELECT c1 FROM t2 WHERE t2.c1 IS NOT NULL) ORDER BY 1,2;
c0	c1	c0	c1
1	A	1	AB
#PARALLEL
#IF "_optimizer_null_aware_antijoin"=ON,EXPLAIN:HASH JOIN ANTI NA
SELECT /*+parallel(2) USE_HASH(t1,t2)*/ * FROM t1 WHERE c1 NOT IN (SELECT c1 FROM t2) ORDER BY 1,2;
c0	c1
1	A
3	A
4	
SELECT /*+parallel(2) USE_HASH(t1,t2)*/ * FROM t1 WHERE c1 <>ALL (SELECT c1 FROM t2) ORDER BY 1,2;
c0	c1
1	A
3	A
4	
SELECT /*+parallel(2) USE_NL(t1,t2)*/ * FROM t1 WHERE c1 <>ALL (SELECT c1 FROM t2) ORDER BY 1,2;
c0	c1
1	A
3	A
4	
SELECT /*+parallel(2) USE_HASH(t1,t2)*/ * FROM t1 WHERE NOT EXISTS (SELECT c1 FROM t2) ORDER BY 1,2;
c0	c1
SELECT /*+parallel(5) USE_HASH(t1,t2)*/ * FROM t1 WHERE c1 NOT IN (SELECT c1 FROM t2) ORDER BY 1,2;
c0	c1
1	A
3	A
4	
SELECT /*+parallel(5) USE_NLJ(t1,t2)*/ * FROM t1 WHERE c1 NOT IN (SELECT c1 FROM t2) ORDER BY 1,2;
c0	c1
1	A
3	A
4	
SELECT /*+parallel(5) USE_HASH(t1,t2)*/ * FROM t1 WHERE c1 <>ALL (SELECT c1 FROM t2) ORDER BY 1,2;
c0	c1
1	A
3	A
4	
SELECT /*+parallel(5) USE_MJ(t1,t2)*/ * FROM t1 WHERE c1 NOT IN (SELECT c1 FROM t2) ORDER BY 1,2;
c0	c1
1	A
3	A
4	
SELECT /*+parallel(5) USE_HASH(t1,t2)*/ * FROM t1 WHERE NOT EXISTS (SELECT c1 FROM t2) ORDER BY 1,2;
c0	c1
SELECT /*+parallel(2) USE_HASH(t1,t2)*/ * FROM t1,t2 WHERE t1.c0=t2.c0 AND t1.c1 NOT IN (SELECT c1 FROM t2) ORDER BY 1,2;
c0	c1	c0	c1
1	A	1	AB
SELECT /*+parallel(2) USE_HASH(t1,t2)*/ * FROM t1,t2 WHERE t1.c0=t2.c0 AND t1.c1 <>ALL (SELECT c1 FROM t2) ORDER BY 1,2;
c0	c1	c0	c1
1	A	1	AB
SELECT /*+parallel(2) USE_MJ(t1,t2)*/ * FROM t1,t2 WHERE t1.c0=t2.c0 AND t1.c1 <>ALL (SELECT c1 FROM t2) ORDER BY 1,2;
c0	c1	c0	c1
1	A	1	AB
SELECT /*+parallel(2) USE_NL(t1,t2)*/ * FROM t1,t2 WHERE t1.c0=t2.c0 AND t1.c1 NOT IN (SELECT c1 FROM t2) ORDER BY 1,2;
c0	c1	c0	c1
1	A	1	AB
SELECT /*+parallel(2) USE_HASH(t1,t2)*/ * FROM t1,t2 WHERE t1.c0=t2.c0 AND NOT EXISTS (SELECT c1 FROM t2) ORDER BY 1,2;
c0	c1	c0	c1
#IF "_optimizer_null_aware_antijoin"=ON,EXPLAIN:HASH JOIN ANTI SNA
SELECT /*+parallel(2) USE_HASH(t1,t2)*/ * FROM t1 WHERE c1 NOT IN (SELECT c1 FROM t2 WHERE t2.c1 IS NOT NULL) ORDER BY 1,2;
c0	c1
1	A
3	A
4	
SELECT /*+parallel(2) USE_HASH(t1,t2)*/ * FROM t1 WHERE c1 <>ALL (SELECT c1 FROM t2 WHERE t2.c1 IS NOT NULL) ORDER BY 1,2;
c0	c1
1	A
3	A
4	
SELECT /*+parallel(2) USE_NL(t1,t2)*/ * FROM t1 WHERE c1 <>ALL (SELECT c1 FROM t2 WHERE t2.c1 IS NOT NULL) ORDER BY 1,2;
c0	c1
1	A
3	A
4	
SELECT /*+parallel(2) USE_HASH(t1,t2)*/ * FROM t1 WHERE NOT EXISTS (SELECT c1 FROM t2 WHERE t2.c1 IS NOT NULL) ORDER BY 1,2;
c0	c1
SELECT /*+parallel(5) USE_HASH(t1,t2)*/ * FROM t1 WHERE c1 NOT IN (SELECT c1 FROM t2 WHERE t2.c1 IS NOT NULL) ORDER BY 1,2;
c0	c1
1	A
3	A
4	
SELECT /*+parallel(5) USE_NLJ(t1,t2)*/ * FROM t1 WHERE c1 NOT IN (SELECT c1 FROM t2 WHERE t2.c1 IS NOT NULL) ORDER BY 1,2;
c0	c1
1	A
3	A
4	
SELECT /*+parallel(5) USE_HASH(t1,t2)*/ * FROM t1 WHERE c1 <>ALL (SELECT c1 FROM t2 WHERE t2.c1 IS NOT NULL) ORDER BY 1,2;
c0	c1
1	A
3	A
4	
SELECT /*+parallel(5) USE_MJ(t1,t2)*/ * FROM t1 WHERE c1 NOT IN (SELECT c1 FROM t2 WHERE t2.c1 IS NOT NULL) ORDER BY 1,2;
c0	c1
1	A
3	A
4	
SELECT /*+parallel(5) USE_HASH(t1,t2)*/ * FROM t1 WHERE NOT EXISTS (SELECT c1 FROM t2 WHERE t2.c1 IS NOT NULL) ORDER BY 1,2;
c0	c1
SELECT /*+parallel(2) USE_HASH(t1,t2)*/ * FROM t1,t2 WHERE t1.c0=t2.c0 AND t1.c1 NOT IN (SELECT c1 FROM t2 WHERE t2.c1 IS NOT NULL) ORDER BY 1,2;
c0	c1	c0	c1
1	A	1	AB
SELECT /*+parallel(2) USE_HASH(t1,t2)*/ * FROM t1,t2 WHERE t1.c0=t2.c0 AND t1.c1 <>ALL (SELECT c1 FROM t2 WHERE t2.c1 IS NOT NULL) ORDER BY 1,2;
c0	c1	c0	c1
1	A	1	AB
SELECT /*+parallel(2) USE_MJ(t1,t2)*/ * FROM t1,t2 WHERE t1.c0=t2.c0 AND t1.c1 <>ALL (SELECT c1 FROM t2 WHERE t2.c1 IS NOT NULL) ORDER BY 1,2;
c0	c1	c0	c1
1	A	1	AB
SELECT /*+parallel(2) USE_NL(t1,t2)*/ * FROM t1,t2 WHERE t1.c0=t2.c0 AND t1.c1 NOT IN (SELECT c1 FROM t2 WHERE t2.c1 IS NOT NULL) ORDER BY 1,2;
c0	c1	c0	c1
1	A	1	AB
SELECT /*+parallel(2) USE_HASH(t1,t2)*/ * FROM t1,t2 WHERE t1.c0=t2.c0 AND NOT EXISTS (SELECT c1 FROM t2 WHERE t2.c1 IS NOT NULL) ORDER BY 1,2;
c0	c1	c0	c1
#There are no null values in the left and right tables
DELETE FROM t1 WHERE c0 IN(4,5);
SELECT * FROM t1 ORDER BY c0;
c0	c1
1	A
2	12
3	A
SELECT * FROM t2 ORDER BY c0;
c0	c1
1	AB
2	12
5	a
#IF "_optimizer_null_aware_antijoin"=ON,EXPLAIN:HASH JOIN ANTI NA
SELECT * FROM t1 WHERE c1 NOT IN (SELECT c1 FROM t2) ORDER BY 1,2;
c0	c1
1	A
3	A
SELECT * FROM t1 WHERE NOT EXISTS (SELECT c1 FROM t2) ORDER BY 1,2;
c0	c1
#IF "_optimizer_null_aware_antijoin"=TRUE,EXPLAIN:HASH JOIN ANTI SNA
SELECT * FROM t1 WHERE c1 NOT IN (SELECT c1 FROM t2 WHERE t2.c1 IS NOT NULL) ORDER BY 1,2;
c0	c1
1	A
3	A
SELECT * FROM t1 WHERE NOT EXISTS (SELECT c1 FROM t2 WHERE t2.c1 IS NOT NULL) ORDER BY 1,2;
c0	c1
#INNER JOIN
#IF "_optimizer_null_aware_antijoin"=ON,EXPLAIN:HASH JOIN ANTI NA
SELECT * FROM t1 JOIN t2 ON t1.c0=t2.c0 AND t1.c1 NOT IN (SELECT c1 FROM t2) ORDER BY 1,2;
c0	c1	c0	c1
1	A	1	AB
SELECT * FROM t1 JOIN t2 ON t1.c0=t2.c0 AND NOT EXISTS (SELECT c1 FROM t2) ORDER BY 1,2;
c0	c1	c0	c1
#IF "_optimizer_null_aware_antijoin"=TRUE,EXPLAIN:HASH JOIN ANTI SNA
SELECT * FROM t1 JOIN t2 ON t1.c0=t2.c0 AND t1.c1 NOT IN (SELECT c1 FROM t2 WHERE t2.c1 IS NOT NULL) ORDER BY 1,2;
c0	c1	c0	c1
1	A	1	AB
SELECT * FROM t1 JOIN t2 ON t1.c0=t2.c0 AND NOT EXISTS (SELECT c1 FROM t2 WHERE t2.c1 IS NOT NULL) ORDER BY 1,2;
c0	c1	c0	c1
#RIGHT JOIN
#IF "_optimizer_null_aware_antijoin"=ON,EXPLAIN:HASH JOIN ANTI NA
SELECT * FROM t1 RIGHT JOIN t2 ON t1.c0=t2.c0 AND t1.c1 NOT IN (SELECT c1 FROM t2) ORDER BY 1,2,3;
c0	c1	c0	c1
NULL	NULL	2	12
NULL	NULL	5	a
1	A	1	AB
SELECT * FROM t1 RIGHT JOIN t2 ON t1.c0=t2.c0 AND t1.c1 <>ALL (SELECT c1 FROM t2) ORDER BY 1,2,3;
c0	c1	c0	c1
NULL	NULL	2	12
NULL	NULL	5	a
1	A	1	AB
SELECT * FROM t1 RIGHT JOIN t2 ON t1.c0=t2.c0 AND NOT EXISTS (SELECT c1 FROM t2) ORDER BY 1,2,3;
c0	c1	c0	c1
NULL	NULL	1	AB
NULL	NULL	2	12
NULL	NULL	5	a
#IF "_optimizer_null_aware_antijoin"=ON,EXPLAIN:HASH JOIN ANTI SNA
SELECT * FROM t1 RIGHT JOIN t2 ON t1.c0=t2.c0 AND t1.c1 NOT IN (SELECT c1 FROM t2 WHERE t2.c1 IS NOT NULL) ORDER BY 1,2,3;
c0	c1	c0	c1
NULL	NULL	2	12
NULL	NULL	5	a
1	A	1	AB
SELECT * FROM t1 RIGHT JOIN t2 ON t1.c0=t2.c0 AND t1.c1 <>ALL (SELECT c1 FROM t2 WHERE t2.c1 IS NOT NULL) ORDER BY 1,2,3;
c0	c1	c0	c1
NULL	NULL	2	12
NULL	NULL	5	a
1	A	1	AB
SELECT * FROM t1 RIGHT JOIN t2 ON t1.c0=t2.c0 AND NOT EXISTS (SELECT c1 FROM t2 WHERE t2.c1 IS NOT NULL) ORDER BY 1,2,3;
c0	c1	c0	c1
NULL	NULL	1	AB
NULL	NULL	2	12
NULL	NULL	5	a
#LEFT JOIN
#IF "_optimizer_null_aware_antijoin"=ON,EXPLAIN:HASH JOIN ANTI NA
SELECT * FROM t1 LEFT JOIN t2 ON t1.c0=t2.c0 WHERE t1.c1 NOT IN (SELECT c1 FROM t2) ORDER BY 1,2;
c0	c1	c0	c1
1	A	1	AB
3	A	NULL	NULL
SELECT * FROM t1 LEFT JOIN t2 ON t1.c0=t2.c0 WHERE t1.c1 <>ALL (SELECT c1 FROM t2) ORDER BY 1,2;
c0	c1	c0	c1
1	A	1	AB
3	A	NULL	NULL
SELECT * FROM t1 LEFT JOIN t2 ON t1.c0=t2.c0 WHERE NOT EXISTS (SELECT c1 FROM t2) ORDER BY 1,2;
c0	c1	c0	c1
#IF "_optimizer_null_aware_antijoin"=ON,EXPLAIN:HASH JOIN ANTI SNA
SELECT * FROM t1 LEFT JOIN t2 ON t1.c0=t2.c0 WHERE t1.c1 NOT IN (SELECT c1 FROM t2 WHERE t2.c1 IS NOT NULL) ORDER BY 1,2,3;
c0	c1	c0	c1
1	A	1	AB
3	A	NULL	NULL
SELECT * FROM t1 LEFT JOIN t2 ON t1.c0=t2.c0 WHERE t1.c1 <>ALL (SELECT c1 FROM t2 WHERE t2.c1 IS NOT NULL) ORDER BY 1,2,3;
c0	c1	c0	c1
1	A	1	AB
3	A	NULL	NULL
SELECT * FROM t1 LEFT JOIN t2 ON t1.c0=t2.c0 WHERE NOT EXISTS (SELECT c1 FROM t2 WHERE t2.c1 IS NOT NULL) ORDER BY 1,2,3;
c0	c1	c0	c1
#FULL JOIN
#IF "_optimizer_null_aware_antijoin"=ON,EXPLAIN:HASH JOIN ANTI NA
SELECT * FROM t1 FULL JOIN t2 ON t1.c0=t2.c0 WHERE t1.c1 NOT IN (SELECT c1 FROM t2) ORDER BY 1,2;
c0	c1	c0	c1
1	A	1	AB
3	A	NULL	NULL
SELECT * FROM t1 FULL JOIN t2 ON t1.c0=t2.c0 WHERE t1.c1 <>ALL (SELECT c1 FROM t2) ORDER BY 1,2;
c0	c1	c0	c1
1	A	1	AB
3	A	NULL	NULL
SELECT * FROM t1 FULL JOIN t2 ON t1.c0=t2.c0 WHERE NOT EXISTS (SELECT c1 FROM t2) ORDER BY 1,2;
c0	c1	c0	c1
#IF "_optimizer_null_aware_antijoin"=ON,EXPLAIN:HASH JOIN ANTI SNA
SELECT * FROM t1 FULL JOIN t2 ON t1.c0=t2.c0 WHERE t1.c1 NOT IN (SELECT c1 FROM t2 WHERE t2.c1 IS NOT NULL) ORDER BY 1,2,3;
c0	c1	c0	c1
1	A	1	AB
3	A	NULL	NULL
SELECT * FROM t1 FULL JOIN t2 ON t1.c0=t2.c0 WHERE t1.c1 <>ALL (SELECT c1 FROM t2 WHERE t2.c1 IS NOT NULL) ORDER BY 1,2,3;
c0	c1	c0	c1
1	A	1	AB
3	A	NULL	NULL
SELECT * FROM t1 FULL JOIN t2 ON t1.c0=t2.c0 WHERE NOT EXISTS (SELECT c1 FROM t2 WHERE t2.c1 IS NOT NULL) ORDER BY 1,2,3;
c0	c1	c0	c1
#HINT
#IF "_optimizer_null_aware_antijoin"=ON,EXPLAIN:HASH JOIN ANTI NA
SELECT /*+USE_HASH(t1,t2)*/ * FROM t1 WHERE c1 NOT IN (SELECT c1 FROM t2) ORDER BY 1,2;
c0	c1
1	A
3	A
SELECT /*+USE_HASH(t1,t2)*/ * FROM t1 JOIN t2 ON t1.c0=t2.c0 AND t1.c1 <>ALL (SELECT c1 FROM t2) ORDER BY 1,2;
c0	c1	c0	c1
1	A	1	AB
SELECT /*+USE_HASH(t1,t2)*/ * FROM t1 RIGHT JOIN t2 ON t1.c0=t2.c0 WHERE t1.c1 NOT IN (SELECT c1 FROM t2) ORDER BY 1,2;
c0	c1	c0	c1
1	A	1	AB
SELECT /*+USE_NLJ(t1,t2)*/ * FROM t1 RIGHT JOIN t2 ON t1.c0=t2.c0 WHERE t1.c1 NOT IN (SELECT c1 FROM t2) ORDER BY 1,2;
c0	c1	c0	c1
1	A	1	AB
SELECT /*+USE_MJ(t1,t2)*/ * FROM t1 JOIN t2 ON t1.c0=t2.c0 AND t1.c1 <>ALL (SELECT c1 FROM t2) ORDER BY 1,2;
c0	c1	c0	c1
1	A	1	AB
SELECT /*+USE_HASH(t1,t2)*/ * FROM t1 WHERE NOT EXISTS (SELECT c1 FROM t2) ORDER BY 1,2;
c0	c1
SELECT /*+USE_HASH(t1,t2)*/ * FROM t1 WHERE c1 NOT IN (SELECT c1 FROM t2) ORDER BY 1,2;
c0	c1
1	A
3	A
SELECT /*+USE_NL(t1,t2)*/ * FROM t1 JOIN t2 ON t1.c0=t2.c0 AND t1.c1 <>ALL (SELECT c1 FROM t2) ORDER BY 1,2;
c0	c1	c0	c1
1	A	1	AB
SELECT /*+USE_MJ(t1,t2)*/ * FROM t1 JOIN t2 ON t1.c0=t2.c0 AND t1.c1 <>ALL (SELECT c1 FROM t2) ORDER BY 1,2;
c0	c1	c0	c1
1	A	1	AB
#IF "_optimizer_null_aware_antijoin"=ON,EXPLAIN:HASH JOIN ANTI SNA
SELECT /*+USE_HASH(t1,t2)*/ * FROM t1 WHERE c1 NOT IN (SELECT c1 FROM t2 WHERE t2.c1 IS NOT NULL) ORDER BY 1,2;
c0	c1
1	A
3	A
SELECT /*+USE_HASH(t1,t2)*/ * FROM t1 JOIN t2 ON t1.c0=t2.c0 AND t1.c1 <>ALL (SELECT c1 FROM t2 WHERE t2.c1 IS NOT NULL) ORDER BY 1,2;
c0	c1	c0	c1
1	A	1	AB
SELECT /*+USE_HASH(t1,t2)*/ * FROM t1 RIGHT JOIN t2 ON t1.c0=t2.c0 WHERE t1.c1 NOT IN (SELECT c1 FROM t2 WHERE t2.c1 IS NOT NULL) ORDER BY 1,2;
c0	c1	c0	c1
1	A	1	AB
SELECT /*+USE_NLJ(t1,t2)*/ * FROM t1 RIGHT JOIN t2 ON t1.c0=t2.c0 WHERE t1.c1 NOT IN (SELECT c1 FROM t2 WHERE t2.c1 IS NOT NULL) ORDER BY 1,2;
c0	c1	c0	c1
1	A	1	AB
SELECT /*+USE_MJ(t1,t2)*/ * FROM t1 JOIN t2 ON t1.c0=t2.c0 AND t1.c1 <>ALL (SELECT c1 FROM t2 WHERE t2.c1 IS NOT NULL) ORDER BY 1,2;
c0	c1	c0	c1
1	A	1	AB
SELECT /*+USE_HASH(t1,t2)*/ * FROM t1 WHERE NOT EXISTS (SELECT c1 FROM t2 WHERE t2.c1 IS NOT NULL) ORDER BY 1,2;
c0	c1
SELECT /*+USE_HASH(t1,t2)*/ * FROM t1 WHERE c1 NOT IN (SELECT c1 FROM t2 WHERE t2.c1 IS NOT NULL) ORDER BY 1,2;
c0	c1
1	A
3	A
SELECT /*+USE_NL(t1,t2)*/ * FROM t1 JOIN t2 ON t1.c0=t2.c0 AND t1.c1 <>ALL (SELECT c1 FROM t2 WHERE t2.c1 IS NOT NULL) ORDER BY 1,2;
c0	c1	c0	c1
1	A	1	AB
SELECT /*+USE_MJ(t1,t2)*/ * FROM t1 JOIN t2 ON t1.c0=t2.c0 AND t1.c1 <>ALL (SELECT c1 FROM t2 WHERE t2.c1 IS NOT NULL) ORDER BY 1,2;
c0	c1	c0	c1
1	A	1	AB
#PARALLEL
#IF "_optimizer_null_aware_antijoin"=ON,EXPLAIN:HASH JOIN ANTI NA
SELECT /*+parallel(2) USE_HASH(t1,t2)*/ * FROM t1 WHERE c1 NOT IN (SELECT c1 FROM t2) ORDER BY 1,2;
c0	c1
1	A
3	A
SELECT /*+parallel(2) USE_HASH(t1,t2)*/ * FROM t1 WHERE c1 <>ALL (SELECT c1 FROM t2) ORDER BY 1,2;
c0	c1
1	A
3	A
SELECT /*+parallel(2) USE_NL(t1,t2)*/ * FROM t1 WHERE c1 <>ALL (SELECT c1 FROM t2) ORDER BY 1,2;
c0	c1
1	A
3	A
SELECT /*+parallel(2) USE_HASH(t1,t2)*/ * FROM t1 WHERE NOT EXISTS (SELECT c1 FROM t2) ORDER BY 1,2;
c0	c1
SELECT /*+parallel(5) USE_HASH(t1,t2)*/ * FROM t1 WHERE c1 NOT IN (SELECT c1 FROM t2) ORDER BY 1,2;
c0	c1
1	A
3	A
SELECT /*+parallel(5) USE_NLJ(t1,t2)*/ * FROM t1 WHERE c1 NOT IN (SELECT c1 FROM t2) ORDER BY 1,2;
c0	c1
1	A
3	A
SELECT /*+parallel(5) USE_HASH(t1,t2)*/ * FROM t1 WHERE c1 <>ALL (SELECT c1 FROM t2) ORDER BY 1,2;
c0	c1
1	A
3	A
SELECT /*+parallel(5) USE_MJ(t1,t2)*/ * FROM t1 WHERE c1 NOT IN (SELECT c1 FROM t2) ORDER BY 1,2;
c0	c1
1	A
3	A
SELECT /*+parallel(5) USE_HASH(t1,t2)*/ * FROM t1 WHERE NOT EXISTS (SELECT c1 FROM t2) ORDER BY 1,2;
c0	c1
SELECT /*+parallel(2) USE_HASH(t1,t2)*/ * FROM t1,t2 WHERE t1.c0=t2.c0 AND t1.c1 NOT IN (SELECT c1 FROM t2) ORDER BY 1,2;
c0	c1	c0	c1
1	A	1	AB
SELECT /*+parallel(2) USE_HASH(t1,t2)*/ * FROM t1,t2 WHERE t1.c0=t2.c0 AND t1.c1 <>ALL (SELECT c1 FROM t2) ORDER BY 1,2;
c0	c1	c0	c1
1	A	1	AB
SELECT /*+parallel(2) USE_MJ(t1,t2)*/ * FROM t1,t2 WHERE t1.c0=t2.c0 AND t1.c1 <>ALL (SELECT c1 FROM t2) ORDER BY 1,2;
c0	c1	c0	c1
1	A	1	AB
SELECT /*+parallel(2) USE_NL(t1,t2)*/ * FROM t1,t2 WHERE t1.c0=t2.c0 AND t1.c1 NOT IN (SELECT c1 FROM t2) ORDER BY 1,2;
c0	c1	c0	c1
1	A	1	AB
SELECT /*+parallel(2) USE_HASH(t1,t2)*/ * FROM t1,t2 WHERE t1.c0=t2.c0 AND NOT EXISTS (SELECT c1 FROM t2) ORDER BY 1,2;
c0	c1	c0	c1
#IF "_optimizer_null_aware_antijoin"=ON,EXPLAIN:HASH JOIN ANTI SNA
SELECT /*+parallel(2) USE_HASH(t1,t2)*/ * FROM t1 WHERE c1 NOT IN (SELECT c1 FROM t2 WHERE t2.c1 IS NOT NULL) ORDER BY 1,2;
c0	c1
1	A
3	A
SELECT /*+parallel(2) USE_HASH(t1,t2)*/ * FROM t1 WHERE c1 <>ALL (SELECT c1 FROM t2 WHERE t2.c1 IS NOT NULL) ORDER BY 1,2;
c0	c1
1	A
3	A
SELECT /*+parallel(2) USE_NL(t1,t2)*/ * FROM t1 WHERE c1 <>ALL (SELECT c1 FROM t2 WHERE t2.c1 IS NOT NULL) ORDER BY 1,2;
c0	c1
1	A
3	A
SELECT /*+parallel(2) USE_HASH(t1,t2)*/ * FROM t1 WHERE NOT EXISTS (SELECT c1 FROM t2 WHERE t2.c1 IS NOT NULL) ORDER BY 1,2;
c0	c1
SELECT /*+parallel(5) USE_HASH(t1,t2)*/ * FROM t1 WHERE c1 NOT IN (SELECT c1 FROM t2 WHERE t2.c1 IS NOT NULL) ORDER BY 1,2;
c0	c1
1	A
3	A
SELECT /*+parallel(5) USE_NLJ(t1,t2)*/ * FROM t1 WHERE c1 NOT IN (SELECT c1 FROM t2 WHERE t2.c1 IS NOT NULL) ORDER BY 1,2;
c0	c1
1	A
3	A
SELECT /*+parallel(5) USE_HASH(t1,t2)*/ * FROM t1 WHERE c1 <>ALL (SELECT c1 FROM t2 WHERE t2.c1 IS NOT NULL) ORDER BY 1,2;
c0	c1
1	A
3	A
SELECT /*+parallel(5) USE_MJ(t1,t2)*/ * FROM t1 WHERE c1 NOT IN (SELECT c1 FROM t2 WHERE t2.c1 IS NOT NULL) ORDER BY 1,2;
c0	c1
1	A
3	A
SELECT /*+parallel(5) USE_HASH(t1,t2)*/ * FROM t1 WHERE NOT EXISTS (SELECT c1 FROM t2 WHERE t2.c1 IS NOT NULL) ORDER BY 1,2;
c0	c1
SELECT /*+parallel(2) USE_HASH(t1,t2)*/ * FROM t1,t2 WHERE t1.c0=t2.c0 AND t1.c1 NOT IN (SELECT c1 FROM t2 WHERE t2.c1 IS NOT NULL) ORDER BY 1,2;
c0	c1	c0	c1
1	A	1	AB
SELECT /*+parallel(2) USE_HASH(t1,t2)*/ * FROM t1,t2 WHERE t1.c0=t2.c0 AND t1.c1 <>ALL (SELECT c1 FROM t2 WHERE t2.c1 IS NOT NULL) ORDER BY 1,2;
c0	c1	c0	c1
1	A	1	AB
SELECT /*+parallel(2) USE_MJ(t1,t2)*/ * FROM t1,t2 WHERE t1.c0=t2.c0 AND t1.c1 <>ALL (SELECT c1 FROM t2 WHERE t2.c1 IS NOT NULL) ORDER BY 1,2;
c0	c1	c0	c1
1	A	1	AB
SELECT /*+parallel(2) USE_NL(t1,t2)*/ * FROM t1,t2 WHERE t1.c0=t2.c0 AND t1.c1 NOT IN (SELECT c1 FROM t2 WHERE t2.c1 IS NOT NULL) ORDER BY 1,2;
c0	c1	c0	c1
1	A	1	AB
SELECT /*+parallel(2) USE_HASH(t1,t2)*/ * FROM t1,t2 WHERE t1.c0=t2.c0 AND NOT EXISTS (SELECT c1 FROM t2 WHERE t2.c1 IS NOT NULL) ORDER BY 1,2;
c0	c1	c0	c1
#Left table is empty
DELETE FROM t1;
INSERT INTO t2 VALUES(3,'');
INSERT INTO t2 VALUES(4,NULL);
SELECT * FROM t1 ORDER BY c0;
c0	c1
SELECT * FROM t2 ORDER BY c0;
c0	c1
1	AB
2	12
3	
4	NULL
5	a
#IF "_optimizer_null_aware_antijoin"=ON,EXPLAIN:HASH JOIN ANTI NA
SELECT * FROM t1 WHERE c1 NOT IN (SELECT c1 FROM t2) ORDER BY 1,2;
c0	c1
SELECT * FROM t1 WHERE NOT EXISTS (SELECT c1 FROM t2) ORDER BY 1,2;
c0	c1
#IF "_optimizer_null_aware_antijoin"=TRUE,EXPLAIN:HASH JOIN ANTI SNA
SELECT * FROM t1 WHERE c1 NOT IN (SELECT c1 FROM t2 WHERE t2.c1 IS NOT NULL) ORDER BY 1,2;
c0	c1
SELECT * FROM t1 WHERE NOT EXISTS (SELECT c1 FROM t2 WHERE t2.c1 IS NOT NULL) ORDER BY 1,2;
c0	c1
#INNER JOIN
#IF "_optimizer_null_aware_antijoin"=ON,EXPLAIN:HASH JOIN ANTI NA
SELECT * FROM t1 JOIN t2 ON t1.c0=t2.c0 AND t1.c1 NOT IN (SELECT c1 FROM t2) ORDER BY 1,2;
c0	c1	c0	c1
SELECT * FROM t1 JOIN t2 ON t1.c0=t2.c0 AND NOT EXISTS (SELECT c1 FROM t2) ORDER BY 1,2;
c0	c1	c0	c1
#IF "_optimizer_null_aware_antijoin"=TRUE,EXPLAIN:HASH JOIN ANTI SNA
SELECT * FROM t1 JOIN t2 ON t1.c0=t2.c0 AND t1.c1 NOT IN (SELECT c1 FROM t2 WHERE t2.c1 IS NOT NULL) ORDER BY 1,2;
c0	c1	c0	c1
SELECT * FROM t1 JOIN t2 ON t1.c0=t2.c0 AND NOT EXISTS (SELECT c1 FROM t2 WHERE t2.c1 IS NOT NULL) ORDER BY 1,2;
c0	c1	c0	c1
#RIGHT JOIN
#IF "_optimizer_null_aware_antijoin"=ON,EXPLAIN:HASH JOIN ANTI NA
SELECT * FROM t1 RIGHT JOIN t2 ON t1.c0=t2.c0 AND t1.c1 NOT IN (SELECT c1 FROM t2) ORDER BY 1,2,3;
c0	c1	c0	c1
NULL	NULL	1	AB
NULL	NULL	2	12
NULL	NULL	3	
NULL	NULL	4	NULL
NULL	NULL	5	a
SELECT * FROM t1 RIGHT JOIN t2 ON t1.c0=t2.c0 AND t1.c1 <>ALL (SELECT c1 FROM t2) ORDER BY 1,2,3;
c0	c1	c0	c1
NULL	NULL	1	AB
NULL	NULL	2	12
NULL	NULL	3	
NULL	NULL	4	NULL
NULL	NULL	5	a
SELECT * FROM t1 RIGHT JOIN t2 ON t1.c0=t2.c0 AND NOT EXISTS (SELECT c1 FROM t2) ORDER BY 1,2,3;
c0	c1	c0	c1
NULL	NULL	1	AB
NULL	NULL	2	12
NULL	NULL	3	
NULL	NULL	4	NULL
NULL	NULL	5	a
#IF "_optimizer_null_aware_antijoin"=ON,EXPLAIN:HASH JOIN ANTI SNA
SELECT * FROM t1 RIGHT JOIN t2 ON t1.c0=t2.c0 AND t1.c1 NOT IN (SELECT c1 FROM t2 WHERE t2.c1 IS NOT NULL) ORDER BY 1,2,3;
c0	c1	c0	c1
NULL	NULL	1	AB
NULL	NULL	2	12
NULL	NULL	3	
NULL	NULL	4	NULL
NULL	NULL	5	a
SELECT * FROM t1 RIGHT JOIN t2 ON t1.c0=t2.c0 AND t1.c1 <>ALL (SELECT c1 FROM t2 WHERE t2.c1 IS NOT NULL) ORDER BY 1,2,3;
c0	c1	c0	c1
NULL	NULL	1	AB
NULL	NULL	2	12
NULL	NULL	3	
NULL	NULL	4	NULL
NULL	NULL	5	a
SELECT * FROM t1 RIGHT JOIN t2 ON t1.c0=t2.c0 AND NOT EXISTS (SELECT c1 FROM t2 WHERE t2.c1 IS NOT NULL) ORDER BY 1,2,3;
c0	c1	c0	c1
NULL	NULL	1	AB
NULL	NULL	2	12
NULL	NULL	3	
NULL	NULL	4	NULL
NULL	NULL	5	a
#LEFT JOIN
#IF "_optimizer_null_aware_antijoin"=ON,EXPLAIN:HASH JOIN ANTI NA
SELECT * FROM t1 LEFT JOIN t2 ON t1.c0=t2.c0 WHERE t1.c1 NOT IN (SELECT c1 FROM t2) ORDER BY 1,2;
c0	c1	c0	c1
SELECT * FROM t1 LEFT JOIN t2 ON t1.c0=t2.c0 WHERE t1.c1 <>ALL (SELECT c1 FROM t2) ORDER BY 1,2;
c0	c1	c0	c1
SELECT * FROM t1 LEFT JOIN t2 ON t1.c0=t2.c0 WHERE NOT EXISTS (SELECT c1 FROM t2) ORDER BY 1,2;
c0	c1	c0	c1
#IF "_optimizer_null_aware_antijoin"=ON,EXPLAIN:HASH JOIN ANTI SNA
SELECT * FROM t1 LEFT JOIN t2 ON t1.c0=t2.c0 WHERE t1.c1 NOT IN (SELECT c1 FROM t2 WHERE t2.c1 IS NOT NULL) ORDER BY 1,2,3;
c0	c1	c0	c1
SELECT * FROM t1 LEFT JOIN t2 ON t1.c0=t2.c0 WHERE t1.c1 <>ALL (SELECT c1 FROM t2 WHERE t2.c1 IS NOT NULL) ORDER BY 1,2,3;
c0	c1	c0	c1
SELECT * FROM t1 LEFT JOIN t2 ON t1.c0=t2.c0 WHERE NOT EXISTS (SELECT c1 FROM t2 WHERE t2.c1 IS NOT NULL) ORDER BY 1,2,3;
c0	c1	c0	c1
#FULL JOIN
#IF "_optimizer_null_aware_antijoin"=ON,EXPLAIN:HASH JOIN ANTI NA
SELECT * FROM t1 FULL JOIN t2 ON t1.c0=t2.c0 WHERE t1.c1 NOT IN (SELECT c1 FROM t2) ORDER BY 1,2;
c0	c1	c0	c1
SELECT * FROM t1 FULL JOIN t2 ON t1.c0=t2.c0 WHERE t1.c1 <>ALL (SELECT c1 FROM t2) ORDER BY 1,2;
c0	c1	c0	c1
SELECT * FROM t1 FULL JOIN t2 ON t1.c0=t2.c0 WHERE NOT EXISTS (SELECT c1 FROM t2) ORDER BY 1,2;
c0	c1	c0	c1
#IF "_optimizer_null_aware_antijoin"=ON,EXPLAIN:HASH JOIN ANTI SNA
SELECT * FROM t1 FULL JOIN t2 ON t1.c0=t2.c0 WHERE t1.c1 NOT IN (SELECT c1 FROM t2 WHERE t2.c1 IS NOT NULL) ORDER BY 1,2,3;
c0	c1	c0	c1
SELECT * FROM t1 FULL JOIN t2 ON t1.c0=t2.c0 WHERE t1.c1 <>ALL (SELECT c1 FROM t2 WHERE t2.c1 IS NOT NULL) ORDER BY 1,2,3;
c0	c1	c0	c1
SELECT * FROM t1 FULL JOIN t2 ON t1.c0=t2.c0 WHERE NOT EXISTS (SELECT c1 FROM t2 WHERE t2.c1 IS NOT NULL) ORDER BY 1,2,3;
c0	c1	c0	c1
#HINT
#IF "_optimizer_null_aware_antijoin"=ON,EXPLAIN:HASH JOIN ANTI NA
SELECT /*+USE_HASH(t1,t2)*/ * FROM t1 WHERE c1 NOT IN (SELECT c1 FROM t2) ORDER BY 1,2;
c0	c1
SELECT /*+USE_HASH(t1,t2)*/ * FROM t1 JOIN t2 ON t1.c0=t2.c0 AND t1.c1 <>ALL (SELECT c1 FROM t2) ORDER BY 1,2;
c0	c1	c0	c1
SELECT /*+USE_HASH(t1,t2)*/ * FROM t1 RIGHT JOIN t2 ON t1.c0=t2.c0 WHERE t1.c1 NOT IN (SELECT c1 FROM t2) ORDER BY 1,2;
c0	c1	c0	c1
SELECT /*+USE_NLJ(t1,t2)*/ * FROM t1 RIGHT JOIN t2 ON t1.c0=t2.c0 WHERE t1.c1 NOT IN (SELECT c1 FROM t2) ORDER BY 1,2;
c0	c1	c0	c1
SELECT /*+USE_MJ(t1,t2)*/ * FROM t1 JOIN t2 ON t1.c0=t2.c0 AND t1.c1 <>ALL (SELECT c1 FROM t2) ORDER BY 1,2;
c0	c1	c0	c1
SELECT /*+USE_HASH(t1,t2)*/ * FROM t1 WHERE NOT EXISTS (SELECT c1 FROM t2) ORDER BY 1,2;
c0	c1
SELECT /*+USE_HASH(t1,t2)*/ * FROM t1 WHERE c1 NOT IN (SELECT c1 FROM t2) ORDER BY 1,2;
c0	c1
SELECT /*+USE_NL(t1,t2)*/ * FROM t1 JOIN t2 ON t1.c0=t2.c0 AND t1.c1 <>ALL (SELECT c1 FROM t2) ORDER BY 1,2;
c0	c1	c0	c1
SELECT /*+USE_MJ(t1,t2)*/ * FROM t1 JOIN t2 ON t1.c0=t2.c0 AND t1.c1 <>ALL (SELECT c1 FROM t2) ORDER BY 1,2;
c0	c1	c0	c1
#IF "_optimizer_null_aware_antijoin"=ON,EXPLAIN:HASH JOIN ANTI SNA
SELECT /*+USE_HASH(t1,t2)*/ * FROM t1 WHERE c1 NOT IN (SELECT c1 FROM t2 WHERE t2.c1 IS NOT NULL) ORDER BY 1,2;
c0	c1
SELECT /*+USE_HASH(t1,t2)*/ * FROM t1 JOIN t2 ON t1.c0=t2.c0 AND t1.c1 <>ALL (SELECT c1 FROM t2 WHERE t2.c1 IS NOT NULL) ORDER BY 1,2;
c0	c1	c0	c1
SELECT /*+USE_HASH(t1,t2)*/ * FROM t1 RIGHT JOIN t2 ON t1.c0=t2.c0 WHERE t1.c1 NOT IN (SELECT c1 FROM t2 WHERE t2.c1 IS NOT NULL) ORDER BY 1,2;
c0	c1	c0	c1
SELECT /*+USE_NLJ(t1,t2)*/ * FROM t1 RIGHT JOIN t2 ON t1.c0=t2.c0 WHERE t1.c1 NOT IN (SELECT c1 FROM t2 WHERE t2.c1 IS NOT NULL) ORDER BY 1,2;
c0	c1	c0	c1
SELECT /*+USE_MJ(t1,t2)*/ * FROM t1 JOIN t2 ON t1.c0=t2.c0 AND t1.c1 <>ALL (SELECT c1 FROM t2 WHERE t2.c1 IS NOT NULL) ORDER BY 1,2;
c0	c1	c0	c1
SELECT /*+USE_HASH(t1,t2)*/ * FROM t1 WHERE NOT EXISTS (SELECT c1 FROM t2 WHERE t2.c1 IS NOT NULL) ORDER BY 1,2;
c0	c1
SELECT /*+USE_HASH(t1,t2)*/ * FROM t1 WHERE c1 NOT IN (SELECT c1 FROM t2 WHERE t2.c1 IS NOT NULL) ORDER BY 1,2;
c0	c1
SELECT /*+USE_NL(t1,t2)*/ * FROM t1 JOIN t2 ON t1.c0=t2.c0 AND t1.c1 <>ALL (SELECT c1 FROM t2 WHERE t2.c1 IS NOT NULL) ORDER BY 1,2;
c0	c1	c0	c1
SELECT /*+USE_MJ(t1,t2)*/ * FROM t1 JOIN t2 ON t1.c0=t2.c0 AND t1.c1 <>ALL (SELECT c1 FROM t2 WHERE t2.c1 IS NOT NULL) ORDER BY 1,2;
c0	c1	c0	c1
#PARALLEL
#IF "_optimizer_null_aware_antijoin"=ON,EXPLAIN:HASH JOIN ANTI NA
SELECT /*+parallel(2) USE_HASH(t1,t2)*/ * FROM t1 WHERE c1 NOT IN (SELECT c1 FROM t2) ORDER BY 1,2;
c0	c1
SELECT /*+parallel(2) USE_HASH(t1,t2)*/ * FROM t1 WHERE c1 <>ALL (SELECT c1 FROM t2) ORDER BY 1,2;
c0	c1
SELECT /*+parallel(2) USE_NL(t1,t2)*/ * FROM t1 WHERE c1 <>ALL (SELECT c1 FROM t2) ORDER BY 1,2;
c0	c1
SELECT /*+parallel(2) USE_HASH(t1,t2)*/ * FROM t1 WHERE NOT EXISTS (SELECT c1 FROM t2) ORDER BY 1,2;
c0	c1
SELECT /*+parallel(5) USE_HASH(t1,t2)*/ * FROM t1 WHERE c1 NOT IN (SELECT c1 FROM t2) ORDER BY 1,2;
c0	c1
SELECT /*+parallel(5) USE_NLJ(t1,t2)*/ * FROM t1 WHERE c1 NOT IN (SELECT c1 FROM t2) ORDER BY 1,2;
c0	c1
SELECT /*+parallel(5) USE_HASH(t1,t2)*/ * FROM t1 WHERE c1 <>ALL (SELECT c1 FROM t2) ORDER BY 1,2;
c0	c1
SELECT /*+parallel(5) USE_MJ(t1,t2)*/ * FROM t1 WHERE c1 NOT IN (SELECT c1 FROM t2) ORDER BY 1,2;
c0	c1
SELECT /*+parallel(5) USE_HASH(t1,t2)*/ * FROM t1 WHERE NOT EXISTS (SELECT c1 FROM t2) ORDER BY 1,2;
c0	c1
SELECT /*+parallel(2) USE_HASH(t1,t2)*/ * FROM t1,t2 WHERE t1.c0=t2.c0 AND t1.c1 NOT IN (SELECT c1 FROM t2) ORDER BY 1,2;
c0	c1	c0	c1
SELECT /*+parallel(2) USE_HASH(t1,t2)*/ * FROM t1,t2 WHERE t1.c0=t2.c0 AND t1.c1 <>ALL (SELECT c1 FROM t2) ORDER BY 1,2;
c0	c1	c0	c1
SELECT /*+parallel(2) USE_MJ(t1,t2)*/ * FROM t1,t2 WHERE t1.c0=t2.c0 AND t1.c1 <>ALL (SELECT c1 FROM t2) ORDER BY 1,2;
c0	c1	c0	c1
SELECT /*+parallel(2) USE_NL(t1,t2)*/ * FROM t1,t2 WHERE t1.c0=t2.c0 AND t1.c1 NOT IN (SELECT c1 FROM t2) ORDER BY 1,2;
c0	c1	c0	c1
SELECT /*+parallel(2) USE_HASH(t1,t2)*/ * FROM t1,t2 WHERE t1.c0=t2.c0 AND NOT EXISTS (SELECT c1 FROM t2) ORDER BY 1,2;
c0	c1	c0	c1
#IF "_optimizer_null_aware_antijoin"=ON,EXPLAIN:HASH JOIN ANTI SNA
SELECT /*+parallel(2) USE_HASH(t1,t2)*/ * FROM t1 WHERE c1 NOT IN (SELECT c1 FROM t2 WHERE t2.c1 IS NOT NULL) ORDER BY 1,2;
c0	c1
SELECT /*+parallel(2) USE_HASH(t1,t2)*/ * FROM t1 WHERE c1 <>ALL (SELECT c1 FROM t2 WHERE t2.c1 IS NOT NULL) ORDER BY 1,2;
c0	c1
SELECT /*+parallel(2) USE_NL(t1,t2)*/ * FROM t1 WHERE c1 <>ALL (SELECT c1 FROM t2 WHERE t2.c1 IS NOT NULL) ORDER BY 1,2;
c0	c1
SELECT /*+parallel(2) USE_HASH(t1,t2)*/ * FROM t1 WHERE NOT EXISTS (SELECT c1 FROM t2 WHERE t2.c1 IS NOT NULL) ORDER BY 1,2;
c0	c1
SELECT /*+parallel(5) USE_HASH(t1,t2)*/ * FROM t1 WHERE c1 NOT IN (SELECT c1 FROM t2 WHERE t2.c1 IS NOT NULL) ORDER BY 1,2;
c0	c1
SELECT /*+parallel(5) USE_NLJ(t1,t2)*/ * FROM t1 WHERE c1 NOT IN (SELECT c1 FROM t2 WHERE t2.c1 IS NOT NULL) ORDER BY 1,2;
c0	c1
SELECT /*+parallel(5) USE_HASH(t1,t2)*/ * FROM t1 WHERE c1 <>ALL (SELECT c1 FROM t2 WHERE t2.c1 IS NOT NULL) ORDER BY 1,2;
c0	c1
SELECT /*+parallel(5) USE_MJ(t1,t2)*/ * FROM t1 WHERE c1 NOT IN (SELECT c1 FROM t2 WHERE t2.c1 IS NOT NULL) ORDER BY 1,2;
c0	c1
SELECT /*+parallel(5) USE_HASH(t1,t2)*/ * FROM t1 WHERE NOT EXISTS (SELECT c1 FROM t2 WHERE t2.c1 IS NOT NULL) ORDER BY 1,2;
c0	c1
SELECT /*+parallel(2) USE_HASH(t1,t2)*/ * FROM t1,t2 WHERE t1.c0=t2.c0 AND t1.c1 NOT IN (SELECT c1 FROM t2 WHERE t2.c1 IS NOT NULL) ORDER BY 1,2;
c0	c1	c0	c1
SELECT /*+parallel(2) USE_HASH(t1,t2)*/ * FROM t1,t2 WHERE t1.c0=t2.c0 AND t1.c1 <>ALL (SELECT c1 FROM t2 WHERE t2.c1 IS NOT NULL) ORDER BY 1,2;
c0	c1	c0	c1
SELECT /*+parallel(2) USE_MJ(t1,t2)*/ * FROM t1,t2 WHERE t1.c0=t2.c0 AND t1.c1 <>ALL (SELECT c1 FROM t2 WHERE t2.c1 IS NOT NULL) ORDER BY 1,2;
c0	c1	c0	c1
SELECT /*+parallel(2) USE_NL(t1,t2)*/ * FROM t1,t2 WHERE t1.c0=t2.c0 AND t1.c1 NOT IN (SELECT c1 FROM t2 WHERE t2.c1 IS NOT NULL) ORDER BY 1,2;
c0	c1	c0	c1
SELECT /*+parallel(2) USE_HASH(t1,t2)*/ * FROM t1,t2 WHERE t1.c0=t2.c0 AND NOT EXISTS (SELECT c1 FROM t2 WHERE t2.c1 IS NOT NULL) ORDER BY 1,2;
c0	c1	c0	c1
#right table is empty
DELETE FROM t2;
INSERT INTO t1 VALUES(1,'A');
INSERT INTO t1 VALUES(2,'12');
INSERT INTO t1 VALUES(3,'A');
INSERT INTO t1 VALUES(4,'');
INSERT INTO t1 VALUES(5,NULL);
SELECT * FROM t1 ORDER BY c0;
c0	c1
1	A
2	12
3	A
4	
5	NULL
SELECT * FROM t2 ORDER BY c0;
c0	c1
#IF "_optimizer_null_aware_antijoin"=ON,EXPLAIN:HASH JOIN ANTI NA
SELECT * FROM t1 WHERE c1 NOT IN (SELECT c1 FROM t2) ORDER BY 1,2;
c0	c1
1	A
2	12
3	A
4	
5	NULL
SELECT * FROM t1 WHERE NOT EXISTS (SELECT c1 FROM t2) ORDER BY 1,2;
c0	c1
1	A
2	12
3	A
4	
5	NULL
#IF "_optimizer_null_aware_antijoin"=TRUE,EXPLAIN:HASH JOIN ANTI SNA
SELECT * FROM t1 WHERE c1 NOT IN (SELECT c1 FROM t2 WHERE t2.c1 IS NOT NULL) ORDER BY 1,2;
c0	c1
1	A
2	12
3	A
4	
5	NULL
SELECT * FROM t1 WHERE NOT EXISTS (SELECT c1 FROM t2 WHERE t2.c1 IS NOT NULL) ORDER BY 1,2;
c0	c1
1	A
2	12
3	A
4	
5	NULL
#INNER JOIN
#IF "_optimizer_null_aware_antijoin"=ON,EXPLAIN:HASH JOIN ANTI NA
SELECT * FROM t1 JOIN t2 ON t1.c0=t2.c0 AND t1.c1 NOT IN (SELECT c1 FROM t2) ORDER BY 1,2;
c0	c1	c0	c1
SELECT * FROM t1 JOIN t2 ON t1.c0=t2.c0 AND NOT EXISTS (SELECT c1 FROM t2) ORDER BY 1,2;
c0	c1	c0	c1
#IF "_optimizer_null_aware_antijoin"=TRUE,EXPLAIN:HASH JOIN ANTI SNA
SELECT * FROM t1 JOIN t2 ON t1.c0=t2.c0 AND t1.c1 NOT IN (SELECT c1 FROM t2 WHERE t2.c1 IS NOT NULL) ORDER BY 1,2;
c0	c1	c0	c1
SELECT * FROM t1 JOIN t2 ON t1.c0=t2.c0 AND NOT EXISTS (SELECT c1 FROM t2 WHERE t2.c1 IS NOT NULL) ORDER BY 1,2;
c0	c1	c0	c1
#RIGHT JOIN
#IF "_optimizer_null_aware_antijoin"=ON,EXPLAIN:HASH JOIN ANTI NA
SELECT * FROM t1 RIGHT JOIN t2 ON t1.c0=t2.c0 AND t1.c1 NOT IN (SELECT c1 FROM t2) ORDER BY 1,2,3;
c0	c1	c0	c1
SELECT * FROM t1 RIGHT JOIN t2 ON t1.c0=t2.c0 AND t1.c1 <>ALL (SELECT c1 FROM t2) ORDER BY 1,2,3;
c0	c1	c0	c1
SELECT * FROM t1 RIGHT JOIN t2 ON t1.c0=t2.c0 AND NOT EXISTS (SELECT c1 FROM t2) ORDER BY 1,2,3;
c0	c1	c0	c1
#IF "_optimizer_null_aware_antijoin"=ON,EXPLAIN:HASH JOIN ANTI SNA
SELECT * FROM t1 RIGHT JOIN t2 ON t1.c0=t2.c0 AND t1.c1 NOT IN (SELECT c1 FROM t2 WHERE t2.c1 IS NOT NULL) ORDER BY 1,2,3;
c0	c1	c0	c1
SELECT * FROM t1 RIGHT JOIN t2 ON t1.c0=t2.c0 AND t1.c1 <>ALL (SELECT c1 FROM t2 WHERE t2.c1 IS NOT NULL) ORDER BY 1,2,3;
c0	c1	c0	c1
SELECT * FROM t1 RIGHT JOIN t2 ON t1.c0=t2.c0 AND NOT EXISTS (SELECT c1 FROM t2 WHERE t2.c1 IS NOT NULL) ORDER BY 1,2,3;
c0	c1	c0	c1
#LEFT JOIN
#IF "_optimizer_null_aware_antijoin"=ON,EXPLAIN:HASH JOIN ANTI NA
SELECT * FROM t1 LEFT JOIN t2 ON t1.c0=t2.c0 WHERE t1.c1 NOT IN (SELECT c1 FROM t2) ORDER BY 1,2;
c0	c1	c0	c1
1	A	NULL	NULL
2	12	NULL	NULL
3	A	NULL	NULL
4		NULL	NULL
5	NULL	NULL	NULL
SELECT * FROM t1 LEFT JOIN t2 ON t1.c0=t2.c0 WHERE t1.c1 <>ALL (SELECT c1 FROM t2) ORDER BY 1,2;
c0	c1	c0	c1
1	A	NULL	NULL
2	12	NULL	NULL
3	A	NULL	NULL
4		NULL	NULL
5	NULL	NULL	NULL
SELECT * FROM t1 LEFT JOIN t2 ON t1.c0=t2.c0 WHERE NOT EXISTS (SELECT c1 FROM t2) ORDER BY 1,2;
c0	c1	c0	c1
1	A	NULL	NULL
2	12	NULL	NULL
3	A	NULL	NULL
4		NULL	NULL
5	NULL	NULL	NULL
#IF "_optimizer_null_aware_antijoin"=ON,EXPLAIN:HASH JOIN ANTI SNA
SELECT * FROM t1 LEFT JOIN t2 ON t1.c0=t2.c0 WHERE t1.c1 NOT IN (SELECT c1 FROM t2 WHERE t2.c1 IS NOT NULL) ORDER BY 1,2,3;
c0	c1	c0	c1
1	A	NULL	NULL
2	12	NULL	NULL
3	A	NULL	NULL
4		NULL	NULL
5	NULL	NULL	NULL
SELECT * FROM t1 LEFT JOIN t2 ON t1.c0=t2.c0 WHERE t1.c1 <>ALL (SELECT c1 FROM t2 WHERE t2.c1 IS NOT NULL) ORDER BY 1,2,3;
c0	c1	c0	c1
1	A	NULL	NULL
2	12	NULL	NULL
3	A	NULL	NULL
4		NULL	NULL
5	NULL	NULL	NULL
SELECT * FROM t1 LEFT JOIN t2 ON t1.c0=t2.c0 WHERE NOT EXISTS (SELECT c1 FROM t2 WHERE t2.c1 IS NOT NULL) ORDER BY 1,2,3;
c0	c1	c0	c1
1	A	NULL	NULL
2	12	NULL	NULL
3	A	NULL	NULL
4		NULL	NULL
5	NULL	NULL	NULL
#FULL JOIN
#IF "_optimizer_null_aware_antijoin"=ON,EXPLAIN:HASH JOIN ANTI NA
SELECT * FROM t1 FULL JOIN t2 ON t1.c0=t2.c0 WHERE t1.c1 NOT IN (SELECT c1 FROM t2) ORDER BY 1,2;
c0	c1	c0	c1
1	A	NULL	NULL
2	12	NULL	NULL
3	A	NULL	NULL
4		NULL	NULL
5	NULL	NULL	NULL
SELECT * FROM t1 FULL JOIN t2 ON t1.c0=t2.c0 WHERE t1.c1 <>ALL (SELECT c1 FROM t2) ORDER BY 1,2;
c0	c1	c0	c1
1	A	NULL	NULL
2	12	NULL	NULL
3	A	NULL	NULL
4		NULL	NULL
5	NULL	NULL	NULL
SELECT * FROM t1 FULL JOIN t2 ON t1.c0=t2.c0 WHERE NOT EXISTS (SELECT c1 FROM t2) ORDER BY 1,2;
c0	c1	c0	c1
1	A	NULL	NULL
2	12	NULL	NULL
3	A	NULL	NULL
4		NULL	NULL
5	NULL	NULL	NULL
#IF "_optimizer_null_aware_antijoin"=ON,EXPLAIN:HASH JOIN ANTI SNA
SELECT * FROM t1 FULL JOIN t2 ON t1.c0=t2.c0 WHERE t1.c1 NOT IN (SELECT c1 FROM t2 WHERE t2.c1 IS NOT NULL) ORDER BY 1,2,3;
c0	c1	c0	c1
1	A	NULL	NULL
2	12	NULL	NULL
3	A	NULL	NULL
4		NULL	NULL
5	NULL	NULL	NULL
SELECT * FROM t1 FULL JOIN t2 ON t1.c0=t2.c0 WHERE t1.c1 <>ALL (SELECT c1 FROM t2 WHERE t2.c1 IS NOT NULL) ORDER BY 1,2,3;
c0	c1	c0	c1
1	A	NULL	NULL
2	12	NULL	NULL
3	A	NULL	NULL
4		NULL	NULL
5	NULL	NULL	NULL
SELECT * FROM t1 FULL JOIN t2 ON t1.c0=t2.c0 WHERE NOT EXISTS (SELECT c1 FROM t2 WHERE t2.c1 IS NOT NULL) ORDER BY 1,2,3;
c0	c1	c0	c1
1	A	NULL	NULL
2	12	NULL	NULL
3	A	NULL	NULL
4		NULL	NULL
5	NULL	NULL	NULL
#HINT
#IF "_optimizer_null_aware_antijoin"=ON,EXPLAIN:HASH JOIN ANTI NA
SELECT /*+USE_HASH(t1,t2)*/ * FROM t1 WHERE c1 NOT IN (SELECT c1 FROM t2) ORDER BY 1,2;
c0	c1
1	A
2	12
3	A
4	
5	NULL
SELECT /*+USE_HASH(t1,t2)*/ * FROM t1 JOIN t2 ON t1.c0=t2.c0 AND t1.c1 <>ALL (SELECT c1 FROM t2) ORDER BY 1,2;
c0	c1	c0	c1
SELECT /*+USE_HASH(t1,t2)*/ * FROM t1 RIGHT JOIN t2 ON t1.c0=t2.c0 WHERE t1.c1 NOT IN (SELECT c1 FROM t2) ORDER BY 1,2;
c0	c1	c0	c1
SELECT /*+USE_NLJ(t1,t2)*/ * FROM t1 RIGHT JOIN t2 ON t1.c0=t2.c0 WHERE t1.c1 NOT IN (SELECT c1 FROM t2) ORDER BY 1,2;
c0	c1	c0	c1
SELECT /*+USE_MJ(t1,t2)*/ * FROM t1 JOIN t2 ON t1.c0=t2.c0 AND t1.c1 <>ALL (SELECT c1 FROM t2) ORDER BY 1,2;
c0	c1	c0	c1
SELECT /*+USE_HASH(t1,t2)*/ * FROM t1 WHERE NOT EXISTS (SELECT c1 FROM t2) ORDER BY 1,2;
c0	c1
1	A
2	12
3	A
4	
5	NULL
SELECT /*+USE_HASH(t1,t2)*/ * FROM t1 WHERE c1 NOT IN (SELECT c1 FROM t2) ORDER BY 1,2;
c0	c1
1	A
2	12
3	A
4	
5	NULL
SELECT /*+USE_NL(t1,t2)*/ * FROM t1 JOIN t2 ON t1.c0=t2.c0 AND t1.c1 <>ALL (SELECT c1 FROM t2) ORDER BY 1,2;
c0	c1	c0	c1
SELECT /*+USE_MJ(t1,t2)*/ * FROM t1 JOIN t2 ON t1.c0=t2.c0 AND t1.c1 <>ALL (SELECT c1 FROM t2) ORDER BY 1,2;
c0	c1	c0	c1
#IF "_optimizer_null_aware_antijoin"=ON,EXPLAIN:HASH JOIN ANTI SNA
SELECT /*+USE_HASH(t1,t2)*/ * FROM t1 WHERE c1 NOT IN (SELECT c1 FROM t2 WHERE t2.c1 IS NOT NULL) ORDER BY 1,2;
c0	c1
1	A
2	12
3	A
4	
5	NULL
SELECT /*+USE_HASH(t1,t2)*/ * FROM t1 JOIN t2 ON t1.c0=t2.c0 AND t1.c1 <>ALL (SELECT c1 FROM t2 WHERE t2.c1 IS NOT NULL) ORDER BY 1,2;
c0	c1	c0	c1
SELECT /*+USE_HASH(t1,t2)*/ * FROM t1 RIGHT JOIN t2 ON t1.c0=t2.c0 WHERE t1.c1 NOT IN (SELECT c1 FROM t2 WHERE t2.c1 IS NOT NULL) ORDER BY 1,2;
c0	c1	c0	c1
SELECT /*+USE_NLJ(t1,t2)*/ * FROM t1 RIGHT JOIN t2 ON t1.c0=t2.c0 WHERE t1.c1 NOT IN (SELECT c1 FROM t2 WHERE t2.c1 IS NOT NULL) ORDER BY 1,2;
c0	c1	c0	c1
SELECT /*+USE_MJ(t1,t2)*/ * FROM t1 JOIN t2 ON t1.c0=t2.c0 AND t1.c1 <>ALL (SELECT c1 FROM t2 WHERE t2.c1 IS NOT NULL) ORDER BY 1,2;
c0	c1	c0	c1
SELECT /*+USE_HASH(t1,t2)*/ * FROM t1 WHERE NOT EXISTS (SELECT c1 FROM t2 WHERE t2.c1 IS NOT NULL) ORDER BY 1,2;
c0	c1
1	A
2	12
3	A
4	
5	NULL
SELECT /*+USE_HASH(t1,t2)*/ * FROM t1 WHERE c1 NOT IN (SELECT c1 FROM t2 WHERE t2.c1 IS NOT NULL) ORDER BY 1,2;
c0	c1
1	A
2	12
3	A
4	
5	NULL
SELECT /*+USE_NL(t1,t2)*/ * FROM t1 JOIN t2 ON t1.c0=t2.c0 AND t1.c1 <>ALL (SELECT c1 FROM t2 WHERE t2.c1 IS NOT NULL) ORDER BY 1,2;
c0	c1	c0	c1
SELECT /*+USE_MJ(t1,t2)*/ * FROM t1 JOIN t2 ON t1.c0=t2.c0 AND t1.c1 <>ALL (SELECT c1 FROM t2 WHERE t2.c1 IS NOT NULL) ORDER BY 1,2;
c0	c1	c0	c1
#PARALLEL
#IF "_optimizer_null_aware_antijoin"=ON,EXPLAIN:HASH JOIN ANTI NA
SELECT /*+parallel(2) USE_HASH(t1,t2)*/ * FROM t1 WHERE c1 NOT IN (SELECT c1 FROM t2) ORDER BY 1,2;
c0	c1
1	A
2	12
3	A
4	
5	NULL
SELECT /*+parallel(2) USE_HASH(t1,t2)*/ * FROM t1 WHERE c1 <>ALL (SELECT c1 FROM t2) ORDER BY 1,2;
c0	c1
1	A
2	12
3	A
4	
5	NULL
SELECT /*+parallel(2) USE_NL(t1,t2)*/ * FROM t1 WHERE c1 <>ALL (SELECT c1 FROM t2) ORDER BY 1,2;
c0	c1
1	A
2	12
3	A
4	
5	NULL
SELECT /*+parallel(2) USE_HASH(t1,t2)*/ * FROM t1 WHERE NOT EXISTS (SELECT c1 FROM t2) ORDER BY 1,2;
c0	c1
1	A
2	12
3	A
4	
5	NULL
SELECT /*+parallel(5) USE_HASH(t1,t2)*/ * FROM t1 WHERE c1 NOT IN (SELECT c1 FROM t2) ORDER BY 1,2;
c0	c1
1	A
2	12
3	A
4	
5	NULL
SELECT /*+parallel(5) USE_NLJ(t1,t2)*/ * FROM t1 WHERE c1 NOT IN (SELECT c1 FROM t2) ORDER BY 1,2;
c0	c1
1	A
2	12
3	A
4	
5	NULL
SELECT /*+parallel(5) USE_HASH(t1,t2)*/ * FROM t1 WHERE c1 <>ALL (SELECT c1 FROM t2) ORDER BY 1,2;
c0	c1
1	A
2	12
3	A
4	
5	NULL
SELECT /*+parallel(5) USE_MJ(t1,t2)*/ * FROM t1 WHERE c1 NOT IN (SELECT c1 FROM t2) ORDER BY 1,2;
c0	c1
1	A
2	12
3	A
4	
5	NULL
SELECT /*+parallel(5) USE_HASH(t1,t2)*/ * FROM t1 WHERE NOT EXISTS (SELECT c1 FROM t2) ORDER BY 1,2;
c0	c1
1	A
2	12
3	A
4	
5	NULL
SELECT /*+parallel(2) USE_HASH(t1,t2)*/ * FROM t1,t2 WHERE t1.c0=t2.c0 AND t1.c1 NOT IN (SELECT c1 FROM t2) ORDER BY 1,2;
c0	c1	c0	c1
SELECT /*+parallel(2) USE_HASH(t1,t2)*/ * FROM t1,t2 WHERE t1.c0=t2.c0 AND t1.c1 <>ALL (SELECT c1 FROM t2) ORDER BY 1,2;
c0	c1	c0	c1
SELECT /*+parallel(2) USE_MJ(t1,t2)*/ * FROM t1,t2 WHERE t1.c0=t2.c0 AND t1.c1 <>ALL (SELECT c1 FROM t2) ORDER BY 1,2;
c0	c1	c0	c1
SELECT /*+parallel(2) USE_NL(t1,t2)*/ * FROM t1,t2 WHERE t1.c0=t2.c0 AND t1.c1 NOT IN (SELECT c1 FROM t2) ORDER BY 1,2;
c0	c1	c0	c1
SELECT /*+parallel(2) USE_HASH(t1,t2)*/ * FROM t1,t2 WHERE t1.c0=t2.c0 AND NOT EXISTS (SELECT c1 FROM t2) ORDER BY 1,2;
c0	c1	c0	c1
#IF "_optimizer_null_aware_antijoin"=ON,EXPLAIN:HASH JOIN ANTI SNA
SELECT /*+parallel(2) USE_HASH(t1,t2)*/ * FROM t1 WHERE c1 NOT IN (SELECT c1 FROM t2 WHERE t2.c1 IS NOT NULL) ORDER BY 1,2;
c0	c1
1	A
2	12
3	A
4	
5	NULL
SELECT /*+parallel(2) USE_HASH(t1,t2)*/ * FROM t1 WHERE c1 <>ALL (SELECT c1 FROM t2 WHERE t2.c1 IS NOT NULL) ORDER BY 1,2;
c0	c1
1	A
2	12
3	A
4	
5	NULL
SELECT /*+parallel(2) USE_NL(t1,t2)*/ * FROM t1 WHERE c1 <>ALL (SELECT c1 FROM t2 WHERE t2.c1 IS NOT NULL) ORDER BY 1,2;
c0	c1
1	A
2	12
3	A
4	
5	NULL
SELECT /*+parallel(2) USE_HASH(t1,t2)*/ * FROM t1 WHERE NOT EXISTS (SELECT c1 FROM t2 WHERE t2.c1 IS NOT NULL) ORDER BY 1,2;
c0	c1
1	A
2	12
3	A
4	
5	NULL
SELECT /*+parallel(5) USE_HASH(t1,t2)*/ * FROM t1 WHERE c1 NOT IN (SELECT c1 FROM t2 WHERE t2.c1 IS NOT NULL) ORDER BY 1,2;
c0	c1
1	A
2	12
3	A
4	
5	NULL
SELECT /*+parallel(5) USE_NLJ(t1,t2)*/ * FROM t1 WHERE c1 NOT IN (SELECT c1 FROM t2 WHERE t2.c1 IS NOT NULL) ORDER BY 1,2;
c0	c1
1	A
2	12
3	A
4	
5	NULL
SELECT /*+parallel(5) USE_HASH(t1,t2)*/ * FROM t1 WHERE c1 <>ALL (SELECT c1 FROM t2 WHERE t2.c1 IS NOT NULL) ORDER BY 1,2;
c0	c1
1	A
2	12
3	A
4	
5	NULL
SELECT /*+parallel(5) USE_MJ(t1,t2)*/ * FROM t1 WHERE c1 NOT IN (SELECT c1 FROM t2 WHERE t2.c1 IS NOT NULL) ORDER BY 1,2;
c0	c1
1	A
2	12
3	A
4	
5	NULL
SELECT /*+parallel(5) USE_HASH(t1,t2)*/ * FROM t1 WHERE NOT EXISTS (SELECT c1 FROM t2 WHERE t2.c1 IS NOT NULL) ORDER BY 1,2;
c0	c1
1	A
2	12
3	A
4	
5	NULL
SELECT /*+parallel(2) USE_HASH(t1,t2)*/ * FROM t1,t2 WHERE t1.c0=t2.c0 AND t1.c1 NOT IN (SELECT c1 FROM t2 WHERE t2.c1 IS NOT NULL) ORDER BY 1,2;
c0	c1	c0	c1
SELECT /*+parallel(2) USE_HASH(t1,t2)*/ * FROM t1,t2 WHERE t1.c0=t2.c0 AND t1.c1 <>ALL (SELECT c1 FROM t2 WHERE t2.c1 IS NOT NULL) ORDER BY 1,2;
c0	c1	c0	c1
SELECT /*+parallel(2) USE_MJ(t1,t2)*/ * FROM t1,t2 WHERE t1.c0=t2.c0 AND t1.c1 <>ALL (SELECT c1 FROM t2 WHERE t2.c1 IS NOT NULL) ORDER BY 1,2;
c0	c1	c0	c1
SELECT /*+parallel(2) USE_NL(t1,t2)*/ * FROM t1,t2 WHERE t1.c0=t2.c0 AND t1.c1 NOT IN (SELECT c1 FROM t2 WHERE t2.c1 IS NOT NULL) ORDER BY 1,2;
c0	c1	c0	c1
SELECT /*+parallel(2) USE_HASH(t1,t2)*/ * FROM t1,t2 WHERE t1.c0=t2.c0 AND NOT EXISTS (SELECT c1 FROM t2 WHERE t2.c1 IS NOT NULL) ORDER BY 1,2;
c0	c1	c0	c1
#The left and right tables are empty
DELETE FROM t2;
DELETE FROM t1;
SELECT * FROM t1 ORDER BY c0;
c0	c1
SELECT * FROM t2 ORDER BY c0;
c0	c1
#IF "_optimizer_null_aware_antijoin"=ON,EXPLAIN:HASH JOIN ANTI NA
SELECT * FROM t1 WHERE c1 NOT IN (SELECT c1 FROM t2) ORDER BY 1,2;
c0	c1
SELECT * FROM t1 WHERE NOT EXISTS (SELECT c1 FROM t2) ORDER BY 1,2;
c0	c1
#IF "_optimizer_null_aware_antijoin"=TRUE,EXPLAIN:HASH JOIN ANTI SNA
SELECT * FROM t1 WHERE c1 NOT IN (SELECT c1 FROM t2 WHERE t2.c1 IS NOT NULL) ORDER BY 1,2;
c0	c1
SELECT * FROM t1 WHERE NOT EXISTS (SELECT c1 FROM t2 WHERE t2.c1 IS NOT NULL) ORDER BY 1,2;
c0	c1
#INNER JOIN
#IF "_optimizer_null_aware_antijoin"=ON,EXPLAIN:HASH JOIN ANTI NA
SELECT * FROM t1 JOIN t2 ON t1.c0=t2.c0 AND t1.c1 NOT IN (SELECT c1 FROM t2) ORDER BY 1,2;
c0	c1	c0	c1
SELECT * FROM t1 JOIN t2 ON t1.c0=t2.c0 AND NOT EXISTS (SELECT c1 FROM t2) ORDER BY 1,2;
c0	c1	c0	c1
#IF "_optimizer_null_aware_antijoin"=TRUE,EXPLAIN:HASH JOIN ANTI SNA
SELECT * FROM t1 JOIN t2 ON t1.c0=t2.c0 AND t1.c1 NOT IN (SELECT c1 FROM t2 WHERE t2.c1 IS NOT NULL) ORDER BY 1,2;
c0	c1	c0	c1
SELECT * FROM t1 JOIN t2 ON t1.c0=t2.c0 AND NOT EXISTS (SELECT c1 FROM t2 WHERE t2.c1 IS NOT NULL) ORDER BY 1,2;
c0	c1	c0	c1
#RIGHT JOIN
#IF "_optimizer_null_aware_antijoin"=ON,EXPLAIN:HASH JOIN ANTI NA
SELECT * FROM t1 RIGHT JOIN t2 ON t1.c0=t2.c0 AND t1.c1 NOT IN (SELECT c1 FROM t2) ORDER BY 1,2,3;
c0	c1	c0	c1
SELECT * FROM t1 RIGHT JOIN t2 ON t1.c0=t2.c0 AND t1.c1 <>ALL (SELECT c1 FROM t2) ORDER BY 1,2,3;
c0	c1	c0	c1
SELECT * FROM t1 RIGHT JOIN t2 ON t1.c0=t2.c0 AND NOT EXISTS (SELECT c1 FROM t2) ORDER BY 1,2,3;
c0	c1	c0	c1
#IF "_optimizer_null_aware_antijoin"=ON,EXPLAIN:HASH JOIN ANTI SNA
SELECT * FROM t1 RIGHT JOIN t2 ON t1.c0=t2.c0 AND t1.c1 NOT IN (SELECT c1 FROM t2 WHERE t2.c1 IS NOT NULL) ORDER BY 1,2,3;
c0	c1	c0	c1
SELECT * FROM t1 RIGHT JOIN t2 ON t1.c0=t2.c0 AND t1.c1 <>ALL (SELECT c1 FROM t2 WHERE t2.c1 IS NOT NULL) ORDER BY 1,2,3;
c0	c1	c0	c1
SELECT * FROM t1 RIGHT JOIN t2 ON t1.c0=t2.c0 AND NOT EXISTS (SELECT c1 FROM t2 WHERE t2.c1 IS NOT NULL) ORDER BY 1,2,3;
c0	c1	c0	c1
#LEFT JOIN
#IF "_optimizer_null_aware_antijoin"=ON,EXPLAIN:HASH JOIN ANTI NA
SELECT * FROM t1 LEFT JOIN t2 ON t1.c0=t2.c0 WHERE t1.c1 NOT IN (SELECT c1 FROM t2) ORDER BY 1,2;
c0	c1	c0	c1
SELECT * FROM t1 LEFT JOIN t2 ON t1.c0=t2.c0 WHERE t1.c1 <>ALL (SELECT c1 FROM t2) ORDER BY 1,2;
c0	c1	c0	c1
SELECT * FROM t1 LEFT JOIN t2 ON t1.c0=t2.c0 WHERE NOT EXISTS (SELECT c1 FROM t2) ORDER BY 1,2;
c0	c1	c0	c1
#IF "_optimizer_null_aware_antijoin"=ON,EXPLAIN:HASH JOIN ANTI SNA
SELECT * FROM t1 LEFT JOIN t2 ON t1.c0=t2.c0 WHERE t1.c1 NOT IN (SELECT c1 FROM t2 WHERE t2.c1 IS NOT NULL) ORDER BY 1,2,3;
c0	c1	c0	c1
SELECT * FROM t1 LEFT JOIN t2 ON t1.c0=t2.c0 WHERE t1.c1 <>ALL (SELECT c1 FROM t2 WHERE t2.c1 IS NOT NULL) ORDER BY 1,2,3;
c0	c1	c0	c1
SELECT * FROM t1 LEFT JOIN t2 ON t1.c0=t2.c0 WHERE NOT EXISTS (SELECT c1 FROM t2 WHERE t2.c1 IS NOT NULL) ORDER BY 1,2,3;
c0	c1	c0	c1
#FULL JOIN
#IF "_optimizer_null_aware_antijoin"=ON,EXPLAIN:HASH JOIN ANTI NA
SELECT * FROM t1 FULL JOIN t2 ON t1.c0=t2.c0 WHERE t1.c1 NOT IN (SELECT c1 FROM t2) ORDER BY 1,2;
c0	c1	c0	c1
SELECT * FROM t1 FULL JOIN t2 ON t1.c0=t2.c0 WHERE t1.c1 <>ALL (SELECT c1 FROM t2) ORDER BY 1,2;
c0	c1	c0	c1
SELECT * FROM t1 FULL JOIN t2 ON t1.c0=t2.c0 WHERE NOT EXISTS (SELECT c1 FROM t2) ORDER BY 1,2;
c0	c1	c0	c1
#IF "_optimizer_null_aware_antijoin"=ON,EXPLAIN:HASH JOIN ANTI SNA
SELECT * FROM t1 FULL JOIN t2 ON t1.c0=t2.c0 WHERE t1.c1 NOT IN (SELECT c1 FROM t2 WHERE t2.c1 IS NOT NULL) ORDER BY 1,2,3;
c0	c1	c0	c1
SELECT * FROM t1 FULL JOIN t2 ON t1.c0=t2.c0 WHERE t1.c1 <>ALL (SELECT c1 FROM t2 WHERE t2.c1 IS NOT NULL) ORDER BY 1,2,3;
c0	c1	c0	c1
SELECT * FROM t1 FULL JOIN t2 ON t1.c0=t2.c0 WHERE NOT EXISTS (SELECT c1 FROM t2 WHERE t2.c1 IS NOT NULL) ORDER BY 1,2,3;
c0	c1	c0	c1
#HINT
#IF "_optimizer_null_aware_antijoin"=ON,EXPLAIN:HASH JOIN ANTI NA
SELECT /*+USE_HASH(t1,t2)*/ * FROM t1 WHERE c1 NOT IN (SELECT c1 FROM t2) ORDER BY 1,2;
c0	c1
SELECT /*+USE_HASH(t1,t2)*/ * FROM t1 JOIN t2 ON t1.c0=t2.c0 AND t1.c1 <>ALL (SELECT c1 FROM t2) ORDER BY 1,2;
c0	c1	c0	c1
SELECT /*+USE_HASH(t1,t2)*/ * FROM t1 RIGHT JOIN t2 ON t1.c0=t2.c0 WHERE t1.c1 NOT IN (SELECT c1 FROM t2) ORDER BY 1,2;
c0	c1	c0	c1
SELECT /*+USE_NLJ(t1,t2)*/ * FROM t1 RIGHT JOIN t2 ON t1.c0=t2.c0 WHERE t1.c1 NOT IN (SELECT c1 FROM t2) ORDER BY 1,2;
c0	c1	c0	c1
SELECT /*+USE_MJ(t1,t2)*/ * FROM t1 JOIN t2 ON t1.c0=t2.c0 AND t1.c1 <>ALL (SELECT c1 FROM t2) ORDER BY 1,2;
c0	c1	c0	c1
SELECT /*+USE_HASH(t1,t2)*/ * FROM t1 WHERE NOT EXISTS (SELECT c1 FROM t2) ORDER BY 1,2;
c0	c1
SELECT /*+USE_HASH(t1,t2)*/ * FROM t1 WHERE c1 NOT IN (SELECT c1 FROM t2) ORDER BY 1,2;
c0	c1
SELECT /*+USE_NL(t1,t2)*/ * FROM t1 JOIN t2 ON t1.c0=t2.c0 AND t1.c1 <>ALL (SELECT c1 FROM t2) ORDER BY 1,2;
c0	c1	c0	c1
SELECT /*+USE_MJ(t1,t2)*/ * FROM t1 JOIN t2 ON t1.c0=t2.c0 AND t1.c1 <>ALL (SELECT c1 FROM t2) ORDER BY 1,2;
c0	c1	c0	c1
#IF "_optimizer_null_aware_antijoin"=ON,EXPLAIN:HASH JOIN ANTI SNA
SELECT /*+USE_HASH(t1,t2)*/ * FROM t1 WHERE c1 NOT IN (SELECT c1 FROM t2 WHERE t2.c1 IS NOT NULL) ORDER BY 1,2;
c0	c1
SELECT /*+USE_HASH(t1,t2)*/ * FROM t1 JOIN t2 ON t1.c0=t2.c0 AND t1.c1 <>ALL (SELECT c1 FROM t2 WHERE t2.c1 IS NOT NULL) ORDER BY 1,2;
c0	c1	c0	c1
SELECT /*+USE_HASH(t1,t2)*/ * FROM t1 RIGHT JOIN t2 ON t1.c0=t2.c0 WHERE t1.c1 NOT IN (SELECT c1 FROM t2 WHERE t2.c1 IS NOT NULL) ORDER BY 1,2;
c0	c1	c0	c1
SELECT /*+USE_NLJ(t1,t2)*/ * FROM t1 RIGHT JOIN t2 ON t1.c0=t2.c0 WHERE t1.c1 NOT IN (SELECT c1 FROM t2 WHERE t2.c1 IS NOT NULL) ORDER BY 1,2;
c0	c1	c0	c1
SELECT /*+USE_MJ(t1,t2)*/ * FROM t1 JOIN t2 ON t1.c0=t2.c0 AND t1.c1 <>ALL (SELECT c1 FROM t2 WHERE t2.c1 IS NOT NULL) ORDER BY 1,2;
c0	c1	c0	c1
SELECT /*+USE_HASH(t1,t2)*/ * FROM t1 WHERE NOT EXISTS (SELECT c1 FROM t2 WHERE t2.c1 IS NOT NULL) ORDER BY 1,2;
c0	c1
SELECT /*+USE_HASH(t1,t2)*/ * FROM t1 WHERE c1 NOT IN (SELECT c1 FROM t2 WHERE t2.c1 IS NOT NULL) ORDER BY 1,2;
c0	c1
SELECT /*+USE_NL(t1,t2)*/ * FROM t1 JOIN t2 ON t1.c0=t2.c0 AND t1.c1 <>ALL (SELECT c1 FROM t2 WHERE t2.c1 IS NOT NULL) ORDER BY 1,2;
c0	c1	c0	c1
SELECT /*+USE_MJ(t1,t2)*/ * FROM t1 JOIN t2 ON t1.c0=t2.c0 AND t1.c1 <>ALL (SELECT c1 FROM t2 WHERE t2.c1 IS NOT NULL) ORDER BY 1,2;
c0	c1	c0	c1
#PARALLEL
#IF "_optimizer_null_aware_antijoin"=ON,EXPLAIN:HASH JOIN ANTI NA
SELECT /*+parallel(2) USE_HASH(t1,t2)*/ * FROM t1 WHERE c1 NOT IN (SELECT c1 FROM t2) ORDER BY 1,2;
c0	c1
SELECT /*+parallel(2) USE_HASH(t1,t2)*/ * FROM t1 WHERE c1 <>ALL (SELECT c1 FROM t2) ORDER BY 1,2;
c0	c1
SELECT /*+parallel(2) USE_NL(t1,t2)*/ * FROM t1 WHERE c1 <>ALL (SELECT c1 FROM t2) ORDER BY 1,2;
c0	c1
SELECT /*+parallel(2) USE_HASH(t1,t2)*/ * FROM t1 WHERE NOT EXISTS (SELECT c1 FROM t2) ORDER BY 1,2;
c0	c1
SELECT /*+parallel(5) USE_HASH(t1,t2)*/ * FROM t1 WHERE c1 NOT IN (SELECT c1 FROM t2) ORDER BY 1,2;
c0	c1
SELECT /*+parallel(5) USE_NLJ(t1,t2)*/ * FROM t1 WHERE c1 NOT IN (SELECT c1 FROM t2) ORDER BY 1,2;
c0	c1
SELECT /*+parallel(5) USE_HASH(t1,t2)*/ * FROM t1 WHERE c1 <>ALL (SELECT c1 FROM t2) ORDER BY 1,2;
c0	c1
SELECT /*+parallel(5) USE_MJ(t1,t2)*/ * FROM t1 WHERE c1 NOT IN (SELECT c1 FROM t2) ORDER BY 1,2;
c0	c1
SELECT /*+parallel(5) USE_HASH(t1,t2)*/ * FROM t1 WHERE NOT EXISTS (SELECT c1 FROM t2) ORDER BY 1,2;
c0	c1
SELECT /*+parallel(2) USE_HASH(t1,t2)*/ * FROM t1,t2 WHERE t1.c0=t2.c0 AND t1.c1 NOT IN (SELECT c1 FROM t2) ORDER BY 1,2;
c0	c1	c0	c1
SELECT /*+parallel(2) USE_HASH(t1,t2)*/ * FROM t1,t2 WHERE t1.c0=t2.c0 AND t1.c1 <>ALL (SELECT c1 FROM t2) ORDER BY 1,2;
c0	c1	c0	c1
SELECT /*+parallel(2) USE_MJ(t1,t2)*/ * FROM t1,t2 WHERE t1.c0=t2.c0 AND t1.c1 <>ALL (SELECT c1 FROM t2) ORDER BY 1,2;
c0	c1	c0	c1
SELECT /*+parallel(2) USE_NL(t1,t2)*/ * FROM t1,t2 WHERE t1.c0=t2.c0 AND t1.c1 NOT IN (SELECT c1 FROM t2) ORDER BY 1,2;
c0	c1	c0	c1
SELECT /*+parallel(2) USE_HASH(t1,t2)*/ * FROM t1,t2 WHERE t1.c0=t2.c0 AND NOT EXISTS (SELECT c1 FROM t2) ORDER BY 1,2;
c0	c1	c0	c1
#IF "_optimizer_null_aware_antijoin"=ON,EXPLAIN:HASH JOIN ANTI SNA
SELECT /*+parallel(2) USE_HASH(t1,t2)*/ * FROM t1 WHERE c1 NOT IN (SELECT c1 FROM t2 WHERE t2.c1 IS NOT NULL) ORDER BY 1,2;
c0	c1
SELECT /*+parallel(2) USE_HASH(t1,t2)*/ * FROM t1 WHERE c1 <>ALL (SELECT c1 FROM t2 WHERE t2.c1 IS NOT NULL) ORDER BY 1,2;
c0	c1
SELECT /*+parallel(2) USE_NL(t1,t2)*/ * FROM t1 WHERE c1 <>ALL (SELECT c1 FROM t2 WHERE t2.c1 IS NOT NULL) ORDER BY 1,2;
c0	c1
SELECT /*+parallel(2) USE_HASH(t1,t2)*/ * FROM t1 WHERE NOT EXISTS (SELECT c1 FROM t2 WHERE t2.c1 IS NOT NULL) ORDER BY 1,2;
c0	c1
SELECT /*+parallel(5) USE_HASH(t1,t2)*/ * FROM t1 WHERE c1 NOT IN (SELECT c1 FROM t2 WHERE t2.c1 IS NOT NULL) ORDER BY 1,2;
c0	c1
SELECT /*+parallel(5) USE_NLJ(t1,t2)*/ * FROM t1 WHERE c1 NOT IN (SELECT c1 FROM t2 WHERE t2.c1 IS NOT NULL) ORDER BY 1,2;
c0	c1
SELECT /*+parallel(5) USE_HASH(t1,t2)*/ * FROM t1 WHERE c1 <>ALL (SELECT c1 FROM t2 WHERE t2.c1 IS NOT NULL) ORDER BY 1,2;
c0	c1
SELECT /*+parallel(5) USE_MJ(t1,t2)*/ * FROM t1 WHERE c1 NOT IN (SELECT c1 FROM t2 WHERE t2.c1 IS NOT NULL) ORDER BY 1,2;
c0	c1
SELECT /*+parallel(5) USE_HASH(t1,t2)*/ * FROM t1 WHERE NOT EXISTS (SELECT c1 FROM t2 WHERE t2.c1 IS NOT NULL) ORDER BY 1,2;
c0	c1
SELECT /*+parallel(2) USE_HASH(t1,t2)*/ * FROM t1,t2 WHERE t1.c0=t2.c0 AND t1.c1 NOT IN (SELECT c1 FROM t2 WHERE t2.c1 IS NOT NULL) ORDER BY 1,2;
c0	c1	c0	c1
SELECT /*+parallel(2) USE_HASH(t1,t2)*/ * FROM t1,t2 WHERE t1.c0=t2.c0 AND t1.c1 <>ALL (SELECT c1 FROM t2 WHERE t2.c1 IS NOT NULL) ORDER BY 1,2;
c0	c1	c0	c1
SELECT /*+parallel(2) USE_MJ(t1,t2)*/ * FROM t1,t2 WHERE t1.c0=t2.c0 AND t1.c1 <>ALL (SELECT c1 FROM t2 WHERE t2.c1 IS NOT NULL) ORDER BY 1,2;
c0	c1	c0	c1
SELECT /*+parallel(2) USE_NL(t1,t2)*/ * FROM t1,t2 WHERE t1.c0=t2.c0 AND t1.c1 NOT IN (SELECT c1 FROM t2 WHERE t2.c1 IS NOT NULL) ORDER BY 1,2;
c0	c1	c0	c1
SELECT /*+parallel(2) USE_HASH(t1,t2)*/ * FROM t1,t2 WHERE t1.c0=t2.c0 AND NOT EXISTS (SELECT c1 FROM t2 WHERE t2.c1 IS NOT NULL) ORDER BY 1,2;
c0	c1	c0	c1
DROP TABLE t1;
DROP TABLE t2;
DROP USER 'zhang'@'%';
DROP DATABASE naaj_test;
