set SESSION ob_query_timeout = 60 * 1000 * 1000;
set SESSION ob_trx_timeout = 60 * 1000 * 1000;
set SESSION ob_trx_idle_timeout = 60 * 1000 * 1000;
set @@session.tx_isolation = 'REPEATABLE-READ';
set SESSION ob_query_timeout = 1 * 1000 * 1000;
set SESSION ob_trx_timeout = 1 * 1000 * 1000;
set SESSION ob_trx_idle_timeout = 1 * 1000 * 1000;
drop table if exists test_lock_row_in_minor_t;
create table test_lock_row_in_minor_t(a int primary key, b int);
insert into test_lock_row_in_minor_t value(1, 1);
insert into test_lock_row_in_minor_t value(2, 2);
insert into test_lock_row_in_minor_t value(3, 3);
begin;
select * from test_lock_row_in_minor_t where a = 1;
a	b
1	1
update test_lock_row_in_minor_t set b = 30 where a = 3;
update test_lock_row_in_minor_t set b = 10 where a = 1;
insert into test_lock_row_in_minor_t value(4, 4);
select * from test_lock_row_in_minor_t;
a	b
1	10
2	2
3	3
4	4
drop table test_lock_row_in_minor_t;
alter system set minor_compact_trigger = 2;
