set GLOBAL ob_query_timeout = 1000000000000;
set GLOBAL ob_trx_timeout = 10000000000000;
set GLOBAL ob_trx_idle_timeout = 10000000000;
alter system set enable_auto_leader_switch = false;
drop table if exists table_without_pk;
create table table_without_pk(num int, str varchar(50), tag int) table_mode='queuing';
insert into table_without_pk value(100, 'Hello OceanBase & Happy New Year', 1);
insert into table_without_pk value(99, 'Hello OceanBase & Happy New Year', 1);
insert into table_without_pk value(98, 'Hello OceanBase & Happy New Year', 1);
insert into table_without_pk value(97, 'Hello OceanBase & Happy New Year', 1);
insert into table_without_pk value(96, 'Hello OceanBase & Happy New Year', 1);
insert into table_without_pk value(95, 'Hello OceanBase & Happy New Year', 1);
insert into table_without_pk value(94, 'Hello OceanBase & Happy New Year', 1);
insert into table_without_pk value(93, 'Hello OceanBase & Happy New Year', 1);
insert into table_without_pk value(92, 'Hello OceanBase & Happy New Year', 1);
insert into table_without_pk value(91, 'Hello OceanBase & Happy New Year', 1);
insert into table_without_pk value(90, 'Hello OceanBase & Happy New Year', 1);
insert into table_without_pk value(89, 'Hello OceanBase & Happy New Year', 1);
insert into table_without_pk value(88, 'Hello OceanBase & Happy New Year', 1);
insert into table_without_pk value(87, 'Hello OceanBase & Happy New Year', 1);
insert into table_without_pk value(86, 'Hello OceanBase & Happy New Year', 1);
insert into table_without_pk value(85, 'Hello OceanBase & Happy New Year', 1);
insert into table_without_pk value(84, 'Hello OceanBase & Happy New Year', 1);
insert into table_without_pk value(83, 'Hello OceanBase & Happy New Year', 1);
insert into table_without_pk value(82, 'Hello OceanBase & Happy New Year', 1);
insert into table_without_pk value(81, 'Hello OceanBase & Happy New Year', 1);
insert into table_without_pk value(80, 'Hello OceanBase & Happy New Year', 1);
alter system minor freeze tenant = sys;
alter system minor freeze tenant = all_user;
alter system minor freeze tenant = all_meta;
delete from table_without_pk where num > 98 || num < 85;
select count(*) from table_without_pk;
count(*)
14
select count(*) from table_without_pk;
count(*)
14
select count(*) from table_without_pk;
count(*)
114
alter system minor freeze tenant = sys;
alter system minor freeze tenant = all_user;
alter system minor freeze tenant = all_meta;
delete from table_without_pk where num % 2 = 0;
update table_without_pk set tag = num * 10 + 10;
select count(*) from table_without_pk;
count(*)
57
commit;
alter system minor freeze tenant = sys;
alter system minor freeze tenant = all_user;
alter system minor freeze tenant = all_meta;
delete from table_without_pk where num > 1000;
alter system major freeze tenant = sys;
alter system major freeze tenant = all_user;
alter system major freeze tenant = all_meta;
select * from table_without_pk;
num	str	tag
97	Hello OceanBase & Happy New Year	980
95	Hello OceanBase & Happy New Year	960
93	Hello OceanBase & Happy New Year	940
91	Hello OceanBase & Happy New Year	920
89	Hello OceanBase & Happy New Year	900
87	Hello OceanBase & Happy New Year	880
85	Hello OceanBase & Happy New Year	860
select * from table_without_pk;
num	str	tag
97	Hello OceanBase & Happy New Year	980
95	Hello OceanBase & Happy New Year	960
93	Hello OceanBase & Happy New Year	940
91	Hello OceanBase & Happy New Year	920
89	Hello OceanBase & Happy New Year	900
87	Hello OceanBase & Happy New Year	880
85	Hello OceanBase & Happy New Year	860
drop table table_without_pk;
