set GLOBAL ob_query_timeout = 1000000000000;
set GLOBAL ob_trx_timeout = 10000000000000;
set GLOBAL ob_trx_idle_timeout = 10000000000;
alter system set enable_auto_leader_switch = false;
drop table if exists t1;
create table t1(num int primary key, str varchar(50), tag int) table_mode='queuing';
alter system minor freeze tenant = sys;
alter system minor freeze tenant = all_user;
alter system minor freeze tenant = all_meta;
delete from t1 where num >= 95;
select count(*) from t1;
count(*)
5
select count(*) from t1;
count(*)
205
commit;
alter system minor freeze tenant = sys;
alter system minor freeze tenant = all_user;
alter system minor freeze tenant = all_meta;
select count(*) from t1;
count(*)
205
delete from t1 where num % 2 = 0;
update t1 set tag = num * 10 + 10;
select count(*) from t1;
count(*)
102
alter system minor freeze tenant = sys;
alter system minor freeze tenant = all_user;
alter system minor freeze tenant = all_meta;
delete from t1 where num > 1000;
alter system major freeze tenant = sys;
alter system major freeze tenant = all_user;
alter system major freeze tenant = all_meta;
select * from t1;
num	str	tag
91	Hello OceanBase & Happy New Year	920
93	Hello OceanBase & Happy New Year	940
select * from t1;
num	str	tag
91	Hello OceanBase & Happy New Year	920
93	Hello OceanBase & Happy New Year	940
alter table t1 table_mode='normal';
delete from t1 where num % 3 = 0;
alter system minor freeze tenant = sys;
alter system minor freeze tenant = all_user;
alter system minor freeze tenant = all_meta;
drop table t1;
