set GLOBAL ob_query_timeout = 1000000000000;
set GLOBAL ob_trx_timeout = 10000000000000;
set GLOBAL ob_trx_idle_timeout = 10000000000;
alter system set enable_auto_leader_switch = false;
drop table if exists test_buf_minor_table;
create table test_buf_minor_table(num int primary key, str varchar(50), tag int) table_mode='queuing';
insert into test_buf_minor_table value(100, 'Hello OceanBase & Happy New Year', 1);
insert into test_buf_minor_table value(99, 'Hello OceanBase & Happy New Year', 1);
insert into test_buf_minor_table value(98, 'Hello OceanBase & Happy New Year', 1);
insert into test_buf_minor_table value(97, 'Hello OceanBase & Happy New Year', 1);
insert into test_buf_minor_table value(96, 'Hello OceanBase & Happy New Year', 1);
insert into test_buf_minor_table value(95, 'Hello OceanBase & Happy New Year', 1);
insert into test_buf_minor_table value(94, 'Hello OceanBase & Happy New Year', 1);
insert into test_buf_minor_table value(93, 'Hello OceanBase & Happy New Year', 1);
insert into test_buf_minor_table value(92, 'Hello OceanBase & Happy New Year', 1);
insert into test_buf_minor_table value(91, 'Hello OceanBase & Happy New Year', 1);
alter system minor freeze tenant = sys;
alter system minor freeze tenant = all_user;
alter system minor freeze tenant = all_meta;
begin;
insert into test_buf_minor_table value(90, 'Hello OceanBase & Happy New Year', 1);
insert into test_buf_minor_table value(89, 'Hello OceanBase & Happy New Year', 1);
insert into test_buf_minor_table value(88, 'Hello OceanBase & Happy New Year', 1);
insert into test_buf_minor_table value(87, 'Hello OceanBase & Happy New Year', 1);
insert into test_buf_minor_table value(86, 'Hello OceanBase & Happy New Year', 1);
insert into test_buf_minor_table value(85, 'Hello OceanBase & Happy New Year', 1);
insert into test_buf_minor_table value(84, 'Hello OceanBase & Happy New Year', 1);
insert into test_buf_minor_table value(83, 'Hello OceanBase & Happy New Year', 1);
insert into test_buf_minor_table value(82, 'Hello OceanBase & Happy New Year', 1);
insert into test_buf_minor_table value(81, 'Hello OceanBase & Happy New Year', 1);
insert into test_buf_minor_table value(80, 'Hello OceanBase & Happy New Year', 1);
alter system minor freeze tenant = sys;
alter system minor freeze tenant = all_user;
alter system minor freeze tenant = all_meta;
delete from test_buf_minor_table where num > 98 || num < 85;
select count(*) from test_buf_minor_table;
count(*)
10
select count(*) from test_buf_minor_table;
count(*)
214
commit;
select count(*) from test_buf_minor_table;
count(*)
214
delete from test_buf_minor_table where num % 2 = 0;
update test_buf_minor_table set tag = num * 10 + 10;
select count(*) from test_buf_minor_table;
count(*)
107
alter system minor freeze tenant = sys;
alter system minor freeze tenant = all_user;
alter system minor freeze tenant = all_meta;
delete from test_buf_minor_table where num > 1000;
alter system major freeze tenant = sys;
alter system major freeze tenant = all_user;
alter system major freeze tenant = all_meta;
select * from test_buf_minor_table;
num	str	tag
85	Hello OceanBase & Happy New Year	860
87	Hello OceanBase & Happy New Year	880
89	Hello OceanBase & Happy New Year	900
91	Hello OceanBase & Happy New Year	920
93	Hello OceanBase & Happy New Year	940
95	Hello OceanBase & Happy New Year	960
97	Hello OceanBase & Happy New Year	980
select * from test_buf_minor_table;
num	str	tag
85	Hello OceanBase & Happy New Year	860
87	Hello OceanBase & Happy New Year	880
89	Hello OceanBase & Happy New Year	900
91	Hello OceanBase & Happy New Year	920
93	Hello OceanBase & Happy New Year	940
95	Hello OceanBase & Happy New Year	960
97	Hello OceanBase & Happy New Year	980
drop table test_buf_minor_table;
