#Environmental cleaning
drop user hjw@'%';
create user hjw identified by 'hjw';
grant all on *.* to hjw WITH GRANT OPTION;
#hex-8  视图/约束/索引
#hex-8-2  约束
#主键   PRIMARY key
drop table hj_test;
CREATE table hj_test(c1 varchar(50) PRIMARY KEY,c2 bigint,c3 bigint);
insert into hj_test values((select hex(2222) from dual),123,333);
insert into hj_test values((select hex(3333) from dual),234,555);
insert into hj_test values((select hex(2222) from dual),456,666);
insert into hj_test values((select hex(6666) from dual),567,877);
select c1,c2,c3 from hj_test order by c1 asc;
c1	c2	c3
1A0A	567	877
8AE	123	333
D05	234	555
insert into hj_test values((select hex(null) from dual),567,877);
insert into hj_test values((select hex(0) from dual),567,877);
select c1,c2,c3 from hj_test order by c1 asc;
c1	c2	c3
0	567	877
1A0A	567	877
8AE	123	333
D05	234	555
update hj_test set c1=(select hex(2222) from dual) where c1=0;
update hj_test set c1=(select hex(2233) from dual) where c1=0;
select c1,c2,c3 from hj_test order by c1 asc;
c1	c2	c3
0	567	877
1A0A	567	877
8AE	123	333
D05	234	555
DELETE FROM hj_test where c1=(select hex(2222) from dual);
select c1,c2,c3 from hj_test order by c1 asc;
c1	c2	c3
0	567	877
1A0A	567	877
D05	234	555
#非空  not null
drop table hj_test;
create table hj_test(c1 varchar(100) UNIQUE KEY not null,c2 int not null check(c2>=20 and c2 <=500));
insert into hj_test values(4243,20);
insert into hj_test values(64363,30);
insert into hj_test values(141,50);
insert into hj_test values(522,350);
insert into hj_test values(6464,499);
select c1,c2 from hj_test order by c1 asc;
c1	c2
141	50
4243	20
522	350
64363	30
6464	499
insert into hj_test values(null,null);
insert into hj_test values(123,null);
insert into hj_test values(null,0);
select c1,c2 from hj_test where c1=(select hex(null) from dual);
c1	c2
insert into hj_test values((select hex(null) from dual),(select hex(0) from dual));
#唯一  unique
drop table hj_test;
create table hj_test(c1 varchar(100) UNIQUE KEY,c2 bigint UNIQUE);
insert into hj_test values(40,20);
insert into hj_test values((select hex(20)+hex(20) from dual),(select hex(30)-hex(10) from dual));
Warnings:
Warning	1292	Truncated incorrect DOUBLE value: '1E'
Warning	1292	Truncated incorrect DOUBLE value: 'A'
insert into hj_test values((select hex(30)+hex(20) from dual),(select hex(30)-hex(100) from dual));
Warnings:
Warning	1292	Truncated incorrect DOUBLE value: '1E'
Warning	1292	Truncated incorrect DOUBLE value: '1E'
insert into hj_test values((select hex(70)+hex(20) from dual),(select hex(130)-hex(30) from dual));
Warnings:
Warning	1292	Truncated incorrect DOUBLE value: '1E'
select c1,c2 from hj_test order by c1 asc;
c1	c2
15	-63
28	1
40	20
60	81
insert into hj_test values((select hex(70)+hex(20) from dual),(select hex(130)-hex(30) from dual));
insert into hj_test values((select hex(null) from dual),(select hex(null) from dual));
insert into hj_test values((select hex(null) from dual),(select hex(null) from dual));
select c1,c2 from hj_test order by c1 asc;
c1	c2
NULL	NULL
NULL	NULL
15	-63
28	1
40	20
60	81
insert into hj_test values(null,null);
select c1,c2 from hj_test order by c1 asc;
c1	c2
NULL	NULL
NULL	NULL
NULL	NULL
15	-63
28	1
40	20
60	81
insert into hj_test values(40,30);
insert into hj_test values((select hex(c1) from dual),(select hex(c2) from dual));
insert into hj_test values((select hex(c2) from dual),(select hex(c1) from dual));
#范围   check
drop table hj_test;
create table hj_test(c1 bigint,c2 bigint,CHECK(c1>hex(20),c2<hex(300)));
create table hj_test(c1 bigint,c2 bigint,CHECK(c1>hex(20) and c2<hex(21329)));
insert into hj_test values((select hex(55) from dual),(select hex(399) from dual));
insert into hj_test values((select hex(55) from dual),(select hex(10000) from dual));
select c1,c2 from hj_test order by c1 asc;
c1	c2
37	2710
drop table hj_test;
create table hj_test(c1 bigint,c2 bigint,CHECK(c1>hex(20) or c2<hex(300)));
drop table hj_test;
create table hj_test(c1 bigint,c2 bigint,CHECK(c1>(select hex(20) from dual) or c2<(select hex(300) from dual)));
create table hj_test(c1 bigint,c2 bigint,CHECK(c1>(select hex(20) from dual)));
create table hj_test(c1 bigint,c2 bigint,CHECK(c1>hex(20)));
drop table hj_test;
create table hj_test(c1 bigint,c2 bigint,CHECK(c1>20 and c2<600));
insert into hj_test values((select hex(21) from dual),(select hex(99) from dual));
insert into hj_test values((select hex(55) from dual),(select hex(199) from dual));
insert into hj_test values((select hex(55) from dual),(select hex(99) from dual));
insert into hj_test values((select hex(35) from dual),(select hex(399) from dual));
select c1,c2 from hj_test order by c1 asc;
c1	c2
37	63
insert into hj_test values((select hex(20) from dual),(select hex(399) from dual));
insert into hj_test values((select hex(23) from dual),(select hex(600) from dual));
#主键+notnull+unique+check
drop table hj_test;
create table hj_test(c1 bigint PRIMARY key UNIQUE key not null CHECK(c1>50),c2 bigint UNIQUE key not null CHECK(c2<500));
insert into hj_test values((select hex(null) from dual),(select hex(0) from dual));
insert into hj_test values((select hex(66) from dual),(select hex(88) from dual));
insert into hj_test values((select hex(66) from dual),(select hex(88) from dual));
insert into hj_test values((select hex(33) from dual)+33,(select hex(88) from dual));
select c1,c2 from hj_test order by c1 asc;
c1	c2
54	58
insert into hj_test values((select hex(10000) from dual)+33,(select hex(88) from dual));
select c1,c2 from hj_test order by c1 asc;
c1	c2
54	58
#外键约束  foreign key
DROP TABLE test2;
DROP TABLE test1;
CREATE TABLE test1
(c1 int,c2 int,
CONSTRAINT CONSTRAINT_1 PRIMARY KEY (c1)
);
CREATE TABLE test2
(c1 int,c2 int,
CONSTRAINT CONSTRAINT_2 FOREIGN KEY (c1) REFERENCES test1(c1)
);
INSERT INTO test1 values((select hex(640) from dual),(select hex(490) from dual));
SELECT * FROM test1 ORDER BY c1 asc;
c1	c2
INSERT INTO test2 values((select hex(640) from dual),(select hex(490) from dual));
INSERT INTO test2 values((select hex(640) from dual),(select hex(490) from dual));
SELECT * FROM test2 ORDER BY c1 asc;
c1	c2
INSERT INTO test2 values(25,22);
INSERT INTO test2 values((select hex(640) from dual),22);
INSERT INTO test2 values((select hex(320) from dual)+320,122);
INSERT INTO test2 values((select hex(320) from dual)+null,122);
INSERT INTO test2 values((select hex(320) from dual),132);
SELECT * FROM test2 ORDER BY c1 asc;
c1	c2
NULL	122
DROP TABLE test2;
DROP TABLE test1;
# Clean up users
drop user hjw@'%' ;
