drop database  IF EXISTS  oblrp;
create database oblrp;
use oblrp;
set timestamp = 1600000000;
set ob_trx_timeout = 10000000000;
set ob_query_timeout = 10000000000;
obmysql-get_format-1参数验证
select get_format();
ERROR 42000: You have an error in your SQL syntax; check the manual that corresponds to your OceanBase version for the right syntax to use near ')' at line 1
select get_format(date,);
ERROR 42000: You have an error in your SQL syntax; check the manual that corresponds to your OceanBase version for the right syntax to use near ')' at line 1
select get_format(date,'eur');
get_format(date,'eur')
%d.%m.%Y
select get_format(date,'INTERNAL');
get_format(date,'INTERNAL')
%Y%m%d
select get_format(DATE,'ISO');
get_format(DATE,'ISO')
%Y-%m-%d
select get_format(DATE,'JIS');
get_format(DATE,'JIS')
%Y-%m-%d
select get_format(DATE,'USA');
get_format(DATE,'USA')
%m.%d.%Y
select get_format(TIME,'eur');
get_format(TIME,'eur')
%H.%i.%s
select get_format(TIME,'INTERNAL');
get_format(TIME,'INTERNAL')
%H%i%s
select get_format(TIME,'ISO');
get_format(TIME,'ISO')
%H:%i:%s
select get_format(time,'JIS');
get_format(time,'JIS')
%H:%i:%s
select get_format(time,'USA');
get_format(time,'USA')
%h:%i:%s %p
select get_format(DATETIME,'eur');
get_format(DATETIME,'eur')
%Y-%m-%d %H.%i.%s
select get_format(DATETIME,'INTERNAL');
get_format(DATETIME,'INTERNAL')
%Y%m%d%H%i%s
select get_format(DATETIME,'ISO');
get_format(DATETIME,'ISO')
%Y-%m-%d %H:%i:%s
select get_format(DATETIME,'JIS');
get_format(DATETIME,'JIS')
%Y-%m-%d %H:%i:%s
select get_format(datetime,'USA');
get_format(datetime,'USA')
%Y-%m-%d %H.%i.%s
select get_format(TIMESTAMP,'eur');
get_format(TIMESTAMP,'eur')
%Y-%m-%d %H.%i.%s
select get_format(TIMESTAMP,'INTERNAL');
get_format(TIMESTAMP,'INTERNAL')
%Y%m%d%H%i%s
select get_format(TIMESTAMP,'ISO');
get_format(TIMESTAMP,'ISO')
%Y-%m-%d %H:%i:%s
select get_format(timestamp,'JIS');
get_format(timestamp,'JIS')
%Y-%m-%d %H:%i:%s
select get_format(timestamp,'USA');
get_format(timestamp,'USA')
%Y-%m-%d %H.%i.%s
select get_format(null,'USA');
ERROR 42000: You have an error in your SQL syntax; check the manual that corresponds to your OceanBase version for the right syntax to use near 'null,'USA')' at line 1
select get_format(int,'USA');
ERROR 42000: You have an error in your SQL syntax; check the manual that corresponds to your OceanBase version for the right syntax to use near 'int,'USA')' at line 1
select get_format(YEAR,'INTERNAL');
ERROR 42000: You have an error in your SQL syntax; check the manual that corresponds to your OceanBase version for the right syntax to use near 'YEAR,'INTERNAL')' at line 1
select get_format(CURDATE(),'INTERNAL');
ERROR 42000: You have an error in your SQL syntax; check the manual that corresponds to your OceanBase version for the right syntax to use near 'CURDATE(),'INTERNAL')' at line 1
select get_format(DATE,'chn');
get_format(DATE,'chn')
NULL
select get_format(DATE,'yy');
get_format(DATE,'yy')
NULL
select get_format(DATETIME,null);
get_format(DATETIME,null)
NULL
select get_format(DATETIME,UPPER('iso'));
get_format(DATETIME,UPPER('iso'))
%Y-%m-%d %H:%i:%s
select get_format(TIME,LOWER('JIS'));
get_format(TIME,LOWER('JIS'))
%H:%i:%s
select get_format(DATETIME,UPPER('usa'));
get_format(DATETIME,UPPER('usa'))
%Y-%m-%d %H.%i.%s
select get_format(TIME,LOWER('INTERNAL'));
get_format(TIME,LOWER('INTERNAL'))
%H%i%s
select get_format(TIME,LOWER('EUR'));
get_format(TIME,LOWER('EUR'))
%H.%i.%s
select get_format(TIMESTAMP,LOWER('INTERNAL'));
get_format(TIMESTAMP,LOWER('INTERNAL'))
%Y%m%d%H%i%s
select get_format(TIMESTAMP,UPPER('eur'));
get_format(TIMESTAMP,UPPER('eur'))
%Y-%m-%d %H.%i.%s
select get_format(DATETIME,'ISO',10);
ERROR 42000: You have an error in your SQL syntax; check the manual that corresponds to your OceanBase version for the right syntax to use near ',10)' at line 1
obmysql-get_format-2
select +get_format(TIME,'eur');
+get_format(TIME,'eur')
%H.%i.%s
select -get_format(TIME,'eur');
-get_format(TIME,'eur')
-0
Warnings:
Warning	1292	Truncated incorrect DOUBLE value: '%H.%i.%s'
select get_format(TIME,'eur')=get_format(TIME,'eur');
get_format(TIME,'eur')=get_format(TIME,'eur')
1
select get_format(TIME,'eur')=get_format(TIME,'iso');
get_format(TIME,'eur')=get_format(TIME,'iso')
0
select get_format(TIME,'usa')<>get_format(TIME,'eur');
get_format(TIME,'usa')<>get_format(TIME,'eur')
1
select get_format(TIME,'jis')<>get_format(TIME,'jis');
get_format(TIME,'jis')<>get_format(TIME,'jis')
0
select get_format(TIME,'jis')<=>get_format(TIME,'jis');
get_format(TIME,'jis')<=>get_format(TIME,'jis')
1
select get_format(TIME,'jis')<=>get_format(TIME,'INTERNAL');
get_format(TIME,'jis')<=>get_format(TIME,'INTERNAL')
0
select get_format(TIME,'INTERNAL')>get_format(TIME,'INTERNAL');
get_format(TIME,'INTERNAL')>get_format(TIME,'INTERNAL')
0
select get_format(TIME,'INTERNAL')>=get_format(TIME,'INTERNAL');
get_format(TIME,'INTERNAL')>=get_format(TIME,'INTERNAL')
1
select get_format(TIME,'usa')<get_format(TIME,'iso');
get_format(TIME,'usa')<get_format(TIME,'iso')
0
select get_format(TIME,'eur')<=get_format(TIME,'usa');
get_format(TIME,'eur')<=get_format(TIME,'usa')
1
select get_format(TIME,'iso') in (get_format(TIME,'iso'),get_format(TIME,'usa'),get_format(TIME,'INTERNAL'),get_format(TIME,'eur'),get_format(TIME,'jis'));
get_format(TIME,'iso') in (get_format(TIME,'iso'),get_format(TIME,'usa'),get_format(TIME,'INTERNAL'),get_format(TIME,'eur'),get_format(TIME,'jis'))
1
select get_format(TIME,'iso') in (get_format(TIME,'usa'),get_format(TIME,'INTERNAL'),get_format(TIME,'eur'),get_format(TIME,'jis'));
get_format(TIME,'iso') in (get_format(TIME,'usa'),get_format(TIME,'INTERNAL'),get_format(TIME,'eur'),get_format(TIME,'jis'))
1
select get_format(TIME,'iso') not in (get_format(TIME,'iso'),get_format(TIME,'usa'),get_format(TIME,'INTERNAL'),get_format(TIME,'eur'),get_format(TIME,'jis'));
get_format(TIME,'iso') not in (get_format(TIME,'iso'),get_format(TIME,'usa'),get_format(TIME,'INTERNAL'),get_format(TIME,'eur'),get_format(TIME,'jis'))
0
select get_format(TIME,'usa') is not null;
get_format(TIME,'usa') is not null
1
select get_format(TIME,'iso') is  null;
get_format(TIME,'iso') is  null
0
select  get_format(DATETIME,'iso') LIKE get_format(TIME,'iso')||'%';
get_format(DATETIME,'iso') LIKE get_format(TIME,'iso')||'%'
1
select  get_format(DATETIME,'iso') LIKE get_format(TIME,'USA')||'%';
get_format(DATETIME,'iso') LIKE get_format(TIME,'USA')||'%'
0
Warnings:
Warning	1292	Truncated incorrect DOUBLE value: '%'
select get_format(datetime,'jis') REGEXP get_format(date,'jis');
get_format(datetime,'jis') REGEXP get_format(date,'jis')
1
select ~get_format(datetime,'jis');
~get_format(datetime,'jis')
18446744073709551615
Warnings:
Warning	1292	Truncated incorrect INTEGER value: '%Y-%m-%d %H:%i:%s'
select get_format(date,'eur')&get_format(TIME,'INTERNAL');
get_format(date,'eur')&get_format(TIME,'INTERNAL')
0
Warnings:
Warning	1292	Truncated incorrect INTEGER value: '%d.%m.%Y'
Warning	1292	Truncated incorrect INTEGER value: '%H%i%s'
select get_format(date,'eur')|get_format(dateTIME,'iso');
get_format(date,'eur')|get_format(dateTIME,'iso')
0
Warnings:
Warning	1292	Truncated incorrect INTEGER value: '%d.%m.%Y'
Warning	1292	Truncated incorrect INTEGER value: '%Y-%m-%d %H:%i:%s'
select get_format(date,'eur')^get_format(dateTIME,'iso');
get_format(date,'eur')^get_format(dateTIME,'iso')
0
Warnings:
Warning	1292	Truncated incorrect INTEGER value: '%d.%m.%Y'
Warning	1292	Truncated incorrect INTEGER value: '%Y-%m-%d %H:%i:%s'
select get_format(time,'eur')>>get_format(TIME,'iso');
get_format(time,'eur')>>get_format(TIME,'iso')
0
Warnings:
Warning	1292	Truncated incorrect INTEGER value: '%H.%i.%s'
Warning	1292	Truncated incorrect INTEGER value: '%H:%i:%s'
select get_format(time,'eur')<<get_format(date,'jis');
get_format(time,'eur')<<get_format(date,'jis')
0
Warnings:
Warning	1292	Truncated incorrect INTEGER value: '%H.%i.%s'
Warning	1292	Truncated incorrect INTEGER value: '%Y-%m-%d'
select get_format(time,'eur')||get_format(date,'jis')||get_format(dateTIME,'iso')||get_format(TIME,'INTERNAL')||get_format(dateTIME,'USA');
get_format(time,'eur')||get_format(date,'jis')||get_format(dateTIME,'iso')||get_format(TIME,'INTERNAL')||get_format(dateTIME,'USA')
0
Warnings:
Warning	1292	Truncated incorrect DOUBLE value: '%H.%i.%s'
Warning	1292	Truncated incorrect DOUBLE value: '%Y-%m-%d'
Warning	1292	Truncated incorrect DOUBLE value: '%Y-%m-%d %H:%i:%s'
Warning	1292	Truncated incorrect DOUBLE value: '%H%i%s'
Warning	1292	Truncated incorrect DOUBLE value: '%Y-%m-%d %H.%i.%s'
obmysql-get_format-3 内置函数参数校验
obmysql-get_format-3-1 日期时间函数
select CURRENT_TIME(get_format(TIME,'eur'));
ERROR 42000: You have an error in your SQL syntax; check the manual that corresponds to your OceanBase version for the right syntax to use near 'get_format(TIME,'eur'))' at line 1
select DATE_ADD(get_format(TIME,'eur'),INTERVAL 5 DAY);
DATE_ADD(get_format(TIME,'eur'),INTERVAL 5 DAY)
NULL
select DATE_FORMAT(utc_date(),GET_FORMAT(DATE,'EUR'));
DATE_FORMAT(utc_date(),GET_FORMAT(DATE,'EUR'))
13.09.2020
select DATE_FORMAT(utc_date(),GET_FORMAT(DATE,'internal'));
DATE_FORMAT(utc_date(),GET_FORMAT(DATE,'internal'))
20200913
select DATE_FORMAT(utc_date(),GET_FORMAT(DATE,'iso'));
DATE_FORMAT(utc_date(),GET_FORMAT(DATE,'iso'))
2020-09-13
select DATE_FORMAT(utc_date(),GET_FORMAT(DATE,'jis'));
DATE_FORMAT(utc_date(),GET_FORMAT(DATE,'jis'))
2020-09-13
select DATE_FORMAT(utc_date(),GET_FORMAT(DATE,'usa'));
DATE_FORMAT(utc_date(),GET_FORMAT(DATE,'usa'))
09.13.2020
select DATE_FORMAT(utc_date(),GET_FORMAT(time,'EUR'));
DATE_FORMAT(utc_date(),GET_FORMAT(time,'EUR'))
00.00.00
select DATE_FORMAT(utc_date(),GET_FORMAT(time,'internal'));
DATE_FORMAT(utc_date(),GET_FORMAT(time,'internal'))
000000
select DATE_FORMAT(utc_date(),GET_FORMAT(time,'iso'));
DATE_FORMAT(utc_date(),GET_FORMAT(time,'iso'))
00:00:00
select DATE_FORMAT(utc_date(),GET_FORMAT(time,'jis'));
DATE_FORMAT(utc_date(),GET_FORMAT(time,'jis'))
00:00:00
select DATE_FORMAT(utc_date(),GET_FORMAT(time,'usa'));
DATE_FORMAT(utc_date(),GET_FORMAT(time,'usa'))
12:00:00 AM
select DATE_FORMAT(utc_date(),GET_FORMAT(date,'EUR'));
DATE_FORMAT(utc_date(),GET_FORMAT(date,'EUR'))
13.09.2020
select DATE_FORMAT(utc_date(),GET_FORMAT(datetime,'internal'));
DATE_FORMAT(utc_date(),GET_FORMAT(datetime,'internal'))
20200913000000
select DATE_FORMAT(utc_date(),GET_FORMAT(time,'iso'));
DATE_FORMAT(utc_date(),GET_FORMAT(time,'iso'))
00:00:00
select DATE_FORMAT(utc_date(),GET_FORMAT(datetime,'jis'));
DATE_FORMAT(utc_date(),GET_FORMAT(datetime,'jis'))
2020-09-13 00:00:00
select DATE_FORMAT(utc_date(),GET_FORMAT(datetime,'usa'));
DATE_FORMAT(utc_date(),GET_FORMAT(datetime,'usa'))
2020-09-13 00.00.00
select DATE_FORMAT('2021-6-25',GET_FORMAT(datetime,'EUR'));
DATE_FORMAT('2021-6-25',GET_FORMAT(datetime,'EUR'))
2021-06-25 00.00.00
select DATE_FORMAT('2021-6-25',GET_FORMAT(datetime,'internal'));
DATE_FORMAT('2021-6-25',GET_FORMAT(datetime,'internal'))
20210625000000
select DATE_FORMAT('2021-6-25',GET_FORMAT(datetime,'iso'));
DATE_FORMAT('2021-6-25',GET_FORMAT(datetime,'iso'))
2021-06-25 00:00:00
select DATE_FORMAT('2021-6-25',GET_FORMAT(datetime,'jis'));
DATE_FORMAT('2021-6-25',GET_FORMAT(datetime,'jis'))
2021-06-25 00:00:00
select DATE_FORMAT('2021-6-25',GET_FORMAT(datetime,'usa'));
DATE_FORMAT('2021-6-25',GET_FORMAT(datetime,'usa'))
2021-06-25 00.00.00
select DATE_FORMAT(utc_date(),GET_FORMAT(TIMESTAMP,'EUR'));
DATE_FORMAT(utc_date(),GET_FORMAT(TIMESTAMP,'EUR'))
2020-09-13 00.00.00
select DATE_FORMAT(utc_date(),GET_FORMAT(TIMESTAMP,'internal'));
DATE_FORMAT(utc_date(),GET_FORMAT(TIMESTAMP,'internal'))
20200913000000
select DATE_FORMAT(utc_date(),GET_FORMAT(TIMESTAMP,'iso'));
DATE_FORMAT(utc_date(),GET_FORMAT(TIMESTAMP,'iso'))
2020-09-13 00:00:00
select DATE_FORMAT(utc_date(),GET_FORMAT(TIMESTAMP,'jis'));
DATE_FORMAT(utc_date(),GET_FORMAT(TIMESTAMP,'jis'))
2020-09-13 00:00:00
select DATE_FORMAT(utc_date(),GET_FORMAT(TIMESTAMP,'usa'));
DATE_FORMAT(utc_date(),GET_FORMAT(TIMESTAMP,'usa'))
2020-09-13 00.00.00
select DATE_FORMAT(utc_time(),GET_FORMAT(TIME,'usa'));
DATE_FORMAT(utc_time(),GET_FORMAT(TIME,'usa'))
12:26:40 PM
select DATE_FORMAT(utc_time(),GET_FORMAT(DATETIME,'EUR'));
select DATE_FORMAT(utc_time(),GET_FORMAT(DATE,'JIS'));
select DATE_FORMAT(utc_time(),GET_FORMAT(DATETIME,'internal'));
select DATE_FORMAT(utc_time(),GET_FORMAT(DATETIME,'iso'));
select FROM_UNIXTIME(160000000,GET_FORMAT(DATETIME,'EUR'));
FROM_UNIXTIME(160000000,GET_FORMAT(DATETIME,'EUR'))
1975-01-27 04.26.40
select FROM_UNIXTIME(utc_date(),GET_FORMAT(DATETIME,'internal'));
FROM_UNIXTIME(utc_date(),GET_FORMAT(DATETIME,'internal'))
19700823032153
select FROM_UNIXTIME(160000000,GET_FORMAT(DATETIME,'usa'));
FROM_UNIXTIME(160000000,GET_FORMAT(DATETIME,'usa'))
1975-01-27 04.26.40
select FROM_UNIXTIME(utc_time(),GET_FORMAT(DATETIME,'jis'));
FROM_UNIXTIME(utc_time(),GET_FORMAT(DATETIME,'jis'))
1970-01-02 18:04:00
select FROM_UNIXTIME(160000000,GET_FORMAT(DATETIME,'iso'));
FROM_UNIXTIME(160000000,GET_FORMAT(DATETIME,'iso'))
1975-01-27 04:26:40
select FROM_UNIXTIME(160000000,GET_FORMAT(DATE,'EUR'));
FROM_UNIXTIME(160000000,GET_FORMAT(DATE,'EUR'))
27.01.1975
select FROM_UNIXTIME(utc_date(),GET_FORMAT(DATE,'internal'));
FROM_UNIXTIME(utc_date(),GET_FORMAT(DATE,'internal'))
19700823
select FROM_UNIXTIME(160000000,GET_FORMAT(DATE,'usa'));
FROM_UNIXTIME(160000000,GET_FORMAT(DATE,'usa'))
01.27.1975
select FROM_UNIXTIME(utc_time(),GET_FORMAT(DATE,'jis'));
FROM_UNIXTIME(utc_time(),GET_FORMAT(DATE,'jis'))
1970-01-02
select FROM_UNIXTIME(160000000,GET_FORMAT(DATE,'iso'));
FROM_UNIXTIME(160000000,GET_FORMAT(DATE,'iso'))
1975-01-27
select FROM_UNIXTIME(160000000,GET_FORMAT(time,'EUR'));
FROM_UNIXTIME(160000000,GET_FORMAT(time,'EUR'))
04.26.40
select FROM_UNIXTIME(utc_date(),GET_FORMAT(time,'internal'));
FROM_UNIXTIME(utc_date(),GET_FORMAT(time,'internal'))
032153
select FROM_UNIXTIME(160000000,GET_FORMAT(time,'usa'));
FROM_UNIXTIME(160000000,GET_FORMAT(time,'usa'))
04:26:40 AM
select FROM_UNIXTIME(utc_time(),GET_FORMAT(time,'jis'));
FROM_UNIXTIME(utc_time(),GET_FORMAT(time,'jis'))
18:04:00
select FROM_UNIXTIME(160000000,GET_FORMAT(time,'iso'));
FROM_UNIXTIME(160000000,GET_FORMAT(time,'iso'))
04:26:40
select FROM_UNIXTIME(160000000,GET_FORMAT(timestamp,'EUR'));
FROM_UNIXTIME(160000000,GET_FORMAT(timestamp,'EUR'))
1975-01-27 04.26.40
select FROM_UNIXTIME(utc_date(),GET_FORMAT(timestamp,'internal'));
FROM_UNIXTIME(utc_date(),GET_FORMAT(timestamp,'internal'))
19700823032153
select FROM_UNIXTIME(160000000,GET_FORMAT(timestamp,'usa'));
FROM_UNIXTIME(160000000,GET_FORMAT(timestamp,'usa'))
1975-01-27 04.26.40
select FROM_UNIXTIME(utc_time(),GET_FORMAT(timestamp,'jis'));
FROM_UNIXTIME(utc_time(),GET_FORMAT(timestamp,'jis'))
1970-01-02 18:04:00
select FROM_UNIXTIME(160000000,GET_FORMAT(timestamp,'iso'));
FROM_UNIXTIME(160000000,GET_FORMAT(timestamp,'iso'))
1975-01-27 04:26:40
select STR_TO_DATE(utc_date(),GET_FORMAT(DATETIME,'ISO'));
STR_TO_DATE(utc_date(),GET_FORMAT(DATETIME,'ISO'))
2020-09-13 00:00:00.000000
select STR_TO_DATE(utc_date(),GET_FORMAT(DATETIME,'eur'));
STR_TO_DATE(utc_date(),GET_FORMAT(DATETIME,'eur'))
2020-09-13 00:00:00.000000
select STR_TO_DATE(utc_date(),GET_FORMAT(DATETIME,'internal'));
STR_TO_DATE(utc_date(),GET_FORMAT(DATETIME,'internal'))
NULL
Warnings:
Warning	1411	Incorrect datetime value: '2020-09-13' for function str_to_date
select STR_TO_DATE(utc_date(),GET_FORMAT(DATETIME,'jis'));
STR_TO_DATE(utc_date(),GET_FORMAT(DATETIME,'jis'))
2020-09-13 00:00:00.000000
select STR_TO_DATE(utc_date(),GET_FORMAT(DATETIME,'iso'));
STR_TO_DATE(utc_date(),GET_FORMAT(DATETIME,'iso'))
2020-09-13 00:00:00.000000
select STR_TO_DATE(utc_date(),GET_FORMAT(DATE,'ISO'));
STR_TO_DATE(utc_date(),GET_FORMAT(DATE,'ISO'))
2020-09-13 00:00:00.000000
select STR_TO_DATE(utc_date(),GET_FORMAT(DATE,'eur'));
STR_TO_DATE(utc_date(),GET_FORMAT(DATE,'eur'))
NULL
Warnings:
Warning	1411	Incorrect datetime value: '2020-09-13' for function str_to_date
select STR_TO_DATE(utc_date(),GET_FORMAT(DATE,'internal'));
STR_TO_DATE(utc_date(),GET_FORMAT(DATE,'internal'))
NULL
Warnings:
Warning	1411	Incorrect datetime value: '2020-09-13' for function str_to_date
select STR_TO_DATE(utc_date(),GET_FORMAT(DATE,'jis'));
STR_TO_DATE(utc_date(),GET_FORMAT(DATE,'jis'))
2020-09-13 00:00:00.000000
select STR_TO_DATE(utc_date(),GET_FORMAT(DATE,'iso'));
STR_TO_DATE(utc_date(),GET_FORMAT(DATE,'iso'))
2020-09-13 00:00:00.000000
select STR_TO_DATE(utc_date(),GET_FORMAT(time,'iso'));
STR_TO_DATE(utc_date(),GET_FORMAT(time,'iso'))
NULL
Warnings:
Warning	1411	Incorrect datetime value: '2020-09-13' for function str_to_date
select STR_TO_DATE(utc_date(),GET_FORMAT(time,'ISO'));
STR_TO_DATE(utc_date(),GET_FORMAT(time,'ISO'))
NULL
Warnings:
Warning	1411	Incorrect datetime value: '2020-09-13' for function str_to_date
select STR_TO_DATE(utc_date(),GET_FORMAT(time,'eur'));
STR_TO_DATE(utc_date(),GET_FORMAT(time,'eur'))
NULL
Warnings:
Warning	1411	Incorrect datetime value: '2020-09-13' for function str_to_date
select STR_TO_DATE(utc_date(),GET_FORMAT(time,'internal'));
STR_TO_DATE(utc_date(),GET_FORMAT(time,'internal'))
0000-00-00 20:20:00.000000
select STR_TO_DATE(utc_date(),GET_FORMAT(time,'jis'));
STR_TO_DATE(utc_date(),GET_FORMAT(time,'jis'))
NULL
Warnings:
Warning	1411	Incorrect datetime value: '2020-09-13' for function str_to_date
select STR_TO_DATE(utc_date(),GET_FORMAT(time,'iso'));
STR_TO_DATE(utc_date(),GET_FORMAT(time,'iso'))
NULL
Warnings:
Warning	1411	Incorrect datetime value: '2020-09-13' for function str_to_date
select STR_TO_DATE(utc_time(),GET_FORMAT(time,'ISO'));
STR_TO_DATE(utc_time(),GET_FORMAT(time,'ISO'))
0000-00-00 12:26:40.000000
select STR_TO_DATE(utc_time(),GET_FORMAT(time,'eur'));
STR_TO_DATE(utc_time(),GET_FORMAT(time,'eur'))
NULL
Warnings:
Warning	1411	Incorrect datetime value: '12:26:40' for function str_to_date
select STR_TO_DATE(utc_time(),GET_FORMAT(time,'internal'));
STR_TO_DATE(utc_time(),GET_FORMAT(time,'internal'))
0000-00-00 12:00:00.000000
select STR_TO_DATE(utc_time(),GET_FORMAT(time,'jis'));
STR_TO_DATE(utc_time(),GET_FORMAT(time,'jis'))
0000-00-00 12:26:40.000000
select STR_TO_DATE(utc_time(),GET_FORMAT(time,'iso'));
STR_TO_DATE(utc_time(),GET_FORMAT(time,'iso'))
0000-00-00 12:26:40.000000
select STR_TO_DATE(utc_time(),GET_FORMAT(timestamp,'ISO'));
STR_TO_DATE(utc_time(),GET_FORMAT(timestamp,'ISO'))
NULL
Warnings:
Warning	1411	Incorrect datetime value: '12:26:40' for function str_to_date
select STR_TO_DATE(utc_time(),GET_FORMAT(timestamp,'eur'));
STR_TO_DATE(utc_time(),GET_FORMAT(timestamp,'eur'))
NULL
Warnings:
Warning	1411	Incorrect datetime value: '12:26:40' for function str_to_date
select STR_TO_DATE(utc_time(5),GET_FORMAT(timestamp,'internal'));
STR_TO_DATE(utc_time(5),GET_FORMAT(timestamp,'internal'))
NULL
Warnings:
Warning	1411	Incorrect datetime value: '12:26:40.00000' for function str_to_date
select STR_TO_DATE(utc_time(),GET_FORMAT(timestamp,'jis'));
STR_TO_DATE(utc_time(),GET_FORMAT(timestamp,'jis'))
NULL
Warnings:
Warning	1411	Incorrect datetime value: '12:26:40' for function str_to_date
select STR_TO_DATE(utc_time(),GET_FORMAT(timestamp,'iso'));
STR_TO_DATE(utc_time(),GET_FORMAT(timestamp,'iso'))
NULL
Warnings:
Warning	1411	Incorrect datetime value: '12:26:40' for function str_to_date
select STR_TO_DATE(utc_date(),GET_FORMAT(timestamp,'ISO'));
STR_TO_DATE(utc_date(),GET_FORMAT(timestamp,'ISO'))
2020-09-13 00:00:00.000000
select STR_TO_DATE(utc_date(),GET_FORMAT(timestamp,'eur'));
STR_TO_DATE(utc_date(),GET_FORMAT(timestamp,'eur'))
2020-09-13 00:00:00.000000
select STR_TO_DATE(utc_date(),GET_FORMAT(timestamp,'internal'));
STR_TO_DATE(utc_date(),GET_FORMAT(timestamp,'internal'))
NULL
Warnings:
Warning	1411	Incorrect datetime value: '2020-09-13' for function str_to_date
select STR_TO_DATE(utc_date(),GET_FORMAT(timestamp,'jis'));
STR_TO_DATE(utc_date(),GET_FORMAT(timestamp,'jis'))
2020-09-13 00:00:00.000000
select STR_TO_DATE(utc_date(),GET_FORMAT(timestamp,'iso'));
STR_TO_DATE(utc_date(),GET_FORMAT(timestamp,'iso'))
2020-09-13 00:00:00.000000
select STR_TO_DATE("2021-06-24",GET_FORMAT(DATE,'ISO'));
STR_TO_DATE("2021-06-24",GET_FORMAT(DATE,'ISO'))
2021-06-24 00:00:00.000000
select STR_TO_DATE("2021-06-24",GET_FORMAT(DATE,'internal'));
STR_TO_DATE("2021-06-24",GET_FORMAT(DATE,'internal'))
NULL
Warnings:
Warning	1411	Incorrect datetime value: '2021-06-24' for function str_to_date
select STR_TO_DATE("2021-06-24",GET_FORMAT(DATE,'usa'));
STR_TO_DATE("2021-06-24",GET_FORMAT(DATE,'usa'))
NULL
Warnings:
Warning	1411	Incorrect datetime value: '2021-06-24' for function str_to_date
select STR_TO_DATE("2021-06-24 12:10:10",GET_FORMAT(DATETIME,'eur'));
STR_TO_DATE("2021-06-24 12:10:10",GET_FORMAT(DATETIME,'eur'))
NULL
Warnings:
Warning	1411	Incorrect datetime value: '2021-06-24 12:10:10' for function str_to_date
select STR_TO_DATE("2021-06-24 12:10:10",GET_FORMAT(DATETIME,'iso'));
STR_TO_DATE("2021-06-24 12:10:10",GET_FORMAT(DATETIME,'iso'))
2021-06-24 12:10:10.000000
select STR_TO_DATE("2021-06-24 12:10:10",GET_FORMAT(DATETIME,'usa'));
STR_TO_DATE("2021-06-24 12:10:10",GET_FORMAT(DATETIME,'usa'))
NULL
Warnings:
Warning	1411	Incorrect datetime value: '2021-06-24 12:10:10' for function str_to_date
select STR_TO_DATE("2021-06-24 12:10:10",GET_FORMAT(DATETIME,'internal'));
STR_TO_DATE("2021-06-24 12:10:10",GET_FORMAT(DATETIME,'internal'))
NULL
Warnings:
Warning	1411	Incorrect datetime value: '2021-06-24 12:10:10' for function str_to_date
select STR_TO_DATE("12:12:12",GET_FORMAT(time,'jis'));
STR_TO_DATE("12:12:12",GET_FORMAT(time,'jis'))
0000-00-00 12:12:12.000000
select STR_TO_DATE("12:12:12",GET_FORMAT(time,'eur'));
STR_TO_DATE("12:12:12",GET_FORMAT(time,'eur'))
NULL
Warnings:
Warning	1411	Incorrect datetime value: '12:12:12' for function str_to_date
select STR_TO_DATE("12:12:12",GET_FORMAT(time,'iso'));
STR_TO_DATE("12:12:12",GET_FORMAT(time,'iso'))
0000-00-00 12:12:12.000000
select STR_TO_DATE("12:12:12",GET_FORMAT(time,'usa'));
STR_TO_DATE("12:12:12",GET_FORMAT(time,'usa'))
0000-00-00 12:12:12.000000
select STR_TO_DATE("12:12:12",GET_FORMAT(time,'internal'));
STR_TO_DATE("12:12:12",GET_FORMAT(time,'internal'))
0000-00-00 12:00:00.000000
select STR_TO_DATE("2021-06-24 12:10:10",GET_FORMAT(TIMESTAMP,'eur'));
STR_TO_DATE("2021-06-24 12:10:10",GET_FORMAT(TIMESTAMP,'eur'))
NULL
Warnings:
Warning	1411	Incorrect datetime value: '2021-06-24 12:10:10' for function str_to_date
select STR_TO_DATE("2021-06-24 12:10:10",GET_FORMAT(TIMESTAMP,'usa'));
STR_TO_DATE("2021-06-24 12:10:10",GET_FORMAT(TIMESTAMP,'usa'))
NULL
Warnings:
Warning	1411	Incorrect datetime value: '2021-06-24 12:10:10' for function str_to_date
select STR_TO_DATE("2021-06-24 12:10:10",GET_FORMAT(TIMESTAMP,'internal'));
STR_TO_DATE("2021-06-24 12:10:10",GET_FORMAT(TIMESTAMP,'internal'))
NULL
Warnings:
Warning	1411	Incorrect datetime value: '2021-06-24 12:10:10' for function str_to_date
select STR_TO_DATE("2021-06-24 12:10:10",GET_FORMAT(TIMESTAMP,'JIS'));
STR_TO_DATE("2021-06-24 12:10:10",GET_FORMAT(TIMESTAMP,'JIS'))
2021-06-24 12:10:10.000000
select USEC_TO_TIME(GET_FORMAT(DATETIME,'internal'));
USEC_TO_TIME(GET_FORMAT(DATETIME,'internal'))
1970-01-01 08:00:00.000000
select USEC_TO_TIME(GET_FORMAT(DATE,'ISO'));
USEC_TO_TIME(GET_FORMAT(DATE,'ISO'))
1970-01-01 08:00:00.000000
obmysql-get_format-3-2  字符串函数
select CONCAT(GET_FORMAT(time,'iso'),GET_FORMAT(time,'iso'));
CONCAT(GET_FORMAT(time,'iso'),GET_FORMAT(time,'iso'))
%H:%i:%s%H:%i:%s
select CONCAT_WS('_',GET_FORMAT(DATETIME,'eur'),GET_FORMAT(TIME,'usa'));
CONCAT_WS('_',GET_FORMAT(DATETIME,'eur'),GET_FORMAT(TIME,'usa'))
%Y-%m-%d %H.%i.%s_%h:%i:%s %p
select FORMAT(GET_FORMAT(DATETIME,'usa'),1);
FORMAT(GET_FORMAT(DATETIME,'usa'),1)
0.0
Warnings:
Warning	1292	Truncated incorrect DOUBLE value: '%Y-%m-%d %H.%i.%s'
select SUBSTR(GET_FORMAT(DATETIME,'internal'),1,2);
SUBSTR(GET_FORMAT(DATETIME,'internal'),1,2)
%Y
select SUBSTRING(GET_FORMAT(DATETIME,'iso'),1,2);
SUBSTRING(GET_FORMAT(DATETIME,'iso'),1,2)
%Y
select TRIM(GET_FORMAT(time,'jis'));
TRIM(GET_FORMAT(time,'jis'))
%H:%i:%s
select RTRIM(GET_FORMAT(time,'usa'));
RTRIM(GET_FORMAT(time,'usa'))
%h:%i:%s %p
select ascii(GET_FORMAT(DATE,'eur'));
ascii(GET_FORMAT(DATE,'eur'))
37
select ORD(GET_FORMAT(time,'internal'));
ORD(GET_FORMAT(time,'internal'))
37
select LENGTH(GET_FORMAT(DATETIME,'internal'));
LENGTH(GET_FORMAT(DATETIME,'internal'))
12
select UPPER(GET_FORMAT(TIME,'usa'));
UPPER(GET_FORMAT(TIME,'usa'))
%H:%I:%S %P
select lower(GET_FORMAT(time,'jis'));
lower(GET_FORMAT(time,'jis'))
%h:%i:%s
select HEX(GET_FORMAT(DATETIME,'eur'));
HEX(GET_FORMAT(DATETIME,'eur'))
25592D256D2D25642025482E25692E2573
select UNHEX(GET_FORMAT(DATETIME,'internal'));
UNHEX(GET_FORMAT(DATETIME,'internal'))
NULL
select MD5(GET_FORMAT(time,'iso'));
MD5(GET_FORMAT(time,'iso'))
54bd1e051cce8e238f4ecec749dfad2d
select INT2IP(GET_FORMAT(time,'iso'));
INT2IP(GET_FORMAT(time,'iso'))
0.0.0.0
Warnings:
Warning	1292	Truncated incorrect INTEGER value: '%H:%i:%s'
SELECT GET_FORMAT(time,'iso') LIKE GET_FORMAT(time,'iso') ESCAPE GET_FORMAT(time,'iso');
ERROR HY000: Incorrect arguments to ESCAPE
SELECT GET_FORMAT(time,'iso') REGEXP GET_FORMAT(time,'iso');
GET_FORMAT(time,'iso') REGEXP GET_FORMAT(time,'iso')
1
SELECT REPEAT(GET_FORMAT(time,'iso'), 3);
REPEAT(GET_FORMAT(time,'iso'), 3)
%H:%i:%s%H:%i:%s%H:%i:%s
SELECT SUBSTRING_INDEX(GET_FORMAT(DATE,'eur'),GET_FORMAT(DATE,'eur'),1);
SUBSTRING_INDEX(GET_FORMAT(DATE,'eur'),GET_FORMAT(DATE,'eur'),1)

SELECT LOCATE(GET_FORMAT(datetime,'jis'),GET_FORMAT(time,'jis'));
LOCATE(GET_FORMAT(datetime,'jis'),GET_FORMAT(time,'jis'))
0
SELECT POSITION(GET_FORMAT(time,'jis') in GET_FORMAT(datetime,'eur'));
POSITION(GET_FORMAT(time,'jis') in GET_FORMAT(datetime,'eur'))
0
SELECT instr(GET_FORMAT(datetime,'jis'),GET_FORMAT(datetime,'jis'));
instr(GET_FORMAT(datetime,'jis'),GET_FORMAT(datetime,'jis'))
1
SELECT REPLACE(GET_FORMAT(datetime,'eur'),GET_FORMAT(datetime,'eur'),GET_FORMAT(datetime,'eur'));
REPLACE(GET_FORMAT(datetime,'eur'),GET_FORMAT(datetime,'eur'),GET_FORMAT(datetime,'eur'))
%Y-%m-%d %H.%i.%s
SELECT FIELD(GET_FORMAT(datetime,'eur'),GET_FORMAT(datetime,'eur'),GET_FORMAT(datetime,'eur'));
FIELD(GET_FORMAT(datetime,'eur'),GET_FORMAT(datetime,'eur'),GET_FORMAT(datetime,'eur'))
1
SELECT ELT(1,GET_FORMAT(time,'jis'),GET_FORMAT(datetime,'eur'));
ELT(1,GET_FORMAT(time,'jis'),GET_FORMAT(datetime,'eur'))
%H:%i:%s
SELECT ELT(2,GET_FORMAT(time,'jis'),GET_FORMAT(datetime,'eur'));
ELT(2,GET_FORMAT(time,'jis'),GET_FORMAT(datetime,'eur'))
%Y-%m-%d %H.%i.%s
SELECT LPAD(GET_FORMAT(time,'jis'),20,GET_FORMAT(time,'iso'));
LPAD(GET_FORMAT(time,'jis'),20,GET_FORMAT(time,'iso'))
%H:%i:%s%H:%%H:%i:%s
SELECT RPAD(GET_FORMAT(time,'jis'),20,GET_FORMAT(time,'iso'));
RPAD(GET_FORMAT(time,'jis'),20,GET_FORMAT(time,'iso'))
%H:%i:%s%H:%i:%s%H:%
SELECT quote(GET_FORMAT(DATETIME,'internal'));
quote(GET_FORMAT(DATETIME,'internal'))
'%Y%m%d%H%i%s'
SELECT REGEXP_SUBSTR(GET_FORMAT(DATETIME,'internal'));
ERROR 42000: Incorrect parameter count in the call to native function 'REGEXP_SUBSTR'
select regexp_substr(GET_FORMAT(DATETIME,'internal'), '%y(.*)', 1, 1, 'i', 0);
regexp_substr(GET_FORMAT(DATETIME,'internal'), '%y(.*)', 1, 1, 'i', 0)
%Y%m%d%H%i%s
obmysql-get_format-3-3
select CAST(GET_FORMAT(DATETIME,'eur') as char);
CAST(GET_FORMAT(DATETIME,'eur') as char)
%Y-%m-%d %H.%i.%s
select GREATEST(GET_FORMAT(time,'iso'),GET_FORMAT(datetime,'eur'));
GREATEST(GET_FORMAT(time,'iso'),GET_FORMAT(datetime,'eur'))
%Y-%m-%d %H.%i.%s
select LEAST(GET_FORMAT(time,'iso'),GET_FORMAT(datetime,'eur'));
LEAST(GET_FORMAT(time,'iso'),GET_FORMAT(datetime,'eur'))
%H:%i:%s
select isnull(GET_FORMAT(DATETIME,'eur'));
isnull(GET_FORMAT(DATETIME,'eur'))
0
obmysql-get_format-4 使用场景
obmysql-get_format-4-1
drop table t1;
create table t1 (id int ,f varchar(50));
insert into t1 values(1,GET_FORMAT(DATETIME,'eur')),(2,GET_FORMAT(DATETIME,'iso')),(3,GET_FORMAT(DATETIME,'internal')),(4,GET_FORMAT(DATETIME,'jis')),(5,GET_FORMAT(DATETIME,'USA'));
insert into t1 values(6,GET_FORMAT(DATE,'eur')),(7,GET_FORMAT(DATE,'iso')),(8,GET_FORMAT(DATE,'internal')),(9,GET_FORMAT(DATE,'jis')),(10,GET_FORMAT(DATE,'USA'));
insert into t1 values(11,GET_FORMAT(time,'eur')),(12,GET_FORMAT(time,'iso')),(13,GET_FORMAT(time,'internal')),(14,GET_FORMAT(time,'jis')),(15,GET_FORMAT(time,'USA'));
insert into t1 values(16,GET_FORMAT(timestamp,'eur')),(17,GET_FORMAT(timestamp,'iso')),(18,GET_FORMAT(timestamp,'internal')),(19,GET_FORMAT(timestamp,'jis')),(20,GET_FORMAT(timestamp,'USA'));
select * from t1;
id	f
1	%Y-%m-%d %H.%i.%s
2	%Y-%m-%d %H:%i:%s
3	%Y%m%d%H%i%s
4	%Y-%m-%d %H:%i:%s
5	%Y-%m-%d %H.%i.%s
6	%d.%m.%Y
7	%Y-%m-%d
8	%Y%m%d
9	%Y-%m-%d
10	%m.%d.%Y
11	%H.%i.%s
12	%H:%i:%s
13	%H%i%s
14	%H:%i:%s
15	%h:%i:%s %p
16	%Y-%m-%d %H.%i.%s
17	%Y-%m-%d %H:%i:%s
18	%Y%m%d%H%i%s
19	%Y-%m-%d %H:%i:%s
20	%Y-%m-%d %H.%i.%s
create table t2 as select GET_FORMAT(DATETIME,'eur'), GET_FORMAT(DATE,'iso'),GET_FORMAT(time,'jis'),GET_FORMAT(timestamp,'internal') from t1;
select * from t2;
GET_FORMAT(DATETIME,'eur')	GET_FORMAT(DATE,'iso')	GET_FORMAT(time,'jis')	GET_FORMAT(timestamp,'internal')
%Y-%m-%d %H.%i.%s	%Y-%m-%d	%H:%i:%s	%Y%m%d%H%i%s
%Y-%m-%d %H.%i.%s	%Y-%m-%d	%H:%i:%s	%Y%m%d%H%i%s
%Y-%m-%d %H.%i.%s	%Y-%m-%d	%H:%i:%s	%Y%m%d%H%i%s
%Y-%m-%d %H.%i.%s	%Y-%m-%d	%H:%i:%s	%Y%m%d%H%i%s
%Y-%m-%d %H.%i.%s	%Y-%m-%d	%H:%i:%s	%Y%m%d%H%i%s
%Y-%m-%d %H.%i.%s	%Y-%m-%d	%H:%i:%s	%Y%m%d%H%i%s
%Y-%m-%d %H.%i.%s	%Y-%m-%d	%H:%i:%s	%Y%m%d%H%i%s
%Y-%m-%d %H.%i.%s	%Y-%m-%d	%H:%i:%s	%Y%m%d%H%i%s
%Y-%m-%d %H.%i.%s	%Y-%m-%d	%H:%i:%s	%Y%m%d%H%i%s
%Y-%m-%d %H.%i.%s	%Y-%m-%d	%H:%i:%s	%Y%m%d%H%i%s
%Y-%m-%d %H.%i.%s	%Y-%m-%d	%H:%i:%s	%Y%m%d%H%i%s
%Y-%m-%d %H.%i.%s	%Y-%m-%d	%H:%i:%s	%Y%m%d%H%i%s
%Y-%m-%d %H.%i.%s	%Y-%m-%d	%H:%i:%s	%Y%m%d%H%i%s
%Y-%m-%d %H.%i.%s	%Y-%m-%d	%H:%i:%s	%Y%m%d%H%i%s
%Y-%m-%d %H.%i.%s	%Y-%m-%d	%H:%i:%s	%Y%m%d%H%i%s
%Y-%m-%d %H.%i.%s	%Y-%m-%d	%H:%i:%s	%Y%m%d%H%i%s
%Y-%m-%d %H.%i.%s	%Y-%m-%d	%H:%i:%s	%Y%m%d%H%i%s
%Y-%m-%d %H.%i.%s	%Y-%m-%d	%H:%i:%s	%Y%m%d%H%i%s
%Y-%m-%d %H.%i.%s	%Y-%m-%d	%H:%i:%s	%Y%m%d%H%i%s
%Y-%m-%d %H.%i.%s	%Y-%m-%d	%H:%i:%s	%Y%m%d%H%i%s
drop table t2;
select DATE_FORMAT(utc_date(),GET_FORMAT(DATE,'JIS')) from t1;
DATE_FORMAT(utc_date(),GET_FORMAT(DATE,'JIS'))
2020-09-13
2020-09-13
2020-09-13
2020-09-13
2020-09-13
2020-09-13
2020-09-13
2020-09-13
2020-09-13
2020-09-13
2020-09-13
2020-09-13
2020-09-13
2020-09-13
2020-09-13
2020-09-13
2020-09-13
2020-09-13
2020-09-13
2020-09-13
select FROM_UNIXTIME(160000000,GET_FORMAT(DATE,'EUR')) from t1;
FROM_UNIXTIME(160000000,GET_FORMAT(DATE,'EUR'))
27.01.1975
27.01.1975
27.01.1975
27.01.1975
27.01.1975
27.01.1975
27.01.1975
27.01.1975
27.01.1975
27.01.1975
27.01.1975
27.01.1975
27.01.1975
27.01.1975
27.01.1975
27.01.1975
27.01.1975
27.01.1975
27.01.1975
27.01.1975
select STR_TO_DATE(utc_date(),GET_FORMAT(DATE,'ISO')) from t1;
STR_TO_DATE(utc_date(),GET_FORMAT(DATE,'ISO'))
2020-09-13 00:00:00.000000
2020-09-13 00:00:00.000000
2020-09-13 00:00:00.000000
2020-09-13 00:00:00.000000
2020-09-13 00:00:00.000000
2020-09-13 00:00:00.000000
2020-09-13 00:00:00.000000
2020-09-13 00:00:00.000000
2020-09-13 00:00:00.000000
2020-09-13 00:00:00.000000
2020-09-13 00:00:00.000000
2020-09-13 00:00:00.000000
2020-09-13 00:00:00.000000
2020-09-13 00:00:00.000000
2020-09-13 00:00:00.000000
2020-09-13 00:00:00.000000
2020-09-13 00:00:00.000000
2020-09-13 00:00:00.000000
2020-09-13 00:00:00.000000
2020-09-13 00:00:00.000000
select DATE_FORMAT(utc_date(),GET_FORMAT(DATETIME,'USA')) from t1;
DATE_FORMAT(utc_date(),GET_FORMAT(DATETIME,'USA'))
2020-09-13 00.00.00
2020-09-13 00.00.00
2020-09-13 00.00.00
2020-09-13 00.00.00
2020-09-13 00.00.00
2020-09-13 00.00.00
2020-09-13 00.00.00
2020-09-13 00.00.00
2020-09-13 00.00.00
2020-09-13 00.00.00
2020-09-13 00.00.00
2020-09-13 00.00.00
2020-09-13 00.00.00
2020-09-13 00.00.00
2020-09-13 00.00.00
2020-09-13 00.00.00
2020-09-13 00.00.00
2020-09-13 00.00.00
2020-09-13 00.00.00
2020-09-13 00.00.00
select FROM_UNIXTIME(160000000,GET_FORMAT(DATETIME,'INTERNAL')) from t1;
FROM_UNIXTIME(160000000,GET_FORMAT(DATETIME,'INTERNAL'))
19750127042640
19750127042640
19750127042640
19750127042640
19750127042640
19750127042640
19750127042640
19750127042640
19750127042640
19750127042640
19750127042640
19750127042640
19750127042640
19750127042640
19750127042640
19750127042640
19750127042640
19750127042640
19750127042640
19750127042640
select STR_TO_DATE(utc_date(),GET_FORMAT(DATETIME,'ISO')) from t1;
STR_TO_DATE(utc_date(),GET_FORMAT(DATETIME,'ISO'))
2020-09-13 00:00:00.000000
2020-09-13 00:00:00.000000
2020-09-13 00:00:00.000000
2020-09-13 00:00:00.000000
2020-09-13 00:00:00.000000
2020-09-13 00:00:00.000000
2020-09-13 00:00:00.000000
2020-09-13 00:00:00.000000
2020-09-13 00:00:00.000000
2020-09-13 00:00:00.000000
2020-09-13 00:00:00.000000
2020-09-13 00:00:00.000000
2020-09-13 00:00:00.000000
2020-09-13 00:00:00.000000
2020-09-13 00:00:00.000000
2020-09-13 00:00:00.000000
2020-09-13 00:00:00.000000
2020-09-13 00:00:00.000000
2020-09-13 00:00:00.000000
2020-09-13 00:00:00.000000
select DATE_FORMAT(UTC_TIME(),GET_FORMAT(TIME,'usa')) from t1;
DATE_FORMAT(UTC_TIME(),GET_FORMAT(TIME,'usa'))
12:26:40 PM
12:26:40 PM
12:26:40 PM
12:26:40 PM
12:26:40 PM
12:26:40 PM
12:26:40 PM
12:26:40 PM
12:26:40 PM
12:26:40 PM
12:26:40 PM
12:26:40 PM
12:26:40 PM
12:26:40 PM
12:26:40 PM
12:26:40 PM
12:26:40 PM
12:26:40 PM
12:26:40 PM
12:26:40 PM
select FROM_UNIXTIME(160000000,GET_FORMAT(TIME,'INTERNAL')) from t1;
FROM_UNIXTIME(160000000,GET_FORMAT(TIME,'INTERNAL'))
042640
042640
042640
042640
042640
042640
042640
042640
042640
042640
042640
042640
042640
042640
042640
042640
042640
042640
042640
042640
select STR_TO_DATE(utc_TIME(),GET_FORMAT(TIME,'ios')) from t1;
STR_TO_DATE(utc_TIME(),GET_FORMAT(TIME,'ios'))
NULL
NULL
NULL
NULL
NULL
NULL
NULL
NULL
NULL
NULL
NULL
NULL
NULL
NULL
NULL
NULL
NULL
NULL
NULL
NULL
select t1.* ,GET_FORMAT(DATETIME,'eur'),GET_FORMAT(DATE,'iso'), GET_FORMAT(time,'internal') from t1 where f =GET_FORMAT(DATETIME,'eur');
id	f	GET_FORMAT(DATETIME,'eur')	GET_FORMAT(DATE,'iso')	GET_FORMAT(time,'internal')
1	%Y-%m-%d %H.%i.%s	%Y-%m-%d %H.%i.%s	%Y-%m-%d	%H%i%s
5	%Y-%m-%d %H.%i.%s	%Y-%m-%d %H.%i.%s	%Y-%m-%d	%H%i%s
16	%Y-%m-%d %H.%i.%s	%Y-%m-%d %H.%i.%s	%Y-%m-%d	%H%i%s
20	%Y-%m-%d %H.%i.%s	%Y-%m-%d %H.%i.%s	%Y-%m-%d	%H%i%s
select t1.* ,GET_FORMAT(DATETIME,'eur') as a,GET_FORMAT(DATE,'iso') as b, GET_FORMAT(time,'internal') as c from t1 where f <GET_FORMAT(DATE,'USA');
id	f	a	b	c
6	%d.%m.%Y	%Y-%m-%d %H.%i.%s	%Y-%m-%d	%H%i%s
11	%H.%i.%s	%Y-%m-%d %H.%i.%s	%Y-%m-%d	%H%i%s
12	%H:%i:%s	%Y-%m-%d %H.%i.%s	%Y-%m-%d	%H%i%s
13	%H%i%s	%Y-%m-%d %H.%i.%s	%Y-%m-%d	%H%i%s
14	%H:%i:%s	%Y-%m-%d %H.%i.%s	%Y-%m-%d	%H%i%s
15	%h:%i:%s %p	%Y-%m-%d %H.%i.%s	%Y-%m-%d	%H%i%s
select t1.* ,GET_FORMAT(DATETIME,'eur') as a,GET_FORMAT(DATE,'iso') as b, GET_FORMAT(time,'internal') as c from t1 where f <=GET_FORMAT(time,'jis');
id	f	a	b	c
6	%d.%m.%Y	%Y-%m-%d %H.%i.%s	%Y-%m-%d	%H%i%s
11	%H.%i.%s	%Y-%m-%d %H.%i.%s	%Y-%m-%d	%H%i%s
12	%H:%i:%s	%Y-%m-%d %H.%i.%s	%Y-%m-%d	%H%i%s
13	%H%i%s	%Y-%m-%d %H.%i.%s	%Y-%m-%d	%H%i%s
14	%H:%i:%s	%Y-%m-%d %H.%i.%s	%Y-%m-%d	%H%i%s
select t1.* ,GET_FORMAT(DATETIME,'eur') as a,GET_FORMAT(DATE,'iso') as b, GET_FORMAT(time,'internal') as c from t1 where f >=GET_FORMAT(time,'internal');
id	f	a	b	c
1	%Y-%m-%d %H.%i.%s	%Y-%m-%d %H.%i.%s	%Y-%m-%d	%H%i%s
2	%Y-%m-%d %H:%i:%s	%Y-%m-%d %H.%i.%s	%Y-%m-%d	%H%i%s
3	%Y%m%d%H%i%s	%Y-%m-%d %H.%i.%s	%Y-%m-%d	%H%i%s
4	%Y-%m-%d %H:%i:%s	%Y-%m-%d %H.%i.%s	%Y-%m-%d	%H%i%s
5	%Y-%m-%d %H.%i.%s	%Y-%m-%d %H.%i.%s	%Y-%m-%d	%H%i%s
7	%Y-%m-%d	%Y-%m-%d %H.%i.%s	%Y-%m-%d	%H%i%s
8	%Y%m%d	%Y-%m-%d %H.%i.%s	%Y-%m-%d	%H%i%s
9	%Y-%m-%d	%Y-%m-%d %H.%i.%s	%Y-%m-%d	%H%i%s
10	%m.%d.%Y	%Y-%m-%d %H.%i.%s	%Y-%m-%d	%H%i%s
11	%H.%i.%s	%Y-%m-%d %H.%i.%s	%Y-%m-%d	%H%i%s
12	%H:%i:%s	%Y-%m-%d %H.%i.%s	%Y-%m-%d	%H%i%s
13	%H%i%s	%Y-%m-%d %H.%i.%s	%Y-%m-%d	%H%i%s
14	%H:%i:%s	%Y-%m-%d %H.%i.%s	%Y-%m-%d	%H%i%s
15	%h:%i:%s %p	%Y-%m-%d %H.%i.%s	%Y-%m-%d	%H%i%s
16	%Y-%m-%d %H.%i.%s	%Y-%m-%d %H.%i.%s	%Y-%m-%d	%H%i%s
17	%Y-%m-%d %H:%i:%s	%Y-%m-%d %H.%i.%s	%Y-%m-%d	%H%i%s
18	%Y%m%d%H%i%s	%Y-%m-%d %H.%i.%s	%Y-%m-%d	%H%i%s
19	%Y-%m-%d %H:%i:%s	%Y-%m-%d %H.%i.%s	%Y-%m-%d	%H%i%s
20	%Y-%m-%d %H.%i.%s	%Y-%m-%d %H.%i.%s	%Y-%m-%d	%H%i%s
select t1.* ,GET_FORMAT(DATETIME,'eur') as a,GET_FORMAT(DATE,'iso') as b, GET_FORMAT(time,'internal') as c from t1 where f >GET_FORMAT(DATE,'iso');
id	f	a	b	c
1	%Y-%m-%d %H.%i.%s	%Y-%m-%d %H.%i.%s	%Y-%m-%d	%H%i%s
2	%Y-%m-%d %H:%i:%s	%Y-%m-%d %H.%i.%s	%Y-%m-%d	%H%i%s
4	%Y-%m-%d %H:%i:%s	%Y-%m-%d %H.%i.%s	%Y-%m-%d	%H%i%s
5	%Y-%m-%d %H.%i.%s	%Y-%m-%d %H.%i.%s	%Y-%m-%d	%H%i%s
16	%Y-%m-%d %H.%i.%s	%Y-%m-%d %H.%i.%s	%Y-%m-%d	%H%i%s
17	%Y-%m-%d %H:%i:%s	%Y-%m-%d %H.%i.%s	%Y-%m-%d	%H%i%s
19	%Y-%m-%d %H:%i:%s	%Y-%m-%d %H.%i.%s	%Y-%m-%d	%H%i%s
20	%Y-%m-%d %H.%i.%s	%Y-%m-%d %H.%i.%s	%Y-%m-%d	%H%i%s
select t1.* ,GET_FORMAT(DATETIME,'eur') as a,GET_FORMAT(DATE,'iso') as b, GET_FORMAT(time,'internal') as c from t1 where GET_FORMAT(DATE,'internal')<>f;
id	f	a	b	c
1	%Y-%m-%d %H.%i.%s	%Y-%m-%d %H.%i.%s	%Y-%m-%d	%H%i%s
2	%Y-%m-%d %H:%i:%s	%Y-%m-%d %H.%i.%s	%Y-%m-%d	%H%i%s
3	%Y%m%d%H%i%s	%Y-%m-%d %H.%i.%s	%Y-%m-%d	%H%i%s
4	%Y-%m-%d %H:%i:%s	%Y-%m-%d %H.%i.%s	%Y-%m-%d	%H%i%s
5	%Y-%m-%d %H.%i.%s	%Y-%m-%d %H.%i.%s	%Y-%m-%d	%H%i%s
6	%d.%m.%Y	%Y-%m-%d %H.%i.%s	%Y-%m-%d	%H%i%s
7	%Y-%m-%d	%Y-%m-%d %H.%i.%s	%Y-%m-%d	%H%i%s
9	%Y-%m-%d	%Y-%m-%d %H.%i.%s	%Y-%m-%d	%H%i%s
10	%m.%d.%Y	%Y-%m-%d %H.%i.%s	%Y-%m-%d	%H%i%s
11	%H.%i.%s	%Y-%m-%d %H.%i.%s	%Y-%m-%d	%H%i%s
12	%H:%i:%s	%Y-%m-%d %H.%i.%s	%Y-%m-%d	%H%i%s
13	%H%i%s	%Y-%m-%d %H.%i.%s	%Y-%m-%d	%H%i%s
14	%H:%i:%s	%Y-%m-%d %H.%i.%s	%Y-%m-%d	%H%i%s
15	%h:%i:%s %p	%Y-%m-%d %H.%i.%s	%Y-%m-%d	%H%i%s
16	%Y-%m-%d %H.%i.%s	%Y-%m-%d %H.%i.%s	%Y-%m-%d	%H%i%s
17	%Y-%m-%d %H:%i:%s	%Y-%m-%d %H.%i.%s	%Y-%m-%d	%H%i%s
18	%Y%m%d%H%i%s	%Y-%m-%d %H.%i.%s	%Y-%m-%d	%H%i%s
19	%Y-%m-%d %H:%i:%s	%Y-%m-%d %H.%i.%s	%Y-%m-%d	%H%i%s
20	%Y-%m-%d %H.%i.%s	%Y-%m-%d %H.%i.%s	%Y-%m-%d	%H%i%s
select t1.* ,GET_FORMAT(DATETIME,'eur') as a,GET_FORMAT(DATE,'iso') as b, GET_FORMAT(time,'internal') as c from t1 where f =GET_FORMAT(DATE,'internal') or GET_FORMAT(DATETIME,'eur')=f;
id	f	a	b	c
1	%Y-%m-%d %H.%i.%s	%Y-%m-%d %H.%i.%s	%Y-%m-%d	%H%i%s
5	%Y-%m-%d %H.%i.%s	%Y-%m-%d %H.%i.%s	%Y-%m-%d	%H%i%s
8	%Y%m%d	%Y-%m-%d %H.%i.%s	%Y-%m-%d	%H%i%s
16	%Y-%m-%d %H.%i.%s	%Y-%m-%d %H.%i.%s	%Y-%m-%d	%H%i%s
20	%Y-%m-%d %H.%i.%s	%Y-%m-%d %H.%i.%s	%Y-%m-%d	%H%i%s
select t1.* ,GET_FORMAT(DATETIME,'eur') as a,GET_FORMAT(DATE,'iso') as b, GET_FORMAT(time,'internal') as c from t1 where f >GET_FORMAT(DATE,'internal') and GET_FORMAT(DATETIME,'eur')<f;
id	f	a	b	c
2	%Y-%m-%d %H:%i:%s	%Y-%m-%d %H.%i.%s	%Y-%m-%d	%H%i%s
4	%Y-%m-%d %H:%i:%s	%Y-%m-%d %H.%i.%s	%Y-%m-%d	%H%i%s
17	%Y-%m-%d %H:%i:%s	%Y-%m-%d %H.%i.%s	%Y-%m-%d	%H%i%s
19	%Y-%m-%d %H:%i:%s	%Y-%m-%d %H.%i.%s	%Y-%m-%d	%H%i%s
select t1.*,GET_FORMAT(DATETIME,'iso') from t1 where f between  GET_FORMAT(DATE,'eur') and GET_FORMAT(DATE,'USA');
id	f	GET_FORMAT(DATETIME,'iso')
6	%d.%m.%Y	%Y-%m-%d %H:%i:%s
10	%m.%d.%Y	%Y-%m-%d %H:%i:%s
11	%H.%i.%s	%Y-%m-%d %H:%i:%s
12	%H:%i:%s	%Y-%m-%d %H:%i:%s
13	%H%i%s	%Y-%m-%d %H:%i:%s
14	%H:%i:%s	%Y-%m-%d %H:%i:%s
15	%h:%i:%s %p	%Y-%m-%d %H:%i:%s
select t1.*,GET_FORMAT(DATETIME,'iso') from t1 where f like GET_FORMAT(date,'eur');
id	f	GET_FORMAT(DATETIME,'iso')
6	%d.%m.%Y	%Y-%m-%d %H:%i:%s
select t1.*,GET_FORMAT(DATETIME,'iso') from t1 where f not like GET_FORMAT(date,'eur');
id	f	GET_FORMAT(DATETIME,'iso')
1	%Y-%m-%d %H.%i.%s	%Y-%m-%d %H:%i:%s
2	%Y-%m-%d %H:%i:%s	%Y-%m-%d %H:%i:%s
3	%Y%m%d%H%i%s	%Y-%m-%d %H:%i:%s
4	%Y-%m-%d %H:%i:%s	%Y-%m-%d %H:%i:%s
5	%Y-%m-%d %H.%i.%s	%Y-%m-%d %H:%i:%s
7	%Y-%m-%d	%Y-%m-%d %H:%i:%s
8	%Y%m%d	%Y-%m-%d %H:%i:%s
9	%Y-%m-%d	%Y-%m-%d %H:%i:%s
10	%m.%d.%Y	%Y-%m-%d %H:%i:%s
11	%H.%i.%s	%Y-%m-%d %H:%i:%s
12	%H:%i:%s	%Y-%m-%d %H:%i:%s
13	%H%i%s	%Y-%m-%d %H:%i:%s
14	%H:%i:%s	%Y-%m-%d %H:%i:%s
15	%h:%i:%s %p	%Y-%m-%d %H:%i:%s
16	%Y-%m-%d %H.%i.%s	%Y-%m-%d %H:%i:%s
17	%Y-%m-%d %H:%i:%s	%Y-%m-%d %H:%i:%s
18	%Y%m%d%H%i%s	%Y-%m-%d %H:%i:%s
19	%Y-%m-%d %H:%i:%s	%Y-%m-%d %H:%i:%s
20	%Y-%m-%d %H.%i.%s	%Y-%m-%d %H:%i:%s
select GET_FORMAT(DATE,'jis'),GET_FORMAT(time,'USA'),t1.* from t1 where exists (select GET_FORMAT(time,'jis'));
GET_FORMAT(DATE,'jis')	GET_FORMAT(time,'USA')	id	f
%Y-%m-%d	%h:%i:%s %p	1	%Y-%m-%d %H.%i.%s
%Y-%m-%d	%h:%i:%s %p	2	%Y-%m-%d %H:%i:%s
%Y-%m-%d	%h:%i:%s %p	3	%Y%m%d%H%i%s
%Y-%m-%d	%h:%i:%s %p	4	%Y-%m-%d %H:%i:%s
%Y-%m-%d	%h:%i:%s %p	5	%Y-%m-%d %H.%i.%s
%Y-%m-%d	%h:%i:%s %p	6	%d.%m.%Y
%Y-%m-%d	%h:%i:%s %p	7	%Y-%m-%d
%Y-%m-%d	%h:%i:%s %p	8	%Y%m%d
%Y-%m-%d	%h:%i:%s %p	9	%Y-%m-%d
%Y-%m-%d	%h:%i:%s %p	10	%m.%d.%Y
%Y-%m-%d	%h:%i:%s %p	11	%H.%i.%s
%Y-%m-%d	%h:%i:%s %p	12	%H:%i:%s
%Y-%m-%d	%h:%i:%s %p	13	%H%i%s
%Y-%m-%d	%h:%i:%s %p	14	%H:%i:%s
%Y-%m-%d	%h:%i:%s %p	15	%h:%i:%s %p
%Y-%m-%d	%h:%i:%s %p	16	%Y-%m-%d %H.%i.%s
%Y-%m-%d	%h:%i:%s %p	17	%Y-%m-%d %H:%i:%s
%Y-%m-%d	%h:%i:%s %p	18	%Y%m%d%H%i%s
%Y-%m-%d	%h:%i:%s %p	19	%Y-%m-%d %H:%i:%s
%Y-%m-%d	%h:%i:%s %p	20	%Y-%m-%d %H.%i.%s
select GET_FORMAT(DATE,'jis'),GET_FORMAT(time,'USA'),t1.* from t1 where f <any (select GET_FORMAT(time,'jis'));
GET_FORMAT(DATE,'jis')	GET_FORMAT(time,'USA')	id	f
%Y-%m-%d	%h:%i:%s %p	6	%d.%m.%Y
%Y-%m-%d	%h:%i:%s %p	11	%H.%i.%s
%Y-%m-%d	%h:%i:%s %p	13	%H%i%s
select GET_FORMAT(DATE,'jis'),GET_FORMAT(time,'USA'),t1.* from t1 where f >all (select GET_FORMAT(time,'jis'));
GET_FORMAT(DATE,'jis')	GET_FORMAT(time,'USA')	id	f
%Y-%m-%d	%h:%i:%s %p	1	%Y-%m-%d %H.%i.%s
%Y-%m-%d	%h:%i:%s %p	2	%Y-%m-%d %H:%i:%s
%Y-%m-%d	%h:%i:%s %p	3	%Y%m%d%H%i%s
%Y-%m-%d	%h:%i:%s %p	4	%Y-%m-%d %H:%i:%s
%Y-%m-%d	%h:%i:%s %p	5	%Y-%m-%d %H.%i.%s
%Y-%m-%d	%h:%i:%s %p	7	%Y-%m-%d
%Y-%m-%d	%h:%i:%s %p	8	%Y%m%d
%Y-%m-%d	%h:%i:%s %p	9	%Y-%m-%d
%Y-%m-%d	%h:%i:%s %p	10	%m.%d.%Y
%Y-%m-%d	%h:%i:%s %p	15	%h:%i:%s %p
%Y-%m-%d	%h:%i:%s %p	16	%Y-%m-%d %H.%i.%s
%Y-%m-%d	%h:%i:%s %p	17	%Y-%m-%d %H:%i:%s
%Y-%m-%d	%h:%i:%s %p	18	%Y%m%d%H%i%s
%Y-%m-%d	%h:%i:%s %p	19	%Y-%m-%d %H:%i:%s
%Y-%m-%d	%h:%i:%s %p	20	%Y-%m-%d %H.%i.%s
select GET_FORMAT(DATE,'jis'),GET_FORMAT(time,'USA'),t1.* from t1 where f in (select GET_FORMAT(time,'jis'));
GET_FORMAT(DATE,'jis')	GET_FORMAT(time,'USA')	id	f
%Y-%m-%d	%h:%i:%s %p	12	%H:%i:%s
%Y-%m-%d	%h:%i:%s %p	14	%H:%i:%s
select GET_FORMAT(DATE,'jis'),GET_FORMAT(time,'USA'),t1.* from t1 where f in (GET_FORMAT(time,'jis'),GET_FORMAT(DATETIME,'internal'),GET_FORMAT(DATE,'eur'));
GET_FORMAT(DATE,'jis')	GET_FORMAT(time,'USA')	id	f
%Y-%m-%d	%h:%i:%s %p	3	%Y%m%d%H%i%s
%Y-%m-%d	%h:%i:%s %p	6	%d.%m.%Y
%Y-%m-%d	%h:%i:%s %p	12	%H:%i:%s
%Y-%m-%d	%h:%i:%s %p	14	%H:%i:%s
%Y-%m-%d	%h:%i:%s %p	18	%Y%m%d%H%i%s
drop table t2;
create table t2(id int ,t1_id int);
insert into t2 values(1,1);
insert into t2 values(2,2);
insert into t2 values(3,3);
select t1.*,GET_FORMAT(TIME,'eur'), GET_FORMAT(DATE,'jis'), GET_FORMAT(DATETIME,'eur') from t1 inner join t2 on t1.id=t2.t1_id;
id	f	GET_FORMAT(TIME,'eur')	GET_FORMAT(DATE,'jis')	GET_FORMAT(DATETIME,'eur')
1	%Y-%m-%d %H.%i.%s	%H.%i.%s	%Y-%m-%d	%Y-%m-%d %H.%i.%s
2	%Y-%m-%d %H:%i:%s	%H.%i.%s	%Y-%m-%d	%Y-%m-%d %H.%i.%s
3	%Y%m%d%H%i%s	%H.%i.%s	%Y-%m-%d	%Y-%m-%d %H.%i.%s
with t as (select GET_FORMAT(TIME,'eur'), GET_FORMAT(DATE,'jis')  from t1)  select * from t;
GET_FORMAT(TIME,'eur')	GET_FORMAT(DATE,'jis')
%H.%i.%s	%Y-%m-%d
%H.%i.%s	%Y-%m-%d
%H.%i.%s	%Y-%m-%d
%H.%i.%s	%Y-%m-%d
%H.%i.%s	%Y-%m-%d
%H.%i.%s	%Y-%m-%d
%H.%i.%s	%Y-%m-%d
%H.%i.%s	%Y-%m-%d
%H.%i.%s	%Y-%m-%d
%H.%i.%s	%Y-%m-%d
%H.%i.%s	%Y-%m-%d
%H.%i.%s	%Y-%m-%d
%H.%i.%s	%Y-%m-%d
%H.%i.%s	%Y-%m-%d
%H.%i.%s	%Y-%m-%d
%H.%i.%s	%Y-%m-%d
%H.%i.%s	%Y-%m-%d
%H.%i.%s	%Y-%m-%d
%H.%i.%s	%Y-%m-%d
%H.%i.%s	%Y-%m-%d
select distinct GET_FORMAT(TIME,'iso') from t1;
GET_FORMAT(TIME,'iso')
%H:%i:%s
select t1.* ,GET_FORMAT(TIME,'eur') from t1 group by GET_FORMAT(time,'USA');
id	f	GET_FORMAT(TIME,'eur')
1	%Y-%m-%d %H.%i.%s	%H.%i.%s
select * from t1 group by GET_FORMAT(time,'USA') having f> GET_FORMAT(DATE,'jis');
id	f
1	%Y-%m-%d %H.%i.%s
select * from t1 order by GET_FORMAT(time,'USA'),GET_FORMAT(time,'internal');
id	f
1	%Y-%m-%d %H.%i.%s
2	%Y-%m-%d %H:%i:%s
3	%Y%m%d%H%i%s
4	%Y-%m-%d %H:%i:%s
5	%Y-%m-%d %H.%i.%s
6	%d.%m.%Y
7	%Y-%m-%d
8	%Y%m%d
9	%Y-%m-%d
10	%m.%d.%Y
11	%H.%i.%s
12	%H:%i:%s
13	%H%i%s
14	%H:%i:%s
15	%h:%i:%s %p
16	%Y-%m-%d %H.%i.%s
17	%Y-%m-%d %H:%i:%s
18	%Y%m%d%H%i%s
19	%Y-%m-%d %H:%i:%s
20	%Y-%m-%d %H.%i.%s
select t1.* , case GET_FORMAT(DATE,'iso')   when GET_FORMAT(time,'jis')  then GET_FORMAT(datetime,'iso')  when GET_FORMAT(DATE,'iso')  then    GET_FORMAT(DATEtime,'USA')  end as a  from t1;
id	f	a
1	%Y-%m-%d %H.%i.%s	%Y-%m-%d %H.%i.%s
2	%Y-%m-%d %H:%i:%s	%Y-%m-%d %H.%i.%s
3	%Y%m%d%H%i%s	%Y-%m-%d %H.%i.%s
4	%Y-%m-%d %H:%i:%s	%Y-%m-%d %H.%i.%s
5	%Y-%m-%d %H.%i.%s	%Y-%m-%d %H.%i.%s
6	%d.%m.%Y	%Y-%m-%d %H.%i.%s
7	%Y-%m-%d	%Y-%m-%d %H.%i.%s
8	%Y%m%d	%Y-%m-%d %H.%i.%s
9	%Y-%m-%d	%Y-%m-%d %H.%i.%s
10	%m.%d.%Y	%Y-%m-%d %H.%i.%s
11	%H.%i.%s	%Y-%m-%d %H.%i.%s
12	%H:%i:%s	%Y-%m-%d %H.%i.%s
13	%H%i%s	%Y-%m-%d %H.%i.%s
14	%H:%i:%s	%Y-%m-%d %H.%i.%s
15	%h:%i:%s %p	%Y-%m-%d %H.%i.%s
16	%Y-%m-%d %H.%i.%s	%Y-%m-%d %H.%i.%s
17	%Y-%m-%d %H:%i:%s	%Y-%m-%d %H.%i.%s
18	%Y%m%d%H%i%s	%Y-%m-%d %H.%i.%s
19	%Y-%m-%d %H:%i:%s	%Y-%m-%d %H.%i.%s
20	%Y-%m-%d %H.%i.%s	%Y-%m-%d %H.%i.%s
select count(GET_FORMAT(DATE,'jis')) from t1;
count(GET_FORMAT(DATE,'jis'))
20
select sum(GET_FORMAT(DATETIME,'USA')) from t1;
sum(GET_FORMAT(DATETIME,'USA'))
0
Warnings:
Warning	1292	Truncated incorrect DOUBLE value: '%Y-%m-%d %H.%i.%s'
select avg(GET_FORMAT(TIME,'INTELNAL')) from t1;
avg(GET_FORMAT(TIME,'INTELNAL'))
NULL
seLect min(GET_FORMAT(TIME,'jis')) from t1;
min(GET_FORMAT(TIME,'jis'))
%H:%i:%s
select max(GET_FORMAT(DATETIME,'ISO')) from t1;
max(GET_FORMAT(DATETIME,'ISO'))
%Y-%m-%d %H:%i:%s
select GROUP_CONCAT(GET_FORMAT(DATE,'EUR')) from t1;
GROUP_CONCAT(GET_FORMAT(DATE,'EUR'))
%d.%m.%Y,%d.%m.%Y,%d.%m.%Y,%d.%m.%Y,%d.%m.%Y,%d.%m.%Y,%d.%m.%Y,%d.%m.%Y,%d.%m.%Y,%d.%m.%Y,%d.%m.%Y,%d.%m.%Y,%d.%m.%Y,%d.%m.%Y,%d.%m.%Y,%d.%m.%Y,%d.%m.%Y,%d.%m.%Y,%d.%m.%Y,%d.%m.%Y
seLect min(GET_FORMAT(TIMESTAMP,'USA')) from t1;
min(GET_FORMAT(TIMESTAMP,'USA'))
%Y-%m-%d %H.%i.%s
drop table t2;
drop table t1;
create table t1(id int,name varchar(20));
create table t2(id int,name varchar(20));
insert into t1 values(1,'test');
insert into t1 values(2,'test');
insert into t2 values(1,'test');
insert into t2 values(3,'test');
select GET_FORMAT(DATE,'EUR') from t1 union select GET_FORMAT(DATE,'EUR') from t2;
GET_FORMAT(DATE,'EUR')
%d.%m.%Y
select GET_FORMAT(DATETIME,'JIS') from t1 union all SELECT GET_FORMAT(DATETIME,'JIS') from t2;
GET_FORMAT(DATETIME,'JIS')
%Y-%m-%d %H:%i:%s
%Y-%m-%d %H:%i:%s
%Y-%m-%d %H:%i:%s
%Y-%m-%d %H:%i:%s
select GET_FORMAT(TIME,'INTERNAL')  from t1 intersect select GET_FORMAT(TIME,'INTERNAL')  from t2;
GET_FORMAT(TIME,'INTERNAL')
%H%i%s
select GET_FORMAT(DATE,'USA')  from t1 except select GET_FORMAT(DATE,'USA')  from t2;
GET_FORMAT(DATE,'USA')
select GET_FORMAT(DATETIME,'ISO') from t1 minus select GET_FORMAT(TIME,'ISO')from t2;
GET_FORMAT(DATETIME,'ISO')
%Y-%m-%d %H:%i:%s
drop table t2;
drop table t1;
obmysql-get_format-4-1-2 插入表
drop table t1;
create table t1(a bool);
insert into t1 values(GET_FORMAT(DATETIME,'ISO'));
ERROR HY000: Incorrect integer value for column 'a' at row 1
update t1 set a =GET_FORMAT(DATETIME,'ISO');
drop table t1;
create table t1(a BOOLEAN);
insert into t1 values(GET_FORMAT(DATETIME,'eus'));
update t1 set a =GET_FORMAT(DATETIME,'eus');
drop table t1;
create table t1(a TINYINT);
insert into t1 values(GET_FORMAT(DATETIME,'jis'));
ERROR HY000: Incorrect integer value for column 'a' at row 1
update t1 set a =GET_FORMAT(DATETIME,'jis');
drop table t1;
create table t1(a SMALLINT);
insert into t1 values(GET_FORMAT(DATETIME,'internal'));
ERROR HY000: Incorrect integer value for column 'a' at row 1
update t1 set a =GET_FORMAT(DATETIME,'internal');
drop table t1;
create table t1(a MEDIUMINT);
insert into t1 values(GET_FORMAT(DATETIME,'usa'));
ERROR HY000: Incorrect integer value for column 'a' at row 1
update t1 set a =GET_FORMAT(DATETIME,'usa');
drop table t1;
create table t1(a INT);
insert into t1 values(GET_FORMAT(DATE,'usa'));
ERROR HY000: Incorrect integer value for column 'a' at row 1
update t1 set a =GET_FORMAT(DATE,'usa');
drop table t1;
create table t1(a INTEGER);
insert into t1 values(GET_FORMAT(DATE,'jis'));
ERROR HY000: Incorrect integer value for column 'a' at row 1
insert into t1 values(1);
update t1 set a =GET_FORMAT(DATE,'jis');
ERROR HY000: Incorrect integer value for column 'a' at row 1
drop table t1;
create table t1(a BIGINT);
insert into t1 values(GET_FORMAT(DATE,'internal'));
ERROR HY000: Incorrect integer value for column 'a' at row 1
insert into t1 values(1);
update t1 set a =GET_FORMAT(DATE,'internal');
ERROR HY000: Incorrect integer value for column 'a' at row 1
drop table t1;
create table t1(a DECIMAL);
insert into t1 values(GET_FORMAT(DATE,'iso'));
ERROR HY000: Incorrect decimal value for column 'a' at row 1
insert into t1 values(1);
update t1 set a =GET_FORMAT(DATE,'iso');
ERROR HY000: Incorrect decimal value for column 'a' at row 1
drop table t1;
create table t1(a NUMERIC);
insert into t1 values(GET_FORMAT(DATE,'eur'));
ERROR HY000: Incorrect decimal value for column 'a' at row 1
insert into t1 values(1);
update t1 set a =GET_FORMAT(DATE,'eur');
ERROR HY000: Incorrect decimal value for column 'a' at row 1
drop table t1;
create table t1(a FLOAT);
insert into t1 values(GET_FORMAT(time,'eur'));
ERROR 01000: Data truncated for column 'a' at row 1
insert into t1 values(1);
update t1 set a =GET_FORMAT(time,'eur');
ERROR 01000: Data truncated for column 'a' at row 1
drop table t1;
create table t1(a DOUBLE);
insert into t1 values(GET_FORMAT(time,'jis'));
ERROR 01000: Data truncated for column 'a' at row 1
insert into t1 values(1);
update t1 set a =GET_FORMAT(time,'jis');
ERROR 01000: Data truncated for column 'a' at row 1
drop table t1;
create table t1(a BIT);
insert into t1 values(GET_FORMAT(time,'usa'));
ERROR 22001: Data too long for column 'a' at row 1
insert into t1 values(1);
update t1 set a =GET_FORMAT(time,'usa');
ERROR 22001: Data too long for column 'a' at row 1
drop table t1;
create table t1(a DATETIME);
insert into t1 values(GET_FORMAT(datetime,'usa'));
ERROR 22007: Incorrect datetime value for column 'a' at row 1
insert into t1 values('2020-09-13:00');
update t1 set a = (GET_FORMAT(datetime,'usa'));
ERROR 22007: Incorrect datetime value for column 'a' at row 1
insert into t1 values(DATE_FORMAT(utc_date(),GET_FORMAT(DATETIME,'jis')));
insert into t1 values(DATE_FORMAT(utc_date(),GET_FORMAT(DATETIME,'EUR')));
insert into t1 values(DATE_FORMAT(utc_date(),GET_FORMAT(DATETIME,'ISO')));
insert into t1 values(DATE_FORMAT(utc_date(),GET_FORMAT(DATETIME,'USA')));
insert into t1 values(DATE_FORMAT(utc_date(),GET_FORMAT(DATETIME,'INTERNAL')));
insert into t1 values(DATE_FORMAT(utc_date(),GET_FORMAT(TIMESTAMP,'jis')));
insert into t1 values(DATE_FORMAT(utc_date(),GET_FORMAT(TIMESTAMP,'EUR')));
insert into t1 values(DATE_FORMAT(utc_date(),GET_FORMAT(TIMESTAMP,'ISO')));
insert into t1 values(DATE_FORMAT(utc_date(),GET_FORMAT(TIMESTAMP,'USA')));
insert into t1 values(DATE_FORMAT(utc_date(),GET_FORMAT(TIMESTAMP,'INTERNAL')));
insert into t1 values(DATE_FORMAT('2020-10-20 10:20:30',GET_FORMAT(TIMESTAMP,'jis')));
insert into t1 values(DATE_FORMAT('2020-10-20 10:20:30.08',GET_FORMAT(TIMESTAMP,'EUR')));
insert into t1 values(DATE_FORMAT('2020-10-20 10:20:30',GET_FORMAT(TIMESTAMP,'ISO')));
insert into t1 values(DATE_FORMAT('2020-10-20 10:20:30',GET_FORMAT(TIMESTAMP,'USA')));
insert into t1 values(DATE_FORMAT('2020-10-20 10:20:30',GET_FORMAT(TIMESTAMP,'INTERNAL')));
update t1 set a=DATE_FORMAT(utc_date(),GET_FORMAT(TIMESTAMP,'jis'));
update t1 set a=DATE_FORMAT(utc_date(),GET_FORMAT(DATETIME,'jis'));
update t1 set a=DATE_FORMAT(utc_date(),GET_FORMAT(DATETIME,'EUR'));
update t1 set a=DATE_FORMAT(utc_date(),GET_FORMAT(DATETIME,'ISO'));
update t1 set a=DATE_FORMAT(utc_date(),GET_FORMAT(DATETIME,'USA'));
update t1 set a=DATE_FORMAT(utc_date(),GET_FORMAT(DATETIME,'INTERNAL'));
insert into t1 values(DATE_FORMAT('2021-06-28 17:52:30',GET_FORMAT(DATETIME,'jis')));
insert into t1 values(DATE_FORMAT('2021-05-20',GET_FORMAT(DATE,'EUR')));
insert into t1 values(DATE_FORMAT('18:17:23',GET_FORMAT(time,'EUR')));
ERROR 22007: Incorrect datetime value for column 'a' at row 1
insert into t1 values(DATE_FORMAT('17:52:30',GET_FORMAT(TIME,'USA')));
ERROR 22007: Incorrect datetime value for column 'a' at row 1
update t1 set a=DATE_FORMAT('12:20:21.222',GET_FORMAT(TIME,'EUR'));
ERROR 22007: Incorrect datetime value for column 'a' at row 1
update t1 set a=DATE_FORMAT('2021-06-29 17:14:17',GET_FORMAT(DATETIME,'ISO'));
update t1 set a=DATE_FORMAT('12:26:45',GET_FORMAT(TIME,'USA'));
ERROR 22007: Incorrect datetime value for column 'a' at row 1
update t1 set a=DATE_FORMAT('2021-06-30',GET_FORMAT(DATE,'INTERNAL'));
select * from t1;
a
2021-06-30 00:00:00
2021-06-30 00:00:00
2021-06-30 00:00:00
2021-06-30 00:00:00
2021-06-30 00:00:00
2021-06-30 00:00:00
2021-06-30 00:00:00
2021-06-30 00:00:00
2021-06-30 00:00:00
2021-06-30 00:00:00
2021-06-30 00:00:00
2021-06-30 00:00:00
2021-06-30 00:00:00
2021-06-30 00:00:00
2021-06-30 00:00:00
2021-06-30 00:00:00
2021-06-30 00:00:00
2021-06-30 00:00:00
insert into t1 values(DATE_FORMAT(utc_date(),GET_FORMAT(DATE,'jis')));
insert into t1 values(DATE_FORMAT(utc_date(),GET_FORMAT(DATE,'EUR')));
insert into t1 values(DATE_FORMAT(utc_date(),GET_FORMAT(DATE,'ISO')));
insert into t1 values(DATE_FORMAT(utc_date(),GET_FORMAT(DATE,'USA')));
ERROR 22007: Incorrect datetime value for column 'a' at row 1
insert into t1 values(DATE_FORMAT(utc_date(),GET_FORMAT(DATE,'INTERNAL')));
update t1 set a=DATE_FORMAT(utc_date(),GET_FORMAT(DATE,'jis'));
update t1 set a=DATE_FORMAT(utc_date(),GET_FORMAT(DATE,'EUR'));
update t1 set a=DATE_FORMAT(utc_date(),GET_FORMAT(DATE,'ISO'));
update t1 set a=DATE_FORMAT(utc_date(),GET_FORMAT(DATE,'USA'));
ERROR 22007: Incorrect datetime value for column 'a' at row 1
update t1 set a=DATE_FORMAT(utc_date(),GET_FORMAT(DATE,'INTERNAL'));
select * from t1;
a
2020-09-13 00:00:00
2020-09-13 00:00:00
2020-09-13 00:00:00
2020-09-13 00:00:00
2020-09-13 00:00:00
2020-09-13 00:00:00
2020-09-13 00:00:00
2020-09-13 00:00:00
2020-09-13 00:00:00
2020-09-13 00:00:00
2020-09-13 00:00:00
2020-09-13 00:00:00
2020-09-13 00:00:00
2020-09-13 00:00:00
2020-09-13 00:00:00
2020-09-13 00:00:00
2020-09-13 00:00:00
2020-09-13 00:00:00
2020-09-13 00:00:00
2020-09-13 00:00:00
2020-09-13 00:00:00
2020-09-13 00:00:00
insert into t1 values(DATE_FORMAT(utc_date(),GET_FORMAT(TIME,'jis')));
insert into t1 values(DATE_FORMAT(utc_date(),GET_FORMAT(TIME,'EUR')));
insert into t1 values(DATE_FORMAT(utc_date(),GET_FORMAT(TIME,'ISO')));
insert into t1 values(DATE_FORMAT(utc_date(),GET_FORMAT(TIME,'USA')));
ERROR 22007: Incorrect datetime value for column 'a' at row 1
insert into t1 values(DATE_FORMAT(utc_date(),GET_FORMAT(TIME,'INTERNAL')));
update t1 set a=DATE_FORMAT(utc_date(),GET_FORMAT(time,'jis'));
update t1 set a=DATE_FORMAT(utc_date(),GET_FORMAT(time,'EUR'));
update t1 set a=DATE_FORMAT(utc_date(),GET_FORMAT(time,'ISO'));
update t1 set a=DATE_FORMAT(utc_date(),GET_FORMAT(time,'USA'));
ERROR 22007: Incorrect datetime value for column 'a' at row 1
update t1 set a=DATE_FORMAT(utc_date(),GET_FORMAT(time,'INTERNAL'));
select * from t1;
a
0000-00-00 00:00:00
0000-00-00 00:00:00
0000-00-00 00:00:00
0000-00-00 00:00:00
0000-00-00 00:00:00
0000-00-00 00:00:00
0000-00-00 00:00:00
0000-00-00 00:00:00
0000-00-00 00:00:00
0000-00-00 00:00:00
0000-00-00 00:00:00
0000-00-00 00:00:00
0000-00-00 00:00:00
0000-00-00 00:00:00
0000-00-00 00:00:00
0000-00-00 00:00:00
0000-00-00 00:00:00
0000-00-00 00:00:00
0000-00-00 00:00:00
0000-00-00 00:00:00
0000-00-00 00:00:00
0000-00-00 00:00:00
0000-00-00 00:00:00
0000-00-00 00:00:00
0000-00-00 00:00:00
0000-00-00 00:00:00
insert into t1 values(DATE_FORMAT(utc_time(),GET_FORMAT(DATETIME,'jis')));
insert into t1 values(DATE_FORMAT(utc_time(6),GET_FORMAT(DATETIME,'EUR')));
insert into t1 values(DATE_FORMAT(utc_time(3),GET_FORMAT(DATETIME,'ISO')));
insert into t1 values(DATE_FORMAT(utc_time(1),GET_FORMAT(DATETIME,'USA')));
insert into t1 values(DATE_FORMAT(utc_time(),GET_FORMAT(DATETIME,'INTERNAL')));
update t1 set a=DATE_FORMAT(utc_time(5),GET_FORMAT(DATETIME,'jis'));
update t1 set a=DATE_FORMAT(utc_time(2),GET_FORMAT(DATETIME,'EUR'));
update t1 set a=DATE_FORMAT(utc_time(3),GET_FORMAT(DATETIME,'ISO'));
update t1 set a=DATE_FORMAT(utc_time(0),GET_FORMAT(DATETIME,'USA'));
update t1 set a=DATE_FORMAT(utc_time(),GET_FORMAT(DATETIME,'INTERNAL'));
select * from t1;
insert into t1 values(DATE_FORMAT(utc_time(3),GET_FORMAT(DATE,'jis')));
insert into t1 values(DATE_FORMAT(utc_time(),GET_FORMAT(DATE,'EUR')));
insert into t1 values(DATE_FORMAT(utc_time(4),GET_FORMAT(DATE,'ISO')));
insert into t1 values(DATE_FORMAT(utc_time(5),GET_FORMAT(DATE,'USA')));
ERROR 22007: Incorrect datetime value for column 'a' at row 1
insert into t1 values(DATE_FORMAT(utc_time(6),GET_FORMAT(DATE,'INTERNAL')));
update t1 set a=DATE_FORMAT(utc_time(5),GET_FORMAT(DATE,'jis'));
update t1 set a=DATE_FORMAT(utc_time(2),GET_FORMAT(DATE,'EUR'));
update t1 set a=DATE_FORMAT(utc_time(3),GET_FORMAT(DATE,'ISO'));
update t1 set a=DATE_FORMAT(utc_time(0),GET_FORMAT(DATE,'USA'));
ERROR 22007: Incorrect datetime value for column 'a' at row 1
update t1 set a=DATE_FORMAT(utc_time(),GET_FORMAT(DATE,'INTERNAL'));
select * from t1;
insert into t1 values(DATE_FORMAT(utc_time(1),GET_FORMAT(TIME,'jis')));
ERROR 22007: Incorrect datetime value for column 'a' at row 1
insert into t1 values(DATE_FORMAT(utc_time(2),GET_FORMAT(TIME,'EUR')));
ERROR 22007: Incorrect datetime value for column 'a' at row 1
insert into t1 values(DATE_FORMAT(utc_time(),GET_FORMAT(TIME,'ISO')));
ERROR 22007: Incorrect datetime value for column 'a' at row 1
insert into t1 values(DATE_FORMAT(utc_time(6),GET_FORMAT(TIME,'USA')));
ERROR 22007: Incorrect datetime value for column 'a' at row 1
insert into t1 values(DATE_FORMAT(utc_time(0),GET_FORMAT(TIME,'INTERNAL')));
ERROR 22007: Incorrect datetime value for column 'a' at row 1
update t1 set a=DATE_FORMAT(utc_time(5),GET_FORMAT(time,'jis'));
ERROR 22007: Incorrect datetime value for column 'a' at row 1
update t1 set a=DATE_FORMAT(utc_time(2),GET_FORMAT(time,'EUR'));
ERROR 22007: Incorrect datetime value for column 'a' at row 1
update t1 set a=DATE_FORMAT(utc_time(3),GET_FORMAT(time,'ISO'));
ERROR 22007: Incorrect datetime value for column 'a' at row 1
update t1 set a=DATE_FORMAT(utc_time(0),GET_FORMAT(time,'USA'));
ERROR 22007: Incorrect datetime value for column 'a' at row 1
update t1 set a=DATE_FORMAT(utc_time(),GET_FORMAT(time,'INTERNAL'));
ERROR 22007: Incorrect datetime value for column 'a' at row 1
select * from t1;
insert into t1 values(FROM_UNIXTIME(UNIX_TIMESTAMP(), GET_FORMAT(date,'INTERNAL')));
insert into t1 values(FROM_UNIXTIME(utc_date(), GET_FORMAT(date,'usa')));
ERROR 22007: Incorrect datetime value for column 'a' at row 1
insert into t1 values(FROM_UNIXTIME(utc_date(), GET_FORMAT(date,'eur')));
ERROR 22007: Incorrect datetime value for column 'a' at row 1
insert into t1 values(FROM_UNIXTIME(utc_date(), GET_FORMAT(date,'jis')));
insert into t1 values(FROM_UNIXTIME(utc_date(), GET_FORMAT(date,'iso')));
insert into t1 values(FROM_UNIXTIME(utc_date(), GET_FORMAT(date,'INTERNAL')));
insert into t1 values(FROM_UNIXTIME(160000000, GET_FORMAT(date,'INTERNAL')));
insert into t1 values(FROM_UNIXTIME(utc_time(), GET_FORMAT(date,'iso')));
insert into t1 values(FROM_UNIXTIME(utc_date(), GET_FORMAT(TIMeSTAMP,'eur')));
insert into t1 values(FROM_UNIXTIME(utc_date(), GET_FORMAT(TIMESTAMP,'jis')));
insert into t1 values(FROM_UNIXTIME(utc_date(), GET_FORMAT(TIMESTAMP,'iso')));
insert into t1 values(FROM_UNIXTIME(utc_date(), GET_FORMAT(TIMESTAMP,'INTERNAL')));
insert into t1 values(FROM_UNIXTIME(160000000, GET_FORMAT(TIMESTAMP,'INTERNAL')));
insert into t1 values(FROM_UNIXTIME(utc_time(), GET_FORMAT(TIMESTAMP,'iso')));
insert into t1 values(FROM_UNIXTIME(160000000, GET_FORMAT(date,'usa')));
ERROR 22007: Incorrect datetime value for column 'a' at row 1
insert into t1 values(FROM_UNIXTIME(UNIX_TIMESTAMP(), GET_FORMAT(datetime,'INTERNAL')));
insert into t1 values(FROM_UNIXTIME(utc_date(), GET_FORMAT(datetime,'usa')));
insert into t1 values(FROM_UNIXTIME(utc_date(), GET_FORMAT(datetime,'eur')));
insert into t1 values(FROM_UNIXTIME(utc_date(), GET_FORMAT(datetime,'jis')));
insert into t1 values(FROM_UNIXTIME(utc_date(), GET_FORMAT(datetime,'iso')));
insert into t1 values(FROM_UNIXTIME(utc_date(), GET_FORMAT(datetime,'INTERNAL')));
insert into t1 values(FROM_UNIXTIME(160000000, GET_FORMAT(datetime,'INTERNAL')));
insert into t1 values(FROM_UNIXTIME(utc_time(), GET_FORMAT(datetime,'iso')));
insert into t1 values(FROM_UNIXTIME(160000000, GET_FORMAT(datetime,'usa')));
insert into t1 values(FROM_UNIXTIME(UNIX_TIMESTAMP(), GET_FORMAT(time,'INTERNAL')));
ERROR 22007: Incorrect datetime value for column 'a' at row 1
insert into t1 values(FROM_UNIXTIME(utc_date(), GET_FORMAT(time,'usa')));
ERROR 22007: Incorrect datetime value for column 'a' at row 1
insert into t1 values(FROM_UNIXTIME(utc_time(5), GET_FORMAT(time,'eur')));
ERROR 22007: Incorrect datetime value for column 'a' at row 1
insert into t1 values(FROM_UNIXTIME(utc_date(), GET_FORMAT(time,'jis')));
ERROR 22007: Incorrect datetime value for column 'a' at row 1
insert into t1 values(FROM_UNIXTIME(utc_time(), GET_FORMAT(time,'iso')));
ERROR 22007: Incorrect datetime value for column 'a' at row 1
insert into t1 values(FROM_UNIXTIME(utc_date(), GET_FORMAT(time,'INTERNAL')));
ERROR 22007: Incorrect datetime value for column 'a' at row 1
insert into t1 values(FROM_UNIXTIME(160000000, GET_FORMAT(time,'INTERNAL')));
ERROR 22007: Incorrect datetime value for column 'a' at row 1
insert into t1 values(FROM_UNIXTIME(utc_time(), GET_FORMAT(time,'iso')));
ERROR 22007: Incorrect datetime value for column 'a' at row 1
insert into t1 values(FROM_UNIXTIME(160000000, GET_FORMAT(time,'usa')));
ERROR 22007: Incorrect datetime value for column 'a' at row 1
insert into t1 values(FROM_UNIXTIME(utc_time(), GET_FORMAT(time,'usa')));
ERROR 22007: Incorrect datetime value for column 'a' at row 1
insert into t1 values(FROM_UNIXTIME(utc_time(5), GET_FORMAT(time,'eur')));
ERROR 22007: Incorrect datetime value for column 'a' at row 1
insert into t1 values(FROM_UNIXTIME(utc_time(3), GET_FORMAT(time,'jis')));
ERROR 22007: Incorrect datetime value for column 'a' at row 1
insert into t1 values(FROM_UNIXTIME(utc_time(2), GET_FORMAT(time,'iso')));
ERROR 22007: Incorrect datetime value for column 'a' at row 1
insert into t1 values(FROM_UNIXTIME(utc_time(1), GET_FORMAT(time,'INTERNAL')));
ERROR 22007: Incorrect datetime value for column 'a' at row 1
insert into t1 values(FROM_UNIXTIME(160000000, GET_FORMAT(time,'INTERNAL')));
ERROR 22007: Incorrect datetime value for column 'a' at row 1
insert into t1 values(FROM_UNIXTIME(utc_time(6), GET_FORMAT(time,'iso')));
ERROR 22007: Incorrect datetime value for column 'a' at row 1
insert into t1 values(FROM_UNIXTIME(160000000, GET_FORMAT(time,'usa')));
ERROR 22007: Incorrect datetime value for column 'a' at row 1
insert into t1 values(FROM_UNIXTIME(utc_time(), GET_FORMAT(datetime,'usa')));
insert into t1 values(FROM_UNIXTIME(utc_time(5), GET_FORMAT(datetime,'eur')));
insert into t1 values(FROM_UNIXTIME(utc_time(3), GET_FORMAT(datetime,'jis')));
insert into t1 values(FROM_UNIXTIME(utc_time(2), GET_FORMAT(datetime,'iso')));
insert into t1 values(FROM_UNIXTIME(utc_time(1), GET_FORMAT(datetime,'INTERNAL')));
insert into t1 values(FROM_UNIXTIME(160000000, GET_FORMAT(datetime,'INTERNAL')));
insert into t1 values(FROM_UNIXTIME(utc_time(6), GET_FORMAT(datetime,'iso')));
insert into t1 values(FROM_UNIXTIME(160000000, GET_FORMAT(datetime,'usa')));
insert into t1 values(FROM_UNIXTIME(utc_time(), GET_FORMAT(date,'usa')));
ERROR 22007: Incorrect datetime value for column 'a' at row 1
insert into t1 values(FROM_UNIXTIME(utc_time(5), GET_FORMAT(date,'eur')));
ERROR 22007: Incorrect datetime value for column 'a' at row 1
insert into t1 values(FROM_UNIXTIME(utc_time(3), GET_FORMAT(date,'jis')));
insert into t1 values(FROM_UNIXTIME(utc_time(2), GET_FORMAT(date,'iso')));
insert into t1 values(FROM_UNIXTIME(utc_time(1), GET_FORMAT(date,'INTERNAL')));
insert into t1 values(FROM_UNIXTIME(160000000, GET_FORMAT(date,'INTERNAL')));
insert into t1 values(FROM_UNIXTIME(utc_time(6), GET_FORMAT(date,'iso')));
insert into t1 values(FROM_UNIXTIME(160000000, GET_FORMAT(date,'usa')));
ERROR 22007: Incorrect datetime value for column 'a' at row 1
update t1 set a =FROM_UNIXTIME(UNIX_TIMESTAMP(), GET_FORMAT(date,'INTERNAL'));
update t1 set a =FROM_UNIXTIME(utc_date(), GET_FORMAT(date,'INTERNAL'));
update t1 set a =FROM_UNIXTIME(utc_date(), GET_FORMAT(date,'eur'));
ERROR 22007: Incorrect datetime value for column 'a' at row 1
update t1 set a =FROM_UNIXTIME(utc_date(), GET_FORMAT(date,'jis'));
update t1 set a =FROM_UNIXTIME(utc_date(), GET_FORMAT(date,'iso'));
update t1 set a =FROM_UNIXTIME(utc_date(), GET_FORMAT(date,'usa'));
ERROR 22007: Incorrect datetime value for column 'a' at row 1
update t1 set a =FROM_UNIXTIME(19000000, GET_FORMAT(date,'usa'));
ERROR 22007: Incorrect datetime value for column 'a' at row 1
update t1 set a =FROM_UNIXTIME(18000000, GET_FORMAT(date,'iso'));
update t1 set a =FROM_UNIXTIME(18000000, GET_FORMAT(date,'INTERNAL'));
update t1 set a =FROM_UNIXTIME(18000000, GET_FORMAT(date,'eur'));
ERROR 22007: Incorrect datetime value for column 'a' at row 1
update t1 set a =FROM_UNIXTIME(18000000, GET_FORMAT(date,'jis'));
update t1 set a =FROM_UNIXTIME(utc_time(), GET_FORMAT(date,'usa'));
ERROR 22007: Incorrect datetime value for column 'a' at row 1
update t1 set a =FROM_UNIXTIME(utc_time(5), GET_FORMAT(date,'iso'));
update t1 set a =FROM_UNIXTIME(utc_time(4), GET_FORMAT(date,'INTERNAL'));
update t1 set a =FROM_UNIXTIME(utc_time(0), GET_FORMAT(date,'eur'));
ERROR 22007: Incorrect datetime value for column 'a' at row 1
update t1 set a =FROM_UNIXTIME(utc_time(6), GET_FORMAT(date,'jis'));
update t1 set a =FROM_UNIXTIME(utc_time(6)+100000, GET_FORMAT(date,'jis'));
update t1 set a =FROM_UNIXTIME(UNIX_TIMESTAMP(), GET_FORMAT(datetime,'INTERNAL'));
update t1 set a =FROM_UNIXTIME(utc_date(), GET_FORMAT(datetime,'INTERNAL'));
update t1 set a =FROM_UNIXTIME(utc_date(), GET_FORMAT(datetime,'eur'));
update t1 set a =FROM_UNIXTIME(utc_date(), GET_FORMAT(datetime,'jis'));
update t1 set a =FROM_UNIXTIME(utc_date(), GET_FORMAT(datetime,'iso'));
update t1 set a =FROM_UNIXTIME(utc_date(), GET_FORMAT(datetime,'usa'));
update t1 set a =FROM_UNIXTIME(19000000, GET_FORMAT(datetime,'usa'));
update t1 set a =FROM_UNIXTIME(18000000, GET_FORMAT(datetime,'iso'));
update t1 set a =FROM_UNIXTIME(18000000, GET_FORMAT(datetime,'INTERNAL'));
update t1 set a =FROM_UNIXTIME(18000000, GET_FORMAT(datetime,'eur'));
update t1 set a =FROM_UNIXTIME(18000000, GET_FORMAT(datetime,'jis'));
update t1 set a =FROM_UNIXTIME(utc_time(), GET_FORMAT(datetime,'usa'));
update t1 set a =FROM_UNIXTIME(utc_time(5), GET_FORMAT(datetime,'iso'));
update t1 set a =FROM_UNIXTIME(utc_time(4), GET_FORMAT(datetime,'INTERNAL'));
update t1 set a =FROM_UNIXTIME(utc_time(0), GET_FORMAT(datetime,'eur'));
update t1 set a =FROM_UNIXTIME(utc_time(6), GET_FORMAT(datetime,'jis'));
update t1 set a =FROM_UNIXTIME(utc_time(6)+100000, GET_FORMAT(datetime,'jis'));
update t1 set a =FROM_UNIXTIME(UNIX_TIMESTAMP(), GET_FORMAT(time,'INTERNAL'));
ERROR 22007: Incorrect datetime value for column 'a' at row 1
update t1 set a =FROM_UNIXTIME(utc_date(), GET_FORMAT(time,'INTERNAL'));
ERROR 22007: Incorrect datetime value for column 'a' at row 1
update t1 set a =FROM_UNIXTIME(utc_date(), GET_FORMAT(time,'eur'));
ERROR 22007: Incorrect datetime value for column 'a' at row 1
update t1 set a =FROM_UNIXTIME(utc_date(), GET_FORMAT(time,'jis'));
ERROR 22007: Incorrect datetime value for column 'a' at row 1
update t1 set a =FROM_UNIXTIME(utc_date(), GET_FORMAT(time,'iso'));
ERROR 22007: Incorrect datetime value for column 'a' at row 1
update t1 set a =FROM_UNIXTIME(utc_date(), GET_FORMAT(time,'usa'));
ERROR 22007: Incorrect datetime value for column 'a' at row 1
update t1 set a =FROM_UNIXTIME(19000000, GET_FORMAT(time,'usa'));
ERROR 22007: Incorrect datetime value for column 'a' at row 1
update t1 set a =FROM_UNIXTIME(18000000, GET_FORMAT(time,'iso'));
ERROR 22007: Incorrect datetime value for column 'a' at row 1
update t1 set a =FROM_UNIXTIME(18000000, GET_FORMAT(time,'INTERNAL'));
ERROR 22007: Incorrect datetime value for column 'a' at row 1
update t1 set a =FROM_UNIXTIME(18000000, GET_FORMAT(time,'eur'));
ERROR 22007: Incorrect datetime value for column 'a' at row 1
update t1 set a =FROM_UNIXTIME(18000000, GET_FORMAT(time,'jis'));
ERROR 22007: Incorrect datetime value for column 'a' at row 1
update t1 set a =FROM_UNIXTIME(utc_time(), GET_FORMAT(time,'usa'));
ERROR 22007: Incorrect datetime value for column 'a' at row 1
update t1 set a =FROM_UNIXTIME(utc_time(5), GET_FORMAT(time,'iso'));
ERROR 22007: Incorrect datetime value for column 'a' at row 1
update t1 set a =FROM_UNIXTIME(utc_time(4), GET_FORMAT(time,'INTERNAL'));
ERROR 22007: Incorrect datetime value for column 'a' at row 1
update t1 set a =FROM_UNIXTIME(utc_time(0), GET_FORMAT(time,'eur'));
ERROR 22007: Incorrect datetime value for column 'a' at row 1
update t1 set a =FROM_UNIXTIME(utc_time(6), GET_FORMAT(time,'jis'));
ERROR 22007: Incorrect datetime value for column 'a' at row 1
update t1 set a =FROM_UNIXTIME(utc_time(6)+100000, GET_FORMAT(time,'jis'));
ERROR 22007: Incorrect datetime value for column 'a' at row 1
update t1 set a =FROM_UNIXTIME('2020-10-10 12:12:12',GET_FORMAT(timestamp,'iso'));
ERROR 22007: Truncated incorrect DECIMAL value: '2020-10-10 12:12:12'
insert into t1 values(str_to_date(utc_date(),GET_FORMAT(date,'jis')));
insert into t1 values(str_to_date(utc_time(),GET_FORMAT(time,'eur')));
ERROR HY000: Incorrect datetime value: '12:26:40' for function str_to_date
insert into t1 values(str_to_date(utc_time(),GET_FORMAT(datetime,'iso')));
ERROR HY000: Incorrect datetime value: '12:26:40' for function str_to_date
insert into t1 values(str_to_date(utc_date(),GET_FORMAT(datetime,'jis')));
insert into t1 values(str_to_date(utc_date(),GET_FORMAT(time,'eur')));
ERROR HY000: Incorrect datetime value: '2020-09-13' for function str_to_date
insert into t1 values(str_to_date(utc_date(),GET_FORMAT(datetime,'eur')));
insert into t1 values(str_to_date(utc_date(),GET_FORMAT(timestamp,'eur')));
insert into t1 values(str_to_date(utc_time(),GET_FORMAT(timestamp,'iso')));
ERROR HY000: Incorrect datetime value: '12:26:40' for function str_to_date
insert into t1 values(str_to_date('2000-05-10 12:12:12',GET_FORMAT(timestamp,'iso')));
insert into t1 values(str_to_date('2000-05-10 12:12:12',GET_FORMAT(timestamp,'internal')));
ERROR HY000: Incorrect datetime value: '2000-05-10 12:12:12' for function str_to_date
insert into t1 values(str_to_date('2000-05-10 12:12:12',GET_FORMAT(timestamp,'jis')));
insert into t1 values(str_to_date('2000-05-10 12:12:12',GET_FORMAT(timestamp,'eur')));
ERROR HY000: Incorrect datetime value: '2000-05-10 12:12:12' for function str_to_date
update t1 set a=str_to_date(utc_date(),GET_FORMAT(date,'usa'));
ERROR HY000: Incorrect datetime value: '2020-09-13' for function str_to_date
update t1 set a=str_to_date(utc_date(),GET_FORMAT(date,'internal'));
ERROR HY000: Incorrect datetime value: '2020-09-13' for function str_to_date
update t1 set a=str_to_date(utc_date(),GET_FORMAT(date,'iso'));
update t1 set a=str_to_date(utc_date(),GET_FORMAT(date,'jis'));
update t1 set a=str_to_date(utc_time(),GET_FORMAT(time,'jis'));
update t1 set a=str_to_date(utc_date(),GET_FORMAT(datetime,'usa'));
update t1 set a =str_to_date(18000000, GET_FORMAT(time,'INTERNAL'));
update t1 set a =str_to_date('12:14:50', GET_FORMAT(time,'INTERNAL'));
update t1 set a =str_to_date('2000-12-12 12:14:50', GET_FORMAT(timestamp,'jis'));
update t1 set a =str_to_date('12:14:50', GET_FORMAT(datetime,'INTERNAL'));
ERROR HY000: Incorrect datetime value: '12:14:50' for function str_to_date
update t1 set a =str_to_date('2020-08-30', GET_FORMAT(date,'INTERNAL'));
ERROR HY000: Incorrect datetime value: '2020-08-30' for function str_to_date
update t1 set a =str_to_date('2020-08-30', GET_FORMAT(date,'jis'));
drop table t1;
create table t1(a TIMESTAMP);
insert into t1 values(utc_date(),GET_FORMAT(date,'INTERNAL'));
ERROR 21S01: Column count doesn't match value count at row 1
insert into t1 values('2021-10-29 12:12:12.555');
select * from t1;
a
2021-10-29 12:12:13
update t1 set a = GET_FORMAT(datetime,'INTERNAL');
ERROR 22007: Incorrect datetime value for column 'a' at row 1
insert into t1 values(DATE_FORMAT(utc_time(5),GET_FORMAT(time,'jis')));
ERROR 22007: Incorrect datetime value for column 'a' at row 1
insert into t1 values(DATE_FORMAT(utc_date(),GET_FORMAT(date,'jis')));
insert into t1 values(DATE_FORMAT(utc_date(),GET_FORMAT(date,'eur')));
insert into t1 values(DATE_FORMAT(utc_date(),GET_FORMAT(date,'iso')));
insert into t1 values(DATE_FORMAT(utc_date(),GET_FORMAT(date,'usa')));
ERROR 22007: Incorrect datetime value for column 'a' at row 1
insert into t1 values(DATE_FORMAT(utc_date(),GET_FORMAT(date,'internal')));
insert into t1 values(DATE_FORMAT(utc_date(),GET_FORMAT(datetime,'jis')));
insert into t1 values(DATE_FORMAT(utc_date(),GET_FORMAT(datetime,'eur')));
insert into t1 values(DATE_FORMAT(utc_date(),GET_FORMAT(datetime,'iso')));
insert into t1 values(DATE_FORMAT(utc_date(),GET_FORMAT(datetime,'usa')));
insert into t1 values(DATE_FORMAT(utc_date(),GET_FORMAT(datetime,'internal')));
insert into t1 values(DATE_FORMAT(utc_date(),GET_FORMAT(time,'jis')));
insert into t1 values(DATE_FORMAT(utc_date(),GET_FORMAT(time,'eur')));
insert into t1 values(DATE_FORMAT(utc_date(),GET_FORMAT(time,'iso')));
insert into t1 values(DATE_FORMAT(utc_date(),GET_FORMAT(time,'usa')));
ERROR 22007: Incorrect datetime value for column 'a' at row 1
insert into t1 values(DATE_FORMAT(utc_date(),GET_FORMAT(time,'internal')));
insert into t1 values(DATE_FORMAT(utc_time(),GET_FORMAT(date,'jis')));
insert into t1 values(DATE_FORMAT(utc_time(),GET_FORMAT(date,'eur')));
insert into t1 values(DATE_FORMAT(utc_time(),GET_FORMAT(date,'iso')));
insert into t1 values(DATE_FORMAT(utc_time(),GET_FORMAT(date,'usa')));
ERROR 22007: Incorrect datetime value for column 'a' at row 1
insert into t1 values(DATE_FORMAT(utc_time(),GET_FORMAT(date,'internal')));
insert into t1 values(DATE_FORMAT(utc_time(),GET_FORMAT(datetime,'jis')));
insert into t1 values(DATE_FORMAT(utc_time(),GET_FORMAT(datetime,'eur')));
insert into t1 values(DATE_FORMAT(utc_time(),GET_FORMAT(datetime,'iso')));
insert into t1 values(DATE_FORMAT(utc_time(),GET_FORMAT(datetime,'usa')));
insert into t1 values(DATE_FORMAT(utc_time(),GET_FORMAT(datetime,'internal')));
insert into t1 values(DATE_FORMAT(utc_time(),GET_FORMAT(timestamp,'jis')));
insert into t1 values(DATE_FORMAT(utc_time(),GET_FORMAT(timestamp,'eur')));
insert into t1 values(DATE_FORMAT(utc_time(),GET_FORMAT(timestamp,'iso')));
insert into t1 values(DATE_FORMAT(utc_time(),GET_FORMAT(timestamp,'usa')));
insert into t1 values(DATE_FORMAT(utc_time(),GET_FORMAT(timestamp,'internal')));
insert into t1 values(DATE_FORMAT(utc_date(),GET_FORMAT(timestamp,'jis')));
insert into t1 values(DATE_FORMAT(utc_date(),GET_FORMAT(timestamp,'eur')));
insert into t1 values(DATE_FORMAT(utc_date(),GET_FORMAT(timestamp,'iso')));
insert into t1 values(DATE_FORMAT(utc_date(),GET_FORMAT(timestamp,'usa')));
insert into t1 values(DATE_FORMAT(utc_date(),GET_FORMAT(timestamp,'internal')));
insert into t1 values(DATE_FORMAT(utc_time(),GET_FORMAT(time,'jis')));
ERROR 22007: Incorrect datetime value for column 'a' at row 1
insert into t1 values(DATE_FORMAT(utc_time(),GET_FORMAT(time,'eur')));
ERROR 22007: Incorrect datetime value for column 'a' at row 1
insert into t1 values(DATE_FORMAT(utc_time(),GET_FORMAT(time,'iso')));
ERROR 22007: Incorrect datetime value for column 'a' at row 1
insert into t1 values(DATE_FORMAT(utc_time(),GET_FORMAT(time,'usa')));
ERROR 22007: Incorrect datetime value for column 'a' at row 1
insert into t1 values(DATE_FORMAT(utc_time(),GET_FORMAT(time,'internal')));
ERROR 22007: Incorrect datetime value for column 'a' at row 1
insert into t1 values(DATE_FORMAT('2020-11-11 12:13:55',GET_FORMAT(datetime,'internal')));
insert into t1 values(DATE_FORMAT('2020-11-11 12:13:55',GET_FORMAT(date,'jis')));
insert into t1 values(DATE_FORMAT('2020-11-11 12:13:55',GET_FORMAT(time,'eur')));
ERROR 22007: Incorrect datetime value for column 'a' at row 1
update t1 set a=DATE_FORMAT(utc_time(5),GET_FORMAT(DATETIME,'jis'));
update t1 set a=DATE_FORMAT(utc_time(2),GET_FORMAT(DATETIME,'EUR'));
update t1 set a=DATE_FORMAT(utc_time(3),GET_FORMAT(DATETIME,'ISO'));
update t1 set a=DATE_FORMAT(utc_time(0),GET_FORMAT(DATETIME,'USA'));
update t1 set a=DATE_FORMAT(utc_time(),GET_FORMAT(DATETIME,'INTERNAL'));
update t1 set a=DATE_FORMAT(utc_date(),GET_FORMAT(DATE,'jis'));
update t1 set a=DATE_FORMAT(utc_date(),GET_FORMAT(DATE,'EUR'));
update t1 set a=DATE_FORMAT(utc_date(),GET_FORMAT(DATE,'ISO'));
update t1 set a=DATE_FORMAT(utc_time(0),GET_FORMAT(TIME,'USA'));
ERROR 22007: Incorrect datetime value for column 'a' at row 1
update t1 set a=DATE_FORMAT(utc_time(),GET_FORMAT(TIME,'INTERNAL'));
ERROR 22007: Incorrect datetime value for column 'a' at row 1
update t1 set a=DATE_FORMAT('2020-11-11 12:13:55',GET_FORMAT(TIMESTAMP,'INTERNAL'));
insert into t1 values(FROM_UNIXTIME(utc_time(), GET_FORMAT(time,'usa')));
ERROR 22007: Incorrect datetime value for column 'a' at row 1
insert into t1 values(FROM_UNIXTIME(utc_date(), GET_FORMAT(date,'eur')));
ERROR 22007: Incorrect datetime value for column 'a' at row 1
insert into t1 values(FROM_UNIXTIME(utc_time(3), GET_FORMAT(datetime,'jis')));
insert into t1 values(FROM_UNIXTIME(utc_date(), GET_FORMAT(datetime,'iso')));
insert into t1 values(FROM_UNIXTIME(utc_time(1), GET_FORMAT(datetime,'INTERNAL')));
insert into t1 values(FROM_UNIXTIME(160000000, GET_FORMAT(datetime,'INTERNAL')));
insert into t1 values(FROM_UNIXTIME(utc_time(6), GET_FORMAT(date,'iso')));
insert into t1 values(FROM_UNIXTIME(160000000, GET_FORMAT(date,'usa')));
ERROR 22007: Incorrect datetime value for column 'a' at row 1
update t1 set a =FROM_UNIXTIME(18000000, GET_FORMAT(datetime,'jis'));
update t1 set a =FROM_UNIXTIME(utc_time(), GET_FORMAT(datetime,'usa'));
update t1 set a =FROM_UNIXTIME(utc_time(5), GET_FORMAT(time,'iso'));
ERROR 22007: Incorrect datetime value for column 'a' at row 1
update t1 set a =FROM_UNIXTIME(utc_date(), GET_FORMAT(datetime,'INTERNAL'));
update t1 set a =FROM_UNIXTIME(utc_date(), GET_FORMAT(date,'eur'));
ERROR 22007: Incorrect datetime value for column 'a' at row 1
update t1 set a =FROM_UNIXTIME(utc_date(), GET_FORMAT(datetime,'jis'));
update t1 set a =FROM_UNIXTIME(utc_time(6)+100000, GET_FORMAT(datetime,'jis'));
insert into t1 values(str_to_date(utc_date(),GET_FORMAT(date,'eur')));
ERROR HY000: Incorrect datetime value: '2020-09-13' for function str_to_date
insert into t1 values(str_to_date(utc_date(),GET_FORMAT(datetime,'iso')));
insert into t1 values(str_to_date(utc_time(),GET_FORMAT(datetime,'jis')));
ERROR HY000: Incorrect datetime value: '12:26:40' for function str_to_date
insert into t1 values(str_to_date(utc_time(),GET_FORMAT(time,'eur')));
ERROR HY000: Incorrect datetime value: '12:26:40' for function str_to_date
insert into t1 values(str_to_date('2021-01-01 06:25:35',GET_FORMAT(datetime,'eur')));
ERROR HY000: Incorrect datetime value: '2021-01-01 06:25:35' for function str_to_date
insert into t1 values(str_to_date('2021-01-01 06:25:35',GET_FORMAT(timestamp,'jis')));
insert into t1 values(str_to_date('2021-01-01 06:25:35',GET_FORMAT(timestamp,'eur')));
ERROR HY000: Incorrect datetime value: '2021-01-01 06:25:35' for function str_to_date
insert into t1 values(str_to_date('2021-01-01 06:25:35',GET_FORMAT(timestamp,'internal')));
ERROR HY000: Incorrect datetime value: '2021-01-01 06:25:35' for function str_to_date
insert into t1 values(str_to_date('2021-01-01 06:25:35',GET_FORMAT(timestamp,'iso')));
insert into t1 values(str_to_date('2021-01-01 06:25:35',GET_FORMAT(timestamp,'usa')));
ERROR HY000: Incorrect datetime value: '2021-01-01 06:25:35' for function str_to_date
update t1 set a =str_to_date(utc_time(5), GET_FORMAT(time,'iso'));
ERROR 22007: Incorrect datetime value for column 'a' at row 1
update t1 set a =str_to_date(utc_date(), GET_FORMAT(datetime,'INTERNAL'));
ERROR HY000: Incorrect datetime value: '2020-09-13' for function str_to_date
update t1 set a =str_to_date(utc_date(), GET_FORMAT(date,'eur'));
ERROR HY000: Incorrect datetime value: '2020-09-13' for function str_to_date
update t1 set a =str_to_date(utc_date(), GET_FORMAT(datetime,'jis'));
update t1 set a =str_to_date(utc_time(6)+100000, GET_FORMAT(datetime,'jis'));
ERROR HY000: Incorrect datetime value: '222640.000000' for function str_to_date
drop table t1;
create table t1(a DATE);
insert into t1 values(GET_FORMAT(date,'jis'));
ERROR 22007: Incorrect datetime value for column 'a' at row 1
insert into t1 values(20200912);
update t1 set a = GET_FORMAT(date,'jis');
ERROR 22007: Incorrect datetime value for column 'a' at row 1
insert into t1 values(DATE_FORMAT(utc_date(),GET_FORMAT(date,'jis')));
insert into t1 values(DATE_FORMAT(utc_date(),GET_FORMAT(datetime,'eur')));
insert into t1 values(DATE_FORMAT(utc_date(),GET_FORMAT(time,'ios')));
insert into t1 values(DATE_FORMAT(utc_date(),GET_FORMAT(timestamp,'internal')));
insert into t1 values(DATE_FORMAT(utc_time(6),GET_FORMAT(time,'internal')));
ERROR 22007: Incorrect datetime value for column 'a' at row 1
insert into t1 values(DATE_FORMAT(utc_time(6),GET_FORMAT(datetime,'usa')));
insert into t1 values(DATE_FORMAT('2020-06-06',GET_FORMAT(date,'usa')));
update t1 set a=DATE_FORMAT(utc_date(),GET_FORMAT(date,'jis'));
update t1 set a=DATE_FORMAT(utc_date(),GET_FORMAT(datetime,'usa'));
update t1 set a=DATE_FORMAT(utc_time(),GET_FORMAT(datetime,'iso'));
update t1 set a=DATE_FORMAT(utc_time(),GET_FORMAT(timestamp,'eur'));
update t1 set a=DATE_FORMAT(utc_time(),GET_FORMAT(time,'internal'));
ERROR 22007: Incorrect datetime value for column 'a' at row 1
update t1 set a=DATE_FORMAT('2020-12-12 14:12:12',GET_FORMAT(date,'internal'));
insert into t1 values(FROM_UNIXTIME(utc_date(),GET_FORMAT(date,'jis')));
insert into t1 values(FROM_UNIXTIME(utc_date(),GET_FORMAT(datetime,'eur')));
insert into t1 values(FROM_UNIXTIME(utc_date(),GET_FORMAT(time,'ios')));
insert into t1 values(FROM_UNIXTIME(utc_date(),GET_FORMAT(timestamp,'usa')));
insert into t1 values(FROM_UNIXTIME(utc_time(6),GET_FORMAT(time,'internal')));
ERROR 22007: Incorrect datetime value for column 'a' at row 1
insert into t1 values(FROM_UNIXTIME(utc_time(6),GET_FORMAT(datetime,'usa')));
insert into t1 values(FROM_UNIXTIME(utc_time(6),GET_FORMAT(timestamp,'jis')));
insert into t1 values(FROM_UNIXTIME('2020-06-06',GET_FORMAT(date,'usa')));
ERROR 22007: Truncated incorrect DECIMAL value: '2020-06-06'
update t1 set a=FROM_UNIXTIME(utc_date(),GET_FORMAT(date,'jis'));
update t1 set a=FROM_UNIXTIME(utc_date(),GET_FORMAT(datetime,'usa'));
update t1 set a=FROM_UNIXTIME(utc_time(),GET_FORMAT(datetime,'iso'));
update t1 set a=FROM_UNIXTIME(utc_time(),GET_FORMAT(time,'internal'));
ERROR 22007: Incorrect datetime value for column 'a' at row 1
update t1 set a=FROM_UNIXTIME('2020-12-12 14:12:12',GET_FORMAT(date,'internal'));
ERROR 22007: Truncated incorrect DECIMAL value: '2020-12-12 14:12:12'
insert into t1 values(str_to_date(utc_date(),GET_FORMAT(date,'jis')));
insert into t1 values(str_to_date(utc_date(),GET_FORMAT(datetime,'eur')));
insert into t1 values(str_to_date(utc_date(),GET_FORMAT(time,'ios')));
insert into t1 values(str_to_date(utc_time(6),GET_FORMAT(time,'internal')));
insert into t1 values(str_to_date(utc_date(),GET_FORMAT(timestamp,'usa')));
insert into t1 values(str_to_date(utc_time(6),GET_FORMAT(datetime,'usa')));
ERROR HY000: Incorrect datetime value: '12:26:40.000000' for function str_to_date
insert into t1 values(str_to_date('2020-06-06',GET_FORMAT(date,'usa')));
ERROR HY000: Incorrect datetime value: '2020-06-06' for function str_to_date
update t1 set a=str_to_date(utc_date(),GET_FORMAT(date,'jis'));
update t1 set a=str_to_date(utc_date(),GET_FORMAT(datetime,'usa'));
update t1 set a=str_to_date(utc_time(),GET_FORMAT(datetime,'iso'));
ERROR HY000: Incorrect datetime value: '12:26:40' for function str_to_date
update t1 set a=str_to_date(utc_time(),GET_FORMAT(time,'internal'));
update t1 set a=str_to_date('2020-12-12 14:12:12',GET_FORMAT(date,'internal'));
ERROR HY000: Incorrect datetime value: '2020-12-12 14:12:12' for function str_to_date
update t1 set a=str_to_date('2020-12-12',GET_FORMAT(timestamp,'usa'));
drop table t1;
create table t1(a TIME);
insert into t1 values(GET_FORMAT(time,'jis'));
ERROR 22007: Incorrect value
insert into t1 values('14:12:30');
update t1 set a = GET_FORMAT(time,'eur');
ERROR 22007: Incorrect value
insert into t1 values(DATE_FORMAT(utc_date(),GET_FORMAT(date,'jis')));
insert into t1 values(DATE_FORMAT(utc_date(),GET_FORMAT(datetime,'eur')));
insert into t1 values(DATE_FORMAT(utc_time(),GET_FORMAT(time,'ios')));
insert into t1 values(DATE_FORMAT(utc_time(6),GET_FORMAT(time,'internal')));
insert into t1 values(DATE_FORMAT(utc_time(3),GET_FORMAT(datetime,'usa')));
insert into t1 values(DATE_FORMAT(utc_time(3),GET_FORMAT(timestamp,'usa')));
insert into t1 values(DATE_FORMAT('14:15:15',GET_FORMAT(time,'usa')));
ERROR 22007: Incorrect datetime value for column 'a' at row 1
update t1 set a=DATE_FORMAT(utc_date(),GET_FORMAT(date,'jis'));
update t1 set a=DATE_FORMAT(utc_date(),GET_FORMAT(datetime,'usa'));
update t1 set a=DATE_FORMAT(utc_time(),GET_FORMAT(datetime,'iso'));
update t1 set a=DATE_FORMAT(utc_time(),GET_FORMAT(time,'internal'));
update t1 set a=DATE_FORMAT('2020-12-12 14:12:12',GET_FORMAT(time,'internal'));
update t1 set a=DATE_FORMAT('2020-12-12 14:12:12',GET_FORMAT(timestamp,'internal'));
insert into t1 values(FROM_UNIXTIME(utc_date(),GET_FORMAT(date,'jis')));
ERROR 22007: Incorrect datetime value for column 'a' at row 1
insert into t1 values(FROM_UNIXTIME(utc_date(),GET_FORMAT(datetime,'eur')));
insert into t1 values(FROM_UNIXTIME(utc_time(),GET_FORMAT(time,'ios')));
insert into t1 values(FROM_UNIXTIME(utc_time(6),GET_FORMAT(time,'internal')));
insert into t1 values(FROM_UNIXTIME(utc_time(6),GET_FORMAT(datetime,'usa')));
insert into t1 values(FROM_UNIXTIME(utc_time(5),GET_FORMAT(timestamp,'internal')));
insert into t1 values(FROM_UNIXTIME('16:16:20',GET_FORMAT(time,'usa')));
ERROR 22007: Truncated incorrect DECIMAL value: '16:16:20'
update t1 set a=FROM_UNIXTIME(utc_date(),GET_FORMAT(date,'jis'));
ERROR 22007: Incorrect datetime value for column 'a' at row 1
update t1 set a=FROM_UNIXTIME(utc_date(),GET_FORMAT(datetime,'usa'));
update t1 set a=FROM_UNIXTIME(utc_time(),GET_FORMAT(datetime,'iso'));
update t1 set a=FROM_UNIXTIME(utc_time(),GET_FORMAT(time,'internal'));
update t1 set a=FROM_UNIXTIME(utc_date(),GET_FORMAT(timestamp,'eur'));
update t1 set a=FROM_UNIXTIME('2020-12-12 14:12:12',GET_FORMAT(time,'internal'));
ERROR 22007: Truncated incorrect DECIMAL value: '2020-12-12 14:12:12'
insert into t1 values(str_to_date(utc_date(),GET_FORMAT(date,'jis')));
insert into t1 values(str_to_date(utc_date(),GET_FORMAT(datetime,'eur')));
insert into t1 values(str_to_date(utc_date(),GET_FORMAT(time,'ios')));
insert into t1 values(str_to_date(utc_time(6),GET_FORMAT(time,'internal')));
insert into t1 values(str_to_date('2000-10-10 12:12:12',GET_FORMAT(timestamp,'internal')));
ERROR HY000: Incorrect datetime value: '2000-10-10 12:12:12' for function str_to_date
insert into t1 values(str_to_date('2000-10-10 12:12:12',GET_FORMAT(timestamp,'iso')));
insert into t1 values(str_to_date(utc_time(6),GET_FORMAT(datetime,'usa')));
ERROR HY000: Incorrect datetime value: '12:26:40.000000' for function str_to_date
insert into t1 values(str_to_date('2020-06-06',GET_FORMAT(date,'usa')));
ERROR HY000: Incorrect datetime value: '2020-06-06' for function str_to_date
update t1 set a=str_to_date(utc_date(),GET_FORMAT(date,'jis'));
update t1 set a=str_to_date(utc_date(),GET_FORMAT(datetime,'usa'));
update t1 set a=str_to_date(utc_time(),GET_FORMAT(datetime,'iso'));
ERROR HY000: Incorrect datetime value: '12:26:40' for function str_to_date
update t1 set a=str_to_date(utc_time(),GET_FORMAT(time,'internal'));
update t1 set a=str_to_date('2020-12-12 14:12:12',GET_FORMAT(date,'internal'));
ERROR HY000: Incorrect datetime value: '2020-12-12 14:12:12' for function str_to_date
update t1 set a=str_to_date('2020-12-12 14:12:12',GET_FORMAT(timestamp,'eur'));
ERROR HY000: Incorrect datetime value: '2020-12-12 14:12:12' for function str_to_date
update t1 set a=str_to_date('2020-12-12 14:12:12',GET_FORMAT(timestamp,'jis'));
drop table t1;
create table t1(a YEAR);
insert into t1 values(GET_FORMAT(date,'jis'));
ERROR HY000: Incorrect integer value for column 'a' at row 1
insert into t1 values(GET_FORMAT(time,'eur'));
ERROR HY000: Incorrect integer value for column 'a' at row 1
insert into t1 values(GET_FORMAT(datetime,'iso'));
ERROR HY000: Incorrect integer value for column 'a' at row 1
insert into t1 values(GET_FORMAT(timestamp,'usa'));
ERROR HY000: Incorrect integer value for column 'a' at row 1
select * from t1;
a
update t1 set a = GET_FORMAT(date,'jis');
update t1 set a = GET_FORMAT(time,'eur');
update t1 set a = GET_FORMAT(datetime,'iso');
insert into t1 values(DATE_FORMAT(utc_date(),GET_FORMAT(date,'jis')));
ERROR 01000: Data truncated for column 'a' at row 1
insert into t1 values(FROM_UNIXTIME(utc_time(3),GET_FORMAT(datetime,'usa')));
ERROR 01000: Data truncated for column 'a' at row 1
insert into t1 values(FROM_UNIXTIME('14:55:20',GET_FORMAT(time,'usa')));
ERROR 22007: Truncated incorrect DECIMAL value: '14:55:20'
insert into t1 values(str_to_date(utc_time(),GET_FORMAT(time,'usa')));
insert into t1 values(str_to_date(utc_date(),GET_FORMAT(date,'iso')));
insert into t1 values(str_to_date(utc_date(),GET_FORMAT(datetime,'jis')));
insert into t1 values(str_to_date(utc_date(),GET_FORMAT(timestamp,'usa')));
select * from t1;
a
0000
2020
2020
2020
update t1 set a=FROM_UNIXTIME(utc_date(),GET_FORMAT(date,'usa'));
ERROR 22003: Out of range value for column 'a' at row 1
update t1 set a=str_to_date(utc_date(),GET_FORMAT(date,'internal'));
ERROR HY000: Incorrect datetime value: '2020-09-13' for function str_to_date
update t1 set a=str_to_date(utc_date(),GET_FORMAT(date,'iso'));
update t1 set a=str_to_date(utc_date(),GET_FORMAT(timestamp,'iso'));
drop table t1;
create table t1(a VARCHAR(50));
insert into t1 values(GET_FORMAT(time,'eur'));
update t1 set a =GET_FORMAT(time,'eur');
update t1 set a =GET_FORMAT(timestamp,'eur');
select * from t1;
a
%Y-%m-%d %H.%i.%s
drop table t1;
create table t1(a VARBINARY(50));
insert into t1 values(GET_FORMAT(date,'iso'));
update t1 set a =GET_FORMAT(date,'iso');
select * from t1;
a
%Y-%m-%d
drop table t1;
create table t1(a CHAR);
insert into t1 values(GET_FORMAT(date,'USA'));
ERROR 22001: Data too long for column 'a' at row 1
insert into t1 values('a');
update t1 set a =GET_FORMAT(date,'internal');
ERROR 22001: Data too long for column 'a' at row 1
select * from t1;
a
a
drop table t1;
create table t1(a BINARY);
insert into t1 values(GET_FORMAT(datetime,'eur'));
ERROR 22001: Data too long for column 'a' at row 1
insert into t1 values('a');
update t1 set a =GET_FORMAT(datetime,'eur');
ERROR 22001: Data too long for column 'a' at row 1
select * from t1;
a
a
drop table t1;
create table t1(a enum ('c','d'));
insert into t1 values(GET_FORMAT(datetime,'eur'));
ERROR 01000: Data truncated for column 'a' at row 1
insert into t1 values('c');
update t1 set a =GET_FORMAT(datetime,'eur');
ERROR 01000: Data truncated for column 'a' at row 1
select * from t1;
a
c
drop table t1;
create table t1(a set ('c','d'));
insert into t1 values(GET_FORMAT(datetime,'eur'));
ERROR 01000: Data truncated for column 'a' at row 1
insert into t1 values('c');
update t1 set a =GET_FORMAT(datetime,'eur');
ERROR 01000: Data truncated for column 'a' at row 1
select * from t1;
a
c
drop table t1;
create table t1(a TINYTEXT);
insert into t1 values(GET_FORMAT(datetime,'eur'));
update t1 set a =GET_FORMAT(datetime,'eur');
select * from t1;
a
%Y-%m-%d %H.%i.%s
drop table t1;
create table t1(a TINYBLOB);
insert into t1 values(GET_FORMAT(date,'eur'));
update t1 set a =GET_FORMAT(time,'eur');
select * from t1;
a
%H.%i.%s
drop table t1;
create table t1(a TEXT);
insert into t1 values(GET_FORMAT(time,'usa'));
update t1 set a =GET_FORMAT(datetime,'eur');
select * from t1;
a
%Y-%m-%d %H.%i.%s
drop table t1;
create table t1(a BLOB);
insert into t1 values(GET_FORMAT(time,'internal'));
update t1 set a =GET_FORMAT(date,'jis');
select * from t1;
a
%Y-%m-%d
drop table t1;
create table t1(a MEDIUMTEXT);
insert into t1 values(GET_FORMAT(datetime,'usa'));
update t1 set a =GET_FORMAT(time,'eur');
select * from t1;
a
%H.%i.%s
drop table t1;
create table t1(a MEDIUMBLOB);
insert into t1 values(GET_FORMAT(date,'iso'));
update t1 set a =GET_FORMAT(datetime,'iso');
select * from t1;
a
%Y-%m-%d %H:%i:%s
drop table t1;
create table t1(a LONGTEXT);
insert into t1 values(GET_FORMAT(datetime,'internal'));
update t1 set a =GET_FORMAT(date,'eur');
select * from t1;
a
%d.%m.%Y
drop table t1;
create table t1(a LONGBLOB);
insert into t1 values(GET_FORMAT(datetime,'eur'));
update t1 set a =GET_FORMAT(time,'usa');
select * from t1;
a
%h:%i:%s %p
drop table t1;
create table t1(id int, name varchar(30),d date,t time, dt datetime);
insert into t1 values(1,'test01',DATE_FORMAT(utc_date(),GET_FORMAT(DATE,'jis')),DATE_FORMAT(utc_time(),GET_FORMAT(time,'ISO')),DATE_FORMAT('2020-11-10 12:14:32',GET_FORMAT(DATETIME,'EUR')));
#ob报5114，mysql正常执行
insert into t1 values(2,'test02',FROM_UNIXTIME(utc_date(),GET_FORMAT(DATE,'JIS')),FROM_UNIXTIME(utc_time(),GET_FORMAT(time,'INTERNAL')),FROM_UNIXTIME('2020-11-10 12:14:32',GET_FORMAT(DATETIME,'EUR')));
ERROR 22007: Truncated incorrect DECIMAL value: '2020-11-10 12:14:32'
insert into t1 values(3,'test03',STR_TO_DATE(utc_date(),GET_FORMAT(DATE,'JIS')),STR_TO_DATE(utc_time(),GET_FORMAT(time,'INTERNAL')),STR_TO_DATE('2020-11-10 12:14:32',GET_FORMAT(DATETIME,'EUR')));
ERROR HY000: Incorrect datetime value: '2020-11-10 12:14:32' for function str_to_date
insert into t1 values(4,GET_FORMAT(datetime,'eur'),null,null,null);
insert into t1(id,name) values(5,GET_FORMAT(datetime,'jis')),(6,GET_FORMAT(datetime,'usa')),(7,GET_FORMAT(datetime,'iso')),(8,GET_FORMAT(datetime,'jis')),(9,GET_FORMAT(datetime,'internal'));
insert into t1(id,name) values(10,GET_FORMAT(date,'jis')),(11,GET_FORMAT(date,'usa')),(12,GET_FORMAT(date,'iso')),(13,GET_FORMAT(date,'jis')),(14,GET_FORMAT(date,'internal'));
insert into t1(id,name) values(13,GET_FORMAT(time,'jis')),(12,GET_FORMAT(time,'usa')),(13,GET_FORMAT(time,'iso')),(18,GET_FORMAT(time,'jis')),(9,GET_FORMAT(time,'internal'));
select * from t1;
id	name	d	t	dt
1	test01	2020-09-13	12:26:40	2020-11-10 12:14:32
4	%Y-%m-%d %H.%i.%s	NULL	NULL	NULL
5	%Y-%m-%d %H:%i:%s	NULL	NULL	NULL
6	%Y-%m-%d %H.%i.%s	NULL	NULL	NULL
7	%Y-%m-%d %H:%i:%s	NULL	NULL	NULL
8	%Y-%m-%d %H:%i:%s	NULL	NULL	NULL
9	%Y%m%d%H%i%s	NULL	NULL	NULL
10	%Y-%m-%d	NULL	NULL	NULL
11	%m.%d.%Y	NULL	NULL	NULL
12	%Y-%m-%d	NULL	NULL	NULL
13	%Y-%m-%d	NULL	NULL	NULL
14	%Y%m%d	NULL	NULL	NULL
13	%H:%i:%s	NULL	NULL	NULL
12	%h:%i:%s %p	NULL	NULL	NULL
13	%H:%i:%s	NULL	NULL	NULL
18	%H:%i:%s	NULL	NULL	NULL
9	%H%i%s	NULL	NULL	NULL
drop table t2;
create table t2 (v_id varchar(20) ,name varchar(20));
insert into t2 select GET_FORMAT(datetime,'iso'),GET_FORMAT(date,'eur');
drop table t2;
insert into t1 values(2,'test02',FROM_UNIXTIME(utc_date(),GET_FORMAT(DATE,'JIS')),null,null);
insert into t1 values(2,'test02',FROM_UNIXTIME(utc_date(),GET_FORMAT(DATE,'JIS')),FROM_UNIXTIME(utc_time(),GET_FORMAT(time,'internal')),null);
insert into t1 values(2,'test02',FROM_UNIXTIME(utc_date(),GET_FORMAT(DATE,'JIS')),FROM_UNIXTIME(utc_time(),GET_FORMAT(time,'internal')),FROM_UNIXTIME(utc_time(),GET_FORMAT(datetime,'internal')));
insert into t1 values(3,'test03',STR_TO_DATE(utc_date(),GET_FORMAT(DATE,'JIS')),null,STR_TO_DATE('10:12:30',GET_FORMAT(time,'INTERNAL')));
insert into t1(name) values(get_format(time,'eur')||get_format(date,'jis'));
Warnings:
Warning	1292	Truncated incorrect DOUBLE value: '%H.%i.%s'
Warning	1292	Truncated incorrect DOUBLE value: '%Y-%m-%d'
insert into t1(name) values(get_format(time,'eur')<>get_format(date,'jis'));
insert into t1(name) values(-get_format(TIME,'eur'));
Warnings:
Warning	1292	Truncated incorrect DOUBLE value: '%H.%i.%s'
insert into t1(name) values(+get_format(TIME,'eur'));
insert into t1(name) values(get_format(TIME,'eur')=get_format(TIME,'iso'));
insert into t1(name) values(get_format(TIME,'usa') is not null);
insert into t1(name) values(get_format(date,'eur')^get_format(dateTIME,'iso'));
Warnings:
Warning	1292	Truncated incorrect INTEGER value: '%d.%m.%Y'
Warning	1292	Truncated incorrect INTEGER value: '%Y-%m-%d %H:%i:%s'
insert into t1(name) values(get_format(date,'eur')&get_format(dateTIME,'iso'));
Warnings:
Warning	1292	Truncated incorrect INTEGER value: '%d.%m.%Y'
Warning	1292	Truncated incorrect INTEGER value: '%Y-%m-%d %H:%i:%s'
insert into t1(name) values(not get_format(time,'eur'));
Warnings:
Warning	1292	Truncated incorrect DOUBLE value: '%H.%i.%s'
obmysql-get_format-4-1-3
drop table t1;
create table t1 (id int ,name varchar(20));
insert into t1 values(1,'test01');
insert into t1 values(2,'test02');
insert into t1 values(3,'test03');
insert into t1 values(4,'test04');
update t1 set name= get_format(date,'eur') where name='test01';
update t1 set name= get_format(datetime,'jis') where name='test02';
update t1 set name= get_format(time,'usa') where name='test03';
select * from t1;
id	name
1	%d.%m.%Y
2	%Y-%m-%d %H:%i:%s
3	%h:%i:%s %p
4	test04
update t1 set name=get_format(datetime,'iso')  where name in ('test01','test02');
update t1 set name= get_format(time,'internal') where id>2;
update t1 set name= get_format(date,'jis')  where id <3;
update t1 set name= get_format(date,'internal')  where id<=3;
update t1 set name= get_format(time,'iso') where id between 1 and 2 ;
update t1 set name= get_format(datetime,'eur') where id = 1  or name='test03' ;
update t1 set name= get_format(datetime,'eur') where name like '%y%' ;
update t1 set name= get_format(time,'jis') where name not like 'test%' ;
update t1 set name=get_format(datetime,'eur') >get_format(datetime,'eur') ;
update t1 set name= get_format(date,'internal') or get_format(date,'jis');
Warnings:
Warning	1292	Truncated incorrect DOUBLE value: '%Y%m%d'
Warning	1292	Truncated incorrect DOUBLE value: '%Y-%m-%d'
update t1 set name= get_format(date,'internal') and get_format(date,'jis');
Warnings:
Warning	1292	Truncated incorrect DOUBLE value: '%Y%m%d'
update t1 set name= get_format(date,'internal') | get_format(date,'jis');
Warnings:
Warning	1292	Truncated incorrect INTEGER value: '%Y%m%d'
Warning	1292	Truncated incorrect INTEGER value: '%Y-%m-%d'
drop table t1;
create table t1(name int, name varchar(20) GENERATED ALWAYS AS (get_format(date,'jis')) STORED NOT NULL COMMENT '姓名');
ERROR 42S21: Duplicate column name 'name'
create table t1(id int,name  varchar(20) GENERATED ALWAYS AS (get_format(datetime,'jis')) VIRTUAL NOT NULL COMMENT '编号');
insert into t1(id) values('1');
insert into t1(name) values('xiaolai');
ERROR HY000: The value specified for generated column 'name' in table 't1' is not allowed
update t1 set name=get_format(date,'eur');
ERROR HY000: The value specified for generated column 'name' in table 't1' is not allowed
select *from t1;
id	name
1	%Y-%m-%d %H:%i:%s
alter  table t1 modify  column name varchar(30)  GENERATED ALWAYS AS (get_format(time,'internal')) VIRTUAL NOT NULL COMMENT '姓名';
ERROR 0A000: Modify generated column definition not supported
update t1 set id =utc_date();
update t1 set id =utc_date()+1;
update t1 set name =utc_date();
ERROR HY000: The value specified for generated column 'name' in table 't1' is not allowed
update t1 set name =utc_date()+1;
ERROR HY000: The value specified for generated column 'name' in table 't1' is not allowed
select * from t1;
id	name
20200914	%Y-%m-%d %H:%i:%s
drop table t1;
obmysql-get_format-4-2 视图
drop table t1;
create table t1(id int,name varchar(20));
insert into t1 values(1,get_format(date,'eur'));
insert into t1 values(1,get_format(date,'jis'));
drop view v1;
create view v1 as select * from t1;
select * from v1;
id	name
1	%d.%m.%Y
1	%Y-%m-%d
insert into v1 values(1,get_format(date,'eur'));
insert into v1 values(2,get_format(date,'jis'));
insert into v1 values(3,get_format(date,'internal'));
insert into v1 values(4,get_format(date,'iso'));
insert into v1 values(5,get_format(date,'usa'));
insert into v1 values(6,get_format(datetime,'eur'));
insert into v1 values(7,get_format(datetime,'jis'));
insert into v1 values(8,get_format(datetime,'internal'));
insert into v1 values(9,get_format(datetime,'iso'));
insert into v1 values(10,get_format(datetime,'usa'));
insert into v1 values(11,get_format(time,'eur'));
insert into v1 values(12,get_format(time,'jis'));
insert into v1 values(13,get_format(time,'internal'));
insert into v1 values(14,get_format(time,'iso'));
insert into v1 values(15,get_format(time,'usa'));
select * from v1;
id	name
1	%d.%m.%Y
1	%Y-%m-%d
1	%d.%m.%Y
2	%Y-%m-%d
3	%Y%m%d
4	%Y-%m-%d
5	%m.%d.%Y
6	%Y-%m-%d %H.%i.%s
7	%Y-%m-%d %H:%i:%s
8	%Y%m%d%H%i%s
9	%Y-%m-%d %H:%i:%s
10	%Y-%m-%d %H.%i.%s
11	%H.%i.%s
12	%H:%i:%s
13	%H%i%s
14	%H:%i:%s
15	%h:%i:%s %p
select DATE_FORMAT(utc_date(),GET_FORMAT(DATE,'JIS')) from v1;
DATE_FORMAT(utc_date(),GET_FORMAT(DATE,'JIS'))
2020-09-13
2020-09-13
2020-09-13
2020-09-13
2020-09-13
2020-09-13
2020-09-13
2020-09-13
2020-09-13
2020-09-13
2020-09-13
2020-09-13
2020-09-13
2020-09-13
2020-09-13
2020-09-13
2020-09-13
select FROM_UNIXTIME(160000000,GET_FORMAT(DATE,'EUR')) from v1;
FROM_UNIXTIME(160000000,GET_FORMAT(DATE,'EUR'))
27.01.1975
27.01.1975
27.01.1975
27.01.1975
27.01.1975
27.01.1975
27.01.1975
27.01.1975
27.01.1975
27.01.1975
27.01.1975
27.01.1975
27.01.1975
27.01.1975
27.01.1975
27.01.1975
27.01.1975
select STR_TO_DATE(utc_date(),GET_FORMAT(DATE,'ISO')) from v1;
STR_TO_DATE(utc_date(),GET_FORMAT(DATE,'ISO'))
2020-09-13 00:00:00.000000
2020-09-13 00:00:00.000000
2020-09-13 00:00:00.000000
2020-09-13 00:00:00.000000
2020-09-13 00:00:00.000000
2020-09-13 00:00:00.000000
2020-09-13 00:00:00.000000
2020-09-13 00:00:00.000000
2020-09-13 00:00:00.000000
2020-09-13 00:00:00.000000
2020-09-13 00:00:00.000000
2020-09-13 00:00:00.000000
2020-09-13 00:00:00.000000
2020-09-13 00:00:00.000000
2020-09-13 00:00:00.000000
2020-09-13 00:00:00.000000
2020-09-13 00:00:00.000000
select DATE_FORMAT(utc_date(),GET_FORMAT(DATETIME,'USA')) from v1;
DATE_FORMAT(utc_date(),GET_FORMAT(DATETIME,'USA'))
2020-09-13 00.00.00
2020-09-13 00.00.00
2020-09-13 00.00.00
2020-09-13 00.00.00
2020-09-13 00.00.00
2020-09-13 00.00.00
2020-09-13 00.00.00
2020-09-13 00.00.00
2020-09-13 00.00.00
2020-09-13 00.00.00
2020-09-13 00.00.00
2020-09-13 00.00.00
2020-09-13 00.00.00
2020-09-13 00.00.00
2020-09-13 00.00.00
2020-09-13 00.00.00
2020-09-13 00.00.00
select FROM_UNIXTIME(160000000,GET_FORMAT(DATETIME,'INTERNAL')) from v1;
FROM_UNIXTIME(160000000,GET_FORMAT(DATETIME,'INTERNAL'))
19750127042640
19750127042640
19750127042640
19750127042640
19750127042640
19750127042640
19750127042640
19750127042640
19750127042640
19750127042640
19750127042640
19750127042640
19750127042640
19750127042640
19750127042640
19750127042640
19750127042640
select STR_TO_DATE(utc_date(),GET_FORMAT(DATETIME,'ISO')) from v1;
STR_TO_DATE(utc_date(),GET_FORMAT(DATETIME,'ISO'))
2020-09-13 00:00:00.000000
2020-09-13 00:00:00.000000
2020-09-13 00:00:00.000000
2020-09-13 00:00:00.000000
2020-09-13 00:00:00.000000
2020-09-13 00:00:00.000000
2020-09-13 00:00:00.000000
2020-09-13 00:00:00.000000
2020-09-13 00:00:00.000000
2020-09-13 00:00:00.000000
2020-09-13 00:00:00.000000
2020-09-13 00:00:00.000000
2020-09-13 00:00:00.000000
2020-09-13 00:00:00.000000
2020-09-13 00:00:00.000000
2020-09-13 00:00:00.000000
2020-09-13 00:00:00.000000
select DATE_FORMAT(UTC_TIME(),GET_FORMAT(TIME,'usa')) from v1;
DATE_FORMAT(UTC_TIME(),GET_FORMAT(TIME,'usa'))
12:26:40 PM
12:26:40 PM
12:26:40 PM
12:26:40 PM
12:26:40 PM
12:26:40 PM
12:26:40 PM
12:26:40 PM
12:26:40 PM
12:26:40 PM
12:26:40 PM
12:26:40 PM
12:26:40 PM
12:26:40 PM
12:26:40 PM
12:26:40 PM
12:26:40 PM
select FROM_UNIXTIME(160000000,GET_FORMAT(TIME,'INTERNAL')) from v1;
FROM_UNIXTIME(160000000,GET_FORMAT(TIME,'INTERNAL'))
042640
042640
042640
042640
042640
042640
042640
042640
042640
042640
042640
042640
042640
042640
042640
042640
042640
select STR_TO_DATE(utc_TIME(),GET_FORMAT(TIME,'iso')) from v1;
STR_TO_DATE(utc_TIME(),GET_FORMAT(TIME,'iso'))
0000-00-00 12:26:40.000000
0000-00-00 12:26:40.000000
0000-00-00 12:26:40.000000
0000-00-00 12:26:40.000000
0000-00-00 12:26:40.000000
0000-00-00 12:26:40.000000
0000-00-00 12:26:40.000000
0000-00-00 12:26:40.000000
0000-00-00 12:26:40.000000
0000-00-00 12:26:40.000000
0000-00-00 12:26:40.000000
0000-00-00 12:26:40.000000
0000-00-00 12:26:40.000000
0000-00-00 12:26:40.000000
0000-00-00 12:26:40.000000
0000-00-00 12:26:40.000000
0000-00-00 12:26:40.000000
select v1.* ,GET_FORMAT(DATETIME,'eur'),GET_FORMAT(DATE,'iso'), GET_FORMAT(time,'internal') from v1 where name =GET_FORMAT(DATETIME,'eur');
id	name	GET_FORMAT(DATETIME,'eur')	GET_FORMAT(DATE,'iso')	GET_FORMAT(time,'internal')
6	%Y-%m-%d %H.%i.%s	%Y-%m-%d %H.%i.%s	%Y-%m-%d	%H%i%s
10	%Y-%m-%d %H.%i.%s	%Y-%m-%d %H.%i.%s	%Y-%m-%d	%H%i%s
select v1.* ,GET_FORMAT(DATETIME,'eur') as a,GET_FORMAT(DATE,'iso') as b, GET_FORMAT(time,'internal') as c from v1 where name <GET_FORMAT(DATE,'USA');
id	name	a	b	c
1	%d.%m.%Y	%Y-%m-%d %H.%i.%s	%Y-%m-%d	%H%i%s
1	%d.%m.%Y	%Y-%m-%d %H.%i.%s	%Y-%m-%d	%H%i%s
11	%H.%i.%s	%Y-%m-%d %H.%i.%s	%Y-%m-%d	%H%i%s
12	%H:%i:%s	%Y-%m-%d %H.%i.%s	%Y-%m-%d	%H%i%s
13	%H%i%s	%Y-%m-%d %H.%i.%s	%Y-%m-%d	%H%i%s
14	%H:%i:%s	%Y-%m-%d %H.%i.%s	%Y-%m-%d	%H%i%s
15	%h:%i:%s %p	%Y-%m-%d %H.%i.%s	%Y-%m-%d	%H%i%s
select v1.* ,GET_FORMAT(DATETIME,'eur') as a,GET_FORMAT(DATE,'iso') as b, GET_FORMAT(time,'internal') as c from v1 where name <=GET_FORMAT(time,'jis');
id	name	a	b	c
1	%d.%m.%Y	%Y-%m-%d %H.%i.%s	%Y-%m-%d	%H%i%s
1	%d.%m.%Y	%Y-%m-%d %H.%i.%s	%Y-%m-%d	%H%i%s
11	%H.%i.%s	%Y-%m-%d %H.%i.%s	%Y-%m-%d	%H%i%s
12	%H:%i:%s	%Y-%m-%d %H.%i.%s	%Y-%m-%d	%H%i%s
13	%H%i%s	%Y-%m-%d %H.%i.%s	%Y-%m-%d	%H%i%s
14	%H:%i:%s	%Y-%m-%d %H.%i.%s	%Y-%m-%d	%H%i%s
select v1.* ,GET_FORMAT(DATETIME,'eur') as a,GET_FORMAT(DATE,'iso') as b, GET_FORMAT(time,'internal') as c from v1 where name >=GET_FORMAT(time,'internal');
id	name	a	b	c
1	%Y-%m-%d	%Y-%m-%d %H.%i.%s	%Y-%m-%d	%H%i%s
2	%Y-%m-%d	%Y-%m-%d %H.%i.%s	%Y-%m-%d	%H%i%s
3	%Y%m%d	%Y-%m-%d %H.%i.%s	%Y-%m-%d	%H%i%s
4	%Y-%m-%d	%Y-%m-%d %H.%i.%s	%Y-%m-%d	%H%i%s
5	%m.%d.%Y	%Y-%m-%d %H.%i.%s	%Y-%m-%d	%H%i%s
6	%Y-%m-%d %H.%i.%s	%Y-%m-%d %H.%i.%s	%Y-%m-%d	%H%i%s
7	%Y-%m-%d %H:%i:%s	%Y-%m-%d %H.%i.%s	%Y-%m-%d	%H%i%s
8	%Y%m%d%H%i%s	%Y-%m-%d %H.%i.%s	%Y-%m-%d	%H%i%s
9	%Y-%m-%d %H:%i:%s	%Y-%m-%d %H.%i.%s	%Y-%m-%d	%H%i%s
10	%Y-%m-%d %H.%i.%s	%Y-%m-%d %H.%i.%s	%Y-%m-%d	%H%i%s
11	%H.%i.%s	%Y-%m-%d %H.%i.%s	%Y-%m-%d	%H%i%s
12	%H:%i:%s	%Y-%m-%d %H.%i.%s	%Y-%m-%d	%H%i%s
13	%H%i%s	%Y-%m-%d %H.%i.%s	%Y-%m-%d	%H%i%s
14	%H:%i:%s	%Y-%m-%d %H.%i.%s	%Y-%m-%d	%H%i%s
15	%h:%i:%s %p	%Y-%m-%d %H.%i.%s	%Y-%m-%d	%H%i%s
select v1.* ,GET_FORMAT(DATETIME,'eur') as a,GET_FORMAT(DATE,'iso') as b, GET_FORMAT(time,'internal') as c from v1 where name >GET_FORMAT(DATE,'iso');
id	name	a	b	c
6	%Y-%m-%d %H.%i.%s	%Y-%m-%d %H.%i.%s	%Y-%m-%d	%H%i%s
7	%Y-%m-%d %H:%i:%s	%Y-%m-%d %H.%i.%s	%Y-%m-%d	%H%i%s
9	%Y-%m-%d %H:%i:%s	%Y-%m-%d %H.%i.%s	%Y-%m-%d	%H%i%s
10	%Y-%m-%d %H.%i.%s	%Y-%m-%d %H.%i.%s	%Y-%m-%d	%H%i%s
select v1.* ,GET_FORMAT(DATETIME,'eur') as a,GET_FORMAT(DATE,'iso') as b, GET_FORMAT(time,'internal') as c from v1 where GET_FORMAT(DATE,'internal')<>name;
id	name	a	b	c
1	%d.%m.%Y	%Y-%m-%d %H.%i.%s	%Y-%m-%d	%H%i%s
1	%Y-%m-%d	%Y-%m-%d %H.%i.%s	%Y-%m-%d	%H%i%s
1	%d.%m.%Y	%Y-%m-%d %H.%i.%s	%Y-%m-%d	%H%i%s
2	%Y-%m-%d	%Y-%m-%d %H.%i.%s	%Y-%m-%d	%H%i%s
4	%Y-%m-%d	%Y-%m-%d %H.%i.%s	%Y-%m-%d	%H%i%s
5	%m.%d.%Y	%Y-%m-%d %H.%i.%s	%Y-%m-%d	%H%i%s
6	%Y-%m-%d %H.%i.%s	%Y-%m-%d %H.%i.%s	%Y-%m-%d	%H%i%s
7	%Y-%m-%d %H:%i:%s	%Y-%m-%d %H.%i.%s	%Y-%m-%d	%H%i%s
8	%Y%m%d%H%i%s	%Y-%m-%d %H.%i.%s	%Y-%m-%d	%H%i%s
9	%Y-%m-%d %H:%i:%s	%Y-%m-%d %H.%i.%s	%Y-%m-%d	%H%i%s
10	%Y-%m-%d %H.%i.%s	%Y-%m-%d %H.%i.%s	%Y-%m-%d	%H%i%s
11	%H.%i.%s	%Y-%m-%d %H.%i.%s	%Y-%m-%d	%H%i%s
12	%H:%i:%s	%Y-%m-%d %H.%i.%s	%Y-%m-%d	%H%i%s
13	%H%i%s	%Y-%m-%d %H.%i.%s	%Y-%m-%d	%H%i%s
14	%H:%i:%s	%Y-%m-%d %H.%i.%s	%Y-%m-%d	%H%i%s
15	%h:%i:%s %p	%Y-%m-%d %H.%i.%s	%Y-%m-%d	%H%i%s
select v1.* ,GET_FORMAT(DATETIME,'eur') as a,GET_FORMAT(DATE,'iso') as b, GET_FORMAT(time,'internal') as c from v1 where name =GET_FORMAT(DATE,'internal') or GET_FORMAT(DATETIME,'eur')=name;
id	name	a	b	c
3	%Y%m%d	%Y-%m-%d %H.%i.%s	%Y-%m-%d	%H%i%s
6	%Y-%m-%d %H.%i.%s	%Y-%m-%d %H.%i.%s	%Y-%m-%d	%H%i%s
10	%Y-%m-%d %H.%i.%s	%Y-%m-%d %H.%i.%s	%Y-%m-%d	%H%i%s
select v1.* ,GET_FORMAT(DATETIME,'eur') as a,GET_FORMAT(DATE,'iso') as b, GET_FORMAT(time,'internal') as c from v1 where name >GET_FORMAT(DATE,'internal') and GET_FORMAT(DATETIME,'eur')<name;
id	name	a	b	c
7	%Y-%m-%d %H:%i:%s	%Y-%m-%d %H.%i.%s	%Y-%m-%d	%H%i%s
9	%Y-%m-%d %H:%i:%s	%Y-%m-%d %H.%i.%s	%Y-%m-%d	%H%i%s
select v1.*,GET_FORMAT(DATETIME,'iso') from v1 where name between  GET_FORMAT(DATE,'eur') and GET_FORMAT(DATE,'USA');
id	name	GET_FORMAT(DATETIME,'iso')
1	%d.%m.%Y	%Y-%m-%d %H:%i:%s
1	%d.%m.%Y	%Y-%m-%d %H:%i:%s
5	%m.%d.%Y	%Y-%m-%d %H:%i:%s
11	%H.%i.%s	%Y-%m-%d %H:%i:%s
12	%H:%i:%s	%Y-%m-%d %H:%i:%s
13	%H%i%s	%Y-%m-%d %H:%i:%s
14	%H:%i:%s	%Y-%m-%d %H:%i:%s
15	%h:%i:%s %p	%Y-%m-%d %H:%i:%s
select v1.*,GET_FORMAT(DATETIME,'iso') from v1 where name like GET_FORMAT(date,'eur');
id	name	GET_FORMAT(DATETIME,'iso')
1	%d.%m.%Y	%Y-%m-%d %H:%i:%s
1	%d.%m.%Y	%Y-%m-%d %H:%i:%s
select v1.*,GET_FORMAT(DATETIME,'iso') from v1 where name not like GET_FORMAT(date,'eur');
id	name	GET_FORMAT(DATETIME,'iso')
1	%Y-%m-%d	%Y-%m-%d %H:%i:%s
2	%Y-%m-%d	%Y-%m-%d %H:%i:%s
3	%Y%m%d	%Y-%m-%d %H:%i:%s
4	%Y-%m-%d	%Y-%m-%d %H:%i:%s
5	%m.%d.%Y	%Y-%m-%d %H:%i:%s
6	%Y-%m-%d %H.%i.%s	%Y-%m-%d %H:%i:%s
7	%Y-%m-%d %H:%i:%s	%Y-%m-%d %H:%i:%s
8	%Y%m%d%H%i%s	%Y-%m-%d %H:%i:%s
9	%Y-%m-%d %H:%i:%s	%Y-%m-%d %H:%i:%s
10	%Y-%m-%d %H.%i.%s	%Y-%m-%d %H:%i:%s
11	%H.%i.%s	%Y-%m-%d %H:%i:%s
12	%H:%i:%s	%Y-%m-%d %H:%i:%s
13	%H%i%s	%Y-%m-%d %H:%i:%s
14	%H:%i:%s	%Y-%m-%d %H:%i:%s
15	%h:%i:%s %p	%Y-%m-%d %H:%i:%s
select GET_FORMAT(DATE,'jis'),GET_FORMAT(time,'USA'),v1.* from v1 where exists (select GET_FORMAT(time,'jis'));
GET_FORMAT(DATE,'jis')	GET_FORMAT(time,'USA')	id	name
%Y-%m-%d	%h:%i:%s %p	1	%d.%m.%Y
%Y-%m-%d	%h:%i:%s %p	1	%Y-%m-%d
%Y-%m-%d	%h:%i:%s %p	1	%d.%m.%Y
%Y-%m-%d	%h:%i:%s %p	2	%Y-%m-%d
%Y-%m-%d	%h:%i:%s %p	3	%Y%m%d
%Y-%m-%d	%h:%i:%s %p	4	%Y-%m-%d
%Y-%m-%d	%h:%i:%s %p	5	%m.%d.%Y
%Y-%m-%d	%h:%i:%s %p	6	%Y-%m-%d %H.%i.%s
%Y-%m-%d	%h:%i:%s %p	7	%Y-%m-%d %H:%i:%s
%Y-%m-%d	%h:%i:%s %p	8	%Y%m%d%H%i%s
%Y-%m-%d	%h:%i:%s %p	9	%Y-%m-%d %H:%i:%s
%Y-%m-%d	%h:%i:%s %p	10	%Y-%m-%d %H.%i.%s
%Y-%m-%d	%h:%i:%s %p	11	%H.%i.%s
%Y-%m-%d	%h:%i:%s %p	12	%H:%i:%s
%Y-%m-%d	%h:%i:%s %p	13	%H%i%s
%Y-%m-%d	%h:%i:%s %p	14	%H:%i:%s
%Y-%m-%d	%h:%i:%s %p	15	%h:%i:%s %p
select GET_FORMAT(DATE,'jis'),GET_FORMAT(time,'USA'),v1.* from v1 where name <any (select GET_FORMAT(time,'jis'));
GET_FORMAT(DATE,'jis')	GET_FORMAT(time,'USA')	id	name
%Y-%m-%d	%h:%i:%s %p	1	%d.%m.%Y
%Y-%m-%d	%h:%i:%s %p	1	%d.%m.%Y
%Y-%m-%d	%h:%i:%s %p	11	%H.%i.%s
%Y-%m-%d	%h:%i:%s %p	13	%H%i%s
select GET_FORMAT(DATE,'jis'),GET_FORMAT(time,'USA'),v1.* from v1 where name >all (select GET_FORMAT(time,'jis'));
GET_FORMAT(DATE,'jis')	GET_FORMAT(time,'USA')	id	name
%Y-%m-%d	%h:%i:%s %p	1	%Y-%m-%d
%Y-%m-%d	%h:%i:%s %p	2	%Y-%m-%d
%Y-%m-%d	%h:%i:%s %p	3	%Y%m%d
%Y-%m-%d	%h:%i:%s %p	4	%Y-%m-%d
%Y-%m-%d	%h:%i:%s %p	5	%m.%d.%Y
%Y-%m-%d	%h:%i:%s %p	6	%Y-%m-%d %H.%i.%s
%Y-%m-%d	%h:%i:%s %p	7	%Y-%m-%d %H:%i:%s
%Y-%m-%d	%h:%i:%s %p	8	%Y%m%d%H%i%s
%Y-%m-%d	%h:%i:%s %p	9	%Y-%m-%d %H:%i:%s
%Y-%m-%d	%h:%i:%s %p	10	%Y-%m-%d %H.%i.%s
%Y-%m-%d	%h:%i:%s %p	15	%h:%i:%s %p
select GET_FORMAT(DATE,'jis'),GET_FORMAT(time,'USA'),v1.* from v1 where name in (select GET_FORMAT(time,'jis'));
GET_FORMAT(DATE,'jis')	GET_FORMAT(time,'USA')	id	name
%Y-%m-%d	%h:%i:%s %p	12	%H:%i:%s
%Y-%m-%d	%h:%i:%s %p	14	%H:%i:%s
select GET_FORMAT(DATE,'jis'),GET_FORMAT(time,'USA'),v1.* from v1 where name in (GET_FORMAT(time,'jis'),GET_FORMAT(DATETIME,'internal'),GET_FORMAT(DATE,'eur'));
GET_FORMAT(DATE,'jis')	GET_FORMAT(time,'USA')	id	name
%Y-%m-%d	%h:%i:%s %p	1	%d.%m.%Y
%Y-%m-%d	%h:%i:%s %p	1	%d.%m.%Y
%Y-%m-%d	%h:%i:%s %p	8	%Y%m%d%H%i%s
%Y-%m-%d	%h:%i:%s %p	12	%H:%i:%s
%Y-%m-%d	%h:%i:%s %p	14	%H:%i:%s
select v1.* ,GET_FORMAT(TIME,'eur') from v1 group by GET_FORMAT(time,'USA');
id	name	GET_FORMAT(TIME,'eur')
1	%d.%m.%Y	%H.%i.%s
select * from v1 group by GET_FORMAT(time,'USA') having name> GET_FORMAT(DATE,'jis');
id	name
select * from v1 order by GET_FORMAT(time,'USA'),GET_FORMAT(time,'internal');
id	name
1	%d.%m.%Y
1	%Y-%m-%d
1	%d.%m.%Y
2	%Y-%m-%d
3	%Y%m%d
4	%Y-%m-%d
5	%m.%d.%Y
6	%Y-%m-%d %H.%i.%s
7	%Y-%m-%d %H:%i:%s
8	%Y%m%d%H%i%s
9	%Y-%m-%d %H:%i:%s
10	%Y-%m-%d %H.%i.%s
11	%H.%i.%s
12	%H:%i:%s
13	%H%i%s
14	%H:%i:%s
15	%h:%i:%s %p
select v1.* , case GET_FORMAT(DATE,'iso')   when GET_FORMAT(time,'jis')  then GET_FORMAT(datetime,'iso')  when GET_FORMAT(DATE,'iso')  then    GET_FORMAT(DATEtime,'USA')  end as a  from v1;
id	name	a
1	%d.%m.%Y	%Y-%m-%d %H.%i.%s
1	%Y-%m-%d	%Y-%m-%d %H.%i.%s
1	%d.%m.%Y	%Y-%m-%d %H.%i.%s
2	%Y-%m-%d	%Y-%m-%d %H.%i.%s
3	%Y%m%d	%Y-%m-%d %H.%i.%s
4	%Y-%m-%d	%Y-%m-%d %H.%i.%s
5	%m.%d.%Y	%Y-%m-%d %H.%i.%s
6	%Y-%m-%d %H.%i.%s	%Y-%m-%d %H.%i.%s
7	%Y-%m-%d %H:%i:%s	%Y-%m-%d %H.%i.%s
8	%Y%m%d%H%i%s	%Y-%m-%d %H.%i.%s
9	%Y-%m-%d %H:%i:%s	%Y-%m-%d %H.%i.%s
10	%Y-%m-%d %H.%i.%s	%Y-%m-%d %H.%i.%s
11	%H.%i.%s	%Y-%m-%d %H.%i.%s
12	%H:%i:%s	%Y-%m-%d %H.%i.%s
13	%H%i%s	%Y-%m-%d %H.%i.%s
14	%H:%i:%s	%Y-%m-%d %H.%i.%s
15	%h:%i:%s %p	%Y-%m-%d %H.%i.%s
select count(GET_FORMAT(DATE,'jis')) from v1;
count(GET_FORMAT(DATE,'jis'))
17
select sum(GET_FORMAT(DATETIME,'USA')) from v1;
sum(GET_FORMAT(DATETIME,'USA'))
0
Warnings:
Warning	1292	Truncated incorrect DOUBLE value: '%Y-%m-%d %H.%i.%s'
select avg(GET_FORMAT(TIME,'INTELNAL')) from v1;
avg(GET_FORMAT(TIME,'INTELNAL'))
NULL
seLect min(GET_FORMAT(TIME,'jis')) from v1;
min(GET_FORMAT(TIME,'jis'))
%H:%i:%s
select max(GET_FORMAT(DATETIME,'ISO')) from v1;
max(GET_FORMAT(DATETIME,'ISO'))
%Y-%m-%d %H:%i:%s
select GROUP_CONCAT(GET_FORMAT(DATE,'EUR')) from v1;
GROUP_CONCAT(GET_FORMAT(DATE,'EUR'))
%d.%m.%Y,%d.%m.%Y,%d.%m.%Y,%d.%m.%Y,%d.%m.%Y,%d.%m.%Y,%d.%m.%Y,%d.%m.%Y,%d.%m.%Y,%d.%m.%Y,%d.%m.%Y,%d.%m.%Y,%d.%m.%Y,%d.%m.%Y,%d.%m.%Y,%d.%m.%Y,%d.%m.%Y
drop table t1;
drop view v1;
create table t1(a datetime);
create view v1 as select * from t1;
insert into v1 values(date_format('2020-10-10 12:12:12',get_format(datetime,'eur')));
insert into v1 values(date_format('2020-10-10 15:20:31.111',get_format(datetime,'jis')));
insert into v1 values(date_format('2020-10-10 15:14:13',get_format(datetime,'iso')));
insert into v1 values(date_format('2020-10-10 20:25:36.256565',get_format(datetime,'internal')));
insert into v1 values(date_format('2020-10-10 17:56:32',get_format(datetime,'usa')));
update v1 set a =date_format('2020-10-10 12:12:12',get_format(datetime,'jis')) where a=date_format('2020-10-10 12:12:12',get_format(datetime,'eur')) ;
update v1 set a =date_format('2020-10-10 15:20:31.111',get_format(datetime,'usa'));
update v1 set a =date_format('2020-10-10 15:20:31.111',get_format(datetime,'internal'));
update v1 set a =date_format('2020-10-10 15:20:31.111',get_format(datetime,'iso'));
update v1 set a =date_format('2020-10-10 15:20:31.111',get_format(datetime,'eur'));
insert into v1 values(STR_TO_DATE('2020-10-10 17:56:32',get_format(datetime,'usa')));
ERROR HY000: Incorrect datetime value: '2020-10-10 17:56:32' for function str_to_date
insert into v1 values(STR_TO_DATE('2020-10-10 12:12:12',get_format(datetime,'eur')));
ERROR HY000: Incorrect datetime value: '2020-10-10 12:12:12' for function str_to_date
insert into v1 values(STR_TO_DATE('2020-10-10 15:20:31.111',get_format(datetime,'jis')));
insert into v1 values(STR_TO_DATE('2020-10-10 15:14:13',get_format(datetime,'iso')));
insert into v1 values(STR_TO_DATE('2020-10-10 20:25:36.256565',get_format(datetime,'internal')));
ERROR HY000: Incorrect datetime value: '2020-10-10 20:25:36.256565' for function str_to_date
update v1 set a =STR_TO_DATE('2020-10-10 12:12:12',get_format(datetime,'jis')) where a=STR_TO_DATE('2020-10-10 12:12:12',get_format(datetime,'usa')) ;
ERROR HY000: Incorrect datetime value: '2020-10-10 12:12:12' for function str_to_date
update v1 set a =STR_TO_DATE('2020-10-10 15:20:31.111',get_format(datetime,'usa'));
ERROR HY000: Incorrect datetime value: '2020-10-10 15:20:31.111' for function str_to_date
update v1 set a =STR_TO_DATE('2020-10-10 15:20:31.111',get_format(datetime,'internal'));
ERROR HY000: Incorrect datetime value: '2020-10-10 15:20:31.111' for function str_to_date
update v1 set a =STR_TO_DATE('2020-10-10 15:20:31.111',get_format(datetime,'iso'));
update v1 set a =STR_TO_DATE('2020-10-10 15:20:31.111',get_format(datetime,'eur'));
ERROR HY000: Incorrect datetime value: '2020-10-10 15:20:31.111' for function str_to_date
insert into v1 values(FROM_UNIXTIME(1600000000,get_format(datetime,'eur')));
insert into v1 values(FROM_UNIXTIME(1600000000,get_format(datetime,'jis')));
insert into v1 values(FROM_UNIXTIME(1600000000,get_format(datetime,'iso')));
insert into v1 values(FROM_UNIXTIME(1600000000,get_format(datetime,'internal')));
insert into v1 values(FROM_UNIXTIME(1600000000,get_format(datetime,'usa')));
update v1 set a =FROM_UNIXTIME(1600000000,get_format(datetime,'jis')) where a=FROM_UNIXTIME(1600000000,get_format(datetime,'eur'));
update v1 set a =FROM_UNIXTIME(1600000000,get_format(datetime,'usa'));
update v1 set a =FROM_UNIXTIME(1600000000,get_format(datetime,'internal'));
update v1 set a =FROM_UNIXTIME(1600000000,get_format(datetime,'iso'));
update v1 set a =FROM_UNIXTIME(1600000000,get_format(datetime,'jis'));
drop table t1;
drop view v1;
create table t1(a date);
create view v1 as select * from t1;
insert into v1 values(date_format('2020-10-10',get_format(date,'eur')));
insert into v1 values(date_format('2020-10-10',get_format(date,'jis')));
insert into v1 values(date_format('2020-10-10',get_format(date,'iso')));
insert into v1 values(date_format('2020-10-10',get_format(date,'internal')));
insert into v1 values(date_format('2020-10-10',get_format(date,'usa')));
update v1  set a =date_format('2020-10-10',get_format(date,'jis')) where a=date_format('2020-10-10',get_format(date,'eur')) ;
update v1 set a =date_format('2020-10-10',get_format(date,'usa'));
update v1 set a =date_format('2020-10-10',get_format(date,'internal'));
update v1 set a =date_format('2020-10-10',get_format(date,'iso'));
update v1 set a =date_format('2020-10-10',get_format(date,'eur'));
insert into v1 values(STR_TO_DATE('2020-10-10',get_format(date,'usa')));
ERROR HY000: Incorrect datetime value: '2020-10-10' for function str_to_date
insert into v1 values(STR_TO_DATE('2020-10-10',get_format(date,'eur')));
ERROR HY000: Incorrect datetime value: '2020-10-10' for function str_to_date
insert into v1 values(STR_TO_DATE('2020-10-10',get_format(date,'jis')));
insert into v1 values(STR_TO_DATE('2020-10-10',get_format(date,'iso')));
insert into v1 values(STR_TO_DATE('2020-10-10',get_format(date,'internal')));
ERROR HY000: Incorrect datetime value: '2020-10-10' for function str_to_date
update v1 set a =STR_TO_DATE('2020-10-10',get_format(date,'jis')) where a=STR_TO_DATE('2020-10-10',get_format(date,'usa')) ;
ERROR HY000: Incorrect datetime value: '2020-10-10' for function str_to_date
update v1 set a =STR_TO_DATE('2020-10-10',get_format(date,'usa'));
ERROR HY000: Incorrect datetime value: '2020-10-10' for function str_to_date
update v1 set a =STR_TO_DATE('2020-10-10',get_format(date,'internal'));
ERROR HY000: Incorrect datetime value: '2020-10-10' for function str_to_date
update v1 set a =STR_TO_DATE('2020-10-10 15:20:31.111',get_format(date,'iso'));
update v1 set a =STR_TO_DATE('2020-10-10 15:20:31.111',get_format(date,'eur'));
ERROR HY000: Incorrect datetime value: '2020-10-10 15:20:31.111' for function str_to_date
insert into v1 values(FROM_UNIXTIME(1600000000,get_format(date,'eur')));
insert into v1 values(FROM_UNIXTIME(1600000000,get_format(date,'jis')));
insert into v1 values(FROM_UNIXTIME(1600000000,get_format(date,'iso')));
insert into v1 values(FROM_UNIXTIME(1600000000,get_format(date,'internal')));
insert into v1 values(FROM_UNIXTIME(1600000000,get_format(date,'usa')));
ERROR 22007: Incorrect datetime value for column 'a' at row 1
update v1 set a =FROM_UNIXTIME(1600000000,get_format(date,'jis')) where a=FROM_UNIXTIME(1600000000,get_format(date,'eur'));
update v1 set a =FROM_UNIXTIME(1600000000,get_format(date,'usa'));
ERROR 22007: Incorrect datetime value for column 'a' at row 1
update v1 set a =FROM_UNIXTIME(1600000000,get_format(date,'internal'));
update v1 set a =FROM_UNIXTIME(1600000000,get_format(date,'iso'));
update v1 set a =FROM_UNIXTIME(1600000000,get_format(date,'jis'));
drop table t1;
drop view v1;
create table t1(a time);
create view v1 as select * from t1;
insert into v1 values('11:11:12');
insert into v1 values(date_format('12:12:12',get_format(time,'eur')));
insert into v1 values(date_format('15:20:31.111',get_format(time,'jis')));
ERROR 22007: Incorrect datetime value for column 'a' at row 1
insert into v1 values(date_format('15:14:13',get_format(time,'iso')));
ERROR 22007: Incorrect datetime value for column 'a' at row 1
insert into v1 values(date_format('20:25:36.256565',get_format(time,'internal')));
ERROR 22007: Incorrect datetime value for column 'a' at row 1
insert into v1 values(date_format('17:56:32',get_format(time,'usa')));
ERROR 22007: Incorrect datetime value for column 'a' at row 1
update v1 set a =date_format('12:12:12',get_format(time,'jis')) where a=date_format('2020-10-10 12:12:12',get_format(time,'eur')) ;
update v1 set a =date_format('15:20:31.111',get_format(time,'usa'));
ERROR 22007: Incorrect datetime value for column 'a' at row 1
update v1 set a =date_format('15:20:31.111',get_format(time,'internal'));
ERROR 22007: Incorrect datetime value for column 'a' at row 1
update v1 set a =date_format('15:20:31.111',get_format(time,'iso'));
ERROR 22007: Incorrect datetime value for column 'a' at row 1
update v1 set a =date_format('15:20:31.111',get_format(time,'eur'));
ERROR 22007: Incorrect datetime value for column 'a' at row 1
insert into v1 values(STR_TO_DATE('17:56:32',get_format(time,'usa')));
insert into v1 values(STR_TO_DATE('12:12:12',get_format(time,'eur')));
ERROR HY000: Incorrect datetime value: '12:12:12' for function str_to_date
insert into v1 values(STR_TO_DATE('15:20:31.111',get_format(time,'jis')));
insert into v1 values(STR_TO_DATE('15:14:13',get_format(time,'iso')));
insert into v1 values(STR_TO_DATE('20:25:36.256565',get_format(time,'internal')));
update v1 set a =STR_TO_DATE('12:12:12',get_format(time,'jis')) where a=STR_TO_DATE('2020-10-10 12:12:12',get_format(time,'usa')) ;
ERROR HY000: Incorrect datetime value: '2020-10-10 12:12:12' for function str_to_date
update v1 set a =STR_TO_DATE('15:20:31.111',get_format(time,'usa'));
ERROR HY000: Incorrect datetime value: '15:20:31.111' for function str_to_date
update v1 set a =STR_TO_DATE('15:20:31.111',get_format(time,'internal'));
update v1 set a =STR_TO_DATE('15:20:31.111',get_format(time,'iso'));
update v1 set a =STR_TO_DATE('15:20:31.111',get_format(time,'eur'));
ERROR HY000: Incorrect datetime value: '15:20:31.111' for function str_to_date
insert into v1 values(FROM_UNIXTIME(1600000000,get_format(time,'eur')));
insert into v1 values(FROM_UNIXTIME(1600000000,get_format(time,'jis')));
insert into v1 values(FROM_UNIXTIME(1600000000,get_format(time,'iso')));
insert into v1 values(FROM_UNIXTIME(1600000000,get_format(time,'internal')));
insert into v1 values(FROM_UNIXTIME(1600000000,get_format(time,'usa')));
update v1 set a =FROM_UNIXTIME(160000000,get_format(time,'jis')) where a=FROM_UNIXTIME(1600000000,get_format(time,'eur'));
update v1 set a =FROM_UNIXTIME(1600000000,get_format(time,'usa'));
update v1 set a =FROM_UNIXTIME(1600000000,get_format(time,'internal'));
update v1 set a =FROM_UNIXTIME(1600000000,get_format(time,'iso'));
update v1 set a =FROM_UNIXTIME(1600000000,get_format(time,'usa'));
drop table t1;
drop view v1;
create table t1(a int);
create view v1 as select get_format(date,'eur'),get_format(datetime,'internal'),get_format(time,'usa'),a from t1;
insert into v1(a) values(1);
ERROR HY000: The target table v1 of the INSERT is not insertable-into
drop table t1;
drop view v1;
obmysql-get_format-4-4
drop table t1;
create table t1(id varchar(30) primary key,name varchar(20) default '10');
drop table t2;
create table t2(id varchar(30)  unique key ,name varchar(20),t1_fk varchar(30),CONSTRAINT  for_key FOREIGN KEY (t1_fk) REFERENCES  t1 (id));
drop table t3;
create table t3(id varchar(30) not null ,name varchar(20));
insert into t1 values(get_format(date,'eur'),get_format(datetime,'jis'));
insert into t1 values(get_format(date,'eur'),get_format(datetime,'jis'));
ERROR 23000: Duplicate entry '%d.%m.%Y' for key 'PRIMARY'
insert into t1 values(get_format(date,'jis'),get_format(time,'jis'));
update t1 set id=get_format(date,'eur'),name=get_format(time,'iso') where id=get_format(date,'jis');
ERROR 23000: Duplicate entry '%d.%m.%Y' for key 'PRIMARY'
update t1 set id=get_format(date,'jis'),name=get_format(time,'iso') where id=get_format(date,'jis');
select * from t1;
id	name
%d.%m.%Y	%Y-%m-%d %H:%i:%s
%Y-%m-%d	%H:%i:%s
insert into t2 values(get_format(date,'eur'),get_format(time,'internal'),get_format(date,'jis'));
insert into t2 values(get_format(time,'eur'),get_format(time,'internal'),get_format(date,'eur'));
insert into t2 values(get_format(date,'eur'),get_format(time,'internal'),get_format(date,'usa'));
ERROR 23000: Duplicate entry '%d.%m.%Y' for key 'id'
insert into t2 values(get_format(datetime,'eur'),get_format(time,'internal'),get_format(date,'usa'));
ERROR 23000: Cannot add or update a child row: a foreign key constraint fails
insert into t2 values(get_format(datetime,'eur'),get_format(time,'internal'),get_format(date,'jis'));
insert into t2 values(get_format(datetime,'iso'),get_format(time,'internal'),get_format(date,'eur'));
insert into t3 values(get_format(datetime,'jk'),get_format(date,'jis'));
ERROR 23000: Column 'id' cannot be null
insert into t3 values(get_format(date,'jis'),get_format(time,'jis'));
update t3 set id=get_format(date,'532');
ERROR 23000: Column 'id' cannot be null
update t3 set id=get_format(time,'internal');
drop table t2;
drop table t1;
drop table t3;
obmysql-get_format-4-5
create table t1(id varchar(30),name varchar(30));
CREATE INDEX indexName ON t1 (id);
insert into t1 values(get_format(time,'usa'),get_format(time,'eur'));
update t1 set id=get_format(date,'iso');
select * from t1 where id =get_format(date,'iso');
id	name
%Y-%m-%d	%H.%i.%s
select * from t1 where id =get_format(datetime,'jis');
id	name
drop table t1;
obmysql-get_format-4-3
drop table t1;
create table t1(id int,name varchar(30),d date,t time, dt datetime);
DROP PROCEDURE pro_test01;
CREATE PROCEDURE pro_test01(in a varchar(30))
begin
declare i int;
set i=1;
while i <=5  DO
if a in (get_format(date,'eur'),get_format(date,'jis'),get_format(date,'internal'),get_format(date,'usa'),get_format(date,'iso')) then
insert into t1 values(i,a,DATE_FORMAT('2012-10-10',a),null,null);
elseif a in (get_format(datetime,'eur'),get_format(datetime,'jis'),get_format(datetime,'internal'),get_format(datetime,'usa'),get_format(datetime,'iso')) then
insert into t1 values(i,a,null,null,DATE_FORMAT('2012-10-10 15:12:40',a));
else 
insert into t1 values(i,a,null,DATE_FORMAT('15:12:40',a),null);
end if;
set i = i + 1;
end WHILE;
end;
//
CALL pro_test01(get_format(date,'eur'));
select * from t1;
id	name	d	t	dt
1	%d.%m.%Y	2010-10-20	NULL	NULL
2	%d.%m.%Y	2010-10-20	NULL	NULL
3	%d.%m.%Y	2010-10-20	NULL	NULL
4	%d.%m.%Y	2010-10-20	NULL	NULL
5	%d.%m.%Y	2010-10-20	NULL	NULL
CALL pro_test01(get_format(datetime,'jis'));
select * from t1;
id	name	d	t	dt
1	%d.%m.%Y	2010-10-20	NULL	NULL
2	%d.%m.%Y	2010-10-20	NULL	NULL
3	%d.%m.%Y	2010-10-20	NULL	NULL
4	%d.%m.%Y	2010-10-20	NULL	NULL
5	%d.%m.%Y	2010-10-20	NULL	NULL
1	%Y-%m-%d %H:%i:%s	NULL	NULL	2012-10-10 15:12:40
2	%Y-%m-%d %H:%i:%s	NULL	NULL	2012-10-10 15:12:40
3	%Y-%m-%d %H:%i:%s	NULL	NULL	2012-10-10 15:12:40
4	%Y-%m-%d %H:%i:%s	NULL	NULL	2012-10-10 15:12:40
5	%Y-%m-%d %H:%i:%s	NULL	NULL	2012-10-10 15:12:40
CALL pro_test01(get_format(time,'iso'));
ERROR 22007: Incorrect datetime value for column 't' at row 1
DROP PROCEDURE pro_test02;
CREATE  PROCEDURE pro_test02(in a varchar(30) ,out b varchar(30))
begin
declare d varchar(30);
set d=a;
select d into b;
end;
//
CALL pro_test02(get_format(date,'jis'),@bb);
select @bb;
@bb
%Y-%m-%d
CALL pro_test02(get_format(datetime,'internal'),@cc);
select @cc;
@cc
%Y%m%d%H%i%s
CALL pro_test02(get_format(time,'usa'),@dd);
select @dd;
@dd
%h:%i:%s %p
drop table t1;
create table t1(id int,name varchar(30),d date,t time, dt datetime);
drop function  fn_test1;
create function fn_test1(aa  varchar(30) ) returns varchar(30)
begin
declare bb varchar(30) ;
declare cc varchar(30);
declare dd varchar(30);
set @i=1;
if aa =get_format(date,'jis') then
select aa into cc;
return(cc);
elseif aa=get_format(datetime,'eur') then
select aa into dd;
return(dd);
else
while @i <= 5 DO
insert into t1 values(@i, aa,str_to_date('2020-12-12 14:15:00',aa),str_to_date('2020-12-12 14:15:00',aa),str_to_date('2020-12-12 14:15:00',aa));
insert into t1 values(@i+1, aa,FROM_UNIXTIME(1600000000,aa),FROM_UNIXTIME(17000000000,aa),FROM_UNIXTIME(18000000000,aa));
set @i=@i+1;
end while;
select aa into bb;
return(bb);
end if;
end;
//
select fn_test1(get_format(date,'jis'));
fn_test1(get_format(date,'jis'))
%Y-%m-%d
select fn_test1(get_format(datetime,'eur'));
fn_test1(get_format(datetime,'eur'))
%Y-%m-%d %H.%i.%s
select fn_test1(get_format(time,'jis'));
ERROR HY000: Incorrect datetime value: '2020-12-12 14:15:00' for function str_to_date
select fn_test1(get_format(datetime,'iso'));
fn_test1(get_format(datetime,'iso'))
%Y-%m-%d %H:%i:%s
select * from t1;
id	name	d	t	dt
1	%Y-%m-%d %H:%i:%s	2020-12-12	14:15:00	2020-12-12 14:15:00
2	%Y-%m-%d %H:%i:%s	2020-09-13	14:13:20	2540-05-25 16:00:00
2	%Y-%m-%d %H:%i:%s	2020-12-12	14:15:00	2020-12-12 14:15:00
3	%Y-%m-%d %H:%i:%s	2020-09-13	14:13:20	2540-05-25 16:00:00
3	%Y-%m-%d %H:%i:%s	2020-12-12	14:15:00	2020-12-12 14:15:00
4	%Y-%m-%d %H:%i:%s	2020-09-13	14:13:20	2540-05-25 16:00:00
4	%Y-%m-%d %H:%i:%s	2020-12-12	14:15:00	2020-12-12 14:15:00
5	%Y-%m-%d %H:%i:%s	2020-09-13	14:13:20	2540-05-25 16:00:00
5	%Y-%m-%d %H:%i:%s	2020-12-12	14:15:00	2020-12-12 14:15:00
6	%Y-%m-%d %H:%i:%s	2020-09-13	14:13:20	2540-05-25 16:00:00
drop function  fn_test1;
obmysql-get_format-5 字符集交集
SET NAMES gbk;
select length(get_format(datetime,'eur'));
length(get_format(datetime,'eur'))
17
select length(get_format(datetime,'jis'));
length(get_format(datetime,'jis'))
17
select length(get_format(datetime,'iso'));
length(get_format(datetime,'iso'))
17
select length(get_format(datetime,'internal'));
length(get_format(datetime,'internal'))
12
select length(get_format(date,'usa'));
length(get_format(date,'usa'))
8
select length(get_format(date,'eur'));
length(get_format(date,'eur'))
8
select length(get_format(date,'jis'));
length(get_format(date,'jis'))
8
select length(get_format(date,'iso'));
length(get_format(date,'iso'))
8
select length(get_format(date,'internal'));
length(get_format(date,'internal'))
6
select length(get_format(date,'usa'));
length(get_format(date,'usa'))
8
select length(get_format(time,'eur'));
length(get_format(time,'eur'))
8
select length(get_format(time,'jis'));
length(get_format(time,'jis'))
8
select length(get_format(time,'iso'));
length(get_format(time,'iso'))
8
select length(get_format(time,'internal'));
length(get_format(time,'internal'))
6
select length(get_format(time,'usa'));
length(get_format(time,'usa'))
11
select length(get_format(timestamp,'eur'));
length(get_format(timestamp,'eur'))
17
select length(get_format(timestamp,'jis'));
length(get_format(timestamp,'jis'))
17
select length(get_format(timestamp,'iso'));
length(get_format(timestamp,'iso'))
17
select length(get_format(timestamp,'internal'));
length(get_format(timestamp,'internal'))
12
select length(get_format(timestamp,'usa'));
length(get_format(timestamp,'usa'))
17
select collation(get_format(datetime,'eur'));
collation(get_format(datetime,'eur'))
gbk_chinese_ci
select collation(get_format(datetime,'jis'));
collation(get_format(datetime,'jis'))
gbk_chinese_ci
select collation(get_format(datetime,'iso'));
collation(get_format(datetime,'iso'))
gbk_chinese_ci
select collation(get_format(datetime,'internal'));
collation(get_format(datetime,'internal'))
gbk_chinese_ci
select collation(get_format(date,'usa'));
collation(get_format(date,'usa'))
gbk_chinese_ci
select collation(get_format(date,'eur'));
collation(get_format(date,'eur'))
gbk_chinese_ci
select collation(get_format(date,'jis'));
collation(get_format(date,'jis'))
gbk_chinese_ci
select collation(get_format(date,'iso'));
collation(get_format(date,'iso'))
gbk_chinese_ci
select collation(get_format(date,'internal'));
collation(get_format(date,'internal'))
gbk_chinese_ci
select collation(get_format(date,'usa'));
collation(get_format(date,'usa'))
gbk_chinese_ci
select collation(get_format(time,'eur'));
collation(get_format(time,'eur'))
gbk_chinese_ci
select collation(get_format(time,'jis'));
collation(get_format(time,'jis'))
gbk_chinese_ci
select collation(get_format(time,'iso'));
collation(get_format(time,'iso'))
gbk_chinese_ci
select collation(get_format(time,'internal'));
collation(get_format(time,'internal'))
gbk_chinese_ci
select collation(get_format(timestamp,'usa'));
collation(get_format(timestamp,'usa'))
gbk_chinese_ci
select collation(get_format(timestamp,'eur'));
collation(get_format(timestamp,'eur'))
gbk_chinese_ci
select collation(get_format(timestamp,'jis'));
collation(get_format(timestamp,'jis'))
gbk_chinese_ci
select collation(get_format(timestamp,'iso'));
collation(get_format(timestamp,'iso'))
gbk_chinese_ci
select collation(get_format(timestamp,'internal'));
collation(get_format(timestamp,'internal'))
gbk_chinese_ci
select collation(get_format(timestamp,'usa'));
collation(get_format(timestamp,'usa'))
gbk_chinese_ci
select get_format(datetime,'eur');
get_format(datetime,'eur')
%Y-%m-%d %H.%i.%s
select get_format(datetime,'jis');
get_format(datetime,'jis')
%Y-%m-%d %H:%i:%s
select get_format(datetime,'usa');
get_format(datetime,'usa')
%Y-%m-%d %H.%i.%s
select get_format(datetime,'iso');
get_format(datetime,'iso')
%Y-%m-%d %H:%i:%s
select get_format(datetime,'internal');
get_format(datetime,'internal')
%Y%m%d%H%i%s
select get_format(datetime,'eur');
get_format(datetime,'eur')
%Y-%m-%d %H.%i.%s
select get_format(date,'jis');
get_format(date,'jis')
%Y-%m-%d
select get_format(date,'usa');
get_format(date,'usa')
%m.%d.%Y
select get_format(date,'iso');
get_format(date,'iso')
%Y-%m-%d
select get_format(date,'internal');
get_format(date,'internal')
%Y%m%d
select get_format(time,'eur');
get_format(time,'eur')
%H.%i.%s
select get_format(time,'jis');
get_format(time,'jis')
%H:%i:%s
select get_format(time,'usa');
get_format(time,'usa')
%h:%i:%s %p
select get_format(time,'iso');
get_format(time,'iso')
%H:%i:%s
select get_format(time,'internal');
get_format(time,'internal')
%H%i%s
select get_format(timestamp,'eur');
get_format(timestamp,'eur')
%Y-%m-%d %H.%i.%s
select get_format(timestamp,'jis');
get_format(timestamp,'jis')
%Y-%m-%d %H:%i:%s
select get_format(timestamp,'usa');
get_format(timestamp,'usa')
%Y-%m-%d %H.%i.%s
select get_format(timestamp,'iso');
get_format(timestamp,'iso')
%Y-%m-%d %H:%i:%s
select get_format(timestamp,'internal');
get_format(timestamp,'internal')
%Y%m%d%H%i%s
SET NAMES utf16;
ERROR 42000: Variable 'character_set_client' can't be set to the value of 'utf16'
SET NAMES gb18030;
select length(get_format(datetime,'eur'));
length(get_format(datetime,'eur'))
17
select length(get_format(datetime,'jis'));
length(get_format(datetime,'jis'))
17
select length(get_format(datetime,'iso'));
length(get_format(datetime,'iso'))
17
select length(get_format(datetime,'internal'));
length(get_format(datetime,'internal'))
12
select length(get_format(date,'usa'));
length(get_format(date,'usa'))
8
select length(get_format(date,'eur'));
length(get_format(date,'eur'))
8
select length(get_format(date,'jis'));
length(get_format(date,'jis'))
8
select length(get_format(date,'iso'));
length(get_format(date,'iso'))
8
select length(get_format(date,'internal'));
length(get_format(date,'internal'))
6
select length(get_format(date,'usa'));
length(get_format(date,'usa'))
8
select length(get_format(time,'eur'));
length(get_format(time,'eur'))
8
select length(get_format(time,'jis'));
length(get_format(time,'jis'))
8
select length(get_format(time,'iso'));
length(get_format(time,'iso'))
8
select length(get_format(time,'internal'));
length(get_format(time,'internal'))
6
select length(get_format(time,'usa'));
length(get_format(time,'usa'))
11
select collation(get_format(datetime,'eur'));
collation(get_format(datetime,'eur'))
gb18030_chinese_ci
select collation(get_format(datetime,'jis'));
collation(get_format(datetime,'jis'))
gb18030_chinese_ci
select collation(get_format(datetime,'iso'));
collation(get_format(datetime,'iso'))
gb18030_chinese_ci
select collation(get_format(datetime,'internal'));
collation(get_format(datetime,'internal'))
gb18030_chinese_ci
select collation(get_format(date,'usa'));
collation(get_format(date,'usa'))
gb18030_chinese_ci
select collation(get_format(date,'eur'));
collation(get_format(date,'eur'))
gb18030_chinese_ci
select collation(get_format(date,'jis'));
collation(get_format(date,'jis'))
gb18030_chinese_ci
select collation(get_format(date,'iso'));
collation(get_format(date,'iso'))
gb18030_chinese_ci
select collation(get_format(date,'internal'));
collation(get_format(date,'internal'))
gb18030_chinese_ci
select collation(get_format(date,'usa'));
collation(get_format(date,'usa'))
gb18030_chinese_ci
select collation(get_format(time,'eur'));
collation(get_format(time,'eur'))
gb18030_chinese_ci
select collation(get_format(time,'jis'));
collation(get_format(time,'jis'))
gb18030_chinese_ci
select collation(get_format(time,'iso'));
collation(get_format(time,'iso'))
gb18030_chinese_ci
select collation(get_format(time,'internal'));
collation(get_format(time,'internal'))
gb18030_chinese_ci
select collation(get_format(time,'usa'));
collation(get_format(time,'usa'))
gb18030_chinese_ci
select get_format(datetime,'eur');
get_format(datetime,'eur')
%Y-%m-%d %H.%i.%s
select get_format(datetime,'jis');
get_format(datetime,'jis')
%Y-%m-%d %H:%i:%s
select get_format(datetime,'usa');
get_format(datetime,'usa')
%Y-%m-%d %H.%i.%s
select get_format(datetime,'iso');
get_format(datetime,'iso')
%Y-%m-%d %H:%i:%s
select get_format(datetime,'internal');
get_format(datetime,'internal')
%Y%m%d%H%i%s
select get_format(datetime,'eur');
get_format(datetime,'eur')
%Y-%m-%d %H.%i.%s
select get_format(date,'jis');
get_format(date,'jis')
%Y-%m-%d
select get_format(date,'usa');
get_format(date,'usa')
%m.%d.%Y
select get_format(date,'iso');
get_format(date,'iso')
%Y-%m-%d
select get_format(date,'internal');
get_format(date,'internal')
%Y%m%d
select get_format(time,'eur');
get_format(time,'eur')
%H.%i.%s
select get_format(time,'jis');
get_format(time,'jis')
%H:%i:%s
select get_format(time,'usa');
get_format(time,'usa')
%h:%i:%s %p
select get_format(time,'iso');
get_format(time,'iso')
%H:%i:%s
select get_format(time,'internal');
get_format(time,'internal')
%H%i%s
select collation(get_format(timestamp,'eur'));
collation(get_format(timestamp,'eur'))
gb18030_chinese_ci
select collation(get_format(timestamp,'jis'));
collation(get_format(timestamp,'jis'))
gb18030_chinese_ci
select collation(get_format(timestamp,'iso'));
collation(get_format(timestamp,'iso'))
gb18030_chinese_ci
select collation(get_format(timestamp,'internal'));
collation(get_format(timestamp,'internal'))
gb18030_chinese_ci
select collation(get_format(timestamp,'usa'));
collation(get_format(timestamp,'usa'))
gb18030_chinese_ci
select get_format(timestamp,'eur');
get_format(timestamp,'eur')
%Y-%m-%d %H.%i.%s
select get_format(timestamp,'jis');
get_format(timestamp,'jis')
%Y-%m-%d %H:%i:%s
select get_format(timestamp,'usa');
get_format(timestamp,'usa')
%Y-%m-%d %H.%i.%s
select get_format(timestamp,'iso');
get_format(timestamp,'iso')
%Y-%m-%d %H:%i:%s
select get_format(timestamp,'internal');
get_format(timestamp,'internal')
%Y%m%d%H%i%s
select length(get_format(timestamp,'eur'));
length(get_format(timestamp,'eur'))
17
select length(get_format(timestamp,'jis'));
length(get_format(timestamp,'jis'))
17
select length(get_format(timestamp,'iso'));
length(get_format(timestamp,'iso'))
17
select length(get_format(timestamp,'internal'));
length(get_format(timestamp,'internal'))
12
select length(get_format(timestamp,'usa'));
length(get_format(timestamp,'usa'))
17
SET NAMES utf8;
select length(get_format(datetime,'eur'));
length(get_format(datetime,'eur'))
17
select length(get_format(datetime,'jis'));
length(get_format(datetime,'jis'))
17
select length(get_format(datetime,'iso'));
length(get_format(datetime,'iso'))
17
select length(get_format(datetime,'internal'));
length(get_format(datetime,'internal'))
12
select length(get_format(date,'usa'));
length(get_format(date,'usa'))
8
select length(get_format(date,'eur'));
length(get_format(date,'eur'))
8
select length(get_format(date,'jis'));
length(get_format(date,'jis'))
8
select length(get_format(date,'iso'));
length(get_format(date,'iso'))
8
select length(get_format(date,'internal'));
length(get_format(date,'internal'))
6
select length(get_format(date,'usa'));
length(get_format(date,'usa'))
8
select length(get_format(time,'eur'));
length(get_format(time,'eur'))
8
select length(get_format(time,'jis'));
length(get_format(time,'jis'))
8
select length(get_format(time,'iso'));
length(get_format(time,'iso'))
8
select length(get_format(time,'internal'));
length(get_format(time,'internal'))
6
select length(get_format(time,'usa'));
length(get_format(time,'usa'))
11
select collation(get_format(datetime,'eur'));
collation(get_format(datetime,'eur'))
utf8mb4_general_ci
select collation(get_format(datetime,'jis'));
collation(get_format(datetime,'jis'))
utf8mb4_general_ci
select collation(get_format(datetime,'iso'));
collation(get_format(datetime,'iso'))
utf8mb4_general_ci
select collation(get_format(datetime,'internal'));
collation(get_format(datetime,'internal'))
utf8mb4_general_ci
select collation(get_format(date,'usa'));
collation(get_format(date,'usa'))
utf8mb4_general_ci
select collation(get_format(date,'eur'));
collation(get_format(date,'eur'))
utf8mb4_general_ci
select collation(get_format(date,'jis'));
collation(get_format(date,'jis'))
utf8mb4_general_ci
select collation(get_format(date,'iso'));
collation(get_format(date,'iso'))
utf8mb4_general_ci
select collation(get_format(date,'internal'));
collation(get_format(date,'internal'))
utf8mb4_general_ci
select collation(get_format(date,'usa'));
collation(get_format(date,'usa'))
utf8mb4_general_ci
select collation(get_format(time,'eur'));
collation(get_format(time,'eur'))
utf8mb4_general_ci
select collation(get_format(time,'jis'));
collation(get_format(time,'jis'))
utf8mb4_general_ci
select collation(get_format(time,'iso'));
collation(get_format(time,'iso'))
utf8mb4_general_ci
select collation(get_format(time,'internal'));
collation(get_format(time,'internal'))
utf8mb4_general_ci
select collation(get_format(time,'usa'));
collation(get_format(time,'usa'))
utf8mb4_general_ci
select get_format(datetime,'eur');
get_format(datetime,'eur')
%Y-%m-%d %H.%i.%s
select get_format(datetime,'jis');
get_format(datetime,'jis')
%Y-%m-%d %H:%i:%s
select get_format(datetime,'usa');
get_format(datetime,'usa')
%Y-%m-%d %H.%i.%s
select get_format(datetime,'iso');
get_format(datetime,'iso')
%Y-%m-%d %H:%i:%s
select get_format(datetime,'internal');
get_format(datetime,'internal')
%Y%m%d%H%i%s
select get_format(datetime,'eur');
get_format(datetime,'eur')
%Y-%m-%d %H.%i.%s
select get_format(date,'jis');
get_format(date,'jis')
%Y-%m-%d
select get_format(date,'usa');
get_format(date,'usa')
%m.%d.%Y
select get_format(date,'iso');
get_format(date,'iso')
%Y-%m-%d
select get_format(date,'internal');
get_format(date,'internal')
%Y%m%d
select get_format(time,'eur');
get_format(time,'eur')
%H.%i.%s
select get_format(time,'jis');
get_format(time,'jis')
%H:%i:%s
select get_format(time,'usa');
get_format(time,'usa')
%h:%i:%s %p
select get_format(time,'iso');
get_format(time,'iso')
%H:%i:%s
select get_format(time,'internal');
get_format(time,'internal')
%H%i%s
select collation(get_format(timestamp,'eur'));
collation(get_format(timestamp,'eur'))
utf8mb4_general_ci
select collation(get_format(timestamp,'jis'));
collation(get_format(timestamp,'jis'))
utf8mb4_general_ci
select collation(get_format(timestamp,'iso'));
collation(get_format(timestamp,'iso'))
utf8mb4_general_ci
select collation(get_format(timestamp,'internal'));
collation(get_format(timestamp,'internal'))
utf8mb4_general_ci
select collation(get_format(timestamp,'usa'));
collation(get_format(timestamp,'usa'))
utf8mb4_general_ci
select get_format(timestamp,'eur');
get_format(timestamp,'eur')
%Y-%m-%d %H.%i.%s
select get_format(timestamp,'jis');
get_format(timestamp,'jis')
%Y-%m-%d %H:%i:%s
select get_format(timestamp,'usa');
get_format(timestamp,'usa')
%Y-%m-%d %H.%i.%s
select get_format(timestamp,'iso');
get_format(timestamp,'iso')
%Y-%m-%d %H:%i:%s
select get_format(timestamp,'internal');
get_format(timestamp,'internal')
%Y%m%d%H%i%s
select length(get_format(timestamp,'eur'));
length(get_format(timestamp,'eur'))
17
select length(get_format(timestamp,'jis'));
length(get_format(timestamp,'jis'))
17
select length(get_format(timestamp,'iso'));
length(get_format(timestamp,'iso'))
17
select length(get_format(timestamp,'internal'));
length(get_format(timestamp,'internal'))
12
select length(get_format(timestamp,'usa'));
length(get_format(timestamp,'usa'))
17
alter database oblrp character set gbk;
use oblrp;
select get_format(datetime,'eur');
get_format(datetime,'eur')
%Y-%m-%d %H.%i.%s
select get_format(datetime,'jis');
get_format(datetime,'jis')
%Y-%m-%d %H:%i:%s
select get_format(datetime,'usa');
get_format(datetime,'usa')
%Y-%m-%d %H.%i.%s
select get_format(datetime,'iso');
get_format(datetime,'iso')
%Y-%m-%d %H:%i:%s
select get_format(datetime,'internal');
get_format(datetime,'internal')
%Y%m%d%H%i%s
select get_format(datetime,'eur');
get_format(datetime,'eur')
%Y-%m-%d %H.%i.%s
select get_format(date,'jis');
get_format(date,'jis')
%Y-%m-%d
select get_format(date,'usa');
get_format(date,'usa')
%m.%d.%Y
select get_format(date,'iso');
get_format(date,'iso')
%Y-%m-%d
select get_format(date,'internal');
get_format(date,'internal')
%Y%m%d
select get_format(time,'eur');
get_format(time,'eur')
%H.%i.%s
select get_format(time,'jis');
get_format(time,'jis')
%H:%i:%s
select get_format(time,'usa');
get_format(time,'usa')
%h:%i:%s %p
select get_format(time,'iso');
get_format(time,'iso')
%H:%i:%s
select get_format(time,'internal');
get_format(time,'internal')
%H%i%s
select get_format(timestamp,'eur');
get_format(timestamp,'eur')
%Y-%m-%d %H.%i.%s
select get_format(timestamp,'jis');
get_format(timestamp,'jis')
%Y-%m-%d %H:%i:%s
select get_format(timestamp,'usa');
get_format(timestamp,'usa')
%Y-%m-%d %H.%i.%s
select get_format(timestamp,'iso');
get_format(timestamp,'iso')
%Y-%m-%d %H:%i:%s
select get_format(timestamp,'internal');
get_format(timestamp,'internal')
%Y%m%d%H%i%s
drop table t1;
create table t1 (a varchar(20))DEFAULT CHARACTER SET = gbk;
insert into t1 values('eur'),('internal'),('usa'),('iso'),('jis');
select get_format(datetime,a) from t1 ;
get_format(datetime,a)
%Y-%m-%d %H.%i.%s
%Y%m%d%H%i%s
%Y-%m-%d %H.%i.%s
%Y-%m-%d %H:%i:%s
%Y-%m-%d %H:%i:%s
select get_format(date,a) from t1;
get_format(date,a)
%d.%m.%Y
%Y%m%d
%m.%d.%Y
%Y-%m-%d
%Y-%m-%d
select get_format(time,a) from t1;
get_format(time,a)
%H.%i.%s
%H%i%s
%h:%i:%s %p
%H:%i:%s
%H:%i:%s
drop table t1;
create table t1 (a varchar(20))DEFAULT CHARACTER SET = utf16;
insert into t1 values('eur'),('internal'),('usa'),('iso'),('jis');
select get_format(datetime,a) from t1 ;
get_format(datetime,a)
%Y-%m-%d %H.%i.%s
%Y%m%d%H%i%s
%Y-%m-%d %H.%i.%s
%Y-%m-%d %H:%i:%s
%Y-%m-%d %H:%i:%s
select get_format(date,a) from t1;
get_format(date,a)
%d.%m.%Y
%Y%m%d
%m.%d.%Y
%Y-%m-%d
%Y-%m-%d
select get_format(time,a) from t1;
get_format(time,a)
%H.%i.%s
%H%i%s
%h:%i:%s %p
%H:%i:%s
%H:%i:%s
select get_format(timestamp,a) from t1;
get_format(timestamp,a)
%Y-%m-%d %H.%i.%s
%Y%m%d%H%i%s
%Y-%m-%d %H.%i.%s
%Y-%m-%d %H:%i:%s
%Y-%m-%d %H:%i:%s
drop table t1;
create table t1 (a varchar(20))DEFAULT CHARACTER SET = gb18030;
insert into t1 values('eur'),('internal'),('usa'),('iso'),('jis');
select get_format(datetime,a) from t1 ;
get_format(datetime,a)
%Y-%m-%d %H.%i.%s
%Y%m%d%H%i%s
%Y-%m-%d %H.%i.%s
%Y-%m-%d %H:%i:%s
%Y-%m-%d %H:%i:%s
select get_format(date,a) from t1;
get_format(date,a)
%d.%m.%Y
%Y%m%d
%m.%d.%Y
%Y-%m-%d
%Y-%m-%d
select get_format(time,a) from t1;
get_format(time,a)
%H.%i.%s
%H%i%s
%h:%i:%s %p
%H:%i:%s
%H:%i:%s
select get_format(timestamp,a) from t1;
get_format(timestamp,a)
%Y-%m-%d %H.%i.%s
%Y%m%d%H%i%s
%Y-%m-%d %H.%i.%s
%Y-%m-%d %H:%i:%s
%Y-%m-%d %H:%i:%s
drop table t1;
create table t1 (a varchar(20))DEFAULT CHARACTER SET = utf8;
insert into t1 values('eur'),('internal'),('usa'),('iso'),('jis');
select get_format(datetime,a) from t1 ;
get_format(datetime,a)
%Y-%m-%d %H.%i.%s
%Y%m%d%H%i%s
%Y-%m-%d %H.%i.%s
%Y-%m-%d %H:%i:%s
%Y-%m-%d %H:%i:%s
select get_format(date,a) from t1;
get_format(date,a)
%d.%m.%Y
%Y%m%d
%m.%d.%Y
%Y-%m-%d
%Y-%m-%d
select get_format(time,a) from t1;
get_format(time,a)
%H.%i.%s
%H%i%s
%h:%i:%s %p
%H:%i:%s
%H:%i:%s
select get_format(timestamp,a) from t1;
get_format(timestamp,a)
%Y-%m-%d %H.%i.%s
%Y%m%d%H%i%s
%Y-%m-%d %H.%i.%s
%Y-%m-%d %H:%i:%s
%Y-%m-%d %H:%i:%s
drop table t1;
create table t1 (a varchar(20) collate utf8_bin)DEFAULT CHARACTER SET = utf8;
insert into t1 values('eur'),('internal'),('usa'),('iso'),('jis');
select get_format(datetime,a) from t1 ;
get_format(datetime,a)
%Y-%m-%d %H.%i.%s
%Y%m%d%H%i%s
%Y-%m-%d %H.%i.%s
%Y-%m-%d %H:%i:%s
%Y-%m-%d %H:%i:%s
select get_format(date,a) from t1;
get_format(date,a)
%d.%m.%Y
%Y%m%d
%m.%d.%Y
%Y-%m-%d
%Y-%m-%d
select get_format(time,a) from t1;
get_format(time,a)
%H.%i.%s
%H%i%s
%h:%i:%s %p
%H:%i:%s
%H:%i:%s
select get_format(timestamp,a) from t1;
get_format(timestamp,a)
%Y-%m-%d %H.%i.%s
%Y%m%d%H%i%s
%Y-%m-%d %H.%i.%s
%Y-%m-%d %H:%i:%s
%Y-%m-%d %H:%i:%s
drop table t1;
create table t1 (a varchar(20) collate gbk_bin);
insert into t1 values('eur'),('internal'),('usa'),('iso'),('jis');
select get_format(datetime,a) from t1 ;
get_format(datetime,a)
%Y-%m-%d %H.%i.%s
%Y%m%d%H%i%s
%Y-%m-%d %H.%i.%s
%Y-%m-%d %H:%i:%s
%Y-%m-%d %H:%i:%s
select get_format(date,a) from t1;
get_format(date,a)
%d.%m.%Y
%Y%m%d
%m.%d.%Y
%Y-%m-%d
%Y-%m-%d
select get_format(time,a) from t1;
get_format(time,a)
%H.%i.%s
%H%i%s
%h:%i:%s %p
%H:%i:%s
%H:%i:%s
select get_format(timestamp,a) from t1;
get_format(timestamp,a)
%Y-%m-%d %H.%i.%s
%Y%m%d%H%i%s
%Y-%m-%d %H.%i.%s
%Y-%m-%d %H:%i:%s
%Y-%m-%d %H:%i:%s
drop table t1;
create table t1 (a varchar(20) collate utf16_bin);
insert into t1 values('eur'),('internal'),('usa'),('iso'),('jis');
select get_format(datetime,a) from t1 ;
get_format(datetime,a)
%Y-%m-%d %H.%i.%s
%Y%m%d%H%i%s
%Y-%m-%d %H.%i.%s
%Y-%m-%d %H:%i:%s
%Y-%m-%d %H:%i:%s
select get_format(date,a) from t1;
get_format(date,a)
%d.%m.%Y
%Y%m%d
%m.%d.%Y
%Y-%m-%d
%Y-%m-%d
select get_format(time,a) from t1;
get_format(time,a)
%H.%i.%s
%H%i%s
%h:%i:%s %p
%H:%i:%s
%H:%i:%s
select get_format(timestamp,a) from t1;
get_format(timestamp,a)
%Y-%m-%d %H.%i.%s
%Y%m%d%H%i%s
%Y-%m-%d %H.%i.%s
%Y-%m-%d %H:%i:%s
%Y-%m-%d %H:%i:%s
drop table t1;
create table t1 (a varchar(20) collate gb18030_bin);
insert into t1 values('eur'),('internal'),('usa'),('iso'),('jis');
select get_format(datetime,a) from t1 ;
get_format(datetime,a)
%Y-%m-%d %H.%i.%s
%Y%m%d%H%i%s
%Y-%m-%d %H.%i.%s
%Y-%m-%d %H:%i:%s
%Y-%m-%d %H:%i:%s
select get_format(date,a) from t1;
get_format(date,a)
%d.%m.%Y
%Y%m%d
%m.%d.%Y
%Y-%m-%d
%Y-%m-%d
select get_format(time,a) from t1;
get_format(time,a)
%H.%i.%s
%H%i%s
%h:%i:%s %p
%H:%i:%s
%H:%i:%s
select get_format(timestamp,a) from t1;
get_format(timestamp,a)
%Y-%m-%d %H.%i.%s
%Y%m%d%H%i%s
%Y-%m-%d %H.%i.%s
%Y-%m-%d %H:%i:%s
%Y-%m-%d %H:%i:%s
drop table t1;
alter database oblrp character set utf8;
use oblrp;
select get_format(datetime,'eur');
get_format(datetime,'eur')
%Y-%m-%d %H.%i.%s
select get_format(datetime,'jis');
get_format(datetime,'jis')
%Y-%m-%d %H:%i:%s
select get_format(datetime,'usa');
get_format(datetime,'usa')
%Y-%m-%d %H.%i.%s
select get_format(datetime,'iso');
get_format(datetime,'iso')
%Y-%m-%d %H:%i:%s
select get_format(datetime,'internal');
get_format(datetime,'internal')
%Y%m%d%H%i%s
select get_format(datetime,'eur');
get_format(datetime,'eur')
%Y-%m-%d %H.%i.%s
select get_format(date,'jis');
get_format(date,'jis')
%Y-%m-%d
select get_format(date,'usa');
get_format(date,'usa')
%m.%d.%Y
select get_format(date,'iso');
get_format(date,'iso')
%Y-%m-%d
select get_format(date,'internal');
get_format(date,'internal')
%Y%m%d
select get_format(time,'eur');
get_format(time,'eur')
%H.%i.%s
select get_format(time,'jis');
get_format(time,'jis')
%H:%i:%s
select get_format(time,'usa');
get_format(time,'usa')
%h:%i:%s %p
select get_format(time,'iso');
get_format(time,'iso')
%H:%i:%s
select get_format(time,'internal');
get_format(time,'internal')
%H%i%s
select get_format(timestamp,'eur');
get_format(timestamp,'eur')
%Y-%m-%d %H.%i.%s
select get_format(timestamp,'jis');
get_format(timestamp,'jis')
%Y-%m-%d %H:%i:%s
select get_format(timestamp,'usa');
get_format(timestamp,'usa')
%Y-%m-%d %H.%i.%s
select get_format(timestamp,'iso');
get_format(timestamp,'iso')
%Y-%m-%d %H:%i:%s
select get_format(timestamp,'internal');
get_format(timestamp,'internal')
%Y%m%d%H%i%s
alter database oblrp character set utf16;
use oblrp;
select get_format(datetime,'eur');
get_format(datetime,'eur')
%Y-%m-%d %H.%i.%s
select get_format(datetime,'jis');
get_format(datetime,'jis')
%Y-%m-%d %H:%i:%s
select get_format(datetime,'usa');
get_format(datetime,'usa')
%Y-%m-%d %H.%i.%s
select get_format(datetime,'iso');
get_format(datetime,'iso')
%Y-%m-%d %H:%i:%s
select get_format(datetime,'internal');
get_format(datetime,'internal')
%Y%m%d%H%i%s
select get_format(datetime,'eur');
get_format(datetime,'eur')
%Y-%m-%d %H.%i.%s
select get_format(date,'jis');
get_format(date,'jis')
%Y-%m-%d
select get_format(date,'usa');
get_format(date,'usa')
%m.%d.%Y
select get_format(date,'iso');
get_format(date,'iso')
%Y-%m-%d
select get_format(date,'internal');
get_format(date,'internal')
%Y%m%d
select get_format(time,'eur');
get_format(time,'eur')
%H.%i.%s
select get_format(time,'jis');
get_format(time,'jis')
%H:%i:%s
select get_format(time,'usa');
get_format(time,'usa')
%h:%i:%s %p
select get_format(time,'iso');
get_format(time,'iso')
%H:%i:%s
select get_format(time,'internal');
get_format(time,'internal')
%H%i%s
select get_format(timestamp,'eur');
get_format(timestamp,'eur')
%Y-%m-%d %H.%i.%s
select get_format(timestamp,'jis');
get_format(timestamp,'jis')
%Y-%m-%d %H:%i:%s
select get_format(timestamp,'usa');
get_format(timestamp,'usa')
%Y-%m-%d %H.%i.%s
select get_format(timestamp,'iso');
get_format(timestamp,'iso')
%Y-%m-%d %H:%i:%s
select get_format(timestamp,'internal');
get_format(timestamp,'internal')
%Y%m%d%H%i%s
alter database oblrp character set gb18030;
use oblrp;
select get_format(datetime,'eur');
get_format(datetime,'eur')
%Y-%m-%d %H.%i.%s
select get_format(datetime,'jis');
get_format(datetime,'jis')
%Y-%m-%d %H:%i:%s
select get_format(datetime,'usa');
get_format(datetime,'usa')
%Y-%m-%d %H.%i.%s
select get_format(datetime,'iso');
get_format(datetime,'iso')
%Y-%m-%d %H:%i:%s
select get_format(datetime,'internal');
get_format(datetime,'internal')
%Y%m%d%H%i%s
select get_format(datetime,'eur');
get_format(datetime,'eur')
%Y-%m-%d %H.%i.%s
select get_format(date,'jis');
get_format(date,'jis')
%Y-%m-%d
select get_format(date,'usa');
get_format(date,'usa')
%m.%d.%Y
select get_format(date,'iso');
get_format(date,'iso')
%Y-%m-%d
select get_format(date,'internal');
get_format(date,'internal')
%Y%m%d
select get_format(time,'eur');
get_format(time,'eur')
%H.%i.%s
select get_format(time,'jis');
get_format(time,'jis')
%H:%i:%s
select get_format(time,'usa');
get_format(time,'usa')
%h:%i:%s %p
select get_format(time,'iso');
get_format(time,'iso')
%H:%i:%s
select get_format(time,'internal');
get_format(time,'internal')
%H%i%s
select get_format(timestamp,'eur');
get_format(timestamp,'eur')
%Y-%m-%d %H.%i.%s
select get_format(timestamp,'jis');
get_format(timestamp,'jis')
%Y-%m-%d %H:%i:%s
select get_format(timestamp,'usa');
get_format(timestamp,'usa')
%Y-%m-%d %H.%i.%s
select get_format(timestamp,'iso');
get_format(timestamp,'iso')
%Y-%m-%d %H:%i:%s
select get_format(timestamp,'internal');
get_format(timestamp,'internal')
%Y%m%d%H%i%s
########清空回收站，删除测试数据库，表等 ##########
drop database  IF EXISTS  oblrp;
purge recyclebin;
