drop database  IF EXISTS  oblrp;
create database oblrp;
use oblrp;
obmysql-utc_time-1
set timestamp = 1600000000.1421;
set ob_trx_timeout = 10000000000;
set ob_query_timeout = 10000000000;
select utc_time(),utc_time()+0;
utc_time()	utc_time()+0
12:26:40	122640
select utc_time(3),utc_time(1)+0;
utc_time(3)	utc_time(1)+0
12:26:40.142	122640.1
select utc_time(0);
utc_time(0)
12:26:40
select utc_time(1);
utc_time(1)
12:26:40.1
select utc_time(3);
utc_time(3)
12:26:40.142
select utc_time(6);
utc_time(6)
12:26:40.142100
select utc_time(7);
ERROR 42000: Too big precision 7 specified for column 'utc_time'. Maximum is 6.
select utc_time(0.6);
ERROR 42000: You have an error in your SQL syntax; check the manual that corresponds to your OceanBase version for the right syntax to use near '0.6)' at line 1
select utc_time(-1);
ERROR 42000: You have an error in your SQL syntax; check the manual that corresponds to your OceanBase version for the right syntax to use near '-1)' at line 1
select utc_time('a');
ERROR 42000: You have an error in your SQL syntax; check the manual that corresponds to your OceanBase version for the right syntax to use near ''a')' at line 1
select utc_time(abs(-3));
ERROR 42000: You have an error in your SQL syntax; check the manual that corresponds to your OceanBase version for the right syntax to use near 'abs(-3))' at line 1
select utc_time(0)+4;
utc_time(0)+4
122644
select utc_time(1)+1;
utc_time(1)+1
122641.1
select utc_time(3)+10;
utc_time(3)+10
122650.142
select utc_time(6)+50;
utc_time(6)+50
122690.142100
select utc_time(7)+0;
ERROR 42000: Too big precision 7 specified for column 'utc_time'. Maximum is 6.
select utc_time(0.6)+0;
ERROR 42000: You have an error in your SQL syntax; check the manual that corresponds to your OceanBase version for the right syntax to use near '0.6)+0' at line 1
select utc_time(-1)+0;
ERROR 42000: You have an error in your SQL syntax; check the manual that corresponds to your OceanBase version for the right syntax to use near '-1)+0' at line 1
select utc_time('a')+0;
ERROR 42000: You have an error in your SQL syntax; check the manual that corresponds to your OceanBase version for the right syntax to use near ''a')+0' at line 1
select utc_time(abs(-3))+0;
ERROR 42000: You have an error in your SQL syntax; check the manual that corresponds to your OceanBase version for the right syntax to use near 'abs(-3))+0' at line 1
select utc_time(6)+50,utc_time(3);
utc_time(6)+50	utc_time(3)
122690.142100	12:26:40.142
select utc_time(6)+2000000000000000;
utc_time(6)+2000000000000000
2000000000122640.142100
obmysql-utc_time-2 运算符
select +utc_time(6)
select -utc_time()+5265222;
-utc_time()+5265222
5142582
select utc_time(6)+1;
utc_time(6)+1
122641.142100
select utc_time(6)+0.23;
utc_time(6)+0.23
122640.372100
select utc_time(2)+0.23;
utc_time(2)+0.23
122640.37
select utc_time(3)+0.2345;
utc_time(3)+0.2345
122640.3765
select utc_time(0)-0;
utc_time(0)-0
122640
select utc_time(1)+9999999999999999999;
utc_time(1)+9999999999999999999
10000000000000122639.1
select utc_time()-9999999999999999999;
utc_time()-9999999999999999999
-9999999999999877359
select utc_time()-20210618;
utc_time()-20210618
-20087978
select utc_time()-'a';
utc_time()-'a'
122640
Warnings:
Warning	1292	Truncated incorrect DOUBLE value: 'a'
select utc_time(4)+'bb';
utc_time(4)+'bb'
122640.1421
Warnings:
Warning	1292	Truncated incorrect DOUBLE value: 'bb'
select utc_time();
utc_time()
12:26:40
select utc_time()+'2020-06-17';
utc_time()+'2020-06-17'
124660
Warnings:
Warning	1292	Truncated incorrect DOUBLE value: '2020-06-17'
select utc_time(3)+'10:44:20';
utc_time(3)+'10:44:20'
122650.142
Warnings:
Warning	1292	Truncated incorrect DOUBLE value: '10:44:20'
select utc_time(3)+utc_date();
utc_time(3)+utc_date()
20323553.142
select utc_time()+utc_time(1);
utc_time()+utc_time(1)
245280.1
select utc_time()+CURDATE();
utc_time()+CURDATE()
20323553
select utc_time()+CURRENT_TIMESTAMP(6);
utc_time()+CURRENT_TIMESTAMP(6)
20200913325280.142100
select utc_time(4)+current_time;
utc_time(4)+current_time
325280.1421
select utc_time(4)-curtime();
utc_time(4)-curtime()
-79999.8579
select utc_time(6)+DATE_ADD(NOW(), INTERVAL 5 DAY);
utc_time(6)+DATE_ADD(NOW(), INTERVAL 5 DAY)
20200918325280.142100
drop table t1;
create table t1(id int,name varchar(30), da DATE, dt DATETIME,  ti time, ts TIMESTAMP, b TINYBLOB);
insert into t1 values(1,'test','2021-06-18','2021-06-18 09:55:22.256456','10:55:22','2021-06-18 09:56:33.555555','blob');
select utc_time()-'2020-06-17';
utc_time()-'2020-06-17'
120620
Warnings:
Warning	1292	Truncated incorrect DOUBLE value: '2020-06-17'
select utc_time()-'11:22:13';
utc_time()-'11:22:13'
122629
Warnings:
Warning	1292	Truncated incorrect DOUBLE value: '11:22:13'
select utc_time(6)-CURRENT_DATE();
utc_time(6)-CURRENT_DATE()
-20078272.857900
select utc_time(1)-CURDATE();
utc_time(1)-CURDATE()
-20078272.9
select utc_time(3)-CURRENT_TIMESTAMP(6);
utc_time(3)-CURRENT_TIMESTAMP(6)
-20200913080000.000100
select utc_time()-DATE_ADD(NOW(), INTERVAL 5 DAY);
utc_time()-DATE_ADD(NOW(), INTERVAL 5 DAY)
-20200918080000
select 1+utc_time();
1+utc_time()
122641
select 1-utc_time();
1-utc_time()
-122639
select 122640-utc_time();
122640-utc_time()
0
select 20200913*utc_time();
20200913*utc_time()
2477439970320
select 122640/utc_time(3);
122640/utc_time(3)
1.0000
select 20200913%utc_time();
20200913%utc_time()
87953
select 20200913 div utc_time(2);
20200913 div utc_time(2)
164
select 20200913 mod utc_time(0);
20200913 mod utc_time(0)
87953
select utc_time(4)-current_time;
utc_time(4)-current_time
-79999.8579
select utc_time(4)+curtime();
utc_time(4)+curtime()
325280.1421
select utc_time(2)*0;
utc_time(2)*0
0.00
select utc_time()*10;
utc_time()*10
1226400
select utc_time()*'a';
utc_time()*'a'
0
Warnings:
Warning	1292	Truncated incorrect DOUBLE value: 'a'
select utc_time()*'14"25:20.222';
utc_time()*'14"25:20.222'
1716960
Warnings:
Warning	1292	Truncated incorrect DOUBLE value: '14"25:20.222'
select utc_time()*CURRENT_DATE();
utc_time()*CURRENT_DATE()
2477439970320
select utc_time()*CURDATE();
utc_time()*CURDATE()
2477439970320
select utc_time()*CURRENT_TIMESTAMP(6);
utc_time()*CURRENT_TIMESTAMP(6)
2477439995171787027.144000
select utc_time()*DATE_ADD(NOW(), INTERVAL 5 DAY);
utc_time()*DATE_ADD(NOW(), INTERVAL 5 DAY)
2477440608371769600
select (utc_time(2)+0)*CURDATE();
(utc_time(2)+0)*CURDATE()
2477442798447.82
select (utc_time(6)+9)*1000;
(utc_time(6)+9)*1000
122649142.100000
select (utc_time(4)+9)*-1000.632;
(utc_time(4)+9)*-1000.632
-122726656.3578072
select utc_time(5)*current_time;
utc_time(5)*current_time
24851798395.14400
select utc_time(4)*curtime();
utc_time(4)*curtime()
24851798395.1440
select utc_time(2)/0;
utc_time(2)/0
NULL
select utc_time(3)/10;
utc_time(3)/10
12264.0142000
select utc_time(1)/'a';
utc_time(1)/'a'
NULL
Warnings:
Warning	1292	Truncated incorrect DOUBLE value: 'a'
select utc_time(4)/'11:30:55.000';
utc_time(4)/'11:30:55.000'
11149.103827272727
Warnings:
Warning	1292	Truncated incorrect DOUBLE value: '11:30:55.000'
select utc_time()/CURRENT_DATE();
utc_time()/CURRENT_DATE()
0.0061
select utc_time(6)/CURDATE();
utc_time(6)/CURDATE()
0.0060710198
select utc_time(5)/CURRENT_TIMESTAMP(6);
utc_time(5)/CURRENT_TIMESTAMP(6)
0.000000006
select utc_time(3)/DATE_ADD(NOW(), INTERVAL 5 DAY);
utc_time(3)/DATE_ADD(NOW(), INTERVAL 5 DAY)
0.0000000
select (utc_time(0)+1)/CURRENT_DATE();
(utc_time(0)+1)/CURRENT_DATE()
0.0061
select (utc_time()+1)/50.55;
(utc_time()+1)/50.55
2426.1325
select (utc_time()+1)/-50.55;
(utc_time()+1)/-50.55
-2426.1325
select utc_time(5)/current_time;
utc_time(5)/current_time
0.605211913
select utc_time(4)/curtime();
utc_time(4)/curtime()
0.60521191
select utc_time()%0;
utc_time()%0
NULL
select utc_time()%10;
utc_time()%10
0
select utc_time()%'a';
utc_time()%'a'
NULL
Warnings:
Warning	1292	Truncated incorrect DOUBLE value: 'a'
select utc_time(4)%'11:35:40';
utc_time(4)%'11:35:40'
1.1420999999972992
Warnings:
Warning	1292	Truncated incorrect DOUBLE value: '11:35:40'
select utc_time(5)%CURRENT_DATE();
utc_time(5)%CURRENT_DATE()
122640.14210
select utc_time(6)%CURDATE();
utc_time(6)%CURDATE()
122640.142100
select utc_time(3)%CURRENT_TIMESTAMP(6);
utc_time(3)%CURRENT_TIMESTAMP(6)
122640.142000
select utc_time(2)%DATE_ADD(NOW(), INTERVAL 5 DAY);
utc_time(2)%DATE_ADD(NOW(), INTERVAL 5 DAY)
122640.14
select (utc_time(1)+0)%0;
(utc_time(1)+0)%0
NULL
select (utc_time(0)+0)%2;
(utc_time(0)+0)%2
0
select (utc_time()+0)%3.2;
(utc_time()+0)%3.2
0.0
select utc_time(5)%current_time;
utc_time(5)%current_time
122640.14210
select utc_time(4)%curtime();
utc_time(4)%curtime()
122640.1421
select utc_time(1) DIV 0;
utc_time(1) DIV 0
NULL
select utc_time(2) DIV 10;
utc_time(2) DIV 10
12264
select utc_time(3) DIV 'a';
utc_time(3) DIV 'a'
NULL
Warnings:
Warning	1292	Truncated incorrect DECIMAL value: 'a'
select utc_time(4) DIV '13:34:20';
utc_time(4) DIV '13:34:20'
9433
Warnings:
Warning	1292	Truncated incorrect DECIMAL value: '13:34:20'
select utc_time(5) DIV CURRENT_DATE();
utc_time(5) DIV CURRENT_DATE()
0
select utc_time(6) DIV CURDATE();
utc_time(6) DIV CURDATE()
0
select utc_time(0) DIV CURRENT_TIMESTAMP(6);
utc_time(0) DIV CURRENT_TIMESTAMP(6)
0
select utc_time() DIV DATE_ADD(NOW(), INTERVAL 5 DAY);
utc_time() DIV DATE_ADD(NOW(), INTERVAL 5 DAY)
0
select (utc_time()+0) DIV DATE_ADD(NOW(), INTERVAL 5 DAY);
(utc_time()+0) DIV DATE_ADD(NOW(), INTERVAL 5 DAY)
0
select (utc_time()+0) DIV -8;
(utc_time()+0) DIV -8
-15330
select utc_time(5) div current_time;
utc_time(5) div current_time
0
select utc_time(4) div curtime();
utc_time(4) div curtime()
0
select utc_time() MOD 0;
utc_time() MOD 0
NULL
select utc_time() MOD 10;
utc_time() MOD 10
0
select utc_time() MOD 'a';
utc_time() MOD 'a'
NULL
Warnings:
Warning	1292	Truncated incorrect DOUBLE value: 'a'
select utc_time(0) MOD '13:19:22.33';
utc_time(0) MOD '13:19:22.33'
11
Warnings:
Warning	1292	Truncated incorrect DOUBLE value: '13:19:22.33'
select utc_time(1) MOD CURRENT_DATE();
utc_time(1) MOD CURRENT_DATE()
122640.1
select utc_time(2) MOD CURDATE();
utc_time(2) MOD CURDATE()
122640.14
select utc_time(3) MOD CURRENT_TIMESTAMP(6);
utc_time(3) MOD CURRENT_TIMESTAMP(6)
122640.142000
select utc_time(4) MOD DATE_ADD(NOW(), INTERVAL 5 DAY);
utc_time(4) MOD DATE_ADD(NOW(), INTERVAL 5 DAY)
122640.1421
select (utc_time()+0) MOD CURRENT_TIMESTAMP(6);
(utc_time()+0) MOD CURRENT_TIMESTAMP(6)
122640.000000
select utc_time(5) div current_time;
utc_time(5) div current_time
0
select utc_time(4) div curtime();
utc_time(4) div curtime()
0
select utc_time() || utc_time()+0;
utc_time() || utc_time()+0
1
select utc_time()+0+1000;
utc_time()+0+1000
123640
select utc_time()-1-1000;
utc_time()-1-1000
121639
select (utc_time()-1)*1000;
(utc_time()-1)*1000
122639000
select (utc_time()-1)/1000;
(utc_time()-1)/1000
122.6390
select (utc_time(3)-1)%1000;
(utc_time(3)-1)%1000
639.142
select (utc_time()-1) DIV 1000;
(utc_time()-1) DIV 1000
122
select (utc_time()-1) MOD 1000;
(utc_time()-1) MOD 1000
639
select utc_time()|| utc_time();
utc_time()|| utc_time()
1
select utc_time(4)|| 'a';
utc_time(4)|| 'a'
1
select utc_time()|| 1000;
utc_time()|| 1000
1
select utc_time(6)|| '13:44:44';
utc_time(6)|| '13:44:44'
1
select utc_time()+1|| 'b';
utc_time()+1|| 'b'
1
select utc_time()+1|| DATE_FORMAT(utc_time(),GET_FORMAT(DATETIME,'EUR'));
utc_time()+1|| DATE_FORMAT(utc_time(),GET_FORMAT(DATETIME,'EUR'))
1
select utc_time()+1|| utc_time()+1 as a;
a
1
select utc_time()+1|| utc_time()+1;
utc_time()+1|| utc_time()+1
1
select utc_time()+1+ utc_time()+1;
utc_time()+1+ utc_time()+1
245282
select utc_time(5)+1- utc_time()+1;
utc_time(5)+1- utc_time()+1
2.14210
select (utc_time()+1)*(utc_time()+1);
(utc_time()+1)*(utc_time()+1)
15040814881
select (utc_time()+1)/(utc_time()+1);
(utc_time()+1)/(utc_time()+1)
1.0000
select (utc_time(2)+1)%(utc_time()+1);
(utc_time(2)+1)%(utc_time()+1)
0.14
select (utc_time()+1) MOD (utc_time()+1);
(utc_time()+1) MOD (utc_time()+1)
0
select (utc_time()+1) div (utc_time()+1);
(utc_time()+1) div (utc_time()+1)
1
set timestamp =322455421.5895;
select utc_time(3)+ utc_time();
utc_time(3)+ utc_time()
51402.589
select utc_time()- utc_time();
utc_time()- utc_time()
0
select utc_time(6)*utc_time();
utc_time(6)*utc_time()
660556551.739500
select utc_time()/utc_time();
utc_time()/utc_time()
1.0000
select utc_time()%utc_time();
utc_time()%utc_time()
0
select utc_time() MOD utc_time();
utc_time() MOD utc_time()
0
select utc_time() div utc_time();
utc_time() div utc_time()
1
select utc_time()+utc_time();
utc_time()+utc_time()
51402
select utc_time(5)+GET_FORMAT(DATETIME,'EUR');
utc_time(5)+GET_FORMAT(DATETIME,'EUR')
25701.5895
Warnings:
Warning	1292	Truncated incorrect DOUBLE value: '%Y-%m-%d %H.%i.%s'
select utc_time(4)-GET_FORMAT(DATETIME,'EUR');
utc_time(4)-GET_FORMAT(DATETIME,'EUR')
25701.5895
Warnings:
Warning	1292	Truncated incorrect DOUBLE value: '%Y-%m-%d %H.%i.%s'
select utc_time()=utc_time();
utc_time()=utc_time()
1
select utc_time(3)=utc_time();
utc_time(3)=utc_time()
0
select utc_time(6)=utc_time()+1;
utc_time(6)=utc_time()+1
0
select utc_time()+1=utc_time(5)+1;
utc_time()+1=utc_time(5)+1
0
select utc_time(3)<>utc_time();
utc_time(3)<>utc_time()
1
select utc_time()<>utc_time();
utc_time()<>utc_time()
0
select utc_time()<>utc_time(5)+1;
utc_time()<>utc_time(5)+1
1
select utc_time()+1<>utc_time()+1;
utc_time()+1<>utc_time()+1
0
select utc_time()+1<>utc_time(1)+1;
utc_time()+1<>utc_time(1)+1
1
select utc_time()<=>utc_time(2);
utc_time()<=>utc_time(2)
0
select utc_time(2)<=>utc_time(2);
utc_time(2)<=>utc_time(2)
1
select utc_time()<=>utc_time(6)+1;
utc_time()<=>utc_time(6)+1
0
select utc_time(3)+1<=>utc_time(3)+1;
utc_time(3)+1<=>utc_time(3)+1
1
select utc_time(6)<utc_time(6);
utc_time(6)<utc_time(6)
0
select utc_time(2)<utc_time(6);
utc_time(2)<utc_time(6)
1
select utc_time(3)<utc_time(2)+1;
utc_time(3)<utc_time(2)+1
1
select utc_time()+1<utc_time()+1;
utc_time()+1<utc_time()+1
0
select utc_time(0)+1<utc_time()+1;
utc_time(0)+1<utc_time()+1
0
select utc_time(3)<=utc_time(4);
utc_time(3)<=utc_time(4)
1
select utc_time(5)<=utc_time(1);
utc_time(5)<=utc_time(1)
0
select utc_time()<=utc_time()+1;
utc_time()<=utc_time()+1
1
select utc_time(4)+1<=utc_time()+1;
utc_time(4)+1<=utc_time()+1
0
select utc_time(6)>=utc_time(6);
utc_time(6)>=utc_time(6)
1
select utc_time(1)>=utc_time(4);
utc_time(1)>=utc_time(4)
0
select utc_time()>=utc_time()+1;
utc_time()>=utc_time()+1
0
select utc_time(4)+1>=utc_time(3)+1;
utc_time(4)+1>=utc_time(3)+1
1
select utc_time()>utc_time(5);
utc_time()>utc_time(5)
0
select utc_time(1)>utc_time(0);
utc_time(1)>utc_time(0)
1
select utc_time()>utc_time()+1;
utc_time()>utc_time()+1
0
select utc_time()+1>utc_time()+1;
utc_time()+1>utc_time()+1
0
select utc_time(3) between utc_time()-1 and utc_time(2)+9;
utc_time(3) between utc_time()-1 and utc_time(2)+9
1
select utc_time() between utc_time()+1 and utc_time()+9;
utc_time() between utc_time()+1 and utc_time()+9
0
select utc_time(2)-1 between utc_time(1) and utc_time(3)+9;
utc_time(2)-1 between utc_time(1) and utc_time(3)+9
0
select utc_time(1)+7 between utc_time()+1 and utc_time()+9;
utc_time(1)+7 between utc_time()+1 and utc_time()+9
1
select utc_time(2)-25699 in (1,2,3,4,5);
utc_time(2)-25699 in (1,2,3,4,5)
0
select utc_time()-25699 in (1,2,3,4,5);
utc_time()-25699 in (1,2,3,4,5)
1
select utc_time(2) in (1,2,3,4,5);
utc_time(2) in (1,2,3,4,5)
0
select utc_time(1) in (utc_time(1),utc_time(2)+1,utc_time()+2);
utc_time(1) in (utc_time(1),utc_time(2)+1,utc_time()+2)
1
select utc_time(3) in (utc_time(1),utc_time(2)+1,utc_time()+2);
utc_time(3) in (utc_time(1),utc_time(2)+1,utc_time()+2)
0
select utc_time()-1 in (utc_time(),utc_time()+1,utc_time()+2);
utc_time()-1 in (utc_time(),utc_time()+1,utc_time()+2)
0
select utc_time(3) in (utc_time()+1,utc_time()+2);
utc_time(3) in (utc_time()+1,utc_time()+2)
0
select utc_time(6)-1 in (utc_time(6)-5,utc_time(6)+1,utc_time(6)+2);
utc_time(6)-1 in (utc_time(6)-5,utc_time(6)+1,utc_time(6)+2)
0
select utc_time(6)-1 in (utc_time(6)-5,utc_time(6)-1,utc_time(6)+2);
utc_time(6)-1 in (utc_time(6)-5,utc_time(6)-1,utc_time(6)+2)
1
select utc_time(6)-1 in (utc_time(6)-5,utc_time(5)-1,utc_time(6)+2);
utc_time(6)-1 in (utc_time(6)-5,utc_time(5)-1,utc_time(6)+2)
1
select utc_time() in ('02:57:01','14:20:35');
utc_time() in ('02:57:01','14:20:35')
1
select utc_time(3) not in (utc_time(2),utc_time()+1,utc_time()+2);
utc_time(3) not in (utc_time(2),utc_time()+1,utc_time()+2)
1
select utc_time() not in (utc_time(),utc_time()+1,utc_time()+2);
utc_time() not in (utc_time(),utc_time()+1,utc_time()+2)
0
select utc_time(2)-1 not in (utc_time(2),utc_time(2)+1,utc_time(2)+2);
utc_time(2)-1 not in (utc_time(2),utc_time(2)+1,utc_time(2)+2)
1
select utc_time(5) not in (utc_time(5),utc_time()+2);
utc_time(5) not in (utc_time(5),utc_time()+2)
0
select utc_time()-1 not in (utc_time()-5,utc_time()+1,utc_time()+2);
utc_time()-1 not in (utc_time()-5,utc_time()+1,utc_time()+2)
1
select utc_time(3)-1  not in (utc_time(2)-5,utc_time(3)-1,utc_time(1)+2);
utc_time(3)-1  not in (utc_time(2)-5,utc_time(3)-1,utc_time(1)+2)
0
select utc_time(3) is NULL;
utc_time(3) is NULL
0
select utc_time(5)+0 is NULL;
utc_time(5)+0 is NULL
0
select utc_time(6)  like '02:5%';
utc_time(6)  like '02:5%'
1
select utc_time(4)+0  like utc_time(4);
utc_time(4)+0  like utc_time(4)
0
select utc_time(2)  like utc_time();
utc_time(2)  like utc_time()
0
select utc_time()  like utc_time();
utc_time()  like utc_time()
1
select utc_time(1)+0 not like '02%';
utc_time(1)+0 not like '02%'
1
select utc_time()+0 not  like utc_time();
utc_time()+0 not  like utc_time()
1
select utc_time(1) REGEXP utc_time(1);
utc_time(1) REGEXP utc_time(1)
1
select utc_time() REGEXP utc_time()+0;
utc_time() REGEXP utc_time()+0
0
select utc_time(2) REGEXP utc_time(3);
utc_time(2) REGEXP utc_time(3)
0
select utc_time()+0 REGEXP utc_time();
utc_time()+0 REGEXP utc_time()
0
select utc_time()+0 REGEXP utc_time()+0;
utc_time()+0 REGEXP utc_time()+0
1
select utc_time(3)&utc_time();
utc_time(3)&utc_time()
25701
select utc_time()+0&utc_time(4);
utc_time()+0&utc_time(4)
25701
select utc_time(2)+0&utc_time()+0;
utc_time(2)+0&utc_time()+0
25700
select utc_time()|utc_time();
utc_time()|utc_time()
25701
select utc_time(4)|utc_time(1)+1;
utc_time(4)|utc_time(1)+1
25703
select utc_time(1)+0|utc_time(1)+0;
utc_time(1)+0|utc_time(1)+0
25702
select utc_time()^utc_time();
utc_time()^utc_time()
0
select utc_time(3)^utc_time(4)+1;
utc_time(3)^utc_time(4)+1
1
select utc_time()+0^utc_time()+0;
utc_time()+0^utc_time()+0
51402
select utc_time(1)>>utc_time();
utc_time(1)>>utc_time()
0
select utc_time()>>utc_time(2)+1;
utc_time()>>utc_time(2)+1
0
select utc_time()+0>>utc_time(3)+0;
utc_time()+0>>utc_time(3)+0
0
select utc_time(1)<<utc_time(2);
utc_time(1)<<utc_time(2)
0
select utc_time(3)<<utc_time(2)+1;
utc_time(3)<<utc_time(2)+1
0
select utc_time(4)+0<<utc_time(5)+0;
utc_time(4)+0<<utc_time(5)+0
0
select ~utc_time();
~utc_time()
18446744073709525914
select ~utc_time(1)-10;
~utc_time(1)-10
18446744073709525904
select utc_time(2) and utc_time();
utc_time(2) and utc_time()
1
select utc_time()+1 and utc_time(4)-1;
utc_time()+1 and utc_time(4)-1
1
select utc_time() and utc_time(3)-1;
utc_time() and utc_time(3)-1
1
select utc_time(1) or utc_time();
utc_time(1) or utc_time()
1
select utc_time(0) or null;
utc_time(0) or null
1
select utc_time(3)+1 or null;
utc_time(3)+1 or null
1
select utc_time()+1 or utc_time()-1;
utc_time()+1 or utc_time()-1
1
select utc_time(6) or utc_time()-1;
utc_time(6) or utc_time()-1
1
select not utc_time(6)-1;
not utc_time(6)-1
0
select not utc_time(3);
not utc_time(3)
0
select !utc_time(3)-1;
!utc_time(3)-1
-1
select !utc_time(3);
!utc_time(3)
0
select utc_time(1) xor utc_time();
utc_time(1) xor utc_time()
0
select utc_time()+1 xor utc_time()-1;
utc_time()+1 xor utc_time()-1
0
select utc_time() xor utc_time(6)-1;
utc_time() xor utc_time(6)-1
0
drop table t1;
obmysql-utc_time-3 内置函数参数校验
--error 1064
select CURRENT_TIME(utc_time())
select CURRENT_TIME((utc_time()-25699));
ERROR 42000: You have an error in your SQL syntax; check the manual that corresponds to your OceanBase version for the right syntax to use near '(utc_time()-25699))' at line 1
select CURRENT_TIMESTAMP(utc_time()-25699);
ERROR 42000: You have an error in your SQL syntax; check the manual that corresponds to your OceanBase version for the right syntax to use near 'utc_time()-25699)' at line 1
select DATE_ADD(utc_time(6),INTERVAL 5 DAY);
DATE_ADD(utc_time(6),INTERVAL 5 DAY)
122:57:01.589500
select DATE_ADD(utc_time(1)+0,INTERVAL 5 DAY);
DATE_ADD(utc_time(1)+0,INTERVAL 5 DAY)
NULL
select DATE_FORMAT(utc_time(),GET_FORMAT(DATETIME,'EUR'));
select DATE_FORMAT(utc_time(4)+1,GET_FORMAT(DATETIME,'EUR'));
DATE_FORMAT(utc_time(4)+1,GET_FORMAT(DATETIME,'EUR'))
NULL
select DATE_SUB(utc_time()+1,INTERVAL 5 DAY);
DATE_SUB(utc_time()+1,INTERVAL 5 DAY)
NULL
select DATE_SUB(utc_time(1),INTERVAL 5 DAY);
DATE_SUB(utc_time(1),INTERVAL 5 DAY)
-117:02:58.5
select DATEDIFF(utc_time(1),utc_time());
DATEDIFF(utc_time(1),utc_time())
0
select DATEDIFF(utc_time()-1,utc_time());
DATEDIFF(utc_time()-1,utc_time())
NULL
select DATEDIFF(utc_time()-1,utc_time(3)+1);
DATEDIFF(utc_time()-1,utc_time(3)+1)
NULL
select DATEDIFF(utc_date(),utc_time());
DATEDIFF(utc_date(),utc_time())
0
select DATEDIFF(utc_time(6),utc_time(5));
DATEDIFF(utc_time(6),utc_time(5))
0
select EXTRACT(week from utc_time());
EXTRACT(week from utc_time())
11
select EXTRACT(week from utc_time(4));
EXTRACT(week from utc_time(4))
11
select EXTRACT(week from utc_time(3)-7);
EXTRACT(week from utc_time(3)-7)
NULL
select from_days(utc_time());
from_days(utc_time())
0070-05-14
select from_days(utc_time(6));
from_days(utc_time(6))
0070-05-14
select from_days(utc_time(3)-1);
from_days(utc_time(3)-1)
0070-05-14
select FROM_UNIXTIME(utc_time(3)-1,GET_FORMAT(DATETIME,'EUR'));
FROM_UNIXTIME(utc_time(3)-1,GET_FORMAT(DATETIME,'EUR'))
1970-01-01 15.08.20
select FROM_UNIXTIME(utc_time(),GET_FORMAT(DATETIME,'EUR'));
FROM_UNIXTIME(utc_time(),GET_FORMAT(DATETIME,'EUR'))
1970-01-01 15.08.21
select MONTH(utc_time(6));
MONTH(utc_time(6))
3
select MONTH(utc_time()+10);
MONTH(utc_time()+10)
NULL
Warnings:
Warning	5086	Not timestamp Can not cast varchar value to timestamp type
select now(utc_time()-25699);
ERROR 42000: You have an error in your SQL syntax; check the manual that corresponds to your OceanBase version for the right syntax to use near 'utc_time()-25699)' at line 1
select PERIOD_DIFF(utc_time()-15,utc_time());
PERIOD_DIFF(utc_time()-15,utc_time())
73
select PERIOD_DIFF(utc_time(),utc_time(5));
PERIOD_DIFF(utc_time(),utc_time(5))
0
select PERIOD_DIFF(utc_time(5),utc_time());
PERIOD_DIFF(utc_time(5),utc_time())
0
select PERIOD_DIFF(utc_time()-10,utc_time(4)+15);
PERIOD_DIFF(utc_time()-10,utc_time(4)+15)
62
select STR_TO_DATE(utc_time(6),GET_FORMAT(time,'ISO'));
STR_TO_DATE(utc_time(6),GET_FORMAT(time,'ISO'))
0000-00-00 02:57:01.000000
select STR_TO_DATE(utc_time()+0,GET_FORMAT(time,'ISO'));
STR_TO_DATE(utc_time()+0,GET_FORMAT(time,'ISO'))
NULL
Warnings:
Warning	1411	Incorrect datetime value: '25701' for function str_to_date
select STR_TO_DATE(utc_time(3)+0,GET_FORMAT(time,'ISO'));
STR_TO_DATE(utc_time(3)+0,GET_FORMAT(time,'ISO'))
NULL
Warnings:
Warning	1411	Incorrect datetime value: '25701.589' for function str_to_date
select time(utc_time(6));
time(utc_time(6))
02:57:01.589500
select time(utc_time()+0);
time(utc_time()+0)
02:57:01
select TIME_TO_USEC(utc_time());
TIME_TO_USEC(utc_time())
322426621000000
select TIME_TO_USEC(utc_time(5));
TIME_TO_USEC(utc_time(5))
322426621589500
select TIME_TO_USEC(utc_time()+0);
ERROR 42000: Invalid argument for time_to_usec()
select TIMEDIFF(utc_time()+1,utc_time(6));
TIMEDIFF(utc_time()+1,utc_time(6))
00:00:00.410500
select TIMEDIFF(utc_time(),utc_time());
TIMEDIFF(utc_time(),utc_time())
00:00:00
select TIMEDIFF(utc_time(4),utc_time());
TIMEDIFF(utc_time(4),utc_time())
00:00:00.5895
select TIMEDIFF(utc_time(6)-0,utc_time()+0);
TIMEDIFF(utc_time(6)-0,utc_time()+0)
00:00:00.589500
select TIMESTAMPADD(day, -5, utc_time(6));
TIMESTAMPADD(day, -5, utc_time(6))
1980-03-16 02:57:01.589500
select TIMESTAMPADD(day, -5, utc_time()+0);
TIMESTAMPADD(day, -5, utc_time()+0)
NULL
select TIMESTAMPDIFF(day,utc_time(3) , utc_time());
TIMESTAMPDIFF(day,utc_time(3) , utc_time())
0
select TIMESTAMPDIFF(day, utc_time(), utc_time()+0);
TIMESTAMPDIFF(day, utc_time(), utc_time()+0)
NULL
select TIMESTAMPDIFF(day, utc_time()-1, utc_time(3)+0);
TIMESTAMPDIFF(day, utc_time()-1, utc_time(3)+0)
NULL
select TO_DAYS(utc_time(3)+10);
TO_DAYS(utc_time(3)+10)
NULL
select TO_DAYS(utc_time(5));
TO_DAYS(utc_time(5))
723260
select USEC_TO_TIME(utc_time(3));
USEC_TO_TIME(utc_time(3))
1970-01-01 08:00:00.025701
select USEC_TO_TIME(utc_time()+1);
USEC_TO_TIME(utc_time()+1)
1970-01-01 08:00:00.025702
select UNIX_TIMESTAMP(utc_time());
UNIX_TIMESTAMP(utc_time())
322426621
select UNIX_TIMESTAMP(utc_time(2));
UNIX_TIMESTAMP(utc_time(2))
322426621.58
select UNIX_TIMESTAMP(utc_time(3)+1);
UNIX_TIMESTAMP(utc_time(3)+1)
0.000
select UTC_TIMESTAMP(utc_time());
ERROR 42000: You have an error in your SQL syntax; check the manual that corresponds to your OceanBase version for the right syntax to use near 'utc_time())' at line 1
select YEAR(utc_time(3));
YEAR(utc_time(3))
1980
select YEAR(utc_time()+10000);
YEAR(utc_time()+10000)
NULL
Warnings:
Warning	5086	Not timestamp Can not cast varchar value to timestamp type
select CONCAT(utc_time(3),utc_time(3));
CONCAT(utc_time(3),utc_time(3))
02:57:01.58902:57:01.589
select CONCAT(utc_time(),utc_time());
CONCAT(utc_time(),utc_time())
02:57:0102:57:01
select CONCAT(utc_time()+0,utc_time()-0);
CONCAT(utc_time()+0,utc_time()-0)
2570125701
select CONCAT_WS('_',utc_time(3),utc_time());
CONCAT_WS('_',utc_time(3),utc_time())
02:57:01.589_02:57:01
select FORMAT(utc_time(6),1);
FORMAT(utc_time(6),1)
25,701.6
select FORMAT(utc_time(),0);
FORMAT(utc_time(),0)
25,701
select FORMAT(utc_time(3)+1,1);
FORMAT(utc_time(3)+1,1)
25,702.6
select SUBSTR(utc_time(6),1,2);
SUBSTR(utc_time(6),1,2)
02
select SUBSTR(utc_time()+0,1,2);
SUBSTR(utc_time()+0,1,2)
25
select SUBSTRING(utc_time(),1,2);
SUBSTRING(utc_time(),1,2)
02
select SUBSTRING(utc_time(4),1,2);
SUBSTRING(utc_time(4),1,2)
02
select SUBSTRING(utc_time(6)+0,1);
SUBSTRING(utc_time(6)+0,1)
25701.589500
select TRIM(utc_time());
TRIM(utc_time())
02:57:01
select TRIM(utc_time(6));
TRIM(utc_time(6))
02:57:01.589500
select TRIM(utc_time(3)+0);
TRIM(utc_time(3)+0)
25701.589
select RTRIM(utc_time());
RTRIM(utc_time())
02:57:01
select RTRIM(utc_time(2));
RTRIM(utc_time(2))
02:57:01.58
select RTRIM(utc_time(6)+0);
RTRIM(utc_time(6)+0)
25701.589500
select ascii(utc_time());
ascii(utc_time())
48
select ascii(utc_time(2));
ascii(utc_time(2))
48
select ascii(utc_time(2)+1);
ascii(utc_time(2)+1)
50
select ORD(utc_time(4));
ORD(utc_time(4))
48
select ORD(utc_time()+1);
ORD(utc_time()+1)
50
select LENGTH(utc_time(6));
LENGTH(utc_time(6))
15
select LENGTH(utc_time()+1);
LENGTH(utc_time()+1)
5
select CHAR_LENGTH(utc_time(6));
CHAR_LENGTH(utc_time(6))
15
select CHAR_LENGTH(utc_time()+1);
CHAR_LENGTH(utc_time()+1)
5
select CHAR_LENGTH(utc_time(2)+1);
CHAR_LENGTH(utc_time(2)+1)
8
select UPPER(utc_time(6));
UPPER(utc_time(6))
02:57:01.589500
select UPPER(utc_time()+1);
UPPER(utc_time()+1)
25702
select lower(utc_time(5));
lower(utc_time(5))
02:57:01.58950
select LOWER(utc_time(3)+1);
LOWER(utc_time(3)+1)
25702.589
select HEX(utc_time());
HEX(utc_time())
30323A35373A3031
select HEX(utc_time(5));
HEX(utc_time(5))
30323A35373A30312E3538393530
select HEX(utc_time(0));
HEX(utc_time(0))
30323A35373A3031
select HEX(utc_time(6)+1);
HEX(utc_time(6)+1)
6467
select UNHEX(utc_time(5));
UNHEX(utc_time(5))
NULL
select UNHEX(utc_time());
UNHEX(utc_time())
NULL
select UNHEX(utc_time()+1);
UNHEX(utc_time()+1)
W
select MD5(utc_time(6));
MD5(utc_time(6))
6a20e50b92a868b591296db295c83f7c
select MD5(utc_time(3)+1);
MD5(utc_time(3)+1)
0289652e032353320aeba178be1bdd95
select INT2IP(utc_time());
INT2IP(utc_time())
0.0.100.101
select INT2IP(utc_time(3));
INT2IP(utc_time(3))
0.0.100.101
select INT2IP(utc_time()+1);
INT2IP(utc_time()+1)
0.0.100.102
SELECT 'utc_time()%' LIKE 'utc_time()%' ESCAPE 'utc_time()';
ERROR HY000: Incorrect arguments to ESCAPE
SELECT 'utc_time()+0%' LIKE 'utc_time()+1%' ESCAPE 'utc_time()';
ERROR HY000: Incorrect arguments to ESCAPE
SELECT utc_time(5) REGEXP utc_time(5);
utc_time(5) REGEXP utc_time(5)
1
SELECT utc_time(3)-1 REGEXP utc_time()-2;
utc_time(3)-1 REGEXP utc_time()-2
0
SELECT REPEAT(utc_time(), utc_time()-25699);
REPEAT(utc_time(), utc_time()-25699)
02:57:0102:57:01
SELECT REPEAT(utc_time(3), utc_time(6)-25699);
REPEAT(utc_time(3), utc_time(6)-25699)
02:57:01.58902:57:01.58902:57:01.589
SELECT REPEAT(utc_time()+0, utc_time()-25700);
REPEAT(utc_time()+0, utc_time()-25700)
25701
SELECT SPACE(utc_time(6)+0);
SPACE(utc_time(6)+0)
                                                                                                                                                                                                                                                                                                                                                                                                                                                                                                                                                                                                                                                                                                                                                                                                                                                                                                                                                                                                                                                                                                                                                                                                                                                                                                                                                                                                                                                                                                                                                                                                                                                                                                                                                                                                                                                                                                                                                                                                                                                                                                                                                                                                                                                                                                                                                                                                                                                                                                                                                                                                                                                                                                                                                                                                                                                                                                                                                                                                                                                                                                                                                                                                                                                                                                                                                                                                                                                                                                                                                                                                                                                                                                                                                                                                                                                                                                                                                                                                                                                                                                                                                                                                                                                                                                                                                                                                                                                                                                                                                                                                                                                                                                                                                                                                                                                                                                                                                                                                                                                                                                                                                                                                                                                                                                                                                                                                                                                                                                                                                                                                                                                                                                                                                                                                                                                                                                                                                                                                                                                                                                                                                                                                                                                                                                                                                                                                                                                                                                                                                                                                                                                                                                                                                                                                                                                                                                                                                                                                                                                                                                                                                                                                                                                                                                                                                                                                                                                                                                                                                                                                                                                                                                                                                                                                                                                                                                                                                                                                                                                                                                                                                                                                                                                                                                                                                                                                                                                                                                                                                                                                                                                                                                                                                                                                                                                                                                                                                                                                                                                                                                                                                                                                                                                                                                                                                                                                                                                                                                                                                                                                                                                                                                                                                                                                                                                                                                                                                                                                                                                                                                                                                                                                                                                                                                                                                                                                                                                                                                                                                                                                                                                                                                                                                                                                                                                                                                                                                                                                                                                                                                                                                                                                                                                                                                                                                                                                                                                                                                                                                                                                                                                                                                                                                                                                                                                                                                                                                                                                                                                                                                                                                                                                                                                                                                                                                                                                                                                                                                                                                                                                                                                                                                                                                                                                                                                                                                                                                                                                                                                                                                                                                                                                                                                                                                                                                                                                                                                                                                                                                                                                                                                                                                                                                                                                                                                                                                                                                                                                                                                                                                                                                                                                                                                                                                                                                                                                                                                                                                                                                                                                                                                                                                                                                                                                                                                                                                                                                                                                                                                                                                                                                                                                                                                                                                                                                                                                                                                                                                                                                                                                                                                                                                                                                                                                                                                                                                                                                                                                                                                                                                                                                                                                                                                                                                                                                                                                                                                                                                                                                                                                                                                                                                                                                                                                                                                                                                                                                                                                                                                                                                                                                                                                                                                                                                                                                                                                                                                                                                                                                                                                                                                                                                                                                                                                                                                                                                                                                                                                                                                                                                                                                                                                                                                                                                                                                                                                                                                                                                                                                                                                                                                                                                                                                                                                                                                                                                                                                                                                                                                                                                                                                                                                                                                                                                                                                                                                                                                                                                                                                                                                                                                                                                                                                                                                                                                                                                                                                                                                                                                                                                                                                                                                                                                                                                                                                                                                                                                                                                                                                                                                                                                                                                                                                                                                                                                                                                                                                                                                                                                                                                                                                                                                                                                                                                                                                                                                                                                                                                                                                                                                                                                                                                                                                                                                                                                                                                                                                                                                                                                                                                                                                                                                                                                                                                                                                                                                                                                                                                                                                                                                                                                                                                                                                                                                                                                                                                                                                                                                                                                                                                                                                                                                                                                                                                                                                                                                                                                                                                                                                                                                                                                                                                                                                                                                                                                                                                                                                                                                                                                                                                                                                                                                                                                                                                                                                                                                                                                                                                                                                                                                                                                                                                                                                                                                                                                                                                                                                                                                                                                                                                                                                                                                                                                                                                                                                                                                                                                                                                                                                                                                                                                                                                                                                                                                                                                                                                                                                                                                                                                                                                                                                                                                                                                                                                                                                                                                                                                                                                                                                                                                                                                                                                                                                                      
SELECT SPACE(utc_time());
SPACE(utc_time())
                                                                                                                                                                                                                                                                                                                                                                                                                                                                                                                                                                                                                                                                                                                                                                                                                                                                                                                                                                                                                                                                                                                                                                                                                                                                                                                                                                                                                                                                                                                                                                                                                                                                                                                                                                                                                                                                                                                                                                                                                                                                                                                                                                                                                                                                                                                                                                                                                                                                                                                                                                                                                                                                                                                                                                                                                                                                                                                                                                                                                                                                                                                                                                                                                                                                                                                                                                                                                                                                                                                                                                                                                                                                                                                                                                                                                                                                                                                                                                                                                                                                                                                                                                                                                                                                                                                                                                                                                                                                                                                                                                                                                                                                                                                                                                                                                                                                                                                                                                                                                                                                                                                                                                                                                                                                                                                                                                                                                                                                                                                                                                                                                                                                                                                                                                                                                                                                                                                                                                                                                                                                                                                                                                                                                                                                                                                                                                                                                                                                                                                                                                                                                                                                                                                                                                                                                                                                                                                                                                                                                                                                                                                                                                                                                                                                                                                                                                                                                                                                                                                                                                                                                                                                                                                                                                                                                                                                                                                                                                                                                                                                                                                                                                                                                                                                                                                                                                                                                                                                                                                                                                                                                                                                                                                                                                                                                                                                                                                                                                                                                                                                                                                                                                                                                                                                                                                                                                                                                                                                                                                                                                                                                                                                                                                                                                                                                                                                                                                                                                                                                                                                                                                                                                                                                                                                                                                                                                                                                                                                                                                                                                                                                                                                                                                                                                                                                                                                                                                                                                                                                                                                                                                                                                                                                                                                                                                                                                                                                                                                                                                                                                                                                                                                                                                                                                                                                                                                                                                                                                                                                                                                                                                                                                                                                                                                                                                                                                                                                                                                                                                                                                                                                                                                                                                                                                                                                                                                                                                                                                                                                                                                                                                                                                                                                                                                                                                                                                                                                                                                                                                                                                                                                                                                                                                                                                                                                                                                                                                                                                                                                                                                                                                                                                                                                                                                                                                                                                                                                                                                                                                                                                                                                                                                                                                                                                                                                                                                                                                                                                                                                                                                                                                                                                                                                                                                                                                                                                                                                                                                                                                                                                                                                                                                                                                                                                                                                                                                                                                                                                                                                                                                                                                                                                                                                                                                                                                                                                                                                                                                                                                                                                                                                                                                                                                                                                                                                                                                                                                                                                                                                                                                                                                                                                                                                                                                                                                                                                                                                                                                                                                                                                                                                                                                                                                                                                                                                                                                                                                                                                                                                                                                                                                                                                                                                                                                                                                                                                                                                                                                                                                                                                                                                                                                                                                                                                                                                                                                                                                                                                                                                                                                                                                                                                                                                                                                                                                                                                                                                                                                                                                                                                                                                                                                                                                                                                                                                                                                                                                                                                                                                                                                                                                                                                                                                                                                                                                                                                                                                                                                                                                                                                                                                                                                                                                                                                                                                                                                                                                                                                                                                                                                                                                                                                                                                                                                                                                                                                                                                                                                                                                                                                                                                                                                                                                                                                                                                                                                                                                                                                                                                                                                                                                                                                                                                                                                                                                                                                                                                                                                                                                                                                                                                                                                                                                                                                                                                                                                                                                                                                                                                                                                                                                                                                                                                                                                                                                                                                                                                                                                                                                                                                                                                                                                                                                                                                                                                                                                                                                                                                                                                                                                                                                                                                                                                                                                                                                                                                                                                                                                                                                                                                                                                                                                                                                                                                                                                                                                                                                                                                                                                                                                                                                                                                                                                                                                                                                                                                                                                                                                                                                                                                                                                                                                                                                                                                                                                                                                                                                                                                                                                                                                                                                                                                                                                                                                                                                                                                                                                                                                                                                                                                                                                                                                                                                                                                     
SELECT SPACE(utc_time(5));
SPACE(utc_time(5))
                                                                                                                                                                                                                                                                                                                                                                                                                                                                                                                                                                                                                                                                                                                                                                                                                                                                                                                                                                                                                                                                                                                                                                                                                                                                                                                                                                                                                                                                                                                                                                                                                                                                                                                                                                                                                                                                                                                                                                                                                                                                                                                                                                                                                                                                                                                                                                                                                                                                                                                                                                                                                                                                                                                                                                                                                                                                                                                                                                                                                                                                                                                                                                                                                                                                                                                                                                                                                                                                                                                                                                                                                                                                                                                                                                                                                                                                                                                                                                                                                                                                                                                                                                                                                                                                                                                                                                                                                                                                                                                                                                                                                                                                                                                                                                                                                                                                                                                                                                                                                                                                                                                                                                                                                                                                                                                                                                                                                                                                                                                                                                                                                                                                                                                                                                                                                                                                                                                                                                                                                                                                                                                                                                                                                                                                                                                                                                                                                                                                                                                                                                                                                                                                                                                                                                                                                                                                                                                                                                                                                                                                                                                                                                                                                                                                                                                                                                                                                                                                                                                                                                                                                                                                                                                                                                                                                                                                                                                                                                                                                                                                                                                                                                                                                                                                                                                                                                                                                                                                                                                                                                                                                                                                                                                                                                                                                                                                                                                                                                                                                                                                                                                                                                                                                                                                                                                                                                                                                                                                                                                                                                                                                                                                                                                                                                                                                                                                                                                                                                                                                                                                                                                                                                                                                                                                                                                                                                                                                                                                                                                                                                                                                                                                                                                                                                                                                                                                                                                                                                                                                                                                                                                                                                                                                                                                                                                                                                                                                                                                                                                                                                                                                                                                                                                                                                                                                                                                                                                                                                                                                                                                                                                                                                                                                                                                                                                                                                                                                                                                                                                                                                                                                                                                                                                                                                                                                                                                                                                                                                                                                                                                                                                                                                                                                                                                                                                                                                                                                                                                                                                                                                                                                                                                                                                                                                                                                                                                                                                                                                                                                                                                                                                                                                                                                                                                                                                                                                                                                                                                                                                                                                                                                                                                                                                                                                                                                                                                                                                                                                                                                                                                                                                                                                                                                                                                                                                                                                                                                                                                                                                                                                                                                                                                                                                                                                                                                                                                                                                                                                                                                                                                                                                                                                                                                                                                                                                                                                                                                                                                                                                                                                                                                                                                                                                                                                                                                                                                                                                                                                                                                                                                                                                                                                                                                                                                                                                                                                                                                                                                                                                                                                                                                                                                                                                                                                                                                                                                                                                                                                                                                                                                                                                                                                                                                                                                                                                                                                                                                                                                                                                                                                                                                                                                                                                                                                                                                                                                                                                                                                                                                                                                                                                                                                                                                                                                                                                                                                                                                                                                                                                                                                                                                                                                                                                                                                                                                                                                                                                                                                                                                                                                                                                                                                                                                                                                                                                                                                                                                                                                                                                                                                                                                                                                                                                                                                                                                                                                                                                                                                                                                                                                                                                                                                                                                                                                                                                                                                                                                                                                                                                                                                                                                                                                                                                                                                                                                                                                                                                                                                                                                                                                                                                                                                                                                                                                                                                                                                                                                                                                                                                                                                                                                                                                                                                                                                                                                                                                                                                                                                                                                                                                                                                                                                                                                                                                                                                                                                                                                                                                                                                                                                                                                                                                                                                                                                                                                                                                                                                                                                                                                                                                                                                                                                                                                                                                                                                                                                                                                                                                                                                                                                                                                                                                                                                                                                                                                                                                                                                                                                                                                                                                                                                                                                                                                                                                                                                                                                                                                                                                                                                                                                                                                                                                                                                                                                                                                                                                                                                                                                                                                                                                                                                                                                                                                                                                                                                                                                                                                                                                                                                                                                                                                                                                                                                                                                     
SELECT SUBSTRING_INDEX(utc_time(3),utc_time()-1,utc_time()-20200911);
SUBSTRING_INDEX(utc_time(3),utc_time()-1,utc_time()-20200911)
02:57:01.589
SELECT SUBSTRING_INDEX(utc_time()-1,utc_time(),utc_time()-20200911);
SUBSTRING_INDEX(utc_time()-1,utc_time(),utc_time()-20200911)
25700
SELECT LOCATE(utc_time()-1,utc_time(6));
LOCATE(utc_time()-1,utc_time(6))
0
SELECT LOCATE(utc_time(3),utc_time());
LOCATE(utc_time(3),utc_time())
0
SELECT LOCATE(utc_time()-1,utc_time()-1);
LOCATE(utc_time()-1,utc_time()-1)
1
SELECT LOCATE(2,utc_time(5)+0,utc_time(1)+0);
LOCATE(2,utc_time(5)+0,utc_time(1)+0)
0
SELECT POSITION(utc_time() in utc_time());
POSITION(utc_time() in utc_time())
1
SELECT POSITION(utc_time(6) in utc_time()+0);
POSITION(utc_time(6) in utc_time()+0)
0
SELECT POSITION(utc_time()+0 in utc_time()+0);
POSITION(utc_time()+0 in utc_time()+0)
1
SELECT POSITION(utc_time(1)+0 in utc_time(1)+0);
POSITION(utc_time(1)+0 in utc_time(1)+0)
1
SELECT POSITION(utc_time()+0 in utc_time()+1);
POSITION(utc_time()+0 in utc_time()+1)
0
SELECT INSTR(utc_time(6),utc_time());
INSTR(utc_time(6),utc_time())
1
SELECT INSTR(utc_time(),utc_time());
INSTR(utc_time(),utc_time())
1
SELECT INSTR(utc_time(),utc_time(4)+0);
INSTR(utc_time(),utc_time(4)+0)
0
SELECT INSTR(utc_time()+0,utc_time()+0);
INSTR(utc_time()+0,utc_time()+0)
1
SELECT INSTR(utc_time()+0,utc_time());
INSTR(utc_time()+0,utc_time())
0
SELECT REPLACE(utc_time()+0,utc_time()+0,utc_time(6));
REPLACE(utc_time()+0,utc_time()+0,utc_time(6))
02:57:01.589500
SELECT REPLACE(utc_time(),utc_time()+0,utc_time(6));
REPLACE(utc_time(),utc_time()+0,utc_time(6))
02:57:01
SELECT REPLACE(utc_time(2),utc_time(2),utc_time()+2);
REPLACE(utc_time(2),utc_time(2),utc_time()+2)
25703
SELECT FIELD(utc_time()-20200911,utc_time(6),utc_time()-20200911);
FIELD(utc_time()-20200911,utc_time(6),utc_time()-20200911)
2
SELECT FIELD(utc_time(3),utc_time(3),utc_time()-20200911);
FIELD(utc_time(3),utc_time(3),utc_time()-20200911)
1
SELECT FIELD(utc_time(2),utc_time(3),utc_time()-20200911);
FIELD(utc_time(2),utc_time(3),utc_time()-20200911)
0
SELECT ELT(utc_time(),utc_time(),utc_time()+0);
ELT(utc_time(),utc_time(),utc_time()+0)
NULL
SELECT ELT(utc_time(3),utc_time(3),utc_time(3)+0);
ELT(utc_time(3),utc_time(3),utc_time(3)+0)
NULL
SELECT ELT(utc_time(6)-25700,utc_time(6),utc_time(6)+3);
ELT(utc_time(6)-25700,utc_time(6),utc_time(6)+3)
25704.589500
SELECT ELT(utc_time(6)-25700.589500,utc_time(6),utc_time(6)+3);
ELT(utc_time(6)-25700.589500,utc_time(6),utc_time(6)+3)
02:57:01.589500
SELECT ELT(utc_time()-25700,utc_time(),utc_time()+0);
ELT(utc_time()-25700,utc_time(),utc_time()+0)
02:57:01
select insert(utc_time(),utc_time()-25700,utc_time()-25698,'a');
insert(utc_time(),utc_time()-25700,utc_time()-25698,'a')
a57:01
select insert(utc_time(6),utc_time()-25700,utc_time()-25698,'a');
insert(utc_time(6),utc_time()-25700,utc_time()-25698,'a')
a57:01.589500
select insert(utc_time(5)+0,utc_time()-25700,utc_time()-25698,'a');
insert(utc_time(5)+0,utc_time()-25700,utc_time()-25698,'a')
a01.58950
select insert('8989989',utc_time()-25700,utc_time()-25698,utc_time(3));
insert('8989989',utc_time()-25700,utc_time()-25698,utc_time(3))
02:57:01.5899989
select insert('8989989',utc_time()-25700,utc_time()-25698,utc_time(3)+9);
insert('8989989',utc_time()-25700,utc_time()-25698,utc_time(3)+9)
25710.5899989
SELECT LPAD(utc_time(6),utc_time()-25700,utc_time());
LPAD(utc_time(6),utc_time()-25700,utc_time())
0
SELECT LPAD(utc_time()+0,utc_time()-25699,utc_time(3)+2);
LPAD(utc_time()+0,utc_time()-25699,utc_time(3)+2)
25
SELECT RPAD(utc_time(),utc_time()-25700,utc_time());
RPAD(utc_time(),utc_time()-25700,utc_time())
0
SELECT RPAD(utc_time()+0,utc_time()-25700,utc_time(5));
RPAD(utc_time()+0,utc_time()-25700,utc_time(5))
2
SELECT bin(utc_time());
bin(utc_time())
10
SELECT bin(utc_time(5));
bin(utc_time(5))
10
SELECT bin(utc_time(6)+0);
bin(utc_time(6)+0)
110010001100101
SELECT quote(utc_time(3));
quote(utc_time(3))
'02:57:01.589'
SELECT quote(utc_time()+0);
quote(utc_time()+0)
'25701'
SELECT REGEXP_SUBSTR(utc_time()+0);
ERROR 42000: Incorrect parameter count in the call to native function 'REGEXP_SUBSTR'
select regexp_substr(utc_time(), '2(.*)(01)', 1, 1, 'i', 0);
regexp_substr(utc_time(), '2(.*)(01)', 1, 1, 'i', 0)
2:57:01
select regexp_substr(utc_time(3), '2(.*)(.589)', 1, 1, 'i', 0);
regexp_substr(utc_time(3), '2(.*)(.589)', 1, 1, 'i', 0)
2:57:01.589
select CAST(utc_time()+0 as time);
CAST(utc_time()+0 as time)
02:57:01
select CAST(utc_time(6) as time);
CAST(utc_time(6) as time)
02:57:02
select ROUND(utc_time());
ROUND(utc_time())
25701
select ROUND(utc_time(6));
ROUND(utc_time(6))
25702
select ROUND(utc_time(5)+0);
ROUND(utc_time(5)+0)
25702
select ROUND(utc_time()+0,utc_time()-25700);
ROUND(utc_time()+0,utc_time()-25700)
25701
#OB中ROUND 没有起到作用
select ROUND(utc_time(),utc_time()-25700);
ROUND(utc_time(),utc_time()-25700)
25701
#OB中ROUND 没有起到作用
select ROUND(utc_time(3),utc_time(6)-25700);
ROUND(utc_time(3),utc_time(6)-25700)
25701.590
select CEIL(utc_time());
CEIL(utc_time())
25701
select CEIL(utc_time(2));
CEIL(utc_time(2))
25702
select CEIL(utc_time(3)+0);
CEIL(utc_time(3)+0)
25702
select FLOOR(utc_time(0));
FLOOR(utc_time(0))
25701
select FLOOR(utc_time()+0);
FLOOR(utc_time()+0)
25701
select ABS(utc_time(6));
ABS(utc_time(6))
25701.589500
select ABS(utc_time()+1);
ABS(utc_time()+1)
25702
select NEG(utc_time(2));
NEG(utc_time(2))
-25701.58
select NEG(utc_time()-1);
NEG(utc_time()-1)
-25700
select SIGN(utc_time(2));
SIGN(utc_time(2))
1
select SIGN(utc_time(3)-25701.589);
SIGN(utc_time(3)-25701.589)
0
select SIGN(utc_time()-20200913);
SIGN(utc_time()-20200913)
-1
select CONV(utc_time(2)-25690,utc_time(2)-25691,utc_time(2)-25699);
CONV(utc_time(2)-25690,utc_time(2)-25691,utc_time(2)-25699)
110
select MOD(utc_time(),utc_time());
MOD(utc_time(),utc_time())
0
select MOD(utc_time(6),utc_time(3)-6);
MOD(utc_time(6),utc_time(3)-6)
6.000500
select MOD(utc_time()+5,utc_time(6));
MOD(utc_time()+5,utc_time(6))
4.410500
select MOD(utc_time()+0,utc_time()-6);
MOD(utc_time()+0,utc_time()-6)
6
select POW(utc_time(6),utc_time()-25701);
POW(utc_time(6),utc_time()-25701)
1
select POW(utc_time(4)+0,utc_time(3)-122644);
POW(utc_time(4)+0,utc_time(3)-122644)
0
select POW(utc_time(),null);
POW(utc_time(),null)
NULL
select POWER(utc_time(6),utc_time(6)-25695);
POWER(utc_time(6),utc_time(6)-25695)
1.1466511396156376e29
select POWER(utc_time()+0,utc_time()-25702);
POWER(utc_time()+0,utc_time()-25702)
0.0000389089918680207
select POWER(utc_time(3),null);
POWER(utc_time(3),null)
NULL
select rand(utc_time(4));
rand(utc_time(4))
0.11130982927168703
select rand(utc_time());
rand(utc_time())
0.11130982927168703
select rand(utc_time(4)+1);
rand(utc_time(4)+1)
0.61167604812577
select GREATEST(utc_time(),utc_time(3)+1);
GREATEST(utc_time(),utc_time(3)+1)
25702.589
select GREATEST(utc_time(3),utc_time(3)+1);
GREATEST(utc_time(3),utc_time(3)+1)
25702.589
select GREATEST(utc_time(),utc_time(3)-2);
GREATEST(utc_time(),utc_time(3)-2)
25701.000
select LEAST(utc_time(),utc_time()+1);
LEAST(utc_time(),utc_time()+1)
25701
select LEAST(utc_time(2),utc_time());
LEAST(utc_time(2),utc_time())
02:57:01.00
select isnull(utc_time(3));
isnull(utc_time(3))
0
select isnull(utc_time()+0);
isnull(utc_time()+0)
0
select CASE utc_time() when utc_time(6)+0 then 1 when utc_time() then 2 END;
CASE utc_time() when utc_time(6)+0 then 1 when utc_time() then 2 END
2
select CASE utc_time(3) when utc_time(3)+0 then 1 when utc_time() then 2 END;
CASE utc_time(3) when utc_time(3)+0 then 1 when utc_time() then 2 END
1
select if(utc_time()<utc_time()-1,utc_time(3),utc_time()-1);
if(utc_time()<utc_time()-1,utc_time(3),utc_time()-1)
25700
select if(utc_time()>utc_time(3)-1,utc_time(3),utc_time(2)-1);
if(utc_time()>utc_time(3)-1,utc_time(3),utc_time(2)-1)
02:57:01.589
select ifnull(null,utc_time(4));
ifnull(null,utc_time(4))
02:57:01.5895
select ifnull(null,utc_time(4)+0);
ifnull(null,utc_time(4)+0)
25701.5895
select ifnull(utc_time(2),utc_time()+0);
ifnull(utc_time(2),utc_time()+0)
02:57:01.58
select ifnull(utc_time()+5,utc_time()+0);
ifnull(utc_time()+5,utc_time()+0)
25706
select nullif(utc_time(3),utc_time());
nullif(utc_time(3),utc_time())
02:57:01.589
select nullif(utc_time(3),utc_time(3));
nullif(utc_time(3),utc_time(3))
NULL
select ORA_DECODE(utc_time(1),utc_time(1)+0,utc_time(2),utc_time(3)+1,utc_time(4),utc_time(5),utc_time()+10);
ORA_DECODE(utc_time(1),utc_time(1)+0,utc_time(2),utc_time(3)+1,utc_time(4),utc_time(5),utc_time()+10)
02:57:01.580000
select ORA_DECODE(utc_time(),utc_time()+1,utc_time(),utc_time()+1,utc_time(),utc_time(),utc_time()+10);
ORA_DECODE(utc_time(),utc_time()+1,utc_time(),utc_time()+1,utc_time(),utc_time(),utc_time()+10)
02:57:11
select COALESCE(utc_time(6));
COALESCE(utc_time(6))
02:57:01.589500
select COALESCE(utc_time(6)+2);
COALESCE(utc_time(6)+2)
25703.589500
select nvl(utc_time(3),utc_time(3)+99);
nvl(utc_time(3),utc_time(3)+99)
02:57:01.589
select nvl(null,utc_time(2));
nvl(null,utc_time(2))
02:57:01.58
select nvl(null,utc_time());
nvl(null,utc_time())
02:57:01
select nvl(null,utc_time(6)+3);
nvl(null,utc_time(6)+3)
25704.589500
select nvl(null,utc_time()+3);
nvl(null,utc_time()+3)
25704
select sleep(utc_time(1)-25696);
sleep(utc_time(1)-25696)
0
obmysql-utc_time-4 使用场景
obmysql-utc_time-4-1
drop table t1;
create table t1 (id int ,name varchar(20),d time);
insert into t1 values(1,'test01',utc_time());
insert into t1 values(2,'test02','02:10:32');
insert into t1 values(3,'test03','04:10:42');
insert into t1 values(4,'test04','02:15:12');
insert into t1 values(5,'test05',utc_time(6)+10);
select utc_time(6) as a,utc_time()+1 from t1;
a	utc_time()+1
02:57:01.589500	25702
02:57:01.589500	25702
02:57:01.589500	25702
02:57:01.589500	25702
02:57:01.589500	25702
#utc_time作为create as 的字段，ob创建失败，mysql创建成功
create table t2 as select utc_time() as a ,utc_time()+1 as b,utc_time(3) as c,utc_time(6)-10 as d from t1;
ERROR 42000: precision must be >= scale
drop table t2;
select DATEDIFF(utc_time()-1,utc_time(3)) from t1;
DATEDIFF(utc_time()-1,utc_time(3))
NULL
NULL
NULL
NULL
NULL
select MOD(utc_time(6)+5,utc_time()) from t1;
MOD(utc_time(6)+5,utc_time())
5.589500
5.589500
5.589500
5.589500
5.589500
select time(utc_time(6)),COALESCE(utc_time()) from t1;
time(utc_time(6))	COALESCE(utc_time())
02:57:01.589500	02:57:01
02:57:01.589500	02:57:01
02:57:01.589500	02:57:01
02:57:01.589500	02:57:01
02:57:01.589500	02:57:01
SELECT INSTR(utc_time(3),utc_time()+0) from t1;
INSTR(utc_time(3),utc_time()+0)
0
0
0
0
0
select LENGTH(utc_time()+1),LENGTH(utc_time(2)) from t1;
LENGTH(utc_time()+1)	LENGTH(utc_time(2))
5	11
5	11
5	11
5	11
5	11
SELECT LOCATE(2,utc_time()+0,utc_time()-25699) from t1;
LOCATE(2,utc_time()+0,utc_time()-25699)
0
0
0
0
0
select MD5(utc_time(3)),MD5(utc_time()+1) from t1;
MD5(utc_time(3))	MD5(utc_time()+1)
332199307a71f8ddc3fb3c8a9882dcf1	1f422c75031b07a409aa665065fdc42b
332199307a71f8ddc3fb3c8a9882dcf1	1f422c75031b07a409aa665065fdc42b
332199307a71f8ddc3fb3c8a9882dcf1	1f422c75031b07a409aa665065fdc42b
332199307a71f8ddc3fb3c8a9882dcf1	1f422c75031b07a409aa665065fdc42b
332199307a71f8ddc3fb3c8a9882dcf1	1f422c75031b07a409aa665065fdc42b
select t1.*,utc_time()+0, utc_time(3) from t1 where utc_time(3)>d;
id	name	d	utc_time()+0	utc_time(3)
1	test01	02:57:01	25701	02:57:01.589
2	test02	02:10:32	25701	02:57:01.589
4	test04	02:15:12	25701	02:57:01.589
select t1.*,utc_time()-0, utc_time(4) from t1 where utc_time(1)>=d;
id	name	d	utc_time()-0	utc_time(4)
1	test01	02:57:01	25701	02:57:01.5895
2	test02	02:10:32	25701	02:57:01.5895
4	test04	02:15:12	25701	02:57:01.5895
select t1.*,utc_time(2)-0, utc_time()  from t1 where utc_time(2)<=d;
id	name	d	utc_time(2)-0	utc_time()
3	test03	04:10:42	25701.58	02:57:01
5	test05	02:57:12	25701.58	02:57:01
select t1.*,utc_time()+0, utc_time()  from t1 where utc_time()=d;
id	name	d	utc_time()+0	utc_time()
1	test01	02:57:01	25701	02:57:01
select t1.*,utc_time(6)+0, utc_time()  from t1 where d=utc_time();
id	name	d	utc_time(6)+0	utc_time()
1	test01	02:57:01	25701.589500	02:57:01
select t1.*,utc_time()+0, utc_time()  from t1 where utc_time(3)<d;
id	name	d	utc_time()+0	utc_time()
3	test03	04:10:42	25701	02:57:01
5	test05	02:57:12	25701	02:57:01
select t1.*,utc_time()+0, utc_time(0)  from t1 where utc_time(5)+0>d;
id	name	d	utc_time()+0	utc_time(0)
1	test01	02:57:01	25701	02:57:01
2	test02	02:10:32	25701	02:57:01
4	test04	02:15:12	25701	02:57:01
select t1.*,utc_time(0)-0, utc_time(0)  from t1 where utc_time(1)-1>=d;
id	name	d	utc_time(0)-0	utc_time(0)
2	test02	02:10:32	25701	02:57:01
4	test04	02:15:12	25701	02:57:01
select t1.*,utc_time(1)+0, utc_time(3)  from t1 where utc_time(1)+2<=d;
id	name	d	utc_time(1)+0	utc_time(3)
3	test03	04:10:42	25701.5	02:57:01.589
5	test05	02:57:12	25701.5	02:57:01.589
select t1.*,utc_time(2)-0, utc_time()  from t1 where utc_time(3)-3=d;
id	name	d	utc_time(2)-0	utc_time()
select t1.*,utc_time()+0, utc_time(4)  from t1 where utc_time()-0<d;
id	name	d	utc_time()+0	utc_time(4)
3	test03	04:10:42	25701	02:57:01.5895
5	test05	02:57:12	25701	02:57:01.5895
select t1.*,utc_time()+0, utc_time(6)  from t1 where d<utc_time(3)-0;
id	name	d	utc_time()+0	utc_time(6)
1	test01	02:57:01	25701	02:57:01.589500
2	test02	02:10:32	25701	02:57:01.589500
4	test04	02:15:12	25701	02:57:01.589500
select t1.*,utc_time(6)-0, utc_time()  from t1 where d=utc_time() or utc_time(6)+1>=d;
id	name	d	utc_time(6)-0	utc_time()
1	test01	02:57:01	25701.589500	02:57:01
2	test02	02:10:32	25701.589500	02:57:01
4	test04	02:15:12	25701.589500	02:57:01
select t1.*,utc_time(3)+0 as a, utc_time()  from t1 where d=utc_time() and utc_time()-1<=d;
id	name	d	a	utc_time()
1	test01	02:57:01	25701.589	02:57:01
select t1.*,utc_time(3)+0, utc_time()  from t1 where d between utc_time() and utc_time()+5;
id	name	d	utc_time(3)+0	utc_time()
1	test01	02:57:01	25701.589	02:57:01
select t1.*,utc_time(4)-0, utc_time()  from t1 where d like 'utc_time()%';
id	name	d	utc_time(4)-0	utc_time()
select t1.*,utc_time(5)+0, utc_time()  from t1 where d not like 'utc_time()%';
id	name	d	utc_time(5)+0	utc_time()
1	test01	02:57:01	25701.58950	02:57:01
2	test02	02:10:32	25701.58950	02:57:01
3	test03	04:10:42	25701.58950	02:57:01
4	test04	02:15:12	25701.58950	02:57:01
5	test05	02:57:12	25701.58950	02:57:01
select t1.*,utc_time()+0, utc_time(6)  from t1 where d not like 'utc_time()+0%';
id	name	d	utc_time()+0	utc_time(6)
1	test01	02:57:01	25701	02:57:01.589500
2	test02	02:10:32	25701	02:57:01.589500
3	test03	04:10:42	25701	02:57:01.589500
4	test04	02:15:12	25701	02:57:01.589500
5	test05	02:57:12	25701	02:57:01.589500
select t1.*,utc_time()-0, utc_time(2)  from t1 where d like 'utc_time()-0%';
id	name	d	utc_time()-0	utc_time(2)
select t1.*,utc_time(1)-0, utc_time()  from t1 where exists (select utc_time(3),utc_time()+0);
id	name	d	utc_time(1)-0	utc_time()
1	test01	02:57:01	25701.5	02:57:01
2	test02	02:10:32	25701.5	02:57:01
3	test03	04:10:42	25701.5	02:57:01
4	test04	02:15:12	25701.5	02:57:01
5	test05	02:57:12	25701.5	02:57:01
select t1.*,utc_time()-0, utc_time()  from t1 where d in  (select utc_time(4));
id	name	d	utc_time()-0	utc_time()
select t1.*,utc_time()-0, utc_time()  from t1 where d in  (select utc_time());
id	name	d	utc_time()-0	utc_time()
1	test01	02:57:01	25701	02:57:01
select t1.*,utc_time(3)-0, utc_time(3)  from t1 where d in  (select utc_time(6)+10);
id	name	d	utc_time(3)-0	utc_time(3)
select t1.*,utc_time(2)-0, utc_time()  from t1 where d in  (utc_time()+2,utc_time(1));
id	name	d	utc_time(2)-0	utc_time()
select * from t1 where d=utc_time(6)+10;
id	name	d
select t1.*,utc_time()-0, utc_time()  from t1 where d >any(utc_time()+2,utc_time());
ERROR 42000: You have an error in your SQL syntax; check the manual that corresponds to your OceanBase version for the right syntax to use near 'utc_time()+2,utc_time())' at line 1
select t1.*,utc_time()-0, utc_time()  from t1 where d >all(utc_time()+2,utc_time());
ERROR 42000: You have an error in your SQL syntax; check the manual that corresponds to your OceanBase version for the right syntax to use near 'utc_time()+2,utc_time())' at line 1
select t1.*,utc_time()-0, utc_time(3)  from t1 where d >=all(select utc_time(3)+2 from t1);
id	name	d	utc_time()-0	utc_time(3)
3	test03	04:10:42	25701	02:57:01.589
5	test05	02:57:12	25701	02:57:01.589
select t1.*,utc_time()-0, utc_time()  from t1 where d <=any(select utc_time(6)+2 from t1);
id	name	d	utc_time()-0	utc_time()
1	test01	02:57:01	25701	02:57:01
2	test02	02:10:32	25701	02:57:01
4	test04	02:15:12	25701	02:57:01
select t1.*,utc_time()-0, utc_time(3)  from t1 where id >2;
id	name	d	utc_time()-0	utc_time(3)
3	test03	04:10:42	25701	02:57:01.589
4	test04	02:15:12	25701	02:57:01.589
5	test05	02:57:12	25701	02:57:01.589
select t1.*,utc_time(4)-0, utc_time()  from t1 where id =2;
id	name	d	utc_time(4)-0	utc_time()
2	test02	02:10:32	25701.5895	02:57:01
select t1.*,utc_time(2)-0, utc_time()  from t1 where id =2 or name ='test03';
id	name	d	utc_time(2)-0	utc_time()
2	test02	02:10:32	25701.58	02:57:01
3	test03	04:10:42	25701.58	02:57:01
select t1.*,utc_time()-0, utc_time(5)  from t1 where id in (1,2,3);
id	name	d	utc_time()-0	utc_time(5)
1	test01	02:57:01	25701	02:57:01.58950
2	test02	02:10:32	25701	02:57:01.58950
3	test03	04:10:42	25701	02:57:01.58950
drop table t2;
create table t2(id int ,t1_id int);
insert into t2 values(1,1);
insert into t2 values(2,2);
insert into t2 values(3,3);
insert into t2 values(4,4);
insert into t2 values(5,5);
select t1.*,utc_time()-0, utc_time(3) from t1 inner join t2 on t1.id=t2.t1_id;
id	name	d	utc_time()-0	utc_time(3)
1	test01	02:57:01	25701	02:57:01.589
2	test02	02:10:32	25701	02:57:01.589
3	test03	04:10:42	25701	02:57:01.589
4	test04	02:15:12	25701	02:57:01.589
5	test05	02:57:12	25701	02:57:01.589
select t1.*,utc_time(1)-0, utc_time() from t1 inner join t2 on t1.id=t2.t1_id and t1.d= utc_time(6)+10;
id	name	d	utc_time(1)-0	utc_time()
with t as (select utc_time()-0 , utc_time(6)   from t1)  select * from t;
utc_time()-0	utc_time(6)
25701	02:57:01.589500
25701	02:57:01.589500
25701	02:57:01.589500
25701	02:57:01.589500
25701	02:57:01.589500
select utc_time(6)+utc_time() from t1 where id>3;
utc_time(6)+utc_time()
51402.589500
51402.589500
select utc_time()-utc_time(3) from t1;
utc_time()-utc_time(3)
-0.589
-0.589
-0.589
-0.589
-0.589
select utc_time(2)*utc_time(0) from t1;
utc_time(2)*utc_time(0)
660556307.58
660556307.58
660556307.58
660556307.58
660556307.58
select utc_time(6)*utc_time(6) from t1;
utc_time(6)*utc_time(6)
660571702.826510250000
660571702.826510250000
660571702.826510250000
660571702.826510250000
660571702.826510250000
select utc_time(3)*utc_time(6) from t1;
utc_time(3)*utc_time(6)
660571689.975715500
660571689.975715500
660571689.975715500
660571689.975715500
660571689.975715500
select utc_time(1)/utc_time(2)-25600 from t1;
utc_time(1)/utc_time(2)-25600
-25599.00000
-25599.00000
-25599.00000
-25599.00000
-25599.00000
select utc_time(6)%utc_time() from t1;
utc_time(6)%utc_time()
0.589500
0.589500
0.589500
0.589500
0.589500
select utc_time(3) div utc_time(5) from t1;
utc_time(3) div utc_time(5)
0
0
0
0
0
select utc_time(3) mod utc_time() from t1;
utc_time(3) mod utc_time()
0.589
0.589
0.589
0.589
0.589
select -utc_time(4) from t1;
-utc_time(4)
-25701.5895
-25701.5895
-25701.5895
-25701.5895
-25701.5895
select +utc_time() from t1;
+utc_time()
02:57:01
02:57:01
02:57:01
02:57:01
02:57:01
select utc_time(3)+0+utc_time(1) from t1 where id>3;
utc_time(3)+0+utc_time(1)
51403.089
51403.089
select utc_time()-utc_time(2)+0 from t1;
utc_time()-utc_time(2)+0
-0.58
-0.58
-0.58
-0.58
-0.58
select utc_time(1)*utc_time(2)+0 from t1;
utc_time(1)*utc_time(2)+0
660569158.370
660569158.370
660569158.370
660569158.370
660569158.370
select utc_time()+0/utc_time() from t1;
utc_time()+0/utc_time()
25701.0000
25701.0000
25701.0000
25701.0000
25701.0000
select utc_time()%utc_time(3)+0 from t1;
utc_time()%utc_time(3)+0
25701.000
25701.000
25701.000
25701.000
25701.000
select utc_time(6)+0 div utc_time(6) from t1;
utc_time(6)+0 div utc_time(6)
25701.589500
25701.589500
25701.589500
25701.589500
25701.589500
select utc_time(2) mod utc_time()+0 from t1;
utc_time(2) mod utc_time()+0
0.58
0.58
0.58
0.58
0.58
select -utc_time()+0 from t1;
-utc_time()+0
-25701
-25701
-25701
-25701
-25701
select +utc_time(2)+0 from t1;
+utc_time(2)+0
25701.58
25701.58
25701.58
25701.58
25701.58
select utc_time(3)+0+utc_time(4)+0 from t1 where id=3;
utc_time(3)+0+utc_time(4)+0
51403.1785
select utc_time()+0-utc_time()+0 from t1;
utc_time()+0-utc_time()+0
0
0
0
0
0
select utc_time(3)+0*utc_time(4)+0 from t1;
utc_time(3)+0*utc_time(4)+0
25701.5890
25701.5890
25701.5890
25701.5890
25701.5890
select utc_time(1)+0/utc_time(6)+0 from t1;
utc_time(1)+0/utc_time(6)+0
25701.5000
25701.5000
25701.5000
25701.5000
25701.5000
select utc_time(2)+0%utc_time(5)+0 from t1;
utc_time(2)+0%utc_time(5)+0
25701.58000
25701.58000
25701.58000
25701.58000
25701.58000
select utc_time()+0 div utc_time()+0 from t1;
utc_time()+0 div utc_time()+0
25701
25701
25701
25701
25701
select utc_time()+0 mod utc_time(3)+0 from t1;
utc_time()+0 mod utc_time(3)+0
25701.000
25701.000
25701.000
25701.000
25701.000
select distinct utc_time(3) from t1;
utc_time(3)
02:57:01.589
select distinct utc_time()+20 from t1;
utc_time()+20
25721
select  utc_time() from t1;
utc_time()
02:57:01
02:57:01
02:57:01
02:57:01
02:57:01
select  utc_time(4)+1 from t1;
utc_time(4)+1
25702.5895
25702.5895
25702.5895
25702.5895
25702.5895
select t1.*,utc_time()-0, utc_time(2) from t1 group by id;
id	name	d	utc_time()-0	utc_time(2)
1	test01	02:57:01	25701	02:57:01.58
2	test02	02:10:32	25701	02:57:01.58
3	test03	04:10:42	25701	02:57:01.58
4	test04	02:15:12	25701	02:57:01.58
5	test05	02:57:12	25701	02:57:01.58
select t1.*,utc_time()-0, utc_time() from t1 group by utc_time(3),utc_time()+0;
id	name	d	utc_time()-0	utc_time()
1	test01	02:57:01	25701	02:57:01
select t1.*,utc_time(6)-0, utc_time() from t1 group by utc_time() having utc_time(3)>='02:10:10';
id	name	d	utc_time(6)-0	utc_time()
1	test01	02:57:01	25701.589500	02:57:01
select t1.*,utc_time()-0, utc_time(2) from t1 group by utc_time() having utc_time(3)-0>='25701';
id	name	d	utc_time()-0	utc_time(2)
1	test01	02:57:01	25701	02:57:01.58
select t1.*,utc_time()-0, utc_time() from t1 order by utc_time(3);
id	name	d	utc_time()-0	utc_time()
1	test01	02:57:01	25701	02:57:01
2	test02	02:10:32	25701	02:57:01
3	test03	04:10:42	25701	02:57:01
4	test04	02:15:12	25701	02:57:01
5	test05	02:57:12	25701	02:57:01
select t1.*,utc_time(3)-0, utc_time(3) from t1 order by utc_time()+0;
id	name	d	utc_time(3)-0	utc_time(3)
1	test01	02:57:01	25701.589	02:57:01.589
2	test02	02:10:32	25701.589	02:57:01.589
3	test03	04:10:42	25701.589	02:57:01.589
4	test04	02:15:12	25701.589	02:57:01.589
5	test05	02:57:12	25701.589	02:57:01.589
select t1.*,utc_time()-0, utc_time(4) from t1  where d =utc_time() order by utc_time();
id	name	d	utc_time()-0	utc_time(4)
1	test01	02:57:01	25701	02:57:01.5895
select t1.*,utc_time(6)-0, utc_time() from t1 where d =utc_time()+0 order by utc_time()+0;
id	name	d	utc_time(6)-0	utc_time()
1	test01	02:57:01	25701.589500	02:57:01
select t1.* , case utc_time()  when utc_time()  then utc_time(3)  when utc_time()+1  then    utc_time()+1  end as a  from t1;
id	name	d	a
1	test01	02:57:01	02:57:01.589
2	test02	02:10:32	02:57:01.589
3	test03	04:10:42	02:57:01.589
4	test04	02:15:12	02:57:01.589
5	test05	02:57:12	02:57:01.589
select t1.* , case utc_time(4)+1  when utc_time()  then utc_time()  when utc_time(4)+1  then    utc_time()+1  end as a  from t1;
id	name	d	a
1	test01	02:57:01	25702
2	test02	02:10:32	25702
3	test03	04:10:42	25702
4	test04	02:15:12	25702
5	test05	02:57:12	25702
select t1.* , case utc_time(4)+1  when utc_time()  then utc_time()  when utc_time(4)+1  then    utc_time(4)+1  end as a  from t1;
id	name	d	a
1	test01	02:57:01	25702.5895
2	test02	02:10:32	25702.5895
3	test03	04:10:42	25702.5895
4	test04	02:15:12	25702.5895
5	test05	02:57:12	25702.5895
select count(utc_time(1)) from t1;
count(utc_time(1))
5
select count(utc_time()+0) from t1;
count(utc_time()+0)
5
select sum(utc_time(3)) from t1;
sum(utc_time(3))
128507.945
select sum(utc_time()+0) from t1;
sum(utc_time()+0)
128505
select avg(utc_time(4)) from t1;
avg(utc_time(4))
25701.58950000
select avg(utc_time()+0) from t1;
avg(utc_time()+0)
25701.0000
select min(utc_time(5)) from t1;
min(utc_time(5))
02:57:01.58950
select min(utc_time()+0) from t1;
min(utc_time()+0)
25701
select max(utc_time()) from t1;
max(utc_time())
02:57:01
select max(utc_time(6)+0) from t1;
max(utc_time(6)+0)
25701.589500
select GROUP_CONCAT(utc_time(6)) from t1;
GROUP_CONCAT(utc_time(6))
02:57:01.589500,02:57:01.589500,02:57:01.589500,02:57:01.589500,02:57:01.589500
select GROUP_CONCAT(utc_time()+0) from t1;
GROUP_CONCAT(utc_time()+0)
25701,25701,25701,25701,25701
drop table t2;
drop table t1;
create table t1(id int,name varchar(20));
create table t2(id int,name varchar(20));
insert into t1 values(1,'test');
insert into t1 values(2,'test');
insert into t2 values(1,'test');
insert into t1 values(3,'test');
select utc_time(3),utc_time(3)+0 from t1 union select utc_time(),utc_time()+0 from t2;
utc_time(3)	utc_time(3)+0
02:57:01.000	25701.000
02:57:01.589	25701.589
select utc_time(6),utc_time(3)+0 from t1 union all select utc_time(),utc_time()+0 from t2;
utc_time(6)	utc_time(3)+0
02:57:01.589500	25701.589
02:57:01.589500	25701.589
02:57:01.589500	25701.589
02:57:01.000000	25701.000
select utc_time(),utc_time(5)+0 from t1 intersect select utc_time(),utc_time(5)+0 from t2;
utc_time()	utc_time(5)+0
02:57:01	25701.58950
select utc_time(),utc_time(5)+0 from t1 intersect select utc_time(),utc_time(2)+0 from t2;
utc_time()	utc_time(5)+0
select utc_time(),utc_time(3)+1 from t1 except select utc_time(),utc_time()+0 from t2;
utc_time()	utc_time(3)+1
02:57:01	25702.589
select utc_time(4),utc_time(4)+2 from t1 minus select utc_time(),utc_time()+0 from t2;
utc_time(4)	utc_time(4)+2
02:57:01.5895	25703.5895
drop table t2;
drop table t1;
obmysql-utc_time-4-1  表insert into
drop table t1;
create table t1(a bool);
insert into t1 values(utc_time());
ERROR 22003: Out of range value for column 'a' at row 1
insert into t1 values(utc_time()-25700);
insert into t1 values(utc_time(3)-25700);
select * from t1;
a
1
2
update t1 set a =utc_time();
ERROR 22003: Out of range value for column 'a' at row 1
update t1 set a =utc_time(3)-25699;
select * from t1;
a
3
3
drop table t1;
create table t1(a BOOLEAN);
insert into t1 values(utc_time());
ERROR 22003: Out of range value for column 'a' at row 1
insert into t1 values(utc_time()-25700);
insert into t1 values(utc_time(3)-25700);
select * from t1;
a
1
2
update t1 set a =utc_time();
ERROR 22003: Out of range value for column 'a' at row 1
update t1 set a =utc_time(3)-25699;
select * from t1;
a
3
3
drop table t1;
create table t1(a TINYINT);
insert into t1 values(utc_time());
ERROR 22003: Out of range value for column 'a' at row 1
insert into t1 values(utc_time()-25700);
insert into t1 values(utc_time(2)-25700);
select * from t1;
a
1
2
update t1 set a =utc_time();
ERROR 22003: Out of range value for column 'a' at row 1
update t1 set a =utc_time(3)-25699;
select * from t1;
a
3
3
drop table t1;
create table t1(a SMALLINT);
insert into t1 values(utc_time());
insert into t1 values(utc_time(6));
insert into t1 values(utc_time()-25700);
insert into t1 values(utc_time(2)-25700);
select * from t1;
a
25701
25701
1
2
update t1 set a =utc_time(3) where a=utc_time(2)-25700;
update t1 set a =utc_time() ;
update t1 set a =utc_time(3)-25699;
select * from t1;
a
3
3
3
3
drop table t1;
create table t1(a MEDIUMINT);
insert into t1 values(utc_time());
insert into t1 values(utc_time(6));
insert into t1 values(utc_time()-25700);
insert into t1 values(utc_time(2)-25700);
select * from t1;
a
25701
25701
1
2
update t1 set a =utc_time(3) where a=utc_time(2)-25700;
update t1 set a =utc_time() ;
update t1 set a =utc_time(3)-25699;
select * from t1;
a
3
3
3
3
drop table t1;
create table t1(a INT);
insert into t1 values(utc_time());
insert into t1 values(utc_time(6));
insert into t1 values(utc_time()-25700);
insert into t1 values(utc_time(2)-25700);
select * from t1;
a
25701
25701
1
2
update t1 set a =utc_time(3) where a=utc_time();
update t1 set a =utc_time(6) ;
update t1 set a =utc_time() ;
update t1 set a =utc_time(3)-25699;
select * from t1;
a
3
3
3
3
drop table t1;
create table t1(a INTEGER);
insert into t1 values(utc_time());
insert into t1 values(utc_time(6));
insert into t1 values(utc_time()-25700);
insert into t1 values(utc_time(2)-25700);
select * from t1;
a
25701
25701
1
2
update t1 set a =utc_time(3) where a=utc_time();
update t1 set a =utc_time(6) ;
update t1 set a =utc_time() ;
update t1 set a =utc_time(3)-25699;
select * from t1;
a
3
3
3
3
drop table t1;
create table t1(a BIGINT);
insert into t1 values(utc_time());
insert into t1 values(utc_time(6));
insert into t1 values(utc_time()-25700);
insert into t1 values(utc_time(2)-25700);
select * from t1;
a
25701
25701
1
2
update t1 set a =utc_time(2) where a=utc_time();
update t1 set a =utc_time(6) ;
update t1 set a =utc_time() ;
update t1 set a =utc_time(3)-25699;
select * from t1;
a
3
3
3
3
drop table t1;
create table t1(a DECIMAL);
insert into t1 values(utc_time());
insert into t1 values(utc_time(6));
Warnings:
Warning	1265	Data truncated for column 'a' at row 1
insert into t1 values(utc_time()-25700);
insert into t1 values(utc_time(2)-25700);
Warnings:
Warning	1265	Data truncated for column 'a' at row 1
select * from t1;
a
25701
25702
1
2
update t1 set a =utc_time(2) where a=utc_time();
Warnings:
Warning	1265	Data truncated for column 'a' at row 1
update t1 set a =utc_time(6) ;
Warnings:
Warning	1265	Data truncated for column 'a' at row 1
update t1 set a =utc_time() ;
update t1 set a =utc_time(3)-25699;
Warnings:
Warning	1265	Data truncated for column 'a' at row 1
select * from t1;
a
3
3
3
3
drop table t1;
create table t1(a NUMERIC);
insert into t1 values(utc_time());
insert into t1 values(utc_time(6));
Warnings:
Warning	1265	Data truncated for column 'a' at row 1
insert into t1 values(utc_time()-25700);
insert into t1 values(utc_time(2)-25700);
Warnings:
Warning	1265	Data truncated for column 'a' at row 1
select * from t1;
a
25701
25702
1
2
update t1 set a =utc_time(2) where a=utc_time();
Warnings:
Warning	1265	Data truncated for column 'a' at row 1
update t1 set a =utc_time(6) ;
Warnings:
Warning	1265	Data truncated for column 'a' at row 1
update t1 set a =utc_time() ;
update t1 set a =utc_time(3)-25699;
Warnings:
Warning	1265	Data truncated for column 'a' at row 1
select * from t1;
a
3
3
3
3
drop table t1;
create table t1(a FLOAT);
insert into t1 values(utc_time());
insert into t1 values(utc_time(6));
insert into t1 values(utc_time()-25700);
insert into t1 values(utc_time(2)-25700);
select * from t1;
a
25701
25701.6
1
1.58
update t1 set a =utc_time(2) where a=utc_time();
update t1 set a =utc_time(6) ;
update t1 set a =utc_time() ;
update t1 set a =utc_time(3)-25699;
select * from t1;
a
2.589
2.589
2.589
2.589
drop table t1;
create table t1(a DOUBLE);
insert into t1 values(utc_time());
insert into t1 values(utc_time(6));
insert into t1 values(utc_time()-25700);
insert into t1 values(utc_time(2)-25700);
select * from t1;
a
25701
25701.5895
1
1.58
update t1 set a =utc_time(2) where a=utc_time();
update t1 set a =utc_time(6) ;
select * from t1;
a
25701.5895
25701.5895
25701.5895
25701.5895
update t1 set a =utc_time() ;
update t1 set a =utc_time(3)-25699;
select * from t1;
a
2.589
2.589
2.589
2.589
drop table t1;
create table t1(a BIT);
insert into t1 values(utc_time());
ERROR 22001: Data too long for column 'a' at row 1
insert into t1 values(utc_time(6));
ERROR 22001: Data too long for column 'a' at row 1
insert into t1 values(utc_time()-25700);
insert into t1 values(utc_time(2)-25700);
ERROR 22001: Data too long for column 'a' at row 1
select * from t1;
a

update t1 set a =utc_time(2) where a=utc_time();
update t1 set a =utc_time(6) ;
ERROR 22001: Data too long for column 'a' at row 1
update t1 set a =utc_time(3)-25699;
ERROR 22001: Data too long for column 'a' at row 1
update t1 set a =utc_time()-25701;
select * from t1;
a
 
drop table t1;
create table t1(a DATETIME);
insert into t1 values(utc_time());
insert into t1 values(utc_time(2));
insert into t1 values(utc_time(6));
insert into t1 values(utc_time()+1);
ERROR 22007: Incorrect datetime value for column 'a' at row 1
insert into t1 values(utc_time(2)+1);
ERROR 22007: Incorrect datetime value for column 'a' at row 1
insert into t1 values(utc_time(6)+1);
ERROR 22007: Incorrect datetime value for column 'a' at row 1
select * from t1;
a
1980-03-21 02:57:01
1980-03-21 02:57:02
1980-03-21 02:57:02
update t1 set a = utc_time(3) where a= utc_time();
select * from t1;
a
1980-03-21 02:57:02
1980-03-21 02:57:02
1980-03-21 02:57:02
update t1 set a = utc_time(6) where a=utc_time(3);
select * from t1;
a
1980-03-21 02:57:02
1980-03-21 02:57:02
1980-03-21 02:57:02
update t1 set a = utc_time();
select * from t1;
a
1980-03-21 02:57:01
1980-03-21 02:57:01
1980-03-21 02:57:01
update t1 set a = utc_time(3)-2;
ERROR 22007: Incorrect datetime value for column 'a' at row 1
drop table t1;
create table t1(a TIMESTAMP);
insert into t1 values(utc_time());
insert into t1 values(utc_time(2));
insert into t1 values(utc_time(6));
insert into t1 values(utc_time()+1);
ERROR 22007: Incorrect datetime value for column 'a' at row 1
insert into t1 values(utc_time(2)+1);
ERROR 22007: Incorrect datetime value for column 'a' at row 1
insert into t1 values(utc_time(6)+1);
ERROR 22007: Incorrect datetime value for column 'a' at row 1
select * from t1;
a
1980-03-21 02:57:01
1980-03-21 02:57:02
1980-03-21 02:57:02
update t1 set a = utc_time(3) where a= utc_time();
select * from t1;
a
1980-03-21 02:57:02
1980-03-21 02:57:02
1980-03-21 02:57:02
update t1 set a = utc_time(6) where a=utc_time(3);
select * from t1;
a
1980-03-21 02:57:02
1980-03-21 02:57:02
1980-03-21 02:57:02
update t1 set a = utc_time();
select * from t1;
a
1980-03-21 02:57:01
1980-03-21 02:57:01
1980-03-21 02:57:01
update t1 set a = utc_time(3)-2;
ERROR 22007: Incorrect datetime value for column 'a' at row 1
drop table t1;
create table t1(a DATE);
insert into t1 values(utc_time());
insert into t1 values(utc_time(2));
insert into t1 values(utc_time(6));
insert into t1 values(utc_time()+1);
ERROR 22007: Incorrect datetime value for column 'a' at row 1
insert into t1 values(utc_time(2)+1);
ERROR 22007: Incorrect datetime value for column 'a' at row 1
insert into t1 values(utc_time(6)+1);
ERROR 22007: Incorrect datetime value for column 'a' at row 1
select * from t1;
a
1980-03-21
1980-03-21
1980-03-21
update t1 set a = utc_time(3) where a= utc_time();
select * from t1;
a
1980-03-21
1980-03-21
1980-03-21
update t1 set a = utc_time(6) where a=utc_time(3);
select * from t1;
a
1980-03-21
1980-03-21
1980-03-21
update t1 set a = utc_time();
select * from t1;
a
1980-03-21
1980-03-21
1980-03-21
update t1 set a = utc_time(3)-2;
ERROR 22007: Incorrect datetime value for column 'a' at row 1
drop table t1;
create table t1(a TIME);
insert into t1 values(utc_time());
insert into t1 values(utc_time(2));
insert into t1 values(utc_time(6));
insert into t1 values(utc_time()+1);
insert into t1 values(utc_time(4)+1);
insert into t1 values(utc_time(6)+1);
select * from t1;
a
02:57:01
02:57:02
02:57:02
02:57:02
02:57:03
02:57:03
update t1 set a = utc_time(3) where a= utc_time();
select * from t1;
a
02:57:02
02:57:02
02:57:02
02:57:02
02:57:03
02:57:03
update t1 set a = utc_time(6) where a=utc_time(3);
select * from t1;
a
02:57:02
02:57:02
02:57:02
02:57:02
02:57:03
02:57:03
update t1 set a = utc_time();
select * from t1;
a
02:57:01
02:57:01
02:57:01
02:57:01
02:57:01
02:57:01
update t1 set a = utc_time(3)-2;
ERROR 22007: Incorrect datetime value for column 'a' at row 1
update t1 set a = utc_time(6)+1;
select * from t1;
a
02:57:03
02:57:03
02:57:03
02:57:03
02:57:03
02:57:03
drop table t1;
create table t1(a YEAR);
insert into t1 values(utc_time());
ERROR 22003: Out of range value for column 'a' at row 1
insert into t1 values(utc_time()-25700);
insert into t1 values(utc_time(4)-25699);
insert into t1 values(utc_time(6)-25699);
select * from t1;
a
2001
2003
2003
update t1 set a = utc_time(3) where a= 2001;
ERROR 22003: Out of range value for column 'a' at row 1
update t1 set a = utc_time(3)-25699 where a= 2001;
update t1 set a = utc_time() where a= 2003;
ERROR 22003: Out of range value for column 'a' at row 1
select * from t1;
a
2003
2003
2003
drop table t1;
create table t1(a VARCHAR(50));
insert into t1 values(utc_time());
insert into t1 values(utc_time(3));
insert into t1 values(utc_time(6));
insert into t1 values(utc_time()-1);
insert into t1 values(utc_time(3)+10);
insert into t1 values(utc_time(6)+10);
select * from t1;
a
02:57:01
02:57:01.589
02:57:01.589500
25700
25711.589
25711.589500
update t1 set a = utc_time(3) where a=utc_time();
select * from t1;
a
02:57:01.589
02:57:01.589
02:57:01.589500
25700
25711.589
25711.589500
update t1 set a = utc_time(3)-5 where a=utc_time()-1;
ERROR 22007: Truncated incorrect DECIMAL value: '02:57:01.589'
update t1 set a = utc_time(3)+10 where a=utc_time()-1;
ERROR 22007: Truncated incorrect DECIMAL value: '02:57:01.589'
select * from t1;
a
02:57:01.589
02:57:01.589
02:57:01.589500
25700
25711.589
25711.589500
drop table t1;
create table t1(a VARBINARY(50));
insert into t1 values(utc_time());
insert into t1 values(utc_time(3));
insert into t1 values(utc_time(6));
insert into t1 values(utc_time()-1);
insert into t1 values(utc_time(3)+10);
insert into t1 values(utc_time(6)+10);
select * from t1;
a
02:57:01
02:57:01.589
02:57:01.589500
25700
25711.589
25711.589500
update t1 set a = utc_time(3) where a=utc_time();
select * from t1;
a
02:57:01.589
02:57:01.589
02:57:01.589500
25700
25711.589
25711.589500
update t1 set a = utc_time(3)-5 where a=utc_time()-1;
ERROR 22007: Truncated incorrect DECIMAL value: '02:57:01.589'
update t1 set a = utc_time(3)+10 where a=utc_time()-1;
ERROR 22007: Truncated incorrect DECIMAL value: '02:57:01.589'
select * from t1;
a
02:57:01.589
02:57:01.589
02:57:01.589500
25700
25711.589
25711.589500
drop table t1;
create table t1(a CHAR);
insert into t1 values(utc_time());
ERROR 22001: Data too long for column 'a' at row 1
insert into t1 values(utc_time(3));
ERROR 22001: Data too long for column 'a' at row 1
insert into t1 values(utc_time()-25700);
insert into t1 values(utc_time(3)-25699);
ERROR 22001: Data too long for column 'a' at row 1
insert into t1 values(utc_time(6)-25699);
ERROR 22001: Data too long for column 'a' at row 1
select * from t1;
a
1
update t1 set a = utc_time(3) where a=utc_time()-25700;
ERROR 22001: Data too long for column 'a' at row 1
update t1 set a = utc_time()-25699 where a=utc_time()-25700;
select * from t1;
a
2
drop table t1;
create table t1(a BINARY);
insert into t1 values(utc_time());
ERROR 22001: Data too long for column 'a' at row 1
insert into t1 values(utc_time(6));
ERROR 22001: Data too long for column 'a' at row 1
insert into t1 values(utc_time()-25695);
insert into t1 values(utc_time(3)-25700);
ERROR 22001: Data too long for column 'a' at row 1
insert into t1 values(utc_time(6)-25698);
ERROR 22001: Data too long for column 'a' at row 1
select * from t1;
a
6
update t1 set a = utc_time(3) where a=6;
ERROR 22001: Data too long for column 'a' at row 1
update t1 set a = utc_time()-25701 where a=6;
select * from t1;
a
0
drop table t1;
create table t1(a enum ('c','d'));
insert into t1 values(utc_time());
ERROR 01000: Data truncated for column 'a' at row 1
insert into t1 values(utc_time()-1);
ERROR 01000: Data truncated for column 'a' at row 1
select * from t1;
a
update t1 set a = utc_time() where a=utc_time();
update t1 set a = utc_time()+1;
drop table t1;
create table t1(a set ('c','d'));
insert into t1 values(utc_time());
ERROR 01000: Data truncated for column 'a' at row 1
insert into t1 values(utc_time()-1);
ERROR 01000: Data truncated for column 'a' at row 1
select * from t1;
a
insert into t1 values('c');
update t1 set a = utc_time()+1;
ERROR 01000: Data truncated for column 'a' at row 1
drop table t1;
create table t1(a TINYTEXT);
insert into t1 values(utc_time());
insert into t1 values(utc_time(2));
insert into t1 values(utc_time(5));
insert into t1 values(utc_time()-1);
insert into t1 values(utc_time(2)+1);
insert into t1 values(utc_time(5)-1);
select * from t1;
a
02:57:01
02:57:01.58
02:57:01.58950
25700
25702.58
25700.58950
update t1 set a = utc_time() where a=utc_time();
select * from t1;
a
02:57:01
02:57:01.58
02:57:01.58950
25700
25702.58
25700.58950
update t1 set a = utc_time(3)+1;
select * from t1;
a
25702.589
25702.589
25702.589
25702.589
25702.589
25702.589
update t1 set a = utc_time(6)+1;
select * from t1;
a
25702.589500
25702.589500
25702.589500
25702.589500
25702.589500
25702.589500
drop table t1;
create table t1(a TINYBLOB);
insert into t1 values(utc_time());
insert into t1 values(utc_time(2));
insert into t1 values(utc_time(5));
insert into t1 values(utc_time()-1);
insert into t1 values(utc_time(2)+1);
insert into t1 values(utc_time(5)-1);
select * from t1;
a
02:57:01
02:57:01.58
02:57:01.58950
25700
25702.58
25700.58950
update t1 set a = utc_time() where a=utc_time();
update t1 set a = utc_time(4) where a=utc_time();
select * from t1;
a
02:57:01.5895
02:57:01.58
02:57:01.58950
25700
25702.58
25700.58950
update t1 set a = utc_time(3)+1;
select * from t1;
a
25702.589
25702.589
25702.589
25702.589
25702.589
25702.589
update t1 set a = utc_time(6)+1;
select * from t1;
a
25702.589500
25702.589500
25702.589500
25702.589500
25702.589500
25702.589500
drop table t1;
create table t1(a TEXT);
insert into t1 values(utc_time());
insert into t1 values(utc_time(2));
insert into t1 values(utc_time(5));
insert into t1 values(utc_time()-1);
insert into t1 values(utc_time(2)+1);
insert into t1 values(utc_time(5)-1);
select * from t1;
a
02:57:01
02:57:01.58
02:57:01.58950
25700
25702.58
25700.58950
update t1 set a = utc_time() where a=utc_time();
select * from t1;
a
02:57:01
02:57:01.58
02:57:01.58950
25700
25702.58
25700.58950
#第二次更新utc_time相关值，ob报错，mysql正常
update t1 set a = utc_time(4) where a=utc_time()-1;
ERROR 22007: Truncated incorrect DECIMAL value: '02:57:01'
select * from t1;
a
02:57:01
02:57:01.58
02:57:01.58950
25700
25702.58
25700.58950
update t1 set a = utc_time(3)+1;
select * from t1;
a
25702.589
25702.589
25702.589
25702.589
25702.589
25702.589
update t1 set a = utc_time(6)+1;
select * from t1;
a
25702.589500
25702.589500
25702.589500
25702.589500
25702.589500
25702.589500
drop table t1;
create table t1(a BLOB);
insert into t1 values(utc_time());
insert into t1 values(utc_time(2));
insert into t1 values(utc_time(5));
insert into t1 values(utc_time()-1);
insert into t1 values(utc_time(2)+1);
insert into t1 values(utc_time(5)-1);
select * from t1;
a
02:57:01
02:57:01.58
02:57:01.58950
25700
25702.58
25700.58950
update t1 set a = utc_time() where a=utc_time(2);
select * from t1;
a
02:57:01
02:57:01
02:57:01.58950
25700
25702.58
25700.58950
update t1 set a = utc_time(4) where a=utc_time()-1;
ERROR 22007: Truncated incorrect DECIMAL value: '02:57:01'
select * from t1;
a
02:57:01
02:57:01
02:57:01.58950
25700
25702.58
25700.58950
update t1 set a = utc_time(3)+1;
select * from t1;
a
25702.589
25702.589
25702.589
25702.589
25702.589
25702.589
update t1 set a = utc_time(6)+1 where a = utc_time(3)+1;
select * from t1;
a
25702.589500
25702.589500
25702.589500
25702.589500
25702.589500
25702.589500
drop table t1;
create table t1(a MEDIUMTEXT);
insert into t1 values(utc_time());
insert into t1 values(utc_time(2));
insert into t1 values(utc_time(5));
insert into t1 values(utc_time()-1);
insert into t1 values(utc_time(2)+1);
insert into t1 values(utc_time(5)-1);
select * from t1;
a
02:57:01
02:57:01.58
02:57:01.58950
25700
25702.58
25700.58950
update t1 set a = utc_time() where a=utc_time(2);
select * from t1;
a
02:57:01
02:57:01
02:57:01.58950
25700
25702.58
25700.58950
update t1 set a = utc_time(4) where a=utc_time()-1;
ERROR 22007: Truncated incorrect DECIMAL value: '02:57:01'
select * from t1;
a
02:57:01
02:57:01
02:57:01.58950
25700
25702.58
25700.58950
update t1 set a = utc_time(3)+1;
select * from t1;
a
25702.589
25702.589
25702.589
25702.589
25702.589
25702.589
update t1 set a = utc_time(6)+1 where a = utc_time(3)+1;
select * from t1;
a
25702.589500
25702.589500
25702.589500
25702.589500
25702.589500
25702.589500
drop table t1;
create table t1(a MEDIUMBLOB);
insert into t1 values(utc_time());
insert into t1 values(utc_time(2));
insert into t1 values(utc_time(5));
insert into t1 values(utc_time()-1);
insert into t1 values(utc_time(2)+1);
insert into t1 values(utc_time(5)-1);
select * from t1;
a
02:57:01
02:57:01.58
02:57:01.58950
25700
25702.58
25700.58950
update t1 set a = utc_time() where a=utc_time(2);
select * from t1;
a
02:57:01
02:57:01
02:57:01.58950
25700
25702.58
25700.58950
update t1 set a = utc_time(4) where a=utc_time()-1;
ERROR 22007: Truncated incorrect DECIMAL value: '02:57:01'
select * from t1;
a
02:57:01
02:57:01
02:57:01.58950
25700
25702.58
25700.58950
update t1 set a = utc_time(3)+1;
select * from t1;
a
25702.589
25702.589
25702.589
25702.589
25702.589
25702.589
update t1 set a = utc_time(5)+1 where a = utc_time(3)+1;
select * from t1;
a
25702.58950
25702.58950
25702.58950
25702.58950
25702.58950
25702.58950
drop table t1;
create table t1(a LONGTEXT);
insert into t1 values(utc_time());
insert into t1 values(utc_time(2));
insert into t1 values(utc_time(5));
insert into t1 values(utc_time()-1);
insert into t1 values(utc_time(2)+1);
insert into t1 values(utc_time(5)-1);
select * from t1;
a
02:57:01
02:57:01.58
02:57:01.58950
25700
25702.58
25700.58950
update t1 set a = utc_time() where a=utc_time(2);
select * from t1;
a
02:57:01
02:57:01
02:57:01.58950
25700
25702.58
25700.58950
update t1 set a = utc_time(4) where a=utc_time()-1;
ERROR 22007: Truncated incorrect DECIMAL value: '02:57:01'
select * from t1;
a
02:57:01
02:57:01
02:57:01.58950
25700
25702.58
25700.58950
update t1 set a = utc_time(3)+1;
select * from t1;
a
25702.589
25702.589
25702.589
25702.589
25702.589
25702.589
update t1 set a = utc_time(5)+1 where a = utc_time(3)+1;
select * from t1;
a
25702.58950
25702.58950
25702.58950
25702.58950
25702.58950
25702.58950
drop table t1;
create table t1(a LONGBLOB);
insert into t1 values(utc_time());
insert into t1 values(utc_time(2));
insert into t1 values(utc_time(5));
insert into t1 values(utc_time()-1);
insert into t1 values(utc_time(2)+1);
insert into t1 values(utc_time(5)-1);
select * from t1;
a
02:57:01
02:57:01.58
02:57:01.58950
25700
25702.58
25700.58950
update t1 set a = utc_time() where a=utc_time(2);
select * from t1;
a
02:57:01
02:57:01
02:57:01.58950
25700
25702.58
25700.58950
update t1 set a = utc_time(4) where a=utc_time()-1;
ERROR 22007: Truncated incorrect DECIMAL value: '02:57:01'
select * from t1;
a
02:57:01
02:57:01
02:57:01.58950
25700
25702.58
25700.58950
update t1 set a = utc_time(3)+1;
select * from t1;
a
25702.589
25702.589
25702.589
25702.589
25702.589
25702.589
update t1 set a = utc_time(5)+1 where a = utc_time(3)+1;
select * from t1;
a
25702.58950
25702.58950
25702.58950
25702.58950
25702.58950
25702.58950
drop table t1;
create table t1 (id int ,name varchar(20),d date);
insert into t1 values(1,'test01','20200811');
insert into t1 values(2,'test02','20200915');
insert into t1 values(3,'test03','2020-08-20');
insert into t1 values(4,'test04','2020-09-15');
insert into t1 values(utc_time()-20200908,utc_time()||'test05',utc_time());
select * from t1;
id	name	d
1	test01	2020-08-11
2	test02	2020-09-15
3	test03	2020-08-20
4	test04	2020-09-15
-20175207	1	1980-03-21
drop table t2;
create table t2 (id int ,d date);
insert into t2(id, d)  select utc_time()+0,utc_time();
select * from t2;
id	d
25701	1980-03-21
insert into t2(id, d)  select utc_time()+0,utc_time() from t1 where d>utc_time();
select * from t2;
id	d
25701	1980-03-21
25701	1980-03-21
25701	1980-03-21
25701	1980-03-21
25701	1980-03-21
drop table t2;
insert into t1 values(abs(utc_time()),UPPER(utc_time()),STR_TO_DATE(utc_time(),GET_FORMAT(DATETIME,'EUR')));
ERROR HY000: Incorrect datetime value: '02:57:01' for function str_to_date
insert into t1 values(abs(utc_time()+1),UPPER(utc_time()+1),STR_TO_DATE(utc_time()+1,GET_FORMAT(DATETIME,'USA')));
ERROR HY000: Incorrect datetime value: '25702' for function str_to_date
insert into t1 values(CEIL(utc_time()+1),RTRIM(utc_time()+1),UNIX_TIMESTAMP(utc_time()));
ERROR 22007: Incorrect datetime value for column 'd' at row 1
insert into t1 values(CEIL(utc_time()+1),RTRIM(utc_time()+1),USEC_TO_TIME(utc_time()+1));
select * from t1;
id	name	d
1	test01	2020-08-11
2	test02	2020-09-15
3	test03	2020-08-20
4	test04	2020-09-15
-20175207	1	1980-03-21
25702	25702	1970-01-01
insert into t1(d) values(-utc_time());
ERROR 22007: Incorrect datetime value for column 'd' at row 1
insert into t1(d) values(+utc_time());
insert into t1(id) values(-utc_time());
insert into t1(name) values(utc_time()+utc_time());
insert into t1(name) values(utc_time()*utc_time());
insert into t1(id) values(utc_time()/1);
insert into t1 values(utc_time()%1,utc_time()%1,utc_time()%1);
insert into t1 values(utc_time() div 1,utc_time() div 1,utc_time() div 1);
ERROR 22007: Incorrect datetime value for column 'd' at row 1
insert into t1 values(utc_time() mod 1,utc_time() mod 1,utc_time() mod 1);
insert into t1 values(utc_time()+0%1,utc_time()+1%1,utc_time()+1%1);
ERROR 22007: Incorrect datetime value for column 'd' at row 1
insert into t1 values(utc_time()-1 div 1,utc_time()-2 div 1,utc_time()-1 div 1);
ERROR 22007: Incorrect datetime value for column 'd' at row 1
insert into t1 values(utc_time()-1 mod 1,utc_time()-1 mod 1,utc_time()-1 mod 1);
ERROR 22007: Incorrect datetime value for column 'd' at row 1
insert into t1 values(utc_time()-1 * 1,utc_time()-1 * 1,utc_time()-1 * 1);
ERROR 22007: Incorrect datetime value for column 'd' at row 1
select * from t1;
id	name	d
1	test01	2020-08-11
2	test02	2020-09-15
3	test03	2020-08-20
4	test04	2020-09-15
-20175207	1	1980-03-21
25702	25702	1970-01-01
NULL	NULL	1980-03-21
-25701	NULL	NULL
NULL	51402	NULL
NULL	660541401	NULL
25701	NULL	NULL
0	0	0000-00-00
0	0	0000-00-00
drop table t1;
obmysql-utc_time-4-1-3
create table t1 (id int ,name varchar(20),d date);
insert into t1 values(1,'test01','20200811');
insert into t1 values(2,'test02','20200915');
insert into t1 values(3,'test03','2020-08-20');
insert into t1 values(4,'test04','2020-09-15');
insert into t1 values(utc_time()-20200908,utc_time()||'test05',utc_time());
insert into t1 values(6,'test06',utc_time());
update t1 set id= utc_time() where name='test01';
update t1 set id= utc_time()+0 where name='test01';
select * from t1;
id	name	d
25701	test01	2020-08-11
2	test02	2020-09-15
3	test03	2020-08-20
4	test04	2020-09-15
-20175207	1	1980-03-21
6	test06	1980-03-21
update t1 set id= utc_time(),d=utc_time()+0 where name in ('test01','test02');
ERROR 22007: Incorrect datetime value for column 'd' at row 1
update t1 set id= utc_time()+0,d=utc_time() where name in ('test01','test02');
update t1 set id= utc_time(),d=utc_time()+0 where name in ('test01','test02');
ERROR 22007: Incorrect datetime value for column 'd' at row 1
update t1 set id= utc_time() where d>utc_time();
update t1 set id= utc_time()+0  where d>utc_time()+0;
ERROR 22007: Incorrect value
update t1 set id= utc_time() where d>utc_time();
update t1 set id= utc_time()+0  where d<utc_time()+0;
ERROR 22007: Incorrect value
update t1 set id= utc_time(5) where d=utc_time();
update t1 set id= utc_time() where d<=utc_time();
update t1 set id= utc_time(6) where d between utc_time() and utc_time()+3 ;
ERROR 22007: Incorrect value
update t1 set id= utc_time()+0 where d = utc_time()  or id=utc_time() ;
update t1 set id= utc_time()+0 where name like 'test%' ;
update t1 set id= utc_time() where name not like 'test%' ;
update t1 set id= utc_time() where d>any(select utc_time());
update t1 set id= utc_time(6)+1 where d<all(select utc_time());
update t1 set id= abs(utc_time(5));
update t1 set id= abs(utc_time()+1);
update t1 set id= TO_DAYS(utc_time());
update t1 set id= LOCATE(utc_time()-1,utc_time());
update t1 set id= DATE_ADD(utc_time()+0,INTERVAL 5 DAY);
ERROR 22007: Incorrect datetime value for column 'id' at row 1
update t1 set name= utc_time()+ utc_time();
update t1 set name= utc_time()+0- utc_time();
update t1 set name= utc_time()/utc_time();
update t1 set name= utc_time()-1*utc_time()+1;
update t1 set name= utc_time()%utc_time();
update t1 set name= utc_time() MOD utc_time();
update t1 set name= utc_time()-1 div utc_time()+0;
update t1 set name= utc_time()+1|| utc_time()+1;
select * from t1;
id	name	d
0	1	1980-03-21
0	1	1980-03-21
0	1	2020-08-20
0	1	2020-09-15
0	1	1980-03-21
0	1	1980-03-21
drop table t1;
create table t1(name varchar(utc_time()-20200900));
ERROR 42000: You have an error in your SQL syntax; check the manual that corresponds to your OceanBase version for the right syntax to use near 'utc_time()-20200900))' at line 1
create table t1(id int ,name varchar(20) default utc_time());
ERROR 42000: You have an error in your SQL syntax; check the manual that corresponds to your OceanBase version for the right syntax to use near 'utc_time())' at line 1
create table t1(id int, name varchar(20) GENERATED ALWAYS AS (utc_time()) STORED NOT NULL COMMENT '姓名');
ERROR HY000: Expression of generated column contains a disallowed function
create table t1(id int GENERATED ALWAYS AS (utc_time()) STORED NOT NULL COMMENT '编号');
ERROR HY000: Expression of generated column contains a disallowed function
create table t1(id int, name varchar(20) GENERATED ALWAYS AS (utc_time()+0) STORED NOT NULL COMMENT '姓名');
ERROR HY000: Expression of generated column contains a disallowed function
create table t1(id int GENERATED ALWAYS AS (utc_time()+0) STORED NOT NULL COMMENT '编号');
ERROR HY000: Expression of generated column contains a disallowed function
drop table t1;
create table t1(id int, name varchar(30));
alter  table t1 modify  column name int(utc_time);
ERROR 42000: You have an error in your SQL syntax; check the manual that corresponds to your OceanBase version for the right syntax to use near 'utc_time)' at line 1
alter  table t1 modify  column name varchar(30)  DEFAULT utc_time();
ERROR 42000: You have an error in your SQL syntax; check the manual that corresponds to your OceanBase version for the right syntax to use near 'utc_time()' at line 1
alter  table t1 modify  column name varchar(30)  GENERATED ALWAYS AS (utc_time()+0) STORED NOT NULL COMMENT '姓名';
ERROR HY000: Expression of generated column contains a disallowed function
drop table t1;
create table t1 (id int primary key, name varchar(30)) partition by hash(id) partitions 3;
insert into t1 values(utc_time()+1,utc_time());
insert into t1 values(utc_time()+2,utc_time()+0);
insert into t1 values(utc_time()+3,utc_time());
insert into t1 values(utc_time()+4,utc_time()+1);
update t1 set id =utc_time();
update t1 set id =utc_time()+1;
update t1 set name =utc_time();
update t1 set name =utc_time()+1;
select * from t1;
id	name
25704	25702
25702	25702
25705	25702
25703	25702
drop table t1;
create table t1 (id int ,name varchar(20),d time);
insert into t1 values(1,'test01','02:57:01.444');
insert into t1 values(2,'test02','025701');
insert into t1 values(3,'test03',utc_time(6)+10);
insert into t1 values(4,'test04','utc_time()-1');
ERROR 22007: Incorrect value
insert into t1 values(utc_time()-25696,utc_time()||'test05',utc_time());
select * from t1;
id	name	d
1	test01	02:57:01
2	test02	02:57:01
3	test03	02:57:12
5	1	02:57:01
drop table t2;
create table t2 (id int ,d time);
insert into t2(id, d)  select utc_time()+0,utc_time(6);
insert into t2(id, d)  select utc_time(3)+1,utc_time();
select * from t2;
id	d
25701	02:57:02
25703	02:57:01
insert into t2(id, d)  select utc_time()+0,utc_time() from t1 where d>=utc_time();
select * from t2;
id	d
25701	02:57:02
25703	02:57:01
25701	02:57:01
25701	02:57:01
25701	02:57:01
25701	02:57:01
drop table t2;
insert into t1 values(abs(utc_time()),UPPER(utc_time()),STR_TO_DATE(utc_time(),GET_FORMAT(TIME,'internal')));
insert into t1 values(abs(utc_time(6)),UPPER(utc_time()),STR_TO_DATE(utc_time(6),GET_FORMAT(TIME,'jis')));
insert into t1 values(abs(utc_time(6)),UPPER(utc_time()),STR_TO_DATE(utc_time(),GET_FORMAT(TIME,'jis')));
insert into t1 values(10,"test10",STR_TO_DATE(utc_time(6),GET_FORMAT(TIME,'eur')));
ERROR HY000: Incorrect datetime value: '02:57:01.589500' for function str_to_date
insert into t1 values(10,"test10",STR_TO_DATE(utc_time(6),GET_FORMAT(TIME,'iso')));
insert into t1 values(10,"test10",STR_TO_DATE(utc_time()+1,GET_FORMAT(TIME,'iso')));
ERROR HY000: Incorrect datetime value: '25702' for function str_to_date
insert into t1 values(10,"test10",STR_TO_DATE(utc_time(6),GET_FORMAT(TIME,'usa')));
ERROR HY000: Incorrect datetime value: '02:57:01.589500' for function str_to_date
insert into t1 values(abs(utc_time(4)+1),UPPER(utc_time(1)+1),STR_TO_DATE(utc_time()+1,GET_FORMAT(DATETIME,'USA')));
ERROR HY000: Incorrect datetime value: '25702' for function str_to_date
insert into t1 values(abs(utc_time(4)+1),UPPER(utc_time(1)+1),STR_TO_DATE(utc_time(),GET_FORMAT(DATETIME,'internal')));
ERROR HY000: Incorrect datetime value: '02:57:01' for function str_to_date
insert into t1 values(abs(utc_time(4)+1),UPPER(utc_time(1)+1),STR_TO_DATE(utc_time(),GET_FORMAT(DATETIME,'jis')));
ERROR HY000: Incorrect datetime value: '02:57:01' for function str_to_date
insert into t1 values(abs(utc_time(4)+1),UPPER(utc_time(1)+1),STR_TO_DATE(utc_time(),GET_FORMAT(DATE,'jis')));
ERROR HY000: Incorrect datetime value: '02:57:01' for function str_to_date
insert into t1 values(abs(utc_time(4)+1),UPPER(utc_time(1)+1),utc_time(4));
insert into t1 values(CEIL(utc_time()+1),RTRIM(utc_time()+1),UNIX_TIMESTAMP(utc_time()));
ERROR 22007: Incorrect datetime value for column 'd' at row 1
insert into t1 values(CEIL(utc_time()+1),RTRIM(utc_time()+1),UNIX_TIMESTAMP(utc_time(6)));
ERROR 22007: Incorrect datetime value for column 'd' at row 1
insert into t1 values(CEIL(utc_time()+1),RTRIM(utc_time()+1),UNIX_TIMESTAMP(utc_time(6)+1));
ERROR 22007: Incorrect datetime value for column 'd' at row 1
insert into t1 values(CEIL(utc_time()+1),RTRIM(utc_time()+1),USEC_TO_TIME(utc_time()+1));
insert into t1 values(CEIL(utc_time()+1),RTRIM(utc_time()+1),USEC_TO_TIME(utc_time(6)+1));
insert into t1 values(CEIL(utc_time()+1),RTRIM(utc_time()+1),USEC_TO_TIME(utc_time(6)));
insert into t1 values(CEIL(utc_time()+1),RTRIM(utc_time()+1),TIME(utc_time(6)));
insert into t1 values(CEIL(utc_time()+1),RTRIM(utc_time()+1),TIME(utc_time(6)+1));
select * from t1;
id	name	d
1	test01	02:57:01
2	test02	02:57:01
3	test03	02:57:12
5	1	02:57:01
25701	02:57:01	02:00:00
25702	02:57:01	02:57:01
25702	02:57:01	02:57:01
10	test10	02:57:01
25703	25702.5	02:57:02
25702	25702	08:00:00
25702	25702	08:00:00
25702	25702	08:00:00
25702	25702	02:57:02
25702	25702	02:57:03
insert into t1(d) values(-utc_time(6));
insert into t1(d) values(+utc_time());
insert into t1(id) values(-utc_time());
insert into t1(name) values(utc_time(6)+utc_time(3));
insert into t1(name) values(utc_time()*utc_time());
insert into t1(id) values(utc_time(6)/1);
insert into t1 values(utc_time()%1,utc_time()%1,utc_time(6)%1);
insert into t1 values(utc_time() div 1,utc_time(3) div 1,utc_time() div 1);
insert into t1 values(utc_time() mod 1,utc_time(2) mod 1,utc_time() mod 1);
insert into t1 values(utc_time()+0%1,utc_time()+1%1,utc_time(6)+1%1);
insert into t1 values(utc_time()-1 div 1,utc_time(3)-2 div 1,utc_time()-1 div 1);
insert into t1 values(utc_time()-1 mod 1,utc_time()-1 mod 1,utc_time()-1 mod 1);
insert into t1 values(utc_time()-1 * 1,utc_time(4)-1 * 1,utc_time()-1 * 1);
select * from t1;
id	name	d
1	test01	02:57:01
2	test02	02:57:01
3	test03	02:57:12
5	1	02:57:01
25701	02:57:01	02:00:00
25702	02:57:01	02:57:01
25702	02:57:01	02:57:01
10	test10	02:57:01
25703	25702.5	02:57:02
25702	25702	08:00:00
25702	25702	08:00:00
25702	25702	08:00:00
25702	25702	02:57:02
25702	25702	02:57:03
NULL	NULL	-02:57:02
NULL	NULL	02:57:01
-25701	NULL	NULL
NULL	51403.178500	NULL
NULL	660541401	NULL
25702	NULL	NULL
0	0	00:00:01
25701	25701	02:57:01
0	0.58	00:00:00
25701	25701	02:57:02
25700	25699.589	02:57:00
25701	25701	02:57:01
25700	25700.5895	02:57:00
drop table t1;
obmysql-utc_time-4-1-3
create table t1 (id int ,name varchar(20),d time);
insert into t1 values(1,'test01','14:06:10');
insert into t1 values(2,'test02','01:00:00');
insert into t1 values(3,'test03','04:55:10');
insert into t1 values(4,'test04','00:56:10');
insert into t1 values(4,'test04','02:57:01');
update t1 set id= utc_time() where name='test01';
update t1 set id= utc_time(6)+0 where name='test01';
update t1 set id= utc_time(),d=utc_time()+0 where name in ('test01','test02');
update t1 set id= utc_time()+0,d=utc_time(4) where name in ('test01','test02');
update t1 set id= utc_time(3),d=utc_time()+0 where name in ('test01','test02');
update t1 set id= utc_time(2) where d>utc_time(2);
update t1 set id= utc_time(1)+0  where d>utc_time(3)+2;
update t1 set id= utc_time(5) where d>utc_time(3);
update t1 set id= utc_time(4)+0  where d<utc_time()+0;
update t1 set id= utc_time() where d=utc_time();
update t1 set id= utc_time() where d<=utc_time();
update t1 set id= utc_time() where d between utc_time() and utc_time()+3 ;
update t1 set id= utc_time(3)+0 where d = utc_time()  or id=utc_time() ;
update t1 set id= utc_time()+0 where name like 'test%' ;
update t1 set id= utc_time(5) where name not like 'test%' ;
update t1 set id= utc_time() where d>any(select utc_time());
update t1 set id= utc_time(4)+1 where d<all(select utc_time());
update t1 set id= abs(utc_time(2));
update t1 set id= abs(utc_time()+1);
update t1 set id= TO_DAYS(utc_time());
update t1 set id= LOCATE(utc_time()-1,utc_time(4));
update t1 set d =utc_time();
update t1 set d= utc_time(6);
update t1 set d =utc_time()+0;
update t1 set d= utc_time(6)+0;
select * from t1;
id	name	d
0	test01	02:57:02
0	test02	02:57:02
0	test03	02:57:02
0	test04	02:57:02
0	test04	02:57:02
update t1 set id= DATE_ADD(utc_time(3)+0,INTERVAL 5 DAY);
ERROR 22007: Incorrect datetime value for column 'id' at row 1
update t1 set d= DATE_ADD(utc_time()+0,INTERVAL 5 DAY);
ERROR 22007: Incorrect datetime value for column 'd' at row 1
update t1 set name= utc_time(3)+ utc_time(4);
update t1 set name= utc_time(2)+6- utc_time(1);
update t1 set name= utc_time()/utc_time();
update t1 set name= utc_time()-1*utc_time()+1;
update t1 set name= utc_time()%utc_time();
update t1 set name= utc_time(5) MOD utc_time(3);
update t1 set name= utc_time()-1 div utc_time()+0;
update t1 set name= utc_time()+1|| utc_time()+1;
update t1 set id=utc_time(4),name=utc_time();
select * from t1;
id	name	d
25701	02:57:01	02:57:02
25701	02:57:01	02:57:02
25701	02:57:01	02:57:02
25701	02:57:01	02:57:02
25701	02:57:01	02:57:02
drop table t1;
create table t1(name varchar(utc_time()-20200900));
ERROR 42000: You have an error in your SQL syntax; check the manual that corresponds to your OceanBase version for the right syntax to use near 'utc_time()-20200900))' at line 1
create table t1(id int ,name varchar(20) default utc_time());
ERROR 42000: You have an error in your SQL syntax; check the manual that corresponds to your OceanBase version for the right syntax to use near 'utc_time())' at line 1
create table t1(id int, name varchar(20) GENERATED ALWAYS AS (utc_time()) STORED NOT NULL COMMENT '姓名');
ERROR HY000: Expression of generated column contains a disallowed function
create table t1(id int GENERATED ALWAYS AS (utc_time()) STORED NOT NULL COMMENT '编号');
ERROR HY000: Expression of generated column contains a disallowed function
create table t1(id int, name varchar(20) GENERATED ALWAYS AS (utc_time()+0) virtual NOT NULL COMMENT '姓名');
ERROR HY000: Expression of generated column contains a disallowed function
create table t1(id int GENERATED ALWAYS AS (utc_time()+0) virtual NOT NULL COMMENT '编号');
ERROR HY000: Expression of generated column contains a disallowed function
drop table t1;
create table t1(id int, name varchar(30));
alter  table t1 modify  column name int(utc_time);
ERROR 42000: You have an error in your SQL syntax; check the manual that corresponds to your OceanBase version for the right syntax to use near 'utc_time)' at line 1
alter  table t1 modify  column name varchar(30)  DEFAULT utc_time();
ERROR 42000: You have an error in your SQL syntax; check the manual that corresponds to your OceanBase version for the right syntax to use near 'utc_time()' at line 1
alter  table t1 modify  column name varchar(30)  GENERATED ALWAYS AS (utc_time()+0) STORED NOT NULL COMMENT '姓名';
ERROR HY000: Expression of generated column contains a disallowed function
alter  table t1 modify  column name varchar(30)  GENERATED ALWAYS AS (utc_time()+0) VIRTUAL NOT NULL COMMENT '姓名';
ERROR HY000: Expression of generated column contains a disallowed function
drop table t1;
create table t1 (id int primary key, name varchar(30)) partition by hash(id) partitions 3;
insert into t1 values(utc_time(3)+1,utc_time(4));
insert into t1 values(utc_time(2)+2,utc_time(6)+0);
insert into t1 values(utc_time()+3,utc_time(5));
insert into t1 values(utc_time(5)+4,utc_time()+1);
select * from t1;
id	name
25704	25701.589500
25703	02:57:01.5895
25706	25702
update t1 set id =utc_time();
update t1 set id =utc_time(4)+1;
update t1 set name =utc_time(3);
update t1 set name =utc_time()+1;
select * from t1;
id	name
25704	25702
25703	25702
25706	25702
drop table t1;
obmysql-utc_time-4-2 视图
drop table t1;
create table t1 (id int ,name varchar(20),d time);
insert into t1 values(1,'test01','15:02:10');
insert into t1 values(2,'test02','02:57:01');
insert into t1 values(3,'test03','02:30:10');
insert into t1 values(4,'test04','14:10:11');
insert into t1 values(5,'test05','01:20:13');
drop view v1;
create view v1 as select * from t1;
drop view v2;
create view v2 as select * from t1 where d=utc_time();
select * from v2;
id	name	d
2	test02	02:57:01
select * from v1;
id	name	d
1	test01	15:02:10
2	test02	02:57:01
3	test03	02:30:10
4	test04	14:10:11
5	test05	01:20:13
select DATEDIFF(utc_time()-1,utc_time(6)) from v1;
DATEDIFF(utc_time()-1,utc_time(6))
NULL
NULL
NULL
NULL
NULL
select MOD(utc_time(3)+5,utc_time()) from v1;
MOD(utc_time(3)+5,utc_time())
5.589
5.589
5.589
5.589
5.589
select time(utc_time()),COALESCE(utc_time(6)) from v1;
time(utc_time())	COALESCE(utc_time(6))
02:57:01	02:57:01.589500
02:57:01	02:57:01.589500
02:57:01	02:57:01.589500
02:57:01	02:57:01.589500
02:57:01	02:57:01.589500
SELECT INSTR(utc_time(6),utc_time()+0) from v1;
INSTR(utc_time(6),utc_time()+0)
0
0
0
0
0
select LENGTH(utc_time()+1),LENGTH(utc_time()) from v1;
LENGTH(utc_time()+1)	LENGTH(utc_time())
5	8
5	8
5	8
5	8
5	8
SELECT LOCATE(2,utc_time()+0,utc_time(3)-25699) from v1;
LOCATE(2,utc_time()+0,utc_time(3)-25699)
0
0
0
0
0
select MD5(utc_time()),MD5(utc_time()+1) from v1;
MD5(utc_time())	MD5(utc_time()+1)
3650b8465a3e0216f3fb0d79101886ff	1f422c75031b07a409aa665065fdc42b
3650b8465a3e0216f3fb0d79101886ff	1f422c75031b07a409aa665065fdc42b
3650b8465a3e0216f3fb0d79101886ff	1f422c75031b07a409aa665065fdc42b
3650b8465a3e0216f3fb0d79101886ff	1f422c75031b07a409aa665065fdc42b
3650b8465a3e0216f3fb0d79101886ff	1f422c75031b07a409aa665065fdc42b
select v1.*,utc_time()+0, utc_time(3) from v1 where utc_time(3)>d;
id	name	d	utc_time()+0	utc_time(3)
2	test02	02:57:01	25701	02:57:01.589
3	test03	02:30:10	25701	02:57:01.589
5	test05	01:20:13	25701	02:57:01.589
select v1.*,utc_time()-0, utc_time(5) from v1 where utc_time()>=d;
id	name	d	utc_time()-0	utc_time(5)
2	test02	02:57:01	25701	02:57:01.58950
3	test03	02:30:10	25701	02:57:01.58950
5	test05	01:20:13	25701	02:57:01.58950
select v1.*,utc_time()-0, utc_time(1)  from v1 where utc_time()<=d;
id	name	d	utc_time()-0	utc_time(1)
1	test01	15:02:10	25701	02:57:01.5
2	test02	02:57:01	25701	02:57:01.5
4	test04	14:10:11	25701	02:57:01.5
select v1.*,utc_time()+0, utc_time(0)  from v1 where utc_time()=d;
id	name	d	utc_time()+0	utc_time(0)
2	test02	02:57:01	25701	02:57:01
select v1.*,utc_time()+0, utc_time(0)  from v1 where utc_time(3)=d;
id	name	d	utc_time()+0	utc_time(0)
select v1.*,utc_time(5)+0, utc_time()  from v1 where d=utc_time();
id	name	d	utc_time(5)+0	utc_time()
2	test02	02:57:01	25701.58950	02:57:01
select v1.*,utc_time(4)+0, utc_time()  from v1 where utc_time(6)<d;
id	name	d	utc_time(4)+0	utc_time()
1	test01	15:02:10	25701.5895	02:57:01
4	test04	14:10:11	25701.5895	02:57:01
select v1.*,utc_time()+0, utc_time()  from v1 where utc_time(3)+0>d;
id	name	d	utc_time()+0	utc_time()
2	test02	02:57:01	25701	02:57:01
3	test03	02:30:10	25701	02:57:01
5	test05	01:20:13	25701	02:57:01
select v1.*,utc_time(5)-0, utc_time(5)  from v1 where utc_time(4)-1>=d;
id	name	d	utc_time(5)-0	utc_time(5)
3	test03	02:30:10	25701.58950	02:57:01.58950
5	test05	01:20:13	25701.58950	02:57:01.58950
select v1.*,utc_time(5)-0, utc_time(5)  from v1 where utc_time()-1>=d;
id	name	d	utc_time(5)-0	utc_time(5)
3	test03	02:30:10	25701.58950	02:57:01.58950
5	test05	01:20:13	25701.58950	02:57:01.58950
select v1.*,utc_time()+0, utc_time()  from v1 where utc_time()+2<=d;
id	name	d	utc_time()+0	utc_time()
1	test01	15:02:10	25701	02:57:01
4	test04	14:10:11	25701	02:57:01
select v1.*,utc_time(4)-0, utc_time(6)  from v1 where utc_time()-3=d;
id	name	d	utc_time(4)-0	utc_time(6)
select v1.*,utc_time(5)+0, utc_time(3)  from v1 where utc_time(3)-0<d;
id	name	d	utc_time(5)+0	utc_time(3)
1	test01	15:02:10	25701.58950	02:57:01.589
4	test04	14:10:11	25701.58950	02:57:01.589
select v1.*,utc_time()+0, utc_time()  from v1 where d<utc_time()-0;
id	name	d	utc_time()+0	utc_time()
3	test03	02:30:10	25701	02:57:01
5	test05	01:20:13	25701	02:57:01
select v1.*,utc_time()-0, utc_time()  from v1 where d=utc_time(6) or utc_time()+1>=d;
id	name	d	utc_time()-0	utc_time()
2	test02	02:57:01	25701	02:57:01
3	test03	02:30:10	25701	02:57:01
5	test05	01:20:13	25701	02:57:01
select v1.*,utc_time(6)+0 as a, utc_time()  from v1 where d=utc_time() and utc_time()-1<=d;
id	name	d	a	utc_time()
2	test02	02:57:01	25701.589500	02:57:01
select v1.*,utc_time()+0, utc_time()  from v1 where d between utc_time() and utc_time()+5;
id	name	d	utc_time()+0	utc_time()
2	test02	02:57:01	25701	02:57:01
select v1.*,utc_time(3)-0, utc_time()  from v1 where d like 'utc_time(5)%';
id	name	d	utc_time(3)-0	utc_time()
select v1.*,utc_time()+0, utc_time()  from v1 where d not like 'utc_time()%';
id	name	d	utc_time()+0	utc_time()
1	test01	15:02:10	25701	02:57:01
2	test02	02:57:01	25701	02:57:01
3	test03	02:30:10	25701	02:57:01
4	test04	14:10:11	25701	02:57:01
5	test05	01:20:13	25701	02:57:01
select v1.*,utc_time(2)+0, utc_time()  from v1 where d not like 'utc_time()+0%';
id	name	d	utc_time(2)+0	utc_time()
1	test01	15:02:10	25701.58	02:57:01
2	test02	02:57:01	25701.58	02:57:01
3	test03	02:30:10	25701.58	02:57:01
4	test04	14:10:11	25701.58	02:57:01
5	test05	01:20:13	25701.58	02:57:01
select v1.*,utc_time(1)-0, utc_time()  from v1 where d like 'utc_time()-0%';
id	name	d	utc_time(1)-0	utc_time()
select v1.*,utc_time()-0, utc_time()  from v1 where exists (select utc_time(),utc_time()+0);
id	name	d	utc_time()-0	utc_time()
1	test01	15:02:10	25701	02:57:01
2	test02	02:57:01	25701	02:57:01
3	test03	02:30:10	25701	02:57:01
4	test04	14:10:11	25701	02:57:01
5	test05	01:20:13	25701	02:57:01
select v1.*,utc_time(3)-0, utc_time()  from v1 where d in  (select utc_time());
id	name	d	utc_time(3)-0	utc_time()
2	test02	02:57:01	25701.589	02:57:01
select v1.*,utc_time(3)-0, utc_time()  from v1 where d in  (select utc_time(5)+2);
id	name	d	utc_time(3)-0	utc_time()
select v1.*,utc_time()-0, utc_time()  from v1 where d in  (utc_time()+2,utc_time());
id	name	d	utc_time()-0	utc_time()
2	test02	02:57:01	25701	02:57:01
select v1.*,utc_time()-0, utc_time()  from v1 where d >any(utc_time()+2,utc_time(2));
ERROR 42000: You have an error in your SQL syntax; check the manual that corresponds to your OceanBase version for the right syntax to use near 'utc_time()+2,utc_time(2))' at line 1
select v1.*,utc_time()-0, utc_time()  from v1 where d >all(utc_time()+2,utc_time());
ERROR 42000: You have an error in your SQL syntax; check the manual that corresponds to your OceanBase version for the right syntax to use near 'utc_time()+2,utc_time())' at line 1
select v1.*,utc_time()-0, utc_time()  from v1 where d >=all(select utc_time()+2 from v1);
id	name	d	utc_time()-0	utc_time()
1	test01	15:02:10	25701	02:57:01
4	test04	14:10:11	25701	02:57:01
select v1.*,utc_time()-0, utc_time()  from v1 where d <=any(select utc_time()+2 from v1);
id	name	d	utc_time()-0	utc_time()
2	test02	02:57:01	25701	02:57:01
3	test03	02:30:10	25701	02:57:01
5	test05	01:20:13	25701	02:57:01
select v1.*,utc_time()-0, utc_time()  from v1 where id >2;
id	name	d	utc_time()-0	utc_time()
3	test03	02:30:10	25701	02:57:01
4	test04	14:10:11	25701	02:57:01
5	test05	01:20:13	25701	02:57:01
select v1.*,utc_time(4)-0, utc_time()  from v1 where id =2;
id	name	d	utc_time(4)-0	utc_time()
2	test02	02:57:01	25701.5895	02:57:01
select v1.*,utc_time()-0, utc_time(5)  from v1 where id =2 or name ='test03';
id	name	d	utc_time()-0	utc_time(5)
2	test02	02:57:01	25701	02:57:01.58950
3	test03	02:30:10	25701	02:57:01.58950
select v1.*,utc_time()-0, utc_time(3)  from v1 where id in (1,2,3);
id	name	d	utc_time()-0	utc_time(3)
1	test01	15:02:10	25701	02:57:01.589
2	test02	02:57:01	25701	02:57:01.589
3	test03	02:30:10	25701	02:57:01.589
select utc_time()+utc_time() from v1 where id>3;
utc_time()+utc_time()
51402
51402
select utc_time(6)-utc_time() from v1;
utc_time(6)-utc_time()
0.589500
0.589500
0.589500
0.589500
0.589500
select utc_time()*utc_time(5) from v1;
utc_time()*utc_time(5)
660556551.73950
660556551.73950
660556551.73950
660556551.73950
660556551.73950
select utc_time(3)/utc_time(3) from v1;
utc_time(3)/utc_time(3)
1.0000000
1.0000000
1.0000000
1.0000000
1.0000000
select utc_time(1)%utc_time(0) from v1;
utc_time(1)%utc_time(0)
0.5
0.5
0.5
0.5
0.5
select utc_time() div utc_time() from v1;
utc_time() div utc_time()
1
1
1
1
1
select utc_time(3) mod utc_time() from v1;
utc_time(3) mod utc_time()
0.589
0.589
0.589
0.589
0.589
select -utc_time(5) from v1;
-utc_time(5)
-25701.58950
-25701.58950
-25701.58950
-25701.58950
-25701.58950
select +utc_time() from v1;
+utc_time()
02:57:01
02:57:01
02:57:01
02:57:01
02:57:01
select utc_time()+0+utc_time() from v1 where id>3;
utc_time()+0+utc_time()
51402
51402
select utc_time(4)-utc_time(6)+0 from v1;
utc_time(4)-utc_time(6)+0
0.000000
0.000000
0.000000
0.000000
0.000000
select utc_time()*utc_time()+0 from v1;
utc_time()*utc_time()+0
660541401
660541401
660541401
660541401
660541401
select utc_time(4)+0/utc_time() from v1;
utc_time(4)+0/utc_time()
25701.5895
25701.5895
25701.5895
25701.5895
25701.5895
select utc_time()%utc_time(6)+0 from v1;
utc_time()%utc_time(6)+0
25701.000000
25701.000000
25701.000000
25701.000000
25701.000000
select utc_time(1)+0 div utc_time(4) from v1;
utc_time(1)+0 div utc_time(4)
25701.5
25701.5
25701.5
25701.5
25701.5
select utc_time() mod utc_time()+0 from v1;
utc_time() mod utc_time()+0
0
0
0
0
0
select -utc_time()+0 from v1;
-utc_time()+0
-25701
-25701
-25701
-25701
-25701
select +utc_time()+0 from v1;
+utc_time()+0
25701
25701
25701
25701
25701
select distinct utc_time(4) from v1;
utc_time(4)
02:57:01.5895
select distinct utc_time()+20 from v1;
utc_time()+20
25721
select  utc_time() from v1;
utc_time()
02:57:01
02:57:01
02:57:01
02:57:01
02:57:01
select  utc_time(5)+1 from v1;
utc_time(5)+1
25702.58950
25702.58950
25702.58950
25702.58950
25702.58950
select v1.*,utc_time(4)-0, utc_time() from v1 group by id;
id	name	d	utc_time(4)-0	utc_time()
1	test01	15:02:10	25701.5895	02:57:01
2	test02	02:57:01	25701.5895	02:57:01
3	test03	02:30:10	25701.5895	02:57:01
4	test04	14:10:11	25701.5895	02:57:01
5	test05	01:20:13	25701.5895	02:57:01
select v1.*,utc_time(5)-0, utc_time() from v1 group by utc_time(3),utc_time(4)+0;
id	name	d	utc_time(5)-0	utc_time()
1	test01	15:02:10	25701.58950	02:57:01
select v1.*,utc_time()-0, utc_time(3) from v1 group by utc_time() having utc_time()>='02:57:01';
id	name	d	utc_time()-0	utc_time(3)
1	test01	15:02:10	25701	02:57:01.589
select v1.*,utc_time()-0, utc_time(2) from v1 group by utc_time() having utc_time()-0>=25701;
id	name	d	utc_time()-0	utc_time(2)
1	test01	15:02:10	25701	02:57:01.58
select v1.*,utc_time()-0, utc_time(1) from v1 order by utc_time();
id	name	d	utc_time()-0	utc_time(1)
1	test01	15:02:10	25701	02:57:01.5
2	test02	02:57:01	25701	02:57:01.5
3	test03	02:30:10	25701	02:57:01.5
4	test04	14:10:11	25701	02:57:01.5
5	test05	01:20:13	25701	02:57:01.5
select v1.*,utc_time(0)-0, utc_time() from v1 order by utc_time()+0;
id	name	d	utc_time(0)-0	utc_time()
1	test01	15:02:10	25701	02:57:01
2	test02	02:57:01	25701	02:57:01
3	test03	02:30:10	25701	02:57:01
4	test04	14:10:11	25701	02:57:01
5	test05	01:20:13	25701	02:57:01
select v1.*,utc_time()-0, utc_time() from v1  where d =utc_time() order by utc_time();
id	name	d	utc_time()-0	utc_time()
2	test02	02:57:01	25701	02:57:01
select v1.*,utc_time()-0, utc_time() from v1 where d =utc_time()+0 order by utc_time()+0;
id	name	d	utc_time()-0	utc_time()
2	test02	02:57:01	25701	02:57:01
select v1.* , case utc_time()  when utc_time()  then utc_time(3)  when utc_time()+1  then    utc_time()+1  end as a  from v1;
id	name	d	a
1	test01	15:02:10	02:57:01.589
2	test02	02:57:01	02:57:01.589
3	test03	02:30:10	02:57:01.589
4	test04	14:10:11	02:57:01.589
5	test05	01:20:13	02:57:01.589
select v1.* , case utc_time()+1  when utc_time()  then utc_time()  when utc_time()+1  then    utc_time()+1  end as a  from v1;
id	name	d	a
1	test01	15:02:10	25702
2	test02	02:57:01	25702
3	test03	02:30:10	25702
4	test04	14:10:11	25702
5	test05	01:20:13	25702
select count(utc_time(6)) from v1;
count(utc_time(6))
5
select count(utc_time()+0) from v1;
count(utc_time()+0)
5
select sum(utc_time(4)) from v1;
sum(utc_time(4))
128507.9475
select sum(utc_time(6)+0) from v1;
sum(utc_time(6)+0)
128507.947500
select avg(utc_time(3)) from v1;
avg(utc_time(3))
25701.5890000
select avg(utc_time(5)+0) from v1;
avg(utc_time(5)+0)
25701.589500000
select min(utc_time()) from v1;
min(utc_time())
02:57:01
select min(utc_time()+0) from v1;
min(utc_time()+0)
25701
select max(utc_time()) from v1;
max(utc_time())
02:57:01
select max(utc_time()+0) from v1;
max(utc_time()+0)
25701
select GROUP_CONCAT(utc_time()) from v1;
GROUP_CONCAT(utc_time())
02:57:01,02:57:01,02:57:01,02:57:01,02:57:01
select GROUP_CONCAT(utc_time()+0) from v1;
GROUP_CONCAT(utc_time()+0)
25701,25701,25701,25701,25701
select * from v1;
id	name	d
1	test01	15:02:10
2	test02	02:57:01
3	test03	02:30:10
4	test04	14:10:11
5	test05	01:20:13
insert into v1(id,name,d) values(utc_time()+0,utc_time(),utc_time(3));
insert into v1(id,name,d) values(utc_time()+0,utc_time(),utc_time(3)+0);
insert into v1(id,name,d) values(utc_time(),utc_time()+0,utc_time(5)+0);
insert into v1(id,name,d) values(utc_time()-1,utc_time()-2,utc_time(6)-2);
ERROR 22007: Incorrect datetime value for column 'd' at row 1
select * from v1;
id	name	d
1	test01	15:02:10
2	test02	02:57:01
3	test03	02:30:10
4	test04	14:10:11
5	test05	01:20:13
25701	02:57:01	02:57:02
25701	02:57:01	02:57:02
25701	25701	02:57:02
insert into v1(d) values(+utc_time(6));
insert into v1(id) values(-utc_time(2));
insert into v1(name) values(utc_time()+utc_time(2));
insert into v1(name) values(utc_time(4)*utc_time());
insert into v1(id) values(utc_time(1)/1);
insert into v1 values(utc_time(0)%1,utc_time(0)%1,utc_time(0)%1);
insert into v1 values(utc_time(6) div 1,utc_time() div 1,utc_time() div 1);
insert into v1 values(utc_time() mod 1,utc_time() mod 1,utc_time() mod 1);
insert into v1 values(utc_time(5)+0%1,utc_time()+1%1,utc_time(3)+1%1);
insert into v1 values(utc_time()-1 div 1,utc_time()-2 div 1,utc_time()-1 div 1);
insert into v1 values(utc_time(6)-1 mod 1,utc_time()-1 mod 1,utc_time()-1 mod 1);
insert into v1 values(utc_time()-1 * 1,utc_time(6)-1 * 1,utc_time()-1 * 1);
insert into v1 values(abs(utc_time()),CHAR_LENGTH(utc_time()),DATE_ADD(utc_time(6), INTERVAL 5 DAY));
update v1 set id= utc_time(6) where name='test01';
update v1 set id= utc_time()+0 where name='test01';
select * from v1 order by 1,2,3;
id	name	d
NULL	NULL	02:57:02
NULL	51402.58	NULL
NULL	660556551.7395	NULL
-25702	NULL	NULL
0	0	00:00:00
0	0	00:00:00
2	test02	02:57:01
3	test03	02:30:10
4	test04	14:10:11
5	test05	01:20:13
25700	25699	02:57:00
25700	25700.589500	02:57:00
25701	02:57:01	02:57:02
25701	02:57:01	02:57:02
25701	25701	02:57:01
25701	25701	02:57:02
25701	8	122:57:02
25701	test01	15:02:10
25702	NULL	NULL
25702	25701	02:57:01
25702	25701	02:57:02
update v1 set id= utc_time(2),d=utc_time()+0 where name in ('test01','test02');
update v1 set id= utc_time(3)+0,d=utc_time(3) where name in ('test01','test02');
update v1 set id= utc_time(4),d=utc_time(5)+0 where name in ('test01','test02');
update v1 set id= utc_time(5) where d>utc_time(3);
update v1 set id= utc_time(6)+0  where d>utc_time(1)+0;
update v1 set id= utc_time(1) where d>utc_time();
update v1 set id= utc_time(4)+0  where d<utc_time(4)+0;
update v1 set id= utc_time(5) where d=utc_time();
update v1 set id= utc_time(6) where d<=utc_time();
update v1 set id= utc_time(5) where d between utc_time() and utc_time()+3 ;
update v1 set id= utc_time(3)+0 where d = utc_time()  or id=utc_time() ;
update v1 set id= utc_time()+0 where name like 'test%' ;
update v1 set id= utc_time() where name not like 'test%' ;
update v1 set id= utc_time() where d>any(select utc_time());
update v1 set id= utc_time()+1 where d<all(select utc_time());
update v1 set id= abs(utc_time(3));
update v1 set id= abs(utc_time()+1);
update v1 set id= TO_DAYS(utc_time());
update v1 set id= LOCATE(utc_time()-1,utc_time());
update v1 set id= DATE_ADD(utc_time()+0,INTERVAL 5 DAY);
ERROR 22007: Incorrect datetime value for column 'id' at row 1
update v1 set d= DATE_ADD(utc_time()+0,INTERVAL 5 DAY);
ERROR 22007: Incorrect datetime value for column 'd' at row 1
update v1 set name= utc_time()+ utc_time();
update v1 set name= utc_time(2)+0- utc_time();
update v1 set name= utc_time(3)/utc_time();
update v1 set name= utc_time(5)-1*utc_time()+1;
update v1 set name= utc_time()%utc_time(5);
update v1 set name= utc_time(3) MOD utc_time(6);
update v1 set name= utc_time()-1 div utc_time()+0;
update v1 set name= utc_time()+1|| utc_time()+1;
update v1 set d= utc_time()+1|| utc_time()+1;
update v1 set d= utc_time(3)&utc_time();
select * from v1 order by 1,2,3;
id	name	d
0	1	02:57:01
0	1	02:57:01
0	1	02:57:01
0	1	02:57:01
0	1	02:57:01
0	1	02:57:01
0	1	02:57:01
0	1	02:57:01
0	1	02:57:01
0	1	02:57:01
0	1	02:57:01
0	1	02:57:01
0	1	02:57:01
0	1	02:57:01
0	1	02:57:01
0	1	02:57:01
0	1	02:57:01
0	1	02:57:01
0	1	02:57:01
0	1	02:57:01
0	1	02:57:01
drop table t1;
drop view v1;
obmysql-utc_time-4-4 约束
drop table t1;
create table t1(id int primary key,t time unique key);
drop table t2;
create table t2(id int default '1' ,name varchar(20),t1_fk time,CONSTRAINT for_key FOREIGN KEY (t1_fk) REFERENCES  t1 (t));
drop table t3;
create table t3(id int not null ,name varchar(20));
insert into t1 values(utc_time(),utc_time());
insert into t1 values(utc_time(),utc_time()+1);
ERROR 23000: Duplicate entry '25701' for key 'PRIMARY'
insert into t1 values(utc_time(3),utc_time()+1);
ERROR 23000: Duplicate entry '25701' for key 'PRIMARY'
insert into t1 values(utc_time()+0,utc_time()+1);
ERROR 23000: Duplicate entry '25701' for key 'PRIMARY'
insert into t1 values(utc_time()-0,utc_time()+1);
ERROR 23000: Duplicate entry '25701' for key 'PRIMARY'
insert into t1(id) values(utc_time(4)+1);
insert into t1 values(utc_time(1)+2,utc_time(1)+5);
insert into t1 values(utc_time(1)+3,utc_time(1)+5);
ERROR 23000: Duplicate entry '02:57:07' for key 't'
insert into t1 values(utc_time(1)+3,utc_time(1)+6);
update t1 set id=utc_time(),t=utc_time() where id=utc_time();
update t1 set id=utc_time()+0,t=utc_time() where id=utc_time()+0;
select * from t1;
id	t
25701	02:57:01
25703	NULL
25704	02:57:07
25705	02:57:08
insert into t2 values(utc_time(),'test',utc_time());
insert into t2 values(utc_time()+1,'test',utc_time(6));
ERROR 23000: Cannot add or update a child row: a foreign key constraint fails
insert into t2 values(utc_time(4)+2,'test',utc_time());
insert into t2 values(utc_time()+3,'test',utc_time()+3);
ERROR 23000: Cannot add or update a child row: a foreign key constraint fails
insert into t2 values(utc_time()+3,'test',utc_time()+6);
select * from t2;
id	name	t1_fk
25701	test	02:57:01
25704	test	02:57:01
25704	test	02:57:07
update t2 set id=utc_time() where t1_fk=utc_time();
update t2 set t1_fk=utc_time();
update t2 set t1_fk=utc_time(5)+10;
ERROR 23000: Cannot add or update a child row: a foreign key constraint fails
insert into t3 values(null,utc_time());
ERROR 23000: Column 'id' cannot be null
insert into t3 values(null,utc_time(6)+0);
ERROR 23000: Column 'id' cannot be null
insert into t3 values(utc_time(),utc_time(6));
insert into t3 values(utc_time()+0,utc_time());
insert into t3(name) values(utc_time()+0);
ERROR HY000: Field 'id' doesn't have a default value
update t3 set id=null;
ERROR 23000: Column 'id' cannot be null
obmysql-utc_time-4-5 索引
CREATE INDEX indexName ON t1 (t);
insert into t1 values(utc_time()+5,utc_time(6));
update t1 set t=utc_time()+6  where id=utc_time()+5;
ERROR 23000: Duplicate entry '02:57:07' for key 't'
update t1 set t=utc_time()+10  where id=utc_time()+4;
select * from t1 where t =utc_time();
id	t
25701	02:57:01
drop table t2;
obmysql-utc_time-4-3 pl块
set timestamp =322455421.5895;
drop table t1;
create table t1(v_id int,v_name varchar(30),v_t time);
DROP PROCEDURE pro_test01;
CREATE PROCEDURE pro_test01(in a int)
begin
declare i int;
declare b int;
set i=a-25700;
select a into b;
while i <=utc_time()-25696  DO
if a = utc_time()+0 then
insert into t1 values(a,a,a),(b,b,b);
elseif a> utc_time()-0  then 
insert into t1(v_t) values(a);
else 
insert into t1(v_id,v_name) values(a,b);
end if;
set i = i + 1;
end WHILE;
end;
//
# 执行存储过程，if和white ob都判断错误，mysql正确
drop table t1;
create table t1(v_name varchar(30),t time);
DROP PROCEDURE pro_test01_1;
CREATE PROCEDURE pro_test01_1(in a varchar(20),out b varchar(20))
begin
select a into b;
if a>utc_time() then
insert into t1(v_name) values(b);
elseif a=utc_time(6) then
insert into t1 values(utc_time() ,a);
else 
insert into t1(t) values(a);
end if;
end;
//
CALL pro_test01_1('02:57:02',@c);
select @c;
@c
02:57:02
CALL pro_test01_1(utc_time(6),@c);
CALL pro_test01_1(utc_time()-1,@c);
CALL pro_test01_1(25699,@c);
ERROR 22007: Incorrect datetime value for column 't' at row 1
DROP PROCEDURE pro_test02;
CREATE  PROCEDURE pro_test02( out b int)
begin
select utc_time() into b;
end;
//
CALL pro_test02(@bb);
select @bb;
@bb
25701
DROP PROCEDURE pro_test03;
CREATE  PROCEDURE pro_test03( out c varchar(30))
begin
select utc_time()+1 into c;
end;
//
CALL pro_test03(@cc);
select @cc;
@cc
25702
drop table t1;
create table t1(v_id int,v_a varchar(30),t time);
drop function  fn_test1;
create function fn_test1(aa int ) returns int
begin
declare bb int ;
declare cc int;
declare dd int;
set @i=1;
if aa=utc_time()+0  then
select aa into cc;
return(cc);
elseif aa>utc_time()+2 then
select aa into dd;
return(dd);
else
while @i <= utc_time()-25696 DO
insert into t1 values(aa,aa,aa);
update t1 set v_id=aa;
set @i=@i+(utc_time()-25700);
end while;
select aa into bb;
return(bb);
end if;
end;
//
select fn_test1(utc_time());
fn_test1(utc_time())
25701
select fn_test1(utc_time()+6);
fn_test1(utc_time()+6)
25707
select fn_test1(utc_time()-1);
fn_test1(utc_time()-1)
25700
drop function  fn_test1;
########清空回收站，删除测试数据库，表等 ##########
drop database  IF EXISTS  oblrp;
purge recyclebin;
