drop database  IF EXISTS  oblrp;
create database oblrp;
use oblrp;
set timestamp = 1600000000;
set ob_trx_timeout = 10000000000;
set ob_query_timeout = 10000000000;
SELECT UTC_DATE(), UTC_DATE() + 0;
UTC_DATE()	UTC_DATE() + 0
2020-09-13	20200913
###obmysql-utc_date-1,参数验证
select utc_date();
utc_date()
2020-09-13
select utc_date(1);
ERROR 42000: You have an error in your SQL syntax; check the manual that corresponds to your OceanBase version for the right syntax to use near '1)' at line 1
select utc_date('a');
ERROR 42000: You have an error in your SQL syntax; check the manual that corresponds to your OceanBase version for the right syntax to use near ''a')' at line 1
#obmysql-utc_date-2 运算符验证
select +utc_date();
+utc_date()
2020-09-13
select -utc_date();
-utc_date()
-20200913
select utc_date()+1;
utc_date()+1
20200914
select utc_date()-0;
utc_date()-0
20200913
select utc_date()+9999999999999999999;
utc_date()+9999999999999999999
10000000000020200912
select utc_date()-9999999999999999999;
ERROR 22003: BIGINT UNSIGNED value is out of range in ''(20200913 - 9999999999999999999)''
select utc_date()-20210618;
utc_date()-20210618
-9705
select utc_date()-'a';
utc_date()-'a'
20200913
Warnings:
Warning	1292	Truncated incorrect DOUBLE value: 'a'
select utc_date()+'bb';
utc_date()+'bb'
20200913
Warnings:
Warning	1292	Truncated incorrect DOUBLE value: 'bb'
select utc_date();
utc_date()
2020-09-13
select utc_date()+'2020-06-17';
utc_date()+'2020-06-17'
20202933
Warnings:
Warning	1292	Truncated incorrect DOUBLE value: '2020-06-17'
select utc_date()+utc_date();
utc_date()+utc_date()
40401826
select utc_date()+utc_date();
utc_date()+utc_date()
40401826
select utc_date()+CURDATE();
utc_date()+CURDATE()
40401826
select utc_date()+CURRENT_TIMESTAMP(6);
utc_date()+CURRENT_TIMESTAMP(6)
20200933403553.000000
select utc_date()+DATE_ADD(NOW(), INTERVAL 5 DAY);
utc_date()+DATE_ADD(NOW(), INTERVAL 5 DAY)
20200938403553
drop table t1;
create table t1(id int,name varchar(30), da DATE, dt DATETIME,  ti time, ts TIMESTAMP, b TINYBLOB);
insert into t1 values(1,'test','2021-06-18','2021-06-18 09:55:22.256456','10:55:22','2021-06-18 09:56:33.555555','blob');
select utc_date()-'2020-06-17';
utc_date()-'2020-06-17'
20198893
Warnings:
Warning	1292	Truncated incorrect DOUBLE value: '2020-06-17'
select utc_date()-CURRENT_DATE();
utc_date()-CURRENT_DATE()
0
select utc_date()-CURDATE();
utc_date()-CURDATE()
0
select utc_date()-CURRENT_TIMESTAMP(6);
utc_date()-CURRENT_TIMESTAMP(6)
-20200893001727.000000
select utc_date()-DATE_ADD(NOW(), INTERVAL 5 DAY);
utc_date()-DATE_ADD(NOW(), INTERVAL 5 DAY)
-20200898001727
select 1+utc_date();
1+utc_date()
20200914
select 1-utc_date();
1-utc_date()
-20200912
select 20200913-utc_date();
20200913-utc_date()
0
select 20200913*utc_date();
20200913*utc_date()
408076886033569
select 20200913/utc_date();
20200913/utc_date()
1.0000
select 20200913%utc_date();
20200913%utc_date()
0
select 20200913 div utc_date();
20200913 div utc_date()
1
select 20200913 mod utc_date();
20200913 mod utc_date()
0
select utc_date()*0;
utc_date()*0
0
select utc_date()*10;
utc_date()*10
202009130
select utc_date()*'a';
utc_date()*'a'
0
Warnings:
Warning	1292	Truncated incorrect DOUBLE value: 'a'
select utc_date()*'2020-06-17';
utc_date()*'2020-06-17'
40805844260
Warnings:
Warning	1292	Truncated incorrect DOUBLE value: '2020-06-17'
select utc_date()*CURRENT_DATE();
utc_date()*CURRENT_DATE()
408076886033569
select utc_date()*CURDATE();
utc_date()*CURDATE()
408076886033569
select utc_date()*CURRENT_TIMESTAMP(6);
utc_date()*CURRENT_TIMESTAMP(6)
408076890127082010320.000000
#ob能正常执行,mysql报错
select utc_date()*DATE_ADD(NOW(), INTERVAL 5 DAY);
utc_date()*DATE_ADD(NOW(), INTERVAL 5 DAY)
408076991131647010320
select (utc_date()+0)*CURDATE();
(utc_date()+0)*CURDATE()
408076886033569
select (utc_date()+9)*1000;
(utc_date()+9)*1000
20200922000
select (utc_date()+9)*-1000.632;
(utc_date()+9)*-1000.632
-20213688982.704
select utc_date()/0;
utc_date()/0
NULL
select utc_date()/10;
utc_date()/10
2020091.3000
select utc_date()/'a';
utc_date()/'a'
NULL
Warnings:
Warning	1292	Truncated incorrect DOUBLE value: 'a'
select utc_date()/'2020-06-17';
utc_date()/'2020-06-17'
10000.45198019802
Warnings:
Warning	1292	Truncated incorrect DOUBLE value: '2020-06-17'
select utc_date()/CURRENT_DATE();
utc_date()/CURRENT_DATE()
1.0000
select utc_date()/CURDATE();
utc_date()/CURDATE()
1.0000
select utc_date()/CURRENT_TIMESTAMP(6);
utc_date()/CURRENT_TIMESTAMP(6)
0.0000
select utc_date()/DATE_ADD(NOW(), INTERVAL 5 DAY);
utc_date()/DATE_ADD(NOW(), INTERVAL 5 DAY)
0.0000
select (utc_date()+1)/CURRENT_DATE();
(utc_date()+1)/CURRENT_DATE()
1.0000
select (utc_date()+1)/50.55;
(utc_date()+1)/50.55
399622.4332
select (utc_date()+1)/-50.55;
(utc_date()+1)/-50.55
-399622.4332
select utc_date()%0;
utc_date()%0
NULL
select utc_date()%10;
utc_date()%10
3
select utc_date()%'a';
utc_date()%'a'
NULL
Warnings:
Warning	1292	Truncated incorrect DOUBLE value: 'a'
select utc_date()%'2020-06-17';
utc_date()%'2020-06-17'
913
Warnings:
Warning	1292	Truncated incorrect DOUBLE value: '2020-06-17'
select utc_date()%CURRENT_DATE();
utc_date()%CURRENT_DATE()
0
select utc_date()%CURDATE();
utc_date()%CURDATE()
0
select utc_date()%CURRENT_TIMESTAMP(6);
utc_date()%CURRENT_TIMESTAMP(6)
20200913.000000
select utc_date()%DATE_ADD(NOW(), INTERVAL 5 DAY);
utc_date()%DATE_ADD(NOW(), INTERVAL 5 DAY)
20200913
select (utc_date()+0)%0;
(utc_date()+0)%0
NULL
select (utc_date()+0)%2;
(utc_date()+0)%2
1
select (utc_date()+0)%3.2;
(utc_date()+0)%3.2
1.0
select utc_date()DIV0;
DIV0
2020-09-13
select utc_date()DIV10;
DIV10
2020-09-13
select utc_date()DIV'a';
utc_date()DIV'a'
NULL
Warnings:
Warning	1292	Truncated incorrect DECIMAL value: 'a'
select utc_date()DIV'2020-06-17';
utc_date()DIV'2020-06-17'
10000
Warnings:
Warning	1292	Truncated incorrect DECIMAL value: '2020-06-17'
select utc_date() DIV CURRENT_DATE();
utc_date() DIV CURRENT_DATE()
1
select utc_date() DIV CURDATE();
utc_date() DIV CURDATE()
1
select utc_date() DIV CURRENT_TIMESTAMP(6);
utc_date() DIV CURRENT_TIMESTAMP(6)
0
select utc_date() DIV DATE_ADD(NOW(), INTERVAL 5 DAY);
utc_date() DIV DATE_ADD(NOW(), INTERVAL 5 DAY)
0
select (utc_date()+0) DIV DATE_ADD(NOW(), INTERVAL 5 DAY);
(utc_date()+0) DIV DATE_ADD(NOW(), INTERVAL 5 DAY)
0
select (utc_date()+0) DIV -8;
(utc_date()+0) DIV -8
-2525114
select utc_date() MOD 0;
utc_date() MOD 0
NULL
select utc_date() MOD 10;
utc_date() MOD 10
3
select utc_date() MOD 'a';
utc_date() MOD 'a'
NULL
Warnings:
Warning	1292	Truncated incorrect DOUBLE value: 'a'
select utc_date() MOD '2020-06-17';
utc_date() MOD '2020-06-17'
913
Warnings:
Warning	1292	Truncated incorrect DOUBLE value: '2020-06-17'
select utc_date() MOD CURRENT_DATE();
utc_date() MOD CURRENT_DATE()
0
select utc_date() MOD CURDATE();
utc_date() MOD CURDATE()
0
select utc_date() MOD CURRENT_TIMESTAMP(6);
utc_date() MOD CURRENT_TIMESTAMP(6)
20200913.000000
select utc_date() MOD DATE_ADD(NOW(), INTERVAL 5 DAY);
utc_date() MOD DATE_ADD(NOW(), INTERVAL 5 DAY)
20200913
select (utc_date()+0) MOD CURRENT_TIMESTAMP(6);
(utc_date()+0) MOD CURRENT_TIMESTAMP(6)
20200913.000000
select utc_date() || utc_date()+0;
utc_date() || utc_date()+0
1
select utc_date()+0+1000;
utc_date()+0+1000
20201913
select utc_date()-1-1000;
utc_date()-1-1000
20199912
select (utc_date()-1)*1000;
(utc_date()-1)*1000
20200912000
select (utc_date()-1)/1000;
(utc_date()-1)/1000
20200.9120
select (utc_date()-1)%1000;
(utc_date()-1)%1000
912
select (utc_date()-1) DIV 1000;
(utc_date()-1) DIV 1000
20200
select (utc_date()-1) MOD 1000;
(utc_date()-1) MOD 1000
912
select utc_date()|| utc_date();
utc_date()|| utc_date()
1
select utc_date()|| 'a';
utc_date()|| 'a'
1
select utc_date()|| 1000;
utc_date()|| 1000
1
select utc_date()|| '2020-06-17';
utc_date()|| '2020-06-17'
1
select utc_date()+1|| 'b';
utc_date()+1|| 'b'
1
select utc_date()+1|| DATE_FORMAT(utc_date(),GET_FORMAT(DATETIME,'EUR'));
utc_date()+1|| DATE_FORMAT(utc_date(),GET_FORMAT(DATETIME,'EUR'))
1
select utc_date()+1|| utc_date()+1;
utc_date()+1|| utc_date()+1
1
select utc_date()+1|| utc_time()+1;
utc_date()+1|| utc_time()+1
1
select utc_date()+1+ utc_time()+1;
utc_date()+1+ utc_time()+1
20323555
select utc_date()+1- utc_time()+1;
utc_date()+1- utc_time()+1
20078275
select (utc_date()+1)*(utc_time()+1);
(utc_date()+1)*(utc_time()+1)
2477460293874
select (utc_date()+1)/(utc_time()+1);
(utc_date()+1)/(utc_time()+1)
164.7158
select (utc_date()+1)%(utc_time()+1);
(utc_date()+1)%(utc_time()+1)
87790
select (utc_date()+1) MOD (utc_time()+1);
(utc_date()+1) MOD (utc_time()+1)
87790
select (utc_date()+1) div (utc_time()+1);
(utc_date()+1) div (utc_time()+1)
164
select utc_date()+ utc_time();
utc_date()+ utc_time()
20323553
select utc_date()- utc_time();
utc_date()- utc_time()
20078273
select utc_date()*utc_time();
utc_date()*utc_time()
2477439970320
select utc_date()/utc_time();
utc_date()/utc_time()
164.7172
select utc_date()%utc_time();
utc_date()%utc_time()
87953
select utc_date() MOD utc_time();
utc_date() MOD utc_time()
87953
select utc_date() div utc_time();
utc_date() div utc_time()
164
select utc_date()+utc_date();
utc_date()+utc_date()
40401826
select utc_date()+GET_FORMAT(DATETIME,'EUR');
utc_date()+GET_FORMAT(DATETIME,'EUR')
20200913
Warnings:
Warning	1292	Truncated incorrect DOUBLE value: '%Y-%m-%d %H.%i.%s'
select utc_date()-GET_FORMAT(DATETIME,'EUR');
utc_date()-GET_FORMAT(DATETIME,'EUR')
20200913
Warnings:
Warning	1292	Truncated incorrect DOUBLE value: '%Y-%m-%d %H.%i.%s'
select utc_date()=utc_date();
utc_date()=utc_date()
1
select utc_date()=utc_date()+1;
utc_date()=utc_date()+1
0
select utc_date()+1=utc_date()+1;
utc_date()+1=utc_date()+1
1
select utc_date()<>utc_date();
utc_date()<>utc_date()
0
select utc_date()<>utc_date()+1;
utc_date()<>utc_date()+1
1
select utc_date()+1<>utc_date()+1;
utc_date()+1<>utc_date()+1
0
select utc_date()<=>utc_date();
utc_date()<=>utc_date()
1
select utc_date()<=>utc_date()+1;
utc_date()<=>utc_date()+1
0
select utc_date()+1<=>utc_date()+1;
utc_date()+1<=>utc_date()+1
1
select utc_date()<utc_date();
utc_date()<utc_date()
0
select utc_date()<utc_date()+1;
utc_date()<utc_date()+1
1
select utc_date()+1<utc_date()+1;
utc_date()+1<utc_date()+1
0
select utc_date()<=utc_date();
utc_date()<=utc_date()
1
select utc_date()<=utc_date()+1;
utc_date()<=utc_date()+1
1
select utc_date()+1<=utc_date()+1;
utc_date()+1<=utc_date()+1
1
select utc_date()>=utc_date();
utc_date()>=utc_date()
1
select utc_date()>=utc_date()+1;
utc_date()>=utc_date()+1
0
select utc_date()+1>=utc_date()+1;
utc_date()+1>=utc_date()+1
1
select utc_date()>utc_date();
utc_date()>utc_date()
0
select utc_date()>utc_date()+1;
utc_date()>utc_date()+1
0
select utc_date()+1>utc_date()+1;
utc_date()+1>utc_date()+1
0
select utc_date() between utc_date()-1 and utc_date()+9;
utc_date() between utc_date()-1 and utc_date()+9
1
select utc_date() between utc_date()+1 and utc_date()+9;
utc_date() between utc_date()+1 and utc_date()+9
0
select utc_date()-1 between utc_date() and utc_date()+9;
utc_date()-1 between utc_date() and utc_date()+9
0
select utc_date()+7 between utc_date()+1 and utc_date()+9;
utc_date()+7 between utc_date()+1 and utc_date()+9
1
select utc_date()-20200912 in (1,2,3,4,5);
utc_date()-20200912 in (1,2,3,4,5)
1
select utc_date() in (1,2,3,4,5);
utc_date() in (1,2,3,4,5)
0
select utc_date() in (utc_date(),utc_date()+1,utc_date()+2);
utc_date() in (utc_date(),utc_date()+1,utc_date()+2)
1
select utc_date()-1 in (utc_date(),utc_date()+1,utc_date()+2);
utc_date()-1 in (utc_date(),utc_date()+1,utc_date()+2)
0
select utc_date() in (utc_date()+1,utc_date()+2);
utc_date() in (utc_date()+1,utc_date()+2)
0
select utc_date()-1 in (utc_date()-5,utc_date()+1,utc_date()+2);
utc_date()-1 in (utc_date()-5,utc_date()+1,utc_date()+2)
0
select utc_date()-1 in (utc_date()-5,utc_date()-1,utc_date()+2);
utc_date()-1 in (utc_date()-5,utc_date()-1,utc_date()+2)
1
select utc_date() not in (utc_date(),utc_date()+1,utc_date()+2);
utc_date() not in (utc_date(),utc_date()+1,utc_date()+2)
0
select utc_date()-1 not in (utc_date(),utc_date()+1,utc_date()+2);
utc_date()-1 not in (utc_date(),utc_date()+1,utc_date()+2)
1
select utc_date() not in (utc_date()+1,utc_date()+2);
utc_date() not in (utc_date()+1,utc_date()+2)
1
select utc_date()-1 not in (utc_date()-5,utc_date()+1,utc_date()+2);
utc_date()-1 not in (utc_date()-5,utc_date()+1,utc_date()+2)
1
select utc_date()-1  not in (utc_date()-5,utc_date()-1,utc_date()+2);
utc_date()-1  not in (utc_date()-5,utc_date()-1,utc_date()+2)
0
select utc_date() is NULL;
utc_date() is NULL
0
select utc_date()+0 is NULL;
utc_date()+0 is NULL
0
select utc_date()  like '20%';
utc_date()  like '20%'
1
select utc_date()+0  like utc_date();
utc_date()+0  like utc_date()
0
select utc_date()  like utc_date();
utc_date()  like utc_date()
1
select utc_date()+0 not like '20%';
utc_date()+0 not like '20%'
0
select utc_date()+0 not  like utc_date();
utc_date()+0 not  like utc_date()
1
select utc_date() REGEXP utc_date();
utc_date() REGEXP utc_date()
1
select utc_date() REGEXP utc_date()+0;
utc_date() REGEXP utc_date()+0
0
select utc_date()+0 REGEXP utc_date();
utc_date()+0 REGEXP utc_date()
0
select utc_date()+0 REGEXP utc_date()+0;
utc_date()+0 REGEXP utc_date()+0
1
select utc_date()&utc_date();
utc_date()&utc_date()
20200913
select utc_date()+0&utc_date();
utc_date()+0&utc_date()
20200913
select utc_date()+0&utc_date()+0;
utc_date()+0&utc_date()+0
20200913
select utc_date()|utc_date();
utc_date()|utc_date()
20200913
select utc_date()|utc_date()+1;
utc_date()|utc_date()+1
20200915
select utc_date()+0|utc_date()+0;
utc_date()+0|utc_date()+0
20200913
select utc_date()^utc_date();
utc_date()^utc_date()
0
select utc_date()^utc_date()+1;
utc_date()^utc_date()+1
1
select utc_date()+0^utc_date()+0;
utc_date()+0^utc_date()+0
40401826
select utc_date()>>utc_date();
utc_date()>>utc_date()
0
select utc_date()>>utc_date()+1;
utc_date()>>utc_date()+1
0
select utc_date()+0>>utc_date()+0;
utc_date()+0>>utc_date()+0
0
select utc_date()<<utc_date();
utc_date()<<utc_date()
0
select utc_date()<<utc_date()+1;
utc_date()<<utc_date()+1
0
select utc_date()+0<<utc_date()+0;
utc_date()+0<<utc_date()+0
0
select ~utc_date();
~utc_date()
18446744073689350702
select ~utc_date()-10;
~utc_date()-10
18446744073689350692
select utc_date() and utc_date();
utc_date() and utc_date()
1
select utc_date()+1 and utc_date()-1;
utc_date()+1 and utc_date()-1
1
select utc_date() and utc_date()-1;
utc_date() and utc_date()-1
1
select utc_date() or utc_date();
utc_date() or utc_date()
1
select utc_date() or null;
utc_date() or null
1
select utc_date()+1 or null;
utc_date()+1 or null
1
select utc_date()+1 or utc_date()-1;
utc_date()+1 or utc_date()-1
1
select utc_date() or utc_date()-1;
utc_date() or utc_date()-1
1
select not utc_date()-1;
not utc_date()-1
0
select not utc_date();
not utc_date()
0
select !utc_date()-1;
!utc_date()-1
-1
select !utc_date();
!utc_date()
0
select utc_date() xor utc_date();
utc_date() xor utc_date()
0
select utc_date()+1 xor utc_date()-1;
utc_date()+1 xor utc_date()-1
0
select utc_date() xor utc_date()-1;
utc_date() xor utc_date()-1
0
drop table t1;
#obmysql-utc_date-3 内置函数参数校验
select CURRENT_TIME(utc_date());
ERROR 42000: You have an error in your SQL syntax; check the manual that corresponds to your OceanBase version for the right syntax to use near 'utc_date())' at line 1
select CURRENT_TIME((utc_date()-20200913));
ERROR 42000: You have an error in your SQL syntax; check the manual that corresponds to your OceanBase version for the right syntax to use near '(utc_date()-20200913))' at line 1
select CURRENT_TIMESTAMP(utc_date()-20200913);
ERROR 42000: You have an error in your SQL syntax; check the manual that corresponds to your OceanBase version for the right syntax to use near 'utc_date()-20200913)' at line 1
select DATE_ADD(utc_date(),INTERVAL 5 DAY);
DATE_ADD(utc_date(),INTERVAL 5 DAY)
2020-09-18
select DATE_ADD(utc_date()+0,INTERVAL 5 DAY);
DATE_ADD(utc_date()+0,INTERVAL 5 DAY)
2020-09-18
select DATE_FORMAT(utc_date(),GET_FORMAT(DATETIME,'EUR'));
DATE_FORMAT(utc_date(),GET_FORMAT(DATETIME,'EUR'))
2020-09-13 00.00.00
select DATE_FORMAT(utc_date()+1,GET_FORMAT(DATETIME,'EUR'));
DATE_FORMAT(utc_date()+1,GET_FORMAT(DATETIME,'EUR'))
2020-09-14 00.00.00
select DATE_SUB(utc_date()+1,INTERVAL 5 DAY);
DATE_SUB(utc_date()+1,INTERVAL 5 DAY)
2020-09-09
select DATE_SUB(utc_date(),INTERVAL 5 DAY);
DATE_SUB(utc_date(),INTERVAL 5 DAY)
2020-09-08
select DATEDIFF(utc_date(),utc_date());
DATEDIFF(utc_date(),utc_date())
0
select DATEDIFF(utc_date()-1,utc_date());
DATEDIFF(utc_date()-1,utc_date())
-1
select DATEDIFF(utc_date()-1,utc_date()+1);
DATEDIFF(utc_date()-1,utc_date()+1)
-2
select DATEDIFF(utc_date(),utc_time());
DATEDIFF(utc_date(),utc_time())
0
select DATEDIFF(utc_time(),utc_date());
DATEDIFF(utc_time(),utc_date())
0
select EXTRACT(week from utc_date());
EXTRACT(week from utc_date())
37
select EXTRACT(week from utc_date()-7);
EXTRACT(week from utc_date()-7)
36
select from_days(utc_date());
from_days(utc_date())
0000-00-00
select from_days(utc_date()-1);
from_days(utc_date()-1)
0000-00-00
select FROM_UNIXTIME(utc_date()-1,GET_FORMAT(DATETIME,'EUR'));
FROM_UNIXTIME(utc_date()-1,GET_FORMAT(DATETIME,'EUR'))
1970-08-23 03.21.52
select FROM_UNIXTIME(utc_date(),GET_FORMAT(DATETIME,'EUR'));
FROM_UNIXTIME(utc_date(),GET_FORMAT(DATETIME,'EUR'))
1970-08-23 03.21.53
select MONTH(utc_date());
MONTH(utc_date())
9
select MONTH(utc_date()+10);
MONTH(utc_date()+10)
9
select now(utc_date()-20200913);
ERROR 42000: You have an error in your SQL syntax; check the manual that corresponds to your OceanBase version for the right syntax to use near 'utc_date()-20200913)' at line 1
select PERIOD_DIFF(utc_date()-15,utc_date());
PERIOD_DIFF(utc_date()-15,utc_date())
73
select PERIOD_DIFF(utc_date(),utc_date());
PERIOD_DIFF(utc_date(),utc_date())
0
select PERIOD_DIFF(utc_date()-10,utc_date()+15);
PERIOD_DIFF(utc_date()-10,utc_date()+15)
-25
select STR_TO_DATE(utc_date(),GET_FORMAT(DATETIME,'ISO'));
STR_TO_DATE(utc_date(),GET_FORMAT(DATETIME,'ISO'))
2020-09-13 00:00:00.000000
select STR_TO_DATE(utc_date()+0,GET_FORMAT(DATETIME,'ISO'));
STR_TO_DATE(utc_date()+0,GET_FORMAT(DATETIME,'ISO'))
NULL
Warnings:
Warning	1411	Incorrect datetime value: '20200913' for function str_to_date
select STR_TO_DATE(utc_date()+0,GET_FORMAT(DATETIME,'ISO'));
STR_TO_DATE(utc_date()+0,GET_FORMAT(DATETIME,'ISO'))
NULL
Warnings:
Warning	1411	Incorrect datetime value: '20200913' for function str_to_date
select time(utc_date());
time(utc_date())
00:00:00
select time(utc_date()+0);
time(utc_date()+0)
838:59:59
select TIME_TO_USEC(utc_date());
TIME_TO_USEC(utc_date())
1599926400000000
select TIME_TO_USEC(utc_date()+0);
ERROR 42000: Invalid argument for time_to_usec()
select TIMEDIFF(utc_date()+1,utc_date());
TIMEDIFF(utc_date()+1,utc_date())
NULL
select TIMEDIFF(utc_date(),utc_date());
TIMEDIFF(utc_date(),utc_date())
00:00:00
select TIMEDIFF(utc_date()-0,utc_date()+0);
TIMEDIFF(utc_date()-0,utc_date()+0)
NULL
select TIMESTAMPADD(day, -5, utc_date());
TIMESTAMPADD(day, -5, utc_date())
2020-09-08 00:00:00
select TIMESTAMPADD(day, -5, utc_date()+0);
TIMESTAMPADD(day, -5, utc_date()+0)
2020-09-08 00:00:00
select TIMESTAMPDIFF(day,utc_date() , utc_date());
TIMESTAMPDIFF(day,utc_date() , utc_date())
0
select TIMESTAMPDIFF(day, utc_date(), utc_date()+0);
TIMESTAMPDIFF(day, utc_date(), utc_date()+0)
0
select TIMESTAMPDIFF(day, utc_date()-1, utc_date()+0);
TIMESTAMPDIFF(day, utc_date()-1, utc_date()+0)
1
select TO_DAYS(utc_date()+10);
TO_DAYS(utc_date()+10)
738056
select TO_DAYS(utc_date());
TO_DAYS(utc_date())
738046
select USEC_TO_TIME(utc_date());
USEC_TO_TIME(utc_date())
1970-01-01 08:00:20.200913
select USEC_TO_TIME(utc_date()+1);
USEC_TO_TIME(utc_date()+1)
1970-01-01 08:00:20.200914
select UNIX_TIMESTAMP(utc_date());
UNIX_TIMESTAMP(utc_date())
1599926400
select UNIX_TIMESTAMP(utc_date()+1);
UNIX_TIMESTAMP(utc_date()+1)
1600012800
select UTC_TIMESTAMP(utc_date());
ERROR 42000: You have an error in your SQL syntax; check the manual that corresponds to your OceanBase version for the right syntax to use near 'utc_date())' at line 1
select YEAR(utc_date());
YEAR(utc_date())
2020
select YEAR(utc_date()+10000);
YEAR(utc_date()+10000)
2021
select CONCAT(utc_date(),utc_date());
CONCAT(utc_date(),utc_date())
2020-09-132020-09-13
select CONCAT(utc_date()+0,utc_date()-0);
CONCAT(utc_date()+0,utc_date()-0)
2020091320200913
select CONCAT_WS('_',utc_date(),utc_date());
CONCAT_WS('_',utc_date(),utc_date())
2020-09-13_2020-09-13
select FORMAT(utc_date(),1);
FORMAT(utc_date(),1)
20,200,913.0
select FORMAT(utc_date(),0);
FORMAT(utc_date(),0)
20,200,913
select SUBSTR(utc_date(),1,2);
SUBSTR(utc_date(),1,2)
20
select SUBSTR(utc_date()+0,1,2);
SUBSTR(utc_date()+0,1,2)
20
select SUBSTRING(utc_date(),1,2);
SUBSTRING(utc_date(),1,2)
20
select SUBSTRING(utc_date()+0,1);
SUBSTRING(utc_date()+0,1)
20200913
select TRIM(utc_date());
TRIM(utc_date())
2020-09-13
select TRIM(utc_date()+0);
TRIM(utc_date()+0)
20200913
select RTRIM(utc_date());
RTRIM(utc_date())
2020-09-13
select RTRIM(utc_date()+0);
RTRIM(utc_date()+0)
20200913
select ascii(utc_date());
ascii(utc_date())
50
select ascii(utc_date()+1);
ascii(utc_date()+1)
50
select ORD(utc_date());
ORD(utc_date())
50
select ORD(utc_date()+1);
ORD(utc_date()+1)
50
select LENGTH(utc_date());
LENGTH(utc_date())
10
select LENGTH(utc_date()+1);
LENGTH(utc_date()+1)
8
select CHAR_LENGTH(utc_date());
CHAR_LENGTH(utc_date())
10
select CHAR_LENGTH(utc_date()+1);
CHAR_LENGTH(utc_date()+1)
8
select UPPER(utc_date());
UPPER(utc_date())
2020-09-13
select UPPER(utc_date()+1);
UPPER(utc_date()+1)
20200914
select lower(utc_date());
lower(utc_date())
2020-09-13
select LOWER(utc_date()+1);
LOWER(utc_date()+1)
20200914
select HEX(utc_date());
HEX(utc_date())
323032302D30392D3133
select HEX(utc_date()+1);
HEX(utc_date()+1)
1343DD2
select UNHEX(utc_date());
UNHEX(utc_date())
NULL
select UNHEX(utc_date()+1);
UNHEX(utc_date()+1)
  	
select MD5(utc_date());
MD5(utc_date())
ecf71871d50e462ef12bfe7790d1c273
select MD5(utc_date()+1);
MD5(utc_date()+1)
76b0e9ef7b9f439bd0e3c5315b11ddee
select INT2IP(utc_date());
INT2IP(utc_date())
1.52.61.209
select INT2IP(utc_date()+1);
INT2IP(utc_date()+1)
1.52.61.210
SELECT 'utc_date()%' LIKE 'utc_date()%' ESCAPE 'utc_date()';
ERROR HY000: Incorrect arguments to ESCAPE
SELECT 'utc_date()+0%' LIKE 'utc_date()+1%' ESCAPE 'utc_date()';
ERROR HY000: Incorrect arguments to ESCAPE
SELECT utc_date() REGEXP utc_date();
utc_date() REGEXP utc_date()
1
SELECT utc_date()-1 REGEXP utc_date()-2;
utc_date()-1 REGEXP utc_date()-2
0
SELECT REPEAT(utc_date(), utc_date()-20200910);
REPEAT(utc_date(), utc_date()-20200910)
2020-09-132020-09-132020-09-13
SELECT REPEAT(utc_date()+0, utc_date()-20200910);
REPEAT(utc_date()+0, utc_date()-20200910)
202009132020091320200913
SELECT SPACE(utc_date()+0);
SPACE(utc_date()+0)
NULL
Warnings:
Warning	1301	Result of space() was larger than max_allowed_packet (16777216) - truncated
SELECT SPACE(utc_date());
SPACE(utc_date())
NULL
Warnings:
Warning	1301	Result of space() was larger than max_allowed_packet (16777216) - truncated
SELECT SUBSTRING_INDEX(utc_date(),utc_date()-1,utc_date()-20200911);
SUBSTRING_INDEX(utc_date(),utc_date()-1,utc_date()-20200911)
2020-09-13
SELECT SUBSTRING_INDEX(utc_date()-1,utc_date(),utc_date()-20200911);
SUBSTRING_INDEX(utc_date()-1,utc_date(),utc_date()-20200911)
20200912
SELECT LOCATE(utc_date()-1,utc_date());
LOCATE(utc_date()-1,utc_date())
0
SELECT LOCATE(utc_date(),utc_date());
LOCATE(utc_date(),utc_date())
1
SELECT LOCATE(utc_date()-1,utc_date()-1);
LOCATE(utc_date()-1,utc_date()-1)
1
SELECT LOCATE(2,utc_date()+0,utc_date()-20200911);
LOCATE(2,utc_date()+0,utc_date()-20200911)
3
SELECT POSITION(utc_date() in utc_date());
POSITION(utc_date() in utc_date())
1
SELECT POSITION(utc_date() in utc_date()+0);
POSITION(utc_date() in utc_date()+0)
0
SELECT POSITION(utc_date()+0 in utc_date()+0);
POSITION(utc_date()+0 in utc_date()+0)
1
SELECT POSITION(utc_date()+0 in utc_date()+1);
POSITION(utc_date()+0 in utc_date()+1)
0
SELECT INSTR(utc_date(),utc_date());
INSTR(utc_date(),utc_date())
1
SELECT INSTR(utc_date(),utc_date()+0);
INSTR(utc_date(),utc_date()+0)
0
SELECT INSTR(utc_date()+0,utc_date()+0);
INSTR(utc_date()+0,utc_date()+0)
1
SELECT INSTR(utc_date()+0,utc_date());
INSTR(utc_date()+0,utc_date())
0
SELECT REPLACE(utc_date()+0,utc_date()+0,utc_date());
REPLACE(utc_date()+0,utc_date()+0,utc_date())
2020-09-13
SELECT REPLACE(utc_date(),utc_date()+0,utc_date());
REPLACE(utc_date(),utc_date()+0,utc_date())
2020-09-13
SELECT REPLACE(utc_date(),utc_date(),utc_date()+0);
REPLACE(utc_date(),utc_date(),utc_date()+0)
20200913
SELECT FIELD(utc_date()-20200911,utc_date(),utc_date()-20200911);
FIELD(utc_date()-20200911,utc_date(),utc_date()-20200911)
2
SELECT FIELD(utc_date(),utc_date(),utc_date()-20200911);
FIELD(utc_date(),utc_date(),utc_date()-20200911)
1
SELECT ELT(utc_date()-20200911,utc_date(),utc_date()+0);
ELT(utc_date()-20200911,utc_date(),utc_date()+0)
20200913
SELECT ELT(utc_date()-20200912,utc_date(),utc_date()+0);
ELT(utc_date()-20200912,utc_date(),utc_date()+0)
2020-09-13
SELECT ELT(utc_date(),utc_date()-20200911,utc_date()-20200910,utc_date()+0);
ELT(utc_date(),utc_date()-20200911,utc_date()-20200910,utc_date()+0)
NULL
SELECT ELT(utc_date(),utc_date()-20200911,utc_date()-20200910,utc_date());
ELT(utc_date(),utc_date()-20200911,utc_date()-20200910,utc_date())
NULL
SELECT LPAD(utc_date(),utc_date()-20200901,utc_date());
LPAD(utc_date(),utc_date()-20200901,utc_date())
202020-09-13
SELECT LPAD(utc_date()+0,utc_date()-20200901,utc_date());
LPAD(utc_date()+0,utc_date()-20200901,utc_date())
202020200913
SELECT LPAD(utc_date()+0,utc_date()-20200901,utc_date()+0);
LPAD(utc_date()+0,utc_date()-20200901,utc_date()+0)
202020200913
SELECT LPAD(utc_date(),utc_date()-20200901,utc_date()+0);
LPAD(utc_date(),utc_date()-20200901,utc_date()+0)
202020-09-13
SELECT RPAD(utc_date(),utc_date()-20200901,utc_date());
RPAD(utc_date(),utc_date()-20200901,utc_date())
2020-09-1320
SELECT RPAD(utc_date()+0,utc_date()-20200901,utc_date());
RPAD(utc_date()+0,utc_date()-20200901,utc_date())
202009132020
SELECT RPAD(utc_date()+0,utc_date()-20200901,utc_date()+0);
RPAD(utc_date()+0,utc_date()-20200901,utc_date()+0)
202009132020
SELECT RPAD(utc_date(),utc_date()-20200901,utc_date()+0);
RPAD(utc_date(),utc_date()-20200901,utc_date()+0)
2020-09-1320
SELECT bin(utc_date());
bin(utc_date())
11111100100
SELECT bin(utc_date()+0);
bin(utc_date()+0)
1001101000011110111010001
SELECT quote(utc_date());
quote(utc_date())
'2020-09-13'
SELECT quote(utc_date()+0);
quote(utc_date()+0)
'20200913'
SELECT REGEXP_SUBSTR(utc_date()+0);
ERROR 42000: Incorrect parameter count in the call to native function 'REGEXP_SUBSTR'
select regexp_substr(utc_date(), '2020(.*)(13)', 1, 1, 'i', 0);
regexp_substr(utc_date(), '2020(.*)(13)', 1, 1, 'i', 0)
2020-09-13
select regexp_substr(utc_date()+0, '2020(.*)(13)', 1, 1, 'i', 0);
regexp_substr(utc_date()+0, '2020(.*)(13)', 1, 1, 'i', 0)
20200913
select CAST(utc_date()+0 as date);
CAST(utc_date()+0 as date)
2020-09-13
select CAST(utc_date() as date);
CAST(utc_date() as date)
2020-09-13
select ROUND(utc_date());
ROUND(utc_date())
20200913
select ROUND(utc_date()+0);
ROUND(utc_date()+0)
20200913
select ROUND(utc_date()+0,utc_date()-20200911);
ROUND(utc_date()+0,utc_date()-20200911)
20200913
#ob值没有带小数，mysql带小数
select ROUND(utc_date(),utc_date()-20200911);
ROUND(utc_date(),utc_date()-20200911)
20200913
select ROUND(utc_date(),utc_date()-20200916);
ROUND(utc_date(),utc_date()-20200916)
20201000
select CEIL(utc_date());
CEIL(utc_date())
20200913
select CEIL(utc_date()+0);
CEIL(utc_date()+0)
20200913
select FLOOR(utc_date());
FLOOR(utc_date())
20200913
select FLOOR(utc_date()+0);
FLOOR(utc_date()+0)
20200913
select ABS(utc_date());
ABS(utc_date())
20200913
select ABS(utc_date()+1);
ABS(utc_date()+1)
20200914
select NEG(utc_date());
NEG(utc_date())
-20200913
select NEG(utc_date()-1);
NEG(utc_date()-1)
-20200912
select SIGN(utc_date());
SIGN(utc_date())
1
select SIGN(utc_date()-20200920);
SIGN(utc_date()-20200920)
-1
select SIGN(utc_date()-20200913);
SIGN(utc_date()-20200913)
0
select CONV(utc_date()-2,utc_date()-20200903,utc_date()-20200911);
CONV(utc_date()-2,utc_date()-20200903,utc_date()-20200911)
1001101000011110111001111
select CONV(utc_date(),utc_date()-20200903,utc_date()-20200911);
CONV(utc_date(),utc_date()-20200903,utc_date()-20200911)
11111100100
select MOD(utc_date(),utc_date());
MOD(utc_date(),utc_date())
0
select MOD(utc_date(),utc_date()-6);
MOD(utc_date(),utc_date()-6)
6
select MOD(utc_date()+5,utc_date());
MOD(utc_date()+5,utc_date())
5
select MOD(utc_date()+0,utc_date()-6);
MOD(utc_date()+0,utc_date()-6)
6
select POW(utc_date(),utc_date()-20200905);
POW(utc_date(),utc_date()-20200905)
2.7731156771937006e58
select POW(utc_date()+0,utc_date()-20200905);
POW(utc_date()+0,utc_date()-20200905)
2.7731156771937006e58
select POW(utc_date(),null);
POW(utc_date(),null)
NULL
select POWER(utc_date(),utc_date()-20200905);
POWER(utc_date(),utc_date()-20200905)
2.7731156771937006e58
select POWER(utc_date()+0,utc_date()-20200905);
POWER(utc_date()+0,utc_date()-20200905)
2.7731156771937006e58
select POWER(utc_date(),null);
POWER(utc_date(),null)
NULL
select rand(utc_date());
rand(utc_date())
0.3781187388842169
select rand(utc_date()+1);
rand(utc_date()+1)
0.6283018483112583
select GREATEST(utc_date(),utc_date+1);
GREATEST(utc_date(),utc_date+1)
20200914
select LEAST(utc_date(),utc_date+1);
LEAST(utc_date(),utc_date+1)
20200913
select LEAST(utc_date(),utc_time());
LEAST(utc_date(),utc_time())
2020-09-13 00:00:00
select isnull(utc_date());
isnull(utc_date())
0
select isnull(utc_date()+0);
isnull(utc_date()+0)
0
select CASE utc_date() when utc_date()+0 then 1 when utc_date() then 2 END;
CASE utc_date() when utc_date()+0 then 1 when utc_date() then 2 END
1
select if(utc_date()<utc_date()-1,utc_date(),utc_date()-1);
if(utc_date()<utc_date()-1,utc_date(),utc_date()-1)
20200912
select if(utc_date()>utc_date()-1,utc_date(),utc_date()-1);
if(utc_date()>utc_date()-1,utc_date(),utc_date()-1)
2020-09-13
select ifnull(null,utc_date());
ifnull(null,utc_date())
2020-09-13
select ifnull(null,utc_date()+0);
ifnull(null,utc_date()+0)
20200913
select ifnull(utc_date(),utc_date()+0);
ifnull(utc_date(),utc_date()+0)
2020-09-13
select ifnull(utc_date()+5,utc_date()+0);
ifnull(utc_date()+5,utc_date()+0)
20200918
select nullif(utc_date(),utc_date());
nullif(utc_date(),utc_date())
NULL
select nullif(utc_date()+0,utc_date());
nullif(utc_date()+0,utc_date())
NULL
select nullif(utc_date()+1,utc_date());
nullif(utc_date()+1,utc_date())
20200914
select nullif(utc_date(),utc_date()+2);
nullif(utc_date(),utc_date()+2)
2020-09-13
select ORA_DECODE(utc_date(),utc_date()+0,utc_date(),utc_date()+1,utc_date(),utc_date(),utc_date+10);
ORA_DECODE(utc_date(),utc_date()+0,utc_date(),utc_date()+1,utc_date(),utc_date(),utc_date+10)
2020-09-13
select ORA_DECODE(utc_date(),utc_date()+1,utc_date(),utc_date()+1,utc_date(),utc_date(),utc_date+10);
ORA_DECODE(utc_date(),utc_date()+1,utc_date(),utc_date()+1,utc_date(),utc_date(),utc_date+10)
2020-09-23
select COALESCE(utc_date());
COALESCE(utc_date())
2020-09-13
select COALESCE(utc_date()+2);
COALESCE(utc_date()+2)
20200915
select nvl(utc_date(),utc_date+99);
nvl(utc_date(),utc_date+99)
2020-09-13
select nvl(null,utc_date);
nvl(null,utc_date)
2020-09-13
select nvl(null,utc_date+6);
nvl(null,utc_date+6)
20200919
select sleep(utc_date-20200912);
sleep(utc_date-20200912)
0
obmysql-utc_date-4 使用场景
obmysql-utc_date-4-1
drop table t1;
create table t1 (id int ,name varchar(20),d date);
insert into t1 values(1,'test01','20200811');
insert into t1 values(2,'test02','20200915');
insert into t1 values(3,'test03','2020-08-20');
insert into t1 values(4,'test04','2020-09-15');
insert into t1 values(5,'test05','2020-09-13');
select utc_date() as a,utc_date()+1 from t1;
a	utc_date()+1
2020-09-13	20200914
2020-09-13	20200914
2020-09-13	20200914
2020-09-13	20200914
2020-09-13	20200914
create table t2 as select utc_date(),utc_date()+1 from t1;
select * from t2;
utc_date()	utc_date()+1
2020-09-13	20200914
2020-09-13	20200914
2020-09-13	20200914
2020-09-13	20200914
2020-09-13	20200914
drop table t2;
select DATEDIFF(utc_date()-1,utc_date()) from t1;
DATEDIFF(utc_date()-1,utc_date())
-1
-1
-1
-1
-1
select MOD(utc_date()+5,utc_date()) from t1;
MOD(utc_date()+5,utc_date())
5
5
5
5
5
select time(utc_date()),COALESCE(utc_date()) from t1;
time(utc_date())	COALESCE(utc_date())
00:00:00	2020-09-13
00:00:00	2020-09-13
00:00:00	2020-09-13
00:00:00	2020-09-13
00:00:00	2020-09-13
SELECT INSTR(utc_date(),utc_date()+0) from t1;
INSTR(utc_date(),utc_date()+0)
0
0
0
0
0
select LENGTH(utc_date()+1),LENGTH(utc_date()) from t1;
LENGTH(utc_date()+1)	LENGTH(utc_date())
8	10
8	10
8	10
8	10
8	10
SELECT LOCATE(2,utc_date()+0,utc_date()-20200911) from t1;
LOCATE(2,utc_date()+0,utc_date()-20200911)
3
3
3
3
3
select MD5(utc_date()),MD5(utc_date()+1) from t1;
MD5(utc_date())	MD5(utc_date()+1)
ecf71871d50e462ef12bfe7790d1c273	76b0e9ef7b9f439bd0e3c5315b11ddee
ecf71871d50e462ef12bfe7790d1c273	76b0e9ef7b9f439bd0e3c5315b11ddee
ecf71871d50e462ef12bfe7790d1c273	76b0e9ef7b9f439bd0e3c5315b11ddee
ecf71871d50e462ef12bfe7790d1c273	76b0e9ef7b9f439bd0e3c5315b11ddee
ecf71871d50e462ef12bfe7790d1c273	76b0e9ef7b9f439bd0e3c5315b11ddee
select t1.*,utc_date()+0, utc_date() from t1 where utc_date()>d;
id	name	d	utc_date()+0	utc_date()
1	test01	2020-08-11	20200913	2020-09-13
3	test03	2020-08-20	20200913	2020-09-13
select t1.*,utc_date()-0, utc_date() from t1 where utc_date()>=d;
id	name	d	utc_date()-0	utc_date()
1	test01	2020-08-11	20200913	2020-09-13
3	test03	2020-08-20	20200913	2020-09-13
5	test05	2020-09-13	20200913	2020-09-13
select t1.*,utc_date()-0, utc_date()  from t1 where utc_date()<=d;
id	name	d	utc_date()-0	utc_date()
2	test02	2020-09-15	20200913	2020-09-13
4	test04	2020-09-15	20200913	2020-09-13
5	test05	2020-09-13	20200913	2020-09-13
select t1.*,utc_date()+0, utc_date()  from t1 where utc_date()=d;
id	name	d	utc_date()+0	utc_date()
5	test05	2020-09-13	20200913	2020-09-13
select t1.*,utc_date()+0, utc_date()  from t1 where d=utc_date();
id	name	d	utc_date()+0	utc_date()
5	test05	2020-09-13	20200913	2020-09-13
select t1.*,utc_date()+0, utc_date()  from t1 where utc_date()<d;
id	name	d	utc_date()+0	utc_date()
2	test02	2020-09-15	20200913	2020-09-13
4	test04	2020-09-15	20200913	2020-09-13
select t1.*,utc_date()+0, utc_date()  from t1 where utc_date()+0>d;
id	name	d	utc_date()+0	utc_date()
1	test01	2020-08-11	20200913	2020-09-13
3	test03	2020-08-20	20200913	2020-09-13
select t1.*,utc_date()-0, utc_date()  from t1 where utc_date()-1>=d;
id	name	d	utc_date()-0	utc_date()
1	test01	2020-08-11	20200913	2020-09-13
3	test03	2020-08-20	20200913	2020-09-13
select t1.*,utc_date()+0, utc_date()  from t1 where utc_date()+2<=d;
id	name	d	utc_date()+0	utc_date()
2	test02	2020-09-15	20200913	2020-09-13
4	test04	2020-09-15	20200913	2020-09-13
select t1.*,utc_date()-0, utc_date()  from t1 where utc_date()-3=d;
id	name	d	utc_date()-0	utc_date()
select t1.*,utc_date()+0, utc_date()  from t1 where utc_date()-0<d;
id	name	d	utc_date()+0	utc_date()
2	test02	2020-09-15	20200913	2020-09-13
4	test04	2020-09-15	20200913	2020-09-13
select t1.*,utc_date()+0, utc_date()  from t1 where d<utc_date()-0;
id	name	d	utc_date()+0	utc_date()
1	test01	2020-08-11	20200913	2020-09-13
3	test03	2020-08-20	20200913	2020-09-13
select t1.*,utc_date()-0, utc_date()  from t1 where d=utc_date() or utc_date()+1>=d;
id	name	d	utc_date()-0	utc_date()
1	test01	2020-08-11	20200913	2020-09-13
3	test03	2020-08-20	20200913	2020-09-13
5	test05	2020-09-13	20200913	2020-09-13
select t1.*,utc_date()+0 as a, utc_date()  from t1 where d=utc_date() and utc_date()-1<=d;
id	name	d	a	utc_date()
5	test05	2020-09-13	20200913	2020-09-13
select t1.*,utc_date()+0, utc_date()  from t1 where d between utc_date() and utc_date()+5;
id	name	d	utc_date()+0	utc_date()
2	test02	2020-09-15	20200913	2020-09-13
4	test04	2020-09-15	20200913	2020-09-13
5	test05	2020-09-13	20200913	2020-09-13
select t1.*,utc_date()-0, utc_date()  from t1 where d like 'utc_date()%';
id	name	d	utc_date()-0	utc_date()
select t1.*,utc_date()+0, utc_date()  from t1 where d not like 'utc_date()%';
id	name	d	utc_date()+0	utc_date()
1	test01	2020-08-11	20200913	2020-09-13
2	test02	2020-09-15	20200913	2020-09-13
3	test03	2020-08-20	20200913	2020-09-13
4	test04	2020-09-15	20200913	2020-09-13
5	test05	2020-09-13	20200913	2020-09-13
select t1.*,utc_date()+0, utc_date()  from t1 where d not like 'utc_date()+0%';
id	name	d	utc_date()+0	utc_date()
1	test01	2020-08-11	20200913	2020-09-13
2	test02	2020-09-15	20200913	2020-09-13
3	test03	2020-08-20	20200913	2020-09-13
4	test04	2020-09-15	20200913	2020-09-13
5	test05	2020-09-13	20200913	2020-09-13
select t1.*,utc_date()-0, utc_date()  from t1 where d like 'utc_date()-0%';
id	name	d	utc_date()-0	utc_date()
select t1.*,utc_date()-0, utc_date()  from t1 where exists (select utc_date(),utc_date()+0);
id	name	d	utc_date()-0	utc_date()
1	test01	2020-08-11	20200913	2020-09-13
2	test02	2020-09-15	20200913	2020-09-13
3	test03	2020-08-20	20200913	2020-09-13
4	test04	2020-09-15	20200913	2020-09-13
5	test05	2020-09-13	20200913	2020-09-13
select t1.*,utc_date()-0, utc_date()  from t1 where d in  (select utc_date());
id	name	d	utc_date()-0	utc_date()
5	test05	2020-09-13	20200913	2020-09-13
select t1.*,utc_date()-0, utc_date()  from t1 where d in  (select utc_date()+2);
id	name	d	utc_date()-0	utc_date()
2	test02	2020-09-15	20200913	2020-09-13
4	test04	2020-09-15	20200913	2020-09-13
select t1.*,utc_date()-0, utc_date()  from t1 where d in  (utc_date()+2,utc_date());
id	name	d	utc_date()-0	utc_date()
2	test02	2020-09-15	20200913	2020-09-13
4	test04	2020-09-15	20200913	2020-09-13
5	test05	2020-09-13	20200913	2020-09-13
select t1.*,utc_date()-0, utc_date()  from t1 where d >any(utc_date()+2,utc_date());
ERROR 42000: You have an error in your SQL syntax; check the manual that corresponds to your OceanBase version for the right syntax to use near 'utc_date()+2,utc_date())' at line 1
select t1.*,utc_date()-0, utc_date()  from t1 where d >all(utc_date()+2,utc_date());
ERROR 42000: You have an error in your SQL syntax; check the manual that corresponds to your OceanBase version for the right syntax to use near 'utc_date()+2,utc_date())' at line 1
select t1.*,utc_date()-0, utc_date()  from t1 where d >=all(select utc_date()+2 from t1);
id	name	d	utc_date()-0	utc_date()
2	test02	2020-09-15	20200913	2020-09-13
4	test04	2020-09-15	20200913	2020-09-13
select t1.*,utc_date()-0, utc_date()  from t1 where d <=any(select utc_date()+2 from t1);
id	name	d	utc_date()-0	utc_date()
1	test01	2020-08-11	20200913	2020-09-13
2	test02	2020-09-15	20200913	2020-09-13
3	test03	2020-08-20	20200913	2020-09-13
4	test04	2020-09-15	20200913	2020-09-13
5	test05	2020-09-13	20200913	2020-09-13
select t1.*,utc_date()-0, utc_date()  from t1 where id >2;
id	name	d	utc_date()-0	utc_date()
3	test03	2020-08-20	20200913	2020-09-13
4	test04	2020-09-15	20200913	2020-09-13
5	test05	2020-09-13	20200913	2020-09-13
select t1.*,utc_date()-0, utc_date()  from t1 where id =2;
id	name	d	utc_date()-0	utc_date()
2	test02	2020-09-15	20200913	2020-09-13
select t1.*,utc_date()-0, utc_date()  from t1 where id =2 or name ='test03';
id	name	d	utc_date()-0	utc_date()
2	test02	2020-09-15	20200913	2020-09-13
3	test03	2020-08-20	20200913	2020-09-13
select t1.*,utc_date()-0, utc_date()  from t1 where id in (1,2,3);
id	name	d	utc_date()-0	utc_date()
1	test01	2020-08-11	20200913	2020-09-13
2	test02	2020-09-15	20200913	2020-09-13
3	test03	2020-08-20	20200913	2020-09-13
create table t2(id int ,t1_id int);
insert into t2 values(1,1);
insert into t2 values(2,2);
insert into t2 values(3,3);
select t1.*,utc_date()-0, utc_date() from t1 inner join t2 on t1.id=t2.t1_id;
id	name	d	utc_date()-0	utc_date()
1	test01	2020-08-11	20200913	2020-09-13
2	test02	2020-09-15	20200913	2020-09-13
3	test03	2020-08-20	20200913	2020-09-13
select t1.*,utc_date()-0, utc_date() from t1 inner join t2 on t1.id=t2.t1_id and t1.d= utc_date()+2;
id	name	d	utc_date()-0	utc_date()
2	test02	2020-09-15	20200913	2020-09-13
with t as (select utc_date()-0 , utc_date()   from t1)  select * from t;
utc_date()-0	utc_date()
20200913	2020-09-13
20200913	2020-09-13
20200913	2020-09-13
20200913	2020-09-13
20200913	2020-09-13
select utc_date()+utc_date() from t1 where id>3;
utc_date()+utc_date()
40401826
40401826
select utc_date()-utc_date() from t1;
utc_date()-utc_date()
0
0
0
0
0
select utc_date()*utc_date() from t1;
utc_date()*utc_date()
408076886033569
408076886033569
408076886033569
408076886033569
408076886033569
select utc_date()/utc_date() from t1;
utc_date()/utc_date()
1.0000
1.0000
1.0000
1.0000
1.0000
select utc_date()%utc_date() from t1;
utc_date()%utc_date()
0
0
0
0
0
select utc_date() div utc_date() from t1;
utc_date() div utc_date()
1
1
1
1
1
select utc_date() mod utc_date() from t1;
utc_date() mod utc_date()
0
0
0
0
0
select -utc_date() from t1;
-utc_date()
-20200913
-20200913
-20200913
-20200913
-20200913
select +utc_date() from t1;
+utc_date()
2020-09-13
2020-09-13
2020-09-13
2020-09-13
2020-09-13
select utc_date()+0+utc_date() from t1 where id>3;
utc_date()+0+utc_date()
40401826
40401826
select utc_date()-utc_date()+0 from t1;
utc_date()-utc_date()+0
0
0
0
0
0
select utc_date()*utc_date()+0 from t1;
utc_date()*utc_date()+0
408076886033569
408076886033569
408076886033569
408076886033569
408076886033569
select utc_date()+0/utc_date() from t1;
utc_date()+0/utc_date()
20200913.0000
20200913.0000
20200913.0000
20200913.0000
20200913.0000
select utc_date()%utc_date()+0 from t1;
utc_date()%utc_date()+0
0
0
0
0
0
select utc_date()+0 div utc_date() from t1;
utc_date()+0 div utc_date()
20200913
20200913
20200913
20200913
20200913
select utc_date() mod utc_date()+0 from t1;
utc_date() mod utc_date()+0
0
0
0
0
0
select -utc_date()+0 from t1;
-utc_date()+0
-20200913
-20200913
-20200913
-20200913
-20200913
select +utc_date()+0 from t1;
+utc_date()+0
20200913
20200913
20200913
20200913
20200913
select utc_date()+0+utc_date()+0 from t1 where id=3;
utc_date()+0+utc_date()+0
40401826
select utc_date()+0-utc_date()+0 from t1;
utc_date()+0-utc_date()+0
0
0
0
0
0
select utc_date()+0*utc_date()+0 from t1;
utc_date()+0*utc_date()+0
20200913
20200913
20200913
20200913
20200913
select utc_date()+0/utc_date()+0 from t1;
utc_date()+0/utc_date()+0
20200913.0000
20200913.0000
20200913.0000
20200913.0000
20200913.0000
select utc_date()+0%utc_date()+0 from t1;
utc_date()+0%utc_date()+0
20200913
20200913
20200913
20200913
20200913
select utc_date()+0 div utc_date()+0 from t1;
utc_date()+0 div utc_date()+0
20200913
20200913
20200913
20200913
20200913
select utc_date()+0 mod utc_date()+0 from t1;
utc_date()+0 mod utc_date()+0
20200913
20200913
20200913
20200913
20200913
select distinct utc_date() from t1;
utc_date()
2020-09-13
select distinct utc_date()+20 from t1;
utc_date()+20
20200933
select  utc_date() from t1;
utc_date()
2020-09-13
2020-09-13
2020-09-13
2020-09-13
2020-09-13
select  utc_date()+1 from t1;
utc_date()+1
20200914
20200914
20200914
20200914
20200914
select t1.*,utc_date()-0, utc_date() from t1 group by id;
id	name	d	utc_date()-0	utc_date()
1	test01	2020-08-11	20200913	2020-09-13
2	test02	2020-09-15	20200913	2020-09-13
3	test03	2020-08-20	20200913	2020-09-13
4	test04	2020-09-15	20200913	2020-09-13
5	test05	2020-09-13	20200913	2020-09-13
select t1.*,utc_date()-0, utc_date() from t1 group by utc_date(),utc_date()+0;
id	name	d	utc_date()-0	utc_date()
1	test01	2020-08-11	20200913	2020-09-13
select t1.*,utc_date()-0, utc_date() from t1 group by utc_date() having utc_date()>='2020-09-13';
id	name	d	utc_date()-0	utc_date()
1	test01	2020-08-11	20200913	2020-09-13
select t1.*,utc_date()-0, utc_date() from t1 group by utc_date() having utc_date()-0>='2020-09-13';
id	name	d	utc_date()-0	utc_date()
1	test01	2020-08-11	20200913	2020-09-13
Warnings:
Warning	1292	Truncated incorrect DECIMAL value: '2020-09-13'
select t1.*,utc_date()-0, utc_date() from t1 order by utc_date();
id	name	d	utc_date()-0	utc_date()
1	test01	2020-08-11	20200913	2020-09-13
2	test02	2020-09-15	20200913	2020-09-13
3	test03	2020-08-20	20200913	2020-09-13
4	test04	2020-09-15	20200913	2020-09-13
5	test05	2020-09-13	20200913	2020-09-13
select t1.*,utc_date()-0, utc_date() from t1 order by utc_date()+0;
id	name	d	utc_date()-0	utc_date()
1	test01	2020-08-11	20200913	2020-09-13
2	test02	2020-09-15	20200913	2020-09-13
3	test03	2020-08-20	20200913	2020-09-13
4	test04	2020-09-15	20200913	2020-09-13
5	test05	2020-09-13	20200913	2020-09-13
select t1.*,utc_date()-0, utc_date() from t1  where d =utc_date() order by utc_date();
id	name	d	utc_date()-0	utc_date()
5	test05	2020-09-13	20200913	2020-09-13
select t1.*,utc_date()-0, utc_date() from t1 where d =utc_date()+0 order by utc_date()+0;
id	name	d	utc_date()-0	utc_date()
5	test05	2020-09-13	20200913	2020-09-13
select t1.* , case utc_date()  when utc_date()  then utc_date()  when utc_date()+1  then    utc_date()+1  end as a  from t1;
id	name	d	a
1	test01	2020-08-11	2020-09-13
2	test02	2020-09-15	2020-09-13
3	test03	2020-08-20	2020-09-13
4	test04	2020-09-15	2020-09-13
5	test05	2020-09-13	2020-09-13
select t1.* , case utc_date()+1  when utc_date()  then utc_date()  when utc_date()+1  then    utc_date()+1  end as a  from t1;
id	name	d	a
1	test01	2020-08-11	20200914
2	test02	2020-09-15	20200914
3	test03	2020-08-20	20200914
4	test04	2020-09-15	20200914
5	test05	2020-09-13	20200914
select count(utc_date()) from t1;
count(utc_date())
5
select count(utc_date()+0) from t1;
count(utc_date()+0)
5
select sum(utc_date()) from t1;
sum(utc_date())
101004565
select sum(utc_date()+0) from t1;
sum(utc_date()+0)
101004565
select avg(utc_date()) from t1;
avg(utc_date())
20200913.0000
select avg(utc_date()+0) from t1;
avg(utc_date()+0)
20200913.0000
select min(utc_date()) from t1;
min(utc_date())
2020-09-13
select min(utc_date()+0) from t1;
min(utc_date()+0)
20200913
select max(utc_date()) from t1;
max(utc_date())
2020-09-13
select max(utc_date()+0) from t1;
max(utc_date()+0)
20200913
select GROUP_CONCAT(utc_date()) from t1;
GROUP_CONCAT(utc_date())
2020-09-13,2020-09-13,2020-09-13,2020-09-13,2020-09-13
select GROUP_CONCAT(utc_date()+0) from t1;
GROUP_CONCAT(utc_date()+0)
20200913,20200913,20200913,20200913,20200913
drop table t2;
drop table t1;
create table t1(id int,name varchar(20));
create table t2(id int,name varchar(20));
insert into t1 values(1,'test');
insert into t1 values(2,'test');
insert into t2 values(1,'test');
insert into t1 values(3,'test');
select utc_date(),utc_date()+0 from t1 union select utc_date(),utc_date()+0 from t2;
utc_date()	utc_date()+0
2020-09-13	20200913
select utc_date(),utc_date()+0 from t1 union all select utc_date(),utc_date()+0 from t2;
utc_date()	utc_date()+0
2020-09-13	20200913
2020-09-13	20200913
2020-09-13	20200913
2020-09-13	20200913
select utc_date(),utc_date()+0 from t1 intersect select utc_date(),utc_date()+0 from t2;
utc_date()	utc_date()+0
2020-09-13	20200913
select utc_date(),utc_date()+1 from t1 except select utc_date(),utc_date()+0 from t2;
utc_date()	utc_date()+1
2020-09-13	20200914
select utc_date(),utc_date()+2 from t1 minus select utc_date(),utc_date()+0 from t2;
utc_date()	utc_date()+2
2020-09-13	20200915
drop table t2;
drop table t1;
obmysql-utc_date-4-1  表insert into
drop table t1;
create table t1(a bool);
insert into t1 values(utc_date());
ERROR 22003: Out of range value for column 'a' at row 1
update t1 set a =utc_date();
insert into t1 values(utc_date()+1);
ERROR 22003: Out of range value for column 'a' at row 1
drop table t1;
create table t1(a BOOLEAN);
insert into t1 values(utc_date());
ERROR 22003: Out of range value for column 'a' at row 1
insert into t1 values(utc_date()+1);
ERROR 22003: Out of range value for column 'a' at row 1
drop table t1;
create table t1(a TINYINT);
insert into t1 values(utc_date());
ERROR 22003: Out of range value for column 'a' at row 1
insert into t1 values(utc_date()+1);
ERROR 22003: Out of range value for column 'a' at row 1
drop table t1;
create table t1(a SMALLINT);
insert into t1 values(utc_date());
ERROR 22003: Out of range value for column 'a' at row 1
update t1 set a =utc_date()+1;
update t1 set a =utc_date()-20200912;
insert into t1 values(utc_date()+1);
ERROR 22003: Out of range value for column 'a' at row 1
insert into t1 values(utc_date()-20200920);
select * from t1;
a
-7
update t1 set a =utc_date();
ERROR 22003: Out of range value for column 'a' at row 1
update t1 set a =utc_date()-20200912;
select * from t1;
a
1
drop table t1;
create table t1(a MEDIUMINT);
insert into t1 values(utc_date());
ERROR 22003: Out of range value for column 'a' at row 1
insert into t1 values(utc_date()+1);
ERROR 22003: Out of range value for column 'a' at row 1
drop table t1;
create table t1(a INT);
insert into t1 values(utc_date());
insert into t1 values(utc_date()+1);
select * from t1;
a
20200913
20200914
drop table t1;
create table t1(a INTEGER);
insert into t1 values(utc_date());
insert into t1 values(utc_date()+1);
select * from t1;
a
20200913
20200914
drop table t1;
create table t1(a BIGINT);
insert into t1 values(utc_date());
insert into t1 values(utc_date()+1);
select * from t1;
a
20200913
20200914
update t1 set a = utc_date() where a=20200914;
select * from t1;
a
20200913
20200913
update t1 set a = utc_date()-10;
select * from t1;
a
20200903
20200903
drop table t1;
create table t1(a DECIMAL);
insert into t1 values(utc_date());
insert into t1 values(utc_date()+1);
select * from t1;
a
20200913
20200914
update t1 set a = utc_date() where a=20200914;
select * from t1;
a
20200913
20200913
update t1 set a = utc_date()-10;
select * from t1;
a
20200903
20200903
drop table t1;
create table t1(a NUMERIC);
insert into t1 values(utc_date());
insert into t1 values(utc_date()+1);
select * from t1;
a
20200913
20200914
update t1 set a = utc_date() where a=20200914;
select * from t1;
a
20200913
20200913
update t1 set a = utc_date()-10;
select * from t1;
a
20200903
20200903
drop table t1;
create table t1(a FLOAT);
insert into t1 values(utc_date());
insert into t1 values(utc_date()+1);
select * from t1;
a
20200900
20200900
update t1 set a = utc_date() where a=20200914;
select * from t1;
a
20200900
20200900
update t1 set a = utc_date()-1000;
select * from t1;
a
20199900
20199900
drop table t1;
create table t1(a DOUBLE);
insert into t1 values(utc_date());
insert into t1 values(utc_date()+1);
select * from t1;
a
20200913
20200914
update t1 set a = utc_date() where a=20200914;
select * from t1;
a
20200913
20200913
update t1 set a = utc_date()-1000;
select * from t1;
a
20199913
20199913
drop table t1;
create table t1(a BIT);
insert into t1 values(utc_date());
ERROR 22001: Data too long for column 'a' at row 1
insert into t1 values(utc_date()-20200912);
select * from t1;
a

update t1 set a = utc_date() where a=20200914;
select * from t1;
a

update t1 set a = utc_date()-20200913;
select * from t1;
a
 
drop table t1;
create table t1(a DATETIME);
insert into t1 values(utc_date());
insert into t1 values(utc_date()-20200912);
ERROR 22007: Incorrect datetime value for column 'a' at row 1
insert into t1 values(utc_date()+0);
select * from t1;
a
2020-09-13 00:00:00
2020-09-13 00:00:00
update t1 set a = utc_date() where a= utc_date();
select * from t1;
a
2020-09-13 00:00:00
2020-09-13 00:00:00
update t1 set a = utc_date()-20200913;
select * from t1;
a
0000-00-00 00:00:00
0000-00-00 00:00:00
drop table t1;
create table t1(a TIMESTAMP);
insert into t1 values(utc_date());
insert into t1 values(utc_date()-1);
select * from t1;
a
2020-09-13 00:00:00
2020-09-12 00:00:00
update t1 set a = utc_date() where a=utc_date();
select * from t1;
a
2020-09-13 00:00:00
2020-09-12 00:00:00
update t1 set a = utc_date()-20200913;
select * from t1;
a
0000-00-00 00:00:00
0000-00-00 00:00:00
drop table t1;
create table t1(a DATE);
insert into t1 values(utc_date());
insert into t1 values(utc_date()-20200912);
ERROR 22007: Incorrect datetime value for column 'a' at row 1
insert into t1 values(utc_date()-1);
select * from t1;
a
2020-09-13
2020-09-12
update t1 set a = utc_date() where a=utc_date();
select * from t1;
a
2020-09-13
2020-09-12
update t1 set a = utc_date()-20200913;
select * from t1;
a
0000-00-00
0000-00-00
drop table t1;
create table t1(a TIME);
insert into t1 values(utc_date());
insert into t1 values(utc_date()-20200912);
select * from t1;
a
00:00:00
00:00:01
update t1 set a = utc_date() where a=20200914;
ERROR 22007: Incorrect value
update t1 set a = utc_date() where a=utc_date();
select * from t1;
a
00:00:00
00:00:01
update t1 set a = utc_date()-20200913;
select * from t1;
a
00:00:00
00:00:00
drop table t1;
create table t1(a YEAR);
insert into t1 values(utc_date());
insert into t1 values(utc_date()-20200912);
select * from t1;
a
2020
2001
update t1 set a = utc_date() where a=utc_date();
update t1 set a = utc_date() where a=20200914;
select * from t1;
a
2020
2001
update t1 set a = utc_date()-20200913;
select * from t1;
a
0000
0000
drop table t1;
create table t1(a VARCHAR(50));
insert into t1 values(utc_date());
insert into t1 values(utc_date()-1);
select * from t1;
a
2020-09-13
20200912
update t1 set a = utc_date() where a=utc_date();
select * from t1;
a
2020-09-13
20200912
update t1 set a = utc_date()+0;
select * from t1;
a
20200913
20200913
drop table t1;
create table t1(a VARBINARY(50));
insert into t1 values(utc_date());
insert into t1 values(utc_date()-1);
select * from t1;
a
2020-09-13
20200912
update t1 set a = utc_date() where a=utc_date();
select * from t1;
a
2020-09-13
20200912
update t1 set a = utc_date()+0;
select * from t1;
a
20200913
20200913
drop table t1;
create table t1(a CHAR);
insert into t1 values(utc_date());
ERROR 22001: Data too long for column 'a' at row 1
insert into t1 values(utc_date()-1);
ERROR 22001: Data too long for column 'a' at row 1
insert into t1 values(utc_date()-20200912);
select * from t1;
a
1
update t1 set a = utc_date() where a=utc_date()-20200912;
ERROR 22001: Data too long for column 'a' at row 1
select * from t1;
a
1
update t1 set a = utc_date()-20200913;
select * from t1;
a
0
drop table t1;
create table t1(a BINARY);
insert into t1 values(utc_date());
ERROR 22001: Data too long for column 'a' at row 1
insert into t1 values(utc_date()-1);
ERROR 22001: Data too long for column 'a' at row 1
insert into t1 values(utc_date()-20200913);
select * from t1;
a
0
update t1 set a = utc_date() where a=utc_date();
ERROR 22007: Incorrect value
select * from t1;
a
0
update t1 set a = utc_date()-20200911;
update t1 set a =  utc_date()-20200912 where a=2;
select * from t1;
a
1
drop table t1;
create table t1(a enum ('c','d'));
insert into t1 values(utc_date());
ERROR 01000: Data truncated for column 'a' at row 1
insert into t1 values(utc_date()-1);
ERROR 01000: Data truncated for column 'a' at row 1
select * from t1;
a
update t1 set a = utc_date() where a=utc_date();
update t1 set a = utc_date()+1;
drop table t1;
create table t1(a set ('c','d'));
insert into t1 values(utc_date());
ERROR 01000: Data truncated for column 'a' at row 1
insert into t1 values(utc_date()-1);
ERROR 01000: Data truncated for column 'a' at row 1
select * from t1;
a
update t1 set a = utc_date() where a=utc_date();
insert into t1 values('c');
update t1 set a = utc_date()+1;
ERROR 01000: Data truncated for column 'a' at row 1
drop table t1;
create table t1(a TINYTEXT);
insert into t1 values(utc_date());
insert into t1 values(utc_date()-1);
select * from t1;
a
2020-09-13
20200912
update t1 set a = utc_date() where a=utc_date();
update t1 set a = utc_date()+1;
select * from t1;
a
20200914
20200914
drop table t1;
create table t1(a TINYBLOB);
insert into t1 values(utc_date());
insert into t1 values(utc_date()-1);
select * from t1;
a
2020-09-13
20200912
update t1 set a = utc_date() where a=utc_date();
update t1 set a = utc_date()+1;
select * from t1;
a
20200914
20200914
drop table t1;
create table t1(a TEXT);
insert into t1 values(utc_date());
insert into t1 values(utc_date()-1);
select * from t1;
a
2020-09-13
20200912
update t1 set a = utc_date() where a=utc_date();
update t1 set a = utc_date()+1;
select * from t1;
a
20200914
20200914
drop table t1;
create table t1(a BLOB);
insert into t1 values(utc_date());
insert into t1 values(utc_date()-1);
select * from t1;
a
2020-09-13
20200912
update t1 set a = utc_date() where a=utc_date();
update t1 set a = utc_date()+1;
select * from t1;
a
20200914
20200914
drop table t1;
create table t1(a MEDIUMTEXT);
insert into t1 values(utc_date());
insert into t1 values(utc_date()-1);
select * from t1;
a
2020-09-13
20200912
update t1 set a = utc_date() where a=utc_date();
update t1 set a = utc_date()+1;
select * from t1;
a
20200914
20200914
drop table t1;
create table t1(a MEDIUMBLOB);
insert into t1 values(utc_date());
insert into t1 values(utc_date()-1);
select * from t1;
a
2020-09-13
20200912
update t1 set a = utc_date() where a=utc_date();
update t1 set a = utc_date()+1;
select * from t1;
a
20200914
20200914
drop table t1;
create table t1(a LONGTEXT);
insert into t1 values(utc_date());
insert into t1 values(utc_date()-1);
select * from t1;
a
2020-09-13
20200912
update t1 set a = utc_date() where a=utc_date();
update t1 set a = utc_date()+1;
select * from t1;
a
20200914
20200914
drop table t1;
create table t1(a LONGBLOB);
insert into t1 values(utc_date());
insert into t1 values(utc_date()-1);
select * from t1;
a
2020-09-13
20200912
update t1 set a = utc_date() where a=utc_date();
update t1 set a = utc_date()+1;
select * from t1;
a
20200914
20200914
drop table t1;
create table t1 (id int ,name varchar(20),d date);
insert into t1 values(1,'test01','20200811');
insert into t1 values(2,'test02','20200915');
insert into t1 values(3,'test03','2020-08-20');
insert into t1 values(4,'test04','2020-09-15');
insert into t1 values(utc_date()-20200908,utc_date()||'test05',utc_date());
select * from t1;
id	name	d
1	test01	2020-08-11
2	test02	2020-09-15
3	test03	2020-08-20
4	test04	2020-09-15
5	1	2020-09-13
drop table t2;
create table t2 (id int ,d date);
insert into t2(id, d)  select utc_date()+0,utc_date();
select * from t2;
id	d
20200913	2020-09-13
insert into t2(id, d)  select utc_date()+0,utc_date() from t1 where d>utc_date();
select * from t2;
id	d
20200913	2020-09-13
20200913	2020-09-13
20200913	2020-09-13
drop table t2;
insert into t1 values(abs(utc_date()),UPPER(utc_date()),STR_TO_DATE(utc_date(),GET_FORMAT(DATETIME,'EUR')));
insert into t1 values(abs(utc_date()+1),UPPER(utc_date()+1),STR_TO_DATE(utc_date()+1,GET_FORMAT(DATETIME,'USA')));
ERROR HY000: Incorrect datetime value: '20200914' for function str_to_date
insert into t1 values(CEIL(utc_date()+1),RTRIM(utc_date()+1),UNIX_TIMESTAMP(utc_date()));
ERROR 22007: Incorrect datetime value for column 'd' at row 1
insert into t1 values(CEIL(utc_date()+1),RTRIM(utc_date()+1),USEC_TO_TIME(utc_date()+1));
select * from t1;
id	name	d
1	test01	2020-08-11
2	test02	2020-09-15
3	test03	2020-08-20
4	test04	2020-09-15
5	1	2020-09-13
20200913	2020-09-13	2020-09-13
20200914	20200914	1970-01-01
insert into t1(d) values(-utc_date());
ERROR 22007: Incorrect datetime value for column 'd' at row 1
insert into t1(d) values(+utc_date());
insert into t1(id) values(-utc_date());
insert into t1(name) values(utc_date()+utc_date());
insert into t1(name) values(utc_date()*utc_date());
insert into t1(id) values(utc_date()/1);
insert into t1 values(utc_date()%1,utc_date()%1,utc_date()%1);
insert into t1 values(utc_date() div 1,utc_date() div 1,utc_date() div 1);
insert into t1 values(utc_date() mod 1,utc_date() mod 1,utc_date() mod 1);
insert into t1 values(utc_date()+0%1,utc_date()+1%1,utc_date()+1%1);
insert into t1 values(utc_date()-1 div 1,utc_date()-2 div 1,utc_date()-1 div 1);
insert into t1 values(utc_date()-1 mod 1,utc_date()-1 mod 1,utc_date()-1 mod 1);
insert into t1 values(utc_date()-1 * 1,utc_date()-1 * 1,utc_date()-1 * 1);
select * from t1;
id	name	d
1	test01	2020-08-11
2	test02	2020-09-15
3	test03	2020-08-20
4	test04	2020-09-15
5	1	2020-09-13
20200913	2020-09-13	2020-09-13
20200914	20200914	1970-01-01
NULL	NULL	2020-09-13
-20200913	NULL	NULL
NULL	40401826	NULL
NULL	408076886033569	NULL
20200913	NULL	NULL
0	0	0000-00-00
20200913	20200913	2020-09-13
0	0	0000-00-00
20200913	20200913	2020-09-13
20200912	20200911	2020-09-12
20200913	20200913	2020-09-13
20200912	20200912	2020-09-12
drop table t1;
obmysql-utc_date-4-1-3
create table t1 (id int ,name varchar(20),d date);
insert into t1 values(1,'test01','20200811');
insert into t1 values(2,'test02','20200915');
insert into t1 values(3,'test03','2020-08-20');
insert into t1 values(4,'test04','2020-09-15');
insert into t1 values(utc_date()-20200908,utc_date()||'test05',utc_date());
insert into t1 values(6,'test06',utc_date());
update t1 set id= utc_date() where name='test01';
update t1 set id= utc_date()+0 where name='test01';
select * from t1;
id	name	d
20200913	test01	2020-08-11
2	test02	2020-09-15
3	test03	2020-08-20
4	test04	2020-09-15
5	1	2020-09-13
6	test06	2020-09-13
update t1 set id= utc_date(),d=utc_date()+0 where name in ('test01','test02');
update t1 set id= utc_date()+0,d=utc_date() where name in ('test01','test02');
update t1 set id= utc_date(),d=utc_date()+0 where name in ('test01','test02');
update t1 set id= utc_date() where d>utc_date();
update t1 set id= utc_date()+0  where d>utc_date()+0;
update t1 set id= utc_date() where d>utc_date();
update t1 set id= utc_date()+0  where d<utc_date()+0;
update t1 set id= utc_date() where d=utc_date();
update t1 set id= utc_date() where d<=utc_date();
update t1 set id= utc_date() where d between utc_date() and utc_date()+3 ;
update t1 set id= utc_date()+0 where d = utc_date()  or id=utc_date() ;
update t1 set id= utc_date()+0 where name like 'test%' ;
update t1 set id= utc_date() where name not like 'test%' ;
update t1 set id= utc_date() where d>any(select utc_date());
update t1 set id= utc_date()+1 where d<all(select utc_date());
update t1 set id= abs(utc_date());
update t1 set id= abs(utc_date()+1);
update t1 set id= TO_DAYS(utc_date());
update t1 set id= LOCATE(utc_date()-1,utc_date());
update t1 set id= DATE_ADD(utc_date()+0,INTERVAL 5 DAY);
ERROR 01000: Data truncated for column 'id' at row 1
update t1 set d= DATE_ADD(utc_date()+0,INTERVAL 5 DAY);
update t1 set name= utc_date()+ utc_time();
update t1 set name= utc_date()+0- utc_time();
update t1 set name= utc_date()/utc_time();
update t1 set name= utc_date()-1*utc_time()+1;
update t1 set name= utc_date()%utc_time();
update t1 set name= utc_date() MOD utc_time();
update t1 set name= utc_date()-1 div utc_time()+0;
update t1 set name= utc_date()+1|| utc_date()+1;
select * from t1;
id	name	d
0	1	2020-09-18
0	1	2020-09-18
0	1	2020-09-18
0	1	2020-09-18
0	1	2020-09-18
0	1	2020-09-18
drop table t1;
create table t1(name varchar(utc_date()-20200900));
ERROR 42000: You have an error in your SQL syntax; check the manual that corresponds to your OceanBase version for the right syntax to use near 'utc_date()-20200900))' at line 1
create table t1(id int ,name varchar(20) default utc_date());
ERROR 42000: You have an error in your SQL syntax; check the manual that corresponds to your OceanBase version for the right syntax to use near 'utc_date())' at line 1
create table t1(id int, name varchar(20) GENERATED ALWAYS AS (utc_date()) STORED NOT NULL COMMENT '姓名');
ERROR HY000: Expression of generated column contains a disallowed function
create table t1(id int GENERATED ALWAYS AS (utc_date()) STORED NOT NULL COMMENT '编号');
ERROR HY000: Expression of generated column contains a disallowed function
create table t1(id int, name varchar(20) GENERATED ALWAYS AS (utc_date()+0) STORED NOT NULL COMMENT '姓名');
ERROR HY000: Expression of generated column contains a disallowed function
create table t1(id int GENERATED ALWAYS AS (utc_date()+0) STORED NOT NULL COMMENT '编号');
ERROR HY000: Expression of generated column contains a disallowed function
drop table t1;
create table t1(id int, name varchar(30));
alter  table t1 modify  column name int(utc_date);
ERROR 42000: You have an error in your SQL syntax; check the manual that corresponds to your OceanBase version for the right syntax to use near 'utc_date)' at line 1
alter  table t1 modify  column name varchar(30)  DEFAULT utc_date();
ERROR 42000: You have an error in your SQL syntax; check the manual that corresponds to your OceanBase version for the right syntax to use near 'utc_date()' at line 1
alter  table t1 modify  column name varchar(30)  GENERATED ALWAYS AS (utc_date()+0) STORED NOT NULL COMMENT '姓名';
ERROR HY000: Expression of generated column contains a disallowed function
drop table t1;
create table t1 (id int primary key, name varchar(30)) partition by hash(id) partitions 3;
insert into t1 values(utc_date()+1,utc_date());
insert into t1 values(utc_date()+2,utc_date()+0);
insert into t1 values(utc_date()+3,utc_date());
insert into t1 values(utc_date()+4,utc_date()+1);
update t1 set id =utc_date();
update t1 set id =utc_date()+1;
update t1 set name =utc_date();
update t1 set name =utc_date()+1;
select * from t1;
id	name
20200914	20200914
20200917	20200914
20200915	20200914
20200916	20200914
drop table t1;
obmysql-utc_date-4-2视图
drop table t1;
create table t1 (id int ,name varchar(20),d date);
insert into t1 values(1,'test01','20200811');
insert into t1 values(2,'test02','20200915');
insert into t1 values(3,'test03','2020-08-20');
insert into t1 values(4,'test04','2020-09-15');
insert into t1 values(5,'test05','2020-09-13');
drop view v1;
create view v1 as select * from t1;
select * from v1;
id	name	d
1	test01	2020-08-11
2	test02	2020-09-15
3	test03	2020-08-20
4	test04	2020-09-15
5	test05	2020-09-13
select DATEDIFF(utc_date()-1,utc_date()) from v1;
DATEDIFF(utc_date()-1,utc_date())
-1
-1
-1
-1
-1
select MOD(utc_date()+5,utc_date()) from v1;
MOD(utc_date()+5,utc_date())
5
5
5
5
5
select time(utc_date()),COALESCE(utc_date()) from v1;
time(utc_date())	COALESCE(utc_date())
00:00:00	2020-09-13
00:00:00	2020-09-13
00:00:00	2020-09-13
00:00:00	2020-09-13
00:00:00	2020-09-13
SELECT INSTR(utc_date(),utc_date()+0) from v1;
INSTR(utc_date(),utc_date()+0)
0
0
0
0
0
select LENGTH(utc_date()+1),LENGTH(utc_date()) from v1;
LENGTH(utc_date()+1)	LENGTH(utc_date())
8	10
8	10
8	10
8	10
8	10
SELECT LOCATE(2,utc_date()+0,utc_date()-20200911) from v1;
LOCATE(2,utc_date()+0,utc_date()-20200911)
3
3
3
3
3
select MD5(utc_date()),MD5(utc_date()+1) from v1;
MD5(utc_date())	MD5(utc_date()+1)
ecf71871d50e462ef12bfe7790d1c273	76b0e9ef7b9f439bd0e3c5315b11ddee
ecf71871d50e462ef12bfe7790d1c273	76b0e9ef7b9f439bd0e3c5315b11ddee
ecf71871d50e462ef12bfe7790d1c273	76b0e9ef7b9f439bd0e3c5315b11ddee
ecf71871d50e462ef12bfe7790d1c273	76b0e9ef7b9f439bd0e3c5315b11ddee
ecf71871d50e462ef12bfe7790d1c273	76b0e9ef7b9f439bd0e3c5315b11ddee
select v1.*,utc_date()+0, utc_date() from v1 where utc_date()>d;
id	name	d	utc_date()+0	utc_date()
1	test01	2020-08-11	20200913	2020-09-13
3	test03	2020-08-20	20200913	2020-09-13
select v1.*,utc_date()-0, utc_date() from v1 where utc_date()>=d;
id	name	d	utc_date()-0	utc_date()
1	test01	2020-08-11	20200913	2020-09-13
3	test03	2020-08-20	20200913	2020-09-13
5	test05	2020-09-13	20200913	2020-09-13
select v1.*,utc_date()-0, utc_date()  from v1 where utc_date()<=d;
id	name	d	utc_date()-0	utc_date()
2	test02	2020-09-15	20200913	2020-09-13
4	test04	2020-09-15	20200913	2020-09-13
5	test05	2020-09-13	20200913	2020-09-13
select v1.*,utc_date()+0, utc_date()  from v1 where utc_date()=d;
id	name	d	utc_date()+0	utc_date()
5	test05	2020-09-13	20200913	2020-09-13
select v1.*,utc_date()+0, utc_date()  from v1 where d=utc_date();
id	name	d	utc_date()+0	utc_date()
5	test05	2020-09-13	20200913	2020-09-13
select v1.*,utc_date()+0, utc_date()  from v1 where utc_date()<d;
id	name	d	utc_date()+0	utc_date()
2	test02	2020-09-15	20200913	2020-09-13
4	test04	2020-09-15	20200913	2020-09-13
select v1.*,utc_date()+0, utc_date()  from v1 where utc_date()+0>d;
id	name	d	utc_date()+0	utc_date()
1	test01	2020-08-11	20200913	2020-09-13
3	test03	2020-08-20	20200913	2020-09-13
select v1.*,utc_date()-0, utc_date()  from v1 where utc_date()-1>=d;
id	name	d	utc_date()-0	utc_date()
1	test01	2020-08-11	20200913	2020-09-13
3	test03	2020-08-20	20200913	2020-09-13
select v1.*,utc_date()+0, utc_date()  from v1 where utc_date()+2<=d;
id	name	d	utc_date()+0	utc_date()
2	test02	2020-09-15	20200913	2020-09-13
4	test04	2020-09-15	20200913	2020-09-13
select v1.*,utc_date()-0, utc_date()  from v1 where utc_date()-3=d;
id	name	d	utc_date()-0	utc_date()
select v1.*,utc_date()+0, utc_date()  from v1 where utc_date()-0<d;
id	name	d	utc_date()+0	utc_date()
2	test02	2020-09-15	20200913	2020-09-13
4	test04	2020-09-15	20200913	2020-09-13
select v1.*,utc_date()+0, utc_date()  from v1 where d<utc_date()-0;
id	name	d	utc_date()+0	utc_date()
1	test01	2020-08-11	20200913	2020-09-13
3	test03	2020-08-20	20200913	2020-09-13
select v1.*,utc_date()-0, utc_date()  from v1 where d=utc_date() or utc_date()+1>=d;
id	name	d	utc_date()-0	utc_date()
1	test01	2020-08-11	20200913	2020-09-13
3	test03	2020-08-20	20200913	2020-09-13
5	test05	2020-09-13	20200913	2020-09-13
select v1.*,utc_date()+0 as a, utc_date()  from v1 where d=utc_date() and utc_date()-1<=d;
id	name	d	a	utc_date()
5	test05	2020-09-13	20200913	2020-09-13
select v1.*,utc_date()+0, utc_date()  from v1 where d between utc_date() and utc_date()+5;
id	name	d	utc_date()+0	utc_date()
2	test02	2020-09-15	20200913	2020-09-13
4	test04	2020-09-15	20200913	2020-09-13
5	test05	2020-09-13	20200913	2020-09-13
select v1.*,utc_date()-0, utc_date()  from v1 where d like 'utc_date()%';
id	name	d	utc_date()-0	utc_date()
select v1.*,utc_date()+0, utc_date()  from v1 where d not like 'utc_date()%';
id	name	d	utc_date()+0	utc_date()
1	test01	2020-08-11	20200913	2020-09-13
2	test02	2020-09-15	20200913	2020-09-13
3	test03	2020-08-20	20200913	2020-09-13
4	test04	2020-09-15	20200913	2020-09-13
5	test05	2020-09-13	20200913	2020-09-13
select v1.*,utc_date()+0, utc_date()  from v1 where d not like 'utc_date()+0%';
id	name	d	utc_date()+0	utc_date()
1	test01	2020-08-11	20200913	2020-09-13
2	test02	2020-09-15	20200913	2020-09-13
3	test03	2020-08-20	20200913	2020-09-13
4	test04	2020-09-15	20200913	2020-09-13
5	test05	2020-09-13	20200913	2020-09-13
select v1.*,utc_date()-0, utc_date()  from v1 where d like 'utc_date()-0%';
id	name	d	utc_date()-0	utc_date()
select v1.*,utc_date()-0, utc_date()  from v1 where exists (select utc_date(),utc_date()+0);
id	name	d	utc_date()-0	utc_date()
1	test01	2020-08-11	20200913	2020-09-13
2	test02	2020-09-15	20200913	2020-09-13
3	test03	2020-08-20	20200913	2020-09-13
4	test04	2020-09-15	20200913	2020-09-13
5	test05	2020-09-13	20200913	2020-09-13
select v1.*,utc_date()-0, utc_date()  from v1 where d in  (select utc_date());
id	name	d	utc_date()-0	utc_date()
5	test05	2020-09-13	20200913	2020-09-13
select v1.*,utc_date()-0, utc_date()  from v1 where d in  (select utc_date()+2);
id	name	d	utc_date()-0	utc_date()
2	test02	2020-09-15	20200913	2020-09-13
4	test04	2020-09-15	20200913	2020-09-13
select v1.*,utc_date()-0, utc_date()  from v1 where d in  (utc_date()+2,utc_date());
id	name	d	utc_date()-0	utc_date()
2	test02	2020-09-15	20200913	2020-09-13
4	test04	2020-09-15	20200913	2020-09-13
5	test05	2020-09-13	20200913	2020-09-13
select v1.*,utc_date()-0, utc_date()  from v1 where d >any(utc_date()+2,utc_date());
ERROR 42000: You have an error in your SQL syntax; check the manual that corresponds to your OceanBase version for the right syntax to use near 'utc_date()+2,utc_date())' at line 1
select v1.*,utc_date()-0, utc_date()  from v1 where d >all(utc_date()+2,utc_date());
ERROR 42000: You have an error in your SQL syntax; check the manual that corresponds to your OceanBase version for the right syntax to use near 'utc_date()+2,utc_date())' at line 1
select v1.*,utc_date()-0, utc_date()  from v1 where d >=all(select utc_date()+2 from v1);
id	name	d	utc_date()-0	utc_date()
2	test02	2020-09-15	20200913	2020-09-13
4	test04	2020-09-15	20200913	2020-09-13
select v1.*,utc_date()-0, utc_date()  from v1 where d <=any(select utc_date()+2 from v1);
id	name	d	utc_date()-0	utc_date()
1	test01	2020-08-11	20200913	2020-09-13
2	test02	2020-09-15	20200913	2020-09-13
3	test03	2020-08-20	20200913	2020-09-13
4	test04	2020-09-15	20200913	2020-09-13
5	test05	2020-09-13	20200913	2020-09-13
select v1.*,utc_date()-0, utc_date()  from v1 where id >2;
id	name	d	utc_date()-0	utc_date()
3	test03	2020-08-20	20200913	2020-09-13
4	test04	2020-09-15	20200913	2020-09-13
5	test05	2020-09-13	20200913	2020-09-13
select v1.*,utc_date()-0, utc_date()  from v1 where id =2;
id	name	d	utc_date()-0	utc_date()
2	test02	2020-09-15	20200913	2020-09-13
select v1.*,utc_date()-0, utc_date()  from v1 where id =2 or name ='test03';
id	name	d	utc_date()-0	utc_date()
2	test02	2020-09-15	20200913	2020-09-13
3	test03	2020-08-20	20200913	2020-09-13
select v1.*,utc_date()-0, utc_date()  from v1 where id in (1,2,3);
id	name	d	utc_date()-0	utc_date()
1	test01	2020-08-11	20200913	2020-09-13
2	test02	2020-09-15	20200913	2020-09-13
3	test03	2020-08-20	20200913	2020-09-13
select utc_date()+utc_date() from v1 where id>3;
utc_date()+utc_date()
40401826
40401826
select utc_date()-utc_date() from v1;
utc_date()-utc_date()
0
0
0
0
0
select utc_date()*utc_date() from v1;
utc_date()*utc_date()
408076886033569
408076886033569
408076886033569
408076886033569
408076886033569
select utc_date()/utc_date() from v1;
utc_date()/utc_date()
1.0000
1.0000
1.0000
1.0000
1.0000
select utc_date()%utc_date() from v1;
utc_date()%utc_date()
0
0
0
0
0
select utc_date() div utc_date() from v1;
utc_date() div utc_date()
1
1
1
1
1
select utc_date() mod utc_date() from v1;
utc_date() mod utc_date()
0
0
0
0
0
select -utc_date() from v1;
-utc_date()
-20200913
-20200913
-20200913
-20200913
-20200913
select +utc_date() from v1;
+utc_date()
2020-09-13
2020-09-13
2020-09-13
2020-09-13
2020-09-13
select utc_date()+0+utc_date() from v1 where id>3;
utc_date()+0+utc_date()
40401826
40401826
select utc_date()-utc_date()+0 from v1;
utc_date()-utc_date()+0
0
0
0
0
0
select utc_date()*utc_date()+0 from v1;
utc_date()*utc_date()+0
408076886033569
408076886033569
408076886033569
408076886033569
408076886033569
select utc_date()+0/utc_date() from v1;
utc_date()+0/utc_date()
20200913.0000
20200913.0000
20200913.0000
20200913.0000
20200913.0000
select utc_date()%utc_date()+0 from v1;
utc_date()%utc_date()+0
0
0
0
0
0
select utc_date()+0 div utc_date() from v1;
utc_date()+0 div utc_date()
20200913
20200913
20200913
20200913
20200913
select utc_date() mod utc_date()+0 from v1;
utc_date() mod utc_date()+0
0
0
0
0
0
select -utc_date()+0 from v1;
-utc_date()+0
-20200913
-20200913
-20200913
-20200913
-20200913
select +utc_date()+0 from v1;
+utc_date()+0
20200913
20200913
20200913
20200913
20200913
select utc_date()+0+utc_date()+0 from v1 where id=3;
utc_date()+0+utc_date()+0
40401826
select utc_date()+0-utc_date()+0 from v1;
utc_date()+0-utc_date()+0
0
0
0
0
0
select utc_date()+0*utc_date()+0 from v1;
utc_date()+0*utc_date()+0
20200913
20200913
20200913
20200913
20200913
select utc_date()+0/utc_date()+0 from v1;
utc_date()+0/utc_date()+0
20200913.0000
20200913.0000
20200913.0000
20200913.0000
20200913.0000
select utc_date()+0%utc_date()+0 from v1;
utc_date()+0%utc_date()+0
20200913
20200913
20200913
20200913
20200913
select utc_date()+0 div utc_date()+0 from v1;
utc_date()+0 div utc_date()+0
20200913
20200913
20200913
20200913
20200913
select utc_date()+0 mod utc_date()+0 from v1;
utc_date()+0 mod utc_date()+0
20200913
20200913
20200913
20200913
20200913
select distinct utc_date() from v1;
utc_date()
2020-09-13
select distinct utc_date()+20 from v1;
utc_date()+20
20200933
select  utc_date() from v1;
utc_date()
2020-09-13
2020-09-13
2020-09-13
2020-09-13
2020-09-13
select  utc_date()+1 from v1;
utc_date()+1
20200914
20200914
20200914
20200914
20200914
select v1.*,utc_date()-0, utc_date() from v1 group by id;
id	name	d	utc_date()-0	utc_date()
1	test01	2020-08-11	20200913	2020-09-13
2	test02	2020-09-15	20200913	2020-09-13
3	test03	2020-08-20	20200913	2020-09-13
4	test04	2020-09-15	20200913	2020-09-13
5	test05	2020-09-13	20200913	2020-09-13
select v1.*,utc_date()-0, utc_date() from v1 group by utc_date(),utc_date()+0;
id	name	d	utc_date()-0	utc_date()
1	test01	2020-08-11	20200913	2020-09-13
select v1.*,utc_date()-0, utc_date() from v1 group by utc_date() having utc_date()>='2020-09-13';
id	name	d	utc_date()-0	utc_date()
1	test01	2020-08-11	20200913	2020-09-13
select v1.*,utc_date()-0, utc_date() from v1 group by utc_date() having utc_date()-0>='2020-09-13';
id	name	d	utc_date()-0	utc_date()
1	test01	2020-08-11	20200913	2020-09-13
Warnings:
Warning	1292	Truncated incorrect DECIMAL value: '2020-09-13'
select v1.*,utc_date()-0, utc_date() from v1 order by utc_date();
id	name	d	utc_date()-0	utc_date()
1	test01	2020-08-11	20200913	2020-09-13
2	test02	2020-09-15	20200913	2020-09-13
3	test03	2020-08-20	20200913	2020-09-13
4	test04	2020-09-15	20200913	2020-09-13
5	test05	2020-09-13	20200913	2020-09-13
select v1.*,utc_date()-0, utc_date() from v1 order by utc_date()+0;
id	name	d	utc_date()-0	utc_date()
1	test01	2020-08-11	20200913	2020-09-13
2	test02	2020-09-15	20200913	2020-09-13
3	test03	2020-08-20	20200913	2020-09-13
4	test04	2020-09-15	20200913	2020-09-13
5	test05	2020-09-13	20200913	2020-09-13
select v1.*,utc_date()-0, utc_date() from v1  where d =utc_date() order by utc_date();
id	name	d	utc_date()-0	utc_date()
5	test05	2020-09-13	20200913	2020-09-13
select v1.*,utc_date()-0, utc_date() from v1 where d =utc_date()+0 order by utc_date()+0;
id	name	d	utc_date()-0	utc_date()
5	test05	2020-09-13	20200913	2020-09-13
select v1.* , case utc_date()  when utc_date()  then utc_date()  when utc_date()+1  then    utc_date()+1  end as a  from v1;
id	name	d	a
1	test01	2020-08-11	2020-09-13
2	test02	2020-09-15	2020-09-13
3	test03	2020-08-20	2020-09-13
4	test04	2020-09-15	2020-09-13
5	test05	2020-09-13	2020-09-13
select v1.* , case utc_date()+1  when utc_date()  then utc_date()  when utc_date()+1  then    utc_date()+1  end as a  from v1;
id	name	d	a
1	test01	2020-08-11	20200914
2	test02	2020-09-15	20200914
3	test03	2020-08-20	20200914
4	test04	2020-09-15	20200914
5	test05	2020-09-13	20200914
select count(utc_date()) from v1;
count(utc_date())
5
select count(utc_date()+0) from v1;
count(utc_date()+0)
5
select sum(utc_date()) from v1;
sum(utc_date())
101004565
select sum(utc_date()+0) from v1;
sum(utc_date()+0)
101004565
select avg(utc_date()) from v1;
avg(utc_date())
20200913.0000
select avg(utc_date()+0) from v1;
avg(utc_date()+0)
20200913.0000
select min(utc_date()) from v1;
min(utc_date())
2020-09-13
select min(utc_date()+0) from v1;
min(utc_date()+0)
20200913
select max(utc_date()) from v1;
max(utc_date())
2020-09-13
select max(utc_date()+0) from v1;
max(utc_date()+0)
20200913
select GROUP_CONCAT(utc_date()) from v1;
GROUP_CONCAT(utc_date())
2020-09-13,2020-09-13,2020-09-13,2020-09-13,2020-09-13
select GROUP_CONCAT(utc_date()+0) from v1;
GROUP_CONCAT(utc_date()+0)
20200913,20200913,20200913,20200913,20200913
select * from v1;
id	name	d
1	test01	2020-08-11
2	test02	2020-09-15
3	test03	2020-08-20
4	test04	2020-09-15
5	test05	2020-09-13
insert into v1(id,name,d) values(utc_date()+0,utc_date(),utc_date());
insert into v1(id,name,d) values(utc_date()+0,utc_date(),utc_date()+0);
insert into v1(id,name,d) values(utc_date(),utc_date()+0,utc_date()+0);
insert into v1(id,name,d) values(utc_date()-1,utc_date()-2,utc_date()-2);
insert into v1(d) values(+utc_date());
insert into v1(id) values(-utc_date());
insert into v1(name) values(utc_date()+utc_date());
insert into v1(name) values(utc_date()*utc_date());
insert into v1(id) values(utc_date()/1);
insert into v1 values(utc_date()%1,utc_date()%1,utc_date()%1);
insert into v1 values(utc_date() div 1,utc_date() div 1,utc_date() div 1);
insert into v1 values(utc_date() mod 1,utc_date() mod 1,utc_date() mod 1);
insert into v1 values(utc_date()+0%1,utc_date()+1%1,utc_date()+1%1);
insert into v1 values(utc_date()-1 div 1,utc_date()-2 div 1,utc_date()-1 div 1);
insert into v1 values(utc_date()-1 mod 1,utc_date()-1 mod 1,utc_date()-1 mod 1);
insert into v1 values(utc_date()-1 * 1,utc_date()-1 * 1,utc_date()-1 * 1);
insert into v1 values(abs(utc_date()),CHAR_LENGTH(utc_date()),DATE_ADD(utc_date(), INTERVAL 5 DAY));
update v1 set id= utc_date() where name='test01';
update v1 set id= utc_date()+0 where name='test01';
select * from v1 order by id;
id	name	d
NULL	NULL	2020-09-13
NULL	40401826	NULL
NULL	408076886033569	NULL
-20200913	NULL	NULL
0	0	0000-00-00
0	0	0000-00-00
2	test02	2020-09-15
3	test03	2020-08-20
4	test04	2020-09-15
5	test05	2020-09-13
20200912	20200911	2020-09-11
20200912	20200912	2020-09-12
20200912	20200911	2020-09-12
20200913	test01	2020-08-11
20200913	20200913	2020-09-13
20200913	20200913	2020-09-13
20200913	2020-09-13	2020-09-13
20200913	20200913	2020-09-13
20200913	2020-09-13	2020-09-13
20200913	20200913	2020-09-13
20200913	NULL	NULL
20200913	10	2020-09-18
update v1 set id= utc_date(),d=utc_date()+0 where name in ('test01','test02');
update v1 set id= utc_date()+0,d=utc_date() where name in ('test01','test02');
update v1 set id= utc_date(),d=utc_date()+0 where name in ('test01','test02');
update v1 set id= utc_date() where d>utc_date();
update v1 set id= utc_date()+0  where d>utc_date()+0;
update v1 set id= utc_date() where d>utc_date();
update v1 set id= utc_date()+0  where d<utc_date()+0;
update v1 set id= utc_date() where d=utc_date();
update v1 set id= utc_date() where d<=utc_date();
update v1 set id= utc_date() where d between utc_date() and utc_date()+3 ;
ob更新数据报错
update v1 set id= utc_date()+0 where d = utc_date()  or id=utc_date() ;
ERROR 22007: Incorrect value
update v1 set id= utc_date()+0 where name like 'test%' ;
update v1 set id= utc_date() where name not like 'test%' ;
update v1 set id= utc_date() where d>any(select utc_date());
update v1 set id= utc_date()+1 where d<all(select utc_date());
update v1 set id= abs(utc_date());
update v1 set id= abs(utc_date()+1);
update v1 set id= TO_DAYS(utc_date());
update v1 set id= LOCATE(utc_date()-1,utc_date());
update v1 set id= DATE_ADD(utc_date()+0,INTERVAL 5 DAY);
ERROR 01000: Data truncated for column 'id' at row 1
update v1 set d= DATE_ADD(utc_date()+0,INTERVAL 5 DAY);
update v1 set name= utc_date()+ utc_time();
update v1 set name= utc_date()+0- utc_time();
update v1 set name= utc_date()/utc_time();
update v1 set name= utc_date()-1*utc_time()+1;
update v1 set name= utc_date()%utc_time();
update v1 set name= utc_date() MOD utc_time();
update v1 set name= utc_date()-1 div utc_time()+0;
update v1 set name= utc_date()+1|| utc_date()+1;
select * from v1 order by id;
id	name	d
0	1	2020-09-18
0	1	2020-09-18
0	1	2020-09-18
0	1	2020-09-18
0	1	2020-09-18
0	1	2020-09-18
0	1	2020-09-18
0	1	2020-09-18
0	1	2020-09-18
0	1	2020-09-18
0	1	2020-09-18
0	1	2020-09-18
0	1	2020-09-18
0	1	2020-09-18
0	1	2020-09-18
0	1	2020-09-18
0	1	2020-09-18
0	1	2020-09-18
0	1	2020-09-18
0	1	2020-09-18
0	1	2020-09-18
0	1	2020-09-18
drop table t1;
drop view v1;
obmysql-utc_date-4-4 约束
drop table t1;
create table t1(id int primary key,name varchar(20) default '10');
drop table t2;
create table t2(id int unique key ,name varchar(20),t1_fk int,CONSTRAINT for_key FOREIGN KEY (t1_fk) REFERENCES  t1 (id));
drop table t3;
create table t3(id int not null ,name varchar(20));
insert into t1 values(utc_date(),utc_date());
insert into t1 values(utc_date(),utc_date()+1);
ERROR 23000: Duplicate entry '20200913' for key 'PRIMARY'
insert into t1 values(utc_date()+0,utc_date()+1);
ERROR 23000: Duplicate entry '20200913' for key 'PRIMARY'
insert into t1 values(utc_date()-0,utc_date()+1);
ERROR 23000: Duplicate entry '20200913' for key 'PRIMARY'
insert into t1(id) values(utc_date()+1);
insert into t1(id) values(utc_date()+1);
ERROR 23000: Duplicate entry '20200914' for key 'PRIMARY'
insert into t1(id) values(utc_date()+2);
update t1 set id=utc_date(),name=utc_date() where id=utc_date();
update t1 set id=utc_date()+0,name=utc_date() where id=utc_date()+0;
select * from t1;
id	name
20200913	2020-09-13
20200914	10
20200915	10
insert into t2 values(utc_date(),'test',utc_date());
insert into t2 values(utc_date()+1,'test',utc_date());
insert into t2 values(utc_date()+2,'test',utc_date());
insert into t2 values(utc_date()+3,'test',utc_date()+3);
ERROR 23000: Cannot add or update a child row: a foreign key constraint fails
insert into t2 values(utc_date()+3,'test',utc_date()+2);
select * from t2;
id	name	t1_fk
20200913	test	20200913
20200914	test	20200913
20200915	test	20200913
20200916	test	20200915
update t2 set id=utc_date() where t1_fk=utc_date();
ERROR 23000: Duplicate entry '20200913' for key 'id'
update t2 set id=utc_date() where id=utc_date()+3;
ERROR 23000: Duplicate entry '20200913' for key 'id'
update t2 set id=utc_date()+4 where id=utc_date()+3;
update t2 set t1_fk=utc_date();
update t2 set t1_fk=utc_date()+10;
ERROR 23000: Cannot add or update a child row: a foreign key constraint fails
insert into t3 values(null,utc_date());
ERROR 23000: Column 'id' cannot be null
insert into t3 values(null,utc_date()+0);
ERROR 23000: Column 'id' cannot be null
insert into t3 values(utc_date(),utc_date());
insert into t3 values(utc_date()+0,utc_date());
insert into t3(name) values(utc_date()+0);
ERROR HY000: Field 'id' doesn't have a default value
update t3 set id=null;
ERROR 23000: Column 'id' cannot be null
obmysql-utc_date-4-5
CREATE INDEX indexName ON t1 (id);
insert into t1 values(utc_date()+5,utc_date());
update t1 set id=utc_date()+6  where id=utc_date()+5;
select * from t1 where id =utc_date();
id	name
20200913	2020-09-13
obmysql-utc_date-4-3 PL块
drop table t2;
drop table t1;
create table t1(v_id int,v_name varchar(30));
DROP PROCEDURE pro_test01;
CREATE PROCEDURE pro_test01(in a int)
begin
declare i int;
declare b int;
set i=utc_date()-20200912;
while i <=utc_date()-20200903  DO
if a =utc_date()-20200912 then
select utc_date();
select utc_date()+1;
end if;
insert into t1 values(a ,'xiaoli');
set i = i + a;
end WHILE;
select a into b;
select a;
select b;
update t1 set v_id=utc_date();
update t1 set v_id=utc_date()+10;
end;
//
CALL pro_test01(utc_date()-20200912);
utc_date()
utc_date()+1
utc_date()
utc_date()+1
utc_date()
utc_date()+1
utc_date()
utc_date()+1
utc_date()
utc_date()+1
utc_date()
utc_date()+1
utc_date()
utc_date()+1
utc_date()
utc_date()+1
utc_date()
utc_date()+1
utc_date()
utc_date()+1
a
b
2020-09-13
20200914
2020-09-13
20200914
2020-09-13
20200914
2020-09-13
20200914
2020-09-13
20200914
2020-09-13
20200914
2020-09-13
20200914
2020-09-13
20200914
2020-09-13
20200914
2020-09-13
20200914
1
1
CALL pro_test01(utc_date());
a
b
20200913
20200913
drop table t1;
create table t1(v_id int,v_name varchar(30));
DROP PROCEDURE pro_test01_1;
CREATE PROCEDURE pro_test01_1(in a varchar(20))
begin
declare i int;
declare b int;
set i=utc_date()-20200912;
while i <=utc_date()-20200903  DO
if utc_date()>a then
select utc_date();
select utc_date()+1;
end if;
insert into t1 values(utc_date() ,a);
set i = i + 1;
end WHILE;
select a into b;
select a;
select b;
update t1 set v_id=a;
update t1 set v_id=a+10;
end;
//
CALL pro_test01_1(utc_date()-20200912);
utc_date()
utc_date()+1
utc_date()
utc_date()+1
utc_date()
utc_date()+1
utc_date()
utc_date()+1
utc_date()
utc_date()+1
utc_date()
utc_date()+1
utc_date()
utc_date()+1
utc_date()
utc_date()+1
utc_date()
utc_date()+1
utc_date()
utc_date()+1
a
b
2020-09-13
20200914
2020-09-13
20200914
2020-09-13
20200914
2020-09-13
20200914
2020-09-13
20200914
2020-09-13
20200914
2020-09-13
20200914
2020-09-13
20200914
2020-09-13
20200914
2020-09-13
20200914
1
1
CALL pro_test01_1(utc_date());
ERROR 01000: Data truncated for argument
DROP PROCEDURE pro_test02;
CREATE  PROCEDURE pro_test02( out b int)
begin
select utc_date() into b;
select utc_date(),utc_date()+1;
end;
//
CALL pro_test02(@bb);
utc_date()	utc_date()+1
2020-09-13	20200914
select @bb;
@bb
20200913
DROP PROCEDURE pro_test03;
CREATE  PROCEDURE pro_test03( out c varchar(30))
begin
select utc_date()+1 into c;
end;
//
CALL pro_test03(@cc);
select @cc;
@cc
20200914
DROP PROCEDURE pro_test01;
drop table t1;
create table t1(v_id int,v_name varchar(30),v_d date);
CREATE PROCEDURE pro_test01(in a int)
begin
declare i int;
declare b int;
set i=a-19800320;
select a into b;
repeat
if a = utc_date()+0 then
insert into t1 values(a,a,a),(b,b,b);
elseif a> utc_date()-0  then 
insert into t1(t) values(a);
else 
insert into t1(v_id,v_name) values(a,b);
end if;
set i = i + 1;
until   i <=utc_date()-19800316
end repeat;
end;
//
CALL pro_test01(19800321);
select * from t1;
v_id	v_name	v_d
19800321	19800321	NULL
drop table t1;
create table t1(v_id int,v_name varchar(30));
drop function  fn_test1;
create function fn_test1(aa  int ) returns int
begin
declare bb int ;
declare cc int;
declare dd int;
set @i=1;
if aa=utc_date() then
select aa into cc;
return(cc);
elseif aa>utc_date()+2 then
select aa into dd;
return(dd);
else
while @i <= utc_date()-20200908 DO
insert into t1 values(aa,aa);
update t1 set v_id=aa;
set @i=@i+(utc_date()-20200912);
end while;
select aa into bb;
return(bb);
end if;
end;
//
select fn_test1(utc_date());
fn_test1(utc_date())
20200913
select fn_test1(utc_date()+6);
fn_test1(utc_date()+6)
20200919
select fn_test1(utc_date()-2);
fn_test1(utc_date()-2)
20200911
drop function  fn_test1;
########清空回收站，删除测试数据库，表等 ##########
drop database  IF EXISTS  oblrp;
purge recyclebin;
