#Environmental cleaning
DROP USER wmj456@'%';
DROP USER TEST_A1@'%';
DROP USER TEST_A2@'%';
DROP DATABASE obwmjtest;
CREATE DATABASE obwmjtest;
CREATE USER wmj456 IDENTIFIED BY 'wmj456';
GRANT ALL ON *.* TO wmj456 WITH GRANT OPTION;
DROP TABLE t1;
DROP TABLE t2;
DROP TABLE t3;
DROP FUNCTION f_test;
DROP PROCEDURE p_test;
DROP TRIGGER demo;
CREATE TABLE t1 (
id int NOT NULL,
consumer char(20) DEFAULT NULL,
price varchar(20) DEFAULT NULL,
sal int DEFAULT NULL,
datetime1 DATE,
`datetime2` bigint
);
INSERT INTO t1 VALUES(1,'书局','7000',5000,'2020-09-22',20200923121200);
INSERT INTO t1 VALUES(2,'微山','3000',-4000,'2020-09-21',20200921101159);
INSERT INTO t1 VALUES(3,'深咖','5000',0,'2020-08-21',20190821101159);
INSERT INTO t1 VALUES(4,'流苏','0',NULL,'2020-02-29',20200228101159);
INSERT INTO t1 VALUES(5,'玻璃','3200',6000,'2020-02-29',20200228101159);
INSERT INTO t1 VALUES(6,'\n',NULL,8000,'2020-02-29',20200228101159);
INSERT INTO t1 VALUES(7,'\t','VIVO',3500,'2020-02-29',20200228101159);
CREATE TABLE t2(c3 timestamp);
INSERT INTO t2 VALUES('2020-01-13 21:29:31');
CREATE TABLE t3(d1 varchar(20));
CREATE DEFINER = 'wmj456'@'%' PROCEDURE p_test()
begin
declare a varchar(200);
declare i int default 1;
SELECT ID FROM t1  WHERE consumer='书局' INTO a;
WHILE i <= 1 do
INSERT INTO t1 VALUES(0,a,concat('无参存储过程a参数第',i,'次'),7000,'2020-08-21 10:11:59',20190821101159);
set i := i + 1;
END while;
END;
//
SELECT COUNT(*) FROM t1;
COUNT(*)
7
CALL p_test();
SELECT COUNT(*) FROM t1;
COUNT(*)
8
DELETE FROM t1 WHERE price LIKE '%存储%';
DROP PROCEDURE p_test;
CREATE USER TEST_A1 IDENTIFIED BY 'testa1';
GRANT ALL ON *.* TO TEST_A1 WITH GRANT OPTION;
CREATE DEFINER = 'TEST_A1'@'%' PROCEDURE p_test()
begin
declare a varchar(200);
declare i int default 1;
SELECT ID FROM t1  WHERE consumer='书局' INTO a;
WHILE i <= 1 do
INSERT INTO t1 VALUES(0,a,concat('无参存储过程a参数第',i,'次'),7000,'2020-08-21 10:11:59',20190821101159);
set i := i + 1;
END while;
END;
//
SELECT COUNT(*) FROM t1;
COUNT(*)
7
CALL p_test();
SELECT COUNT(*) FROM t1;
COUNT(*)
8
DELETE FROM t1 WHERE price LIKE '%存储%';
DROP USER TEST_A1;
Warnings:
Warning	4005	User 'TEST_A1'@'%' is referenced as a definer account in a stored routine.
DROP PROCEDURE p_test;
CREATE DEFINER = 'TEST_A1'@'%' PROCEDURE p_test()
begin
declare a varchar(200);
declare i int default 1;
SELECT ID FROM t1  WHERE consumer='书局' INTO a;
WHILE i <= 1 do
INSERT INTO t1 VALUES(0,a,concat('无参存储过程a参数第',i,'次'),7000,'2020-08-21 10:11:59',20190821101159);
set i := i + 1;
END while;
END;
//
SELECT COUNT(*) FROM t1;
COUNT(*)
7
CALL p_test();
SELECT COUNT(*) FROM t1;
COUNT(*)
7
DROP PROCEDURE p_test;
CREATE DEFINER = current_user PROCEDURE p_test()
begin
declare a varchar(200);
declare i int default 1;
SELECT ID FROM t1  WHERE consumer='书局' INTO a;
WHILE i <= 1 do
INSERT INTO t1 VALUES(0,a,concat('无参存储过程a参数第',i,'次'),7000,'2020-08-21 10:11:59',20190821101159);
set i := i + 1;
END while;
END;
//
SELECT COUNT(*) FROM t1;
COUNT(*)
7
CALL p_test();
SELECT COUNT(*) FROM t1;
COUNT(*)
8
DELETE FROM t1 WHERE price LIKE '%存储%';
DROP PROCEDURE p_test;
CREATE USER TEST_A1@localhost IDENTIFIED BY 'testa1';
GRANT ALL ON *.* TO TEST_A1@localhost WITH GRANT OPTION;
CREATE DEFINER = TEST_A1@localhost PROCEDURE p_test()
begin
declare a varchar(200);
declare i int default 1;
SELECT ID FROM t1  WHERE consumer='书局' INTO a;
WHILE i <= 1 do
INSERT INTO t1 VALUES(0,a,concat('无参存储过程a参数第',i,'次'),7000,'2020-08-21 10:11:59',20190821101159);
set i := i + 1;
END while;
END;
//
SELECT COUNT(*) FROM t1;
COUNT(*)
7
CALL p_test();
SELECT COUNT(*) FROM t1;
COUNT(*)
8
DELETE FROM t1 WHERE price LIKE '%存储%';
DROP PROCEDURE p_test;
DROP USER TEST_A1@localhost;
CREATE USER ' '@'%' IDENTIFIED BY 'testa1';
GRANT ALL ON *.* TO ' '@'%' WITH GRANT OPTION;
CREATE DEFINER = ' '@'%' PROCEDURE p_test()
begin
declare a varchar(200);
declare i int default 1;
SELECT ID FROM t1  WHERE consumer='书局' INTO a;
WHILE i <= 1 do
INSERT INTO t1 VALUES(0,a,concat('无参存储过程a参数第',i,'次'),7000,'2020-08-21 10:11:59',20190821101159);
set i := i + 1;
END while;
END;
//
SELECT COUNT(*) FROM t1;
COUNT(*)
7
CALL p_test();
SELECT COUNT(*) FROM t1;
COUNT(*)
8
DELETE FROM t1 WHERE price LIKE '%存储%';
DROP PROCEDURE p_test;
DROP USER ' '@'%';
CREATE USER TEST_A1 IDENTIFIED BY 'testa1';
GRANT ALL ON *.* TO TEST_A1 WITH GRANT OPTION;
CREATE DEFINER = 'TEST_A1'@'%' PROCEDURE p_test() SQL SECURITY DEFINER
begin
declare a varchar(200);
declare i int default 1;
SELECT ID FROM t1  WHERE consumer='书局' INTO a;
WHILE i <= 1 do
INSERT INTO t1 VALUES(0,a,concat('无参存储过程a参数第',i,'次'),7000,'2020-08-21 10:11:59',20190821101159);
set i := i + 1;
END while;
END;
//
SELECT COUNT(*) FROM t1;
COUNT(*)
7
CALL p_test();
SELECT COUNT(*) FROM t1;
COUNT(*)
8
DELETE FROM t1 WHERE price LIKE '%存储%';
DROP USER TEST_A1;
Warnings:
Warning	4005	User 'TEST_A1'@'%' is referenced as a definer account in a stored routine.
DROP PROCEDURE p_test;
CREATE DEFINER = 'TEST_A1'@'%' PROCEDURE p_test() SQL SECURITY INVOKER
begin
declare a varchar(200);
declare i int default 1;
SELECT ID FROM t1  WHERE consumer='书局' INTO a;
WHILE i <= 1 do
INSERT INTO t1 VALUES(0,a,concat('无参存储过程a参数第',i,'次'),7000,'2020-08-21 10:11:59',20190821101159);
set i := i + 1;
END while;
END;
//
SELECT COUNT(*) FROM t1;
COUNT(*)
7
CALL p_test();
SELECT COUNT(*) FROM t1;
COUNT(*)
8
DELETE FROM t1 WHERE price LIKE '%存储%';
DROP PROCEDURE p_test;
CREATE USER 'TEST_A1'@'%' IDENTIFIED BY 'testa1';
GRANT ALL ON *.* TO 'TEST_A1'@'%' WITH GRANT OPTION;
REVOKE SELECT ON *.* FROM wmj456@'%';
REVOKE Delete ON *.* FROM wmj456@'%';
REVOKE INSERT ON *.* FROM wmj456@'%';
REVOKE UPDATE ON *.* FROM wmj456@'%';
CREATE DEFINER = 'TEST_A1'@'%' PROCEDURE p_test() SQL SECURITY INVOKER
begin
declare a varchar(200);
declare i int default 1;
SELECT ID FROM t1  WHERE consumer='书局' INTO a;
END;
//
CALL p_test();
DROP PROCEDURE p_test;
GRANT SELECT ON *.* TO wmj456 WITH GRANT OPTION;
CREATE DEFINER = 'TEST_A1'@'%' PROCEDURE p_test() SQL SECURITY INVOKER
begin
declare a varchar(200) default '饿了么';
UPDATE t1 SET consumer = a WHERE consumer='玻璃';
END;
//
SELECT COUNT(*) FROM t1;
COUNT(*)
7
CALL p_test();
SELECT COUNT(*) FROM t1;
COUNT(*)
7
DROP PROCEDURE p_test;
CREATE DEFINER = 'TEST_A1'@'%' PROCEDURE p_test() SQL SECURITY INVOKER
begin
declare a varchar(200) default '饿了么';
delete from t1 WHERE consumer = a;
END;
//
SELECT COUNT(*) FROM t1;
COUNT(*)
7
CALL p_test();
SELECT COUNT(*) FROM t1;
COUNT(*)
6
DROP PROCEDURE p_test;
CREATE DEFINER = 'TEST_A1'@'%' PROCEDURE p_test() SQL SECURITY INVOKER
begin
declare a varchar(200) default '饿了么';
UPDATE t1 SET consumer = a WHERE consumer='玻璃';
END;
//
SELECT COUNT(*) FROM t1;
COUNT(*)
6
CALL p_test();
SELECT COUNT(*) FROM t1;
COUNT(*)
6
DROP PROCEDURE p_test;
CREATE VIEW t1_view AS SELECT * FROM t1 ;
CREATE DEFINER = 'TEST_A1'@'%' FUNCTION f_test()
returns varchar(200) SQL SECURITY INVOKER
BEGIN
declare a varchar(200) default '饿了么';
delete from t1_view WHERE consumer = a;
return a;
END;
//
SELECT f_test();
f_test()
饿了么
DROP FUNCTION f_test;
DROP USER TEST_A1@'%';
DROP VIEW t1_view;
GRANT ALL ON *.* TO wmj456 WITH GRANT OPTION;
CREATE DEFINER = 'TEST_A1'@'%' PROCEDURE p_test() SQL SECURITY INVOKER
BEGIN
declare a varchar(200) default '饿了么';
UPDATE t1 SET consumer = a WHERE consumer='玻璃';
END;
//
ALTER PROCEDURE p_test SQL SECURITY DEFINER;
CALL p_test();
ERROR HY000: User not exist
SELECT COUNT(*) FROM t1;
COUNT(*)
6
DROP PROCEDURE p_test;
CREATE USER 'TEST_A1'@'%' IDENTIFIED BY 'testa1';
GRANT ALL ON *.* TO 'TEST_A1'@'%' WITH GRANT OPTION;
CREATE DEFINER = 'TEST_A1'@'%' PROCEDURE p_test() SQL SECURITY INVOKER
BEGIN
declare a varchar(200) default '饿了么';
UPDATE t1 SET consumer = a WHERE consumer='玻璃';
END;
//
DROP USER TEST_A1@'%';
Warnings:
Warning	4005	User 'TEST_A1'@'%' is referenced as a definer account in a stored routine.
ALTER PROCEDURE p_test SQL SECURITY DEFINER;
CALL p_test();
ERROR HY000: User not exist
SELECT COUNT(*) FROM t1;
COUNT(*)
6
DROP PROCEDURE p_test;
CREATE USER 'TEST_A1'@'%' IDENTIFIED BY 'testa1';
GRANT ALL ON *.* TO 'TEST_A1'@'%' WITH GRANT OPTION;
REVOKE SELECT ON *.* FROM 'TEST_A1'@'%';
GRANT SELECT ON obwmjtest.t1 TO 'TEST_A1'@'%' WITH GRANT OPTION;
CREATE DEFINER = 'TEST_A1'@'%' PROCEDURE p_test() SQL SECURITY DEFINER
BEGIN
declare a varchar(200) default '饿了么';
SELECT c3 FROM t2 INTO a;
END;
//
CALL p_test();
DROP PROCEDURE p_test;
DROP USER TEST_A1@'%';
CREATE USER 'TEST_A1'@'%' IDENTIFIED BY 'testa1';
GRANT ALL ON *.* TO 'TEST_A1'@'%' WITH GRANT OPTION;
CREATE DEFINER = 'TEST_A1'@'%' PROCEDURE p_test(in samplename  varchar(200)) SQL SECURITY DEFINER
BEGIN
declare a varchar(200);
SELECT sign(sal) FROM t1 e WHERE sign(e.sal) = samplename into a;
INSERT INTO t1 VALUES(0, a, concat('in存储过程a参数第', 1, '次'),7000,'2020-08-21 10:11:59',20190821101159);
END;
//
CALL p_test(500);
DROP PROCEDURE p_test;
SELECT COUNT(*) FROM t1;
COUNT(*)
7
delete from t1 where price like '%存储%';
DROP USER TEST_A1@'%';
CREATE USER 'TEST_A1'@'%' IDENTIFIED BY 'testa1';
GRANT ALL ON *.* TO 'TEST_A1'@'%' WITH GRANT OPTION;
CREATE DEFINER = 'TEST_A1'@'%' PROCEDURE p_test(out wb  varchar(200)) SQL SECURITY DEFINER
BEGIN
declare a varchar(200);
SELECT sign(sal) FROM t1 e WHERE sign(e.sal) = 0 into wb;
END;
//
CALL p_test(@wb);
DROP PROCEDURE p_test;
SELECT COUNT(*) FROM t1;
COUNT(*)
6
DROP USER TEST_A1@'%';
CREATE USER 'TEST_A1'@'%' IDENTIFIED BY 'testa1';
GRANT ALL ON *.* TO 'TEST_A1'@'%' WITH GRANT OPTION;
CREATE DEFINER = 'TEST_A1'@'%' PROCEDURE p_test( out wb varchar(200), inout wb1 varchar(200))
begin
SELECT sign(sal) FROM t1 e WHERE sign(e.sal) = 0 into wb;
SELECT sign(sal) FROM t1 e WHERE sign(e.sal) = -1 into wb1;
END;
//
call p_test(@wb,@wb1);
SELECT COUNT(*) FROM t1;
COUNT(*)
6
DROP USER TEST_A1@'%';
Warnings:
Warning	4005	User 'TEST_A1'@'%' is referenced as a definer account in a stored routine.
DROP PROCEDURE p_test;
CREATE DEFINER = 'TEST_A1'@'192.168.0.1' PROCEDURE p_test( out wb varchar(200), inout wb1 varchar(200)) SQL SECURITY DEFINER
begin
SELECT sign(sal) FROM t1 e WHERE sign(e.sal) = 0 into wb;
SELECT sign(sal) FROM t1 e WHERE sign(e.sal) = -1 into wb1;
END;
//
ALTER PROCEDURE p_test SQL SECURITY INVOKER;
call p_test(@wb,@wb1);
SELECT COUNT(*) FROM t1;
COUNT(*)
6
DROP PROCEDURE p_test;
CREATE USER 'TEST_A1'@'%' IDENTIFIED BY 'testa1';
GRANT ALL ON *.* TO 'TEST_A1'@'%' WITH GRANT OPTION;
CREATE DEFINER = 'TEST_A1'@'%' PROCEDURE p_test( out wb varchar(200), inout wb1 varchar(200)) SQL SECURITY DEFINER
begin
SELECT sign(sal) FROM t1 e WHERE sign(e.sal) = 0 into wb;
SELECT sign(sal) FROM t1 e WHERE sign(e.sal) = -1 into wb1;
END;
//
DROP USER TEST_A1@'%';
Warnings:
Warning	4005	User 'TEST_A1'@'%' is referenced as a definer account in a stored routine.
call p_test(@wb,@wb1);
DROP PROCEDURE p_test;
# Clean up users
DROP DATABASE obwmjtest;
DROP USER wmj456@'%' ;
DROP USER TEST_A1@'%';
DROP USER TEST_A2@'%';
