#Environmental cleaning
DROP USER wmj456@'%';
DROP USER TEST_A1@'%';
DROP USER TEST_A2@'%';
DROP DATABASE obwmjtest;
CREATE DATABASE obwmjtest;
CREATE USER wmj456 IDENTIFIED BY 'wmj456';
GRANT ALL ON *.* TO wmj456 WITH GRANT OPTION;
DROP TABLE t1;
DROP TABLE t2;
DROP TABLE t3;
DROP FUNCTION f_test;
DROP TRIGGER demo;
CREATE TABLE t1 (
id int NOT NULL,
consumer char(20) DEFAULT NULL,
price varchar(20) DEFAULT NULL,
sal int DEFAULT NULL,
datetime1 DATE,
`datetime2` bigint
);
INSERT INTO t1 VALUES(1,'书局','7000',5000,'2020-09-22',20200923121200);
INSERT INTO t1 VALUES(2,'微山','3000',-4000,'2020-09-21',20200921101159);
INSERT INTO t1 VALUES(3,'深咖','5000',0,'2020-08-21',20190821101159);
INSERT INTO t1 VALUES(4,'流苏','0',NULL,'2020-02-29',20200228101159);
INSERT INTO t1 VALUES(5,'玻璃','3200',6000,'2020-02-29',20200228101159);
INSERT INTO t1 VALUES(6,'\n',NULL,8000,'2020-02-29',20200228101159);
INSERT INTO t1 VALUES(7,'\t','VIVO',3500,'2020-02-29',20200228101159);
CREATE TABLE t2(c3 timestamp);
INSERT INTO t2 VALUES('2020-01-13 21:29:31');
CREATE TABLE t3(d1 varchar(20));
CREATE TRIGGER demo BEFORE INSERT ON t2 FOR EACH ROW
BEGIN
SET NEW.C3='2022-01-13 21:29:31';
END;
//
TRUNCATE TABLE t2;
SELECT COUNT(*) FROM t2;
COUNT(*)
0
INSERT INTO t2 VALUES ('1990-03-23 21:29:31');
SELECT COUNT(*) FROM t2;
COUNT(*)
1
DROP TRIGGER demo;
CREATE DEFINER = 'wmj456'@'%' TRIGGER demo BEFORE INSERT ON t2 FOR EACH ROW
BEGIN
SET NEW.C3='2022-01-13 21:29:31';
END;
//
TRUNCATE TABLE t2;
SELECT COUNT(*) FROM t2;
COUNT(*)
0
INSERT INTO t2 VALUES ('1990-03-23 21:29:31');
SELECT * FROM t2;
c3
2022-01-13 21:29:31
DROP TRIGGER demo;
CREATE DEFINER = 'TEST_A1'@'%' TRIGGER demo BEFORE INSERT ON t2 FOR EACH ROW
BEGIN
SET NEW.C3='2022-01-13 21:29:31';
END;
//
TRUNCATE TABLE t2;
SELECT COUNT(*) FROM t2;
COUNT(*)
0
INSERT INTO t2 VALUES ('1990-03-23 21:29:31');
SELECT * FROM t2;
c3
DROP TRIGGER demo;
CREATE USER TEST_A1 IDENTIFIED BY 'testa1';
GRANT ALL ON *.* TO TEST_A1 WITH GRANT OPTION;
CREATE DEFINER = 'TEST_A1'@'%' TRIGGER demo BEFORE INSERT ON t2 FOR EACH ROW
BEGIN
SET NEW.C3='2022-01-13 21:29:31';
END;
//
TRUNCATE TABLE t2;
SELECT COUNT(*) FROM t2;
COUNT(*)
0
INSERT INTO t2 VALUES ('1990-03-23 21:29:31');
SELECT * FROM t2;
c3
2022-01-13 21:29:31
DROP TRIGGER demo;
DROP USER TEST_A1;
CREATE USER ' ' IDENTIFIED BY 'testa1';
GRANT ALL ON *.* TO ' '@'%' WITH GRANT OPTION;
CREATE DEFINER = ' '@'%' TRIGGER demo BEFORE INSERT ON t2 FOR EACH ROW
BEGIN
SET NEW.C3='2022-01-13 21:29:31';
END;
//
TRUNCATE TABLE t2;
INSERT INTO t2 VALUES ('1990-03-23 21:29:31');
SELECT * FROM t2;
c3
2022-01-13 21:29:31
DROP TRIGGER demo;
DROP USER ' ';
CREATE USER ' ' IDENTIFIED BY 'testa1';
CREATE DEFINER = ' '@'%' TRIGGER demo BEFORE INSERT ON t2 FOR EACH ROW
BEGIN
SET NEW.C3='2022-01-13 21:29:31';
END;
//
TRUNCATE TABLE t2;
INSERT INTO t2 VALUES ('1990-03-23 21:29:31');
ERROR 42000: TRIGGER command denied to user ' '@'%' for table 't2'
SELECT * FROM t2;
c3
DROP TRIGGER demo;
DROP USER ' ';
CREATE DEFINER = current_user TRIGGER demo BEFORE INSERT ON t2 FOR EACH ROW
BEGIN
SET NEW.C3='2022-01-13 21:29:31';
END;
//
TRUNCATE TABLE t2;
INSERT INTO t2 VALUES ('1990-03-23 21:29:31');
SELECT * FROM t2;
c3
2022-01-13 21:29:31
DROP TRIGGER demo;
CREATE USER 'TEST_A1'@'192.222.11.11' IDENTIFIED BY 'testa1';
GRANT ALL ON *.* TO 'TEST_A1'@'192.222.11.11' WITH GRANT OPTION;
CREATE DEFINER = 'TEST_A1'@'192.222.11.11' TRIGGER demo BEFORE INSERT ON t2 FOR EACH ROW
BEGIN
SET NEW.C3='2022-01-13 21:29:31';
END;
//
TRUNCATE TABLE t2;
INSERT INTO t2 VALUES ('1990-03-23 21:29:31');
SELECT * FROM t2;
c3
2022-01-13 21:29:31
DROP TRIGGER demo;
DROP USER 'TEST_A1'@'192.222.11.11';
CREATE DEFINER = 'wmj456'@'%' TRIGGER demo BEFORE UPDATE ON t2 FOR EACH ROW
BEGIN
SET NEW.C3='2022-01-13 21:29:31';
END;
//
TRUNCATE TABLE t2;
INSERT INTO t2 VALUES ('1990-03-23 21:29:31');
INSERT INTO t2 VALUES ('1991-03-23 21:29:31');
UPDATE t2 SET C3='2000-03-23 21:29:31' WHERE C3='1991-03-23 21:29:31';
SELECT * FROM t2;
c3
1990-03-23 21:29:31
2022-01-13 21:29:31
DROP TRIGGER demo;
CREATE USER TEST_A1 IDENTIFIED BY 'testa1';
GRANT ALL ON *.* TO TEST_A1 WITH GRANT OPTION;
CREATE DEFINER = 'TEST_A1'@'%' TRIGGER demo BEFORE UPDATE ON t2 FOR EACH ROW
BEGIN
SET NEW.C3='2022-01-13 21:29:31';
END;
//
TRUNCATE TABLE t2;
INSERT INTO t2 VALUES ('1990-03-23 21:29:31');
INSERT INTO t2 VALUES ('1991-03-23 21:29:31');
UPDATE t2 SET C3='2000-03-23 21:29:31' WHERE C3='1991-03-23 21:29:31';
SELECT * FROM t2;
c3
1990-03-23 21:29:31
2022-01-13 21:29:31
DROP TRIGGER demo;
DROP USER TEST_A1;
CREATE DEFINER = 'wmj456'@'%' TRIGGER demo before delete ON t2 FOR EACH ROW
BEGIN
INSERT INTO t3 VALUES(old.c3);
END;
//
TRUNCATE TABLE t2;
INSERT INTO t2 VALUES ('1990-03-23 21:29:31');
INSERT INTO t2 VALUES ('1991-03-23 21:29:31');
DELETE FROM t2 WHERE C3='1991-03-23 21:29:31';
SELECT * FROM t2;
c3
1990-03-23 21:29:31
SELECT * FROM t3;
d1
1991-03-23 21:29:31
TRUNCATE TABLE t3;
DROP TRIGGER demo;
CREATE DEFINER = 'wmj456'@'%' TRIGGER demo BEFORE INSERT ON t2 FOR EACH ROW
BEGIN
SET NEW.C3='2022-01-13 21:29:31';
END;
//
TRUNCATE TABLE t2;
SELECT COUNT(*) FROM t2;
COUNT(*)
0
INSERT INTO t2 VALUES ('1990-03-23 21:29:31');
SELECT * FROM t2;
c3
2022-01-13 21:29:31
DROP TRIGGER demo;
CREATE DEFINER = 'wmj456'@'%' TRIGGER demo BEFORE INSERT ON t2 FOR EACH ROW
BEGIN
SET NEW.C3='2022-01-13 21:29:31';
END;
//
CREATE DEFINER = 'TEST_A1'@'%' TRIGGER demo2 BEFORE INSERT ON t2 FOR EACH ROW FOLLOWS demo
BEGIN
SET NEW.C3='2024-01-13 21:29:31';
END;
//
Warnings:
Warning	1449	User TEST_A1 not exist
DROP TRIGGER demo;
DROP TRIGGER demo2;
CREATE DEFINER = 'wmj456'@'%' TRIGGER demo BEFORE INSERT ON t2 FOR EACH ROW
BEGIN
SET NEW.C3='2022-01-13 21:29:31';
END;
//
CREATE DEFINER = 'TEST_A1'@'%' TRIGGER demo2 BEFORE INSERT ON t2 FOR EACH ROW PRECEDES demo
BEGIN
SET NEW.C3='2024-01-13 21:29:31';
END;
//
Warnings:
Warning	1449	User TEST_A1 not exist
DROP TRIGGER demo;
DROP TRIGGER demo2;
LOCK TABLES t2 WRITE ;
CREATE DEFINER = 'wmj456'@'%' TRIGGER demo2 BEFORE INSERT ON t2 FOR EACH ROW
BEGIN
SET NEW.C3='2024-01-13 21:29:31';
END;
//
UNLOCK TABLES;
DROP TRIGGER demo2;
CREATE USER TEST_A1@'%' IDENTIFIED BY 'testa1';
GRANT ALL ON *.* TO TEST_A1@'%' WITH GRANT OPTION;
REVOKE INSERT ON *.* FROM TEST_A1@'%';
CREATE DEFINER = TEST_A1@'%' TRIGGER demo BEFORE INSERT ON t2 FOR EACH ROW
BEGIN
INSERT INTO t3 VALUES(new.c3);
END;
//
TRUNCATE TABLE t2;
INSERT INTO t2 VALUES ('1990-03-23 21:29:31');
SELECT * FROM t3;
d1
1990-03-23 21:29:31
DROP TRIGGER demo;
DROP USER TEST_A1@'%';
CREATE USER TEST_A1@'%' IDENTIFIED BY 'testa1';
GRANT ALL ON *.* TO TEST_A1@'%' WITH GRANT OPTION;
REVOKE UPDATE ON *.* FROM TEST_A1@'%';
CREATE DEFINER = TEST_A1@'%' TRIGGER demo BEFORE INSERT ON t2 FOR EACH ROW
BEGIN
INSERT INTO t3 VALUES('1991-03-23 21:29:31');
update t3 set d1='2000-03-23 21:29:31';
END;
//
TRUNCATE TABLE t2;
INSERT INTO t2 VALUES ('1990-03-23 21:29:31');
SELECT * FROM t3;
d1
2000-03-23 21:29:31
2000-03-23 21:29:31
DROP TRIGGER demo;
DROP USER TEST_A1@'%';
CREATE USER TEST_A1@'%' IDENTIFIED BY 'testa1';
GRANT ALL ON *.* TO TEST_A1@'%' WITH GRANT OPTION;
REVOKE delete ON *.* FROM TEST_A1@'%';
CREATE DEFINER = TEST_A1@'%' TRIGGER demo BEFORE INSERT ON t2 FOR EACH ROW
BEGIN
INSERT INTO t3 VALUES('1991-03-23 21:29:31');
delete from t3 where d1='1991-03-23 21:29:31';
END;
//
TRUNCATE TABLE t2;
INSERT INTO t2 VALUES ('1991-03-23 21:29:31');
SELECT * FROM t3;
d1
2000-03-23 21:29:31
2000-03-23 21:29:31
DROP TRIGGER demo;
DROP USER TEST_A1@'%';
# Clean up users
DROP DATABASE obwmjtest;
DROP USER wmj456@'%' ;
DROP USER TEST_A1@'%';
DROP USER TEST_A2@'%';
