#Environmental cleaning
DROP USER wmj456@'%';
DROP USER TEST_A1@'%';
DROP USER ' '@'%';
DROP USER TEST_A2@'%';
DROP DATABASE obwmjtest;
CREATE DATABASE obwmjtest;
CREATE USER wmj456 IDENTIFIED BY 'wmj456';
GRANT ALL ON *.* TO wmj456 WITH GRANT OPTION;
DROP TABLE t1;
DROP TABLE t2;
DROP FUNCTION f_test;
CREATE TABLE t1 (
id int NOT NULL,
consumer char(20) DEFAULT NULL,
price varchar(20) DEFAULT NULL,
sal int DEFAULT NULL,
datetime1 DATE,
`datetime2` bigint
);
INSERT INTO t1 VALUES(1,'书局','7000',5000,'2020-09-22',20200923121200);
INSERT INTO t1 VALUES(2,'微山','3000',-4000,'2020-09-21',20200921101159);
INSERT INTO t1 VALUES(3,'深咖','5000',0,'2020-08-21',20190821101159);
INSERT INTO t1 VALUES(4,'流苏','0',NULL,'2020-02-29',20200228101159);
INSERT INTO t1 VALUES(5,'玻璃','3200',6000,'2020-02-29',20200228101159);
INSERT INTO t1 VALUES(6,'\n',NULL,8000,'2020-02-29',20200228101159);
INSERT INTO t1 VALUES(7,'\t','VIVO',3500,'2020-02-29',20200228101159);
CREATE USER TEST_A1 IDENTIFIED BY 'testa1';
GRANT ALL ON *.* TO TEST_A1 WITH GRANT OPTION;
CREATE DEFINER = 'TEST_A1'@'xxx' FUNCTION f_test()
returns varchar(200) SQL SECURITY DEFINER
BEGIN
declare a varchar(200);
SELECT CONCAT('111','222','333') FROM DUAL INTO a;
return a;
END;
//
SELECT f_test();
DROP FUNCTION f_test;
DROP USER TEST_A1;
CREATE DEFINER = 'wmj456'@' ' FUNCTION f_test()
returns varchar(200) SQL SECURITY DEFINER
BEGIN
declare a varchar(200);
SELECT CONCAT('111','222','333') FROM DUAL INTO a;
return a;
END;
//
CREATE USER TEST_A1@localhost IDENTIFIED BY 'testa1';
GRANT ALL ON *.* TO TEST_A1@'localhost' WITH GRANT OPTION;
CREATE DEFINER = 'TEST_A1'@'localhost' FUNCTION f_test()
returns varchar(200) SQL SECURITY DEFINER
BEGIN
declare a varchar(200);
SELECT CONCAT('111','222','333') FROM DUAL INTO a;
return a;
END;
//
SELECT f_test();
f_test()
111222333
DROP FUNCTION f_test;
DROP USER TEST_A1@localhost;
CREATE USER TEST_A1 IDENTIFIED BY 'testa1';
GRANT ALL ON *.* TO TEST_A1 WITH GRANT OPTION;
CREATE DEFINER = 'TEST_A1'@'%' FUNCTION f_test()
returns varchar(200) SQL SECURITY DEFINER
BEGIN
declare a varchar(200);
SELECT CONCAT('111','222','333') FROM DUAL INTO a;
return a;
END;
//
SELECT f_test();
f_test()
111222333
DROP FUNCTION f_test;
DROP USER TEST_A1;
CREATE USER TEST_A1 IDENTIFIED BY 'testa1';
GRANT ALL ON *.* TO TEST_A1 WITH GRANT OPTION;
CREATE DEFINER = 'TEST_A1'@'localhost' FUNCTION f_test()
returns varchar(200) SQL SECURITY DEFINER
BEGIN
declare a varchar(200);
SELECT CONCAT('111','222','333') FROM DUAL INTO a;
return a;
END;
//
Warnings:
Warning	1449	User TEST_A1 not exist
SELECT f_test();
DROP FUNCTION f_test;
DROP USER TEST_A1;
CREATE USER TEST_A1 IDENTIFIED BY 'testa1';
GRANT ALL ON *.* TO TEST_A1 WITH GRANT OPTION;
CREATE DEFINER = TEST_A1@'%' FUNCTION f_test()
returns varchar(200) SQL SECURITY DEFINER
BEGIN
declare a varchar(200);
SELECT CONCAT('111','222','333') FROM DUAL INTO a;
return a;
END;
//
SELECT f_test();
f_test()
111222333
DROP FUNCTION f_test;
DROP USER TEST_A1;
CREATE USER TEST_A1 IDENTIFIED BY 'testa1';
GRANT ALL ON *.* TO TEST_A1 WITH GRANT OPTION;
CREATE DEFINER = 'TEST_A1'@% FUNCTION f_test()
returns varchar(200) SQL SECURITY DEFINER
BEGIN
declare a varchar(200);
SELECT CONCAT('111','222','333') FROM DUAL INTO a;
return a;
END;
//
DROP FUNCTION f_test;
DROP USER TEST_A1;
CREATE USER TEST_A1 IDENTIFIED BY 'testa1';
GRANT ALL ON *.* TO TEST_A1 WITH GRANT OPTION;
CREATE DEFINER = TEST_A1@% FUNCTION f_test()
returns varchar(200) SQL SECURITY DEFINER
BEGIN
declare a varchar(200);
SELECT CONCAT('111','222','333') FROM DUAL INTO a;
return a;
END;
//
DROP FUNCTION f_test;
DROP USER TEST_A1;
CREATE DEFINER = "wmj456"@"%" FUNCTION f_test()
returns varchar(200) SQL SECURITY DEFINER
BEGIN
declare a varchar(200);
SELECT CONCAT('111','222','333') FROM DUAL INTO a;
return a;
END;
//
SELECT f_test();
f_test()
111222333
DROP FUNCTION f_test;
CREATE DEFINER = `wmj456`@`%` FUNCTION f_test()
returns varchar(200) SQL SECURITY DEFINER
BEGIN
declare a varchar(200);
SELECT CONCAT('111','222','333') FROM DUAL INTO a;
return a;
END;
//
SELECT f_test();
f_test()
111222333
DROP FUNCTION f_test;
CREATE USER ' '@'%' IDENTIFIED BY '123456';
GRANT ALL ON *.* TO ' ' WITH GRANT OPTION;
CREATE DEFINER = ' '@'%' FUNCTION f_test()
returns varchar(200) SQL SECURITY DEFINER
BEGIN
declare a varchar(200);
SELECT CONCAT('111','222','333') FROM DUAL INTO a;
return a;
END;
//
SELECT f_test();
f_test()
111222333
DROP FUNCTION f_test;
DROP USER ' '@'%';
CREATE USER ' '@'%' IDENTIFIED BY '123456';
GRANT ALL ON *.* TO ' ' WITH GRANT OPTION;
CREATE DEFINER = ` `@`%` FUNCTION f_test()
returns varchar(200) SQL SECURITY DEFINER
BEGIN
declare a varchar(200);
SELECT CONCAT('111','222','333') FROM DUAL INTO a;
return a;
END;
//
SELECT f_test();
f_test()
111222333
DROP FUNCTION f_test;
DROP USER ' '@'%';
CREATE USER ' '@'%' IDENTIFIED BY '123456';
GRANT ALL ON *.* TO ' ' WITH GRANT OPTION;
CREATE DEFINER = ' '@`%` FUNCTION f_test()
returns varchar(200) SQL SECURITY DEFINER
BEGIN
declare a varchar(200);
SELECT CONCAT('111','222','333') FROM DUAL INTO a;
return a;
END;
//
SELECT f_test();
f_test()
111222333
DROP FUNCTION f_test;
DROP USER ' '@'%';
CREATE DEFINER = 'TEST_A1'@'%' FUNCTION f_test()
returns varchar(200) SQL SECURITY INVOKER 
BEGIN
declare a varchar(200) default '饿了么';
UPDATE t1 SET consumer = a WHERE consumer='玻璃';
return a;
END;
//
SELECT f_test();
f_test()
饿了么
DROP FUNCTION f_test;
CREATE USER 'TEST_A1'@'%' IDENTIFIED BY 'testa1';
GRANT ALL ON *.* TO 'TEST_A1'@'%' WITH GRANT OPTION;
REVOKE delete ON *.* FROM wmj456@'%';
CREATE DEFINER = 'TEST_A1'@'%' FUNCTION f_test()
returns varchar(200) SQL SECURITY INVOKER 
BEGIN
declare a varchar(200) default '饿了么';
delete from t1 WHERE consumer = a;
return a;
END;
//
SELECT f_test();
f_test()
饿了么
DROP FUNCTION f_test;
DROP USER 'TEST_A1'@'%';
GRANT ALL ON *.* TO wmj456 WITH GRANT OPTION;
CREATE VIEW t1_view AS SELECT * FROM t1 ;
CREATE USER TEST_A1@'%' IDENTIFIED BY 'testa1';
GRANT ALL ON *.* TO TEST_A1@'%' WITH GRANT OPTION;
REVOKE delete ON *.* FROM wmj456@'%';
CREATE DEFINER = CURRENT_USER FUNCTION f_test()
returns varchar(200) SQL SECURITY INVOKER 
BEGIN
declare a varchar(200) default '饿了么';
delete from t1 WHERE consumer = a;
return a;
END;
//
SELECT f_test();
f_test()
饿了么
DROP FUNCTION f_test;
CREATE DEFINER = 'TEST_A1'@'%' FUNCTION f_test()
returns varchar(200) SQL SECURITY INVOKER
BEGIN
declare a varchar(200) default '饿了么';
delete from t1_view WHERE consumer = a;
return a;
END;
//
SELECT f_test();
f_test()
饿了么
DROP FUNCTION f_test;
DROP VIEW t1_view;
DROP USER TEST_A1@'%';
GRANT ALL ON *.* TO wmj456 WITH GRANT OPTION;
CREATE USER TEST_A1 IDENTIFIED BY 'testa1';
GRANT ALL ON *.* TO TEST_A1 WITH GRANT OPTION;
REVOKE INSERT ON *.* FROM wmj456;
CREATE DEFINER = 'TEST_A1'@'%' FUNCTION f_test()
returns varchar(200) SQL SECURITY INVOKER 
BEGIN
declare a varchar(200) default '饿了么';
INSERT INTO t1 VALUES(0,a,'while插入a数据',7000,'2020-12-31 10:11:59',20190821101159);
return a;
END;
//
SELECT f_test();
f_test()
饿了么
DROP FUNCTION f_test;
DROP USER 'TEST_A1'@'%';
GRANT ALL ON *.* TO wmj456 WITH GRANT OPTION;
CREATE USER 'TEST_A1'@'%' IDENTIFIED BY 'testa1';
GRANT ALL ON *.* TO 'TEST_A1'@'%' WITH GRANT OPTION;
REVOKE UPDATE ON *.* FROM wmj456@'%';
CREATE DEFINER = 'TEST_A1'@'%' FUNCTION f_test()
returns varchar(200) SQL SECURITY INVOKER 
BEGIN
declare a varchar(200) default '饿了么';
UPDATE t1 SET consumer = a WHERE consumer='玻璃';
return a;
END;
//
SELECT f_test();
f_test()
饿了么
DROP FUNCTION f_test;
DROP USER 'TEST_A1'@'%';
GRANT ALL ON *.* TO wmj456 WITH GRANT OPTION;
CREATE DEFINER = 'wmj456'@'%' FUNCTION f_test(samplename varchar(200))
returns varchar(200) SQL SECURITY DEFINER 
begin
declare a varchar(200);
SELECT sign(samplename) FROM t1 WHERE consumer='书局' INTO a;
return a;
END;
//
SELECT f_test(100);
f_test(100)
1
DROP FUNCTION f_test;
CREATE DEFINER = 'wmj456'@'%' FUNCTION f_test( samplename varchar(200), samplename1 varchar(200)) returns varchar(200) SQL SECURITY DEFINER 
begin
declare a varchar(200);
declare b varchar(200);
SELECT sign(samplename) FROM t1 WHERE consumer='书局' INTO a;
SELECT sign(samplename1) FROM t1 WHERE sign(t1.sal) = samplename1 into b;
return a+b;
END;
//
SELECT f_test(100,-1);
f_test(100,-1)
0
DROP FUNCTION f_test;
CREATE USER 'TEST_A1'@'%' IDENTIFIED BY 'testa1';
CREATE DEFINER = 'TEST_A1'@'%' FUNCTION f_test( samplename varchar(200), samplename1 varchar(200)) returns varchar(200) SQL SECURITY INVOKER 
begin
declare a varchar(200);
declare b varchar(200);
SELECT sign(samplename) FROM t1 WHERE consumer='书局' INTO a;
SELECT sign(samplename1) FROM t1 WHERE sign(t1.sal) = samplename1 into b;
return a+b;
END;
//
ALTER FUNCTION f_test SQL SECURITY DEFINER;
SELECT f_test(100,-1);
Got one of the listed errors
DROP FUNCTION f_test;
DROP USER 'TEST_A1'@'%';
CREATE USER 'TEST_A1'@'%' IDENTIFIED BY 'testa1';
GRANT ALL ON *.* TO 'TEST_A1'@'%' WITH GRANT OPTION;
CREATE DEFINER = 'TEST_A1'@'%' FUNCTION f_test( samplename varchar(200)) returns varchar(200) SQL SECURITY DEFINER 
begin
declare a varchar(200);
SELECT sign(samplename) FROM t1 WHERE consumer='书局' INTO a;
return a;
END;
//
DROP USER 'TEST_A1'@'%';
Warnings:
Warning	4005	User 'TEST_A1'@'%' is referenced as a definer account in a stored routine.
SELECT f_test(100);
DROP FUNCTION f_test;
# Clean up users
DROP DATABASE obwmjtest;
DROP USER wmj456@'%' ;
DROP USER TEST_A1@'%';
DROP USER TEST_A2@'%';
