#Environmental cleaning
DROP USER wmj456@'%';
DROP DATABASE obwmjtest;
CREATE DATABASE obwmjtest;
CREATE USER wmj456 IDENTIFIED BY 'wmj456';
GRANT ALL ON *.* TO wmj456 WITH GRANT OPTION;
DROP TABLE obwmj_t1;
DROP TABLE obwmj_t2;
DROP TABLE obwmj_t3;
DROP TABLE obwmj_t4;
DROP TABLE obwmj_t5;
DROP TEMPORARY TABLE obwmj_t6;
DROP TABLE obwmj_t7;
DROP TABLE obwmj_t8;
DROP VIEW obwmj_t5_view;
DROP TABLE obwmj_t55;
DROP VIEW obwmj_t55_view;
CREATE TABLE obwmj_t1 (id int NOT NULL, name varchar(20));
INSERT INTO obwmj_t1 VALUES (1,'t1a');
INSERT INTO obwmj_t1 VALUES (2,'t1b');
SELECT TABLE_CATALOG FROM INFORMATION_SCHEMA.TABLES WHERE TABLE_NAME='obwmj_t1';
TABLE_CATALOG
def
SELECT TABLE_SCHEMA FROM INFORMATION_SCHEMA.TABLES WHERE TABLE_NAME='obwmj_t1';
TABLE_SCHEMA
obwmjtest
SELECT TABLE_NAME FROM INFORMATION_SCHEMA.TABLES WHERE TABLE_SCHEMA='obwmjtest';
TABLE_NAME
obwmj_t1
SELECT TABLE_TYPE FROM INFORMATION_SCHEMA.TABLES WHERE TABLE_NAME='obwmj_t1';
TABLE_TYPE
BASE TABLE
SELECT TABLE_TYPE FROM INFORMATION_SCHEMA.TABLES WHERE TABLE_NAME='TABLES';
TABLE_TYPE
SYSTEM VIEW
SELECT ENGINE FROM INFORMATION_SCHEMA.TABLES WHERE TABLE_NAME='obwmj_t1';
ENGINE
InnoDB
SELECT TABLE_NAME, VERSION FROM INFORMATION_SCHEMA.TABLES WHERE TABLE_SCHEMA='obwmjtest';
TABLE_NAME	VERSION
obwmj_t1	NULL
SELECT TABLE_NAME, ROW_FORMAT FROM INFORMATION_SCHEMA.TABLES WHERE TABLE_SCHEMA='obwmjtest';
TABLE_NAME	ROW_FORMAT
obwmj_t1	DYNAMIC
SELECT TABLE_NAME, TABLE_TYPE, AVG_ROW_LENGTH FROM INFORMATION_SCHEMA.TABLES WHERE TABLE_SCHEMA='obwmjtest';
TABLE_NAME	TABLE_TYPE	AVG_ROW_LENGTH
obwmj_t1	BASE TABLE	0
SELECT TABLE_NAME, TABLE_TYPE, AVG_ROW_LENGTH FROM INFORMATION_SCHEMA.TABLES WHERE TABLE_NAME='TABLES';
TABLE_NAME	TABLE_TYPE	AVG_ROW_LENGTH
TABLES	SYSTEM VIEW	0
SELECT TABLE_NAME, TABLE_TYPE FROM INFORMATION_SCHEMA.TABLES WHERE TABLE_SCHEMA='obwmjtest' ORDER BY TABLE_NAME;
TABLE_NAME	TABLE_TYPE
obwmj_t1	BASE TABLE
SELECT TABLE_NAME, TABLE_TYPE FROM INFORMATION_SCHEMA.TABLES WHERE TABLE_NAME='TABLES';
TABLE_NAME	TABLE_TYPE
TABLES	SYSTEM VIEW
SELECT TABLE_NAME, TABLE_TYPE, MAX_DATA_LENGTH FROM INFORMATION_SCHEMA.TABLES WHERE TABLE_SCHEMA='obwmjtest' ORDER BY TABLE_NAME;
TABLE_NAME	TABLE_TYPE	MAX_DATA_LENGTH
obwmj_t1	BASE TABLE	NULL
SELECT TABLE_NAME, TABLE_TYPE, MAX_DATA_LENGTH FROM INFORMATION_SCHEMA.TABLES WHERE TABLE_NAME='TABLES';
TABLE_NAME	TABLE_TYPE	MAX_DATA_LENGTH
TABLES	SYSTEM VIEW	NULL
SELECT TABLE_NAME, TABLE_TYPE, DATA_FREE FROM INFORMATION_SCHEMA.TABLES WHERE TABLE_SCHEMA='obwmjtest' ORDER BY TABLE_NAME;
TABLE_NAME	TABLE_TYPE	DATA_FREE
obwmj_t1	BASE TABLE	NULL
SELECT TABLE_NAME, TABLE_TYPE, DATA_FREE FROM INFORMATION_SCHEMA.TABLES WHERE TABLE_NAME='TABLES';
TABLE_NAME	TABLE_TYPE	DATA_FREE
TABLES	SYSTEM VIEW	NULL
DROP TABLE obwmj_t1;
CREATE TABLE obwmj_t2 (  
id BIGINT UNSIGNED  PRIMARY KEY AUTO_INCREMENT,  
brand VARCHAR(255) NOT NULL,  
color ENUM('RED','GREEN','BLUE')
);
INSERT INTO obwmj_t2 VALUES(1, 'vivo', 'GREEN');
INSERT INTO obwmj_t2 VALUES(2,  'OPPO', 'RED');
SELECT TABLE_CATALOG FROM INFORMATION_SCHEMA.TABLES WHERE TABLE_NAME='obwmj_t2';
TABLE_CATALOG
def
SELECT TABLE_SCHEMA FROM INFORMATION_SCHEMA.TABLES WHERE TABLE_NAME='obwmj_t2';
TABLE_SCHEMA
obwmjtest
SELECT TABLE_NAME FROM INFORMATION_SCHEMA.TABLES WHERE TABLE_SCHEMA='obwmjtest';
TABLE_NAME
obwmj_t2
SELECT TABLE_TYPE FROM INFORMATION_SCHEMA.TABLES WHERE TABLE_NAME='obwmj_t2';
TABLE_TYPE
BASE TABLE
SELECT TABLE_NAME, TABLE_TYPE, TABLE_ROWS FROM INFORMATION_SCHEMA.TABLES WHERE TABLE_SCHEMA='obwmjtest';
TABLE_NAME	TABLE_TYPE	TABLE_ROWS
obwmj_t2	BASE TABLE	0
SELECT TABLE_NAME, TABLE_TYPE, TABLE_ROWS FROM INFORMATION_SCHEMA.TABLES WHERE TABLE_NAME='TABLES';
TABLE_NAME	TABLE_TYPE	TABLE_ROWS
TABLES	SYSTEM VIEW	0
SELECT TABLE_NAME, TABLE_TYPE, AVG_ROW_LENGTH FROM INFORMATION_SCHEMA.TABLES WHERE TABLE_SCHEMA='obwmjtest';
TABLE_NAME	TABLE_TYPE	AVG_ROW_LENGTH
obwmj_t2	BASE TABLE	0
SELECT TABLE_NAME, TABLE_TYPE, AVG_ROW_LENGTH FROM INFORMATION_SCHEMA.TABLES WHERE TABLE_NAME='TABLES';
TABLE_NAME	TABLE_TYPE	AVG_ROW_LENGTH
TABLES	SYSTEM VIEW	0
SELECT TABLE_NAME, TABLE_TYPE FROM INFORMATION_SCHEMA.TABLES WHERE TABLE_SCHEMA='obwmjtest' ORDER BY TABLE_NAME;
TABLE_NAME	TABLE_TYPE
obwmj_t2	BASE TABLE
SELECT TABLE_NAME, TABLE_TYPE FROM INFORMATION_SCHEMA.TABLES WHERE TABLE_NAME='TABLES';
TABLE_NAME	TABLE_TYPE
TABLES	SYSTEM VIEW
SELECT TABLE_NAME, TABLE_TYPE, MAX_DATA_LENGTH FROM INFORMATION_SCHEMA.TABLES WHERE TABLE_SCHEMA='obwmjtest' ORDER BY TABLE_NAME;
TABLE_NAME	TABLE_TYPE	MAX_DATA_LENGTH
obwmj_t2	BASE TABLE	NULL
SELECT TABLE_NAME, TABLE_TYPE, MAX_DATA_LENGTH FROM INFORMATION_SCHEMA.TABLES WHERE TABLE_NAME='TABLES';
TABLE_NAME	TABLE_TYPE	MAX_DATA_LENGTH
TABLES	SYSTEM VIEW	NULL
SELECT TABLE_NAME, TABLE_TYPE, DATA_FREE FROM INFORMATION_SCHEMA.TABLES WHERE TABLE_SCHEMA='obwmjtest' ORDER BY TABLE_NAME;
TABLE_NAME	TABLE_TYPE	DATA_FREE
obwmj_t2	BASE TABLE	NULL
SELECT TABLE_NAME, TABLE_TYPE, DATA_FREE FROM INFORMATION_SCHEMA.TABLES WHERE TABLE_NAME='TABLES';
TABLE_NAME	TABLE_TYPE	DATA_FREE
TABLES	SYSTEM VIEW	NULL
DROP TABLE obwmj_t2;
CREATE TABLE obwmj_t3 (a INT, b SET('abc', '中国人民'));
INSERT INTO obwmj_t3 VALUES(1,  'abc');
INSERT INTO obwmj_t3 VALUES(2,  '中国人民');
INSERT INTO obwmj_t3 VALUES(3,  'abc,中国人民');
SELECT TABLE_CATALOG FROM INFORMATION_SCHEMA.TABLES WHERE TABLE_NAME='obwmj_t3';
TABLE_CATALOG
def
SELECT TABLE_SCHEMA FROM INFORMATION_SCHEMA.TABLES WHERE TABLE_NAME='obwmj_t3';
TABLE_SCHEMA
obwmjtest
SELECT TABLE_NAME FROM INFORMATION_SCHEMA.TABLES WHERE TABLE_SCHEMA='obwmjtest';
TABLE_NAME
obwmj_t3
SELECT TABLE_TYPE FROM INFORMATION_SCHEMA.TABLES WHERE TABLE_NAME='obwmj_t3';
TABLE_TYPE
BASE TABLE
SELECT TABLE_NAME, TABLE_TYPE, TABLE_ROWS FROM INFORMATION_SCHEMA.TABLES WHERE TABLE_SCHEMA='obwmjtest';
TABLE_NAME	TABLE_TYPE	TABLE_ROWS
obwmj_t3	BASE TABLE	0
SELECT TABLE_NAME, TABLE_TYPE, TABLE_ROWS FROM INFORMATION_SCHEMA.TABLES WHERE TABLE_NAME='TABLES';
TABLE_NAME	TABLE_TYPE	TABLE_ROWS
TABLES	SYSTEM VIEW	0
SELECT TABLE_NAME, TABLE_TYPE, AVG_ROW_LENGTH FROM INFORMATION_SCHEMA.TABLES WHERE TABLE_SCHEMA='obwmjtest';
TABLE_NAME	TABLE_TYPE	AVG_ROW_LENGTH
obwmj_t3	BASE TABLE	0
SELECT TABLE_NAME, TABLE_TYPE, AVG_ROW_LENGTH FROM INFORMATION_SCHEMA.TABLES WHERE TABLE_NAME='TABLES';
TABLE_NAME	TABLE_TYPE	AVG_ROW_LENGTH
TABLES	SYSTEM VIEW	0
SELECT TABLE_NAME, TABLE_TYPE FROM INFORMATION_SCHEMA.TABLES WHERE TABLE_SCHEMA='obwmjtest' ORDER BY TABLE_NAME;
TABLE_NAME	TABLE_TYPE
obwmj_t3	BASE TABLE
SELECT TABLE_NAME, TABLE_TYPE FROM INFORMATION_SCHEMA.TABLES WHERE TABLE_NAME='TABLES';
TABLE_NAME	TABLE_TYPE
TABLES	SYSTEM VIEW
SELECT TABLE_NAME, TABLE_TYPE, MAX_DATA_LENGTH FROM INFORMATION_SCHEMA.TABLES WHERE TABLE_SCHEMA='obwmjtest' ORDER BY TABLE_NAME;
TABLE_NAME	TABLE_TYPE	MAX_DATA_LENGTH
obwmj_t3	BASE TABLE	NULL
SELECT TABLE_NAME, TABLE_TYPE, MAX_DATA_LENGTH FROM INFORMATION_SCHEMA.TABLES WHERE TABLE_NAME='TABLES';
TABLE_NAME	TABLE_TYPE	MAX_DATA_LENGTH
TABLES	SYSTEM VIEW	NULL
SELECT TABLE_NAME, TABLE_TYPE, DATA_FREE FROM INFORMATION_SCHEMA.TABLES WHERE TABLE_SCHEMA='obwmjtest' ORDER BY TABLE_NAME;
TABLE_NAME	TABLE_TYPE	DATA_FREE
obwmj_t3	BASE TABLE	NULL
SELECT TABLE_NAME, TABLE_TYPE, DATA_FREE FROM INFORMATION_SCHEMA.TABLES WHERE TABLE_NAME='TABLES';
TABLE_NAME	TABLE_TYPE	DATA_FREE
TABLES	SYSTEM VIEW	NULL
DROP TABLE obwmj_t3;
CREATE TABLE obwmj_t4(
a bigint,
b date
)partition by range columns(b) 
( 
partition part_1 values less than ('2016-09-01'),
partition part_2 values less than ('2020-09-01'),
partition part_3 values less than ('2021-09-01')
);
SELECT TABLE_CATALOG FROM INFORMATION_SCHEMA.TABLES WHERE TABLE_NAME='obwmj_t4';
TABLE_CATALOG
def
SELECT TABLE_SCHEMA FROM INFORMATION_SCHEMA.TABLES WHERE TABLE_NAME='obwmj_t4';
TABLE_SCHEMA
obwmjtest
SELECT TABLE_NAME FROM INFORMATION_SCHEMA.TABLES WHERE TABLE_SCHEMA='obwmjtest';
TABLE_NAME
obwmj_t4
SELECT TABLE_TYPE FROM INFORMATION_SCHEMA.TABLES WHERE TABLE_NAME='obwmj_t4';
TABLE_TYPE
BASE TABLE
SELECT TABLE_NAME, TABLE_TYPE, TABLE_ROWS FROM INFORMATION_SCHEMA.TABLES WHERE TABLE_SCHEMA='obwmjtest';
TABLE_NAME	TABLE_TYPE	TABLE_ROWS
obwmj_t4	BASE TABLE	0
SELECT TABLE_NAME, TABLE_TYPE, TABLE_ROWS FROM INFORMATION_SCHEMA.TABLES WHERE TABLE_NAME='TABLES';
TABLE_NAME	TABLE_TYPE	TABLE_ROWS
TABLES	SYSTEM VIEW	0
SELECT TABLE_NAME, TABLE_TYPE, AVG_ROW_LENGTH FROM INFORMATION_SCHEMA.TABLES WHERE TABLE_SCHEMA='obwmjtest';
TABLE_NAME	TABLE_TYPE	AVG_ROW_LENGTH
obwmj_t4	BASE TABLE	0
SELECT TABLE_NAME, TABLE_TYPE, AVG_ROW_LENGTH FROM INFORMATION_SCHEMA.TABLES WHERE TABLE_NAME='TABLES';
TABLE_NAME	TABLE_TYPE	AVG_ROW_LENGTH
TABLES	SYSTEM VIEW	0
SELECT TABLE_NAME, TABLE_TYPE FROM INFORMATION_SCHEMA.TABLES WHERE TABLE_SCHEMA='obwmjtest' ORDER BY TABLE_NAME;
TABLE_NAME	TABLE_TYPE
obwmj_t4	BASE TABLE
SELECT TABLE_NAME, TABLE_TYPE FROM INFORMATION_SCHEMA.TABLES WHERE TABLE_NAME='TABLES';
TABLE_NAME	TABLE_TYPE
TABLES	SYSTEM VIEW
SELECT TABLE_NAME, TABLE_TYPE, MAX_DATA_LENGTH FROM INFORMATION_SCHEMA.TABLES WHERE TABLE_SCHEMA='obwmjtest' ORDER BY TABLE_NAME;
TABLE_NAME	TABLE_TYPE	MAX_DATA_LENGTH
obwmj_t4	BASE TABLE	NULL
SELECT TABLE_NAME, TABLE_TYPE, MAX_DATA_LENGTH FROM INFORMATION_SCHEMA.TABLES WHERE TABLE_NAME='TABLES';
TABLE_NAME	TABLE_TYPE	MAX_DATA_LENGTH
TABLES	SYSTEM VIEW	NULL
SELECT TABLE_NAME, TABLE_TYPE, DATA_FREE FROM INFORMATION_SCHEMA.TABLES WHERE TABLE_SCHEMA='obwmjtest' ORDER BY TABLE_NAME;
TABLE_NAME	TABLE_TYPE	DATA_FREE
obwmj_t4	BASE TABLE	NULL
SELECT TABLE_NAME, TABLE_TYPE, DATA_FREE FROM INFORMATION_SCHEMA.TABLES WHERE TABLE_NAME='TABLES';
TABLE_NAME	TABLE_TYPE	DATA_FREE
TABLES	SYSTEM VIEW	NULL
DROP TABLE obwmj_t4;
CREATE VIEW obwmj_t5_view AS SELECT 1 + 1, 2+2 FROM DUAL;
SELECT TABLE_CATALOG FROM INFORMATION_SCHEMA.TABLES WHERE TABLE_NAME='obwmj_t5_view';
TABLE_CATALOG
def
SELECT TABLE_SCHEMA FROM INFORMATION_SCHEMA.TABLES WHERE TABLE_NAME='obwmj_t5_view';
TABLE_SCHEMA
obwmjtest
SELECT TABLE_NAME FROM INFORMATION_SCHEMA.TABLES WHERE TABLE_SCHEMA='obwmjtest';
TABLE_NAME
obwmj_t5_view
SELECT TABLE_TYPE FROM INFORMATION_SCHEMA.TABLES WHERE TABLE_NAME='obwmj_t5_view';
TABLE_TYPE
VIEW
SELECT TABLE_NAME, TABLE_TYPE, TABLE_ROWS FROM INFORMATION_SCHEMA.TABLES WHERE TABLE_SCHEMA='obwmjtest';
TABLE_NAME	TABLE_TYPE	TABLE_ROWS
obwmj_t5_view	VIEW	0
SELECT TABLE_NAME, TABLE_TYPE, TABLE_ROWS FROM INFORMATION_SCHEMA.TABLES WHERE TABLE_NAME='TABLES';
TABLE_NAME	TABLE_TYPE	TABLE_ROWS
TABLES	SYSTEM VIEW	0
SELECT TABLE_NAME, TABLE_TYPE, AVG_ROW_LENGTH FROM INFORMATION_SCHEMA.TABLES WHERE TABLE_SCHEMA='obwmjtest';
TABLE_NAME	TABLE_TYPE	AVG_ROW_LENGTH
obwmj_t5_view	VIEW	0
SELECT TABLE_NAME, TABLE_TYPE, AVG_ROW_LENGTH FROM INFORMATION_SCHEMA.TABLES WHERE TABLE_NAME='TABLES';
TABLE_NAME	TABLE_TYPE	AVG_ROW_LENGTH
TABLES	SYSTEM VIEW	0
SELECT TABLE_NAME, TABLE_TYPE FROM INFORMATION_SCHEMA.TABLES WHERE TABLE_SCHEMA='obwmjtest' ORDER BY TABLE_NAME;
TABLE_NAME	TABLE_TYPE
obwmj_t5_view	VIEW
SELECT TABLE_NAME, TABLE_TYPE FROM INFORMATION_SCHEMA.TABLES WHERE TABLE_NAME='TABLES';
TABLE_NAME	TABLE_TYPE
TABLES	SYSTEM VIEW
SELECT TABLE_NAME, TABLE_TYPE, MAX_DATA_LENGTH FROM INFORMATION_SCHEMA.TABLES WHERE TABLE_SCHEMA='obwmjtest' ORDER BY TABLE_NAME;
TABLE_NAME	TABLE_TYPE	MAX_DATA_LENGTH
obwmj_t5_view	VIEW	NULL
SELECT TABLE_NAME, TABLE_TYPE, MAX_DATA_LENGTH FROM INFORMATION_SCHEMA.TABLES WHERE TABLE_NAME='TABLES';
TABLE_NAME	TABLE_TYPE	MAX_DATA_LENGTH
TABLES	SYSTEM VIEW	NULL
SELECT TABLE_NAME, TABLE_TYPE, DATA_FREE FROM INFORMATION_SCHEMA.TABLES WHERE TABLE_SCHEMA='obwmjtest' ORDER BY TABLE_NAME;
TABLE_NAME	TABLE_TYPE	DATA_FREE
obwmj_t5_view	VIEW	NULL
SELECT TABLE_NAME, TABLE_TYPE, DATA_FREE FROM INFORMATION_SCHEMA.TABLES WHERE TABLE_NAME='TABLES';
TABLE_NAME	TABLE_TYPE	DATA_FREE
TABLES	SYSTEM VIEW	NULL
DROP VIEW obwmj_t5_view;
CREATE TABLE obwmj_t55 (a INT, b SET('abc', '中国人民'));
INSERT INTO obwmj_t55 VALUES(1,  'abc');
INSERT INTO obwmj_t55 VALUES(2,  '中国人民');
INSERT INTO obwmj_t55 VALUES(3,  'abc,中国人民');
CREATE VIEW obwmj_t55_view AS SELECT * FROM obwmj_t55;
SELECT TABLE_CATALOG FROM INFORMATION_SCHEMA.TABLES WHERE TABLE_NAME='obwmj_t55_view';
TABLE_CATALOG
def
SELECT TABLE_SCHEMA FROM INFORMATION_SCHEMA.TABLES WHERE TABLE_NAME='obwmj_t55_view';
TABLE_SCHEMA
obwmjtest
SELECT TABLE_NAME FROM INFORMATION_SCHEMA.TABLES WHERE TABLE_SCHEMA='obwmjtest';
TABLE_NAME
obwmj_t55
obwmj_t55_view
SELECT TABLE_TYPE FROM INFORMATION_SCHEMA.TABLES WHERE TABLE_NAME='obwmj_t55_view';
TABLE_TYPE
VIEW
SELECT TABLE_NAME, TABLE_TYPE, TABLE_ROWS FROM INFORMATION_SCHEMA.TABLES WHERE TABLE_SCHEMA='obwmjtest';
TABLE_NAME	TABLE_TYPE	TABLE_ROWS
obwmj_t55_view	VIEW	0
obwmj_t55	BASE TABLE	0
SELECT TABLE_NAME, TABLE_TYPE, TABLE_ROWS FROM INFORMATION_SCHEMA.TABLES WHERE TABLE_NAME='TABLES';
TABLE_NAME	TABLE_TYPE	TABLE_ROWS
TABLES	SYSTEM VIEW	0
SELECT TABLE_NAME, TABLE_TYPE, AVG_ROW_LENGTH FROM INFORMATION_SCHEMA.TABLES WHERE TABLE_SCHEMA='obwmjtest';
TABLE_NAME	TABLE_TYPE	AVG_ROW_LENGTH
obwmj_t55	BASE TABLE	0
obwmj_t55_view	VIEW	0
SELECT TABLE_NAME, TABLE_TYPE, AVG_ROW_LENGTH FROM INFORMATION_SCHEMA.TABLES WHERE TABLE_NAME='TABLES';
TABLE_NAME	TABLE_TYPE	AVG_ROW_LENGTH
TABLES	SYSTEM VIEW	0
SELECT TABLE_NAME, TABLE_TYPE FROM INFORMATION_SCHEMA.TABLES WHERE TABLE_SCHEMA='obwmjtest' ORDER BY TABLE_NAME;
TABLE_NAME	TABLE_TYPE
obwmj_t55	BASE TABLE
obwmj_t55_view	VIEW
SELECT TABLE_NAME, TABLE_TYPE FROM INFORMATION_SCHEMA.TABLES WHERE TABLE_NAME='TABLES';
TABLE_NAME	TABLE_TYPE
TABLES	SYSTEM VIEW
SELECT TABLE_NAME, TABLE_TYPE, MAX_DATA_LENGTH FROM INFORMATION_SCHEMA.TABLES WHERE TABLE_SCHEMA='obwmjtest' ORDER BY TABLE_NAME;
TABLE_NAME	TABLE_TYPE	MAX_DATA_LENGTH
obwmj_t55	BASE TABLE	NULL
obwmj_t55_view	VIEW	NULL
SELECT TABLE_NAME, TABLE_TYPE, MAX_DATA_LENGTH FROM INFORMATION_SCHEMA.TABLES WHERE TABLE_NAME='TABLES';
TABLE_NAME	TABLE_TYPE	MAX_DATA_LENGTH
TABLES	SYSTEM VIEW	NULL
SELECT TABLE_NAME, TABLE_TYPE, DATA_FREE FROM INFORMATION_SCHEMA.TABLES WHERE TABLE_SCHEMA='obwmjtest' ORDER BY TABLE_NAME;
TABLE_NAME	TABLE_TYPE	DATA_FREE
obwmj_t55	BASE TABLE	NULL
obwmj_t55_view	VIEW	NULL
SELECT TABLE_NAME, TABLE_TYPE, DATA_FREE FROM INFORMATION_SCHEMA.TABLES WHERE TABLE_NAME='TABLES';
TABLE_NAME	TABLE_TYPE	DATA_FREE
TABLES	SYSTEM VIEW	NULL
DROP VIEW obwmj_t55_view;
DROP TABLE obwmj_t55;
CREATE TABLE obwmj_t7 (  
id BIGINT UNSIGNED  PRIMARY KEY AUTO_INCREMENT,  
brand VARCHAR(255) NOT NULL,  
color ENUM('RED','GREEN','BLUE') 
);
INSERT INTO obwmj_t7 VALUES(1, 'vivo', 'GREEN');
INSERT INTO obwmj_t7 VALUES(2,  'OPPO', 'RED');
SELECT TABLE_CATALOG FROM INFORMATION_SCHEMA.TABLES WHERE TABLE_NAME='obwmj_t7';
TABLE_CATALOG
def
SELECT TABLE_SCHEMA FROM INFORMATION_SCHEMA.TABLES WHERE TABLE_NAME='obwmj_t7';
TABLE_SCHEMA
obwmjtest
SELECT TABLE_NAME FROM INFORMATION_SCHEMA.TABLES WHERE TABLE_SCHEMA='obwmjtest';
TABLE_NAME
obwmj_t7
SELECT TABLE_TYPE FROM INFORMATION_SCHEMA.TABLES WHERE TABLE_NAME='obwmj_t7';
TABLE_TYPE
BASE TABLE
SELECT TABLE_NAME, TABLE_TYPE, TABLE_ROWS FROM INFORMATION_SCHEMA.TABLES WHERE TABLE_SCHEMA='obwmjtest';
TABLE_NAME	TABLE_TYPE	TABLE_ROWS
obwmj_t7	BASE TABLE	0
SELECT TABLE_NAME, TABLE_TYPE, TABLE_ROWS FROM INFORMATION_SCHEMA.TABLES WHERE TABLE_NAME='TABLES';
TABLE_NAME	TABLE_TYPE	TABLE_ROWS
TABLES	SYSTEM VIEW	0
SELECT TABLE_NAME, TABLE_TYPE, AVG_ROW_LENGTH FROM INFORMATION_SCHEMA.TABLES WHERE TABLE_SCHEMA='obwmjtest' ORDER BY TABLE_NAME;
TABLE_NAME	TABLE_TYPE	AVG_ROW_LENGTH
obwmj_t7	BASE TABLE	0
SELECT TABLE_NAME, TABLE_TYPE, AVG_ROW_LENGTH FROM INFORMATION_SCHEMA.TABLES WHERE TABLE_NAME='TABLES';
TABLE_NAME	TABLE_TYPE	AVG_ROW_LENGTH
TABLES	SYSTEM VIEW	0
SELECT TABLE_NAME, TABLE_TYPE FROM INFORMATION_SCHEMA.TABLES WHERE TABLE_SCHEMA='obwmjtest' ORDER BY TABLE_NAME;
TABLE_NAME	TABLE_TYPE
obwmj_t7	BASE TABLE
SELECT TABLE_NAME, TABLE_TYPE FROM INFORMATION_SCHEMA.TABLES WHERE TABLE_NAME='TABLES';
TABLE_NAME	TABLE_TYPE
TABLES	SYSTEM VIEW
SELECT TABLE_NAME, TABLE_TYPE, MAX_DATA_LENGTH FROM INFORMATION_SCHEMA.TABLES WHERE TABLE_SCHEMA='obwmjtest' ORDER BY TABLE_NAME;
TABLE_NAME	TABLE_TYPE	MAX_DATA_LENGTH
obwmj_t7	BASE TABLE	NULL
SELECT TABLE_NAME, TABLE_TYPE, MAX_DATA_LENGTH FROM INFORMATION_SCHEMA.TABLES WHERE TABLE_NAME='TABLES';
TABLE_NAME	TABLE_TYPE	MAX_DATA_LENGTH
TABLES	SYSTEM VIEW	NULL
SELECT TABLE_NAME, TABLE_TYPE, DATA_FREE FROM INFORMATION_SCHEMA.TABLES WHERE TABLE_SCHEMA='obwmjtest' ORDER BY TABLE_NAME;
TABLE_NAME	TABLE_TYPE	DATA_FREE
obwmj_t7	BASE TABLE	NULL
SELECT TABLE_NAME, TABLE_TYPE, DATA_FREE FROM INFORMATION_SCHEMA.TABLES WHERE TABLE_NAME='TABLES';
TABLE_NAME	TABLE_TYPE	DATA_FREE
TABLES	SYSTEM VIEW	NULL
DROP TABLE obwmj_t7;
CREATE TABLE obwmj_t8 (  
id BIGINT UNSIGNED  PRIMARY KEY AUTO_INCREMENT,  
brand VARCHAR(255) NOT NULL,  
color ENUM('RED','GREEN','BLUE') 
);
INSERT INTO obwmj_t8 VALUES(1, 'vivo', 'GREEN');
INSERT INTO obwmj_t8 VALUES(2,  'OPPO', 'RED');
DROP TABLE obwmj_t8;
CREATE TABLE obwmj_t8 (  
id BIGINT UNSIGNED  PRIMARY KEY AUTO_INCREMENT,  
brand VARCHAR(255) NOT NULL,  
color ENUM('RED','GREEN','BLUE') 
);
ALTER TABLE obwmj_t8 change brand brand varchar(25) ;
ALTER TABLE obwmj_t8 change brand brand varchar(25) ;
DROP TABLE obwmj_t8;
CREATE TABLE obwmj_t5(
a bigint,
b date
)partition by range columns(b) 
( 
partition part_1 values less than ('2016-09-01'),
partition part_2 values less than ('2020-09-01'),
partition part_3 values less than ('2021-09-01')
);
INSERT INTO obwmj_t5 VALUES(1,'2013-08-01');
INSERT INTO obwmj_t5 VALUES(2,'2019-10-11');
UPDATE obwmj_t5 SET b='2021-08-11';
DELETE FROM obwmj_t5 WHERE a=1;
DROP TABLE obwmj_t5;
CREATE VIEW obwmj_t5_view AS SELECT 1 + 1, 2+2 FROM DUAL;
DROP VIEW obwmj_t5_view;
CREATE TABLE obwmj_t55 (a INT, b SET('abc', '中国人民'));
CREATE VIEW obwmj_t55_view AS SELECT * FROM obwmj_t55;
INSERT INTO obwmj_t55 VALUES(1,  'abc');
INSERT INTO obwmj_t55 VALUES(2,  '中国人民');
INSERT INTO obwmj_t55 VALUES(3,  'abc,中国人民');
DROP VIEW obwmj_t55_view;
DROP TABLE obwmj_t55;
CREATE TABLE obwmj_t1 (id int NOT NULL, name varchar(20));
INSERT INTO obwmj_t1 VALUES (1,'t1a');
INSERT INTO obwmj_t1 VALUES (2,'t1b');
ALTER TABLE obwmj_t1 change name name varchar(255) character set utf8 collate utf8_general_ci not null;
SELECT TABLE_NAME, TABLE_COLLATION, CHECKSUM FROM INFORMATION_SCHEMA.TABLES WHERE TABLE_NAME='TABLES';
TABLE_NAME	TABLE_COLLATION	CHECKSUM
TABLES	utf8mb4_general_ci	NULL
ALTER TABLE obwmj_t1 change name name varchar(255) character set gbk collate gbk_chinese_ci not null;
SELECT TABLE_NAME, TABLE_COLLATION, CHECKSUM FROM INFORMATION_SCHEMA.TABLES WHERE TABLE_NAME='TABLES';
TABLE_NAME	TABLE_COLLATION	CHECKSUM
TABLES	utf8mb4_general_ci	NULL
ALTER TABLE obwmj_t1 change name name varchar(255) character set gb18030 collate gb18030_chinese_ci not null;
SELECT TABLE_NAME, TABLE_COLLATION, CHECKSUM FROM INFORMATION_SCHEMA.TABLES WHERE TABLE_NAME='TABLES';
TABLE_NAME	TABLE_COLLATION	CHECKSUM
TABLES	utf8mb4_general_ci	NULL
DROP TABLE obwmj_t1;
CREATE TABLE obwmj_t1 (id int NOT NULL, name varchar(20)) character set gb18030 collate gb18030_chinese_ci;
INSERT INTO obwmj_t1 VALUES (1,'t1a');
INSERT INTO obwmj_t1 VALUES (2,'t1b');
SELECT TABLE_NAME, TABLE_COLLATION, CHECKSUM FROM INFORMATION_SCHEMA.TABLES WHERE TABLE_NAME='TABLES';
TABLE_NAME	TABLE_COLLATION	CHECKSUM
TABLES	utf8mb4_general_ci	NULL
DROP TABLE obwmj_t1;
CREATE TABLE obwmj_t1 (id int NOT NULL, name varchar(20)) character set gb18030 collate gb18030_chinese_ci;
SELECT TABLE_NAME, TABLE_COLLATION, CHECKSUM FROM INFORMATION_SCHEMA.TABLES WHERE TABLE_NAME='TABLES';
TABLE_NAME	TABLE_COLLATION	CHECKSUM
TABLES	utf8mb4_general_ci	NULL
INSERT INTO obwmj_t1 VALUES (1,'t1a');
INSERT INTO obwmj_t1 VALUES (2,'t1b');
ALTER TABLE obwmj_t1 character set gbk collate gbk_chinese_ci ;
SELECT TABLE_NAME, TABLE_COLLATION, CHECKSUM FROM INFORMATION_SCHEMA.TABLES WHERE TABLE_NAME='TABLES';
TABLE_NAME	TABLE_COLLATION	CHECKSUM
TABLES	utf8mb4_general_ci	NULL
DROP TABLE obwmj_t1;
CREATE TABLE obwmj_t1 (id int NOT NULL, name varchar(20)) character set gb18030 collate gb18030_chinese_ci;
CREATE VIEW obwmj_t55_view AS SELECT * FROM obwmj_t1;
SELECT TABLE_NAME, TABLE_COLLATION, CHECKSUM FROM INFORMATION_SCHEMA.TABLES WHERE TABLE_NAME='TABLES';
TABLE_NAME	TABLE_COLLATION	CHECKSUM
TABLES	utf8mb4_general_ci	NULL
DROP TABLE obwmj_t1;
DROP VIEW obwmj_t55_view;
CREATE TABLE obwmj_t1 (id int NOT NULL, name varchar(20)) character set gb18030 collate gb18030_chinese_ci;
CREATE VIEW obwmj_t55_view AS SELECT * FROM obwmj_t1;
SELECT TABLE_NAME, TABLE_COLLATION, CHECKSUM FROM INFORMATION_SCHEMA.TABLES WHERE TABLE_NAME='TABLES';
TABLE_NAME	TABLE_COLLATION	CHECKSUM
TABLES	utf8mb4_general_ci	NULL
ALTER TABLE obwmj_t1 character set gbk collate gbk_chinese_ci ;
SELECT TABLE_NAME, TABLE_COLLATION, CHECKSUM FROM INFORMATION_SCHEMA.TABLES WHERE TABLE_NAME='TABLES';
TABLE_NAME	TABLE_COLLATION	CHECKSUM
TABLES	utf8mb4_general_ci	NULL
DROP TABLE obwmj_t1;
DROP VIEW obwmj_t55_view;
CREATE TABLE obwmj_t1 (id int NOT NULL, name varchar(20)) ROW_FORMAT DYNAMIC;
INSERT INTO obwmj_t1 VALUES (1,'t1a');
INSERT INTO obwmj_t1 VALUES (2,'t1b');
SELECT TABLE_NAME, CREATE_OPTIONS FROM INFORMATION_SCHEMA.TABLES WHERE TABLE_SCHEMA='obwmjtest' ORDER BY TABLE_NAME;
TABLE_NAME	CREATE_OPTIONS
obwmj_t1	NULL
SELECT TABLE_NAME, CREATE_OPTIONS FROM INFORMATION_SCHEMA.TABLES WHERE TABLE_NAME='TABLES';
TABLE_NAME	CREATE_OPTIONS
TABLES	NULL
DROP TABLE obwmj_t1;
CREATE TABLE obwmj_t4(
a bigint,
b date
)partition by range columns(b) 
( 
partition part_1 values less than ('2016-09-01'),
partition part_2 values less than ('2020-09-01'),
partition part_3 values less than ('2021-09-01')
);
SELECT TABLE_NAME, CREATE_OPTIONS FROM INFORMATION_SCHEMA.TABLES WHERE TABLE_SCHEMA='obwmjtest' ORDER BY TABLE_NAME;
TABLE_NAME	CREATE_OPTIONS
obwmj_t4	NULL
SELECT TABLE_NAME, CREATE_OPTIONS FROM INFORMATION_SCHEMA.TABLES WHERE TABLE_NAME='TABLES';
TABLE_NAME	CREATE_OPTIONS
TABLES	NULL
DROP TABLE obwmj_t4;
CREATE TABLE obwmj_t5(
a bigint,
b date
)ROW_FORMAT Compressed partition by range columns(b) 
( 
partition part_1 values less than ('2016-09-01'),
partition part_2 values less than ('2020-09-01'),
partition part_3 values less than ('2021-09-01')
);
SELECT TABLE_NAME, CREATE_OPTIONS FROM INFORMATION_SCHEMA.TABLES WHERE TABLE_SCHEMA='obwmjtest' ORDER BY TABLE_NAME;
TABLE_NAME	CREATE_OPTIONS
obwmj_t5	NULL
SELECT TABLE_NAME, CREATE_OPTIONS FROM INFORMATION_SCHEMA.TABLES WHERE TABLE_NAME='TABLES';
TABLE_NAME	CREATE_OPTIONS
TABLES	NULL
DROP TABLE obwmj_t5;
CREATE TABLE obwmj_t55 (a INT, b SET('abc', '中国人民'))COMMENT 'www.baidu.com';
CREATE VIEW obwmj_t55_view AS SELECT * FROM obwmj_t55;
INSERT INTO obwmj_t55 VALUES(1,  'abc');
INSERT INTO obwmj_t55 VALUES(2,  '中国人民');
INSERT INTO obwmj_t55 VALUES(3,  'abc,中国人民');
SELECT TABLE_NAME, CREATE_OPTIONS FROM INFORMATION_SCHEMA.TABLES WHERE TABLE_SCHEMA='obwmjtest' ORDER BY TABLE_NAME;
TABLE_NAME	CREATE_OPTIONS
obwmj_t55	NULL
obwmj_t55_view	NULL
SELECT TABLE_NAME, CREATE_OPTIONS FROM INFORMATION_SCHEMA.TABLES WHERE TABLE_NAME='TABLES';
TABLE_NAME	CREATE_OPTIONS
TABLES	NULL
DROP TABLE obwmj_t55;
DROP VIEW obwmj_t55_view;
CREATE TABLE obwmj_t1(
a INT, 
b VARCHAR(50) 
)comment='表描述';
SELECT TABLE_NAME, CREATE_OPTIONS, TABLE_COMMENT FROM INFORMATION_SCHEMA.TABLES WHERE TABLE_SCHEMA='obwmjtest' ORDER BY TABLE_NAME;
TABLE_NAME	CREATE_OPTIONS	TABLE_COMMENT
obwmj_t1	NULL	表描述
SELECT TABLE_NAME, CREATE_OPTIONS, TABLE_COMMENT FROM INFORMATION_SCHEMA.TABLES WHERE TABLE_NAME='TABLES';
TABLE_NAME	CREATE_OPTIONS	TABLE_COMMENT
TABLES	NULL	
DROP TABLE obwmj_t1;
CREATE TABLE obwmj_t1(
a INT, 
b VARCHAR(50) comment '段描述' 
);
SELECT TABLE_NAME, CREATE_OPTIONS, TABLE_COMMENT FROM INFORMATION_SCHEMA.TABLES WHERE TABLE_SCHEMA='obwmjtest' ORDER BY TABLE_NAME;
TABLE_NAME	CREATE_OPTIONS	TABLE_COMMENT
obwmj_t1	NULL	
SELECT TABLE_NAME, CREATE_OPTIONS, TABLE_COMMENT FROM INFORMATION_SCHEMA.TABLES WHERE TABLE_NAME='TABLES';
TABLE_NAME	CREATE_OPTIONS	TABLE_COMMENT
TABLES	NULL	
DROP TABLE obwmj_t1;
CREATE TABLE obwmj_t4(
a bigint,
b date
)comment='www.baidu.com' partition by range columns(b) 
( 
partition part_1 values less than ('2016-09-01'),
partition part_2 values less than ('2020-09-01'),
partition part_3 values less than ('2021-09-01')
);
SELECT TABLE_NAME, CREATE_OPTIONS, TABLE_COMMENT FROM INFORMATION_SCHEMA.TABLES WHERE TABLE_SCHEMA='obwmjtest' ORDER BY TABLE_NAME;
TABLE_NAME	CREATE_OPTIONS	TABLE_COMMENT
obwmj_t4	NULL	www.baidu.com
SELECT TABLE_NAME, CREATE_OPTIONS, TABLE_COMMENT FROM INFORMATION_SCHEMA.TABLES WHERE TABLE_NAME='TABLES';
TABLE_NAME	CREATE_OPTIONS	TABLE_COMMENT
TABLES	NULL	
DROP TABLE obwmj_t4;
CREATE TABLE obwmj_t55 (a INT, b SET('abc', '中国人民'))COMMENT 'www.baidu.com';
CREATE VIEW obwmj_t55_view AS SELECT * FROM obwmj_t55;
INSERT INTO obwmj_t55 VALUES(1,  'abc');
INSERT INTO obwmj_t55 VALUES(2,  '中国人民');
INSERT INTO obwmj_t55 VALUES(3,  'abc,中国人民');
SELECT TABLE_NAME, CREATE_OPTIONS, TABLE_COMMENT FROM INFORMATION_SCHEMA.TABLES WHERE TABLE_SCHEMA='obwmjtest' ORDER BY TABLE_NAME;
TABLE_NAME	CREATE_OPTIONS	TABLE_COMMENT
obwmj_t55	NULL	www.baidu.com
obwmj_t55_view	NULL	VIEW
SELECT TABLE_NAME, CREATE_OPTIONS, TABLE_COMMENT FROM INFORMATION_SCHEMA.TABLES WHERE TABLE_NAME='TABLES';
TABLE_NAME	CREATE_OPTIONS	TABLE_COMMENT
TABLES	NULL	
DROP TABLE obwmj_t55;
DROP VIEW obwmj_t55_view;
CREATE TABLE obwmj_t2 (  
id BIGINT UNSIGNED  PRIMARY KEY AUTO_INCREMENT,  
brand VARCHAR(255) NOT NULL,  
color ENUM('RED','GREEN','BLUE')
);
INSERT INTO obwmj_t2 VALUES(1, 'vivo', 'GREEN');
INSERT INTO obwmj_t2 VALUES(2,  'OPPO', 'RED');
SELECT TABLE_NAME, CREATE_OPTIONS, AUTO_INCREMENT FROM INFORMATION_SCHEMA.TABLES WHERE TABLE_SCHEMA='obwmjtest' ORDER BY TABLE_NAME;
TABLE_NAME	CREATE_OPTIONS	AUTO_INCREMENT
obwmj_t2	NULL	NULL
SELECT TABLE_NAME, CREATE_OPTIONS, AUTO_INCREMENT FROM INFORMATION_SCHEMA.TABLES WHERE TABLE_NAME='TABLES';
TABLE_NAME	CREATE_OPTIONS	AUTO_INCREMENT
TABLES	NULL	NULL
DROP TABLE obwmj_t2;
CREATE TABLE obwmj_t4(
a bigint not null AUTO_INCREMENT key,
b date
)partition by range columns(a) 
( 
partition part_1 values less than (20),
partition part_2 values less than (50),
partition part_3 values less than (100)
);
SELECT TABLE_NAME, CREATE_OPTIONS, AUTO_INCREMENT FROM INFORMATION_SCHEMA.TABLES WHERE TABLE_SCHEMA='obwmjtest' ORDER BY TABLE_NAME;
TABLE_NAME	CREATE_OPTIONS	AUTO_INCREMENT
obwmj_t4	NULL	NULL
SELECT TABLE_NAME, CREATE_OPTIONS, AUTO_INCREMENT FROM INFORMATION_SCHEMA.TABLES WHERE TABLE_NAME='TABLES';
TABLE_NAME	CREATE_OPTIONS	AUTO_INCREMENT
TABLES	NULL	NULL
DROP TABLE obwmj_t4;
CREATE TABLE obwmj_t55 (a INT PRIMARY KEY AUTO_INCREMENT, b SET('abc', '中国人民'));
CREATE VIEW obwmj_t55_view AS SELECT * FROM obwmj_t55;
INSERT INTO obwmj_t55 VALUES(1,  'abc');
INSERT INTO obwmj_t55 VALUES(2,  '中国人民');
INSERT INTO obwmj_t55 VALUES(3,  'abc,中国人民');
SELECT TABLE_NAME, CREATE_OPTIONS, AUTO_INCREMENT FROM INFORMATION_SCHEMA.TABLES WHERE TABLE_SCHEMA='obwmjtest' ORDER BY TABLE_NAME;
TABLE_NAME	CREATE_OPTIONS	AUTO_INCREMENT
obwmj_t55	NULL	NULL
obwmj_t55_view	NULL	NULL
SELECT TABLE_NAME, CREATE_OPTIONS, AUTO_INCREMENT FROM INFORMATION_SCHEMA.TABLES WHERE TABLE_NAME='TABLES';
TABLE_NAME	CREATE_OPTIONS	AUTO_INCREMENT
TABLES	NULL	NULL
DROP TABLE obwmj_t55;
DROP VIEW obwmj_t55_view;
CREATE TABLE obwmj_t2 (  
id BIGINT UNSIGNED  PRIMARY KEY AUTO_INCREMENT,  
brand VARCHAR(255) NOT NULL,  
color ENUM('RED','GREEN','BLUE')
);
INSERT INTO obwmj_t2 VALUES(1, 'vivo', 'GREEN');
INSERT INTO obwmj_t2 VALUES(2,  'OPPO', 'RED');
SELECT TABLE_NAME, INDEX_LENGTH FROM INFORMATION_SCHEMA.TABLES WHERE TABLE_SCHEMA='obwmjtest' ORDER BY TABLE_NAME;
TABLE_NAME	INDEX_LENGTH
obwmj_t2	0
SELECT TABLE_NAME, INDEX_LENGTH FROM INFORMATION_SCHEMA.TABLES WHERE TABLE_NAME='TABLES';
TABLE_NAME	INDEX_LENGTH
TABLES	0
DROP TABLE obwmj_t2;
CREATE TABLE obwmj_t2 (  
id BIGINT UNSIGNED  unique KEY,  
brand VARCHAR(255) NOT NULL,  
color ENUM('RED','GREEN','BLUE')
);
INSERT INTO obwmj_t2 VALUES(1, 'vivo', 'GREEN');
INSERT INTO obwmj_t2 VALUES(2,  'OPPO', 'RED');
SELECT TABLE_NAME, INDEX_LENGTH FROM INFORMATION_SCHEMA.TABLES WHERE TABLE_SCHEMA='obwmjtest' ORDER BY TABLE_NAME;
TABLE_NAME	INDEX_LENGTH
obwmj_t2	0
SELECT TABLE_NAME, INDEX_LENGTH FROM INFORMATION_SCHEMA.TABLES WHERE TABLE_NAME='TABLES';
TABLE_NAME	INDEX_LENGTH
TABLES	0
DROP TABLE obwmj_t2;
CREATE TABLE obwmj_t4(
a bigint not null unique key,
b date
)partition by range columns(a) 
( 
partition part_1 values less than (20),
partition part_2 values less than (50),
partition part_3 values less than (100)
);
SELECT TABLE_NAME, INDEX_LENGTH FROM INFORMATION_SCHEMA.TABLES WHERE TABLE_SCHEMA='obwmjtest' ORDER BY TABLE_NAME;
TABLE_NAME	INDEX_LENGTH
obwmj_t4	0
SELECT TABLE_NAME, INDEX_LENGTH FROM INFORMATION_SCHEMA.TABLES WHERE TABLE_NAME='TABLES';
TABLE_NAME	INDEX_LENGTH
TABLES	0
DROP TABLE obwmj_t4;
CREATE TABLE obwmj_t55 (a INT UNIQUE KEY , b SET('abc', '中国人民'));
CREATE VIEW obwmj_t55_view AS SELECT * FROM obwmj_t55;
INSERT INTO obwmj_t55 VALUES(1,  'abc');
INSERT INTO obwmj_t55 VALUES(2,  '中国人民');
INSERT INTO obwmj_t55 VALUES(3,  'abc,中国人民');
SELECT TABLE_NAME, INDEX_LENGTH FROM INFORMATION_SCHEMA.TABLES WHERE TABLE_SCHEMA='obwmjtest' ORDER BY TABLE_NAME;
TABLE_NAME	INDEX_LENGTH
obwmj_t55	0
obwmj_t55_view	0
SELECT TABLE_NAME, INDEX_LENGTH FROM INFORMATION_SCHEMA.TABLES WHERE TABLE_NAME='TABLES';
TABLE_NAME	INDEX_LENGTH
TABLES	0
DROP TABLE obwmj_t55;
DROP VIEW obwmj_t55_view;
# Clean up users
DROP DATABASE obwmjtest;
drop user wmj456@'%' ;
