#Environmental cleaning
DROP USER wmj456@'%';
DROP USER TEST_AC@'%';
DROP DATABASE obwmjtest;
CREATE DATABASE obwmjtest;
DROP DATABASE obwmj_ac;
CREATE DATABASE obwmj_ac;
CREATE USER wmj456 IDENTIFIED BY 'wmj456';
GRANT ALL ON *.* TO wmj456 WITH GRANT OPTION;
CREATE USER TEST_AC IDENTIFIED BY 'WMJ456';
GRANT ALL ON *.* TO TEST_AC WITH GRANT OPTION;
DROP TABLE obwmj_t2;
DROP TABLE obwmj_t3;
DROP TABLE `obwmj_ac`.`obwmj_t2`;
CREATE TABLE obwmj_t2(c3 timestamp);
INSERT INTO obwmj_t2 VALUES('2020-01-13 21:29:31');
CREATE TABLE obwmj_t3(d1 varchar(20));
CREATE TRIGGER obwmj_demo BEFORE INSERT ON obwmj_t2 FOR EACH ROW
BEGIN
INSERT INTO obwmj_t3 VALUES(new.c3);
END;
//
INSERT INTO obwmj_t2 VALUES ('1990-03-23 21:29:31');
SELECT * FROM obwmj_t3;
d1
1990-03-23 21:29:31
SELECT TRIGGER_CATALOG,TRIGGER_SCHEMA,TRIGGER_NAME,EVENT_MANIPULATION,EVENT_OBJECT_CATALOG,EVENT_OBJECT_SCHEMA,EVENT_OBJECT_TABLE,ACTION_ORDER FROM INFORMATION_SCHEMA.TRIGGERS WHERE TRIGGER_NAME='obwmj_demo';
TRIGGER_CATALOG	TRIGGER_SCHEMA	TRIGGER_NAME	EVENT_MANIPULATION	EVENT_OBJECT_CATALOG	EVENT_OBJECT_SCHEMA	EVENT_OBJECT_TABLE	ACTION_ORDER
def	obwmjtest	obwmj_demo	INSERT	def	obwmjtest	obwmj_t2	1
DROP TRIGGER obwmj_demo;
CREATE TRIGGER obwmj_demo BEFORE UPDATE ON obwmj_t2 FOR EACH ROW
BEGIN
SET NEW.C3='2022-01-13 21:29:31';
END;
//
TRUNCATE TABLE obwmj_t2;
INSERT INTO obwmj_t2 VALUES ('1990-03-23 21:29:31');
INSERT INTO obwmj_t2 VALUES ('1991-03-23 21:29:31');
UPDATE obwmj_t2 SET C3='2000-03-23 21:29:31' WHERE C3='1991-03-23 21:29:31';
SELECT * FROM obwmj_t2;
c3
1990-03-23 21:29:31
2022-01-13 21:29:31
SELECT TRIGGER_CATALOG,TRIGGER_SCHEMA,TRIGGER_NAME,EVENT_MANIPULATION,EVENT_OBJECT_CATALOG,EVENT_OBJECT_SCHEMA,EVENT_OBJECT_TABLE,ACTION_ORDER FROM INFORMATION_SCHEMA.TRIGGERS WHERE TRIGGER_NAME='obwmj_demo';
TRIGGER_CATALOG	TRIGGER_SCHEMA	TRIGGER_NAME	EVENT_MANIPULATION	EVENT_OBJECT_CATALOG	EVENT_OBJECT_SCHEMA	EVENT_OBJECT_TABLE	ACTION_ORDER
def	obwmjtest	obwmj_demo	UPDATE	def	obwmjtest	obwmj_t2	1
DROP TRIGGER obwmj_demo;
CREATE TRIGGER obwmj_demo BEFORE DELETE ON obwmj_t2 FOR EACH ROW
BEGIN
INSERT INTO obwmj_t3 VALUES(old.c3);
END;
//
TRUNCATE TABLE obwmj_t2;
INSERT INTO obwmj_t2 VALUES ('1990-03-23 21:29:31');
INSERT INTO obwmj_t2 VALUES ('1991-03-23 21:29:31');
DELETE FROM obwmj_t2 WHERE C3='1991-03-23 21:29:31';
SELECT * FROM obwmj_t2;
c3
1990-03-23 21:29:31
SELECT * FROM obwmj_t3;
d1
1990-03-23 21:29:31
1991-03-23 21:29:31
TRUNCATE TABLE obwmj_t3;
SELECT TRIGGER_CATALOG,TRIGGER_SCHEMA,TRIGGER_NAME,EVENT_MANIPULATION,EVENT_OBJECT_CATALOG,EVENT_OBJECT_SCHEMA,EVENT_OBJECT_TABLE,ACTION_ORDER FROM INFORMATION_SCHEMA.TRIGGERS WHERE TRIGGER_NAME='obwmj_demo';
TRIGGER_CATALOG	TRIGGER_SCHEMA	TRIGGER_NAME	EVENT_MANIPULATION	EVENT_OBJECT_CATALOG	EVENT_OBJECT_SCHEMA	EVENT_OBJECT_TABLE	ACTION_ORDER
def	obwmjtest	obwmj_demo	DELETE	def	obwmjtest	obwmj_t2	1
DROP TRIGGER obwmj_demo;
DROP TABLE `obwmj_t2`;
DROP TABLE obwmj_t3;
CREATE TABLE `obwmj_ac`.`obwmj_t2`(c3 timestamp);
INSERT INTO `obwmj_ac`.`obwmj_t2` VALUES('2020-01-13 21:29:31');
CREATE TABLE `obwmj_ac`.obwmj_t3(d1 varchar(20));
CREATE TRIGGER `obwmj_ac`.obwmj_demo BEFORE DELETE ON `obwmj_ac`.`obwmj_t2` FOR EACH ROW
BEGIN
INSERT INTO `obwmj_ac`.obwmj_t3 VALUES(old.c3);
END;
//
TRUNCATE TABLE `obwmj_ac`.`obwmj_t2`;
INSERT INTO `obwmj_ac`.`obwmj_t2` VALUES ('1990-03-23 21:29:31');
INSERT INTO `obwmj_ac`.`obwmj_t2` VALUES ('1991-03-23 21:29:31');
DELETE FROM `obwmj_ac`.`obwmj_t2` WHERE C3='1991-03-23 21:29:31';
SELECT * FROM `obwmj_ac`.`obwmj_t2`;
c3
1990-03-23 21:29:31
SELECT * FROM `obwmj_ac`.obwmj_t3;
d1
1991-03-23 21:29:31
TRUNCATE TABLE `obwmj_ac`.obwmj_t3;
SELECT TRIGGER_NAME,TRIGGER_SCHEMA,EVENT_MANIPULATION,EVENT_OBJECT_SCHEMA,EVENT_OBJECT_TABLE,ACTION_ORDER FROM INFORMATION_SCHEMA.TRIGGERS WHERE TRIGGER_NAME='obwmj_demo';
TRIGGER_NAME	TRIGGER_SCHEMA	EVENT_MANIPULATION	EVENT_OBJECT_SCHEMA	EVENT_OBJECT_TABLE	ACTION_ORDER
obwmj_demo	obwmj_ac	DELETE	obwmj_ac	obwmj_t2	1
DROP TRIGGER `obwmj_ac`.obwmj_demo;
DROP TABLE `obwmj_ac`.`obwmj_t2`;
DROP TABLE `obwmj_ac`.obwmj_t3;
CREATE TABLE `obwmj_t2`(c3 timestamp);
INSERT INTO `obwmj_t2` VALUES('2020-01-13 21:29:31');
CREATE TABLE `obwmj_ac`.obwmj_t3(d1 varchar(20));
CREATE TRIGGER obwmj_demo BEFORE DELETE ON `obwmj_t2` FOR EACH ROW
BEGIN
INSERT INTO `obwmj_ac`.obwmj_t3 VALUES(old.c3);
END;
//
TRUNCATE TABLE `obwmj_t2`;
INSERT INTO `obwmj_t2` VALUES ('1990-03-23 21:29:31');
INSERT INTO `obwmj_t2` VALUES ('1991-03-23 21:29:31');
DELETE FROM `obwmj_t2` WHERE C3='1991-03-23 21:29:31';
SELECT * FROM `obwmj_t2`;
c3
1990-03-23 21:29:31
SELECT * FROM `obwmj_ac`.obwmj_t3;
d1
1991-03-23 21:29:31
TRUNCATE TABLE `obwmj_ac`.obwmj_t3;
SELECT TRIGGER_NAME,TRIGGER_SCHEMA,EVENT_MANIPULATION,EVENT_OBJECT_SCHEMA,EVENT_OBJECT_TABLE,ACTION_ORDER FROM INFORMATION_SCHEMA.TRIGGERS WHERE TRIGGER_NAME='obwmj_demo';
TRIGGER_NAME	TRIGGER_SCHEMA	EVENT_MANIPULATION	EVENT_OBJECT_SCHEMA	EVENT_OBJECT_TABLE	ACTION_ORDER
obwmj_demo	obwmjtest	DELETE	obwmjtest	obwmj_t2	1
DROP TRIGGER obwmj_demo;
DROP TABLE `obwmj_t2`;
DROP TABLE `obwmj_ac`.obwmj_t3;
CREATE TABLE obwmj_t2(c3 timestamp);
INSERT INTO obwmj_t2 VALUES('2020-01-13 21:29:31');
CREATE TABLE obwmj_t3(d1 varchar(20));
INSERT INTO obwmj_t3 VALUES('第一行');
INSERT INTO obwmj_t3 VALUES('第二行');
CREATE TRIGGER obwmj_demo BEFORE INSERT ON obwmj_t2 FOR EACH ROW
BEGIN
INSERT INTO obwmj_t3 VALUES(new.c3);
END;
//
CREATE TRIGGER obwmj_demo2 BEFORE INSERT ON obwmj_t2 FOR EACH ROW
BEGIN
INSERT INTO obwmj_t3 VALUES(new.c3);
END;
//
INSERT INTO obwmj_t2 VALUES ('1990-03-23 21:29:31');
SELECT * FROM obwmj_t3;
d1
第一行
第二行
1990-03-23 21:29:31
1990-03-23 21:29:31
SELECT TRIGGER_NAME,TRIGGER_SCHEMA,EVENT_MANIPULATION,EVENT_OBJECT_SCHEMA,EVENT_OBJECT_TABLE,ACTION_ORDER FROM INFORMATION_SCHEMA.TRIGGERS WHERE TRIGGER_NAME='obwmj_demo';
TRIGGER_NAME	TRIGGER_SCHEMA	EVENT_MANIPULATION	EVENT_OBJECT_SCHEMA	EVENT_OBJECT_TABLE	ACTION_ORDER
obwmj_demo	obwmjtest	INSERT	obwmjtest	obwmj_t2	1
SELECT TRIGGER_NAME,TRIGGER_SCHEMA,EVENT_MANIPULATION,EVENT_OBJECT_SCHEMA,EVENT_OBJECT_TABLE,ACTION_ORDER FROM INFORMATION_SCHEMA.TRIGGERS WHERE TRIGGER_NAME='obwmj_demo2';
TRIGGER_NAME	TRIGGER_SCHEMA	EVENT_MANIPULATION	EVENT_OBJECT_SCHEMA	EVENT_OBJECT_TABLE	ACTION_ORDER
obwmj_demo2	obwmjtest	INSERT	obwmjtest	obwmj_t2	2
DROP TRIGGER obwmj_demo;
DROP TABLE `obwmj_t2`;
DROP TABLE obwmj_t3;
CREATE TABLE obwmj_t2(c3 timestamp);
INSERT INTO obwmj_t2 VALUES('2020-01-13 21:29:31');
CREATE TABLE obwmj_t3(d1 varchar(20));
CREATE TRIGGER obwmj_demo BEFORE INSERT ON obwmj_t2 FOR EACH ROW
BEGIN
INSERT INTO obwmj_t3 VALUES(new.c3);
END;
//
INSERT INTO obwmj_t2 VALUES ('1990-03-23 21:29:31');
SELECT * FROM obwmj_t3;
d1
1990-03-23 21:29:31
SELECT TRIGGER_NAME,TRIGGER_SCHEMA,EVENT_MANIPULATION,EVENT_OBJECT_SCHEMA,EVENT_OBJECT_TABLE,ACTION_ORDER FROM INFORMATION_SCHEMA.TRIGGERS WHERE TRIGGER_NAME='obwmj_demo';
TRIGGER_NAME	TRIGGER_SCHEMA	EVENT_MANIPULATION	EVENT_OBJECT_SCHEMA	EVENT_OBJECT_TABLE	ACTION_ORDER
obwmj_demo	obwmjtest	INSERT	obwmjtest	obwmj_t2	1
SELECT TRIGGER_NAME,ACTION_CONDITION,ACTION_STATEMENT,ACTION_ORIENTATION,ACTION_TIMING,ACTION_REFERENCE_OLD_TABLE,ACTION_REFERENCE_NEW_TABLE,ACTION_REFERENCE_OLD_ROW,ACTION_REFERENCE_NEW_ROW FROM INFORMATION_SCHEMA.TRIGGERS WHERE TRIGGER_NAME='obwmj_demo';
TRIGGER_NAME	ACTION_CONDITION	ACTION_STATEMENT	ACTION_ORIENTATION	ACTION_TIMING	ACTION_REFERENCE_OLD_TABLE	ACTION_REFERENCE_NEW_TABLE	ACTION_REFERENCE_OLD_ROW	ACTION_REFERENCE_NEW_ROW
obwmj_demo	NULL	TRIGGER obwmj_demo BEFORE INSERT ON obwmj_t2 FOR EACH ROW
BEGIN
INSERT INTO obwmj_t3 VALUES(new.c3);
END	ROW	BEFORE	NULL	NULL	OLD	NEW
DROP TRIGGER obwmj_demo;
DROP TABLE `obwmj_t2`;
DROP TABLE obwmj_t3;
CREATE TABLE obwmj_t2(c3 timestamp);
INSERT INTO obwmj_t2 VALUES('2020-01-13 21:29:31');
CREATE TABLE obwmj_t3(d1 varchar(20));
CREATE TRIGGER obwmj_demo AFTER INSERT ON obwmj_t2 FOR EACH ROW
BEGIN
INSERT INTO obwmj_t3 VALUES(new.c3);
END;
//
INSERT INTO obwmj_t2 VALUES ('1990-03-23 21:29:31');
SELECT * FROM obwmj_t3;
d1
1990-03-23 21:29:31
SELECT TRIGGER_NAME,TRIGGER_SCHEMA,EVENT_MANIPULATION,EVENT_OBJECT_SCHEMA,EVENT_OBJECT_TABLE,ACTION_ORDER FROM INFORMATION_SCHEMA.TRIGGERS WHERE TRIGGER_NAME='obwmj_demo';
TRIGGER_NAME	TRIGGER_SCHEMA	EVENT_MANIPULATION	EVENT_OBJECT_SCHEMA	EVENT_OBJECT_TABLE	ACTION_ORDER
obwmj_demo	obwmjtest	INSERT	obwmjtest	obwmj_t2	1
SELECT TRIGGER_NAME,ACTION_STATEMENT,ACTION_TIMING FROM INFORMATION_SCHEMA.TRIGGERS WHERE TRIGGER_NAME='obwmj_demo';
TRIGGER_NAME	ACTION_STATEMENT	ACTION_TIMING
obwmj_demo	TRIGGER obwmj_demo AFTER INSERT ON obwmj_t2 FOR EACH ROW
BEGIN
INSERT INTO obwmj_t3 VALUES(new.c3);
END	AFTER
DROP TRIGGER obwmj_demo;
DROP TABLE `obwmj_t2`;
DROP TABLE obwmj_t3;
CREATE TABLE obwmj_t2(c3 timestamp);
INSERT INTO obwmj_t2 VALUES('2020-01-13 21:29:31');
CREATE TABLE obwmj_t3(d1 varchar(20));
CREATE TRIGGER obwmj_demo BEFORE INSERT ON obwmj_t2 FOR EACH ROW
BEGIN
INSERT INTO obwmj_t3 VALUES(new.c3);
END;
//
INSERT INTO obwmj_t2 VALUES ('1990-03-23 21:29:31');
SELECT * FROM obwmj_t3;
d1
1990-03-23 21:29:31
SELECT TRIGGER_NAME,TRIGGER_SCHEMA,EVENT_MANIPULATION,EVENT_OBJECT_SCHEMA,EVENT_OBJECT_TABLE,ACTION_ORDER FROM INFORMATION_SCHEMA.TRIGGERS WHERE TRIGGER_NAME='obwmj_demo';
TRIGGER_NAME	TRIGGER_SCHEMA	EVENT_MANIPULATION	EVENT_OBJECT_SCHEMA	EVENT_OBJECT_TABLE	ACTION_ORDER
obwmj_demo	obwmjtest	INSERT	obwmjtest	obwmj_t2	1
SELECT TRIGGER_NAME,ACTION_STATEMENT,ACTION_TIMING FROM INFORMATION_SCHEMA.TRIGGERS WHERE TRIGGER_NAME='obwmj_demo';
TRIGGER_NAME	ACTION_STATEMENT	ACTION_TIMING
obwmj_demo	TRIGGER obwmj_demo BEFORE INSERT ON obwmj_t2 FOR EACH ROW
BEGIN
INSERT INTO obwmj_t3 VALUES(new.c3);
END	BEFORE
DROP TRIGGER obwmj_demo;
DROP TABLE `obwmj_t2`;
DROP TABLE obwmj_t3;
CREATE TABLE obwmj_t2(c3 timestamp);
INSERT INTO obwmj_t2 VALUES('2020-01-13 21:29:31');
CREATE TABLE obwmj_t3(d1 varchar(20));
CREATE TRIGGER obwmj_demo BEFORE UPDATE ON obwmj_t2 FOR EACH ROW
BEGIN
SET NEW.C3='2022-01-13 21:29:31';
END;
//
TRUNCATE TABLE obwmj_t2;
INSERT INTO obwmj_t2 VALUES ('1990-03-23 21:29:31');
INSERT INTO obwmj_t2 VALUES ('1991-03-23 21:29:31');
UPDATE obwmj_t2 SET C3='2000-03-23 21:29:31' WHERE C3='1991-03-23 21:29:31';
SELECT * FROM obwmj_t2;
c3
1990-03-23 21:29:31
2022-01-13 21:29:31
SELECT TRIGGER_NAME,TRIGGER_SCHEMA,EVENT_MANIPULATION,EVENT_OBJECT_SCHEMA,EVENT_OBJECT_TABLE,ACTION_ORDER FROM INFORMATION_SCHEMA.TRIGGERS WHERE TRIGGER_NAME='obwmj_demo';
TRIGGER_NAME	TRIGGER_SCHEMA	EVENT_MANIPULATION	EVENT_OBJECT_SCHEMA	EVENT_OBJECT_TABLE	ACTION_ORDER
obwmj_demo	obwmjtest	UPDATE	obwmjtest	obwmj_t2	1
SELECT TRIGGER_NAME,ACTION_STATEMENT,ACTION_TIMING FROM INFORMATION_SCHEMA.TRIGGERS WHERE TRIGGER_NAME='obwmj_demo';
TRIGGER_NAME	ACTION_STATEMENT	ACTION_TIMING
obwmj_demo	TRIGGER obwmj_demo BEFORE UPDATE ON obwmj_t2 FOR EACH ROW
BEGIN
SET NEW.C3='2022-01-13 21:29:31';
END	BEFORE
DROP TRIGGER obwmj_demo;
DROP TABLE `obwmj_t2`;
DROP TABLE obwmj_t3;
CREATE TABLE obwmj_t2(c3 timestamp);
INSERT INTO obwmj_t2 VALUES('2020-01-13 21:29:31');
CREATE TABLE obwmj_t3(d1 varchar(20));
CREATE TRIGGER obwmj_demo BEFORE DELETE ON obwmj_t2 FOR EACH ROW
BEGIN
INSERT INTO obwmj_t3 VALUES(old.c3);
END;
//
TRUNCATE TABLE obwmj_t2;
INSERT INTO obwmj_t2 VALUES ('1990-03-23 21:29:31');
INSERT INTO obwmj_t2 VALUES ('1991-03-23 21:29:31');
DELETE FROM obwmj_t2 WHERE C3='1991-03-23 21:29:31';
SELECT * FROM obwmj_t2;
c3
1990-03-23 21:29:31
SELECT * FROM obwmj_t3;
d1
1991-03-23 21:29:31
TRUNCATE TABLE obwmj_t3;
SELECT TRIGGER_NAME,TRIGGER_SCHEMA,EVENT_MANIPULATION,EVENT_OBJECT_SCHEMA,EVENT_OBJECT_TABLE,ACTION_ORDER FROM INFORMATION_SCHEMA.TRIGGERS WHERE TRIGGER_NAME='obwmj_demo';
TRIGGER_NAME	TRIGGER_SCHEMA	EVENT_MANIPULATION	EVENT_OBJECT_SCHEMA	EVENT_OBJECT_TABLE	ACTION_ORDER
obwmj_demo	obwmjtest	DELETE	obwmjtest	obwmj_t2	1
SELECT TRIGGER_NAME,ACTION_STATEMENT,ACTION_TIMING FROM INFORMATION_SCHEMA.TRIGGERS WHERE TRIGGER_NAME='obwmj_demo';
TRIGGER_NAME	ACTION_STATEMENT	ACTION_TIMING
obwmj_demo	TRIGGER obwmj_demo BEFORE DELETE ON obwmj_t2 FOR EACH ROW
BEGIN
INSERT INTO obwmj_t3 VALUES(old.c3);
END	BEFORE
DROP TRIGGER obwmj_demo;
DROP TABLE `obwmj_t2`;
DROP TABLE obwmj_t3;
CREATE TABLE obwmj_t2(c3 timestamp);
INSERT INTO obwmj_t2 VALUES('2020-01-13 21:29:31');
CREATE TABLE obwmj_t3(d1 varchar(20));
CREATE TRIGGER obwmj_demo BEFORE INSERT ON obwmj_t2 FOR EACH ROW
BEGIN
INSERT INTO obwmj_t3 VALUES(new.c3);
END;
//
INSERT INTO obwmj_t2 VALUES ('1990-03-23 21:29:31');
SELECT * FROM obwmj_t3;
d1
1990-03-23 21:29:31
SELECT TRIGGER_NAME,TRIGGER_SCHEMA,EVENT_MANIPULATION,EVENT_OBJECT_SCHEMA,EVENT_OBJECT_TABLE,ACTION_ORDER FROM INFORMATION_SCHEMA.TRIGGERS WHERE TRIGGER_NAME='obwmj_demo';
TRIGGER_NAME	TRIGGER_SCHEMA	EVENT_MANIPULATION	EVENT_OBJECT_SCHEMA	EVENT_OBJECT_TABLE	ACTION_ORDER
obwmj_demo	obwmjtest	INSERT	obwmjtest	obwmj_t2	1
SELECT SQL_MODE,DEFINER,CHARACTER_SET_CLIENT,COLLATION_CONNECTION,DATABASE_COLLATION FROM INFORMATION_SCHEMA.TRIGGERS WHERE TRIGGER_NAME='obwmj_demo';
SQL_MODE	DEFINER	CHARACTER_SET_CLIENT	COLLATION_CONNECTION	DATABASE_COLLATION
STRICT_ALL_TABLES,NO_ZERO_IN_DATE,NO_AUTO_CREATE_USER	wmj456@%	utf8mb4	utf8mb4_general_ci	utf8mb4_general_ci
DROP TRIGGER obwmj_demo;
DROP TABLE `obwmj_t2`;
DROP TABLE obwmj_t3;
SET @@SQL_MODE = '';
CREATE TABLE obwmj_t2(c3 timestamp);
INSERT INTO obwmj_t2 VALUES('2020-01-13 21:29:31');
CREATE TABLE obwmj_t3(d1 varchar(20));
CREATE TRIGGER obwmj_demo BEFORE INSERT ON obwmj_t2 FOR EACH ROW
BEGIN
INSERT INTO obwmj_t3 VALUES(new.c3);
END;
//
INSERT INTO obwmj_t2 VALUES ('1990-03-23 21:29:31');
SELECT * FROM obwmj_t3;
d1
1990-03-23 21:29:31
SELECT TRIGGER_NAME,TRIGGER_SCHEMA,EVENT_MANIPULATION,EVENT_OBJECT_SCHEMA,EVENT_OBJECT_TABLE,ACTION_ORDER FROM INFORMATION_SCHEMA.TRIGGERS WHERE TRIGGER_NAME='obwmj_demo';
TRIGGER_NAME	TRIGGER_SCHEMA	EVENT_MANIPULATION	EVENT_OBJECT_SCHEMA	EVENT_OBJECT_TABLE	ACTION_ORDER
obwmj_demo	obwmjtest	INSERT	obwmjtest	obwmj_t2	1
SELECT SQL_MODE,DEFINER,CHARACTER_SET_CLIENT,COLLATION_CONNECTION,DATABASE_COLLATION FROM INFORMATION_SCHEMA.TRIGGERS WHERE TRIGGER_NAME='obwmj_demo';
SQL_MODE	DEFINER	CHARACTER_SET_CLIENT	COLLATION_CONNECTION	DATABASE_COLLATION
	wmj456@%	utf8mb4	utf8mb4_general_ci	utf8mb4_general_ci
DROP TRIGGER obwmj_demo;
DROP TABLE `obwmj_t2`;
DROP TABLE obwmj_t3;
CREATE TABLE obwmj_t2(c3 timestamp);
INSERT INTO obwmj_t2 VALUES('2020-01-13 21:29:31');
CREATE TABLE obwmj_t3(d1 varchar(20));
CREATE DEFINER = 'TEST_AC'@'%' TRIGGER obwmj_demo BEFORE UPDATE ON obwmj_t2 FOR EACH ROW
BEGIN
SET NEW.C3='2022-01-13 21:29:31';
END;
//
TRUNCATE TABLE obwmj_t2;
INSERT INTO obwmj_t2 VALUES ('1990-03-23 21:29:31');
INSERT INTO obwmj_t2 VALUES ('1991-03-23 21:29:31');
UPDATE obwmj_t2 SET C3='2000-03-23 21:29:31' WHERE C3='1991-03-23 21:29:31';
SELECT * FROM obwmj_t2;
c3
1990-03-23 21:29:31
2022-01-13 21:29:31
SELECT TRIGGER_NAME,TRIGGER_SCHEMA,EVENT_MANIPULATION,EVENT_OBJECT_SCHEMA,EVENT_OBJECT_TABLE,ACTION_ORDER FROM INFORMATION_SCHEMA.TRIGGERS WHERE TRIGGER_NAME='obwmj_demo';
TRIGGER_NAME	TRIGGER_SCHEMA	EVENT_MANIPULATION	EVENT_OBJECT_SCHEMA	EVENT_OBJECT_TABLE	ACTION_ORDER
obwmj_demo	obwmjtest	UPDATE	obwmjtest	obwmj_t2	1
SELECT SQL_MODE,DEFINER,CHARACTER_SET_CLIENT,COLLATION_CONNECTION,DATABASE_COLLATION FROM INFORMATION_SCHEMA.TRIGGERS WHERE TRIGGER_NAME='obwmj_demo';
SQL_MODE	DEFINER	CHARACTER_SET_CLIENT	COLLATION_CONNECTION	DATABASE_COLLATION
	TEST_AC@%	utf8mb4	utf8mb4_general_ci	utf8mb4_general_ci
DROP TRIGGER obwmj_demo;
DROP TABLE `obwmj_t2`;
DROP TABLE obwmj_t3;
# Clean up users
DROP DATABASE obwmjtest;
DROP DATABASE obwmj_ac;
DROP USER wmj456@'%';
DROP USER TEST_AC@'%';
