result_format: 4
explain_protocol: 0
alter system set _rowsets_enabled=true tenant=sys;
alter system set _rowsets_enabled=true tenant=all_user;
alter system set _rowsets_enabled=true tenant=all_meta;
alter system set _rowsets_max_rows = 128 tenant=sys;
alter system set _rowsets_max_rows = 128 tenant=all_user;
alter system set _rowsets_max_rows = 128 tenant=all_meta;

drop table if exists t1;
drop table if exists t2;
create table t1 (c1 int primary key, c2 int, c3 int, c4 varchar(100));
insert into t1 (c1, c2, c3, c4) values
(1, 0, 1, 'abc1'), (2, 0, 0, 'abc2'), (3, 1, 1, 'abc3'), (4, 1, 1, 'abc4'), (5, 1, 0, 'abc5'), (6, 2, 1, 'abc6'), (7, 2, 1, 'abc7'), (8, 2, 0, 'abc8'), (9, 3, 1, 'abc9'), (10, 3, 1, 'abc10'), (11, 3, 0, 'abc11'), (12, 4, 1, 'abc12'), (13, 4, 1, 'abc13'), (14, 4, 0, 'abc14'), (15, 5, 1, 'abc15'), (16, 5, 1, 'abc16'), (17, 5, 0, 'abc17'), (18, 6, 1, 'abc18'), (19, 6, 1, 'abc19'), (20, 6, 0, 'abc20'), (21, 7, 1, 'abc21'), (22, 7, 1, 'abc22'), (23, 7, 0, 'abc23'), (24, 8, 1, 'abc24'), (25, 8, 1, 'abc25'), (26, 8, 0, 'abc26'), (27, 9, 1, 'abc27'), (28, 9, 1, 'abc28'), (29, 9, 0, 'abc29'), (30, 10, 1, 'abc30'), (31, 10, 1, 'abc31'), (32, 10, 0, 'abc32'), (33, 11, 1, 'abc33'), (34, 11, 1, 'abc34'), (35, 11, 0, 'abc35'), (36, 12, 1, 'abc36'), (37, 12, 1, 'abc37'), (38, 12, 0, 'abc38'), (39, 13, 1, 'abc39'), (40, 13, 1, 'abc40'), (41, 13, 0, 'abc41'), (42, 14, 1, 'abc42'), (43, 14, 1, 'abc43'), (44, 14, 0, 'abc44'), (45, 15, 1, 'abc45'), (46, 15, 1, 'abc46'), (47, 15, 0, 'abc47'), (48, 16, 1, 'abc48'), (49, 16, 1, 'abc49'), (50, 16, 0, 'abc50'), (51, 17, 1, 'abc51'), (52, 17, 1, 'abc52'), (53, 17, 0, 'abc53'), (54, 18, 1, 'abc54'), (55, 18, 1, 'abc55'), (56, 18, 0, 'abc56'), (57, 19, 1, 'abc57'), (58, 19, 1, 'abc58'), (59, 19, 0, 'abc59'), (60, 20, 1, 'abc60'), (61, 20, 1, 'abc61'), (62, 20, 0, 'abc62'), (63, 21, 1, 'abc63'), (64, 21, 1, 'abc64'), (65, 21, 0, 'abc65'), (66, 22, 1, 'abc66'), (67, 22, 1, 'abc67'), (68, 22, 0, 'abc68'), (69, 23, 1, 'abc69'), (70, 23, 1, 'abc70'), (71, 23, 0, 'abc71'), (72, 24, 1, 'abc72'), (73, 24, 1, 'abc73'), (74, 24, 0, 'abc74'), (75, 25, 1, 'abc75'), (76, 25, 1, 'abc76'), (77, 25, 0, 'abc77'), (78, 26, 1, 'abc78'), (79, 26, 1, 'abc79'), (80, 26, 0, 'abc80'), (81, 27, 1, 'abc81'), (82, 27, 1, 'abc82'), (83, 27, 0, 'abc83'), (84, 28, 1, 'abc84'), (85, 28, 1, 'abc85'), (86, 28, 0, 'abc86'), (87, 29, 1, 'abc87'), (88, 29, 1, 'abc88'), (89, 29, 0, 'abc89'), (90, 30, 1, 'abc90'), (91, 30, 1, 'abc91'), (92, 30, 0, 'abc92'), (93, 31, 1, 'abc93'), (94, 31, 1, 'abc94'), (95, 31, 0, 'abc95'), (96, 32, 1, 'abc96'), (97, 32, 1, 'abc97'), (98, 32, 0, 'abc98'), (99, 33, 1, 'abc99'), (100, 33, 1, 'abc100'), (101, 33, 0, 'abc101'), (102, 34, 1, 'abc102'), (103, 34, 1, 'abc103'), (104, 34, 0, 'abc104'), (105, 35, 1, 'abc105'), (106, 35, 1, 'abc106'), (107, 35, 0, 'abc107'), (108, 36, 1, 'abc108'), (109, 36, 1, 'abc109'), (110, 36, 0, 'abc110'), (111, 37, 1, 'abc111'), (112, 37, 1, 'abc112'), (113, 37, 0, 'abc113'), (114, 38, 1, 'abc114'), (115, 38, 1, 'abc115'), (116, 38, 0, 'abc116'), (117, 39, 1, 'abc117'), (118, 39, 1, 'abc118'), (119, 39, 0, 'abc119'), (120, 40, 1, 'abc120'), (121, 40, 1, 'abc121'), (122, 40, 0, 'abc122'), (123, 41, 1, 'abc123'), (124, 41, 1, 'abc124'), (125, 41, 0, 'abc125'), (126, 42, 1, 'abc126'), (127, 42, 1, 'abc127'), (128, 42, 0, 'abc128'), (129, 43, 1, 'abc129'), (130, 43, 1, 'abc130'), (131, 43, 0, 'abc131'), (132, 44, 1, 'abc132'), (133, 44, 1, 'abc133'), (134, 44, 0, 'abc134'), (135, 45, 1, 'abc135'), (136, 45, 1, 'abc136'), (137, 45, 0, 'abc137'), (138, 46, 1, 'abc138'), (139, 46, 1, 'abc139'), (140, 46, 0, 'abc140'), (141, 47, 1, 'abc141'), (142, 47, 1, 'abc142'), (143, 47, 0, 'abc143'), (144, 48, 1, 'abc144'), (145, 48, 1, 'abc145'), (146, 48, 0, 'abc146'), (147, 49, 1, 'abc147'), (148, 49, 1, 'abc148'), (149, 49, 0, 'abc149'), (150, 50, 1, 'abc150'), (151, 50, 1, 'abc151'), (152, 50, 0, 'abc152'), (153, 51, 1, 'abc153'), (154, 51, 1, 'abc154'), (155, 51, 0, 'abc155'), (156, 52, 1, 'abc156'), (157, 52, 1, 'abc157'), (158, 52, 0, 'abc158'), (159, 53, 1, 'abc159'), (160, 53, 1, 'abc160'), (161, 53, 0, 'abc161'), (162, 54, 1, 'abc162'), (163, 54, 1, 'abc163'), (164, 54, 0, 'abc164'), (165, 55, 1, 'abc165'), (166, 55, 1, 'abc166'), (167, 55, 0, 'abc167'), (168, 56, 1, 'abc168'), (169, 56, 1, 'abc169'), (170, 56, 0, 'abc170'), (171, 57, 1, 'abc171'), (172, 57, 1, 'abc172'), (173, 57, 0, 'abc173'), (174, 58, 1, 'abc174'), (175, 58, 1, 'abc175'), (176, 58, 0, 'abc176'), (177, 59, 1, 'abc177'), (178, 59, 1, 'abc178'), (179, 59, 0, 'abc179'), (180, 60, 1, 'abc180'), (181, 60, 1, 'abc181'), (182, 60, 0, 'abc182'), (183, 61, 1, 'abc183'), (184, 61, 1, 'abc184'), (185, 61, 0, 'abc185'), (186, 62, 1, 'abc186'), (187, 62, 1, 'abc187'), (188, 62, 0, 'abc188'), (189, 63, 1, 'abc189'), (190, 63, 1, 'abc190'), (191, 63, 0, 'abc191'), (192, 64, 1, 'abc192'), (193, 64, 1, 'abc193'), (194, 64, 0, 'abc194'), (195, 65, 1, 'abc195'), (196, 65, 1, 'abc196'), (197, 65, 0, 'abc197'), (198, 66, 1, 'abc198'), (199, 66, 1, 'abc199'), (200, 66, 0, 'abc200'), (201, 67, 1, 'abc201'), (202, 67, 1, 'abc202'), (203, 67, 0, 'abc203'), (204, 68, 1, 'abc204'), (205, 68, 1, 'abc205'), (206, 68, 0, 'abc206'), (207, 69, 1, 'abc207'), (208, 69, 1, 'abc208'), (209, 69, 0, 'abc209'), (210, 70, 1, 'abc210'), (211, 70, 1, 'abc211'), (212, 70, 0, 'abc212'), (213, 71, 1, 'abc213'), (214, 71, 1, 'abc214'), (215, 71, 0, 'abc215'), (216, 72, 1, 'abc216'), (217, 72, 1, 'abc217'), (218, 72, 0, 'abc218'), (219, 73, 1, 'abc219'), (220, 73, 1, 'abc220'), (221, 73, 0, 'abc221'), (222, 74, 1, 'abc222'), (223, 74, 1, 'abc223'), (224, 74, 0, 'abc224'), (225, 75, 1, 'abc225'), (226, 75, 1, 'abc226'), (227, 75, 0, 'abc227'), (228, 76, 1, 'abc228'), (229, 76, 1, 'abc229'), (230, 76, 0, 'abc230'), (231, 77, 1, 'abc231'), (232, 77, 1, 'abc232'), (233, 77, 0, 'abc233'), (234, 78, 1, 'abc234'), (235, 78, 1, 'abc235'), (236, 78, 0, 'abc236'), (237, 79, 1, 'abc237'), (238, 79, 1, 'abc238'), (239, 79, 0, 'abc239'), (240, 80, 1, 'abc240'), (241, 80, 1, 'abc241'), (242, 80, 0, 'abc242'), (243, 81, 1, 'abc243'), (244, 81, 1, 'abc244'), (245, 81, 0, 'abc245'), (246, 82, 1, 'abc246'), (247, 82, 1, 'abc247'), (248, 82, 0, 'abc248'), (249, 83, 1, 'abc249'), (250, 83, 1, 'abc250'), (251, 83, 0, 'abc251'), (252, 84, 1, 'abc252'), (253, 84, 1, 'abc253'), (254, 84, 0, 'abc254'), (255, 85, 1, 'abc255'), (256, 85, 1, 'abc256');

create table t2 (c1 int , c2 int, c3 int, c4 varchar(100), primary key (c1, c2)) partition by hash(c1) partitions 2;

insert into t2 (c1, c2, c3, c4) select c1, c2, c3, c4 from t1;

explain select * from t2;
Query Plan
=============================================================
|ID|OPERATOR                 |NAME    |EST.ROWS|EST.TIME(us)|
-------------------------------------------------------------
|0 |PX COORDINATOR           |        |256     |895         |
|1 |└─EXCHANGE OUT DISTR     |:EX10000|256     |628         |
|2 |  └─PX PARTITION ITERATOR|        |256     |28          |
|3 |    └─TABLE FULL SCAN    |t2      |256     |28          |
=============================================================
Outputs & filters:
-------------------------------------
  0 - output([INTERNAL_FUNCTION(t2.c1, t2.c2, t2.c3, t2.c4)]), filter(nil), rowset=128
  1 - output([INTERNAL_FUNCTION(t2.c1, t2.c2, t2.c3, t2.c4)]), filter(nil), rowset=128
      dop=1
  2 - output([t2.c1], [t2.c2], [t2.c3], [t2.c4]), filter(nil), rowset=128
      force partition granule
  3 - output([t2.c1], [t2.c2], [t2.c3], [t2.c4]), filter(nil), rowset=128
      access([t2.c1], [t2.c2], [t2.c3], [t2.c4]), partitions(p[0-1])
      is_index_back=false, is_global_index=false, 
      range_key([t2.c1], [t2.c2]), range(MIN,MIN ; MAX,MAX)always true
explain select /*+ parallel(2) */ * from t1;
Query Plan
=========================================================
|ID|OPERATOR             |NAME    |EST.ROWS|EST.TIME(us)|
---------------------------------------------------------
|0 |PX COORDINATOR       |        |256     |580         |
|1 |└─EXCHANGE OUT DISTR |:EX10000|256     |313         |
|2 |  └─PX BLOCK ITERATOR|        |256     |13          |
|3 |    └─TABLE FULL SCAN|t1      |256     |13          |
=========================================================
Outputs & filters:
-------------------------------------
  0 - output([INTERNAL_FUNCTION(t1.c1, t1.c2, t1.c3, t1.c4)]), filter(nil), rowset=128
  1 - output([INTERNAL_FUNCTION(t1.c1, t1.c2, t1.c3, t1.c4)]), filter(nil), rowset=128
      dop=2
  2 - output([t1.c1], [t1.c2], [t1.c3], [t1.c4]), filter(nil), rowset=128
  3 - output([t1.c1], [t1.c2], [t1.c3], [t1.c4]), filter(nil), rowset=128
      access([t1.c1], [t1.c2], [t1.c3], [t1.c4]), partitions(p0)
      is_index_back=false, is_global_index=false, 
      range_key([t1.c1]), range(MIN ; MAX)always true
select /*+ parallel(2) */ * from t1;
+-----+------+------+--------+
| c1  | c2   | c3   | c4     |
+-----+------+------+--------+
|   1 |    0 |    1 | abc1   |
|   2 |    0 |    0 | abc2   |
|   3 |    1 |    1 | abc3   |
|   4 |    1 |    1 | abc4   |
|   5 |    1 |    0 | abc5   |
|   6 |    2 |    1 | abc6   |
|   7 |    2 |    1 | abc7   |
|   8 |    2 |    0 | abc8   |
|   9 |    3 |    1 | abc9   |
|  10 |    3 |    1 | abc10  |
|  11 |    3 |    0 | abc11  |
|  12 |    4 |    1 | abc12  |
|  13 |    4 |    1 | abc13  |
|  14 |    4 |    0 | abc14  |
|  15 |    5 |    1 | abc15  |
|  16 |    5 |    1 | abc16  |
|  17 |    5 |    0 | abc17  |
|  18 |    6 |    1 | abc18  |
|  19 |    6 |    1 | abc19  |
|  20 |    6 |    0 | abc20  |
|  21 |    7 |    1 | abc21  |
|  22 |    7 |    1 | abc22  |
|  23 |    7 |    0 | abc23  |
|  24 |    8 |    1 | abc24  |
|  25 |    8 |    1 | abc25  |
|  26 |    8 |    0 | abc26  |
|  27 |    9 |    1 | abc27  |
|  28 |    9 |    1 | abc28  |
|  29 |    9 |    0 | abc29  |
|  30 |   10 |    1 | abc30  |
|  31 |   10 |    1 | abc31  |
|  32 |   10 |    0 | abc32  |
|  33 |   11 |    1 | abc33  |
|  34 |   11 |    1 | abc34  |
|  35 |   11 |    0 | abc35  |
|  36 |   12 |    1 | abc36  |
|  37 |   12 |    1 | abc37  |
|  38 |   12 |    0 | abc38  |
|  39 |   13 |    1 | abc39  |
|  40 |   13 |    1 | abc40  |
|  41 |   13 |    0 | abc41  |
|  42 |   14 |    1 | abc42  |
|  43 |   14 |    1 | abc43  |
|  44 |   14 |    0 | abc44  |
|  45 |   15 |    1 | abc45  |
|  46 |   15 |    1 | abc46  |
|  47 |   15 |    0 | abc47  |
|  48 |   16 |    1 | abc48  |
|  49 |   16 |    1 | abc49  |
|  50 |   16 |    0 | abc50  |
|  51 |   17 |    1 | abc51  |
|  52 |   17 |    1 | abc52  |
|  53 |   17 |    0 | abc53  |
|  54 |   18 |    1 | abc54  |
|  55 |   18 |    1 | abc55  |
|  56 |   18 |    0 | abc56  |
|  57 |   19 |    1 | abc57  |
|  58 |   19 |    1 | abc58  |
|  59 |   19 |    0 | abc59  |
|  60 |   20 |    1 | abc60  |
|  61 |   20 |    1 | abc61  |
|  62 |   20 |    0 | abc62  |
|  63 |   21 |    1 | abc63  |
|  64 |   21 |    1 | abc64  |
|  65 |   21 |    0 | abc65  |
|  66 |   22 |    1 | abc66  |
|  67 |   22 |    1 | abc67  |
|  68 |   22 |    0 | abc68  |
|  69 |   23 |    1 | abc69  |
|  70 |   23 |    1 | abc70  |
|  71 |   23 |    0 | abc71  |
|  72 |   24 |    1 | abc72  |
|  73 |   24 |    1 | abc73  |
|  74 |   24 |    0 | abc74  |
|  75 |   25 |    1 | abc75  |
|  76 |   25 |    1 | abc76  |
|  77 |   25 |    0 | abc77  |
|  78 |   26 |    1 | abc78  |
|  79 |   26 |    1 | abc79  |
|  80 |   26 |    0 | abc80  |
|  81 |   27 |    1 | abc81  |
|  82 |   27 |    1 | abc82  |
|  83 |   27 |    0 | abc83  |
|  84 |   28 |    1 | abc84  |
|  85 |   28 |    1 | abc85  |
|  86 |   28 |    0 | abc86  |
|  87 |   29 |    1 | abc87  |
|  88 |   29 |    1 | abc88  |
|  89 |   29 |    0 | abc89  |
|  90 |   30 |    1 | abc90  |
|  91 |   30 |    1 | abc91  |
|  92 |   30 |    0 | abc92  |
|  93 |   31 |    1 | abc93  |
|  94 |   31 |    1 | abc94  |
|  95 |   31 |    0 | abc95  |
|  96 |   32 |    1 | abc96  |
|  97 |   32 |    1 | abc97  |
|  98 |   32 |    0 | abc98  |
|  99 |   33 |    1 | abc99  |
| 100 |   33 |    1 | abc100 |
| 101 |   33 |    0 | abc101 |
| 102 |   34 |    1 | abc102 |
| 103 |   34 |    1 | abc103 |
| 104 |   34 |    0 | abc104 |
| 105 |   35 |    1 | abc105 |
| 106 |   35 |    1 | abc106 |
| 107 |   35 |    0 | abc107 |
| 108 |   36 |    1 | abc108 |
| 109 |   36 |    1 | abc109 |
| 110 |   36 |    0 | abc110 |
| 111 |   37 |    1 | abc111 |
| 112 |   37 |    1 | abc112 |
| 113 |   37 |    0 | abc113 |
| 114 |   38 |    1 | abc114 |
| 115 |   38 |    1 | abc115 |
| 116 |   38 |    0 | abc116 |
| 117 |   39 |    1 | abc117 |
| 118 |   39 |    1 | abc118 |
| 119 |   39 |    0 | abc119 |
| 120 |   40 |    1 | abc120 |
| 121 |   40 |    1 | abc121 |
| 122 |   40 |    0 | abc122 |
| 123 |   41 |    1 | abc123 |
| 124 |   41 |    1 | abc124 |
| 125 |   41 |    0 | abc125 |
| 126 |   42 |    1 | abc126 |
| 127 |   42 |    1 | abc127 |
| 128 |   42 |    0 | abc128 |
| 129 |   43 |    1 | abc129 |
| 130 |   43 |    1 | abc130 |
| 131 |   43 |    0 | abc131 |
| 132 |   44 |    1 | abc132 |
| 133 |   44 |    1 | abc133 |
| 134 |   44 |    0 | abc134 |
| 135 |   45 |    1 | abc135 |
| 136 |   45 |    1 | abc136 |
| 137 |   45 |    0 | abc137 |
| 138 |   46 |    1 | abc138 |
| 139 |   46 |    1 | abc139 |
| 140 |   46 |    0 | abc140 |
| 141 |   47 |    1 | abc141 |
| 142 |   47 |    1 | abc142 |
| 143 |   47 |    0 | abc143 |
| 144 |   48 |    1 | abc144 |
| 145 |   48 |    1 | abc145 |
| 146 |   48 |    0 | abc146 |
| 147 |   49 |    1 | abc147 |
| 148 |   49 |    1 | abc148 |
| 149 |   49 |    0 | abc149 |
| 150 |   50 |    1 | abc150 |
| 151 |   50 |    1 | abc151 |
| 152 |   50 |    0 | abc152 |
| 153 |   51 |    1 | abc153 |
| 154 |   51 |    1 | abc154 |
| 155 |   51 |    0 | abc155 |
| 156 |   52 |    1 | abc156 |
| 157 |   52 |    1 | abc157 |
| 158 |   52 |    0 | abc158 |
| 159 |   53 |    1 | abc159 |
| 160 |   53 |    1 | abc160 |
| 161 |   53 |    0 | abc161 |
| 162 |   54 |    1 | abc162 |
| 163 |   54 |    1 | abc163 |
| 164 |   54 |    0 | abc164 |
| 165 |   55 |    1 | abc165 |
| 166 |   55 |    1 | abc166 |
| 167 |   55 |    0 | abc167 |
| 168 |   56 |    1 | abc168 |
| 169 |   56 |    1 | abc169 |
| 170 |   56 |    0 | abc170 |
| 171 |   57 |    1 | abc171 |
| 172 |   57 |    1 | abc172 |
| 173 |   57 |    0 | abc173 |
| 174 |   58 |    1 | abc174 |
| 175 |   58 |    1 | abc175 |
| 176 |   58 |    0 | abc176 |
| 177 |   59 |    1 | abc177 |
| 178 |   59 |    1 | abc178 |
| 179 |   59 |    0 | abc179 |
| 180 |   60 |    1 | abc180 |
| 181 |   60 |    1 | abc181 |
| 182 |   60 |    0 | abc182 |
| 183 |   61 |    1 | abc183 |
| 184 |   61 |    1 | abc184 |
| 185 |   61 |    0 | abc185 |
| 186 |   62 |    1 | abc186 |
| 187 |   62 |    1 | abc187 |
| 188 |   62 |    0 | abc188 |
| 189 |   63 |    1 | abc189 |
| 190 |   63 |    1 | abc190 |
| 191 |   63 |    0 | abc191 |
| 192 |   64 |    1 | abc192 |
| 193 |   64 |    1 | abc193 |
| 194 |   64 |    0 | abc194 |
| 195 |   65 |    1 | abc195 |
| 196 |   65 |    1 | abc196 |
| 197 |   65 |    0 | abc197 |
| 198 |   66 |    1 | abc198 |
| 199 |   66 |    1 | abc199 |
| 200 |   66 |    0 | abc200 |
| 201 |   67 |    1 | abc201 |
| 202 |   67 |    1 | abc202 |
| 203 |   67 |    0 | abc203 |
| 204 |   68 |    1 | abc204 |
| 205 |   68 |    1 | abc205 |
| 206 |   68 |    0 | abc206 |
| 207 |   69 |    1 | abc207 |
| 208 |   69 |    1 | abc208 |
| 209 |   69 |    0 | abc209 |
| 210 |   70 |    1 | abc210 |
| 211 |   70 |    1 | abc211 |
| 212 |   70 |    0 | abc212 |
| 213 |   71 |    1 | abc213 |
| 214 |   71 |    1 | abc214 |
| 215 |   71 |    0 | abc215 |
| 216 |   72 |    1 | abc216 |
| 217 |   72 |    1 | abc217 |
| 218 |   72 |    0 | abc218 |
| 219 |   73 |    1 | abc219 |
| 220 |   73 |    1 | abc220 |
| 221 |   73 |    0 | abc221 |
| 222 |   74 |    1 | abc222 |
| 223 |   74 |    1 | abc223 |
| 224 |   74 |    0 | abc224 |
| 225 |   75 |    1 | abc225 |
| 226 |   75 |    1 | abc226 |
| 227 |   75 |    0 | abc227 |
| 228 |   76 |    1 | abc228 |
| 229 |   76 |    1 | abc229 |
| 230 |   76 |    0 | abc230 |
| 231 |   77 |    1 | abc231 |
| 232 |   77 |    1 | abc232 |
| 233 |   77 |    0 | abc233 |
| 234 |   78 |    1 | abc234 |
| 235 |   78 |    1 | abc235 |
| 236 |   78 |    0 | abc236 |
| 237 |   79 |    1 | abc237 |
| 238 |   79 |    1 | abc238 |
| 239 |   79 |    0 | abc239 |
| 240 |   80 |    1 | abc240 |
| 241 |   80 |    1 | abc241 |
| 242 |   80 |    0 | abc242 |
| 243 |   81 |    1 | abc243 |
| 244 |   81 |    1 | abc244 |
| 245 |   81 |    0 | abc245 |
| 246 |   82 |    1 | abc246 |
| 247 |   82 |    1 | abc247 |
| 248 |   82 |    0 | abc248 |
| 249 |   83 |    1 | abc249 |
| 250 |   83 |    1 | abc250 |
| 251 |   83 |    0 | abc251 |
| 252 |   84 |    1 | abc252 |
| 253 |   84 |    1 | abc253 |
| 254 |   84 |    0 | abc254 |
| 255 |   85 |    1 | abc255 |
| 256 |   85 |    1 | abc256 |
+-----+------+------+--------+

update t2 set c3 = 1;

explain select c3, sum(c1) from t2 group by c3;
Query Plan
=====================================================================
|ID|OPERATOR                         |NAME    |EST.ROWS|EST.TIME(us)|
---------------------------------------------------------------------
|0 |PX COORDINATOR                   |        |100     |364         |
|1 |└─EXCHANGE OUT DISTR             |:EX10001|100     |322         |
|2 |  └─HASH GROUP BY                |        |100     |228         |
|3 |    └─EXCHANGE IN DISTR          |        |100     |197         |
|4 |      └─EXCHANGE OUT DISTR (HASH)|:EX10000|100     |155         |
|5 |        └─HASH GROUP BY          |        |100     |61          |
|6 |          └─PX PARTITION ITERATOR|        |256     |17          |
|7 |            └─TABLE FULL SCAN    |t2      |256     |17          |
=====================================================================
Outputs & filters:
-------------------------------------
  0 - output([INTERNAL_FUNCTION(t2.c3, T_FUN_SUM(T_FUN_SUM(t2.c1)))]), filter(nil), rowset=128
  1 - output([INTERNAL_FUNCTION(t2.c3, T_FUN_SUM(T_FUN_SUM(t2.c1)))]), filter(nil), rowset=128
      dop=1
  2 - output([t2.c3], [T_FUN_SUM(T_FUN_SUM(t2.c1))]), filter(nil), rowset=128
      group([t2.c3]), agg_func([T_FUN_SUM(T_FUN_SUM(t2.c1))])
  3 - output([t2.c3], [T_FUN_SUM(t2.c1)]), filter(nil), rowset=128
  4 - output([t2.c3], [T_FUN_SUM(t2.c1)]), filter(nil), rowset=128
      (#keys=1, [t2.c3]), dop=1
  5 - output([t2.c3], [T_FUN_SUM(t2.c1)]), filter(nil), rowset=128
      group([t2.c3]), agg_func([T_FUN_SUM(t2.c1)])
  6 - output([t2.c1], [t2.c3]), filter(nil), rowset=128
      force partition granule
  7 - output([t2.c1], [t2.c3]), filter(nil), rowset=128
      access([t2.c1], [t2.c3]), partitions(p[0-1])
      is_index_back=false, is_global_index=false, 
      range_key([t2.c1], [t2.c2]), range(MIN,MIN ; MAX,MAX)always true
select /*+ paralle(2)*/ c3, sum(c1) from t2 group by c3;
+------+---------+
| c3   | sum(c1) |
+------+---------+
|    1 |   32896 |
+------+---------+
select /*+ paralle(2)*/ c3, sum(c1) from t2 group by c3;
+------+---------+
| c3   | sum(c1) |
+------+---------+
|    1 |   32896 |
+------+---------+

drop table if exists t1;
drop table if exists t2;
alter system set _rowsets_max_rows = 256 tenant=sys;
alter system set _rowsets_max_rows = 256 tenant=all_user;
alter system set _rowsets_max_rows = 256 tenant=all_meta;
