alter system set _enable_values_table_folding=false;
select distinct name, value from __all_virtual_sys_parameter_stat where name like '%enable_values_table_folding%';
name	value
_enable_values_table_folding	False
result_format: 4
alter system flush plan cache global;

values row(1);
+----------+
| column_0 |
+----------+
|        1 |
+----------+
values row('a');
+----------+
| column_0 |
+----------+
| a        |
+----------+

values row(1), row(2), row(3);
+----------+
| column_0 |
+----------+
|        1 |
|        2 |
|        3 |
+----------+
values row('a'), row('b'), row('c');
+----------+
| column_0 |
+----------+
| a        |
| b        |
| c        |
+----------+

values row('a',   -2), row('cc',   3), row('dd', 4);
+----------+----------+
| column_0 | column_1 |
+----------+----------+
| a        |       -2 |
| cc       |        3 |
| dd       |        4 |
+----------+----------+
values row(2, 'a'), row(3, 'cc'), row(4, 'dd');
+----------+----------+
| column_0 | column_1 |
+----------+----------+
|        2 | a        |
|        3 | cc       |
|        4 | dd       |
+----------+----------+

values row('a',   -2), row('cc',   3), row('dd', 4) order by 1;
+----------+----------+
| column_0 | column_1 |
+----------+----------+
| a        |       -2 |
| cc       |        3 |
| dd       |        4 |
+----------+----------+

values row(1, -2, date'2000-12-01'), row(5, 7, date'2019-12-01'), row(4, 6, date'2020-11-01');
+----------+----------+------------+
| column_0 | column_1 | column_2   |
+----------+----------+------------+
|        1 |       -2 | 2000-12-01 |
|        5 |        7 | 2019-12-01 |
|        4 |        6 | 2020-11-01 |
+----------+----------+------------+
values row(1, -2, date'2000-12-01'), row(5, 7, date'2019-12-01'), row(4, 6, date'2020-11-01') limit 1;
+----------+----------+------------+
| column_0 | column_1 | column_2   |
+----------+----------+------------+
|        1 |       -2 | 2000-12-01 |
+----------+----------+------------+
values row(1, -2, date'2000-12-01'), row(5, 7, date'2019-12-01'), row(4, 6, date'2020-11-01') order by 1 limit 1;
+----------+----------+------------+
| column_0 | column_1 | column_2   |
+----------+----------+------------+
|        1 |       -2 | 2000-12-01 |
+----------+----------+------------+

values row(1, -2, 'oceanbase'), row('a', 5, '蚂蚁集团'), row('222asda', 8, date'2020-12-01');
+----------+----------+--------------+
| column_0 | column_1 | column_2     |
+----------+----------+--------------+
| 1        |       -2 | oceanbase    |
| a        |        5 | 蚂蚁集团     |
| 222asda  |        8 | 2020-12-01   |
+----------+----------+--------------+

select distinct statement, sql_id, param_infos from oceanbase.GV$OB_PLAN_CACHE_PLAN_STAT where statement like '%values row%';
+--------------------------------------------------------------------+----------------------------------+----------------------------------------------------------------------------------------------------------------------------+
| statement                                                          | sql_id                           | param_infos                                                                                                                |
+--------------------------------------------------------------------+----------------------------------+----------------------------------------------------------------------------------------------------------------------------+
| values row(?)                                                      | E9745AD9A2D981FFEBE8C68AF6BACA42 | {1,0,0,0,5}                                                                                                                |
| values row(?)                                                      | E9745AD9A2D981FFEBE8C68AF6BACA42 | {1,0,0,-1,22}                                                                                                              |
| values row(?), row(?), row(?)                                      | D355216BA30B1351C9B152C7AE4F647C | {1,0,0,0,5},{1,0,0,0,5},{1,0,0,0,5}                                                                                        |
| values row(?), row(?), row(?)                                      | D355216BA30B1351C9B152C7AE4F647C | {1,0,0,-1,22},{1,0,0,-1,22},{1,0,0,-1,22}                                                                                  |
| values row(?,   ?), row(?,   ?), row(?, ?)                         | EE4349014DF5605746C83E6984781843 | {1,0,0,-1,22},{1,0,0,0,5},{1,0,0,-1,22},{1,0,0,0,5},{1,0,0,-1,22},{1,0,0,0,5}                                              |
| values row(?, ?), row(?, ?), row(?, ?)                             | D6AF939DCB6AAEBA1CF594F4A661FD7B | {1,0,0,0,5},{1,0,0,-1,22},{1,0,0,0,5},{1,0,0,-1,22},{1,0,0,0,5},{1,0,0,-1,22}                                              |
| values row(?,   ?), row(?,   ?), row(?, ?) order by 1              | C0DD9305108C61B79F77C3CA7C1E15F0 | {1,0,0,-1,22},{1,0,0,0,5},{1,0,0,-1,22},{1,0,0,0,5},{1,0,0,-1,22},{1,0,0,0,5}                                              |
| values row(?, ?, ?), row(?, ?, ?), row(?, ?, ?)                    | 9BEF31A02985C65DAC5A3DC18B812010 | {1,0,0,0,5},{1,0,0,0,5},{1,0,0,0,41},{1,0,0,0,5},{1,0,0,0,5},{1,0,0,0,41},{1,0,0,0,5},{1,0,0,0,5},{1,0,0,0,41}             |
| values row(?, ?, ?), row(?, ?, ?), row(?, ?, ?) limit ?            | 7A53E58F042863D74B4B4AF61AB81B6C | {1,0,0,0,5},{1,0,0,0,5},{1,0,0,0,41},{1,0,0,0,5},{1,0,0,0,5},{1,0,0,0,41},{1,0,0,0,5},{1,0,0,0,5},{1,0,0,0,41},{1,0,0,0,5} |
| values row(?, ?, ?), row(?, ?, ?), row(?, ?, ?) order by 1 limit ? | 25873ED2EBEDDF07FF739274BE35A701 | {1,0,0,0,5},{1,0,0,0,5},{1,0,0,0,41},{1,0,0,0,5},{1,0,0,0,5},{1,0,0,0,41},{1,0,0,0,5},{1,0,0,0,5},{1,0,0,0,41},{1,0,0,0,5} |
| values row(?, ?, ?), row(?, ?, ?), row(?, ?, ?)                    | 9BEF31A02985C65DAC5A3DC18B812010 | {1,0,0,0,5},{1,0,0,0,5},{1,0,0,-1,22},{1,0,0,-1,22},{1,0,0,0,5},{1,0,0,-1,22},{1,0,0,-1,22},{1,0,0,0,5},{1,0,0,0,41}       |
+--------------------------------------------------------------------+----------------------------------+----------------------------------------------------------------------------------------------------------------------------+

values row('a',   2), row('caaac',3), row('ddaaaaaa', 4), row('112', 5);
+----------+----------+
| column_0 | column_1 |
+----------+----------+
| a        |        2 |
| caaac    |        3 |
| ddaaaaaa |        4 |
| 112      |        5 |
+----------+----------+
values row('a',   2), row('caaac',3), row('ddaaaaaa', 4), row('112', 5) order by 1;
+----------+----------+
| column_0 | column_1 |
+----------+----------+
| 112      |        5 |
| a        |        2 |
| caaac    |        3 |
| ddaaaaaa |        4 |
+----------+----------+

values row(1, 2, date'2000-11-01'), row(4, 5, date'2011-12-01'), row(7, 8, date'2000-12-21');
+----------+----------+------------+
| column_0 | column_1 | column_2   |
+----------+----------+------------+
|        1 |        2 | 2000-11-01 |
|        4 |        5 | 2011-12-01 |
|        7 |        8 | 2000-12-21 |
+----------+----------+------------+
values row(1, 2, date'2000-11-01'), row(4, 5, date'2011-12-01'), row(7, 8, date'2000-12-21') limit 1;
+----------+----------+------------+
| column_0 | column_1 | column_2   |
+----------+----------+------------+
|        1 |        2 | 2000-11-01 |
+----------+----------+------------+
values row(1, 2, date'2000-11-01'), row(4, 5, date'2011-12-01'), row(7, 8, date'2000-12-21') order by 1 limit 1;
+----------+----------+------------+
| column_0 | column_1 | column_2   |
+----------+----------+------------+
|        1 |        2 | 2000-11-01 |
+----------+----------+------------+

select distinct statement, sql_id, param_infos from oceanbase.GV$OB_PLAN_CACHE_PLAN_STAT where statement like '%values row%';
+--------------------------------------------------------------------+----------------------------------+----------------------------------------------------------------------------------------------------------------------------+
| statement                                                          | sql_id                           | param_infos                                                                                                                |
+--------------------------------------------------------------------+----------------------------------+----------------------------------------------------------------------------------------------------------------------------+
| values row(?)                                                      | E9745AD9A2D981FFEBE8C68AF6BACA42 | {1,0,0,0,5}                                                                                                                |
| values row(?)                                                      | E9745AD9A2D981FFEBE8C68AF6BACA42 | {1,0,0,-1,22}                                                                                                              |
| values row(?), row(?), row(?)                                      | D355216BA30B1351C9B152C7AE4F647C | {1,0,0,0,5},{1,0,0,0,5},{1,0,0,0,5}                                                                                        |
| values row(?), row(?), row(?)                                      | D355216BA30B1351C9B152C7AE4F647C | {1,0,0,-1,22},{1,0,0,-1,22},{1,0,0,-1,22}                                                                                  |
| values row(?,   ?), row(?,   ?), row(?, ?)                         | EE4349014DF5605746C83E6984781843 | {1,0,0,-1,22},{1,0,0,0,5},{1,0,0,-1,22},{1,0,0,0,5},{1,0,0,-1,22},{1,0,0,0,5}                                              |
| values row(?, ?), row(?, ?), row(?, ?)                             | D6AF939DCB6AAEBA1CF594F4A661FD7B | {1,0,0,0,5},{1,0,0,-1,22},{1,0,0,0,5},{1,0,0,-1,22},{1,0,0,0,5},{1,0,0,-1,22}                                              |
| values row(?,   ?), row(?,   ?), row(?, ?) order by 1              | C0DD9305108C61B79F77C3CA7C1E15F0 | {1,0,0,-1,22},{1,0,0,0,5},{1,0,0,-1,22},{1,0,0,0,5},{1,0,0,-1,22},{1,0,0,0,5}                                              |
| values row(?, ?, ?), row(?, ?, ?), row(?, ?, ?)                    | 9BEF31A02985C65DAC5A3DC18B812010 | {1,0,0,0,5},{1,0,0,0,5},{1,0,0,0,41},{1,0,0,0,5},{1,0,0,0,5},{1,0,0,0,41},{1,0,0,0,5},{1,0,0,0,5},{1,0,0,0,41}             |
| values row(?, ?, ?), row(?, ?, ?), row(?, ?, ?) limit ?            | 7A53E58F042863D74B4B4AF61AB81B6C | {1,0,0,0,5},{1,0,0,0,5},{1,0,0,0,41},{1,0,0,0,5},{1,0,0,0,5},{1,0,0,0,41},{1,0,0,0,5},{1,0,0,0,5},{1,0,0,0,41},{1,0,0,0,5} |
| values row(?, ?, ?), row(?, ?, ?), row(?, ?, ?) order by 1 limit ? | 25873ED2EBEDDF07FF739274BE35A701 | {1,0,0,0,5},{1,0,0,0,5},{1,0,0,0,41},{1,0,0,0,5},{1,0,0,0,5},{1,0,0,0,41},{1,0,0,0,5},{1,0,0,0,5},{1,0,0,0,41},{1,0,0,0,5} |
| values row(?, ?, ?), row(?, ?, ?), row(?, ?, ?)                    | 9BEF31A02985C65DAC5A3DC18B812010 | {1,0,0,0,5},{1,0,0,0,5},{1,0,0,-1,22},{1,0,0,-1,22},{1,0,0,0,5},{1,0,0,-1,22},{1,0,0,-1,22},{1,0,0,0,5},{1,0,0,0,41}       |
| values row(?,   ?), row(?,?), row(?, ?), row(?, ?)                 | 94112A9DDB2636F0C1EC54A81D9D3A3A | {1,0,0,-1,22},{1,0,0,0,5},{1,0,0,-1,22},{1,0,0,0,5},{1,0,0,-1,22},{1,0,0,0,5},{1,0,0,-1,22},{1,0,0,0,5}                    |
| values row(?,   ?), row(?,?), row(?, ?), row(?, ?) order by 1      | 52CDC4892F44FB1179707B64E913BC4A | {1,0,0,-1,22},{1,0,0,0,5},{1,0,0,-1,22},{1,0,0,0,5},{1,0,0,-1,22},{1,0,0,0,5},{1,0,0,-1,22},{1,0,0,0,5}                    |
+--------------------------------------------------------------------+----------------------------------+----------------------------------------------------------------------------------------------------------------------------+

alter system flush plan cache global;
select 1 from (values row(2)) v1 union all select 3 from (values row(4,5,6), row(7,8,1000)) v2 order by 1;
+------+
| 1    |
+------+
|    1 |
|    3 |
|    3 |
+------+
select 3 from (values row(44)) v1 union all select 55 from (values row(66,77,88), row(99,100,111)) v2 order by 1;
+------+
| 3    |
+------+
|    3 |
|   55 |
|   55 |
+------+

select 1 from (values row(77,   88 , 99), row(0,-1,-2)) v1 union all select 3 from (values row(4,5,6), row(7,8,1000)) v2 order by 1;
+------+
| 1    |
+------+
|    1 |
|    1 |
|    3 |
|    3 |
+------+
select 3 from (values row(111,   1 , 2), row(-1, -2, 0)) v1 union all select 55 from (values row(66,77,88), row(99,100,111)) v2 order by 1;
+------+
| 3    |
+------+
|    3 |
|    3 |
|   55 |
|   55 |
+------+

select distinct statement, sql_id, param_infos from oceanbase.GV$OB_PLAN_CACHE_PLAN_STAT where statement like '%values row%';
+-------------------------------------------------------------------------------------------------------------------------------+----------------------------------+-------------------------------------------------------------------------------------------------------------------------------------------------------------------------+
| statement                                                                                                                     | sql_id                           | param_infos                                                                                                                                                             |
+-------------------------------------------------------------------------------------------------------------------------------+----------------------------------+-------------------------------------------------------------------------------------------------------------------------------------------------------------------------+
| select ? from (values row(?)) v1 union all select ? from (values row(?,?,?), row(?,?,?)) v2 order by 1                        | 996DAAC9C0021CA9F3CF47AEB788E543 | {1,0,0,0,5},{1,0,0,0,5},{1,0,0,0,5},{1,0,0,0,5},{1,0,0,0,5},{1,0,0,0,5},{1,0,0,0,5},{1,0,0,0,5},{1,0,0,0,5}                                                             |
| select ? from (values row(?,   ? , ?), row(?,?,?)) v1 union all select ? from (values row(?,?,?), row(?,?,?)) v2 order by 1   | D2532CB999BB126F35D4C6F0C39B0951 | {1,0,0,0,5},{1,0,0,0,5},{1,0,0,0,5},{1,0,0,0,5},{1,0,0,0,5},{1,0,0,0,5},{1,0,0,0,5},{1,0,0,0,5},{1,0,0,0,5},{1,0,0,0,5},{1,0,0,0,5},{1,0,0,0,5},{1,0,0,0,5},{1,0,0,0,5} |
| select ? from (values row(?,   ? , ?), row(?, ?, ?)) v1 union all select ? from (values row(?,?,?), row(?,?,?)) v2 order by 1 | D3C0541574D864EF8D5C34B52259EFE9 | {1,0,0,0,5},{1,0,0,0,5},{1,0,0,0,5},{1,0,0,0,5},{1,0,0,0,5},{1,0,0,0,5},{1,0,0,0,5},{1,0,0,0,5},{1,0,0,0,5},{1,0,0,0,5},{1,0,0,0,5},{1,0,0,0,5},{1,0,0,0,5},{1,0,0,0,5} |
+-------------------------------------------------------------------------------------------------------------------------------+----------------------------------+-------------------------------------------------------------------------------------------------------------------------------------------------------------------------+

drop table if exists test1, t1, test2;
create table test1(c1 int, c2 varchar(20));
insert into test1 values row(1,'a'), row(2,'b');
insert into test1 values row(3,3), row(4,4);
insert into test1 values row(5,'e'), row(6,'f');
insert into test1 values row(7,'g'), row(8,'h') order by column_0 limit 1;
insert into test1 values row(9,9), row(10,10) order by column_0 limit 1;
insert into test1 values row(11,'k'), row(12,'k') order by column_0 limit 1;
select distinct statement, sql_id, param_infos from oceanbase.GV$OB_PLAN_CACHE_PLAN_STAT where statement like '%insert into test1 values%';
+-----------------------------------------------------------------------+----------------------------------+-----------------------------------------------------------------+
| statement                                                             | sql_id                           | param_infos                                                     |
+-----------------------------------------------------------------------+----------------------------------+-----------------------------------------------------------------+
| insert into test1 values row(?,?), row(?,?)                           | 31890DCFB45FE5B1F9AED09A01E19379 | {0,0,0,0,5},{0,0,0,-1,22},{0,0,0,0,5},{0,0,0,-1,22}             |
| insert into test1 values row(?,?), row(?,?) order by column_0 limit ? | BAE02163768F8EB0AB33A329A252950C | {0,0,0,0,5},{0,0,0,-1,22},{0,0,0,0,5},{0,0,0,-1,22},{1,0,0,0,5} |
+-----------------------------------------------------------------------+----------------------------------+-----------------------------------------------------------------+
select * from test1;
+------+------+
| c1   | c2   |
+------+------+
|    1 | a    |
|    2 | b    |
|    3 | 3    |
|    4 | 4    |
|    5 | e    |
|    6 | f    |
|    7 | g    |
|    9 | 9    |
|   11 | k    |
+------+------+

update test1 set c1 = (VALUES ROW(1));
update test1 set c2 = (VALUES ROW(100)) where c1 in (VALUES ROW(1), ROW(2), ROW(100));
update test1 set c2 = (VALUES ROW(1000)) where c1 in (VALUES ROW('1'), ROW('2'), ROW('1000'));

CREATE TABLE test2 (
col_datetime datetime,
col_float_10_5 float(10,5),
pk int not null,
col_double double,
col_varchar_20 varchar(20),
col_decimal_20_0 decimal(20,0),
col_bigint bigint,
/*Indices*/
primary key (pk) ) PARTITION BY range(pk)(partition p1 values less than(50),partition p2 values less than(maxvalue));

INSERT INTO test2 VALUES
('2007-06-14 20:46:11', 0, 1, NULL, '', 0, 7164382582216327168),
('2003-10-18 14:12:04', NULL, 2, 0, 'h',8, 0),
('2009-06-19 08:53:38', 0, 3, 0, 'yeah', 9, 0),
(NULL, 0, 4, NULL, 'c', 0, 20588),
(NULL, 0, 5, 0, 'mubhvq', 0, NULL),
('2007-02-07 04:14:59', -123, 6, 7, 'p', 0, 8),
(NULL, 91, 7, 5, 'v', -19473, 0),
('2002-07-21 22:27:07', -4328, 8, 0, 'x', 3, 11795),
('2002-02-23 08:12:44', NULL, 9, 9, 'amubhvqxrmkfnkwngd', 0, NULL),
(NULL, 1, 10, NULL, 'got', 25301, 124);

SELECT * FROM test2, (VALUES ROW(9,9,4,2,4,0), ROW(0,9,5,0,3,9), ROW(7,6,3,0,6,4)) AS t2(c1,c2,c3,c4,c5,c6) where test2.pk=t2.c3;
+---------------------+----------------+----+------------+----------------+------------------+------------+----+----+----+----+----+----+
| col_datetime        | col_float_10_5 | pk | col_double | col_varchar_20 | col_decimal_20_0 | col_bigint | c1 | c2 | c3 | c4 | c5 | c6 |
+---------------------+----------------+----+------------+----------------+------------------+------------+----+----+----+----+----+----+
| 2009-06-19 08:53:38 |        0.00000 |  3 |          0 | yeah           |                9 |          0 |  7 |  6 |  3 |  0 |  6 |  4 |
| NULL                |        0.00000 |  4 |       NULL | c              |                0 |      20588 |  9 |  9 |  4 |  2 |  4 |  0 |
| NULL                |        0.00000 |  5 |          0 | mubhvq         |                0 |       NULL |  0 |  9 |  5 |  0 |  3 |  9 |
+---------------------+----------------+----+------------+----------------+------------------+------------+----+----+----+----+----+----+
SELECT * FROM test2, (VALUES ROW(9,9,4,2,4,0), ROW(0,9,5,0,3,9)) AS t2(c1,c2,c3,c4,c5,c6) where test2.pk=t2.c3;
+--------------+----------------+----+------------+----------------+------------------+------------+----+----+----+----+----+----+
| col_datetime | col_float_10_5 | pk | col_double | col_varchar_20 | col_decimal_20_0 | col_bigint | c1 | c2 | c3 | c4 | c5 | c6 |
+--------------+----------------+----+------------+----------------+------------------+------------+----+----+----+----+----+----+
| NULL         |        0.00000 |  4 |       NULL | c              |                0 |      20588 |  9 |  9 |  4 |  2 |  4 |  0 |
| NULL         |        0.00000 |  5 |          0 | mubhvq         |                0 |       NULL |  0 |  9 |  5 |  0 |  3 |  9 |
+--------------+----------------+----+------------+----------------+------------------+------------+----+----+----+----+----+----+
SELECT * FROM test2, (VALUES ROW(9,9,4,2,4,0), ROW(0,9,5,0,3,9), ROW(7,6,3,0,6,4), ROW(7,6,3,0,6,4)) AS t2(c1,c2,c3,c4,c5,c6) where test2.pk=t2.c3;
+---------------------+----------------+----+------------+----------------+------------------+------------+----+----+----+----+----+----+
| col_datetime        | col_float_10_5 | pk | col_double | col_varchar_20 | col_decimal_20_0 | col_bigint | c1 | c2 | c3 | c4 | c5 | c6 |
+---------------------+----------------+----+------------+----------------+------------------+------------+----+----+----+----+----+----+
| 2009-06-19 08:53:38 |        0.00000 |  3 |          0 | yeah           |                9 |          0 |  7 |  6 |  3 |  0 |  6 |  4 |
| 2009-06-19 08:53:38 |        0.00000 |  3 |          0 | yeah           |                9 |          0 |  7 |  6 |  3 |  0 |  6 |  4 |
| NULL                |        0.00000 |  4 |       NULL | c              |                0 |      20588 |  9 |  9 |  4 |  2 |  4 |  0 |
| NULL                |        0.00000 |  5 |          0 | mubhvq         |                0 |       NULL |  0 |  9 |  5 |  0 |  3 |  9 |
+---------------------+----------------+----+------------+----------------+------------------+------------+----+----+----+----+----+----+

select distinct statement, sql_id, param_infos from oceanbase.GV$OB_PLAN_CACHE_PLAN_STAT where statement like '%update test1 set c2%';
+-----------------------------------------------------------------------------------+----------------------------------+-------------------------------------------------------+
| statement                                                                         | sql_id                           | param_infos                                           |
+-----------------------------------------------------------------------------------+----------------------------------+-------------------------------------------------------+
| update test1 set c2 = (VALUES ROW(?)) where c1 in (VALUES ROW(?), ROW(?), ROW(?)) | ADCD5851698DA3EA7FEA1591F562A941 | {1,0,0,0,5},{1,0,0,-1,22},{1,0,0,-1,22},{1,0,0,-1,22} |
| update test1 set c2 = (VALUES ROW(?)) where c1 in (VALUES ROW(?), ROW(?), ROW(?)) | ADCD5851698DA3EA7FEA1591F562A941 | {1,0,0,0,5},{1,0,0,0,5},{1,0,0,0,5},{1,0,0,0,5}       |
+-----------------------------------------------------------------------------------+----------------------------------+-------------------------------------------------------+

select * from test1;
+------+------+
| c1   | c2   |
+------+------+
|    1 | 1000 |
|    1 | 1000 |
|    1 | 1000 |
|    1 | 1000 |
|    1 | 1000 |
|    1 | 1000 |
|    1 | 1000 |
|    1 | 1000 |
|    1 | 1000 |
+------+------+
drop table test1, test2;

create table t1 as values row(1, 2, 3), row(100, 200, 300);
select * from t1;
+----------+----------+----------+
| column_0 | column_1 | column_2 |
+----------+----------+----------+
|        1 |        2 |        3 |
|      100 |      200 |      300 |
+----------+----------+----------+
drop table t1;

alter system set _enable_values_table_folding=true;
select distinct name, value from __all_virtual_sys_parameter_stat where name like '%enable_values_table_folding%';
+------------------------------+-------+
| name                         | value |
+------------------------------+-------+
| _enable_values_table_folding | True  |
+------------------------------+-------+

