drop user 'yyl_mysql'@'%';
create user 'yyl_mysql'@'%' IDENTIFIED BY 'yyl_mysql';
grant all on *.* to 'yyl_mysql'@'%' WITH GRANT OPTION;
#sub-1	基本功能测试
drop table test1;
drop table test2;
drop table test3;
create table test1 (f1 int, f2 char(10), f3 varchar(10));
create table test2 (f1 int, f2 char(10), f3 varchar(10));
create table test3 (f1 int);
insert into test1 values(1,'aaa','a1');
insert into test1 values(2,'bbb','b1');
insert into test1 values(null,null,null);
#sub-1-1	values中的subquery是否用单独的()括起来
#未使用单独的()
insert into test2 values(1,select f2 from test1 where f1=1,'a1' );
ERROR 42000: You have an error in your SQL syntax; check the manual that corresponds to your OceanBase version for the right syntax to use near 'select f2 from test1 where f1=1,'a1' )' at line 1
insert into test2 values(select f1 from test1 where f2='bbb','bbb','b1');
ERROR 42000: You have an error in your SQL syntax; check the manual that corresponds to your OceanBase version for the right syntax to use near 'select f1 from test1 where f2='bbb','bbb','b1')' at line 1
insert into test2 values(3,'ccc',select f3 from test1 where f2='ccc');
ERROR 42000: You have an error in your SQL syntax; check the manual that corresponds to your OceanBase version for the right syntax to use near 'select f3 from test1 where f2='ccc')' at line 1
insert into test2(f2) values(select f2 from test1 where f1=1);
ERROR 42000: You have an error in your SQL syntax; check the manual that corresponds to your OceanBase version for the right syntax to use near 'select f2 from test1 where f1=1)' at line 1
insert into test3 values(select * from (select avg(f1) from test1));
ERROR 42000: You have an error in your SQL syntax; check the manual that corresponds to your OceanBase version for the right syntax to use near 'select * from (select avg(f1) from test1))' at line 1
select * from test2;
f1	f2	f3
select * from test3;
f1
#使用单独的()
DELETE FROM test2;
DELETE FROM test3;
insert into test2 values(1,(select f2 from test1 where f1=1),'a1');
insert into test2 values((select f1 from test1 where f2='bbb'),'bbb','b1');
insert into test2 values(3,'ccc',(select f3 from test1 where f2='ccc'));
insert into test2(f2) values((select f2 from test1 where f1=1));
insert into test3 values((select * from (select avg(f1) from test1) t));
select * from test2;
f1	f2	f3
1	aaa	a1
2	bbb	b1
3	ccc	NULL
NULL	aaa	NULL
select * from test3;
f1
2
#sub-1-2	子查询返回内容
delete from test2;
delete from test3;
#返回一行一列
insert into test2 values((select f1 from test1 where f2='bbb'),(select f2 from test1 where f1=1),'z1');
#返回一行多列
insert into test2 values(select * from test1 where f1=1);
ERROR 42000: You have an error in your SQL syntax; check the manual that corresponds to your OceanBase version for the right syntax to use near 'select * from test1 where f1=1)' at line 1
insert into test2 values((select * from test1 where f1=1));
ERROR 21S01: Column count doesn't match value count at row 1
insert into test2 values((select * from test1 where f1=1),'bbb','v1');
ERROR 21000: Operand should contain 1 column(s)
#返回一列多行
insert into test2 values((select f1 from test1),'bbb','v1');
ERROR 21000: Subquery returns more than 1 row
#返回多行多列
insert into test2 values(select * from test1);
ERROR 42000: You have an error in your SQL syntax; check the manual that corresponds to your OceanBase version for the right syntax to use near 'select * from test1)' at line 1
insert into test2 values((select * from test1));
ERROR 21S01: Column count doesn't match value count at row 1
insert into test2 values((select * from test1),'bbb','v1');
ERROR 21000: Operand should contain 1 column(s)
#返回空
insert into test2 values((select * from test1 where f1=5),'bbb','v1');
ERROR 21000: Operand should contain 1 column(s)
insert into test2 values((select f1 from test1 where f1=5),'bbb','v1');
insert into test2 values((select f2 from test1 where f1=5),'bbb','v1');
select * from test2;
f1	f2	f3
2	aaa	z1
NULL	bbb	v1
NULL	bbb	v1
#返回null
delete from test2;
insert into test2 values((select * from test1 where f1 is null),'bbb','v1');
ERROR 21000: Operand should contain 1 column(s)
insert into test2 values((select f1 from test1 where f1 is null),'bbb','v1');
insert into test2 values((select f2 from test1 where f1 is null),'bbb','v1');
select * from test2;
f1	f2	f3
NULL	bbb	v1
NULL	bbb	v1
#sub-1-3	subquery查询的表与insert的表是否为同一个表
delete from test2;
#不为同一个表
insert into test2 values((select f1 from test1 where f2='bbb'),'bbb','b1');
#为同一个表
insert into test1 values((select f1 from test1 where f3='a1'),
(select max(concat(trim(a.f2),b.f3)) from test1 a,test1 b where a.f1=b.f1),
(select concat(a.f3,trim(b.f2)) from test1 a,test2 b where a.f1=b.f1));
SELECT * FROM test1;
f1	f2	f3
1	aaa	a1
2	bbb	b1
NULL	NULL	NULL
1	bbbb1	b1bbb
SELECT * FROM test2;
f1	f2	f3
2	bbb	b1
#sub-1-4	插入目标
#向表中指定列插入数据
DELETE FROM test1;
delete from test2;
insert into test1 values(1,'aaa','a1');
insert into test1 values(2,'bbb','b1');
insert into test1 values(null,null,null);
insert into test2(f1,f2) values(1,(select f2 from test1 where f1=1));
insert into test2(f1,f2) values((select f1 from test1 where f1=1),(select f2 from test1 where f1=1));
SELECT * FROM test2;
f1	f2	f3
1	aaa	NULL
1	aaa	NULL
#向表中所有列插入数据
delete from test2;
insert into test2(f1,f2,f3) values(1,(select f2 from test1 where f1=1),'test');
insert into test2 values((select f1 from test1 where f1=1),(select f2 from test1 where f1=1),(select f3 from test1 where f1=1));
SELECT * FROM test2;
f1	f2	f3
1	aaa	test
1	aaa	a1
#向表中指定分区插入数据
drop table test2;
create table test2(f1 int, f2 char(10), f3 varchar(10) default 'admin')
partition by range(f1) (partition p1 values less than(5), partition p2 values less than (maxvalue));
insert into test2 partition(p2) values((select f1 from test1 where f2='bbb'),'aaa','a1');
ERROR HY000: Found a row not matching the given partition set
insert into test2 partition(p1) values((select f1 from test1 where f2='bbb'),'aaa','a1');
select * from test2;
f1	f2	f3
2	aaa	a1
#补充测试
delete from test2;
INSERT INTO test2 VALUES
((select f1 from test1 where f2='bbb'),'aaa','a1'),
((select f1 from test1 where f1=1),(select f2 from test1 where f1=1),(select f3 from test1 where f1=1)),
((select f1 from test1 where f1=2),(select f2 from test1 where f1=2),NULL),
((select f1 from test1 where f3='a1'),(select max(concat(trim(a.f2),b.f3)) from test1 a,test1 b where a.f1=b.f1),(select concat(a.f3,trim(b.f2)) from test1 a,test1 b where a.f1=b.f1 AND a.f1>1));
SELECT * FROM test2;
f1	f2	f3
2	aaa	a1
1	aaa	a1
2	bbb	NULL
1	bbbb1	b1bbb
#sub-1-5	values中除subquery外，还存在default、null等需要插入的特殊值
delete from test2;
insert into test2 values(null,(select f2 from test1 where f1=2),default);
SELECT * FROM test2;
f1	f2	f3
NULL	bbb	admin
#sub-2	运算符与条件
drop table test1;
drop table test2;
create table test1 (f1 int, f2 char(10), f3 varchar(10));
create table test2 (f1 int, f2 char(10), f3 varchar(10));
insert into test1 values(1,'aaa','a1');
insert into test1 values(2,'bbb','b1');
insert into test1 values(null,null,null);
#sub-2-1	运算符（+、-、*、/）
#子查询中使用运算符
delete from test2;
insert into test2 values((select f1-3/(f1*0.02)+2 from test1 where f1=2),(select f2 from test1 where f1*f1-1*2+1<3),(select concat(trim(f2),f3) from test1 where f1=2));
select * from test2;
f1	f2	f3
-71	aaa	bbbb1
#子查询外使用运算符
delete from test2;
insert into test2 VALUES
(5+(select f1 from test1 where f1=1),5-(select f1 from test1 where f1=1),5*(select f1 from test1 where f1=1)),
(5/(select f1 from test1 where f1=1),null,null),
((select f1 from test1 where f1=1)+5,(select f1 from test1 where f1=1)-5,(select f1 from test1 where f1=1)*5),
((select f1 from test1 where f1=1)/5,null,null),
((select f1 from test1 where f1=1)/5+3*(2-5),concat('t_',(select trim(f2) from test1 where f1=1)),concat((select trim(f2) from test1 where f1=1),'t_'));
select * from test2;
f1	f2	f3
6	4	5
5	NULL	NULL
6	-4	5
0	NULL	NULL
-9	t_aaa	aaat_
#sub-2-2	子查询中使用各种条件
#>、>=、<、<=、=、!=、<>（选择其中某几个进行测试）
delete from test2;
insert into test2(f1,f2) values((select f1 from test1 where f2>='abc'),(select f2 from test1 group by f2 having f2<'abc'));
insert into test2(f1,f2) values((select f1 from test1 where f1>1.5),(select f2 from test1 group by f2 having f2<='aaa'));
insert into test2(f1,f2) values((select f1 from test1 where f1<>1),(select f2 from test1 group by f2 having f2!='bbb'));
insert into test2 values((select f1 from test1 where (f1,f2,f3)=((1,'aaa','a1'))),null,null);
select * from test2;
f1	f2	f3
2	aaa	NULL
2	aaa	NULL
2	aaa	NULL
1	NULL	NULL
#any,some,all
delete from test2;
insert into test2 values((select f1 from test1 where f1!=all(SELECT 2 FROM DUAL UNION SELECT 3 FROM DUAL UNION SELECT 4 FROM dual)),
(select f2 from test1 where f3=some(SELECT 'b1' FROM DUAL UNION SELECT 'test' FROM DUAL UNION SELECT null FROM dual)),
(select f3 from test1 where f2>=any(SELECT 'bbb' FROM DUAL UNION SELECT 'test' FROM DUAL UNION SELECT null FROM dual)));
insert into test2 values((select f1 from test1 where (f3,f2)=some(SELECT null,null FROM DUAL UNION SELECT 'admin','test' FROM DUAL UNION SELECT 'b1','bbb' FROM dual)),
(select f2 from test1 where (f1,f3)=any(SELECT 1,'a' FROM DUAL UNION SELECT 1,'a1' FROM DUAL)),
(select f3 from test1 where (f1,f2)!=all(SELECT 1,'aaa' FROM DUAL UNION SELECT 2,'bbb' FROM DUAL)));
select * from test2;
f1	f2	f3
1	bbb	b1
2	aaa	NULL
#like,regexp
delete from test2;
insert into test2 values((select f1 from test1 where f2 like '%a%'),
(select f2 from test1 where f2 like 'a_a%'),
(select f3 from test1 where f1>0 group by f3 having f3 like 'b_'));
insert into test2 values((select f1 from test1 where f2 regexp 'aaa|ccc|ddd'),
(select f2 from test1 where f2 regexp '^a.*'),
(select f3 from test1 where f2 regexp '.*a$'));
select * from test2;
f1	f2	f3
1	aaa	b1
1	aaa	a1
#exists
delete from test2;
insert into test2 values((select min(f1) from test1 where exists(select f2 from test1 where f1>0)),
null,
null);
select * from test2;
f1	f2	f3
1	NULL	NULL
#is [not] null
delete from test2;
insert into test2 values((select f1 from test1 where f2 is null),
(select max(f2) from test1 where f3 is not null),
null);
select * from test2;
f1	f2	f3
NULL	bbb	NULL
#[not] in
delete from test2;
insert into test2 values((select f1 from test1 where f2 in ('aa','bb','cc','bbb')),
null,
(select f3 from test1 where f2 not in ('aa','bb','cc','bbb')));
select * from test2;
f1	f2	f3
2	NULL	a1
#[not] between and
delete from test2;
insert into test2 values((SELECT f1 FROM test1 WHERE f1 BETWEEN 1 AND 1.5),
(SELECT f2 FROM test1 WHERE f2 NOT BETWEEN 'aaa' AND 'abc'),
null);
select * from test2;
f1	f2	f3
1	bbb	NULL
#and,or,not
delete from test2;
insert into test2 values((SELECT f1 FROM test1 WHERE f1>0 AND f1<=1),
(SELECT max(f2) FROM test1 WHERE f1>0 OR f2>'aaa'),
(SELECT max(f3) FROM test1 WHERE NOT f2>'aaa'));
insert into test2 values((SELECT min(f1) FROM test1 WHERE f1>0 AND f1<=1 OR f2>'aaa'),
(SELECT max(f2) FROM test1 WHERE f1>0 OR f2>'aaa' AND NOT (f2<'bbb')),
NULL);
select * from test2;
f1	f2	f3
1	bbb	a1
1	bbb	NULL
#sub-3	常用系统函数
drop table test1;
drop table test2;
create table test1 (f1 int, f2 char(10), f3 varchar(10), f4 date);
create table test2 (f1 int, f2 char(10), f3 varchar(10), f4 date);
insert into test1 values(1,'abc','a1','19700101');
insert into test1 values(2,'bcd','b1','19800101');
insert into test1 values(3,'cde','c1','19900101');
insert into test1 values(4,'def','d1','20000101');
insert into test1 values(5,'efg','e1','20100101');
insert into test1 values(6,'fgh','f1','20200101');
insert into test1 values(null,null,NULL,NULL);
#sub-3-1	子查询中使用常用系统函数
#字符类函数
DELETE FROM test2;
insert into test2(f2,f3) values(
(SELECT concat(trim(f2),f3) FROM test1 WHERE LENGTH(f2)>2 AND LENGTH(f3)<3 AND f1=4),
(SELECT concat(trim(upper(f2)),lower(f3)) FROM test1 WHERE f2='Efg'));
insert into test2(f2,f3) values(
(SELECT concat(upper(f2),lower(f3)) FROM test1 WHERE f2='Efg'),
(SELECT ascii(f2)+ascii(f3) FROM test1 WHERE f1=5));
insert into test2(f2,f3) values(
(SELECT substr(f2,2) FROM test1 WHERE f1=2),
(SELECT substr(f3,1) FROM test1 WHERE substr(f2,2,2)='de'));
select * from test2;
f1	f2	f3	f4
NULL	defd1	EFGe1	NULL
NULL	EFGe1	202	NULL
NULL	cd	c1	NULL
#数字类函数
DELETE FROM test2;
INSERT INTO test2(f1) VALUES((SELECT round(f1/2.5) FROM test1 WHERE MOD(f1,4)=0));
INSERT INTO test2(f1) VALUES((SELECT f1/2.5 FROM test1 WHERE MOD(f1,4)=0));
INSERT INTO test2(f1) VALUES((SELECT CEIL(f1/1.5) FROM test1 WHERE floor(f1/3)=1 AND FLOOR(f1/2)=1));
SELECT * FROM test2;
f1	f2	f3	f4
2	NULL	NULL	NULL
2	NULL	NULL	NULL
2	NULL	NULL	NULL
#日期和时间函数
DELETE FROM test2;
INSERT INTO test2(f4) VALUES((SELECT f4 FROM test1 WHERE SYSDATE()-f4>0 ORDER BY 1 DESC LIMIT 1));
INSERT INTO test2(f1) VALUES((SELECT MONTH(f4) FROM test1 WHERE f4>'20100101'));
SELECT * FROM test2;
f1	f2	f3	f4
NULL	NULL	NULL	2020-01-01
1	NULL	NULL	NULL
#聚合函数
DELETE FROM test2;
INSERT INTO test2 VALUES(
(SELECT avg(f1) FROM test1 WHERE f1>3),
(SELECT min(f2) FROM test1 WHERE f1>3),
(SELECT max(f3) FROM test1 WHERE f1>3),
(SELECT min(f4) FROM test1 WHERE f1>3));
INSERT INTO test2 VALUES(
(SELECT sum(f1) FROM test1 WHERE f1>3),
(SELECT count(f2) FROM test1 WHERE f1>3),
NULL,NULL);
SELECT * FROM test2;
f1	f2	f3	f4
5	def	f1	2000-01-01
15	3	NULL	NULL
#sub-3-2	values中使用常用系统函数，且其参数为subquery
DELETE FROM test2;
INSERT INTO test2 VALUES(
mod((SELECT f1 FROM test1 WHERE f1>5)+1,(SELECT f1 FROM test1 WHERE f2='cde'))*100,
concat(concat((SELECT min(UPPER(trim(f2))) FROM test1),'a'),(SELECT max(lower(trim(f2))) FROM test1)),
(SELECT f2 FROM test1 WHERE f1=2),
(SELECT f4 FROM test1 WHERE f1=3)+10);
INSERT INTO test2(f2) VALUES(
SUBSTRING((SELECT f2 FROM test1 WHERE f1=5),(SELECT f1 FROM test1 WHERE f3='b1'),(SELECT f1 FROM test1 WHERE f2='bcd')));
SELECT * FROM test2;
f1	f2	f3	f4
100	ABCafgh	bcd	1990-01-11
NULL	fg	NULL	NULL
#sub-4	表约束类型
drop table test1;
drop table test2;
drop table test3;
create table test1 (id int primary key);
INSERT INTO test1 VALUES(1001);
INSERT INTO test1 VALUES(1002);
INSERT INTO test1 VALUES(1003);
create table test2 (
id int primary key, 
name char(10) unique, 
name_1 varchar(10) not null, 
birthday DATE DEFAULT '20000101', 
age decimal(2,0),
p_id int,
foreign KEY(p_id) REFERENCES test1(id));
INSERT INTO test2 VALUES(1,'stu1','aaa','19700101',18,1001);
INSERT INTO test2 VALUES(2,'stu2','bbb','19800101',28,1001);
INSERT INTO test2 VALUES(3,'stu3','ccc','19900101',38,1002);
INSERT INTO test2 VALUES(4,'stu4','ddd','20000101',48,1002);
INSERT INTO test2 VALUES(5,'stu5','eee','20100101',58,1003);
INSERT INTO test2 VALUES(6,NULL,'fff','20200101',68,1003);
create table test3 (
id int primary key, 
name char(10) unique, 
name_1 varchar(10) not null, 
birthday DATE DEFAULT '20000101', 
age decimal(2,0),
p_id int,
foreign KEY(p_id) REFERENCES test1(id));
#sub-4-1	primary key
DELETE FROM test3;
INSERT INTO test3(id,name_1) VALUES((SELECT id FROM test2 WHERE id<2),'test1');
INSERT INTO test3(id,name_1) VALUES((SELECT id FROM test2 WHERE id<2),'test2');
ERROR 23000: Duplicate entry '1' for key 'PRIMARY'
INSERT INTO test3(id,name_1) VALUES((SELECT id FROM test2 WHERE id<1),'test3');
ERROR 23000: Column 'id' cannot be null
SELECT * FROM test3;
id	name	name_1	birthday	age	p_id
1	NULL	test1	2000-01-01	NULL	NULL
#sub-4-2	unique
DELETE FROM test3;
INSERT INTO test3(id,name,name_1) VALUES(10,(SELECT name FROM test2 WHERE name LIKE '%4%'),'test1');
INSERT INTO test3(id,name,name_1) VALUES(11,(SELECT name FROM test2 WHERE name LIKE '%4%'),'test2');
ERROR 23000: Duplicate entry 'stu4' for key 'name'
INSERT INTO test3(id,name,name_1) VALUES(12,(SELECT name FROM test2 WHERE name LIKE '%9%'),'test3');
SELECT * FROM test3;
id	name	name_1	birthday	age	p_id
10	stu4	test1	2000-01-01	NULL	NULL
12	NULL	test3	2000-01-01	NULL	NULL
#sub-4-3	[not] null
DELETE FROM test3;
INSERT INTO test3(id,name_1) VALUES(10,(SELECT name_1 FROM test2 WHERE name_1 in ('abc','acd','aaa')));
INSERT INTO test3(id,name_1) VALUES(11,(SELECT name_1 FROM test2 WHERE name_1 in ('abc','acd','aaa')));
INSERT INTO test3(id,name_1) VALUES(12,(SELECT name_1 FROM test2 WHERE name_1 in ('abc','acd','ade')));
ERROR 23000: Column 'name_1' cannot be null
SELECT * FROM test3;
id	name	name_1	birthday	age	p_id
10	NULL	aaa	2000-01-01	NULL	NULL
11	NULL	aaa	2000-01-01	NULL	NULL
#sub-4-4	default
DELETE FROM test3;
INSERT INTO test3(id,name_1,birthday) VALUES(10,'test1',(SELECT birthday FROM test2 WHERE birthday>'19800101' AND birthday<'20000101'));
INSERT INTO test3(id,name_1,birthday) VALUES(11,'test2',(SELECT birthday FROM test2 WHERE birthday>'19900101' AND birthday<'20100101'));
INSERT INTO test3(id,name_1,birthday) VALUES(12,'test3',(SELECT birthday FROM test2 WHERE birthday>'19900101' AND birthday<'20000101'));
SELECT * FROM test3;
id	name	name_1	birthday	age	p_id
10	NULL	test1	1990-01-01	NULL	NULL
11	NULL	test2	2000-01-01	NULL	NULL
12	NULL	test3	NULL	NULL	NULL
#sub-4-5	foreign key
DELETE FROM test3;
INSERT INTO test3(id,name_1,p_id) VALUES(10,'test1',(SELECT min(p_id) FROM test2 WHERE p_id>1002));
INSERT INTO test3(id,name_1,p_id) VALUES(11,'test2',(SELECT min(p_id)+100 FROM test2 WHERE p_id>1002));
ERROR 23000: Cannot add or update a child row: a foreign key constraint fails
INSERT INTO test3(id,name_1,p_id) VALUES(12,'test3',(SELECT min(p_id) FROM test2 WHERE p_id>1002));
INSERT INTO test3(id,name_1,p_id) VALUES(13,'test4',(SELECT min(p_id) FROM test2 WHERE p_id>1003));
SELECT * FROM test3;
id	name	name_1	birthday	age	p_id
10	NULL	test1	2000-01-01	NULL	1003
12	NULL	test3	2000-01-01	NULL	1003
13	NULL	test4	2000-01-01	NULL	NULL
#sub-5	数据类型
#sub-5-1	int
drop table test2;
drop table test3;
drop table test1;
CREATE TABLE test1 (f1 int PRIMARY KEY, f2 int);
CREATE TABLE test2 (f1 int PRIMARY KEY, f2 int);
INSERT INTO test1 VALUES(1,111);
INSERT INTO test1 VALUES(2,222);
INSERT INTO test1 VALUES(3,333);
INSERT INTO test1 VALUES(4,NULL);
INSERT INTO test2 VALUES((SELECT min(f1) FROM test1 WHERE f2<444),(SELECT min(f2) FROM test1 WHERE f1>1));
INSERT INTO test2 VALUES(5,(SELECT f2 FROM test1 WHERE f2=444));
INSERT INTO test2 VALUES(6,(SELECT f2 FROM test1 WHERE f1=4));
SELECT * FROM test2;
f1	f2
1	222
5	NULL
6	NULL
#sub-5-2	float
drop table test1;
drop table test2;
CREATE TABLE test1 (f1 float(5,2) PRIMARY KEY, f2 float(5,2));
CREATE TABLE test2 (f1 float(5,2) PRIMARY KEY, f2 float(5,2));
INSERT INTO test1 VALUES(1,111);
INSERT INTO test1 VALUES(2,222);
INSERT INTO test1 VALUES(3,333);
INSERT INTO test1 VALUES(4,NULL);
INSERT INTO test2 VALUES((SELECT min(f1) FROM test1 WHERE f2<444),(SELECT min(f2) FROM test1 WHERE f1>1));
INSERT INTO test2 VALUES(5,(SELECT f2 FROM test1 WHERE f2=444));
INSERT INTO test2 VALUES(6,(SELECT f2 FROM test1 WHERE f1=4));
SELECT * FROM test2;
f1	f2
1.00	222.00
5.00	NULL
6.00	NULL
#sub-5-3	double
drop table test1;
drop table test2;
CREATE TABLE test1 (f1 double(5,2) PRIMARY KEY, f2 double(5,2));
CREATE TABLE test2 (f1 double(5,2) PRIMARY KEY, f2 double(5,2));
INSERT INTO test1 VALUES(1,111);
INSERT INTO test1 VALUES(2,222);
INSERT INTO test1 VALUES(3,333);
INSERT INTO test1 VALUES(4,NULL);
INSERT INTO test2 VALUES((SELECT min(f1) FROM test1 WHERE f2 NOT IN (111,222,555)),(SELECT min(f2) FROM test1 WHERE f1 IN (1,4,6)));
INSERT INTO test2 VALUES(5,(SELECT f2 FROM test1 WHERE f2=444));
INSERT INTO test2 VALUES(6,(SELECT f2 FROM test1 WHERE f1=4));
SELECT * FROM test2;
f1	f2
3.00	111.00
5.00	NULL
6.00	NULL
#sub-5-4	decimal
drop table test1;
drop table test2;
CREATE TABLE test1 (f1 decimal(5,2) PRIMARY KEY, f2 decimal(5,2));
CREATE TABLE test2 (f1 decimal(5,2) PRIMARY KEY, f2 decimal(5,2));
INSERT INTO test1 VALUES(1,111);
INSERT INTO test1 VALUES(2,222);
INSERT INTO test1 VALUES(3,333);
INSERT INTO test1 VALUES(4,NULL);
INSERT INTO test2 VALUES((SELECT min(f1) FROM test1 WHERE f2<444),(SELECT min(f2) FROM test1 WHERE f1>1));
INSERT INTO test2 VALUES(5,(SELECT f2 FROM test1 WHERE f2=444));
INSERT INTO test2 VALUES(6,(SELECT f2 FROM test1 WHERE f1=4));
SELECT * FROM test2;
f1	f2
1.00	222.00
5.00	NULL
6.00	NULL
#sub-5-5	year
drop table test1;
drop table test2;
CREATE TABLE test1 (f1 year PRIMARY KEY, f2 year);
CREATE TABLE test2 (f1 year PRIMARY KEY, f2 year);
INSERT INTO test1 VALUES('2014','1914');
INSERT INTO test1 VALUES('2015','1915');
INSERT INTO test1 VALUES('2016','1916');
INSERT INTO test1 VALUES('2017',NULL);
INSERT INTO test2 VALUES((SELECT min(f1) FROM test1 WHERE f2='1915'),(SELECT min(f2) FROM test1 WHERE f1='2014'));
INSERT INTO test2 VALUES(2018,(SELECT f2 FROM test1 WHERE f2='1917'));
INSERT INTO test2 VALUES(2019,(SELECT f2 FROM test1 WHERE f1='2017'));
SELECT * FROM test2;
f1	f2
2015	1914
2018	NULL
2019	NULL
#sub-5-6	date
drop table test1;
drop table test2;
CREATE TABLE test1 (f1 date PRIMARY KEY, f2 date);
CREATE TABLE test2 (f1 date PRIMARY KEY, f2 date);
INSERT INTO test1 VALUES('20140205','19140205');
INSERT INTO test1 VALUES('20150205','19150205');
INSERT INTO test1 VALUES('20160205','19160205');
INSERT INTO test1 VALUES('20170205',NULL);
INSERT INTO test2 VALUES((SELECT f1 FROM test1 WHERE f2>'19150205'),(SELECT f2 FROM test1 WHERE f1='20150205'));
INSERT INTO test2 VALUES('20180205',(SELECT f2 FROM test1 WHERE f2='19170205'));
INSERT INTO test2 VALUES('20190205',(SELECT f2 FROM test1 WHERE f1='20170205'));
SELECT * FROM test2;
f1	f2
2016-02-05	1915-02-05
2018-02-05	NULL
2019-02-05	NULL
#sub-5-7	time
drop table test1;
drop table test2;
CREATE TABLE test1 (f1 time PRIMARY KEY, f2 time);
CREATE TABLE test2 (f1 time PRIMARY KEY, f2 time);
INSERT INTO test1 VALUES('140205','140205');
INSERT INTO test1 VALUES('150205','150205');
INSERT INTO test1 VALUES('160205','160205');
INSERT INTO test1 VALUES('170205',NULL);
INSERT INTO test2 VALUES((SELECT f1 FROM test1 WHERE f2 IS NULL),(SELECT f2 FROM test1 WHERE f1<'150205'));
INSERT INTO test2 VALUES('180205',(SELECT f2 FROM test1 WHERE f2='170205'));
INSERT INTO test2 VALUES('190205',(SELECT f2 FROM test1 WHERE f1='170205'));
SELECT * FROM test2;
f1	f2
17:02:05	14:02:05
18:02:05	NULL
19:02:05	NULL
#sub-5-8	datetime
drop table test1;
drop table test2;
CREATE TABLE test1 (f1 datetime PRIMARY KEY, f2 datetime);
CREATE TABLE test2 (f1 datetime PRIMARY KEY, f2 datetime);
INSERT INTO test1 VALUES('20140205140205','19140205140205');
INSERT INTO test1 VALUES('20150205150205','19150205150205');
INSERT INTO test1 VALUES('20160205160205','19160205160205');
INSERT INTO test1 VALUES('20170205160205',NULL);
INSERT INTO test2 VALUES((SELECT f1 FROM test1 WHERE f2 NOT IN ('19140205140205','19150205150205','20170205160205')),(SELECT f2 FROM test1 WHERE f1<'20150205150205'));
INSERT INTO test2 VALUES('20180205160205',(SELECT f2 FROM test1 WHERE f2='19170205160205'));
INSERT INTO test2 VALUES('20190205160205',(SELECT f2 FROM test1 WHERE f1='20170205160205'));
SELECT * FROM test2;
f1	f2
2016-02-05 16:02:05	1914-02-05 14:02:05
2018-02-05 16:02:05	NULL
2019-02-05 16:02:05	NULL
#sub-5-9	timestamp
drop table test1;
drop table test2;
CREATE TABLE test1 (f1 timestamp PRIMARY KEY, f2 timestamp);
CREATE TABLE test2 (f1 timestamp PRIMARY KEY, f2 timestamp);
INSERT INTO test1 VALUES('20140205140205','19740205140205');
INSERT INTO test1 VALUES('20150205150205','19750205150205');
INSERT INTO test1 VALUES('20160205160205','19760205160205');
INSERT INTO test1 VALUES('20170205160205',NULL);
INSERT INTO test2 VALUES((SELECT f1 FROM test1 WHERE f2 NOT IN ('19740205140205','19750205150205','20170205160205')),(SELECT f2 FROM test1 WHERE f1<'20150205150205'));
INSERT INTO test2 VALUES('20180205160205',(SELECT f2 FROM test1 WHERE f2='19770205160205'));
INSERT INTO test2 VALUES('20190205160205',(SELECT f2 FROM test1 WHERE f1='20170205160205'));
SELECT * FROM test2;
f1	f2
2016-02-05 16:02:05	1974-02-05 14:02:05
2018-02-05 16:02:05	NULL
2019-02-05 16:02:05	NULL
#sub-5-10	char
drop table test1;
drop table test2;
CREATE TABLE test1 (f1 char(20) PRIMARY KEY, f2 char(20));
CREATE TABLE test2 (f1 char(20) PRIMARY KEY, f2 char(20));
INSERT INTO test1 VALUES('1dddd','fds');
INSERT INTO test1 VALUES('2gfsg','fsr');
INSERT INTO test1 VALUES('3gfdd','juy');
INSERT INTO test1 VALUES('4hyyy',NULL);
INSERT INTO test2 VALUES((SELECT max(f1) FROM test1 WHERE f2 IS NOT NULL),(SELECT min(f2) FROM test1 WHERE f1>'2gfsg'));
INSERT INTO test2 VALUES('5tryr',(SELECT f2 FROM test1 WHERE f2='kbg'));
INSERT INTO test2 VALUES('6utdh',(SELECT f2 FROM test1 WHERE f1='4hyyy'));
SELECT * FROM test2;
f1	f2
3gfdd	juy
5tryr	NULL
6utdh	NULL
#sub-5-11	varchar
drop table test1;
drop table test2;
CREATE TABLE test1 (f1 varchar(20) PRIMARY KEY, f2 varchar(20));
CREATE TABLE test2 (f1 varchar(20) PRIMARY KEY, f2 varchar(20));
INSERT INTO test1 VALUES('1dddd','fds');
INSERT INTO test1 VALUES('2gfsg','fsr');
INSERT INTO test1 VALUES('3gfdd','juy');
INSERT INTO test1 VALUES('4hyyy',NULL);
INSERT INTO test2 VALUES((SELECT max(f1) FROM test1 WHERE f2 IS NOT NULL),(SELECT min(f2) FROM test1 WHERE f1>'2gfsg'));
INSERT INTO test2 VALUES('5tryr',(SELECT f2 FROM test1 WHERE f2='kbg'));
INSERT INTO test2 VALUES('6utdh',(SELECT f2 FROM test1 WHERE f1='4hyyy'));
SELECT * FROM test2;
f1	f2
3gfdd	juy
5tryr	NULL
6utdh	NULL
#sub-5-12	text
drop table test1;
drop table test2;
CREATE TABLE test1 (f1 text, f2 text);
CREATE TABLE test2 (f1 text, f2 text);
INSERT INTO test1 VALUES('1dddd','fds');
INSERT INTO test1 VALUES('2gfsg','fsr');
INSERT INTO test1 VALUES('3gfdd','juy');
INSERT INTO test1 VALUES('4hyyy',NULL);
INSERT INTO test2 VALUES((SELECT max(f1) FROM test1 WHERE f2 IS NOT NULL),(SELECT min(f2) FROM test1 WHERE f1>'2gfsg'));
INSERT INTO test2 VALUES('5tryr',(SELECT f2 FROM test1 WHERE f2='kbg'));
INSERT INTO test2 VALUES('6utdh',(SELECT f2 FROM test1 WHERE f1='4hyyy'));
SELECT * FROM test2;
f1	f2
3gfdd	juy
5tryr	NULL
6utdh	NULL
#sub-5-13	enum
drop table test1;
drop table test2;
CREATE TABLE test1 (f1 enum('first','second','third'),f2 enum('one','two','three'));
CREATE TABLE test2 (f1 enum('first','second','third'),f2 enum('one','two','three'));
INSERT INTO test1 VALUES('first','one');
INSERT INTO test1 VALUES('second','two');
INSERT INTO test1 VALUES('third','three');
INSERT INTO test1 VALUES('third',NULL);
INSERT INTO test2 VALUES((SELECT f1 FROM test1 WHERE f2>='two'),(SELECT f2 FROM test1 WHERE f1<'second'));
INSERT INTO test2 VALUES('third',(SELECT f2 FROM test1 WHERE f2='third'));
INSERT INTO test2 VALUES('third',(SELECT f2 FROM test1 WHERE f1='third' AND f2 IS NULL));
SELECT * FROM test2;
f1	f2
second	one
third	NULL
third	NULL
#sub-5-14	set
drop table test1;
drop table test2;
CREATE TABLE test1 (f1 set('first','second','third'),f2 set('one','two','three'));
CREATE TABLE test2 (f1 set('first','second','third'),f2 set('one','two','three'));
INSERT INTO test1 VALUES('first,second','one');
INSERT INTO test1 VALUES('second,third','two');
INSERT INTO test1 VALUES('third,first','three');
INSERT INTO test1 VALUES('third',NULL);
INSERT INTO test2 VALUES((SELECT f1 FROM test1 WHERE f2='three'),(SELECT f2 FROM test1 WHERE f1='second,third'));
INSERT INTO test2 VALUES('first,second,third',(SELECT f2 FROM test1 WHERE f2='first'));
INSERT INTO test2 VALUES('first,second,third',(SELECT f2 FROM test1 WHERE f1='third'));
SELECT * FROM test2;
f1	f2
first,third	two
first,second,third	NULL
first,second,third	NULL
#sub-5-15	bit
drop table test1;
drop table test2;
CREATE TABLE test1 (f1 bit(4) PRIMARY KEY, f2 bit(6));
CREATE TABLE test2 (f1 bit(4) PRIMARY KEY, f2 bit(6));
INSERT INTO test1 VALUES(1,11);
INSERT INTO test1 VALUES(2,22);
INSERT INTO test1 VALUES(3,33);
INSERT INTO test1 VALUES(4,NULL);
INSERT INTO test2 VALUES((SELECT f1 FROM test1 WHERE f2=11),(SELECT f2 FROM test1 WHERE f1=3));
INSERT INTO test2 VALUES(5,(SELECT f2 FROM test1 WHERE f2=35));
INSERT INTO test2 VALUES(6,(SELECT f2 FROM test1 WHERE f1=4));
SELECT f1+0,f2+0 FROM test2;
f1+0	f2+0
1	33
5	NULL
6	NULL
#sub-5-16	binary
drop table test1;
drop table test2;
CREATE TABLE test1 (f1 binary(5) PRIMARY KEY, f2 binary(5));
CREATE TABLE test2 (f1 binary(5) PRIMARY KEY, f2 binary(5));
INSERT INTO test1 VALUES('1dddd','fds');
INSERT INTO test1 VALUES('2gfsg','fsr');
INSERT INTO test1 VALUES('3gfdd','juy');
INSERT INTO test1 VALUES('4hyyy',NULL);
INSERT INTO test2 VALUES((SELECT max(f1) FROM test1 WHERE f2 IS NOT NULL),(SELECT min(f2) FROM test1 WHERE f1>'2gfsg'));
INSERT INTO test2 VALUES('5tryr',(SELECT f2 FROM test1 WHERE f2='kbg'));
INSERT INTO test2 VALUES('6utdh',(SELECT f2 FROM test1 WHERE f1='4hyyy'));
SELECT * FROM test2;
f1	f2
3gfdd	juy  
5tryr	NULL
6utdh	NULL
#sub-5-17	varbinary
drop table test1;
drop table test2;
CREATE TABLE test1 (f1 varbinary(5) PRIMARY KEY, f2 varbinary(5));
CREATE TABLE test2 (f1 varbinary(5) PRIMARY KEY, f2 varbinary(5));
INSERT INTO test1 VALUES('1dddd','fds');
INSERT INTO test1 VALUES('2gfsg','fsr');
INSERT INTO test1 VALUES('3gfdd','juy');
INSERT INTO test1 VALUES('4hyyy',NULL);
INSERT INTO test2 VALUES((SELECT max(f1) FROM test1 WHERE f2 IS NOT NULL),(SELECT min(f2) FROM test1 WHERE f1>'2gfsg'));
INSERT INTO test2 VALUES('5tryr',(SELECT f2 FROM test1 WHERE f2='kbg'));
INSERT INTO test2 VALUES('6utdh',(SELECT f2 FROM test1 WHERE f1='4hyyy'));
SELECT * FROM test2;
f1	f2
3gfdd	juy
5tryr	NULL
6utdh	NULL
#sub-5-18	blob
drop table test1;
drop table test2;
CREATE TABLE test1 (f1 blob(5), f2 blob(5));
CREATE TABLE test2 (f1 blob(5), f2 blob(5));
INSERT INTO test1 VALUES('1dddd','fds');
INSERT INTO test1 VALUES('2gfsg','fsr');
INSERT INTO test1 VALUES('3gfdd','juy');
INSERT INTO test1 VALUES('4hyyy',NULL);
INSERT INTO test2 VALUES((SELECT max(f1) FROM test1 WHERE f2 IS NOT NULL),(SELECT min(f2) FROM test1 WHERE f1>'2gfsg'));
INSERT INTO test2 VALUES('5tryr',(SELECT f2 FROM test1 WHERE f2='kbg'));
INSERT INTO test2 VALUES('6utdh',(SELECT f2 FROM test1 WHERE f1='4hyyy'));
SELECT * FROM test2;
f1	f2
3gfdd	juy
5tryr	NULL
6utdh	NULL
drop user 'yyl_mysql'@'%';
