drop user 'yyl_mysql'@'%';
create user 'yyl_mysql'@'%' IDENTIFIED BY 'yyl_mysql';
grant all on *.* to 'yyl_mysql'@'%' WITH GRANT OPTION;
#sub-7	PL
DROP TABLE test1;
DROP TABLE test2;
DROP TABLE test3;
CREATE TABLE test1(id int PRIMARY KEY, name char(20), name_1 varchar(20), birthday DATE, weight float, p_id int)
PARTITION BY RANGE(id) 
(PARTITION p1 VALUES less than(103), PARTITION p2 VALUES less than(105), PARTITION p3 VALUES less than(MAXVALUE));
CREATE INDEX idx_1 ON test1(birthday) GLOBAL;
INSERT INTO test1 VALUES(101, 'test1', 'admin1', '19700101', 50.5, NULL);
INSERT INTO test1 VALUES(102, 'test2', 'admin2', '19800101', 55.5, 101);
INSERT INTO test1 VALUES(103, 'test3', 'admin3', '19900101', 60.5, 101);
INSERT INTO test1 VALUES(104, 'test4', 'admin4', '20000101', 65.5, 102);
INSERT INTO test1 VALUES(105, 'test5', 'admin5', '20100101', 70.5, 102);
INSERT INTO test1 VALUES(106, 'test6', 'admin6', '20200101', 75.5, 103);
INSERT INTO test1 VALUES(107, 'test7', 'admin7', '20300101', 80.5, 103);
INSERT INTO test1 VALUES(108, NULL, NULL, '20400101', NULL, NULL);
CREATE TABLE test2(id int PRIMARY KEY, name char(20), name_1 varchar(20), birthday DATE, weight float, p_id int)
PARTITION BY RANGE(id)
(PARTITION p1 VALUES less than(103), PARTITION p2 VALUES less than(105), PARTITION p3 VALUES less than(MAXVALUE));
CREATE INDEX idx_2 ON test2(birthday) GLOBAL;
INSERT INTO test2 VALUES(101, 'test1', 'admin1', '19700101', 50.5, NULL);
INSERT INTO test2 VALUES(102, 'test2', 'admin2', '19800101', 55.5, 101);
INSERT INTO test2 VALUES(103, 'test3', 'admin3', '19900101', 60.5, 101);
INSERT INTO test2 VALUES(104, 'test4', 'admin4', '20000101', 65.5, 102);
INSERT INTO test2 VALUES(105, 'test5', 'admin5', '20100101', 70.5, 102);
INSERT INTO test2 VALUES(106, 'test6', 'admin6', '20200101', 75.5, 103);
INSERT INTO test2 VALUES(107, 'test7', 'admin7', '20300101', 80.5, 103);
INSERT INTO test2 VALUES(108, NULL, NULL, '20400101', NULL, NULL);
CREATE TABLE test3(id int PRIMARY KEY, name char(20), name_1 varchar(20), birthday DATE, weight float, p_id int)
PARTITION BY RANGE(id) 
(PARTITION p1 VALUES less than(103), PARTITION p2 VALUES less than(105), PARTITION p3 VALUES less than(MAXVALUE));
CREATE INDEX idx_3 ON test3(birthday) GLOBAL;
drop table DemoOrganization;
create table DemoOrganization 
(
OrgID     int not null,
OrgName   VARCHAR(10),
OrgPath   VARCHAR(10),
ParentID  INTEGER,
OLevel    INTEGER default 0,
AddTime   DATE,
primary key (OrgID)) 
PARTITION BY RANGE(OrgID) (PARTITION p1 VALUES less than(7), PARTITION p2 VALUES less than(MAXVALUE));
CREATE INDEX in_1 ON DemoOrganization(AddTime) GLOBAL;
INSERT INTO DemoOrganization(OrgID,ORGNAME,OLEVEL,ORGPATH,PARENTID ,ADDTIME)
select 1,'组织机构1',1,'0',0,'19900101' from dual union all
select 2,'组织机构2',1,'0',0,'20000101' from dual union all
select 3,'组织机构3',1,'0',0,'20100101' from dual union all
select 4,'组织机构4',2,'1',1,'20200101' from dual union all
select 5,'组织机构5',2,'2',2,'20300101' from dual union all
select 6,'组织机构6',3,'1/4',4,'20400101' from dual union all
select 7,'组织机构7',3,'1/4',4,'20500101' from dual union all
select 8,'组织机构8',3,'2/5',5,'20600101' from dual union all
select 9,'组织机构9',4,'1/4/6',6,'20700101' from dual union all
select 10,'组织机构10',4,'1/4/6',6,'20800101' from dual union all
select 11,'组织机构11',4,'1/4/6',6,'20900101' from dual union all
select 12,'组织机构12',4,'2/5/8',8,'21000101' from dual union all
select 13,'组织机构13',4,'2/5/8',8,'21100101' from dual;
#sub-7-1	PL中使用 insert into values(subquery)
#sub-7-1-1	function
DELETE FROM test3;
DROP FUNCTION func1;
CREATE FUNCTION func1() RETURNS int
BEGIN
DECLARE var int DEFAULT 10;
INSERT INTO test3(id,name,birthday) VALUES(
(SELECT min(id) FROM test1),
(SELECT max(name) FROM test1),
(SELECT max(birthday) FROM test1));
INSERT INTO test3 VALUES(
(SELECT DISTINCT p_id FROM test1 WHERE id>=104 AND name<='test6' AND birthday<'20200101'),
(SELECT concat(trim(name),name_1) FROM test2 PARTITION(p3) WHERE id=105),
(SELECT name_1 FROM test1 WHERE birthday='20200101'),
(SELECT date_add(birthday,INTERVAL 1 YEAR) FROM test2 GROUP BY birthday HAVING birthday<'19800101'),
(SELECT weight FROM test1 ORDER BY 1 DESC LIMIT 1),
(SELECT p_id FROM test2 ORDER BY 1 LIMIT 1));
WHILE var=10 DO
INSERT INTO test3(id,birthday) VALUES(
(SELECT (CASE id WHEN 103 THEN 120 WHEN 105 THEN id+8 END) FROM test1 PARTITION(p3) WHERE name='test5'),
5+date_add((SELECT birthday FROM test1 WHERE id=107), INTERVAL (SELECT max(id-100) FROM test1 PARTITION(p3) WHERE (CASE WHEN id>105 THEN 20 ELSE -20 END)>0) YEAR));
SET var=var-10;
END WHILE;
RETURN 120;
END;
//
SELECT func1() FROM dual;
func1()
120
SELECT * FROM test3;
id	name	name_1	birthday	weight	p_id
101	test7	NULL	2040-01-01	NULL	NULL
102	test5admin5	admin6	1971-01-01	80.5	NULL
113	NULL	NULL	2038-01-06	NULL	NULL
DELETE FROM test3;
DROP FUNCTION func1;
CREATE FUNCTION func1() RETURNS int
BEGIN
DECLARE var int DEFAULT 10;
INSERT INTO test3 VALUES(
(SELECT b.id FROM test1 a, test1 b WHERE a.id=b.id GROUP BY b.id HAVING b.id<102),
(SELECT MAX(a.name) FROM test1 a, test2 PARTITION(p3) b WHERE a.birthday=b.birthday),
(SELECT a.name_1 FROM test1 a INNER JOIN test2 b ON a.name=b.name WHERE b.id IN (105,110,120)),
(SELECT DISTINCT a.birthday FROM test1 PARTITION(p3) a JOIN test1 b ON a.name>b.name WHERE b.name LIKE '%6%'),
(SELECT a.weight FROM test1 a LEFT JOIN test2 b ON a.name=b.name WHERE b.id IN (105,110,120)),
(SELECT DISTINCT a.p_id FROM test1 a LEFT OUTER JOIN test1 b ON a.name>b.name WHERE b.name LIKE '%6%'));
IF var=10 THEN
INSERT INTO test3(id,birthday) VALUES(
concat((SELECT MAX(id) FROM test1 a NATURAL JOIN test1 b WHERE id IS NOT NULL AND p_id IS NOT NULL),'111'),
(SELECT birthday FROM test1 a NATURAL JOIN test2 b WHERE name=SOME(SELECT 'test2' FROM dual UNION SELECT 'admin5' FROM dual UNION SELECT 'test8' FROM dual)));
END IF;
RETURN 120;
END;
//
SELECT func1() FROM dual;
func1()
120
SELECT * FROM test3;
id	name	name_1	birthday	weight	p_id
101	test7	admin5	2030-01-01	70.5	103
107111	NULL	NULL	1980-01-01	NULL	NULL
#sub-7-1-2	procedure
DELETE FROM test3;
DROP PROCEDURE pro1;
CREATE PROCEDURE pro1()
BEGIN
DECLARE var int DEFAULT 10;
INSERT INTO test3(id,birthday) VALUES(
(SELECT id FROM test1 WHERE name='test1' UNION SELECT id FROM test1 WHERE name='test9' UNION
SELECT b.id FROM test1 a, test1 b WHERE a.id=b.id GROUP BY b.id HAVING b.id<102),
(SELECT DISTINCT a.birthday FROM test1 a JOIN test1 b ON a.name>b.name WHERE b.name LIKE '%6%' UNION ALL
SELECT birthday FROM test1 WHERE id=111 UNION ALL SELECT birthday FROM test1 PARTITION(p3) WHERE birthday>'20400101'));
loop1:LOOP
INSERT INTO test3 VALUES(
(SELECT max(id) FROM (SELECT b.id FROM test1 a RIGHT JOIN test1 PARTITION(p3) b ON a.id=b.id GROUP BY b.id) t WHERE id>101),
(SELECT DISTINCT SUBSTR((SELECT name FROM test1 WHERE id=105),(SELECT id-100 FROM test1 WHERE name='test2'),id-100) FROM test1 WHERE name_1='admin3'),
(SELECT max(name_1) FROM test1 WHERE id IN (SELECT id FROM test2 WHERE id>102 AND id<105)),
(SELECT birthday FROM test1 WHERE (id,name,name_1)=(SELECT a.id,b.name,a.name_1 FROM test1 a,test2 b WHERE a.id=b.id AND a.name=b.name AND a.birthday=b.birthday AND a.name_1<'admin2')),
(SELECT weight FROM test1 GROUP BY weight HAVING weight>=
(SELECT weight FROM test2 WHERE id>106 AND weight IS NOT NULL UNION
SELECT weight FROM test1 WHERE name IS NOT NULL AND name='test7')),
(SELECT DISTINCT p_id FROM test1 WHERE id=(SELECT id FROM test1 WHERE name='test1' UNION SELECT id FROM test1 WHERE name='test9' UNION
SELECT b.id FROM test1 a, test1 b WHERE a.id=b.id GROUP BY b.id HAVING b.id<102)));
SET var=var-10;
IF var<>10 THEN
leave loop1;
END IF;
END LOOP;
END;
//
CALL pro1();
SELECT * FROM test3;
id	name	name_1	birthday	weight	p_id
101	NULL	NULL	2030-01-01	NULL	NULL
108	est	admin4	1970-01-01	80.5	NULL
DELETE FROM test3;
DROP PROCEDURE pro1;
CREATE PROCEDURE pro1()
BEGIN
DECLARE var int DEFAULT 10;
INSERT INTO test3(id,name,name_1,birthday) VALUES(
(SELECT min(a.id) FROM test1 a JOIN (SELECT * FROM test2 WHERE id>101) b ON a.id=b.id WHERE a.birthday>'19900101'),
(SELECT a.name FROM (SELECT a.* FROM test1 a right JOIN test2 b ON a.name=b.name WHERE b.id IN (105,106,120)) a RIGHT JOIN test2 b ON a.id=b.id WHERE a.name>'test5'),
(SELECT min(b.name_1) FROM (SELECT id FROM (SELECT id,name,birthday FROM test1) a WHERE name>'test1') a,(SELECT * FROM test2) b WHERE a.id=b.id),
(SELECT a.birthday FROM (SELECT id,birthday FROM test1 a NATURAL JOIN test2 b WHERE name=SOME(SELECT 'test2' FROM dual UNION SELECT 'admin3' FROM dual UNION SELECT 'test8' FROM dual)) a JOIN 
(SELECT DISTINCT b.id,a.birthday FROM test1 a JOIN test1 PARTITION(p3) b ON a.name>b.name WHERE b.name LIKE '%6%' UNION ALL
SELECT id,birthday FROM test1 WHERE id=111 UNION ALL SELECT id,birthday FROM test1 WHERE birthday>'20400101') b ON a.id<b.id));
INSERT INTO test3(id,birthday) VALUES(
CONCAT((SELECT MAX(a.id) FROM test1 a LEFT OUTER JOIN test2 b ON a.birthday=b.birthday 
UNION
SELECT a.id+3 FROM test1 a RIGHT JOIN test2 b ON a.name=b.name WHERE b.id IN (105,110,120)),'111'),
(SELECT date_add(birthday,INTERVAL 10 YEAR) FROM test2 PARTITION(p1) GROUP BY birthday HAVING birthday<'19800101'
UNION
SELECT birthday FROM test1  PARTITION(p3) a NATURAL JOIN test2 b WHERE name=SOME(SELECT 'test2' FROM dual UNION SELECT 'admin5' FROM dual UNION SELECT 'test8' FROM dual)));
REPEAT
INSERT INTO test3(id,name,name_1,birthday) VALUES(
(SELECT count(*) FROM
(SELECT ORGNAME as ORGNAME,
(Select ORGNAME from DemoOrganization s where s.ORGID=c.PARENTID) as PARENTNAME,
ORGPATH as ORGPATH,OLEVEL
from DemoOrganization c where ORGPATH like'2/%' and OLEVEL<=3) t),
NULL,
NULL,
(SELECT max(AddTime) FROM DemoOrganization D
WHERE ORGID IN (SELECT ORGID FROM DemoOrganization WHERE ORGID = 12 ORDER BY 1)));
until var=10 END REPEAT;
END;
//
CALL pro1();
SELECT * FROM test3;
id	name	name_1	birthday	weight	p_id
1	NULL	NULL	2100-01-01	NULL	NULL
104	test6	admin2	1980-01-01	NULL	NULL
108111	NULL	NULL	1980-01-01	NULL	NULL
#sub-7-2	subquery中调用自定义function
DROP TABLE test3;
DROP TABLE test4;
CREATE TABLE test3(id int, name char(20), name_1 varchar(20), birthday DATE, weight float, p_id int)
PARTITION BY RANGE(id) 
(PARTITION p1 VALUES less than(103), PARTITION p2 VALUES less than(105), PARTITION p3 VALUES less than(MAXVALUE));
CREATE TABLE test4 AS SELECT * FROM test1 WHERE 1=0;
CREATE INDEX idx_3 ON test3(birthday) GLOBAL;
DELETE FROM test3;
DELETE FROM test4;
DROP FUNCTION func1;
DROP FUNCTION func2;
CREATE FUNCTION func1(i int) RETURNS int
BEGIN
RETURN i/0.5;
END;
//
CREATE FUNCTION func2(i int) RETURNS int
BEGIN
INSERT INTO test3(id,name,birthday) VALUES(
(SELECT min(id) FROM test1),
(SELECT max(name) FROM test1),
(SELECT max(birthday) FROM test1));
RETURN i/0.5;
END;
//
INSERT INTO test4(id,birthday) VALUES(
(SELECT max(id)+10 FROM test2 WHERE p_id>func1(51)),
(SELECT max(date_add(birthday,INTERVAL func2(10) YEAR)) FROM test2 WHERE id IS NOT NULL AND name>'test5'));
SELECT * FROM test3;
id	name	name_1	birthday	weight	p_id
101	test7	NULL	2040-01-01	NULL	NULL
101	test7	NULL	2040-01-01	NULL	NULL
SELECT * FROM test4;
id	name	name_1	birthday	weight	p_id
117	NULL	NULL	2050-01-01	NULL	NULL
#sub-7-3	values中使用自定义function，且其参数为subquery
DELETE FROM test3;
DELETE FROM test4;
INSERT INTO test4(id,birthday) VALUES(
func1((SELECT DISTINCT a.p_id+10 FROM test2 a JOIN test2 b ON a.id=b.p_id WHERE a.p_id IS NOT NULL))/2,
date_add((SELECT min(birthday) FROM test2),INTERVAL (func2((SELECT max(p_id) FROM test2 WHERE id>=(SELECT min(id) FROM test2) AND p_id IS NOT NULL))/2) YEAR));
SELECT * FROM test3;
id	name	name_1	birthday	weight	p_id
101	test7	NULL	2040-01-01	NULL	NULL
SELECT * FROM test4;
id	name	name_1	birthday	weight	p_id
111	NULL	NULL	2073-01-01	NULL	NULL
#sub-8	其它对象测试
DROP TABLE test1;
DROP TABLE test2;
DROP TABLE test3;
CREATE TABLE test1(id int, name char(20), name_1 varchar(20), birthday DATE, weight float, p_id int, PRIMARY KEY(id,birthday))
PARTITION BY RANGE(id) 
(PARTITION p1 VALUES less than(103), PARTITION p2 VALUES less than(105), PARTITION p3 VALUES less than(MAXVALUE));
CREATE INDEX idx_11 ON test1(birthday) GLOBAL;
CREATE INDEX idx_12 ON test1(name) GLOBAL;
INSERT INTO test1 VALUES(101, 'test1', 'admin1', '19700101', 50.5, NULL);
INSERT INTO test1 VALUES(102, 'test2', 'admin2', '19800101', 55.5, 101);
INSERT INTO test1 VALUES(103, 'test3', 'admin3', '19900101', 60.5, 101);
INSERT INTO test1 VALUES(104, 'test4', 'admin4', '20000101', 65.5, 102);
INSERT INTO test1 VALUES(105, 'test5', 'admin5', '20100101', 70.5, 102);
INSERT INTO test1 VALUES(106, 'test6', 'admin6', '20200101', 75.5, 103);
INSERT INTO test1 VALUES(107, 'test7', 'admin7', '20300101', 80.5, 103);
INSERT INTO test1 VALUES(108, NULL, NULL, '20400101', NULL, NULL);
CREATE TABLE test2(id int, name char(20), name_1 varchar(20), birthday DATE, weight float, p_id int, PRIMARY KEY(id,birthday))
PARTITION BY RANGE(id) 
(PARTITION p1 VALUES less than(103), PARTITION p2 VALUES less than(105), PARTITION p3 VALUES less than(MAXVALUE));
CREATE INDEX idx_21 ON test2(birthday) GLOBAL;
CREATE INDEX idx_22 ON test2(name) GLOBAL;
INSERT INTO test2 VALUES(101, 'test1', 'admin1', '19700101', 50.5, NULL);
INSERT INTO test2 VALUES(102, 'test2', 'admin2', '19800101', 55.5, 101);
INSERT INTO test2 VALUES(103, 'test3', 'admin3', '19900101', 60.5, 101);
INSERT INTO test2 VALUES(104, 'test4', 'admin4', '20000101', 65.5, 102);
INSERT INTO test2 VALUES(105, 'test5', 'admin5', '20100101', 70.5, 102);
INSERT INTO test2 VALUES(106, 'test6', 'admin6', '20200101', 75.5, 103);
INSERT INTO test2 VALUES(107, 'test7', 'admin7', '20300101', 80.5, 103);
INSERT INTO test2 VALUES(108, NULL, NULL, '20400101', NULL, NULL);
CREATE TABLE test3(id int, name char(20), name_1 varchar(20), birthday DATE, weight float, p_id int, PRIMARY KEY(id,birthday))
PARTITION BY RANGE(id) 
(PARTITION p1 VALUES less than(103), PARTITION p2 VALUES less than(105), PARTITION p3 VALUES less than(MAXVALUE));
CREATE INDEX idx_31 ON test3(birthday) GLOBAL;
CREATE INDEX idx_32 ON test3(name) GLOBAL;
CREATE OR REPLACE VIEW test1_view AS SELECT * FROM test1;
CREATE OR REPLACE VIEW test2_view AS SELECT * FROM test2;
CREATE OR REPLACE VIEW test3_view AS SELECT * FROM test3;
CREATE OR REPLACE VIEW test1_view_view AS SELECT * FROM test1_view;
CREATE OR REPLACE VIEW test2_view_view AS SELECT * FROM test2_view;
CREATE OR REPLACE VIEW test3_view_view AS SELECT * FROM test3_view;
#sub-8-1	view
DELETE FROM test3;
INSERT INTO test3_view VALUES(
(SELECT max(id) FROM (SELECT b.id FROM test1_view a RIGHT JOIN test1_view b ON a.id=b.id GROUP BY b.id) t WHERE id>101),
(SELECT DISTINCT SUBSTR((SELECT name FROM test1_view WHERE id=105),(SELECT id-100 FROM test1_view WHERE name='test2'),id-100) FROM test1_view WHERE name_1='admin3'),
(SELECT max(name_1) FROM test1_view WHERE id IN (SELECT id FROM test2_view WHERE id>102 AND id<105)),
(SELECT birthday FROM test1_view WHERE (id,name,name_1)=(SELECT a.id,b.name,a.name_1 FROM test1_view a,test2_view b WHERE a.id=b.id AND a.name=b.name AND a.birthday=b.birthday AND a.name_1<'admin2')),
(SELECT weight FROM test1_view GROUP BY weight HAVING weight>=
(SELECT weight FROM test2_view WHERE id>106 AND weight IS NOT NULL UNION
SELECT weight FROM test1_view WHERE name IS NOT NULL AND name='test7')),
(SELECT DISTINCT p_id FROM test1_view WHERE id=(SELECT id FROM test1_view WHERE name='test1' UNION SELECT id FROM test1_view WHERE name='test9' UNION
SELECT b.id FROM test1_view a, test1_view b WHERE a.id=b.id GROUP BY b.id HAVING b.id<102)));
INSERT INTO test3_view(id,name,name_1,birthday) VALUES(
(SELECT min(a.id) FROM test1_view a JOIN (SELECT * FROM test2_view WHERE id>101) b ON a.id=b.id WHERE a.birthday>'19900101'),
(SELECT a.name FROM (SELECT a.* FROM test1_view a right JOIN test2_view b ON a.name=b.name WHERE b.id IN (105,106,120)) a RIGHT JOIN test2_view b ON a.id=b.id WHERE a.name>'test5'),
(SELECT min(b.name_1) FROM (SELECT id FROM (SELECT id,name,birthday FROM test1_view) a WHERE name>'test1') a,(SELECT * FROM test2_view) b WHERE a.id=b.id),
(SELECT a.birthday FROM (SELECT id,birthday FROM test1_view a NATURAL JOIN test2_view b WHERE name=SOME(SELECT 'test2' FROM dual UNION SELECT 'admin3' FROM dual UNION SELECT 'test8' FROM dual)) a JOIN 
(SELECT DISTINCT b.id,a.birthday FROM test1_view a JOIN test1_view b ON a.name>b.name WHERE b.name LIKE '%6%' UNION ALL
SELECT id,birthday FROM test1_view WHERE id=111 UNION ALL SELECT id,birthday FROM test1_view WHERE birthday>'20400101') b ON a.id<b.id));
INSERT INTO test3_view(id,birthday) VALUES(
CONCAT((SELECT MAX(a.id) FROM test1_view a LEFT OUTER JOIN test2_view b ON a.birthday=b.birthday 
UNION
SELECT a.id+3 FROM test1_view a RIGHT JOIN test2_view b ON a.name=b.name WHERE b.id IN (105,110,120)),'111'),
(SELECT date_add(birthday,INTERVAL 10 YEAR) FROM test2_view GROUP BY birthday HAVING birthday<'19800101'
UNION
SELECT birthday FROM test1_view a NATURAL JOIN test2_view b WHERE name=SOME(SELECT 'test2' FROM dual UNION SELECT 'admin5' FROM dual UNION SELECT 'test8' FROM dual)));
SELECT * FROM test3;
id	name	name_1	birthday	weight	p_id
104	test6	admin2	1980-01-01	NULL	NULL
108	est	admin4	1970-01-01	80.5	NULL
108111	NULL	NULL	1980-01-01	NULL	NULL
#sub-8-2	对view创建的view
DELETE FROM test3;
INSERT INTO test3_view_view VALUES(
(SELECT max(id) FROM (SELECT b.id FROM test1_view_view a RIGHT JOIN test1_view_view b ON a.id=b.id GROUP BY b.id) t WHERE id>101),
(SELECT DISTINCT SUBSTR((SELECT name FROM test1_view_view WHERE id=105),(SELECT id-100 FROM test1_view_view WHERE name='test2'),id-100) FROM test1_view_view WHERE name_1='admin3'),
(SELECT max(name_1) FROM test1_view_view WHERE id IN (SELECT id FROM test2_view_view WHERE id>102 AND id<105)),
(SELECT birthday FROM test1_view_view WHERE (id,name,name_1)=(SELECT a.id,b.name,a.name_1 FROM test1_view_view a,test2_view_view b WHERE a.id=b.id AND a.name=b.name AND a.birthday=b.birthday AND a.name_1<'admin2')),
(SELECT weight FROM test1_view_view GROUP BY weight HAVING weight>=
(SELECT weight FROM test2_view_view WHERE id>106 AND weight IS NOT NULL UNION
SELECT weight FROM test1_view_view WHERE name IS NOT NULL AND name='test7')),
(SELECT DISTINCT p_id FROM test1_view_view WHERE id=(SELECT id FROM test1_view_view WHERE name='test1' UNION SELECT id FROM test1_view_view WHERE name='test9' UNION
SELECT b.id FROM test1_view_view a, test1_view_view b WHERE a.id=b.id GROUP BY b.id HAVING b.id<102)));
INSERT INTO test3_view_view(id,name,name_1,birthday) VALUES(
(SELECT min(a.id) FROM test1_view_view a JOIN (SELECT * FROM test2_view_view WHERE id>101) b ON a.id=b.id WHERE a.birthday>'19900101'),
(SELECT a.name FROM (SELECT a.* FROM test1_view_view a right JOIN test2_view_view b ON a.name=b.name WHERE b.id IN (105,106,120)) a RIGHT JOIN test2_view_view b ON a.id=b.id WHERE a.name>'test5'),
(SELECT min(b.name_1) FROM (SELECT id FROM (SELECT id,name,birthday FROM test1_view_view) a WHERE name>'test1') a,(SELECT * FROM test2_view_view) b WHERE a.id=b.id),
(SELECT a.birthday FROM (SELECT id,birthday FROM test1_view_view a NATURAL JOIN test2_view_view b WHERE name=SOME(SELECT 'test2' FROM dual UNION SELECT 'admin3' FROM dual UNION SELECT 'test8' FROM dual)) a JOIN 
(SELECT DISTINCT b.id,a.birthday FROM test1_view_view a JOIN test1_view_view b ON a.name>b.name WHERE b.name LIKE '%6%' UNION ALL
SELECT id,birthday FROM test1_view_view WHERE id=111 UNION ALL SELECT id,birthday FROM test1_view_view WHERE birthday>'20400101') b ON a.id<b.id));
INSERT INTO test3_view_view(id,birthday) VALUES(
CONCAT((SELECT MAX(a.id) FROM test1_view_view a LEFT OUTER JOIN test2_view_view b ON a.birthday=b.birthday 
UNION
SELECT a.id+3 FROM test1_view_view a RIGHT JOIN test2_view_view b ON a.name=b.name WHERE b.id IN (105,110,120)),'111'),
(SELECT date_add(birthday,INTERVAL 10 YEAR) FROM test2_view_view GROUP BY birthday HAVING birthday<'19800101'
UNION
SELECT birthday FROM test1_view_view a NATURAL JOIN test2_view_view b WHERE name=SOME(SELECT 'test2' FROM dual UNION SELECT 'admin5' FROM dual UNION SELECT 'test8' FROM dual)));
SELECT * FROM test3;
id	name	name_1	birthday	weight	p_id
104	test6	admin2	1980-01-01	NULL	NULL
108	est	admin4	1970-01-01	80.5	NULL
108111	NULL	NULL	1980-01-01	NULL	NULL
drop user 'yyl_mysql'@'%';
