set @@ob_query_timeout = 1000000*60*60*10, @@ob_trx_timeout=1000000*60*60*10;
alter system set direct_load_allow_fallback=False;
create table t_pqTly6tEb1(c1 int, c2 int, c3 int);
================ test autoinc column =========
create table t1_pqTly6tEb1(
c1 int,
c2 int,
c3 int,
c_autoinc int AUTO_INCREMENT
);
alter table t1_pqTly6tEb1 drop column c_autoinc;
select * from t1_pqTly6tEb1 order by c1;
c1	c2	c3
3	1	2
33	11	22
333	111	222
delete from t1_pqTly6tEb1;
insert /*+ enable_parallel_dml parallel(2) append */ into t1_pqTly6tEb1 select * from t_pqTly6tEb1;
select * from t1_pqTly6tEb1 order by c1;
c1	c2	c3
3	1	2
33	11	22
333	111	222
drop table t1_pqTly6tEb1;
================ test nomal column =========
create table t1_pqTly6tEb1(
c1 int,
c2 int,
c3 int,
c_bool bool,
c_bool_def bool default true,
c_boolean boolean,
c_boolean_def boolean default false
);
alter table t1_pqTly6tEb1
drop column c_bool,
drop column c_bool_def,
drop column c_boolean,
drop column c_boolean_def;
select * from t1_pqTly6tEb1 order by c1;
c1	c2	c3
3	1	2
33	11	22
333	111	222
delete from t1_pqTly6tEb1;
insert /*+ enable_parallel_dml parallel(2) append */ into t1_pqTly6tEb1 select * from t_pqTly6tEb1;
select * from t1_pqTly6tEb1 order by c1;
c1	c2	c3
3	1	2
33	11	22
333	111	222
drop table t1_pqTly6tEb1;
create table t1_pqTly6tEb1(
c1 int,
c2 int,
c3 int,
c_tinyint tinyint,
c_tinyint_def tinyint default 1,
c_smallint smallint,
c_smallint_def smallint default 2,
c_mediumint mediumint,
c_mediumint_def mediumint default 3,
c_int int,
c_int_def int default 4,
c_integer int,
c_integer_def integer default 5,
c_bigint bigint,
c_bigint_def bigint default 6
);
alter table t1_pqTly6tEb1
drop column c_tinyint,
drop column c_tinyint_def,
drop column c_smallint,
drop column c_smallint_def,
drop column c_mediumint,
drop column c_mediumint_def,
drop column c_int,
drop column c_int_def,
drop column c_integer,
drop column c_integer_def,
drop column c_bigint,
drop column c_bigint_def;
select * from t1_pqTly6tEb1 order by c1;
c1	c2	c3
3	1	2
33	11	22
333	111	222
delete from t1_pqTly6tEb1;
insert /*+ enable_parallel_dml parallel(2) append */ into t1_pqTly6tEb1 select * from t_pqTly6tEb1;
select * from t1_pqTly6tEb1 order by c1;
c1	c2	c3
3	1	2
33	11	22
333	111	222
drop table t1_pqTly6tEb1;
create table t1_pqTly6tEb1(
c1 int,
c2 int,
c3 int,
c_float float,
c_float_def float default 5.5,
c_double double,
c_double_def double default 7.7
);
alter table t1_pqTly6tEb1
drop column c_float,
drop column c_float_def,
drop column c_double,
drop column c_double_def;
select * from t1_pqTly6tEb1 order by c1;
c1	c2	c3
3	1	2
33	11	22
333	111	222
delete from t1_pqTly6tEb1;
insert /*+ enable_parallel_dml parallel(2) append */ into t1_pqTly6tEb1 select * from t_pqTly6tEb1;
select * from t1_pqTly6tEb1 order by c1;
c1	c2	c3
3	1	2
33	11	22
333	111	222
drop table t1_pqTly6tEb1;
create table t1_pqTly6tEb1(
c1 int,
c2 int,
c3 int,
c_char char(16),
c_char_def char(16) default 'hello world',
c_varchar varchar(16),
c_varchar_def varchar(16) default 'hello world',
c_binary binary(10),
c_binary_def binary(10) default 'aa',
c_varbinary varbinary(16),
c_varbinary_def varbinary(16) default b'101010'
);
alter table t1_pqTly6tEb1
drop column c_char,
drop column c_char_def,
drop column c_varchar,
drop column c_varchar_def,
drop column c_binary,
drop column c_binary_def,
drop column c_varbinary,
drop column c_varbinary_def;
select * from t1_pqTly6tEb1 order by c1;
c1	c2	c3
3	1	2
33	11	22
333	111	222
delete from t1_pqTly6tEb1;
insert /*+ enable_parallel_dml parallel(2) append */ into t1_pqTly6tEb1 select * from t_pqTly6tEb1;
select * from t1_pqTly6tEb1 order by c1;
c1	c2	c3
3	1	2
33	11	22
333	111	222
drop table t1_pqTly6tEb1;
create table t1_pqTly6tEb1(
c1 int,
c2 int,
c3 int,
c_date date,
c_date_def date default '2024-08-07 10:10:10',
c_time time,
c_time_def time default '2024-08-08',
c_timestamp timestamp,
c_timestamp_def timestamp default '2024-08-07 11:11:11.111222'
);
alter table t1_pqTly6tEb1
drop column c_date,
drop column c_date_def,
drop column c_time,
drop column c_time_def,
drop column c_timestamp,
drop column c_timestamp_def;
select * from t1_pqTly6tEb1 order by c1;
c1	c2	c3
3	1	2
33	11	22
333	111	222
delete from t1_pqTly6tEb1;
insert /*+ enable_parallel_dml parallel(2) append */ into t1_pqTly6tEb1 select * from t_pqTly6tEb1;
select * from t1_pqTly6tEb1 order by c1;
c1	c2	c3
3	1	2
33	11	22
333	111	222
drop table t1_pqTly6tEb1;
create table t1_pqTly6tEb1(
c1 int,
c2 int,
c3 int,
c4 text,
c_blob blob,
c_text text,
c_json json
);
alter table t1_pqTly6tEb1
drop column c_blob,
drop column c_text,
drop column c_json;
select * from t1_pqTly6tEb1 order by c1;
c1	c2	c3	c4
3	1	2	NULL
33	11	22	NULL
333	111	222	NULL
delete from t1_pqTly6tEb1;
insert /*+ enable_parallel_dml parallel(2) append */ into t1_pqTly6tEb1 (c1, c2, c3) select * from t_pqTly6tEb1;
select * from t1_pqTly6tEb1 order by c1;
c1	c2	c3	c4
3	1	2	NULL
33	11	22	NULL
333	111	222	NULL
drop table t1_pqTly6tEb1;
================ test generated column =========
create table t1_pqTly6tEb1(
c1 int,
c2 int,
c3 int,
c_vg int GENERATED ALWAYS AS (c2 + c3) virtual
);
alter table t1_pqTly6tEb1 drop column c_vg;
select * from t1_pqTly6tEb1 order by c1;
c1	c2	c3
3	1	2
33	11	22
333	111	222
delete from t1_pqTly6tEb1;
insert /*+ enable_parallel_dml parallel(2) append */ into t1_pqTly6tEb1 select * from t_pqTly6tEb1;
select * from t1_pqTly6tEb1 order by c1;
c1	c2	c3
3	1	2
33	11	22
333	111	222
drop table t1_pqTly6tEb1;
create table t1_pqTly6tEb1(
c1 int,
c2 int,
c3 int,
c_vg int GENERATED ALWAYS AS (c2 + c3) stored
);
alter table t1_pqTly6tEb1 drop column c_vg;
select * from t1_pqTly6tEb1 order by c1;
c1	c2	c3
3	1	2
33	11	22
333	111	222
delete from t1_pqTly6tEb1;
insert /*+ enable_parallel_dml parallel(2) append */ into t1_pqTly6tEb1 select * from t_pqTly6tEb1;
select * from t1_pqTly6tEb1 order by c1;
c1	c2	c3
3	1	2
33	11	22
333	111	222
drop table t1_pqTly6tEb1;
create table t1_pqTly6tEb1(
c1 int,
c_vg1 int GENERATED ALWAYS AS (c1 / 2), 
c2 int,
c_vg2 int GENERATED ALWAYS AS (c1 + c2) stored,
c3 int,
c_vg3 int GENERATED ALWAYS AS (c3 - c1)
);
alter table t1_pqTly6tEb1 drop column c_vg1;
alter table t1_pqTly6tEb1 drop column c_vg2;
alter table t1_pqTly6tEb1 drop column c_vg3;
select * from t1_pqTly6tEb1 order by c1;
c1	c2	c3
3	1	2
33	11	22
333	111	222
delete from t1_pqTly6tEb1;
insert /*+ enable_parallel_dml parallel(2) append */ into t1_pqTly6tEb1 select * from t_pqTly6tEb1;
select * from t1_pqTly6tEb1 order by c1;
c1	c2	c3
3	1	2
33	11	22
333	111	222
drop table t1_pqTly6tEb1;
================ test partition exchange =========
create table t1_pqTly6tEb1(
c1 int,
c2 int,
c3 int,
c_int int
) partition by range(c1) (
partition p0 values less than(1000),
partition p1 values less than(2000),
partition p2 values less than (MAXVALUE)
);
alter table t1_pqTly6tEb1 drop column c_int;
ERROR 0A000: partition level direct-load for table has drop column instant is not supported
select * from t1_pqTly6tEb1 order by c1;
c1	c2	c3
delete from t1_pqTly6tEb1;
insert /*+ enable_parallel_dml parallel(2) append */ into t1_pqTly6tEb1 partition(p0) select * from t_pqTly6tEb1;
ERROR 0A000: partition level direct-load for table has drop column instant is not supported
select * from t1_pqTly6tEb1 order by c1;
c1	c2	c3
drop table t1_pqTly6tEb1;
create table t1_pqTly6tEb1(
c1 int,
c2 int,
c3 int,
c_autoinc int AUTO_INCREMENT
) partition by range(c1) (
partition p0 values less than(1000),
partition p1 values less than(2000),
partition p2 values less than (MAXVALUE)
);
alter table t1_pqTly6tEb1 drop column c_autoinc;
select * from t1_pqTly6tEb1 order by c1;
c1	c2	c3
3	1	2
33	11	22
333	111	222
delete from t1_pqTly6tEb1;
insert /*+ enable_parallel_dml parallel(2) append */ into t1_pqTly6tEb1 partition(p0) select * from t_pqTly6tEb1;
select * from t1_pqTly6tEb1 order by c1;
c1	c2	c3
3	1	2
33	11	22
333	111	222
drop table t1_pqTly6tEb1;
drop table t_pqTly6tEb1;
alter system set direct_load_allow_fallback=True;
