set @@recyclebin = off;
drop database if exists jx_db;
set the session variable
set @@recyclebin = on;
show session variables like 'recyclebin';
Variable_name	Value
recyclebin	ON
create database jx_db;
use jx_db;
create table t1(c1 int primary key, c2 int, c3 int, index idx1(c2), index idx2(c2, c3));
CREATE INDEX test_index on t1(c2, c3);
drop table t1;
1
select a.table_name from oceanbase.__all_virtual_table a left join oceanbase.__all_virtual_ddl_operation b on a.table_id = b.table_id where b.ddl_stmt_str != '' order by b.schema_version desc limit 1;
table_name
t1
show index from t1;
Table	Non_unique	Key_name	Seq_in_index	Column_name	Collation	Cardinality	Sub_part	Packed	Null	Index_type	Comment	Index_comment	Visible
t1	0	PRIMARY	1	c1	A	NULL	NULL	NULL		BTREE	available		YES
t1	1	idx1	1	c2	A	NULL	NULL	NULL	YES	BTREE	available		YES
t1	1	idx2	1	c2	A	NULL	NULL	NULL	YES	BTREE	available		YES
t1	1	idx2	2	c3	A	NULL	NULL	NULL	YES	BTREE	available		YES
t1	1	test_index	1	c2	A	NULL	NULL	NULL	YES	BTREE	available		YES
t1	1	test_index	2	c3	A	NULL	NULL	NULL	YES	BTREE	available		YES
create table t2(c1 int primary key, c2 int, c3 int, index(c2), index(c2, c3));
create view v2 as select * from t2;
drop view v2;
1
select a.table_name from oceanbase.__all_virtual_table a left join oceanbase.__all_virtual_ddl_operation b on a.table_id = b.table_id where b.ddl_stmt_str != '' order by b.schema_version desc limit 1;
table_name
v2
drop database jx_db;
1
select a.database_name from oceanbase.__all_virtual_database a left join oceanbase.__all_virtual_ddl_operation b on a.database_id = b.database_id where b.ddl_stmt_str != '' order by b.schema_version desc limit 1;
database_name
jx_db
use jx_db;
show tables;
Tables_in_jx_db
t1
t2
v2
set @@recyclebin = on;
drop database jx_db;
purge recyclebin;
delete from oceanbase.__all_ddl_id;
alter system change tenant sys;
delete from oceanbase.__all_ddl_id;
alter system change tenant sys;
drop database if exists jx_drc;
create database jx_drc;
use jx_drc;
set @__oceanbase_ddl_id = '1_1_123456710';
create table t1(c1 int primary key, c2 int, c3 int, index idx1(c2), index idx2(c2, c3));
set @__oceanbase_ddl_id = '1_1_123456711';
CREATE INDEX test_index on t1(c2, c3);
set @__oceanbase_ddl_id = '1_1_123456716';
drop table t1;
select a.table_name from oceanbase.__all_virtual_table a left join oceanbase.__all_virtual_ddl_operation b on a.table_id = b.table_id where b.ddl_stmt_str != '' order by b.schema_version desc limit 1;
table_name
t1
use jx_drc;
show index from t1;
Table	Non_unique	Key_name	Seq_in_index	Column_name	Collation	Cardinality	Sub_part	Packed	Null	Index_type	Comment	Index_comment	Visible
t1	0	PRIMARY	1	c1	A	NULL	NULL	NULL		BTREE	available		YES
t1	1	idx1	1	c2	A	NULL	NULL	NULL	YES	BTREE	available		YES
t1	1	idx2	1	c2	A	NULL	NULL	NULL	YES	BTREE	available		YES
t1	1	idx2	2	c3	A	NULL	NULL	NULL	YES	BTREE	available		YES
t1	1	test_index	1	c2	A	NULL	NULL	NULL	YES	BTREE	available		YES
t1	1	test_index	2	c3	A	NULL	NULL	NULL	YES	BTREE	available		YES
set @__oceanbase_ddl_id = '1_1_123456731';
create table t2(c1 int primary key, c2 int, c3 int, index(c2), index(c2, c3));
set @__oceanbase_ddl_id = '1_1_123456732';
create view v2 as select * from t2;
set @__oceanbase_ddl_id = '1_1_123456733';
drop view v2;
select a.table_name from oceanbase.__all_virtual_table a left join oceanbase.__all_virtual_ddl_operation b on a.table_id = b.table_id where b.ddl_stmt_str != '' order by b.schema_version desc limit 1;
table_name
v2
set @__oceanbase_ddl_id = '1_1_123456830';
create table jx_t1(a int, b int, c int, d int, e int, primary key(a,b,c,d), index (b), index idx2(c)) partition by hash(b) partitions 2;
set @__oceanbase_ddl_id = '1_1_123456831';
create index gkey on jx_t1(b,c,d) global partition by hash(b) partitions 5;
set @__oceanbase_ddl_id = '1_1_123456832';
drop table jx_t1;
select a.table_name from oceanbase.__all_virtual_table a left join oceanbase.__all_virtual_ddl_operation b on a.table_id = b.table_id where b.ddl_stmt_str != '' order by b.schema_version desc limit 1;
table_name
jx_t1
show index from jx_t1;
Table	Non_unique	Key_name	Seq_in_index	Column_name	Collation	Cardinality	Sub_part	Packed	Null	Index_type	Comment	Index_comment	Visible
jx_t1	0	PRIMARY	1	a	A	NULL	NULL	NULL		BTREE	available		YES
jx_t1	0	PRIMARY	2	b	A	NULL	NULL	NULL		BTREE	available		YES
jx_t1	0	PRIMARY	3	c	A	NULL	NULL	NULL		BTREE	available		YES
jx_t1	0	PRIMARY	4	d	A	NULL	NULL	NULL		BTREE	available		YES
jx_t1	1	b	1	b	A	NULL	NULL	NULL		BTREE	available		YES
jx_t1	1	idx2	1	c	A	NULL	NULL	NULL		BTREE	available		YES
jx_t1	1	gkey	1	b	A	NULL	NULL	NULL		BTREE	available		YES
jx_t1	1	gkey	2	c	A	NULL	NULL	NULL		BTREE	available		YES
jx_t1	1	gkey	3	d	A	NULL	NULL	NULL		BTREE	available		YES
set @__oceanbase_ddl_id = '1_1_123456741';
drop database jx_drc;
select a.database_name from oceanbase.__all_virtual_database a left join oceanbase.__all_virtual_ddl_operation b on a.database_id = b.database_id where b.ddl_stmt_str != '' order by b.schema_version desc limit 1;
database_name
jx_drc
set @__oceanbase_ddl_id = '1_1_123456743';
use jx_drc;
show tables;
Tables_in_jx_drc
jx_t1
t1
t2
v2
set @@recyclebin = on;
set @__oceanbase_ddl_id = '1_1_123456744';
drop database jx_drc;
