set @@recyclebin = off;
drop database if exists hualong;
drop database if exists hualong_2;
drop database if exists hualong_3;
drop database if exists hualong_4;
drop database if exists hualong_5;
drop database if exists new_hualong_5;
drop database if exists hulong_6;
drop tablegroup if exists tg1;
drop tablegroup if exists tg2;
create database hualong;
create database hualong_2;
create tablegroup tg1;
create tablegroup tg2;
create table hualong.tr1 (c1 int primary key, c2 int, key(c1), unique key(c2));
insert into hualong.tr1 values (1,1), (2,2), (3,3);
select * from hualong.tr1;
c1	c2
1	1
2	2
3	3
use hualong;
create table tr2 (c1 int, c2 varchar(100));
alter tablegroup tg1 add table hualong.tr1;
alter tablegroup tg2 add table hualong.tr2;
set @@recyclebin = on;
flashback table t1 to before drop;
ERROR HY000: object not in RECYCLE BIN
flashback table tr1 to before drop;
ERROR HY000: object not in RECYCLE BIN
flashback database hualong to before drop;
ERROR HY000: object not in RECYCLE BIN
flashback database xxxx to before drop;
ERROR HY000: object not in RECYCLE BIN
drop table tr1;
select database();
database()
NULL
FLASHBACK TABLE __recycle_$_1_1688535624460528 TO BEFORE DROP;
ERROR 3D000: No database selected
create table tr1 (c1 int primary key, c2 int);
flashback table tr1 to before drop
ERROR 42S01: Table 'tr1' already exists
flashback index tr1_index_c1 from recyclebin
ERROR HY000: object not in RECYCLE BIN
flashback table tr1 to before drop rename to hualong2.tr1
ERROR 42000: Unknown database 'hualong2'
flashback table tr1 to before drop rename to hualong.tr2
ERROR 42S01: Table 'tr2' already exists
drop table tr1;
show databases like '__recyclebin';
Database (__recyclebin)
flashback table tr1 to recyclebin
ERROR HY000: Operation not allowed now
show tables from __recyclebin;
use __recyclebin;
use hualong;
drop database hualong_2;
flashback table to database in recyclebin
ERROR HY000: Operation not allowed now
drop tablegroup tg1;
flashback table tr1 to before drop
show create table tr1;
Table	Create Table
tr1	CREATE TABLE `tr1` (
  `c1` int(11) NOT NULL,
  `c2` int(11) DEFAULT NULL,
  PRIMARY KEY (`c1`),
  UNIQUE KEY `c2` (`c2`) BLOCK_SIZE 16384 LOCAL,
  KEY `c1` (`c1`) BLOCK_SIZE 16384 LOCAL
) ORGANIZATION INDEX DEFAULT CHARSET = utf8mb4 COMPRESSION = 'lz4_1.0' REPLICA_NUM = NUM BLOCK_SIZE = SIZE USE_BLOOM_FILTER = FALSE ENABLE_MACRO_BLOCK_BLOOM_FILTER = FALSE TABLET_SIZE = SIZE PCTFREE = 10
alter tablegroup tg2 add table tr1;
drop table tr1;
flashback table tr1 to before drop
show create table tr1;
Table	Create Table
tr1	CREATE TABLE `tr1` (
  `c1` int(11) NOT NULL,
  `c2` int(11) DEFAULT NULL,
  PRIMARY KEY (`c1`),
  UNIQUE KEY `c2` (`c2`) BLOCK_SIZE 16384 LOCAL,
  KEY `c1` (`c1`) BLOCK_SIZE 16384 LOCAL
) ORGANIZATION INDEX DEFAULT CHARSET = utf8mb4 COMPRESSION = 'lz4_1.0' REPLICA_NUM = NUM BLOCK_SIZE = SIZE USE_BLOOM_FILTER = FALSE ENABLE_MACRO_BLOCK_BLOOM_FILTER = FALSE TABLET_SIZE = SIZE PCTFREE = 10
drop table tr1;
purge table tr123;
ERROR HY000: object not in RECYCLE BIN
purge table hualong.tr123;
ERROR HY000: object not in RECYCLE BIN
purge database hualong;
ERROR HY000: object not in RECYCLE BIN
purge database xxxxx;
ERROR HY000: object not in RECYCLE BIN
purge database using table_object_name
ERROR HY000: object not in RECYCLE BIN
select * from __recyclebin.tr1
insert into table in recyclebin
ERROR HY000: can not perform DDL/DML over objects in Recycle Bin
replace into table in recyclebin
ERROR HY000: can not perform DDL/DML over objects in Recycle Bin
update table in recyclebin
ERROR HY000: can not perform DDL/DML over objects in Recycle Bin
delete from table in recyclebin
ERROR HY000: can not perform DDL/DML over objects in Recycle Bin
alter database in recyclebin
ERROR HY000: can not perform DDL/DML over objects in Recycle Bin
drop database in recyclebin
ERROR HY000: can not perform DDL/DML over objects in Recycle Bin
create database hualong_3;
create table hualong_3.tr3 (c1 int primary key);
create index idx on hualong_3.tr3 (c1);
create view hualong_3.v3 as select c1 from hualong_3.tr3;
drop table hualong_3.tr3;
drop view hualong_3.v3;
drop database hualong_3;
select count(*) from oceanbase.__all_virtual_recyclebin where datababase = 'hualong_3';
count(*)
4
purge database hualong_3;
select count(*) from oceanbase.__all_virtual_recyclebin where datababase = 'hualong_3';
count(*)
0
create database hualong_4;
create table hualong_4.tr4 (c1 int primary key);
create index idx on hualong_4.tr4 (c1);
create view hualong_4.v4 as select c1 from hualong_4.tr4;
drop table hualong_4.tr4;
drop view hualong_4.v4;
select count(*) from oceanbase.__all_virtual_recyclebin where datababase = 'hualong_4';
count(*)
3
create database hualong_5;
drop database hualong_5;
create database new_hualong_5;
falshback database hualong_5 to before drop rename to new_hualong_5
ERROR HY000: Can't create database 'new_hualong_5'; database exists
set @@recyclebin = off;
drop database hualong_4;
drop database new_hualong_5;
select count(*) from oceanbase.__all_virtual_recyclebin where datababase = 'hualong_4';
count(*)
0
set @@recyclebin = on;
create database hualong_6;
create table hualong.single_table3 (c1 int);
use hualong_6;
create table single_table (c1 int primary key, c2 varchar(11), index i1 (c1), unique i2 (c1, c2));
drop database hualong_6;
alter database hualong_6 read write;
ERROR HY000: can not perform DDL/DML over objects in Recycle Bin
drop database hualong_6;
ERROR HY000: can not perform DDL/DML over objects in Recycle Bin
create table hualong_6.new_table (c1 int);
ERROR HY000: can not perform DDL/DML over objects in Recycle Bin
create index i3 on hualong_6.single_table (c1);
ERROR HY000: can not perform DDL/DML over objects in Recycle Bin
drop index i2 on hualong_6.single_table;
ERROR HY000: can not perform DDL/DML over objects in Recycle Bin
rename table hualong_6.single_table to hualong_6.single_table2;
ERROR HY000: can not perform DDL/DML over objects in Recycle Bin
rename table hualong_6.single_table to oceanbase.single_table2;
rename table hualong.single_table3 to hualong_6.single_table3;
ERROR HY000: can not perform DDL/DML over objects in Recycle Bin
truncate table hualong_6.single_table;
ERROR HY000: can not perform DDL/DML over objects in Recycle Bin
create table hualong_6.single_table2 like hualong.single_table;
ERROR HY000: can not perform DDL/DML over objects in Recycle Bin
create table hualong.single_table2 like hualong_6.single_table;
ERROR HY000: can not perform DDL/DML over objects in Recycle Bin
