result_format: 4
drop table if exists t1_date, t2_date;
drop table if exists t1_datetime, t2_datetime;
drop table if exists t1_timestamp, t2_timestamp;
drop table if exists t_date, t_datetime, t_timestamp;

#################################### sql_mode with NO_ZERO_DATE ###################################
set sql_mode = 'STRICT_ALL_TABLES,NO_ZERO_DATE';

############## test select ############
select date '0000-00-00';
ERROR HY000: Incorrect DATE value: '0000-00-00'
select timestamp '0000-00-00';
ERROR HY000: Incorrect DATETIME value: '0000-00-00'
select timestamp '0000-00-00 00:00:00';
ERROR HY000: Incorrect DATETIME value: '0000-00-00 00:00:00'
select date_add(date'0000-00-00', interval 1 second);
ERROR HY000: Incorrect DATE value: '0000-00-00'
select date_format(date'0000-00-00', "%Y-%m-%d");
ERROR HY000: Incorrect DATE value: '0000-00-00'
select to_seconds(date'0000-00-00') from dual;
ERROR HY000: Incorrect DATE value: '0000-00-00'
select round(date'0000-00-00');
ERROR HY000: Incorrect DATE value: '0000-00-00'
select weekofyear(date'0000-00-00') from dual;
ERROR HY000: Incorrect DATE value: '0000-00-00'
select weekday(date'0000-00-00') from dual;
ERROR HY000: Incorrect DATE value: '0000-00-00'
select week(date'0000-00-00') from dual;
ERROR HY000: Incorrect DATE value: '0000-00-00'
select yearweek(date'0000-00-00') from dual;
ERROR HY000: Incorrect DATE value: '0000-00-00'
select extract(year from date'0000-00-00');
ERROR HY000: Incorrect DATE value: '0000-00-00'
select extract(month from date'0000-00-00');
ERROR HY000: Incorrect DATE value: '0000-00-00'
select extract(day from date'0000-00-00');
ERROR HY000: Incorrect DATE value: '0000-00-00'
select quarter(date'0000-00-00') from dual;
ERROR HY000: Incorrect DATE value: '0000-00-00'

select str_to_date('00.00.0000', '%m.%d.%Y');
+---------------------------------------+
| str_to_date('00.00.0000', '%m.%d.%Y') |
+---------------------------------------+
| NULL                                  |
+---------------------------------------+
Warnings:
Warning	1411	Incorrect datetime value: '00.00.0000' for function str_to_date


############## test create ############
create table t1_date(c date default '0000-00-00');
ERROR 42000: Invalid default value for 'c'
create table t2_date(c date default '0000-00-00 00:00:00');
ERROR 42000: Invalid default value for 'c'
create table t1_datetime(c datetime default '0000-00-00');
ERROR 42000: Invalid default value for 'c'
create table t2_datetime(c datetime default '0000-00-00 00:00:00');
ERROR 42000: Invalid default value for 'c'
create table t1_timestamp(c timestamp default '0000-00-00');
ERROR 42000: Invalid default value for 'c'
create table t2_timestamp(c timestamp default '0000-00-00 00:00:00');
ERROR 42000: Invalid default value for 'c'

create table t_part (id int, data date)
  partition by list(id) (
    partition p0 values in (1, year('0000-00-00')),
    partition p1 values in (2, 3, 4, 5, 6, 7, 8, 9)
);
Warnings:
Warning	5086	Not timestamp Can not cast varchar value to timestamp type
drop table t_part;


############## test insert ############
create table t_date(c date);
insert into t_date values('0000-00-00');
ERROR 22007: Incorrect datetime value for column 'c' at row 1
insert into t_date values('0000-00-00 00:00:00');
ERROR 22007: Incorrect datetime value for column 'c' at row 1
insert ignore into t_date values('0000-00-00');
insert ignore into t_date values('0000-00-00 00:00:00');
select * from t_date;
+------------+
| c          |
+------------+
| 0000-00-00 |
| 0000-00-00 |
+------------+

create table t_datetime(c date);
insert into t_datetime values('0000-00-00');
ERROR 22007: Incorrect datetime value for column 'c' at row 1
insert into t_datetime values('0000-00-00 00:00:00');
ERROR 22007: Incorrect datetime value for column 'c' at row 1
insert ignore into t_datetime values('0000-00-00');
insert ignore into t_datetime values('0000-00-00 00:00:00');
select * from t_datetime;
+------------+
| c          |
+------------+
| 0000-00-00 |
| 0000-00-00 |
+------------+

create table t_timestamp(c timestamp);
insert into t_timestamp values('0000-00-00');
ERROR 22007: Incorrect datetime value for column 'c' at row 1
insert into t_timestamp values('0000-00-00 00:00:00');
ERROR 22007: Incorrect datetime value for column 'c' at row 1
insert ignore into t_timestamp values('0000-00-00');
insert ignore into t_timestamp values('0000-00-00 00:00:00');
select * from t_timestamp;
+---------------------+
| c                   |
+---------------------+
| 0000-00-00 00:00:00 |
| 0000-00-00 00:00:00 |
+---------------------+


############## test update ############
delete from t_date;
insert into t_date values('2020-10-01');
update t_date set c = '0000-00-00';
ERROR 22007: Incorrect datetime value for column 'c' at row 1
update t_date set c = '0000-00-00 00:00:00';
ERROR 22007: Incorrect datetime value for column 'c' at row 1
select * from t_date;
+------------+
| c          |
+------------+
| 2020-10-01 |
+------------+

update ignore t_date set c = '0000-00-00';
update ignore t_date set c = '0000-00-00 00:00:00';
select * from t_date;
+------------+
| c          |
+------------+
| 0000-00-00 |
+------------+

delete from t_datetime;
insert into t_datetime values('2020-10-01');
update t_datetime set c = '0000-00-00';
ERROR 22007: Incorrect datetime value for column 'c' at row 1
update t_datetime set c = '0000-00-00 00:00:00';
ERROR 22007: Incorrect datetime value for column 'c' at row 1
select * from t_datetime;
+------------+
| c          |
+------------+
| 2020-10-01 |
+------------+

update ignore t_datetime set c = '0000-00-00';
update ignore t_datetime set c = '0000-00-00 00:00:00';
select * from t_datetime;
+------------+
| c          |
+------------+
| 0000-00-00 |
+------------+

delete from t_timestamp;
insert into t_timestamp values('2020-10-01');
update t_timestamp set c = '0000-00-00';
ERROR 22007: Incorrect datetime value for column 'c' at row 1
update t_timestamp set c = '0000-00-00 00:00:00';
ERROR 22007: Incorrect datetime value for column 'c' at row 1
select * from t_timestamp;
+---------------------+
| c                   |
+---------------------+
| 2020-10-01 00:00:00 |
+---------------------+

update ignore t_timestamp set c = '0000-00-00';
update ignore t_timestamp set c = '0000-00-00 00:00:00';
select * from t_timestamp;
+---------------------+
| c                   |
+---------------------+
| 0000-00-00 00:00:00 |
+---------------------+


############## drop table #############
drop table if exists t1_date, t2_date;
drop table if exists t1_datetime, t2_datetime;
drop table if exists t1_timestamp, t2_timestamp;
drop table if exists t_date, t_datetime, t_timestamp;


#################################### sql_mode without NO_ZERO_DATE ################################
set sql_mode = 'STRICT_ALL_TABLES';

############## test select ############
select date '0000-00-00';
+-------------------+
| date '0000-00-00' |
+-------------------+
| 0000-00-00        |
+-------------------+
select timestamp '0000-00-00';
+------------------------+
| timestamp '0000-00-00' |
+------------------------+
| 0000-00-00 00:00:00    |
+------------------------+
select timestamp '0000-00-00 00:00:00';
+---------------------------------+
| timestamp '0000-00-00 00:00:00' |
+---------------------------------+
| 0000-00-00 00:00:00             |
+---------------------------------+
select date_add(date'0000-00-00', interval 1 second);
+-----------------------------------------------+
| date_add(date'0000-00-00', interval 1 second) |
+-----------------------------------------------+
| NULL                                          |
+-----------------------------------------------+
select date_format(date'0000-00-00', "%Y-%m-%d");
+-------------------------------------------+
| date_format(date'0000-00-00', "%Y-%m-%d") |
+-------------------------------------------+
| 0000-00-00                                |
+-------------------------------------------+
select to_seconds(date'0000-00-00') from dual;
+------------------------------+
| to_seconds(date'0000-00-00') |
+------------------------------+
|                         NULL |
+------------------------------+
select round(date'0000-00-00');
+-------------------------+
| round(date'0000-00-00') |
+-------------------------+
|                       0 |
+-------------------------+
select weekofyear(date'0000-00-00') from dual;
+------------------------------+
| weekofyear(date'0000-00-00') |
+------------------------------+
|                         NULL |
+------------------------------+
select weekday(date'0000-00-00') from dual;
+---------------------------+
| weekday(date'0000-00-00') |
+---------------------------+
|                      NULL |
+---------------------------+
select week(date'0000-00-00') from dual;
+------------------------+
| week(date'0000-00-00') |
+------------------------+
|                   NULL |
+------------------------+
select yearweek(date'0000-00-00') from dual;
+----------------------------+
| yearweek(date'0000-00-00') |
+----------------------------+
|                       NULL |
+----------------------------+
select extract(year from date'0000-00-00');
+-------------------------------------+
| extract(year from date'0000-00-00') |
+-------------------------------------+
|                                   0 |
+-------------------------------------+
select extract(month from date'0000-00-00');
+--------------------------------------+
| extract(month from date'0000-00-00') |
+--------------------------------------+
|                                    0 |
+--------------------------------------+
select extract(day from date'0000-00-00');
+------------------------------------+
| extract(day from date'0000-00-00') |
+------------------------------------+
|                                  0 |
+------------------------------------+
select quarter(date'0000-00-00') from dual;
+---------------------------+
| quarter(date'0000-00-00') |
+---------------------------+
|                      NULL |
+---------------------------+

select str_to_date('00.00.0000', '%m.%d.%Y');
+---------------------------------------+
| str_to_date('00.00.0000', '%m.%d.%Y') |
+---------------------------------------+
| 0000-00-00                            |
+---------------------------------------+


############## test create ############
create table t1_date(c date default '0000-00-00');
create table t2_date(c date default '0000-00-00 00:00:00');
create table t1_datetime(c datetime default '0000-00-00');
create table t2_datetime(c datetime default '0000-00-00 00:00:00');
create table t1_timestamp(c timestamp default '0000-00-00');
create table t2_timestamp(c timestamp default '0000-00-00 00:00:00');


############## test insert ############
create table t_date(c date);
insert into t_date values('0000-00-00');
insert into t_date values('0000-00-00 00:00:00');
insert ignore into t_date values('0000-00-00');
insert ignore into t_date values('0000-00-00 00:00:00');
select * from t_date;
+------------+
| c          |
+------------+
| 0000-00-00 |
| 0000-00-00 |
| 0000-00-00 |
| 0000-00-00 |
+------------+

create table t_datetime(c datetime);
insert into t_datetime values('0000-00-00');
insert into t_datetime values('0000-00-00 00:00:00');
insert ignore into t_datetime values('0000-00-00');
insert ignore into t_datetime values('0000-00-00 00:00:00');
select * from t_datetime;
+---------------------+
| c                   |
+---------------------+
| 0000-00-00 00:00:00 |
| 0000-00-00 00:00:00 |
| 0000-00-00 00:00:00 |
| 0000-00-00 00:00:00 |
+---------------------+

create table t_timestamp(c timestamp);
insert into t_timestamp values('0000-00-00');
insert into t_timestamp values('0000-00-00 00:00:00');
insert ignore into t_timestamp values('0000-00-00');
insert ignore into t_timestamp values('0000-00-00 00:00:00');
select * from t_timestamp;
+---------------------+
| c                   |
+---------------------+
| 0000-00-00 00:00:00 |
| 0000-00-00 00:00:00 |
| 0000-00-00 00:00:00 |
| 0000-00-00 00:00:00 |
+---------------------+


############## test update ############
delete from t_date;
insert into t_date values('2020-10-01');
update t_date set c = '0000-00-00';
update t_date set c = '0000-00-00 00:00:00';
select * from t_date;
+------------+
| c          |
+------------+
| 0000-00-00 |
+------------+

delete from t_datetime;
insert into t_datetime values('2020-10-01');
update t_datetime set c = '0000-00-00';
update t_datetime set c = '0000-00-00 00:00:00';
select * from t_datetime;
+---------------------+
| c                   |
+---------------------+
| 0000-00-00 00:00:00 |
+---------------------+

delete from t_timestamp;
insert into t_timestamp values('2020-10-01');
update t_timestamp set c = '0000-00-00';
update t_timestamp set c = '0000-00-00 00:00:00';
select * from t_timestamp;
+---------------------+
| c                   |
+---------------------+
| 0000-00-00 00:00:00 |
+---------------------+


############## drop table #############
drop table if exists t1_date, t2_date;
drop table if exists t1_datetime, t2_datetime;
drop table if exists t1_timestamp, t2_timestamp;
drop table if exists t_date, t_datetime, t_timestamp;


#################################### reset sql mode ###############################################
set sql_mode = 'STRICT_ALL_TABLES,NO_ZERO_IN_DATE';
