drop table if exists test, test2;
show variables like 'explicit_defaults_for_timestamp';
Variable_name	Value
explicit_defaults_for_timestamp	ON
create table test(c1 int, c2 timestamp, c3 timestamp);
desc test;
Field	Type	Null	Key	Default	Extra
c1	int(11)	YES		NULL	
c2	timestamp	YES		NULL	
c3	timestamp	YES		NULL	
insert into test values(1, null, null);
select * from test;
c1	c2	c3
1	NULL	NULL
update test set c1 = 2, c3 = null;
select * from test;
c1	c2	c3
2	NULL	NULL
drop table test;
create table test(c1 int, c2 timestamp, c3 timestamp not null);
desc test;
Field	Type	Null	Key	Default	Extra
c1	int(11)	YES		NULL	
c2	timestamp	YES		NULL	
c3	timestamp	NO		NULL	
insert into test values(1, null, null);
ERROR 23000: Column 'c3' cannot be null
set @@session.explicit_defaults_for_timestamp=OFF;
drop table test;
create table test(c1 int, c2 timestamp, c3 timestamp);
desc test;
Field	Type	Null	Key	Default	Extra
c1	int(11)	YES		NULL	
c2	timestamp	NO		CURRENT_TIMESTAMP	ON UPDATE CURRENT_TIMESTAMP
c3	timestamp	NO		0000-00-00 00:00:00	
insert into test values(1, null, null);
select c1 from test where c2 is null;
c1
drop table test;
create table test(c1 int, c2 timestamp, c3 timestamp not null);
desc test;
Field	Type	Null	Key	Default	Extra
c1	int(11)	YES		NULL	
c2	timestamp	NO		CURRENT_TIMESTAMP	ON UPDATE CURRENT_TIMESTAMP
c3	timestamp	NO		0000-00-00 00:00:00	
insert into test values(1, null, null);
set @@session.explicit_defaults_for_timestamp=ON;
insert into test values(3, null, null);
ERROR 23000: Column 'c2' cannot be null
create table test2(c1 int, c2 timestamp, c3 timestamp);
desc test2;
Field	Type	Null	Key	Default	Extra
c1	int(11)	YES		NULL	
c2	timestamp	YES		NULL	
c3	timestamp	YES		NULL	
insert into test2 values(1, null, null);
select * from test2;
c1	c2	c3
1	NULL	NULL
insert into test values(11,null, null);
ERROR 23000: Column 'c2' cannot be null
select c1 from test where c2 is null;
c1
alter table test add column c4 timestamp;
desc test;
Field	Type	Null	Key	Default	Extra
c1	int(11)	YES		NULL	
c2	timestamp	NO		CURRENT_TIMESTAMP	ON UPDATE CURRENT_TIMESTAMP
c3	timestamp	NO		0000-00-00 00:00:00	
c4	timestamp	YES		NULL	
insert into test values(4,null,null,null);
ERROR 23000: Column 'c2' cannot be null
select c1 from test where c2 is null;
c1
drop table test;
drop table test2;
