drop table if exists test_table;
create table test_table(id int, name varchar(64), age int,  birth datetime(6), school_date  timestamp(6) default "2012-01-01 12:00:00", height float, weight double, home varchar(64), description varchar(64), primary key(id,age));
replace into test_table values(1,'abc', 38, '1988-01-29', '1993-09-01', 158.778, 50.06432, 'shiyan', 'rd'),(2,'yy', 30, '1984-3-16', '1990-09-01', 165.624, 59.870, 'shanghai', 'dba'),(3,'cm', 18, '1987-01-12', '1992-09-01', 160.234, 51.364, 'hangzhou', 'qa'),(4,'my', 26, '1987-06-29', '1994-09-01', 159.008, 48.786, 'beijing', 'sa');
select @@session.sql_mode;
@@session.sql_mode
STRICT_ALL_TABLES,NO_ZERO_IN_DATE,NO_AUTO_CREATE_USER
insert into test_table(id, age, school_date) values(100,100,'2012-10-01 24:00:00'),(101,100,'2012-10-01 25:61:62');
ERROR 22007: Incorrect datetime value for column 'school_date' at row 1
insert into test_table(id, age, school_date) values(100,100,'2013-02-29 23:00:00');
ERROR 22007: Incorrect datetime value for column 'school_date' at row 1
insert into test_table(id, age, school_date) values(100,100,'2013-01-32 23:00:00');
ERROR 22007: Incorrect datetime value for column 'school_date' at row 1
insert into test_table(id, age, school_date) values(100,100,'2013-04-31 23:00:00');
ERROR 22007: Incorrect datetime value for column 'school_date' at row 1
select * from test_table;
id	name	age	birth	school_date	height	weight	home	description
1	abc	38	1988-01-29 00:00:00.000000	1993-09-01 00:00:00.000000	158.778	50.06432	shiyan	rd
2	yy	30	1984-03-16 00:00:00.000000	1990-09-01 00:00:00.000000	165.624	59.87	shanghai	dba
3	cm	18	1987-01-12 00:00:00.000000	1992-09-01 00:00:00.000000	160.234	51.364	hangzhou	qa
4	my	26	1987-06-29 00:00:00.000000	1994-09-01 00:00:00.000000	159.008	48.786	beijing	sa
drop table if exists t_range;
create table t_range (t int primary key,c2  timestamp(6) default "2012-01-01 12:00:00",c3 datetime(6));
insert into t_range values(1, '0000-01-01 00:00:00', '0000-01-01 00:00:00');
insert into t_range values(1, '0000-01-03 00:00:00', '0000-01-01 00:00:00');
ERROR 23000: Duplicate entry '1' for key 'PRIMARY'
insert into t_range values(2, '0001-01-01 00:00:00', '0001-01-01 00:00:00');
insert into t_range values(13, '1-01-01 00:00:00', '1-01-01 00:00:00');
insert into t_range values(14, '2-01-01 00:00:00', '2-01-01 00:00:00');
insert into t_range values(3, '-0001-01-01 00:00:00', '-0001-01-01 00:00:00');
ERROR 22007: Incorrect datetime value for column 'c2' at row 1
insert into t_range values(4, '-4713-01-01 00:00:00', '-4713-01-01 00:00:00');
ERROR 22007: Incorrect datetime value for column 'c2' at row 1
insert into t_range values(5, '-4714-01-01 00:00:00', '-4714-01-01 00:00:00');
ERROR 22007: Incorrect datetime value for column 'c2' at row 1
insert into t_range values(6, '9999-01-01 00:00:00', '9999-01-01 00:00:00');
insert into t_range values(7, '10000-01-01 00:00:00', '10000-01-01 00:00:00');
ERROR 22007: Incorrect datetime value for column 'c2' at row 1
insert into t_range values(9, '-1-01-01 00:00:00', '-1-01-01 00:00:00');
ERROR 22007: Incorrect datetime value for column 'c2' at row 1
select * from t_range;
t	c2	c3
1	0000-01-01 00:00:00.000000	0000-01-01 00:00:00.000000
2	0001-01-01 00:00:00.000000	0001-01-01 00:00:00.000000
6	9999-01-01 00:00:00.000000	9999-01-01 00:00:00.000000
13	2001-01-01 00:00:00.000000	2001-01-01 00:00:00.000000
14	2002-01-01 00:00:00.000000	2002-01-01 00:00:00.000000
set timestamp = 100;
select now(),now(1),now(2),now(3),now(4),now(5),now(6),current_time(),current_date();
now()	now(1)	now(2)	now(3)	now(4)	now(5)	now(6)	current_time()	current_date()
1970-01-01 08:01:40	1970-01-01 08:01:40.0	1970-01-01 08:01:40.00	1970-01-01 08:01:40.000	1970-01-01 08:01:40.0000	1970-01-01 08:01:40.00000	1970-01-01 08:01:40.000000	08:01:40	1970-01-01
select @@timestamp;
@@timestamp
100.000000
set timestamp = 133.345;
select @@timestamp;
@@timestamp
133.345000
select now(),now(1),now(2),now(3),now(4),now(5),now(6),current_time(),current_date();
now()	now(1)	now(2)	now(3)	now(4)	now(5)	now(6)	current_time()	current_date()
1970-01-01 08:02:13	1970-01-01 08:02:13.3	1970-01-01 08:02:13.34	1970-01-01 08:02:13.345	1970-01-01 08:02:13.3450	1970-01-01 08:02:13.34500	1970-01-01 08:02:13.345000	08:02:13	1970-01-01
set timestamp = 0;
set timestamp = 133.3451111111;
select @@timestamp;
@@timestamp
133.345111
select now(),now(1),now(2),now(3),now(4),now(5),now(6),current_time(),current_date();
now()	now(1)	now(2)	now(3)	now(4)	now(5)	now(6)	current_time()	current_date()
1970-01-01 08:02:13	1970-01-01 08:02:13.3	1970-01-01 08:02:13.34	1970-01-01 08:02:13.345	1970-01-01 08:02:13.3451	1970-01-01 08:02:13.34511	1970-01-01 08:02:13.345111	08:02:13	1970-01-01
set timestamp = 0;
set timestamp = 133.3456666666;
select @@timestamp;
@@timestamp
133.345667
select now(),now(1),now(2),now(3),now(4),now(5),now(6),current_time(),current_date();
now()	now(1)	now(2)	now(3)	now(4)	now(5)	now(6)	current_time()	current_date()
1970-01-01 08:02:13	1970-01-01 08:02:13.3	1970-01-01 08:02:13.34	1970-01-01 08:02:13.345	1970-01-01 08:02:13.3456	1970-01-01 08:02:13.34566	1970-01-01 08:02:13.345667	08:02:13	1970-01-01
set timestamp = 0;
set timestamp = 0;
set timestamp = -100;
ERROR 42000: Variable 'timestamp' can't be set to the value of '-100'
set timestamp = 100;
set timestamp = -100.123;
ERROR 42000: Variable 'timestamp' can't be set to the value of '-100.123'
set timestamp = 100.123;
select @@timestamp;
@@timestamp
100.123000
set timestamp = 253402272000;
ERROR 42000: Variable 'timestamp' can't be set to the value of '253402272000'
set timestamp = 0;
set timestamp = 1600000000;
drop table if exists t_refered,t_h5_r4_int_int_datetime;
create table t_refered(a int, aa bigint, b int unsigned, bb bigint unsigned, c datetime, d date, e timestamp,  primary key (a));
create table t_h5_r4_int_int_datetime(a int, b int, c datetime, primary key (a, b, c));
insert into t_refered values ( 1,  1, 1, 1, 20161101, 20161101, 20161101), ( 2,  2, 2, 2, 20161101, 20161102, 20161102), ( 3,  3, 3, 3, 20161103, 20161101, 20161103), ( 4,  4, 4, 4, 20161104, 20161101, 20161104);
insert into t_h5_r4_int_int_datetime values ( 1,  1, 20161101), ( 2,  2, 20161102), ( 3,  3, 20161103), ( 4,  4, 20161104);
select * from t_h5_r4_int_int_datetime t1, t_refered as t2 where t1.a = t2.a and t1.b=t2.a and t1.c = t2.e;
a	b	c	a	aa	b	bb	c	d	e
1	1	2016-11-01 00:00:00	1	1	1	1	2016-11-01 00:00:00	2016-11-01	2016-11-01 00:00:00
2	2	2016-11-02 00:00:00	2	2	2	2	2016-11-01 00:00:00	2016-11-02	2016-11-02 00:00:00
3	3	2016-11-03 00:00:00	3	3	3	3	2016-11-03 00:00:00	2016-11-01	2016-11-03 00:00:00
4	4	2016-11-04 00:00:00	4	4	4	4	2016-11-04 00:00:00	2016-11-01	2016-11-04 00:00:00
drop table if exists t_refered,t_h5_r4_int_int_datetime;
drop table if exists t;
set time_zone = '+8:00';
create table t(c1 timestamp);
insert into t values('0000-01-02 07:59:59');
insert into t values('0000-01-02 08:00:00');
select * from t;
c1
0000-01-02 07:59:59
0000-01-02 08:00:00
drop table t;
create table t(c1 timestamp, c2 datetime, c3 int);
insert into t(c2) values('0000-01-01 00:00:00');
update t set c1 = c2;
ERROR 23000: Column 'c1' cannot be null
select * from t;
c1	c2	c3
2020-09-13 20:26:40	0000-01-01 00:00:00	NULL
update t set c2 = '0000-01-01 07:59:59';
update t set c1 = c2;
ERROR 23000: Column 'c1' cannot be null
select * from t;
c1	c2	c3
2020-09-13 20:26:40	0000-01-01 07:59:59	NULL
update t set c2 = '0000-01-02 08:00:00';
update t set c1 = c2;
select * from t;
c1	c2	c3
0000-01-02 08:00:00	0000-01-02 08:00:00	NULL
delete from t;
insert into t(c2) values('9999-12-31 23:00:00');
update t set c1 = c2;
select * from t;
c1	c2	c3
9999-12-31 23:00:00	9999-12-31 23:00:00	NULL
delete from t;
set time_zone = '-8:00';
insert into t(c2) values('0000-01-01 00:00:00');
update t set c1 = c2;
select * from t;
c1	c2	c3
0000-01-01 00:00:00	0000-01-01 00:00:00	NULL
update t set c2 = '0000-01-01 08:00:00';
update t set c1 = c2;
select * from t;
c1	c2	c3
0000-01-01 08:00:00	0000-01-01 08:00:00	NULL
delete from t;
insert into t(c2) values('9999-12-31 23:00:00');
update t set c1 = c2;
ERROR 23000: Column 'c1' cannot be null
select c1 from t;
c1
2020-09-13 04:26:40
drop table t;
set timestamp = 1600000000;
select timestamp(123);
timestamp(123)
2000-01-23 00:00:00
select timestamp(123.456);
timestamp(123.456)
2000-01-23 00:00:00.000
select timestamp('2020-01-01');
timestamp('2020-01-01')
2020-01-01 00:00:00.000000
select timestamp(date '2020-01-01');
timestamp(date '2020-01-01')
2020-01-01 00:00:00
select timestamp(timestamp '2020-01-01 10:00:00');
timestamp(timestamp '2020-01-01 10:00:00')
2020-01-01 10:00:00
select timestamp(time '12:34:56.123');
timestamp(time '12:34:56.123')
2020-09-13 12:34:56.123
create table t as select timestamp(123) c1, timestamp(123.456) c2, timestamp('2020-01-01') c3,
timestamp(date '2020-01-01') c4, timestamp(timestamp '2020-01-01 10:00:00') c5, timestamp(time '12:34:56.123') c6;
desc t;
Field	Type	Null	Key	Default	Extra
c1	datetime	YES		NULL	
c2	datetime(3)	YES		NULL	
c3	datetime(6)	YES		NULL	
c4	datetime	YES		NULL	
c5	datetime	YES		NULL	
c6	datetime(3)	YES		NULL	
select * from t;
c1	c2	c3	c4	c5	c6
2000-01-23 00:00:00	2000-01-23 00:00:00.000	2020-01-01 00:00:00.000000	2020-01-01 00:00:00	2020-01-01 10:00:00	2020-09-13 12:34:56.123
drop table t;
create table t(c1 int, c2 float, c3 decimal(12,3), c4 varchar(20), c5 date, c6 time,
c7 time(3), c8 datetime, c9 datetime(3), c10 timestamp, c11 timestamp(3));
insert into t values(123, 123, 123, '123', '2020-01-01', '12:34:56', '12:34:56.123456',
'2020-01-01 12:34:56', '2020-01-01 12:34:56.123456', '2020-01-01 12:34:56', '2020-01-01 12:34:56.123456');
insert into t values(123123, 123.123, 123.123, '123.123', '2020-01-01', '12:34:56', '12:34:56.123456',
'2020-01-01 12:34:56', '2020-01-01 12:34:56.123456', '2020-01-01 12:34:56', '2020-01-01 12:34:56.123456');
select c1, timestamp(c1) from t;
c1	timestamp(c1)
123	2000-01-23 00:00:00
123123	NULL
select c2, timestamp(c2) from t;
c2	timestamp(c2)
123	2000-01-23 00:00:00.000000
123.123	2000-01-23 00:00:00.000000
select c3, timestamp(c3) from t;
c3	timestamp(c3)
123.000	2000-01-23 00:00:00.000
123.123	2000-01-23 00:00:00.000
select c4, timestamp(c4) from t;
c4	timestamp(c4)
123	NULL
123.123	2012-03-12 03:00:00.000000
select c5, timestamp(c5) from t;
c5	timestamp(c5)
2020-01-01	2020-01-01 00:00:00
2020-01-01	2020-01-01 00:00:00
select c6, timestamp(c6) from t;
c6	timestamp(c6)
12:34:56	2020-09-13 12:34:56
12:34:56	2020-09-13 12:34:56
select c7, timestamp(c7) from t;
c7	timestamp(c7)
12:34:56.123	2020-09-13 12:34:56.123
12:34:56.123	2020-09-13 12:34:56.123
select c8, timestamp(c8) from t;
c8	timestamp(c8)
2020-01-01 12:34:56	2020-01-01 12:34:56
2020-01-01 12:34:56	2020-01-01 12:34:56
select c9, timestamp(c9) from t;
c9	timestamp(c9)
2020-01-01 12:34:56.123	2020-01-01 12:34:56.123
2020-01-01 12:34:56.123	2020-01-01 12:34:56.123
select c10, timestamp(c10) from t;
c10	timestamp(c10)
2020-01-01 12:34:56	2020-01-01 12:34:56
2020-01-01 12:34:56	2020-01-01 12:34:56
select c11, timestamp(c11) from t;
c11	timestamp(c11)
2020-01-01 12:34:56.123	2020-01-01 12:34:56.123
2020-01-01 12:34:56.123	2020-01-01 12:34:56.123
select timestamp(null, '00:00:01');
timestamp(null, '00:00:01')
NULL
select timestamp('2020-01-01 12:34:56', null);
timestamp('2020-01-01 12:34:56', null)
NULL
select timestamp(null, null);
timestamp(null, null)
NULL
drop table if exists t_time, t1;
create table t_time (c1 time, c2 time(4), c3 decimal(15,8), c4 varchar(100));
insert into t_time values('00:00:01', '00:00:01', 1, '00:00:01');
insert into t_time values('00:00:11.123456', '00:00:11.123456', 11.123456, '00:00:11.123456');
insert into t_time values('100:22:11.123456', '100:22:11.123456', 1002211.123456, '100:22:11.123456');
insert into t_time values('-00:00:11.123456', '-00:00:11.123456', -11.123456, '-00:00:11.123456');
create table t1 as select timestamp(a.c8, b.c1) c1, timestamp(a.c8, b.c2) c2, timestamp(a.c8, b.c3) c3, timestamp(a.c8, b.c4) c4 from t a, t_time b;
desc t1;
Field	Type	Null	Key	Default	Extra
c1	datetime	YES		NULL	
c2	datetime(4)	YES		NULL	
c3	datetime(6)	YES		NULL	
c4	datetime(6)	YES		NULL	
select * from t1;
c1	c2	c3	c4
2020-01-01 12:34:57	2020-01-01 12:34:57.0000	2020-01-01 12:34:57.000000	2020-01-01 12:34:57.000000
2020-01-01 12:34:57	2020-01-01 12:34:57.0000	2020-01-01 12:34:57.000000	2020-01-01 12:34:57.000000
2020-01-01 12:35:07	2020-01-01 12:35:07.1235	2020-01-01 12:35:07.123456	2020-01-01 12:35:07.123456
2020-01-01 12:35:07	2020-01-01 12:35:07.1235	2020-01-01 12:35:07.123456	2020-01-01 12:35:07.123456
2020-01-05 16:57:07	2020-01-05 16:57:07.1235	2020-01-05 16:57:07.123456	2020-01-05 16:57:07.123456
2020-01-05 16:57:07	2020-01-05 16:57:07.1235	2020-01-05 16:57:07.123456	2020-01-05 16:57:07.123456
2020-01-01 12:34:45	2020-01-01 12:34:44.8765	2020-01-01 12:34:44.876544	2020-01-01 12:34:44.876544
2020-01-01 12:34:45	2020-01-01 12:34:44.8765	2020-01-01 12:34:44.876544	2020-01-01 12:34:44.876544
drop table t1;
create table t1(c1 datetime);
explain select * from t1 where c1 < TIMESTAMP'1990-02-01';
Query Plan
===============================================
|ID|OPERATOR       |NAME|EST.ROWS|EST.TIME(us)|
-----------------------------------------------
|0 |TABLE FULL SCAN|t1  |1       |3           |
===============================================
Outputs & filters:
-------------------------------------
  0 - output([t1.c1]), filter([t1.c1 < '1990-02-01 00:00:00']), rowset=16
      access([t1.c1]), partitions(p0)
      is_index_back=false, is_global_index=false, filter_before_indexback[false], 
      range_key([t1.__pk_increment]), range(MIN ; MAX)always true
