drop table if exists t1;
create table t1 (t time,id int primary key auto_increment);
insert into t1 (t) values('10:22:33'),('12:34:56.78'),(10),(1234),(123456.78),(1234559.99),('1'),('1:23'),('1:23:45'), ('10.22'), ('-10  1:22:33.45'),('20 10:22:33'),('1999-02-03 20:33:34');
insert t1 (t) values (30),(1230),('1230'),('12:30'),('12:30:35'),('1 12:30:31.32');
select concat('',t) from t1;
concat('',t)
10:22:33
12:34:57
00:00:10
00:12:34
12:34:57
123:46:00
00:00:01
01:23:00
01:23:45
00:00:10
-241:22:33
490:22:33
20:33:34
00:00:30
00:12:30
00:12:30
12:30:00
12:30:35
36:30:31
insert into t1 (t) values('10.22.22'),(1234567),(123456789),(123456789.10),('10 22:22'),('12.45a');
ERROR 22007: Incorrect datetime value for column 't' at row 2
select concat('',t) from t1;
concat('',t)
10:22:33
12:34:57
00:00:10
00:12:34
12:34:57
123:46:00
00:00:01
01:23:00
01:23:45
00:00:10
-241:22:33
490:22:33
20:33:34
00:00:30
00:12:30
00:12:30
12:30:00
12:30:35
36:30:31
drop table t1;
create table t1 (t time ,id int primary key auto_increment);
insert into t1 (t) values ('09:00:00'),('13:00:00'),('19:38:34'), ('13:00:00'),('09:00:00'),('09:00:00'),('13:00:00'),('13:00:00'),('13:00:00'),('09:00:00');
drop table t1;
CREATE TABLE t1 (t TIME,id int primary key auto_increment);
INSERT INTO t1 (t) VALUES (+10), (+10.0), (+10e0);
INSERT INTO t1 (t) VALUES (-10), (-10.0), (-10e0);
SELECT concat('',t) FROM t1;
concat('',t)
00:00:10
00:00:10
00:00:10
-00:00:10
-00:00:10
-00:00:10
DROP TABLE t1;
SELECT CAST(235959.123456 AS TIME);
CAST(235959.123456 AS TIME)
23:59:59
SELECT CAST(0.235959123456e+6 AS TIME);
CAST(0.235959123456e+6 AS TIME)
23:59:59
SELECT CAST(235959123456e-6 AS TIME);
CAST(235959123456e-6 AS TIME)
23:59:59
SELECT CAST(235959.1234567 AS TIME);
CAST(235959.1234567 AS TIME)
23:59:59
SELECT CAST(0.2359591234567e6 AS TIME);
CAST(0.2359591234567e6 AS TIME)
23:59:59
End of 4.1 tests
select cast('100:55:50' as time) < cast('24:00:00' as time);
cast('100:55:50' as time) < cast('24:00:00' as time)
0
select cast('100:55:50' as time) < cast('024:00:00' as time);
cast('100:55:50' as time) < cast('024:00:00' as time)
0
select cast('300:55:50' as time) < cast('240:00:00' as time);
cast('300:55:50' as time) < cast('240:00:00' as time)
0
select cast('100:55:50' as time) > cast('24:00:00' as time);
cast('100:55:50' as time) > cast('24:00:00' as time)
1
select cast('100:55:50' as time) > cast('024:00:00' as time);
cast('100:55:50' as time) > cast('024:00:00' as time)
1
select cast('300:55:50' as time) > cast('240:00:00' as time);
cast('300:55:50' as time) > cast('240:00:00' as time)
1
create table t1 (f1 time,id int primary key auto_increment);
insert into t1 (f1) values ('24:00:00');
select cast('24:00:00' as time) = (select f1 from t1);
cast('24:00:00' as time) = (select f1 from t1)
1
drop table t1;
create table t1(f1 time, f2 time,id int primary key);
insert into t1 values('20:00:00','150:00:00',1);
select 1 from t1 where cast('100:00:00' as time) between f1 and f2;
1
1
drop table t1;
CREATE TABLE  t1 (
f2 date NOT NULL,
f3 int(11) unsigned NOT NULL default '0',
PRIMARY KEY  (f3, f2)
);
insert into t1 values('2007-07-01', 1);
insert into t1 values('2007-07-01', 2);
insert into t1 values('2007-07-02', 1);
insert into t1 values('2007-07-02', 2);
SELECT sum(f3) FROM t1 where f2='2007-07-01 00:00:00' group by f2;
sum(f3)
3
drop table t1;
#
# Bug #44792: valgrind warning when casting from time to time
#
CREATE TABLE t1 (c TIME ,id int primary key);
INSERT INTO t1 VALUES ('0:00:00',1);
SELECT CAST(c AS TIME) FROM t1;
CAST(c AS TIME)
00:00:00
DROP TABLE t1;
End of 5.0 tests
#
# Bug#53942 valgrind warnings with timestamp() function and incomplete datetime values
#
CREATE TABLE t1 (f1 TIME ,id int primary key);
INSERT INTO t1 VALUES ('24:00:00',1);
SELECT CAST('24:00:00' AS TIME) = (SELECT f1 FROM t1);
CAST('24:00:00' AS TIME) = (SELECT f1 FROM t1)
1
SELECT CAST('-24:00:00' AS TIME) = (SELECT f1 FROM t1);
CAST('-24:00:00' AS TIME) = (SELECT f1 FROM t1)
0
DELETE FROM t1;
INSERT INTO t1 VALUES ('-24:00:00',1);
SELECT CAST('24:00:00' AS TIME) = (SELECT f1 FROM t1);
CAST('24:00:00' AS TIME) = (SELECT f1 FROM t1)
0
SELECT CAST('-24:00:00' AS TIME) = (SELECT f1 FROM t1);
CAST('-24:00:00' AS TIME) = (SELECT f1 FROM t1)
1
DROP TABLE t1;
#
# Start of 5.6 tests
#
#
# WL#946 Testing <=> operator with TIME
#
CREATE TABLE t1 (a TIME,id int primary key auto_increment);
INSERT INTO t1(a) VALUES ('20:00:00'),('19:20:30');
SELECT * FROM t1 WHERE a<=>'19:20:30';
a	id
19:20:30	2
SELECT * FROM t1 WHERE a<=>TIME'19:20:30';
a	id
19:20:30	2
SELECT * FROM t1 WHERE a<=>192030;
a	id
19:20:30	2
DROP TABLE t1;
#
# WL#946: Testing rounding
#
CREATE TABLE t1 (a TIME,id int primary key auto_increment);
INSERT INTO t1(a) VALUES ('10:10:10.9999994'), ('10:10:10.9999995');
INSERT INTO t1(a) VALUES (101010.9999994), (101010.9999995);
SELECT * FROM t1;
a	id
10:10:11	1
10:10:11	2
10:10:11	3
10:10:11	4
DROP TABLE t1;
#
# Before WL#946 TIME did not reject too big negative minutes/seconds
#
CREATE TABLE t1 (a TIME,id int primary key auto_increment);
INSERT INTO t1 (a) VALUES ('-10:60:59'), ('-10:59:60'), (-106059), (-105960);
ERROR 22007: Incorrect datetime value for column 'a' at row 1
SELECT * FROM t1;
a	id
DROP TABLE t1;
#
# WL#946 Make sure case from number to TIME properly handles
# too big negative minutes/secons
#
#
# WL#946 Checking function TIME()
#
CREATE TABLE t1 (a TIME,id int primary key);
INSERT INTO t1 VALUES (NULL,1);
SELECT * FROM t1 WHERE a NOT IN ('20:20:20','10:10:10');
a	id
DROP TABLE t1;
#
# Testing Item_func_numhybrid::val_int when TIME type
#
CREATE TABLE t1 (a TIME primary key);
INSERT INTO t1 VALUES ('10:10:10');
SELECT CAST(COALESCE(a,a) AS SIGNED) FROM t1;
CAST(COALESCE(a,a) AS SIGNED)
101010
DROP TABLE t1;
#
# Testing Item_func_numhybrid::val_decimal when TIME type
#
CREATE TABLE t1 (a TIME primary key);
INSERT INTO t1 VALUES ('10:10:10');
SELECT CAST(COALESCE(a,a) AS DECIMAL(23,6)) FROM t1;
CAST(COALESCE(a,a) AS DECIMAL(23,6))
101010.000000
DROP TABLE t1;
#
# Testing Item_func_numhybrid::get_time  when non-temporal type
#
SELECT CAST(COALESCE(10,20) AS TIME);
CAST(COALESCE(10,20) AS TIME)
00:00:10
#
# Testing Item_func_min_max::get_time when DATE type and NULL
#
SELECT CAST(LEAST(DATE(NULL), DATE(NULL)) AS TIME);
CAST(LEAST(DATE(NULL), DATE(NULL)) AS TIME)
NULL
#
# Testing Item_func_min_max::get_time with non-temporal arguments
#
SELECT CAST(LEAST(111111,222222) AS TIME);
CAST(LEAST(111111,222222) AS TIME)
11:11:11
#
# Item::get_time_from_numeric
#
SELECT CAST(SUM(0) AS TIME);
CAST(SUM(0) AS TIME)
00:00:00
SELECT CAST(SUM(0 + 0e0) AS TIME);
CAST(SUM(0 + 0e0) AS TIME)
00:00:00
#
# Item::get_time_from_non_temporal
#
#
# Item_name_const::get_time
#
#
# Item_cache_datetime::get_time
#
CREATE TABLE t1 (a DATE primary key);
INSERT INTO t1 VALUES (0);
SELECT CAST(MIN(a) AS TIME) FROM t1;
CAST(MIN(a) AS TIME)
00:00:00
DROP TABLE t1;
drop table if exists t1,t2,t3;
CREATE TABLE t1 (
pk INT NOT NULL AUTO_INCREMENT,
col_int_nokey INT,
col_int_key INT NOT NULL,
PRIMARY KEY (pk)
) ;
INSERT INTO t1 VALUES (10,1,7), (11,7,0), (12,4,9), (13,7,3),
(14,0,4), (15,2,2), (16,9,5), (17,4,3), (18,0,1), (19,9,3), (20,1,6),
(21,3,7), (22,8,5), (23,8,1), (24,18,204), (25,84,224), (26,6,9),
(27,3,5), (28,6,0), (29,6,3);
CREATE TABLE t2 (
col_int_nokey INT NOT NULL,
col_datetime_key DATETIME NOT NULL,
col_varchar_key VARCHAR(1) NOT NULL,
PRIMARY KEY (col_datetime_key)
);
INSERT INTO t2 VALUES (1,'2001-11-04 19:07:55','k');
CREATE TABLE t3 (
id int auto_increment,
col_time_key TIME,
PRIMARY KEY (id)
);
INSERT INTO t3 (col_time_key) VALUES ('21:22:34'), ('10:50:38'), ('00:21:38'),
('04:08:02'), ('16:25:11'), ('10:14:58'), ('19:47:59'), ('11:14:24'),
('00:00:00'), ('00:00:00'), ('15:57:25'), ('07:05:51'), ('19:22:21'),
('03:53:16'), ('09:16:38'), ('15:37:26'), ('00:00:00'), ('05:03:03'),
('02:59:24'), ('00:01:58');
DROP TABLE t1,t2,t3;
#
# End of 5.6 tests
#
