drop table if exists t1, t2;
create table t1 (v varchar(128), id int primary key,index (v));
insert into t1 values ("This is a test ",1);
insert into t1 values ("Some sample data",2);
insert into t1 values (" garbage ",3);
insert into t1 values (" This is a test ",4);
insert into t1 values ("This is a test",5);
insert into t1 values ("Hello world",6);
insert into t1 values ("Foo bar",7);
insert into t1 values ("This is a test",8);
insert into t1 values ("MySQL varchar test",9);
insert into t1 values ("test MySQL varchar",10);
insert into t1 values ("This is a long string to have some random length data included",11);
insert into t1 values ("Short string",12);
insert into t1 values ("VSS",13);
insert into t1 values ("Some samples",14);
insert into t1 values ("Bar foo",15);
insert into t1 values ("Bye",16);
select * from t1 where v like 'This is a test' order by v;
v	id
This is a test	5
This is a test	8
select * from t1 where v='This is a test' order by v;
v	id
This is a test 	1
This is a test	5
This is a test	8
select * from t1 where v like 'S%' order by v;
v	id
Short string	12
Some sample data	2
Some samples	14
select * from t1 where v like 'This is a test' order by v;
v	id
This is a test	5
This is a test	8
select * from t1 where v='This is a test' order by v;
v	id
This is a test 	1
This is a test	5
This is a test	8
select * from t1 where v like 'S%' order by v;
v	id
Short string	12
Some sample data	2
Some samples	14
select * from t1 where v like 'This is a test' order by v;
v	id
This is a test	5
This is a test	8
select * from t1 where v='This is a test' order by v;
v	id
This is a test 	1
This is a test	5
This is a test	8
select * from t1 where v like 'S%' order by v;
v	id
Short string	12
Some sample data	2
Some samples	14
select * from t1 where v like 'This is a test' order by v;
v	id
This is a test	5
This is a test	8
select * from t1 where v='This is a test' order by v;
v	id
This is a test 	1
This is a test	5
This is a test	8
select * from t1 where v like 'S%' order by v;
v	id
Short string	12
Some sample data	2
Some samples	14
select * from t1 where v like 'This is a test' order by v;
v	id
This is a test	5
This is a test	8
select * from t1 where v='This is a test' order by v;
v	id
This is a test 	1
This is a test	5
This is a test	8
select * from t1 where v like 'S%' order by v;
v	id
Short string	12
Some sample data	2
Some samples	14
select * from t1 where v like 'This is a test' order by v;
v	id
This is a test	5
This is a test	8
select * from t1 where v='This is a test' order by v;
v	id
This is a test 	1
This is a test	5
This is a test	8
select * from t1 where v like 'S%' order by v;
v	id
Short string	12
Some sample data	2
Some samples	14
select * from t1 where v like 'This is a test' order by v;
v	id
This is a test	5
This is a test	8
select * from t1 where v='This is a test' order by v;
v	id
This is a test 	1
This is a test	5
This is a test	8
select * from t1 where v like 'S%' order by v;
v	id
Short string	12
Some sample data	2
Some samples	14
select * from t1 where v like 'This is a test' order by v;
v	id
This is a test	5
This is a test	8
select * from t1 where v='This is a test' order by v;
v	id
This is a test 	1
This is a test	5
This is a test	8
select * from t1 where v like 'S%' order by v;
v	id
Short string	12
Some sample data	2
Some samples	14
select * from t1 where v like 'This is a test' order by v;
v	id
This is a test	5
This is a test	8
select * from t1 where v='This is a test' order by v;
v	id
This is a test 	1
This is a test	5
This is a test	8
select * from t1 where v like 'S%' order by v;
v	id
Short string	12
Some sample data	2
Some samples	14
select * from t1 where v like 'This is a test' order by v;
v	id
This is a test	5
This is a test	8
select * from t1 where v='This is a test' order by v;
v	id
This is a test 	1
This is a test	5
This is a test	8
select * from t1 where v like 'S%' order by v;
v	id
Short string	12
Some sample data	2
Some samples	14
select * from t1 where v like 'This is a test' order by v;
v	id
This is a test	5
This is a test	8
select * from t1 where v='This is a test' order by v;
v	id
This is a test 	1
This is a test	5
This is a test	8
select * from t1 where v like 'S%' order by v;
v	id
Short string	12
Some sample data	2
Some samples	14
select * from t1 where v like 'This is a test' order by v;
v	id
This is a test	5
This is a test	8
select * from t1 where v='This is a test' order by v;
v	id
This is a test 	1
This is a test	5
This is a test	8
select * from t1 where v like 'S%' order by v;
v	id
Short string	12
Some sample data	2
Some samples	14
drop table t1;
create table t1 (pkcol varchar(16), othercol varchar(16), primary key (pkcol));
insert into t1 values ('test', 'something');
update t1 set othercol='somethingelse' where pkcol='test';
select * from t1;
pkcol	othercol
test	somethingelse
drop table t1;
create table t1 (a int primary key, b varchar(12));
insert into t1 values (1, 'A'), (22, NULL);
create table t2 (a int ,id int primary key);
insert into t2 values (22,1), (22,2);
select t1.a, t1.b, min(t1.b) from t1 inner join t2 ON t2.a = t1.a
group by t1.b, t1.a;
a	b	min(t1.b)
22	NULL	NULL
drop table t1, t2;
DROP TABLE IF EXISTS t1;
CREATE TABLE t1(f1 VARCHAR(100) DEFAULT 'test',id int primary key);
INSERT INTO t1 VALUES(SUBSTR(f1, 1, 3),1);
DROP TABLE IF EXISTS t1;
drop table if exists t1, t2, t3;
create table t3 (
id int(11) primary key,
en varchar(255) character set utf8,
cz varchar(255) character set utf8
);
delete from  t3;
insert into t3 (id, en, cz) values
(1,'en string 1','cz string 1'),
(2,'en string 2','cz string 2'),
(3,'en string 3','cz string 3');
create table t1 (
id int(11) primary key,
name_id int(11)
);
insert into t1 (id, name_id) values (1,1), (2,3), (3,3);
create table t2 (id int(11) primary key);
insert into t2 (id) values (1), (2), (3);
select t1.*, t2.id, t3.en, t3.cz from t1 left join t2 on t1.id=t2.id
left join t3 on t1.id=t3.id order by t3.id;
id	name_id	id	en	cz
1	1	1	en string 1	cz string 1
2	3	2	en string 2	cz string 2
3	3	3	en string 3	cz string 3
drop table t1, t2, t3;
CREATE TABLE t1 (a CHAR(2) primary key);
INSERT INTO t1 VALUES (10), (50), (30), ('1a'), (60), ('t');
SELECT a,(a + 0) FROM t1 ORDER BY a;
a	(a + 0)
10	10
1a	1
30	30
50	50
60	60
t	0
Warnings:
Warning	1292	Truncated incorrect DOUBLE value: '1a'
Warning	1292	Truncated incorrect DOUBLE value: 't'
SELECT a,(a DIV 2) FROM t1 ORDER BY a;
a	(a DIV 2)
10	5
1a	0
30	15
50	25
60	30
t	0
Warnings:
Warning	1292	Truncated incorrect DECIMAL value: '1a'
Warning	1292	Truncated incorrect DECIMAL value: 't'
SELECT a,CAST(a AS SIGNED) FROM t1 ORDER BY a;
a	CAST(a AS SIGNED)
10	10
1a	1
30	30
50	50
60	60
t	0
Warnings:
Warning	1292	Truncated incorrect INTEGER value: '1a'
Warning	1292	Truncated incorrect INTEGER value: 't'
DROP TABLE t1;
CREATE TABLE t1 (a VARCHAR(16) primary key);
INSERT INTO t1 VALUES ('5'), ('s'), ('');
SELECT 5 = a FROM t1;
5 = a
0
1
0
Warnings:
Warning	1292	Truncated incorrect DECIMAL value: 's'
DROP TABLE t1;
CREATE TABLE t1 (a CHAR(16) primary key);
INSERT INTO t1 VALUES ('5'), ('s'), ('');
SELECT 5 = a FROM t1;
5 = a
0
1
0
Warnings:
Warning	1292	Truncated incorrect DECIMAL value: 's'
DROP TABLE t1;
