alter system flush sql audit global;
alter system flush plan cache global;
drop table if exists t_year, t_tinyint, t_utinyint;
create table t_year(c year);
insert into t_year values(2000);
create table t_tinyint(c tinyint);
insert into t_tinyint values(2000);
ERROR 22003: Out of range value for column 'c' at row 1
insert into t_tinyint select * from t_year;
ERROR 22003: Out of range value for column 'c' at row 1
create table t_utinyint(c tinyint unsigned);
insert into t_utinyint values(2000);
ERROR 22003: Out of range value for column 'c' at row 1
insert into t_utinyint select * from t_year;
ERROR 22003: Out of range value for column 'c' at row 1
drop table if exists t_year, t_tinyint, t_utinyint;
drop table if exists t1;
create table t1(c1 time, c2 year);
insert into t1(c1) values('00:00:00'), ('00:00:01'), ('00:00:10'), ('00:01:00'), ('00:10:00'), ('01:00:00'), ('10:00:00'), ('100:00:00');
set sql_mode = '';
update t1 set c2 = c1;
select * from t1;
c1	c2
00:00:00	0000
00:00:01	2001
00:00:10	2010
00:01:00	0000
00:10:00	0000
01:00:00	0000
10:00:00	0000
100:00:00	0000
delete from  t1;
insert into t1(c2) values(0), (10), (100), (1000), (1901), (2000);
update t1 set c1 = c2;
select * from t1;
c1	c2
00:00:00	0000
00:20:10	2010
00:00:00	0000
00:00:00	0000
00:19:01	1901
00:20:00	2000
set sql_mode = default;
drop table t1;
CREATE TABLE t1(Z0_TEST0 year);
INSERT INTO t1 VALUES('1920');
INSERT INTO t1 VALUES(NULL);
ALTER TABLE t1 MODIFY column z0_test0 TIME;
select * from t1;
z0_test0
00:19:20
NULL
drop table t1;
