alter system set debug_sync_timeout = '60s';
set ob_global_debug_sync = 'reset';
set ob_query_timeout=1000000000000;
set autocommit = 0;
set ob_query_timeout=1000000000000;
set autocommit = 0;
set ob_query_timeout=1000000000000;
set autocommit = 0;
set ob_query_timeout=1000000000000;
set autocommit = 0;
drop table if exists t1;
drop table if exists t2;
purge recyclebin;

# auto split table with lob
create table t1(a int auto_increment primary key, b VARCHAR(150), c int, d VARCHAR(4000)) partition by range() size('unlimited');
alter table t1 add e text;
create index i1 on t1(c) local;
alter table t1 partition by range() size('128MB');
select auto_part,auto_part_size,part_func_type,part_level from oceanbase.__all_table where table_name = 't1';
auto_part	auto_part_size	part_func_type	part_level
1	134217728	3	0
select auto_part,auto_part_size,part_func_type,part_level from oceanbase.__all_table where data_table_id = (select table_id from oceanbase.__all_table where table_name = 't1');
auto_part	auto_part_size	part_func_type	part_level
0	-1	3	0
0	-1	3	0
0	-1	3	0
insert into t1(b,c,d,e) select
randstr(150, random()),
uniform(1, 100000000, random()),
randstr(4000, random()),
randstr(100, random())
from
table(generator(11000));
insert into t1(b,c,d,e) select
randstr(150, random()),
uniform(1, 100000000, random()),
randstr(4000, random()),
randstr(100, random())
from
table(generator(11000));
insert into t1(b,c,d,e) select
randstr(150, random()),
uniform(1, 100000000, random()),
randstr(4000, random()),
randstr(100, random())
from
table(generator(11000));
insert into t1(b,c,d,e) select
randstr(150, random()),
uniform(1, 100000000, random()),
randstr(4000, random()),
randstr(100, random())
from
table(generator(11000));
insert into t1(b,c,d,e) select
randstr(150, random()),
uniform(1, 100000000, random()),
randstr(4000, random()),
randstr(100, random())
from
table(generator(11000));
insert into t1(b,c,d,e) select
randstr(150, random()),
uniform(1, 100000000, random()),
randstr(4000, random()),
randstr(100, random())
from
table(generator(11000));
insert into t1(b,c,d,e) select
randstr(150, random()),
uniform(1, 100000000, random()),
randstr(4000, random()),
randstr(100, random())
from
table(generator(11000));
insert into t1(b,c,d,e) select
randstr(150, random()),
uniform(1, 100000000, random()),
randstr(4000, random()),
randstr(100, random())
from
table(generator(11000));
insert into t1(b,c,d,e) select
randstr(150, random()),
uniform(1, 100000000, random()),
randstr(4000, random()),
randstr(100, random())
from
table(generator(11000));
insert into t1(b,c,d,e) select
randstr(150, random()),
uniform(1, 100000000, random()),
randstr(4000, random()),
randstr(100, random())
from
table(generator(11000));
commit;
select count(*) from information_schema.partitions where table_name = 't1';
count(*)
2
# high_bound_val should be not null
select count(*) from oceanbase.__all_part where high_bound_val is not null and table_id in (select table_id from oceanbase.__all_table where data_table_id = (select table_id from oceanbase.__all_table where table_name = 't1')) group by high_bound_val;
count(*)
3
3
# high_bound_val should be same as data table's
select * from oceanbase.__all_part where table_id in (select table_id from oceanbase.__all_table where data_table_id = (select table_id from oceanbase.__all_table where table_name = 't1')) and high_bound_val not in (select high_bound_val from oceanbase.__all_table where table_id = (select table_id from oceanbase.__all_table where table_name = 't1'));
gmt_create	gmt_modified	table_id	part_id	part_name	schema_version	high_bound_val	b_high_bound_val	sub_part_num	sub_part_space	new_sub_part_space	sub_part_interval	sub_interval_start	new_sub_part_interval	new_sub_interval_start	block_size	compress_func_name	status	spare1	spare2	spare3	comment	list_val	b_list_val	part_idx	source_partition_id	tablespace_id	partition_type	tablet_id	external_location	storage_cache_policy
drop table t1;

# uncommitted lob row
create table t1(c1 int, c2 text, primary key(c1)) partition by range(c1) (
partition p0 values less than (10),
partition p1 values less than (20),
partition p2 values less than (maxvalue));
insert into t1 values(1, repeat('p00_something1', 1000));
insert into t1 values(2, repeat('p00_something2', 1000));
insert into t1 values(3, repeat('p00_something3', 1000));
insert into t1 values(5, repeat('p01_something5', 1000));
select * from t1;
c1	c2
alter table t1 reorganize partition p0 into (partition p00 values less than (5), partition p01 values less than (10));
select c1, left(c2, 20) from t1 order by c1;
c1	left(c2, 20)
1	p00_something1p00_so
2	p00_something2p00_so
3	p00_something3p00_so
5	p01_something5p01_so
select c1, length(c2) from t1 order by c1;
c1	length(c2)
1	14000
2	14000
3	14000
5	14000
commit;
select c1, left(c2, 20) from t1 partition (p00) order by c1;
c1	left(c2, 20)
1	p00_something1p00_so
2	p00_something2p00_so
3	p00_something3p00_so
select c1, left(c2, 20) from t1 partition (p01) order by c1;
c1	left(c2, 20)
5	p01_something5p01_so
select c1, length(c2) from t1 order by c1;
c1	length(c2)
1	14000
2	14000
3	14000
5	14000
drop table t1;

# committed lob row
create table t1(c1 int, c2 text, primary key(c1)) partition by range(c1) (
partition p0 values less than (10),
partition p1 values less than (20),
partition p2 values less than (maxvalue));
insert into t1 values(0, repeat('0_p00_from_p0_major', 1000));
insert into t1 values(1, repeat('1_p00_from_p0_major', 1000));
insert into t1 values(5, repeat('5_p01_from_p0_major', 1000));
insert into t1 values(6, repeat('6_p01_from_p0_major', 1000));
commit;
alter system major freeze tenant = sys;
alter system major freeze tenant = all_user;
alter system major freeze tenant = all_meta;
insert into t1 values(2, repeat('2_p00_from_p0_minor', 1000));
insert into t1 values(3, repeat('3_p00_from_p0_minor', 1000));
insert into t1 values(4, repeat('4_p00_from_p0_minor', 1000));
insert into t1 values(7, repeat('7_p01_from_p0_minor', 1000));
select c1, left(c2, 20) from t1 order by c1;
c1	left(c2, 20)
0	0_p00_from_p0_major0
1	1_p00_from_p0_major1
5	5_p01_from_p0_major5
6	6_p01_from_p0_major6
select c1, length(c2) from t1 order by c1;
c1	length(c2)
0	19000
1	19000
5	19000
6	19000
commit;
select c1, left(c2, 20) from t1 order by c1;
c1	left(c2, 20)
0	0_p00_from_p0_major0
1	1_p00_from_p0_major1
2	2_p00_from_p0_minor2
3	3_p00_from_p0_minor3
4	4_p00_from_p0_minor4
5	5_p01_from_p0_major5
6	6_p01_from_p0_major6
7	7_p01_from_p0_minor7
select c1, length(c2) from t1 order by c1;
c1	length(c2)
0	19000
1	19000
2	19000
3	19000
4	19000
5	19000
6	19000
7	19000
alter table t1 reorganize partition p0 into (partition p00 values less than (5), partition p01 values less than (10));
select c1, left(c2, 20) from t1 partition (p00) order by c1;
c1	left(c2, 20)
0	0_p00_from_p0_major0
1	1_p00_from_p0_major1
2	2_p00_from_p0_minor2
3	3_p00_from_p0_minor3
4	4_p00_from_p0_minor4
select c1, left(c2, 20) from t1 partition (p01) order by c1;
c1	left(c2, 20)
5	5_p01_from_p0_major5
6	6_p01_from_p0_major6
7	7_p01_from_p0_minor7
select c1, length(c2) from t1 order by c1;
c1	length(c2)
0	19000
1	19000
2	19000
3	19000
4	19000
5	19000
6	19000
7	19000
drop table t1;

# aborted lob row
create table t1(c1 int, c2 text, primary key(c1)) partition by range(c1) (
partition p0 values less than (10),
partition p1 values less than (20),
partition p2 values less than (maxvalue));
insert into t1 values(0, repeat('0_p00_from_p0_major', 1000));
insert into t1 values(1, repeat('1_p00_from_p0_major', 1000));
insert into t1 values(5, repeat('5_p01_from_p0_major', 1000));
insert into t1 values(6, repeat('6_p01_from_p0_major', 1000));
commit;
alter system major freeze tenant = sys;
alter system major freeze tenant = all_user;
alter system major freeze tenant = all_meta;
insert into t1 values(2, repeat('2_p00_from_p0_minor', 1000));
insert into t1 values(3, repeat('3_p00_from_p0_minor', 1000));
insert into t1 values(4, repeat('4_p00_from_p0_minor', 1000));
insert into t1 values(7, repeat('7_p01_from_p0_minor', 1000));
select c1, left(c2, 20) from t1 order by c1;
c1	left(c2, 20)
0	0_p00_from_p0_major0
1	1_p00_from_p0_major1
5	5_p01_from_p0_major5
6	6_p01_from_p0_major6
select c1, length(c2) from t1 order by c1;
c1	length(c2)
0	19000
1	19000
5	19000
6	19000
rollback;
select c1, left(c2, 20) from t1 order by c1;
c1	left(c2, 20)
0	0_p00_from_p0_major0
1	1_p00_from_p0_major1
5	5_p01_from_p0_major5
6	6_p01_from_p0_major6
select c1, length(c2) from t1 order by c1;
c1	length(c2)
0	19000
1	19000
5	19000
6	19000
alter table t1 reorganize partition p0 into (partition p00 values less than (5), partition p01 values less than (10));
select c1, left(c2, 20) from t1 partition (p00) order by c1;
c1	left(c2, 20)
0	0_p00_from_p0_major0
1	1_p00_from_p0_major1
select c1, left(c2, 20) from t1 partition (p01) order by c1;
c1	left(c2, 20)
5	5_p01_from_p0_major5
6	6_p01_from_p0_major6
select c1, length(c2) from t1 order by c1;
c1	length(c2)
0	19000
1	19000
5	19000
6	19000
drop table t1;

# insert delete lob row
create table t1(c1 int, c2 text, primary key(c1)) partition by range(c1) (
partition p0 values less than (10),
partition p1 values less than (20),
partition p2 values less than (maxvalue));
insert into t1 values(1, repeat('p00_something1', 1000));
insert into t1 values(2, repeat('p00_something2', 1000));
insert into t1 values(3, repeat('p00_something3', 1000));
insert into t1 values(5, repeat('p01_something5', 1000));
commit;
delete from t1;
select * from t1;
c1	c2
alter table t1 reorganize partition p0 into (partition p00 values less than (5), partition p01 values less than (10));
select c1, left(c2, 20) from t1 order by c1;
c1	left(c2, 20)
1	p00_something1p00_so
2	p00_something2p00_so
3	p00_something3p00_so
5	p01_something5p01_so
select c1, length(c2) from t1 order by c1;
c1	length(c2)
1	14000
2	14000
3	14000
5	14000
select * from t1;
c1	c2
commit;
select * from t1 partition (p00);
c1	c2
select * from t1 partition (p01);
c1	c2
select * from t1;
c1	c2
drop table t1;

# insert lob after split
create table t1(c1 int, c2 text, primary key(c1)) partition by range(c1) (
partition p0 values less than (10),
partition p1 values less than (20),
partition p2 values less than (maxvalue));
insert into t1 values(1, repeat('p00_something1', 1000));
insert into t1 values(2, repeat('p00_something2', 1000));
insert into t1 values(3, repeat('p00_something3', 1000));
insert into t1 values(5, repeat('p01_something5', 1000));
commit;
alter table t1 reorganize partition p0 into (partition p00 values less than (5), partition p01 values less than (10));
delete from t1;
commit;
insert into t1 values(1, repeat('p00_something1', 1000));
insert into t1 values(2, repeat('p00_something2', 1000));
insert into t1 values(3, repeat('p00_something3', 1000));
insert into t1 values(5, repeat('p01_something5', 1000));
commit;
select c1, left(c2, 20) from t1 order by c1;
c1	left(c2, 20)
1	p00_something1p00_so
2	p00_something2p00_so
3	p00_something3p00_so
5	p01_something5p01_so
delete from t1;
commit;
drop table t1;

# split lob to more partitions
CREATE TABLE t1 (
`col1` int(11) NOT NULL,
`col2` int(11) DEFAULT NULL,
`col3` string DEFAULT NULL,
`col4` text DEFAULT NULL,
PRIMARY KEY (`col1`)
) partition by range(col1)
(partition `p0` values less than (5000),
partition `p1` values less than (10000),
partition `p2` values less than (15000),
partition `p_max` values less than (MAXVALUE));
insert /*+query_timeout(1000000000)*/ into t1 select row_number() over(), null, null, randstr(8192, random()) from table(generator(2000));
ALTER TABLE t1 REORGANIZE PARTITION p0 INTO (PARTITION p0_1 VALUES LESS THAN (102),PARTITION p0_2 VALUES LESS THAN (204),PARTITION p0_3 VALUES LESS THAN (306),PARTITION p0_4 VALUES LESS THAN (408),PARTITION p0_5 VALUES LESS THAN (510),PARTITION p0_6 VALUES LESS THAN (612),PARTITION p0_7 VALUES LESS THAN (714),PARTITION p0_8 VALUES LESS THAN (816),PARTITION p0_9 VALUES LESS THAN (918),PARTITION p0_10 VALUES LESS THAN (1020),PARTITION p0_11 VALUES LESS THAN (1122),PARTITION p0_12 VALUES LESS THAN (1224),PARTITION p0_13 VALUES LESS THAN (1326),PARTITION p0_14 VALUES LESS THAN (1428),PARTITION p0_15 VALUES LESS THAN (1530),PARTITION p0_16 VALUES LESS THAN (1632),PARTITION p0_17 VALUES LESS THAN (1734),PARTITION p0_18 VALUES LESS THAN (1836),PARTITION p0_19 VALUES LESS THAN (1938),PARTITION p0_20 VALUES LESS THAN (2040),PARTITION p0_21 VALUES LESS THAN (2142),PARTITION p0_22 VALUES LESS THAN (2244),PARTITION p0_23 VALUES LESS THAN (2346),PARTITION p0_24 VALUES LESS THAN (2448),PARTITION p0_25 VALUES LESS THAN (2550),PARTITION p0_26 VALUES LESS THAN (2652),PARTITION p0_27 VALUES LESS THAN (2754),PARTITION p0_28 VALUES LESS THAN (2856),PARTITION p0_29 VALUES LESS THAN (2958),PARTITION p0_30 VALUES LESS THAN (3060),PARTITION p0_31 VALUES LESS THAN (3162),PARTITION p0_32 VALUES LESS THAN (3264),PARTITION p0_33 VALUES LESS THAN (3366),PARTITION p0_34 VALUES LESS THAN (3468),PARTITION p0_35 VALUES LESS THAN (3570),PARTITION p0_36 VALUES LESS THAN (3672),PARTITION p0_37 VALUES LESS THAN (3774),PARTITION p0_38 VALUES LESS THAN (3876),PARTITION p0_39 VALUES LESS THAN (3978),PARTITION p0_40 VALUES LESS THAN (4080),PARTITION p0_41 VALUES LESS THAN (4182),PARTITION p0_42 VALUES LESS THAN (4284),PARTITION p0_43 VALUES LESS THAN (4386),PARTITION p0_44 VALUES LESS THAN (4488),PARTITION p0_45 VALUES LESS THAN (4590),PARTITION p0_46 VALUES LESS THAN (4692),PARTITION p0_47 VALUES LESS THAN (4794),PARTITION p0_48 VALUES LESS THAN (4896),PARTITION p0_49 VALUES LESS THAN (4998),PARTITION p0 VALUES LESS THAN (5000));
drop table t1;
