drop database if exists db1;
create database db1;
use db1;
SET wait_timeout=30000000;
SET ob_trx_timeout = 100000000;
SET ob_query_timeout = 100000000;
#分裂局部索引
drop table if exists t_range;
Warnings:
Note	1051	Unknown table 'db1.t_range'
create table t_range(
c1 int primary key,
c2 varchar(30) not null
) PARTITION BY RANGE(c1)
(PARTITION p1 VALUES LESS THAN(10),
PARTITION p2 VALUES LESS THAN(20),
PARTITION p3 VALUES LESS THAN(30));
insert into t_range values(1,'Qqwer');
insert into t_range values(3,'gagnasj');
insert into t_range values(7,'打发十分');
insert into t_range values(8,'#￥……#');
insert into t_range values(12,'【】。；，归属');
insert into t_range values(16,'SAGASN');
insert into t_range values(15,'##……是的');
insert into t_range values(21,'/613撒*12');
insert into t_range values(29,'%……H仔细');
insert into t_range values(25,'asd8gasg8');
insert into t_range values(5,'1ewg5as3');
#创建局部索引
CREATE INDEX t_range_c1 ON t_range (c1) local;
ALTER TABLE t_range REORGANIZE PARTITION p1 INTO
(PARTITION p1_new VALUES LESS THAN(5),
PARTITION p1_new2 VALUES LESS THAN(10)
);
show create table t_range;
Table	Create Table
t_range	CREATE TABLE `t_range` (
  `c1` int(11) NOT NULL,
  `c2` varchar(30) NOT NULL,
  PRIMARY KEY (`c1`),
  KEY `t_range_c1` (`c1`) BLOCK_SIZE 16384 LOCAL
) ORGANIZATION INDEX DEFAULT CHARSET = utf8mb4 ROW_FORMAT = DYNAMIC COMPRESSION = 'zstd_1.3.8' REPLICA_NUM = replica_num BLOCK_SIZE = 16384 USE_BLOOM_FILTER = FALSE ENABLE_MACRO_BLOCK_BLOOM_FILTER = FALSE TABLET_SIZE = 134217728 PCTFREE = 0
 partition by range(c1)
(partition `p1_new` values less than (5),
partition `p1_new2` values less than (10),
partition `p2` values less than (20),
partition `p3` values less than (30))
select * from t_range where c1 > 10;
c1	c2
12	【】。；，归属
15	##……是的
16	SAGASN
21	/613撒*12
25	asd8gasg8
29	%……H仔细
select * from t_range partition(p1_new) where c1 > 1 and c1 <10;
c1	c2
3	gagnasj
select * from t_range partition(p1_new2) where c1 != 7;
c1	c2
5	1ewg5as3
8	#￥……#
select * from t_range partition(p2) order by c1 desc,c2 asc;
c1	c2
16	SAGASN
15	##……是的
12	【】。；，归属
select * from t_range partition(p3);
c1	c2
21	/613撒*12
25	asd8gasg8
29	%……H仔细
update t_range set c1 = 26 where c1 = 12;
update t_range set c1 = 15 where c1 = 1;
ERROR 23000: Duplicate entry '15' for key 'PRIMARY'
update t_range set c1 = 30 where c1 = 15;
ERROR HY000: Table has no partition for value
select * from t_range partition(p2);
c1	c2
15	##……是的
16	SAGASN
select * from t_range partition(p3);
c1	c2
21	/613撒*12
25	asd8gasg8
26	【】。；，归属
29	%……H仔细
delete from t_range where c1 <5;
select * from t_range partition(p1_new);
c1	c2
drop index t_range_c1 on t_range;
CREATE INDEX t_range_c1 ON t_range (c1) GLOBAL;
ALTER TABLE t_range REORGANIZE PARTITION p2 INTO
(PARTITION p2_new VALUES LESS THAN(15),
PARTITION p2_new2 VALUES LESS THAN(20)
);
show create table t_range;
Table	Create Table
t_range	CREATE TABLE `t_range` (
  `c1` int(11) NOT NULL,
  `c2` varchar(30) NOT NULL,
  PRIMARY KEY (`c1`),
  KEY `t_range_c1` (`c1`) BLOCK_SIZE 16384 GLOBAL
 
) ORGANIZATION INDEX DEFAULT CHARSET = utf8mb4 ROW_FORMAT = DYNAMIC COMPRESSION = 'zstd_1.3.8' REPLICA_NUM = replica_num BLOCK_SIZE = 16384 USE_BLOOM_FILTER = FALSE ENABLE_MACRO_BLOCK_BLOOM_FILTER = FALSE TABLET_SIZE = 134217728 PCTFREE = 0
 partition by range(c1)
(partition `p1_new` values less than (5),
partition `p1_new2` values less than (10),
partition `p2_new` values less than (15),
partition `p2_new2` values less than (20),
partition `p3` values less than (30))
select * from t_range;
c1	c2
5	1ewg5as3
7	打发十分
8	#￥……#
15	##……是的
16	SAGASN
21	/613撒*12
25	asd8gasg8
26	【】。；，归属
29	%……H仔细
select * from t_range partition(p1_new);
c1	c2
select * from t_range partition(p1_new2);
c1	c2
5	1ewg5as3
7	打发十分
8	#￥……#
select * from t_range partition(p2_new);
c1	c2
select * from t_range partition(p2_new2);
c1	c2
15	##……是的
16	SAGASN
select * from t_range partition(p3);
c1	c2
21	/613撒*12
25	asd8gasg8
26	【】。；，归属
29	%……H仔细
#主表分区列只有局部索引，分裂场景
drop table if exists t_range;
create table t_range(
c1 int,
c2 varchar(30) not null,
index index_c1(c1) local
) PARTITION BY RANGE(c1)
(PARTITION p1 VALUES LESS THAN(10),
PARTITION p2 VALUES LESS THAN(20),
PARTITION p3 VALUES LESS THAN(30));
show create table t_range;
Table	Create Table
t_range	CREATE TABLE `t_range` (
  `c1` int(11) DEFAULT NULL,
  `c2` varchar(30) NOT NULL,
  KEY `index_c1` (`c1`) BLOCK_SIZE 16384 LOCAL
) ORGANIZATION INDEX DEFAULT CHARSET = utf8mb4 ROW_FORMAT = DYNAMIC COMPRESSION = 'zstd_1.3.8' REPLICA_NUM = replica_num BLOCK_SIZE = 16384 USE_BLOOM_FILTER = FALSE ENABLE_MACRO_BLOCK_BLOOM_FILTER = FALSE TABLET_SIZE = 134217728 PCTFREE = 0
 partition by range(c1)
(partition `p1` values less than (10),
partition `p2` values less than (20),
partition `p3` values less than (30))
#预期报错
ALTER TABLE t_range REORGANIZE PARTITION p1 INTO
(PARTITION p1_new VALUES LESS THAN(5),
PARTITION p1_new2 VALUES LESS THAN(10)
);
ERROR 0A000: reorganizing table without primary key(s) is not supported
show create table t_range;
Table	Create Table
t_range	CREATE TABLE `t_range` (
  `c1` int(11) DEFAULT NULL,
  `c2` varchar(30) NOT NULL,
  KEY `index_c1` (`c1`) BLOCK_SIZE 16384 LOCAL
) ORGANIZATION INDEX DEFAULT CHARSET = utf8mb4 ROW_FORMAT = DYNAMIC COMPRESSION = 'zstd_1.3.8' REPLICA_NUM = replica_num BLOCK_SIZE = 16384 USE_BLOOM_FILTER = FALSE ENABLE_MACRO_BLOCK_BLOOM_FILTER = FALSE TABLET_SIZE = 134217728 PCTFREE = 0
 partition by range(c1)
(partition `p1` values less than (10),
partition `p2` values less than (20),
partition `p3` values less than (30))
drop table t_range;
#分裂其他列上有局部索引的场景
drop table if exists t_range;
Warnings:
Note	1051	Unknown table 'db1.t_range'
create table t_range(
c1 int primary key,
c2 varchar(30) not null,
index index_c2(c2) local
) PARTITION BY RANGE(c1)
(PARTITION p1 VALUES LESS THAN(10),
PARTITION p2 VALUES LESS THAN(20),
PARTITION p3 VALUES LESS THAN(30));
insert into t_range values(1,'Qqwer');
insert into t_range values(3,'gagnasj');
insert into t_range values(7,'打发十分');
insert into t_range values(8,'#￥……#');
insert into t_range values(12,'【】。；，归属');
insert into t_range values(16,'SAGASN');
insert into t_range values(15,'##……是的');
insert into t_range values(21,'/613撒*12');
insert into t_range values(29,'%……H仔细');
insert into t_range values(25,'asd8gasg8');
insert into t_range values(5,'1ewg5as3');
ALTER TABLE t_range REORGANIZE PARTITION p1 INTO
(PARTITION p1_new VALUES LESS THAN(5),
PARTITION p1_new2 VALUES LESS THAN(10)
);
show create table t_range;
Table	Create Table
t_range	CREATE TABLE `t_range` (
  `c1` int(11) NOT NULL,
  `c2` varchar(30) NOT NULL,
  PRIMARY KEY (`c1`),
  KEY `index_c2` (`c2`) BLOCK_SIZE 16384 LOCAL
) ORGANIZATION INDEX DEFAULT CHARSET = utf8mb4 ROW_FORMAT = DYNAMIC COMPRESSION = 'zstd_1.3.8' REPLICA_NUM = replica_num BLOCK_SIZE = 16384 USE_BLOOM_FILTER = FALSE ENABLE_MACRO_BLOCK_BLOOM_FILTER = FALSE TABLET_SIZE = 134217728 PCTFREE = 0
 partition by range(c1)
(partition `p1_new` values less than (5),
partition `p1_new2` values less than (10),
partition `p2` values less than (20),
partition `p3` values less than (30))
select * from t_range order by c1,c2;
c1	c2
1	Qqwer
3	gagnasj
5	1ewg5as3
7	打发十分
8	#￥……#
12	【】。；，归属
15	##……是的
16	SAGASN
21	/613撒*12
25	asd8gasg8
29	%……H仔细
select * from t_range partition(p1_new) where c2 = 'Qqwer';
c1	c2
1	Qqwer
select * from t_range partition(p1_new2);
c1	c2
5	1ewg5as3
7	打发十分
8	#￥……#
select * from t_range partition(p2);
c1	c2
12	【】。；，归属
15	##……是的
16	SAGASN
select * from t_range partition(p3);
c1	c2
21	/613撒*12
25	asd8gasg8
29	%……H仔细
drop table t_range;
#唯一局部索引
drop table if exists test1;
Warnings:
Note	1051	Unknown table 'db1.test1'
create table test1(c1 int,c2 varchar(60),c3 decimal(10,2),primary key(c1))
partition by range(c1)(
PARTITION p1 VALUES LESS THAN(30),
PARTITION p2 VALUES LESS THAN(60),
PARTITION p3 VALUES LESS THAN(90),
PARTITION p4 VALUES less THAN(MAXVALUE)
);
CREATE UNIQUE INDEX u_index_c1_c2 ON test1(c1,c2) LOCAL;
CREATE UNIQUE INDEX u_index_c1_c2 ON test1(c3) LOCAL;
ERROR HY000: A UNIQUE INDEX must include all columns in the table's partitioning function
drop procedure if exists pro1;
CREATE  PROCEDURE pro1(in i int,j int)
begin
while i <= j DO
insert into test1 values(i,concat("李",i),i*0.1);
set i = i + 1;
end WHILE;
end
//
call pro1(1,120);
ALTER TABLE test1 REORGANIZE PARTITION p1 INTO
(PARTITION p1_new VALUES LESS THAN(15),
PARTITION p1_new2 VALUES LESS THAN(30)
);
show create table test1;
Table	Create Table
test1	CREATE TABLE `test1` (
  `c1` int(11) NOT NULL,
  `c2` varchar(60) DEFAULT NULL,
  `c3` decimal(10,2) DEFAULT NULL,
  PRIMARY KEY (`c1`),
  UNIQUE KEY `u_index_c1_c2` (`c1`, `c2`) BLOCK_SIZE 16384 LOCAL
) ORGANIZATION INDEX DEFAULT CHARSET = utf8mb4 ROW_FORMAT = DYNAMIC COMPRESSION = 'zstd_1.3.8' REPLICA_NUM = replica_num BLOCK_SIZE = 16384 USE_BLOOM_FILTER = FALSE ENABLE_MACRO_BLOCK_BLOOM_FILTER = FALSE TABLET_SIZE = 134217728 PCTFREE = 0
 partition by range(c1)
(partition `p1_new` values less than (15),
partition `p1_new2` values less than (30),
partition `p2` values less than (60),
partition `p3` values less than (90),
partition `p4` values less than (MAXVALUE))
select * from test1 partition(p1_new);
c1	c2	c3
1	李1	0.10
2	李2	0.20
3	李3	0.30
4	李4	0.40
5	李5	0.50
6	李6	0.60
7	李7	0.70
8	李8	0.80
9	李9	0.90
10	李10	1.00
11	李11	1.10
12	李12	1.20
13	李13	1.30
14	李14	1.40
select * from test1 partition(p1_new2);
c1	c2	c3
15	李15	1.50
16	李16	1.60
17	李17	1.70
18	李18	1.80
19	李19	1.90
20	李20	2.00
21	李21	2.10
22	李22	2.20
23	李23	2.30
24	李24	2.40
25	李25	2.50
26	李26	2.60
27	李27	2.70
28	李28	2.80
29	李29	2.90
update test1 set c1 = 130 where c1 = 1;
select * from test1 partition(p4) where c1 = 130;
c1	c2	c3
130	李1	0.10
delete from test1 where c1 < 15;
select * from test1 partition(p1_new);
c1	c2	c3
drop table test1;
#组合索引
#手动分裂分区键上的组合索引
drop table if exists dl_idx_test;
Warnings:
Note	1051	Unknown table 'db1.dl_idx_test'
create table dl_idx_test(
c1 int primary key,
c2 varchar(30) not null default 'AABB',
index index_c1_c2(c1,c2)
)PARTITION BY RANGE(c1)
(PARTITION p1 VALUES LESS THAN(100),
PARTITION p2 VALUES LESS THAN(200),
PARTITION p3 VALUES LESS THAN(300)
);
drop procedure if exists pro1;
CREATE  PROCEDURE pro1(in i int,j int)
begin
while i <= j DO
insert into dl_idx_test values(i,concat("王",i));
set i = i + 1;
end WHILE;
end
//
call pro1(0,249);
select count(*) from dl_idx_test;
count(*)
250
ALTER TABLE dl_idx_test REORGANIZE PARTITION p3 INTO
(PARTITION p3_new VALUES LESS THAN(250),
PARTITION p3 VALUES LESS THAN(300)
);
select count(*) from dl_idx_test partition(p3_new);
count(*)
50
select * from dl_idx_test partition(p3);
c1	c2
update dl_idx_test set c1 = 288 where c1 = 201;
select * from dl_idx_test partition(p3);
c1	c2
288	王201
ALTER TABLE dl_idx_test REORGANIZE PARTITION p1 INTO
(PARTITION p1_new VALUES LESS THAN(50),
PARTITION p1 VALUES LESS THAN(100)
);
delete from dl_idx_test where c1 < 80;
select count(*) from dl_idx_test partition(p1_new);
count(*)
0
select count(*) from dl_idx_test partition(p1);
count(*)
20
drop table dl_idx_test;
#gis索引
#创建空间列的分区表
drop table if exists spatial_data;
Warnings:
Note	1051	Unknown table 'db1.spatial_data'
CREATE TABLE spatial_data (
c1 INT not null,
point GEOMETRY not null,
PRIMARY KEY (c1)
) PARTITION BY RANGE (c1) (
PARTITION p0 VALUES LESS THAN (100),
PARTITION p1 VALUES LESS THAN (200),
PARTITION p2 VALUES LESS THAN (300)
);
ALTER TABLE spatial_data ADD SPATIAL INDEX idx_point (point);
drop procedure if exists pro1;
CREATE  PROCEDURE pro1(in i int,j int)
begin
while i <= j DO
insert into spatial_data values(i,point(i*2,i+1));
set i = i + 1;
end WHILE;
end
//
call pro1(0,299);
#预期报错，OB不支持
ALTER TABLE spatial_data REORGANIZE PARTITION p0 INTO
(PARTITION p0_new VALUES LESS THAN(50),
PARTITION p0 VALUES LESS THAN(100)
);
ERROR 0A000: split partition of a table with spatial index is not supported
#lob表的分区 ，预期报错。
#text
drop table if exists t_text;
Warnings:
Note	1051	Unknown table 'db1.t_text'
create table t_text(
c1 int primary key,
c2 text(30) not null
) PARTITION BY RANGE(c1)
(PARTITION p1 VALUES LESS THAN(10),
PARTITION p2 VALUES LESS THAN(20),
PARTITION p3 VALUES LESS THAN(30));
drop procedure if exists pro1;
CREATE  PROCEDURE pro1(in i int,j int)
begin
while i <= j DO
insert into t_text values(i,concat("李",i));
set i = i + 1;
end WHILE;
end
//
call pro1(1,29);
ALTER TABLE t_text REORGANIZE PARTITION p1 INTO
(PARTITION p1_new VALUES LESS THAN(5),
PARTITION p1_new2 VALUES LESS THAN(10)
);
show create table t_text;
Table	Create Table
t_text	CREATE TABLE `t_text` (
  `c1` int(11) NOT NULL,
  `c2` tinytext NOT NULL,
  PRIMARY KEY (`c1`)
) ORGANIZATION INDEX DEFAULT CHARSET = utf8mb4 ROW_FORMAT = DYNAMIC COMPRESSION = 'zstd_1.3.8' REPLICA_NUM = replica_num BLOCK_SIZE = 16384 USE_BLOOM_FILTER = FALSE ENABLE_MACRO_BLOCK_BLOOM_FILTER = FALSE TABLET_SIZE = 134217728 PCTFREE = 0
 partition by range(c1)
(partition `p1_new` values less than (5),
partition `p1_new2` values less than (10),
partition `p2` values less than (20),
partition `p3` values less than (30))
select * from t_text partition(p1_new);
c1	c2
1	李1
2	李2
3	李3
4	李4
select * from t_text partition(p1_new2);
c1	c2
5	李5
6	李6
7	李7
8	李8
9	李9
#添加局部索引
CREATE INDEX t_text_c2 ON t_text (c2) local;
ERROR 42000: The used storage engine can't index column 'c2'
CREATE INDEX t_text_c1 ON t_text (c2) GLOBAL;
ERROR 42000: The used storage engine can't index column 'c2'
CREATE INDEX t_text_c1 ON t_text (c1) GLOBAL;
CREATE INDEX t_text_c2 ON t_text (c1) local;
ALTER TABLE t_text REORGANIZE PARTITION p2 INTO
(PARTITION p2_new VALUES LESS THAN(15),
PARTITION p2_new2 VALUES LESS THAN(20)
);
show create table t_text;
Table	Create Table
t_text	CREATE TABLE `t_text` (
  `c1` int(11) NOT NULL,
  `c2` tinytext NOT NULL,
  PRIMARY KEY (`c1`),
  KEY `t_text_c1` (`c1`) BLOCK_SIZE 16384 GLOBAL
 ,
  KEY `t_text_c2` (`c1`) BLOCK_SIZE 16384 LOCAL
) ORGANIZATION INDEX DEFAULT CHARSET = utf8mb4 ROW_FORMAT = DYNAMIC COMPRESSION = 'zstd_1.3.8' REPLICA_NUM = replica_num BLOCK_SIZE = 16384 USE_BLOOM_FILTER = FALSE ENABLE_MACRO_BLOCK_BLOOM_FILTER = FALSE TABLET_SIZE = 134217728 PCTFREE = 0
 partition by range(c1)
(partition `p1_new` values less than (5),
partition `p1_new2` values less than (10),
partition `p2_new` values less than (15),
partition `p2_new2` values less than (20),
partition `p3` values less than (30))
select * from t_text partition(p2_new);
c1	c2
10	李10
11	李11
12	李12
13	李13
14	李14
select * from t_text partition(p2_new2);
c1	c2
15	李15
16	李16
17	李17
18	李18
19	李19
drop table t_text;
create table t_text(
c1 int ,
c2 text(30) primary key
) PARTITION BY RANGE(c2)
(PARTITION p1 VALUES LESS THAN(10),
PARTITION p2 VALUES LESS THAN(20),
PARTITION p3 VALUES LESS THAN(30));
ERROR 42000: The used storage engine can't index column 'c2'
#blob
drop table if exists t_blob;
Warnings:
Note	1051	Unknown table 'db1.t_blob'
create table t_blob(
c1 int primary key,
c2 blob
) PARTITION BY RANGE(c1)
(PARTITION p1 VALUES LESS THAN(10),
PARTITION p2 VALUES LESS THAN(20),
PARTITION p3 VALUES LESS THAN(30));
CREATE INDEX index_c1 ON t_blob (c1) local;
drop procedure if exists pro1;
CREATE  PROCEDURE pro1(in i int,j int)
begin
while i <= j DO
insert into t_blob values(i,concat("liwosgngsi",i*3));
set i = i + 1;
end WHILE;
end
//
call pro1(1,29);
ALTER TABLE t_blob REORGANIZE PARTITION p3 INTO
(PARTITION p3_new VALUES LESS THAN(28),
PARTITION p3_new2 VALUES LESS THAN(30)
);
show create table t_blob;
Table	Create Table
t_blob	CREATE TABLE `t_blob` (
  `c1` int(11) NOT NULL,
  `c2` blob DEFAULT NULL,
  PRIMARY KEY (`c1`),
  KEY `index_c1` (`c1`) BLOCK_SIZE 16384 LOCAL
) ORGANIZATION INDEX DEFAULT CHARSET = utf8mb4 ROW_FORMAT = DYNAMIC COMPRESSION = 'zstd_1.3.8' REPLICA_NUM = replica_num BLOCK_SIZE = 16384 USE_BLOOM_FILTER = FALSE ENABLE_MACRO_BLOCK_BLOOM_FILTER = FALSE TABLET_SIZE = 134217728 PCTFREE = 0
 partition by range(c1)
(partition `p1` values less than (10),
partition `p2` values less than (20),
partition `p3_new` values less than (28),
partition `p3_new2` values less than (30))
select * from t_blob partition(p3_new);
c1	c2
20	liwosgngsi60
21	liwosgngsi63
22	liwosgngsi66
23	liwosgngsi69
24	liwosgngsi72
25	liwosgngsi75
26	liwosgngsi78
27	liwosgngsi81
select * from t_blob partition(p3_new2);
c1	c2
28	liwosgngsi84
29	liwosgngsi87
drop table t_blob;
#lob/text
drop table if exists t_lob_text;
Warnings:
Note	1051	Unknown table 'db1.t_lob_text'
create table t_lob_text(
c1 int primary key,
c2 TINYBLOB not null,
c3 TINYTEXT not null,
c4 MEDIUMBLOB not null,
c5 MEDIUMTEXT,
c6 LONGBLOB,
c7 LONGTEXT,
point GEOMETRY
)partition by range(c1)(
PARTITION p1 VALUES LESS THAN(50),
PARTITION p2 VALUES LESS THAN(100),
PARTITION p3 VALUES LESS THAN(150),
PARTITION p4 VALUES LESS THAN(MAXVALUE)
);
create index index_c2_c3 on t_lob_text(c2,c3);
ERROR 42000: The used storage engine can't index column 'c2'
CREATE UNIQUE INDEX lob_index_c1_c2 ON t_lob_text(c1,c2) LOCAL;
ERROR 42000: The used storage engine can't index column 'c2'
insert into t_lob_text(c1,c2,c3,c4,c5,c6) values(1,'A','B','C','D','E');
insert into t_lob_text(c1,c2,c3,c4,c5,c6) values(2,'2A','2B','2C','2D','2E');
insert into t_lob_text(c1,c2,c3,c4,c5,c6) values(3,'2A','2B','2C','2D','2E');
insert into t_lob_text(c1,c2,c3,c4,c5,c7) values(4,'4A','4B','4C','4D','4E');
insert into t_lob_text(c1,c2,c3,c4,c5,c7) values(5,'5A','5B','5C','5D','5E');
insert into t_lob_text(c1,c2,c3,c4,c5,c7) values(6,'6A','6B','6C','6D','6E');
insert into t_lob_text(c1,c2,c3,c4,c6,c7) values(157,'7A','7B','7C','7D','7E');
insert into t_lob_text(c1,c2,c3,c4,c6,c7) values(178,'8A','8B','8C','8D','8E');
insert into t_lob_text(c1,c2,c3,c4,c6,c7) values(199,'9A','9B','9C','9D','9E');
select * from t_lob_text order by c1;
c1	c2	c3	c4	c5	c6	c7	point
1	A	B	C	D	E	NULL	NULL
2	2A	2B	2C	2D	2E	NULL	NULL
3	2A	2B	2C	2D	2E	NULL	NULL
4	4A	4B	4C	4D	NULL	4E	NULL
5	5A	5B	5C	5D	NULL	5E	NULL
6	6A	6B	6C	6D	NULL	6E	NULL
157	7A	7B	7C	NULL	7D	7E	NULL
178	8A	8B	8C	NULL	8D	8E	NULL
199	9A	9B	9C	NULL	9D	9E	NULL
drop procedure if exists pro1;
CREATE  PROCEDURE pro1(in i int,j int)
begin
while i <= j DO
insert into t_lob_text values(i,concat(i,'A'),concat(i,'B'),concat(i,'C'),concat(i,'D'),concat(i,'E'),concat(i,'F'),point(i,1));
set i = i + 1;
end WHILE;
end
//
call pro1(7,156);
ALTER TABLE t_lob_text REORGANIZE PARTITION p1 INTO
(PARTITION p1_new VALUES LESS THAN(5),
PARTITION p1_new2 VALUES LESS THAN(25),
PARTITION p1 VALUES LESS THAN(50)
);
ALTER TABLE t_lob_text REORGANIZE PARTITION p1 INTO
(PARTITION p1_new3 VALUES LESS THAN(30),
PARTITION p1_new4 VALUES LESS THAN(40),
PARTITION p1 VALUES LESS THAN(50)
);
show create table t_lob_text;
Table	Create Table
t_lob_text	CREATE TABLE `t_lob_text` (
  `c1` int(11) NOT NULL,
  `c2` tinyblob NOT NULL,
  `c3` tinytext NOT NULL,
  `c4` mediumblob NOT NULL,
  `c5` mediumtext DEFAULT NULL,
  `c6` longblob DEFAULT NULL,
  `c7` longtext DEFAULT NULL,
  `point` geometry DEFAULT NULL,
  PRIMARY KEY (`c1`)
) ORGANIZATION INDEX DEFAULT CHARSET = utf8mb4 ROW_FORMAT = DYNAMIC COMPRESSION = 'zstd_1.3.8' REPLICA_NUM = replica_num BLOCK_SIZE = 16384 USE_BLOOM_FILTER = FALSE ENABLE_MACRO_BLOCK_BLOOM_FILTER = FALSE TABLET_SIZE = 134217728 PCTFREE = 0
 partition by range(c1)
(partition `p1_new` values less than (5),
partition `p1_new2` values less than (25),
partition `p1_new3` values less than (30),
partition `p1_new4` values less than (40),
partition `p1` values less than (50),
partition `p2` values less than (100),
partition `p3` values less than (150),
partition `p4` values less than (MAXVALUE))
select * from t_lob_text partition(p1_new);
c1	c2	c3	c4	c5	c6	c7	point
1	A	B	C	D	E	NULL	NULL
2	2A	2B	2C	2D	2E	NULL	NULL
3	2A	2B	2C	2D	2E	NULL	NULL
4	4A	4B	4C	4D	NULL	4E	NULL
select * from t_lob_text partition(p1_new2);
c1	c2	c3	c4	c5	c6	c7	point
5	5A	5B	5C	5D	NULL	5E	NULL
6	6A	6B	6C	6D	NULL	6E	NULL
7	7A	7B	7C	7D	7E	7F	             @      �?
8	8A	8B	8C	8D	8E	8F	              @      �?
9	9A	9B	9C	9D	9E	9F	             "@      �?
10	10A	10B	10C	10D	10E	10F	             $@      �?
11	11A	11B	11C	11D	11E	11F	             &@      �?
12	12A	12B	12C	12D	12E	12F	             (@      �?
13	13A	13B	13C	13D	13E	13F	             *@      �?
14	14A	14B	14C	14D	14E	14F	             ,@      �?
15	15A	15B	15C	15D	15E	15F	             .@      �?
16	16A	16B	16C	16D	16E	16F	             0@      �?
17	17A	17B	17C	17D	17E	17F	             1@      �?
18	18A	18B	18C	18D	18E	18F	             2@      �?
19	19A	19B	19C	19D	19E	19F	             3@      �?
20	20A	20B	20C	20D	20E	20F	             4@      �?
21	21A	21B	21C	21D	21E	21F	             5@      �?
22	22A	22B	22C	22D	22E	22F	             6@      �?
23	23A	23B	23C	23D	23E	23F	             7@      �?
24	24A	24B	24C	24D	24E	24F	             8@      �?
select * from t_lob_text partition(p1_new3);
c1	c2	c3	c4	c5	c6	c7	point
25	25A	25B	25C	25D	25E	25F	             9@      �?
26	26A	26B	26C	26D	26E	26F	             :@      �?
27	27A	27B	27C	27D	27E	27F	             ;@      �?
28	28A	28B	28C	28D	28E	28F	             <@      �?
29	29A	29B	29C	29D	29E	29F	             =@      �?
select * from t_lob_text partition(p1_new4);
c1	c2	c3	c4	c5	c6	c7	point
30	30A	30B	30C	30D	30E	30F	             >@      �?
31	31A	31B	31C	31D	31E	31F	             ?@      �?
32	32A	32B	32C	32D	32E	32F	             @@      �?
33	33A	33B	33C	33D	33E	33F	            �@@      �?
34	34A	34B	34C	34D	34E	34F	             A@      �?
35	35A	35B	35C	35D	35E	35F	            �A@      �?
36	36A	36B	36C	36D	36E	36F	             B@      �?
37	37A	37B	37C	37D	37E	37F	            �B@      �?
38	38A	38B	38C	38D	38E	38F	             C@      �?
39	39A	39B	39C	39D	39E	39F	            �C@      �?
select * from t_lob_text partition(p1);
c1	c2	c3	c4	c5	c6	c7	point
40	40A	40B	40C	40D	40E	40F	             D@      �?
41	41A	41B	41C	41D	41E	41F	            �D@      �?
42	42A	42B	42C	42D	42E	42F	             E@      �?
43	43A	43B	43C	43D	43E	43F	            �E@      �?
44	44A	44B	44C	44D	44E	44F	             F@      �?
45	45A	45B	45C	45D	45E	45F	            �F@      �?
46	46A	46B	46C	46D	46E	46F	             G@      �?
47	47A	47B	47C	47D	47E	47F	            �G@      �?
48	48A	48B	48C	48D	48E	48F	             H@      �?
49	49A	49B	49C	49D	49E	49F	            �H@      �?
ALTER TABLE t_lob_text REORGANIZE PARTITION p4 INTO
(PARTITION p4_new VALUES LESS THAN(155),
PARTITION p4_new2 VALUES LESS THAN(160),
PARTITION p4 VALUES LESS THAN(MAXVALUE)
);
select * from t_lob_text partition(p4_new);
c1	c2	c3	c4	c5	c6	c7	point
150	150A	150B	150C	150D	150E	150F	            �b@      �?
151	151A	151B	151C	151D	151E	151F	            �b@      �?
152	152A	152B	152C	152D	152E	152F	             c@      �?
153	153A	153B	153C	153D	153E	153F	             c@      �?
154	154A	154B	154C	154D	154E	154F	            @c@      �?
select * from t_lob_text partition(p4_new2);
c1	c2	c3	c4	c5	c6	c7	point
155	155A	155B	155C	155D	155E	155F	            `c@      �?
156	156A	156B	156C	156D	156E	156F	            �c@      �?
157	7A	7B	7C	NULL	7D	7E	NULL
select * from t_lob_text partition(p4);
c1	c2	c3	c4	c5	c6	c7	point
178	8A	8B	8C	NULL	8D	8E	NULL
199	9A	9B	9C	NULL	9D	9E	NULL
drop table t_lob_text;
drop database db1;
