purge recyclebin;
#Environmental cleaning
result_format: 4
###设置超时时间
set ob_trx_timeout = 10000000000;
set ob_query_timeout = 10000000000;
###root用户
DROP DATABASE db1;
CREATE DATABASE db1 CHARACTER SET utf8mb4;
use db1;
### 基础case
#### OB结果与ODPS不一致。
select split_part('a,b,c,d', '', '') ;
+-------------------------------+
| split_part('a,b,c,d', '', '') |
+-------------------------------+
| a,b,c,d                       |
+-------------------------------+
### arg3 = 0时，将0按照1处理；
select split_part('a,b,c,d', ',', 0) ;
+-------------------------------+
| split_part('a,b,c,d', ',', 0) |
+-------------------------------+
| a                             |
+-------------------------------+
### arg3 < 0时，按照逆序处理。
select split_part('a,b,c,d', ',', -1) ;
+--------------------------------+
| split_part('a,b,c,d', ',', -1) |
+--------------------------------+
| d                              |
+--------------------------------+
select split_part('a,b,c,d', ',', 1) ;
+-------------------------------+
| split_part('a,b,c,d', ',', 1) |
+-------------------------------+
| a                             |
+-------------------------------+
select split_part('a,b,c,d', ':', 2) ;
+-------------------------------+
| split_part('a,b,c,d', ':', 2) |
+-------------------------------+
|                               |
+-------------------------------+
select split_part('a,b,c,d', '', 1) ;
+------------------------------+
| split_part('a,b,c,d', '', 1) |
+------------------------------+
| a,b,c,d                      |
+------------------------------+
#### OB结果与ODPS不一致。
select split_part('a,b,c,d', '', 2) ;
+------------------------------+
| split_part('a,b,c,d', '', 2) |
+------------------------------+
|                              |
+------------------------------+
select split_part('a,b,c,d', ',', 10) ;
+--------------------------------+
| split_part('a,b,c,d', ',', 10) |
+--------------------------------+
|                                |
+--------------------------------+
### arg3 < 0时，按照逆序处理。
select split_part('a,b,c,d', ',', -10) ;
+---------------------------------+
| split_part('a,b,c,d', ',', -10) |
+---------------------------------+
|                                 |
+---------------------------------+
### arg3 = 0时，将0按照1处理；
SELECT split_part('abcdabcdabc', 'abc', 0) ;
+-------------------------------------+
| split_part('abcdabcdabc', 'abc', 0) |
+-------------------------------------+
|                                     |
+-------------------------------------+
SELECT split_part('abcdabcdabc', 'abc', 1) ;
+-------------------------------------+
| split_part('abcdabcdabc', 'abc', 1) |
+-------------------------------------+
|                                     |
+-------------------------------------+
SELECT split_part('abcdabcdabc', 'abc', -1) ;
+--------------------------------------+
| split_part('abcdabcdabc', 'abc', -1) |
+--------------------------------------+
|                                      |
+--------------------------------------+
#### OB结果与ODPS不一致。
SELECT split_part(1.414, 1, '2') ;
+---------------------------+
| split_part(1.414, 1, '2') |
+---------------------------+
| .4                        |
+---------------------------+
SELECT split_part(1.414, 1, '-4') ;
+----------------------------+
| split_part(1.414, 1, '-4') |
+----------------------------+
|                            |
+----------------------------+
### arg3 = 0时，将0按照1处理；
SELECT split_part('', '', 0) ;
+-----------------------+
| split_part('', '', 0) |
+-----------------------+
|                       |
+-----------------------+
SELECT split_part('', '', 1) ;
+-----------------------+
| split_part('', '', 1) |
+-----------------------+
|                       |
+-----------------------+
select split_part('', ',', 1) ;
+------------------------+
| split_part('', ',', 1) |
+------------------------+
|                        |
+------------------------+
select split_part('a,b,c,d', ',', 1, 2) ;
+----------------------------------+
| split_part('a,b,c,d', ',', 1, 2) |
+----------------------------------+
| a,b                              |
+----------------------------------+
select split_part('a,b,c,d', ',', 2, 6) ;
+----------------------------------+
| split_part('a,b,c,d', ',', 2, 6) |
+----------------------------------+
| b,c,d                            |
+----------------------------------+
select split_part('a,b,c,d', '', 1, 2) ;
+---------------------------------+
| split_part('a,b,c,d', '', 1, 2) |
+---------------------------------+
| a,b,c,d                         |
+---------------------------------+
select split_part('a,b,c,d', ',', 1, 3) ;
+----------------------------------+
| split_part('a,b,c,d', ',', 1, 3) |
+----------------------------------+
| a,b,c                            |
+----------------------------------+
### arg3 < 0时，按照逆序处理。
select split_part('a,b,c,d', ',', -4, -2) ;
+------------------------------------+
| split_part('a,b,c,d', ',', -4, -2) |
+------------------------------------+
| a,b,c                              |
+------------------------------------+
select split_part('a,b,c,d', ',', 1, 10) ;
+-----------------------------------+
| split_part('a,b,c,d', ',', 1, 10) |
+-----------------------------------+
| a,b,c,d                           |
+-----------------------------------+
select split_part('a,b,c,d', ',', -2, -1) ;
+------------------------------------+
| split_part('a,b,c,d', ',', -2, -1) |
+------------------------------------+
| c,d                                |
+------------------------------------+
SELECT split_part('abcdabcdabc', 'abc', '1','2') ;
+-------------------------------------------+
| split_part('abcdabcdabc', 'abc', '1','2') |
+-------------------------------------------+
| abcd                                      |
+-------------------------------------------+
SELECT split_part('abcdabcdabc', 'abc', '-1','-4') ;
ERROR HY000: Incorrect arguments to SPLIT_PART function. The end part must be greater than start part.
select split_part(NULL, ',', 10) ;
+---------------------------+
| split_part(NULL, ',', 10) |
+---------------------------+
| NULL                      |
+---------------------------+
select split_part('a,b,c,d', NULL, 1) ;
+--------------------------------+
| split_part('a,b,c,d', NULL, 1) |
+--------------------------------+
| NULL                           |
+--------------------------------+
select split_part('a,b,c,d', ':', NULL) ;
+----------------------------------+
| split_part('a,b,c,d', ':', NULL) |
+----------------------------------+
| NULL                             |
+----------------------------------+
select split_part('a,b,c,d', ',', null) ;
+----------------------------------+
| split_part('a,b,c,d', ',', null) |
+----------------------------------+
| NULL                             |
+----------------------------------+
select split_part(NULL,NULL,NULL) ;
+----------------------------+
| split_part(NULL,NULL,NULL) |
+----------------------------+
| NULL                       |
+----------------------------+
select split_part(NULL,NULL,NULL,NULL) ;
+---------------------------------+
| split_part(NULL,NULL,NULL,NULL) |
+---------------------------------+
| NULL                            |
+---------------------------------+
SELECT split_part('abcdabcdabc', NULL, NULL) ;
+---------------------------------------+
| split_part('abcdabcdabc', NULL, NULL) |
+---------------------------------------+
| NULL                                  |
+---------------------------------------+
SELECT split_part('abcdabcdabc', NULL, 0, NULL) ;
+------------------------------------------+
| split_part('abcdabcdabc', NULL, 0, NULL) |
+------------------------------------------+
| NULL                                     |
+------------------------------------------+
SELECT split_part('abcdabcdabc', NULL, 0, 0) ;
+---------------------------------------+
| split_part('abcdabcdabc', NULL, 0, 0) |
+---------------------------------------+
| NULL                                  |
+---------------------------------------+
SELECT split_part('abcdabcdabc', NULL, 1, NULL) ;
+------------------------------------------+
| split_part('abcdabcdabc', NULL, 1, NULL) |
+------------------------------------------+
| NULL                                     |
+------------------------------------------+
SELECT split_part('abcdabcdabc', NULL, -1, NULL) ;
+-------------------------------------------+
| split_part('abcdabcdabc', NULL, -1, NULL) |
+-------------------------------------------+
| NULL                                      |
+-------------------------------------------+
SELECT split_part('abcdabcdabc', NULL, NULL, 0) ;
+------------------------------------------+
| split_part('abcdabcdabc', NULL, NULL, 0) |
+------------------------------------------+
| NULL                                     |
+------------------------------------------+
select split_part( 'mysql.col','.', 9223372036854775806) ;
+---------------------------------------------------+
| split_part( 'mysql.col','.', 9223372036854775806) |
+---------------------------------------------------+
|                                                   |
+---------------------------------------------------+
select split_part( 'mysql.col','.', 9223372036854775807) ;
+---------------------------------------------------+
| split_part( 'mysql.col','.', 9223372036854775807) |
+---------------------------------------------------+
|                                                   |
+---------------------------------------------------+
#### OB结果与ODPS不一致。
select split_part( 'mysql.col','.', 9223372036854775808) ;
+---------------------------------------------------+
| split_part( 'mysql.col','.', 9223372036854775808) |
+---------------------------------------------------+
|                                                   |
+---------------------------------------------------+
select split_part( 'mysql.col','.', 9223372036854775809) ;
+---------------------------------------------------+
| split_part( 'mysql.col','.', 9223372036854775809) |
+---------------------------------------------------+
|                                                   |
+---------------------------------------------------+
select split_part( 'mysql.col','.', 9223372036854775810) ;
+---------------------------------------------------+
| split_part( 'mysql.col','.', 9223372036854775810) |
+---------------------------------------------------+
|                                                   |
+---------------------------------------------------+
select split_part( 'mysql.col','.', 9223372036854775811) ;
+---------------------------------------------------+
| split_part( 'mysql.col','.', 9223372036854775811) |
+---------------------------------------------------+
|                                                   |
+---------------------------------------------------+
select split_part( 'mysql.col','.', -9223372036854775806) ;
+----------------------------------------------------+
| split_part( 'mysql.col','.', -9223372036854775806) |
+----------------------------------------------------+
|                                                    |
+----------------------------------------------------+
select split_part( 'mysql.col','.', -9223372036854775807) ;
+----------------------------------------------------+
| split_part( 'mysql.col','.', -9223372036854775807) |
+----------------------------------------------------+
|                                                    |
+----------------------------------------------------+
select split_part( 'mysql.col','.', -9223372036854775808) ;
+----------------------------------------------------+
| split_part( 'mysql.col','.', -9223372036854775808) |
+----------------------------------------------------+
|                                                    |
+----------------------------------------------------+
select split_part( 'mysql.col','.', -9223372036854775809) ;
+----------------------------------------------------+
| split_part( 'mysql.col','.', -9223372036854775809) |
+----------------------------------------------------+
|                                                    |
+----------------------------------------------------+
### 参数个数，边界值覆盖
SELECT split_part('a,b,c,d', ',', 1) ;
+-------------------------------+
| split_part('a,b,c,d', ',', 1) |
+-------------------------------+
| a                             |
+-------------------------------+
SELECT split_part('a,b,c,d', ',', 1, 2) ;
+----------------------------------+
| split_part('a,b,c,d', ',', 1, 2) |
+----------------------------------+
| a,b                              |
+----------------------------------+
SELECT split_part('a,b,c,d', ',') ;
ERROR 42000: Incorrect parameter count in the call to native function 'split_part'
SELECT split_part('a,b,c,d') ;
ERROR 42000: Incorrect parameter count in the call to native function 'split_part'
SELECT split_part() ;
ERROR 42000: Incorrect parameter count in the call to native function 'split_part'
SELECT split_part('a,b,c,d', ',', 1, 2, 3) ;
ERROR 42000: Incorrect parameter count
SELECT split_part('a,b,c,d', ',', 1, 2, 3, 4) ;
ERROR 42000: Incorrect parameter count
SELECT split_part('a,b,c,d', NULL, 1) ;
+--------------------------------+
| split_part('a,b,c,d', NULL, 1) |
+--------------------------------+
| NULL                           |
+--------------------------------+
SELECT split_part('a,b,c,d', ',', NULL, 2) ;
+-------------------------------------+
| split_part('a,b,c,d', ',', NULL, 2) |
+-------------------------------------+
| NULL                                |
+-------------------------------------+
SELECT split_part(NULL, NULL, NULL) ;
+------------------------------+
| split_part(NULL, NULL, NULL) |
+------------------------------+
| NULL                         |
+------------------------------+
SELECT split_part(NULL, NULL, NULL, NULL) ;
+------------------------------------+
| split_part(NULL, NULL, NULL, NULL) |
+------------------------------------+
| NULL                               |
+------------------------------------+
### 参数类型，包含常用字符、特殊字符以及使用变量等覆盖
SELECT split_part('a,b,c,d', ',', 1) ;
+-------------------------------+
| split_part('a,b,c,d', ',', 1) |
+-------------------------------+
| a                             |
+-------------------------------+
SELECT split_part('a,b,c,d', ',', 0) ;
+-------------------------------+
| split_part('a,b,c,d', ',', 0) |
+-------------------------------+
| a                             |
+-------------------------------+
SELECT split_part('a,b,c,d', ',', -1) ;
+--------------------------------+
| split_part('a,b,c,d', ',', -1) |
+--------------------------------+
| d                              |
+--------------------------------+
SELECT split_part('a,b,c,d', ',', 10) ;
+--------------------------------+
| split_part('a,b,c,d', ',', 10) |
+--------------------------------+
|                                |
+--------------------------------+
SELECT split_part('a,b,c,d', ';', 1) ;
+-------------------------------+
| split_part('a,b,c,d', ';', 1) |
+-------------------------------+
| a,b,c,d                       |
+-------------------------------+
SELECT split_part('a,b,c,d', ';', 0) ;
+-------------------------------+
| split_part('a,b,c,d', ';', 0) |
+-------------------------------+
| a,b,c,d                       |
+-------------------------------+
SELECT split_part('a,b,c,d', ';', -1) ;
+--------------------------------+
| split_part('a,b,c,d', ';', -1) |
+--------------------------------+
| a,b,c,d                        |
+--------------------------------+
SELECT split_part('a,b,c,d', ',', 1, 2) ;
+----------------------------------+
| split_part('a,b,c,d', ',', 1, 2) |
+----------------------------------+
| a,b                              |
+----------------------------------+
SELECT split_part('a,b,c,d', ',', -4, -2) ;
+------------------------------------+
| split_part('a,b,c,d', ',', -4, -2) |
+------------------------------------+
| a,b,c                              |
+------------------------------------+
SELECT split_part('a,b,c,d', ',', 1, 10) ;
+-----------------------------------+
| split_part('a,b,c,d', ',', 1, 10) |
+-----------------------------------+
| a,b,c,d                           |
+-----------------------------------+
SELECT split_part('a,b,c,d', ';', 1, 2) ;
+----------------------------------+
| split_part('a,b,c,d', ';', 1, 2) |
+----------------------------------+
| a,b,c,d                          |
+----------------------------------+
SELECT split_part('a,b,c,d', ',', 1, -2) ;
ERROR HY000: Incorrect arguments to SPLIT_PART function. The end part must be greater than start part.
SELECT split_part(NULL, NULL, NULL) ;
+------------------------------+
| split_part(NULL, NULL, NULL) |
+------------------------------+
| NULL                         |
+------------------------------+
SELECT split_part(NULL, NULL, NULL, NULL) ;
+------------------------------------+
| split_part(NULL, NULL, NULL, NULL) |
+------------------------------------+
| NULL                               |
+------------------------------------+
SELECT split_part(NULL, ',', 1) ;
+--------------------------+
| split_part(NULL, ',', 1) |
+--------------------------+
| NULL                     |
+--------------------------+
SELECT split_part(NULL, ',', 1, 2) ;
+-----------------------------+
| split_part(NULL, ',', 1, 2) |
+-----------------------------+
| NULL                        |
+-----------------------------+
SELECT split_part('a,b,c,d', NULL, 1) ;
+--------------------------------+
| split_part('a,b,c,d', NULL, 1) |
+--------------------------------+
| NULL                           |
+--------------------------------+
SELECT split_part('a,b,c,d', NULL, 1, 2) ;
+-----------------------------------+
| split_part('a,b,c,d', NULL, 1, 2) |
+-----------------------------------+
| NULL                              |
+-----------------------------------+
SELECT split_part('a,b,c,d', ',', NULL) ;
+----------------------------------+
| split_part('a,b,c,d', ',', NULL) |
+----------------------------------+
| NULL                             |
+----------------------------------+
SELECT split_part('a,b,c,d', ',', NULL, 2) ;
+-------------------------------------+
| split_part('a,b,c,d', ',', NULL, 2) |
+-------------------------------------+
| NULL                                |
+-------------------------------------+
SELECT split_part('a,b,c,d', ',', 1, NULL) ;
+-------------------------------------+
| split_part('a,b,c,d', ',', 1, NULL) |
+-------------------------------------+
| NULL                                |
+-------------------------------------+
SELECT split_part('a,b,c,d', ',', 1) ;
+-------------------------------+
| split_part('a,b,c,d', ',', 1) |
+-------------------------------+
| a                             |
+-------------------------------+
SELECT split_part('a,b,c,d', ',', 0) ;
+-------------------------------+
| split_part('a,b,c,d', ',', 0) |
+-------------------------------+
| a                             |
+-------------------------------+
SELECT split_part('a,b,c,d', ',', -1) ;
+--------------------------------+
| split_part('a,b,c,d', ',', -1) |
+--------------------------------+
| d                              |
+--------------------------------+
SELECT split_part('a,b,c,d', ',', 10) ;
+--------------------------------+
| split_part('a,b,c,d', ',', 10) |
+--------------------------------+
|                                |
+--------------------------------+
SELECT split_part('abcd', ',', 1) ;
+----------------------------+
| split_part('abcd', ',', 1) |
+----------------------------+
| abcd                       |
+----------------------------+
SELECT split_part(CAST('a,b,c,d' AS tinytext), ',', 1) ;
ERROR 42000: You have an error in your SQL syntax; check the manual that corresponds to your OceanBase version for the right syntax to use near 'tinytext), ',', 1)' at line 1
SELECT split_part(CAST('a,b,c,d' AS text), ',', 1) ;
ERROR 42000: You have an error in your SQL syntax; check the manual that corresponds to your OceanBase version for the right syntax to use near 'text), ',', 1)' at line 1
SELECT split_part(CAST('a,b,c,d' AS longtext), ',', 1) ;
ERROR 42000: You have an error in your SQL syntax; check the manual that corresponds to your OceanBase version for the right syntax to use near 'longtext), ',', 1)' at line 1
SELECT split_part(NULL, ',', 1) ;
+--------------------------+
| split_part(NULL, ',', 1) |
+--------------------------+
| NULL                     |
+--------------------------+
SELECT split_part('a,b,c,d', NULL, 1) ;
+--------------------------------+
| split_part('a,b,c,d', NULL, 1) |
+--------------------------------+
| NULL                           |
+--------------------------------+
SELECT split_part('a,b,c,d', ',', NULL) ;
+----------------------------------+
| split_part('a,b,c,d', ',', NULL) |
+----------------------------------+
| NULL                             |
+----------------------------------+
SELECT split_part('a,b,c,d', ',', 1, NULL) ;
+-------------------------------------+
| split_part('a,b,c,d', ',', 1, NULL) |
+-------------------------------------+
| NULL                                |
+-------------------------------------+
SELECT split_part('a|b|c|d', '|', 2) ;
+-------------------------------+
| split_part('a|b|c|d', '|', 2) |
+-------------------------------+
| b                             |
+-------------------------------+
SELECT split_part('abcd', '', 1) ;
+---------------------------+
| split_part('abcd', '', 1) |
+---------------------------+
| abcd                      |
+---------------------------+
SELECT split_part('a,,b,c', ',', 2) ;
+------------------------------+
| split_part('a,,b,c', ',', 2) |
+------------------------------+
|                              |
+------------------------------+
SELECT split_part('', ',', 1) ;
+------------------------+
| split_part('', ',', 1) |
+------------------------+
|                        |
+------------------------+
SELECT split_part('a,b,c,d', ',', -1, 2) ;
ERROR HY000: Incorrect arguments to SPLIT_PART function. The start_part and end_part must both be either positive or negative numbers.
SELECT split_part('a,b,c,d', ',', 1, 3) ;
+----------------------------------+
| split_part('a,b,c,d', ',', 1, 3) |
+----------------------------------+
| a,b,c                            |
+----------------------------------+
SELECT split_part('a,,b,,c', ',', 3) ;
+-------------------------------+
| split_part('a,,b,,c', ',', 3) |
+-------------------------------+
| b                             |
+-------------------------------+
SELECT split_part('', '', 1) ;
+-----------------------+
| split_part('', '', 1) |
+-----------------------+
|                       |
+-----------------------+
SELECT split_part('a,b,c,d', ',', 1) WHERE LENGTH('a,b,c,d') < 255 ;
+-------------------------------+
| split_part('a,b,c,d', ',', 1) |
+-------------------------------+
| a                             |
+-------------------------------+
SELECT split_part('a,b,c,d', ',', 1) WHERE LENGTH('a,b,c,d') > 255 AND LENGTH('a,b,c,d') < 65535 ;
+-------------------------------+
| split_part('a,b,c,d', ',', 1) |
+-------------------------------+
+-------------------------------+
SELECT split_part('a,b,c,d', ',', 1) WHERE LENGTH('a,b,c,d') > 65535 ;
+-------------------------------+
| split_part('a,b,c,d', ',', 1) |
+-------------------------------+
+-------------------------------+
### 覆盖全量参数类型：
SELECT split_part('a,b,c,d', ',', 0);
+-------------------------------+
| split_part('a,b,c,d', ',', 0) |
+-------------------------------+
| a                             |
+-------------------------------+
SELECT split_part('a,b,c,d', ',', 1);
+-------------------------------+
| split_part('a,b,c,d', ',', 1) |
+-------------------------------+
| a                             |
+-------------------------------+
SELECT split_part('a,b,c,d', ',', -1);
+--------------------------------+
| split_part('a,b,c,d', ',', -1) |
+--------------------------------+
| d                              |
+--------------------------------+
SELECT split_part('1.0,2.0,3.0', ',', 1);
+-----------------------------------+
| split_part('1.0,2.0,3.0', ',', 1) |
+-----------------------------------+
| 1.0                               |
+-----------------------------------+
### OB结果不一致
SELECT split_part('a,b,c,d', ',', true);
+----------------------------------+
| split_part('a,b,c,d', ',', true) |
+----------------------------------+
| a                                |
+----------------------------------+
SELECT split_part('a,b,c,d', ',', false);
+-----------------------------------+
| split_part('a,b,c,d', ',', false) |
+-----------------------------------+
| a                                 |
+-----------------------------------+
SELECT split_part('A,B,C,D', ',', 1);
+-------------------------------+
| split_part('A,B,C,D', ',', 1) |
+-------------------------------+
| A                             |
+-------------------------------+
SELECT split_part('a,b,c,d', ',', 1);
+-------------------------------+
| split_part('a,b,c,d', ',', 1) |
+-------------------------------+
| a                             |
+-------------------------------+
SELECT split_part('Ab,cD,eF', ',', 1);
+--------------------------------+
| split_part('Ab,cD,eF', ',', 1) |
+--------------------------------+
| Ab                             |
+--------------------------------+
SELECT split_part('abc', ',', 0);
+---------------------------+
| split_part('abc', ',', 0) |
+---------------------------+
| abc                       |
+---------------------------+
SELECT split_part('abc', ',', 1);
+---------------------------+
| split_part('abc', ',', 1) |
+---------------------------+
| abc                       |
+---------------------------+
SELECT split_part('汉字,测试,示例', ',', 1);
+--------------------------------------------+
| split_part('汉字,测试,示例', ',', 1)       |
+--------------------------------------------+
| 汉字                                       |
+--------------------------------------------+
SELECT split_part('⚽,🏀,篮球', ',', 1);
+---------------------------------------+
| split_part('⚽,🏀,篮球', ',', 1)         |
+---------------------------------------+
| ⚽                                     |
+---------------------------------------+
SELECT split_part('汉字', ',', 0);
+------------------------------+
| split_part('汉字', ',', 0)   |
+------------------------------+
| 汉字                         |
+------------------------------+
SELECT split_part('汉字', ',', 1);
+------------------------------+
| split_part('汉字', ',', 1)   |
+------------------------------+
| 汉字                         |
+------------------------------+
SELECT split_part(NULL, ',', 1);
+--------------------------+
| split_part(NULL, ',', 1) |
+--------------------------+
| NULL                     |
+--------------------------+
SELECT split_part('a,b,c', NULL, 1);
+------------------------------+
| split_part('a,b,c', NULL, 1) |
+------------------------------+
| NULL                         |
+------------------------------+
SELECT split_part('a,b,c', ',', NULL);
+--------------------------------+
| split_part('a,b,c', ',', NULL) |
+--------------------------------+
| NULL                           |
+--------------------------------+
SELECT split_part(NULL, NULL, NULL);
+------------------------------+
| split_part(NULL, NULL, NULL) |
+------------------------------+
| NULL                         |
+------------------------------+
SELECT split_part('~！？@#￥%&*（）、{}【】=/。， ·', '，', 1);
+---------------------------------------------------------------------+
| split_part('~！？@#￥%&*（）、{}【】=/。， ·', '，', 1)             |
+---------------------------------------------------------------------+
| ~！？@#￥%&*（）、{}【】=/。                                        |
+---------------------------------------------------------------------+
SELECT split_part('~！？@#￥%', '!', 1);
+-------------------------------------+
| split_part('~！？@#￥%', '!', 1)    |
+-------------------------------------+
| ~！？@#￥%                          |
+-------------------------------------+
SET @arg1 = 'a,b,c,d';
SET @arg2 = ',';
SET @arg3 = 2;
SELECT split_part(@arg1, @arg2, @arg3);
+---------------------------------+
| split_part(@arg1, @arg2, @arg3) |
+---------------------------------+
| b                               |
+---------------------------------+
### 使用运算符对参数计算的结果覆盖
SELECT split_part('a,b,c,d', ',', 1 + 0) ;
+-----------------------------------+
| split_part('a,b,c,d', ',', 1 + 0) |
+-----------------------------------+
| a                                 |
+-----------------------------------+
SELECT split_part('a,b,c,d', ',', 3 - 2) ;
+-----------------------------------+
| split_part('a,b,c,d', ',', 3 - 2) |
+-----------------------------------+
| a                                 |
+-----------------------------------+
### #### OB结果与ODPS不一致。
SELECT split_part('a,b,c,d', ',', 2 * 2 / 2) ;
+---------------------------------------+
| split_part('a,b,c,d', ',', 2 * 2 / 2) |
+---------------------------------------+
| b                                     |
+---------------------------------------+
SELECT split_part('a,b,c,d', ',', 1 + 2 / 2) ;
+---------------------------------------+
| split_part('a,b,c,d', ',', 1 + 2 / 2) |
+---------------------------------------+
| b                                     |
+---------------------------------------+
SELECT split_part('a,b,c,d', ',', (2 + 3) * (4 - 2) / 2) ;
+---------------------------------------------------+
| split_part('a,b,c,d', ',', (2 + 3) * (4 - 2) / 2) |
+---------------------------------------------------+
|                                                   |
+---------------------------------------------------+
SELECT split_part('a,b,c,d', ',', 1, (2 + 3) * (4 - 2) / 2) ;
+------------------------------------------------------+
| split_part('a,b,c,d', ',', 1, (2 + 3) * (4 - 2) / 2) |
+------------------------------------------------------+
| a,b,c,d                                              |
+------------------------------------------------------+
SELECT split_part('a,b,c,d', ',', LENGTH('abc') - 2) ;
+-----------------------------------------------+
| split_part('a,b,c,d', ',', LENGTH('abc') - 2) |
+-----------------------------------------------+
| a                                             |
+-----------------------------------------------+
SELECT split_part('a,b,c,d', ',', 1, LENGTH('abcd') - 3) ;
+---------------------------------------------------+
| split_part('a,b,c,d', ',', 1, LENGTH('abcd') - 3) |
+---------------------------------------------------+
| a                                                 |
+---------------------------------------------------+
SELECT split_part('a,b,c,d', ',', -ABS(-2)) ;
+--------------------------------------+
| split_part('a,b,c,d', ',', -ABS(-2)) |
+--------------------------------------+
| c                                    |
+--------------------------------------+
SELECT split_part('a,b,c,d', ',', 1, -ABS(-3)) ;
ERROR HY000: Incorrect arguments to SPLIT_PART function. The end part must be greater than start part.
SELECT split_part('a,b,c,d', ',', 5 - 5) ;
+-----------------------------------+
| split_part('a,b,c,d', ',', 5 - 5) |
+-----------------------------------+
| a                                 |
+-----------------------------------+
SELECT split_part('a,b,c,d', ',', 1, 5 - 5) ;
ERROR HY000: Incorrect arguments to SPLIT_PART function. The end part must be greater than start part.
SELECT split_part('a,b,c,d', ',', -1, 2) ;
ERROR HY000: Incorrect arguments to SPLIT_PART function. The start_part and end_part must both be either positive or negative numbers.
SELECT split_part('a,b,c,d', ',', -1, -2) ;
ERROR HY000: Incorrect arguments to SPLIT_PART function. The end part must be greater than start part.
SELECT split_part('a,b,c,d', ',', NULLIF(1, 1)) ;
+------------------------------------------+
| split_part('a,b,c,d', ',', NULLIF(1, 1)) |
+------------------------------------------+
| NULL                                     |
+------------------------------------------+
SELECT split_part('a,b,c,d', ',', 1, NULLIF(1, 1)) ;
+---------------------------------------------+
| split_part('a,b,c,d', ',', 1, NULLIF(1, 1)) |
+---------------------------------------------+
| NULL                                        |
+---------------------------------------------+
### 覆盖全量运算符：
###  比较运算符
###  >, >=, <, <=, =, !=
SELECT
    split_part('a,b,c,d', ',', 1) > split_part('a,b,c,d', ',', 2) AS greater_than,
    split_part('a,b,c,d', ',', 1) >= split_part('a,b,c,d', ',', 1) AS greater_equal,
    split_part('a,b,c,d', ',', 3) < split_part('a,b,c,d', ',', 4) AS less_than,
    split_part('a,b,c,d', ',', 3) <= split_part('a,b,c,d', ',', 3) AS less_equal,
    split_part('a,b,c,d', ',', 2) = split_part('a,b,c,d', ',', 2) AS equal,
    split_part('a,b,c,d', ',', 1) != split_part('a,b,c,d', ',', 3) AS not_equal;
+--------------+---------------+-----------+------------+-------+-----------+
| greater_than | greater_equal | less_than | less_equal | equal | not_equal |
+--------------+---------------+-----------+------------+-------+-----------+
|            0 |             1 |         1 |          1 |     1 |         1 |
+--------------+---------------+-----------+------------+-------+-----------+
### IN / NOT IN
SELECT 
    split_part('a,b,c,d', ',', 1) IN ('a', 'b', 'c', 'd') AS in_set,
    split_part('a,b,c,d', ',', 2) NOT IN ('x', 'y', 'z') AS not_in_set;
+--------+------------+
| in_set | not_in_set |
+--------+------------+
|      1 |          1 |
+--------+------------+
### IS NULL / IS NOT NULL
SELECT 
    split_part(NULL, ',', 1) IS NULL AS is_null_test,
    split_part('a,b,c,d', ',', 1) IS NOT NULL AS is_not_null_test;
+--------------+------------------+
| is_null_test | is_not_null_test |
+--------------+------------------+
|            1 |                1 |
+--------------+------------------+
### BETWEEN AND / NOT BETWEEN AND
SELECT 
    split_part('1,2,3,4', ',', 2) BETWEEN '1' AND '3' AS between_test,
    split_part('1,2,3,4', ',', 4) NOT BETWEEN '1' AND '3' AS not_between_test;
+--------------+------------------+
| between_test | not_between_test |
+--------------+------------------+
|            1 |                1 |
+--------------+------------------+
### LIKE
SELECT 
    split_part('apple,banana,orange', ',', 2) LIKE 'ban%' AS like_test;
+-----------+
| like_test |
+-----------+
|         1 |
+-----------+
###  REGEXP 或 RLIKE
SELECT 
    split_part('apple,banana,orange', ',', 1) REGEXP '^[a-z]+' AS regexp_test;
+-------------+
| regexp_test |
+-------------+
|           1 |
+-------------+
###  计算运算符
###  +, -, *, /, %, DIV, MOD
SELECT 
    split_part('1,2,3', ',', 1) + split_part('1,2,3', ',', 2) AS addition,
    split_part('5,3,2', ',', 1) - split_part('5,3,2', ',', 2) AS subtraction,
    split_part('2,3,4', ',', 1) * split_part('2,3,4', ',', 2) AS multiplication;
+----------+-------------+----------------+
| addition | subtraction | multiplication |
+----------+-------------+----------------+
|        3 |           2 |              6 |
+----------+-------------+----------------+
### OB结果正常无报错，返回结果为数值类型，非STRING类型。ODPS报错ODPS-0130071
SELECT 
    floor(split_part('10,3', ',', 1) DIV split_part('10,3', ',', 2)) AS div_test;
+----------+
| div_test |
+----------+
|        3 |
+----------+
SELECT 
    split_part('10,3', ',', 1) MOD split_part('10,3', ',', 2) AS mod_operation;
+---------------+
| mod_operation |
+---------------+
|             1 |
+---------------+
SELECT 
    split_part('6,3', ',', 1) / split_part('6,3', ',', 2) AS division,
    split_part('5,2', ',', 1) % split_part('5,2', ',', 2) AS mod_test;
+----------+----------+
| division | mod_test |
+----------+----------+
|        2 |        1 |
+----------+----------+
### 多层计算
SELECT 
    (split_part('5,3', ',', 1) + split_part('5,3', ',', 2)) * 2 AS multi_layer_calculation;
+-------------------------+
| multi_layer_calculation |
+-------------------------+
|                      16 |
+-------------------------+
### 逻辑运算符
SELECT 
    (split_part('a,b,c', ',', 1) = 'a' AND split_part('a,b,c', ',', 2) = 'b') AS and_test,
    (split_part('a,b,c', ',', 1) = 'a' OR split_part('a,b,c', ',', 3) = 'd') AS or_test,
    NOT (split_part('a,b,c', ',', 1) = 'x') AS not_test,
    (1 = 1 XOR 2 = 2) AS xor_test;
+----------+---------+----------+----------+
| and_test | or_test | not_test | xor_test |
+----------+---------+----------+----------+
|        1 |       1 |        1 |        0 |
+----------+---------+----------+----------+
SELECT 
    (split_part('a,b,c', ',', 1) = 'a' AND split_part('a,b,c', ',', 2) = 'b') AS and_test,
    (split_part('a,b,c', ',', 1) = 'a' OR split_part('a,b,c', ',', 3) = 'd') AS or_test;
+----------+---------+
| and_test | or_test |
+----------+---------+
|        1 |       1 |
+----------+---------+
### OB结果正常无报错,ODPS不支持。
SELECT 
    (split_part('a,b,c', ',', 1) = 'x' XOR split_part('a,b,c', ',', 1) = 'x') AS xor_test;
+----------+
| xor_test |
+----------+
|        0 |
+----------+
SELECT 
    NOT (split_part('a,b,c', ',', 1) = 'x') AS not_test;
+----------+
| not_test |
+----------+
|        1 |
+----------+
### 连接符
SELECT 
    split_part('Hello,World', ',', 1)  AS concat_test;
+-------------+
| concat_test |
+-------------+
| Hello       |
+-------------+
SELECT 
    split_part('Hello,World', ',', 2) AS concat_test;
+-------------+
| concat_test |
+-------------+
| World       |
+-------------+
SELECT 
    split_part('Hello,World', ',', 1) || ' ' || split_part('Hello,World', ',', 2) AS concat_test;
+-------------+
| concat_test |
+-------------+
|           0 |
+-------------+
Warnings:
Warning	1292	Truncated incorrect DOUBLE value: 'Hello'
Warning	1292	Truncated incorrect DOUBLE value: 'World'
### 位运算符
### OB结果正常无报错,ODPS不支持。主要ODPS返回STRING类型
SELECT split_part('a,b,c,d', ',', 1) & split_part('1,2,3', ',', 2) AS bitwise_and;
+-------------+
| bitwise_and |
+-------------+
|           0 |
+-------------+
Warnings:
Warning	1292	Truncated incorrect INTEGER value: 'a'
SELECT split_part('a,b,c,d', ',', 1) | split_part('1,2,3', ',', 2) AS bitwise_or;
+------------+
| bitwise_or |
+------------+
|          2 |
+------------+
Warnings:
Warning	1292	Truncated incorrect INTEGER value: 'a'
SELECT split_part('a,b,c,d', ',', 1) ^ split_part('1,2,3', ',', 2) AS bitwise_xor;
+-------------+
| bitwise_xor |
+-------------+
|           2 |
+-------------+
Warnings:
Warning	1292	Truncated incorrect INTEGER value: 'a'
SELECT !split_part('1,2,3,4', ',', 2) AS bitwise_not;
+-------------+
| bitwise_not |
+-------------+
|           0 |
+-------------+
SELECT split_part('1,2,3,4', ',', 2) << 1 AS left_shift;
+------------+
| left_shift |
+------------+
|          4 |
+------------+
SELECT split_part('1,2,3,4', ',', 3) >> 1 AS right_shift;
+-------------+
| right_shift |
+-------------+
|           1 |
+-------------+
SELECT 
    (split_part('1,2,3', ',', 1) & split_part('2,3,4', ',', 2)) | 
    (split_part('3,4,5', ',', 1) ^ split_part('1,2,3', ',', 2)) AS complex_bitwise_operation;
+---------------------------+
| complex_bitwise_operation |
+---------------------------+
|                         1 |
+---------------------------+
SELECT 
    split_part(NULL, ',', 1) & split_part('1,2,3', ',', 2) AS null_case_and,
    split_part('a,b,c,d', ',', NULL) | split_part('1,2,3', ',', 2) AS null_case_or;
+---------------+--------------+
| null_case_and | null_case_or |
+---------------+--------------+
|          NULL |         NULL |
+---------------+--------------+
SELECT 
    split_part('a,b,c,d', ',', 10) & split_part('1,2,3', ',', 2) AS out_of_bounds_and,
    split_part('a,b,c,d', ',', 1, 10) | split_part('1,2,3', ',', -10) AS out_of_bounds_or;
+-------------------+------------------+
| out_of_bounds_and | out_of_bounds_or |
+-------------------+------------------+
|                 0 |                0 |
+-------------------+------------------+
Warnings:
Warning	1292	Truncated incorrect INTEGER value: ''
Warning	1292	Truncated incorrect INTEGER value: 'a,b,c,d'
Warning	1292	Truncated incorrect INTEGER value: ''
### 赋值运算符
SET @result := split_part('a,b,c,d', ',', 2);
SELECT @result AS assignment_test;
+-----------------+
| assignment_test |
+-----------------+
| b               |
+-----------------+
### 函数嵌套，包含常用函数与SPLIT_PART/KEYVALUE的嵌套，以及SPLIT_PART/KEYVALUE自身的嵌套使用
SELECT split_part(UPPER('a,b,c,d'), ',', 1) ;
+--------------------------------------+
| split_part(UPPER('a,b,c,d'), ',', 1) |
+--------------------------------------+
| A                                    |
+--------------------------------------+
SELECT split_part('a,b,c,d', LEFT('abc-', 2), 1) ;
+-------------------------------------------+
| split_part('a,b,c,d', LEFT('abc-', 2), 1) |
+-------------------------------------------+
| a,b,c,d                                   |
+-------------------------------------------+
SELECT split_part('a,b,c,d', ',', LENGTH('abc') - 2) ;
+-----------------------------------------------+
| split_part('a,b,c,d', ',', LENGTH('abc') - 2) |
+-----------------------------------------------+
| a                                             |
+-----------------------------------------------+
SELECT split_part('a,b,c,d', ',', 1, LENGTH('abcd') - 3) ;
+---------------------------------------------------+
| split_part('a,b,c,d', ',', 1, LENGTH('abcd') - 3) |
+---------------------------------------------------+
| a                                                 |
+---------------------------------------------------+
SELECT split_part(split_part('a,b,c,d', ',', 1), ',', 1) ;
+---------------------------------------------------+
| split_part(split_part('a,b,c,d', ',', 1), ',', 1) |
+---------------------------------------------------+
| a                                                 |
+---------------------------------------------------+
SELECT split_part('a,b,c,d', split_part('x,y,z', ',', 1), 1) ;
+-------------------------------------------------------+
| split_part('a,b,c,d', split_part('x,y,z', ',', 1), 1) |
+-------------------------------------------------------+
| a,b,c,d                                               |
+-------------------------------------------------------+
SELECT split_part('a,b,c,d', ',', split_part('1,2,3', ',', 1)::int) ;
ERROR 42000: You have an error in your SQL syntax; check the manual that corresponds to your OceanBase version for the right syntax to use near '::int)' at line 1
### #### OB结果与ODPS不一致。
SELECT split_part('a,b,c,d', ',', 1, split_part('1,2,3', ',', 2)) ;
+------------------------------------------------------------+
| split_part('a,b,c,d', ',', 1, split_part('1,2,3', ',', 2)) |
+------------------------------------------------------------+
| a,b                                                        |
+------------------------------------------------------------+
SELECT split_part('a,b,c,d', ',', 1, CAST(123 AS CHAR(2))) ;
+-----------------------------------------------------+
| split_part('a,b,c,d', ',', 1, CAST(123 AS CHAR(2))) |
+-----------------------------------------------------+
| a,b,c,d                                             |
+-----------------------------------------------------+
SELECT split_part(UPPER(SUBSTRING('a,b,c,d,e', 1, 5)), ',', 2) ;
+---------------------------------------------------------+
| split_part(UPPER(SUBSTRING('a,b,c,d,e', 1, 5)), ',', 2) |
+---------------------------------------------------------+
| B                                                       |
+---------------------------------------------------------+
SELECT split_part('a,b,c,d', SUBSTRING(UPPER('abc-'), 1, 2), 2) ;
+----------------------------------------------------------+
| split_part('a,b,c,d', SUBSTRING(UPPER('abc-'), 1, 2), 2) |
+----------------------------------------------------------+
|                                                          |
+----------------------------------------------------------+
SELECT split_part('a,b,c,d', ',', LENGTH(SUBSTRING('abcdef', 1, 3)) + 1) ;
+-------------------------------------------------------------------+
| split_part('a,b,c,d', ',', LENGTH(SUBSTRING('abcdef', 1, 3)) + 1) |
+-------------------------------------------------------------------+
| d                                                                 |
+-------------------------------------------------------------------+
SELECT split_part('a,b,c,d', ',', 1, LENGTH(SUBSTRING('abcdef', 1, 4)) - 2) ;
+----------------------------------------------------------------------+
| split_part('a,b,c,d', ',', 1, LENGTH(SUBSTRING('abcdef', 1, 4)) - 2) |
+----------------------------------------------------------------------+
| a,b                                                                  |
+----------------------------------------------------------------------+
SELECT split_part(split_part(split_part('a,b,c,d', ',', 1), ',', 1), ',', 1) ;
+-----------------------------------------------------------------------+
| split_part(split_part(split_part('a,b,c,d', ',', 1), ',', 1), ',', 1) |
+-----------------------------------------------------------------------+
| a                                                                     |
+-----------------------------------------------------------------------+
SELECT split_part('a,b,c,d', split_part(split_part('x,y,z', ',', 1), ',', 1), 1) ;
+---------------------------------------------------------------------------+
| split_part('a,b,c,d', split_part(split_part('x,y,z', ',', 1), ',', 1), 1) |
+---------------------------------------------------------------------------+
| a,b,c,d                                                                   |
+---------------------------------------------------------------------------+
SELECT split_part('a,b,c,d', ',', split_part(split_part('1,2,3', ',', 1), ',', 1)) ;
+-----------------------------------------------------------------------------+
| split_part('a,b,c,d', ',', split_part(split_part('1,2,3', ',', 1), ',', 1)) |
+-----------------------------------------------------------------------------+
| a                                                                           |
+-----------------------------------------------------------------------------+
SELECT split_part('a,b,c,d', ',', 1, split_part(split_part('1,2,3', ',', 2), ',', 1)) ;
+--------------------------------------------------------------------------------+
| split_part('a,b,c,d', ',', 1, split_part(split_part('1,2,3', ',', 2), ',', 1)) |
+--------------------------------------------------------------------------------+
| a,b                                                                            |
+--------------------------------------------------------------------------------+
### 函数嵌套全量覆盖
SELECT MAX(split_part('a,b,c,d', ',', 1)) AS max_value ;
+-----------+
| max_value |
+-----------+
| a         |
+-----------+
SELECT MAX(split_part('1,2,3,4', ',', 1)) AS max_value ;
+-----------+
| max_value |
+-----------+
| 1         |
+-----------+
SELECT MAX(split_part('1,5,3,4', ',', 2)) AS max_value ;
+-----------+
| max_value |
+-----------+
| 5         |
+-----------+
SELECT MAX(split_part('1,2,3,4', ',', 1, 2)) AS max_value ;
+-----------+
| max_value |
+-----------+
| 1,2       |
+-----------+
SELECT MIN(split_part('a,b,c,d', ',', 1)) AS min_value ;
+-----------+
| min_value |
+-----------+
| a         |
+-----------+
SELECT MIN(split_part('4,2,3,1', ',', 1)) AS min_value ;
+-----------+
| min_value |
+-----------+
| 4         |
+-----------+
SELECT MIN(split_part('1,5,3,4', ',', 3)) AS min_value ;
+-----------+
| min_value |
+-----------+
| 3         |
+-----------+
SELECT MIN(split_part('1,2,3,4', ',', 1, 2)) AS min_value ;
+-----------+
| min_value |
+-----------+
| 1,2       |
+-----------+
### #### OB结果与ODPS不一致。ODPS不支持。
SELECT AVG(CAST(split_part('1,2,3,4', ',', 1) AS UNSIGNED)) AS avg_value ;
+-----------+
| avg_value |
+-----------+
|    1.0000 |
+-----------+
SELECT AVG(CAST(split_part('10,20,30,40', ',', 2) AS UNSIGNED)) AS avg_value ;
+-----------+
| avg_value |
+-----------+
|   20.0000 |
+-----------+
SELECT AVG(CAST(split_part('10,20,30,40', ',', 1, 4) AS UNSIGNED)) AS avg_value ;
+-----------+
| avg_value |
+-----------+
|   10.0000 |
+-----------+
Warnings:
Warning	1292	Truncated incorrect INTEGER value: '10,20,30,40'
Warning	1292	Truncated incorrect INTEGER value: '10,20,30,40'
SELECT SUM(CAST(split_part('1,2,3,4', ',', 1) AS UNSIGNED)) AS sum_value ;
+-----------+
| sum_value |
+-----------+
|         1 |
+-----------+
SELECT SUM(CAST(split_part('1,2,3,4', ',', 3) AS UNSIGNED)) AS sum_value ;
+-----------+
| sum_value |
+-----------+
|         3 |
+-----------+
SELECT SUM(CAST(split_part('1,2,3,4', ',', 1, 3) AS UNSIGNED)) AS sum_value ;
+-----------+
| sum_value |
+-----------+
|         1 |
+-----------+
Warnings:
Warning	1292	Truncated incorrect INTEGER value: '1,2,3'
SELECT COUNT(split_part('a,b,c,d', ',', 1)) AS count_value ;
+-------------+
| count_value |
+-------------+
|           1 |
+-------------+
SELECT COUNT(split_part('1,2,3,4', ',', 2)) AS count_value ;
+-------------+
| count_value |
+-------------+
|           1 |
+-------------+
SELECT COUNT(split_part('a,b,c,d', ',', 1, 2)) AS count_value ;
+-------------+
| count_value |
+-------------+
|           1 |
+-------------+
SELECT ROUND(CAST(split_part('10.5,20.7,30.1', ',', 1) AS DECIMAL(10, 2)));
+---------------------------------------------------------------------+
| ROUND(CAST(split_part('10.5,20.7,30.1', ',', 1) AS DECIMAL(10, 2))) |
+---------------------------------------------------------------------+
|                                                                  11 |
+---------------------------------------------------------------------+
SELECT CEIL(CAST(split_part('10.5,20.7,30.1', ',', 2) AS DECIMAL(10, 2)));
+--------------------------------------------------------------------+
| CEIL(CAST(split_part('10.5,20.7,30.1', ',', 2) AS DECIMAL(10, 2))) |
+--------------------------------------------------------------------+
|                                                                 21 |
+--------------------------------------------------------------------+
SELECT FLOOR(CAST(split_part('10.5,20.7,30.1', ',', 3) AS DECIMAL(10, 2)));
+---------------------------------------------------------------------+
| FLOOR(CAST(split_part('10.5,20.7,30.1', ',', 3) AS DECIMAL(10, 2))) |
+---------------------------------------------------------------------+
|                                                                  30 |
+---------------------------------------------------------------------+
SELECT ABS(CAST(split_part('10,-20,30', ',', 2) AS SIGNED));
+------------------------------------------------------+
| ABS(CAST(split_part('10,-20,30', ',', 2) AS SIGNED)) |
+------------------------------------------------------+
|                                                   20 |
+------------------------------------------------------+
SELECT NEG(CAST(split_part('5,10,15', ',', 1) AS SIGNED));
+----------------------------------------------------+
| NEG(CAST(split_part('5,10,15', ',', 1) AS SIGNED)) |
+----------------------------------------------------+
|                                                 -5 |
+----------------------------------------------------+
SELECT SIGN(CAST(split_part('0,-20,30', ',', 1) AS SIGNED));
+------------------------------------------------------+
| SIGN(CAST(split_part('0,-20,30', ',', 1) AS SIGNED)) |
+------------------------------------------------------+
|                                                    0 |
+------------------------------------------------------+
SELECT CONV(CAST(split_part('1010,2,10', ',', 1) AS UNSIGNED), 2, 10);
+----------------------------------------------------------------+
| CONV(CAST(split_part('1010,2,10', ',', 1) AS UNSIGNED), 2, 10) |
+----------------------------------------------------------------+
| 10                                                             |
+----------------------------------------------------------------+
SELECT MOD(CAST(split_part('10,3,4', ',', 1) AS SIGNED), CAST(split_part('10,3,4', ',', 2) AS SIGNED));
+-------------------------------------------------------------------------------------------------+
| MOD(CAST(split_part('10,3,4', ',', 1) AS SIGNED), CAST(split_part('10,3,4', ',', 2) AS SIGNED)) |
+-------------------------------------------------------------------------------------------------+
|                                                                                               1 |
+-------------------------------------------------------------------------------------------------+
SELECT POW(CAST(split_part('2,3', ',', 1) AS SIGNED), CAST(split_part('2,3', ',', 2) AS SIGNED));
+-------------------------------------------------------------------------------------------+
| POW(CAST(split_part('2,3', ',', 1) AS SIGNED), CAST(split_part('2,3', ',', 2) AS SIGNED)) |
+-------------------------------------------------------------------------------------------+
|                                                                                         8 |
+-------------------------------------------------------------------------------------------+
SELECT POWER(CAST(split_part('2,4', ',', 1) AS SIGNED), CAST(split_part('2,4', ',', 2) AS SIGNED));
+---------------------------------------------------------------------------------------------+
| POWER(CAST(split_part('2,4', ',', 1) AS SIGNED), CAST(split_part('2,4', ',', 2) AS SIGNED)) |
+---------------------------------------------------------------------------------------------+
|                                                                                          16 |
+---------------------------------------------------------------------------------------------+
### SELECT RAND(CAST(split_part('0.5,0.5', ',', 1) AS DECIMAL(10,2))); 
SELECT split_part(CONCAT('apple', ',', 'banana', ',', 'cherry'), ',', 2);
+-------------------------------------------------------------------+
| split_part(CONCAT('apple', ',', 'banana', ',', 'cherry'), ',', 2) |
+-------------------------------------------------------------------+
| banana                                                            |
+-------------------------------------------------------------------+
SELECT split_part(CONCAT_WS(',', 'grape', 'orange', 'pear'), ',', 3);
+---------------------------------------------------------------+
| split_part(CONCAT_WS(',', 'grape', 'orange', 'pear'), ',', 3) |
+---------------------------------------------------------------+
| pear                                                          |
+---------------------------------------------------------------+
SELECT FORMAT(split_part('1000,2000,3000', ',', 2), 0);
+-------------------------------------------------+
| FORMAT(split_part('1000,2000,3000', ',', 2), 0) |
+-------------------------------------------------+
| 2,000                                           |
+-------------------------------------------------+
SELECT SUBSTR(split_part('a,b,c,d', ',', 3), 1, 1);
+---------------------------------------------+
| SUBSTR(split_part('a,b,c,d', ',', 3), 1, 1) |
+---------------------------------------------+
| c                                           |
+---------------------------------------------+
SELECT SUBSTRING(split_part('foo|bar|baz', '|', 1), 1, 1);
+----------------------------------------------------+
| SUBSTRING(split_part('foo|bar|baz', '|', 1), 1, 1) |
+----------------------------------------------------+
| f                                                  |
+----------------------------------------------------+
SELECT TRIM(split_part('   space1,   space2   ', ',', 2));
+----------------------------------------------------+
| TRIM(split_part('   space1,   space2   ', ',', 2)) |
+----------------------------------------------------+
| space2                                             |
+----------------------------------------------------+
SELECT LTRIM(split_part('   leftTrim, rightTrim', ',', 1));
+-----------------------------------------------------+
| LTRIM(split_part('   leftTrim, rightTrim', ',', 1)) |
+-----------------------------------------------------+
| leftTrim                                            |
+-----------------------------------------------------+
SELECT RTRIM(split_part('leftTrim, rightTrim   ', ',', 2));
+-----------------------------------------------------+
| RTRIM(split_part('leftTrim, rightTrim   ', ',', 2)) |
+-----------------------------------------------------+
|  rightTrim                                          |
+-----------------------------------------------------+
SELECT ASCII(split_part('a,b,c,d', ',', 1));
+--------------------------------------+
| ASCII(split_part('a,b,c,d', ',', 1)) |
+--------------------------------------+
|                                   97 |
+--------------------------------------+
SELECT ORD(split_part('apple', ',', 1));
+----------------------------------+
| ORD(split_part('apple', ',', 1)) |
+----------------------------------+
|                               97 |
+----------------------------------+
SELECT LENGTH(split_part('a,b,c,d', ',', 3));
+---------------------------------------+
| LENGTH(split_part('a,b,c,d', ',', 3)) |
+---------------------------------------+
|                                     1 |
+---------------------------------------+
SELECT CHAR_LENGTH(split_part('a,b,c,d', ',', 2));
+--------------------------------------------+
| CHAR_LENGTH(split_part('a,b,c,d', ',', 2)) |
+--------------------------------------------+
|                                          1 |
+--------------------------------------------+
SELECT UPPER(split_part('hello,world', ',', 2));
+------------------------------------------+
| UPPER(split_part('hello,world', ',', 2)) |
+------------------------------------------+
| WORLD                                    |
+------------------------------------------+
SELECT LOWER(split_part('HELLO, World', ',', 2));
+-------------------------------------------+
| LOWER(split_part('HELLO, World', ',', 2)) |
+-------------------------------------------+
|  world                                    |
+-------------------------------------------+
SELECT HEX(split_part('abc,def', ',', 1));
+------------------------------------+
| HEX(split_part('abc,def', ',', 1)) |
+------------------------------------+
| 616263                             |
+------------------------------------+
SELECT UNHEX(split_part('616263,646566', ',', 1));
+--------------------------------------------+
| UNHEX(split_part('616263,646566', ',', 1)) |
+--------------------------------------------+
| abc                                        |
+--------------------------------------------+
SELECT MD5(split_part('abc,def', ',', 2));
+------------------------------------+
| MD5(split_part('abc,def', ',', 2)) |
+------------------------------------+
| 4ed9407630eb1000c0f6b63842defa7d   |
+------------------------------------+
SELECT INT2IP(split_part('19216801,19216802', ',', 1));
+-------------------------------------------------+
| INT2IP(split_part('19216801,19216802', ',', 1)) |
+-------------------------------------------------+
| 1.37.57.161                                     |
+-------------------------------------------------+
SELECT IP2INT(split_part('192.168.1.1,192.168.1.2', ',', 1));
+-------------------------------------------------------+
| IP2INT(split_part('192.168.1.1,192.168.1.2', ',', 1)) |
+-------------------------------------------------------+
|                                            3232235777 |
+-------------------------------------------------------+
SELECT split_part('apple,banana,cherry', ',', 1) LIKE 'a%';
+-----------------------------------------------------+
| split_part('apple,banana,cherry', ',', 1) LIKE 'a%' |
+-----------------------------------------------------+
|                                                   1 |
+-----------------------------------------------------+
SELECT split_part('dog,cat,mouse', ',', 2) REGEXP 'c.t';
+--------------------------------------------------+
| split_part('dog,cat,mouse', ',', 2) REGEXP 'c.t' |
+--------------------------------------------------+
|                                                1 |
+--------------------------------------------------+
SELECT REPEAT(split_part('foo,bar', ',', 1), 3);
+------------------------------------------+
| REPEAT(split_part('foo,bar', ',', 1), 3) |
+------------------------------------------+
| foofoofoo                                |
+------------------------------------------+
### #### OB结果与ODPS不一致。OB结果为0，ODPS结果为NULL
SELECT SPACE(2);
+----------+
| SPACE(2) |
+----------+
|          |
+----------+
SELECT split_part('first,second', ',', 2);
+------------------------------------+
| split_part('first,second', ',', 2) |
+------------------------------------+
| second                             |
+------------------------------------+
SELECT '  '+'second';
+---------------+
| '  '+'second' |
+---------------+
|             0 |
+---------------+
Warnings:
Warning	1292	Truncated incorrect DOUBLE value: 'second'
SELECT SPACE(2) + split_part('first,second', ',', 2);
+-----------------------------------------------+
| SPACE(2) + split_part('first,second', ',', 2) |
+-----------------------------------------------+
|                                             0 |
+-----------------------------------------------+
Warnings:
Warning	1292	Truncated incorrect DOUBLE value: 'second'
SELECT SUBSTRING_INDEX(split_part('a,b,c,d', ',', 2), ',', -1);
+---------------------------------------------------------+
| SUBSTRING_INDEX(split_part('a,b,c,d', ',', 2), ',', -1) |
+---------------------------------------------------------+
| b                                                       |
+---------------------------------------------------------+
SELECT LOCATE(split_part('apple,banana,cherry', ',', 2), 'banana');
+-------------------------------------------------------------+
| LOCATE(split_part('apple,banana,cherry', ',', 2), 'banana') |
+-------------------------------------------------------------+
|                                                           1 |
+-------------------------------------------------------------+
SELECT POSITION(split_part('apple,banana,cherry', ',', 2) IN 'banana');
+-----------------------------------------------------------------+
| POSITION(split_part('apple,banana,cherry', ',', 2) IN 'banana') |
+-----------------------------------------------------------------+
|                                                               1 |
+-----------------------------------------------------------------+
SELECT INSTR(split_part('apple,banana,cherry', ',', 3), 'e');
+-------------------------------------------------------+
| INSTR(split_part('apple,banana,cherry', ',', 3), 'e') |
+-------------------------------------------------------+
|                                                     3 |
+-------------------------------------------------------+
SELECT REPLACE(split_part('apple,banana,cherry', ',', 2), 'banana', 'grape');
+-----------------------------------------------------------------------+
| REPLACE(split_part('apple,banana,cherry', ',', 2), 'banana', 'grape') |
+-----------------------------------------------------------------------+
| grape                                                                 |
+-----------------------------------------------------------------------+
SELECT FIELD(split_part('apple,banana,cherry', ',', 3), 'banana', 'apple', 'cherry');
+-------------------------------------------------------------------------------+
| FIELD(split_part('apple,banana,cherry', ',', 3), 'banana', 'apple', 'cherry') |
+-------------------------------------------------------------------------------+
|                                                                             3 |
+-------------------------------------------------------------------------------+
SELECT ELT(2, split_part('first,second,third', ',', 2));
+--------------------------------------------------+
| ELT(2, split_part('first,second,third', ',', 2)) |
+--------------------------------------------------+
| NULL                                             |
+--------------------------------------------------+
SELECT INSERT(split_part('The quick brown fox', ' ', 3), 1, 3, 'red');
+----------------------------------------------------------------+
| INSERT(split_part('The quick brown fox', ' ', 3), 1, 3, 'red') |
+----------------------------------------------------------------+
| redwn                                                          |
+----------------------------------------------------------------+
SELECT LPAD(split_part('1234,5678', ',', 2), 10, '0');
+------------------------------------------------+
| LPAD(split_part('1234,5678', ',', 2), 10, '0') |
+------------------------------------------------+
| 0000005678                                     |
+------------------------------------------------+
SELECT RPAD(split_part('1234,5678', ',', 1), 10, '0');
+------------------------------------------------+
| RPAD(split_part('1234,5678', ',', 1), 10, '0') |
+------------------------------------------------+
| 1234000000                                     |
+------------------------------------------------+
### SELECT split_part(uuid(), '-', 1);
SELECT BIN(split_part('2,3', ',', 2));
+--------------------------------+
| BIN(split_part('2,3', ',', 2)) |
+--------------------------------+
| 11                             |
+--------------------------------+
SELECT quote(split_part('my_string,another_string', ',', 1));
+-------------------------------------------------------+
| quote(split_part('my_string,another_string', ',', 1)) |
+-------------------------------------------------------+
| 'my_string'                                           |
+-------------------------------------------------------+
SELECT REGEXP_SUBSTR(split_part('match1,match2', ',', 2), 'match[0-9]+');
+-------------------------------------------------------------------+
| REGEXP_SUBSTR(split_part('match1,match2', ',', 2), 'match[0-9]+') |
+-------------------------------------------------------------------+
| match2                                                            |
+-------------------------------------------------------------------+
SELECT split_part(CONCAT(CURDATE(), ',2023-12-25'), ',', 1);
SELECT split_part(CONCAT(DATEDIFF('2023-12-25', CURDATE()), ',days'), ',', 1);
SELECT split_part(CONCAT(ADDDATE(CURDATE(), INTERVAL 3 DAY), ',future_date'), ',', 1);
SELECT split_part(CONCAT(DATE(NOW()), ',2023-01-01'), ',', 1);
SELECT split_part(CONCAT(ADDTIME(NOW(), '02:00:00'), ',future_time'), ',', 1);
SELECT ADDDATE(DATE('2023-12-25'), INTERVAL split_part('1,2,3', ',', 1) DAY);
SELECT DATEDIFF(CURDATE(), '2023-12-25') + split_part('5,10,15', ',', 1);
SELECT CURDATE() + INTERVAL (select split_part('1,2,3', ',', 1)) DAY;
SELECT DATE(NOW()) + INTERVAL (SELECT split_part('3,4', ',', 2)) DAY;
SELECT ADDTIME(NOW(), split_part('00:30:00,01:00:00', ',', 1));
SELECT ADDDATE(CURDATE(), INTERVAL split_part(CONCAT('3,4'), ',', 1) DAY);
SELECT DATEDIFF(NOW(), ADDDATE(CURDATE(), INTERVAL split_part('5,7', ',', 1) DAY));
SELECT split_part(CONCAT(ADDDATE(NOW(), INTERVAL 1 MONTH), ',', DATE(NOW())), ',', 1);
SELECT CAST(split_part('1,2,3', ',', 1) AS CHAR);
+-------------------------------------------+
| CAST(split_part('1,2,3', ',', 1) AS CHAR) |
+-------------------------------------------+
| 1                                         |
+-------------------------------------------+
SELECT CONVERT(split_part('a,b,c,d', ',', 2) USING utf8);
+---------------------------------------------------+
| CONVERT(split_part('a,b,c,d', ',', 2) USING utf8) |
+---------------------------------------------------+
| b                                                 |
+---------------------------------------------------+
SELECT CAST(split_part('10,20,30', ',', 2) AS SIGNED);
+------------------------------------------------+
| CAST(split_part('10,20,30', ',', 2) AS SIGNED) |
+------------------------------------------------+
|                                             20 |
+------------------------------------------------+
SELECT split_part(CAST('1,2,3' AS CHAR), ',', 1);
+-------------------------------------------+
| split_part(CAST('1,2,3' AS CHAR), ',', 1) |
+-------------------------------------------+
| 1                                         |
+-------------------------------------------+
SELECT CAST(split_part('1.1,2.2,3.3', ',', 2) AS DECIMAL(10,2));
+----------------------------------------------------------+
| CAST(split_part('1.1,2.2,3.3', ',', 2) AS DECIMAL(10,2)) |
+----------------------------------------------------------+
|                                                     2.20 |
+----------------------------------------------------------+
SELECT CAST(split_part('10.5,20.5,30.5', ',', 3) AS FLOAT);
+-----------------------------------------------------+
| CAST(split_part('10.5,20.5,30.5', ',', 3) AS FLOAT) |
+-----------------------------------------------------+
|                                                30.5 |
+-----------------------------------------------------+
SELECT CAST(split_part('12:00:00,13:30:00,14:00:00', ',', 2) AS TIME);
+----------------------------------------------------------------+
| CAST(split_part('12:00:00,13:30:00,14:00:00', ',', 2) AS TIME) |
+----------------------------------------------------------------+
| 13:30:00                                                       |
+----------------------------------------------------------------+
SELECT split_part('12:00:00,13:30:00', ',', 1);
+-----------------------------------------+
| split_part('12:00:00,13:30:00', ',', 1) |
+-----------------------------------------+
| 12:00:00                                |
+-----------------------------------------+
SELECT CAST(split_part('2023-01-01,2023-02-01,2023-03-01', ',', 2) AS DATE);
+----------------------------------------------------------------------+
| CAST(split_part('2023-01-01,2023-02-01,2023-03-01', ',', 2) AS DATE) |
+----------------------------------------------------------------------+
| 2023-02-01                                                           |
+----------------------------------------------------------------------+
SELECT split_part('2023-01-01,2023-02-01', ',', 1);
+---------------------------------------------+
| split_part('2023-01-01,2023-02-01', ',', 1) |
+---------------------------------------------+
| 2023-01-01                                  |
+---------------------------------------------+
SELECT CAST(split_part('2023-01-01 12:00:00,2023-01-02 12:00:00', ',', 2) AS DATETIME);
+---------------------------------------------------------------------------------+
| CAST(split_part('2023-01-01 12:00:00,2023-01-02 12:00:00', ',', 2) AS DATETIME) |
+---------------------------------------------------------------------------------+
| 2023-01-02 12:00:00                                                             |
+---------------------------------------------------------------------------------+
SELECT split_part('2023-01-01 12:00:00,2023-01-02 12:00:00', ',', 1);
+---------------------------------------------------------------+
| split_part('2023-01-01 12:00:00,2023-01-02 12:00:00', ',', 1) |
+---------------------------------------------------------------+
| 2023-01-01 12:00:00                                           |
+---------------------------------------------------------------+
SELECT CAST(split_part('1.1,2.2,3.3', ',', 1) AS DECIMAL(10,2));
+----------------------------------------------------------+
| CAST(split_part('1.1,2.2,3.3', ',', 1) AS DECIMAL(10,2)) |
+----------------------------------------------------------+
|                                                     1.10 |
+----------------------------------------------------------+
SELECT CAST(split_part(CAST('2023-01-01,2023-01-02' AS CHAR), ',', 2) AS DATE);
+-------------------------------------------------------------------------+
| CAST(split_part(CAST('2023-01-01,2023-01-02' AS CHAR), ',', 2) AS DATE) |
+-------------------------------------------------------------------------+
| 2023-01-02                                                              |
+-------------------------------------------------------------------------+
SELECT split_part(CAST('apple,banana,cherry' AS CHAR), ',', 2);
+---------------------------------------------------------+
| split_part(CAST('apple,banana,cherry' AS CHAR), ',', 2) |
+---------------------------------------------------------+
| banana                                                  |
+---------------------------------------------------------+
SELECT split_part(CAST(123.456 AS CHAR), '.', 2);
+-------------------------------------------+
| split_part(CAST(123.456 AS CHAR), '.', 2) |
+-------------------------------------------+
| 456                                       |
+-------------------------------------------+
SELECT JSON_OBJECT('name', 'John Doe', 'age', 30, 'city', 'New York');
+----------------------------------------------------------------+
| JSON_OBJECT('name', 'John Doe', 'age', 30, 'city', 'New York') |
+----------------------------------------------------------------+
| {"age": 30, "city": "New York", "name": "John Doe"}            |
+----------------------------------------------------------------+
SELECT split_part(
    JSON_OBJECT('name', 'John Doe', 'age', 30, 'city', 'New York'),
    ',', 1
) AS first_part;
ERROR 42000: wrong number or types of arguments in call to 'SPLIT_PART'
SELECT split_part(
    JSON_ARRAY('Apple', 'Banana', 'Cherry'),
    ',', 2
) AS second_fruit;
ERROR 42000: wrong number or types of arguments in call to 'SPLIT_PART'
SELECT split_part(
    JSON_MERGE(
        JSON_OBJECT('key1', 'value1'),
        JSON_OBJECT('key2', 'value2')
    ),
    ',', 1
) AS first_key_value;
ERROR 42000: wrong number or types of arguments in call to 'SPLIT_PART'
SELECT split_part(
    JSON_UNQUOTE(JSON_EXTRACT('{"a":"apple","b":"banana","c":"cherry"}', '$.b')),
    ' ', 1
) AS extracted_value;
+-----------------+
| extracted_value |
+-----------------+
| banana          |
+-----------------+
SELECT split_part(
    JSON_UNQUOTE('["a, b, c", "d, e, f"]'),
    ',', 2
) AS second_value;
+--------------+
| second_value |
+--------------+
|  b           |
+--------------+
SELECT split_part(
    JSON_SET('{"name":"Alice"}', '$.age', 25), 
    ',', 1
) AS updated_value;
ERROR 42000: wrong number or types of arguments in call to 'SPLIT_PART'
SELECT split_part(
    JSON_REPLACE('{"name":"Alice", "age":25}', '$.age', 30),
    ',', 1
) AS replaced_value;
ERROR 42000: wrong number or types of arguments in call to 'SPLIT_PART'
SELECT split_part(
    JSON_INSERT('{"name":"Alice"}', '$.city', 'New York'),
    ',', 1
) AS inserted_value;
ERROR 42000: wrong number or types of arguments in call to 'SPLIT_PART'
SELECT 
    CASE 
        WHEN split_part('a,b,c,d', ',', 1) = 'a' THEN 'Start with A'
        ELSE 'Does not start with A'
    END as result;
+--------------+
| result       |
+--------------+
| Start with A |
+--------------+
SELECT IF(split_part('apple,banana,cherry', ',', 2) = 'banana', 'It is Banana', 'Not Banana') as check_fruit;
+--------------+
| check_fruit  |
+--------------+
| It is Banana |
+--------------+
SELECT IFNULL(split_part(NULL, ',', 1), 'No value found') as result;
+----------------+
| result         |
+----------------+
| No value found |
+----------------+
SELECT NULLIF(split_part('1,2,3', ',', 2), '2') as result;
+--------+
| result |
+--------+
| NULL   |
+--------+
SELECT ORA_DECODE(split_part('cat,dog,bird', ',', 3), 'bird', 'Found a bird', 'No match') as animal_check;
+--------------+
| animal_check |
+--------------+
| Found a bird |
+--------------+
SELECT CASE WHEN IFNULL(NULLIF(split_part('x,y,z', ',', 2), 'y'), 'default') = 'default' THEN CONCAT('Value was not found, returning: ', split_part('default', 'd', 1)) ELSE CONCAT('Found value: ', IF(split_part('x,y,z', ',', 2) = 'y', 'It is y!', 'Not y')) END as final_result;
+----------------------------------+
| final_result                     |
+----------------------------------+
| Value was not found, returning:  |
+----------------------------------+
select 
    GREATEST(split_part('a,b,c,d', ',', 1), split_part('a,b,c,d', ',', 2)) as result;
+--------+
| result |
+--------+
| b      |
+--------+
###  OB GREATEST判断NULL和'd'，结果为NULL；OB结果与MYSQL保持一致。
select 
    GREATEST(IFNULL(NULL, NULL), 'd') as result;
+--------+
| result |
+--------+
| NULL   |
+--------+
select 
    GREATEST(NULL, 'd') as result;
+--------+
| result |
+--------+
| NULL   |
+--------+
select split_part('a,b,c,d', ',', NULL);
+----------------------------------+
| split_part('a,b,c,d', ',', NULL) |
+----------------------------------+
| NULL                             |
+----------------------------------+
select 
    GREATEST(split_part('a,b,c,d', ',', NULL), 'd') as result;
+--------+
| result |
+--------+
| NULL   |
+--------+
select 
    GREATEST(split_part('a,b,c,d', ',', 1), split_part('a,b,c,d', ',', 10)) as result;
+--------+
| result |
+--------+
| a      |
+--------+
select 
    LEAST(split_part('z,y,x,w', ',', 1), split_part('z,y,x,w', ',', 2)) as result;
+--------+
| result |
+--------+
| y      |
+--------+
select 
    LEAST(split_part('z,y,x,w', ',', NULL), 'y') as result;
+--------+
| result |
+--------+
| NULL   |
+--------+
select 
    LEAST(split_part('a,b,c,d', ',', -2), split_part('a,b,c,d', ',', -4)) as result;
+--------+
| result |
+--------+
| a      |
+--------+
select 
    ISNULL(split_part('a,b,c,d', ',', NULL)) as result;
+--------+
| result |
+--------+
|      1 |
+--------+
select 
    ISNULL(split_part(NULL, ',', 1)) as result;
+--------+
| result |
+--------+
|      1 |
+--------+
### OB结果为1，ODPS结果为false，因为OB GREATEST判断NULL和'd'，结果为NULL；OB结果与MYSQL保持一致。
select 
    ISNULL(GREATEST(split_part('a,b,c,d', ',', 1), NULL)) as result;
+--------+
| result |
+--------+
|      1 |
+--------+
select 
    GREATEST(split_part(split_part('a,b,c,d', ',', 1), 'a', 1), split_part('a,b,c,d', ',', 2)) as result;
+--------+
| result |
+--------+
| b      |
+--------+
select 
    LEAST(split_part(split_part('z,y,x,w', ',', 1), 'y', 1), split_part('z,y,x,w', ',', 3)) as result;
+--------+
| result |
+--------+
| x      |
+--------+
SELECT 
    split_part(
        split_part('a,b,c,d', ',', 1), 
        'a', 
        1
    ) AS result;
+--------+
| result |
+--------+
|        |
+--------+
SELECT 
    split_part(
        '1,2,3,4,5', 
        ',', 
        split_part('1,2,3,4,5', ',', 2)
    ) AS result;
+--------+
| result |
+--------+
| 2      |
+--------+
SELECT 
    split_part(
        split_part('a,b,c,d', ',', -2), 
        ',', 
        1
    ) AS result;
+--------+
| result |
+--------+
| c      |
+--------+
SELECT 
    split_part(
        split_part(
            'apple,banana,cherry', 
            ',', 
            split_part('0,1,2', ',', 1)
        ), 
        'a', 
        1
    ) AS result;
+--------+
| result |
+--------+
|        |
+--------+
SELECT 
    split_part(
        'hello|world|example', 
        '|', 
        split_part('1|2|3', '|', 3)
    ) AS result;
+---------+
| result  |
+---------+
| example |
+---------+
SELECT 
    split_part(
        split_part('cat,dog,fish', ',', 1, 2), 
        ',', 
        -1
    ) AS result;
+--------+
| result |
+--------+
| dog    |
+--------+
SELECT 
    split_part(
        'Monday,Tuesday,Wednesday', 
        ',', 
        split_part('1,2,3', ',', -1)
    ) AS result;
+-----------+
| result    |
+-----------+
| Wednesday |
+-----------+
SELECT 
    split_part(
        split_part('', ',', 1), 
        ',', 
        1
    ) AS result;
+--------+
| result |
+--------+
|        |
+--------+
SELECT 
    split_part(
        split_part(NULL, ',', 1), 
        ',', 
        NULL
    ) AS result;
+--------+
| result |
+--------+
| NULL   |
+--------+
SELECT 
    split_part(
        split_part('x,y,z', '|', 1), 
        '|', 
        1
    ) AS result;
+--------+
| result |
+--------+
| x,y,z  |
+--------+
SELECT split_part(keyvalue('a:b;c:d', ';'), ':', 1);
+----------------------------------------------+
| split_part(keyvalue('a:b;c:d', ';'), ':', 1) |
+----------------------------------------------+
| NULL                                         |
+----------------------------------------------+
SELECT split_part(keyvalue('a:b;c:d', ';', ':', 'e'), ':', 1);
+--------------------------------------------------------+
| split_part(keyvalue('a:b;c:d', ';', ':', 'e'), ':', 1) |
+--------------------------------------------------------+
| NULL                                                   |
+--------------------------------------------------------+
SELECT split_part(keyvalue('a:b;c:d', ';', ':', 'a'), ':', 2);
+--------------------------------------------------------+
| split_part(keyvalue('a:b;c:d', ';', ':', 'a'), ':', 2) |
+--------------------------------------------------------+
|                                                        |
+--------------------------------------------------------+
SELECT split_part(keyvalue('a:b;c:d', ';', ':', 'c'), ':', 2);
+--------------------------------------------------------+
| split_part(keyvalue('a:b;c:d', ';', ':', 'c'), ':', 2) |
+--------------------------------------------------------+
|                                                        |
+--------------------------------------------------------+
SELECT split_part(keyvalue('x:y;z:w', ';', ':', 'x'), ':', 2);
+--------------------------------------------------------+
| split_part(keyvalue('x:y;z:w', ';', ':', 'x'), ':', 2) |
+--------------------------------------------------------+
|                                                        |
+--------------------------------------------------------+
SELECT split_part(keyvalue('x:y;z:w', ';', ':', 'notfound'), ':', 2);
+---------------------------------------------------------------+
| split_part(keyvalue('x:y;z:w', ';', ':', 'notfound'), ':', 2) |
+---------------------------------------------------------------+
| NULL                                                          |
+---------------------------------------------------------------+
SELECT split_part(keyvalue('a:b;c:d', ';'), ':', 1);
+----------------------------------------------+
| split_part(keyvalue('a:b;c:d', ';'), ':', 1) |
+----------------------------------------------+
| NULL                                         |
+----------------------------------------------+
SELECT keyvalue(split_part('user1:info1;user2:info2', ';', 1), ':', 'user1');
ERROR 42000: Incorrect parameter count
SELECT keyvalue('user1:value1;user2:value2;user3:value3', ';', ':', split_part('user1:value1;user2:value2', ';', 2));
+---------------------------------------------------------------------------------------------------------------+
| keyvalue('user1:value1;user2:value2;user3:value3', ';', ':', split_part('user1:value1;user2:value2', ';', 2)) |
+---------------------------------------------------------------------------------------------------------------+
| NULL                                                                                                          |
+---------------------------------------------------------------------------------------------------------------+
SELECT keyvalue(split_part('key1:value1;key2:value2;key3:value3', ';', 2), ':', 'key2');
ERROR 42000: Incorrect parameter count
SELECT keyvalue(split_part(NULL, ';', 1), ':', 'k1');
ERROR 42000: Incorrect parameter count
SELECT keyvalue('k1:v1;k2:v2;', ';', ':', 'k1');
+------------------------------------------+
| keyvalue('k1:v1;k2:v2;', ';', ':', 'k1') |
+------------------------------------------+
| v1                                       |
+------------------------------------------+
### 参数使用表列时，覆盖各种数据类型
drop table if exists funcs_test;
### create table funcs_test(
###     dict_str varchar(512) CHARACTER SET utf8mb4,
###     dict_text longtext CHARACTER SET gbk,
###     delimiter_str varchar(512) CHARACTER SET utf16
### );
### create table funcs_test(
###     dict_str varchar(512) ,
###     dict_text longtext ,
###     delimiter_str varchar(512)
### );
create table funcs_test(
    dict_str varchar(512) ,
    dict_text varchar(512) ,
    delimiter_str varchar(512)
);
insert into funcs_test values ('组别:sql;姓名:xx;年龄:20;', '组别:sql;姓名:xx;年龄:20;', ';');
select split_part(dict_str, ';', 1) from funcs_test;
+------------------------------+
| split_part(dict_str, ';', 1) |
+------------------------------+
| 组别:sql                     |
+------------------------------+
select split_part(dict_str, ';', -1) from funcs_test;
+-------------------------------+
| split_part(dict_str, ';', -1) |
+-------------------------------+
|                               |
+-------------------------------+
select split_part(dict_str, ';', 4) from funcs_test;
+------------------------------+
| split_part(dict_str, ';', 4) |
+------------------------------+
|                              |
+------------------------------+
select split_part(dict_text, '', 1) from funcs_test;
+---------------------------------+
| split_part(dict_text, '', 1)    |
+---------------------------------+
| 组别:sql;姓名:xx;年龄:20;       |
+---------------------------------+
### #### OB结果与ODPS不一致。
select split_part(dict_text, '', 3) from funcs_test;
+------------------------------+
| split_part(dict_text, '', 3) |
+------------------------------+
|                              |
+------------------------------+
select split_part(dict_text, '', -1) from funcs_test;
+---------------------------------+
| split_part(dict_text, '', -1)   |
+---------------------------------+
| 组别:sql;姓名:xx;年龄:20;       |
+---------------------------------+
select split_part(dict_text, '', 0) from funcs_test;
+---------------------------------+
| split_part(dict_text, '', 0)    |
+---------------------------------+
| 组别:sql;姓名:xx;年龄:20;       |
+---------------------------------+
select split_part(dict_text, NULL, 0) from funcs_test;
+--------------------------------+
| split_part(dict_text, NULL, 0) |
+--------------------------------+
| NULL                           |
+--------------------------------+
drop table if exists test_table;
CREATE TABLE test_table (
    varchar_col VARCHAR(255),
    tinytext_col TINYTEXT,
    text_col TEXT,
    longtext_col LONGTEXT,
    int_col INT
);
INSERT INTO test_table (varchar_col, tinytext_col, text_col, longtext_col, int_col) 
VALUES ('a,b,c,d', 'a,b,c,d', 'a,b,c,d', 'a,b,c,d', 3);
SELECT split_part(varchar_col, ',', int_col) FROM test_table;
+---------------------------------------+
| split_part(varchar_col, ',', int_col) |
+---------------------------------------+
| c                                     |
+---------------------------------------+
SELECT split_part(tinytext_col, ',', int_col) FROM test_table;
+----------------------------------------+
| split_part(tinytext_col, ',', int_col) |
+----------------------------------------+
| c                                      |
+----------------------------------------+
SELECT split_part(text_col, ',', int_col) FROM test_table;
+------------------------------------+
| split_part(text_col, ',', int_col) |
+------------------------------------+
| c                                  |
+------------------------------------+
SELECT split_part(longtext_col, ',', int_col) FROM test_table;
+----------------------------------------+
| split_part(longtext_col, ',', int_col) |
+----------------------------------------+
| c                                      |
+----------------------------------------+
SELECT split_part(NULL, ',', int_col) FROM test_table;
+--------------------------------+
| split_part(NULL, ',', int_col) |
+--------------------------------+
| NULL                           |
+--------------------------------+
SELECT split_part(varchar_col, NULL, int_col) FROM test_table;
+----------------------------------------+
| split_part(varchar_col, NULL, int_col) |
+----------------------------------------+
| NULL                                   |
+----------------------------------------+
SELECT split_part(varchar_col, ',', NULL) FROM test_table;
+------------------------------------+
| split_part(varchar_col, ',', NULL) |
+------------------------------------+
| NULL                               |
+------------------------------------+
SELECT split_part(varchar_col, ',', 1, NULL) FROM test_table;
+---------------------------------------+
| split_part(varchar_col, ',', 1, NULL) |
+---------------------------------------+
| NULL                                  |
+---------------------------------------+
UPDATE test_table SET varchar_col = '' WHERE int_col = 3;
SELECT split_part(varchar_col, ',', int_col) FROM test_table;
+---------------------------------------+
| split_part(varchar_col, ',', int_col) |
+---------------------------------------+
|                                       |
+---------------------------------------+
SELECT split_part(varchar_col, '', int_col) FROM test_table;
+--------------------------------------+
| split_part(varchar_col, '', int_col) |
+--------------------------------------+
|                                      |
+--------------------------------------+
SELECT split_part(varchar_col, ',', 0) FROM test_table;
+---------------------------------+
| split_part(varchar_col, ',', 0) |
+---------------------------------+
|                                 |
+---------------------------------+
SELECT split_part(varchar_col, ',', -int_col) FROM test_table;
+----------------------------------------+
| split_part(varchar_col, ',', -int_col) |
+----------------------------------------+
|                                        |
+----------------------------------------+
SELECT split_part(varchar_col, ',', -int_col, -int_col + 1) FROM test_table;
+------------------------------------------------------+
| split_part(varchar_col, ',', -int_col, -int_col + 1) |
+------------------------------------------------------+
|                                                      |
+------------------------------------------------------+
SELECT split_part(varchar_col, 'x', 1) FROM test_table;
+---------------------------------+
| split_part(varchar_col, 'x', 1) |
+---------------------------------+
|                                 |
+---------------------------------+
### 数据类型全量覆盖
drop table if exists test_split_part;
CREATE TABLE test_split_part (
    id INT AUTO_INCREMENT PRIMARY KEY,
    char_col CHAR(10),
    varchar_col VARCHAR(50),
    tinyblob_col TINYBLOB,
    tinytext_col TINYTEXT,
    blob_col BLOB,
    text_col TEXT,
    mediumblob_col MEDIUMBLOB,
    mediumtext_col MEDIUMTEXT,
    longblob_col LONGBLOB,
    longtext_col LONGTEXT
);
INSERT INTO test_split_part (char_col, varchar_col, tinyblob_col, tinytext_col, blob_col, text_col, mediumblob_col, mediumtext_col, longblob_col, longtext_col) VALUES
('a,b,c,d', 'a,b,c,d', 'a,b,c,d', 'a,b,c,d', 'a,b,c,d', 'a,b,c,d', 'a,b,c,d', 'a,b,c,d', 'a,b,c,d', 'a,b,c,d');
SELECT split_part(char_col, ',', 1) FROM test_split_part;
+------------------------------+
| split_part(char_col, ',', 1) |
+------------------------------+
| a                            |
+------------------------------+
SELECT split_part(char_col, ',', 0) FROM test_split_part;
+------------------------------+
| split_part(char_col, ',', 0) |
+------------------------------+
| a                            |
+------------------------------+
SELECT split_part(char_col, ',', -1) FROM test_split_part;
+-------------------------------+
| split_part(char_col, ',', -1) |
+-------------------------------+
| d                             |
+-------------------------------+
SELECT split_part(char_col, ',', 10) FROM test_split_part;
+-------------------------------+
| split_part(char_col, ',', 10) |
+-------------------------------+
|                               |
+-------------------------------+
SELECT split_part(char_col, ',', 1, 2) FROM test_split_part;
+---------------------------------+
| split_part(char_col, ',', 1, 2) |
+---------------------------------+
| a,b                             |
+---------------------------------+
SELECT split_part(char_col, ',', 1, 3) FROM test_split_part;
+---------------------------------+
| split_part(char_col, ',', 1, 3) |
+---------------------------------+
| a,b,c                           |
+---------------------------------+
SELECT split_part(char_col, ',', -4, -2) FROM test_split_part;
+-----------------------------------+
| split_part(char_col, ',', -4, -2) |
+-----------------------------------+
| a,b,c                             |
+-----------------------------------+
SELECT split_part(char_col, ',', 1, 10) FROM test_split_part;
+----------------------------------+
| split_part(char_col, ',', 1, 10) |
+----------------------------------+
| a,b,c,d                          |
+----------------------------------+
SELECT split_part(varchar_col, ',', 1) FROM test_split_part;
+---------------------------------+
| split_part(varchar_col, ',', 1) |
+---------------------------------+
| a                               |
+---------------------------------+
SELECT split_part(varchar_col, ',', 0) FROM test_split_part;
+---------------------------------+
| split_part(varchar_col, ',', 0) |
+---------------------------------+
| a                               |
+---------------------------------+
SELECT split_part(varchar_col, ',', -1) FROM test_split_part;
+----------------------------------+
| split_part(varchar_col, ',', -1) |
+----------------------------------+
| d                                |
+----------------------------------+
SELECT split_part(varchar_col, ',', 10) FROM test_split_part;
+----------------------------------+
| split_part(varchar_col, ',', 10) |
+----------------------------------+
|                                  |
+----------------------------------+
SELECT split_part(varchar_col, ',', 1, 2) FROM test_split_part;
+------------------------------------+
| split_part(varchar_col, ',', 1, 2) |
+------------------------------------+
| a,b                                |
+------------------------------------+
SELECT split_part(varchar_col, ',', 1, 3) FROM test_split_part;
+------------------------------------+
| split_part(varchar_col, ',', 1, 3) |
+------------------------------------+
| a,b,c                              |
+------------------------------------+
SELECT split_part(varchar_col, ',', -4, -2) FROM test_split_part;
+--------------------------------------+
| split_part(varchar_col, ',', -4, -2) |
+--------------------------------------+
| a,b,c                                |
+--------------------------------------+
SELECT split_part(varchar_col, ',', 1, 10) FROM test_split_part;
+-------------------------------------+
| split_part(varchar_col, ',', 1, 10) |
+-------------------------------------+
| a,b,c,d                             |
+-------------------------------------+
SELECT split_part(tinyblob_col, ',', 1) FROM test_split_part;
+----------------------------------+
| split_part(tinyblob_col, ',', 1) |
+----------------------------------+
| a                                |
+----------------------------------+
SELECT split_part(tinyblob_col, ',', 0) FROM test_split_part;
+----------------------------------+
| split_part(tinyblob_col, ',', 0) |
+----------------------------------+
| a                                |
+----------------------------------+
SELECT split_part(tinyblob_col, ',', -1) FROM test_split_part;
+-----------------------------------+
| split_part(tinyblob_col, ',', -1) |
+-----------------------------------+
| d                                 |
+-----------------------------------+
SELECT split_part(tinyblob_col, ',', 10) FROM test_split_part;
+-----------------------------------+
| split_part(tinyblob_col, ',', 10) |
+-----------------------------------+
|                                   |
+-----------------------------------+
SELECT split_part(tinyblob_col, ',', 1, 2) FROM test_split_part;
+-------------------------------------+
| split_part(tinyblob_col, ',', 1, 2) |
+-------------------------------------+
| a,b                                 |
+-------------------------------------+
SELECT split_part(tinyblob_col, ',', 1, 3) FROM test_split_part;
+-------------------------------------+
| split_part(tinyblob_col, ',', 1, 3) |
+-------------------------------------+
| a,b,c                               |
+-------------------------------------+
SELECT split_part(tinyblob_col, ',', -4, -2) FROM test_split_part;
+---------------------------------------+
| split_part(tinyblob_col, ',', -4, -2) |
+---------------------------------------+
| a,b,c                                 |
+---------------------------------------+
SELECT split_part(tinyblob_col, ',', 1, 10) FROM test_split_part;
+--------------------------------------+
| split_part(tinyblob_col, ',', 1, 10) |
+--------------------------------------+
| a,b,c,d                              |
+--------------------------------------+
SELECT split_part(tinytext_col, ',', 1) FROM test_split_part;
+----------------------------------+
| split_part(tinytext_col, ',', 1) |
+----------------------------------+
| a                                |
+----------------------------------+
SELECT split_part(tinytext_col, ',', 0) FROM test_split_part;
+----------------------------------+
| split_part(tinytext_col, ',', 0) |
+----------------------------------+
| a                                |
+----------------------------------+
SELECT split_part(tinytext_col, ',', -1) FROM test_split_part;
+-----------------------------------+
| split_part(tinytext_col, ',', -1) |
+-----------------------------------+
| d                                 |
+-----------------------------------+
SELECT split_part(tinytext_col, ',', 10) FROM test_split_part;
+-----------------------------------+
| split_part(tinytext_col, ',', 10) |
+-----------------------------------+
|                                   |
+-----------------------------------+
SELECT split_part(tinytext_col, ',', 1, 2) FROM test_split_part;
+-------------------------------------+
| split_part(tinytext_col, ',', 1, 2) |
+-------------------------------------+
| a,b                                 |
+-------------------------------------+
SELECT split_part(tinytext_col, ',', 1, 3) FROM test_split_part;
+-------------------------------------+
| split_part(tinytext_col, ',', 1, 3) |
+-------------------------------------+
| a,b,c                               |
+-------------------------------------+
SELECT split_part(tinytext_col, ',', -4, -2) FROM test_split_part;
+---------------------------------------+
| split_part(tinytext_col, ',', -4, -2) |
+---------------------------------------+
| a,b,c                                 |
+---------------------------------------+
SELECT split_part(tinytext_col, ',', 1, 10) FROM test_split_part;
+--------------------------------------+
| split_part(tinytext_col, ',', 1, 10) |
+--------------------------------------+
| a,b,c,d                              |
+--------------------------------------+
SELECT split_part(blob_col, ',', 1) FROM test_split_part;
+------------------------------+
| split_part(blob_col, ',', 1) |
+------------------------------+
| a                            |
+------------------------------+
SELECT split_part(blob_col, ',', 0) FROM test_split_part;
+------------------------------+
| split_part(blob_col, ',', 0) |
+------------------------------+
| a                            |
+------------------------------+
SELECT split_part(blob_col, ',', -1) FROM test_split_part;
+-------------------------------+
| split_part(blob_col, ',', -1) |
+-------------------------------+
| d                             |
+-------------------------------+
SELECT split_part(blob_col, ',', 10) FROM test_split_part;
+-------------------------------+
| split_part(blob_col, ',', 10) |
+-------------------------------+
|                               |
+-------------------------------+
SELECT split_part(blob_col, ',', 1, 2) FROM test_split_part;
+---------------------------------+
| split_part(blob_col, ',', 1, 2) |
+---------------------------------+
| a,b                             |
+---------------------------------+
SELECT split_part(blob_col, ',', 1, 3) FROM test_split_part;
+---------------------------------+
| split_part(blob_col, ',', 1, 3) |
+---------------------------------+
| a,b,c                           |
+---------------------------------+
SELECT split_part(blob_col, ',', -4, -2) FROM test_split_part;
+-----------------------------------+
| split_part(blob_col, ',', -4, -2) |
+-----------------------------------+
| a,b,c                             |
+-----------------------------------+
SELECT split_part(blob_col, ',', 1, 10) FROM test_split_part;
+----------------------------------+
| split_part(blob_col, ',', 1, 10) |
+----------------------------------+
| a,b,c,d                          |
+----------------------------------+
SELECT split_part(text_col, ',', 1) FROM test_split_part;
+------------------------------+
| split_part(text_col, ',', 1) |
+------------------------------+
| a                            |
+------------------------------+
SELECT split_part(text_col, ',', 0) FROM test_split_part;
+------------------------------+
| split_part(text_col, ',', 0) |
+------------------------------+
| a                            |
+------------------------------+
SELECT split_part(text_col, ',', -1) FROM test_split_part;
+-------------------------------+
| split_part(text_col, ',', -1) |
+-------------------------------+
| d                             |
+-------------------------------+
SELECT split_part(text_col, ',', 10) FROM test_split_part;
+-------------------------------+
| split_part(text_col, ',', 10) |
+-------------------------------+
|                               |
+-------------------------------+
SELECT split_part(text_col, ',', 1, 2) FROM test_split_part;
+---------------------------------+
| split_part(text_col, ',', 1, 2) |
+---------------------------------+
| a,b                             |
+---------------------------------+
SELECT split_part(text_col, ',', 1, 3) FROM test_split_part;
+---------------------------------+
| split_part(text_col, ',', 1, 3) |
+---------------------------------+
| a,b,c                           |
+---------------------------------+
SELECT split_part(text_col, ',', -4, -2) FROM test_split_part;
+-----------------------------------+
| split_part(text_col, ',', -4, -2) |
+-----------------------------------+
| a,b,c                             |
+-----------------------------------+
SELECT split_part(text_col, ',', 1, 10) FROM test_split_part;
+----------------------------------+
| split_part(text_col, ',', 1, 10) |
+----------------------------------+
| a,b,c,d                          |
+----------------------------------+
SELECT split_part(mediumblob_col, ',', 1) FROM test_split_part;
+------------------------------------+
| split_part(mediumblob_col, ',', 1) |
+------------------------------------+
| a                                  |
+------------------------------------+
SELECT split_part(mediumblob_col, ',', 0) FROM test_split_part;
+------------------------------------+
| split_part(mediumblob_col, ',', 0) |
+------------------------------------+
| a                                  |
+------------------------------------+
SELECT split_part(mediumblob_col, ',', -1) FROM test_split_part;
+-------------------------------------+
| split_part(mediumblob_col, ',', -1) |
+-------------------------------------+
| d                                   |
+-------------------------------------+
SELECT split_part(mediumblob_col, ',', 10) FROM test_split_part;
+-------------------------------------+
| split_part(mediumblob_col, ',', 10) |
+-------------------------------------+
|                                     |
+-------------------------------------+
SELECT split_part(mediumblob_col, ',', 1, 2) FROM test_split_part;
+---------------------------------------+
| split_part(mediumblob_col, ',', 1, 2) |
+---------------------------------------+
| a,b                                   |
+---------------------------------------+
SELECT split_part(mediumblob_col, ',', 1, 3) FROM test_split_part;
+---------------------------------------+
| split_part(mediumblob_col, ',', 1, 3) |
+---------------------------------------+
| a,b,c                                 |
+---------------------------------------+
SELECT split_part(mediumblob_col, ',', -4, -2) FROM test_split_part;
+-----------------------------------------+
| split_part(mediumblob_col, ',', -4, -2) |
+-----------------------------------------+
| a,b,c                                   |
+-----------------------------------------+
SELECT split_part(mediumblob_col, ',', 1, 10) FROM test_split_part;
+----------------------------------------+
| split_part(mediumblob_col, ',', 1, 10) |
+----------------------------------------+
| a,b,c,d                                |
+----------------------------------------+
SELECT split_part(mediumtext_col, ',', 1) FROM test_split_part;
+------------------------------------+
| split_part(mediumtext_col, ',', 1) |
+------------------------------------+
| a                                  |
+------------------------------------+
SELECT split_part(mediumtext_col, ',', 0) FROM test_split_part;
+------------------------------------+
| split_part(mediumtext_col, ',', 0) |
+------------------------------------+
| a                                  |
+------------------------------------+
SELECT split_part(mediumtext_col, ',', -1) FROM test_split_part;
+-------------------------------------+
| split_part(mediumtext_col, ',', -1) |
+-------------------------------------+
| d                                   |
+-------------------------------------+
SELECT split_part(mediumtext_col, ',', 10) FROM test_split_part;
+-------------------------------------+
| split_part(mediumtext_col, ',', 10) |
+-------------------------------------+
|                                     |
+-------------------------------------+
SELECT split_part(mediumtext_col, ',', 1, 2) FROM test_split_part;
+---------------------------------------+
| split_part(mediumtext_col, ',', 1, 2) |
+---------------------------------------+
| a,b                                   |
+---------------------------------------+
SELECT split_part(mediumtext_col, ',', 1, 3) FROM test_split_part;
+---------------------------------------+
| split_part(mediumtext_col, ',', 1, 3) |
+---------------------------------------+
| a,b,c                                 |
+---------------------------------------+
SELECT split_part(mediumtext_col, ',', -4, -2) FROM test_split_part;
+-----------------------------------------+
| split_part(mediumtext_col, ',', -4, -2) |
+-----------------------------------------+
| a,b,c                                   |
+-----------------------------------------+
SELECT split_part(mediumtext_col, ',', 1, 10) FROM test_split_part;
+----------------------------------------+
| split_part(mediumtext_col, ',', 1, 10) |
+----------------------------------------+
| a,b,c,d                                |
+----------------------------------------+
SELECT split_part(longblob_col, ',', 1) FROM test_split_part;
+----------------------------------+
| split_part(longblob_col, ',', 1) |
+----------------------------------+
| a                                |
+----------------------------------+
SELECT split_part(longblob_col, ',', 0) FROM test_split_part;
+----------------------------------+
| split_part(longblob_col, ',', 0) |
+----------------------------------+
| a                                |
+----------------------------------+
SELECT split_part(longblob_col, ',', -1) FROM test_split_part;
+-----------------------------------+
| split_part(longblob_col, ',', -1) |
+-----------------------------------+
| d                                 |
+-----------------------------------+
SELECT split_part(longblob_col, ',', 10) FROM test_split_part;
+-----------------------------------+
| split_part(longblob_col, ',', 10) |
+-----------------------------------+
|                                   |
+-----------------------------------+
SELECT split_part(longblob_col, ',', 1, 2) FROM test_split_part;
+-------------------------------------+
| split_part(longblob_col, ',', 1, 2) |
+-------------------------------------+
| a,b                                 |
+-------------------------------------+
SELECT split_part(longblob_col, ',', 1, 3) FROM test_split_part;
+-------------------------------------+
| split_part(longblob_col, ',', 1, 3) |
+-------------------------------------+
| a,b,c                               |
+-------------------------------------+
SELECT split_part(longblob_col, ',', -4, -2) FROM test_split_part;
+---------------------------------------+
| split_part(longblob_col, ',', -4, -2) |
+---------------------------------------+
| a,b,c                                 |
+---------------------------------------+
SELECT split_part(longblob_col, ',', 1, 10) FROM test_split_part;
+--------------------------------------+
| split_part(longblob_col, ',', 1, 10) |
+--------------------------------------+
| a,b,c,d                              |
+--------------------------------------+
SELECT split_part(longtext_col, ',', 1) FROM test_split_part;
+----------------------------------+
| split_part(longtext_col, ',', 1) |
+----------------------------------+
| a                                |
+----------------------------------+
SELECT split_part(longtext_col, ',', 0) FROM test_split_part;
+----------------------------------+
| split_part(longtext_col, ',', 0) |
+----------------------------------+
| a                                |
+----------------------------------+
SELECT split_part(longtext_col, ',', -1) FROM test_split_part;
+-----------------------------------+
| split_part(longtext_col, ',', -1) |
+-----------------------------------+
| d                                 |
+-----------------------------------+
SELECT split_part(longtext_col, ',', 10) FROM test_split_part;
+-----------------------------------+
| split_part(longtext_col, ',', 10) |
+-----------------------------------+
|                                   |
+-----------------------------------+
SELECT split_part(longtext_col, ',', 1, 2) FROM test_split_part;
+-------------------------------------+
| split_part(longtext_col, ',', 1, 2) |
+-------------------------------------+
| a,b                                 |
+-------------------------------------+
SELECT split_part(longtext_col, ',', 1, 3) FROM test_split_part;
+-------------------------------------+
| split_part(longtext_col, ',', 1, 3) |
+-------------------------------------+
| a,b,c                               |
+-------------------------------------+
SELECT split_part(longtext_col, ',', -4, -2) FROM test_split_part;
+---------------------------------------+
| split_part(longtext_col, ',', -4, -2) |
+---------------------------------------+
| a,b,c                                 |
+---------------------------------------+
SELECT split_part(longtext_col, ',', 1, 10) FROM test_split_part;
+--------------------------------------+
| split_part(longtext_col, ',', 1, 10) |
+--------------------------------------+
| a,b,c,d                              |
+--------------------------------------+
drop table if exists split_part_test;
CREATE TABLE split_part_test (
    id INT AUTO_INCREMENT PRIMARY KEY,
    big_int_col BIGINT,
    tiny_int_col TINYINT,
    small_int_col SMALLINT,
    medium_int_col MEDIUMINT,
    float_col FLOAT,
    double_col DOUBLE,
    decimal_col DECIMAL(10, 2),
    string_col VARCHAR(255)
);
INSERT INTO split_part_test (big_int_col, tiny_int_col, small_int_col, medium_int_col, float_col, double_col, decimal_col, string_col) VALUES
(12345678901234, 127, 32767, 8388607, 123.45, 123456.78, 12345.67, 'a,b,c,d'),
(98765432109876, -128, -32768, -8388607, 987.65, 987654.32, -12345.67, 'e,f,g,h'),
(NULL, NULL, NULL, NULL, NULL, NULL, NULL, NULL);
SELECT split_part(string_col, ',', 1) AS result1 FROM split_part_test;
+---------+
| result1 |
+---------+
| NULL    |
| a       |
| e       |
+---------+
SELECT split_part(string_col, ',', 0) AS result2 FROM split_part_test;
+---------+
| result2 |
+---------+
| NULL    |
| a       |
| e       |
+---------+
SELECT split_part(string_col, ',', -1) AS result3 FROM split_part_test;
+---------+
| result3 |
+---------+
| NULL    |
| d       |
| h       |
+---------+
SELECT split_part(string_col, ',', 10) AS result4 FROM split_part_test;
+---------+
| result4 |
+---------+
|         |
|         |
| NULL    |
+---------+
SELECT split_part(string_col, ',', 1, 2) AS result5 FROM split_part_test;
+---------+
| result5 |
+---------+
| NULL    |
| a,b     |
| e,f     |
+---------+
SELECT split_part(string_col, ',', 1, 3) AS result6 FROM split_part_test;
+---------+
| result6 |
+---------+
| NULL    |
| a,b,c   |
| e,f,g   |
+---------+
SELECT split_part(string_col, ',', -4, -2) AS result7 FROM split_part_test;
+---------+
| result7 |
+---------+
| NULL    |
| a,b,c   |
| e,f,g   |
+---------+
SELECT split_part(string_col, ',', 1, 10) AS result8 FROM split_part_test;
+---------+
| result8 |
+---------+
| NULL    |
| a,b,c,d |
| e,f,g,h |
+---------+
SELECT split_part(CAST(big_int_col AS CHAR), ',', 1) FROM split_part_test;
+-----------------------------------------------+
| split_part(CAST(big_int_col AS CHAR), ',', 1) |
+-----------------------------------------------+
| 12345678901234                                |
| 98765432109876                                |
| NULL                                          |
+-----------------------------------------------+
SELECT split_part(CAST(tiny_int_col AS CHAR), ',', 1) FROM split_part_test;
+------------------------------------------------+
| split_part(CAST(tiny_int_col AS CHAR), ',', 1) |
+------------------------------------------------+
| -128                                           |
| 127                                            |
| NULL                                           |
+------------------------------------------------+
SELECT split_part(CAST(small_int_col AS CHAR), ',', 1) FROM split_part_test;
+-------------------------------------------------+
| split_part(CAST(small_int_col AS CHAR), ',', 1) |
+-------------------------------------------------+
| -32768                                          |
| 32767                                           |
| NULL                                            |
+-------------------------------------------------+
SELECT split_part(CAST(medium_int_col AS CHAR), ',', 1) FROM split_part_test;
+--------------------------------------------------+
| split_part(CAST(medium_int_col AS CHAR), ',', 1) |
+--------------------------------------------------+
| -8388607                                         |
| 8388607                                          |
| NULL                                             |
+--------------------------------------------------+
SELECT split_part(CAST(float_col AS CHAR), ',', 1) FROM split_part_test;
+---------------------------------------------+
| split_part(CAST(float_col AS CHAR), ',', 1) |
+---------------------------------------------+
| 123.45                                      |
| 987.65                                      |
| NULL                                        |
+---------------------------------------------+
SELECT split_part(CAST(double_col AS CHAR), ',', 1) FROM split_part_test;
+----------------------------------------------+
| split_part(CAST(double_col AS CHAR), ',', 1) |
+----------------------------------------------+
| 123456.78                                    |
| 987654.32                                    |
| NULL                                         |
+----------------------------------------------+
SELECT split_part(CAST(decimal_col AS CHAR), ',', 1) FROM split_part_test;
+-----------------------------------------------+
| split_part(CAST(decimal_col AS CHAR), ',', 1) |
+-----------------------------------------------+
| -12345.67                                     |
| 12345.67                                      |
| NULL                                          |
+-----------------------------------------------+
drop table if exists test_split_part;
CREATE TABLE test_split_part (
    id INT AUTO_INCREMENT PRIMARY KEY,
    date_col DATE,
    time_col TIME,
    year_col YEAR,
    datetime_col TIMESTAMP,
    timestamp_col TIMESTAMP,
    text_col TEXT
);
INSERT INTO test_split_part (date_col, time_col, year_col, datetime_col, timestamp_col, text_col) VALUES
('2023-01-01', '12:34:56', 2023, '2023-01-01 12:34:56', '20230101', 'a,b,c,d'),
('2023-12-31', '23:59:59', 2023, '2023-12-31 23:59:59', '20231231', 'apple,banana,carrot,date');
SELECT split_part(date_col, '-', 1) AS Year FROM test_split_part;
+------+
| Year |
+------+
| 2023 |
| 2023 |
+------+
SELECT split_part(time_col, ':', 1) AS Hours FROM test_split_part;
+-------+
| Hours |
+-------+
| 12    |
| 23    |
+-------+
SELECT split_part(CONVERT(year_col USING utf8), '', 1) AS Year_Value FROM test_split_part;
+------------+
| Year_Value |
+------------+
| 2023       |
| 2023       |
+------------+
SELECT split_part(datetime_col, ' ', 1) AS Date_Part FROM test_split_part;
+------------+
| Date_Part  |
+------------+
| 2023-01-01 |
| 2023-12-31 |
+------------+
SELECT split_part(timestamp_col, ' ', 1) AS Timestamp_Part FROM test_split_part;
+----------------+
| Timestamp_Part |
+----------------+
| 2023-01-01     |
| 2023-12-31     |
+----------------+
SELECT split_part(text_col, ',', 1) AS First_Part FROM test_split_part;
+------------+
| First_Part |
+------------+
| a          |
| apple      |
+------------+
SELECT split_part(text_col, ',', -1) AS Last_Part FROM test_split_part;
+-----------+
| Last_Part |
+-----------+
| d         |
| date      |
+-----------+
SELECT split_part(text_col, ',', 1, 2) AS First_Two FROM test_split_part;
+--------------+
| First_Two    |
+--------------+
| a,b          |
| apple,banana |
+--------------+
SELECT split_part(text_col, ',', -4, -2) AS Negative_Example FROM test_split_part;
+---------------------+
| Negative_Example    |
+---------------------+
| a,b,c               |
| apple,banana,carrot |
+---------------------+
SELECT split_part(text_col, ',', 1, 10) AS Out_Of_Bounds FROM test_split_part;
+--------------------------+
| Out_Of_Bounds            |
+--------------------------+
| a,b,c,d                  |
| apple,banana,carrot,date |
+--------------------------+
SELECT split_part(text_col, 'x', 1) AS No_Split_Return_Original FROM test_split_part;
+--------------------------+
| No_Split_Return_Original |
+--------------------------+
| a,b,c,d                  |
| apple,banana,carrot,date |
+--------------------------+
drop table if exists test_split_part;
CREATE TABLE test_split_part (
    id INT AUTO_INCREMENT PRIMARY KEY,
    json_data JSON
);
INSERT INTO test_split_part (json_data) VALUES
('{"key": "a,b,c,d"}'),  
('{"key": "e,f,g"}'),   
(NULL);
SELECT split_part(json_unquote(json_data->'$.key'), ',', 1) AS result_1,
       split_part(json_unquote(json_data->'$.key'), ',', 2) AS result_2,
       split_part(json_unquote(json_data->'$.key'), ',', 3) AS result_3,
       split_part(json_unquote(json_data->'$.key'), ',', 4) AS result_4
FROM test_split_part
WHERE json_data IS NOT NULL;
+----------+----------+----------+----------+
| result_1 | result_2 | result_3 | result_4 |
+----------+----------+----------+----------+
| a        | b        | c        | d        |
| e        | f        | g        |          |
+----------+----------+----------+----------+
SELECT split_part(json_unquote(json_data->'$.key'), ',', -1) AS result,
       split_part(json_unquote(json_data->'$.key'), ',', -2) AS result_reverse
FROM test_split_part
WHERE json_data IS NOT NULL;
+--------+----------------+
| result | result_reverse |
+--------+----------------+
| d      | c              |
| g      | f              |
+--------+----------------+
SELECT split_part(json_unquote(json_data->'$.key'), ',', 10) AS out_of_bounds_1,
       split_part(json_unquote(json_data->'$.key'), ',', -10) AS out_of_bounds_reverse
FROM test_split_part
WHERE json_data IS NOT NULL;
+-----------------+-----------------------+
| out_of_bounds_1 | out_of_bounds_reverse |
+-----------------+-----------------------+
|                 |                       |
|                 |                       |
+-----------------+-----------------------+
SELECT split_part(json_unquote(json_data->'$.key'), ',', 1, 2) AS first_two,
       split_part(json_unquote(json_data->'$.key'), ',', 1, 3) AS first_three,
       split_part(json_unquote(json_data->'$.key'), ',', -4, -2) AS reverse_range,
       split_part(json_unquote(json_data->'$.key'), ',', 1, 10) AS out_of_bounds_four
FROM test_split_part
WHERE json_data IS NOT NULL;
+-----------+-------------+---------------+--------------------+
| first_two | first_three | reverse_range | out_of_bounds_four |
+-----------+-------------+---------------+--------------------+
| a,b       | a,b,c       | a,b,c         | a,b,c,d            |
| e,f       | e,f,g       |               | e,f,g              |
+-----------+-------------+---------------+--------------------+
SELECT split_part(NULL, ',', 1) AS null_case_1,
       split_part(json_unquote(json_data->'$.key'), NULL, 1) AS null_case_2
FROM test_split_part;
+-------------+-------------+
| null_case_1 | null_case_2 |
+-------------+-------------+
| NULL        | NULL        |
| NULL        | NULL        |
| NULL        | NULL        |
+-------------+-------------+
drop table if exists test_split_part;
CREATE TABLE test_split_part (
    id INT AUTO_INCREMENT PRIMARY KEY,
    varchar_col VARCHAR(255),
    tinytext_col TINYTEXT,
    text_col TEXT,
    longtext_col LONGTEXT,
    bigint_col BIGINT,
    double_col DOUBLE,
    decimal_col DECIMAL(10, 2),
    datetime_col DATETIME
);
INSERT INTO test_split_part (varchar_col, tinytext_col, text_col, longtext_col, bigint_col, double_col, decimal_col, datetime_col) VALUES
('a,b,c,d', 'tiny,a,b,c,d', 'text,a,b,c,d', 'longtext,a,b,c,d', 123456789, 12.34, 123.45, '2023-01-01 12:00:00');
SELECT split_part(varchar_col, ',', 1) FROM test_split_part;
+---------------------------------+
| split_part(varchar_col, ',', 1) |
+---------------------------------+
| a                               |
+---------------------------------+
SELECT split_part(varchar_col, ',', 0) FROM test_split_part;
+---------------------------------+
| split_part(varchar_col, ',', 0) |
+---------------------------------+
| a                               |
+---------------------------------+
SELECT split_part(varchar_col, ',', -1) FROM test_split_part;
+----------------------------------+
| split_part(varchar_col, ',', -1) |
+----------------------------------+
| d                                |
+----------------------------------+
SELECT split_part(varchar_col, ',', 10) FROM test_split_part;
+----------------------------------+
| split_part(varchar_col, ',', 10) |
+----------------------------------+
|                                  |
+----------------------------------+
SELECT split_part(varchar_col, '|', 1) FROM test_split_part;
+---------------------------------+
| split_part(varchar_col, '|', 1) |
+---------------------------------+
| a,b,c,d                         |
+---------------------------------+
SELECT split_part(varchar_col, '|', 0) FROM test_split_part;
+---------------------------------+
| split_part(varchar_col, '|', 0) |
+---------------------------------+
| a,b,c,d                         |
+---------------------------------+
SELECT split_part(tinytext_col, ',', 1) FROM test_split_part;
+----------------------------------+
| split_part(tinytext_col, ',', 1) |
+----------------------------------+
| tiny                             |
+----------------------------------+
SELECT split_part(tinytext_col, ',', 1, 2) FROM test_split_part;
+-------------------------------------+
| split_part(tinytext_col, ',', 1, 2) |
+-------------------------------------+
| tiny,a                              |
+-------------------------------------+
SELECT split_part(text_col, ',', 1) FROM test_split_part;
+------------------------------+
| split_part(text_col, ',', 1) |
+------------------------------+
| text                         |
+------------------------------+
SELECT split_part(text_col, ',', -1) FROM test_split_part;
+-------------------------------+
| split_part(text_col, ',', -1) |
+-------------------------------+
| d                             |
+-------------------------------+
SELECT split_part(longtext_col, ',', 1, 3) FROM test_split_part;
+-------------------------------------+
| split_part(longtext_col, ',', 1, 3) |
+-------------------------------------+
| longtext,a,b                        |
+-------------------------------------+
SELECT split_part(longtext_col, ',', -4, -2) FROM test_split_part;
+---------------------------------------+
| split_part(longtext_col, ',', -4, -2) |
+---------------------------------------+
| a,b,c                                 |
+---------------------------------------+
SELECT split_part(CAST(bigint_col AS CHAR), ',', 1) FROM test_split_part;
+----------------------------------------------+
| split_part(CAST(bigint_col AS CHAR), ',', 1) |
+----------------------------------------------+
| 123456789                                    |
+----------------------------------------------+
SELECT split_part(CAST(double_col AS CHAR), ',', 1) FROM test_split_part;
+----------------------------------------------+
| split_part(CAST(double_col AS CHAR), ',', 1) |
+----------------------------------------------+
| 12.34                                        |
+----------------------------------------------+
SELECT split_part(CAST(decimal_col AS CHAR), ',', 1) FROM test_split_part;
+-----------------------------------------------+
| split_part(CAST(decimal_col AS CHAR), ',', 1) |
+-----------------------------------------------+
| 123.45                                        |
+-----------------------------------------------+
SELECT split_part(CAST(datetime_col AS CHAR), ',', 1) FROM test_split_part;
+------------------------------------------------+
| split_part(CAST(datetime_col AS CHAR), ',', 1) |
+------------------------------------------------+
| 2023-01-01 12:00:00                            |
+------------------------------------------------+
drop table if exists split_part_test;
CREATE TABLE split_part_test (
id INT,
test_string TINYTEXT,
separator1 VARCHAR(10),
expected_output VARCHAR(255));
INSERT INTO split_part_test (test_string, separator1, expected_output) VALUES 
('a,b,c,d', ',', 'a'),
('a,b,c,d', ',', 'a'),
('a,b,c,d', ',', 'd'),
('a,b,c,d', ',', ''), 
('a,b,c,d', NULL, 'a,b,c,d'), 
(NULL, ',', NULL),  
('a,b,c,d', ',', 'a,b'),  
('a,b,c,d', ',', 'a,b,c'),  
('a,b,c,d', ',', 'a,b,c'), 
('a,b,c,d', ',', 'a,b,c,d'),
('a,b,c,d', ',', NULL), 
('test', ',', 'test'), 
('a', ',', 'a'), 
('a,,b,c,d', ',', 'b') 
;
SELECT test_string, separator1, 
       split_part(test_string, separator1, 1) AS result1, 
       split_part(test_string, separator1, 0) AS result0, 
       split_part(test_string, separator1, -1) AS resultNeg1, 
       split_part(test_string, separator1, 1, 2) AS result12, 
       split_part(test_string, separator1, 1, 3) AS result13, 
       split_part(test_string, separator1, -4, -2) AS resultNeg42, 
       split_part(test_string, separator1, 1, 10) AS result110 
FROM split_part_test;
+-------------+------------+---------+---------+------------+----------+----------+-------------+-----------+
| test_string | separator1 | result1 | result0 | resultNeg1 | result12 | result13 | resultNeg42 | result110 |
+-------------+------------+---------+---------+------------+----------+----------+-------------+-----------+
| NULL        | ,          | NULL    | NULL    | NULL       | NULL     | NULL     | NULL        | NULL      |
| a           | ,          | a       | a       | a          | a        | a        |             | a         |
| a,,b,c,d    | ,          | a       | a       | d          | a,       | a,,b     | ,b,c        | a,,b,c,d  |
| a,b,c,d     | ,          | a       | a       | d          | a,b      | a,b,c    | a,b,c       | a,b,c,d   |
| a,b,c,d     | ,          | a       | a       | d          | a,b      | a,b,c    | a,b,c       | a,b,c,d   |
| a,b,c,d     | ,          | a       | a       | d          | a,b      | a,b,c    | a,b,c       | a,b,c,d   |
| a,b,c,d     | ,          | a       | a       | d          | a,b      | a,b,c    | a,b,c       | a,b,c,d   |
| a,b,c,d     | ,          | a       | a       | d          | a,b      | a,b,c    | a,b,c       | a,b,c,d   |
| a,b,c,d     | ,          | a       | a       | d          | a,b      | a,b,c    | a,b,c       | a,b,c,d   |
| a,b,c,d     | ,          | a       | a       | d          | a,b      | a,b,c    | a,b,c       | a,b,c,d   |
| a,b,c,d     | ,          | a       | a       | d          | a,b      | a,b,c    | a,b,c       | a,b,c,d   |
| a,b,c,d     | ,          | a       | a       | d          | a,b      | a,b,c    | a,b,c       | a,b,c,d   |
| a,b,c,d     | NULL       | NULL    | NULL    | NULL       | NULL     | NULL     | NULL        | NULL      |
| test        | ,          | test    | test    | test       | test     | test     |             | test      |
+-------------+------------+---------+---------+------------+----------+----------+-------------+-----------+
drop table if exists test_split_part;
CREATE TABLE test_split_part (
    id INT AUTO_INCREMENT PRIMARY KEY,
    data_text TEXT,
    data_tinytext TINYTEXT,
    data_varchar VARCHAR(255)
);
INSERT INTO test_split_part (data_text, data_tinytext, data_varchar) VALUES
('a,b,c,d', 'tiny,a,b,c,d', 'varchar,a,b,c,d'),
(NULL, NULL, 'varchar,data'),
('singleString', NULL, 'varchar,with,no,comma'),
('string1,string2', 'tiny,string2', 'varchar,string3'),
('', '', 'emptyString');
SELECT split_part(data_text, ',', 1) AS result_1 FROM test_split_part;
+--------------+
| result_1     |
+--------------+
|              |
| NULL         |
| a            |
| singleString |
| string1      |
+--------------+
SELECT split_part(data_tinytext, ',', 1) AS result_2 FROM test_split_part;
+----------+
| result_2 |
+----------+
|          |
| NULL     |
| NULL     |
| tiny     |
| tiny     |
+----------+
SELECT split_part(data_varchar, ',', 1) AS result_3 FROM test_split_part;
+-------------+
| result_3    |
+-------------+
| emptyString |
| varchar     |
| varchar     |
| varchar     |
| varchar     |
+-------------+
SELECT split_part(data_text, ',', 0) AS result_4 FROM test_split_part;
+--------------+
| result_4     |
+--------------+
|              |
| NULL         |
| a            |
| singleString |
| string1      |
+--------------+
SELECT split_part(data_tinytext, ',', 0) AS result_5 FROM test_split_part;
+----------+
| result_5 |
+----------+
|          |
| NULL     |
| NULL     |
| tiny     |
| tiny     |
+----------+
SELECT split_part(data_varchar, ',', 0) AS result_6 FROM test_split_part;
+-------------+
| result_6    |
+-------------+
| emptyString |
| varchar     |
| varchar     |
| varchar     |
| varchar     |
+-------------+
SELECT split_part(data_text, ';', 1) AS result_7 FROM test_split_part;
+-----------------+
| result_7        |
+-----------------+
|                 |
| NULL            |
| a,b,c,d         |
| singleString    |
| string1,string2 |
+-----------------+
SELECT split_part(data_tinytext, ';', 1) AS result_8 FROM test_split_part;
+--------------+
| result_8     |
+--------------+
|              |
| NULL         |
| NULL         |
| tiny,a,b,c,d |
| tiny,string2 |
+--------------+
SELECT split_part(data_varchar, ';', 1) AS result_9 FROM test_split_part;
+-----------------------+
| result_9              |
+-----------------------+
| emptyString           |
| varchar,a,b,c,d       |
| varchar,data          |
| varchar,string3       |
| varchar,with,no,comma |
+-----------------------+
SELECT split_part(data_text, ',', -1) AS result_10 FROM test_split_part;
+--------------+
| result_10    |
+--------------+
|              |
| NULL         |
| d            |
| singleString |
| string2      |
+--------------+
SELECT split_part(data_tinytext, ',', -1) AS result_11 FROM test_split_part;
+-----------+
| result_11 |
+-----------+
|           |
| NULL      |
| NULL      |
| d         |
| string2   |
+-----------+
SELECT split_part(data_varchar, ',', -1) AS result_12 FROM test_split_part;
+-------------+
| result_12   |
+-------------+
| comma       |
| d           |
| data        |
| emptyString |
| string3     |
+-------------+
SELECT split_part(data_text, ',', 10) AS result_13 FROM test_split_part;
+-----------+
| result_13 |
+-----------+
|           |
|           |
|           |
|           |
| NULL      |
+-----------+
SELECT split_part(data_tinytext, ',', 10) AS result_14 FROM test_split_part;
+-----------+
| result_14 |
+-----------+
|           |
|           |
|           |
| NULL      |
| NULL      |
+-----------+
SELECT split_part(data_varchar, ',', 10) AS result_15 FROM test_split_part;
+-----------+
| result_15 |
+-----------+
|           |
|           |
|           |
|           |
|           |
+-----------+
SELECT split_part('', ',', 1) AS result_16;
+-----------+
| result_16 |
+-----------+
|           |
+-----------+
SELECT split_part(NULL, ',', 1) AS result_17;
+-----------+
| result_17 |
+-----------+
| NULL      |
+-----------+
SELECT split_part(data_text, ',', 0) AS result_18 FROM test_split_part;
+--------------+
| result_18    |
+--------------+
|              |
| NULL         |
| a            |
| singleString |
| string1      |
+--------------+
drop table if exists test_split;
CREATE TABLE test_split (
    id INT AUTO_INCREMENT PRIMARY KEY,
    tiny_text_col TINYTEXT,
    text_col TEXT,
    long_text_col LONGTEXT,
    varchar_col VARCHAR(255)
);
INSERT INTO test_split (tiny_text_col, text_col, long_text_col, varchar_col)
VALUES 
('a,b,c,d', 'x,y,z,w', '1,2,3,4,5', 'foo,bar,baz'),
('apple,banana,cherry', 'one,two,three', 'alpha,beta,gamma,delta', 'abc,def,ghi'),
(NULL, NULL, NULL, 'single_value');
### 测试基本分割
### 返回 'a'
SELECT split_part(tiny_text_col, ',', 1) FROM test_split WHERE id = 1;
+-----------------------------------+
| split_part(tiny_text_col, ',', 1) |
+-----------------------------------+
| a                                 |
+-----------------------------------+
### 'apple,banana'
SELECT split_part(tiny_text_col, ',', 1, 2) FROM test_split WHERE id = 2;
+--------------------------------------+
| split_part(tiny_text_col, ',', 1, 2) |
+--------------------------------------+
| apple,banana                         |
+--------------------------------------+
### NULL
SELECT split_part(long_text_col, ',', 1, 2) FROM test_split WHERE id = 3;
+--------------------------------------+
| split_part(long_text_col, ',', 1, 2) |
+--------------------------------------+
| NULL                                 |
+--------------------------------------+
### 'single_value'
SELECT split_part(varchar_col, ',', 1) FROM test_split WHERE id = 3;
+---------------------------------+
| split_part(varchar_col, ',', 1) |
+---------------------------------+
| single_value                    |
+---------------------------------+
### 'cherry'
SELECT split_part('apple,banana,cherry', ',', 3) FROM test_split WHERE id = 2;
+-------------------------------------------+
| split_part('apple,banana,cherry', ',', 3) |
+-------------------------------------------+
| cherry                                    |
+-------------------------------------------+
### 'b,c,d'
SELECT split_part(tiny_text_col, ',', -3, -1) FROM test_split WHERE id = 1;
+----------------------------------------+
| split_part(tiny_text_col, ',', -3, -1) |
+----------------------------------------+
| b,c,d                                  |
+----------------------------------------+
### 'apple,banana,cherry'
SELECT split_part('apple,banana,cherry', ',', 1, 10) FROM test_split WHERE id = 2;
+-----------------------------------------------+
| split_part('apple,banana,cherry', ',', 1, 10) |
+-----------------------------------------------+
| apple,banana,cherry                           |
+-----------------------------------------------+
### NULL
SELECT split_part(NULL, ',', 1) FROM test_split WHERE id = 1;
+--------------------------+
| split_part(NULL, ',', 1) |
+--------------------------+
| NULL                     |
+--------------------------+
### Arg2不存在于Arg1中
### 'apple,banana,cherry'
SELECT split_part('apple,banana,cherry', '|', 1) FROM test_split WHERE id = 2;
+-------------------------------------------+
| split_part('apple,banana,cherry', '|', 1) |
+-------------------------------------------+
| apple,banana,cherry                       |
+-------------------------------------------+
###  ''
SELECT split_part(tiny_text_col, ',', 10) FROM test_split WHERE id = 1;
+------------------------------------+
| split_part(tiny_text_col, ',', 10) |
+------------------------------------+
|                                    |
+------------------------------------+
### NULL
SELECT split_part(long_text_col, ',', -2) FROM test_split WHERE id = 3;
+------------------------------------+
| split_part(long_text_col, ',', -2) |
+------------------------------------+
| NULL                               |
+------------------------------------+
### arg4 超界
### 'banana,cherry'
SELECT split_part('apple,banana,cherry', ',', 2, 10) FROM test_split WHERE id = 2;
+-----------------------------------------------+
| split_part('apple,banana,cherry', ',', 2, 10) |
+-----------------------------------------------+
| banana,cherry                                 |
+-----------------------------------------------+
### 测试负数处理
### NULL
SELECT split_part(long_text_col, ',', -3, -2) FROM test_split WHERE id = 3;
+----------------------------------------+
| split_part(long_text_col, ',', -3, -2) |
+----------------------------------------+
| NULL                                   |
+----------------------------------------+
### 只有一个参数，返回原始字符串
### NULL
SELECT split_part(varchar_col, NULL, 1) FROM test_split WHERE id = 3;
+----------------------------------+
| split_part(varchar_col, NULL, 1) |
+----------------------------------+
| NULL                             |
+----------------------------------+
### SELECT+DML使用覆盖
drop table if exists test_table;
CREATE TABLE test_table (
    id INT PRIMARY KEY,
    string_col VARCHAR(255),
    delimiter_col VARCHAR(10),
    position_col INT,
    end_position_col INT
);
INSERT INTO test_table (id, string_col, delimiter_col, position_col) VALUES (1, 'a,b,c,d', ',', 1);
SELECT id, split_part(string_col, delimiter_col, position_col) AS result FROM test_table WHERE id = 1;
+----+--------+
| id | result |
+----+--------+
|  1 | a      |
+----+--------+
UPDATE test_table SET position_col = 2 WHERE id = 1;
SELECT id, split_part(string_col, delimiter_col, position_col) AS result FROM test_table WHERE id = 1;
+----+--------+
| id | result |
+----+--------+
|  1 | b      |
+----+--------+
DELETE FROM test_table WHERE id = 1;
SELECT * FROM test_table WHERE id = 1;
+----+------------+---------------+--------------+------------------+
| id | string_col | delimiter_col | position_col | end_position_col |
+----+------------+---------------+--------------+------------------+
+----+------------+---------------+--------------+------------------+
MERGE INTO test_table AS target
USING (SELECT 2 AS id, 'e,f,g,h' AS string_col, ',' AS delimiter_col, 1 AS position_col) AS source
ON (target.id = source.id)
WHEN MATCHED THEN
    UPDATE SET target.string_col = source.string_col, target.delimiter_col = source.delimiter_col, target.position_col = source.position_col
WHEN NOT MATCHED THEN
    INSERT (id, string_col, delimiter_col, position_col) VALUES (source.id, source.string_col, source.delimiter_col, source.position_col);
ERROR 42000: You have an error in your SQL syntax; check the manual that corresponds to your OceanBase version for the right syntax to use near 'MERGE INTO test_table AS target
USING (SELECT 2 AS id, 'e,f,g,h' AS string_col, ' at line 1
SELECT id, split_part(string_col, delimiter_col, position_col) AS result FROM test_table WHERE id = 2;
+----+--------+
| id | result |
+----+--------+
+----+--------+
INSERT INTO test_table (id, string_col, delimiter_col, position_col) VALUES (3, NULL, ',', 1);
SELECT id, split_part(string_col, delimiter_col, position_col) AS result FROM test_table WHERE id = 3;
+----+--------+
| id | result |
+----+--------+
|  3 | NULL   |
+----+--------+
INSERT INTO test_table (id, string_col, delimiter_col, position_col) VALUES (4, 'i,j,k,l', ',', 0);
SELECT id, split_part(string_col, delimiter_col, position_col) AS result FROM test_table WHERE id = 4;
+----+--------+
| id | result |
+----+--------+
|  4 | i      |
+----+--------+
INSERT INTO test_table (id, string_col, delimiter_col, position_col) VALUES (5, 'm,n,o,p', ',', -1);
SELECT id, split_part(string_col, delimiter_col, position_col) AS result FROM test_table WHERE id = 5;
+----+--------+
| id | result |
+----+--------+
|  5 | p      |
+----+--------+
INSERT INTO test_table (id, string_col, delimiter_col, position_col, end_position_col) VALUES (6, 'q,r,s,t', ',', 1, 3);
SELECT id, split_part(string_col, delimiter_col, position_col, end_position_col) AS result FROM test_table WHERE id = 6;
+----+--------+
| id | result |
+----+--------+
|  6 | q,r,s  |
+----+--------+
### SELECT+DML全量覆盖
drop table if exists test_split;
CREATE TABLE test_split (
    id INT AUTO_INCREMENT PRIMARY KEY,
    data_column TINYTEXT,
    another_column VARCHAR(255)
);
INSERT INTO test_split (data_column, another_column) VALUES 
('a,b,c,d', 'Alpha'),
('e,f,g,h', 'Beta'),
(NULL, 'Gamma');
INSERT INTO test_split (data_column, another_column)
SELECT 'i,j,k,l', 'Delta';
REPLACE INTO test_split (id, data_column, another_column) VALUES (1, 'm,n,o,p', 'Epsilon');
### 基本选择和 where
SELECT id, split_part(data_column, ',', 1) AS first_part 
FROM test_split 
WHERE another_column = 'Epsilon';
+----+------------+
| id | first_part |
+----+------------+
|  1 | m          |
+----+------------+
### 使用 OR 和 AND
SELECT * 
FROM test_split 
WHERE split_part(data_column, ',', 2) = 'b' OR another_column LIKE 'G%';
+----+-------------+----------------+
| id | data_column | another_column |
+----+-------------+----------------+
|  3 | NULL        | Gamma          |
+----+-------------+----------------+
### 使用 LIKE
SELECT * 
FROM test_split 
WHERE another_column LIKE '%ta%';
+----+-------------+----------------+
| id | data_column | another_column |
+----+-------------+----------------+
|  2 | e,f,g,h     | Beta           |
|  4 | i,j,k,l     | Delta          |
+----+-------------+----------------+
### 使用 ORDER BY
SELECT * 
FROM test_split 
ORDER BY split_part(data_column, ',', 1);
+----+-------------+----------------+
| id | data_column | another_column |
+----+-------------+----------------+
|  1 | m,n,o,p     | Epsilon        |
|  2 | e,f,g,h     | Beta           |
|  3 | NULL        | Gamma          |
|  4 | i,j,k,l     | Delta          |
+----+-------------+----------------+
### 使用 GROUP BY 和 HAVING
SELECT another_column, COUNT(*) AS count
FROM test_split 
GROUP BY another_column HAVING count > 1;
+----------------+-------+
| another_column | count |
+----------------+-------+
+----------------+-------+
### 使用 DISTINCT
SELECT DISTINCT split_part(data_column, ',', 1) 
FROM test_split;
+---------------------------------+
| split_part(data_column, ',', 1) |
+---------------------------------+
| NULL                            |
| e                               |
| i                               |
| m                               |
+---------------------------------+
### 使用 CASE WHEN
SELECT id, 
       CASE 
           WHEN split_part(data_column, ',', 2) IS NOT NULL THEN 'Exists' 
           ELSE 'Not Exists' 
       END AS part_existence 
FROM test_split;
+----+----------------+
| id | part_existence |
+----+----------------+
|  1 | Exists         |
|  2 | Exists         |
|  3 | Not Exists     |
|  4 | Exists         |
+----+----------------+
### 使用 WITH AS 和子查询
WITH split_data AS (
    SELECT id, split_part(data_column, ',', 1) AS first_part 
    FROM test_split 
)
SELECT * FROM split_data WHERE first_part IS NOT NULL;
+----+------------+
| id | first_part |
+----+------------+
|  1 | m          |
|  2 | e          |
|  4 | i          |
+----+------------+
### 子查询中的 EXISTS
SELECT * 
FROM test_split t 
WHERE EXISTS (
    SELECT 1 
    FROM test_split 
    WHERE split_part(data_column, ',', 2) = 'b'
);
+----+-------------+----------------+
| id | data_column | another_column |
+----+-------------+----------------+
+----+-------------+----------------+
### 使用 ANY
SELECT * 
FROM test_split 
WHERE split_part(data_column, ',', 1) = ANY (SELECT split_part(data_column, ',', 1) FROM test_split);
+----+-------------+----------------+
| id | data_column | another_column |
+----+-------------+----------------+
|  1 | m,n,o,p     | Epsilon        |
|  2 | e,f,g,h     | Beta           |
|  4 | i,j,k,l     | Delta          |
+----+-------------+----------------+
### 使用 SOME（MySQL 中和 ANY 是相同的）
SELECT * 
FROM test_split 
WHERE split_part(data_column, ',', 1) = SOME (SELECT split_part(data_column, ',', 1) FROM test_split);
+----+-------------+----------------+
| id | data_column | another_column |
+----+-------------+----------------+
|  1 | m,n,o,p     | Epsilon        |
|  2 | e,f,g,h     | Beta           |
|  4 | i,j,k,l     | Delta          |
+----+-------------+----------------+
### 使用 ALL
SELECT * 
FROM test_split 
WHERE split_part(data_column, ',', 1) = ALL (SELECT split_part(data_column, ',', 1) FROM test_split);
+----+-------------+----------------+
| id | data_column | another_column |
+----+-------------+----------------+
+----+-------------+----------------+
### 使用 NOT IN
SELECT * 
FROM test_split 
WHERE split_part(data_column, ',', 1) NOT IN (SELECT split_part(data_column, ',', 1) FROM test_split);
+----+-------------+----------------+
| id | data_column | another_column |
+----+-------------+----------------+
+----+-------------+----------------+
### 使用比较运算符
SELECT * 
FROM test_split 
WHERE id >= 1 AND id <= 2;
+----+-------------+----------------+
| id | data_column | another_column |
+----+-------------+----------------+
|  1 | m,n,o,p     | Epsilon        |
|  2 | e,f,g,h     | Beta           |
+----+-------------+----------------+
### 使用 AND, OR, LIKE, NOT LIKE
SELECT * 
FROM test_split 
WHERE split_part(data_column, ',', 1) LIKE 'a%' AND another_column NOT LIKE 'Gamma';
+----+-------------+----------------+
| id | data_column | another_column |
+----+-------------+----------------+
+----+-------------+----------------+
### 更新
UPDATE test_split 
SET data_column = split_part(data_column, ',', 1) 
WHERE id = 1;
### 使用 UPDATE ... SELECT
UPDATE test_split 
SET another_column = (SELECT 'Updated' FROM dual)
WHERE id = 2;
### 删除
DELETE FROM test_split 
WHERE id = 3;
### 删除来自子查询的行
DELETE FROM test_split 
WHERE id IN (SELECT id FROM test_split WHERE another_column = 'Beta');
drop table if exists users;
drop table if exists orders;
CREATE TABLE users (
    user_id INT PRIMARY KEY,
    user_name VARCHAR(100),
    user_info TEXT
);
CREATE TABLE orders (
    order_id INT PRIMARY KEY,
    user_id INT,
    product VARCHAR(100),
    FOREIGN KEY (user_id) REFERENCES users(user_id)
);
INSERT INTO users (user_id, user_name, user_info)
VALUES 
(1, 'Alice', 'Alice,birthday,single'),
(2, 'Bob', 'Bob,age,30'),
(3, 'Charlie', 'Charlie,age,25');
INSERT INTO orders (order_id, user_id, product)
VALUES 
(1, 1, 'Product1'),
(2, 2, 'Product2'),
(3, 1, 'Product3'),
(4, 3, 'Product4');
SELECT users.user_id, users.user_name, split_part(users.user_info, ',', 1) as split_info
FROM users, orders
WHERE users.user_id = orders.user_id;
+---------+-----------+------------+
| user_id | user_name | split_info |
+---------+-----------+------------+
|       1 | Alice     | Alice      |
|       1 | Alice     | Alice      |
|       2 | Bob       | Bob        |
|       3 | Charlie   | Charlie    |
+---------+-----------+------------+
SELECT users.user_id, users.user_name, split_part(users.user_info, ',', 1) as split_info
FROM users
LEFT JOIN orders ON users.user_id = orders.user_id;
+---------+-----------+------------+
| user_id | user_name | split_info |
+---------+-----------+------------+
|       1 | Alice     | Alice      |
|       1 | Alice     | Alice      |
|       2 | Bob       | Bob        |
|       3 | Charlie   | Charlie    |
+---------+-----------+------------+
SELECT users.user_id, users.user_name, split_part(users.user_info, ',', 1) as split_info
FROM users
RIGHT JOIN orders ON users.user_id = orders.user_id;
+---------+-----------+------------+
| user_id | user_name | split_info |
+---------+-----------+------------+
|       1 | Alice     | Alice      |
|       1 | Alice     | Alice      |
|       2 | Bob       | Bob        |
|       3 | Charlie   | Charlie    |
+---------+-----------+------------+
SELECT users.user_id, users.user_name, split_part(users.user_info, ',', 2) as split_info
FROM users
INNER JOIN orders ON users.user_id = orders.user_id;
+---------+-----------+------------+
| user_id | user_name | split_info |
+---------+-----------+------------+
|       1 | Alice     | birthday   |
|       1 | Alice     | birthday   |
|       2 | Bob       | age        |
|       3 | Charlie   | age        |
+---------+-----------+------------+
SELECT users.user_id, users.user_name, split_part(users.user_info, ',', 1) as split_info
FROM users
CROSS JOIN orders;
+---------+-----------+------------+
| user_id | user_name | split_info |
+---------+-----------+------------+
|       1 | Alice     | Alice      |
|       1 | Alice     | Alice      |
|       1 | Alice     | Alice      |
|       1 | Alice     | Alice      |
|       2 | Bob       | Bob        |
|       2 | Bob       | Bob        |
|       2 | Bob       | Bob        |
|       2 | Bob       | Bob        |
|       3 | Charlie   | Charlie    |
|       3 | Charlie   | Charlie    |
|       3 | Charlie   | Charlie    |
|       3 | Charlie   | Charlie    |
+---------+-----------+------------+
SELECT users.user_id, users.user_name,
       split_part(users.user_info, ',', 1, 2) as split_info_range
FROM users
INNER JOIN orders ON users.user_id = orders.user_id;
+---------+-----------+------------------+
| user_id | user_name | split_info_range |
+---------+-----------+------------------+
|       1 | Alice     | Alice,birthday   |
|       1 | Alice     | Alice,birthday   |
|       2 | Bob       | Bob,age          |
|       3 | Charlie   | Charlie,age      |
+---------+-----------+------------------+
SELECT users.user_id, users.user_name, 
       split_part(users.user_info, '-', 1) as split_info_not_found
FROM users;
+---------+-----------+-----------------------+
| user_id | user_name | split_info_not_found  |
+---------+-----------+-----------------------+
|       1 | Alice     | Alice,birthday,single |
|       2 | Bob       | Bob,age,30            |
|       3 | Charlie   | Charlie,age,25        |
+---------+-----------+-----------------------+
SELECT users.user_id, users.user_name, 
       split_part(users.user_info, ',', -2) as split_info_negative
FROM users;
+---------+-----------+---------------------+
| user_id | user_name | split_info_negative |
+---------+-----------+---------------------+
|       1 | Alice     | birthday            |
|       2 | Bob       | age                 |
|       3 | Charlie   | age                 |
+---------+-----------+---------------------+
SELECT users.user_id, users.user_name, 
       split_part(users.user_info, ',', 10) as split_info_out_of_bounds
FROM users;
+---------+-----------+--------------------------+
| user_id | user_name | split_info_out_of_bounds |
+---------+-----------+--------------------------+
|       1 | Alice     |                          |
|       2 | Bob       |                          |
|       3 | Charlie   |                          |
+---------+-----------+--------------------------+
### PL相关场景覆盖
drop table if exists test_table;
CREATE TABLE test_table (
    id SERIAL PRIMARY KEY,
    string_col VARCHAR(255),
    delimiter_col VARCHAR(10),
    position_col INT,
    end_position_col INT
);
DROP PROCEDURE test_split_part_procedure;
CREATE PROCEDURE test_split_part_procedure()
BEGIN
    DECLARE v_string VARCHAR(255);
    DECLARE v_delimiter VARCHAR(10);
    DECLARE v_position INT;
    DECLARE v_result VARCHAR(255);
    DECLARE v_index INT DEFAULT 1;

    SET v_string = 'a,b,c,d';
    SET v_delimiter = ',';
    TRUNCATE TABLE test_table;

    WHILE v_index <= 4 DO
        INSERT INTO test_table (string_col, delimiter_col, position_col)
        VALUES (v_string, v_delimiter, v_index);
        SET v_index = v_index + 1;
    END WHILE;

    SET v_index = 1;

    WHILE v_index <= 4 DO
        SET v_result = split_part(v_string, v_delimiter, v_index);
        SELECT v_index, v_result;
        SET v_index = v_index + 1;
    END WHILE;
END;
//
CALL test_split_part_procedure();
+---------+----------+
| v_index | v_result |
+---------+----------+
+---------+----------+
| v_index | v_result |
+---------+----------+
+---------+----------+
| v_index | v_result |
+---------+----------+
+---------+----------+
| v_index | v_result |
+---------+----------+
|       1 | a        |
|       2 | b        |
|       3 | c        |
|       4 | d        |
+---------+----------+
+---------+----------+
+---------+----------+
+---------+----------+
drop table if exists test_table;
CREATE TABLE test_table (
    id SERIAL PRIMARY KEY,
    string_col VARCHAR(255),
    delimiter_col VARCHAR(10),
    position_col INT,
    result_col VARCHAR(255)
);
DROP TRIGGER IF EXISTS before_insert_test_table;
CREATE TRIGGER before_insert_test_table
BEFORE INSERT ON test_table
FOR EACH ROW
BEGIN
    DECLARE v_result VARCHAR(255);
   
    SET v_result = split_part(NEW.string_col, NEW.delimiter_col, NEW.position_col);

    SET NEW.result_col = v_result;
END;
//
INSERT INTO test_table (string_col, delimiter_col, position_col) VALUES ('a,b,c,d', ',', 1);
INSERT INTO test_table (string_col, delimiter_col, position_col) VALUES ('a,b,c,d', ',', 2);
INSERT INTO test_table (string_col, delimiter_col, position_col) VALUES ('a,b,c,d', ',', 3);
INSERT INTO test_table (string_col, delimiter_col, position_col) VALUES ('a,b,c,d', ',', 4);
SELECT * FROM test_table;
+----+------------+---------------+--------------+------------+
| id | string_col | delimiter_col | position_col | result_col |
+----+------------+---------------+--------------+------------+
|  1 | a,b,c,d    | ,             |            1 | a          |
|  2 | a,b,c,d    | ,             |            2 | b          |
|  3 | a,b,c,d    | ,             |            3 | c          |
|  4 | a,b,c,d    | ,             |            4 | d          |
+----+------------+---------------+--------------+------------+
DROP FUNCTION IF EXISTS my_split_part;
CREATE FUNCTION my_split_part(
    str1 VARCHAR(255),
    separator1 VARCHAR(10),
    start1 BIGINT,
    end1 BIGINT
) RETURNS VARCHAR(255)
BEGIN
    RETURN split_part(str1, separator1, start1, end1);
END;
//
SELECT my_split_part('a,b,c,d', ',', 1,2) AS part1;
+-------+
| part1 |
+-------+
| a,b   |
+-------+
SELECT my_split_part('a,b,c,d', ',', 2,2) AS part2;
+-------+
| part2 |
+-------+
| b     |
+-------+
SELECT my_split_part('a,b,c,d', ',', 3,2) AS part3;
ERROR HY000: Incorrect arguments to SPLIT_PART function. The end part must be greater than start part.
SELECT my_split_part('a,b,c,d', ',', 4,2) AS part4;
ERROR HY000: Incorrect arguments to SPLIT_PART function. The end part must be greater than start part.
SELECT my_split_part('a,b,c,d', ',', 1,3) AS part1;
+-------+
| part1 |
+-------+
| a,b,c |
+-------+
SELECT my_split_part('a,b,c,d', ',', 2,3) AS part2;
+-------+
| part2 |
+-------+
| b,c   |
+-------+
SELECT my_split_part('a,b,c,d', ',', 3,3) AS part3;
+-------+
| part3 |
+-------+
| c     |
+-------+
SELECT my_split_part('a,b,c,d', ',', 4,3) AS part4;
ERROR HY000: Incorrect arguments to SPLIT_PART function. The end part must be greater than start part.
SELECT my_split_part('a,b,c,d', ',', 1,4) AS part1;
+---------+
| part1   |
+---------+
| a,b,c,d |
+---------+
SELECT my_split_part('a,b,c,d', ',', 2,4) AS part2;
+-------+
| part2 |
+-------+
| b,c,d |
+-------+
SELECT my_split_part('a,b,c,d', ',', 3,4) AS part3;
+-------+
| part3 |
+-------+
| c,d   |
+-------+
SELECT my_split_part('a,b,c,d', ',', 4,4) AS part4;
+-------+
| part4 |
+-------+
| d     |
+-------+
SELECT my_split_part('a,b,c,d', ',', 1,5) AS part1;
+---------+
| part1   |
+---------+
| a,b,c,d |
+---------+
SELECT my_split_part('a,b,c,d', ',', 2,5) AS part2;
+-------+
| part2 |
+-------+
| b,c,d |
+-------+
SELECT my_split_part('a,b,c,d', ',', 3,5) AS part3;
+-------+
| part3 |
+-------+
| c,d   |
+-------+
SELECT my_split_part('a,b,c,d', ',', 4,5) AS part4;
+-------+
| part4 |
+-------+
| d     |
+-------+
###  覆盖PL
DROP TABLE IF EXISTS test_split_part;
DROP PROCEDURE IF EXISTS test_split_part_procedure;
DROP PROCEDURE IF EXISTS test_split_part_while;
DROP PROCEDURE IF EXISTS test_split_part_repeat;
DROP PROCEDURE IF EXISTS test_split_part_loop;
CREATE TABLE test_split_part (
    id INT AUTO_INCREMENT PRIMARY KEY,
    input_string TEXT,
    delimiter VARCHAR(10),
    index_return INT,
    count_param INT
);
INSERT INTO test_split_part (input_string, delimiter, index_return, count_param) VALUES
('a,b,c,d', ',', 1, 2),
('a,b,c,d', ',', 2, 3),
('a,b,c,d', ',', 1, NULL),
('a,b,c,d', ',', 0, 2),
('a,b,c,d', ',', -1, 2),
('a,b,c,d', ',', 10, 2),
('a,b,c,d', '|', 1, 2),   
('a,b,c,d', ',', -4, -2), 
(NULL, ',', 1, 2),        
('a,b,c,d', ',', NULL, NULL);
CREATE PROCEDURE test_split_part_procedure()
BEGIN
    DECLARE done INT DEFAULT FALSE;
    DECLARE str TEXT;
    DECLARE del VARCHAR(10);
    DECLARE index_ret INT;
    DECLARE cnt INT;
    
    DECLARE cur CURSOR FOR SELECT input_string, delimiter, index_return, count_param FROM test_split_part;
    DECLARE CONTINUE HANDLER FOR NOT FOUND SET done = TRUE;

    OPEN cur;

    read_loop: LOOP
        FETCH cur INTO str, del, index_ret, cnt;
        IF done THEN
            LEAVE read_loop;
        END IF;
        SELECT str AS input_string, del AS delimiter, index_ret AS index_return, cnt AS count_param,
               split_part(str, del, index_ret, cnt) AS result;
    END LOOP;

    CLOSE cur;
END;
//
CALL test_split_part_procedure();
//
+--------------+-----------+--------------+-------------+--------+
| input_string | delimiter | index_return | count_param | result |
+--------------+-----------+--------------+-------------+--------+
+--------------+-----------+--------------+-------------+--------+
| input_string | delimiter | index_return | count_param | result |
+--------------+-----------+--------------+-------------+--------+
+--------------+-----------+--------------+-------------+--------+
| input_string | delimiter | index_return | count_param | result |
+--------------+-----------+--------------+-------------+--------+
+--------------+-----------+--------------+-------------+--------+
| input_string | delimiter | index_return | count_param | result |
+--------------+-----------+--------------+-------------+--------+
| a,b,c,d      | ,         |            0 |           2 | a,b    |
| a,b,c,d      | ,         |            1 |           2 | a,b    |
| a,b,c,d      | ,         |            1 |        NULL | NULL   |
| a,b,c,d      | ,         |            2 |           3 | b,c    |
+--------------+-----------+--------------+-------------+--------+
+--------------+-----------+--------------+-------------+--------+
+--------------+-----------+--------------+-------------+--------+
+--------------+-----------+--------------+-------------+--------+
ERROR HY000: Incorrect arguments to SPLIT_PART function. The start_part and end_part must both be either positive or negative numbers.
CREATE PROCEDURE test_split_part_while()
BEGIN
    DECLARE i INT DEFAULT 1;
    DECLARE total INT;
    
    SELECT COUNT(*) INTO total FROM test_split_part;

    WHILE i <= total DO
        SELECT 
            input_string, 
            delimiter, 
            index_return, 
            count_param, 
            split_part(input_string, delimiter, index_return, count_param) AS result
        FROM test_split_part
        WHERE id = i;
        SET i = i + 1;
    END WHILE;
END; //
CALL test_split_part_while();
//
+--------------+-----------+--------------+-------------+--------+
| input_string | delimiter | index_return | count_param | result |
+--------------+-----------+--------------+-------------+--------+
+--------------+-----------+--------------+-------------+--------+
| input_string | delimiter | index_return | count_param | result |
+--------------+-----------+--------------+-------------+--------+
+--------------+-----------+--------------+-------------+--------+
| input_string | delimiter | index_return | count_param | result |
+--------------+-----------+--------------+-------------+--------+
+--------------+-----------+--------------+-------------+--------+
| input_string | delimiter | index_return | count_param | result |
+--------------+-----------+--------------+-------------+--------+
| a,b,c,d      | ,         |            0 |           2 | a,b    |
| a,b,c,d      | ,         |            1 |           2 | a,b    |
| a,b,c,d      | ,         |            1 |        NULL | NULL   |
| a,b,c,d      | ,         |            2 |           3 | b,c    |
+--------------+-----------+--------------+-------------+--------+
+--------------+-----------+--------------+-------------+--------+
+--------------+-----------+--------------+-------------+--------+
+--------------+-----------+--------------+-------------+--------+
ERROR HY000: Incorrect arguments to SPLIT_PART function. The start_part and end_part must both be either positive or negative numbers.
CREATE PROCEDURE test_split_part_repeat()
BEGIN
    DECLARE i INT DEFAULT 1;
    DECLARE total INT;

    SELECT COUNT(*) INTO total FROM test_split_part;

    REPEAT
        SELECT 
            input_string, 
            delimiter, 
            index_return, 
            count_param, 
            split_part(input_string, delimiter, index_return, count_param) AS result
        FROM test_split_part
        WHERE id = i;
        SET i = i + 1;
    UNTIL i > total
    END REPEAT;
END ;//
CALL test_split_part_repeat();
//
+--------------+-----------+--------------+-------------+--------+
| input_string | delimiter | index_return | count_param | result |
+--------------+-----------+--------------+-------------+--------+
+--------------+-----------+--------------+-------------+--------+
| input_string | delimiter | index_return | count_param | result |
+--------------+-----------+--------------+-------------+--------+
+--------------+-----------+--------------+-------------+--------+
| input_string | delimiter | index_return | count_param | result |
+--------------+-----------+--------------+-------------+--------+
+--------------+-----------+--------------+-------------+--------+
| input_string | delimiter | index_return | count_param | result |
+--------------+-----------+--------------+-------------+--------+
| a,b,c,d      | ,         |            0 |           2 | a,b    |
| a,b,c,d      | ,         |            1 |           2 | a,b    |
| a,b,c,d      | ,         |            1 |        NULL | NULL   |
| a,b,c,d      | ,         |            2 |           3 | b,c    |
+--------------+-----------+--------------+-------------+--------+
+--------------+-----------+--------------+-------------+--------+
+--------------+-----------+--------------+-------------+--------+
+--------------+-----------+--------------+-------------+--------+
ERROR HY000: Incorrect arguments to SPLIT_PART function. The start_part and end_part must both be either positive or negative numbers.
CREATE PROCEDURE test_split_part_loop()
BEGIN
    DECLARE i INT DEFAULT 1;
    DECLARE total INT;

    SELECT COUNT(*) INTO total FROM test_split_part;

    loop_label: LOOP
        IF i > total THEN
            LEAVE loop_label;
        END IF;

        SELECT 
            input_string, 
            delimiter, 
            index_return, 
            count_param, 
            split_part(input_string, delimiter, index_return, count_param) AS result
        FROM test_split_part
        WHERE id = i;

        SET i = i + 1;
    END LOOP;
END ;//
CALL test_split_part_loop();
//
+--------------+-----------+--------------+-------------+--------+
| input_string | delimiter | index_return | count_param | result |
+--------------+-----------+--------------+-------------+--------+
+--------------+-----------+--------------+-------------+--------+
| input_string | delimiter | index_return | count_param | result |
+--------------+-----------+--------------+-------------+--------+
+--------------+-----------+--------------+-------------+--------+
| input_string | delimiter | index_return | count_param | result |
+--------------+-----------+--------------+-------------+--------+
+--------------+-----------+--------------+-------------+--------+
| input_string | delimiter | index_return | count_param | result |
+--------------+-----------+--------------+-------------+--------+
| a,b,c,d      | ,         |            0 |           2 | a,b    |
| a,b,c,d      | ,         |            1 |           2 | a,b    |
| a,b,c,d      | ,         |            1 |        NULL | NULL   |
| a,b,c,d      | ,         |            2 |           3 | b,c    |
+--------------+-----------+--------------+-------------+--------+
+--------------+-----------+--------------+-------------+--------+
+--------------+-----------+--------------+-------------+--------+
+--------------+-----------+--------------+-------------+--------+
ERROR HY000: Incorrect arguments to SPLIT_PART function. The start_part and end_part must both be either positive or negative numbers.
DROP TABLE IF EXISTS test_split_part;
CREATE TABLE test_split_part (
    id INT AUTO_INCREMENT PRIMARY KEY,
    data TEXT
);
CREATE TRIGGER before_insert_test_split_part 
BEFORE INSERT ON test_split_part
FOR EACH ROW 
BEGIN
    DECLARE result VARCHAR(255);
    SET result = split_part(NEW.data, ',', 1);
    SELECT CONCAT('Insert Trigger: First part is ', result);
END ; 
$$
ERROR 0A000: Not allowed to return a result set from a trigger
CREATE TRIGGER before_insert_test_split_part 
BEFORE INSERT ON test_split_part
FOR EACH ROW 
BEGIN
    DECLARE result VARCHAR(255);
    SET result = split_part(NEW.data, ',', 1);
END ; 
$$
CREATE TRIGGER before_update_test_split_part 
BEFORE UPDATE ON test_split_part
FOR EACH ROW 
BEGIN
    DECLARE result VARCHAR(255);
    SET result = split_part(NEW.data, ',', 1);
END; $$
CREATE TRIGGER before_delete_test_split_part 
BEFORE DELETE ON test_split_part
FOR EACH ROW 
BEGIN
    DECLARE result VARCHAR(255);
    SET result = split_part(OLD.data, ',', 1);
END; $$
INSERT INTO test_split_part (data) VALUES ('a,b,c,d');
INSERT INTO test_split_part (data) VALUES ('1,2,3');
INSERT INTO test_split_part (data) VALUES (NULL);
UPDATE test_split_part SET data = 'apple,banana' WHERE id = 1;
UPDATE test_split_part SET data = '45,67,89' WHERE id = 2;
DELETE FROM test_split_part WHERE id = 1;
DELETE FROM test_split_part WHERE id = 2;
SELECT * FROM test_split_part;
+----+------+
| id | data |
+----+------+
|  3 | NULL |
+----+------+
DROP TABLE IF EXISTS string_data;
CREATE TABLE IF NOT EXISTS string_data (
    id INT AUTO_INCREMENT PRIMARY KEY,
    str VARCHAR(255) NOT NULL
);
INSERT INTO string_data (str) VALUES 
('a,b,c,d'), 
('1,2,3,4,5'), 
('foo,bar,baz'), 
('apple,banana,kiwi,grape');
DROP FUNCTION IF EXISTS my_split_part;
CREATE FUNCTION my_split_part(input VARCHAR(255), delimiter VARCHAR(1), position INT)
RETURNS VARCHAR(255) 
DETERMINISTIC
BEGIN
    RETURN split_part(input, delimiter, position);
END; $$
SELECT my_split_part(NULL, NULL, NULL);
+---------------------------------+
| my_split_part(NULL, NULL, NULL) |
+---------------------------------+
| NULL                            |
+---------------------------------+
SELECT my_split_part('hello,world', ',', 1);
+--------------------------------------+
| my_split_part('hello,world', ',', 1) |
+--------------------------------------+
| hello                                |
+--------------------------------------+
SELECT my_split_part('a,b,c,d', ',', 2);
+----------------------------------+
| my_split_part('a,b,c,d', ',', 2) |
+----------------------------------+
| b                                |
+----------------------------------+
SELECT my_split_part('a,b,c,d', ',', -1);
+-----------------------------------+
| my_split_part('a,b,c,d', ',', -1) |
+-----------------------------------+
| d                                 |
+-----------------------------------+
### SELECT my_split_part(CONCAT('1,2,3,4,5', RAND()), ',', 1);
### SELECT my_split_part('apple,banana,kiwi,grape', ',', FLOOR(RAND() * 4) + 1);
SELECT my_split_part('a,b,c,d', ',,', -1);
ERROR 22001: Data too long for column
DROP TABLE IF EXISTS test_split_part;
CREATE TABLE test_split_part (
    id INT AUTO_INCREMENT PRIMARY KEY,
    input_str TEXT,
    delimiter VARCHAR(10),
    part_index INT,
    part_index2 INT,
    expected_output TEXT
);
INSERT INTO test_split_part (input_str, delimiter, part_index, part_index2, expected_output) VALUES
('a,b,c,d', ',', 1, NULL, 'a'),
('a,b,c,d', ',', 0, NULL, 'a'),
('a,b,c,d', ',', -1, NULL, 'd'),
('a,b,c,d', ',', 10, NULL, ''),
('a,b,c,d', ',', 1, 2, 'a,b'),
('a,b,c,d', ',', 1, 3, 'a,b,c'),
('a,b,c,d', ',', -4, -2, 'a,b,c'),
('a,b,c,d', ',', 1, 10, 'a,b,c,d');
DROP PROCEDURE IF EXISTS test_split_part_proc;
CREATE PROCEDURE test_split_part_proc()
BEGIN
    DECLARE done INT DEFAULT FALSE;
    DECLARE current_input_str TEXT;
    DECLARE current_delimiter VARCHAR(10);
    DECLARE current_part_index INT;
    DECLARE current_part_index2 INT;
    DECLARE current_expected_output TEXT;
    DECLARE current_output TEXT;

    DECLARE split_part_cursor CURSOR FOR
        SELECT input_str, delimiter, part_index, part_index2, expected_output FROM test_split_part;

    DECLARE CONTINUE HANDLER FOR NOT FOUND SET done = TRUE;

    OPEN split_part_cursor;

    read_loop: LOOP
        FETCH split_part_cursor INTO current_input_str, current_delimiter, current_part_index, current_part_index2, current_expected_output;

        IF done THEN
            LEAVE read_loop;
        END IF;

        IF current_part_index2 IS NULL THEN
            SET current_output = split_part(current_input_str, current_delimiter, current_part_index);
        ELSE
            SET current_output = split_part(current_input_str, current_delimiter, current_part_index, current_part_index2);
        END IF;

        SELECT current_input_str AS input_str,
               current_delimiter AS delimiter,
               current_part_index AS part_index,
               current_part_index2 AS part_index2,
               current_expected_output AS expected,
               current_output AS actual;
    END LOOP;

    CLOSE split_part_cursor;
END;$$
CALL test_split_part_proc();
+-----------+-----------+------------+-------------+----------+--------+
| input_str | delimiter | part_index | part_index2 | expected | actual |
+-----------+-----------+------------+-------------+----------+--------+
+-----------+-----------+------------+-------------+----------+--------+
| input_str | delimiter | part_index | part_index2 | expected | actual |
+-----------+-----------+------------+-------------+----------+--------+
+-----------+-----------+------------+-------------+----------+--------+
| input_str | delimiter | part_index | part_index2 | expected | actual |
+-----------+-----------+------------+-------------+----------+--------+
+-----------+-----------+------------+-------------+----------+--------+
| input_str | delimiter | part_index | part_index2 | expected | actual |
+-----------+-----------+------------+-------------+----------+--------+
+-----------+-----------+------------+-------------+----------+--------+
| input_str | delimiter | part_index | part_index2 | expected | actual |
+-----------+-----------+------------+-------------+----------+--------+
+-----------+-----------+------------+-------------+----------+--------+
| input_str | delimiter | part_index | part_index2 | expected | actual |
+-----------+-----------+------------+-------------+----------+--------+
+-----------+-----------+------------+-------------+----------+--------+
| input_str | delimiter | part_index | part_index2 | expected | actual |
+-----------+-----------+------------+-------------+----------+--------+
+-----------+-----------+------------+-------------+----------+---------+
| input_str | delimiter | part_index | part_index2 | expected | actual  |
+-----------+-----------+------------+-------------+----------+---------+
| a,b,c,d   | ,         |          0 |        NULL | a        | a      |
| a,b,c,d   | ,         |          1 |           2 | a,b      | a,b    |
| a,b,c,d   | ,         |          1 |           3 | a,b,c    | a,b,c  |
| a,b,c,d   | ,         |          1 |          10 | a,b,c,d  | a,b,c,d |
| a,b,c,d   | ,         |          1 |        NULL | a        | a      |
| a,b,c,d   | ,         |         -1 |        NULL | d        | d      |
| a,b,c,d   | ,         |         -4 |          -2 | a,b,c    | a,b,c  |
| a,b,c,d   | ,         |         10 |        NULL |          |        |
+-----------+-----------+------------+-------------+----------+--------+
+-----------+-----------+------------+-------------+----------+--------+
+-----------+-----------+------------+-------------+----------+--------+
+-----------+-----------+------------+-------------+----------+--------+
+-----------+-----------+------------+-------------+----------+--------+
+-----------+-----------+------------+-------------+----------+--------+
+-----------+-----------+------------+-------------+----------+--------+
+-----------+-----------+------------+-------------+----------+---------+
### 分区表/视图/索引/约束/生成列等相关场景覆盖
drop table if exists test_table;
CREATE TABLE test_table (
    id SERIAL PRIMARY KEY,
    string_col VARCHAR(255),
    delimiter_col VARCHAR(10),
    position_col INT,
    end_position_col INT,
    split_result VARCHAR(255) GENERATED ALWAYS AS (split_part(string_col, delimiter_col, position_col, end_position_col)) STORED
);
ALTER TABLE test_table ADD CONSTRAINT unique_split_result UNIQUE (split_result);
CREATE INDEX idx_split_result ON test_table (split_result);
CREATE VIEW test_view AS
SELECT id, string_col, delimiter_col, position_col, split_part(string_col, delimiter_col, position_col) AS view_split_result
FROM test_table;
INSERT INTO test_table (string_col, delimiter_col, position_col) VALUES ('a,b,c,d', ',', 1);
INSERT INTO test_table (string_col, delimiter_col, position_col) VALUES ('a,b,c,d', ',', 1);
SELECT * FROM test_view WHERE id = 1;
+----+------------+---------------+--------------+-------------------+
| id | string_col | delimiter_col | position_col | view_split_result |
+----+------------+---------------+--------------+-------------------+
|  1 | a,b,c,d    | ,             |            1 | a                 |
+----+------------+---------------+--------------+-------------------+
UPDATE test_table SET position_col = 2 WHERE id = 1;
### EXPLAIN  SELECT * FROM test_table WHERE split_result = 'a';
DELETE FROM test_table WHERE id = 1;
drop table if exists partitioned_table;
CREATE TABLE partitioned_table (
    id INT PRIMARY KEY,
    string_col VARCHAR(255),
    delimiter_col VARCHAR(10),
    position_col INT,
    partition_key INT
) PARTITION BY RANGE (id);
INSERT INTO partitioned_table (id,string_col, delimiter_col, position_col, partition_key) VALUES (1,'a,b,c,d', ',', 1, 500);
INSERT INTO partitioned_table (id,string_col, delimiter_col, position_col, partition_key) VALUES (2,'e,f,g,h', ',', 2, 1500);
SELECT id, split_part(string_col, delimiter_col, position_col) AS split_result
FROM partitioned_table
WHERE partition_key BETWEEN 1 AND 1000;
+----+--------------+
| id | split_result |
+----+--------------+
|  1 | a            |
+----+--------------+
SELECT id, split_part(string_col, delimiter_col, 0) AS split_result
FROM partitioned_table
WHERE partition_key BETWEEN 1001 AND 2000;
+----+--------------+
| id | split_result |
+----+--------------+
|  2 | e            |
+----+--------------+
SELECT id, split_part(string_col, delimiter_col, -1) AS split_result
FROM partitioned_table
WHERE partition_key BETWEEN 1 AND 1000;
+----+--------------+
| id | split_result |
+----+--------------+
|  1 | d            |
+----+--------------+
SELECT id, split_part(string_col, delimiter_col, 10) AS split_result
FROM partitioned_table
WHERE partition_key BETWEEN 1001 AND 2000;
+----+--------------+
| id | split_result |
+----+--------------+
|  2 |              |
+----+--------------+
SELECT id, split_part(string_col, delimiter_col, 1, 3) AS split_result
FROM partitioned_table
WHERE partition_key BETWEEN 1 AND 1000;
+----+--------------+
| id | split_result |
+----+--------------+
|  1 | a,b,c        |
+----+--------------+
SELECT id, split_part(string_col, delimiter_col, 1, 10) AS split_result
FROM partitioned_table
WHERE partition_key BETWEEN 1001 AND 2000;
+----+--------------+
| id | split_result |
+----+--------------+
|  2 | e,f,g,h      |
+----+--------------+
### 分区表/视图/索引/约束/生成列等补充覆盖
drop table if exists hash_partitioned_table;
CREATE TABLE hash_partitioned_table (
    id INT PRIMARY KEY,
    data VARCHAR(255)
) PARTITION BY HASH(id) PARTITIONS 4;
INSERT INTO hash_partitioned_table (id, data) VALUES (1, 'a,b,c,d');
SELECT split_part(data, ',', 1) FROM hash_partitioned_table WHERE id = 1;
+--------------------------+
| split_part(data, ',', 1) |
+--------------------------+
| a                        |
+--------------------------+
drop table if exists key_partitioned_table;
CREATE TABLE key_partitioned_table (
    id INT PRIMARY KEY,
    data VARCHAR(255)
) PARTITION BY KEY(id) PARTITIONS 4;
INSERT INTO key_partitioned_table (id, data) VALUES (1, 'a,b,c,d');
SELECT split_part(data, ',', 2) FROM key_partitioned_table WHERE id = 1;
+--------------------------+
| split_part(data, ',', 2) |
+--------------------------+
| b                        |
+--------------------------+
drop table if exists list_partitioned_table;
CREATE TABLE list_partitioned_table (
    id INT PRIMARY KEY,
    data VARCHAR(255)
) PARTITION BY LIST(id) (
    PARTITION p0 VALUES IN (1, 2),
    PARTITION p1 VALUES IN (3, 4)
);
INSERT INTO list_partitioned_table (id, data) VALUES (1, 'a,b,c,d');
SELECT split_part(data, ',', 1) FROM list_partitioned_table WHERE id = 1;
+--------------------------+
| split_part(data, ',', 1) |
+--------------------------+
| a                        |
+--------------------------+
drop table if exists range_partitioned_table;
CREATE TABLE range_partitioned_table (
    id INT PRIMARY KEY,
    data VARCHAR(255)
) PARTITION BY RANGE(id) (
    PARTITION p0 VALUES LESS THAN (10),
    PARTITION p1 VALUES LESS THAN (20)
);
INSERT INTO range_partitioned_table (id, data) VALUES (5, 'a,b,c,d');
SELECT split_part(data, ',', 3) FROM range_partitioned_table WHERE id = 5;
+--------------------------+
| split_part(data, ',', 3) |
+--------------------------+
| c                        |
+--------------------------+
drop table if exists range_hash_partitioned_table;
CREATE TABLE range_hash_partitioned_table (
    id INT PRIMARY KEY,
    data VARCHAR(255)
) PARTITION BY RANGE(id) SUBPARTITION BY HASH(id) (
    PARTITION p0 VALUES LESS THAN (10) (
        SUBPARTITION sp0,
        SUBPARTITION sp1
    ),
    PARTITION p1 VALUES LESS THAN (20) (
        SUBPARTITION sp2,
        SUBPARTITION sp3
    )
);
INSERT INTO range_hash_partitioned_table (id, data) VALUES (5, 'a,b,c,d');
SELECT split_part(data, ',', -1) FROM range_hash_partitioned_table WHERE id = 5;
+---------------------------+
| split_part(data, ',', -1) |
+---------------------------+
| d                         |
+---------------------------+
drop table if exists range_key_partitioned_table;
CREATE TABLE range_key_partitioned_table (
    id INT PRIMARY KEY,
    data VARCHAR(255)
) PARTITION BY RANGE(id) SUBPARTITION BY KEY(id) (
    PARTITION p0 VALUES LESS THAN (10) (
        SUBPARTITION sp1,
        SUBPARTITION sp2
    ),
    PARTITION p1 VALUES LESS THAN (20) (
        SUBPARTITION sp3,
        SUBPARTITION sp4
    )
);
INSERT INTO range_key_partitioned_table (id, data) VALUES (5, 'a,b,c,d');
SELECT split_part(data, ',', 1, 2) FROM range_key_partitioned_table WHERE id = 5;
+-----------------------------+
| split_part(data, ',', 1, 2) |
+-----------------------------+
| a,b                         |
+-----------------------------+
drop table if exists list_hash_partitioned_table;
CREATE TABLE list_hash_partitioned_table (
    id INT PRIMARY KEY,
    data VARCHAR(255)
) PARTITION BY LIST(id) SUBPARTITION BY HASH(id) (
    PARTITION p0 VALUES IN (1, 2) (
        SUBPARTITION sp1,
        SUBPARTITION sp2
    ),
    PARTITION p1 VALUES IN (3, 4) (
        SUBPARTITION sp3,
        SUBPARTITION sp4
    )
);
INSERT INTO list_hash_partitioned_table (id, data) VALUES (1, 'a,b,c,d');
SELECT split_part(data, ',', 1, 3) FROM list_hash_partitioned_table WHERE id = 1;
+-----------------------------+
| split_part(data, ',', 1, 3) |
+-----------------------------+
| a,b,c                       |
+-----------------------------+
drop table if exists list_key_partitioned_table;
CREATE TABLE list_key_partitioned_table (
    id INT PRIMARY KEY,
    data VARCHAR(255)
) PARTITION BY LIST(id) SUBPARTITION BY KEY(id) (
    PARTITION p0 VALUES IN (1, 2) (
        SUBPARTITION sp1,
        SUBPARTITION sp2
    ),
    PARTITION p1 VALUES IN (3, 4) (
        SUBPARTITION sp3,
        SUBPARTITION sp4
    )
);
INSERT INTO list_key_partitioned_table (id, data) VALUES (1, 'a,b,c,d');
SELECT split_part(data, ',', -4, -2) FROM list_key_partitioned_table WHERE id = 1;
+-------------------------------+
| split_part(data, ',', -4, -2) |
+-------------------------------+
| a,b,c                         |
+-------------------------------+
drop table if exists test_strings;
CREATE TABLE test_strings (
    id INT AUTO_INCREMENT PRIMARY KEY,
    str TEXT
);
INSERT INTO test_strings (str) VALUES 
('a,b,c,d'), 
('1,2,3,4,5'),
('apple,banana,cherry'),
(NULL),
('only_one_part');
CREATE OR REPLACE VIEW string_parts AS 
SELECT 
    id,
    str,
    split_part(str, ',', 1) AS part1,
    split_part(str, ',', 2) AS part2,
    split_part(str, ',', 3) AS part3
FROM 
    test_strings;
SELECT * FROM string_parts;
+----+---------------------+---------------+--------+--------+
| id | str                 | part1         | part2  | part3  |
+----+---------------------+---------------+--------+--------+
|  1 | a,b,c,d             | a             | b      | c      |
|  2 | 1,2,3,4,5           | 1             | 2      | 3      |
|  3 | apple,banana,cherry | apple         | banana | cherry |
|  4 | NULL                | NULL          | NULL   | NULL   |
|  5 | only_one_part       | only_one_part |        |        |
+----+---------------------+---------------+--------+--------+
INSERT INTO test_strings (str) VALUES ('x,y,z');
SELECT * FROM string_parts;
+----+---------------------+---------------+--------+--------+
| id | str                 | part1         | part2  | part3  |
+----+---------------------+---------------+--------+--------+
|  1 | a,b,c,d             | a             | b      | c      |
|  2 | 1,2,3,4,5           | 1             | 2      | 3      |
|  3 | apple,banana,cherry | apple         | banana | cherry |
|  4 | NULL                | NULL          | NULL   | NULL   |
|  5 | only_one_part       | only_one_part |        |        |
|  6 | x,y,z               | x             | y      | z      |
+----+---------------------+---------------+--------+--------+
UPDATE test_strings SET str = 'update,test,case' WHERE id = 1;
SELECT * FROM string_parts;
+----+---------------------+---------------+--------+--------+
| id | str                 | part1         | part2  | part3  |
+----+---------------------+---------------+--------+--------+
|  1 | update,test,case    | update        | test   | case   |
|  2 | 1,2,3,4,5           | 1             | 2      | 3      |
|  3 | apple,banana,cherry | apple         | banana | cherry |
|  4 | NULL                | NULL          | NULL   | NULL   |
|  5 | only_one_part       | only_one_part |        |        |
|  6 | x,y,z               | x             | y      | z      |
+----+---------------------+---------------+--------+--------+
DELETE FROM test_strings WHERE id = 2;
SELECT * FROM string_parts;
+----+---------------------+---------------+--------+--------+
| id | str                 | part1         | part2  | part3  |
+----+---------------------+---------------+--------+--------+
|  1 | update,test,case    | update        | test   | case   |
|  3 | apple,banana,cherry | apple         | banana | cherry |
|  4 | NULL                | NULL          | NULL   | NULL   |
|  5 | only_one_part       | only_one_part |        |        |
|  6 | x,y,z               | x             | y      | z      |
+----+---------------------+---------------+--------+--------+
SELECT split_part('a,b,c,d', ',', 1);
+-------------------------------+
| split_part('a,b,c,d', ',', 1) |
+-------------------------------+
| a                             |
+-------------------------------+
SELECT split_part('a,b,c,d', ',', 0);
+-------------------------------+
| split_part('a,b,c,d', ',', 0) |
+-------------------------------+
| a                             |
+-------------------------------+
SELECT split_part('a,b,c,d', ',', -1);
+--------------------------------+
| split_part('a,b,c,d', ',', -1) |
+--------------------------------+
| d                              |
+--------------------------------+
SELECT split_part('a,b,c,d', ',', 10);
+--------------------------------+
| split_part('a,b,c,d', ',', 10) |
+--------------------------------+
|                                |
+--------------------------------+
SELECT split_part('a,b,c,d', ',', 1, 2);
+----------------------------------+
| split_part('a,b,c,d', ',', 1, 2) |
+----------------------------------+
| a,b                              |
+----------------------------------+
SELECT split_part('a,b,c,d', ',', 1, 3);
+----------------------------------+
| split_part('a,b,c,d', ',', 1, 3) |
+----------------------------------+
| a,b,c                            |
+----------------------------------+
SELECT split_part('a,b,c,d', ',', -4, -2);
+------------------------------------+
| split_part('a,b,c,d', ',', -4, -2) |
+------------------------------------+
| a,b,c                              |
+------------------------------------+
SELECT split_part('a,b,c,d', ',', 1, 10);
+-----------------------------------+
| split_part('a,b,c,d', ',', 1, 10) |
+-----------------------------------+
| a,b,c,d                           |
+-----------------------------------+
SELECT split_part('a,b,c,d', ',', NULL);
+----------------------------------+
| split_part('a,b,c,d', ',', NULL) |
+----------------------------------+
| NULL                             |
+----------------------------------+
SELECT split_part(NULL, ',', 1);
+--------------------------+
| split_part(NULL, ',', 1) |
+--------------------------+
| NULL                     |
+--------------------------+
SELECT split_part('a,b,c,d', 'z', 1);
+-------------------------------+
| split_part('a,b,c,d', 'z', 1) |
+-------------------------------+
| a,b,c,d                       |
+-------------------------------+
drop table if exists test_split_part;
drop table if exists another_table;
CREATE TABLE another_table (
    id INT PRIMARY KEY AUTO_INCREMENT,
    description VARCHAR(100)
);
CREATE TABLE test_split_part (
    id INT AUTO_INCREMENT PRIMARY KEY,       
    name VARCHAR(50) NOT NULL,               
    unique_col VARCHAR(50) UNIQUE,           
    age INT CHECK (age >= 0 AND age <= 120), 
    foreign_id INT,                          
    created_at DATETIME DEFAULT CURRENT_TIMESTAMP, 
    FOREIGN KEY (foreign_id) REFERENCES another_table(id)
);
INSERT INTO another_table (description) VALUES ('Sample description');
INSERT INTO test_split_part (name, unique_col, age, foreign_id) VALUES ('Alice', 'unique_value_1', 25, 1);
INSERT INTO test_split_part (name, unique_col, age, foreign_id) VALUES ('Bob', 'unique_value_2', 30, 1);
SELECT split_part('a,b,c,d', ',', 1);
+-------------------------------+
| split_part('a,b,c,d', ',', 1) |
+-------------------------------+
| a                             |
+-------------------------------+
SELECT split_part('a,b,c,d', ',', 0);
+-------------------------------+
| split_part('a,b,c,d', ',', 0) |
+-------------------------------+
| a                             |
+-------------------------------+
SELECT split_part('a,b,c,d', ',', -1);
+--------------------------------+
| split_part('a,b,c,d', ',', -1) |
+--------------------------------+
| d                              |
+--------------------------------+
SELECT split_part('a,b,c,d', ',', 10);
+--------------------------------+
| split_part('a,b,c,d', ',', 10) |
+--------------------------------+
|                                |
+--------------------------------+
SELECT split_part('a,b,c,d', ',', 1, 2);
+----------------------------------+
| split_part('a,b,c,d', ',', 1, 2) |
+----------------------------------+
| a,b                              |
+----------------------------------+
SELECT split_part('a,b,c,d', ',', 1, 3);
+----------------------------------+
| split_part('a,b,c,d', ',', 1, 3) |
+----------------------------------+
| a,b,c                            |
+----------------------------------+
SELECT split_part('a,b,c,d', ',', -4, -2);
+------------------------------------+
| split_part('a,b,c,d', ',', -4, -2) |
+------------------------------------+
| a,b,c                              |
+------------------------------------+
SELECT split_part('a,b,c,d', ',', 1, 10);
+-----------------------------------+
| split_part('a,b,c,d', ',', 1, 10) |
+-----------------------------------+
| a,b,c,d                           |
+-----------------------------------+
drop table if exists test_split_part;
CREATE TABLE test_split_part (
    id INT AUTO_INCREMENT PRIMARY KEY,
    part_string TEXT,          
    part_delimiter VARCHAR(100),
    index (part_delimiter)
);
INSERT INTO test_split_part (part_string, part_delimiter) VALUES ('apple,banana,cherry', ',');
SELECT split_part(part_string, part_delimiter, 1) FROM test_split_part;
+--------------------------------------------+
| split_part(part_string, part_delimiter, 1) |
+--------------------------------------------+
| apple                                      |
+--------------------------------------------+
INSERT INTO test_split_part (part_string, part_delimiter) VALUES ('orange,grape', 'unique_delimiter');
SELECT split_part(part_string, 'unique_delimiter', 1) FROM test_split_part;
+------------------------------------------------+
| split_part(part_string, 'unique_delimiter', 1) |
+------------------------------------------------+
| apple,banana,cherry                            |
| orange,grape                                   |
+------------------------------------------------+
INSERT INTO test_split_part (part_string, part_delimiter) VALUES ('mango,pineapple,lemon', '|');
SELECT split_part(part_string, '|', 2) FROM test_split_part WHERE part_delimiter = '|';
+---------------------------------+
| split_part(part_string, '|', 2) |
+---------------------------------+
|                                 |
+---------------------------------+
drop table if exists test_split_part;
CREATE TABLE test_split_part (
    id INT AUTO_INCREMENT PRIMARY KEY,
    original_string VARCHAR(255),
    delimiter VARCHAR(10),
    split_part_1 VARCHAR(255) GENERATED ALWAYS AS (split_part(original_string, delimiter, 1)) STORED,
    split_part_2 VARCHAR(255) GENERATED ALWAYS AS (split_part(original_string, delimiter, 2)) STORED,
    split_part_3 VARCHAR(255) GENERATED ALWAYS AS (split_part(original_string, delimiter, 3)) STORED,
    split_part_4 VARCHAR(255) GENERATED ALWAYS AS (split_part(original_string, delimiter, 4)) STORED,
    split_part_neg_1 VARCHAR(255) GENERATED ALWAYS AS (split_part(original_string, delimiter, -1)) STORED,
    split_part_1_2 VARCHAR(255) GENERATED ALWAYS AS (split_part(original_string, delimiter, 1, 2)) STORED,
    split_part_1_3 VARCHAR(255) GENERATED ALWAYS AS (split_part(original_string, delimiter, 1, 3)) STORED,
    split_part_neg_4_neg_2 VARCHAR(255) GENERATED ALWAYS AS (split_part(original_string, delimiter, -4, -2)) STORED
);
INSERT INTO test_split_part (original_string, delimiter) VALUES
('a,b,c,d', ','),
('abc', NULL),
('1;2;3;4', ';'),
(NULL, ','),
('foo', '|');
SELECT id, original_string, delimiter,
       split_part_1, split_part_2, split_part_3, split_part_4,
       split_part_neg_1, split_part_1_2, split_part_1_3,
       split_part_neg_4_neg_2
FROM test_split_part;
+----+-----------------+-----------+--------------+--------------+--------------+--------------+------------------+----------------+----------------+------------------------+
| id | original_string | delimiter | split_part_1 | split_part_2 | split_part_3 | split_part_4 | split_part_neg_1 | split_part_1_2 | split_part_1_3 | split_part_neg_4_neg_2 |
+----+-----------------+-----------+--------------+--------------+--------------+--------------+------------------+----------------+----------------+------------------------+
|  1 | a,b,c,d         | ,         | a            | b            | c            | d            | d                | a,b            | a,b,c          | a,b,c                  |
|  2 | abc             | NULL      | NULL         | NULL         | NULL         | NULL         | NULL             | NULL           | NULL           | NULL                   |
|  3 | 1;2;3;4         | ;         | 1            | 2            | 3            | 4            | 4                | 1;2            | 1;2;3          | 1;2;3                  |
|  4 | NULL            | ,         | NULL         | NULL         | NULL         | NULL         | NULL             | NULL           | NULL           | NULL                   |
|  5 | foo             | |         | foo          |              |              |              | foo              | foo            | foo            |                        |
+----+-----------------+-----------+--------------+--------------+--------------+--------------+------------------+----------------+----------------+------------------------+
SELECT 
       split_part_1, split_part_2, split_part_3, split_part_4,
       split_part_neg_1, split_part_1_2, split_part_1_3,
       split_part_neg_4_neg_2
FROM test_split_part;
+--------------+--------------+--------------+--------------+------------------+----------------+----------------+------------------------+
| split_part_1 | split_part_2 | split_part_3 | split_part_4 | split_part_neg_1 | split_part_1_2 | split_part_1_3 | split_part_neg_4_neg_2 |
+--------------+--------------+--------------+--------------+------------------+----------------+----------------+------------------------+
| 1            | 2            | 3            | 4            | 4                | 1;2            | 1;2;3          | 1;2;3                  |
| NULL         | NULL         | NULL         | NULL         | NULL             | NULL           | NULL           | NULL                   |
| NULL         | NULL         | NULL         | NULL         | NULL             | NULL           | NULL           | NULL                   |
| a            | b            | c            | d            | d                | a,b            | a,b,c          | a,b,c                  |
| foo          |              |              |              | foo              | foo            | foo            |                        |
+--------------+--------------+--------------+--------------+------------------+----------------+----------------+------------------------+
SELECT split_part_1 FROM test_split_part;
+--------------+
| split_part_1 |
+--------------+
| 1            |
| NULL         |
| NULL         |
| a            |
| foo          |
+--------------+
SELECT split_part_2 FROM test_split_part;
+--------------+
| split_part_2 |
+--------------+
|              |
| 2            |
| NULL         |
| NULL         |
| b            |
+--------------+
SELECT split_part_neg_1 FROM test_split_part;
+------------------+
| split_part_neg_1 |
+------------------+
| 4                |
| NULL             |
| NULL             |
| d                |
| foo              |
+------------------+
SELECT split_part_1_3 FROM test_split_part;
+----------------+
| split_part_1_3 |
+----------------+
| 1;2;3          |
| NULL           |
| NULL           |
| a,b,c          |
| foo            |
+----------------+
SELECT split_part_neg_4_neg_2 FROM test_split_part;
+------------------------+
| split_part_neg_4_neg_2 |
+------------------------+
|                        |
| 1;2;3                  |
| NULL                   |
| NULL                   |
| a,b,c                  |
+------------------------+
### 不同表字符集下，SPLIT_PART/KEYVALUE的使用覆盖
SET NAMES 'GBK';
SELECT split_part('中,国,人,民', ',', 1) ;
+-----------------------------------+
| split_part('�,�,�,�', ',', 1)         |
+-----------------------------------+
| 中                                |
+-----------------------------------+
SELECT split_part(_gbk '中,国,人,民', ',', 1) ;
+----------------------------------------+
| split_part(_gbk '�,�,�,�', ',', 1)         |
+----------------------------------------+
| 中                                     |
+----------------------------------------+
Warnings:
Warning	1300	Invalid gbk character string: 'AD2CE5'
SELECT split_part(_gbk '中国人民', ',', 1) ;
+-----------------------------------------+
| split_part(_gbk '中国人民', ',', 1)     |
+-----------------------------------------+
| 中国人民                                |
+-----------------------------------------+
SELECT split_part(_gbk '中国人民', '', 1) ;
+----------------------------------------+
| split_part(_gbk '中国人民', '', 1)     |
+----------------------------------------+
| 中国人民                               |
+----------------------------------------+
SELECT split_part(_gbk '中 国 人 民', ' ', 1) ;
+--------------------------------------------+
| split_part(_gbk '中 国 人 民', ' ', 1)     |
+--------------------------------------------+
| 中                                         |
+--------------------------------------------+
Warnings:
Warning	1300	Invalid gbk character string: 'AD20E5'
SELECT split_part(_gbk 'Ox35D9', ' ', 1) ;
+-----------------------------------+
| split_part(_gbk 'Ox35D9', ' ', 1) |
+-----------------------------------+
| Ox35D9                            |
+-----------------------------------+
SET NAMES 'GB18030';
SELECT split_part('中,国,人,民', ',', -1) ;
+------------------------------------+
| split_part('�,�,�,�', ',', -1)         |
+------------------------------------+
| 民                                 |
+------------------------------------+
SELECT split_part(_gb18030 '中,国,人,民', ',', 1) ;
+--------------------------------------------+
| split_part(_gb18030 '�,�,�,�', ',', 1)         |
+--------------------------------------------+
| 中                                         |
+--------------------------------------------+
Warnings:
Warning	1300	Invalid gb18030 character string: 'AD2CE5'
SELECT split_part(_gb18030 '中国人民', ',', 1) ;
+---------------------------------------------+
| split_part(_gb18030 '中国人民', ',', 1)     |
+---------------------------------------------+
| 中国人民                                    |
+---------------------------------------------+
SELECT split_part(_gb18030 '中国人民', '', 1) ;
+--------------------------------------------+
| split_part(_gb18030 '中国人民', '', 1)     |
+--------------------------------------------+
| 中国人民                                   |
+--------------------------------------------+
SELECT split_part(_gb18030 '中 国 人 民', ' ', 1) ;
+------------------------------------------------+
| split_part(_gb18030 '中 国 人 民', ' ', 1)     |
+------------------------------------------------+
| 中                                             |
+------------------------------------------------+
Warnings:
Warning	1300	Invalid gb18030 character string: 'AD20E5'
SET NAMES 'UTF16';
ERROR 42000: Variable 'character_set_client' can't be set to the value of 'UTF16'
SELECT split_part('中,国,人,民', ',', 10) ;
+----------------------------------------+
| split_part('中,国,人,民', ',', 10)     |
+----------------------------------------+
|                                        |
+----------------------------------------+
SET NAMES 'SJIS';
SELECT split_part('漢,字,文,字', ',', 1) ;
+------------------------------------+
| split_part('漢,�,�,�', ',', 1)        |
+------------------------------------+
| 漢                                 |
+------------------------------------+
SELECT split_part(_SJIS '漢,国,人,民', ',', 1) ;
+--------------------------------------------+
| split_part(_SJIS '漢,国,人,�', ',', 1)      |
+--------------------------------------------+
| 漢                                         |
+--------------------------------------------+
Warnings:
Warning	1300	Invalid sjis character string: '91'
SELECT split_part(_SJIS '漢国人民', ',', 1) ;
+------------------------------------------+
| split_part(_SJIS '漢国人民', ',', 1)     |
+------------------------------------------+
| 漢国人民                                 |
+------------------------------------------+
Warnings:
Warning	1300	Invalid sjis character string: '91'
SELECT split_part(_SJIS '漢国人民', '', 1) ;
+-----------------------------------------+
| split_part(_SJIS '漢国人民', '', 1)     |
+-----------------------------------------+
| 漢国人民                                |
+-----------------------------------------+
Warnings:
Warning	1300	Invalid sjis character string: '91'
SELECT split_part(_SJIS '中漢 国 人 民', ' ', 1) ;
+------------------------------------------------+
| split_part(_SJIS '中漢 国 人 民', ' ', 1)      |
+------------------------------------------------+
| 中漢                                           |
+------------------------------------------------+
Warnings:
Warning	1300	Invalid sjis character string: '91'
SELECT split_part('中漢 国 人 民', ' ', 1) ;
+------------------------------------------+
| split_part('中漢 国 人 民', ' ', 1)      |
+------------------------------------------+
| 中漢                                     |
+------------------------------------------+
SET NAMES 'DEC8';
SELECT split_part('a,b,c,d', ',', -1) ;
+--------------------------------+
| split_part('a,b,c,d', ',', -1) |
+--------------------------------+
| d                              |
+--------------------------------+
SET NAMES 'LATIN1';
SELECT split_part('a,b,c,d', ',', 1, 2) ;
+----------------------------------+
| split_part('a,b,c,d', ',', 1, 2) |
+----------------------------------+
| a,b                              |
+----------------------------------+
SELECT split_part(_LATIN1 '漢,国,人,民', ',', 1) ;
+-----------------------------------------------+
| split_part(_LATIN1 '漢,国,人,民', ',', 1)     |
+-----------------------------------------------+
| 漢                                            |
+-----------------------------------------------+
SELECT split_part(_LATIN1 '漢国人民', ',', 1) ;
+--------------------------------------------+
| split_part(_LATIN1 '漢国人民', ',', 1)     |
+--------------------------------------------+
| 漢国人民                                   |
+--------------------------------------------+
SELECT split_part(_LATIN1 '漢国人民', '', 1) ;
+-------------------------------------------+
| split_part(_LATIN1 '漢国人民', '', 1)     |
+-------------------------------------------+
| 漢国人民                                  |
+-------------------------------------------+
SELECT split_part(_LATIN1 '中漢 国 人 民', ' ', 1) ;
+--------------------------------------------------+
| split_part(_LATIN1 '中漢 国 人 民', ' ', 1)      |
+--------------------------------------------------+
| 中漢                                             |
+--------------------------------------------------+
SET NAMES 'utf8mb4';
drop table if exists split_part_test;
CREATE TABLE split_part_test (
    id INT AUTO_INCREMENT PRIMARY KEY,
    test_string VARCHAR(255) CHARACTER SET utf8mb4,
    binary_string BINARY(255),
    gbk_string VARCHAR(255) CHARACTER SET gbk,
    gb18030_string VARCHAR(255) CHARACTER SET gb18030,
    latin1_string VARCHAR(255) CHARACTER SET latin1
);
INSERT INTO split_part_test (test_string, binary_string, gbk_string, gb18030_string, latin1_string) VALUES
('a,b,c,d', _binary 'a,b,c,d', 'a,b,c,d', 'a,b,c,d' , 'a,b,c,d' );
SELECT split_part(test_string, ',', 1) FROM split_part_test;
+---------------------------------+
| split_part(test_string, ',', 1) |
+---------------------------------+
| a                               |
+---------------------------------+
SELECT split_part(test_string, ',', 2) FROM split_part_test;
+---------------------------------+
| split_part(test_string, ',', 2) |
+---------------------------------+
| b                               |
+---------------------------------+
SELECT split_part(test_string, ',', 3) FROM split_part_test;
+---------------------------------+
| split_part(test_string, ',', 3) |
+---------------------------------+
| c                               |
+---------------------------------+
SELECT split_part(test_string, ',', -1) FROM split_part_test;
+----------------------------------+
| split_part(test_string, ',', -1) |
+----------------------------------+
| d                                |
+----------------------------------+
SELECT split_part(test_string, ',', 10) FROM split_part_test;
+----------------------------------+
| split_part(test_string, ',', 10) |
+----------------------------------+
|                                  |
+----------------------------------+
SELECT split_part(binary_string, ',', 1) FROM split_part_test;
+-----------------------------------+
| split_part(binary_string, ',', 1) |
+-----------------------------------+
| a                                 |
+-----------------------------------+
SELECT split_part(gbk_string, ',', 1) FROM split_part_test;
+--------------------------------+
| split_part(gbk_string, ',', 1) |
+--------------------------------+
| a                              |
+--------------------------------+
SELECT split_part(gb18030_string, ',', 1) FROM split_part_test;
+------------------------------------+
| split_part(gb18030_string, ',', 1) |
+------------------------------------+
| a                                  |
+------------------------------------+
SELECT split_part(latin1_string, ',', 1) FROM split_part_test;
+-----------------------------------+
| split_part(latin1_string, ',', 1) |
+-----------------------------------+
| a                                 |
+-----------------------------------+
SELECT split_part(test_string, ',', 1, 2) FROM split_part_test;
+------------------------------------+
| split_part(test_string, ',', 1, 2) |
+------------------------------------+
| a,b                                |
+------------------------------------+
SELECT split_part(test_string, ',', 1, 3) FROM split_part_test;
+------------------------------------+
| split_part(test_string, ',', 1, 3) |
+------------------------------------+
| a,b,c                              |
+------------------------------------+
SELECT split_part(test_string, ',', -4, -2) FROM split_part_test;
+--------------------------------------+
| split_part(test_string, ',', -4, -2) |
+--------------------------------------+
| a,b,c                                |
+--------------------------------------+
SELECT split_part(test_string, ',', 1, 10) FROM split_part_test;
+-------------------------------------+
| split_part(test_string, ',', 1, 10) |
+-------------------------------------+
| a,b,c,d                             |
+-------------------------------------+
SELECT split_part(binary_string, ',', 1, 2) FROM split_part_test;
+--------------------------------------+
| split_part(binary_string, ',', 1, 2) |
+--------------------------------------+
| a,b                                  |
+--------------------------------------+
SELECT split_part(gbk_string, ',', 1, 2) FROM split_part_test;
+-----------------------------------+
| split_part(gbk_string, ',', 1, 2) |
+-----------------------------------+
| a,b                               |
+-----------------------------------+
SELECT split_part(gb18030_string, ',', 1, 2) FROM split_part_test;
+---------------------------------------+
| split_part(gb18030_string, ',', 1, 2) |
+---------------------------------------+
| a,b                                   |
+---------------------------------------+
SELECT split_part(latin1_string, ',', 1, 2) FROM split_part_test;
+--------------------------------------+
| split_part(latin1_string, ',', 1, 2) |
+--------------------------------------+
| a,b                                  |
+--------------------------------------+
SELECT split_part(NULL, ',', 1) FROM split_part_test;
+--------------------------+
| split_part(NULL, ',', 1) |
+--------------------------+
| NULL                     |
+--------------------------+
SELECT split_part(test_string, NULL, 1) FROM split_part_test;
+----------------------------------+
| split_part(test_string, NULL, 1) |
+----------------------------------+
| NULL                             |
+----------------------------------+
SELECT split_part(test_string, ',', NULL) FROM split_part_test;
+------------------------------------+
| split_part(test_string, ',', NULL) |
+------------------------------------+
| NULL                               |
+------------------------------------+
### 其他场景补充
SELECT split_part(NULL, ',', 1) ;
+--------------------------+
| split_part(NULL, ',', 1) |
+--------------------------+
| NULL                     |
+--------------------------+
SELECT split_part('a,b,c,d', NULL, 1) ;
+--------------------------------+
| split_part('a,b,c,d', NULL, 1) |
+--------------------------------+
| NULL                           |
+--------------------------------+
SELECT split_part('a,b,c,d', ',', NULL) ;
+----------------------------------+
| split_part('a,b,c,d', ',', NULL) |
+----------------------------------+
| NULL                             |
+----------------------------------+
SELECT split_part('a,b,c,d', ',', 0) ;
+-------------------------------+
| split_part('a,b,c,d', ',', 0) |
+-------------------------------+
| a                             |
+-------------------------------+
SELECT split_part('a,b,c,d', ',', -1) ;
+--------------------------------+
| split_part('a,b,c,d', ',', -1) |
+--------------------------------+
| d                              |
+--------------------------------+
SELECT split_part('a,b,c,d', ',', 10) ;
+--------------------------------+
| split_part('a,b,c,d', ',', 10) |
+--------------------------------+
|                                |
+--------------------------------+
SELECT split_part('a,b,c,d', ',', 1, NULL) ;
+-------------------------------------+
| split_part('a,b,c,d', ',', 1, NULL) |
+-------------------------------------+
| NULL                                |
+-------------------------------------+
SELECT split_part('a,b,c,d', ',', 1, -2) ;
ERROR HY000: Incorrect arguments to SPLIT_PART function. The end part must be greater than start part.
SELECT split_part('abcdef', ',', 1) ;
+------------------------------+
| split_part('abcdef', ',', 1) |
+------------------------------+
| abcdef                       |
+------------------------------+
SELECT split_part('abcdef', ',', 2) ;
+------------------------------+
| split_part('abcdef', ',', 2) |
+------------------------------+
|                              |
+------------------------------+
#Environmental cleaning
DROP DATABASE db1;
purge recyclebin;
