result_format: 4
alter system set _enable_defensive_check = 2;
set binlog_row_image=MINIMAL;
use test;

drop table if exists t1;
CREATE TABLE `t1` (
  `payment_id` varchar(32) NOT NULL,
  `apply_id` varchar(32) DEFAULT NULL,
  `row_id` bigint(20) DEFAULT NULL,
  `partition_id` varchar(10) GENERATED ALWAYS AS (substr(`payment_id`,1,1)) VIRTUAL,
  `v1` varchar(32) DEFAULT NULL,
  `v1_check` bigint(20) DEFAULT NULL,
  `gmt_create` timestamp(6) NULL DEFAULT "2022-10-12 20:58:26.702383",
  `gmt_modified` timestamp(6) NULL DEFAULT "2022-10-12 20:58:26.702383",
  PRIMARY KEY (`payment_id`)
) DEFAULT CHARSET = utf8mb4 ROW_FORMAT = DYNAMIC COMPRESSION = 'zstd_1.3.8' REPLICA_NUM = 3 BLOCK_SIZE = 16384 USE_BLOOM_FILTER = FALSE TABLET_SIZE = 134217728 PCTFREE = 0
 partition by list columns(partition_id)
(partition p0 values in ('0'),
partition p1 values in ('1'),
partition p2 values in ('2'),
partition p3 values in ('3'),
partition p4 values in ('4'),
partition p5 values in ('5'),
partition p6 values in ('6'),
partition p7 values in ('7'),
partition p8 values in ('8'),
partition p9 values in ('9'));
insert into t1(payment_id, apply_id, row_id, v1, v1_check) values('5_5065', '5_5065', '5065', 'tfRhwSXhEqkpmzfODkpvQKRW7ZHhKU4P', '3370978187');
delete from t1 where payment_id=  '5_5065';
select * from t1;
+------------+----------+--------+--------------+------+----------+------------+--------------+
| payment_id | apply_id | row_id | partition_id | v1   | v1_check | gmt_create | gmt_modified |
+------------+----------+--------+--------------+------+----------+------------+--------------+
+------------+----------+--------+--------------+------+----------+------------+--------------+
drop table t1;

drop table if exists t2;
CREATE TABLE `t2` (
  `payment_id` varchar(32) NOT NULL,
  `apply_id` varchar(32) DEFAULT NULL,
  `row_id` bigint(20) NOT NULL,
  `partition_id` varchar(50) GENERATED ALWAYS AS (concat(`payment_id`,`v1`)) VIRTUAL,
  `v1` varchar(32) NOT NULL,
  `v1_check` bigint(20) DEFAULT NULL,
  `gmt_create` timestamp(6) NULL DEFAULT "2022-10-12 20:58:26.702383",
  `gmt_modified` timestamp(6) NULL DEFAULT "2022-10-12 20:58:26.702383",
  PRIMARY KEY (`payment_id`,`v1`)
) DEFAULT CHARSET = utf8mb4 ROW_FORMAT = DYNAMIC COMPRESSION = 'zstd_1.3.8' REPLICA_NUM = 3 BLOCK_SIZE = 16384 USE_BLOOM_FILTER = FALSE TABLET_SIZE = 134217728 PCTFREE = 0
 partition by list columns(partition_id)
(partition p0 values in ('0'),
partition p1 values in ('1'),
partition p2 values in ('2'),
partition p3 values in ('3'),
partition p4 values in ('4'),
partition p5 values in ('5_5065tfRhwSXhEqkpmzfODkpvQKRW7ZHhKU4P'),
partition p6 values in ('6'),
partition p7 values in ('7'),
partition p8 values in ('8'),
partition p9 values in ('9'));
insert into t2(payment_id, apply_id, row_id, v1, v1_check) values('5_5065', '5_5065', '5065', 'tfRhwSXhEqkpmzfODkpvQKRW7ZHhKU4P', '3370978187');
delete from t2 where payment_id=  '5_5065';
select * from t2;
+------------+----------+--------+--------------+----+----------+------------+--------------+
| payment_id | apply_id | row_id | partition_id | v1 | v1_check | gmt_create | gmt_modified |
+------------+----------+--------+--------------+----+----------+------------+--------------+
+------------+----------+--------+--------------+----+----------+------------+--------------+
drop table t2;

drop table if exists t3;
CREATE TABLE `t3` (
  `payment_id` varchar(32) NOT NULL,
  `apply_id` varchar(32) DEFAULT NULL,
  `row_id` bigint(20) NOT NULL,
  `partition_id` varchar(10) GENERATED ALWAYS AS (substr(`payment_id`,1,1)) VIRTUAL,
  `v1` varchar(32) DEFAULT NULL,
  `v1_check` bigint(20) DEFAULT NULL,
  `gmt_create` timestamp(6) NULL DEFAULT "2022-10-12 20:58:26.702383",
  `gmt_modified` timestamp(6) NULL DEFAULT "2022-10-12 20:58:26.702383",
  PRIMARY KEY (`payment_id`,`row_id`)
) DEFAULT CHARSET = utf8mb4 ROW_FORMAT = DYNAMIC COMPRESSION = 'zstd_1.3.8' REPLICA_NUM = 3 BLOCK_SIZE = 16384 USE_BLOOM_FILTER = FALSE TABLET_SIZE = 134217728 PCTFREE = 0
 partition by range(row_id)
 SUBPARTITION by list columns(partition_id) subpartition template
(SUBPARTITION sp0 values in ('0'),
SUBPARTITION sp1 values in ('1'),
SUBPARTITION sp2 values in ('2'),
SUBPARTITION sp3 values in ('3'),
SUBPARTITION sp4 values in ('4'),
SUBPARTITION sp5 values in ('5'),
SUBPARTITION sp6 values in ('6'),
SUBPARTITION sp7 values in ('7'),
SUBPARTITION sp8 values in ('8'),
SUBPARTITION sp9 values in ('9'))
(
  PARTITION p0 values less than(3000),
  PARTITION p1 values less than(6000),
  PARTITION p2 values less than(9000)
)
;
insert into t3(payment_id, apply_id, row_id, v1, v1_check) values('5_5065', '5_5065', '5065', 'tfRhwSXhEqkpmzfODkpvQKRW7ZHhKU4P', '3370978187');
delete from t3 where payment_id=  '5_5065';
select * from t3;
+------------+----------+--------+--------------+------+----------+------------+--------------+
| payment_id | apply_id | row_id | partition_id | v1   | v1_check | gmt_create | gmt_modified |
+------------+----------+--------+--------------+------+----------+------------+--------------+
+------------+----------+--------+--------------+------+----------+------------+--------------+
drop table t3;

alter system set _enable_defensive_check = 1;
set binlog_row_image=FULL;
