drop table if exists t1;
drop table if exists t2;
drop table if exists t3;
drop table if exists t4;
drop table if exists t5;
drop table if exists t6;
drop table if exists t7;
drop table if exists t8;
drop table if exists t9;
set @@binlog_row_image = 'MINIMAL';
create table t1(c1 int, c2 int, c3 int, c4 int, primary key(c1 ,c2));
insert into t1 values(1,2,3,4),(5,6,7,8),(9,10,11,12),(13,14,15,16),(17,18,19,20);
delete from t1 where c1 < 10;
select * from t1;
c1	c2	c3	c4
13	14	15	16
17	18	19	20
create table t2(c1 int, c2 int, c3 int, c4 int,  c5 int as (c2 + c3) virtual, primary key(c3 ,c2)) partition by hash(c5) partitions 4;
insert into t2(c1,c2,c3,c4) values(1,2,3,4),(5,6,7,8),(9,10,11,12),(13,14,15,16),(17,18,19,20);
select * from t2 order by c1;
c1	c2	c3	c4	c5
1	2	3	4	5
5	6	7	8	13
9	10	11	12	21
13	14	15	16	29
17	18	19	20	37
delete from t2 where c2 < 10;
select * from t2 order by c1;
c1	c2	c3	c4	c5
9	10	11	12	21
13	14	15	16	29
17	18	19	20	37
create table t3(c1 int, c2 int, c3 int, c4 int, c5 int as (c1 + c2)) partition by hash(c5) partitions 4;
insert into t3(c1,c2,c3,c4) values(1,2,3,4),(5,6,7,8),(9,10,11,12),(13,14,15,16),(17,18,19,20);
delete from t3 where c2 < 10;
select * from t3;
c1	c2	c3	c4	c5
9	10	11	12	19
13	14	15	16	27
17	18	19	20	35
create table t4(c1 int, c2 int, c3 int, c4 int, c5 int as (c1 + c2)) partition by hash(c5) partitions 4;
create unique index t4_idx_01 on t4(c4, c5) local;
insert into t4(c1,c2,c3,c4) values(1,2,3,4),(5,6,7,8),(9,10,11,12),(13,14,15,16),(17,18,19,20);
delete from t4 where c2 < 10;
explain select /*+index(t4 t4_idx_01)*/ c4 from t4;
Query Plan
==================================================================
|ID|OPERATOR                 |NAME         |EST.ROWS|EST.TIME(us)|
------------------------------------------------------------------
|0 |PX COORDINATOR           |             |3       |11          |
|1 |└─EXCHANGE OUT DISTR     |:EX10000     |3       |10          |
|2 |  └─PX PARTITION ITERATOR|             |3       |9           |
|3 |    └─TABLE FULL SCAN    |t4(t4_idx_01)|3       |9           |
==================================================================
Outputs & filters:
-------------------------------------
  0 - output([INTERNAL_FUNCTION(t4.c4)]), filter(nil), rowset=16
  1 - output([INTERNAL_FUNCTION(t4.c4)]), filter(nil), rowset=16
      dop=1
  2 - output([t4.c4]), filter(nil), rowset=16
      force partition granule
  3 - output([t4.c4]), filter(nil), rowset=16
      access([t4.c4]), partitions(p[0-3])
      is_index_back=false, is_global_index=false, 
      range_key([t4.c4], [t4.c5], [t4.shadow_pk_0]), range(MIN,MIN,MIN ; MAX,MAX,MAX)always true
select /*+index(t4 t4_idx_01)*/ c4 from t4;
c4
12
16
20
select * from t4;
c1	c2	c3	c4	c5
9	10	11	12	19
13	14	15	16	27
17	18	19	20	35
create table t5(c1 int, c2 int, c3 int, c4 int not null, c5 int as (c1 + c2) not null) partition by hash(c5) partitions 4;
create unique index t5_idx_01 on t5(c4, c5) local;
insert into t5(c1,c2,c3,c4) values(1,2,3,4),(5,6,7,8),(9,10,11,12),(13,14,15,16),(17,18,19,20);
delete from t5 where c2 < 10;
select * from t5 order by c1;
c1	c2	c3	c4	c5
9	10	11	12	19
13	14	15	16	27
17	18	19	20	35
explain select /*+index(t5 t5_idx_01)*/ c4 from t5;
Query Plan
==================================================================
|ID|OPERATOR                 |NAME         |EST.ROWS|EST.TIME(us)|
------------------------------------------------------------------
|0 |PX COORDINATOR           |             |3       |11          |
|1 |└─EXCHANGE OUT DISTR     |:EX10000     |3       |10          |
|2 |  └─PX PARTITION ITERATOR|             |3       |9           |
|3 |    └─TABLE FULL SCAN    |t5(t5_idx_01)|3       |9           |
==================================================================
Outputs & filters:
-------------------------------------
  0 - output([INTERNAL_FUNCTION(t5.c4)]), filter(nil), rowset=16
  1 - output([INTERNAL_FUNCTION(t5.c4)]), filter(nil), rowset=16
      dop=1
  2 - output([t5.c4]), filter(nil), rowset=16
      force partition granule
  3 - output([t5.c4]), filter(nil), rowset=16
      access([t5.c4]), partitions(p[0-3])
      is_index_back=false, is_global_index=false, 
      range_key([t5.c4], [t5.c5], [t5.shadow_pk_0]), range(MIN,MIN,MIN ; MAX,MAX,MAX)always true
select /*+index(t5 t5_idx_01)*/ c4 from t5;
c4
12
16
20
drop table t5;
create table t5(c1 int, c2 int, c3 int, c4 int not null, c5 int as (c1 + c2) not null) partition by hash(c5) partitions 4;
create unique index t5_idx_01 on t5(c4, c5) global;
insert into t5(c1,c2,c3,c4) values(1,2,3,4),(5,6,7,8),(9,10,11,12),(13,14,15,16),(17,18,19,20);
delete from t5 where c2 < 10;
select * from t5 order by c1;
c1	c2	c3	c4	c5
9	10	11	12	19
13	14	15	16	27
17	18	19	20	35
explain select /*+index(t5 t5_idx_01)*/ c4 from t5;
Query Plan
========================================================
|ID|OPERATOR       |NAME         |EST.ROWS|EST.TIME(us)|
--------------------------------------------------------
|0 |TABLE FULL SCAN|t5(t5_idx_01)|3       |3           |
========================================================
Outputs & filters:
-------------------------------------
  0 - output([t5.c4]), filter(nil), rowset=16
      access([t5.c4]), partitions(p0)
      is_index_back=false, is_global_index=true, 
      range_key([t5.c4], [t5.c5], [t5.shadow_pk_0], [t5.shadow_pk_1]), range(MIN,MIN,MIN,MIN ; MAX,MAX,MAX,MAX)always true
select /*+index(t5 t5_idx_01)*/ c4 from t5;
c4
12
16
20
create table t6(c1 int, c2 int, c3 int, c4 int not null, c5 int generated always  as (c1 + c2) STORED not null) partition by hash(c5) partitions 4;
create unique index t6_idx_01 on t6(c4, c5) local;
insert into t6(c1,c2,c3,c4) values(1,2,3,4),(5,6,7,8),(9,10,11,12),(13,14,15,16),(17,18,19,20);
delete from t6 where c2 < 10;
select * from t6 order by c1;
c1	c2	c3	c4	c5
9	10	11	12	19
13	14	15	16	27
17	18	19	20	35
explain select /*+index(t6 t6_idx_01)*/ c4 from t6;
Query Plan
==================================================================
|ID|OPERATOR                 |NAME         |EST.ROWS|EST.TIME(us)|
------------------------------------------------------------------
|0 |PX COORDINATOR           |             |3       |11          |
|1 |└─EXCHANGE OUT DISTR     |:EX10000     |3       |10          |
|2 |  └─PX PARTITION ITERATOR|             |3       |9           |
|3 |    └─TABLE FULL SCAN    |t6(t6_idx_01)|3       |9           |
==================================================================
Outputs & filters:
-------------------------------------
  0 - output([INTERNAL_FUNCTION(t6.c4)]), filter(nil), rowset=16
  1 - output([INTERNAL_FUNCTION(t6.c4)]), filter(nil), rowset=16
      dop=1
  2 - output([t6.c4]), filter(nil), rowset=16
      force partition granule
  3 - output([t6.c4]), filter(nil), rowset=16
      access([t6.c4]), partitions(p[0-3])
      is_index_back=false, is_global_index=false, 
      range_key([t6.c4], [t6.c5], [t6.shadow_pk_0]), range(MIN,MIN,MIN ; MAX,MAX,MAX)always true
select /*+index(t6 t6_idx_01)*/ c4 from t6;
c4
12
16
20
create table t7(c1 int, c2 int, c3 int, c4 int, primary key(c1,c2), c5 int as (c1 + c3));
create unique index t7_idx_01 on t7(c5) local;
insert into t7(c1,c2,c3,c4) values(1,2,3,4),(5,6,7,8),(9,10,11,12),(13,14,15,16),(17,18,19,20);
delete from t7 where c2 < 10;
select * from t7 order by c1;
c1	c2	c3	c4	c5
9	10	11	12	20
13	14	15	16	28
17	18	19	20	36
explain select /*+index(t7 t7_idx_01)*/ c4 from t7;
Query Plan
========================================================
|ID|OPERATOR       |NAME         |EST.ROWS|EST.TIME(us)|
--------------------------------------------------------
|0 |TABLE FULL SCAN|t7(t7_idx_01)|3       |17          |
========================================================
Outputs & filters:
-------------------------------------
  0 - output([t7.c4]), filter(nil), rowset=16
      access([t7.c1], [t7.c2], [t7.c4]), partitions(p0)
      is_index_back=true, is_global_index=false, 
      range_key([t7.c5], [t7.shadow_pk_0], [t7.shadow_pk_1]), range(MIN,MIN,MIN ; MAX,MAX,MAX)always true
select /*+index(t7 t7_idx_01)*/ c4 from t7;
c4
12
16
20
create table t8(c1 int, c2 int, c3 int, c4 int, primary key(c1,c2)) partition by hash(c1) partitions 4;
create unique index t8_idx_01 on t8(c1,c4) local;
insert into t8(c1,c2,c3,c4) values(1,2,3,4),(5,6,7,8),(9,10,11,12),(13,14,15,16),(17,18,19,20);
delete from t8 where c2 < 10;
select * from t8 order by c1;
c1	c2	c3	c4
9	10	11	12
13	14	15	16
17	18	19	20
explain select /*+index(t8 t8_idx_01)*/ c4 from t8;
Query Plan
==================================================================
|ID|OPERATOR                 |NAME         |EST.ROWS|EST.TIME(us)|
------------------------------------------------------------------
|0 |PX COORDINATOR           |             |3       |11          |
|1 |└─EXCHANGE OUT DISTR     |:EX10000     |3       |10          |
|2 |  └─PX PARTITION ITERATOR|             |3       |9           |
|3 |    └─TABLE FULL SCAN    |t8(t8_idx_01)|3       |9           |
==================================================================
Outputs & filters:
-------------------------------------
  0 - output([INTERNAL_FUNCTION(t8.c4)]), filter(nil), rowset=16
  1 - output([INTERNAL_FUNCTION(t8.c4)]), filter(nil), rowset=16
      dop=1
  2 - output([t8.c4]), filter(nil), rowset=16
      force partition granule
  3 - output([t8.c4]), filter(nil), rowset=16
      access([t8.c4]), partitions(p[0-3])
      is_index_back=false, is_global_index=false, 
      range_key([t8.c1], [t8.c4], [t8.shadow_pk_0], [t8.shadow_pk_1]), range(MIN,MIN,MIN,MIN ; MAX,MAX,MAX,MAX)always true
select /*+index(t8 t8_idx_01)*/ c4 from t8;
c4
12
16
20
CREATE TABLE t9(c1 int NOT NULL PRIMARY KEY,c2 POINT NOT NULL, c3 LINESTRING NOT NULL,c4 POLYGON NOT NULL,c5 GEOMETRY NOT NULL) ENGINE=InnoDB;
ALTER TABLE t9  ENGINE InnoDB;
INSERT INTO t9(c1,c2,c3,c4,c5) VALUES(1, ST_GeomFromText('POINT(4 4)'),ST_GeomFromText('LINESTRING(130 130,140 140,150 150)'), ST_GeomFromText('POLYGON((7 1,6 2,6 3,10 3,10 1,7 1))'), ST_GeomFromText('POLYGON((4 -2,5 -4,6 -5,7 -4,7 2,4 -2))'));
ALTER TABLE t9 ADD INDEX idx6(c4(10)) USING BTREE;
delete from t9;
set @@binlog_row_image = 'FULL';
drop table t1;
drop table t2;
drop table t3;
drop table t4;
drop table t5;
drop table t6;
drop table t7;
drop table t8;
drop table t9;
