purge recyclebin;
drop database IF EXISTS oblrp;
create database oblrp;
use oblrp;
set timestamp = 1600000000;
set ob_trx_timeout = 10000000000;
set ob_query_timeout = 10000000000;
result_format: 4
ob_mysql_set_1
ob_mysql_set_1_1
drop table tt1;
create table tt1(id int,a varchar(20),d date);
insert into tt1 values(1,'test01','2022-3-2');
insert into tt1 values(2,'test02','2022-3-3');
insert into tt1 values(3,'test03','2022-3-3');
drop table tt2;
create table tt2(id int,a varchar(20),d date);
insert into tt2 values(3,'test03','2022-3-2');
drop table tt3;
create table tt3(id int,a varchar(20),d date);
insert into tt3 values(3,'test03','2022-3-2');
set @a=(select 1);
select @a;
+------+
| @a   |
+------+
|    1 |
+------+
set @a=(select 1 from tt1);
ERROR 21000: Subquery returns more than 1 row
select @a;
+------+
| @a   |
+------+
|    1 |
+------+
set @id=1+(select a.id from tt2 a inner join tt1 b on a.Id=b.id and a.a=b.a
inner join tt3 tpl on a.id=tpl.id
where a.a = 'test03' and a.d='2022-3-2');
select @id;
+------+
| @id  |
+------+
|    4 |
+------+
set @a=(select 1 from tt1)+(select id from tt1);
ERROR 21000: Subquery returns more than 1 row
set @a=+(select 2 from tt1 where id =2);
select @a;
+------+
| @a   |
+------+
|    2 |
+------+
set @a=(select (select 2 from tt1 where id =2));
select @a;
+------+
| @a   |
+------+
|    2 |
+------+
set @a=(select id from tt2 union select id from tt2);
select @a;
+------+
| @a   |
+------+
|    3 |
+------+
set @a=(SELECT d as test FROM tt1 WHERE ROW(id,a) = (SELECT id, a FROM tt2 WHERE id = 3));
select @a;
+------------+
| @a         |
+------------+
| 2022-03-03 |
+------------+
set @a=(SELECT * FROM tt1 WHERE (id,a) = (3,'test03'));
ERROR 21000: Operand should contain 1 column(s)
set @a=(SELECT a FROM tt1 WHERE (id,a) = (3,'test03'));
select @a;
+--------+
| @a     |
+--------+
| test03 |
+--------+
set @a=(select 2,1 from tt1 where id =2);
ERROR 21000: Operand should contain 1 column(s)
select @a;
+--------+
| @a     |
+--------+
| test03 |
+--------+
set @a=(select 2,1 from tt1 where id =2),@b=(select id from tt1);
ERROR 21000: Operand should contain 1 column(s)
set @a=(select id,a,d from tt1 where id =2),@b=(select id from tt2);
ERROR 21000: Operand should contain 1 column(s)
set @a=(select null from tt1 where id =2);
select @a;
+------+
| @a   |
+------+
| NULL |
+------+
set @a=-(select id from tt2);
select @a;
+------+
| @a   |
+------+
|   -3 |
+------+
set @a=(select a from tt2);
select @a;
+--------+
| @a     |
+--------+
| test03 |
+--------+
set @a=(select d as d1 from tt2);
select @a;
+------------+
| @a         |
+------------+
| 2022-03-02 |
+------------+
set @a=(select * from tt1);
ERROR 21000: Operand should contain 1 column(s)
set @a=(select id  from tt1 where id=4);
select @a;
+------+
| @a   |
+------+
| NULL |
+------+
set @a=(select id  from tt1 where id=(select max(id) from tt2));
select @a;
+------+
| @a   |
+------+
|    3 |
+------+
set @a:=(select id  from tt1 where id=4);
select @a;
+------+
| @a   |
+------+
| NULL |
+------+
set @a=(select distinct id  from tt1 where id=2);
select @a;
+------+
| @a   |
+------+
|    2 |
+------+
set @a=(select a from tt1 where id <2);
select @a;
+--------+
| @a     |
+--------+
| test01 |
+--------+
set @a=(select a from tt1 where id <2);
select @a;
+--------+
| @a     |
+--------+
| test01 |
+--------+
set @a=(select d from tt1 where id <=2);
ERROR 21000: Subquery returns more than 1 row
select @a;
+--------+
| @a     |
+--------+
| test01 |
+--------+
set @a=(select d from tt1 where id <=1);
select @a;
+------------+
| @a         |
+------------+
| 2022-03-02 |
+------------+
set @a=(select id from tt1 where a in (select a from tt2 union select a from tt3 ));
select @a;
+------+
| @a   |
+------+
|    3 |
+------+
set @a=(select d from tt1 where id <=1);
select @a;
+------------+
| @a         |
+------------+
| 2022-03-02 |
+------------+
set @a=(select d from tt1 where id >2);
select @a;
+------------+
| @a         |
+------------+
| 2022-03-03 |
+------------+
set @a=(select id from tt1 where id >=3);
select @a;
+------+
| @a   |
+------+
|    3 |
+------+
set @a=(select id from tt2 where id !=1);
select @a;
+------+
| @a   |
+------+
|    3 |
+------+
set @a=(select a from tt2 where id <>1);
select @a;
+--------+
| @a     |
+--------+
| test03 |
+--------+
set @a=(select d from tt1 where id <=2 limit 1);
select @a;
+------------+
| @a         |
+------------+
| 2022-03-02 |
+------------+
set @a=(select a from tt1 where id in ((select 1),(select 5)));
select @a;
+--------+
| @a     |
+--------+
| test01 |
+--------+
set @a=(select a from tt1 where id not in ((select 1),(select 2)));
select @a;
+--------+
| @a     |
+--------+
| test03 |
+--------+
set @a=(select id from tt1 where id in (1,5));
select @a;
+------+
| @a   |
+------+
|    1 |
+------+
set @a=(select d from tt1 where id not in (1,2));
select @a;
+------------+
| @a         |
+------------+
| 2022-03-03 |
+------------+
set @a:=(select d from tt1 where id not in (1,2));
select @a;
+------------+
| @a         |
+------------+
| 2022-03-03 |
+------------+
set @a=(select d from tt1 where id not in (1,2));
select @a;
+------------+
| @a         |
+------------+
| 2022-03-03 |
+------------+
set @a=(select d from tt1 where id between 3 and 4);
select @a;
+------------+
| @a         |
+------------+
| 2022-03-03 |
+------------+
set @a=(select id from tt1 where a like '%03');
select @a;
+------+
| @a   |
+------+
|    3 |
+------+
set @a=2*(select id from tt1 where a like '%03');
select @a;
+------+
| @a   |
+------+
|    6 |
+------+
set @a=(1+(select id from tt1 where a not like '%03' and id=1));
select @a;
+------+
| @a   |
+------+
|    2 |
+------+
set @a=(1+(select id from tt1 where a not like '%03' and id=1)),@b=(1+(select id from tt1 where a not like '%03'));
ERROR 21000: Subquery returns more than 1 row
set @a=(select id from tt1 where id =3 or id=1);
ERROR 21000: Subquery returns more than 1 row
set @a=(select id from tt1 where id =3 and a='test03');
select @a;
+------+
| @a   |
+------+
|    3 |
+------+
set @a=(select id from tt1 where id =3 and a='test03') div 2;
select @a;
+------+
| @a   |
+------+
|    1 |
+------+
set @a=(select id from tt1 where id is not null);
ERROR 21000: Subquery returns more than 1 row
set @a=(select id from tt1 where id is  null);
select @a;
+------+
| @a   |
+------+
| NULL |
+------+
set @a=(select id from tt2 where 1=1);
select @a;
+------+
| @a   |
+------+
|    3 |
+------+
set @a=(select tt2.a from tt2 limit 1);
select @a;
+--------+
| @a     |
+--------+
| test03 |
+--------+
set @a=(select tt2.id as id1 from tt2 order by id);
select @a;
+------+
| @a   |
+------+
|    3 |
+------+
set @a=(select tt2.id as id1 from tt2 where id =3 order by id asc );
select @a;
+------+
| @a   |
+------+
|    3 |
+------+
set @a=(select d from tt1 where a='test03' order by id);
select @a;
+------------+
| @a         |
+------------+
| 2022-03-03 |
+------------+
set @a=(select id from tt1 where a='test03' group by id);
select @a;
+------+
| @a   |
+------+
|    3 |
+------+
set @a=(select sum(id) from tt1 group by id having sum(id)>3);
select @a;
+------+
| @a   |
+------+
| NULL |
+------+
set @a=(select sum(id) from tt1 where id>1 and id<4 group by id having sum(id)>3);
select @a;
+------+
| @a   |
+------+
| NULL |
+------+
set @a=(select (case when id =1 then 5 end) from tt1);
ERROR 21000: Subquery returns more than 1 row
set @a=(select (case when id =1 then 5 end) from tt1 where id=1);
select @a;
+------+
| @a   |
+------+
|    5 |
+------+
set @a=(select id from tt1 group by id,case when a='test03' then '3' else '4' end);
ERROR 21000: Subquery returns more than 1 row
set @a=(select id from tt2 group by id,case when a='test01' then '3' else '4' end);
select @a;
+------+
| @a   |
+------+
|    3 |
+------+
set @a=(with temp as (select * from tt2) select id from temp);
select @a;
+------+
| @a   |
+------+
|    3 |
+------+
set @a=(select d from tt2 where exists  (select id from tt1 where id in (select id from tt2 order by a asc)));
select @a;
+------------+
| @a         |
+------------+
| 2022-03-02 |
+------------+
set @a=(select id from tt2 where not exists  (select id from tt1 where id>10));
select @a;
+------+
| @a   |
+------+
|    3 |
+------+
set @a=(select id from tt1 where id >=some(select id from tt1));
ERROR 21000: Subquery returns more than 1 row
set @a=(select id from tt2 where id >=some(select id from tt1));
select @a;
+------+
| @a   |
+------+
|    3 |
+------+
set @a=(select id from tt2 where id >=any(select id from tt1));
select @a;
+------+
| @a   |
+------+
|    3 |
+------+
set @a=(select id from tt2 where id <all(select id from tt1));
select @a;
+------+
| @a   |
+------+
| NULL |
+------+
set @a=(select a from (select a from tt1 where id=1) tt4);
select @a;
+--------+
| @a     |
+--------+
| test01 |
+--------+
set @a=(select id from (select id from tt1 where id >(select 2)) tt5);
select @a;
+------+
| @a   |
+------+
|    3 |
+------+
set @a=(select id from tt2 where id =(select id from tt1 where id=3));
select @a;
+------+
| @a   |
+------+
|    3 |
+------+
set @a=(select a from tt1 where id < (select 2));
select @a;
+--------+
| @a     |
+--------+
| test01 |
+--------+
set @a=(select a from tt1 where id <(select 2 from dual));
select @a;
+--------+
| @a     |
+--------+
| test01 |
+--------+
set @a=(select d from tt1 where id <=(select 2));
ERROR 21000: Subquery returns more than 1 row
select @a;
+--------+
| @a     |
+--------+
| test01 |
+--------+
set @a=(select d from tt1 where id <=(select 1));
select @a;
+------------+
| @a         |
+------------+
| 2022-03-02 |
+------------+
set @a=(select d from tt1 where id <=(select 2));
ERROR 21000: Subquery returns more than 1 row
select @a;
+------------+
| @a         |
+------------+
| 2022-03-02 |
+------------+
set @a=(select d from tt1 where id >(select 2));
select @a;
+------------+
| @a         |
+------------+
| 2022-03-03 |
+------------+
set @a=(select id from tt1 where id >=(select 3));
select @a;
+------+
| @a   |
+------+
|    3 |
+------+
set @a=(select id from tt2 where id !=(select 1));
select @a;
+------+
| @a   |
+------+
|    3 |
+------+
set @a=(SELECT id FROM tt2 WHERE Tt2.id IN (SELECT tt1.id FROM tt1 WHERE Tt2.d = Tt1.d or tt2.a=tt1.a));
select @a;
+------+
| @a   |
+------+
|    3 |
+------+
set @a=(select a from tt2 where id <>(select 1));
select @a;
+--------+
| @a     |
+--------+
| test03 |
+--------+
set @a=(select sum(id) from tt1);
select @a;
+------+
| @a   |
+------+
|    6 |
+------+
##the precision of result is unstable,see issue: 
##set @a=(select avg(id) from tt1);
##select @a;
set @a=(select min(id) from tt1);
select @a;
+------+
| @a   |
+------+
|    1 |
+------+
set @a=(select max(id)+3 from tt1);
select @a;
+------+
| @a   |
+------+
|    6 |
+------+
set @a:=(select max(id)+3 from tt1);
select @a;
+------+
| @a   |
+------+
|    6 |
+------+
set @a=(select count(*) from tt1 where id>=1 or id<=4);
select @a;
+------+
| @a   |
+------+
|    3 |
+------+
set @a=(with myCTE(id) as
(
 select id from tt2 where  id=3
 union 
 select id from tt1 where id =3
)SELECT * FROM myCTE);
select @a;
+------+
| @a   |
+------+
|    3 |
+------+
set @a=(select tt2.id from tt2 left join tt1 on tt2.a=tt1.a where tt1.id in (select id from tt3));
select @a;
+------+
| @a   |
+------+
|    3 |
+------+
insert into tt1(id) values(@a);
select * from tt1;
+------+--------+------------+
| id   | a      | d          |
+------+--------+------------+
|    1 | test01 | 2022-03-02 |
|    2 | test02 | 2022-03-03 |
|    3 | test03 | 2022-03-03 |
|    3 | NULL   | NULL       |
+------+--------+------------+
update tt1 set a=@a where id=@a;
select * from tt1;
+------+--------+------------+
| id   | a      | d          |
+------+--------+------------+
|    1 | test01 | 2022-03-02 |
|    2 | test02 | 2022-03-03 |
|    3 | 3      | 2022-03-03 |
|    3 | 3      | NULL       |
+------+--------+------------+
delete from tt1 where id=@a;
select * from tt1;
+------+--------+------------+
| id   | a      | d          |
+------+--------+------------+
|    1 | test01 | 2022-03-02 |
|    2 | test02 | 2022-03-03 |
+------+--------+------------+
视图
drop table tt1;
create table tt1(id int,a varchar(20),d date);
insert into tt1 values(1,'test01','2022-3-2');
insert into tt1 values(2,'test02','2022-3-3');
insert into tt1 values(3,'test03','2022-3-3');
drop table tt2;
create table tt2(id int,a varchar(20),d date);
insert into tt2 values(3,'test03','2022-3-2');
drop table tt3;
create table tt3(id int,a varchar(20),d date);
insert into tt3 values(3,'test03','2022-3-2');
set @a=(select 1);
select @a;
+------+
| @a   |
+------+
|    1 |
+------+
drop view vtt1;
drop view vtt2;
create view vtt1 as select * from tt1;
create view vtt2 as select * from tt2;
set @a=(select 1 from vtt1);
ERROR 21000: Subquery returns more than 1 row
select @a;
+------+
| @a   |
+------+
|    1 |
+------+
set @a=(select distinct 2 from vtt1 where id =2);
select @a;
+------+
| @a   |
+------+
|    2 |
+------+
set @a=(select distinct id+89898 from vtt1 where id =2);
select @a;
+-------+
| @a    |
+-------+
| 89900 |
+-------+
set @a=(select distinct id*89898 from vtt1 where id =2);
select @a;
+--------+
| @a     |
+--------+
| 179796 |
+--------+
set @a=(select 2,1 from vtt1 where id =2);
ERROR 21000: Operand should contain 1 column(s)
select @a;
+--------+
| @a     |
+--------+
| 179796 |
+--------+
set @a=(select null from vtt1 where id =2);
select @a;
+------+
| @a   |
+------+
| NULL |
+------+
set @a=(select id from vtt2);
select @a;
+------+
| @a   |
+------+
|    3 |
+------+
set @a=(select a from vtt2);
select @a;
+--------+
| @a     |
+--------+
| test03 |
+--------+
set @a=(select d as d1 from vtt2);
select @a;
+------------+
| @a         |
+------------+
| 2022-03-02 |
+------------+
set @a=(select * from vtt1);
ERROR 21000: Operand should contain 1 column(s)
set @a=(select id  from vtt1 where id=4);
select @a;
+------+
| @a   |
+------+
| NULL |
+------+
set @a=(select distinct id  from vtt1 where id=2);
select @a;
+------+
| @a   |
+------+
|    2 |
+------+
set @a=(select a from vtt1 where id <2);
select @a;
+--------+
| @a     |
+--------+
| test01 |
+--------+
set @a=(select a from vtt1 where id <2);
select @a;
+--------+
| @a     |
+--------+
| test01 |
+--------+
set @a=(select d from vtt1 where id <=2);
ERROR 21000: Subquery returns more than 1 row
select @a;
+--------+
| @a     |
+--------+
| test01 |
+--------+
set @a=(select d from vtt1 where id <=1);
select @a;
+------------+
| @a         |
+------------+
| 2022-03-02 |
+------------+
set @a=(select d from vtt1 where id <=1 and a='test01');
select @a;
+------------+
| @a         |
+------------+
| 2022-03-02 |
+------------+
set @a=(select d from vtt1 where id >2 or d='2001-10-10');
select @a;
+------------+
| @a         |
+------------+
| 2022-03-03 |
+------------+
set @a=(select id from vtt1 where id >=3)+10,@b=(select a from (select * from vtt1) vvt where vvt.id>=3);
select @a,@b;
+------+--------+
| @a   | @b     |
+------+--------+
|   13 | test03 |
+------+--------+
set @a=(select id from vtt2 where id !=1);
select @a;
+------+
| @a   |
+------+
|    3 |
+------+
set @a=(select a from vtt2 where id <>1);
select @a;
+--------+
| @a     |
+--------+
| test03 |
+--------+
set @a=(select d from vtt1 where id <=2 limit 1);
select @a;
+------------+
| @a         |
+------------+
| 2022-03-02 |
+------------+
set @a=(select a from vtt1 where id in ((select 1),(select 5)));
select @a;
+--------+
| @a     |
+--------+
| test01 |
+--------+
set @a=(select a from vtt1 where id not in ((select 1),(select 2)));
select @a;
+--------+
| @a     |
+--------+
| test03 |
+--------+
set @a=(select id from vtt1 where id in (1,5));
select @a;
+------+
| @a   |
+------+
|    1 |
+------+
set @a=(select d from vtt1 where id not in (1,2));
select @a;
+------------+
| @a         |
+------------+
| 2022-03-03 |
+------------+
set @a=(select d from vtt1 where id not in (1,2));
select @a;
+------------+
| @a         |
+------------+
| 2022-03-03 |
+------------+
set @a=(select d from vtt1 where id between 3 and 4);
select @a;
+------------+
| @a         |
+------------+
| 2022-03-03 |
+------------+
set @a=(select d from vtt1 where id between 3 and 4)-1;
select @a;
+----------+
| @a       |
+----------+
| 20220302 |
+----------+
set @a=(select id from vtt1 where a like '%03');
select @a;
+------+
| @a   |
+------+
|    3 |
+------+
set @a=(select id from vtt1 where id =3 or id=1);
ERROR 21000: Subquery returns more than 1 row
set @a=(select id from vtt1 where id =3 and a='test03');
select @a;
+------+
| @a   |
+------+
|    3 |
+------+
set @a=(select id from vtt1 where id is not null);
ERROR 21000: Subquery returns more than 1 row
set @a=(select id from vtt1 where id is  null);
select @a;
+------+
| @a   |
+------+
| NULL |
+------+
set @a=(select id from vtt2 where 1=1);
select @a;
+------+
| @a   |
+------+
|    3 |
+------+
set @a=(select vtt2.a from vtt2 limit 1);
select @a;
+--------+
| @a     |
+--------+
| test03 |
+--------+
set @a=(select vtt2.id as id1 from vtt2 order by id);
select @a;
+------+
| @a   |
+------+
|    3 |
+------+
set @a=(select d from vtt1 where a='test03' order by id);
select @a;
+------------+
| @a         |
+------------+
| 2022-03-03 |
+------------+
set @a=(select id from vtt1 where a='test03' group by id);
select @a;
+------+
| @a   |
+------+
|    3 |
+------+
set @a=(select sum(id) from vtt1 group by id having sum(id)>3);
select @a;
+------+
| @a   |
+------+
| NULL |
+------+
set @a=(select (case when id =1 then 5 end) from vtt1);
ERROR 21000: Subquery returns more than 1 row
set @a=(select (case when id =1 then 5 end) from vtt1 where id=1);
select @a;
+------+
| @a   |
+------+
|    5 |
+------+
set @a=(select id from vtt1 group by id,case when a='test03' then '3' else '4' end);
ERROR 21000: Subquery returns more than 1 row
set @a=(select id from vtt2 group by id,case when a='test01' then '3' else '4' end);
select @a;
+------+
| @a   |
+------+
|    3 |
+------+
set @a=(with temp as (select * from vtt2) select id from temp);
select @a;
+------+
| @a   |
+------+
|    3 |
+------+
set @a=(select d from vtt2 where exists  (select id from tt1));
select @a;
+------------+
| @a         |
+------------+
| 2022-03-02 |
+------------+
set @a=(select id from vtt2 where not exists  (select id from tt1 where id>10));
select @a;
+------+
| @a   |
+------+
|    3 |
+------+
set @a=(select id from vtt1 where id >=some(select id from vtt1));
ERROR 21000: Subquery returns more than 1 row
set @a=(select id from vtt2 where id >=some(select id from tt1));
select @a;
+------+
| @a   |
+------+
|    3 |
+------+
set @a=(select id from vtt2 where id >=any(select id from vtt1));
select @a;
+------+
| @a   |
+------+
|    3 |
+------+
set @a=(select id from vtt2 where id <all(select id from vtt1));
select @a;
+------+
| @a   |
+------+
| NULL |
+------+
set @a=(select a from (select a from vtt1 where id=1) tt4);
select @a;
+--------+
| @a     |
+--------+
| test01 |
+--------+
set @a=(select id from (select id from vtt1 where id >(select 2)) tt5);
select @a;
+------+
| @a   |
+------+
|    3 |
+------+
set @a=(select id from vtt2 where id =(select id from vtt1 where id=3));
select @a;
+------+
| @a   |
+------+
|    3 |
+------+
set @a=(select a from vtt1 where id < (select 2));
select @a;
+--------+
| @a     |
+--------+
| test01 |
+--------+
set @a=(select a from vtt1 where id <(select 2 from dual));
select @a;
+--------+
| @a     |
+--------+
| test01 |
+--------+
set @a=(select d from vtt1 where id <=(select 2));
ERROR 21000: Subquery returns more than 1 row
select @a;
+--------+
| @a     |
+--------+
| test01 |
+--------+
set @a=(select d from vtt1 where id <=(select 1));
select @a;
+------------+
| @a         |
+------------+
| 2022-03-02 |
+------------+
set @a=(select d from vtt1 where id <=(select 2));
ERROR 21000: Subquery returns more than 1 row
select @a;
+------------+
| @a         |
+------------+
| 2022-03-02 |
+------------+
set @a=(select d from vtt1 where id >(select 2));
select @a;
+------------+
| @a         |
+------------+
| 2022-03-03 |
+------------+
set @a=(select id from vtt1 where id >=(select 3));
select @a;
+------+
| @a   |
+------+
|    3 |
+------+
set @a=(select id from vtt2 where id !=(select 1));
select @a;
+------+
| @a   |
+------+
|    3 |
+------+
set @a=(select a from vtt2 where id <>(select 1));
select @a;
+--------+
| @a     |
+--------+
| test03 |
+--------+
set @a=(select sum(id) from vtt1);
select @a;
+------+
| @a   |
+------+
|    6 |
+------+
set @a=(select min(id) from vtt1);
select @a;
+------+
| @a   |
+------+
|    1 |
+------+
set @a=(select max(id) from vtt1);
select @a;
+------+
| @a   |
+------+
|    3 |
+------+
set @a=(select count(*) from vtt1);
select @a;
+------+
| @a   |
+------+
|    3 |
+------+
create sequence s1;
set @c= (select s1.nextval from tt2);
ERROR HY000: sequence number not allowed here
set @c=(SELECT /*+ PARALLEL(3) */ MAX(id) FROM tt2)%1;
select @c;
+------+
| @c   |
+------+
|    0 |
+------+
set @c=(SELECT /*+ no_use_px */ id FROM tt2);
select @c;
+------+
| @c   |
+------+
|    3 |
+------+
set @c=(SELECT /*+ ORDERED USE_NL(id) */ id FROM tt2);
select @c;
+------+
| @c   |
+------+
|    3 |
+------+
set @c=(SELECT /*+ ORDERED USE_NL(id) */ id FROM tt1);
ERROR 21000: Subquery returns more than 1 row
set @c=(SELECT /*+ ORDERED USE_NL(id) */ id FROM tt2);
select @c;
+------+
| @c   |
+------+
|    3 |
+------+
set @c=(SELECT /*+ ORDERED USE_NL(id) */ id FROM tt1);
ERROR 21000: Subquery returns more than 1 row
set @c=(SELECT /*+USE_PX PARALLEL(3) PQ_DISTRIBUTE
        (tt2 BROADCAST NONE) LEADING(tt1 tt2)*/ tt2.a FROM tt1 JOIN tt2 ON 
         tt1.id = tt2.id);
set @c=(SELECT/*+USE_NL(vtt1 vtt2)*/ vtt2.a FROM (select * from tt1) vtt1,(select * from tt2) vtt2 
      WHERE vtt1.id = vtt2.id);
select @c;
+--------+
| @c     |
+--------+
| test03 |
+--------+
set @c=(SELECT/*+USE_MERGE(tt1 tt2)*/ tt1.id FROM tt1, tt2 WHERE tt1.id = tt2.id);
select @c;
+------+
| @c   |
+------+
|    3 |
+------+
set @c=(SELECT/*+USE_MERGE(tt1 tt2)*/ * FROM tt1, tt2 WHERE tt1.id = tt2.id);
ERROR 21000: Operand should contain 1 column(s)
set @c=(SELECT/*+USE_HASH(tt1 tt2)*/ tt2.id FROM tt1, tt2 WHERE tt1.a = tt2.a);
select @c;
+------+
| @c   |
+------+
|    3 |
+------+
create index ind on tt2(id);
set @c=(SELECT id FROM tt2 force index(ind));
select @c;
+------+
| @c   |
+------+
|    3 |
+------+
set @c=(SELECT id FROM tt2 ignore index(ind));
select @c;
+------+
| @c   |
+------+
|    3 |
+------+
set @c=(SELECT SQL_NO_CACHe a FROM tt2 );
select @c;
+--------+
| @c     |
+--------+
| test03 |
+--------+
set @c=(SELECT SQL_CACHe d FROM tt2 );
select @c;
+------------+
| @c         |
+------------+
| 2022-03-02 |
+------------+
ob_mysql_set_1_2 连接
drop table tt1;
create table tt1(id int,a varchar(20),d date);
insert into tt1 values(1,'test01','2022-3-2');
insert into tt1 values(2,'test02','2022-3-3');
insert into tt1 values(2,'test02','2022-3-3');
insert into tt1 values(3,'test03','2022-3-3');
drop table tt2;
create table tt2(id int,a varchar(20),d date);
insert into tt2 values(3,'test03','2022-3-2');
insert into tt2 values(4,'test04','2022-3-4');
drop table tt3;
create table tt3(id int,a varchar(20),d date);
insert into tt3 values(3,'test03','2022-3-2');
set @b=(select tt1.id from tt1 ,tt2 where tt1.id=tt2.id);
select @b;
+------+
| @b   |
+------+
|    3 |
+------+
set @b=(select vtt1.id from vtt1 ,vtt2 where vtt1.id=vtt2.id);
select @b;
+------+
| @b   |
+------+
|    3 |
+------+
set @b=(select tt2.a from tt1 inner join tt2 on tt1.id=tt2.id);
select @b;
+--------+
| @b     |
+--------+
| test03 |
+--------+
set @b:=(select tt2.a from tt1 inner join tt2 on tt1.id=tt2.id);
select @b;
+--------+
| @b     |
+--------+
| test03 |
+--------+
set @b=(select tt1.d from tt1 left join tt2 on tt1.id=tt2.id);
ERROR 21000: Subquery returns more than 1 row
set @b:=(select tt1.d from tt1 left join tt2 on tt1.id=tt2.id);
ERROR 21000: Subquery returns more than 1 row
set @b=(select tt1.d from tt1 left join tt2 on tt1.id=tt2.id and tt1.d='2022-03-03');
ERROR 21000: Subquery returns more than 1 row
set @b=(select distinct tt1.d from tt1 left join tt2 on tt1.id=tt2.id where tt1.d=(select '2022-03-03'));
select @b;
+------------+
| @b         |
+------------+
| 2022-03-03 |
+------------+
set @b=(select distinct tt1.d from tt1 right join tt2 on tt1.id=tt2.id);
ERROR 21000: Subquery returns more than 1 row
set @b=(select distinct tt1.d from tt1 left join tt2 on tt1.id=tt2.id where tt1.d='2022-03-03');
select @b;
+------------+
| @b         |
+------------+
| 2022-03-03 |
+------------+
set @b=(select distinct tt1.d from tt1 full join tt2 on tt1.id=tt2.id where tt1.d='2022-03-03');
select @b;
+------------+
| @b         |
+------------+
| 2022-03-03 |
+------------+
set @b=(select  tt2.id from tt2 natural join tt1 where id =3),@a='test';
select @b,@a;
+------+------+
| @b   | @a   |
+------+------+
| NULL | test |
+------+------+
set @b=(select  tt2.id from tt2 left join (select * from tt1) tt3 on tt2.id=tt3.id);
ERROR 21000: Subquery returns more than 1 row
set @b=(select  tt2.id from tt2 union select id from tt1 where tt1.id=3);
ERROR 21000: Subquery returns more than 1 row
set @b=(select  tt2.id from tt2 union all select id from tt1);
ERROR 21000: Subquery returns more than 1 row
set @b=(select * from tt2 cross join tt1);
ERROR 21000: Operand should contain 1 column(s)
set @b=(select  tt2.id from tt2 cross join (select * from tt1) tt);
ERROR 21000: Subquery returns more than 1 row
set @b=(select  distinct tt2.id from tt2  cross join (select * from tt1) tt where tt2.id=4);
select @b;
+------+
| @b   |
+------+
|    4 |
+------+
set @b=(select id from tt2 where id=3 union select id from tt1 where id=3);
select @b;
+------+
| @b   |
+------+
|    3 |
+------+
set @b=(select id from tt2 where id in (select 3) union select id from tt3 where id=3);
select @b;
+------+
| @b   |
+------+
|    3 |
+------+
set @b=(select  id from tt2 union all select id from tt1 where id=3);
ERROR 21000: Subquery returns more than 1 row
set @b=(select distinct id from (select  id from tt2 where id=3 union all select id from tt1 where id=3) tt);
select @b;
+------+
| @b   |
+------+
|    3 |
+------+
ob_mysql_set_1_3 运算符
set @c=(select 1+2);
select @c;
+------+
| @c   |
+------+
|    3 |
+------+
set @c=(select 1-2);
select @c;
+------+
| @c   |
+------+
|   -1 |
+------+
set @c=(select 2*3);
select @c;
+------+
| @c   |
+------+
|    6 |
+------+
set @c=(select 2/3);
select @c;
+--------+
| @c     |
+--------+
| 0.6667 |
+--------+
set @c=(select 10 DIV 4);
select @c;
+------+
| @c   |
+------+
|    2 |
+------+
set @c=(select 10 MOD 4);
select @c;
+------+
| @c   |
+------+
|    2 |
+------+
set @c=(select 2=3);
select @c;
+------+
| @c   |
+------+
|    0 |
+------+
set @c=(select NULL = NULL);
select @c;
+------+
| @c   |
+------+
| NULL |
+------+
set @c=(select 2<>3) or (select 1);
select @c;
+------+
| @c   |
+------+
|    1 |
+------+
set @c=(select 2<=>3);
select @c;
+------+
| @c   |
+------+
|    0 |
+------+
set @c=(select null<=>null);
select @c;
+------+
| @c   |
+------+
|    1 |
+------+
set @c=(select 2<3);
select @c;
+------+
| @c   |
+------+
|    1 |
+------+
set @c=(select 2<=3);
select @c;
+------+
| @c   |
+------+
|    1 |
+------+
set @c=(select 2>3);
select @c;
+------+
| @c   |
+------+
|    0 |
+------+
set @c=(select 2>=3);
select @c;
+------+
| @c   |
+------+
|    0 |
+------+
set @c=(select 5 between 1 and 10);
select @c;
+------+
| @c   |
+------+
|    1 |
+------+
set @c=(select 5 in (1,2,3,4,5));
select @c;
+------+
| @c   |
+------+
|    1 |
+------+
set @c=(select 5 not in (1,2,3,4,5));
select @c;
+------+
| @c   |
+------+
|    0 |
+------+
set @c=(select 5 not in (1,2,3,4,5)),@d=(select '12345' like '12%') mod (select 2);
select @c;
+------+
| @c   |
+------+
|    0 |
+------+
set @c=(select null is NULL);
select @c;
+------+
| @c   |
+------+
|    1 |
+------+
set @c=(select 'a' is NULL);
select @c;
+------+
| @c   |
+------+
|    0 |
+------+
set @c=(select null IS NOT NULL);
select @c;
+------+
| @c   |
+------+
|    0 |
+------+
set @c=(select '12345' like '12%');
select @c;
+------+
| @c   |
+------+
|    1 |
+------+
set @c=(select '12345' like '12_');
select @c;
+------+
| @c   |
+------+
|    0 |
+------+
set @c=(select 'beijing' REGEXP 'jing');
select @c;
+------+
| @c   |
+------+
|    1 |
+------+
set @c=(select 'beijing' REGEXP 'xi');
select @c;
+------+
| @c   |
+------+
|    0 |
+------+
set @c=(select 2 and 0);
select @c;
+------+
| @c   |
+------+
|    0 |
+------+
set @c=(select 2 and 1);
select @c;
+------+
| @c   |
+------+
|    1 |
+------+
set @c=(select (select id from tt2 where id=3) and (select 1));
select @c;
+------+
| @c   |
+------+
|    1 |
+------+
set @c=(select 2 or 0);
select @c;
+------+
| @c   |
+------+
|    1 |
+------+
set @c=(select 2 or 1);
select @c;
+------+
| @c   |
+------+
|    1 |
+------+
set @c=(select 0 or 0);
select @c;
+------+
| @c   |
+------+
|    0 |
+------+
set @c=(select 1 || 0);
select @c;
+------+
| @c   |
+------+
|    1 |
+------+
set @c=(select not 1);
select @c;
+------+
| @c   |
+------+
|    0 |
+------+
set @c=(select !0);
select @c;
+------+
| @c   |
+------+
|    1 |
+------+
set @c=(select 1 xor 1);
select @c;
+------+
| @c   |
+------+
|    0 |
+------+
set @c=(select 1) xor (select 1);
select @c;
+------+
| @c   |
+------+
|    0 |
+------+
set @c=(select 0 xor 0);
select @c;
+------+
| @c   |
+------+
|    0 |
+------+
set @c=(select 1 xor 0);
select @c;
+------+
| @c   |
+------+
|    1 |
+------+
set @a=2, @c=(select (select 1) xor 0);
select @a,@c;
+------+------+
| @a   | @c   |
+------+------+
|    2 |    1 |
+------+------+
set @c=(select null or 1);
select @c;
+------+
| @c   |
+------+
|    1 |
+------+
set @c=(select 1 ^ 0);
select @c;
+------+
| @c   |
+------+
|    1 |
+------+
set @c=(select 3&5);
select @c;
+------+
| @c   |
+------+
|    1 |
+------+
set @c=(select 3|5);
select @c;
+------+
| @c   |
+------+
|    7 |
+------+
set @c=(select 3^5);
select @c;
+------+
| @c   |
+------+
|    6 |
+------+
set @c=(select ~18446744073709551612);
select @c;
+------+
| @c   |
+------+
|    3 |
+------+
set @c=(select 3>>1);
select @c;
+------+
| @c   |
+------+
|    1 |
+------+
set @c=(select 3<<1);
select @c;
+------+
| @c   |
+------+
|    6 |
+------+
set @c=(SELECT @var1 := 1);
select @c;
+------+
| @c   |
+------+
|    1 |
+------+
set @c=(SELECT '2008-12-31 23:59:59' + INTERVAL 1 SECOND);
select @c;
+---------------------+
| @c                  |
+---------------------+
| 2009-01-01 00:00:00 |
+---------------------+
set @c :=(SELECT '2008-12-31 23:59:59' + INTERVAL 1 SECOND);
select @c;
+---------------------+
| @c                  |
+---------------------+
| 2009-01-01 00:00:00 |
+---------------------+
ob_mysql_set_1_4 函数
ob_mysql_set_1_4_1
set @d=(SELECT ADDDATE('2021-08-01', INTERVAL 31 DAY));
select @d;
+------------+
| @d         |
+------------+
| 2021-09-01 |
+------------+
set @d=(SELECT CURDATE());
select @d;
+------------+
| @d         |
+------------+
| 2020-09-13 |
+------------+
set @d=(SELECT CURRENT_DATE);
select @d;
+------------+
| @d         |
+------------+
| 2020-09-13 |
+------------+
set @d=(SELECT CURRENT_TIME(6));
ob值没有小数点,目前ob与mysql的精度不同，当前版本暂不考虑这一问题
select @d;
+----------+
| @d       |
+----------+
| 20:26:40 |
+----------+
set @d=(SELECT CURRENT_TIMESTAMP(6));
ob值没有小数点,目前ob与mysql的精度不同，当前版本暂不考虑这一问题
select @d;
+---------------------+
| @d                  |
+---------------------+
| 2020-09-13 20:26:40 |
+---------------------+
set @d=(SELECT CURTIME(3));
ob值没有小数点,目前ob与mysql的精度不同，当前版本暂不考虑这一问题
select @d;
+----------+
| @d       |
+----------+
| 20:26:40 |
+----------+
set @d=(SELECT DATE('2021-07-14 19:12:03'));
select @d;
+------------+
| @d         |
+------------+
| 2021-07-14 |
+------------+
set @d=(SELECT DATE_ADD(NOW(), INTERVAL 5 DAY));
select @d;
+---------------------+
| @d                  |
+---------------------+
| 2020-09-18 20:26:40 |
+---------------------+
set @d=(SELECT DATE_FORMAT('2014-01-01', '%Y-%M-%d'));
select @d;
+-----------------+
| @d              |
+-----------------+
| 2014-January-01 |
+-----------------+
set @d=(SELECT DATE_SUB(NOW(), INTERVAL 5 DAY));
select @d;
+---------------------+
| @d                  |
+---------------------+
| 2020-09-08 20:26:40 |
+---------------------+
set @d=(SELECT DATEDIFF('2015-06-19','1994-12-17'));
select @d;
+------+
| @d   |
+------+
| 7489 |
+------+
set @d=(SELECT DATEDIFF('2015-06-19','1994-12-17'))+1;
select @d;
+------+
| @d   |
+------+
| 7490 |
+------+
set @d=(SELECT DAYOFMONTH('2008-12-31'));
select @d;
+------+
| @d   |
+------+
|   31 |
+------+
set @d=(SELECT DAYOFWEEK('2021-07-15'));
select @d;
+------+
| @d   |
+------+
|    5 |
+------+
set @d=(SELECT DAYOFYEAR('2021-07-15'));
select @d;
+------+
| @d   |
+------+
|  196 |
+------+
set @d=(SELECT EXTRACT(WEEK FROM '2013-01-01'));
select @d;
+------+
| @d   |
+------+
|    0 |
+------+
set @d=(SELECT FROM_DAYS(736271));
select @d;
+------------+
| @d         |
+------------+
| 2015-11-04 |
+------------+
set @d=(SELECT FROM_UNIXTIME(UNIX_TIMESTAMP(), '%Y %D %M %h:%i:%s %x'));
select @d;
+-----------------------------------+
| @d                                |
+-----------------------------------+
| 2020 13th September 08:26:40 2020 |
+-----------------------------------+
set @d=(SELECT DATE_FORMAT('2003-10-03',GET_FORMAT(DATE,'EUR')));
select @d;
+------------+
| @d         |
+------------+
| 03.10.2003 |
+------------+
set @d=(SELECT HOUR('272:59:59'));
select @d;
+------+
| @d   |
+------+
|  272 |
+------+
set @d=(SELECT LAST_DAY('2004-01-01 01:01:01'));
select @d;
+------------+
| @d         |
+------------+
| 2004-01-31 |
+------------+
set @d=(SELECT LOCALTIME(6));
ob值没有小数点,目前ob与mysql的精度不同，当前版本暂不考虑这一问题
select @d;
+---------------------+
| @d                  |
+---------------------+
| 2020-09-13 20:26:40 |
+---------------------+
set @d=(SELECT LOCALTIMESTAMP,LOCALTIMESTAMP(0),LOCALTIMESTAMP(6));
ERROR 21000: Operand should contain 1 column(s)
select @d;
+---------------------+
| @d                  |
+---------------------+
| 2020-09-13 20:26:40 |
+---------------------+
set @d=(SELECT LOCALTIMESTAMP(6));
ob值没有小数点,目前ob与mysql的精度不同，当前版本暂不考虑这一问题
select @d;
+---------------------+
| @d                  |
+---------------------+
| 2020-09-13 20:26:40 |
+---------------------+
set @d=(SELECT MAKEDATE(2011,31));
select @d;
+------------+
| @d         |
+------------+
| 2011-01-31 |
+------------+
set @d=(SELECT MAKETIME(12,15,30));
select @d;
+-----------------+
| @d              |
+-----------------+
| 12:15:30.000000 |
+-----------------+
set @d=(SELECT MICROSECOND('2021-07-15 18:20:17.000010'));
select @d;
+------+
| @d   |
+------+
|   10 |
+------+
set @d=(SELECT MINUTE('18:20:17'));
select @d;
+------+
| @d   |
+------+
|   20 |
+------+
set @d=(SELECT MONTH('2008-02-03'));
select @d;
+------+
| @d   |
+------+
|    2 |
+------+
set @d=(SELECT MONTHNAME('2008-02-03'));
select @d;
+----------+
| @d       |
+----------+
| February |
+----------+
set @d=(SELECT MONTHNAME(d) from tt2 where id =4) ;
select @d;
+-------+
| @d    |
+-------+
| March |
+-------+
set @d=(select NOW(6));
ob没有显示小数点,目前ob与mysql的精度不同，当前版本暂不考虑这一问题
select @d;
+---------------------+
| @d                  |
+---------------------+
| 2020-09-13 20:26:40 |
+---------------------+
set @d=(SELECT PERIOD_ADD(200801,2));
select @d;
+--------+
| @d     |
+--------+
| 200803 |
+--------+
set @d=(SELECT PERIOD_DIFF(200802, 200703));
select @d;
+------+
| @d   |
+------+
|   11 |
+------+
set @d=(SELECT QUARTER(NOW()));
select @d;
+------+
| @d   |
+------+
|    3 |
+------+
set @d=(SELECT SEC_TO_TIME(2378));
select @d;
+----------+
| @d       |
+----------+
| 00:39:38 |
+----------+
set @d=(SELECT SECOND('18:20:17'));
select @d;
+------+
| @d   |
+------+
|   17 |
+------+
set @d=(SELECT STR_TO_DATE(-100,'%Y-%b-%D %r'));
Warnings:
Warning	1292	Truncated incorrect date value: '-100'
select @d;
+---------------------+
| @d                  |
+---------------------+
| 0000-00-00 00:00:00 |
+---------------------+
set @d=(SELECT DATE_SUB('2022-01-02', INTERVAL 31 DAY));
select @d;
+------------+
| @d         |
+------------+
| 2021-12-02 |
+------------+
set @d=(SELECT SUBTIME('2021-07-14 19:12:59.999999','1 1:1:1.000002'));
select @d;
+----------------------------+
| @d                         |
+----------------------------+
| 2021-07-13 18:11:58.999997 |
+----------------------------+
ob值没有小数点,目前ob与mysql的精度不同，当前版本暂不考虑这一问题
set @d=(SELECT SYSDATE(5));
set @d=(SELECT TIME('2003-12-31 01:02:03'));
select @d;
+-----------------+
| @d              |
+-----------------+
| 01:02:03.000000 |
+-----------------+
set @d=(SELECT TIME_FORMAT('100:00:00', '%H %k %h %I %l'));
select @d;
+-----------------+
| @d              |
+-----------------+
| 100 100 04 04 4 |
+-----------------+
set @d=(SELECT TIME_TO_SEC('22:23:00'));
select @d;
+-------+
| @d    |
+-------+
| 80580 |
+-------+
set @d=(SELECT TIMEDIFF('2015-06-06 12:12:12', '2014-06-05 11:11:11'));
select @d;
+-----------+
| @d        |
+-----------+
| 838:59:59 |
+-----------+
set @d=(SELECT TIMESTAMP('2020-12-31 12:00:00','12:00:00'));
select @d;
+----------------------------+
| @d                         |
+----------------------------+
| 2021-01-01 00:00:00.000000 |
+----------------------------+
set @d=(SELECT TIMESTAMPADD(DAY, -5, '2010-01-01 00:00:00'));
select @d;
+---------------------+
| @d                  |
+---------------------+
| 2009-12-27 00:00:00 |
+---------------------+
set @d=(SELECT TIMESTAMPDIFF(SECOND, NOW(), '2011-01-01 11:11:11'));
select @d;
+------------+
| @d         |
+------------+
| -306148529 |
+------------+
set @d=(SELECT TO_DAYS('2015-11-04'));
select @d;
+--------+
| @d     |
+--------+
| 736271 |
+--------+
set @d=(SELECT TO_SECONDS('2021-07-15'));
select @d;
+-------------+
| @d          |
+-------------+
| 63793526400 |
+-------------+
set @d=(SELECT UNIX_TIMESTAMP('1997-10-04 22:23:00'));
select @d;
+-----------+
| @d        |
+-----------+
| 875974980 |
+-----------+
set @d=(SELECT USEC_TO_TIME(1));
select @d;
+----------------------------+
| @d                         |
+----------------------------+
| 1970-01-01 08:00:00.000001 |
+----------------------------+
set @d=(SELECT utc_date()+1);
select @d;
+----------+
| @d       |
+----------+
| 20200914 |
+----------+
set @d=(SELECT utc_date()+1,utc_date());
ERROR 21000: Operand should contain 1 column(s)
set @d=(SELECT utc_time(6));
select @d;
+-----------------+
| @d              |
+-----------------+
| 12:26:40.000000 |
+-----------------+
set @d=(SELECT UTC_TIMESTAMP(3));
select @d;
+-------------------------+
| @d                      |
+-------------------------+
| 2020-09-13 12:26:40.000 |
+-------------------------+
set @d=(SELECT WEEK('2021-01-01',0));
select @d;
+------+
| @d   |
+------+
|    0 |
+------+
set @d=(SELECT WEEKDAY('2021-07-16 00:00:00'));
select @d;
+------+
| @d   |
+------+
|    4 |
+------+
set @d=(SELECT WEEKOFYEAR('2020-07-16'));
select @d;
+------+
| @d   |
+------+
|   29 |
+------+
set @d=(SELECT YEARWEEK('2021-01-01'));
select @d;
+--------+
| @d     |
+--------+
| 202052 |
+--------+
set @d=(SELECT WEEKOFYEAR('2020-07-16'))+(SELECT YEARWEEK('2021-01-01'));
select @d;
+--------+
| @d     |
+--------+
| 202081 |
+--------+
set @d=(SELECT YEAR('1987-01-01'));
select @d;
+------+
| @d   |
+------+
| 1987 |
+------+
字符函数
set @d=(SELECT ASCII('oceanbase'));
select @d;
+------+
| @d   |
+------+
|  111 |
+------+
set @d=(SELECT BIN(12));
select @d;
+------+
| @d   |
+------+
| 1100 |
+------+
set @d=(SELECT BIN(id) from tt2 where id=4)+100;
select @d;
+------+
| @d   |
+------+
|  200 |
+------+
set @d=(SELECT BIT_LENGTH('oceanbase'));
select @d;
+------+
| @d   |
+------+
|   72 |
+------+
set @d=(select CHARSET(char(''))),@e=(SELECT CHAR_LENGTH('中国'))*1;
select @d,@e;
+--------+------+
| @d     | @e   |
+--------+------+
| binary |    2 |
+--------+------+
set @d=(SELECT CONCAT('test','obclient', '1.0'));
select @d;
+-----------------+
| @d              |
+-----------------+
| testobclient1.0 |
+-----------------+
set @d=(SELECT CONCAT_WS('_', 'First', 'Second'));
select @d;
+--------------+
| @d           |
+--------------+
| First_Second |
+--------------+
set @d=(SELECT ELT(3, 'abc1', 'abc2', 'abc', 'abc4', 'abc'));
select @d;
+------+
| @d   |
+------+
| abc  |
+------+
set @d=(SELECT FIELD('abc','abc1','abc2','abc','abc4','abc'));
select @d;
+------+
| @d   |
+------+
|    3 |
+------+
set @d=(SELECT FIND_IN_SET('b','a,b,c,d'));
select @d;
+------+
| @d   |
+------+
|    2 |
+------+
set @d=(SELECT FORMAT(12332.123456, 4) FROM DUAL);
select @d;
+-------------+
| @d          |
+-------------+
| 12,332.1235 |
+-------------+
set @d=(SELECT HEX(255));
select @d;
+------+
| @d   |
+------+
| FF   |
+------+
set @d=(SELECT 'yeyruehhdsh90034893848384938389412155454hdshf@#$##$$%' from dual);
select @d;
+-------------------------------------------------------+
| @d                                                    |
+-------------------------------------------------------+
| yeyruehhdsh90034893848384938389412155454hdshf@#$##$$% |
+-------------------------------------------------------+
set @d=(SELECT HEX(id) from tt1);
ERROR 21000: Subquery returns more than 1 row
set @d=(SELECT INSERT('Quadratic',-2,100,'What'));
select @d;
+-----------+
| @d        |
+-----------+
| Quadratic |
+-----------+
set @d=(SELECT INSTR('foobarbar', 'bar'));
select @d;
+------+
| @d   |
+------+
|    4 |
+------+
set @d=(SELECT INT2IP(16777216));
select @d;
+---------+
| @d      |
+---------+
| 1.0.0.0 |
+---------+
set @d=(SELECT IP2INT('0.0.0.1'));
select @d;
+------+
| @d   |
+------+
|    1 |
+------+
set @d=(SELECT LCASE('OBCLIENT！'));
select @d;
+-------------+
| @d          |
+-------------+
| obclient！  |
+-------------+
set @d=(SELECT LEFT('oceanbase', 5));
select @d;
+-------+
| @d    |
+-------+
| ocean |
+-------+
set @d=(SELECT LENGTH('zhongguo'));
select @d;
+------+
| @d   |
+------+
|    8 |
+------+
set @d=(SELECT LOCATE('bar', 'foobarbar',5));
select @d;
+------+
| @d   |
+------+
|    7 |
+------+
set @d =(SELECT LOWER('OBCLIENT！'));
select @d;
+-------------+
| @d          |
+-------------+
| obclient！  |
+-------------+
set @d=(SELECT LPAD('Base',9,'Ocean'));
select @d;
+-----------+
| @d        |
+-----------+
| OceanBase |
+-----------+
set @d=(SELECT LTRIM('    obclient    ') AS ltrim);
select @d;
+--------------+
| @d           |
+--------------+
| obclient     |
+--------------+
set @d=(SELECT MAKE_SET(1,'a','b','c'));
select @d;
+------+
| @d   |
+------+
| a    |
+------+
set @d=(SELECT MID('OceanBase',6));
select @d;
+------+
| @d   |
+------+
| Base |
+------+
set @d=(SELECT OCT(12));
select @d;
+------+
| @d   |
+------+
| 14   |
+------+
set @d=(SELECT ORD('zhongguo'));
select @d;
+------+
| @d   |
+------+
|  122 |
+------+
set @d=(SELECT POSITION('bar' IN 'foobarbar'));
select @d;
+------+
| @d   |
+------+
|    4 |
+------+
set @d=(SELECT QUOTE('Don\'t!'));
select @d;
+-----------+
| @d        |
+-----------+
| 'Don\'t!' |
+-----------+
set @d=(SELECT 1234 REGEXP 1);
select @d;
+------+
| @d   |
+------+
|    1 |
+------+
set @d=(SELECT 1234 REGEXP 1)+(select 1 from tt1);
ERROR 21000: Subquery returns more than 1 row
set @d=(SELECT REGEXP_INSTR('ocean base oceanbase', 'ocean'));
select @d;
+------+
| @d   |
+------+
|    1 |
+------+
set @d=(SELECT REGEXP_REPLACE('OceanBase', 'a', '2'));
select @d;
+-----------+
| @d        |
+-----------+
| Oce2nB2se |
+-----------+
set @d=+(SELECT REPEAT('1', -1));
select @d;
+------+
| @d   |
+------+
|      |
+------+
set @d=(SELECT REPLACE('abc.efg.gpg.nowdew.abc.dabc.e', 'abc.', 'www'));
select @d;
+----------------------------+
| @d                         |
+----------------------------+
| wwwefg.gpg.nowdew.wwwdwwwe |
+----------------------------+
set @d=(SELECT REVERSE('oceanbase'));
select @d;
+-----------+
| @d        |
+-----------+
| esabnaeco |
+-----------+
set @d=(SELECT RIGHT('oceanbase',4));
select @d;
+------+
| @d   |
+------+
| base |
+------+
set @d=(SELECT 'hello world!' RLIKE '^hello');
select @d;
+------+
| @d   |
+------+
|    1 |
+------+
set @d=(SELECT RPAD('hi',5,'?'));
select @d;
+-------+
| @d    |
+-------+
| hi??? |
+-------+
set @d=(SELECT RTRIM('    obclient    ') AS rtrim);
select @d;
+--------------+
| @d           |
+--------------+
|     obclient |
+--------------+
set @d=(SELECT SPACE(5));
select @d;
+-------+
| @d    |
+-------+
|       |
+-------+
set @d=(SELECT STRCMP('text', 'text2'));
select @d;
+------+
| @d   |
+------+
|   -1 |
+------+
set @d=(SELECT SUBSTR('abcdefg', 3));
select @d;
+-------+
| @d    |
+-------+
| cdefg |
+-------+
set @d=(select SUBSTRING('abcdefg', 3, 2));
select @d;
+------+
| @d   |
+------+
| cd   |
+------+
set @d=(SELECT SUBSTRING_INDEX('ABCDABC', 'ABC', 0));
select @d;
+------+
| @d   |
+------+
|      |
+------+
set @d=(SELECT TRIM(LEADING 'x' FROM 'xxxbarxxx'));
select @d;
+--------+
| @d     |
+--------+
| barxxx |
+--------+
set @d=(SELECT UCASE('obclient您好！'));
select @d;
+-------------------+
| @d                |
+-------------------+
| OBCLIENT您好！    |
+-------------------+
set @d=(SELECT UNHEX('4f6365616e42617365'));
select @d;
+-----------+
| @d        |
+-----------+
| OceanBase |
+-----------+
set @d=(SELECT UPPER('obclient您好！'));
select @d;
+-------------------+
| @d                |
+-------------------+
| OBCLIENT您好！    |
+-------------------+
set @d=(SELECT CHARSET(CONVERT('abc' USING binary)));
select @d;
+--------+
| @d     |
+--------+
| binary |
+--------+
set @d=(SELECT CAST('2012' AS date) );
select @d;
+------+
| @d   |
+------+
| NULL |
+------+
set @d=(SELECT CAST(123 AS time) );
select @d;
+----------+
| @d       |
+----------+
| 00:01:23 |
+----------+
set @d=(SELECT CAST(123 AS signed) );
select @d;
+------+
| @d   |
+------+
|  123 |
+------+
set @d=(SELECT BIN((select 12)));
select @d;
+------+
| @d   |
+------+
| 1100 |
+------+
set @d=BIN((select 12));
select @d;
+------+
| @d   |
+------+
| 1100 |
+------+
数字函数
set @d=(select ACOS(0));
select @d;
+--------------------+
| @d                 |
+--------------------+
| 1.5707963267948966 |
+--------------------+
set @d=(ATAN(-10));
select @d;
+---------------------+
| @d                  |
+---------------------+
| -1.4711276743037347 |
+---------------------+
set @d=(select ASIN(0));
select @d;
+------+
| @d   |
+------+
|    0 |
+------+
set @d=(SELECT ATAN(PI(),0));
select @d;
+--------------------+
| @d                 |
+--------------------+
| 1.5707963267948966 |
+--------------------+
set @d=(SELECT BIT_COUNT(42));
select @d;
+------+
| @d   |
+------+
|    3 |
+------+
set @d=(SELECT CONV(9223372036854775807,10,2));
select @d;
+-----------------------------------------------------------------+
| @d                                                              |
+-----------------------------------------------------------------+
| 111111111111111111111111111111111111111111111111111111111111111 |
+-----------------------------------------------------------------+
set @d=(SELECT CONV(9223372036854775807,10,2))-5,@a=(SELECT CONV(9223372036854775807,10,2));
select @d;
+-----------------------+
| @d                    |
+-----------------------+
| 1.1111111111111112e62 |
+-----------------------+
set @d=(SELECT COS(PI()));
select @d;
+------+
| @d   |
+------+
|   -1 |
+------+
set @d=(SELECT COT(-10));
select @d;
+---------------------+
| @d                  |
+---------------------+
| -1.5423510453569202 |
+---------------------+
set @d=-(SELECT COT(-10));
select @d;
+--------------------+
| @d                 |
+--------------------+
| 1.5423510453569202 |
+--------------------+
set @d=(SELECT EXP(2));
select @d;
+------------------+
| @d               |
+------------------+
| 7.38905609893065 |
+------------------+
set @d=(SELECT log(10));
select @d;
+-------------------+
| @d                |
+-------------------+
| 2.302585092994046 |
+-------------------+
set @d=(SELECT log((select 10)));
select @d;
+-------------------+
| @d                |
+-------------------+
| 2.302585092994046 |
+-------------------+
set @d=(SELECT LOG10(1000));
select @d;
+------+
| @d   |
+------+
|    3 |
+------+
set @d=(SELECT LOG2(65536));
select @d;
+------+
| @d   |
+------+
|   16 |
+------+
set @d=(SELECT MOD(29,19));
select @d;
+------+
| @d   |
+------+
|   10 |
+------+
set @d=(SELECT NEG(1+1));
select @d;
+------+
| @d   |
+------+
|   -2 |
+------+
set @d=(SELECT POW(4,-2));
select @d;
+--------+
| @d     |
+--------+
| 0.0625 |
+--------+
set @d=(SELECT POWER(2,8));
select @d;
+------+
| @d   |
+------+
|  256 |
+------+
set @d=(SELECT RADIANS(-10));
select @d;
+----------------------+
| @d                   |
+----------------------+
| -0.17453292519943295 |
+----------------------+
set @d=(SELECT SIN(PI()));
select @d;
+------------------------+
| @d                     |
+------------------------+
| 1.2246467991473532e-16 |
+------------------------+
set @d=(SELECT SQRT(4));
select @d;
+------+
| @d   |
+------+
|    2 |
+------+
set @d=(SELECT TAN(PI()));
select @d;
+-------------------------+
| @d                      |
+-------------------------+
| -1.2246467991473532e-16 |
+-------------------------+
set @d=(SELECT TRUNCATE(3.27,1));
select @d;
+------+
| @d   |
+------+
|  3.2 |
+------+
比较函数
set @d=(SELECT GREATEST(2,1));
select @d;
+------+
| @d   |
+------+
|    2 |
+------+
set @d=(SELECT INTERVAL(23, 1, 15, 17, 30, 44, 200));
select @d;
+------+
| @d   |
+------+
|    3 |
+------+
set @d=(SELECT ISNULL(null)),@e=(select ISNULL(123.456)),@f=(select ISNULL('test'));
select @d,@f,@e;
+------+------+------+
| @d   | @f   | @e   |
+------+------+------+
|    1 |    0 |    0 |
+------+------+------+
set @d=(SELECT LEAST('2',4,9));
select @d;
+------+
| @d   |
+------+
|    2 |
+------+
流程控制函数
set @d=(SELECT CASE 'B' WHEN 'A' THEN 1 WHEN 'B' THEN 2 END);
select @d;
+------+
| @d   |
+------+
|    2 |
+------+
set @d=(SELECT IF(5>6, 'T','F'));
select @d;
+------+
| @d   |
+------+
| F    |
+------+
set @d=(SELECT NULLIF('ABC', 123), NULLIF('123',123), NULLIF(NULL, 'abc'));
ERROR 21000: Operand should contain 1 column(s)
set @d=(SELECT NULLIF('ABC', 123));
select @d;
+------+
| @d   |
+------+
| ABC  |
+------+
set @d=(SELECT NULLIF('ABC', 123));
select @d;
+------+
| @d   |
+------+
| ABC  |
+------+
set @d=(SELECT id FROM tt1 ORDER BY ORA_DECODE(id,1,'lala',2,'mua'));
ERROR 21000: Subquery returns more than 1 row
set @d=(SELECT id FROM tt1 where id =1 ORDER BY ORA_DECODE(id,1,'lala',2,'mua'));
select @d;
+------+
| @d   |
+------+
|    1 |
+------+
聚合函数
drop table tt1;
create table tt1(id int,a varchar(20),d date);
insert into tt1 values(1,'test01','2022-3-2');
insert into tt1 values(2,'test02','2022-3-3');
insert into tt1 values(2,'test02','2022-3-3');
insert into tt1 values(3,'test03','2022-3-3');
drop table tt2;
create table tt2(id int,a varchar(20),d date);
insert into tt2 values(3,'test03','2022-3-2');
set @b=(select APPROX_COUNT_DISTINCT(id) from tt1);
select @b;
+------+
| @b   |
+------+
|    3 |
+------+
set @b=(select avg(distinct(id)) from tt1);
select @b;
+--------+
| @b     |
+--------+
| 2.0000 |
+--------+
set @b=(SELECT  BIT_AND(a) BITS FROM tt2 where id=3 GROUP BY a);
select @b;
+------+
| @b   |
+------+
|    0 |
+------+
set @b=(SELECT BIT_COUNT(BIT_OR(1<<id)) AS days FROM tt2 GROUP BY d);
select @b;
+------+
| @b   |
+------+
|    1 |
+------+
set @b=(SELECT BIT_COUNT(BIT_XOR(1<<id)) AS days FROM tt2   GROUP BY d);
select @b;
+------+
| @b   |
+------+
|    1 |
+------+
set @b=(SELECT COUNT(distinct id) AS days FROM tt1);
select @b;
+------+
| @b   |
+------+
|    3 |
+------+
set @b=(SELECT COUNT(distinct id) AS days FROM tt1 group by id);
ERROR 21000: Subquery returns more than 1 row
set @b=(SELECT group_concat(id) FROM tt2 group by id);
select @b;
+------+
| @b   |
+------+
| 3    |
+------+
set @b=( SELECT SUM(id)  FROM tt2 GROUP BY id WITH ROLLUP);
ERROR 21000: Subquery returns more than 1 row
set @b=(SELECT max(id) FROM tt2 order by id);
select @b;
+------+
| @b   |
+------+
|    3 |
+------+
set @b=(SELECT max(id) FROM tt2 group by id);
select @b;
+------+
| @b   |
+------+
|    3 |
+------+
set @b=(SELECT min(id) FROM tt1 group by id);
ERROR 21000: Subquery returns more than 1 row
select @b;
+------+
| @b   |
+------+
|    3 |
+------+
set @b=(SELECT min(id) FROM tt1 order by id);
select @b;
+------+
| @b   |
+------+
|    1 |
+------+
set @b=(SELECT std(id) FROM tt2);
select @b;
+------+
| @b   |
+------+
|    0 |
+------+
set @b=(SELECT stddev(id) FROM tt2);
select @b;
+------+
| @b   |
+------+
|    0 |
+------+
set @b=(SELECT STDDEV_POP(id) FROM tt1);
select @b;
+--------------------+
| @b                 |
+--------------------+
| 0.7071067811865476 |
+--------------------+
set @b=(SELECT STDDEV_SAMP(id) FROM tt1);
select @b;
+-------------------+
| @b                |
+-------------------+
| 0.816496580927726 |
+-------------------+
set @b=(SELECT VAR_POP(d) FROM tt1);
select @b;
+--------+
| @b     |
+--------+
| 0.1875 |
+--------+
set @b=(SELECT VAR_SAMP(d) FROM tt1);
select @b;
+------+
| @b   |
+------+
| 0.25 |
+------+
set @b=(SELECT VARIANCE(a) FROM tt1);
Warnings:
Warning	1292	Truncated incorrect DOUBLE value: 'test01'
Warning	1292	Truncated incorrect DOUBLE value: 'test02'
Warning	1292	Truncated incorrect DOUBLE value: 'test02'
Warning	1292	Truncated incorrect DOUBLE value: 'test03'
Warning	1292	Truncated incorrect DOUBLE value: 'test01'
Warning	1292	Truncated incorrect DOUBLE value: 'test02'
Warning	1292	Truncated incorrect DOUBLE value: 'test02'
Warning	1292	Truncated incorrect DOUBLE value: 'test03'
Warning	1292	Truncated incorrect DOUBLE value: 'test01'
Warning	1292	Truncated incorrect DOUBLE value: 'test02'
Warning	1292	Truncated incorrect DOUBLE value: 'test02'
Warning	1292	Truncated incorrect DOUBLE value: 'test03'
select @b;
+------+
| @b   |
+------+
|    0 |
+------+
分析函数
set @b=(SELECT  APPROX_COUNT_DISTINCT(id) OVER (ORDER BY d) "Variance"
FROM TT1 WHERE id = 1 ORDER BY d, a);
select @a;
+-----------------------------------------------------------------+
| @a                                                              |
+-----------------------------------------------------------------+
| 111111111111111111111111111111111111111111111111111111111111111 |
+-----------------------------------------------------------------+
set @b=(SELECT  AVG(id) OVER(PARTITION BY id) AVG_S FROM tt2);
select @b;
+--------+
| @b     |
+--------+
| 3.0000 |
+--------+
set @b=(SELECT  COUNT(*) OVER (PARTITION BY ID) COUNT_S  FROM tt1);
ERROR 21000: Subquery returns more than 1 row
set @b=(SELECT  COUNT(*) OVER (PARTITION BY ID) COUNT_S  FROM tt2);
select @b;
+------+
| @b   |
+------+
|    1 |
+------+
set @b=(SELECT  CUME_DIST() OVER(PARTITION BY ID ORDER BY a) CUME_DIST FROM tt1);
ERROR 21000: Subquery returns more than 1 row
select @b;
+------+
| @b   |
+------+
|    1 |
+------+
set @b=(SELECT  CUME_DIST() OVER(PARTITION BY ID ORDER BY a) CUME_DIST FROM tt2);
select @b;
+------+
| @b   |
+------+
|    1 |
+------+
set @b=(select DENSE_RANK() OVER(PARTITION BY ID ORDER BY a) DENSE_RANK FROM tt2);
select @b;
+------+
| @b   |
+------+
|    1 |
+------+
set @b=(SELECT  FIRST_VALUE(a) OVER(PARTITION BY ID) FIRST_S FROM tt2);
select @b;
+--------+
| @b     |
+--------+
| test03 |
+--------+
set @b=(SELECT  FIRST_VALUE(a) OVER(PARTITION BY ID) FIRST_S FROM tt1);
ERROR 21000: Subquery returns more than 1 row
set @b=(SELECT LAG(a) OVER(ORDER BY id) LAG FROM tt2);
select @b;
+------+
| @b   |
+------+
| NULL |
+------+
set @b=(SELECT LAG(a) OVER(ORDER BY id) LAG FROM tt1);
ERROR 21000: Subquery returns more than 1 row
set @b=(SELECT LAST_VALUE(a) OVER(PARTITION BY ID) LAST_S FROM tt2);
select @b;
+--------+
| @b     |
+--------+
| test03 |
+--------+
set @b=(SELECT LAST_VALUE(a) OVER(PARTITION BY ID) LAST_S FROM tt1);
ERROR 21000: Subquery returns more than 1 row
set @b=(SELECT  LEAD(a) OVER(ORDER BY a) LEAD FROM tt2);
select @b;
+------+
| @b   |
+------+
| NULL |
+------+
set @b=(SELECT  LEAD(a) OVER(ORDER BY a) LEAD FROM tt1);
ERROR 21000: Subquery returns more than 1 row
set @b=(SELECT  MAX(d) OVER (PARTITION BY ID) MAX_S FROM tt2);
select @b;
+------------+
| @b         |
+------------+
| 2022-03-02 |
+------------+
set @b=(SELECT  MAX(d) OVER (PARTITION BY ID) MAX_S FROM tt1);
ERROR 21000: Subquery returns more than 1 row
set @b=(SELECT  min(d) OVER (PARTITION BY ID) MAX_S FROM tt2);
select @b;
+------------+
| @b         |
+------------+
| 2022-03-02 |
+------------+
set @b=(SELECT  min(d) OVER (PARTITION BY ID) MAX_S FROM tt1);
ERROR 21000: Subquery returns more than 1 row
set @b=(SELECT  NTH_VALUE(d,2) OVER (PARTITION BY ID) MAX_S FROM tt2);
select @b;
+------+
| @b   |
+------+
| NULL |
+------+
set @b=(SELECT  NTH_VALUE(d,2) OVER (PARTITION BY ID) MAX_S FROM tt1);
ERROR 21000: Subquery returns more than 1 row
set @b=(SELECT  NTILE(10) OVER (PARTITION BY ID) MAX_S FROM tt2);
select @b;
+------+
| @b   |
+------+
|    1 |
+------+
set @b=(SELECT  NTILE(10) OVER (PARTITION BY ID) MAX_S FROM tt1);
ERROR 21000: Subquery returns more than 1 row
set @b=(SELECT   PERCENT_RANK()  OVER (PARTITION BY ID) MAX_S FROM tt2);
select @b;
+------+
| @b   |
+------+
|    0 |
+------+
set @b=(SELECT   PERCENT_RANK()  OVER (PARTITION BY ID) MAX_S FROM tt1);
ERROR 21000: Subquery returns more than 1 row
set @b=(SELECT  RANK()  OVER (PARTITION BY ID) MAX_S FROM tt2);
select @b;
+------+
| @b   |
+------+
|    1 |
+------+
set @b:=(SELECT  RANK()  OVER (PARTITION BY ID) MAX_S FROM tt2);
select @b;
+------+
| @b   |
+------+
|    1 |
+------+
set @b=(SELECT  RANK()  OVER (PARTITION BY ID) MAX_S FROM tt1);
ERROR 21000: Subquery returns more than 1 row
set @b=(SELECT  ROW_NUMBER() OVER (PARTITION BY ID) MAX_S FROM tt2);
select @b;
+------+
| @b   |
+------+
|    1 |
+------+
set @b=(SELECT  ROW_NUMBER()  OVER (PARTITION BY ID) MAX_S FROM tt1);
ERROR 21000: Subquery returns more than 1 row
set @b=(SELECT  STD(a) OVER (PARTITION BY ID) MAX_S FROM tt2);
Warnings:
Warning	1292	Truncated incorrect DOUBLE value: 'test03'
Warning	1292	Truncated incorrect DOUBLE value: 'test03'
Warning	1292	Truncated incorrect DOUBLE value: 'test03'
Warning	1292	Truncated incorrect DOUBLE value: 'test03'
Warning	1292	Truncated incorrect DOUBLE value: 'test03'
select @b;
+------+
| @b   |
+------+
|    0 |
+------+
set @b=(SELECT  STD(a)  OVER (PARTITION BY ID) MAX_S FROM tt1);
ERROR 21000: Subquery returns more than 1 row
set @b=(SELECT  STDDEV(a) OVER (PARTITION BY ID) MAX_S FROM tt2);
Warnings:
Warning	1292	Truncated incorrect DOUBLE value: 'test03'
Warning	1292	Truncated incorrect DOUBLE value: 'test03'
Warning	1292	Truncated incorrect DOUBLE value: 'test03'
Warning	1292	Truncated incorrect DOUBLE value: 'test03'
Warning	1292	Truncated incorrect DOUBLE value: 'test03'
select @b;
+------+
| @b   |
+------+
|    0 |
+------+
set @b=(SELECT  STDDEV(a)  OVER (PARTITION BY ID) MAX_S FROM tt1);
ERROR 21000: Subquery returns more than 1 row
set @b=(SELECT  STDDEV_POP(a) OVER (PARTITION BY ID) MAX_S FROM tt2);
Warnings:
Warning	1292	Truncated incorrect DOUBLE value: 'test03'
Warning	1292	Truncated incorrect DOUBLE value: 'test03'
Warning	1292	Truncated incorrect DOUBLE value: 'test03'
Warning	1292	Truncated incorrect DOUBLE value: 'test03'
Warning	1292	Truncated incorrect DOUBLE value: 'test03'
select @b;
+------+
| @b   |
+------+
|    0 |
+------+
set @b=(SELECT  STDDEV_POP(a)  OVER (PARTITION BY ID) MAX_S FROM tt1);
ERROR 21000: Subquery returns more than 1 row
set @b=(SELECT  STDDEV_SAMP(a) OVER (PARTITION BY ID) MAX_S FROM tt2);
Warnings:
Warning	1292	Truncated incorrect DOUBLE value: 'test03'
Warning	1292	Truncated incorrect DOUBLE value: 'test03'
Warning	1292	Truncated incorrect DOUBLE value: 'test03'
select @b;
+------+
| @b   |
+------+
| NULL |
+------+
set @b=(SELECT  STDDEV_SAMP(a)  OVER (PARTITION BY ID) MAX_S FROM tt1);
ERROR 21000: Subquery returns more than 1 row
set @b=(SELECT  SUM(ID)  OVER (PARTITION BY ID) MAX_S FROM tt1);
ERROR 21000: Subquery returns more than 1 row
set @b=(SELECT  VAR_POP(ID) OVER (PARTITION BY ID) MAX_S FROM tt2);
select @b;
+------+
| @b   |
+------+
|    0 |
+------+
set @b=(SELECT  VAR_POP(ID)  OVER (PARTITION BY ID) MAX_S FROM tt1);
ERROR 21000: Subquery returns more than 1 row
set @b=(SELECT  VAR_SAMP(ID) OVER (PARTITION BY ID) MAX_S FROM tt2);
select @b;
+------+
| @b   |
+------+
| NULL |
+------+
set @b=(SELECT  VAR_SAMP(ID)  OVER (PARTITION BY ID) MAX_S FROM tt1);
ERROR 21000: Subquery returns more than 1 row
set @b=(SELECT  VARIANCE(ID) OVER (PARTITION BY ID) MAX_S FROM tt2);
select @b;
+------+
| @b   |
+------+
|    0 |
+------+
set @b=(SELECT  VARIANCE(ID)  OVER (PARTITION BY ID) MAX_S FROM tt1);
ERROR 21000: Subquery returns more than 1 row
加密函数
set @b=(SELECT AES_DECRYPT(@crypt_str,@key_str,@init_vector));
select @b;
+------+
| @b   |
+------+
| NULL |
+------+
set @b=(SELECT AES_ENCRYPT(@crypt_str,@key_str,@init_vector));
select @b;
+------+
| @b   |
+------+
| NULL |
+------+
加密函数
set block_encryption_mode = 18;
set @b=(SELECT SM4_DECRYPT(@crypt_str,@key_str,@init_vector));
select @b;
+------+
| @b   |
+------+
| NULL |
+------+
set @b=(SELECT SM4_ENCRYPT(@crypt_str,@key_str,@init_vector));
select @b;
+------+
| @b   |
+------+
| NULL |
+------+
set block_encryption_mode = 0;
set @b=(SELECT MD5(1));
select @b;
+----------------------------------+
| @b                               |
+----------------------------------+
| c4ca4238a0b923820dcc509a6f75849b |
+----------------------------------+
信息函数
set @b=(SELECT CHARSET("oceanbaase"));
select @b;
+---------+
| @b      |
+---------+
| utf8mb4 |
+---------+
set @b=(SELECT COERCIBILITY('oceanbase'));
select @b;
+------+
| @b   |
+------+
|    4 |
+------+
set @b=(SELECT COLLATION("oceanbase"));
select @b;
+--------------------+
| @b                 |
+--------------------+
| utf8mb4_general_ci |
+--------------------+
set @b=(SELECT CONNECTION_ID());
set @b=(SELECT CURRENT_USER());
select @b;
+---------+
| @b      |
+---------+
| admin@% |
+---------+
set @b=(SELECT DATABASE());
select @b;
+-------+
| @b    |
+-------+
| oblrp |
+-------+
set @b=(SELECT FOUND_ROWS());
select @b;
+------+
| @b   |
+------+
|    1 |
+------+
set @b=(SELECT LAST_INSERT_ID());
select @b;
+------+
| @b   |
+------+
|    0 |
+------+
set @b=(SELECT ROW_COUNT());
select @b;
+------+
| @b   |
+------+
|   -1 |
+------+
set @b=(SELECT JSON_OBJECT('id', 69, 'name', 'apple'));
select @b;
+-----------------------------+
| @b                          |
+-----------------------------+
| {"id": 69, "name": "apple"} |
+-----------------------------+
set @b=(SELECT JSON_QUOTE('null'));
select @b;
+--------+
| @b     |
+--------+
| "null" |
+--------+
set @b=(SELECT JSON_CONTAINS(@jn, @jn2, '$.a'));
select @b;
+------+
| @b   |
+------+
| NULL |
+------+
set @b=(SELECT JSON_CONTAINS_PATH(@jn, 'one', '$.a', '$.e'));
select @b;
+------+
| @b   |
+------+
| NULL |
+------+
set @b=(SELECT JSON_EXTRACT('[10, 20, [30, 40]]', '$[0]'));
select @b;
+------+
| @b   |
+------+
| 10   |
+------+
set @b=(SELECT JSON_KEYS('{"a": 1, "b": {"c": 20}}'));
select @b;
+------------+
| @b         |
+------------+
| ["a", "b"] |
+------------+
set @b=(SELECT JSON_OVERLAPS("[1,3,5,7]", "[2,3,5]"));
select @b;
+------+
| @b   |
+------+
|    1 |
+------+
set @b=(SELECT JSON_SEARCH(@jn, 'all', 'ghk'));
select @b;
+------+
| @b   |
+------+
| NULL |
+------+
set @b=(SELECT JSON_VALUE('{"fname": "Smith", "lname": "Will"}', '$.fname'));
select @b;
+-------+
| @b    |
+-------+
| Smith |
+-------+
set @b=(SELECT 45 MEMBER OF('[123, "abc", 45, "ab", 10]'));
select @b;
+------+
| @b   |
+------+
|    1 |
+------+
set @b=1-(SELECT JSON_ARRAY_APPEND(@jn, '$[0]', 2));
select @b;
+------+
| @b   |
+------+
| NULL |
+------+
SET @jn = '["a", {"b": [1, 2]}, [3, 4]]';
set @b=(SELECT JSON_ARRAY_INSERT(@jn, '$[1]', 'x'));
select @b;
+-----------------------------------+
| @b                                |
+-----------------------------------+
| ["a", "x", {"b": [1, 2]}, [3, 4]] |
+-----------------------------------+
set @b=(SELECT JSON_INSERT(@jn, '$.a', 10, '$.c', '[true, false]'));
select @b;
+------------------------------+
| @b                           |
+------------------------------+
| ["a", {"b": [1, 2]}, [3, 4]] |
+------------------------------+
set @b=(SELECT JSON_MERGE_PATCH('{"name": "x"}', '{"id": 23}'));
select @b;
+-------------------------+
| @b                      |
+-------------------------+
| {"id": 23, "name": "x"} |
+-------------------------+
set @b=(SELECT JSON_REMOVE(@jn, '$[1]'));
select @b;
+---------------+
| @b            |
+---------------+
| ["a", [3, 4]] |
+---------------+
set @b=(SELECT JSON_REPLACE(@jn, '$.a', 10, '$.c', '[true, false]'));
select @b;
+------------------------------+
| @b                           |
+------------------------------+
| ["a", {"b": [1, 2]}, [3, 4]] |
+------------------------------+
set @b=(SELECT JSON_SET(@jn, '$.a', 10, '$.c', '[true, false]'));
select @b;
+------------------------------+
| @b                           |
+------------------------------+
| ["a", {"b": [1, 2]}, [3, 4]] |
+------------------------------+
set @b=(SELECT JSON_UNQUOTE(@jn));
select @b;
+------------------------------+
| @b                           |
+------------------------------+
| ["a", {"b": [1, 2]}, [3, 4]] |
+------------------------------+
set @b=( SELECT JSON_DEPTH('{}'),JSON_DEPTH('[]'));
ERROR 21000: Operand should contain 1 column(s)
set @b=( SELECT JSON_DEPTH('{}'));
select @b;
+------+
| @b   |
+------+
|    1 |
+------+
set @b=(SELECT JSON_LENGTH('[1, 2, {"a": 3}, 4]'));
select @b;
+------+
| @b   |
+------+
|    4 |
+------+
set @b=(SELECT JSON_TYPE(JSON_EXTRACT(@jn, '$.a')));
select @b;
+------+
| @b   |
+------+
| NULL |
+------+
set @b=(SELECT JSON_VALID('{"a": 1}'));
select @b;
+------+
| @b   |
+------+
|    1 |
+------+
set @b=(SELECT JSON_PRETTY('1234'));
select @b;
+------+
| @b   |
+------+
| 1234 |
+------+
SET @jn = JSON_SET(@jn, '$[1]', "json");
set @b=(SELECT JSON_STORAGE_SIZE(@jn) AS Size);
select @b;
+------+
| @b   |
+------+
|   35 |
+------+
set @b=(SELECT JSON_ARRAYAGG(a) AS attributes FROM tt1 GROUP BY id);
ERROR 21000: Subquery returns more than 1 row
set @b=(SELECT JSON_OBJECTAGG(a, d) AS attributes FROM tt1 GROUP BY id);
ERROR 21000: Subquery returns more than 1 row
其它函数
set @b=(SELECT ANY_VALUE(a) FROM tt2 GROUP BY id);
select @b;
+--------+
| @b     |
+--------+
| test03 |
+--------+
set @b=(SELECT ANY_VALUE(a) FROM tt1 GROUP BY id);
ERROR 21000: Subquery returns more than 1 row
set @b=(SELECT COALESCE(NULL,NULL,3,4,5));
select @b;
+------+
| @b   |
+------+
|    3 |
+------+
set @b=(SELECT NVL(NULL, 0));
select @b;
+------+
| @b   |
+------+
|    0 |
+------+
set @b=(SELECT UUID());
select @b;
set @b=(SELECT UUID_SHORT());
select @b;
set @b=abs((select 1));
select @b;
+------+
| @b   |
+------+
|    1 |
+------+
set @b=(select abs((select 1)));
select @b;
+------+
| @b   |
+------+
|    1 |
+------+
set @b=(select abs((select id from tt2)));
select @b;
+------+
| @b   |
+------+
|    3 |
+------+
ob_mysql_set_1_5 赋值类型
drop table tt6;
create table tt6(id01 tinyint);
insert into tt6 values(1);
set @a=(select * from tt6);
select @a;
+------+
| @a   |
+------+
|    1 |
+------+
drop table tt6;
create table tt6(id bool);
insert into tt6 values(1);
set @a=(select * from tt6);
select @a;
+------+
| @a   |
+------+
|    1 |
+------+
drop table tt6;
create table tt6(id boolean);
insert into tt6 values(1);
set @a=(select * from tt6);
select @a;
+------+
| @a   |
+------+
|    1 |
+------+
drop table tt6;
create table tt6(id smallint);
insert into tt6 values(1);
set @a=(select id from tt6);
select @a;
+------+
| @a   |
+------+
|    1 |
+------+
drop table tt6;
create table tt6(id mediumint);
insert into tt6 values(1);
set @a=(select id from tt6);
select @a;
+------+
| @a   |
+------+
|    1 |
+------+
drop table tt6;
create table tt6(id integer);
insert into tt6 values(1);
set @a=(select * from tt6);
select @a;
+------+
| @a   |
+------+
|    1 |
+------+
drop table tt6;
create table tt6(id bigint);
insert into tt6 values(1);
set @a=(select * from tt6);
select @a;
+------+
| @a   |
+------+
|    1 |
+------+
drop table tt6;
create table tt6(id decimal);
insert into tt6 values(2);
set @a=(select * from tt6);
select @a;
+------+
| @a   |
+------+
|    2 |
+------+
drop table tt6;
create table tt6(id float);
insert into tt6 values(2.8);
set @a=(select * from tt6);
select @a;
+------+
| @a   |
+------+
|  2.8 |
+------+
drop table tt6;
create table tt6(id double);
insert into tt6 values(2.8);
set @a=(select * from tt6);
select @a;
+------+
| @a   |
+------+
|  2.8 |
+------+
drop table tt6;
create table tt6(id double precision);
insert into tt6 values(2.8);
set @a=(select * from tt6);
select @a;
+------+
| @a   |
+------+
|  2.8 |
+------+
drop table tt6;
create table tt6(id bit(10));
insert into tt6 values(2);
set @a=(select * from tt6);
select @a;
+------+
| @a   |
+------+
|     |
+------+
drop table tt6;
create table tt6(id datetime);
insert into tt6 values('2011-10-10 14:30:22');
set @a=(select * from tt6);
select @a;
+---------------------+
| @a                  |
+---------------------+
| 2011-10-10 14:30:22 |
+---------------------+
drop table tt6;
create table tt6(id time);
insert into tt6 values('14:30:22');
set @a=(select * from tt6);
select @a;
+----------+
| @a       |
+----------+
| 14:30:22 |
+----------+
drop table tt6;
create table tt6(id timestamp(6));
insert into tt6 values('2011-10-10 14:30:22.6522');
set @a=(select * from tt6);
select @a;
+----------------------------+
| @a                         |
+----------------------------+
| 2011-10-10 14:30:22.652200 |
+----------------------------+
drop table tt6;
create table tt6(id year);
insert into tt6 values('2011');
set @a=(select * from tt6);
select @a;
+------+
| @a   |
+------+
| 2011 |
+------+
drop table tt6;
create table tt6(id char(10));
insert into tt6 values('test');
set @a=(select * from tt6);
select @a;
+------+
| @a   |
+------+
| test |
+------+
drop table tt6;
create table tt6(id binary(10));
insert into tt6 values('test');
set @a=(select * from tt6);
select @a;
+------------+
| @a         |
+------------+
| test       |
+------------+
drop table tt6;
create table tt6(id varbinary(10));
insert into tt6 values('test');
set @a=(select * from tt6);
select @a;
+------+
| @a   |
+------+
| test |
+------+
drop table tt6;
create table tt6(id blob);
insert into tt6 values('test01');
set @a=(select * from tt6);
select @a;
+--------+
| @a     |
+--------+
| test01 |
+--------+
drop table tt6;
create table tt6(id tinytext);
insert into tt6 values('test02');
set @a=(select * from tt6);
select @a;
+--------+
| @a     |
+--------+
| test02 |
+--------+
drop table tt6;
create table tt6(id enum('1','2'));
insert into tt6 values('2');
set @a=(select * from tt6);
select @a;
+------+
| @a   |
+------+
| 2    |
+------+
drop table tt6;
create table tt6(id set('01','02'));
insert into tt6 values('01');
set @a=(select * from tt6);
select @a;
+------+
| @a   |
+------+
| 01   |
+------+
drop table tt6;
create table tt6(id json);
insert into tt6 values('["abc", 10, null, true, false]');
drop table jn;
CREATE TABLE jn ( c JSON, g INT GENERATED ALWAYS AS (c->"$.id"));
CREATE INDEX idx1 ON jn(g);
INSERT INTO jn (c) VALUES
      ('{"id": "1", "name": "Fred"}'), ('{"id": "2", "name": "Wilma"}'),
      ('{"id": "3", "name": "Barney"}'), ('{"id": "4", "name": "Betty"}');
set @a=(SELECT c->>"$.name" AS name FROM jn WHERE g <= 2);
ERROR 21000: Subquery returns more than 1 row
set @a=(SELECT c->>"$.name" AS name FROM jn WHERE g <2);
select @a;
+------+
| @a   |
+------+
| Fred |
+------+
set @a=(SELECT CAST("123" AS JSON));
select @a;
+------+
| @a   |
+------+
| 123  |
+------+
set @a=(SELECT JSON_SET('"x"', '$[0]', 'a'));
select @a;
+------+
| @a   |
+------+
| "a"  |
+------+
ob_mysql_set_1_6
drop table t1;
create table t1( id int,name varchar(30),t date)partition by list (id)
(
partition part_1 values in ( 1, 3, 5, 7 ),
partition part_2 values in( 2, 4, 6, 8 ),
partition part_default values in(10,20,30,40,50)
);
insert into t1 values(1,'test01','2020-10-10');
insert into t1 values(10,'test02','2020-10-11');
insert into t1 values(20,'test03','2020-10-12');
set @a=(select id from t1);
ERROR 21000: Subquery returns more than 1 row
set @a=(select id from t1 where id =1);
select @a;
+------+
| @a   |
+------+
|    1 |
+------+
drop table t1;
create table t1( id int,name varchar(30),t date)PARTITION BY RANGE (id) SUBPARTITION BY HASH (id % 4) SUBPARTITIONS 2(
     PARTITION p0 VALUES LESS THAN (3000000),
     PARTITION p1 VALUES LESS THAN (6000000)
);
insert into t1 values(1,'test01','2020-10-10');
insert into t1 values(10,'test02','2020-10-11');
insert into t1 values(20,'test03','2020-10-12');
set @a=(select id from t1);
ERROR 21000: Subquery returns more than 1 row
set @a=(select id from t1 where id <=(select 1));
select @a;
+------+
| @a   |
+------+
|    1 |
+------+
drop table t3;
create table t3( id int,name varchar(30)) partition by hash(id) partitions 4;
insert into t3 values(1,'test01');
set @a=(select id from t3 where id <=(select id from t1 where id =(select 1)));
select @a;
+------+
| @a   |
+------+
|    1 |
+------+
set @a=(SELECT _utf8mb4'abc' COLLATE utf8mb4_unicode_ci);
select @a;
+------+
| @a   |
+------+
| abc  |
+------+
drop table t1;
create table t1(id int primary key, a varchar(20) check(a='1' or a='2'),id01 int default 18, id03 int, b varchar(20) not null,
constraint uq unique(id03));
drop table t2;
create table t2(id int, fk_id int);
alter table t2 add constraint fk foreign key(fk_id) references t1(id);
set @a=(select id from t1);
select @a;
+------+
| @a   |
+------+
| NULL |
+------+
set @a=(select a from t1);
select @a;
+------+
| @a   |
+------+
| NULL |
+------+
set @a=(select id01 from t1);
select @a;
+------+
| @a   |
+------+
| NULL |
+------+
set @a=(select id03 from t1);
select @a;
+------+
| @a   |
+------+
| NULL |
+------+
set @a=(select b from t1);
select @a;
+------+
| @a   |
+------+
| NULL |
+------+
set @b=(select fk_id from t2);
select @b;
+------+
| @b   |
+------+
| NULL |
+------+
insert into t1 values(1,'2',1,3,'test');
set @a=(select id from t1);
select @a;
+------+
| @a   |
+------+
|    1 |
+------+
set @a=(select a from t1);
select @a;
+------+
| @a   |
+------+
| 2    |
+------+
set @a=(select id01 from t1);
select @a;
+------+
| @a   |
+------+
|    1 |
+------+
set @a=(select id03 from t1);
select @a;
+------+
| @a   |
+------+
|    3 |
+------+
set @a=(select b from t1);
select @a;
+------+
| @a   |
+------+
| test |
+------+
insert into t2 values(1,1);
set @a=(select fk_id from t2);
select @a;
+------+
| @a   |
+------+
|    1 |
+------+
CREATE TABLE person (
  first_name VARCHAR(10) NOT NULL COMMENT '名',
  last_name VARCHAR(10) NOT NULL COMMENT '姓',
  full_name VARCHAR(21) GENERATED ALWAYS AS (CONCAT(first_name,' ',last_name)) STORED NOT NULL COMMENT '全名'
);
insert into person(first_name,last_name) values('xiao','lai');
insert into person(first_name,last_name) values('lai','xiao');
set @a=(select full_name from person);
ERROR 21000: Subquery returns more than 1 row
set @a=(select full_name from person where last_name='lai' );
select @a;
+----------+
| @a       |
+----------+
| xiao lai |
+----------+
ALTER TABLE person ADD full_name_gc VARCHAR(21) 
GENERATED ALWAYS AS (CONCAT(first_name,'_',last_name)) VIRTUAL NOT NULL COMMENT '全名(虚拟列)';
set @a=(select full_name from person);
ERROR 21000: Subquery returns more than 1 row
set @a=(select full_name from person where last_name='lai' );
select @a;
+----------+
| @a       |
+----------+
| xiao lai |
+----------+
SET NAMES utf8mb4;
set @e=(select id from tt2);
select @e;
+------+
| @e   |
+------+
|    3 |
+------+
set @e=(select '测试' as name from tt2);
select @e;
+--------+
| @e     |
+--------+
| 测试   |
+--------+
SET NAMES gbk;
set @e=(select a from tt1 where id=1);
select @e;
+--------+
| @e     |
+--------+
| test01 |
+--------+
select @e;
+--------+
| @e     |
+--------+
| test01 |
+--------+
set @a=(SELECT _utf8mb4'abc' COLLATE utf8mb4_unicode_ci);
ERROR 42000: COLLATION 'utf8mb4_unicode_ci' is not valid for CHARACTER SET 'gbk'
select @a;
+----------+
| @a       |
+----------+
| xiao lai |
+----------+
set @a=(select CHARSET(0x5461626c65));
select @a;
+--------+
| @a     |
+--------+
| binary |
+--------+
set @a=(SELECT 0b1100001), @b=(select CHARSET(0b1100001));
select @a,@b;
+------+--------+
| @a   | @b     |
+------+--------+
| a    | binary |
+------+--------+
set @a=(select 0x5461626c65);
select @a;
+-------+
| @a    |
+-------+
| Table |
+-------+
SET NAMES GB18030;
set @e=(select distinct id  from tt1 where id in(select id from tt2));
select @e;
+------+
| @e   |
+------+
|    3 |
+------+
set @a=(select CHARSET(0x5461626c65));
select @a;
+--------+
| @a     |
+--------+
| binary |
+--------+
set @a=(select 0x5461626c65);
select @a;
+-------+
| @a    |
+-------+
| Table |
+-------+
set @a=(SELECT 0b1100001), @b=(select CHARSET(0b1100001));
select @a,@b;
+------+--------+
| @a   | @b     |
+------+--------+
| a    | binary |
+------+--------+
select @e;
+------+
| @e   |
+------+
|    3 |
+------+
SET NAMES binary;
set @e=(select d from (select * from tt2) tt);
select @e;
+------------+
| @e         |
+------------+
| 2022-03-02 |
+------------+
set @e=(select '测试' as name from tt2);
select @e;
+--------+
| @e     |
+--------+
| 测试   |
+--------+
set @a=(select CHARSET(0x5461626c65));
select @a;
+--------+
| @a     |
+--------+
| binary |
+--------+
set @a=(select 0x5461626c65);
select @a;
+-------+
| @a    |
+-------+
| Table |
+-------+
set @a=(SELECT 0b1100001), @b=(select CHARSET(0b1100001));
select @a,@b;
+------+--------+
| @a   | @b     |
+------+--------+
| a    | binary |
+------+--------+
SET NAMES UTF8;
set @e=(select '测试');
select @e;
+--------+
| @e     |
+--------+
| 测试   |
+--------+
set @a=(select CHARSET(0x5461626c65));
select @a;
+--------+
| @a     |
+--------+
| binary |
+--------+
set @a=(select 0x5461626c65);
select @a;
+-------+
| @a    |
+-------+
| Table |
+-------+
set @a=(SELECT 0b1100001), @b=(select CHARSET(0b1100001));
select @a,@b;
+------+--------+
| @a   | @b     |
+------+--------+
| a    | binary |
+------+--------+
set @a=(SELECT TRUE, true, FALSE, false);
ERROR 21000: Operand should contain 1 column(s)
set @a=(SELECT TRUE),@b=(select false);
select @a,@b;
+------+------+
| @a   | @b   |
+------+------+
|    1 |    0 |
+------+------+
set @a=1;
set @b='test';
set @c =(select @a from dual)+2;
select @c;
+------+
| @c   |
+------+
|    3 |
+------+
set @c =(select @b from dual)+2;
Warnings:
Warning	1292	Truncated incorrect DOUBLE value: 'test'
select @c;
+------+
| @c   |
+------+
|    2 |
+------+
set @c=(SELECT (SELECT id FROM tt2) FROM tt1 where id=1);
select @c;
+------+
| @c   |
+------+
|    3 |
+------+
set @c=(SELECT (SELECT id FROM tt2) FROM tt1);
ERROR 21000: Subquery returns more than 1 row
set @c=(SELECT (SELECT id ,a FROM tt2) FROM tt1 where id=1);
ERROR 21000: Operand should contain 1 column(s)
set @c =(select HEX((SELECT id FROM tt1 WHERE id=1)));
select @c;
+------+
| @c   |
+------+
| 1    |
+------+
set @a=(SELECT a FROM tt2
 WHERE ROW(id,a) = (SELECT id, a FROM tt1 WHERE id = 3));
select @a;
+--------+
| @a     |
+--------+
| test03 |
+--------+
SET @a=(SELECT d FROM tt1 WHERE TT1.id IN (SELECT TT2.ID FROM TT2 WHERE TT2.ID = TT1.ID));
select @a;
+------------+
| @a         |
+------------+
| 2022-03-03 |
+------------+
ob_mysql_set_2 pl
drop table tt1;
create table tt1(id int,a varchar(20),d date);
insert into tt1 values(1,'test01','2022-3-2');
insert into tt1 values(2,'test02','2022-3-3');
insert into tt1 values(3,'test03','2022-3-3');
insert into tt1 values(3,'test033','2022-3-8');
drop table tt2;
create table tt2(id int,a varchar(20),d date);
insert into tt2 values(3,'test03','2022-3-2');
drop view vtt1;
drop view vtt2;
create view vtt1 as select * from tt1;
create view vtt2 as select * from tt2;
DROP PROCEDURE p_test01;
CREATE  PROCEDURE p_test01(in a int)
begin
    declare i int;
    set i=(select id from tt2);
	select i;
	set @a=1+(select id from tt2),@b=(select distinct d from tt1 where id between 1 and 1);
	select @a,@b;	
	set @a=(select distinct d from tt1 where id between 1 and 1);
    select @a;
end;
//
CALL p_test01((select 10));
+------+
| i    |
+------+
+------+------------+
| @a   | @b         |
+------+------------+
+------------+
| @a         |
+------------+
|    3 |
|    4 | 2022-03-02 |
| 2022-03-02 |
+------+
+------+------------+
+------------+
DROP PROCEDURE p_test01;
CREATE  PROCEDURE p_test01(in a int)
begin
    declare i int;
	set @a=a;
	select @a;	
end;
//
CALL p_test01((select * from tt2));
ERROR 21000: Operand should contain 1 column(s)
CALL p_test01((select id from tt1));
ERROR 21000: Subquery returns more than 1 row
CALL p_test01((select id from tt2));
+------+
| @a   |
+------+
|    3 |
+------+
CALL p_test01((select 10));
+------+
| @a   |
+------+
|   10 |
+------+
DROP PROCEDURE p_test01;
CREATE  PROCEDURE p_test01()
begin
	set @a=(select 3);
	select @a;
	set @a=(select distinct id from tt1 where id =3);
	select @a;
	set @a=(select d from tt2 order by id),@c=(select distinct d from tt2 group by d);
	select @a;
	select @d;
	set @a=(select distinct d from tt2 group by d);
	select @a;
	set @a=(select d from tt1 where id <=2 limit 1);
    select @a;
	set @a=(select a from tt1 where id in ((select 1),(select 5)));
    select @a;
	set @a=(select sum(id) from tt1 group by id having sum(id)>3);
    select @a;
	set @a=(select a from tt1 where a like '%03');
    select @a;
	set @a=(select id from tt1 where id =3 and a='test03')-1;
    select @a;
	set @a=(select (case when id =1 then 5 end) from tt1 where id=1);
    select @a;
	set @b=(select distinct tt2.id from tt1 inner join tt2 on tt1.id=tt2.id);
    select @b;
	set @a=(select d from tt2 where exists  (select id from tt1));
    select @a;
	set @a=(select id from tt2 where id >=some(select id from tt1));
    select @a;
	set @a=(select distinct id from (select id from tt1 where id >(select 2)) tt5);
    select @a;
	set @a=(select a from tt1 where id <(select 2 from dual));
    select @a;
end;
//
CALL p_test01();
+------+
| @a   |
+------+
+------+
| @a   |
+------+
+------------+
| @a         |
+------------+
+------+
| @d   |
+------+
+------------+
| @a         |
+------------+
+------------+
| @a         |
+------------+
+--------+
| @a     |
+--------+
+------+
| @a   |
+------+
+--------+
| @a     |
+--------+
+------+
| @a   |
+------+
+------+
| @a   |
+------+
+------+
| @b   |
+------+
+------------+
| @a         |
+------------+
+------+
| @a   |
+------+
+------+
| @a   |
+------+
+--------+
| @a     |
+--------+
|    3 |
|    3 |
| 2022-03-02 |
|    1 |
| 2022-03-02 |
| 2022-03-02 |
| test01 |
|    6 |
| test03 |
|    2 |
|    5 |
|    3 |
| 2022-03-02 |
|    3 |
|    3 |
| test01 |
+------+
+------+
+------------+
+------+
+------------+
+------------+
+--------+
+------+
+--------+
+------+
+------+
+------+
+------------+
+------+
+------+
+--------+
drop view vtt1;
create view vtt1 as select * from tt1;
drop view vtt2;
create view vtt2 as select * from tt2;
DROP PROCEDURE p_test01;
CREATE  PROCEDURE p_test01()
begin

	set @a=(select distinct id from vtt1 where id =3);
	select @a;
	select @c;
    set @c=(select 3&5);
	set @a=(select d from vtt2 order by id);
	select @a;
	set @a=(select distinct d from vtt2 group by d);
	select @a;
	set @a=(select d from vtt1 where id <=2 limit 1);
    select @a;
	set @a=(select a from vtt1 where id in ((select 1),(select 5)));
    select @a;
	set @a=(select sum(id) from vtt1 group by id having sum(id)>3);
    select @a;
	set @a=(select a from vtt1 where a like '%03');
    select @a;
	set @a=(select id from vtt1 where id =3 and a='test03');
    select @a;
	set @a=(select (case when id =1 then 5 end) from vtt1 where id=1);
    select @a;
	set @b=(select distinct vtt2.id from vtt1 inner join vtt2 on vtt1.id=vtt2.id);
    select @b;
	set @a=(select d from vtt2 where exists  (select id from vtt1));
    select @a;
	set @a=(select id from vtt2 where id >=some(select id from vtt1));
    select @a;
	set @a=(select distinct id from (select id from vtt1 where id >(select 2)) tt5);
    select @a;
	set @a=(select a from vtt1 where id <(select 2 from dual));
    select @a;
end;
//
CALL p_test01();
+------+
| @a   |
+------+
+------------+
| @c         |
+------------+
+------------+
| @a         |
+------------+
+------------+
| @a         |
+------------+
+------------+
| @a         |
+------------+
+--------+
| @a     |
+--------+
+------+
| @a   |
+------+
+--------+
| @a     |
+--------+
+------+
| @a   |
+------+
+------+
| @a   |
+------+
+------+
| @b   |
+------+
+------------+
| @a         |
+------------+
+------+
| @a   |
+------+
+------+
| @a   |
+------+
+--------+
| @a     |
+--------+
|    3 |
| 2022-03-02 |
| 2022-03-02 |
| 2022-03-02 |
| 2022-03-02 |
| test01 |
|    6 |
| test03 |
|    3 |
|    5 |
|    3 |
| 2022-03-02 |
|    3 |
|    3 |
| test01 |
+------+
+------------+
+------------+
+------------+
+------------+
+--------+
+------+
+--------+
+------+
+------+
+------+
+------------+
+------+
+------+
+--------+
DROP PROCEDURE p_test01;
CREATE  PROCEDURE p_test01()
begin
  set @c=(select 1+2);
  select @c;
  set @c=(select 5 in (1,2,3,4,5));
  select @c;
  set @c=(select 2 or 1);
  select @c;
  set @d=(SELECT CURRENT_DATE);
  select @d;
  set @d=(SELECT SECOND('18:20:17'));
  select @d;
  set @d=(SELECT CONCAT('test','obclient', '1.0'));
  select @d;
  set @d=(SELECT CEILING(1.23));
  select @d;
  set @b=(SELECT BIT_COUNT(BIT_OR(1<<id)) AS days FROM tt2 GROUP BY d);
  select @b;
  set @b=(SELECT  CUME_DIST() OVER(PARTITION BY ID ORDER BY a) CUME_DIST FROM tt2);
  select @b;
  set @b=(SELECT ANY_VALUE(a) FROM tt2 GROUP BY id);
  select @b;
end;
//
CALL p_test01();
+------+
| @c   |
+------+
+------+
| @c   |
+------+
+------+
| @c   |
+------+
+------------+
| @d         |
+------------+
+------+
| @d   |
+------+
+-----------------+
| @d              |
+-----------------+
+------+
| @d   |
+------+
+------+
| @b   |
+------+
+------+
| @b   |
+------+
+--------+
| @b     |
+--------+
|    3 |
|    1 |
|    1 |
| 2020-09-13 |
|   17 |
| testobclient1.0 |
|    2 |
|    1 |
|    1 |
| test03 |
+------+
+------+
+------+
+------------+
+------+
+-----------------+
+------+
+------+
+------+
+--------+
select @c;
+------+
| @c   |
+------+
|    1 |
+------+
select @b;
+--------+
| @b     |
+--------+
| test03 |
+--------+
select @d;
+------+
| @d   |
+------+
|    2 |
+------+
DROP PROCEDURE p_test01;
CREATE  PROCEDURE p_test01(in i int)
begin
    if i<1 then
	 set @a=(select d from tt2 where id >=(select 3));
	 select @a;
	 elseif i=1 then 
	 set @b=(SELECT min(id) FROM tt1 order by id);
     select @b;
	 else
	 set @c=(select 1 || 0);
     select @c;
	 end if;
end;
//
call p_test01(0);
+------------+
| @a         |
+------------+
| 2022-03-02 |
+------------+
select @a;
+------------+
| @a         |
+------------+
| 2022-03-02 |
+------------+
call p_test01(1);
+------+
| @b   |
+------+
|    1 |
+------+
select @b;
+------+
| @b   |
+------+
|    1 |
+------+
call p_test01(2);
+------+
| @c   |
+------+
|    1 |
+------+
select @c;
+------+
| @c   |
+------+
|    1 |
+------+
DROP PROCEDURE p_test01;
CREATE  PROCEDURE p_test01()
begin
    set @i=(select 1);
    while @i <= 5 DO
    set @b=(select distinct tt1.d from tt1 full join tt2 on tt1.id=tt2.id where tt1.d='2022-03-03');
    select @b;  
	set @i = @i + (select id from tt1 where id=1);
    end WHILE;
end;
//
call p_test01();
+------------+
| @b         |
+------------+
+------------+
| @b         |
+------------+
+------------+
| @b         |
+------------+
+------------+
| @b         |
+------------+
+------------+
| @b         |
+------------+
| 2022-03-03 |
| 2022-03-03 |
| 2022-03-03 |
| 2022-03-03 |
| 2022-03-03 |
+------------+
+------------+
+------------+
+------------+
+------------+
select @b;
+------------+
| @b         |
+------------+
| 2022-03-03 |
+------------+
DROP PROCEDURE p_test01;
create procedure p_test01()
begin
set @i=(select abs(1));
repeat
set @i=@i+(select id from tt2);
set @a=(select a from tt1 where id <(select 2 from dual));
set @a:=(select a from tt1 where id <(select 2 from dual));
select @a;
until @i>5
end repeat;
end;
//
call p_test01();
+--------+
| @a     |
+--------+
+--------+
| @a     |
+--------+
| test01 |
| test01 |
+--------+
+--------+
select @a;
+--------+
| @a     |
+--------+
| test01 |
+--------+
DROP PROCEDURE p_test01;
create procedure p_test01(out b int)
begin
set @i=0;
loop_label: loop
set @a=(SELECT sum(distinct id) FROM tt1);
set @i=@i+(select 1);
if @i>=3 then
set @b=(select sum(id) from tt2 where id>1 and a in((select "test03"),(select "test02")));
leave loop_label;
end if;
end loop;
end;//
call p_test01(@b);
select @b;
+------+
| @b   |
+------+
| NULL |
+------+
DROP PROCEDURE p_test01;
create procedure p_test01(out b date,out c varchar(20))
begin
set @a=(select d from tt2);
select @a into b;
set @d=(select a from vtt2);
select @d into c;
set @d:=(select a from vtt2);
end;//
call p_test01(@b,@c);
set @d=(select @b,@c from dual);
ERROR 21000: Operand should contain 1 column(s)
set @d=(select @b from dual);
select @d;
+------------+
| @d         |
+------------+
| 2022-03-02 |
+------------+
set @d=(select @c from dual);
select @d;
+--------+
| @d     |
+--------+
| test03 |
+--------+
drop table t3;
create table t3( id int,name varchar(30)) partition by list (id)
(
partition part_1 values in( 1, 3, 5, 7 ),
partition part_2 values in( 2, 4, 6, 8 ),
partition part_default values in(10,20,30,40,50)
);
insert into t3 values(1,'test01');
DROP PROCEDURE p_test01;
CREATE  PROCEDURE p_test01(in j int)
begin
	
	case 
	    when j in(select id from t3) 
		then set @a=(select name from t3 where id=1);
		select @a;
		else set @b=(select 1 from (select id from t3) tt);
		select @b;
	end case;
	set @n=(select '2010-1-10');
	insert into vtt1(d) values(@n);
	update vtt1 set d=@n where d =@n;
	delete from vtt1  where d=@n;
	
end;
//
call p_test01(1);
+--------+
| @a     |
+--------+
| test01 |
+--------+
call p_test01(2);
+------+
| @b   |
+------+
|    1 |
+------+
drop trigger tr_test;
CREATE  trigger tr_test before insert on tt1
for each row
begin
    set @i=(select 1);
    while @i <= 5 DO
    set @a:=(select 3);
	set @a=(select d from tt2 order by id);
	set @a=(select distinct d from tt2 group by d);
	set @a=(select d from tt2 where exists  (select id from tt2));
	set @i=(select (@i+1));
	end while;
end;
//
insert into tt1 values(1,'tr01','2019-10-10');
select @a;
+------------+
| @a         |
+------------+
| 2022-03-02 |
+------------+
drop trigger tr_test;
CREATE  trigger tr_test after insert on tt1
for each row
begin
    
    set @a=(select 3),@b=(select 4+1);
	set @a=(select d from tt2 order by id);
	set @a=(select distinct d from tt2 group by d);
	set @a=(select d from tt2 where exists  (select id from tt2));
	set @b=(select id from (select * from tt2) tt where id in(select id from vtt2 order by d));
	set @i=(select id from vtt2);
	set @c=(SELECT /*+ no_use_px */ a FROM tt2);
	set @c=(select count(*) from vtt2 where id=3 group by a limit 1);
    loop_label: loop
    set @a=(SELECT sum(distinct id) FROM tt2);
    set @i=@i+(select 1);
	set @b=1-(select id from tt2 union select id from tt2);
	set @d=(SELECT TRUNCATE(3.27,1));
    set @d:=(SELECT TRUNCATE(3.27,1));
    if @i>=3 then
    set @b=(select sum(id) from tt2 where id>1 and a in((select "test03"),(select "test02")));
    set @a=(select d from tt2 where exists  (select id from tt2));
   leave loop_label;
   end if;
end loop;
end;
//
insert into tt1 values(1,'tr01','2019-10-10');
select @a,@b;
+------------+------+
| @a         | @b   |
+------------+------+
| 2022-03-02 |    3 |
+------------+------+
drop trigger tr_test;
CREATE  trigger tr_test after update on tt1
for each row
begin
    set @i=(select abs(1));
    repeat
    set @a=(select 3);
	set @a:=(select d from tt2 order by id);
	set @a=(select distinct d from tt2 group by d);
	set @a=(select d from tt2 where exists  (select id from tt2));
	set @a=(select a from tt2 where id=1);
	set @i=@i+(select 1);
	until @i>5
end repeat;
end;
//
insert into tt1 values(1,'tr01','2019-10-10');
update tt1 set id=10;
set @b=(select @a);
drop trigger tr_test;
CREATE  trigger tr_test before update on tt1
for each row
begin
    set @i=(select abs(1));
    repeat
    set @a=(select 3);
	set @a:=(select d from tt2 order by id);
	set @a=(select distinct d from tt2 group by d);
	set @a=(select d from tt2 where exists  (select id from tt2));
	set @a=(select a from tt2 where id=1);
	set @i=@i+(select 1);
	until @i>5
end repeat;
end;
//
insert into tt1 values(1,'tr01','2019-10-10');
update tt1 set id=10;
set @b=(select @a);
drop trigger tr_test;
CREATE  trigger tr_test before delete on tt1
for each row
begin
    set @a=(select 3);
	set @a=(select d from tt2 order by id);
	set @a=(select distinct d from tt2 group by d);
	set @a=(select d from tt2 where exists  (select id from tt2));
	set @n=(select '2010-1-10');
	insert into tt2(d) values(@n);
	update tt2 set d=@n where d =@n;
	delete from tt2  where d=@n;
end;
//
insert into tt1 values(1,'tr01','2019-10-10');
delete from tt1;
select @a;
+------------+
| @a         |
+------------+
| 2022-03-02 |
+------------+
drop trigger tr_test;
CREATE  trigger tr_test after delete on tt1
for each row
begin
    set @i=(select (select 0));
	set @j=(select (select 0));
	set @d=(SELECT WEEKOFYEAR('2020-07-16'));
	while @i<5 do 
    if @i=@j then 
    set @a=(select 3);
	set @a=(select d from tt2 order by id);
	elseif @i=1 then 
	set @a=(select distinct d from tt2 group by d);
	else
	set @a=(select d from tt2 where exists  (select id from tt2));
    end if;
	set @i=@i+(select 1);
	end while;
end;
//
insert into tt1 values(1,'tr01','2019-10-10');
delete from tt1;
select @a;
+------------+
| @a         |
+------------+
| 2022-03-02 |
+------------+
drop table tt1;
create table tt1(id int,a varchar(20),d date);
insert into tt1 values(1,'test01','2022-3-2');
insert into tt1 values(2,'test02','2022-3-3');
insert into tt1 values(3,'test03','2022-3-3');
insert into tt1 values(3,'test033','2022-3-8');
drop table tt2;
create table tt2(id int,a varchar(20),d date);
insert into tt2 values(3,'test03','2022-3-2');
drop function fun_test;
create function fun_test()
returns varchar(20)
begin
   
	set @a=(select distinct id from tt1 where id =3);
	set @a:=(select distinct id from tt1 where id =3);
	set @a=(select d from tt2 order by id);
	set @a=(select distinct d from tt2 group by d);
	set @a=(select d from tt1 where id <=2 limit 1);
	set @a=(select a from tt1 where id in ((select 1),(select 5)));
	set @a=(select sum(id) from tt1 group by id having sum(id)>3);
	set @a=(select a from tt1 where a like '%03');
	set @a=(select id from tt1 where id =3 and a='test03');
	set @a=1+(select (case when id =1 then 5 end) from tt1 where id=1);
	set @b=(select distinct tt2.id from tt1 inner join tt2 on tt1.id=tt2.id);
	set @a=(select d from tt2 where exists  (select id from tt1));
	set @a=(select id from tt2 where id >=some(select id from tt1));
	set @a=(select distinct id from (select id from tt1 where id >(select 2)) tt5);
	set @a=(select a from tt1 where id <(select 2 from dual));
return @a;
end;
//
select fun_test();
+------------+
| fun_test() |
+------------+
| test01     |
+------------+
select @a;
+--------+
| @a     |
+--------+
| test01 |
+--------+
select @b;
+------+
| @b   |
+------+
|    3 |
+------+
drop function fun_test;
create function fun_test()
returns varchar(20)
begin
set @i=0;
loop_label: loop
set @a=(SELECT sum(distinct id) FROM tt1);
set @i=(select(@i+(select 1)));
if @i>=3 then
set @b=(select sum(id) from tt2 where id>1 and a in((select "test03"),(select "test02")));
leave loop_label;
end if;
end loop;
return 'test';
end;
//
select fun_test();
+------------+
| fun_test() |
+------------+
| test       |
+------------+
drop function fun_test;
create function fun_test()
returns date
begin
 set @i=(select abs(1));
    repeat
    set @c=(select 2<=3);
    set @a=(select 3);
	set @a:=(select d from tt2 order by id);
	set @a=(select distinct d from tt2 group by d);
	set @a=(select d from tt2 where exists  (select id from tt2));
	set @a=(select a from tt2 where id=1);
	set @i=@i+(select 1);
	until @i>5
end repeat;
set @a=(select distinct d from tt2 group by d);
return @a;
end;
//
set @d=(select fun_test());
select @d;
+------------+
| @d         |
+------------+
| 2022-03-02 |
+------------+
drop function fun_test;
create function fun_test(a int)
returns int
begin
    set @b=a;
    set @a=(select 3);
	set @a:=(select 3);
	set @a=(select distinct id from vtt1 where id =3)+5,@c=(select d from vtt2 order by id);
	set @a=(select d from vtt2 order by id);
	set @a=(select distinct d from (select * from tt2) tt group by d);
	set @a=(select d from (select * from tt1) tt where id <=2 limit 1);
	set @a=(select a from (select * from tt1) tt where id in ((select 1),(select 5)));
	set @a=(select sum(id) from (select * from tt1) tt group by id having sum(id)>3);
	set @a=(select a from (select * from tt1) tt where a like '%03');
	set @a=(select id from (select * from tt1) tt where id =3 and a='test03');
	set @a=(select (case when id =1 then 5 end) from (select * from tt1) tt where id=1);
	set @b=(select distinct tt2.id from (select * from tt1) tt inner join tt2 on tt.id=tt2.id);
	set @a=(select d from (select * from tt2) tt where exists  (select id from tt1));
	set @a=(select id from (select * from tt2) tt where id >=some(select id from tt1));
	set @a=(select distinct id from (select id from tt1 where id >(select 2)) tt5);
	set @a=(select a from (select * from tt1) tt where id <(select 2 from dual));
return @b;
end;
//
select fun_test((select id from tt2));
+--------------------------------+
| fun_test((select id from tt2)) |
+--------------------------------+
|                              3 |
+--------------------------------+
set @e=(select fun_test((select id from tt2)));
select @e;
+------+
| @e   |
+------+
|    3 |
+------+
select @e;
+------+
| @e   |
+------+
|    3 |
+------+
select @a;
+------+
| @a   |
+------+
|    3 |
+------+
select @b;
+------+
| @b   |
+------+
|    3 |
+------+
drop function fun_test;
create function fun_test(a int)
returns int
begin
set @i=(select 1);
if a>1 then
 set @a=(select id*2 from vtt2 where id >some (select id from tt1));
 elseif a<1 then
 set @a=(select 1);
 set @a:=(select 1);
 else 
 set @a =(select ( 1 or (select 1 from dual)));
 end if;
 while @i<=2 do
 set @i=@i+(select id from tt2);
 set @d=(SELECT utc_date()+1),@c=(select 1);
 set @c=(select '12345' like '12_');
 end while;
return @i;
end;
//
select fun_test(2);
+-------------+
| fun_test(2) |
+-------------+
|           4 |
+-------------+
select fun_test(0);
+-------------+
| fun_test(0) |
+-------------+
|           4 |
+-------------+
select fun_test(1);
+-------------+
| fun_test(1) |
+-------------+
|           4 |
+-------------+
set @a=(select fun_test(2)+4);
select @a;
+------+
| @a   |
+------+
|    8 |
+------+
drop function func;
create function func() returns int unsigned return 1;//
set @a = (select func() or (select 1) from dual);
select @a;
+------+
| @a   |
+------+
|    1 |
+------+
drop function func;
create function func() returns varchar(20)
begin 
set @b=(select a from tt2 where id =(select 3));
insert into tt3(a) values(@b);
update tt3 set a=@b;
delete from tt3 where a=@b;
set @b=(SELECT JSON_SEARCH(@jn, 'all', 'ghk'));
return @b;
end;//
select func();
+--------+
| func() |
+--------+
| NULL   |
+--------+
select * from tt3;
+------+------+------+
| id   | a    | d    |
+------+------+------+
+------+------+------+
set @a=(select func() from dual);
select @a;
+------+
| @a   |
+------+
| NULL |
+------+
drop function func;
create function func(username varchar(20)) returns varchar(20)
begin
set @i= (select username);
return (select @i) ;
end;//
set @a = (select func('test') and 'hao');
Warnings:
Warning	1292	Truncated incorrect DOUBLE value: 'test'
set @a := (select func('test') and 'hao');
Warnings:
Warning	1292	Truncated incorrect DOUBLE value: 'test'
select @a;
+------+
| @a   |
+------+
|    0 |
+------+
drop function func;
create function func(num1 smallint unsigned,num2 smallint unsigned) returns date 
return (select utc_date);//
set @a = (select func(5.5,6.5));
select @a;
+------------+
| @a         |
+------------+
| 2020-09-13 |
+------------+
drop table tt1;
drop table tt2;
drop table tt3;
drop table t2;
drop table t1;
drop view vtt1;
drop view vtt2;
drop database  IF EXISTS  oblrp1;
########清空回收站，删除测试数据库，表等 ##########
drop database  IF EXISTS  oblrp;
purge recyclebin;
