drop database if exists test_async_scheduler;
create database test_async_scheduler;
use test_async_scheduler;
alter system set_tp tp_name = ERRSIM_FAILED_ANALYZE_TABLE_STATS, error_code = 4013, frequency = 1;
create table t(c1 int, c2 int);
create table t1(c1 int, c2 int, c3 int, index i1(c1,c2)) partition by hash(c1) partitions 2;
create table tsubpart1 (c1 int, c2 int) partition by hash(c1)
subpartition by hash(c2)
subpartition template (subpartition p0, subpartition p1)
partitions 2;
insert into t values(1,1), (2,2), (3,3), (4,4), (5,5), (6,6), (7,7), (8,8), (9,9), (10,10);
insert into t values(11,1), (12,2), (13,3), (14,4), (15,5), (16,6), (17,7), (18,8), (19,9), (20,10);
insert into t values(21,1), (22,2), (23,3), (24,4), (25,5), (26,6), (27,7), (28,8), (29,9), (30,10);
insert into t values(31,1), (32,2), (33,3), (34,4), (35,5), (36,6), (37,7), (38,8), (39,9), (40,10);
insert into t values(41,1), (42,2), (43,3), (44,4), (45,5), (46,6), (47,7), (48,8), (49,9), (50,10);
insert into t values(51,1), (52,2), (53,3), (54,4), (55,5), (56,6), (57,7), (58,8), (59,9), (60,10);
insert into t values(61,1), (62,2), (63,3), (64,4), (65,5), (66,6), (67,7), (68,8), (69,9), (70,10);
insert into t values(71,1), (72,2), (73,3), (74,4), (75,5), (76,6), (77,7), (78,8), (79,9), (80,10);
insert into t values(81,1), (82,2), (83,3), (84,4), (85,5), (86,6), (87,7), (88,8), (89,9), (90,10);
insert into t values(91,1), (92,2), (93,3), (94,4), (95,5), (96,6), (97,7), (98,8), (99,9), (100,10);
insert into t values(101,1), (102,2), (103,3), (104,4), (105,5), (106,6), (107,7), (108,8), (109,9), (110,10);
insert into t values(111,1), (112,2), (113,3), (114,4), (115,5), (116,6), (117,7), (118,8), (119,9), (120,10);
insert into t values(121,1), (122,2), (123,3), (124,4), (125,5), (126,6), (127,7), (128,8), (129,9), (130,10);
insert into t values(131,1), (132,2), (133,3), (134,4), (135,5), (136,6), (137,7), (138,8), (139,9), (140,10);
insert into t values(141,1), (142,2), (143,3), (144,4), (145,5), (146,6), (147,7), (148,8), (149,9), (150,10);
insert into t values(151,1), (152,2), (153,3), (154,4), (155,5), (156,6), (157,7), (158,8), (159,9), (160,10);
insert into t values(161,1), (162,2), (163,3), (164,4), (165,5), (166,6), (167,7), (168,8), (169,9), (170,10);
insert into t values(171,1), (172,2), (173,3), (174,4), (175,5), (176,6), (177,7), (178,8), (179,9), (180,10);
insert into t values(181,1), (182,2), (183,3), (184,4), (185,5), (186,6), (187,7), (188,8), (189,9), (190,10);
insert into t values(191,1), (192,2), (193,3), (194,4), (195,5), (196,6), (197,7), (198,8), (199,9), (200,10);
insert into t select * from t;
insert into t select * from t;
insert into t select * from t;
insert into t1 select c1, c2, c1+c2 from t;
insert into tsubpart1 select * from t;
select TABLE_NAME,PARTITION_NAME,SUBPARTITION_NAME,STALE_STATS,NUM_ROWS from oceanbase.DBA_TAB_STATISTICS where TABLE_NAME in ('aa', 'bb', 'cc', 't', 't1','tsubpart', 'tsubpart1') and OWNER ='test_async_scheduler';
TABLE_NAME	PARTITION_NAME	SUBPARTITION_NAME	STALE_STATS	NUM_ROWS
t	NULL	NULL	NULL	NULL
t1	NULL	NULL	NULL	NULL
t1	p0	NULL	NULL	NULL
t1	p1	NULL	NULL	NULL
tsubpart1	NULL	NULL	NULL	NULL
tsubpart1	p0	NULL	NULL	NULL
tsubpart1	p0	p0sp0	NULL	NULL
tsubpart1	p0	p0sp1	NULL	NULL
tsubpart1	p1	NULL	NULL	NULL
tsubpart1	p1	p1sp0	NULL	NULL
tsubpart1	p1	p1sp1	NULL	NULL
select t.table_name, s.stale_stats,	s.spare1,	s.spare2  from oceanbase.__all_table_stat s inner join  oceanbase.__all_table t on s.table_id = t.table_id 
where t.table_name  in ('t', 't1','tsubpart', 'tsubpart1') and t.database_id in (select database_id from oceanbase.__all_database where database_name ='test_async_scheduler' );
table_name	stale_stats	spare1	spare2
call dbms_stats.async_gather_stats_job_proc();
select TABLE_NAME,PARTITION_NAME,SUBPARTITION_NAME,STALE_STATS,NUM_ROWS from oceanbase.DBA_TAB_STATISTICS where TABLE_NAME in ('aa', 'bb', 'cc', 't', 't1','tsubpart', 'tsubpart1') and OWNER ='test_async_scheduler';
TABLE_NAME	PARTITION_NAME	SUBPARTITION_NAME	STALE_STATS	NUM_ROWS
t	NULL	NULL	YES	0
t1	NULL	NULL	YES	0
t1	p0	NULL	YES	0
t1	p1	NULL	YES	0
tsubpart1	NULL	NULL	YES	0
tsubpart1	p0	NULL	YES	0
tsubpart1	p0	p0sp0	YES	0
tsubpart1	p0	p0sp1	NULL	NULL
tsubpart1	p1	NULL	YES	0
tsubpart1	p1	p1sp0	NULL	NULL
tsubpart1	p1	p1sp1	YES	0
select t.table_name, s.stale_stats,	s.spare1,	s.spare2  from oceanbase.__all_table_stat s inner join  oceanbase.__all_table t on s.table_id = t.table_id 
where t.table_name  in ('t', 't1','tsubpart', 'tsubpart1') and t.database_id in (select database_id from oceanbase.__all_database where database_name ='test_async_scheduler' );
table_name	stale_stats	spare1	spare2
t	1	NULL	1
t1	1	NULL	1
t1	1	NULL	1
t1	1	NULL	1
tsubpart1	1	NULL	1
tsubpart1	1	NULL	1
tsubpart1	1	NULL	1
tsubpart1	1	NULL	1
tsubpart1	1	NULL	1
call dbms_stats.async_gather_stats_job_proc();
call dbms_stats.async_gather_stats_job_proc();
call dbms_stats.async_gather_stats_job_proc();
call dbms_stats.async_gather_stats_job_proc();
create table tsubpart (c1 int, c2 int) partition by hash(c1)
subpartition by hash(c2)
subpartition template (subpartition p0, subpartition p1)
partitions 2;
insert into tsubpart select * from t;
alter system set_tp tp_name = ERRSIM_FAILED_ANALYZE_TABLE_STATS, error_code = 4013, frequency = 0;
use test_async_scheduler;
select t.table_name, s.stale_stats,	s.spare1,	s.spare2  from oceanbase.__all_table_stat s inner join  oceanbase.__all_table t on s.table_id = t.table_id 
where t.table_name  in ('t', 't1','tsubpart', 'tsubpart1') and t.database_id in (select database_id from oceanbase.__all_database where database_name ='test_async_scheduler' );
table_name	stale_stats	spare1	spare2
t	1	NULL	5
t1	1	NULL	5
t1	1	NULL	5
t1	1	NULL	5
tsubpart1	1	NULL	5
tsubpart1	1	NULL	5
tsubpart1	1	NULL	5
tsubpart1	1	NULL	5
tsubpart1	1	NULL	5
call dbms_stats.async_gather_stats_job_proc();
select t.table_name, s.stale_stats,	s.spare1,	s.spare2  from oceanbase.__all_table_stat s inner join  oceanbase.__all_table t on s.table_id = t.table_id 
where t.table_name  in ('t', 't1','tsubpart', 'tsubpart1') and t.database_id in (select database_id from oceanbase.__all_database where database_name ='test_async_scheduler' );
table_name	stale_stats	spare1	spare2
t	1	NULL	5
t1	1	NULL	5
t1	1	NULL	5
t1	1	NULL	5
tsubpart	0	1600	0
tsubpart	0	800	0
tsubpart	0	800	0
tsubpart	0	800	0
tsubpart	0	800	0
tsubpart1	1	NULL	5
tsubpart1	1	NULL	5
tsubpart1	1	NULL	5
tsubpart1	1	NULL	5
tsubpart1	1	NULL	5
call dbms_stats.GATHER_DATABASE_STATS_JOB_PROC();
select t.table_name,s.stale_stats,	s.spare1,	s.spare2  from oceanbase.__all_table_stat s inner join  oceanbase.__all_table t on s.table_id = t.table_id 
where t.table_name  in ('t', 't1','tsubpart', 'tsubpart1') and t.database_id in (select database_id from oceanbase.__all_database where database_name ='test_async_scheduler' );
table_name	stale_stats	spare1	spare2
t	1	NULL	5
t1	1	NULL	5
t1	1	NULL	5
t1	1	NULL	5
tsubpart	0	0	0
tsubpart	0	0	0
tsubpart	0	1600	0
tsubpart	0	800	0
tsubpart	0	800	0
tsubpart	0	800	0
tsubpart	0	800	0
tsubpart1	1	NULL	5
tsubpart1	1	NULL	5
tsubpart1	1	NULL	5
tsubpart1	1	NULL	5
tsubpart1	1	NULL	5
call dbms_stats.async_gather_stats_job_proc();
select t.table_name,s.stale_stats,	s.spare1,	s.spare2  from oceanbase.__all_table_stat s inner join  oceanbase.__all_table t on s.table_id = t.table_id 
where t.table_name  in ('t', 't1','tsubpart', 'tsubpart1') and t.database_id in (select database_id from oceanbase.__all_database where database_name ='test_async_scheduler' );
table_name	stale_stats	spare1	spare2
t	1	NULL	5
t1	1	NULL	5
t1	1	NULL	5
t1	1	NULL	5
tsubpart	0	0	0
tsubpart	0	0	0
tsubpart	0	1600	0
tsubpart	0	800	0
tsubpart	0	800	0
tsubpart	0	800	0
tsubpart	0	800	0
tsubpart1	1	NULL	5
tsubpart1	1	NULL	5
tsubpart1	1	NULL	5
tsubpart1	1	NULL	5
tsubpart1	1	NULL	5
call DBMS_STATS.ASYNC_GATHER_STATS_JOB_PROC();
select TABLE_NAME,PARTITION_NAME,SUBPARTITION_NAME,STALE_STATS,NUM_ROWS from oceanbase.DBA_TAB_STATISTICS where TABLE_NAME in ('aa', 'bb', 'cc', 't', 't1','tsubpart', 'tsubpart1') and OWNER ='test_async_scheduler';
TABLE_NAME	PARTITION_NAME	SUBPARTITION_NAME	STALE_STATS	NUM_ROWS
aa	NULL	NULL	NO	6
bb	NULL	NULL	NO	5
cc	NULL	NULL	NULL	NULL
t	NULL	NULL	YES	0
t1	NULL	NULL	YES	0
t1	p0	NULL	YES	0
t1	p1	NULL	YES	0
tsubpart	NULL	NULL	NO	1600
tsubpart	p0	NULL	NO	800
tsubpart	p0	p0sp0	NO	800
tsubpart	p0	p0sp1	NO	0
tsubpart	p1	NULL	NO	800
tsubpart	p1	p1sp0	NO	0
tsubpart	p1	p1sp1	NO	800
tsubpart1	NULL	NULL	YES	0
tsubpart1	p0	NULL	YES	0
tsubpart1	p0	p0sp0	YES	0
tsubpart1	p0	p0sp1	NULL	NULL
tsubpart1	p1	NULL	YES	0
tsubpart1	p1	p1sp0	NULL	NULL
tsubpart1	p1	p1sp1	YES	0
select t.table_name,s.stale_stats,	s.spare1,	s.spare2  from oceanbase.__all_table_stat s inner join  oceanbase.__all_table t on s.table_id = t.table_id 
where t.table_name  in ('aa', 'bb', 'cc', 't', 't1','tsubpart', 'tsubpart1') and t.database_id in (select database_id from oceanbase.__all_database where database_name ='test_async_scheduler' );
table_name	stale_stats	spare1	spare2
aa	0	6	0
bb	0	5	0
t	1	NULL	5
t1	1	NULL	5
t1	1	NULL	5
t1	1	NULL	5
tsubpart	0	0	0
tsubpart	0	0	0
tsubpart	0	1600	0
tsubpart	0	800	0
tsubpart	0	800	0
tsubpart	0	800	0
tsubpart	0	800	0
tsubpart1	1	NULL	5
tsubpart1	1	NULL	5
tsubpart1	1	NULL	5
tsubpart1	1	NULL	5
tsubpart1	1	NULL	5
create table aa(a1 int primary key auto_increment, a2 int, a3 int);
create table bb(b1 int primary key auto_increment, b2 int, b3 int);
create table cc(c1 int primary key auto_increment, c2 int, c3 int) with column group (all columns, each column);
delete from aa;
insert into aa(a2, a3) values (10, 15), (10, 14), (10, 12), (11, 13), (12, 12), (12, 10);
delete from bb;
insert into bb(b2, b3) values  (10, 14), (11, 14), (11, 13), (12, 11), (12, 10);
set ob_query_timeout= 10;
call dbms_stats.async_gather_stats_job_proc();
call dbms_stats.async_gather_stats_job_proc();
call dbms_stats.async_gather_stats_job_proc();
call dbms_stats.async_gather_stats_job_proc();
call dbms_stats.async_gather_stats_job_proc();
SET ob_query_timeout = DEFAULT;
select TABLE_NAME,PARTITION_NAME,SUBPARTITION_NAME,STALE_STATS,NUM_ROWS from oceanbase.DBA_TAB_STATISTICS where TABLE_NAME in ('aa', 'bb', 'cc', 't', 't1','tsubpart', 'tsubpart1') and OWNER ='test_async_scheduler';
TABLE_NAME	PARTITION_NAME	SUBPARTITION_NAME	STALE_STATS	NUM_ROWS
aa	NULL	NULL	YES	0
bb	NULL	NULL	YES	0
cc	NULL	NULL	NULL	NULL
t	NULL	NULL	YES	0
t1	NULL	NULL	YES	0
t1	p0	NULL	YES	0
t1	p1	NULL	YES	0
tsubpart	NULL	NULL	NO	1600
tsubpart	p0	NULL	NO	800
tsubpart	p0	p0sp0	NO	800
tsubpart	p0	p0sp1	NO	0
tsubpart	p1	NULL	NO	800
tsubpart	p1	p1sp0	NO	0
tsubpart	p1	p1sp1	NO	800
tsubpart1	NULL	NULL	YES	0
tsubpart1	p0	NULL	YES	0
tsubpart1	p0	p0sp0	YES	0
tsubpart1	p0	p0sp1	NULL	NULL
tsubpart1	p1	NULL	YES	0
tsubpart1	p1	p1sp0	NULL	NULL
tsubpart1	p1	p1sp1	YES	0
select t.table_name,s.stale_stats,	s.spare1,	s.spare2  from oceanbase.__all_table_stat s inner join  oceanbase.__all_table t on s.table_id = t.table_id 
where t.table_name  in ('aa', 'bb', 'cc', 't', 't1','tsubpart', 'tsubpart1') and t.database_id in (select database_id from oceanbase.__all_database where database_name ='test_async_scheduler' );
table_name	stale_stats	spare1	spare2
aa	1	NULL	5
bb	1	NULL	5
t	1	NULL	5
t1	1	NULL	5
t1	1	NULL	5
t1	1	NULL	5
tsubpart	0	0	0
tsubpart	0	0	0
tsubpart	0	1600	0
tsubpart	0	800	0
tsubpart	0	800	0
tsubpart	0	800	0
tsubpart	0	800	0
tsubpart1	1	NULL	5
tsubpart1	1	NULL	5
tsubpart1	1	NULL	5
tsubpart1	1	NULL	5
tsubpart1	1	NULL	5
drop database test_async_scheduler;
