drop table if exists t1, t_part, t_subpart;
create table t1 (c1 int, c2 int, c3 int);
create index idx1_t1 on t1(c2);
create table t_part (c1 int primary key, c2 int, c3 int) partition by hash(c1) partitions 4;
create index idx1_part on t_part(c2) global;
create table t_subpart (c1 int, c2 int, c3 int) partition by hash(c1)
subpartition by hash(c2)
subpartition template
(
subpartition p0,
subpartition p1,
subpartition p2
)
partitions 3;
create index idx1_subpart on t_subpart(c2) local;
result_format: 4
##desc oceanbase.v$dml_stats, oceanbase.dba_tab_modifications;
desc oceanbase.v$dml_stats;
+----------+-------------+------+-----+---------+-------+
| Field    | Type        | Null | Key | Default | Extra |
+----------+-------------+------+-----+---------+-------+
| CON_ID   | bigint(0)   | NO   |     |         |       |
| CURROWS  | bigint(0)   | NO   |     |         |       |
| DEL      | bigint(20)  | NO   |     |         |       |
| DROPSEG  | bigint(0)   | NO   |     |         |       |
| FLAGS    | bigint(0)   | NO   |     |         |       |
| INS      | bigint(20)  | NO   |     |         |       |
| INST_ID  | bigint(20)  | NO   |     |         |       |
| LASTUSED | bigint(0)   | NO   |     |         |       |
| OBJN     | bigint(20)  | NO   |     |         |       |
| PAROBJN  | bigint(20)  | NO   |     |         |       |
| SVR_IP   | varchar(46) | NO   |     |         |       |
| SVR_PORT | bigint(20)  | NO   |     |         |       |
| UPD      | bigint(20)  | NO   |     |         |       |
+----------+-------------+------+-----+---------+-------+

desc oceanbase.dba_tab_modifications;
+-------------------+--------------+------+-----+---------+-------+
| Field             | Type         | Null | Key | Default | Extra |
+-------------------+--------------+------+-----+---------+-------+
| DELETES           | bigint(20)   | NO   |     |         |       |
| DROP_SEGMENTS     | bigint(0)    | NO   |     |         |       |
| INSERTS           | bigint(20)   | NO   |     |         |       |
| PARTITION_NAME    | varchar(128) | NO   |     |         |       |
| SUBPARTITION_NAME | varchar(128) | NO   |     |         |       |
| TABLE_NAME        | varchar(128) | NO   |     |         |       |
| TABLE_OWNER       | varchar(128) | NO   |     |         |       |
| TIMESTAMP         | date         | NO   |     |         |       |
| TRUNCATED         | varchar(3)   | NO   |     |         |       |
| UPDATES           | bigint(20)   | NO   |     |         |       |
+-------------------+--------------+------+-----+---------+-------+

##test insert count stats
insert into t1 values(1,1,1), (2,2,2), (3,3,3), (4,4,4), (5,5,5), (6,6,6), (7,7,7), (8,8,8), (9,9,9), (10,10,10);
insert into t1 values(11,1,1), (12,2,2), (13,3,3), (14,4,4), (15,5,5), (16,6,6), (17,7,7), (18,8,8), (19,9,9), (20,10,10);
insert into t1 values(21,1,1), (22,2,2), (23,3,3), (24,4,4), (25,5,5), (26,6,6), (27,7,7), (28,8,8), (29,9,9), (30,10,10);
insert into t1 values(31,1,1), (32,2,2), (33,3,3), (34,4,4), (35,5,5), (36,6,6), (37,7,7), (38,8,8), (39,9,9), (40,10,10);
insert into t1 values(41,1,1), (42,2,2), (43,3,3), (44,4,4), (45,5,5), (46,6,6), (47,7,7), (48,8,8), (49,9,9), (50,10,10);
insert into t1 values(51,1,1), (52,2,2), (53,3,3), (54,4,4), (55,5,5), (56,6,6), (57,7,7), (58,8,8), (59,9,9), (60,10,10);
insert into t1 values(61,1,1), (62,2,2), (63,3,3), (64,4,4), (65,5,5), (66,6,6), (67,7,7), (68,8,8), (69,9,9), (70,10,10);
insert into t1 values(71,1,1), (72,2,2), (73,3,3), (74,4,4), (75,5,5), (76,6,6), (77,7,7), (78,8,8), (79,9,9), (80,10,10);
insert into t1 values(81,1,1), (82,2,2), (83,3,3), (84,4,4), (85,5,5), (86,6,6), (87,7,7), (88,8,8), (89,9,9), (90,10,10);
insert into t1 values(91,1,1), (92,2,2), (93,3,3), (94,4,4), (95,5,5), (96,6,6), (97,7,7), (98,8,8), (99,9,9), (100,10,10);

insert into t_part values(101,1,1), (102,2,2), (103,3,3), (104,4,4), (105,5,5), (106,6,6), (107,7,7), (108,8,8), (109,9,9), (110,10,10);
insert into t_part values(111,1,1), (112,2,2), (113,3,3), (114,4,4), (115,5,5), (116,6,6), (117,7,7), (118,8,8), (119,9,9), (120,10,10);
insert into t_part values(121,1,1), (122,2,2), (123,3,3), (124,4,4), (125,5,5), (126,6,6), (127,7,7), (128,8,8), (129,9,9), (130,10,10);
insert into t_part values(131,1,1), (132,2,2), (133,3,3), (134,4,4), (135,5,5), (136,6,6), (137,7,7), (138,8,8), (139,9,9), (140,10,10);
insert into t_part values(141,1,1), (142,2,2), (143,3,3), (144,4,4), (145,5,5), (146,6,6), (147,7,7), (148,8,8), (149,9,9), (150,10,10);
insert into t_part values(151,1,1), (152,2,2), (153,3,3), (154,4,4), (155,5,5), (156,6,6), (157,7,7), (158,8,8), (159,9,9), (160,10,10);
insert into t_part values(161,1,1), (162,2,2), (163,3,3), (164,4,4), (165,5,5), (166,6,6), (167,7,7), (168,8,8), (169,9,9), (170,10,10);
insert into t_part values(171,1,1), (172,2,2), (173,3,3), (174,4,4), (175,5,5), (176,6,6), (177,7,7), (178,8,8), (179,9,9), (180,10,10);
insert into t_part values(181,1,1), (182,2,2), (183,3,3), (184,4,4), (185,5,5), (186,6,6), (187,7,7), (188,8,8), (189,9,9), (190,10,10);
insert into t_part values(191,1,1), (192,2,2), (193,3,3), (194,4,4), (195,5,5), (196,6,6), (197,7,7), (198,8,8), (199,9,9), (200,10,10);

insert into t_part select c1%100,c2,c3 from t_part;
insert into t_part select c1+201,c2,c3 from t_part;
insert into t_part select c1+402,c2,c3 from t_part;

insert into t_subpart select * from t_part;
insert into t_subpart select * from t_subpart;
insert into t_subpart select * from t_subpart;
insert into t_subpart select * from t_subpart;

alter system minor freeze tenant = sys;
alter system minor freeze tenant = all_user;
alter system minor freeze tenant = all_meta;
result_format: 4
select TABLE_OWNER,TABLE_NAME,PARTITION_NAME,SUBPARTITION_NAME,INSERTS,UPDATES,DELETES from oceanbase.dba_tab_modifications where TABLE_OWNER='TEST' and table_name in ('T1','T_PART','T_SUBPART');
+-------------+------------+----------------+-------------------+---------+---------+---------+
| TABLE_OWNER | TABLE_NAME | PARTITION_NAME | SUBPARTITION_NAME | INSERTS | UPDATES | DELETES |
+-------------+------------+----------------+-------------------+---------+---------+---------+
| test        | t1         | NULL           | NULL              |     100 |       0 |       0 |
| test        | t_part     | p0             | NULL              |     200 |       0 |       0 |
| test        | t_part     | p1             | NULL              |     200 |       0 |       0 |
| test        | t_part     | p2             | NULL              |     200 |       0 |       0 |
| test        | t_part     | p3             | NULL              |     200 |       0 |       0 |
| test        | t_subpart  | NULL           | p0sp0             |     672 |       0 |       0 |
| test        | t_subpart  | NULL           | p0sp1             |     800 |       0 |       0 |
| test        | t_subpart  | NULL           | p0sp2             |     672 |       0 |       0 |
| test        | t_subpart  | NULL           | p1sp0             |     672 |       0 |       0 |
| test        | t_subpart  | NULL           | p1sp1             |     864 |       0 |       0 |
| test        | t_subpart  | NULL           | p1sp2             |     576 |       0 |       0 |
| test        | t_subpart  | NULL           | p2sp0             |     576 |       0 |       0 |
| test        | t_subpart  | NULL           | p2sp1             |     896 |       0 |       0 |
| test        | t_subpart  | NULL           | p2sp2             |     672 |       0 |       0 |
+-------------+------------+----------------+-------------------+---------+---------+---------+

call dbms_stats.FLUSH_DATABASE_MONITORING_INFO();

select TABLE_OWNER,TABLE_NAME,PARTITION_NAME,SUBPARTITION_NAME,INSERTS,UPDATES,DELETES from oceanbase.dba_tab_modifications where TABLE_OWNER='TEST' and table_name in ('T1','T_PART','T_SUBPART');
+-------------+------------+----------------+-------------------+---------+---------+---------+
| TABLE_OWNER | TABLE_NAME | PARTITION_NAME | SUBPARTITION_NAME | INSERTS | UPDATES | DELETES |
+-------------+------------+----------------+-------------------+---------+---------+---------+
| test        | t1         | NULL           | NULL              |     100 |       0 |       0 |
| test        | t_part     | p0             | NULL              |     200 |       0 |       0 |
| test        | t_part     | p1             | NULL              |     200 |       0 |       0 |
| test        | t_part     | p2             | NULL              |     200 |       0 |       0 |
| test        | t_part     | p3             | NULL              |     200 |       0 |       0 |
| test        | t_subpart  | NULL           | p0sp0             |     672 |       0 |       0 |
| test        | t_subpart  | NULL           | p0sp1             |     800 |       0 |       0 |
| test        | t_subpart  | NULL           | p0sp2             |     672 |       0 |       0 |
| test        | t_subpart  | NULL           | p1sp0             |     672 |       0 |       0 |
| test        | t_subpart  | NULL           | p1sp1             |     864 |       0 |       0 |
| test        | t_subpart  | NULL           | p1sp2             |     576 |       0 |       0 |
| test        | t_subpart  | NULL           | p2sp0             |     576 |       0 |       0 |
| test        | t_subpart  | NULL           | p2sp1             |     896 |       0 |       0 |
| test        | t_subpart  | NULL           | p2sp2             |     672 |       0 |       0 |
+-------------+------------+----------------+-------------------+---------+---------+---------+

insert into t1 select * from t1;
insert into t_part select c1+1000,c2,c3 from t_part;
insert into t_subpart select * from t_subpart;
alter system minor freeze tenant = sys;
alter system minor freeze tenant = all_user;
alter system minor freeze tenant = all_meta;
select TABLE_OWNER,TABLE_NAME,PARTITION_NAME,SUBPARTITION_NAME,INSERTS,UPDATES,DELETES from oceanbase.dba_tab_modifications where TABLE_OWNER='TEST' and table_name in ('T1','T_PART','T_SUBPART');
+-------------+------------+----------------+-------------------+---------+---------+---------+
| TABLE_OWNER | TABLE_NAME | PARTITION_NAME | SUBPARTITION_NAME | INSERTS | UPDATES | DELETES |
+-------------+------------+----------------+-------------------+---------+---------+---------+
| test        | t1         | NULL           | NULL              |     200 |       0 |       0 |
| test        | t_part     | p0             | NULL              |     400 |       0 |       0 |
| test        | t_part     | p1             | NULL              |     400 |       0 |       0 |
| test        | t_part     | p2             | NULL              |     400 |       0 |       0 |
| test        | t_part     | p3             | NULL              |     400 |       0 |       0 |
| test        | t_subpart  | NULL           | p0sp0             |    1344 |       0 |       0 |
| test        | t_subpart  | NULL           | p0sp1             |    1600 |       0 |       0 |
| test        | t_subpart  | NULL           | p0sp2             |    1344 |       0 |       0 |
| test        | t_subpart  | NULL           | p1sp0             |    1344 |       0 |       0 |
| test        | t_subpart  | NULL           | p1sp1             |    1728 |       0 |       0 |
| test        | t_subpart  | NULL           | p1sp2             |    1152 |       0 |       0 |
| test        | t_subpart  | NULL           | p2sp0             |    1152 |       0 |       0 |
| test        | t_subpart  | NULL           | p2sp1             |    1792 |       0 |       0 |
| test        | t_subpart  | NULL           | p2sp2             |    1344 |       0 |       0 |
+-------------+------------+----------------+-------------------+---------+---------+---------+

call dbms_stats.FLUSH_DATABASE_MONITORING_INFO();

select TABLE_OWNER,TABLE_NAME,PARTITION_NAME,SUBPARTITION_NAME,INSERTS,UPDATES,DELETES from oceanbase.dba_tab_modifications where TABLE_OWNER='TEST' and table_name in ('T1','T_PART','T_SUBPART');
+-------------+------------+----------------+-------------------+---------+---------+---------+
| TABLE_OWNER | TABLE_NAME | PARTITION_NAME | SUBPARTITION_NAME | INSERTS | UPDATES | DELETES |
+-------------+------------+----------------+-------------------+---------+---------+---------+
| test        | t1         | NULL           | NULL              |     200 |       0 |       0 |
| test        | t_part     | p0             | NULL              |     400 |       0 |       0 |
| test        | t_part     | p1             | NULL              |     400 |       0 |       0 |
| test        | t_part     | p2             | NULL              |     400 |       0 |       0 |
| test        | t_part     | p3             | NULL              |     400 |       0 |       0 |
| test        | t_subpart  | NULL           | p0sp0             |    1344 |       0 |       0 |
| test        | t_subpart  | NULL           | p0sp1             |    1600 |       0 |       0 |
| test        | t_subpart  | NULL           | p0sp2             |    1344 |       0 |       0 |
| test        | t_subpart  | NULL           | p1sp0             |    1344 |       0 |       0 |
| test        | t_subpart  | NULL           | p1sp1             |    1728 |       0 |       0 |
| test        | t_subpart  | NULL           | p1sp2             |    1152 |       0 |       0 |
| test        | t_subpart  | NULL           | p2sp0             |    1152 |       0 |       0 |
| test        | t_subpart  | NULL           | p2sp1             |    1792 |       0 |       0 |
| test        | t_subpart  | NULL           | p2sp2             |    1344 |       0 |       0 |
+-------------+------------+----------------+-------------------+---------+---------+---------+

##replace
replace into t1 select * from t1;
replace into t_part select c1+2000,c2+2000,c3+2000 from t_part order by c1 desc limit 1000;
replace into t_subpart select * from t_subpart;
alter system minor freeze tenant = sys;
alter system minor freeze tenant = all_user;
alter system minor freeze tenant = all_meta;
select TABLE_OWNER,TABLE_NAME,PARTITION_NAME,SUBPARTITION_NAME,INSERTS,UPDATES,DELETES from oceanbase.dba_tab_modifications where TABLE_OWNER='TEST' and table_name in ('T1','T_PART','T_SUBPART');
+-------------+------------+----------------+-------------------+---------+---------+---------+
| TABLE_OWNER | TABLE_NAME | PARTITION_NAME | SUBPARTITION_NAME | INSERTS | UPDATES | DELETES |
+-------------+------------+----------------+-------------------+---------+---------+---------+
| test        | t1         | NULL           | NULL              |     400 |       0 |       0 |
| test        | t_part     | p0             | NULL              |     650 |       0 |       0 |
| test        | t_part     | p1             | NULL              |     650 |       0 |       0 |
| test        | t_part     | p2             | NULL              |     650 |       0 |       0 |
| test        | t_part     | p3             | NULL              |     650 |       0 |       0 |
| test        | t_subpart  | NULL           | p0sp0             |    2688 |       0 |       0 |
| test        | t_subpart  | NULL           | p0sp1             |    3200 |       0 |       0 |
| test        | t_subpart  | NULL           | p0sp2             |    2688 |       0 |       0 |
| test        | t_subpart  | NULL           | p1sp0             |    2688 |       0 |       0 |
| test        | t_subpart  | NULL           | p1sp1             |    3456 |       0 |       0 |
| test        | t_subpart  | NULL           | p1sp2             |    2304 |       0 |       0 |
| test        | t_subpart  | NULL           | p2sp0             |    2304 |       0 |       0 |
| test        | t_subpart  | NULL           | p2sp1             |    3584 |       0 |       0 |
| test        | t_subpart  | NULL           | p2sp2             |    2688 |       0 |       0 |
+-------------+------------+----------------+-------------------+---------+---------+---------+

call dbms_stats.FLUSH_DATABASE_MONITORING_INFO();

select TABLE_OWNER,TABLE_NAME,PARTITION_NAME,SUBPARTITION_NAME,INSERTS,UPDATES,DELETES from oceanbase.dba_tab_modifications where TABLE_OWNER='TEST' and table_name in ('T1','T_PART','T_SUBPART');
+-------------+------------+----------------+-------------------+---------+---------+---------+
| TABLE_OWNER | TABLE_NAME | PARTITION_NAME | SUBPARTITION_NAME | INSERTS | UPDATES | DELETES |
+-------------+------------+----------------+-------------------+---------+---------+---------+
| test        | t1         | NULL           | NULL              |     400 |       0 |       0 |
| test        | t_part     | p0             | NULL              |     650 |       0 |       0 |
| test        | t_part     | p1             | NULL              |     650 |       0 |       0 |
| test        | t_part     | p2             | NULL              |     650 |       0 |       0 |
| test        | t_part     | p3             | NULL              |     650 |       0 |       0 |
| test        | t_subpart  | NULL           | p0sp0             |    2688 |       0 |       0 |
| test        | t_subpart  | NULL           | p0sp1             |    3200 |       0 |       0 |
| test        | t_subpart  | NULL           | p0sp2             |    2688 |       0 |       0 |
| test        | t_subpart  | NULL           | p1sp0             |    2688 |       0 |       0 |
| test        | t_subpart  | NULL           | p1sp1             |    3456 |       0 |       0 |
| test        | t_subpart  | NULL           | p1sp2             |    2304 |       0 |       0 |
| test        | t_subpart  | NULL           | p2sp0             |    2304 |       0 |       0 |
| test        | t_subpart  | NULL           | p2sp1             |    3584 |       0 |       0 |
| test        | t_subpart  | NULL           | p2sp2             |    2688 |       0 |       0 |
+-------------+------------+----------------+-------------------+---------+---------+---------+

##test update count stats
update t1 set c3 = 10000 where c1 <= 10;
update t_part set c3 = 100000 where c1 <= 1000;
update t_subpart set c3 = 1000000 where c1 <= 100;
alter system minor freeze tenant = sys;
alter system minor freeze tenant = all_user;
alter system minor freeze tenant = all_meta;
select TABLE_OWNER,TABLE_NAME,PARTITION_NAME,SUBPARTITION_NAME,INSERTS,UPDATES,DELETES from oceanbase.dba_tab_modifications where TABLE_OWNER='TEST' and table_name in ('T1','T_PART','T_SUBPART');
+-------------+------------+----------------+-------------------+---------+---------+---------+
| TABLE_OWNER | TABLE_NAME | PARTITION_NAME | SUBPARTITION_NAME | INSERTS | UPDATES | DELETES |
+-------------+------------+----------------+-------------------+---------+---------+---------+
| test        | t1         | NULL           | NULL              |     400 |      40 |       0 |
| test        | t_part     | p0             | NULL              |     650 |     201 |       0 |
| test        | t_part     | p1             | NULL              |     650 |     200 |       0 |
| test        | t_part     | p2             | NULL              |     650 |     200 |       0 |
| test        | t_part     | p3             | NULL              |     650 |     200 |       0 |
| test        | t_subpart  | NULL           | p0sp0             |    2688 |     384 |       0 |
| test        | t_subpart  | NULL           | p0sp1             |    3200 |     416 |       0 |
| test        | t_subpart  | NULL           | p0sp2             |    2688 |     288 |       0 |
| test        | t_subpart  | NULL           | p1sp0             |    2688 |     288 |       0 |
| test        | t_subpart  | NULL           | p1sp1             |    3456 |     480 |       0 |
| test        | t_subpart  | NULL           | p1sp2             |    2304 |     288 |       0 |
| test        | t_subpart  | NULL           | p2sp0             |    2304 |     288 |       0 |
| test        | t_subpart  | NULL           | p2sp1             |    3584 |     384 |       0 |
| test        | t_subpart  | NULL           | p2sp2             |    2688 |     384 |       0 |
+-------------+------------+----------------+-------------------+---------+---------+---------+

call dbms_stats.FLUSH_DATABASE_MONITORING_INFO();

select TABLE_OWNER,TABLE_NAME,PARTITION_NAME,SUBPARTITION_NAME,INSERTS,UPDATES,DELETES from oceanbase.dba_tab_modifications where TABLE_OWNER='TEST' and table_name in ('T1','T_PART','T_SUBPART');
+-------------+------------+----------------+-------------------+---------+---------+---------+
| TABLE_OWNER | TABLE_NAME | PARTITION_NAME | SUBPARTITION_NAME | INSERTS | UPDATES | DELETES |
+-------------+------------+----------------+-------------------+---------+---------+---------+
| test        | t1         | NULL           | NULL              |     400 |      40 |       0 |
| test        | t_part     | p0             | NULL              |     650 |     201 |       0 |
| test        | t_part     | p1             | NULL              |     650 |     200 |       0 |
| test        | t_part     | p2             | NULL              |     650 |     200 |       0 |
| test        | t_part     | p3             | NULL              |     650 |     200 |       0 |
| test        | t_subpart  | NULL           | p0sp0             |    2688 |     384 |       0 |
| test        | t_subpart  | NULL           | p0sp1             |    3200 |     416 |       0 |
| test        | t_subpart  | NULL           | p0sp2             |    2688 |     288 |       0 |
| test        | t_subpart  | NULL           | p1sp0             |    2688 |     288 |       0 |
| test        | t_subpart  | NULL           | p1sp1             |    3456 |     480 |       0 |
| test        | t_subpart  | NULL           | p1sp2             |    2304 |     288 |       0 |
| test        | t_subpart  | NULL           | p2sp0             |    2304 |     288 |       0 |
| test        | t_subpart  | NULL           | p2sp1             |    3584 |     384 |       0 |
| test        | t_subpart  | NULL           | p2sp2             |    2688 |     384 |       0 |
+-------------+------------+----------------+-------------------+---------+---------+---------+

update t1 set c3 = 10000 where c1 > 10 and c1 <= 20;
update t_part set c3 = 100000 where c1 > 1000 and c1 <= 2000;
update t_subpart set c3 = 1000000 where c1 > 100 and c1 <= 200;
alter system minor freeze tenant = sys;
alter system minor freeze tenant = all_user;
alter system minor freeze tenant = all_meta;
select TABLE_OWNER,TABLE_NAME,PARTITION_NAME,SUBPARTITION_NAME,INSERTS,UPDATES,DELETES from oceanbase.dba_tab_modifications where TABLE_OWNER='TEST' and table_name in ('T1','T_PART','T_SUBPART');
+-------------+------------+----------------+-------------------+---------+---------+---------+
| TABLE_OWNER | TABLE_NAME | PARTITION_NAME | SUBPARTITION_NAME | INSERTS | UPDATES | DELETES |
+-------------+------------+----------------+-------------------+---------+---------+---------+
| test        | t1         | NULL           | NULL              |     400 |      80 |       0 |
| test        | t_part     | p0             | NULL              |     650 |     400 |       0 |
| test        | t_part     | p1             | NULL              |     650 |     400 |       0 |
| test        | t_part     | p2             | NULL              |     650 |     400 |       0 |
| test        | t_part     | p3             | NULL              |     650 |     400 |       0 |
| test        | t_subpart  | NULL           | p0sp0             |    2688 |     672 |       0 |
| test        | t_subpart  | NULL           | p0sp1             |    3200 |     800 |       0 |
| test        | t_subpart  | NULL           | p0sp2             |    2688 |     672 |       0 |
| test        | t_subpart  | NULL           | p1sp0             |    2688 |     672 |       0 |
| test        | t_subpart  | NULL           | p1sp1             |    3456 |     864 |       0 |
| test        | t_subpart  | NULL           | p1sp2             |    2304 |     576 |       0 |
| test        | t_subpart  | NULL           | p2sp0             |    2304 |     576 |       0 |
| test        | t_subpart  | NULL           | p2sp1             |    3584 |     896 |       0 |
| test        | t_subpart  | NULL           | p2sp2             |    2688 |     672 |       0 |
+-------------+------------+----------------+-------------------+---------+---------+---------+

call dbms_stats.FLUSH_DATABASE_MONITORING_INFO();

select TABLE_OWNER,TABLE_NAME,PARTITION_NAME,SUBPARTITION_NAME,INSERTS,UPDATES,DELETES from oceanbase.dba_tab_modifications where TABLE_OWNER='TEST' and table_name in ('T1','T_PART','T_SUBPART');
+-------------+------------+----------------+-------------------+---------+---------+---------+
| TABLE_OWNER | TABLE_NAME | PARTITION_NAME | SUBPARTITION_NAME | INSERTS | UPDATES | DELETES |
+-------------+------------+----------------+-------------------+---------+---------+---------+
| test        | t1         | NULL           | NULL              |     400 |      80 |       0 |
| test        | t_part     | p0             | NULL              |     650 |     400 |       0 |
| test        | t_part     | p1             | NULL              |     650 |     400 |       0 |
| test        | t_part     | p2             | NULL              |     650 |     400 |       0 |
| test        | t_part     | p3             | NULL              |     650 |     400 |       0 |
| test        | t_subpart  | NULL           | p0sp0             |    2688 |     672 |       0 |
| test        | t_subpart  | NULL           | p0sp1             |    3200 |     800 |       0 |
| test        | t_subpart  | NULL           | p0sp2             |    2688 |     672 |       0 |
| test        | t_subpart  | NULL           | p1sp0             |    2688 |     672 |       0 |
| test        | t_subpart  | NULL           | p1sp1             |    3456 |     864 |       0 |
| test        | t_subpart  | NULL           | p1sp2             |    2304 |     576 |       0 |
| test        | t_subpart  | NULL           | p2sp0             |    2304 |     576 |       0 |
| test        | t_subpart  | NULL           | p2sp1             |    3584 |     896 |       0 |
| test        | t_subpart  | NULL           | p2sp2             |    2688 |     672 |       0 |
+-------------+------------+----------------+-------------------+---------+---------+---------+

##test delete count stats
delete from t1 where c1 <= 10;
delete from t_part where c1 <= 1000;
delete from t_subpart where c1 <= 100;
alter system minor freeze tenant = sys;
alter system minor freeze tenant = all_user;
alter system minor freeze tenant = all_meta;
select TABLE_OWNER,TABLE_NAME,PARTITION_NAME,SUBPARTITION_NAME,INSERTS,UPDATES,DELETES from oceanbase.dba_tab_modifications where TABLE_OWNER='TEST' and table_name in ('T1','T_PART','T_SUBPART');
+-------------+------------+----------------+-------------------+---------+---------+---------+
| TABLE_OWNER | TABLE_NAME | PARTITION_NAME | SUBPARTITION_NAME | INSERTS | UPDATES | DELETES |
+-------------+------------+----------------+-------------------+---------+---------+---------+
| test        | t1         | NULL           | NULL              |     400 |      80 |      40 |
| test        | t_part     | p0             | NULL              |     650 |     400 |     201 |
| test        | t_part     | p1             | NULL              |     650 |     400 |     200 |
| test        | t_part     | p2             | NULL              |     650 |     400 |     200 |
| test        | t_part     | p3             | NULL              |     650 |     400 |     200 |
| test        | t_subpart  | NULL           | p0sp0             |    2688 |     672 |     384 |
| test        | t_subpart  | NULL           | p0sp1             |    3200 |     800 |     416 |
| test        | t_subpart  | NULL           | p0sp2             |    2688 |     672 |     288 |
| test        | t_subpart  | NULL           | p1sp0             |    2688 |     672 |     288 |
| test        | t_subpart  | NULL           | p1sp1             |    3456 |     864 |     480 |
| test        | t_subpart  | NULL           | p1sp2             |    2304 |     576 |     288 |
| test        | t_subpart  | NULL           | p2sp0             |    2304 |     576 |     288 |
| test        | t_subpart  | NULL           | p2sp1             |    3584 |     896 |     384 |
| test        | t_subpart  | NULL           | p2sp2             |    2688 |     672 |     384 |
+-------------+------------+----------------+-------------------+---------+---------+---------+

call dbms_stats.FLUSH_DATABASE_MONITORING_INFO();

select TABLE_OWNER,TABLE_NAME,PARTITION_NAME,SUBPARTITION_NAME,INSERTS,UPDATES,DELETES from oceanbase.dba_tab_modifications where TABLE_OWNER='TEST' and table_name in ('T1','T_PART','T_SUBPART');
+-------------+------------+----------------+-------------------+---------+---------+---------+
| TABLE_OWNER | TABLE_NAME | PARTITION_NAME | SUBPARTITION_NAME | INSERTS | UPDATES | DELETES |
+-------------+------------+----------------+-------------------+---------+---------+---------+
| test        | t1         | NULL           | NULL              |     400 |      80 |      40 |
| test        | t_part     | p0             | NULL              |     650 |     400 |     201 |
| test        | t_part     | p1             | NULL              |     650 |     400 |     200 |
| test        | t_part     | p2             | NULL              |     650 |     400 |     200 |
| test        | t_part     | p3             | NULL              |     650 |     400 |     200 |
| test        | t_subpart  | NULL           | p0sp0             |    2688 |     672 |     384 |
| test        | t_subpart  | NULL           | p0sp1             |    3200 |     800 |     416 |
| test        | t_subpart  | NULL           | p0sp2             |    2688 |     672 |     288 |
| test        | t_subpart  | NULL           | p1sp0             |    2688 |     672 |     288 |
| test        | t_subpart  | NULL           | p1sp1             |    3456 |     864 |     480 |
| test        | t_subpart  | NULL           | p1sp2             |    2304 |     576 |     288 |
| test        | t_subpart  | NULL           | p2sp0             |    2304 |     576 |     288 |
| test        | t_subpart  | NULL           | p2sp1             |    3584 |     896 |     384 |
| test        | t_subpart  | NULL           | p2sp2             |    2688 |     672 |     384 |
+-------------+------------+----------------+-------------------+---------+---------+---------+

delete from t1 where c1 > 10 and c1 <= 20;
delete from t_part where c1 > 1000 and c1 <= 2000;
delete from t_subpart where c1> 100 and c1 <= 200;
alter system minor freeze tenant = sys;
alter system minor freeze tenant = all_user;
alter system minor freeze tenant = all_meta;
select TABLE_OWNER,TABLE_NAME,PARTITION_NAME,SUBPARTITION_NAME,INSERTS,UPDATES,DELETES from oceanbase.dba_tab_modifications where TABLE_OWNER='TEST' and table_name in ('T1','T_PART','T_SUBPART');
+-------------+------------+----------------+-------------------+---------+---------+---------+
| TABLE_OWNER | TABLE_NAME | PARTITION_NAME | SUBPARTITION_NAME | INSERTS | UPDATES | DELETES |
+-------------+------------+----------------+-------------------+---------+---------+---------+
| test        | t1         | NULL           | NULL              |     400 |      80 |      80 |
| test        | t_part     | p0             | NULL              |     650 |     400 |     400 |
| test        | t_part     | p1             | NULL              |     650 |     400 |     400 |
| test        | t_part     | p2             | NULL              |     650 |     400 |     400 |
| test        | t_part     | p3             | NULL              |     650 |     400 |     400 |
| test        | t_subpart  | NULL           | p0sp0             |    2688 |     672 |     672 |
| test        | t_subpart  | NULL           | p0sp1             |    3200 |     800 |     800 |
| test        | t_subpart  | NULL           | p0sp2             |    2688 |     672 |     672 |
| test        | t_subpart  | NULL           | p1sp0             |    2688 |     672 |     672 |
| test        | t_subpart  | NULL           | p1sp1             |    3456 |     864 |     864 |
| test        | t_subpart  | NULL           | p1sp2             |    2304 |     576 |     576 |
| test        | t_subpart  | NULL           | p2sp0             |    2304 |     576 |     576 |
| test        | t_subpart  | NULL           | p2sp1             |    3584 |     896 |     896 |
| test        | t_subpart  | NULL           | p2sp2             |    2688 |     672 |     672 |
+-------------+------------+----------------+-------------------+---------+---------+---------+

call dbms_stats.FLUSH_DATABASE_MONITORING_INFO();

select TABLE_OWNER,TABLE_NAME,PARTITION_NAME,SUBPARTITION_NAME,INSERTS,UPDATES,DELETES from oceanbase.dba_tab_modifications where TABLE_OWNER='TEST' and table_name in ('T1','T_PART','T_SUBPART');
+-------------+------------+----------------+-------------------+---------+---------+---------+
| TABLE_OWNER | TABLE_NAME | PARTITION_NAME | SUBPARTITION_NAME | INSERTS | UPDATES | DELETES |
+-------------+------------+----------------+-------------------+---------+---------+---------+
| test        | t1         | NULL           | NULL              |     400 |      80 |      80 |
| test        | t_part     | p0             | NULL              |     650 |     400 |     400 |
| test        | t_part     | p1             | NULL              |     650 |     400 |     400 |
| test        | t_part     | p2             | NULL              |     650 |     400 |     400 |
| test        | t_part     | p3             | NULL              |     650 |     400 |     400 |
| test        | t_subpart  | NULL           | p0sp0             |    2688 |     672 |     672 |
| test        | t_subpart  | NULL           | p0sp1             |    3200 |     800 |     800 |
| test        | t_subpart  | NULL           | p0sp2             |    2688 |     672 |     672 |
| test        | t_subpart  | NULL           | p1sp0             |    2688 |     672 |     672 |
| test        | t_subpart  | NULL           | p1sp1             |    3456 |     864 |     864 |
| test        | t_subpart  | NULL           | p1sp2             |    2304 |     576 |     576 |
| test        | t_subpart  | NULL           | p2sp0             |    2304 |     576 |     576 |
| test        | t_subpart  | NULL           | p2sp1             |    3584 |     896 |     896 |
| test        | t_subpart  | NULL           | p2sp2             |    2688 |     672 |     672 |
+-------------+------------+----------------+-------------------+---------+---------+---------+

##test ins/upd/del count stats
replace into t_part select c1+1000,c2+1000,c3+1000 from t_part;
alter system minor freeze tenant = sys;
alter system minor freeze tenant = all_user;
alter system minor freeze tenant = all_meta;
select TABLE_OWNER,TABLE_NAME,PARTITION_NAME,SUBPARTITION_NAME,INSERTS,UPDATES,DELETES from oceanbase.dba_tab_modifications where TABLE_OWNER='TEST' and table_name = 'T_PART';
+-------------+------------+----------------+-------------------+---------+---------+---------+
| TABLE_OWNER | TABLE_NAME | PARTITION_NAME | SUBPARTITION_NAME | INSERTS | UPDATES | DELETES |
+-------------+------------+----------------+-------------------+---------+---------+---------+
| test        | t_part     | p0             | NULL              |     900 |     400 |     450 |
| test        | t_part     | p1             | NULL              |     900 |     400 |     450 |
| test        | t_part     | p2             | NULL              |     900 |     400 |     450 |
| test        | t_part     | p3             | NULL              |     900 |     400 |     450 |
+-------------+------------+----------------+-------------------+---------+---------+---------+

call dbms_stats.FLUSH_DATABASE_MONITORING_INFO();

select TABLE_OWNER,TABLE_NAME,PARTITION_NAME,SUBPARTITION_NAME,INSERTS,UPDATES,DELETES from oceanbase.dba_tab_modifications where TABLE_OWNER='TEST' and table_name = 'T_PART';
+-------------+------------+----------------+-------------------+---------+---------+---------+
| TABLE_OWNER | TABLE_NAME | PARTITION_NAME | SUBPARTITION_NAME | INSERTS | UPDATES | DELETES |
+-------------+------------+----------------+-------------------+---------+---------+---------+
| test        | t_part     | p0             | NULL              |     900 |     400 |     450 |
| test        | t_part     | p1             | NULL              |     900 |     400 |     450 |
| test        | t_part     | p2             | NULL              |     900 |     400 |     450 |
| test        | t_part     | p3             | NULL              |     900 |     400 |     450 |
+-------------+------------+----------------+-------------------+---------+---------+---------+

insert into t_part select c1+1500,c2+1500,c3+1500 from t_part ON DUPLICATE KEY UPDATE c3=c3+100000;
alter system minor freeze tenant = sys;
alter system minor freeze tenant = all_user;
alter system minor freeze tenant = all_meta;
select TABLE_OWNER,TABLE_NAME,PARTITION_NAME,SUBPARTITION_NAME,INSERTS,UPDATES,DELETES from oceanbase.dba_tab_modifications where TABLE_OWNER='TEST' and table_name = 'T_PART';
+-------------+------------+----------------+-------------------+---------+---------+---------+
| TABLE_OWNER | TABLE_NAME | PARTITION_NAME | SUBPARTITION_NAME | INSERTS | UPDATES | DELETES |
+-------------+------------+----------------+-------------------+---------+---------+---------+
| test        | t_part     | p0             | NULL              |    1544 |     400 |     575 |
| test        | t_part     | p1             | NULL              |    1544 |     400 |     574 |
| test        | t_part     | p2             | NULL              |    1544 |     400 |     575 |
| test        | t_part     | p3             | NULL              |    1544 |     400 |     575 |
+-------------+------------+----------------+-------------------+---------+---------+---------+

call dbms_stats.FLUSH_DATABASE_MONITORING_INFO();

select TABLE_OWNER,TABLE_NAME,PARTITION_NAME,SUBPARTITION_NAME,INSERTS,UPDATES,DELETES from oceanbase.dba_tab_modifications where TABLE_OWNER='TEST' and table_name = 'T_PART';
+-------------+------------+----------------+-------------------+---------+---------+---------+
| TABLE_OWNER | TABLE_NAME | PARTITION_NAME | SUBPARTITION_NAME | INSERTS | UPDATES | DELETES |
+-------------+------------+----------------+-------------------+---------+---------+---------+
| test        | t_part     | p0             | NULL              |    1544 |     400 |     575 |
| test        | t_part     | p1             | NULL              |    1544 |     400 |     574 |
| test        | t_part     | p2             | NULL              |    1544 |     400 |     575 |
| test        | t_part     | p3             | NULL              |    1544 |     400 |     575 |
+-------------+------------+----------------+-------------------+---------+---------+---------+

drop table t1;
drop table t_part;
drop table t_subpart;

##test gather table stats consider the stats whether is expired.
##build new tenant.
##build tenant


use test;

call dbms_stats.gather_table_stats('OCEANBASE','__ALL_VIRTUAL_CORE_ALL_TABLE');
call dbms_stats.gather_table_stats('OCEANBASE','__ALL_VIRTUAL_CORE_COLUMN_TABLE');

drop table if exists t1, t_part, t_subpart;
create table t1 (c1 int, c2 int, c3 int);
create index idx1_t1 on t1(c2);

create table t_part (c1 int primary key, c2 int, c3 int) partition by hash(c1) partitions 4;
create index idx1_part on t_part(c2) global;

create table t_subpart (c1 int, c2 int, c3 int) partition by hash(c1)
subpartition by range(c2)
subpartition template
(
  subpartition p0 values less than (1000),
  subpartition p1 values less than (10000),
  subpartition p2 values less than (100000),
  subpartition p3 values less than (MAXVALUE)
)
partitions 3;
create index idx1_subpart on t_subpart(c2) local;

insert into t1 values(1,1,1), (2,2,2), (3,3,3), (4,4,4), (5,5,5), (6,6,6), (7,7,7), (8,8,8), (9,9,9), (10,10,10);
insert into t1 values(11,1,1), (12,2,2), (13,3,3), (14,4,4), (15,5,5), (16,6,6), (17,7,7), (18,8,8), (19,9,9), (20,10,10);
insert into t1 values(21,1,1), (22,2,2), (23,3,3), (24,4,4), (25,5,5), (26,6,6), (27,7,7), (28,8,8), (29,9,9), (30,10,10);
insert into t1 values(31,1,1), (32,2,2), (33,3,3), (34,4,4), (35,5,5), (36,6,6), (37,7,7), (38,8,8), (39,9,9), (40,10,10);
insert into t1 values(41,1,1), (42,2,2), (43,3,3), (44,4,4), (45,5,5), (46,6,6), (47,7,7), (48,8,8), (49,9,9), (50,10,10);
insert into t1 values(51,1,1), (52,2,2), (53,3,3), (54,4,4), (55,5,5), (56,6,6), (57,7,7), (58,8,8), (59,9,9), (60,10,10);
insert into t1 values(61,1,1), (62,2,2), (63,3,3), (64,4,4), (65,5,5), (66,6,6), (67,7,7), (68,8,8), (69,9,9), (70,10,10);
insert into t1 values(71,1,1), (72,2,2), (73,3,3), (74,4,4), (75,5,5), (76,6,6), (77,7,7), (78,8,8), (79,9,9), (80,10,10);
insert into t1 values(81,1,1), (82,2,2), (83,3,3), (84,4,4), (85,5,5), (86,6,6), (87,7,7), (88,8,8), (89,9,9), (90,10,10);
insert into t1 values(91,1,1), (92,2,2), (93,3,3), (94,4,4), (95,5,5), (96,6,6), (97,7,7), (98,8,8), (99,9,9), (100,10,10);

insert into t_part values(101,1,1), (102,2,2), (103,3,3), (104,4,4), (105,5,5), (106,6,6), (107,7,7), (108,8,8), (109,9,9), (110,10,10);
insert into t_part values(111,1,1), (112,2,2), (113,3,3), (114,4,4), (115,5,5), (116,6,6), (117,7,7), (118,8,8), (119,9,9), (120,10,10);
insert into t_part values(121,1,1), (122,2,2), (123,3,3), (124,4,4), (125,5,5), (126,6,6), (127,7,7), (128,8,8), (129,9,9), (130,10,10);
insert into t_part values(131,1,1), (132,2,2), (133,3,3), (134,4,4), (135,5,5), (136,6,6), (137,7,7), (138,8,8), (139,9,9), (140,10,10);
insert into t_part values(141,1,1), (142,2,2), (143,3,3), (144,4,4), (145,5,5), (146,6,6), (147,7,7), (148,8,8), (149,9,9), (150,10,10);
insert into t_part values(151,1,1), (152,2,2), (153,3,3), (154,4,4), (155,5,5), (156,6,6), (157,7,7), (158,8,8), (159,9,9), (160,10,10);
insert into t_part values(161,1,1), (162,2,2), (163,3,3), (164,4,4), (165,5,5), (166,6,6), (167,7,7), (168,8,8), (169,9,9), (170,10,10);
insert into t_part values(171,1,1), (172,2,2), (173,3,3), (174,4,4), (175,5,5), (176,6,6), (177,7,7), (178,8,8), (179,9,9), (180,10,10);
insert into t_part values(181,1,1), (182,2,2), (183,3,3), (184,4,4), (185,5,5), (186,6,6), (187,7,7), (188,8,8), (189,9,9), (190,10,10);
insert into t_part values(191,1,1), (192,2,2), (193,3,3), (194,4,4), (195,5,5), (196,6,6), (197,7,7), (198,8,8), (199,9,9), (200,10,10);

insert into t_part select c1%100,c2,c3 from t_part;
insert into t_part select c1+201,c2,c3 from t_part;
insert into t_part select c1+402,c2,c3 from t_part;

insert into t_subpart select * from t_part;
insert into t_subpart select c1+1000, c2+1000, c3+1000 from t_subpart;
insert into t_subpart select c1+10000, c2+10000, c3+10000 from t_subpart;
insert into t_subpart select c1+100000, c2+100000, c3+100000 from t_subpart;

alter system minor freeze tenant = sys;
alter system minor freeze tenant = all_user;
alter system minor freeze tenant = all_meta;
use test;

result_format: 4
call dbms_stats.GATHER_DATABASE_STATS_JOB_PROC();
select TABLE_NAME, partition_name, subpartition_name, OBJECT_TYPE, NUM_ROWS, AVG_ROW_LEN, SAMPLE_SIZE from OCEANBASE.DBA_TAB_STATISTICS where table_name in ('T1','T_PART','T_SUBPART') and OWNER = 'TEST';
+------------+----------------+-------------------+--------------+----------+-------------+-------------+
| TABLE_NAME | partition_name | subpartition_name | OBJECT_TYPE  | NUM_ROWS | AVG_ROW_LEN | SAMPLE_SIZE |
+------------+----------------+-------------------+--------------+----------+-------------+-------------+
| t1         | NULL           | NULL              | TABLE        |      100 |          60 |         100 |
| t_part     | NULL           | NULL              | TABLE        |      800 |          60 |         800 |
| t_part     | p0             | NULL              | PARTITION    |      200 |          60 |         200 |
| t_part     | p1             | NULL              | PARTITION    |      200 |          60 |         200 |
| t_part     | p2             | NULL              | PARTITION    |      200 |          60 |         200 |
| t_part     | p3             | NULL              | PARTITION    |      200 |          60 |         200 |
| t_subpart  | NULL           | NULL              | TABLE        |     6400 |          60 |        6400 |
| t_subpart  | p0             | NULL              | PARTITION    |     2132 |          60 |        2132 |
| t_subpart  | p0             | p0sp0             | SUBPARTITION |      268 |          60 |         268 |
| t_subpart  | p0             | p0sp1             | SUBPARTITION |      268 |          60 |         268 |
| t_subpart  | p0             | p0sp2             | SUBPARTITION |      532 |          60 |         532 |
| t_subpart  | p0             | p0sp3             | SUBPARTITION |     1064 |          60 |        1064 |
| t_subpart  | p1             | NULL              | PARTITION    |     2136 |          60 |        2136 |
| t_subpart  | p1             | p1sp0             | SUBPARTITION |      264 |          60 |         264 |
| t_subpart  | p1             | p1sp1             | SUBPARTITION |      268 |          60 |         268 |
| t_subpart  | p1             | p1sp2             | SUBPARTITION |      536 |          60 |         536 |
| t_subpart  | p1             | p1sp3             | SUBPARTITION |     1068 |          60 |        1068 |
| t_subpart  | p2             | NULL              | PARTITION    |     2132 |          60 |        2132 |
| t_subpart  | p2             | p2sp0             | SUBPARTITION |      268 |          60 |         268 |
| t_subpart  | p2             | p2sp1             | SUBPARTITION |      264 |          60 |         264 |
| t_subpart  | p2             | p2sp2             | SUBPARTITION |      532 |          60 |         532 |
| t_subpart  | p2             | p2sp3             | SUBPARTITION |     1068 |          60 |        1068 |
+------------+----------------+-------------------+--------------+----------+-------------+-------------+
select TABLE_NAME, COLUMN_NAME, NUM_DISTINCT, LOW_VALUE, HIGH_VALUE, DENSITY, NUM_NULLS, NUM_BUCKETS, SAMPLE_SIZE, AVG_COL_LEN, HISTOGRAM from OCEANBASE.DBA_TAB_COL_STATISTICS where table_name in ('T1','T_PART','T_SUBPART') and OWNER = 'TEST';
+------------+-------------+--------------+-----------+------------+---------+-----------+-------------+-------------+-------------+-----------+
| TABLE_NAME | COLUMN_NAME | NUM_DISTINCT | LOW_VALUE | HIGH_VALUE | DENSITY | NUM_NULLS | NUM_BUCKETS | SAMPLE_SIZE | AVG_COL_LEN | HISTOGRAM |
+------------+-------------+--------------+-----------+------------+---------+-----------+-------------+-------------+-------------+-----------+
| t1         | c1          |          101 | 1         | 100        |       0 |         0 |           0 |         100 |          20 | NULL      |
| t1         | c2          |           10 | 1         | 10         |       0 |         0 |          10 |         100 |          20 | FREQUENCY |
| t1         | c3          |           10 | 1         | 10         |       0 |         0 |           0 |         100 |          20 | NULL      |
| t_part     | c1          |          832 | 0         | 803        |       0 |         0 |           0 |         800 |          20 | NULL      |
| t_part     | c2          |           10 | 1         | 10         |       0 |         0 |          10 |         800 |          20 | FREQUENCY |
| t_part     | c3          |           10 | 1         | 10         |       0 |         0 |           0 |         800 |          20 | NULL      |
| t_subpart  | c1          |         6409 | 0         | 111803     |       0 |         0 |           0 |        6400 |          20 | NULL      |
| t_subpart  | c2          |           78 | 1         | 111010     |       0 |         0 |          80 |        6400 |          20 | FREQUENCY |
| t_subpart  | c3          |           78 | 1         | 111010     |       0 |         0 |           0 |        6400 |          20 | NULL      |
+------------+-------------+--------------+-----------+------------+---------+-----------+-------------+-------------+-------------+-----------+
select TABLE_NAME, partition_name, COLUMN_NAME, NUM_DISTINCT, LOW_VALUE, HIGH_VALUE, DENSITY, NUM_NULLS, NUM_BUCKETS, SAMPLE_SIZE, AVG_COL_LEN, HISTOGRAM from OCEANBASE.DBA_PART_COL_STATISTICS where table_name in ('T_PART','T_SUBPART') and OWNER = 'TEST';
+------------+----------------+-------------+--------------+-----------+------------+---------+-----------+-------------+-------------+-------------+-----------+
| TABLE_NAME | partition_name | COLUMN_NAME | NUM_DISTINCT | LOW_VALUE | HIGH_VALUE | DENSITY | NUM_NULLS | NUM_BUCKETS | SAMPLE_SIZE | AVG_COL_LEN | HISTOGRAM |
+------------+----------------+-------------+--------------+-----------+------------+---------+-----------+-------------+-------------+-------------+-----------+
| t_part     | p0             | c1          |          197 | 0         | 800        |       0 |         0 |           0 |         200 |          20 | NULL      |
| t_part     | p0             | c2          |           10 | 1         | 10         |       0 |         0 |          10 |         200 |          20 | FREQUENCY |
| t_part     | p0             | c3          |           10 | 1         | 10         |       0 |         0 |           0 |         200 |          20 | NULL      |
| t_part     | p1             | c1          |          196 | 1         | 801        |       0 |         0 |           0 |         200 |          20 | NULL      |
| t_part     | p1             | c2          |           10 | 1         | 10         |       0 |         0 |          10 |         200 |          20 | FREQUENCY |
| t_part     | p1             | c3          |           10 | 1         | 10         |       0 |         0 |           0 |         200 |          20 | NULL      |
| t_part     | p2             | c1          |          197 | 2         | 802        |       0 |         0 |           0 |         200 |          20 | NULL      |
| t_part     | p2             | c2          |           10 | 1         | 10         |       0 |         0 |          10 |         200 |          20 | FREQUENCY |
| t_part     | p2             | c3          |           10 | 1         | 10         |       0 |         0 |           0 |         200 |          20 | NULL      |
| t_part     | p3             | c1          |          204 | 3         | 803        |       0 |         0 |           0 |         200 |          20 | NULL      |
| t_part     | p3             | c2          |           10 | 1         | 10         |       0 |         0 |          10 |         200 |          20 | FREQUENCY |
| t_part     | p3             | c3          |           10 | 1         | 10         |       0 |         0 |           0 |         200 |          20 | NULL      |
| t_subpart  | p0             | c1          |         2161 | 0         | 111801     |       0 |         0 |           0 |        2132 |          20 | NULL      |
| t_subpart  | p0             | c2          |           78 | 1         | 111010     |       0 |         0 |          80 |        2132 |          20 | FREQUENCY |
| t_subpart  | p0             | c3          |           78 | 1         | 111010     |       0 |         0 |           0 |        2132 |          20 | NULL      |
| t_subpart  | p1             | c1          |         2145 | 1         | 111802     |       0 |         0 |           0 |        2136 |          20 | NULL      |
| t_subpart  | p1             | c2          |           78 | 1         | 111010     |       0 |         0 |          80 |        2136 |          20 | FREQUENCY |
| t_subpart  | p1             | c3          |           78 | 1         | 111010     |       0 |         0 |           0 |        2136 |          20 | NULL      |
| t_subpart  | p2             | c1          |         2052 | 2         | 111803     |       0 |         0 |           0 |        2132 |          20 | NULL      |
| t_subpart  | p2             | c2          |           78 | 1         | 111010     |       0 |         0 |          80 |        2132 |          20 | FREQUENCY |
| t_subpart  | p2             | c3          |           78 | 1         | 111010     |       0 |         0 |           0 |        2132 |          20 | NULL      |
+------------+----------------+-------------+--------------+-----------+------------+---------+-----------+-------------+-------------+-------------+-----------+
SELECT table_name, subpartition_name, column_name, num_distinct, low_value, high_value, density, num_nulls, num_buckets, sample_size, avg_col_len, histogram FROM OCEANBASE.DBA_SUBPART_COL_STATISTICS WHERE table_name = 'T_SUBPART' and owner='TEST';
+------------+-------------------+-------------+--------------+-----------+------------+---------+-----------+-------------+-------------+-------------+-----------+
| table_name | subpartition_name | column_name | num_distinct | low_value | high_value | density | num_nulls | num_buckets | sample_size | avg_col_len | histogram |
+------------+-------------------+-------------+--------------+-----------+------------+---------+-----------+-------------+-------------+-------------+-----------+
| t_subpart  | p0sp0             | c1          |          265 | 0         | 801        |       0 |         0 |           0 |         268 |          20 | NULL      |
| t_subpart  | p0sp0             | c2          |           10 | 1         | 10         |       0 |         0 |           0 |         268 |          20 | NULL      |
| t_subpart  | p0sp0             | c3          |           10 | 1         | 10         |       0 |         0 |           0 |         268 |          20 | NULL      |
| t_subpart  | p0sp1             | c1          |          273 | 1002      | 1803       |       0 |         0 |           0 |         268 |          20 | NULL      |
| t_subpart  | p0sp1             | c2          |           10 | 1001      | 1010       |       0 |         0 |           0 |         268 |          20 | NULL      |
| t_subpart  | p0sp1             | c3          |           10 | 1001      | 1010       |       0 |         0 |           0 |         268 |          20 | NULL      |
| t_subpart  | p0sp2             | c1          |          549 | 10002     | 11802      |       0 |         0 |           0 |         532 |          20 | NULL      |
| t_subpart  | p0sp2             | c2          |           20 | 10001     | 11010      |       0 |         0 |           0 |         532 |          20 | NULL      |
| t_subpart  | p0sp2             | c3          |           20 | 10001     | 11010      |       0 |         0 |           0 |         532 |          20 | NULL      |
| t_subpart  | p0sp3             | c1          |         1045 | 100002    | 111801     |       0 |         0 |           0 |        1064 |          20 | NULL      |
| t_subpart  | p0sp3             | c2          |           39 | 100001    | 111010     |       0 |         0 |           0 |        1064 |          20 | NULL      |
| t_subpart  | p0sp3             | c3          |           39 | 100001    | 111010     |       0 |         0 |           0 |        1064 |          20 | NULL      |
| t_subpart  | p1sp0             | c1          |          276 | 1         | 802        |       0 |         0 |           0 |         264 |          20 | NULL      |
| t_subpart  | p1sp0             | c2          |           10 | 1         | 10         |       0 |         0 |           0 |         264 |          20 | NULL      |
| t_subpart  | p1sp0             | c3          |           10 | 1         | 10         |       0 |         0 |           0 |         264 |          20 | NULL      |
| t_subpart  | p1sp1             | c1          |          256 | 1000      | 1801       |       0 |         0 |           0 |         268 |          20 | NULL      |
| t_subpart  | p1sp1             | c2          |           10 | 1001      | 1010       |       0 |         0 |           0 |         268 |          20 | NULL      |
| t_subpart  | p1sp1             | c3          |           10 | 1001      | 1010       |       0 |         0 |           0 |         268 |          20 | NULL      |
| t_subpart  | p1sp2             | c1          |          523 | 10000     | 11803      |       0 |         0 |           0 |         536 |          20 | NULL      |
| t_subpart  | p1sp2             | c2          |           20 | 10001     | 11010      |       0 |         0 |           0 |         536 |          20 | NULL      |
| t_subpart  | p1sp2             | c3          |           20 | 10001     | 11010      |       0 |         0 |           0 |         536 |          20 | NULL      |
| t_subpart  | p1sp3             | c1          |         1061 | 100000    | 111802     |       0 |         0 |           0 |        1068 |          20 | NULL      |
| t_subpart  | p1sp3             | c2          |           39 | 100001    | 111010     |       0 |         0 |           0 |        1068 |          20 | NULL      |
| t_subpart  | p1sp3             | c3          |           39 | 100001    | 111010     |       0 |         0 |           0 |        1068 |          20 | NULL      |
| t_subpart  | p2sp0             | c1          |          276 | 2         | 803        |       0 |         0 |           0 |         268 |          20 | NULL      |
| t_subpart  | p2sp0             | c2          |           10 | 1         | 10         |       0 |         0 |           0 |         268 |          20 | NULL      |
| t_subpart  | p2sp0             | c3          |           10 | 1         | 10         |       0 |         0 |           0 |         268 |          20 | NULL      |
| t_subpart  | p2sp1             | c1          |          260 | 1001      | 1802       |       0 |         0 |           0 |         264 |          20 | NULL      |
| t_subpart  | p2sp1             | c2          |           10 | 1001      | 1010       |       0 |         0 |           0 |         264 |          20 | NULL      |
| t_subpart  | p2sp1             | c3          |           10 | 1001      | 1010       |       0 |         0 |           0 |         264 |          20 | NULL      |
| t_subpart  | p2sp2             | c1          |          515 | 10001     | 11801      |       0 |         0 |           0 |         532 |          20 | NULL      |
| t_subpart  | p2sp2             | c2          |           20 | 10001     | 11010      |       0 |         0 |           0 |         532 |          20 | NULL      |
| t_subpart  | p2sp2             | c3          |           20 | 10001     | 11010      |       0 |         0 |           0 |         532 |          20 | NULL      |
| t_subpart  | p2sp3             | c1          |         1064 | 100001    | 111803     |       0 |         0 |           0 |        1068 |          20 | NULL      |
| t_subpart  | p2sp3             | c2          |           39 | 100001    | 111010     |       0 |         0 |           0 |        1068 |          20 | NULL      |
| t_subpart  | p2sp3             | c3          |           39 | 100001    | 111010     |       0 |         0 |           0 |        1068 |          20 | NULL      |
+------------+-------------------+-------------+--------------+-----------+------------+---------+-----------+-------------+-------------+-------------+-----------+

##not arrive stale percent(default value:10)
delete from t1 where c1 >=95;
delete from t_part partition(p0) where c1 <= 36;
delete from t_part partition(p1) where c1 <= 37;
delete from t_subpart partition(p0sp1) where c1 <= 1029;
delete from t_subpart partition(p1sp0) where c1 <= 28;
delete from t_subpart partition(p1sp1) where c1 <= 1027;
alter system minor freeze tenant = sys;
alter system minor freeze tenant = all_user;
alter system minor freeze tenant = all_meta;
use test;

call dbms_stats.GATHER_DATABASE_STATS_JOB_PROC();
##expected no regather table stat and the stat isn't change.
select TABLE_NAME, partition_name, subpartition_name, OBJECT_TYPE, NUM_ROWS, AVG_ROW_LEN, SAMPLE_SIZE from OCEANBASE.DBA_TAB_STATISTICS where table_name in ('T1','T_PART','T_SUBPART') and OWNER = 'TEST';
+------------+----------------+-------------------+--------------+----------+-------------+-------------+
| TABLE_NAME | partition_name | subpartition_name | OBJECT_TYPE  | NUM_ROWS | AVG_ROW_LEN | SAMPLE_SIZE |
+------------+----------------+-------------------+--------------+----------+-------------+-------------+
| t1         | NULL           | NULL              | TABLE        |      100 |          60 |         100 |
| t_part     | NULL           | NULL              | TABLE        |      800 |          60 |         800 |
| t_part     | p0             | NULL              | PARTITION    |      200 |          60 |         200 |
| t_part     | p1             | NULL              | PARTITION    |      200 |          60 |         200 |
| t_part     | p2             | NULL              | PARTITION    |      200 |          60 |         200 |
| t_part     | p3             | NULL              | PARTITION    |      200 |          60 |         200 |
| t_subpart  | NULL           | NULL              | TABLE        |     6400 |          60 |        6400 |
| t_subpart  | p0             | NULL              | PARTITION    |     2132 |          60 |        2132 |
| t_subpart  | p0             | p0sp0             | SUBPARTITION |      268 |          60 |         268 |
| t_subpart  | p0             | p0sp1             | SUBPARTITION |      268 |          60 |         268 |
| t_subpart  | p0             | p0sp2             | SUBPARTITION |      532 |          60 |         532 |
| t_subpart  | p0             | p0sp3             | SUBPARTITION |     1064 |          60 |        1064 |
| t_subpart  | p1             | NULL              | PARTITION    |     2136 |          60 |        2136 |
| t_subpart  | p1             | p1sp0             | SUBPARTITION |      264 |          60 |         264 |
| t_subpart  | p1             | p1sp1             | SUBPARTITION |      268 |          60 |         268 |
| t_subpart  | p1             | p1sp2             | SUBPARTITION |      536 |          60 |         536 |
| t_subpart  | p1             | p1sp3             | SUBPARTITION |     1068 |          60 |        1068 |
| t_subpart  | p2             | NULL              | PARTITION    |     2132 |          60 |        2132 |
| t_subpart  | p2             | p2sp0             | SUBPARTITION |      268 |          60 |         268 |
| t_subpart  | p2             | p2sp1             | SUBPARTITION |      264 |          60 |         264 |
| t_subpart  | p2             | p2sp2             | SUBPARTITION |      532 |          60 |         532 |
| t_subpart  | p2             | p2sp3             | SUBPARTITION |     1068 |          60 |        1068 |
+------------+----------------+-------------------+--------------+----------+-------------+-------------+
select TABLE_NAME, COLUMN_NAME, NUM_DISTINCT, LOW_VALUE, HIGH_VALUE, DENSITY, NUM_NULLS, NUM_BUCKETS, SAMPLE_SIZE, AVG_COL_LEN, HISTOGRAM from OCEANBASE.DBA_TAB_COL_STATISTICS where table_name in ('T1','T_PART','T_SUBPART') and OWNER = 'TEST';
+------------+-------------+--------------+-----------+------------+---------+-----------+-------------+-------------+-------------+-----------+
| TABLE_NAME | COLUMN_NAME | NUM_DISTINCT | LOW_VALUE | HIGH_VALUE | DENSITY | NUM_NULLS | NUM_BUCKETS | SAMPLE_SIZE | AVG_COL_LEN | HISTOGRAM |
+------------+-------------+--------------+-----------+------------+---------+-----------+-------------+-------------+-------------+-----------+
| t1         | c1          |          101 | 1         | 100        |       0 |         0 |           0 |         100 |          20 | NULL      |
| t1         | c2          |           10 | 1         | 10         |       0 |         0 |          10 |         100 |          20 | FREQUENCY |
| t1         | c3          |           10 | 1         | 10         |       0 |         0 |           0 |         100 |          20 | NULL      |
| t_part     | c1          |          832 | 0         | 803        |       0 |         0 |           0 |         800 |          20 | NULL      |
| t_part     | c2          |           10 | 1         | 10         |       0 |         0 |          10 |         800 |          20 | FREQUENCY |
| t_part     | c3          |           10 | 1         | 10         |       0 |         0 |           0 |         800 |          20 | NULL      |
| t_subpart  | c1          |         6409 | 0         | 111803     |       0 |         0 |           0 |        6400 |          20 | NULL      |
| t_subpart  | c2          |           78 | 1         | 111010     |       0 |         0 |          80 |        6400 |          20 | FREQUENCY |
| t_subpart  | c3          |           78 | 1         | 111010     |       0 |         0 |           0 |        6400 |          20 | NULL      |
+------------+-------------+--------------+-----------+------------+---------+-----------+-------------+-------------+-------------+-----------+
select TABLE_NAME, partition_name, COLUMN_NAME, NUM_DISTINCT, LOW_VALUE, HIGH_VALUE, DENSITY, NUM_NULLS, NUM_BUCKETS, SAMPLE_SIZE, AVG_COL_LEN, HISTOGRAM from OCEANBASE.DBA_PART_COL_STATISTICS where table_name in ('T_PART','T_SUBPART') and OWNER = 'TEST';
+------------+----------------+-------------+--------------+-----------+------------+---------+-----------+-------------+-------------+-------------+-----------+
| TABLE_NAME | partition_name | COLUMN_NAME | NUM_DISTINCT | LOW_VALUE | HIGH_VALUE | DENSITY | NUM_NULLS | NUM_BUCKETS | SAMPLE_SIZE | AVG_COL_LEN | HISTOGRAM |
+------------+----------------+-------------+--------------+-----------+------------+---------+-----------+-------------+-------------+-------------+-----------+
| t_part     | p0             | c1          |          197 | 0         | 800        |       0 |         0 |           0 |         200 |          20 | NULL      |
| t_part     | p0             | c2          |           10 | 1         | 10         |       0 |         0 |          10 |         200 |          20 | FREQUENCY |
| t_part     | p0             | c3          |           10 | 1         | 10         |       0 |         0 |           0 |         200 |          20 | NULL      |
| t_part     | p1             | c1          |          196 | 1         | 801        |       0 |         0 |           0 |         200 |          20 | NULL      |
| t_part     | p1             | c2          |           10 | 1         | 10         |       0 |         0 |          10 |         200 |          20 | FREQUENCY |
| t_part     | p1             | c3          |           10 | 1         | 10         |       0 |         0 |           0 |         200 |          20 | NULL      |
| t_part     | p2             | c1          |          197 | 2         | 802        |       0 |         0 |           0 |         200 |          20 | NULL      |
| t_part     | p2             | c2          |           10 | 1         | 10         |       0 |         0 |          10 |         200 |          20 | FREQUENCY |
| t_part     | p2             | c3          |           10 | 1         | 10         |       0 |         0 |           0 |         200 |          20 | NULL      |
| t_part     | p3             | c1          |          204 | 3         | 803        |       0 |         0 |           0 |         200 |          20 | NULL      |
| t_part     | p3             | c2          |           10 | 1         | 10         |       0 |         0 |          10 |         200 |          20 | FREQUENCY |
| t_part     | p3             | c3          |           10 | 1         | 10         |       0 |         0 |           0 |         200 |          20 | NULL      |
| t_subpart  | p0             | c1          |         2161 | 0         | 111801     |       0 |         0 |           0 |        2132 |          20 | NULL      |
| t_subpart  | p0             | c2          |           78 | 1         | 111010     |       0 |         0 |          80 |        2132 |          20 | FREQUENCY |
| t_subpart  | p0             | c3          |           78 | 1         | 111010     |       0 |         0 |           0 |        2132 |          20 | NULL      |
| t_subpart  | p1             | c1          |         2145 | 1         | 111802     |       0 |         0 |           0 |        2136 |          20 | NULL      |
| t_subpart  | p1             | c2          |           78 | 1         | 111010     |       0 |         0 |          80 |        2136 |          20 | FREQUENCY |
| t_subpart  | p1             | c3          |           78 | 1         | 111010     |       0 |         0 |           0 |        2136 |          20 | NULL      |
| t_subpart  | p2             | c1          |         2052 | 2         | 111803     |       0 |         0 |           0 |        2132 |          20 | NULL      |
| t_subpart  | p2             | c2          |           78 | 1         | 111010     |       0 |         0 |          80 |        2132 |          20 | FREQUENCY |
| t_subpart  | p2             | c3          |           78 | 1         | 111010     |       0 |         0 |           0 |        2132 |          20 | NULL      |
+------------+----------------+-------------+--------------+-----------+------------+---------+-----------+-------------+-------------+-------------+-----------+
SELECT table_name, subpartition_name, column_name, num_distinct, low_value, high_value, density, num_nulls, num_buckets, sample_size, avg_col_len, histogram FROM OCEANBASE.DBA_SUBPART_COL_STATISTICS WHERE table_name = 'T_SUBPART' and owner='TEST';
+------------+-------------------+-------------+--------------+-----------+------------+---------+-----------+-------------+-------------+-------------+-----------+
| table_name | subpartition_name | column_name | num_distinct | low_value | high_value | density | num_nulls | num_buckets | sample_size | avg_col_len | histogram |
+------------+-------------------+-------------+--------------+-----------+------------+---------+-----------+-------------+-------------+-------------+-----------+
| t_subpart  | p0sp0             | c1          |          265 | 0         | 801        |       0 |         0 |           0 |         268 |          20 | NULL      |
| t_subpart  | p0sp0             | c2          |           10 | 1         | 10         |       0 |         0 |           0 |         268 |          20 | NULL      |
| t_subpart  | p0sp0             | c3          |           10 | 1         | 10         |       0 |         0 |           0 |         268 |          20 | NULL      |
| t_subpart  | p0sp1             | c1          |          273 | 1002      | 1803       |       0 |         0 |           0 |         268 |          20 | NULL      |
| t_subpart  | p0sp1             | c2          |           10 | 1001      | 1010       |       0 |         0 |           0 |         268 |          20 | NULL      |
| t_subpart  | p0sp1             | c3          |           10 | 1001      | 1010       |       0 |         0 |           0 |         268 |          20 | NULL      |
| t_subpart  | p0sp2             | c1          |          549 | 10002     | 11802      |       0 |         0 |           0 |         532 |          20 | NULL      |
| t_subpart  | p0sp2             | c2          |           20 | 10001     | 11010      |       0 |         0 |           0 |         532 |          20 | NULL      |
| t_subpart  | p0sp2             | c3          |           20 | 10001     | 11010      |       0 |         0 |           0 |         532 |          20 | NULL      |
| t_subpart  | p0sp3             | c1          |         1045 | 100002    | 111801     |       0 |         0 |           0 |        1064 |          20 | NULL      |
| t_subpart  | p0sp3             | c2          |           39 | 100001    | 111010     |       0 |         0 |           0 |        1064 |          20 | NULL      |
| t_subpart  | p0sp3             | c3          |           39 | 100001    | 111010     |       0 |         0 |           0 |        1064 |          20 | NULL      |
| t_subpart  | p1sp0             | c1          |          276 | 1         | 802        |       0 |         0 |           0 |         264 |          20 | NULL      |
| t_subpart  | p1sp0             | c2          |           10 | 1         | 10         |       0 |         0 |           0 |         264 |          20 | NULL      |
| t_subpart  | p1sp0             | c3          |           10 | 1         | 10         |       0 |         0 |           0 |         264 |          20 | NULL      |
| t_subpart  | p1sp1             | c1          |          256 | 1000      | 1801       |       0 |         0 |           0 |         268 |          20 | NULL      |
| t_subpart  | p1sp1             | c2          |           10 | 1001      | 1010       |       0 |         0 |           0 |         268 |          20 | NULL      |
| t_subpart  | p1sp1             | c3          |           10 | 1001      | 1010       |       0 |         0 |           0 |         268 |          20 | NULL      |
| t_subpart  | p1sp2             | c1          |          523 | 10000     | 11803      |       0 |         0 |           0 |         536 |          20 | NULL      |
| t_subpart  | p1sp2             | c2          |           20 | 10001     | 11010      |       0 |         0 |           0 |         536 |          20 | NULL      |
| t_subpart  | p1sp2             | c3          |           20 | 10001     | 11010      |       0 |         0 |           0 |         536 |          20 | NULL      |
| t_subpart  | p1sp3             | c1          |         1061 | 100000    | 111802     |       0 |         0 |           0 |        1068 |          20 | NULL      |
| t_subpart  | p1sp3             | c2          |           39 | 100001    | 111010     |       0 |         0 |           0 |        1068 |          20 | NULL      |
| t_subpart  | p1sp3             | c3          |           39 | 100001    | 111010     |       0 |         0 |           0 |        1068 |          20 | NULL      |
| t_subpart  | p2sp0             | c1          |          276 | 2         | 803        |       0 |         0 |           0 |         268 |          20 | NULL      |
| t_subpart  | p2sp0             | c2          |           10 | 1         | 10         |       0 |         0 |           0 |         268 |          20 | NULL      |
| t_subpart  | p2sp0             | c3          |           10 | 1         | 10         |       0 |         0 |           0 |         268 |          20 | NULL      |
| t_subpart  | p2sp1             | c1          |          260 | 1001      | 1802       |       0 |         0 |           0 |         264 |          20 | NULL      |
| t_subpart  | p2sp1             | c2          |           10 | 1001      | 1010       |       0 |         0 |           0 |         264 |          20 | NULL      |
| t_subpart  | p2sp1             | c3          |           10 | 1001      | 1010       |       0 |         0 |           0 |         264 |          20 | NULL      |
| t_subpart  | p2sp2             | c1          |          515 | 10001     | 11801      |       0 |         0 |           0 |         532 |          20 | NULL      |
| t_subpart  | p2sp2             | c2          |           20 | 10001     | 11010      |       0 |         0 |           0 |         532 |          20 | NULL      |
| t_subpart  | p2sp2             | c3          |           20 | 10001     | 11010      |       0 |         0 |           0 |         532 |          20 | NULL      |
| t_subpart  | p2sp3             | c1          |         1064 | 100001    | 111803     |       0 |         0 |           0 |        1068 |          20 | NULL      |
| t_subpart  | p2sp3             | c2          |           39 | 100001    | 111010     |       0 |         0 |           0 |        1068 |          20 | NULL      |
| t_subpart  | p2sp3             | c3          |           39 | 100001    | 111010     |       0 |         0 |           0 |        1068 |          20 | NULL      |
+------------+-------------------+-------------+--------------+-----------+------------+---------+-----------+-------------+-------------+-------------+-----------+

##more than stale percent(default value:10)
update t1 set c1 = 10000 where c1 >=89;
update t_part partition(p0) set c3 = 10000 where c1 < 100;
update t_subpart partition(p0sp1) set c3 = 10000 where c1 <= 1200;
update t_subpart partition(p1sp0) set c3 = 10000 where c1 <= 640;
alter system minor freeze tenant = sys;
alter system minor freeze tenant = all_user;
alter system minor freeze tenant = all_meta;
use test;

call dbms_stats.GATHER_DATABASE_STATS_JOB_PROC();
##expected regather table stat and the stat is changed.
select TABLE_NAME, partition_name, subpartition_name, OBJECT_TYPE, NUM_ROWS, AVG_ROW_LEN, SAMPLE_SIZE from OCEANBASE.DBA_TAB_STATISTICS where table_name in ('T1','T_PART','T_SUBPART') and OWNER = 'TEST';
+------------+----------------+-------------------+--------------+----------+-------------+-------------+
| TABLE_NAME | partition_name | subpartition_name | OBJECT_TYPE  | NUM_ROWS | AVG_ROW_LEN | SAMPLE_SIZE |
+------------+----------------+-------------------+--------------+----------+-------------+-------------+
| t1         | NULL           | NULL              | TABLE        |       94 |          60 |          94 |
| t_part     | NULL           | NULL              | TABLE        |      790 |          60 |         790 |
| t_part     | p0             | NULL              | PARTITION    |      190 |          60 |         190 |
| t_part     | p1             | NULL              | PARTITION    |      200 |          60 |         200 |
| t_part     | p2             | NULL              | PARTITION    |      200 |          60 |         200 |
| t_part     | p3             | NULL              | PARTITION    |      200 |          60 |         200 |
| t_subpart  | NULL           | NULL              | TABLE        |     6390 |          60 |        6390 |
| t_subpart  | p0             | NULL              | PARTITION    |     2132 |          60 |        2132 |
| t_subpart  | p0             | p0sp0             | SUBPARTITION |      268 |          60 |         268 |
| t_subpart  | p0             | p0sp1             | SUBPARTITION |      258 |          60 |         258 |
| t_subpart  | p0             | p0sp2             | SUBPARTITION |      532 |          60 |         532 |
| t_subpart  | p0             | p0sp3             | SUBPARTITION |     1064 |          60 |        1064 |
| t_subpart  | p1             | NULL              | PARTITION    |     2126 |          60 |        2126 |
| t_subpart  | p1             | p1sp0             | SUBPARTITION |      254 |          60 |         254 |
| t_subpart  | p1             | p1sp1             | SUBPARTITION |      268 |          60 |         268 |
| t_subpart  | p1             | p1sp2             | SUBPARTITION |      536 |          60 |         536 |
| t_subpart  | p1             | p1sp3             | SUBPARTITION |     1068 |          60 |        1068 |
| t_subpart  | p2             | NULL              | PARTITION    |     2132 |          60 |        2132 |
| t_subpart  | p2             | p2sp0             | SUBPARTITION |      268 |          60 |         268 |
| t_subpart  | p2             | p2sp1             | SUBPARTITION |      264 |          60 |         264 |
| t_subpart  | p2             | p2sp2             | SUBPARTITION |      532 |          60 |         532 |
| t_subpart  | p2             | p2sp3             | SUBPARTITION |     1068 |          60 |        1068 |
+------------+----------------+-------------------+--------------+----------+-------------+-------------+
select TABLE_NAME, COLUMN_NAME, NUM_DISTINCT, LOW_VALUE, HIGH_VALUE, DENSITY, NUM_NULLS, NUM_BUCKETS, SAMPLE_SIZE, AVG_COL_LEN, HISTOGRAM from OCEANBASE.DBA_TAB_COL_STATISTICS where table_name in ('T1','T_PART','T_SUBPART') and OWNER = 'TEST';
+------------+-------------+--------------+-----------+------------+---------+-----------+-------------+-------------+-------------+---------------+
| TABLE_NAME | COLUMN_NAME | NUM_DISTINCT | LOW_VALUE | HIGH_VALUE | DENSITY | NUM_NULLS | NUM_BUCKETS | SAMPLE_SIZE | AVG_COL_LEN | HISTOGRAM     |
+------------+-------------+--------------+-----------+------------+---------+-----------+-------------+-------------+-------------+---------------+
| t1         | c1          |           92 | 1         | 10000      |       0 |         0 |          89 |          94 |          20 | FREQUENCY     |
| t1         | c2          |           10 | 1         | 10         |       0 |         0 |          10 |          94 |          20 | FREQUENCY     |
| t1         | c3          |           10 | 1         | 10         |       0 |         0 |           0 |          94 |          20 | NULL          |
| t_part     | c1          |          819 | 1         | 803        |      -1 |         0 |           0 |          -1 |          20 | NULL          |
| t_part     | c2          |           10 | 1         | 10         |       0 |         0 |          10 |         790 |          20 | FREQUENCY     |
| t_part     | c3          |           11 | 1         | 10000      |       0 |         0 |           0 |         790 |          20 | NULL          |
| t_subpart  | c1          |         6375 | 0         | 111803     |       0 |         0 |           0 |        6390 |          20 | NULL          |
| t_subpart  | c2          |           78 | 1         | 111010     |       0 |         0 |          80 |        6390 |          20 | TOP-FREQUENCY |
| t_subpart  | c3          |           80 | 1         | 111010     |       0 |         0 |           0 |        6390 |          20 | NULL          |
+------------+-------------+--------------+-----------+------------+---------+-----------+-------------+-------------+-------------+---------------+
select TABLE_NAME, partition_name, COLUMN_NAME, NUM_DISTINCT, LOW_VALUE, HIGH_VALUE, DENSITY, NUM_NULLS, NUM_BUCKETS, SAMPLE_SIZE, AVG_COL_LEN, HISTOGRAM from OCEANBASE.DBA_PART_COL_STATISTICS where table_name in ('T_PART','T_SUBPART') and OWNER = 'TEST';
+------------+----------------+-------------+--------------+-----------+------------+---------+-----------+-------------+-------------+-------------+-----------+
| TABLE_NAME | partition_name | COLUMN_NAME | NUM_DISTINCT | LOW_VALUE | HIGH_VALUE | DENSITY | NUM_NULLS | NUM_BUCKETS | SAMPLE_SIZE | AVG_COL_LEN | HISTOGRAM |
+------------+----------------+-------------+--------------+-----------+------------+---------+-----------+-------------+-------------+-------------+-----------+
| t_part     | p0             | c1          |          188 | 40        | 800        |       0 |         0 |         190 |         190 |          20 | FREQUENCY |
| t_part     | p0             | c2          |           10 | 1         | 10         |       0 |         0 |          10 |         190 |          20 | FREQUENCY |
| t_part     | p0             | c3          |           11 | 1         | 10000      |       0 |         0 |           0 |         190 |          20 | NULL      |
| t_part     | p1             | c1          |          196 | 1         | 801        |       0 |         0 |           0 |         200 |          20 | NULL      |
| t_part     | p1             | c2          |           10 | 1         | 10         |       0 |         0 |          10 |         200 |          20 | FREQUENCY |
| t_part     | p1             | c3          |           10 | 1         | 10         |       0 |         0 |           0 |         200 |          20 | NULL      |
| t_part     | p2             | c1          |          197 | 2         | 802        |       0 |         0 |           0 |         200 |          20 | NULL      |
| t_part     | p2             | c2          |           10 | 1         | 10         |       0 |         0 |          10 |         200 |          20 | FREQUENCY |
| t_part     | p2             | c3          |           10 | 1         | 10         |       0 |         0 |           0 |         200 |          20 | NULL      |
| t_part     | p3             | c1          |          204 | 3         | 803        |       0 |         0 |           0 |         200 |          20 | NULL      |
| t_part     | p3             | c2          |           10 | 1         | 10         |       0 |         0 |          10 |         200 |          20 | FREQUENCY |
| t_part     | p3             | c3          |           10 | 1         | 10         |       0 |         0 |           0 |         200 |          20 | NULL      |
| t_subpart  | p0             | c1          |         2161 | 0         | 111801     |       0 |         0 |           0 |        2132 |          20 | NULL      |
| t_subpart  | p0             | c2          |           78 | 1         | 111010     |       0 |         0 |          80 |        2132 |          20 | FREQUENCY |
| t_subpart  | p0             | c3          |           78 | 1         | 111010     |       0 |         0 |           0 |        2132 |          20 | NULL      |
| t_subpart  | p1             | c1          |         2121 | 31        | 111802     |      -1 |         0 |           0 |          -1 |          20 | NULL      |
| t_subpart  | p1             | c2          |           78 | 1         | 111010     |       0 |         0 |          80 |        2116 |          20 | HYBRID    |
| t_subpart  | p1             | c3          |           80 | 1         | 111010     |       0 |         0 |           0 |        2126 |          20 | NULL      |
| t_subpart  | p2             | c1          |         2052 | 2         | 111803     |       0 |         0 |           0 |        2132 |          20 | NULL      |
| t_subpart  | p2             | c2          |           78 | 1         | 111010     |       0 |         0 |          80 |        2132 |          20 | FREQUENCY |
| t_subpart  | p2             | c3          |           78 | 1         | 111010     |       0 |         0 |           0 |        2132 |          20 | NULL      |
+------------+----------------+-------------+--------------+-----------+------------+---------+-----------+-------------+-------------+-------------+-----------+
SELECT table_name, subpartition_name, column_name, num_distinct, low_value, high_value, density, num_nulls, num_buckets, sample_size, avg_col_len, histogram FROM OCEANBASE.DBA_SUBPART_COL_STATISTICS WHERE table_name = 'T_SUBPART' and owner='TEST';
+------------+-------------------+-------------+--------------+-----------+------------+---------+-----------+-------------+-------------+-------------+-----------+
| table_name | subpartition_name | column_name | num_distinct | low_value | high_value | density | num_nulls | num_buckets | sample_size | avg_col_len | histogram |
+------------+-------------------+-------------+--------------+-----------+------------+---------+-----------+-------------+-------------+-------------+-----------+
| t_subpart  | p0sp0             | c1          |          265 | 0         | 801        |       0 |         0 |           0 |         268 |          20 | NULL      |
| t_subpart  | p0sp0             | c2          |           10 | 1         | 10         |       0 |         0 |           0 |         268 |          20 | NULL      |
| t_subpart  | p0sp0             | c3          |           10 | 1         | 10         |       0 |         0 |           0 |         268 |          20 | NULL      |
| t_subpart  | p0sp1             | c1          |          261 | 1032      | 1803       |       0 |         0 |           0 |         258 |          20 | NULL      |
| t_subpart  | p0sp1             | c2          |           10 | 1001      | 1010       |       0 |         0 |           0 |         258 |          20 | NULL      |
| t_subpart  | p0sp1             | c3          |           11 | 1001      | 10000      |       0 |         0 |           0 |         258 |          20 | NULL      |
| t_subpart  | p0sp2             | c1          |          549 | 10002     | 11802      |       0 |         0 |           0 |         532 |          20 | NULL      |
| t_subpart  | p0sp2             | c2          |           20 | 10001     | 11010      |       0 |         0 |           0 |         532 |          20 | NULL      |
| t_subpart  | p0sp2             | c3          |           20 | 10001     | 11010      |       0 |         0 |           0 |         532 |          20 | NULL      |
| t_subpart  | p0sp3             | c1          |         1045 | 100002    | 111801     |       0 |         0 |           0 |        1064 |          20 | NULL      |
| t_subpart  | p0sp3             | c2          |           39 | 100001    | 111010     |       0 |         0 |           0 |        1064 |          20 | NULL      |
| t_subpart  | p0sp3             | c3          |           39 | 100001    | 111010     |       0 |         0 |           0 |        1064 |          20 | NULL      |
| t_subpart  | p1sp0             | c1          |          265 | 31        | 802        |       0 |         0 |           0 |         254 |          20 | NULL      |
| t_subpart  | p1sp0             | c2          |           10 | 1         | 10         |       0 |         0 |           0 |         254 |          20 | NULL      |
| t_subpart  | p1sp0             | c3          |           11 | 1         | 10000      |       0 |         0 |           0 |         254 |          20 | NULL      |
| t_subpart  | p1sp1             | c1          |          256 | 1000      | 1801       |       0 |         0 |           0 |         268 |          20 | NULL      |
| t_subpart  | p1sp1             | c2          |           10 | 1001      | 1010       |       0 |         0 |           0 |         268 |          20 | NULL      |
| t_subpart  | p1sp1             | c3          |           10 | 1001      | 1010       |       0 |         0 |           0 |         268 |          20 | NULL      |
| t_subpart  | p1sp2             | c1          |          523 | 10000     | 11803      |       0 |         0 |           0 |         536 |          20 | NULL      |
| t_subpart  | p1sp2             | c2          |           20 | 10001     | 11010      |       0 |         0 |           0 |         536 |          20 | NULL      |
| t_subpart  | p1sp2             | c3          |           20 | 10001     | 11010      |       0 |         0 |           0 |         536 |          20 | NULL      |
| t_subpart  | p1sp3             | c1          |         1061 | 100000    | 111802     |       0 |         0 |           0 |        1068 |          20 | NULL      |
| t_subpart  | p1sp3             | c2          |           39 | 100001    | 111010     |       0 |         0 |           0 |        1068 |          20 | NULL      |
| t_subpart  | p1sp3             | c3          |           39 | 100001    | 111010     |       0 |         0 |           0 |        1068 |          20 | NULL      |
| t_subpart  | p2sp0             | c1          |          276 | 2         | 803        |       0 |         0 |           0 |         268 |          20 | NULL      |
| t_subpart  | p2sp0             | c2          |           10 | 1         | 10         |       0 |         0 |           0 |         268 |          20 | NULL      |
| t_subpart  | p2sp0             | c3          |           10 | 1         | 10         |       0 |         0 |           0 |         268 |          20 | NULL      |
| t_subpart  | p2sp1             | c1          |          260 | 1001      | 1802       |       0 |         0 |           0 |         264 |          20 | NULL      |
| t_subpart  | p2sp1             | c2          |           10 | 1001      | 1010       |       0 |         0 |           0 |         264 |          20 | NULL      |
| t_subpart  | p2sp1             | c3          |           10 | 1001      | 1010       |       0 |         0 |           0 |         264 |          20 | NULL      |
| t_subpart  | p2sp2             | c1          |          515 | 10001     | 11801      |       0 |         0 |           0 |         532 |          20 | NULL      |
| t_subpart  | p2sp2             | c2          |           20 | 10001     | 11010      |       0 |         0 |           0 |         532 |          20 | NULL      |
| t_subpart  | p2sp2             | c3          |           20 | 10001     | 11010      |       0 |         0 |           0 |         532 |          20 | NULL      |
| t_subpart  | p2sp3             | c1          |         1064 | 100001    | 111803     |       0 |         0 |           0 |        1068 |          20 | NULL      |
| t_subpart  | p2sp3             | c2          |           39 | 100001    | 111010     |       0 |         0 |           0 |        1068 |          20 | NULL      |
| t_subpart  | p2sp3             | c3          |           39 | 100001    | 111010     |       0 |         0 |           0 |        1068 |          20 | NULL      |
+------------+-------------------+-------------+--------------+-----------+------------+---------+-----------+-------------+-------------+-------------+-----------+
select OWNER, TABLE_NAME, STATUS, PROPERTIES from oceanbase.dba_ob_table_opt_stat_gather_history where table_name in ('T1', 'T_PART', 'T_SUBPART') and owner = 'TEST' and TASK_ID is not null order by start_time limit 3;
+-------+------------+---------+---------------------------------------------------------------------------------------------------------------------------------------------------------------+
| OWNER | TABLE_NAME | STATUS  | PROPERTIES                                                                                                                                                    |
+-------+------------+---------+---------------------------------------------------------------------------------------------------------------------------------------------------------------+
| test  | t1         | SUCCESS | GRANULARITY:AUTO;METHOD_OPT:FOR ALL COLUMNS SIZE AUTO;DEGREE:1;ESTIMATE_PERCENT:100.000000;BLOCK_SAMPLE:0;STALE_PERCENT:-1.000000;HIST_EST_PERCENT:100.000000 |
| test  | t_part     | SUCCESS | GRANULARITY:AUTO;METHOD_OPT:FOR ALL COLUMNS SIZE AUTO;DEGREE:1;ESTIMATE_PERCENT:100.000000;BLOCK_SAMPLE:0;STALE_PERCENT:-1.000000;HIST_EST_PERCENT:100.000000 |
| test  | t_subpart  | SUCCESS | GRANULARITY:AUTO;METHOD_OPT:FOR ALL COLUMNS SIZE AUTO;DEGREE:1;ESTIMATE_PERCENT:100.000000;BLOCK_SAMPLE:0;STALE_PERCENT:-1.000000;HIST_EST_PERCENT:100.000000 |
+-------+------------+---------+---------------------------------------------------------------------------------------------------------------------------------------------------------------+

call dbms_stats.alter_stats_history_retention(0);
select count(*) from oceanbase.DBA_OB_TASK_OPT_STAT_GATHER_HISTORY;
+----------+
| count(*) |
+----------+
|        0 |
+----------+
select count(*) from oceanbase.DBA_OB_TABLE_OPT_STAT_GATHER_HISTORY where TASK_ID IS NOT NULL;
+----------+
| count(*) |
+----------+
|        0 |
+----------+

drop table t1;
drop table t_part;
drop table t_subpart;

drop sequence s1;
create sequence s1 cache 42000 noorder;

create table t_part (c1 int, c2 int, c3 int) partition by hash(c1) partitions 4;


call dbms_stats.GATHER_DATABASE_STATS_JOB_PROC();
select TABLE_NAME,PARTITION_NAME,NUM_ROWS from oceanbase.dba_tab_statistics where table_name='T_PART' and OWNER = 'TEST';
+------------+----------------+----------+
| TABLE_NAME | PARTITION_NAME | NUM_ROWS |
+------------+----------------+----------+
| t_part     | NULL           |        0 |
| t_part     | p0             |        0 |
| t_part     | p1             |        0 |
| t_part     | p2             |        0 |
| t_part     | p3             |        0 |
+------------+----------------+----------+

insert into t_part select s1.nextval, s1.nextval, s1.nextval from table(generator(40000));
alter system minor freeze tenant = sys;
alter system minor freeze tenant = all_user;
alter system minor freeze tenant = all_meta;
call dbms_stats.set_table_prefs('TEST', 'T_PART', 'GRANULARITY', 'GLOBAL');
call dbms_stats.GATHER_DATABASE_STATS_JOB_PROC();
select TABLE_NAME,PARTITION_NAME,NUM_ROWS from oceanbase.dba_tab_statistics where table_name='T_PART' and OWNER = 'TEST';
+------------+----------------+----------+
| TABLE_NAME | PARTITION_NAME | NUM_ROWS |
+------------+----------------+----------+
| t_part     | NULL           |    40000 |
| t_part     | p0             |        0 |
| t_part     | p1             |        0 |
| t_part     | p2             |        0 |
| t_part     | p3             |        0 |
+------------+----------------+----------+
select LAST_INSERTS, LAST_UPDATES, LAST_DELETES, INSERTS, UPDATES, DELETES from oceanbase.__all_monitor_modified where table_id = $T_PART_TABLE_ID;
+--------------+--------------+--------------+---------+---------+---------+
| LAST_INSERTS | LAST_UPDATES | LAST_DELETES | INSERTS | UPDATES | DELETES |
+--------------+--------------+--------------+---------+---------+---------+
|        10000 |            0 |            0 |   10000 |       0 |       0 |
|        10000 |            0 |            0 |   10000 |       0 |       0 |
|        10000 |            0 |            0 |   10000 |       0 |       0 |
|        10000 |            0 |            0 |   10000 |       0 |       0 |
+--------------+--------------+--------------+---------+---------+---------+
select TABLE_NAME,PROPERTIES from oceanbase.dba_ob_table_opt_stat_gather_history where table_name='T_PART' and OWNER = 'TEST';
+------------+-----------------------------------------------------------------------------------------------------------------------------------------------------------------+
| TABLE_NAME | PROPERTIES                                                                                                                                                      |
+------------+-----------------------------------------------------------------------------------------------------------------------------------------------------------------+
| t_part     | GRANULARITY:AUTO;METHOD_OPT:FOR ALL COLUMNS SIZE AUTO;DEGREE:1;ESTIMATE_PERCENT:100.000000;BLOCK_SAMPLE:0;STALE_PERCENT:-1.000000;HIST_EST_PERCENT:100.000000   |
| t_part     | GRANULARITY:GLOBAL;METHOD_OPT:FOR ALL COLUMNS SIZE AUTO;DEGREE:1;ESTIMATE_PERCENT:100.000000;BLOCK_SAMPLE:0;STALE_PERCENT:-1.000000;HIST_EST_PERCENT:100.000000 |
+------------+-----------------------------------------------------------------------------------------------------------------------------------------------------------------+

call dbms_stats.GATHER_DATABASE_STATS_JOB_PROC();
select TABLE_NAME,PROPERTIES from oceanbase.dba_ob_table_opt_stat_gather_history where table_name='T_PART' and OWNER = 'TEST';
+------------+-----------------------------------------------------------------------------------------------------------------------------------------------------------------+
| TABLE_NAME | PROPERTIES                                                                                                                                                      |
+------------+-----------------------------------------------------------------------------------------------------------------------------------------------------------------+
| t_part     | GRANULARITY:AUTO;METHOD_OPT:FOR ALL COLUMNS SIZE AUTO;DEGREE:1;ESTIMATE_PERCENT:100.000000;BLOCK_SAMPLE:0;STALE_PERCENT:-1.000000;HIST_EST_PERCENT:100.000000   |
| t_part     | GRANULARITY:GLOBAL;METHOD_OPT:FOR ALL COLUMNS SIZE AUTO;DEGREE:1;ESTIMATE_PERCENT:100.000000;BLOCK_SAMPLE:0;STALE_PERCENT:-1.000000;HIST_EST_PERCENT:100.000000 |
+------------+-----------------------------------------------------------------------------------------------------------------------------------------------------------------+

call dbms_stats.delete_table_stats('TEST','T_PART');

call dbms_stats.GATHER_DATABASE_STATS_JOB_PROC();
select TABLE_NAME,PROPERTIES from oceanbase.dba_ob_table_opt_stat_gather_history where table_name='T_PART' and OWNER = 'TEST';
+------------+-----------------------------------------------------------------------------------------------------------------------------------------------------------------+
| TABLE_NAME | PROPERTIES                                                                                                                                                      |
+------------+-----------------------------------------------------------------------------------------------------------------------------------------------------------------+
| t_part     | GRANULARITY:AUTO;METHOD_OPT:FOR ALL COLUMNS SIZE AUTO;DEGREE:1;ESTIMATE_PERCENT:100.000000;BLOCK_SAMPLE:0;STALE_PERCENT:-1.000000;HIST_EST_PERCENT:100.000000   |
| t_part     | GRANULARITY:GLOBAL;METHOD_OPT:FOR ALL COLUMNS SIZE AUTO;DEGREE:1;ESTIMATE_PERCENT:100.000000;BLOCK_SAMPLE:0;STALE_PERCENT:-1.000000;HIST_EST_PERCENT:100.000000 |
| t_part     | GRANULARITY:GLOBAL;METHOD_OPT:FOR ALL COLUMNS SIZE AUTO;DEGREE:1;ESTIMATE_PERCENT:100.000000;BLOCK_SAMPLE:0;STALE_PERCENT:-1.000000;HIST_EST_PERCENT:100.000000 |
+------------+-----------------------------------------------------------------------------------------------------------------------------------------------------------------+

insert into t_part partition(p3) select 99, 99, 99 from table(generator(2000));
alter system minor freeze tenant = sys;
alter system minor freeze tenant = all_user;
alter system minor freeze tenant = all_meta;
call dbms_stats.GATHER_DATABASE_STATS_JOB_PROC();
select TABLE_NAME,PROPERTIES from oceanbase.dba_ob_table_opt_stat_gather_history where table_name='T_PART' and OWNER = 'TEST';
+------------+-----------------------------------------------------------------------------------------------------------------------------------------------------------------+
| TABLE_NAME | PROPERTIES                                                                                                                                                      |
+------------+-----------------------------------------------------------------------------------------------------------------------------------------------------------------+
| t_part     | GRANULARITY:AUTO;METHOD_OPT:FOR ALL COLUMNS SIZE AUTO;DEGREE:1;ESTIMATE_PERCENT:100.000000;BLOCK_SAMPLE:0;STALE_PERCENT:-1.000000;HIST_EST_PERCENT:100.000000   |
| t_part     | GRANULARITY:GLOBAL;METHOD_OPT:FOR ALL COLUMNS SIZE AUTO;DEGREE:1;ESTIMATE_PERCENT:100.000000;BLOCK_SAMPLE:0;STALE_PERCENT:-1.000000;HIST_EST_PERCENT:100.000000 |
| t_part     | GRANULARITY:GLOBAL;METHOD_OPT:FOR ALL COLUMNS SIZE AUTO;DEGREE:1;ESTIMATE_PERCENT:100.000000;BLOCK_SAMPLE:0;STALE_PERCENT:-1.000000;HIST_EST_PERCENT:100.000000 |
+------------+-----------------------------------------------------------------------------------------------------------------------------------------------------------------+

call dbms_stats.delete_table_prefs('TEST', 'T_PART', 'GRANULARITY');

call dbms_stats.GATHER_DATABASE_STATS_JOB_PROC();
select TABLE_NAME,PARTITION_NAME,NUM_ROWS from oceanbase.dba_tab_statistics where table_name='T_PART' and OWNER = 'TEST';
+------------+----------------+----------+
| TABLE_NAME | PARTITION_NAME | NUM_ROWS |
+------------+----------------+----------+
| t_part     | NULL           |    42000 |
| t_part     | p0             |    10000 |
| t_part     | p1             |    10000 |
| t_part     | p2             |    10000 |
| t_part     | p3             |    12000 |
+------------+----------------+----------+
select TABLE_NAME,PROPERTIES from oceanbase.dba_ob_table_opt_stat_gather_history where table_name='T_PART' and OWNER = 'TEST';
+------------+-----------------------------------------------------------------------------------------------------------------------------------------------------------------+
| TABLE_NAME | PROPERTIES                                                                                                                                                      |
+------------+-----------------------------------------------------------------------------------------------------------------------------------------------------------------+
| t_part     | GRANULARITY:AUTO;METHOD_OPT:FOR ALL COLUMNS SIZE AUTO;DEGREE:1;ESTIMATE_PERCENT:100.000000;BLOCK_SAMPLE:0;STALE_PERCENT:-1.000000;HIST_EST_PERCENT:100.000000   |
| t_part     | GRANULARITY:AUTO;METHOD_OPT:FOR ALL COLUMNS SIZE AUTO;DEGREE:1;ESTIMATE_PERCENT:100.000000;BLOCK_SAMPLE:0;STALE_PERCENT:-1.000000;HIST_EST_PERCENT:100.000000   |
| t_part     | GRANULARITY:GLOBAL;METHOD_OPT:FOR ALL COLUMNS SIZE AUTO;DEGREE:1;ESTIMATE_PERCENT:100.000000;BLOCK_SAMPLE:0;STALE_PERCENT:-1.000000;HIST_EST_PERCENT:100.000000 |
| t_part     | GRANULARITY:GLOBAL;METHOD_OPT:FOR ALL COLUMNS SIZE AUTO;DEGREE:1;ESTIMATE_PERCENT:100.000000;BLOCK_SAMPLE:0;STALE_PERCENT:-1.000000;HIST_EST_PERCENT:100.000000 |
+------------+-----------------------------------------------------------------------------------------------------------------------------------------------------------------+

call dbms_stats.delete_table_stats('TEST','T_PART');
call dbms_stats.set_table_prefs('TEST', 'T_PART', 'BLOCK_SAMPLE', 'TRUE');
call dbms_stats.set_table_prefs('TEST', 'T_PART', 'ESTIMATE_PERCENT', '50');

call dbms_stats.GATHER_DATABASE_STATS_JOB_PROC();
select TABLE_NAME,PROPERTIES from oceanbase.dba_ob_table_opt_stat_gather_history where table_name='T_PART' and OWNER = 'TEST';
+------------+-----------------------------------------------------------------------------------------------------------------------------------------------------------------+
| TABLE_NAME | PROPERTIES                                                                                                                                                      |
+------------+-----------------------------------------------------------------------------------------------------------------------------------------------------------------+
| t_part     | GRANULARITY:AUTO;METHOD_OPT:FOR ALL COLUMNS SIZE AUTO;DEGREE:1;ESTIMATE_PERCENT:100.000000;BLOCK_SAMPLE:0;STALE_PERCENT:-1.000000;HIST_EST_PERCENT:100.000000   |
| t_part     | GRANULARITY:AUTO;METHOD_OPT:FOR ALL COLUMNS SIZE AUTO;DEGREE:1;ESTIMATE_PERCENT:100.000000;BLOCK_SAMPLE:0;STALE_PERCENT:-1.000000;HIST_EST_PERCENT:100.000000   |
| t_part     | GRANULARITY:AUTO;METHOD_OPT:FOR ALL COLUMNS SIZE AUTO;DEGREE:1;ESTIMATE_PERCENT:50.000000;BLOCK_SAMPLE:1;STALE_PERCENT:-1.000000;HIST_EST_PERCENT:100.000000    |
| t_part     | GRANULARITY:GLOBAL;METHOD_OPT:FOR ALL COLUMNS SIZE AUTO;DEGREE:1;ESTIMATE_PERCENT:100.000000;BLOCK_SAMPLE:0;STALE_PERCENT:-1.000000;HIST_EST_PERCENT:100.000000 |
| t_part     | GRANULARITY:GLOBAL;METHOD_OPT:FOR ALL COLUMNS SIZE AUTO;DEGREE:1;ESTIMATE_PERCENT:100.000000;BLOCK_SAMPLE:0;STALE_PERCENT:-1.000000;HIST_EST_PERCENT:100.000000 |
+------------+-----------------------------------------------------------------------------------------------------------------------------------------------------------------+

drop sequence s1;
drop table t_part;

##drop tenant
