result_format: 4
alter system flush pl cache global;
set sql_mode = 'STRICT_ALL_TABLES,NO_ZERO_IN_DATE,NO_AUTO_CREATE_USER';
drop procedure test_p;
drop procedure test_p1;
drop table test;

####procedure DDL变更####
alter system plsql_v2_compatibility = 0;

create table test(a int);

create procedure test_p() begin  select * from test; end;//
create procedure test_p1() begin  call test_p(); end;//

select type,object_type,hit_count from oceanbase.gv$ob_plan_cache_plan_stat where pl_schema_id=(select routine_id from oceanbase.__all_routine where upper(routine_name)='TEST_P' order by gmt_create desc limit 1);
+------+-------------+-----------+
| type | object_type | hit_count |
+------+-------------+-----------+
+------+-------------+-----------+

call test_p();
+------+
| a    |
+------+
+------+

select OBJECT_TYPE,HIT_COUNT from oceanbase.GV$OB_PL_CACHE_OBJECT where PARAMETERIZE_TEXT like '%test_p%';
+-------------+-----------+
| OBJECT_TYPE | HIT_COUNT |
+-------------+-----------+
| PROCEDURE   |         0 |
+-------------+-----------+
select type,object_type,hit_count from oceanbase.gv$ob_plan_cache_plan_stat where pl_schema_id=(select routine_id from oceanbase.__all_routine where upper(routine_name)='TEST_P' order by gmt_create desc limit 1);
+------+-------------+-----------+
| type | object_type | hit_count |
+------+-------------+-----------+
|    6 | PROCEDURE   |         0 |
+------+-------------+-----------+

call test_p();
+------+
| a    |
+------+
+------+

select OBJECT_TYPE,HIT_COUNT from oceanbase.GV$OB_PL_CACHE_OBJECT where PARAMETERIZE_TEXT like '%test_p%';
+-------------+-----------+
| OBJECT_TYPE | HIT_COUNT |
+-------------+-----------+
| PROCEDURE   |         1 |
+-------------+-----------+
select type,object_type,hit_count from oceanbase.gv$ob_plan_cache_plan_stat where pl_schema_id=(select routine_id from oceanbase.__all_routine where upper(routine_name)='TEST_P' order by gmt_create desc limit 1);
+------+-------------+-----------+
| type | object_type | hit_count |
+------+-------------+-----------+
|    6 | PROCEDURE   |         1 |
+------+-------------+-----------+

alter system plsql_v2_compatibility = 1;

alter table test modify a double;

set sql_mode = STRICT_ALL_TABLES;
alter system flush pl cache global;
alter procedure test_p compile;


select routine_name, exec_env, route_sql from oceanbase.__all_routine where routine_name = 'test_p';
+--------------+---------------------+--------------------+
| routine_name | exec_env            | route_sql          |
+--------------+---------------------+--------------------+
| test_p       | 4194304,45,45,45,2, | select * from test |
+--------------+---------------------+--------------------+
select routine_name, exec_env, route_sql from oceanbase.__all_routine where routine_name = 'test_p1';
+--------------+-----------------------+-----------+
| routine_name | exec_env              | route_sql |
+--------------+-----------------------+-----------+
| test_p1      | 281018368,45,45,45,2, | NULL      |
+--------------+-----------------------+-----------+
select type,object_type,hit_count from oceanbase.gv$ob_plan_cache_plan_stat where pl_schema_id=(select routine_id from oceanbase.__all_routine where upper(routine_name)='TEST_P' order by gmt_create desc limit 1);
+------+-------------+-----------+
| type | object_type | hit_count |
+------+-------------+-----------+
|    6 | PROCEDURE   |         0 |
+------+-------------+-----------+

call test_p();
+------+
| a    |
+------+
+------+

select type,object_type,hit_count from oceanbase.gv$ob_plan_cache_plan_stat where pl_schema_id=(select routine_id from oceanbase.__all_routine where upper(routine_name)='TEST_P' order by gmt_create desc limit 1);
+------+-------------+-----------+
| type | object_type | hit_count |
+------+-------------+-----------+
|    6 | PROCEDURE   |         1 |
+------+-------------+-----------+

alter table test modify a char;
alter procedure test_p1 compile reuse settings;

select routine_name, exec_env, route_sql from oceanbase.__all_routine where routine_name = 'test_p1';
+--------------+-----------------------+-----------+
| routine_name | exec_env              | route_sql |
+--------------+-----------------------+-----------+
| test_p1      | 281018368,45,45,45,2, | NULL      |
+--------------+-----------------------+-----------+
####function DDL变更####
alter system plsql_v2_compatibility = 0;
set sql_mode = 'STRICT_ALL_TABLES,NO_ZERO_IN_DATE,NO_AUTO_CREATE_USER';
drop function test_f;
drop function test_f1;
drop table test1;

create table test1(a int, b double);
insert into test1 value(1, 13.14);

create function test_f()
returns int
begin
update test1 set b=13.15 where a=1;
return 1;
end;
//

create function test_f1()
returns int
begin
      declare i int;
      set i =1;
      while i< 10    
      do
           update test1 set b=13.15 where a=1;
           set i=i+1;
      end while;
      return 1;
end;
//

select type,object_type,hit_count from oceanbase.gv$ob_plan_cache_plan_stat where pl_schema_id=(select routine_id from oceanbase.__all_routine where upper(routine_name)='TEST_F' order by gmt_create desc limit 1);
+------+-------------+-----------+
| type | object_type | hit_count |
+------+-------------+-----------+
+------+-------------+-----------+

select test_f();
+----------+
| test_f() |
+----------+
|        1 |
+----------+

select OBJECT_TYPE,HIT_COUNT from oceanbase.GV$OB_PL_CACHE_OBJECT where PARAMETERIZE_TEXT like '%test_f%';
+-------------+-----------+
| OBJECT_TYPE | HIT_COUNT |
+-------------+-----------+
| FUNCTION    |         0 |
+-------------+-----------+
select type,object_type,hit_count from oceanbase.gv$ob_plan_cache_plan_stat where pl_schema_id=(select routine_id from oceanbase.__all_routine where upper(routine_name)='TEST_F' order by gmt_create desc limit 1);
+------+-------------+-----------+
| type | object_type | hit_count |
+------+-------------+-----------+
|    6 | FUNCTION    |         0 |
+------+-------------+-----------+

select test_f();
+----------+
| test_f() |
+----------+
|        1 |
+----------+

select OBJECT_TYPE,HIT_COUNT from oceanbase.GV$OB_PL_CACHE_OBJECT where PARAMETERIZE_TEXT like '%test_f%';
+-------------+-----------+
| OBJECT_TYPE | HIT_COUNT |
+-------------+-----------+
| FUNCTION    |         1 |
+-------------+-----------+
select type,object_type,hit_count from oceanbase.gv$ob_plan_cache_plan_stat where pl_schema_id=(select routine_id from oceanbase.__all_routine where upper(routine_name)='TEST_F' order by gmt_create desc limit 1);
+------+-------------+-----------+
| type | object_type | hit_count |
+------+-------------+-----------+
|    6 | FUNCTION    |         1 |
+------+-------------+-----------+

alter system plsql_v2_compatibility = 1;

alter table test1 modify b int;

set sql_mode = STRICT_ALL_TABLES;
alter system flush pl cache global;
alter function test_f compile;

select routine_name, exec_env, route_sql from oceanbase.__all_routine where routine_name = 'test_f';
+--------------+---------------------+------------------------------------+
| routine_name | exec_env            | route_sql                          |
+--------------+---------------------+------------------------------------+
| test_f       | 4194304,45,45,45,2, | update test1 set b=13.15 where a=1 |
+--------------+---------------------+------------------------------------+
select routine_name, exec_env, route_sql from oceanbase.__all_routine where routine_name = 'test_f1';
+--------------+-----------------------+------------------------------------+
| routine_name | exec_env              | route_sql                          |
+--------------+-----------------------+------------------------------------+
| test_f1      | 281018368,45,45,45,2, | update test1 set b=13.15 where a=1 |
+--------------+-----------------------+------------------------------------+
select type,object_type,hit_count from oceanbase.gv$ob_plan_cache_plan_stat where pl_schema_id=(select routine_id from oceanbase.__all_routine where upper(routine_name)='TEST_F' order by gmt_create desc limit 1);
+------+-------------+-----------+
| type | object_type | hit_count |
+------+-------------+-----------+
|    6 | FUNCTION    |         0 |
+------+-------------+-----------+

select test_f();
+----------+
| test_f() |
+----------+
|        1 |
+----------+

select type,object_type,hit_count from oceanbase.gv$ob_plan_cache_plan_stat where pl_schema_id=(select routine_id from oceanbase.__all_routine where upper(routine_name)='TEST_F' order by gmt_create desc limit 1);
+------+-------------+-----------+
| type | object_type | hit_count |
+------+-------------+-----------+
|    6 | FUNCTION    |         1 |
+------+-------------+-----------+

alter table test1 modify b char(10);
alter function test_f1 compile reuse settings;

select routine_name, exec_env, route_sql from oceanbase.__all_routine where routine_name = 'test_f1';
+--------------+-----------------------+------------------------------------+
| routine_name | exec_env              | route_sql                          |
+--------------+-----------------------+------------------------------------+
| test_f1      | 281018368,45,45,45,2, | update test1 set b=13.15 where a=1 |
+--------------+-----------------------+------------------------------------+

set sql_mode = 'STRICT_ALL_TABLES,NO_ZERO_IN_DATE,NO_AUTO_CREATE_USER';
alter system plsql_v2_compatibility = 0;
drop procedure test_p;
drop procedure test_p1;
drop table test;
drop function test_f;
drop function test_f1;
drop table test1;

