result_format: 4
#### 
#### call procedure `s rowcount is last sql`s rowcount
drop table if exists t;
drop table if exists t1;
drop procedure if exists proc1;
drop procedure if exists proc2;
drop procedure if exists proc3;
drop procedure if exists proc4;
drop procedure if exists proc5;
drop procedure if exists proc6;
drop procedure if exists proc7;
create table t(col int);
insert into t values(1),(2),(3);
create procedure proc1() insert into t values(4);
call proc1();
select row_count();
+-------------+
| row_count() |
+-------------+
|           1 |
+-------------+
create procedure proc2() update t set col = col + 1;
call proc2();
select row_count();
+-------------+
| row_count() |
+-------------+
|           4 |
+-------------+

create procedure proc3()
begin
  declare cur cursor for select * from t;
  open cur;
  close cur;
end;
|
call proc3()|
select row_count()|
+-------------+
| row_count() |
+-------------+
|           0 |
+-------------+

create procedure proc4()
begin
  insert into t values(5);
  update t set col = col + 1 where col >=4;
end;|
call proc4();|
select row_count()|
+-------------+
| row_count() |
+-------------+
|           3 |
+-------------+

create procedure proc5()
begin
  insert into t values(6);
  commit;
end;|
call proc5();|
select row_count()|
+-------------+
| row_count() |
+-------------+
|           0 |
+-------------+

create procedure proc6()
begin
  insert into t values(7);
  create table t1(col int);
end;|
call proc6();|
select row_count()|
+-------------+
| row_count() |
+-------------+
|           0 |
+-------------+

create procedure proc7(x int)
begin
  insert into t values(8);
  if x > 1 then update t set col = col + 1; end if;
end;|
call proc7(2)|
select row_count();|
+-------------+
| row_count() |
+-------------+
|           8 |
+-------------+
call proc7(1)|
select row_count();|
+-------------+
| row_count() |
+-------------+
|           1 |
+-------------+

drop procedure proc1;
drop procedure proc2;
drop procedure proc3;
drop procedure proc4;
drop procedure proc5;
drop procedure proc6;
drop procedure proc7;

#### 
drop procedure if exists pro1/
drop table if exists t_hr0/
drop table if exists t_hr1/
create table t_hr0(a float(24.8))/
desc t_hr0/
+-------+-------+------+-----+---------+-------+
| Field | Type  | Null | Key | Default | Extra |
+-------+-------+------+-----+---------+-------+
| a     | float | YES  |     | NULL    |       |
+-------+-------+------+-----+---------+-------+
create table t_hr1(a float(25.1))/
desc t_hr1/
+-------+--------+------+-----+---------+-------+
| Field | Type   | Null | Key | Default | Extra |
+-------+--------+------+-----+---------+-------+
| a     | double | YES  |     | NULL    |       |
+-------+--------+------+-----+---------+-------+

drop table t_hr0/
drop table t_hr1/

create table t_hr2(a float(256,20))/
ERROR 42000: Display width out of range for column 'a' (max = 255)

create procedure pro1()
begin
  declare a float(3.6);
  set a = 20;
  create table t_hr0(a float(24.8));
  desc t_hr0;
  create table t_hr1(a float(25.1));
  desc t_hr1;
end/

call pro1()/
+-------+-------+------+-----+---------+-------+
| Field | Type  | Null | Key | Default | Extra |
+-------+-------+------+-----+---------+-------+
+-------+--------+------+-----+---------+-------+
| Field | Type   | Null | Key | Default | Extra |
+-------+--------+------+-----+---------+-------+
| a     | float | YES  |     | NULL    |       |
| a     | double | YES  |     | NULL    |       |
+-------+-------+------+-----+---------+-------+
+-------+--------+------+-----+---------+-------+

drop table t_hr0/
drop table t_hr1/
drop procedure pro1/

#### 
drop procedure if exists pro1/
create procedure pro1()
begin
  declare a double(7);
  set a = 20;
end/
ERROR 42000: You have an error in your SQL syntax; check the manual that corresponds to your OceanBase version for the right syntax to use near '(7)' at line 3

#### 
drop procedure if exists pro1/
create procedure pro1()
begin
  declare a float(54);
  set a = 20;
end/
ERROR 42000: Incorrect column specifier for column ''

#### 
drop table if exists t1/
drop procedure if exists pro1/
create table t1 (
  id int(10) primary key,
  result char(20),
  a float
)/

create procedure pro1()
begin
  declare a float(54,2);
  set a = 20;
  insert into t1 VALUES(1,"insert value",a);
end/

call pro1()/

select * from t1/
+----+--------------+------+
| id | result       | a    |
+----+--------------+------+
|  1 | insert value |   20 |
+----+--------------+------+

drop table t1/
drop procedure pro1/


create table t1(empno decimal(6,2),ename varchar(10),job varchar(9),loc char(10),dname char(10),sal int,note char(20),deptno decimal(2)) character set binary;
insert into t1 values(7782,unhex('E5858BE68B89E5858B'),unhex('E8BF90E58AA8E59198'),unhex('D6D0B9FA'),unhex('97E9551B'),2450,unhex('CAC0BDE7BCB6D4CBB6AFD4B1'),10);

create procedure pro1()
begin
  declare a varchar(20) character set utf8mb4;
  declare b varchar(20) character set binary;
  declare c varchar(20) character set gbk;
  declare d varchar(20) character set utf16;
  declare e varchar(20) character set gb18030;
  declare msg varchar(20); declare done int default 0;
  declare mc cursor for select cast(ename as char character set utf8mb4)ename,cast(job as char character set binary)job,cast(loc as char character set gbk)loc, cast(dname as char(2) character set utf16)dname,cast(note as char(7) character set gb18030)note from t1 where cast(job as char character set binary) = '运动员';
  declare continue handler for not found set done = 1;
  open mc;
  while done != 1 do
    set msg = '';
    fetch mc into a,b,c,d,e;
    if done != 1 then set msg = concat('5:',(select a),(select d)); select msg; end if;
  end while;
  close mc;
end/

call pro1()/
+-------------------+
| msg               |
+-------------------+
| 5:克拉克韩唛      |
+-------------------+

drop procedure pro1/

drop table t1/


drop table if exists t1;
drop function if exists f1;
create table t1(c1 int);
set autocommit=1;
create function f1() returns int begin   insert into t1 value(1);   return 1; end/
start transaction/
select f1()/
+------+
| f1() |
+------+
|    1 |
+------+
select * from t1/
+------+
| c1   |
+------+
|    1 |
+------+
rollback/
select * from t1/
+------+
| c1   |
+------+
+------+
drop table t1;
drop function f1;
