result_format: 4

drop table t1;
drop table t2;
drop trigger trg_affect_1;
drop trigger trg_affect_2;
drop trigger trg_affect_3;
drop function func_affect;

create table t1 (c1 int);
create table t2 (c1 int);

create trigger trg_affect_1 before insert on t1 for each row
insert into t2 values (new.c1);

create trigger trg_affect_2 before update on t1 for each row
update t2 set c1 = new.c1 where c1 = old.c1;

create trigger trg_affect_3 before delete on t1 for each row
delete from t2 where c1 = old.c1;

insert into t1 values (1);
select row_count();
+-------------+
| row_count() |
+-------------+
|           1 |
+-------------+

insert into t1 values (2);
select row_count();
+-------------+
| row_count() |
+-------------+
|           1 |
+-------------+

update t1 set c1 = 11 where c1 = 1;
select row_count();
+-------------+
| row_count() |
+-------------+
|           1 |
+-------------+

update t1 set c1 = 22 where c1 = 2;
select row_count();
+-------------+
| row_count() |
+-------------+
|           1 |
+-------------+

delete from t1;
select row_count();
+-------------+
| row_count() |
+-------------+
|           2 |
+-------------+

update t1 set c1 = 100;
select row_count();
+-------------+
| row_count() |
+-------------+
|           0 |
+-------------+

create function func_affect() returns int
BEGIN
  insert into t2 values (2);
  return 10;
END;
/

drop trigger trg_affect_1;
insert into t1 values (func_affect());
select row_count();
+-------------+
| row_count() |
+-------------+
|           1 |
+-------------+

drop table t1;
drop table t2;
drop function func_affect;
