result_format: 4
DROP TABLE IF exists test_status;
DROP TABLE IF exists test_status2;
DROP PROCEDURE `TestProcedureStatus`;
DROP PROCEDURE `TestProcedureStatus2`;

CREATE TABLE test_status (n1 INT PRIMARY KEY, status varchar(20), d1 DATETIME DEFAULT current_timestamp);
INSERT INTO test_status (n1, status) values (1, 'Y');
SELECT * FROM test_status;
+----+--------+---------------------+
| n1 | status | d1                  |
+----+--------+---------------------+
|  1 | Y      | time                |
+----+--------+---------------------+
CREATE TABLE test_status2 (n1 INT PRIMARY KEY, status varchar(20), d1 DATETIME DEFAULT current_timestamp);
INSERT INTO test_status2 (n1, status) values (1, 'Y');
SELECT * FROM test_status2;
+----+--------+---------------------+
| n1 | status | d1                  |
+----+--------+---------------------+
|  1 | Y      | time                |
+----+--------+---------------------+

CREATE  PROCEDURE `TestProcedureStatus`(
IN status varchar(20)
)
BEGIN
  UPDATE test_status SET test_status.status = status;
END //

call TestProcedureStatus ('N');
SELECT * FROM test_status;
+----+--------+---------------------+
| n1 | status | d1                  |
+----+--------+---------------------+
|  1 | N      | time                |
+----+--------+---------------------+

UPDATE test_status SET test_status.status = status;

CREATE  PROCEDURE `TestProcedureStatus2`(
IN `status` varchar(20)
)
BEGIN
  UPDATE test_status2 SET test_status2.`status` = `status`;
END //

call TestProcedureStatus2('N');
SELECT * FROM test_status2;
+----+--------+---------------------+
| n1 | status | d1                  |
+----+--------+---------------------+
|  1 | N      | time                |
+----+--------+---------------------+

UPDATE test_status2 SET test_status2.`status` = `status`;

DROP TABLE test_status;
DROP PROCEDURE `TestProcedureStatus`;
DROP TABLE test_status2;
DROP PROCEDURE `TestProcedureStatus2`;
