result_format: 4
drop procedure if exists p1;
drop table t1;

drop procedure if exists p1;
create table t1(id int);

insert into t1 values(10);


create procedure p1(a int, A int)
begin
  declare b int;
  declare B int;
  set b = 1;
  set B = 2;
  select a, A, b, B from dual;
end/
ERROR 42000: Duplicate parameter: A

create procedure p1(a int, Ab int)
begin
  declare b int;
  declare B int;
  set b = 1;
  set B = 2;
  select a, Ab, b, B from dual;
end/
ERROR 42000: Duplicate variable: B

create procedure p1()
begin
  declare b int;
  declare B cursor for select id from t1;
  open B;
  fetch B into b;
  select b;
  close B;
end/

call p1()/
+------+
| b    |
+------+
|   10 |
+------+

drop procedure p1/

create procedure p1()
begin
  declare b int;
  declare b cursor for select id from t1;
  open b;
  fetch b into b;
  select b;
  close b;
end/

call p1()/
+------+
| b    |
+------+
|   10 |
+------+

drop procedure p1/

create procedure p1()
begin
  declare b1 int;
  declare b cursor for select id from t1 ;
  declare B cursor for select id from t1;
  open B;
  fetch B into b1;
  select b1;
  close B;
  open b;
  fetch b into b1;
  select b1;
  close b;
end/
ERROR 42000: Duplicate cursor: B

create procedure p1()
begin
  declare val int;
  declare B cursor for select id from t1;
  open b;
  fetch b into val;
  close b;
  select val;
end/

call p1()/
+------+
| val  |
+------+
|   10 |
+------+

drop procedure p1/

create procedure p1()
begin
  lab1: begin
    select 2;
  end LAB1;
end/

call p1()/
+---+
| 2 |
+---+
| 2 |
+---+

drop procedure p1/

create procedure p1()
begin
  declare lab1 char(20);
  set lab1 = "dfd";
  lab1: begin
    select lab1;
  end LAb1;
end/

call p1()/
+------+
| lab1 |
+------+
| dfd  |
+------+

drop procedure p1/

create procedure p1()
begin
  declare cond1 condition for sqlstate "HY000";
  declare cond1 int default 5;
  signal COND1 set mysql_errno = Cond1;
end/

call p1()/
ERROR HY000: Unhandled user-defined exception condition

drop procedure p1/

drop table t1/


CREATE PROCEDURE p1()
BEGIN
   SIGNAL SQLSTATE '45000' SET MESSAGE_TEXT='12345678901234567890123456789012345678901234567890123456789012345678901234567890123456789012345678901234567890123456789012345678', MYSQL_ERRNO=9999;
END;
/
CALL p1()/
ERROR 45000: 12345678901234567890123456789012345678901234567890123456789012345678901234567890123456789012345678901234567890123456789012345678

DROP PROCEDURE IF EXISTS p1/
CREATE PROCEDURE p1()
BEGIN
   SIGNAL SQLSTATE '45000' SET MESSAGE_TEXT='123456789123456789012345678901234567890123456789012345678901234567890123456789012345678901234567890123456789012345678901234567890123456789012345678901234567890123456789012345678901234567890123456789012345678901234567890123456789012345678901234567890$12345678901234567890123456789012345678901234567890123456789012345678901234567890123456789012345678901234567890123456789012345678901234567890123456789012345678901234567890123456789012345678901234567890123456789012345678901234567890123456789012345678901234567890$', MYSQL_ERRNO=9999;
END;
/
CALL p1()/
ERROR 45000: 12345678912345678901234567890123456789012345678901234567890123456789012345678901234567890123456789012345678901234567890123456789

DROP PROCEDURE IF EXISTS p1/
CREATE PROCEDURE p1()
BEGIN
   SIGNAL SQLSTATE '45000' SET MESSAGE_TEXT='1234567890123456789012345678901234567890123456789012345678901234567890123456789012345678901234567890123456789012345678901234567890123456789012345678901234567890123456789012345678901234567890123456789012345678901234567890123456789012345678901234567890$12345678901234567890123456789012345678901234567890123456789012345678901234567890123456789012345678901234567890123456789012345678901234567890123456789012345678901234567890123456789012345678901234567890123456789012345678901234567890123456789012345678901234567890$', MYSQL_ERRNO=9999;
END;
/
CALL p1()/
ERROR 45000: 12345678901234567890123456789012345678901234567890123456789012345678901234567890123456789012345678901234567890123456789012345678

drop procedure p1/

CREATE PROCEDURE p1(pval INT)
BEGIN
  DECLARE EXIT HANDLER FOR SQLEXCEPTION
  BEGIN
    IF pval = 0 THEN
      RESIGNAL SET MESSAGE_TEXT='【RESIGNAL】MYSQL_ERRNO值：负数', MYSQL_ERRNO='-1001';
    ELSE
      RESIGNAL SQLSTATE '45000' SET MESSAGE_TEXT='【RESIGNAL】MYSQL_ERRNO值：负数', MYSQL_ERRNO="-1.56789";
    END IF;
  END;
  DROP TABLE xxx;
END;
/
CALL p1(0)/
ERROR 42000: Variable 'MYSQL_ERRNO' can't be set to the value of '-1001'
CALL p1(1)/
ERROR 42000: Variable 'MYSQL_ERRNO' can't be set to the value of '-2'

drop procedure p1/

DROP FUNCTION IF EXISTS fun1/
CREATE FUNCTION fun1 (pval INT) RETURNS varchar(200) DETERMINISTIC 
BEGIN
  DECLARE EXIT HANDLER FOR SQLEXCEPTION
  BEGIN
    IF pval = 0 THEN
      RESIGNAL SET MESSAGE_TEXT=@n1, MYSQL_ERRNO=@n2;
    ELSE
      RESIGNAL SQLSTATE '99999' SET MESSAGE_TEXT=@n1, MYSQL_ERRNO=@n2;
    END IF;
  END;
  SELECT id into @temp FROM  xxx;
  RETURN '用户定义的变量修改错误信息';
END;
/

SET @n1 ='[RESIGNAL] An error occurred in function';/
SET @n2 =1111;/
SELECT fun1(0)/
ERROR 42S02: [RESIGNAL] An error occurred in function
SELECT fun1(1)/
ERROR 99999: [RESIGNAL] An error occurred in function

drop function fun1/

CREATE PROCEDURE p1(pval INT)
BEGIN
  DECLARE EXIT HANDLER FOR SQLEXCEPTION
  BEGIN
	DECLARE specialty CONDITION FOR SQLSTATE '45000';
	IF pval = 0 THEN
      RESIGNAL;
	ELSEIF pval = 1 THEN
      RESIGNAL SQLSTATE '03000';
	ELSEIF pval = 2 THEN
      RESIGNAL SQLSTATE '45000' SET MESSAGE_TEXT = '【RESIGNAL】An 45000 occurred';
	ELSEIF pval = 3 THEN
      RESIGNAL specialty SET MESSAGE_TEXT = '【RESIGNAL】An error occurred';
	ELSE
      RESIGNAL SQLSTATE '99999' SET MESSAGE_TEXT = '【RESIGNAL】An 99999 occurred', MYSQL_ERRNO = 1001;
	END IF;    
  END;
  DROP TABLE xxx;
END;
/
CALL p1(0)/
ERROR 42S02: Unknown table 'test.xxx'
CALL p1(1)/
ERROR 03000: Unknown table 'test.xxx'
CALL p1(2)/
ERROR 45000: 【RESIGNAL】An 45000 occurred
CALL p1(3)/
ERROR 45000: 【RESIGNAL】An error occurred
CALL p1(4)/
ERROR 99999: 【RESIGNAL】An 99999 occurred

drop procedure p1/

CREATE PROCEDURE p1(pval INT)
BEGIN
  IF pval = 0 THEN
    SIGNAL SQLSTATE '01000';
  END IF;
END;
/

CALL p1(0)/
Warnings:
Warning	1642	Unhandled user-defined exception condition
SHOW warnings;/
Level	Code	Message
Warning	1642	Unhandled user-defined exception condition

drop procedure p1/

create table t1(c0 int)/
insert into t1 values(100)/

create procedure p1()
begin
  DECLARE V_1 int;
  DECLARE done INT default 0;
  DECLARE C_1 CURSOR  FOR SELECT T1.C0 FROM T1;
  DECLARE CONTINUE HANDLER FOR NOT FOUND SET done=65530;
  OPEN C_1;
  repeat
  FETCH C_1 INTO V_1;
  select done;
  UNTIL done END REPEAT;
  CLOSE C_1;
END/

call p1()/
+------+
| done |
+------+
+-------+
| done  |
+-------+
|    0 |
| 65530 |
+------+
+-------+

drop table t1/

drop procedure p1/

create procedure p1()
begin
  if (SELECT '2008-12-31 23:59:59' + INTERVAL 1 SECOND) then
    select 1;
  else
    select 2;
  end if;
end;
/

call p1()/
+---+
| 1 |
+---+
| 1 |
+---+

drop procedure p1/

create procedure p1()
begin
  if ('2008-12-31 23:59:59' + INTERVAL 1 SECOND) then
    select 1;
  else
    select 2;
  end if;
end;
/

call p1()/
+---+
| 1 |
+---+
| 1 |
+---+

drop procedure p1/

create procedure p1()
begin
  declare a varchar(20);
  set a = '';
  if a = 0 then
    select 1;
  else
    select 2;
  end if;
end/

call p1()/
+---+
| 1 |
+---+
| 1 |
+---+

drop procedure p1/

create procedure p1()
begin
  declare a decimal;
  set a = '';
end/

call p1()/
ERROR HY000: Incorrect integer value

drop procedure p1/

create procedure p1()
begin
  if (select curdate()) then
    if (select 0) then
      select 1;
    elseif (select curdate()) then
      select 2;
    else
      select 3;
    end if;
  else
    select 4;
  end if;
end/

call p1()/
+---+
| 2 |
+---+
| 2 |
+---+

drop procedure p1/

create table t1(c0 int)/

drop function if exists f1/
drop function if exists f2/
create function f1(id int)returns int deterministic
begin
   insert into t1 values(2);
   if id>1 then
   insert into t1 values('aa');
   end if;
return 1;
end;/

create procedure p1()
begin
 if f1(1)=f1(2) then
  set @a=1;
 end if;
end;/

call p1() /
ERROR HY000: Incorrect integer value for column 'c0' at row 1
select * from t1/
+------+
| c0   |
+------+
+------+

drop procedure p1/

create procedure p1()
begin
 if f1(1) then
  set @a=f1(2);
 end if;
end;/

call p1()/
ERROR HY000: Incorrect integer value for column 'c0' at row 1

select * from t1/
+------+
| c0   |
+------+
|    2 |
+------+

delete from t1/

create function f2() returns int deterministic
begin
  if f1(1)=f1(2) then
    set @a=1;
  end if;
  return 2;
end;/

select f2()/
ERROR HY000: Incorrect integer value for column 'c0' at row 1

select * from t1/
+------+
| c0   |
+------+
+------+

drop function f2/

create function f2() returns int deterministic
begin
  if f1(1) then
    set @a=f1(2);
  end if;
  return 2;
end;/

select f2()/
ERROR HY000: Incorrect integer value for column 'c0' at row 1

select * from t1/
+------+
| c0   |
+------+
+------+

delete from t1/
drop procedure p1/
drop function f2/

set autocommit = 0/

create procedure p1()
begin
  if f1(1)=f1(2) then
    set @a=1;
  end if;
end;/

insert into t1 value(0)/

call p1()/
ERROR HY000: Incorrect integer value for column 'c0' at row 1

select * from t1/
+------+
| c0   |
+------+
|    0 |
+------+

rollback/

select * from t1/
+------+
| c0   |
+------+
+------+

drop procedure p1/

create procedure p1()
begin
 if f1(1) then
  set @a=f1(2);
 end if;
end;/

insert into t1 value(0)/

call p1()/
ERROR HY000: Incorrect integer value for column 'c0' at row 1

select * from t1/
+------+
| c0   |
+------+
|    0 |
|    2 |
+------+

rollback/

create function f2() returns int deterministic
begin
  if f1(1) then
    set @a=f1(2);
  end if;
  return 2;
end;/

insert into t1 value(0)/

select f2()/
ERROR HY000: Incorrect integer value for column 'c0' at row 1

select * from t1/
+------+
| c0   |
+------+
|    0 |
+------+

drop table t1/
drop procedure p1/
drop function f1/
drop function f2/

set autocommit = 1/

create table t1(id int);/

create function f1()returns varchar(1)
begin
insert into t1 values(1);
return 'a';
end;/

create function f2()returns int deterministic
begin
declare aa int;
DECLARE continue HANDLER FOR SQLEXCEPTION
set @a=1;
set aa=f1();
return 1;
end
/

select f2()/
+------+
| f2() |
+------+
|    1 |
+------+
select * from t1/
+------+
| id   |
+------+
|    1 |
+------+

create procedure p1()
begin
declare aa int;
DECLARE continue HANDLER FOR SQLEXCEPTION
begin
set @a=1;
end;
set aa=f1();
end
/

call p1()/
select * from t1/
+------+
| id   |
+------+
|    1 |
+------+

drop table t1/
drop function f1/
drop function f2/
drop procedure p1/

create table t1(id int);/

create procedure p1()
begin
declare t_error int;
DECLARE continue HANDLER FOR SQLEXCEPTION set t_error=1;
insert into t1 values(1);
start transaction;
insert into t1 values(2);
insert into t1 values('a');
if t_error=1 then
rollback;
end if;
end;
/

call p1()/
select * from t1/
+------+
| id   |
+------+
|    1 |
+------+

drop table t1/
drop procedure p1/

drop procedure if exists p2/
CREATE procedure p2(a varchar(2))
begin
   set @a=100;
end;
/

CREATE procedure p1()
begin
   declare out_code varchar(10);
   declare out_msg varchar(100);
   declare continue handler for SQLEXCEPTION
   begin
        show warnings;
        get diagnostics condition 1
          out_code=returned_sqlstate,out_msg=message_text;
        select 'error:',out_code,out_msg;
   end;
   call p2('aaaa');
end;
/

call p1()/
+-------+------+--------------------------+
| Level | Code | Message                  |
+-------+------+--------------------------+
+--------+----------+--------------------------+
| error: | out_code | out_msg                  |
+--------+----------+--------------------------+
| Error | 1406 | Data too long for column |
| error: | 22001    | Data too long for column |
+-------+------+--------------------------+
+--------+----------+--------------------------+

drop procedure p1/
drop procedure p2/

CREATE function f_func1() returns int
begin
  alter function f_func COMMENT'xiaolai' MODIFIES SQL DATA sql security definer;
  drop function f_func;
  return 0;
end;
/
ERROR HY000: Can't drop or alter a 'FUNCTION' from within another stored routine.

CREATE function f_func1() returns int
begin
  alter procedure p_test COMMENT'xiaolai' MODIFIES SQL DATA sql security invoker;
  drop procedure p_test;
  return 0;
end;
/
ERROR HY000: Can't drop or alter a 'PROCEDURE' from within another stored routine.

drop table if exists t2/
CREATE TABLE t2(c3 timestamp)/
INSERT INTO t2 VALUES('2020-01-13 21:29:31')/

CREATE  TRIGGER demo BEFORE INSERT ON t2 FOR EACH ROW
BEGIN
  alter function f_func COMMENT'xiaolai' MODIFIES SQL DATA sql security definer;
  alter procedure p_test COMMENT'xiaolai' MODIFIES SQL DATA sql security invoker;
  drop function f_func;
  drop procedure p_test;
END;
/
ERROR HY000: Can't drop or alter a 'FUNCTION' from within another stored routine.

CREATE  PROCEDURE p_test1() 
begin
  alter function f_func COMMENT'xiaolai' MODIFIES SQL DATA sql security definer;
  alter procedure p_test COMMENT'xiaolai' MODIFIES SQL DATA sql security invoker;
  drop function f_func;
  drop procedure p_test;
END;
/
ERROR HY000: Can't drop or alter a 'FUNCTION' from within another stored routine.


drop table if exists t0;
drop table if exists t1;
drop function if exists f1;

create table t0(c0 int);
insert into t0 values(0);

create table t1(c0 int);
insert into t1 values(0);

create function f1() returns int
begin
declare a int;
select count(*) into a from t1 for update;
return 1;
end;
/

select  /*+ENABLE_PARALLEL_DML parallel(2) */ f1() from t0;
+------+
| f1() |
+------+
|    1 |
+------+

drop table t0;
drop table t1;
drop function f1;

drop table if exists t0;
drop procedure if exists p1;
drop function if exists f1;
create table t0(c0 int);
insert into t0 values(1);


create function f1() returns int
begin
call p1();
return 0;
end;
/


update t0 set c0=f1();
ERROR 42000: procedure/function does not exist

update /*+ ENABLE_PARALLEL_DML parallel(2) */ t0 set c0=f1();
ERROR 42000: procedure/function does not exist

drop table if exists t9;
drop table if exists t13;
drop function if exists f1;
drop function if exists FUNC_NEST_OUTER_DML_INNER_SELECT_15_1318;
create table t9 (c1 TIMESTAMP(3)  NOT NULL default 0,c2 BINARY(89) ,c3 BIGINT(127)  auto_increment,c4 TIMESTAMP(1)  NOT NULL default 0,c5 NUMERIC(64,5) ,c6 NUMERIC(64,16) ,c7 DATE,c8 TIMESTAMP NOT NULL default 0,c9 TIMESTAMP NOT NULL default 0,c10 DATE,c11 VARCHAR(86) ,c12 BIGINT(127) ,c13 TIMESTAMP(5)  NOT NULL default 0,c14 CHAR(152) ,c15 DECIMAL(64,6) ,c16 CHAR(152) , primary key(c16,c3,c11,c12,c2,c14))  DEFAULT CHARSET = utf8mb4 COLLATE = utf8mb4_bin PARTITION BY KEY(c16,c3) PARTITIONS 10;
create table t13 (c1 BINARY(147) ,c2 INTEGER(127) ,c3 INT(127) ,c4 TIME,c5 TIMESTAMP NOT NULL default 0,c6 DATETIME,c7 NUMERIC(64,1) ,c8 INT(127)  auto_increment,c9 BIGINT(127) ,c10 VARBINARY(52) , primary key(c7,c10,c8))  DEFAULT CHARSET = utf8mb4 COLLATE = utf8mb4_bin PARTITION BY KEY(c7,c10) PARTITIONS 10;


CREATE FUNCTION FUNC_NEST_OUTER_DML_INNER_SELECT_15_1318(INTVALUE INT)
   RETURNS INT
   BEGIN
     DECLARE A, B INT;
     select ceil(rand() * 1000) INTO B from dual;
     SELECT INTVALUE INTO A FROM (select B from dual);
     SELECT count(*) - B + A + INTVALUE INTO A FROM (SELECT * FROM ((SELECT t13_15.c4 AS c1 FROM (SELECT (SELECT MIN(t13.c1) FROM t13) AS c1, (SELECT t13.c2 FROM t13 ORDER BY 1 DESC LIMIT 1) AS c2, t13.c3, t13.c4, (SELECT t13.c5 FROM t13 ORDER BY 1 LIMIT 1) AS c5, t13.c6, t13.c7, t13.c8, t13.c9, t13.c10 FROM t13) AS t13_15 WHERE '11' IN (t13_15.c3, t13_15.c3) OR 'PtsWVEFrXbmdNdERjXIeHRHhMSeXwQEPUViODkoIOyUylswpgJiAzOKlmERo' <> 'kFbeNUsrPjMprLRTvnrsZFbaDpKkLtTkDCbMdLKAJgtVebzwDtfCZNaIvVry' AND concat('JGgHsaFKIBncZKIwtKyvWpoOmYJCFYeVUDFxpgeOptVxdVBvRhfPkYFMKoeuwP', 'ACRFcfoyLFHwOowEcGT') LIKE '%Ab%' GROUP BY t13_15.c4 HAVING COUNT(t13_15.c9) <> 285 ORDER BY 1 DESC) EXCEPT (SELECT t9_5.c9 FROM t9 AS t9_5 WHERE '814' IN (t9_5.c12, t9_5.c12) OR t9_5.c7 <= (SELECT t9_5.c10 FROM t9 AS t9_5 ORDER BY 1 LIMIT 1) AND t9_5.c7 <> t9_5.c10 GROUP BY t9_5.c9 ORDER BY 1 ASC) ORDER BY 1) ORDER BY 1);
     RETURN A;
   END;/


explain DELETE /*+ ENABLE_PARALLEL_DML parallel(t9, 2) */ FROM t9 WHERE t9.c2='zSwSrSuGyIKFbcNlzNJmTEVwheeAQRm' or t9.c3=(SELECT FUNC_NEST_OUTER_DML_INNER_SELECT_15_1318(@DEF_BIGINT_NAME) FROM DUAL) or t9.c11='ENeETgcGPsnNjIEqyLDLmEPDwcDrcRoTgCYtSUcRCUpEmBcNyXZUbbxSKFAMvVgjLIGrVW' or t9.c12=943 ;
Query Plan
===============================================================
|ID|OPERATOR                       |NAME|EST.ROWS|EST.TIME(us)|
---------------------------------------------------------------
|0 |DISTRIBUTED DELETE             |    |1       |33          |
|1 |└─SUBPLAN FILTER               |    |1       |22          |
|2 |  ├─DISTRIBUTED TABLE FULL SCAN|t9  |1       |22          |
|3 |  └─EXPRESSION                 |    |1       |1           |
===============================================================
Outputs & filters:
-------------------------------------
  0 - output(nil), filter(nil)
      table_columns([{t9: ({t9: (t9.c16, t9.c3, t9.c11, t9.c12, t9.c2, t9.c14, t9.c1, t9.c4, t9.c5, t9.c6, t9.c7, t9.c8, t9.c9, t9.c10, t9.c13, t9.c15)})}])
  1 - output([t9.c16], [t9.c3], [t9.c11], [t9.c12], [t9.c2], [t9.c14], [t9.c1], [t9.c4], [t9.c5], [t9.c6], [t9.c7], [t9.c8], [t9.c9], [t9.c10], [t9.c13],
       [t9.c15]), filter([(T_OP_OR, cast(t9.c2, VARCHAR(1048576)) = cast('zSwSrSuGyIKFbcNlzNJmTEVwheeAQRm', VARCHAR(1048576)), t9.c3 = subquery(1), t9.c11 = cast('ENeETgcGPsnNjIEqyLDLmEPDwcDrcRoTgCYtSUcRCUpE
      mBcNyXZUbbxSKFAMvVgjLIGrVW', VARCHAR(1048576)), t9.c12 = 943)])
      exec_params_(nil), onetime_exprs_(nil), init_plan_idxs_(nil), use_batch=false
  2 - output([t9.c16], [t9.c3], [t9.c11], [t9.c12], [t9.c2], [t9.c14], [t9.c1], [t9.c4], [t9.c5], [t9.c6], [t9.c7], [t9.c8], [t9.c9], [t9.c10], [t9.c13],
       [t9.c15]), filter(nil)
      access([t9.c16], [t9.c3], [t9.c11], [t9.c12], [t9.c2], [t9.c14], [t9.c1], [t9.c4], [t9.c5], [t9.c6], [t9.c7], [t9.c8], [t9.c9], [t9.c10], [t9.c13],
       [t9.c15]), partitions(p[0-9])
      is_index_back=false, is_global_index=false, 
      range_key([t9.c16], [t9.c3], [t9.c11], [t9.c12], [t9.c2], [t9.c14]), range(MIN,MIN,MIN,MIN,MIN,MIN ; MAX,MAX,MAX,MAX,MAX,MAX)always true
  3 - output([FUNC_NEST_OUTER_DML_INNER_SELECT_15_1318(cast(('def_bigint_name'), INT(11, 0)))]), filter(nil)
      values({FUNC_NEST_OUTER_DML_INNER_SELECT_15_1318(cast(('def_bigint_name'), INT(11, 0)))})


create function f1() RETURNS INT
BEGIN
  savepoint a;
  return 1;
end/


explain DELETE /*+ ENABLE_PARALLEL_DML parallel(t9, 2) */ FROM t9 where t9.c2 = f1();
Query Plan
=============================================================
|ID|OPERATOR                     |NAME|EST.ROWS|EST.TIME(us)|
-------------------------------------------------------------
|0 |DISTRIBUTED DELETE           |    |1       |33          |
|1 |└─DISTRIBUTED TABLE FULL SCAN|t9  |1       |22          |
=============================================================
Outputs & filters:
-------------------------------------
  0 - output(nil), filter(nil)
      table_columns([{t9: ({t9: (t9.c16, t9.c3, t9.c11, t9.c12, t9.c2, t9.c14, t9.c1, t9.c4, t9.c5, t9.c6, t9.c7, t9.c8, t9.c9, t9.c10, t9.c13, t9.c15)})}])
  1 - output([t9.c16], [t9.c3], [t9.c11], [t9.c12], [t9.c2], [t9.c14], [t9.c1], [t9.c4], [t9.c5], [t9.c6], [t9.c7], [t9.c8], [t9.c9], [t9.c10], [t9.c13],
       [t9.c15]), filter([cast(t9.c2, DECIMAL(-1, -1)) = cast(f1(), DECIMAL(11, 0))])
      access([t9.c16], [t9.c3], [t9.c11], [t9.c12], [t9.c2], [t9.c14], [t9.c1], [t9.c4], [t9.c5], [t9.c6], [t9.c7], [t9.c8], [t9.c9], [t9.c10], [t9.c13],
       [t9.c15]), partitions(p[0-9])
      is_index_back=false, is_global_index=false, filter_before_indexback[false], 
      range_key([t9.c16], [t9.c3], [t9.c11], [t9.c12], [t9.c2], [t9.c14]), range(MIN,MIN,MIN,MIN,MIN,MIN ; MAX,MAX,MAX,MAX,MAX,MAX)always true

select f1() from dual;
+------+
| f1() |
+------+
|    1 |
+------+

drop table t9;
drop table t13;
drop function f1;
drop function FUNC_NEST_OUTER_DML_INNER_SELECT_15_1318;

drop procedure if exists test_lpad_length;
CREATE PROCEDURE test_lpad_length()
BEGIN
    DECLARE padded_string VARCHAR(32767);
    DECLARE length_limit INT DEFAULT 1;
    DECLARE continue_loop BOOLEAN DEFAULT TRUE;

    WHILE continue_loop DO
        SET padded_string = LPAD('Hello', length_limit, '*');
        SET length_limit = length_limit + 1;
        IF padded_string == '' THEN
            SELECT length_limit - 1 AS max_length;
            SET continue_loop = FALSE;
        END IF;
    END WHILE;
END
//


drop procedure test_lpad_length;

select 1 from dual 1==1;
ERROR 42000: You have an error in your SQL syntax; check the manual that corresponds to your OceanBase version for the right syntax to use near '1==1' at line 1
