result_format: 4

# ◆ 准备测试用户
drop user if exists whh_test0;
drop database if exists whh_test0_db;
create user 'whh_test0' identified by 'whh_test0';
create database whh_test0_db character set utf8;
grant all on *.* to 'whh_test0'@'%' with grant option;



set ob_trx_timeout = 10000000000;
set ob_query_timeout = 10000000000;
SET GLOBAL sql_mode = 'STRICT_ALL_TABLES,NO_ZERO_IN_DATE,NO_AUTO_CREATE_USER';

#-----------------------------------------------------------------------------
# 场景： enum 与 pl 正交测试
#-----------------------------------------------------------------------------
drop table tab0;
CREATE TABLE tab0 (
    id INT AUTO_INCREMENT PRIMARY KEY,
    c1 ENUM('','NULL', 'one', 'TWO','Three','FouR') NOT NULL,
    c1_index int as (c1) STORED,
    c2 ENUM('','NULL', '-1', '2', '3.14', '4.0', 'One', 'Two') DEFAULT '',
    c2_index int as (c2+0) STORED,
    c3 VARCHAR(255));
INSERT INTO tab0(c1,c2,c3) VALUES ('', '', '空枚举值');
INSERT INTO tab0(c1,c2,c3) VALUES ('NULL', NULL, 'NULL');
INSERT INTO tab0(c1,c2,c3) VALUES ('one', '-1', '枚举值');
INSERT INTO tab0(c1,c2,c3) VALUES ('4', '4', '下标');
INSERT INTO tab0(c1,c2,c3) VALUES (5, 5, '下标');
INSERT INTO tab0(c1,c2,c3) VALUES ('FouR', '4.0','枚举值');
select * from tab0 order by 1;
+----+-------+----------+------+----------+--------------+
| id | c1    | c1_index | c2   | c2_index | c3           |
+----+-------+----------+------+----------+--------------+
|  1 |       |        1 |      |        1 | 空枚举值     |
|  2 | NULL  |        2 | NULL |     NULL | NULL         |
|  3 | one   |        3 | -1   |        3 | 枚举值       |
|  4 | TWO   |        4 | 2    |        4 | 下标         |
|  5 | Three |        5 | 3.14 |        5 | 下标         |
|  6 | FouR  |        6 | 4.0  |        6 | 枚举值       |
+----+-------+----------+------+----------+--------------+

drop table tab1;
CREATE TABLE tab1 (
    id INT AUTO_INCREMENT PRIMARY KEY,
    c1 ENUM('','NULL', 'one', 'TWO','Three','FouR') NOT NULL,
    c2 ENUM('','NULL', '-1', '2', '3.14', '4.0', 'One', 'Two') DEFAULT '',
    c3 varchar(2000));
INSERT INTO tab1(c1,c2,c3) VALUES ('one', '-1', '1');
INSERT INTO tab1(c1,c2,c3) VALUES ('TWO', '2','2');
select * from tab1 order by 1;
+----+------+------+------+
| id | c1   | c2   | c3   |
+----+------+------+------+
|  1 | one  | -1   | 1    |
|  2 | TWO  | 2    | 2    |
+----+------+------+------+

drop table tab2;
CREATE TABLE tab2 (
    id INT AUTO_INCREMENT PRIMARY KEY,
    c1 ENUM('','NULL', 'one', 'TWO','Three','FouR') NOT NULL,
    c2 ENUM('','NULL', '-1', '2', '3.14', '4.0', 'One', 'Two') DEFAULT '',
    c3 varchar(2000));
INSERT INTO tab2(c1,c2,c3) VALUES ('Three', '3.14','1');
select * from tab2 order by 1;
+----+-------+------+------+
| id | c1    | c2   | c3   |
+----+-------+------+------+
|  1 | Three | 3.14 | 1    |
+----+-------+------+------+

############ ◆◆ function
#### 参数类型
drop FUNCTION my_fun1_1;
drop FUNCTION my_fun1_2;

CREATE FUNCTION MY_FUN1_1(arg ENUM('','NULL', 'one', 'TWO','Three','FouR')) RETURNS INT DETERMINISTIC
BEGIN
  RETURN arg+0;
END 
/
CREATE FUNCTION MY_FUN1_2(arg ENUM('','NULL', 'one', 'TWO','Three','FouR','ARG')) RETURNS ENUM('','NULL', 'one', 'TWO','Three','FouR','RETURNS') DETERMINISTIC
BEGIN
  RETURN arg;
END 
/
CREATE FUNCTION MY_FUN1_3(arg1 ENUM('','NULL', 'one', 'TWO','Three','FouR','ARG'), arg2 ENUM('','NULL', 'one', 'TWO','Three','FouR','ARG')) RETURNS ENUM('','NULL', 'one', 'TWO','Three','FouR','RETURNS') DETERMINISTIC
BEGIN
  RETURN arg1 + arg2;
END 
/

select MY_FUN1_1(NULL);
+-----------------+
| MY_FUN1_1(NULL) |
+-----------------+
|            NULL |
+-----------------+
select MY_FUN1_1(''),MY_FUN1_1('one'),MY_FUN1_1('NULL');
+---------------+------------------+-------------------+
| MY_FUN1_1('') | MY_FUN1_1('one') | MY_FUN1_1('NULL') |
+---------------+------------------+-------------------+
|             1 |                3 |                 2 |
+---------------+------------------+-------------------+
select MY_FUN1_1('ONE'),MY_FUN1_1('two'),MY_FUN1_1('NuLL');
+------------------+------------------+-------------------+
| MY_FUN1_1('ONE') | MY_FUN1_1('two') | MY_FUN1_1('NuLL') |
+------------------+------------------+-------------------+
|                3 |                4 |                 2 |
+------------------+------------------+-------------------+
select my_fun1_3('ONE', '');
+----------------------+
| my_fun1_3('ONE', '') |
+----------------------+
| TWO                  |
+----------------------+
select my_fun1_3('ONE', 'NULL');
+--------------------------+
| my_fun1_3('ONE', 'NULL') |
+--------------------------+
| Three                    |
+--------------------------+
select MY_FUN1_1('xxxx');
ERROR 01000: Data truncated for argument
select MY_FUN1_1(c1) from tab0 order by 1;
+---------------+
| MY_FUN1_1(c1) |
+---------------+
|             1 |
|             2 |
|             3 |
|             4 |
|             5 |
|             6 |
+---------------+

select MY_FUN1_1(2),MY_FUN1_1(4);
+--------------+--------------+
| MY_FUN1_1(2) | MY_FUN1_1(4) |
+--------------+--------------+
|            2 |            4 |
+--------------+--------------+
select MY_FUN1_1(c1_index) from tab0 order by 1;
+---------------------+
| MY_FUN1_1(c1_index) |
+---------------------+
|                   1 |
|                   2 |
|                   3 |
|                   4 |
|                   5 |
|                   6 |
+---------------------+
select MY_FUN1_1(c1+0) from tab0 order by 1;
+-----------------+
| MY_FUN1_1(c1+0) |
+-----------------+
|               1 |
|               2 |
|               3 |
|               4 |
|               5 |
|               6 |
+-----------------+

select MY_FUN1_2(NULL);
+-----------------+
| MY_FUN1_2(NULL) |
+-----------------+
| NULL            |
+-----------------+
select MY_FUN1_2(''),MY_FUN1_2('one'),MY_FUN1_2('NULL');
+---------------+------------------+-------------------+
| MY_FUN1_2('') | MY_FUN1_2('one') | MY_FUN1_2('NULL') |
+---------------+------------------+-------------------+
|               | one              | NULL              |
+---------------+------------------+-------------------+
select MY_FUN1_2('ONE'),MY_FUN1_2('two'),MY_FUN1_2('NuLL');
+------------------+------------------+-------------------+
| MY_FUN1_2('ONE') | MY_FUN1_2('two') | MY_FUN1_2('NuLL') |
+------------------+------------------+-------------------+
| one              | TWO              | NULL              |
+------------------+------------------+-------------------+
select MY_FUN1_2('xxxx');
ERROR 01000: Data truncated for argument
select MY_FUN1_2(c1) from tab0 order by 1;
+---------------+
| MY_FUN1_2(c1) |
+---------------+
|               |
| NULL          |
| one           |
| TWO           |
| Three         |
| FouR          |
+---------------+

select MY_FUN1_2(2),MY_FUN1_2(4);
+--------------+--------------+
| MY_FUN1_2(2) | MY_FUN1_2(4) |
+--------------+--------------+
| NULL         | TWO          |
+--------------+--------------+
select MY_FUN1_2(c1_index) from tab0 order by 1;
+---------------------+
| MY_FUN1_2(c1_index) |
+---------------------+
|                     |
| NULL                |
| one                 |
| TWO                 |
| Three               |
| FouR                |
+---------------------+
select MY_FUN1_2(c1+0) from tab0 order by 1;
+-----------------+
| MY_FUN1_2(c1+0) |
+-----------------+
|                 |
| NULL            |
| one             |
| TWO             |
| Three           |
| FouR            |
+-----------------+

select MY_FUN1_2(6);
+--------------+
| MY_FUN1_2(6) |
+--------------+
| FouR         |
+--------------+
select MY_FUN1_2(7);
ERROR 01000: Data truncated for argument
select MY_FUN1_2('ARG');
ERROR 01000: Data truncated for argument
select MY_FUN1_2('RETURNS');
ERROR 01000: Data truncated for argument

drop function My_Fun1_1;
drop function My_Fun1_2;

#### 返回值类型
drop FUNCTION my_fun2_1;
drop FUNCTION my_fun2_2;
drop FUNCTION my_fun2_3;

CREATE FUNCTION MY_FUN2_1(arg ENUM('','NULL', 'ONE')) RETURNS ENUM(' ','null', 'one', 'TWO','Three','FouR','RETURNS') DETERMINISTIC
BEGIN
  RETURN arg;
END 
/
CREATE FUNCTION MY_FUN2_2(arg ENUM('','NULL', 'ONE', 'TWO','THREE','FOUR','ARG')) RETURNS ENUM('','NULL', 'one') DETERMINISTIC
BEGIN
  RETURN arg;
END 
/
CREATE FUNCTION MY_FUN2_3(arg ENUM('','NULL', 'ONE', 'TWO','THREE','FOUR','ARG')) RETURNS ENUM('','NULL', 'one', 'TWO','Three','FouR','RETURNS') DETERMINISTIC
BEGIN
  RETURN arg;
END 
/

set @a='ONE';
select MY_FUN2_1(@a);
+---------------+
| MY_FUN2_1(@a) |
+---------------+
| one           |
+---------------+
select length(MY_FUN2_1('     '));
+----------------------------+
| length(MY_FUN2_1('     ')) |
+----------------------------+
|                          0 |
+----------------------------+
select length(MY_FUN2_1('')),length(MY_FUN2_1(' '));
+-----------------------+------------------------+
| length(MY_FUN2_1('')) | length(MY_FUN2_1(' ')) |
+-----------------------+------------------------+
|                     0 |                      0 |
+-----------------------+------------------------+
select MY_FUN2_1('NULL'),MY_FUN2_1('null');
+-------------------+-------------------+
| MY_FUN2_1('NULL') | MY_FUN2_1('null') |
+-------------------+-------------------+
| null              | null              |
+-------------------+-------------------+
select MY_FUN2_1('ONE'),MY_FUN2_1('one');
+------------------+------------------+
| MY_FUN2_1('ONE') | MY_FUN2_1('one') |
+------------------+------------------+
| one              | one              |
+------------------+------------------+
select MY_FUN2_1('TWO');
ERROR 01000: Data truncated for argument

select length(MY_FUN2_2('')),length(MY_FUN2_2('   '));
+-----------------------+--------------------------+
| length(MY_FUN2_2('')) | length(MY_FUN2_2('   ')) |
+-----------------------+--------------------------+
|                     0 |                        0 |
+-----------------------+--------------------------+
select MY_FUN2_2('ONE'),MY_FUN2_2('one');
+------------------+------------------+
| MY_FUN2_2('ONE') | MY_FUN2_2('one') |
+------------------+------------------+
| one              | one              |
+------------------+------------------+
select MY_FUN2_2('TWO');
ERROR 01000: Data truncated for argument

select MY_FUN2_3(''),MY_FUN2_3('NULL'),MY_FUN2_3('FOUR');
+---------------+-------------------+-------------------+
| MY_FUN2_3('') | MY_FUN2_3('NULL') | MY_FUN2_3('FOUR') |
+---------------+-------------------+-------------------+
|               | NULL              | FouR              |
+---------------+-------------------+-------------------+
select MY_FUN2_3('ARG');
ERROR 01000: Data truncated for argument
select MY_FUN2_3('RETURNS');
ERROR 01000: Data truncated for argument

drop function my_fun2_1;
drop function my_fun2_2;
drop function my_fun2_3;

#### 变量类型
drop FUNCTION my_fun3_1;
drop FUNCTION my_fun3_2;
drop FUNCTION my_fun3_3;
drop FUNCTION my_fun3_4;
drop FUNCTION my_fun3_5;

CREATE FUNCTION my_fun3_1(arg ENUM('','null', 'one', 'two')) RETURNS ENUM('','null', 'one', 'two') DETERMINISTIC
BEGIN
  RETURN arg;
END 
/
CREATE FUNCTION my_fun3_2(arg ENUM('','NULL', 'ONE', 'TWO','THREE','FOUR')) RETURNS ENUM('','NULL', 'ONE', 'TWO','THREE','FOUR') DETERMINISTIC
BEGIN
  RETURN arg;
END 
/
CREATE FUNCTION my_fun3_3() RETURNS INT DETERMINISTIC
BEGIN
  declare var1 ENUM('','NULL', 'One', 'TWO');
  set var1 = 'One';
  RETURN var1;
END 
/
CREATE FUNCTION my_fun3_4() RETURNS INT DETERMINISTIC
BEGIN
  declare var1 ENUM('','NULL', 'One', 'TWO') default 'TWO';
  RETURN var1;
END 
/
CREATE FUNCTION my_fun3_5(arg ENUM('','NULL', 'ONE', 'TWO','THREE','FOUR')) RETURNS INT DETERMINISTIC
BEGIN
  declare var1 ENUM('','null', 'one', 'two');
  set var1 = arg;
  RETURN var1;
END 
/

select my_fun3_1('null');
+-------------------+
| my_fun3_1('null') |
+-------------------+
| null              |
+-------------------+
select my_fun3_2('TWO');
+------------------+
| my_fun3_2('TWO') |
+------------------+
| TWO              |
+------------------+
select my_fun3_3();
+-------------+
| my_fun3_3() |
+-------------+
|           3 |
+-------------+
select my_fun3_4();
+-------------+
| my_fun3_4() |
+-------------+
|           4 |
+-------------+
select my_fun3_5('TWO');
+------------------+
| my_fun3_5('TWO') |
+------------------+
|                4 |
+------------------+
select my_fun3_5('FOUR');
ERROR 01000: Data truncated for argument
select my_fun3_5(my_fun3_1('null'));
+------------------------------+
| my_fun3_5(my_fun3_1('null')) |
+------------------------------+
|                            2 |
+------------------------------+
select my_fun3_5(my_fun3_2('TWO'));
+-----------------------------+
| my_fun3_5(my_fun3_2('TWO')) |
+-----------------------------+
|                           4 |
+-----------------------------+
select my_fun3_5(my_fun3_2(my_fun3_1('ONE')));
+----------------------------------------+
| my_fun3_5(my_fun3_2(my_fun3_1('ONE'))) |
+----------------------------------------+
|                                      3 |
+----------------------------------------+
select my_fun3_5(my_fun3_1(my_fun3_2('TWO')));
+----------------------------------------+
| my_fun3_5(my_fun3_1(my_fun3_2('TWO'))) |
+----------------------------------------+
|                                      4 |
+----------------------------------------+
select my_fun3_5(my_fun3_1('')+my_fun3_1('null'));
+--------------------------------------------+
| my_fun3_5(my_fun3_1('')+my_fun3_1('null')) |
+--------------------------------------------+
|                                          3 |
+--------------------------------------------+
select my_fun3_5(my_fun3_2('')+my_fun3_2('null'));
+--------------------------------------------+
| my_fun3_5(my_fun3_2('')+my_fun3_2('null')) |
+--------------------------------------------+
|                                          3 |
+--------------------------------------------+
select my_fun3_5(my_fun3_1(my_fun3_2('THREE')));
ERROR 01000: Data truncated for argument
select my_fun3_5(my_fun3_2('THREE'));
ERROR 01000: Data truncated for argument
select my_fun3_1('ONE')+my_fun3_1('two');
+-----------------------------------+
| my_fun3_1('ONE')+my_fun3_1('two') |
+-----------------------------------+
|                                 7 |
+-----------------------------------+
select my_fun3_2('THREE')+my_fun3_2('NULL');
+--------------------------------------+
| my_fun3_2('THREE')+my_fun3_2('NULL') |
+--------------------------------------+
|                                    7 |
+--------------------------------------+

drop function my_fun3_1;
drop function my_fun3_2;
drop function my_fun3_3;
drop function my_fun3_4;
drop function my_fun3_5;

############ ◆◆ 存储过程
#### 变量类型
#### 参数类型 in/inout
drop PROCEDURE my_pro4_1;
drop PROCEDURE my_pro4_2;
drop PROCEDURE my_pro4_3;

CREATE PROCEDURE my_pro4_1(in arg ENUM('','null', 'one', 'two','three','four'))
BEGIN
  declare var1 ENUM('','NULL', 'ONE', 'TWO') default null;
  SELECT var1 default_value;
END;
/
CREATE PROCEDURE my_pro4_2(inout arg ENUM('','null', 'one', 'two','three','four'))
BEGIN
  declare var1 ENUM('','NULL', 'ONE', 'TWO','THREE','FOUR') default 'ONE';
  declare var2 ENUM('','NULL', 'ONE', 'TWO','THREE','FOUR') default 'TWO';
  SELECT var1, var2, arg;
  set var1 = arg;
  set arg  = var2;
  set var2 = 'four';
  SELECT var1 ,var2, arg;
END;
/
CREATE PROCEDURE my_pro4_3()
BEGIN
  declare var1 ENUM('','NULL', 'ONE', 'TWO','THREE','FOUR') default 'THREE';
  declare var2 ENUM('','NULL', 'ONE', 'TWO','THREE','FOUR') default 'FOUR';
  SELECT var1, var2;
  call my_pro4_2(var1);
  call my_pro4_2(var2);
  SELECT var1 ,var2;
END;
/

call my_pro4_1('   ');
+---------------+
| default_value |
+---------------+
| NULL          |
+---------------+
call my_pro4_1('two');
+---------------+
| default_value |
+---------------+
| NULL          |
+---------------+
call my_pro4_1(concat('T','wo'));
+---------------+
| default_value |
+---------------+
| NULL          |
+---------------+
call my_pro4_1(4);
+---------------+
| default_value |
+---------------+
| NULL          |
+---------------+
call my_pro4_1(5);
+---------------+
| default_value |
+---------------+
| NULL          |
+---------------+
call my_pro4_1('three');
+---------------+
| default_value |
+---------------+
| NULL          |
+---------------+

set @arg='three';
call my_pro4_2(@arg);
+------+------+-------+
| var1 | var2 | arg   |
+------+------+-------+
+-------+------+------+
| var1  | var2 | arg  |
+-------+------+------+
| ONE  | TWO  | three |
| THREE | FOUR | two  |
+------+------+-------+
+-------+------+------+
SELECT @arg;
+------+
| @arg |
+------+
| two  |
+------+

set @arg=2;
call my_pro4_2(@arg);
+------+------+------+
| var1 | var2 | arg  |
+------+------+------+
+------+------+------+
| var1 | var2 | arg  |
+------+------+------+
| ONE  | TWO  | null |
| NULL | FOUR | two  |
+------+------+------+
+------+------+------+
SELECT @arg;
+------+
| @arg |
+------+
| two  |
+------+

call my_pro4_3();
+-------+------+
| var1  | var2 |
+-------+------+
+------+------+-------+
| var1 | var2 | arg   |
+------+------+-------+
+-------+------+------+
| var1  | var2 | arg  |
+-------+------+------+
+------+------+------+
| var1 | var2 | arg  |
+------+------+------+
+------+------+------+
| var1 | var2 | arg  |
+------+------+------+
+------+------+
| var1 | var2 |
+------+------+
| THREE | FOUR |
| ONE  | TWO  | three |
| THREE | FOUR | two  |
| ONE  | TWO  | four |
| FOUR | FOUR | two  |
| TWO  | TWO  |
+-------+------+
+------+------+-------+
+-------+------+------+
+------+------+------+
+------+------+------+
+------+------+

#### 变量类型 out
drop PROCEDURE my_pro5_1;
drop PROCEDURE my_pro5_2;
drop PROCEDURE my_pro5_3;

CREATE PROCEDURE my_pro5_1(out out_arg ENUM('','null', 'one', 'two','three','four'))
BEGIN
  declare var1 ENUM('','NULL', 'ONE', 'TWO') default null;
  set out_arg = var1;
  SELECT out_arg;
  set out_arg = 'ONE';
  SELECT out_arg;
  set out_arg = 3;
  SELECT out_arg;
  set out_arg = @var;
  SELECT out_arg;
END;
/
CREATE PROCEDURE my_pro5_2(in in_arg ENUM('','null', 'one', 'two','three','four'),inout inout_arg ENUM('','null', 'one', 'two','three','four'),out out_arg ENUM('','null', 'one', 'two','three','four'))
BEGIN
  declare var1 ENUM('','NULL', 'ONE', 'TWO','THREE','FOUR') default 'ONE';
  declare var2 ENUM('','NULL', 'ONE', 'TWO','THREE','FOUR') default 'TWO';
  set inout_arg = in_arg;
  SELECT inout_arg;
  set out_arg = in_arg;
  SELECT out_arg;
  set out_arg = inout_arg;
  SELECT out_arg;
END;
/
CREATE PROCEDURE my_pro5_3()
BEGIN
  declare var1 ENUM('','NULL', 'ONE', 'TWO','THREE','FOUR') default 'ONE';
  declare var2 ENUM('','NULL', 'ONE', 'TWO','THREE','FOUR') default 'TWO';
  declare var3 ENUM('','NULL', 'ONE', 'TWO','THREE','FOUR') default 'THREE';
  SELECT var1, var2, var3;
  call my_pro5_2(var1,var2,var3);
  SELECT var1 ,var2;
END;
/

set @var='two';
call my_pro5_1(@var);
+---------+
| out_arg |
+---------+
+---------+
| out_arg |
+---------+
+---------+
| out_arg |
+---------+
+---------+
| out_arg |
+---------+
| NULL    |
| one     |
| one     |
| two     |
+---------+
+---------+
+---------+
+---------+
select @var;
+------+
| @var |
+------+
| two  |
+------+

set @var1='two';
set @var2='THREE';
set @var3='FOUR';
call my_pro5_2(@var1,@var2,@var3);
+-----------+
| inout_arg |
+-----------+
+---------+
| out_arg |
+---------+
+---------+
| out_arg |
+---------+
| two       |
| two     |
| two     |
+-----------+
+---------+
+---------+
select @var1,@var2,@var3;
+-------+-------+-------+
| @var1 | @var2 | @var3 |
+-------+-------+-------+
| two   | two   | two   |
+-------+-------+-------+

call my_pro5_3();
+------+------+-------+
| var1 | var2 | var3  |
+------+------+-------+
+-----------+
| inout_arg |
+-----------+
+---------+
| out_arg |
+---------+
+---------+
| out_arg |
+---------+
+------+------+
| var1 | var2 |
+------+------+
| ONE  | TWO  | THREE |
| one       |
| one     |
| one     |
| ONE  | ONE  |
+------+------+-------+
+-----------+
+---------+
+---------+
+------+------+

drop PROCEDURE my_pro5_1;
drop PROCEDURE my_pro5_2;
drop PROCEDURE my_pro5_3;

drop PROCEDURE my_pro5_4;

CREATE PROCEDURE my_pro5_4(arg ENUM('','NULL', 'ONE', 'TWO','THREE','FOUR'))
BEGIN
  declare var1 ENUM('one', 'two') default 'one';
  declare var2 ENUM('','null', 'one', 'two') default 'two';
  declare var3 ENUM('','null', 'one', 'two','1','2','3') default '3';
  select var1,var2,var3,arg;
  set arg = var1;
  set var3 = var2;
  select var1,var2,var3,arg;
END 
/

call my_pro5_4('     ');
+------+------+------+------+
| var1 | var2 | var3 | arg  |
+------+------+------+------+
+------+------+------+------+
| var1 | var2 | var3 | arg  |
+------+------+------+------+
| one  | two  | 3    |      |
| one  | two  | two  | ONE  |
+------+------+------+------+
+------+------+------+------+
call my_pro5_4('THREE');
+------+------+------+-------+
| var1 | var2 | var3 | arg   |
+------+------+------+-------+
+------+------+------+------+
| var1 | var2 | var3 | arg  |
+------+------+------+------+
| one  | two  | 3    | THREE |
| one  | two  | two  | ONE  |
+------+------+------+-------+
+------+------+------+------+
call my_pro5_4('three');
+------+------+------+-------+
| var1 | var2 | var3 | arg   |
+------+------+------+-------+
+------+------+------+------+
| var1 | var2 | var3 | arg  |
+------+------+------+------+
| one  | two  | 3    | THREE |
| one  | two  | two  | ONE  |
+------+------+------+-------+
+------+------+------+------+
call my_pro5_4('  three  ');
ERROR 01000: Data truncated for argument
call my_pro5_4('xxxxx');
ERROR 01000: Data truncated for argument

drop PROCEDURE my_pro5_4;

############ ◆◆ 触发器
#### NEW.columnName 和 OLD.columnName 枚举值
drop trigger my_tri6_1;
drop trigger my_tri6_2;
drop trigger my_tri6_3;

create trigger my_tri6_1 before insert on tab1 for each row
begin
  declare var1 ENUM('','NULL', 'one', 'TWO','Three','FouR') DEFAULT 'two';
  declare var2 ENUM('','NULL', '-1', '2', '3.14', '4.0', 'One', 'Two') DEFAULT '2';
  INSERT INTO tab2(c1,c2,c3) VALUES (new.c1,new.c2,new.c3);
  set new.c1=var1;
  set new.c2=(select var2);
  set new.c3=111;
  INSERT INTO tab2(c1,c2,c3) VALUES (new.c1,new.c2,new.c3);
end;
/
create trigger my_tri6_2 before update on tab1 for each row
begin
  INSERT INTO tab2(c1,c2,c3) VALUES (old.c1,old.c2,old.c3);
  INSERT INTO tab2(c1,c2,c3) VALUES (new.c1,new.c2,new.c3);
  set new.c1='Three';
  set new.c2= (select c2 from tab2 where id = 1);
  set new.c3=222;
  INSERT INTO tab2(c1,c2,c3) VALUES (new.c1,new.c2,new.c3);  
end;
/
create trigger my_tri6_3 before delete on tab1 for each row
begin
  INSERT INTO tab2(c1,c2,c3) VALUES (old.c1,old.c2,old.c3);
end;
/

select * from tab1 order by 1;
+----+------+------+------+
| id | c1   | c2   | c3   |
+----+------+------+------+
|  1 | one  | -1   | 1    |
|  2 | TWO  | 2    | 2    |
+----+------+------+------+
select * from tab2 order by 1;
+----+-------+------+------+
| id | c1    | c2   | c3   |
+----+-------+------+------+
|  1 | Three | 3.14 | 1    |
+----+-------+------+------+

INSERT INTO tab1(c1,c2,c3) VALUES ('one', '-1',10);
select * from tab1 order by 1;
+----+------+------+------+
| id | c1   | c2   | c3   |
+----+------+------+------+
|  1 | one  | -1   | 1    |
|  2 | TWO  | 2    | 2    |
|  3 | TWO  | 2    | 111  |
+----+------+------+------+
select * from tab2 order by 1;
+----+-------+------+------+
| id | c1    | c2   | c3   |
+----+-------+------+------+
|  1 | Three | 3.14 | 1    |
|  2 | one   | -1   | 10   |
|  3 | TWO   | 2    | 111  |
+----+-------+------+------+

update tab1 set c1='NULL',c2='NULL',c3=20 where id = 2;
select * from tab1 order by 1;
+----+-------+------+------+
| id | c1    | c2   | c3   |
+----+-------+------+------+
|  1 | one   | -1   | 1    |
|  2 | Three | 3.14 | 222  |
|  3 | TWO   | 2    | 111  |
+----+-------+------+------+
select * from tab2 order by 1;
+----+-------+------+------+
| id | c1    | c2   | c3   |
+----+-------+------+------+
|  1 | Three | 3.14 | 1    |
|  2 | one   | -1   | 10   |
|  3 | TWO   | 2    | 111  |
|  4 | TWO   | 2    | 2    |
|  5 | NULL  | NULL | 20   |
|  6 | Three | 3.14 | 222  |
+----+-------+------+------+

delete from tab1 where id = 1;
select * from tab1 order by 1;
+----+-------+------+------+
| id | c1    | c2   | c3   |
+----+-------+------+------+
|  2 | Three | 3.14 | 222  |
|  3 | TWO   | 2    | 111  |
+----+-------+------+------+
select * from tab2 order by 1;
+----+-------+------+------+
| id | c1    | c2   | c3   |
+----+-------+------+------+
|  1 | Three | 3.14 | 1    |
|  2 | one   | -1   | 10   |
|  3 | TWO   | 2    | 111  |
|  4 | TWO   | 2    | 2    |
|  5 | NULL  | NULL | 20   |
|  6 | Three | 3.14 | 222  |
|  7 | one   | -1   | 1    |
+----+-------+------+------+

drop trigger my_tri6_1;
drop trigger my_tri6_2;
drop trigger my_tri6_3;

#### 枚举变量进行比较 IF
## 函数中
drop FUNCTION MY_FUN7_1;
ERROR 42000: FUNCTION whh_test0_db.MY_FUN7_1 does not exist

CREATE FUNCTION MY_FUN7_1(arg1 ENUM('','NULL', 'one', 'TWO','Three','FouR'),arg2 ENUM('','NULL', '-1', '2', '3.14', '4.0', 'One', 'Two')) RETURNS INT DETERMINISTIC
BEGIN
  IF arg1 != arg2 THEN
    IF arg1 > arg2 THEN
      INSERT INTO tab2(c3) VALUES ('arg1 > arg12');
    else
      INSERT INTO tab2(c3) VALUES ('arg1 < arg12');
    END IF;
  else
    INSERT INTO tab2(c3) VALUES ('arg1 = arg12');
  END IF;
  RETURN arg1;
END 
/

delete from tab2;

select MY_FUN7_1('one', '-1');
+------------------------+
| MY_FUN7_1('one', '-1') |
+------------------------+
|                      3 |
+------------------------+
select c3 from tab2 order by 1;
+--------------+
| c3           |
+--------------+
| arg1 > arg12 |
+--------------+

select MY_FUN7_1('one', 'One');
+-------------------------+
| MY_FUN7_1('one', 'One') |
+-------------------------+
|                       3 |
+-------------------------+
select c3 from tab2 order by 1;
+--------------+
| c3           |
+--------------+
| arg1 = arg12 |
| arg1 > arg12 |
+--------------+

drop FUNCTION MY_FUN7_1;

## 存储过程中
drop PROCEDURE pro7_2;
ERROR 42000: PROCEDURE whh_test0_db.pro7_2 does not exist

CREATE PROCEDURE pro7_2(arg1 ENUM('','NULL', 'one', 'TWO','Three','FouR'),arg2 ENUM('','NULL', '-1', '2', '3.14', '4.0', 'One', 'Two'))
begin
  IF arg1 != arg2 THEN
    IF arg1 > arg2 THEN
      select 'arg1 > arg2 ';
    else
      select 'arg1 < arg2';
    END IF;
  else
    select 'arg1 = arg2';
  END IF;
end;
/

call pro7_2('one', '-1');
+--------------+
| arg1 > arg2  |
+--------------+
| arg1 > arg2  |
+--------------+
call pro7_2('one', 'One');
+-------------+
| arg1 = arg2 |
+-------------+
| arg1 = arg2 |
+-------------+
drop PROCEDURE pro7_2;

## 触发器中
drop trigger my_tri7_3;

create trigger my_tri7_3 before insert on tab1 for each row
begin
  DECLARE str1 ENUM('','NULL', 'one', 'TWO','Three','FouR') DEFAULT 'one';
  DECLARE str2 ENUM('','NULL', '-1', '2', '3.14', '4.0', 'One', 'Two') DEFAULT 'Two';
  IF new.c1 != new.c2 THEN
    if new.c2 > new.c1 THEN
      set new.c2 = 6;
      INSERT INTO tab2(c1,c2,c3) VALUES (new.c1,new.c2,concat('new.c1 > new.c2 ',new.c3));
    else
      set new.c1 = str1;
      set new.c2 = str2;
      INSERT INTO tab2(c1,c2,c3) VALUES (new.c1,new.c2,concat('new.c1 < new.c2 ',new.c3));
    END IF;
  else
    set new.c1 = str1;
    set new.c2 = str2;
    INSERT INTO tab2(c1,c2,c3) VALUES (new.c1,new.c2,concat('new.c1 = new.c2 ',new.c3));
  END IF;
end;
/

delete from tab1 where id > 2;
delete from tab2;

INSERT INTO tab1(c1,c2,c3) VALUES ('one', '-1',1);
select * from tab1 order by 1;
+----+-------+------+------+
| id | c1    | c2   | c3   |
+----+-------+------+------+
|  2 | Three | 3.14 | 222  |
|  4 | one   | Two  | 1    |
+----+-------+------+------+
select * from tab2 order by 1;
+----+------+------+-------------------+
| id | c1   | c2   | c3                |
+----+------+------+-------------------+
| 10 | one  | Two  | new.c1 < new.c2 1 |
+----+------+------+-------------------+

INSERT INTO tab1(c1,c2,c3) VALUES ('one', 'One',2);
select * from tab1 order by 1;
+----+-------+------+------+
| id | c1    | c2   | c3   |
+----+-------+------+------+
|  2 | Three | 3.14 | 222  |
|  4 | one   | Two  | 1    |
|  5 | one   | Two  | 2    |
+----+-------+------+------+
select * from tab2 order by 1;
+----+------+------+-------------------+
| id | c1   | c2   | c3                |
+----+------+------+-------------------+
| 10 | one  | Two  | new.c1 < new.c2 1 |
| 11 | one  | Two  | new.c1 = new.c2 2 |
+----+------+------+-------------------+

INSERT INTO tab1(c1,c2,c3) VALUES ('FouR', 'Two',3);
select * from tab1 order by 1;
+----+-------+------+------+
| id | c1    | c2   | c3   |
+----+-------+------+------+
|  2 | Three | 3.14 | 222  |
|  4 | one   | Two  | 1    |
|  5 | one   | Two  | 2    |
|  6 | FouR  | 4.0  | 3    |
+----+-------+------+------+
select * from tab2 order by 1;
+----+------+------+-------------------+
| id | c1   | c2   | c3                |
+----+------+------+-------------------+
| 10 | one  | Two  | new.c1 < new.c2 1 |
| 11 | one  | Two  | new.c1 = new.c2 2 |
| 12 | FouR | 4.0  | new.c1 > new.c2 3 |
+----+------+------+-------------------+

INSERT INTO tab1(c1,c2,c3) VALUES ('FouR', '-1',4);
select * from tab1 order by 1;
+----+-------+------+------+
| id | c1    | c2   | c3   |
+----+-------+------+------+
|  2 | Three | 3.14 | 222  |
|  4 | one   | Two  | 1    |
|  5 | one   | Two  | 2    |
|  6 | FouR  | 4.0  | 3    |
|  7 | one   | Two  | 4    |
+----+-------+------+------+
select * from tab2 order by 1;
+----+------+------+-------------------+
| id | c1   | c2   | c3                |
+----+------+------+-------------------+
| 10 | one  | Two  | new.c1 < new.c2 1 |
| 11 | one  | Two  | new.c1 = new.c2 2 |
| 12 | FouR | 4.0  | new.c1 > new.c2 3 |
| 13 | one  | Two  | new.c1 < new.c2 4 |
+----+------+------+-------------------+

drop trigger my_tri7_3;

#### 枚举变量进行比较 CASE
## 函数中
drop FUNCTION MY_FUN7_4;

CREATE FUNCTION MY_FUN7_4(arg1 ENUM('','NULL', 'one', 'TWO','Three','FouR'),arg2 ENUM('','NULL', '-1', '2', '3.14', '4.0', 'One', 'Two')) RETURNS varchar(2000) DETERMINISTIC
BEGIN
  declare res varchar(2000);
  CASE arg1
    WHEN ''     THEN SET res = '【WHEN 空分支 1】';
    WHEN 'NULL' THEN SET res ='【WHEN NULL分支 2】';
    WHEN arg2     THEN SET res= '【WHEN arg2分支 3】';
    ELSE SET res = '【ELSE分支 4】';
  END CASE; 
  RETURN res;
END 
/

select MY_FUN7_4('', '-1');
+------------------------+
| MY_FUN7_4('', '-1')    |
+------------------------+
| 【WHEN 空分支 1】      |
+------------------------+
select MY_FUN7_4('NULL', 'One');
+--------------------------+
| MY_FUN7_4('NULL', 'One') |
+--------------------------+
| 【WHEN NULL分支 2】      |
+--------------------------+
select MY_FUN7_4('NULL', 'NULL');
+---------------------------+
| MY_FUN7_4('NULL', 'NULL') |
+---------------------------+
| 【WHEN NULL分支 2】       |
+---------------------------+

drop FUNCTION MY_FUN7_4;

## 存储过程中
drop PROCEDURE pro7_5;

CREATE PROCEDURE pro7_5(arg1 ENUM('','NULL', 'one', 'TWO','Three','FouR'),arg2 ENUM('','NULL', '-1', '2', '3.14', '4.0', 'One', 'Two'))
begin
  CASE arg1
    WHEN ''     THEN select '【WHEN 空分支 1】';
    WHEN 'NULL' THEN select '【WHEN NULL分支 2】';
    WHEN arg2   THEN select  '【WHEN arg2分支 3】';
    ELSE select '【ELSE分支 4】';
  END CASE; 
end;
/

call pro7_5('', '-1');
+------------------------+
| 【WHEN 空分支 1】      |
+------------------------+
| 【WHEN 空分支 1】      |
+------------------------+

call pro7_5('NULL', '-1');
+-------------------------+
| 【WHEN NULL分支 2】     |
+-------------------------+
| 【WHEN NULL分支 2】     |
+-------------------------+

call pro7_5('one', 'One');
+-------------------------+
| 【WHEN arg2分支 3】     |
+-------------------------+
| 【WHEN arg2分支 3】     |
+-------------------------+

drop PROCEDURE pro7_5;

## 触发器中
drop trigger my_tri7_6;

create trigger my_tri7_6 before update on tab1 for each row
begin
  CASE new.c1
    WHEN old.c1 THEN SET new.c1 = 'one';SET new.c2 = 'One';SET new.c3 = concat('【WHEN old.c1分支 1】',old.c3);
    WHEN ''     THEN SET new.c1 = 'TWO';SET new.c2 = 'Two';SET new.c3 = concat('【WHEN 空分支 2】',old.c3);
    WHEN 'NULL' THEN SET new.c1 = 'Three';SET new.c2 = '3.14';SET new.c3 = concat('【WHEN NULL分支 3】',old.c3);
    ELSE SET new.c1 = 'FouR';SET new.c2 = '4.0';SET new.c3 = concat('【ELSE分支 4】',old.c3);
  END CASE; 
  INSERT INTO tab2(c1,c2,c3) VALUES (old.c1,old.c2,concat('old.xxx ',old.c3));
  INSERT INTO tab2(c1,c2,c3) VALUES (new.c1,new.c2,concat('new.xxx ',new.c3));
end;
/

delete from tab1;
delete from tab2;
INSERT INTO tab1 VALUES (2,'TWO', '2','2');
select * from tab1 order by 1;
+----+------+------+------+
| id | c1   | c2   | c3   |
+----+------+------+------+
|  2 | TWO  | 2    | 2    |
+----+------+------+------+
select * from tab2 order by 1;
+----+------+------+------+
| id | c1   | c2   | c3   |
+----+------+------+------+
+----+------+------+------+

update tab1 set c1='TWO',c2='2',c3=2 where id = 2;
select * from tab1 order by 1;
+----+------+------+----------------------------+
| id | c1   | c2   | c3                         |
+----+------+------+----------------------------+
|  2 | one  | One  | 【WHEN old.c1分支 1】2     |
+----+------+------+----------------------------+
select * from tab2 order by 1;
+----+------+------+------------------------------------+
| id | c1   | c2   | c3                                 |
+----+------+------+------------------------------------+
| 14 | TWO  | 2    | old.xxx 2                          |
| 15 | one  | One  | new.xxx 【WHEN old.c1分支 1】2     |
+----+------+------+------------------------------------+

update tab1 set c1='',c2='',c3=30 where id = 2;
select * from tab1 order by 1;
+----+------+------+--------------------------------------------------+
| id | c1   | c2   | c3                                               |
+----+------+------+--------------------------------------------------+
|  2 | TWO  | Two  | 【WHEN 空分支 2】【WHEN old.c1分支 1】2          |
+----+------+------+--------------------------------------------------+
select * from tab2 order by 1;
+----+------+------+----------------------------------------------------------+
| id | c1   | c2   | c3                                                       |
+----+------+------+----------------------------------------------------------+
| 14 | TWO  | 2    | old.xxx 2                                                |
| 15 | one  | One  | new.xxx 【WHEN old.c1分支 1】2                           |
| 16 | one  | One  | old.xxx 【WHEN old.c1分支 1】2                           |
| 17 | TWO  | Two  | new.xxx 【WHEN 空分支 2】【WHEN old.c1分支 1】2          |
+----+------+------+----------------------------------------------------------+

update tab1 set c1='NULL',c2='NULL',c3=30 where id = 2;
select * from tab1 order by 1;
+----+-------+------+-------------------------------------------------------------------------+
| id | c1    | c2   | c3                                                                      |
+----+-------+------+-------------------------------------------------------------------------+
|  2 | Three | 3.14 | 【WHEN NULL分支 3】【WHEN 空分支 2】【WHEN old.c1分支 1】2              |
+----+-------+------+-------------------------------------------------------------------------+
select * from tab2 order by 1;
+----+-------+------+---------------------------------------------------------------------------------+
| id | c1    | c2   | c3                                                                              |
+----+-------+------+---------------------------------------------------------------------------------+
| 14 | TWO   | 2    | old.xxx 2                                                                       |
| 15 | one   | One  | new.xxx 【WHEN old.c1分支 1】2                                                  |
| 16 | one   | One  | old.xxx 【WHEN old.c1分支 1】2                                                  |
| 17 | TWO   | Two  | new.xxx 【WHEN 空分支 2】【WHEN old.c1分支 1】2                                 |
| 18 | TWO   | Two  | old.xxx 【WHEN 空分支 2】【WHEN old.c1分支 1】2                                 |
| 19 | Three | 3.14 | new.xxx 【WHEN NULL分支 3】【WHEN 空分支 2】【WHEN old.c1分支 1】2              |
+----+-------+------+---------------------------------------------------------------------------------+

update tab1 set c1='one',c2='NULL',c3=30 where id = 2;
select * from tab1 order by 1;
+----+------+------+-------------------------------------------------------------------------------------------+
| id | c1   | c2   | c3                                                                                        |
+----+------+------+-------------------------------------------------------------------------------------------+
|  2 | FouR | 4.0  | 【ELSE分支 4】【WHEN NULL分支 3】【WHEN 空分支 2】【WHEN old.c1分支 1】2                  |
+----+------+------+-------------------------------------------------------------------------------------------+
select * from tab2 order by 1;
+----+-------+------+---------------------------------------------------------------------------------------------------+
| id | c1    | c2   | c3                                                                                                |
+----+-------+------+---------------------------------------------------------------------------------------------------+
| 14 | TWO   | 2    | old.xxx 2                                                                                         |
| 15 | one   | One  | new.xxx 【WHEN old.c1分支 1】2                                                                    |
| 16 | one   | One  | old.xxx 【WHEN old.c1分支 1】2                                                                    |
| 17 | TWO   | Two  | new.xxx 【WHEN 空分支 2】【WHEN old.c1分支 1】2                                                   |
| 18 | TWO   | Two  | old.xxx 【WHEN 空分支 2】【WHEN old.c1分支 1】2                                                   |
| 19 | Three | 3.14 | new.xxx 【WHEN NULL分支 3】【WHEN 空分支 2】【WHEN old.c1分支 1】2                                |
| 20 | Three | 3.14 | old.xxx 【WHEN NULL分支 3】【WHEN 空分支 2】【WHEN old.c1分支 1】2                                |
| 21 | FouR  | 4.0  | new.xxx 【ELSE分支 4】【WHEN NULL分支 3】【WHEN 空分支 2】【WHEN old.c1分支 1】2                  |
+----+-------+------+---------------------------------------------------------------------------------------------------+

drop trigger my_tri7_6;

############ ◆◆ 子查询返回类型是enum类型枚举值赋值给变量
drop PROCEDURE pro8_1;

delete from tab1;
INSERT INTO tab1 VALUES (3,'TWO', '2','2');
select * from tab1 order by 1;
+----+------+------+------+
| id | c1   | c2   | c3   |
+----+------+------+------+
|  3 | TWO  | 2    | 2    |
+----+------+------+------+

CREATE PROCEDURE pro8_1(arg1 ENUM('','NULL', 'one', 'TWO','Three','FouR'))
begin
  declare var1 ENUM('','NULL', 'one', 'TWO','Three','FouR');
  set var1 = (select arg1);
  select var1;
  set var1 = (select c1 from tab1 where id = 3);
  select var1;
end;
/

call pro8_1('');
+------+
| var1 |
+------+
+------+
| var1 |
+------+
|      |
| TWO  |
+------+
+------+
call pro8_1('NULL');
+------+
| var1 |
+------+
+------+
| var1 |
+------+
| NULL |
| TWO  |
+------+
+------+
call pro8_1('one');
+------+
| var1 |
+------+
+------+
| var1 |
+------+
| one  |
| TWO  |
+------+
+------+

drop PROCEDURE pro8_1;

############ ◆◆ PL中枚举变量赋值给用户自定义变量
drop PROCEDURE pro9_1;

CREATE PROCEDURE pro9_1(arg1 ENUM('one', 'TWO','Three','FouR'))
begin
  declare var1 ENUM('one', 'TWO','Three','FouR') default 'TWO';
  set @var1 = var1;
  set @var2 = arg1;
  set @var3 = (select var1 from dual);
  select arg1 into @var4 from dual;
  select @var1,@var2,@var3,@var4;
end;
/

call pro9_1('one');
+-------+-------+-------+-------+
| @var1 | @var2 | @var3 | @var4 |
+-------+-------+-------+-------+
| TWO   | one   | TWO   | one   |
+-------+-------+-------+-------+
select @var1,@var2,@var3,@var4;
+-------+-------+-------+-------+
| @var1 | @var2 | @var3 | @var4 |
+-------+-------+-------+-------+
| TWO   | one   | TWO   | one   |
+-------+-------+-------+-------+

drop PROCEDURE pro9_1;

############ ◆◆ 游标中使用枚举值
drop PROCEDURE pro10_1;

CREATE PROCEDURE pro10_1()
BEGIN
    DECLARE done BOOLEAN DEFAULT FALSE;
    DECLARE var1 ENUM('','NULL', 'one', 'TWO','Three','FouR') DEFAULT 'one';
    DECLARE var2 ENUM('','NULL', '-1', '2', '3.14', '4.0', 'One', 'Two') DEFAULT 'Two';
    DECLARE cursor_name CURSOR FOR SELECT c1, c2 FROM tab0 order by id;
    DECLARE CONTINUE HANDLER FOR NOT FOUND SET done = TRUE;
    OPEN cursor_name;
    read_loop: LOOP
        FETCH cursor_name INTO var1, var2;
        IF done THEN
            LEAVE read_loop;
        END IF;
        SELECT var1, var2;
    END LOOP;
    CLOSE cursor_name;
END;
/

call pro10_1();
+------+------+
| var1 | var2 |
+------+------+
+------+------+
| var1 | var2 |
+------+------+
+------+------+
| var1 | var2 |
+------+------+
+------+------+
| var1 | var2 |
+------+------+
+-------+------+
| var1  | var2 |
+-------+------+
+------+------+
| var1 | var2 |
+------+------+
|      |      |
| NULL | NULL |
| one  | -1   |
| TWO  | 2    |
| Three | 3.14 |
| FouR | 4.0  |
+------+------+
+------+------+
+------+------+
+------+------+
+-------+------+
+------+------+

drop PROCEDURE pro10_1;

############ ◆◆ 动态sql中使用枚举值
SET @sql = 'SELECT c1, c2 FROM tab0 order by id';
PREPARE stmt FROM @sql;
EXECUTE stmt;
+-------+------+
| c1    | c2   |
+-------+------+
|       |      |
| NULL  | NULL |
| one   | -1   |
| TWO   | 2    |
| Three | 3.14 |
| FouR  | 4.0  |
+-------+------+
DEALLOCATE PREPARE stmt;

SET @sql = 'SELECT c1, c2 FROM tab0 where c1 = ? order by id';
SET @c1 ='Three';
SET @c2 = 3;
PREPARE stmt FROM @sql;
EXECUTE stmt using @c1;
+-------+------+
| c1    | c2   |
+-------+------+
| Three | 3.14 |
+-------+------+
EXECUTE stmt using @c2;
+------+------+
| c1   | c2   |
+------+------+
| one  | -1   |
+------+------+
DEALLOCATE PREPARE stmt;

############ ◆◆ 循环结构中使用枚举值
drop PROCEDURE pro11_1;
drop PROCEDURE pro11_2;

CREATE PROCEDURE pro11_1(inout arg ENUM('','NULL', 'one', 'TWO','Three','FouR'))
BEGIN
  WHILE arg > 1 DO
    select arg;
    SET arg = arg - 1;
  END WHILE;
END;
/
CREATE PROCEDURE pro11_2(inout arg ENUM('','NULL', 'one', 'TWO','Three','FouR'))
  BEGIN
    loop_label1: LOOP
      select arg;
      SET arg = arg - 1;
      IF arg = 2 THEN
        select 'ITERATE';
        ITERATE loop_label1;
      END IF;
      IF arg = 1 THEN
        select 'LEAVE';
        LEAVE loop_label1;
      END IF; 
    END LOOP loop_label1;
END;
/

SET @var1 ='FouR';
call pro11_1(@var1);
+------+
| arg  |
+------+
+-------+
| arg   |
+-------+
+------+
| arg  |
+------+
+------+
| arg  |
+------+
+------+
| arg  |
+------+
| FouR |
| Three |
| TWO  |
| one  |
| NULL |
+------+
+-------+
+------+
+------+
+------+

SET @var2 ='FouR';
call pro11_2(@var2);
+------+
| arg  |
+------+
+-------+
| arg   |
+-------+
+------+
| arg  |
+------+
+------+
| arg  |
+------+
+---------+
| ITERATE |
+---------+
+------+
| arg  |
+------+
+-------+
| LEAVE |
+-------+
| FouR |
| Three |
| TWO  |
| one  |
| ITERATE |
| NULL |
| LEAVE |
+------+
+-------+
+------+
+------+
+---------+
+------+
+-------+

drop PROCEDURE pro11_1;
drop PROCEDURE pro11_2;

############ ◆◆ 枚举值与内置函数正交
drop PROCEDURE pro12_1;

CREATE PROCEDURE pro12_1(arg ENUM('','NULL', 'one', 'TWO','Three','FouR'))
BEGIN
  declare var1 ENUM('','NULL', 'one', 'TWO','Three','FouR') default 'one';
  declare var2 ENUM('','null', 'one', 'two','three','four','1','2','3','4') default 'TWO';
  select ASCII(arg),CHAR_LENGTH(arg),LENGTH(arg),SOUNDEX(arg),HEX(WEIGHT_STRING(arg AS CHAR(4)));
  select upper(arg),CONCAT(var1, arg),INSERT(arg,0,3,var1),LPAD(arg,10,var1),LEFT(arg,2),MID(arg,1,2);
  select FIELD(arg, var1,var2),FIND_IN_SET(arg,var2),HEX(arg),INSTR(arg,var2),OCT(arg),UNHEX(arg);
  select POSITION(arg IN var2),QUOTE(arg),REPLACE(arg, arg, var1),REVERSE(arg),SUBSTR(arg, 0,3),SUBSTRING_INDEX(arg, var2, 1);
  select arg rlike var1,arg rlike var2,STRCMP(var1,arg),STRCMP(var2,arg);
END;
/
call pro12_1('TWO');
+------------+------------------+-------------+--------------+------------------------------------+
| ASCII(arg) | CHAR_LENGTH(arg) | LENGTH(arg) | SOUNDEX(arg) | HEX(WEIGHT_STRING(arg AS CHAR(4))) |
+------------+------------------+-------------+--------------+------------------------------------+
+------------+-------------------+----------------------+-------------------+-------------+--------------+
| upper(arg) | CONCAT(var1, arg) | INSERT(arg,0,3,var1) | LPAD(arg,10,var1) | LEFT(arg,2) | MID(arg,1,2) |
+------------+-------------------+----------------------+-------------------+-------------+--------------+
|         84 |                3 |           3 | T000         | 00540057004F0020                   |
| TWO        | oneTWO            | TWO                  | oneoneoTWO        | TW          | TW           |
+------------+------------------+-------------+--------------+------------------------------------+
+------------+-------------------+----------------------+-------------------+-------------+--------------+
ERROR 22000: Invalid data type for the operation

drop PROCEDURE pro12_1;

drop PROCEDURE pro12_2;

CREATE PROCEDURE pro12_2(arg ENUM('','NULL', 'one', 'TWO','Three','FouR'))
BEGIN
  declare var1 ENUM('','NULL', 'one', 'TWO','Three','FouR') default 'one';
  declare var2 ENUM('','null', 'one', 'two','three','four','1','2','3','4') default 'TWO';
  select EXPORT_SET(arg, '1','0',',', 10);
  select FORMAT(arg, 2);
  select MAKE_SET(arg,var1,var2,'aa','bb');
  select REPEAT(arg, var1);
  select INTERVAL(arg,var1,var2);
END;
/

call pro12_2('NULL');
+----------------------------------+
| EXPORT_SET(arg, '1','0',',', 10) |
+----------------------------------+
+----------------+
| FORMAT(arg, 2) |
+----------------+
+-----------------------------------+
| MAKE_SET(arg,var1,var2,'aa','bb') |
+-----------------------------------+
+-------------------+
| REPEAT(arg, var1) |
+-------------------+
+-------------------------+
| INTERVAL(arg,var1,var2) |
+-------------------------+
| 0,1,0,0,0,0,0,0,0,0              |
| 2.00           |
| two                               |
| NULLNULLNULL      |
|                       0 |
+----------------------------------+
+----------------+
+-----------------------------------+
+-------------------+
+-------------------------+

drop PROCEDURE pro12_2;

drop PROCEDURE pro12_3;

CREATE PROCEDURE pro12_3(arg ENUM('','Null', 'One', 'Two','Three','Four'))
BEGIN
  declare var1 ENUM('','NULL', 'ONE', 'TWO','THREE','FOUR') default 'one';
  declare var2 ENUM('','null', 'one', 'two','three','four','1','2','3','4') default 'TWO';
  select GREATEST(arg,var1,var2),LEAST(arg,var1,var2),ISNULL(arg);
END;
/

call pro12_3('');
+-------------------------+----------------------+-------------+
| GREATEST(arg,var1,var2) | LEAST(arg,var1,var2) | ISNULL(arg) |
+-------------------------+----------------------+-------------+
| two                     |                      |           0 |
+-------------------------+----------------------+-------------+
call pro12_3('Null');
+-------------------------+----------------------+-------------+
| GREATEST(arg,var1,var2) | LEAST(arg,var1,var2) | ISNULL(arg) |
+-------------------------+----------------------+-------------+
| two                     | Null                 |           0 |
+-------------------------+----------------------+-------------+
call pro12_3(Null);
+-------------------------+----------------------+-------------+
| GREATEST(arg,var1,var2) | LEAST(arg,var1,var2) | ISNULL(arg) |
+-------------------------+----------------------+-------------+
| NULL                    | NULL                 |           1 |
+-------------------------+----------------------+-------------+
call pro12_3('Three');
+-------------------------+----------------------+-------------+
| GREATEST(arg,var1,var2) | LEAST(arg,var1,var2) | ISNULL(arg) |
+-------------------------+----------------------+-------------+
| two                     | ONE                  |           0 |
+-------------------------+----------------------+-------------+

drop PROCEDURE pro12_3;

drop PROCEDURE pro12_4;

CREATE PROCEDURE pro12_4(arg ENUM('','Null', 'One', 'Two','Three','Four'))
BEGIN
  declare var1 ENUM('','NULL', 'ONE', 'TWO','THREE','FOUR') default 'one';
  declare var2 ENUM('','null', 'one', 'two','three','four','1','2','3','4') default 'TWO';
  SELECT CASE arg WHEN var1 THEN 1 WHEN var2 THEN 2 WHEN 'Null' THEN 3 ELSE 'ELSE' END;
  SELECT IF(arg>var1, 'T','F'),IF(arg>var2, 'T','F');
END;
/

call pro12_4('');
+-------------------------------------------------------------------------------+
| CASE arg WHEN var1 THEN 1 WHEN var2 THEN 2 WHEN 'Null' THEN 3 ELSE 'ELSE' END |
+-------------------------------------------------------------------------------+
+-----------------------+-----------------------+
| IF(arg>var1, 'T','F') | IF(arg>var2, 'T','F') |
+-----------------------+-----------------------+
| ELSE                                                                          |
| F                     | F                     |
+-------------------------------------------------------------------------------+
+-----------------------+-----------------------+
call pro12_4('Null');
+-------------------------------------------------------------------------------+
| CASE arg WHEN var1 THEN 1 WHEN var2 THEN 2 WHEN 'Null' THEN 3 ELSE 'ELSE' END |
+-------------------------------------------------------------------------------+
+-----------------------+-----------------------+
| IF(arg>var1, 'T','F') | IF(arg>var2, 'T','F') |
+-----------------------+-----------------------+
| 3                                                                             |
| F                     | F                     |
+-------------------------------------------------------------------------------+
+-----------------------+-----------------------+
call pro12_4(Null);
+-------------------------------------------------------------------------------+
| CASE arg WHEN var1 THEN 1 WHEN var2 THEN 2 WHEN 'Null' THEN 3 ELSE 'ELSE' END |
+-------------------------------------------------------------------------------+
+-----------------------+-----------------------+
| IF(arg>var1, 'T','F') | IF(arg>var2, 'T','F') |
+-----------------------+-----------------------+
| ELSE                                                                          |
| F                     | F                     |
+-------------------------------------------------------------------------------+
+-----------------------+-----------------------+
call pro12_4('One');
+-------------------------------------------------------------------------------+
| CASE arg WHEN var1 THEN 1 WHEN var2 THEN 2 WHEN 'Null' THEN 3 ELSE 'ELSE' END |
+-------------------------------------------------------------------------------+
+-----------------------+-----------------------+
| IF(arg>var1, 'T','F') | IF(arg>var2, 'T','F') |
+-----------------------+-----------------------+
| 1                                                                             |
| F                     | F                     |
+-------------------------------------------------------------------------------+
+-----------------------+-----------------------+
call pro12_4('Two');
+-------------------------------------------------------------------------------+
| CASE arg WHEN var1 THEN 1 WHEN var2 THEN 2 WHEN 'Null' THEN 3 ELSE 'ELSE' END |
+-------------------------------------------------------------------------------+
+-----------------------+-----------------------+
| IF(arg>var1, 'T','F') | IF(arg>var2, 'T','F') |
+-----------------------+-----------------------+
| 2                                                                             |
| T                     | F                     |
+-------------------------------------------------------------------------------+
+-----------------------+-----------------------+
call pro12_4('Three');
+-------------------------------------------------------------------------------+
| CASE arg WHEN var1 THEN 1 WHEN var2 THEN 2 WHEN 'Null' THEN 3 ELSE 'ELSE' END |
+-------------------------------------------------------------------------------+
+-----------------------+-----------------------+
| IF(arg>var1, 'T','F') | IF(arg>var2, 'T','F') |
+-----------------------+-----------------------+
| ELSE                                                                          |
| T                     | F                     |
+-------------------------------------------------------------------------------+
+-----------------------+-----------------------+

drop PROCEDURE pro12_4;

drop PROCEDURE pro12_5;

CREATE PROCEDURE pro12_5(arg ENUM('','Null', 'One', 'Two','Three','Four'))
BEGIN
  declare var1 ENUM('','NULL', 'ONE', 'TWO','THREE','FOUR') default 'one';
  declare var2 ENUM('','null', 'one', 'two','three','four','1','2','3','4') default null;
  SELECT IFNULL(arg, var1),IFNULL(arg, var2);
  SELECT NULLIF(arg, var1),NULLIF(arg, var2);
  SELECT ORA_DECODE(arg, var1,1, var2,2,3);
END;
/

call pro12_5('');
+-------------------+-------------------+
| IFNULL(arg, var1) | IFNULL(arg, var2) |
+-------------------+-------------------+
+-------------------+-------------------+
| NULLIF(arg, var1) | NULLIF(arg, var2) |
+-------------------+-------------------+
+-----------------------------------+
| ORA_DECODE(arg, var1,1, var2,2,3) |
+-----------------------------------+
|                   |                   |
|                   |                   |
|                                 3 |
+-------------------+-------------------+
+-------------------+-------------------+
+-----------------------------------+
call pro12_5('Null');
+-------------------+-------------------+
| IFNULL(arg, var1) | IFNULL(arg, var2) |
+-------------------+-------------------+
+-------------------+-------------------+
| NULLIF(arg, var1) | NULLIF(arg, var2) |
+-------------------+-------------------+
+-----------------------------------+
| ORA_DECODE(arg, var1,1, var2,2,3) |
+-----------------------------------+
| Null              | Null              |
| Null              | Null              |
|                                 3 |
+-------------------+-------------------+
+-------------------+-------------------+
+-----------------------------------+
call pro12_5(Null);
+-------------------+-------------------+
| IFNULL(arg, var1) | IFNULL(arg, var2) |
+-------------------+-------------------+
+-------------------+-------------------+
| NULLIF(arg, var1) | NULLIF(arg, var2) |
+-------------------+-------------------+
+-----------------------------------+
| ORA_DECODE(arg, var1,1, var2,2,3) |
+-----------------------------------+
| ONE               | NULL              |
| NULL              | NULL              |
|                                 2 |
+-------------------+-------------------+
+-------------------+-------------------+
+-----------------------------------+
call pro12_5('One');
+-------------------+-------------------+
| IFNULL(arg, var1) | IFNULL(arg, var2) |
+-------------------+-------------------+
+-------------------+-------------------+
| NULLIF(arg, var1) | NULLIF(arg, var2) |
+-------------------+-------------------+
+-----------------------------------+
| ORA_DECODE(arg, var1,1, var2,2,3) |
+-----------------------------------+
| One               | One               |
| NULL              | One               |
|                                 1 |
+-------------------+-------------------+
+-------------------+-------------------+
+-----------------------------------+
call pro12_5('Two');
+-------------------+-------------------+
| IFNULL(arg, var1) | IFNULL(arg, var2) |
+-------------------+-------------------+
+-------------------+-------------------+
| NULLIF(arg, var1) | NULLIF(arg, var2) |
+-------------------+-------------------+
+-----------------------------------+
| ORA_DECODE(arg, var1,1, var2,2,3) |
+-----------------------------------+
| Two               | Two               |
| Two               | Two               |
|                                 3 |
+-------------------+-------------------+
+-------------------+-------------------+
+-----------------------------------+
call pro12_5('Three');
+-------------------+-------------------+
| IFNULL(arg, var1) | IFNULL(arg, var2) |
+-------------------+-------------------+
+-------------------+-------------------+
| NULLIF(arg, var1) | NULLIF(arg, var2) |
+-------------------+-------------------+
+-----------------------------------+
| ORA_DECODE(arg, var1,1, var2,2,3) |
+-----------------------------------+
| Three             | Three             |
| Three             | Three             |
|                                 3 |
+-------------------+-------------------+
+-------------------+-------------------+
+-----------------------------------+

drop PROCEDURE pro12_5;

drop PROCEDURE pro12_6;

CREATE PROCEDURE pro12_6(arg ENUM('','NULL', 'ONE', 'TWO','THREE','FOUR'))
BEGIN
  declare var1 ENUM('','null', 'one', 'two','1.235','2024-11-26 11:30:00.123456') default '2024-11-26 11:30:00.123456';
  select CAST(var1 AS DATE),CAST(var1 AS DATETIME(3));
  set var1 = '1.235';
  select CAST(var1 AS DECIMAL(3,2)),CAST(var1 AS UNSIGNED),CAST(var1 AS SIGNED);
  SELECT CAST(arg AS CHAR(10));
END 
/

call pro12_6('TWO');
+--------------------+---------------------------+
| CAST(var1 AS DATE) | CAST(var1 AS DATETIME(3)) |
+--------------------+---------------------------+
+----------------------------+------------------------+----------------------+
| CAST(var1 AS DECIMAL(3,2)) | CAST(var1 AS UNSIGNED) | CAST(var1 AS SIGNED) |
+----------------------------+------------------------+----------------------+
+-----------------------+
| CAST(arg AS CHAR(10)) |
+-----------------------+
| 2024-11-26         | 2024-11-26 11:30:00.123   |
|                       5.00 |                      5 |                    5 |
| TWO                   |
+--------------------+---------------------------+
+----------------------------+------------------------+----------------------+
+-----------------------+

drop PROCEDURE pro12_6;

############ ◆◆ 枚举值运算
drop PROCEDURE pro13_1;

CREATE PROCEDURE pro13_1(arg ENUM('','NULL','THREE3','FOUR4','50','60','70'))
BEGIN
  declare var1 ENUM('','null', 'one3', 'two4','50','60','70') default '60';
  SELECT arg,var1,arg+var1;
END 
/

call pro13_1(NULL);
+------+------+----------+
| arg  | var1 | arg+var1 |
+------+------+----------+
| NULL | 60   |     NULL |
+------+------+----------+
call pro13_1('');
+------+------+----------+
| arg  | var1 | arg+var1 |
+------+------+----------+
|      | 60   |        7 |
+------+------+----------+
call pro13_1('NULL');
+------+------+----------+
| arg  | var1 | arg+var1 |
+------+------+----------+
| NULL | 60   |        8 |
+------+------+----------+
call pro13_1('THREE3');
+--------+------+----------+
| arg    | var1 | arg+var1 |
+--------+------+----------+
| THREE3 | 60   |        9 |
+--------+------+----------+
call pro13_1('50');
+------+------+----------+
| arg  | var1 | arg+var1 |
+------+------+----------+
| 50   | 60   |       11 |
+------+------+----------+

drop PROCEDURE pro13_1;

############ 
drop PROCEDURE pro13_2;

set @a ='THREE3';

CREATE PROCEDURE pro13_2(inout arg ENUM('','NULL','THREE3','FOUR4','50','60','70'))
BEGIN
  declare var1 ENUM('','null','three3','four4','50','60','70') default arg;
  declare var2 ENUM('','Null','Three3','Four4','50','60','70') default var1;
  declare var3 ENUM('','Null','Three3','Four4','50','60','70') default @a;
  SELECT @a,arg,var1,var2,var3;
  set arg ='FOUR4';
  SELECT @a,arg,var1,var2,var3;
END 
/

set @a ='THREE3';
call pro13_2(@a);
+--------+--------+--------+--------+--------+
| @a     | arg    | var1   | var2   | var3   |
+--------+--------+--------+--------+--------+
+--------+-------+--------+--------+--------+
| @a     | arg   | var1   | var2   | var3   |
+--------+-------+--------+--------+--------+
| THREE3 | THREE3 | three3 | Three3 | Three3 |
| THREE3 | FOUR4 | three3 | Three3 | Three3 |
+--------+--------+--------+--------+--------+
+--------+-------+--------+--------+--------+

drop PROCEDURE pro13_2;

############ case
drop PROCEDURE pro13_3;

CREATE PROCEDURE pro13_3(in arg ENUM('','NULL','256个字符','5678901234567890123456789012345678901234567890123456789012345678901234567890123456789012345678901234567890123456789012345678901234567890123456789012345678901234567890123456789012345678901234567890123456789012345678901234567890123456789012345678901234567890'))
BEGIN
  SELECT arg;
END 
/
ERROR HY000: Too long enumeration/set value for column arg.
CREATE PROCEDURE pro13_3(in arg ENUM('','NULL','最大255个字符','678901234567890123456789012345678901234567890123456789012345678901234567890123456789012345678901234567890123456789012345678901234567890123456789012345678901234567890123456789012345678901234567890123456789012345678901234567890123456789012345678901234567890'))
BEGIN
  SELECT arg;
END 
/

call pro13_3('最大255个字符');
+--------------------+
| arg                |
+--------------------+
| 最大255个字符      |
+--------------------+
call pro13_3('678901234567890123456789012345678901234567890123456789012345678901234567890123456789012345678901234567890123456789012345678901234567890123456789012345678901234567890123456789012345678901234567890123456789012345678901234567890123456789012345678901234567890');
+-----------------------------------------------------------------------------------------------------------------------------------------------------------------------------------------------------------------------------------------------------------------+
| arg                                                                                                                                                                                                                                                             |
+-----------------------------------------------------------------------------------------------------------------------------------------------------------------------------------------------------------------------------------------------------------------+
| 678901234567890123456789012345678901234567890123456789012345678901234567890123456789012345678901234567890123456789012345678901234567890123456789012345678901234567890123456789012345678901234567890123456789012345678901234567890123456789012345678901234567890 |
+-----------------------------------------------------------------------------------------------------------------------------------------------------------------------------------------------------------------------------------------------------------------+
call pro13_3('6789012345678901234567890123456789012345
678901234567890123456789012345678901234567890123456789
012345678901234567890123456789012345678901234567890123
456789012345678901234567890123456789012345678901234567
89012345678901234567890123456789012345678901234567890');
ERROR 01000: Data truncated for argument

drop PROCEDURE pro13_3;

############ case
drop PROCEDURE pro13_4;

CREATE PROCEDURE pro13_4(in arg ENUM('','NULL','最大255个字符','！@#￥%……&*（）','abcd','ａｂｃｄ'))
BEGIN
  SELECT arg;
END 
/

call pro13_4('');
+------+
| arg  |
+------+
|      |
+------+
call pro13_4("");
+------+
| arg  |
+------+
|      |
+------+
call pro13_4('  ');
+------+
| arg  |
+------+
|      |
+------+
call pro13_4(SPACE(5));
+------+
| arg  |
+------+
|      |
+------+
call pro13_4(SPACE(1000000));
+------+
| arg  |
+------+
|      |
+------+
call pro13_4('　　');
ERROR 01000: Data truncated for argument
call pro13_4(Null);
+------+
| arg  |
+------+
| NULL |
+------+
call pro13_4('Null');
+------+
| arg  |
+------+
| NULL |
+------+
call pro13_4(QUOTE(NULL));
+------+
| arg  |
+------+
| NULL |
+------+
call pro13_4('最大255个字符');
+--------------------+
| arg                |
+--------------------+
| 最大255个字符      |
+--------------------+
call pro13_4('！@#￥%……&*（）');
+-------------------------+
| arg                     |
+-------------------------+
| ！@#￥%……&*（）         |
+-------------------------+
call pro13_4('ａｂｃｄ');
+--------------+
| arg          |
+--------------+
| ａｂｃｄ     |
+--------------+
call pro13_4('ａｂｃｄ　　');
ERROR 01000: Data truncated for argument
call pro13_4('abcd');
+------+
| arg  |
+------+
| abcd |
+------+
call pro13_4(DES_DECRYPT(DES_ENCRYPT('abcd')));
+------+
| arg  |
+------+
| abcd |
+------+
call pro13_4("abcd");
+------+
| arg  |
+------+
| abcd |
+------+
call pro13_4(QUOTE('abcd'));
ERROR 01000: Data truncated for argument
call pro13_4('abcd\t');
ERROR 01000: Data truncated for argument
call pro13_4('abcd\n');
ERROR 01000: Data truncated for argument
call pro13_4(concat('abcd',''));
+------+
| arg  |
+------+
| abcd |
+------+
call pro13_4('ABCD');
+------+
| arg  |
+------+
| abcd |
+------+
call pro13_4(upper('abcd'));
+------+
| arg  |
+------+
| abcd |
+------+
call pro13_4('ABCD    ');
+------+
| arg  |
+------+
| abcd |
+------+
call pro13_4('    ABCD');
ERROR 01000: Data truncated for argument
call pro13_4('    ABCD    ');
ERROR 01000: Data truncated for argument

drop PROCEDURE pro13_4;

############ case
drop FUNCTION FUN13_5;
drop PROCEDURE pro13_6;
drop PROCEDURE pro13_7;

CREATE FUNCTION FUN13_5(arg ENUM('','NULL', 'ONE', 'TWO','THREE','FOUR','ENUM')) RETURNS SET('','null', 'one', 'two','three','four','set') DETERMINISTIC
BEGIN
  RETURN arg;
END 
/
CREATE PROCEDURE pro13_6(in arg ENUM('','NULL', 'ONE', 'TWO','THREE','FOUR','ENUM'))
BEGIN
  declare var1 ENUM('','NULL', 'ONE', 'TWO','THREE','FOUR','ENUM') default 'ONE';
  declare var2 SET('','NULL', 'ONE', 'TWO','THREE','FOUR','SET') default 'TWO';
  SELECT arg,var1,var2;
  set var1 = var2;
  set arg = var2;
  SELECT arg,var1,var2;
  set var2 = concat(arg,',NULL');
  SELECT arg,var1,var2;
END 
/
CREATE PROCEDURE pro13_7(in arg1 ENUM('','NULL', 'ONE', 'TWO','THREE','FOUR','ENUM'),in arg2 SET('','NULL', 'ONE', 'TWO','THREE','FOUR','SET'))
BEGIN
  if arg1 != arg2 then
    if arg1> arg2 then
      SELECT 'arg1 > arg2 ',arg1,arg2;
    else
      SELECT 'arg1 < arg2 ',arg1,arg2;
    end if;
  else
    SELECT 'arg1 = arg2 ',arg1,arg2;
  end if;
END 
/

select FUN13_5(NULL);
+---------------+
| FUN13_5(NULL) |
+---------------+
| NULL          |
+---------------+
select FUN13_5('');
+-------------+
| FUN13_5('') |
+-------------+
|             |
+-------------+
select FUN13_5('   ');
+----------------+
| FUN13_5('   ') |
+----------------+
|                |
+----------------+
select FUN13_5('NULL   ');
+--------------------+
| FUN13_5('NULL   ') |
+--------------------+
| null               |
+--------------------+
select FUN13_5('THREE');
+------------------+
| FUN13_5('THREE') |
+------------------+
| three            |
+------------------+
select FUN13_5('ENUM');
ERROR 01000: Data truncated for argument
select FUN13_5(7);
ERROR 01000: Data truncated for argument

call pro13_6(NULL);
+------+------+------+
| arg  | var1 | var2 |
+------+------+------+
+------+------+------+
| arg  | var1 | var2 |
+------+------+------+
+------+------+----------+
| arg  | var1 | var2     |
+------+------+----------+
| NULL | ONE  | TWO  |
| TWO  | TWO  | TWO  |
| TWO  | TWO  | NULL,TWO |
+------+------+------+
+------+------+------+
+------+------+----------+
call pro13_6('');
+------+------+------+
| arg  | var1 | var2 |
+------+------+------+
+------+------+------+
| arg  | var1 | var2 |
+------+------+------+
+------+------+----------+
| arg  | var1 | var2     |
+------+------+----------+
|      | ONE  | TWO  |
| TWO  | TWO  | TWO  |
| TWO  | TWO  | NULL,TWO |
+------+------+------+
+------+------+------+
+------+------+----------+
call pro13_6('THREE');
+-------+------+------+
| arg   | var1 | var2 |
+-------+------+------+
+------+------+------+
| arg  | var1 | var2 |
+------+------+------+
+------+------+----------+
| arg  | var1 | var2     |
+------+------+----------+
| THREE | ONE  | TWO  |
| TWO  | TWO  | TWO  |
| TWO  | TWO  | NULL,TWO |
+-------+------+------+
+------+------+------+
+------+------+----------+

call pro13_7(null,null);
+--------------+------+------+
| arg1 = arg2  | arg1 | arg2 |
+--------------+------+------+
| arg1 = arg2  | NULL | NULL |
+--------------+------+------+
call pro13_7(null,'ONE');
+--------------+------+------+
| arg1 = arg2  | arg1 | arg2 |
+--------------+------+------+
| arg1 = arg2  | NULL | ONE  |
+--------------+------+------+
call pro13_7('ONE',null);
+--------------+------+------+
| arg1 = arg2  | arg1 | arg2 |
+--------------+------+------+
| arg1 = arg2  | ONE  | NULL |
+--------------+------+------+
call pro13_7('','');
+--------------+------+------+
| arg1 = arg2  | arg1 | arg2 |
+--------------+------+------+
| arg1 = arg2  |      |      |
+--------------+------+------+
call pro13_7('ONE','ONE');
+--------------+------+------+
| arg1 = arg2  | arg1 | arg2 |
+--------------+------+------+
| arg1 = arg2  | ONE  | ONE  |
+--------------+------+------+
call pro13_7('ONE','TWO');
+--------------+------+------+
| arg1 < arg2  | arg1 | arg2 |
+--------------+------+------+
| arg1 < arg2  | ONE  | TWO  |
+--------------+------+------+
call pro13_7('ENUM','SET');
+--------------+------+------+
| arg1 < arg2  | arg1 | arg2 |
+--------------+------+------+
| arg1 < arg2  | ENUM | SET  |
+--------------+------+------+
call pro13_7('ONE','ONE,TWO');
+--------------+------+---------+
| arg1 < arg2  | arg1 | arg2    |
+--------------+------+---------+
| arg1 < arg2  | ONE  | ONE,TWO |
+--------------+------+---------+
call pro13_7('ENUM',',ONE');
+--------------+------+------+
| arg1 < arg2  | arg1 | arg2 |
+--------------+------+------+
| arg1 < arg2  | ENUM | ONE  |
+--------------+------+------+
call pro13_7('ENUM','');
+--------------+------+------+
| arg1 > arg2  | arg1 | arg2 |
+--------------+------+------+
| arg1 > arg2  | ENUM |      |
+--------------+------+------+

drop FUNCTION FUN13_5;
drop PROCEDURE pro13_6;
drop PROCEDURE pro13_7;

drop user whh_test0;
purge recyclebin;
