drop trigger tri_t10;
drop trigger tri_t10_delete;
drop trigger tri_t10_insert;
drop trigger tri_t10_after_update;
drop table t10;
drop table msg;
create table t10(c10 int, c11 int, c12 int);
create table msg(c1 int, c2 int, c3 int);
create trigger tri_t10 before insert on t10 for each row
begin
declare a int;
set a = 100;
insert into msg values (NEW.c11,  NEW.c10, c);
end;
/
create trigger tri_t10 before insert on t10 for each row
begin
declare a int;
set a = 100;
insert into msg values (NEW.c11,  NEW.c10, c);
end;
/
ERROR HY000: trigger 'tri_t10' already exist
create trigger tri_t10_delete before delete on t10 for each row
begin
declare a int;
set a = 100;
end;
/
create trigger tri_t10_insert after insert on t10 for each row
begin
declare a int;
set a = 100;
insert into msg values (NEW.c11,  NEW.c10, c);
end;
/
create trigger tri_t10_after_update after update on t10 for each row
begin
declare a int;
set a = 100;
insert into msg values (NEW.c11,  NEW.c10, c);
end;
/
insert into t10 values (1, 2, 3);
ERROR 42S22: Unknown column 'c' in 'field list'
drop table msg;
drop table t10;
drop table test;
drop table msg;
drop trigger tri_test_before_insert;
drop trigger tri_test_after_insert;
drop trigger tri_test_before_update;
drop trigger tri_test_after_update;
drop trigger tri_test_before_delete;
drop trigger tri_test_after_delete;
create table test(c1 int, c2 int, c3 int);
create table msg (c1 int, c2 int, c3 int);
create trigger tri_test_before_insert before insert on test for each row
insert into msg values (NEW.c1, NEW.c2, NEW.c3);
create trigger tri_test_after_insert after insert on test for each row
insert into msg values (NEW.c3 + 1, NEW.c2 + 1, NEW.c1 + 1);
insert into test values (1, 2, 3);
select * from test;
c1	c2	c3
1	2	3
select * from msg;
c1	c2	c3
1	2	3
4	3	2
delete from msg;
create trigger tri_test_before_update before update on test for each row
begin
insert into msg values (NEW.c1, NEW.c2, NEW.c3);
insert into msg values (OLD.c1, OLD.c2, OLD.c3);
end;
/
create trigger tri_test_after_update after update on test for each row
begin
insert into msg values (NEW.c3 + 100, NEW.c2 + 100, NEW.c1 + 100);
insert into msg values (OLD.c3 + 100, OLD.c2 + 100, OLD.c1 + 100);
end;
/
update test set c2 = 20, c3 = 30 where c1 = 1;
select * from test;
c1	c2	c3
1	20	30
select * from msg;
c1	c2	c3
1	2	3
1	20	30
103	102	101
130	120	101
delete from msg;
create trigger tri_test_before_delete before delete on test for each row
insert into msg values (OLD.c3 + 1, OLD.c2 + 1, OLD.c1 + 1);
create trigger tri_test_after_delete after delete on test for each row
insert into msg values (OLD.c3 + 100, OLD.c2 + 100, OLD.c1 + 100);
delete from test;
select * from msg;
c1	c2	c3
130	120	101
31	21	2
drop table msg;
drop table test;
drop table test;
drop table msg;
drop trigger tri_test_before_insert;
drop trigger tri_test_after_insert;
drop trigger tri_test_before_delete;
drop trigger tri_test_after_delete;
create table test(c1 int primary key, c2 int, c3 int);
create table msg (c1 int, c2 int, c3 int);
create trigger tri_test_before_insert before insert on test for each row
insert into msg values (NEW.c1, NEW.c2, NEW.c3);
create trigger tri_test_after_insert after insert on test for each row
insert into msg values (NEW.c3 + 1, NEW.c2 + 1, NEW.c1 + 1);
create trigger tri_test_before_delete before delete on test for each row
insert into msg values (OLD.c3 + 1, OLD.c2 + 1, OLD.c1 + 1);
create trigger tri_test_after_delete after delete on test for each row
insert into msg values (OLD.c3 + 100, OLD.c2 + 100, OLD.c1 + 100);
replace into test values (1, 2, 3);
replace into test values (10, 11, 12);
select * from test;
c1	c2	c3
1	2	3
10	11	12
select * from msg;
c1	c2	c3
1	2	3
10	11	12
13	12	11
4	3	2
delete from msg;
replace into test values (1, 20, 20);
select * from msg;
c1	c2	c3
1	20	20
103	102	101
21	21	2
4	3	2
drop table test;
drop table msg;
drop table test;
drop table msg;
drop trigger tri_test_before_insert;
drop trigger tri_test_after_insert;
drop trigger tri_test_before_delete;
drop trigger tri_test_after_delete;
create table test(c1 int, c2 int, c3 int, primary key (c1, c2)) partition by hash (c2) partitions 3;
create table msg (c1 int, c2 int, c3 int);
create trigger tri_test_before_insert before insert on test for each row
insert into msg values (NEW.c1, NEW.c2, NEW.c3);
create trigger tri_test_after_insert after insert on test for each row
insert into msg values (NEW.c3 + 1, NEW.c2 + 1, NEW.c1 + 1);
create trigger tri_test_before_delete before delete on test for each row
insert into msg values (OLD.c3 + 1, OLD.c2 + 1, OLD.c1 + 1);
create trigger tri_test_after_delete after delete on test for each row
insert into msg values (OLD.c3 + 100, OLD.c2 + 100, OLD.c1 + 100);
replace into test values (1, 2, 3), (2, 3, 4), (3, 4, 5), (4, 5, 6), (5, 6, 7), (6, 7, 8), (7, 8, 9);
select * from test;
c1	c2	c3
1	2	3
2	3	4
3	4	5
4	5	6
5	6	7
6	7	8
7	8	9
select * from msg;
c1	c2	c3
1	2	3
10	9	8
2	3	4
3	4	5
4	3	2
4	5	6
5	4	3
5	6	7
6	5	4
6	7	8
7	6	5
7	8	9
8	7	6
9	8	7
delete from msg;
replace into test values (1, 2, 3), (11, 12, 13), (2, 3, 4), (3, 4, 5),
(4, 5, 6), (5, 6, 7), (6, 7, 8), (7, 8, 9), (12, 13, 14);
select * from msg;
c1	c2	c3
1	2	3
10	9	8
10	9	8
103	102	101
104	103	102
105	104	103
106	105	104
107	106	105
108	107	106
109	108	107
11	12	13
12	13	14
14	13	12
15	14	13
2	3	4
3	4	5
4	3	2
4	3	2
4	5	6
5	4	3
5	4	3
5	6	7
6	5	4
6	5	4
6	7	8
7	6	5
7	6	5
7	8	9
8	7	6
8	7	6
9	8	7
9	8	7
drop table test;
drop table msg;
drop table test;
drop table msg;
drop trigger tri_test_before_insert;
drop trigger tri_test_after_insert;
drop trigger tri_test_before_update;
drop trigger tri_test_after_update;
create table test(c1 int, c2 int, c3 int, primary key (c1));
create table msg (c1 int, c2 int, c3 int);
insert into test values (1, 2, 3),(2, 3, 4);
create trigger tri_test_before_insert before insert on test for each row
insert into msg values (NEW.c1, NEW.c2, NEW.c3);
create trigger tri_test_after_insert after insert on test for each row
insert into msg values (NEW.c3 + 1, NEW.c2 + 1, NEW.c1 + 1);
create trigger tri_test_before_update before update on test for each row
begin
insert into msg values (OLD.c3 + 1, OLD.c2 + 1, OLD.c1 + 1);
insert into msg values (NEW.c3 * -1, NEW.c2 * -1, NEW.c1 * -1);
end;
/
create trigger tri_test_after_update after update on test for each row
begin
insert into msg values (OLD.c3 + 100, OLD.c2 + 100, OLD.c1 + 100);
insert into msg values (NEW.c3 * -100, NEW.c2 * -100, NEW.c1 * -100);
end;
/
insert into test values (1, 2, 3) on duplicate key update c2 = C2 + 100;
select * from test;
c1	c2	c3
1	102	3
2	3	4
select * from msg;
c1	c2	c3
-3	-102	-1
-300	-10200	-100
1	2	3
103	102	101
4	3	2
delete from msg;
insert into test values (1, 2, 3), (2, 5, 10) on duplicate key update c2 = C2 + 100;
select * from msg;
c1	c2	c3
-3	-202	-1
-300	-20200	-100
-4	-103	-2
-400	-10300	-200
1	2	3
103	202	101
104	103	102
2	5	10
4	103	2
5	4	3
delete from msg;
insert into test values (1, 2, 3) on duplicate key update c2 = 202;
select * from msg;
c1	c2	c3
-3	-202	-1
1	2	3
4	203	2
delete from msg;
insert into test values (3, 5, 10) on duplicate key update c2 = C2 + 100;
select * from msg;
c1	c2	c3
11	6	4
3	5	10
drop table test;
drop table msg;
drop table test;
drop table msg;
drop trigger tri_test_before_insert;
drop trigger tri_test_after_insert;
drop trigger tri_test_before_update;
drop trigger tri_test_after_update;
create table test(c1 int, c2 int, c3 int, primary key (c1, c2)) partition by hash (c2) partitions 3;
create table msg (c1 int, c2 int, c3 int);
insert into test values (1, 2, 3),(2, 3, 4);
create trigger tri_test_before_insert before insert on test for each row
insert into msg values (NEW.c1, NEW.c2, NEW.c3);
create trigger tri_test_after_insert after insert on test for each row
insert into msg values (NEW.c3 + 1, NEW.c2 + 1, NEW.c1 + 1);
create trigger tri_test_before_update before update on test for each row
begin
insert into msg values (OLD.c3 + 1, OLD.c2 + 1, OLD.c1 + 1);
insert into msg values (NEW.c3 * -1, NEW.c2 * -1, NEW.c1 * -1);
end;
/
create trigger tri_test_after_update after update on test for each row
begin
insert into msg values (OLD.c3 + 100, OLD.c2 + 100, OLD.c1 + 100);
insert into msg values (NEW.c3 * -100, NEW.c2 * -100, NEW.c1 * -100);
end;
/
insert into test values (1, 2, 3) on duplicate key update c2 = C2 + 100;
select * from test;
c1	c2	c3
1	102	3
2	3	4
select * from msg;
c1	c2	c3
-3	-102	-1
-300	-10200	-100
1	2	3
103	102	101
4	3	2
delete from msg;
insert into test values (1, 2, 3), (2, 5, 10) on duplicate key update c2 = C2 + 100;
select * from msg;
c1	c2	c3
1	2	3
11	6	3
2	5	10
4	3	2
delete from msg;
insert into test values (1, 2, 3) on duplicate key update c2 = 202;
select * from msg;
c1	c2	c3
-3	-202	-1
-300	-20200	-100
1	2	3
103	102	101
4	3	2
delete from msg;
insert into test values (3, 5, 10) on duplicate key update c2 = C2 + 100;
select * from msg;
c1	c2	c3
11	6	4
3	5	10
drop table test;
drop table msg;
drop table test;
drop table msg;
drop table msg_update;
drop trigger tri_test_before_update;
drop trigger tri_test_after_update;
create table test(c1 int, c2 int, c3 int);
create table msg (c1 int, c2 int, c3 int);
create table msg_update (c1 int, c2 int, c3 int);
insert into test values (1, 2, 3);
insert into test values (10, 11, 12);
insert into msg_update values (1, 2, 100);
insert into msg_update values (10, 11, 12);
create trigger tri_test_before_update before update on test for each row
begin
declare a int;
set NEW.c2 = NEW.c2 * 100;
set a = OLD.c3 * -100;
update msg_update set c2 = NEW.c2 where c1 = NEW.c1;
insert into msg values (NEW.c1, NEW.c2, NEW.c3);
insert into msg values (OLD.c1, OLD.c2, a);
end;
/
create trigger tri_test_after_update after update on test for each row
begin
declare a int;
set a = NEW.c1 * 222;
delete from msg_update where c1 = NEW.c1 and c3 = NEW.c3;
insert into msg values (a, NEW.c2 + 100, NEW.c1 + 100);
insert into msg values (OLD.c3 + 100, OLD.c2 + 100, OLD.c1 + 100);
end;
/
update test set c2 = 10 where c1 = 1;
select * from test;
c1	c2	c3
1	1000	3
10	11	12
select * from msg;
c1	c2	c3
1	1000	3
1	2	-300
103	102	101
222	1100	101
select * from msg_update;
c1	c2	c3
1	1000	100
10	11	12
delete from msg;
update test set c2 = 10 where c1 = 10 and c3 = 12;
select * from test;
c1	c2	c3
1	1000	3
10	1000	12
select * from msg;
c1	c2	c3
10	1000	12
10	11	-1200
112	111	110
2220	1100	110
select * from msg_update;
c1	c2	c3
1	1000	100
drop table msg;
drop table test;
drop table msg_update;
drop database if exists webber_tri_1;
drop database if exists webber_tri_2;
create database webber_tri_1;
create database webber_tri_2;
use webber_tri_1;
drop table test;
create table test(c1 int primary key, c2 int, c3 int);
create trigger tri_test_after_insert after insert on test for each row
set @a = 1;
show triggers;
Trigger	Event	Table	Statement	Timing	Created	sql_mode	Definer	character_set_client	collation_connection	Database Collation
tri_test_after_insert	INSERT	test	trigger tri_test_after_insert after insert on test for each row
set @a = 1	AFTER	2022-11-16 11:16:22	STRICT_ALL_TABLES,NO_ZERO_IN_DATE,NO_AUTO_CREATE_USER	admin@%	utf8mb4	utf8mb4_general_ci	utf8mb4_general_ci
show create trigger tri_test_after_insert;
Trigger	sql_mode	SQL Original Statement	character_set_client	collation_connection	Database Collation
tri_test_after_insert	STRICT_ALL_TABLES,NO_ZERO_IN_DATE,NO_AUTO_CREATE_USER	CREATE DEFINER = admin@% trigger tri_test_after_insert after insert on test for each row
set @a = 1	utf8mb4	utf8mb4	utf8mb4
select * from information_schema.triggers where EVENT_OBJECT_SCHEMA = 'webber_tri_1' and EVENT_OBJECT_TABLE = 'test';
TRIGGER_CATALOG	TRIGGER_SCHEMA	TRIGGER_NAME	EVENT_MANIPULATION	EVENT_OBJECT_CATALOG	EVENT_OBJECT_SCHEMA	EVENT_OBJECT_TABLE	ACTION_ORDER	ACTION_CONDITION	ACTION_STATEMENT	ACTION_ORIENTATION	ACTION_TIMING	ACTION_REFERENCE_OLD_TABLE	ACTION_REFERENCE_NEW_TABLE	ACTION_REFERENCE_OLD_ROW	ACTION_REFERENCE_NEW_ROW	CREATED	SQL_MODE	DEFINER	CHARACTER_SET_CLIENT	COLLATION_CONNECTION	DATABASE_COLLATION
def	webber_tri_1	tri_test_after_insert	INSERT	def	webber_tri_1	test	1	NULL	trigger tri_test_after_insert after insert on test for each row
set @a = 1	ROW	AFTER	NULL	NULL	OLD	NEW	2022-11-16 11:16:22	STRICT_ALL_TABLES,NO_ZERO_IN_DATE,NO_AUTO_CREATE_USER	admin@%	utf8mb4	utf8mb4_general_ci	utf8mb4_general_ci
use webber_tri_2;
show triggers;
Trigger	Event	Table	Statement	Timing	Created	sql_mode	Definer	character_set_client	collation_connection	Database Collation
show triggers from webber_tri_1;
Trigger	Event	Table	Statement	Timing	Created	sql_mode	Definer	character_set_client	collation_connection	Database Collation
tri_test_after_insert	INSERT	test	trigger tri_test_after_insert after insert on test for each row
set @a = 1	AFTER	2022-11-16 11:16:22	STRICT_ALL_TABLES,NO_ZERO_IN_DATE,NO_AUTO_CREATE_USER	admin@%	utf8mb4	utf8mb4_general_ci	utf8mb4_general_ci
show create trigger tri_test_after_insert;
ERROR HY000: Trigger does not exist
show create trigger webber_tri_1.tri_test_after_insert;
Trigger	sql_mode	SQL Original Statement	character_set_client	collation_connection	Database Collation
tri_test_after_insert	STRICT_ALL_TABLES,NO_ZERO_IN_DATE,NO_AUTO_CREATE_USER	CREATE DEFINER = admin@% trigger tri_test_after_insert after insert on test for each row
set @a = 1	utf8mb4	utf8mb4	utf8mb4
select * from information_schema.triggers where EVENT_OBJECT_SCHEMA = 'webber_tri_1' and EVENT_OBJECT_TABLE = 'test';
TRIGGER_CATALOG	TRIGGER_SCHEMA	TRIGGER_NAME	EVENT_MANIPULATION	EVENT_OBJECT_CATALOG	EVENT_OBJECT_SCHEMA	EVENT_OBJECT_TABLE	ACTION_ORDER	ACTION_CONDITION	ACTION_STATEMENT	ACTION_ORIENTATION	ACTION_TIMING	ACTION_REFERENCE_OLD_TABLE	ACTION_REFERENCE_NEW_TABLE	ACTION_REFERENCE_OLD_ROW	ACTION_REFERENCE_NEW_ROW	CREATED	SQL_MODE	DEFINER	CHARACTER_SET_CLIENT	COLLATION_CONNECTION	DATABASE_COLLATION
def	webber_tri_1	tri_test_after_insert	INSERT	def	webber_tri_1	test	1	NULL	trigger tri_test_after_insert after insert on test for each row
set @a = 1	ROW	AFTER	NULL	NULL	OLD	NEW	2022-11-16 11:16:22	STRICT_ALL_TABLES,NO_ZERO_IN_DATE,NO_AUTO_CREATE_USER	admin@%	utf8mb4	utf8mb4_general_ci	utf8mb4_general_ci
use test;
drop database webber_tri_1;
drop database webber_tri_2;
drop user webber;
drop database wb;
create user "webber" identified by "webber";
grant all on *.* to webber with grant option;
create database wb;
create table test(c1 int, c2 int, c3 int);
create table msg (c1 int, c2 int, c3 int);
create trigger tri_test_before_insert before insert on test for each row
insert into msg values (NEW.c1, NEW.c2, NEW.c3);
show triggers like 'test';
Trigger	Event	Table	Statement	Timing	Created	sql_mode	Definer	character_set_client	collation_connection	Database Collation
tri_test_before_insert	INSERT	test	trigger tri_test_before_insert before insert on test for each row
insert into msg values (NEW.c1, NEW.c2, NEW.c3)	BEFORE	2022-11-16 11:16:22	STRICT_ALL_TABLES,NO_ZERO_IN_DATE,NO_AUTO_CREATE_USER	webber@%	utf8mb4	utf8mb4_general_ci	utf8mb4_general_ci
select trigger_schema, trigger_name, definer from information_schema.triggers 
where trigger_schema = 'wb';
trigger_schema	trigger_name	definer
wb	tri_test_before_insert	webber@%
drop user webber;
select trigger_schema, trigger_name, definer from information_schema.triggers 
where trigger_schema = 'wb';
trigger_schema	trigger_name	definer
wb	tri_test_before_insert	webber@%
show triggers like 'tri_test_before_insert';
Trigger	Event	Table	Statement	Timing	Created	sql_mode	Definer	character_set_client	collation_connection	Database Collation
drop database wb;
drop table t1;
drop table msg;
drop trigger tri_t;
create table t1 (c1 char(10), c2 enum('1','2'), c3 set('1','2'));
create table msg (id int);
create trigger tri_t before update on t1 for each row
insert into msg values (1);
insert into t1 values (1,1,1);
update t1 set c1 = 'aaa';
update t1 set c2 = '2';
update t1 set c3 = '2';
select * from t1;
c1	c2	c3
aaa	2	2
select * from msg;
id
1
1
1
drop table t1;
drop table msg;
drop table test_ddl;
drop trigger tri_test_ddl;
create table test_ddl(c1 int);
create trigger tri_test_ddl before insert on test_ddl for each row
begin
create table t(c1 int);
end;
/
ERROR HY000: Explicit or implicit commit is not allowed in stored function or trigger.
drop table test_ddl;
