result_format: 4
##########################test1  start##########################
### 

drop table test_ddl;
drop table test_ddl_1;
drop table msg;
drop trigger tri_test_ddl;

create table test_ddl(c1 int);
create table msg (c1 int);

create trigger tri_test_ddl before insert on test_ddl for each row
insert into msg values (NEW.c1);
/

insert into test_ddl values (1);

select * from test_ddl;
+------+
| c1   |
+------+
|    1 |
+------+
select * from msg;
+------+
| c1   |
+------+
|    1 |
+------+

truncate table test_ddl;

insert into test_ddl values (2);
select * from test_ddl;
+------+
| c1   |
+------+
|    2 |
+------+
select * from msg;
+------+
| c1   |
+------+
|    1 |
|    2 |
+------+

rename table test_ddl to test_ddl_1;
insert into test_ddl_1 values (3);
select * from test_ddl_1;
+------+
| c1   |
+------+
|    2 |
|    3 |
+------+
select * from msg;
+------+
| c1   |
+------+
|    1 |
|    2 |
|    3 |
+------+

drop table test_ddl_1;
drop table msg;
##########################test1  end##########################
##########################test2  start##########################
### 
drop procedure pro_tri;
drop table test_ddl;
drop trigger tri_test_ddl;

create table test_ddl(c1 int);

create procedure pro_tri()
create table ttt(c1 int);
/

create trigger tri_test_ddl before insert on test_ddl
for each row
call pro_tri;
/

insert into test_ddl values (100);
ERROR HY000: Explicit or implicit commit is not allowed in stored function or trigger.

drop table test_ddl;
drop procedure pro_tri;
##########################test2  end##########################
##########################test3  start##########################
###
###
set recyclebin=on;

drop table test_drop_table;
drop trigger if exists tri_test_drop_table;
Warnings:
Note	1360	Trigger does not exist

create table test_drop_table (c1 int);

create trigger tri_test_drop_table before insert on test_drop_table for each row
set @aaa = 1;

drop trigger if exists tri_test_drop_table;

select count(*) from INFORMATION_SCHEMA.TRIGGERS
  where trigger_name = 'tri_test_drop_table' and trigger_schema = 'test';
+----------+
| count(*) |
+----------+
|        0 |
+----------+

create trigger tri_test_drop_table before insert on test_drop_table for each row
set @aaa = 1;

select count(*) from INFORMATION_SCHEMA.TRIGGERS
  where trigger_name = 'tri_test_drop_table' and trigger_schema = 'test';
+----------+
| count(*) |
+----------+
|        1 |
+----------+

drop table test_drop_table;

select count(*) from INFORMATION_SCHEMA.TRIGGERS where trigger_schema = '__recyclebin';
+----------+
| count(*) |
+----------+
|        0 |
+----------+

##########################test3  end##########################
##########################test4  start##########################
###
drop table test_new_old;
drop trigger tri_test_new_old;

create table test_new_old (c1 int);

create trigger tri_test_new_old after update on test_new_old
for each row
SET NEW.c1 = 7;
ERROR HY000: Updating of NEW row is not allowed in after trigger

create trigger tri_test_new_old before update on test_new_old
for each row
SET OLD.c1 = 7;
ERROR HY000: Updating of OLD row is not allowed in trigger

create trigger tri_test_new_old before update on test_new_old
for each row
select 5 into OLD.c1;
ERROR 42000: You have an error in your SQL syntax; check the manual that corresponds to your OceanBase version for the right syntax to use near 'select 5 into OLD.c1' at line 3

create trigger tri_test_new_old before update on test_new_old
for each row
select 5 into @aaa;

drop table test_new_old;
##########################test4  end##########################
##########################test5  start##########################
#####
drop table t;
drop trigger tri;

create table t (c1 int);

create trigger tri before insert on t for each row
  select current_date;
ERROR 0A000: Not allowed to return a result set from a trigger

drop table t;
##########################test5  end##########################
##########################test6  start##########################
#######
#######
drop table t;
drop table msg;
drop trigger tri_t;

create table t (c1 int);
create table msg (c1 int);

create trigger tri_t before delete on t for each row
BEGIN
  set @aa = NEW.c1;
end;
/
ERROR HY000: There is no NEW row in on DELETE trigger

create trigger tri_t before delete on t for each row
BEGIN
  insert into msg values (NEW.c1);
end;
/
ERROR HY000: There is no NEW row in on DELETE trigger

create trigger tri_t before insert on t for each row
BEGIN
  set @aa = OLD.c1;
end;
/
ERROR HY000: There is no OLD row in on INSERT trigger

create trigger tri_t before insert on t for each row
BEGIN
  insert into msg values (OLD.c1);
end;
/
ERROR HY000: There is no OLD row in on INSERT trigger

drop table t;
drop table msg;
##########################test6  end##########################
##########################test7  start##########################
######
drop table t;

create table t (c1 int);

create trigger trigger before insert on t for each row
set @bb = new.C1;
ERROR 42000: You have an error in your SQL syntax; check the manual that corresponds to your OceanBase version for the right syntax to use near 'trigger' at line 1

drop table t;
##########################test7  end##########################
##########################test8  start##########################
######
drop table t;
drop table msg;
drop trigger tri_t;

create table t (c1 int, c2 int);
create table msg (c1 int, c2 int);

create trigger tri_t before insert on t for each row
BEGIN
  declare a1 int;
  declare b1 int;

  set a1 = NEW.c1;
  set b1 = new.C2;

  insert into msg values (new.c1, A1);
  insert into msg values (A1 + b1, NEW.C2);
end;
/

insert into t values (10, 10);

select * from t;
+------+------+
| c1   | c2   |
+------+------+
|   10 |   10 |
+------+------+

select * from msg;
+------+------+
| c1   | c2   |
+------+------+
|   10 |   10 |
|   20 |   10 |
+------+------+

drop table t;
drop table msg;
##########################test8  end##########################
##########################test9  start##########################
drop table t1;
drop trigger tri_t1;

create table t1 (c1 int);
insert into t1 values (1);

create  trigger tri_t1 before insert on t1 for each row
  insert into t1 values (10);

insert into t1 values (11);
ERROR HY000: Can't update table 't1' in stored function/trigger because it is already used by statement which invoked this stored function/trigger.

drop trigger tri_t1;
create  trigger tri_t1 after insert on t1 for each row
  delete from t1;

insert into t1 values (11);
ERROR HY000: Can't update table 't1' in stored function/trigger because it is already used by statement which invoked this stored function/trigger.

drop trigger tri_t1;
create  trigger tri_t1 before delete on t1 for each row
  insert into t1 values (101);

delete from t1;
ERROR HY000: Can't update table 't1' in stored function/trigger because it is already used by statement which invoked this stored function/trigger.

drop trigger tri_t1;
create  trigger tri_t1 after delete on t1 for each row
  delete from t1;

delete from t1;
ERROR HY000: Can't update table 't1' in stored function/trigger because it is already used by statement which invoked this stored function/trigger.

drop trigger tri_t1;
create  trigger tri_t1 before update on t1 for each row
  update t1 set c1 = 100;

update t1 set c1 = 102;
ERROR HY000: Can't update table 't1' in stored function/trigger because it is already used by statement which invoked this stored function/trigger.

drop trigger tri_t1;
create  trigger tri_t1 after update on t1 for each row
  update t1 set c1 = 100;

update t1 set c1 = 102;
ERROR HY000: Can't update table 't1' in stored function/trigger because it is already used by statement which invoked this stored function/trigger.

drop trigger tri_t1;
create  trigger tri_t1 before insert on t1 for each row
  select count(*) into @a1 from t1;

insert into t1 values (101);

drop table t1;
##########################test9  end##########################
##########################test10  start##########################
#####
drop table zy;
drop table zy1;
drop trigger tri_test;

create table zy(coll_id int not null, doc_id int not null, doc_data varchar(30) not null,
                last_modified bigint not null, primary key(coll_id, doc_id),
                index idx_col(coll_id, last_modified));

create table zy1(coll_id int not null, doc_id int not null, doc_data varchar(30) not null,
                 last_modified bigint not null, primary key(coll_id, doc_id),
                 index idx_col(coll_id, last_modified));

create trigger tri_test before insert on zy for each row 
  insert into zy1 values (NEW.coll_id, NEW.doc_id, NEW.doc_data,NEW.last_modified);

insert into zy values (1,1,'{ "item" : "canvas"}',1000);

select * from zy1;
+---------+--------+----------------------+---------------+
| coll_id | doc_id | doc_data             | last_modified |
+---------+--------+----------------------+---------------+
|       1 |      1 | { "item" : "canvas"} |          1000 |
+---------+--------+----------------------+---------------+

drop table zy;
drop table zy1;
##########################test10  end##########################
##########################test11  start##########################
###
drop table test_set_t1;
drop table test_set_t2;
drop trigger tri_test_set_t1;

CREATE TABLE test_set_t1(c0 INT, c1 VARCHAR(10), 
                         c2 SET('a','b','c','d','e','f','g'));

CREATE TABLE test_set_t2(c0 INT, c1 VARCHAR(10), 
                         c2 SET('a','b','c','d','e','f','g'));

CREATE TRIGGER tri_test_set_t1 AFTER INSERT ON test_set_t1 FOR EACH ROW
  INSERT INTO test_set_t2 VALUES(new.c0, new.c1, new.c2);

INSERT INTO test_set_t1 VALUES(7,'GG','d');

INSERT INTO test_set_t1 (c0, c1) VALUES(8,'DD');

select * from test_set_t2;
+------+------+------+
| c0   | c1   | c2   |
+------+------+------+
|    7 | GG   | d    |
|    8 | DD   | NULL |
+------+------+------+

drop table test_set_t1;
drop table test_set_t2;
##########################test11  end##########################
