set ob_trx_timeout = 10000000000;
set ob_query_timeout = 10000000000;
drop database IF EXISTS hal_db;
create database hal_db character set utf8;
use hal_db;
result_format: 4
drop table riel;
create table riel(id int,name char(20),age int);
insert into riel values(1,'hal',1000);
insert into riel values(2,'riel',1200);
select * from riel;
+------+------+------+
| id   | name | age  |
+------+------+------+
|    1 | hal  | 1000 |
|    2 | riel | 1200 |
+------+------+------+

drop user halA;
create user halA identified by '123';
grant select on hal_db.* to halA;

drop user halB;
create user halB identified by '123';
grant super on *.* to halB;

drop role role_g1;
drop role role_g2;
drop role role_g3;

create role role_g1;
create role role_g2;
create role role_g3;

grant select on hal_db.riel to role_g1;
grant update on hal_db.riel to role_g2;

grant role_g1 to halB;
grant role_g2 to halB;
grant role_g3 to halB;
set default role role_g1 to halB;


############################### 拥有SUPER权限，支持更改该全局变量 ################################
set global activate_all_roles_on_login = OFF;（默认）
set global activate_all_roles_on_login = OFF;
show grants for 'halB';
Grants for halB@%
GRANT SUPER ON *.* TO 'halB'
GRANT `role_g3`@`%`,`role_g2`@`%`,`role_g1`@`%` TO `halB`@`%`
SHOW VARIABLES LIKE 'activate_all_roles_on_login';
Variable_name	Value
activate_all_roles_on_login	OFF
select current_role();
+----------------+
| current_role() |
+----------------+
| `role_g1`@`%`  |
+----------------+
select * from information_schema.enabled_roles;
+-----------+-----------+------------+--------------+
| ROLE_NAME | ROLE_HOST | IS_DEFAULT | IS_MANDATORY |
+-----------+-----------+------------+--------------+
| role_g1   | %         | YES        | NO           |
+-----------+-----------+------------+--------------+

重新登录
show grants for 'halB';
Grants for halB@%
GRANT SUPER ON *.* TO 'halB'
GRANT `role_g3`@`%`,`role_g2`@`%`,`role_g1`@`%` TO `halB`@`%`
SHOW VARIABLES LIKE 'activate_all_roles_on_login';
Variable_name	Value
activate_all_roles_on_login	OFF
SELECT @@global.activate_all_roles_on_login;
+--------------------------------------+
| @@global.activate_all_roles_on_login |
+--------------------------------------+
|                                    0 |
+--------------------------------------+
select current_role();
+----------------+
| current_role() |
+----------------+
| `role_g1`@`%`  |
+----------------+
select * from information_schema.enabled_roles;
+-----------+-----------+------------+--------------+
| ROLE_NAME | ROLE_HOST | IS_DEFAULT | IS_MANDATORY |
+-----------+-----------+------------+--------------+
| role_g1   | %         | YES        | NO           |
+-----------+-----------+------------+--------------+

select * from hal_db.riel;
+------+------+------+
| id   | name | age  |
+------+------+------+
|    1 | hal  | 1000 |
|    2 | riel | 1200 |
+------+------+------+
update hal_db.riel set age=2100 where id=2;
ERROR 42000: UPDATE command denied to user 'halB'@'%' for table 'riel'



set global activate_all_roles_on_login = ON;
set global activate_all_roles_on_login = ON;
show grants for 'halB';
Grants for halB@%
GRANT SUPER ON *.* TO 'halB'
GRANT `role_g3`@`%`,`role_g2`@`%`,`role_g1`@`%` TO `halB`@`%`
SHOW VARIABLES LIKE 'activate_all_roles_on_login';
Variable_name	Value
activate_all_roles_on_login	OFF
SELECT @@global.activate_all_roles_on_login;
+--------------------------------------+
| @@global.activate_all_roles_on_login |
+--------------------------------------+
|                                    1 |
+--------------------------------------+

select current_role();
+----------------+
| current_role() |
+----------------+
| `role_g1`@`%`  |
+----------------+

重新登录
show grants for 'halB';
Grants for halB@%
GRANT SUPER ON *.* TO 'halB'
GRANT `role_g3`@`%`,`role_g2`@`%`,`role_g1`@`%` TO `halB`@`%`
SHOW VARIABLES LIKE 'activate_all_roles_on_login';
Variable_name	Value
activate_all_roles_on_login	ON
SELECT @@global.activate_all_roles_on_login;
+--------------------------------------+
| @@global.activate_all_roles_on_login |
+--------------------------------------+
|                                    1 |
+--------------------------------------+
select current_role();
+-------------------------------------------+
| current_role()                            |
+-------------------------------------------+
| `role_g3`@`%`,`role_g2`@`%`,`role_g1`@`%` |
+-------------------------------------------+

select * from hal_db.riel;
+------+------+------+
| id   | name | age  |
+------+------+------+
|    1 | hal  | 1000 |
|    2 | riel | 1200 |
+------+------+------+
update hal_db.riel set age=2100 where id=2;
select * from hal_db.riel;
+------+------+------+
| id   | name | age  |
+------+------+------+
|    1 | hal  | 1000 |
|    2 | riel | 2100 |
+------+------+------+

set global activate_all_roles_on_login = OFF;
SHOW VARIABLES LIKE 'activate_all_roles_on_login';
Variable_name	Value
activate_all_roles_on_login	ON
SELECT @@global.activate_all_roles_on_login;
+--------------------------------------+
| @@global.activate_all_roles_on_login |
+--------------------------------------+
|                                    0 |
+--------------------------------------+
show grants for 'halB';
Grants for halB@%
GRANT SUPER ON *.* TO 'halB'
GRANT `role_g3`@`%`,`role_g2`@`%`,`role_g1`@`%` TO `halB`@`%`
select current_role();
+-------------------------------------------+
| current_role()                            |
+-------------------------------------------+
| `role_g3`@`%`,`role_g2`@`%`,`role_g1`@`%` |
+-------------------------------------------+
select * from information_schema.enabled_roles;
+-----------+-----------+------------+--------------+
| ROLE_NAME | ROLE_HOST | IS_DEFAULT | IS_MANDATORY |
+-----------+-----------+------------+--------------+
| role_g3   | %         | NO         | NO           |
| role_g2   | %         | NO         | NO           |
| role_g1   | %         | YES        | NO           |
+-----------+-----------+------------+--------------+

############################### 未拥有SUPER权限，不支持支持更改该全局变量 ###########################

show grants for 'halA';
Grants for halA@%
GRANT USAGE ON *.* TO 'halA'
GRANT SELECT ON `hal_db`.* TO 'halA'
SHOW VARIABLES LIKE 'activate_all_roles_on_login';
Variable_name	Value
activate_all_roles_on_login	OFF

set global activate_all_roles_on_login = on;
ERROR 42501: Access denied; you need (at least one of) the SUPER or ALTER SYSTEM privilege(s) for this operation

set global activate_all_roles_on_login = OFF;
ERROR 42501: Access denied; you need (at least one of) the SUPER or ALTER SYSTEM privilege(s) for this operation
SHOW VARIABLES LIKE 'activate_all_roles_on_login';
Variable_name	Value
activate_all_roles_on_login	OFF


恢复环境
set global activate_all_roles_on_login = OFF;
SHOW VARIABLES LIKE 'activate_all_roles_on_login';
Variable_name	Value
activate_all_roles_on_login	OFF


################################# 清空回收站,删除测试数据库,表等 ##################################

drop user admin_hal@'%' ;
purge recyclebin;
