result_format: 4
PURGE RECYCLEBIN;
########## SET DEFAULT ROLE 与set role 在pl中应用场景 ##########
DROP user halB;
DROP user zc_user1;
DROP user zc_user2;
DROP user zc_user3;
DROP user zc_role1;
DROP user zc_role2;
DROP user zc_role3;
DROP user zc_test1;
DROP user zc_test2;
DROP user zc_test3;
CREATE user zc_user1,zc_user2,zc_user3;
CREATE role zc_role1,zc_role2,zc_role3;
GRANT zc_role1,zc_role2,zc_user2 to zc_user1;
GRANT zc_role1,zc_role3,zc_user2 to zc_role2;
ALTER USER 'zc_role2' ACCOUNT UNLOCK;
GRANT CREATE on test.* to zc_role1;
set DEFAULT role all to zc_user1;
set DEFAULT role all to zc_role2;
GRANT ALTER ROUTINE ON *.* TO 'zc_user1'@'%';
GRANT CREATE ROUTINE ON *.* TO 'zc_user1'@'%';
GRANT ALTER ROUTINE ON *.* TO 'zc_role2'@'%';
GRANT CREATE ROUTINE ON *.* TO 'zc_role2'@'%';
########## SET DEFAULT ROLE ##########
#### PROCEDURE ####
##mysql中用户创建存储程序需要CREATE ROUTINE权限，ob不支持
##GRANT CREATE ROUTINE,ALTER ROUTINE,EXECUTE ON test.* to zc_user1;
####set user default role####
CONNECT zc_user1
use test;
DROP PROCEDURE zc_prole//
CREATE PROCEDURE zc_prole()
BEGIN
	SET DEFAULT ROLE zc_role1 to zc_user1;
end;
//
call zc_prole();
SELECT CURRENT_ROLE();
+----------------+
| CURRENT_ROLE() |
+----------------+
| `zc_role1`@`%` |
+----------------+
use test;
DROP PROCEDURE zc_prole1//
CREATE PROCEDURE zc_prole1()
BEGIN
	PREPARE stmt1 FROM 'SET DEFAULT ROLE zc_role1 to zc_user1';
	EXECUTE stmt1;
	DEALLOCATE PREPARE stmt1;
end;
//
DROP PROCEDURE zc_prole2//
CREATE PROCEDURE zc_prole2()
BEGIN
	PREPARE stmt1 FROM 'SET DEFAULT ROLE zc_role1,zc_role2 to zc_user1';
	EXECUTE stmt1;
	DEALLOCATE PREPARE stmt1;
end;
//
DROP PROCEDURE zc_prole3//
CREATE PROCEDURE zc_prole3()
BEGIN
	PREPARE stmt1 FROM 'SET DEFAULT ROLE all to zc_user1';
	EXECUTE stmt1;
	DEALLOCATE PREPARE stmt1;
end;
//
DROP PROCEDURE zc_prole4//
CREATE PROCEDURE zc_prole4()
BEGIN
	PREPARE stmt1 FROM 'SET DEFAULT ROLE NONE to zc_user1';
	EXECUTE stmt1;
	DEALLOCATE PREPARE stmt1;
end;
//
call test.zc_prole1();
SELECT CURRENT_ROLE();
+----------------+
| CURRENT_ROLE() |
+----------------+
| `zc_role1`@`%` |
+----------------+
call test.zc_prole2();
SELECT CURRENT_ROLE();
+-------------------------------+
| CURRENT_ROLE()                |
+-------------------------------+
| `zc_role2`@`%`,`zc_role1`@`%` |
+-------------------------------+
call test.zc_prole3();
SELECT CURRENT_ROLE();
+----------------------------------------------+
| CURRENT_ROLE()                               |
+----------------------------------------------+
| `zc_role2`@`%`,`zc_role1`@`%`,`zc_user2`@`%` |
+----------------------------------------------+
call test.zc_prole4();
SELECT CURRENT_ROLE();
+----------------+
| CURRENT_ROLE() |
+----------------+
| NONE           |
+----------------+
####set role default role####
CONNECT zc_role2
##mysql执行这条语句之前要重置role2的密码ALTER USER zc_role2 IDENTIFIED BY ''
use test;
DROP PROCEDURE zc_prole//
CREATE PROCEDURE zc_prole()
BEGIN
	SET DEFAULT ROLE zc_role1 to zc_role2;
end;
//
call zc_prole();
SELECT CURRENT_ROLE();
+----------------+
| CURRENT_ROLE() |
+----------------+
| `zc_role1`@`%` |
+----------------+
use test;
DROP PROCEDURE zc_prole5//
CREATE PROCEDURE zc_prole5()
BEGIN
	PREPARE stmt1 FROM 'SET DEFAULT ROLE zc_role1 to zc_role2';
	EXECUTE stmt1;
	DEALLOCATE PREPARE stmt1;
end;
//
DROP PROCEDURE zc_prole6//
CREATE PROCEDURE zc_prole6()
BEGIN
	PREPARE stmt1 FROM 'SET DEFAULT ROLE zc_role1,zc_role3 to zc_role2';
	EXECUTE stmt1;
	DEALLOCATE PREPARE stmt1;
end;
//
DROP PROCEDURE zc_prole7//
CREATE PROCEDURE zc_prole7()
BEGIN
	PREPARE stmt1 FROM 'SET DEFAULT ROLE all to zc_role2';
	EXECUTE stmt1;
	DEALLOCATE PREPARE stmt1;
end;
//
DROP PROCEDURE zc_prole8//
CREATE PROCEDURE zc_prole8()
BEGIN
	PREPARE stmt1 FROM 'SET DEFAULT ROLE NONE to zc_role2';
	EXECUTE stmt1;
	DEALLOCATE PREPARE stmt1;
end;
//
call test.zc_prole5();
SELECT CURRENT_ROLE();
+----------------+
| CURRENT_ROLE() |
+----------------+
| `zc_role1`@`%` |
+----------------+
call test.zc_prole6();
SELECT CURRENT_ROLE();
+-------------------------------+
| CURRENT_ROLE()                |
+-------------------------------+
| `zc_role3`@`%`,`zc_role1`@`%` |
+-------------------------------+
call test.zc_prole7();
SELECT CURRENT_ROLE();
+----------------------------------------------+
| CURRENT_ROLE()                               |
+----------------------------------------------+
| `zc_role3`@`%`,`zc_role1`@`%`,`zc_user2`@`%` |
+----------------------------------------------+
call test.zc_prole8();
SELECT CURRENT_ROLE();
+----------------+
| CURRENT_ROLE() |
+----------------+
| NONE           |
+----------------+
CONNECT DEFAULT
SELECT * FROM mysql.default_roles ;
+------+------+-------------------+-------------------+
| HOST | USER | DEFAULT_ROLE_HOST | DEFAULT_ROLE_USER |
+------+------+-------------------+-------------------+
+------+------+-------------------+-------------------+
####为其他用户设置default ROLE
DROP user zc_test1;
DROP user zc_test2;
DROP user zc_test3;
CREATE user zc_test1;
GRANT CREATE USER ON *.* to zc_test1;
CREATE user zc_test2;
GRANT UPDATE ON mysql.* to zc_test2;
CREATE user zc_test3;
GRANT CREATE on test.* to zc_role1;
GRANT zc_role1 to zc_test1,zc_test2,zc_test3;
set DEFAULT role zc_role1 to zc_test1;
set DEFAULT role zc_role1 to zc_test2;
set DEFAULT role zc_role1 to zc_test3;
GRANT ALTER ROUTINE ON *.* TO 'zc_test1'@'%';
GRANT CREATE ROUTINE ON *.* TO 'zc_test1'@'%';
GRANT ALTER ROUTINE ON *.* TO 'zc_test2'@'%';
GRANT CREATE ROUTINE ON *.* TO 'zc_test2'@'%';
grant EXECUTE ON PROCEDURE test.zc_prole5 to 'zc_test1'@'%';
grant EXECUTE ON PROCEDURE test.zc_prole6 to 'zc_test1'@'%';
grant EXECUTE ON PROCEDURE test.zc_prole7 to 'zc_test1'@'%';
grant EXECUTE ON PROCEDURE test.zc_prole8 to 'zc_test1'@'%';
grant EXECUTE ON PROCEDURE test.zc_prole1 to 'zc_test2'@'%';
grant EXECUTE ON PROCEDURE test.zc_prole2 to 'zc_test2'@'%';
grant EXECUTE ON PROCEDURE test.zc_prole3 to 'zc_test2'@'%';
grant EXECUTE ON PROCEDURE test.zc_prole4 to 'zc_test2'@'%';
grant EXECUTE ON PROCEDURE test.zc_prole5 to 'zc_test2'@'%';
grant EXECUTE ON PROCEDURE test.zc_prole6 to 'zc_test2'@'%';
grant EXECUTE ON PROCEDURE test.zc_prole7 to 'zc_test2'@'%';
grant EXECUTE ON PROCEDURE test.zc_prole8 to 'zc_test2'@'%';
grant EXECUTE ON PROCEDURE test.zc_prole1 to 'zc_test3'@'%';
grant EXECUTE ON PROCEDURE test.zc_prole2 to 'zc_test3'@'%';
grant EXECUTE ON PROCEDURE test.zc_prole3 to 'zc_test3'@'%';
grant EXECUTE ON PROCEDURE test.zc_prole4 to 'zc_test3'@'%';
grant EXECUTE ON PROCEDURE test.zc_prole5 to 'zc_test3'@'%';
grant EXECUTE ON PROCEDURE test.zc_prole6 to 'zc_test3'@'%';
grant EXECUTE ON PROCEDURE test.zc_prole7 to 'zc_test3'@'%';
grant EXECUTE ON PROCEDURE test.zc_prole8 to 'zc_test3'@'%';
####拥有CREATE USER权限
CONNECT zc_test1
##mysql中用户创建存储程序需要CREATE ROUTINE权限，ob不支持
##GRANT CREATE ROUTINE,ALTER ROUTINE,EXECUTE ON test.* to zc_test1;
use test;
DROP PROCEDURE zc_prole//
CREATE PROCEDURE zc_prole()
BEGIN
	SET DEFAULT ROLE zc_role1 to zc_user1;
end;
//
call zc_prole();
SELECT CURRENT_ROLE();
+----------------+
| CURRENT_ROLE() |
+----------------+
| `zc_role1`@`%` |
+----------------+
use test;
DROP PROCEDURE zc_prole1//
CREATE PROCEDURE zc_prole1()
BEGIN
	SET DEFAULT ROLE zc_role1 to zc_user1;
end;
//
DROP PROCEDURE zc_prole2//
CREATE PROCEDURE zc_prole2()
BEGIN
	SET DEFAULT ROLE zc_role1,zc_role2 to zc_user1;
end;
//
DROP PROCEDURE zc_prole3//
CREATE PROCEDURE zc_prole3()
BEGIN
	SET DEFAULT ROLE all to zc_user1;
end;
//
DROP PROCEDURE zc_prole4//
CREATE PROCEDURE zc_prole4()
BEGIN
	SET DEFAULT ROLE NONE to zc_user1;
end;
//
call test.zc_prole1();
SELECT CURRENT_ROLE();
+----------------+
| CURRENT_ROLE() |
+----------------+
| `zc_role1`@`%` |
+----------------+
call test.zc_prole2();
SELECT CURRENT_ROLE();
+-------------------------------+
| CURRENT_ROLE()                |
+-------------------------------+
| `zc_role2`@`%`,`zc_role1`@`%` |
+-------------------------------+
call test.zc_prole3();
SELECT CURRENT_ROLE();
+----------------------------------------------+
| CURRENT_ROLE()                               |
+----------------------------------------------+
| `zc_role2`@`%`,`zc_role1`@`%`,`zc_user2`@`%` |
+----------------------------------------------+
call test.zc_prole4();
SELECT CURRENT_ROLE();
+----------------+
| CURRENT_ROLE() |
+----------------+
| NONE           |
+----------------+
call test.zc_prole5();
SELECT CURRENT_ROLE();
+----------------+
| CURRENT_ROLE() |
+----------------+
| `zc_role1`@`%` |
+----------------+
call test.zc_prole6();
SELECT CURRENT_ROLE();
+-------------------------------+
| CURRENT_ROLE()                |
+-------------------------------+
| `zc_role3`@`%`,`zc_role1`@`%` |
+-------------------------------+
call test.zc_prole7();
SELECT CURRENT_ROLE();
+----------------------------------------------+
| CURRENT_ROLE()                               |
+----------------------------------------------+
| `zc_role3`@`%`,`zc_role1`@`%`,`zc_user2`@`%` |
+----------------------------------------------+
call test.zc_prole8();
SELECT CURRENT_ROLE();
+----------------+
| CURRENT_ROLE() |
+----------------+
| NONE           |
+----------------+
CONNECT DEFAULT
SELECT * FROM mysql.default_roles ;
+------+----------+-------------------+-------------------+
| HOST | USER     | DEFAULT_ROLE_HOST | DEFAULT_ROLE_USER |
+------+----------+-------------------+-------------------+
| %    | zc_test1 | %                 | zc_role1          |
| %    | zc_test2 | %                 | zc_role1          |
| %    | zc_test3 | %                 | zc_role1          |
+------+----------+-------------------+-------------------+
grant EXECUTE ON PROCEDURE test.zc_prole1 to 'zc_test2'@'%';
grant EXECUTE ON PROCEDURE test.zc_prole2 to 'zc_test2'@'%';
grant EXECUTE ON PROCEDURE test.zc_prole3 to 'zc_test2'@'%';
grant EXECUTE ON PROCEDURE test.zc_prole4 to 'zc_test2'@'%';
####拥有mysql库的UPDATE权限
CONNECT zc_test2
##mysql中用户创建存储程序需要CREATE ROUTINE权限，ob不支持
##GRANT EXECUTE ON test.* to zc_test2;
DROP PROCEDURE test.zc_prole5//
CREATE PROCEDURE test.zc_prole5()
BEGIN
	SET DEFAULT ROLE zc_role1 to zc_role2;
end;
//
DROP PROCEDURE test.zc_prole6//
CREATE PROCEDURE test.zc_prole6()
BEGIN
	SET DEFAULT ROLE zc_role1,zc_role3 to zc_role2;
end;
//
DROP PROCEDURE test.zc_prole7//
CREATE PROCEDURE test.zc_prole7()
BEGIN
	SET DEFAULT ROLE all to zc_role2;
end;
//
DROP PROCEDURE test.zc_prole8//
CREATE PROCEDURE test.zc_prole8()
BEGIN
	SET DEFAULT ROLE NONE to zc_role2;
end;
//
call test.zc_prole1();
SELECT CURRENT_ROLE();
+----------------+
| CURRENT_ROLE() |
+----------------+
| `zc_role1`@`%` |
+----------------+
call test.zc_prole2();
SELECT CURRENT_ROLE();
+-------------------------------+
| CURRENT_ROLE()                |
+-------------------------------+
| `zc_role2`@`%`,`zc_role1`@`%` |
+-------------------------------+
call test.zc_prole3();
SELECT CURRENT_ROLE();
+----------------------------------------------+
| CURRENT_ROLE()                               |
+----------------------------------------------+
| `zc_role2`@`%`,`zc_role1`@`%`,`zc_user2`@`%` |
+----------------------------------------------+
call test.zc_prole4();
SELECT CURRENT_ROLE();
+----------------+
| CURRENT_ROLE() |
+----------------+
| NONE           |
+----------------+
call test.zc_prole5();
SELECT CURRENT_ROLE();
+----------------+
| CURRENT_ROLE() |
+----------------+
| `zc_role1`@`%` |
+----------------+
call test.zc_prole6();
SELECT CURRENT_ROLE();
+-------------------------------+
| CURRENT_ROLE()                |
+-------------------------------+
| `zc_role3`@`%`,`zc_role1`@`%` |
+-------------------------------+
call test.zc_prole7();
SELECT CURRENT_ROLE();
+----------------------------------------------+
| CURRENT_ROLE()                               |
+----------------------------------------------+
| `zc_role3`@`%`,`zc_role1`@`%`,`zc_user2`@`%` |
+----------------------------------------------+
call test.zc_prole8();
SELECT CURRENT_ROLE();
+----------------+
| CURRENT_ROLE() |
+----------------+
| NONE           |
+----------------+
CONNECT DEFAULT
SELECT * FROM mysql.default_roles ;
+------+----------+-------------------+-------------------+
| HOST | USER     | DEFAULT_ROLE_HOST | DEFAULT_ROLE_USER |
+------+----------+-------------------+-------------------+
| %    | zc_test1 | %                 | zc_role1          |
| %    | zc_test2 | %                 | zc_role1          |
| %    | zc_test3 | %                 | zc_role1          |
+------+----------+-------------------+-------------------+
grant EXECUTE ON PROCEDURE test.zc_prole1 to 'zc_test3'@'%';
grant EXECUTE ON PROCEDURE test.zc_prole2 to 'zc_test3'@'%';
grant EXECUTE ON PROCEDURE test.zc_prole3 to 'zc_test3'@'%';
grant EXECUTE ON PROCEDURE test.zc_prole4 to 'zc_test3'@'%';
grant EXECUTE ON PROCEDURE test.zc_prole5 to 'zc_test3'@'%';
grant EXECUTE ON PROCEDURE test.zc_prole6 to 'zc_test3'@'%';
grant EXECUTE ON PROCEDURE test.zc_prole7 to 'zc_test3'@'%';
grant EXECUTE ON PROCEDURE test.zc_prole8 to 'zc_test3'@'%';
####未拥有这两个相关权限
CONNECT zc_test3
##mysql中用户创建存储程序需要CREATE ROUTINE权限，ob不支持
##GRANT EXECUTE ON test.* to zc_test3;
call test.zc_prole1();
SELECT CURRENT_ROLE();
+----------------+
| CURRENT_ROLE() |
+----------------+
| `zc_role1`@`%` |
+----------------+
call test.zc_prole2();
SELECT CURRENT_ROLE();
+-------------------------------+
| CURRENT_ROLE()                |
+-------------------------------+
| `zc_role2`@`%`,`zc_role1`@`%` |
+-------------------------------+
call test.zc_prole3();
SELECT CURRENT_ROLE();
+----------------------------------------------+
| CURRENT_ROLE()                               |
+----------------------------------------------+
| `zc_role2`@`%`,`zc_role1`@`%`,`zc_user2`@`%` |
+----------------------------------------------+
call test.zc_prole4();
SELECT CURRENT_ROLE();
+----------------+
| CURRENT_ROLE() |
+----------------+
| NONE           |
+----------------+
call test.zc_prole5();
SELECT CURRENT_ROLE();
+----------------+
| CURRENT_ROLE() |
+----------------+
| `zc_role1`@`%` |
+----------------+
call test.zc_prole6();
SELECT CURRENT_ROLE();
+-------------------------------+
| CURRENT_ROLE()                |
+-------------------------------+
| `zc_role3`@`%`,`zc_role1`@`%` |
+-------------------------------+
call test.zc_prole7();
SELECT CURRENT_ROLE();
+----------------------------------------------+
| CURRENT_ROLE()                               |
+----------------------------------------------+
| `zc_role3`@`%`,`zc_role1`@`%`,`zc_user2`@`%` |
+----------------------------------------------+
call test.zc_prole8();
SELECT CURRENT_ROLE();
+----------------+
| CURRENT_ROLE() |
+----------------+
| NONE           |
+----------------+
CONNECT DEFAULT
SELECT * FROM mysql.default_roles ;
+------+----------+-------------------+-------------------+
| HOST | USER     | DEFAULT_ROLE_HOST | DEFAULT_ROLE_USER |
+------+----------+-------------------+-------------------+
| %    | zc_test1 | %                 | zc_role1          |
| %    | zc_test2 | %                 | zc_role1          |
| %    | zc_test3 | %                 | zc_role1          |
+------+----------+-------------------+-------------------+
#### ALTER USER DEFAULT ROLE ####
DROP PROCEDURE zc_prole9//
CREATE PROCEDURE zc_prole9()
BEGIN
	ALTER USER zc_user1 DEFAULT ROLE zc_role1;
end;
//
DROP PROCEDURE zc_prole10//
CREATE PROCEDURE zc_prole10()
BEGIN
	ALTER USER zc_user1 DEFAULT ROLE zc_role1,zc_user2;
end;
//
DROP PROCEDURE zc_prole11//
CREATE PROCEDURE zc_prole11()
BEGIN
	ALTER USER zc_user1 DEFAULT ROLE all;
end;
//
DROP PROCEDURE zc_prole12//
CREATE PROCEDURE zc_prole12()
BEGIN
	ALTER USER zc_user1 DEFAULT ROLE NONE;
end;
//
DROP PROCEDURE zc_prole13//
CREATE PROCEDURE zc_prole13()
BEGIN
	ALTER USER zc_role2 DEFAULT ROLE zc_role1;
end;
//
DROP PROCEDURE zc_prole14//
CREATE PROCEDURE zc_prole14()
BEGIN
	ALTER USER zc_role2 DEFAULT ROLE zc_role1,zc_user2;
end;
//
DROP PROCEDURE zc_prole15//
CREATE PROCEDURE zc_prole15()
BEGIN
	ALTER USER zc_role2 DEFAULT ROLE all;
end;
//
DROP PROCEDURE zc_prole16//
CREATE PROCEDURE zc_prole16()
BEGIN
	ALTER USER zc_role2 DEFAULT ROLE NONE;
end;
//
grant EXECUTE ON PROCEDURE test.zc_prole9 to 'zc_user1'@'%';
grant EXECUTE ON PROCEDURE test.zc_prole10 to 'zc_user1'@'%';
grant EXECUTE ON PROCEDURE test.zc_prole11 to 'zc_user1'@'%';
grant EXECUTE ON PROCEDURE test.zc_prole12 to 'zc_user1'@'%';
grant EXECUTE ON PROCEDURE test.zc_prole13 to 'zc_user1'@'%';
grant EXECUTE ON PROCEDURE test.zc_prole14 to 'zc_user1'@'%';
grant EXECUTE ON PROCEDURE test.zc_prole15 to 'zc_user1'@'%';
grant EXECUTE ON PROCEDURE test.zc_prole16 to 'zc_user1'@'%';
grant EXECUTE ON PROCEDURE test.zc_prole9 to 'zc_role2'@'%';
grant EXECUTE ON PROCEDURE test.zc_prole10 to 'zc_role2'@'%';
grant EXECUTE ON PROCEDURE test.zc_prole11 to 'zc_role2'@'%';
grant EXECUTE ON PROCEDURE test.zc_prole12 to 'zc_role2'@'%';
grant EXECUTE ON PROCEDURE test.zc_prole13 to 'zc_role2'@'%';
grant EXECUTE ON PROCEDURE test.zc_prole14 to 'zc_role2'@'%';
grant EXECUTE ON PROCEDURE test.zc_prole15 to 'zc_role2'@'%';
grant EXECUTE ON PROCEDURE test.zc_prole16 to 'zc_role2'@'%';
####执行(用户为另一个用户设置默认角色可以通过存储过程直接设置而不需要set default相关权限)
CONNECT zc_user1
call test.zc_prole9();
SELECT CURRENT_ROLE();
+----------------+
| CURRENT_ROLE() |
+----------------+
| `zc_role1`@`%` |
+----------------+
call test.zc_prole10();
SELECT CURRENT_ROLE();
+-------------------------------+
| CURRENT_ROLE()                |
+-------------------------------+
| `zc_role1`@`%`,`zc_user2`@`%` |
+-------------------------------+
call test.zc_prole11();
SELECT CURRENT_ROLE();
+----------------------------------------------+
| CURRENT_ROLE()                               |
+----------------------------------------------+
| `zc_role2`@`%`,`zc_role1`@`%`,`zc_user2`@`%` |
+----------------------------------------------+
call test.zc_prole12();
SELECT CURRENT_ROLE();
+----------------+
| CURRENT_ROLE() |
+----------------+
| NONE           |
+----------------+
call test.zc_prole13();
SELECT CURRENT_ROLE();
+----------------+
| CURRENT_ROLE() |
+----------------+
| `zc_role1`@`%` |
+----------------+
call test.zc_prole14();
SELECT CURRENT_ROLE();
+-------------------------------+
| CURRENT_ROLE()                |
+-------------------------------+
| `zc_role1`@`%`,`zc_user2`@`%` |
+-------------------------------+
call test.zc_prole15();
SELECT CURRENT_ROLE();
+----------------------------------------------+
| CURRENT_ROLE()                               |
+----------------------------------------------+
| `zc_role3`@`%`,`zc_role1`@`%`,`zc_user2`@`%` |
+----------------------------------------------+
call test.zc_prole16();
SELECT CURRENT_ROLE();
+----------------+
| CURRENT_ROLE() |
+----------------+
| NONE           |
+----------------+
CONNECT zc_role2
call test.zc_prole9();
SELECT CURRENT_ROLE();
+----------------+
| CURRENT_ROLE() |
+----------------+
| `zc_role1`@`%` |
+----------------+
call test.zc_prole10();
SELECT CURRENT_ROLE();
+-------------------------------+
| CURRENT_ROLE()                |
+-------------------------------+
| `zc_role1`@`%`,`zc_user2`@`%` |
+-------------------------------+
call test.zc_prole11();
SELECT CURRENT_ROLE();
+----------------------------------------------+
| CURRENT_ROLE()                               |
+----------------------------------------------+
| `zc_role2`@`%`,`zc_role1`@`%`,`zc_user2`@`%` |
+----------------------------------------------+
call test.zc_prole12();
SELECT CURRENT_ROLE();
+----------------+
| CURRENT_ROLE() |
+----------------+
| NONE           |
+----------------+
call test.zc_prole13();
SELECT CURRENT_ROLE();
+----------------+
| CURRENT_ROLE() |
+----------------+
| `zc_role1`@`%` |
+----------------+
call test.zc_prole14();
SELECT CURRENT_ROLE();
+-------------------------------+
| CURRENT_ROLE()                |
+-------------------------------+
| `zc_role1`@`%`,`zc_user2`@`%` |
+-------------------------------+
call test.zc_prole15();
SELECT CURRENT_ROLE();
+----------------------------------------------+
| CURRENT_ROLE()                               |
+----------------------------------------------+
| `zc_role3`@`%`,`zc_role1`@`%`,`zc_user2`@`%` |
+----------------------------------------------+
call test.zc_prole16();
SELECT CURRENT_ROLE();
+----------------+
| CURRENT_ROLE() |
+----------------+
| NONE           |
+----------------+
CONNECT DEFAULT
SELECT * FROM mysql.default_roles ;
+------+----------+-------------------+-------------------+
| HOST | USER     | DEFAULT_ROLE_HOST | DEFAULT_ROLE_USER |
+------+----------+-------------------+-------------------+
| %    | zc_test1 | %                 | zc_role1          |
| %    | zc_test2 | %                 | zc_role1          |
| %    | zc_test3 | %                 | zc_role1          |
+------+----------+-------------------+-------------------+
#### FUNCTION TRIGGER(not support) ####
####ob在create阶段就会报错，mysql是在执行阶段报错
drop table test.zc_t;
CREATE table test.zc_t(a int);
CONNECT zc_user1
set role zc_role1;
use test;
DROP FUNCTION zc_frole//
CREATE FUNCTION zc_frole() RETURNS int
BEGIN
	ALTER USER zc_user1 DEFAULT ROLE zc_role1;
	RETURN 1;
end;
//
ERROR HY000: Explicit or implicit commit is not allowed in stored function or trigger.
DROP FUNCTION zc_frole//
CREATE FUNCTION zc_frole() RETURNS int
BEGIN
	set DEFAULT ROLE zc_role1 to zc_user1;
	RETURN 1;
end;
//
ERROR HY000: Explicit or implicit commit is not allowed in stored function or trigger.
DROP TRIGGER zc_trole//
CREATE TRIGGER zc_trole BEFORE INSERT on test.zc_t for EACH ROW
BEGIN
	ALTER USER zc_user1 DEFAULT ROLE zc_role1;
end;
//
ERROR HY000: Explicit or implicit commit is not allowed in stored function or trigger.
DROP TRIGGER zc_trole//
CREATE TRIGGER zc_trole BEFORE INSERT on test.zc_t for EACH ROW
BEGIN
	set DEFAULT ROLE zc_role1 to zc_user1;
end;
//
ERROR HY000: Explicit or implicit commit is not allowed in stored function or trigger.
SELECT CURRENT_ROLE();
+----------------+
| CURRENT_ROLE() |
+----------------+
| NONE           |
+----------------+
CONNECT DEFAULT
SELECT * FROM mysql.default_roles ;
+------+----------+-------------------+-------------------+
| HOST | USER     | DEFAULT_ROLE_HOST | DEFAULT_ROLE_USER |
+------+----------+-------------------+-------------------+
| %    | zc_test1 | %                 | zc_role1          |
| %    | zc_test2 | %                 | zc_role1          |
| %    | zc_test3 | %                 | zc_role1          |
+------+----------+-------------------+-------------------+
########## SET ROLE ##########
####目前来看pl中的set role，执行后激活的是该pl创建者的role
CONNECT zc_user1
DROP PROCEDURE test.zc_prole17//
CREATE PROCEDURE test.zc_prole17()
BEGIN
	SET ROLE zc_role1;
end;
//
SELECT CURRENT_ROLE();//
+----------------+
| CURRENT_ROLE() |
+----------------+
| NONE           |
+----------------+
DROP PROCEDURE test.zc_prole18//
CREATE PROCEDURE test.zc_prole18()
BEGIN
	SET ROLE DEFAULT;
end;
//
SELECT CURRENT_ROLE();//
+----------------+
| CURRENT_ROLE() |
+----------------+
| NONE           |
+----------------+
DROP PROCEDURE test.zc_prole19//
CREATE PROCEDURE test.zc_prole19()
BEGIN
	SET ROLE all;
end;
//
SELECT CURRENT_ROLE();//
+----------------+
| CURRENT_ROLE() |
+----------------+
| NONE           |
+----------------+
DROP PROCEDURE test.zc_prole20//
CREATE PROCEDURE test.zc_prole20()
BEGIN
	SET ROLE all except zc_role1;
end;
//
SELECT CURRENT_ROLE();//
+----------------+
| CURRENT_ROLE() |
+----------------+
| NONE           |
+----------------+
DROP PROCEDURE test.zc_prole21//
CREATE PROCEDURE test.zc_prole21()
BEGIN
	SET ROLE NONE;
end;
//
SELECT CURRENT_ROLE();//
+----------------+
| CURRENT_ROLE() |
+----------------+
| NONE           |
+----------------+
CONNECT zc_user1
SELECT CURRENT_ROLE();
+----------------+
| CURRENT_ROLE() |
+----------------+
| NONE           |
+----------------+
call test.zc_prole17();
SELECT CURRENT_ROLE();
+----------------+
| CURRENT_ROLE() |
+----------------+
| `zc_role1`@`%` |
+----------------+
call test.zc_prole18();
SELECT CURRENT_ROLE();
+----------------+
| CURRENT_ROLE() |
+----------------+
| NONE           |
+----------------+
call test.zc_prole19();
SELECT CURRENT_ROLE();
+----------------------------------------------+
| CURRENT_ROLE()                               |
+----------------------------------------------+
| `zc_role2`@`%`,`zc_role1`@`%`,`zc_user2`@`%` |
+----------------------------------------------+
call test.zc_prole20();
SELECT CURRENT_ROLE();
+-------------------------------+
| CURRENT_ROLE()                |
+-------------------------------+
| `zc_role2`@`%`,`zc_user2`@`%` |
+-------------------------------+
call test.zc_prole21();
SELECT CURRENT_ROLE();
+----------------+
| CURRENT_ROLE() |
+----------------+
| NONE           |
+----------------+
CONNECT DEFAULT
grant EXECUTE ON PROCEDURE test.zc_prole17 to 'zc_role2'@'%';
grant EXECUTE ON PROCEDURE test.zc_prole18 to 'zc_role2'@'%';
grant EXECUTE ON PROCEDURE test.zc_prole19 to 'zc_role2'@'%';
grant EXECUTE ON PROCEDURE test.zc_prole20 to 'zc_role2'@'%';
grant EXECUTE ON PROCEDURE test.zc_prole21 to 'zc_role2'@'%';
####role2执行预期不会有任何效果
CONNECT zc_role2
SELECT CURRENT_ROLE();
+----------------+
| CURRENT_ROLE() |
+----------------+
| NONE           |
+----------------+
call test.zc_prole17();
SELECT CURRENT_ROLE();
+----------------+
| CURRENT_ROLE() |
+----------------+
| NONE           |
+----------------+
call test.zc_prole18();
SELECT CURRENT_ROLE();
+----------------+
| CURRENT_ROLE() |
+----------------+
| NONE           |
+----------------+
call test.zc_prole19();
SELECT CURRENT_ROLE();
+----------------+
| CURRENT_ROLE() |
+----------------+
| NONE           |
+----------------+
call test.zc_prole20();
SELECT CURRENT_ROLE();
+----------------+
| CURRENT_ROLE() |
+----------------+
| NONE           |
+----------------+
call test.zc_prole21();
SELECT CURRENT_ROLE();
+----------------+
| CURRENT_ROLE() |
+----------------+
| NONE           |
+----------------+
####function
CONNECT zc_user1
DROP FUNCTION test.zc_frole1//
CREATE FUNCTION test.zc_frole1() RETURNS int
BEGIN
	set ROLE zc_role1;
	RETURN 1;
end;
//
SELECT CURRENT_ROLE();//
+----------------+
| CURRENT_ROLE() |
+----------------+
| NONE           |
+----------------+
DROP FUNCTION test.zc_frole2//
CREATE FUNCTION test.zc_frole2() RETURNS int
BEGIN
	SET ROLE DEFAULT;
	RETURN 2;
end;
//
SELECT CURRENT_ROLE();//
+----------------+
| CURRENT_ROLE() |
+----------------+
| NONE           |
+----------------+
DROP FUNCTION test.zc_frole3//
CREATE FUNCTION test.zc_frole3() RETURNS int
BEGIN
	SET ROLE all;
	RETURN 3;
end;
//
SELECT CURRENT_ROLE();//
+----------------+
| CURRENT_ROLE() |
+----------------+
| NONE           |
+----------------+
DROP FUNCTION test.zc_frole4//
CREATE FUNCTION test.zc_frole4() RETURNS int
BEGIN
	SET ROLE all except zc_role1;
	RETURN 4;
end;
//
SELECT CURRENT_ROLE();//
+----------------+
| CURRENT_ROLE() |
+----------------+
| NONE           |
+----------------+
DROP FUNCTION test.zc_frole5//
CREATE FUNCTION test.zc_frole5() RETURNS int
BEGIN
	SET ROLE NONE;
	RETURN 5;
end;
//
SELECT CURRENT_ROLE();//
+----------------+
| CURRENT_ROLE() |
+----------------+
| NONE           |
+----------------+
SELECT test.zc_frole1();
+------------------+
| test.zc_frole1() |
+------------------+
|                1 |
+------------------+
SELECT CURRENT_ROLE();
+----------------+
| CURRENT_ROLE() |
+----------------+
| `zc_role1`@`%` |
+----------------+
SELECT test.zc_frole2();
+------------------+
| test.zc_frole2() |
+------------------+
|                2 |
+------------------+
SELECT CURRENT_ROLE();
+----------------+
| CURRENT_ROLE() |
+----------------+
| NONE           |
+----------------+
SELECT test.zc_frole3();
+------------------+
| test.zc_frole3() |
+------------------+
|                3 |
+------------------+
SELECT CURRENT_ROLE();
+----------------------------------------------+
| CURRENT_ROLE()                               |
+----------------------------------------------+
| `zc_role2`@`%`,`zc_role1`@`%`,`zc_user2`@`%` |
+----------------------------------------------+
SELECT test.zc_frole4();
+------------------+
| test.zc_frole4() |
+------------------+
|                4 |
+------------------+
SELECT CURRENT_ROLE();
+-------------------------------+
| CURRENT_ROLE()                |
+-------------------------------+
| `zc_role2`@`%`,`zc_user2`@`%` |
+-------------------------------+
SELECT test.zc_frole5();
+------------------+
| test.zc_frole5() |
+------------------+
|                5 |
+------------------+
SELECT CURRENT_ROLE();
+----------------+
| CURRENT_ROLE() |
+----------------+
| NONE           |
+----------------+
CONNECT DEFAULT
grant EXECUTE ON PROCEDURE test.zc_frole1 to 'zc_role2'@'%';
grant EXECUTE ON PROCEDURE test.zc_frole2 to 'zc_role2'@'%';
grant EXECUTE ON PROCEDURE test.zc_frole3 to 'zc_role2'@'%';
grant EXECUTE ON PROCEDURE test.zc_frole4 to 'zc_role2'@'%';
grant EXECUTE ON PROCEDURE test.zc_frole5 to 'zc_role2'@'%';
####role2执行预期不会有任何效果
CONNECT zc_role2
SELECT test.zc_frole1();
+------------------+
| test.zc_frole1() |
+------------------+
|                1 |
+------------------+
SELECT CURRENT_ROLE();
+----------------+
| CURRENT_ROLE() |
+----------------+
| NONE           |
+----------------+
SELECT test.zc_frole2();
+------------------+
| test.zc_frole2() |
+------------------+
|                2 |
+------------------+
SELECT CURRENT_ROLE();
+----------------+
| CURRENT_ROLE() |
+----------------+
| NONE           |
+----------------+
SELECT test.zc_frole3();
+------------------+
| test.zc_frole3() |
+------------------+
|                3 |
+------------------+
SELECT CURRENT_ROLE();
+----------------+
| CURRENT_ROLE() |
+----------------+
| NONE           |
+----------------+
SELECT test.zc_frole4();
+------------------+
| test.zc_frole4() |
+------------------+
|                4 |
+------------------+
SELECT CURRENT_ROLE();
+----------------+
| CURRENT_ROLE() |
+----------------+
| NONE           |
+----------------+
SELECT test.zc_frole5();
+------------------+
| test.zc_frole5() |
+------------------+
|                5 |
+------------------+
SELECT CURRENT_ROLE();
+----------------+
| CURRENT_ROLE() |
+----------------+
| NONE           |
+----------------+
####TRIGGER
CONNECT DEFAULT
SELECT * FROM mysql.default_roles ;
+------+----------+-------------------+-------------------+
| HOST | USER     | DEFAULT_ROLE_HOST | DEFAULT_ROLE_USER |
+------+----------+-------------------+-------------------+
| %    | zc_test1 | %                 | zc_role1          |
| %    | zc_test2 | %                 | zc_role1          |
| %    | zc_test3 | %                 | zc_role1          |
+------+----------+-------------------+-------------------+
grant INSERT,UPDATE,DELETE,SELECT,TRIGGER on test.zc_t to zc_user1;
grant INSERT,UPDATE,DELETE,SELECT on test.zc_t to zc_role2;
CONNECT zc_user1
use test;
DROP TRIGGER test.zc_trole//
CREATE TRIGGER test.zc_trole AFTER INSERT on test.zc_t for EACH ROW
BEGIN
	set ROLE zc_role1;
end;
//
SELECT CURRENT_ROLE();
+----------------+
| CURRENT_ROLE() |
+----------------+
| NONE           |
+----------------+
insert into test.zc_t values (1);
SELECT CURRENT_ROLE();
+----------------+
| CURRENT_ROLE() |
+----------------+
| `zc_role1`@`%` |
+----------------+
select * from test.zc_t;
+------+
| a    |
+------+
|    1 |
+------+
CONNECT zc_role2
SELECT CURRENT_ROLE();
+----------------+
| CURRENT_ROLE() |
+----------------+
| NONE           |
+----------------+
insert into test.zc_t values (1);
SELECT CURRENT_ROLE();
+----------------+
| CURRENT_ROLE() |
+----------------+
| NONE           |
+----------------+
select * from test.zc_t;
+------+
| a    |
+------+
|    1 |
|    1 |
+------+
CONNECT zc_user1
use test;
DROP TRIGGER test.zc_trole//
CREATE TRIGGER test.zc_trole AFTER UPDATE on test.zc_t for EACH ROW
BEGIN
	set ROLE NONE;
end;
//
SELECT CURRENT_ROLE();
+----------------+
| CURRENT_ROLE() |
+----------------+
| `zc_role1`@`%` |
+----------------+
UPDATE test.zc_t set a = 2;
SELECT CURRENT_ROLE();
+----------------+
| CURRENT_ROLE() |
+----------------+
| NONE           |
+----------------+
select * from test.zc_t;
+------+
| a    |
+------+
|    2 |
|    2 |
+------+
CONNECT zc_role2
SELECT CURRENT_ROLE();
+----------------+
| CURRENT_ROLE() |
+----------------+
| NONE           |
+----------------+
UPDATE test.zc_t set a = 3;
SELECT CURRENT_ROLE();
+----------------+
| CURRENT_ROLE() |
+----------------+
| NONE           |
+----------------+
select * from test.zc_t;
+------+
| a    |
+------+
|    3 |
|    3 |
+------+
CONNECT zc_user1
use test;
DROP TRIGGER test.zc_trole//
CREATE TRIGGER test.zc_trole AFTER DELETE on test.zc_t for EACH ROW
BEGIN
	set ROLE all;
end;
//
SELECT CURRENT_ROLE();
+----------------+
| CURRENT_ROLE() |
+----------------+
| NONE           |
+----------------+
delete from test.zc_t;
SELECT CURRENT_ROLE();
+----------------------------------------------+
| CURRENT_ROLE()                               |
+----------------------------------------------+
| `zc_role2`@`%`,`zc_role1`@`%`,`zc_user2`@`%` |
+----------------------------------------------+
select * from test.zc_t;
+------+
| a    |
+------+
+------+
CONNECT zc_role2
SELECT CURRENT_ROLE();
+----------------+
| CURRENT_ROLE() |
+----------------+
| NONE           |
+----------------+
insert into test.zc_t values (1);
delete from test.zc_t;
SELECT CURRENT_ROLE();
+----------------+
| CURRENT_ROLE() |
+----------------+
| NONE           |
+----------------+
select * from test.zc_t;
+------+
| a    |
+------+
+------+
CONNECT DEFAULT
SELECT * FROM mysql.default_roles ;
+------+----------+-------------------+-------------------+
| HOST | USER     | DEFAULT_ROLE_HOST | DEFAULT_ROLE_USER |
+------+----------+-------------------+-------------------+
| %    | zc_test1 | %                 | zc_role1          |
| %    | zc_test2 | %                 | zc_role1          |
| %    | zc_test3 | %                 | zc_role1          |
+------+----------+-------------------+-------------------+
DROP TRIGGER test.zc_trole;
drop table test.zc_t;
REVOKE INSERT,UPDATE,DELETE,SELECT on test.zc_t FROM zc_user1;
REVOKE INSERT,UPDATE,DELETE,SELECT on test.zc_t FROM zc_role2;
####补充问题场景：将角色zc_role1从zc_role2角色中撤销再执行zc_prole17过程，预期不报错
##待修复
CONNECT DEFAULT
REVOKE zc_role1 from zc_role2;
CONNECT zc_role2
SELECT CURRENT_ROLE();
+----------------+
| CURRENT_ROLE() |
+----------------+
| NONE           |
+----------------+
call test.zc_prole17();
CONNECT DEFAULT
SELECT * FROM mysql.default_roles ;
+------+----------+-------------------+-------------------+
| HOST | USER     | DEFAULT_ROLE_HOST | DEFAULT_ROLE_USER |
+------+----------+-------------------+-------------------+
| %    | zc_test1 | %                 | zc_role1          |
| %    | zc_test2 | %                 | zc_role1          |
| %    | zc_test3 | %                 | zc_role1          |
+------+----------+-------------------+-------------------+
#####嵌套授权
revoke zc_role1,zc_role2,zc_role3,zc_user1,zc_user2,zc_user3 from zc_user1;
revoke zc_role1,zc_role2,zc_role3,zc_user1,zc_user2,zc_user3 from zc_role2;
grant zc_role1 to zc_role2;
grant zc_role2 to zc_role3;
grant zc_role3 to zc_user1;
GRANT create on test.* to zc_role1;
set DEFAULT ROLE all to zc_role2;
set DEFAULT ROLE all to zc_role3;
set DEFAULT ROLE all to zc_user1;
SELECT * FROM mysql.default_roles ;
+------+----------+-------------------+-------------------+
| HOST | USER     | DEFAULT_ROLE_HOST | DEFAULT_ROLE_USER |
+------+----------+-------------------+-------------------+
| %    | zc_role2 | %                 | zc_role1          |
| %    | zc_role3 | %                 | zc_role2          |
| %    | zc_test1 | %                 | zc_role1          |
| %    | zc_test2 | %                 | zc_role1          |
| %    | zc_test3 | %                 | zc_role1          |
| %    | zc_user1 | %                 | zc_role3          |
+------+----------+-------------------+-------------------+
DROP PROCEDURE zc_prole;
DROP PROCEDURE zc_prole1;
DROP PROCEDURE zc_prole2;
DROP PROCEDURE zc_prole3;
DROP PROCEDURE zc_prole4;
DROP PROCEDURE zc_prole5;
DROP PROCEDURE zc_prole6;
DROP PROCEDURE zc_prole7;
DROP PROCEDURE zc_prole8;
DROP PROCEDURE zc_prole9;
DROP PROCEDURE zc_prole10;
DROP PROCEDURE zc_prole11;
DROP PROCEDURE zc_prole12;
DROP PROCEDURE zc_prole13;
DROP PROCEDURE zc_prole14;
DROP PROCEDURE zc_prole15;
DROP PROCEDURE zc_prole16;
DROP PROCEDURE zc_prole17;
DROP PROCEDURE zc_prole18;
DROP PROCEDURE zc_prole19;
DROP PROCEDURE zc_prole20;
DROP PROCEDURE zc_prole21;
DROP FUNCTION test.zc_frole5;
DROP FUNCTION test.zc_frole4;
DROP FUNCTION test.zc_frole3;
DROP FUNCTION test.zc_frole2;
DROP FUNCTION test.zc_frole1;
DROP user zc_user1;
DROP user zc_user2;
DROP user zc_user3;
DROP user zc_role1;
DROP user zc_role2;
DROP user zc_role3;
DROP user zc_test1;
DROP user zc_test2;
DROP user zc_test3;
PURGE RECYCLEBIN;
####set global activate_all_roles_on_login = off;
