#Environmental cleaning
drop user wmj456@'%';
create user wmj456 identified by 'wmj456';
grant all on *.* to wmj456 WITH GRANT OPTION;
DROP TABLE t1;
DROP TABLE t2;
DROP TABLE t3;
CREATE TABLE `t1` (
`id` int NOT NULL AUTO_INCREMENT,
`consumer` char(20) DEFAULT NULL,
`brand` varchar(20) DEFAULT NULL,
`sal` int DEFAULT NULL,
PRIMARY KEY (`id`)
);
INSERT INTO t1 VALUES(1,'书局','apple',5000);
INSERT INTO t1 VALUES(2,'微山','xiaomi',-4000);
INSERT INTO t1 VALUES(3,'深咖','oppo',0);
INSERT INTO t1 VALUES(4,'流苏','huawei',NULL);
INSERT INTO t1 VALUES(5,'玻璃','LG',6000);
INSERT INTO t1 VALUES(6,'钛钢','HTC',8000);
INSERT INTO t1 VALUES(7,'合金','VIVO',3500);
CREATE TABLE `t2` (
`id` int NOT NULL AUTO_INCREMENT,
`model` varchar(200) DEFAULT NULL,
`Price` int DEFAULT NULL,
PRIMARY KEY (`id`)
);
INSERT INTO t2 VALUES(1,'apple 12',7000);
INSERT INTO t2 VALUES(2,'xiaomi 9',0);
INSERT INTO t2 VALUES(3,'oppo findx',-6000);
INSERT INTO t2 VALUES(4,'huawei mata30',8000);
INSERT INTO t2 VALUES(5,'huawei mata30',NULL);
INSERT INTO t2 VALUES(6,'htc cc30',26.44);
INSERT INTO t2 VALUES(7,'shumei xi2',-26.44);
obmysql-sign-2
obmysql-sign-2-1
SELECT sign(e.id) FROM t1 e;
sign(e.id)
1
1
1
1
1
1
1
SELECT sign(e.consumer) FROM t1 e;
sign(e.consumer)
0
0
0
0
0
0
0
Warnings:
Warning	1292	Truncated incorrect DOUBLE value: '书局'
Warning	1292	Truncated incorrect DOUBLE value: '微山'
Warning	1292	Truncated incorrect DOUBLE value: '深咖'
Warning	1292	Truncated incorrect DOUBLE value: '流苏'
Warning	1292	Truncated incorrect DOUBLE value: '玻璃'
Warning	1292	Truncated incorrect DOUBLE value: '钛钢'
Warning	1292	Truncated incorrect DOUBLE value: '合金'
SELECT sign(e.brand) FROM t1 e;
sign(e.brand)
0
0
0
0
0
0
0
Warnings:
Warning	1292	Truncated incorrect DOUBLE value: 'apple'
Warning	1292	Truncated incorrect DOUBLE value: 'xiaomi'
Warning	1292	Truncated incorrect DOUBLE value: 'oppo'
Warning	1292	Truncated incorrect DOUBLE value: 'huawei'
Warning	1292	Truncated incorrect DOUBLE value: 'LG'
Warning	1292	Truncated incorrect DOUBLE value: 'HTC'
Warning	1292	Truncated incorrect DOUBLE value: 'VIVO'
SELECT sign(e.sal) sal,sign(p.Price) FROM t1 e LEFT JOIN t2 p ON e.id = p.id ORDER BY e.sal DESC;
sal	sign(p.Price)
1	1
1	NULL
1	1
1	-1
0	-1
-1	0
NULL	1
SELECT sign(e.sal) sal,sign(p.Price) FROM t1 e RIGHT JOIN t2 p ON e.id = p.id ORDER BY e.sal DESC;
sal	sign(p.Price)
1	1
1	NULL
1	1
1	-1
0	-1
-1	0
NULL	1
SELECT sign(e.sal) sal,sign(p.Price) FROM t1 e INNER JOIN t2 p ON e.id = p.id ORDER BY e.sal DESC;
sal	sign(p.Price)
1	1
1	NULL
1	1
1	-1
0	-1
-1	0
NULL	1
SELECT * FROM (SELECT e.id,sign(e.sal) sal,sign(p.Price) FROM t1 e LEFT JOIN t2 p ON e.id = p.id ) e ORDER BY e.sal;
id	sal	sign(p.Price)
4	NULL	1
2	-1	0
3	0	-1
1	1	1
5	1	NULL
6	1	1
7	1	-1
SELECT *  FROM t1 e WHERE sign(e.sal) = ANY (SELECT sign(p.Price) FROM t2 p ) ORDER BY e.id;
id	consumer	brand	sal
1	书局	apple	5000
2	微山	xiaomi	-4000
3	深咖	oppo	0
5	玻璃	LG	6000
6	钛钢	HTC	8000
7	合金	VIVO	3500
SELECT *  FROM t1 e WHERE sign(e.sal) < ANY (SELECT sign(p.Price) FROM t2 p ) ORDER BY e.id;
id	consumer	brand	sal
2	微山	xiaomi	-4000
3	深咖	oppo	0
SELECT *  FROM t1 e WHERE sign(e.sal) > ANY (SELECT sign(p.Price) FROM t2 p ) ORDER BY e.id;
id	consumer	brand	sal
1	书局	apple	5000
3	深咖	oppo	0
5	玻璃	LG	6000
6	钛钢	HTC	8000
7	合金	VIVO	3500
SELECT *  FROM t1 e WHERE sign(e.sal) < ALL (SELECT sign(p.Price) FROM t2 p ) ORDER BY e.id;
id	consumer	brand	sal
SELECT *  FROM t1 e WHERE sign(e.sal) > ALL (SELECT sign(p.Price) FROM t2 p ) ORDER BY e.id;
id	consumer	brand	sal
SELECT *  FROM t1 e WHERE sign(e.sal) = ALL (SELECT sign(p.Price) FROM t2 p WHERE p.model = 'oppo findx') ORDER BY e.id;
id	consumer	brand	sal
2	微山	xiaomi	-4000
SELECT *  FROM t1 e WHERE EXISTS (SELECT sign(p.Price) FROM t2 p ) ORDER BY e.id;
id	consumer	brand	sal
1	书局	apple	5000
2	微山	xiaomi	-4000
3	深咖	oppo	0
4	流苏	huawei	NULL
5	玻璃	LG	6000
6	钛钢	HTC	8000
7	合金	VIVO	3500
SELECT sign(e.sal)  FROM t1 e WHERE NOT EXISTS (SELECT p.id,p.price FROM t2 p WHERE sign(p.Price)=7500 ) ORDER BY e.id;
sign(e.sal)
1
-1
0
NULL
1
1
1
CREATE TABLE t3 AS SELECT * FROM t1 e WHERE sign(e.sal) = 1;
select * from t3;
id	consumer	brand	sal
1	书局	apple	5000
5	玻璃	LG	6000
6	钛钢	HTC	8000
7	合金	VIVO	3500
drop table t3;
CREATE TABLE t3 AS SELECT * FROM t1 e WHERE sign(e.sal) = 0;
SELECT *  FROM t3;
id	consumer	brand	sal
3	深咖	oppo	0
drop table t3;
CREATE TABLE t3 AS SELECT * FROM t1 e WHERE sign(e.sal) = NUll;
SELECT *  FROM t3;
id	consumer	brand	sal
SELECT brand, sign(brand) FROM t1 e WHERE e.brand LIKE '%a%';
brand	sign(brand)
apple	0
xiaomi	0
huawei	0
Warnings:
Warning	1292	Truncated incorrect DOUBLE value: 'apple'
Warning	1292	Truncated incorrect DOUBLE value: 'xiaomi'
Warning	1292	Truncated incorrect DOUBLE value: 'huawei'
SELECT sal, sign(sal) FROM t1 e LEFT JOIN t2 p ON e.id = p.id WHERE e.sal LIKE '%00%';
sal	sign(sal)
5000	1
-4000	-1
6000	1
8000	1
3500	1
SELECT * FROM t1 e WHERE sign(e.sal) = 0;
id	consumer	brand	sal
3	深咖	oppo	0
SELECT * FROM t1 e WHERE sign(e.sal) = 1;
id	consumer	brand	sal
1	书局	apple	5000
5	玻璃	LG	6000
6	钛钢	HTC	8000
7	合金	VIVO	3500
SELECT * FROM t1 e WHERE sign(e.sal) = NULL;
id	consumer	brand	sal
SELECT * FROM t1 e WHERE sign(e.sal) > 0 ORDER BY e.id;
id	consumer	brand	sal
1	书局	apple	5000
5	玻璃	LG	6000
6	钛钢	HTC	8000
7	合金	VIVO	3500
SELECT * FROM t1 e WHERE sign(e.sal) >= 0 ORDER BY e.id;
id	consumer	brand	sal
1	书局	apple	5000
3	深咖	oppo	0
5	玻璃	LG	6000
6	钛钢	HTC	8000
7	合金	VIVO	3500
SELECT * FROM t1 e WHERE sign(e.sal) < 0 ORDER BY e.id;
id	consumer	brand	sal
2	微山	xiaomi	-4000
SELECT * FROM t1 e WHERE sign(e.sal) <= 0 ORDER BY e.id;
id	consumer	brand	sal
2	微山	xiaomi	-4000
3	深咖	oppo	0
SELECT * FROM t1 e WHERE sign(e.sal) = 1 ORDER BY e.id;
id	consumer	brand	sal
1	书局	apple	5000
5	玻璃	LG	6000
6	钛钢	HTC	8000
7	合金	VIVO	3500
SELECT * FROM t1 e WHERE sign(e.sal) <> 0 ORDER BY e.id;
id	consumer	brand	sal
1	书局	apple	5000
2	微山	xiaomi	-4000
5	玻璃	LG	6000
6	钛钢	HTC	8000
7	合金	VIVO	3500
SELECT e.id, e.sal, sign(e.sal) FROM t1 e WHERE e.id > 0 ORDER BY sign(e.sal);
id	sal	sign(e.sal)
4	NULL	NULL
2	-4000	-1
3	0	0
1	5000	1
5	6000	1
6	8000	1
7	3500	1
SELECT e.id, e.sal, sign(e.sal) FROM t1 e WHERE e.id > 0 ORDER BY sign(e.sal) DESC;
id	sal	sign(e.sal)
1	5000	1
5	6000	1
6	8000	1
7	3500	1
3	0	0
2	-4000	-1
4	NULL	NULL
SELECT e.id, e.sal, sign(e.brand) FROM t1 e WHERE e.id > 0 ORDER BY sign(e.brand) ASC;
id	sal	sign(e.brand)
1	5000	0
2	-4000	0
3	0	0
4	NULL	0
5	6000	0
6	8000	0
7	3500	0
Warnings:
Warning	1292	Truncated incorrect DOUBLE value: 'apple'
Warning	1292	Truncated incorrect DOUBLE value: 'xiaomi'
Warning	1292	Truncated incorrect DOUBLE value: 'oppo'
Warning	1292	Truncated incorrect DOUBLE value: 'huawei'
Warning	1292	Truncated incorrect DOUBLE value: 'LG'
Warning	1292	Truncated incorrect DOUBLE value: 'HTC'
Warning	1292	Truncated incorrect DOUBLE value: 'VIVO'
SELECT e.id, e.sal, sign(e.brand) FROM t1 e WHERE e.id > 0 ORDER BY sign(e.brand) DESC;
id	sal	sign(e.brand)
1	5000	0
2	-4000	0
3	0	0
4	NULL	0
5	6000	0
6	8000	0
7	3500	0
Warnings:
Warning	1292	Truncated incorrect DOUBLE value: 'apple'
Warning	1292	Truncated incorrect DOUBLE value: 'xiaomi'
Warning	1292	Truncated incorrect DOUBLE value: 'oppo'
Warning	1292	Truncated incorrect DOUBLE value: 'huawei'
Warning	1292	Truncated incorrect DOUBLE value: 'LG'
Warning	1292	Truncated incorrect DOUBLE value: 'HTC'
Warning	1292	Truncated incorrect DOUBLE value: 'VIVO'
SELECT e.id, sign(e.sal), SUM(e.sal+p.Price) FROM t1 e ,t2 p WHERE e.id=p.id GROUP BY e.id, sign(e.sal)  ORDER BY e.id;
id	sign(e.sal)	SUM(e.sal+p.Price)
1	1	12000
2	-1	-4000
3	0	-6000
4	NULL	NULL
5	1	NULL
6	1	8026
7	1	3474
SELECT e.id, sign(e.sal) tt, SUM(e.sal+p.Price) FROM t1 e ,t2 p WHERE e.id=p.id GROUP BY e.id, sign(e.sal) HAVING tt > -1 ORDER BY e.id;
id	tt	SUM(e.sal+p.Price)
1	1	12000
3	0	-6000
5	1	NULL
6	1	8026
7	1	3474
select id, sal, sign(case when sal=0 then 200 else sal end ) from t1 ORDER BY id;
id	sal	sign(case when sal=0 then 200 else sal end )
1	5000	1
2	-4000	-1
3	0	1
4	NULL	NULL
5	6000	1
6	8000	1
7	3500	1
select id, sal, sign(case when sal>0 then 200 else sal end ) from t1 order by id;
id	sal	sign(case when sal>0 then 200 else sal end )
1	5000	1
2	-4000	-1
3	0	0
4	NULL	NULL
5	6000	1
6	8000	1
7	3500	1
select id, sal, sign(case when sal=0 then 200 else sal end ), COUNT(*) from t1 GROUP by sign(case when sal=0 then 200 else sal end ),id ORDER BY id;
id	sal	sign(case when sal=0 then 200 else sal end )	COUNT(*)
1	5000	1	1
2	-4000	-1	1
3	0	1	1
4	NULL	NULL	1
5	6000	1	1
6	8000	1	1
7	3500	1	1
obmysql-sign-2-2
INSERT INTO t2(model,price) SELECT model,price from t2 WHERE sign(Price) = 1;
SELECT COUNT(*) FROM t2;
COUNT(*)
10
INSERT INTO t2(model,price) SELECT model,price from t2 WHERE sign(Price) = 0;
SELECT COUNT(*) FROM t2;
COUNT(*)
11
obmysql-sign-2-3
UPDATE t2 SET MODEL = 'xiaomi 10' WHERE sign(Price) = 0;
SELECT model FROM t2;
model
apple 12
xiaomi 10
oppo findx
huawei mata30
huawei mata30
htc cc30
shumei xi2
apple 12
huawei mata30
htc cc30
xiaomi 10
UPDATE t2 SET price = '9000' WHERE sign(Price) < 0;
SELECT price FROM t2;
price
7000
0
9000
8000
NULL
26
9000
7000
8000
26
0
UPDATE t2 SET price = (SELECT sign(t1.sal) FROM t1 WHERE sign(t1.sal) = 0 ) WHERE id = 1 ;
SELECT price FROM t2;
price
0
0
9000
8000
NULL
26
9000
7000
8000
26
0
obmysql-sign-2-4
DELETE FROM t2 WHERE sign(Price) = 0;
SELECT COUNT(*) FROM t2;
COUNT(*)
8
DELETE FROM t2 WHERE sign(Price) = -1;
SELECT COUNT(*) FROM t2;
COUNT(*)
8
DELETE FROM t2 WHERE sign(Price) <= 2 ;
SELECT COUNT(*) FROM t2;
COUNT(*)
1
DROP TABLE t1;
DROP TABLE t2;
DROP TABLE t3;
obmysql-sign-3
obmysql-sign-3-1
DROP TABLE t1;
DROP TABLE t2;
DROP TABLE t3;
DROP VIEW t1_view;
DROP VIEW t2_view;
CREATE TABLE `t1` (
`id` int,
`consumer` char(20) DEFAULT NULL,
`brand` varchar(20) DEFAULT NULL,
`sal` int DEFAULT NULL
);
INSERT INTO t1 VALUES(1,'书局','apple',5000);
INSERT INTO t1 VALUES(2,'微山','xiaomi',-4000);
INSERT INTO t1 VALUES(3,'深咖','oppo',0);
INSERT INTO t1 VALUES(4,'流苏','huawei',NULL);
INSERT INTO t1 VALUES(5,'玻璃','LG',6000);
INSERT INTO t1 VALUES(6,'钛钢','HTC',8000);
INSERT INTO t1 VALUES(7,'合金','VIVO',3500);
CREATE TABLE `t2` (
`id` int,
`model` varchar(200) DEFAULT NULL,
`Price` int DEFAULT NULL
);
INSERT INTO t2 VALUES(1,'apple 12',7000);
INSERT INTO t2 VALUES(2,'xiaomi 9',0);
INSERT INTO t2 VALUES(3,'oppo findx',-6000);
INSERT INTO t2 VALUES(4,'huawei mata30',8000);
INSERT INTO t2 VALUES(5,'huawei mata30',NULL);
INSERT INTO t2 VALUES(6,'htc cc30',26.44);
INSERT INTO t2 VALUES(7,'shumei xi2',-26.44);
CREATE VIEW t1_view AS SELECT *  FROM t1;
CREATE VIEW t2_view AS SELECT *  FROM t2;
SELECT e.id, sign(e.id) FROM t1_view e;
id	sign(e.id)
1	1
2	1
3	1
4	1
5	1
6	1
7	1
SELECT e.consumer, sign(e.consumer) FROM t1_view e;
consumer	sign(e.consumer)
书局	0
微山	0
深咖	0
流苏	0
玻璃	0
钛钢	0
合金	0
Warnings:
Warning	1292	Truncated incorrect DOUBLE value: '书局'
Warning	1292	Truncated incorrect DOUBLE value: '微山'
Warning	1292	Truncated incorrect DOUBLE value: '深咖'
Warning	1292	Truncated incorrect DOUBLE value: '流苏'
Warning	1292	Truncated incorrect DOUBLE value: '玻璃'
Warning	1292	Truncated incorrect DOUBLE value: '钛钢'
Warning	1292	Truncated incorrect DOUBLE value: '合金'
SELECT e.brand, sign(e.brand) FROM t1_view e;
brand	sign(e.brand)
apple	0
xiaomi	0
oppo	0
huawei	0
LG	0
HTC	0
VIVO	0
Warnings:
Warning	1292	Truncated incorrect DOUBLE value: 'apple'
Warning	1292	Truncated incorrect DOUBLE value: 'xiaomi'
Warning	1292	Truncated incorrect DOUBLE value: 'oppo'
Warning	1292	Truncated incorrect DOUBLE value: 'huawei'
Warning	1292	Truncated incorrect DOUBLE value: 'LG'
Warning	1292	Truncated incorrect DOUBLE value: 'HTC'
Warning	1292	Truncated incorrect DOUBLE value: 'VIVO'
SELECT sign(e.sal) sal,sign(p.Price) FROM t1_view e LEFT JOIN t2_view p ON e.id = p.id ORDER BY e.sal DESC;
sal	sign(p.Price)
1	1
1	NULL
1	1
1	-1
0	-1
-1	0
NULL	1
SELECT sign(e.sal) sal,sign(p.Price) FROM t1_view e RIGHT JOIN t2_view p ON e.id = p.id ORDER BY e.sal DESC;
sal	sign(p.Price)
1	1
1	NULL
1	1
1	-1
0	-1
-1	0
NULL	1
SELECT sign(e.sal) sal,sign(p.Price) FROM t1_view e INNER JOIN t2_view p ON e.id = p.id ORDER BY e.sal DESC;
sal	sign(p.Price)
1	1
1	NULL
1	1
1	-1
0	-1
-1	0
NULL	1
SELECT * FROM (SELECT e.id,sign(e.sal) sal,sign(p.Price) FROM t1_view e LEFT JOIN t2_view p ON e.id = p.id ) e ORDER BY e.sal;
id	sal	sign(p.Price)
4	NULL	1
2	-1	0
3	0	-1
1	1	1
5	1	NULL
6	1	1
7	1	-1
SELECT *  FROM t1_view e WHERE sign(e.sal) = ANY (SELECT sign(p.Price) FROM t2_view p ) ORDER BY e.id;
id	consumer	brand	sal
1	书局	apple	5000
2	微山	xiaomi	-4000
3	深咖	oppo	0
5	玻璃	LG	6000
6	钛钢	HTC	8000
7	合金	VIVO	3500
SELECT *  FROM t1_view e WHERE sign(e.sal) < ANY (SELECT sign(p.Price) FROM t2_view p ) ORDER BY e.id;
id	consumer	brand	sal
2	微山	xiaomi	-4000
3	深咖	oppo	0
SELECT *  FROM t1_view e WHERE sign(e.sal) > ANY (SELECT sign(p.Price) FROM t2_view p ) ORDER BY e.id;
id	consumer	brand	sal
1	书局	apple	5000
3	深咖	oppo	0
5	玻璃	LG	6000
6	钛钢	HTC	8000
7	合金	VIVO	3500
SELECT *  FROM t1_view e WHERE sign(e.sal) < ALL (SELECT sign(p.Price) FROM t2_view p ) ORDER BY e.id;
id	consumer	brand	sal
SELECT *  FROM t1_view e WHERE sign(e.sal) > ALL (SELECT sign(p.Price) FROM t2_view p ) ORDER BY e.id;
id	consumer	brand	sal
SELECT *  FROM t1_view e WHERE sign(e.sal) = ALL (SELECT sign(p.Price) FROM t2_view p WHERE p.model = 'oppo findx') ORDER BY e.id;
id	consumer	brand	sal
2	微山	xiaomi	-4000
SELECT *  FROM t1_view e WHERE EXISTS (SELECT sign(p.Price) FROM t2_view p ) ORDER BY e.id;
id	consumer	brand	sal
1	书局	apple	5000
2	微山	xiaomi	-4000
3	深咖	oppo	0
4	流苏	huawei	NULL
5	玻璃	LG	6000
6	钛钢	HTC	8000
7	合金	VIVO	3500
SELECT sign(e.sal)  FROM t1_view e WHERE NOT EXISTS (SELECT p.id,p.price FROM t2_view p WHERE sign(p.Price)=7500 ) ORDER BY e.id;
sign(e.sal)
1
-1
0
NULL
1
1
1
CREATE TABLE t3 AS SELECT * FROM t1_view e WHERE sign(e.sal) = 1;
select * from t3;
id	consumer	brand	sal
1	书局	apple	5000
5	玻璃	LG	6000
6	钛钢	HTC	8000
7	合金	VIVO	3500
drop table t3;
CREATE TABLE t3 AS SELECT * FROM t1_view e WHERE sign(e.sal) = 0;
SELECT *  FROM t3;
id	consumer	brand	sal
3	深咖	oppo	0
drop table t3;
CREATE TABLE t3 AS SELECT * FROM t1_view e WHERE sign(e.sal) = NUll;
SELECT *  FROM t3;
id	consumer	brand	sal
SELECT brand, sign(brand) FROM t1_view e WHERE e.brand LIKE '%a%';
brand	sign(brand)
apple	0
xiaomi	0
huawei	0
Warnings:
Warning	1292	Truncated incorrect DOUBLE value: 'apple'
Warning	1292	Truncated incorrect DOUBLE value: 'xiaomi'
Warning	1292	Truncated incorrect DOUBLE value: 'huawei'
SELECT sal, sign(sal) FROM t1_view e LEFT JOIN t2_view p ON e.id = p.id WHERE e.sal LIKE '%00%';
sal	sign(sal)
5000	1
-4000	-1
6000	1
8000	1
3500	1
SELECT * FROM t1_view e WHERE sign(e.sal) = 0;
id	consumer	brand	sal
3	深咖	oppo	0
SELECT * FROM t1_view e WHERE sign(e.sal) = 1;
id	consumer	brand	sal
1	书局	apple	5000
5	玻璃	LG	6000
6	钛钢	HTC	8000
7	合金	VIVO	3500
SELECT * FROM t1_view e WHERE sign(e.sal) = NULL;
id	consumer	brand	sal
SELECT * FROM t1_view e WHERE sign(e.sal) > 0 ORDER BY e.id;
id	consumer	brand	sal
1	书局	apple	5000
5	玻璃	LG	6000
6	钛钢	HTC	8000
7	合金	VIVO	3500
SELECT * FROM t1_view e WHERE sign(e.sal) < 0 ORDER BY e.id;
id	consumer	brand	sal
2	微山	xiaomi	-4000
SELECT * FROM t1_view e WHERE sign(e.sal) = 1 ORDER BY e.id;
id	consumer	brand	sal
1	书局	apple	5000
5	玻璃	LG	6000
6	钛钢	HTC	8000
7	合金	VIVO	3500
SELECT * FROM t1_view e WHERE sign(e.sal) <> 0 ORDER BY e.id;
id	consumer	brand	sal
1	书局	apple	5000
2	微山	xiaomi	-4000
5	玻璃	LG	6000
6	钛钢	HTC	8000
7	合金	VIVO	3500
SELECT e.id, e.sal, sign(e.sal) FROM t1_view e WHERE e.id > 0 ORDER BY sign(e.sal);
id	sal	sign(e.sal)
4	NULL	NULL
2	-4000	-1
3	0	0
1	5000	1
5	6000	1
6	8000	1
7	3500	1
SELECT e.id, e.sal, sign(e.sal) FROM t1_view e WHERE e.id > 0 ORDER BY sign(e.sal) DESC;
id	sal	sign(e.sal)
1	5000	1
5	6000	1
6	8000	1
7	3500	1
3	0	0
2	-4000	-1
4	NULL	NULL
SELECT e.id, e.sal, sign(e.brand) FROM t1_view e WHERE e.id > 0 ORDER BY sign(e.brand) ASC;
id	sal	sign(e.brand)
1	5000	0
2	-4000	0
3	0	0
4	NULL	0
5	6000	0
6	8000	0
7	3500	0
Warnings:
Warning	1292	Truncated incorrect DOUBLE value: 'apple'
Warning	1292	Truncated incorrect DOUBLE value: 'xiaomi'
Warning	1292	Truncated incorrect DOUBLE value: 'oppo'
Warning	1292	Truncated incorrect DOUBLE value: 'huawei'
Warning	1292	Truncated incorrect DOUBLE value: 'LG'
Warning	1292	Truncated incorrect DOUBLE value: 'HTC'
Warning	1292	Truncated incorrect DOUBLE value: 'VIVO'
SELECT e.id, e.sal, sign(e.brand) FROM t1_view e WHERE e.id > 0 ORDER BY sign(e.brand) DESC;
id	sal	sign(e.brand)
1	5000	0
2	-4000	0
3	0	0
4	NULL	0
5	6000	0
6	8000	0
7	3500	0
Warnings:
Warning	1292	Truncated incorrect DOUBLE value: 'apple'
Warning	1292	Truncated incorrect DOUBLE value: 'xiaomi'
Warning	1292	Truncated incorrect DOUBLE value: 'oppo'
Warning	1292	Truncated incorrect DOUBLE value: 'huawei'
Warning	1292	Truncated incorrect DOUBLE value: 'LG'
Warning	1292	Truncated incorrect DOUBLE value: 'HTC'
Warning	1292	Truncated incorrect DOUBLE value: 'VIVO'
SELECT e.id, sign(e.sal), SUM(e.sal+p.Price) FROM t1_view e ,t2_view p WHERE e.id=p.id GROUP BY e.id, sign(e.sal)  ORDER BY e.id;
id	sign(e.sal)	SUM(e.sal+p.Price)
1	1	12000
2	-1	-4000
3	0	-6000
4	NULL	NULL
5	1	NULL
6	1	8026
7	1	3474
SELECT e.id, sign(e.sal) tt, SUM(e.sal+p.Price) FROM t1_view e ,t2_view p WHERE e.id=p.id GROUP BY e.id, tt HAVING tt > -1 ORDER BY e.id;
id	tt	SUM(e.sal+p.Price)
1	1	12000
3	0	-6000
5	1	NULL
6	1	8026
7	1	3474
select id, sal, sign(case when sal=0 then 200 else sal end ) from t1_view ORDER BY id;
id	sal	sign(case when sal=0 then 200 else sal end )
1	5000	1
2	-4000	-1
3	0	1
4	NULL	NULL
5	6000	1
6	8000	1
7	3500	1
select id, sal, sign(case when sal>0 then 200 else sal end ) from t1_view order by id;
id	sal	sign(case when sal>0 then 200 else sal end )
1	5000	1
2	-4000	-1
3	0	0
4	NULL	NULL
5	6000	1
6	8000	1
7	3500	1
select id, sal, sign(case when sal=0 then 200 else sal end ), COUNT(*) from t1_view GROUP by sign(case when sal=0 then 200 else sal end ),id ORDER BY id;
id	sal	sign(case when sal=0 then 200 else sal end )	COUNT(*)
1	5000	1	1
2	-4000	-1	1
3	0	1	1
4	NULL	NULL	1
5	6000	1	1
6	8000	1	1
7	3500	1	1
INSERT INTO t2(model,price) SELECT model,price from t2_view WHERE sign(Price) = 1;
SELECT COUNT(*) FROM t2;
COUNT(*)
10
INSERT INTO t2(model,price) SELECT model,price from t2_view WHERE sign(Price) = 0;
SELECT COUNT(*) FROM t2;
COUNT(*)
11
UPDATE t2_view SET MODEL = 'xiaomi 10' WHERE sign(Price) = 0;
SELECT model FROM t2_view;
model
apple 12
xiaomi 10
oppo findx
huawei mata30
huawei mata30
htc cc30
shumei xi2
apple 12
huawei mata30
htc cc30
xiaomi 10
UPDATE t2_view SET price = '9000' WHERE sign(Price) < 0;
SELECT price FROM t2_view;
price
7000
0
9000
8000
NULL
26
9000
7000
8000
26
0
UPDATE t2_view SET price = (SELECT sign(t1.sal) FROM t1 WHERE sign(t1.sal) = 0 ) WHERE id = 1 ;
SELECT price FROM t2_view;
price
0
0
9000
8000
NULL
26
9000
7000
8000
26
0
DELETE FROM t2_view WHERE sign(Price) = 0;
SELECT COUNT(*) FROM t2_view;
COUNT(*)
8
DELETE FROM t2_view WHERE sign(Price) = -1;
SELECT COUNT(*) FROM t2_view;
COUNT(*)
8
DELETE FROM t2_view WHERE sign(Price) <= 2 ;
SELECT COUNT(*) FROM t2_view;
COUNT(*)
1
obmysql-sign-4
DROP TABLE t1;
CREATE TABLE `t1` (
`id` int,
`consumer` char(20) DEFAULT NULL,
`price` varchar(20) DEFAULT NULL,
`sal` int DEFAULT NULL,
`datetime1` DATE,
`datetime2` bigint
);
INSERT INTO t1 VALUES(1,'书局','7000',5000,'2020-09-22',20200923121200);
INSERT INTO t1 VALUES(2,'微山','3000',-4000,'2020-09-21',20200921101159);
INSERT INTO t1 VALUES(3,'深咖','5000',0,'2020-08-21',20190821101159);
INSERT INTO t1 VALUES(4,'流苏','0',NULL,'2020-02-29',20200228101159);
INSERT INTO t1 VALUES(5,'玻璃','3200',6000,'2020-02-29',20200228101159);
INSERT INTO t1 VALUES(6,'钛钢',NULL,8000,'2020-02-29',20200228101159);
INSERT INTO t1 VALUES(7,'合金','VIVO',3500,'2020-02-29',20200228101159);
CREATE INDEX index_test ON t1(sal);
CREATE INDEX index_test1 ON t1(price);
CREATE INDEX index_test2 ON t1(consumer);
CREATE INDEX index_test3 ON t1(datetime1);
CREATE INDEX index_test4 ON t1(datetime2);
SELECT * FROM t1;
id	consumer	price	sal	datetime1	datetime2
1	书局	7000	5000	2020-09-22	20200923121200
2	微山	3000	-4000	2020-09-21	20200921101159
3	深咖	5000	0	2020-08-21	20190821101159
4	流苏	0	NULL	2020-02-29	20200228101159
5	玻璃	3200	6000	2020-02-29	20200228101159
6	钛钢	NULL	8000	2020-02-29	20200228101159
7	合金	VIVO	3500	2020-02-29	20200228101159
SELECT sal, sign(sal) FROM t1;
sal	sign(sal)
NULL	NULL
-4000	-1
0	0
3500	1
5000	1
6000	1
8000	1
SELECT id, consumer, sign(sal) FROM t1 WHERE sign(sal) = 0 ORDER BY id DESC;
id	consumer	sign(sal)
3	深咖	0
SELECT id,consumer,sign(sal) FROM t1 WHERE sign(sal) > 0 ORDER BY sign(sal);
id	consumer	sign(sal)
1	书局	1
5	玻璃	1
6	钛钢	1
7	合金	1
SELECT id,SUM(sal) FROM t1 WHERE sign(sal) > 0 GROUP BY id HAVING SUM(sal) > 3000 ORDER BY id;
id	SUM(sal)
1	5000
5	6000
6	8000
7	3500
SELECT id,SUM(sal) FROM t1 WHERE sign(sal) > 0 GROUP BY id HAVING SUM(sal) > 5000 ORDER BY id;
id	SUM(sal)
5	6000
6	8000
UPDATE t1 SET sal = 10 WHERE sign(sal) = 0 ;
SELECT sal FROM t1;
sal
5000
-4000
10
NULL
6000
8000
3500
UPDATE t1 SET sal = 0 WHERE sal = 10 ;
SELECT sal FROM t1;
sal
5000
-4000
0
NULL
6000
8000
3500
SELECT COUNT(*) FROM t1;
COUNT(*)
7
INSERT INTO t1(consumer,price,sal,datetime1,datetime2) SELECT consumer,price,sal,datetime1,datetime2  FROM t1 WHERE sign(sal)<0;
SELECT COUNT(*) FROM t1;
COUNT(*)
8
INSERT INTO t1 VALUES(8,'流苏','9111',sign(200),'2020-02-29 10:11:59',20200228101159);
INSERT INTO t1 VALUES(8,'流苏','9112',sign('156'),'2020-02-29 10:11:59',20200228101159);
INSERT INTO t1 VALUES(8,'流苏','9113',sign(-100),'2020-02-29 10:11:59',20200228101159);
INSERT INTO t1 VALUES(8,'流苏','9114',sign(0),'2020-02-29 10:11:59',20200228101159);
INSERT INTO t1 VALUES(8,'流苏','9115',sign(NULL),'2020-02-29 10:11:59',20200228101159);
SELECT COUNT(*)  FROM t1;
COUNT(*)
13
DELETE FROM t1 WHERE sign(sal)=0;
SELECT COUNT(*)  FROM t1;
COUNT(*)
11
obmysql-sign-5
DROP TABLE t1;
CREATE TABLE `t1` (
`id` int NOT NULL AUTO_INCREMENT,
`consumer` char(20) NOT NULL,
`price` varchar(20) DEFAULT NULL,
`sal` int DEFAULT NULL,
`datetime1` DATE,
`datetime2` bigint,
PRIMARY KEY (`id`),
UNIQUE KEY `t1_UN` (`price`)
);
INSERT INTO t1 VALUES(1,'书局','7000',5000,'2020-09-22',20200923121200);
INSERT INTO t1 VALUES(2,'微山','3000',-4000,'2020-09-21',20200921101159);
INSERT INTO t1 VALUES(3,'深咖','5000',0,'2020-08-21',20190821101159);
INSERT INTO t1 VALUES(4,'流苏','0',NULL,'2020-02-29',20200228101159);
INSERT INTO t1 VALUES(5,'玻璃','3200',6000,'2020-02-29',20200228101159);
INSERT INTO t1 VALUES(6,'钛钢',NULL,8000,'2020-02-29',20200228101159);
INSERT INTO t1 VALUES(7,'合金','VIVO',3500,'2020-02-29',20200228101159);
SELECT sign(price) FROM t1;
sign(price)
NULL
0
1
1
1
1
0
Warnings:
Warning	1292	Truncated incorrect DOUBLE value: 'VIVO'
SELECT sign(sal) FROM t1;
sign(sal)
1
-1
0
NULL
1
1
1
SELECT sign(datetime1), sign(datetime2), sign(sal), sign(price) FROM t1;
sign(datetime1)	sign(datetime2)	sign(sal)	sign(price)
1	1	1	1
1	1	-1	1
1	1	0	1
1	1	NULL	0
1	1	1	1
1	1	1	NULL
1	1	1	0
Warnings:
Warning	1292	Truncated incorrect DOUBLE value: 'VIVO'
SELECT id, consumer, sign(sal), sign(price) FROM t1 WHERE sign(sal)>0 ORDER BY id DESC;
id	consumer	sign(sal)	sign(price)
7	合金	1	0
6	钛钢	1	NULL
5	玻璃	1	1
1	书局	1	1
Warnings:
Warning	1292	Truncated incorrect DOUBLE value: 'VIVO'
SELECT id,consumer, sign(sal), sign(price) FROM t1 WHERE sign(sal)<0 ORDER BY sign(sal);
id	consumer	sign(sal)	sign(price)
2	微山	-1	1
SELECT id, sal,SUM(sign(sal)) FROM t1 WHERE t1.sal <> 6000 GROUP BY sal,id HAVING SUM(sign(sal)) > 0 ORDER BY id;
id	sal	SUM(sign(sal))
1	5000	1
6	8000	1
7	3500	1
SELECT price, sal FROM t1;
price	sal
7000	5000
3000	-4000
5000	0
0	NULL
3200	6000
NULL	8000
VIVO	3500
UPDATE t1 SET sal = 10 WHERE sign(sal) = 0 ;
UPDATE t1 SET price = '9527' where sign(sal) < 0;
SELECT price, sal FROM t1;
price	sal
7000	5000
9527	-4000
5000	10
0	NULL
3200	6000
NULL	8000
VIVO	3500
SELECT COUNT(*) FROM t1;
COUNT(*)
7
INSERT INTO t1 VALUES(0,'流苏_insert1',sign('200'),sign(200),'2020-02-29 10:11:59',20200228101159);
INSERT INTO t1 VALUES(0,'流苏_insert2',2,sign('156'),'2020-02-29 10:11:59',20200228101159);
INSERT INTO t1 VALUES(0,'流苏_insert3',3,sign(-100),'2020-02-29 10:11:59',20200228101159);
INSERT INTO t1 VALUES(0,'流苏_insert4',sign(NULL),sign(0),'2020-02-29 10:11:59',20200228101159);
INSERT INTO t1 VALUES(0,'流苏_insert5','9115',sign(NULL),'2020-02-29 10:11:59',20200228101159);
SELECT COUNT(*)  FROM t1;
COUNT(*)
12
DELETE FROM t1 WHERE sign(id) = 1;
SELECT COUNT(*)  FROM t1;
COUNT(*)
0
DROP VIEW t2_view;
DROP VIEW t1_view;
DROP TABLE t1;
DROP TABLE t2;
DROP TABLE t3;
obmysql-sign-6
DROP TABLE t1;
CREATE TABLE `t1` (
`id` int NOT NULL AUTO_INCREMENT,
`consumer` char(20) NOT NULL,
`price` varchar(20) DEFAULT NULL,
`sal` int DEFAULT NULL,
`datetime1` DATE,
`datetime2` bigint,
PRIMARY KEY (`id`)
);
INSERT INTO t1 VALUES(1,'书局','7000',5000,'2020-09-22',20200923121200);
INSERT INTO t1 VALUES(2,'微山','3000',-4000,'2020-09-21',20200921101159);
INSERT INTO t1 VALUES(3,'深咖','5000',0,'2020-08-21',20190821101159);
INSERT INTO t1 VALUES(4,'流苏','0',NULL,'2020-02-29',20200228101159);
INSERT INTO t1 VALUES(5,'玻璃','3200',6000,'2020-02-29',20200228101159);
INSERT INTO t1 VALUES(6,'钛钢',NULL,8000,'2020-02-29',20200228101159);
INSERT INTO t1 VALUES(7,'合金','VIVO',3500,'2020-02-29',20200228101159);
SELECT LEAST(sign(10),sign(-10),sign(0),sign(NULL)) from dual;
LEAST(sign(10),sign(-10),sign(0),sign(NULL))
NULL
SELECT LEAST(LEAST(sign(consumer),datetime1),datetime2) FROM t1;
LEAST(LEAST(sign(consumer),datetime1),datetime2)
0
0
0
0
0
0
0
Warnings:
Warning	1292	Truncated incorrect DOUBLE value: '书局'
Warning	1292	Truncated incorrect DOUBLE value: '微山'
Warning	1292	Truncated incorrect DOUBLE value: '深咖'
Warning	1292	Truncated incorrect DOUBLE value: '流苏'
Warning	1292	Truncated incorrect DOUBLE value: '玻璃'
Warning	1292	Truncated incorrect DOUBLE value: '钛钢'
Warning	1292	Truncated incorrect DOUBLE value: '合金'
SELECT sign(least(consumer, sal)) from t1;
sign(least(consumer, sal))
0
-1
0
NULL
0
0
0
Warnings:
Warning	1292	Truncated incorrect DECIMAL value: '书局'
Warning	1292	Truncated incorrect DOUBLE value: '书局'
Warning	1292	Truncated incorrect DECIMAL value: '微山'
Warning	1292	Truncated incorrect DECIMAL value: '深咖'
Warning	1292	Truncated incorrect DOUBLE value: '深咖'
Warning	1292	Truncated incorrect DECIMAL value: '玻璃'
Warning	1292	Truncated incorrect DOUBLE value: '玻璃'
Warning	1292	Truncated incorrect DECIMAL value: '钛钢'
Warning	1292	Truncated incorrect DOUBLE value: '钛钢'
Warning	1292	Truncated incorrect DECIMAL value: '合金'
Warning	1292	Truncated incorrect DOUBLE value: '合金'
SELECT sign(sign(sal)) from t1;
sign(sign(sal))
1
-1
0
NULL
1
1
1
SELECT sign(sum(sal)) from t1;
sign(sum(sal))
1
SELECT SUM(sign(sal)) FROM t1 ORDER BY id;
SUM(sign(sal))
3
SELECT SUM(sign(sal)+sign(price)) FROM t1 ORDER BY id;
SUM(sign(sal)+sign(price))
6
Warnings:
Warning	1292	Truncated incorrect DOUBLE value: 'VIVO'
SELECT COUNT(sign(sal)) FROM t1 ORDER BY id;
COUNT(sign(sal))
6
SELECT COUNT(sign(sal)+sign(consumer)) FROM t1 ORDER BY id;
COUNT(sign(sal)+sign(consumer))
6
Warnings:
Warning	1292	Truncated incorrect DOUBLE value: '书局'
Warning	1292	Truncated incorrect DOUBLE value: '微山'
Warning	1292	Truncated incorrect DOUBLE value: '深咖'
Warning	1292	Truncated incorrect DOUBLE value: '流苏'
Warning	1292	Truncated incorrect DOUBLE value: '玻璃'
Warning	1292	Truncated incorrect DOUBLE value: '钛钢'
Warning	1292	Truncated incorrect DOUBLE value: '合金'
SELECT sign(COUNT(sal+consumer)) FROM t1 ORDER BY id;
sign(COUNT(sal+consumer))
1
Warnings:
Warning	1292	Truncated incorrect DOUBLE value: '书局'
Warning	1292	Truncated incorrect DOUBLE value: '微山'
Warning	1292	Truncated incorrect DOUBLE value: '深咖'
Warning	1292	Truncated incorrect DOUBLE value: '流苏'
Warning	1292	Truncated incorrect DOUBLE value: '玻璃'
Warning	1292	Truncated incorrect DOUBLE value: '钛钢'
Warning	1292	Truncated incorrect DOUBLE value: '合金'
SELECT MAX(sign(sal)) FROM t1 ORDER BY id;
MAX(sign(sal))
1
SELECT sign(MAX(sal)) FROM t1 ORDER BY id;
sign(MAX(sal))
1
SELECT MIN(sign(sal)) FROM t1 ORDER BY id;
MIN(sign(sal))
-1
SELECT sign(MIN(sal)) FROM t1 ORDER BY id;
sign(MIN(sal))
-1
SELECT AVG(sign(sal)) FROM t1 ORDER BY id;
AVG(sign(sal))
0.5000
SELECT sign(AVG(sal)) FROM t1 ORDER BY id;
sign(AVG(sal))
1
SELECT ABS(sign(sal)) FROM t1 ORDER BY id;
ABS(sign(sal))
1
1
0
NULL
1
1
1
SELECT sign(ABS(sal)) FROM t1 ORDER BY id;
sign(ABS(sal))
1
1
0
NULL
1
1
1
SELECT CEIL(sign(sal)) FROM t1 ORDER BY id;
CEIL(sign(sal))
1
-1
0
NULL
1
1
1
SELECT sign(CEIL(sal)) FROM t1 ORDER BY id;
sign(CEIL(sal))
1
-1
0
NULL
1
1
1
SELECT FLOOR(sign(price)) FROM t1 ORDER BY id;
FLOOR(sign(price))
1
1
1
0
1
NULL
0
Warnings:
Warning	1292	Truncated incorrect DOUBLE value: 'VIVO'
SELECT sign(FLOOR(price)) FROM t1 ORDER BY id;
sign(FLOOR(price))
1
1
1
0
1
NULL
0
Warnings:
Warning	1292	Truncated incorrect DOUBLE value: 'VIVO'
SELECT MOD(sign(sal),2) FROM t1 ORDER BY id;
MOD(sign(sal),2)
1
-1
0
NULL
1
1
1
SELECT sign(MOD(sal,3)) FROM t1 ORDER BY id;
sign(MOD(sal,3))
1
-1
0
NULL
0
1
1
SELECT LENGTH(sign(price)) FROM t1;
LENGTH(sign(price))
1
1
1
1
1
NULL
1
Warnings:
Warning	1292	Truncated incorrect DOUBLE value: 'VIVO'
SELECT sign(LENGTH(price)) FROM t1;
sign(LENGTH(price))
1
1
1
1
1
NULL
1
SELECT INSTR(sign(price),'-1') FROM t1;
INSTR(sign(price),'-1')
0
0
0
0
0
NULL
0
Warnings:
Warning	1292	Truncated incorrect DOUBLE value: 'VIVO'
SELECT sign(INSTR(consumer,'局')) FROM t1;
sign(INSTR(consumer,'局'))
1
0
0
0
0
0
0
SELECT sign(CAST(datetime1 AS CHAR(200))) FROM t1;
sign(CAST(datetime1 AS CHAR(200)))
1
1
1
1
1
1
1
Warnings:
Warning	1292	Truncated incorrect DOUBLE value: '2020-09-22'
Warning	1292	Truncated incorrect DOUBLE value: '2020-09-21'
Warning	1292	Truncated incorrect DOUBLE value: '2020-08-21'
Warning	1292	Truncated incorrect DOUBLE value: '2020-02-29'
Warning	1292	Truncated incorrect DOUBLE value: '2020-02-29'
Warning	1292	Truncated incorrect DOUBLE value: '2020-02-29'
Warning	1292	Truncated incorrect DOUBLE value: '2020-02-29'
SELECT CAST(sign(sal) AS CHAR(200)) FROM t1;
CAST(sign(sal) AS CHAR(200))
1
-1
0
NULL
1
1
1
SELECT CAST(sign(sal) AS SIGNED) FROM t1;
CAST(sign(sal) AS SIGNED)
1
-1
0
NULL
1
1
1
SELECT CAST(sign(price) AS SIGNED ) FROM t1;
CAST(sign(price) AS SIGNED )
1
1
1
0
1
NULL
0
Warnings:
Warning	1292	Truncated incorrect DOUBLE value: 'VIVO'
SELECT CAST(sign(datetime1) AS datetime) FROM t1;
CAST(sign(datetime1) AS datetime)
NULL
NULL
NULL
NULL
NULL
NULL
NULL
obmysql-sign-7
SELECT sign(price * 10) FROM t1 order by id;
sign(price * 10)
1
1
1
0
1
NULL
0
Warnings:
Warning	1292	Truncated incorrect DOUBLE value: 'VIVO'
SELECT sign(price + 1500) FROM t1 order by id;
sign(price + 1500)
1
1
1
1
1
NULL
1
Warnings:
Warning	1292	Truncated incorrect DOUBLE value: 'VIVO'
SELECT sign(sal - 1000) FROM t1 order by id;
sign(sal - 1000)
1
-1
-1
NULL
1
1
1
SELECT sign(price / 1500) FROM t1 order by id;
sign(price / 1500)
1
1
1
0
1
NULL
0
Warnings:
Warning	1292	Truncated incorrect DOUBLE value: 'VIVO'
SELECT sign(price / 1500 * 10) FROM t1 order by id;
sign(price / 1500 * 10)
1
1
1
0
1
NULL
0
Warnings:
Warning	1292	Truncated incorrect DOUBLE value: 'VIVO'
SELECT sign(price * 10 - 0.1) FROM t1 order by id;
sign(price * 10 - 0.1)
1
1
1
-1
1
NULL
-1
Warnings:
Warning	1292	Truncated incorrect DOUBLE value: 'VIVO'
SELECT sign(price * 0.221 - 0.1) FROM t1 order by id;
sign(price * 0.221 - 0.1)
1
1
1
-1
1
NULL
-1
Warnings:
Warning	1292	Truncated incorrect DOUBLE value: 'VIVO'
SELECT sign(price % 3) FROM t1 order by id;
sign(price % 3)
1
0
1
0
1
NULL
0
Warnings:
Warning	1292	Truncated incorrect DOUBLE value: 'VIVO'
SELECT sign(price * 0) FROM t1 order by id;
sign(price * 0)
0
0
0
0
0
NULL
0
Warnings:
Warning	1292	Truncated incorrect DOUBLE value: 'VIVO'
SELECT sign(price * NULL) FROM t1 order by id;
sign(price * NULL)
NULL
NULL
NULL
NULL
NULL
NULL
NULL
Warnings:
Warning	1292	Truncated incorrect DOUBLE value: 'VIVO'
SELECT sign(sal - 0.111) FROM t1 order by id;
sign(sal - 0.111)
1
-1
-1
NULL
1
1
1
SELECT sign(consumer||price) FROM t1 order by id;
sign(consumer||price)
1
1
1
0
1
NULL
0
Warnings:
Warning	1292	Truncated incorrect DOUBLE value: '书局'
Warning	1292	Truncated incorrect DOUBLE value: '微山'
Warning	1292	Truncated incorrect DOUBLE value: '深咖'
Warning	1292	Truncated incorrect DOUBLE value: '流苏'
Warning	1292	Truncated incorrect DOUBLE value: '玻璃'
Warning	1292	Truncated incorrect DOUBLE value: '钛钢'
Warning	1292	Truncated incorrect DOUBLE value: '合金'
Warning	1292	Truncated incorrect DOUBLE value: 'VIVO'
SELECT sign(sal||price) FROM t1 order by id;
sign(sal||price)
1
1
1
NULL
1
1
1
SELECT sign(datetime1||datetime2) FROM t1 order by id;
sign(datetime1||datetime2)
1
1
1
1
1
1
1
SELECT sal REGEXP sign(sal) FROM t1 order by id;
sal REGEXP sign(sal)
0
0
1
NULL
0
0
0
SELECT sal like sign(sal) FROM t1 order by id;
sal like sign(sal)
0
0
1
NULL
0
0
0
SELECT * FROM t1 e WHERE sign(e.sal) = 0;
id	consumer	price	sal	datetime1	datetime2
3	深咖	5000	0	2020-08-21	20190821101159
SELECT * FROM t1 e WHERE sign(e.sal) = 1;
id	consumer	price	sal	datetime1	datetime2
1	书局	7000	5000	2020-09-22	20200923121200
5	玻璃	3200	6000	2020-02-29	20200228101159
6	钛钢	NULL	8000	2020-02-29	20200228101159
7	合金	VIVO	3500	2020-02-29	20200228101159
SELECT * FROM t1 e WHERE sign(e.sal) = NULL;
id	consumer	price	sal	datetime1	datetime2
SELECT * FROM t1 e WHERE sign(e.sal) > 0 ORDER BY e.id;
id	consumer	price	sal	datetime1	datetime2
1	书局	7000	5000	2020-09-22	20200923121200
5	玻璃	3200	6000	2020-02-29	20200228101159
6	钛钢	NULL	8000	2020-02-29	20200228101159
7	合金	VIVO	3500	2020-02-29	20200228101159
SELECT * FROM t1 e WHERE sign(e.sal) >= 0 ORDER BY e.id;
id	consumer	price	sal	datetime1	datetime2
1	书局	7000	5000	2020-09-22	20200923121200
3	深咖	5000	0	2020-08-21	20190821101159
5	玻璃	3200	6000	2020-02-29	20200228101159
6	钛钢	NULL	8000	2020-02-29	20200228101159
7	合金	VIVO	3500	2020-02-29	20200228101159
SELECT * FROM t1 e WHERE sign(e.sal) < 0 ORDER BY e.id;
id	consumer	price	sal	datetime1	datetime2
2	微山	3000	-4000	2020-09-21	20200921101159
SELECT * FROM t1 e WHERE sign(e.sal) <= 0 ORDER BY e.id;
id	consumer	price	sal	datetime1	datetime2
2	微山	3000	-4000	2020-09-21	20200921101159
3	深咖	5000	0	2020-08-21	20190821101159
SELECT * FROM t1 e WHERE sign(e.sal) = 1 ORDER BY e.id;
id	consumer	price	sal	datetime1	datetime2
1	书局	7000	5000	2020-09-22	20200923121200
5	玻璃	3200	6000	2020-02-29	20200228101159
6	钛钢	NULL	8000	2020-02-29	20200228101159
7	合金	VIVO	3500	2020-02-29	20200228101159
SELECT * FROM t1 e WHERE sign(e.sal) <> 0 ORDER BY e.id;
id	consumer	price	sal	datetime1	datetime2
1	书局	7000	5000	2020-09-22	20200923121200
2	微山	3000	-4000	2020-09-21	20200921101159
5	玻璃	3200	6000	2020-02-29	20200228101159
6	钛钢	NULL	8000	2020-02-29	20200228101159
7	合金	VIVO	3500	2020-02-29	20200228101159
SELECT id,sal,datetime1 FROM t1 WHERE sign(sal) = 0 OR sign(sal) = -1;
id	sal	datetime1
2	-4000	2020-09-21
3	0	2020-08-21
SELECT id,sal,datetime1 FROM t1 WHERE sign(sal) = 1 OR sign(sal) = 0;
id	sal	datetime1
1	5000	2020-09-22
3	0	2020-08-21
5	6000	2020-02-29
6	8000	2020-02-29
7	3500	2020-02-29
SELECT id,sal,datetime1 FROM t1 WHERE sign(sal) = 0 OR sign(sal) = -1 AND  sign(sal) = 1;
id	sal	datetime1
3	0	2020-08-21
drop table t1;
# Clean up users
drop user wmj456@'%' ;
