#Environmental cleaning
drop user wmj456@'%';
create user wmj456 identified by 'wmj456';
grant all on *.* to wmj456 WITH GRANT OPTION;
DROP TABLE t1;
DROP FUNCTION f_test;
DROP PROCEDURE p_test;
CREATE TABLE `t1` (
`id` int NOT NULL,
`consumer` char(20) DEFAULT NULL,
`price` varchar(20) DEFAULT NULL,
`sal` int DEFAULT NULL,
`datetime1` DATE,
`datetime2` bigint
);
INSERT INTO t1 VALUES(1,'书局','7000',5000,'2020-09-22',20200923121200);
INSERT INTO t1 VALUES(2,'微山','3000',-4000,'2020-09-21',20200921101159);
INSERT INTO t1 VALUES(3,'深咖','5000',0,'2020-08-21',20190821101159);
INSERT INTO t1 VALUES(4,'流苏','0',NULL,'2020-02-29',20200228101159);
INSERT INTO t1 VALUES(5,'玻璃','3200',6000,'2020-02-29',20200228101159);
INSERT INTO t1 VALUES(6,'钛钢',NULL,8000,'2020-02-29',20200228101159);
INSERT INTO t1 VALUES(7,'合金','VIVO',3500,'2020-02-29',20200228101159);
obmysql-sign-8
obmysql-sign-8-1
drop function f_test ;//
CREATE  FUNCTION f_test()
returns varchar(200)
begin
declare a varchar(200);
SELECT sign(sal) FROM t1 e WHERE sign(sal)=0 INTO a;
return a;
END;
//
SELECT  f_test();
f_test()
0
drop function f_test ;//
CREATE FUNCTION f_test(samplename varchar(200))
returns varchar(200)
begin
declare a varchar(200);
SELECT  sign(samplename) FROM t1 e WHERE sign(sal)=0 INTO a ;
return a;
END;
//
SELECT f_test(-100);
f_test(-100)
-1
SELECT f_test(-0.1);
f_test(-0.1)
-1
SELECT f_test(0);
f_test(0)
0
SELECT f_test(0.22222);
f_test(0.22222)
1
SELECT f_test(abc);
SELECT f_test(NULL);
f_test(NULL)
NULL
obmysql-sign-8-2
drop function f_test;//
CREATE FUNCTION f_test(samplename varchar(200), samplename1 varchar(200))
returns  varchar(200)
begin
declare a varchar(200);
declare b varchar(200);
declare i int default 0;
SELECT sign(sal) FROM t1 e WHERE sign(e.sal) = samplename into a;
SELECT sign(sal) FROM t1 e WHERE sign(e.sal) = samplename1 into b;
WHILE i <= 10 do
INSERT INTO t1 VALUES(0,a,'while插入a数据',7000,'2020-12-31 10:11:59',20190821101159);
INSERT INTO t1 VALUES(0,b,'while插入b数据',90000,'2020-12-30 10:11:59',20200228101159);
set i := i + 1;
END WHILE;
return a+b;
END;
//
SELECT f_test(0,-1) FROM dual;
f_test(0,-1)
-1
SELECT f_test(NULL,-1) FROM dual;
f_test(NULL,-1)
NULL
SELECT f_test(-1,0) FROM dual;
f_test(-1,0)
-1
SELECT f_test(-1,-1) FROM dual;
f_test(-1,-1)
-2
select count(*) from t1;
count(*)
95
delete from t1 where price like '%插入%';
drop function f_test;//
CREATE  FUNCTION f_test(samplename varchar(200),samplename1 varchar(200))
returns  varchar(200)
begin
declare a varchar(200);
declare b varchar(200);
declare i int default 0;
SELECT sign(sal) FROM t1 e WHERE sign(e.sal) = samplename into a;
SELECT sign(sal) FROM t1 e WHERE sign(e.sal) = samplename1 into b;
repeat 	
INSERT INTO t1 VALUES(0,a,'repeat插入a数据',7000,'2020-08-21 10:11:59',20190821101159);
INSERT INTO t1 VALUES(0,b,'repeat插入b数据',90000,'2020-02-29 10:11:59',20200228101159);
set i := i + 1;
until i >= 10	
end	 repeat;
return a+b;
END;
//
select count(*) from t1;
count(*)
7
SELECT f_test(0,-1) FROM dual;
f_test(0,-1)
-1
SELECT f_test(NULL,-1) FROM dual;
f_test(NULL,-1)
NULL
SELECT f_test(-1,0) FROM dual;
f_test(-1,0)
-1
SELECT f_test(-1,-1) FROM dual;
f_test(-1,-1)
-2
select count(*) from t1;
count(*)
87
delete from t1 where price like '%插入%';
drop function f_test;//
CREATE FUNCTION f_test(samplename varchar(200),samplename1 varchar(200))
returns varchar(200)
BEGIN
declare a varchar(200);
declare b varchar(200);
declare i int default 0;
SELECT sign(sal) FROM t1 e WHERE sign(e.sal) = samplename into a;
SELECT sign(sal) FROM t1 e WHERE sign(e.sal) = samplename1 into b;
lp1:loop
set i := i + 1;
INSERT INTO t1 VALUES(0,a,'110',7000,'2020-08-21 10:11:59',20190821101159);
INSERT INTO t1 VALUES(0,b,'120',90000,'2020-02-29 10:11:59',20200228101159);
if i > 10 then
leave lp1;
end if;
end Loop lp1;
return a+b;
END;
//
select count(*) from t1;
count(*)
7
SELECT f_test(0,-1) FROM dual;
f_test(0,-1)
-1
SELECT f_test(NULL,-1) FROM dual;
f_test(NULL,-1)
NULL
SELECT f_test(-1,0) FROM dual;
f_test(-1,0)
-1
SELECT f_test(-1,-1) FROM dual;
f_test(-1,-1)
-2
select count(*) from t1;
count(*)
95
delete from t1 where price in ('110','120');
obmysql-sign-9
obmysql-sign-9-1
drop procedure p_test;//
CREATE  PROCEDURE p_test()
begin
declare a varchar(200);
declare b varchar(200);
declare i int default 0;
SELECT sign(sal) FROM t1 e WHERE sign(e.sal) = 0 into a;
SELECT sign(sal) FROM t1 e WHERE sign(e.sal) = -1 into b;
WHILE i <= 10 do
INSERT INTO t1 VALUES(0,a,concat('无参存储过程a参数第',i,'次'),7000,'2020-08-21 10:11:59',20190821101159);
INSERT INTO t1 VALUES(0,b,concat('无参存储过程b参数第',i,'次'),90000,'2020-02-29 10:11:59',20200228101159);
set i := i + 1;
END while;
END;
//
SELECT COUNT(*) FROM t1;
COUNT(*)
7
CALL p_test();
SELECT COUNT(*) FROM t1;
COUNT(*)
29
delete from t1 where price like '%存储%';
drop procedure p_test;//
CREATE PROCEDURE p_test(in samplename  varchar(200))
begin
declare i int;
declare a varchar(200);
declare b varchar(200);
SELECT sign(sal) FROM t1 e WHERE sign(e.sal) = samplename into a;
SELECT sign(sal) FROM t1 e WHERE sign(e.sal) = samplename into b;
set i := 1;
repeat
INSERT INTO t1 VALUES(0,a,concat('in存储过程a参数第',i,'次'),7000,'2020-08-21 10:11:59',20190821101159);
INSERT INTO t1 VALUES(0,b,concat('in存储过程b参数第',i,'次'),90000,'2020-02-29 10:11:59',20200228101159);
set i := i+1;
until i >= 10
end	 repeat;
END ;
//
SELECT COUNT(*) FROM t1;
COUNT(*)
7
CALL p_test(500);
CALL p_test(0);
CALL p_test(-1);
CALL p_test(NULL);
SELECT COUNT(*) FROM t1;
COUNT(*)
79
delete from t1 where price like '%存储%';
drop procedure p_test;//
CREATE PROCEDURE p_test(out wb  varchar(200), out wb1  varchar(200))
begin
declare i int;
SELECT sign(sal) FROM t1 e WHERE sign(e.sal) = 0 into wb;
SELECT sign(sal) FROM t1 e WHERE sign(e.sal) = -1 into wb1;
set i :=  1;
while i <= 10 do
INSERT INTO t1 VALUES(0,'哈哈哈',concat('存储过程out第',i,'次'),7000,'2020-08-21 10:11:59',20190821101159);
set i := i + 1;
end while;
END;
//
SELECT COUNT(*) FROM t1;
COUNT(*)
7
call p_test(@wb,@wb1);
SELECT COUNT(*) FROM t1;
COUNT(*)
17
delete from t1 where price like '%存储%';
drop PROCEDURE p_test;//
CREATE PROCEDURE p_test( out wb varchar(200),inout wb1 varchar(200))
begin
declare i int;
SELECT sign(sal) FROM t1 e WHERE sign(e.sal) = 0 into wb;
SELECT sign(sal) FROM t1 e WHERE sign(e.sal) = -1 into wb1;
set i := 1;
WHILE i <= 10 do
INSERT INTO t1 VALUES(0,'哈哈哈',concat('存储过程第',i,'次'),7000,'2020-08-21 10:11:59',20190821101159);
set i := i+1;
END while;
END;
//
SELECT COUNT(*) FROM t1;
COUNT(*)
7
call p_test(@wb,@wb1);
SELECT COUNT(*) FROM t1;
COUNT(*)
17
delete from t1 where price like '%存储%';
drop procedure p_test;//
CREATE PROCEDURE p_test(OUT wb varchar(200),inout wb1 int ,in wb2  int)
begin
declare i int;
SELECT sign(sal) FROM t1 e WHERE sign(e.sal) = 0 into wb;
set i := 1;
WHILE i <= 10 do
INSERT INTO t1 VALUES(0,'哈哈哈',concat('存储过程第',i,'次'),wb1,'2020-08-21 10:11:59',20190821101159);
INSERT INTO t1 VALUES(0,'哦哦哦',concat('存储过程第',i,'次'),wb2,'2020-02-29 10:11:59',20200228101159);
set i := i + 1;
END while;
END;
//
SELECT COUNT(*) FROM t1;
COUNT(*)
7
call p_test(@wb,@wb1,100);
SELECT COUNT(*) FROM t1;
COUNT(*)
27
delete from t1 where price like '%存储%';
drop procedure p_test;//
create  PROCEDURE p_test(in wb int)
begin
declare i int;
set i := 1;
WHILE i <= 5 do
INSERT INTO t1 VALUES(0,'哈哈哈','600',wb+100,'2021-01-01 10:11:59',20190821101159);
INSERT INTO t1 VALUES(0,'哦哦哦','19111',wb+200,'2021-01-01 10:11:59',20200228101159);
set i := i+1;
END while;
END;
//
SELECT COUNT(*)  FROM  t1;
COUNT(*)
7
CALL p_test(sign(500));
CALL p_test(sign(0));
CALL p_test(sign(-1));
CALL p_test(sign(NULL));
CALL p_test(sign("xxx"));
CALL p_test(sign(1000));
SELECT COUNT(*)  FROM  t1;
COUNT(*)
57
delete from t1 where datetime1='2021-01-01';
drop function f_test;//
CREATE FUNCTION f_test()
returns int
begin
declare a int;
SELECT  sign(sal) FROM t1 e WHERE sign(sal) = -1 into a ;
RETURN a;
END;
//
SELECT f_test() FROM  dual;
f_test()
-1
drop procedure p_test;//
create  PROCEDURE p_test(in wb int)
begin
declare i int;
set i := 1;
WHILE i <= 1 do
INSERT INTO t1 VALUES(0,'哈哈哈','600',wb+100,'2021-01-01 10:11:59',20190821101159);
INSERT INTO t1 VALUES(0,'哦哦哦','19111',wb+200,'2021-01-01 10:11:59',20200228101159);
set i := i+1;
END while;
END;
//
CALL p_test(f_test());
SELECT COUNT(*)  FROM t1;
COUNT(*)
9
DROP TABLE t1;
DROP FUNCTION f_test;
DROP PROCEDURE p_test;
# Clean up users
drop user wmj456@'%' ;
