purge recyclebin;
result_format: 4
drop user whh@'%';
create user whh identified by 'whh';
grant all on *.* to whh WITH GRANT OPTION;


-----------------------------------------------------------------------------------------------------------------
------------------------- 加密函数-sha(str)/sha1(str), sha2(str, hash_length) pl/sql ----------------------------
### 用例：sha-3  sha(str)/sha1(str)/sha2(str) - pl/sql
-----------------------------------------------------------------------------------------------------------------
DROP TABLE sha_table1;//
CREATE TABLE sha_table1(id int,name varchar(200), addressess varchar(200),sal varchar(200));//
INSERT INTO sha_table1 VALUES(1,'不一','杭州','15000');//
INSERT INTO sha_table1 VALUES(2,'不二','苏州','8000');//
INSERT INTO sha_table1 VALUES(3,'不三','洛阳','6000');//
INSERT INTO sha_table1 VALUES(4,'不四','濮阳','5000');//
DROP TABLE sha_table2;//
CREATE TABLE sha_table2(id int,sal_sha varchar(200), sal_sha1 varchar(200),sal_sha2 varchar(200));//
### 标签：sha-3-1 存储过程
##无参数的存储过程
DROP PROCEDURE p_sha;//
CREATE PROCEDURE p_sha()
begin
	declare a varchar(200);
	declare b varchar(200);
	declare c varchar(200);
	declare i int default 5;
	SELECT sha(sal),sha1(sal),sha2(sal,224) into a,b,c FROM sha_table1 WHERE sha(id) = sha(1);
    INSERT INTO sha_table2 VALUES(1,a,b,c);
	WHILE i <= 7 do
	  INSERT INTO sha_table1 VALUES(i,'不易1','杭州1',sha(9000+i));
	  SET i := i + 1;
	END while;
END;
//
SELECT COUNT(*) FROM sha_table1;//
+----------+
| COUNT(*) |
+----------+
|        4 |
+----------+
SELECT COUNT(*) FROM sha_table2;//
+----------+
| COUNT(*) |
+----------+
|        0 |
+----------+
CALL p_sha();//
SELECT id,name,addressess,sal FROM sha_table1 ORDER BY id;//
+------+---------+------------+------------------------------------------+
| id   | name    | addressess | sal                                      |
+------+---------+------------+------------------------------------------+
|    1 | 不一    | 杭州       | 15000                                    |
|    2 | 不二    | 苏州       | 8000                                     |
|    3 | 不三    | 洛阳       | 6000                                     |
|    4 | 不四    | 濮阳       | 5000                                     |
|    5 | 不易1   | 杭州1      | c4528b12c0581e2d63285f369dd6eb97a1dc4364 |
|    6 | 不易1   | 杭州1      | 9131555c6f4b67152897a8fc66b7bcd2de2e5891 |
|    7 | 不易1   | 杭州1      | 5fa0f837dcfe808e7f8a5c22c8549588ea868c44 |
+------+---------+------------+------------------------------------------+
SELECT id,sal_sha,sal_sha1,sal_sha2 FROM sha_table2 ORDER BY id;//
+------+------------------------------------------+------------------------------------------+----------------------------------------------------------+
| id   | sal_sha                                  | sal_sha1                                 | sal_sha2                                                 |
+------+------------------------------------------+------------------------------------------+----------------------------------------------------------+
|    1 | 271593a69439c052d4de63e50c569060dcd78e91 | 271593a69439c052d4de63e50c569060dcd78e91 | 00874d5a05f6bc2112ebf308bd11671b46bb4715d9fd90295bc3fc59 |
+------+------------------------------------------+------------------------------------------+----------------------------------------------------------+
##只有一个in参数的存储过程
DROP PROCEDURE p_sha;//
CREATE PROCEDURE p_sha(in invalue varchar(200))
begin
	declare a varchar(200);
	declare b varchar(200);
	declare c varchar(200);
    declare i int default 8;
	SELECT sha(sal),sha1(sal),sha2(sal,224) into a,b,c FROM sha_table1 WHERE sha1(id) = invalue;
	INSERT INTO sha_table2 VALUES(2,a,b,c);
   	REPEAT
	  INSERT INTO sha_table1 VALUES(i,'不易2','杭州2',sha1(8000+i));
	  SET i := i+1;
	until i > 11	
	END  REPEAT;
END;
//
SELECT COUNT(*) FROM sha_table1;//
+----------+
| COUNT(*) |
+----------+
|        7 |
+----------+
SELECT COUNT(*) FROM sha_table2;//
+----------+
| COUNT(*) |
+----------+
|        1 |
+----------+
CALL p_sha(sha1(2));//
SELECT id,name,addressess,sal FROM sha_table1 ORDER BY id;//
+------+---------+------------+------------------------------------------+
| id   | name    | addressess | sal                                      |
+------+---------+------------+------------------------------------------+
|    1 | 不一    | 杭州       | 15000                                    |
|    2 | 不二    | 苏州       | 8000                                     |
|    3 | 不三    | 洛阳       | 6000                                     |
|    4 | 不四    | 濮阳       | 5000                                     |
|    5 | 不易1   | 杭州1      | c4528b12c0581e2d63285f369dd6eb97a1dc4364 |
|    6 | 不易1   | 杭州1      | 9131555c6f4b67152897a8fc66b7bcd2de2e5891 |
|    7 | 不易1   | 杭州1      | 5fa0f837dcfe808e7f8a5c22c8549588ea868c44 |
|    8 | 不易2   | 杭州2      | 84304dedd765b959d054ed4333448d60ad5e6b8e |
|    9 | 不易2   | 杭州2      | 27529aa462f33715b44be8935c3887a4825fe289 |
|   10 | 不易2   | 杭州2      | d239a9839404faf538e085739173bad0a2b9bda6 |
|   11 | 不易2   | 杭州2      | 982906af37623afd726ed6eac797c1030e3c00d1 |
+------+---------+------------+------------------------------------------+
SELECT id,sal_sha,sal_sha1,sal_sha2 FROM sha_table2 ORDER BY id;//
+------+------------------------------------------+------------------------------------------+----------------------------------------------------------+
| id   | sal_sha                                  | sal_sha1                                 | sal_sha2                                                 |
+------+------------------------------------------+------------------------------------------+----------------------------------------------------------+
|    1 | 271593a69439c052d4de63e50c569060dcd78e91 | 271593a69439c052d4de63e50c569060dcd78e91 | 00874d5a05f6bc2112ebf308bd11671b46bb4715d9fd90295bc3fc59 |
|    2 | 2de49ac0fce223dbdd31d2b8b3b3710582ef1535 | 2de49ac0fce223dbdd31d2b8b3b3710582ef1535 | c3ef46b539da72ab30382ab94535ffefc0ee4e4c04c589058af495df |
+------+------------------------------------------+------------------------------------------+----------------------------------------------------------+
##包含out参数的存储过程
DROP PROCEDURE p_sha;//
CREATE  PROCEDURE p_sha(out outa varchar(200),OUT outb varchar(200),OUT outc varchar(200))
begin
    declare i int default 11;
	SELECT sha(sal),sha1(sal),sha2(sal,224) into outa,outb,outc FROM sha_table1 WHERE sha1(id) like '%3BABBB%';
	WHILE i <= 13 do
	   INSERT INTO sha_table1 VALUES(i,'不易3','杭州3',sha2(7000+i,0));
	SET i := i + 1;
	END WHILE;
END;
//
SELECT COUNT(*) FROM sha_table1;//
+----------+
| COUNT(*) |
+----------+
|       11 |
+----------+
CALL p_sha(@outa,@outb,@outc);//
SELECT id,name,addressess,sal FROM sha_table1 ORDER BY id;//
+------+---------+------------+------------------------------------------------------------------+
| id   | name    | addressess | sal                                                              |
+------+---------+------------+------------------------------------------------------------------+
|    1 | 不一    | 杭州       | 15000                                                            |
|    2 | 不二    | 苏州       | 8000                                                             |
|    3 | 不三    | 洛阳       | 6000                                                             |
|    4 | 不四    | 濮阳       | 5000                                                             |
|    5 | 不易1   | 杭州1      | c4528b12c0581e2d63285f369dd6eb97a1dc4364                         |
|    6 | 不易1   | 杭州1      | 9131555c6f4b67152897a8fc66b7bcd2de2e5891                         |
|    7 | 不易1   | 杭州1      | 5fa0f837dcfe808e7f8a5c22c8549588ea868c44                         |
|    8 | 不易2   | 杭州2      | 84304dedd765b959d054ed4333448d60ad5e6b8e                         |
|    9 | 不易2   | 杭州2      | 27529aa462f33715b44be8935c3887a4825fe289                         |
|   10 | 不易2   | 杭州2      | d239a9839404faf538e085739173bad0a2b9bda6                         |
|   11 | 不易2   | 杭州2      | 982906af37623afd726ed6eac797c1030e3c00d1                         |
|   11 | 不易3   | 杭州3      | 7fb8a56336e161678d48fee87ee481f9afda126e6ee86d139bbb9d23e9fed2d3 |
|   12 | 不易3   | 杭州3      | 21612db808d2becd4a2e1f489a1404583c7199cc162993c8cc167e4199505856 |
|   13 | 不易3   | 杭州3      | 6e237b1f8dc0da15957d168af0b2f58ce8dbc421671f0b38d1f39cc6026af032 |
+------+---------+------------+------------------------------------------------------------------+
SELECT @outa,@outb,@outc;//
+------------------------------------------+------------------------------------------+----------------------------------------------------------+
| @outa                                    | @outb                                    | @outc                                                    |
+------------------------------------------+------------------------------------------+----------------------------------------------------------+
| 31d9ddeaa80bc88c1f3117b9724726ebcc7fc72d | 31d9ddeaa80bc88c1f3117b9724726ebcc7fc72d | 44a3389045711c0c7f7b71cca114dc4060bfec6c5ac82dfc519ed4bf |
+------------------------------------------+------------------------------------------+----------------------------------------------------------+
##包含inout参数的存储过程
DROP PROCEDURE p_sha;//
CREATE  PROCEDURE p_sha(OUT outa varchar(200),OUT outb varchar(200),INOUT inoutc varchar(200))
begin
    declare invalue varchar(200);
    declare i int default 14;
	set invalue := inoutc;
	SELECT sha(sal),sha1(sal),sha2(sal,224) into outa,outb,inoutc FROM sha_table1 WHERE sha2(id,0) = invalue;
	WHILE i <= 16 do
	  INSERT INTO sha_table1 VALUES(i,'不易4','杭州4',sha2(6000+i,224));
	  set i := i+1;
	END WHILE;
END;
//
SELECT COUNT(*) FROM sha_table1;//
+----------+
| COUNT(*) |
+----------+
|       14 |
+----------+
SET @inoutc := sha2(3,0);//
CALL p_sha(@outa,@outb,@inoutc);//
SELECT id,name,addressess,sal FROM sha_table1 ORDER BY id;//
+------+---------+------------+------------------------------------------------------------------+
| id   | name    | addressess | sal                                                              |
+------+---------+------------+------------------------------------------------------------------+
|    1 | 不一    | 杭州       | 15000                                                            |
|    2 | 不二    | 苏州       | 8000                                                             |
|    3 | 不三    | 洛阳       | 6000                                                             |
|    4 | 不四    | 濮阳       | 5000                                                             |
|    5 | 不易1   | 杭州1      | c4528b12c0581e2d63285f369dd6eb97a1dc4364                         |
|    6 | 不易1   | 杭州1      | 9131555c6f4b67152897a8fc66b7bcd2de2e5891                         |
|    7 | 不易1   | 杭州1      | 5fa0f837dcfe808e7f8a5c22c8549588ea868c44                         |
|    8 | 不易2   | 杭州2      | 84304dedd765b959d054ed4333448d60ad5e6b8e                         |
|    9 | 不易2   | 杭州2      | 27529aa462f33715b44be8935c3887a4825fe289                         |
|   10 | 不易2   | 杭州2      | d239a9839404faf538e085739173bad0a2b9bda6                         |
|   11 | 不易3   | 杭州3      | 7fb8a56336e161678d48fee87ee481f9afda126e6ee86d139bbb9d23e9fed2d3 |
|   11 | 不易2   | 杭州2      | 982906af37623afd726ed6eac797c1030e3c00d1                         |
|   12 | 不易3   | 杭州3      | 21612db808d2becd4a2e1f489a1404583c7199cc162993c8cc167e4199505856 |
|   13 | 不易3   | 杭州3      | 6e237b1f8dc0da15957d168af0b2f58ce8dbc421671f0b38d1f39cc6026af032 |
|   14 | 不易4   | 杭州4      | 3046e2c3c404bb96d5e172b6add694980733b4956ccc56e20b9f5e47         |
|   15 | 不易4   | 杭州4      | be23ea086eea7bdd5e7207c91e9d744e8128ee6fe429ac437e025090         |
|   16 | 不易4   | 杭州4      | db0571afb43bf248f54c2579e3952cdf4d9226c2242b707e375d3fcf         |
+------+---------+------------+------------------------------------------------------------------+
SELECT @outa,@outb,@outc;//
+------------------------------------------+------------------------------------------+----------------------------------------------------------+
| @outa                                    | @outb                                    | @outc                                                    |
+------------------------------------------+------------------------------------------+----------------------------------------------------------+
| 31d9ddeaa80bc88c1f3117b9724726ebcc7fc72d | 31d9ddeaa80bc88c1f3117b9724726ebcc7fc72d | 44a3389045711c0c7f7b71cca114dc4060bfec6c5ac82dfc519ed4bf |
+------------------------------------------+------------------------------------------+----------------------------------------------------------+
##dml语句
#条件语句
DROP PROCEDURE p_sha;//
CREATE PROCEDURE p_sha(IN invalue varchar(200),IN ina varchar(200),IN inb varchar(200),IN inc varchar(200))
begin
    IF invalue = sha1('sha_table1') THEN 
	   INSERT INTO sha_table1 VALUES(17,'PROCEDURE-If条件','杭州5',sha2(ina+inb+inc,512));
    ELSE 
	   INSERT INTO sha_table2 VALUES(3,sha(ina),sha1(inb),sha2(inb,512));
    END IF;
END;
//
SELECT COUNT(*) FROM sha_table1;//
+----------+
| COUNT(*) |
+----------+
|       17 |
+----------+
SELECT COUNT(*) FROM sha_table2;//
+----------+
| COUNT(*) |
+----------+
|        2 |
+----------+
SET @invalue := sha1('sha_table1');//
SET @ina := '1';//
SET @inb := '2';//
SET @inc := '3';//
CALL p_sha(@invalue,@ina,@inb,@inc);//
SELECT id,name,addressess,sal FROM sha_table1 ORDER BY id;//
+------+--------------------+------------+----------------------------------------------------------------------------------------------------------------------------------+
| id   | name               | addressess | sal                                                                                                                              |
+------+--------------------+------------+----------------------------------------------------------------------------------------------------------------------------------+
|    1 | 不一               | 杭州       | 15000                                                                                                                            |
|    2 | 不二               | 苏州       | 8000                                                                                                                             |
|    3 | 不三               | 洛阳       | 6000                                                                                                                             |
|    4 | 不四               | 濮阳       | 5000                                                                                                                             |
|    5 | 不易1              | 杭州1      | c4528b12c0581e2d63285f369dd6eb97a1dc4364                                                                                         |
|    6 | 不易1              | 杭州1      | 9131555c6f4b67152897a8fc66b7bcd2de2e5891                                                                                         |
|    7 | 不易1              | 杭州1      | 5fa0f837dcfe808e7f8a5c22c8549588ea868c44                                                                                         |
|    8 | 不易2              | 杭州2      | 84304dedd765b959d054ed4333448d60ad5e6b8e                                                                                         |
|    9 | 不易2              | 杭州2      | 27529aa462f33715b44be8935c3887a4825fe289                                                                                         |
|   10 | 不易2              | 杭州2      | d239a9839404faf538e085739173bad0a2b9bda6                                                                                         |
|   11 | 不易3              | 杭州3      | 7fb8a56336e161678d48fee87ee481f9afda126e6ee86d139bbb9d23e9fed2d3                                                                 |
|   11 | 不易2              | 杭州2      | 982906af37623afd726ed6eac797c1030e3c00d1                                                                                         |
|   12 | 不易3              | 杭州3      | 21612db808d2becd4a2e1f489a1404583c7199cc162993c8cc167e4199505856                                                                 |
|   13 | 不易3              | 杭州3      | 6e237b1f8dc0da15957d168af0b2f58ce8dbc421671f0b38d1f39cc6026af032                                                                 |
|   14 | 不易4              | 杭州4      | 3046e2c3c404bb96d5e172b6add694980733b4956ccc56e20b9f5e47                                                                         |
|   15 | 不易4              | 杭州4      | be23ea086eea7bdd5e7207c91e9d744e8128ee6fe429ac437e025090                                                                         |
|   16 | 不易4              | 杭州4      | db0571afb43bf248f54c2579e3952cdf4d9226c2242b707e375d3fcf                                                                         |
|   17 | PROCEDURE-If条件   | 杭州5      | 3c9ad55147a7144f6067327c3b82ea70e7c5426add9ceea4d07dc2902239bf9e049b88625eb65d014a7718f79354608cab0921782c643f0208983fffa3582e40 |
+------+--------------------+------------+----------------------------------------------------------------------------------------------------------------------------------+
SET @invalue := sha1('sha_table2');//
SET @ina := '1';//
SET @inb := '2';//
SET @inc := '3';//
CALL p_sha(@invalue,@ina,@inb,@inc);//
SELECT id,sal_sha,sal_sha1,sal_sha2 FROM sha_table2 ORDER BY id;//
+------+------------------------------------------+------------------------------------------+----------------------------------------------------------------------------------------------------------------------------------+
| id   | sal_sha                                  | sal_sha1                                 | sal_sha2                                                                                                                         |
+------+------------------------------------------+------------------------------------------+----------------------------------------------------------------------------------------------------------------------------------+
|    1 | 271593a69439c052d4de63e50c569060dcd78e91 | 271593a69439c052d4de63e50c569060dcd78e91 | 00874d5a05f6bc2112ebf308bd11671b46bb4715d9fd90295bc3fc59                                                                         |
|    2 | 2de49ac0fce223dbdd31d2b8b3b3710582ef1535 | 2de49ac0fce223dbdd31d2b8b3b3710582ef1535 | c3ef46b539da72ab30382ab94535ffefc0ee4e4c04c589058af495df                                                                         |
|    3 | 356a192b7913b04c54574d18c28d46e6395428ab | da4b9237bacccdf19c0760cab7aec4a8359010b0 | 40b244112641dd78dd4f93b6c9190dd46e0099194d5a44257b7efad6ef9ff4683da1eda0244448cb343aa688f5d3efd7314dafe580ac0bcbf115aeca9e8dc114 |
+------+------------------------------------------+------------------------------------------+----------------------------------------------------------------------------------------------------------------------------------+
#循环语句
DROP PROCEDURE p_sha;//
CREATE PROCEDURE p_sha()
begin
    declare i int default 18;
    WHILE i <= 20 do
      INSERT INTO sha_table1 VALUES(i,'PROCEDURE-While循环','杭州5',sha(6000+i));
      set i := i+1;
    END WHILE;

    loop_name:LOOP
      INSERT INTO sha_table1 VALUES(i,'PROCEDURE-Loop循环','杭州6',sha1(6000+i));
      SET i := i+1;
      IF i > 23 THEN 
	    LEAVE loop_name;
      END IF;
    END LOOP loop_name;

    REPEAT
      INSERT INTO sha_table1 VALUES(i,'PROCEDURE-Repeat循环','杭州7',sha2(8000+i,224));
      SET i := i+1;
      until i > 26	
    END  REPEAT;
END;
//
SELECT COUNT(*) FROM sha_table1;//
+----------+
| COUNT(*) |
+----------+
|       18 |
+----------+
SELECT COUNT(*) FROM sha_table2;//
+----------+
| COUNT(*) |
+----------+
|        3 |
+----------+
CALL p_sha();//
SELECT id,name,addressess,sal FROM sha_table1 ORDER BY id;//
+------+------------------------+------------+----------------------------------------------------------------------------------------------------------------------------------+
| id   | name                   | addressess | sal                                                                                                                              |
+------+------------------------+------------+----------------------------------------------------------------------------------------------------------------------------------+
|    1 | 不一                   | 杭州       | 15000                                                                                                                            |
|    2 | 不二                   | 苏州       | 8000                                                                                                                             |
|    3 | 不三                   | 洛阳       | 6000                                                                                                                             |
|    4 | 不四                   | 濮阳       | 5000                                                                                                                             |
|    5 | 不易1                  | 杭州1      | c4528b12c0581e2d63285f369dd6eb97a1dc4364                                                                                         |
|    6 | 不易1                  | 杭州1      | 9131555c6f4b67152897a8fc66b7bcd2de2e5891                                                                                         |
|    7 | 不易1                  | 杭州1      | 5fa0f837dcfe808e7f8a5c22c8549588ea868c44                                                                                         |
|    8 | 不易2                  | 杭州2      | 84304dedd765b959d054ed4333448d60ad5e6b8e                                                                                         |
|    9 | 不易2                  | 杭州2      | 27529aa462f33715b44be8935c3887a4825fe289                                                                                         |
|   10 | 不易2                  | 杭州2      | d239a9839404faf538e085739173bad0a2b9bda6                                                                                         |
|   11 | 不易2                  | 杭州2      | 982906af37623afd726ed6eac797c1030e3c00d1                                                                                         |
|   11 | 不易3                  | 杭州3      | 7fb8a56336e161678d48fee87ee481f9afda126e6ee86d139bbb9d23e9fed2d3                                                                 |
|   12 | 不易3                  | 杭州3      | 21612db808d2becd4a2e1f489a1404583c7199cc162993c8cc167e4199505856                                                                 |
|   13 | 不易3                  | 杭州3      | 6e237b1f8dc0da15957d168af0b2f58ce8dbc421671f0b38d1f39cc6026af032                                                                 |
|   14 | 不易4                  | 杭州4      | 3046e2c3c404bb96d5e172b6add694980733b4956ccc56e20b9f5e47                                                                         |
|   15 | 不易4                  | 杭州4      | be23ea086eea7bdd5e7207c91e9d744e8128ee6fe429ac437e025090                                                                         |
|   16 | 不易4                  | 杭州4      | db0571afb43bf248f54c2579e3952cdf4d9226c2242b707e375d3fcf                                                                         |
|   17 | PROCEDURE-If条件       | 杭州5      | 3c9ad55147a7144f6067327c3b82ea70e7c5426add9ceea4d07dc2902239bf9e049b88625eb65d014a7718f79354608cab0921782c643f0208983fffa3582e40 |
|   18 | PROCEDURE-While循环    | 杭州5      | 62eaedeada371f634322780ae8ff95e6c269ebf3                                                                                         |
|   19 | PROCEDURE-While循环    | 杭州5      | eb4e53533101ab8e8bdab0e068821493b02f9707                                                                                         |
|   20 | PROCEDURE-While循环    | 杭州5      | b6f645f796048a40fcb0f120373dbb2712f298c6                                                                                         |
|   21 | PROCEDURE-Loop循环     | 杭州6      | 91f4a1e93e73e19b75606041453b81ac73c9abe3                                                                                         |
|   22 | PROCEDURE-Loop循环     | 杭州6      | a58dcb7f4d5593428bac0dd85c941f216c6fcd34                                                                                         |
|   23 | PROCEDURE-Loop循环     | 杭州6      | 21407653fb5e0dccd0f0db39ce608d606700b787                                                                                         |
|   24 | PROCEDURE-Repeat循环   | 杭州7      | 8a24db5a7a70d1ee925f80b7a513f24d3ddf49c4e709ad7f666df513                                                                         |
|   25 | PROCEDURE-Repeat循环   | 杭州7      | b7d99d68729979843c0141882618b2d3e112460b647cd688cc1684d8                                                                         |
|   26 | PROCEDURE-Repeat循环   | 杭州7      | e62b3eb095ff0fb48d350243df71f5c2ac6b05cabf48b8d5486d7e10                                                                         |
+------+------------------------+------------+----------------------------------------------------------------------------------------------------------------------------------+
SELECT id,sal_sha,sal_sha1,sal_sha2 FROM sha_table2 ORDER BY id;//
+------+------------------------------------------+------------------------------------------+----------------------------------------------------------------------------------------------------------------------------------+
| id   | sal_sha                                  | sal_sha1                                 | sal_sha2                                                                                                                         |
+------+------------------------------------------+------------------------------------------+----------------------------------------------------------------------------------------------------------------------------------+
|    1 | 271593a69439c052d4de63e50c569060dcd78e91 | 271593a69439c052d4de63e50c569060dcd78e91 | 00874d5a05f6bc2112ebf308bd11671b46bb4715d9fd90295bc3fc59                                                                         |
|    2 | 2de49ac0fce223dbdd31d2b8b3b3710582ef1535 | 2de49ac0fce223dbdd31d2b8b3b3710582ef1535 | c3ef46b539da72ab30382ab94535ffefc0ee4e4c04c589058af495df                                                                         |
|    3 | 356a192b7913b04c54574d18c28d46e6395428ab | da4b9237bacccdf19c0760cab7aec4a8359010b0 | 40b244112641dd78dd4f93b6c9190dd46e0099194d5a44257b7efad6ef9ff4683da1eda0244448cb343aa688f5d3efd7314dafe580ac0bcbf115aeca9e8dc114 |
+------+------------------------------------------+------------------------------------------+----------------------------------------------------------------------------------------------------------------------------------+
##游标
DROP PROCEDURE test_pro;//
CREATE PROCEDURE test_pro()
BEGIN
	DECLARE a varchar(200);
	DECLARE b varchar(200);
	DECLARE done INT DEFAULT 0;
	DECLARE sha_cursor CURSOR FOR SELECT id,sha(sal) FROM sha_table1 WHERE id < 4 GROUP BY id HAVING sha1(id) like '%cd%';
	DECLARE CONTINUE HANDLER FOR SQLSTATE '02000' SET done=1;
	OPEN sha_cursor;
	FETCH sha_cursor INTO a,b;
	WHILE done<>1 DO
      INSERT INTO sha_table2 VALUES(a,b,sha1(lower(b)),sha2(lower(b),384));
      FETCH sha_cursor INTO a,b;
	END WHILE;
	CLOSE sha_cursor;
END;
//
SELECT COUNT(*) FROM sha_table2;//
+----------+
| COUNT(*) |
+----------+
|        3 |
+----------+
CALL test_pro();//
SELECT id,sal_sha,sal_sha1,sal_sha2 FROM sha_table2 ORDER BY id;//
+------+------------------------------------------+------------------------------------------+----------------------------------------------------------------------------------------------------------------------------------+
| id   | sal_sha                                  | sal_sha1                                 | sal_sha2                                                                                                                         |
+------+------------------------------------------+------------------------------------------+----------------------------------------------------------------------------------------------------------------------------------+
|    1 | 271593a69439c052d4de63e50c569060dcd78e91 | 271593a69439c052d4de63e50c569060dcd78e91 | 00874d5a05f6bc2112ebf308bd11671b46bb4715d9fd90295bc3fc59                                                                         |
|    2 | 2de49ac0fce223dbdd31d2b8b3b3710582ef1535 | 2de49ac0fce223dbdd31d2b8b3b3710582ef1535 | c3ef46b539da72ab30382ab94535ffefc0ee4e4c04c589058af495df                                                                         |
|    2 | 2de49ac0fce223dbdd31d2b8b3b3710582ef1535 | 124d946b501f4dfb396971bc981a890abc8e3597 | acd41d66df321a7c860e6d593ca7125ed4e9dbd4f35e4be1db5e7e0ef0057c25bba3dbf037e6ed12fae9d60a8e106822                                 |
|    3 | 356a192b7913b04c54574d18c28d46e6395428ab | da4b9237bacccdf19c0760cab7aec4a8359010b0 | 40b244112641dd78dd4f93b6c9190dd46e0099194d5a44257b7efad6ef9ff4683da1eda0244448cb343aa688f5d3efd7314dafe580ac0bcbf115aeca9e8dc114 |
|    3 | 31d9ddeaa80bc88c1f3117b9724726ebcc7fc72d | fe4c3e34ef832c2081b151e3df428bcb3956b4d3 | 6bf91bebceb2c95cc1b8e1e1975d1e11b62cd07b1506ffdeaf1b7cc726d3d0ea71286e3d42c36a61f9d87ef01b85d402                                 |
+------+------------------------------------------+------------------------------------------+----------------------------------------------------------------------------------------------------------------------------------+
##动态sql
DROP PROCEDURE p_sha;//
CREATE PROCEDURE p_sha()
BEGIN
  SET @s = 'INSERT INTO sha_table1 VALUES(?,"动态sql插入的数据","杭州8",?);';
  PREPARE stmsha_table1 FROM @s;
  SET @a = 26;
  SET @b = sha(10000);
  EXECUTE stmsha_table1 USING @a,@b;

  SET @s = 'SELECT id,name,sha(name),addressess,sal FROM sha_table1 WHERE sal = ?';
  PREPARE stmt2 FROM @s;
  SET @a = sha(10000);
  EXECUTE stmt2 USING @a; 
END;
//
SELECT * FROM sha_table1 ORDER BY id;//
+------+------------------------+------------+----------------------------------------------------------------------------------------------------------------------------------+
| id   | name                   | addressess | sal                                                                                                                              |
+------+------------------------+------------+----------------------------------------------------------------------------------------------------------------------------------+
|    1 | 不一                   | 杭州       | 15000                                                                                                                            |
|    2 | 不二                   | 苏州       | 8000                                                                                                                             |
|    3 | 不三                   | 洛阳       | 6000                                                                                                                             |
|    4 | 不四                   | 濮阳       | 5000                                                                                                                             |
|    5 | 不易1                  | 杭州1      | c4528b12c0581e2d63285f369dd6eb97a1dc4364                                                                                         |
|    6 | 不易1                  | 杭州1      | 9131555c6f4b67152897a8fc66b7bcd2de2e5891                                                                                         |
|    7 | 不易1                  | 杭州1      | 5fa0f837dcfe808e7f8a5c22c8549588ea868c44                                                                                         |
|    8 | 不易2                  | 杭州2      | 84304dedd765b959d054ed4333448d60ad5e6b8e                                                                                         |
|    9 | 不易2                  | 杭州2      | 27529aa462f33715b44be8935c3887a4825fe289                                                                                         |
|   10 | 不易2                  | 杭州2      | d239a9839404faf538e085739173bad0a2b9bda6                                                                                         |
|   11 | 不易2                  | 杭州2      | 982906af37623afd726ed6eac797c1030e3c00d1                                                                                         |
|   11 | 不易3                  | 杭州3      | 7fb8a56336e161678d48fee87ee481f9afda126e6ee86d139bbb9d23e9fed2d3                                                                 |
|   12 | 不易3                  | 杭州3      | 21612db808d2becd4a2e1f489a1404583c7199cc162993c8cc167e4199505856                                                                 |
|   13 | 不易3                  | 杭州3      | 6e237b1f8dc0da15957d168af0b2f58ce8dbc421671f0b38d1f39cc6026af032                                                                 |
|   14 | 不易4                  | 杭州4      | 3046e2c3c404bb96d5e172b6add694980733b4956ccc56e20b9f5e47                                                                         |
|   15 | 不易4                  | 杭州4      | be23ea086eea7bdd5e7207c91e9d744e8128ee6fe429ac437e025090                                                                         |
|   16 | 不易4                  | 杭州4      | db0571afb43bf248f54c2579e3952cdf4d9226c2242b707e375d3fcf                                                                         |
|   17 | PROCEDURE-If条件       | 杭州5      | 3c9ad55147a7144f6067327c3b82ea70e7c5426add9ceea4d07dc2902239bf9e049b88625eb65d014a7718f79354608cab0921782c643f0208983fffa3582e40 |
|   18 | PROCEDURE-While循环    | 杭州5      | 62eaedeada371f634322780ae8ff95e6c269ebf3                                                                                         |
|   19 | PROCEDURE-While循环    | 杭州5      | eb4e53533101ab8e8bdab0e068821493b02f9707                                                                                         |
|   20 | PROCEDURE-While循环    | 杭州5      | b6f645f796048a40fcb0f120373dbb2712f298c6                                                                                         |
|   21 | PROCEDURE-Loop循环     | 杭州6      | 91f4a1e93e73e19b75606041453b81ac73c9abe3                                                                                         |
|   22 | PROCEDURE-Loop循环     | 杭州6      | a58dcb7f4d5593428bac0dd85c941f216c6fcd34                                                                                         |
|   23 | PROCEDURE-Loop循环     | 杭州6      | 21407653fb5e0dccd0f0db39ce608d606700b787                                                                                         |
|   24 | PROCEDURE-Repeat循环   | 杭州7      | 8a24db5a7a70d1ee925f80b7a513f24d3ddf49c4e709ad7f666df513                                                                         |
|   25 | PROCEDURE-Repeat循环   | 杭州7      | b7d99d68729979843c0141882618b2d3e112460b647cd688cc1684d8                                                                         |
|   26 | PROCEDURE-Repeat循环   | 杭州7      | e62b3eb095ff0fb48d350243df71f5c2ac6b05cabf48b8d5486d7e10                                                                         |
+------+------------------------+------------+----------------------------------------------------------------------------------------------------------------------------------+
CALL p_sha();//
+------+--------------------------+------------------------------------------+------------+------------------------------------------+
| id   | name                     | sha(name)                                | addressess | sal                                      |
+------+--------------------------+------------------------------------------+------------+------------------------------------------+
|   26 | 动态sql插入的数据        | 1da27fafc7025498e1e222214bbfdf1d2a267f6f | 杭州8      | 8a12a315082a345f1a9d3ad14b214cd36d310cf8 |
+------+--------------------------+------------------------------------------+------------+------------------------------------------+
DROP PROCEDURE p_sha;//
CREATE PROCEDURE p_sha()
BEGIN
  SET @s = 'update sha_table1 set name = ? WHERE sha(id) = ?;';
  PREPARE stmsha_table1 FROM @s;
  SET @a = '动态sql更新数据';
  SET @b = sha(26);
  EXECUTE stmsha_table1 USING @a,@b;

  SET @s = 'SELECT id,name,addressess,sal FROM sha_table1 WHERE sha(id) = ?';
  PREPARE stmt2 FROM @s;
  SET @a = sha(26);
  EXECUTE stmt2 USING @a; 
  
  SET @s = 'delete FROM sha_table1 WHERE sha(id) = ?;';
  PREPARE stmsha_table1 FROM @s;
  SET @a = sha(26);
  EXECUTE stmsha_table1 USING @a;

  SET @s = 'SELECT id,name,addressess,sal FROM sha_table1 WHERE sha(id) = ?';
  PREPARE stmt2 FROM @s;
  SET @a = sha(26);
  EXECUTE stmt2 USING @a;  
END;
//
CALL p_sha();//
+------+-----------------------+------------+----------------------------------------------------------+
| id   | name                  | addressess | sal                                                      |
+------+-----------------------+------------+----------------------------------------------------------+
+------+------+------------+------+
| id   | name | addressess | sal  |
+------+------+------------+------+
|   26 | 动态sql更新数据       | 杭州7      | e62b3eb095ff0fb48d350243df71f5c2ac6b05cabf48b8d5486d7e10 |
|   26 | 动态sql更新数据       | 杭州8      | 8a12a315082a345f1a9d3ad14b214cd36d310cf8                 |
+------+-----------------------+------------+----------------------------------------------------------+
+------+------+------------+------+
##函数返回值作为存储过程的参数传递
DROP FUNCTION f_sha;//
CREATE FUNCTION f_sha() RETURNS varchar(200) READS SQL DATA 
BEGIN
	declare a varchar(200);
	SELECT sha(sal) into a FROM sha_table1 WHERE sha2(id,384) = sha2(3,384);
	RETURN a;
END;
//
drop procedure p_sha;//
create  PROCEDURE p_sha(in infun varchar(200))
begin
	declare a varchar(200);
	declare b varchar(200);
	declare i int;
	set a := '变量1';
	set b := '变量2';
  	INSERT INTO sha_table2 VALUES(4,infun,sha1(a),sha2(b,512));
END;
//
SELECT COUNT(*) FROM sha_table2;//
+----------+
| COUNT(*) |
+----------+
|        5 |
+----------+
CALL p_sha(f_sha());//
SELECT id,sal_sha,sal_sha1,sal_sha2 FROM sha_table2 ORDER BY id;//
+------+------------------------------------------+------------------------------------------+----------------------------------------------------------------------------------------------------------------------------------+
| id   | sal_sha                                  | sal_sha1                                 | sal_sha2                                                                                                                         |
+------+------------------------------------------+------------------------------------------+----------------------------------------------------------------------------------------------------------------------------------+
|    1 | 271593a69439c052d4de63e50c569060dcd78e91 | 271593a69439c052d4de63e50c569060dcd78e91 | 00874d5a05f6bc2112ebf308bd11671b46bb4715d9fd90295bc3fc59                                                                         |
|    2 | 2de49ac0fce223dbdd31d2b8b3b3710582ef1535 | 2de49ac0fce223dbdd31d2b8b3b3710582ef1535 | c3ef46b539da72ab30382ab94535ffefc0ee4e4c04c589058af495df                                                                         |
|    2 | 2de49ac0fce223dbdd31d2b8b3b3710582ef1535 | 124d946b501f4dfb396971bc981a890abc8e3597 | acd41d66df321a7c860e6d593ca7125ed4e9dbd4f35e4be1db5e7e0ef0057c25bba3dbf037e6ed12fae9d60a8e106822                                 |
|    3 | 356a192b7913b04c54574d18c28d46e6395428ab | da4b9237bacccdf19c0760cab7aec4a8359010b0 | 40b244112641dd78dd4f93b6c9190dd46e0099194d5a44257b7efad6ef9ff4683da1eda0244448cb343aa688f5d3efd7314dafe580ac0bcbf115aeca9e8dc114 |
|    3 | 31d9ddeaa80bc88c1f3117b9724726ebcc7fc72d | fe4c3e34ef832c2081b151e3df428bcb3956b4d3 | 6bf91bebceb2c95cc1b8e1e1975d1e11b62cd07b1506ffdeaf1b7cc726d3d0ea71286e3d42c36a61f9d87ef01b85d402                                 |
|    4 | 31d9ddeaa80bc88c1f3117b9724726ebcc7fc72d | 9e898cce023258f18c2122444daabf95f19f5308 | faf403e1222af7682cc7eb74b708068b10eac9122a54a4d0d8483cfdb1b38b289569472b3e547b812a7922b68100022052322b557dcb92dff8c7e1984ad0db23 |
+------+------------------------------------------+------------------------------------------+----------------------------------------------------------------------------------------------------------------------------------+
#自定义变量，全局变量，in 参数作为sha函数的参数
DROP TABLE sha_table3;//
CREATE TABLE sha_table3(id int,c1 varchar(200), c2 varchar(200),c3 varchar(200),c4 varchar(200));//
DROP PROCEDURE p_sha;//
CREATE PROCEDURE p_sha(IN ina varchar(200),IN inb varchar(200),IN inc varchar(200))
begin
  declare a varchar(200) default '1';
  declare b varchar(200) default '2';
  declare c varchar(200) default '3';
  INSERT INTO sha_table3 VALUES(1,'自定义变量',sha(a),sha1(b),sha2(c,0));
  INSERT INTO sha_table3 VALUES(2,'全局变量',sha(@mya),sha1(@myb),sha2(@myc,0));
  INSERT INTO sha_table3 VALUES(3,'参数变量',sha(ina),sha1(inb),sha2(inc,0));
END;
//
SET @mya := '1';//
SET @myb := '2';//
SET @myc := '3';//
CALL p_sha('1','2','3');//
SELECT * FROM sha_table3 ORDER BY id;//
+------+-----------------+------------------------------------------+------------------------------------------+------------------------------------------------------------------+
| id   | c1              | c2                                       | c3                                       | c4                                                               |
+------+-----------------+------------------------------------------+------------------------------------------+------------------------------------------------------------------+
|    1 | 自定义变量      | 356a192b7913b04c54574d18c28d46e6395428ab | da4b9237bacccdf19c0760cab7aec4a8359010b0 | 4e07408562bedb8b60ce05c1decfe3ad16b72230967de01f640b7e4729b49fce |
|    2 | 全局变量        | 356a192b7913b04c54574d18c28d46e6395428ab | da4b9237bacccdf19c0760cab7aec4a8359010b0 | 4e07408562bedb8b60ce05c1decfe3ad16b72230967de01f640b7e4729b49fce |
|    3 | 参数变量        | 356a192b7913b04c54574d18c28d46e6395428ab | da4b9237bacccdf19c0760cab7aec4a8359010b0 | 4e07408562bedb8b60ce05c1decfe3ad16b72230967de01f640b7e4729b49fce |
+------+-----------------+------------------------------------------+------------------------------------------+------------------------------------------------------------------+
### 标签：sha-3-2 函数      
#定义一个无参的函数
drop function f_sha;//
CREATE FUNCTION f_sha() returns varchar(200) READS SQL DATA 
begin
	declare a varchar(200);
	SELECT sha(sal) into a FROM sha_table1 WHERE sha1(id) = sha1(4);
	return a;
END;
//
SELECT  f_sha();//
+------------------------------------------+
| f_sha()                                  |
+------------------------------------------+
| f8237d8959e03355010bb85cc3dc46a46fb31110 |
+------------------------------------------+
#定义一个有参的函数
DROP FUNCTION f_sha;//
CREATE FUNCTION f_sha(invalue varchar(200)) returns  varchar(200) READS SQL DATA 
begin
	declare a varchar(200);
	SELECT sha1(sal) into a FROM sha_table1 WHERE sha1(id) = invalue;
	return a;
END ;
//
SELECT f_sha(sha1(3));//
+------------------------------------------+
| f_sha(sha1(3))                           |
+------------------------------------------+
| 31d9ddeaa80bc88c1f3117b9724726ebcc7fc72d |
+------------------------------------------+
##dml语句
#条件语句
DROP FUNCTION f_sha;//
CREATE FUNCTION f_sha(invalue varchar(200),ina varchar(200),inb varchar(200),inc varchar(200))returns varchar(200) DETERMINISTIC
begin
    IF invalue = sha('sha_table1') THEN 
	   INSERT INTO sha_table1 VALUES(26,'FUNCTION-If条件','杭州7',sha2(ina+inb+inc,512));
    ELSE 
	   INSERT INTO sha_table2 VALUES(4,sha(ina),sha1(inb),sha2(inb,512));
    END IF;
    return sha2(ina+inb+inc,512);
END;
//
SELECT COUNT(*) FROM sha_table1;//
+----------+
| COUNT(*) |
+----------+
|       26 |
+----------+
SELECT COUNT(*) FROM sha_table2;//
+----------+
| COUNT(*) |
+----------+
|        6 |
+----------+
SET @invalue := sha1('sha_table1');//
SET @ina := '1';//
SET @inb := '2';//
SET @inc := '3';//
SELECT f_sha(@invalue,@ina,@inb,@inc);//
+----------------------------------------------------------------------------------------------------------------------------------+
| f_sha(@invalue,@ina,@inb,@inc)                                                                                                   |
+----------------------------------------------------------------------------------------------------------------------------------+
| 3c9ad55147a7144f6067327c3b82ea70e7c5426add9ceea4d07dc2902239bf9e049b88625eb65d014a7718f79354608cab0921782c643f0208983fffa3582e40 |
+----------------------------------------------------------------------------------------------------------------------------------+
SELECT id,name,addressess,sal FROM sha_table1 ORDER BY id;//
+------+------------------------+------------+----------------------------------------------------------------------------------------------------------------------------------+
| id   | name                   | addressess | sal                                                                                                                              |
+------+------------------------+------------+----------------------------------------------------------------------------------------------------------------------------------+
|    1 | 不一                   | 杭州       | 15000                                                                                                                            |
|    2 | 不二                   | 苏州       | 8000                                                                                                                             |
|    3 | 不三                   | 洛阳       | 6000                                                                                                                             |
|    4 | 不四                   | 濮阳       | 5000                                                                                                                             |
|    5 | 不易1                  | 杭州1      | c4528b12c0581e2d63285f369dd6eb97a1dc4364                                                                                         |
|    6 | 不易1                  | 杭州1      | 9131555c6f4b67152897a8fc66b7bcd2de2e5891                                                                                         |
|    7 | 不易1                  | 杭州1      | 5fa0f837dcfe808e7f8a5c22c8549588ea868c44                                                                                         |
|    8 | 不易2                  | 杭州2      | 84304dedd765b959d054ed4333448d60ad5e6b8e                                                                                         |
|    9 | 不易2                  | 杭州2      | 27529aa462f33715b44be8935c3887a4825fe289                                                                                         |
|   10 | 不易2                  | 杭州2      | d239a9839404faf538e085739173bad0a2b9bda6                                                                                         |
|   11 | 不易2                  | 杭州2      | 982906af37623afd726ed6eac797c1030e3c00d1                                                                                         |
|   11 | 不易3                  | 杭州3      | 7fb8a56336e161678d48fee87ee481f9afda126e6ee86d139bbb9d23e9fed2d3                                                                 |
|   12 | 不易3                  | 杭州3      | 21612db808d2becd4a2e1f489a1404583c7199cc162993c8cc167e4199505856                                                                 |
|   13 | 不易3                  | 杭州3      | 6e237b1f8dc0da15957d168af0b2f58ce8dbc421671f0b38d1f39cc6026af032                                                                 |
|   14 | 不易4                  | 杭州4      | 3046e2c3c404bb96d5e172b6add694980733b4956ccc56e20b9f5e47                                                                         |
|   15 | 不易4                  | 杭州4      | be23ea086eea7bdd5e7207c91e9d744e8128ee6fe429ac437e025090                                                                         |
|   16 | 不易4                  | 杭州4      | db0571afb43bf248f54c2579e3952cdf4d9226c2242b707e375d3fcf                                                                         |
|   17 | PROCEDURE-If条件       | 杭州5      | 3c9ad55147a7144f6067327c3b82ea70e7c5426add9ceea4d07dc2902239bf9e049b88625eb65d014a7718f79354608cab0921782c643f0208983fffa3582e40 |
|   18 | PROCEDURE-While循环    | 杭州5      | 62eaedeada371f634322780ae8ff95e6c269ebf3                                                                                         |
|   19 | PROCEDURE-While循环    | 杭州5      | eb4e53533101ab8e8bdab0e068821493b02f9707                                                                                         |
|   20 | PROCEDURE-While循环    | 杭州5      | b6f645f796048a40fcb0f120373dbb2712f298c6                                                                                         |
|   21 | PROCEDURE-Loop循环     | 杭州6      | 91f4a1e93e73e19b75606041453b81ac73c9abe3                                                                                         |
|   22 | PROCEDURE-Loop循环     | 杭州6      | a58dcb7f4d5593428bac0dd85c941f216c6fcd34                                                                                         |
|   23 | PROCEDURE-Loop循环     | 杭州6      | 21407653fb5e0dccd0f0db39ce608d606700b787                                                                                         |
|   24 | PROCEDURE-Repeat循环   | 杭州7      | 8a24db5a7a70d1ee925f80b7a513f24d3ddf49c4e709ad7f666df513                                                                         |
|   25 | PROCEDURE-Repeat循环   | 杭州7      | b7d99d68729979843c0141882618b2d3e112460b647cd688cc1684d8                                                                         |
|   26 | FUNCTION-If条件        | 杭州7      | 3c9ad55147a7144f6067327c3b82ea70e7c5426add9ceea4d07dc2902239bf9e049b88625eb65d014a7718f79354608cab0921782c643f0208983fffa3582e40 |
+------+------------------------+------------+----------------------------------------------------------------------------------------------------------------------------------+
SET @invalue := sha1('sha_table2');//
SET @ina := '1';//
SET @inb := '2';//
SET @inc := '3';//
SELECT f_sha(@invalue,@ina,@inb,@inc);//
+----------------------------------------------------------------------------------------------------------------------------------+
| f_sha(@invalue,@ina,@inb,@inc)                                                                                                   |
+----------------------------------------------------------------------------------------------------------------------------------+
| 3c9ad55147a7144f6067327c3b82ea70e7c5426add9ceea4d07dc2902239bf9e049b88625eb65d014a7718f79354608cab0921782c643f0208983fffa3582e40 |
+----------------------------------------------------------------------------------------------------------------------------------+
SELECT id,sal_sha,sal_sha1,sal_sha2 FROM sha_table2 ORDER BY id;//
+------+------------------------------------------+------------------------------------------+----------------------------------------------------------------------------------------------------------------------------------+
| id   | sal_sha                                  | sal_sha1                                 | sal_sha2                                                                                                                         |
+------+------------------------------------------+------------------------------------------+----------------------------------------------------------------------------------------------------------------------------------+
|    1 | 271593a69439c052d4de63e50c569060dcd78e91 | 271593a69439c052d4de63e50c569060dcd78e91 | 00874d5a05f6bc2112ebf308bd11671b46bb4715d9fd90295bc3fc59                                                                         |
|    2 | 2de49ac0fce223dbdd31d2b8b3b3710582ef1535 | 2de49ac0fce223dbdd31d2b8b3b3710582ef1535 | c3ef46b539da72ab30382ab94535ffefc0ee4e4c04c589058af495df                                                                         |
|    2 | 2de49ac0fce223dbdd31d2b8b3b3710582ef1535 | 124d946b501f4dfb396971bc981a890abc8e3597 | acd41d66df321a7c860e6d593ca7125ed4e9dbd4f35e4be1db5e7e0ef0057c25bba3dbf037e6ed12fae9d60a8e106822                                 |
|    3 | 356a192b7913b04c54574d18c28d46e6395428ab | da4b9237bacccdf19c0760cab7aec4a8359010b0 | 40b244112641dd78dd4f93b6c9190dd46e0099194d5a44257b7efad6ef9ff4683da1eda0244448cb343aa688f5d3efd7314dafe580ac0bcbf115aeca9e8dc114 |
|    3 | 31d9ddeaa80bc88c1f3117b9724726ebcc7fc72d | fe4c3e34ef832c2081b151e3df428bcb3956b4d3 | 6bf91bebceb2c95cc1b8e1e1975d1e11b62cd07b1506ffdeaf1b7cc726d3d0ea71286e3d42c36a61f9d87ef01b85d402                                 |
|    4 | 31d9ddeaa80bc88c1f3117b9724726ebcc7fc72d | 9e898cce023258f18c2122444daabf95f19f5308 | faf403e1222af7682cc7eb74b708068b10eac9122a54a4d0d8483cfdb1b38b289569472b3e547b812a7922b68100022052322b557dcb92dff8c7e1984ad0db23 |
|    4 | 356a192b7913b04c54574d18c28d46e6395428ab | da4b9237bacccdf19c0760cab7aec4a8359010b0 | 40b244112641dd78dd4f93b6c9190dd46e0099194d5a44257b7efad6ef9ff4683da1eda0244448cb343aa688f5d3efd7314dafe580ac0bcbf115aeca9e8dc114 |
+------+------------------------------------------+------------------------------------------+----------------------------------------------------------------------------------------------------------------------------------+
#循环语句
DROP FUNCTION f_sha;//
CREATE  FUNCTION f_sha(invalue varchar(200)) returns varchar(200) DETERMINISTIC
begin
	declare a varchar(200);
    declare i int default 27;
	SELECT sha1(sal) into a FROM sha_table1 WHERE sha2(name,256) = invalue;
	
    WHILE i <= 29 do
      INSERT INTO sha_table1 VALUES(i,'FUNCTION-While循环','杭州8',sha(8000+i));
      set i := i+1;
    END WHILE;

    loop_name:LOOP
      INSERT INTO sha_table1 VALUES(i,'FUNCTION-Loop循环','杭州9',sha1(8000+i));
      SET i := i+1;
      IF i > 32 THEN 
	    LEAVE loop_name;
      END IF;
    END LOOP loop_name;

    REPEAT
      INSERT INTO sha_table1 VALUES(i,'FUNCTION-Repeat循环','杭州10',sha2(8000+i,224));
      SET i := i+1;
      until i > 34	
    END  REPEAT;
	return a;
END;
//
SELECT COUNT(*) FROM sha_table1;//
+----------+
| COUNT(*) |
+----------+
|       27 |
+----------+
SELECT f_sha(sha2('不三',256));//
+------------------------------------------+
| f_sha(sha2('不三',256))                  |
+------------------------------------------+
| 31d9ddeaa80bc88c1f3117b9724726ebcc7fc72d |
+------------------------------------------+
SELECT id,name,addressess,sal FROM sha_table1 ORDER BY id;//
+------+------------------------+------------+----------------------------------------------------------------------------------------------------------------------------------+
| id   | name                   | addressess | sal                                                                                                                              |
+------+------------------------+------------+----------------------------------------------------------------------------------------------------------------------------------+
|    1 | 不一                   | 杭州       | 15000                                                                                                                            |
|    2 | 不二                   | 苏州       | 8000                                                                                                                             |
|    3 | 不三                   | 洛阳       | 6000                                                                                                                             |
|    4 | 不四                   | 濮阳       | 5000                                                                                                                             |
|    5 | 不易1                  | 杭州1      | c4528b12c0581e2d63285f369dd6eb97a1dc4364                                                                                         |
|    6 | 不易1                  | 杭州1      | 9131555c6f4b67152897a8fc66b7bcd2de2e5891                                                                                         |
|    7 | 不易1                  | 杭州1      | 5fa0f837dcfe808e7f8a5c22c8549588ea868c44                                                                                         |
|    8 | 不易2                  | 杭州2      | 84304dedd765b959d054ed4333448d60ad5e6b8e                                                                                         |
|    9 | 不易2                  | 杭州2      | 27529aa462f33715b44be8935c3887a4825fe289                                                                                         |
|   10 | 不易2                  | 杭州2      | d239a9839404faf538e085739173bad0a2b9bda6                                                                                         |
|   11 | 不易2                  | 杭州2      | 982906af37623afd726ed6eac797c1030e3c00d1                                                                                         |
|   11 | 不易3                  | 杭州3      | 7fb8a56336e161678d48fee87ee481f9afda126e6ee86d139bbb9d23e9fed2d3                                                                 |
|   12 | 不易3                  | 杭州3      | 21612db808d2becd4a2e1f489a1404583c7199cc162993c8cc167e4199505856                                                                 |
|   13 | 不易3                  | 杭州3      | 6e237b1f8dc0da15957d168af0b2f58ce8dbc421671f0b38d1f39cc6026af032                                                                 |
|   14 | 不易4                  | 杭州4      | 3046e2c3c404bb96d5e172b6add694980733b4956ccc56e20b9f5e47                                                                         |
|   15 | 不易4                  | 杭州4      | be23ea086eea7bdd5e7207c91e9d744e8128ee6fe429ac437e025090                                                                         |
|   16 | 不易4                  | 杭州4      | db0571afb43bf248f54c2579e3952cdf4d9226c2242b707e375d3fcf                                                                         |
|   17 | PROCEDURE-If条件       | 杭州5      | 3c9ad55147a7144f6067327c3b82ea70e7c5426add9ceea4d07dc2902239bf9e049b88625eb65d014a7718f79354608cab0921782c643f0208983fffa3582e40 |
|   18 | PROCEDURE-While循环    | 杭州5      | 62eaedeada371f634322780ae8ff95e6c269ebf3                                                                                         |
|   19 | PROCEDURE-While循环    | 杭州5      | eb4e53533101ab8e8bdab0e068821493b02f9707                                                                                         |
|   20 | PROCEDURE-While循环    | 杭州5      | b6f645f796048a40fcb0f120373dbb2712f298c6                                                                                         |
|   21 | PROCEDURE-Loop循环     | 杭州6      | 91f4a1e93e73e19b75606041453b81ac73c9abe3                                                                                         |
|   22 | PROCEDURE-Loop循环     | 杭州6      | a58dcb7f4d5593428bac0dd85c941f216c6fcd34                                                                                         |
|   23 | PROCEDURE-Loop循环     | 杭州6      | 21407653fb5e0dccd0f0db39ce608d606700b787                                                                                         |
|   24 | PROCEDURE-Repeat循环   | 杭州7      | 8a24db5a7a70d1ee925f80b7a513f24d3ddf49c4e709ad7f666df513                                                                         |
|   25 | PROCEDURE-Repeat循环   | 杭州7      | b7d99d68729979843c0141882618b2d3e112460b647cd688cc1684d8                                                                         |
|   26 | FUNCTION-If条件        | 杭州7      | 3c9ad55147a7144f6067327c3b82ea70e7c5426add9ceea4d07dc2902239bf9e049b88625eb65d014a7718f79354608cab0921782c643f0208983fffa3582e40 |
|   27 | FUNCTION-While循环     | 杭州8      | 05cd62a7341bee1a1db69f68bdbf8be35ad1c3ff                                                                                         |
|   28 | FUNCTION-While循环     | 杭州8      | c9ecc30d06a346411e9b56cf2f6fb1e7ebcf5db3                                                                                         |
|   29 | FUNCTION-While循环     | 杭州8      | 0734191fd7da1554d4ea2133df31209ef2d9302a                                                                                         |
|   30 | FUNCTION-Loop循环      | 杭州9      | e3bb938a1e4b7bad82270a93401d99e5ad22f90b                                                                                         |
|   31 | FUNCTION-Loop循环      | 杭州9      | 27abda65bdedf4f26e868fc69b2d3f9c0ef8c55b                                                                                         |
|   32 | FUNCTION-Loop循环      | 杭州9      | fa235e465ec7f73864e37f6a021168f9f4b71c8b                                                                                         |
|   33 | FUNCTION-Repeat循环    | 杭州10     | 97318f8cc65cd0767754a8aa130a4a7b4ebda9110b7098456f603afc                                                                         |
|   34 | FUNCTION-Repeat循环    | 杭州10     | 73101c4423445f60dddee1b6033ecef71f84288139255192cdcd1145                                                                         |
+------+------------------------+------------+----------------------------------------------------------------------------------------------------------------------------------+
### 标签：sha-3-3 触发器    
DROP TRIGGER base_pl;//
CREATE TRIGGER base_pl BEFORE INSERT
ON sha_table1 FOR EACH ROW
BEGIN
	DECLARE a int;
	DECLARE b VARCHAR(20);
	set a=10;
	set b='insert';
	loop1: LOOP
	  if a < 15 then
	    INSERT INTO sha_table2 VALUES(a,'触发器-插入数据 insert',sha1(b),sha2(b,0));
	  elseif a = 16 then
	    update sha_table2 set sal_sha = '触发器-更新数据 update',sal_sha1=sha1('update'),sal_sha2=sha2('update',0)  WHERE id >= 12;
	    LEAVE loop1;
	  else
	    delete FROM sha_table2 WHERE sha(id) = sha(14);	
	  end if;
	  set a = a + 1;
	end LOOP loop1;
END;
//
SELECT * FROM sha_table1 ORDER BY id;//
+------+------------------------+------------+----------------------------------------------------------------------------------------------------------------------------------+
| id   | name                   | addressess | sal                                                                                                                              |
+------+------------------------+------------+----------------------------------------------------------------------------------------------------------------------------------+
|    1 | 不一                   | 杭州       | 15000                                                                                                                            |
|    2 | 不二                   | 苏州       | 8000                                                                                                                             |
|    3 | 不三                   | 洛阳       | 6000                                                                                                                             |
|    4 | 不四                   | 濮阳       | 5000                                                                                                                             |
|    5 | 不易1                  | 杭州1      | c4528b12c0581e2d63285f369dd6eb97a1dc4364                                                                                         |
|    6 | 不易1                  | 杭州1      | 9131555c6f4b67152897a8fc66b7bcd2de2e5891                                                                                         |
|    7 | 不易1                  | 杭州1      | 5fa0f837dcfe808e7f8a5c22c8549588ea868c44                                                                                         |
|    8 | 不易2                  | 杭州2      | 84304dedd765b959d054ed4333448d60ad5e6b8e                                                                                         |
|    9 | 不易2                  | 杭州2      | 27529aa462f33715b44be8935c3887a4825fe289                                                                                         |
|   10 | 不易2                  | 杭州2      | d239a9839404faf538e085739173bad0a2b9bda6                                                                                         |
|   11 | 不易2                  | 杭州2      | 982906af37623afd726ed6eac797c1030e3c00d1                                                                                         |
|   11 | 不易3                  | 杭州3      | 7fb8a56336e161678d48fee87ee481f9afda126e6ee86d139bbb9d23e9fed2d3                                                                 |
|   12 | 不易3                  | 杭州3      | 21612db808d2becd4a2e1f489a1404583c7199cc162993c8cc167e4199505856                                                                 |
|   13 | 不易3                  | 杭州3      | 6e237b1f8dc0da15957d168af0b2f58ce8dbc421671f0b38d1f39cc6026af032                                                                 |
|   14 | 不易4                  | 杭州4      | 3046e2c3c404bb96d5e172b6add694980733b4956ccc56e20b9f5e47                                                                         |
|   15 | 不易4                  | 杭州4      | be23ea086eea7bdd5e7207c91e9d744e8128ee6fe429ac437e025090                                                                         |
|   16 | 不易4                  | 杭州4      | db0571afb43bf248f54c2579e3952cdf4d9226c2242b707e375d3fcf                                                                         |
|   17 | PROCEDURE-If条件       | 杭州5      | 3c9ad55147a7144f6067327c3b82ea70e7c5426add9ceea4d07dc2902239bf9e049b88625eb65d014a7718f79354608cab0921782c643f0208983fffa3582e40 |
|   18 | PROCEDURE-While循环    | 杭州5      | 62eaedeada371f634322780ae8ff95e6c269ebf3                                                                                         |
|   19 | PROCEDURE-While循环    | 杭州5      | eb4e53533101ab8e8bdab0e068821493b02f9707                                                                                         |
|   20 | PROCEDURE-While循环    | 杭州5      | b6f645f796048a40fcb0f120373dbb2712f298c6                                                                                         |
|   21 | PROCEDURE-Loop循环     | 杭州6      | 91f4a1e93e73e19b75606041453b81ac73c9abe3                                                                                         |
|   22 | PROCEDURE-Loop循环     | 杭州6      | a58dcb7f4d5593428bac0dd85c941f216c6fcd34                                                                                         |
|   23 | PROCEDURE-Loop循环     | 杭州6      | 21407653fb5e0dccd0f0db39ce608d606700b787                                                                                         |
|   24 | PROCEDURE-Repeat循环   | 杭州7      | 8a24db5a7a70d1ee925f80b7a513f24d3ddf49c4e709ad7f666df513                                                                         |
|   25 | PROCEDURE-Repeat循环   | 杭州7      | b7d99d68729979843c0141882618b2d3e112460b647cd688cc1684d8                                                                         |
|   26 | FUNCTION-If条件        | 杭州7      | 3c9ad55147a7144f6067327c3b82ea70e7c5426add9ceea4d07dc2902239bf9e049b88625eb65d014a7718f79354608cab0921782c643f0208983fffa3582e40 |
|   27 | FUNCTION-While循环     | 杭州8      | 05cd62a7341bee1a1db69f68bdbf8be35ad1c3ff                                                                                         |
|   28 | FUNCTION-While循环     | 杭州8      | c9ecc30d06a346411e9b56cf2f6fb1e7ebcf5db3                                                                                         |
|   29 | FUNCTION-While循环     | 杭州8      | 0734191fd7da1554d4ea2133df31209ef2d9302a                                                                                         |
|   30 | FUNCTION-Loop循环      | 杭州9      | e3bb938a1e4b7bad82270a93401d99e5ad22f90b                                                                                         |
|   31 | FUNCTION-Loop循环      | 杭州9      | 27abda65bdedf4f26e868fc69b2d3f9c0ef8c55b                                                                                         |
|   32 | FUNCTION-Loop循环      | 杭州9      | fa235e465ec7f73864e37f6a021168f9f4b71c8b                                                                                         |
|   33 | FUNCTION-Repeat循环    | 杭州10     | 97318f8cc65cd0767754a8aa130a4a7b4ebda9110b7098456f603afc                                                                         |
|   34 | FUNCTION-Repeat循环    | 杭州10     | 73101c4423445f60dddee1b6033ecef71f84288139255192cdcd1145                                                                         |
+------+------------------------+------------+----------------------------------------------------------------------------------------------------------------------------------+
SELECT * FROM sha_table2 ORDER BY id;//
+------+------------------------------------------+------------------------------------------+----------------------------------------------------------------------------------------------------------------------------------+
| id   | sal_sha                                  | sal_sha1                                 | sal_sha2                                                                                                                         |
+------+------------------------------------------+------------------------------------------+----------------------------------------------------------------------------------------------------------------------------------+
|    1 | 271593a69439c052d4de63e50c569060dcd78e91 | 271593a69439c052d4de63e50c569060dcd78e91 | 00874d5a05f6bc2112ebf308bd11671b46bb4715d9fd90295bc3fc59                                                                         |
|    2 | 2de49ac0fce223dbdd31d2b8b3b3710582ef1535 | 2de49ac0fce223dbdd31d2b8b3b3710582ef1535 | c3ef46b539da72ab30382ab94535ffefc0ee4e4c04c589058af495df                                                                         |
|    2 | 2de49ac0fce223dbdd31d2b8b3b3710582ef1535 | 124d946b501f4dfb396971bc981a890abc8e3597 | acd41d66df321a7c860e6d593ca7125ed4e9dbd4f35e4be1db5e7e0ef0057c25bba3dbf037e6ed12fae9d60a8e106822                                 |
|    3 | 356a192b7913b04c54574d18c28d46e6395428ab | da4b9237bacccdf19c0760cab7aec4a8359010b0 | 40b244112641dd78dd4f93b6c9190dd46e0099194d5a44257b7efad6ef9ff4683da1eda0244448cb343aa688f5d3efd7314dafe580ac0bcbf115aeca9e8dc114 |
|    3 | 31d9ddeaa80bc88c1f3117b9724726ebcc7fc72d | fe4c3e34ef832c2081b151e3df428bcb3956b4d3 | 6bf91bebceb2c95cc1b8e1e1975d1e11b62cd07b1506ffdeaf1b7cc726d3d0ea71286e3d42c36a61f9d87ef01b85d402                                 |
|    4 | 31d9ddeaa80bc88c1f3117b9724726ebcc7fc72d | 9e898cce023258f18c2122444daabf95f19f5308 | faf403e1222af7682cc7eb74b708068b10eac9122a54a4d0d8483cfdb1b38b289569472b3e547b812a7922b68100022052322b557dcb92dff8c7e1984ad0db23 |
|    4 | 356a192b7913b04c54574d18c28d46e6395428ab | da4b9237bacccdf19c0760cab7aec4a8359010b0 | 40b244112641dd78dd4f93b6c9190dd46e0099194d5a44257b7efad6ef9ff4683da1eda0244448cb343aa688f5d3efd7314dafe580ac0bcbf115aeca9e8dc114 |
+------+------------------------------------------+------------------------------------------+----------------------------------------------------------------------------------------------------------------------------------+
INSERT INTO sha_table1 VALUES(34,'触发触发器-插入数据','杭州9',sha(8000));//
SELECT * FROM sha_table1 ORDER BY id;//
+------+------------------------------+------------+----------------------------------------------------------------------------------------------------------------------------------+
| id   | name                         | addressess | sal                                                                                                                              |
+------+------------------------------+------------+----------------------------------------------------------------------------------------------------------------------------------+
|    1 | 不一                         | 杭州       | 15000                                                                                                                            |
|    2 | 不二                         | 苏州       | 8000                                                                                                                             |
|    3 | 不三                         | 洛阳       | 6000                                                                                                                             |
|    4 | 不四                         | 濮阳       | 5000                                                                                                                             |
|    5 | 不易1                        | 杭州1      | c4528b12c0581e2d63285f369dd6eb97a1dc4364                                                                                         |
|    6 | 不易1                        | 杭州1      | 9131555c6f4b67152897a8fc66b7bcd2de2e5891                                                                                         |
|    7 | 不易1                        | 杭州1      | 5fa0f837dcfe808e7f8a5c22c8549588ea868c44                                                                                         |
|    8 | 不易2                        | 杭州2      | 84304dedd765b959d054ed4333448d60ad5e6b8e                                                                                         |
|    9 | 不易2                        | 杭州2      | 27529aa462f33715b44be8935c3887a4825fe289                                                                                         |
|   10 | 不易2                        | 杭州2      | d239a9839404faf538e085739173bad0a2b9bda6                                                                                         |
|   11 | 不易2                        | 杭州2      | 982906af37623afd726ed6eac797c1030e3c00d1                                                                                         |
|   11 | 不易3                        | 杭州3      | 7fb8a56336e161678d48fee87ee481f9afda126e6ee86d139bbb9d23e9fed2d3                                                                 |
|   12 | 不易3                        | 杭州3      | 21612db808d2becd4a2e1f489a1404583c7199cc162993c8cc167e4199505856                                                                 |
|   13 | 不易3                        | 杭州3      | 6e237b1f8dc0da15957d168af0b2f58ce8dbc421671f0b38d1f39cc6026af032                                                                 |
|   14 | 不易4                        | 杭州4      | 3046e2c3c404bb96d5e172b6add694980733b4956ccc56e20b9f5e47                                                                         |
|   15 | 不易4                        | 杭州4      | be23ea086eea7bdd5e7207c91e9d744e8128ee6fe429ac437e025090                                                                         |
|   16 | 不易4                        | 杭州4      | db0571afb43bf248f54c2579e3952cdf4d9226c2242b707e375d3fcf                                                                         |
|   17 | PROCEDURE-If条件             | 杭州5      | 3c9ad55147a7144f6067327c3b82ea70e7c5426add9ceea4d07dc2902239bf9e049b88625eb65d014a7718f79354608cab0921782c643f0208983fffa3582e40 |
|   18 | PROCEDURE-While循环          | 杭州5      | 62eaedeada371f634322780ae8ff95e6c269ebf3                                                                                         |
|   19 | PROCEDURE-While循环          | 杭州5      | eb4e53533101ab8e8bdab0e068821493b02f9707                                                                                         |
|   20 | PROCEDURE-While循环          | 杭州5      | b6f645f796048a40fcb0f120373dbb2712f298c6                                                                                         |
|   21 | PROCEDURE-Loop循环           | 杭州6      | 91f4a1e93e73e19b75606041453b81ac73c9abe3                                                                                         |
|   22 | PROCEDURE-Loop循环           | 杭州6      | a58dcb7f4d5593428bac0dd85c941f216c6fcd34                                                                                         |
|   23 | PROCEDURE-Loop循环           | 杭州6      | 21407653fb5e0dccd0f0db39ce608d606700b787                                                                                         |
|   24 | PROCEDURE-Repeat循环         | 杭州7      | 8a24db5a7a70d1ee925f80b7a513f24d3ddf49c4e709ad7f666df513                                                                         |
|   25 | PROCEDURE-Repeat循环         | 杭州7      | b7d99d68729979843c0141882618b2d3e112460b647cd688cc1684d8                                                                         |
|   26 | FUNCTION-If条件              | 杭州7      | 3c9ad55147a7144f6067327c3b82ea70e7c5426add9ceea4d07dc2902239bf9e049b88625eb65d014a7718f79354608cab0921782c643f0208983fffa3582e40 |
|   27 | FUNCTION-While循环           | 杭州8      | 05cd62a7341bee1a1db69f68bdbf8be35ad1c3ff                                                                                         |
|   28 | FUNCTION-While循环           | 杭州8      | c9ecc30d06a346411e9b56cf2f6fb1e7ebcf5db3                                                                                         |
|   29 | FUNCTION-While循环           | 杭州8      | 0734191fd7da1554d4ea2133df31209ef2d9302a                                                                                         |
|   30 | FUNCTION-Loop循环            | 杭州9      | e3bb938a1e4b7bad82270a93401d99e5ad22f90b                                                                                         |
|   31 | FUNCTION-Loop循环            | 杭州9      | 27abda65bdedf4f26e868fc69b2d3f9c0ef8c55b                                                                                         |
|   32 | FUNCTION-Loop循环            | 杭州9      | fa235e465ec7f73864e37f6a021168f9f4b71c8b                                                                                         |
|   33 | FUNCTION-Repeat循环          | 杭州10     | 97318f8cc65cd0767754a8aa130a4a7b4ebda9110b7098456f603afc                                                                         |
|   34 | 触发触发器-插入数据          | 杭州9      | 2de49ac0fce223dbdd31d2b8b3b3710582ef1535                                                                                         |
|   34 | FUNCTION-Repeat循环          | 杭州10     | 73101c4423445f60dddee1b6033ecef71f84288139255192cdcd1145                                                                         |
+------+------------------------------+------------+----------------------------------------------------------------------------------------------------------------------------------+
SELECT * FROM sha_table2 ORDER BY id;//
+------+------------------------------------------+------------------------------------------+----------------------------------------------------------------------------------------------------------------------------------+
| id   | sal_sha                                  | sal_sha1                                 | sal_sha2                                                                                                                         |
+------+------------------------------------------+------------------------------------------+----------------------------------------------------------------------------------------------------------------------------------+
|    1 | 271593a69439c052d4de63e50c569060dcd78e91 | 271593a69439c052d4de63e50c569060dcd78e91 | 00874d5a05f6bc2112ebf308bd11671b46bb4715d9fd90295bc3fc59                                                                         |
|    2 | 2de49ac0fce223dbdd31d2b8b3b3710582ef1535 | 2de49ac0fce223dbdd31d2b8b3b3710582ef1535 | c3ef46b539da72ab30382ab94535ffefc0ee4e4c04c589058af495df                                                                         |
|    2 | 2de49ac0fce223dbdd31d2b8b3b3710582ef1535 | 124d946b501f4dfb396971bc981a890abc8e3597 | acd41d66df321a7c860e6d593ca7125ed4e9dbd4f35e4be1db5e7e0ef0057c25bba3dbf037e6ed12fae9d60a8e106822                                 |
|    3 | 356a192b7913b04c54574d18c28d46e6395428ab | da4b9237bacccdf19c0760cab7aec4a8359010b0 | 40b244112641dd78dd4f93b6c9190dd46e0099194d5a44257b7efad6ef9ff4683da1eda0244448cb343aa688f5d3efd7314dafe580ac0bcbf115aeca9e8dc114 |
|    3 | 31d9ddeaa80bc88c1f3117b9724726ebcc7fc72d | fe4c3e34ef832c2081b151e3df428bcb3956b4d3 | 6bf91bebceb2c95cc1b8e1e1975d1e11b62cd07b1506ffdeaf1b7cc726d3d0ea71286e3d42c36a61f9d87ef01b85d402                                 |
|    4 | 31d9ddeaa80bc88c1f3117b9724726ebcc7fc72d | 9e898cce023258f18c2122444daabf95f19f5308 | faf403e1222af7682cc7eb74b708068b10eac9122a54a4d0d8483cfdb1b38b289569472b3e547b812a7922b68100022052322b557dcb92dff8c7e1984ad0db23 |
|    4 | 356a192b7913b04c54574d18c28d46e6395428ab | da4b9237bacccdf19c0760cab7aec4a8359010b0 | 40b244112641dd78dd4f93b6c9190dd46e0099194d5a44257b7efad6ef9ff4683da1eda0244448cb343aa688f5d3efd7314dafe580ac0bcbf115aeca9e8dc114 |
|   10 | 触发器-插入数据 insert                   | a26aafc1f521420b84a65c0884ceaff6c083f05b | 1e22560cee2c4b727c6a117792e04a6769efbe2395f8e2528c603a153a446477                                                                 |
|   11 | 触发器-插入数据 insert                   | a26aafc1f521420b84a65c0884ceaff6c083f05b | 1e22560cee2c4b727c6a117792e04a6769efbe2395f8e2528c603a153a446477                                                                 |
|   12 | 触发器-更新数据 update                   | 0a25ba5991316bdda4a9b3abcee2106016df28a0 | 2937013f2181810606b2a799b05bda2849f3e369a20982a4138f0e0a55984ce4                                                                 |
|   13 | 触发器-更新数据 update                   | 0a25ba5991316bdda4a9b3abcee2106016df28a0 | 2937013f2181810606b2a799b05bda2849f3e369a20982a4138f0e0a55984ce4                                                                 |
+------+------------------------------------------+------------------------------------------+----------------------------------------------------------------------------------------------------------------------------------+
-----------------------------------------------------------------------------------------------------------------
------------------------- 加密函数-sha(str)/sha1(str), sha2(str, hash_length) 视图，索引，约束 ------------------
### 用例：sha-4  sha(str)/sha1(str)/sha2(str) - 视图，索引，约束
-----------------------------------------------------------------------------------------------------------------
#################################################################################
### 表，视图创建
DROP TABLE sha_table1;
CREATE TABLE sha_table1(id int,name varchar(200), address varchar(200),sal varchar(200));
INSERT INTO sha_table1 VALUES(1,'阿里','杭州','15000');
INSERT INTO sha_table1 VALUES(2,'阿依','广州','8000');
INSERT INTO sha_table1 VALUES(3,'阿布','苏州','6000');
INSERT INTO sha_table1 VALUES(4,'阿珊','苏州','5000');
DROP TABLE sha_table2;
CREATE TABLE sha_table2(id int,style varchar(200),price int);
INSERT INTO sha_table2 VALUES(1,'键盘',300);
INSERT INTO sha_table2 VALUES(2,'鼠标',200);
INSERT INTO sha_table2 VALUES(3,'耳机',500);
DROP TABLE sha_table4;
CREATE TABLE sha_table4(id int,c1 varchar(200),c2 varchar(200),c3 varchar(200));
DROP VIEW sha_table1_view;
CREATE VIEW sha_table1_view AS SELECT * FROM sha_table1 WHERE sha(id) >= sha(4);
DROP VIEW t2_view;
CREATE VIEW t2_view AS SELECT * FROM sha_table2 WHERE sha(id) like '%A%';
DROP TABLE t3_view;
SELECT * FROM sha_table1_view ORDER BY id;
+------+--------+---------+-------+
| id   | name   | address | sal   |
+------+--------+---------+-------+
|    1 | 阿里   | 杭州    | 15000 |
|    2 | 阿依   | 广州    | 8000  |
|    3 | 阿布   | 苏州    | 6000  |
|    4 | 阿珊   | 苏州    | 5000  |
+------+--------+---------+-------+
SELECT * FROM t2_view ORDER BY id;
+------+--------+-------+
| id   | style  | price |
+------+--------+-------+
|    1 | 键盘   |   300 |
|    2 | 鼠标   |   200 |
|    3 | 耳机   |   500 |
+------+--------+-------+
#################################################################################
### 标签：sha-4-1 视图
### SELECT
##多列/单列
SELECT id,sha(e.id),sha1(e.name),sha2(e.address,224) FROM sha_table1_view e ORDER BY e.id;
+------+------------------------------------------+------------------------------------------+----------------------------------------------------------+
| id   | sha(e.id)                                | sha1(e.name)                             | sha2(e.address,224)                                      |
+------+------------------------------------------+------------------------------------------+----------------------------------------------------------+
|    1 | 356a192b7913b04c54574d18c28d46e6395428ab | 6590ec95970ed3bef369b239b44ce608889f17b5 | 78f549d528c983e59a1a7905b715687d12751cd8e95e7d0afca9b46a |
|    2 | da4b9237bacccdf19c0760cab7aec4a8359010b0 | f4b7ea6fd2116531aa725a6e36d5752ae3ed7daf | 71925b54833761a5f07b1a2cfc1f316c796175dcba4b06aa980cec8e |
|    3 | 77de68daecd823babbb58edb1c8e14d7106e83bb | 9d42150fe917c3f9195e7fca2bb380baf00b0880 | beb7b6ff1bdcbaca6e4d06002e5af9296a005efd57c48dce91547383 |
|    4 | 1b6453892473a467d07372d45eb05abc2031647a | 57b7fa2df7239a2f1468a2720c4be5e9c3a4b913 | beb7b6ff1bdcbaca6e4d06002e5af9296a005efd57c48dce91547383 |
+------+------------------------------------------+------------------------------------------+----------------------------------------------------------+
SELECT CONCAT(e.id,e.name) idname,sha(CONCAT(e.id,e.name)),sha1(CONCAT(e.id,e.name)),sha2(CONCAT(e.id,e.name),0) FROM sha_table1_view e ORDER BY e.id;
+---------+------------------------------------------+------------------------------------------+------------------------------------------------------------------+
| idname  | sha(CONCAT(e.id,e.name))                 | sha1(CONCAT(e.id,e.name))                | sha2(CONCAT(e.id,e.name),0)                                      |
+---------+------------------------------------------+------------------------------------------+------------------------------------------------------------------+
| 1阿里   | 5fc1fd757f1f2b3ab6714956a63d59125642dbea | 5fc1fd757f1f2b3ab6714956a63d59125642dbea | d9389cc25a5a682748afbc07678d4d58a2008b12f11c3b38fffe49dfb32ffc2d |
| 2阿依   | f3713ad9e1885fb55e0d920ca12b74b20a78ef21 | f3713ad9e1885fb55e0d920ca12b74b20a78ef21 | ca39855b406a30d9c328943a5ec2c4595e742ae295d2f21fd8919586e238e00f |
| 3阿布   | 9d34bca0d81984ef76d751c7ac37dcfbaf38d4a2 | 9d34bca0d81984ef76d751c7ac37dcfbaf38d4a2 | f479a6f44c20b640c6a9595bcaef7e1b63e66caaa040c8ab9b472d8759354f0c |
| 4阿珊   | d711c46160ab4728c1787141b64b88945b064604 | d711c46160ab4728c1787141b64b88945b064604 | 7ed373852eecfcba50b5c02d022a2272035116da9f809816dfb5efa52311c786 |
+---------+------------------------------------------+------------------------------------------+------------------------------------------------------------------+
##WHERE 子句
SELECT e.id,e.name,sha(e.name) FROM sha_table1_view e WHERE sha(e.name) like '%6590ec%';
+------+--------+------------------------------------------+
| id   | name   | sha(e.name)                              |
+------+--------+------------------------------------------+
|    1 | 阿里   | 6590ec95970ed3bef369b239b44ce608889f17b5 |
+------+--------+------------------------------------------+
SELECT e.id,e.name,sha1(e.name) FROM sha_table1_view e WHERE sha1(e.name) like '%f4b7ea%';
+------+--------+------------------------------------------+
| id   | name   | sha1(e.name)                             |
+------+--------+------------------------------------------+
|    2 | 阿依   | f4b7ea6fd2116531aa725a6e36d5752ae3ed7daf |
+------+--------+------------------------------------------+
SELECT e.id,e.name,sha(e.name) FROM sha_table1_view e WHERE sha(e.name) > sha('阿布') ORDER BY e.id;
+------+--------+------------------------------------------+
| id   | name   | sha(e.name)                              |
+------+--------+------------------------------------------+
|    2 | 阿依   | f4b7ea6fd2116531aa725a6e36d5752ae3ed7daf |
+------+--------+------------------------------------------+
SELECT e.id,e.name,sha1(e.name) FROM sha_table1_view e WHERE sha1(e.name) < sha1('阿布') ORDER BY e.id;
+------+--------+------------------------------------------+
| id   | name   | sha1(e.name)                             |
+------+--------+------------------------------------------+
|    1 | 阿里   | 6590ec95970ed3bef369b239b44ce608889f17b5 |
|    4 | 阿珊   | 57b7fa2df7239a2f1468a2720c4be5e9c3a4b913 |
+------+--------+------------------------------------------+
SELECT e.id,e.name,sha2(e.name,0) FROM sha_table1_view e WHERE sha2(e.name,0) = sha2('阿布',0) ORDER BY e.id;
+------+--------+------------------------------------------------------------------+
| id   | name   | sha2(e.name,0)                                                   |
+------+--------+------------------------------------------------------------------+
|    3 | 阿布   | 4760eef88a5334c94fa67a33746dd3c31dbf4d2f729813d4903bf9b9cc814ed9 |
+------+--------+------------------------------------------------------------------+
##order by 子句
SELECT e.id,sha(e.id) FROM sha_table1_view e WHERE sha(e.name) < sha('阿布') ORDER BY sha(e.id);
+------+------------------------------------------+
| id   | sha(e.id)                                |
+------+------------------------------------------+
|    4 | 1b6453892473a467d07372d45eb05abc2031647a |
|    1 | 356a192b7913b04c54574d18c28d46e6395428ab |
+------+------------------------------------------+
SELECT e.id,sha(e.id) FROM sha_table1_view e WHERE sha(e.name) < sha('阿布') ORDER BY sha(e.id) DESC;
+------+------------------------------------------+
| id   | sha(e.id)                                |
+------+------------------------------------------+
|    1 | 356a192b7913b04c54574d18c28d46e6395428ab |
|    4 | 1b6453892473a467d07372d45eb05abc2031647a |
+------+------------------------------------------+
SELECT e.id,sha1(e.id) FROM sha_table1_view e WHERE sha1(e.name) < sha1('阿布') ORDER BY sha1(e.id) ;
+------+------------------------------------------+
| id   | sha1(e.id)                               |
+------+------------------------------------------+
|    4 | 1b6453892473a467d07372d45eb05abc2031647a |
|    1 | 356a192b7913b04c54574d18c28d46e6395428ab |
+------+------------------------------------------+
SELECT e.id,sha2(e.id,0) FROM sha_table1_view e WHERE sha2(e.name,0) > sha2('阿布',0) ORDER BY sha2(e.id,0) DESC;
+------+------------------------------------------------------------------+
| id   | sha2(e.id,0)                                                     |
+------+------------------------------------------------------------------+
|    2 | d4735e3a265e16eee03f59718b9b5d03019c07d8b6c51f90da3a666eec13ab35 |
|    4 | 4b227777d4dd1fc61c6f884f48641d02b4d121d3fd328cb08b5531fcacdabf8a |
+------+------------------------------------------------------------------+
##group by having 子句
SELECT e.id,e.address,sha(e.address) FROM sha_table1_view e LEFT JOIN t2_view p ON e.id = p.id GROUP BY sha(e.address),e.id ORDER BY e.id ;
+------+---------+------------------------------------------+
| id   | address | sha(e.address)                           |
+------+---------+------------------------------------------+
|    1 | 杭州    | c2d2d67e9afbca8ad8f4a7ae1dd8b782683cd438 |
|    2 | 广州    | d03d2f65a5ab57980517c9579251f710a4e4c18a |
|    3 | 苏州    | 855f21547c2192ca266a39ff717eb768366f7976 |
|    4 | 苏州    | 855f21547c2192ca266a39ff717eb768366f7976 |
+------+---------+------------------------------------------+
SELECT e.id,e.address,sha1(e.address) FROM sha_table1_view e LEFT JOIN t2_view p ON e.id = p.id GROUP BY sha1(e.address),e.id HAVING SUM(sha1(e.address)) > 0 ORDER BY e.id;
+------+---------+------------------------------------------+
| id   | address | sha1(e.address)                          |
+------+---------+------------------------------------------+
|    3 | 苏州    | 855f21547c2192ca266a39ff717eb768366f7976 |
|    4 | 苏州    | 855f21547c2192ca266a39ff717eb768366f7976 |
+------+---------+------------------------------------------+
Warnings:
Warning	1292	Truncated incorrect DOUBLE value: 'c2d2d67e9afbca8ad8f4a7ae1dd8b782683cd438'
Warning	1292	Truncated incorrect DOUBLE value: 'd03d2f65a5ab57980517c9579251f710a4e4c18a'
Warning	1292	Truncated incorrect DOUBLE value: '855f21547c2192ca266a39ff717eb768366f7976'
Warning	1292	Truncated incorrect DOUBLE value: '855f21547c2192ca266a39ff717eb768366f7976'
SELECT e.id,e.address,sha2(e.address,512) FROM sha_table1_view e  GROUP BY sha2(e.address,512),e.id ORDER BY e.id ;
+------+---------+----------------------------------------------------------------------------------------------------------------------------------+
| id   | address | sha2(e.address,512)                                                                                                              |
+------+---------+----------------------------------------------------------------------------------------------------------------------------------+
|    1 | 杭州    | 588306dffbb95504c7e0ad0314c70ec70aae65921f4e74b82649c6c682767eb1934fa25ea9a701e7b48e11322819b8f26d69489726d607c08e47786b56a0a876 |
|    2 | 广州    | f53a02506cff8f698be38e820c9cb34ec7c82cbfd5dc161564ceb06c6738a3461a6a5d490a63d47f7fa887ef0f68c01f373f2c41b35d65553659b94054a542b2 |
|    3 | 苏州    | de0aba5c28949882c00dabda1dde00402509e02b8252d9e923ca988a8eff4db90ffecd9505f085bfdbaf09ad62323511fb293581ceb2cdc8cf3ba58b8bbad2fc |
|    4 | 苏州    | de0aba5c28949882c00dabda1dde00402509e02b8252d9e923ca988a8eff4db90ffecd9505f085bfdbaf09ad62323511fb293581ceb2cdc8cf3ba58b8bbad2fc |
+------+---------+----------------------------------------------------------------------------------------------------------------------------------+
#DISTINCT
SELECT distinct sha(e.address),e.address FROM sha_table1_view e ORDER BY e.id;
+------------------------------------------+---------+
| sha(e.address)                           | address |
+------------------------------------------+---------+
| c2d2d67e9afbca8ad8f4a7ae1dd8b782683cd438 | 杭州    |
| d03d2f65a5ab57980517c9579251f710a4e4c18a | 广州    |
| 855f21547c2192ca266a39ff717eb768366f7976 | 苏州    |
+------------------------------------------+---------+
SELECT distinct sha1(e.address),e.address FROM sha_table1_view e ORDER BY e.id;
+------------------------------------------+---------+
| sha1(e.address)                          | address |
+------------------------------------------+---------+
| c2d2d67e9afbca8ad8f4a7ae1dd8b782683cd438 | 杭州    |
| d03d2f65a5ab57980517c9579251f710a4e4c18a | 广州    |
| 855f21547c2192ca266a39ff717eb768366f7976 | 苏州    |
+------------------------------------------+---------+
SELECT distinct sha2(e.address,384),e.address FROM sha_table1_view e ORDER BY e.id;
+--------------------------------------------------------------------------------------------------+---------+
| sha2(e.address,384)                                                                              | address |
+--------------------------------------------------------------------------------------------------+---------+
| 46896766552a347360d9e511e4459ceea0e65fae109f7704f7853cb3a6fc9e330d4e61cef9b4d7e668590083e143482d | 杭州    |
| 104ea37dcef1c0648d875bb54d423412b845f34fe78d07d3bfe5ef1897325b04315ba764136ae92309aacb6ef5953cdd | 广州    |
| 87b119ad8420c5d2d2bfe8f2603889d786ef8fcca268e7292d173ede57604531092c3b433da1c89b3e3076e772424d11 | 苏州    |
+--------------------------------------------------------------------------------------------------+---------+
#CASE WHEN
SELECT e.id,e.name,e.sal,sha(CASE WHEN e.sal < 6000 THEN NULL ELSE e.sal END) sal2 FROM sha_table1_view e ORDER BY e.id;
+------+--------+-------+------------------------------------------+
| id   | name   | sal   | sal2                                     |
+------+--------+-------+------------------------------------------+
|    1 | 阿里   | 15000 | 271593a69439c052d4de63e50c569060dcd78e91 |
|    2 | 阿依   | 8000  | 2de49ac0fce223dbdd31d2b8b3b3710582ef1535 |
|    3 | 阿布   | 6000  | 31d9ddeaa80bc88c1f3117b9724726ebcc7fc72d |
|    4 | 阿珊   | 5000  | NULL                                     |
+------+--------+-------+------------------------------------------+
SELECT e.id,e.name,e.sal,CASE sha(e.sal) WHEN sha(5000) THEN '工资低' WHEN sha(6000) THEN '工资一般' ELSE '工资高' END ranks FROM sha_table1_view e ORDER BY e.id;
+------+--------+-------+--------------+
| id   | name   | sal   | ranks        |
+------+--------+-------+--------------+
|    1 | 阿里   | 15000 | 工资高       |
|    2 | 阿依   | 8000  | 工资高       |
|    3 | 阿布   | 6000  | 工资一般     |
|    4 | 阿珊   | 5000  | 工资低       |
+------+--------+-------+--------------+
SELECT e.id,e.name,e.sal,(CASE sha(e.sal) WHEN sha(5000) THEN '工资低' WHEN sha(6000) THEN '工资一般' ELSE '工资高' END) ranks FROM sha_table1_view e GROUP BY (CASE sha(e.sal) WHEN sha(5000) THEN '工资低' WHEN sha(6000) THEN '工资一般' ELSE '工资高' END),e.id ORDER BY e.id ;
+------+--------+-------+--------------+
| id   | name   | sal   | ranks        |
+------+--------+-------+--------------+
|    1 | 阿里   | 15000 | 工资高       |
|    2 | 阿依   | 8000  | 工资高       |
|    3 | 阿布   | 6000  | 工资一般     |
|    4 | 阿珊   | 5000  | 工资低       |
+------+--------+-------+--------------+
##连接查询
SELECT sha(e.name),sha1(e.address),sha2(p.style,0) FROM sha_table1_view e, t2_view p WHERE e.id = p.id ORDER BY e.id DESC;
+------------------------------------------+------------------------------------------+------------------------------------------------------------------+
| sha(e.name)                              | sha1(e.address)                          | sha2(p.style,0)                                                  |
+------------------------------------------+------------------------------------------+------------------------------------------------------------------+
| 9d42150fe917c3f9195e7fca2bb380baf00b0880 | 855f21547c2192ca266a39ff717eb768366f7976 | 1bc009fa87e0dae1a5471eefcde551c4fa0bbb8c1daebf7dfee6652a63d2c348 |
| f4b7ea6fd2116531aa725a6e36d5752ae3ed7daf | d03d2f65a5ab57980517c9579251f710a4e4c18a | f93ba1b7e9289659fef1b4fa9f8b14c093d4df3d76935b72d8633d8e517d49ba |
| 6590ec95970ed3bef369b239b44ce608889f17b5 | c2d2d67e9afbca8ad8f4a7ae1dd8b782683cd438 | 864200bbb241e06718231abc10232c338a8277208b746ae02e3bd83e8df72c4d |
+------------------------------------------+------------------------------------------+------------------------------------------------------------------+
SELECT sha(e.name),sha1(e.address),sha2(p.style,0) FROM sha_table1_view e LEFT JOIN t2_view p ON e.id = p.id ORDER BY e.id DESC;
+------------------------------------------+------------------------------------------+------------------------------------------------------------------+
| sha(e.name)                              | sha1(e.address)                          | sha2(p.style,0)                                                  |
+------------------------------------------+------------------------------------------+------------------------------------------------------------------+
| 57b7fa2df7239a2f1468a2720c4be5e9c3a4b913 | 855f21547c2192ca266a39ff717eb768366f7976 | NULL                                                             |
| 9d42150fe917c3f9195e7fca2bb380baf00b0880 | 855f21547c2192ca266a39ff717eb768366f7976 | 1bc009fa87e0dae1a5471eefcde551c4fa0bbb8c1daebf7dfee6652a63d2c348 |
| f4b7ea6fd2116531aa725a6e36d5752ae3ed7daf | d03d2f65a5ab57980517c9579251f710a4e4c18a | f93ba1b7e9289659fef1b4fa9f8b14c093d4df3d76935b72d8633d8e517d49ba |
| 6590ec95970ed3bef369b239b44ce608889f17b5 | c2d2d67e9afbca8ad8f4a7ae1dd8b782683cd438 | 864200bbb241e06718231abc10232c338a8277208b746ae02e3bd83e8df72c4d |
+------------------------------------------+------------------------------------------+------------------------------------------------------------------+
SELECT sha(e.name),sha1(e.address),sha2(p.style,0) FROM sha_table1_view e RIGHT JOIN t2_view p ON e.id = p.id ORDER BY e.id DESC;
+------------------------------------------+------------------------------------------+------------------------------------------------------------------+
| sha(e.name)                              | sha1(e.address)                          | sha2(p.style,0)                                                  |
+------------------------------------------+------------------------------------------+------------------------------------------------------------------+
| 9d42150fe917c3f9195e7fca2bb380baf00b0880 | 855f21547c2192ca266a39ff717eb768366f7976 | 1bc009fa87e0dae1a5471eefcde551c4fa0bbb8c1daebf7dfee6652a63d2c348 |
| f4b7ea6fd2116531aa725a6e36d5752ae3ed7daf | d03d2f65a5ab57980517c9579251f710a4e4c18a | f93ba1b7e9289659fef1b4fa9f8b14c093d4df3d76935b72d8633d8e517d49ba |
| 6590ec95970ed3bef369b239b44ce608889f17b5 | c2d2d67e9afbca8ad8f4a7ae1dd8b782683cd438 | 864200bbb241e06718231abc10232c338a8277208b746ae02e3bd83e8df72c4d |
+------------------------------------------+------------------------------------------+------------------------------------------------------------------+
SELECT sha(e.name),sha1(e.address),sha2(p.style,0) FROM sha_table1_view e INNER JOIN t2_view p ON e.id = p.id ORDER BY e.id DESC;
+------------------------------------------+------------------------------------------+------------------------------------------------------------------+
| sha(e.name)                              | sha1(e.address)                          | sha2(p.style,0)                                                  |
+------------------------------------------+------------------------------------------+------------------------------------------------------------------+
| 9d42150fe917c3f9195e7fca2bb380baf00b0880 | 855f21547c2192ca266a39ff717eb768366f7976 | 1bc009fa87e0dae1a5471eefcde551c4fa0bbb8c1daebf7dfee6652a63d2c348 |
| f4b7ea6fd2116531aa725a6e36d5752ae3ed7daf | d03d2f65a5ab57980517c9579251f710a4e4c18a | f93ba1b7e9289659fef1b4fa9f8b14c093d4df3d76935b72d8633d8e517d49ba |
| 6590ec95970ed3bef369b239b44ce608889f17b5 | c2d2d67e9afbca8ad8f4a7ae1dd8b782683cd438 | 864200bbb241e06718231abc10232c338a8277208b746ae02e3bd83e8df72c4d |
+------------------------------------------+------------------------------------------+------------------------------------------------------------------+
##SELECT嵌套
#SELECT
SELECT sha(e.id),sha(e.name),sha1(e.address),sha2(e.sal,0) FROM (SELECT id,name,address,sal FROM sha_table1_view WHERE id =1) e;
+------------------------------------------+------------------------------------------+------------------------------------------+------------------------------------------------------------------+
| sha(e.id)                                | sha(e.name)                              | sha1(e.address)                          | sha2(e.sal,0)                                                    |
+------------------------------------------+------------------------------------------+------------------------------------------+------------------------------------------------------------------+
| 356a192b7913b04c54574d18c28d46e6395428ab | 6590ec95970ed3bef369b239b44ce608889f17b5 | c2d2d67e9afbca8ad8f4a7ae1dd8b782683cd438 | d4c999ae43633bd2036188d2bca68e1be8202b2cc1f3a1c42a728eaff7d2483d |
+------------------------------------------+------------------------------------------+------------------------------------------+------------------------------------------------------------------+
#EXISTS AND NOT EXISTS
SELECT e.id,e.name,sha(e.name) FROM sha_table1_view e WHERE EXISTS (SELECT sha(p.id) FROM t2_view p ) ORDER BY e.id;
+------+--------+------------------------------------------+
| id   | name   | sha(e.name)                              |
+------+--------+------------------------------------------+
|    1 | 阿里   | 6590ec95970ed3bef369b239b44ce608889f17b5 |
|    2 | 阿依   | f4b7ea6fd2116531aa725a6e36d5752ae3ed7daf |
|    3 | 阿布   | 9d42150fe917c3f9195e7fca2bb380baf00b0880 |
|    4 | 阿珊   | 57b7fa2df7239a2f1468a2720c4be5e9c3a4b913 |
+------+--------+------------------------------------------+
SELECT e.id,e.name,sha1(e.name) FROM sha_table1_view e WHERE NOT EXISTS (SELECT sha(p.id) FROM t2_view p WHERE p.style like '%whh%' ) ORDER BY e.id;
+------+--------+------------------------------------------+
| id   | name   | sha1(e.name)                             |
+------+--------+------------------------------------------+
|    1 | 阿里   | 6590ec95970ed3bef369b239b44ce608889f17b5 |
|    2 | 阿依   | f4b7ea6fd2116531aa725a6e36d5752ae3ed7daf |
|    3 | 阿布   | 9d42150fe917c3f9195e7fca2bb380baf00b0880 |
|    4 | 阿珊   | 57b7fa2df7239a2f1468a2720c4be5e9c3a4b913 |
+------+--------+------------------------------------------+
#ANY
SELECT e.id,e.name,sha(e.name) FROM sha_table1_view e WHERE sha(e.id) = ANY (SELECT sha(p.id) FROM t2_view p WHERE id = 2) ORDER BY e.id;
+------+--------+------------------------------------------+
| id   | name   | sha(e.name)                              |
+------+--------+------------------------------------------+
|    2 | 阿依   | f4b7ea6fd2116531aa725a6e36d5752ae3ed7daf |
+------+--------+------------------------------------------+
SELECT e.id,e.name,sha1(e.name) FROM sha_table1_view e WHERE sha1(e.id) < ANY (SELECT sha1(p.id) FROM t2_view p WHERE id = 3) ORDER BY e.id;
+------+--------+------------------------------------------+
| id   | name   | sha1(e.name)                             |
+------+--------+------------------------------------------+
|    1 | 阿里   | 6590ec95970ed3bef369b239b44ce608889f17b5 |
|    4 | 阿珊   | 57b7fa2df7239a2f1468a2720c4be5e9c3a4b913 |
+------+--------+------------------------------------------+
SELECT e.id,e.name,sha2(e.name,224) FROM sha_table1_view e WHERE sha2(e.id,224) > ANY (SELECT sha2(p.id,224) FROM t2_view p WHERE id = 3) ORDER BY e.id;
+------+--------+----------------------------------------------------------+
| id   | name   | sha2(e.name,224)                                         |
+------+--------+----------------------------------------------------------+
|    1 | 阿里   | 29c8a7225135e5469ac4f5522e2fe0ee95f379e8b2335945259b88bf |
|    2 | 阿依   | c0d20cfd5b643d4bff0f594a3ecef8b0b060be62fac54f532e2ee931 |
+------+--------+----------------------------------------------------------+
#ALL 
SELECT e.id,e.name,sha(e.name) FROM sha_table1_view e WHERE sha(e.id) = ALL (SELECT sha(p.id) FROM t2_view p WHERE id = 2) ORDER BY e.id;
+------+--------+------------------------------------------+
| id   | name   | sha(e.name)                              |
+------+--------+------------------------------------------+
|    2 | 阿依   | f4b7ea6fd2116531aa725a6e36d5752ae3ed7daf |
+------+--------+------------------------------------------+
SELECT e.id,e.name,sha1(e.name) FROM sha_table1_view e WHERE sha1(e.id) < ALL (SELECT sha1(p.id) FROM t2_view p WHERE id = 3) ORDER BY e.id;
+------+--------+------------------------------------------+
| id   | name   | sha1(e.name)                             |
+------+--------+------------------------------------------+
|    1 | 阿里   | 6590ec95970ed3bef369b239b44ce608889f17b5 |
|    4 | 阿珊   | 57b7fa2df7239a2f1468a2720c4be5e9c3a4b913 |
+------+--------+------------------------------------------+
SELECT e.id,e.name,sha2(e.name,256) FROM sha_table1_view e WHERE sha2(e.id,256) > ALL (SELECT sha2(p.id,256) FROM t2_view p WHERE id = 3) ORDER BY e.id;
+------+--------+------------------------------------------------------------------+
| id   | name   | sha2(e.name,256)                                                 |
+------+--------+------------------------------------------------------------------+
|    1 | 阿里   | 1d99cc69a8ba22eb7d7175853076fe9dcebfa8b97bb915b7df1f4f976c4ccaa3 |
|    2 | 阿依   | e0ca09be4491800241ee221d403fa19010e476cf906f956f85b9a6921d0b21fd |
+------+--------+------------------------------------------------------------------+
#CREATE AS  mysql 执行失败，Ob执行成功
#原因：5.6及以上的版本内，开启了 enforce_gtid_consistency=true 功能导致的，MySQL官方解释说当启用 enforce_gtid_consistency 功能的时候，MySQL只允许能够保障事务安全，并且能够被日志记录的SQL语句被执行，像create table … SELECT 和 create temporarytable语句，以及同时更新事务表和非事务表的SQL语句或事务都不允许执行。 
DROP VIEW t3_view;
CREATE VIEW t3_view AS SELECT id,sha(name) name3,sha1(address) address3,sha2(sal,0) sal3 FROM sha_table1_view;
SELECT * FROM t3_view;
+------+------------------------------------------+------------------------------------------+------------------------------------------------------------------+
| id   | name3                                    | address3                                 | sal3                                                             |
+------+------------------------------------------+------------------------------------------+------------------------------------------------------------------+
|    1 | 6590ec95970ed3bef369b239b44ce608889f17b5 | c2d2d67e9afbca8ad8f4a7ae1dd8b782683cd438 | d4c999ae43633bd2036188d2bca68e1be8202b2cc1f3a1c42a728eaff7d2483d |
|    2 | f4b7ea6fd2116531aa725a6e36d5752ae3ed7daf | d03d2f65a5ab57980517c9579251f710a4e4c18a | ad5f9478d603fe97eae2bbff07f76fe7f18610343b5f3bc8e00945ee51b30d2c |
|    3 | 9d42150fe917c3f9195e7fca2bb380baf00b0880 | 855f21547c2192ca266a39ff717eb768366f7976 | 8d284220975da66c6cba4a32aaedfa0b897187d86ed9f7a2419c9bd10a103505 |
|    4 | 57b7fa2df7239a2f1468a2720c4be5e9c3a4b913 | 855f21547c2192ca266a39ff717eb768366f7976 | 0f8eb4b72b6e0c9e88b388eb967b49e067ef1004bf07bffc22c3acb13b43580a |
+------+------------------------------------------+------------------------------------------+------------------------------------------------------------------+
#WITH AS的SELECT
WITH a AS (SELECT id,name,sha(name) name2 FROM sha_table1_view ) SELECT a.id,a.name,a.name2 FROM a ORDER BY a.id;
+------+--------+------------------------------------------+
| id   | name   | name2                                    |
+------+--------+------------------------------------------+
|    1 | 阿里   | 6590ec95970ed3bef369b239b44ce608889f17b5 |
|    2 | 阿依   | f4b7ea6fd2116531aa725a6e36d5752ae3ed7daf |
|    3 | 阿布   | 9d42150fe917c3f9195e7fca2bb380baf00b0880 |
|    4 | 阿珊   | 57b7fa2df7239a2f1468a2720c4be5e9c3a4b913 |
+------+--------+------------------------------------------+
WITH a AS (SELECT id,name,sha1(name) name2 FROM sha_table1_view ) SELECT a.id,a.name,a.name2 FROM a ORDER BY a.id;
+------+--------+------------------------------------------+
| id   | name   | name2                                    |
+------+--------+------------------------------------------+
|    1 | 阿里   | 6590ec95970ed3bef369b239b44ce608889f17b5 |
|    2 | 阿依   | f4b7ea6fd2116531aa725a6e36d5752ae3ed7daf |
|    3 | 阿布   | 9d42150fe917c3f9195e7fca2bb380baf00b0880 |
|    4 | 阿珊   | 57b7fa2df7239a2f1468a2720c4be5e9c3a4b913 |
+------+--------+------------------------------------------+
WITH a AS (SELECT id,name,sha2(name,0) name2 FROM sha_table1_view ) SELECT a.id,a.name,a.name2 FROM a ORDER BY a.id;
+------+--------+------------------------------------------------------------------+
| id   | name   | name2                                                            |
+------+--------+------------------------------------------------------------------+
|    1 | 阿里   | 1d99cc69a8ba22eb7d7175853076fe9dcebfa8b97bb915b7df1f4f976c4ccaa3 |
|    2 | 阿依   | e0ca09be4491800241ee221d403fa19010e476cf906f956f85b9a6921d0b21fd |
|    3 | 阿布   | 4760eef88a5334c94fa67a33746dd3c31dbf4d2f729813d4903bf9b9cc814ed9 |
|    4 | 阿珊   | 5896627767e8dd4042c12a503476ba821f478ca4c0fda4cb60f1fd7a44e0ad56 |
+------+--------+------------------------------------------------------------------+
#模糊查询like 
SELECT e.id,e.name,sha(e.name)  FROM sha_table1_view e WHERE sha(e.name) LIKE '%bef%';
+------+--------+------------------------------------------+
| id   | name   | sha(e.name)                              |
+------+--------+------------------------------------------+
|    1 | 阿里   | 6590ec95970ed3bef369b239b44ce608889f17b5 |
+------+--------+------------------------------------------+
SELECT e.id,e.name,sha(e.name) FROM sha_table1_view e LEFT JOIN t2_view p ON e.id = p.id WHERE sha(e.name) LIKE '%df%';
+------+--------+------------------------------------------+
| id   | name   | sha(e.name)                              |
+------+--------+------------------------------------------+
|    4 | 阿珊   | 57b7fa2df7239a2f1468a2720c4be5e9c3a4b913 |
+------+--------+------------------------------------------+
###  update
UPDATE sha_table1_view SET name = '阿里-update' WHERE sha(name) = sha('阿里');
UPDATE sha_table1_view SET name = '阿依-update' WHERE sha1(name) = sha1('阿依') ORDER BY sha1(id) DESC;
UPDATE sha_table1_view SET address = (SELECT sha2(style,0) FROM t2_view GROUP BY sha2(style,0),id HAVING id = 1 ORDER BY sha1(id)) WHERE id = 1 ;
SELECT * FROM  sha_table1_view;
+------+---------------+------------------------------------------------------------------+-------+
| id   | name          | address                                                          | sal   |
+------+---------------+------------------------------------------------------------------+-------+
|    1 | 阿里-update   | 864200bbb241e06718231abc10232c338a8277208b746ae02e3bd83e8df72c4d | 15000 |
|    2 | 阿依-update   | 广州                                                             | 8000  |
|    3 | 阿布          | 苏州                                                             | 6000  |
|    4 | 阿珊          | 苏州                                                             | 5000  |
+------+---------------+------------------------------------------------------------------+-------+
###  delete
SELECT * FROM  t2_view ORDER BY sha1(id);
+------+--------+-------+
| id   | style  | price |
+------+--------+-------+
|    1 | 键盘   |   300 |
|    3 | 耳机   |   500 |
|    2 | 鼠标   |   200 |
+------+--------+-------+
DELETE FROM t2_view WHERE sha1(id) = sha1(2) ORDER BY sha1(id) DESC;
SELECT * FROM  t2_view ORDER BY sha1(id);
+------+--------+-------+
| id   | style  | price |
+------+--------+-------+
|    1 | 键盘   |   300 |
|    3 | 耳机   |   500 |
+------+--------+-------+
### 标签：sha-4-2 索引
DROP INDEX `sha_index1` ON sha_table1;
DROP INDEX `sha_index2` ON sha_table1;
CREATE INDEX sha_index1 ON sha_table1(id);
ALTER TABLE sha_table1 ADD INDEX sha_index2 (name);
#insert 
insert into sha_table1 SELECT * FROM sha_table1 e WHERE sha(e.id) = sha(3);
SELECT *  FROM sha_table1 ORDER BY sha1(id);
+------+---------------+------------------------------------------------------------------+-------+
| id   | name          | address                                                          | sal   |
+------+---------------+------------------------------------------------------------------+-------+
|    4 | 阿珊          | 苏州                                                             | 5000  |
|    1 | 阿里-update   | 864200bbb241e06718231abc10232c338a8277208b746ae02e3bd83e8df72c4d | 15000 |
|    3 | 阿布          | 苏州                                                             | 6000  |
|    3 | 阿布          | 苏州                                                             | 6000  |
|    2 | 阿依-update   | 广州                                                             | 8000  |
+------+---------------+------------------------------------------------------------------+-------+
#update 
UPDATE sha_table1 set name = '索引-update' WHERE sha1(id) = sha1(4);
SELECT *  FROM sha_table1 ORDER BY sha1(id);
+------+---------------+------------------------------------------------------------------+-------+
| id   | name          | address                                                          | sal   |
+------+---------------+------------------------------------------------------------------+-------+
|    4 | 索引-update   | 苏州                                                             | 5000  |
|    1 | 阿里-update   | 864200bbb241e06718231abc10232c338a8277208b746ae02e3bd83e8df72c4d | 15000 |
|    3 | 阿布          | 苏州                                                             | 6000  |
|    3 | 阿布          | 苏州                                                             | 6000  |
|    2 | 阿依-update   | 广州                                                             | 8000  |
+------+---------------+------------------------------------------------------------------+-------+
UPDATE sha_table1 set address = sha('索引-update') WHERE sha2(id,0) = sha2(4,0);
SELECT *  FROM sha_table1 ORDER BY sha1(id);
+------+---------------+------------------------------------------------------------------+-------+
| id   | name          | address                                                          | sal   |
+------+---------------+------------------------------------------------------------------+-------+
|    4 | 索引-update   | f1817977f0720d06c8dfec916479c20f59e9b5fd                         | 5000  |
|    1 | 阿里-update   | 864200bbb241e06718231abc10232c338a8277208b746ae02e3bd83e8df72c4d | 15000 |
|    3 | 阿布          | 苏州                                                             | 6000  |
|    3 | 阿布          | 苏州                                                             | 6000  |
|    2 | 阿依-update   | 广州                                                             | 8000  |
+------+---------------+------------------------------------------------------------------+-------+
#SELECT 
SELECT id,sha(e.id),sha1(e.name),sha2(e.name,0) FROM sha_table1 e WHERE sha(e.id) < sha(2) ORDER BY e.id;
+------+------------------------------------------+------------------------------------------+------------------------------------------------------------------+
| id   | sha(e.id)                                | sha1(e.name)                             | sha2(e.name,0)                                                   |
+------+------------------------------------------+------------------------------------------+------------------------------------------------------------------+
|    1 | 356a192b7913b04c54574d18c28d46e6395428ab | 90dd231b9fdbe2415903077336f17be9a38bc89e | 3f7f96586adc1cbbc920d781376deb2859fb556bc845066687529c4c9025f641 |
|    3 | 77de68daecd823babbb58edb1c8e14d7106e83bb | 9d42150fe917c3f9195e7fca2bb380baf00b0880 | 4760eef88a5334c94fa67a33746dd3c31dbf4d2f729813d4903bf9b9cc814ed9 |
|    3 | 77de68daecd823babbb58edb1c8e14d7106e83bb | 9d42150fe917c3f9195e7fca2bb380baf00b0880 | 4760eef88a5334c94fa67a33746dd3c31dbf4d2f729813d4903bf9b9cc814ed9 |
|    4 | 1b6453892473a467d07372d45eb05abc2031647a | f1817977f0720d06c8dfec916479c20f59e9b5fd | 9525ff72298ef69636cfbc4f338cb4146244e9057eaa042093b52bcf543206b6 |
+------+------------------------------------------+------------------------------------------+------------------------------------------------------------------+
SELECT id,sha(e.id),sha1(e.name),sha2(e.name,224) FROM sha_table1 e WHERE sha(e.name) like '%f1%' order by sha(e.id) desc;
+------+------------------------------------------+------------------------------------------+----------------------------------------------------------+
| id   | sha(e.id)                                | sha1(e.name)                             | sha2(e.name,224)                                         |
+------+------------------------------------------+------------------------------------------+----------------------------------------------------------+
|    2 | da4b9237bacccdf19c0760cab7aec4a8359010b0 | f16f1a0d07826be1869dc80f3ad37403e84e7654 | 7873c0cea68772248f61b57290b0730aede57d8aba7a94389e119c29 |
|    1 | 356a192b7913b04c54574d18c28d46e6395428ab | 90dd231b9fdbe2415903077336f17be9a38bc89e | 35423b027242a075be24a2ca68f6760cb68dbb58ee0a88c6b7fff5da |
|    4 | 1b6453892473a467d07372d45eb05abc2031647a | f1817977f0720d06c8dfec916479c20f59e9b5fd | 49de0e58b2f04aa765f595123569b3c64cbba1204c887f05d6c19baa |
+------+------------------------------------------+------------------------------------------+----------------------------------------------------------+
#delete 
DELETE FROM sha_table1 WHERE address = sha('索引-update');
SELECT *  FROM sha_table1 ORDER BY sha1(id);
+------+---------------+------------------------------------------------------------------+-------+
| id   | name          | address                                                          | sal   |
+------+---------------+------------------------------------------------------------------+-------+
|    1 | 阿里-update   | 864200bbb241e06718231abc10232c338a8277208b746ae02e3bd83e8df72c4d | 15000 |
|    3 | 阿布          | 苏州                                                             | 6000  |
|    3 | 阿布          | 苏州                                                             | 6000  |
|    2 | 阿依-update   | 广州                                                             | 8000  |
+------+---------------+------------------------------------------------------------------+-------+
### 标签：sha-4-3 约束
DROP TABLE sha_table1;
CREATE TABLE sha_table1(
  id int PRIMARY KEY,
  name char(200) UNIQUE, 
  grade varchar(200) NOT NULL,
  ranks varchar(200)
);
INSERT INTO sha_table1 VALUES(1,'楠楠','100','1');
INSERT INTO sha_table1 VALUES(2,'看看','90','3');
INSERT INTO sha_table1 VALUES(3,'青青','95','2');
INSERT INTO sha_table1 VALUES(4,'慧慧','88','4');
#insert 
INSERT INTO sha_table1 VALUES(5,'洋洋',sha('100'),sha2('1',0));
SELECT *  FROM sha_table1 ORDER BY sha1(id);
+----+--------+------------------------------------------+------------------------------------------------------------------+
| id | name   | grade                                    | ranks                                                            |
+----+--------+------------------------------------------+------------------------------------------------------------------+
|  4 | 慧慧   | 88                                       | 4                                                                |
|  1 | 楠楠   | 100                                      | 1                                                                |
|  3 | 青青   | 95                                       | 2                                                                |
|  5 | 洋洋   | 310b86e0b62b828562fc91c7be5380a992b2786a | 6b86b273ff34fce19d6b804eff5a3f5747ada4eaa22f1d49c01e52ddb7875b4b |
|  2 | 看看   | 90                                       | 3                                                                |
+----+--------+------------------------------------------+------------------------------------------------------------------+
#update 
UPDATE sha_table1 set name = '洋洋-update' WHERE sha1(id) = sha1(5);
SELECT *  FROM sha_table1 ORDER BY sha1(id);
+----+---------------+------------------------------------------+------------------------------------------------------------------+
| id | name          | grade                                    | ranks                                                            |
+----+---------------+------------------------------------------+------------------------------------------------------------------+
|  4 | 慧慧          | 88                                       | 4                                                                |
|  1 | 楠楠          | 100                                      | 1                                                                |
|  3 | 青青          | 95                                       | 2                                                                |
|  5 | 洋洋-update   | 310b86e0b62b828562fc91c7be5380a992b2786a | 6b86b273ff34fce19d6b804eff5a3f5747ada4eaa22f1d49c01e52ddb7875b4b |
|  2 | 看看          | 90                                       | 3                                                                |
+----+---------------+------------------------------------------+------------------------------------------------------------------+
#SELECT 
SELECT id,sha(e.id),sha1(e.name),sha2(e.name,0) FROM sha_table1 e WHERE sha(e.id) < sha(2) ORDER BY e.id;
+----+------------------------------------------+------------------------------------------+------------------------------------------------------------------+
| id | sha(e.id)                                | sha1(e.name)                             | sha2(e.name,0)                                                   |
+----+------------------------------------------+------------------------------------------+------------------------------------------------------------------+
|  1 | 356a192b7913b04c54574d18c28d46e6395428ab | 304a01311ca45a917dd05e98e394f0db19245277 | 077dec86f7424101b04980376418872ac43b0861401d4beb260457630beccfec |
|  3 | 77de68daecd823babbb58edb1c8e14d7106e83bb | da96d1735b386f5a1f68f0ba39d133178a7bec74 | 99dee435e60edeaba3925b2eff2c1d67eab8dc32d27bef0eafac4f2d8f3e41f1 |
|  4 | 1b6453892473a467d07372d45eb05abc2031647a | 60b0a13647230ae74a1ecd623ef4c9e0e805d024 | 4e8ff59ccce77aa623e2e1d3912fa8fa5c9ed9361b1aff266d64831cf162ba58 |
|  5 | ac3478d69a3c81fa62e60f5c3696165a4e5e6ac4 | 9fdd71b527bb7362dca8e1fa2cfe72cb0e81d176 | b86911da77681d77661e9555916e0e29d9b85769565315e453bf77666eaf5df6 |
+----+------------------------------------------+------------------------------------------+------------------------------------------------------------------+
SELECT id,sha(e.id),sha1(e.name),sha2(e.name,224) FROM sha_table1 e  order by sha(e.id) desc;
+----+------------------------------------------+------------------------------------------+----------------------------------------------------------+
| id | sha(e.id)                                | sha1(e.name)                             | sha2(e.name,224)                                         |
+----+------------------------------------------+------------------------------------------+----------------------------------------------------------+
|  2 | da4b9237bacccdf19c0760cab7aec4a8359010b0 | 2217d0e5fed8641dd11c69f7be538bdf93025f4d | ff3ccb793c852e17719ce9bdc661daac5053b08bf8e379bea068ed37 |
|  5 | ac3478d69a3c81fa62e60f5c3696165a4e5e6ac4 | 9fdd71b527bb7362dca8e1fa2cfe72cb0e81d176 | 7a5e9035168d40d46172c38c72e76362c171a960d3b2c3ae1fa30f66 |
|  3 | 77de68daecd823babbb58edb1c8e14d7106e83bb | da96d1735b386f5a1f68f0ba39d133178a7bec74 | de44e134bbc26b5da814c1efa21b6963dd70273357c8c14b07a057d9 |
|  1 | 356a192b7913b04c54574d18c28d46e6395428ab | 304a01311ca45a917dd05e98e394f0db19245277 | 883d85938b14c6a3f8c343fa2f654fba24784b8c83526c1d351c99af |
|  4 | 1b6453892473a467d07372d45eb05abc2031647a | 60b0a13647230ae74a1ecd623ef4c9e0e805d024 | c2f61e273bf2c9a7f6aacb40236fb5a6bcacc6d30c3ebc22eaee031b |
+----+------------------------------------------+------------------------------------------+----------------------------------------------------------+
#delete 
DELETE FROM sha_table1 WHERE sha1(id) = sha1(5);
SELECT *  FROM sha_table1 ORDER BY sha1(id);
+----+--------+-------+-------+
| id | name   | grade | ranks |
+----+--------+-------+-------+
|  4 | 慧慧   | 88    | 4     |
|  1 | 楠楠   | 100   | 1     |
|  3 | 青青   | 95    | 2     |
|  2 | 看看   | 90    | 3     |
+----+--------+-------+-------+
# Clean up users
drop user whh@'%';
