result_format: 4
drop table if exists t1,t2;
drop view if exists v1,v2,v3,v4;
create table t1(c1 int, c2 int);

## 0. opt_param test basic test
explain outline select /*+opt_param('hidden_column_visible','true')*/ `__pk_increment`, t1.* from t1;
Query Plan
===============================================
|ID|OPERATOR       |NAME|EST.ROWS|EST.TIME(us)|
-----------------------------------------------
|0 |TABLE FULL SCAN|t1  |3       |3           |
===============================================
Outputs & filters:
-------------------------------------
  0 - output([t1.__pk_increment], [t1.c1], [t1.c2]), filter(nil), rowset=16
      access([t1.__pk_increment], [t1.c1], [t1.c2]), partitions(p0)
      is_index_back=false, is_global_index=false, 
      range_key([t1.__pk_increment]), range(MIN ; MAX)always true
Outline Data: 
-------------------------------------
  /*+
      BEGIN_OUTLINE_DATA
      FULL(@"SEL$1" "test"."t1"@"SEL$1")
      OPTIMIZER_FEATURES_ENABLE('')
      OPT_PARAM('HIDDEN_COLUMN_VISIBLE' 'true')
      END_OUTLINE_DATA
  */
select /*+opt_param('hidden_column_visible' 'true') opt_param('hidden_column_visible' 'false')*/ `__pk_increment`, t1.* from t1;
+----------------+------+------+
| __pk_increment | c1   | c2   |
+----------------+------+------+
|              1 |    1 |    1 |
|              2 |    5 |    5 |
|              3 |    2 |    2 |
+----------------+------+------+
select /*+opt_param('hidden_column_visible' 'false') opt_param('hidden_column_visible' 'true')*/ `__pk_increment`, t1.* from t1;
ERROR 42S22: Unknown column '__pk_increment' in 'field list'

## 1. hidden_column_visible
select /*+opt_param('hidden_column_visible' 'true')*/ `__pk_increment`, t1.* from t1;
+----------------+------+------+
| __pk_increment | c1   | c2   |
+----------------+------+------+
|              1 |    1 |    1 |
|              2 |    5 |    5 |
|              3 |    2 |    2 |
+----------------+------+------+
select * from (select `__pk_increment`, t1.* from t1) v1,
              (select /*+opt_param('hidden_column_visible','true')*/ t1.* from t1) v2 where v1.c1 = v2.c1;
+----------------+------+------+------+------+
| __pk_increment | c1   | c2   | c1   | c2   |
+----------------+------+------+------+------+
|              1 |    1 |    1 |    1 |    1 |
|              2 |    5 |    5 |    5 |    5 |
|              3 |    2 |    2 |    2 |    2 |
+----------------+------+------+------+------+
select `__pk_increment`, t1.* from t1;
ERROR 42S22: Unknown column '__pk_increment' in 'field list'
select t1.* from t1 where `__pk_increment` is not null;
ERROR 42S22: Unknown column '__pk_increment' in 'where clause'
select /*+opt_param('hidden_column_visible','false')*/ `__pk_increment`, t1.* from t1;
ERROR 42S22: Unknown column '__pk_increment' in 'field list'
select /*+opt_param('hidden_column_visible','invalid')*/ `__pk_increment`, t1.* from t1;
ERROR 42S22: Unknown column '__pk_increment' in 'field list'
select /*+opt_param('hidden_column_visible','1')*/ `__pk_increment`, t1.* from t1;
ERROR 42S22: Unknown column '__pk_increment' in 'field list'

## 2. table hidden column cannot be set without opt_param
update t1 set __pk_increment = 1;
ERROR 42S22: Unknown column '__pk_increment' in 'field list'
insert into t1(__pk_increment, c1, c2) values(1, 1, 1);
ERROR 42S22: Unknown column '__pk_increment' in 'field list'
insert into t1(__pk_increment, c1, c2) values(1, 1, 1) on duplicate key update __pk_increment = 1;
ERROR 42S22: Unknown column '__pk_increment' in 'field list'

## 2. table hidden column cannot be set with opt_param
update /*+opt_param('hidden_column_visible','true')*/ t1 set __pk_increment = 1;
ERROR 42S22: Unknown column '__pk_increment' in 'field list'
insert /*+opt_param('hidden_column_visible','true')*/ into t1(__pk_increment, c1, c2) values(1, 1, 1);
ERROR 42S22: Unknown column '__pk_increment' in 'field list'
insert /*+opt_param('hidden_column_visible','true')*/ into t1(__pk_increment, c1, c2) values(1, 1, 1) on duplicate key update __pk_increment = 1;
ERROR 42S22: Unknown column '__pk_increment' in 'field list'

## 4. view(with hidden pk) hidden column cannot be set without opt_param
create view v1 as select __pk_increment,c1,c2 from t1;
update v1 set __pk_increment = 1;
ERROR 42S22: Unknown column
insert into v1(__pk_increment, c1, c2) values(1, 1, 1);
ERROR 42S22: Unknown column
insert into v1(__pk_increment, c1, c2) values(1, 1, 1) on duplicate key update __pk_increment = 1;
ERROR 42S22: Unknown column

## 5. view(with hidden pk) hidden column cannot be set with opt_param
select /*+opt_param('hidden_column_visible','true')*/__pk_increment from v1;
+----------------+
| __pk_increment |
+----------------+
|              1 |
|              2 |
|              3 |
+----------------+
update /*+opt_param('hidden_column_visible','true')*/ v1 set __pk_increment = 1;
ERROR 42S22: Unknown column
insert /*+opt_param('hidden_column_visible','true')*/ into v1(__pk_increment, c1, c2) values(1, 1, 1);
ERROR 42S22: Unknown column
insert /*+opt_param('hidden_column_visible','true')*/ into v1(__pk_increment, c1, c2) values(1, 1, 1) on duplicate key update __pk_increment = 1;
ERROR 42S22: Unknown column

## 6. pk + 1
create table t2(c1 int, c2 int unique not null);
create view v2 as select __pk_increment + 1 as r1, c1, c2 from t2;
update /*+opt_param('hidden_column_visible','true')*/ v2 set c1 = 1;
update /*+opt_param('hidden_column_visible','true')*/ v2 set __pk_increment  = 1;
ERROR 42S22: Unknown column '__pk_increment' in 'field list'
update /*+opt_param('hidden_column_visible','true')*/ v2 set r1  = 1;
ERROR HY000: Column 'r1' is not updatable

## 7. view(without hidden pk) can be set with opt_param
create view v3 as select c1, c2 from t1;
update /*+opt_param('hidden_column_visible','true')*/ v3 set c1 = 1;

## 8.nest view
create view v4 as select * from v1;
update v4 set __pk_increment = 1;
ERROR 42S22: Unknown column
insert into v4(__pk_increment, c1, c2) values(1, 1, 1);
ERROR 42S22: Unknown column
insert into v4(__pk_increment, c1, c2) values(1, 1, 1) on duplicate key update __pk_increment = 1;
ERROR 42S22: Unknown column
update /*+opt_param('hidden_column_visible' 'true')*/ v4 set __pk_increment = 1;
ERROR 42S22: Unknown column

## 9.join
explain basic select /*+opt_param('hash_join_enabled' 'true'), opt_param('optimizer_sortmerge_join_enabled' 'false'), opt_param('nested_loop_join_enabled' 'false')*/ * from t1, t2 where t1.c1 = t2.c1;
Query Plan
===========================
|ID|OPERATOR         |NAME|
---------------------------
|0 |HASH JOIN        |    |
|1 |├─TABLE FULL SCAN|t2  |
|2 |└─TABLE FULL SCAN|t1  |
===========================
Outputs & filters:
-------------------------------------
  0 - output([t1.c1], [t1.c2], [t2.c1], [t2.c2]), filter(nil), rowset=16
      equal_conds([t1.c1 = t2.c1]), other_conds(nil)
  1 - output([t2.c1], [t2.c2]), filter(nil), rowset=16
      access([t2.c1], [t2.c2]), partitions(p0)
      is_index_back=false, is_global_index=false, 
      range_key([t2.__pk_increment]), range(MIN ; MAX)always true
  2 - output([t1.c1], [t1.c2]), filter(nil), rowset=16
      access([t1.c1], [t1.c2]), partitions(p0)
      is_index_back=false, is_global_index=false, 
      range_key([t1.__pk_increment]), range(MIN ; MAX)always true
explain basic select /*+opt_param('hash_join_enabled' 'false'), opt_param('optimizer_sortmerge_join_enabled' 'true'), opt_param('nested_loop_join_enabled' 'false')*/ * from t1, t2 where t1.c1 = t2.c1;
Query Plan
=============================
|ID|OPERATOR           |NAME|
-----------------------------
|0 |MERGE JOIN         |    |
|1 |├─SORT             |    |
|2 |│ └─TABLE FULL SCAN|t2  |
|3 |└─SORT             |    |
|4 |  └─TABLE FULL SCAN|t1  |
=============================
Outputs & filters:
-------------------------------------
  0 - output([t1.c1], [t1.c2], [t2.c1], [t2.c2]), filter(nil), rowset=16
      equal_conds([t1.c1 = t2.c1]), other_conds(nil)
      merge_directions([ASC])
  1 - output([t2.c1], [t2.c2]), filter(nil), rowset=16
      sort_keys([t2.c1, ASC])
  2 - output([t2.c1], [t2.c2]), filter(nil), rowset=16
      access([t2.c1], [t2.c2]), partitions(p0)
      is_index_back=false, is_global_index=false, 
      range_key([t2.__pk_increment]), range(MIN ; MAX)always true
  3 - output([t1.c1], [t1.c2]), filter(nil), rowset=16
      sort_keys([t1.c1, ASC])
  4 - output([t1.c1], [t1.c2]), filter(nil), rowset=16
      access([t1.c1], [t1.c2]), partitions(p0)
      is_index_back=false, is_global_index=false, 
      range_key([t1.__pk_increment]), range(MIN ; MAX)always true
explain basic select /*+opt_param('hash_join_enabled' 'false'), opt_param('optimizer_sortmerge_join_enabled' 'false'), opt_param('nested_loop_join_enabled' 'true')*/ * from t1, t2 where t1.c1 = t2.c1;
Query Plan
=============================
|ID|OPERATOR           |NAME|
-----------------------------
|0 |NESTED-LOOP JOIN   |    |
|1 |├─TABLE FULL SCAN  |t1  |
|2 |└─MATERIAL         |    |
|3 |  └─TABLE FULL SCAN|t2  |
=============================
Outputs & filters:
-------------------------------------
  0 - output([t1.c1], [t1.c2], [t2.c1], [t2.c2]), filter(nil), rowset=16
      conds([t1.c1 = t2.c1]), nl_params_(nil), use_batch=false
  1 - output([t1.c1], [t1.c2]), filter(nil), rowset=16
      access([t1.c1], [t1.c2]), partitions(p0)
      is_index_back=false, is_global_index=false, 
      range_key([t1.__pk_increment]), range(MIN ; MAX)always true
  2 - output([t2.c1], [t2.c2]), filter(nil), rowset=16
  3 - output([t2.c1], [t2.c2]), filter(nil), rowset=16
      access([t2.c1], [t2.c2]), partitions(p0)
      is_index_back=false, is_global_index=false, 
      range_key([t2.__pk_increment]), range(MIN ; MAX)always true
explain basic select /*+opt_param('hash_join_enabled' 'false'), opt_param('optimizer_sortmerge_join_enabled' 'false'), opt_param('nested_loop_join_enabled' 'false')*/ * from t1, t2 where t1.c1 = t2.c1;
Query Plan
===========================
|ID|OPERATOR         |NAME|
---------------------------
|0 |HASH JOIN        |    |
|1 |├─TABLE FULL SCAN|t2  |
|2 |└─TABLE FULL SCAN|t1  |
===========================
Outputs & filters:
-------------------------------------
  0 - output([t1.c1], [t1.c2], [t2.c1], [t2.c2]), filter(nil), rowset=16
      equal_conds([t1.c1 = t2.c1]), other_conds(nil)
  1 - output([t2.c1], [t2.c2]), filter(nil), rowset=16
      access([t2.c1], [t2.c2]), partitions(p0)
      is_index_back=false, is_global_index=false, 
      range_key([t2.__pk_increment]), range(MIN ; MAX)always true
  2 - output([t1.c1], [t1.c2]), filter(nil), rowset=16
      access([t1.c1], [t1.c2]), partitions(p0)
      is_index_back=false, is_global_index=false, 
      range_key([t1.__pk_increment]), range(MIN ; MAX)always true

create index i_t2_c1 on t2(c1);
explain basic select /*+opt_param('nlj_batching_enabled' 'true'), opt_param('hash_join_enabled' 'false'), opt_param('optimizer_sortmerge_join_enabled' 'false'), opt_param('nested_loop_join_enabled' 'true')*/ * from t1, t2 where t1.c1 = t2.c1;
Query Plan
===================================
|ID|OPERATOR          |NAME       |
-----------------------------------
|0 |NESTED-LOOP JOIN  |           |
|1 |├─TABLE FULL SCAN |t1         |
|2 |└─TABLE RANGE SCAN|t2(i_t2_c1)|
===================================
Outputs & filters:
-------------------------------------
  0 - output([t1.c1], [t1.c2], [t2.c1], [t2.c2]), filter(nil), rowset=16
      conds(nil), nl_params_([t1.c1(:0)]), use_batch=true
  1 - output([t1.c1], [t1.c2]), filter(nil), rowset=16
      access([t1.c1], [t1.c2]), partitions(p0)
      is_index_back=false, is_global_index=false, 
      range_key([t1.__pk_increment]), range(MIN ; MAX)always true
  2 - output([t2.c1], [t2.c2]), filter(nil), rowset=16
      access([GROUP_ID], [t2.__pk_increment], [t2.c1], [t2.c2]), partitions(p0)
      is_index_back=true, is_global_index=false, 
      range_key([t2.c1], [t2.__pk_increment]), range(MIN ; MAX), 
      range_cond([:0 = t2.c1])
explain basic select /*+opt_param('nlj_batching_enabled' 'false'), opt_param('hash_join_enabled' 'false'), opt_param('optimizer_sortmerge_join_enabled' 'false'), opt_param('nested_loop_join_enabled' 'true')*/ * from t1, t2 where t1.c1 = t2.c1;
Query Plan
===================================
|ID|OPERATOR          |NAME       |
-----------------------------------
|0 |NESTED-LOOP JOIN  |           |
|1 |├─TABLE FULL SCAN |t1         |
|2 |└─TABLE RANGE SCAN|t2(i_t2_c1)|
===================================
Outputs & filters:
-------------------------------------
  0 - output([t1.c1], [t1.c2], [t2.c1], [t2.c2]), filter(nil), rowset=16
      conds(nil), nl_params_([t1.c1(:0)]), use_batch=false
  1 - output([t1.c1], [t1.c2]), filter(nil), rowset=16
      access([t1.c1], [t1.c2]), partitions(p0)
      is_index_back=false, is_global_index=false, 
      range_key([t1.__pk_increment]), range(MIN ; MAX)always true
  2 - output([t2.c1], [t2.c2]), filter(nil), rowset=16
      access([t2.__pk_increment], [t2.c1], [t2.c2]), partitions(p0)
      is_index_back=true, is_global_index=false, 
      range_key([t2.c1], [t2.__pk_increment]), range(MIN ; MAX), 
      range_cond([:0 = t2.c1])

## 10.with_subquery
explain basic WITH temp1 AS (SELECT t1.c1 FROM t1, t2 where t1.c1 = t2.c1)
SELECT /*+opt_param('with_subquery', 1)*/ c1 FROM temp1 order by 1;
Query Plan
==========================================
|ID|OPERATOR                 |NAME       |
------------------------------------------
|0 |TEMP TABLE TRANSFORMATION|           |
|1 |├─TEMP TABLE INSERT      |temp1      |
|2 |│ └─MERGE JOIN           |           |
|3 |│   ├─TABLE FULL SCAN    |t2(i_t2_c1)|
|4 |│   └─SORT               |           |
|5 |│     └─TABLE FULL SCAN  |t1         |
|6 |└─SORT                   |           |
|7 |  └─TEMP TABLE ACCESS    |temp1      |
==========================================
Outputs & filters:
-------------------------------------
  0 - output([temp1.c1]), filter(nil), rowset=16
  1 - output(nil), filter(nil), rowset=16
  2 - output([t1.c1]), filter(nil), rowset=16
      equal_conds([t1.c1 = t2.c1]), other_conds(nil)
      merge_directions([ASC])
  3 - output([t2.c1]), filter(nil), rowset=16
      access([t2.c1]), partitions(p0)
      is_index_back=false, is_global_index=false, 
      range_key([t2.c1], [t2.__pk_increment]), range(MIN,MIN ; MAX,MAX)always true
  4 - output([t1.c1]), filter(nil), rowset=16
      sort_keys([t1.c1, ASC])
  5 - output([t1.c1]), filter(nil), rowset=16
      access([t1.c1]), partitions(p0)
      is_index_back=false, is_global_index=false, 
      range_key([t1.__pk_increment]), range(MIN ; MAX)always true
  6 - output([temp1.c1]), filter(nil), rowset=16
      sort_keys([temp1.c1, ASC])
  7 - output([temp1.c1]), filter(nil), rowset=16
      access([temp1.c1])
explain basic WITH temp1 AS (SELECT t1.c1 FROM t1, t2 where t1.c1 = t2.c1)
SELECT /*+opt_param('with_subquery', 2)*/ c1 FROM temp1 order by 1;
Query Plan
====================================
|ID|OPERATOR           |NAME       |
------------------------------------
|0 |MERGE JOIN         |           |
|1 |├─TABLE FULL SCAN  |t2(i_t2_c1)|
|2 |└─SORT             |           |
|3 |  └─TABLE FULL SCAN|t1         |
====================================
Outputs & filters:
-------------------------------------
  0 - output([t1.c1]), filter(nil), rowset=16
      equal_conds([t1.c1 = t2.c1]), other_conds(nil)
      merge_directions([ASC])
  1 - output([t2.c1]), filter(nil), rowset=16
      access([t2.c1]), partitions(p0)
      is_index_back=false, is_global_index=false, 
      range_key([t2.c1], [t2.__pk_increment]), range(MIN,MIN ; MAX,MAX)always true
  2 - output([t1.c1]), filter(nil), rowset=16
      sort_keys([t1.c1, ASC])
  3 - output([t1.c1]), filter(nil), rowset=16
      access([t1.c1]), partitions(p0)
      is_index_back=false, is_global_index=false, 
      range_key([t1.__pk_increment]), range(MIN ; MAX)always true

alter system set _with_subquery = 1;
explain basic WITH temp1 AS (SELECT t1.c1 FROM t1, t2 where t1.c1 = t2.c1)
SELECT /*+opt_param('with_subquery', 0)*/ c1 FROM temp1 order by 1;
Query Plan
====================================
|ID|OPERATOR           |NAME       |
------------------------------------
|0 |MERGE JOIN         |           |
|1 |├─TABLE FULL SCAN  |t2(i_t2_c1)|
|2 |└─SORT             |           |
|3 |  └─TABLE FULL SCAN|t1         |
====================================
Outputs & filters:
-------------------------------------
  0 - output([t1.c1]), filter(nil), rowset=16
      equal_conds([t1.c1 = t2.c1]), other_conds(nil)
      merge_directions([ASC])
  1 - output([t2.c1]), filter(nil), rowset=16
      access([t2.c1]), partitions(p0)
      is_index_back=false, is_global_index=false, 
      range_key([t2.c1], [t2.__pk_increment]), range(MIN,MIN ; MAX,MAX)always true
  2 - output([t1.c1]), filter(nil), rowset=16
      sort_keys([t1.c1, ASC])
  3 - output([t1.c1]), filter(nil), rowset=16
      access([t1.c1]), partitions(p0)
      is_index_back=false, is_global_index=false, 
      range_key([t1.__pk_increment]), range(MIN ; MAX)always true
alter system set _with_subquery = 0;

## 11.enable_spf_batch_rescan
explain basic select /*+no_rewrite, opt_param('enable_spf_batch_rescan', 'true')*/ * from t1 where exists (select * from t2 where t1.c2=t2.c1);
Query Plan
===============================================
|ID|OPERATOR                      |NAME       |
-----------------------------------------------
|0 |SUBPLAN FILTER                |           |
|1 |├─TABLE FULL SCAN             |t1         |
|2 |└─DISTRIBUTED TABLE RANGE SCAN|t2(i_t2_c1)|
===============================================
Outputs & filters:
-------------------------------------
  0 - output([t1.c1], [t1.c2]), filter([(T_OP_EXISTS, subquery(1))]), rowset=16
      exec_params_([t1.c2(:0)]), onetime_exprs_(nil), init_plan_idxs_(nil), use_batch=true
  1 - output([t1.c2], [t1.c1]), filter(nil), rowset=16
      access([t1.c2], [t1.c1]), partitions(p0)
      is_index_back=false, is_global_index=false, 
      range_key([t1.__pk_increment]), range(MIN ; MAX)always true
  2 - output([t2.c1], [t2.c2]), filter(nil), rowset=16
      access([GROUP_ID], [t2.__pk_increment], [t2.c1], [t2.c2]), partitions(p0)
      is_index_back=true, is_global_index=false, 
      range_key([t2.c1], [t2.__pk_increment]), range(MIN,MIN ; MAX,MAX)always true, 
      range_cond([:0 = t2.c1])
explain basic select /*+no_rewrite, opt_param('enable_spf_batch_rescan', 'false')*/ * from t1 where exists (select * from t2 where t1.c2=t2.c1);
Query Plan
===================================
|ID|OPERATOR          |NAME       |
-----------------------------------
|0 |SUBPLAN FILTER    |           |
|1 |├─TABLE FULL SCAN |t1         |
|2 |└─TABLE RANGE SCAN|t2(i_t2_c1)|
===================================
Outputs & filters:
-------------------------------------
  0 - output([t1.c1], [t1.c2]), filter([(T_OP_EXISTS, subquery(1))]), rowset=16
      exec_params_([t1.c2(:0)]), onetime_exprs_(nil), init_plan_idxs_(nil), use_batch=false
  1 - output([t1.c2], [t1.c1]), filter(nil), rowset=16
      access([t1.c2], [t1.c1]), partitions(p0)
      is_index_back=false, is_global_index=false, 
      range_key([t1.__pk_increment]), range(MIN ; MAX)always true
  2 - output([t2.c1], [t2.c2]), filter(nil), rowset=16
      access([t2.__pk_increment], [t2.c1], [t2.c2]), partitions(p0)
      is_index_back=true, is_global_index=false, 
      range_key([t2.c1], [t2.__pk_increment]), range(MIN,MIN ; MAX,MAX)always true, 
      range_cond([:0 = t2.c1])
explain basic select /*+leading(t1 v2) use_nl(v2)*/ count(*) from t1, (select /*+no_merge*/ * from t2)v2 where t1.c1 = v2.c2;
Query Plan
=======================================
|ID|OPERATOR                   |NAME  |
---------------------------------------
|0 |SCALAR GROUP BY            |      |
|1 |└─NESTED-LOOP JOIN         |      |
|2 |  ├─TABLE FULL SCAN        |t1    |
|3 |  └─SUBPLAN SCAN           |v2    |
|4 |    └─DISTRIBUTED TABLE GET|t2(c2)|
=======================================
Outputs & filters:
-------------------------------------
  0 - output([T_FUN_COUNT(*)]), filter(nil), rowset=16
      group(nil), agg_func([T_FUN_COUNT(*)])
  1 - output(nil), filter(nil), rowset=16
      conds(nil), nl_params_([t1.c1(:0)]), use_batch=true
  2 - output([t1.c1]), filter(nil), rowset=16
      access([t1.c1]), partitions(p0)
      is_index_back=false, is_global_index=false, 
      range_key([t1.__pk_increment]), range(MIN ; MAX)always true
  3 - output(nil), filter(nil), rowset=16
      access(nil)
  4 - output([t2.c2]), filter(nil), rowset=16
      access([GROUP_ID], [t2.c2]), partitions(p0)
      is_index_back=false, is_global_index=false, 
      range_key([t2.c2], [t2.shadow_pk_0]), range(MIN,MIN ; MAX,MAX)always true, 
      range_cond([:0 = t2.c2])

explain basic select /*+leading(t1 v2) use_nl(v2) opt_param('_push_join_predicate','true')*/ count(*) from t1, (select /*+no_merge*/ * from t2)v2 where t1.c1 = v2.c2;
Query Plan
=======================================
|ID|OPERATOR                   |NAME  |
---------------------------------------
|0 |SCALAR GROUP BY            |      |
|1 |└─NESTED-LOOP JOIN         |      |
|2 |  ├─TABLE FULL SCAN        |t1    |
|3 |  └─SUBPLAN SCAN           |v2    |
|4 |    └─DISTRIBUTED TABLE GET|t2(c2)|
=======================================
Outputs & filters:
-------------------------------------
  0 - output([T_FUN_COUNT(*)]), filter(nil), rowset=16
      group(nil), agg_func([T_FUN_COUNT(*)])
  1 - output(nil), filter(nil), rowset=16
      conds(nil), nl_params_([t1.c1(:0)]), use_batch=true
  2 - output([t1.c1]), filter(nil), rowset=16
      access([t1.c1]), partitions(p0)
      is_index_back=false, is_global_index=false, 
      range_key([t1.__pk_increment]), range(MIN ; MAX)always true
  3 - output(nil), filter(nil), rowset=16
      access(nil)
  4 - output([t2.c2]), filter(nil), rowset=16
      access([GROUP_ID], [t2.c2]), partitions(p0)
      is_index_back=false, is_global_index=false, 
      range_key([t2.c2], [t2.shadow_pk_0]), range(MIN,MIN ; MAX,MAX)always true, 
      range_cond([:0 = t2.c2])
explain basic select /*+leading(t1 v2) use_nl(v2) opt_param('_push_join_predicate','false')*/ count(*) from t1, (select /*+no_merge*/ * from t2)v2 where t1.c1 = v2.c2;
Query Plan
=======================================
|ID|OPERATOR                   |NAME  |
---------------------------------------
|0 |SCALAR GROUP BY            |      |
|1 |└─NESTED-LOOP JOIN         |      |
|2 |  ├─TABLE FULL SCAN        |t1    |
|3 |  └─SUBPLAN SCAN           |v2    |
|4 |    └─DISTRIBUTED TABLE GET|t2(c2)|
=======================================
Outputs & filters:
-------------------------------------
  0 - output([T_FUN_COUNT(*)]), filter(nil), rowset=16
      group(nil), agg_func([T_FUN_COUNT(*)])
  1 - output(nil), filter(nil), rowset=16
      conds(nil), nl_params_([t1.c1(:0)]), use_batch=true
  2 - output([t1.c1]), filter(nil), rowset=16
      access([t1.c1]), partitions(p0)
      is_index_back=false, is_global_index=false, 
      range_key([t1.__pk_increment]), range(MIN ; MAX)always true
  3 - output(nil), filter(nil), rowset=16
      access(nil)
  4 - output([t2.c2]), filter(nil), rowset=16
      access([GROUP_ID], [t2.c2]), partitions(p0)
      is_index_back=false, is_global_index=false, 
      range_key([t2.c2], [t2.shadow_pk_0]), range(MIN,MIN ; MAX,MAX)always true, 
      range_cond([:0 = t2.c2])

explain basic select /*+NO_SEMI_TO_INNER leading(t1 view1) use_nl(view1) opt_param('_push_join_predicate','true')*/ count(*) from t1 where exists (select /*+no_merge*/ * from t2 where t1.c1 = t2.c2);
Query Plan
====================================
|ID|OPERATOR                |NAME  |
------------------------------------
|0 |SCALAR GROUP BY         |      |
|1 |└─NESTED-LOOP SEMI JOIN |      |
|2 |  ├─TABLE FULL SCAN     |t1    |
|3 |  └─SUBPLAN SCAN        |VIEW1 |
|4 |    └─TABLE GET         |t2(c2)|
====================================
Outputs & filters:
-------------------------------------
  0 - output([T_FUN_COUNT(*)]), filter(nil), rowset=16
      group(nil), agg_func([T_FUN_COUNT(*)])
  1 - output(nil), filter(nil), rowset=16
      conds(nil), nl_params_([t1.c1(:0)]), use_batch=false
  2 - output([t1.c1]), filter(nil), rowset=16
      access([t1.c1]), partitions(p0)
      is_index_back=false, is_global_index=false, 
      range_key([t1.__pk_increment]), range(MIN ; MAX)always true
  3 - output(nil), filter(nil), rowset=16
      access(nil)
  4 - output([t2.c2]), filter(nil), rowset=16
      access([t2.c2]), partitions(p0)
      is_index_back=false, is_global_index=false, 
      range_key([t2.c2], [t2.shadow_pk_0]), range(MIN,MIN ; MAX,MAX)always true, 
      range_cond([:0 = t2.c2])
explain basic select /*+NO_SEMI_TO_INNER leading(t1 view1) use_nl(view1) opt_param('_push_join_predicate','false')*/ count(*) from t1 where exists (select /*+no_merge*/ * from t2 where t1.c1 = t2.c2);
Query Plan
====================================
|ID|OPERATOR                |NAME  |
------------------------------------
|0 |SCALAR GROUP BY         |      |
|1 |└─NESTED-LOOP SEMI JOIN |      |
|2 |  ├─TABLE FULL SCAN     |t1    |
|3 |  └─SUBPLAN SCAN        |VIEW1 |
|4 |    └─TABLE GET         |t2(c2)|
====================================
Outputs & filters:
-------------------------------------
  0 - output([T_FUN_COUNT(*)]), filter(nil), rowset=16
      group(nil), agg_func([T_FUN_COUNT(*)])
  1 - output(nil), filter(nil), rowset=16
      conds(nil), nl_params_([t1.c1(:0)]), use_batch=false
  2 - output([t1.c1]), filter(nil), rowset=16
      access([t1.c1]), partitions(p0)
      is_index_back=false, is_global_index=false, 
      range_key([t1.__pk_increment]), range(MIN ; MAX)always true
  3 - output(nil), filter(nil), rowset=16
      access(nil)
  4 - output([t2.c2]), filter(nil), rowset=16
      access([t2.c2]), partitions(p0)
      is_index_back=false, is_global_index=false, 
      range_key([t2.c2], [t2.shadow_pk_0]), range(MIN,MIN ; MAX,MAX)always true, 
      range_cond([:0 = t2.c2])

explain basic select /*+leading(t1 v2) use_nl(v2) opt_param('_push_join_predicate','true')*/ count(*) from t1, (select /*+no_merge*/ t21.c1 c1, t22.c2 c2 from t2 t21, t2 t22)v2 where t1.c1 = v2.c2;
Query Plan
==============================================
|ID|OPERATOR                         |NAME   |
----------------------------------------------
|0 |SCALAR GROUP BY                  |       |
|1 |└─NESTED-LOOP JOIN               |       |
|2 |  ├─TABLE FULL SCAN              |t1     |
|3 |  └─SUBPLAN SCAN                 |v2     |
|4 |    └─NESTED-LOOP JOIN CARTESIAN |       |
|5 |      ├─TABLE GET                |t22(c2)|
|6 |      └─TABLE FULL SCAN          |t21    |
==============================================
Outputs & filters:
-------------------------------------
  0 - output([T_FUN_COUNT(*)]), filter(nil), rowset=16
      group(nil), agg_func([T_FUN_COUNT(*)])
  1 - output(nil), filter(nil), rowset=16
      conds(nil), nl_params_([t1.c1(:0)]), use_batch=false
  2 - output([t1.c1]), filter(nil), rowset=16
      access([t1.c1]), partitions(p0)
      is_index_back=false, is_global_index=false, 
      range_key([t1.__pk_increment]), range(MIN ; MAX)always true
  3 - output(nil), filter(nil), rowset=16
      access(nil)
  4 - output([t22.c2]), filter(nil), rowset=16
      conds(nil), nl_params_(nil), use_batch=false
  5 - output([t22.c2]), filter(nil), rowset=16
      access([t22.c2]), partitions(p0)
      is_index_back=false, is_global_index=false, 
      range_key([t22.c2], [t22.shadow_pk_0]), range(MIN,MIN ; MAX,MAX)always true, 
      range_cond([:0 = t22.c2])
  6 - output(nil), filter(nil), rowset=16
      access(nil), partitions(p0)
      is_index_back=false, is_global_index=false, 
      range_key([t21.__pk_increment]), range(MIN ; MAX)always true
explain basic select /*+leading(t1 v2) use_nl(v2) opt_param('_push_join_predicate','false')*/ count(*) from t1, (select /*+no_merge*/ t21.c1 c1, t22.c2 c2 from t2 t21, t2 t22)v2 where t1.c1 = v2.c2;
Query Plan
================================================
|ID|OPERATOR                           |NAME   |
------------------------------------------------
|0 |SCALAR GROUP BY                    |       |
|1 |└─NESTED-LOOP JOIN                 |       |
|2 |  ├─TABLE FULL SCAN                |t1     |
|3 |  └─MATERIAL                       |       |
|4 |    └─SUBPLAN SCAN                 |v2     |
|5 |      └─NESTED-LOOP JOIN CARTESIAN |       |
|6 |        ├─TABLE FULL SCAN          |t22(c2)|
|7 |        └─MATERIAL                 |       |
|8 |          └─TABLE FULL SCAN        |t21    |
================================================
Outputs & filters:
-------------------------------------
  0 - output([T_FUN_COUNT(*)]), filter(nil), rowset=16
      group(nil), agg_func([T_FUN_COUNT(*)])
  1 - output(nil), filter(nil), rowset=16
      conds([t1.c1 = v2.c2]), nl_params_(nil), use_batch=false
  2 - output([t1.c1]), filter(nil), rowset=16
      access([t1.c1]), partitions(p0)
      is_index_back=false, is_global_index=false, 
      range_key([t1.__pk_increment]), range(MIN ; MAX)always true
  3 - output([v2.c2]), filter(nil), rowset=16
  4 - output([v2.c2]), filter(nil), rowset=16
      access([v2.c2])
  5 - output([t22.c2]), filter(nil), rowset=16
      conds(nil), nl_params_(nil), use_batch=false
  6 - output([t22.c2]), filter(nil), rowset=16
      access([t22.c2]), partitions(p0)
      is_index_back=false, is_global_index=false, 
      range_key([t22.c2], [t22.shadow_pk_0]), range(MIN,MIN ; MAX,MAX)always true
  7 - output(nil), filter(nil), rowset=16
  8 - output(nil), filter(nil), rowset=16
      access(nil), partitions(p0)
      is_index_back=false, is_global_index=false, 
      range_key([t21.__pk_increment]), range(MIN ; MAX)always true

explain basic select /*+leading(t1 v2) use_nl(v2) opt_param('_push_join_predicate','true')*/ count(*) from t1, (select /*+no_merge*/ * from (select /*+no_merge*/ * from t2) v3)v2 where t1.c1 = v2.c2;
Query Plan
=========================================
|ID|OPERATOR                     |NAME  |
-----------------------------------------
|0 |SCALAR GROUP BY              |      |
|1 |└─NESTED-LOOP JOIN           |      |
|2 |  ├─TABLE FULL SCAN          |t1    |
|3 |  └─SUBPLAN SCAN             |v2    |
|4 |    └─SUBPLAN SCAN           |v3    |
|5 |      └─DISTRIBUTED TABLE GET|t2(c2)|
=========================================
Outputs & filters:
-------------------------------------
  0 - output([T_FUN_COUNT(*)]), filter(nil), rowset=16
      group(nil), agg_func([T_FUN_COUNT(*)])
  1 - output(nil), filter(nil), rowset=16
      conds(nil), nl_params_([t1.c1(:0)]), use_batch=true
  2 - output([t1.c1]), filter(nil), rowset=16
      access([t1.c1]), partitions(p0)
      is_index_back=false, is_global_index=false, 
      range_key([t1.__pk_increment]), range(MIN ; MAX)always true
  3 - output(nil), filter(nil), rowset=16
      access(nil)
  4 - output([v3.c2]), filter(nil), rowset=16
      access([v3.c2])
  5 - output([t2.c2]), filter(nil), rowset=16
      access([GROUP_ID], [t2.c2]), partitions(p0)
      is_index_back=false, is_global_index=false, 
      range_key([t2.c2], [t2.shadow_pk_0]), range(MIN,MIN ; MAX,MAX)always true, 
      range_cond([:0 = t2.c2])
explain basic select /*+leading(t1 v2) use_nl(v2) opt_param('_push_join_predicate','false')*/ count(*) from t1, (select /*+no_merge*/ * from (select /*+no_merge*/ * from t2) v3)v2 where t1.c1 = v2.c2;
Query Plan
=========================================
|ID|OPERATOR                     |NAME  |
-----------------------------------------
|0 |SCALAR GROUP BY              |      |
|1 |└─NESTED-LOOP JOIN           |      |
|2 |  ├─TABLE FULL SCAN          |t1    |
|3 |  └─SUBPLAN SCAN             |v2    |
|4 |    └─SUBPLAN SCAN           |v3    |
|5 |      └─DISTRIBUTED TABLE GET|t2(c2)|
=========================================
Outputs & filters:
-------------------------------------
  0 - output([T_FUN_COUNT(*)]), filter(nil), rowset=16
      group(nil), agg_func([T_FUN_COUNT(*)])
  1 - output(nil), filter(nil), rowset=16
      conds(nil), nl_params_([t1.c1(:0)]), use_batch=true
  2 - output([t1.c1]), filter(nil), rowset=16
      access([t1.c1]), partitions(p0)
      is_index_back=false, is_global_index=false, 
      range_key([t1.__pk_increment]), range(MIN ; MAX)always true
  3 - output(nil), filter(nil), rowset=16
      access(nil)
  4 - output([v3.c2]), filter(nil), rowset=16
      access([v3.c2])
  5 - output([t2.c2]), filter(nil), rowset=16
      access([GROUP_ID], [t2.c2]), partitions(p0)
      is_index_back=false, is_global_index=false, 
      range_key([t2.c2], [t2.shadow_pk_0]), range(MIN,MIN ; MAX,MAX)always true, 
      range_cond([:0 = t2.c2])
explain basic select /*+leading(t1 v2) use_nl(v2) opt_param('_push_join_predicate','true')*/ count(*) from t1, (select /*+no_merge*/ count(*) c2 from t2 group by t2.c1)v2 where t1.c1 = v2.c2;
Query Plan
==========================================
|ID|OPERATOR                 |NAME       |
------------------------------------------
|0 |SCALAR GROUP BY          |           |
|1 |└─NESTED-LOOP JOIN       |           |
|2 |  ├─TABLE FULL SCAN      |t1         |
|3 |  └─MATERIAL             |           |
|4 |    └─SUBPLAN SCAN       |v2         |
|5 |      └─MERGE GROUP BY   |           |
|6 |        └─TABLE FULL SCAN|t2(i_t2_c1)|
==========================================
Outputs & filters:
-------------------------------------
  0 - output([T_FUN_COUNT(*)]), filter(nil), rowset=16
      group(nil), agg_func([T_FUN_COUNT(*)])
  1 - output(nil), filter(nil), rowset=16
      conds([t1.c1 = v2.c2]), nl_params_(nil), use_batch=false
  2 - output([t1.c1]), filter(nil), rowset=16
      access([t1.c1]), partitions(p0)
      is_index_back=false, is_global_index=false, 
      range_key([t1.__pk_increment]), range(MIN ; MAX)always true
  3 - output([v2.c2]), filter(nil), rowset=16
  4 - output([v2.c2]), filter(nil), rowset=16
      access([v2.c2])
  5 - output([T_FUN_COUNT(*)]), filter(nil), rowset=16
      group([t2.c1]), agg_func([T_FUN_COUNT(*)])
  6 - output([t2.c1]), filter(nil), rowset=16
      access([t2.c1]), partitions(p0)
      is_index_back=false, is_global_index=false, 
      range_key([t2.c1], [t2.__pk_increment]), range(MIN,MIN ; MAX,MAX)always true
explain basic select /*+leading(t1 v2) use_nl(v2) opt_param('_push_join_predicate','false')*/ count(*) from t1, (select /*+no_merge*/ count(*) c2 from t2 group by t2.c1)v2 where t1.c1 = v2.c2;
Query Plan
==========================================
|ID|OPERATOR                 |NAME       |
------------------------------------------
|0 |SCALAR GROUP BY          |           |
|1 |└─NESTED-LOOP JOIN       |           |
|2 |  ├─TABLE FULL SCAN      |t1         |
|3 |  └─MATERIAL             |           |
|4 |    └─SUBPLAN SCAN       |v2         |
|5 |      └─MERGE GROUP BY   |           |
|6 |        └─TABLE FULL SCAN|t2(i_t2_c1)|
==========================================
Outputs & filters:
-------------------------------------
  0 - output([T_FUN_COUNT(*)]), filter(nil), rowset=16
      group(nil), agg_func([T_FUN_COUNT(*)])
  1 - output(nil), filter(nil), rowset=16
      conds([t1.c1 = v2.c2]), nl_params_(nil), use_batch=false
  2 - output([t1.c1]), filter(nil), rowset=16
      access([t1.c1]), partitions(p0)
      is_index_back=false, is_global_index=false, 
      range_key([t1.__pk_increment]), range(MIN ; MAX)always true
  3 - output([v2.c2]), filter(nil), rowset=16
  4 - output([v2.c2]), filter(nil), rowset=16
      access([v2.c2])
  5 - output([T_FUN_COUNT(*)]), filter(nil), rowset=16
      group([t2.c1]), agg_func([T_FUN_COUNT(*)])
  6 - output([t2.c1]), filter(nil), rowset=16
      access([t2.c1]), partitions(p0)
      is_index_back=false, is_global_index=false, 
      range_key([t2.c1], [t2.__pk_increment]), range(MIN,MIN ; MAX,MAX)always true
explain basic select /*+leading(t1 v2) use_nl(v2) opt_param('_push_join_predicate','true')*/ count(*) from t1, (select /*+no_merge*/ * from (select /*+no_merge*/ t21.c1 c1, t22.c2 c2 from t2 t21, t2 t22) v3)v2 where t1.c1 = v2.c2;
Query Plan
================================================
|ID|OPERATOR                           |NAME   |
------------------------------------------------
|0 |SCALAR GROUP BY                    |       |
|1 |└─NESTED-LOOP JOIN                 |       |
|2 |  ├─TABLE FULL SCAN                |t1     |
|3 |  └─SUBPLAN SCAN                   |v2     |
|4 |    └─SUBPLAN SCAN                 |v3     |
|5 |      └─NESTED-LOOP JOIN CARTESIAN |       |
|6 |        ├─TABLE GET                |t22(c2)|
|7 |        └─TABLE FULL SCAN          |t21    |
================================================
Outputs & filters:
-------------------------------------
  0 - output([T_FUN_COUNT(*)]), filter(nil), rowset=16
      group(nil), agg_func([T_FUN_COUNT(*)])
  1 - output(nil), filter(nil), rowset=16
      conds(nil), nl_params_([t1.c1(:0)]), use_batch=false
  2 - output([t1.c1]), filter(nil), rowset=16
      access([t1.c1]), partitions(p0)
      is_index_back=false, is_global_index=false, 
      range_key([t1.__pk_increment]), range(MIN ; MAX)always true
  3 - output(nil), filter(nil), rowset=16
      access(nil)
  4 - output([v3.c2]), filter(nil), rowset=16
      access([v3.c2])
  5 - output([t22.c2]), filter(nil), rowset=16
      conds(nil), nl_params_(nil), use_batch=false
  6 - output([t22.c2]), filter(nil), rowset=16
      access([t22.c2]), partitions(p0)
      is_index_back=false, is_global_index=false, 
      range_key([t22.c2], [t22.shadow_pk_0]), range(MIN,MIN ; MAX,MAX)always true, 
      range_cond([:0 = t22.c2])
  7 - output(nil), filter(nil), rowset=16
      access(nil), partitions(p0)
      is_index_back=false, is_global_index=false, 
      range_key([t21.__pk_increment]), range(MIN ; MAX)always true
explain basic select /*+leading(t1 v2) use_nl(v2) opt_param('_push_join_predicate','false')*/ count(*) from t1, (select /*+no_merge*/ * from (select /*+no_merge*/ t21.c1 c1, t22.c2 c2 from t2 t21, t2 t22) v3)v2 where t1.c1 = v2.c2;
Query Plan
==================================================
|ID|OPERATOR                             |NAME   |
--------------------------------------------------
|0 |SCALAR GROUP BY                      |       |
|1 |└─NESTED-LOOP JOIN                   |       |
|2 |  ├─TABLE FULL SCAN                  |t1     |
|3 |  └─MATERIAL                         |       |
|4 |    └─SUBPLAN SCAN                   |v2     |
|5 |      └─SUBPLAN SCAN                 |v3     |
|6 |        └─NESTED-LOOP JOIN CARTESIAN |       |
|7 |          ├─TABLE FULL SCAN          |t22(c2)|
|8 |          └─MATERIAL                 |       |
|9 |            └─TABLE FULL SCAN        |t21    |
==================================================
Outputs & filters:
-------------------------------------
  0 - output([T_FUN_COUNT(*)]), filter(nil), rowset=16
      group(nil), agg_func([T_FUN_COUNT(*)])
  1 - output(nil), filter(nil), rowset=16
      conds([t1.c1 = v2.c2]), nl_params_(nil), use_batch=false
  2 - output([t1.c1]), filter(nil), rowset=16
      access([t1.c1]), partitions(p0)
      is_index_back=false, is_global_index=false, 
      range_key([t1.__pk_increment]), range(MIN ; MAX)always true
  3 - output([v2.c2]), filter(nil), rowset=16
  4 - output([v2.c2]), filter(nil), rowset=16
      access([v2.c2])
  5 - output([v3.c2]), filter(nil), rowset=16
      access([v3.c2])
  6 - output([t22.c2]), filter(nil), rowset=16
      conds(nil), nl_params_(nil), use_batch=false
  7 - output([t22.c2]), filter(nil), rowset=16
      access([t22.c2]), partitions(p0)
      is_index_back=false, is_global_index=false, 
      range_key([t22.c2], [t22.shadow_pk_0]), range(MIN,MIN ; MAX,MAX)always true
  8 - output(nil), filter(nil), rowset=16
  9 - output(nil), filter(nil), rowset=16
      access(nil), partitions(p0)
      is_index_back=false, is_global_index=false, 
      range_key([t21.__pk_increment]), range(MIN ; MAX)always true

set _push_join_predicate = false;
explain basic select /*+leading(t1 v2) use_nl(v2)*/ count(*) from t1, (select /*+no_merge*/ * from t2)v2 where t1.c1 = v2.c2;
Query Plan
=======================================
|ID|OPERATOR                   |NAME  |
---------------------------------------
|0 |SCALAR GROUP BY            |      |
|1 |└─NESTED-LOOP JOIN         |      |
|2 |  ├─TABLE FULL SCAN        |t1    |
|3 |  └─SUBPLAN SCAN           |v2    |
|4 |    └─DISTRIBUTED TABLE GET|t2(c2)|
=======================================
Outputs & filters:
-------------------------------------
  0 - output([T_FUN_COUNT(*)]), filter(nil), rowset=16
      group(nil), agg_func([T_FUN_COUNT(*)])
  1 - output(nil), filter(nil), rowset=16
      conds(nil), nl_params_([t1.c1(:0)]), use_batch=true
  2 - output([t1.c1]), filter(nil), rowset=16
      access([t1.c1]), partitions(p0)
      is_index_back=false, is_global_index=false, 
      range_key([t1.__pk_increment]), range(MIN ; MAX)always true
  3 - output(nil), filter(nil), rowset=16
      access(nil)
  4 - output([t2.c2]), filter(nil), rowset=16
      access([GROUP_ID], [t2.c2]), partitions(p0)
      is_index_back=false, is_global_index=false, 
      range_key([t2.c2], [t2.shadow_pk_0]), range(MIN,MIN ; MAX,MAX)always true, 
      range_cond([:0 = t2.c2])
explain basic select /*+leading(t1 v2) use_nl(v2) opt_param('_push_join_predicate','true')*/ count(*) from t1, (select /*+no_merge*/ * from t2)v2 where t1.c1 = v2.c2;
Query Plan
=======================================
|ID|OPERATOR                   |NAME  |
---------------------------------------
|0 |SCALAR GROUP BY            |      |
|1 |└─NESTED-LOOP JOIN         |      |
|2 |  ├─TABLE FULL SCAN        |t1    |
|3 |  └─SUBPLAN SCAN           |v2    |
|4 |    └─DISTRIBUTED TABLE GET|t2(c2)|
=======================================
Outputs & filters:
-------------------------------------
  0 - output([T_FUN_COUNT(*)]), filter(nil), rowset=16
      group(nil), agg_func([T_FUN_COUNT(*)])
  1 - output(nil), filter(nil), rowset=16
      conds(nil), nl_params_([t1.c1(:0)]), use_batch=true
  2 - output([t1.c1]), filter(nil), rowset=16
      access([t1.c1]), partitions(p0)
      is_index_back=false, is_global_index=false, 
      range_key([t1.__pk_increment]), range(MIN ; MAX)always true
  3 - output(nil), filter(nil), rowset=16
      access(nil)
  4 - output([t2.c2]), filter(nil), rowset=16
      access([GROUP_ID], [t2.c2]), partitions(p0)
      is_index_back=false, is_global_index=false, 
      range_key([t2.c2], [t2.shadow_pk_0]), range(MIN,MIN ; MAX,MAX)always true, 
      range_cond([:0 = t2.c2])
explain basic select /*+leading(t1 v2) use_nl(v2)*/ count(*) from t1, (select /*+no_merge*/ t21.c1 c1, t22.c2 c2 from t2 t21, t2 t22)v2 where t1.c1 = v2.c2;
Query Plan
================================================
|ID|OPERATOR                           |NAME   |
------------------------------------------------
|0 |SCALAR GROUP BY                    |       |
|1 |└─NESTED-LOOP JOIN                 |       |
|2 |  ├─TABLE FULL SCAN                |t1     |
|3 |  └─MATERIAL                       |       |
|4 |    └─SUBPLAN SCAN                 |v2     |
|5 |      └─NESTED-LOOP JOIN CARTESIAN |       |
|6 |        ├─TABLE FULL SCAN          |t22(c2)|
|7 |        └─MATERIAL                 |       |
|8 |          └─TABLE FULL SCAN        |t21    |
================================================
Outputs & filters:
-------------------------------------
  0 - output([T_FUN_COUNT(*)]), filter(nil), rowset=16
      group(nil), agg_func([T_FUN_COUNT(*)])
  1 - output(nil), filter(nil), rowset=16
      conds([t1.c1 = v2.c2]), nl_params_(nil), use_batch=false
  2 - output([t1.c1]), filter(nil), rowset=16
      access([t1.c1]), partitions(p0)
      is_index_back=false, is_global_index=false, 
      range_key([t1.__pk_increment]), range(MIN ; MAX)always true
  3 - output([v2.c2]), filter(nil), rowset=16
  4 - output([v2.c2]), filter(nil), rowset=16
      access([v2.c2])
  5 - output([t22.c2]), filter(nil), rowset=16
      conds(nil), nl_params_(nil), use_batch=false
  6 - output([t22.c2]), filter(nil), rowset=16
      access([t22.c2]), partitions(p0)
      is_index_back=false, is_global_index=false, 
      range_key([t22.c2], [t22.shadow_pk_0]), range(MIN,MIN ; MAX,MAX)always true
  7 - output(nil), filter(nil), rowset=16
  8 - output(nil), filter(nil), rowset=16
      access(nil), partitions(p0)
      is_index_back=false, is_global_index=false, 
      range_key([t21.__pk_increment]), range(MIN ; MAX)always true
explain basic select /*+leading(t1 v2) use_nl(v2) opt_param('_push_join_predicate','true')*/ count(*) from t1, (select /*+no_merge*/ t21.c1 c1, t22.c2 c2 from t2 t21, t2 t22)v2 where t1.c1 = v2.c2;
Query Plan
==============================================
|ID|OPERATOR                         |NAME   |
----------------------------------------------
|0 |SCALAR GROUP BY                  |       |
|1 |└─NESTED-LOOP JOIN               |       |
|2 |  ├─TABLE FULL SCAN              |t1     |
|3 |  └─SUBPLAN SCAN                 |v2     |
|4 |    └─NESTED-LOOP JOIN CARTESIAN |       |
|5 |      ├─TABLE GET                |t22(c2)|
|6 |      └─TABLE FULL SCAN          |t21    |
==============================================
Outputs & filters:
-------------------------------------
  0 - output([T_FUN_COUNT(*)]), filter(nil), rowset=16
      group(nil), agg_func([T_FUN_COUNT(*)])
  1 - output(nil), filter(nil), rowset=16
      conds(nil), nl_params_([t1.c1(:0)]), use_batch=false
  2 - output([t1.c1]), filter(nil), rowset=16
      access([t1.c1]), partitions(p0)
      is_index_back=false, is_global_index=false, 
      range_key([t1.__pk_increment]), range(MIN ; MAX)always true
  3 - output(nil), filter(nil), rowset=16
      access(nil)
  4 - output([t22.c2]), filter(nil), rowset=16
      conds(nil), nl_params_(nil), use_batch=false
  5 - output([t22.c2]), filter(nil), rowset=16
      access([t22.c2]), partitions(p0)
      is_index_back=false, is_global_index=false, 
      range_key([t22.c2], [t22.shadow_pk_0]), range(MIN,MIN ; MAX,MAX)always true, 
      range_cond([:0 = t22.c2])
  6 - output(nil), filter(nil), rowset=16
      access(nil), partitions(p0)
      is_index_back=false, is_global_index=false, 
      range_key([t21.__pk_increment]), range(MIN ; MAX)always true

set _push_join_predicate = true;
explain basic select /*+leading(t1 v2) use_nl(v2)*/ count(*) from t1, (select /*+no_merge*/ * from t2)v2 where t1.c1 = v2.c2;
Query Plan
=======================================
|ID|OPERATOR                   |NAME  |
---------------------------------------
|0 |SCALAR GROUP BY            |      |
|1 |└─NESTED-LOOP JOIN         |      |
|2 |  ├─TABLE FULL SCAN        |t1    |
|3 |  └─SUBPLAN SCAN           |v2    |
|4 |    └─DISTRIBUTED TABLE GET|t2(c2)|
=======================================
Outputs & filters:
-------------------------------------
  0 - output([T_FUN_COUNT(*)]), filter(nil), rowset=16
      group(nil), agg_func([T_FUN_COUNT(*)])
  1 - output(nil), filter(nil), rowset=16
      conds(nil), nl_params_([t1.c1(:0)]), use_batch=true
  2 - output([t1.c1]), filter(nil), rowset=16
      access([t1.c1]), partitions(p0)
      is_index_back=false, is_global_index=false, 
      range_key([t1.__pk_increment]), range(MIN ; MAX)always true
  3 - output(nil), filter(nil), rowset=16
      access(nil)
  4 - output([t2.c2]), filter(nil), rowset=16
      access([GROUP_ID], [t2.c2]), partitions(p0)
      is_index_back=false, is_global_index=false, 
      range_key([t2.c2], [t2.shadow_pk_0]), range(MIN,MIN ; MAX,MAX)always true, 
      range_cond([:0 = t2.c2])
explain basic select /*+leading(t1 v2) use_nl(v2) opt_param('_push_join_predicate','false')*/ count(*) from t1, (select /*+no_merge*/ * from t2)v2 where t1.c1 = v2.c2;
Query Plan
=======================================
|ID|OPERATOR                   |NAME  |
---------------------------------------
|0 |SCALAR GROUP BY            |      |
|1 |└─NESTED-LOOP JOIN         |      |
|2 |  ├─TABLE FULL SCAN        |t1    |
|3 |  └─SUBPLAN SCAN           |v2    |
|4 |    └─DISTRIBUTED TABLE GET|t2(c2)|
=======================================
Outputs & filters:
-------------------------------------
  0 - output([T_FUN_COUNT(*)]), filter(nil), rowset=16
      group(nil), agg_func([T_FUN_COUNT(*)])
  1 - output(nil), filter(nil), rowset=16
      conds(nil), nl_params_([t1.c1(:0)]), use_batch=true
  2 - output([t1.c1]), filter(nil), rowset=16
      access([t1.c1]), partitions(p0)
      is_index_back=false, is_global_index=false, 
      range_key([t1.__pk_increment]), range(MIN ; MAX)always true
  3 - output(nil), filter(nil), rowset=16
      access(nil)
  4 - output([t2.c2]), filter(nil), rowset=16
      access([GROUP_ID], [t2.c2]), partitions(p0)
      is_index_back=false, is_global_index=false, 
      range_key([t2.c2], [t2.shadow_pk_0]), range(MIN,MIN ; MAX,MAX)always true, 
      range_cond([:0 = t2.c2])
explain basic select /*+leading(t1 v2) use_nl(v2)*/ count(*) from t1, (select /*+no_merge*/ t21.c1 c1, t22.c2 c2 from t2 t21, t2 t22)v2 where t1.c1 = v2.c2;
Query Plan
==============================================
|ID|OPERATOR                         |NAME   |
----------------------------------------------
|0 |SCALAR GROUP BY                  |       |
|1 |└─NESTED-LOOP JOIN               |       |
|2 |  ├─TABLE FULL SCAN              |t1     |
|3 |  └─SUBPLAN SCAN                 |v2     |
|4 |    └─NESTED-LOOP JOIN CARTESIAN |       |
|5 |      ├─TABLE GET                |t22(c2)|
|6 |      └─TABLE FULL SCAN          |t21    |
==============================================
Outputs & filters:
-------------------------------------
  0 - output([T_FUN_COUNT(*)]), filter(nil), rowset=16
      group(nil), agg_func([T_FUN_COUNT(*)])
  1 - output(nil), filter(nil), rowset=16
      conds(nil), nl_params_([t1.c1(:0)]), use_batch=false
  2 - output([t1.c1]), filter(nil), rowset=16
      access([t1.c1]), partitions(p0)
      is_index_back=false, is_global_index=false, 
      range_key([t1.__pk_increment]), range(MIN ; MAX)always true
  3 - output(nil), filter(nil), rowset=16
      access(nil)
  4 - output([t22.c2]), filter(nil), rowset=16
      conds(nil), nl_params_(nil), use_batch=false
  5 - output([t22.c2]), filter(nil), rowset=16
      access([t22.c2]), partitions(p0)
      is_index_back=false, is_global_index=false, 
      range_key([t22.c2], [t22.shadow_pk_0]), range(MIN,MIN ; MAX,MAX)always true, 
      range_cond([:0 = t22.c2])
  6 - output(nil), filter(nil), rowset=16
      access(nil), partitions(p0)
      is_index_back=false, is_global_index=false, 
      range_key([t21.__pk_increment]), range(MIN ; MAX)always true
explain basic select /*+leading(t1 v2) use_nl(v2) opt_param('_push_join_predicate','false')*/ count(*) from t1, (select /*+no_merge*/ t21.c1 c1, t22.c2 c2 from t2 t21, t2 t22)v2 where t1.c1 = v2.c2;
Query Plan
================================================
|ID|OPERATOR                           |NAME   |
------------------------------------------------
|0 |SCALAR GROUP BY                    |       |
|1 |└─NESTED-LOOP JOIN                 |       |
|2 |  ├─TABLE FULL SCAN                |t1     |
|3 |  └─MATERIAL                       |       |
|4 |    └─SUBPLAN SCAN                 |v2     |
|5 |      └─NESTED-LOOP JOIN CARTESIAN |       |
|6 |        ├─TABLE FULL SCAN          |t22(c2)|
|7 |        └─MATERIAL                 |       |
|8 |          └─TABLE FULL SCAN        |t21    |
================================================
Outputs & filters:
-------------------------------------
  0 - output([T_FUN_COUNT(*)]), filter(nil), rowset=16
      group(nil), agg_func([T_FUN_COUNT(*)])
  1 - output(nil), filter(nil), rowset=16
      conds([t1.c1 = v2.c2]), nl_params_(nil), use_batch=false
  2 - output([t1.c1]), filter(nil), rowset=16
      access([t1.c1]), partitions(p0)
      is_index_back=false, is_global_index=false, 
      range_key([t1.__pk_increment]), range(MIN ; MAX)always true
  3 - output([v2.c2]), filter(nil), rowset=16
  4 - output([v2.c2]), filter(nil), rowset=16
      access([v2.c2])
  5 - output([t22.c2]), filter(nil), rowset=16
      conds(nil), nl_params_(nil), use_batch=false
  6 - output([t22.c2]), filter(nil), rowset=16
      access([t22.c2]), partitions(p0)
      is_index_back=false, is_global_index=false, 
      range_key([t22.c2], [t22.shadow_pk_0]), range(MIN,MIN ; MAX,MAX)always true
  7 - output(nil), filter(nil), rowset=16
  8 - output(nil), filter(nil), rowset=16
      access(nil), partitions(p0)
      is_index_back=false, is_global_index=false, 
      range_key([t21.__pk_increment]), range(MIN ; MAX)always true

drop view v1;
drop view v2;
drop view v3;
drop view v4;
drop table t1;
drop table t2;
