drop table if exists t1;
create table t1 (a int not null auto_increment,b int, primary key (a)) engine=heap auto_increment=3;
Warnings:
Warning	1286	Unknown storage engine 'heap'
insert into t1 values (1,1),(NULL,3),(NULL,4);
delete from t1 where a=4;
insert into t1 values (NULL,5),(NULL,6);
select * from t1;
a	b
1	1
3	3
6	5
7	6
delete from t1 where a=6;
replace t1 values (3,1);
ALTER TABLE t1 add c int;
replace t1 values (3,3,3);
insert into t1 values (NULL,7,7);
update t1 set a=8,b=b+1,c=c+1 where a=7;
ERROR 23000: Duplicate entry '8' for key 'PRIMARY'
insert into t1 values (NULL,9,9);
select * from t1;
a	b	c
1	1	NULL
3	3	3
7	6	NULL
8	7	7
9	9	9
drop table t1;
create table t1 (
skey tinyint unsigned NOT NULL auto_increment PRIMARY KEY,
sval char(20)
) engine=heap;
Warnings:
Warning	1286	Unknown storage engine 'heap'
insert into t1 values (NULL, "hello");
insert into t1 values (NULL, "hey");
select * from t1;
skey	sval
1	hello
2	hey
select _rowid,t1._rowid,skey,sval from t1;
ERROR 42S22: Unknown column '_rowid' in 'field list'
drop table t1;
