drop user mysqltest_dfn;
drop user mysqltest_inv;
FLUSH PRIVILEGES;
Warnings:
Warning	1235	After executing the GRANT and REVOKE statements, the permissions will be automatically applied and take effect. There is no need to execute the FLUSH PRIVILEGES command. FLUSH PRIVILEGES not supported
DROP DATABASE IF EXISTS mysqltest_db1;
CREATE DATABASE mysqltest_db1;
CREATE USER mysqltest_dfn;
CREATE USER mysqltest_inv;
GRANT CREATE ON mysqltest_db1.* TO mysqltest_dfn;

---> connection: wl2818_definer_con
CREATE TABLE t1(num_value INT);
CREATE TABLE t2(user_str TEXT);

---> connection: default
GRANT INSERT, DROP ON mysqltest_db1.t1 TO mysqltest_dfn;
GRANT INSERT, DROP ON mysqltest_db1.t2 TO mysqltest_dfn;

---> connection: default
GRANT SUPER ON *.* TO mysqltest_dfn;

---> connection: wl2818_definer_con
CREATE TRIGGER trg1 AFTER INSERT ON t1
FOR EACH ROW
INSERT INTO t2 VALUES(CURRENT_USER());
ERROR 42000: TRIGGER command denied to user 'mysqltest_dfn'@'%' for table 't1'

---> connection: default
GRANT TRIGGER ON mysqltest_db1.t1 TO mysqltest_dfn;

---> connection: wl2818_definer_con
CREATE TRIGGER trg1 AFTER INSERT ON t1
FOR EACH ROW
INSERT INTO t2 VALUES(CURRENT_USER());

---> connection: default
REVOKE TRIGGER ON mysqltest_db1.t1 FROM mysqltest_dfn;

---> connection: wl2818_definer_con
DROP TRIGGER trg1;
ERROR 42000: TRIGGER command denied to user 'mysqltest_dfn'@'%' for table 't1'

---> connection: wl2818_definer_con
INSERT INTO t1 VALUES(0);
ERROR 42000: TRIGGER command denied to user 'mysqltest_dfn'@'%' for table 't1'

---> connection: default
GRANT TRIGGER ON mysqltest_db1.t1 TO mysqltest_dfn;

---> connection: wl2818_definer_con
INSERT INTO t1 VALUES(0);
DROP TRIGGER trg1;
TRUNCATE TABLE t1;
TRUNCATE TABLE t2;

---> connection: default
REVOKE SUPER ON *.* FROM mysqltest_dfn;

---> connection: wl2818_definer_con
CREATE TRIGGER trg1 AFTER INSERT ON t1
FOR EACH ROW
INSERT INTO t2 VALUES(CURRENT_USER());

---> connection: default
GRANT ALL PRIVILEGES ON mysqltest_db1.t1 TO mysqltest_dfn;
GRANT ALL PRIVILEGES ON mysqltest_db1.t2 TO mysqltest_dfn;
GRANT ALL PRIVILEGES ON mysqltest_db1.t1
TO 'mysqltest_inv';
GRANT SELECT ON mysqltest_db1.t2
TO 'mysqltest_inv';

---> connection: wl2818_definer_con
use mysqltest_db1;
INSERT INTO t1 VALUES(1);
SELECT * FROM t1;
num_value
1
SELECT * FROM t2;
user_str
mysqltest_dfn@%

---> connection: wl2818_invoker_con
use mysqltest_db1;
INSERT INTO t1 VALUES(2);
SELECT * FROM t1;
num_value
1
2
SELECT * FROM t2;
user_str
mysqltest_dfn@%
mysqltest_dfn@%

---> connection: default
use mysqltest_db1;
REVOKE INSERT ON mysqltest_db1.t2 FROM mysqltest_dfn;

---> connection: wl2818_invoker_con
use mysqltest_db1;
INSERT INTO t1 VALUES(3);
ERROR 42000: INSERT command denied to user 'mysqltest_dfn'@'%' for table 't2'
SELECT * FROM t1;
num_value
1
2
SELECT * FROM t2;
user_str
mysqltest_dfn@%
mysqltest_dfn@%

---> connection: wl2818_definer_con
use mysqltest_db1;
DROP TRIGGER trg1;
CREATE DEFINER='mysqltest_inv'@'localhost'
  TRIGGER trg1 BEFORE INSERT ON t1
FOR EACH ROW
SET @new_sum = 0;
ERROR 42501: Access denied

---> connection: default
use mysqltest_db1;
GRANT SUPER ON *.* TO mysqltest_dfn;

---> connection: wl2818_definer_con
CREATE DEFINER='mysqltest_inv'@'localhost'
  TRIGGER trg1 BEFORE INSERT ON t1
FOR EACH ROW
SET @new_sum = 0;
Warnings:
Warning	1449	User mysqltest_inv not exist
CREATE DEFINER='mysqltest_nonexs'@'localhost'
  TRIGGER trg2 AFTER INSERT ON t1
FOR EACH ROW
SET @new_sum = 0;
Warnings:
Warning	1449	User mysqltest_nonexs not exist
INSERT INTO t1 VALUES(6);
ERROR HY000: User not exist
SHOW TRIGGERS;
Trigger	Event	Table	Statement	Timing	Created	sql_mode	Definer	character_set_client	collation_connection	Database Collation
FOR EACH ROW
FOR EACH ROW
SET @new_sum = 0	AFTER	#	STRICT_ALL_TABLES,NO_ZERO_IN_DATE,NO_AUTO_CREATE_USER	mysqltest_nonexs@localhost	utf8mb4	utf8mb4_general_ci	utf8mb4_general_ci
SET @new_sum = 0	BEFORE	#	STRICT_ALL_TABLES,NO_ZERO_IN_DATE,NO_AUTO_CREATE_USER	mysqltest_inv@localhost	utf8mb4	utf8mb4_general_ci	utf8mb4_general_ci
trg1	INSERT	t1	TRIGGER trg1 BEFORE INSERT ON t1
trg2	INSERT	t1	TRIGGER trg2 AFTER INSERT ON t1
DROP TRIGGER trg1;
DROP TRIGGER trg2;
CREATE TRIGGER trg1 BEFORE INSERT ON t1
FOR EACH ROW
SET @a = 1;
CREATE TRIGGER trg2 AFTER INSERT ON t1
FOR EACH ROW
SET @a = 2;
CREATE TRIGGER trg3 BEFORE UPDATE ON t1
FOR EACH ROW
SET @a = 3;
CREATE TRIGGER trg4 AFTER UPDATE ON t1
FOR EACH ROW
SET @a = 4;
CREATE TRIGGER trg5 BEFORE DELETE ON t1
FOR EACH ROW
SET @a = 5;

---> connection: default
DROP USER mysqltest_dfn;
DROP USER mysqltest_inv;
DROP DATABASE mysqltest_db1;
drop user mysqltest_u1;
FLUSH PRIVILEGES;
Warnings:
Warning	1235	After executing the GRANT and REVOKE statements, the permissions will be automatically applied and take effect. There is no need to execute the FLUSH PRIVILEGES command. FLUSH PRIVILEGES not supported
DROP DATABASE IF EXISTS mysqltest_db1;
CREATE DATABASE mysqltest_db1;
use mysqltest_db1;
CREATE TABLE t1(col CHAR(20));
CREATE TABLE t2(col CHAR(20));
CREATE TABLE t3(col CHAR(20));
CREATE TABLE t4(col CHAR(20));
CREATE USER mysqltest_u1;
REVOKE ALL PRIVILEGES, GRANT OPTION FROM mysqltest_u1;
GRANT TRIGGER ON mysqltest_db1.* TO mysqltest_u1;
SET test_var = NULL;

---> connection: default
use mysqltest_db1;
GRANT DELETE ON mysqltest_db1.* TO mysqltest_u1;
SHOW GRANTS FOR mysqltest_u1;
Grants for mysqltest_u1@%
GRANT USAGE ON *.* TO 'mysqltest_u1'
GRANT DELETE, TRIGGER ON `mysqltest_db1`.* TO 'mysqltest_u1'

---> connection: bug15166_u1_con
use mysqltest_db1;
CREATE TRIGGER t1_trg_after_delete AFTER DELETE ON t1
FOR EACH ROW
SET test_var = 'Hello, world!';

---> connection: default
use mysqltest_db1;
GRANT UPDATE ON mysqltest_db1.t1 TO mysqltest_u1;
GRANT UPDATE ON mysqltest_db1.t2 TO mysqltest_u1;
GRANT UPDATE(col) ON mysqltest_db1.t3 TO mysqltest_u1;
GRANT UPDATE(col) ON mysqltest_db1.t4 TO mysqltest_u1;
GRANT UPDATE ON mysqltest_db1.t3 TO mysqltest_u1;
GRANT UPDATE ON mysqltest_db1.t4 TO mysqltest_u1;

---> connection: bug15166_u1_con
use mysqltest_db1;
CREATE TRIGGER t1_trg_err_1 BEFORE INSERT ON t1
FOR EACH ROW
SET test_var = NEW.col;
DROP TRIGGER t1_trg_err_1;
CREATE TRIGGER t1_trg_err_2 BEFORE DELETE ON t1
FOR EACH ROW
SET test_var = OLD.col;
DROP TRIGGER t1_trg_err_2;
CREATE TRIGGER t2_trg_before_insert BEFORE INSERT ON t2
FOR EACH ROW
SET NEW.col = 't2_trg_before_insert';
CREATE TRIGGER t3_trg_err_1 BEFORE INSERT ON t3
FOR EACH ROW
SET test_var = NEW.col;
DROP TRIGGER t3_trg_err_1;
CREATE TRIGGER t3_trg_err_2 BEFORE DELETE ON t3
FOR EACH ROW
SET test_var = OLD.col;
DROP TRIGGER t3_trg_err_2;
CREATE TRIGGER t4_trg_before_insert BEFORE INSERT ON t4
FOR EACH ROW
SET NEW.col = 't4_trg_before_insert';

---> connection: default
use mysqltest_db1;
REVOKE UPDATE ON mysqltest_db1.t1 FROM mysqltest_u1;
REVOKE UPDATE ON mysqltest_db1.t2 FROM mysqltest_u1;
GRANT SELECT ON mysqltest_db1.t1 TO mysqltest_u1;
GRANT SELECT ON mysqltest_db1.t2 TO mysqltest_u1;
REVOKE UPDATE ON mysqltest_db1.t3 FROM mysqltest_u1;
REVOKE UPDATE ON mysqltest_db1.t4 FROM mysqltest_u1;
GRANT SELECT on mysqltest_db1.t3 TO mysqltest_u1;
GRANT SELECT on mysqltest_db1.t4 TO mysqltest_u1;

---> connection: bug15166_u1_con
use mysqltest_db1;
CREATE TRIGGER t1_trg_after_insert AFTER INSERT ON t1
FOR EACH ROW
SET test_var = NEW.col;
CREATE TRIGGER t1_trg_after_update AFTER UPDATE ON t1
FOR EACH ROW
SET test_var = OLD.col;
CREATE TRIGGER t2_trg_err_1 BEFORE UPDATE ON t2
FOR EACH ROW
SET NEW.col = 't2_trg_err_1';
DROP TRIGGER t2_trg_err_1;
CREATE TRIGGER t2_trg_err_2 BEFORE UPDATE ON t2
FOR EACH ROW
SET NEW.col = CONCAT(OLD.col, '(updated)');
DROP TRIGGER t2_trg_err_2;
CREATE TRIGGER t3_trg_after_insert AFTER INSERT ON t3
FOR EACH ROW
SET test_var = NEW.col;
CREATE TRIGGER t3_trg_after_update AFTER UPDATE ON t3
FOR EACH ROW
SET test_var = OLD.col;
CREATE TRIGGER t4_trg_err_1 BEFORE UPDATE ON t4
FOR EACH ROW
SET NEW.col = 't4_trg_err_1';
DROP TRIGGER t4_trg_err_1;
CREATE TRIGGER t4_trg_err_2 BEFORE UPDATE ON t4
FOR EACH ROW
SET NEW.col = CONCAT(OLD.col, '(updated)');
DROP TRIGGER t4_trg_err_2;

---> connection: default
use mysqltest_db1;
REVOKE SELECT ON mysqltest_db1.t1 FROM mysqltest_u1;
REVOKE SELECT ON mysqltest_db1.t2 FROM mysqltest_u1;
GRANT UPDATE ON mysqltest_db1.t1 TO mysqltest_u1;
GRANT UPDATE ON mysqltest_db1.t2 TO mysqltest_u1;
REVOKE SELECT ON mysqltest_db1.t3 FROM mysqltest_u1;
REVOKE SELECT ON mysqltest_db1.t4 FROM mysqltest_u1;
GRANT UPDATE ON mysqltest_db1.t3 TO mysqltest_u1;
GRANT UPDATE ON mysqltest_db1.t4 TO mysqltest_u1;
INSERT INTO t1 VALUES('line1');
SELECT * FROM t1;
col
line1
SELECT test_var;
test_var
line1
INSERT INTO t2 VALUES('line2');
SELECT * FROM t2;
col
t2_trg_before_insert
INSERT INTO t3 VALUES('t3_line1');
SELECT * FROM t3;
col
t3_line1
SELECT test_var;
test_var
t3_line1
INSERT INTO t4 VALUES('t4_line2');
SELECT * FROM t4;
col
t4_trg_before_insert

---> connection: default
use mysqltest_db1;
REVOKE UPDATE ON mysqltest_db1.t1 FROM mysqltest_u1;
REVOKE UPDATE ON mysqltest_db1.t2 FROM mysqltest_u1;
GRANT SELECT ON mysqltest_db1.t1 TO mysqltest_u1;
GRANT SELECT ON mysqltest_db1.t2 TO mysqltest_u1;
REVOKE UPDATE ON mysqltest_db1.t3 FROM mysqltest_u1;
REVOKE UPDATE ON mysqltest_db1.t4 FROM mysqltest_u1;
GRANT SELECT ON mysqltest_db1.t3 TO mysqltest_u1;
GRANT SELECT ON mysqltest_db1.t4 TO mysqltest_u1;
INSERT INTO t1 VALUES('line3');
SELECT * FROM t1;
col
line1
line3
SELECT test_var;
test_var
line3
INSERT INTO t2 VALUES('line4');
SELECT * FROM t2;
col
t2_trg_before_insert
t2_trg_before_insert
INSERT INTO t3 VALUES('t3_line2');
SELECT * FROM t3;
col
t3_line1
t3_line2
SELECT test_var;
test_var
t3_line2
INSERT INTO t4 VALUES('t4_line2');
SELECT * FROM t4;
col
t4_trg_before_insert
t4_trg_before_insert
DELETE FROM t1;
SELECT test_var;
test_var
Hello, world!
DROP USER mysqltest_u1;
DROP DATABASE mysqltest_db1;
drop user mysqltest_dfn;
drop user mysqltest_inv;
FLUSH PRIVILEGES;
Warnings:
Warning	1235	After executing the GRANT and REVOKE statements, the permissions will be automatically applied and take effect. There is no need to execute the FLUSH PRIVILEGES command. FLUSH PRIVILEGES not supported
DROP DATABASE IF EXISTS mysqltest_db1;
CREATE DATABASE mysqltest_db1;
USE mysqltest_db1;
CREATE TABLE t1 (i1 INT);
CREATE TABLE t2 (i1 INT);
CREATE USER mysqltest_dfn;
CREATE USER mysqltest_inv;
GRANT EXECUTE, CREATE ROUTINE ON *.* TO mysqltest_dfn;
GRANT CREATE, TRIGGER ON *.* TO mysqltest_dfn;
GRANT INSERT ON mysqltest_db1.* TO mysqltest_inv;
CREATE PROCEDURE p1(OUT i INT) DETERMINISTIC NO SQL SET i = 3;
CREATE PROCEDURE p2(INOUT i INT) DETERMINISTIC NO SQL SET i = i * 5;
CREATE TRIGGER t1_bi BEFORE INSERT ON t1 FOR EACH ROW
CALL p1(NEW.i1);
CREATE TRIGGER t2_bi BEFORE INSERT ON t2 FOR EACH ROW
CALL p2(NEW.i1);
INSERT INTO t1 VALUES (7);
INSERT INTO t2 VALUES (11);
DROP TRIGGER t2_bi;
DROP TRIGGER t1_bi;
GRANT SELECT ON mysqltest_db1.* TO mysqltest_dfn;
CREATE TRIGGER t1_bi BEFORE INSERT ON t1 FOR EACH ROW
CALL p1(NEW.i1);
CREATE TRIGGER t2_bi BEFORE INSERT ON t2 FOR EACH ROW
CALL p2(NEW.i1);
INSERT INTO t1 VALUES (13);
INSERT INTO t2 VALUES (17);
REVOKE SELECT ON mysqltest_db1.* FROM mysqltest_dfn;
DROP TRIGGER t2_bi;
DROP TRIGGER t1_bi;
GRANT UPDATE ON mysqltest_db1.* TO mysqltest_dfn;
CREATE TRIGGER t1_bi BEFORE INSERT ON t1 FOR EACH ROW
CALL p1(NEW.i1);
CREATE TRIGGER t2_bi BEFORE INSERT ON t2 FOR EACH ROW
CALL p2(NEW.i1);
INSERT INTO t1 VALUES (19);
INSERT INTO t2 VALUES (23);
REVOKE UPDATE ON mysqltest_db1.* FROM mysqltest_dfn;
DROP TRIGGER t2_bi;
DROP TRIGGER t1_bi;
GRANT SELECT, UPDATE ON mysqltest_db1.* TO mysqltest_dfn;
CREATE TRIGGER t1_bi BEFORE INSERT ON t1 FOR EACH ROW
CALL p1(NEW.i1);
CREATE TRIGGER t2_bi BEFORE INSERT ON t2 FOR EACH ROW
CALL p2(NEW.i1);
INSERT INTO t1 VALUES (29);
INSERT INTO t2 VALUES (31);
REVOKE SELECT, UPDATE ON mysqltest_db1.* FROM mysqltest_dfn;
DROP TRIGGER t2_bi;
DROP TRIGGER t1_bi;
DROP PROCEDURE p2;
DROP PROCEDURE p1;
GRANT UPDATE ON mysqltest_db1.* TO mysqltest_dfn;
CREATE PROCEDURE p1(OUT i INT) DETERMINISTIC NO SQL SET i = 37;
CREATE TRIGGER t1_bi BEFORE INSERT ON t1 FOR EACH ROW
CALL p1(NEW.i1);
INSERT INTO t1 VALUES (41);
DROP PROCEDURE p1;
CREATE PROCEDURE p1(IN i INT) DETERMINISTIC NO SQL SET @v1 = i + 43;
INSERT INTO t1 VALUES (47);
DROP PROCEDURE p1;
CREATE PROCEDURE p1(INOUT i INT) DETERMINISTIC NO SQL SET i = i + 51;
INSERT INTO t1 VALUES (53);
DROP PROCEDURE p1;
REVOKE UPDATE ON mysqltest_db1.* FROM mysqltest_dfn;
DROP TRIGGER t1_bi;
DROP USER mysqltest_inv;
DROP USER mysqltest_dfn;
DROP TABLE t2;
DROP TABLE t1;
DROP DATABASE mysqltest_db1;
USE test;
End of 5.0 tests.
drop table if exists t1;
create table t1 (i int);
connection: default
lock tables t1 write;
connection: flush
flush tables with read lock;;
connection: default
Timeout in wait_condition.inc for select count(*) = 1 from information_schema.processlist
where state = "Waiting for global read lock"
create trigger t1_bi before insert on t1 for each row begin end;
unlock tables;
connection: flush
ERROR 42000: You have an error in your SQL syntax; check the manual that corresponds to your OceanBase version for the right syntax to use near 'tables with read lock;' at line 1
unlock tables;
select * from t1;
i
drop table t1;
DROP DATABASE db1;
CREATE DATABASE db1;
CREATE TABLE db1.t1 (a char(30)) ENGINE=MEMORY;
Warnings:
Warning	1286	Unknown storage engine 'MEMORY'
CREATE TRIGGER db1.trg AFTER INSERT ON db1.t1 FOR EACH ROW
INSERT INTO db1.t1 VALUES('Some very sensitive data goes here');
drop user no_rights;
CREATE USER 'no_rights';
REVOKE ALL ON *.* FROM 'no_rights';
FLUSH PRIVILEGES;
Warnings:
Warning	1235	After executing the GRANT and REVOKE statements, the permissions will be automatically applied and take effect. There is no need to execute the FLUSH PRIVILEGES command. FLUSH PRIVILEGES not supported
SELECT trigger_name FROM INFORMATION_SCHEMA.TRIGGERS
WHERE trigger_schema = 'db1';
trigger_name
SHOW CREATE TRIGGER db1.trg;
ERROR 42501: Access denied; you need (at least one of) the TRIGGER privilege(s) for this operation
DROP USER 'no_rights';
DROP DATABASE db1;
DROP DATABASE IF EXISTS mysqltest_db1;
CREATE DATABASE mysqltest_db1;
USE mysqltest_db1;
set @orig_sql_mode= @@sql_mode;
set sql_mode= (select replace(@@sql_mode,'NO_AUTO_CREATE_USER',''));
set @sql_test_mode=replace(@@sql_mode,'NO_AUTO_CREATE_USER','');
set sql_mode= @sql_test_mode;
GRANT ALL ON mysqltest_db1.* TO mysqltest_u1;
set sql_mode= @orig_sql_mode;
CREATE TABLE t1 (
a1 int,
a2 int
);
INSERT INTO t1 VALUES (1, 20);
CREATE TRIGGER mysqltest_db1.upd_t1
BEFORE UPDATE ON t1 FOR EACH ROW SET new.a2 = 200;
CREATE TABLE t2 (
a1 int
);
INSERT INTO t2 VALUES (2);
REVOKE ALL PRIVILEGES, GRANT OPTION FROM mysqltest_u1;
UPDATE IGNORE t1, t2 SET t1.a1 = 2, t2.a1 = 3 WHERE t1.a1 = 1 AND t2.a1 = 2;
ERROR 42000: TRIGGER command denied to user 'mysqltest_u1'@'%' for table 't1'
DROP DATABASE mysqltest_db1;
DROP USER mysqltest_u1;
USE test;
End of 5.1 tests.
#
# WL#2284: Increase the length of a user name
#
CREATE DATABASE test1;
CREATE TABLE test1.t1 (
int_field INTEGER UNSIGNED NOT NULL,
char_field CHAR(10),
INDEX(`int_field`)
);
use test;
CREATE USER user_name_len_22_01234;
CREATE USER user_name_len_32_012345678901234;
REVOKE ALL PRIVILEGES, GRANT OPTION FROM user_name_len_22_01234;
REVOKE ALL PRIVILEGES, GRANT OPTION FROM user_name_len_32_012345678901234;
# Check that user_name_len_22_01234 has no SELECT permission ON t1
SELECT * FROM test1.t1;
ERROR 42000: SELECT command denied to user 'user_name_len_22_01234'@'%' for table 't1'
# Check that user_name_len_32_012345678901234 has no SELECT permission ON t1
SELECT * FROM test1.t1;
ERROR 42000: SELECT command denied to user 'user_name_len_32_012345678901234'@'%' for table 't1'
GRANT ALL ON test1.* TO user_name_len_32_012345678901234;
CREATE DEFINER=user_name_len_32_012345678901234
TRIGGER test1.t1_ai AFTER INSERT ON test1.t1 FOR EACH ROW SET @a = (SELECT COUNT(*) FROM test1.t1);
GRANT INSERT ON test1.t1 TO user_name_len_22_01234;
# Now user_name_len_22_01234 should be able to "SELECT" COUNT(*) FROM
# test1.t1 by using the trigger
set @a:=0;
INSERT INTO test1.t1 VALUES (1,'haha');
SELECT @a;
@a
1
CREATE DEFINER=user_name_len_33_0123456789012345
TRIGGER test1.t1_bi BEFORE INSERT ON test1.t1 FOR EACH ROW SET @a = (SELECT COUNT(*) FROM test1.t1);
Warnings:
Warning	1449	User user_name_len_33_0123456789012345 not exist
DROP DATABASE test1;
DROP USER user_name_len_22_01234;
DROP USER user_name_len_32_012345678901234;
