drop tenant if exists ora_tt force;
drop resource pool if exists pool1;
drop resource unit if exists box1;
create resource unit box1 max_cpu 1, max_memory 1073741824, max_iops 100000, max_disk_size 536870912, max_session_num 64, MIN_CPU=1, MIN_MEMORY=1073741824, MIN_IOPS=128;
drop database if exists ctetest;
create database ctetest;
use ctetest;
create table EMP (
EMPno  number,
ENAME varchar(30),
JOB varchar(30),
MGR number(4),
HIREDATE date,
SAL number(7,2),
COMM number(7,2),
DEPTNO number(2)
) ;
create table DEPT(
DEPTNO number(2),
DNAME char(45),
LOC varchar(39)
) ;
insert into EMP values (7369,'SMITH','CLERK',7902,    str_to_date('17-DEC-80','%d-%b-%Y'),800,NULL, 20) ;
INSERT INTO EMP VALUES (7499, 'ALLEN','SALESMAN',7698,str_to_date('20-FEB-81','%d-%b-%Y'),1600,300,30) ;
INSERT INTO EMP VALUES (7521,'WARD','SALESMAN',7698,  str_to_date('22-FEB-81','%d-%b-%Y'),1250, 500, 30) ;
INSERT INTO EMP VALUES (7566,'JONES','MANAGER',7839,  str_to_date('02-APR-81','%d-%b-%Y'), 2975, NULL, 20) ;
INSERT INTO EMP VALUES (7654,'MARTIN','SALESMAN', 7698, str_to_date('28-SEP-81','%d-%b-%Y'), 1250, 1400, 30) ;
INSERT INTO EMP VALUES (7698, 'BLAKE','MANAGER', 7839,  str_to_date('01-MAY-81','%d-%b-%Y'), 2850, NULL, 30) ;
INSERT INTO EMP VALUES (7782, 'CLARK','MANAGER', 7839,  str_to_date('09-JUN-81','%d-%b-%Y'), 2450, NULL, 10) ;
insert into EMP values (7788,'SCOTT','ANALYST', 7566,   str_to_date('19-APR-87','%d-%b-%Y'), 3000, null, 20) ;
INSERT INTO EMP VALUES (7839, 'KING','PRESIDENT', NULL, str_to_date('17-NOV-81','%d-%b-%Y'), 5000, NULL, 10) ;
INSERT INTO EMP VALUES (7844, 'TURNER','SALESMAN', 7698, str_to_date('08-SEP-81','%d-%b-%Y'), 1500, 0, 30) ;
INSERT INTO EMP VALUES(7876, 'ADAMS','CLERK', 7788,     str_to_date('23-MAY-87','%d-%b-%Y'), 1100, NULL, 20) ;
INSERT INTO EMP VALUES(7900, 'JAMES', 'CLEARK', 7698,   str_to_date('03-DEC-81','%d-%b-%Y'), 950, NULL, 30) ;
INSERT INTO EMP VALUES(7902, 'FORD','ANALYST',7566,     str_to_date('03-DEC-81','%d-%b-%Y'), 3000, NULL, 20) ;
INSERT INTO EMP VALUES(7934,'MILLER','CLERK', 7782,     str_to_date('23-JAN-82','%d-%b-%Y'), 1300,NULL, 10) ;
CREATE TABLE emp1 (
empno    VARCHAR(32000) NOT NULL,
ename    VARCHAR(14),
job      VARCHAR(9),
mgr      VARCHAR(32000),
hiredate DATE,
sal      NUMBER(7,2),
comm     NUMBER(7,2),
deptno   NUMBER(2));
CREATE TABLE emp2 (
empno    VARCHAR(4000) NOT NULL,
ename    VARCHAR(14),
job      VARCHAR(9),
mgr      VARCHAR(4000),
hiredate DATE,
sal      NUMBER(7,2),
comm     NUMBER(7,2),
deptno   NUMBER(2));
INSERT INTO emp1 values (7369, 'SMITH', 'CLERK', 7902, str_to_date('17-DEC-80', '%d-%b-%Y'), 800, null, 20);
INSERT INTO emp1 values (7499, 'ALLEN', 'SALESMAN', 7698, str_to_date('20-FEB-81', '%d-%b-%Y'), 1600, 300, 30);
INSERT INTO emp1 values (7521, 'WARD', 'SALESMAN', 7698, str_to_date('22-FEB-81', '%d-%b-%Y'), 1250, 500, 30);
INSERT INTO emp1 values (7566, 'JONES', 'MANAGER', 7839, str_to_date('02-APR-81', '%d-%b-%Y'), 2975, null, 20);
INSERT INTO emp1 values (7654, 'MARTIN', 'SALESMAN', 7698, str_to_date('28-SEP-81', '%d-%b-%Y'), 1250, 1400, 30);
INSERT INTO emp1 values (7698, 'BLAKE', 'MANAGER', 7839, str_to_date('01-MAY-81', '%d-%b-%Y'), 2850, null, 30);
INSERT INTO emp1 values (7782, 'CLARK', 'MANAGER', 7839, str_to_date('09-JUN-81' , '%d-%b-%Y'), 2450, null, 10);
INSERT INTO emp1 values (7788, 'SCOTT', 'ANALYST', 7566, str_to_date('19-APR-87', '%d-%b-%Y'), 3000, null, 20);
INSERT INTO emp1 values (7839, 'KING', 'PRESIDENT', null, str_to_date('17-NOV-81', '%d-%b-%Y'), 5000, null, 10);
INSERT INTO emp1 values (7844, 'TURNER', 'SALESMAN', 7698, str_to_date('08-SEP-81', '%d-%b-%Y'), 1500, 0, 30);
INSERT INTO emp1 values (7876, 'ADAMS', 'CLERK', 7788, str_to_date('23-MAY-87', '%d-%b-%Y'), 1100, null, 20);
INSERT INTO emp1 values (7900, 'JAMES', 'CLERK', 7698, str_to_date('03-DEC-81', '%d-%b-%Y'), 950, null, 30);
INSERT INTO emp1 values (7902, 'FORD', 'ANALYST', 7566, str_to_date('03-DEC-81', '%d-%b-%Y'), 3000, null, 20);
INSERT INTO emp1 values (7934, 'MILLER', 'CLERK', 7782, str_to_date('23-JAN-82', '%d-%b-%Y'), 1300, null, 10);
INSERT INTO emp1 values (concat('8100',4000,'5'), 'Eve', 'MANAGER', 7839, str_to_date('01-MAY-84', '%d-%b-%Y'), 2850, null, 30);
INSERT INTO emp1 values (concat('8101',30000,'5'), 'Eve1', 'MANAGER', concat('8100',4000,'5'), str_to_date('01-MAY-84', '%d-%b-%Y'), 2850, null, 30);
INSERT INTO emp1 values (concat('8102',30000,'5'), 'Eve2', 'MANAGER', concat('8101',30000,'5'), str_to_date('01-MAY-84', '%d-%b-%Y'), 2850, null, 30);
INSERT INTO emp1 values (concat('8103',30000,'5'), 'Eve3', 'MANAGER', concat('8102',30000,'5'), str_to_date('01-MAY-84', '%d-%b-%Y'), 2850, null, 30);
INSERT INTO emp1 values (concat('8104',30000,'5'), 'Eve4', 'MANAGER', concat('8103',30000,'5'), str_to_date('01-MAY-84', '%d-%b-%Y'), 2850, null, 30);
INSERT INTO emp1 values (concat('8105',30000,'5'), 'Eve5', 'MANAGER', concat('8104',30000,'5'), str_to_date('01-MAY-84', '%d-%b-%Y'), 2850, null, 30);
INSERT INTO emp1 values (concat('8106',30000,'5'), 'Eve6', 'MANAGER', concat('8105',30000,'5'), str_to_date('01-MAY-84', '%d-%b-%Y'), 2850, null, 30);
INSERT INTO emp1 values (concat('8107',4000,'5'), 'Eve7', 'MANAGER', concat('8106',30000,'5'), str_to_date('01-MAY-84', '%d-%b-%Y'), 2850, null, 30);
INSERT INTO emp1 values (concat('8108',4000,'5'), 'Eve8', 'MANAGER', concat('8107',4000,'5'), str_to_date('01-MAY-84', '%d-%b-%Y'), 2850, null, 30);
INSERT INTO emp1 values (concat('8109',4000,'5'), 'Eve9', 'MANAGER', concat('8108',4000,'5'), str_to_date('01-MAY-84', '%d-%b-%Y'), 2850, null, 30);
INSERT INTO emp1 values (concat('8110',4000,'5'), 'Eve10', 'MANAGER', concat('8109',4000,'5'), str_to_date('01-MAY-84', '%d-%b-%Y'), 2850, null, 30);
INSERT INTO emp1 values (concat('8111',4000,'5'), 'Eve11', 'MANAGER', concat('8110',4000,'5'), str_to_date('01-MAY-84', '%d-%b-%Y'), 2850, null, 30);
INSERT INTO emp1 values (concat('8112',4000,'5'), 'Eve12', 'MANAGER', concat('8111',4000,'5'), str_to_date('01-MAY-84', '%d-%b-%Y'), 2850, null, 30);
INSERT INTO emp1 values (concat('8113',4000,'5'), 'Eve13', 'MANAGER', concat('8112',4000,'5'), str_to_date('01-MAY-84', '%d-%b-%Y'), 2850, null, 30);
INSERT INTO emp1 values (concat('8114',4000,'5'), 'Eve14', 'MANAGER', concat('8113',4000,'5'), str_to_date('01-MAY-84', '%d-%b-%Y'), 2850, null, 30);
INSERT INTO emp1 values (concat('8115',4000,'5'), 'Eve15', 'MANAGER', concat('8114',4000,'5'), str_to_date('01-MAY-84', '%d-%b-%Y'), 2850, null, 30);
INSERT INTO emp1 values (concat('8116',4000,'5'), 'Eve16', 'MANAGER', concat('8115',4000,'5'), str_to_date('01-MAY-84', '%d-%b-%Y'), 2850, null, 30);
INSERT INTO emp1 values (concat('8117',4000,'5'), 'Eve17', 'MANAGER', concat('8116',4000,'5'), str_to_date('01-MAY-84', '%d-%b-%Y'), 2850, null, 30);
INSERT INTO emp1 values (concat('8118',4000,'5'), 'Eve18', 'MANAGER', concat('8117',4000,'5'), str_to_date('01-MAY-84', '%d-%b-%Y'), 2850, null, 30);
INSERT INTO emp1 values (concat('8119',4000,'5'), 'Eve19', 'CLERK', concat('8118',4000,'5'), str_to_date('01-MAY-84', '%d-%b-%Y'), 2850, null, 30);
INSERT INTO emp2 values (4002, 'SMITH', 'CLERK', 5002, str_to_date('17-DEC-80', '%d-%b-%Y'), 800, null, 20);
INSERT INTO emp2 values (5003, 'ALLEN', 'SALESMAN', 6002, str_to_date('20-FEB-81', '%d-%b-%Y'), 1600, 300, 30);
INSERT INTO emp2 values (5004, 'WARD', 'SALESMAN', 6002, str_to_date('22-FEB-81', '%d-%b-%Y'), 1250, 500, 30);
INSERT INTO emp2 values (6001, 'JONES', 'MANAGER', 7839, str_to_date('02-APR-81', '%d-%b-%Y'), 2975, null, 20);
INSERT INTO emp2 values (5005, 'MARTIN', 'SALESMAN', 6002, str_to_date('28-SEP-81', '%d-%b-%Y'), 1250, 1400, 30);
INSERT INTO emp2 values (6002, 'BLAKE', 'MANAGER', 7839, str_to_date('01-MAY-81', '%d-%b-%Y'), 2850, null, 30);
INSERT INTO emp2 values (6003, 'CLARK', 'MANAGER', 7839, str_to_date('09-JUN-81' , '%d-%b-%Y'), 2450, null, 10);
INSERT INTO emp2 values (5001, 'SCOTT', 'ANALYST', 6001, str_to_date('19-APR-87', '%d-%b-%Y'), 3000, null, 20);
INSERT INTO emp2 values (7839, 'KING', 'PRESIDENT', null, str_to_date('17-NOV-81', '%d-%b-%Y'), 5000, null, 10);
INSERT INTO emp2 values (5006, 'TURNER', 'SALESMAN', 6002, str_to_date('08-SEP-81', '%d-%b-%Y'), 1500, 0, 30);
INSERT INTO emp2 values (4001, 'ADAMS', 'CLERK', 5001, str_to_date('23-MAY-87', '%d-%b-%Y'), 1100, null, 20);
INSERT INTO emp2 values (5007, 'JAMES', 'CLERK', 6002, str_to_date('03-DEC-81', '%d-%b-%Y'), 950, null, 30);
INSERT INTO emp2 values (5002, 'FORD', 'ANALYST', 6001, str_to_date('03-DEC-81', '%d-%b-%Y'), 3000, null, 20);
INSERT INTO emp2 values (5008, 'MILLER', 'CLERK', 6003, str_to_date('23-JAN-82', '%d-%b-%Y'), 1300, null, 10);
result_format: 4
## =======================================================================
## Test Case 1:
## - recursive WITH Query: no cycle clause used in query in acyclic data
## =======================================================================
explain basic 
WITH rw (ename, mgr, empno) AS
(
    SELECT ename, mgr, empno
    FROM emp e
    WHERE job = 'PRESIDENT'
    UNION ALL
    SELECT e.ename, e.mgr, e.empno
    FROM rw r, emp e
    WHERE r.empno = e.mgr
)
SELECT ename, empno, mgr
FROM rw;
Query Plan
==============================
|ID|OPERATOR            |NAME|
------------------------------
|0 |SUBPLAN SCAN        |rw  |
|1 | RECURSIVE UNION ALL|    |
|2 |  TABLE SCAN        |e   |
|3 |  HASH JOIN         |    |
|4 |   TABLE SCAN       |e   |
|5 |   TABLE SCAN       |r   |
==============================

Outputs & filters: 
-------------------------------------
  0 - output([rw.ename], [rw.empno], [rw.mgr]), filter(nil), 
      access([rw.ename], [rw.empno], [rw.mgr])
  1 - output([UNION(e.ENAME, e.ENAME)], [UNION(e.MGR, e.MGR)], [UNION(e.EMPno, e.EMPno)]), filter(nil)
  2 - output([e.ENAME], [e.MGR], [e.EMPno]), filter([e.JOB = 'PRESIDENT']), 
      access([e.JOB], [e.ENAME], [e.MGR], [e.EMPno]), partitions(p0)
  3 - output([e.ENAME], [e.MGR], [e.EMPno]), filter(nil), 
      equal_conds([r.empno = e.MGR]), other_conds(nil)
  4 - output([e.MGR], [e.ENAME], [e.EMPno]), filter(nil), 
      access([e.MGR], [e.ENAME], [e.EMPno]), partitions(p0)
  5 - output([r.empno]), filter(nil), 
      access([r.empno]), partitions(nil)


WITH rw (ename, mgr, empno) AS
(
    SELECT ename, mgr, empno
    FROM emp e
    WHERE job = 'PRESIDENT'
    UNION ALL
    SELECT e.ename, e.mgr, e.empno
    FROM rw r, emp e
    WHERE r.empno = e.mgr
)
SELECT ename, empno, mgr
FROM rw;
+--------+-------+------+
| ename  | empno | mgr  |
+--------+-------+------+
| KING   |  7839 | NULL |
| CLARK  |  7782 | 7839 |
| BLAKE  |  7698 | 7839 |
| JONES  |  7566 | 7839 |
| MILLER |  7934 | 7782 |
| JAMES  |  7900 | 7698 |
| TURNER |  7844 | 7698 |
| MARTIN |  7654 | 7698 |
| WARD   |  7521 | 7698 |
| ALLEN  |  7499 | 7698 |
| FORD   |  7902 | 7566 |
| SCOTT  |  7788 | 7566 |
| SMITH  |  7369 | 7902 |
| ADAMS  |  7876 | 7788 |
+--------+-------+------+

## =======================================================================
## Test Case 2:
## - recursive WITH Query: cycle clause used in query with cycle key column
## =======================================================================
/* add loop from scott back to king  in emp */
update emp set mgr = 7788 where ename = 'KING';

explain basic 
WITH rw (ename, mgr, empno) AS
(
    SELECT ename, mgr, empno
    FROM emp e
    WHERE job = 'PRESIDENT'
    UNION ALL
    SELECT e.ename, e.mgr, e.empno
    FROM rw r, emp e
    WHERE r.empno = e.mgr
)
CYCLE empno set iscycle TO 'Y' DEFAULT 'N'
SELECT ename, empno, mgr , iscycle
FROM rw;
Query Plan
==============================
|ID|OPERATOR            |NAME|
------------------------------
|0 |SUBPLAN SCAN        |rw  |
|1 | RECURSIVE UNION ALL|    |
|2 |  TABLE SCAN        |e   |
|3 |  HASH JOIN         |    |
|4 |   TABLE SCAN       |e   |
|5 |   TABLE SCAN       |r   |
==============================

Outputs & filters: 
-------------------------------------
  0 - output([rw.ename], [rw.empno], [rw.mgr], [rw.iscycle]), filter(nil), 
      access([rw.ename], [rw.empno], [rw.mgr], [rw.iscycle])
  1 - output([UNION(e.ENAME, e.ENAME)], [UNION(e.MGR, e.MGR)], [UNION(e.EMPno, e.EMPno)], [T_CTE_CYCLE_COLUMN]), filter(nil)
  2 - output([e.ENAME], [e.MGR], [e.EMPno]), filter([e.JOB = 'PRESIDENT']), 
      access([e.JOB], [e.ENAME], [e.MGR], [e.EMPno]), partitions(p0)
  3 - output([e.ENAME], [e.MGR], [e.EMPno]), filter(nil), 
      equal_conds([r.empno = e.MGR]), other_conds(nil)
  4 - output([e.MGR], [e.ENAME], [e.EMPno]), filter(nil), 
      access([e.MGR], [e.ENAME], [e.EMPno]), partitions(p0)
  5 - output([r.empno]), filter(nil), 
      access([r.empno]), partitions(nil)


WITH rw (ename, mgr, empno) AS
(
    SELECT ename, mgr, empno
    FROM emp e
    WHERE job = 'PRESIDENT'
    UNION ALL
    SELECT e.ename, e.mgr, e.empno
    FROM rw r, emp e
    WHERE r.empno = e.mgr
)
CYCLE empno set iscycle TO 'Y' DEFAULT 'N'
SELECT ename, empno, mgr , iscycle
FROM rw;
+--------+-------+------+---------+
| ename  | empno | mgr  | iscycle |
+--------+-------+------+---------+
| KING   |  7839 | 7788 | N       |
| CLARK  |  7782 | 7839 | N       |
| BLAKE  |  7698 | 7839 | N       |
| JONES  |  7566 | 7839 | N       |
| MILLER |  7934 | 7782 | N       |
| JAMES  |  7900 | 7698 | N       |
| TURNER |  7844 | 7698 | N       |
| MARTIN |  7654 | 7698 | N       |
| WARD   |  7521 | 7698 | N       |
| ALLEN  |  7499 | 7698 | N       |
| FORD   |  7902 | 7566 | N       |
| SCOTT  |  7788 | 7566 | N       |
| SMITH  |  7369 | 7902 | N       |
| ADAMS  |  7876 | 7788 | N       |
| KING   |  7839 | 7788 | Y       |
+--------+-------+------+---------+

## =======================================================================
## Test Case 3:
## - recursive WITH Query: cycle clause used in query with two cycle key column
## =======================================================================
explain basic
WITH rw (mgr, empno, iters, sal) AS
(
    SELECT mgr, empno, 1 iters, sal
    FROM emp
    WHERE job = 'PRESIDENT'
    UNION ALL
    SELECT t.mgr, t.empno, r.iters + 1 iters, (r.sal + t.sal) sal
    FROM rw r, emp t
    WHERE r.empno = t.mgr 
)
cycle empno,mgr set iscycle to 'y' default 'n'
SELECT *
FROM rw;
Query Plan
=============================
|ID|OPERATOR           |NAME|
-----------------------------
|0 |RECURSIVE UNION ALL|    |
|1 | TABLE SCAN        |emp |
|2 | HASH JOIN         |    |
|3 |  TABLE SCAN       |t   |
|4 |  TABLE SCAN       |r   |
=============================

Outputs & filters: 
-------------------------------------
  0 - output([UNION(emp.MGR, t.MGR)], [UNION(emp.EMPno, t.EMPno)], [UNION(cast(?, BIGINT(20, 0)), cast(r.iters + 1, BIGINT(20, 0)))], [UNION(cast(emp.SAL, DECIMAL(8, 2)), r.sal + t.SAL)], [T_CTE_CYCLE_COLUMN]), filter(nil)
  1 - output([emp.MGR], [emp.EMPno], [cast(?, BIGINT(20, 0))], [cast(emp.SAL, DECIMAL(8, 2))]), filter([emp.JOB = 'PRESIDENT']), 
      access([emp.JOB], [emp.MGR], [emp.EMPno], [emp.SAL]), partitions(p0)
  2 - output([t.MGR], [t.EMPno], [cast(r.iters + 1, BIGINT(20, 0))], [r.sal + t.SAL]), filter(nil), 
      equal_conds([r.empno = t.MGR]), other_conds(nil)
  3 - output([t.MGR], [t.EMPno], [t.SAL]), filter(nil), 
      access([t.MGR], [t.EMPno], [t.SAL]), partitions(p0)
  4 - output([r.empno], [r.sal], [cast(r.iters + 1, BIGINT(20, 0))]), filter(nil), 
      access([r.empno], [r.iters], [r.sal]), partitions(nil)


WITH rw (mgr, empno, iters, sal) AS
(
    SELECT mgr, empno, 1 iters, sal
    FROM emp
    WHERE job = 'PRESIDENT'
    UNION ALL
    SELECT t.mgr, t.empno, r.iters + 1 iters, (r.sal + t.sal) sal
    FROM rw r, emp t
    WHERE r.empno = t.mgr 
)
cycle empno,mgr set iscycle to 'y' default 'n'
SELECT *
FROM rw;
+------+-------+-------+----------+---------+
| mgr  | empno | iters | sal      | iscycle |
+------+-------+-------+----------+---------+
| 7788 |  7839 |     1 |  5000.00 | n       |
| 7839 |  7782 |     2 |  7450.00 | n       |
| 7839 |  7698 |     2 |  7850.00 | n       |
| 7839 |  7566 |     2 |  7975.00 | n       |
| 7782 |  7934 |     3 |  8750.00 | n       |
| 7698 |  7900 |     3 |  8800.00 | n       |
| 7698 |  7844 |     3 |  9350.00 | n       |
| 7698 |  7654 |     3 |  9100.00 | n       |
| 7698 |  7521 |     3 |  9100.00 | n       |
| 7698 |  7499 |     3 |  9450.00 | n       |
| 7566 |  7902 |     3 | 10975.00 | n       |
| 7566 |  7788 |     3 | 10975.00 | n       |
| 7902 |  7369 |     4 | 11775.00 | n       |
| 7788 |  7876 |     4 | 12075.00 | n       |
| 7788 |  7839 |     4 | 15975.00 | y       |
+------+-------+-------+----------+---------+

drop table emp1;
drop table emp2;

CREATE TABLE emp1 (
   empno    VARCHAR(32000) NOT NULL,
   ename    VARCHAR(14),
   job      VARCHAR(9),
   mgr      VARCHAR(32000),
   hiredate DATE,
   sal      NUMBER(7,2),
   comm     NUMBER(7,2),
   deptno   NUMBER(2));

CREATE TABLE emp2 (
   empno    VARCHAR(4000) NOT NULL,
   ename    VARCHAR(14),
   job      VARCHAR(9),
   mgr      VARCHAR(4000),
   hiredate DATE,
   sal      NUMBER(7,2),
   comm     NUMBER(7,2),
   deptno   NUMBER(2));

INSERT INTO emp1 values (7369, 'SMITH', 'CLERK', 7902, str_to_date('17-DEC-80', '%d-%b-%Y'), 800, null, 20);
INSERT INTO emp1 values (7499, 'ALLEN', 'SALESMAN', 7698, str_to_date('20-FEB-81', '%d-%b-%Y'), 1600, 300, 30);
INSERT INTO emp1 values (7521, 'WARD', 'SALESMAN', 7698, str_to_date('22-FEB-81', '%d-%b-%Y'), 1250, 500, 30);
INSERT INTO emp1 values (7566, 'JONES', 'MANAGER', 7839, str_to_date('02-APR-81', '%d-%b-%Y'), 2975, null, 20);
INSERT INTO emp1 values (7654, 'MARTIN', 'SALESMAN', 7698, str_to_date('28-SEP-81', '%d-%b-%Y'), 1250, 1400, 30);
INSERT INTO emp1 values (7698, 'BLAKE', 'MANAGER', 7839, str_to_date('01-MAY-81', '%d-%b-%Y'), 2850, null, 30);
INSERT INTO emp1 values (7782, 'CLARK', 'MANAGER', 7839, str_to_date('09-JUN-81' , '%d-%b-%Y'), 2450, null, 10);
INSERT INTO emp1 values (7788, 'SCOTT', 'ANALYST', 7566, str_to_date('19-APR-87', '%d-%b-%Y'), 3000, null, 20);
INSERT INTO emp1 values (7839, 'KING', 'PRESIDENT', null, str_to_date('17-NOV-81', '%d-%b-%Y'), 5000, null, 10);
INSERT INTO emp1 values (7844, 'TURNER', 'SALESMAN', 7698, str_to_date('08-SEP-81', '%d-%b-%Y'), 1500, 0, 30);
INSERT INTO emp1 values (7876, 'ADAMS', 'CLERK', 7788, str_to_date('23-MAY-87', '%d-%b-%Y'), 1100, null, 20);
INSERT INTO emp1 values (7900, 'JAMES', 'CLERK', 7698, str_to_date('03-DEC-81', '%d-%b-%Y'), 950, null, 30);
INSERT INTO emp1 values (7902, 'FORD', 'ANALYST', 7566, str_to_date('03-DEC-81', '%d-%b-%Y'), 3000, null, 20);
INSERT INTO emp1 values (7934, 'MILLER', 'CLERK', 7782, str_to_date('23-JAN-82', '%d-%b-%Y'), 1300, null, 10);
INSERT INTO emp1 values (concat('8100',4000,'5'), 'Eve', 'MANAGER', 7839, str_to_date('01-MAY-84', '%d-%b-%Y'), 2850, null, 30);
INSERT INTO emp1 values (concat('8101',30000,'5'), 'Eve1', 'MANAGER', concat('8100',4000,'5'), str_to_date('01-MAY-84', '%d-%b-%Y'), 2850, null, 30);
INSERT INTO emp1 values (concat('8102',30000,'5'), 'Eve2', 'MANAGER', concat('8101',30000,'5'), str_to_date('01-MAY-84', '%d-%b-%Y'), 2850, null, 30);
INSERT INTO emp1 values (concat('8103',30000,'5'), 'Eve3', 'MANAGER', concat('8102',30000,'5'), str_to_date('01-MAY-84', '%d-%b-%Y'), 2850, null, 30);
INSERT INTO emp1 values (concat('8104',30000,'5'), 'Eve4', 'MANAGER', concat('8103',30000,'5'), str_to_date('01-MAY-84', '%d-%b-%Y'), 2850, null, 30);
INSERT INTO emp1 values (concat('8105',30000,'5'), 'Eve5', 'MANAGER', concat('8104',30000,'5'), str_to_date('01-MAY-84', '%d-%b-%Y'), 2850, null, 30);
INSERT INTO emp1 values (concat('8106',30000,'5'), 'Eve6', 'MANAGER', concat('8105',30000,'5'), str_to_date('01-MAY-84', '%d-%b-%Y'), 2850, null, 30);
INSERT INTO emp1 values (concat('8107',4000,'5'), 'Eve7', 'MANAGER', concat('8106',30000,'5'), str_to_date('01-MAY-84', '%d-%b-%Y'), 2850, null, 30);
INSERT INTO emp1 values (concat('8108',4000,'5'), 'Eve8', 'MANAGER', concat('8107',4000,'5'), str_to_date('01-MAY-84', '%d-%b-%Y'), 2850, null, 30);
INSERT INTO emp1 values (concat('8109',4000,'5'), 'Eve9', 'MANAGER', concat('8108',4000,'5'), str_to_date('01-MAY-84', '%d-%b-%Y'), 2850, null, 30);
INSERT INTO emp1 values (concat('8110',4000,'5'), 'Eve10', 'MANAGER', concat('8109',4000,'5'), str_to_date('01-MAY-84', '%d-%b-%Y'), 2850, null, 30);
INSERT INTO emp1 values (concat('8111',4000,'5'), 'Eve11', 'MANAGER', concat('8110',4000,'5'), str_to_date('01-MAY-84', '%d-%b-%Y'), 2850, null, 30);
INSERT INTO emp1 values (concat('8112',4000,'5'), 'Eve12', 'MANAGER', concat('8111',4000,'5'), str_to_date('01-MAY-84', '%d-%b-%Y'), 2850, null, 30);
INSERT INTO emp1 values (concat('8113',4000,'5'), 'Eve13', 'MANAGER', concat('8112',4000,'5'), str_to_date('01-MAY-84', '%d-%b-%Y'), 2850, null, 30);
INSERT INTO emp1 values (concat('8114',4000,'5'), 'Eve14', 'MANAGER', concat('8113',4000,'5'), str_to_date('01-MAY-84', '%d-%b-%Y'), 2850, null, 30);
INSERT INTO emp1 values (concat('8115',4000,'5'), 'Eve15', 'MANAGER', concat('8114',4000,'5'), str_to_date('01-MAY-84', '%d-%b-%Y'), 2850, null, 30);
INSERT INTO emp1 values (concat('8116',4000,'5'), 'Eve16', 'MANAGER', concat('8115',4000,'5'), str_to_date('01-MAY-84', '%d-%b-%Y'), 2850, null, 30);
INSERT INTO emp1 values (concat('8117',4000,'5'), 'Eve17', 'MANAGER', concat('8116',4000,'5'), str_to_date('01-MAY-84', '%d-%b-%Y'), 2850, null, 30);
INSERT INTO emp1 values (concat('8118',4000,'5'), 'Eve18', 'MANAGER', concat('8117',4000,'5'), str_to_date('01-MAY-84', '%d-%b-%Y'), 2850, null, 30);
INSERT INTO emp1 values (concat('8119',4000,'5'), 'Eve19', 'CLERK', concat('8118',4000,'5'), str_to_date('01-MAY-84', '%d-%b-%Y'), 2850, null, 30);

INSERT INTO emp2 values (4002, 'SMITH', 'CLERK', 5002, str_to_date('17-DEC-80', '%d-%b-%Y'), 800, null, 20);
INSERT INTO emp2 values (5003, 'ALLEN', 'SALESMAN', 6002, str_to_date('20-FEB-81', '%d-%b-%Y'), 1600, 300, 30);
INSERT INTO emp2 values (5004, 'WARD', 'SALESMAN', 6002, str_to_date('22-FEB-81', '%d-%b-%Y'), 1250, 500, 30);
INSERT INTO emp2 values (6001, 'JONES', 'MANAGER', 7839, str_to_date('02-APR-81', '%d-%b-%Y'), 2975, null, 20);
INSERT INTO emp2 values (5005, 'MARTIN', 'SALESMAN', 6002, str_to_date('28-SEP-81', '%d-%b-%Y'), 1250, 1400, 30);
INSERT INTO emp2 values (6002, 'BLAKE', 'MANAGER', 7839, str_to_date('01-MAY-81', '%d-%b-%Y'), 2850, null, 30);
INSERT INTO emp2 values (6003, 'CLARK', 'MANAGER', 7839, str_to_date('09-JUN-81' , '%d-%b-%Y'), 2450, null, 10);
INSERT INTO emp2 values (5001, 'SCOTT', 'ANALYST', 6001, str_to_date('19-APR-87', '%d-%b-%Y'), 3000, null, 20);
INSERT INTO emp2 values (7839, 'KING', 'PRESIDENT', null, str_to_date('17-NOV-81', '%d-%b-%Y'), 5000, null, 10);
INSERT INTO emp2 values (5006, 'TURNER', 'SALESMAN', 6002, str_to_date('08-SEP-81', '%d-%b-%Y'), 1500, 0, 30);
INSERT INTO emp2 values (4001, 'ADAMS', 'CLERK', 5001, str_to_date('23-MAY-87', '%d-%b-%Y'), 1100, null, 20);
INSERT INTO emp2 values (5007, 'JAMES', 'CLERK', 6002, str_to_date('03-DEC-81', '%d-%b-%Y'), 950, null, 30);
INSERT INTO emp2 values (5002, 'FORD', 'ANALYST', 6001, str_to_date('03-DEC-81', '%d-%b-%Y'), 3000, null, 20);
INSERT INTO emp2 values (5008, 'MILLER', 'CLERK', 6003, str_to_date('23-JAN-82', '%d-%b-%Y'), 1300, null, 10);


## =======================================================================
## Test Case 4:
## - recursive WITH Query(Negative): cycle clause not used in query with 
##    cyclic data
## =======================================================================
/* add loop from scott back to king  in emp */
update emp set mgr = 7788 where ename = 'KING';

explain basic
WITH rw (ename, mgr, empno) AS
(
    SELECT ename, mgr, empno
    FROM emp e
    WHERE job = 'PRESIDENT'
    UNION ALL
    SELECT e.ename, e.mgr, e.empno
    FROM rw r, emp e
    WHERE r.empno = e.mgr
)
SELECT ename, empno, mgr
FROM rw;
Query Plan
==============================
|ID|OPERATOR            |NAME|
------------------------------
|0 |SUBPLAN SCAN        |rw  |
|1 | RECURSIVE UNION ALL|    |
|2 |  TABLE SCAN        |e   |
|3 |  HASH JOIN         |    |
|4 |   TABLE SCAN       |e   |
|5 |   TABLE SCAN       |r   |
==============================

Outputs & filters: 
-------------------------------------
  0 - output([rw.ename], [rw.empno], [rw.mgr]), filter(nil), 
      access([rw.ename], [rw.empno], [rw.mgr])
  1 - output([UNION(e.ENAME, e.ENAME)], [UNION(e.MGR, e.MGR)], [UNION(e.EMPno, e.EMPno)]), filter(nil)
  2 - output([e.ENAME], [e.MGR], [e.EMPno]), filter([e.JOB = 'PRESIDENT']), 
      access([e.JOB], [e.ENAME], [e.MGR], [e.EMPno]), partitions(p0)
  3 - output([e.ENAME], [e.MGR], [e.EMPno]), filter(nil), 
      equal_conds([r.empno = e.MGR]), other_conds(nil)
  4 - output([e.MGR], [e.ENAME], [e.EMPno]), filter(nil), 
      access([e.MGR], [e.ENAME], [e.EMPno]), partitions(p0)
  5 - output([r.empno]), filter(nil), 
      access([r.empno]), partitions(nil)


WITH rw (ename, mgr, empno) AS
(
    SELECT ename, mgr, empno
    FROM emp e
    WHERE job = 'PRESIDENT'
    UNION ALL
    SELECT e.ename, e.mgr, e.empno
    FROM rw r, emp e
    WHERE r.empno = e.mgr
)
SELECT ename, empno, mgr
FROM rw;
+--------+-------+------+
| ename  | empno | mgr  |
+--------+-------+------+
| KING   |  7839 | 7788 |
| CLARK  |  7782 | 7839 |
| BLAKE  |  7698 | 7839 |
| JONES  |  7566 | 7839 |
| MILLER |  7934 | 7782 |
| JAMES  |  7900 | 7698 |
| TURNER |  7844 | 7698 |
| MARTIN |  7654 | 7698 |
| WARD   |  7521 | 7698 |
| ALLEN  |  7499 | 7698 |
| FORD   |  7902 | 7566 |
| SCOTT  |  7788 | 7566 |
| SMITH  |  7369 | 7902 |
| ADAMS  |  7876 | 7788 |
| KING   |  7839 | 7788 |
+--------+-------+------+

drop table emp1;
drop table emp2;

CREATE TABLE emp1 (
   empno    VARCHAR(32000) NOT NULL,
   ename    VARCHAR(14),
   job      VARCHAR(9),
   mgr      VARCHAR(32000),
   hiredate DATE,
   sal      NUMBER(7,2),
   comm     NUMBER(7,2),
   deptno   NUMBER(2));

CREATE TABLE emp2 (
   empno    VARCHAR(4000) NOT NULL,
   ename    VARCHAR(14),
   job      VARCHAR(9),
   mgr      VARCHAR(4000),
   hiredate DATE,
   sal      NUMBER(7,2),
   comm     NUMBER(7,2),
   deptno   NUMBER(2));

INSERT INTO emp1 values (7369, 'SMITH', 'CLERK', 7902, str_to_date('17-DEC-80', '%d-%b-%Y'), 800, null, 20);
INSERT INTO emp1 values (7499, 'ALLEN', 'SALESMAN', 7698, str_to_date('20-FEB-81', '%d-%b-%Y'), 1600, 300, 30);
INSERT INTO emp1 values (7521, 'WARD', 'SALESMAN', 7698, str_to_date('22-FEB-81', '%d-%b-%Y'), 1250, 500, 30);
INSERT INTO emp1 values (7566, 'JONES', 'MANAGER', 7839, str_to_date('02-APR-81', '%d-%b-%Y'), 2975, null, 20);
INSERT INTO emp1 values (7654, 'MARTIN', 'SALESMAN', 7698, str_to_date('28-SEP-81', '%d-%b-%Y'), 1250, 1400, 30);
INSERT INTO emp1 values (7698, 'BLAKE', 'MANAGER', 7839, str_to_date('01-MAY-81', '%d-%b-%Y'), 2850, null, 30);
INSERT INTO emp1 values (7782, 'CLARK', 'MANAGER', 7839, str_to_date('09-JUN-81' , '%d-%b-%Y'), 2450, null, 10);
INSERT INTO emp1 values (7788, 'SCOTT', 'ANALYST', 7566, str_to_date('19-APR-87', '%d-%b-%Y'), 3000, null, 20);
INSERT INTO emp1 values (7839, 'KING', 'PRESIDENT', null, str_to_date('17-NOV-81', '%d-%b-%Y'), 5000, null, 10);
INSERT INTO emp1 values (7844, 'TURNER', 'SALESMAN', 7698, str_to_date('08-SEP-81', '%d-%b-%Y'), 1500, 0, 30);
INSERT INTO emp1 values (7876, 'ADAMS', 'CLERK', 7788, str_to_date('23-MAY-87', '%d-%b-%Y'), 1100, null, 20);
INSERT INTO emp1 values (7900, 'JAMES', 'CLERK', 7698, str_to_date('03-DEC-81', '%d-%b-%Y'), 950, null, 30);
INSERT INTO emp1 values (7902, 'FORD', 'ANALYST', 7566, str_to_date('03-DEC-81', '%d-%b-%Y'), 3000, null, 20);
INSERT INTO emp1 values (7934, 'MILLER', 'CLERK', 7782, str_to_date('23-JAN-82', '%d-%b-%Y'), 1300, null, 10);
INSERT INTO emp1 values (concat('8100',4000,'5'), 'Eve', 'MANAGER', 7839, str_to_date('01-MAY-84', '%d-%b-%Y'), 2850, null, 30);
INSERT INTO emp1 values (concat('8101',30000,'5'), 'Eve1', 'MANAGER', concat('8100',4000,'5'), str_to_date('01-MAY-84', '%d-%b-%Y'), 2850, null, 30);
INSERT INTO emp1 values (concat('8102',30000,'5'), 'Eve2', 'MANAGER', concat('8101',30000,'5'), str_to_date('01-MAY-84', '%d-%b-%Y'), 2850, null, 30);
INSERT INTO emp1 values (concat('8103',30000,'5'), 'Eve3', 'MANAGER', concat('8102',30000,'5'), str_to_date('01-MAY-84', '%d-%b-%Y'), 2850, null, 30);
INSERT INTO emp1 values (concat('8104',30000,'5'), 'Eve4', 'MANAGER', concat('8103',30000,'5'), str_to_date('01-MAY-84', '%d-%b-%Y'), 2850, null, 30);
INSERT INTO emp1 values (concat('8105',30000,'5'), 'Eve5', 'MANAGER', concat('8104',30000,'5'), str_to_date('01-MAY-84', '%d-%b-%Y'), 2850, null, 30);
INSERT INTO emp1 values (concat('8106',30000,'5'), 'Eve6', 'MANAGER', concat('8105',30000,'5'), str_to_date('01-MAY-84', '%d-%b-%Y'), 2850, null, 30);
INSERT INTO emp1 values (concat('8107',4000,'5'), 'Eve7', 'MANAGER', concat('8106',30000,'5'), str_to_date('01-MAY-84', '%d-%b-%Y'), 2850, null, 30);
INSERT INTO emp1 values (concat('8108',4000,'5'), 'Eve8', 'MANAGER', concat('8107',4000,'5'), str_to_date('01-MAY-84', '%d-%b-%Y'), 2850, null, 30);
INSERT INTO emp1 values (concat('8109',4000,'5'), 'Eve9', 'MANAGER', concat('8108',4000,'5'), str_to_date('01-MAY-84', '%d-%b-%Y'), 2850, null, 30);
INSERT INTO emp1 values (concat('8110',4000,'5'), 'Eve10', 'MANAGER', concat('8109',4000,'5'), str_to_date('01-MAY-84', '%d-%b-%Y'), 2850, null, 30);
INSERT INTO emp1 values (concat('8111',4000,'5'), 'Eve11', 'MANAGER', concat('8110',4000,'5'), str_to_date('01-MAY-84', '%d-%b-%Y'), 2850, null, 30);
INSERT INTO emp1 values (concat('8112',4000,'5'), 'Eve12', 'MANAGER', concat('8111',4000,'5'), str_to_date('01-MAY-84', '%d-%b-%Y'), 2850, null, 30);
INSERT INTO emp1 values (concat('8113',4000,'5'), 'Eve13', 'MANAGER', concat('8112',4000,'5'), str_to_date('01-MAY-84', '%d-%b-%Y'), 2850, null, 30);
INSERT INTO emp1 values (concat('8114',4000,'5'), 'Eve14', 'MANAGER', concat('8113',4000,'5'), str_to_date('01-MAY-84', '%d-%b-%Y'), 2850, null, 30);
INSERT INTO emp1 values (concat('8115',4000,'5'), 'Eve15', 'MANAGER', concat('8114',4000,'5'), str_to_date('01-MAY-84', '%d-%b-%Y'), 2850, null, 30);
INSERT INTO emp1 values (concat('8116',4000,'5'), 'Eve16', 'MANAGER', concat('8115',4000,'5'), str_to_date('01-MAY-84', '%d-%b-%Y'), 2850, null, 30);
INSERT INTO emp1 values (concat('8117',4000,'5'), 'Eve17', 'MANAGER', concat('8116',4000,'5'), str_to_date('01-MAY-84', '%d-%b-%Y'), 2850, null, 30);
INSERT INTO emp1 values (concat('8118',4000,'5'), 'Eve18', 'MANAGER', concat('8117',4000,'5'), str_to_date('01-MAY-84', '%d-%b-%Y'), 2850, null, 30);
INSERT INTO emp1 values (concat('8119',4000,'5'), 'Eve19', 'CLERK', concat('8118',4000,'5'), str_to_date('01-MAY-84', '%d-%b-%Y'), 2850, null, 30);

INSERT INTO emp2 values (4002, 'SMITH', 'CLERK', 5002, str_to_date('17-DEC-80', '%d-%b-%Y'), 800, null, 20);
INSERT INTO emp2 values (5003, 'ALLEN', 'SALESMAN', 6002, str_to_date('20-FEB-81', '%d-%b-%Y'), 1600, 300, 30);
INSERT INTO emp2 values (5004, 'WARD', 'SALESMAN', 6002, str_to_date('22-FEB-81', '%d-%b-%Y'), 1250, 500, 30);
INSERT INTO emp2 values (6001, 'JONES', 'MANAGER', 7839, str_to_date('02-APR-81', '%d-%b-%Y'), 2975, null, 20);
INSERT INTO emp2 values (5005, 'MARTIN', 'SALESMAN', 6002, str_to_date('28-SEP-81', '%d-%b-%Y'), 1250, 1400, 30);
INSERT INTO emp2 values (6002, 'BLAKE', 'MANAGER', 7839, str_to_date('01-MAY-81', '%d-%b-%Y'), 2850, null, 30);
INSERT INTO emp2 values (6003, 'CLARK', 'MANAGER', 7839, str_to_date('09-JUN-81' , '%d-%b-%Y'), 2450, null, 10);
INSERT INTO emp2 values (5001, 'SCOTT', 'ANALYST', 6001, str_to_date('19-APR-87', '%d-%b-%Y'), 3000, null, 20);
INSERT INTO emp2 values (7839, 'KING', 'PRESIDENT', null, str_to_date('17-NOV-81', '%d-%b-%Y'), 5000, null, 10);
INSERT INTO emp2 values (5006, 'TURNER', 'SALESMAN', 6002, str_to_date('08-SEP-81', '%d-%b-%Y'), 1500, 0, 30);
INSERT INTO emp2 values (4001, 'ADAMS', 'CLERK', 5001, str_to_date('23-MAY-87', '%d-%b-%Y'), 1100, null, 20);
INSERT INTO emp2 values (5007, 'JAMES', 'CLERK', 6002, str_to_date('03-DEC-81', '%d-%b-%Y'), 950, null, 30);
INSERT INTO emp2 values (5002, 'FORD', 'ANALYST', 6001, str_to_date('03-DEC-81', '%d-%b-%Y'), 3000, null, 20);
INSERT INTO emp2 values (5008, 'MILLER', 'CLERK', 6003, str_to_date('23-JAN-82', '%d-%b-%Y'), 1300, null, 10);

## =======================================================================
## Test Case 6: Bug 21506203 SERIAL Run shows results BUT PARALLEL RUN Errors out
## - recursive WITH Query(Negative): Dummy placeholder query. Incorrect log
##   Cycle length exceeded for 32k value 
##REM  The parameter _recursive_with_cycle_length_multiplier parameter would   
##  need to be set to value 1 first before running query
##  Run time error should be reported for exceeding the cycle length                                 
## =======================================================================
/* add loop from Eve19 back to Eve  in emp1 */
INSERT INTO emp1 values (concat('8100',4000,'5'), 'Eve', 'MANAGER', concat('8119',4000,'5'), str_to_date('01-MAY-84', '%d-%b-%Y'), 2850, null, 30);

explain basic
WITH rw (ename, mgr, empno , iters, sal) AS
   (
      SELECT ename, mgr, empno, 1 iters, sal
      FROM emp1
      WHERE ename = 'Eve'
      UNION ALL
      SELECT t.ename, t.mgr, t.empno, r.iters + 1 iters, (r.sal + t.sal) sal                      
      FROM rw r, emp1 t
      WHERE r.empno = t.mgr  
   )
   cycle empno,mgr set iscycle to 'y' default 'n'
   SELECT  ename, iters, sal, iscycle
   FROM rw;
Query Plan
==============================
|ID|OPERATOR            |NAME|
------------------------------
|0 |SUBPLAN SCAN        |rw  |
|1 | RECURSIVE UNION ALL|    |
|2 |  TABLE SCAN        |emp1|
|3 |  HASH JOIN         |    |
|4 |   TABLE SCAN       |t   |
|5 |   TABLE SCAN       |r   |
==============================

Outputs & filters: 
-------------------------------------
  0 - output([rw.ename], [rw.iters], [rw.sal], [rw.iscycle]), filter(nil), 
      access([rw.ename], [rw.iters], [rw.sal], [rw.iscycle])
  1 - output([UNION(emp1.ename, t.ename)], [UNION(emp1.mgr, t.mgr)], [UNION(emp1.empno, t.empno)], [UNION(cast(?, BIGINT(20, 0)), cast(r.iters + 1, BIGINT(20, 0)))], [UNION(cast(emp1.sal, DECIMAL(8, 2)), r.sal + t.sal)], [T_CTE_CYCLE_COLUMN]), filter(nil)
  2 - output([emp1.ename], [emp1.mgr], [emp1.empno], [cast(?, BIGINT(20, 0))], [cast(emp1.sal, DECIMAL(8, 2))]), filter([emp1.ename = 'Eve']), 
      access([emp1.ename], [emp1.mgr], [emp1.empno], [emp1.sal]), partitions(p0)
  3 - output([t.ename], [t.mgr], [t.empno], [cast(r.iters + 1, BIGINT(20, 0))], [r.sal + t.sal]), filter(nil), 
      equal_conds([r.empno = t.mgr]), other_conds(nil)
  4 - output([t.mgr], [t.ename], [t.empno], [t.sal]), filter(nil), 
      access([t.mgr], [t.ename], [t.empno], [t.sal]), partitions(p0)
  5 - output([r.empno], [r.sal], [cast(r.iters + 1, BIGINT(20, 0))]), filter(nil), 
      access([r.empno], [r.iters], [r.sal]), partitions(nil)


WITH rw (ename, mgr, empno , iters, sal) AS
   (
      SELECT ename, mgr, empno, 1 iters, sal
      FROM emp1
      WHERE ename = 'Eve'
      UNION ALL
      SELECT t.ename, t.mgr, t.empno, r.iters + 1 iters, (r.sal + t.sal) sal                      
      FROM rw r, emp1 t
      WHERE r.empno = t.mgr  
   )
   cycle empno,mgr set iscycle to 'y' default 'n'
   SELECT  ename, iters, sal, iscycle
   FROM rw;
+-------+-------+----------+---------+
| ename | iters | sal      | iscycle |
+-------+-------+----------+---------+
| Eve   |     1 |  2850.00 | n       |
| Eve   |     1 |  2850.00 | n       |
| Eve1  |     2 |  5700.00 | n       |
| Eve1  |     2 |  5700.00 | n       |
| Eve2  |     3 |  8550.00 | n       |
| Eve2  |     3 |  8550.00 | n       |
| Eve3  |     4 | 11400.00 | n       |
| Eve3  |     4 | 11400.00 | n       |
| Eve4  |     5 | 14250.00 | n       |
| Eve4  |     5 | 14250.00 | n       |
| Eve5  |     6 | 17100.00 | n       |
| Eve5  |     6 | 17100.00 | n       |
| Eve6  |     7 | 19950.00 | n       |
| Eve6  |     7 | 19950.00 | n       |
| Eve7  |     8 | 22800.00 | n       |
| Eve7  |     8 | 22800.00 | n       |
| Eve8  |     9 | 25650.00 | n       |
| Eve8  |     9 | 25650.00 | n       |
| Eve9  |    10 | 28500.00 | n       |
| Eve9  |    10 | 28500.00 | n       |
| Eve10 |    11 | 31350.00 | n       |
| Eve10 |    11 | 31350.00 | n       |
| Eve11 |    12 | 34200.00 | n       |
| Eve11 |    12 | 34200.00 | n       |
| Eve12 |    13 | 37050.00 | n       |
| Eve12 |    13 | 37050.00 | n       |
| Eve13 |    14 | 39900.00 | n       |
| Eve13 |    14 | 39900.00 | n       |
| Eve14 |    15 | 42750.00 | n       |
| Eve14 |    15 | 42750.00 | n       |
| Eve15 |    16 | 45600.00 | n       |
| Eve15 |    16 | 45600.00 | n       |
| Eve16 |    17 | 48450.00 | n       |
| Eve16 |    17 | 48450.00 | n       |
| Eve17 |    18 | 51300.00 | n       |
| Eve17 |    18 | 51300.00 | n       |
| Eve18 |    19 | 54150.00 | n       |
| Eve18 |    19 | 54150.00 | n       |
| Eve19 |    20 | 57000.00 | n       |
| Eve19 |    20 | 57000.00 | n       |
| Eve   |    21 | 59850.00 | n       |
| Eve   |    21 | 59850.00 | y       |
| Eve1  |    22 | 62700.00 | y       |
+-------+-------+----------+---------+

## =======================================================================
## Test Case 7: Bug 21506203 SERIAL Run shows results BUT PARALLEL RUN Errors out
## - recursive WITH Query (Positive): Dummy placeholder query
##  The same query of Test case 6 is now executed with  
##REM  the parameter _recursive_with_cycle_length_multiplier parameter now  
##  set to value 2.
##  The Query should pass now displaying the output and cycle lengths                                 
## =======================================================================
explain basic
WITH rw (ename, mgr, empno , iters, sal) AS
   (
      SELECT ename, mgr, empno, 1 iters, sal
      FROM emp1
      WHERE ename = 'Eve'
      UNION ALL
      SELECT t.ename, t.mgr, t.empno, r.iters + 1 iters, (r.sal + t.sal) sal                      
      FROM rw r, emp1 t
      WHERE r.empno = t.mgr  
   )
   cycle empno,mgr set iscycle to 'y' default 'n'
   SELECT  ename, iters, sal, iscycle
   FROM rw;
Query Plan
==============================
|ID|OPERATOR            |NAME|
------------------------------
|0 |SUBPLAN SCAN        |rw  |
|1 | RECURSIVE UNION ALL|    |
|2 |  TABLE SCAN        |emp1|
|3 |  HASH JOIN         |    |
|4 |   TABLE SCAN       |t   |
|5 |   TABLE SCAN       |r   |
==============================

Outputs & filters: 
-------------------------------------
  0 - output([rw.ename], [rw.iters], [rw.sal], [rw.iscycle]), filter(nil), 
      access([rw.ename], [rw.iters], [rw.sal], [rw.iscycle])
  1 - output([UNION(emp1.ename, t.ename)], [UNION(emp1.mgr, t.mgr)], [UNION(emp1.empno, t.empno)], [UNION(cast(?, BIGINT(20, 0)), cast(r.iters + 1, BIGINT(20, 0)))], [UNION(cast(emp1.sal, DECIMAL(8, 2)), r.sal + t.sal)], [T_CTE_CYCLE_COLUMN]), filter(nil)
  2 - output([emp1.ename], [emp1.mgr], [emp1.empno], [cast(?, BIGINT(20, 0))], [cast(emp1.sal, DECIMAL(8, 2))]), filter([emp1.ename = 'Eve']), 
      access([emp1.ename], [emp1.mgr], [emp1.empno], [emp1.sal]), partitions(p0)
  3 - output([t.ename], [t.mgr], [t.empno], [cast(r.iters + 1, BIGINT(20, 0))], [r.sal + t.sal]), filter(nil), 
      equal_conds([r.empno = t.mgr]), other_conds(nil)
  4 - output([t.mgr], [t.ename], [t.empno], [t.sal]), filter(nil), 
      access([t.mgr], [t.ename], [t.empno], [t.sal]), partitions(p0)
  5 - output([r.empno], [r.sal], [cast(r.iters + 1, BIGINT(20, 0))]), filter(nil), 
      access([r.empno], [r.iters], [r.sal]), partitions(nil)


WITH rw (ename, mgr, empno , iters, sal) AS
   (
      SELECT ename, mgr, empno, 1 iters, sal
      FROM emp1
      WHERE ename = 'Eve'
      UNION ALL
      SELECT t.ename, t.mgr, t.empno, r.iters + 1 iters, (r.sal + t.sal) sal                      
      FROM rw r, emp1 t
      WHERE r.empno = t.mgr  
   )
   cycle empno,mgr set iscycle to 'y' default 'n'
   SELECT  ename, iters, sal, iscycle
   FROM rw;
+-------+-------+----------+---------+
| ename | iters | sal      | iscycle |
+-------+-------+----------+---------+
| Eve   |     1 |  2850.00 | n       |
| Eve   |     1 |  2850.00 | n       |
| Eve1  |     2 |  5700.00 | n       |
| Eve1  |     2 |  5700.00 | n       |
| Eve2  |     3 |  8550.00 | n       |
| Eve2  |     3 |  8550.00 | n       |
| Eve3  |     4 | 11400.00 | n       |
| Eve3  |     4 | 11400.00 | n       |
| Eve4  |     5 | 14250.00 | n       |
| Eve4  |     5 | 14250.00 | n       |
| Eve5  |     6 | 17100.00 | n       |
| Eve5  |     6 | 17100.00 | n       |
| Eve6  |     7 | 19950.00 | n       |
| Eve6  |     7 | 19950.00 | n       |
| Eve7  |     8 | 22800.00 | n       |
| Eve7  |     8 | 22800.00 | n       |
| Eve8  |     9 | 25650.00 | n       |
| Eve8  |     9 | 25650.00 | n       |
| Eve9  |    10 | 28500.00 | n       |
| Eve9  |    10 | 28500.00 | n       |
| Eve10 |    11 | 31350.00 | n       |
| Eve10 |    11 | 31350.00 | n       |
| Eve11 |    12 | 34200.00 | n       |
| Eve11 |    12 | 34200.00 | n       |
| Eve12 |    13 | 37050.00 | n       |
| Eve12 |    13 | 37050.00 | n       |
| Eve13 |    14 | 39900.00 | n       |
| Eve13 |    14 | 39900.00 | n       |
| Eve14 |    15 | 42750.00 | n       |
| Eve14 |    15 | 42750.00 | n       |
| Eve15 |    16 | 45600.00 | n       |
| Eve15 |    16 | 45600.00 | n       |
| Eve16 |    17 | 48450.00 | n       |
| Eve16 |    17 | 48450.00 | n       |
| Eve17 |    18 | 51300.00 | n       |
| Eve17 |    18 | 51300.00 | n       |
| Eve18 |    19 | 54150.00 | n       |
| Eve18 |    19 | 54150.00 | n       |
| Eve19 |    20 | 57000.00 | n       |
| Eve19 |    20 | 57000.00 | n       |
| Eve   |    21 | 59850.00 | n       |
| Eve   |    21 | 59850.00 | y       |
| Eve1  |    22 | 62700.00 | y       |
+-------+-------+----------+---------+

drop table emp1;
drop table emp2;

CREATE TABLE emp1 (
   empno    VARCHAR(32000) NOT NULL,
   ename    VARCHAR(14),
   job      VARCHAR(9),
   mgr      VARCHAR(32000),
   hiredate DATE,
   sal      NUMBER(7,2),
   comm     NUMBER(7,2),
   deptno   NUMBER(2));

CREATE TABLE emp2 (
   empno    VARCHAR(4000) NOT NULL,
   ename    VARCHAR(14),
   job      VARCHAR(9),
   mgr      VARCHAR(4000),
   hiredate DATE,
   sal      NUMBER(7,2),
   comm     NUMBER(7,2),
   deptno   NUMBER(2));

INSERT INTO emp1 values (7369, 'SMITH', 'CLERK', 7902, str_to_date('17-DEC-80', '%d-%b-%Y'), 800, null, 20);
INSERT INTO emp1 values (7499, 'ALLEN', 'SALESMAN', 7698, str_to_date('20-FEB-81', '%d-%b-%Y'), 1600, 300, 30);
INSERT INTO emp1 values (7521, 'WARD', 'SALESMAN', 7698, str_to_date('22-FEB-81', '%d-%b-%Y'), 1250, 500, 30);
INSERT INTO emp1 values (7566, 'JONES', 'MANAGER', 7839, str_to_date('02-APR-81', '%d-%b-%Y'), 2975, null, 20);
INSERT INTO emp1 values (7654, 'MARTIN', 'SALESMAN', 7698, str_to_date('28-SEP-81', '%d-%b-%Y'), 1250, 1400, 30);
INSERT INTO emp1 values (7698, 'BLAKE', 'MANAGER', 7839, str_to_date('01-MAY-81', '%d-%b-%Y'), 2850, null, 30);
INSERT INTO emp1 values (7782, 'CLARK', 'MANAGER', 7839, str_to_date('09-JUN-81' , '%d-%b-%Y'), 2450, null, 10);
INSERT INTO emp1 values (7788, 'SCOTT', 'ANALYST', 7566, str_to_date('19-APR-87', '%d-%b-%Y'), 3000, null, 20);
INSERT INTO emp1 values (7839, 'KING', 'PRESIDENT', null, str_to_date('17-NOV-81', '%d-%b-%Y'), 5000, null, 10);
INSERT INTO emp1 values (7844, 'TURNER', 'SALESMAN', 7698, str_to_date('08-SEP-81', '%d-%b-%Y'), 1500, 0, 30);
INSERT INTO emp1 values (7876, 'ADAMS', 'CLERK', 7788, str_to_date('23-MAY-87', '%d-%b-%Y'), 1100, null, 20);
INSERT INTO emp1 values (7900, 'JAMES', 'CLERK', 7698, str_to_date('03-DEC-81', '%d-%b-%Y'), 950, null, 30);
INSERT INTO emp1 values (7902, 'FORD', 'ANALYST', 7566, str_to_date('03-DEC-81', '%d-%b-%Y'), 3000, null, 20);
INSERT INTO emp1 values (7934, 'MILLER', 'CLERK', 7782, str_to_date('23-JAN-82', '%d-%b-%Y'), 1300, null, 10);
INSERT INTO emp1 values (concat('8100',4000,'5'), 'Eve', 'MANAGER', 7839, str_to_date('01-MAY-84', '%d-%b-%Y'), 2850, null, 30);
INSERT INTO emp1 values (concat('8101',30000,'5'), 'Eve1', 'MANAGER', concat('8100',4000,'5'), str_to_date('01-MAY-84', '%d-%b-%Y'), 2850, null, 30);
INSERT INTO emp1 values (concat('8102',30000,'5'), 'Eve2', 'MANAGER', concat('8101',30000,'5'), str_to_date('01-MAY-84', '%d-%b-%Y'), 2850, null, 30);
INSERT INTO emp1 values (concat('8103',30000,'5'), 'Eve3', 'MANAGER', concat('8102',30000,'5'), str_to_date('01-MAY-84', '%d-%b-%Y'), 2850, null, 30);
INSERT INTO emp1 values (concat('8104',30000,'5'), 'Eve4', 'MANAGER', concat('8103',30000,'5'), str_to_date('01-MAY-84', '%d-%b-%Y'), 2850, null, 30);
INSERT INTO emp1 values (concat('8105',30000,'5'), 'Eve5', 'MANAGER', concat('8104',30000,'5'), str_to_date('01-MAY-84', '%d-%b-%Y'), 2850, null, 30);
INSERT INTO emp1 values (concat('8106',30000,'5'), 'Eve6', 'MANAGER', concat('8105',30000,'5'), str_to_date('01-MAY-84', '%d-%b-%Y'), 2850, null, 30);
INSERT INTO emp1 values (concat('8107',4000,'5'), 'Eve7', 'MANAGER', concat('8106',30000,'5'), str_to_date('01-MAY-84', '%d-%b-%Y'), 2850, null, 30);
INSERT INTO emp1 values (concat('8108',4000,'5'), 'Eve8', 'MANAGER', concat('8107',4000,'5'), str_to_date('01-MAY-84', '%d-%b-%Y'), 2850, null, 30);
INSERT INTO emp1 values (concat('8109',4000,'5'), 'Eve9', 'MANAGER', concat('8108',4000,'5'), str_to_date('01-MAY-84', '%d-%b-%Y'), 2850, null, 30);
INSERT INTO emp1 values (concat('8110',4000,'5'), 'Eve10', 'MANAGER', concat('8109',4000,'5'), str_to_date('01-MAY-84', '%d-%b-%Y'), 2850, null, 30);
INSERT INTO emp1 values (concat('8111',4000,'5'), 'Eve11', 'MANAGER', concat('8110',4000,'5'), str_to_date('01-MAY-84', '%d-%b-%Y'), 2850, null, 30);
INSERT INTO emp1 values (concat('8112',4000,'5'), 'Eve12', 'MANAGER', concat('8111',4000,'5'), str_to_date('01-MAY-84', '%d-%b-%Y'), 2850, null, 30);
INSERT INTO emp1 values (concat('8113',4000,'5'), 'Eve13', 'MANAGER', concat('8112',4000,'5'), str_to_date('01-MAY-84', '%d-%b-%Y'), 2850, null, 30);
INSERT INTO emp1 values (concat('8114',4000,'5'), 'Eve14', 'MANAGER', concat('8113',4000,'5'), str_to_date('01-MAY-84', '%d-%b-%Y'), 2850, null, 30);
INSERT INTO emp1 values (concat('8115',4000,'5'), 'Eve15', 'MANAGER', concat('8114',4000,'5'), str_to_date('01-MAY-84', '%d-%b-%Y'), 2850, null, 30);
INSERT INTO emp1 values (concat('8116',4000,'5'), 'Eve16', 'MANAGER', concat('8115',4000,'5'), str_to_date('01-MAY-84', '%d-%b-%Y'), 2850, null, 30);
INSERT INTO emp1 values (concat('8117',4000,'5'), 'Eve17', 'MANAGER', concat('8116',4000,'5'), str_to_date('01-MAY-84', '%d-%b-%Y'), 2850, null, 30);
INSERT INTO emp1 values (concat('8118',4000,'5'), 'Eve18', 'MANAGER', concat('8117',4000,'5'), str_to_date('01-MAY-84', '%d-%b-%Y'), 2850, null, 30);
INSERT INTO emp1 values (concat('8119',4000,'5'), 'Eve19', 'CLERK', concat('8118',4000,'5'), str_to_date('01-MAY-84', '%d-%b-%Y'), 2850, null, 30);

INSERT INTO emp2 values (4002, 'SMITH', 'CLERK', 5002, str_to_date('17-DEC-80', '%d-%b-%Y'), 800, null, 20);
INSERT INTO emp2 values (5003, 'ALLEN', 'SALESMAN', 6002, str_to_date('20-FEB-81', '%d-%b-%Y'), 1600, 300, 30);
INSERT INTO emp2 values (5004, 'WARD', 'SALESMAN', 6002, str_to_date('22-FEB-81', '%d-%b-%Y'), 1250, 500, 30);
INSERT INTO emp2 values (6001, 'JONES', 'MANAGER', 7839, str_to_date('02-APR-81', '%d-%b-%Y'), 2975, null, 20);
INSERT INTO emp2 values (5005, 'MARTIN', 'SALESMAN', 6002, str_to_date('28-SEP-81', '%d-%b-%Y'), 1250, 1400, 30);
INSERT INTO emp2 values (6002, 'BLAKE', 'MANAGER', 7839, str_to_date('01-MAY-81', '%d-%b-%Y'), 2850, null, 30);
INSERT INTO emp2 values (6003, 'CLARK', 'MANAGER', 7839, str_to_date('09-JUN-81' , '%d-%b-%Y'), 2450, null, 10);
INSERT INTO emp2 values (5001, 'SCOTT', 'ANALYST', 6001, str_to_date('19-APR-87', '%d-%b-%Y'), 3000, null, 20);
INSERT INTO emp2 values (7839, 'KING', 'PRESIDENT', null, str_to_date('17-NOV-81', '%d-%b-%Y'), 5000, null, 10);
INSERT INTO emp2 values (5006, 'TURNER', 'SALESMAN', 6002, str_to_date('08-SEP-81', '%d-%b-%Y'), 1500, 0, 30);
INSERT INTO emp2 values (4001, 'ADAMS', 'CLERK', 5001, str_to_date('23-MAY-87', '%d-%b-%Y'), 1100, null, 20);
INSERT INTO emp2 values (5007, 'JAMES', 'CLERK', 6002, str_to_date('03-DEC-81', '%d-%b-%Y'), 950, null, 30);
INSERT INTO emp2 values (5002, 'FORD', 'ANALYST', 6001, str_to_date('03-DEC-81', '%d-%b-%Y'), 3000, null, 20);
INSERT INTO emp2 values (5008, 'MILLER', 'CLERK', 6003, str_to_date('23-JAN-82', '%d-%b-%Y'), 1300, null, 10);

## =======================================================================
## Test Case 8:
## - recursive WITH Query: Cycle Pruning with Cycle clause used in the query    
##  and filter predicate added. Only one column specified in cycle clause                               
## =======================================================================
/* add loop from scott back to king  in emp */
update emp2 set mgr = 5001 where ename = 'KING';

explain basic
WITH rw (ename, mgr, empno) AS
(
    SELECT ename, mgr, empno
    FROM emp2 e
    WHERE job = 'PRESIDENT'
    UNION ALL
    SELECT e.ename, e.mgr, e.empno
    FROM rw r, emp2 e
    WHERE r.empno = e.mgr and e.mgr > e.empno
)
CYCLE empno set iscycle TO 'Y' DEFAULT 'N'
SELECT ename, empno, mgr , iscycle
FROM rw;
Query Plan
==============================
|ID|OPERATOR            |NAME|
------------------------------
|0 |SUBPLAN SCAN        |rw  |
|1 | RECURSIVE UNION ALL|    |
|2 |  TABLE SCAN        |e   |
|3 |  HASH JOIN         |    |
|4 |   TABLE SCAN       |e   |
|5 |   TABLE SCAN       |r   |
==============================

Outputs & filters: 
-------------------------------------
  0 - output([rw.ename], [rw.empno], [rw.mgr], [rw.iscycle]), filter(nil), 
      access([rw.ename], [rw.empno], [rw.mgr], [rw.iscycle])
  1 - output([UNION(e.ename, e.ename)], [UNION(e.mgr, e.mgr)], [UNION(e.empno, e.empno)], [T_CTE_CYCLE_COLUMN]), filter(nil)
  2 - output([e.ename], [e.mgr], [e.empno]), filter([e.job = 'PRESIDENT']), 
      access([e.job], [e.ename], [e.mgr], [e.empno]), partitions(p0)
  3 - output([e.ename], [e.mgr], [e.empno]), filter(nil), 
      equal_conds([r.empno = e.mgr]), other_conds(nil)
  4 - output([e.mgr], [e.empno], [e.ename]), filter([e.mgr > e.empno]), 
      access([e.mgr], [e.empno], [e.ename]), partitions(p0)
  5 - output([r.empno]), filter(nil), 
      access([r.empno]), partitions(nil)


WITH rw (ename, mgr, empno) AS
(
    SELECT ename, mgr, empno
    FROM emp2 e
    WHERE job = 'PRESIDENT'
    UNION ALL
    SELECT e.ename, e.mgr, e.empno
    FROM rw r, emp2 e
    WHERE r.empno = e.mgr and e.mgr > e.empno
)
CYCLE empno set iscycle TO 'Y' DEFAULT 'N'
SELECT ename, empno, mgr , iscycle
FROM rw;
+--------+-------+------+---------+
| ename  | empno | mgr  | iscycle |
+--------+-------+------+---------+
| KING   | 7839  | 5001 | N       |
| CLARK  | 6003  | 7839 | N       |
| BLAKE  | 6002  | 7839 | N       |
| JONES  | 6001  | 7839 | N       |
| MILLER | 5008  | 6003 | N       |
| JAMES  | 5007  | 6002 | N       |
| TURNER | 5006  | 6002 | N       |
| MARTIN | 5005  | 6002 | N       |
| WARD   | 5004  | 6002 | N       |
| ALLEN  | 5003  | 6002 | N       |
| FORD   | 5002  | 6001 | N       |
| SCOTT  | 5001  | 6001 | N       |
| SMITH  | 4002  | 5002 | N       |
| ADAMS  | 4001  | 5001 | N       |
+--------+-------+------+---------+

## =======================================================================
## Test Case 9:  
## - recursive WITH Query: Cycle Pruning with Cycle clause used in the query    
##  Pruning predicate added that results in no cycles e.mgr < e.empno                             
## =======================================================================
explain basic
WITH rw (ename, mgr, empno) AS
(
    SELECT ename, mgr, empno
    FROM emp2 e
    WHERE job = 'PRESIDENT'
    UNION ALL
    SELECT e.ename, e.mgr, e.empno
    FROM rw r, emp2 e
    WHERE r.empno = e.mgr and e.mgr < e.empno
)
CYCLE empno,mgr set iscycle TO 'Y' DEFAULT 'N'
SELECT ename, empno, mgr , iscycle
FROM rw;
Query Plan
==============================
|ID|OPERATOR            |NAME|
------------------------------
|0 |SUBPLAN SCAN        |rw  |
|1 | RECURSIVE UNION ALL|    |
|2 |  TABLE SCAN        |e   |
|3 |  HASH JOIN         |    |
|4 |   TABLE SCAN       |e   |
|5 |   TABLE SCAN       |r   |
==============================

Outputs & filters: 
-------------------------------------
  0 - output([rw.ename], [rw.empno], [rw.mgr], [rw.iscycle]), filter(nil), 
      access([rw.ename], [rw.empno], [rw.mgr], [rw.iscycle])
  1 - output([UNION(e.ename, e.ename)], [UNION(e.mgr, e.mgr)], [UNION(e.empno, e.empno)], [T_CTE_CYCLE_COLUMN]), filter(nil)
  2 - output([e.ename], [e.mgr], [e.empno]), filter([e.job = 'PRESIDENT']), 
      access([e.job], [e.ename], [e.mgr], [e.empno]), partitions(p0)
  3 - output([e.ename], [e.mgr], [e.empno]), filter(nil), 
      equal_conds([r.empno = e.mgr]), other_conds(nil)
  4 - output([e.mgr], [e.empno], [e.ename]), filter([e.mgr < e.empno]), 
      access([e.mgr], [e.empno], [e.ename]), partitions(p0)
  5 - output([r.empno]), filter(nil), 
      access([r.empno]), partitions(nil)


WITH rw (ename, mgr, empno) AS
(
    SELECT ename, mgr, empno
    FROM emp2 e
    WHERE job = 'PRESIDENT'
    UNION ALL
    SELECT e.ename, e.mgr, e.empno
    FROM rw r, emp2 e
    WHERE r.empno = e.mgr and e.mgr < e.empno
)
CYCLE empno,mgr set iscycle TO 'Y' DEFAULT 'N'
SELECT ename, empno, mgr , iscycle
FROM rw;
+-------+-------+------+---------+
| ename | empno | mgr  | iscycle |
+-------+-------+------+---------+
| KING  | 7839  | 5001 | N       |
+-------+-------+------+---------+

## =======================================================================
## Test Case 10:  
## - recursive WITH Query: Cycle Pruning with Cycle clause used in the query    
##  Pruning predicate added that results in no cycles e.mgr > e.empno                             
## =======================================================================
explain basic
WITH rw (ename, mgr, empno) AS
(
    SELECT ename, mgr, empno
    FROM emp2 e
    WHERE job = 'PRESIDENT'
    UNION ALL
    SELECT e.ename, e.mgr, e.empno
    FROM rw r, emp2 e
    WHERE r.empno = e.mgr and e.mgr > e.empno
)
CYCLE empno,mgr set iscycle TO 'Y' DEFAULT 'N'
SELECT ename, empno, mgr , iscycle
FROM rw;
Query Plan
==============================
|ID|OPERATOR            |NAME|
------------------------------
|0 |SUBPLAN SCAN        |rw  |
|1 | RECURSIVE UNION ALL|    |
|2 |  TABLE SCAN        |e   |
|3 |  HASH JOIN         |    |
|4 |   TABLE SCAN       |e   |
|5 |   TABLE SCAN       |r   |
==============================

Outputs & filters: 
-------------------------------------
  0 - output([rw.ename], [rw.empno], [rw.mgr], [rw.iscycle]), filter(nil), 
      access([rw.ename], [rw.empno], [rw.mgr], [rw.iscycle])
  1 - output([UNION(e.ename, e.ename)], [UNION(e.mgr, e.mgr)], [UNION(e.empno, e.empno)], [T_CTE_CYCLE_COLUMN]), filter(nil)
  2 - output([e.ename], [e.mgr], [e.empno]), filter([e.job = 'PRESIDENT']), 
      access([e.job], [e.ename], [e.mgr], [e.empno]), partitions(p0)
  3 - output([e.ename], [e.mgr], [e.empno]), filter(nil), 
      equal_conds([r.empno = e.mgr]), other_conds(nil)
  4 - output([e.mgr], [e.empno], [e.ename]), filter([e.mgr > e.empno]), 
      access([e.mgr], [e.empno], [e.ename]), partitions(p0)
  5 - output([r.empno]), filter(nil), 
      access([r.empno]), partitions(nil)


WITH rw (ename, mgr, empno) AS
(
    SELECT ename, mgr, empno
    FROM emp2 e
    WHERE job = 'PRESIDENT'
    UNION ALL
    SELECT e.ename, e.mgr, e.empno
    FROM rw r, emp2 e
    WHERE r.empno = e.mgr and e.mgr > e.empno
)
CYCLE empno,mgr set iscycle TO 'Y' DEFAULT 'N'
SELECT ename, empno, mgr , iscycle
FROM rw;
+--------+-------+------+---------+
| ename  | empno | mgr  | iscycle |
+--------+-------+------+---------+
| KING   | 7839  | 5001 | N       |
| CLARK  | 6003  | 7839 | N       |
| BLAKE  | 6002  | 7839 | N       |
| JONES  | 6001  | 7839 | N       |
| MILLER | 5008  | 6003 | N       |
| JAMES  | 5007  | 6002 | N       |
| TURNER | 5006  | 6002 | N       |
| MARTIN | 5005  | 6002 | N       |
| WARD   | 5004  | 6002 | N       |
| ALLEN  | 5003  | 6002 | N       |
| FORD   | 5002  | 6001 | N       |
| SCOTT  | 5001  | 6001 | N       |
| SMITH  | 4002  | 5002 | N       |
| ADAMS  | 4001  | 5001 | N       |
+--------+-------+------+---------+

## =======================================================================
## Test Case 11:  
## - recursive WITH Query: Cycle Pruning with Cycle clause used in the query    
##  Pruning predicate added that results in no cycles r.empno < e.empno                              
## =======================================================================
explain basic
WITH rw (ename, mgr, empno) AS
(
    SELECT ename, mgr, empno
    FROM emp2 e
    WHERE job = 'PRESIDENT'
    UNION ALL
    SELECT e.ename, e.mgr, e.empno
    FROM rw r, emp2 e
    WHERE r.empno = e.mgr and r.empno < e.empno
)
CYCLE empno,mgr set iscycle TO 'Y' DEFAULT 'N'
SELECT ename, empno, mgr , iscycle
FROM rw;
Query Plan
==============================
|ID|OPERATOR            |NAME|
------------------------------
|0 |SUBPLAN SCAN        |rw  |
|1 | RECURSIVE UNION ALL|    |
|2 |  TABLE SCAN        |e   |
|3 |  HASH JOIN         |    |
|4 |   TABLE SCAN       |e   |
|5 |   TABLE SCAN       |r   |
==============================

Outputs & filters: 
-------------------------------------
  0 - output([rw.ename], [rw.empno], [rw.mgr], [rw.iscycle]), filter(nil), 
      access([rw.ename], [rw.empno], [rw.mgr], [rw.iscycle])
  1 - output([UNION(e.ename, e.ename)], [UNION(e.mgr, e.mgr)], [UNION(e.empno, e.empno)], [T_CTE_CYCLE_COLUMN]), filter(nil)
  2 - output([e.ename], [e.mgr], [e.empno]), filter([e.job = 'PRESIDENT']), 
      access([e.job], [e.ename], [e.mgr], [e.empno]), partitions(p0)
  3 - output([e.ename], [e.mgr], [e.empno]), filter(nil), 
      equal_conds([r.empno = e.mgr]), other_conds([r.empno < e.empno])
  4 - output([e.mgr], [e.empno], [e.ename]), filter(nil), 
      access([e.mgr], [e.empno], [e.ename]), partitions(p0)
  5 - output([r.empno]), filter(nil), 
      access([r.empno]), partitions(nil)


WITH rw (ename, mgr, empno) AS
(
    SELECT ename, mgr, empno
    FROM emp2 e
    WHERE job = 'PRESIDENT'
    UNION ALL
    SELECT e.ename, e.mgr, e.empno
    FROM rw r, emp2 e
    WHERE r.empno = e.mgr and r.empno < e.empno
)
CYCLE empno,mgr set iscycle TO 'Y' DEFAULT 'N'
SELECT ename, empno, mgr , iscycle
FROM rw;
+-------+-------+------+---------+
| ename | empno | mgr  | iscycle |
+-------+-------+------+---------+
| KING  | 7839  | 5001 | N       |
+-------+-------+------+---------+

## =======================================================================
## Test Case 12:  
## - recursive WITH Query: Cycle Pruning with Cycle clause used in the query    
##  Pruning predicate added that results in no cycles r.empno > e.empno                            
## =======================================================================
explain basic
WITH rw (ename, mgr, empno) AS
(
    SELECT ename, mgr, empno
    FROM emp2 e
    WHERE job = 'PRESIDENT'
    UNION ALL
    SELECT e.ename, e.mgr, e.empno
    FROM rw r, emp2 e
    WHERE r.empno = e.mgr and r.empno > e.empno
)
CYCLE empno,mgr set iscycle TO 'Y' DEFAULT 'N'
SELECT ename, empno, mgr , iscycle
FROM rw;
Query Plan
==============================
|ID|OPERATOR            |NAME|
------------------------------
|0 |SUBPLAN SCAN        |rw  |
|1 | RECURSIVE UNION ALL|    |
|2 |  TABLE SCAN        |e   |
|3 |  HASH JOIN         |    |
|4 |   TABLE SCAN       |e   |
|5 |   TABLE SCAN       |r   |
==============================

Outputs & filters: 
-------------------------------------
  0 - output([rw.ename], [rw.empno], [rw.mgr], [rw.iscycle]), filter(nil), 
      access([rw.ename], [rw.empno], [rw.mgr], [rw.iscycle])
  1 - output([UNION(e.ename, e.ename)], [UNION(e.mgr, e.mgr)], [UNION(e.empno, e.empno)], [T_CTE_CYCLE_COLUMN]), filter(nil)
  2 - output([e.ename], [e.mgr], [e.empno]), filter([e.job = 'PRESIDENT']), 
      access([e.job], [e.ename], [e.mgr], [e.empno]), partitions(p0)
  3 - output([e.ename], [e.mgr], [e.empno]), filter(nil), 
      equal_conds([r.empno = e.mgr]), other_conds([r.empno > e.empno])
  4 - output([e.mgr], [e.empno], [e.ename]), filter(nil), 
      access([e.mgr], [e.empno], [e.ename]), partitions(p0)
  5 - output([r.empno]), filter(nil), 
      access([r.empno]), partitions(nil)


WITH rw (ename, mgr, empno) AS
(
    SELECT ename, mgr, empno
    FROM emp2 e
    WHERE job = 'PRESIDENT'
    UNION ALL
    SELECT e.ename, e.mgr, e.empno
    FROM rw r, emp2 e
    WHERE r.empno = e.mgr and r.empno > e.empno
)
CYCLE empno,mgr set iscycle TO 'Y' DEFAULT 'N'
SELECT ename, empno, mgr , iscycle
FROM rw;
+--------+-------+------+---------+
| ename  | empno | mgr  | iscycle |
+--------+-------+------+---------+
| KING   | 7839  | 5001 | N       |
| CLARK  | 6003  | 7839 | N       |
| BLAKE  | 6002  | 7839 | N       |
| JONES  | 6001  | 7839 | N       |
| MILLER | 5008  | 6003 | N       |
| JAMES  | 5007  | 6002 | N       |
| TURNER | 5006  | 6002 | N       |
| MARTIN | 5005  | 6002 | N       |
| WARD   | 5004  | 6002 | N       |
| ALLEN  | 5003  | 6002 | N       |
| FORD   | 5002  | 6001 | N       |
| SCOTT  | 5001  | 6001 | N       |
| SMITH  | 4002  | 5002 | N       |
| ADAMS  | 4001  | 5001 | N       |
+--------+-------+------+---------+

## =======================================================================
## Test Case 13:  
## - recursive WITH Query: Cycle Pruning with Cycle clause not used in the query    
##  Pruning predicate added that results in no cycles e.mgr < e.empno                             
## =======================================================================
explain basic
WITH rw (ename, mgr, empno) AS
(
    SELECT ename, mgr, empno
    FROM emp2 e
    WHERE job = 'PRESIDENT'
    UNION ALL
    SELECT e.ename, e.mgr, e.empno
    FROM rw r, emp2 e
    WHERE r.empno = e.mgr and e.mgr < e.empno
)
SELECT ename, empno, mgr 
FROM rw;
Query Plan
==============================
|ID|OPERATOR            |NAME|
------------------------------
|0 |SUBPLAN SCAN        |rw  |
|1 | RECURSIVE UNION ALL|    |
|2 |  TABLE SCAN        |e   |
|3 |  HASH JOIN         |    |
|4 |   TABLE SCAN       |e   |
|5 |   TABLE SCAN       |r   |
==============================

Outputs & filters: 
-------------------------------------
  0 - output([rw.ename], [rw.empno], [rw.mgr]), filter(nil), 
      access([rw.ename], [rw.empno], [rw.mgr])
  1 - output([UNION(e.ename, e.ename)], [UNION(e.mgr, e.mgr)], [UNION(e.empno, e.empno)]), filter(nil)
  2 - output([e.ename], [e.mgr], [e.empno]), filter([e.job = 'PRESIDENT']), 
      access([e.job], [e.ename], [e.mgr], [e.empno]), partitions(p0)
  3 - output([e.ename], [e.mgr], [e.empno]), filter(nil), 
      equal_conds([r.empno = e.mgr]), other_conds(nil)
  4 - output([e.mgr], [e.empno], [e.ename]), filter([e.mgr < e.empno]), 
      access([e.mgr], [e.empno], [e.ename]), partitions(p0)
  5 - output([r.empno]), filter(nil), 
      access([r.empno]), partitions(nil)


WITH rw (ename, mgr, empno) AS
(
    SELECT ename, mgr, empno
    FROM emp2 e
    WHERE job = 'PRESIDENT'
    UNION ALL
    SELECT e.ename, e.mgr, e.empno
    FROM rw r, emp2 e
    WHERE r.empno = e.mgr and e.mgr < e.empno
)
SELECT ename, empno, mgr 
FROM rw;
+-------+-------+------+
| ename | empno | mgr  |
+-------+-------+------+
| KING  | 7839  | 5001 |
+-------+-------+------+

## =======================================================================
## Test Case 14:  
## - recursive WITH Query: Cycle Pruning with Cycle clause not used in the query    
##  Pruning predicate added that results in no cycles e.mgr > e.empno                             
## =======================================================================
explain basic
WITH rw (ename, mgr, empno) AS
(
    SELECT ename, mgr, empno
    FROM emp2 e
    WHERE job = 'PRESIDENT'
    UNION ALL
    SELECT e.ename, e.mgr, e.empno
    FROM rw r, emp2 e
    WHERE r.empno = e.mgr and e.mgr > e.empno
)
SELECT ename, empno, mgr
FROM rw;
Query Plan
==============================
|ID|OPERATOR            |NAME|
------------------------------
|0 |SUBPLAN SCAN        |rw  |
|1 | RECURSIVE UNION ALL|    |
|2 |  TABLE SCAN        |e   |
|3 |  HASH JOIN         |    |
|4 |   TABLE SCAN       |e   |
|5 |   TABLE SCAN       |r   |
==============================

Outputs & filters: 
-------------------------------------
  0 - output([rw.ename], [rw.empno], [rw.mgr]), filter(nil), 
      access([rw.ename], [rw.empno], [rw.mgr])
  1 - output([UNION(e.ename, e.ename)], [UNION(e.mgr, e.mgr)], [UNION(e.empno, e.empno)]), filter(nil)
  2 - output([e.ename], [e.mgr], [e.empno]), filter([e.job = 'PRESIDENT']), 
      access([e.job], [e.ename], [e.mgr], [e.empno]), partitions(p0)
  3 - output([e.ename], [e.mgr], [e.empno]), filter(nil), 
      equal_conds([r.empno = e.mgr]), other_conds(nil)
  4 - output([e.mgr], [e.empno], [e.ename]), filter([e.mgr > e.empno]), 
      access([e.mgr], [e.empno], [e.ename]), partitions(p0)
  5 - output([r.empno]), filter(nil), 
      access([r.empno]), partitions(nil)


WITH rw (ename, mgr, empno) AS
(
    SELECT ename, mgr, empno
    FROM emp2 e
    WHERE job = 'PRESIDENT'
    UNION ALL
    SELECT e.ename, e.mgr, e.empno
    FROM rw r, emp2 e
    WHERE r.empno = e.mgr and e.mgr > e.empno
)
SELECT ename, empno, mgr
FROM rw;
+--------+-------+------+
| ename  | empno | mgr  |
+--------+-------+------+
| KING   | 7839  | 5001 |
| CLARK  | 6003  | 7839 |
| BLAKE  | 6002  | 7839 |
| JONES  | 6001  | 7839 |
| MILLER | 5008  | 6003 |
| JAMES  | 5007  | 6002 |
| TURNER | 5006  | 6002 |
| MARTIN | 5005  | 6002 |
| WARD   | 5004  | 6002 |
| ALLEN  | 5003  | 6002 |
| FORD   | 5002  | 6001 |
| SCOTT  | 5001  | 6001 |
| SMITH  | 4002  | 5002 |
| ADAMS  | 4001  | 5001 |
+--------+-------+------+

## =======================================================================
## Test Case 15:  
## - recursive WITH Query: Cycle Pruning with Cycle clause not used in the query    
##  Pruning predicate added that results in no cycles r.empno < e.empno                              
## =======================================================================
explain basic
WITH rw (ename, mgr, empno) AS
(
    SELECT ename, mgr, empno
    FROM emp2 e
    WHERE job = 'PRESIDENT'
    UNION ALL
    SELECT e.ename, e.mgr, e.empno
    FROM rw r, emp2 e
    WHERE r.empno = e.mgr and r.empno < e.empno
)
SELECT ename, empno, mgr 
FROM rw;
Query Plan
==============================
|ID|OPERATOR            |NAME|
------------------------------
|0 |SUBPLAN SCAN        |rw  |
|1 | RECURSIVE UNION ALL|    |
|2 |  TABLE SCAN        |e   |
|3 |  HASH JOIN         |    |
|4 |   TABLE SCAN       |e   |
|5 |   TABLE SCAN       |r   |
==============================

Outputs & filters: 
-------------------------------------
  0 - output([rw.ename], [rw.empno], [rw.mgr]), filter(nil), 
      access([rw.ename], [rw.empno], [rw.mgr])
  1 - output([UNION(e.ename, e.ename)], [UNION(e.mgr, e.mgr)], [UNION(e.empno, e.empno)]), filter(nil)
  2 - output([e.ename], [e.mgr], [e.empno]), filter([e.job = 'PRESIDENT']), 
      access([e.job], [e.ename], [e.mgr], [e.empno]), partitions(p0)
  3 - output([e.ename], [e.mgr], [e.empno]), filter(nil), 
      equal_conds([r.empno = e.mgr]), other_conds([r.empno < e.empno])
  4 - output([e.mgr], [e.empno], [e.ename]), filter(nil), 
      access([e.mgr], [e.empno], [e.ename]), partitions(p0)
  5 - output([r.empno]), filter(nil), 
      access([r.empno]), partitions(nil)


WITH rw (ename, mgr, empno) AS
(
    SELECT ename, mgr, empno
    FROM emp2 e
    WHERE job = 'PRESIDENT'
    UNION ALL
    SELECT e.ename, e.mgr, e.empno
    FROM rw r, emp2 e
    WHERE r.empno = e.mgr and r.empno < e.empno
)
SELECT ename, empno, mgr 
FROM rw;
+-------+-------+------+
| ename | empno | mgr  |
+-------+-------+------+
| KING  | 7839  | 5001 |
+-------+-------+------+

## =======================================================================
## Test Case 16:  
## - recursive WITH Query: Cycle Pruning with Cycle clause not used in the query    
##  Pruning predicate added that results in no cycles r.empno > e.empno                            
## =======================================================================
explain basic
WITH rw (ename, mgr, empno) AS
(
    SELECT ename, mgr, empno
    FROM emp2 e
    WHERE job = 'PRESIDENT'
    UNION ALL
    SELECT e.ename, e.mgr, e.empno
    FROM rw r, emp2 e
    WHERE r.empno = e.mgr and r.empno > e.empno
)
SELECT ename, empno, mgr
FROM rw;
Query Plan
==============================
|ID|OPERATOR            |NAME|
------------------------------
|0 |SUBPLAN SCAN        |rw  |
|1 | RECURSIVE UNION ALL|    |
|2 |  TABLE SCAN        |e   |
|3 |  HASH JOIN         |    |
|4 |   TABLE SCAN       |e   |
|5 |   TABLE SCAN       |r   |
==============================

Outputs & filters: 
-------------------------------------
  0 - output([rw.ename], [rw.empno], [rw.mgr]), filter(nil), 
      access([rw.ename], [rw.empno], [rw.mgr])
  1 - output([UNION(e.ename, e.ename)], [UNION(e.mgr, e.mgr)], [UNION(e.empno, e.empno)]), filter(nil)
  2 - output([e.ename], [e.mgr], [e.empno]), filter([e.job = 'PRESIDENT']), 
      access([e.job], [e.ename], [e.mgr], [e.empno]), partitions(p0)
  3 - output([e.ename], [e.mgr], [e.empno]), filter(nil), 
      equal_conds([r.empno = e.mgr]), other_conds([r.empno > e.empno])
  4 - output([e.mgr], [e.empno], [e.ename]), filter(nil), 
      access([e.mgr], [e.empno], [e.ename]), partitions(p0)
  5 - output([r.empno]), filter(nil), 
      access([r.empno]), partitions(nil)


WITH rw (ename, mgr, empno) AS
(
    SELECT ename, mgr, empno
    FROM emp2 e
    WHERE job = 'PRESIDENT'
    UNION ALL
    SELECT e.ename, e.mgr, e.empno
    FROM rw r, emp2 e
    WHERE r.empno = e.mgr and r.empno > e.empno
)
SELECT ename, empno, mgr
FROM rw;
+--------+-------+------+
| ename  | empno | mgr  |
+--------+-------+------+
| KING   | 7839  | 5001 |
| CLARK  | 6003  | 7839 |
| BLAKE  | 6002  | 7839 |
| JONES  | 6001  | 7839 |
| MILLER | 5008  | 6003 |
| JAMES  | 5007  | 6002 |
| TURNER | 5006  | 6002 |
| MARTIN | 5005  | 6002 |
| WARD   | 5004  | 6002 |
| ALLEN  | 5003  | 6002 |
| FORD   | 5002  | 6001 |
| SCOTT  | 5001  | 6001 |
| SMITH  | 4002  | 5002 |
| ADAMS  | 4001  | 5001 |
+--------+-------+------+


drop database if exists ctetest;
drop tenant ora_tt force;
drop resource pool pool1;
drop resource unit box1;

