explain_protocol: 0
drop sequence s1;
drop table t1;
drop table t2;
drop table t3;
create sequence s1;
create table t1(c1 int, c2 int);
create table t2(c1 int primary key, c2 int);
create table t3(c1 int, c2 int) partition by hash(c1) partitions 4;
insert into t1 values(1, 2), (NULL, NULL), (3, 3);
insert into t2 values(1, 1), (2, 3), (3, 4);
insert into t3 values(1, 2), (2, 5), (2, 3);
select count(*) from t1;
COUNT(*)
3
select count(*) from t2;
COUNT(*)
3
select count(*) from t3;
COUNT(*)
3
explain_protocol: 2
result_format: 4
EXPLAIN select * from t1 where (select count(*) from t2) > 0;
Query Plan
=================================================
|ID|OPERATOR         |NAME|EST.ROWS|EST.TIME(us)|
-------------------------------------------------
|0 |SUBPLAN FILTER   |    |3       |5           |
|1 |├─TABLE FULL SCAN|T1  |3       |3           |
|2 |└─TABLE FULL SCAN|T2  |1       |3           |
=================================================
Outputs & filters:
-------------------------------------
  0 - output([T1.C1], [T1.C2]), filter(nil), rowset=16
      exec_params_(nil), onetime_exprs_([(T_OP_EXISTS, subquery(1))(:0)]), init_plan_idxs_(nil), use_batch=false
  1 - output([T1.C1], [T1.C2]), filter(nil), startup_filter([:0]), rowset=16
      access([T1.C1], [T1.C2]), partitions(p0)
      is_index_back=false, is_global_index=false, 
      range_key([T1.__pk_increment]), range(MIN ; MAX)always true
  2 - output([1]), filter(nil), rowset=16
      access(nil), partitions(p0)
      limit(1), offset(nil), is_index_back=false, is_global_index=false, 
      range_key([T2.C1]), range(MIN ; MAX)always true
select * from t1 where (select count(*) from t2) > 0;
+------+------+
| C1   | C2   |
+------+------+
|    1 |    2 |
| NULL | NULL |
|    3 |    3 |
+------+------+
EXPLAIN select /*+no_rewrite*/* from t1 where (select count(*) from t2) > 0;
Query Plan
===================================================
|ID|OPERATOR           |NAME|EST.ROWS|EST.TIME(us)|
---------------------------------------------------
|0 |SUBPLAN FILTER     |    |3       |5           |
|1 |├─TABLE FULL SCAN  |T1  |3       |3           |
|2 |└─SCALAR GROUP BY  |    |1       |3           |
|3 |  └─TABLE FULL SCAN|T2  |3       |3           |
===================================================
Outputs & filters:
-------------------------------------
  0 - output([T1.C1], [T1.C2]), filter(nil), rowset=16
      exec_params_(nil), onetime_exprs_([subquery(1)(:0)]), init_plan_idxs_(nil), use_batch=false
  1 - output([T1.C1], [T1.C2]), filter(nil), startup_filter([:0 > 0]), rowset=16
      access([T1.C1], [T1.C2]), partitions(p0)
      is_index_back=false, is_global_index=false, 
      range_key([T1.__pk_increment]), range(MIN ; MAX)always true
  2 - output([T_FUN_COUNT_SUM(T_FUN_COUNT(*))]), filter(nil), rowset=16
      group(nil), agg_func([T_FUN_COUNT_SUM(T_FUN_COUNT(*))])
  3 - output([T_FUN_COUNT(*)]), filter(nil), rowset=16
      access(nil), partitions(p0)
      is_index_back=false, is_global_index=false, 
      range_key([T2.C1]), range(MIN ; MAX)always true, 
      pushdown_aggregation([T_FUN_COUNT(*)])
select /*+no_rewrite*/* from t1 where (select count(*) from t2) > 0;
+------+------+
| C1   | C2   |
+------+------+
|    1 |    2 |
| NULL | NULL |
|    3 |    3 |
+------+------+

EXPLAIN select * from t1 where (select count(c1 + c2 + 1) from t2 where c1 > 1) > 0;
Query Plan
==================================================
|ID|OPERATOR          |NAME|EST.ROWS|EST.TIME(us)|
--------------------------------------------------
|0 |SUBPLAN FILTER    |    |3       |5           |
|1 |├─TABLE FULL SCAN |T1  |3       |3           |
|2 |└─TABLE RANGE SCAN|T2  |1       |3           |
==================================================
Outputs & filters:
-------------------------------------
  0 - output([T1.C1], [T1.C2]), filter(nil), rowset=16
      exec_params_(nil), onetime_exprs_([(T_OP_EXISTS, subquery(1))(:0)]), init_plan_idxs_(nil), use_batch=false
  1 - output([T1.C1], [T1.C2]), filter(nil), startup_filter([:0]), rowset=16
      access([T1.C1], [T1.C2]), partitions(p0)
      is_index_back=false, is_global_index=false, 
      range_key([T1.__pk_increment]), range(MIN ; MAX)always true
  2 - output([1]), filter([T2.C1 + T2.C2 + cast(1, NUMBER(-1, -85)) IS NOT NULL]), rowset=16
      access([T2.C1], [T2.C2]), partitions(p0)
      limit(1), offset(nil), is_index_back=false, is_global_index=false, filter_before_indexback[false], 
      range_key([T2.C1]), range(1 ; NULL), 
      range_cond([T2.C1 > 1])
select * from t1 where (select count(c1 + c2 + 1) from t2 where c1 > 1) > 0;
+------+------+
| C1   | C2   |
+------+------+
|    1 |    2 |
| NULL | NULL |
|    3 |    3 |
+------+------+
EXPLAIN select /*+no_rewrite*/* from t1 where (select count(c1 + c2 + 1) from t2 where c1 > 1) > 0;
Query Plan
====================================================
|ID|OPERATOR            |NAME|EST.ROWS|EST.TIME(us)|
----------------------------------------------------
|0 |SUBPLAN FILTER      |    |3       |5           |
|1 |├─TABLE FULL SCAN   |T1  |3       |3           |
|2 |└─SCALAR GROUP BY   |    |1       |3           |
|3 |  └─TABLE RANGE SCAN|T2  |2       |3           |
====================================================
Outputs & filters:
-------------------------------------
  0 - output([T1.C1], [T1.C2]), filter(nil), rowset=16
      exec_params_(nil), onetime_exprs_([subquery(1)(:0)]), init_plan_idxs_(nil), use_batch=false
  1 - output([T1.C1], [T1.C2]), filter(nil), startup_filter([:0 > 0]), rowset=16
      access([T1.C1], [T1.C2]), partitions(p0)
      is_index_back=false, is_global_index=false, 
      range_key([T1.__pk_increment]), range(MIN ; MAX)always true
  2 - output([T_FUN_COUNT(T2.C1 + T2.C2 + cast(1, NUMBER(-1, -85)))]), filter(nil), rowset=16
      group(nil), agg_func([T_FUN_COUNT(T2.C1 + T2.C2 + cast(1, NUMBER(-1, -85)))])
  3 - output([T2.C1], [T2.C2]), filter(nil), rowset=16
      access([T2.C1], [T2.C2]), partitions(p0)
      is_index_back=false, is_global_index=false, 
      range_key([T2.C1]), range(1 ; NULL), 
      range_cond([T2.C1 > 1])
select /*+no_rewrite*/* from t1 where (select count(c1 + c2 + 1) from t2 where c1 > 1) > 0;
+------+------+
| C1   | C2   |
+------+------+
|    1 |    2 |
| NULL | NULL |
|    3 |    3 |
+------+------+

EXPLAIN select * from t1 where (select count(*) from t2 having avg(c1) > 1) > 0;
Query Plan
===================================================
|ID|OPERATOR           |NAME|EST.ROWS|EST.TIME(us)|
---------------------------------------------------
|0 |SUBPLAN FILTER     |    |3       |5           |
|1 |├─TABLE FULL SCAN  |T1  |3       |3           |
|2 |└─SCALAR GROUP BY  |    |1       |3           |
|3 |  └─TABLE FULL SCAN|T2  |3       |3           |
===================================================
Outputs & filters:
-------------------------------------
  0 - output([T1.C1], [T1.C2]), filter(nil), rowset=16
      exec_params_(nil), onetime_exprs_([subquery(1)(:0)]), init_plan_idxs_(nil), use_batch=false
  1 - output([T1.C1], [T1.C2]), filter(nil), startup_filter([:0 > 0]), rowset=16
      access([T1.C1], [T1.C2]), partitions(p0)
      is_index_back=false, is_global_index=false, 
      range_key([T1.__pk_increment]), range(MIN ; MAX)always true
  2 - output([T_FUN_COUNT_SUM(T_FUN_COUNT(*))]), filter([T_FUN_SUM(T_FUN_SUM(T2.C1)) / T_FUN_COUNT_SUM(T_FUN_COUNT(T2.C1)) > 1]), rowset=16
      group(nil), agg_func([T_FUN_COUNT_SUM(T_FUN_COUNT(*))], [T_FUN_SUM(T_FUN_SUM(T2.C1))], [T_FUN_COUNT_SUM(T_FUN_COUNT(T2.C1))])
  3 - output([T_FUN_COUNT(*)], [T_FUN_SUM(T2.C1)], [T_FUN_COUNT(T2.C1)]), filter(nil), rowset=16
      access([T2.C1]), partitions(p0)
      is_index_back=false, is_global_index=false, 
      range_key([T2.C1]), range(MIN ; MAX)always true, 
      pushdown_aggregation([T_FUN_COUNT(*)], [T_FUN_SUM(T2.C1)], [T_FUN_COUNT(T2.C1)])
select * from t1 where (select count(*) from t2 having avg(c1) > 1) > 0;
+------+------+
| C1   | C2   |
+------+------+
|    1 |    2 |
| NULL | NULL |
|    3 |    3 |
+------+------+
EXPLAIN select /*+no_rewrite*/* from t1 where (select count(*) from t2 having avg(c1) > 1) > 0;
Query Plan
===================================================
|ID|OPERATOR           |NAME|EST.ROWS|EST.TIME(us)|
---------------------------------------------------
|0 |SUBPLAN FILTER     |    |3       |5           |
|1 |├─TABLE FULL SCAN  |T1  |3       |3           |
|2 |└─SCALAR GROUP BY  |    |1       |3           |
|3 |  └─TABLE FULL SCAN|T2  |3       |3           |
===================================================
Outputs & filters:
-------------------------------------
  0 - output([T1.C1], [T1.C2]), filter(nil), rowset=16
      exec_params_(nil), onetime_exprs_([subquery(1)(:0)]), init_plan_idxs_(nil), use_batch=false
  1 - output([T1.C1], [T1.C2]), filter(nil), startup_filter([:0 > 0]), rowset=16
      access([T1.C1], [T1.C2]), partitions(p0)
      is_index_back=false, is_global_index=false, 
      range_key([T1.__pk_increment]), range(MIN ; MAX)always true
  2 - output([T_FUN_COUNT_SUM(T_FUN_COUNT(*))]), filter([T_FUN_SUM(T_FUN_SUM(T2.C1)) / T_FUN_COUNT_SUM(T_FUN_COUNT(T2.C1)) > 1]), rowset=16
      group(nil), agg_func([T_FUN_COUNT_SUM(T_FUN_COUNT(*))], [T_FUN_SUM(T_FUN_SUM(T2.C1))], [T_FUN_COUNT_SUM(T_FUN_COUNT(T2.C1))])
  3 - output([T_FUN_COUNT(*)], [T_FUN_SUM(T2.C1)], [T_FUN_COUNT(T2.C1)]), filter(nil), rowset=16
      access([T2.C1]), partitions(p0)
      is_index_back=false, is_global_index=false, 
      range_key([T2.C1]), range(MIN ; MAX)always true, 
      pushdown_aggregation([T_FUN_COUNT(*)], [T_FUN_SUM(T2.C1)], [T_FUN_COUNT(T2.C1)])
select /*+no_rewrite*/* from t1 where (select count(*) from t2 having avg(c1) > 1) > 0;
+------+------+
| C1   | C2   |
+------+------+
|    1 |    2 |
| NULL | NULL |
|    3 |    3 |
+------+------+

EXPLAIN select * from t1 where (select count(*) from t2 having count(*) > 10) > 0;
Query Plan
===================================================
|ID|OPERATOR           |NAME|EST.ROWS|EST.TIME(us)|
---------------------------------------------------
|0 |SUBPLAN FILTER     |    |3       |5           |
|1 |├─TABLE FULL SCAN  |T1  |3       |3           |
|2 |└─SCALAR GROUP BY  |    |1       |3           |
|3 |  └─TABLE FULL SCAN|T2  |3       |3           |
===================================================
Outputs & filters:
-------------------------------------
  0 - output([T1.C1], [T1.C2]), filter(nil), rowset=16
      exec_params_(nil), onetime_exprs_([subquery(1)(:0)]), init_plan_idxs_(nil), use_batch=false
  1 - output([T1.C1], [T1.C2]), filter(nil), startup_filter([:0 > 0]), rowset=16
      access([T1.C1], [T1.C2]), partitions(p0)
      is_index_back=false, is_global_index=false, 
      range_key([T1.__pk_increment]), range(MIN ; MAX)always true
  2 - output([T_FUN_COUNT_SUM(T_FUN_COUNT(*))]), filter([T_FUN_COUNT_SUM(T_FUN_COUNT(*)) > 10]), rowset=16
      group(nil), agg_func([T_FUN_COUNT_SUM(T_FUN_COUNT(*))])
  3 - output([T_FUN_COUNT(*)]), filter(nil), rowset=16
      access(nil), partitions(p0)
      is_index_back=false, is_global_index=false, 
      range_key([T2.C1]), range(MIN ; MAX)always true, 
      pushdown_aggregation([T_FUN_COUNT(*)])
select * from t1 where (select count(*) from t2 having count(*) > 10) > 0;
+------+------+
| C1   | C2   |
+------+------+
+------+------+
EXPLAIN select /*+no_rewrite*/* from t1 where (select count(*) from t2 having count(*) > 10) > 0;
Query Plan
===================================================
|ID|OPERATOR           |NAME|EST.ROWS|EST.TIME(us)|
---------------------------------------------------
|0 |SUBPLAN FILTER     |    |3       |5           |
|1 |├─TABLE FULL SCAN  |T1  |3       |3           |
|2 |└─SCALAR GROUP BY  |    |1       |3           |
|3 |  └─TABLE FULL SCAN|T2  |3       |3           |
===================================================
Outputs & filters:
-------------------------------------
  0 - output([T1.C1], [T1.C2]), filter(nil), rowset=16
      exec_params_(nil), onetime_exprs_([subquery(1)(:0)]), init_plan_idxs_(nil), use_batch=false
  1 - output([T1.C1], [T1.C2]), filter(nil), startup_filter([:0 > 0]), rowset=16
      access([T1.C1], [T1.C2]), partitions(p0)
      is_index_back=false, is_global_index=false, 
      range_key([T1.__pk_increment]), range(MIN ; MAX)always true
  2 - output([T_FUN_COUNT_SUM(T_FUN_COUNT(*))]), filter([T_FUN_COUNT_SUM(T_FUN_COUNT(*)) > 10]), rowset=16
      group(nil), agg_func([T_FUN_COUNT_SUM(T_FUN_COUNT(*))])
  3 - output([T_FUN_COUNT(*)]), filter(nil), rowset=16
      access(nil), partitions(p0)
      is_index_back=false, is_global_index=false, 
      range_key([T2.C1]), range(MIN ; MAX)always true, 
      pushdown_aggregation([T_FUN_COUNT(*)])
select /*+no_rewrite*/* from t1 where (select count(*) from t2 having count(*) > 10) > 0;
+------+------+
| C1   | C2   |
+------+------+
+------+------+

EXPLAIN select * from t1 where (select * from (select count(c1) from t2 group by c1) where rownum <= 1) > 0;
Query Plan
=================================================
|ID|OPERATOR         |NAME|EST.ROWS|EST.TIME(us)|
-------------------------------------------------
|0 |SUBPLAN FILTER   |    |3       |5           |
|1 |├─TABLE FULL SCAN|T1  |3       |3           |
|2 |└─TABLE FULL SCAN|T2  |1       |3           |
=================================================
Outputs & filters:
-------------------------------------
  0 - output([T1.C1], [T1.C2]), filter(nil), rowset=16
      exec_params_(nil), onetime_exprs_([subquery(1)(:0)]), init_plan_idxs_(nil), use_batch=false
  1 - output([T1.C1], [T1.C2]), filter(nil), startup_filter([:0 > 0]), rowset=16
      access([T1.C1], [T1.C2]), partitions(p0)
      is_index_back=false, is_global_index=false, 
      range_key([T1.__pk_increment]), range(MIN ; MAX)always true
  2 - output([cast(CASE WHEN T2.C1 IS NOT NULL THEN 1 ELSE 0 END, NUMBER(38, 0))]), filter(nil), rowset=16
      access([T2.C1]), partitions(p0)
      limit(cast(FLOOR(1), BIGINT(-1, 0))), offset(nil), is_index_back=false, is_global_index=false, 
      range_key([T2.C1]), range(MIN ; MAX)always true
select * from t1 where (select * from (select count(c1) from t2 group by c1) where rownum <= 1) > 0;
+------+------+
| C1   | C2   |
+------+------+
|    1 |    2 |
| NULL | NULL |
|    3 |    3 |
+------+------+
EXPLAIN select /*+no_rewrite*/* from t1 where (select * from (select count(c1) from t2 group by c1) where rownum <= 1) > 0;
Query Plan
=================================================
|ID|OPERATOR         |NAME|EST.ROWS|EST.TIME(us)|
-------------------------------------------------
|0 |SUBPLAN FILTER   |    |3       |5           |
|1 |├─TABLE FULL SCAN|T1  |3       |3           |
|2 |└─TABLE FULL SCAN|T2  |1       |3           |
=================================================
Outputs & filters:
-------------------------------------
  0 - output([T1.C1], [T1.C2]), filter(nil), rowset=16
      exec_params_(nil), onetime_exprs_([subquery(1)(:0)]), init_plan_idxs_(nil), use_batch=false
  1 - output([T1.C1], [T1.C2]), filter(nil), startup_filter([:0 > 0]), rowset=16
      access([T1.C1], [T1.C2]), partitions(p0)
      is_index_back=false, is_global_index=false, 
      range_key([T1.__pk_increment]), range(MIN ; MAX)always true
  2 - output([cast(CASE WHEN T2.C1 IS NOT NULL THEN 1 ELSE 0 END, NUMBER(38, 0))]), filter(nil), rowset=16
      access([T2.C1]), partitions(p0)
      limit(cast(FLOOR(1), BIGINT(-1, 0))), offset(nil), is_index_back=false, is_global_index=false, 
      range_key([T2.C1]), range(MIN ; MAX)always true
select /*+no_rewrite*/* from t1 where (select * from (select count(c1) from t2 group by c1) where rownum <= 1) > 0;
+------+------+
| C1   | C2   |
+------+------+
|    1 |    2 |
| NULL | NULL |
|    3 |    3 |
+------+------+

EXPLAIN select count(*) from t2 where (select count(*) from t3) > 0;
Query Plan
=====================================================================
|ID|OPERATOR                         |NAME    |EST.ROWS|EST.TIME(us)|
---------------------------------------------------------------------
|0 |SCALAR GROUP BY                  |        |1       |11          |
|1 |└─SUBPLAN FILTER                 |        |3       |11          |
|2 |  ├─TABLE FULL SCAN              |T2      |3       |3           |
|3 |  └─LIMIT                        |        |1       |9           |
|4 |    └─PX COORDINATOR             |        |1       |9           |
|5 |      └─EXCHANGE OUT DISTR       |:EX10000|1       |9           |
|6 |        └─LIMIT                  |        |1       |9           |
|7 |          └─PX PARTITION ITERATOR|        |1       |9           |
|8 |            └─TABLE FULL SCAN    |T3      |1       |9           |
=====================================================================
Outputs & filters:
-------------------------------------
  0 - output([T_FUN_COUNT(*)]), filter(nil), rowset=16
      group(nil), agg_func([T_FUN_COUNT(*)])
  1 - output(nil), filter(nil), rowset=16
      exec_params_(nil), onetime_exprs_([(T_OP_EXISTS, subquery(1))(:0)]), init_plan_idxs_(nil), use_batch=false
  2 - output(nil), filter(nil), startup_filter([:0]), rowset=16
      access(nil), partitions(p0)
      is_index_back=false, is_global_index=false, 
      range_key([T2.C1]), range(MIN ; MAX)always true
  3 - output([1]), filter(nil), rowset=16
      limit(1), offset(nil)
  4 - output(nil), filter(nil), rowset=16
  5 - output(nil), filter(nil), rowset=16
      dop=1
  6 - output(nil), filter(nil), rowset=16
      limit(1), offset(nil)
  7 - output(nil), filter(nil), rowset=16
      force partition granule
  8 - output(nil), filter(nil), rowset=16
      access(nil), partitions(p[0-3])
      limit(1), offset(nil), is_index_back=false, is_global_index=false, 
      range_key([T3.__pk_increment]), range(MIN ; MAX)always true
select count(*) from t2 where (select count(*) from t3) > 0;
+----------+
| COUNT(*) |
+----------+
|        3 |
+----------+
EXPLAIN select /*+no_rewrite*/count(*) from t2 where (select count(*) from t3) > 0;
Query Plan
=====================================================================
|ID|OPERATOR                         |NAME    |EST.ROWS|EST.TIME(us)|
---------------------------------------------------------------------
|0 |SCALAR GROUP BY                  |        |1       |12          |
|1 |└─SUBPLAN FILTER                 |        |3       |12          |
|2 |  ├─TABLE FULL SCAN              |T2      |3       |3           |
|3 |  └─SCALAR GROUP BY              |        |1       |10          |
|4 |    └─PX COORDINATOR             |        |1       |10          |
|5 |      └─EXCHANGE OUT DISTR       |:EX10000|1       |10          |
|6 |        └─MERGE GROUP BY         |        |1       |9           |
|7 |          └─PX PARTITION ITERATOR|        |3       |9           |
|8 |            └─TABLE FULL SCAN    |T3      |3       |9           |
=====================================================================
Outputs & filters:
-------------------------------------
  0 - output([T_FUN_COUNT(*)]), filter(nil), rowset=16
      group(nil), agg_func([T_FUN_COUNT(*)])
  1 - output(nil), filter(nil), rowset=16
      exec_params_(nil), onetime_exprs_([subquery(1)(:0)]), init_plan_idxs_(nil), use_batch=false
  2 - output(nil), filter(nil), startup_filter([:0 > 0]), rowset=16
      access(nil), partitions(p0)
      is_index_back=false, is_global_index=false, 
      range_key([T2.C1]), range(MIN ; MAX)always true
  3 - output([T_FUN_COUNT_SUM(T_FUN_COUNT_SUM(T_FUN_COUNT(*)))]), filter(nil), rowset=16
      group(nil), agg_func([T_FUN_COUNT_SUM(T_FUN_COUNT_SUM(T_FUN_COUNT(*)))])
  4 - output([T_FUN_COUNT_SUM(T_FUN_COUNT(*))]), filter(nil), rowset=16
  5 - output([T_FUN_COUNT_SUM(T_FUN_COUNT(*))]), filter(nil), rowset=16
      dop=1
  6 - output([T_FUN_COUNT_SUM(T_FUN_COUNT(*))]), filter(nil), rowset=16
      group(nil), agg_func([T_FUN_COUNT_SUM(T_FUN_COUNT(*))])
  7 - output([T_FUN_COUNT(*)]), filter(nil), rowset=16
      force partition granule
  8 - output([T_FUN_COUNT(*)]), filter(nil), rowset=16
      access(nil), partitions(p[0-3])
      is_index_back=false, is_global_index=false, 
      range_key([T3.__pk_increment]), range(MIN ; MAX)always true, 
      pushdown_aggregation([T_FUN_COUNT(*)])
select /*+no_rewrite*/count(*) from t2 where (select count(*) from t3) > 0;
+----------+
| COUNT(*) |
+----------+
|        3 |
+----------+

EXPLAIN select * from t1 where 0 < (select count(*) from t2);
Query Plan
=================================================
|ID|OPERATOR         |NAME|EST.ROWS|EST.TIME(us)|
-------------------------------------------------
|0 |SUBPLAN FILTER   |    |3       |5           |
|1 |├─TABLE FULL SCAN|T1  |3       |3           |
|2 |└─TABLE FULL SCAN|T2  |1       |3           |
=================================================
Outputs & filters:
-------------------------------------
  0 - output([T1.C1], [T1.C2]), filter(nil), rowset=16
      exec_params_(nil), onetime_exprs_([(T_OP_EXISTS, subquery(1))(:0)]), init_plan_idxs_(nil), use_batch=false
  1 - output([T1.C1], [T1.C2]), filter(nil), startup_filter([:0]), rowset=16
      access([T1.C1], [T1.C2]), partitions(p0)
      is_index_back=false, is_global_index=false, 
      range_key([T1.__pk_increment]), range(MIN ; MAX)always true
  2 - output([1]), filter(nil), rowset=16
      access(nil), partitions(p0)
      limit(1), offset(nil), is_index_back=false, is_global_index=false, 
      range_key([T2.C1]), range(MIN ; MAX)always true
select * from t1 where 0 < (select count(*) from t2);
+------+------+
| C1   | C2   |
+------+------+
|    1 |    2 |
| NULL | NULL |
|    3 |    3 |
+------+------+
EXPLAIN select /*+no_rewrite*/* from t1 where 0 < (select count(*) from t2);
Query Plan
===================================================
|ID|OPERATOR           |NAME|EST.ROWS|EST.TIME(us)|
---------------------------------------------------
|0 |SUBPLAN FILTER     |    |3       |5           |
|1 |├─TABLE FULL SCAN  |T1  |3       |3           |
|2 |└─SCALAR GROUP BY  |    |1       |3           |
|3 |  └─TABLE FULL SCAN|T2  |3       |3           |
===================================================
Outputs & filters:
-------------------------------------
  0 - output([T1.C1], [T1.C2]), filter(nil), rowset=16
      exec_params_(nil), onetime_exprs_([subquery(1)(:0)]), init_plan_idxs_(nil), use_batch=false
  1 - output([T1.C1], [T1.C2]), filter(nil), startup_filter([0 < :0]), rowset=16
      access([T1.C1], [T1.C2]), partitions(p0)
      is_index_back=false, is_global_index=false, 
      range_key([T1.__pk_increment]), range(MIN ; MAX)always true
  2 - output([T_FUN_COUNT_SUM(T_FUN_COUNT(*))]), filter(nil), rowset=16
      group(nil), agg_func([T_FUN_COUNT_SUM(T_FUN_COUNT(*))])
  3 - output([T_FUN_COUNT(*)]), filter(nil), rowset=16
      access(nil), partitions(p0)
      is_index_back=false, is_global_index=false, 
      range_key([T2.C1]), range(MIN ; MAX)always true, 
      pushdown_aggregation([T_FUN_COUNT(*)])
select /*+no_rewrite*/* from t1 where 0 < (select count(*) from t2);
+------+------+
| C1   | C2   |
+------+------+
|    1 |    2 |
| NULL | NULL |
|    3 |    3 |
+------+------+

EXPLAIN select * from t1 where (select count(*) from t2 where t1.c1 = t2.c1) > 0;
Query Plan
===================================================
|ID|OPERATOR           |NAME|EST.ROWS|EST.TIME(us)|
---------------------------------------------------
|0 |MERGE JOIN         |    |2       |6           |
|1 |├─TABLE FULL SCAN  |T2  |3       |3           |
|2 |└─SORT             |    |3       |3           |
|3 |  └─TABLE FULL SCAN|T1  |3       |3           |
===================================================
Outputs & filters:
-------------------------------------
  0 - output([T1.C1], [T1.C2]), filter(nil), rowset=16
      equal_conds([T1.C1 = T2.C1]), other_conds(nil)
      merge_directions([ASC])
  1 - output([T2.C1]), filter(nil), rowset=16
      access([T2.C1]), partitions(p0)
      is_index_back=false, is_global_index=false, 
      range_key([T2.C1]), range(MIN ; MAX)always true
  2 - output([T1.C1], [T1.C2]), filter(nil), rowset=16
      sort_keys([T1.C1, ASC])
  3 - output([T1.C1], [T1.C2]), filter(nil), rowset=16
      access([T1.C1], [T1.C2]), partitions(p0)
      is_index_back=false, is_global_index=false, 
      range_key([T1.__pk_increment]), range(MIN ; MAX)always true
select * from t1 where (select count(*) from t2 where t1.c1 = t2.c1) > 0;
+------+------+
| C1   | C2   |
+------+------+
|    1 |    2 |
|    3 |    3 |
+------+------+
EXPLAIN select /*+no_rewrite*/* from t1 where (select count(*) from t2 where t1.c1 = t2.c1) > 0;
Query Plan
=================================================
|ID|OPERATOR         |NAME|EST.ROWS|EST.TIME(us)|
-------------------------------------------------
|0 |SUBPLAN FILTER   |    |1       |57          |
|1 |├─TABLE FULL SCAN|T1  |3       |3           |
|2 |└─SCALAR GROUP BY|    |1       |18          |
|3 |  └─TABLE GET    |T2  |1       |18          |
=================================================
Outputs & filters:
-------------------------------------
  0 - output([T1.C1], [T1.C2]), filter([subquery(1) > 0]), rowset=16
      exec_params_([T1.C1(:0)]), onetime_exprs_(nil), init_plan_idxs_(nil), use_batch=false
  1 - output([T1.C1], [T1.C2]), filter(nil), rowset=16
      access([T1.C1], [T1.C2]), partitions(p0)
      is_index_back=false, is_global_index=false, 
      range_key([T1.__pk_increment]), range(MIN ; MAX)always true
  2 - output([T_FUN_COUNT(*)]), filter(nil), rowset=16
      group(nil), agg_func([T_FUN_COUNT(*)])
  3 - output(nil), filter(nil), rowset=16
      access(nil), partitions(p0)
      is_index_back=false, is_global_index=false, 
      range_key([T2.C1]), range(MIN ; MAX)always true, 
      range_cond([:0 = T2.C1])
select /*+no_rewrite*/* from t1 where (select count(*) from t2 where t1.c1 = t2.c1) > 0;
+------+------+
| C1   | C2   |
+------+------+
|    1 |    2 |
|    3 |    3 |
+------+------+

EXPLAIN select * from t1 where (select count(*) from t2 where t1.c1 > t2.c1) > 0;
Query Plan
======================================================
|ID|OPERATOR              |NAME|EST.ROWS|EST.TIME(us)|
------------------------------------------------------
|0 |NESTED-LOOP SEMI JOIN |    |1       |59          |
|1 |├─TABLE FULL SCAN     |T1  |3       |3           |
|2 |└─TABLE RANGE SCAN    |T2  |1       |18          |
======================================================
Outputs & filters:
-------------------------------------
  0 - output([T1.C1], [T1.C2]), filter(nil), rowset=16
      conds(nil), nl_params_([T1.C1(:0)]), use_batch=false
  1 - output([T1.C1], [T1.C2]), filter(nil), rowset=16
      access([T1.C1], [T1.C2]), partitions(p0)
      is_index_back=false, is_global_index=false, 
      range_key([T1.__pk_increment]), range(MIN ; MAX)always true
  2 - output(nil), filter(nil), rowset=16
      access(nil), partitions(p0)
      is_index_back=false, is_global_index=false, 
      range_key([T2.C1]), range(MIN ; MAX), 
      range_cond([:0 > T2.C1])
select * from t1 where (select count(*) from t2 where t1.c1 > t2.c1) > 0;
+------+------+
| C1   | C2   |
+------+------+
|    3 |    3 |
+------+------+
EXPLAIN select /*+no_rewrite*/* from t1 where (select count(*) from t2 where t1.c1 > t2.c1) > 0;
Query Plan
====================================================
|ID|OPERATOR            |NAME|EST.ROWS|EST.TIME(us)|
----------------------------------------------------
|0 |SUBPLAN FILTER      |    |1       |57          |
|1 |├─TABLE FULL SCAN   |T1  |3       |3           |
|2 |└─SCALAR GROUP BY   |    |1       |18          |
|3 |  └─TABLE RANGE SCAN|T2  |1       |18          |
====================================================
Outputs & filters:
-------------------------------------
  0 - output([T1.C1], [T1.C2]), filter([subquery(1) > 0]), rowset=16
      exec_params_([T1.C1(:0)]), onetime_exprs_(nil), init_plan_idxs_(nil), use_batch=false
  1 - output([T1.C1], [T1.C2]), filter(nil), rowset=16
      access([T1.C1], [T1.C2]), partitions(p0)
      is_index_back=false, is_global_index=false, 
      range_key([T1.__pk_increment]), range(MIN ; MAX)always true
  2 - output([T_FUN_COUNT_SUM(T_FUN_COUNT(*))]), filter(nil), rowset=16
      group(nil), agg_func([T_FUN_COUNT_SUM(T_FUN_COUNT(*))])
  3 - output([T_FUN_COUNT(*)]), filter(nil), rowset=16
      access(nil), partitions(p0)
      is_index_back=false, is_global_index=false, 
      range_key([T2.C1]), range(MIN ; MAX)always true, 
      range_cond([:0 > T2.C1]), 
      pushdown_aggregation([T_FUN_COUNT(*)])
select /*+no_rewrite*/* from t1 where (select count(*) from t2 where t1.c1 > t2.c1) > 0;
+------+------+
| C1   | C2   |
+------+------+
|    3 |    3 |
+------+------+

EXPLAIN select * from t1 where (select count(*) from t2) > 0 and t1.c1 > 0;
Query Plan
=================================================
|ID|OPERATOR         |NAME|EST.ROWS|EST.TIME(us)|
-------------------------------------------------
|0 |SUBPLAN FILTER   |    |1       |5           |
|1 |├─TABLE FULL SCAN|T1  |1       |3           |
|2 |└─TABLE FULL SCAN|T2  |1       |3           |
=================================================
Outputs & filters:
-------------------------------------
  0 - output([T1.C1], [T1.C2]), filter(nil), rowset=16
      exec_params_(nil), onetime_exprs_([(T_OP_EXISTS, subquery(1))(:0)]), init_plan_idxs_(nil), use_batch=false
  1 - output([T1.C1], [T1.C2]), filter([T1.C1 > 0]), startup_filter([:0]), rowset=16
      access([T1.C1], [T1.C2]), partitions(p0)
      is_index_back=false, is_global_index=false, filter_before_indexback[false], 
      range_key([T1.__pk_increment]), range(MIN ; MAX)always true
  2 - output([1]), filter(nil), rowset=16
      access(nil), partitions(p0)
      limit(1), offset(nil), is_index_back=false, is_global_index=false, 
      range_key([T2.C1]), range(MIN ; MAX)always true
select * from t1 where (select count(*) from t2) > 0 and t1.c1 > 0;
+------+------+
| C1   | C2   |
+------+------+
|    1 |    2 |
|    3 |    3 |
+------+------+
EXPLAIN select /*+no_rewrite*/* from t1 where (select count(*) from t2) > 0 and t1.c1 > 0;
Query Plan
===================================================
|ID|OPERATOR           |NAME|EST.ROWS|EST.TIME(us)|
---------------------------------------------------
|0 |SUBPLAN FILTER     |    |1       |5           |
|1 |├─TABLE FULL SCAN  |T1  |1       |3           |
|2 |└─SCALAR GROUP BY  |    |1       |3           |
|3 |  └─TABLE FULL SCAN|T2  |3       |3           |
===================================================
Outputs & filters:
-------------------------------------
  0 - output([T1.C1], [T1.C2]), filter(nil), rowset=16
      exec_params_(nil), onetime_exprs_([subquery(1)(:0)]), init_plan_idxs_(nil), use_batch=false
  1 - output([T1.C1], [T1.C2]), filter([T1.C1 > 0]), startup_filter([:0 > 0]), rowset=16
      access([T1.C1], [T1.C2]), partitions(p0)
      is_index_back=false, is_global_index=false, filter_before_indexback[false], 
      range_key([T1.__pk_increment]), range(MIN ; MAX)always true
  2 - output([T_FUN_COUNT_SUM(T_FUN_COUNT(*))]), filter(nil), rowset=16
      group(nil), agg_func([T_FUN_COUNT_SUM(T_FUN_COUNT(*))])
  3 - output([T_FUN_COUNT(*)]), filter(nil), rowset=16
      access(nil), partitions(p0)
      is_index_back=false, is_global_index=false, 
      range_key([T2.C1]), range(MIN ; MAX)always true, 
      pushdown_aggregation([T_FUN_COUNT(*)])
select /*+no_rewrite*/* from t1 where (select count(*) from t2) > 0 and t1.c1 > 0;
+------+------+
| C1   | C2   |
+------+------+
|    1 |    2 |
|    3 |    3 |
+------+------+

EXPLAIN select * from t1 where (select count(*) from t2 where t1.c1 = t2.c1) > 0 and t1.c1 > 0;
Query Plan
===================================================
|ID|OPERATOR           |NAME|EST.ROWS|EST.TIME(us)|
---------------------------------------------------
|0 |MERGE JOIN         |    |2       |5           |
|1 |├─TABLE RANGE SCAN |T2  |3       |3           |
|2 |└─SORT             |    |2       |3           |
|3 |  └─TABLE FULL SCAN|T1  |2       |3           |
===================================================
Outputs & filters:
-------------------------------------
  0 - output([T1.C1], [T1.C2]), filter(nil), rowset=16
      equal_conds([T1.C1 = T2.C1]), other_conds(nil)
      merge_directions([ASC])
  1 - output([T2.C1]), filter(nil), rowset=16
      access([T2.C1]), partitions(p0)
      is_index_back=false, is_global_index=false, 
      range_key([T2.C1]), range(0 ; NULL), 
      range_cond([T2.C1 > 0])
  2 - output([T1.C1], [T1.C2]), filter(nil), rowset=16
      sort_keys([T1.C1, ASC])
  3 - output([T1.C1], [T1.C2]), filter([T1.C1 > 0]), rowset=16
      access([T1.C1], [T1.C2]), partitions(p0)
      is_index_back=false, is_global_index=false, filter_before_indexback[false], 
      range_key([T1.__pk_increment]), range(MIN ; MAX)always true
select * from t1 where (select count(*) from t2 where t1.c1 = t2.c1) > 0 and t1.c1 > 0;
+------+------+
| C1   | C2   |
+------+------+
|    1 |    2 |
|    3 |    3 |
+------+------+
EXPLAIN select /*+no_rewrite*/* from t1 where (select count(*) from t2 where t1.c1 = t2.c1) > 0 and t1.c1 > 0;
Query Plan
=================================================
|ID|OPERATOR         |NAME|EST.ROWS|EST.TIME(us)|
-------------------------------------------------
|0 |SUBPLAN FILTER   |    |1       |39          |
|1 |├─TABLE FULL SCAN|T1  |2       |3           |
|2 |└─SCALAR GROUP BY|    |1       |18          |
|3 |  └─TABLE GET    |T2  |1       |18          |
=================================================
Outputs & filters:
-------------------------------------
  0 - output([T1.C1], [T1.C2]), filter([subquery(1) > 0]), rowset=16
      exec_params_([T1.C1(:0)]), onetime_exprs_(nil), init_plan_idxs_(nil), use_batch=false
  1 - output([T1.C1], [T1.C2]), filter([T1.C1 > 0]), rowset=16
      access([T1.C1], [T1.C2]), partitions(p0)
      is_index_back=false, is_global_index=false, filter_before_indexback[false], 
      range_key([T1.__pk_increment]), range(MIN ; MAX)always true
  2 - output([T_FUN_COUNT(*)]), filter(nil), rowset=16
      group(nil), agg_func([T_FUN_COUNT(*)])
  3 - output(nil), filter(nil), rowset=16
      access(nil), partitions(p0)
      is_index_back=false, is_global_index=false, 
      range_key([T2.C1]), range(MIN ; MAX)always true, 
      range_cond([:0 = T2.C1], [T2.C1 > 0])
select /*+no_rewrite*/* from t1 where (select count(*) from t2 where t1.c1 = t2.c1) > 0 and t1.c1 > 0;
+------+------+
| C1   | C2   |
+------+------+
|    1 |    2 |
|    3 |    3 |
+------+------+

EXPLAIN select * from t1 where (select count(*) from t2 where t1.c1 = t2.c1) > 0 and (select count(*) from t2) > 0;
Query Plan
=====================================================
|ID|OPERATOR             |NAME|EST.ROWS|EST.TIME(us)|
-----------------------------------------------------
|0 |SUBPLAN FILTER       |    |2       |8           |
|1 |├─MERGE JOIN         |    |2       |6           |
|2 |│ ├─TABLE FULL SCAN  |T2  |3       |3           |
|3 |│ └─SORT             |    |3       |3           |
|4 |│   └─TABLE FULL SCAN|T1  |3       |3           |
|5 |└─TABLE FULL SCAN    |T2  |1       |3           |
=====================================================
Outputs & filters:
-------------------------------------
  0 - output([T1.C1], [T1.C2]), filter(nil), rowset=16
      exec_params_(nil), onetime_exprs_([(T_OP_EXISTS, subquery(1))(:0)]), init_plan_idxs_(nil), use_batch=false
  1 - output([T1.C1], [T1.C2]), filter(nil), startup_filter([:0]), rowset=16
      equal_conds([T1.C1 = T2.C1]), other_conds(nil)
      merge_directions([ASC])
  2 - output([T2.C1]), filter(nil), rowset=16
      access([T2.C1]), partitions(p0)
      is_index_back=false, is_global_index=false, 
      range_key([T2.C1]), range(MIN ; MAX)always true
  3 - output([T1.C1], [T1.C2]), filter(nil), rowset=16
      sort_keys([T1.C1, ASC])
  4 - output([T1.C1], [T1.C2]), filter(nil), rowset=16
      access([T1.C1], [T1.C2]), partitions(p0)
      is_index_back=false, is_global_index=false, 
      range_key([T1.__pk_increment]), range(MIN ; MAX)always true
  5 - output([1]), filter(nil), rowset=16
      access(nil), partitions(p0)
      limit(1), offset(nil), is_index_back=false, is_global_index=false, 
      range_key([T2.C1]), range(MIN ; MAX)always true
select * from t1 where (select count(*) from t2 where t1.c1 = t2.c1) > 0 and (select count(*) from t2) > 0;
+------+------+
| C1   | C2   |
+------+------+
|    1 |    2 |
|    3 |    3 |
+------+------+
EXPLAIN select /*+no_rewrite*/* from t1 where (select count(*) from t2 where t1.c1 = t2.c1) > 0 and (select count(*) from t2) > 0;
Query Plan
===================================================
|ID|OPERATOR           |NAME|EST.ROWS|EST.TIME(us)|
---------------------------------------------------
|0 |SUBPLAN FILTER     |    |1       |59          |
|1 |├─TABLE FULL SCAN  |T1  |3       |3           |
|2 |├─SCALAR GROUP BY  |    |1       |18          |
|3 |│ └─TABLE GET      |T2  |1       |18          |
|4 |└─SCALAR GROUP BY  |    |1       |3           |
|5 |  └─TABLE FULL SCAN|T2  |3       |3           |
===================================================
Outputs & filters:
-------------------------------------
  0 - output([T1.C1], [T1.C2]), filter([subquery(1) > 0]), rowset=16
      exec_params_([T1.C1(:0)]), onetime_exprs_([subquery(2)(:1)]), init_plan_idxs_(nil), use_batch=false
  1 - output([T1.C1], [T1.C2]), filter(nil), startup_filter([:1 > 0]), rowset=16
      access([T1.C1], [T1.C2]), partitions(p0)
      is_index_back=false, is_global_index=false, 
      range_key([T1.__pk_increment]), range(MIN ; MAX)always true
  2 - output([T_FUN_COUNT(*)]), filter(nil), rowset=16
      group(nil), agg_func([T_FUN_COUNT(*)])
  3 - output(nil), filter(nil), rowset=16
      access(nil), partitions(p0)
      is_index_back=false, is_global_index=false, 
      range_key([T2.C1]), range(MIN ; MAX)always true, 
      range_cond([:0 = T2.C1])
  4 - output([T_FUN_COUNT_SUM(T_FUN_COUNT(*))]), filter(nil), rowset=16
      group(nil), agg_func([T_FUN_COUNT_SUM(T_FUN_COUNT(*))])
  5 - output([T_FUN_COUNT(*)]), filter(nil), rowset=16
      access(nil), partitions(p0)
      is_index_back=false, is_global_index=false, 
      range_key([T2.C1]), range(MIN ; MAX)always true, 
      pushdown_aggregation([T_FUN_COUNT(*)])
select /*+no_rewrite*/* from t1 where (select count(*) from t2 where t1.c1 = t2.c1) > 0 and (select count(*) from t2) > 0;
+------+------+
| C1   | C2   |
+------+------+
|    1 |    2 |
|    3 |    3 |
+------+------+

EXPLAIN select * from t1 left join t2 on t1.c1 = t2.c1 where (select count(*) from t3 where t3.c1 = t1.c1 and t3.c1 = t2.c1) > 0;
Query Plan
=====================================================================
|ID|OPERATOR                         |NAME    |EST.ROWS|EST.TIME(us)|
---------------------------------------------------------------------
|0 |PX COORDINATOR                   |        |2       |30          |
|1 |└─EXCHANGE OUT DISTR             |:EX10001|2       |28          |
|2 |  └─HASH RIGHT SEMI JOIN         |        |2       |23          |
|3 |    ├─PX PARTITION ITERATOR      |        |3       |9           |
|4 |    │ └─TABLE FULL SCAN          |T3      |3       |9           |
|5 |    └─EXCHANGE IN DISTR          |        |2       |13          |
|6 |      └─EXCHANGE OUT DISTR (PKEY)|:EX10000|2       |11          |
|7 |        └─MERGE JOIN             |        |2       |6           |
|8 |          ├─SORT                 |        |3       |3           |
|9 |          │ └─TABLE FULL SCAN    |T1      |3       |3           |
|10|          └─TABLE FULL SCAN      |T2      |3       |3           |
=====================================================================
Outputs & filters:
-------------------------------------
  0 - output([INTERNAL_FUNCTION(T1.C1, T1.C2, T2.C1, T2.C2)]), filter(nil), rowset=16
  1 - output([INTERNAL_FUNCTION(T1.C1, T1.C2, T2.C1, T2.C2)]), filter(nil), rowset=16
      dop=1
  2 - output([T1.C1], [T2.C1], [T1.C2], [T2.C2]), filter(nil), rowset=16
      equal_conds([T3.C1 = T1.C1]), other_conds(nil)
  3 - output([T3.C1]), filter(nil), rowset=16
      affinitize, force partition granule
  4 - output([T3.C1]), filter(nil), rowset=16
      access([T3.C1]), partitions(p[0-3])
      is_index_back=false, is_global_index=false, 
      range_key([T3.__pk_increment]), range(MIN ; MAX)always true
  5 - output([T1.C1], [T2.C1], [T1.C2], [T2.C2]), filter(nil), rowset=16
  6 - output([T1.C1], [T2.C1], [T1.C2], [T2.C2]), filter(nil), rowset=16
      (#keys=1, [T1.C1]), is_single, dop=1
  7 - output([T1.C1], [T2.C1], [T1.C2], [T2.C2]), filter(nil), rowset=16
      equal_conds([T1.C1 = T2.C1]), other_conds(nil)
      merge_directions([ASC])
  8 - output([T1.C1], [T1.C2]), filter(nil), rowset=16
      sort_keys([T1.C1, ASC])
  9 - output([T1.C1], [T1.C2]), filter(nil), rowset=16
      access([T1.C1], [T1.C2]), partitions(p0)
      is_index_back=false, is_global_index=false, 
      range_key([T1.__pk_increment]), range(MIN ; MAX)always true
 10 - output([T2.C1], [T2.C2]), filter(nil), rowset=16
      access([T2.C1], [T2.C2]), partitions(p0)
      is_index_back=false, is_global_index=false, 
      range_key([T2.C1]), range(MIN ; MAX)always true
select * from t1 left join t2 on t1.c1 = t2.c1 where (select count(*) from t3 where t3.c1 = t1.c1 and t3.c1 = t2.c1) > 0;
+------+------+----+------+
| C1   | C2   | C1 | C2   |
+------+------+----+------+
|    1 |    2 |  1 |    1 |
+------+------+----+------+
EXPLAIN select /*+no_rewrite*/* from t1 left join t2 on t1.c1 = t2.c1 where (select count(*) from t3 where t3.c1 = t1.c1 and t3.c1 = t2.c1) > 0;
Query Plan
===============================================================
|ID|OPERATOR                       |NAME|EST.ROWS|EST.TIME(us)|
---------------------------------------------------------------
|0 |SUBPLAN FILTER                 |    |1       |221         |
|1 |├─MERGE RIGHT OUTER JOIN       |    |3       |6           |
|2 |│ ├─TABLE FULL SCAN            |T2  |3       |3           |
|3 |│ └─SORT                       |    |3       |3           |
|4 |│   └─TABLE FULL SCAN          |T1  |3       |3           |
|5 |└─SCALAR GROUP BY              |    |1       |72          |
|6 |  └─DISTRIBUTED TABLE FULL SCAN|T3  |1       |72          |
===============================================================
Outputs & filters:
-------------------------------------
  0 - output([T1.C1], [T1.C2], [T2.C1], [T2.C2]), filter([subquery(1) > 0]), rowset=16
      exec_params_([T1.C1(:0)], [T2.C1(:1)]), onetime_exprs_(nil), init_plan_idxs_(nil), use_batch=false
  1 - output([T1.C1], [T2.C1], [T1.C2], [T2.C2]), filter(nil), rowset=16
      equal_conds([T1.C1 = T2.C1]), other_conds(nil)
      merge_directions([ASC])
  2 - output([T2.C1], [T2.C2]), filter(nil), rowset=16
      access([T2.C1], [T2.C2]), partitions(p0)
      is_index_back=false, is_global_index=false, 
      range_key([T2.C1]), range(MIN ; MAX)always true
  3 - output([T1.C1], [T1.C2]), filter(nil), rowset=16
      sort_keys([T1.C1, ASC])
  4 - output([T1.C1], [T1.C2]), filter(nil), rowset=16
      access([T1.C1], [T1.C2]), partitions(p0)
      is_index_back=false, is_global_index=false, 
      range_key([T1.__pk_increment]), range(MIN ; MAX)always true
  5 - output([T_FUN_COUNT_SUM(T_FUN_COUNT(*))]), filter(nil), rowset=16
      group(nil), agg_func([T_FUN_COUNT_SUM(T_FUN_COUNT(*))])
  6 - output([T_FUN_COUNT(*)]), filter([T3.C1 = :0], [T3.C1 = :1]), startup_filter([:0 = :1]), rowset=16
      access([T3.C1]), partitions(p[0-3])
      is_index_back=false, is_global_index=false, filter_before_indexback[false,false], 
      range_key([T3.__pk_increment]), range(MIN ; MAX)always true, 
      pushdown_aggregation([T_FUN_COUNT(*)])
select /*+no_rewrite*/* from t1 left join t2 on t1.c1 = t2.c1 where (select count(*) from t3 where t3.c1 = t1.c1 and t3.c1 = t2.c1) > 0;
+------+------+----+------+
| C1   | C2   | C1 | C2   |
+------+------+----+------+
|    1 |    2 |  1 |    1 |
+------+------+----+------+

EXPLAIN select * from t1 where (select count(*) from t2) < 0;
Query Plan
============================================================
|ID|OPERATOR                   |NAME |EST.ROWS|EST.TIME(us)|
------------------------------------------------------------
|0 |NESTED-LOOP JOIN CARTESIAN |     |3       |6           |
|1 |├─SUBPLAN SCAN             |VIEW1|1       |3           |
|2 |│ └─SCALAR GROUP BY        |     |1       |3           |
|3 |│   └─TABLE FULL SCAN      |T2   |3       |3           |
|4 |└─TABLE FULL SCAN          |T1   |3       |3           |
============================================================
Outputs & filters:
-------------------------------------
  0 - output([T1.C1], [T1.C2]), filter(nil), rowset=16
      conds(nil), nl_params_(nil), use_batch=false
  1 - output(nil), filter(nil), rowset=16
      access(nil)
  2 - output([T_FUN_COUNT_SUM(T_FUN_COUNT(*))]), filter([T_FUN_COUNT_SUM(T_FUN_COUNT(*)) < 0]), rowset=16
      group(nil), agg_func([T_FUN_COUNT_SUM(T_FUN_COUNT(*))])
  3 - output([T_FUN_COUNT(*)]), filter(nil), rowset=16
      access(nil), partitions(p0)
      is_index_back=false, is_global_index=false, 
      range_key([T2.C1]), range(MIN ; MAX)always true, 
      pushdown_aggregation([T_FUN_COUNT(*)])
  4 - output([T1.C1], [T1.C2]), filter(nil), rowset=16
      access([T1.C1], [T1.C2]), partitions(p0)
      is_index_back=false, is_global_index=false, 
      range_key([T1.__pk_increment]), range(MIN ; MAX)always true
select * from t1 where (select count(*) from t2) < 0;
+------+------+
| C1   | C2   |
+------+------+
+------+------+
EXPLAIN select /*+no_rewrite*/* from t1 where (select count(*) from t2) < 0;
Query Plan
===================================================
|ID|OPERATOR           |NAME|EST.ROWS|EST.TIME(us)|
---------------------------------------------------
|0 |SUBPLAN FILTER     |    |3       |5           |
|1 |├─TABLE FULL SCAN  |T1  |3       |3           |
|2 |└─SCALAR GROUP BY  |    |1       |3           |
|3 |  └─TABLE FULL SCAN|T2  |3       |3           |
===================================================
Outputs & filters:
-------------------------------------
  0 - output([T1.C1], [T1.C2]), filter(nil), rowset=16
      exec_params_(nil), onetime_exprs_([subquery(1)(:0)]), init_plan_idxs_(nil), use_batch=false
  1 - output([T1.C1], [T1.C2]), filter(nil), startup_filter([:0 < 0]), rowset=16
      access([T1.C1], [T1.C2]), partitions(p0)
      is_index_back=false, is_global_index=false, 
      range_key([T1.__pk_increment]), range(MIN ; MAX)always true
  2 - output([T_FUN_COUNT_SUM(T_FUN_COUNT(*))]), filter(nil), rowset=16
      group(nil), agg_func([T_FUN_COUNT_SUM(T_FUN_COUNT(*))])
  3 - output([T_FUN_COUNT(*)]), filter(nil), rowset=16
      access(nil), partitions(p0)
      is_index_back=false, is_global_index=false, 
      range_key([T2.C1]), range(MIN ; MAX)always true, 
      pushdown_aggregation([T_FUN_COUNT(*)])
select /*+no_rewrite*/* from t1 where (select count(*) from t2) < 0;
+------+------+
| C1   | C2   |
+------+------+
+------+------+

EXPLAIN select * from t1 where (select count(*) from t2) <= 0;
Query Plan
=================================================
|ID|OPERATOR         |NAME|EST.ROWS|EST.TIME(us)|
-------------------------------------------------
|0 |SUBPLAN FILTER   |    |3       |5           |
|1 |├─TABLE FULL SCAN|T1  |3       |3           |
|2 |└─TABLE FULL SCAN|T2  |1       |3           |
=================================================
Outputs & filters:
-------------------------------------
  0 - output([T1.C1], [T1.C2]), filter(nil), rowset=16
      exec_params_(nil), onetime_exprs_([(T_OP_NOT_EXISTS, subquery(1))(:0)]), init_plan_idxs_(nil), use_batch=false
  1 - output([T1.C1], [T1.C2]), filter(nil), startup_filter([:0]), rowset=16
      access([T1.C1], [T1.C2]), partitions(p0)
      is_index_back=false, is_global_index=false, 
      range_key([T1.__pk_increment]), range(MIN ; MAX)always true
  2 - output([1]), filter(nil), rowset=16
      access(nil), partitions(p0)
      limit(1), offset(nil), is_index_back=false, is_global_index=false, 
      range_key([T2.C1]), range(MIN ; MAX)always true
select * from t1 where (select count(*) from t2) <= 0;
+------+------+
| C1   | C2   |
+------+------+
+------+------+
EXPLAIN select /*+no_rewrite*/* from t1 where (select count(*) from t2) <= 0;
Query Plan
===================================================
|ID|OPERATOR           |NAME|EST.ROWS|EST.TIME(us)|
---------------------------------------------------
|0 |SUBPLAN FILTER     |    |3       |5           |
|1 |├─TABLE FULL SCAN  |T1  |3       |3           |
|2 |└─SCALAR GROUP BY  |    |1       |3           |
|3 |  └─TABLE FULL SCAN|T2  |3       |3           |
===================================================
Outputs & filters:
-------------------------------------
  0 - output([T1.C1], [T1.C2]), filter(nil), rowset=16
      exec_params_(nil), onetime_exprs_([subquery(1)(:0)]), init_plan_idxs_(nil), use_batch=false
  1 - output([T1.C1], [T1.C2]), filter(nil), startup_filter([:0 <= 0]), rowset=16
      access([T1.C1], [T1.C2]), partitions(p0)
      is_index_back=false, is_global_index=false, 
      range_key([T1.__pk_increment]), range(MIN ; MAX)always true
  2 - output([T_FUN_COUNT_SUM(T_FUN_COUNT(*))]), filter(nil), rowset=16
      group(nil), agg_func([T_FUN_COUNT_SUM(T_FUN_COUNT(*))])
  3 - output([T_FUN_COUNT(*)]), filter(nil), rowset=16
      access(nil), partitions(p0)
      is_index_back=false, is_global_index=false, 
      range_key([T2.C1]), range(MIN ; MAX)always true, 
      pushdown_aggregation([T_FUN_COUNT(*)])
select /*+no_rewrite*/* from t1 where (select count(*) from t2) <= 0;
+------+------+
| C1   | C2   |
+------+------+
+------+------+

EXPLAIN select * from t1 where 0 >= (select count(*) from t2);
Query Plan
=================================================
|ID|OPERATOR         |NAME|EST.ROWS|EST.TIME(us)|
-------------------------------------------------
|0 |SUBPLAN FILTER   |    |3       |5           |
|1 |├─TABLE FULL SCAN|T1  |3       |3           |
|2 |└─TABLE FULL SCAN|T2  |1       |3           |
=================================================
Outputs & filters:
-------------------------------------
  0 - output([T1.C1], [T1.C2]), filter(nil), rowset=16
      exec_params_(nil), onetime_exprs_([(T_OP_NOT_EXISTS, subquery(1))(:0)]), init_plan_idxs_(nil), use_batch=false
  1 - output([T1.C1], [T1.C2]), filter(nil), startup_filter([:0]), rowset=16
      access([T1.C1], [T1.C2]), partitions(p0)
      is_index_back=false, is_global_index=false, 
      range_key([T1.__pk_increment]), range(MIN ; MAX)always true
  2 - output([1]), filter(nil), rowset=16
      access(nil), partitions(p0)
      limit(1), offset(nil), is_index_back=false, is_global_index=false, 
      range_key([T2.C1]), range(MIN ; MAX)always true
select * from t1 where 0 >= (select count(*) from t2);
+------+------+
| C1   | C2   |
+------+------+
+------+------+
EXPLAIN select /*+no_rewrite*/* from t1 where 0 >= (select count(*) from t2);
Query Plan
===================================================
|ID|OPERATOR           |NAME|EST.ROWS|EST.TIME(us)|
---------------------------------------------------
|0 |SUBPLAN FILTER     |    |3       |5           |
|1 |├─TABLE FULL SCAN  |T1  |3       |3           |
|2 |└─SCALAR GROUP BY  |    |1       |3           |
|3 |  └─TABLE FULL SCAN|T2  |3       |3           |
===================================================
Outputs & filters:
-------------------------------------
  0 - output([T1.C1], [T1.C2]), filter(nil), rowset=16
      exec_params_(nil), onetime_exprs_([subquery(1)(:0)]), init_plan_idxs_(nil), use_batch=false
  1 - output([T1.C1], [T1.C2]), filter(nil), startup_filter([0 >= :0]), rowset=16
      access([T1.C1], [T1.C2]), partitions(p0)
      is_index_back=false, is_global_index=false, 
      range_key([T1.__pk_increment]), range(MIN ; MAX)always true
  2 - output([T_FUN_COUNT_SUM(T_FUN_COUNT(*))]), filter(nil), rowset=16
      group(nil), agg_func([T_FUN_COUNT_SUM(T_FUN_COUNT(*))])
  3 - output([T_FUN_COUNT(*)]), filter(nil), rowset=16
      access(nil), partitions(p0)
      is_index_back=false, is_global_index=false, 
      range_key([T2.C1]), range(MIN ; MAX)always true, 
      pushdown_aggregation([T_FUN_COUNT(*)])
select /*+no_rewrite*/* from t1 where 0 >= (select count(*) from t2);
+------+------+
| C1   | C2   |
+------+------+
+------+------+

EXPLAIN select * from t1 where (select count(*) from t2) = 0;
Query Plan
=================================================
|ID|OPERATOR         |NAME|EST.ROWS|EST.TIME(us)|
-------------------------------------------------
|0 |SUBPLAN FILTER   |    |3       |5           |
|1 |├─TABLE FULL SCAN|T1  |3       |3           |
|2 |└─TABLE FULL SCAN|T2  |1       |3           |
=================================================
Outputs & filters:
-------------------------------------
  0 - output([T1.C1], [T1.C2]), filter(nil), rowset=16
      exec_params_(nil), onetime_exprs_([(T_OP_NOT_EXISTS, subquery(1))(:0)]), init_plan_idxs_(nil), use_batch=false
  1 - output([T1.C1], [T1.C2]), filter(nil), startup_filter([:0]), rowset=16
      access([T1.C1], [T1.C2]), partitions(p0)
      is_index_back=false, is_global_index=false, 
      range_key([T1.__pk_increment]), range(MIN ; MAX)always true
  2 - output([1]), filter(nil), rowset=16
      access(nil), partitions(p0)
      limit(1), offset(nil), is_index_back=false, is_global_index=false, 
      range_key([T2.C1]), range(MIN ; MAX)always true
select * from t1 where (select count(*) from t2) = 0;
+------+------+
| C1   | C2   |
+------+------+
+------+------+
EXPLAIN select /*+no_rewrite*/* from t1 where (select count(*) from t2) = 0;
Query Plan
===================================================
|ID|OPERATOR           |NAME|EST.ROWS|EST.TIME(us)|
---------------------------------------------------
|0 |SUBPLAN FILTER     |    |3       |5           |
|1 |├─TABLE FULL SCAN  |T1  |3       |3           |
|2 |└─SCALAR GROUP BY  |    |1       |3           |
|3 |  └─TABLE FULL SCAN|T2  |3       |3           |
===================================================
Outputs & filters:
-------------------------------------
  0 - output([T1.C1], [T1.C2]), filter(nil), rowset=16
      exec_params_(nil), onetime_exprs_([subquery(1)(:0)]), init_plan_idxs_(nil), use_batch=false
  1 - output([T1.C1], [T1.C2]), filter(nil), startup_filter([:0 = 0]), rowset=16
      access([T1.C1], [T1.C2]), partitions(p0)
      is_index_back=false, is_global_index=false, 
      range_key([T1.__pk_increment]), range(MIN ; MAX)always true
  2 - output([T_FUN_COUNT_SUM(T_FUN_COUNT(*))]), filter(nil), rowset=16
      group(nil), agg_func([T_FUN_COUNT_SUM(T_FUN_COUNT(*))])
  3 - output([T_FUN_COUNT(*)]), filter(nil), rowset=16
      access(nil), partitions(p0)
      is_index_back=false, is_global_index=false, 
      range_key([T2.C1]), range(MIN ; MAX)always true, 
      pushdown_aggregation([T_FUN_COUNT(*)])
select /*+no_rewrite*/* from t1 where (select count(*) from t2) = 0;
+------+------+
| C1   | C2   |
+------+------+
+------+------+

EXPLAIN select * from t1 where (select count(c1) from t2) = 0;
Query Plan
=================================================
|ID|OPERATOR         |NAME|EST.ROWS|EST.TIME(us)|
-------------------------------------------------
|0 |SUBPLAN FILTER   |    |3       |5           |
|1 |├─TABLE FULL SCAN|T1  |3       |3           |
|2 |└─TABLE FULL SCAN|T2  |1       |3           |
=================================================
Outputs & filters:
-------------------------------------
  0 - output([T1.C1], [T1.C2]), filter(nil), rowset=16
      exec_params_(nil), onetime_exprs_([(T_OP_NOT_EXISTS, subquery(1))(:0)]), init_plan_idxs_(nil), use_batch=false
  1 - output([T1.C1], [T1.C2]), filter(nil), startup_filter([:0]), rowset=16
      access([T1.C1], [T1.C2]), partitions(p0)
      is_index_back=false, is_global_index=false, 
      range_key([T1.__pk_increment]), range(MIN ; MAX)always true
  2 - output([1]), filter(nil), rowset=16
      access(nil), partitions(p0)
      limit(1), offset(nil), is_index_back=false, is_global_index=false, 
      range_key([T2.C1]), range(MIN ; MAX)always true
select * from t1 where (select count(c1) from t2) = 0;
+------+------+
| C1   | C2   |
+------+------+
+------+------+
EXPLAIN select /*+no_rewrite*/* from t1 where (select count(c1) from t2) = 0;
Query Plan
===================================================
|ID|OPERATOR           |NAME|EST.ROWS|EST.TIME(us)|
---------------------------------------------------
|0 |SUBPLAN FILTER     |    |3       |5           |
|1 |├─TABLE FULL SCAN  |T1  |3       |3           |
|2 |└─SCALAR GROUP BY  |    |1       |3           |
|3 |  └─TABLE FULL SCAN|T2  |3       |3           |
===================================================
Outputs & filters:
-------------------------------------
  0 - output([T1.C1], [T1.C2]), filter(nil), rowset=16
      exec_params_(nil), onetime_exprs_([subquery(1)(:0)]), init_plan_idxs_(nil), use_batch=false
  1 - output([T1.C1], [T1.C2]), filter(nil), startup_filter([:0 = 0]), rowset=16
      access([T1.C1], [T1.C2]), partitions(p0)
      is_index_back=false, is_global_index=false, 
      range_key([T1.__pk_increment]), range(MIN ; MAX)always true
  2 - output([T_FUN_COUNT_SUM(T_FUN_COUNT(T2.C1))]), filter(nil), rowset=16
      group(nil), agg_func([T_FUN_COUNT_SUM(T_FUN_COUNT(T2.C1))])
  3 - output([T_FUN_COUNT(T2.C1)]), filter(nil), rowset=16
      access([T2.C1]), partitions(p0)
      is_index_back=false, is_global_index=false, 
      range_key([T2.C1]), range(MIN ; MAX)always true, 
      pushdown_aggregation([T_FUN_COUNT(T2.C1)])
select /*+no_rewrite*/* from t1 where (select count(c1) from t2) = 0;
+------+------+
| C1   | C2   |
+------+------+
+------+------+

EXPLAIN select * from t1 where (select count(c1 + c2 + 1) from t2 where c1 > 1) = 0;
Query Plan
==================================================
|ID|OPERATOR          |NAME|EST.ROWS|EST.TIME(us)|
--------------------------------------------------
|0 |SUBPLAN FILTER    |    |3       |5           |
|1 |├─TABLE FULL SCAN |T1  |3       |3           |
|2 |└─TABLE RANGE SCAN|T2  |1       |3           |
==================================================
Outputs & filters:
-------------------------------------
  0 - output([T1.C1], [T1.C2]), filter(nil), rowset=16
      exec_params_(nil), onetime_exprs_([(T_OP_NOT_EXISTS, subquery(1))(:0)]), init_plan_idxs_(nil), use_batch=false
  1 - output([T1.C1], [T1.C2]), filter(nil), startup_filter([:0]), rowset=16
      access([T1.C1], [T1.C2]), partitions(p0)
      is_index_back=false, is_global_index=false, 
      range_key([T1.__pk_increment]), range(MIN ; MAX)always true
  2 - output([1]), filter([T2.C1 + T2.C2 + cast(1, NUMBER(-1, -85)) IS NOT NULL]), rowset=16
      access([T2.C1], [T2.C2]), partitions(p0)
      limit(1), offset(nil), is_index_back=false, is_global_index=false, filter_before_indexback[false], 
      range_key([T2.C1]), range(1 ; NULL), 
      range_cond([T2.C1 > 1])
select * from t1 where (select count(c1 + c2 + 1) from t2 where c1 > 1) = 0;
+------+------+
| C1   | C2   |
+------+------+
+------+------+
EXPLAIN select /*+no_rewrite*/* from t1 where (select count(c1 + c2 + 1) from t2 where c1 > 1) = 0;
Query Plan
====================================================
|ID|OPERATOR            |NAME|EST.ROWS|EST.TIME(us)|
----------------------------------------------------
|0 |SUBPLAN FILTER      |    |3       |5           |
|1 |├─TABLE FULL SCAN   |T1  |3       |3           |
|2 |└─SCALAR GROUP BY   |    |1       |3           |
|3 |  └─TABLE RANGE SCAN|T2  |2       |3           |
====================================================
Outputs & filters:
-------------------------------------
  0 - output([T1.C1], [T1.C2]), filter(nil), rowset=16
      exec_params_(nil), onetime_exprs_([subquery(1)(:0)]), init_plan_idxs_(nil), use_batch=false
  1 - output([T1.C1], [T1.C2]), filter(nil), startup_filter([:0 = 0]), rowset=16
      access([T1.C1], [T1.C2]), partitions(p0)
      is_index_back=false, is_global_index=false, 
      range_key([T1.__pk_increment]), range(MIN ; MAX)always true
  2 - output([T_FUN_COUNT(T2.C1 + T2.C2 + cast(1, NUMBER(-1, -85)))]), filter(nil), rowset=16
      group(nil), agg_func([T_FUN_COUNT(T2.C1 + T2.C2 + cast(1, NUMBER(-1, -85)))])
  3 - output([T2.C1], [T2.C2]), filter(nil), rowset=16
      access([T2.C1], [T2.C2]), partitions(p0)
      is_index_back=false, is_global_index=false, 
      range_key([T2.C1]), range(1 ; NULL), 
      range_cond([T2.C1 > 1])
select /*+no_rewrite*/* from t1 where (select count(c1 + c2 + 1) from t2 where c1 > 1) = 0;
+------+------+
| C1   | C2   |
+------+------+
+------+------+

EXPLAIN select * from t1 where 0 = (select count(*) from t2);
Query Plan
=================================================
|ID|OPERATOR         |NAME|EST.ROWS|EST.TIME(us)|
-------------------------------------------------
|0 |SUBPLAN FILTER   |    |3       |5           |
|1 |├─TABLE FULL SCAN|T1  |3       |3           |
|2 |└─TABLE FULL SCAN|T2  |1       |3           |
=================================================
Outputs & filters:
-------------------------------------
  0 - output([T1.C1], [T1.C2]), filter(nil), rowset=16
      exec_params_(nil), onetime_exprs_([(T_OP_NOT_EXISTS, subquery(1))(:0)]), init_plan_idxs_(nil), use_batch=false
  1 - output([T1.C1], [T1.C2]), filter(nil), startup_filter([:0]), rowset=16
      access([T1.C1], [T1.C2]), partitions(p0)
      is_index_back=false, is_global_index=false, 
      range_key([T1.__pk_increment]), range(MIN ; MAX)always true
  2 - output([1]), filter(nil), rowset=16
      access(nil), partitions(p0)
      limit(1), offset(nil), is_index_back=false, is_global_index=false, 
      range_key([T2.C1]), range(MIN ; MAX)always true
select * from t1 where 0 = (select count(*) from t2);
+------+------+
| C1   | C2   |
+------+------+
+------+------+
EXPLAIN select /*+no_rewrite*/* from t1 where 0 = (select count(*) from t2);
Query Plan
===================================================
|ID|OPERATOR           |NAME|EST.ROWS|EST.TIME(us)|
---------------------------------------------------
|0 |SUBPLAN FILTER     |    |3       |5           |
|1 |├─TABLE FULL SCAN  |T1  |3       |3           |
|2 |└─SCALAR GROUP BY  |    |1       |3           |
|3 |  └─TABLE FULL SCAN|T2  |3       |3           |
===================================================
Outputs & filters:
-------------------------------------
  0 - output([T1.C1], [T1.C2]), filter(nil), rowset=16
      exec_params_(nil), onetime_exprs_([subquery(1)(:0)]), init_plan_idxs_(nil), use_batch=false
  1 - output([T1.C1], [T1.C2]), filter(nil), startup_filter([0 = :0]), rowset=16
      access([T1.C1], [T1.C2]), partitions(p0)
      is_index_back=false, is_global_index=false, 
      range_key([T1.__pk_increment]), range(MIN ; MAX)always true
  2 - output([T_FUN_COUNT_SUM(T_FUN_COUNT(*))]), filter(nil), rowset=16
      group(nil), agg_func([T_FUN_COUNT_SUM(T_FUN_COUNT(*))])
  3 - output([T_FUN_COUNT(*)]), filter(nil), rowset=16
      access(nil), partitions(p0)
      is_index_back=false, is_global_index=false, 
      range_key([T2.C1]), range(MIN ; MAX)always true, 
      pushdown_aggregation([T_FUN_COUNT(*)])
select /*+no_rewrite*/* from t1 where 0 = (select count(*) from t2);
+------+------+
| C1   | C2   |
+------+------+
+------+------+

EXPLAIN select * from t1 where (select count(*) from t2 where t1.c1 = t2.c1) = 0;
Query Plan
=====================================================
|ID|OPERATOR             |NAME|EST.ROWS|EST.TIME(us)|
-----------------------------------------------------
|0 |HASH RIGHT ANTI JOIN |    |1       |6           |
|1 |├─TABLE FULL SCAN    |T2  |3       |3           |
|2 |└─TABLE FULL SCAN    |T1  |3       |3           |
=====================================================
Outputs & filters:
-------------------------------------
  0 - output([T1.C1], [T1.C2]), filter(nil), rowset=16
      equal_conds([T1.C1 = T2.C1]), other_conds(nil)
  1 - output([T2.C1]), filter(nil), rowset=16
      access([T2.C1]), partitions(p0)
      is_index_back=false, is_global_index=false, 
      range_key([T2.C1]), range(MIN ; MAX)always true
  2 - output([T1.C1], [T1.C2]), filter(nil), rowset=16
      access([T1.C1], [T1.C2]), partitions(p0)
      is_index_back=false, is_global_index=false, 
      range_key([T1.__pk_increment]), range(MIN ; MAX)always true
select * from t1 where (select count(*) from t2 where t1.c1 = t2.c1) = 0;
+------+------+
| C1   | C2   |
+------+------+
| NULL | NULL |
+------+------+
EXPLAIN select /*+no_rewrite*/* from t1 where (select count(*) from t2 where t1.c1 = t2.c1) = 0;
Query Plan
=================================================
|ID|OPERATOR         |NAME|EST.ROWS|EST.TIME(us)|
-------------------------------------------------
|0 |SUBPLAN FILTER   |    |2       |57          |
|1 |├─TABLE FULL SCAN|T1  |3       |3           |
|2 |└─SCALAR GROUP BY|    |1       |18          |
|3 |  └─TABLE GET    |T2  |1       |18          |
=================================================
Outputs & filters:
-------------------------------------
  0 - output([T1.C1], [T1.C2]), filter([subquery(1) = 0]), rowset=16
      exec_params_([T1.C1(:0)]), onetime_exprs_(nil), init_plan_idxs_(nil), use_batch=false
  1 - output([T1.C1], [T1.C2]), filter(nil), rowset=16
      access([T1.C1], [T1.C2]), partitions(p0)
      is_index_back=false, is_global_index=false, 
      range_key([T1.__pk_increment]), range(MIN ; MAX)always true
  2 - output([T_FUN_COUNT(*)]), filter(nil), rowset=16
      group(nil), agg_func([T_FUN_COUNT(*)])
  3 - output(nil), filter(nil), rowset=16
      access(nil), partitions(p0)
      is_index_back=false, is_global_index=false, 
      range_key([T2.C1]), range(MIN ; MAX)always true, 
      range_cond([:0 = T2.C1])
select /*+no_rewrite*/* from t1 where (select count(*) from t2 where t1.c1 = t2.c1) = 0;
+------+------+
| C1   | C2   |
+------+------+
| NULL | NULL |
+------+------+

EXPLAIN select * from t1 where (select count(*) from t2 where t1.c1 = t2.c1) = 0 and (select count(*) from t3 where t1.c1 = t3.c1) > 0;
Query Plan
=====================================================================
|ID|OPERATOR                         |NAME    |EST.ROWS|EST.TIME(us)|
---------------------------------------------------------------------
|0 |PX COORDINATOR                   |        |1       |18          |
|1 |└─EXCHANGE OUT DISTR             |:EX10001|1       |18          |
|2 |  └─HASH SEMI JOIN               |        |1       |17          |
|3 |    ├─EXCHANGE IN DISTR          |        |1       |8           |
|4 |    │ └─EXCHANGE OUT DISTR (PKEY)|:EX10000|1       |7           |
|5 |    │   └─MERGE ANTI JOIN        |        |1       |6           |
|6 |    │     ├─SORT                 |        |3       |3           |
|7 |    │     │ └─TABLE FULL SCAN    |T1      |3       |3           |
|8 |    │     └─TABLE FULL SCAN      |T2      |3       |3           |
|9 |    └─PX PARTITION ITERATOR      |        |3       |9           |
|10|      └─TABLE FULL SCAN          |T3      |3       |9           |
=====================================================================
Outputs & filters:
-------------------------------------
  0 - output([INTERNAL_FUNCTION(T1.C1, T1.C2)]), filter(nil), rowset=16
  1 - output([INTERNAL_FUNCTION(T1.C1, T1.C2)]), filter(nil), rowset=16
      dop=1
  2 - output([T1.C1], [T1.C2]), filter(nil), rowset=16
      equal_conds([T1.C1 = T3.C1]), other_conds(nil)
  3 - output([T1.C1], [T1.C2]), filter(nil), rowset=16
  4 - output([T1.C1], [T1.C2]), filter(nil), rowset=16
      (#keys=1, [T1.C1]), is_single, dop=1
  5 - output([T1.C1], [T1.C2]), filter(nil), rowset=16
      equal_conds([T1.C1 = T2.C1]), other_conds(nil)
      merge_directions([ASC])
  6 - output([T1.C1], [T1.C2]), filter(nil), rowset=16
      sort_keys([T1.C1, ASC])
  7 - output([T1.C1], [T1.C2]), filter(nil), rowset=16
      access([T1.C1], [T1.C2]), partitions(p0)
      is_index_back=false, is_global_index=false, 
      range_key([T1.__pk_increment]), range(MIN ; MAX)always true
  8 - output([T2.C1]), filter(nil), rowset=16
      access([T2.C1]), partitions(p0)
      is_index_back=false, is_global_index=false, 
      range_key([T2.C1]), range(MIN ; MAX)always true
  9 - output([T3.C1]), filter(nil), rowset=16
      affinitize, force partition granule
 10 - output([T3.C1]), filter(nil), rowset=16
      access([T3.C1]), partitions(p[0-3])
      is_index_back=false, is_global_index=false, 
      range_key([T3.__pk_increment]), range(MIN ; MAX)always true
select * from t1 where (select count(*) from t2 where t1.c1 = t2.c1) = 0 and (select count(*) from t3 where t1.c1 = t3.c1) > 0;
+------+------+
| C1   | C2   |
+------+------+
+------+------+
EXPLAIN select /*+no_rewrite*/* from t1 where (select count(*) from t2 where t1.c1 = t2.c1) = 0 and (select count(*) from t3 where t1.c1 = t3.c1) > 0;
Query Plan
===============================================================
|ID|OPERATOR                       |NAME|EST.ROWS|EST.TIME(us)|
---------------------------------------------------------------
|0 |SUBPLAN FILTER                 |    |1       |272         |
|1 |├─TABLE FULL SCAN              |T1  |3       |3           |
|2 |├─SCALAR GROUP BY              |    |1       |18          |
|3 |│ └─DISTRIBUTED TABLE GET      |T2  |1       |18          |
|4 |└─SCALAR GROUP BY              |    |1       |72          |
|5 |  └─DISTRIBUTED TABLE FULL SCAN|T3  |1       |72          |
===============================================================
Outputs & filters:
-------------------------------------
  0 - output([T1.C1], [T1.C2]), filter([subquery(2) > 0], [subquery(1) = 0]), rowset=16
      exec_params_([T1.C1(:0)], [T1.C1(:1)]), onetime_exprs_(nil), init_plan_idxs_(nil), use_batch=false
  1 - output([T1.C1], [T1.C2]), filter(nil), rowset=16
      access([T1.C1], [T1.C2]), partitions(p0)
      is_index_back=false, is_global_index=false, 
      range_key([T1.__pk_increment]), range(MIN ; MAX)always true
  2 - output([T_FUN_COUNT(*)]), filter(nil), rowset=16
      group(nil), agg_func([T_FUN_COUNT(*)])
  3 - output(nil), filter(nil), rowset=16
      access(nil), partitions(p0)
      is_index_back=false, is_global_index=false, 
      range_key([T2.C1]), range(MIN ; MAX)always true, 
      range_cond([:0 = T2.C1])
  4 - output([T_FUN_COUNT_SUM(T_FUN_COUNT(*))]), filter(nil), rowset=16
      group(nil), agg_func([T_FUN_COUNT_SUM(T_FUN_COUNT(*))])
  5 - output([T_FUN_COUNT(*)]), filter([:1 = T3.C1]), rowset=16
      access([T3.C1]), partitions(p[0-3])
      is_index_back=false, is_global_index=false, filter_before_indexback[false], 
      range_key([T3.__pk_increment]), range(MIN ; MAX)always true, 
      pushdown_aggregation([T_FUN_COUNT(*)])
select /*+no_rewrite*/* from t1 where (select count(*) from t2 where t1.c1 = t2.c1) = 0 and (select count(*) from t3 where t1.c1 = t3.c1) > 0;
+------+------+
| C1   | C2   |
+------+------+
+------+------+

EXPLAIN select * from t1 left join t2 on t1.c1 = t2.c1 where (select count(*) from t3 where t1.c1 = t3.c1 and t2.c1 = t3.c1) = 0;
Query Plan
=====================================================================
|ID|OPERATOR                         |NAME    |EST.ROWS|EST.TIME(us)|
---------------------------------------------------------------------
|0 |PX COORDINATOR                   |        |2       |33          |
|1 |└─EXCHANGE OUT DISTR             |:EX10001|2       |31          |
|2 |  └─HASH RIGHT ANTI JOIN         |        |2       |27          |
|3 |    ├─PX PARTITION ITERATOR      |        |3       |9           |
|4 |    │ └─TABLE FULL SCAN          |T3      |3       |9           |
|5 |    └─EXCHANGE IN DISTR          |        |3       |17          |
|6 |      └─EXCHANGE OUT DISTR (PKEY)|:EX10000|3       |14          |
|7 |        └─MERGE OUTER JOIN       |        |3       |6           |
|8 |          ├─SORT                 |        |3       |3           |
|9 |          │ └─TABLE FULL SCAN    |T1      |3       |3           |
|10|          └─TABLE FULL SCAN      |T2      |3       |3           |
=====================================================================
Outputs & filters:
-------------------------------------
  0 - output([INTERNAL_FUNCTION(T1.C1, T1.C2, T2.C1, T2.C2)]), filter(nil), rowset=16
  1 - output([INTERNAL_FUNCTION(T1.C1, T1.C2, T2.C1, T2.C2)]), filter(nil), rowset=16
      dop=1
  2 - output([T1.C1], [T2.C1], [T1.C2], [T2.C2]), filter(nil), rowset=16
      equal_conds([T1.C1 = T3.C1], [T2.C1 = T3.C1]), other_conds(nil)
  3 - output([T3.C1]), filter(nil), rowset=16
      affinitize, force partition granule
  4 - output([T3.C1]), filter(nil), rowset=16
      access([T3.C1]), partitions(p[0-3])
      is_index_back=false, is_global_index=false, 
      range_key([T3.__pk_increment]), range(MIN ; MAX)always true
  5 - output([T1.C1], [T2.C1], [T1.C2], [T2.C2]), filter(nil), rowset=16
  6 - output([T1.C1], [T2.C1], [T1.C2], [T2.C2]), filter(nil), rowset=16
      (#keys=1, [T1.C1]), is_single, dop=1
  7 - output([T1.C1], [T2.C1], [T1.C2], [T2.C2]), filter(nil), rowset=16
      equal_conds([T1.C1 = T2.C1]), other_conds(nil)
      merge_directions([ASC])
  8 - output([T1.C1], [T1.C2]), filter(nil), rowset=16
      sort_keys([T1.C1, ASC])
  9 - output([T1.C1], [T1.C2]), filter(nil), rowset=16
      access([T1.C1], [T1.C2]), partitions(p0)
      is_index_back=false, is_global_index=false, 
      range_key([T1.__pk_increment]), range(MIN ; MAX)always true
 10 - output([T2.C1], [T2.C2]), filter(nil), rowset=16
      access([T2.C1], [T2.C2]), partitions(p0)
      is_index_back=false, is_global_index=false, 
      range_key([T2.C1]), range(MIN ; MAX)always true
select * from t1 left join t2 on t1.c1 = t2.c1 where (select count(*) from t3 where t1.c1 = t3.c1 and t2.c1 = t3.c1) = 0;
+------+------+----+------+
| C1   | C2   | C1 | C2   |
+------+------+----+------+
|    3 |    3 |  3 |    4 |
| NULL | NULL | NULL | NULL |
+------+------+----+------+
EXPLAIN select /*+no_rewrite*/* from t1 left join t2 on t1.c1 = t2.c1 where (select count(*) from t3 where t1.c1 = t3.c1 and t2.c1 = t3.c1) = 0;
Query Plan
===============================================================
|ID|OPERATOR                       |NAME|EST.ROWS|EST.TIME(us)|
---------------------------------------------------------------
|0 |SUBPLAN FILTER                 |    |1       |221         |
|1 |├─MERGE RIGHT OUTER JOIN       |    |3       |6           |
|2 |│ ├─TABLE FULL SCAN            |T2  |3       |3           |
|3 |│ └─SORT                       |    |3       |3           |
|4 |│   └─TABLE FULL SCAN          |T1  |3       |3           |
|5 |└─SCALAR GROUP BY              |    |1       |72          |
|6 |  └─DISTRIBUTED TABLE FULL SCAN|T3  |1       |72          |
===============================================================
Outputs & filters:
-------------------------------------
  0 - output([T1.C1], [T1.C2], [T2.C1], [T2.C2]), filter([subquery(1) = 0]), rowset=16
      exec_params_([T1.C1(:0)], [T2.C1(:1)]), onetime_exprs_(nil), init_plan_idxs_(nil), use_batch=false
  1 - output([T1.C1], [T2.C1], [T1.C2], [T2.C2]), filter(nil), rowset=16
      equal_conds([T1.C1 = T2.C1]), other_conds(nil)
      merge_directions([ASC])
  2 - output([T2.C1], [T2.C2]), filter(nil), rowset=16
      access([T2.C1], [T2.C2]), partitions(p0)
      is_index_back=false, is_global_index=false, 
      range_key([T2.C1]), range(MIN ; MAX)always true
  3 - output([T1.C1], [T1.C2]), filter(nil), rowset=16
      sort_keys([T1.C1, ASC])
  4 - output([T1.C1], [T1.C2]), filter(nil), rowset=16
      access([T1.C1], [T1.C2]), partitions(p0)
      is_index_back=false, is_global_index=false, 
      range_key([T1.__pk_increment]), range(MIN ; MAX)always true
  5 - output([T_FUN_COUNT_SUM(T_FUN_COUNT(*))]), filter(nil), rowset=16
      group(nil), agg_func([T_FUN_COUNT_SUM(T_FUN_COUNT(*))])
  6 - output([T_FUN_COUNT(*)]), filter([:0 = T3.C1], [:1 = T3.C1]), startup_filter([:0 = :1]), rowset=16
      access([T3.C1]), partitions(p[0-3])
      is_index_back=false, is_global_index=false, filter_before_indexback[false,false], 
      range_key([T3.__pk_increment]), range(MIN ; MAX)always true, 
      pushdown_aggregation([T_FUN_COUNT(*)])
select /*+no_rewrite*/* from t1 left join t2 on t1.c1 = t2.c1 where (select count(*) from t3 where t1.c1 = t3.c1 and t2.c1 = t3.c1) = 0;
+------+------+----+------+
| C1   | C2   | C1 | C2   |
+------+------+----+------+
|    3 |    3 |  3 |    4 |
| NULL | NULL | NULL | NULL |
+------+------+----+------+

EXPLAIN select * from t1 left join t2 on t1.c1 = t2.c1 where (select count(*) from t3 where t1.c1 = t3.c1 or t2.c1 = t3.c1) = 0;
Query Plan
=================================================================
|ID|OPERATOR                     |NAME    |EST.ROWS|EST.TIME(us)|
-----------------------------------------------------------------
|0 |NESTED-LOOP ANTI JOIN        |        |1       |17          |
|1 |├─MERGE RIGHT OUTER JOIN     |        |3       |6           |
|2 |│ ├─TABLE FULL SCAN          |T2      |3       |3           |
|3 |│ └─SORT                     |        |3       |3           |
|4 |│   └─TABLE FULL SCAN        |T1      |3       |3           |
|5 |└─MATERIAL                   |        |3       |12          |
|6 |  └─PX COORDINATOR           |        |3       |12          |
|7 |    └─EXCHANGE OUT DISTR     |:EX10000|3       |11          |
|8 |      └─PX PARTITION ITERATOR|        |3       |9           |
|9 |        └─TABLE FULL SCAN    |T3      |3       |9           |
=================================================================
Outputs & filters:
-------------------------------------
  0 - output([T1.C1], [T1.C2], [T2.C1], [T2.C2]), filter(nil), rowset=16
      conds([T1.C1 = T3.C1 OR T2.C1 = T3.C1]), nl_params_(nil), use_batch=false
  1 - output([T1.C1], [T1.C2], [T2.C1], [T2.C2]), filter(nil), rowset=16
      equal_conds([T1.C1 = T2.C1]), other_conds(nil)
      merge_directions([ASC])
  2 - output([T2.C1], [T2.C2]), filter(nil), rowset=16
      access([T2.C1], [T2.C2]), partitions(p0)
      is_index_back=false, is_global_index=false, 
      range_key([T2.C1]), range(MIN ; MAX)always true
  3 - output([T1.C1], [T1.C2]), filter(nil), rowset=16
      sort_keys([T1.C1, ASC])
  4 - output([T1.C1], [T1.C2]), filter(nil), rowset=16
      access([T1.C1], [T1.C2]), partitions(p0)
      is_index_back=false, is_global_index=false, 
      range_key([T1.__pk_increment]), range(MIN ; MAX)always true
  5 - output([T3.C1]), filter(nil), rowset=16
  6 - output([T3.C1]), filter(nil), rowset=16
  7 - output([T3.C1]), filter(nil), rowset=16
      dop=1
  8 - output([T3.C1]), filter(nil), rowset=16
      force partition granule
  9 - output([T3.C1]), filter(nil), rowset=16
      access([T3.C1]), partitions(p[0-3])
      is_index_back=false, is_global_index=false, 
      range_key([T3.__pk_increment]), range(MIN ; MAX)always true
select * from t1 left join t2 on t1.c1 = t2.c1 where (select count(*) from t3 where t1.c1 = t3.c1 or t2.c1 = t3.c1) = 0;
+------+------+----+------+
| C1   | C2   | C1 | C2   |
+------+------+----+------+
|    3 |    3 |  3 |    4 |
| NULL | NULL | NULL | NULL |
+------+------+----+------+
EXPLAIN select /*+no_rewrite*/* from t1 left join t2 on t1.c1 = t2.c1 where (select count(*) from t3 where t1.c1 = t3.c1 or t2.c1 = t3.c1) = 0;
Query Plan
===============================================================
|ID|OPERATOR                       |NAME|EST.ROWS|EST.TIME(us)|
---------------------------------------------------------------
|0 |SUBPLAN FILTER                 |    |1       |221         |
|1 |├─MERGE RIGHT OUTER JOIN       |    |3       |6           |
|2 |│ ├─TABLE FULL SCAN            |T2  |3       |3           |
|3 |│ └─SORT                       |    |3       |3           |
|4 |│   └─TABLE FULL SCAN          |T1  |3       |3           |
|5 |└─SCALAR GROUP BY              |    |1       |72          |
|6 |  └─DISTRIBUTED TABLE FULL SCAN|T3  |2       |72          |
===============================================================
Outputs & filters:
-------------------------------------
  0 - output([T1.C1], [T1.C2], [T2.C1], [T2.C2]), filter([subquery(1) = 0]), rowset=16
      exec_params_([T1.C1(:0)], [T2.C1(:1)]), onetime_exprs_(nil), init_plan_idxs_(nil), use_batch=false
  1 - output([T1.C1], [T2.C1], [T1.C2], [T2.C2]), filter(nil), rowset=16
      equal_conds([T1.C1 = T2.C1]), other_conds(nil)
      merge_directions([ASC])
  2 - output([T2.C1], [T2.C2]), filter(nil), rowset=16
      access([T2.C1], [T2.C2]), partitions(p0)
      is_index_back=false, is_global_index=false, 
      range_key([T2.C1]), range(MIN ; MAX)always true
  3 - output([T1.C1], [T1.C2]), filter(nil), rowset=16
      sort_keys([T1.C1, ASC])
  4 - output([T1.C1], [T1.C2]), filter(nil), rowset=16
      access([T1.C1], [T1.C2]), partitions(p0)
      is_index_back=false, is_global_index=false, 
      range_key([T1.__pk_increment]), range(MIN ; MAX)always true
  5 - output([T_FUN_COUNT_SUM(T_FUN_COUNT(*))]), filter(nil), rowset=16
      group(nil), agg_func([T_FUN_COUNT_SUM(T_FUN_COUNT(*))])
  6 - output([T_FUN_COUNT(*)]), filter([:0 = T3.C1 OR :1 = T3.C1]), rowset=16
      access([T3.C1]), partitions(p[0-3])
      is_index_back=false, is_global_index=false, filter_before_indexback[false], 
      range_key([T3.__pk_increment]), range(MIN ; MAX)always true, 
      pushdown_aggregation([T_FUN_COUNT(*)])
select /*+no_rewrite*/* from t1 left join t2 on t1.c1 = t2.c1 where (select count(*) from t3 where t1.c1 = t3.c1 or t2.c1 = t3.c1) = 0;
+------+------+----+------+
| C1   | C2   | C1 | C2   |
+------+------+----+------+
|    3 |    3 |  3 |    4 |
| NULL | NULL | NULL | NULL |
+------+------+----+------+

EXPLAIN select * from t1, t2 where t1.c1 = t2.c1 and (select count(*) from t3 where t3.c1 = t2.c1 and t3.c1 = t1.c1) = 0;
Query Plan
=====================================================================
|ID|OPERATOR                         |NAME    |EST.ROWS|EST.TIME(us)|
---------------------------------------------------------------------
|0 |PX COORDINATOR                   |        |1       |23          |
|1 |└─EXCHANGE OUT DISTR             |:EX10001|1       |23          |
|2 |  └─HASH RIGHT ANTI JOIN         |        |1       |23          |
|3 |    ├─PX PARTITION ITERATOR      |        |3       |9           |
|4 |    │ └─TABLE FULL SCAN          |T3      |3       |9           |
|5 |    └─EXCHANGE IN DISTR          |        |2       |13          |
|6 |      └─EXCHANGE OUT DISTR (PKEY)|:EX10000|2       |11          |
|7 |        └─MERGE JOIN             |        |2       |6           |
|8 |          ├─SORT                 |        |3       |3           |
|9 |          │ └─TABLE FULL SCAN    |T1      |3       |3           |
|10|          └─TABLE FULL SCAN      |T2      |3       |3           |
=====================================================================
Outputs & filters:
-------------------------------------
  0 - output([INTERNAL_FUNCTION(T1.C1, T1.C2, T2.C1, T2.C2)]), filter(nil), rowset=16
  1 - output([INTERNAL_FUNCTION(T1.C1, T1.C2, T2.C1, T2.C2)]), filter(nil), rowset=16
      dop=1
  2 - output([T1.C1], [T2.C1], [T1.C2], [T2.C2]), filter(nil), rowset=16
      equal_conds([T3.C1 = T1.C1]), other_conds(nil)
  3 - output([T3.C1]), filter(nil), rowset=16
      affinitize, force partition granule
  4 - output([T3.C1]), filter(nil), rowset=16
      access([T3.C1]), partitions(p[0-3])
      is_index_back=false, is_global_index=false, 
      range_key([T3.__pk_increment]), range(MIN ; MAX)always true
  5 - output([T1.C1], [T2.C1], [T1.C2], [T2.C2]), filter(nil), rowset=16
  6 - output([T1.C1], [T2.C1], [T1.C2], [T2.C2]), filter(nil), rowset=16
      (#keys=1, [T1.C1]), is_single, dop=1
  7 - output([T1.C1], [T2.C1], [T1.C2], [T2.C2]), filter(nil), rowset=16
      equal_conds([T1.C1 = T2.C1]), other_conds(nil)
      merge_directions([ASC])
  8 - output([T1.C1], [T1.C2]), filter(nil), rowset=16
      sort_keys([T1.C1, ASC])
  9 - output([T1.C1], [T1.C2]), filter(nil), rowset=16
      access([T1.C1], [T1.C2]), partitions(p0)
      is_index_back=false, is_global_index=false, 
      range_key([T1.__pk_increment]), range(MIN ; MAX)always true
 10 - output([T2.C1], [T2.C2]), filter(nil), rowset=16
      access([T2.C1], [T2.C2]), partitions(p0)
      is_index_back=false, is_global_index=false, 
      range_key([T2.C1]), range(MIN ; MAX)always true
select * from t1, t2 where t1.c1 = t2.c1 and (select count(*) from t3 where t3.c1 = t2.c1 and t3.c1 = t1.c1) = 0;
+------+------+----+------+
| C1   | C2   | C1 | C2   |
+------+------+----+------+
|    3 |    3 |  3 |    4 |
+------+------+----+------+
EXPLAIN select /*+no_rewrite*/* from t1, t2 where t1.c1 = t2.c1 and (select count(*) from t3 where t3.c1 = t2.c1 and t3.c1 = t1.c1) = 0;
Query Plan
===============================================================
|ID|OPERATOR                       |NAME|EST.ROWS|EST.TIME(us)|
---------------------------------------------------------------
|0 |SUBPLAN FILTER                 |    |2       |149         |
|1 |├─MERGE JOIN                   |    |2       |6           |
|2 |│ ├─TABLE FULL SCAN            |T2  |3       |3           |
|3 |│ └─SORT                       |    |3       |3           |
|4 |│   └─TABLE FULL SCAN          |T1  |3       |3           |
|5 |└─SCALAR GROUP BY              |    |1       |72          |
|6 |  └─DISTRIBUTED TABLE FULL SCAN|T3  |1       |72          |
===============================================================
Outputs & filters:
-------------------------------------
  0 - output([T1.C1], [T1.C2], [T2.C1], [T2.C2]), filter([subquery(1) = 0]), rowset=16
      exec_params_([T2.C1(:0)], [T1.C1(:1)]), onetime_exprs_(nil), init_plan_idxs_(nil), use_batch=false
  1 - output([T2.C1], [T1.C1], [T1.C2], [T2.C2]), filter(nil), rowset=16
      equal_conds([T1.C1 = T2.C1]), other_conds(nil)
      merge_directions([ASC])
  2 - output([T2.C1], [T2.C2]), filter(nil), rowset=16
      access([T2.C1], [T2.C2]), partitions(p0)
      is_index_back=false, is_global_index=false, 
      range_key([T2.C1]), range(MIN ; MAX)always true
  3 - output([T1.C1], [T1.C2]), filter(nil), rowset=16
      sort_keys([T1.C1, ASC])
  4 - output([T1.C1], [T1.C2]), filter(nil), rowset=16
      access([T1.C1], [T1.C2]), partitions(p0)
      is_index_back=false, is_global_index=false, 
      range_key([T1.__pk_increment]), range(MIN ; MAX)always true
  5 - output([T_FUN_COUNT_SUM(T_FUN_COUNT(*))]), filter(nil), rowset=16
      group(nil), agg_func([T_FUN_COUNT_SUM(T_FUN_COUNT(*))])
  6 - output([T_FUN_COUNT(*)]), filter([T3.C1 = :0], [T3.C1 = :1]), rowset=16
      access([T3.C1]), partitions(p[0-3])
      is_index_back=false, is_global_index=false, filter_before_indexback[false,false], 
      range_key([T3.__pk_increment]), range(MIN ; MAX)always true, 
      pushdown_aggregation([T_FUN_COUNT(*)])
select /*+no_rewrite*/* from t1, t2 where t1.c1 = t2.c1 and (select count(*) from t3 where t3.c1 = t2.c1 and t3.c1 = t1.c1) = 0;
+------+------+----+------+
| C1   | C2   | C1 | C2   |
+------+------+----+------+
|    3 |    3 |  3 |    4 |
+------+------+----+------+

EXPLAIN select * from t1 where (select count(*) from t2 where (select count(*) from t3) = 0) > 0;
Query Plan
=======================================================================
|ID|OPERATOR                           |NAME    |EST.ROWS|EST.TIME(us)|
-----------------------------------------------------------------------
|0 |SUBPLAN FILTER                     |        |3       |13          |
|1 |├─TABLE FULL SCAN                  |T1      |3       |3           |
|2 |└─LIMIT                            |        |1       |11          |
|3 |  └─SUBPLAN FILTER                 |        |1       |11          |
|4 |    ├─TABLE FULL SCAN              |T2      |1       |3           |
|5 |    └─LIMIT                        |        |1       |9           |
|6 |      └─PX COORDINATOR             |        |1       |9           |
|7 |        └─EXCHANGE OUT DISTR       |:EX10000|1       |9           |
|8 |          └─LIMIT                  |        |1       |9           |
|9 |            └─PX PARTITION ITERATOR|        |1       |9           |
|10|              └─TABLE FULL SCAN    |T3      |1       |9           |
=======================================================================
Outputs & filters:
-------------------------------------
  0 - output([T1.C1], [T1.C2]), filter(nil), rowset=16
      exec_params_(nil), onetime_exprs_([(T_OP_EXISTS, subquery(1))(:0)]), init_plan_idxs_(nil), use_batch=false
  1 - output([T1.C1], [T1.C2]), filter(nil), startup_filter([:0]), rowset=16
      access([T1.C1], [T1.C2]), partitions(p0)
      is_index_back=false, is_global_index=false, 
      range_key([T1.__pk_increment]), range(MIN ; MAX)always true
  2 - output([1]), filter(nil), rowset=16
      limit(1), offset(nil)
  3 - output(nil), filter(nil), rowset=16
      exec_params_(nil), onetime_exprs_([(T_OP_NOT_EXISTS, subquery(1))(:1)]), init_plan_idxs_(nil), use_batch=false
  4 - output(nil), filter(nil), startup_filter([:1]), rowset=16
      access(nil), partitions(p0)
      is_index_back=false, is_global_index=false, 
      range_key([T2.C1]), range(MIN ; MAX)always true
  5 - output([1]), filter(nil), rowset=16
      limit(1), offset(nil)
  6 - output(nil), filter(nil), rowset=16
  7 - output(nil), filter(nil), rowset=16
      dop=1
  8 - output(nil), filter(nil), rowset=16
      limit(1), offset(nil)
  9 - output(nil), filter(nil), rowset=16
      force partition granule
 10 - output(nil), filter(nil), rowset=16
      access(nil), partitions(p[0-3])
      limit(1), offset(nil), is_index_back=false, is_global_index=false, 
      range_key([T3.__pk_increment]), range(MIN ; MAX)always true
select * from t1 where (select count(*) from t2 where (select count(*) from t3) = 0) > 0;
+------+------+
| C1   | C2   |
+------+------+
+------+------+
EXPLAIN select /*+no_rewrite*/* from t1 where (select /*+no_rewrite*/count(*) from t2 where (select count(*) from t3) = 0) > 0;
Query Plan
=======================================================================
|ID|OPERATOR                           |NAME    |EST.ROWS|EST.TIME(us)|
-----------------------------------------------------------------------
|0 |SUBPLAN FILTER                     |        |3       |14          |
|1 |├─TABLE FULL SCAN                  |T1      |3       |3           |
|2 |└─SCALAR GROUP BY                  |        |1       |12          |
|3 |  └─SUBPLAN FILTER                 |        |3       |12          |
|4 |    ├─TABLE FULL SCAN              |T2      |3       |3           |
|5 |    └─SCALAR GROUP BY              |        |1       |10          |
|6 |      └─PX COORDINATOR             |        |1       |10          |
|7 |        └─EXCHANGE OUT DISTR       |:EX10000|1       |10          |
|8 |          └─MERGE GROUP BY         |        |1       |9           |
|9 |            └─PX PARTITION ITERATOR|        |3       |9           |
|10|              └─TABLE FULL SCAN    |T3      |3       |9           |
=======================================================================
Outputs & filters:
-------------------------------------
  0 - output([T1.C1], [T1.C2]), filter(nil), rowset=16
      exec_params_(nil), onetime_exprs_([subquery(1)(:0)]), init_plan_idxs_(nil), use_batch=false
  1 - output([T1.C1], [T1.C2]), filter(nil), startup_filter([:0 > 0]), rowset=16
      access([T1.C1], [T1.C2]), partitions(p0)
      is_index_back=false, is_global_index=false, 
      range_key([T1.__pk_increment]), range(MIN ; MAX)always true
  2 - output([T_FUN_COUNT(*)]), filter(nil), rowset=16
      group(nil), agg_func([T_FUN_COUNT(*)])
  3 - output(nil), filter(nil), rowset=16
      exec_params_(nil), onetime_exprs_([subquery(1)(:1)]), init_plan_idxs_(nil), use_batch=false
  4 - output(nil), filter(nil), startup_filter([:1 = 0]), rowset=16
      access(nil), partitions(p0)
      is_index_back=false, is_global_index=false, 
      range_key([T2.C1]), range(MIN ; MAX)always true
  5 - output([T_FUN_COUNT_SUM(T_FUN_COUNT_SUM(T_FUN_COUNT(*)))]), filter(nil), rowset=16
      group(nil), agg_func([T_FUN_COUNT_SUM(T_FUN_COUNT_SUM(T_FUN_COUNT(*)))])
  6 - output([T_FUN_COUNT_SUM(T_FUN_COUNT(*))]), filter(nil), rowset=16
  7 - output([T_FUN_COUNT_SUM(T_FUN_COUNT(*))]), filter(nil), rowset=16
      dop=1
  8 - output([T_FUN_COUNT_SUM(T_FUN_COUNT(*))]), filter(nil), rowset=16
      group(nil), agg_func([T_FUN_COUNT_SUM(T_FUN_COUNT(*))])
  9 - output([T_FUN_COUNT(*)]), filter(nil), rowset=16
      force partition granule
 10 - output([T_FUN_COUNT(*)]), filter(nil), rowset=16
      access(nil), partitions(p[0-3])
      is_index_back=false, is_global_index=false, 
      range_key([T3.__pk_increment]), range(MIN ; MAX)always true, 
      pushdown_aggregation([T_FUN_COUNT(*)])
select /*+no_rewrite*/* from t1 where (select /*+no_rewrite*/count(*) from t2 where (select count(*) from t3) = 0) > 0;
+------+------+
| C1   | C2   |
+------+------+
+------+------+

EXPLAIN select * from t1 where (select count(*) from t2 where (select count(*) from t3) != 0) > 0;
Query Plan
=========================================================================
|ID|OPERATOR                             |NAME    |EST.ROWS|EST.TIME(us)|
-------------------------------------------------------------------------
|0 |SUBPLAN FILTER                       |        |3       |15          |
|1 |├─TABLE FULL SCAN                    |T1      |3       |3           |
|2 |└─LIMIT                              |        |1       |13          |
|3 |  └─NESTED-LOOP JOIN CARTESIAN       |        |1       |13          |
|4 |    ├─SUBPLAN SCAN                   |VIEW1   |1       |10          |
|5 |    │ └─SCALAR GROUP BY              |        |1       |10          |
|6 |    │   └─PX COORDINATOR             |        |1       |10          |
|7 |    │     └─EXCHANGE OUT DISTR       |:EX10000|1       |10          |
|8 |    │       └─MERGE GROUP BY         |        |1       |9           |
|9 |    │         └─PX PARTITION ITERATOR|        |3       |9           |
|10|    │           └─TABLE FULL SCAN    |T3      |3       |9           |
|11|    └─SUBPLAN SCAN                   |VIEW2   |1       |3           |
|12|      └─TABLE FULL SCAN              |T2      |1       |3           |
=========================================================================
Outputs & filters:
-------------------------------------
  0 - output([T1.C1], [T1.C2]), filter(nil), rowset=16
      exec_params_(nil), onetime_exprs_([(T_OP_EXISTS, subquery(1))(:0)]), init_plan_idxs_(nil), use_batch=false
  1 - output([T1.C1], [T1.C2]), filter(nil), startup_filter([:0]), rowset=16
      access([T1.C1], [T1.C2]), partitions(p0)
      is_index_back=false, is_global_index=false, 
      range_key([T1.__pk_increment]), range(MIN ; MAX)always true
  2 - output([1]), filter(nil), rowset=16
      limit(1), offset(nil)
  3 - output(nil), filter(nil), rowset=16
      conds(nil), nl_params_(nil), use_batch=false
  4 - output(nil), filter(nil), rowset=16
      access(nil)
  5 - output([T_FUN_COUNT_SUM(T_FUN_COUNT_SUM(T_FUN_COUNT(*)))]), filter([T_FUN_COUNT_SUM(T_FUN_COUNT_SUM(T_FUN_COUNT(*))) != 0]), rowset=16
      group(nil), agg_func([T_FUN_COUNT_SUM(T_FUN_COUNT_SUM(T_FUN_COUNT(*)))])
  6 - output([T_FUN_COUNT_SUM(T_FUN_COUNT(*))]), filter(nil), rowset=16
  7 - output([T_FUN_COUNT_SUM(T_FUN_COUNT(*))]), filter(nil), rowset=16
      dop=1
  8 - output([T_FUN_COUNT_SUM(T_FUN_COUNT(*))]), filter(nil), rowset=16
      group(nil), agg_func([T_FUN_COUNT_SUM(T_FUN_COUNT(*))])
  9 - output([T_FUN_COUNT(*)]), filter(nil), rowset=16
      force partition granule
 10 - output([T_FUN_COUNT(*)]), filter(nil), rowset=16
      access(nil), partitions(p[0-3])
      is_index_back=false, is_global_index=false, 
      range_key([T3.__pk_increment]), range(MIN ; MAX)always true, 
      pushdown_aggregation([T_FUN_COUNT(*)])
 11 - output(nil), filter(nil), rowset=16
      access(nil)
 12 - output([1]), filter(nil), rowset=16
      access(nil), partitions(p0)
      limit(1), offset(nil), is_index_back=false, is_global_index=false, 
      range_key([T2.C1]), range(MIN ; MAX)always true
select * from t1 where (select count(*) from t2 where (select count(*) from t3) != 0) > 0;
+------+------+
| C1   | C2   |
+------+------+
|    1 |    2 |
| NULL | NULL |
|    3 |    3 |
+------+------+
EXPLAIN select /*+no_rewrite*/* from t1 where (select /*+no_rewrite*/count(*) from t2 where (select count(*) from t3) != 0) > 0;
Query Plan
=======================================================================
|ID|OPERATOR                           |NAME    |EST.ROWS|EST.TIME(us)|
-----------------------------------------------------------------------
|0 |SUBPLAN FILTER                     |        |3       |14          |
|1 |├─TABLE FULL SCAN                  |T1      |3       |3           |
|2 |└─SCALAR GROUP BY                  |        |1       |12          |
|3 |  └─SUBPLAN FILTER                 |        |3       |12          |
|4 |    ├─TABLE FULL SCAN              |T2      |3       |3           |
|5 |    └─SCALAR GROUP BY              |        |1       |10          |
|6 |      └─PX COORDINATOR             |        |1       |10          |
|7 |        └─EXCHANGE OUT DISTR       |:EX10000|1       |10          |
|8 |          └─MERGE GROUP BY         |        |1       |9           |
|9 |            └─PX PARTITION ITERATOR|        |3       |9           |
|10|              └─TABLE FULL SCAN    |T3      |3       |9           |
=======================================================================
Outputs & filters:
-------------------------------------
  0 - output([T1.C1], [T1.C2]), filter(nil), rowset=16
      exec_params_(nil), onetime_exprs_([subquery(1)(:0)]), init_plan_idxs_(nil), use_batch=false
  1 - output([T1.C1], [T1.C2]), filter(nil), startup_filter([:0 > 0]), rowset=16
      access([T1.C1], [T1.C2]), partitions(p0)
      is_index_back=false, is_global_index=false, 
      range_key([T1.__pk_increment]), range(MIN ; MAX)always true
  2 - output([T_FUN_COUNT(*)]), filter(nil), rowset=16
      group(nil), agg_func([T_FUN_COUNT(*)])
  3 - output(nil), filter(nil), rowset=16
      exec_params_(nil), onetime_exprs_([subquery(1)(:1)]), init_plan_idxs_(nil), use_batch=false
  4 - output(nil), filter(nil), startup_filter([:1 != 0]), rowset=16
      access(nil), partitions(p0)
      is_index_back=false, is_global_index=false, 
      range_key([T2.C1]), range(MIN ; MAX)always true
  5 - output([T_FUN_COUNT_SUM(T_FUN_COUNT_SUM(T_FUN_COUNT(*)))]), filter(nil), rowset=16
      group(nil), agg_func([T_FUN_COUNT_SUM(T_FUN_COUNT_SUM(T_FUN_COUNT(*)))])
  6 - output([T_FUN_COUNT_SUM(T_FUN_COUNT(*))]), filter(nil), rowset=16
  7 - output([T_FUN_COUNT_SUM(T_FUN_COUNT(*))]), filter(nil), rowset=16
      dop=1
  8 - output([T_FUN_COUNT_SUM(T_FUN_COUNT(*))]), filter(nil), rowset=16
      group(nil), agg_func([T_FUN_COUNT_SUM(T_FUN_COUNT(*))])
  9 - output([T_FUN_COUNT(*)]), filter(nil), rowset=16
      force partition granule
 10 - output([T_FUN_COUNT(*)]), filter(nil), rowset=16
      access(nil), partitions(p[0-3])
      is_index_back=false, is_global_index=false, 
      range_key([T3.__pk_increment]), range(MIN ; MAX)always true, 
      pushdown_aggregation([T_FUN_COUNT(*)])
select /*+no_rewrite*/* from t1 where (select /*+no_rewrite*/count(*) from t2 where (select count(*) from t3) != 0) > 0;
+------+------+
| C1   | C2   |
+------+------+
|    1 |    2 |
| NULL | NULL |
|    3 |    3 |
+------+------+

with cte as (select * from t1 order by c1) select * from cte where (select count(*) from t2 where cte.c1 = t2.c1) > 0;
+------+------+
| C1   | C2   |
+------+------+
|    1 |    2 |
|    3 |    3 |
+------+------+
with cte as (select * from t1 order by c1) select /*+no_rewrite*/* from cte where (select count(*) from t2 where cte.c1 = t2.c1) > 0;
+------+------+
| C1   | C2   |
+------+------+
|    1 |    2 |
|    3 |    3 |
+------+------+

with cte(c1) as (select c1 from t1 union all select c1 + 1 as c1 from cte where c1 < 4) 
  select * from cte where (select count(*) from t2 where t2.c1 = cte.c1) > 0;
+------+
| C1   |
+------+
|    1 |
|    2 |
|    3 |
|    3 |
+------+
with cte(c1) as (select c1 from t1 union all select c1 + 1 as c1 from cte where c1 < 4) 
  select /*+no_rewrite*/* from cte where (select count(*) from t2 where t2.c1 = cte.c1) > 0;
+------+
| C1   |
+------+
|    1 |
|    3 |
|    2 |
|    3 |
+------+

EXPLAIN select s1.nextval, c1 from t1 where (select count(*) from t2 where t1.c1 = t2.c1) > 0;
Query Plan
=====================================================
|ID|OPERATOR             |NAME|EST.ROWS|EST.TIME(us)|
-----------------------------------------------------
|0 |SEQUENCE             |    |2       |5           |
|1 |└─MERGE JOIN         |    |2       |5           |
|2 |  ├─TABLE FULL SCAN  |T2  |3       |3           |
|3 |  └─SORT             |    |3       |3           |
|4 |    └─TABLE FULL SCAN|T1  |3       |3           |
=====================================================
Outputs & filters:
-------------------------------------
  0 - output([S1.NEXTVAL], [T1.C1]), filter(nil)
  1 - output([T1.C1]), filter(nil), rowset=16
      equal_conds([T1.C1 = T2.C1]), other_conds(nil)
      merge_directions([ASC])
  2 - output([T2.C1]), filter(nil), rowset=16
      access([T2.C1]), partitions(p0)
      is_index_back=false, is_global_index=false, 
      range_key([T2.C1]), range(MIN ; MAX)always true
  3 - output([T1.C1]), filter(nil), rowset=16
      sort_keys([T1.C1, ASC])
  4 - output([T1.C1]), filter(nil), rowset=16
      access([T1.C1]), partitions(p0)
      is_index_back=false, is_global_index=false, 
      range_key([T1.__pk_increment]), range(MIN ; MAX)always true
select s1.nextval, c1 from t1 where (select count(*) from t2 where t1.c1 = t2.c1) > 0;
+---------+------+
| NEXTVAL | C1   |
+---------+------+
|       1 |    1 |
|       2 |    3 |
+---------+------+
EXPLAIN select /*+no_rewrite*/s1.nextval, c1 from t1 where (select count(*) from t2 where t1.c1 = t2.c1) > 0;
Query Plan
===================================================
|ID|OPERATOR           |NAME|EST.ROWS|EST.TIME(us)|
---------------------------------------------------
|0 |SEQUENCE           |    |1       |56          |
|1 |└─SUBPLAN FILTER   |    |1       |56          |
|2 |  ├─TABLE FULL SCAN|T1  |3       |3           |
|3 |  └─SCALAR GROUP BY|    |1       |18          |
|4 |    └─TABLE GET    |T2  |1       |18          |
===================================================
Outputs & filters:
-------------------------------------
  0 - output([S1.NEXTVAL], [T1.C1]), filter(nil)
  1 - output([T1.C1]), filter([subquery(1) > 0]), rowset=16
      exec_params_([T1.C1(:0)]), onetime_exprs_(nil), init_plan_idxs_(nil), use_batch=false
  2 - output([T1.C1]), filter(nil), rowset=16
      access([T1.C1]), partitions(p0)
      is_index_back=false, is_global_index=false, 
      range_key([T1.__pk_increment]), range(MIN ; MAX)always true
  3 - output([T_FUN_COUNT(*)]), filter(nil), rowset=16
      group(nil), agg_func([T_FUN_COUNT(*)])
  4 - output(nil), filter(nil), rowset=16
      access(nil), partitions(p0)
      is_index_back=false, is_global_index=false, 
      range_key([T2.C1]), range(MIN ; MAX)always true, 
      range_cond([:0 = T2.C1])
select /*+no_rewrite*/s1.nextval, c1 from t1 where (select count(*) from t2 where t1.c1 = t2.c1) > 0;
+---------+------+
| NEXTVAL | C1   |
+---------+------+
|       3 |    1 |
|       4 |    3 |
+---------+------+

set autocommit=0;

explain_protocol: 0
select stddev(c1) from t1;
+------------------------------------------+
| STDDEV(C1)                               |
+------------------------------------------+
| 1.41421356237309504880168872420969807857 |
+------------------------------------------+
explain_protocol: 2
EXPLAIN update t1 set c1 = 1 where (select count(*) from t2 where t1.c1 = t2.c1) > 0;
Query Plan
=====================================================
|ID|OPERATOR             |NAME|EST.ROWS|EST.TIME(us)|
-----------------------------------------------------
|0 |UPDATE               |    |3       |52          |
|1 |└─MERGE JOIN         |    |3       |6           |
|2 |  ├─TABLE FULL SCAN  |T2  |3       |3           |
|3 |  └─SORT             |    |3       |3           |
|4 |    └─TABLE FULL SCAN|T1  |3       |3           |
=====================================================
Outputs & filters:
-------------------------------------
  0 - output(nil), filter(nil)
      table_columns([{T1: ({T1: (T1.__pk_increment, T1.C1, T1.C2)})}]),
      update([T1.C1=column_conv(NUMBER,PS:(-1,0),NULL,1)])
  1 - output([T1.__pk_increment], [T1.C1], [T1.C2]), filter(nil), rowset=16
      equal_conds([T1.C1 = T2.C1]), other_conds(nil)
      merge_directions([ASC])
  2 - output([T2.C1]), filter(nil), rowset=16
      access([T2.C1]), partitions(p0)
      is_index_back=false, is_global_index=false, 
      range_key([T2.C1]), range(MIN ; MAX)always true
  3 - output([T1.__pk_increment], [T1.C1], [T1.C2]), filter(nil), rowset=16
      sort_keys([T1.C1, ASC])
  4 - output([T1.__pk_increment], [T1.C1], [T1.C2]), filter(nil), rowset=16
      access([T1.__pk_increment], [T1.C1], [T1.C2]), partitions(p0)
      is_index_back=false, is_global_index=false, 
      range_key([T1.__pk_increment]), range(MIN ; MAX)always true
update t1 set c1 = 1 where (select count(*) from t2 where t1.c1 = t2.c1) > 0;
explain_protocol: 0
select stddev(c1) from t1;
+------------+
| STDDEV(C1) |
+------------+
|          0 |
+------------+
rollback;
explain_protocol: 2
EXPLAIN update /*+no_rewrite*/t1 set c1 = 1 where (select count(*) from t2 where t1.c1 = t2.c1) > 0;
Query Plan
===================================================
|ID|OPERATOR           |NAME|EST.ROWS|EST.TIME(us)|
---------------------------------------------------
|0 |UPDATE             |    |1       |88          |
|1 |└─SUBPLAN FILTER   |    |1       |57          |
|2 |  ├─TABLE FULL SCAN|T1  |3       |3           |
|3 |  └─SCALAR GROUP BY|    |1       |18          |
|4 |    └─TABLE GET    |T2  |1       |18          |
===================================================
Outputs & filters:
-------------------------------------
  0 - output(nil), filter(nil)
      table_columns([{T1: ({T1: (T1.__pk_increment, T1.C1, T1.C2)})}]),
      update([T1.C1=column_conv(NUMBER,PS:(-1,0),NULL,1)])
  1 - output([T1.__pk_increment], [T1.C1], [T1.C2]), filter([subquery(1) > 0]), rowset=16
      exec_params_([T1.C1(:0)]), onetime_exprs_(nil), init_plan_idxs_(nil), use_batch=false
  2 - output([T1.__pk_increment], [T1.C1], [T1.C2]), filter(nil), rowset=16
      access([T1.__pk_increment], [T1.C1], [T1.C2]), partitions(p0)
      is_index_back=false, is_global_index=false, 
      range_key([T1.__pk_increment]), range(MIN ; MAX)always true
  3 - output([T_FUN_COUNT(*)]), filter(nil), rowset=16
      group(nil), agg_func([T_FUN_COUNT(*)])
  4 - output(nil), filter(nil), rowset=16
      access(nil), partitions(p0)
      is_index_back=false, is_global_index=false, 
      range_key([T2.C1]), range(MIN ; MAX)always true, 
      range_cond([:0 = T2.C1])
update /*+no_rewrite*/t1 set c1 = 1 where (select count(*) from t2 where t1.c1 = t2.c1) > 0;
explain_protocol: 0
select stddev(c1) from t1;
+------------+
| STDDEV(C1) |
+------------+
|          0 |
+------------+
rollback;
explain_protocol: 2
EXPLAIN update t1 set c1 = 1 where (select count(*) from t2 where t1.c1 = t2.c1) = 0;
Query Plan
=======================================================
|ID|OPERATOR               |NAME|EST.ROWS|EST.TIME(us)|
-------------------------------------------------------
|0 |UPDATE                 |    |1       |30          |
|1 |└─HASH RIGHT ANTI JOIN |    |1       |6           |
|2 |  ├─TABLE FULL SCAN    |T2  |3       |3           |
|3 |  └─TABLE FULL SCAN    |T1  |3       |3           |
=======================================================
Outputs & filters:
-------------------------------------
  0 - output(nil), filter(nil)
      table_columns([{T1: ({T1: (T1.__pk_increment, T1.C1, T1.C2)})}]),
      update([T1.C1=column_conv(NUMBER,PS:(-1,0),NULL,1)])
  1 - output([T1.__pk_increment], [T1.C1], [T1.C2]), filter(nil), rowset=16
      equal_conds([T1.C1 = T2.C1]), other_conds(nil)
  2 - output([T2.C1]), filter(nil), rowset=16
      access([T2.C1]), partitions(p0)
      is_index_back=false, is_global_index=false, 
      range_key([T2.C1]), range(MIN ; MAX)always true
  3 - output([T1.__pk_increment], [T1.C1], [T1.C2]), filter(nil), rowset=16
      access([T1.__pk_increment], [T1.C1], [T1.C2]), partitions(p0)
      is_index_back=false, is_global_index=false, 
      range_key([T1.__pk_increment]), range(MIN ; MAX)always true
update t1 set c1 = 1 where (select count(*) from t2 where t1.c1 = t2.c1) = 0;
explain_protocol: 0
select stddev(c1) from t1;
+-----------------------------------------+
| STDDEV(C1)                              |
+-----------------------------------------+
| 1.1547005383792515290182975610039149113 |
+-----------------------------------------+
rollback;
explain_protocol: 2
EXPLAIN update /*+no_rewrite*/t1 set c1 = 1 where (select count(*) from t2 where t1.c1 = t2.c1) = 0;
Query Plan
===================================================
|ID|OPERATOR           |NAME|EST.ROWS|EST.TIME(us)|
---------------------------------------------------
|0 |UPDATE             |    |1       |88          |
|1 |└─SUBPLAN FILTER   |    |1       |57          |
|2 |  ├─TABLE FULL SCAN|T1  |3       |3           |
|3 |  └─SCALAR GROUP BY|    |1       |18          |
|4 |    └─TABLE GET    |T2  |1       |18          |
===================================================
Outputs & filters:
-------------------------------------
  0 - output(nil), filter(nil)
      table_columns([{T1: ({T1: (T1.__pk_increment, T1.C1, T1.C2)})}]),
      update([T1.C1=column_conv(NUMBER,PS:(-1,0),NULL,1)])
  1 - output([T1.__pk_increment], [T1.C1], [T1.C2]), filter([subquery(1) = 0]), rowset=16
      exec_params_([T1.C1(:0)]), onetime_exprs_(nil), init_plan_idxs_(nil), use_batch=false
  2 - output([T1.__pk_increment], [T1.C1], [T1.C2]), filter(nil), rowset=16
      access([T1.__pk_increment], [T1.C1], [T1.C2]), partitions(p0)
      is_index_back=false, is_global_index=false, 
      range_key([T1.__pk_increment]), range(MIN ; MAX)always true
  3 - output([T_FUN_COUNT(*)]), filter(nil), rowset=16
      group(nil), agg_func([T_FUN_COUNT(*)])
  4 - output(nil), filter(nil), rowset=16
      access(nil), partitions(p0)
      is_index_back=false, is_global_index=false, 
      range_key([T2.C1]), range(MIN ; MAX)always true, 
      range_cond([:0 = T2.C1])
update /*+no_rewrite*/t1 set c1 = 1 where (select count(*) from t2 where t1.c1 = t2.c1) = 0;
explain_protocol: 0
select stddev(c1) from t1;
+-----------------------------------------+
| STDDEV(C1)                              |
+-----------------------------------------+
| 1.1547005383792515290182975610039149113 |
+-----------------------------------------+
rollback;
explain_protocol: 2
EXPLAIN delete from t1 where (select count(*) from t2 where t1.c1 > t2.c1) > 0;
Query Plan
========================================================
|ID|OPERATOR                |NAME|EST.ROWS|EST.TIME(us)|
--------------------------------------------------------
|0 |DELETE                  |    |1       |66          |
|1 |└─NESTED-LOOP SEMI JOIN |    |1       |59          |
|2 |  ├─TABLE FULL SCAN     |T1  |3       |3           |
|3 |  └─TABLE RANGE SCAN    |T2  |1       |18          |
========================================================
Outputs & filters:
-------------------------------------
  0 - output(nil), filter(nil)
      table_columns([{T1: ({T1: (T1.__pk_increment, T1.C1, T1.C2)})}])
  1 - output([T1.__pk_increment], [T1.C1], [T1.C2]), filter(nil), rowset=16
      conds(nil), nl_params_([T1.C1(:0)]), use_batch=false
  2 - output([T1.__pk_increment], [T1.C1], [T1.C2]), filter(nil), rowset=16
      access([T1.__pk_increment], [T1.C1], [T1.C2]), partitions(p0)
      is_index_back=false, is_global_index=false, 
      range_key([T1.__pk_increment]), range(MIN ; MAX)always true
  3 - output(nil), filter(nil), rowset=16
      access(nil), partitions(p0)
      is_index_back=false, is_global_index=false, 
      range_key([T2.C1]), range(MIN ; MAX), 
      range_cond([:0 > T2.C1])
delete from t1 where (select count(*) from t2 where t1.c1 > t2.c1) > 0;
explain_protocol: 0
select stddev(c1) from t1;
+------------+
| STDDEV(C1) |
+------------+
|          0 |
+------------+
rollback;
explain_protocol: 2
EXPLAIN delete /*+no_rewrite*/from t1 where (select count(*) from t2 where t1.c1 > t2.c1) > 0;
Query Plan
======================================================
|ID|OPERATOR              |NAME|EST.ROWS|EST.TIME(us)|
------------------------------------------------------
|0 |DELETE                |    |1       |68          |
|1 |└─SUBPLAN FILTER      |    |1       |57          |
|2 |  ├─TABLE FULL SCAN   |T1  |3       |3           |
|3 |  └─SCALAR GROUP BY   |    |1       |18          |
|4 |    └─TABLE RANGE SCAN|T2  |1       |18          |
======================================================
Outputs & filters:
-------------------------------------
  0 - output(nil), filter(nil)
      table_columns([{T1: ({T1: (T1.__pk_increment, T1.C1, T1.C2)})}])
  1 - output([T1.__pk_increment], [T1.C1], [T1.C2]), filter([subquery(1) > 0]), rowset=16
      exec_params_([T1.C1(:0)]), onetime_exprs_(nil), init_plan_idxs_(nil), use_batch=false
  2 - output([T1.__pk_increment], [T1.C1], [T1.C2]), filter(nil), rowset=16
      access([T1.__pk_increment], [T1.C1], [T1.C2]), partitions(p0)
      is_index_back=false, is_global_index=false, 
      range_key([T1.__pk_increment]), range(MIN ; MAX)always true
  3 - output([T_FUN_COUNT_SUM(T_FUN_COUNT(*))]), filter(nil), rowset=16
      group(nil), agg_func([T_FUN_COUNT_SUM(T_FUN_COUNT(*))])
  4 - output([T_FUN_COUNT(*)]), filter(nil), rowset=16
      access(nil), partitions(p0)
      is_index_back=false, is_global_index=false, 
      range_key([T2.C1]), range(MIN ; MAX)always true, 
      range_cond([:0 > T2.C1]), 
      pushdown_aggregation([T_FUN_COUNT(*)])
delete /*+no_rewrite*/from t1 where (select count(*) from t2 where t1.c1 > t2.c1) > 0;
explain_protocol: 0
select stddev(c1) from t1;
+------------+
| STDDEV(C1) |
+------------+
|          0 |
+------------+
rollback;
explain_protocol: 2
EXPLAIN select * from t1 where (select count(*) from t1) > 0 for update;
Query Plan
=====================================================
|ID|OPERATOR             |NAME|EST.ROWS|EST.TIME(us)|
-----------------------------------------------------
|0 |MATERIAL             |    |3       |5           |
|1 |└─FOR UPDATE         |    |3       |5           |
|2 |  └─SUBPLAN FILTER   |    |3       |5           |
|3 |    ├─TABLE FULL SCAN|T1  |3       |3           |
|4 |    └─TABLE FULL SCAN|T1  |1       |3           |
=====================================================
Outputs & filters:
-------------------------------------
  0 - output([T1.C1], [T1.C2]), filter(nil), rowset=16
  1 - output([T1.C1], [T1.C2]), filter(nil), rowset=16
      lock tables(T1)
  2 - output([T1.C1], [T1.C2], [T1.__pk_increment]), filter(nil), rowset=16
      exec_params_(nil), onetime_exprs_([(T_OP_EXISTS, subquery(1))(:0)]), init_plan_idxs_(nil), use_batch=false
  3 - output([T1.__pk_increment], [T1.C1], [T1.C2]), filter(nil), startup_filter([:0]), rowset=16
      access([T1.__pk_increment], [T1.C1], [T1.C2]), partitions(p0)
      is_index_back=false, is_global_index=false, 
      range_key([T1.__pk_increment]), range(MIN ; MAX)always true
  4 - output([1]), filter(nil), rowset=16
      access(nil), partitions(p0)
      limit(1), offset(nil), is_index_back=false, is_global_index=false, 
      range_key([T1.__pk_increment]), range(MIN ; MAX)always true
select * from t1 where (select count(*) from t1) > 0 for update;
+------+------+
| C1   | C2   |
+------+------+
|    1 |    2 |
| NULL | NULL |
|    3 |    3 |
+------+------+
EXPLAIN select /*+no_rewrite*/* from t1 where (select count(*) from t1) > 0 for update;
Query Plan
=======================================================
|ID|OPERATOR               |NAME|EST.ROWS|EST.TIME(us)|
-------------------------------------------------------
|0 |MATERIAL               |    |3       |5           |
|1 |└─FOR UPDATE           |    |3       |5           |
|2 |  └─SUBPLAN FILTER     |    |3       |5           |
|3 |    ├─TABLE FULL SCAN  |T1  |3       |3           |
|4 |    └─SCALAR GROUP BY  |    |1       |3           |
|5 |      └─TABLE FULL SCAN|T1  |3       |3           |
=======================================================
Outputs & filters:
-------------------------------------
  0 - output([T1.C1], [T1.C2]), filter(nil), rowset=16
  1 - output([T1.C1], [T1.C2]), filter(nil), rowset=16
      lock tables(T1)
  2 - output([T1.C1], [T1.C2], [T1.__pk_increment]), filter(nil), rowset=16
      exec_params_(nil), onetime_exprs_([subquery(1)(:0)]), init_plan_idxs_(nil), use_batch=false
  3 - output([T1.__pk_increment], [T1.C1], [T1.C2]), filter(nil), startup_filter([:0 > 0]), rowset=16
      access([T1.__pk_increment], [T1.C1], [T1.C2]), partitions(p0)
      is_index_back=false, is_global_index=false, 
      range_key([T1.__pk_increment]), range(MIN ; MAX)always true
  4 - output([T_FUN_COUNT_SUM(T_FUN_COUNT(*))]), filter(nil), rowset=16
      group(nil), agg_func([T_FUN_COUNT_SUM(T_FUN_COUNT(*))])
  5 - output([T_FUN_COUNT(*)]), filter(nil), rowset=16
      access(nil), partitions(p0)
      is_index_back=false, is_global_index=false, 
      range_key([T1.__pk_increment]), range(MIN ; MAX)always true, 
      pushdown_aggregation([T_FUN_COUNT(*)])
select /*+no_rewrite*/* from t1 where (select count(*) from t1) > 0 for update;
+------+------+
| C1   | C2   |
+------+------+
|    1 |    2 |
| NULL | NULL |
|    3 |    3 |
+------+------+

explain merge into t1 using t2 on ((select count(*) from t2) = 0) when matched then update set c2 = 1;
Query Plan
===============================================================
|ID|OPERATOR                       |NAME|EST.ROWS|EST.TIME(us)|
---------------------------------------------------------------
|0 |MERGE                          |    |9       |7           |
|1 |└─SUBPLAN FILTER               |    |9       |7           |
|2 |  ├─NESTED-LOOP JOIN CARTESIAN |    |9       |5           |
|3 |  │ ├─TABLE FULL SCAN          |T1  |3       |3           |
|4 |  │ └─MATERIAL                 |    |3       |3           |
|5 |  │   └─TABLE FULL SCAN        |T2  |3       |3           |
|6 |  └─TABLE FULL SCAN            |T2  |1       |3           |
===============================================================
Outputs & filters:
-------------------------------------
  0 - output(nil), filter(nil)
      columns([{T1: ({T1: (T1.__pk_increment, T1.C1, T1.C2)})}]),
      update([T1.C2=column_conv(NUMBER,PS:(-1,0),NULL,1)]), 
      insert_conds(nil), update_conds(nil), delete_conds(nil)
  1 - output([T1.__pk_increment], [T1.C1], [T1.C2]), filter(nil), rowset=16
      exec_params_(nil), onetime_exprs_([(T_OP_NOT_EXISTS, subquery(1))(:0)]), init_plan_idxs_(nil), use_batch=false
  2 - output([T1.__pk_increment], [T1.C1], [T1.C2]), filter(nil), startup_filter([:0]), rowset=16
      conds(nil), nl_params_(nil), use_batch=false
  3 - output([T1.__pk_increment], [T1.C1], [T1.C2]), filter([T1.__pk_increment IS NOT NULL]), rowset=16
      access([T1.__pk_increment], [T1.C1], [T1.C2]), partitions(p0)
      is_index_back=false, is_global_index=false, filter_before_indexback[false], 
      range_key([T1.__pk_increment]), range(MIN ; MAX)always true
  4 - output(nil), filter(nil), rowset=16
  5 - output(nil), filter(nil), rowset=16
      access(nil), partitions(p0)
      is_index_back=false, is_global_index=false, 
      range_key([T2.C1]), range(MIN ; MAX)always true
  6 - output([1]), filter(nil), rowset=16
      access(nil), partitions(p0)
      limit(1), offset(nil), is_index_back=false, is_global_index=false, 
      range_key([T2.C1]), range(MIN ; MAX)always true
merge into t1 using t2 on ((select count(*) from t2) = 0) when matched then update set c2 = 1;
explain_protocol: 0
select stddev(c2) from t1;
+-------------------------------------------+
| STDDEV(C2)                                |
+-------------------------------------------+
| .7071067811865475244008443621048490392848 |
+-------------------------------------------+
rollback;
explain_protocol: 2
explain merge /*+no_rewrite*/ into t1 using t2 on ((select count(*) from t2) = 0) when matched then update set c2 = 1;
Query Plan
===============================================================
|ID|OPERATOR                       |NAME|EST.ROWS|EST.TIME(us)|
---------------------------------------------------------------
|0 |MERGE                          |    |5       |7           |
|1 |└─SUBPLAN FILTER               |    |5       |7           |
|2 |  ├─NESTED-LOOP JOIN CARTESIAN |    |5       |5           |
|3 |  │ ├─TABLE FULL SCAN          |T1  |2       |3           |
|4 |  │ └─MATERIAL                 |    |3       |3           |
|5 |  │   └─TABLE FULL SCAN        |T2  |3       |3           |
|6 |  └─SCALAR GROUP BY            |    |1       |3           |
|7 |    └─TABLE FULL SCAN          |T2  |3       |3           |
===============================================================
Outputs & filters:
-------------------------------------
  0 - output(nil), filter(nil)
      columns([{T1: ({T1: (T1.__pk_increment, T1.C1, T1.C2)})}]),
      update([T1.C2=column_conv(NUMBER,PS:(-1,0),NULL,1)]), 
      insert_conds(nil), update_conds(nil), delete_conds(nil)
  1 - output([T1.__pk_increment], [T1.C1], [T1.C2]), filter(nil), rowset=16
      exec_params_(nil), onetime_exprs_([subquery(1)(:0)]), init_plan_idxs_(nil), use_batch=false
  2 - output([T1.__pk_increment], [T1.C1], [T1.C2]), filter(nil), rowset=16
      conds(nil), nl_params_(nil), use_batch=false
  3 - output([T1.__pk_increment], [T1.C1], [T1.C2]), filter([T1.__pk_increment IS NOT NULL AND :0 = 0]), rowset=16
      access([T1.__pk_increment], [T1.C1], [T1.C2]), partitions(p0)
      is_index_back=false, is_global_index=false, filter_before_indexback[false], 
      range_key([T1.__pk_increment]), range(MIN ; MAX)always true
  4 - output(nil), filter(nil), rowset=16
  5 - output(nil), filter(nil), rowset=16
      access(nil), partitions(p0)
      is_index_back=false, is_global_index=false, 
      range_key([T2.C1]), range(MIN ; MAX)always true
  6 - output([T_FUN_COUNT_SUM(T_FUN_COUNT(*))]), filter(nil), rowset=16
      group(nil), agg_func([T_FUN_COUNT_SUM(T_FUN_COUNT(*))])
  7 - output([T_FUN_COUNT(*)]), filter(nil), rowset=16
      access(nil), partitions(p0)
      is_index_back=false, is_global_index=false, 
      range_key([T2.C1]), range(MIN ; MAX)always true, 
      pushdown_aggregation([T_FUN_COUNT(*)])
merge /*+no_rewrite*/ into t1 using t2 on ((select count(*) from t2) = 0) when matched then update set c2 = 1;
explain_protocol: 0
select stddev(c2) from t1;
+-------------------------------------------+
| STDDEV(C2)                                |
+-------------------------------------------+
| .7071067811865475244008443621048490392848 |
+-------------------------------------------+
rollback;
explain_protocol: 2
explain merge into t1 using t2 on ((select count(*) from t2 where t1.c1 = t2.c1) = 0) when matched then update set c2 = 1;
Query Plan
==============================================================
|ID|OPERATOR                     |NAME |EST.ROWS|EST.TIME(us)|
--------------------------------------------------------------
|0 |MERGE                        |     |3       |8           |
|1 |└─NESTED-LOOP JOIN CARTESIAN |     |3       |8           |
|2 |  ├─TABLE FULL SCAN          |T2   |3       |3           |
|3 |  └─MATERIAL                 |     |1       |6           |
|4 |    └─HASH RIGHT ANTI JOIN   |     |1       |6           |
|5 |      ├─SUBPLAN SCAN         |VIEW1|3       |3           |
|6 |      │ └─TABLE FULL SCAN    |T2   |3       |3           |
|7 |      └─TABLE FULL SCAN      |T1   |3       |3           |
==============================================================
Outputs & filters:
-------------------------------------
  0 - output(nil), filter(nil)
      columns([{T1: ({T1: (T1.__pk_increment, T1.C1, T1.C2)})}]),
      update([T1.C2=column_conv(NUMBER,PS:(-1,0),NULL,1)]), 
      insert_conds(nil), update_conds(nil), delete_conds(nil)
  1 - output([T1.__pk_increment], [T1.C1], [T1.C2]), filter(nil), rowset=16
      conds(nil), nl_params_(nil), use_batch=false
  2 - output(nil), filter(nil), rowset=16
      access(nil), partitions(p0)
      is_index_back=false, is_global_index=false, 
      range_key([T2.C1]), range(MIN ; MAX)always true
  3 - output([T1.__pk_increment], [T1.C1], [T1.C2]), filter(nil), rowset=16
  4 - output([T1.__pk_increment], [T1.C1], [T1.C2]), filter(nil), rowset=16
      equal_conds([T1.C1 = VIEW1.T2.C1]), other_conds(nil)
  5 - output([VIEW1.T2.C1]), filter(nil), rowset=16
      access([VIEW1.T2.C1])
  6 - output([T2.C1]), filter(nil), rowset=16
      access([T2.C1]), partitions(p0)
      is_index_back=false, is_global_index=false, 
      range_key([T2.C1]), range(MIN ; MAX)always true
  7 - output([T1.__pk_increment], [T1.C1], [T1.C2]), filter([T1.__pk_increment IS NOT NULL]), rowset=16
      access([T1.__pk_increment], [T1.C1], [T1.C2]), partitions(p0)
      is_index_back=false, is_global_index=false, filter_before_indexback[false], 
      range_key([T1.__pk_increment]), range(MIN ; MAX)always true
merge into t1 using t2 on ((select count(*) from t2 where t1.c1 = t2.c1) = 0) when matched then update set c2 = 1;
ERROR HY000: unable to get a stable set of rows in the source tables

explain merge /*+no_rewrite*/ into t1 using t2 on ((select count(*) from t2 where t1.c1 = t2.c1) = 0) when matched then update set c2 = 1;
Query Plan
===============================================================
|ID|OPERATOR                       |NAME|EST.ROWS|EST.TIME(us)|
---------------------------------------------------------------
|0 |MERGE                          |    |3       |167         |
|1 |└─SUBPLAN FILTER               |    |3       |167         |
|2 |  ├─NESTED-LOOP JOIN CARTESIAN |    |9       |5           |
|3 |  │ ├─TABLE FULL SCAN          |T1  |3       |3           |
|4 |  │ └─MATERIAL                 |    |3       |3           |
|5 |  │   └─TABLE FULL SCAN        |T2  |3       |3           |
|6 |  └─SCALAR GROUP BY            |    |1       |18          |
|7 |    └─TABLE GET                |T2  |1       |18          |
===============================================================
Outputs & filters:
-------------------------------------
  0 - output(nil), filter(nil)
      columns([{T1: ({T1: (T1.__pk_increment, T1.C1, T1.C2)})}]),
      update([T1.C2=column_conv(NUMBER,PS:(-1,0),NULL,1)]), 
      insert_conds(nil), update_conds(nil), delete_conds(nil)
  1 - output([T1.__pk_increment], [T1.C1], [T1.C2]), filter([T1.__pk_increment IS NOT NULL AND subquery(1) = 0]), rowset=16
      exec_params_([T1.C1(:0)]), onetime_exprs_(nil), init_plan_idxs_(nil), use_batch=false
  2 - output([T1.__pk_increment], [T1.C1], [T1.C2]), filter(nil), rowset=16
      conds(nil), nl_params_(nil), use_batch=false
  3 - output([T1.__pk_increment], [T1.C1], [T1.C2]), filter(nil), rowset=16
      access([T1.__pk_increment], [T1.C1], [T1.C2]), partitions(p0)
      is_index_back=false, is_global_index=false, 
      range_key([T1.__pk_increment]), range(MIN ; MAX)always true
  4 - output(nil), filter(nil), rowset=16
  5 - output(nil), filter(nil), rowset=16
      access(nil), partitions(p0)
      is_index_back=false, is_global_index=false, 
      range_key([T2.C1]), range(MIN ; MAX)always true
  6 - output([T_FUN_COUNT(*)]), filter(nil), rowset=16
      group(nil), agg_func([T_FUN_COUNT(*)])
  7 - output(nil), filter(nil), rowset=16
      access(nil), partitions(p0)
      is_index_back=false, is_global_index=false, 
      range_key([T2.C1]), range(MIN ; MAX)always true, 
      range_cond([:0 = T2.C1])
merge /*+no_rewrite*/ into t1 using t2 on ((select count(*) from t2 where t1.c1 = t2.c1) = 0) when matched then update set c2 = 1;
ERROR HY000: unable to get a stable set of rows in the source tables

EXPLAIN select * from t1 where (select count(substr('abcd', 3)) from t2) > 0;
Query Plan
=================================================
|ID|OPERATOR         |NAME|EST.ROWS|EST.TIME(us)|
-------------------------------------------------
|0 |SUBPLAN FILTER   |    |3       |5           |
|1 |├─TABLE FULL SCAN|T1  |3       |3           |
|2 |└─TABLE FULL SCAN|T2  |1       |3           |
=================================================
Outputs & filters:
-------------------------------------
  0 - output([T1.C1], [T1.C2]), filter(nil), rowset=16
      exec_params_(nil), onetime_exprs_([(T_OP_EXISTS, subquery(1))(:0)]), init_plan_idxs_(nil), use_batch=false
  1 - output([T1.C1], [T1.C2]), filter(nil), startup_filter([:0]), rowset=16
      access([T1.C1], [T1.C2]), partitions(p0)
      is_index_back=false, is_global_index=false, 
      range_key([T1.__pk_increment]), range(MIN ; MAX)always true
  2 - output([1]), filter(nil), rowset=16
      access(nil), partitions(p0)
      limit(1), offset(nil), is_index_back=false, is_global_index=false, 
      range_key([T2.C1]), range(MIN ; MAX)always true
select * from t1 where (select count(substr('abcd', 3)) from t2) > 0;
+------+------+
| C1   | C2   |
+------+------+
|    1 |    2 |
| NULL | NULL |
|    3 |    3 |
+------+------+
EXPLAIN select /*+no_rewrite*/ * from t1 where (select count(substr('abcd', 3)) from t2) > 0;
Query Plan
===================================================
|ID|OPERATOR           |NAME|EST.ROWS|EST.TIME(us)|
---------------------------------------------------
|0 |SUBPLAN FILTER     |    |3       |5           |
|1 |├─TABLE FULL SCAN  |T1  |3       |3           |
|2 |└─SCALAR GROUP BY  |    |1       |3           |
|3 |  └─TABLE FULL SCAN|T2  |3       |3           |
===================================================
Outputs & filters:
-------------------------------------
  0 - output([T1.C1], [T1.C2]), filter(nil), rowset=16
      exec_params_(nil), onetime_exprs_([subquery(1)(:0)]), init_plan_idxs_(nil), use_batch=false
  1 - output([T1.C1], [T1.C2]), filter(nil), startup_filter([:0 > 0]), rowset=16
      access([T1.C1], [T1.C2]), partitions(p0)
      is_index_back=false, is_global_index=false, 
      range_key([T1.__pk_increment]), range(MIN ; MAX)always true
  2 - output([T_FUN_COUNT_SUM(T_FUN_COUNT(*))]), filter(nil), rowset=16
      group(nil), agg_func([T_FUN_COUNT_SUM(T_FUN_COUNT(*))])
  3 - output([T_FUN_COUNT(*)]), filter(nil), rowset=16
      access(nil), partitions(p0)
      is_index_back=false, is_global_index=false, 
      range_key([T2.C1]), range(MIN ; MAX)always true, 
      pushdown_aggregation([T_FUN_COUNT(*)])
select /*+no_rewrite*/ * from t1 where (select count(substr('abcd', 3)) from t2) > 0;
+------+------+
| C1   | C2   |
+------+------+
|    1 |    2 |
| NULL | NULL |
|    3 |    3 |
+------+------+

EXPLAIN select * from t1 where (select count(substr('ab', 3)) from t2) > 0;
Query Plan
===============================================
|ID|OPERATOR       |NAME|EST.ROWS|EST.TIME(us)|
-----------------------------------------------
|0 |TABLE FULL SCAN|T1  |0       |3           |
===============================================
Outputs & filters:
-------------------------------------
  0 - output([T1.C1], [T1.C2]), filter(nil), startup_filter([0]), rowset=16
      access([T1.C1], [T1.C2]), partitions(p0)
      is_index_back=false, is_global_index=false, 
      range_key([T1.__pk_increment]), range(MIN ; MAX)always true
select * from t1 where (select count(substr('ab', 3)) from t2) > 0;
+------+------+
| C1   | C2   |
+------+------+
+------+------+
EXPLAIN select /*+no_rewrite*/ * from t1 where (select count(substr('ab', 3)) from t2) > 0;
Query Plan
===================================================
|ID|OPERATOR           |NAME|EST.ROWS|EST.TIME(us)|
---------------------------------------------------
|0 |SUBPLAN FILTER     |    |3       |5           |
|1 |├─TABLE FULL SCAN  |T1  |3       |3           |
|2 |└─SCALAR GROUP BY  |    |1       |3           |
|3 |  └─TABLE FULL SCAN|T2  |3       |3           |
===================================================
Outputs & filters:
-------------------------------------
  0 - output([T1.C1], [T1.C2]), filter(nil), rowset=16
      exec_params_(nil), onetime_exprs_([subquery(1)(:0)]), init_plan_idxs_(nil), use_batch=false
  1 - output([T1.C1], [T1.C2]), filter(nil), startup_filter([:0 > 0]), rowset=16
      access([T1.C1], [T1.C2]), partitions(p0)
      is_index_back=false, is_global_index=false, 
      range_key([T1.__pk_increment]), range(MIN ; MAX)always true
  2 - output([T_FUN_COUNT(SUBSTR(cast('ab', VARCHAR2(2 BYTE)), 3))]), filter(nil), rowset=16
      group(nil), agg_func([T_FUN_COUNT(SUBSTR(cast('ab', VARCHAR2(2 BYTE)), 3))])
  3 - output(nil), filter(nil), rowset=16
      access(nil), partitions(p0)
      is_index_back=false, is_global_index=false, 
      range_key([T2.C1]), range(MIN ; MAX)always true
select /*+no_rewrite*/ * from t1 where (select count(substr('ab', 3)) from t2) > 0;
+------+------+
| C1   | C2   |
+------+------+
+------+------+

set autocommit=1;
drop sequence s1;
drop table t1;
drop table t2;
drop table t3;

create table t1(c1 int);
create table t2(c1 int);
EXPLAIN insert into t1 values (1);
Query Plan
==================================================
|ID|OPERATOR          |NAME|EST.ROWS|EST.TIME(us)|
--------------------------------------------------
|0 |DISTRIBUTED INSERT|    |1       |13          |
|1 |└─EXPRESSION      |    |1       |1           |
==================================================
Outputs & filters:
-------------------------------------
  0 - output(nil), filter(nil)
      columns([{T1: ({T1: (T1.__pk_increment, T1.C1)})}]), 
      column_values([T_HIDDEN_PK], [column_conv(NUMBER,PS:(-1,0),NULL,__values.C1)])
  1 - output([__values.C1]), filter(nil)
      values({1})
insert into t1 values (1);
EXPLAIN insert into t2 values(null),(null),(1);
Query Plan
==================================================
|ID|OPERATOR          |NAME|EST.ROWS|EST.TIME(us)|
--------------------------------------------------
|0 |DISTRIBUTED INSERT|    |3       |26          |
|1 |└─EXPRESSION      |    |3       |1           |
==================================================
Outputs & filters:
-------------------------------------
  0 - output(nil), filter(nil)
      columns([{T2: ({T2: (T2.__pk_increment, T2.C1)})}]), 
      column_values([T_HIDDEN_PK], [column_conv(NUMBER,PS:(-1,0),NULL,__values.C1)])
  1 - output([__values.C1]), filter(nil)
      values({NULL}, {NULL}, {1})
insert into t2 values(null),(null),(1);

EXPLAIN select * from t1 where (select count(t2.c1) from t2 where rownum+1<4) > 0;
Query Plan
=====================================================
|ID|OPERATOR             |NAME|EST.ROWS|EST.TIME(us)|
-----------------------------------------------------
|0 |SUBPLAN FILTER       |    |1       |5           |
|1 |├─TABLE FULL SCAN    |T1  |1       |3           |
|2 |└─SCALAR GROUP BY    |    |1       |3           |
|3 |  └─COUNT            |    |1       |3           |
|4 |    └─TABLE FULL SCAN|T2  |3       |3           |
=====================================================
Outputs & filters:
-------------------------------------
  0 - output([T1.C1]), filter(nil), rowset=16
      exec_params_(nil), onetime_exprs_([subquery(1)(:0)]), init_plan_idxs_(nil), use_batch=false
  1 - output([T1.C1]), filter(nil), startup_filter([:0 > 0]), rowset=16
      access([T1.C1]), partitions(p0)
      is_index_back=false, is_global_index=false, 
      range_key([T1.__pk_increment]), range(MIN ; MAX)always true
  2 - output([T_FUN_COUNT(T2.C1)]), filter(nil), rowset=16
      group(nil), agg_func([T_FUN_COUNT(T2.C1)])
  3 - output([T2.C1]), filter([rownum() + cast(1, NUMBER(-1, -85)) < 4])
  4 - output([T2.C1]), filter(nil), rowset=16
      access([T2.C1]), partitions(p0)
      is_index_back=false, is_global_index=false, 
      range_key([T2.__pk_increment]), range(MIN ; MAX)always true
select * from t1 where (select count(t2.c1) from t2 where rownum+1<4) > 0;
+------+
| C1   |
+------+
+------+
EXPLAIN select /*+no_rewrite*/ * from t1 where (select count(t2.c1) from t2 where rownum+1<4) > 0;
Query Plan
=====================================================
|ID|OPERATOR             |NAME|EST.ROWS|EST.TIME(us)|
-----------------------------------------------------
|0 |SUBPLAN FILTER       |    |1       |5           |
|1 |├─TABLE FULL SCAN    |T1  |1       |3           |
|2 |└─SCALAR GROUP BY    |    |1       |3           |
|3 |  └─COUNT            |    |1       |3           |
|4 |    └─TABLE FULL SCAN|T2  |3       |3           |
=====================================================
Outputs & filters:
-------------------------------------
  0 - output([T1.C1]), filter(nil), rowset=16
      exec_params_(nil), onetime_exprs_([subquery(1)(:0)]), init_plan_idxs_(nil), use_batch=false
  1 - output([T1.C1]), filter(nil), startup_filter([:0 > 0]), rowset=16
      access([T1.C1]), partitions(p0)
      is_index_back=false, is_global_index=false, 
      range_key([T1.__pk_increment]), range(MIN ; MAX)always true
  2 - output([T_FUN_COUNT(T2.C1)]), filter(nil), rowset=16
      group(nil), agg_func([T_FUN_COUNT(T2.C1)])
  3 - output([T2.C1]), filter([rownum() + cast(1, NUMBER(-1, -85)) < 4])
  4 - output([T2.C1]), filter(nil), rowset=16
      access([T2.C1]), partitions(p0)
      is_index_back=false, is_global_index=false, 
      range_key([T2.__pk_increment]), range(MIN ; MAX)always true
select /*+no_rewrite*/ * from t1 where (select count(t2.c1) from t2 where rownum+1<4) > 0;
+------+
| C1   |
+------+
+------+
EXPLAIN select * from t1 where (select count(t2.c1) from t2) > 0 and (select count(t2.c1) from t2 where rownum+1<4) > 0;
Query Plan
=====================================================
|ID|OPERATOR             |NAME|EST.ROWS|EST.TIME(us)|
-----------------------------------------------------
|0 |SUBPLAN FILTER       |    |1       |7           |
|1 |├─TABLE FULL SCAN    |T1  |1       |3           |
|2 |├─SCALAR GROUP BY    |    |1       |3           |
|3 |│ └─COUNT            |    |1       |3           |
|4 |│   └─TABLE FULL SCAN|T2  |3       |3           |
|5 |└─TABLE FULL SCAN    |T2  |1       |3           |
=====================================================
Outputs & filters:
-------------------------------------
  0 - output([T1.C1]), filter(nil), rowset=16
      exec_params_(nil), onetime_exprs_([subquery(1)(:0)], [(T_OP_EXISTS, subquery(2))(:1)]), init_plan_idxs_(nil), use_batch=false
  1 - output([T1.C1]), filter(nil), startup_filter([:0 > 0], [:1]), rowset=16
      access([T1.C1]), partitions(p0)
      is_index_back=false, is_global_index=false, 
      range_key([T1.__pk_increment]), range(MIN ; MAX)always true
  2 - output([T_FUN_COUNT(T2.C1)]), filter(nil), rowset=16
      group(nil), agg_func([T_FUN_COUNT(T2.C1)])
  3 - output([T2.C1]), filter([rownum() + cast(1, NUMBER(-1, -85)) < 4])
  4 - output([T2.C1]), filter(nil), rowset=16
      access([T2.C1]), partitions(p0)
      is_index_back=false, is_global_index=false, 
      range_key([T2.__pk_increment]), range(MIN ; MAX)always true
  5 - output([1]), filter([T2.C1 IS NOT NULL]), rowset=16
      access([T2.C1]), partitions(p0)
      limit(1), offset(nil), is_index_back=false, is_global_index=false, filter_before_indexback[false], 
      range_key([T2.__pk_increment]), range(MIN ; MAX)always true
select * from t1 where (select count(t2.c1) from t2) > 0 and (select count(t2.c1) from t2 where rownum+1<4) > 0;
+------+
| C1   |
+------+
+------+
EXPLAIN select /*+no_rewrite*/ * from t1 where (select count(t2.c1) from t2) > 0 and (select count(t2.c1) from t2 where rownum+1<4) > 0;
Query Plan
=====================================================
|ID|OPERATOR             |NAME|EST.ROWS|EST.TIME(us)|
-----------------------------------------------------
|0 |SUBPLAN FILTER       |    |1       |7           |
|1 |├─TABLE FULL SCAN    |T1  |1       |3           |
|2 |├─SCALAR GROUP BY    |    |1       |3           |
|3 |│ └─TABLE FULL SCAN  |T2  |3       |3           |
|4 |└─SCALAR GROUP BY    |    |1       |3           |
|5 |  └─COUNT            |    |1       |3           |
|6 |    └─TABLE FULL SCAN|T2  |3       |3           |
=====================================================
Outputs & filters:
-------------------------------------
  0 - output([T1.C1]), filter(nil), rowset=16
      exec_params_(nil), onetime_exprs_([subquery(1)(:0)], [subquery(2)(:1)]), init_plan_idxs_(nil), use_batch=false
  1 - output([T1.C1]), filter(nil), startup_filter([:0 > 0], [:1 > 0]), rowset=16
      access([T1.C1]), partitions(p0)
      is_index_back=false, is_global_index=false, 
      range_key([T1.__pk_increment]), range(MIN ; MAX)always true
  2 - output([T_FUN_COUNT_SUM(T_FUN_COUNT(T2.C1))]), filter(nil), rowset=16
      group(nil), agg_func([T_FUN_COUNT_SUM(T_FUN_COUNT(T2.C1))])
  3 - output([T_FUN_COUNT(T2.C1)]), filter(nil), rowset=16
      access([T2.C1]), partitions(p0)
      is_index_back=false, is_global_index=false, 
      range_key([T2.__pk_increment]), range(MIN ; MAX)always true, 
      pushdown_aggregation([T_FUN_COUNT(T2.C1)])
  4 - output([T_FUN_COUNT(T2.C1)]), filter(nil), rowset=16
      group(nil), agg_func([T_FUN_COUNT(T2.C1)])
  5 - output([T2.C1]), filter([rownum() + cast(1, NUMBER(-1, -85)) < 4])
  6 - output([T2.C1]), filter(nil), rowset=16
      access([T2.C1]), partitions(p0)
      is_index_back=false, is_global_index=false, 
      range_key([T2.__pk_increment]), range(MIN ; MAX)always true
select /*+no_rewrite*/ * from t1 where (select count(t2.c1) from t2) > 0 and (select count(t2.c1) from t2 where rownum+1<4) > 0;
+------+
| C1   |
+------+
+------+

drop table t1;
drop table t2;
