drop table t1;
drop table t2;
drop table t3;
drop table tpart;
drop sequence seq;
create table t1 (c1 int primary key, c2 int, c3 int, c4 int);
create table t2 (c1 int, c2 int, c3 int, c4 int);
create table t3 (c1 int, c2 int, c3 int, c4 int);
create table tpart (c1 int primary key, c2 int, c3 int, c4 int) partition by hash(c1) partitions 4;
create index gidx_c2 on tpart(c2) global partition by hash(c2) partitions 4;
create sequence seq;
set autocommit=0;
explain_protocol: 2
result_format: 4
## test rownum
EXPLAIN select * from t1 where 2 * t1.c2 > (select avg(c2) from t2 where t2.c1 > t1.c1) and rownum <= 5;
Query Plan
==========================================================
|ID|OPERATOR                  |NAME|EST.ROWS|EST.TIME(us)|
----------------------------------------------------------
|0 |EXCHANGE IN REMOTE        |    |1       |177         |
|1 |└─EXCHANGE OUT REMOTE     |    |1       |176         |
|2 |  └─LIMIT                 |    |1       |175         |
|3 |    └─HASH GROUP BY       |    |1       |175         |
|4 |      └─NESTED-LOOP JOIN  |    |25      |168         |
|5 |        ├─TABLE FULL SCAN |T2  |10      |3           |
|6 |        └─TABLE RANGE SCAN|T1  |17      |16          |
==========================================================
Outputs & filters:
-------------------------------------
  0 - output([T1.C1], [T1.C2], [T1.C3], [T1.C4]), filter(nil)
  1 - output([T1.C1], [T1.C2], [T1.C3], [T1.C4]), filter(nil)
  2 - output([T1.C1], [T1.C2], [T1.C3], [T1.C4]), filter(nil), rowset=256
      limit(cast(FLOOR(5), BIGINT(-1, 0))), offset(nil)
  3 - output([T1.C1], [T1.C2], [T1.C3], [T1.C4]), filter([cast(2, NUMBER(-1, -85)) * T1.C2 > T_FUN_SUM(T2.C2) / T_FUN_COUNT(T2.C2)]), rowset=256
      group([T1.C1]), agg_func([T_FUN_SUM(T2.C2)], [T_FUN_COUNT(T2.C2)])
  4 - output([T1.C1], [T1.C2], [T1.C3], [T1.C4], [T2.C2]), filter(nil), rowset=256
      conds(nil), nl_params_([T2.C1(:0)]), use_batch=true
  5 - output([T2.C1], [T2.C2]), filter(nil), rowset=256
      access([T2.C1], [T2.C2]), partitions(p0)
      is_index_back=false, is_global_index=false, 
      range_key([T2.__pk_increment]), range(MIN ; MAX)always true
  6 - output([T1.C1], [T1.C2], [T1.C3], [T1.C4]), filter(nil), rowset=256
      access([GROUP_ID], [T1.C1], [T1.C2], [T1.C3], [T1.C4]), partitions(p0)
      is_index_back=false, is_global_index=false, 
      range_key([T1.C1]), range(MIN ; MAX), 
      range_cond([:0 > T1.C1])
select * from t1 where 2 * t1.c2 > (select avg(c2) from t2 where t2.c1 > t1.c1) and rownum <= 5;
+----+------+------+------+
| C1 | C2   | C3   | C4   |
+----+------+------+------+
| 16 |   16 |   16 |   16 |
| 17 |   17 |   17 |   17 |
| 18 |   18 |   18 |   18 |
| 19 |   19 |   19 |   19 |
| 20 |   20 |   20 |   20 |
+----+------+------+------+
EXPLAIN select * from t1 where 2 * t1.c2 > (select /*+no_unnest*/ avg(c2) from t2 where t2.c1 > t1.c1) and rownum <= 5;
Query Plan
=========================================================
|ID|OPERATOR                 |NAME|EST.ROWS|EST.TIME(us)|
---------------------------------------------------------
|0 |EXCHANGE IN REMOTE       |    |5       |293         |
|1 |└─EXCHANGE OUT REMOTE    |    |5       |287         |
|2 |  └─LIMIT                |    |5       |274         |
|3 |    └─SUBPLAN FILTER     |    |5       |274         |
|4 |      ├─TABLE FULL SCAN  |T1  |15      |4           |
|5 |      └─SCALAR GROUP BY  |    |1       |19          |
|6 |        └─TABLE FULL SCAN|T2  |4       |18          |
=========================================================
Outputs & filters:
-------------------------------------
  0 - output([T1.C1], [T1.C2], [T1.C3], [T1.C4]), filter(nil)
  1 - output([T1.C1], [T1.C2], [T1.C3], [T1.C4]), filter(nil)
  2 - output([T1.C1], [T1.C2], [T1.C3], [T1.C4]), filter(nil), rowset=16
      limit(cast(FLOOR(5), BIGINT(-1, 0))), offset(nil)
  3 - output([T1.C1], [T1.C2], [T1.C3], [T1.C4]), filter([cast(2, NUMBER(-1, -85)) * T1.C2 > subquery(1)]), rowset=16
      exec_params_([T1.C1(:0)]), onetime_exprs_(nil), init_plan_idxs_(nil), use_batch=false
  4 - output([T1.C1], [T1.C2], [T1.C3], [T1.C4]), filter(nil), rowset=16
      access([T1.C1], [T1.C2], [T1.C3], [T1.C4]), partitions(p0)
      is_index_back=false, is_global_index=false, 
      range_key([T1.C1]), range(MIN ; MAX)always true
  5 - output([T_FUN_SUM(T_FUN_SUM(T2.C2)) / T_FUN_COUNT_SUM(T_FUN_COUNT(T2.C2))]), filter(nil), rowset=16
      group(nil), agg_func([T_FUN_SUM(T_FUN_SUM(T2.C2))], [T_FUN_COUNT_SUM(T_FUN_COUNT(T2.C2))])
  6 - output([T_FUN_SUM(T2.C2)], [T_FUN_COUNT(T2.C2)]), filter([T2.C1 > :0]), rowset=16
      access([T2.C1], [T2.C2]), partitions(p0)
      is_index_back=false, is_global_index=false, filter_before_indexback[false], 
      range_key([T2.__pk_increment]), range(MIN ; MAX)always true, 
      pushdown_aggregation([T_FUN_SUM(T2.C2)], [T_FUN_COUNT(T2.C2)])
select * from t1 where 2 * t1.c2 > (select /*+no_unnest*/ avg(c2) from t2 where t2.c1 > t1.c1) and rownum <= 5;
+----+------+------+------+
| C1 | C2   | C3   | C4   |
+----+------+------+------+
| 16 |   16 |   16 |   16 |
| 17 |   17 |   17 |   17 |
| 18 |   18 |   18 |   18 |
| 19 |   19 |   19 |   19 |
| 20 |   20 |   20 |   20 |
+----+------+------+------+

EXPLAIN select (select avg(c2) from t2 where t2.c1 > t1.c1) as aggr from t1 where rownum <= 5;
Query Plan
===============================================================
|ID|OPERATOR                       |NAME|EST.ROWS|EST.TIME(us)|
---------------------------------------------------------------
|0 |EXCHANGE IN REMOTE             |    |5       |12          |
|1 |└─EXCHANGE OUT REMOTE          |    |5       |10          |
|2 |  └─LIMIT                      |    |5       |4           |
|3 |    └─MERGE GROUP BY           |    |5       |4           |
|4 |      └─NESTED-LOOP OUTER JOIN |    |5       |4           |
|5 |        ├─TABLE FULL SCAN      |T1  |5       |3           |
|6 |        └─MATERIAL             |    |10      |4           |
|7 |          └─TABLE FULL SCAN    |T2  |10      |3           |
===============================================================
Outputs & filters:
-------------------------------------
  0 - output([T_FUN_SUM(T2.C2) / T_FUN_COUNT(T2.C2)]), filter(nil)
  1 - output([T_FUN_SUM(T2.C2) / T_FUN_COUNT(T2.C2)]), filter(nil)
  2 - output([T_FUN_SUM(T2.C2) / T_FUN_COUNT(T2.C2)]), filter(nil), rowset=16
      limit(cast(FLOOR(5), BIGINT(-1, 0))), offset(nil)
  3 - output([T_FUN_SUM(T2.C2)], [T_FUN_COUNT(T2.C2)]), filter(nil), rowset=16
      group([T1.C1]), agg_func([T_FUN_SUM(T2.C2)], [T_FUN_COUNT(T2.C2)])
  4 - output([T1.C1], [T2.C2]), filter(nil), rowset=16
      conds([T2.C1 > T1.C1]), nl_params_(nil), use_batch=false
  5 - output([T1.C1]), filter(nil), rowset=16
      access([T1.C1]), partitions(p0)
      is_index_back=false, is_global_index=false, 
      range_key([T1.C1]), range(MIN ; MAX)always true
  6 - output([T2.C2], [T2.C1]), filter(nil), rowset=16
  7 - output([T2.C1], [T2.C2]), filter(nil), rowset=16
      access([T2.C1], [T2.C2]), partitions(p0)
      is_index_back=false, is_global_index=false, 
      range_key([T2.__pk_increment]), range(MIN ; MAX)always true
select (select avg(c2) from t2 where t2.c1 > t1.c1) as aggr from t1 where rownum <= 5;
+------+
| AGGR |
+------+
|   25 |
|   25 |
|   25 |
|   25 |
|   25 |
+------+
EXPLAIN select (select /*+no_unnest*/ avg(c2) from t2 where t2.c1 > t1.c1) as aggr from t1 where rownum <= 5;
Query Plan
=======================================================
|ID|OPERATOR               |NAME|EST.ROWS|EST.TIME(us)|
-------------------------------------------------------
|0 |EXCHANGE IN REMOTE     |    |5       |98          |
|1 |└─EXCHANGE OUT REMOTE  |    |5       |96          |
|2 |  └─SUBPLAN FILTER     |    |5       |93          |
|3 |    ├─TABLE FULL SCAN  |T1  |5       |3           |
|4 |    └─SCALAR GROUP BY  |    |1       |19          |
|5 |      └─TABLE FULL SCAN|T2  |4       |18          |
=======================================================
Outputs & filters:
-------------------------------------
  0 - output([subquery(1)]), filter(nil)
  1 - output([subquery(1)]), filter(nil)
  2 - output([subquery(1)]), filter(nil), rowset=16
      exec_params_([T1.C1(:0)]), onetime_exprs_(nil), init_plan_idxs_(nil), use_batch=false
  3 - output([T1.C1]), filter(nil), rowset=16
      access([T1.C1]), partitions(p0)
      limit(cast(FLOOR(5), BIGINT(-1, 0))), offset(nil), is_index_back=false, is_global_index=false, 
      range_key([T1.C1]), range(MIN ; MAX)always true
  4 - output([T_FUN_SUM(T_FUN_SUM(T2.C2)) / T_FUN_COUNT_SUM(T_FUN_COUNT(T2.C2))]), filter(nil), rowset=16
      group(nil), agg_func([T_FUN_SUM(T_FUN_SUM(T2.C2))], [T_FUN_COUNT_SUM(T_FUN_COUNT(T2.C2))])
  5 - output([T_FUN_SUM(T2.C2)], [T_FUN_COUNT(T2.C2)]), filter([T2.C1 > :0]), rowset=16
      access([T2.C1], [T2.C2]), partitions(p0)
      is_index_back=false, is_global_index=false, filter_before_indexback[false], 
      range_key([T2.__pk_increment]), range(MIN ; MAX)always true, 
      pushdown_aggregation([T_FUN_SUM(T2.C2)], [T_FUN_COUNT(T2.C2)])
select (select /*+no_unnest*/ avg(c2) from t2 where t2.c1 > t1.c1) as aggr from t1 where rownum <= 5;
+------+
| AGGR |
+------+
|   25 |
|   25 |
|   25 |
|   25 |
|   25 |
+------+

EXPLAIN select t1.*, rownum as rn from t1 where 2 * t1.c2 > (select avg(c2) from t2 where t2.c1 > t1.c1);
Query Plan
=============================================================
|ID|OPERATOR                    |NAME |EST.ROWS|EST.TIME(us)|
-------------------------------------------------------------
|0 |EXCHANGE IN REMOTE          |     |1       |177         |
|1 |└─EXCHANGE OUT REMOTE       |     |1       |177         |
|2 |  └─COUNT                   |     |1       |175         |
|3 |    └─SUBPLAN SCAN          |VIEW1|1       |175         |
|4 |      └─HASH GROUP BY       |     |1       |175         |
|5 |        └─NESTED-LOOP JOIN  |     |25      |168         |
|6 |          ├─TABLE FULL SCAN |T2   |10      |3           |
|7 |          └─TABLE RANGE SCAN|T1   |17      |16          |
=============================================================
Outputs & filters:
-------------------------------------
  0 - output([VIEW1.T1.C1], [VIEW1.T1.C2], [VIEW1.T1.C3], [VIEW1.T1.C4], [rownum()]), filter(nil)
  1 - output([VIEW1.T1.C1], [VIEW1.T1.C2], [VIEW1.T1.C3], [VIEW1.T1.C4], [rownum()]), filter(nil)
  2 - output([VIEW1.T1.C1], [VIEW1.T1.C2], [VIEW1.T1.C3], [VIEW1.T1.C4], [rownum()]), filter(nil)
  3 - output([VIEW1.T1.C1], [VIEW1.T1.C2], [VIEW1.T1.C3], [VIEW1.T1.C4]), filter(nil), rowset=256
      access([VIEW1.T1.C1], [VIEW1.T1.C2], [VIEW1.T1.C3], [VIEW1.T1.C4])
  4 - output([T1.C1], [T1.C2], [T1.C3], [T1.C4]), filter([cast(2, NUMBER(-1, -85)) * T1.C2 > T_FUN_SUM(T2.C2) / T_FUN_COUNT(T2.C2)]), rowset=256
      group([T1.C1]), agg_func([T_FUN_SUM(T2.C2)], [T_FUN_COUNT(T2.C2)])
  5 - output([T1.C1], [T2.C2], [T1.C2], [T1.C3], [T1.C4]), filter(nil), rowset=256
      conds(nil), nl_params_([T2.C1(:0)]), use_batch=true
  6 - output([T2.C1], [T2.C2]), filter(nil), rowset=256
      access([T2.C1], [T2.C2]), partitions(p0)
      is_index_back=false, is_global_index=false, 
      range_key([T2.__pk_increment]), range(MIN ; MAX)always true
  7 - output([T1.C1], [T1.C2], [T1.C3], [T1.C4]), filter(nil), rowset=256
      access([GROUP_ID], [T1.C1], [T1.C2], [T1.C3], [T1.C4]), partitions(p0)
      is_index_back=false, is_global_index=false, 
      range_key([T1.C1]), range(MIN ; MAX), 
      range_cond([:0 > T1.C1])
select t1.*, rownum as rn from t1 where 2 * t1.c2 > (select avg(c2) from t2 where t2.c1 > t1.c1);
+----+------+------+------+------+
| C1 | C2   | C3   | C4   | RN   |
+----+------+------+------+------+
| 16 |   16 |   16 |   16 |    1 |
| 17 |   17 |   17 |   17 |    2 |
| 18 |   18 |   18 |   18 |    3 |
| 19 |   19 |   19 |   19 |    4 |
| 20 |   20 |   20 |   20 |    5 |
| 21 |   21 |   21 |   21 |    6 |
| 22 |   22 |   22 |   22 |    7 |
| 23 |   23 |   23 |   23 |    8 |
| 24 |   24 |   24 |   24 |    9 |
| 25 |   25 |   25 |   25 |   10 |
| 26 |   26 |   26 |   26 |   11 |
| 27 |   27 |   27 |   27 |   12 |
| 28 |   28 |   28 |   28 |   13 |
| 29 |   29 |   29 |   29 |   14 |
| 30 |   30 |   30 |   30 |   15 |
| 31 |   31 |   31 |   31 |   16 |
| 32 |   32 |   32 |   32 |   17 |
| 33 |   33 |   33 |   33 |   18 |
| 34 |   34 |   34 |   34 |   19 |
| 35 |   35 |   35 |   35 |   20 |
| 36 |   36 |   36 |   36 |   21 |
| 37 |   37 |   37 |   37 |   22 |
| 38 |   38 |   38 |   38 |   23 |
| 39 |   39 |   39 |   39 |   24 |
| 40 |   40 |   40 |   40 |   25 |
| 41 |   41 |   41 |   41 |   26 |
| 42 |   42 |   42 |   42 |   27 |
| 43 |   43 |   43 |   43 |   28 |
| 44 |   44 |   44 |   44 |   29 |
| 45 |   45 |   45 |   45 |   30 |
| 46 |   46 |   46 |   46 |   31 |
| 47 |   47 |   47 |   47 |   32 |
| 48 |   48 |   48 |   48 |   33 |
| 49 |   49 |   49 |   49 |   34 |
+----+------+------+------+------+
EXPLAIN select t1.*, rownum as rn from t1 where 2 * t1.c2 > (select /*+no_unnest*/ avg(c2) from t2 where t2.c1 > t1.c1);
Query Plan
=========================================================
|ID|OPERATOR                 |NAME|EST.ROWS|EST.TIME(us)|
---------------------------------------------------------
|0 |EXCHANGE IN REMOTE       |    |17      |974         |
|1 |└─EXCHANGE OUT REMOTE    |    |17      |953         |
|2 |  └─COUNT                |    |17      |908         |
|3 |    └─SUBPLAN FILTER     |    |17      |908         |
|4 |      ├─TABLE FULL SCAN  |T1  |50      |6           |
|5 |      └─SCALAR GROUP BY  |    |1       |19          |
|6 |        └─TABLE FULL SCAN|T2  |4       |18          |
=========================================================
Outputs & filters:
-------------------------------------
  0 - output([T1.C1], [T1.C2], [T1.C3], [T1.C4], [rownum()]), filter(nil)
  1 - output([T1.C1], [T1.C2], [T1.C3], [T1.C4], [rownum()]), filter(nil)
  2 - output([T1.C1], [T1.C2], [T1.C3], [T1.C4], [rownum()]), filter(nil)
  3 - output([T1.C1], [T1.C2], [T1.C3], [T1.C4]), filter([cast(2, NUMBER(-1, -85)) * T1.C2 > subquery(1)]), rowset=256
      exec_params_([T1.C1(:0)]), onetime_exprs_(nil), init_plan_idxs_(nil), use_batch=false
  4 - output([T1.C1], [T1.C2], [T1.C3], [T1.C4]), filter(nil), rowset=256
      access([T1.C1], [T1.C2], [T1.C3], [T1.C4]), partitions(p0)
      is_index_back=false, is_global_index=false, 
      range_key([T1.C1]), range(MIN ; MAX)always true
  5 - output([T_FUN_SUM(T_FUN_SUM(T2.C2)) / T_FUN_COUNT_SUM(T_FUN_COUNT(T2.C2))]), filter(nil), rowset=256
      group(nil), agg_func([T_FUN_SUM(T_FUN_SUM(T2.C2))], [T_FUN_COUNT_SUM(T_FUN_COUNT(T2.C2))])
  6 - output([T_FUN_SUM(T2.C2)], [T_FUN_COUNT(T2.C2)]), filter([T2.C1 > :0]), rowset=256
      access([T2.C1], [T2.C2]), partitions(p0)
      is_index_back=false, is_global_index=false, filter_before_indexback[false], 
      range_key([T2.__pk_increment]), range(MIN ; MAX)always true, 
      pushdown_aggregation([T_FUN_SUM(T2.C2)], [T_FUN_COUNT(T2.C2)])
select t1.*, rownum as rn from t1 where 2 * t1.c2 > (select /*+no_unnest*/ avg(c2) from t2 where t2.c1 > t1.c1);
+----+------+------+------+------+
| C1 | C2   | C3   | C4   | RN   |
+----+------+------+------+------+
| 16 |   16 |   16 |   16 |    1 |
| 17 |   17 |   17 |   17 |    2 |
| 18 |   18 |   18 |   18 |    3 |
| 19 |   19 |   19 |   19 |    4 |
| 20 |   20 |   20 |   20 |    5 |
| 21 |   21 |   21 |   21 |    6 |
| 22 |   22 |   22 |   22 |    7 |
| 23 |   23 |   23 |   23 |    8 |
| 24 |   24 |   24 |   24 |    9 |
| 25 |   25 |   25 |   25 |   10 |
| 26 |   26 |   26 |   26 |   11 |
| 27 |   27 |   27 |   27 |   12 |
| 28 |   28 |   28 |   28 |   13 |
| 29 |   29 |   29 |   29 |   14 |
| 30 |   30 |   30 |   30 |   15 |
| 31 |   31 |   31 |   31 |   16 |
| 32 |   32 |   32 |   32 |   17 |
| 33 |   33 |   33 |   33 |   18 |
| 34 |   34 |   34 |   34 |   19 |
| 35 |   35 |   35 |   35 |   20 |
| 36 |   36 |   36 |   36 |   21 |
| 37 |   37 |   37 |   37 |   22 |
| 38 |   38 |   38 |   38 |   23 |
| 39 |   39 |   39 |   39 |   24 |
| 40 |   40 |   40 |   40 |   25 |
| 41 |   41 |   41 |   41 |   26 |
| 42 |   42 |   42 |   42 |   27 |
| 43 |   43 |   43 |   43 |   28 |
| 44 |   44 |   44 |   44 |   29 |
| 45 |   45 |   45 |   45 |   30 |
| 46 |   46 |   46 |   46 |   31 |
| 47 |   47 |   47 |   47 |   32 |
| 48 |   48 |   48 |   48 |   33 |
| 49 |   49 |   49 |   49 |   34 |
+----+------+------+------+------+

EXPLAIN select (select avg(c2) from t2 where t2.c1 > t1.c1) as aggr, rownum as rn from t1;
Query Plan
=======================================================
|ID|OPERATOR               |NAME|EST.ROWS|EST.TIME(us)|
-------------------------------------------------------
|0 |EXCHANGE IN REMOTE     |    |50      |960         |
|1 |└─EXCHANGE OUT REMOTE  |    |50      |943         |
|2 |  └─SUBPLAN FILTER     |    |50      |906         |
|3 |    ├─COUNT            |    |50      |4           |
|4 |    │ └─TABLE FULL SCAN|T1  |50      |4           |
|5 |    └─SCALAR GROUP BY  |    |1       |19          |
|6 |      └─TABLE FULL SCAN|T2  |4       |18          |
=======================================================
Outputs & filters:
-------------------------------------
  0 - output([subquery(1)], [rownum()]), filter(nil)
  1 - output([subquery(1)], [rownum()]), filter(nil)
  2 - output([subquery(1)], [rownum()]), filter(nil), rowset=256
      exec_params_([T1.C1(:0)]), onetime_exprs_(nil), init_plan_idxs_(nil), use_batch=false
  3 - output([rownum()], [T1.C1]), filter(nil)
  4 - output([T1.C1]), filter(nil), rowset=256
      access([T1.C1]), partitions(p0)
      is_index_back=false, is_global_index=false, 
      range_key([T1.C1]), range(MIN ; MAX)always true
  5 - output([T_FUN_SUM(T_FUN_SUM(T2.C2)) / T_FUN_COUNT_SUM(T_FUN_COUNT(T2.C2))]), filter(nil), rowset=256
      group(nil), agg_func([T_FUN_SUM(T_FUN_SUM(T2.C2))], [T_FUN_COUNT_SUM(T_FUN_COUNT(T2.C2))])
  6 - output([T_FUN_SUM(T2.C2)], [T_FUN_COUNT(T2.C2)]), filter([T2.C1 > :0]), rowset=256
      access([T2.C1], [T2.C2]), partitions(p0)
      is_index_back=false, is_global_index=false, filter_before_indexback[false], 
      range_key([T2.__pk_increment]), range(MIN ; MAX)always true, 
      pushdown_aggregation([T_FUN_SUM(T2.C2)], [T_FUN_COUNT(T2.C2)])
select (select avg(c2) from t2 where t2.c1 > t1.c1) as aggr, rownum as rn from t1;
+------+------+
| AGGR | RN   |
+------+------+
|   25 |    1 |
|   25 |    2 |
|   25 |    3 |
|   25 |    4 |
|   25 |    5 |
|   25 |    6 |
|   25 |    7 |
|   25 |    8 |
|   25 |    9 |
|   30 |   10 |
|   30 |   11 |
|   30 |   12 |
|   30 |   13 |
|   30 |   14 |
|   30 |   15 |
|   30 |   16 |
|   30 |   17 |
|   30 |   18 |
|   30 |   19 |
|   35 |   20 |
|   35 |   21 |
|   35 |   22 |
|   35 |   23 |
|   35 |   24 |
|   35 |   25 |
|   35 |   26 |
|   35 |   27 |
|   35 |   28 |
|   35 |   29 |
|   40 |   30 |
|   40 |   31 |
|   40 |   32 |
|   40 |   33 |
|   40 |   34 |
|   40 |   35 |
|   40 |   36 |
|   40 |   37 |
|   40 |   38 |
|   40 |   39 |
|   45 |   40 |
|   45 |   41 |
|   45 |   42 |
|   45 |   43 |
|   45 |   44 |
|   45 |   45 |
|   45 |   46 |
|   45 |   47 |
|   45 |   48 |
|   45 |   49 |
| NULL |   50 |
+------+------+
EXPLAIN select (select /*+no_unnest*/ avg(c2) from t2 where t2.c1 > t1.c1) as aggr, rownum as rn from t1;
Query Plan
=======================================================
|ID|OPERATOR               |NAME|EST.ROWS|EST.TIME(us)|
-------------------------------------------------------
|0 |EXCHANGE IN REMOTE     |    |50      |960         |
|1 |└─EXCHANGE OUT REMOTE  |    |50      |943         |
|2 |  └─SUBPLAN FILTER     |    |50      |906         |
|3 |    ├─COUNT            |    |50      |4           |
|4 |    │ └─TABLE FULL SCAN|T1  |50      |4           |
|5 |    └─SCALAR GROUP BY  |    |1       |19          |
|6 |      └─TABLE FULL SCAN|T2  |4       |18          |
=======================================================
Outputs & filters:
-------------------------------------
  0 - output([subquery(1)], [rownum()]), filter(nil)
  1 - output([subquery(1)], [rownum()]), filter(nil)
  2 - output([subquery(1)], [rownum()]), filter(nil), rowset=256
      exec_params_([T1.C1(:0)]), onetime_exprs_(nil), init_plan_idxs_(nil), use_batch=false
  3 - output([rownum()], [T1.C1]), filter(nil)
  4 - output([T1.C1]), filter(nil), rowset=256
      access([T1.C1]), partitions(p0)
      is_index_back=false, is_global_index=false, 
      range_key([T1.C1]), range(MIN ; MAX)always true
  5 - output([T_FUN_SUM(T_FUN_SUM(T2.C2)) / T_FUN_COUNT_SUM(T_FUN_COUNT(T2.C2))]), filter(nil), rowset=256
      group(nil), agg_func([T_FUN_SUM(T_FUN_SUM(T2.C2))], [T_FUN_COUNT_SUM(T_FUN_COUNT(T2.C2))])
  6 - output([T_FUN_SUM(T2.C2)], [T_FUN_COUNT(T2.C2)]), filter([T2.C1 > :0]), rowset=256
      access([T2.C1], [T2.C2]), partitions(p0)
      is_index_back=false, is_global_index=false, filter_before_indexback[false], 
      range_key([T2.__pk_increment]), range(MIN ; MAX)always true, 
      pushdown_aggregation([T_FUN_SUM(T2.C2)], [T_FUN_COUNT(T2.C2)])
select (select /*+no_unnest*/ avg(c2) from t2 where t2.c1 > t1.c1) as aggr, rownum as rn from t1;
+------+------+
| AGGR | RN   |
+------+------+
|   25 |    1 |
|   25 |    2 |
|   25 |    3 |
|   25 |    4 |
|   25 |    5 |
|   25 |    6 |
|   25 |    7 |
|   25 |    8 |
|   25 |    9 |
|   30 |   10 |
|   30 |   11 |
|   30 |   12 |
|   30 |   13 |
|   30 |   14 |
|   30 |   15 |
|   30 |   16 |
|   30 |   17 |
|   30 |   18 |
|   30 |   19 |
|   35 |   20 |
|   35 |   21 |
|   35 |   22 |
|   35 |   23 |
|   35 |   24 |
|   35 |   25 |
|   35 |   26 |
|   35 |   27 |
|   35 |   28 |
|   35 |   29 |
|   40 |   30 |
|   40 |   31 |
|   40 |   32 |
|   40 |   33 |
|   40 |   34 |
|   40 |   35 |
|   40 |   36 |
|   40 |   37 |
|   40 |   38 |
|   40 |   39 |
|   45 |   40 |
|   45 |   41 |
|   45 |   42 |
|   45 |   43 |
|   45 |   44 |
|   45 |   45 |
|   45 |   46 |
|   45 |   47 |
|   45 |   48 |
|   45 |   49 |
| NULL |   50 |
+------+------+

EXPLAIN select * from t1 where 2 * t1.c2 > (select avg(c2) from t2 where t2.c1 > t1.c1 and rownum <= 5);
Query Plan
==========================================================
|ID|OPERATOR                 |NAME |EST.ROWS|EST.TIME(us)|
----------------------------------------------------------
|0 |EXCHANGE IN REMOTE       |     |17      |972         |
|1 |└─EXCHANGE OUT REMOTE    |     |17      |952         |
|2 |  └─SUBPLAN FILTER       |     |17      |908         |
|3 |    ├─TABLE FULL SCAN    |T1   |50      |6           |
|4 |    └─SCALAR GROUP BY    |     |1       |19          |
|5 |      └─SUBPLAN SCAN     |VIEW1|4       |18          |
|6 |        └─TABLE FULL SCAN|T2   |4       |18          |
==========================================================
Outputs & filters:
-------------------------------------
  0 - output([T1.C1], [T1.C2], [T1.C3], [T1.C4]), filter(nil)
  1 - output([T1.C1], [T1.C2], [T1.C3], [T1.C4]), filter(nil)
  2 - output([T1.C1], [T1.C2], [T1.C3], [T1.C4]), filter([cast(2, NUMBER(-1, -85)) * T1.C2 > subquery(1)]), rowset=256
      exec_params_([T1.C1(:0)]), onetime_exprs_(nil), init_plan_idxs_(nil), use_batch=false
  3 - output([T1.C1], [T1.C2], [T1.C3], [T1.C4]), filter(nil), rowset=256
      access([T1.C1], [T1.C2], [T1.C3], [T1.C4]), partitions(p0)
      is_index_back=false, is_global_index=false, 
      range_key([T1.C1]), range(MIN ; MAX)always true
  4 - output([T_FUN_SUM(VIEW1.T2.C2) / T_FUN_COUNT(VIEW1.T2.C2)]), filter(nil), rowset=256
      group(nil), agg_func([T_FUN_SUM(VIEW1.T2.C2)], [T_FUN_COUNT(VIEW1.T2.C2)])
  5 - output([VIEW1.T2.C2]), filter(nil), rowset=256
      access([VIEW1.T2.C2])
  6 - output([T2.C2]), filter([T2.C1 > :0]), rowset=256
      access([T2.C1], [T2.C2]), partitions(p0)
      limit(cast(FLOOR(5), BIGINT(-1, 0))), offset(nil), is_index_back=false, is_global_index=false, filter_before_indexback[false], 
      range_key([T2.__pk_increment]), range(MIN ; MAX)always true
select * from t1 where 2 * t1.c2 > (select avg(c2) from t2 where t2.c1 > t1.c1 and rownum <= 5);
+----+------+------+------+
| C1 | C2   | C3   | C4   |
+----+------+------+------+
|  7 |    7 |    7 |    7 |
|  8 |    8 |    8 |    8 |
|  9 |    9 |    9 |    9 |
| 12 |   12 |   12 |   12 |
| 13 |   13 |   13 |   13 |
| 14 |   14 |   14 |   14 |
| 15 |   15 |   15 |   15 |
| 16 |   16 |   16 |   16 |
| 17 |   17 |   17 |   17 |
| 18 |   18 |   18 |   18 |
| 19 |   19 |   19 |   19 |
| 20 |   20 |   20 |   20 |
| 21 |   21 |   21 |   21 |
| 22 |   22 |   22 |   22 |
| 23 |   23 |   23 |   23 |
| 24 |   24 |   24 |   24 |
| 25 |   25 |   25 |   25 |
| 26 |   26 |   26 |   26 |
| 27 |   27 |   27 |   27 |
| 28 |   28 |   28 |   28 |
| 29 |   29 |   29 |   29 |
| 30 |   30 |   30 |   30 |
| 31 |   31 |   31 |   31 |
| 32 |   32 |   32 |   32 |
| 33 |   33 |   33 |   33 |
| 34 |   34 |   34 |   34 |
| 35 |   35 |   35 |   35 |
| 36 |   36 |   36 |   36 |
| 37 |   37 |   37 |   37 |
| 38 |   38 |   38 |   38 |
| 39 |   39 |   39 |   39 |
| 40 |   40 |   40 |   40 |
| 41 |   41 |   41 |   41 |
| 42 |   42 |   42 |   42 |
| 43 |   43 |   43 |   43 |
| 44 |   44 |   44 |   44 |
| 45 |   45 |   45 |   45 |
| 46 |   46 |   46 |   46 |
| 47 |   47 |   47 |   47 |
| 48 |   48 |   48 |   48 |
| 49 |   49 |   49 |   49 |
+----+------+------+------+
EXPLAIN select * from t1 where 2 * t1.c2 > (select /*+no_unnest*/ avg(c2) from t2 where t2.c1 > t1.c1 and rownum <= 5);
Query Plan
==========================================================
|ID|OPERATOR                 |NAME |EST.ROWS|EST.TIME(us)|
----------------------------------------------------------
|0 |EXCHANGE IN REMOTE       |     |17      |972         |
|1 |└─EXCHANGE OUT REMOTE    |     |17      |952         |
|2 |  └─SUBPLAN FILTER       |     |17      |908         |
|3 |    ├─TABLE FULL SCAN    |T1   |50      |6           |
|4 |    └─SCALAR GROUP BY    |     |1       |19          |
|5 |      └─SUBPLAN SCAN     |VIEW1|4       |18          |
|6 |        └─TABLE FULL SCAN|T2   |4       |18          |
==========================================================
Outputs & filters:
-------------------------------------
  0 - output([T1.C1], [T1.C2], [T1.C3], [T1.C4]), filter(nil)
  1 - output([T1.C1], [T1.C2], [T1.C3], [T1.C4]), filter(nil)
  2 - output([T1.C1], [T1.C2], [T1.C3], [T1.C4]), filter([cast(2, NUMBER(-1, -85)) * T1.C2 > subquery(1)]), rowset=256
      exec_params_([T1.C1(:0)]), onetime_exprs_(nil), init_plan_idxs_(nil), use_batch=false
  3 - output([T1.C1], [T1.C2], [T1.C3], [T1.C4]), filter(nil), rowset=256
      access([T1.C1], [T1.C2], [T1.C3], [T1.C4]), partitions(p0)
      is_index_back=false, is_global_index=false, 
      range_key([T1.C1]), range(MIN ; MAX)always true
  4 - output([T_FUN_SUM(VIEW1.T2.C2) / T_FUN_COUNT(VIEW1.T2.C2)]), filter(nil), rowset=256
      group(nil), agg_func([T_FUN_SUM(VIEW1.T2.C2)], [T_FUN_COUNT(VIEW1.T2.C2)])
  5 - output([VIEW1.T2.C2]), filter(nil), rowset=256
      access([VIEW1.T2.C2])
  6 - output([T2.C2]), filter([T2.C1 > :0]), rowset=256
      access([T2.C1], [T2.C2]), partitions(p0)
      limit(cast(FLOOR(5), BIGINT(-1, 0))), offset(nil), is_index_back=false, is_global_index=false, filter_before_indexback[false], 
      range_key([T2.__pk_increment]), range(MIN ; MAX)always true
select * from t1 where 2 * t1.c2 > (select /*+no_unnest*/ avg(c2) from t2 where t2.c1 > t1.c1 and rownum <= 5);
+----+------+------+------+
| C1 | C2   | C3   | C4   |
+----+------+------+------+
|  7 |    7 |    7 |    7 |
|  8 |    8 |    8 |    8 |
|  9 |    9 |    9 |    9 |
| 12 |   12 |   12 |   12 |
| 13 |   13 |   13 |   13 |
| 14 |   14 |   14 |   14 |
| 15 |   15 |   15 |   15 |
| 16 |   16 |   16 |   16 |
| 17 |   17 |   17 |   17 |
| 18 |   18 |   18 |   18 |
| 19 |   19 |   19 |   19 |
| 20 |   20 |   20 |   20 |
| 21 |   21 |   21 |   21 |
| 22 |   22 |   22 |   22 |
| 23 |   23 |   23 |   23 |
| 24 |   24 |   24 |   24 |
| 25 |   25 |   25 |   25 |
| 26 |   26 |   26 |   26 |
| 27 |   27 |   27 |   27 |
| 28 |   28 |   28 |   28 |
| 29 |   29 |   29 |   29 |
| 30 |   30 |   30 |   30 |
| 31 |   31 |   31 |   31 |
| 32 |   32 |   32 |   32 |
| 33 |   33 |   33 |   33 |
| 34 |   34 |   34 |   34 |
| 35 |   35 |   35 |   35 |
| 36 |   36 |   36 |   36 |
| 37 |   37 |   37 |   37 |
| 38 |   38 |   38 |   38 |
| 39 |   39 |   39 |   39 |
| 40 |   40 |   40 |   40 |
| 41 |   41 |   41 |   41 |
| 42 |   42 |   42 |   42 |
| 43 |   43 |   43 |   43 |
| 44 |   44 |   44 |   44 |
| 45 |   45 |   45 |   45 |
| 46 |   46 |   46 |   46 |
| 47 |   47 |   47 |   47 |
| 48 |   48 |   48 |   48 |
| 49 |   49 |   49 |   49 |
+----+------+------+------+

## test sequence
EXPLAIN select t1.*, seq.nextval from t1 where 2 * t1.c2 > (select avg(c2) from t2 where t2.c1 > t1.c1);
Query Plan
==============================================================
|ID|OPERATOR                  |NAME    |EST.ROWS|EST.TIME(us)|
--------------------------------------------------------------
|0 |SEQUENCE                  |        |1       |177         |
|1 |└─PX COORDINATOR          |        |1       |177         |
|2 |  └─EXCHANGE OUT DISTR    |:EX10000|1       |176         |
|3 |    └─HASH GROUP BY       |        |1       |175         |
|4 |      └─NESTED-LOOP JOIN  |        |25      |168         |
|5 |        ├─TABLE FULL SCAN |T2      |10      |3           |
|6 |        └─TABLE RANGE SCAN|T1      |17      |16          |
==============================================================
Outputs & filters:
-------------------------------------
  0 - output([T1.C1], [T1.C2], [T1.C3], [T1.C4], [SEQ.NEXTVAL]), filter(nil)
  1 - output([T1.C1], [T1.C2], [T1.C3], [T1.C4]), filter(nil), rowset=256
  2 - output([T1.C1], [T1.C2], [T1.C3], [T1.C4]), filter(nil), rowset=256
      is_single, dop=1
  3 - output([T1.C1], [T1.C2], [T1.C3], [T1.C4]), filter([cast(2, NUMBER(-1, -85)) * T1.C2 > T_FUN_SUM(T2.C2) / T_FUN_COUNT(T2.C2)]), rowset=256
      group([T1.C1]), agg_func([T_FUN_SUM(T2.C2)], [T_FUN_COUNT(T2.C2)])
  4 - output([T1.C1], [T1.C2], [T1.C3], [T1.C4], [T2.C2]), filter(nil), rowset=256
      conds(nil), nl_params_([T2.C1(:0)]), use_batch=true
  5 - output([T2.C1], [T2.C2]), filter(nil), rowset=256
      access([T2.C1], [T2.C2]), partitions(p0)
      is_index_back=false, is_global_index=false, 
      range_key([T2.__pk_increment]), range(MIN ; MAX)always true
  6 - output([T1.C1], [T1.C2], [T1.C3], [T1.C4]), filter(nil), rowset=256
      access([GROUP_ID], [T1.C1], [T1.C2], [T1.C3], [T1.C4]), partitions(p0)
      is_index_back=false, is_global_index=false, 
      range_key([T1.C1]), range(MIN ; MAX), 
      range_cond([:0 > T1.C1])
select t1.*, seq.nextval from t1 where 2 * t1.c2 > (select avg(c2) from t2 where t2.c1 > t1.c1);
+----+------+------+------+---------+
| C1 | C2   | C3   | C4   | NEXTVAL |
+----+------+------+------+---------+
| 16 |   16 |   16 |   16 |       1 |
| 17 |   17 |   17 |   17 |       2 |
| 18 |   18 |   18 |   18 |       3 |
| 19 |   19 |   19 |   19 |       4 |
| 20 |   20 |   20 |   20 |       5 |
| 21 |   21 |   21 |   21 |       6 |
| 22 |   22 |   22 |   22 |       7 |
| 23 |   23 |   23 |   23 |       8 |
| 24 |   24 |   24 |   24 |       9 |
| 25 |   25 |   25 |   25 |      10 |
| 26 |   26 |   26 |   26 |      11 |
| 27 |   27 |   27 |   27 |      12 |
| 28 |   28 |   28 |   28 |      13 |
| 29 |   29 |   29 |   29 |      14 |
| 30 |   30 |   30 |   30 |      15 |
| 31 |   31 |   31 |   31 |      16 |
| 32 |   32 |   32 |   32 |      17 |
| 33 |   33 |   33 |   33 |      18 |
| 34 |   34 |   34 |   34 |      19 |
| 35 |   35 |   35 |   35 |      20 |
| 36 |   36 |   36 |   36 |      21 |
| 37 |   37 |   37 |   37 |      22 |
| 38 |   38 |   38 |   38 |      23 |
| 39 |   39 |   39 |   39 |      24 |
| 40 |   40 |   40 |   40 |      25 |
| 41 |   41 |   41 |   41 |      26 |
| 42 |   42 |   42 |   42 |      27 |
| 43 |   43 |   43 |   43 |      28 |
| 44 |   44 |   44 |   44 |      29 |
| 45 |   45 |   45 |   45 |      30 |
| 46 |   46 |   46 |   46 |      31 |
| 47 |   47 |   47 |   47 |      32 |
| 48 |   48 |   48 |   48 |      33 |
| 49 |   49 |   49 |   49 |      34 |
+----+------+------+------+---------+
EXPLAIN select t1.*, seq.nextval from t1 where 2 * t1.c2 > (select /*+no_unnest*/ avg(c2) from t2 where t2.c1 > t1.c1);
Query Plan
=============================================================
|ID|OPERATOR                 |NAME    |EST.ROWS|EST.TIME(us)|
-------------------------------------------------------------
|0 |SEQUENCE                 |        |17      |971         |
|1 |└─PX COORDINATOR         |        |17      |971         |
|2 |  └─EXCHANGE OUT DISTR   |:EX10000|17      |952         |
|3 |    └─SUBPLAN FILTER     |        |17      |908         |
|4 |      ├─TABLE FULL SCAN  |T1      |50      |6           |
|5 |      └─SCALAR GROUP BY  |        |1       |19          |
|6 |        └─TABLE FULL SCAN|T2      |4       |18          |
=============================================================
Outputs & filters:
-------------------------------------
  0 - output([T1.C1], [T1.C2], [T1.C3], [T1.C4], [SEQ.NEXTVAL]), filter(nil)
  1 - output([T1.C1], [T1.C2], [T1.C3], [T1.C4]), filter(nil), rowset=256
  2 - output([T1.C1], [T1.C2], [T1.C3], [T1.C4]), filter(nil), rowset=256
      is_single, dop=1
  3 - output([T1.C1], [T1.C2], [T1.C3], [T1.C4]), filter([cast(2, NUMBER(-1, -85)) * T1.C2 > subquery(1)]), rowset=256
      exec_params_([T1.C1(:0)]), onetime_exprs_(nil), init_plan_idxs_(nil), use_batch=false
  4 - output([T1.C1], [T1.C2], [T1.C3], [T1.C4]), filter(nil), rowset=256
      access([T1.C1], [T1.C2], [T1.C3], [T1.C4]), partitions(p0)
      is_index_back=false, is_global_index=false, 
      range_key([T1.C1]), range(MIN ; MAX)always true
  5 - output([T_FUN_SUM(T_FUN_SUM(T2.C2)) / T_FUN_COUNT_SUM(T_FUN_COUNT(T2.C2))]), filter(nil), rowset=256
      group(nil), agg_func([T_FUN_SUM(T_FUN_SUM(T2.C2))], [T_FUN_COUNT_SUM(T_FUN_COUNT(T2.C2))])
  6 - output([T_FUN_SUM(T2.C2)], [T_FUN_COUNT(T2.C2)]), filter([T2.C1 > :0]), rowset=256
      access([T2.C1], [T2.C2]), partitions(p0)
      is_index_back=false, is_global_index=false, filter_before_indexback[false], 
      range_key([T2.__pk_increment]), range(MIN ; MAX)always true, 
      pushdown_aggregation([T_FUN_SUM(T2.C2)], [T_FUN_COUNT(T2.C2)])
select t1.*, seq.nextval from t1 where 2 * t1.c2 > (select /*+no_unnest*/ avg(c2) from t2 where t2.c1 > t1.c1);
+----+------+------+------+---------+
| C1 | C2   | C3   | C4   | NEXTVAL |
+----+------+------+------+---------+
| 16 |   16 |   16 |   16 |      35 |
| 17 |   17 |   17 |   17 |      36 |
| 18 |   18 |   18 |   18 |      37 |
| 19 |   19 |   19 |   19 |      38 |
| 20 |   20 |   20 |   20 |      39 |
| 21 |   21 |   21 |   21 |      40 |
| 22 |   22 |   22 |   22 |      41 |
| 23 |   23 |   23 |   23 |      42 |
| 24 |   24 |   24 |   24 |      43 |
| 25 |   25 |   25 |   25 |      44 |
| 26 |   26 |   26 |   26 |      45 |
| 27 |   27 |   27 |   27 |      46 |
| 28 |   28 |   28 |   28 |      47 |
| 29 |   29 |   29 |   29 |      48 |
| 30 |   30 |   30 |   30 |      49 |
| 31 |   31 |   31 |   31 |      50 |
| 32 |   32 |   32 |   32 |      51 |
| 33 |   33 |   33 |   33 |      52 |
| 34 |   34 |   34 |   34 |      53 |
| 35 |   35 |   35 |   35 |      54 |
| 36 |   36 |   36 |   36 |      55 |
| 37 |   37 |   37 |   37 |      56 |
| 38 |   38 |   38 |   38 |      57 |
| 39 |   39 |   39 |   39 |      58 |
| 40 |   40 |   40 |   40 |      59 |
| 41 |   41 |   41 |   41 |      60 |
| 42 |   42 |   42 |   42 |      61 |
| 43 |   43 |   43 |   43 |      62 |
| 44 |   44 |   44 |   44 |      63 |
| 45 |   45 |   45 |   45 |      64 |
| 46 |   46 |   46 |   46 |      65 |
| 47 |   47 |   47 |   47 |      66 |
| 48 |   48 |   48 |   48 |      67 |
| 49 |   49 |   49 |   49 |      68 |
+----+------+------+------+---------+

EXPLAIN select (select avg(c2) from t2 where t2.c1 > t1.c1) as aggr, seq.nextval from t1;
Query Plan
===================================================================
|ID|OPERATOR                       |NAME    |EST.ROWS|EST.TIME(us)|
-------------------------------------------------------------------
|0 |SEQUENCE                       |        |50      |100         |
|1 |└─PX COORDINATOR               |        |50      |100         |
|2 |  └─EXCHANGE OUT DISTR         |:EX10000|50      |76          |
|3 |    └─MERGE GROUP BY           |        |50      |21          |
|4 |      └─NESTED-LOOP OUTER JOIN |        |50      |13          |
|5 |        ├─TABLE FULL SCAN      |T1      |50      |4           |
|6 |        └─MATERIAL             |        |10      |4           |
|7 |          └─TABLE FULL SCAN    |T2      |10      |3           |
===================================================================
Outputs & filters:
-------------------------------------
  0 - output([T_FUN_SUM(T2.C2) / T_FUN_COUNT(T2.C2)], [SEQ.NEXTVAL]), filter(nil)
  1 - output([T_FUN_SUM(T2.C2)], [T_FUN_COUNT(T2.C2)]), filter(nil), rowset=256
  2 - output([T_FUN_SUM(T2.C2)], [T_FUN_COUNT(T2.C2)]), filter(nil), rowset=256
      is_single, dop=1
  3 - output([T_FUN_SUM(T2.C2)], [T_FUN_COUNT(T2.C2)]), filter(nil), rowset=256
      group([T1.C1]), agg_func([T_FUN_SUM(T2.C2)], [T_FUN_COUNT(T2.C2)])
  4 - output([T1.C1], [T2.C2]), filter(nil), rowset=256
      conds([T2.C1 > T1.C1]), nl_params_(nil), use_batch=false
  5 - output([T1.C1]), filter(nil), rowset=256
      access([T1.C1]), partitions(p0)
      is_index_back=false, is_global_index=false, 
      range_key([T1.C1]), range(MIN ; MAX)always true
  6 - output([T2.C2], [T2.C1]), filter(nil), rowset=256
  7 - output([T2.C1], [T2.C2]), filter(nil), rowset=256
      access([T2.C1], [T2.C2]), partitions(p0)
      is_index_back=false, is_global_index=false, 
      range_key([T2.__pk_increment]), range(MIN ; MAX)always true
select (select avg(c2) from t2 where t2.c1 > t1.c1) as aggr, seq.nextval from t1;
+------+---------+
| AGGR | NEXTVAL |
+------+---------+
|   25 |      69 |
|   25 |      70 |
|   25 |      71 |
|   25 |      72 |
|   25 |      73 |
|   25 |      74 |
|   25 |      75 |
|   25 |      76 |
|   25 |      77 |
|   30 |      78 |
|   30 |      79 |
|   30 |      80 |
|   30 |      81 |
|   30 |      82 |
|   30 |      83 |
|   30 |      84 |
|   30 |      85 |
|   30 |      86 |
|   30 |      87 |
|   35 |      88 |
|   35 |      89 |
|   35 |      90 |
|   35 |      91 |
|   35 |      92 |
|   35 |      93 |
|   35 |      94 |
|   35 |      95 |
|   35 |      96 |
|   35 |      97 |
|   40 |      98 |
|   40 |      99 |
|   40 |     100 |
|   40 |     101 |
|   40 |     102 |
|   40 |     103 |
|   40 |     104 |
|   40 |     105 |
|   40 |     106 |
|   40 |     107 |
|   45 |     108 |
|   45 |     109 |
|   45 |     110 |
|   45 |     111 |
|   45 |     112 |
|   45 |     113 |
|   45 |     114 |
|   45 |     115 |
|   45 |     116 |
|   45 |     117 |
| NULL |     118 |
+------+---------+
EXPLAIN select (select /*+no_unnest*/ avg(c2) from t2 where t2.c1 > t1.c1) as aggr, seq.nextval from t1;
Query Plan
============================================================
|ID|OPERATOR                |NAME    |EST.ROWS|EST.TIME(us)|
------------------------------------------------------------
|0 |SUBPLAN FILTER          |        |50      |20945       |
|1 |├─SEQUENCE              |        |50      |52          |
|2 |│ └─PX COORDINATOR      |        |50      |51          |
|3 |│   └─EXCHANGE OUT DISTR|:EX10000|50      |37          |
|4 |│     └─TABLE FULL SCAN |T1      |50      |4           |
|5 |└─PX COORDINATOR        |        |1       |20          |
|6 |  └─EXCHANGE OUT DISTR  |:EX20000|1       |20          |
|7 |    └─SCALAR GROUP BY   |        |1       |19          |
|8 |      └─TABLE FULL SCAN |T2      |4       |18          |
============================================================
Outputs & filters:
-------------------------------------
  0 - output([subquery(1)], [SEQ.NEXTVAL]), filter(nil), rowset=256
      exec_params_([T1.C1(:0)]), onetime_exprs_(nil), init_plan_idxs_(nil), use_batch=false
  1 - output([T1.C1], [SEQ.NEXTVAL]), filter(nil)
  2 - output([T1.C1]), filter(nil), rowset=256
  3 - output([T1.C1]), filter(nil), rowset=256
      is_single, dop=1
  4 - output([T1.C1]), filter(nil), rowset=256
      access([T1.C1]), partitions(p0)
      is_index_back=false, is_global_index=false, 
      range_key([T1.C1]), range(MIN ; MAX)always true
  5 - output([T_FUN_SUM(T_FUN_SUM(T2.C2)) / T_FUN_COUNT_SUM(T_FUN_COUNT(T2.C2))]), filter(nil), rowset=256
  6 - output([T_FUN_SUM(T_FUN_SUM(T2.C2))], [T_FUN_COUNT_SUM(T_FUN_COUNT(T2.C2))]), filter(nil), rowset=256
      is_single, dop=1
  7 - output([T_FUN_SUM(T_FUN_SUM(T2.C2))], [T_FUN_COUNT_SUM(T_FUN_COUNT(T2.C2))]), filter(nil), rowset=256
      group(nil), agg_func([T_FUN_SUM(T_FUN_SUM(T2.C2))], [T_FUN_COUNT_SUM(T_FUN_COUNT(T2.C2))])
  8 - output([T_FUN_SUM(T2.C2)], [T_FUN_COUNT(T2.C2)]), filter([T2.C1 > :0]), rowset=256
      access([T2.C1], [T2.C2]), partitions(p0)
      is_index_back=false, is_global_index=false, filter_before_indexback[false], 
      range_key([T2.__pk_increment]), range(MIN ; MAX)always true, 
      pushdown_aggregation([T_FUN_SUM(T2.C2)], [T_FUN_COUNT(T2.C2)])
select (select /*+no_unnest*/ avg(c2) from t2 where t2.c1 > t1.c1) as aggr, seq.nextval from t1;
+------+---------+
| AGGR | NEXTVAL |
+------+---------+
|   25 |     119 |
|   25 |     120 |
|   25 |     121 |
|   25 |     122 |
|   25 |     123 |
|   25 |     124 |
|   25 |     125 |
|   25 |     126 |
|   25 |     127 |
|   30 |     128 |
|   30 |     129 |
|   30 |     130 |
|   30 |     131 |
|   30 |     132 |
|   30 |     133 |
|   30 |     134 |
|   30 |     135 |
|   30 |     136 |
|   30 |     137 |
|   35 |     138 |
|   35 |     139 |
|   35 |     140 |
|   35 |     141 |
|   35 |     142 |
|   35 |     143 |
|   35 |     144 |
|   35 |     145 |
|   35 |     146 |
|   35 |     147 |
|   40 |     148 |
|   40 |     149 |
|   40 |     150 |
|   40 |     151 |
|   40 |     152 |
|   40 |     153 |
|   40 |     154 |
|   40 |     155 |
|   40 |     156 |
|   40 |     157 |
|   45 |     158 |
|   45 |     159 |
|   45 |     160 |
|   45 |     161 |
|   45 |     162 |
|   45 |     163 |
|   45 |     164 |
|   45 |     165 |
|   45 |     166 |
|   45 |     167 |
| NULL |     168 |
+------+---------+

## test vector compare
EXPLAIN select * from t1 where (c1, c2) = (select max(c1), max(c2) from t2 where t2.c3 > t1.c3);
Query Plan
=========================================================
|ID|OPERATOR                 |NAME|EST.ROWS|EST.TIME(us)|
---------------------------------------------------------
|0 |EXCHANGE IN REMOTE       |    |1       |22          |
|1 |└─EXCHANGE OUT REMOTE    |    |1       |21          |
|2 |  └─MERGE GROUP BY       |    |1       |20          |
|3 |    └─NESTED-LOOP JOIN   |    |25      |15          |
|4 |      ├─TABLE FULL SCAN  |T1  |50      |6           |
|5 |      └─MATERIAL         |    |10      |5           |
|6 |        └─TABLE FULL SCAN|T2  |10      |3           |
=========================================================
Outputs & filters:
-------------------------------------
  0 - output([T1.C1], [T1.C2], [T1.C3], [T1.C4]), filter(nil)
  1 - output([T1.C1], [T1.C2], [T1.C3], [T1.C4]), filter(nil)
  2 - output([T1.C1], [T1.C2], [T1.C3], [T1.C4]), filter([(T1.C1, T1.C2) = (T_FUN_MAX(T2.C1), T_FUN_MAX(T2.C2))]), rowset=256
      group([T1.C1]), agg_func([T_FUN_MAX(T2.C1)], [T_FUN_MAX(T2.C2)])
  3 - output([T1.C1], [T1.C2], [T1.C3], [T1.C4], [T2.C1], [T2.C2]), filter(nil), rowset=256
      conds([T2.C3 > T1.C3]), nl_params_(nil), use_batch=false
  4 - output([T1.C1], [T1.C3], [T1.C2], [T1.C4]), filter(nil), rowset=256
      access([T1.C1], [T1.C3], [T1.C2], [T1.C4]), partitions(p0)
      is_index_back=false, is_global_index=false, 
      range_key([T1.C1]), range(MIN ; MAX)always true
  5 - output([T2.C3], [T2.C1], [T2.C2]), filter(nil), rowset=256
  6 - output([T2.C3], [T2.C1], [T2.C2]), filter(nil), rowset=256
      access([T2.C3], [T2.C1], [T2.C2]), partitions(p0)
      is_index_back=false, is_global_index=false, 
      range_key([T2.__pk_increment]), range(MIN ; MAX)always true
select * from t1 where (c1, c2) = (select max(c1), max(c2) from t2 where t2.c3 > t1.c3);
+----+------+------+------+
| C1 | C2   | C3   | C4   |
+----+------+------+------+
+----+------+------+------+

## test merge into
explain merge into t3 using (select c1,c2,c3,c4 from t1 where 2 * t1.c2 > (select avg(c2) from t2 where t2.c1 > t1.c1)) source on (t3.c1 = source.c1)
when not matched then insert (t3.c1, t3.c2, t3.c3) values (source.c1, source.c2, source.c3);
Query Plan
================================================================
|ID|OPERATOR                       |NAME |EST.ROWS|EST.TIME(us)|
----------------------------------------------------------------
|0 |EXCHANGE IN REMOTE             |     |1       |192         |
|1 |└─EXCHANGE OUT REMOTE          |     |1       |191         |
|2 |  └─INSERT                     |     |1       |191         |
|3 |    └─SUBPLAN SCAN             |VIEW1|1       |181         |
|4 |      └─HASH GROUP BY          |     |1       |181         |
|5 |        └─HASH RIGHT ANTI JOIN |     |24      |175         |
|6 |          ├─TABLE FULL SCAN    |T3   |8       |3           |
|7 |          └─NESTED-LOOP JOIN   |     |25      |168         |
|8 |            ├─TABLE FULL SCAN  |T2   |10      |3           |
|9 |            └─TABLE RANGE SCAN |T1   |17      |16          |
================================================================
Outputs & filters:
-------------------------------------
  0 - output(nil), filter(nil)
  1 - output(nil), filter(nil)
  2 - output(nil), filter(nil)
      columns([{T3: ({T3: (T3.__pk_increment, T3.C1, T3.C2, T3.C3, T3.C4)})}]), partitions(p0), 
      column_values([T_HIDDEN_PK], [column_conv(NUMBER,PS:(-1,0),NULL,VIEW1.SOURCE.C1)], [column_conv(NUMBER,PS:(-1,0),NULL,VIEW1.SOURCE.C2)], [column_conv(NUMBER,
      PS:(-1,0),NULL,VIEW1.SOURCE.C3)], [column_conv(NUMBER,PS:(-1,0),NULL,cast(NULL, NUMBER(-1, 0)))])
  3 - output([VIEW1.SOURCE.C1], [VIEW1.SOURCE.C2], [VIEW1.SOURCE.C3]), filter(nil), rowset=256
      access([VIEW1.SOURCE.C1], [VIEW1.SOURCE.C2], [VIEW1.SOURCE.C3])
  4 - output([T1.C1], [T1.C2], [T1.C3]), filter([cast(2, NUMBER(-1, -85)) * T1.C2 > T_FUN_SUM(T2.C2) / T_FUN_COUNT(T2.C2)]), rowset=256
      group([T1.C1]), agg_func([T_FUN_SUM(T2.C2)], [T_FUN_COUNT(T2.C2)])
  5 - output([T1.C1], [T2.C2], [T1.C2], [T1.C3]), filter(nil), rowset=256
      equal_conds([T3.C1 = T1.C1]), other_conds(nil)
  6 - output([T3.C1]), filter(nil), rowset=256
      access([T3.C1]), partitions(p0)
      is_index_back=false, is_global_index=false, 
      range_key([T3.__pk_increment]), range(MIN ; MAX)always true
  7 - output([T1.C1], [T2.C2], [T1.C2], [T1.C3]), filter(nil), rowset=256
      conds(nil), nl_params_([T2.C1(:0)]), use_batch=true
  8 - output([T2.C1], [T2.C2]), filter(nil), rowset=256
      access([T2.C1], [T2.C2]), partitions(p0)
      is_index_back=false, is_global_index=false, 
      range_key([T2.__pk_increment]), range(MIN ; MAX)always true
  9 - output([T1.C1], [T1.C2], [T1.C3]), filter(nil), rowset=256
      access([GROUP_ID], [T1.C1], [T1.C2], [T1.C3]), partitions(p0)
      is_index_back=false, is_global_index=false, 
      range_key([T1.C1]), range(MIN ; MAX), 
      range_cond([:0 > T1.C1])
merge into t3 using (select c1,c2,c3,c4 from t1 where 2 * t1.c2 > (select avg(c2) from t2 where t2.c1 > t1.c1)) source on (t3.c1 = source.c1)
when not matched then insert (t3.c1, t3.c2, t3.c3) values (source.c1, source.c2, source.c3);
EXPLAIN select * from t3;
Query Plan
=====================================================
|ID|OPERATOR             |NAME|EST.ROWS|EST.TIME(us)|
-----------------------------------------------------
|0 |EXCHANGE IN REMOTE   |    |39      |154         |
|1 |└─EXCHANGE OUT REMOTE|    |39      |108         |
|2 |  └─TABLE FULL SCAN  |T3  |39      |5           |
=====================================================
Outputs & filters:
-------------------------------------
  0 - output([T3.C1], [T3.C2], [T3.C3], [T3.C4]), filter(nil)
  1 - output([T3.C1], [T3.C2], [T3.C3], [T3.C4]), filter(nil)
  2 - output([T3.C1], [T3.C2], [T3.C3], [T3.C4]), filter(nil), rowset=256
      access([T3.C1], [T3.C2], [T3.C3], [T3.C4]), partitions(p0)
      is_index_back=false, is_global_index=false, 
      range_key([T3.__pk_increment]), range(MIN ; MAX)always true
select * from t3;
+------+------+------+------+
| C1   | C2   | C3   | C4   |
+------+------+------+------+
|   10 |    5 |    0 |    1 |
|   10 |    5 |    0 |    2 |
|   20 |   15 |   10 |    3 |
|   20 |   15 |   10 | NULL |
|   30 |   25 |   20 |    5 |
|   30 |   25 |   20 |    6 |
|   40 |   35 |   30 |    7 |
|   40 |   35 |   30 | NULL |
|   16 |   16 |   16 | NULL |
|   17 |   17 |   17 | NULL |
|   18 |   18 |   18 | NULL |
|   19 |   19 |   19 | NULL |
|   21 |   21 |   21 | NULL |
|   22 |   22 |   22 | NULL |
|   23 |   23 |   23 | NULL |
|   24 |   24 |   24 | NULL |
|   25 |   25 |   25 | NULL |
|   26 |   26 |   26 | NULL |
|   27 |   27 |   27 | NULL |
|   28 |   28 |   28 | NULL |
|   29 |   29 |   29 | NULL |
|   31 |   31 |   31 | NULL |
|   32 |   32 |   32 | NULL |
|   33 |   33 |   33 | NULL |
|   34 |   34 |   34 | NULL |
|   35 |   35 |   35 | NULL |
|   36 |   36 |   36 | NULL |
|   37 |   37 |   37 | NULL |
|   38 |   38 |   38 | NULL |
|   39 |   39 |   39 | NULL |
|   41 |   41 |   41 | NULL |
|   42 |   42 |   42 | NULL |
|   43 |   43 |   43 | NULL |
|   44 |   44 |   44 | NULL |
|   45 |   45 |   45 | NULL |
|   46 |   46 |   46 | NULL |
|   47 |   47 |   47 | NULL |
|   48 |   48 |   48 | NULL |
|   49 |   49 |   49 | NULL |
+------+------+------+------+
rollback;

explain merge into t3 using (select c1,c2,c3,c4 from t1 where 2 * t1.c2 > (select /*+no_unnest*/ avg(c2) from t2 where t2.c1 > t1.c1)) source on (t3.c1 = source.c1)
when not matched then insert (t3.c1, t3.c2, t3.c3) values (source.c1, source.c2, source.c3);
Query Plan
================================================================
|ID|OPERATOR                       |NAME |EST.ROWS|EST.TIME(us)|
----------------------------------------------------------------
|0 |EXCHANGE IN REMOTE             |     |16      |994         |
|1 |└─EXCHANGE OUT REMOTE          |     |16      |981         |
|2 |  └─INSERT                     |     |16      |950         |
|3 |    └─SUBPLAN SCAN             |VIEW1|16      |846         |
|4 |      └─SUBPLAN FILTER         |     |16      |846         |
|5 |        ├─HASH RIGHT ANTI JOIN |     |47      |15          |
|6 |        │ ├─TABLE FULL SCAN    |T3   |8       |3           |
|7 |        │ └─TABLE FULL SCAN    |T1   |50      |5           |
|8 |        └─SCALAR GROUP BY      |     |1       |19          |
|9 |          └─TABLE FULL SCAN    |T2   |4       |18          |
================================================================
Outputs & filters:
-------------------------------------
  0 - output(nil), filter(nil)
  1 - output(nil), filter(nil)
  2 - output(nil), filter(nil)
      columns([{T3: ({T3: (T3.__pk_increment, T3.C1, T3.C2, T3.C3, T3.C4)})}]), partitions(p0), 
      column_values([T_HIDDEN_PK], [column_conv(NUMBER,PS:(-1,0),NULL,VIEW1.SOURCE.C1)], [column_conv(NUMBER,PS:(-1,0),NULL,VIEW1.SOURCE.C2)], [column_conv(NUMBER,
      PS:(-1,0),NULL,VIEW1.SOURCE.C3)], [column_conv(NUMBER,PS:(-1,0),NULL,cast(NULL, NUMBER(-1, 0)))])
  3 - output([VIEW1.SOURCE.C1], [VIEW1.SOURCE.C2], [VIEW1.SOURCE.C3]), filter(nil), rowset=256
      access([VIEW1.SOURCE.C1], [VIEW1.SOURCE.C2], [VIEW1.SOURCE.C3])
  4 - output([T1.C1], [T1.C2], [T1.C3]), filter([cast(2, NUMBER(-1, -85)) * T1.C2 > subquery(1)]), rowset=256
      exec_params_([T1.C1(:0)]), onetime_exprs_(nil), init_plan_idxs_(nil), use_batch=false
  5 - output([T1.C1], [T1.C2], [T1.C3]), filter(nil), rowset=256
      equal_conds([T3.C1 = T1.C1]), other_conds(nil)
  6 - output([T3.C1]), filter(nil), rowset=256
      access([T3.C1]), partitions(p0)
      is_index_back=false, is_global_index=false, 
      range_key([T3.__pk_increment]), range(MIN ; MAX)always true
  7 - output([T1.C1], [T1.C2], [T1.C3]), filter(nil), rowset=256
      access([T1.C1], [T1.C2], [T1.C3]), partitions(p0)
      is_index_back=false, is_global_index=false, 
      range_key([T1.C1]), range(MIN ; MAX)always true
  8 - output([T_FUN_SUM(T_FUN_SUM(T2.C2)) / T_FUN_COUNT_SUM(T_FUN_COUNT(T2.C2))]), filter(nil), rowset=256
      group(nil), agg_func([T_FUN_SUM(T_FUN_SUM(T2.C2))], [T_FUN_COUNT_SUM(T_FUN_COUNT(T2.C2))])
  9 - output([T_FUN_SUM(T2.C2)], [T_FUN_COUNT(T2.C2)]), filter([T2.C1 > :0]), rowset=256
      access([T2.C1], [T2.C2]), partitions(p0)
      is_index_back=false, is_global_index=false, filter_before_indexback[false], 
      range_key([T2.__pk_increment]), range(MIN ; MAX)always true, 
      pushdown_aggregation([T_FUN_SUM(T2.C2)], [T_FUN_COUNT(T2.C2)])
merge into t3 using (select c1,c2,c3,c4 from t1 where 2 * t1.c2 > (select /*+no_unnest*/ avg(c2) from t2 where t2.c1 > t1.c1)) source on (t3.c1 = source.c1)
when not matched then insert (t3.c1, t3.c2, t3.c3) values (source.c1, source.c2, source.c3);
EXPLAIN select * from t3;
Query Plan
=====================================================
|ID|OPERATOR             |NAME|EST.ROWS|EST.TIME(us)|
-----------------------------------------------------
|0 |EXCHANGE IN REMOTE   |    |39      |154         |
|1 |└─EXCHANGE OUT REMOTE|    |39      |108         |
|2 |  └─TABLE FULL SCAN  |T3  |39      |5           |
=====================================================
Outputs & filters:
-------------------------------------
  0 - output([T3.C1], [T3.C2], [T3.C3], [T3.C4]), filter(nil)
  1 - output([T3.C1], [T3.C2], [T3.C3], [T3.C4]), filter(nil)
  2 - output([T3.C1], [T3.C2], [T3.C3], [T3.C4]), filter(nil), rowset=256
      access([T3.C1], [T3.C2], [T3.C3], [T3.C4]), partitions(p0)
      is_index_back=false, is_global_index=false, 
      range_key([T3.__pk_increment]), range(MIN ; MAX)always true
select * from t3;
+------+------+------+------+
| C1   | C2   | C3   | C4   |
+------+------+------+------+
|   10 |    5 |    0 |    1 |
|   10 |    5 |    0 |    2 |
|   20 |   15 |   10 |    3 |
|   20 |   15 |   10 | NULL |
|   30 |   25 |   20 |    5 |
|   30 |   25 |   20 |    6 |
|   40 |   35 |   30 |    7 |
|   40 |   35 |   30 | NULL |
|   16 |   16 |   16 | NULL |
|   17 |   17 |   17 | NULL |
|   18 |   18 |   18 | NULL |
|   19 |   19 |   19 | NULL |
|   21 |   21 |   21 | NULL |
|   22 |   22 |   22 | NULL |
|   23 |   23 |   23 | NULL |
|   24 |   24 |   24 | NULL |
|   25 |   25 |   25 | NULL |
|   26 |   26 |   26 | NULL |
|   27 |   27 |   27 | NULL |
|   28 |   28 |   28 | NULL |
|   29 |   29 |   29 | NULL |
|   31 |   31 |   31 | NULL |
|   32 |   32 |   32 | NULL |
|   33 |   33 |   33 | NULL |
|   34 |   34 |   34 | NULL |
|   35 |   35 |   35 | NULL |
|   36 |   36 |   36 | NULL |
|   37 |   37 |   37 | NULL |
|   38 |   38 |   38 | NULL |
|   39 |   39 |   39 | NULL |
|   41 |   41 |   41 | NULL |
|   42 |   42 |   42 | NULL |
|   43 |   43 |   43 | NULL |
|   44 |   44 |   44 | NULL |
|   45 |   45 |   45 | NULL |
|   46 |   46 |   46 | NULL |
|   47 |   47 |   47 | NULL |
|   48 |   48 |   48 | NULL |
|   49 |   49 |   49 | NULL |
+------+------+------+------+
rollback;

explain merge into t3 using (select c1, (select avg(c2) from t2 where t2.c1 > t1.c1) as aggr from t1) source on (t3.c1 = source.c1)
when not matched then insert (t3.c1, t3.c2) values (source.c1, source.aggr);
Query Plan
=======================================================================
|ID|OPERATOR                             |NAME  |EST.ROWS|EST.TIME(us)|
-----------------------------------------------------------------------
|0 |EXCHANGE IN REMOTE                   |      |46      |402         |
|1 |└─EXCHANGE OUT REMOTE                |      |46      |379         |
|2 |  └─INSERT                           |      |46      |329         |
|3 |    └─SUBPLAN SCAN                   |VIEW1 |46      |31          |
|4 |      └─HASH RIGHT ANTI JOIN         |      |46      |31          |
|5 |        ├─TABLE FULL SCAN            |T3    |8       |3           |
|6 |        └─SUBPLAN SCAN               |SOURCE|50      |21          |
|7 |          └─MERGE GROUP BY           |      |50      |21          |
|8 |            └─NESTED-LOOP OUTER JOIN |      |50      |13          |
|9 |              ├─TABLE FULL SCAN      |T1    |50      |4           |
|10|              └─MATERIAL             |      |10      |4           |
|11|                └─TABLE FULL SCAN    |T2    |10      |3           |
=======================================================================
Outputs & filters:
-------------------------------------
  0 - output(nil), filter(nil)
  1 - output(nil), filter(nil)
  2 - output(nil), filter(nil)
      columns([{T3: ({T3: (T3.__pk_increment, T3.C1, T3.C2, T3.C3, T3.C4)})}]), partitions(p0), 
      column_values([T_HIDDEN_PK], [column_conv(NUMBER,PS:(-1,0),NULL,VIEW1.SOURCE.C1)], [column_conv(NUMBER,PS:(-1,0),NULL,VIEW1.SOURCE.AGGR)], [column_conv(NUMBER,
      PS:(-1,0),NULL,cast(NULL, NUMBER(-1, 0)))], [column_conv(NUMBER,PS:(-1,0),NULL,cast(NULL, NUMBER(-1, 0)))])
  3 - output([VIEW1.SOURCE.C1], [VIEW1.SOURCE.AGGR]), filter(nil), rowset=256
      access([VIEW1.SOURCE.C1], [VIEW1.SOURCE.AGGR])
  4 - output([SOURCE.C1], [SOURCE.AGGR]), filter(nil), rowset=256
      equal_conds([T3.C1 = SOURCE.C1]), other_conds(nil)
  5 - output([T3.C1]), filter(nil), rowset=256
      access([T3.C1]), partitions(p0)
      is_index_back=false, is_global_index=false, 
      range_key([T3.__pk_increment]), range(MIN ; MAX)always true
  6 - output([SOURCE.C1], [SOURCE.AGGR]), filter(nil), rowset=256
      access([SOURCE.C1], [SOURCE.AGGR])
  7 - output([T1.C1], [T_FUN_SUM(T2.C2) / T_FUN_COUNT(T2.C2)]), filter(nil), rowset=256
      group([T1.C1]), agg_func([T_FUN_SUM(T2.C2)], [T_FUN_COUNT(T2.C2)])
  8 - output([T1.C1], [T2.C2]), filter(nil), rowset=256
      conds([T2.C1 > T1.C1]), nl_params_(nil), use_batch=false
  9 - output([T1.C1]), filter(nil), rowset=256
      access([T1.C1]), partitions(p0)
      is_index_back=false, is_global_index=false, 
      range_key([T1.C1]), range(MIN ; MAX)always true
 10 - output([T2.C2], [T2.C1]), filter(nil), rowset=256
 11 - output([T2.C1], [T2.C2]), filter(nil), rowset=256
      access([T2.C1], [T2.C2]), partitions(p0)
      is_index_back=false, is_global_index=false, 
      range_key([T2.__pk_increment]), range(MIN ; MAX)always true
merge into t3 using (select c1, (select avg(c2) from t2 where t2.c1 > t1.c1) as aggr from t1) source on (t3.c1 = source.c1)
when not matched then insert (t3.c1, t3.c2) values (source.c1, source.aggr);
EXPLAIN select * from t3;
Query Plan
=====================================================
|ID|OPERATOR             |NAME|EST.ROWS|EST.TIME(us)|
-----------------------------------------------------
|0 |EXCHANGE IN REMOTE   |    |54      |212         |
|1 |└─EXCHANGE OUT REMOTE|    |54      |149         |
|2 |  └─TABLE FULL SCAN  |T3  |54      |6           |
=====================================================
Outputs & filters:
-------------------------------------
  0 - output([T3.C1], [T3.C2], [T3.C3], [T3.C4]), filter(nil)
  1 - output([T3.C1], [T3.C2], [T3.C3], [T3.C4]), filter(nil)
  2 - output([T3.C1], [T3.C2], [T3.C3], [T3.C4]), filter(nil), rowset=256
      access([T3.C1], [T3.C2], [T3.C3], [T3.C4]), partitions(p0)
      is_index_back=false, is_global_index=false, 
      range_key([T3.__pk_increment]), range(MIN ; MAX)always true
select * from t3;
+------+------+------+------+
| C1   | C2   | C3   | C4   |
+------+------+------+------+
|   10 |    5 |    0 |    1 |
|   10 |    5 |    0 |    2 |
|   20 |   15 |   10 |    3 |
|   20 |   15 |   10 | NULL |
|   30 |   25 |   20 |    5 |
|   30 |   25 |   20 |    6 |
|   40 |   35 |   30 |    7 |
|   40 |   35 |   30 | NULL |
|    1 |   25 | NULL | NULL |
|    2 |   25 | NULL | NULL |
|    3 |   25 | NULL | NULL |
|    4 |   25 | NULL | NULL |
|    5 |   25 | NULL | NULL |
|    6 |   25 | NULL | NULL |
|    7 |   25 | NULL | NULL |
|    8 |   25 | NULL | NULL |
|    9 |   25 | NULL | NULL |
|   11 |   30 | NULL | NULL |
|   12 |   30 | NULL | NULL |
|   13 |   30 | NULL | NULL |
|   14 |   30 | NULL | NULL |
|   15 |   30 | NULL | NULL |
|   16 |   30 | NULL | NULL |
|   17 |   30 | NULL | NULL |
|   18 |   30 | NULL | NULL |
|   19 |   30 | NULL | NULL |
|   21 |   35 | NULL | NULL |
|   22 |   35 | NULL | NULL |
|   23 |   35 | NULL | NULL |
|   24 |   35 | NULL | NULL |
|   25 |   35 | NULL | NULL |
|   26 |   35 | NULL | NULL |
|   27 |   35 | NULL | NULL |
|   28 |   35 | NULL | NULL |
|   29 |   35 | NULL | NULL |
|   31 |   40 | NULL | NULL |
|   32 |   40 | NULL | NULL |
|   33 |   40 | NULL | NULL |
|   34 |   40 | NULL | NULL |
|   35 |   40 | NULL | NULL |
|   36 |   40 | NULL | NULL |
|   37 |   40 | NULL | NULL |
|   38 |   40 | NULL | NULL |
|   39 |   40 | NULL | NULL |
|   41 |   45 | NULL | NULL |
|   42 |   45 | NULL | NULL |
|   43 |   45 | NULL | NULL |
|   44 |   45 | NULL | NULL |
|   45 |   45 | NULL | NULL |
|   46 |   45 | NULL | NULL |
|   47 |   45 | NULL | NULL |
|   48 |   45 | NULL | NULL |
|   49 |   45 | NULL | NULL |
|   50 | NULL | NULL | NULL |
+------+------+------+------+
rollback;

explain merge into t3 using (select c1, (select /*+no_unnest*/ avg(c2) from t2 where t2.c1 > t1.c1) as aggr from t1) source on (t3.c1 = source.c1)
when not matched then insert (t3.c1, t3.c2) values (source.c1, source.aggr);
Query Plan
=================================================================
|ID|OPERATOR                       |NAME  |EST.ROWS|EST.TIME(us)|
-----------------------------------------------------------------
|0 |EXCHANGE IN REMOTE             |      |46      |1286        |
|1 |└─EXCHANGE OUT REMOTE          |      |46      |1264        |
|2 |  └─INSERT                     |      |46      |1214        |
|3 |    └─SUBPLAN SCAN             |VIEW1 |46      |916         |
|4 |      └─HASH RIGHT ANTI JOIN   |      |46      |916         |
|5 |        ├─TABLE FULL SCAN      |T3    |8       |3           |
|6 |        └─SUBPLAN SCAN         |SOURCE|50      |906         |
|7 |          └─SUBPLAN FILTER     |      |50      |905         |
|8 |            ├─TABLE FULL SCAN  |T1    |50      |4           |
|9 |            └─SCALAR GROUP BY  |      |1       |19          |
|10|              └─TABLE FULL SCAN|T2    |4       |18          |
=================================================================
Outputs & filters:
-------------------------------------
  0 - output(nil), filter(nil)
  1 - output(nil), filter(nil)
  2 - output(nil), filter(nil)
      columns([{T3: ({T3: (T3.__pk_increment, T3.C1, T3.C2, T3.C3, T3.C4)})}]), partitions(p0), 
      column_values([T_HIDDEN_PK], [column_conv(NUMBER,PS:(-1,0),NULL,VIEW1.SOURCE.C1)], [column_conv(NUMBER,PS:(-1,0),NULL,VIEW1.SOURCE.AGGR)], [column_conv(NUMBER,
      PS:(-1,0),NULL,cast(NULL, NUMBER(-1, 0)))], [column_conv(NUMBER,PS:(-1,0),NULL,cast(NULL, NUMBER(-1, 0)))])
  3 - output([VIEW1.SOURCE.C1], [VIEW1.SOURCE.AGGR]), filter(nil), rowset=256
      access([VIEW1.SOURCE.C1], [VIEW1.SOURCE.AGGR])
  4 - output([SOURCE.C1], [SOURCE.AGGR]), filter(nil), rowset=256
      equal_conds([T3.C1 = SOURCE.C1]), other_conds(nil)
  5 - output([T3.C1]), filter(nil), rowset=256
      access([T3.C1]), partitions(p0)
      is_index_back=false, is_global_index=false, 
      range_key([T3.__pk_increment]), range(MIN ; MAX)always true
  6 - output([SOURCE.C1], [SOURCE.AGGR]), filter(nil), rowset=256
      access([SOURCE.C1], [SOURCE.AGGR])
  7 - output([T1.C1], [subquery(1)]), filter(nil), rowset=256
      exec_params_([T1.C1(:0)]), onetime_exprs_(nil), init_plan_idxs_(nil), use_batch=false
  8 - output([T1.C1]), filter(nil), rowset=256
      access([T1.C1]), partitions(p0)
      is_index_back=false, is_global_index=false, 
      range_key([T1.C1]), range(MIN ; MAX)always true
  9 - output([T_FUN_SUM(T_FUN_SUM(T2.C2)) / T_FUN_COUNT_SUM(T_FUN_COUNT(T2.C2))]), filter(nil), rowset=256
      group(nil), agg_func([T_FUN_SUM(T_FUN_SUM(T2.C2))], [T_FUN_COUNT_SUM(T_FUN_COUNT(T2.C2))])
 10 - output([T_FUN_SUM(T2.C2)], [T_FUN_COUNT(T2.C2)]), filter([T2.C1 > :0]), rowset=256
      access([T2.C1], [T2.C2]), partitions(p0)
      is_index_back=false, is_global_index=false, filter_before_indexback[false], 
      range_key([T2.__pk_increment]), range(MIN ; MAX)always true, 
      pushdown_aggregation([T_FUN_SUM(T2.C2)], [T_FUN_COUNT(T2.C2)])
merge into t3 using (select c1, (select /*+no_unnest*/ avg(c2) from t2 where t2.c1 > t1.c1) as aggr from t1) source on (t3.c1 = source.c1)
when not matched then insert (t3.c1, t3.c2) values (source.c1, source.aggr);
EXPLAIN select * from t3;
Query Plan
=====================================================
|ID|OPERATOR             |NAME|EST.ROWS|EST.TIME(us)|
-----------------------------------------------------
|0 |EXCHANGE IN REMOTE   |    |54      |212         |
|1 |└─EXCHANGE OUT REMOTE|    |54      |149         |
|2 |  └─TABLE FULL SCAN  |T3  |54      |6           |
=====================================================
Outputs & filters:
-------------------------------------
  0 - output([T3.C1], [T3.C2], [T3.C3], [T3.C4]), filter(nil)
  1 - output([T3.C1], [T3.C2], [T3.C3], [T3.C4]), filter(nil)
  2 - output([T3.C1], [T3.C2], [T3.C3], [T3.C4]), filter(nil), rowset=256
      access([T3.C1], [T3.C2], [T3.C3], [T3.C4]), partitions(p0)
      is_index_back=false, is_global_index=false, 
      range_key([T3.__pk_increment]), range(MIN ; MAX)always true
select * from t3;
+------+------+------+------+
| C1   | C2   | C3   | C4   |
+------+------+------+------+
|   10 |    5 |    0 |    1 |
|   10 |    5 |    0 |    2 |
|   20 |   15 |   10 |    3 |
|   20 |   15 |   10 | NULL |
|   30 |   25 |   20 |    5 |
|   30 |   25 |   20 |    6 |
|   40 |   35 |   30 |    7 |
|   40 |   35 |   30 | NULL |
|    1 |   25 | NULL | NULL |
|    2 |   25 | NULL | NULL |
|    3 |   25 | NULL | NULL |
|    4 |   25 | NULL | NULL |
|    5 |   25 | NULL | NULL |
|    6 |   25 | NULL | NULL |
|    7 |   25 | NULL | NULL |
|    8 |   25 | NULL | NULL |
|    9 |   25 | NULL | NULL |
|   11 |   30 | NULL | NULL |
|   12 |   30 | NULL | NULL |
|   13 |   30 | NULL | NULL |
|   14 |   30 | NULL | NULL |
|   15 |   30 | NULL | NULL |
|   16 |   30 | NULL | NULL |
|   17 |   30 | NULL | NULL |
|   18 |   30 | NULL | NULL |
|   19 |   30 | NULL | NULL |
|   21 |   35 | NULL | NULL |
|   22 |   35 | NULL | NULL |
|   23 |   35 | NULL | NULL |
|   24 |   35 | NULL | NULL |
|   25 |   35 | NULL | NULL |
|   26 |   35 | NULL | NULL |
|   27 |   35 | NULL | NULL |
|   28 |   35 | NULL | NULL |
|   29 |   35 | NULL | NULL |
|   31 |   40 | NULL | NULL |
|   32 |   40 | NULL | NULL |
|   33 |   40 | NULL | NULL |
|   34 |   40 | NULL | NULL |
|   35 |   40 | NULL | NULL |
|   36 |   40 | NULL | NULL |
|   37 |   40 | NULL | NULL |
|   38 |   40 | NULL | NULL |
|   39 |   40 | NULL | NULL |
|   41 |   45 | NULL | NULL |
|   42 |   45 | NULL | NULL |
|   43 |   45 | NULL | NULL |
|   44 |   45 | NULL | NULL |
|   45 |   45 | NULL | NULL |
|   46 |   45 | NULL | NULL |
|   47 |   45 | NULL | NULL |
|   48 |   45 | NULL | NULL |
|   49 |   45 | NULL | NULL |
|   50 | NULL | NULL | NULL |
+------+------+------+------+
rollback;

## test multi table update
EXPLAIN update tpart set c3 = 100 where c2 < (select avg(c2) from t2 where t2.c1 > tpart.c1);
Query Plan
============================================================================
|ID|OPERATOR                                |NAME    |EST.ROWS|EST.TIME(us)|
----------------------------------------------------------------------------
|0 |DISTRIBUTED UPDATE                      |        |1       |659         |
|1 |└─PX COORDINATOR                        |        |1       |632         |
|2 |  └─EXCHANGE OUT DISTR                  |:EX10000|1       |631         |
|3 |    └─SUBPLAN SCAN                      |VIEW1   |1       |630         |
|4 |      └─HASH GROUP BY                   |        |1       |630         |
|5 |        └─NESTED-LOOP JOIN              |        |10      |624         |
|6 |          ├─TABLE FULL SCAN             |T2      |10      |3           |
|7 |          └─DISTRIBUTED TABLE RANGE SCAN|TPART   |4       |62          |
============================================================================
Outputs & filters:
-------------------------------------
  0 - output(nil), filter(nil)
      table_columns([{VIEW1: ({TPART: (VIEW1.TPART.C1, VIEW1.TPART.C2, VIEW1.TPART.C3, VIEW1.TPART.C4)})}]),
      update([VIEW1.TPART.C3=column_conv(NUMBER,PS:(-1,0),NULL,100)])
  1 - output([VIEW1.TPART.C1], [VIEW1.TPART.C2], [VIEW1.TPART.C3], [VIEW1.TPART.C4]), filter(nil), rowset=16
  2 - output([VIEW1.TPART.C1], [VIEW1.TPART.C2], [VIEW1.TPART.C3], [VIEW1.TPART.C4]), filter(nil), rowset=16
      is_single, dop=1
  3 - output([VIEW1.TPART.C1], [VIEW1.TPART.C2], [VIEW1.TPART.C3], [VIEW1.TPART.C4]), filter(nil), rowset=16
      access([VIEW1.TPART.C1], [VIEW1.TPART.C2], [VIEW1.TPART.C3], [VIEW1.TPART.C4])
  4 - output([TPART.C1], [TPART.C2], [TPART.C3], [TPART.C4]), filter([TPART.C2 < T_FUN_SUM(T2.C2) / T_FUN_COUNT(T2.C2)]), rowset=16
      group([TPART.C1]), agg_func([T_FUN_SUM(T2.C2)], [T_FUN_COUNT(T2.C2)])
  5 - output([TPART.C1], [T2.C2], [TPART.C2], [TPART.C3], [TPART.C4]), filter(nil), rowset=16
      conds(nil), nl_params_([T2.C1(:0)]), use_batch=true
  6 - output([T2.C1], [T2.C2]), filter(nil), rowset=16
      access([T2.C1], [T2.C2]), partitions(p0)
      is_index_back=false, is_global_index=false, 
      range_key([T2.__pk_increment]), range(MIN ; MAX)always true
  7 - output([TPART.C1], [TPART.C2], [TPART.C3], [TPART.C4]), filter(nil), rowset=16
      access([GROUP_ID], [TPART.C1], [TPART.C2], [TPART.C3], [TPART.C4]), partitions(p[0-3])
      is_index_back=false, is_global_index=false, 
      range_key([TPART.C1]), range(MIN ; MAX), 
      range_cond([:0 > TPART.C1])
update tpart set c3 = 100 where c2 < (select avg(c2) from t2 where t2.c1 > tpart.c1);
EXPLAIN select /*+index(tpart idx_c2)*/ * from tpart;
Query Plan
=============================================================
|ID|OPERATOR                 |NAME    |EST.ROWS|EST.TIME(us)|
-------------------------------------------------------------
|0 |PX COORDINATOR           |        |10      |48          |
|1 |└─EXCHANGE OUT DISTR     |:EX10000|10      |36          |
|2 |  └─PX PARTITION ITERATOR|        |10      |10          |
|3 |    └─TABLE FULL SCAN    |TPART   |10      |10          |
=============================================================
Outputs & filters:
-------------------------------------
  0 - output([INTERNAL_FUNCTION(TPART.C1, TPART.C2, TPART.C3, TPART.C4)]), filter(nil), rowset=16
  1 - output([INTERNAL_FUNCTION(TPART.C1, TPART.C2, TPART.C3, TPART.C4)]), filter(nil), rowset=16
      dop=1
  2 - output([TPART.C1], [TPART.C2], [TPART.C3], [TPART.C4]), filter(nil), rowset=16
      force partition granule
  3 - output([TPART.C1], [TPART.C2], [TPART.C3], [TPART.C4]), filter(nil), rowset=16
      access([TPART.C1], [TPART.C2], [TPART.C3], [TPART.C4]), partitions(p[0-3])
      is_index_back=false, is_global_index=false, 
      range_key([TPART.C1]), range(MIN ; MAX)always true
select /*+index(tpart idx_c2)*/ * from tpart;
+----+------+------+------+
| C1 | C2   | C3   | C4   |
+----+------+------+------+
| 30 |   30 |  100 |   30 |
| 40 |   40 |  100 |   40 |
|  5 |    5 |  100 |    5 |
| 10 |   10 |  100 |   10 |
| 15 |   15 |  100 |   15 |
| 20 |   20 |  100 |   20 |
| 25 |   25 |  100 |   25 |
| 45 |   45 |   45 |   45 |
| 50 |   50 |   50 |   50 |
| 35 |   35 |  100 |   35 |
+----+------+------+------+
rollback;

update tpart set c3 = 100 where c2 < (select /*+no_unnest*/ avg(c2) from t2 where t2.c1 > tpart.c1);
EXPLAIN select /*+index(tpart idx_c2)*/ * from tpart;
Query Plan
=============================================================
|ID|OPERATOR                 |NAME    |EST.ROWS|EST.TIME(us)|
-------------------------------------------------------------
|0 |PX COORDINATOR           |        |10      |48          |
|1 |└─EXCHANGE OUT DISTR     |:EX10000|10      |36          |
|2 |  └─PX PARTITION ITERATOR|        |10      |10          |
|3 |    └─TABLE FULL SCAN    |TPART   |10      |10          |
=============================================================
Outputs & filters:
-------------------------------------
  0 - output([INTERNAL_FUNCTION(TPART.C1, TPART.C2, TPART.C3, TPART.C4)]), filter(nil), rowset=16
  1 - output([INTERNAL_FUNCTION(TPART.C1, TPART.C2, TPART.C3, TPART.C4)]), filter(nil), rowset=16
      dop=1
  2 - output([TPART.C1], [TPART.C2], [TPART.C3], [TPART.C4]), filter(nil), rowset=16
      force partition granule
  3 - output([TPART.C1], [TPART.C2], [TPART.C3], [TPART.C4]), filter(nil), rowset=16
      access([TPART.C1], [TPART.C2], [TPART.C3], [TPART.C4]), partitions(p[0-3])
      is_index_back=false, is_global_index=false, 
      range_key([TPART.C1]), range(MIN ; MAX)always true
select /*+index(tpart idx_c2)*/ * from tpart;
+----+------+------+------+
| C1 | C2   | C3   | C4   |
+----+------+------+------+
| 30 |   30 |  100 |   30 |
| 40 |   40 |  100 |   40 |
|  5 |    5 |  100 |    5 |
| 10 |   10 |  100 |   10 |
| 15 |   15 |  100 |   15 |
| 20 |   20 |  100 |   20 |
| 25 |   25 |  100 |   25 |
| 45 |   45 |   45 |   45 |
| 50 |   50 |   50 |   50 |
| 35 |   35 |  100 |   35 |
+----+------+------+------+
rollback;

EXPLAIN delete from tpart where c2 < (select avg(c2) from t2 where t2.c1 > tpart.c1);
Query Plan
============================================================================
|ID|OPERATOR                                |NAME    |EST.ROWS|EST.TIME(us)|
----------------------------------------------------------------------------
|0 |DISTRIBUTED DELETE                      |        |1       |647         |
|1 |└─PX COORDINATOR                        |        |1       |632         |
|2 |  └─EXCHANGE OUT DISTR                  |:EX10000|1       |631         |
|3 |    └─SUBPLAN SCAN                      |VIEW1   |1       |630         |
|4 |      └─HASH GROUP BY                   |        |1       |630         |
|5 |        └─NESTED-LOOP JOIN              |        |10      |624         |
|6 |          ├─TABLE FULL SCAN             |T2      |10      |3           |
|7 |          └─DISTRIBUTED TABLE RANGE SCAN|TPART   |4       |62          |
============================================================================
Outputs & filters:
-------------------------------------
  0 - output(nil), filter(nil)
      table_columns([{VIEW1: ({TPART: (VIEW1.TPART.C1, VIEW1.TPART.C2, VIEW1.TPART.C3, VIEW1.TPART.C4)}, {GIDX_C2: (VIEW1.TPART.C2, VIEW1.TPART.C1)})}])
  1 - output([VIEW1.TPART.C1], [VIEW1.TPART.C2], [VIEW1.TPART.C3], [VIEW1.TPART.C4]), filter(nil), rowset=16
  2 - output([VIEW1.TPART.C1], [VIEW1.TPART.C2], [VIEW1.TPART.C3], [VIEW1.TPART.C4]), filter(nil), rowset=16
      is_single, dop=1
  3 - output([VIEW1.TPART.C1], [VIEW1.TPART.C2], [VIEW1.TPART.C3], [VIEW1.TPART.C4]), filter(nil), rowset=16
      access([VIEW1.TPART.C1], [VIEW1.TPART.C2], [VIEW1.TPART.C3], [VIEW1.TPART.C4])
  4 - output([TPART.C1], [TPART.C2], [TPART.C3], [TPART.C4]), filter([TPART.C2 < T_FUN_SUM(T2.C2) / T_FUN_COUNT(T2.C2)]), rowset=16
      group([TPART.C1]), agg_func([T_FUN_SUM(T2.C2)], [T_FUN_COUNT(T2.C2)])
  5 - output([TPART.C1], [T2.C2], [TPART.C2], [TPART.C3], [TPART.C4]), filter(nil), rowset=16
      conds(nil), nl_params_([T2.C1(:0)]), use_batch=true
  6 - output([T2.C1], [T2.C2]), filter(nil), rowset=16
      access([T2.C1], [T2.C2]), partitions(p0)
      is_index_back=false, is_global_index=false, 
      range_key([T2.__pk_increment]), range(MIN ; MAX)always true
  7 - output([TPART.C1], [TPART.C2], [TPART.C3], [TPART.C4]), filter(nil), rowset=16
      access([GROUP_ID], [TPART.C1], [TPART.C2], [TPART.C3], [TPART.C4]), partitions(p[0-3])
      is_index_back=false, is_global_index=false, 
      range_key([TPART.C1]), range(MIN ; MAX), 
      range_cond([:0 > TPART.C1])
delete from tpart where c2 < (select avg(c2) from t2 where t2.c1 > tpart.c1);
EXPLAIN select /*+index(tpart idx_c2)*/ * from tpart;
Query Plan
=============================================================
|ID|OPERATOR                 |NAME    |EST.ROWS|EST.TIME(us)|
-------------------------------------------------------------
|0 |PX COORDINATOR           |        |10      |48          |
|1 |└─EXCHANGE OUT DISTR     |:EX10000|10      |36          |
|2 |  └─PX PARTITION ITERATOR|        |10      |10          |
|3 |    └─TABLE FULL SCAN    |TPART   |10      |10          |
=============================================================
Outputs & filters:
-------------------------------------
  0 - output([INTERNAL_FUNCTION(TPART.C1, TPART.C2, TPART.C3, TPART.C4)]), filter(nil), rowset=16
  1 - output([INTERNAL_FUNCTION(TPART.C1, TPART.C2, TPART.C3, TPART.C4)]), filter(nil), rowset=16
      dop=1
  2 - output([TPART.C1], [TPART.C2], [TPART.C3], [TPART.C4]), filter(nil), rowset=16
      force partition granule
  3 - output([TPART.C1], [TPART.C2], [TPART.C3], [TPART.C4]), filter(nil), rowset=16
      access([TPART.C1], [TPART.C2], [TPART.C3], [TPART.C4]), partitions(p[0-3])
      is_index_back=false, is_global_index=false, 
      range_key([TPART.C1]), range(MIN ; MAX)always true
select /*+index(tpart idx_c2)*/ * from tpart;
+----+------+------+------+
| C1 | C2   | C3   | C4   |
+----+------+------+------+
| 45 |   45 |   45 |   45 |
| 50 |   50 |   50 |   50 |
+----+------+------+------+
rollback;

delete from tpart where c2 < (select /*+no_unnest*/ avg(c2) from t2 where t2.c1 > tpart.c1);
EXPLAIN select /*+index(tpart idx_c2)*/ * from tpart;
Query Plan
=============================================================
|ID|OPERATOR                 |NAME    |EST.ROWS|EST.TIME(us)|
-------------------------------------------------------------
|0 |PX COORDINATOR           |        |10      |48          |
|1 |└─EXCHANGE OUT DISTR     |:EX10000|10      |36          |
|2 |  └─PX PARTITION ITERATOR|        |10      |10          |
|3 |    └─TABLE FULL SCAN    |TPART   |10      |10          |
=============================================================
Outputs & filters:
-------------------------------------
  0 - output([INTERNAL_FUNCTION(TPART.C1, TPART.C2, TPART.C3, TPART.C4)]), filter(nil), rowset=16
  1 - output([INTERNAL_FUNCTION(TPART.C1, TPART.C2, TPART.C3, TPART.C4)]), filter(nil), rowset=16
      dop=1
  2 - output([TPART.C1], [TPART.C2], [TPART.C3], [TPART.C4]), filter(nil), rowset=16
      force partition granule
  3 - output([TPART.C1], [TPART.C2], [TPART.C3], [TPART.C4]), filter(nil), rowset=16
      access([TPART.C1], [TPART.C2], [TPART.C3], [TPART.C4]), partitions(p[0-3])
      is_index_back=false, is_global_index=false, 
      range_key([TPART.C1]), range(MIN ; MAX)always true
select /*+index(tpart idx_c2)*/ * from tpart;
+----+------+------+------+
| C1 | C2   | C3   | C4   |
+----+------+------+------+
| 45 |   45 |   45 |   45 |
| 50 |   50 |   50 |   50 |
+----+------+------+------+
rollback;

## test returning into
EXPLAIN update t1 set c3 = 100 where 2 * t1.c2 > (select avg(c2) from t2 where t2.c1 > t1.c1) returning c1,c2,c3;
Query Plan
=============================================================
|ID|OPERATOR                    |NAME |EST.ROWS|EST.TIME(us)|
-------------------------------------------------------------
|0 |EXCHANGE IN REMOTE          |     |1       |205         |
|1 |└─EXCHANGE OUT REMOTE       |     |1       |204         |
|2 |  └─UPDATE                  |     |1       |203         |
|3 |    └─SUBPLAN SCAN          |VIEW1|1       |175         |
|4 |      └─HASH GROUP BY       |     |1       |175         |
|5 |        └─NESTED-LOOP JOIN  |     |25      |168         |
|6 |          ├─TABLE FULL SCAN |T2   |10      |3           |
|7 |          └─TABLE RANGE SCAN|T1   |17      |16          |
=============================================================
Outputs & filters:
-------------------------------------
  0 - output([VIEW1.T1.C1], [VIEW1.T1.C2], [column_conv(NUMBER,PS:(-1,0),NULL,100)]), filter(nil)
  1 - output([VIEW1.T1.C1], [VIEW1.T1.C2], [column_conv(NUMBER,PS:(-1,0),NULL,100)]), filter(nil)
  2 - output([VIEW1.T1.C1], [VIEW1.T1.C2], [column_conv(NUMBER,PS:(-1,0),NULL,100)]), filter(nil)
      table_columns([{VIEW1: ({T1: (VIEW1.T1.C1, VIEW1.T1.C2, VIEW1.T1.C3, VIEW1.T1.C4)})}]),
      update([VIEW1.T1.C3=column_conv(NUMBER,PS:(-1,0),NULL,100)])
  3 - output([VIEW1.T1.C1], [VIEW1.T1.C2], [VIEW1.T1.C3], [VIEW1.T1.C4]), filter(nil), rowset=256
      access([VIEW1.T1.C1], [VIEW1.T1.C2], [VIEW1.T1.C3], [VIEW1.T1.C4])
  4 - output([T1.C1], [T1.C2], [T1.C3], [T1.C4]), filter([cast(2, NUMBER(-1, -85)) * T1.C2 > T_FUN_SUM(T2.C2) / T_FUN_COUNT(T2.C2)]), rowset=256
      group([T1.C1]), agg_func([T_FUN_SUM(T2.C2)], [T_FUN_COUNT(T2.C2)])
  5 - output([T1.C1], [T2.C2], [T1.C2], [T1.C3], [T1.C4]), filter(nil), rowset=256
      conds(nil), nl_params_([T2.C1(:0)]), use_batch=true
  6 - output([T2.C1], [T2.C2]), filter(nil), rowset=256
      access([T2.C1], [T2.C2]), partitions(p0)
      is_index_back=false, is_global_index=false, 
      range_key([T2.__pk_increment]), range(MIN ; MAX)always true
  7 - output([T1.C1], [T1.C3], [T1.C2], [T1.C4]), filter(nil), rowset=256
      access([GROUP_ID], [T1.C1], [T1.C3], [T1.C2], [T1.C4]), partitions(p0)
      is_index_back=false, is_global_index=false, 
      range_key([T1.C1]), range(MIN ; MAX), 
      range_cond([:0 > T1.C1])
update t1 set c3 = 100 where 2 * t1.c2 > (select avg(c2) from t2 where t2.c1 > t1.c1) returning c1,c2,c3;
+----+------+------+
| C1 | C2   | C3   |
+----+------+------+
| 16 |   16 |  100 |
| 17 |   17 |  100 |
| 18 |   18 |  100 |
| 19 |   19 |  100 |
| 20 |   20 |  100 |
| 21 |   21 |  100 |
| 22 |   22 |  100 |
| 23 |   23 |  100 |
| 24 |   24 |  100 |
| 25 |   25 |  100 |
| 26 |   26 |  100 |
| 27 |   27 |  100 |
| 28 |   28 |  100 |
| 29 |   29 |  100 |
| 30 |   30 |  100 |
| 31 |   31 |  100 |
| 32 |   32 |  100 |
| 33 |   33 |  100 |
| 34 |   34 |  100 |
| 35 |   35 |  100 |
| 36 |   36 |  100 |
| 37 |   37 |  100 |
| 38 |   38 |  100 |
| 39 |   39 |  100 |
| 40 |   40 |  100 |
| 41 |   41 |  100 |
| 42 |   42 |  100 |
| 43 |   43 |  100 |
| 44 |   44 |  100 |
| 45 |   45 |  100 |
| 46 |   46 |  100 |
| 47 |   47 |  100 |
| 48 |   48 |  100 |
| 49 |   49 |  100 |
+----+------+------+
rollback;

EXPLAIN update t1 set c3 = 100 where 2 * t1.c2 > (select /*+no_unnest*/ avg(c2) from t2 where t2.c1 > t1.c1) returning c1,c2,c3;
Query Plan
=========================================================
|ID|OPERATOR                 |NAME|EST.ROWS|EST.TIME(us)|
---------------------------------------------------------
|0 |EXCHANGE IN REMOTE       |    |17      |1121        |
|1 |└─EXCHANGE OUT REMOTE    |    |17      |1102        |
|2 |  └─UPDATE               |    |17      |1058        |
|3 |    └─SUBPLAN FILTER     |    |17      |908         |
|4 |      ├─TABLE FULL SCAN  |T1  |50      |6           |
|5 |      └─SCALAR GROUP BY  |    |1       |19          |
|6 |        └─TABLE FULL SCAN|T2  |4       |18          |
=========================================================
Outputs & filters:
-------------------------------------
  0 - output([T1.C1], [T1.C2], [column_conv(NUMBER,PS:(-1,0),NULL,100)]), filter(nil)
  1 - output([T1.C1], [T1.C2], [column_conv(NUMBER,PS:(-1,0),NULL,100)]), filter(nil)
  2 - output([T1.C1], [T1.C2], [column_conv(NUMBER,PS:(-1,0),NULL,100)]), filter(nil)
      table_columns([{T1: ({T1: (T1.C1, T1.C2, T1.C3, T1.C4)})}]),
      update([T1.C3=column_conv(NUMBER,PS:(-1,0),NULL,100)])
  3 - output([T1.C1], [T1.C2], [T1.C3], [T1.C4]), filter([cast(2, NUMBER(-1, -85)) * T1.C2 > subquery(1)]), rowset=256
      exec_params_([T1.C1(:0)]), onetime_exprs_(nil), init_plan_idxs_(nil), use_batch=false
  4 - output([T1.C1], [T1.C3], [T1.C2], [T1.C4]), filter(nil), rowset=256
      access([T1.C1], [T1.C3], [T1.C2], [T1.C4]), partitions(p0)
      is_index_back=false, is_global_index=false, 
      range_key([T1.C1]), range(MIN ; MAX)always true
  5 - output([T_FUN_SUM(T_FUN_SUM(T2.C2)) / T_FUN_COUNT_SUM(T_FUN_COUNT(T2.C2))]), filter(nil), rowset=256
      group(nil), agg_func([T_FUN_SUM(T_FUN_SUM(T2.C2))], [T_FUN_COUNT_SUM(T_FUN_COUNT(T2.C2))])
  6 - output([T_FUN_SUM(T2.C2)], [T_FUN_COUNT(T2.C2)]), filter([T2.C1 > :0]), rowset=256
      access([T2.C1], [T2.C2]), partitions(p0)
      is_index_back=false, is_global_index=false, filter_before_indexback[false], 
      range_key([T2.__pk_increment]), range(MIN ; MAX)always true, 
      pushdown_aggregation([T_FUN_SUM(T2.C2)], [T_FUN_COUNT(T2.C2)])
update t1 set c3 = 100 where 2 * t1.c2 > (select /*+no_unnest*/ avg(c2) from t2 where t2.c1 > t1.c1) returning c1,c2,c3;
+----+------+------+
| C1 | C2   | C3   |
+----+------+------+
| 16 |   16 |  100 |
| 17 |   17 |  100 |
| 18 |   18 |  100 |
| 19 |   19 |  100 |
| 20 |   20 |  100 |
| 21 |   21 |  100 |
| 22 |   22 |  100 |
| 23 |   23 |  100 |
| 24 |   24 |  100 |
| 25 |   25 |  100 |
| 26 |   26 |  100 |
| 27 |   27 |  100 |
| 28 |   28 |  100 |
| 29 |   29 |  100 |
| 30 |   30 |  100 |
| 31 |   31 |  100 |
| 32 |   32 |  100 |
| 33 |   33 |  100 |
| 34 |   34 |  100 |
| 35 |   35 |  100 |
| 36 |   36 |  100 |
| 37 |   37 |  100 |
| 38 |   38 |  100 |
| 39 |   39 |  100 |
| 40 |   40 |  100 |
| 41 |   41 |  100 |
| 42 |   42 |  100 |
| 43 |   43 |  100 |
| 44 |   44 |  100 |
| 45 |   45 |  100 |
| 46 |   46 |  100 |
| 47 |   47 |  100 |
| 48 |   48 |  100 |
| 49 |   49 |  100 |
+----+------+------+
rollback;

EXPLAIN delete from t1 where 2 * t1.c2 > (select avg(c2) from t2 where t2.c1 > t1.c1) returning sum(c1);
Query Plan
===============================================================
|ID|OPERATOR                      |NAME |EST.ROWS|EST.TIME(us)|
---------------------------------------------------------------
|0 |EXCHANGE IN REMOTE            |     |1       |184         |
|1 |└─EXCHANGE OUT REMOTE         |     |1       |184         |
|2 |  └─SCALAR GROUP BY           |     |1       |184         |
|3 |    └─DELETE                  |     |1       |184         |
|4 |      └─SUBPLAN SCAN          |VIEW1|1       |175         |
|5 |        └─HASH GROUP BY       |     |1       |175         |
|6 |          └─NESTED-LOOP JOIN  |     |25      |168         |
|7 |            ├─TABLE FULL SCAN |T2   |10      |3           |
|8 |            └─TABLE RANGE SCAN|T1   |17      |16          |
===============================================================
Outputs & filters:
-------------------------------------
  0 - output([T_FUN_SUM(VIEW1.T1.C1)]), filter(nil)
  1 - output([T_FUN_SUM(VIEW1.T1.C1)]), filter(nil)
  2 - output([T_FUN_SUM(VIEW1.T1.C1)]), filter(nil), rowset=256
      group(nil), agg_func([T_FUN_SUM(VIEW1.T1.C1)])
  3 - output([VIEW1.T1.C1]), filter(nil)
      table_columns([{VIEW1: ({T1: (VIEW1.T1.C1, VIEW1.T1.C2, VIEW1.T1.C3, VIEW1.T1.C4)})}])
  4 - output([VIEW1.T1.C1], [VIEW1.T1.C2], [VIEW1.T1.C3], [VIEW1.T1.C4]), filter(nil), rowset=256
      access([VIEW1.T1.C1], [VIEW1.T1.C2], [VIEW1.T1.C3], [VIEW1.T1.C4])
  5 - output([T1.C1], [T1.C2], [T1.C3], [T1.C4]), filter([cast(2, NUMBER(-1, -85)) * T1.C2 > T_FUN_SUM(T2.C2) / T_FUN_COUNT(T2.C2)]), rowset=256
      group([T1.C1]), agg_func([T_FUN_SUM(T2.C2)], [T_FUN_COUNT(T2.C2)])
  6 - output([T1.C1], [T2.C2], [T1.C2], [T1.C3], [T1.C4]), filter(nil), rowset=256
      conds(nil), nl_params_([T2.C1(:0)]), use_batch=true
  7 - output([T2.C1], [T2.C2]), filter(nil), rowset=256
      access([T2.C1], [T2.C2]), partitions(p0)
      is_index_back=false, is_global_index=false, 
      range_key([T2.__pk_increment]), range(MIN ; MAX)always true
  8 - output([T1.C1], [T1.C2], [T1.C3], [T1.C4]), filter(nil), rowset=256
      access([GROUP_ID], [T1.C1], [T1.C2], [T1.C3], [T1.C4]), partitions(p0)
      is_index_back=false, is_global_index=false, 
      range_key([T1.C1]), range(MIN ; MAX), 
      range_cond([:0 > T1.C1])
delete from t1 where 2 * t1.c2 > (select avg(c2) from t2 where t2.c1 > t1.c1) returning sum(c1);
+---------+
| SUM(C1) |
+---------+
|    1105 |
+---------+
rollback;

EXPLAIN delete from t1 where 2 * t1.c2 > (select /*+no_unnest*/ avg(c2) from t2 where t2.c1 > t1.c1) returning sum(c1);
Query Plan
===========================================================
|ID|OPERATOR                   |NAME|EST.ROWS|EST.TIME(us)|
-----------------------------------------------------------
|0 |EXCHANGE IN REMOTE         |    |1       |999         |
|1 |└─EXCHANGE OUT REMOTE      |    |1       |999         |
|2 |  └─SCALAR GROUP BY        |    |1       |999         |
|3 |    └─DELETE               |    |17      |998         |
|4 |      └─SUBPLAN FILTER     |    |17      |908         |
|5 |        ├─TABLE FULL SCAN  |T1  |50      |6           |
|6 |        └─SCALAR GROUP BY  |    |1       |19          |
|7 |          └─TABLE FULL SCAN|T2  |4       |18          |
===========================================================
Outputs & filters:
-------------------------------------
  0 - output([T_FUN_SUM(T1.C1)]), filter(nil)
  1 - output([T_FUN_SUM(T1.C1)]), filter(nil)
  2 - output([T_FUN_SUM(T1.C1)]), filter(nil), rowset=256
      group(nil), agg_func([T_FUN_SUM(T1.C1)])
  3 - output([T1.C1]), filter(nil)
      table_columns([{T1: ({T1: (T1.C1, T1.C2, T1.C3, T1.C4)})}])
  4 - output([T1.C1], [T1.C2], [T1.C3], [T1.C4]), filter([cast(2, NUMBER(-1, -85)) * T1.C2 > subquery(1)]), rowset=256
      exec_params_([T1.C1(:0)]), onetime_exprs_(nil), init_plan_idxs_(nil), use_batch=false
  5 - output([T1.C1], [T1.C2], [T1.C3], [T1.C4]), filter(nil), rowset=256
      access([T1.C1], [T1.C2], [T1.C3], [T1.C4]), partitions(p0)
      is_index_back=false, is_global_index=false, 
      range_key([T1.C1]), range(MIN ; MAX)always true
  6 - output([T_FUN_SUM(T_FUN_SUM(T2.C2)) / T_FUN_COUNT_SUM(T_FUN_COUNT(T2.C2))]), filter(nil), rowset=256
      group(nil), agg_func([T_FUN_SUM(T_FUN_SUM(T2.C2))], [T_FUN_COUNT_SUM(T_FUN_COUNT(T2.C2))])
  7 - output([T_FUN_SUM(T2.C2)], [T_FUN_COUNT(T2.C2)]), filter([T2.C1 > :0]), rowset=256
      access([T2.C1], [T2.C2]), partitions(p0)
      is_index_back=false, is_global_index=false, filter_before_indexback[false], 
      range_key([T2.__pk_increment]), range(MIN ; MAX)always true, 
      pushdown_aggregation([T_FUN_SUM(T2.C2)], [T_FUN_COUNT(T2.C2)])
delete from t1 where 2 * t1.c2 > (select /*+no_unnest*/ avg(c2) from t2 where t2.c1 > t1.c1) returning sum(c1);
+---------+
| SUM(C1) |
+---------+
|    1105 |
+---------+
rollback;

set autocommit=1;
drop table t1;
drop table t2;
drop table t3;
drop table tpart;
drop sequence seq;

## enhance join first pullup 
drop table prpCmain;
drop table PrpTmain;
drop table PrpTration;
drop table PrpTplan;

CREATE TABLE prpCmain (PROPOSALNO VARCHAR2(40) NOT NULL, SUMPREMIUMNOVAT NUMBER(20,8), SUMVAT NUMBER(20,8), CONSTRAINT ckt_cmain_endhour PRIMARY KEY (ProposalNo));

CREATE TABLE PrpTmain (PROPOSALNO VARCHAR2(40) NOT NULL, SUMAMOUNT NUMBER(14,2), SUMPREMIUM NUMBER(14,2), SUMPREMIUMNOVAT NUMBER(20,8), SUMVAT NUMBER(20,8), CONSTRAINT PK_TMAIN PRIMARY KEY (ProposalNo));

CREATE TABLE PrpTration (PROPOSALNO VARCHAR2(40) NOT NULL, MODECODE VARCHAR2(20) NOT NULL, RATIONAMOUNT NUMBER(14,2), RATIONPREMIUM NUMBER(14,2), CONSTRAINT pk_tration PRIMARY KEY (ProposalNo,ModeCode));

CREATE TABLE PrpTplan (PROPOSALNO VARCHAR2(40) NOT NULL, CURRENCY VARCHAR2(3) NOT NULL, RISKCODE VARCHAR2(4) DEFAULT ' ' NOT NULL, PLANFEENOVAT NUMBER(20,8), DELINQUENTFEENOVAT NUMBER(20,8), PLANVAT NUMBER(20,8), DELINQUENTVAT NUMBER(20,8), CONSTRAINT pk_prptplan PRIMARY KEY (ProposalNo,RiskCode,Currency));

EXPLAIN UPDATE prpcmain t
SET (t.sumpremiumnovat,
     t.sumvat) =
 (SELECT a.sumpremiumnovat,
         a.sumvat
  FROM prptmain a
  WHERE a.proposalno = t.proposalno)
WHERE t.proposalno = 'a';
Query Plan
=======================================================================
|ID|OPERATOR                               |NAME|EST.ROWS|EST.TIME(us)|
-----------------------------------------------------------------------
|0 |EXCHANGE IN REMOTE                     |    |1       |42          |
|1 |└─EXCHANGE OUT REMOTE                  |    |1       |42          |
|2 |  └─UPDATE                             |    |1       |42          |
|3 |    └─NESTED-LOOP OUTER JOIN CARTESIAN |    |1       |11          |
|4 |      ├─TABLE GET                      |T   |1       |5           |
|5 |      └─TABLE GET                      |A   |1       |5           |
=======================================================================
Outputs & filters:
-------------------------------------
  0 - output(nil), filter(nil)
  1 - output(nil), filter(nil)
  2 - output(nil), filter(nil)
      table_columns([{T: ({PRPCMAIN: (T.PROPOSALNO, T.SUMPREMIUMNOVAT, T.SUMVAT)})}]),
      update([T.SUMPREMIUMNOVAT=column_conv(DECIMAL_INT,PS:(20,8),NULL,CASE WHEN A.PROPOSALNO IS NOT NULL THEN A.SUMPREMIUMNOVAT ELSE cast(NULL, DECIMAL_INT(20,
       8)) END)], [T.SUMVAT=column_conv(DECIMAL_INT,PS:(20,8),NULL,CASE WHEN A.PROPOSALNO IS NOT NULL THEN A.SUMVAT ELSE cast(NULL, DECIMAL_INT(20, 8)) END)])
  3 - output([T.PROPOSALNO], [T.SUMPREMIUMNOVAT], [T.SUMVAT], [A.PROPOSALNO], [A.SUMPREMIUMNOVAT], [A.SUMVAT]), filter(nil), rowset=16
      conds(nil), nl_params_(nil), use_batch=false
  4 - output([T.PROPOSALNO], [T.SUMPREMIUMNOVAT], [T.SUMVAT]), filter(nil), rowset=16
      access([T.PROPOSALNO], [T.SUMPREMIUMNOVAT], [T.SUMVAT]), partitions(p0)
      is_index_back=false, is_global_index=false, 
      range_key([T.PROPOSALNO]), range[a ; a], 
      range_cond([T.PROPOSALNO = cast('a', VARCHAR2(1048576 ))])
  5 - output([A.PROPOSALNO], [A.SUMPREMIUMNOVAT], [A.SUMVAT]), filter(nil), rowset=16
      access([A.PROPOSALNO], [A.SUMPREMIUMNOVAT], [A.SUMVAT]), partitions(p0)
      is_index_back=false, is_global_index=false, 
      range_key([A.PROPOSALNO]), range[a ; a], 
      range_cond([A.PROPOSALNO = cast('a', VARCHAR2(1048576 ))])
UPDATE prpcmain t
SET (t.sumpremiumnovat,
     t.sumvat) =
 (SELECT a.sumpremiumnovat,
         a.sumvat
  FROM prptmain a
  WHERE a.proposalno = t.proposalno)
WHERE t.proposalno = 'a';

EXPLAIN UPDATE prpcmain t
SET (t.sumpremiumnovat,
     t.sumvat) =
 (SELECT /*+no_unnest*/ a.sumpremiumnovat,
         a.sumvat
  FROM prptmain a
  WHERE a.proposalno = t.proposalno)
WHERE t.proposalno = 'a';
Query Plan
=============================================================
|ID|OPERATOR                     |NAME|EST.ROWS|EST.TIME(us)|
-------------------------------------------------------------
|0 |EXCHANGE IN REMOTE           |    |1       |54          |
|1 |└─EXCHANGE OUT REMOTE        |    |1       |54          |
|2 |  └─UPDATE                   |    |1       |52          |
|3 |    └─SUBPLAN FILTER         |    |1       |21          |
|4 |      ├─TABLE GET            |T   |1       |5           |
|5 |      └─DISTRIBUTED TABLE GET|A   |1       |16          |
=============================================================
Outputs & filters:
-------------------------------------
  0 - output(nil), filter(nil)
  1 - output(nil), filter(nil)
  2 - output(nil), filter(nil)
      table_columns([{T: ({PRPCMAIN: (T.PROPOSALNO, T.SUMPREMIUMNOVAT, T.SUMVAT)})}]),
      update([T.SUMPREMIUMNOVAT=column_conv(DECIMAL_INT,PS:(20,8),NULL,A.SUMPREMIUMNOVAT)], [T.SUMVAT=column_conv(DECIMAL_INT,PS:(20,8),NULL,A.SUMVAT)])
  3 - output([T.PROPOSALNO], [T.SUMPREMIUMNOVAT], [T.SUMVAT], [A.SUMPREMIUMNOVAT], [A.SUMVAT]), filter(nil)
      exec_params_([T.PROPOSALNO(:0)]), onetime_exprs_(nil), init_plan_idxs_(nil), use_batch=true
  4 - output([T.PROPOSALNO], [T.SUMPREMIUMNOVAT], [T.SUMVAT]), filter(nil)
      access([T.PROPOSALNO], [T.SUMPREMIUMNOVAT], [T.SUMVAT]), partitions(p0)
      is_index_back=false, is_global_index=false, 
      range_key([T.PROPOSALNO]), range[a ; a], 
      range_cond([T.PROPOSALNO = cast('a', VARCHAR2(1048576 ))])
  5 - output([A.SUMPREMIUMNOVAT], [A.SUMVAT]), filter(nil)
      access([GROUP_ID], [A.SUMPREMIUMNOVAT], [A.SUMVAT]), partitions(p0)
      is_index_back=false, is_global_index=false, 
      range_key([A.PROPOSALNO]), range(MIN ; MAX)always true, 
      range_cond([A.PROPOSALNO = :0])
UPDATE prpcmain t
SET (t.sumpremiumnovat,
     t.sumvat) =
 (SELECT /*+no_unnest*/ a.sumpremiumnovat,
         a.sumvat
  FROM prptmain a
  WHERE a.proposalno = t.proposalno)
WHERE t.proposalno = 'a';

EXPLAIN UPDATE prptmain t
SET (t.sumamount,
     t.sumpremium) =
 (SELECT sum(a.rationamount),
         sum(a.rationpremium)
  FROM prptration a
  WHERE a.proposalno = t.proposalno
  GROUP BY a.proposalno)
WHERE t.proposalno = 'a';
Query Plan
========================================================================
|ID|OPERATOR                               |NAME |EST.ROWS|EST.TIME(us)|
------------------------------------------------------------------------
|0 |EXCHANGE IN REMOTE                     |     |1       |40          |
|1 |└─EXCHANGE OUT REMOTE                  |     |1       |40          |
|2 |  └─UPDATE                             |     |1       |40          |
|3 |    └─NESTED-LOOP OUTER JOIN CARTESIAN |     |1       |8           |
|4 |      ├─TABLE GET                      |T    |1       |5           |
|5 |      └─SUBPLAN SCAN                   |VIEW1|1       |3           |
|6 |        └─MERGE GROUP BY               |     |1       |3           |
|7 |          └─TABLE RANGE SCAN           |A    |1       |3           |
========================================================================
Outputs & filters:
-------------------------------------
  0 - output(nil), filter(nil)
  1 - output(nil), filter(nil)
  2 - output(nil), filter(nil)
      table_columns([{T: ({PRPTMAIN: (T.PROPOSALNO, T.SUMAMOUNT, T.SUMPREMIUM, T.SUMPREMIUMNOVAT, T.SUMVAT)})}]),
      update([T.SUMAMOUNT=column_conv(DECIMAL_INT,PS:(14,2),NULL,cast(VIEW1.SUM(A.RATIONAMOUNT), DECIMAL_INT(14, 2)))], [T.SUMPREMIUM=column_conv(DECIMAL_INT,
      PS:(14,2),NULL,cast(VIEW1.SUM(A.RATIONPREMIUM), DECIMAL_INT(14, 2)))])
  3 - output([T.PROPOSALNO], [T.SUMAMOUNT], [T.SUMPREMIUM], [T.SUMPREMIUMNOVAT], [T.SUMVAT], [VIEW1.SUM(A.RATIONAMOUNT)], [VIEW1.SUM(A.RATIONPREMIUM)]), filter(nil), rowset=16
      conds(nil), nl_params_(nil), use_batch=false
  4 - output([T.PROPOSALNO], [T.SUMAMOUNT], [T.SUMPREMIUM], [T.SUMPREMIUMNOVAT], [T.SUMVAT]), filter(nil), rowset=16
      access([T.PROPOSALNO], [T.SUMAMOUNT], [T.SUMPREMIUM], [T.SUMPREMIUMNOVAT], [T.SUMVAT]), partitions(p0)
      is_index_back=false, is_global_index=false, 
      range_key([T.PROPOSALNO]), range[a ; a], 
      range_cond([T.PROPOSALNO = cast('a', VARCHAR2(1048576 ))])
  5 - output([VIEW1.SUM(A.RATIONAMOUNT)], [VIEW1.SUM(A.RATIONPREMIUM)]), filter(nil), rowset=16
      access([VIEW1.SUM(A.RATIONAMOUNT)], [VIEW1.SUM(A.RATIONPREMIUM)])
  6 - output([T_FUN_SUM(A.RATIONAMOUNT)], [T_FUN_SUM(A.RATIONPREMIUM)], [A.PROPOSALNO]), filter(nil), rowset=16
      group(nil), agg_func([T_FUN_SUM(A.RATIONAMOUNT)], [T_FUN_SUM(A.RATIONPREMIUM)])
  7 - output([A.PROPOSALNO], [A.RATIONAMOUNT], [A.RATIONPREMIUM]), filter(nil), rowset=16
      access([A.PROPOSALNO], [A.RATIONAMOUNT], [A.RATIONPREMIUM]), partitions(p0)
      is_index_back=false, is_global_index=false, 
      range_key([A.PROPOSALNO], [A.MODECODE]), range(a,MIN ; a,MAX), 
      range_cond([A.PROPOSALNO = cast('a', VARCHAR2(1048576 ))])
UPDATE prptmain t
SET (t.sumamount,
     t.sumpremium) =
 (SELECT sum(a.rationamount),
         sum(a.rationpremium)
  FROM prptration a
  WHERE a.proposalno = t.proposalno
  GROUP BY a.proposalno)
WHERE t.proposalno = 'a';

EXPLAIN UPDATE prptmain t
SET (t.sumamount,
     t.sumpremium) =
 (SELECT /*+no_unnest*/ sum(a.rationamount),
         sum(a.rationpremium)
  FROM prptration a
  WHERE a.proposalno = t.proposalno
  GROUP BY a.proposalno)
WHERE t.proposalno = 'a';
Query Plan
==========================================================
|ID|OPERATOR                  |NAME|EST.ROWS|EST.TIME(us)|
----------------------------------------------------------
|0 |EXCHANGE IN REMOTE        |    |1       |58          |
|1 |└─EXCHANGE OUT REMOTE     |    |1       |57          |
|2 |  └─UPDATE                |    |1       |55          |
|3 |    └─SUBPLAN FILTER      |    |1       |23          |
|4 |      ├─TABLE GET         |T   |1       |5           |
|5 |      └─MERGE GROUP BY    |    |1       |19          |
|6 |        └─TABLE RANGE SCAN|A   |1       |18          |
==========================================================
Outputs & filters:
-------------------------------------
  0 - output(nil), filter(nil)
  1 - output(nil), filter(nil)
  2 - output(nil), filter(nil)
      table_columns([{T: ({PRPTMAIN: (T.PROPOSALNO, T.SUMAMOUNT, T.SUMPREMIUM, T.SUMPREMIUMNOVAT, T.SUMVAT)})}]),
      update([T.SUMAMOUNT=column_conv(DECIMAL_INT,PS:(14,2),NULL,cast(T_FUN_SUM(A.RATIONAMOUNT), DECIMAL_INT(14, 2)))], [T.SUMPREMIUM=column_conv(DECIMAL_INT,
      PS:(14,2),NULL,cast(T_FUN_SUM(A.RATIONPREMIUM), DECIMAL_INT(14, 2)))])
  3 - output([T.PROPOSALNO], [T.SUMAMOUNT], [T.SUMPREMIUM], [T.SUMPREMIUMNOVAT], [T.SUMVAT], [T_FUN_SUM(A.RATIONAMOUNT)], [T_FUN_SUM(A.RATIONPREMIUM)]), filter(nil)
      exec_params_([T.PROPOSALNO(:0)]), onetime_exprs_(nil), init_plan_idxs_(nil), use_batch=false
  4 - output([T.PROPOSALNO], [T.SUMAMOUNT], [T.SUMPREMIUM], [T.SUMPREMIUMNOVAT], [T.SUMVAT]), filter(nil)
      access([T.PROPOSALNO], [T.SUMAMOUNT], [T.SUMPREMIUM], [T.SUMPREMIUMNOVAT], [T.SUMVAT]), partitions(p0)
      is_index_back=false, is_global_index=false, 
      range_key([T.PROPOSALNO]), range[a ; a], 
      range_cond([T.PROPOSALNO = cast('a', VARCHAR2(1048576 ))])
  5 - output([T_FUN_SUM(A.RATIONAMOUNT)], [T_FUN_SUM(A.RATIONPREMIUM)]), filter(nil)
      group(nil), agg_func([T_FUN_SUM(A.RATIONAMOUNT)], [T_FUN_SUM(A.RATIONPREMIUM)])
  6 - output([A.RATIONAMOUNT], [A.RATIONPREMIUM]), filter(nil)
      access([A.RATIONAMOUNT], [A.RATIONPREMIUM]), partitions(p0)
      is_index_back=false, is_global_index=false, 
      range_key([A.PROPOSALNO], [A.MODECODE]), range(MIN,MIN ; MAX,MAX)always true, 
      range_cond([A.PROPOSALNO = :0])
UPDATE prptmain t
SET (t.sumamount,
     t.sumpremium) =
 (SELECT /*+no_unnest*/ sum(a.rationamount),
         sum(a.rationpremium)
  FROM prptration a
  WHERE a.proposalno = t.proposalno
  GROUP BY a.proposalno)
WHERE t.proposalno = 'a';

EXPLAIN UPDATE prptmain t
SET (t.sumpremium) =
 (SELECT COUNT(*)
  FROM prptration a
  WHERE a.proposalno = t.proposalno
  GROUP BY a.proposalno)
WHERE t.proposalno = 'a';
Query Plan
========================================================================
|ID|OPERATOR                               |NAME |EST.ROWS|EST.TIME(us)|
------------------------------------------------------------------------
|0 |EXCHANGE IN REMOTE                     |     |1       |40          |
|1 |└─EXCHANGE OUT REMOTE                  |     |1       |40          |
|2 |  └─UPDATE                             |     |1       |40          |
|3 |    └─NESTED-LOOP OUTER JOIN CARTESIAN |     |1       |8           |
|4 |      ├─TABLE GET                      |T    |1       |5           |
|5 |      └─SUBPLAN SCAN                   |VIEW1|1       |3           |
|6 |        └─MERGE GROUP BY               |     |1       |3           |
|7 |          └─TABLE RANGE SCAN           |A    |1       |3           |
========================================================================
Outputs & filters:
-------------------------------------
  0 - output(nil), filter(nil)
  1 - output(nil), filter(nil)
  2 - output(nil), filter(nil)
      table_columns([{T: ({PRPTMAIN: (T.PROPOSALNO, T.SUMAMOUNT, T.SUMPREMIUM, T.SUMPREMIUMNOVAT, T.SUMVAT)}), hash_distinct}]),
      update([T.SUMPREMIUM=column_conv(DECIMAL_INT,PS:(14,2),NULL,cast(VIEW1.COUNT(*), DECIMAL_INT(14, 2)))])
  3 - output([T.PROPOSALNO], [T.SUMAMOUNT], [T.SUMPREMIUM], [T.SUMPREMIUMNOVAT], [T.SUMVAT], [VIEW1.COUNT(*)]), filter(nil), rowset=16
      conds(nil), nl_params_(nil), use_batch=false
  4 - output([T.PROPOSALNO], [T.SUMPREMIUM], [T.SUMAMOUNT], [T.SUMPREMIUMNOVAT], [T.SUMVAT]), filter(nil), rowset=16
      access([T.PROPOSALNO], [T.SUMPREMIUM], [T.SUMAMOUNT], [T.SUMPREMIUMNOVAT], [T.SUMVAT]), partitions(p0)
      is_index_back=false, is_global_index=false, 
      range_key([T.PROPOSALNO]), range[a ; a], 
      range_cond([T.PROPOSALNO = cast('a', VARCHAR2(1048576 ))])
  5 - output([VIEW1.COUNT(*)]), filter(nil), rowset=16
      access([VIEW1.COUNT(*)])
  6 - output([T_FUN_COUNT(*)]), filter(nil), rowset=16
      group(nil), agg_func([T_FUN_COUNT(*)])
  7 - output(nil), filter(nil), rowset=16
      access(nil), partitions(p0)
      is_index_back=false, is_global_index=false, 
      range_key([A.PROPOSALNO], [A.MODECODE]), range(a,MIN ; a,MAX), 
      range_cond([A.PROPOSALNO = cast('a', VARCHAR2(1048576 ))])
UPDATE prptmain t
SET (t.sumpremium) =
 (SELECT COUNT(*)
  FROM prptration a
  WHERE a.proposalno = t.proposalno
  GROUP BY a.proposalno)
WHERE t.proposalno = 'a';

EXPLAIN UPDATE prptmain t
SET (t.sumpremium) =
 (SELECT /*+no_unnest*/ COUNT(*)
  FROM prptration a
  WHERE a.proposalno = t.proposalno
  GROUP BY a.proposalno)
WHERE t.proposalno = 'a';
Query Plan
==========================================================
|ID|OPERATOR                  |NAME|EST.ROWS|EST.TIME(us)|
----------------------------------------------------------
|0 |EXCHANGE IN REMOTE        |    |1       |43          |
|1 |└─EXCHANGE OUT REMOTE     |    |1       |42          |
|2 |  └─UPDATE                |    |1       |39          |
|3 |    └─SUBPLAN FILTER      |    |1       |8           |
|4 |      ├─TABLE GET         |T   |1       |5           |
|5 |      └─MERGE GROUP BY    |    |1       |3           |
|6 |        └─TABLE RANGE SCAN|A   |1       |3           |
==========================================================
Outputs & filters:
-------------------------------------
  0 - output(nil), filter(nil)
  1 - output(nil), filter(nil)
  2 - output(nil), filter(nil)
      table_columns([{T: ({PRPTMAIN: (T.PROPOSALNO, T.SUMAMOUNT, T.SUMPREMIUM, T.SUMPREMIUMNOVAT, T.SUMVAT)})}]),
      update([T.SUMPREMIUM=column_conv(DECIMAL_INT,PS:(14,2),NULL,cast(:0, DECIMAL_INT(14, 2)))])
  3 - output([T.PROPOSALNO], [T.SUMAMOUNT], [T.SUMPREMIUM], [T.SUMPREMIUMNOVAT], [T.SUMVAT], [:0]), filter(nil), rowset=16
      exec_params_(nil), onetime_exprs_([subquery(1)(:0)]), init_plan_idxs_(nil), use_batch=false
  4 - output([T.PROPOSALNO], [T.SUMPREMIUM], [T.SUMAMOUNT], [T.SUMPREMIUMNOVAT], [T.SUMVAT]), filter(nil), rowset=16
      access([T.PROPOSALNO], [T.SUMPREMIUM], [T.SUMAMOUNT], [T.SUMPREMIUMNOVAT], [T.SUMVAT]), partitions(p0)
      is_index_back=false, is_global_index=false, 
      range_key([T.PROPOSALNO]), range[a ; a], 
      range_cond([T.PROPOSALNO = cast('a', VARCHAR2(1048576 ))])
  5 - output([T_FUN_COUNT(*)]), filter(nil), rowset=16
      group(nil), agg_func([T_FUN_COUNT(*)])
  6 - output(nil), filter(nil), rowset=16
      access(nil), partitions(p0)
      is_index_back=false, is_global_index=false, 
      range_key([A.PROPOSALNO], [A.MODECODE]), range(a,MIN ; a,MAX), 
      range_cond([A.PROPOSALNO = cast('a', VARCHAR2(1048576 ))])
UPDATE prptmain t
SET (t.sumpremium) =
 (SELECT /*+no_unnest*/ COUNT(*)
  FROM prptration a
  WHERE a.proposalno = t.proposalno
  GROUP BY a.proposalno)
WHERE t.proposalno = 'a';

EXPLAIN UPDATE prptmain t
SET (t.sumamount) =
 (SELECT sum(nvl(a.rationamount, 1))
  FROM prptration a
  WHERE a.proposalno = t.proposalno
  GROUP BY a.proposalno)
WHERE t.proposalno = 'a';
Query Plan
========================================================================
|ID|OPERATOR                               |NAME |EST.ROWS|EST.TIME(us)|
------------------------------------------------------------------------
|0 |EXCHANGE IN REMOTE                     |     |1       |40          |
|1 |└─EXCHANGE OUT REMOTE                  |     |1       |40          |
|2 |  └─UPDATE                             |     |1       |40          |
|3 |    └─NESTED-LOOP OUTER JOIN CARTESIAN |     |1       |8           |
|4 |      ├─TABLE GET                      |T    |1       |5           |
|5 |      └─SUBPLAN SCAN                   |VIEW1|1       |3           |
|6 |        └─MERGE GROUP BY               |     |1       |3           |
|7 |          └─TABLE RANGE SCAN           |A    |1       |3           |
========================================================================
Outputs & filters:
-------------------------------------
  0 - output(nil), filter(nil)
  1 - output(nil), filter(nil)
  2 - output(nil), filter(nil)
      table_columns([{T: ({PRPTMAIN: (T.PROPOSALNO, T.SUMAMOUNT, T.SUMPREMIUM, T.SUMPREMIUMNOVAT, T.SUMVAT)}), hash_distinct}]),
      update([T.SUMAMOUNT=column_conv(DECIMAL_INT,PS:(14,2),NULL,cast(VIEW1.SUM(NVL(A.RATIONAMOUNT,1)), DECIMAL_INT(14, 2)))])
  3 - output([T.PROPOSALNO], [T.SUMAMOUNT], [T.SUMPREMIUM], [T.SUMPREMIUMNOVAT], [T.SUMVAT], [VIEW1.SUM(NVL(A.RATIONAMOUNT,1))]), filter(nil), rowset=16
      conds(nil), nl_params_(nil), use_batch=false
  4 - output([T.PROPOSALNO], [T.SUMAMOUNT], [T.SUMPREMIUM], [T.SUMPREMIUMNOVAT], [T.SUMVAT]), filter(nil), rowset=16
      access([T.PROPOSALNO], [T.SUMAMOUNT], [T.SUMPREMIUM], [T.SUMPREMIUMNOVAT], [T.SUMVAT]), partitions(p0)
      is_index_back=false, is_global_index=false, 
      range_key([T.PROPOSALNO]), range[a ; a], 
      range_cond([T.PROPOSALNO = cast('a', VARCHAR2(1048576 ))])
  5 - output([VIEW1.SUM(NVL(A.RATIONAMOUNT,1))]), filter(nil), rowset=16
      access([VIEW1.SUM(NVL(A.RATIONAMOUNT,1))])
  6 - output([T_FUN_SUM(NVL(cast(A.RATIONAMOUNT, NUMBER(-1, -1)), 1))]), filter(nil), rowset=16
      group(nil), agg_func([T_FUN_SUM(NVL(cast(A.RATIONAMOUNT, NUMBER(-1, -1)), 1))])
  7 - output([A.RATIONAMOUNT]), filter(nil), rowset=16
      access([A.RATIONAMOUNT]), partitions(p0)
      is_index_back=false, is_global_index=false, 
      range_key([A.PROPOSALNO], [A.MODECODE]), range(a,MIN ; a,MAX), 
      range_cond([A.PROPOSALNO = cast('a', VARCHAR2(1048576 ))])
UPDATE prptmain t
SET (t.sumamount) =
 (SELECT sum(nvl(a.rationamount, 1))
  FROM prptration a
  WHERE a.proposalno = t.proposalno
  GROUP BY a.proposalno)
WHERE t.proposalno = 'a';

EXPLAIN UPDATE prptmain t
SET (t.sumamount) =
 (SELECT /*+no_unnest*/ sum(nvl(a.rationamount, 1))
  FROM prptration a
  WHERE a.proposalno = t.proposalno
  GROUP BY a.proposalno)
WHERE t.proposalno = 'a';
Query Plan
==========================================================
|ID|OPERATOR                  |NAME|EST.ROWS|EST.TIME(us)|
----------------------------------------------------------
|0 |EXCHANGE IN REMOTE        |    |1       |43          |
|1 |└─EXCHANGE OUT REMOTE     |    |1       |42          |
|2 |  └─UPDATE                |    |1       |39          |
|3 |    └─SUBPLAN FILTER      |    |1       |8           |
|4 |      ├─TABLE GET         |T   |1       |5           |
|5 |      └─MERGE GROUP BY    |    |1       |3           |
|6 |        └─TABLE RANGE SCAN|A   |1       |3           |
==========================================================
Outputs & filters:
-------------------------------------
  0 - output(nil), filter(nil)
  1 - output(nil), filter(nil)
  2 - output(nil), filter(nil)
      table_columns([{T: ({PRPTMAIN: (T.PROPOSALNO, T.SUMAMOUNT, T.SUMPREMIUM, T.SUMPREMIUMNOVAT, T.SUMVAT)})}]),
      update([T.SUMAMOUNT=column_conv(DECIMAL_INT,PS:(14,2),NULL,cast(:0, DECIMAL_INT(14, 2)))])
  3 - output([T.PROPOSALNO], [T.SUMAMOUNT], [T.SUMPREMIUM], [T.SUMPREMIUMNOVAT], [T.SUMVAT], [:0]), filter(nil), rowset=16
      exec_params_(nil), onetime_exprs_([subquery(1)(:0)]), init_plan_idxs_(nil), use_batch=false
  4 - output([T.PROPOSALNO], [T.SUMAMOUNT], [T.SUMPREMIUM], [T.SUMPREMIUMNOVAT], [T.SUMVAT]), filter(nil), rowset=16
      access([T.PROPOSALNO], [T.SUMAMOUNT], [T.SUMPREMIUM], [T.SUMPREMIUMNOVAT], [T.SUMVAT]), partitions(p0)
      is_index_back=false, is_global_index=false, 
      range_key([T.PROPOSALNO]), range[a ; a], 
      range_cond([T.PROPOSALNO = cast('a', VARCHAR2(1048576 ))])
  5 - output([T_FUN_SUM(NVL(cast(A.RATIONAMOUNT, NUMBER(-1, -1)), 1))]), filter(nil), rowset=16
      group(nil), agg_func([T_FUN_SUM(NVL(cast(A.RATIONAMOUNT, NUMBER(-1, -1)), 1))])
  6 - output([A.RATIONAMOUNT]), filter(nil), rowset=16
      access([A.RATIONAMOUNT]), partitions(p0)
      is_index_back=false, is_global_index=false, 
      range_key([A.PROPOSALNO], [A.MODECODE]), range(a,MIN ; a,MAX), 
      range_cond([A.PROPOSALNO = cast('a', VARCHAR2(1048576 ))])
UPDATE prptmain t
SET (t.sumamount) =
 (SELECT /*+no_unnest*/ sum(nvl(a.rationamount, 1))
  FROM prptration a
  WHERE a.proposalno = t.proposalno
  GROUP BY a.proposalno)
WHERE t.proposalno = 'a';

EXPLAIN UPDATE prptplan t
SET (t.planFeeNoVat,
     t.delinquentFeeNoVat,
     t.planVat,
     t.delinquentVat) =
 (SELECT c.sumpremiumnovat,
         c.sumpremiumnovat,
         c.sumvat,
         c.sumvat
  FROM prpcmain c
  WHERE t.proposalno = c.proposalno)
WHERE t.proposalno = 'a';
Query Plan
=======================================================================
|ID|OPERATOR                               |NAME|EST.ROWS|EST.TIME(us)|
-----------------------------------------------------------------------
|0 |EXCHANGE IN REMOTE                     |    |1       |34          |
|1 |└─EXCHANGE OUT REMOTE                  |    |1       |34          |
|2 |  └─UPDATE                             |    |1       |34          |
|3 |    └─NESTED-LOOP OUTER JOIN CARTESIAN |    |1       |3           |
|4 |      ├─TABLE RANGE SCAN               |T   |1       |3           |
|5 |      └─MATERIAL                       |    |1       |5           |
|6 |        └─TABLE GET                    |C   |1       |5           |
=======================================================================
Outputs & filters:
-------------------------------------
  0 - output(nil), filter(nil)
  1 - output(nil), filter(nil)
  2 - output(nil), filter(nil)
      table_columns([{T: ({PRPTPLAN: (T.PROPOSALNO, T.RISKCODE, T.CURRENCY, T.PLANFEENOVAT, T.DELINQUENTFEENOVAT, T.PLANVAT, T.DELINQUENTVAT)})}]),
      update([T.PLANFEENOVAT=column_conv(DECIMAL_INT,PS:(20,8),NULL,CASE WHEN C.PROPOSALNO IS NOT NULL THEN C.SUMPREMIUMNOVAT ELSE cast(NULL, DECIMAL_INT(20,
       8)) END)], [T.DELINQUENTFEENOVAT=column_conv(DECIMAL_INT,PS:(20,8),NULL,CASE WHEN C.PROPOSALNO IS NOT NULL THEN C.SUMPREMIUMNOVAT ELSE cast(NULL, DECIMAL_INT(20,
       8)) END)], [T.PLANVAT=column_conv(DECIMAL_INT,PS:(20,8),NULL,CASE WHEN C.PROPOSALNO IS NOT NULL THEN C.SUMVAT ELSE cast(NULL, DECIMAL_INT(20, 8)) END)],
       [T.DELINQUENTVAT=column_conv(DECIMAL_INT,PS:(20,8),NULL,CASE WHEN C.PROPOSALNO IS NOT NULL THEN C.SUMVAT ELSE cast(NULL, DECIMAL_INT(20, 8)) END)])
  3 - output([T.PROPOSALNO], [T.RISKCODE], [T.CURRENCY], [T.PLANFEENOVAT], [T.DELINQUENTFEENOVAT], [T.PLANVAT], [T.DELINQUENTVAT], [C.PROPOSALNO], [C.SUMPREMIUMNOVAT],
       [C.SUMVAT]), filter(nil), rowset=16
      conds(nil), nl_params_(nil), use_batch=false
  4 - output([T.PROPOSALNO], [T.RISKCODE], [T.CURRENCY], [T.PLANFEENOVAT], [T.DELINQUENTFEENOVAT], [T.PLANVAT], [T.DELINQUENTVAT]), filter(nil), rowset=16
      access([T.PROPOSALNO], [T.RISKCODE], [T.CURRENCY], [T.PLANFEENOVAT], [T.DELINQUENTFEENOVAT], [T.PLANVAT], [T.DELINQUENTVAT]), partitions(p0)
      is_index_back=false, is_global_index=false, 
      range_key([T.PROPOSALNO], [T.RISKCODE], [T.CURRENCY]), range(a,MIN,MIN ; a,MAX,MAX), 
      range_cond([T.PROPOSALNO = cast('a', VARCHAR2(1048576 ))])
  5 - output([C.PROPOSALNO], [C.SUMPREMIUMNOVAT], [C.SUMVAT]), filter(nil), rowset=16
  6 - output([C.PROPOSALNO], [C.SUMPREMIUMNOVAT], [C.SUMVAT]), filter(nil), rowset=16
      access([C.PROPOSALNO], [C.SUMPREMIUMNOVAT], [C.SUMVAT]), partitions(p0)
      is_index_back=false, is_global_index=false, 
      range_key([C.PROPOSALNO]), range[a ; a], 
      range_cond([C.PROPOSALNO = cast('a', VARCHAR2(1048576 ))])
UPDATE prptplan t
SET (t.planFeeNoVat,
     t.delinquentFeeNoVat,
     t.planVat,
     t.delinquentVat) =
 (SELECT c.sumpremiumnovat,
         c.sumpremiumnovat,
         c.sumvat,
         c.sumvat
  FROM prpcmain c
  WHERE t.proposalno = c.proposalno)
WHERE t.proposalno = 'a';

EXPLAIN UPDATE prptplan t
SET (t.planFeeNoVat,
     t.delinquentFeeNoVat,
     t.planVat,
     t.delinquentVat) =
 (SELECT /*+no_unnest*/ c.sumpremiumnovat,
         c.sumpremiumnovat,
         c.sumvat,
         c.sumvat
  FROM prpcmain c
  WHERE t.proposalno = c.proposalno)
WHERE t.proposalno = 'a';
Query Plan
=============================================================
|ID|OPERATOR                     |NAME|EST.ROWS|EST.TIME(us)|
-------------------------------------------------------------
|0 |EXCHANGE IN REMOTE           |    |1       |54          |
|1 |└─EXCHANGE OUT REMOTE        |    |1       |53          |
|2 |  └─UPDATE                   |    |1       |50          |
|3 |    └─SUBPLAN FILTER         |    |1       |18          |
|4 |      ├─TABLE RANGE SCAN     |T   |1       |3           |
|5 |      └─DISTRIBUTED TABLE GET|C   |1       |16          |
=============================================================
Outputs & filters:
-------------------------------------
  0 - output(nil), filter(nil)
  1 - output(nil), filter(nil)
  2 - output(nil), filter(nil)
      table_columns([{T: ({PRPTPLAN: (T.PROPOSALNO, T.RISKCODE, T.CURRENCY, T.PLANFEENOVAT, T.DELINQUENTFEENOVAT, T.PLANVAT, T.DELINQUENTVAT)})}]),
      update([T.PLANFEENOVAT=column_conv(DECIMAL_INT,PS:(20,8),NULL,C.SUMPREMIUMNOVAT)], [T.DELINQUENTFEENOVAT=column_conv(DECIMAL_INT,PS:(20,8),NULL,C.SUMPREMIUMNOVAT)],
       [T.PLANVAT=column_conv(DECIMAL_INT,PS:(20,8),NULL,C.SUMVAT)], [T.DELINQUENTVAT=column_conv(DECIMAL_INT,PS:(20,8),NULL,C.SUMVAT)])
  3 - output([T.PROPOSALNO], [T.RISKCODE], [T.CURRENCY], [T.PLANFEENOVAT], [T.DELINQUENTFEENOVAT], [T.PLANVAT], [T.DELINQUENTVAT], [C.SUMPREMIUMNOVAT], 
      [C.SUMPREMIUMNOVAT], [C.SUMVAT], [C.SUMVAT]), filter(nil)
      exec_params_([T.PROPOSALNO(:0)]), onetime_exprs_(nil), init_plan_idxs_(nil), use_batch=true
  4 - output([T.PROPOSALNO], [T.RISKCODE], [T.CURRENCY], [T.PLANFEENOVAT], [T.DELINQUENTFEENOVAT], [T.PLANVAT], [T.DELINQUENTVAT]), filter(nil)
      access([T.PROPOSALNO], [T.RISKCODE], [T.CURRENCY], [T.PLANFEENOVAT], [T.DELINQUENTFEENOVAT], [T.PLANVAT], [T.DELINQUENTVAT]), partitions(p0)
      is_index_back=false, is_global_index=false, 
      range_key([T.PROPOSALNO], [T.RISKCODE], [T.CURRENCY]), range(a,MIN,MIN ; a,MAX,MAX), 
      range_cond([T.PROPOSALNO = cast('a', VARCHAR2(1048576 ))])
  5 - output([C.SUMPREMIUMNOVAT], [C.SUMPREMIUMNOVAT], [C.SUMVAT], [C.SUMVAT]), filter(nil)
      access([GROUP_ID], [C.SUMPREMIUMNOVAT], [C.SUMVAT]), partitions(p0)
      is_index_back=false, is_global_index=false, 
      range_key([C.PROPOSALNO]), range(MIN ; MAX)always true, 
      range_cond([:0 = C.PROPOSALNO])
UPDATE prptplan t
SET (t.planFeeNoVat,
     t.delinquentFeeNoVat,
     t.planVat,
     t.delinquentVat) =
 (SELECT /*+no_unnest*/ c.sumpremiumnovat,
         c.sumpremiumnovat,
         c.sumvat,
         c.sumvat
  FROM prpcmain c
  WHERE t.proposalno = c.proposalno)
WHERE t.proposalno = 'a';

drop table prpCmain;
drop table PrpTmain;
drop table PrpTration;
drop table PrpTplan;

##bug:
drop table test1;
drop table test2;
drop table test3;

CREATE TABLE test1 (
col_int int,
col_nchar_2 nchar(2),
col_int_not_null int not null,
col_number_5_2 number(5,2),
pk int,
col_number_5_2_not_null number(5,2) not null,
col_varchar2_2 varchar2(2),
col_varchar2_2_not_null varchar2(2) not null,
col_nchar_2_not_null nchar(2) not null,
/*Indices*/
primary key (pk) );

CREATE TABLE test2 (
col_nchar_2_not_null nchar(2) not null,
col_number_5_2_not_null number(5,2) not null,
col_int int,
col_varchar2_2 varchar2(2),
pk int,
col_varchar2_2_not_null varchar2(2) not null,
col_number_5_2 number(5,2),
col_int_not_null int not null,
col_nchar_2 nchar(2),
/*Indices*/
primary key (pk) ) PARTITION BY hash(pk) partitions 3;

CREATE TABLE test3 (
col_int_not_null int not null,
col_nchar_2_not_null nchar(2) not null,
col_nchar_2 nchar(2),
col_varchar2_2_not_null varchar2(2) not null,
pk int,
col_int int,
col_number_5_2 number(5,2),
col_varchar2_2 varchar2(2),
col_number_5_2_not_null number(5,2) not null,
/*Indices*/
primary key (pk) );

EXPLAIN SELECT COUNT( t3.col_nchar_2_not_null), COUNT( t1.col_nchar_2), t1.col_int, CONCAT(t1.col_nchar_2_not_null,t3.col_varchar2_2),
  (SELECT COUNT( tt2.col_number_5_2)
    FROM test3 tt1 INNER JOIN test2 tt2 ON tt2.col_int < tt1.col_int
    WHERE tt1.col_int <= t1.col_int AND tt2.col_number_5_2_not_null < t1.col_int) AS SELECT_SUBQUERY_ALIAS
FROM test1 t1 INNER JOIN (test2 t2 INNER JOIN test3 t3 ON t3.col_number_5_2 != t2.col_int ) ON t3.col_nchar_2_not_null = t2.col_varchar2_2
WHERE ( t2.col_int = 92)
GROUP BY t1.col_int, CONCAT(t1.col_nchar_2_not_null,t3.col_varchar2_2);
Query Plan
===========================================================================
|ID|OPERATOR                               |NAME    |EST.ROWS|EST.TIME(us)|
---------------------------------------------------------------------------
|0 |HASH GROUP BY                          |        |2       |8           |
|1 |└─NESTED-LOOP OUTER JOIN               |        |2       |7           |
|2 |  ├─SUBPLAN SCAN                       |VIEW1   |2       |7           |
|3 |  │ └─HASH GROUP BY                    |        |2       |7           |
|4 |  │   └─NESTED-LOOP JOIN CARTESIAN     |        |2       |6           |
|5 |  │     ├─PX COORDINATOR               |        |2       |6           |
|6 |  │     │ └─EXCHANGE OUT DISTR         |:EX10000|2       |5           |
|7 |  │     │   └─TABLE FULL SCAN          |T1      |2       |3           |
|8 |  │     └─MATERIAL                     |        |1       |14          |
|9 |  │       └─HASH JOIN                  |        |1       |14          |
|10|  │         ├─PX COORDINATOR           |        |1       |8           |
|11|  │         │ └─EXCHANGE OUT DISTR     |:EX20000|1       |8           |
|12|  │         │   └─PX PARTITION ITERATOR|        |1       |7           |
|13|  │         │     └─TABLE FULL SCAN    |T2      |1       |7           |
|14|  │         └─PX COORDINATOR           |        |2       |5           |
|15|  │           └─EXCHANGE OUT DISTR     |:EX30000|2       |4           |
|16|  │             └─TABLE FULL SCAN      |T3      |2       |3           |
|17|  └─MATERIAL                           |        |2       |11          |
|18|    └─NESTED-LOOP JOIN                 |        |2       |11          |
|19|      ├─PX COORDINATOR                 |        |2       |11          |
|20|      │ └─EXCHANGE OUT DISTR           |:EX40000|2       |9           |
|21|      │   └─PX PARTITION ITERATOR      |        |2       |7           |
|22|      │     └─TABLE FULL SCAN          |TT2     |2       |7           |
|23|      └─MATERIAL                       |        |2       |5           |
|24|        └─PX COORDINATOR               |        |2       |5           |
|25|          └─EXCHANGE OUT DISTR         |:EX50000|2       |4           |
|26|            └─TABLE FULL SCAN          |TT1     |2       |3           |
===========================================================================
Outputs & filters:
-------------------------------------
  0 - output([VIEW1.T_FUN_COUNT(T3.COL_NCHAR_2_NOT_NULL)], [VIEW1.T_FUN_COUNT(T1.COL_NCHAR_2)], [VIEW1.T1.COL_INT], [VIEW1.SEL_4], [T_FUN_COUNT(TT2.COL_NUMBER_5_2)]), filter(nil), rowset=16
      group([VIEW1.T1.COL_INT], [VIEW1.SEL_4]), agg_func([T_FUN_COUNT(TT2.COL_NUMBER_5_2)])
  1 - output([VIEW1.T1.COL_INT], [VIEW1.SEL_4], [VIEW1.T_FUN_COUNT(T3.COL_NCHAR_2_NOT_NULL)], [VIEW1.T_FUN_COUNT(T1.COL_NCHAR_2)], [TT2.COL_NUMBER_5_2]), filter(nil), rowset=16
      conds([TT1.COL_INT <= VIEW1.T1.COL_INT], [cast(TT2.COL_NUMBER_5_2_NOT_NULL, NUMBER(-1, 0)) < VIEW1.T1.COL_INT]), nl_params_(nil), use_batch=false
  2 - output([VIEW1.T_FUN_COUNT(T3.COL_NCHAR_2_NOT_NULL)], [VIEW1.T_FUN_COUNT(T1.COL_NCHAR_2)], [VIEW1.T1.COL_INT], [VIEW1.SEL_4]), filter(nil), rowset=16
      access([VIEW1.T_FUN_COUNT(T3.COL_NCHAR_2_NOT_NULL)], [VIEW1.T_FUN_COUNT(T1.COL_NCHAR_2)], [VIEW1.T1.COL_INT], [VIEW1.SEL_4])
  3 - output([T_FUN_COUNT(T3.COL_NCHAR_2_NOT_NULL)], [T_FUN_COUNT(T1.COL_NCHAR_2)], [T1.COL_INT], [CONCAT(cast(T1.COL_NCHAR_2_NOT_NULL, NVARCHAR2(2 )), 
      cast(T3.COL_VARCHAR2_2, NVARCHAR2(5 )))]), filter(nil), rowset=16
      group([T1.COL_INT], [CONCAT(cast(T1.COL_NCHAR_2_NOT_NULL, NVARCHAR2(2 )), cast(T3.COL_VARCHAR2_2, NVARCHAR2(5 )))]), agg_func([T_FUN_COUNT(T3.COL_NCHAR_2_NOT_NULL)],
       [T_FUN_COUNT(T1.COL_NCHAR_2)])
  4 - output([T1.COL_INT], [T1.COL_NCHAR_2_NOT_NULL], [T1.COL_NCHAR_2], [T3.COL_NCHAR_2_NOT_NULL], [T3.COL_VARCHAR2_2]), filter(nil), rowset=16
      conds(nil), nl_params_(nil), use_batch=false
  5 - output([T1.COL_INT], [T1.COL_NCHAR_2_NOT_NULL], [T1.COL_NCHAR_2]), filter(nil), rowset=16
  6 - output([T1.COL_INT], [T1.COL_NCHAR_2_NOT_NULL], [T1.COL_NCHAR_2]), filter(nil), rowset=16
      is_single, dop=1
  7 - output([T1.COL_INT], [T1.COL_NCHAR_2_NOT_NULL], [T1.COL_NCHAR_2]), filter(nil), rowset=16
      access([T1.COL_INT], [T1.COL_NCHAR_2_NOT_NULL], [T1.COL_NCHAR_2]), partitions(p0)
      is_index_back=false, is_global_index=false, 
      range_key([T1.PK]), range(MIN ; MAX)always true
  8 - output([T3.COL_NCHAR_2_NOT_NULL], [T3.COL_VARCHAR2_2]), filter(nil), rowset=16
  9 - output([T3.COL_NCHAR_2_NOT_NULL], [T3.COL_VARCHAR2_2]), filter(nil), rowset=16
      equal_conds([cast(T3.COL_NCHAR_2_NOT_NULL, NVARCHAR2(1048576 )) = to_nchar(cast(T2.COL_VARCHAR2_2, NVARCHAR2(1048576 )))]), other_conds(nil)
 10 - output([T2.COL_VARCHAR2_2]), filter(nil), rowset=16
 11 - output([T2.COL_VARCHAR2_2]), filter(nil), rowset=16
      dop=1
 12 - output([T2.COL_VARCHAR2_2]), filter(nil), rowset=16
      force partition granule
 13 - output([T2.COL_VARCHAR2_2]), filter([T2.COL_INT = 92]), rowset=16
      access([T2.COL_INT], [T2.COL_VARCHAR2_2]), partitions(p[0-2])
      is_index_back=false, is_global_index=false, filter_before_indexback[false], 
      range_key([T2.PK]), range(MIN ; MAX)always true
 14 - output([T3.COL_NCHAR_2_NOT_NULL], [T3.COL_VARCHAR2_2]), filter(nil), rowset=16
 15 - output([T3.COL_NCHAR_2_NOT_NULL], [T3.COL_VARCHAR2_2]), filter(nil), rowset=16
      is_single, dop=1
 16 - output([T3.COL_NCHAR_2_NOT_NULL], [T3.COL_VARCHAR2_2]), filter([cast(T3.COL_NUMBER_5_2, NUMBER(-1, 0)) != 92]), rowset=16
      access([T3.COL_NUMBER_5_2], [T3.COL_NCHAR_2_NOT_NULL], [T3.COL_VARCHAR2_2]), partitions(p0)
      is_index_back=false, is_global_index=false, filter_before_indexback[false], 
      range_key([T3.PK]), range(MIN ; MAX)always true
 17 - output([TT1.COL_INT], [TT2.COL_NUMBER_5_2_NOT_NULL], [TT2.COL_NUMBER_5_2]), filter(nil), rowset=16
 18 - output([TT1.COL_INT], [TT2.COL_NUMBER_5_2_NOT_NULL], [TT2.COL_NUMBER_5_2]), filter(nil), rowset=16
      conds([TT2.COL_INT < TT1.COL_INT]), nl_params_(nil), use_batch=false
 19 - output([TT2.COL_INT], [TT2.COL_NUMBER_5_2_NOT_NULL], [TT2.COL_NUMBER_5_2]), filter(nil), rowset=16
 20 - output([TT2.COL_INT], [TT2.COL_NUMBER_5_2_NOT_NULL], [TT2.COL_NUMBER_5_2]), filter(nil), rowset=16
      dop=1
 21 - output([TT2.COL_INT], [TT2.COL_NUMBER_5_2_NOT_NULL], [TT2.COL_NUMBER_5_2]), filter(nil), rowset=16
      force partition granule
 22 - output([TT2.COL_INT], [TT2.COL_NUMBER_5_2_NOT_NULL], [TT2.COL_NUMBER_5_2]), filter(nil), rowset=16
      access([TT2.COL_INT], [TT2.COL_NUMBER_5_2_NOT_NULL], [TT2.COL_NUMBER_5_2]), partitions(p[0-2])
      is_index_back=false, is_global_index=false, 
      range_key([TT2.PK]), range(MIN ; MAX)always true
 23 - output([TT1.COL_INT]), filter(nil), rowset=16
 24 - output([TT1.COL_INT]), filter(nil), rowset=16
 25 - output([TT1.COL_INT]), filter(nil), rowset=16
      is_single, dop=1
 26 - output([TT1.COL_INT]), filter(nil), rowset=16
      access([TT1.COL_INT]), partitions(p0)
      is_index_back=false, is_global_index=false, 
      range_key([TT1.PK]), range(MIN ; MAX)always true
SELECT COUNT( t3.col_nchar_2_not_null), COUNT( t1.col_nchar_2), t1.col_int, CONCAT(t1.col_nchar_2_not_null,t3.col_varchar2_2),
  (SELECT COUNT( tt2.col_number_5_2)
    FROM test3 tt1 INNER JOIN test2 tt2 ON tt2.col_int < tt1.col_int
    WHERE tt1.col_int <= t1.col_int AND tt2.col_number_5_2_not_null < t1.col_int) AS SELECT_SUBQUERY_ALIAS
FROM test1 t1 INNER JOIN (test2 t2 INNER JOIN test3 t3 ON t3.col_number_5_2 != t2.col_int ) ON t3.col_nchar_2_not_null = t2.col_varchar2_2
WHERE ( t2.col_int = 92)
GROUP BY t1.col_int, CONCAT(t1.col_nchar_2_not_null,t3.col_varchar2_2);
+--------------------------------+-----------------------+---------+---------------------------------------------------+-----------------------+
| COUNT(T3.COL_NCHAR_2_NOT_NULL) | COUNT(T1.COL_NCHAR_2) | COL_INT | CONCAT(T1.COL_NCHAR_2_NOT_NULL,T3.COL_VARCHAR2_2) | SELECT_SUBQUERY_ALIAS |
+--------------------------------+-----------------------+---------+---------------------------------------------------+-----------------------+
+--------------------------------+-----------------------+---------+---------------------------------------------------+-----------------------+

## bug:35739653
DROP TABLE t1;
DROP TABLE t4;
DROP TABLE t7;
DROP TABLE t8;

CREATE TABLE t1 (
pk int,
col_int int,
col_number number,
col_char_20 char(20),
col_varchar_20 varchar(20),
col_number_not_null number not null,
col_varchar_20_not_null varchar(20) not null,
col_int_not_null int not null,
col_char_20_not_null char(20) not null,
/*Indices*/
primary key (pk) ) ;
EXPLAIN INSERT INTO t1 VALUES  (1, 9, -1234239488, 'xtfiiiridobjdrkxjvt', 'qxtfiiiridobj', 1192493056, 'sqxtfii', 2, 'us') ,  (2, -918749184, 333250560, 'pu', 'wpusqxtf', 0, 'xwpusqxtf', 4, 'gxwpusqx') ,  (3, 9306112, -930480128, 'mgxwpusqx', 'fmgxwpusqxtf', -154402816, 'j', 1497497600, 'rjf') ,  (4, 310444032, 874577920, 'jrjfm', 'kjrjf', 1590362112, 'kkjr', 9, 'ukkjrjfm') ,  (5, 226557952, 2121400320, 'xukkjr', 'rx', -2028666880, 'grxukkjrj', 681902080, 'wgrxukkjrjfmgx') ,  (6, 1253769216, 4, 'bwgrxukkjrjfmgxwp', 'xbwg', 21626880, 'bxbw', 822673408, 'r') ,  (7, 1076559872, -897712128, 'trbxbwgr', 'ntrbxbwgrxukkjr', 8, 'x', 7, 'uxntrb') ,  (8, 1036058624, -1428291584, 'kuxntrbxbwgrxukkjrjf', 'v', -2068185088, 'svkuxnt', 8, 'rsvku') ,  (9, -1648033792, -723976192, 'rrsv', 'irrsvkuxnt', -2106916864, 'mirrsvkuxntr', -1578172416, 'rm') ,  (10, 5, 1402208256, 'hr', 'ahrmi', 571867136, 'f', -1251868672, 'd') ;
Query Plan
==================================================
|ID|OPERATOR          |NAME|EST.ROWS|EST.TIME(us)|
--------------------------------------------------
|0 |DISTRIBUTED INSERT|    |10      |70          |
|1 |└─EXPRESSION      |    |10      |1           |
==================================================
Outputs & filters:
-------------------------------------
  0 - output(nil), filter(nil)
      columns([{T1: ({T1: (T1.PK, T1.COL_INT, T1.COL_NUMBER, T1.COL_CHAR_20, T1.COL_VARCHAR_20, T1.COL_NUMBER_NOT_NULL, T1.COL_VARCHAR_20_NOT_NULL, T1.COL_INT_NOT_NULL,
       T1.COL_CHAR_20_NOT_NULL)})}]), 
      column_values([column_conv(NUMBER,PS:(-1,0),NOT NULL,__values.PK)], [column_conv(NUMBER,PS:(-1,0),NULL,__values.COL_INT)], [column_conv(NUMBER,PS:(-1,
      -85),NULL,__values.COL_NUMBER)], [column_conv(CHAR,utf8mb4_bin,length:20,NULL,__values.COL_CHAR_20)], [column_conv(VARCHAR2,utf8mb4_bin,length:20,NULL,__values.COL_VARCHAR_20)],
       [column_conv(NUMBER,PS:(-1,-85),NOT NULL,__values.COL_NUMBER_NOT_NULL)], [column_conv(VARCHAR2,utf8mb4_bin,length:20,NOT NULL,__values.COL_VARCHAR_20_NOT_NULL)],
       [column_conv(NUMBER,PS:(-1,0),NOT NULL,__values.COL_INT_NOT_NULL)], [column_conv(CHAR,utf8mb4_bin,length:20,NOT NULL,__values.COL_CHAR_20_NOT_NULL)])
  1 - output([__values.PK], [__values.COL_INT], [__values.COL_NUMBER], [__values.COL_CHAR_20], [__values.COL_VARCHAR_20], [__values.COL_NUMBER_NOT_NULL],
       [__values.COL_VARCHAR_20_NOT_NULL], [__values.COL_INT_NOT_NULL], [__values.COL_CHAR_20_NOT_NULL]), filter(nil)
      values({1, 9, -1234239488, 'xtfiiiridobjdrkxjvt', 'qxtfiiiridobj', 1192493056, 'sqxtfii', 2, 'us'}, {2, -918749184, 333250560, 'pu', 'wpusqxtf', 0,
       'xwpusqxtf', 4, 'gxwpusqx'}, {3, 9306112, -930480128, 'mgxwpusqx', 'fmgxwpusqxtf', -154402816, 'j', 1497497600, 'rjf'}, {4, 310444032, 874577920, 'jrjfm',
       'kjrjf', 1590362112, 'kkjr', 9, 'ukkjrjfm'}, {5, 226557952, 2121400320, 'xukkjr', 'rx', -2028666880, 'grxukkjrj', 681902080, 'wgrxukkjrjfmgx'}, {6, 1253769216,
       4, 'bwgrxukkjrjfmgxwp', 'xbwg', 21626880, 'bxbw', 822673408, 'r'}, {7, 1076559872, -897712128, 'trbxbwgr', 'ntrbxbwgrxukkjr', 8, 'x', 7, 'uxntrb'}, {8,
       1036058624, -1428291584, 'kuxntrbxbwgrxukkjrjf', 'v', -2068185088, 'svkuxnt', 8, 'rsvku'}, {9, -1648033792, -723976192, 'rrsv', 'irrsvkuxnt', -2106916864,
       'mirrsvkuxntr', -1578172416, 'rm'}, {10, 5, 1402208256, 'hr', 'ahrmi', 571867136, 'f', -1251868672, 'd'})
INSERT INTO t1 VALUES  (1, 9, -1234239488, 'xtfiiiridobjdrkxjvt', 'qxtfiiiridobj', 1192493056, 'sqxtfii', 2, 'us') ,  (2, -918749184, 333250560, 'pu', 'wpusqxtf', 0, 'xwpusqxtf', 4, 'gxwpusqx') ,  (3, 9306112, -930480128, 'mgxwpusqx', 'fmgxwpusqxtf', -154402816, 'j', 1497497600, 'rjf') ,  (4, 310444032, 874577920, 'jrjfm', 'kjrjf', 1590362112, 'kkjr', 9, 'ukkjrjfm') ,  (5, 226557952, 2121400320, 'xukkjr', 'rx', -2028666880, 'grxukkjrj', 681902080, 'wgrxukkjrjfmgx') ,  (6, 1253769216, 4, 'bwgrxukkjrjfmgxwp', 'xbwg', 21626880, 'bxbw', 822673408, 'r') ,  (7, 1076559872, -897712128, 'trbxbwgr', 'ntrbxbwgrxukkjr', 8, 'x', 7, 'uxntrb') ,  (8, 1036058624, -1428291584, 'kuxntrbxbwgrxukkjrjf', 'v', -2068185088, 'svkuxnt', 8, 'rsvku') ,  (9, -1648033792, -723976192, 'rrsv', 'irrsvkuxnt', -2106916864, 'mirrsvkuxntr', -1578172416, 'rm') ,  (10, 5, 1402208256, 'hr', 'ahrmi', 571867136, 'f', -1251868672, 'd') ;

CREATE TABLE t4 (
col_int_not_null int not null,
col_varchar_20 varchar(20),
col_number_not_null number not null,
col_number number,
col_int int,
col_varchar_20_not_null varchar(20) not null,
col_char_20_not_null char(20) not null,
col_char_20 char(20),
pk int,
/*Indices*/
primary key (pk) ) ;
EXPLAIN INSERT INTO t4 VALUES  (-734855168, 'hrwdbe', 1417740288, -182845440, 377028608, 'ghrwdb', 'zghrwdberoiwovwnnwri', 'jzghrwdbe', 1) ,  (-1298137088, 'ljzghrwdberoi', -1062600704, 1, -1810497536, 'rljzghr', 'hrljzg', 'thr', 2) ,  (-1358888960, 'othrlj', -256180224, 1046347776, 1905721344, 'h', 'yhothrl', 'nyhothrljzghrwdbe', 3) ,  (-1376649216, 'hn', 1800536064, 1234108416, -704184320, 'qhny', 'eqhnyhothrljzghr', 'ueqhnyho', 4) ,  (-769261568, 'kueqhnyhothrljz', -406519808, 3, -1176633344, 'pku', 'wpkueqhny', 'nwpkueqhnyho', 5) ,  (9, 'nnwpk', 1, -1571094528, 672137216, 'qnnwpkueqhnyho', 'jqn', 'djqnnw', 6) ,  (0, 'hdjqnnwpkueq', -697630720, 7, 0, 'ohdjqnnwpk', 'xohdjqnn', 'x', 7) ,  (-873988096, 'kxxohdjqnnwpkueqh', 396951552, -833028096, 8, 'ekxxohdjq', 'uekxxohdjqnnwpkueqh', 'zuekxxohdjqnnw', 8) ,  (1985740800, 'kzu', 6, 132382720, -1284243456, 'pkz', 'ypkzue', 'dy', 9) ,  (3, 'ydypkzu', -662700032, 1, 1279393792, 'yy', 'vyy', 'vvyydy', 10) ,  (1596063744, 'jvvyydypkzuek', 8, -1835794432, 312410112, 'cjvvyydy', 'u', 'sucjvvyy', 11) ,  (242483200, 'gsucj', -1361444864, -450887680, 3, 'n', 'ingsucjvvyydypk', 'ii', 12) ,  (1018560512, 'kiings', 248709120, -1179058176, 3, 'lkiingsucj', 'blkiingsucjvvy', 'mb', 13) ,  (2031484928, 'rmblkii', -1688469504, 1677918208, -505348096, 'kr', 'ek', 'hekrmblkiings', 14) ,  (1567621120, 'shekrm', 6, 1279852544, -824639488, 'fshek', 'ffs', 'qffshekrm', 15) ,  (1177288704, 'mqffshek', -640286720, 1126301696, 2130968576, 'vmqffshek', 'nvmqffshek', 'on', 16) ,  (-17891328, 'yonv', -1248002048, 1886715904, 5, 'dyonv', 'hdyonvmqffshekrmblk', 'lhdyonvmqffshekrmb', 17) ,  (7, 'jl', -821690368, -1922957312, 1058209792, 'wjl', 'qwjlhdy', 'uq', 18) ,  (8, 'tu', 1, -153550848, -926810112, 'stuqwjl', 'estuqwjl', 'j', 19) ,  (1395458048, 'zjes', 2, 1399652352, -166723584, 'iz', 'kizjestuqwjlh', 'yki', 20) ,  (-98304000, 'rykizjest', 1007157248, 1, 1, 'yry', 'hyrykizjestuqwjl', 'ehyrykizje', 21) ,  (-1376976896, 'pe', 1104019456, 1, -160235520, 'upehyrykizjestuqwj', 'oupe', 'roupehyrykizjest', 22) ,  (5, 'sroupehyrykiz', 619184128, 3, 2, 'usroupeh', 'busroup', 'pbusroup', 23) ,  (-656146432, 'dpbusrou', 625278976, 1466892288, 2078015488, 'sdpbusroupehyrykizje', 'hs', 'uhsdp', 24) ,  (-97189888, 's', 463863808, 6, -409468928, 'xsuh', 'pxsuhsdpb', 'gp', 25) ,  (-1950875648, 'bgpxsuhsdpbusrou', -1192493056, 4, 1840513024, 'xbgpxsuhsdp', 'jxbgpxsuhsdpbus', 'njxbgpxsuh', 26) ,  (1951268864, 'xnjxbgpxsuhsdpbusro', 6, -2143551488, 2026766336, 'uxnjx', 'uuxnjxbgpxs', 'suuxnj', 27) ,  (-337379328, 'fsuuxnjxb', 8, 5, 7, 'xfsuuxnjxbgpxs', 'c', 'ncxfsuuxn', 28) ,  (3, 'cncxfsuux', 1293811712, -2065956864, 425263104, 'scncxf', 'ls', 'qlsc', 29) ,  (1189085184, 'aqlscncxf', 1846345728, 1, 668073984, 'gaql', 'xgaqlscnc', 'bx', 30) ,  (-307560448, 'nbxgaqlscnc', -868155392, 7, 305922048, 'rnbx', 'lrnbxgaq', 'yl', 31) ,  (329777152, 'uylrnb', -926810112, -1213857792, 1563754496, 'ruylrnbxgaql', 'jruylrnbx', 'qjruylr', 32) ,  (714801152, 'iqjruylrnbxgaqlscn', 1692336128, -1735852032, 0, 'miqjruylrnbxg', 'xmiqjruylr', 'gxmiqjruylrnbxgaq', 33) ,  (-2000814080, 'fgxmiqjr', 162004992, 2, 989528064, 'nfgxmiqjr', 'fnfgxmiqjruylrnbxgaq', 'jfnfgxm', 34) ,  (1, 'xjfnf', 1190002688, 7, 2, 'yxjfnfgx', 'hyxjfnfgxmiqjruylr', 'rhyxjfnfgxmiqjr', 35) ,  (-1097924608, 'irhyx', -964362240, 2016215040, 0, 'girhyx', 'igi', 'migirhyx', 36) ,  (7, 'sm', 4, -459341824, 8, 'fsmigirhyxjfnfgx', 'dfsmi', 'wdfs', 37) ,  (5, 'rwdfsmi', 1, 2, 5, 'wrwd', 'nw', 'pnw', 38) ,  (-1464729600, 'bpnwrwdfsm', 1459683328, -431751168, 344588288, 'dbpnwrwdfsmigi', 'mdbpnwrwdfsmigi', 'fmdbpnwrw', 39) ,  (-1485570048, 'afmdbpnwrwdfsm', 608567296, 1, 0, 'qafmdbpnwrwdfsmi', 'zqafmdbpnwrwdfsmigi', 'wzqafmdbpn', 40) ,  (1445068800, 'qwz', 6, -1901068288, 1673854976, 'mqw', 'tmqwzqafm', 'utmqwzq', 41) ,  (3, 'outmq', 0, 9, -514392064, 'oo', 'hooutmqwz', 'thooutmq', 42) ,  (4, 'xthooutmqwzqafmdb', 2062483456, 1, -495517696, 'dxthooutmqwzqafmdbp', 'xdxthooutmqw', 'ex', 43) ,  (-1437073408, 'rexdxthooutmqwzqaf', -1373437952, -1827012608, 8, 'rrexdxthooutmqw', 'wr', 'dwrrexdx', 44) ,  (9, 'adwrrexdx', 2, 186253312, -461307904, 'h', 'xhadwrr', 'jxhadwrrex', 45) ,  (-1982595072, 'rjxhadwrrexdxthoo', 5, 2115698688, -528220160, 'nrjxhadwrrexd', 'enrjxhadwrrexdxth', 'denrjx', 46) ,  (-309395456, 'zdenrjxhadwr', 4, 9502720, -1868496896, 'mzdenrjx', 'wmzde', 'awmzdenrj', 47) ,  (-1100677120, 'ra', 726466560, -798425088, 149815296, 'qrawmz', 'uqrawmz', 'yuqrawmz', 48) ,  (1290141696, 'jyuqraw', 490274816, -1325596672, -384237568, 'wjyuqrawm', 'ywjyuqrawmzdenrjxhad', 'kywjyu', 49) ,  (-813432832, 'nky', 5, 874381312, 5, 'znk', 'rznkywjyuq', 'krznkywjyu', 50) ;
Query Plan
==================================================
|ID|OPERATOR          |NAME|EST.ROWS|EST.TIME(us)|
--------------------------------------------------
|0 |DISTRIBUTED INSERT|    |50      |324         |
|1 |└─EXPRESSION      |    |50      |1           |
==================================================
Outputs & filters:
-------------------------------------
  0 - output(nil), filter(nil)
      columns([{T4: ({T4: (T4.PK, T4.COL_INT_NOT_NULL, T4.COL_VARCHAR_20, T4.COL_NUMBER_NOT_NULL, T4.COL_NUMBER, T4.COL_INT, T4.COL_VARCHAR_20_NOT_NULL,
       T4.COL_CHAR_20_NOT_NULL, T4.COL_CHAR_20)})}]), 
      column_values([column_conv(NUMBER,PS:(-1,0),NOT NULL,__values.PK)], [column_conv(NUMBER,PS:(-1,0),NOT NULL,__values.COL_INT_NOT_NULL)], [column_conv(VARCHAR2,
      utf8mb4_bin,length:20,NULL,__values.COL_VARCHAR_20)], [column_conv(NUMBER,PS:(-1,-85),NOT NULL,__values.COL_NUMBER_NOT_NULL)], [column_conv(NUMBER,PS:(-1,
      -85),NULL,__values.COL_NUMBER)], [column_conv(NUMBER,PS:(-1,0),NULL,__values.COL_INT)], [column_conv(VARCHAR2,utf8mb4_bin,length:20,NOT NULL,__values.COL_VARCHAR_20_NOT_NULL)],
       [column_conv(CHAR,utf8mb4_bin,length:20,NOT NULL,__values.COL_CHAR_20_NOT_NULL)], [column_conv(CHAR,utf8mb4_bin,length:20,NULL,__values.COL_CHAR_20)])
  1 - output([__values.COL_INT_NOT_NULL], [__values.COL_VARCHAR_20], [__values.COL_NUMBER_NOT_NULL], [__values.COL_NUMBER], [__values.COL_INT], [__values.COL_VARCHAR_20_NOT_NULL],
       [__values.COL_CHAR_20_NOT_NULL], [__values.COL_CHAR_20], [__values.PK]), filter(nil)
      values({-734855168, 'hrwdbe', 1417740288, -182845440, 377028608, 'ghrwdb', 'zghrwdberoiwovwnnwri', 'jzghrwdbe', 1}, {-1298137088, 'ljzghrwdberoi',
       -1062600704, 1, -1810497536, 'rljzghr', 'hrljzg', 'thr', 2}, {-1358888960, 'othrlj', -256180224, 1046347776, 1905721344, 'h', 'yhothrl', 'nyhothrljzghrwdbe',
       3}, {-1376649216, 'hn', 1800536064, 1234108416, -704184320, 'qhny', 'eqhnyhothrljzghr', 'ueqhnyho', 4}, {-769261568, 'kueqhnyhothrljz', -406519808, 3, 
      -1176633344, 'pku', 'wpkueqhny', 'nwpkueqhnyho', 5}, {9, 'nnwpk', 1, -1571094528, 672137216, 'qnnwpkueqhnyho', 'jqn', 'djqnnw', 6}, {0, 'hdjqnnwpkueq', 
      -697630720, 7, 0, 'ohdjqnnwpk', 'xohdjqnn', 'x', 7}, {-873988096, 'kxxohdjqnnwpkueqh', 396951552, -833028096, 8, 'ekxxohdjq', 'uekxxohdjqnnwpkueqh', 'zuekxxohdjqnnw',
       8}, {1985740800, 'kzu', 6, 132382720, -1284243456, 'pkz', 'ypkzue', 'dy', 9}, {3, 'ydypkzu', -662700032, 1, 1279393792, 'yy', 'vyy', 'vvyydy', 10}, {1596063744,
       'jvvyydypkzuek', 8, -1835794432, 312410112, 'cjvvyydy', 'u', 'sucjvvyy', 11}, {242483200, 'gsucj', -1361444864, -450887680, 3, 'n', 'ingsucjvvyydypk', 
      'ii', 12}, {1018560512, 'kiings', 248709120, -1179058176, 3, 'lkiingsucj', 'blkiingsucjvvy', 'mb', 13}, {2031484928, 'rmblkii', -1688469504, 1677918208,
       -505348096, 'kr', 'ek', 'hekrmblkiings', 14}, {1567621120, 'shekrm', 6, 1279852544, -824639488, 'fshek', 'ffs', 'qffshekrm', 15}, {1177288704, 'mqffshek',
       -640286720, 1126301696, 2130968576, 'vmqffshek', 'nvmqffshek', 'on', 16}, {-17891328, 'yonv', -1248002048, 1886715904, 5, 'dyonv', 'hdyonvmqffshekrmblk',
       'lhdyonvmqffshekrmb', 17}, {7, 'jl', -821690368, -1922957312, 1058209792, 'wjl', 'qwjlhdy', 'uq', 18}, {8, 'tu', 1, -153550848, -926810112, 'stuqwjl', 
      'estuqwjl', 'j', 19}, {1395458048, 'zjes', 2, 1399652352, -166723584, 'iz', 'kizjestuqwjlh', 'yki', 20}, {-98304000, 'rykizjest', 1007157248, 1, 1, 'yry',
       'hyrykizjestuqwjl', 'ehyrykizje', 21}, {-1376976896, 'pe', 1104019456, 1, -160235520, 'upehyrykizjestuqwj', 'oupe', 'roupehyrykizjest', 22}, {5, 'sroupehyrykiz',
       619184128, 3, 2, 'usroupeh', 'busroup', 'pbusroup', 23}, {-656146432, 'dpbusrou', 625278976, 1466892288, 2078015488, 'sdpbusroupehyrykizje', 'hs', 'uhsdp',
       24}, {-97189888, 's', 463863808, 6, -409468928, 'xsuh', 'pxsuhsdpb', 'gp', 25}, {-1950875648, 'bgpxsuhsdpbusrou', -1192493056, 4, 1840513024, 'xbgpxsuhsdp',
       'jxbgpxsuhsdpbus', 'njxbgpxsuh', 26}, {1951268864, 'xnjxbgpxsuhsdpbusro', 6, -2143551488, 2026766336, 'uxnjx', 'uuxnjxbgpxs', 'suuxnj', 27}, {-337379328,
       'fsuuxnjxb', 8, 5, 7, 'xfsuuxnjxbgpxs', 'c', 'ncxfsuuxn', 28}, {3, 'cncxfsuux', 1293811712, -2065956864, 425263104, 'scncxf', 'ls', 'qlsc', 29}, {1189085184,
       'aqlscncxf', 1846345728, 1, 668073984, 'gaql', 'xgaqlscnc', 'bx', 30}, {-307560448, 'nbxgaqlscnc', -868155392, 7, 305922048, 'rnbx', 'lrnbxgaq', 'yl', 
      31}, {329777152, 'uylrnb', -926810112, -1213857792, 1563754496, 'ruylrnbxgaql', 'jruylrnbx', 'qjruylr', 32}, {714801152, 'iqjruylrnbxgaqlscn', 1692336128,
       -1735852032, 0, 'miqjruylrnbxg', 'xmiqjruylr', 'gxmiqjruylrnbxgaq', 33}, {-2000814080, 'fgxmiqjr', 162004992, 2, 989528064, 'nfgxmiqjr', 'fnfgxmiqjruylrnbxgaq',
       'jfnfgxm', 34}, {1, 'xjfnf', 1190002688, 7, 2, 'yxjfnfgx', 'hyxjfnfgxmiqjruylr', 'rhyxjfnfgxmiqjr', 35}, {-1097924608, 'irhyx', -964362240, 2016215040,
       0, 'girhyx', 'igi', 'migirhyx', 36}, {7, 'sm', 4, -459341824, 8, 'fsmigirhyxjfnfgx', 'dfsmi', 'wdfs', 37}, {5, 'rwdfsmi', 1, 2, 5, 'wrwd', 'nw', 'pnw',
       38}, {-1464729600, 'bpnwrwdfsm', 1459683328, -431751168, 344588288, 'dbpnwrwdfsmigi', 'mdbpnwrwdfsmigi', 'fmdbpnwrw', 39}, {-1485570048, 'afmdbpnwrwdfsm',
       608567296, 1, 0, 'qafmdbpnwrwdfsmi', 'zqafmdbpnwrwdfsmigi', 'wzqafmdbpn', 40}, {1445068800, 'qwz', 6, -1901068288, 1673854976, 'mqw', 'tmqwzqafm', 'utmqwzq',
       41}, {3, 'outmq', 0, 9, -514392064, 'oo', 'hooutmqwz', 'thooutmq', 42}, {4, 'xthooutmqwzqafmdb', 2062483456, 1, -495517696, 'dxthooutmqwzqafmdbp', 'xdxthooutmqw',
       'ex', 43}, {-1437073408, 'rexdxthooutmqwzqaf', -1373437952, -1827012608, 8, 'rrexdxthooutmqw', 'wr', 'dwrrexdx', 44}, {9, 'adwrrexdx', 2, 186253312, -461307904,
       'h', 'xhadwrr', 'jxhadwrrex', 45}, {-1982595072, 'rjxhadwrrexdxthoo', 5, 2115698688, -528220160, 'nrjxhadwrrexd', 'enrjxhadwrrexdxth', 'denrjx', 46}, {-309395456,
       'zdenrjxhadwr', 4, 9502720, -1868496896, 'mzdenrjx', 'wmzde', 'awmzdenrj', 47}, {-1100677120, 'ra', 726466560, -798425088, 149815296, 'qrawmz', 'uqrawmz',
       'yuqrawmz', 48}, {1290141696, 'jyuqraw', 490274816, -1325596672, -384237568, 'wjyuqrawm', 'ywjyuqrawmzdenrjxhad', 'kywjyu', 49}, {-813432832, 'nky', 5,
       874381312, 5, 'znk', 'rznkywjyuq', 'krznkywjyu', 50})
INSERT INTO t4 VALUES  (-734855168, 'hrwdbe', 1417740288, -182845440, 377028608, 'ghrwdb', 'zghrwdberoiwovwnnwri', 'jzghrwdbe', 1) ,  (-1298137088, 'ljzghrwdberoi', -1062600704, 1, -1810497536, 'rljzghr', 'hrljzg', 'thr', 2) ,  (-1358888960, 'othrlj', -256180224, 1046347776, 1905721344, 'h', 'yhothrl', 'nyhothrljzghrwdbe', 3) ,  (-1376649216, 'hn', 1800536064, 1234108416, -704184320, 'qhny', 'eqhnyhothrljzghr', 'ueqhnyho', 4) ,  (-769261568, 'kueqhnyhothrljz', -406519808, 3, -1176633344, 'pku', 'wpkueqhny', 'nwpkueqhnyho', 5) ,  (9, 'nnwpk', 1, -1571094528, 672137216, 'qnnwpkueqhnyho', 'jqn', 'djqnnw', 6) ,  (0, 'hdjqnnwpkueq', -697630720, 7, 0, 'ohdjqnnwpk', 'xohdjqnn', 'x', 7) ,  (-873988096, 'kxxohdjqnnwpkueqh', 396951552, -833028096, 8, 'ekxxohdjq', 'uekxxohdjqnnwpkueqh', 'zuekxxohdjqnnw', 8) ,  (1985740800, 'kzu', 6, 132382720, -1284243456, 'pkz', 'ypkzue', 'dy', 9) ,  (3, 'ydypkzu', -662700032, 1, 1279393792, 'yy', 'vyy', 'vvyydy', 10) ,  (1596063744, 'jvvyydypkzuek', 8, -1835794432, 312410112, 'cjvvyydy', 'u', 'sucjvvyy', 11) ,  (242483200, 'gsucj', -1361444864, -450887680, 3, 'n', 'ingsucjvvyydypk', 'ii', 12) ,  (1018560512, 'kiings', 248709120, -1179058176, 3, 'lkiingsucj', 'blkiingsucjvvy', 'mb', 13) ,  (2031484928, 'rmblkii', -1688469504, 1677918208, -505348096, 'kr', 'ek', 'hekrmblkiings', 14) ,  (1567621120, 'shekrm', 6, 1279852544, -824639488, 'fshek', 'ffs', 'qffshekrm', 15) ,  (1177288704, 'mqffshek', -640286720, 1126301696, 2130968576, 'vmqffshek', 'nvmqffshek', 'on', 16) ,  (-17891328, 'yonv', -1248002048, 1886715904, 5, 'dyonv', 'hdyonvmqffshekrmblk', 'lhdyonvmqffshekrmb', 17) ,  (7, 'jl', -821690368, -1922957312, 1058209792, 'wjl', 'qwjlhdy', 'uq', 18) ,  (8, 'tu', 1, -153550848, -926810112, 'stuqwjl', 'estuqwjl', 'j', 19) ,  (1395458048, 'zjes', 2, 1399652352, -166723584, 'iz', 'kizjestuqwjlh', 'yki', 20) ,  (-98304000, 'rykizjest', 1007157248, 1, 1, 'yry', 'hyrykizjestuqwjl', 'ehyrykizje', 21) ,  (-1376976896, 'pe', 1104019456, 1, -160235520, 'upehyrykizjestuqwj', 'oupe', 'roupehyrykizjest', 22) ,  (5, 'sroupehyrykiz', 619184128, 3, 2, 'usroupeh', 'busroup', 'pbusroup', 23) ,  (-656146432, 'dpbusrou', 625278976, 1466892288, 2078015488, 'sdpbusroupehyrykizje', 'hs', 'uhsdp', 24) ,  (-97189888, 's', 463863808, 6, -409468928, 'xsuh', 'pxsuhsdpb', 'gp', 25) ,  (-1950875648, 'bgpxsuhsdpbusrou', -1192493056, 4, 1840513024, 'xbgpxsuhsdp', 'jxbgpxsuhsdpbus', 'njxbgpxsuh', 26) ,  (1951268864, 'xnjxbgpxsuhsdpbusro', 6, -2143551488, 2026766336, 'uxnjx', 'uuxnjxbgpxs', 'suuxnj', 27) ,  (-337379328, 'fsuuxnjxb', 8, 5, 7, 'xfsuuxnjxbgpxs', 'c', 'ncxfsuuxn', 28) ,  (3, 'cncxfsuux', 1293811712, -2065956864, 425263104, 'scncxf', 'ls', 'qlsc', 29) ,  (1189085184, 'aqlscncxf', 1846345728, 1, 668073984, 'gaql', 'xgaqlscnc', 'bx', 30) ,  (-307560448, 'nbxgaqlscnc', -868155392, 7, 305922048, 'rnbx', 'lrnbxgaq', 'yl', 31) ,  (329777152, 'uylrnb', -926810112, -1213857792, 1563754496, 'ruylrnbxgaql', 'jruylrnbx', 'qjruylr', 32) ,  (714801152, 'iqjruylrnbxgaqlscn', 1692336128, -1735852032, 0, 'miqjruylrnbxg', 'xmiqjruylr', 'gxmiqjruylrnbxgaq', 33) ,  (-2000814080, 'fgxmiqjr', 162004992, 2, 989528064, 'nfgxmiqjr', 'fnfgxmiqjruylrnbxgaq', 'jfnfgxm', 34) ,  (1, 'xjfnf', 1190002688, 7, 2, 'yxjfnfgx', 'hyxjfnfgxmiqjruylr', 'rhyxjfnfgxmiqjr', 35) ,  (-1097924608, 'irhyx', -964362240, 2016215040, 0, 'girhyx', 'igi', 'migirhyx', 36) ,  (7, 'sm', 4, -459341824, 8, 'fsmigirhyxjfnfgx', 'dfsmi', 'wdfs', 37) ,  (5, 'rwdfsmi', 1, 2, 5, 'wrwd', 'nw', 'pnw', 38) ,  (-1464729600, 'bpnwrwdfsm', 1459683328, -431751168, 344588288, 'dbpnwrwdfsmigi', 'mdbpnwrwdfsmigi', 'fmdbpnwrw', 39) ,  (-1485570048, 'afmdbpnwrwdfsm', 608567296, 1, 0, 'qafmdbpnwrwdfsmi', 'zqafmdbpnwrwdfsmigi', 'wzqafmdbpn', 40) ,  (1445068800, 'qwz', 6, -1901068288, 1673854976, 'mqw', 'tmqwzqafm', 'utmqwzq', 41) ,  (3, 'outmq', 0, 9, -514392064, 'oo', 'hooutmqwz', 'thooutmq', 42) ,  (4, 'xthooutmqwzqafmdb', 2062483456, 1, -495517696, 'dxthooutmqwzqafmdbp', 'xdxthooutmqw', 'ex', 43) ,  (-1437073408, 'rexdxthooutmqwzqaf', -1373437952, -1827012608, 8, 'rrexdxthooutmqw', 'wr', 'dwrrexdx', 44) ,  (9, 'adwrrexdx', 2, 186253312, -461307904, 'h', 'xhadwrr', 'jxhadwrrex', 45) ,  (-1982595072, 'rjxhadwrrexdxthoo', 5, 2115698688, -528220160, 'nrjxhadwrrexd', 'enrjxhadwrrexdxth', 'denrjx', 46) ,  (-309395456, 'zdenrjxhadwr', 4, 9502720, -1868496896, 'mzdenrjx', 'wmzde', 'awmzdenrj', 47) ,  (-1100677120, 'ra', 726466560, -798425088, 149815296, 'qrawmz', 'uqrawmz', 'yuqrawmz', 48) ,  (1290141696, 'jyuqraw', 490274816, -1325596672, -384237568, 'wjyuqrawm', 'ywjyuqrawmzdenrjxhad', 'kywjyu', 49) ,  (-813432832, 'nky', 5, 874381312, 5, 'znk', 'rznkywjyuq', 'krznkywjyu', 50) ;
EXPLAIN INSERT INTO t4 VALUES  (5, 'jkrznk', 1924923392, 8, -339148800, 'jjkrzn', 'rjjkrznk', 'lrjjkrznk', 51) ,  (486801408, 'll', 291635200, 1, -1374683136, 'sllrjjkrz', 'jsl', 'wjsllrjjk', 52) ,  (-1104084992, 'qwjsllr', 485425152, 586416128, -1640497152, 'lqw', 'ulqwjs', 'iulqw', 53) ,  (-1931083776, 'viulqwjs', 565575680, -889978880, -1280770048, 'nviulqw', 's', 'rsnviulqw', 54) ,  (0, 'zrsnv', 7, 220135424, 516227072, 'iz', 'mizrsnviulqwjsllr', 'smizrsnvi', 55) ,  (0, 'psmizrsnviulqwjs', 618332160, 3, 920256512, 'npsmizrs', 'kn', 'uknpsmizrsnviulqwjs', 56) ,  (-1710817280, 'xuk', 5, 5, 1398996992, 'axuknpsmizrsnvi', 'aa', 'vaaxuknpsmizrsnvi', 57) ,  (-346554368, 'av', -1407778816, 3, 7, 'havaaxuknpsmizr', 'mhavaax', 'imhavaax', 58) ,  (1374027776, 'qimh', 9, -801898496, 827523072, 'bqimha', 'vbq', 'uvbqimh', 59) ,  (-192741376, 'ruv', 6, 698220544, -1261633536, 'lru', 'klruvb', 'nklruv', 60) ,  (2, 'rnklruvbqimhavaaxu', 4, -631570432, -1271463936, 'crnklruv', 'fcrnklr', 'pfcrnklruvbqimha', 61) ,  (-1477705728, 'epfc', -1744240640, -1328087040, 2, 'sepfcrnkl', 'rsepfcrnklruv', 'prsepfcr', 62) ,  (3, 'bprsepfcrnk', 1, -906625024, 2, 'nb', 'hnbprse', 'nhnb', 63) ,  (7, 'cnhnbpr', 4, 1844183040, 5, 'scn', 'mscnhnbpr', 'wmscnhnbprsepfcrnk', 64) ,  (-1290403840, 's', 1808138240, 6, 464453632, 'isw', 'eiswmscnhnbp', 'rei', 65) ,  (-2081357824, 'kreiswmscnhnbprse', 8, -268304384, -164954112, 'tkrei', 'itkre', 'jitkreiswmscn', 66) ,  (1606680576, 'pjitkreiswmscnhnbpr', 704380928, -566624256, 5, 'npjitkreis', 'q', 'lqnpjitkr', 67) ,  (86835200, 'xlqnpjitkreiswmscn', -1080754176, -1800208384, -42532864, 'w', 'twxl', 'ttwxlqnpjitkreiswms', 68) ,  (1, 'pttwxlqnpj', 71499776, 7, 1422983168, 'zpttwxlq', 'hz', 'q', 69) ,  (1962344448, 'iqhzpttwxlqnpji', 8, -1925709824, 702611456, 'k', 'ukiqhzpttwxlqnpjitk', 'fukiqhzpttw', 70) ,  (8, 'zfukiqh', 1615593472, 3, -1313275904, 'ozfukiqh', 'aoz', 'saozfuki', 71) ,  (724500480, 'isao', 7, -703856640, 494010368, 'zisaoz', 'tzi', 'ktzisaozfukiqhzpttw', 72) ,  (6, 'ektzisa', 927072256, 5, -1401487360, 'fektzisaoz', 'l', 'tlf', 73) ,  (-467337216, 'xtlfektzisa', 8, 9, 1106706432, 'uxtlfektzisao', 'suxtlfekt', 'bsuxtl', 74) ,  (1434124288, 'fbsu', 1258291200, -1128136704, 524615680, 'ef', 'eefbsuxtlfektzisaozf', 'reefbsuxt', 75) ,  (214433792, 'dreefbs', 1179582464, 393019392, 677314560, 'f', 'yfdreefbsuxtlfektz', 'ky', 76) ,  (-608698368, 'ekyfd', 1878130688, 0, 677314560, 'p', 't', 'ftpek', 77) ,  (-606797824, 'v', 1201733632, -610992128, 41091072, 'ivft', 'uiv', 'nuiv', 78) ,  (6, 'knu', 3, 811008000, 1, 'nknui', 'hnk', 'qhn', 79) ,  (8, 'iqhnknui', -1863516160, 5, -715128832, 'giqhnknui', 'v', 'lvg', 80) ,  (1384448000, 'tlv', -954204160, 752484352, -1349713920, 'ztl', 'tztlvgiqh', 'ktztlvgiqhnknuivf', 81) ,  (9, 'gktztl', 834338816, 2, 294780928, 'sgkt', 'vs', 'i', 82) ,  (-1411055616, 'livsgk', -1257177088, 1864302592, 4, 'qlivsgktztlvgiqhnk', 'rqlivsg', 'er', 83) ,  (-1315897344, 'zerqlivs', 1780154368, 9, 5, 'izer', 'fizerqli', 'f', 84) ,  (1672282112, 'uf', 2111176704, 288948224, 1456013312, 'euff', 'peuffiz', 'pp', 85) ,  (0, 'ippe', 7, -501547008, -1984692224, 'lippeuffizerq', 'n', 'hnlippeuffi', 86) ,  (7, 'nhnlipp', 7, 1, -260046848, 'tnhnlippeu', 'qtnhn', 'fqtnh', 87) ,  (-1616576512, 'mfqt', 7, -1031536640, 1745092608, 'zmfqt', 'lzmfqtnhn', 'dlzmfq', 88) ,  (439812096, 'xdlzmfqtn', 459800576, 7, 1, 'f', 'ufx', 'yufxdlz', 89) ,  (8, 'jyufx', -2124414976, -542113792, -1697972224, 'vjyuf', 'bvjyufx', 'sbvjyufxdlz', 90) ,  (-1183645696, 'asbvjyufxdlzmf', 3, 0, 2045050880, 'iasb', 'ci', 'kciasb', 91) ,  (4, 'ykciasbvj', 4, 824311808, 1, 'lykc', 'elykciasbvjy', 'p', 92) ,  (21168128, 'qpelykcias', -1554055168, 3, 9, 'uqpelykciasbvjyu', 'suqpelykcias', 'wsuqpely', 93) ,  (130809856, 'awsuqpely', 1822031872, 3, 1790443520, 'hawsu', 'wh', 'wwha', 94) ,  (5, 'bwwha', 1558708224, 2, 972816384, 'jbwwhaws', 'djbwwhawsu', 'sdjbwwhawsuqpelyk', 95) ,  (2092433408, 'js', 1855127552, 9, -743768064, 'cjsdjbwwh', 'ecjsdjbwwh', 'uecjsdjbwwhawsuqpel', 96) ,  (9, 'iuecj', 745013248, 6, 7, 'viuecjs', 'zviuecj', 'jzviu', 97) ,  (-2075590656, 'qjzviu', 0, 552599552, 531365888, 'rqjzviuecjsd', 'mrq', 'mmrqjzviu', 98) ,  (-468189184, 'rmmr', -310706176, 1275658240, -677838848, 'krmmrqjzvi', 'dkrmmrq', 'vdkrmmrqjzviuecjsdj', 99) ,  (-1234436096, 'h', 2083323904, 8, 1557135360, 'ghvdkrm', 'eghvdkrmmrqj', 'jeghvdkrmm', 100) ;
Query Plan
==================================================
|ID|OPERATOR          |NAME|EST.ROWS|EST.TIME(us)|
--------------------------------------------------
|0 |DISTRIBUTED INSERT|    |50      |324         |
|1 |└─EXPRESSION      |    |50      |1           |
==================================================
Outputs & filters:
-------------------------------------
  0 - output(nil), filter(nil)
      columns([{T4: ({T4: (T4.PK, T4.COL_INT_NOT_NULL, T4.COL_VARCHAR_20, T4.COL_NUMBER_NOT_NULL, T4.COL_NUMBER, T4.COL_INT, T4.COL_VARCHAR_20_NOT_NULL,
       T4.COL_CHAR_20_NOT_NULL, T4.COL_CHAR_20)})}]), 
      column_values([column_conv(NUMBER,PS:(-1,0),NOT NULL,__values.PK)], [column_conv(NUMBER,PS:(-1,0),NOT NULL,__values.COL_INT_NOT_NULL)], [column_conv(VARCHAR2,
      utf8mb4_bin,length:20,NULL,__values.COL_VARCHAR_20)], [column_conv(NUMBER,PS:(-1,-85),NOT NULL,__values.COL_NUMBER_NOT_NULL)], [column_conv(NUMBER,PS:(-1,
      -85),NULL,__values.COL_NUMBER)], [column_conv(NUMBER,PS:(-1,0),NULL,__values.COL_INT)], [column_conv(VARCHAR2,utf8mb4_bin,length:20,NOT NULL,__values.COL_VARCHAR_20_NOT_NULL)],
       [column_conv(CHAR,utf8mb4_bin,length:20,NOT NULL,__values.COL_CHAR_20_NOT_NULL)], [column_conv(CHAR,utf8mb4_bin,length:20,NULL,__values.COL_CHAR_20)])
  1 - output([__values.COL_INT_NOT_NULL], [__values.COL_VARCHAR_20], [__values.COL_NUMBER_NOT_NULL], [__values.COL_NUMBER], [__values.COL_INT], [__values.COL_VARCHAR_20_NOT_NULL],
       [__values.COL_CHAR_20_NOT_NULL], [__values.COL_CHAR_20], [__values.PK]), filter(nil)
      values({5, 'jkrznk', 1924923392, 8, -339148800, 'jjkrzn', 'rjjkrznk', 'lrjjkrznk', 51}, {486801408, 'll', 291635200, 1, -1374683136, 'sllrjjkrz', 
      'jsl', 'wjsllrjjk', 52}, {-1104084992, 'qwjsllr', 485425152, 586416128, -1640497152, 'lqw', 'ulqwjs', 'iulqw', 53}, {-1931083776, 'viulqwjs', 565575680,
       -889978880, -1280770048, 'nviulqw', 's', 'rsnviulqw', 54}, {0, 'zrsnv', 7, 220135424, 516227072, 'iz', 'mizrsnviulqwjsllr', 'smizrsnvi', 55}, {0, 'psmizrsnviulqwjs',
       618332160, 3, 920256512, 'npsmizrs', 'kn', 'uknpsmizrsnviulqwjs', 56}, {-1710817280, 'xuk', 5, 5, 1398996992, 'axuknpsmizrsnvi', 'aa', 'vaaxuknpsmizrsnvi',
       57}, {-346554368, 'av', -1407778816, 3, 7, 'havaaxuknpsmizr', 'mhavaax', 'imhavaax', 58}, {1374027776, 'qimh', 9, -801898496, 827523072, 'bqimha', 'vbq',
       'uvbqimh', 59}, {-192741376, 'ruv', 6, 698220544, -1261633536, 'lru', 'klruvb', 'nklruv', 60}, {2, 'rnklruvbqimhavaaxu', 4, -631570432, -1271463936, 'crnklruv',
       'fcrnklr', 'pfcrnklruvbqimha', 61}, {-1477705728, 'epfc', -1744240640, -1328087040, 2, 'sepfcrnkl', 'rsepfcrnklruv', 'prsepfcr', 62}, {3, 'bprsepfcrnk',
       1, -906625024, 2, 'nb', 'hnbprse', 'nhnb', 63}, {7, 'cnhnbpr', 4, 1844183040, 5, 'scn', 'mscnhnbpr', 'wmscnhnbprsepfcrnk', 64}, {-1290403840, 's', 1808138240,
       6, 464453632, 'isw', 'eiswmscnhnbp', 'rei', 65}, {-2081357824, 'kreiswmscnhnbprse', 8, -268304384, -164954112, 'tkrei', 'itkre', 'jitkreiswmscn', 66}, 
      {1606680576, 'pjitkreiswmscnhnbpr', 704380928, -566624256, 5, 'npjitkreis', 'q', 'lqnpjitkr', 67}, {86835200, 'xlqnpjitkreiswmscn', -1080754176, -1800208384,
       -42532864, 'w', 'twxl', 'ttwxlqnpjitkreiswms', 68}, {1, 'pttwxlqnpj', 71499776, 7, 1422983168, 'zpttwxlq', 'hz', 'q', 69}, {1962344448, 'iqhzpttwxlqnpji',
       8, -1925709824, 702611456, 'k', 'ukiqhzpttwxlqnpjitk', 'fukiqhzpttw', 70}, {8, 'zfukiqh', 1615593472, 3, -1313275904, 'ozfukiqh', 'aoz', 'saozfuki', 71},
       {724500480, 'isao', 7, -703856640, 494010368, 'zisaoz', 'tzi', 'ktzisaozfukiqhzpttw', 72}, {6, 'ektzisa', 927072256, 5, -1401487360, 'fektzisaoz', 'l',
       'tlf', 73}, {-467337216, 'xtlfektzisa', 8, 9, 1106706432, 'uxtlfektzisao', 'suxtlfekt', 'bsuxtl', 74}, {1434124288, 'fbsu', 1258291200, -1128136704, 524615680,
       'ef', 'eefbsuxtlfektzisaozf', 'reefbsuxt', 75}, {214433792, 'dreefbs', 1179582464, 393019392, 677314560, 'f', 'yfdreefbsuxtlfektz', 'ky', 76}, {-608698368,
       'ekyfd', 1878130688, 0, 677314560, 'p', 't', 'ftpek', 77}, {-606797824, 'v', 1201733632, -610992128, 41091072, 'ivft', 'uiv', 'nuiv', 78}, {6, 'knu', 3,
       811008000, 1, 'nknui', 'hnk', 'qhn', 79}, {8, 'iqhnknui', -1863516160, 5, -715128832, 'giqhnknui', 'v', 'lvg', 80}, {1384448000, 'tlv', -954204160, 752484352,
       -1349713920, 'ztl', 'tztlvgiqh', 'ktztlvgiqhnknuivf', 81}, {9, 'gktztl', 834338816, 2, 294780928, 'sgkt', 'vs', 'i', 82}, {-1411055616, 'livsgk', -1257177088,
       1864302592, 4, 'qlivsgktztlvgiqhnk', 'rqlivsg', 'er', 83}, {-1315897344, 'zerqlivs', 1780154368, 9, 5, 'izer', 'fizerqli', 'f', 84}, {1672282112, 'uf',
       2111176704, 288948224, 1456013312, 'euff', 'peuffiz', 'pp', 85}, {0, 'ippe', 7, -501547008, -1984692224, 'lippeuffizerq', 'n', 'hnlippeuffi', 86}, {7, 
      'nhnlipp', 7, 1, -260046848, 'tnhnlippeu', 'qtnhn', 'fqtnh', 87}, {-1616576512, 'mfqt', 7, -1031536640, 1745092608, 'zmfqt', 'lzmfqtnhn', 'dlzmfq', 88},
       {439812096, 'xdlzmfqtn', 459800576, 7, 1, 'f', 'ufx', 'yufxdlz', 89}, {8, 'jyufx', -2124414976, -542113792, -1697972224, 'vjyuf', 'bvjyufx', 'sbvjyufxdlz',
       90}, {-1183645696, 'asbvjyufxdlzmf', 3, 0, 2045050880, 'iasb', 'ci', 'kciasb', 91}, {4, 'ykciasbvj', 4, 824311808, 1, 'lykc', 'elykciasbvjy', 'p', 92},
       {21168128, 'qpelykcias', -1554055168, 3, 9, 'uqpelykciasbvjyu', 'suqpelykcias', 'wsuqpely', 93}, {130809856, 'awsuqpely', 1822031872, 3, 1790443520, 'hawsu',
       'wh', 'wwha', 94}, {5, 'bwwha', 1558708224, 2, 972816384, 'jbwwhaws', 'djbwwhawsu', 'sdjbwwhawsuqpelyk', 95}, {2092433408, 'js', 1855127552, 9, -743768064,
       'cjsdjbwwh', 'ecjsdjbwwh', 'uecjsdjbwwhawsuqpel', 96}, {9, 'iuecj', 745013248, 6, 7, 'viuecjs', 'zviuecj', 'jzviu', 97}, {-2075590656, 'qjzviu', 0, 552599552,
       531365888, 'rqjzviuecjsd', 'mrq', 'mmrqjzviu', 98}, {-468189184, 'rmmr', -310706176, 1275658240, -677838848, 'krmmrqjzvi', 'dkrmmrq', 'vdkrmmrqjzviuecjsdj',
       99}, {-1234436096, 'h', 2083323904, 8, 1557135360, 'ghvdkrm', 'eghvdkrmmrqj', 'jeghvdkrmm', 100})
INSERT INTO t4 VALUES  (5, 'jkrznk', 1924923392, 8, -339148800, 'jjkrzn', 'rjjkrznk', 'lrjjkrznk', 51) ,  (486801408, 'll', 291635200, 1, -1374683136, 'sllrjjkrz', 'jsl', 'wjsllrjjk', 52) ,  (-1104084992, 'qwjsllr', 485425152, 586416128, -1640497152, 'lqw', 'ulqwjs', 'iulqw', 53) ,  (-1931083776, 'viulqwjs', 565575680, -889978880, -1280770048, 'nviulqw', 's', 'rsnviulqw', 54) ,  (0, 'zrsnv', 7, 220135424, 516227072, 'iz', 'mizrsnviulqwjsllr', 'smizrsnvi', 55) ,  (0, 'psmizrsnviulqwjs', 618332160, 3, 920256512, 'npsmizrs', 'kn', 'uknpsmizrsnviulqwjs', 56) ,  (-1710817280, 'xuk', 5, 5, 1398996992, 'axuknpsmizrsnvi', 'aa', 'vaaxuknpsmizrsnvi', 57) ,  (-346554368, 'av', -1407778816, 3, 7, 'havaaxuknpsmizr', 'mhavaax', 'imhavaax', 58) ,  (1374027776, 'qimh', 9, -801898496, 827523072, 'bqimha', 'vbq', 'uvbqimh', 59) ,  (-192741376, 'ruv', 6, 698220544, -1261633536, 'lru', 'klruvb', 'nklruv', 60) ,  (2, 'rnklruvbqimhavaaxu', 4, -631570432, -1271463936, 'crnklruv', 'fcrnklr', 'pfcrnklruvbqimha', 61) ,  (-1477705728, 'epfc', -1744240640, -1328087040, 2, 'sepfcrnkl', 'rsepfcrnklruv', 'prsepfcr', 62) ,  (3, 'bprsepfcrnk', 1, -906625024, 2, 'nb', 'hnbprse', 'nhnb', 63) ,  (7, 'cnhnbpr', 4, 1844183040, 5, 'scn', 'mscnhnbpr', 'wmscnhnbprsepfcrnk', 64) ,  (-1290403840, 's', 1808138240, 6, 464453632, 'isw', 'eiswmscnhnbp', 'rei', 65) ,  (-2081357824, 'kreiswmscnhnbprse', 8, -268304384, -164954112, 'tkrei', 'itkre', 'jitkreiswmscn', 66) ,  (1606680576, 'pjitkreiswmscnhnbpr', 704380928, -566624256, 5, 'npjitkreis', 'q', 'lqnpjitkr', 67) ,  (86835200, 'xlqnpjitkreiswmscn', -1080754176, -1800208384, -42532864, 'w', 'twxl', 'ttwxlqnpjitkreiswms', 68) ,  (1, 'pttwxlqnpj', 71499776, 7, 1422983168, 'zpttwxlq', 'hz', 'q', 69) ,  (1962344448, 'iqhzpttwxlqnpji', 8, -1925709824, 702611456, 'k', 'ukiqhzpttwxlqnpjitk', 'fukiqhzpttw', 70) ,  (8, 'zfukiqh', 1615593472, 3, -1313275904, 'ozfukiqh', 'aoz', 'saozfuki', 71) ,  (724500480, 'isao', 7, -703856640, 494010368, 'zisaoz', 'tzi', 'ktzisaozfukiqhzpttw', 72) ,  (6, 'ektzisa', 927072256, 5, -1401487360, 'fektzisaoz', 'l', 'tlf', 73) ,  (-467337216, 'xtlfektzisa', 8, 9, 1106706432, 'uxtlfektzisao', 'suxtlfekt', 'bsuxtl', 74) ,  (1434124288, 'fbsu', 1258291200, -1128136704, 524615680, 'ef', 'eefbsuxtlfektzisaozf', 'reefbsuxt', 75) ,  (214433792, 'dreefbs', 1179582464, 393019392, 677314560, 'f', 'yfdreefbsuxtlfektz', 'ky', 76) ,  (-608698368, 'ekyfd', 1878130688, 0, 677314560, 'p', 't', 'ftpek', 77) ,  (-606797824, 'v', 1201733632, -610992128, 41091072, 'ivft', 'uiv', 'nuiv', 78) ,  (6, 'knu', 3, 811008000, 1, 'nknui', 'hnk', 'qhn', 79) ,  (8, 'iqhnknui', -1863516160, 5, -715128832, 'giqhnknui', 'v', 'lvg', 80) ,  (1384448000, 'tlv', -954204160, 752484352, -1349713920, 'ztl', 'tztlvgiqh', 'ktztlvgiqhnknuivf', 81) ,  (9, 'gktztl', 834338816, 2, 294780928, 'sgkt', 'vs', 'i', 82) ,  (-1411055616, 'livsgk', -1257177088, 1864302592, 4, 'qlivsgktztlvgiqhnk', 'rqlivsg', 'er', 83) ,  (-1315897344, 'zerqlivs', 1780154368, 9, 5, 'izer', 'fizerqli', 'f', 84) ,  (1672282112, 'uf', 2111176704, 288948224, 1456013312, 'euff', 'peuffiz', 'pp', 85) ,  (0, 'ippe', 7, -501547008, -1984692224, 'lippeuffizerq', 'n', 'hnlippeuffi', 86) ,  (7, 'nhnlipp', 7, 1, -260046848, 'tnhnlippeu', 'qtnhn', 'fqtnh', 87) ,  (-1616576512, 'mfqt', 7, -1031536640, 1745092608, 'zmfqt', 'lzmfqtnhn', 'dlzmfq', 88) ,  (439812096, 'xdlzmfqtn', 459800576, 7, 1, 'f', 'ufx', 'yufxdlz', 89) ,  (8, 'jyufx', -2124414976, -542113792, -1697972224, 'vjyuf', 'bvjyufx', 'sbvjyufxdlz', 90) ,  (-1183645696, 'asbvjyufxdlzmf', 3, 0, 2045050880, 'iasb', 'ci', 'kciasb', 91) ,  (4, 'ykciasbvj', 4, 824311808, 1, 'lykc', 'elykciasbvjy', 'p', 92) ,  (21168128, 'qpelykcias', -1554055168, 3, 9, 'uqpelykciasbvjyu', 'suqpelykcias', 'wsuqpely', 93) ,  (130809856, 'awsuqpely', 1822031872, 3, 1790443520, 'hawsu', 'wh', 'wwha', 94) ,  (5, 'bwwha', 1558708224, 2, 972816384, 'jbwwhaws', 'djbwwhawsu', 'sdjbwwhawsuqpelyk', 95) ,  (2092433408, 'js', 1855127552, 9, -743768064, 'cjsdjbwwh', 'ecjsdjbwwh', 'uecjsdjbwwhawsuqpel', 96) ,  (9, 'iuecj', 745013248, 6, 7, 'viuecjs', 'zviuecj', 'jzviu', 97) ,  (-2075590656, 'qjzviu', 0, 552599552, 531365888, 'rqjzviuecjsd', 'mrq', 'mmrqjzviu', 98) ,  (-468189184, 'rmmr', -310706176, 1275658240, -677838848, 'krmmrqjzvi', 'dkrmmrq', 'vdkrmmrqjzviuecjsdj', 99) ,  (-1234436096, 'h', 2083323904, 8, 1557135360, 'ghvdkrm', 'eghvdkrmmrqj', 'jeghvdkrmm', 100) ;

CREATE TABLE t7 (
col_varchar_20_not_null varchar(20) not null,
col_number number,
col_varchar_20 varchar(20),
col_number_not_null number not null,
col_char_20 char(20),
col_int int,
pk int,
col_char_20_not_null char(20) not null,
col_int_not_null int not null,
/*Indices*/
primary key (pk) ) ;
EXPLAIN INSERT INTO t7 VALUES  ('otjjrhsacmva', 1739259904, 'ao', -424214528, 'zaotjjrhsacmvazmfd', -955187200, 1, 'vzaotjj', 3) ,  ('t', -671416320, 'htvza', 1794834432, 'xhtvz', 744095744, 2, 'h', 3) ,  ('d', 2065629184, 'ndhxhtvz', 5, 'ynd', -1495990272, 3, 'z', 1168310272) ,  ('s', 4, 'lszyndhxht', -836304896, 'blszyndhxhtvzao', -299106304, 4, 'sblszyn', -262209536) ,  ('osblszyndh', -2136735744, 'iosblszyndhxhtvza', 3, 'hio', -2093809664, 5, 'yh', 6) ,  ('iy', 3, 'giy', 1517289472, 'w', -1483079680, 6, 'qwgiyhio', -488112128) ,  ('aqw', 1428815872, 'eaqwgiyhiosblszyndhx', 2, 'jeaqwgiyhiosbls', 906297344, 7, 'bjea', 233373696) ,  ('ibjeaqwgiyhiosbl', 8, 'kibjea', -1142554624, 'fkibjeaqwgiyhiosbl', 1, 8, 'jfkibjeaqwgiy', 1920794624) ,  ('zjfkibjeaq', 6, 'vzjfkib', -1518338048, 'avz', 8, 9, 'aavzj', 1230241792) ,  ('iaav', -670564352, 'viaa', 1923743744, 'sviaavz', 9, 10, 'osviaavzj', 0) ,  ('aosviaavzjfk', 1722548224, 'eaosviaa', -886374400, 'xeaos', -161284096, 11, 'wxeaos', 588906496) ,  ('xwxe', -436928512, 'exwxeaos', -150274048, 'yexwxeaosvia', 130416640, 12, 'syexw', 1142030336) ,  ('psyexwxeao', -1635778560, 'zpsyexwxeao', 2, 'jzpsy', 0, 13, 'u', 1651834880) ,  ('bujzps', -560791552, 'j', -831717376, 'wjbujzpsyexwxeaos', 5, 14, 'xwjbujzpsyexwxeaos', -477888512) ,  ('cxwjbuj', 5, 'y', 1019740160, 'hycx', -904265728, 15, 'phycxwjbuj', 338690048) ,  ('wphycxwjb', 8, 'o', 9, 'cowphycxwjbujz', -1862270976, 16, 'p', -2139750400) ,  ('epcowphycxwjbujz', 8, 'gepc', 1201864704, 'qgepcowphycxwj', 6, 17, 'uqgepco', 708247552) ,  ('puqg', 2054684672, 'gpuqg', 535625728, 'bgpuqgepcowphycx', 5, 18, 'jbgpuqgepc', 1705246720) ,  ('tjbg', 9, 'p', -1073414144, 'optjbg', -1697710080, 19, 'fopt', 3) ,  ('cfopt', 1128398848, 'fcfoptjbgpuqgep', 7, 'nfcfoptjbg', 936968192, 20, 'jnf', -273285120) ,  ('kjnfcfo', 355794944, 'dkjnfcf', 335085568, 'bdkjnf', 758906880, 21, 'sbdkjnfcf', 1008074752) ,  ('rsbdkjnfcf', 1875509248, 'drsbdkjnfcfoptj', 1727397888, 'fdrsb', 1, 22, 'yfdrsbdkj', 1474822144) ,  ('gyfdrsbdkjnf', 45285376, 'kgyfdrs', 974061568, 'mkgyfdrsbdkjn', -1668218880, 23, 'omkgyfdrsbdkjn', -58458112) ,  ('comkgyfd', -1164771328, 'zcomkgyfdrsbdkj', -1013317632, 'gzcomkg', 1416429568, 24, 'fgzcomkg', 1793327104) ,  ('mfgzcom', 1766064128, 'pmfgzcomk', -1383989248, 'hpmfgzco', 1601896448, 25, 'ahpmfg', 681836544) ,  ('a', -1822031872, 'paahp', -118751232, 'tpaah', 2126512128, 26, 'ptpaahpmfg', -1326776320) ,  ('rptpaa', 1248460800, 'urptpaahpmfgzcomk', 275382272, 'uurptpaah', -11665408, 27, 'muu', -1717960704) ,  ('cm', -890765312, 'icmuurp', 1123745792, 'hicmuurptpaahpmfgz', -950534144, 28, 'khicmuurpt', 1913192448) ,  ('fkhicmuurptpaahpmfgz', 1316421632, 'wfkh', -2072182784, 'awfkhicmuu', -221184000, 29, 'eawfk', -751042560) ,  ('qe', -1459093504, 'vq', -1414922240, 'xvqeawfk', 8, 30, 'xxvqeawfkhicmu', 7) ,  ('yxxvqeaw', 2, 'byxxvqeawfkhicmuu', 0, 'ybyxxvqeaw', 2, 31, 'bybyxxvqeawfk', 0) ,  ('fbybyxxvq', 8, 'xfbybyxxvq', 1982660608, 'kxfbybyxx', -1677918208, 32, 'wkx', 3) ,  ('fwkxfbybyxxv', -1577648128, 'mfwk', -886964224, 'tmfwkxfbybyxxv', 0, 33, 'wtmfwk', 0) ,  ('b', -594739200, 'cbwtmfwkx', 3, 'kcbwtmf', 7, 34, 'skcbwt', 9) ,  ('iskc', 1796603904, 'kisk', 1615462400, 'lkisk', 4, 35, 'blk', -1339752448) ,  ('pblkiskcbwtmf', 178257920, 'hpblkis', 1002569728, 'dhpblkis', -1605959680, 36, 'vdh', 7) ,  ('o', -2018312192, 'povdhpblkiskc', 616890368, 'ypovdhpblkis', 0, 37, 'typovdhpblkis', -147718144) ,  ('ptypovdhp', -556859392, 'eptypovdhpblk', 2, 'lep', 1432616960, 38, 'jleptypov', -428670976) ,  ('gjleptypovdhp', 838860800, 'igjleptyp', 0, 'tigjlepty', 1933574144, 39, 'u', -695664640) ,  ('t', 1293746176, 'ttutigjl', 50397184, 'xttutigjlep', 1463681024, 40, 'zxtt', -1210712064) ,  ('mzxttuti', 1154285568, 'x', 1683685376, 'l', -1337786368, 41, 'jlxm', 855375872) ,  ('rjlxm', 4, 'krjlxmzxttut', -291241984, 'n', 602013696, 42, 'dnkrjl', -1233649664) ,  ('fdnkrjlxmzxttut', -416940032, 'cfdnkrjlx', -803012608, 'ecfdnkrjlxmzxttu', -779943936, 43, 'zec', -1963917312) ,  ('qzecfdn', -806748160, 'iqze', 5, 'liqzecfdn', -819658752, 44, 'zliqzecfdn', 152240128) ,  ('bzl', 786432000, 'fbzliq', 4, 'mfbzl', 482738176, 45, 'm', 5) ,  ('r', 2, 'nrmmfbzliqzecfdn', 6, 'hnrmmfbzliqzecfd', 3, 46, 'whnrm', -35651584) ,  ('awhnrmmfb', -2133327872, 'saw', -525533184, 'us', -418512896, 47, 'vusawhnr', 3) ,  ('pvu', 417267712, 'gpvusawhnrmmfb', 353566720, 'cgpv', 8, 48, 'ecgpvusaw', -154992640) ,  ('xecgpvusawhn', -837615616, 'sxecg', 1, 'fsxecgpvusawhnrm', 1159004160, 49, 'gfsxecgpvusawhnrmmfb', 8) ,  ('ugfsxecgpvusawhnrm', -1065484288, 'vugfsxecgpv', -99287040, 'uvugfsx', 999882752, 50, 'xuvugfsxecgpvu', 3) ;
Query Plan
==================================================
|ID|OPERATOR          |NAME|EST.ROWS|EST.TIME(us)|
--------------------------------------------------
|0 |DISTRIBUTED INSERT|    |50      |324         |
|1 |└─EXPRESSION      |    |50      |1           |
==================================================
Outputs & filters:
-------------------------------------
  0 - output(nil), filter(nil)
      columns([{T7: ({T7: (T7.PK, T7.COL_VARCHAR_20_NOT_NULL, T7.COL_NUMBER, T7.COL_VARCHAR_20, T7.COL_NUMBER_NOT_NULL, T7.COL_CHAR_20, T7.COL_INT, T7.COL_CHAR_20_NOT_NULL,
       T7.COL_INT_NOT_NULL)})}]), 
      column_values([column_conv(NUMBER,PS:(-1,0),NOT NULL,__values.PK)], [column_conv(VARCHAR2,utf8mb4_bin,length:20,NOT NULL,__values.COL_VARCHAR_20_NOT_NULL)],
       [column_conv(NUMBER,PS:(-1,-85),NULL,__values.COL_NUMBER)], [column_conv(VARCHAR2,utf8mb4_bin,length:20,NULL,__values.COL_VARCHAR_20)], [column_conv(NUMBER,
      PS:(-1,-85),NOT NULL,__values.COL_NUMBER_NOT_NULL)], [column_conv(CHAR,utf8mb4_bin,length:20,NULL,__values.COL_CHAR_20)], [column_conv(NUMBER,PS:(-1,0),
      NULL,__values.COL_INT)], [column_conv(CHAR,utf8mb4_bin,length:20,NOT NULL,__values.COL_CHAR_20_NOT_NULL)], [column_conv(NUMBER,PS:(-1,0),NOT NULL,__values.COL_INT_NOT_NULL)])
  1 - output([__values.COL_VARCHAR_20_NOT_NULL], [__values.COL_NUMBER], [__values.COL_VARCHAR_20], [__values.COL_NUMBER_NOT_NULL], [__values.COL_CHAR_20],
       [__values.COL_INT], [__values.PK], [__values.COL_CHAR_20_NOT_NULL], [__values.COL_INT_NOT_NULL]), filter(nil)
      values({'otjjrhsacmva', 1739259904, 'ao', -424214528, 'zaotjjrhsacmvazmfd', -955187200, 1, 'vzaotjj', 3}, {'t', -671416320, 'htvza', 1794834432, 'xhtvz',
       744095744, 2, 'h', 3}, {'d', 2065629184, 'ndhxhtvz', 5, 'ynd', -1495990272, 3, 'z', 1168310272}, {'s', 4, 'lszyndhxht', -836304896, 'blszyndhxhtvzao', 
      -299106304, 4, 'sblszyn', -262209536}, {'osblszyndh', -2136735744, 'iosblszyndhxhtvza', 3, 'hio', -2093809664, 5, 'yh', 6}, {'iy', 3, 'giy', 1517289472,
       'w', -1483079680, 6, 'qwgiyhio', -488112128}, {'aqw', 1428815872, 'eaqwgiyhiosblszyndhx', 2, 'jeaqwgiyhiosbls', 906297344, 7, 'bjea', 233373696}, {'ibjeaqwgiyhiosbl',
       8, 'kibjea', -1142554624, 'fkibjeaqwgiyhiosbl', 1, 8, 'jfkibjeaqwgiy', 1920794624}, {'zjfkibjeaq', 6, 'vzjfkib', -1518338048, 'avz', 8, 9, 'aavzj', 1230241792},
       {'iaav', -670564352, 'viaa', 1923743744, 'sviaavz', 9, 10, 'osviaavzj', 0}, {'aosviaavzjfk', 1722548224, 'eaosviaa', -886374400, 'xeaos', -161284096, 11,
       'wxeaos', 588906496}, {'xwxe', -436928512, 'exwxeaos', -150274048, 'yexwxeaosvia', 130416640, 12, 'syexw', 1142030336}, {'psyexwxeao', -1635778560, 'zpsyexwxeao',
       2, 'jzpsy', 0, 13, 'u', 1651834880}, {'bujzps', -560791552, 'j', -831717376, 'wjbujzpsyexwxeaos', 5, 14, 'xwjbujzpsyexwxeaos', -477888512}, {'cxwjbuj',
       5, 'y', 1019740160, 'hycx', -904265728, 15, 'phycxwjbuj', 338690048}, {'wphycxwjb', 8, 'o', 9, 'cowphycxwjbujz', -1862270976, 16, 'p', -2139750400}, {'epcowphycxwjbujz',
       8, 'gepc', 1201864704, 'qgepcowphycxwj', 6, 17, 'uqgepco', 708247552}, {'puqg', 2054684672, 'gpuqg', 535625728, 'bgpuqgepcowphycx', 5, 18, 'jbgpuqgepc',
       1705246720}, {'tjbg', 9, 'p', -1073414144, 'optjbg', -1697710080, 19, 'fopt', 3}, {'cfopt', 1128398848, 'fcfoptjbgpuqgep', 7, 'nfcfoptjbg', 936968192, 
      20, 'jnf', -273285120}, {'kjnfcfo', 355794944, 'dkjnfcf', 335085568, 'bdkjnf', 758906880, 21, 'sbdkjnfcf', 1008074752}, {'rsbdkjnfcf', 1875509248, 'drsbdkjnfcfoptj',
       1727397888, 'fdrsb', 1, 22, 'yfdrsbdkj', 1474822144}, {'gyfdrsbdkjnf', 45285376, 'kgyfdrs', 974061568, 'mkgyfdrsbdkjn', -1668218880, 23, 'omkgyfdrsbdkjn',
       -58458112}, {'comkgyfd', -1164771328, 'zcomkgyfdrsbdkj', -1013317632, 'gzcomkg', 1416429568, 24, 'fgzcomkg', 1793327104}, {'mfgzcom', 1766064128, 'pmfgzcomk',
       -1383989248, 'hpmfgzco', 1601896448, 25, 'ahpmfg', 681836544}, {'a', -1822031872, 'paahp', -118751232, 'tpaah', 2126512128, 26, 'ptpaahpmfg', -1326776320},
       {'rptpaa', 1248460800, 'urptpaahpmfgzcomk', 275382272, 'uurptpaah', -11665408, 27, 'muu', -1717960704}, {'cm', -890765312, 'icmuurp', 1123745792, 'hicmuurptpaahpmfgz',
       -950534144, 28, 'khicmuurpt', 1913192448}, {'fkhicmuurptpaahpmfgz', 1316421632, 'wfkh', -2072182784, 'awfkhicmuu', -221184000, 29, 'eawfk', -751042560},
       {'qe', -1459093504, 'vq', -1414922240, 'xvqeawfk', 8, 30, 'xxvqeawfkhicmu', 7}, {'yxxvqeaw', 2, 'byxxvqeawfkhicmuu', 0, 'ybyxxvqeaw', 2, 31, 'bybyxxvqeawfk',
       0}, {'fbybyxxvq', 8, 'xfbybyxxvq', 1982660608, 'kxfbybyxx', -1677918208, 32, 'wkx', 3}, {'fwkxfbybyxxv', -1577648128, 'mfwk', -886964224, 'tmfwkxfbybyxxv',
       0, 33, 'wtmfwk', 0}, {'b', -594739200, 'cbwtmfwkx', 3, 'kcbwtmf', 7, 34, 'skcbwt', 9}, {'iskc', 1796603904, 'kisk', 1615462400, 'lkisk', 4, 35, 'blk', 
      -1339752448}, {'pblkiskcbwtmf', 178257920, 'hpblkis', 1002569728, 'dhpblkis', -1605959680, 36, 'vdh', 7}, {'o', -2018312192, 'povdhpblkiskc', 616890368,
       'ypovdhpblkis', 0, 37, 'typovdhpblkis', -147718144}, {'ptypovdhp', -556859392, 'eptypovdhpblk', 2, 'lep', 1432616960, 38, 'jleptypov', -428670976}, {'gjleptypovdhp',
       838860800, 'igjleptyp', 0, 'tigjlepty', 1933574144, 39, 'u', -695664640}, {'t', 1293746176, 'ttutigjl', 50397184, 'xttutigjlep', 1463681024, 40, 'zxtt',
       -1210712064}, {'mzxttuti', 1154285568, 'x', 1683685376, 'l', -1337786368, 41, 'jlxm', 855375872}, {'rjlxm', 4, 'krjlxmzxttut', -291241984, 'n', 602013696,
       42, 'dnkrjl', -1233649664}, {'fdnkrjlxmzxttut', -416940032, 'cfdnkrjlx', -803012608, 'ecfdnkrjlxmzxttu', -779943936, 43, 'zec', -1963917312}, {'qzecfdn',
       -806748160, 'iqze', 5, 'liqzecfdn', -819658752, 44, 'zliqzecfdn', 152240128}, {'bzl', 786432000, 'fbzliq', 4, 'mfbzl', 482738176, 45, 'm', 5}, {'r', 2,
       'nrmmfbzliqzecfdn', 6, 'hnrmmfbzliqzecfd', 3, 46, 'whnrm', -35651584}, {'awhnrmmfb', -2133327872, 'saw', -525533184, 'us', -418512896, 47, 'vusawhnr', 
      3}, {'pvu', 417267712, 'gpvusawhnrmmfb', 353566720, 'cgpv', 8, 48, 'ecgpvusaw', -154992640}, {'xecgpvusawhn', -837615616, 'sxecg', 1, 'fsxecgpvusawhnrm',
       1159004160, 49, 'gfsxecgpvusawhnrmmfb', 8}, {'ugfsxecgpvusawhnrm', -1065484288, 'vugfsxecgpv', -99287040, 'uvugfsx', 999882752, 50, 'xuvugfsxecgpvu', 3})
INSERT INTO t7 VALUES  ('otjjrhsacmva', 1739259904, 'ao', -424214528, 'zaotjjrhsacmvazmfd', -955187200, 1, 'vzaotjj', 3) ,  ('t', -671416320, 'htvza', 1794834432, 'xhtvz', 744095744, 2, 'h', 3) ,  ('d', 2065629184, 'ndhxhtvz', 5, 'ynd', -1495990272, 3, 'z', 1168310272) ,  ('s', 4, 'lszyndhxht', -836304896, 'blszyndhxhtvzao', -299106304, 4, 'sblszyn', -262209536) ,  ('osblszyndh', -2136735744, 'iosblszyndhxhtvza', 3, 'hio', -2093809664, 5, 'yh', 6) ,  ('iy', 3, 'giy', 1517289472, 'w', -1483079680, 6, 'qwgiyhio', -488112128) ,  ('aqw', 1428815872, 'eaqwgiyhiosblszyndhx', 2, 'jeaqwgiyhiosbls', 906297344, 7, 'bjea', 233373696) ,  ('ibjeaqwgiyhiosbl', 8, 'kibjea', -1142554624, 'fkibjeaqwgiyhiosbl', 1, 8, 'jfkibjeaqwgiy', 1920794624) ,  ('zjfkibjeaq', 6, 'vzjfkib', -1518338048, 'avz', 8, 9, 'aavzj', 1230241792) ,  ('iaav', -670564352, 'viaa', 1923743744, 'sviaavz', 9, 10, 'osviaavzj', 0) ,  ('aosviaavzjfk', 1722548224, 'eaosviaa', -886374400, 'xeaos', -161284096, 11, 'wxeaos', 588906496) ,  ('xwxe', -436928512, 'exwxeaos', -150274048, 'yexwxeaosvia', 130416640, 12, 'syexw', 1142030336) ,  ('psyexwxeao', -1635778560, 'zpsyexwxeao', 2, 'jzpsy', 0, 13, 'u', 1651834880) ,  ('bujzps', -560791552, 'j', -831717376, 'wjbujzpsyexwxeaos', 5, 14, 'xwjbujzpsyexwxeaos', -477888512) ,  ('cxwjbuj', 5, 'y', 1019740160, 'hycx', -904265728, 15, 'phycxwjbuj', 338690048) ,  ('wphycxwjb', 8, 'o', 9, 'cowphycxwjbujz', -1862270976, 16, 'p', -2139750400) ,  ('epcowphycxwjbujz', 8, 'gepc', 1201864704, 'qgepcowphycxwj', 6, 17, 'uqgepco', 708247552) ,  ('puqg', 2054684672, 'gpuqg', 535625728, 'bgpuqgepcowphycx', 5, 18, 'jbgpuqgepc', 1705246720) ,  ('tjbg', 9, 'p', -1073414144, 'optjbg', -1697710080, 19, 'fopt', 3) ,  ('cfopt', 1128398848, 'fcfoptjbgpuqgep', 7, 'nfcfoptjbg', 936968192, 20, 'jnf', -273285120) ,  ('kjnfcfo', 355794944, 'dkjnfcf', 335085568, 'bdkjnf', 758906880, 21, 'sbdkjnfcf', 1008074752) ,  ('rsbdkjnfcf', 1875509248, 'drsbdkjnfcfoptj', 1727397888, 'fdrsb', 1, 22, 'yfdrsbdkj', 1474822144) ,  ('gyfdrsbdkjnf', 45285376, 'kgyfdrs', 974061568, 'mkgyfdrsbdkjn', -1668218880, 23, 'omkgyfdrsbdkjn', -58458112) ,  ('comkgyfd', -1164771328, 'zcomkgyfdrsbdkj', -1013317632, 'gzcomkg', 1416429568, 24, 'fgzcomkg', 1793327104) ,  ('mfgzcom', 1766064128, 'pmfgzcomk', -1383989248, 'hpmfgzco', 1601896448, 25, 'ahpmfg', 681836544) ,  ('a', -1822031872, 'paahp', -118751232, 'tpaah', 2126512128, 26, 'ptpaahpmfg', -1326776320) ,  ('rptpaa', 1248460800, 'urptpaahpmfgzcomk', 275382272, 'uurptpaah', -11665408, 27, 'muu', -1717960704) ,  ('cm', -890765312, 'icmuurp', 1123745792, 'hicmuurptpaahpmfgz', -950534144, 28, 'khicmuurpt', 1913192448) ,  ('fkhicmuurptpaahpmfgz', 1316421632, 'wfkh', -2072182784, 'awfkhicmuu', -221184000, 29, 'eawfk', -751042560) ,  ('qe', -1459093504, 'vq', -1414922240, 'xvqeawfk', 8, 30, 'xxvqeawfkhicmu', 7) ,  ('yxxvqeaw', 2, 'byxxvqeawfkhicmuu', 0, 'ybyxxvqeaw', 2, 31, 'bybyxxvqeawfk', 0) ,  ('fbybyxxvq', 8, 'xfbybyxxvq', 1982660608, 'kxfbybyxx', -1677918208, 32, 'wkx', 3) ,  ('fwkxfbybyxxv', -1577648128, 'mfwk', -886964224, 'tmfwkxfbybyxxv', 0, 33, 'wtmfwk', 0) ,  ('b', -594739200, 'cbwtmfwkx', 3, 'kcbwtmf', 7, 34, 'skcbwt', 9) ,  ('iskc', 1796603904, 'kisk', 1615462400, 'lkisk', 4, 35, 'blk', -1339752448) ,  ('pblkiskcbwtmf', 178257920, 'hpblkis', 1002569728, 'dhpblkis', -1605959680, 36, 'vdh', 7) ,  ('o', -2018312192, 'povdhpblkiskc', 616890368, 'ypovdhpblkis', 0, 37, 'typovdhpblkis', -147718144) ,  ('ptypovdhp', -556859392, 'eptypovdhpblk', 2, 'lep', 1432616960, 38, 'jleptypov', -428670976) ,  ('gjleptypovdhp', 838860800, 'igjleptyp', 0, 'tigjlepty', 1933574144, 39, 'u', -695664640) ,  ('t', 1293746176, 'ttutigjl', 50397184, 'xttutigjlep', 1463681024, 40, 'zxtt', -1210712064) ,  ('mzxttuti', 1154285568, 'x', 1683685376, 'l', -1337786368, 41, 'jlxm', 855375872) ,  ('rjlxm', 4, 'krjlxmzxttut', -291241984, 'n', 602013696, 42, 'dnkrjl', -1233649664) ,  ('fdnkrjlxmzxttut', -416940032, 'cfdnkrjlx', -803012608, 'ecfdnkrjlxmzxttu', -779943936, 43, 'zec', -1963917312) ,  ('qzecfdn', -806748160, 'iqze', 5, 'liqzecfdn', -819658752, 44, 'zliqzecfdn', 152240128) ,  ('bzl', 786432000, 'fbzliq', 4, 'mfbzl', 482738176, 45, 'm', 5) ,  ('r', 2, 'nrmmfbzliqzecfdn', 6, 'hnrmmfbzliqzecfd', 3, 46, 'whnrm', -35651584) ,  ('awhnrmmfb', -2133327872, 'saw', -525533184, 'us', -418512896, 47, 'vusawhnr', 3) ,  ('pvu', 417267712, 'gpvusawhnrmmfb', 353566720, 'cgpv', 8, 48, 'ecgpvusaw', -154992640) ,  ('xecgpvusawhn', -837615616, 'sxecg', 1, 'fsxecgpvusawhnrm', 1159004160, 49, 'gfsxecgpvusawhnrmmfb', 8) ,  ('ugfsxecgpvusawhnrm', -1065484288, 'vugfsxecgpv', -99287040, 'uvugfsx', 999882752, 50, 'xuvugfsxecgpvu', 3) ;
EXPLAIN INSERT INTO t7 VALUES  ('pxuvugfsxecgpvusawh', 394330112, 'epxuvugfsxecg', -416546816, 'je', 431751168, 51, 'vj', -1861025792) ,  ('zvjepxuv', -209256448, 'yzvj', 8, 'hyz', 1191182336, 52, 'ohyzvjep', 122093568) ,  ('oohyzvjep', 7, 'boohyzvjepxu', 1518600192, 'sboohyzvje', 4, 53, 'msb', 1722155008) ,  ('wmsboohyzvje', -879427584, 'lwmsboohyzvjep', 128450560, 'hlw', 1051918336, 54, 'bhlwmsbo', 0) ,  ('jbhlwmsboo', -217841664, 'hjbhlwm', -1595408384, 'nhjbhlwms', -1175453696, 55, 'z', 5) ,  ('pznhjbhl', 2, 'hpznhjbh', 1043529728, 'fhpznh', 5, 56, 'wfhpznhjbh', 7) ,  ('rwf', 1442709504, 'vrwfhpznhjbhlwmsboo', 172949504, 'dvrwfhpznhj', 8, 57, 'fdv', -149684224) ,  ('vfdvrwfhpz', 593428480, 'qvfdvrwfhpznhjbhl', -945356800, 'hqvfdvrwf', 1231028224, 58, 'jhqvfdvrwfh', 1564082176) ,  ('ljhq', -1305935872, 'tlj', 2083979264, 'rtl', 794755072, 59, 'b', 7) ,  ('gbr', 2, 'zgbrtljhqvfdvrwfh', 621150208, 'mzgbrtljh', -1326514176, 60, 'umzgbrtl', -1016922112) ,  ('numzgb', 476905472, 'hnumzgb', -191627264, 'nhnum', -1894121472, 61, 'n', 465895424) ,  ('onnhnu', 6, 'ionnhn', -1491992576, 'iionnhnu', 1164705792, 62, 'fiionnhnumzgbrtljhqv', 1039597568) ,  ('yfiionnhnumzgbrtljh', 74907648, 'eyfiionnh', 3, 'neyfii', 7, 63, 'ineyfiionnhnumzgbr', 5) ,  ('eineyfiio', 1297612800, 'mein', -555155456, 'lmeiney', -1851129856, 64, 'c', 450232320) ,  ('nclmei', 1527971840, 'anclmei', 1, 'lanc', 3, 65, 'jlanclmei', 1881276416) ,  ('yjlan', -794951680, 'xyj', 1088356352, 'zxyj', -1625948160, 66, 'nzx', 9) ,  ('lnzxyjlan', -1942749184, 'olnzxyjl', 4, 'polnzxyjlancl', -923795456, 67, 'dpol', 9) ,  ('odpolnz', -1232470016, 'oo', 945487872, 'zo', 992346112, 68, 'n', 1530593280) ,  ('sn', 197525504, 'asnz', 1910833152, 'easnzood', 1778253824, 69, 'ueasnzood', 7) ,  ('bueasnzo', 3, 'ibue', 6, 'hibueasn', -1502937088, 70, 'nh', 1983315968) ,  ('anh', -80674816, 'la', -502267904, 'mlanhibueasnzoo', 167772160, 71, 'amlanhibuea', -2001207296) ,  ('wamlanhibueasnzo', 1952448512, 'kwamlanhibueasnzoo', 34406400, 'jkwamlanhibueasnzood', 1643577344, 72, 'qjkwamlanhi', -2024800256) ,  ('oqj', -1734213632, 'ioqjk', -142409728, 'sioq', 893583360, 73, 'qsioqjkwamlanhibueas', 1462304768) ,  ('tqsioqjkwamlanhibue', 972816384, 'gtqsioqjkw', 8, 'ygt', 534315008, 74, 'ky', -1271005184) ,  ('ekygtqsioqjkwamlanhi', 1178468352, 'sekygtqsio', -74383360, 'asekygtqs', 1, 75, 'xasekygtqsioqj', 4) ,  ('dx', 1568145408, 'ldxasekyg', 1621360640, 'nldxasekygtqsioqjk', 958660608, 76, 'gnldx', -1711079424) ,  ('agnldxasekygtqsioqjk', 446038016, 'nagn', 0, 'lnagnldx', 0, 77, 'kl', 703856640) ,  ('okl', 1524826112, 'bo', 9, 'lbo', -33882112, 78, 'ilboklna', 0) ,  ('uilboklnagnldx', 1270022144, 'p', 350158848, 'upuilbok', 1231749120, 79, 'jupuilboklnagnl', 320733184) ,  ('zjup', 350552064, 'szjupuil', -1013317632, 'bszjupu', 3, 80, 'vbszj', 101974016) ,  ('ivbszjupuilboklnagn', 8, 'vivbszjupuil', 170393600, 'uvivbszjupuilboklnag', 6, 81, 'auv', -1082327040) ,  ('aau', 8, 'faauvivbszjupuilbok', -633143296, 'wfaauvivbs', -1667891200, 82, 'rwf', -126877696) ,  ('mr', 1676935168, 'emrwfaauvivbszj', 5, 'oemrwfaa', 1829371904, 83, 'ooemrwfa', -1256325120) ,  ('moo', -1656750080, 'fmooem', 202047488, 'u', -506265600, 84, 's', 3) ,  ('ysufmooemrwfaauvi', 1674182656, 'lysufmooem', -106364928, 'clysuf', -1735327744, 85, 'jclysufmo', 658571264) ,  ('jj', -530317312, 'gjjclysufm', 9, 'ug', 8, 86, 'iugjjclysuf', -765722624) ,  ('siugjjclysufmooe', 417595392, 'csiu', -1081212928, 'kcsiugj', 5, 87, 'lkcsiugjjc', -745406464) ,  ('tlkcsiug', 7, 'btlkcsiugjjcl', 8, 'mbtlkcsiug', 80347136, 88, 'gmbtlkcsiu', -1207107584) ,  ('pg', 1, 'jpgm', -2035286016, 'kj', 8, 89, 'y', 9) ,  ('aykjpgmbtl', -136577024, 'xa', -386072576, 'u', 9, 90, 'juxaykjpg', -1634992128) ,  ('yjuxaykjpg', 917635072, 'gyjux', 956891136, 'fgyjuxa', 2, 91, 'lfgyjuxaykjpgmbtlk', 9) ,  ('alf', 2, 'balfgyju', 1749024768, 'rb', 5, 92, 'mrbalfgyju', -141885440) ,  ('qmrbalfgyjuxaykjpgm', 5, 'gqmrbalfgyjuxaykj', 1646919680, 'kgqmrbalfg', 1378091008, 93, 'skgqmrbalfgyjuxa', -368574464) ,  ('kskgq', -798425088, 'ekskg', 1, 'nekskgqm', 455147520, 94, 'h', 6) ,  ('zhnek', -1397620736, 'mzhnekskgq', -1710227456, 'xmzhnek', 1765277696, 95, 'axmzhnek', -346095616) ,  ('caxmz', 8, 'wcax', 884736000, 'zwcax', 751632384, 96, 'dzw', 2) ,  ('mdzwcaxmzhnek', 0, 'hmdzwcaxmz', -978321408, 'qhmdzwcaxm', 2027618304, 97, 'iqh', 9) ,  ('ziqhmdzwca', -1694040064, 'kzi', 7, 'kkziqhmdzw', 4, 98, 'c', 0) ,  ('qckkziqhmdzwcaxmz', 1, 'jqckkziqhmdzwcaxmz', -1319960576, 'ujqckkzi', 6, 99, 'sujqckkziqhm', 3) ,  ('hsujqckkz', 830537728, 'yhsujq', 9, 'myhsujqck', 213581824, 100, 'tm', -1241579520) ;
Query Plan
==================================================
|ID|OPERATOR          |NAME|EST.ROWS|EST.TIME(us)|
--------------------------------------------------
|0 |DISTRIBUTED INSERT|    |50      |324         |
|1 |└─EXPRESSION      |    |50      |1           |
==================================================
Outputs & filters:
-------------------------------------
  0 - output(nil), filter(nil)
      columns([{T7: ({T7: (T7.PK, T7.COL_VARCHAR_20_NOT_NULL, T7.COL_NUMBER, T7.COL_VARCHAR_20, T7.COL_NUMBER_NOT_NULL, T7.COL_CHAR_20, T7.COL_INT, T7.COL_CHAR_20_NOT_NULL,
       T7.COL_INT_NOT_NULL)})}]), 
      column_values([column_conv(NUMBER,PS:(-1,0),NOT NULL,__values.PK)], [column_conv(VARCHAR2,utf8mb4_bin,length:20,NOT NULL,__values.COL_VARCHAR_20_NOT_NULL)],
       [column_conv(NUMBER,PS:(-1,-85),NULL,__values.COL_NUMBER)], [column_conv(VARCHAR2,utf8mb4_bin,length:20,NULL,__values.COL_VARCHAR_20)], [column_conv(NUMBER,
      PS:(-1,-85),NOT NULL,__values.COL_NUMBER_NOT_NULL)], [column_conv(CHAR,utf8mb4_bin,length:20,NULL,__values.COL_CHAR_20)], [column_conv(NUMBER,PS:(-1,0),
      NULL,__values.COL_INT)], [column_conv(CHAR,utf8mb4_bin,length:20,NOT NULL,__values.COL_CHAR_20_NOT_NULL)], [column_conv(NUMBER,PS:(-1,0),NOT NULL,__values.COL_INT_NOT_NULL)])
  1 - output([__values.COL_VARCHAR_20_NOT_NULL], [__values.COL_NUMBER], [__values.COL_VARCHAR_20], [__values.COL_NUMBER_NOT_NULL], [__values.COL_CHAR_20],
       [__values.COL_INT], [__values.PK], [__values.COL_CHAR_20_NOT_NULL], [__values.COL_INT_NOT_NULL]), filter(nil)
      values({'pxuvugfsxecgpvusawh', 394330112, 'epxuvugfsxecg', -416546816, 'je', 431751168, 51, 'vj', -1861025792}, {'zvjepxuv', -209256448, 'yzvj', 8,
       'hyz', 1191182336, 52, 'ohyzvjep', 122093568}, {'oohyzvjep', 7, 'boohyzvjepxu', 1518600192, 'sboohyzvje', 4, 53, 'msb', 1722155008}, {'wmsboohyzvje', -879427584,
       'lwmsboohyzvjep', 128450560, 'hlw', 1051918336, 54, 'bhlwmsbo', 0}, {'jbhlwmsboo', -217841664, 'hjbhlwm', -1595408384, 'nhjbhlwms', -1175453696, 55, 'z',
       5}, {'pznhjbhl', 2, 'hpznhjbh', 1043529728, 'fhpznh', 5, 56, 'wfhpznhjbh', 7}, {'rwf', 1442709504, 'vrwfhpznhjbhlwmsboo', 172949504, 'dvrwfhpznhj', 8, 
      57, 'fdv', -149684224}, {'vfdvrwfhpz', 593428480, 'qvfdvrwfhpznhjbhl', -945356800, 'hqvfdvrwf', 1231028224, 58, 'jhqvfdvrwfh', 1564082176}, {'ljhq', -1305935872,
       'tlj', 2083979264, 'rtl', 794755072, 59, 'b', 7}, {'gbr', 2, 'zgbrtljhqvfdvrwfh', 621150208, 'mzgbrtljh', -1326514176, 60, 'umzgbrtl', -1016922112}, {'numzgb',
       476905472, 'hnumzgb', -191627264, 'nhnum', -1894121472, 61, 'n', 465895424}, {'onnhnu', 6, 'ionnhn', -1491992576, 'iionnhnu', 1164705792, 62, 'fiionnhnumzgbrtljhqv',
       1039597568}, {'yfiionnhnumzgbrtljh', 74907648, 'eyfiionnh', 3, 'neyfii', 7, 63, 'ineyfiionnhnumzgbr', 5}, {'eineyfiio', 1297612800, 'mein', -555155456,
       'lmeiney', -1851129856, 64, 'c', 450232320}, {'nclmei', 1527971840, 'anclmei', 1, 'lanc', 3, 65, 'jlanclmei', 1881276416}, {'yjlan', -794951680, 'xyj',
       1088356352, 'zxyj', -1625948160, 66, 'nzx', 9}, {'lnzxyjlan', -1942749184, 'olnzxyjl', 4, 'polnzxyjlancl', -923795456, 67, 'dpol', 9}, {'odpolnz', -1232470016,
       'oo', 945487872, 'zo', 992346112, 68, 'n', 1530593280}, {'sn', 197525504, 'asnz', 1910833152, 'easnzood', 1778253824, 69, 'ueasnzood', 7}, {'bueasnzo',
       3, 'ibue', 6, 'hibueasn', -1502937088, 70, 'nh', 1983315968}, {'anh', -80674816, 'la', -502267904, 'mlanhibueasnzoo', 167772160, 71, 'amlanhibuea', -2001207296},
       {'wamlanhibueasnzo', 1952448512, 'kwamlanhibueasnzoo', 34406400, 'jkwamlanhibueasnzood', 1643577344, 72, 'qjkwamlanhi', -2024800256}, {'oqj', -1734213632,
       'ioqjk', -142409728, 'sioq', 893583360, 73, 'qsioqjkwamlanhibueas', 1462304768}, {'tqsioqjkwamlanhibue', 972816384, 'gtqsioqjkw', 8, 'ygt', 534315008, 
      74, 'ky', -1271005184}, {'ekygtqsioqjkwamlanhi', 1178468352, 'sekygtqsio', -74383360, 'asekygtqs', 1, 75, 'xasekygtqsioqj', 4}, {'dx', 1568145408, 'ldxasekyg',
       1621360640, 'nldxasekygtqsioqjk', 958660608, 76, 'gnldx', -1711079424}, {'agnldxasekygtqsioqjk', 446038016, 'nagn', 0, 'lnagnldx', 0, 77, 'kl', 703856640},
       {'okl', 1524826112, 'bo', 9, 'lbo', -33882112, 78, 'ilboklna', 0}, {'uilboklnagnldx', 1270022144, 'p', 350158848, 'upuilbok', 1231749120, 79, 'jupuilboklnagnl',
       320733184}, {'zjup', 350552064, 'szjupuil', -1013317632, 'bszjupu', 3, 80, 'vbszj', 101974016}, {'ivbszjupuilboklnagn', 8, 'vivbszjupuil', 170393600, 'uvivbszjupuilboklnag',
       6, 81, 'auv', -1082327040}, {'aau', 8, 'faauvivbszjupuilbok', -633143296, 'wfaauvivbs', -1667891200, 82, 'rwf', -126877696}, {'mr', 1676935168, 'emrwfaauvivbszj',
       5, 'oemrwfaa', 1829371904, 83, 'ooemrwfa', -1256325120}, {'moo', -1656750080, 'fmooem', 202047488, 'u', -506265600, 84, 's', 3}, {'ysufmooemrwfaauvi', 
      1674182656, 'lysufmooem', -106364928, 'clysuf', -1735327744, 85, 'jclysufmo', 658571264}, {'jj', -530317312, 'gjjclysufm', 9, 'ug', 8, 86, 'iugjjclysuf',
       -765722624}, {'siugjjclysufmooe', 417595392, 'csiu', -1081212928, 'kcsiugj', 5, 87, 'lkcsiugjjc', -745406464}, {'tlkcsiug', 7, 'btlkcsiugjjcl', 8, 'mbtlkcsiug',
       80347136, 88, 'gmbtlkcsiu', -1207107584}, {'pg', 1, 'jpgm', -2035286016, 'kj', 8, 89, 'y', 9}, {'aykjpgmbtl', -136577024, 'xa', -386072576, 'u', 9, 90,
       'juxaykjpg', -1634992128}, {'yjuxaykjpg', 917635072, 'gyjux', 956891136, 'fgyjuxa', 2, 91, 'lfgyjuxaykjpgmbtlk', 9}, {'alf', 2, 'balfgyju', 1749024768,
       'rb', 5, 92, 'mrbalfgyju', -141885440}, {'qmrbalfgyjuxaykjpgm', 5, 'gqmrbalfgyjuxaykj', 1646919680, 'kgqmrbalfg', 1378091008, 93, 'skgqmrbalfgyjuxa', -368574464},
       {'kskgq', -798425088, 'ekskg', 1, 'nekskgqm', 455147520, 94, 'h', 6}, {'zhnek', -1397620736, 'mzhnekskgq', -1710227456, 'xmzhnek', 1765277696, 95, 'axmzhnek',
       -346095616}, {'caxmz', 8, 'wcax', 884736000, 'zwcax', 751632384, 96, 'dzw', 2}, {'mdzwcaxmzhnek', 0, 'hmdzwcaxmz', -978321408, 'qhmdzwcaxm', 2027618304,
       97, 'iqh', 9}, {'ziqhmdzwca', -1694040064, 'kzi', 7, 'kkziqhmdzw', 4, 98, 'c', 0}, {'qckkziqhmdzwcaxmz', 1, 'jqckkziqhmdzwcaxmz', -1319960576, 'ujqckkzi',
       6, 99, 'sujqckkziqhm', 3}, {'hsujqckkz', 830537728, 'yhsujq', 9, 'myhsujqck', 213581824, 100, 'tm', -1241579520})
INSERT INTO t7 VALUES  ('pxuvugfsxecgpvusawh', 394330112, 'epxuvugfsxecg', -416546816, 'je', 431751168, 51, 'vj', -1861025792) ,  ('zvjepxuv', -209256448, 'yzvj', 8, 'hyz', 1191182336, 52, 'ohyzvjep', 122093568) ,  ('oohyzvjep', 7, 'boohyzvjepxu', 1518600192, 'sboohyzvje', 4, 53, 'msb', 1722155008) ,  ('wmsboohyzvje', -879427584, 'lwmsboohyzvjep', 128450560, 'hlw', 1051918336, 54, 'bhlwmsbo', 0) ,  ('jbhlwmsboo', -217841664, 'hjbhlwm', -1595408384, 'nhjbhlwms', -1175453696, 55, 'z', 5) ,  ('pznhjbhl', 2, 'hpznhjbh', 1043529728, 'fhpznh', 5, 56, 'wfhpznhjbh', 7) ,  ('rwf', 1442709504, 'vrwfhpznhjbhlwmsboo', 172949504, 'dvrwfhpznhj', 8, 57, 'fdv', -149684224) ,  ('vfdvrwfhpz', 593428480, 'qvfdvrwfhpznhjbhl', -945356800, 'hqvfdvrwf', 1231028224, 58, 'jhqvfdvrwfh', 1564082176) ,  ('ljhq', -1305935872, 'tlj', 2083979264, 'rtl', 794755072, 59, 'b', 7) ,  ('gbr', 2, 'zgbrtljhqvfdvrwfh', 621150208, 'mzgbrtljh', -1326514176, 60, 'umzgbrtl', -1016922112) ,  ('numzgb', 476905472, 'hnumzgb', -191627264, 'nhnum', -1894121472, 61, 'n', 465895424) ,  ('onnhnu', 6, 'ionnhn', -1491992576, 'iionnhnu', 1164705792, 62, 'fiionnhnumzgbrtljhqv', 1039597568) ,  ('yfiionnhnumzgbrtljh', 74907648, 'eyfiionnh', 3, 'neyfii', 7, 63, 'ineyfiionnhnumzgbr', 5) ,  ('eineyfiio', 1297612800, 'mein', -555155456, 'lmeiney', -1851129856, 64, 'c', 450232320) ,  ('nclmei', 1527971840, 'anclmei', 1, 'lanc', 3, 65, 'jlanclmei', 1881276416) ,  ('yjlan', -794951680, 'xyj', 1088356352, 'zxyj', -1625948160, 66, 'nzx', 9) ,  ('lnzxyjlan', -1942749184, 'olnzxyjl', 4, 'polnzxyjlancl', -923795456, 67, 'dpol', 9) ,  ('odpolnz', -1232470016, 'oo', 945487872, 'zo', 992346112, 68, 'n', 1530593280) ,  ('sn', 197525504, 'asnz', 1910833152, 'easnzood', 1778253824, 69, 'ueasnzood', 7) ,  ('bueasnzo', 3, 'ibue', 6, 'hibueasn', -1502937088, 70, 'nh', 1983315968) ,  ('anh', -80674816, 'la', -502267904, 'mlanhibueasnzoo', 167772160, 71, 'amlanhibuea', -2001207296) ,  ('wamlanhibueasnzo', 1952448512, 'kwamlanhibueasnzoo', 34406400, 'jkwamlanhibueasnzood', 1643577344, 72, 'qjkwamlanhi', -2024800256) ,  ('oqj', -1734213632, 'ioqjk', -142409728, 'sioq', 893583360, 73, 'qsioqjkwamlanhibueas', 1462304768) ,  ('tqsioqjkwamlanhibue', 972816384, 'gtqsioqjkw', 8, 'ygt', 534315008, 74, 'ky', -1271005184) ,  ('ekygtqsioqjkwamlanhi', 1178468352, 'sekygtqsio', -74383360, 'asekygtqs', 1, 75, 'xasekygtqsioqj', 4) ,  ('dx', 1568145408, 'ldxasekyg', 1621360640, 'nldxasekygtqsioqjk', 958660608, 76, 'gnldx', -1711079424) ,  ('agnldxasekygtqsioqjk', 446038016, 'nagn', 0, 'lnagnldx', 0, 77, 'kl', 703856640) ,  ('okl', 1524826112, 'bo', 9, 'lbo', -33882112, 78, 'ilboklna', 0) ,  ('uilboklnagnldx', 1270022144, 'p', 350158848, 'upuilbok', 1231749120, 79, 'jupuilboklnagnl', 320733184) ,  ('zjup', 350552064, 'szjupuil', -1013317632, 'bszjupu', 3, 80, 'vbszj', 101974016) ,  ('ivbszjupuilboklnagn', 8, 'vivbszjupuil', 170393600, 'uvivbszjupuilboklnag', 6, 81, 'auv', -1082327040) ,  ('aau', 8, 'faauvivbszjupuilbok', -633143296, 'wfaauvivbs', -1667891200, 82, 'rwf', -126877696) ,  ('mr', 1676935168, 'emrwfaauvivbszj', 5, 'oemrwfaa', 1829371904, 83, 'ooemrwfa', -1256325120) ,  ('moo', -1656750080, 'fmooem', 202047488, 'u', -506265600, 84, 's', 3) ,  ('ysufmooemrwfaauvi', 1674182656, 'lysufmooem', -106364928, 'clysuf', -1735327744, 85, 'jclysufmo', 658571264) ,  ('jj', -530317312, 'gjjclysufm', 9, 'ug', 8, 86, 'iugjjclysuf', -765722624) ,  ('siugjjclysufmooe', 417595392, 'csiu', -1081212928, 'kcsiugj', 5, 87, 'lkcsiugjjc', -745406464) ,  ('tlkcsiug', 7, 'btlkcsiugjjcl', 8, 'mbtlkcsiug', 80347136, 88, 'gmbtlkcsiu', -1207107584) ,  ('pg', 1, 'jpgm', -2035286016, 'kj', 8, 89, 'y', 9) ,  ('aykjpgmbtl', -136577024, 'xa', -386072576, 'u', 9, 90, 'juxaykjpg', -1634992128) ,  ('yjuxaykjpg', 917635072, 'gyjux', 956891136, 'fgyjuxa', 2, 91, 'lfgyjuxaykjpgmbtlk', 9) ,  ('alf', 2, 'balfgyju', 1749024768, 'rb', 5, 92, 'mrbalfgyju', -141885440) ,  ('qmrbalfgyjuxaykjpgm', 5, 'gqmrbalfgyjuxaykj', 1646919680, 'kgqmrbalfg', 1378091008, 93, 'skgqmrbalfgyjuxa', -368574464) ,  ('kskgq', -798425088, 'ekskg', 1, 'nekskgqm', 455147520, 94, 'h', 6) ,  ('zhnek', -1397620736, 'mzhnekskgq', -1710227456, 'xmzhnek', 1765277696, 95, 'axmzhnek', -346095616) ,  ('caxmz', 8, 'wcax', 884736000, 'zwcax', 751632384, 96, 'dzw', 2) ,  ('mdzwcaxmzhnek', 0, 'hmdzwcaxmz', -978321408, 'qhmdzwcaxm', 2027618304, 97, 'iqh', 9) ,  ('ziqhmdzwca', -1694040064, 'kzi', 7, 'kkziqhmdzw', 4, 98, 'c', 0) ,  ('qckkziqhmdzwcaxmz', 1, 'jqckkziqhmdzwcaxmz', -1319960576, 'ujqckkzi', 6, 99, 'sujqckkziqhm', 3) ,  ('hsujqckkz', 830537728, 'yhsujq', 9, 'myhsujqck', 213581824, 100, 'tm', -1241579520) ;

CREATE TABLE t8 (
col_varchar_20_not_null varchar(20) not null,
col_char_20_not_null char(20) not null,
col_number_not_null number not null,
pk int,
col_int_not_null int not null,
col_char_20 char(20),
col_number number,
col_varchar_20 varchar(20),
col_int int,
/*Indices*/
primary key (pk) ) ;
EXPLAIN INSERT INTO t8 VALUES  ('htmyhsujqck', 'dhtmyh', 4, 1, -1460862976, 'cdhtmyhsujqckk', 9, 'ocdhtmyhsujqckkziq', 5) ,  ('qocdhtm', 'iqocdhtmyhs', 662503424, 2, 4, 'tiqocd', 7, 'vtiqocdhtmyhsujqckk', 1229914112) ,  ('qvtiqocdhtmyh', 'rqvti', 494272512, 3, -3670016, 'brqvtiqo', 9, 'dbrqvtiq', -414842880) ,  ('ldbrqvti', 'rld', 1785790464, 4, -1589968896, 'irld', -1837826048, 'kirldbrq', 3) ,  ('vki', 'xvkirldbrqvtiqoc', 351600640, 5, 5, 'exvk', -1783889920, 'hexvk', 6) ,  ('yhexvkirld', 'ryhe', 8, 6, 726925312, 'zryhexvkirl', 1860501504, 'gz', 9) ,  ('bgz', 'tbgzr', 9, 7, 729546752, 'gtbgzr', 6, 'ugtb', 4) ,  ('lugtbgzryhexvkir', 'jl', -1959526400, 8, 2000355328, 'j', 1519648768, 'qjjlugtbgzryhe', -2003501056) ,  ('k', 'gkqjjlugtb', 883949568, 9, -90308608, 'pgkqjjlugt', 444137472, 'lpgkqjjl', 6) ,  ('rlpgkqjjlugtb', 'arlpgkqj', 6, 10, -1356333056, 'parlpgkqjjlug', 8, 'fpa', -1951006720) ,  ('pfparl', 'spfpar', -1898577920, 11, -135266304, 'ospfp', -430309376, 'o', -1209794560) ,  ('goos', 'ug', 8, 12, 2, 'cugo', -1349320704, 'icugoospf', 1) ,  ('eicug', 'peicugo', -698155008, 13, -931725312, 's', 1589379072, 'nspeicugoo', 6) ,  ('jnspe', 'hjnspeicugo', 9, 14, -100859904, 'yhjnspeic', 1732509696, 'ayh', 6) ,  ('aayhjnspeicu', 'zaayhjns', 4, 15, 5, 'i', 1, 'vizaayhjnspeicugoos', 3) ,  ('mvi', 'om', 8, 16, -642580480, 'aomv', 7, 'taomviz', -1523318784) ,  ('ytaomvizaayhjnspei', 'ry', -1907163136, 17, 7, 'qryt', -902168576, 'iqrytaom', 1176698880) ,  ('liqr', 'nliqryt', 5, 18, 1325137920, 'pn', 5, 'lpnliqrytaomvizaay', -567148544) ,  ('clp', 'zcl', -1920532480, 19, 9, 'bzclpn', -1113784320, 'kb', 1) ,  ('qkbzclpnliqrytaom', 'rqkbzcl', 1258422272, 20, 7, 'prqkbzcl', 4, 'kprqkbzclp', 1581187072) ,  ('wkprqkbzc', 'dwkprqkbzc', 271319040, 21, -1115684864, 'xdwkprqkbz', -183959552, 'oxdwkprqk', -1294663680) ,  ('l', 'p', 6, 22, 1001783296, 'hploxdwkprqkbzclp', -1303117824, 'x', 8) ,  ('vxhploxd', 'ivxhpl', 7, 23, -1211957248, 'mivxhploxdwkprqk', -2143485952, 'rmiv', 5) ,  ('ir', 'nirmiv', -518651904, 24, 7, 'fnirmivxhpl', -1336147968, 'zfnirmivxhploxdwkprq', 1230962688) ,  ('jzfnirmi', 'rjzfni', -1973420032, 25, -325124096, 'wrj', -225771520, 'gwrjzfnirmivxhploxd', 2) ,  ('mgwrjzfnirmivxhplo', 'tmgwrjzfnirmivxhpl', 5, 26, 311820288, 'mtmgw', 4, 'kmtmgw', -416808960) ,  ('zkmtmgwrjzfnirmiv', 'nzkmt', 1203109888, 27, -674955264, 'znzkmtmgwr', -374472704, 'bznz', 897253376) ,  ('fbz', 'afbznzkmtmg', -870776832, 28, -478543872, 'aafb', 2097545216, 'waafbznzkmtmgwrjzfn', -314376192) ,  ('pwaafbznz', 'ipwaafbznzkmtmgwrjzf', -168493056, 29, 6, 'uip', 39452672, 'fuipwaa', 4) ,  ('n', 'znfuipwaafbznzkm', 849477632, 30, -2020737024, 'tznfuipwaa', -739377152, 'mtzn', 1) ,  ('jmtzn', 'sjm', 71368704, 31, 0, 'usjmtznfuipw', 5, 'cus', 6) ,  ('ccusjmtz', 'uccusjmtzn', -1638858752, 32, 569507840, 'muccusjmtznfuipw', -1358299136, 'mmuccusjmtznfuipwaaf', 519438336) ,  ('v', 'hvmmucc', -1904148480, 33, 1679687680, 'l', -52559872, 'ulhvmmuccusjmtznfu', 1127546880) ,  ('mulhvm', 'mmulh', 7, 34, 8, 'pmmulhvm', 768344064, 'jpmmulh', 2000814080) ,  ('rjpmmulh', 'trjpmmulhvmm', -807403520, 35, 9, 'ctrj', 6, 'dc', 707133440) ,  ('tdct', 'ftdctrjpmmulhvmmucc', 1189806080, 36, 551878656, 'qftdct', 8, 'pqft', 1345126400) ,  ('ppqftdctrjpmmul', 'z', 9, 37, 6, 'dzpp', 1281490944, 'hdzppqftdctrjp', -987758592) ,  ('mhdzppqftd', 'emhd', 1642725376, 38, 1567490048, 'memhdz', 6, 'omemhdzpp', 9) ,  ('vomemhdzppqftdc', 'cvomemhdzppqft', -1563099136, 39, -2140340224, 'fcv', -1806106624, 'a', 286982144) ,  ('na', 'jnafcvomemhdzp', 850067456, 40, -1593442304, 'mj', 1926889472, 'imjn', 2) ,  ('oi', 'uoimj', 0, 41, 1147273216, 'tuoimjn', 8, 'stuoimjnafcvomemhd', 1549271040) ,  ('dstuoimjnafcv', 'edstuoim', 8, 42, -445579264, 'pedstuo', 5, 'zpedstuoimjna', 6) ,  ('izpedstuoi', 'qizpedstuoimjnafc', -477298688, 43, 2, 'rqizp', 1680670720, 'grq', -939851776) ,  ('l', 'tlgrqizp', -522715136, 44, 5, 'itlgrqizpedstuoim', 1155661824, 'jitlgrqizp', 6) ,  ('g', 'e', 3, 45, 925106176, 'hegjitlgrqizpedstuo', 4, 'uhegjitlgrq', -1451425792) ,  ('tuhegji', 'c', -2132934656, 46, 4, 'tctuhegjitlgrqi', 728891392, 'vtctu', 1375010816) ,  ('avt', 'r', 6, 47, 2, 'fravtctuhegjitlgrqiz', 734527488, 'afravtc', 4) ,  ('zafra', 'xza', 1283784704, 48, 1951924224, 'sxza', 7, 'vsxzafrav', -1536163840) ,  ('jvsxzafrav', 'djvs', -1905393664, 49, 2, 'zdjvsxzaf', -1919156224, 'rzdjvs', -1441333248) ,  ('urzdjv', 'rurzdjvsxzafravtc', 898826240, 50, -1940389888, 'arurzd', -1251475456, 'nar', -637861888) ;
Query Plan
==================================================
|ID|OPERATOR          |NAME|EST.ROWS|EST.TIME(us)|
--------------------------------------------------
|0 |DISTRIBUTED INSERT|    |50      |324         |
|1 |└─EXPRESSION      |    |50      |1           |
==================================================
Outputs & filters:
-------------------------------------
  0 - output(nil), filter(nil)
      columns([{T8: ({T8: (T8.PK, T8.COL_VARCHAR_20_NOT_NULL, T8.COL_CHAR_20_NOT_NULL, T8.COL_NUMBER_NOT_NULL, T8.COL_INT_NOT_NULL, T8.COL_CHAR_20, T8.COL_NUMBER,
       T8.COL_VARCHAR_20, T8.COL_INT)})}]), 
      column_values([column_conv(NUMBER,PS:(-1,0),NOT NULL,__values.PK)], [column_conv(VARCHAR2,utf8mb4_bin,length:20,NOT NULL,__values.COL_VARCHAR_20_NOT_NULL)],
       [column_conv(CHAR,utf8mb4_bin,length:20,NOT NULL,__values.COL_CHAR_20_NOT_NULL)], [column_conv(NUMBER,PS:(-1,-85),NOT NULL,__values.COL_NUMBER_NOT_NULL)],
       [column_conv(NUMBER,PS:(-1,0),NOT NULL,__values.COL_INT_NOT_NULL)], [column_conv(CHAR,utf8mb4_bin,length:20,NULL,__values.COL_CHAR_20)], [column_conv(NUMBER,
      PS:(-1,-85),NULL,__values.COL_NUMBER)], [column_conv(VARCHAR2,utf8mb4_bin,length:20,NULL,__values.COL_VARCHAR_20)], [column_conv(NUMBER,PS:(-1,0),NULL,__values.COL_INT)])
  1 - output([__values.COL_VARCHAR_20_NOT_NULL], [__values.COL_CHAR_20_NOT_NULL], [__values.COL_NUMBER_NOT_NULL], [__values.PK], [__values.COL_INT_NOT_NULL],
       [__values.COL_CHAR_20], [__values.COL_NUMBER], [__values.COL_VARCHAR_20], [__values.COL_INT]), filter(nil)
      values({'htmyhsujqck', 'dhtmyh', 4, 1, -1460862976, 'cdhtmyhsujqckk', 9, 'ocdhtmyhsujqckkziq', 5}, {'qocdhtm', 'iqocdhtmyhs', 662503424, 2, 4, 'tiqocd',
       7, 'vtiqocdhtmyhsujqckk', 1229914112}, {'qvtiqocdhtmyh', 'rqvti', 494272512, 3, -3670016, 'brqvtiqo', 9, 'dbrqvtiq', -414842880}, {'ldbrqvti', 'rld', 1785790464,
       4, -1589968896, 'irld', -1837826048, 'kirldbrq', 3}, {'vki', 'xvkirldbrqvtiqoc', 351600640, 5, 5, 'exvk', -1783889920, 'hexvk', 6}, {'yhexvkirld', 'ryhe',
       8, 6, 726925312, 'zryhexvkirl', 1860501504, 'gz', 9}, {'bgz', 'tbgzr', 9, 7, 729546752, 'gtbgzr', 6, 'ugtb', 4}, {'lugtbgzryhexvkir', 'jl', -1959526400,
       8, 2000355328, 'j', 1519648768, 'qjjlugtbgzryhe', -2003501056}, {'k', 'gkqjjlugtb', 883949568, 9, -90308608, 'pgkqjjlugt', 444137472, 'lpgkqjjl', 6}, {'rlpgkqjjlugtb',
       'arlpgkqj', 6, 10, -1356333056, 'parlpgkqjjlug', 8, 'fpa', -1951006720}, {'pfparl', 'spfpar', -1898577920, 11, -135266304, 'ospfp', -430309376, 'o', -1209794560},
       {'goos', 'ug', 8, 12, 2, 'cugo', -1349320704, 'icugoospf', 1}, {'eicug', 'peicugo', -698155008, 13, -931725312, 's', 1589379072, 'nspeicugoo', 6}, {'jnspe',
       'hjnspeicugo', 9, 14, -100859904, 'yhjnspeic', 1732509696, 'ayh', 6}, {'aayhjnspeicu', 'zaayhjns', 4, 15, 5, 'i', 1, 'vizaayhjnspeicugoos', 3}, {'mvi',
       'om', 8, 16, -642580480, 'aomv', 7, 'taomviz', -1523318784}, {'ytaomvizaayhjnspei', 'ry', -1907163136, 17, 7, 'qryt', -902168576, 'iqrytaom', 1176698880},
       {'liqr', 'nliqryt', 5, 18, 1325137920, 'pn', 5, 'lpnliqrytaomvizaay', -567148544}, {'clp', 'zcl', -1920532480, 19, 9, 'bzclpn', -1113784320, 'kb', 1}, 
      {'qkbzclpnliqrytaom', 'rqkbzcl', 1258422272, 20, 7, 'prqkbzcl', 4, 'kprqkbzclp', 1581187072}, {'wkprqkbzc', 'dwkprqkbzc', 271319040, 21, -1115684864, 'xdwkprqkbz',
       -183959552, 'oxdwkprqk', -1294663680}, {'l', 'p', 6, 22, 1001783296, 'hploxdwkprqkbzclp', -1303117824, 'x', 8}, {'vxhploxd', 'ivxhpl', 7, 23, -1211957248,
       'mivxhploxdwkprqk', -2143485952, 'rmiv', 5}, {'ir', 'nirmiv', -518651904, 24, 7, 'fnirmivxhpl', -1336147968, 'zfnirmivxhploxdwkprq', 1230962688}, {'jzfnirmi',
       'rjzfni', -1973420032, 25, -325124096, 'wrj', -225771520, 'gwrjzfnirmivxhploxd', 2}, {'mgwrjzfnirmivxhplo', 'tmgwrjzfnirmivxhpl', 5, 26, 311820288, 'mtmgw',
       4, 'kmtmgw', -416808960}, {'zkmtmgwrjzfnirmiv', 'nzkmt', 1203109888, 27, -674955264, 'znzkmtmgwr', -374472704, 'bznz', 897253376}, {'fbz', 'afbznzkmtmg',
       -870776832, 28, -478543872, 'aafb', 2097545216, 'waafbznzkmtmgwrjzfn', -314376192}, {'pwaafbznz', 'ipwaafbznzkmtmgwrjzf', -168493056, 29, 6, 'uip', 39452672,
       'fuipwaa', 4}, {'n', 'znfuipwaafbznzkm', 849477632, 30, -2020737024, 'tznfuipwaa', -739377152, 'mtzn', 1}, {'jmtzn', 'sjm', 71368704, 31, 0, 'usjmtznfuipw',
       5, 'cus', 6}, {'ccusjmtz', 'uccusjmtzn', -1638858752, 32, 569507840, 'muccusjmtznfuipw', -1358299136, 'mmuccusjmtznfuipwaaf', 519438336}, {'v', 'hvmmucc',
       -1904148480, 33, 1679687680, 'l', -52559872, 'ulhvmmuccusjmtznfu', 1127546880}, {'mulhvm', 'mmulh', 7, 34, 8, 'pmmulhvm', 768344064, 'jpmmulh', 2000814080},
       {'rjpmmulh', 'trjpmmulhvmm', -807403520, 35, 9, 'ctrj', 6, 'dc', 707133440}, {'tdct', 'ftdctrjpmmulhvmmucc', 1189806080, 36, 551878656, 'qftdct', 8, 'pqft',
       1345126400}, {'ppqftdctrjpmmul', 'z', 9, 37, 6, 'dzpp', 1281490944, 'hdzppqftdctrjp', -987758592}, {'mhdzppqftd', 'emhd', 1642725376, 38, 1567490048, 'memhdz',
       6, 'omemhdzpp', 9}, {'vomemhdzppqftdc', 'cvomemhdzppqft', -1563099136, 39, -2140340224, 'fcv', -1806106624, 'a', 286982144}, {'na', 'jnafcvomemhdzp', 850067456,
       40, -1593442304, 'mj', 1926889472, 'imjn', 2}, {'oi', 'uoimj', 0, 41, 1147273216, 'tuoimjn', 8, 'stuoimjnafcvomemhd', 1549271040}, {'dstuoimjnafcv', 'edstuoim',
       8, 42, -445579264, 'pedstuo', 5, 'zpedstuoimjna', 6}, {'izpedstuoi', 'qizpedstuoimjnafc', -477298688, 43, 2, 'rqizp', 1680670720, 'grq', -939851776}, {'l',
       'tlgrqizp', -522715136, 44, 5, 'itlgrqizpedstuoim', 1155661824, 'jitlgrqizp', 6}, {'g', 'e', 3, 45, 925106176, 'hegjitlgrqizpedstuo', 4, 'uhegjitlgrq',
       -1451425792}, {'tuhegji', 'c', -2132934656, 46, 4, 'tctuhegjitlgrqi', 728891392, 'vtctu', 1375010816}, {'avt', 'r', 6, 47, 2, 'fravtctuhegjitlgrqiz', 734527488,
       'afravtc', 4}, {'zafra', 'xza', 1283784704, 48, 1951924224, 'sxza', 7, 'vsxzafrav', -1536163840}, {'jvsxzafrav', 'djvs', -1905393664, 49, 2, 'zdjvsxzaf',
       -1919156224, 'rzdjvs', -1441333248}, {'urzdjv', 'rurzdjvsxzafravtc', 898826240, 50, -1940389888, 'arurzd', -1251475456, 'nar', -637861888})
INSERT INTO t8 VALUES  ('htmyhsujqck', 'dhtmyh', 4, 1, -1460862976, 'cdhtmyhsujqckk', 9, 'ocdhtmyhsujqckkziq', 5) ,  ('qocdhtm', 'iqocdhtmyhs', 662503424, 2, 4, 'tiqocd', 7, 'vtiqocdhtmyhsujqckk', 1229914112) ,  ('qvtiqocdhtmyh', 'rqvti', 494272512, 3, -3670016, 'brqvtiqo', 9, 'dbrqvtiq', -414842880) ,  ('ldbrqvti', 'rld', 1785790464, 4, -1589968896, 'irld', -1837826048, 'kirldbrq', 3) ,  ('vki', 'xvkirldbrqvtiqoc', 351600640, 5, 5, 'exvk', -1783889920, 'hexvk', 6) ,  ('yhexvkirld', 'ryhe', 8, 6, 726925312, 'zryhexvkirl', 1860501504, 'gz', 9) ,  ('bgz', 'tbgzr', 9, 7, 729546752, 'gtbgzr', 6, 'ugtb', 4) ,  ('lugtbgzryhexvkir', 'jl', -1959526400, 8, 2000355328, 'j', 1519648768, 'qjjlugtbgzryhe', -2003501056) ,  ('k', 'gkqjjlugtb', 883949568, 9, -90308608, 'pgkqjjlugt', 444137472, 'lpgkqjjl', 6) ,  ('rlpgkqjjlugtb', 'arlpgkqj', 6, 10, -1356333056, 'parlpgkqjjlug', 8, 'fpa', -1951006720) ,  ('pfparl', 'spfpar', -1898577920, 11, -135266304, 'ospfp', -430309376, 'o', -1209794560) ,  ('goos', 'ug', 8, 12, 2, 'cugo', -1349320704, 'icugoospf', 1) ,  ('eicug', 'peicugo', -698155008, 13, -931725312, 's', 1589379072, 'nspeicugoo', 6) ,  ('jnspe', 'hjnspeicugo', 9, 14, -100859904, 'yhjnspeic', 1732509696, 'ayh', 6) ,  ('aayhjnspeicu', 'zaayhjns', 4, 15, 5, 'i', 1, 'vizaayhjnspeicugoos', 3) ,  ('mvi', 'om', 8, 16, -642580480, 'aomv', 7, 'taomviz', -1523318784) ,  ('ytaomvizaayhjnspei', 'ry', -1907163136, 17, 7, 'qryt', -902168576, 'iqrytaom', 1176698880) ,  ('liqr', 'nliqryt', 5, 18, 1325137920, 'pn', 5, 'lpnliqrytaomvizaay', -567148544) ,  ('clp', 'zcl', -1920532480, 19, 9, 'bzclpn', -1113784320, 'kb', 1) ,  ('qkbzclpnliqrytaom', 'rqkbzcl', 1258422272, 20, 7, 'prqkbzcl', 4, 'kprqkbzclp', 1581187072) ,  ('wkprqkbzc', 'dwkprqkbzc', 271319040, 21, -1115684864, 'xdwkprqkbz', -183959552, 'oxdwkprqk', -1294663680) ,  ('l', 'p', 6, 22, 1001783296, 'hploxdwkprqkbzclp', -1303117824, 'x', 8) ,  ('vxhploxd', 'ivxhpl', 7, 23, -1211957248, 'mivxhploxdwkprqk', -2143485952, 'rmiv', 5) ,  ('ir', 'nirmiv', -518651904, 24, 7, 'fnirmivxhpl', -1336147968, 'zfnirmivxhploxdwkprq', 1230962688) ,  ('jzfnirmi', 'rjzfni', -1973420032, 25, -325124096, 'wrj', -225771520, 'gwrjzfnirmivxhploxd', 2) ,  ('mgwrjzfnirmivxhplo', 'tmgwrjzfnirmivxhpl', 5, 26, 311820288, 'mtmgw', 4, 'kmtmgw', -416808960) ,  ('zkmtmgwrjzfnirmiv', 'nzkmt', 1203109888, 27, -674955264, 'znzkmtmgwr', -374472704, 'bznz', 897253376) ,  ('fbz', 'afbznzkmtmg', -870776832, 28, -478543872, 'aafb', 2097545216, 'waafbznzkmtmgwrjzfn', -314376192) ,  ('pwaafbznz', 'ipwaafbznzkmtmgwrjzf', -168493056, 29, 6, 'uip', 39452672, 'fuipwaa', 4) ,  ('n', 'znfuipwaafbznzkm', 849477632, 30, -2020737024, 'tznfuipwaa', -739377152, 'mtzn', 1) ,  ('jmtzn', 'sjm', 71368704, 31, 0, 'usjmtznfuipw', 5, 'cus', 6) ,  ('ccusjmtz', 'uccusjmtzn', -1638858752, 32, 569507840, 'muccusjmtznfuipw', -1358299136, 'mmuccusjmtznfuipwaaf', 519438336) ,  ('v', 'hvmmucc', -1904148480, 33, 1679687680, 'l', -52559872, 'ulhvmmuccusjmtznfu', 1127546880) ,  ('mulhvm', 'mmulh', 7, 34, 8, 'pmmulhvm', 768344064, 'jpmmulh', 2000814080) ,  ('rjpmmulh', 'trjpmmulhvmm', -807403520, 35, 9, 'ctrj', 6, 'dc', 707133440) ,  ('tdct', 'ftdctrjpmmulhvmmucc', 1189806080, 36, 551878656, 'qftdct', 8, 'pqft', 1345126400) ,  ('ppqftdctrjpmmul', 'z', 9, 37, 6, 'dzpp', 1281490944, 'hdzppqftdctrjp', -987758592) ,  ('mhdzppqftd', 'emhd', 1642725376, 38, 1567490048, 'memhdz', 6, 'omemhdzpp', 9) ,  ('vomemhdzppqftdc', 'cvomemhdzppqft', -1563099136, 39, -2140340224, 'fcv', -1806106624, 'a', 286982144) ,  ('na', 'jnafcvomemhdzp', 850067456, 40, -1593442304, 'mj', 1926889472, 'imjn', 2) ,  ('oi', 'uoimj', 0, 41, 1147273216, 'tuoimjn', 8, 'stuoimjnafcvomemhd', 1549271040) ,  ('dstuoimjnafcv', 'edstuoim', 8, 42, -445579264, 'pedstuo', 5, 'zpedstuoimjna', 6) ,  ('izpedstuoi', 'qizpedstuoimjnafc', -477298688, 43, 2, 'rqizp', 1680670720, 'grq', -939851776) ,  ('l', 'tlgrqizp', -522715136, 44, 5, 'itlgrqizpedstuoim', 1155661824, 'jitlgrqizp', 6) ,  ('g', 'e', 3, 45, 925106176, 'hegjitlgrqizpedstuo', 4, 'uhegjitlgrq', -1451425792) ,  ('tuhegji', 'c', -2132934656, 46, 4, 'tctuhegjitlgrqi', 728891392, 'vtctu', 1375010816) ,  ('avt', 'r', 6, 47, 2, 'fravtctuhegjitlgrqiz', 734527488, 'afravtc', 4) ,  ('zafra', 'xza', 1283784704, 48, 1951924224, 'sxza', 7, 'vsxzafrav', -1536163840) ,  ('jvsxzafrav', 'djvs', -1905393664, 49, 2, 'zdjvsxzaf', -1919156224, 'rzdjvs', -1441333248) ,  ('urzdjv', 'rurzdjvsxzafravtc', 898826240, 50, -1940389888, 'arurzd', -1251475456, 'nar', -637861888) ;
EXPLAIN INSERT INTO t8 VALUES  ('v', 'xvn', 780664832, 51, 9, 'pxvnarur', 8, 'lpxvnarurzdj', 423034880) ,  ('vlpxvnar', 'cvlpxvnarur', -1741684736, 52, 2, 'kcvlp', 1754857472, 'wkcvlpx', -552140800) ,  ('wwkcvlpxvnarur', 'xwwkcvlp', 251265024, 53, 1414070272, 'kxwwkcvlpxvnarurz', 926154752, 'lk', 46268416) ,  ('wlk', 'dw', 87097344, 54, 1540292608, 'ddwlkxww', -1190330368, 'hd', -1540882432) ,  ('hh', 'nh', 1481900032, 55, 5, 'onhhddw', 1745485824, 'lonhhdd', -1477246976) ,  ('qlonh', 'wqlonhh', 9, 56, 8, 'lwq', 853016576, 'elwqlonhhd', 796262400) ,  ('qelwqlonhh', 'jqelwqlonh', -1491795968, 57, -160956416, 'njqelwqlo', -1636433920, 'hnjqelwqlonhhddwlk', 6) ,  ('uh', 'duhnjqelwq', -224722944, 58, 5, 'iduhnjq', -251658240, 'gid', -2048196608) ,  ('fgid', 'ufgiduhnjqelwq', -944242688, 59, 1269235712, 'iufgid', 183500800, 'iiufgiduhnjqelwql', -1593049088) ,  ('miiufgiduhnjqel', 'nmiiufgid', 3, 60, 105840640, 'gnm', 1658585088, 'ygnmi', -2050621440) ,  ('fygnmii', 'ifygn', 7, 61, 2, 'tifygnm', 1072037888, 'ctif', 3) ,  ('vctify', 'mvctifygn', -1035730944, 62, 1, 'qmvctifygnmiiufgiduh', 708640768, 'jqmvctifygnmiiufgid', 0) ,  ('qjqmvcti', 'lqjqmvct', -861077504, 63, 791019520, 'flqjqmvcti', 2, 'rf', -571801600) ,  ('brfl', 'ybrflqjqmvctify', 0, 64, 5, 'qybr', -1138098176, 'cqy', 5) ,  ('pcqy', 'wpcqybrflqjqmvctify', 4, 65, 1661534208, 'd', 471007232, 'l', 875495424) ,  ('nldwpcqyb', 'nnldw', -553385984, 66, -1002045440, 'cnnldwpcqybrflqjqm', 1300103168, 'hcnnld', 2125594624) ,  ('vhcnn', 'evhcnnldwpc', 1696661504, 67, 1, 'mevh', -726532096, 'cmevhcnnldwpcqybrfl', 2) ,  ('x', 'oxcmevh', 750059520, 68, 2, 'fo', -1562181632, 'dfoxcmev', -699727872) ,  ('pdfox', 'ipdfoxcme', -1871511552, 69, -188678144, 'sip', 1017511936, 'nsipdfoxcmevhcnnld', -815398912) ,  ('nnsip', 'w', -1078460416, 70, 6, 'rwnnsipdf', -416022528, 'yrwnnsipdf', 1966997504) ,  ('hyrwnnsi', 'ahyrwnnsipdfoxcmevhc', 1717436416, 71, 7, 'eahyrwnns', -281411584, 'ueahyrwnnsi', 591986688) ,  ('hueah', 'mhueahy', 1735983104, 72, -2006515712, 'umhueahyrwnnsipdfox', -1417281536, 'wumhue', 38273024) ,  ('awu', 'gawumhu', -1433665536, 73, 1087242240, 'fgawumhueahyrwn', 7, 'yfgawumh', -14876672) ,  ('hy', 'mhyfgaw', -178454528, 74, 4, 'sm', 969736192, 'ysmhyfgaw', -1618083840) ,  ('iysmhyfgawumhuea', 'niy', 1730478080, 75, 1102577664, 'sniysmhyfg', 289341440, 'ksn', 384040960) ,  ('uksniysmhyfgawumhue', 'vuksniysmh', -1192624128, 76, -73465856, 'uvuksniysmhy', -705822720, 'u', 197722112) ,  ('zuuvuksn', 'tzuuvuks', 8, 77, 7, 'ctzuuvuks', 1018167296, 'tctzuuvuks', 2) ,  ('btctzuuvuk', 'qbtctz', 357171200, 78, 1714814976, 'jqbtctzuuvuksn', 9, 'ijqbt', 833093632) ,  ('zijqb', 'gzi', -1551630336, 79, 1, 'pgz', 0, 'zpgzijqbtc', 6) ,  ('vzpgzijq', 'kv', 1683619840, 80, 0, 'jkvz', -2053242880, 'kjkvzpgz', 1) ,  ('ik', 'hikjkvzpgzijqbt', 1648427008, 81, -332595200, 'ghikjkvzp', -1247346688, 'qghikjkvzpgzi', 1016659968) ,  ('gqghikjkvzpgz', 'hgqghikjkvz', 4, 82, -1528561664, 'nhgqgh', 1562443776, 'snhgqghikjkvzpg', 2118320128) ,  ('rsnhgqghik', 'irs', -1952710656, 83, 2, 'm', 3, 'a', -318177280) ,  ('zami', 'fzamirs', -1423310848, 84, 6, 'lfzamir', 8, 'blfzamirsnhgqghikjkv', 1961820160) ,  ('gblf', 'igblfz', 1365442560, 85, -276365312, 'rigb', -264765440, 'wrigb', -1821376512) ,  ('iw', 'hiwrigb', -538443776, 86, 3, 'dhiwrigblfzamirsnhgq', 0, 'gdhiwrigb', 6) ,  ('cgdhiwrigb', 'mcgdhiwrigbl', 1526661120, 87, 533856256, 'hmcgdhiwri', 8, 'shmc', -1665466368) ,  ('ishmcgdhiwrigblfzami', 'cishmcg', 0, 88, -1279852544, 'hcishm', 6, 'mhcishmc', 139198464) ,  ('amhcishmc', 'f', 9, 89, 1970077696, 'hfamhc', -397017088, 'khfamhcis', 1334902784) ,  ('qkh', 'tqkhfamhc', -357433344, 90, -709754880, 'ytq', -968491008, 'mytq', 129695744) ,  ('rmytqkhf', 'ermyt', 1334116352, 91, 8, 'f', 8, 'if', 1695416320) ,  ('hi', 'mhifermytqkhfam', 1007091712, 92, 901447680, 'hmhifermytqkhf', -286261248, 'ihmhi', 4) ,  ('pihmhifer', 'epihmhi', 5, 93, -1516437504, 'fe', 576126976, 'mfepihmhifermyt', 921763840) ,  ('ymfepihmh', 'vym', 8, 94, 608632832, 'dvym', 9, 'ndvym', 1611464704) ,  ('hndvymfepihmhifermy', 'bh', 2, 95, 9, 'xbhndvymfepih', -560136192, 'axbhndvy', -1488781312) ,  ('yaxbhndvymfepi', 'jyaxbhn', -532545536, 96, 1963982848, 'ojyaxbhndv', -1909719040, 'p', 1) ,  ('npojya', 'tnpojy', 1, 97, 6, 'itnpo', 0, 'sitnpojyaxbhndvy', 1081409536) ,  ('h', 'ihsitnpojy', 8, 98, 1653211136, 'bihsit', 8, 'obihsitnpojyaxbhndvy', 0) ,  ('yo', 'nyobi', 1543700480, 99, 9, 'anyobihsitnpoj', 1, 'iany', 9) ,  ('fianyobih', 'yfianyobihs', 243335168, 100, 6, 'uyfiany', 40304640, 'fuyf', 1247936512) ;
Query Plan
==================================================
|ID|OPERATOR          |NAME|EST.ROWS|EST.TIME(us)|
--------------------------------------------------
|0 |DISTRIBUTED INSERT|    |50      |324         |
|1 |└─EXPRESSION      |    |50      |1           |
==================================================
Outputs & filters:
-------------------------------------
  0 - output(nil), filter(nil)
      columns([{T8: ({T8: (T8.PK, T8.COL_VARCHAR_20_NOT_NULL, T8.COL_CHAR_20_NOT_NULL, T8.COL_NUMBER_NOT_NULL, T8.COL_INT_NOT_NULL, T8.COL_CHAR_20, T8.COL_NUMBER,
       T8.COL_VARCHAR_20, T8.COL_INT)})}]), 
      column_values([column_conv(NUMBER,PS:(-1,0),NOT NULL,__values.PK)], [column_conv(VARCHAR2,utf8mb4_bin,length:20,NOT NULL,__values.COL_VARCHAR_20_NOT_NULL)],
       [column_conv(CHAR,utf8mb4_bin,length:20,NOT NULL,__values.COL_CHAR_20_NOT_NULL)], [column_conv(NUMBER,PS:(-1,-85),NOT NULL,__values.COL_NUMBER_NOT_NULL)],
       [column_conv(NUMBER,PS:(-1,0),NOT NULL,__values.COL_INT_NOT_NULL)], [column_conv(CHAR,utf8mb4_bin,length:20,NULL,__values.COL_CHAR_20)], [column_conv(NUMBER,
      PS:(-1,-85),NULL,__values.COL_NUMBER)], [column_conv(VARCHAR2,utf8mb4_bin,length:20,NULL,__values.COL_VARCHAR_20)], [column_conv(NUMBER,PS:(-1,0),NULL,__values.COL_INT)])
  1 - output([__values.COL_VARCHAR_20_NOT_NULL], [__values.COL_CHAR_20_NOT_NULL], [__values.COL_NUMBER_NOT_NULL], [__values.PK], [__values.COL_INT_NOT_NULL],
       [__values.COL_CHAR_20], [__values.COL_NUMBER], [__values.COL_VARCHAR_20], [__values.COL_INT]), filter(nil)
      values({'v', 'xvn', 780664832, 51, 9, 'pxvnarur', 8, 'lpxvnarurzdj', 423034880}, {'vlpxvnar', 'cvlpxvnarur', -1741684736, 52, 2, 'kcvlp', 1754857472,
       'wkcvlpx', -552140800}, {'wwkcvlpxvnarur', 'xwwkcvlp', 251265024, 53, 1414070272, 'kxwwkcvlpxvnarurz', 926154752, 'lk', 46268416}, {'wlk', 'dw', 87097344,
       54, 1540292608, 'ddwlkxww', -1190330368, 'hd', -1540882432}, {'hh', 'nh', 1481900032, 55, 5, 'onhhddw', 1745485824, 'lonhhdd', -1477246976}, {'qlonh', 
      'wqlonhh', 9, 56, 8, 'lwq', 853016576, 'elwqlonhhd', 796262400}, {'qelwqlonhh', 'jqelwqlonh', -1491795968, 57, -160956416, 'njqelwqlo', -1636433920, 'hnjqelwqlonhhddwlk',
       6}, {'uh', 'duhnjqelwq', -224722944, 58, 5, 'iduhnjq', -251658240, 'gid', -2048196608}, {'fgid', 'ufgiduhnjqelwq', -944242688, 59, 1269235712, 'iufgid',
       183500800, 'iiufgiduhnjqelwql', -1593049088}, {'miiufgiduhnjqel', 'nmiiufgid', 3, 60, 105840640, 'gnm', 1658585088, 'ygnmi', -2050621440}, {'fygnmii', 
      'ifygn', 7, 61, 2, 'tifygnm', 1072037888, 'ctif', 3}, {'vctify', 'mvctifygn', -1035730944, 62, 1, 'qmvctifygnmiiufgiduh', 708640768, 'jqmvctifygnmiiufgid',
       0}, {'qjqmvcti', 'lqjqmvct', -861077504, 63, 791019520, 'flqjqmvcti', 2, 'rf', -571801600}, {'brfl', 'ybrflqjqmvctify', 0, 64, 5, 'qybr', -1138098176, 
      'cqy', 5}, {'pcqy', 'wpcqybrflqjqmvctify', 4, 65, 1661534208, 'd', 471007232, 'l', 875495424}, {'nldwpcqyb', 'nnldw', -553385984, 66, -1002045440, 'cnnldwpcqybrflqjqm',
       1300103168, 'hcnnld', 2125594624}, {'vhcnn', 'evhcnnldwpc', 1696661504, 67, 1, 'mevh', -726532096, 'cmevhcnnldwpcqybrfl', 2}, {'x', 'oxcmevh', 750059520,
       68, 2, 'fo', -1562181632, 'dfoxcmev', -699727872}, {'pdfox', 'ipdfoxcme', -1871511552, 69, -188678144, 'sip', 1017511936, 'nsipdfoxcmevhcnnld', -815398912},
       {'nnsip', 'w', -1078460416, 70, 6, 'rwnnsipdf', -416022528, 'yrwnnsipdf', 1966997504}, {'hyrwnnsi', 'ahyrwnnsipdfoxcmevhc', 1717436416, 71, 7, 'eahyrwnns',
       -281411584, 'ueahyrwnnsi', 591986688}, {'hueah', 'mhueahy', 1735983104, 72, -2006515712, 'umhueahyrwnnsipdfox', -1417281536, 'wumhue', 38273024}, {'awu',
       'gawumhu', -1433665536, 73, 1087242240, 'fgawumhueahyrwn', 7, 'yfgawumh', -14876672}, {'hy', 'mhyfgaw', -178454528, 74, 4, 'sm', 969736192, 'ysmhyfgaw',
       -1618083840}, {'iysmhyfgawumhuea', 'niy', 1730478080, 75, 1102577664, 'sniysmhyfg', 289341440, 'ksn', 384040960}, {'uksniysmhyfgawumhue', 'vuksniysmh',
       -1192624128, 76, -73465856, 'uvuksniysmhy', -705822720, 'u', 197722112}, {'zuuvuksn', 'tzuuvuks', 8, 77, 7, 'ctzuuvuks', 1018167296, 'tctzuuvuks', 2}, 
      {'btctzuuvuk', 'qbtctz', 357171200, 78, 1714814976, 'jqbtctzuuvuksn', 9, 'ijqbt', 833093632}, {'zijqb', 'gzi', -1551630336, 79, 1, 'pgz', 0, 'zpgzijqbtc',
       6}, {'vzpgzijq', 'kv', 1683619840, 80, 0, 'jkvz', -2053242880, 'kjkvzpgz', 1}, {'ik', 'hikjkvzpgzijqbt', 1648427008, 81, -332595200, 'ghikjkvzp', -1247346688,
       'qghikjkvzpgzi', 1016659968}, {'gqghikjkvzpgz', 'hgqghikjkvz', 4, 82, -1528561664, 'nhgqgh', 1562443776, 'snhgqghikjkvzpg', 2118320128}, {'rsnhgqghik',
       'irs', -1952710656, 83, 2, 'm', 3, 'a', -318177280}, {'zami', 'fzamirs', -1423310848, 84, 6, 'lfzamir', 8, 'blfzamirsnhgqghikjkv', 1961820160}, {'gblf',
       'igblfz', 1365442560, 85, -276365312, 'rigb', -264765440, 'wrigb', -1821376512}, {'iw', 'hiwrigb', -538443776, 86, 3, 'dhiwrigblfzamirsnhgq', 0, 'gdhiwrigb',
       6}, {'cgdhiwrigb', 'mcgdhiwrigbl', 1526661120, 87, 533856256, 'hmcgdhiwri', 8, 'shmc', -1665466368}, {'ishmcgdhiwrigblfzami', 'cishmcg', 0, 88, -1279852544,
       'hcishm', 6, 'mhcishmc', 139198464}, {'amhcishmc', 'f', 9, 89, 1970077696, 'hfamhc', -397017088, 'khfamhcis', 1334902784}, {'qkh', 'tqkhfamhc', -357433344,
       90, -709754880, 'ytq', -968491008, 'mytq', 129695744}, {'rmytqkhf', 'ermyt', 1334116352, 91, 8, 'f', 8, 'if', 1695416320}, {'hi', 'mhifermytqkhfam', 1007091712,
       92, 901447680, 'hmhifermytqkhf', -286261248, 'ihmhi', 4}, {'pihmhifer', 'epihmhi', 5, 93, -1516437504, 'fe', 576126976, 'mfepihmhifermyt', 921763840}, 
      {'ymfepihmh', 'vym', 8, 94, 608632832, 'dvym', 9, 'ndvym', 1611464704}, {'hndvymfepihmhifermy', 'bh', 2, 95, 9, 'xbhndvymfepih', -560136192, 'axbhndvy',
       -1488781312}, {'yaxbhndvymfepi', 'jyaxbhn', -532545536, 96, 1963982848, 'ojyaxbhndv', -1909719040, 'p', 1}, {'npojya', 'tnpojy', 1, 97, 6, 'itnpo', 0, 
      'sitnpojyaxbhndvy', 1081409536}, {'h', 'ihsitnpojy', 8, 98, 1653211136, 'bihsit', 8, 'obihsitnpojyaxbhndvy', 0}, {'yo', 'nyobi', 1543700480, 99, 9, 'anyobihsitnpoj',
       1, 'iany', 9}, {'fianyobih', 'yfianyobihs', 243335168, 100, 6, 'uyfiany', 40304640, 'fuyf', 1247936512})
INSERT INTO t8 VALUES  ('v', 'xvn', 780664832, 51, 9, 'pxvnarur', 8, 'lpxvnarurzdj', 423034880) ,  ('vlpxvnar', 'cvlpxvnarur', -1741684736, 52, 2, 'kcvlp', 1754857472, 'wkcvlpx', -552140800) ,  ('wwkcvlpxvnarur', 'xwwkcvlp', 251265024, 53, 1414070272, 'kxwwkcvlpxvnarurz', 926154752, 'lk', 46268416) ,  ('wlk', 'dw', 87097344, 54, 1540292608, 'ddwlkxww', -1190330368, 'hd', -1540882432) ,  ('hh', 'nh', 1481900032, 55, 5, 'onhhddw', 1745485824, 'lonhhdd', -1477246976) ,  ('qlonh', 'wqlonhh', 9, 56, 8, 'lwq', 853016576, 'elwqlonhhd', 796262400) ,  ('qelwqlonhh', 'jqelwqlonh', -1491795968, 57, -160956416, 'njqelwqlo', -1636433920, 'hnjqelwqlonhhddwlk', 6) ,  ('uh', 'duhnjqelwq', -224722944, 58, 5, 'iduhnjq', -251658240, 'gid', -2048196608) ,  ('fgid', 'ufgiduhnjqelwq', -944242688, 59, 1269235712, 'iufgid', 183500800, 'iiufgiduhnjqelwql', -1593049088) ,  ('miiufgiduhnjqel', 'nmiiufgid', 3, 60, 105840640, 'gnm', 1658585088, 'ygnmi', -2050621440) ,  ('fygnmii', 'ifygn', 7, 61, 2, 'tifygnm', 1072037888, 'ctif', 3) ,  ('vctify', 'mvctifygn', -1035730944, 62, 1, 'qmvctifygnmiiufgiduh', 708640768, 'jqmvctifygnmiiufgid', 0) ,  ('qjqmvcti', 'lqjqmvct', -861077504, 63, 791019520, 'flqjqmvcti', 2, 'rf', -571801600) ,  ('brfl', 'ybrflqjqmvctify', 0, 64, 5, 'qybr', -1138098176, 'cqy', 5) ,  ('pcqy', 'wpcqybrflqjqmvctify', 4, 65, 1661534208, 'd', 471007232, 'l', 875495424) ,  ('nldwpcqyb', 'nnldw', -553385984, 66, -1002045440, 'cnnldwpcqybrflqjqm', 1300103168, 'hcnnld', 2125594624) ,  ('vhcnn', 'evhcnnldwpc', 1696661504, 67, 1, 'mevh', -726532096, 'cmevhcnnldwpcqybrfl', 2) ,  ('x', 'oxcmevh', 750059520, 68, 2, 'fo', -1562181632, 'dfoxcmev', -699727872) ,  ('pdfox', 'ipdfoxcme', -1871511552, 69, -188678144, 'sip', 1017511936, 'nsipdfoxcmevhcnnld', -815398912) ,  ('nnsip', 'w', -1078460416, 70, 6, 'rwnnsipdf', -416022528, 'yrwnnsipdf', 1966997504) ,  ('hyrwnnsi', 'ahyrwnnsipdfoxcmevhc', 1717436416, 71, 7, 'eahyrwnns', -281411584, 'ueahyrwnnsi', 591986688) ,  ('hueah', 'mhueahy', 1735983104, 72, -2006515712, 'umhueahyrwnnsipdfox', -1417281536, 'wumhue', 38273024) ,  ('awu', 'gawumhu', -1433665536, 73, 1087242240, 'fgawumhueahyrwn', 7, 'yfgawumh', -14876672) ,  ('hy', 'mhyfgaw', -178454528, 74, 4, 'sm', 969736192, 'ysmhyfgaw', -1618083840) ,  ('iysmhyfgawumhuea', 'niy', 1730478080, 75, 1102577664, 'sniysmhyfg', 289341440, 'ksn', 384040960) ,  ('uksniysmhyfgawumhue', 'vuksniysmh', -1192624128, 76, -73465856, 'uvuksniysmhy', -705822720, 'u', 197722112) ,  ('zuuvuksn', 'tzuuvuks', 8, 77, 7, 'ctzuuvuks', 1018167296, 'tctzuuvuks', 2) ,  ('btctzuuvuk', 'qbtctz', 357171200, 78, 1714814976, 'jqbtctzuuvuksn', 9, 'ijqbt', 833093632) ,  ('zijqb', 'gzi', -1551630336, 79, 1, 'pgz', 0, 'zpgzijqbtc', 6) ,  ('vzpgzijq', 'kv', 1683619840, 80, 0, 'jkvz', -2053242880, 'kjkvzpgz', 1) ,  ('ik', 'hikjkvzpgzijqbt', 1648427008, 81, -332595200, 'ghikjkvzp', -1247346688, 'qghikjkvzpgzi', 1016659968) ,  ('gqghikjkvzpgz', 'hgqghikjkvz', 4, 82, -1528561664, 'nhgqgh', 1562443776, 'snhgqghikjkvzpg', 2118320128) ,  ('rsnhgqghik', 'irs', -1952710656, 83, 2, 'm', 3, 'a', -318177280) ,  ('zami', 'fzamirs', -1423310848, 84, 6, 'lfzamir', 8, 'blfzamirsnhgqghikjkv', 1961820160) ,  ('gblf', 'igblfz', 1365442560, 85, -276365312, 'rigb', -264765440, 'wrigb', -1821376512) ,  ('iw', 'hiwrigb', -538443776, 86, 3, 'dhiwrigblfzamirsnhgq', 0, 'gdhiwrigb', 6) ,  ('cgdhiwrigb', 'mcgdhiwrigbl', 1526661120, 87, 533856256, 'hmcgdhiwri', 8, 'shmc', -1665466368) ,  ('ishmcgdhiwrigblfzami', 'cishmcg', 0, 88, -1279852544, 'hcishm', 6, 'mhcishmc', 139198464) ,  ('amhcishmc', 'f', 9, 89, 1970077696, 'hfamhc', -397017088, 'khfamhcis', 1334902784) ,  ('qkh', 'tqkhfamhc', -357433344, 90, -709754880, 'ytq', -968491008, 'mytq', 129695744) ,  ('rmytqkhf', 'ermyt', 1334116352, 91, 8, 'f', 8, 'if', 1695416320) ,  ('hi', 'mhifermytqkhfam', 1007091712, 92, 901447680, 'hmhifermytqkhf', -286261248, 'ihmhi', 4) ,  ('pihmhifer', 'epihmhi', 5, 93, -1516437504, 'fe', 576126976, 'mfepihmhifermyt', 921763840) ,  ('ymfepihmh', 'vym', 8, 94, 608632832, 'dvym', 9, 'ndvym', 1611464704) ,  ('hndvymfepihmhifermy', 'bh', 2, 95, 9, 'xbhndvymfepih', -560136192, 'axbhndvy', -1488781312) ,  ('yaxbhndvymfepi', 'jyaxbhn', -532545536, 96, 1963982848, 'ojyaxbhndv', -1909719040, 'p', 1) ,  ('npojya', 'tnpojy', 1, 97, 6, 'itnpo', 0, 'sitnpojyaxbhndvy', 1081409536) ,  ('h', 'ihsitnpojy', 8, 98, 1653211136, 'bihsit', 8, 'obihsitnpojyaxbhndvy', 0) ,  ('yo', 'nyobi', 1543700480, 99, 9, 'anyobihsitnpoj', 1, 'iany', 9) ,  ('fianyobih', 'yfianyobihs', 243335168, 100, 6, 'uyfiany', 40304640, 'fuyf', 1247936512) ;

explain select COL_CHAR_20_NOT_NULL,COL_VARCHAR_20
from t4 T1
where T1.COL_INT >= 
    ( select sum(T7.COL_NUMBER_NOT_NULL) 
      from t8 T7 
      where T7.COL_NUMBER <> 
          ( select avg(T8.COL_INT_NOT_NULL) 
            from  t8 T8 JOIN t7 T9 on T8.COL_CHAR_20_NOT_NULL > T9.COL_VARCHAR_20
            where T7.PK < T9.COL_NUMBER_NOT_NULL 
              and T1.COL_CHAR_20_NOT_NULL = T9.COL_CHAR_20 
              and T8.COL_INT <= (   select count(*) from t1 T10 where T1.COL_VARCHAR_20 > T10.COL_CHAR_20 and T10.PK > T10.PK  )  
          )  
    ) ;
Query Plan
========================================================================
|ID|OPERATOR                               |NAME |EST.ROWS|EST.TIME(us)|
------------------------------------------------------------------------
|0 |EXCHANGE IN REMOTE                     |     |34      |2344        |
|1 |└─EXCHANGE OUT REMOTE                  |     |34      |2320        |
|2 |  └─SUBPLAN FILTER                     |     |34      |2267        |
|3 |    ├─TABLE FULL SCAN                  |T1   |100     |6           |
|4 |    └─SCALAR GROUP BY                  |     |1       |23          |
|5 |      └─SUBPLAN SCAN                   |VIEW2|1       |23          |
|6 |        └─MERGE GROUP BY               |     |1       |23          |
|7 |          └─NESTED-LOOP JOIN           |     |9       |22          |
|8 |            ├─TABLE FULL SCAN          |T7   |100     |18          |
|9 |            └─MATERIAL                 |     |2       |39          |
|10|              └─NESTED-LOOP JOIN       |     |2       |39          |
|11|                ├─NESTED-LOOP JOIN     |     |5       |39          |
|12|                │ ├─SUBPLAN SCAN       |VIEW1|1       |18          |
|13|                │ │ └─SCALAR GROUP BY  |     |1       |18          |
|14|                │ │   └─TABLE FULL SCAN|T10  |0       |18          |
|15|                │ └─TABLE FULL SCAN    |T8   |100     |18          |
|16|                └─MATERIAL             |     |1       |19          |
|17|                  └─TABLE FULL SCAN    |T9   |1       |18          |
========================================================================
Outputs & filters:
-------------------------------------
  0 - output([T1.COL_CHAR_20_NOT_NULL], [T1.COL_VARCHAR_20]), filter(nil)
  1 - output([T1.COL_CHAR_20_NOT_NULL], [T1.COL_VARCHAR_20]), filter(nil)
  2 - output([T1.COL_CHAR_20_NOT_NULL], [T1.COL_VARCHAR_20]), filter([T1.COL_INT >= subquery(1)]), rowset=256
      exec_params_([T1.COL_CHAR_20_NOT_NULL(:0)], [T1.COL_VARCHAR_20(:1)]), onetime_exprs_(nil), init_plan_idxs_(nil), use_batch=false
  3 - output([T1.COL_CHAR_20_NOT_NULL], [T1.COL_VARCHAR_20], [T1.COL_INT]), filter(nil), rowset=256
      access([T1.COL_CHAR_20_NOT_NULL], [T1.COL_VARCHAR_20], [T1.COL_INT]), partitions(p0)
      is_index_back=false, is_global_index=false, 
      range_key([T1.PK]), range(MIN ; MAX)always true
  4 - output([T_FUN_SUM(VIEW2.T7.COL_NUMBER_NOT_NULL)]), filter(nil), rowset=256
      group(nil), agg_func([T_FUN_SUM(VIEW2.T7.COL_NUMBER_NOT_NULL)])
  5 - output([VIEW2.T7.COL_NUMBER_NOT_NULL]), filter(nil), rowset=256
      access([VIEW2.T7.COL_NUMBER_NOT_NULL])
  6 - output([T7.COL_NUMBER_NOT_NULL]), filter([T7.COL_NUMBER != T_FUN_SUM(T8.COL_INT_NOT_NULL) / T_FUN_COUNT(T8.COL_INT_NOT_NULL)]), rowset=256
      group([T7.PK]), agg_func([T_FUN_SUM(T8.COL_INT_NOT_NULL)], [T_FUN_COUNT(T8.COL_INT_NOT_NULL)])
  7 - output([T7.PK], [T8.COL_INT_NOT_NULL], [T7.COL_NUMBER_NOT_NULL], [T7.COL_NUMBER]), filter(nil), rowset=256
      conds([T7.PK < T9.COL_NUMBER_NOT_NULL]), nl_params_(nil), use_batch=false
  8 - output([T7.PK], [T7.COL_NUMBER], [T7.COL_NUMBER_NOT_NULL]), filter(nil), rowset=256
      access([T7.PK], [T7.COL_NUMBER], [T7.COL_NUMBER_NOT_NULL]), partitions(p0)
      is_index_back=false, is_global_index=false, 
      range_key([T7.PK]), range(MIN ; MAX)always true
  9 - output([T8.COL_INT_NOT_NULL], [T9.COL_NUMBER_NOT_NULL]), filter(nil), rowset=256
 10 - output([T8.COL_INT_NOT_NULL], [T9.COL_NUMBER_NOT_NULL]), filter(nil), rowset=256
      conds([cast(T8.COL_CHAR_20_NOT_NULL, VARCHAR2(1048576 )) > T9.COL_VARCHAR_20]), nl_params_(nil), use_batch=false
 11 - output([T8.COL_INT_NOT_NULL], [T8.COL_CHAR_20_NOT_NULL]), filter(nil), rowset=256
      conds([T8.COL_INT <= VIEW1.COUNT(*)]), nl_params_(nil), use_batch=false
 12 - output([VIEW1.COUNT(*)]), filter(nil), rowset=256
      access([VIEW1.COUNT(*)])
 13 - output([T_FUN_COUNT_SUM(T_FUN_COUNT(*))]), filter(nil), rowset=256
      group(nil), agg_func([T_FUN_COUNT_SUM(T_FUN_COUNT(*))])
 14 - output([T_FUN_COUNT(*)]), filter([T10.PK > T10.PK], [:1 > cast(T10.COL_CHAR_20, VARCHAR2(1048576 ))]), rowset=256
      access([T10.PK], [T10.COL_CHAR_20]), partitions(p0)
      is_index_back=false, is_global_index=false, filter_before_indexback[false,false], 
      range_key([T10.PK]), range(MIN ; MAX)always true, 
      pushdown_aggregation([T_FUN_COUNT(*)])
 15 - output([T8.COL_CHAR_20_NOT_NULL], [T8.COL_INT], [T8.COL_INT_NOT_NULL]), filter(nil), rowset=256
      access([T8.COL_CHAR_20_NOT_NULL], [T8.COL_INT], [T8.COL_INT_NOT_NULL]), partitions(p0)
      is_index_back=false, is_global_index=false, 
      range_key([T8.PK]), range(MIN ; MAX)always true
 16 - output([T9.COL_VARCHAR_20], [T9.COL_NUMBER_NOT_NULL]), filter(nil), rowset=256
 17 - output([T9.COL_VARCHAR_20], [T9.COL_NUMBER_NOT_NULL]), filter([:0 = T9.COL_CHAR_20]), rowset=256
      access([T9.COL_VARCHAR_20], [T9.COL_NUMBER_NOT_NULL], [T9.COL_CHAR_20]), partitions(p0)
      is_index_back=false, is_global_index=false, filter_before_indexback[false], 
      range_key([T9.PK]), range(MIN ; MAX)always true

DROP TABLE t1;
DROP TABLE t4;
DROP TABLE t7;
DROP TABLE t8;

## bug:
drop table t1;
drop table t2;
drop table t3;
drop table t4;
explain_protocol: 0
create table t1 (pk int primary key, c1 int, c2 int);
create table t2 (pk int primary key, c1 int, c2 int);
create table t3 (pk int primary key, c1 int, c2 int);
create table t4 (pk int primary key, c1 int, c2 int);
insert into t1 values (1,1,1);
insert into t1 values (2,2,2);
insert into t2 values (1,1,1);
insert into t2 values (2,2,2);
insert into t3 values (3,3,3);
insert into t4 values (1,1,1);
explain_protocol: 2
EXPLAIN select t1.* from  t1, t2 full join t3 on t2.c1 > t3.c1 where t1.c1 > (select count(1) from t4 where t1.pk > t4.pk);
Query Plan
======================================================================
|ID|OPERATOR                             |NAME |EST.ROWS|EST.TIME(us)|
----------------------------------------------------------------------
|0 |EXCHANGE IN REMOTE                   |     |2       |114         |
|1 |└─EXCHANGE OUT REMOTE                |     |2       |113         |
|2 |  └─SUBPLAN FILTER                   |     |2       |109         |
|3 |    ├─NESTED-LOOP JOIN CARTESIAN     |     |6       |3           |
|4 |    │ ├─TABLE FULL SCAN              |T1   |2       |3           |
|5 |    │ └─MATERIAL                     |     |3       |5           |
|6 |    │   └─SUBPLAN SCAN               |VIEW1|3       |5           |
|7 |    │     └─UNION ALL                |     |3       |5           |
|8 |    │       ├─NESTED-LOOP OUTER JOIN |     |2       |3           |
|9 |    │       │ ├─TABLE FULL SCAN      |T2   |2       |3           |
|10|    │       │ └─MATERIAL             |     |1       |3           |
|11|    │       │   └─TABLE FULL SCAN    |T3   |1       |3           |
|12|    │       └─NESTED-LOOP ANTI JOIN  |     |1       |3           |
|13|    │         ├─TABLE FULL SCAN      |T3   |1       |3           |
|14|    │         └─MATERIAL             |     |2       |3           |
|15|    │           └─TABLE FULL SCAN    |T2   |2       |3           |
|16|    └─SCALAR GROUP BY                |     |1       |18          |
|17|      └─TABLE RANGE SCAN             |T4   |1       |18          |
======================================================================
Outputs & filters:
-------------------------------------
  0 - output([T1.PK], [T1.C1], [T1.C2]), filter(nil)
  1 - output([T1.PK], [T1.C1], [T1.C2]), filter(nil)
  2 - output([T1.PK], [T1.C1], [T1.C2]), filter([T1.C1 > subquery(1)]), rowset=16
      exec_params_([T1.PK(:0)]), onetime_exprs_(nil), init_plan_idxs_(nil), use_batch=false
  3 - output([T1.PK], [T1.C1], [T1.C2]), filter(nil), rowset=16
      conds(nil), nl_params_(nil), use_batch=false
  4 - output([T1.PK], [T1.C1], [T1.C2]), filter(nil), rowset=16
      access([T1.PK], [T1.C1], [T1.C2]), partitions(p0)
      is_index_back=false, is_global_index=false, 
      range_key([T1.PK]), range(MIN ; MAX)always true
  5 - output(nil), filter(nil), rowset=16
  6 - output(nil), filter(nil), rowset=16
      access(nil)
  7 - output([UNION([1])]), filter(nil), rowset=16
  8 - output([1]), filter(nil), rowset=16
      conds([T2.C1 > T3.C1]), nl_params_(nil), use_batch=false
  9 - output([T2.C1]), filter(nil), rowset=16
      access([T2.C1]), partitions(p0)
      is_index_back=false, is_global_index=false, 
      range_key([T2.PK]), range(MIN ; MAX)always true
 10 - output([T3.C1]), filter(nil), rowset=16
 11 - output([T3.C1]), filter(nil), rowset=16
      access([T3.C1]), partitions(p0)
      is_index_back=false, is_global_index=false, 
      range_key([T3.PK]), range(MIN ; MAX)always true
 12 - output([1]), filter(nil), rowset=16
      conds([T2.C1 > T3.C1]), nl_params_(nil), use_batch=false
 13 - output([T3.C1]), filter(nil), rowset=16
      access([T3.C1]), partitions(p0)
      is_index_back=false, is_global_index=false, 
      range_key([T3.PK]), range(MIN ; MAX)always true
 14 - output([T2.C1]), filter(nil), rowset=16
 15 - output([T2.C1]), filter(nil), rowset=16
      access([T2.C1]), partitions(p0)
      is_index_back=false, is_global_index=false, 
      range_key([T2.PK]), range(MIN ; MAX)always true
 16 - output([T_FUN_COUNT_SUM(T_FUN_COUNT(*))]), filter(nil), rowset=16
      group(nil), agg_func([T_FUN_COUNT_SUM(T_FUN_COUNT(*))])
 17 - output([T_FUN_COUNT(*)]), filter(nil), rowset=16
      access(nil), partitions(p0)
      is_index_back=false, is_global_index=false, 
      range_key([T4.PK]), range(MIN ; MAX)always true, 
      range_cond([:0 > T4.PK]), 
      pushdown_aggregation([T_FUN_COUNT(*)])
select t1.* from  t1, t2 full join t3 on t2.c1 > t3.c1 where t1.c1 > (select count(1) from t4 where t1.pk > t4.pk);
+----+------+------+
| PK | C1   | C2   |
+----+------+------+
|  1 |    1 |    1 |
|  1 |    1 |    1 |
|  1 |    1 |    1 |
|  2 |    2 |    2 |
|  2 |    2 |    2 |
|  2 |    2 |    2 |
+----+------+------+
drop table t1;
drop table t2;
drop table t3;
drop table t4;

## bug 
explain_protocol: 0
#tri-5-3 层级查询
#分区表+无索引+无主键
DROP TABLE t1 purge;
CREATE TABLE t1(id int, name varchar2(10), grade int, pid int) PARTITION BY RANGE(id) (PARTITION p1 VALUES less than (108), PARTITION p2 VALUES less than (MAXVALUE));
DROP TABLE t2 purge;
CREATE TABLE t2(id int, name varchar2(10), grade int, pid int) PARTITION BY RANGE(id) (PARTITION p1 VALUES less than (108), PARTITION p2 VALUES less than (MAXVALUE));
INSERT INTO t1 VALUES(101, 'test1', 50, NULL);
INSERT INTO t1 VALUES(102, 'test2', 55, 101);
INSERT INTO t1 VALUES(103, 'test3', 60, 101);
INSERT INTO t1 VALUES(104, 'test4', 65, 102);
INSERT INTO t1 VALUES(105, 'test5', 70, 102);
INSERT INTO t1 VALUES(106, 'test6', 75, 103);
INSERT INTO t1 VALUES(107, 'test7', 80, 103);
INSERT INTO t1 VALUES(108, NULL, NULL, NULL);
INSERT INTO t1 VALUES(109, 'test9', 90, 103);
INSERT INTO t2 VALUES(100, 'test1', 60, 101);
INSERT INTO t2 VALUES(99, 'test2', 90, 102);
INSERT INTO t2 VALUES(98, 'test3', 100, NULL);
INSERT INTO t2 VALUES(97, 'test4', 120, NULL);
set autocommit=0;

select stddev(grade) from t1;
+-------------------------------------------+
| STDDEV(GRADE)                             |
+-------------------------------------------+
| 13.34634781503913901351440495699463828285 |
+-------------------------------------------+
explain_protocol: 2
EXPLAIN update t1 set (grade, name) = (select grade, name from t1 where rownum <=1) where grade < (select max(grade) from t2 where id < t1.id);
Query Plan
=========================================================================
|ID|OPERATOR                             |NAME    |EST.ROWS|EST.TIME(us)|
-------------------------------------------------------------------------
|0 |DISTRIBUTED UPDATE                   |        |1       |70          |
|1 |└─SUBPLAN FILTER                     |        |1       |45          |
|2 |  ├─SUBPLAN SCAN                     |VIEW2   |1       |39          |
|3 |  │ └─HASH GROUP BY                  |        |1       |39          |
|4 |  │   └─NESTED-LOOP JOIN             |        |4       |37          |
|5 |  │     ├─PX COORDINATOR             |        |9       |36          |
|6 |  │     │ └─EXCHANGE OUT DISTR       |:EX10000|9       |26          |
|7 |  │     │   └─PX PARTITION ITERATOR  |        |9       |5           |
|8 |  │     │     └─TABLE FULL SCAN      |T1      |9       |5           |
|9 |  │     └─MATERIAL                   |        |4       |13          |
|10|  │       └─PX COORDINATOR           |        |4       |12          |
|11|  │         └─EXCHANGE OUT DISTR     |:EX20000|4       |10          |
|12|  │           └─PX PARTITION ITERATOR|        |4       |5           |
|13|  │             └─TABLE FULL SCAN    |T2      |4       |5           |
|14|  └─LIMIT                            |        |1       |6           |
|15|    └─PX COORDINATOR                 |        |1       |6           |
|16|      └─EXCHANGE OUT DISTR           |:EX30000|1       |6           |
|17|        └─LIMIT                      |        |1       |5           |
|18|          └─PX PARTITION ITERATOR    |        |1       |5           |
|19|            └─TABLE FULL SCAN        |T1      |1       |5           |
=========================================================================
Outputs & filters:
-------------------------------------
  0 - output(nil), filter(nil)
      table_columns([{VIEW2: ({T1: (VIEW2.T1.__pk_increment, VIEW2.T1.ID, VIEW2.T1.NAME, VIEW2.T1.GRADE, VIEW2.T1.PID)}), hash_distinct}]),
      update([VIEW2.T1.GRADE=column_conv(NUMBER,PS:(-1,0),NULL,T1.GRADE)], [VIEW2.T1.NAME=column_conv(VARCHAR2,utf8mb4_bin,length:10,NULL,T1.NAME)])
  1 - output([VIEW2.T1.__pk_increment], [VIEW2.T1.ID], [VIEW2.T1.NAME], [VIEW2.T1.GRADE], [VIEW2.T1.PID], [T1.GRADE], [T1.NAME]), filter(nil)
      exec_params_(nil), onetime_exprs_(nil), init_plan_idxs_([1]), use_batch=false
  2 - output([VIEW2.T1.__pk_increment], [VIEW2.T1.ID], [VIEW2.T1.NAME], [VIEW2.T1.GRADE], [VIEW2.T1.PID]), filter(nil)
      access([VIEW2.T1.__pk_increment], [VIEW2.T1.ID], [VIEW2.T1.NAME], [VIEW2.T1.GRADE], [VIEW2.T1.PID])
  3 - output([T1.__pk_increment], [T1.ID], [T1.NAME], [T1.GRADE], [T1.PID]), filter([T1.GRADE < T_FUN_MAX(T2.GRADE)])
      group([T1.ID], [T1.__pk_increment]), agg_func([T_FUN_MAX(T2.GRADE)])
  4 - output([T1.ID], [T1.__pk_increment], [T1.NAME], [T1.GRADE], [T1.PID], [T2.GRADE]), filter(nil)
      conds([T2.ID < T1.ID]), nl_params_(nil), use_batch=false
  5 - output([T1.ID], [T1.__pk_increment], [T1.NAME], [T1.GRADE], [T1.PID]), filter(nil)
  6 - output([T1.ID], [T1.__pk_increment], [T1.NAME], [T1.GRADE], [T1.PID]), filter(nil)
      dop=1
  7 - output([T1.__pk_increment], [T1.ID], [T1.GRADE], [T1.NAME], [T1.PID]), filter(nil)
      force partition granule
  8 - output([T1.__pk_increment], [T1.ID], [T1.GRADE], [T1.NAME], [T1.PID]), filter(nil)
      access([T1.__pk_increment], [T1.ID], [T1.GRADE], [T1.NAME], [T1.PID]), partitions(p[0-1])
      is_index_back=false, is_global_index=false, 
      range_key([T1.__pk_increment]), range(MIN ; MAX)always true
  9 - output([T2.ID], [T2.GRADE]), filter(nil)
 10 - output([T2.ID], [T2.GRADE]), filter(nil)
 11 - output([T2.ID], [T2.GRADE]), filter(nil)
      dop=1
 12 - output([T2.ID], [T2.GRADE]), filter(nil)
      force partition granule
 13 - output([T2.ID], [T2.GRADE]), filter(nil)
      access([T2.ID], [T2.GRADE]), partitions(p[0-1])
      is_index_back=false, is_global_index=false, 
      range_key([T2.__pk_increment]), range(MIN ; MAX)always true
 14 - output([T1.GRADE], [T1.NAME]), filter(nil)
      limit(cast(FLOOR(1), BIGINT(-1, 0))), offset(nil)
 15 - output([T1.GRADE], [T1.NAME]), filter(nil)
 16 - output([T1.GRADE], [T1.NAME]), filter(nil)
      dop=1
 17 - output([T1.GRADE], [T1.NAME]), filter(nil)
      limit(cast(FLOOR(1), BIGINT(-1, 0))), offset(nil)
 18 - output([T1.GRADE], [T1.NAME]), filter(nil)
      force partition granule
 19 - output([T1.GRADE], [T1.NAME]), filter(nil)
      access([T1.GRADE], [T1.NAME]), partitions(p[0-1])
      limit(cast(FLOOR(1), BIGINT(-1, 0))), offset(nil), is_index_back=false, is_global_index=false, 
      range_key([T1.__pk_increment]), range(MIN ; MAX)always true
update t1 set (grade, name) = (select grade, name from t1 where rownum <=1) where grade < (select max(grade) from t2 where id < t1.id);
explain_protocol: 0
select stddev(grade) from t1;
+---------------+
| STDDEV(GRADE) |
+---------------+
|             0 |
+---------------+
rollback;
explain_protocol: 2
EXPLAIN update /*+no_rewrite*/ t1 set (grade, name) = (select grade, name from t1 where rownum <=1) where grade < (select max(grade) from t2 where id < t1.id);
Query Plan
===========================================================================
|ID|OPERATOR                               |NAME    |EST.ROWS|EST.TIME(us)|
---------------------------------------------------------------------------
|0 |DISTRIBUTED UPDATE                     |        |3       |391         |
|1 |└─SUBPLAN FILTER                       |        |3       |344         |
|2 |  ├─PX COORDINATOR                     |        |3       |338         |
|3 |  │ └─EXCHANGE OUT DISTR               |:EX10000|3       |335         |
|4 |  │   └─SUBPLAN FILTER                 |        |3       |328         |
|5 |  │     ├─PX PARTITION ITERATOR        |        |9       |5           |
|6 |  │     │ └─TABLE FULL SCAN            |T1      |9       |5           |
|7 |  │     └─SCALAR GROUP BY              |        |1       |36          |
|8 |  │       └─DISTRIBUTED TABLE FULL SCAN|T2      |2       |36          |
|9 |  └─LIMIT                              |        |1       |6           |
|10|    └─PX COORDINATOR                   |        |1       |6           |
|11|      └─EXCHANGE OUT DISTR             |:EX20000|1       |6           |
|12|        └─LIMIT                        |        |1       |5           |
|13|          └─PX PARTITION ITERATOR      |        |1       |5           |
|14|            └─TABLE FULL SCAN          |T1      |1       |5           |
===========================================================================
Outputs & filters:
-------------------------------------
  0 - output(nil), filter(nil)
      table_columns([{T1: ({T1: (T1.__pk_increment, T1.ID, T1.NAME, T1.GRADE, T1.PID)})}]),
      update([T1.GRADE=column_conv(NUMBER,PS:(-1,0),NULL,T1.GRADE)], [T1.NAME=column_conv(VARCHAR2,utf8mb4_bin,length:10,NULL,T1.NAME)])
  1 - output([T1.__pk_increment], [T1.ID], [T1.NAME], [T1.GRADE], [T1.PID], [T1.GRADE], [T1.NAME]), filter(nil)
      exec_params_(nil), onetime_exprs_(nil), init_plan_idxs_([1]), use_batch=false
  2 - output([T1.__pk_increment], [T1.ID], [T1.NAME], [T1.GRADE], [T1.PID]), filter(nil)
  3 - output([T1.__pk_increment], [T1.ID], [T1.NAME], [T1.GRADE], [T1.PID]), filter(nil)
      dop=1
  4 - output([T1.__pk_increment], [T1.ID], [T1.NAME], [T1.GRADE], [T1.PID]), filter([T1.GRADE < subquery(1)])
      exec_params_([T1.ID(:0)]), onetime_exprs_(nil), init_plan_idxs_(nil), use_batch=false
  5 - output([T1.__pk_increment], [T1.ID], [T1.GRADE], [T1.NAME], [T1.PID]), filter(nil)
      force partition granule
  6 - output([T1.__pk_increment], [T1.ID], [T1.GRADE], [T1.NAME], [T1.PID]), filter(nil)
      access([T1.__pk_increment], [T1.ID], [T1.GRADE], [T1.NAME], [T1.PID]), partitions(p[0-1])
      is_index_back=false, is_global_index=false, 
      range_key([T1.__pk_increment]), range(MIN ; MAX)always true
  7 - output([T_FUN_MAX(T_FUN_MAX(T2.GRADE))]), filter(nil)
      group(nil), agg_func([T_FUN_MAX(T_FUN_MAX(T2.GRADE))])
  8 - output([T_FUN_MAX(T2.GRADE)]), filter([T2.ID < :0])
      access([T2.ID], [T2.GRADE]), partitions(p[0-1])
      is_index_back=false, is_global_index=false, filter_before_indexback[false], 
      range_key([T2.__pk_increment]), range(MIN ; MAX)always true, 
      pushdown_aggregation([T_FUN_MAX(T2.GRADE)])
  9 - output([T1.GRADE], [T1.NAME]), filter(nil)
      limit(cast(FLOOR(1), BIGINT(-1, 0))), offset(nil)
 10 - output([T1.GRADE], [T1.NAME]), filter(nil)
 11 - output([T1.GRADE], [T1.NAME]), filter(nil)
      dop=1
 12 - output([T1.GRADE], [T1.NAME]), filter(nil)
      limit(cast(FLOOR(1), BIGINT(-1, 0))), offset(nil)
 13 - output([T1.GRADE], [T1.NAME]), filter(nil)
      force partition granule
 14 - output([T1.GRADE], [T1.NAME]), filter(nil)
      access([T1.GRADE], [T1.NAME]), partitions(p[0-1])
      limit(cast(FLOOR(1), BIGINT(-1, 0))), offset(nil), is_index_back=false, is_global_index=false, 
      range_key([T1.__pk_increment]), range(MIN ; MAX)always true
update /*+no_rewrite*/ t1 set (grade, name) = (select grade, name from t1 where rownum <=1) where grade < (select max(grade) from t2 where id < t1.id);
explain_protocol: 0
select stddev(grade) from t1;
+---------------+
| STDDEV(GRADE) |
+---------------+
|             0 |
+---------------+
rollback;

explain_protocol: 2
EXPLAIN update t1 set (grade, name) = (select max(grade), max(name) from t2 where t2.id < t1.id) where grade < (select max(grade) from t2 where t2.id < t1.id);
Query Plan
=============================================================================
|ID|OPERATOR                                 |NAME    |EST.ROWS|EST.TIME(us)|
-----------------------------------------------------------------------------
|0 |DISTRIBUTED UPDATE                       |        |1       |64          |
|1 |└─SUBPLAN SCAN                           |VIEW2   |1       |39          |
|2 |  └─HASH GROUP BY                        |        |1       |39          |
|3 |    └─NESTED-LOOP OUTER JOIN             |        |1       |39          |
|4 |      ├─SUBPLAN SCAN                     |VIEW1   |1       |39          |
|5 |      │ └─HASH GROUP BY                  |        |1       |39          |
|6 |      │   └─NESTED-LOOP JOIN             |        |4       |37          |
|7 |      │     ├─PX COORDINATOR             |        |9       |36          |
|8 |      │     │ └─EXCHANGE OUT DISTR       |:EX10000|9       |26          |
|9 |      │     │   └─PX PARTITION ITERATOR  |        |9       |5           |
|10|      │     │     └─TABLE FULL SCAN      |T1      |9       |5           |
|11|      │     └─MATERIAL                   |        |4       |13          |
|12|      │       └─PX COORDINATOR           |        |4       |12          |
|13|      │         └─EXCHANGE OUT DISTR     |:EX20000|4       |10          |
|14|      │           └─PX PARTITION ITERATOR|        |4       |5           |
|15|      │             └─TABLE FULL SCAN    |T2      |4       |5           |
|16|      └─MATERIAL                         |        |4       |15          |
|17|        └─PX COORDINATOR                 |        |4       |15          |
|18|          └─EXCHANGE OUT DISTR           |:EX30000|4       |12          |
|19|            └─PX PARTITION ITERATOR      |        |4       |5           |
|20|              └─TABLE FULL SCAN          |T2      |4       |5           |
=============================================================================
Outputs & filters:
-------------------------------------
  0 - output(nil), filter(nil)
      table_columns([{VIEW2: ({T1: (VIEW2.VIEW1.T1.__pk_increment, VIEW2.VIEW1.T1.ID, VIEW2.VIEW1.T1.NAME, VIEW2.VIEW1.T1.GRADE, VIEW2.VIEW1.T1.PID)}), 
      hash_distinct}]),
      update([VIEW2.VIEW1.T1.GRADE=column_conv(NUMBER,PS:(-1,0),NULL,VIEW2.subquery(0))], [VIEW2.VIEW1.T1.NAME=column_conv(VARCHAR2,utf8mb4_bin,length:10,
      NULL,VIEW2.subquery(0))])
  1 - output([VIEW2.subquery(0)], [VIEW2.subquery(0)], [VIEW2.VIEW1.T1.__pk_increment], [VIEW2.VIEW1.T1.ID], [VIEW2.VIEW1.T1.NAME], [VIEW2.VIEW1.T1.GRADE],
       [VIEW2.VIEW1.T1.PID]), filter(nil), rowset=16
      access([VIEW2.subquery(0)], [VIEW2.subquery(0)], [VIEW2.VIEW1.T1.__pk_increment], [VIEW2.VIEW1.T1.ID], [VIEW2.VIEW1.T1.NAME], [VIEW2.VIEW1.T1.GRADE],
       [VIEW2.VIEW1.T1.PID])
  2 - output([T_FUN_MAX(T2.GRADE)], [T_FUN_MAX(T2.NAME)], [VIEW1.T1.__pk_increment], [VIEW1.T1.ID], [VIEW1.T1.NAME], [VIEW1.T1.GRADE], [VIEW1.T1.PID]), filter(nil), rowset=16
      group([VIEW1.T1.__pk_increment], [VIEW1.T1.ID]), agg_func([T_FUN_MAX(T2.GRADE)], [T_FUN_MAX(T2.NAME)])
  3 - output([VIEW1.T1.__pk_increment], [VIEW1.T1.ID], [VIEW1.T1.NAME], [VIEW1.T1.GRADE], [VIEW1.T1.PID], [T2.GRADE], [T2.NAME]), filter(nil), rowset=16
      conds([T2.ID < VIEW1.T1.ID]), nl_params_(nil), use_batch=false
  4 - output([VIEW1.T1.__pk_increment], [VIEW1.T1.ID], [VIEW1.T1.NAME], [VIEW1.T1.GRADE], [VIEW1.T1.PID]), filter(nil), rowset=16
      access([VIEW1.T1.__pk_increment], [VIEW1.T1.ID], [VIEW1.T1.NAME], [VIEW1.T1.GRADE], [VIEW1.T1.PID])
  5 - output([T1.__pk_increment], [T1.ID], [T1.NAME], [T1.GRADE], [T1.PID]), filter([T1.GRADE < T_FUN_MAX(T2.GRADE)]), rowset=16
      group([T1.ID], [T1.__pk_increment]), agg_func([T_FUN_MAX(T2.GRADE)])
  6 - output([T1.ID], [T1.__pk_increment], [T1.NAME], [T1.GRADE], [T1.PID], [T2.GRADE]), filter(nil), rowset=16
      conds([T2.ID < T1.ID]), nl_params_(nil), use_batch=false
  7 - output([T1.ID], [T1.__pk_increment], [T1.NAME], [T1.GRADE], [T1.PID]), filter(nil), rowset=16
  8 - output([T1.ID], [T1.__pk_increment], [T1.NAME], [T1.GRADE], [T1.PID]), filter(nil), rowset=16
      dop=1
  9 - output([T1.__pk_increment], [T1.ID], [T1.GRADE], [T1.NAME], [T1.PID]), filter(nil), rowset=16
      force partition granule
 10 - output([T1.__pk_increment], [T1.ID], [T1.GRADE], [T1.NAME], [T1.PID]), filter(nil), rowset=16
      access([T1.__pk_increment], [T1.ID], [T1.GRADE], [T1.NAME], [T1.PID]), partitions(p[0-1])
      is_index_back=false, is_global_index=false, 
      range_key([T1.__pk_increment]), range(MIN ; MAX)always true
 11 - output([T2.ID], [T2.GRADE]), filter(nil), rowset=16
 12 - output([T2.ID], [T2.GRADE]), filter(nil), rowset=16
 13 - output([T2.ID], [T2.GRADE]), filter(nil), rowset=16
      dop=1
 14 - output([T2.ID], [T2.GRADE]), filter(nil), rowset=16
      force partition granule
 15 - output([T2.ID], [T2.GRADE]), filter(nil), rowset=16
      access([T2.ID], [T2.GRADE]), partitions(p[0-1])
      is_index_back=false, is_global_index=false, 
      range_key([T2.__pk_increment]), range(MIN ; MAX)always true
 16 - output([T2.ID], [T2.GRADE], [T2.NAME]), filter(nil), rowset=16
 17 - output([T2.ID], [T2.GRADE], [T2.NAME]), filter(nil), rowset=16
 18 - output([T2.ID], [T2.GRADE], [T2.NAME]), filter(nil), rowset=16
      dop=1
 19 - output([T2.ID], [T2.GRADE], [T2.NAME]), filter(nil), rowset=16
      force partition granule
 20 - output([T2.ID], [T2.GRADE], [T2.NAME]), filter(nil), rowset=16
      access([T2.ID], [T2.GRADE], [T2.NAME]), partitions(p[0-1])
      is_index_back=false, is_global_index=false, 
      range_key([T2.__pk_increment]), range(MIN ; MAX)always true
update t1 set (grade, name) = (select max(grade), max(name) from t2 where t2.id < t1.id) where grade < (select max(grade) from t2 where t2.id < t1.id);
explain_protocol: 0
select stddev(grade) from t1;
+---------------+
| STDDEV(GRADE) |
+---------------+
|             0 |
+---------------+
rollback;
explain_protocol: 2
EXPLAIN update /*+no_rewrite*/ t1 set (grade, name) = (select max(grade), max(name) from t2 where t2.id < t1.id) where grade < (select max(grade) from t2 where t2.id < t1.id);
Query Plan
=============================================================================
|ID|OPERATOR                                 |NAME    |EST.ROWS|EST.TIME(us)|
-----------------------------------------------------------------------------
|0 |PX COORDINATOR                           |        |3       |493         |
|1 |└─EXCHANGE OUT DISTR                     |:EX10000|3       |490         |
|2 |  └─PX PARTITION ITERATOR                |        |3       |483         |
|3 |    └─UPDATE                             |        |3       |483         |
|4 |      └─SUBPLAN FILTER                   |        |3       |436         |
|5 |        ├─SUBPLAN FILTER                 |        |3       |328         |
|6 |        │ ├─TABLE FULL SCAN              |T1      |9       |5           |
|7 |        │ └─SCALAR GROUP BY              |        |1       |36          |
|8 |        │   └─DISTRIBUTED TABLE FULL SCAN|T2      |2       |36          |
|9 |        └─SCALAR GROUP BY                |        |1       |36          |
|10|          └─DISTRIBUTED TABLE FULL SCAN  |T2      |2       |36          |
=============================================================================
Outputs & filters:
-------------------------------------
  0 - output(nil), filter(nil)
  1 - output(nil), filter(nil)
      dop=1
  2 - output(nil), filter(nil)
      partition wise, force partition granule
  3 - output(nil), filter(nil)
      table_columns([{T1: ({T1: (T1.__pk_increment, T1.ID, T1.NAME, T1.GRADE, T1.PID)})}]),
      update([T1.GRADE=column_conv(NUMBER,PS:(-1,0),NULL,T_FUN_MAX(T_FUN_MAX(T2.GRADE)))], [T1.NAME=column_conv(VARCHAR2,utf8mb4_bin,length:10,NULL,T_FUN_MAX(T_FUN_MAX(T2.NAME)))])
  4 - output([T1.__pk_increment], [T1.ID], [T1.NAME], [T1.GRADE], [T1.PID], [T_FUN_MAX(T_FUN_MAX(T2.GRADE))], [T_FUN_MAX(T_FUN_MAX(T2.NAME))]), filter(nil)
      exec_params_([T1.ID(:1)]), onetime_exprs_(nil), init_plan_idxs_(nil), use_batch=false
  5 - output([T1.__pk_increment], [T1.ID], [T1.NAME], [T1.GRADE], [T1.PID]), filter([T1.GRADE < subquery(1)])
      exec_params_([T1.ID(:0)]), onetime_exprs_(nil), init_plan_idxs_(nil), use_batch=false
  6 - output([T1.__pk_increment], [T1.ID], [T1.GRADE], [T1.NAME], [T1.PID]), filter(nil)
      access([T1.__pk_increment], [T1.ID], [T1.GRADE], [T1.NAME], [T1.PID]), partitions(p[0-1])
      is_index_back=false, is_global_index=false, 
      range_key([T1.__pk_increment]), range(MIN ; MAX)always true
  7 - output([T_FUN_MAX(T_FUN_MAX(T2.GRADE))]), filter(nil)
      group(nil), agg_func([T_FUN_MAX(T_FUN_MAX(T2.GRADE))])
  8 - output([T_FUN_MAX(T2.GRADE)]), filter([T2.ID < :0])
      access([T2.ID], [T2.GRADE]), partitions(p[0-1])
      is_index_back=false, is_global_index=false, filter_before_indexback[false], 
      range_key([T2.__pk_increment]), range(MIN ; MAX)always true, 
      pushdown_aggregation([T_FUN_MAX(T2.GRADE)])
  9 - output([T_FUN_MAX(T_FUN_MAX(T2.GRADE))], [T_FUN_MAX(T_FUN_MAX(T2.NAME))]), filter(nil)
      group(nil), agg_func([T_FUN_MAX(T_FUN_MAX(T2.GRADE))], [T_FUN_MAX(T_FUN_MAX(T2.NAME))])
 10 - output([T_FUN_MAX(T2.GRADE)], [T_FUN_MAX(T2.NAME)]), filter([T2.ID < :1])
      access([T2.ID], [T2.GRADE], [T2.NAME]), partitions(p[0-1])
      is_index_back=false, is_global_index=false, filter_before_indexback[false], 
      range_key([T2.__pk_increment]), range(MIN ; MAX)always true, 
      pushdown_aggregation([T_FUN_MAX(T2.GRADE)], [T_FUN_MAX(T2.NAME)])
update /*+no_rewrite*/ t1 set (grade, name) = (select max(grade), max(name) from t2 where t2.id < t1.id) where grade < (select max(grade) from t2 where t2.id < t1.id);
explain_protocol: 0
select stddev(grade) from t1;
+---------------+
| STDDEV(GRADE) |
+---------------+
|             0 |
+---------------+
rollback;

explain_protocol: 2
EXPLAIN update t1 set (grade, name) = (select max(grade), max(name) from t2) where grade < (select max(grade) from t1 where t1.id < t1.id);
Query Plan
=========================================================================
|ID|OPERATOR                             |NAME    |EST.ROWS|EST.TIME(us)|
-------------------------------------------------------------------------
|0 |DISTRIBUTED UPDATE                   |        |1       |178         |
|1 |└─NESTED-LOOP JOIN CARTESIAN         |        |1       |146         |
|2 |  ├─SUBPLAN SCAN                     |VIEW2   |1       |7           |
|3 |  │ └─SCALAR GROUP BY                |        |1       |7           |
|4 |  │   └─PX COORDINATOR               |        |1       |7           |
|5 |  │     └─EXCHANGE OUT DISTR         |:EX10000|1       |6           |
|6 |  │       └─MERGE GROUP BY           |        |1       |5           |
|7 |  │         └─PX PARTITION ITERATOR  |        |4       |5           |
|8 |  │           └─TABLE FULL SCAN      |T2      |4       |5           |
|9 |  └─NESTED-LOOP JOIN                 |        |1       |90          |
|10|    ├─SUBPLAN SCAN                   |VIEW1   |1       |5           |
|11|    │ └─SCALAR GROUP BY              |        |1       |5           |
|12|    │   └─PX COORDINATOR             |        |0       |5           |
|13|    │     └─EXCHANGE OUT DISTR       |:EX20000|0       |5           |
|14|    │       └─MERGE GROUP BY         |        |0       |5           |
|15|    │         └─PX PARTITION ITERATOR|        |0       |5           |
|16|    │           └─TABLE FULL SCAN    |T1      |0       |5           |
|17|    └─PX COORDINATOR                 |        |9       |36          |
|18|      └─EXCHANGE OUT DISTR           |:EX30000|9       |26          |
|19|        └─PX PARTITION ITERATOR      |        |9       |5           |
|20|          └─TABLE FULL SCAN          |T1      |9       |5           |
=========================================================================
Outputs & filters:
-------------------------------------
  0 - output(nil), filter(nil)
      table_columns([{T1: ({T1: (T1.__pk_increment, T1.ID, T1.NAME, T1.GRADE, T1.PID)}), hash_distinct}]),
      update([T1.GRADE=column_conv(NUMBER,PS:(-1,0),NULL,VIEW2.MAX(GRADE))], [T1.NAME=column_conv(VARCHAR2,utf8mb4_bin,length:10,NULL,VIEW2.MAX(NAME))])
  1 - output([T1.__pk_increment], [T1.ID], [T1.NAME], [T1.GRADE], [T1.PID], [VIEW2.MAX(GRADE)], [VIEW2.MAX(NAME)]), filter(nil), rowset=16
      conds(nil), nl_params_(nil), use_batch=false
  2 - output([VIEW2.MAX(GRADE)], [VIEW2.MAX(NAME)]), filter(nil), rowset=16
      access([VIEW2.MAX(GRADE)], [VIEW2.MAX(NAME)])
  3 - output([T_FUN_MAX(T_FUN_MAX(T_FUN_MAX(T2.GRADE)))], [T_FUN_MAX(T_FUN_MAX(T_FUN_MAX(T2.NAME)))]), filter(nil), rowset=16
      group(nil), agg_func([T_FUN_MAX(T_FUN_MAX(T_FUN_MAX(T2.GRADE)))], [T_FUN_MAX(T_FUN_MAX(T_FUN_MAX(T2.NAME)))])
  4 - output([T_FUN_MAX(T_FUN_MAX(T2.GRADE))], [T_FUN_MAX(T_FUN_MAX(T2.NAME))]), filter(nil), rowset=16
  5 - output([T_FUN_MAX(T_FUN_MAX(T2.GRADE))], [T_FUN_MAX(T_FUN_MAX(T2.NAME))]), filter(nil), rowset=16
      dop=1
  6 - output([T_FUN_MAX(T_FUN_MAX(T2.GRADE))], [T_FUN_MAX(T_FUN_MAX(T2.NAME))]), filter(nil), rowset=16
      group(nil), agg_func([T_FUN_MAX(T_FUN_MAX(T2.GRADE))], [T_FUN_MAX(T_FUN_MAX(T2.NAME))])
  7 - output([T_FUN_MAX(T2.GRADE)], [T_FUN_MAX(T2.NAME)]), filter(nil), rowset=16
      force partition granule
  8 - output([T_FUN_MAX(T2.GRADE)], [T_FUN_MAX(T2.NAME)]), filter(nil), rowset=16
      access([T2.GRADE], [T2.NAME]), partitions(p[0-1])
      is_index_back=false, is_global_index=false, 
      range_key([T2.__pk_increment]), range(MIN ; MAX)always true, 
      pushdown_aggregation([T_FUN_MAX(T2.GRADE)], [T_FUN_MAX(T2.NAME)])
  9 - output([T1.__pk_increment], [T1.ID], [T1.NAME], [T1.GRADE], [T1.PID]), filter(nil), rowset=16
      conds([T1.GRADE < VIEW1.MAX(GRADE)]), nl_params_(nil), use_batch=false
 10 - output([VIEW1.MAX(GRADE)]), filter(nil), rowset=16
      access([VIEW1.MAX(GRADE)])
 11 - output([T_FUN_MAX(T_FUN_MAX(T_FUN_MAX(T1.GRADE)))]), filter(nil), rowset=16
      group(nil), agg_func([T_FUN_MAX(T_FUN_MAX(T_FUN_MAX(T1.GRADE)))])
 12 - output([T_FUN_MAX(T_FUN_MAX(T1.GRADE))]), filter(nil), rowset=16
 13 - output([T_FUN_MAX(T_FUN_MAX(T1.GRADE))]), filter(nil), rowset=16
      dop=1
 14 - output([T_FUN_MAX(T_FUN_MAX(T1.GRADE))]), filter(nil), rowset=16
      group(nil), agg_func([T_FUN_MAX(T_FUN_MAX(T1.GRADE))])
 15 - output([T_FUN_MAX(T1.GRADE)]), filter(nil), rowset=16
      force partition granule
 16 - output([T_FUN_MAX(T1.GRADE)]), filter([T1.ID < T1.ID]), rowset=16
      access([T1.ID], [T1.GRADE]), partitions(p[0-1])
      is_index_back=false, is_global_index=false, filter_before_indexback[false], 
      range_key([T1.__pk_increment]), range(MIN ; MAX)always true, 
      pushdown_aggregation([T_FUN_MAX(T1.GRADE)])
 17 - output([T1.__pk_increment], [T1.ID], [T1.NAME], [T1.GRADE], [T1.PID]), filter(nil), rowset=16
 18 - output([T1.__pk_increment], [T1.ID], [T1.NAME], [T1.GRADE], [T1.PID]), filter(nil), rowset=16
      dop=1
 19 - output([T1.__pk_increment], [T1.ID], [T1.GRADE], [T1.NAME], [T1.PID]), filter(nil), rowset=16
      force partition granule
 20 - output([T1.__pk_increment], [T1.ID], [T1.GRADE], [T1.NAME], [T1.PID]), filter(nil), rowset=16
      access([T1.__pk_increment], [T1.ID], [T1.GRADE], [T1.NAME], [T1.PID]), partitions(p[0-1])
      is_index_back=false, is_global_index=false, 
      range_key([T1.__pk_increment]), range(MIN ; MAX)always true
update t1 set (grade, name) = (select max(grade), max(name) from t2) where grade < (select max(grade) from t1 where t1.id < t1.id);
explain_protocol: 0
select stddev(grade) from t1;
+-------------------------------------------+
| STDDEV(GRADE)                             |
+-------------------------------------------+
| 13.34634781503913901351440495699463828285 |
+-------------------------------------------+
rollback;
explain_protocol: 2
EXPLAIN update /*+no_rewrite*/ t1 set (grade, name) = (select max(grade), max(name) from t2) where grade < (select max(grade) from t1 where t1.id < t1.id);
Query Plan
=======================================================================
|ID|OPERATOR                           |NAME    |EST.ROWS|EST.TIME(us)|
-----------------------------------------------------------------------
|0 |DISTRIBUTED UPDATE                 |        |3       |73          |
|1 |└─SUBPLAN FILTER                   |        |3       |26          |
|2 |  ├─SUBPLAN FILTER                 |        |3       |20          |
|3 |  │ ├─PX COORDINATOR               |        |3       |15          |
|4 |  │ │ └─EXCHANGE OUT DISTR         |:EX10000|3       |12          |
|5 |  │ │   └─PX PARTITION ITERATOR    |        |3       |5           |
|6 |  │ │     └─TABLE FULL SCAN        |T1      |3       |5           |
|7 |  │ └─SCALAR GROUP BY              |        |1       |5           |
|8 |  │   └─PX COORDINATOR             |        |0       |5           |
|9 |  │     └─EXCHANGE OUT DISTR       |:EX20000|0       |5           |
|10|  │       └─MERGE GROUP BY         |        |0       |5           |
|11|  │         └─PX PARTITION ITERATOR|        |0       |5           |
|12|  │           └─TABLE FULL SCAN    |T1      |0       |5           |
|13|  └─SCALAR GROUP BY                |        |1       |7           |
|14|    └─PX COORDINATOR               |        |1       |7           |
|15|      └─EXCHANGE OUT DISTR         |:EX30000|1       |6           |
|16|        └─MERGE GROUP BY           |        |1       |5           |
|17|          └─PX PARTITION ITERATOR  |        |4       |5           |
|18|            └─TABLE FULL SCAN      |T2      |4       |5           |
=======================================================================
Outputs & filters:
-------------------------------------
  0 - output(nil), filter(nil)
      table_columns([{T1: ({T1: (T1.__pk_increment, T1.ID, T1.NAME, T1.GRADE, T1.PID)})}]),
      update([T1.GRADE=column_conv(NUMBER,PS:(-1,0),NULL,T_FUN_MAX(T_FUN_MAX(T_FUN_MAX(T2.GRADE))))], [T1.NAME=column_conv(VARCHAR2,utf8mb4_bin,length:10,
      NULL,T_FUN_MAX(T_FUN_MAX(T_FUN_MAX(T2.NAME))))])
  1 - output([T1.__pk_increment], [T1.ID], [T1.NAME], [T1.GRADE], [T1.PID], [T_FUN_MAX(T_FUN_MAX(T_FUN_MAX(T2.GRADE)))], [T_FUN_MAX(T_FUN_MAX(T_FUN_MAX(T2.NAME)))]), filter(nil)
      exec_params_(nil), onetime_exprs_(nil), init_plan_idxs_([1]), use_batch=false
  2 - output([T1.__pk_increment], [T1.ID], [T1.NAME], [T1.GRADE], [T1.PID]), filter(nil)
      exec_params_(nil), onetime_exprs_([subquery(1)(:0)]), init_plan_idxs_(nil), use_batch=false
  3 - output([T1.__pk_increment], [T1.ID], [T1.NAME], [T1.GRADE], [T1.PID]), filter(nil)
  4 - output([T1.__pk_increment], [T1.ID], [T1.NAME], [T1.GRADE], [T1.PID]), filter(nil)
      dop=1
  5 - output([T1.__pk_increment], [T1.ID], [T1.GRADE], [T1.NAME], [T1.PID]), filter(nil)
      force partition granule
  6 - output([T1.__pk_increment], [T1.ID], [T1.GRADE], [T1.NAME], [T1.PID]), filter([T1.GRADE < :0])
      access([T1.__pk_increment], [T1.ID], [T1.GRADE], [T1.NAME], [T1.PID]), partitions(p[0-1])
      is_index_back=false, is_global_index=false, filter_before_indexback[false], 
      range_key([T1.__pk_increment]), range(MIN ; MAX)always true
  7 - output([T_FUN_MAX(T_FUN_MAX(T_FUN_MAX(T1.GRADE)))]), filter(nil)
      group(nil), agg_func([T_FUN_MAX(T_FUN_MAX(T_FUN_MAX(T1.GRADE)))])
  8 - output([T_FUN_MAX(T_FUN_MAX(T1.GRADE))]), filter(nil)
  9 - output([T_FUN_MAX(T_FUN_MAX(T1.GRADE))]), filter(nil)
      dop=1
 10 - output([T_FUN_MAX(T_FUN_MAX(T1.GRADE))]), filter(nil)
      group(nil), agg_func([T_FUN_MAX(T_FUN_MAX(T1.GRADE))])
 11 - output([T_FUN_MAX(T1.GRADE)]), filter(nil)
      force partition granule
 12 - output([T_FUN_MAX(T1.GRADE)]), filter([T1.ID < T1.ID])
      access([T1.ID], [T1.GRADE]), partitions(p[0-1])
      is_index_back=false, is_global_index=false, filter_before_indexback[false], 
      range_key([T1.__pk_increment]), range(MIN ; MAX)always true, 
      pushdown_aggregation([T_FUN_MAX(T1.GRADE)])
 13 - output([T_FUN_MAX(T_FUN_MAX(T_FUN_MAX(T2.GRADE)))], [T_FUN_MAX(T_FUN_MAX(T_FUN_MAX(T2.NAME)))]), filter(nil)
      group(nil), agg_func([T_FUN_MAX(T_FUN_MAX(T_FUN_MAX(T2.GRADE)))], [T_FUN_MAX(T_FUN_MAX(T_FUN_MAX(T2.NAME)))])
 14 - output([T_FUN_MAX(T_FUN_MAX(T2.GRADE))], [T_FUN_MAX(T_FUN_MAX(T2.NAME))]), filter(nil)
 15 - output([T_FUN_MAX(T_FUN_MAX(T2.GRADE))], [T_FUN_MAX(T_FUN_MAX(T2.NAME))]), filter(nil)
      dop=1
 16 - output([T_FUN_MAX(T_FUN_MAX(T2.GRADE))], [T_FUN_MAX(T_FUN_MAX(T2.NAME))]), filter(nil)
      group(nil), agg_func([T_FUN_MAX(T_FUN_MAX(T2.GRADE))], [T_FUN_MAX(T_FUN_MAX(T2.NAME))])
 17 - output([T_FUN_MAX(T2.GRADE)], [T_FUN_MAX(T2.NAME)]), filter(nil)
      force partition granule
 18 - output([T_FUN_MAX(T2.GRADE)], [T_FUN_MAX(T2.NAME)]), filter(nil)
      access([T2.GRADE], [T2.NAME]), partitions(p[0-1])
      is_index_back=false, is_global_index=false, 
      range_key([T2.__pk_increment]), range(MIN ; MAX)always true, 
      pushdown_aggregation([T_FUN_MAX(T2.GRADE)], [T_FUN_MAX(T2.NAME)])
update /*+no_rewrite*/ t1 set (grade, name) = (select max(grade), max(name) from t2) where grade < (select max(grade) from t1 where t1.id < t1.id);
explain_protocol: 0
select stddev(grade) from t1;
+-------------------------------------------+
| STDDEV(GRADE)                             |
+-------------------------------------------+
| 13.34634781503913901351440495699463828285 |
+-------------------------------------------+
rollback;

CREATE OR REPLACE VIEW v1 AS SELECT * FROM t1 PARTITION(p1) WHERE lnnvl(name>'test7') START WITH id<=102 CONNECT BY PRIOR id=pid;

CREATE OR REPLACE TRIGGER tri1 instead OF INSERT OR DELETE OR UPDATE ON v1
BEGIN
  INSERT INTO t2 VALUES (:NEW.id,:NEW.name,:NEW.grade,:NEW.pid);
  INSERT INTO t2 VALUES (:OLD.id,:OLD.name,:OLD.grade,:OLD.pid);
END |

DELETE FROM t2;
commit;
explain_protocol: 2
EXPLAIN UPDATE v1 SET (id,name)=(SELECT max(id),max(name) FROM t1 WHERE id>v1.id);
Query Plan
========================================================================
|ID|OPERATOR                               |NAME |EST.ROWS|EST.TIME(us)|
------------------------------------------------------------------------
|0 |DISTRIBUTED UPDATE                     |     |2       |442         |
|1 |└─SUBPLAN FILTER                       |     |2       |408         |
|2 |  ├─SUBPLAN SCAN                       |V1   |2       |7           |
|3 |  │ └─SUBPLAN SCAN                     |VIEW1|2       |6           |
|4 |  │   └─HASH CONNECT BY                |     |2       |6           |
|5 |  │     ├─SUBPLAN SCAN                 |VIEW2|1       |3           |
|6 |  │     │ └─DISTRIBUTED TABLE FULL SCAN|T1   |1       |3           |
|7 |  │     └─SUBPLAN SCAN                 |VIEW3|7       |3           |
|8 |  │       └─DISTRIBUTED TABLE FULL SCAN|T1   |7       |3           |
|9 |  └─SCALAR GROUP BY                    |     |1       |295         |
|10|    └─DISTRIBUTED TABLE FULL SCAN      |T1   |3       |295         |
========================================================================
Outputs & filters:
-------------------------------------
  0 - output(nil), filter(nil)
      table_columns([{V1: ({V1: (V1.ID, V1.NAME, V1.GRADE, V1.PID)})}]),
      update([V1.ID=column_conv(NUMBER,PS:(-1,0),NULL,T_FUN_MAX(T_FUN_MAX(T1.ID)))], [V1.NAME=column_conv(VARCHAR2,utf8mb4_bin,length:10,NULL,T_FUN_MAX(T_FUN_MAX(T1.NAME)))])
  1 - output([V1.ID], [V1.NAME], [V1.GRADE], [V1.PID], [T_FUN_MAX(T_FUN_MAX(T1.ID))], [T_FUN_MAX(T_FUN_MAX(T1.NAME))]), filter(nil)
      exec_params_([V1.ID(:0)]), onetime_exprs_(nil), init_plan_idxs_(nil), use_batch=false
  2 - output([V1.ID], [V1.NAME], [V1.GRADE], [V1.PID]), filter(nil)
      access([V1.ID], [V1.NAME], [V1.GRADE], [V1.PID])
  3 - output([VIEW1.T1.ID], [VIEW1.T1.NAME], [VIEW1.T1.GRADE], [VIEW1.T1.PID]), filter([lnnvl(cast(VIEW1.T1.NAME > cast('test7', VARCHAR2(1048576 )), TINYINT(-1,
       0)))])
      access([VIEW1.T1.ID], [VIEW1.T1.PID], [VIEW1.T1.NAME], [VIEW1.T1.GRADE])
  4 - output([VIEW3.T1.__pk_increment], [VIEW3.T1.ID], [VIEW3.T1.PID], [VIEW3.T1.NAME], [VIEW3.T1.GRADE]), filter(nil)
      equal_conds([VIEW2.T1.ID = VIEW3.T1.PID]), other_conds(nil)
  5 - output([VIEW2.T1.__pk_increment], [VIEW2.T1.ID], [VIEW2.T1.PID], [VIEW2.T1.NAME], [VIEW2.T1.GRADE]), filter(nil)
      access([VIEW2.T1.__pk_increment], [VIEW2.T1.ID], [VIEW2.T1.PID], [VIEW2.T1.NAME], [VIEW2.T1.GRADE])
  6 - output([T1.__pk_increment], [T1.ID], [T1.PID], [T1.NAME], [T1.GRADE]), filter([T1.ID <= 102])
      access([T1.__pk_increment], [T1.ID], [T1.PID], [T1.NAME], [T1.GRADE]), partitions(p0)
      is_index_back=false, is_global_index=false, filter_before_indexback[false], 
      range_key([T1.__pk_increment]), range(MIN ; MAX)always true
  7 - output([VIEW3.T1.__pk_increment], [VIEW3.T1.ID], [VIEW3.T1.PID], [VIEW3.T1.NAME], [VIEW3.T1.GRADE]), filter(nil)
      access([VIEW3.T1.__pk_increment], [VIEW3.T1.ID], [VIEW3.T1.PID], [VIEW3.T1.NAME], [VIEW3.T1.GRADE])
  8 - output([T1.__pk_increment], [T1.ID], [T1.PID], [T1.NAME], [T1.GRADE]), filter(nil)
      access([T1.__pk_increment], [T1.ID], [T1.PID], [T1.NAME], [T1.GRADE]), partitions(p0)
      is_index_back=false, is_global_index=false, 
      range_key([T1.__pk_increment]), range(MIN ; MAX)always true
  9 - output([T_FUN_MAX(T_FUN_MAX(T1.ID))], [T_FUN_MAX(T_FUN_MAX(T1.NAME))]), filter(nil)
      group(nil), agg_func([T_FUN_MAX(T_FUN_MAX(T1.ID))], [T_FUN_MAX(T_FUN_MAX(T1.NAME))])
 10 - output([T_FUN_MAX(T1.ID)], [T_FUN_MAX(T1.NAME)]), filter([T1.ID > :0])
      access([T1.ID], [T1.NAME]), partitions(p[0-1])
      is_index_back=false, is_global_index=false, filter_before_indexback[false], 
      range_key([T1.__pk_increment]), range(MIN ; MAX)always true, 
      pushdown_aggregation([T_FUN_MAX(T1.ID)], [T_FUN_MAX(T1.NAME)])
UPDATE v1 SET (id,name)=(SELECT max(id),max(name) FROM t1 WHERE id>v1.id);
explain_protocol: 0
select stddev(id) from v1;
+-----------------------------------------+
| STDDEV(ID)                              |
+-----------------------------------------+
| 1.9119507199599982251514190212926928864 |
+-----------------------------------------+
select stddev(id) from t1;
+------------------------------------------+
| STDDEV(ID)                               |
+------------------------------------------+
| 2.73861278752583056728484891400401066976 |
+------------------------------------------+
select stddev(id) from t2;
+------------------------------------------+
| STDDEV(ID)                               |
+------------------------------------------+
| 2.92853475128325636376340914075450140485 |
+------------------------------------------+
rollback;
explain_protocol: 2
EXPLAIN UPDATE /*+no_rewrite*/ v1 SET (id,name)=(SELECT max(id),max(name) FROM t1 WHERE id>v1.id);
Query Plan
========================================================================
|ID|OPERATOR                               |NAME |EST.ROWS|EST.TIME(us)|
------------------------------------------------------------------------
|0 |DISTRIBUTED UPDATE                     |     |2       |442         |
|1 |└─SUBPLAN FILTER                       |     |2       |408         |
|2 |  ├─SUBPLAN SCAN                       |V1   |2       |7           |
|3 |  │ └─SUBPLAN SCAN                     |VIEW1|2       |6           |
|4 |  │   └─HASH CONNECT BY                |     |2       |6           |
|5 |  │     ├─SUBPLAN SCAN                 |VIEW2|1       |3           |
|6 |  │     │ └─DISTRIBUTED TABLE FULL SCAN|T1   |1       |3           |
|7 |  │     └─SUBPLAN SCAN                 |VIEW3|7       |3           |
|8 |  │       └─DISTRIBUTED TABLE FULL SCAN|T1   |7       |3           |
|9 |  └─SCALAR GROUP BY                    |     |1       |295         |
|10|    └─DISTRIBUTED TABLE FULL SCAN      |T1   |3       |295         |
========================================================================
Outputs & filters:
-------------------------------------
  0 - output(nil), filter(nil)
      table_columns([{V1: ({V1: (V1.ID, V1.NAME, V1.GRADE, V1.PID)})}]),
      update([V1.ID=column_conv(NUMBER,PS:(-1,0),NULL,T_FUN_MAX(T_FUN_MAX(T1.ID)))], [V1.NAME=column_conv(VARCHAR2,utf8mb4_bin,length:10,NULL,T_FUN_MAX(T_FUN_MAX(T1.NAME)))])
  1 - output([V1.ID], [V1.NAME], [V1.GRADE], [V1.PID], [T_FUN_MAX(T_FUN_MAX(T1.ID))], [T_FUN_MAX(T_FUN_MAX(T1.NAME))]), filter(nil)
      exec_params_([V1.ID(:0)]), onetime_exprs_(nil), init_plan_idxs_(nil), use_batch=false
  2 - output([V1.ID], [V1.NAME], [V1.GRADE], [V1.PID]), filter(nil)
      access([V1.ID], [V1.NAME], [V1.GRADE], [V1.PID])
  3 - output([VIEW1.T1.ID], [VIEW1.T1.NAME], [VIEW1.T1.GRADE], [VIEW1.T1.PID]), filter([lnnvl(cast(VIEW1.T1.NAME > cast('test7', VARCHAR2(1048576 )), TINYINT(-1,
       0)))])
      access([VIEW1.T1.ID], [VIEW1.T1.PID], [VIEW1.T1.NAME], [VIEW1.T1.GRADE])
  4 - output([VIEW3.T1.__pk_increment], [VIEW3.T1.ID], [VIEW3.T1.PID], [VIEW3.T1.NAME], [VIEW3.T1.GRADE]), filter(nil)
      equal_conds([VIEW2.T1.ID = VIEW3.T1.PID]), other_conds(nil)
  5 - output([VIEW2.T1.__pk_increment], [VIEW2.T1.ID], [VIEW2.T1.PID], [VIEW2.T1.NAME], [VIEW2.T1.GRADE]), filter(nil)
      access([VIEW2.T1.__pk_increment], [VIEW2.T1.ID], [VIEW2.T1.PID], [VIEW2.T1.NAME], [VIEW2.T1.GRADE])
  6 - output([T1.__pk_increment], [T1.ID], [T1.PID], [T1.NAME], [T1.GRADE]), filter([T1.ID <= 102])
      access([T1.__pk_increment], [T1.ID], [T1.PID], [T1.NAME], [T1.GRADE]), partitions(p0)
      is_index_back=false, is_global_index=false, filter_before_indexback[false], 
      range_key([T1.__pk_increment]), range(MIN ; MAX)always true
  7 - output([VIEW3.T1.__pk_increment], [VIEW3.T1.ID], [VIEW3.T1.PID], [VIEW3.T1.NAME], [VIEW3.T1.GRADE]), filter(nil)
      access([VIEW3.T1.__pk_increment], [VIEW3.T1.ID], [VIEW3.T1.PID], [VIEW3.T1.NAME], [VIEW3.T1.GRADE])
  8 - output([T1.__pk_increment], [T1.ID], [T1.PID], [T1.NAME], [T1.GRADE]), filter(nil)
      access([T1.__pk_increment], [T1.ID], [T1.PID], [T1.NAME], [T1.GRADE]), partitions(p0)
      is_index_back=false, is_global_index=false, 
      range_key([T1.__pk_increment]), range(MIN ; MAX)always true
  9 - output([T_FUN_MAX(T_FUN_MAX(T1.ID))], [T_FUN_MAX(T_FUN_MAX(T1.NAME))]), filter(nil)
      group(nil), agg_func([T_FUN_MAX(T_FUN_MAX(T1.ID))], [T_FUN_MAX(T_FUN_MAX(T1.NAME))])
 10 - output([T_FUN_MAX(T1.ID)], [T_FUN_MAX(T1.NAME)]), filter([T1.ID > :0])
      access([T1.ID], [T1.NAME]), partitions(p[0-1])
      is_index_back=false, is_global_index=false, filter_before_indexback[false], 
      range_key([T1.__pk_increment]), range(MIN ; MAX)always true, 
      pushdown_aggregation([T_FUN_MAX(T1.ID)], [T_FUN_MAX(T1.NAME)])
UPDATE /*+no_rewrite*/ v1 SET (id,name)=(SELECT max(id),max(name) FROM t1 WHERE id>v1.id);
explain_protocol: 0
select stddev(id) from v1;
+-----------------------------------------+
| STDDEV(ID)                              |
+-----------------------------------------+
| 1.9119507199599982251514190212926928864 |
+-----------------------------------------+
select stddev(id) from t1;
+------------------------------------------+
| STDDEV(ID)                               |
+------------------------------------------+
| 2.73861278752583056728484891400401066976 |
+------------------------------------------+
select stddev(id) from t2;
+------------------------------------------+
| STDDEV(ID)                               |
+------------------------------------------+
| 2.92853475128325636376340914075450140485 |
+------------------------------------------+
rollback;

explain_protocol: 2
EXPLAIN UPDATE v1 SET id=(SELECT max(id) FROM t1 WHERE name<v1.name), grade=(SELECT max(grade) FROM t1 WHERE id<v1.id);
Query Plan
========================================================================
|ID|OPERATOR                               |NAME |EST.ROWS|EST.TIME(us)|
------------------------------------------------------------------------
|0 |DISTRIBUTED UPDATE                     |     |2       |844         |
|1 |└─SUBPLAN FILTER                       |     |2       |810         |
|2 |  ├─SUBPLAN SCAN                       |V1   |2       |7           |
|3 |  │ └─SUBPLAN SCAN                     |VIEW1|2       |6           |
|4 |  │   └─HASH CONNECT BY                |     |2       |6           |
|5 |  │     ├─SUBPLAN SCAN                 |VIEW2|1       |3           |
|6 |  │     │ └─DISTRIBUTED TABLE FULL SCAN|T1   |1       |3           |
|7 |  │     └─SUBPLAN SCAN                 |VIEW3|7       |3           |
|8 |  │       └─DISTRIBUTED TABLE FULL SCAN|T1   |7       |3           |
|9 |  ├─SCALAR GROUP BY                    |     |1       |295         |
|10|  │ └─DISTRIBUTED TABLE FULL SCAN      |T1   |3       |295         |
|11|  └─SCALAR GROUP BY                    |     |1       |295         |
|12|    └─DISTRIBUTED TABLE FULL SCAN      |T1   |3       |295         |
========================================================================
Outputs & filters:
-------------------------------------
  0 - output(nil), filter(nil)
      table_columns([{V1: ({V1: (V1.ID, V1.NAME, V1.GRADE, V1.PID)})}]),
      update([V1.ID=column_conv(NUMBER,PS:(-1,0),NULL,subquery(1))], [V1.GRADE=column_conv(NUMBER,PS:(-1,0),NULL,subquery(2))])
  1 - output([V1.ID], [V1.NAME], [V1.GRADE], [V1.PID], [subquery(1)], [subquery(2)]), filter(nil), rowset=16
      exec_params_([V1.NAME(:0)], [V1.ID(:1)]), onetime_exprs_(nil), init_plan_idxs_(nil), use_batch=false
  2 - output([V1.ID], [V1.NAME], [V1.GRADE], [V1.PID]), filter(nil), rowset=16
      access([V1.ID], [V1.NAME], [V1.GRADE], [V1.PID])
  3 - output([VIEW1.T1.ID], [VIEW1.T1.NAME], [VIEW1.T1.GRADE], [VIEW1.T1.PID]), filter([lnnvl(cast(VIEW1.T1.NAME > cast('test7', VARCHAR2(1048576 )), TINYINT(-1,
       0)))]), rowset=16
      access([VIEW1.T1.ID], [VIEW1.T1.PID], [VIEW1.T1.NAME], [VIEW1.T1.GRADE])
  4 - output([VIEW3.T1.__pk_increment], [VIEW3.T1.ID], [VIEW3.T1.PID], [VIEW3.T1.NAME], [VIEW3.T1.GRADE]), filter(nil)
      equal_conds([VIEW2.T1.ID = VIEW3.T1.PID]), other_conds(nil)
  5 - output([VIEW2.T1.__pk_increment], [VIEW2.T1.ID], [VIEW2.T1.PID], [VIEW2.T1.NAME], [VIEW2.T1.GRADE]), filter(nil), rowset=16
      access([VIEW2.T1.__pk_increment], [VIEW2.T1.ID], [VIEW2.T1.PID], [VIEW2.T1.NAME], [VIEW2.T1.GRADE])
  6 - output([T1.__pk_increment], [T1.ID], [T1.PID], [T1.NAME], [T1.GRADE]), filter([T1.ID <= 102]), rowset=16
      access([T1.__pk_increment], [T1.ID], [T1.PID], [T1.NAME], [T1.GRADE]), partitions(p0)
      is_index_back=false, is_global_index=false, filter_before_indexback[false], 
      range_key([T1.__pk_increment]), range(MIN ; MAX)always true
  7 - output([VIEW3.T1.__pk_increment], [VIEW3.T1.ID], [VIEW3.T1.PID], [VIEW3.T1.NAME], [VIEW3.T1.GRADE]), filter(nil), rowset=16
      access([VIEW3.T1.__pk_increment], [VIEW3.T1.ID], [VIEW3.T1.PID], [VIEW3.T1.NAME], [VIEW3.T1.GRADE])
  8 - output([T1.__pk_increment], [T1.ID], [T1.PID], [T1.NAME], [T1.GRADE]), filter(nil), rowset=16
      access([T1.__pk_increment], [T1.ID], [T1.PID], [T1.NAME], [T1.GRADE]), partitions(p0)
      is_index_back=false, is_global_index=false, 
      range_key([T1.__pk_increment]), range(MIN ; MAX)always true
  9 - output([T_FUN_MAX(T_FUN_MAX(T1.ID))]), filter(nil), rowset=16
      group(nil), agg_func([T_FUN_MAX(T_FUN_MAX(T1.ID))])
 10 - output([T_FUN_MAX(T1.ID)]), filter([T1.NAME < :0]), rowset=16
      access([T1.ID], [T1.NAME]), partitions(p[0-1])
      is_index_back=false, is_global_index=false, filter_before_indexback[false], 
      range_key([T1.__pk_increment]), range(MIN ; MAX)always true, 
      pushdown_aggregation([T_FUN_MAX(T1.ID)])
 11 - output([T_FUN_MAX(T_FUN_MAX(T1.GRADE))]), filter(nil), rowset=16
      group(nil), agg_func([T_FUN_MAX(T_FUN_MAX(T1.GRADE))])
 12 - output([T_FUN_MAX(T1.GRADE)]), filter([T1.ID < :1]), rowset=16
      access([T1.ID], [T1.GRADE]), partitions(p[0-1])
      is_index_back=false, is_global_index=false, filter_before_indexback[false], 
      range_key([T1.__pk_increment]), range(MIN ; MAX)always true, 
      pushdown_aggregation([T_FUN_MAX(T1.GRADE)])
UPDATE v1 SET id=(SELECT max(id) FROM t1 WHERE name<v1.name), grade=(SELECT max(grade) FROM t1 WHERE id<v1.id);
explain_protocol: 0
select stddev(id) from v1;
+-----------------------------------------+
| STDDEV(ID)                              |
+-----------------------------------------+
| 1.9119507199599982251514190212926928864 |
+-----------------------------------------+
select stddev(id) from t1;
+------------------------------------------+
| STDDEV(ID)                               |
+------------------------------------------+
| 2.73861278752583056728484891400401066976 |
+------------------------------------------+
select stddev(id) from t2;
+------------------------------------------+
| STDDEV(ID)                               |
+------------------------------------------+
| 1.80480191198936506342120853195451205897 |
+------------------------------------------+
rollback;
explain_protocol: 2
EXPLAIN UPDATE /*+no_rewrite*/ v1 SET id=(SELECT max(id) FROM t1 WHERE name<v1.name), grade=(SELECT max(grade) FROM t1 WHERE id<v1.id);
Query Plan
========================================================================
|ID|OPERATOR                               |NAME |EST.ROWS|EST.TIME(us)|
------------------------------------------------------------------------
|0 |DISTRIBUTED UPDATE                     |     |2       |844         |
|1 |└─SUBPLAN FILTER                       |     |2       |810         |
|2 |  ├─SUBPLAN SCAN                       |V1   |2       |7           |
|3 |  │ └─SUBPLAN SCAN                     |VIEW1|2       |6           |
|4 |  │   └─HASH CONNECT BY                |     |2       |6           |
|5 |  │     ├─SUBPLAN SCAN                 |VIEW2|1       |3           |
|6 |  │     │ └─DISTRIBUTED TABLE FULL SCAN|T1   |1       |3           |
|7 |  │     └─SUBPLAN SCAN                 |VIEW3|7       |3           |
|8 |  │       └─DISTRIBUTED TABLE FULL SCAN|T1   |7       |3           |
|9 |  ├─SCALAR GROUP BY                    |     |1       |295         |
|10|  │ └─DISTRIBUTED TABLE FULL SCAN      |T1   |3       |295         |
|11|  └─SCALAR GROUP BY                    |     |1       |295         |
|12|    └─DISTRIBUTED TABLE FULL SCAN      |T1   |3       |295         |
========================================================================
Outputs & filters:
-------------------------------------
  0 - output(nil), filter(nil)
      table_columns([{V1: ({V1: (V1.ID, V1.NAME, V1.GRADE, V1.PID)})}]),
      update([V1.ID=column_conv(NUMBER,PS:(-1,0),NULL,subquery(1))], [V1.GRADE=column_conv(NUMBER,PS:(-1,0),NULL,subquery(2))])
  1 - output([V1.ID], [V1.NAME], [V1.GRADE], [V1.PID], [subquery(1)], [subquery(2)]), filter(nil), rowset=16
      exec_params_([V1.NAME(:0)], [V1.ID(:1)]), onetime_exprs_(nil), init_plan_idxs_(nil), use_batch=false
  2 - output([V1.ID], [V1.NAME], [V1.GRADE], [V1.PID]), filter(nil), rowset=16
      access([V1.ID], [V1.NAME], [V1.GRADE], [V1.PID])
  3 - output([VIEW1.T1.ID], [VIEW1.T1.NAME], [VIEW1.T1.GRADE], [VIEW1.T1.PID]), filter([lnnvl(cast(VIEW1.T1.NAME > cast('test7', VARCHAR2(1048576 )), TINYINT(-1,
       0)))]), rowset=16
      access([VIEW1.T1.ID], [VIEW1.T1.PID], [VIEW1.T1.NAME], [VIEW1.T1.GRADE])
  4 - output([VIEW3.T1.__pk_increment], [VIEW3.T1.ID], [VIEW3.T1.PID], [VIEW3.T1.NAME], [VIEW3.T1.GRADE]), filter(nil)
      equal_conds([VIEW2.T1.ID = VIEW3.T1.PID]), other_conds(nil)
  5 - output([VIEW2.T1.__pk_increment], [VIEW2.T1.ID], [VIEW2.T1.PID], [VIEW2.T1.NAME], [VIEW2.T1.GRADE]), filter(nil), rowset=16
      access([VIEW2.T1.__pk_increment], [VIEW2.T1.ID], [VIEW2.T1.PID], [VIEW2.T1.NAME], [VIEW2.T1.GRADE])
  6 - output([T1.__pk_increment], [T1.ID], [T1.PID], [T1.NAME], [T1.GRADE]), filter([T1.ID <= 102]), rowset=16
      access([T1.__pk_increment], [T1.ID], [T1.PID], [T1.NAME], [T1.GRADE]), partitions(p0)
      is_index_back=false, is_global_index=false, filter_before_indexback[false], 
      range_key([T1.__pk_increment]), range(MIN ; MAX)always true
  7 - output([VIEW3.T1.__pk_increment], [VIEW3.T1.ID], [VIEW3.T1.PID], [VIEW3.T1.NAME], [VIEW3.T1.GRADE]), filter(nil), rowset=16
      access([VIEW3.T1.__pk_increment], [VIEW3.T1.ID], [VIEW3.T1.PID], [VIEW3.T1.NAME], [VIEW3.T1.GRADE])
  8 - output([T1.__pk_increment], [T1.ID], [T1.PID], [T1.NAME], [T1.GRADE]), filter(nil), rowset=16
      access([T1.__pk_increment], [T1.ID], [T1.PID], [T1.NAME], [T1.GRADE]), partitions(p0)
      is_index_back=false, is_global_index=false, 
      range_key([T1.__pk_increment]), range(MIN ; MAX)always true
  9 - output([T_FUN_MAX(T_FUN_MAX(T1.ID))]), filter(nil), rowset=16
      group(nil), agg_func([T_FUN_MAX(T_FUN_MAX(T1.ID))])
 10 - output([T_FUN_MAX(T1.ID)]), filter([T1.NAME < :0]), rowset=16
      access([T1.ID], [T1.NAME]), partitions(p[0-1])
      is_index_back=false, is_global_index=false, filter_before_indexback[false], 
      range_key([T1.__pk_increment]), range(MIN ; MAX)always true, 
      pushdown_aggregation([T_FUN_MAX(T1.ID)])
 11 - output([T_FUN_MAX(T_FUN_MAX(T1.GRADE))]), filter(nil), rowset=16
      group(nil), agg_func([T_FUN_MAX(T_FUN_MAX(T1.GRADE))])
 12 - output([T_FUN_MAX(T1.GRADE)]), filter([T1.ID < :1]), rowset=16
      access([T1.ID], [T1.GRADE]), partitions(p[0-1])
      is_index_back=false, is_global_index=false, filter_before_indexback[false], 
      range_key([T1.__pk_increment]), range(MIN ; MAX)always true, 
      pushdown_aggregation([T_FUN_MAX(T1.GRADE)])
UPDATE /*+no_rewrite*/ v1 SET id=(SELECT max(id) FROM t1 WHERE name<v1.name), grade=(SELECT max(grade) FROM t1 WHERE id<v1.id);
explain_protocol: 0
select stddev(id) from v1;
+-----------------------------------------+
| STDDEV(ID)                              |
+-----------------------------------------+
| 1.9119507199599982251514190212926928864 |
+-----------------------------------------+
select stddev(id) from t1;
+------------------------------------------+
| STDDEV(ID)                               |
+------------------------------------------+
| 2.73861278752583056728484891400401066976 |
+------------------------------------------+
select stddev(id) from t2;
+------------------------------------------+
| STDDEV(ID)                               |
+------------------------------------------+
| 1.80480191198936506342120853195451205897 |
+------------------------------------------+
rollback;

##########################
explain_protocol: 0
#普通表+无索引+无主键
DROP TABLE t1 purge;
CREATE TABLE t1(f1 int, f2 int, f3 char(10), f4 date);
INSERT INTO t1 SELECT LEVEL,LEVEL,'test'||LEVEL,to_date('20200101','yyyymmdd')+LEVEL FROM dual CONNECT BY LEVEL<=5;
DROP TABLE t2 purge;
CREATE TABLE t2 (f1 int, f2 int, f3 char(10));
INSERT INTO t2 SELECT LEVEL, LEVEL + 1, 'test' || LEVEL FROM dual CONNECT BY LEVEL <= 5;
commit;

select stddev(f1) from t1;
+------------------------------------------+
| STDDEV(F1)                               |
+------------------------------------------+
| 1.58113883008418966599944677221635926686 |
+------------------------------------------+
explain_protocol: 2
EXPLAIN update t1 set (f1, f2) = (select max(f1), max(f2) from t2 where f1 < t1.f1);
Query Plan
==================================================================
|ID|OPERATOR                         |NAME |EST.ROWS|EST.TIME(us)|
------------------------------------------------------------------
|0 |EXCHANGE IN REMOTE               |     |5       |95          |
|1 |└─EXCHANGE OUT REMOTE            |     |5       |86          |
|2 |  └─UPDATE                       |     |5       |67          |
|3 |    └─SUBPLAN SCAN               |VIEW1|5       |6           |
|4 |      └─MERGE GROUP BY           |     |5       |6           |
|5 |        └─NESTED-LOOP OUTER JOIN |     |5       |4           |
|6 |          ├─TABLE FULL SCAN      |T1   |5       |3           |
|7 |          └─MATERIAL             |     |5       |3           |
|8 |            └─TABLE FULL SCAN    |T2   |5       |3           |
==================================================================
Outputs & filters:
-------------------------------------
  0 - output(nil), filter(nil)
  1 - output(nil), filter(nil)
  2 - output(nil), filter(nil)
      table_columns([{VIEW1: ({T1: (VIEW1.T1.__pk_increment, VIEW1.T1.F1, VIEW1.T1.F2, VIEW1.T1.F3, VIEW1.T1.F4)})}]),
      update([VIEW1.T1.F1=column_conv(NUMBER,PS:(-1,0),NULL,VIEW1.subquery(0))], [VIEW1.T1.F2=column_conv(NUMBER,PS:(-1,0),NULL,VIEW1.subquery(0))])
  3 - output([VIEW1.subquery(0)], [VIEW1.subquery(0)], [VIEW1.T1.__pk_increment], [VIEW1.T1.F1], [VIEW1.T1.F2], [VIEW1.T1.F3], [VIEW1.T1.F4]), filter(nil), rowset=16
      access([VIEW1.subquery(0)], [VIEW1.subquery(0)], [VIEW1.T1.__pk_increment], [VIEW1.T1.F1], [VIEW1.T1.F2], [VIEW1.T1.F3], [VIEW1.T1.F4])
  4 - output([T_FUN_MAX(T2.F1)], [T_FUN_MAX(T2.F2)], [T1.__pk_increment], [T1.F1], [T1.F2], [T1.F3], [T1.F4]), filter(nil), rowset=16
      group([T1.__pk_increment]), agg_func([T_FUN_MAX(T2.F1)], [T_FUN_MAX(T2.F2)])
  5 - output([T1.__pk_increment], [T1.F1], [T1.F2], [T1.F3], [T1.F4], [T2.F1], [T2.F2]), filter(nil), rowset=16
      conds([T2.F1 < T1.F1]), nl_params_(nil), use_batch=false
  6 - output([T1.__pk_increment], [T1.F1], [T1.F2], [T1.F3], [T1.F4]), filter(nil), rowset=16
      access([T1.__pk_increment], [T1.F1], [T1.F2], [T1.F3], [T1.F4]), partitions(p0)
      is_index_back=false, is_global_index=false, 
      range_key([T1.__pk_increment]), range(MIN ; MAX)always true
  7 - output([T2.F1], [T2.F2]), filter(nil), rowset=16
  8 - output([T2.F1], [T2.F2]), filter(nil), rowset=16
      access([T2.F1], [T2.F2]), partitions(p0)
      is_index_back=false, is_global_index=false, 
      range_key([T2.__pk_increment]), range(MIN ; MAX)always true
update t1 set (f1, f2) = (select max(f1), max(f2) from t2 where f1 < t1.f1);
explain_protocol: 0
select stddev(f1) from t1;
+------------------------------------------+
| STDDEV(F1)                               |
+------------------------------------------+
| 1.29099444873580562839308846659413320361 |
+------------------------------------------+
rollback;
explain_protocol: 2
EXPLAIN update /*+no_rewrite*/ t1 set (f1, f2) = (select max(f1), max(f2) from t2 where f1 < t1.f1);
Query Plan
=========================================================
|ID|OPERATOR                 |NAME|EST.ROWS|EST.TIME(us)|
---------------------------------------------------------
|0 |EXCHANGE IN REMOTE       |    |5       |170         |
|1 |└─EXCHANGE OUT REMOTE    |    |5       |165         |
|2 |  └─UPDATE               |    |5       |155         |
|3 |    └─SUBPLAN FILTER     |    |5       |93          |
|4 |      ├─TABLE FULL SCAN  |T1  |5       |3           |
|5 |      └─SCALAR GROUP BY  |    |1       |18          |
|6 |        └─TABLE FULL SCAN|T2  |2       |18          |
=========================================================
Outputs & filters:
-------------------------------------
  0 - output(nil), filter(nil)
  1 - output(nil), filter(nil)
  2 - output(nil), filter(nil)
      table_columns([{T1: ({T1: (T1.__pk_increment, T1.F1, T1.F2, T1.F3, T1.F4)})}]),
      update([T1.F1=column_conv(NUMBER,PS:(-1,0),NULL,T_FUN_MAX(T_FUN_MAX(T2.F1)))], [T1.F2=column_conv(NUMBER,PS:(-1,0),NULL,T_FUN_MAX(T_FUN_MAX(T2.F2)))])
  3 - output([T1.__pk_increment], [T1.F1], [T1.F2], [T1.F3], [T1.F4], [T_FUN_MAX(T_FUN_MAX(T2.F1))], [T_FUN_MAX(T_FUN_MAX(T2.F2))]), filter(nil)
      exec_params_([T1.F1(:0)]), onetime_exprs_(nil), init_plan_idxs_(nil), use_batch=false
  4 - output([T1.__pk_increment], [T1.F1], [T1.F2], [T1.F3], [T1.F4]), filter(nil)
      access([T1.__pk_increment], [T1.F1], [T1.F2], [T1.F3], [T1.F4]), partitions(p0)
      is_index_back=false, is_global_index=false, 
      range_key([T1.__pk_increment]), range(MIN ; MAX)always true
  5 - output([T_FUN_MAX(T_FUN_MAX(T2.F1))], [T_FUN_MAX(T_FUN_MAX(T2.F2))]), filter(nil)
      group(nil), agg_func([T_FUN_MAX(T_FUN_MAX(T2.F1))], [T_FUN_MAX(T_FUN_MAX(T2.F2))])
  6 - output([T_FUN_MAX(T2.F1)], [T_FUN_MAX(T2.F2)]), filter([T2.F1 < :0])
      access([T2.F1], [T2.F2]), partitions(p0)
      is_index_back=false, is_global_index=false, filter_before_indexback[false], 
      range_key([T2.__pk_increment]), range(MIN ; MAX)always true, 
      pushdown_aggregation([T_FUN_MAX(T2.F1)], [T_FUN_MAX(T2.F2)])
update /*+no_rewrite*/ t1 set (f1, f2) = (select max(f1), max(f2) from t2 where f1 < t1.f1);
explain_protocol: 0
select stddev(f1) from t1;
+------------------------------------------+
| STDDEV(F1)                               |
+------------------------------------------+
| 1.29099444873580562839308846659413320361 |
+------------------------------------------+
rollback;

set autocommit=1;
DROP TABLE t1 purge;
DROP TABLE t2 purge;
## bug 
drop table t1;
drop table t2;
drop table t3;
create table t1 (c1 int, c2 int, c3 int, c4 int, c5 int, c6 int);
create table t2 (c1 int, c2 int, c3 int, c4 int, c5 int, c6 int);
create table t3 (c1 int, c2 int, c3 int, c4 int, c5 int, c6 int);

insert into t1 select level, level, level, level, level, level from dual connect by level <= 10;
insert into t2 select level, level, level, level, level, level from dual connect by level <= 20;
insert into t3 select level, level, level, level, level, level from dual connect by level <= 30;

result_format: 4
explain_protocol: 2
set autocommit = 0;
EXPLAIN update t1 set (c1, c2) = (select c1, c2 from t2 where rownum <= 1) where c3 < (select max(c3) from t3 where t3.c4 < t1.c4);
Query Plan
================================================================
|ID|OPERATOR                       |NAME |EST.ROWS|EST.TIME(us)|
----------------------------------------------------------------
|0 |EXCHANGE IN REMOTE             |     |1       |48          |
|1 |└─EXCHANGE OUT REMOTE          |     |1       |47          |
|2 |  └─UPDATE                     |     |1       |44          |
|3 |    └─SUBPLAN FILTER           |     |1       |17          |
|4 |      ├─SUBPLAN SCAN           |VIEW2|1       |14          |
|5 |      │ └─MERGE GROUP BY       |     |1       |14          |
|6 |      │   └─NESTED-LOOP JOIN   |     |15      |9           |
|7 |      │     ├─TABLE FULL SCAN  |T1   |10      |4           |
|8 |      │     └─MATERIAL         |     |30      |7           |
|9 |      │       └─TABLE FULL SCAN|T3   |30      |4           |
|10|      └─TABLE FULL SCAN        |T2   |1       |3           |
================================================================
Outputs & filters:
-------------------------------------
  0 - output(nil), filter(nil)
  1 - output(nil), filter(nil)
  2 - output(nil), filter(nil)
      table_columns([{VIEW2: ({T1: (VIEW2.T1.__pk_increment, VIEW2.T1.C1, VIEW2.T1.C2, VIEW2.T1.C3, VIEW2.T1.C4, VIEW2.T1.C5, VIEW2.T1.C6)})}]),
      update([VIEW2.T1.C1=column_conv(NUMBER,PS:(-1,0),NULL,T2.C1)], [VIEW2.T1.C2=column_conv(NUMBER,PS:(-1,0),NULL,T2.C2)])
  3 - output([VIEW2.T1.__pk_increment], [VIEW2.T1.C1], [VIEW2.T1.C2], [VIEW2.T1.C3], [VIEW2.T1.C4], [VIEW2.T1.C5], [VIEW2.T1.C6], [T2.C1], [T2.C2]), filter(nil)
      exec_params_(nil), onetime_exprs_(nil), init_plan_idxs_([1]), use_batch=false
  4 - output([VIEW2.T1.__pk_increment], [VIEW2.T1.C1], [VIEW2.T1.C2], [VIEW2.T1.C3], [VIEW2.T1.C4], [VIEW2.T1.C5], [VIEW2.T1.C6]), filter(nil)
      access([VIEW2.T1.__pk_increment], [VIEW2.T1.C1], [VIEW2.T1.C2], [VIEW2.T1.C3], [VIEW2.T1.C4], [VIEW2.T1.C5], [VIEW2.T1.C6])
  5 - output([T1.__pk_increment], [T1.C1], [T1.C2], [T1.C3], [T1.C4], [T1.C5], [T1.C6]), filter([T1.C3 < T_FUN_MAX(T3.C3)])
      group([T1.__pk_increment]), agg_func([T_FUN_MAX(T3.C3)])
  6 - output([T1.__pk_increment], [T1.C1], [T1.C2], [T1.C3], [T1.C4], [T1.C5], [T1.C6], [T3.C3]), filter(nil)
      conds([T3.C4 < T1.C4]), nl_params_(nil), use_batch=false
  7 - output([T1.__pk_increment], [T1.C1], [T1.C2], [T1.C3], [T1.C4], [T1.C5], [T1.C6]), filter(nil)
      access([T1.__pk_increment], [T1.C1], [T1.C2], [T1.C3], [T1.C4], [T1.C5], [T1.C6]), partitions(p0)
      is_index_back=false, is_global_index=false, 
      range_key([T1.__pk_increment]), range(MIN ; MAX)always true
  8 - output([T3.C4], [T3.C3]), filter(nil)
  9 - output([T3.C4], [T3.C3]), filter(nil)
      access([T3.C4], [T3.C3]), partitions(p0)
      is_index_back=false, is_global_index=false, 
      range_key([T3.__pk_increment]), range(MIN ; MAX)always true
 10 - output([T2.C1], [T2.C2]), filter(nil)
      access([T2.C1], [T2.C2]), partitions(p0)
      limit(cast(FLOOR(1), BIGINT(-1, 0))), offset(nil), is_index_back=false, is_global_index=false, 
      range_key([T2.__pk_increment]), range(MIN ; MAX)always true
update t1 set (c1, c2) = (select c1, c2 from t2 where rownum <= 1) where c3 < (select max(c3) from t3 where t3.c4 < t1.c4);
EXPLAIN select * from t1;
Query Plan
=====================================================
|ID|OPERATOR             |NAME|EST.ROWS|EST.TIME(us)|
-----------------------------------------------------
|0 |EXCHANGE IN REMOTE   |    |10      |61          |
|1 |└─EXCHANGE OUT REMOTE|    |10      |43          |
|2 |  └─TABLE FULL SCAN  |T1  |10      |4           |
=====================================================
Outputs & filters:
-------------------------------------
  0 - output([T1.C1], [T1.C2], [T1.C3], [T1.C4], [T1.C5], [T1.C6]), filter(nil)
  1 - output([T1.C1], [T1.C2], [T1.C3], [T1.C4], [T1.C5], [T1.C6]), filter(nil)
  2 - output([T1.C1], [T1.C2], [T1.C3], [T1.C4], [T1.C5], [T1.C6]), filter(nil), rowset=16
      access([T1.C1], [T1.C2], [T1.C3], [T1.C4], [T1.C5], [T1.C6]), partitions(p0)
      is_index_back=false, is_global_index=false, 
      range_key([T1.__pk_increment]), range(MIN ; MAX)always true
select * from t1;
+------+------+------+------+------+------+
| C1   | C2   | C3   | C4   | C5   | C6   |
+------+------+------+------+------+------+
|    1 |    1 |    1 |    1 |    1 |    1 |
|    2 |    2 |    2 |    2 |    2 |    2 |
|    3 |    3 |    3 |    3 |    3 |    3 |
|    4 |    4 |    4 |    4 |    4 |    4 |
|    5 |    5 |    5 |    5 |    5 |    5 |
|    6 |    6 |    6 |    6 |    6 |    6 |
|    7 |    7 |    7 |    7 |    7 |    7 |
|    8 |    8 |    8 |    8 |    8 |    8 |
|    9 |    9 |    9 |    9 |    9 |    9 |
|   10 |   10 |   10 |   10 |   10 |   10 |
+------+------+------+------+------+------+
rollback;
EXPLAIN update t1 set (c1, c2) = (select /*+no_unnest*/ c1, c2 from t2 where rownum <= 1) where c3 < (select /*+no_unnest*/ max(c3) from t3 where t3.c4 < t1.c4);
Query Plan
===========================================================
|ID|OPERATOR                   |NAME|EST.ROWS|EST.TIME(us)|
-----------------------------------------------------------
|0 |EXCHANGE IN REMOTE         |    |4       |255         |
|1 |└─EXCHANGE OUT REMOTE      |    |4       |250         |
|2 |  └─UPDATE                 |    |4       |236         |
|3 |    └─SUBPLAN FILTER       |    |4       |187         |
|4 |      ├─SUBPLAN FILTER     |    |4       |185         |
|5 |      │ ├─TABLE FULL SCAN  |T1  |10      |4           |
|6 |      │ └─SCALAR GROUP BY  |    |1       |19          |
|7 |      │   └─TABLE FULL SCAN|T3  |10      |18          |
|8 |      └─TABLE FULL SCAN    |T2  |1       |3           |
===========================================================
Outputs & filters:
-------------------------------------
  0 - output(nil), filter(nil)
  1 - output(nil), filter(nil)
  2 - output(nil), filter(nil)
      table_columns([{T1: ({T1: (T1.__pk_increment, T1.C1, T1.C2, T1.C3, T1.C4, T1.C5, T1.C6)})}]),
      update([T1.C1=column_conv(NUMBER,PS:(-1,0),NULL,T2.C1)], [T1.C2=column_conv(NUMBER,PS:(-1,0),NULL,T2.C2)])
  3 - output([T1.__pk_increment], [T1.C1], [T1.C2], [T1.C3], [T1.C4], [T1.C5], [T1.C6], [T2.C1], [T2.C2]), filter(nil)
      exec_params_(nil), onetime_exprs_(nil), init_plan_idxs_([1]), use_batch=false
  4 - output([T1.__pk_increment], [T1.C1], [T1.C2], [T1.C3], [T1.C4], [T1.C5], [T1.C6]), filter([T1.C3 < subquery(1)])
      exec_params_([T1.C4(:0)]), onetime_exprs_(nil), init_plan_idxs_(nil), use_batch=false
  5 - output([T1.__pk_increment], [T1.C1], [T1.C2], [T1.C3], [T1.C4], [T1.C5], [T1.C6]), filter(nil)
      access([T1.__pk_increment], [T1.C1], [T1.C2], [T1.C3], [T1.C4], [T1.C5], [T1.C6]), partitions(p0)
      is_index_back=false, is_global_index=false, 
      range_key([T1.__pk_increment]), range(MIN ; MAX)always true
  6 - output([T_FUN_MAX(T_FUN_MAX(T3.C3))]), filter(nil)
      group(nil), agg_func([T_FUN_MAX(T_FUN_MAX(T3.C3))])
  7 - output([T_FUN_MAX(T3.C3)]), filter([T3.C4 < :0])
      access([T3.C4], [T3.C3]), partitions(p0)
      is_index_back=false, is_global_index=false, filter_before_indexback[false], 
      range_key([T3.__pk_increment]), range(MIN ; MAX)always true, 
      pushdown_aggregation([T_FUN_MAX(T3.C3)])
  8 - output([T2.C1], [T2.C2]), filter(nil)
      access([T2.C1], [T2.C2]), partitions(p0)
      limit(cast(FLOOR(1), BIGINT(-1, 0))), offset(nil), is_index_back=false, is_global_index=false, 
      range_key([T2.__pk_increment]), range(MIN ; MAX)always true
update t1 set (c1, c2) = (select /*+no_unnest*/ c1, c2 from t2 where rownum <= 1) where c3 < (select /*+no_unnest*/ max(c3) from t3 where t3.c4 < t1.c4);
EXPLAIN select * from t1;
Query Plan
=====================================================
|ID|OPERATOR             |NAME|EST.ROWS|EST.TIME(us)|
-----------------------------------------------------
|0 |EXCHANGE IN REMOTE   |    |10      |61          |
|1 |└─EXCHANGE OUT REMOTE|    |10      |43          |
|2 |  └─TABLE FULL SCAN  |T1  |10      |4           |
=====================================================
Outputs & filters:
-------------------------------------
  0 - output([T1.C1], [T1.C2], [T1.C3], [T1.C4], [T1.C5], [T1.C6]), filter(nil)
  1 - output([T1.C1], [T1.C2], [T1.C3], [T1.C4], [T1.C5], [T1.C6]), filter(nil)
  2 - output([T1.C1], [T1.C2], [T1.C3], [T1.C4], [T1.C5], [T1.C6]), filter(nil), rowset=16
      access([T1.C1], [T1.C2], [T1.C3], [T1.C4], [T1.C5], [T1.C6]), partitions(p0)
      is_index_back=false, is_global_index=false, 
      range_key([T1.__pk_increment]), range(MIN ; MAX)always true
select * from t1;
+------+------+------+------+------+------+
| C1   | C2   | C3   | C4   | C5   | C6   |
+------+------+------+------+------+------+
|    1 |    1 |    1 |    1 |    1 |    1 |
|    2 |    2 |    2 |    2 |    2 |    2 |
|    3 |    3 |    3 |    3 |    3 |    3 |
|    4 |    4 |    4 |    4 |    4 |    4 |
|    5 |    5 |    5 |    5 |    5 |    5 |
|    6 |    6 |    6 |    6 |    6 |    6 |
|    7 |    7 |    7 |    7 |    7 |    7 |
|    8 |    8 |    8 |    8 |    8 |    8 |
|    9 |    9 |    9 |    9 |    9 |    9 |
|   10 |   10 |   10 |   10 |   10 |   10 |
+------+------+------+------+------+------+
rollback;

EXPLAIN update t1 set (c1, c2) = (select c1, c2 from t2 where rownum <= 1), (c3, c4) = (select max(c3), max(c4) from t3 where t3.c5 < t1.c5);
Query Plan
====================================================================
|ID|OPERATOR                           |NAME |EST.ROWS|EST.TIME(us)|
--------------------------------------------------------------------
|0 |EXCHANGE IN REMOTE                 |     |10      |198         |
|1 |└─EXCHANGE OUT REMOTE              |     |10      |173         |
|2 |  └─UPDATE                         |     |10      |117         |
|3 |    └─SUBPLAN FILTER               |     |10      |18          |
|4 |      ├─SUBPLAN SCAN               |VIEW2|10      |15          |
|5 |      │ └─MERGE GROUP BY           |     |10      |15          |
|6 |      │   └─NESTED-LOOP OUTER JOIN |     |15      |9           |
|7 |      │     ├─TABLE FULL SCAN      |T1   |10      |4           |
|8 |      │     └─MATERIAL             |     |30      |10          |
|9 |      │       └─TABLE FULL SCAN    |T3   |30      |4           |
|10|      └─TABLE FULL SCAN            |T2   |1       |3           |
====================================================================
Outputs & filters:
-------------------------------------
  0 - output(nil), filter(nil)
  1 - output(nil), filter(nil)
  2 - output(nil), filter(nil)
      table_columns([{VIEW2: ({T1: (VIEW2.T1.__pk_increment, VIEW2.T1.C1, VIEW2.T1.C2, VIEW2.T1.C3, VIEW2.T1.C4, VIEW2.T1.C5, VIEW2.T1.C6)})}]),
      update([VIEW2.T1.C1=column_conv(NUMBER,PS:(-1,0),NULL,T2.C1)], [VIEW2.T1.C2=column_conv(NUMBER,PS:(-1,0),NULL,T2.C2)], [VIEW2.T1.C3=column_conv(NUMBER,
      PS:(-1,0),NULL,VIEW2.subquery(1))], [VIEW2.T1.C4=column_conv(NUMBER,PS:(-1,0),NULL,VIEW2.subquery(1))])
  3 - output([VIEW2.T1.__pk_increment], [VIEW2.T1.C1], [VIEW2.T1.C2], [VIEW2.T1.C3], [VIEW2.T1.C4], [VIEW2.T1.C5], [VIEW2.T1.C6], [VIEW2.subquery(1)], [VIEW2.subquery(1)],
       [T2.C1], [T2.C2]), filter(nil)
      exec_params_(nil), onetime_exprs_(nil), init_plan_idxs_([1]), use_batch=false
  4 - output([VIEW2.subquery(1)], [VIEW2.subquery(1)], [VIEW2.T1.__pk_increment], [VIEW2.T1.C1], [VIEW2.T1.C2], [VIEW2.T1.C3], [VIEW2.T1.C4], [VIEW2.T1.C5],
       [VIEW2.T1.C6]), filter(nil)
      access([VIEW2.subquery(1)], [VIEW2.subquery(1)], [VIEW2.T1.__pk_increment], [VIEW2.T1.C1], [VIEW2.T1.C2], [VIEW2.T1.C3], [VIEW2.T1.C4], [VIEW2.T1.C5],
       [VIEW2.T1.C6])
  5 - output([T_FUN_MAX(T3.C3)], [T_FUN_MAX(T3.C4)], [T1.__pk_increment], [T1.C1], [T1.C2], [T1.C3], [T1.C4], [T1.C5], [T1.C6]), filter(nil)
      group([T1.__pk_increment]), agg_func([T_FUN_MAX(T3.C3)], [T_FUN_MAX(T3.C4)])
  6 - output([T1.__pk_increment], [T1.C1], [T1.C2], [T1.C3], [T1.C4], [T1.C5], [T1.C6], [T3.C3], [T3.C4]), filter(nil)
      conds([T3.C5 < T1.C5]), nl_params_(nil), use_batch=false
  7 - output([T1.__pk_increment], [T1.C1], [T1.C2], [T1.C3], [T1.C4], [T1.C5], [T1.C6]), filter(nil)
      access([T1.__pk_increment], [T1.C1], [T1.C2], [T1.C3], [T1.C4], [T1.C5], [T1.C6]), partitions(p0)
      is_index_back=false, is_global_index=false, 
      range_key([T1.__pk_increment]), range(MIN ; MAX)always true
  8 - output([T3.C5], [T3.C3], [T3.C4]), filter(nil)
  9 - output([T3.C5], [T3.C3], [T3.C4]), filter(nil)
      access([T3.C5], [T3.C3], [T3.C4]), partitions(p0)
      is_index_back=false, is_global_index=false, 
      range_key([T3.__pk_increment]), range(MIN ; MAX)always true
 10 - output([T2.C1], [T2.C2]), filter(nil)
      access([T2.C1], [T2.C2]), partitions(p0)
      limit(cast(FLOOR(1), BIGINT(-1, 0))), offset(nil), is_index_back=false, is_global_index=false, 
      range_key([T2.__pk_increment]), range(MIN ; MAX)always true
update t1 set (c1, c2) = (select c1, c2 from t2 where rownum <= 1), (c3, c4) = (select max(c3), max(c4) from t3 where t3.c5 < t1.c5);
EXPLAIN select * from t1;
Query Plan
=====================================================
|ID|OPERATOR             |NAME|EST.ROWS|EST.TIME(us)|
-----------------------------------------------------
|0 |EXCHANGE IN REMOTE   |    |10      |61          |
|1 |└─EXCHANGE OUT REMOTE|    |10      |43          |
|2 |  └─TABLE FULL SCAN  |T1  |10      |4           |
=====================================================
Outputs & filters:
-------------------------------------
  0 - output([T1.C1], [T1.C2], [T1.C3], [T1.C4], [T1.C5], [T1.C6]), filter(nil)
  1 - output([T1.C1], [T1.C2], [T1.C3], [T1.C4], [T1.C5], [T1.C6]), filter(nil)
  2 - output([T1.C1], [T1.C2], [T1.C3], [T1.C4], [T1.C5], [T1.C6]), filter(nil), rowset=16
      access([T1.C1], [T1.C2], [T1.C3], [T1.C4], [T1.C5], [T1.C6]), partitions(p0)
      is_index_back=false, is_global_index=false, 
      range_key([T1.__pk_increment]), range(MIN ; MAX)always true
select * from t1;
+------+------+------+------+------+------+
| C1   | C2   | C3   | C4   | C5   | C6   |
+------+------+------+------+------+------+
|    1 |    1 | NULL | NULL |    1 |    1 |
|    1 |    1 |    1 |    1 |    2 |    2 |
|    1 |    1 |    2 |    2 |    3 |    3 |
|    1 |    1 |    3 |    3 |    4 |    4 |
|    1 |    1 |    4 |    4 |    5 |    5 |
|    1 |    1 |    5 |    5 |    6 |    6 |
|    1 |    1 |    6 |    6 |    7 |    7 |
|    1 |    1 |    7 |    7 |    8 |    8 |
|    1 |    1 |    8 |    8 |    9 |    9 |
|    1 |    1 |    9 |    9 |   10 |   10 |
+------+------+------+------+------+------+
rollback;
EXPLAIN update t1 set (c1, c2) = (select /*+no_unnest*/ c1, c2 from t2 where rownum <= 1), (c3, c4) = (select /*+no_unnest*/ max(c3), max(c4) from t3 where t3.c5 < t1.c5);
Query Plan
=========================================================
|ID|OPERATOR                 |NAME|EST.ROWS|EST.TIME(us)|
---------------------------------------------------------
|0 |EXCHANGE IN REMOTE       |    |10      |346         |
|1 |└─EXCHANGE OUT REMOTE    |    |10      |328         |
|2 |  └─UPDATE               |    |10      |288         |
|3 |    └─SUBPLAN FILTER     |    |10      |189         |
|4 |      ├─TABLE FULL SCAN  |T1  |10      |4           |
|5 |      ├─TABLE FULL SCAN  |T2  |1       |3           |
|6 |      └─SCALAR GROUP BY  |    |1       |19          |
|7 |        └─TABLE FULL SCAN|T3  |10      |18          |
=========================================================
Outputs & filters:
-------------------------------------
  0 - output(nil), filter(nil)
  1 - output(nil), filter(nil)
  2 - output(nil), filter(nil)
      table_columns([{T1: ({T1: (T1.__pk_increment, T1.C1, T1.C2, T1.C3, T1.C4, T1.C5, T1.C6)})}]),
      update([T1.C1=column_conv(NUMBER,PS:(-1,0),NULL,T2.C1)], [T1.C2=column_conv(NUMBER,PS:(-1,0),NULL,T2.C2)], [T1.C3=column_conv(NUMBER,PS:(-1,0),NULL,
      T_FUN_MAX(T_FUN_MAX(T3.C3)))], [T1.C4=column_conv(NUMBER,PS:(-1,0),NULL,T_FUN_MAX(T_FUN_MAX(T3.C4)))])
  3 - output([T1.__pk_increment], [T1.C1], [T1.C2], [T1.C3], [T1.C4], [T1.C5], [T1.C6], [T2.C1], [T2.C2], [T_FUN_MAX(T_FUN_MAX(T3.C3))], [T_FUN_MAX(T_FUN_MAX(T3.C4))]), filter(nil)
      exec_params_([T1.C5(:0)]), onetime_exprs_(nil), init_plan_idxs_([1]), use_batch=false
  4 - output([T1.__pk_increment], [T1.C1], [T1.C2], [T1.C3], [T1.C4], [T1.C5], [T1.C6]), filter(nil)
      access([T1.__pk_increment], [T1.C1], [T1.C2], [T1.C3], [T1.C4], [T1.C5], [T1.C6]), partitions(p0)
      is_index_back=false, is_global_index=false, 
      range_key([T1.__pk_increment]), range(MIN ; MAX)always true
  5 - output([T2.C1], [T2.C2]), filter(nil)
      access([T2.C1], [T2.C2]), partitions(p0)
      limit(cast(FLOOR(1), BIGINT(-1, 0))), offset(nil), is_index_back=false, is_global_index=false, 
      range_key([T2.__pk_increment]), range(MIN ; MAX)always true
  6 - output([T_FUN_MAX(T_FUN_MAX(T3.C3))], [T_FUN_MAX(T_FUN_MAX(T3.C4))]), filter(nil)
      group(nil), agg_func([T_FUN_MAX(T_FUN_MAX(T3.C3))], [T_FUN_MAX(T_FUN_MAX(T3.C4))])
  7 - output([T_FUN_MAX(T3.C3)], [T_FUN_MAX(T3.C4)]), filter([T3.C5 < :0])
      access([T3.C5], [T3.C3], [T3.C4]), partitions(p0)
      is_index_back=false, is_global_index=false, filter_before_indexback[false], 
      range_key([T3.__pk_increment]), range(MIN ; MAX)always true, 
      pushdown_aggregation([T_FUN_MAX(T3.C3)], [T_FUN_MAX(T3.C4)])
update t1 set (c1, c2) = (select /*+no_unnest*/ c1, c2 from t2 where rownum <= 1), (c3, c4) = (select /*+no_unnest*/ max(c3), max(c4) from t3 where t3.c5 < t1.c5);
EXPLAIN select * from t1;
Query Plan
=====================================================
|ID|OPERATOR             |NAME|EST.ROWS|EST.TIME(us)|
-----------------------------------------------------
|0 |EXCHANGE IN REMOTE   |    |10      |61          |
|1 |└─EXCHANGE OUT REMOTE|    |10      |43          |
|2 |  └─TABLE FULL SCAN  |T1  |10      |4           |
=====================================================
Outputs & filters:
-------------------------------------
  0 - output([T1.C1], [T1.C2], [T1.C3], [T1.C4], [T1.C5], [T1.C6]), filter(nil)
  1 - output([T1.C1], [T1.C2], [T1.C3], [T1.C4], [T1.C5], [T1.C6]), filter(nil)
  2 - output([T1.C1], [T1.C2], [T1.C3], [T1.C4], [T1.C5], [T1.C6]), filter(nil), rowset=16
      access([T1.C1], [T1.C2], [T1.C3], [T1.C4], [T1.C5], [T1.C6]), partitions(p0)
      is_index_back=false, is_global_index=false, 
      range_key([T1.__pk_increment]), range(MIN ; MAX)always true
select * from t1;
+------+------+------+------+------+------+
| C1   | C2   | C3   | C4   | C5   | C6   |
+------+------+------+------+------+------+
|    1 |    1 | NULL | NULL |    1 |    1 |
|    1 |    1 |    1 |    1 |    2 |    2 |
|    1 |    1 |    2 |    2 |    3 |    3 |
|    1 |    1 |    3 |    3 |    4 |    4 |
|    1 |    1 |    4 |    4 |    5 |    5 |
|    1 |    1 |    5 |    5 |    6 |    6 |
|    1 |    1 |    6 |    6 |    7 |    7 |
|    1 |    1 |    7 |    7 |    8 |    8 |
|    1 |    1 |    8 |    8 |    9 |    9 |
|    1 |    1 |    9 |    9 |   10 |   10 |
+------+------+------+------+------+------+
rollback;

set autocommit = 1;
drop table t1;
drop table t2;
drop table t3;
