result_format: 4
drop table if exists t1, t1_, t2, t2_, t3, t3_, test_date, test_date_, test_part, test_part_, t1_csv, t1_parquet;
CREATE EXTERNAL TABLE t1 (c1 int, c2 int)
PROPERTIES = (
TYPE = 'ODPS'
ACCESSID='#ODPS_ACCESSID#'
ACCESSKEY='#ODPS_ACCESSKEY#'
ENDPOINT='#ODPS_ENDPOINT#'
TUNNEL_ENDPOINT='#TUNNEL_ENDPOINT#'
PROJECT_NAME = 'mysqltest_regression'
SCHEMA_NAME = ''
TABLE_NAME = 'linyi_test_int'
QUOTA_NAME = ''
COMPRESSION_CODE = ''
COLLECT_STATISTICS_ON_CREATE = FALSE
);

create table t1_(c1 int, c2 int);
insert into t1_ values(1,1),(2,2),(3,3);
insert overwrite t1 select 1, 2 from dual;
select * from t1;
+------+------+
| c1   | c2   |
+------+------+
|    1 |    2 |
+------+------+

explain insert into t1 select * from t1_;
Query Plan
==============================================================
|ID|OPERATOR           |NAME           |EST.ROWS|EST.TIME(us)|
--------------------------------------------------------------
|0 |SELECT INTO        |               |3       |3           |
|1 |└─SUBPLAN SCAN     |ANONYMOUS_VIEW1|3       |3           |
|2 |  └─TABLE FULL SCAN|t1_            |3       |3           |
==============================================================
Outputs & filters:
-------------------------------------
  0 - output(nil), filter(nil), rowset=16
  1 - output([ANONYMOUS_VIEW1.c1], [ANONYMOUS_VIEW1.c2]), filter(nil), rowset=16
      access([ANONYMOUS_VIEW1.c1], [ANONYMOUS_VIEW1.c2])
  2 - output([t1_.c1], [t1_.c2]), filter(nil), rowset=16
      access([t1_.c1], [t1_.c2]), partitions(p0)
      is_index_back=false, is_global_index=false, 
      range_key([t1_.__pk_increment]), range(MIN ; MAX)always true
explain insert /*+parallel(5)*/ into t1 select * from t1_;
Query Plan
==============================================================================
|ID|OPERATOR                           |NAME           |EST.ROWS|EST.TIME(us)|
------------------------------------------------------------------------------
|0 |PX COORDINATOR                     |               |3       |3           |
|1 |└─EXCHANGE OUT DISTR               |:EX10001       |3       |2           |
|2 |  └─SELECT INTO                    |               |3       |2           |
|3 |    └─EXCHANGE IN DISTR            |               |3       |2           |
|4 |      └─EXCHANGE OUT DISTR (RANDOM)|:EX10000       |3       |1           |
|5 |        └─SUBPLAN SCAN             |ANONYMOUS_VIEW1|3       |1           |
|6 |          └─PX BLOCK ITERATOR      |               |3       |1           |
|7 |            └─TABLE FULL SCAN      |t1_            |3       |1           |
==============================================================================
Outputs & filters:
-------------------------------------
  0 - output(nil), filter(nil), rowset=16
  1 - output(nil), filter(nil), rowset=16
      dop=5
  2 - output(nil), filter(nil), rowset=16
  3 - output([ANONYMOUS_VIEW1.c1], [ANONYMOUS_VIEW1.c2]), filter(nil), rowset=16
  4 - output([ANONYMOUS_VIEW1.c1], [ANONYMOUS_VIEW1.c2]), filter(nil), rowset=16
      dop=5
  5 - output([ANONYMOUS_VIEW1.c1], [ANONYMOUS_VIEW1.c2]), filter(nil), rowset=16
      access([ANONYMOUS_VIEW1.c1], [ANONYMOUS_VIEW1.c2])
  6 - output([t1_.c1], [t1_.c2]), filter(nil), rowset=16
  7 - output([t1_.c1], [t1_.c2]), filter(nil), rowset=16
      access([t1_.c1], [t1_.c2]), partitions(p0)
      is_index_back=false, is_global_index=false, 
      range_key([t1_.__pk_increment]), range(MIN ; MAX)always true

insert into t1 select * from t1_;
select * from t1;
+------+------+
| c1   | c2   |
+------+------+
|    1 |    2 |
|    1 |    1 |
|    2 |    2 |
|    3 |    3 |
+------+------+
insert /*+parallel(5)*/ into t1 select * from t1_;
select * from t1;
+------+------+
| c1   | c2   |
+------+------+
|    1 |    1 |
|    1 |    1 |
|    1 |    2 |
|    2 |    2 |
|    2 |    2 |
|    3 |    3 |
|    3 |    3 |
+------+------+

delete from t1_;
select count(*) from t1;
+----------+
| count(*) |
+----------+
|        7 |
+----------+
insert into t1 select * from t1_;
select count(*) from t1;
+----------+
| count(*) |
+----------+
|        7 |
+----------+
insert overwrite t1 select * from t1_;
select count(*) from t1;
+----------+
| count(*) |
+----------+
|        0 |
+----------+

insert /*+append enable_parallel_dml parallel(8) */ into t1_
select UNIFORM(1, 1000, random(7)), UNIFORM(1, 1000, random(7)) from table(generator(10000));
insert /*+parallel(5)*/ into t1 select * from t1_;
select count(*) from t1;
+----------+
| count(*) |
+----------+
|    10000 |
+----------+

CREATE EXTERNAL TABLE t2
(c1 tinyint, c2 smallint, c3 int, c4 bigint, c5 float, c6 double, c7 decimal(38,18), c8 blob,
c9 text, c10 timestamp(6), c11 char(10), c12 varchar(20), c13 json, c14 datetime)
PROPERTIES = (
TYPE = 'ODPS'
ACCESSID='#ODPS_ACCESSID#'
ACCESSKEY='#ODPS_ACCESSKEY#'
ENDPOINT='#ODPS_ENDPOINT#'
TUNNEL_ENDPOINT='#TUNNEL_ENDPOINT#'
PROJECT_NAME = 'mysqltest_regression'
SCHEMA_NAME = ''
TABLE_NAME = 'linyi_test_select_into0'
QUOTA_NAME = ''
COMPRESSION_CODE = ''
COLLECT_STATISTICS_ON_CREATE = FALSE
);

create table t2_
(c1 tinyint, c2 smallint, c3 int, c4 bigint, c5 float, c6 double, c7 decimal(38,18), c8 blob,
c9 text, c10 timestamp(6), c11 char(10), c12 varchar(20), c13 json, c14 datetime);

insert into t2_ values(null,null,null,null,null,null,null,null,null,null,null,null,null,null);
insert into t2_ values(1,2,3,4,5.5,6.666,7.7777, "blobc80101", "text c9", "2010-10-10 10:10:10",
"c11", "c1212", '{"id":129}', "2014-12-14 8:00:00");
insert into t2_ values(1,2,3,4,5.5,6.666,7.7777, "blobc81111", "text c9", "2010-10-10 10:10:10",
"c11", "c1212", '{"name":"ak"}', "2014-12-14 1:00:00");
insert into t2_ values(1,2,3,4,5.5,6.666,7.7777, "blobc81234", "text c9", "2010-10-10 10:10:10",
"c11", "c1212", null, "2014-12-14");

insert overwrite t2 select * from t2_;
insert /*+parallel(4)*/ overwrite t2 select * from t2_;

set time_zone = "+8:00";
select * from t2_;
+------+------+------+------+------+-------+----------------------+------------+---------+----------------------------+------+-------+----------------+---------------------+
| c1   | c2   | c3   | c4   | c5   | c6    | c7                   | c8         | c9      | c10                        | c11  | c12   | c13            | c14                 |
+------+------+------+------+------+-------+----------------------+------------+---------+----------------------------+------+-------+----------------+---------------------+
| NULL | NULL | NULL | NULL | NULL |  NULL |                 NULL | NULL       | NULL    | NULL                       | NULL | NULL  | NULL           | NULL                |
|    1 |    2 |    3 |    4 |  5.5 | 6.666 | 7.777700000000000000 | blobc80101 | text c9 | 2010-10-10 10:10:10.000000 | c11  | c1212 | {"id": 129}    | 2014-12-14 08:00:00 |
|    1 |    2 |    3 |    4 |  5.5 | 6.666 | 7.777700000000000000 | blobc81111 | text c9 | 2010-10-10 10:10:10.000000 | c11  | c1212 | {"name": "ak"} | 2014-12-14 01:00:00 |
|    1 |    2 |    3 |    4 |  5.5 | 6.666 | 7.777700000000000000 | blobc81234 | text c9 | 2010-10-10 10:10:10.000000 | c11  | c1212 | NULL           | 2014-12-14 00:00:00 |
+------+------+------+------+------+-------+----------------------+------------+---------+----------------------------+------+-------+----------------+---------------------+
insert into t2 select * from t2_;
insert /*+parallel(4)*/ into t2 select * from t2_;
insert into t2(c10) select '0000-00-00 00:00:00' from dual;
ERROR 22008: Datetime overflow
insert into t2(c14) select '0000-00-00 00:00:00' from dual;
ERROR 22008: Datetime overflow
insert into t2(c10) select '0001-01-01 00:00:00' from dual;
ERROR 22008: Datetime overflow
insert into t2(c10) select '0001-01-01 08:00:00' from dual;
insert into t2(c14) select '0001-01-01 00:00:00' from dual;

CREATE EXTERNAL TABLE t3
(c1 tinyint, c2 decimal(20,10), c3 varchar(500), c4 longtext, c5 varbinary(500), c6 longblob)
PROPERTIES = (
TYPE = 'ODPS'
ACCESSID='#ODPS_ACCESSID#'
ACCESSKEY='#ODPS_ACCESSKEY#'
ENDPOINT='#ODPS_ENDPOINT#'
TUNNEL_ENDPOINT='#TUNNEL_ENDPOINT#'
PROJECT_NAME = 'mysqltest_regression'
SCHEMA_NAME = ''
TABLE_NAME = 'linyi_test_select_into1'
QUOTA_NAME = ''
COMPRESSION_CODE = ''
COLLECT_STATISTICS_ON_CREATE = FALSE
);

create table t3_(c1 tinyint, c2 decimal(20,10), c3 varchar(500), c4 longtext, c5 varbinary(500), c6 longblob);
insert overwrite t3 select * from t3_;

insert into t3_ values(null,null,null,null,null,null);
insert into t3_ values(0, 1, '', '', '', '');
insert into t3_ values(1, 12.345, 'asdfghjk', 'qwertyuiop', 'asdfghjk', 'qwertyuiop');
insert into t3_ values(1, 12.345678, 'AA', 'NOT', 'NULL', 'PPP');
insert into t3 select * from t3_;
insert into t3(c1,c2) select c1,c2 from t3_;
select * from t3;
+------+---------------+----------+------------+----------+------------+
| c1   | c2            | c3       | c4         | c5       | c6         |
+------+---------------+----------+------------+----------+------------+
|    0 |  1.0000000000 |          |            |          |            |
|    0 |  1.0000000000 | NULL     | NULL       | NULL     | NULL       |
|    1 | 12.3450000000 | NULL     | NULL       | NULL     | NULL       |
|    1 | 12.3450000000 | asdfghjk | qwertyuiop | asdfghjk | qwertyuiop |
|    1 | 12.3456780000 | AA       | NOT        | NULL     | PPP        |
|    1 | 12.3456780000 | NULL     | NULL       | NULL     | NULL       |
| NULL |          NULL | NULL     | NULL       | NULL     | NULL       |
| NULL |          NULL | NULL     | NULL       | NULL     | NULL       |
+------+---------------+----------+------------+----------+------------+

CREATE EXTERNAL TABLE test_date (c1 date, c2 datetime(3))
PROPERTIES = (
TYPE = 'ODPS'
ACCESSID='#ODPS_ACCESSID#'
ACCESSKEY='#ODPS_ACCESSKEY#'
ENDPOINT='#ODPS_ENDPOINT#'
TUNNEL_ENDPOINT='#TUNNEL_ENDPOINT#'
PROJECT_NAME = 'mysqltest_regression'
SCHEMA_NAME = ''
TABLE_NAME = 'linyi_test_date'
QUOTA_NAME = ''
COMPRESSION_CODE = ''
COLLECT_STATISTICS_ON_CREATE = FALSE
);

create table test_date_ (c1 date, c2 datetime(3));
insert into test_date_ values('2020-10-10','2020-1-1 1:00:10'),('2024-2-1','2023-10-1 8:00:00');
insert overwrite test_date select * from test_date_;

select * from test_date_;
+------------+-------------------------+
| c1         | c2                      |
+------------+-------------------------+
| 2020-10-10 | 2020-01-01 01:00:10.000 |
| 2024-02-01 | 2023-10-01 08:00:00.000 |
+------------+-------------------------+
select * from test_date;
+------------+-------------------------+
| c1         | c2                      |
+------------+-------------------------+
| 2020-10-10 | 2020-01-01 01:00:10.000 |
| 2024-02-01 | 2023-10-01 08:00:00.000 |
+------------+-------------------------+

set time_zone = "+8:00";
insert into test_date(c1) select '0000-00-00' from dual;
ERROR 22008: Datetime overflow
insert into test_date(c1) select '0001-01-01' from dual;
insert into test_date(c2) select '0000-00-00 00:00:00' from dual;
ERROR 22008: Datetime overflow
insert into test_date(c2) select '0001-01-01 00:00:00' from dual;
ERROR 22008: Datetime overflow
insert into test_date(c2) select '0001-01-01 08:00:00' from dual;


CREATE EXTERNAL TABLE test_part (
 c1             int AS (external$tablecol1),
 c2             int AS (external$tablecol2),
 c3          varchar(20) AS (metadata$partition_list_col1)
)
PROPERTIES = (
TYPE = 'ODPS'
ACCESSID='#ODPS_ACCESSID#'
ACCESSKEY='#ODPS_ACCESSKEY#'
ENDPOINT='#ODPS_ENDPOINT#'
TUNNEL_ENDPOINT='#TUNNEL_ENDPOINT#'
PROJECT_NAME = 'mysqltest_regression'
SCHEMA_NAME = ''
TABLE_NAME = 'linyi_test_part'
QUOTA_NAME = ''
COMPRESSION_CODE = ''
COLLECT_STATISTICS_ON_CREATE = FALSE
)
partition by (c3)
;

create table test_part_(c1 int, c2 int);

insert overwrite test_part partition (c3='abc') select * from test_part_;
insert overwrite test_part partition (c3='def') select * from test_part_;
insert /*+parallel(3)*/ overwrite test_part partition (c3='p3') select * from test_part_;
insert /*+parallel(3)*/ overwrite test_part partition (c3='p4') select * from test_part_;

insert into test_part_ values(1,2),(2,3),(3,4);

insert into test_part partition (c3='abc') select * from test_part_;
insert into test_part partition (c3 = 'def') select * from test_part_;
insert /*+parallel(3)*/ into test_part partition (c3 ='p3') select * from test_part_;
insert /*+parallel(3)*/ into test_part partition (c3= 'p4') select * from test_part_;

alter external table test_part refresh;
set ob_query_timeout=1000000000;
select * from test_part;
+------+------+------+
| c1   | c2   | c3   |
+------+------+------+
|    1 |    2 | abc  |
|    2 |    3 | abc  |
|    3 |    4 | abc  |
|    1 |    2 | def  |
|    2 |    3 | def  |
|    3 |    4 | def  |
|    1 |    2 | p3   |
|    2 |    3 | p3   |
|    3 |    4 | p3   |
|    1 |    2 | p4   |
|    2 |    3 | p4   |
|    3 |    4 | p4   |
+------+------+------+

drop table test_part;

CREATE EXTERNAL TABLE test_part (
    c1 int AS (external$tablecol1),
    c2 varchar(500) AS (external$tablecol2),
    c3 varchar(500) AS (external$tablecol3),
    c4 varchar(500) AS (external$tablecol4),
    c5 varchar(500) AS (external$tablecol5),
    c6 varchar(10) AS (metadata$partition_list_col1),
    c7 int AS (metadata$partition_list_col2)
)
PROPERTIES = (
REGION = 'shanghai'
TYPE = 'ODPS'
ACCESSID='#ODPS_ACCESSID#'
ACCESSKEY='#ODPS_ACCESSKEY#'
ENDPOINT='#ODPS_ENDPOINT#'
TUNNEL_ENDPOINT='#TUNNEL_ENDPOINT#'
PROJECT_NAME = 'mysqltest_regression'
SCHEMA_NAME = ''
TABLE_NAME = 'linyi_test_performance3'
QUOTA_NAME = ''
COMPRESSION_CODE = ''
COLLECT_STATISTICS_ON_CREATE = FALSE
)
partition by (c6,c7)
;

insert overwrite test_part partition (c6='20201010',c7=12345678) select 1,'a','b','c','d' from dual;
alter external table test_part refresh;
select * from test_part;
+------+------+------+------+------+----------+----------+
| c1   | c2   | c3   | c4   | c5   | c6       | c7       |
+------+------+------+------+------+----------+----------+
|    1 | a    | b    | c    | d    | 20201010 | 12345678 |
+------+------+------+------+------+----------+----------+



create external table t1_csv (
    c1 int,
    c2 int,
    c3 int
)
location='mysqltest_data_for_external_table/external_table_lineitem'
format (
    type = 'csv',
    line_delimiter = NVL(NULL, 'b'),
    field_delimiter = UPPER('a'),
    field_optionally_enclosed_by = NVL(NULL, ''),
    null_if = (NVL(NULL, 'NULL'),UPPER('c'))
);
insert into t1_csv select 1,2,3 from dual;
ERROR 0A000: insert into external table which is not in odps not supported

create external table t1_parquet (
    c1 bigint as (cast(get_path(external$filerow, 'int') as signed)),
    c2 varchar(1000) as (cast(get_path(external$filerow, 'string') as char)),
    c3 decimal(6,3) as (cast(get_path(external$filerow, 'decimal32') as decimal(6,3))),
    c4 decimal as (cast(get_path(external$filerow, 'decimal64') as decimal)),
    c6 date as (cast(get_path(external$filerow, 'date') as date))
)
format (type = 'PARQUET') location 'mysqltest_data_for_external_table/parquet_ex_t1';
insert into t1_parquet select null,null,null,null,null from dual;
ERROR 0A000: insert into external table which is not in odps not supported

drop table t1, t1_, t2, t2_, t3, t3_, test_date, test_date_, test_part, test_part_, t1_csv, t1_parquet;


set ob_query_timeout=10000000;

