show grants for user_1;
Grants for user_1@%
GRANT USAGE ON *.* TO 'user_1'
GRANT SELECT ON `test`.`t1` TO 'user_1'
/***************************user privilege level********************************/
CREATE
create external table ex_t1 (
c1 int,
c2 int,
c3 int
)
location='mysqltest_data_for_external_table/external_table_lineitem'
pattern='temp[0-3].dat'
format (
type = 'csv',
line_delimiter = NVL(NULL, 'b'),
field_delimiter = UPPER('a'),
field_optionally_enclosed_by = NVL(NULL, ''),
null_if = (NVL(NULL, 'NULL'),UPPER('c'))
);
ERROR 42000: CREATE command denied to user 'user_1'@'%' for table 'ex_t1'
grant create on *.* to user_1;
create external table ex_t1 (
c1 int,
c2 int,
c3 int
)
location='mysqltest_data_for_external_table/external_table_lineitem'
pattern='temp[0-3].dat'
format (
type = 'csv',
line_delimiter = NVL(NULL, 'b'),
field_delimiter = UPPER('a'),
field_optionally_enclosed_by = NVL(NULL, ''),
null_if = (NVL(NULL, 'NULL'),UPPER('c'))
);
SELECT/INSERT/DELETE/UPDATE/INDEX/ALTER/CREATE VIEW
select * from ex_t1;
ERROR 42000: SELECT command denied to user 'user_1'@'%' for table 'ex_t1'
insert into ex_t1 values(5, 6,7);
ERROR 0A000: insert into external table with values, replace, ignore, returning, update not supported
delete from ex_t1 where c1 = 1;
ERROR 0A000: DML operation on External Table not supported
update ex_t1 set c1 = 1 where c1 = 2;
ERROR HY000: The value specified for generated column 'c1' in table 'ex_t1' is not allowed
CREATE unique INDEX idx ON ex_t1 (c1);
ERROR 0A000: operation on external table not supported
create external table ex_t2 (
c1 int,
c2 int,
c3 int,
index(c1)
)
location='mysqltest_data_for_external_table/external_table_lineitem'
format (
type = 'csv'
);
ERROR 0A000: operation on external table not supported
alter table ex_t1 ADD i INT;
ERROR 0A000: alter table type not supported
create view v1 as (select c1 from ex_t1);
ERROR 42000: CREATE VIEW command denied to user 'user_1'@'%' for table 'v1'
revoke create on *.* from user_1;
show create table ex_t1;
ERROR 42000: SHOW command denied to user 'user_1'@'%' for table 'ex_t1'
grant create, select, insert, delete, update, index, alter, create view on *.* to user_1;
select * from ex_t1;
c1	c2	c3
1	2	3
2	2	2
3	2	1
4	5	6
5	5	5
6	5	4
7	8	9
8	8	8
9	8	7
insert into ex_t1 values(5, 6,7);
ERROR 0A000: insert into external table with values, replace, ignore, returning, update not supported
delete from ex_t1 where c1 = 1;
ERROR 0A000: DML operation on External Table not supported
update ex_t1 set c1 = 1 where c1 = 2;
ERROR HY000: The value specified for generated column 'c1' in table 'ex_t1' is not allowed
create unique index idx on ex_t1 (c1);
ERROR 0A000: operation on external table not supported
create external table ex_t2 (
c1 int,
c2 int,
c3 int,
index(c1)
)
location='mysqltest_data_for_external_table/external_table_lineitem'
format (
type = 'csv'
);
ERROR 0A000: operation on external table not supported
alter table ex_t1 ADD i INT;
ERROR 0A000: alter table type not supported
create view v1 as (select c1 as a1 from ex_t1);
select * from v1;
a1
1
2
3
4
5
6
7
8
9
insert into v1 values(3);
ERROR HY000: The value specified for generated column 'a1' in table 'v1' is not allowed
show create table ex_t1;
Table	Create Table
ex_t1	CREATE EXTERNAL TABLE `ex_t1` (
  `c1` int(11) GENERATED ALWAYS AS (metadata$filecol1),
  `c2` int(11) GENERATED ALWAYS AS (metadata$filecol2),
  `c3` int(11) GENERATED ALWAYS AS (metadata$filecol3)
) 
LOCATION='file://mysqltest_data_for_external_table/external_table_lineitem'
PATTERN='temp[0-3].dat'
AUTO_REFRESH = OFF
FORMAT (
  TYPE = 'CSV',
  LINE_DELIMITER = NVL(NULL, 'b'),
  FIELD_DELIMITER = UPPER('a'),
  ENCODING = 'utf8mb4',
  NULL_IF = (NVL(NULL, 'NULL'),UPPER('c'))
) DEFAULT CHARSET = utf8mb4
DROP
drop table ex_t1;
ERROR 42000: DROP command denied to user 'user_1'@'%' for table 'ex_t1'
grant drop on *.* to user_1;
drop table ex_t1;
select * from ex_t1;
ERROR 42S02: Table 'test.ex_t1' doesn't exist
show tables;
Tables_in_test
t1
v1
drop view v1;
REVOKE ALL PRIVILEGES, GRANT OPTION FROM user_1;
grant select on test.t1 to user_1;
show grants for user_1;
Grants for user_1@%
GRANT USAGE ON *.* TO 'user_1'
GRANT SELECT ON `test`.`t1` TO 'user_1'
/***************************database privilege level********************************/
CREATE
create external table ex_t1 (
c1 int,
c2 int,
c3 int
)
location='mysqltest_data_for_external_table/external_table_lineitem'
pattern='temp[0-3].dat'
format (
type = 'csv',
line_delimiter = NVL(NULL, 'b'),
field_delimiter = UPPER('a'),
field_optionally_enclosed_by = NVL(NULL, ''),
null_if = (NVL(NULL, 'NULL'),UPPER('c'))
);
ERROR 42000: CREATE command denied to user 'user_1'@'%' for table 'ex_t1'
grant create on test.* to user_1;
create external table ex_t1 (
c1 int,
c2 int,
c3 int
)
location='mysqltest_data_for_external_table/external_table_lineitem'
pattern='temp[0-3].dat'
format (
type = 'csv',
line_delimiter = NVL(NULL, 'b'),
field_delimiter = UPPER('a'),
field_optionally_enclosed_by = NVL(NULL, ''),
null_if = (NVL(NULL, 'NULL'),UPPER('c'))
);
SELECT/INSERT/DELETE/UPDATE/INDEX/ALTER/CREATE VIEW
select * from ex_t1;
ERROR 42000: SELECT command denied to user 'user_1'@'%' for table 'ex_t1'
insert into ex_t1 values(5, 6,7);
ERROR 0A000: insert into external table with values, replace, ignore, returning, update not supported
delete from ex_t1 where c1 = 1;
ERROR 0A000: DML operation on External Table not supported
update ex_t1 set c1 = 1 where c1 = 2;
ERROR HY000: The value specified for generated column 'c1' in table 'ex_t1' is not allowed
CREATE unique INDEX idx ON ex_t1 (c1);
ERROR 0A000: operation on external table not supported
create external table ex_t2 (
c1 int,
c2 int,
c3 int,
index(c1)
)
location='mysqltest_data_for_external_table/external_table_lineitem'
format (
type = 'csv'
);
ERROR 0A000: operation on external table not supported
alter table ex_t1 ADD i INT;
ERROR 0A000: alter table type not supported
create view v1 as (select c1 from ex_t1);
ERROR 42000: CREATE VIEW command denied to user 'user_1'@'%' for table 'v1'
revoke create on test.* from user_1;
show create table ex_t1;
ERROR 42000: SHOW command denied to user 'user_1'@'%' for table 'ex_t1'
grant create, select, insert, delete, update, index, alter, create view on test.* to user_1;
select * from ex_t1;
c1	c2	c3
1	2	3
2	2	2
3	2	1
4	5	6
5	5	5
6	5	4
7	8	9
8	8	8
9	8	7
insert into ex_t1 values(5, 6,7);
ERROR 0A000: insert into external table with values, replace, ignore, returning, update not supported
delete from ex_t1 where c1 = 1;
ERROR 0A000: DML operation on External Table not supported
update ex_t1 set c1 = 1 where c1 = 2;
ERROR HY000: The value specified for generated column 'c1' in table 'ex_t1' is not allowed
create unique index idx on ex_t1 (c1);
ERROR 0A000: operation on external table not supported
create external table ex_t2 (
c1 int,
c2 int,
c3 int,
index(c1)
)
location='mysqltest_data_for_external_table/external_table_lineitem'
format (
type = 'csv'
);
ERROR 0A000: operation on external table not supported
alter table ex_t1 ADD i INT;
ERROR 0A000: alter table type not supported
create view v1 as (select c1 as a1 from ex_t1);
select * from v1;
a1
1
2
3
4
5
6
7
8
9
insert into v1 values(3);
ERROR HY000: The value specified for generated column 'a1' in table 'v1' is not allowed
show create table ex_t1;
Table	Create Table
ex_t1	CREATE EXTERNAL TABLE `ex_t1` (
  `c1` int(11) GENERATED ALWAYS AS (metadata$filecol1),
  `c2` int(11) GENERATED ALWAYS AS (metadata$filecol2),
  `c3` int(11) GENERATED ALWAYS AS (metadata$filecol3)
) 
LOCATION='file://mysqltest_data_for_external_table/external_table_lineitem'
PATTERN='temp[0-3].dat'
AUTO_REFRESH = OFF
FORMAT (
  TYPE = 'CSV',
  LINE_DELIMITER = NVL(NULL, 'b'),
  FIELD_DELIMITER = UPPER('a'),
  ENCODING = 'utf8mb4',
  NULL_IF = (NVL(NULL, 'NULL'),UPPER('c'))
) DEFAULT CHARSET = utf8mb4
DROP
drop table ex_t1;
ERROR 42000: DROP command denied to user 'user_1'@'%' for table 'ex_t1'
grant drop on test.* to user_1;
drop table ex_t1;
select * from ex_t1;
ERROR 42S02: Table 'test.ex_t1' doesn't exist
drop view v1;
show tables;
Tables_in_test
t1
show grants for user_1;
Grants for user_1@%
GRANT USAGE ON *.* TO 'user_1'
GRANT ALTER, CREATE, DELETE, DROP, INSERT, UPDATE, SELECT, INDEX, CREATE VIEW ON `test`.* TO 'user_1'
GRANT SELECT ON `test`.`t1` TO 'user_1'
REVOKE ALL PRIVILEGES, GRANT OPTION FROM user_1;
grant update, select on test.t1 to user_1;
show grants for user_1;
Grants for user_1@%
GRANT USAGE ON *.* TO 'user_1'
GRANT UPDATE, SELECT ON `test`.`t1` TO 'user_1'
/***************************table privilege level********************************/
CREATE
create external table ex_t1 (
c1 int,
c2 int,
c3 int
)
location='mysqltest_data_for_external_table/external_table_lineitem'
pattern='temp[0-3].dat'
format (
type = 'csv',
line_delimiter = NVL(NULL, 'b'),
field_delimiter = UPPER('a'),
field_optionally_enclosed_by = NVL(NULL, ''),
null_if = (NVL(NULL, 'NULL'),UPPER('c'))
);
SELECT/INSERT/DELETE/UPDATE/INDEX/ALTER/CREATE VIEW
select * from ex_t1;
ERROR 42000: SELECT command denied to user 'user_1'@'%' for table 'ex_t1'
insert into ex_t1 values(5, 6,7);
ERROR 0A000: insert into external table with values, replace, ignore, returning, update not supported
delete from ex_t1 where c1 = 1;
ERROR 0A000: DML operation on External Table not supported
update ex_t1 set c1 = 1 where c1 = 2;
ERROR HY000: The value specified for generated column 'c1' in table 'ex_t1' is not allowed
CREATE unique INDEX idx ON ex_t1 (c1);
ERROR 0A000: operation on external table not supported
alter table ex_t1 ADD i INT;
ERROR 0A000: alter table type not supported
create view v1 as (select c1 from ex_t1);
ERROR 42000: CREATE VIEW command denied to user 'user_1'@'%' for table 'v1'
show create table ex_t1;
ERROR 42000: SHOW command denied to user 'user_1'@'%' for table 'ex_t1'
grant create, select, insert, delete, update, index, alter on test.ex_t1 to user_1;
select * from ex_t1;
c1	c2	c3
1	2	3
2	2	2
3	2	1
4	5	6
5	5	5
6	5	4
7	8	9
8	8	8
9	8	7
insert into ex_t1 values(5, 6,7);
ERROR 0A000: insert into external table with values, replace, ignore, returning, update not supported
delete from ex_t1 where c1 = 1;
ERROR 0A000: DML operation on External Table not supported
update ex_t1 set c1 = 1 where c1 = 2;
ERROR HY000: The value specified for generated column 'c1' in table 'ex_t1' is not allowed
create unique index idx on ex_t1 (c1);
ERROR 0A000: operation on external table not supported
alter table ex_t1 ADD i INT;
ERROR 0A000: alter table type not supported
show create table ex_t1;
Table	Create Table
ex_t1	CREATE EXTERNAL TABLE `ex_t1` (
  `c1` int(11) GENERATED ALWAYS AS (metadata$filecol1),
  `c2` int(11) GENERATED ALWAYS AS (metadata$filecol2),
  `c3` int(11) GENERATED ALWAYS AS (metadata$filecol3)
) 
LOCATION='file://mysqltest_data_for_external_table/external_table_lineitem'
PATTERN='temp[0-3].dat'
AUTO_REFRESH = OFF
FORMAT (
  TYPE = 'CSV',
  LINE_DELIMITER = NVL(NULL, 'b'),
  FIELD_DELIMITER = UPPER('a'),
  ENCODING = 'utf8mb4',
  NULL_IF = (NVL(NULL, 'NULL'),UPPER('c'))
) DEFAULT CHARSET = utf8mb4
update t1, ex_t1 set t1.c1 = 0 where t1.c1 = ex_t1.c1;
select * from ex_t1 for update;
ERROR 0A000: DML operation on External Table not supported
select * from t1, ex_t1 where t1.c1 = ex_t1.c1 for update;
ERROR 0A000: DML operation on External Table not supported
select t1.* from t1, ex_t1 where t1.c1 = ex_t1.c1 for update;
ERROR 0A000: DML operation on External Table not supported
select ex_t1.* from t1, ex_t1 where t1.c1 = ex_t1.c1 for update;
ERROR 0A000: DML operation on External Table not supported
select * from t1, (select c1 from ex_t1 for update) a where t1.c1 = a.c1;
ERROR 0A000: DML operation on External Table not supported
select * from ex_t1, (select c1 from t1 for update) a where ex_t1.c1 = a.c1;
c1	c2	c3	c1
DROP
drop table ex_t1;
ERROR 42000: DROP command denied to user 'user_1'@'%' for table 'ex_t1'
grant drop on test.ex_t1 to user_1;
drop table ex_t1;
select * from ex_t1;
ERROR 42S02: Table 'test.ex_t1' doesn't exist
show tables;
Tables_in_test
t1
create external table ex_t1 (
c1 int,
c2 int,
c3 int
)
location='mysqltest_data_for_external_table/external_table_lineitem'
format (
type = 'csv'
);
create view v1 as (select * from ex_t1);
delete from v1;
ERROR 0A000: DML operation on External Table not supported
update v1 set c1 = 1 where c1 = 2;
ERROR HY000: The value specified for generated column 'c1' in table 'v1' is not allowed
insert into v1 values(1,1,1);
ERROR HY000: The value specified for generated column 'c1' in table 'v1' is not allowed
drop view v1;
drop table ex_t1;
drop table t1;
drop user user_1@'%';
