"keyword"
drop table `order`;
create table `order` (`add` int, `check` int);
insert into `order`(order.add, order.check) values (1,1);
select order.add, `order`.check from `order`;
add	check
1	1
update `order` set order.add = 2;
update `order` set order.check = 3;
select `order`.`add`, `order`.check from `order`;
add	check
2	3
select order.add, order.`check` from `order`;
ERROR 42000: You have an error in your SQL syntax; check the manual that corresponds to your OceanBase version for the right syntax to use near '`check` from `order`' at line 1
"select without from"
select 1 where 1 = 1;
1
1
select 1 where 1 = 2;
1
select 1 where not exists (select 1);
1
select 1 where exists (select 1);
1
1
