ob1=OBI(cluster=1,init_unit_cpu=5);
ob1.reboot;
ob1.create_client;
create resource unit oblog_box max_cpu 2, memory_size='20G';
create resource pool oblog_pool unit = 'oblog_box', unit_num = 1, zone_list = ('z1');
create tenant oblog_tt replica_num = 1, primary_zone='z1', resource_pool_list=('oblog_pool') set ob_tcp_invited_nodes='%';
ob1.oblog.gen_conf tb_white_list=sys.oblog*.*|oblog_tt.*.* skip_ob_version_compat_check=1;
ob1.oblog.restart;
create database oblog_db1;
ob1.oblog.next;
[R0] record_type:EDDL;[R0] db_name:oblog_tt;[R0] table_name:;[R0] column_count:1;[R0] column_name:ddl;[R0] ddl_stmt_str: create database oblog_db1;[R0] ddl_stmt_len: 25;
create database oblog_db2;
ob1.oblog.next;
[R0] record_type:EDDL;[R0] db_name:oblog_tt;[R0] table_name:;[R0] column_count:1;[R0] column_name:ddl;[R0] ddl_stmt_str: create database oblog_db2;[R0] ddl_stmt_len: 25;
use oblog_db1;
create table oblog_db1.t1 (pk int primary key);
ob1.oblog.next;
[R0] record_type:EDDL;[R0] db_name:oblog_tt.oblog_db1;[R0] table_name:;[R0] column_count:1;[R0] column_name:ddl;[R0] ddl_stmt_str: create table oblog_db1.t1 (pk int primary key);[R0] ddl_stmt_len: 46;
create table oblog_db1.t2 (pk int primary key);
ob1.oblog.next;
[R0] record_type:EDDL;[R0] db_name:oblog_tt.oblog_db1;[R0] table_name:;[R0] column_count:1;[R0] column_name:ddl;[R0] ddl_stmt_str: create table oblog_db1.t2 (pk int primary key);[R0] ddl_stmt_len: 46;
CREATE TABLE IF NOT EXISTS oblog_db1.t3 (c1 int primary key, c2 int, c3 int, c4 int, c5 int, KEY idx_1 (c1,c2,c3), KEY idx_2 (c2,c4), KEY idx_3 (c3,c2), UNIQUE KEY uk_test (c4,c2,c5),UNIQUE KEY uk_test1 (c2,c1));
ob1.oblog.next;
[R0] record_type:EDDL;[R0] db_name:oblog_tt.oblog_db1;[R0] table_name:;[R0] column_count:1;[R0] column_name:ddl;[R0] ddl_stmt_str: CREATE TABLE IF NOT EXISTS oblog_db1.t3 (c1 int primary key, c2 int, c3 int, c4 int, c5 int, KEY idx_1 (c1,c2,c3), KEY idx_2 (c2,c4), KEY idx_3 (c3,c2), UNIQUE KEY uk_test (c4,c2,c5),UNIQUE KEY uk_test1 (c2,c1));[R0] ddl_stmt_len: 211;
set @@recyclebin = on;
DROP INDEX idx_2 on t3;
ob1.oblog.next;
[R0] record_type:EDDL;[R0] db_name:oblog_tt.oblog_db1;[R0] table_name:;[R0] column_count:1;[R0] column_name:ddl;[R0] ddl_stmt_str: DROP INDEX idx_2 on t3;[R0] ddl_stmt_len: 22;
CREATE INDEX idx_2a on t3(c4,c2);
ob1.oblog.next;
[R0] record_type:EDDL;[R0] db_name:oblog_tt.oblog_db1;[R0] table_name:;[R0] column_count:1;[R0] column_name:ddl;[R0] ddl_stmt_str: CREATE INDEX idx_2a on t3(c4,c2);[R0] ddl_stmt_len: 32;
DROP INDEX uk_test on t3;
ob1.oblog.next;
[R0] record_type:EDDL;[R0] db_name:oblog_tt.oblog_db1;[R0] table_name:;[R0] column_count:1;[R0] column_name:ddl;[R0] ddl_stmt_str: DROP INDEX uk_test on t3;[R0] ddl_stmt_len: 24;
CREATE INDEX uk_testa on t3(c4,c2);
ob1.oblog.next;
[R0] record_type:EDDL;[R0] db_name:oblog_tt.oblog_db1;[R0] table_name:;[R0] column_count:1;[R0] column_name:ddl;[R0] ddl_stmt_str: CREATE INDEX uk_testa on t3(c4,c2);[R0] ddl_stmt_len: 34;
create table table_with_generate_column(c1 int, c2 int, c3 int as (c1 + c2));
ob1.oblog.next;
[R0] record_type:EDDL;[R0] db_name:oblog_tt.oblog_db1;[R0] table_name:;[R0] column_count:1;[R0] column_name:ddl;[R0] ddl_stmt_str: create table table_with_generate_column(c1 int, c2 int, c3 int as (c1 + c2));[R0] ddl_stmt_len: 76;
insert into table_with_generate_column (c1, c2) VALUES(1, 2);
ob1.oblog.next;
[R0] BEGIN;[R0] org_cluster_id:1;[R1] record_type:INSERT;[R1] database_name:oblog_tt.oblog_db1;[R1] table_name:table_with_generate_column;[R1] log_event:true;[R1] column_count:3;[R1] source_category:SRC_FULL_RECORDED;[R1] source_type:SRC_OCEANBASE_1_0;[R1] has_pk:true;[R1] pk_info:(0);[R1] pks:__pk_increment;[R1] has_uk:false;[R1] uk_info:(null);[R1] uks:(null);[R1] [C1] column_name:__pk_increment;[R1] [C1] column_type:MYSQL_TYPE_LONGLONG;[R1] [C1] column_is_rowkey:true;[R1] [C1] column_is_signed:false;[R1] [C1] column_encoding:binary;[R1] [C1] column_is_not_null:true;[R1] [C1] column_value_new:[1](1);[R1] [C2] column_name:c1;[R1] [C2] column_type:MYSQL_TYPE_LONG;[R1] [C2] column_is_rowkey:false;[R1] [C2] column_is_signed:true;[R1] [C2] column_encoding:binary;[R1] [C2] column_is_not_null:false;[R1] [C2] column_value_new:[1](1);[R1] [C3] column_name:c2;[R1] [C3] column_type:MYSQL_TYPE_LONG;[R1] [C3] column_is_rowkey:false;[R1] [C3] column_is_signed:true;[R1] [C3] column_encoding:binary;[R1] [C3] column_is_not_null:false;[R1] [C3] column_value_new:[2](1);$[R2] COMMIT;
insert into table_with_generate_column (c1, c2) VALUES(3, 4);
ob1.oblog.next;
[R0] BEGIN;[R0] org_cluster_id:1;[R1] record_type:INSERT;[R1] database_name:oblog_tt.oblog_db1;[R1] table_name:table_with_generate_column;[R1] log_event:true;[R1] column_count:3;[R1] source_category:SRC_FULL_RECORDED;[R1] source_type:SRC_OCEANBASE_1_0;[R1] has_pk:true;[R1] pk_info:(0);[R1] pks:__pk_increment;[R1] has_uk:false;[R1] uk_info:(null);[R1] uks:(null);[R1] [C1] column_name:__pk_increment;[R1] [C1] column_type:MYSQL_TYPE_LONGLONG;[R1] [C1] column_is_rowkey:true;[R1] [C1] column_is_signed:false;[R1] [C1] column_encoding:binary;[R1] [C1] column_is_not_null:true;[R1] [C1] column_value_new:[2](1);[R1] [C2] column_name:c1;[R1] [C2] column_type:MYSQL_TYPE_LONG;[R1] [C2] column_is_rowkey:false;[R1] [C2] column_is_signed:true;[R1] [C2] column_encoding:binary;[R1] [C2] column_is_not_null:false;[R1] [C2] column_value_new:[3](1);[R1] [C3] column_name:c2;[R1] [C3] column_type:MYSQL_TYPE_LONG;[R1] [C3] column_is_rowkey:false;[R1] [C3] column_is_signed:true;[R1] [C3] column_encoding:binary;[R1] [C3] column_is_not_null:false;[R1] [C3] column_value_new:[4](1);$[R2] COMMIT;
drop table table_with_generate_column;
ob1.oblog.next;
[R0] record_type:EDDL;[R0] db_name:oblog_tt.oblog_db1;[R0] table_name:;[R0] column_count:1;[R0] column_name:ddl;[R0] ddl_stmt_str: DROP TABLE `oblog_db1`.`table_with_generate_column`;[R0] ddl_stmt_len: 51;
drop table oblog_db1.t1;
ob1.oblog.next;
[R0] record_type:EDDL;[R0] db_name:oblog_tt.oblog_db1;[R0] table_name:;[R0] column_count:1;[R0] column_name:ddl;[R0] ddl_stmt_str: DROP TABLE `oblog_db1`.`t1`;[R0] ddl_stmt_len: 27;
select count(*) from oceanbase.__all_recyclebin where object_name = (select concat('__recycle_$_', 1, '_', schema_version) from oceanbase.__all_ddl_operation where ddl_stmt_str != '' order by schema_version desc limit 1) order by gmt_create desc limit 1;
count(*)
1
alter table oblog_db1.t2  ADD COLUMN c1 int;
ob1.oblog.next;
[R0] record_type:EDDL;[R0] db_name:oblog_tt.oblog_db1;[R0] table_name:;[R0] column_count:1;[R0] column_name:ddl;[R0] ddl_stmt_str: alter table oblog_db1.t2  ADD COLUMN c1 int;[R0] ddl_stmt_len: 43;
alter table oblog_db1.t2  ADD COLUMN c2 int;
ob1.oblog.next;
[R0] record_type:EDDL;[R0] db_name:oblog_tt.oblog_db1;[R0] table_name:;[R0] column_count:1;[R0] column_name:ddl;[R0] ddl_stmt_str: alter table oblog_db1.t2  ADD COLUMN c2 int;[R0] ddl_stmt_len: 43;
alter table oblog_db1.t2 drop COLUMN c2;
ob1.oblog.next;
[R0] record_type:EDDL;[R0] db_name:oblog_tt.oblog_db1;[R0] table_name:;[R0] column_count:1;[R0] column_name:ddl;[R0] ddl_stmt_str: alter table oblog_db1.t2 drop COLUMN c2;[R0] ddl_stmt_len: 39;
alter table oblog_db1.t2  RENAME to t200;
ob1.oblog.next;
[R0] record_type:EDDL;[R0] db_name:oblog_tt.oblog_db1;[R0] table_name:;[R0] column_count:1;[R0] column_name:ddl;[R0] ddl_stmt_str: alter table oblog_db1.t2  RENAME to t200;[R0] ddl_stmt_len: 40;
RENAME table oblog_db1.t200 to t300;
ob1.oblog.next;
[R0] record_type:EDDL;[R0] db_name:oblog_tt.oblog_db1;[R0] table_name:;[R0] column_count:1;[R0] column_name:ddl;[R0] ddl_stmt_str: RENAME TABLE `oblog_db1`.`t200` TO `oblog_db1`.`t300`;[R0] ddl_stmt_len: 53;
insert into oblog_db1.t300 VALUE(1, 1);
ob1.oblog.next;
[R0] BEGIN;[R0] org_cluster_id:1;[R1] record_type:INSERT;[R1] database_name:oblog_tt.oblog_db1;[R1] table_name:t300;[R1] log_event:true;[R1] column_count:2;[R1] source_category:SRC_FULL_RECORDED;[R1] source_type:SRC_OCEANBASE_1_0;[R1] has_pk:true;[R1] pk_info:(0);[R1] pks:pk;[R1] has_uk:false;[R1] uk_info:(null);[R1] uks:(null);[R1] [C1] column_name:pk;[R1] [C1] column_type:MYSQL_TYPE_LONG;[R1] [C1] column_is_rowkey:true;[R1] [C1] column_is_signed:true;[R1] [C1] column_encoding:binary;[R1] [C1] column_is_not_null:true;[R1] [C1] column_value_new:[1](1);[R1] [C2] column_name:c1;[R1] [C2] column_type:MYSQL_TYPE_LONG;[R1] [C2] column_is_rowkey:false;[R1] [C2] column_is_signed:true;[R1] [C2] column_encoding:binary;[R1] [C2] column_is_not_null:false;[R1] [C2] column_value_new:[1](1);$[R2] COMMIT;
insert into oblog_db1.t300 VALUE(2, 2);
ob1.oblog.next;
[R0] BEGIN;[R0] org_cluster_id:1;[R1] record_type:INSERT;[R1] database_name:oblog_tt.oblog_db1;[R1] table_name:t300;[R1] log_event:true;[R1] column_count:2;[R1] source_category:SRC_FULL_RECORDED;[R1] source_type:SRC_OCEANBASE_1_0;[R1] has_pk:true;[R1] pk_info:(0);[R1] pks:pk;[R1] has_uk:false;[R1] uk_info:(null);[R1] uks:(null);[R1] [C1] column_name:pk;[R1] [C1] column_type:MYSQL_TYPE_LONG;[R1] [C1] column_is_rowkey:true;[R1] [C1] column_is_signed:true;[R1] [C1] column_encoding:binary;[R1] [C1] column_is_not_null:true;[R1] [C1] column_value_new:[2](1);[R1] [C2] column_name:c1;[R1] [C2] column_type:MYSQL_TYPE_LONG;[R1] [C2] column_is_rowkey:false;[R1] [C2] column_is_signed:true;[R1] [C2] column_encoding:binary;[R1] [C2] column_is_not_null:false;[R1] [C2] column_value_new:[2](1);$[R2] COMMIT;
insert into oblog_db1.t300 VALUE(3, 3);
ob1.oblog.next;
[R0] BEGIN;[R0] org_cluster_id:1;[R1] record_type:INSERT;[R1] database_name:oblog_tt.oblog_db1;[R1] table_name:t300;[R1] log_event:true;[R1] column_count:2;[R1] source_category:SRC_FULL_RECORDED;[R1] source_type:SRC_OCEANBASE_1_0;[R1] has_pk:true;[R1] pk_info:(0);[R1] pks:pk;[R1] has_uk:false;[R1] uk_info:(null);[R1] uks:(null);[R1] [C1] column_name:pk;[R1] [C1] column_type:MYSQL_TYPE_LONG;[R1] [C1] column_is_rowkey:true;[R1] [C1] column_is_signed:true;[R1] [C1] column_encoding:binary;[R1] [C1] column_is_not_null:true;[R1] [C1] column_value_new:[3](1);[R1] [C2] column_name:c1;[R1] [C2] column_type:MYSQL_TYPE_LONG;[R1] [C2] column_is_rowkey:false;[R1] [C2] column_is_signed:true;[R1] [C2] column_encoding:binary;[R1] [C2] column_is_not_null:false;[R1] [C2] column_value_new:[3](1);$[R2] COMMIT;
truncate table oblog_db1.t300;
ob1.oblog.next;
[R0] record_type:EDDL;[R0] db_name:oblog_tt.oblog_db1;[R0] table_name:;[R0] column_count:1;[R0] column_name:ddl;[R0] ddl_stmt_str: truncate table oblog_db1.t300;[R0] ddl_stmt_len: 29;
RENAME table oblog_db1.t300 to oblog_db2.t300;
ob1.oblog.next;
[R0] record_type:EDDL;[R0] db_name:oblog_tt.oblog_db1;[R0] table_name:;[R0] column_count:1;[R0] column_name:ddl;[R0] ddl_stmt_str: RENAME TABLE `oblog_db1`.`t300` TO `oblog_db2`.`t300`;[R0] ddl_stmt_len: 53;
alter database oblog_db1 REPLICA_NUM=3;
ob1.oblog.next;
[R0] record_type:EDDL;[R0] db_name:oblog_tt.oblog_db1;[R0] table_name:;[R0] column_count:1;[R0] column_name:ddl;[R0] ddl_stmt_str: alter database oblog_db1 REPLICA_NUM=3;[R0] ddl_stmt_len: 38;
drop database oblog_db1;
ob1.oblog.next;
[R0] record_type:EDDL;[R0] db_name:oblog_tt.oblog_db1;[R0] table_name:;[R0] column_count:1;[R0] column_name:ddl;[R0] ddl_stmt_str: drop database oblog_db1;[R0] ddl_stmt_len: 23;
select count(*) from oceanbase.__all_recyclebin where object_name = (select concat('__recycle_$_', 1, '_', schema_version) from oceanbase.__all_ddl_operation where ddl_stmt_str != '' order by schema_version desc limit 1) order by gmt_create desc limit 1;
count(*)
1
alter tenant oblog_tt COMMENT='alter tenant';
ob1.oblog.next;
[R0] record_type:EDDL;[R0] db_name:sys;[R0] table_name:;[R0] column_count:1;[R0] column_name:ddl;[R0] ddl_stmt_str: alter tenant oblog_tt COMMENT='alter tenant';[R0] ddl_stmt_len: 44;
alter tenant oblog_tt primary_zone='z1';
ob1.oblog.next;
[R0] record_type:EDDL;[R0] db_name:sys;[R0] table_name:;[R0] column_count:1;[R0] column_name:ddl;[R0] ddl_stmt_str: alter tenant oblog_tt primary_zone='z1';[R0] ddl_stmt_len: 39;
set @@recyclebin = off;
drop tenant oblog_tt force;
ob1.oblog.next;
[R0] record_type:EDDL;[R0] db_name:sys;[R0] table_name:;[R0] column_count:1;[R0] column_name:ddl;[R0] ddl_stmt_str: drop tenant oblog_tt force;[R0] ddl_stmt_len: 26;
ob1.oblog.stop;
drop resource pool if exists oblog_pool;
drop resource unit if exists oblog_box;
drop database if exists oblog_db1;
drop database if exists oblog_db2;
create resource unit oblog_box max_cpu 2, memory_size='20G';
create resource pool oblog_pool unit = 'oblog_box', unit_num = 1, zone_list = ('z1');
create tenant oblog_tt replica_num = 1, primary_zone='z1', resource_pool_list=('oblog_pool') set ob_tcp_invited_nodes='%';
set @@recyclebin = on;
ob1.mysql alter system set dump_data_dictionary_to_log_interval = '6s' tenant sys;
ob1.mysql alter system set dump_data_dictionary_to_log_interval = '6s' tenant all_user;
ob1.mysql alter system set dump_data_dictionary_to_log_interval = '6s' tenant all_meta;
ob1.oblog.gen_conf tb_white_list=sys.oblog*.*|oblog_tt.*.* skip_ob_version_compat_check=1;
ob1.oblog.restart;
create user if not exists __oceanbase_inner_drc_user;
ob1.oblog.next;
[R0] record_type:EDDL;[R0] db_name:oblog_tt;[R0] table_name:;[R0] column_count:1;[R0] column_name:ddl;[R0] ddl_stmt_str: CREATE USER if not exists `__oceanbase_inner_drc_user`;[R0] ddl_stmt_len: 54;
grant all privileges on *.* to __oceanbase_inner_drc_user;
ob1.oblog.next;
[R0] record_type:EDDL;[R0] db_name:oblog_tt;[R0] table_name:;[R0] column_count:1;[R0] column_name:ddl;[R0] ddl_stmt_str: GRANT ALL PRIVILEGES ON *.* TO `__oceanbase_inner_drc_user`;[R0] ddl_stmt_len: 59;
purge recyclebin;
delete from oceanbase.__all_ddl_id;
drop database if exists drc_db;
set @@recyclebin = on;
set @__oceanbase_ddl_id = '1_1004_123456710';
create database drc_db;
ob1.oblog.next;
[R0] record_type:EDDL;[R0] db_name:oblog_tt;[R0] table_name:;[R0] column_count:1;[R0] column_name:ddl;[R0] ddl_stmt_str: create database drc_db;[R0] ddl_stmt_len: 22;
use drc_db;
set @__oceanbase_ddl_id = '1_1004_123456711';
create table t1(c1 int primary key, c2 int, c3 int, index(c2), index(c2, c3));
ob1.oblog.next;
[R0] record_type:EDDL;[R0] db_name:oblog_tt.drc_db;[R0] table_name:;[R0] column_count:1;[R0] column_name:ddl;[R0] ddl_stmt_str: create table t1(c1 int primary key, c2 int, c3 int, index(c2), index(c2, c3));[R0] ddl_stmt_len: 77;
set @__oceanbase_ddl_id = '1_1004_123456712';
drop table t1;
ob1.oblog.next;
[R0] record_type:EDDL;[R0] db_name:oblog_tt.drc_db;[R0] table_name:;[R0] column_count:1;[R0] column_name:ddl;[R0] ddl_stmt_str: DROP TABLE `drc_db`.`t1`;[R0] ddl_stmt_len: 24;
select object_name from oceanbase.__all_recyclebin where object_name = '__recycle_$_1_1004_123456712';
object_name
__recycle_$_1_1004_123456712
set @__oceanbase_ddl_id = '1_1004_123456713';
purge table __recycle_$_1_1004_123456712;
ob1.oblog.next;
[R0] record_type:EDDL;[R0] db_name:oblog_tt.__recyclebin;[R0] table_name:;[R0] column_count:1;[R0] column_name:ddl;[R0] ddl_stmt_str: purge table __recycle_$_1_1004_123456712;[R0] ddl_stmt_len: 40;
set @__oceanbase_ddl_id = '1_1004_123456714';
drop database drc_db;
select object_name from oceanbase.__all_recyclebin where object_name = '__recycle_$_1_1004_123456714';
object_name
__recycle_$_1_1004_123456714
set @__oceanbase_ddl_id = '1_1004_123456715';
purge database __recycle_$_1_1004_123456714;
ob1.oblog.stop;
ob1.oblog.gen_conf tb_white_list=sys.oblog*.*|oblog_tt.*.* meta_data_refresh_mode=data_dict enable_formatter_print_log=1;
ob1.oblog.set_start_tstamp_usec $restart_ts1_usec;
ob1.oblog.restart;
ob1.oblog.next;
[R0] record_type:EDDL;[R0] db_name:oblog_tt;[R0] table_name:;[R0] column_count:1;[R0] column_name:ddl;[R0] ddl_stmt_str: CREATE USER if not exists `__oceanbase_inner_drc_user`;[R0] ddl_stmt_len: 54;
ob1.oblog.next;
[R0] record_type:EDDL;[R0] db_name:oblog_tt;[R0] table_name:;[R0] column_count:1;[R0] column_name:ddl;[R0] ddl_stmt_str: GRANT ALL PRIVILEGES ON *.* TO `__oceanbase_inner_drc_user`;[R0] ddl_stmt_len: 59;
ob1.oblog.next;
[R0] record_type:EDDL;[R0] db_name:oblog_tt;[R0] table_name:;[R0] column_count:1;[R0] column_name:ddl;[R0] ddl_stmt_str: create database drc_db;[R0] ddl_stmt_len: 22;
ob1.oblog.next;
[R0] record_type:EDDL;[R0] db_name:oblog_tt.drc_db;[R0] table_name:;[R0] column_count:1;[R0] column_name:ddl;[R0] ddl_stmt_str: create table t1(c1 int primary key, c2 int, c3 int, index(c2), index(c2, c3));[R0] ddl_stmt_len: 77;
ob1.oblog.next;
[R0] record_type:EDDL;[R0] db_name:oblog_tt.drc_db;[R0] table_name:;[R0] column_count:1;[R0] column_name:ddl;[R0] ddl_stmt_str: DROP TABLE `drc_db`.`t1`;[R0] ddl_stmt_len: 24;
ob1.oblog.next;
[R0] record_type:EDDL;[R0] db_name:oblog_tt.__recyclebin;[R0] table_name:;[R0] column_count:1;[R0] column_name:ddl;[R0] ddl_stmt_str: purge table __recycle_$_1_1004_123456712;[R0] ddl_stmt_len: 40;
ob1.oblog.stop;
ob1.oblog.gen_conf tb_white_list=sys.oblog*.*|oblog_tt.*.* meta_data_refresh_mode=data_dict enable_formatter_print_log=1;
ob1.oblog.restart;
ob1.oblog.stop;
