ob1=OBI(cluster=1,init_unit_cpu=2);
ob1.reboot;
ob1.create_client;
create resource unit oblog_box max_cpu 2, memory_size='20G';
create resource pool oblog_pool unit = 'oblog_box', unit_num = 1, zone_list = ('z1');
create tenant oblog_tt replica_num = 1, primary_zone='z1', resource_pool_list=('oblog_pool') set ob_tcp_invited_nodes='%';
ob1.oblog.gen_conf tb_white_list=oblog_tt.oblog_db1.* log_level=DEBUG;
ob1.oblog.set_extra_argument -i;
ob1.oblog.restart;
create database oblog_db1;
ob1.oblog.next;
[R0] record_type:EDDL;[R0] db_name:oblog_tt;[R0] table_name:;[R0] column_count:1;[R0] column_name:ddl;[R0] ddl_stmt_str: create database oblog_db1;[R0] ddl_stmt_len: 25;
use oblog_db1;
create table simple_decimal_int(c0 decimal(10, 2), c1 decimal(18, 2), c2 decimal(38, 30));
ob1.oblog.next;
[R0] record_type:EDDL;[R0] db_name:oblog_tt.oblog_db1;[R0] table_name:;[R0] column_count:1;[R0] column_name:ddl;[R0] ddl_stmt_str: create table simple_decimal_int(c0 decimal(10, 2), c1 decimal(18, 2), c2 decimal(38, 30));[R0] ddl_stmt_len: 89;
insert into simple_decimal_int values(1.23, 23.45, 56.70001);
ob1.oblog.next;
[R0] BEGIN;[R0] org_cluster_id:1;[R1] record_type:INSERT;[R1] database_name:oblog_tt.oblog_db1;[R1] table_name:simple_decimal_int;[R1] log_event:true;[R1] column_count:4;[R1] source_category:SRC_FULL_RECORDED;[R1] source_type:SRC_OCEANBASE_1_0;[R1] has_pk:true;[R1] pk_info:(0);[R1] pks:__pk_increment;[R1] has_uk:false;[R1] uk_info:(null);[R1] uks:(null);[R1] [C1] column_name:__pk_increment;[R1] [C1] column_type:MYSQL_TYPE_LONGLONG;[R1] [C1] column_is_rowkey:true;[R1] [C1] column_is_signed:false;[R1] [C1] column_encoding:binary;[R1] [C1] column_is_not_null:true;[R1] [C1] column_value_new:[1](1);[R1] [C2] column_name:c0;[R1] [C2] column_type:MYSQL_TYPE_NEWDECIMAL;[R1] [C2] column_is_rowkey:false;[R1] [C2] column_is_signed:true;[R1] [C2] column_encoding:binary;[R1] [C2] column_is_not_null:false;[R1] [C2] column_precision:10;[R1] [C2] column_scale:2;[R1] [C2] column_value_new:[1.23](4);[R1] [C3] column_name:c1;[R1] [C3] column_type:MYSQL_TYPE_NEWDECIMAL;[R1] [C3] column_is_rowkey:false;[R1] [C3] column_is_signed:true;[R1] [C3] column_encoding:binary;[R1] [C3] column_is_not_null:false;[R1] [C3] column_precision:18;[R1] [C3] column_scale:2;[R1] [C3] column_value_new:[23.45](5);[R1] [C4] column_name:c2;[R1] [C4] column_type:MYSQL_TYPE_NEWDECIMAL;[R1] [C4] column_is_rowkey:false;[R1] [C4] column_is_signed:true;[R1] [C4] column_encoding:binary;[R1] [C4] column_is_not_null:false;[R1] [C4] column_precision:38;[R1] [C4] column_scale:30;[R1] [C4] column_value_new:[56.700010000000000000000000000000](33);$[R2] COMMIT;
insert into simple_decimal_int values(8.90, 10.21, 32321321.321321321321);
ob1.oblog.next;
[R0] BEGIN;[R0] org_cluster_id:1;[R1] record_type:INSERT;[R1] database_name:oblog_tt.oblog_db1;[R1] table_name:simple_decimal_int;[R1] log_event:true;[R1] column_count:4;[R1] source_category:SRC_FULL_RECORDED;[R1] source_type:SRC_OCEANBASE_1_0;[R1] has_pk:true;[R1] pk_info:(0);[R1] pks:__pk_increment;[R1] has_uk:false;[R1] uk_info:(null);[R1] uks:(null);[R1] [C1] column_name:__pk_increment;[R1] [C1] column_type:MYSQL_TYPE_LONGLONG;[R1] [C1] column_is_rowkey:true;[R1] [C1] column_is_signed:false;[R1] [C1] column_encoding:binary;[R1] [C1] column_is_not_null:true;[R1] [C1] column_value_new:[2](1);[R1] [C2] column_name:c0;[R1] [C2] column_type:MYSQL_TYPE_NEWDECIMAL;[R1] [C2] column_is_rowkey:false;[R1] [C2] column_is_signed:true;[R1] [C2] column_encoding:binary;[R1] [C2] column_is_not_null:false;[R1] [C2] column_precision:10;[R1] [C2] column_scale:2;[R1] [C2] column_value_new:[8.90](4);[R1] [C3] column_name:c1;[R1] [C3] column_type:MYSQL_TYPE_NEWDECIMAL;[R1] [C3] column_is_rowkey:false;[R1] [C3] column_is_signed:true;[R1] [C3] column_encoding:binary;[R1] [C3] column_is_not_null:false;[R1] [C3] column_precision:18;[R1] [C3] column_scale:2;[R1] [C3] column_value_new:[10.21](5);[R1] [C4] column_name:c2;[R1] [C4] column_type:MYSQL_TYPE_NEWDECIMAL;[R1] [C4] column_is_rowkey:false;[R1] [C4] column_is_signed:true;[R1] [C4] column_encoding:binary;[R1] [C4] column_is_not_null:false;[R1] [C4] column_precision:38;[R1] [C4] column_scale:30;[R1] [C4] column_value_new:[32321321.321321321321000000000000000000](39);$[R2] COMMIT;
insert into simple_decimal_int values(0, 0, 0);
ob1.oblog.next;
[R0] BEGIN;[R0] org_cluster_id:1;[R1] record_type:INSERT;[R1] database_name:oblog_tt.oblog_db1;[R1] table_name:simple_decimal_int;[R1] log_event:true;[R1] column_count:4;[R1] source_category:SRC_FULL_RECORDED;[R1] source_type:SRC_OCEANBASE_1_0;[R1] has_pk:true;[R1] pk_info:(0);[R1] pks:__pk_increment;[R1] has_uk:false;[R1] uk_info:(null);[R1] uks:(null);[R1] [C1] column_name:__pk_increment;[R1] [C1] column_type:MYSQL_TYPE_LONGLONG;[R1] [C1] column_is_rowkey:true;[R1] [C1] column_is_signed:false;[R1] [C1] column_encoding:binary;[R1] [C1] column_is_not_null:true;[R1] [C1] column_value_new:[3](1);[R1] [C2] column_name:c0;[R1] [C2] column_type:MYSQL_TYPE_NEWDECIMAL;[R1] [C2] column_is_rowkey:false;[R1] [C2] column_is_signed:true;[R1] [C2] column_encoding:binary;[R1] [C2] column_is_not_null:false;[R1] [C2] column_precision:10;[R1] [C2] column_scale:2;[R1] [C2] column_value_new:[0.00](4);[R1] [C3] column_name:c1;[R1] [C3] column_type:MYSQL_TYPE_NEWDECIMAL;[R1] [C3] column_is_rowkey:false;[R1] [C3] column_is_signed:true;[R1] [C3] column_encoding:binary;[R1] [C3] column_is_not_null:false;[R1] [C3] column_precision:18;[R1] [C3] column_scale:2;[R1] [C3] column_value_new:[0.00](4);[R1] [C4] column_name:c2;[R1] [C4] column_type:MYSQL_TYPE_NEWDECIMAL;[R1] [C4] column_is_rowkey:false;[R1] [C4] column_is_signed:true;[R1] [C4] column_encoding:binary;[R1] [C4] column_is_not_null:false;[R1] [C4] column_precision:38;[R1] [C4] column_scale:30;[R1] [C4] column_value_new:[0.000000000000000000000000000000](32);$[R2] COMMIT;
insert into simple_decimal_int values(null, null, null);
ob1.oblog.next;
[R0] BEGIN;[R0] org_cluster_id:1;[R1] record_type:INSERT;[R1] database_name:oblog_tt.oblog_db1;[R1] table_name:simple_decimal_int;[R1] log_event:true;[R1] column_count:4;[R1] source_category:SRC_FULL_RECORDED;[R1] source_type:SRC_OCEANBASE_1_0;[R1] has_pk:true;[R1] pk_info:(0);[R1] pks:__pk_increment;[R1] has_uk:false;[R1] uk_info:(null);[R1] uks:(null);[R1] [C1] column_name:__pk_increment;[R1] [C1] column_type:MYSQL_TYPE_LONGLONG;[R1] [C1] column_is_rowkey:true;[R1] [C1] column_is_signed:false;[R1] [C1] column_encoding:binary;[R1] [C1] column_is_not_null:true;[R1] [C1] column_value_new:[4](1);[R1] [C2] column_name:c0;[R1] [C2] column_type:MYSQL_TYPE_NEWDECIMAL;[R1] [C2] column_is_rowkey:false;[R1] [C2] column_is_signed:true;[R1] [C2] column_encoding:binary;[R1] [C2] column_is_not_null:false;[R1] [C2] column_precision:10;[R1] [C2] column_scale:2;[R1] [C2] column_value_new:[NULL](0);[R1] [C3] column_name:c1;[R1] [C3] column_type:MYSQL_TYPE_NEWDECIMAL;[R1] [C3] column_is_rowkey:false;[R1] [C3] column_is_signed:true;[R1] [C3] column_encoding:binary;[R1] [C3] column_is_not_null:false;[R1] [C3] column_precision:18;[R1] [C3] column_scale:2;[R1] [C3] column_value_new:[NULL](0);[R1] [C4] column_name:c2;[R1] [C4] column_type:MYSQL_TYPE_NEWDECIMAL;[R1] [C4] column_is_rowkey:false;[R1] [C4] column_is_signed:true;[R1] [C4] column_encoding:binary;[R1] [C4] column_is_not_null:false;[R1] [C4] column_precision:38;[R1] [C4] column_scale:30;[R1] [C4] column_value_new:[NULL](0);$[R2] COMMIT;
insert into simple_decimal_int values(99999999.99, 9999999999999999.99, 99999999.999999999999999999999999999999);
ob1.oblog.next;
[R0] BEGIN;[R0] org_cluster_id:1;[R1] record_type:INSERT;[R1] database_name:oblog_tt.oblog_db1;[R1] table_name:simple_decimal_int;[R1] log_event:true;[R1] column_count:4;[R1] source_category:SRC_FULL_RECORDED;[R1] source_type:SRC_OCEANBASE_1_0;[R1] has_pk:true;[R1] pk_info:(0);[R1] pks:__pk_increment;[R1] has_uk:false;[R1] uk_info:(null);[R1] uks:(null);[R1] [C1] column_name:__pk_increment;[R1] [C1] column_type:MYSQL_TYPE_LONGLONG;[R1] [C1] column_is_rowkey:true;[R1] [C1] column_is_signed:false;[R1] [C1] column_encoding:binary;[R1] [C1] column_is_not_null:true;[R1] [C1] column_value_new:[5](1);[R1] [C2] column_name:c0;[R1] [C2] column_type:MYSQL_TYPE_NEWDECIMAL;[R1] [C2] column_is_rowkey:false;[R1] [C2] column_is_signed:true;[R1] [C2] column_encoding:binary;[R1] [C2] column_is_not_null:false;[R1] [C2] column_precision:10;[R1] [C2] column_scale:2;[R1] [C2] column_value_new:[99999999.99](11);[R1] [C3] column_name:c1;[R1] [C3] column_type:MYSQL_TYPE_NEWDECIMAL;[R1] [C3] column_is_rowkey:false;[R1] [C3] column_is_signed:true;[R1] [C3] column_encoding:binary;[R1] [C3] column_is_not_null:false;[R1] [C3] column_precision:18;[R1] [C3] column_scale:2;[R1] [C3] column_value_new:[9999999999999999.99](19);[R1] [C4] column_name:c2;[R1] [C4] column_type:MYSQL_TYPE_NEWDECIMAL;[R1] [C4] column_is_rowkey:false;[R1] [C4] column_is_signed:true;[R1] [C4] column_encoding:binary;[R1] [C4] column_is_not_null:false;[R1] [C4] column_precision:38;[R1] [C4] column_scale:30;[R1] [C4] column_value_new:[99999999.999999999999999999999999999999](39);$[R2] COMMIT;
select * from simple_decimal_int;
c0	c1	c2
1.23	23.45	56.700010000000000000000000000000
8.90	10.21	32321321.321321321321000000000000000000
0.00	0.00	0.000000000000000000000000000000
NULL	NULL	NULL
99999999.99	9999999999999999.99	99999999.999999999999999999999999999999
update simple_decimal_int set c0 = 1.2;
ob1.oblog.next;
[R0] BEGIN;[R0] org_cluster_id:1;[R1] record_type:UPDATE;[R1] database_name:oblog_tt.oblog_db1;[R1] table_name:simple_decimal_int;[R1] log_event:true;[R1] column_count:4;[R1] source_category:SRC_FULL_RECORDED;[R1] source_type:SRC_OCEANBASE_1_0;[R1] has_pk:true;[R1] pk_info:(0);[R1] pks:__pk_increment;[R1] has_uk:false;[R1] uk_info:(null);[R1] uks:(null);[R1] [C1] column_name:__pk_increment;[R1] [C1] column_type:MYSQL_TYPE_LONGLONG;[R1] [C1] column_is_rowkey:true;[R1] [C1] column_is_signed:false;[R1] [C1] column_encoding:binary;[R1] [C1] column_is_not_null:true;[R1] [C1] column_value_new:[1](1);[R1] [C1] column_value_old:[1](1);[R1] [C2] column_name:c0;[R1] [C2] column_type:MYSQL_TYPE_NEWDECIMAL;[R1] [C2] column_is_rowkey:false;[R1] [C2] column_is_signed:true;[R1] [C2] column_encoding:binary;[R1] [C2] column_is_not_null:false;[R1] [C2] column_precision:10;[R1] [C2] column_scale:2;[R1] [C2] column_value_new:[1.20](4);[R1] [C2] column_value_old:[1.23](4);[R1] [C3] column_name:c1;[R1] [C3] column_type:MYSQL_TYPE_NEWDECIMAL;[R1] [C3] column_is_rowkey:false;[R1] [C3] column_is_signed:true;[R1] [C3] column_encoding:binary;[R1] [C3] column_is_not_null:false;[R1] [C3] column_precision:18;[R1] [C3] column_scale:2;[R1] [C3] column_value_new:[23.45](5);[R1] [C3] column_value_old:[23.45](5);[R1] [C4] column_name:c2;[R1] [C4] column_type:MYSQL_TYPE_NEWDECIMAL;[R1] [C4] column_is_rowkey:false;[R1] [C4] column_is_signed:true;[R1] [C4] column_encoding:binary;[R1] [C4] column_is_not_null:false;[R1] [C4] column_precision:38;[R1] [C4] column_scale:30;[R1] [C4] column_value_new:[56.700010000000000000000000000000](33);[R1] [C4] column_value_old:[56.700010000000000000000000000000](33);$[R2] record_type:UPDATE;[R2] database_name:oblog_tt.oblog_db1;[R2] table_name:simple_decimal_int;[R2] log_event:true;[R2] column_count:4;[R2] source_category:SRC_FULL_RECORDED;[R2] source_type:SRC_OCEANBASE_1_0;[R2] has_pk:true;[R2] pk_info:(0);[R2] pks:__pk_increment;[R2] has_uk:false;[R2] uk_info:(null);[R2] uks:(null);[R2] [C1] column_name:__pk_increment;[R2] [C1] column_type:MYSQL_TYPE_LONGLONG;[R2] [C1] column_is_rowkey:true;[R2] [C1] column_is_signed:false;[R2] [C1] column_encoding:binary;[R2] [C1] column_is_not_null:true;[R2] [C1] column_value_new:[2](1);[R2] [C1] column_value_old:[2](1);[R2] [C2] column_name:c0;[R2] [C2] column_type:MYSQL_TYPE_NEWDECIMAL;[R2] [C2] column_is_rowkey:false;[R2] [C2] column_is_signed:true;[R2] [C2] column_encoding:binary;[R2] [C2] column_is_not_null:false;[R2] [C2] column_precision:10;[R2] [C2] column_scale:2;[R2] [C2] column_value_new:[1.20](4);[R2] [C2] column_value_old:[8.90](4);[R2] [C3] column_name:c1;[R2] [C3] column_type:MYSQL_TYPE_NEWDECIMAL;[R2] [C3] column_is_rowkey:false;[R2] [C3] column_is_signed:true;[R2] [C3] column_encoding:binary;[R2] [C3] column_is_not_null:false;[R2] [C3] column_precision:18;[R2] [C3] column_scale:2;[R2] [C3] column_value_new:[10.21](5);[R2] [C3] column_value_old:[10.21](5);[R2] [C4] column_name:c2;[R2] [C4] column_type:MYSQL_TYPE_NEWDECIMAL;[R2] [C4] column_is_rowkey:false;[R2] [C4] column_is_signed:true;[R2] [C4] column_encoding:binary;[R2] [C4] column_is_not_null:false;[R2] [C4] column_precision:38;[R2] [C4] column_scale:30;[R2] [C4] column_value_new:[32321321.321321321321000000000000000000](39);[R2] [C4] column_value_old:[32321321.321321321321000000000000000000](39);$[R3] record_type:UPDATE;[R3] database_name:oblog_tt.oblog_db1;[R3] table_name:simple_decimal_int;[R3] log_event:true;[R3] column_count:4;[R3] source_category:SRC_FULL_RECORDED;[R3] source_type:SRC_OCEANBASE_1_0;[R3] has_pk:true;[R3] pk_info:(0);[R3] pks:__pk_increment;[R3] has_uk:false;[R3] uk_info:(null);[R3] uks:(null);[R3] [C1] column_name:__pk_increment;[R3] [C1] column_type:MYSQL_TYPE_LONGLONG;[R3] [C1] column_is_rowkey:true;[R3] [C1] column_is_signed:false;[R3] [C1] column_encoding:binary;[R3] [C1] column_is_not_null:true;[R3] [C1] column_value_new:[3](1);[R3] [C1] column_value_old:[3](1);[R3] [C2] column_name:c0;[R3] [C2] column_type:MYSQL_TYPE_NEWDECIMAL;[R3] [C2] column_is_rowkey:false;[R3] [C2] column_is_signed:true;[R3] [C2] column_encoding:binary;[R3] [C2] column_is_not_null:false;[R3] [C2] column_precision:10;[R3] [C2] column_scale:2;[R3] [C2] column_value_new:[1.20](4);[R3] [C2] column_value_old:[0.00](4);[R3] [C3] column_name:c1;[R3] [C3] column_type:MYSQL_TYPE_NEWDECIMAL;[R3] [C3] column_is_rowkey:false;[R3] [C3] column_is_signed:true;[R3] [C3] column_encoding:binary;[R3] [C3] column_is_not_null:false;[R3] [C3] column_precision:18;[R3] [C3] column_scale:2;[R3] [C3] column_value_new:[0.00](4);[R3] [C3] column_value_old:[0.00](4);[R3] [C4] column_name:c2;[R3] [C4] column_type:MYSQL_TYPE_NEWDECIMAL;[R3] [C4] column_is_rowkey:false;[R3] [C4] column_is_signed:true;[R3] [C4] column_encoding:binary;[R3] [C4] column_is_not_null:false;[R3] [C4] column_precision:38;[R3] [C4] column_scale:30;[R3] [C4] column_value_new:[0.000000000000000000000000000000](32);[R3] [C4] column_value_old:[0.000000000000000000000000000000](32);$[R4] record_type:UPDATE;[R4] database_name:oblog_tt.oblog_db1;[R4] table_name:simple_decimal_int;[R4] log_event:true;[R4] column_count:4;[R4] source_category:SRC_FULL_RECORDED;[R4] source_type:SRC_OCEANBASE_1_0;[R4] has_pk:true;[R4] pk_info:(0);[R4] pks:__pk_increment;[R4] has_uk:false;[R4] uk_info:(null);[R4] uks:(null);[R4] [C1] column_name:__pk_increment;[R4] [C1] column_type:MYSQL_TYPE_LONGLONG;[R4] [C1] column_is_rowkey:true;[R4] [C1] column_is_signed:false;[R4] [C1] column_encoding:binary;[R4] [C1] column_is_not_null:true;[R4] [C1] column_value_new:[4](1);[R4] [C1] column_value_old:[4](1);[R4] [C2] column_name:c0;[R4] [C2] column_type:MYSQL_TYPE_NEWDECIMAL;[R4] [C2] column_is_rowkey:false;[R4] [C2] column_is_signed:true;[R4] [C2] column_encoding:binary;[R4] [C2] column_is_not_null:false;[R4] [C2] column_precision:10;[R4] [C2] column_scale:2;[R4] [C2] column_value_new:[1.20](4);[R4] [C2] column_value_old:[NULL](0);[R4] [C3] column_name:c1;[R4] [C3] column_type:MYSQL_TYPE_NEWDECIMAL;[R4] [C3] column_is_rowkey:false;[R4] [C3] column_is_signed:true;[R4] [C3] column_encoding:binary;[R4] [C3] column_is_not_null:false;[R4] [C3] column_precision:18;[R4] [C3] column_scale:2;[R4] [C3] column_value_new:[NULL](0);[R4] [C3] column_value_old:[NULL](0);[R4] [C4] column_name:c2;[R4] [C4] column_type:MYSQL_TYPE_NEWDECIMAL;[R4] [C4] column_is_rowkey:false;[R4] [C4] column_is_signed:true;[R4] [C4] column_encoding:binary;[R4] [C4] column_is_not_null:false;[R4] [C4] column_precision:38;[R4] [C4] column_scale:30;[R4] [C4] column_value_new:[NULL](0);[R4] [C4] column_value_old:[NULL](0);$[R5] record_type:UPDATE;[R5] database_name:oblog_tt.oblog_db1;[R5] table_name:simple_decimal_int;[R5] log_event:true;[R5] column_count:4;[R5] source_category:SRC_FULL_RECORDED;[R5] source_type:SRC_OCEANBASE_1_0;[R5] has_pk:true;[R5] pk_info:(0);[R5] pks:__pk_increment;[R5] has_uk:false;[R5] uk_info:(null);[R5] uks:(null);[R5] [C1] column_name:__pk_increment;[R5] [C1] column_type:MYSQL_TYPE_LONGLONG;[R5] [C1] column_is_rowkey:true;[R5] [C1] column_is_signed:false;[R5] [C1] column_encoding:binary;[R5] [C1] column_is_not_null:true;[R5] [C1] column_value_new:[5](1);[R5] [C1] column_value_old:[5](1);[R5] [C2] column_name:c0;[R5] [C2] column_type:MYSQL_TYPE_NEWDECIMAL;[R5] [C2] column_is_rowkey:false;[R5] [C2] column_is_signed:true;[R5] [C2] column_encoding:binary;[R5] [C2] column_is_not_null:false;[R5] [C2] column_precision:10;[R5] [C2] column_scale:2;[R5] [C2] column_value_new:[1.20](4);[R5] [C2] column_value_old:[99999999.99](11);[R5] [C3] column_name:c1;[R5] [C3] column_type:MYSQL_TYPE_NEWDECIMAL;[R5] [C3] column_is_rowkey:false;[R5] [C3] column_is_signed:true;[R5] [C3] column_encoding:binary;[R5] [C3] column_is_not_null:false;[R5] [C3] column_precision:18;[R5] [C3] column_scale:2;[R5] [C3] column_value_new:[9999999999999999.99](19);[R5] [C3] column_value_old:[9999999999999999.99](19);[R5] [C4] column_name:c2;[R5] [C4] column_type:MYSQL_TYPE_NEWDECIMAL;[R5] [C4] column_is_rowkey:false;[R5] [C4] column_is_signed:true;[R5] [C4] column_encoding:binary;[R5] [C4] column_is_not_null:false;[R5] [C4] column_precision:38;[R5] [C4] column_scale:30;[R5] [C4] column_value_new:[99999999.999999999999999999999999999999](39);[R5] [C4] column_value_old:[99999999.999999999999999999999999999999](39);$[R6] COMMIT;
select * from simple_decimal_int;
c0	c1	c2
1.20	23.45	56.700010000000000000000000000000
1.20	10.21	32321321.321321321321000000000000000000
1.20	0.00	0.000000000000000000000000000000
1.20	NULL	NULL
1.20	9999999999999999.99	99999999.999999999999999999999999999999
update simple_decimal_int set c1 = 99999999.99;
ob1.oblog.next;
[R0] BEGIN;[R0] org_cluster_id:1;[R1] record_type:UPDATE;[R1] database_name:oblog_tt.oblog_db1;[R1] table_name:simple_decimal_int;[R1] log_event:true;[R1] column_count:4;[R1] source_category:SRC_FULL_RECORDED;[R1] source_type:SRC_OCEANBASE_1_0;[R1] has_pk:true;[R1] pk_info:(0);[R1] pks:__pk_increment;[R1] has_uk:false;[R1] uk_info:(null);[R1] uks:(null);[R1] [C1] column_name:__pk_increment;[R1] [C1] column_type:MYSQL_TYPE_LONGLONG;[R1] [C1] column_is_rowkey:true;[R1] [C1] column_is_signed:false;[R1] [C1] column_encoding:binary;[R1] [C1] column_is_not_null:true;[R1] [C1] column_value_new:[1](1);[R1] [C1] column_value_old:[1](1);[R1] [C2] column_name:c0;[R1] [C2] column_type:MYSQL_TYPE_NEWDECIMAL;[R1] [C2] column_is_rowkey:false;[R1] [C2] column_is_signed:true;[R1] [C2] column_encoding:binary;[R1] [C2] column_is_not_null:false;[R1] [C2] column_precision:10;[R1] [C2] column_scale:2;[R1] [C2] column_value_new:[1.20](4);[R1] [C2] column_value_old:[1.20](4);[R1] [C3] column_name:c1;[R1] [C3] column_type:MYSQL_TYPE_NEWDECIMAL;[R1] [C3] column_is_rowkey:false;[R1] [C3] column_is_signed:true;[R1] [C3] column_encoding:binary;[R1] [C3] column_is_not_null:false;[R1] [C3] column_precision:18;[R1] [C3] column_scale:2;[R1] [C3] column_value_new:[99999999.99](11);[R1] [C3] column_value_old:[23.45](5);[R1] [C4] column_name:c2;[R1] [C4] column_type:MYSQL_TYPE_NEWDECIMAL;[R1] [C4] column_is_rowkey:false;[R1] [C4] column_is_signed:true;[R1] [C4] column_encoding:binary;[R1] [C4] column_is_not_null:false;[R1] [C4] column_precision:38;[R1] [C4] column_scale:30;[R1] [C4] column_value_new:[56.700010000000000000000000000000](33);[R1] [C4] column_value_old:[56.700010000000000000000000000000](33);$[R2] record_type:UPDATE;[R2] database_name:oblog_tt.oblog_db1;[R2] table_name:simple_decimal_int;[R2] log_event:true;[R2] column_count:4;[R2] source_category:SRC_FULL_RECORDED;[R2] source_type:SRC_OCEANBASE_1_0;[R2] has_pk:true;[R2] pk_info:(0);[R2] pks:__pk_increment;[R2] has_uk:false;[R2] uk_info:(null);[R2] uks:(null);[R2] [C1] column_name:__pk_increment;[R2] [C1] column_type:MYSQL_TYPE_LONGLONG;[R2] [C1] column_is_rowkey:true;[R2] [C1] column_is_signed:false;[R2] [C1] column_encoding:binary;[R2] [C1] column_is_not_null:true;[R2] [C1] column_value_new:[2](1);[R2] [C1] column_value_old:[2](1);[R2] [C2] column_name:c0;[R2] [C2] column_type:MYSQL_TYPE_NEWDECIMAL;[R2] [C2] column_is_rowkey:false;[R2] [C2] column_is_signed:true;[R2] [C2] column_encoding:binary;[R2] [C2] column_is_not_null:false;[R2] [C2] column_precision:10;[R2] [C2] column_scale:2;[R2] [C2] column_value_new:[1.20](4);[R2] [C2] column_value_old:[1.20](4);[R2] [C3] column_name:c1;[R2] [C3] column_type:MYSQL_TYPE_NEWDECIMAL;[R2] [C3] column_is_rowkey:false;[R2] [C3] column_is_signed:true;[R2] [C3] column_encoding:binary;[R2] [C3] column_is_not_null:false;[R2] [C3] column_precision:18;[R2] [C3] column_scale:2;[R2] [C3] column_value_new:[99999999.99](11);[R2] [C3] column_value_old:[10.21](5);[R2] [C4] column_name:c2;[R2] [C4] column_type:MYSQL_TYPE_NEWDECIMAL;[R2] [C4] column_is_rowkey:false;[R2] [C4] column_is_signed:true;[R2] [C4] column_encoding:binary;[R2] [C4] column_is_not_null:false;[R2] [C4] column_precision:38;[R2] [C4] column_scale:30;[R2] [C4] column_value_new:[32321321.321321321321000000000000000000](39);[R2] [C4] column_value_old:[32321321.321321321321000000000000000000](39);$[R3] record_type:UPDATE;[R3] database_name:oblog_tt.oblog_db1;[R3] table_name:simple_decimal_int;[R3] log_event:true;[R3] column_count:4;[R3] source_category:SRC_FULL_RECORDED;[R3] source_type:SRC_OCEANBASE_1_0;[R3] has_pk:true;[R3] pk_info:(0);[R3] pks:__pk_increment;[R3] has_uk:false;[R3] uk_info:(null);[R3] uks:(null);[R3] [C1] column_name:__pk_increment;[R3] [C1] column_type:MYSQL_TYPE_LONGLONG;[R3] [C1] column_is_rowkey:true;[R3] [C1] column_is_signed:false;[R3] [C1] column_encoding:binary;[R3] [C1] column_is_not_null:true;[R3] [C1] column_value_new:[3](1);[R3] [C1] column_value_old:[3](1);[R3] [C2] column_name:c0;[R3] [C2] column_type:MYSQL_TYPE_NEWDECIMAL;[R3] [C2] column_is_rowkey:false;[R3] [C2] column_is_signed:true;[R3] [C2] column_encoding:binary;[R3] [C2] column_is_not_null:false;[R3] [C2] column_precision:10;[R3] [C2] column_scale:2;[R3] [C2] column_value_new:[1.20](4);[R3] [C2] column_value_old:[1.20](4);[R3] [C3] column_name:c1;[R3] [C3] column_type:MYSQL_TYPE_NEWDECIMAL;[R3] [C3] column_is_rowkey:false;[R3] [C3] column_is_signed:true;[R3] [C3] column_encoding:binary;[R3] [C3] column_is_not_null:false;[R3] [C3] column_precision:18;[R3] [C3] column_scale:2;[R3] [C3] column_value_new:[99999999.99](11);[R3] [C3] column_value_old:[0.00](4);[R3] [C4] column_name:c2;[R3] [C4] column_type:MYSQL_TYPE_NEWDECIMAL;[R3] [C4] column_is_rowkey:false;[R3] [C4] column_is_signed:true;[R3] [C4] column_encoding:binary;[R3] [C4] column_is_not_null:false;[R3] [C4] column_precision:38;[R3] [C4] column_scale:30;[R3] [C4] column_value_new:[0.000000000000000000000000000000](32);[R3] [C4] column_value_old:[0.000000000000000000000000000000](32);$[R4] record_type:UPDATE;[R4] database_name:oblog_tt.oblog_db1;[R4] table_name:simple_decimal_int;[R4] log_event:true;[R4] column_count:4;[R4] source_category:SRC_FULL_RECORDED;[R4] source_type:SRC_OCEANBASE_1_0;[R4] has_pk:true;[R4] pk_info:(0);[R4] pks:__pk_increment;[R4] has_uk:false;[R4] uk_info:(null);[R4] uks:(null);[R4] [C1] column_name:__pk_increment;[R4] [C1] column_type:MYSQL_TYPE_LONGLONG;[R4] [C1] column_is_rowkey:true;[R4] [C1] column_is_signed:false;[R4] [C1] column_encoding:binary;[R4] [C1] column_is_not_null:true;[R4] [C1] column_value_new:[4](1);[R4] [C1] column_value_old:[4](1);[R4] [C2] column_name:c0;[R4] [C2] column_type:MYSQL_TYPE_NEWDECIMAL;[R4] [C2] column_is_rowkey:false;[R4] [C2] column_is_signed:true;[R4] [C2] column_encoding:binary;[R4] [C2] column_is_not_null:false;[R4] [C2] column_precision:10;[R4] [C2] column_scale:2;[R4] [C2] column_value_new:[1.20](4);[R4] [C2] column_value_old:[1.20](4);[R4] [C3] column_name:c1;[R4] [C3] column_type:MYSQL_TYPE_NEWDECIMAL;[R4] [C3] column_is_rowkey:false;[R4] [C3] column_is_signed:true;[R4] [C3] column_encoding:binary;[R4] [C3] column_is_not_null:false;[R4] [C3] column_precision:18;[R4] [C3] column_scale:2;[R4] [C3] column_value_new:[99999999.99](11);[R4] [C3] column_value_old:[NULL](0);[R4] [C4] column_name:c2;[R4] [C4] column_type:MYSQL_TYPE_NEWDECIMAL;[R4] [C4] column_is_rowkey:false;[R4] [C4] column_is_signed:true;[R4] [C4] column_encoding:binary;[R4] [C4] column_is_not_null:false;[R4] [C4] column_precision:38;[R4] [C4] column_scale:30;[R4] [C4] column_value_new:[NULL](0);[R4] [C4] column_value_old:[NULL](0);$[R5] record_type:UPDATE;[R5] database_name:oblog_tt.oblog_db1;[R5] table_name:simple_decimal_int;[R5] log_event:true;[R5] column_count:4;[R5] source_category:SRC_FULL_RECORDED;[R5] source_type:SRC_OCEANBASE_1_0;[R5] has_pk:true;[R5] pk_info:(0);[R5] pks:__pk_increment;[R5] has_uk:false;[R5] uk_info:(null);[R5] uks:(null);[R5] [C1] column_name:__pk_increment;[R5] [C1] column_type:MYSQL_TYPE_LONGLONG;[R5] [C1] column_is_rowkey:true;[R5] [C1] column_is_signed:false;[R5] [C1] column_encoding:binary;[R5] [C1] column_is_not_null:true;[R5] [C1] column_value_new:[5](1);[R5] [C1] column_value_old:[5](1);[R5] [C2] column_name:c0;[R5] [C2] column_type:MYSQL_TYPE_NEWDECIMAL;[R5] [C2] column_is_rowkey:false;[R5] [C2] column_is_signed:true;[R5] [C2] column_encoding:binary;[R5] [C2] column_is_not_null:false;[R5] [C2] column_precision:10;[R5] [C2] column_scale:2;[R5] [C2] column_value_new:[1.20](4);[R5] [C2] column_value_old:[1.20](4);[R5] [C3] column_name:c1;[R5] [C3] column_type:MYSQL_TYPE_NEWDECIMAL;[R5] [C3] column_is_rowkey:false;[R5] [C3] column_is_signed:true;[R5] [C3] column_encoding:binary;[R5] [C3] column_is_not_null:false;[R5] [C3] column_precision:18;[R5] [C3] column_scale:2;[R5] [C3] column_value_new:[99999999.99](11);[R5] [C3] column_value_old:[9999999999999999.99](19);[R5] [C4] column_name:c2;[R5] [C4] column_type:MYSQL_TYPE_NEWDECIMAL;[R5] [C4] column_is_rowkey:false;[R5] [C4] column_is_signed:true;[R5] [C4] column_encoding:binary;[R5] [C4] column_is_not_null:false;[R5] [C4] column_precision:38;[R5] [C4] column_scale:30;[R5] [C4] column_value_new:[99999999.999999999999999999999999999999](39);[R5] [C4] column_value_old:[99999999.999999999999999999999999999999](39);$[R6] COMMIT;
select * from simple_decimal_int;
c0	c1	c2
1.20	99999999.99	56.700010000000000000000000000000
1.20	99999999.99	32321321.321321321321000000000000000000
1.20	99999999.99	0.000000000000000000000000000000
1.20	99999999.99	NULL
1.20	99999999.99	99999999.999999999999999999999999999999
update simple_decimal_int set c2 = 99999999.99999999999999999999999999999;
ob1.oblog.next;
[R0] BEGIN;[R0] org_cluster_id:1;[R1] record_type:UPDATE;[R1] database_name:oblog_tt.oblog_db1;[R1] table_name:simple_decimal_int;[R1] log_event:true;[R1] column_count:4;[R1] source_category:SRC_FULL_RECORDED;[R1] source_type:SRC_OCEANBASE_1_0;[R1] has_pk:true;[R1] pk_info:(0);[R1] pks:__pk_increment;[R1] has_uk:false;[R1] uk_info:(null);[R1] uks:(null);[R1] [C1] column_name:__pk_increment;[R1] [C1] column_type:MYSQL_TYPE_LONGLONG;[R1] [C1] column_is_rowkey:true;[R1] [C1] column_is_signed:false;[R1] [C1] column_encoding:binary;[R1] [C1] column_is_not_null:true;[R1] [C1] column_value_new:[1](1);[R1] [C1] column_value_old:[1](1);[R1] [C2] column_name:c0;[R1] [C2] column_type:MYSQL_TYPE_NEWDECIMAL;[R1] [C2] column_is_rowkey:false;[R1] [C2] column_is_signed:true;[R1] [C2] column_encoding:binary;[R1] [C2] column_is_not_null:false;[R1] [C2] column_precision:10;[R1] [C2] column_scale:2;[R1] [C2] column_value_new:[1.20](4);[R1] [C2] column_value_old:[1.20](4);[R1] [C3] column_name:c1;[R1] [C3] column_type:MYSQL_TYPE_NEWDECIMAL;[R1] [C3] column_is_rowkey:false;[R1] [C3] column_is_signed:true;[R1] [C3] column_encoding:binary;[R1] [C3] column_is_not_null:false;[R1] [C3] column_precision:18;[R1] [C3] column_scale:2;[R1] [C3] column_value_new:[99999999.99](11);[R1] [C3] column_value_old:[99999999.99](11);[R1] [C4] column_name:c2;[R1] [C4] column_type:MYSQL_TYPE_NEWDECIMAL;[R1] [C4] column_is_rowkey:false;[R1] [C4] column_is_signed:true;[R1] [C4] column_encoding:binary;[R1] [C4] column_is_not_null:false;[R1] [C4] column_precision:38;[R1] [C4] column_scale:30;[R1] [C4] column_value_new:[99999999.999999999999999999999999999990](39);[R1] [C4] column_value_old:[56.700010000000000000000000000000](33);$[R2] record_type:UPDATE;[R2] database_name:oblog_tt.oblog_db1;[R2] table_name:simple_decimal_int;[R2] log_event:true;[R2] column_count:4;[R2] source_category:SRC_FULL_RECORDED;[R2] source_type:SRC_OCEANBASE_1_0;[R2] has_pk:true;[R2] pk_info:(0);[R2] pks:__pk_increment;[R2] has_uk:false;[R2] uk_info:(null);[R2] uks:(null);[R2] [C1] column_name:__pk_increment;[R2] [C1] column_type:MYSQL_TYPE_LONGLONG;[R2] [C1] column_is_rowkey:true;[R2] [C1] column_is_signed:false;[R2] [C1] column_encoding:binary;[R2] [C1] column_is_not_null:true;[R2] [C1] column_value_new:[2](1);[R2] [C1] column_value_old:[2](1);[R2] [C2] column_name:c0;[R2] [C2] column_type:MYSQL_TYPE_NEWDECIMAL;[R2] [C2] column_is_rowkey:false;[R2] [C2] column_is_signed:true;[R2] [C2] column_encoding:binary;[R2] [C2] column_is_not_null:false;[R2] [C2] column_precision:10;[R2] [C2] column_scale:2;[R2] [C2] column_value_new:[1.20](4);[R2] [C2] column_value_old:[1.20](4);[R2] [C3] column_name:c1;[R2] [C3] column_type:MYSQL_TYPE_NEWDECIMAL;[R2] [C3] column_is_rowkey:false;[R2] [C3] column_is_signed:true;[R2] [C3] column_encoding:binary;[R2] [C3] column_is_not_null:false;[R2] [C3] column_precision:18;[R2] [C3] column_scale:2;[R2] [C3] column_value_new:[99999999.99](11);[R2] [C3] column_value_old:[99999999.99](11);[R2] [C4] column_name:c2;[R2] [C4] column_type:MYSQL_TYPE_NEWDECIMAL;[R2] [C4] column_is_rowkey:false;[R2] [C4] column_is_signed:true;[R2] [C4] column_encoding:binary;[R2] [C4] column_is_not_null:false;[R2] [C4] column_precision:38;[R2] [C4] column_scale:30;[R2] [C4] column_value_new:[99999999.999999999999999999999999999990](39);[R2] [C4] column_value_old:[32321321.321321321321000000000000000000](39);$[R3] record_type:UPDATE;[R3] database_name:oblog_tt.oblog_db1;[R3] table_name:simple_decimal_int;[R3] log_event:true;[R3] column_count:4;[R3] source_category:SRC_FULL_RECORDED;[R3] source_type:SRC_OCEANBASE_1_0;[R3] has_pk:true;[R3] pk_info:(0);[R3] pks:__pk_increment;[R3] has_uk:false;[R3] uk_info:(null);[R3] uks:(null);[R3] [C1] column_name:__pk_increment;[R3] [C1] column_type:MYSQL_TYPE_LONGLONG;[R3] [C1] column_is_rowkey:true;[R3] [C1] column_is_signed:false;[R3] [C1] column_encoding:binary;[R3] [C1] column_is_not_null:true;[R3] [C1] column_value_new:[3](1);[R3] [C1] column_value_old:[3](1);[R3] [C2] column_name:c0;[R3] [C2] column_type:MYSQL_TYPE_NEWDECIMAL;[R3] [C2] column_is_rowkey:false;[R3] [C2] column_is_signed:true;[R3] [C2] column_encoding:binary;[R3] [C2] column_is_not_null:false;[R3] [C2] column_precision:10;[R3] [C2] column_scale:2;[R3] [C2] column_value_new:[1.20](4);[R3] [C2] column_value_old:[1.20](4);[R3] [C3] column_name:c1;[R3] [C3] column_type:MYSQL_TYPE_NEWDECIMAL;[R3] [C3] column_is_rowkey:false;[R3] [C3] column_is_signed:true;[R3] [C3] column_encoding:binary;[R3] [C3] column_is_not_null:false;[R3] [C3] column_precision:18;[R3] [C3] column_scale:2;[R3] [C3] column_value_new:[99999999.99](11);[R3] [C3] column_value_old:[99999999.99](11);[R3] [C4] column_name:c2;[R3] [C4] column_type:MYSQL_TYPE_NEWDECIMAL;[R3] [C4] column_is_rowkey:false;[R3] [C4] column_is_signed:true;[R3] [C4] column_encoding:binary;[R3] [C4] column_is_not_null:false;[R3] [C4] column_precision:38;[R3] [C4] column_scale:30;[R3] [C4] column_value_new:[99999999.999999999999999999999999999990](39);[R3] [C4] column_value_old:[0.000000000000000000000000000000](32);$[R4] record_type:UPDATE;[R4] database_name:oblog_tt.oblog_db1;[R4] table_name:simple_decimal_int;[R4] log_event:true;[R4] column_count:4;[R4] source_category:SRC_FULL_RECORDED;[R4] source_type:SRC_OCEANBASE_1_0;[R4] has_pk:true;[R4] pk_info:(0);[R4] pks:__pk_increment;[R4] has_uk:false;[R4] uk_info:(null);[R4] uks:(null);[R4] [C1] column_name:__pk_increment;[R4] [C1] column_type:MYSQL_TYPE_LONGLONG;[R4] [C1] column_is_rowkey:true;[R4] [C1] column_is_signed:false;[R4] [C1] column_encoding:binary;[R4] [C1] column_is_not_null:true;[R4] [C1] column_value_new:[4](1);[R4] [C1] column_value_old:[4](1);[R4] [C2] column_name:c0;[R4] [C2] column_type:MYSQL_TYPE_NEWDECIMAL;[R4] [C2] column_is_rowkey:false;[R4] [C2] column_is_signed:true;[R4] [C2] column_encoding:binary;[R4] [C2] column_is_not_null:false;[R4] [C2] column_precision:10;[R4] [C2] column_scale:2;[R4] [C2] column_value_new:[1.20](4);[R4] [C2] column_value_old:[1.20](4);[R4] [C3] column_name:c1;[R4] [C3] column_type:MYSQL_TYPE_NEWDECIMAL;[R4] [C3] column_is_rowkey:false;[R4] [C3] column_is_signed:true;[R4] [C3] column_encoding:binary;[R4] [C3] column_is_not_null:false;[R4] [C3] column_precision:18;[R4] [C3] column_scale:2;[R4] [C3] column_value_new:[99999999.99](11);[R4] [C3] column_value_old:[99999999.99](11);[R4] [C4] column_name:c2;[R4] [C4] column_type:MYSQL_TYPE_NEWDECIMAL;[R4] [C4] column_is_rowkey:false;[R4] [C4] column_is_signed:true;[R4] [C4] column_encoding:binary;[R4] [C4] column_is_not_null:false;[R4] [C4] column_precision:38;[R4] [C4] column_scale:30;[R4] [C4] column_value_new:[99999999.999999999999999999999999999990](39);[R4] [C4] column_value_old:[NULL](0);$[R5] record_type:UPDATE;[R5] database_name:oblog_tt.oblog_db1;[R5] table_name:simple_decimal_int;[R5] log_event:true;[R5] column_count:4;[R5] source_category:SRC_FULL_RECORDED;[R5] source_type:SRC_OCEANBASE_1_0;[R5] has_pk:true;[R5] pk_info:(0);[R5] pks:__pk_increment;[R5] has_uk:false;[R5] uk_info:(null);[R5] uks:(null);[R5] [C1] column_name:__pk_increment;[R5] [C1] column_type:MYSQL_TYPE_LONGLONG;[R5] [C1] column_is_rowkey:true;[R5] [C1] column_is_signed:false;[R5] [C1] column_encoding:binary;[R5] [C1] column_is_not_null:true;[R5] [C1] column_value_new:[5](1);[R5] [C1] column_value_old:[5](1);[R5] [C2] column_name:c0;[R5] [C2] column_type:MYSQL_TYPE_NEWDECIMAL;[R5] [C2] column_is_rowkey:false;[R5] [C2] column_is_signed:true;[R5] [C2] column_encoding:binary;[R5] [C2] column_is_not_null:false;[R5] [C2] column_precision:10;[R5] [C2] column_scale:2;[R5] [C2] column_value_new:[1.20](4);[R5] [C2] column_value_old:[1.20](4);[R5] [C3] column_name:c1;[R5] [C3] column_type:MYSQL_TYPE_NEWDECIMAL;[R5] [C3] column_is_rowkey:false;[R5] [C3] column_is_signed:true;[R5] [C3] column_encoding:binary;[R5] [C3] column_is_not_null:false;[R5] [C3] column_precision:18;[R5] [C3] column_scale:2;[R5] [C3] column_value_new:[99999999.99](11);[R5] [C3] column_value_old:[99999999.99](11);[R5] [C4] column_name:c2;[R5] [C4] column_type:MYSQL_TYPE_NEWDECIMAL;[R5] [C4] column_is_rowkey:false;[R5] [C4] column_is_signed:true;[R5] [C4] column_encoding:binary;[R5] [C4] column_is_not_null:false;[R5] [C4] column_precision:38;[R5] [C4] column_scale:30;[R5] [C4] column_value_new:[99999999.999999999999999999999999999990](39);[R5] [C4] column_value_old:[99999999.999999999999999999999999999999](39);$[R6] COMMIT;
select * from simple_decimal_int;
c0	c1	c2
1.20	99999999.99	99999999.999999999999999999999999999990
1.20	99999999.99	99999999.999999999999999999999999999990
1.20	99999999.99	99999999.999999999999999999999999999990
1.20	99999999.99	99999999.999999999999999999999999999990
1.20	99999999.99	99999999.999999999999999999999999999990
update simple_decimal_int set c1 = c0 + c1;
ob1.oblog.next;
[R0] BEGIN;[R0] org_cluster_id:1;[R1] record_type:UPDATE;[R1] database_name:oblog_tt.oblog_db1;[R1] table_name:simple_decimal_int;[R1] log_event:true;[R1] column_count:4;[R1] source_category:SRC_FULL_RECORDED;[R1] source_type:SRC_OCEANBASE_1_0;[R1] has_pk:true;[R1] pk_info:(0);[R1] pks:__pk_increment;[R1] has_uk:false;[R1] uk_info:(null);[R1] uks:(null);[R1] [C1] column_name:__pk_increment;[R1] [C1] column_type:MYSQL_TYPE_LONGLONG;[R1] [C1] column_is_rowkey:true;[R1] [C1] column_is_signed:false;[R1] [C1] column_encoding:binary;[R1] [C1] column_is_not_null:true;[R1] [C1] column_value_new:[1](1);[R1] [C1] column_value_old:[1](1);[R1] [C2] column_name:c0;[R1] [C2] column_type:MYSQL_TYPE_NEWDECIMAL;[R1] [C2] column_is_rowkey:false;[R1] [C2] column_is_signed:true;[R1] [C2] column_encoding:binary;[R1] [C2] column_is_not_null:false;[R1] [C2] column_precision:10;[R1] [C2] column_scale:2;[R1] [C2] column_value_new:[1.20](4);[R1] [C2] column_value_old:[1.20](4);[R1] [C3] column_name:c1;[R1] [C3] column_type:MYSQL_TYPE_NEWDECIMAL;[R1] [C3] column_is_rowkey:false;[R1] [C3] column_is_signed:true;[R1] [C3] column_encoding:binary;[R1] [C3] column_is_not_null:false;[R1] [C3] column_precision:18;[R1] [C3] column_scale:2;[R1] [C3] column_value_new:[100000001.19](12);[R1] [C3] column_value_old:[99999999.99](11);[R1] [C4] column_name:c2;[R1] [C4] column_type:MYSQL_TYPE_NEWDECIMAL;[R1] [C4] column_is_rowkey:false;[R1] [C4] column_is_signed:true;[R1] [C4] column_encoding:binary;[R1] [C4] column_is_not_null:false;[R1] [C4] column_precision:38;[R1] [C4] column_scale:30;[R1] [C4] column_value_new:[99999999.999999999999999999999999999990](39);[R1] [C4] column_value_old:[99999999.999999999999999999999999999990](39);$[R2] record_type:UPDATE;[R2] database_name:oblog_tt.oblog_db1;[R2] table_name:simple_decimal_int;[R2] log_event:true;[R2] column_count:4;[R2] source_category:SRC_FULL_RECORDED;[R2] source_type:SRC_OCEANBASE_1_0;[R2] has_pk:true;[R2] pk_info:(0);[R2] pks:__pk_increment;[R2] has_uk:false;[R2] uk_info:(null);[R2] uks:(null);[R2] [C1] column_name:__pk_increment;[R2] [C1] column_type:MYSQL_TYPE_LONGLONG;[R2] [C1] column_is_rowkey:true;[R2] [C1] column_is_signed:false;[R2] [C1] column_encoding:binary;[R2] [C1] column_is_not_null:true;[R2] [C1] column_value_new:[2](1);[R2] [C1] column_value_old:[2](1);[R2] [C2] column_name:c0;[R2] [C2] column_type:MYSQL_TYPE_NEWDECIMAL;[R2] [C2] column_is_rowkey:false;[R2] [C2] column_is_signed:true;[R2] [C2] column_encoding:binary;[R2] [C2] column_is_not_null:false;[R2] [C2] column_precision:10;[R2] [C2] column_scale:2;[R2] [C2] column_value_new:[1.20](4);[R2] [C2] column_value_old:[1.20](4);[R2] [C3] column_name:c1;[R2] [C3] column_type:MYSQL_TYPE_NEWDECIMAL;[R2] [C3] column_is_rowkey:false;[R2] [C3] column_is_signed:true;[R2] [C3] column_encoding:binary;[R2] [C3] column_is_not_null:false;[R2] [C3] column_precision:18;[R2] [C3] column_scale:2;[R2] [C3] column_value_new:[100000001.19](12);[R2] [C3] column_value_old:[99999999.99](11);[R2] [C4] column_name:c2;[R2] [C4] column_type:MYSQL_TYPE_NEWDECIMAL;[R2] [C4] column_is_rowkey:false;[R2] [C4] column_is_signed:true;[R2] [C4] column_encoding:binary;[R2] [C4] column_is_not_null:false;[R2] [C4] column_precision:38;[R2] [C4] column_scale:30;[R2] [C4] column_value_new:[99999999.999999999999999999999999999990](39);[R2] [C4] column_value_old:[99999999.999999999999999999999999999990](39);$[R3] record_type:UPDATE;[R3] database_name:oblog_tt.oblog_db1;[R3] table_name:simple_decimal_int;[R3] log_event:true;[R3] column_count:4;[R3] source_category:SRC_FULL_RECORDED;[R3] source_type:SRC_OCEANBASE_1_0;[R3] has_pk:true;[R3] pk_info:(0);[R3] pks:__pk_increment;[R3] has_uk:false;[R3] uk_info:(null);[R3] uks:(null);[R3] [C1] column_name:__pk_increment;[R3] [C1] column_type:MYSQL_TYPE_LONGLONG;[R3] [C1] column_is_rowkey:true;[R3] [C1] column_is_signed:false;[R3] [C1] column_encoding:binary;[R3] [C1] column_is_not_null:true;[R3] [C1] column_value_new:[3](1);[R3] [C1] column_value_old:[3](1);[R3] [C2] column_name:c0;[R3] [C2] column_type:MYSQL_TYPE_NEWDECIMAL;[R3] [C2] column_is_rowkey:false;[R3] [C2] column_is_signed:true;[R3] [C2] column_encoding:binary;[R3] [C2] column_is_not_null:false;[R3] [C2] column_precision:10;[R3] [C2] column_scale:2;[R3] [C2] column_value_new:[1.20](4);[R3] [C2] column_value_old:[1.20](4);[R3] [C3] column_name:c1;[R3] [C3] column_type:MYSQL_TYPE_NEWDECIMAL;[R3] [C3] column_is_rowkey:false;[R3] [C3] column_is_signed:true;[R3] [C3] column_encoding:binary;[R3] [C3] column_is_not_null:false;[R3] [C3] column_precision:18;[R3] [C3] column_scale:2;[R3] [C3] column_value_new:[100000001.19](12);[R3] [C3] column_value_old:[99999999.99](11);[R3] [C4] column_name:c2;[R3] [C4] column_type:MYSQL_TYPE_NEWDECIMAL;[R3] [C4] column_is_rowkey:false;[R3] [C4] column_is_signed:true;[R3] [C4] column_encoding:binary;[R3] [C4] column_is_not_null:false;[R3] [C4] column_precision:38;[R3] [C4] column_scale:30;[R3] [C4] column_value_new:[99999999.999999999999999999999999999990](39);[R3] [C4] column_value_old:[99999999.999999999999999999999999999990](39);$[R4] record_type:UPDATE;[R4] database_name:oblog_tt.oblog_db1;[R4] table_name:simple_decimal_int;[R4] log_event:true;[R4] column_count:4;[R4] source_category:SRC_FULL_RECORDED;[R4] source_type:SRC_OCEANBASE_1_0;[R4] has_pk:true;[R4] pk_info:(0);[R4] pks:__pk_increment;[R4] has_uk:false;[R4] uk_info:(null);[R4] uks:(null);[R4] [C1] column_name:__pk_increment;[R4] [C1] column_type:MYSQL_TYPE_LONGLONG;[R4] [C1] column_is_rowkey:true;[R4] [C1] column_is_signed:false;[R4] [C1] column_encoding:binary;[R4] [C1] column_is_not_null:true;[R4] [C1] column_value_new:[4](1);[R4] [C1] column_value_old:[4](1);[R4] [C2] column_name:c0;[R4] [C2] column_type:MYSQL_TYPE_NEWDECIMAL;[R4] [C2] column_is_rowkey:false;[R4] [C2] column_is_signed:true;[R4] [C2] column_encoding:binary;[R4] [C2] column_is_not_null:false;[R4] [C2] column_precision:10;[R4] [C2] column_scale:2;[R4] [C2] column_value_new:[1.20](4);[R4] [C2] column_value_old:[1.20](4);[R4] [C3] column_name:c1;[R4] [C3] column_type:MYSQL_TYPE_NEWDECIMAL;[R4] [C3] column_is_rowkey:false;[R4] [C3] column_is_signed:true;[R4] [C3] column_encoding:binary;[R4] [C3] column_is_not_null:false;[R4] [C3] column_precision:18;[R4] [C3] column_scale:2;[R4] [C3] column_value_new:[100000001.19](12);[R4] [C3] column_value_old:[99999999.99](11);[R4] [C4] column_name:c2;[R4] [C4] column_type:MYSQL_TYPE_NEWDECIMAL;[R4] [C4] column_is_rowkey:false;[R4] [C4] column_is_signed:true;[R4] [C4] column_encoding:binary;[R4] [C4] column_is_not_null:false;[R4] [C4] column_precision:38;[R4] [C4] column_scale:30;[R4] [C4] column_value_new:[99999999.999999999999999999999999999990](39);[R4] [C4] column_value_old:[99999999.999999999999999999999999999990](39);$[R5] record_type:UPDATE;[R5] database_name:oblog_tt.oblog_db1;[R5] table_name:simple_decimal_int;[R5] log_event:true;[R5] column_count:4;[R5] source_category:SRC_FULL_RECORDED;[R5] source_type:SRC_OCEANBASE_1_0;[R5] has_pk:true;[R5] pk_info:(0);[R5] pks:__pk_increment;[R5] has_uk:false;[R5] uk_info:(null);[R5] uks:(null);[R5] [C1] column_name:__pk_increment;[R5] [C1] column_type:MYSQL_TYPE_LONGLONG;[R5] [C1] column_is_rowkey:true;[R5] [C1] column_is_signed:false;[R5] [C1] column_encoding:binary;[R5] [C1] column_is_not_null:true;[R5] [C1] column_value_new:[5](1);[R5] [C1] column_value_old:[5](1);[R5] [C2] column_name:c0;[R5] [C2] column_type:MYSQL_TYPE_NEWDECIMAL;[R5] [C2] column_is_rowkey:false;[R5] [C2] column_is_signed:true;[R5] [C2] column_encoding:binary;[R5] [C2] column_is_not_null:false;[R5] [C2] column_precision:10;[R5] [C2] column_scale:2;[R5] [C2] column_value_new:[1.20](4);[R5] [C2] column_value_old:[1.20](4);[R5] [C3] column_name:c1;[R5] [C3] column_type:MYSQL_TYPE_NEWDECIMAL;[R5] [C3] column_is_rowkey:false;[R5] [C3] column_is_signed:true;[R5] [C3] column_encoding:binary;[R5] [C3] column_is_not_null:false;[R5] [C3] column_precision:18;[R5] [C3] column_scale:2;[R5] [C3] column_value_new:[100000001.19](12);[R5] [C3] column_value_old:[99999999.99](11);[R5] [C4] column_name:c2;[R5] [C4] column_type:MYSQL_TYPE_NEWDECIMAL;[R5] [C4] column_is_rowkey:false;[R5] [C4] column_is_signed:true;[R5] [C4] column_encoding:binary;[R5] [C4] column_is_not_null:false;[R5] [C4] column_precision:38;[R5] [C4] column_scale:30;[R5] [C4] column_value_new:[99999999.999999999999999999999999999990](39);[R5] [C4] column_value_old:[99999999.999999999999999999999999999990](39);$[R6] COMMIT;
select * from simple_decimal_int;
c0	c1	c2
1.20	100000001.19	99999999.999999999999999999999999999990
1.20	100000001.19	99999999.999999999999999999999999999990
1.20	100000001.19	99999999.999999999999999999999999999990
1.20	100000001.19	99999999.999999999999999999999999999990
1.20	100000001.19	99999999.999999999999999999999999999990
update simple_decimal_int set c2 = c2 - c1;
ob1.oblog.next;
[R0] BEGIN;[R0] org_cluster_id:1;[R1] record_type:UPDATE;[R1] database_name:oblog_tt.oblog_db1;[R1] table_name:simple_decimal_int;[R1] log_event:true;[R1] column_count:4;[R1] source_category:SRC_FULL_RECORDED;[R1] source_type:SRC_OCEANBASE_1_0;[R1] has_pk:true;[R1] pk_info:(0);[R1] pks:__pk_increment;[R1] has_uk:false;[R1] uk_info:(null);[R1] uks:(null);[R1] [C1] column_name:__pk_increment;[R1] [C1] column_type:MYSQL_TYPE_LONGLONG;[R1] [C1] column_is_rowkey:true;[R1] [C1] column_is_signed:false;[R1] [C1] column_encoding:binary;[R1] [C1] column_is_not_null:true;[R1] [C1] column_value_new:[1](1);[R1] [C1] column_value_old:[1](1);[R1] [C2] column_name:c0;[R1] [C2] column_type:MYSQL_TYPE_NEWDECIMAL;[R1] [C2] column_is_rowkey:false;[R1] [C2] column_is_signed:true;[R1] [C2] column_encoding:binary;[R1] [C2] column_is_not_null:false;[R1] [C2] column_precision:10;[R1] [C2] column_scale:2;[R1] [C2] column_value_new:[1.20](4);[R1] [C2] column_value_old:[1.20](4);[R1] [C3] column_name:c1;[R1] [C3] column_type:MYSQL_TYPE_NEWDECIMAL;[R1] [C3] column_is_rowkey:false;[R1] [C3] column_is_signed:true;[R1] [C3] column_encoding:binary;[R1] [C3] column_is_not_null:false;[R1] [C3] column_precision:18;[R1] [C3] column_scale:2;[R1] [C3] column_value_new:[100000001.19](12);[R1] [C3] column_value_old:[100000001.19](12);[R1] [C4] column_name:c2;[R1] [C4] column_type:MYSQL_TYPE_NEWDECIMAL;[R1] [C4] column_is_rowkey:false;[R1] [C4] column_is_signed:true;[R1] [C4] column_encoding:binary;[R1] [C4] column_is_not_null:false;[R1] [C4] column_precision:38;[R1] [C4] column_scale:30;[R1] [C4] column_value_new:[-1.190000000000000000000000000010](33);[R1] [C4] column_value_old:[99999999.999999999999999999999999999990](39);$[R2] record_type:UPDATE;[R2] database_name:oblog_tt.oblog_db1;[R2] table_name:simple_decimal_int;[R2] log_event:true;[R2] column_count:4;[R2] source_category:SRC_FULL_RECORDED;[R2] source_type:SRC_OCEANBASE_1_0;[R2] has_pk:true;[R2] pk_info:(0);[R2] pks:__pk_increment;[R2] has_uk:false;[R2] uk_info:(null);[R2] uks:(null);[R2] [C1] column_name:__pk_increment;[R2] [C1] column_type:MYSQL_TYPE_LONGLONG;[R2] [C1] column_is_rowkey:true;[R2] [C1] column_is_signed:false;[R2] [C1] column_encoding:binary;[R2] [C1] column_is_not_null:true;[R2] [C1] column_value_new:[2](1);[R2] [C1] column_value_old:[2](1);[R2] [C2] column_name:c0;[R2] [C2] column_type:MYSQL_TYPE_NEWDECIMAL;[R2] [C2] column_is_rowkey:false;[R2] [C2] column_is_signed:true;[R2] [C2] column_encoding:binary;[R2] [C2] column_is_not_null:false;[R2] [C2] column_precision:10;[R2] [C2] column_scale:2;[R2] [C2] column_value_new:[1.20](4);[R2] [C2] column_value_old:[1.20](4);[R2] [C3] column_name:c1;[R2] [C3] column_type:MYSQL_TYPE_NEWDECIMAL;[R2] [C3] column_is_rowkey:false;[R2] [C3] column_is_signed:true;[R2] [C3] column_encoding:binary;[R2] [C3] column_is_not_null:false;[R2] [C3] column_precision:18;[R2] [C3] column_scale:2;[R2] [C3] column_value_new:[100000001.19](12);[R2] [C3] column_value_old:[100000001.19](12);[R2] [C4] column_name:c2;[R2] [C4] column_type:MYSQL_TYPE_NEWDECIMAL;[R2] [C4] column_is_rowkey:false;[R2] [C4] column_is_signed:true;[R2] [C4] column_encoding:binary;[R2] [C4] column_is_not_null:false;[R2] [C4] column_precision:38;[R2] [C4] column_scale:30;[R2] [C4] column_value_new:[-1.190000000000000000000000000010](33);[R2] [C4] column_value_old:[99999999.999999999999999999999999999990](39);$[R3] record_type:UPDATE;[R3] database_name:oblog_tt.oblog_db1;[R3] table_name:simple_decimal_int;[R3] log_event:true;[R3] column_count:4;[R3] source_category:SRC_FULL_RECORDED;[R3] source_type:SRC_OCEANBASE_1_0;[R3] has_pk:true;[R3] pk_info:(0);[R3] pks:__pk_increment;[R3] has_uk:false;[R3] uk_info:(null);[R3] uks:(null);[R3] [C1] column_name:__pk_increment;[R3] [C1] column_type:MYSQL_TYPE_LONGLONG;[R3] [C1] column_is_rowkey:true;[R3] [C1] column_is_signed:false;[R3] [C1] column_encoding:binary;[R3] [C1] column_is_not_null:true;[R3] [C1] column_value_new:[3](1);[R3] [C1] column_value_old:[3](1);[R3] [C2] column_name:c0;[R3] [C2] column_type:MYSQL_TYPE_NEWDECIMAL;[R3] [C2] column_is_rowkey:false;[R3] [C2] column_is_signed:true;[R3] [C2] column_encoding:binary;[R3] [C2] column_is_not_null:false;[R3] [C2] column_precision:10;[R3] [C2] column_scale:2;[R3] [C2] column_value_new:[1.20](4);[R3] [C2] column_value_old:[1.20](4);[R3] [C3] column_name:c1;[R3] [C3] column_type:MYSQL_TYPE_NEWDECIMAL;[R3] [C3] column_is_rowkey:false;[R3] [C3] column_is_signed:true;[R3] [C3] column_encoding:binary;[R3] [C3] column_is_not_null:false;[R3] [C3] column_precision:18;[R3] [C3] column_scale:2;[R3] [C3] column_value_new:[100000001.19](12);[R3] [C3] column_value_old:[100000001.19](12);[R3] [C4] column_name:c2;[R3] [C4] column_type:MYSQL_TYPE_NEWDECIMAL;[R3] [C4] column_is_rowkey:false;[R3] [C4] column_is_signed:true;[R3] [C4] column_encoding:binary;[R3] [C4] column_is_not_null:false;[R3] [C4] column_precision:38;[R3] [C4] column_scale:30;[R3] [C4] column_value_new:[-1.190000000000000000000000000010](33);[R3] [C4] column_value_old:[99999999.999999999999999999999999999990](39);$[R4] record_type:UPDATE;[R4] database_name:oblog_tt.oblog_db1;[R4] table_name:simple_decimal_int;[R4] log_event:true;[R4] column_count:4;[R4] source_category:SRC_FULL_RECORDED;[R4] source_type:SRC_OCEANBASE_1_0;[R4] has_pk:true;[R4] pk_info:(0);[R4] pks:__pk_increment;[R4] has_uk:false;[R4] uk_info:(null);[R4] uks:(null);[R4] [C1] column_name:__pk_increment;[R4] [C1] column_type:MYSQL_TYPE_LONGLONG;[R4] [C1] column_is_rowkey:true;[R4] [C1] column_is_signed:false;[R4] [C1] column_encoding:binary;[R4] [C1] column_is_not_null:true;[R4] [C1] column_value_new:[4](1);[R4] [C1] column_value_old:[4](1);[R4] [C2] column_name:c0;[R4] [C2] column_type:MYSQL_TYPE_NEWDECIMAL;[R4] [C2] column_is_rowkey:false;[R4] [C2] column_is_signed:true;[R4] [C2] column_encoding:binary;[R4] [C2] column_is_not_null:false;[R4] [C2] column_precision:10;[R4] [C2] column_scale:2;[R4] [C2] column_value_new:[1.20](4);[R4] [C2] column_value_old:[1.20](4);[R4] [C3] column_name:c1;[R4] [C3] column_type:MYSQL_TYPE_NEWDECIMAL;[R4] [C3] column_is_rowkey:false;[R4] [C3] column_is_signed:true;[R4] [C3] column_encoding:binary;[R4] [C3] column_is_not_null:false;[R4] [C3] column_precision:18;[R4] [C3] column_scale:2;[R4] [C3] column_value_new:[100000001.19](12);[R4] [C3] column_value_old:[100000001.19](12);[R4] [C4] column_name:c2;[R4] [C4] column_type:MYSQL_TYPE_NEWDECIMAL;[R4] [C4] column_is_rowkey:false;[R4] [C4] column_is_signed:true;[R4] [C4] column_encoding:binary;[R4] [C4] column_is_not_null:false;[R4] [C4] column_precision:38;[R4] [C4] column_scale:30;[R4] [C4] column_value_new:[-1.190000000000000000000000000010](33);[R4] [C4] column_value_old:[99999999.999999999999999999999999999990](39);$[R5] record_type:UPDATE;[R5] database_name:oblog_tt.oblog_db1;[R5] table_name:simple_decimal_int;[R5] log_event:true;[R5] column_count:4;[R5] source_category:SRC_FULL_RECORDED;[R5] source_type:SRC_OCEANBASE_1_0;[R5] has_pk:true;[R5] pk_info:(0);[R5] pks:__pk_increment;[R5] has_uk:false;[R5] uk_info:(null);[R5] uks:(null);[R5] [C1] column_name:__pk_increment;[R5] [C1] column_type:MYSQL_TYPE_LONGLONG;[R5] [C1] column_is_rowkey:true;[R5] [C1] column_is_signed:false;[R5] [C1] column_encoding:binary;[R5] [C1] column_is_not_null:true;[R5] [C1] column_value_new:[5](1);[R5] [C1] column_value_old:[5](1);[R5] [C2] column_name:c0;[R5] [C2] column_type:MYSQL_TYPE_NEWDECIMAL;[R5] [C2] column_is_rowkey:false;[R5] [C2] column_is_signed:true;[R5] [C2] column_encoding:binary;[R5] [C2] column_is_not_null:false;[R5] [C2] column_precision:10;[R5] [C2] column_scale:2;[R5] [C2] column_value_new:[1.20](4);[R5] [C2] column_value_old:[1.20](4);[R5] [C3] column_name:c1;[R5] [C3] column_type:MYSQL_TYPE_NEWDECIMAL;[R5] [C3] column_is_rowkey:false;[R5] [C3] column_is_signed:true;[R5] [C3] column_encoding:binary;[R5] [C3] column_is_not_null:false;[R5] [C3] column_precision:18;[R5] [C3] column_scale:2;[R5] [C3] column_value_new:[100000001.19](12);[R5] [C3] column_value_old:[100000001.19](12);[R5] [C4] column_name:c2;[R5] [C4] column_type:MYSQL_TYPE_NEWDECIMAL;[R5] [C4] column_is_rowkey:false;[R5] [C4] column_is_signed:true;[R5] [C4] column_encoding:binary;[R5] [C4] column_is_not_null:false;[R5] [C4] column_precision:38;[R5] [C4] column_scale:30;[R5] [C4] column_value_new:[-1.190000000000000000000000000010](33);[R5] [C4] column_value_old:[99999999.999999999999999999999999999990](39);$[R6] COMMIT;
select * from simple_decimal_int;
c0	c1	c2
1.20	100000001.19	-1.190000000000000000000000000010
1.20	100000001.19	-1.190000000000000000000000000010
1.20	100000001.19	-1.190000000000000000000000000010
1.20	100000001.19	-1.190000000000000000000000000010
1.20	100000001.19	-1.190000000000000000000000000010
update simple_decimal_int set c2 = c0 * c0;
ob1.oblog.next;
[R0] BEGIN;[R0] org_cluster_id:1;[R1] record_type:UPDATE;[R1] database_name:oblog_tt.oblog_db1;[R1] table_name:simple_decimal_int;[R1] log_event:true;[R1] column_count:4;[R1] source_category:SRC_FULL_RECORDED;[R1] source_type:SRC_OCEANBASE_1_0;[R1] has_pk:true;[R1] pk_info:(0);[R1] pks:__pk_increment;[R1] has_uk:false;[R1] uk_info:(null);[R1] uks:(null);[R1] [C1] column_name:__pk_increment;[R1] [C1] column_type:MYSQL_TYPE_LONGLONG;[R1] [C1] column_is_rowkey:true;[R1] [C1] column_is_signed:false;[R1] [C1] column_encoding:binary;[R1] [C1] column_is_not_null:true;[R1] [C1] column_value_new:[1](1);[R1] [C1] column_value_old:[1](1);[R1] [C2] column_name:c0;[R1] [C2] column_type:MYSQL_TYPE_NEWDECIMAL;[R1] [C2] column_is_rowkey:false;[R1] [C2] column_is_signed:true;[R1] [C2] column_encoding:binary;[R1] [C2] column_is_not_null:false;[R1] [C2] column_precision:10;[R1] [C2] column_scale:2;[R1] [C2] column_value_new:[1.20](4);[R1] [C2] column_value_old:[1.20](4);[R1] [C3] column_name:c1;[R1] [C3] column_type:MYSQL_TYPE_NEWDECIMAL;[R1] [C3] column_is_rowkey:false;[R1] [C3] column_is_signed:true;[R1] [C3] column_encoding:binary;[R1] [C3] column_is_not_null:false;[R1] [C3] column_precision:18;[R1] [C3] column_scale:2;[R1] [C3] column_value_new:[100000001.19](12);[R1] [C3] column_value_old:[100000001.19](12);[R1] [C4] column_name:c2;[R1] [C4] column_type:MYSQL_TYPE_NEWDECIMAL;[R1] [C4] column_is_rowkey:false;[R1] [C4] column_is_signed:true;[R1] [C4] column_encoding:binary;[R1] [C4] column_is_not_null:false;[R1] [C4] column_precision:38;[R1] [C4] column_scale:30;[R1] [C4] column_value_new:[1.440000000000000000000000000000](32);[R1] [C4] column_value_old:[-1.190000000000000000000000000010](33);$[R2] record_type:UPDATE;[R2] database_name:oblog_tt.oblog_db1;[R2] table_name:simple_decimal_int;[R2] log_event:true;[R2] column_count:4;[R2] source_category:SRC_FULL_RECORDED;[R2] source_type:SRC_OCEANBASE_1_0;[R2] has_pk:true;[R2] pk_info:(0);[R2] pks:__pk_increment;[R2] has_uk:false;[R2] uk_info:(null);[R2] uks:(null);[R2] [C1] column_name:__pk_increment;[R2] [C1] column_type:MYSQL_TYPE_LONGLONG;[R2] [C1] column_is_rowkey:true;[R2] [C1] column_is_signed:false;[R2] [C1] column_encoding:binary;[R2] [C1] column_is_not_null:true;[R2] [C1] column_value_new:[2](1);[R2] [C1] column_value_old:[2](1);[R2] [C2] column_name:c0;[R2] [C2] column_type:MYSQL_TYPE_NEWDECIMAL;[R2] [C2] column_is_rowkey:false;[R2] [C2] column_is_signed:true;[R2] [C2] column_encoding:binary;[R2] [C2] column_is_not_null:false;[R2] [C2] column_precision:10;[R2] [C2] column_scale:2;[R2] [C2] column_value_new:[1.20](4);[R2] [C2] column_value_old:[1.20](4);[R2] [C3] column_name:c1;[R2] [C3] column_type:MYSQL_TYPE_NEWDECIMAL;[R2] [C3] column_is_rowkey:false;[R2] [C3] column_is_signed:true;[R2] [C3] column_encoding:binary;[R2] [C3] column_is_not_null:false;[R2] [C3] column_precision:18;[R2] [C3] column_scale:2;[R2] [C3] column_value_new:[100000001.19](12);[R2] [C3] column_value_old:[100000001.19](12);[R2] [C4] column_name:c2;[R2] [C4] column_type:MYSQL_TYPE_NEWDECIMAL;[R2] [C4] column_is_rowkey:false;[R2] [C4] column_is_signed:true;[R2] [C4] column_encoding:binary;[R2] [C4] column_is_not_null:false;[R2] [C4] column_precision:38;[R2] [C4] column_scale:30;[R2] [C4] column_value_new:[1.440000000000000000000000000000](32);[R2] [C4] column_value_old:[-1.190000000000000000000000000010](33);$[R3] record_type:UPDATE;[R3] database_name:oblog_tt.oblog_db1;[R3] table_name:simple_decimal_int;[R3] log_event:true;[R3] column_count:4;[R3] source_category:SRC_FULL_RECORDED;[R3] source_type:SRC_OCEANBASE_1_0;[R3] has_pk:true;[R3] pk_info:(0);[R3] pks:__pk_increment;[R3] has_uk:false;[R3] uk_info:(null);[R3] uks:(null);[R3] [C1] column_name:__pk_increment;[R3] [C1] column_type:MYSQL_TYPE_LONGLONG;[R3] [C1] column_is_rowkey:true;[R3] [C1] column_is_signed:false;[R3] [C1] column_encoding:binary;[R3] [C1] column_is_not_null:true;[R3] [C1] column_value_new:[3](1);[R3] [C1] column_value_old:[3](1);[R3] [C2] column_name:c0;[R3] [C2] column_type:MYSQL_TYPE_NEWDECIMAL;[R3] [C2] column_is_rowkey:false;[R3] [C2] column_is_signed:true;[R3] [C2] column_encoding:binary;[R3] [C2] column_is_not_null:false;[R3] [C2] column_precision:10;[R3] [C2] column_scale:2;[R3] [C2] column_value_new:[1.20](4);[R3] [C2] column_value_old:[1.20](4);[R3] [C3] column_name:c1;[R3] [C3] column_type:MYSQL_TYPE_NEWDECIMAL;[R3] [C3] column_is_rowkey:false;[R3] [C3] column_is_signed:true;[R3] [C3] column_encoding:binary;[R3] [C3] column_is_not_null:false;[R3] [C3] column_precision:18;[R3] [C3] column_scale:2;[R3] [C3] column_value_new:[100000001.19](12);[R3] [C3] column_value_old:[100000001.19](12);[R3] [C4] column_name:c2;[R3] [C4] column_type:MYSQL_TYPE_NEWDECIMAL;[R3] [C4] column_is_rowkey:false;[R3] [C4] column_is_signed:true;[R3] [C4] column_encoding:binary;[R3] [C4] column_is_not_null:false;[R3] [C4] column_precision:38;[R3] [C4] column_scale:30;[R3] [C4] column_value_new:[1.440000000000000000000000000000](32);[R3] [C4] column_value_old:[-1.190000000000000000000000000010](33);$[R4] record_type:UPDATE;[R4] database_name:oblog_tt.oblog_db1;[R4] table_name:simple_decimal_int;[R4] log_event:true;[R4] column_count:4;[R4] source_category:SRC_FULL_RECORDED;[R4] source_type:SRC_OCEANBASE_1_0;[R4] has_pk:true;[R4] pk_info:(0);[R4] pks:__pk_increment;[R4] has_uk:false;[R4] uk_info:(null);[R4] uks:(null);[R4] [C1] column_name:__pk_increment;[R4] [C1] column_type:MYSQL_TYPE_LONGLONG;[R4] [C1] column_is_rowkey:true;[R4] [C1] column_is_signed:false;[R4] [C1] column_encoding:binary;[R4] [C1] column_is_not_null:true;[R4] [C1] column_value_new:[4](1);[R4] [C1] column_value_old:[4](1);[R4] [C2] column_name:c0;[R4] [C2] column_type:MYSQL_TYPE_NEWDECIMAL;[R4] [C2] column_is_rowkey:false;[R4] [C2] column_is_signed:true;[R4] [C2] column_encoding:binary;[R4] [C2] column_is_not_null:false;[R4] [C2] column_precision:10;[R4] [C2] column_scale:2;[R4] [C2] column_value_new:[1.20](4);[R4] [C2] column_value_old:[1.20](4);[R4] [C3] column_name:c1;[R4] [C3] column_type:MYSQL_TYPE_NEWDECIMAL;[R4] [C3] column_is_rowkey:false;[R4] [C3] column_is_signed:true;[R4] [C3] column_encoding:binary;[R4] [C3] column_is_not_null:false;[R4] [C3] column_precision:18;[R4] [C3] column_scale:2;[R4] [C3] column_value_new:[100000001.19](12);[R4] [C3] column_value_old:[100000001.19](12);[R4] [C4] column_name:c2;[R4] [C4] column_type:MYSQL_TYPE_NEWDECIMAL;[R4] [C4] column_is_rowkey:false;[R4] [C4] column_is_signed:true;[R4] [C4] column_encoding:binary;[R4] [C4] column_is_not_null:false;[R4] [C4] column_precision:38;[R4] [C4] column_scale:30;[R4] [C4] column_value_new:[1.440000000000000000000000000000](32);[R4] [C4] column_value_old:[-1.190000000000000000000000000010](33);$[R5] record_type:UPDATE;[R5] database_name:oblog_tt.oblog_db1;[R5] table_name:simple_decimal_int;[R5] log_event:true;[R5] column_count:4;[R5] source_category:SRC_FULL_RECORDED;[R5] source_type:SRC_OCEANBASE_1_0;[R5] has_pk:true;[R5] pk_info:(0);[R5] pks:__pk_increment;[R5] has_uk:false;[R5] uk_info:(null);[R5] uks:(null);[R5] [C1] column_name:__pk_increment;[R5] [C1] column_type:MYSQL_TYPE_LONGLONG;[R5] [C1] column_is_rowkey:true;[R5] [C1] column_is_signed:false;[R5] [C1] column_encoding:binary;[R5] [C1] column_is_not_null:true;[R5] [C1] column_value_new:[5](1);[R5] [C1] column_value_old:[5](1);[R5] [C2] column_name:c0;[R5] [C2] column_type:MYSQL_TYPE_NEWDECIMAL;[R5] [C2] column_is_rowkey:false;[R5] [C2] column_is_signed:true;[R5] [C2] column_encoding:binary;[R5] [C2] column_is_not_null:false;[R5] [C2] column_precision:10;[R5] [C2] column_scale:2;[R5] [C2] column_value_new:[1.20](4);[R5] [C2] column_value_old:[1.20](4);[R5] [C3] column_name:c1;[R5] [C3] column_type:MYSQL_TYPE_NEWDECIMAL;[R5] [C3] column_is_rowkey:false;[R5] [C3] column_is_signed:true;[R5] [C3] column_encoding:binary;[R5] [C3] column_is_not_null:false;[R5] [C3] column_precision:18;[R5] [C3] column_scale:2;[R5] [C3] column_value_new:[100000001.19](12);[R5] [C3] column_value_old:[100000001.19](12);[R5] [C4] column_name:c2;[R5] [C4] column_type:MYSQL_TYPE_NEWDECIMAL;[R5] [C4] column_is_rowkey:false;[R5] [C4] column_is_signed:true;[R5] [C4] column_encoding:binary;[R5] [C4] column_is_not_null:false;[R5] [C4] column_precision:38;[R5] [C4] column_scale:30;[R5] [C4] column_value_new:[1.440000000000000000000000000000](32);[R5] [C4] column_value_old:[-1.190000000000000000000000000010](33);$[R6] COMMIT;
select * from simple_decimal_int;
c0	c1	c2
1.20	100000001.19	1.440000000000000000000000000000
1.20	100000001.19	1.440000000000000000000000000000
1.20	100000001.19	1.440000000000000000000000000000
1.20	100000001.19	1.440000000000000000000000000000
1.20	100000001.19	1.440000000000000000000000000000
update simple_decimal_int set c2 = c2 / c0;
ob1.oblog.next;
[R0] BEGIN;[R0] org_cluster_id:1;[R1] record_type:UPDATE;[R1] database_name:oblog_tt.oblog_db1;[R1] table_name:simple_decimal_int;[R1] log_event:true;[R1] column_count:4;[R1] source_category:SRC_FULL_RECORDED;[R1] source_type:SRC_OCEANBASE_1_0;[R1] has_pk:true;[R1] pk_info:(0);[R1] pks:__pk_increment;[R1] has_uk:false;[R1] uk_info:(null);[R1] uks:(null);[R1] [C1] column_name:__pk_increment;[R1] [C1] column_type:MYSQL_TYPE_LONGLONG;[R1] [C1] column_is_rowkey:true;[R1] [C1] column_is_signed:false;[R1] [C1] column_encoding:binary;[R1] [C1] column_is_not_null:true;[R1] [C1] column_value_new:[1](1);[R1] [C1] column_value_old:[1](1);[R1] [C2] column_name:c0;[R1] [C2] column_type:MYSQL_TYPE_NEWDECIMAL;[R1] [C2] column_is_rowkey:false;[R1] [C2] column_is_signed:true;[R1] [C2] column_encoding:binary;[R1] [C2] column_is_not_null:false;[R1] [C2] column_precision:10;[R1] [C2] column_scale:2;[R1] [C2] column_value_new:[1.20](4);[R1] [C2] column_value_old:[1.20](4);[R1] [C3] column_name:c1;[R1] [C3] column_type:MYSQL_TYPE_NEWDECIMAL;[R1] [C3] column_is_rowkey:false;[R1] [C3] column_is_signed:true;[R1] [C3] column_encoding:binary;[R1] [C3] column_is_not_null:false;[R1] [C3] column_precision:18;[R1] [C3] column_scale:2;[R1] [C3] column_value_new:[100000001.19](12);[R1] [C3] column_value_old:[100000001.19](12);[R1] [C4] column_name:c2;[R1] [C4] column_type:MYSQL_TYPE_NEWDECIMAL;[R1] [C4] column_is_rowkey:false;[R1] [C4] column_is_signed:true;[R1] [C4] column_encoding:binary;[R1] [C4] column_is_not_null:false;[R1] [C4] column_precision:38;[R1] [C4] column_scale:30;[R1] [C4] column_value_new:[1.200000000000000000000000000000](32);[R1] [C4] column_value_old:[1.440000000000000000000000000000](32);$[R2] record_type:UPDATE;[R2] database_name:oblog_tt.oblog_db1;[R2] table_name:simple_decimal_int;[R2] log_event:true;[R2] column_count:4;[R2] source_category:SRC_FULL_RECORDED;[R2] source_type:SRC_OCEANBASE_1_0;[R2] has_pk:true;[R2] pk_info:(0);[R2] pks:__pk_increment;[R2] has_uk:false;[R2] uk_info:(null);[R2] uks:(null);[R2] [C1] column_name:__pk_increment;[R2] [C1] column_type:MYSQL_TYPE_LONGLONG;[R2] [C1] column_is_rowkey:true;[R2] [C1] column_is_signed:false;[R2] [C1] column_encoding:binary;[R2] [C1] column_is_not_null:true;[R2] [C1] column_value_new:[2](1);[R2] [C1] column_value_old:[2](1);[R2] [C2] column_name:c0;[R2] [C2] column_type:MYSQL_TYPE_NEWDECIMAL;[R2] [C2] column_is_rowkey:false;[R2] [C2] column_is_signed:true;[R2] [C2] column_encoding:binary;[R2] [C2] column_is_not_null:false;[R2] [C2] column_precision:10;[R2] [C2] column_scale:2;[R2] [C2] column_value_new:[1.20](4);[R2] [C2] column_value_old:[1.20](4);[R2] [C3] column_name:c1;[R2] [C3] column_type:MYSQL_TYPE_NEWDECIMAL;[R2] [C3] column_is_rowkey:false;[R2] [C3] column_is_signed:true;[R2] [C3] column_encoding:binary;[R2] [C3] column_is_not_null:false;[R2] [C3] column_precision:18;[R2] [C3] column_scale:2;[R2] [C3] column_value_new:[100000001.19](12);[R2] [C3] column_value_old:[100000001.19](12);[R2] [C4] column_name:c2;[R2] [C4] column_type:MYSQL_TYPE_NEWDECIMAL;[R2] [C4] column_is_rowkey:false;[R2] [C4] column_is_signed:true;[R2] [C4] column_encoding:binary;[R2] [C4] column_is_not_null:false;[R2] [C4] column_precision:38;[R2] [C4] column_scale:30;[R2] [C4] column_value_new:[1.200000000000000000000000000000](32);[R2] [C4] column_value_old:[1.440000000000000000000000000000](32);$[R3] record_type:UPDATE;[R3] database_name:oblog_tt.oblog_db1;[R3] table_name:simple_decimal_int;[R3] log_event:true;[R3] column_count:4;[R3] source_category:SRC_FULL_RECORDED;[R3] source_type:SRC_OCEANBASE_1_0;[R3] has_pk:true;[R3] pk_info:(0);[R3] pks:__pk_increment;[R3] has_uk:false;[R3] uk_info:(null);[R3] uks:(null);[R3] [C1] column_name:__pk_increment;[R3] [C1] column_type:MYSQL_TYPE_LONGLONG;[R3] [C1] column_is_rowkey:true;[R3] [C1] column_is_signed:false;[R3] [C1] column_encoding:binary;[R3] [C1] column_is_not_null:true;[R3] [C1] column_value_new:[3](1);[R3] [C1] column_value_old:[3](1);[R3] [C2] column_name:c0;[R3] [C2] column_type:MYSQL_TYPE_NEWDECIMAL;[R3] [C2] column_is_rowkey:false;[R3] [C2] column_is_signed:true;[R3] [C2] column_encoding:binary;[R3] [C2] column_is_not_null:false;[R3] [C2] column_precision:10;[R3] [C2] column_scale:2;[R3] [C2] column_value_new:[1.20](4);[R3] [C2] column_value_old:[1.20](4);[R3] [C3] column_name:c1;[R3] [C3] column_type:MYSQL_TYPE_NEWDECIMAL;[R3] [C3] column_is_rowkey:false;[R3] [C3] column_is_signed:true;[R3] [C3] column_encoding:binary;[R3] [C3] column_is_not_null:false;[R3] [C3] column_precision:18;[R3] [C3] column_scale:2;[R3] [C3] column_value_new:[100000001.19](12);[R3] [C3] column_value_old:[100000001.19](12);[R3] [C4] column_name:c2;[R3] [C4] column_type:MYSQL_TYPE_NEWDECIMAL;[R3] [C4] column_is_rowkey:false;[R3] [C4] column_is_signed:true;[R3] [C4] column_encoding:binary;[R3] [C4] column_is_not_null:false;[R3] [C4] column_precision:38;[R3] [C4] column_scale:30;[R3] [C4] column_value_new:[1.200000000000000000000000000000](32);[R3] [C4] column_value_old:[1.440000000000000000000000000000](32);$[R4] record_type:UPDATE;[R4] database_name:oblog_tt.oblog_db1;[R4] table_name:simple_decimal_int;[R4] log_event:true;[R4] column_count:4;[R4] source_category:SRC_FULL_RECORDED;[R4] source_type:SRC_OCEANBASE_1_0;[R4] has_pk:true;[R4] pk_info:(0);[R4] pks:__pk_increment;[R4] has_uk:false;[R4] uk_info:(null);[R4] uks:(null);[R4] [C1] column_name:__pk_increment;[R4] [C1] column_type:MYSQL_TYPE_LONGLONG;[R4] [C1] column_is_rowkey:true;[R4] [C1] column_is_signed:false;[R4] [C1] column_encoding:binary;[R4] [C1] column_is_not_null:true;[R4] [C1] column_value_new:[4](1);[R4] [C1] column_value_old:[4](1);[R4] [C2] column_name:c0;[R4] [C2] column_type:MYSQL_TYPE_NEWDECIMAL;[R4] [C2] column_is_rowkey:false;[R4] [C2] column_is_signed:true;[R4] [C2] column_encoding:binary;[R4] [C2] column_is_not_null:false;[R4] [C2] column_precision:10;[R4] [C2] column_scale:2;[R4] [C2] column_value_new:[1.20](4);[R4] [C2] column_value_old:[1.20](4);[R4] [C3] column_name:c1;[R4] [C3] column_type:MYSQL_TYPE_NEWDECIMAL;[R4] [C3] column_is_rowkey:false;[R4] [C3] column_is_signed:true;[R4] [C3] column_encoding:binary;[R4] [C3] column_is_not_null:false;[R4] [C3] column_precision:18;[R4] [C3] column_scale:2;[R4] [C3] column_value_new:[100000001.19](12);[R4] [C3] column_value_old:[100000001.19](12);[R4] [C4] column_name:c2;[R4] [C4] column_type:MYSQL_TYPE_NEWDECIMAL;[R4] [C4] column_is_rowkey:false;[R4] [C4] column_is_signed:true;[R4] [C4] column_encoding:binary;[R4] [C4] column_is_not_null:false;[R4] [C4] column_precision:38;[R4] [C4] column_scale:30;[R4] [C4] column_value_new:[1.200000000000000000000000000000](32);[R4] [C4] column_value_old:[1.440000000000000000000000000000](32);$[R5] record_type:UPDATE;[R5] database_name:oblog_tt.oblog_db1;[R5] table_name:simple_decimal_int;[R5] log_event:true;[R5] column_count:4;[R5] source_category:SRC_FULL_RECORDED;[R5] source_type:SRC_OCEANBASE_1_0;[R5] has_pk:true;[R5] pk_info:(0);[R5] pks:__pk_increment;[R5] has_uk:false;[R5] uk_info:(null);[R5] uks:(null);[R5] [C1] column_name:__pk_increment;[R5] [C1] column_type:MYSQL_TYPE_LONGLONG;[R5] [C1] column_is_rowkey:true;[R5] [C1] column_is_signed:false;[R5] [C1] column_encoding:binary;[R5] [C1] column_is_not_null:true;[R5] [C1] column_value_new:[5](1);[R5] [C1] column_value_old:[5](1);[R5] [C2] column_name:c0;[R5] [C2] column_type:MYSQL_TYPE_NEWDECIMAL;[R5] [C2] column_is_rowkey:false;[R5] [C2] column_is_signed:true;[R5] [C2] column_encoding:binary;[R5] [C2] column_is_not_null:false;[R5] [C2] column_precision:10;[R5] [C2] column_scale:2;[R5] [C2] column_value_new:[1.20](4);[R5] [C2] column_value_old:[1.20](4);[R5] [C3] column_name:c1;[R5] [C3] column_type:MYSQL_TYPE_NEWDECIMAL;[R5] [C3] column_is_rowkey:false;[R5] [C3] column_is_signed:true;[R5] [C3] column_encoding:binary;[R5] [C3] column_is_not_null:false;[R5] [C3] column_precision:18;[R5] [C3] column_scale:2;[R5] [C3] column_value_new:[100000001.19](12);[R5] [C3] column_value_old:[100000001.19](12);[R5] [C4] column_name:c2;[R5] [C4] column_type:MYSQL_TYPE_NEWDECIMAL;[R5] [C4] column_is_rowkey:false;[R5] [C4] column_is_signed:true;[R5] [C4] column_encoding:binary;[R5] [C4] column_is_not_null:false;[R5] [C4] column_precision:38;[R5] [C4] column_scale:30;[R5] [C4] column_value_new:[1.200000000000000000000000000000](32);[R5] [C4] column_value_old:[1.440000000000000000000000000000](32);$[R6] COMMIT;
select * from simple_decimal_int;
c0	c1	c2
1.20	100000001.19	1.200000000000000000000000000000
1.20	100000001.19	1.200000000000000000000000000000
1.20	100000001.19	1.200000000000000000000000000000
1.20	100000001.19	1.200000000000000000000000000000
1.20	100000001.19	1.200000000000000000000000000000
drop table simple_decimal_int;
ob1.oblog.next;
[R0] record_type:EDDL;[R0] db_name:oblog_tt.oblog_db1;[R0] table_name:;[R0] column_count:1;[R0] column_name:ddl;[R0] ddl_stmt_str: DROP TABLE `oblog_db1`.`simple_decimal_int`;[R0] ddl_stmt_len: 43;
create table simple_decimal_int_pk(c1 decimal(20, 10) primary key, c2 decimal(65, 30));
ob1.oblog.next;
[R0] record_type:EDDL;[R0] db_name:oblog_tt.oblog_db1;[R0] table_name:;[R0] column_count:1;[R0] column_name:ddl;[R0] ddl_stmt_str: create table simple_decimal_int_pk(c1 decimal(20, 10) primary key, c2 decimal(65, 30));[R0] ddl_stmt_len: 86;
insert into simple_decimal_int_pk values(1.23, 1);
delete from simple_decimal_int_pk;
insert into simple_decimal_int_pk values(99999999.9999999, 99999999.999999999999999999999999999999);
delete from simple_decimal_int_pk;
insert into simple_decimal_int_pk values(99999999.9999999999999, 99999999.999999999999999999999999999999);
Warnings:
Warning	1265	Data truncated for column 'c1' at row 1
delete from simple_decimal_int_pk;
ob1.oblog.next;
[R0] BEGIN;[R0] org_cluster_id:1;[R1] record_type:INSERT;[R1] database_name:oblog_tt.oblog_db1;[R1] table_name:simple_decimal_int_pk;[R1] log_event:true;[R1] column_count:2;[R1] source_category:SRC_FULL_RECORDED;[R1] source_type:SRC_OCEANBASE_1_0;[R1] has_pk:true;[R1] pk_info:(0);[R1] pks:c1;[R1] has_uk:false;[R1] uk_info:(null);[R1] uks:(null);[R1] [C1] column_name:c1;[R1] [C1] column_type:MYSQL_TYPE_NEWDECIMAL;[R1] [C1] column_is_rowkey:true;[R1] [C1] column_is_signed:true;[R1] [C1] column_encoding:binary;[R1] [C1] column_is_not_null:true;[R1] [C1] column_precision:20;[R1] [C1] column_scale:10;[R1] [C1] column_value_new:[1.2300000000](12);[R1] [C2] column_name:c2;[R1] [C2] column_type:MYSQL_TYPE_NEWDECIMAL;[R1] [C2] column_is_rowkey:false;[R1] [C2] column_is_signed:true;[R1] [C2] column_encoding:binary;[R1] [C2] column_is_not_null:false;[R1] [C2] column_precision:65;[R1] [C2] column_scale:30;[R1] [C2] column_value_new:[1.000000000000000000000000000000](32);$[R2] COMMIT;
ob1.oblog.next;
[R0] BEGIN;[R0] org_cluster_id:1;[R1] record_type:DELETE;[R1] database_name:oblog_tt.oblog_db1;[R1] table_name:simple_decimal_int_pk;[R1] log_event:true;[R1] column_count:2;[R1] source_category:SRC_FULL_RECORDED;[R1] source_type:SRC_OCEANBASE_1_0;[R1] has_pk:true;[R1] pk_info:(0);[R1] pks:c1;[R1] has_uk:false;[R1] uk_info:(null);[R1] uks:(null);[R1] [C1] column_name:c1;[R1] [C1] column_type:MYSQL_TYPE_NEWDECIMAL;[R1] [C1] column_is_rowkey:true;[R1] [C1] column_is_signed:true;[R1] [C1] column_encoding:binary;[R1] [C1] column_is_not_null:true;[R1] [C1] column_precision:20;[R1] [C1] column_scale:10;[R1] [C1] column_value_old:[1.2300000000](12);[R1] [C2] column_name:c2;[R1] [C2] column_type:MYSQL_TYPE_NEWDECIMAL;[R1] [C2] column_is_rowkey:false;[R1] [C2] column_is_signed:true;[R1] [C2] column_encoding:binary;[R1] [C2] column_is_not_null:false;[R1] [C2] column_precision:65;[R1] [C2] column_scale:30;[R1] [C2] column_value_old:[1.000000000000000000000000000000](32);$[R2] COMMIT;
ob1.oblog.next;
[R0] BEGIN;[R0] org_cluster_id:1;[R1] record_type:INSERT;[R1] database_name:oblog_tt.oblog_db1;[R1] table_name:simple_decimal_int_pk;[R1] log_event:true;[R1] column_count:2;[R1] source_category:SRC_FULL_RECORDED;[R1] source_type:SRC_OCEANBASE_1_0;[R1] has_pk:true;[R1] pk_info:(0);[R1] pks:c1;[R1] has_uk:false;[R1] uk_info:(null);[R1] uks:(null);[R1] [C1] column_name:c1;[R1] [C1] column_type:MYSQL_TYPE_NEWDECIMAL;[R1] [C1] column_is_rowkey:true;[R1] [C1] column_is_signed:true;[R1] [C1] column_encoding:binary;[R1] [C1] column_is_not_null:true;[R1] [C1] column_precision:20;[R1] [C1] column_scale:10;[R1] [C1] column_value_new:[99999999.9999999000](19);[R1] [C2] column_name:c2;[R1] [C2] column_type:MYSQL_TYPE_NEWDECIMAL;[R1] [C2] column_is_rowkey:false;[R1] [C2] column_is_signed:true;[R1] [C2] column_encoding:binary;[R1] [C2] column_is_not_null:false;[R1] [C2] column_precision:65;[R1] [C2] column_scale:30;[R1] [C2] column_value_new:[99999999.999999999999999999999999999999](39);$[R2] COMMIT;
ob1.oblog.next;
[R0] BEGIN;[R0] org_cluster_id:1;[R1] record_type:DELETE;[R1] database_name:oblog_tt.oblog_db1;[R1] table_name:simple_decimal_int_pk;[R1] log_event:true;[R1] column_count:2;[R1] source_category:SRC_FULL_RECORDED;[R1] source_type:SRC_OCEANBASE_1_0;[R1] has_pk:true;[R1] pk_info:(0);[R1] pks:c1;[R1] has_uk:false;[R1] uk_info:(null);[R1] uks:(null);[R1] [C1] column_name:c1;[R1] [C1] column_type:MYSQL_TYPE_NEWDECIMAL;[R1] [C1] column_is_rowkey:true;[R1] [C1] column_is_signed:true;[R1] [C1] column_encoding:binary;[R1] [C1] column_is_not_null:true;[R1] [C1] column_precision:20;[R1] [C1] column_scale:10;[R1] [C1] column_value_old:[99999999.9999999000](19);[R1] [C2] column_name:c2;[R1] [C2] column_type:MYSQL_TYPE_NEWDECIMAL;[R1] [C2] column_is_rowkey:false;[R1] [C2] column_is_signed:true;[R1] [C2] column_encoding:binary;[R1] [C2] column_is_not_null:false;[R1] [C2] column_precision:65;[R1] [C2] column_scale:30;[R1] [C2] column_value_old:[99999999.999999999999999999999999999999](39);$[R2] COMMIT;
ob1.oblog.next;
[R0] BEGIN;[R0] org_cluster_id:1;[R1] record_type:INSERT;[R1] database_name:oblog_tt.oblog_db1;[R1] table_name:simple_decimal_int_pk;[R1] log_event:true;[R1] column_count:2;[R1] source_category:SRC_FULL_RECORDED;[R1] source_type:SRC_OCEANBASE_1_0;[R1] has_pk:true;[R1] pk_info:(0);[R1] pks:c1;[R1] has_uk:false;[R1] uk_info:(null);[R1] uks:(null);[R1] [C1] column_name:c1;[R1] [C1] column_type:MYSQL_TYPE_NEWDECIMAL;[R1] [C1] column_is_rowkey:true;[R1] [C1] column_is_signed:true;[R1] [C1] column_encoding:binary;[R1] [C1] column_is_not_null:true;[R1] [C1] column_precision:20;[R1] [C1] column_scale:10;[R1] [C1] column_value_new:[100000000.0000000000](20);[R1] [C2] column_name:c2;[R1] [C2] column_type:MYSQL_TYPE_NEWDECIMAL;[R1] [C2] column_is_rowkey:false;[R1] [C2] column_is_signed:true;[R1] [C2] column_encoding:binary;[R1] [C2] column_is_not_null:false;[R1] [C2] column_precision:65;[R1] [C2] column_scale:30;[R1] [C2] column_value_new:[99999999.999999999999999999999999999999](39);$[R2] COMMIT;
ob1.oblog.next;
[R0] BEGIN;[R0] org_cluster_id:1;[R1] record_type:DELETE;[R1] database_name:oblog_tt.oblog_db1;[R1] table_name:simple_decimal_int_pk;[R1] log_event:true;[R1] column_count:2;[R1] source_category:SRC_FULL_RECORDED;[R1] source_type:SRC_OCEANBASE_1_0;[R1] has_pk:true;[R1] pk_info:(0);[R1] pks:c1;[R1] has_uk:false;[R1] uk_info:(null);[R1] uks:(null);[R1] [C1] column_name:c1;[R1] [C1] column_type:MYSQL_TYPE_NEWDECIMAL;[R1] [C1] column_is_rowkey:true;[R1] [C1] column_is_signed:true;[R1] [C1] column_encoding:binary;[R1] [C1] column_is_not_null:true;[R1] [C1] column_precision:20;[R1] [C1] column_scale:10;[R1] [C1] column_value_old:[100000000.0000000000](20);[R1] [C2] column_name:c2;[R1] [C2] column_type:MYSQL_TYPE_NEWDECIMAL;[R1] [C2] column_is_rowkey:false;[R1] [C2] column_is_signed:true;[R1] [C2] column_encoding:binary;[R1] [C2] column_is_not_null:false;[R1] [C2] column_precision:65;[R1] [C2] column_scale:30;[R1] [C2] column_value_old:[99999999.999999999999999999999999999999](39);$[R2] COMMIT;
ob1.oblog.stop;
ob1.oblog.set_start_tstamp $start_tstamp;
ob1.oblog.gen_conf tb_white_list=oblog_tt.oblog_db1.* log_level=DEBUG;
ob1.oblog.set_extra_argument -i;
ob1.oblog.restart;
ob1.oblog.next;
[R0] BEGIN;[R0] org_cluster_id:1;[R1] record_type:INSERT;[R1] database_name:oblog_tt.oblog_db1;[R1] table_name:simple_decimal_int_pk;[R1] log_event:true;[R1] column_count:2;[R1] source_category:SRC_FULL_RECORDED;[R1] source_type:SRC_OCEANBASE_1_0;[R1] has_pk:true;[R1] pk_info:(0);[R1] pks:c1;[R1] has_uk:false;[R1] uk_info:(null);[R1] uks:(null);[R1] [C1] column_name:c1;[R1] [C1] column_type:MYSQL_TYPE_NEWDECIMAL;[R1] [C1] column_is_rowkey:true;[R1] [C1] column_is_signed:true;[R1] [C1] column_encoding:binary;[R1] [C1] column_is_not_null:true;[R1] [C1] column_precision:20;[R1] [C1] column_scale:10;[R1] [C1] column_value_new:[1.2300000000](12);[R1] [C2] column_name:c2;[R1] [C2] column_type:MYSQL_TYPE_NEWDECIMAL;[R1] [C2] column_is_rowkey:false;[R1] [C2] column_is_signed:true;[R1] [C2] column_encoding:binary;[R1] [C2] column_is_not_null:false;[R1] [C2] column_precision:65;[R1] [C2] column_scale:30;[R1] [C2] column_value_new:[1.000000000000000000000000000000](32);$[R2] COMMIT;
ob1.oblog.next;
[R0] BEGIN;[R0] org_cluster_id:1;[R1] record_type:DELETE;[R1] database_name:oblog_tt.oblog_db1;[R1] table_name:simple_decimal_int_pk;[R1] log_event:true;[R1] column_count:2;[R1] source_category:SRC_FULL_RECORDED;[R1] source_type:SRC_OCEANBASE_1_0;[R1] has_pk:true;[R1] pk_info:(0);[R1] pks:c1;[R1] has_uk:false;[R1] uk_info:(null);[R1] uks:(null);[R1] [C1] column_name:c1;[R1] [C1] column_type:MYSQL_TYPE_NEWDECIMAL;[R1] [C1] column_is_rowkey:true;[R1] [C1] column_is_signed:true;[R1] [C1] column_encoding:binary;[R1] [C1] column_is_not_null:true;[R1] [C1] column_precision:20;[R1] [C1] column_scale:10;[R1] [C1] column_value_old:[1.2300000000](12);[R1] [C2] column_name:c2;[R1] [C2] column_type:MYSQL_TYPE_NEWDECIMAL;[R1] [C2] column_is_rowkey:false;[R1] [C2] column_is_signed:true;[R1] [C2] column_encoding:binary;[R1] [C2] column_is_not_null:false;[R1] [C2] column_precision:65;[R1] [C2] column_scale:30;[R1] [C2] column_value_old:[1.000000000000000000000000000000](32);$[R2] COMMIT;
ob1.oblog.next;
[R0] BEGIN;[R0] org_cluster_id:1;[R1] record_type:INSERT;[R1] database_name:oblog_tt.oblog_db1;[R1] table_name:simple_decimal_int_pk;[R1] log_event:true;[R1] column_count:2;[R1] source_category:SRC_FULL_RECORDED;[R1] source_type:SRC_OCEANBASE_1_0;[R1] has_pk:true;[R1] pk_info:(0);[R1] pks:c1;[R1] has_uk:false;[R1] uk_info:(null);[R1] uks:(null);[R1] [C1] column_name:c1;[R1] [C1] column_type:MYSQL_TYPE_NEWDECIMAL;[R1] [C1] column_is_rowkey:true;[R1] [C1] column_is_signed:true;[R1] [C1] column_encoding:binary;[R1] [C1] column_is_not_null:true;[R1] [C1] column_precision:20;[R1] [C1] column_scale:10;[R1] [C1] column_value_new:[99999999.9999999000](19);[R1] [C2] column_name:c2;[R1] [C2] column_type:MYSQL_TYPE_NEWDECIMAL;[R1] [C2] column_is_rowkey:false;[R1] [C2] column_is_signed:true;[R1] [C2] column_encoding:binary;[R1] [C2] column_is_not_null:false;[R1] [C2] column_precision:65;[R1] [C2] column_scale:30;[R1] [C2] column_value_new:[99999999.999999999999999999999999999999](39);$[R2] COMMIT;
ob1.oblog.next;
[R0] BEGIN;[R0] org_cluster_id:1;[R1] record_type:DELETE;[R1] database_name:oblog_tt.oblog_db1;[R1] table_name:simple_decimal_int_pk;[R1] log_event:true;[R1] column_count:2;[R1] source_category:SRC_FULL_RECORDED;[R1] source_type:SRC_OCEANBASE_1_0;[R1] has_pk:true;[R1] pk_info:(0);[R1] pks:c1;[R1] has_uk:false;[R1] uk_info:(null);[R1] uks:(null);[R1] [C1] column_name:c1;[R1] [C1] column_type:MYSQL_TYPE_NEWDECIMAL;[R1] [C1] column_is_rowkey:true;[R1] [C1] column_is_signed:true;[R1] [C1] column_encoding:binary;[R1] [C1] column_is_not_null:true;[R1] [C1] column_precision:20;[R1] [C1] column_scale:10;[R1] [C1] column_value_old:[99999999.9999999000](19);[R1] [C2] column_name:c2;[R1] [C2] column_type:MYSQL_TYPE_NEWDECIMAL;[R1] [C2] column_is_rowkey:false;[R1] [C2] column_is_signed:true;[R1] [C2] column_encoding:binary;[R1] [C2] column_is_not_null:false;[R1] [C2] column_precision:65;[R1] [C2] column_scale:30;[R1] [C2] column_value_old:[99999999.999999999999999999999999999999](39);$[R2] COMMIT;
ob1.oblog.next;
[R0] BEGIN;[R0] org_cluster_id:1;[R1] record_type:INSERT;[R1] database_name:oblog_tt.oblog_db1;[R1] table_name:simple_decimal_int_pk;[R1] log_event:true;[R1] column_count:2;[R1] source_category:SRC_FULL_RECORDED;[R1] source_type:SRC_OCEANBASE_1_0;[R1] has_pk:true;[R1] pk_info:(0);[R1] pks:c1;[R1] has_uk:false;[R1] uk_info:(null);[R1] uks:(null);[R1] [C1] column_name:c1;[R1] [C1] column_type:MYSQL_TYPE_NEWDECIMAL;[R1] [C1] column_is_rowkey:true;[R1] [C1] column_is_signed:true;[R1] [C1] column_encoding:binary;[R1] [C1] column_is_not_null:true;[R1] [C1] column_precision:20;[R1] [C1] column_scale:10;[R1] [C1] column_value_new:[100000000.0000000000](20);[R1] [C2] column_name:c2;[R1] [C2] column_type:MYSQL_TYPE_NEWDECIMAL;[R1] [C2] column_is_rowkey:false;[R1] [C2] column_is_signed:true;[R1] [C2] column_encoding:binary;[R1] [C2] column_is_not_null:false;[R1] [C2] column_precision:65;[R1] [C2] column_scale:30;[R1] [C2] column_value_new:[99999999.999999999999999999999999999999](39);$[R2] COMMIT;
ob1.oblog.next;
[R0] BEGIN;[R0] org_cluster_id:1;[R1] record_type:DELETE;[R1] database_name:oblog_tt.oblog_db1;[R1] table_name:simple_decimal_int_pk;[R1] log_event:true;[R1] column_count:2;[R1] source_category:SRC_FULL_RECORDED;[R1] source_type:SRC_OCEANBASE_1_0;[R1] has_pk:true;[R1] pk_info:(0);[R1] pks:c1;[R1] has_uk:false;[R1] uk_info:(null);[R1] uks:(null);[R1] [C1] column_name:c1;[R1] [C1] column_type:MYSQL_TYPE_NEWDECIMAL;[R1] [C1] column_is_rowkey:true;[R1] [C1] column_is_signed:true;[R1] [C1] column_encoding:binary;[R1] [C1] column_is_not_null:true;[R1] [C1] column_precision:20;[R1] [C1] column_scale:10;[R1] [C1] column_value_old:[100000000.0000000000](20);[R1] [C2] column_name:c2;[R1] [C2] column_type:MYSQL_TYPE_NEWDECIMAL;[R1] [C2] column_is_rowkey:false;[R1] [C2] column_is_signed:true;[R1] [C2] column_encoding:binary;[R1] [C2] column_is_not_null:false;[R1] [C2] column_precision:65;[R1] [C2] column_scale:30;[R1] [C2] column_value_old:[99999999.999999999999999999999999999999](39);$[R2] COMMIT;
ob1.oblog.stop;
