ob1=OBI(cluster=1, init_unit_cpu=5);
ob1.reboot;
ob1.create_client;
create resource unit oblog_box max_cpu 2, memory_size='20G';
create resource pool oblog_pool unit = 'oblog_box', unit_num = 1, zone_list = ('z1');
create tenant oblog_tt replica_num = 1, primary_zone='z1', resource_pool_list=('oblog_pool') set ob_tcp_invited_nodes='%';
drop database if exists oblog_db1;
ob1.oblog.set_start_tstamp $start_tstamp;
ob1.oblog.gen_conf tb_white_list=oblog_tt.oblog*.* log_level=DEBUG skip_ob_version_compat_check=1;
ob1.oblog.set_extra_argument -i;
ob1.oblog.restart;
set sql_mode ='';
create database oblog_db1;
ob1.oblog.next;
[R0] record_type:EDDL;[R0] db_name:oblog_tt;[R0] table_name:;[R0] column_count:1;[R0] column_name:ddl;[R0] ddl_stmt_str: create database oblog_db1;[R0] ddl_stmt_len: 25;
use oblog_db1;
create table t_tmp(c1 int primary key, c2 char(12));
ob1.oblog.next;
[R0] record_type:EDDL;[R0] db_name:oblog_tt.oblog_db1;[R0] table_name:;[R0] column_count:1;[R0] column_name:ddl;[R0] ddl_stmt_str: create table t_tmp(c1 int primary key, c2 char(12));[R0] ddl_stmt_len: 51;
insert into t_tmp values(1, '1');
ob1.oblog.next;
[R0] BEGIN;[R0] org_cluster_id:1;[R1] record_type:INSERT;[R1] database_name:oblog_tt.oblog_db1;[R1] table_name:t_tmp;[R1] log_event:true;[R1] column_count:2;[R1] source_category:SRC_FULL_RECORDED;[R1] source_type:SRC_OCEANBASE_1_0;[R1] has_pk:true;[R1] pk_info:(0);[R1] pks:c1;[R1] has_uk:false;[R1] uk_info:(null);[R1] uks:(null);[R1] [C1] column_name:c1;[R1] [C1] column_type:MYSQL_TYPE_LONG;[R1] [C1] column_is_rowkey:true;[R1] [C1] column_is_signed:true;[R1] [C1] column_encoding:binary;[R1] [C1] column_is_not_null:true;[R1] [C1] column_value_new:[1](1);[R1] [C2] column_name:c2;[R1] [C2] column_type:MYSQL_TYPE_STRING;[R1] [C2] column_is_rowkey:false;[R1] [C2] column_is_signed:true;[R1] [C2] column_encoding:utf8mb4;[R1] [C2] column_is_not_null:false;[R1] [C2] column_value_new:[1](1);$[R2] COMMIT;
insert into t_tmp values(2, 'a');
ob1.oblog.next;
[R0] BEGIN;[R0] org_cluster_id:1;[R1] record_type:INSERT;[R1] database_name:oblog_tt.oblog_db1;[R1] table_name:t_tmp;[R1] log_event:true;[R1] column_count:2;[R1] source_category:SRC_FULL_RECORDED;[R1] source_type:SRC_OCEANBASE_1_0;[R1] has_pk:true;[R1] pk_info:(0);[R1] pks:c1;[R1] has_uk:false;[R1] uk_info:(null);[R1] uks:(null);[R1] [C1] column_name:c1;[R1] [C1] column_type:MYSQL_TYPE_LONG;[R1] [C1] column_is_rowkey:true;[R1] [C1] column_is_signed:true;[R1] [C1] column_encoding:binary;[R1] [C1] column_is_not_null:true;[R1] [C1] column_value_new:[2](1);[R1] [C2] column_name:c2;[R1] [C2] column_type:MYSQL_TYPE_STRING;[R1] [C2] column_is_rowkey:false;[R1] [C2] column_is_signed:true;[R1] [C2] column_encoding:utf8mb4;[R1] [C2] column_is_not_null:false;[R1] [C2] column_value_new:[a](1);$[R2] COMMIT;
insert into t_tmp values(3, '');
ob1.oblog.next;
[R0] BEGIN;[R0] org_cluster_id:1;[R1] record_type:INSERT;[R1] database_name:oblog_tt.oblog_db1;[R1] table_name:t_tmp;[R1] log_event:true;[R1] column_count:2;[R1] source_category:SRC_FULL_RECORDED;[R1] source_type:SRC_OCEANBASE_1_0;[R1] has_pk:true;[R1] pk_info:(0);[R1] pks:c1;[R1] has_uk:false;[R1] uk_info:(null);[R1] uks:(null);[R1] [C1] column_name:c1;[R1] [C1] column_type:MYSQL_TYPE_LONG;[R1] [C1] column_is_rowkey:true;[R1] [C1] column_is_signed:true;[R1] [C1] column_encoding:binary;[R1] [C1] column_is_not_null:true;[R1] [C1] column_value_new:[3](1);[R1] [C2] column_name:c2;[R1] [C2] column_type:MYSQL_TYPE_STRING;[R1] [C2] column_is_rowkey:false;[R1] [C2] column_is_signed:true;[R1] [C2] column_encoding:utf8mb4;[R1] [C2] column_is_not_null:false;[R1] [C2] column_value_new:[](0);$[R2] COMMIT;
insert into t_tmp values(4, NULL);
ob1.oblog.next;
[R0] BEGIN;[R0] org_cluster_id:1;[R1] record_type:INSERT;[R1] database_name:oblog_tt.oblog_db1;[R1] table_name:t_tmp;[R1] log_event:true;[R1] column_count:2;[R1] source_category:SRC_FULL_RECORDED;[R1] source_type:SRC_OCEANBASE_1_0;[R1] has_pk:true;[R1] pk_info:(0);[R1] pks:c1;[R1] has_uk:false;[R1] uk_info:(null);[R1] uks:(null);[R1] [C1] column_name:c1;[R1] [C1] column_type:MYSQL_TYPE_LONG;[R1] [C1] column_is_rowkey:true;[R1] [C1] column_is_signed:true;[R1] [C1] column_encoding:binary;[R1] [C1] column_is_not_null:true;[R1] [C1] column_value_new:[4](1);[R1] [C2] column_name:c2;[R1] [C2] column_type:MYSQL_TYPE_STRING;[R1] [C2] column_is_rowkey:false;[R1] [C2] column_is_signed:true;[R1] [C2] column_encoding:utf8mb4;[R1] [C2] column_is_not_null:false;[R1] [C2] column_value_new:[NULL](0);$[R2] COMMIT;
create table t_enum(c1 int primary key, c2 enum('a', 'b', 'c'));
ob1.oblog.next;
[R0] record_type:EDDL;[R0] db_name:oblog_tt.oblog_db1;[R0] table_name:;[R0] column_count:1;[R0] column_name:ddl;[R0] ddl_stmt_str: create table t_enum(c1 int primary key, c2 enum('a', 'b', 'c'));[R0] ddl_stmt_len: 63;
insert into t_enum values(1, 1);
ob1.oblog.next;
[R0] BEGIN;[R0] org_cluster_id:1;[R1] record_type:INSERT;[R1] database_name:oblog_tt.oblog_db1;[R1] table_name:t_enum;[R1] log_event:true;[R1] column_count:2;[R1] source_category:SRC_FULL_RECORDED;[R1] source_type:SRC_OCEANBASE_1_0;[R1] has_pk:true;[R1] pk_info:(0);[R1] pks:c1;[R1] has_uk:false;[R1] uk_info:(null);[R1] uks:(null);[R1] [C1] column_name:c1;[R1] [C1] column_type:MYSQL_TYPE_LONG;[R1] [C1] column_is_rowkey:true;[R1] [C1] column_is_signed:true;[R1] [C1] column_encoding:binary;[R1] [C1] column_is_not_null:true;[R1] [C1] column_value_new:[1](1);[R1] [C2] column_name:c2;[R1] [C2] column_type:MYSQL_TYPE_ENUM;[R1] [C2] column_is_rowkey:false;[R1] [C2] column_is_signed:true;[R1] [C2] column_encoding:utf8mb4;[R1] [C2] column_is_not_null:false;[R1] [C2] column_extend_info:a,b,c;[R1] [C2] column_value_new:[a](1);$[R2] COMMIT;
insert into t_enum values(2, 'a');
ob1.oblog.next;
[R0] BEGIN;[R0] org_cluster_id:1;[R1] record_type:INSERT;[R1] database_name:oblog_tt.oblog_db1;[R1] table_name:t_enum;[R1] log_event:true;[R1] column_count:2;[R1] source_category:SRC_FULL_RECORDED;[R1] source_type:SRC_OCEANBASE_1_0;[R1] has_pk:true;[R1] pk_info:(0);[R1] pks:c1;[R1] has_uk:false;[R1] uk_info:(null);[R1] uks:(null);[R1] [C1] column_name:c1;[R1] [C1] column_type:MYSQL_TYPE_LONG;[R1] [C1] column_is_rowkey:true;[R1] [C1] column_is_signed:true;[R1] [C1] column_encoding:binary;[R1] [C1] column_is_not_null:true;[R1] [C1] column_value_new:[2](1);[R1] [C2] column_name:c2;[R1] [C2] column_type:MYSQL_TYPE_ENUM;[R1] [C2] column_is_rowkey:false;[R1] [C2] column_is_signed:true;[R1] [C2] column_encoding:utf8mb4;[R1] [C2] column_is_not_null:false;[R1] [C2] column_extend_info:a,b,c;[R1] [C2] column_value_new:[a](1);$[R2] COMMIT;
insert into t_enum values(3, 0);
ob1.oblog.next;
[R0] BEGIN;[R0] org_cluster_id:1;[R1] record_type:INSERT;[R1] database_name:oblog_tt.oblog_db1;[R1] table_name:t_enum;[R1] log_event:true;[R1] column_count:2;[R1] source_category:SRC_FULL_RECORDED;[R1] source_type:SRC_OCEANBASE_1_0;[R1] has_pk:true;[R1] pk_info:(0);[R1] pks:c1;[R1] has_uk:false;[R1] uk_info:(null);[R1] uks:(null);[R1] [C1] column_name:c1;[R1] [C1] column_type:MYSQL_TYPE_LONG;[R1] [C1] column_is_rowkey:true;[R1] [C1] column_is_signed:true;[R1] [C1] column_encoding:binary;[R1] [C1] column_is_not_null:true;[R1] [C1] column_value_new:[3](1);[R1] [C2] column_name:c2;[R1] [C2] column_type:MYSQL_TYPE_ENUM;[R1] [C2] column_is_rowkey:false;[R1] [C2] column_is_signed:true;[R1] [C2] column_encoding:utf8mb4;[R1] [C2] column_is_not_null:false;[R1] [C2] column_extend_info:a,b,c;[R1] [C2] column_value_new:[](0);$[R2] COMMIT;
insert into t_enum values(4, "invalid");
ob1.oblog.next;
[R0] BEGIN;[R0] org_cluster_id:1;[R1] record_type:INSERT;[R1] database_name:oblog_tt.oblog_db1;[R1] table_name:t_enum;[R1] log_event:true;[R1] column_count:2;[R1] source_category:SRC_FULL_RECORDED;[R1] source_type:SRC_OCEANBASE_1_0;[R1] has_pk:true;[R1] pk_info:(0);[R1] pks:c1;[R1] has_uk:false;[R1] uk_info:(null);[R1] uks:(null);[R1] [C1] column_name:c1;[R1] [C1] column_type:MYSQL_TYPE_LONG;[R1] [C1] column_is_rowkey:true;[R1] [C1] column_is_signed:true;[R1] [C1] column_encoding:binary;[R1] [C1] column_is_not_null:true;[R1] [C1] column_value_new:[4](1);[R1] [C2] column_name:c2;[R1] [C2] column_type:MYSQL_TYPE_ENUM;[R1] [C2] column_is_rowkey:false;[R1] [C2] column_is_signed:true;[R1] [C2] column_encoding:utf8mb4;[R1] [C2] column_is_not_null:false;[R1] [C2] column_extend_info:a,b,c;[R1] [C2] column_value_new:[](0);$[R2] COMMIT;
insert into t_enum values(5, null);
ob1.oblog.next;
[R0] BEGIN;[R0] org_cluster_id:1;[R1] record_type:INSERT;[R1] database_name:oblog_tt.oblog_db1;[R1] table_name:t_enum;[R1] log_event:true;[R1] column_count:2;[R1] source_category:SRC_FULL_RECORDED;[R1] source_type:SRC_OCEANBASE_1_0;[R1] has_pk:true;[R1] pk_info:(0);[R1] pks:c1;[R1] has_uk:false;[R1] uk_info:(null);[R1] uks:(null);[R1] [C1] column_name:c1;[R1] [C1] column_type:MYSQL_TYPE_LONG;[R1] [C1] column_is_rowkey:true;[R1] [C1] column_is_signed:true;[R1] [C1] column_encoding:binary;[R1] [C1] column_is_not_null:true;[R1] [C1] column_value_new:[5](1);[R1] [C2] column_name:c2;[R1] [C2] column_type:MYSQL_TYPE_ENUM;[R1] [C2] column_is_rowkey:false;[R1] [C2] column_is_signed:true;[R1] [C2] column_encoding:utf8mb4;[R1] [C2] column_is_not_null:false;[R1] [C2] column_extend_info:a,b,c;[R1] [C2] column_value_new:[NULL](0);$[R2] COMMIT;
select c1, c2, c2+1-1 from t_enum;
c1	c2	c2+1-1
1	a	1
2	a	1
3		0
4		0
5	NULL	NULL
insert into t_enum values (6, 'a'), (7, 'invalid'), (8, NULL);
ob1.oblog.next;
[R0] BEGIN;[R0] org_cluster_id:1;[R1] record_type:INSERT;[R1] database_name:oblog_tt.oblog_db1;[R1] table_name:t_enum;[R1] log_event:true;[R1] column_count:2;[R1] source_category:SRC_FULL_RECORDED;[R1] source_type:SRC_OCEANBASE_1_0;[R1] has_pk:true;[R1] pk_info:(0);[R1] pks:c1;[R1] has_uk:false;[R1] uk_info:(null);[R1] uks:(null);[R1] [C1] column_name:c1;[R1] [C1] column_type:MYSQL_TYPE_LONG;[R1] [C1] column_is_rowkey:true;[R1] [C1] column_is_signed:true;[R1] [C1] column_encoding:binary;[R1] [C1] column_is_not_null:true;[R1] [C1] column_value_new:[6](1);[R1] [C2] column_name:c2;[R1] [C2] column_type:MYSQL_TYPE_ENUM;[R1] [C2] column_is_rowkey:false;[R1] [C2] column_is_signed:true;[R1] [C2] column_encoding:utf8mb4;[R1] [C2] column_is_not_null:false;[R1] [C2] column_extend_info:a,b,c;[R1] [C2] column_value_new:[a](1);$[R2] record_type:INSERT;[R2] database_name:oblog_tt.oblog_db1;[R2] table_name:t_enum;[R2] log_event:true;[R2] column_count:2;[R2] source_category:SRC_FULL_RECORDED;[R2] source_type:SRC_OCEANBASE_1_0;[R2] has_pk:true;[R2] pk_info:(0);[R2] pks:c1;[R2] has_uk:false;[R2] uk_info:(null);[R2] uks:(null);[R2] [C1] column_name:c1;[R2] [C1] column_type:MYSQL_TYPE_LONG;[R2] [C1] column_is_rowkey:true;[R2] [C1] column_is_signed:true;[R2] [C1] column_encoding:binary;[R2] [C1] column_is_not_null:true;[R2] [C1] column_value_new:[7](1);[R2] [C2] column_name:c2;[R2] [C2] column_type:MYSQL_TYPE_ENUM;[R2] [C2] column_is_rowkey:false;[R2] [C2] column_is_signed:true;[R2] [C2] column_encoding:utf8mb4;[R2] [C2] column_is_not_null:false;[R2] [C2] column_extend_info:a,b,c;[R2] [C2] column_value_new:[](0);$[R3] record_type:INSERT;[R3] database_name:oblog_tt.oblog_db1;[R3] table_name:t_enum;[R3] log_event:true;[R3] column_count:2;[R3] source_category:SRC_FULL_RECORDED;[R3] source_type:SRC_OCEANBASE_1_0;[R3] has_pk:true;[R3] pk_info:(0);[R3] pks:c1;[R3] has_uk:false;[R3] uk_info:(null);[R3] uks:(null);[R3] [C1] column_name:c1;[R3] [C1] column_type:MYSQL_TYPE_LONG;[R3] [C1] column_is_rowkey:true;[R3] [C1] column_is_signed:true;[R3] [C1] column_encoding:binary;[R3] [C1] column_is_not_null:true;[R3] [C1] column_value_new:[8](1);[R3] [C2] column_name:c2;[R3] [C2] column_type:MYSQL_TYPE_ENUM;[R3] [C2] column_is_rowkey:false;[R3] [C2] column_is_signed:true;[R3] [C2] column_encoding:utf8mb4;[R3] [C2] column_is_not_null:false;[R3] [C2] column_extend_info:a,b,c;[R3] [C2] column_value_new:[NULL](0);$[R4] COMMIT;
select c1, c2, c2+1-1 from t_enum;
c1	c2	c2+1-1
1	a	1
2	a	1
3		0
4		0
5	NULL	NULL
6	a	1
7		0
8	NULL	NULL
create table t_enum2(c1 enum('a', 'b', 'c') primary key, c2 int );
ob1.oblog.next;
[R0] record_type:EDDL;[R0] db_name:oblog_tt.oblog_db1;[R0] table_name:;[R0] column_count:1;[R0] column_name:ddl;[R0] ddl_stmt_str: create table t_enum2(c1 enum('a', 'b', 'c') primary key, c2 int );[R0] ddl_stmt_len: 65;
insert into t_enum2 values('a', 1);
ob1.oblog.next;
[R0] BEGIN;[R0] org_cluster_id:1;[R1] record_type:INSERT;[R1] database_name:oblog_tt.oblog_db1;[R1] table_name:t_enum2;[R1] log_event:true;[R1] column_count:2;[R1] source_category:SRC_FULL_RECORDED;[R1] source_type:SRC_OCEANBASE_1_0;[R1] has_pk:true;[R1] pk_info:(0);[R1] pks:c1;[R1] has_uk:false;[R1] uk_info:(null);[R1] uks:(null);[R1] [C1] column_name:c1;[R1] [C1] column_type:MYSQL_TYPE_ENUM;[R1] [C1] column_is_rowkey:true;[R1] [C1] column_is_signed:true;[R1] [C1] column_encoding:utf8mb4;[R1] [C1] column_is_not_null:true;[R1] [C1] column_extend_info:a,b,c;[R1] [C1] column_value_new:[a](1);[R1] [C2] column_name:c2;[R1] [C2] column_type:MYSQL_TYPE_LONG;[R1] [C2] column_is_rowkey:false;[R1] [C2] column_is_signed:true;[R1] [C2] column_encoding:binary;[R1] [C2] column_is_not_null:false;[R1] [C2] column_value_new:[1](1);$[R2] COMMIT;
insert into t_enum2 values(2, 2);
ob1.oblog.next;
[R0] BEGIN;[R0] org_cluster_id:1;[R1] record_type:INSERT;[R1] database_name:oblog_tt.oblog_db1;[R1] table_name:t_enum2;[R1] log_event:true;[R1] column_count:2;[R1] source_category:SRC_FULL_RECORDED;[R1] source_type:SRC_OCEANBASE_1_0;[R1] has_pk:true;[R1] pk_info:(0);[R1] pks:c1;[R1] has_uk:false;[R1] uk_info:(null);[R1] uks:(null);[R1] [C1] column_name:c1;[R1] [C1] column_type:MYSQL_TYPE_ENUM;[R1] [C1] column_is_rowkey:true;[R1] [C1] column_is_signed:true;[R1] [C1] column_encoding:utf8mb4;[R1] [C1] column_is_not_null:true;[R1] [C1] column_extend_info:a,b,c;[R1] [C1] column_value_new:[b](1);[R1] [C2] column_name:c2;[R1] [C2] column_type:MYSQL_TYPE_LONG;[R1] [C2] column_is_rowkey:false;[R1] [C2] column_is_signed:true;[R1] [C2] column_encoding:binary;[R1] [C2] column_is_not_null:false;[R1] [C2] column_value_new:[2](1);$[R2] COMMIT;
insert into t_enum2 values('c', 3);
ob1.oblog.next;
[R0] BEGIN;[R0] org_cluster_id:1;[R1] record_type:INSERT;[R1] database_name:oblog_tt.oblog_db1;[R1] table_name:t_enum2;[R1] log_event:true;[R1] column_count:2;[R1] source_category:SRC_FULL_RECORDED;[R1] source_type:SRC_OCEANBASE_1_0;[R1] has_pk:true;[R1] pk_info:(0);[R1] pks:c1;[R1] has_uk:false;[R1] uk_info:(null);[R1] uks:(null);[R1] [C1] column_name:c1;[R1] [C1] column_type:MYSQL_TYPE_ENUM;[R1] [C1] column_is_rowkey:true;[R1] [C1] column_is_signed:true;[R1] [C1] column_encoding:utf8mb4;[R1] [C1] column_is_not_null:true;[R1] [C1] column_extend_info:a,b,c;[R1] [C1] column_value_new:[c](1);[R1] [C2] column_name:c2;[R1] [C2] column_type:MYSQL_TYPE_LONG;[R1] [C2] column_is_rowkey:false;[R1] [C2] column_is_signed:true;[R1] [C2] column_encoding:binary;[R1] [C2] column_is_not_null:false;[R1] [C2] column_value_new:[3](1);$[R2] COMMIT;
insert into t_enum2 values('invald', 4);
ob1.oblog.next;
[R0] BEGIN;[R0] org_cluster_id:1;[R1] record_type:INSERT;[R1] database_name:oblog_tt.oblog_db1;[R1] table_name:t_enum2;[R1] log_event:true;[R1] column_count:2;[R1] source_category:SRC_FULL_RECORDED;[R1] source_type:SRC_OCEANBASE_1_0;[R1] has_pk:true;[R1] pk_info:(0);[R1] pks:c1;[R1] has_uk:false;[R1] uk_info:(null);[R1] uks:(null);[R1] [C1] column_name:c1;[R1] [C1] column_type:MYSQL_TYPE_ENUM;[R1] [C1] column_is_rowkey:true;[R1] [C1] column_is_signed:true;[R1] [C1] column_encoding:utf8mb4;[R1] [C1] column_is_not_null:true;[R1] [C1] column_extend_info:a,b,c;[R1] [C1] column_value_new:[](0);[R1] [C2] column_name:c2;[R1] [C2] column_type:MYSQL_TYPE_LONG;[R1] [C2] column_is_rowkey:false;[R1] [C2] column_is_signed:true;[R1] [C2] column_encoding:binary;[R1] [C2] column_is_not_null:false;[R1] [C2] column_value_new:[4](1);$[R2] COMMIT;
select c2, c1, c1+1-1 from t_enum2;
c2	c1	c1+1-1
4		0
1	a	1
2	b	2
3	c	3
create table t_set(c1 int primary key, c2 set('a', 'b', 'c'));
ob1.oblog.next;
[R0] record_type:EDDL;[R0] db_name:oblog_tt.oblog_db1;[R0] table_name:;[R0] column_count:1;[R0] column_name:ddl;[R0] ddl_stmt_str: create table t_set(c1 int primary key, c2 set('a', 'b', 'c'));[R0] ddl_stmt_len: 61;
insert into t_set values(1, 1);
ob1.oblog.next;
[R0] BEGIN;[R0] org_cluster_id:1;[R1] record_type:INSERT;[R1] database_name:oblog_tt.oblog_db1;[R1] table_name:t_set;[R1] log_event:true;[R1] column_count:2;[R1] source_category:SRC_FULL_RECORDED;[R1] source_type:SRC_OCEANBASE_1_0;[R1] has_pk:true;[R1] pk_info:(0);[R1] pks:c1;[R1] has_uk:false;[R1] uk_info:(null);[R1] uks:(null);[R1] [C1] column_name:c1;[R1] [C1] column_type:MYSQL_TYPE_LONG;[R1] [C1] column_is_rowkey:true;[R1] [C1] column_is_signed:true;[R1] [C1] column_encoding:binary;[R1] [C1] column_is_not_null:true;[R1] [C1] column_value_new:[1](1);[R1] [C2] column_name:c2;[R1] [C2] column_type:MYSQL_TYPE_SET;[R1] [C2] column_is_rowkey:false;[R1] [C2] column_is_signed:true;[R1] [C2] column_encoding:utf8mb4;[R1] [C2] column_is_not_null:false;[R1] [C2] column_extend_info:a,b,c;[R1] [C2] column_value_new:[a](1);$[R2] COMMIT;
insert into t_set values(2, "a,c");
ob1.oblog.next;
[R0] BEGIN;[R0] org_cluster_id:1;[R1] record_type:INSERT;[R1] database_name:oblog_tt.oblog_db1;[R1] table_name:t_set;[R1] log_event:true;[R1] column_count:2;[R1] source_category:SRC_FULL_RECORDED;[R1] source_type:SRC_OCEANBASE_1_0;[R1] has_pk:true;[R1] pk_info:(0);[R1] pks:c1;[R1] has_uk:false;[R1] uk_info:(null);[R1] uks:(null);[R1] [C1] column_name:c1;[R1] [C1] column_type:MYSQL_TYPE_LONG;[R1] [C1] column_is_rowkey:true;[R1] [C1] column_is_signed:true;[R1] [C1] column_encoding:binary;[R1] [C1] column_is_not_null:true;[R1] [C1] column_value_new:[2](1);[R1] [C2] column_name:c2;[R1] [C2] column_type:MYSQL_TYPE_SET;[R1] [C2] column_is_rowkey:false;[R1] [C2] column_is_signed:true;[R1] [C2] column_encoding:utf8mb4;[R1] [C2] column_is_not_null:false;[R1] [C2] column_extend_info:a,b,c;[R1] [C2] column_value_new:[a,c](3);$[R2] COMMIT;
insert into t_set values(3, 0);
ob1.oblog.next;
[R0] BEGIN;[R0] org_cluster_id:1;[R1] record_type:INSERT;[R1] database_name:oblog_tt.oblog_db1;[R1] table_name:t_set;[R1] log_event:true;[R1] column_count:2;[R1] source_category:SRC_FULL_RECORDED;[R1] source_type:SRC_OCEANBASE_1_0;[R1] has_pk:true;[R1] pk_info:(0);[R1] pks:c1;[R1] has_uk:false;[R1] uk_info:(null);[R1] uks:(null);[R1] [C1] column_name:c1;[R1] [C1] column_type:MYSQL_TYPE_LONG;[R1] [C1] column_is_rowkey:true;[R1] [C1] column_is_signed:true;[R1] [C1] column_encoding:binary;[R1] [C1] column_is_not_null:true;[R1] [C1] column_value_new:[3](1);[R1] [C2] column_name:c2;[R1] [C2] column_type:MYSQL_TYPE_SET;[R1] [C2] column_is_rowkey:false;[R1] [C2] column_is_signed:true;[R1] [C2] column_encoding:utf8mb4;[R1] [C2] column_is_not_null:false;[R1] [C2] column_extend_info:a,b,c;[R1] [C2] column_value_new:[](0);$[R2] COMMIT;
insert into t_set values(4, "invalid");
ob1.oblog.next;
[R0] BEGIN;[R0] org_cluster_id:1;[R1] record_type:INSERT;[R1] database_name:oblog_tt.oblog_db1;[R1] table_name:t_set;[R1] log_event:true;[R1] column_count:2;[R1] source_category:SRC_FULL_RECORDED;[R1] source_type:SRC_OCEANBASE_1_0;[R1] has_pk:true;[R1] pk_info:(0);[R1] pks:c1;[R1] has_uk:false;[R1] uk_info:(null);[R1] uks:(null);[R1] [C1] column_name:c1;[R1] [C1] column_type:MYSQL_TYPE_LONG;[R1] [C1] column_is_rowkey:true;[R1] [C1] column_is_signed:true;[R1] [C1] column_encoding:binary;[R1] [C1] column_is_not_null:true;[R1] [C1] column_value_new:[4](1);[R1] [C2] column_name:c2;[R1] [C2] column_type:MYSQL_TYPE_SET;[R1] [C2] column_is_rowkey:false;[R1] [C2] column_is_signed:true;[R1] [C2] column_encoding:utf8mb4;[R1] [C2] column_is_not_null:false;[R1] [C2] column_extend_info:a,b,c;[R1] [C2] column_value_new:[](0);$[R2] COMMIT;
insert into t_set values(5, null);
ob1.oblog.next;
[R0] BEGIN;[R0] org_cluster_id:1;[R1] record_type:INSERT;[R1] database_name:oblog_tt.oblog_db1;[R1] table_name:t_set;[R1] log_event:true;[R1] column_count:2;[R1] source_category:SRC_FULL_RECORDED;[R1] source_type:SRC_OCEANBASE_1_0;[R1] has_pk:true;[R1] pk_info:(0);[R1] pks:c1;[R1] has_uk:false;[R1] uk_info:(null);[R1] uks:(null);[R1] [C1] column_name:c1;[R1] [C1] column_type:MYSQL_TYPE_LONG;[R1] [C1] column_is_rowkey:true;[R1] [C1] column_is_signed:true;[R1] [C1] column_encoding:binary;[R1] [C1] column_is_not_null:true;[R1] [C1] column_value_new:[5](1);[R1] [C2] column_name:c2;[R1] [C2] column_type:MYSQL_TYPE_SET;[R1] [C2] column_is_rowkey:false;[R1] [C2] column_is_signed:true;[R1] [C2] column_encoding:utf8mb4;[R1] [C2] column_is_not_null:false;[R1] [C2] column_extend_info:a,b,c;[R1] [C2] column_value_new:[NULL](0);$[R2] COMMIT;
insert into t_set values(6, "a,b,d");
ob1.oblog.next;
[R0] BEGIN;[R0] org_cluster_id:1;[R1] record_type:INSERT;[R1] database_name:oblog_tt.oblog_db1;[R1] table_name:t_set;[R1] log_event:true;[R1] column_count:2;[R1] source_category:SRC_FULL_RECORDED;[R1] source_type:SRC_OCEANBASE_1_0;[R1] has_pk:true;[R1] pk_info:(0);[R1] pks:c1;[R1] has_uk:false;[R1] uk_info:(null);[R1] uks:(null);[R1] [C1] column_name:c1;[R1] [C1] column_type:MYSQL_TYPE_LONG;[R1] [C1] column_is_rowkey:true;[R1] [C1] column_is_signed:true;[R1] [C1] column_encoding:binary;[R1] [C1] column_is_not_null:true;[R1] [C1] column_value_new:[6](1);[R1] [C2] column_name:c2;[R1] [C2] column_type:MYSQL_TYPE_SET;[R1] [C2] column_is_rowkey:false;[R1] [C2] column_is_signed:true;[R1] [C2] column_encoding:utf8mb4;[R1] [C2] column_is_not_null:false;[R1] [C2] column_extend_info:a,b,c;[R1] [C2] column_value_new:[a,b](3);$[R2] COMMIT;
select c1, c2, c2+1-1 from t_set;
c1	c2	c2+1-1
1	a	1
2	a,c	5
3		0
4		0
5	NULL	NULL
6	a,b	3
create table t_set2(c1 set('a', 'b', 'c')  primary key, c2 int);
ob1.oblog.next;
[R0] record_type:EDDL;[R0] db_name:oblog_tt.oblog_db1;[R0] table_name:;[R0] column_count:1;[R0] column_name:ddl;[R0] ddl_stmt_str: create table t_set2(c1 set('a', 'b', 'c')  primary key, c2 int);[R0] ddl_stmt_len: 63;
insert into t_set2 values('a', 1);
ob1.oblog.next;
[R0] BEGIN;[R0] org_cluster_id:1;[R1] record_type:INSERT;[R1] database_name:oblog_tt.oblog_db1;[R1] table_name:t_set2;[R1] log_event:true;[R1] column_count:2;[R1] source_category:SRC_FULL_RECORDED;[R1] source_type:SRC_OCEANBASE_1_0;[R1] has_pk:true;[R1] pk_info:(0);[R1] pks:c1;[R1] has_uk:false;[R1] uk_info:(null);[R1] uks:(null);[R1] [C1] column_name:c1;[R1] [C1] column_type:MYSQL_TYPE_SET;[R1] [C1] column_is_rowkey:true;[R1] [C1] column_is_signed:true;[R1] [C1] column_encoding:utf8mb4;[R1] [C1] column_is_not_null:true;[R1] [C1] column_extend_info:a,b,c;[R1] [C1] column_value_new:[a](1);[R1] [C2] column_name:c2;[R1] [C2] column_type:MYSQL_TYPE_LONG;[R1] [C2] column_is_rowkey:false;[R1] [C2] column_is_signed:true;[R1] [C2] column_encoding:binary;[R1] [C2] column_is_not_null:false;[R1] [C2] column_value_new:[1](1);$[R2] COMMIT;
insert into t_set2 values(3, 2);
ob1.oblog.next;
[R0] BEGIN;[R0] org_cluster_id:1;[R1] record_type:INSERT;[R1] database_name:oblog_tt.oblog_db1;[R1] table_name:t_set2;[R1] log_event:true;[R1] column_count:2;[R1] source_category:SRC_FULL_RECORDED;[R1] source_type:SRC_OCEANBASE_1_0;[R1] has_pk:true;[R1] pk_info:(0);[R1] pks:c1;[R1] has_uk:false;[R1] uk_info:(null);[R1] uks:(null);[R1] [C1] column_name:c1;[R1] [C1] column_type:MYSQL_TYPE_SET;[R1] [C1] column_is_rowkey:true;[R1] [C1] column_is_signed:true;[R1] [C1] column_encoding:utf8mb4;[R1] [C1] column_is_not_null:true;[R1] [C1] column_extend_info:a,b,c;[R1] [C1] column_value_new:[a,b](3);[R1] [C2] column_name:c2;[R1] [C2] column_type:MYSQL_TYPE_LONG;[R1] [C2] column_is_rowkey:false;[R1] [C2] column_is_signed:true;[R1] [C2] column_encoding:binary;[R1] [C2] column_is_not_null:false;[R1] [C2] column_value_new:[2](1);$[R2] COMMIT;
insert into t_set2 values('a,b,c', 3);
ob1.oblog.next;
[R0] BEGIN;[R0] org_cluster_id:1;[R1] record_type:INSERT;[R1] database_name:oblog_tt.oblog_db1;[R1] table_name:t_set2;[R1] log_event:true;[R1] column_count:2;[R1] source_category:SRC_FULL_RECORDED;[R1] source_type:SRC_OCEANBASE_1_0;[R1] has_pk:true;[R1] pk_info:(0);[R1] pks:c1;[R1] has_uk:false;[R1] uk_info:(null);[R1] uks:(null);[R1] [C1] column_name:c1;[R1] [C1] column_type:MYSQL_TYPE_SET;[R1] [C1] column_is_rowkey:true;[R1] [C1] column_is_signed:true;[R1] [C1] column_encoding:utf8mb4;[R1] [C1] column_is_not_null:true;[R1] [C1] column_extend_info:a,b,c;[R1] [C1] column_value_new:[a,b,c](5);[R1] [C2] column_name:c2;[R1] [C2] column_type:MYSQL_TYPE_LONG;[R1] [C2] column_is_rowkey:false;[R1] [C2] column_is_signed:true;[R1] [C2] column_encoding:binary;[R1] [C2] column_is_not_null:false;[R1] [C2] column_value_new:[3](1);$[R2] COMMIT;
insert into t_set2 values('invalid', 4);
ob1.oblog.next;
[R0] BEGIN;[R0] org_cluster_id:1;[R1] record_type:INSERT;[R1] database_name:oblog_tt.oblog_db1;[R1] table_name:t_set2;[R1] log_event:true;[R1] column_count:2;[R1] source_category:SRC_FULL_RECORDED;[R1] source_type:SRC_OCEANBASE_1_0;[R1] has_pk:true;[R1] pk_info:(0);[R1] pks:c1;[R1] has_uk:false;[R1] uk_info:(null);[R1] uks:(null);[R1] [C1] column_name:c1;[R1] [C1] column_type:MYSQL_TYPE_SET;[R1] [C1] column_is_rowkey:true;[R1] [C1] column_is_signed:true;[R1] [C1] column_encoding:utf8mb4;[R1] [C1] column_is_not_null:true;[R1] [C1] column_extend_info:a,b,c;[R1] [C1] column_value_new:[](0);[R1] [C2] column_name:c2;[R1] [C2] column_type:MYSQL_TYPE_LONG;[R1] [C2] column_is_rowkey:false;[R1] [C2] column_is_signed:true;[R1] [C2] column_encoding:binary;[R1] [C2] column_is_not_null:false;[R1] [C2] column_value_new:[4](1);$[R2] COMMIT;
select c2, c1, c1+1-1 from t_set2;
c2	c1	c1+1-1
4		0
1	a	1
2	a,b	3
3	a,b,c	7
create table t_set_enum1(c1 set('a', 'b', 'c', 'd') primary key, c2 enum('a', 'b', 'c', 'd', 'e'), c3 int);
ob1.oblog.next;
[R0] record_type:EDDL;[R0] db_name:oblog_tt.oblog_db1;[R0] table_name:;[R0] column_count:1;[R0] column_name:ddl;[R0] ddl_stmt_str: create table t_set_enum1(c1 set('a', 'b', 'c', 'd') primary key, c2 enum('a', 'b', 'c', 'd', 'e'), c3 int);[R0] ddl_stmt_len: 106;
insert into t_set_enum1 values('a', 'a', 1);
ob1.oblog.next;
[R0] BEGIN;[R0] org_cluster_id:1;[R1] record_type:INSERT;[R1] database_name:oblog_tt.oblog_db1;[R1] table_name:t_set_enum1;[R1] log_event:true;[R1] column_count:3;[R1] source_category:SRC_FULL_RECORDED;[R1] source_type:SRC_OCEANBASE_1_0;[R1] has_pk:true;[R1] pk_info:(0);[R1] pks:c1;[R1] has_uk:false;[R1] uk_info:(null);[R1] uks:(null);[R1] [C1] column_name:c1;[R1] [C1] column_type:MYSQL_TYPE_SET;[R1] [C1] column_is_rowkey:true;[R1] [C1] column_is_signed:true;[R1] [C1] column_encoding:utf8mb4;[R1] [C1] column_is_not_null:true;[R1] [C1] column_extend_info:a,b,c,d;[R1] [C1] column_value_new:[a](1);[R1] [C2] column_name:c2;[R1] [C2] column_type:MYSQL_TYPE_ENUM;[R1] [C2] column_is_rowkey:false;[R1] [C2] column_is_signed:true;[R1] [C2] column_encoding:utf8mb4;[R1] [C2] column_is_not_null:false;[R1] [C2] column_extend_info:a,b,c,d,e;[R1] [C2] column_value_new:[a](1);[R1] [C3] column_name:c3;[R1] [C3] column_type:MYSQL_TYPE_LONG;[R1] [C3] column_is_rowkey:false;[R1] [C3] column_is_signed:true;[R1] [C3] column_encoding:binary;[R1] [C3] column_is_not_null:false;[R1] [C3] column_value_new:[1](1);$[R2] COMMIT;
insert into t_set_enum1 values('b', 5, 1);
ob1.oblog.next;
[R0] BEGIN;[R0] org_cluster_id:1;[R1] record_type:INSERT;[R1] database_name:oblog_tt.oblog_db1;[R1] table_name:t_set_enum1;[R1] log_event:true;[R1] column_count:3;[R1] source_category:SRC_FULL_RECORDED;[R1] source_type:SRC_OCEANBASE_1_0;[R1] has_pk:true;[R1] pk_info:(0);[R1] pks:c1;[R1] has_uk:false;[R1] uk_info:(null);[R1] uks:(null);[R1] [C1] column_name:c1;[R1] [C1] column_type:MYSQL_TYPE_SET;[R1] [C1] column_is_rowkey:true;[R1] [C1] column_is_signed:true;[R1] [C1] column_encoding:utf8mb4;[R1] [C1] column_is_not_null:true;[R1] [C1] column_extend_info:a,b,c,d;[R1] [C1] column_value_new:[b](1);[R1] [C2] column_name:c2;[R1] [C2] column_type:MYSQL_TYPE_ENUM;[R1] [C2] column_is_rowkey:false;[R1] [C2] column_is_signed:true;[R1] [C2] column_encoding:utf8mb4;[R1] [C2] column_is_not_null:false;[R1] [C2] column_extend_info:a,b,c,d,e;[R1] [C2] column_value_new:[e](1);[R1] [C3] column_name:c3;[R1] [C3] column_type:MYSQL_TYPE_LONG;[R1] [C3] column_is_rowkey:false;[R1] [C3] column_is_signed:true;[R1] [C3] column_encoding:binary;[R1] [C3] column_is_not_null:false;[R1] [C3] column_value_new:[1](1);$[R2] COMMIT;
insert into t_set_enum1 values('a,b', null, 2);
ob1.oblog.next;
[R0] BEGIN;[R0] org_cluster_id:1;[R1] record_type:INSERT;[R1] database_name:oblog_tt.oblog_db1;[R1] table_name:t_set_enum1;[R1] log_event:true;[R1] column_count:3;[R1] source_category:SRC_FULL_RECORDED;[R1] source_type:SRC_OCEANBASE_1_0;[R1] has_pk:true;[R1] pk_info:(0);[R1] pks:c1;[R1] has_uk:false;[R1] uk_info:(null);[R1] uks:(null);[R1] [C1] column_name:c1;[R1] [C1] column_type:MYSQL_TYPE_SET;[R1] [C1] column_is_rowkey:true;[R1] [C1] column_is_signed:true;[R1] [C1] column_encoding:utf8mb4;[R1] [C1] column_is_not_null:true;[R1] [C1] column_extend_info:a,b,c,d;[R1] [C1] column_value_new:[a,b](3);[R1] [C2] column_name:c2;[R1] [C2] column_type:MYSQL_TYPE_ENUM;[R1] [C2] column_is_rowkey:false;[R1] [C2] column_is_signed:true;[R1] [C2] column_encoding:utf8mb4;[R1] [C2] column_is_not_null:false;[R1] [C2] column_extend_info:a,b,c,d,e;[R1] [C2] column_value_new:[NULL](0);[R1] [C3] column_name:c3;[R1] [C3] column_type:MYSQL_TYPE_LONG;[R1] [C3] column_is_rowkey:false;[R1] [C3] column_is_signed:true;[R1] [C3] column_encoding:binary;[R1] [C3] column_is_not_null:false;[R1] [C3] column_value_new:[2](1);$[R2] COMMIT;
insert into t_set_enum1 values('invalid', 'd', 3);
ob1.oblog.next;
[R0] BEGIN;[R0] org_cluster_id:1;[R1] record_type:INSERT;[R1] database_name:oblog_tt.oblog_db1;[R1] table_name:t_set_enum1;[R1] log_event:true;[R1] column_count:3;[R1] source_category:SRC_FULL_RECORDED;[R1] source_type:SRC_OCEANBASE_1_0;[R1] has_pk:true;[R1] pk_info:(0);[R1] pks:c1;[R1] has_uk:false;[R1] uk_info:(null);[R1] uks:(null);[R1] [C1] column_name:c1;[R1] [C1] column_type:MYSQL_TYPE_SET;[R1] [C1] column_is_rowkey:true;[R1] [C1] column_is_signed:true;[R1] [C1] column_encoding:utf8mb4;[R1] [C1] column_is_not_null:true;[R1] [C1] column_extend_info:a,b,c,d;[R1] [C1] column_value_new:[](0);[R1] [C2] column_name:c2;[R1] [C2] column_type:MYSQL_TYPE_ENUM;[R1] [C2] column_is_rowkey:false;[R1] [C2] column_is_signed:true;[R1] [C2] column_encoding:utf8mb4;[R1] [C2] column_is_not_null:false;[R1] [C2] column_extend_info:a,b,c,d,e;[R1] [C2] column_value_new:[d](1);[R1] [C3] column_name:c3;[R1] [C3] column_type:MYSQL_TYPE_LONG;[R1] [C3] column_is_rowkey:false;[R1] [C3] column_is_signed:true;[R1] [C3] column_encoding:binary;[R1] [C3] column_is_not_null:false;[R1] [C3] column_value_new:[3](1);$[R2] COMMIT;
update t_set_enum1 set c2='b' where c1='b';
ob1.oblog.next;
[R0] BEGIN;[R0] org_cluster_id:1;[R1] record_type:UPDATE;[R1] database_name:oblog_tt.oblog_db1;[R1] table_name:t_set_enum1;[R1] log_event:true;[R1] column_count:3;[R1] source_category:SRC_FULL_RECORDED;[R1] source_type:SRC_OCEANBASE_1_0;[R1] has_pk:true;[R1] pk_info:(0);[R1] pks:c1;[R1] has_uk:false;[R1] uk_info:(null);[R1] uks:(null);[R1] [C1] column_name:c1;[R1] [C1] column_type:MYSQL_TYPE_SET;[R1] [C1] column_is_rowkey:true;[R1] [C1] column_is_signed:true;[R1] [C1] column_encoding:utf8mb4;[R1] [C1] column_is_not_null:true;[R1] [C1] column_extend_info:a,b,c,d;[R1] [C1] column_value_new:[b](1);[R1] [C1] column_value_old:[b](1);[R1] [C2] column_name:c2;[R1] [C2] column_type:MYSQL_TYPE_ENUM;[R1] [C2] column_is_rowkey:false;[R1] [C2] column_is_signed:true;[R1] [C2] column_encoding:utf8mb4;[R1] [C2] column_is_not_null:false;[R1] [C2] column_extend_info:a,b,c,d,e;[R1] [C2] column_value_new:[b](1);[R1] [C2] column_value_old:[e](1);[R1] [C3] column_name:c3;[R1] [C3] column_type:MYSQL_TYPE_LONG;[R1] [C3] column_is_rowkey:false;[R1] [C3] column_is_signed:true;[R1] [C3] column_encoding:binary;[R1] [C3] column_is_not_null:false;[R1] [C3] column_value_new:[1](1);[R1] [C3] column_value_old:[1](1);$[R2] COMMIT;
delete from t_set_enum1 where c1='a';
ob1.oblog.next;
[R0] BEGIN;[R0] org_cluster_id:1;[R1] record_type:DELETE;[R1] database_name:oblog_tt.oblog_db1;[R1] table_name:t_set_enum1;[R1] log_event:true;[R1] column_count:3;[R1] source_category:SRC_FULL_RECORDED;[R1] source_type:SRC_OCEANBASE_1_0;[R1] has_pk:true;[R1] pk_info:(0);[R1] pks:c1;[R1] has_uk:false;[R1] uk_info:(null);[R1] uks:(null);[R1] [C1] column_name:c1;[R1] [C1] column_type:MYSQL_TYPE_SET;[R1] [C1] column_is_rowkey:true;[R1] [C1] column_is_signed:true;[R1] [C1] column_encoding:utf8mb4;[R1] [C1] column_is_not_null:true;[R1] [C1] column_extend_info:a,b,c,d;[R1] [C1] column_value_old:[a](1);[R1] [C2] column_name:c2;[R1] [C2] column_type:MYSQL_TYPE_ENUM;[R1] [C2] column_is_rowkey:false;[R1] [C2] column_is_signed:true;[R1] [C2] column_encoding:utf8mb4;[R1] [C2] column_is_not_null:false;[R1] [C2] column_extend_info:a,b,c,d,e;[R1] [C2] column_value_old:[a](1);[R1] [C3] column_name:c3;[R1] [C3] column_type:MYSQL_TYPE_LONG;[R1] [C3] column_is_rowkey:false;[R1] [C3] column_is_signed:true;[R1] [C3] column_encoding:binary;[R1] [C3] column_is_not_null:false;[R1] [C3] column_value_old:[1](1);$[R2] COMMIT;
select c1, c2, c2+1-1, c3 from t_set_enum1;
c1	c2	c2+1-1	c3
	d	4	3
b	b	2	1
a,b	NULL	NULL	2
create table t_set_enum2(c1 set('a', 'b', 'c', 'd'), c2 enum('a', 'b', 'c', 'ddddd', 'e')  primary key, c3 int);
ob1.oblog.next;
[R0] record_type:EDDL;[R0] db_name:oblog_tt.oblog_db1;[R0] table_name:;[R0] column_count:1;[R0] column_name:ddl;[R0] ddl_stmt_str: create table t_set_enum2(c1 set('a', 'b', 'c', 'd'), c2 enum('a', 'b', 'c', 'ddddd', 'e')  primary key, c3 int);[R0] ddl_stmt_len: 111;
insert into t_set_enum2 values('a', 1, 1);
ob1.oblog.next;
[R0] BEGIN;[R0] org_cluster_id:1;[R1] record_type:INSERT;[R1] database_name:oblog_tt.oblog_db1;[R1] table_name:t_set_enum2;[R1] log_event:true;[R1] column_count:3;[R1] source_category:SRC_FULL_RECORDED;[R1] source_type:SRC_OCEANBASE_1_0;[R1] has_pk:true;[R1] pk_info:(0);[R1] pks:c2;[R1] has_uk:false;[R1] uk_info:(null);[R1] uks:(null);[R1] [C1] column_name:c2;[R1] [C1] column_type:MYSQL_TYPE_ENUM;[R1] [C1] column_is_rowkey:true;[R1] [C1] column_is_signed:true;[R1] [C1] column_encoding:utf8mb4;[R1] [C1] column_is_not_null:true;[R1] [C1] column_extend_info:a,b,c,ddddd,e;[R1] [C1] column_value_new:[a](1);[R1] [C2] column_name:c1;[R1] [C2] column_type:MYSQL_TYPE_SET;[R1] [C2] column_is_rowkey:false;[R1] [C2] column_is_signed:true;[R1] [C2] column_encoding:utf8mb4;[R1] [C2] column_is_not_null:false;[R1] [C2] column_extend_info:a,b,c,d;[R1] [C2] column_value_new:[a](1);[R1] [C3] column_name:c3;[R1] [C3] column_type:MYSQL_TYPE_LONG;[R1] [C3] column_is_rowkey:false;[R1] [C3] column_is_signed:true;[R1] [C3] column_encoding:binary;[R1] [C3] column_is_not_null:false;[R1] [C3] column_value_new:[1](1);$[R2] COMMIT;
insert into t_set_enum2 values('b', 'e', 1);
ob1.oblog.next;
[R0] BEGIN;[R0] org_cluster_id:1;[R1] record_type:INSERT;[R1] database_name:oblog_tt.oblog_db1;[R1] table_name:t_set_enum2;[R1] log_event:true;[R1] column_count:3;[R1] source_category:SRC_FULL_RECORDED;[R1] source_type:SRC_OCEANBASE_1_0;[R1] has_pk:true;[R1] pk_info:(0);[R1] pks:c2;[R1] has_uk:false;[R1] uk_info:(null);[R1] uks:(null);[R1] [C1] column_name:c2;[R1] [C1] column_type:MYSQL_TYPE_ENUM;[R1] [C1] column_is_rowkey:true;[R1] [C1] column_is_signed:true;[R1] [C1] column_encoding:utf8mb4;[R1] [C1] column_is_not_null:true;[R1] [C1] column_extend_info:a,b,c,ddddd,e;[R1] [C1] column_value_new:[e](1);[R1] [C2] column_name:c1;[R1] [C2] column_type:MYSQL_TYPE_SET;[R1] [C2] column_is_rowkey:false;[R1] [C2] column_is_signed:true;[R1] [C2] column_encoding:utf8mb4;[R1] [C2] column_is_not_null:false;[R1] [C2] column_extend_info:a,b,c,d;[R1] [C2] column_value_new:[b](1);[R1] [C3] column_name:c3;[R1] [C3] column_type:MYSQL_TYPE_LONG;[R1] [C3] column_is_rowkey:false;[R1] [C3] column_is_signed:true;[R1] [C3] column_encoding:binary;[R1] [C3] column_is_not_null:false;[R1] [C3] column_value_new:[1](1);$[R2] COMMIT;
insert into t_set_enum2 values('a,b', 'c', 2);
ob1.oblog.next;
[R0] BEGIN;[R0] org_cluster_id:1;[R1] record_type:INSERT;[R1] database_name:oblog_tt.oblog_db1;[R1] table_name:t_set_enum2;[R1] log_event:true;[R1] column_count:3;[R1] source_category:SRC_FULL_RECORDED;[R1] source_type:SRC_OCEANBASE_1_0;[R1] has_pk:true;[R1] pk_info:(0);[R1] pks:c2;[R1] has_uk:false;[R1] uk_info:(null);[R1] uks:(null);[R1] [C1] column_name:c2;[R1] [C1] column_type:MYSQL_TYPE_ENUM;[R1] [C1] column_is_rowkey:true;[R1] [C1] column_is_signed:true;[R1] [C1] column_encoding:utf8mb4;[R1] [C1] column_is_not_null:true;[R1] [C1] column_extend_info:a,b,c,ddddd,e;[R1] [C1] column_value_new:[c](1);[R1] [C2] column_name:c1;[R1] [C2] column_type:MYSQL_TYPE_SET;[R1] [C2] column_is_rowkey:false;[R1] [C2] column_is_signed:true;[R1] [C2] column_encoding:utf8mb4;[R1] [C2] column_is_not_null:false;[R1] [C2] column_extend_info:a,b,c,d;[R1] [C2] column_value_new:[a,b](3);[R1] [C3] column_name:c3;[R1] [C3] column_type:MYSQL_TYPE_LONG;[R1] [C3] column_is_rowkey:false;[R1] [C3] column_is_signed:true;[R1] [C3] column_encoding:binary;[R1] [C3] column_is_not_null:false;[R1] [C3] column_value_new:[2](1);$[R2] COMMIT;
insert into t_set_enum2 values('invalid', 'ddddd', 3);
ob1.oblog.next;
[R0] BEGIN;[R0] org_cluster_id:1;[R1] record_type:INSERT;[R1] database_name:oblog_tt.oblog_db1;[R1] table_name:t_set_enum2;[R1] log_event:true;[R1] column_count:3;[R1] source_category:SRC_FULL_RECORDED;[R1] source_type:SRC_OCEANBASE_1_0;[R1] has_pk:true;[R1] pk_info:(0);[R1] pks:c2;[R1] has_uk:false;[R1] uk_info:(null);[R1] uks:(null);[R1] [C1] column_name:c2;[R1] [C1] column_type:MYSQL_TYPE_ENUM;[R1] [C1] column_is_rowkey:true;[R1] [C1] column_is_signed:true;[R1] [C1] column_encoding:utf8mb4;[R1] [C1] column_is_not_null:true;[R1] [C1] column_extend_info:a,b,c,ddddd,e;[R1] [C1] column_value_new:[ddddd](5);[R1] [C2] column_name:c1;[R1] [C2] column_type:MYSQL_TYPE_SET;[R1] [C2] column_is_rowkey:false;[R1] [C2] column_is_signed:true;[R1] [C2] column_encoding:utf8mb4;[R1] [C2] column_is_not_null:false;[R1] [C2] column_extend_info:a,b,c,d;[R1] [C2] column_value_new:[](0);[R1] [C3] column_name:c3;[R1] [C3] column_type:MYSQL_TYPE_LONG;[R1] [C3] column_is_rowkey:false;[R1] [C3] column_is_signed:true;[R1] [C3] column_encoding:binary;[R1] [C3] column_is_not_null:false;[R1] [C3] column_value_new:[3](1);$[R2] COMMIT;
update t_set_enum2 set c2='b' where c1='b';
ob1.oblog.next;
[R0] BEGIN;[R0] org_cluster_id:1;[R1] record_type:DELETE;[R1] database_name:oblog_tt.oblog_db1;[R1] table_name:t_set_enum2;[R1] log_event:true;[R1] column_count:3;[R1] source_category:SRC_FULL_RECORDED;[R1] source_type:SRC_OCEANBASE_1_0;[R1] has_pk:true;[R1] pk_info:(0);[R1] pks:c2;[R1] has_uk:false;[R1] uk_info:(null);[R1] uks:(null);[R1] [C1] column_name:c2;[R1] [C1] column_type:MYSQL_TYPE_ENUM;[R1] [C1] column_is_rowkey:true;[R1] [C1] column_is_signed:true;[R1] [C1] column_encoding:utf8mb4;[R1] [C1] column_is_not_null:true;[R1] [C1] column_extend_info:a,b,c,ddddd,e;[R1] [C1] column_value_old:[e](1);[R1] [C2] column_name:c1;[R1] [C2] column_type:MYSQL_TYPE_SET;[R1] [C2] column_is_rowkey:false;[R1] [C2] column_is_signed:true;[R1] [C2] column_encoding:utf8mb4;[R1] [C2] column_is_not_null:false;[R1] [C2] column_extend_info:a,b,c,d;[R1] [C2] column_value_old:[b](1);[R1] [C3] column_name:c3;[R1] [C3] column_type:MYSQL_TYPE_LONG;[R1] [C3] column_is_rowkey:false;[R1] [C3] column_is_signed:true;[R1] [C3] column_encoding:binary;[R1] [C3] column_is_not_null:false;[R1] [C3] column_value_old:[1](1);$[R2] record_type:INSERT;[R2] database_name:oblog_tt.oblog_db1;[R2] table_name:t_set_enum2;[R2] log_event:true;[R2] column_count:3;[R2] source_category:SRC_FULL_RECORDED;[R2] source_type:SRC_OCEANBASE_1_0;[R2] has_pk:true;[R2] pk_info:(0);[R2] pks:c2;[R2] has_uk:false;[R2] uk_info:(null);[R2] uks:(null);[R2] [C1] column_name:c2;[R2] [C1] column_type:MYSQL_TYPE_ENUM;[R2] [C1] column_is_rowkey:true;[R2] [C1] column_is_signed:true;[R2] [C1] column_encoding:utf8mb4;[R2] [C1] column_is_not_null:true;[R2] [C1] column_extend_info:a,b,c,ddddd,e;[R2] [C1] column_value_new:[b](1);[R2] [C2] column_name:c1;[R2] [C2] column_type:MYSQL_TYPE_SET;[R2] [C2] column_is_rowkey:false;[R2] [C2] column_is_signed:true;[R2] [C2] column_encoding:utf8mb4;[R2] [C2] column_is_not_null:false;[R2] [C2] column_extend_info:a,b,c,d;[R2] [C2] column_value_new:[b](1);[R2] [C3] column_name:c3;[R2] [C3] column_type:MYSQL_TYPE_LONG;[R2] [C3] column_is_rowkey:false;[R2] [C3] column_is_signed:true;[R2] [C3] column_encoding:binary;[R2] [C3] column_is_not_null:false;[R2] [C3] column_value_new:[1](1);$[R3] COMMIT;
delete from t_set_enum2 where c1='a';
ob1.oblog.next;
[R0] BEGIN;[R0] org_cluster_id:1;[R1] record_type:DELETE;[R1] database_name:oblog_tt.oblog_db1;[R1] table_name:t_set_enum2;[R1] log_event:true;[R1] column_count:3;[R1] source_category:SRC_FULL_RECORDED;[R1] source_type:SRC_OCEANBASE_1_0;[R1] has_pk:true;[R1] pk_info:(0);[R1] pks:c2;[R1] has_uk:false;[R1] uk_info:(null);[R1] uks:(null);[R1] [C1] column_name:c2;[R1] [C1] column_type:MYSQL_TYPE_ENUM;[R1] [C1] column_is_rowkey:true;[R1] [C1] column_is_signed:true;[R1] [C1] column_encoding:utf8mb4;[R1] [C1] column_is_not_null:true;[R1] [C1] column_extend_info:a,b,c,ddddd,e;[R1] [C1] column_value_old:[a](1);[R1] [C2] column_name:c1;[R1] [C2] column_type:MYSQL_TYPE_SET;[R1] [C2] column_is_rowkey:false;[R1] [C2] column_is_signed:true;[R1] [C2] column_encoding:utf8mb4;[R1] [C2] column_is_not_null:false;[R1] [C2] column_extend_info:a,b,c,d;[R1] [C2] column_value_old:[a](1);[R1] [C3] column_name:c3;[R1] [C3] column_type:MYSQL_TYPE_LONG;[R1] [C3] column_is_rowkey:false;[R1] [C3] column_is_signed:true;[R1] [C3] column_encoding:binary;[R1] [C3] column_is_not_null:false;[R1] [C3] column_value_old:[1](1);$[R2] COMMIT;
select c1, c2, c2+1-1, c3 from t_set_enum2;
c1	c2	c2+1-1	c3
b	b	2	1
a,b	c	3	2
	ddddd	4	3
ob1.oblog.stop;
