ob1=OBI(cluster=1);
ob1.reboot;
ob1.create_client;
create resource unit oblog_box max_cpu 2, memory_size='20G';
create resource pool oblog_pool unit = 'oblog_box', unit_num = 1, zone_list = ('z1');
create tenant oblog_tt replica_num = 1, primary_zone='z1', resource_pool_list=('oblog_pool') set ob_tcp_invited_nodes='%';
drop database if exists oblog_db;
ob1.oblog.set_extra_argument -m;
ob1.oblog.gen_conf tb_white_list=oblog_tt.*.* log_level=DEBUG;
ob1.oblog.restart;
create database oblog_db;
ob1.oblog.next;
[R0] record_type:EDDL;[R0] db_name:oblog_tt;[R0] table_name:;[R0] column_count:1;[R0] column_name:ddl;[R0] ddl_stmt_str: create database oblog_db;[R0] ddl_stmt_len: 24;
use oblog_db;
set log_row_value_options="partial_json";
set GLOBAL max_allowed_packet=1073741824;
ob1.oblog.next;
[R0] record_type:EDDL;[R0] db_name:oblog_tt;[R0] table_name:;[R0] column_count:1;[R0] column_name:ddl;[R0] ddl_stmt_str: set GLOBAL max_allowed_packet=1073741824;[R0] ddl_stmt_len: 40;
set ob_query_timeout=100000000000;
create table json_test(pk int, j json) JSON(j) STORE AS (CHUNK '1K');
ob1.oblog.next;
[R0] record_type:EDDL;[R0] db_name:oblog_tt.oblog_db;[R0] table_name:;[R0] column_count:1;[R0] column_name:ddl;[R0] ddl_stmt_str: create table json_test(pk int, j json) JSON(j) STORE AS (CHUNK '1K');[R0] ddl_stmt_len: 68;
insert into json_test values(9 , json_object('name', 'zero', 'age', 100, 'position', 'software engineer', 'hrofile', repeat('x', 4000), 'like', json_array('a', 'b', 'c'), 'nickname', repeat('z', 100), 'big1', repeat('z', 1000), 'big2', repeat('z', 300), 'big3', repeat('z', 500), 'big4', repeat('z', 500), 'big5', repeat('z', 500), 'big6', repeat('z', 500), repeat('y', 1048570), 'big-key-y', repeat('z', 1048570), 'big-key-z', repeat('x', 1048570), 'big-key-x'));
select md5(j), json_extract(j, concat('$.', repeat('x', 1048570)), concat('$.', repeat('y', 1048570)), concat('$.', repeat('z', 1048570)) ) as value from json_test where pk=9;
md5(j)	value
0441c54d76164dde4ec17db32f640c78	["big-key-x", "big-key-y", "big-key-z"]
ob1.oblog.next;
[R0] BEGIN;[R0] org_cluster_id:1;[R1] record_type:INSERT;[R1] database_name:oblog_tt.oblog_db;[R1] table_name:json_test;[R1] log_event:true;[R1] column_count:3;[R1] source_category:SRC_FULL_RECORDED;[R1] source_type:SRC_OCEANBASE_1_0;[R1] has_pk:true;[R1] pk_info:(0);[R1] pks:__pk_increment;[R1] has_uk:false;[R1] uk_info:(null);[R1] uks:(null);[R1] [C1] column_name:__pk_increment;[R1] [C1] column_type:MYSQL_TYPE_LONGLONG;[R1] [C1] column_is_rowkey:true;[R1] [C1] column_is_signed:false;[R1] [C1] column_encoding:binary;[R1] [C1] column_is_not_null:true;[R1] [C1] column_value_new:[1](1);[R1] [C2] column_name:pk;[R1] [C2] column_type:MYSQL_TYPE_LONG;[R1] [C2] column_is_rowkey:false;[R1] [C2] column_is_signed:true;[R1] [C2] column_encoding:binary;[R1] [C2] column_is_not_null:false;[R1] [C2] column_value_new:[9](1);[R1] [C3] column_name:j;[R1] [C3] column_type:MYSQL_TYPE_JSON;[R1] [C3] column_is_rowkey:false;[R1] [C3] column_is_signed:true;[R1] [C3] column_encoding:utf8mb4;[R1] [C3] column_is_not_null:false;[R1] [C3] column_value_new_md5:[0441c54d76164dde4ec17db32f640c78](3153350);$[R2] COMMIT;
create table tmp(d longtext);
ob1.oblog.next;
[R0] record_type:EDDL;[R0] db_name:oblog_tt.oblog_db;[R0] table_name:;[R0] column_count:1;[R0] column_name:ddl;[R0] ddl_stmt_str: create table tmp(d longtext);[R0] ddl_stmt_len: 28;
insert into tmp values('');
ob1.oblog.next;
[R0] BEGIN;[R0] org_cluster_id:1;[R1] record_type:INSERT;[R1] database_name:oblog_tt.oblog_db;[R1] table_name:tmp;[R1] log_event:true;[R1] column_count:2;[R1] source_category:SRC_FULL_RECORDED;[R1] source_type:SRC_OCEANBASE_1_0;[R1] has_pk:true;[R1] pk_info:(0);[R1] pks:__pk_increment;[R1] has_uk:false;[R1] uk_info:(null);[R1] uks:(null);[R1] [C1] column_name:__pk_increment;[R1] [C1] column_type:MYSQL_TYPE_LONGLONG;[R1] [C1] column_is_rowkey:true;[R1] [C1] column_is_signed:false;[R1] [C1] column_encoding:binary;[R1] [C1] column_is_not_null:true;[R1] [C1] column_value_new:[1](1);[R1] [C2] column_name:d;[R1] [C2] column_type:MYSQL_TYPE_LONG_BLOB;[R1] [C2] column_is_rowkey:false;[R1] [C2] column_is_signed:true;[R1] [C2] column_encoding:utf8mb4;[R1] [C2] column_is_not_null:false;[R1] [C2] column_value_new_md5:[d41d8cd98f00b204e9800998ecf8427e](0);$[R2] COMMIT;
select md5(concat(d, '{"version": 1, "diffs": ',
json_array(
json_object('op', 'replace', 'value', 'big-key-x1', 'path', concat('$.\"', repeat('x', 1048570), '\"')),
json_object('op', 'replace', 'value', 'big-key-y1', 'path', concat('$.\"', repeat('y', 1048570), '\"')),
json_object('op', 'replace', 'value', 'big-key-z1', 'path', concat('$.\"', repeat('z', 1048570), '\"'))
), '}')) as md5_sum from tmp;
md5_sum
8d2aeb91d267f2534b65e7f1a1ae26c2
drop table tmp;
ob1.oblog.next;
[R0] record_type:EDDL;[R0] db_name:oblog_tt.oblog_db;[R0] table_name:;[R0] column_count:1;[R0] column_name:ddl;[R0] ddl_stmt_str: DROP TABLE `oblog_db`.`tmp`;[R0] ddl_stmt_len: 27;
update json_test set j = json_set(j, concat('$.', repeat('x', 1048570)), 'big-key-x1', concat('$.', repeat('y', 1048570)), 'big-key-y1', concat('$.', repeat('z', 1048570)), 'big-key-z1') where pk=9;
select md5(j), json_extract(j, concat('$.', repeat('x', 1048570)), concat('$.', repeat('y', 1048570)), concat('$.', repeat('z', 1048570)) ) as data from json_test where pk=9;
md5(j)	data
5caf4fb396c56af1e5781ba4aa78639a	["big-key-x1", "big-key-y1", "big-key-z1"]
ob1.oblog.next;
[R0] BEGIN;[R0] org_cluster_id:1;[R1] record_type:UPDATE;[R1] database_name:oblog_tt.oblog_db;[R1] table_name:json_test;[R1] log_event:true;[R1] column_count:3;[R1] source_category:SRC_FULL_RECORDED;[R1] source_type:SRC_OCEANBASE_1_0;[R1] has_pk:true;[R1] pk_info:(0);[R1] pks:__pk_increment;[R1] has_uk:false;[R1] uk_info:(null);[R1] uks:(null);[R1] [C1] column_name:__pk_increment;[R1] [C1] column_type:MYSQL_TYPE_LONGLONG;[R1] [C1] column_is_rowkey:true;[R1] [C1] column_is_signed:false;[R1] [C1] column_encoding:binary;[R1] [C1] column_is_not_null:true;[R1] [C1] column_value_new:[1](1);[R1] [C1] column_value_old:[1](1);[R1] [C2] column_name:pk;[R1] [C2] column_type:MYSQL_TYPE_LONG;[R1] [C2] column_is_rowkey:false;[R1] [C2] column_is_signed:true;[R1] [C2] column_encoding:binary;[R1] [C2] column_is_not_null:false;[R1] [C2] column_value_new:[9](1);[R1] [C2] column_value_old:[9](1);[R1] [C3] column_name:j;[R1] [C3] column_type:MYSQL_TYPE_JSON;[R1] [C3] column_is_rowkey:false;[R1] [C3] column_is_signed:true;[R1] [C3] column_encoding:utf8mb4;[R1] [C3] column_is_not_null:false;[R1] [C3] is_json_diff:true;[R1] [C3] column_value_new_md5:[8d2aeb91d267f2534b65e7f1a1ae26c2](3145915);[R1] [C3] column_value_old_origin: PADDING;[R1] [C3] column_value_old_md5:[NULL](0);$[R2] COMMIT;
drop table json_test;
ob1.oblog.next;
[R0] record_type:EDDL;[R0] db_name:oblog_tt.oblog_db;[R0] table_name:;[R0] column_count:1;[R0] column_name:ddl;[R0] ddl_stmt_str: DROP TABLE `oblog_db`.`json_test`;[R0] ddl_stmt_len: 33;
ob1.oblog.stop;
