ob1=OBI(cluster=1,init_unit_cpu=5);
ob1.reboot;
ob1.create_client;
drop tenant if exists oblog_tt;
drop resource pool if exists oblog_pool;
drop resource unit if exists oblog_box;
drop database if exists oblog_db1;
set global max_allowed_packet=1073741824;
set ob_trx_timeout=100000000;
set ob_default_lob_inrow_threshold=4096;
ob1.oblog.set_extra_argument -m;
ob1.oblog.gen_conf tb_white_list=sys.oblog*.*|obtest.*.* log_level=DEBUG skip_ob_version_compat_check=1;
ob1.oblog.restart;
create database oblog_db1;
ob1.oblog.next;
[R0] record_type:EDDL;[R0] db_name:obtest;[R0] table_name:;[R0] column_count:1;[R0] column_name:ddl;[R0] ddl_stmt_str: create database oblog_db1;[R0] ddl_stmt_len: 25;
use oblog_db1;
CREATE TABLE t (b BIT(8));
ob1.oblog.next;
[R0] record_type:EDDL;[R0] db_name:obtest.oblog_db1;[R0] table_name:;[R0] column_count:1;[R0] column_name:ddl;[R0] ddl_stmt_str: CREATE TABLE t (b BIT(8));[R0] ddl_stmt_len: 25;
INSERT INTO t SET b = b'11111111';
ob1.oblog.next;
[R0] BEGIN;[R0] org_cluster_id:1;[R1] record_type:INSERT;[R1] database_name:obtest.oblog_db1;[R1] table_name:t;[R1] log_event:true;[R1] column_count:2;[R1] source_category:SRC_FULL_RECORDED;[R1] source_type:SRC_OCEANBASE_1_0;[R1] has_pk:true;[R1] pk_info:(0);[R1] pks:__pk_increment;[R1] has_uk:false;[R1] uk_info:(null);[R1] uks:(null);[R1] [C1] column_name:__pk_increment;[R1] [C1] column_type:MYSQL_TYPE_LONGLONG;[R1] [C1] column_is_rowkey:true;[R1] [C1] column_is_signed:false;[R1] [C1] column_encoding:binary;[R1] [C1] column_is_not_null:true;[R1] [C1] column_value_new:[1](1);[R1] [C2] column_name:b;[R1] [C2] column_type:MYSQL_TYPE_BIT;[R1] [C2] column_is_rowkey:false;[R1] [C2] column_is_signed:false;[R1] [C2] column_encoding:binary;[R1] [C2] column_is_not_null:false;[R1] [C2] column_value_new:[255](3);$[R2] COMMIT;
CREATE TABLE t1(pk int primary key, json_col_1 JSON);
ob1.oblog.next;
[R0] record_type:EDDL;[R0] db_name:obtest.oblog_db1;[R0] table_name:;[R0] column_count:1;[R0] column_name:ddl;[R0] ddl_stmt_str: CREATE TABLE t1(pk int primary key, json_col_1 JSON);[R0] ddl_stmt_len: 52;
SET @a:=CONCAT('[',REPEAT('"a",',2),'"a"]');
SELECT JSON_TYPE(@a), LENGTH(@a), LENGTH(@a)*3;
JSON_TYPE(@a)	LENGTH(@a)	LENGTH(@a)*3
ARRAY	13	39
INSERT INTO t1 VALUES(1, @a);
select md5(json_col_1) from t1 where pk = 1;
md5(json_col_1)
d6df46d9f6cf60a5695aad11003fcfe0
ob1.oblog.next;
[R0] BEGIN;[R0] org_cluster_id:1;[R1] record_type:INSERT;[R1] database_name:obtest.oblog_db1;[R1] table_name:t1;[R1] log_event:true;[R1] column_count:2;[R1] source_category:SRC_FULL_RECORDED;[R1] source_type:SRC_OCEANBASE_1_0;[R1] has_pk:true;[R1] pk_info:(0);[R1] pks:pk;[R1] has_uk:false;[R1] uk_info:(null);[R1] uks:(null);[R1] [C1] column_name:pk;[R1] [C1] column_type:MYSQL_TYPE_LONG;[R1] [C1] column_is_rowkey:true;[R1] [C1] column_is_signed:true;[R1] [C1] column_encoding:binary;[R1] [C1] column_is_not_null:true;[R1] [C1] column_value_new:[1](1);[R1] [C2] column_name:json_col_1;[R1] [C2] column_type:MYSQL_TYPE_JSON;[R1] [C2] column_is_rowkey:false;[R1] [C2] column_is_signed:true;[R1] [C2] column_encoding:utf8mb4;[R1] [C2] column_is_not_null:false;[R1] [C2] column_value_new_md5:[d6df46d9f6cf60a5695aad11003fcfe0](15);$[R2] COMMIT;
SET @a:=CONCAT('[',REPEAT('"a",',5),'"a"]');
SELECT JSON_TYPE(@a), LENGTH(@a), LENGTH(@a)*3;
JSON_TYPE(@a)	LENGTH(@a)	LENGTH(@a)*3
ARRAY	25	75
INSERT INTO t1 VALUES(2, @a);
select md5(json_col_1) from t1 where pk = 2;
md5(json_col_1)
95728498950fa54f67851686fbbc5a79
ob1.oblog.next;
[R0] BEGIN;[R0] org_cluster_id:1;[R1] record_type:INSERT;[R1] database_name:obtest.oblog_db1;[R1] table_name:t1;[R1] log_event:true;[R1] column_count:2;[R1] source_category:SRC_FULL_RECORDED;[R1] source_type:SRC_OCEANBASE_1_0;[R1] has_pk:true;[R1] pk_info:(0);[R1] pks:pk;[R1] has_uk:false;[R1] uk_info:(null);[R1] uks:(null);[R1] [C1] column_name:pk;[R1] [C1] column_type:MYSQL_TYPE_LONG;[R1] [C1] column_is_rowkey:true;[R1] [C1] column_is_signed:true;[R1] [C1] column_encoding:binary;[R1] [C1] column_is_not_null:true;[R1] [C1] column_value_new:[2](1);[R1] [C2] column_name:json_col_1;[R1] [C2] column_type:MYSQL_TYPE_JSON;[R1] [C2] column_is_rowkey:false;[R1] [C2] column_is_signed:true;[R1] [C2] column_encoding:utf8mb4;[R1] [C2] column_is_not_null:false;[R1] [C2] column_value_new_md5:[95728498950fa54f67851686fbbc5a79](30);$[R2] COMMIT;
SET @a:=CONCAT('[',REPEAT('"a",',200000),'"a"]');
SELECT JSON_TYPE(@a), LENGTH(@a), LENGTH(@a)*3;
JSON_TYPE(@a)	LENGTH(@a)	LENGTH(@a)*3
ARRAY	800005	2400015
INSERT INTO t1 VALUES(3, @a);
select md5(json_col_1) from t1 where pk = 3;
md5(json_col_1)
fb40a1efd15a961c607b7e9d3169b13e
ob1.oblog.next;
[R0] BEGIN;[R0] org_cluster_id:1;[R1] record_type:INSERT;[R1] database_name:obtest.oblog_db1;[R1] table_name:t1;[R1] log_event:true;[R1] column_count:2;[R1] source_category:SRC_FULL_RECORDED;[R1] source_type:SRC_OCEANBASE_1_0;[R1] has_pk:true;[R1] pk_info:(0);[R1] pks:pk;[R1] has_uk:false;[R1] uk_info:(null);[R1] uks:(null);[R1] [C1] column_name:pk;[R1] [C1] column_type:MYSQL_TYPE_LONG;[R1] [C1] column_is_rowkey:true;[R1] [C1] column_is_signed:true;[R1] [C1] column_encoding:binary;[R1] [C1] column_is_not_null:true;[R1] [C1] column_value_new:[3](1);[R1] [C2] column_name:json_col_1;[R1] [C2] column_type:MYSQL_TYPE_JSON;[R1] [C2] column_is_rowkey:false;[R1] [C2] column_is_signed:true;[R1] [C2] column_encoding:utf8mb4;[R1] [C2] column_is_not_null:false;[R1] [C2] column_value_new_md5:[fb40a1efd15a961c607b7e9d3169b13e](1000005);$[R2] COMMIT;
SET @b:=CONCAT('[',REPEAT('"b",',200000),'"b"]');
update t1 set json_col_1 = @b;
select md5(json_col_1) from t1 where pk = 3;
md5(json_col_1)
29c9699a10efa5f60eae88b4a89b3211
ob1.oblog.next;
[R0] BEGIN;[R0] org_cluster_id:1;[R1] record_type:UPDATE;[R1] database_name:obtest.oblog_db1;[R1] table_name:t1;[R1] log_event:true;[R1] column_count:2;[R1] source_category:SRC_FULL_RECORDED;[R1] source_type:SRC_OCEANBASE_1_0;[R1] has_pk:true;[R1] pk_info:(0);[R1] pks:pk;[R1] has_uk:false;[R1] uk_info:(null);[R1] uks:(null);[R1] [C1] column_name:pk;[R1] [C1] column_type:MYSQL_TYPE_LONG;[R1] [C1] column_is_rowkey:true;[R1] [C1] column_is_signed:true;[R1] [C1] column_encoding:binary;[R1] [C1] column_is_not_null:true;[R1] [C1] column_value_new:[1](1);[R1] [C1] column_value_old:[1](1);[R1] [C2] column_name:json_col_1;[R1] [C2] column_type:MYSQL_TYPE_JSON;[R1] [C2] column_is_rowkey:false;[R1] [C2] column_is_signed:true;[R1] [C2] column_encoding:utf8mb4;[R1] [C2] column_is_not_null:false;[R1] [C2] column_value_new_md5:[29c9699a10efa5f60eae88b4a89b3211](1000005);[R1] [C2] column_value_old_md5:[d6df46d9f6cf60a5695aad11003fcfe0](15);$[R2] record_type:UPDATE;[R2] database_name:obtest.oblog_db1;[R2] table_name:t1;[R2] log_event:true;[R2] column_count:2;[R2] source_category:SRC_FULL_RECORDED;[R2] source_type:SRC_OCEANBASE_1_0;[R2] has_pk:true;[R2] pk_info:(0);[R2] pks:pk;[R2] has_uk:false;[R2] uk_info:(null);[R2] uks:(null);[R2] [C1] column_name:pk;[R2] [C1] column_type:MYSQL_TYPE_LONG;[R2] [C1] column_is_rowkey:true;[R2] [C1] column_is_signed:true;[R2] [C1] column_encoding:binary;[R2] [C1] column_is_not_null:true;[R2] [C1] column_value_new:[2](1);[R2] [C1] column_value_old:[2](1);[R2] [C2] column_name:json_col_1;[R2] [C2] column_type:MYSQL_TYPE_JSON;[R2] [C2] column_is_rowkey:false;[R2] [C2] column_is_signed:true;[R2] [C2] column_encoding:utf8mb4;[R2] [C2] column_is_not_null:false;[R2] [C2] column_value_new_md5:[29c9699a10efa5f60eae88b4a89b3211](1000005);[R2] [C2] column_value_old_md5:[95728498950fa54f67851686fbbc5a79](30);$[R3] record_type:UPDATE;[R3] database_name:obtest.oblog_db1;[R3] table_name:t1;[R3] log_event:true;[R3] column_count:2;[R3] source_category:SRC_FULL_RECORDED;[R3] source_type:SRC_OCEANBASE_1_0;[R3] has_pk:true;[R3] pk_info:(0);[R3] pks:pk;[R3] has_uk:false;[R3] uk_info:(null);[R3] uks:(null);[R3] [C1] column_name:pk;[R3] [C1] column_type:MYSQL_TYPE_LONG;[R3] [C1] column_is_rowkey:true;[R3] [C1] column_is_signed:true;[R3] [C1] column_encoding:binary;[R3] [C1] column_is_not_null:true;[R3] [C1] column_value_new:[3](1);[R3] [C1] column_value_old:[3](1);[R3] [C2] column_name:json_col_1;[R3] [C2] column_type:MYSQL_TYPE_JSON;[R3] [C2] column_is_rowkey:false;[R3] [C2] column_is_signed:true;[R3] [C2] column_encoding:utf8mb4;[R3] [C2] column_is_not_null:false;[R3] [C2] column_value_new_md5:[29c9699a10efa5f60eae88b4a89b3211](1000005);[R3] [C2] column_value_old_md5:[fb40a1efd15a961c607b7e9d3169b13e](1000005);$[R4] COMMIT;
SET @a:=CONCAT('[',REPEAT('"a",',5),'"a"]');
update t1 set json_col_1 = @a where pk=3;
select md5(json_col_1) from t1 where pk = 3;
md5(json_col_1)
95728498950fa54f67851686fbbc5a79
ob1.oblog.next;
[R0] BEGIN;[R0] org_cluster_id:1;[R1] record_type:UPDATE;[R1] database_name:obtest.oblog_db1;[R1] table_name:t1;[R1] log_event:true;[R1] column_count:2;[R1] source_category:SRC_FULL_RECORDED;[R1] source_type:SRC_OCEANBASE_1_0;[R1] has_pk:true;[R1] pk_info:(0);[R1] pks:pk;[R1] has_uk:false;[R1] uk_info:(null);[R1] uks:(null);[R1] [C1] column_name:pk;[R1] [C1] column_type:MYSQL_TYPE_LONG;[R1] [C1] column_is_rowkey:true;[R1] [C1] column_is_signed:true;[R1] [C1] column_encoding:binary;[R1] [C1] column_is_not_null:true;[R1] [C1] column_value_new:[3](1);[R1] [C1] column_value_old:[3](1);[R1] [C2] column_name:json_col_1;[R1] [C2] column_type:MYSQL_TYPE_JSON;[R1] [C2] column_is_rowkey:false;[R1] [C2] column_is_signed:true;[R1] [C2] column_encoding:utf8mb4;[R1] [C2] column_is_not_null:false;[R1] [C2] column_value_new_md5:[95728498950fa54f67851686fbbc5a79](30);[R1] [C2] column_value_old_origin: PADDING;[R1] [C2] column_value_old_md5:[NULL](0);$[R2] COMMIT;
SET @a:=CONCAT('[',REPEAT('"a",',6),'"a"]');
update t1 set json_col_1 = @a where pk=3;
select md5(json_col_1) from t1 where pk = 3;
md5(json_col_1)
33d8e0946e2cf73d6992060a8d4e8d02
ob1.oblog.next;
[R0] BEGIN;[R0] org_cluster_id:1;[R1] record_type:UPDATE;[R1] database_name:obtest.oblog_db1;[R1] table_name:t1;[R1] log_event:true;[R1] column_count:2;[R1] source_category:SRC_FULL_RECORDED;[R1] source_type:SRC_OCEANBASE_1_0;[R1] has_pk:true;[R1] pk_info:(0);[R1] pks:pk;[R1] has_uk:false;[R1] uk_info:(null);[R1] uks:(null);[R1] [C1] column_name:pk;[R1] [C1] column_type:MYSQL_TYPE_LONG;[R1] [C1] column_is_rowkey:true;[R1] [C1] column_is_signed:true;[R1] [C1] column_encoding:binary;[R1] [C1] column_is_not_null:true;[R1] [C1] column_value_new:[3](1);[R1] [C1] column_value_old:[3](1);[R1] [C2] column_name:json_col_1;[R1] [C2] column_type:MYSQL_TYPE_JSON;[R1] [C2] column_is_rowkey:false;[R1] [C2] column_is_signed:true;[R1] [C2] column_encoding:utf8mb4;[R1] [C2] column_is_not_null:false;[R1] [C2] column_value_new_md5:[33d8e0946e2cf73d6992060a8d4e8d02](35);[R1] [C2] column_value_old_md5:[95728498950fa54f67851686fbbc5a79](30);$[R2] COMMIT;
SET @a:=CONCAT('[',REPEAT('"a",',200000),'"a"]');
update t1 set json_col_1 = @a where pk=3;
select md5(json_col_1) from t1 where pk = 3;
md5(json_col_1)
fb40a1efd15a961c607b7e9d3169b13e
ob1.oblog.next;
[R0] BEGIN;[R0] org_cluster_id:1;[R1] record_type:UPDATE;[R1] database_name:obtest.oblog_db1;[R1] table_name:t1;[R1] log_event:true;[R1] column_count:2;[R1] source_category:SRC_FULL_RECORDED;[R1] source_type:SRC_OCEANBASE_1_0;[R1] has_pk:true;[R1] pk_info:(0);[R1] pks:pk;[R1] has_uk:false;[R1] uk_info:(null);[R1] uks:(null);[R1] [C1] column_name:pk;[R1] [C1] column_type:MYSQL_TYPE_LONG;[R1] [C1] column_is_rowkey:true;[R1] [C1] column_is_signed:true;[R1] [C1] column_encoding:binary;[R1] [C1] column_is_not_null:true;[R1] [C1] column_value_new:[3](1);[R1] [C1] column_value_old:[3](1);[R1] [C2] column_name:json_col_1;[R1] [C2] column_type:MYSQL_TYPE_JSON;[R1] [C2] column_is_rowkey:false;[R1] [C2] column_is_signed:true;[R1] [C2] column_encoding:utf8mb4;[R1] [C2] column_is_not_null:false;[R1] [C2] column_value_new_md5:[fb40a1efd15a961c607b7e9d3169b13e](1000005);[R1] [C2] column_value_old_md5:[33d8e0946e2cf73d6992060a8d4e8d02](35);$[R2] COMMIT;
insert into t1 values(30001, CONCAT('{"K1": "', REPEAT('x', 4096),'"}'));
select md5(json_col_1) from t1 where pk = 30001;
md5(json_col_1)
9e66776fca0f9576f0395b96e204b4fb
ob1.oblog.next;
[R0] BEGIN;[R0] org_cluster_id:1;[R1] record_type:INSERT;[R1] database_name:obtest.oblog_db1;[R1] table_name:t1;[R1] log_event:true;[R1] column_count:2;[R1] source_category:SRC_FULL_RECORDED;[R1] source_type:SRC_OCEANBASE_1_0;[R1] has_pk:true;[R1] pk_info:(0);[R1] pks:pk;[R1] has_uk:false;[R1] uk_info:(null);[R1] uks:(null);[R1] [C1] column_name:pk;[R1] [C1] column_type:MYSQL_TYPE_LONG;[R1] [C1] column_is_rowkey:true;[R1] [C1] column_is_signed:true;[R1] [C1] column_encoding:binary;[R1] [C1] column_is_not_null:true;[R1] [C1] column_value_new:[30001](5);[R1] [C2] column_name:json_col_1;[R1] [C2] column_type:MYSQL_TYPE_JSON;[R1] [C2] column_is_rowkey:false;[R1] [C2] column_is_signed:true;[R1] [C2] column_encoding:utf8mb4;[R1] [C2] column_is_not_null:false;[R1] [C2] column_value_new_md5:[9e66776fca0f9576f0395b96e204b4fb](4106);$[R2] COMMIT;
update t1 set pk = 30002 where pk = 30001;
ob1.oblog.next;
[R0] BEGIN;[R0] org_cluster_id:1;[R1] record_type:DELETE;[R1] database_name:obtest.oblog_db1;[R1] table_name:t1;[R1] log_event:true;[R1] column_count:2;[R1] source_category:SRC_FULL_RECORDED;[R1] source_type:SRC_OCEANBASE_1_0;[R1] has_pk:true;[R1] pk_info:(0);[R1] pks:pk;[R1] has_uk:false;[R1] uk_info:(null);[R1] uks:(null);[R1] [C1] column_name:pk;[R1] [C1] column_type:MYSQL_TYPE_LONG;[R1] [C1] column_is_rowkey:true;[R1] [C1] column_is_signed:true;[R1] [C1] column_encoding:binary;[R1] [C1] column_is_not_null:true;[R1] [C1] column_value_old:[30001](5);[R1] [C2] column_name:json_col_1;[R1] [C2] column_type:MYSQL_TYPE_JSON;[R1] [C2] column_is_rowkey:false;[R1] [C2] column_is_signed:true;[R1] [C2] column_encoding:utf8mb4;[R1] [C2] column_is_not_null:false;[R1] [C2] column_value_old_origin: PADDING;[R1] [C2] column_value_old_md5:[NULL](0);$[R2] record_type:INSERT;[R2] database_name:obtest.oblog_db1;[R2] table_name:t1;[R2] log_event:true;[R2] column_count:2;[R2] source_category:SRC_FULL_RECORDED;[R2] source_type:SRC_OCEANBASE_1_0;[R2] has_pk:true;[R2] pk_info:(0);[R2] pks:pk;[R2] has_uk:false;[R2] uk_info:(null);[R2] uks:(null);[R2] [C1] column_name:pk;[R2] [C1] column_type:MYSQL_TYPE_LONG;[R2] [C1] column_is_rowkey:true;[R2] [C1] column_is_signed:true;[R2] [C1] column_encoding:binary;[R2] [C1] column_is_not_null:true;[R2] [C1] column_value_new:[30002](5);[R2] [C2] column_name:json_col_1;[R2] [C2] column_type:MYSQL_TYPE_JSON;[R2] [C2] column_is_rowkey:false;[R2] [C2] column_is_signed:true;[R2] [C2] column_encoding:utf8mb4;[R2] [C2] column_is_not_null:false;[R2] [C2] column_value_new_md5:[9e66776fca0f9576f0395b96e204b4fb](4106);$[R3] COMMIT;
delete from t1 where pk = 30002;
ob1.oblog.next;
[R0] BEGIN;[R0] org_cluster_id:1;[R1] record_type:DELETE;[R1] database_name:obtest.oblog_db1;[R1] table_name:t1;[R1] log_event:true;[R1] column_count:2;[R1] source_category:SRC_FULL_RECORDED;[R1] source_type:SRC_OCEANBASE_1_0;[R1] has_pk:true;[R1] pk_info:(0);[R1] pks:pk;[R1] has_uk:false;[R1] uk_info:(null);[R1] uks:(null);[R1] [C1] column_name:pk;[R1] [C1] column_type:MYSQL_TYPE_LONG;[R1] [C1] column_is_rowkey:true;[R1] [C1] column_is_signed:true;[R1] [C1] column_encoding:binary;[R1] [C1] column_is_not_null:true;[R1] [C1] column_value_old:[30002](5);[R1] [C2] column_name:json_col_1;[R1] [C2] column_type:MYSQL_TYPE_JSON;[R1] [C2] column_is_rowkey:false;[R1] [C2] column_is_signed:true;[R1] [C2] column_encoding:utf8mb4;[R1] [C2] column_is_not_null:false;[R1] [C2] column_value_old_origin: PADDING;[R1] [C2] column_value_old_md5:[NULL](0);$[R2] COMMIT;
delete from t1;
ob1.oblog.next;
[R0] BEGIN;[R0] org_cluster_id:1;[R1] record_type:DELETE;[R1] database_name:obtest.oblog_db1;[R1] table_name:t1;[R1] log_event:true;[R1] column_count:2;[R1] source_category:SRC_FULL_RECORDED;[R1] source_type:SRC_OCEANBASE_1_0;[R1] has_pk:true;[R1] pk_info:(0);[R1] pks:pk;[R1] has_uk:false;[R1] uk_info:(null);[R1] uks:(null);[R1] [C1] column_name:pk;[R1] [C1] column_type:MYSQL_TYPE_LONG;[R1] [C1] column_is_rowkey:true;[R1] [C1] column_is_signed:true;[R1] [C1] column_encoding:binary;[R1] [C1] column_is_not_null:true;[R1] [C1] column_value_old:[1](1);[R1] [C2] column_name:json_col_1;[R1] [C2] column_type:MYSQL_TYPE_JSON;[R1] [C2] column_is_rowkey:false;[R1] [C2] column_is_signed:true;[R1] [C2] column_encoding:utf8mb4;[R1] [C2] column_is_not_null:false;[R1] [C2] column_value_old_origin: PADDING;[R1] [C2] column_value_old_md5:[NULL](0);$[R2] record_type:DELETE;[R2] database_name:obtest.oblog_db1;[R2] table_name:t1;[R2] log_event:true;[R2] column_count:2;[R2] source_category:SRC_FULL_RECORDED;[R2] source_type:SRC_OCEANBASE_1_0;[R2] has_pk:true;[R2] pk_info:(0);[R2] pks:pk;[R2] has_uk:false;[R2] uk_info:(null);[R2] uks:(null);[R2] [C1] column_name:pk;[R2] [C1] column_type:MYSQL_TYPE_LONG;[R2] [C1] column_is_rowkey:true;[R2] [C1] column_is_signed:true;[R2] [C1] column_encoding:binary;[R2] [C1] column_is_not_null:true;[R2] [C1] column_value_old:[2](1);[R2] [C2] column_name:json_col_1;[R2] [C2] column_type:MYSQL_TYPE_JSON;[R2] [C2] column_is_rowkey:false;[R2] [C2] column_is_signed:true;[R2] [C2] column_encoding:utf8mb4;[R2] [C2] column_is_not_null:false;[R2] [C2] column_value_old_origin: PADDING;[R2] [C2] column_value_old_md5:[NULL](0);$[R3] record_type:DELETE;[R3] database_name:obtest.oblog_db1;[R3] table_name:t1;[R3] log_event:true;[R3] column_count:2;[R3] source_category:SRC_FULL_RECORDED;[R3] source_type:SRC_OCEANBASE_1_0;[R3] has_pk:true;[R3] pk_info:(0);[R3] pks:pk;[R3] has_uk:false;[R3] uk_info:(null);[R3] uks:(null);[R3] [C1] column_name:pk;[R3] [C1] column_type:MYSQL_TYPE_LONG;[R3] [C1] column_is_rowkey:true;[R3] [C1] column_is_signed:true;[R3] [C1] column_encoding:binary;[R3] [C1] column_is_not_null:true;[R3] [C1] column_value_old:[3](1);[R3] [C2] column_name:json_col_1;[R3] [C2] column_type:MYSQL_TYPE_JSON;[R3] [C2] column_is_rowkey:false;[R3] [C2] column_is_signed:true;[R3] [C2] column_encoding:utf8mb4;[R3] [C2] column_is_not_null:false;[R3] [C2] column_value_old_origin: PADDING;[R3] [C2] column_value_old_md5:[NULL](0);$[R4] COMMIT;
CREATE TABLE t2(pk int primary key, json_col_1 JSON, json_col_2 JSON, json_col_3 JSON, json_col_4 JSON);
ob1.oblog.next;
[R0] record_type:EDDL;[R0] db_name:obtest.oblog_db1;[R0] table_name:;[R0] column_count:1;[R0] column_name:ddl;[R0] ddl_stmt_str: CREATE TABLE t2(pk int primary key, json_col_1 JSON, json_col_2 JSON, json_col_3 JSON, json_col_4 JSON);[R0] ddl_stmt_len: 103;
SET @a:=CONCAT('[',REPEAT('"a",',5),'"a"]');
INSERT INTO t2 VALUES(1, @a, @a, @a, @a);
select md5(json_col_1), md5(json_col_2), md5(json_col_3), md5(json_col_4) from t2 where pk = 1;
md5(json_col_1)	md5(json_col_2)	md5(json_col_3)	md5(json_col_4)
95728498950fa54f67851686fbbc5a79	95728498950fa54f67851686fbbc5a79	95728498950fa54f67851686fbbc5a79	95728498950fa54f67851686fbbc5a79
ob1.oblog.next;
[R0] BEGIN;[R0] org_cluster_id:1;[R1] record_type:INSERT;[R1] database_name:obtest.oblog_db1;[R1] table_name:t2;[R1] log_event:true;[R1] column_count:5;[R1] source_category:SRC_FULL_RECORDED;[R1] source_type:SRC_OCEANBASE_1_0;[R1] has_pk:true;[R1] pk_info:(0);[R1] pks:pk;[R1] has_uk:false;[R1] uk_info:(null);[R1] uks:(null);[R1] [C1] column_name:pk;[R1] [C1] column_type:MYSQL_TYPE_LONG;[R1] [C1] column_is_rowkey:true;[R1] [C1] column_is_signed:true;[R1] [C1] column_encoding:binary;[R1] [C1] column_is_not_null:true;[R1] [C1] column_value_new:[1](1);[R1] [C2] column_name:json_col_1;[R1] [C2] column_type:MYSQL_TYPE_JSON;[R1] [C2] column_is_rowkey:false;[R1] [C2] column_is_signed:true;[R1] [C2] column_encoding:utf8mb4;[R1] [C2] column_is_not_null:false;[R1] [C2] column_value_new_md5:[95728498950fa54f67851686fbbc5a79](30);[R1] [C3] column_name:json_col_2;[R1] [C3] column_type:MYSQL_TYPE_JSON;[R1] [C3] column_is_rowkey:false;[R1] [C3] column_is_signed:true;[R1] [C3] column_encoding:utf8mb4;[R1] [C3] column_is_not_null:false;[R1] [C3] column_value_new_md5:[95728498950fa54f67851686fbbc5a79](30);[R1] [C4] column_name:json_col_3;[R1] [C4] column_type:MYSQL_TYPE_JSON;[R1] [C4] column_is_rowkey:false;[R1] [C4] column_is_signed:true;[R1] [C4] column_encoding:utf8mb4;[R1] [C4] column_is_not_null:false;[R1] [C4] column_value_new_md5:[95728498950fa54f67851686fbbc5a79](30);[R1] [C5] column_name:json_col_4;[R1] [C5] column_type:MYSQL_TYPE_JSON;[R1] [C5] column_is_rowkey:false;[R1] [C5] column_is_signed:true;[R1] [C5] column_encoding:utf8mb4;[R1] [C5] column_is_not_null:false;[R1] [C5] column_value_new_md5:[95728498950fa54f67851686fbbc5a79](30);$[R2] COMMIT;
SET @a:=CONCAT('[',REPEAT('"c",',200000),'"c"]');
INSERT INTO t2 VALUES(2, @a, @a, @a, @a);
select md5(json_col_1), md5(json_col_2), md5(json_col_3), md5(json_col_4) from t2 where pk = 2;
md5(json_col_1)	md5(json_col_2)	md5(json_col_3)	md5(json_col_4)
dc29d7e36102a98dc16643abd8ae2be7	dc29d7e36102a98dc16643abd8ae2be7	dc29d7e36102a98dc16643abd8ae2be7	dc29d7e36102a98dc16643abd8ae2be7
ob1.oblog.next;
[R0] BEGIN;[R0] org_cluster_id:1;[R1] record_type:INSERT;[R1] database_name:obtest.oblog_db1;[R1] table_name:t2;[R1] log_event:true;[R1] column_count:5;[R1] source_category:SRC_FULL_RECORDED;[R1] source_type:SRC_OCEANBASE_1_0;[R1] has_pk:true;[R1] pk_info:(0);[R1] pks:pk;[R1] has_uk:false;[R1] uk_info:(null);[R1] uks:(null);[R1] [C1] column_name:pk;[R1] [C1] column_type:MYSQL_TYPE_LONG;[R1] [C1] column_is_rowkey:true;[R1] [C1] column_is_signed:true;[R1] [C1] column_encoding:binary;[R1] [C1] column_is_not_null:true;[R1] [C1] column_value_new:[2](1);[R1] [C2] column_name:json_col_1;[R1] [C2] column_type:MYSQL_TYPE_JSON;[R1] [C2] column_is_rowkey:false;[R1] [C2] column_is_signed:true;[R1] [C2] column_encoding:utf8mb4;[R1] [C2] column_is_not_null:false;[R1] [C2] column_value_new_md5:[dc29d7e36102a98dc16643abd8ae2be7](1000005);[R1] [C3] column_name:json_col_2;[R1] [C3] column_type:MYSQL_TYPE_JSON;[R1] [C3] column_is_rowkey:false;[R1] [C3] column_is_signed:true;[R1] [C3] column_encoding:utf8mb4;[R1] [C3] column_is_not_null:false;[R1] [C3] column_value_new_md5:[dc29d7e36102a98dc16643abd8ae2be7](1000005);[R1] [C4] column_name:json_col_3;[R1] [C4] column_type:MYSQL_TYPE_JSON;[R1] [C4] column_is_rowkey:false;[R1] [C4] column_is_signed:true;[R1] [C4] column_encoding:utf8mb4;[R1] [C4] column_is_not_null:false;[R1] [C4] column_value_new_md5:[dc29d7e36102a98dc16643abd8ae2be7](1000005);[R1] [C5] column_name:json_col_4;[R1] [C5] column_type:MYSQL_TYPE_JSON;[R1] [C5] column_is_rowkey:false;[R1] [C5] column_is_signed:true;[R1] [C5] column_encoding:utf8mb4;[R1] [C5] column_is_not_null:false;[R1] [C5] column_value_new_md5:[dc29d7e36102a98dc16643abd8ae2be7](1000005);$[R2] COMMIT;
SET @a:=CONCAT('[',REPEAT('"d",',200000),'"d"]');
update t2 set json_col_1 = @a, json_col_3 = @a where pk=2;
select md5(json_col_1), md5(json_col_2), md5(json_col_3), md5(json_col_4) from t2 where pk = 2;
md5(json_col_1)	md5(json_col_2)	md5(json_col_3)	md5(json_col_4)
76715aaccfdb3b8aa71447d366fb6ed5	dc29d7e36102a98dc16643abd8ae2be7	76715aaccfdb3b8aa71447d366fb6ed5	dc29d7e36102a98dc16643abd8ae2be7
ob1.oblog.next;
[R0] BEGIN;[R0] org_cluster_id:1;[R1] record_type:UPDATE;[R1] database_name:obtest.oblog_db1;[R1] table_name:t2;[R1] log_event:true;[R1] column_count:5;[R1] source_category:SRC_FULL_RECORDED;[R1] source_type:SRC_OCEANBASE_1_0;[R1] has_pk:true;[R1] pk_info:(0);[R1] pks:pk;[R1] has_uk:false;[R1] uk_info:(null);[R1] uks:(null);[R1] [C1] column_name:pk;[R1] [C1] column_type:MYSQL_TYPE_LONG;[R1] [C1] column_is_rowkey:true;[R1] [C1] column_is_signed:true;[R1] [C1] column_encoding:binary;[R1] [C1] column_is_not_null:true;[R1] [C1] column_value_new:[2](1);[R1] [C1] column_value_old:[2](1);[R1] [C2] column_name:json_col_1;[R1] [C2] column_type:MYSQL_TYPE_JSON;[R1] [C2] column_is_rowkey:false;[R1] [C2] column_is_signed:true;[R1] [C2] column_encoding:utf8mb4;[R1] [C2] column_is_not_null:false;[R1] [C2] column_value_new_md5:[76715aaccfdb3b8aa71447d366fb6ed5](1000005);[R1] [C2] column_value_old_md5:[dc29d7e36102a98dc16643abd8ae2be7](1000005);[R1] [C3] column_name:json_col_2;[R1] [C3] column_type:MYSQL_TYPE_JSON;[R1] [C3] column_is_rowkey:false;[R1] [C3] column_is_signed:true;[R1] [C3] column_encoding:utf8mb4;[R1] [C3] column_is_not_null:false;[R1] [C3] column_value_new_origin: PADDING;[R1] [C3] column_value_new_md5:[NULL](0);[R1] [C3] column_value_old_origin: PADDING;[R1] [C3] column_value_old_md5:[NULL](0);[R1] [C4] column_name:json_col_3;[R1] [C4] column_type:MYSQL_TYPE_JSON;[R1] [C4] column_is_rowkey:false;[R1] [C4] column_is_signed:true;[R1] [C4] column_encoding:utf8mb4;[R1] [C4] column_is_not_null:false;[R1] [C4] column_value_new_md5:[76715aaccfdb3b8aa71447d366fb6ed5](1000005);[R1] [C4] column_value_old_md5:[dc29d7e36102a98dc16643abd8ae2be7](1000005);[R1] [C5] column_name:json_col_4;[R1] [C5] column_type:MYSQL_TYPE_JSON;[R1] [C5] column_is_rowkey:false;[R1] [C5] column_is_signed:true;[R1] [C5] column_encoding:utf8mb4;[R1] [C5] column_is_not_null:false;[R1] [C5] column_value_new_origin: PADDING;[R1] [C5] column_value_new_md5:[NULL](0);[R1] [C5] column_value_old_origin: PADDING;[R1] [C5] column_value_old_md5:[NULL](0);$[R2] COMMIT;
SET @a:=CONCAT('[',REPEAT('"e",',5),'"e"]');
update t2 set json_col_1 = @a, json_col_3 = @a where pk=2;
select md5(json_col_1), md5(json_col_2), md5(json_col_3), md5(json_col_4) from t2 where pk = 2;
md5(json_col_1)	md5(json_col_2)	md5(json_col_3)	md5(json_col_4)
97acf765ba1d1765c8151644ea6e8fed	dc29d7e36102a98dc16643abd8ae2be7	97acf765ba1d1765c8151644ea6e8fed	dc29d7e36102a98dc16643abd8ae2be7
ob1.oblog.next;
[R0] BEGIN;[R0] org_cluster_id:1;[R1] record_type:UPDATE;[R1] database_name:obtest.oblog_db1;[R1] table_name:t2;[R1] log_event:true;[R1] column_count:5;[R1] source_category:SRC_FULL_RECORDED;[R1] source_type:SRC_OCEANBASE_1_0;[R1] has_pk:true;[R1] pk_info:(0);[R1] pks:pk;[R1] has_uk:false;[R1] uk_info:(null);[R1] uks:(null);[R1] [C1] column_name:pk;[R1] [C1] column_type:MYSQL_TYPE_LONG;[R1] [C1] column_is_rowkey:true;[R1] [C1] column_is_signed:true;[R1] [C1] column_encoding:binary;[R1] [C1] column_is_not_null:true;[R1] [C1] column_value_new:[2](1);[R1] [C1] column_value_old:[2](1);[R1] [C2] column_name:json_col_1;[R1] [C2] column_type:MYSQL_TYPE_JSON;[R1] [C2] column_is_rowkey:false;[R1] [C2] column_is_signed:true;[R1] [C2] column_encoding:utf8mb4;[R1] [C2] column_is_not_null:false;[R1] [C2] column_value_new_md5:[97acf765ba1d1765c8151644ea6e8fed](30);[R1] [C2] column_value_old_origin: PADDING;[R1] [C2] column_value_old_md5:[NULL](0);[R1] [C3] column_name:json_col_2;[R1] [C3] column_type:MYSQL_TYPE_JSON;[R1] [C3] column_is_rowkey:false;[R1] [C3] column_is_signed:true;[R1] [C3] column_encoding:utf8mb4;[R1] [C3] column_is_not_null:false;[R1] [C3] column_value_new_origin: PADDING;[R1] [C3] column_value_new_md5:[NULL](0);[R1] [C3] column_value_old_origin: PADDING;[R1] [C3] column_value_old_md5:[NULL](0);[R1] [C4] column_name:json_col_3;[R1] [C4] column_type:MYSQL_TYPE_JSON;[R1] [C4] column_is_rowkey:false;[R1] [C4] column_is_signed:true;[R1] [C4] column_encoding:utf8mb4;[R1] [C4] column_is_not_null:false;[R1] [C4] column_value_new_md5:[97acf765ba1d1765c8151644ea6e8fed](30);[R1] [C4] column_value_old_origin: PADDING;[R1] [C4] column_value_old_md5:[NULL](0);[R1] [C5] column_name:json_col_4;[R1] [C5] column_type:MYSQL_TYPE_JSON;[R1] [C5] column_is_rowkey:false;[R1] [C5] column_is_signed:true;[R1] [C5] column_encoding:utf8mb4;[R1] [C5] column_is_not_null:false;[R1] [C5] column_value_new_origin: PADDING;[R1] [C5] column_value_new_md5:[NULL](0);[R1] [C5] column_value_old_origin: PADDING;[R1] [C5] column_value_old_md5:[NULL](0);$[R2] COMMIT;
SET @a:=CONCAT('[',REPEAT('"f",',200000),'"f"]');
update t2 set json_col_1 = @a, json_col_3 = @a where pk=2;
select md5(json_col_1), md5(json_col_2), md5(json_col_3), md5(json_col_4) from t2 where pk = 2;
md5(json_col_1)	md5(json_col_2)	md5(json_col_3)	md5(json_col_4)
a7fc7958bbacc1b0325e161b2d8bbedd	dc29d7e36102a98dc16643abd8ae2be7	a7fc7958bbacc1b0325e161b2d8bbedd	dc29d7e36102a98dc16643abd8ae2be7
ob1.oblog.next;
[R0] BEGIN;[R0] org_cluster_id:1;[R1] record_type:UPDATE;[R1] database_name:obtest.oblog_db1;[R1] table_name:t2;[R1] log_event:true;[R1] column_count:5;[R1] source_category:SRC_FULL_RECORDED;[R1] source_type:SRC_OCEANBASE_1_0;[R1] has_pk:true;[R1] pk_info:(0);[R1] pks:pk;[R1] has_uk:false;[R1] uk_info:(null);[R1] uks:(null);[R1] [C1] column_name:pk;[R1] [C1] column_type:MYSQL_TYPE_LONG;[R1] [C1] column_is_rowkey:true;[R1] [C1] column_is_signed:true;[R1] [C1] column_encoding:binary;[R1] [C1] column_is_not_null:true;[R1] [C1] column_value_new:[2](1);[R1] [C1] column_value_old:[2](1);[R1] [C2] column_name:json_col_1;[R1] [C2] column_type:MYSQL_TYPE_JSON;[R1] [C2] column_is_rowkey:false;[R1] [C2] column_is_signed:true;[R1] [C2] column_encoding:utf8mb4;[R1] [C2] column_is_not_null:false;[R1] [C2] column_value_new_md5:[a7fc7958bbacc1b0325e161b2d8bbedd](1000005);[R1] [C2] column_value_old_md5:[97acf765ba1d1765c8151644ea6e8fed](30);[R1] [C3] column_name:json_col_2;[R1] [C3] column_type:MYSQL_TYPE_JSON;[R1] [C3] column_is_rowkey:false;[R1] [C3] column_is_signed:true;[R1] [C3] column_encoding:utf8mb4;[R1] [C3] column_is_not_null:false;[R1] [C3] column_value_new_origin: PADDING;[R1] [C3] column_value_new_md5:[NULL](0);[R1] [C3] column_value_old_origin: PADDING;[R1] [C3] column_value_old_md5:[NULL](0);[R1] [C4] column_name:json_col_3;[R1] [C4] column_type:MYSQL_TYPE_JSON;[R1] [C4] column_is_rowkey:false;[R1] [C4] column_is_signed:true;[R1] [C4] column_encoding:utf8mb4;[R1] [C4] column_is_not_null:false;[R1] [C4] column_value_new_md5:[a7fc7958bbacc1b0325e161b2d8bbedd](1000005);[R1] [C4] column_value_old_md5:[97acf765ba1d1765c8151644ea6e8fed](30);[R1] [C5] column_name:json_col_4;[R1] [C5] column_type:MYSQL_TYPE_JSON;[R1] [C5] column_is_rowkey:false;[R1] [C5] column_is_signed:true;[R1] [C5] column_encoding:utf8mb4;[R1] [C5] column_is_not_null:false;[R1] [C5] column_value_new_origin: PADDING;[R1] [C5] column_value_new_md5:[NULL](0);[R1] [C5] column_value_old_origin: PADDING;[R1] [C5] column_value_old_md5:[NULL](0);$[R2] COMMIT;
delete from t2;
ob1.oblog.next;
[R0] BEGIN;[R0] org_cluster_id:1;[R1] record_type:DELETE;[R1] database_name:obtest.oblog_db1;[R1] table_name:t2;[R1] log_event:true;[R1] column_count:5;[R1] source_category:SRC_FULL_RECORDED;[R1] source_type:SRC_OCEANBASE_1_0;[R1] has_pk:true;[R1] pk_info:(0);[R1] pks:pk;[R1] has_uk:false;[R1] uk_info:(null);[R1] uks:(null);[R1] [C1] column_name:pk;[R1] [C1] column_type:MYSQL_TYPE_LONG;[R1] [C1] column_is_rowkey:true;[R1] [C1] column_is_signed:true;[R1] [C1] column_encoding:binary;[R1] [C1] column_is_not_null:true;[R1] [C1] column_value_old:[1](1);[R1] [C2] column_name:json_col_1;[R1] [C2] column_type:MYSQL_TYPE_JSON;[R1] [C2] column_is_rowkey:false;[R1] [C2] column_is_signed:true;[R1] [C2] column_encoding:utf8mb4;[R1] [C2] column_is_not_null:false;[R1] [C2] column_value_old_md5:[95728498950fa54f67851686fbbc5a79](30);[R1] [C3] column_name:json_col_2;[R1] [C3] column_type:MYSQL_TYPE_JSON;[R1] [C3] column_is_rowkey:false;[R1] [C3] column_is_signed:true;[R1] [C3] column_encoding:utf8mb4;[R1] [C3] column_is_not_null:false;[R1] [C3] column_value_old_md5:[95728498950fa54f67851686fbbc5a79](30);[R1] [C4] column_name:json_col_3;[R1] [C4] column_type:MYSQL_TYPE_JSON;[R1] [C4] column_is_rowkey:false;[R1] [C4] column_is_signed:true;[R1] [C4] column_encoding:utf8mb4;[R1] [C4] column_is_not_null:false;[R1] [C4] column_value_old_md5:[95728498950fa54f67851686fbbc5a79](30);[R1] [C5] column_name:json_col_4;[R1] [C5] column_type:MYSQL_TYPE_JSON;[R1] [C5] column_is_rowkey:false;[R1] [C5] column_is_signed:true;[R1] [C5] column_encoding:utf8mb4;[R1] [C5] column_is_not_null:false;[R1] [C5] column_value_old_md5:[95728498950fa54f67851686fbbc5a79](30);$[R2] record_type:DELETE;[R2] database_name:obtest.oblog_db1;[R2] table_name:t2;[R2] log_event:true;[R2] column_count:5;[R2] source_category:SRC_FULL_RECORDED;[R2] source_type:SRC_OCEANBASE_1_0;[R2] has_pk:true;[R2] pk_info:(0);[R2] pks:pk;[R2] has_uk:false;[R2] uk_info:(null);[R2] uks:(null);[R2] [C1] column_name:pk;[R2] [C1] column_type:MYSQL_TYPE_LONG;[R2] [C1] column_is_rowkey:true;[R2] [C1] column_is_signed:true;[R2] [C1] column_encoding:binary;[R2] [C1] column_is_not_null:true;[R2] [C1] column_value_old:[2](1);[R2] [C2] column_name:json_col_1;[R2] [C2] column_type:MYSQL_TYPE_JSON;[R2] [C2] column_is_rowkey:false;[R2] [C2] column_is_signed:true;[R2] [C2] column_encoding:utf8mb4;[R2] [C2] column_is_not_null:false;[R2] [C2] column_value_old_origin: PADDING;[R2] [C2] column_value_old_md5:[NULL](0);[R2] [C3] column_name:json_col_2;[R2] [C3] column_type:MYSQL_TYPE_JSON;[R2] [C3] column_is_rowkey:false;[R2] [C3] column_is_signed:true;[R2] [C3] column_encoding:utf8mb4;[R2] [C3] column_is_not_null:false;[R2] [C3] column_value_old_origin: PADDING;[R2] [C3] column_value_old_md5:[NULL](0);[R2] [C4] column_name:json_col_3;[R2] [C4] column_type:MYSQL_TYPE_JSON;[R2] [C4] column_is_rowkey:false;[R2] [C4] column_is_signed:true;[R2] [C4] column_encoding:utf8mb4;[R2] [C4] column_is_not_null:false;[R2] [C4] column_value_old_origin: PADDING;[R2] [C4] column_value_old_md5:[NULL](0);[R2] [C5] column_name:json_col_4;[R2] [C5] column_type:MYSQL_TYPE_JSON;[R2] [C5] column_is_rowkey:false;[R2] [C5] column_is_signed:true;[R2] [C5] column_encoding:utf8mb4;[R2] [C5] column_is_not_null:false;[R2] [C5] column_value_old_origin: PADDING;[R2] [C5] column_value_old_md5:[NULL](0);$[R3] COMMIT;
ob1.oblog.stop;
