ob1=OBI(cluster=1,version=1_4_70,oblog_version=current);
ob1.reboot;
ob1.create_client;
ob1.oblog.set_extra_argument -m;
ob1.oblog.gen_conf tb_white_list=sys.oblog*.*  test_mode_on=1 test_mode_ignore_redo_count=10 sort_trans_participants=1 skip_ob_version_compat_check=1;
ob1.oblog.restart;
set global max_allowed_packet=1073741824;
set ob_trx_timeout=100000000;
create database oblog_db1;
use oblog_db1;
create table t1(pk int primary key, tiny_text tinytext, tiny_blob tinyblob, text_type text, blob_type blob, medium_text mediumtext, medium_blob mediumblob, long_text longtext, long_blob longblob);
insert into t1 values (1, NULL, NULL, NULL, NULL, NULL, NULL, NULL, NULL);
ob1.oblog.next_dml;
[R0] BEGIN;[R0] org_cluster_id:1;[R1] record_type:INSERT;[R1] database_name:sys.oblog_db1;[R1] table_name:t1;[R1] log_event:true;[R1] column_count:9;[R1] source_category:SRC_FULL_RECORDED;[R1] source_type:SRC_OCEANBASE_1_0;[R1] has_pk:true;[R1] pk_info:(0);[R1] pks:pk;[R1] has_uk:false;[R1] uk_info:(null);[R1] uks:(null);[R1] [C1] column_name:pk;[R1] [C1] column_type:MYSQL_TYPE_LONG;[R1] [C1] column_is_rowkey:true;[R1] [C1] column_is_signed:true;[R1] [C1] column_encoding:;[R1] [C1] column_is_not_null:true;[R1] [C1] column_value_new:[1](1);[R1] [C2] column_name:tiny_text;[R1] [C2] column_type:MYSQL_TYPE_TINY_BLOB;[R1] [C2] column_is_rowkey:false;[R1] [C2] column_is_signed:true;[R1] [C2] column_encoding:utf8mb4;[R1] [C2] column_is_not_null:false;[R1] [C2] column_value_new_md5:[NULL](0);[R1] [C3] column_name:tiny_blob;[R1] [C3] column_type:MYSQL_TYPE_TINY_BLOB;[R1] [C3] column_is_rowkey:false;[R1] [C3] column_is_signed:true;[R1] [C3] column_encoding:;[R1] [C3] column_is_not_null:false;[R1] [C3] column_value_new_md5:[NULL](0);[R1] [C4] column_name:text_type;[R1] [C4] column_type:MYSQL_TYPE_BLOB;[R1] [C4] column_is_rowkey:false;[R1] [C4] column_is_signed:true;[R1] [C4] column_encoding:utf8mb4;[R1] [C4] column_is_not_null:false;[R1] [C4] column_value_new_md5:[NULL](0);[R1] [C5] column_name:blob_type;[R1] [C5] column_type:MYSQL_TYPE_BLOB;[R1] [C5] column_is_rowkey:false;[R1] [C5] column_is_signed:true;[R1] [C5] column_encoding:;[R1] [C5] column_is_not_null:false;[R1] [C5] column_value_new_md5:[NULL](0);[R1] [C6] column_name:medium_text;[R1] [C6] column_type:MYSQL_TYPE_MEDIUM_BLOB;[R1] [C6] column_is_rowkey:false;[R1] [C6] column_is_signed:true;[R1] [C6] column_encoding:utf8mb4;[R1] [C6] column_is_not_null:false;[R1] [C6] column_value_new_md5:[NULL](0);[R1] [C7] column_name:medium_blob;[R1] [C7] column_type:MYSQL_TYPE_MEDIUM_BLOB;[R1] [C7] column_is_rowkey:false;[R1] [C7] column_is_signed:true;[R1] [C7] column_encoding:;[R1] [C7] column_is_not_null:false;[R1] [C7] column_value_new_md5:[NULL](0);[R1] [C8] column_name:long_text;[R1] [C8] column_type:MYSQL_TYPE_LONG_BLOB;[R1] [C8] column_is_rowkey:false;[R1] [C8] column_is_signed:true;[R1] [C8] column_encoding:utf8mb4;[R1] [C8] column_is_not_null:false;[R1] [C8] column_value_new_md5:[NULL](0);[R1] [C9] column_name:long_blob;[R1] [C9] column_type:MYSQL_TYPE_LONG_BLOB;[R1] [C9] column_is_rowkey:false;[R1] [C9] column_is_signed:true;[R1] [C9] column_encoding:;[R1] [C9] column_is_not_null:false;[R1] [C9] column_value_new_md5:[NULL](0);$[R2] COMMIT;
insert into t1 values (2, "", "", "", "", "", "", "", "");
select md5(tiny_text) from t1 where pk = 2;
md5(tiny_text)
d41d8cd98f00b204e9800998ecf8427e
ob1.oblog.next_dml;
[R0] BEGIN;[R0] org_cluster_id:1;[R1] record_type:INSERT;[R1] database_name:sys.oblog_db1;[R1] table_name:t1;[R1] log_event:true;[R1] column_count:9;[R1] source_category:SRC_FULL_RECORDED;[R1] source_type:SRC_OCEANBASE_1_0;[R1] has_pk:true;[R1] pk_info:(0);[R1] pks:pk;[R1] has_uk:false;[R1] uk_info:(null);[R1] uks:(null);[R1] [C1] column_name:pk;[R1] [C1] column_type:MYSQL_TYPE_LONG;[R1] [C1] column_is_rowkey:true;[R1] [C1] column_is_signed:true;[R1] [C1] column_encoding:;[R1] [C1] column_is_not_null:true;[R1] [C1] column_value_new:[2](1);[R1] [C2] column_name:tiny_text;[R1] [C2] column_type:MYSQL_TYPE_TINY_BLOB;[R1] [C2] column_is_rowkey:false;[R1] [C2] column_is_signed:true;[R1] [C2] column_encoding:utf8mb4;[R1] [C2] column_is_not_null:false;[R1] [C2] column_value_new_md5:[d41d8cd98f00b204e9800998ecf8427e](0);[R1] [C3] column_name:tiny_blob;[R1] [C3] column_type:MYSQL_TYPE_TINY_BLOB;[R1] [C3] column_is_rowkey:false;[R1] [C3] column_is_signed:true;[R1] [C3] column_encoding:;[R1] [C3] column_is_not_null:false;[R1] [C3] column_value_new_md5:[d41d8cd98f00b204e9800998ecf8427e](0);[R1] [C4] column_name:text_type;[R1] [C4] column_type:MYSQL_TYPE_BLOB;[R1] [C4] column_is_rowkey:false;[R1] [C4] column_is_signed:true;[R1] [C4] column_encoding:utf8mb4;[R1] [C4] column_is_not_null:false;[R1] [C4] column_value_new_md5:[d41d8cd98f00b204e9800998ecf8427e](0);[R1] [C5] column_name:blob_type;[R1] [C5] column_type:MYSQL_TYPE_BLOB;[R1] [C5] column_is_rowkey:false;[R1] [C5] column_is_signed:true;[R1] [C5] column_encoding:;[R1] [C5] column_is_not_null:false;[R1] [C5] column_value_new_md5:[d41d8cd98f00b204e9800998ecf8427e](0);[R1] [C6] column_name:medium_text;[R1] [C6] column_type:MYSQL_TYPE_MEDIUM_BLOB;[R1] [C6] column_is_rowkey:false;[R1] [C6] column_is_signed:true;[R1] [C6] column_encoding:utf8mb4;[R1] [C6] column_is_not_null:false;[R1] [C6] column_value_new_md5:[d41d8cd98f00b204e9800998ecf8427e](0);[R1] [C7] column_name:medium_blob;[R1] [C7] column_type:MYSQL_TYPE_MEDIUM_BLOB;[R1] [C7] column_is_rowkey:false;[R1] [C7] column_is_signed:true;[R1] [C7] column_encoding:;[R1] [C7] column_is_not_null:false;[R1] [C7] column_value_new_md5:[d41d8cd98f00b204e9800998ecf8427e](0);[R1] [C8] column_name:long_text;[R1] [C8] column_type:MYSQL_TYPE_LONG_BLOB;[R1] [C8] column_is_rowkey:false;[R1] [C8] column_is_signed:true;[R1] [C8] column_encoding:utf8mb4;[R1] [C8] column_is_not_null:false;[R1] [C8] column_value_new_md5:[d41d8cd98f00b204e9800998ecf8427e](0);[R1] [C9] column_name:long_blob;[R1] [C9] column_type:MYSQL_TYPE_LONG_BLOB;[R1] [C9] column_is_rowkey:false;[R1] [C9] column_is_signed:true;[R1] [C9] column_encoding:;[R1] [C9] column_is_not_null:false;[R1] [C9] column_value_new_md5:[d41d8cd98f00b204e9800998ecf8427e](0);$[R2] COMMIT;
insert into t1 values (3, repeat('1', 256), repeat('2', 256), repeat('3', 65536), repeat('4', 65536), repeat('5', 16777216), repeat('6', 16777216), "", "");
select md5(tiny_text),  md5(tiny_blob), md5(text_type), md5(blob_type), md5(medium_text), md5(medium_blob), md5(long_text), md5(long_blob) from t1 where pk = 3;
md5(tiny_text)	md5(tiny_blob)	md5(text_type)	md5(blob_type)	md5(medium_text)	md5(medium_blob)	md5(long_text)	md5(long_blob)
cb63280c6142bddf58025800093901ca	7490c42f7f5a2dd8e801021dadbeebe8	0c8b65a2815c4d303a7f348b4b7aca67	9a8618f4df0feb7290bdac2af7ba389a	52c2d77c71e95f33b31fdc18fed1a134	5252f385601387fcad48a42063b9b7ce	d41d8cd98f00b204e9800998ecf8427e	d41d8cd98f00b204e9800998ecf8427e
ob1.oblog.next_dml;
[R0] BEGIN;[R0] org_cluster_id:1;[R1] record_type:INSERT;[R1] database_name:sys.oblog_db1;[R1] table_name:t1;[R1] log_event:true;[R1] column_count:9;[R1] source_category:SRC_FULL_RECORDED;[R1] source_type:SRC_OCEANBASE_1_0;[R1] has_pk:true;[R1] pk_info:(0);[R1] pks:pk;[R1] has_uk:false;[R1] uk_info:(null);[R1] uks:(null);[R1] [C1] column_name:pk;[R1] [C1] column_type:MYSQL_TYPE_LONG;[R1] [C1] column_is_rowkey:true;[R1] [C1] column_is_signed:true;[R1] [C1] column_encoding:;[R1] [C1] column_is_not_null:true;[R1] [C1] column_value_new:[3](1);[R1] [C2] column_name:tiny_text;[R1] [C2] column_type:MYSQL_TYPE_TINY_BLOB;[R1] [C2] column_is_rowkey:false;[R1] [C2] column_is_signed:true;[R1] [C2] column_encoding:utf8mb4;[R1] [C2] column_is_not_null:false;[R1] [C2] column_value_new_md5:[cb63280c6142bddf58025800093901ca](256);[R1] [C3] column_name:tiny_blob;[R1] [C3] column_type:MYSQL_TYPE_TINY_BLOB;[R1] [C3] column_is_rowkey:false;[R1] [C3] column_is_signed:true;[R1] [C3] column_encoding:;[R1] [C3] column_is_not_null:false;[R1] [C3] column_value_new_md5:[7490c42f7f5a2dd8e801021dadbeebe8](256);[R1] [C4] column_name:text_type;[R1] [C4] column_type:MYSQL_TYPE_BLOB;[R1] [C4] column_is_rowkey:false;[R1] [C4] column_is_signed:true;[R1] [C4] column_encoding:utf8mb4;[R1] [C4] column_is_not_null:false;[R1] [C4] column_value_new_md5:[0c8b65a2815c4d303a7f348b4b7aca67](65536);[R1] [C5] column_name:blob_type;[R1] [C5] column_type:MYSQL_TYPE_BLOB;[R1] [C5] column_is_rowkey:false;[R1] [C5] column_is_signed:true;[R1] [C5] column_encoding:;[R1] [C5] column_is_not_null:false;[R1] [C5] column_value_new_md5:[9a8618f4df0feb7290bdac2af7ba389a](65536);[R1] [C6] column_name:medium_text;[R1] [C6] column_type:MYSQL_TYPE_MEDIUM_BLOB;[R1] [C6] column_is_rowkey:false;[R1] [C6] column_is_signed:true;[R1] [C6] column_encoding:utf8mb4;[R1] [C6] column_is_not_null:false;[R1] [C6] column_value_new_md5:[52c2d77c71e95f33b31fdc18fed1a134](16777216);[R1] [C7] column_name:medium_blob;[R1] [C7] column_type:MYSQL_TYPE_MEDIUM_BLOB;[R1] [C7] column_is_rowkey:false;[R1] [C7] column_is_signed:true;[R1] [C7] column_encoding:;[R1] [C7] column_is_not_null:false;[R1] [C7] column_value_new_md5:[5252f385601387fcad48a42063b9b7ce](16777216);[R1] [C8] column_name:long_text;[R1] [C8] column_type:MYSQL_TYPE_LONG_BLOB;[R1] [C8] column_is_rowkey:false;[R1] [C8] column_is_signed:true;[R1] [C8] column_encoding:utf8mb4;[R1] [C8] column_is_not_null:false;[R1] [C8] column_value_new_md5:[d41d8cd98f00b204e9800998ecf8427e](0);[R1] [C9] column_name:long_blob;[R1] [C9] column_type:MYSQL_TYPE_LONG_BLOB;[R1] [C9] column_is_rowkey:false;[R1] [C9] column_is_signed:true;[R1] [C9] column_encoding:;[R1] [C9] column_is_not_null:false;[R1] [C9] column_value_new_md5:[d41d8cd98f00b204e9800998ecf8427e](0);$[R2] COMMIT;
insert into t1 values (4, "", "", "", "", "", "", repeat('a', 50331648), repeat('b', 11534336));
select md5(long_text), md5(long_blob)  from t1 where pk = 4;
md5(long_text)	md5(long_blob)
dc802351f6717547cbf4c951b294f952	2c935e46cfdb63ec4d3dc7c05351aa7f
ob1.oblog.next_dml;
[R0] BEGIN;[R0] org_cluster_id:1;[R1] record_type:INSERT;[R1] database_name:sys.oblog_db1;[R1] table_name:t1;[R1] log_event:true;[R1] column_count:9;[R1] source_category:SRC_FULL_RECORDED;[R1] source_type:SRC_OCEANBASE_1_0;[R1] has_pk:true;[R1] pk_info:(0);[R1] pks:pk;[R1] has_uk:false;[R1] uk_info:(null);[R1] uks:(null);[R1] [C1] column_name:pk;[R1] [C1] column_type:MYSQL_TYPE_LONG;[R1] [C1] column_is_rowkey:true;[R1] [C1] column_is_signed:true;[R1] [C1] column_encoding:;[R1] [C1] column_is_not_null:true;[R1] [C1] column_value_new:[4](1);[R1] [C2] column_name:tiny_text;[R1] [C2] column_type:MYSQL_TYPE_TINY_BLOB;[R1] [C2] column_is_rowkey:false;[R1] [C2] column_is_signed:true;[R1] [C2] column_encoding:utf8mb4;[R1] [C2] column_is_not_null:false;[R1] [C2] column_value_new_md5:[d41d8cd98f00b204e9800998ecf8427e](0);[R1] [C3] column_name:tiny_blob;[R1] [C3] column_type:MYSQL_TYPE_TINY_BLOB;[R1] [C3] column_is_rowkey:false;[R1] [C3] column_is_signed:true;[R1] [C3] column_encoding:;[R1] [C3] column_is_not_null:false;[R1] [C3] column_value_new_md5:[d41d8cd98f00b204e9800998ecf8427e](0);[R1] [C4] column_name:text_type;[R1] [C4] column_type:MYSQL_TYPE_BLOB;[R1] [C4] column_is_rowkey:false;[R1] [C4] column_is_signed:true;[R1] [C4] column_encoding:utf8mb4;[R1] [C4] column_is_not_null:false;[R1] [C4] column_value_new_md5:[d41d8cd98f00b204e9800998ecf8427e](0);[R1] [C5] column_name:blob_type;[R1] [C5] column_type:MYSQL_TYPE_BLOB;[R1] [C5] column_is_rowkey:false;[R1] [C5] column_is_signed:true;[R1] [C5] column_encoding:;[R1] [C5] column_is_not_null:false;[R1] [C5] column_value_new_md5:[d41d8cd98f00b204e9800998ecf8427e](0);[R1] [C6] column_name:medium_text;[R1] [C6] column_type:MYSQL_TYPE_MEDIUM_BLOB;[R1] [C6] column_is_rowkey:false;[R1] [C6] column_is_signed:true;[R1] [C6] column_encoding:utf8mb4;[R1] [C6] column_is_not_null:false;[R1] [C6] column_value_new_md5:[d41d8cd98f00b204e9800998ecf8427e](0);[R1] [C7] column_name:medium_blob;[R1] [C7] column_type:MYSQL_TYPE_MEDIUM_BLOB;[R1] [C7] column_is_rowkey:false;[R1] [C7] column_is_signed:true;[R1] [C7] column_encoding:;[R1] [C7] column_is_not_null:false;[R1] [C7] column_value_new_md5:[d41d8cd98f00b204e9800998ecf8427e](0);[R1] [C8] column_name:long_text;[R1] [C8] column_type:MYSQL_TYPE_LONG_BLOB;[R1] [C8] column_is_rowkey:false;[R1] [C8] column_is_signed:true;[R1] [C8] column_encoding:utf8mb4;[R1] [C8] column_is_not_null:false;[R1] [C8] column_value_new_md5:[dc802351f6717547cbf4c951b294f952](50331648);[R1] [C9] column_name:long_blob;[R1] [C9] column_type:MYSQL_TYPE_LONG_BLOB;[R1] [C9] column_is_rowkey:false;[R1] [C9] column_is_signed:true;[R1] [C9] column_encoding:;[R1] [C9] column_is_not_null:false;[R1] [C9] column_value_new_md5:[2c935e46cfdb63ec4d3dc7c05351aa7f](11534336);$[R2] COMMIT;
insert into t1 values (5, "", "", "", "", "", "", repeat('c',11534336), repeat('d', 50331648));
select md5(long_text), md5(long_blob)  from t1 where pk = 5;
md5(long_text)	md5(long_blob)
4cf1a6c97de72dee3c22318050c0d533	70f12a7f28d21c9700e7f612dc99a20c
ob1.oblog.next_dml;
[R0] BEGIN;[R0] org_cluster_id:1;[R1] record_type:INSERT;[R1] database_name:sys.oblog_db1;[R1] table_name:t1;[R1] log_event:true;[R1] column_count:9;[R1] source_category:SRC_FULL_RECORDED;[R1] source_type:SRC_OCEANBASE_1_0;[R1] has_pk:true;[R1] pk_info:(0);[R1] pks:pk;[R1] has_uk:false;[R1] uk_info:(null);[R1] uks:(null);[R1] [C1] column_name:pk;[R1] [C1] column_type:MYSQL_TYPE_LONG;[R1] [C1] column_is_rowkey:true;[R1] [C1] column_is_signed:true;[R1] [C1] column_encoding:;[R1] [C1] column_is_not_null:true;[R1] [C1] column_value_new:[5](1);[R1] [C2] column_name:tiny_text;[R1] [C2] column_type:MYSQL_TYPE_TINY_BLOB;[R1] [C2] column_is_rowkey:false;[R1] [C2] column_is_signed:true;[R1] [C2] column_encoding:utf8mb4;[R1] [C2] column_is_not_null:false;[R1] [C2] column_value_new_md5:[d41d8cd98f00b204e9800998ecf8427e](0);[R1] [C3] column_name:tiny_blob;[R1] [C3] column_type:MYSQL_TYPE_TINY_BLOB;[R1] [C3] column_is_rowkey:false;[R1] [C3] column_is_signed:true;[R1] [C3] column_encoding:;[R1] [C3] column_is_not_null:false;[R1] [C3] column_value_new_md5:[d41d8cd98f00b204e9800998ecf8427e](0);[R1] [C4] column_name:text_type;[R1] [C4] column_type:MYSQL_TYPE_BLOB;[R1] [C4] column_is_rowkey:false;[R1] [C4] column_is_signed:true;[R1] [C4] column_encoding:utf8mb4;[R1] [C4] column_is_not_null:false;[R1] [C4] column_value_new_md5:[d41d8cd98f00b204e9800998ecf8427e](0);[R1] [C5] column_name:blob_type;[R1] [C5] column_type:MYSQL_TYPE_BLOB;[R1] [C5] column_is_rowkey:false;[R1] [C5] column_is_signed:true;[R1] [C5] column_encoding:;[R1] [C5] column_is_not_null:false;[R1] [C5] column_value_new_md5:[d41d8cd98f00b204e9800998ecf8427e](0);[R1] [C6] column_name:medium_text;[R1] [C6] column_type:MYSQL_TYPE_MEDIUM_BLOB;[R1] [C6] column_is_rowkey:false;[R1] [C6] column_is_signed:true;[R1] [C6] column_encoding:utf8mb4;[R1] [C6] column_is_not_null:false;[R1] [C6] column_value_new_md5:[d41d8cd98f00b204e9800998ecf8427e](0);[R1] [C7] column_name:medium_blob;[R1] [C7] column_type:MYSQL_TYPE_MEDIUM_BLOB;[R1] [C7] column_is_rowkey:false;[R1] [C7] column_is_signed:true;[R1] [C7] column_encoding:;[R1] [C7] column_is_not_null:false;[R1] [C7] column_value_new_md5:[d41d8cd98f00b204e9800998ecf8427e](0);[R1] [C8] column_name:long_text;[R1] [C8] column_type:MYSQL_TYPE_LONG_BLOB;[R1] [C8] column_is_rowkey:false;[R1] [C8] column_is_signed:true;[R1] [C8] column_encoding:utf8mb4;[R1] [C8] column_is_not_null:false;[R1] [C8] column_value_new_md5:[4cf1a6c97de72dee3c22318050c0d533](11534336);[R1] [C9] column_name:long_blob;[R1] [C9] column_type:MYSQL_TYPE_LONG_BLOB;[R1] [C9] column_is_rowkey:false;[R1] [C9] column_is_signed:true;[R1] [C9] column_encoding:;[R1] [C9] column_is_not_null:false;[R1] [C9] column_value_new_md5:[70f12a7f28d21c9700e7f612dc99a20c](50331648);$[R2] COMMIT;
update t1 set long_text=repeat('d', 50331648), long_blob=repeat('c', 11534336) where pk = 5;;
select md5(long_text), md5(long_blob) from t1 where pk = 5;
md5(long_text)	md5(long_blob)
70f12a7f28d21c9700e7f612dc99a20c	4cf1a6c97de72dee3c22318050c0d533
ob1.oblog.next_dml;
[R0] BEGIN;[R0] org_cluster_id:1;[R1] record_type:UPDATE;[R1] database_name:sys.oblog_db1;[R1] table_name:t1;[R1] log_event:true;[R1] column_count:9;[R1] source_category:SRC_FULL_RECORDED;[R1] source_type:SRC_OCEANBASE_1_0;[R1] has_pk:true;[R1] pk_info:(0);[R1] pks:pk;[R1] has_uk:false;[R1] uk_info:(null);[R1] uks:(null);[R1] [C1] column_name:pk;[R1] [C1] column_type:MYSQL_TYPE_LONG;[R1] [C1] column_is_rowkey:true;[R1] [C1] column_is_signed:true;[R1] [C1] column_encoding:;[R1] [C1] column_is_not_null:true;[R1] [C1] column_value_new:[5](1);[R1] [C1] column_value_old:[5](1);[R1] [C2] column_name:tiny_text;[R1] [C2] column_type:MYSQL_TYPE_TINY_BLOB;[R1] [C2] column_is_rowkey:false;[R1] [C2] column_is_signed:true;[R1] [C2] column_encoding:utf8mb4;[R1] [C2] column_is_not_null:false;[R1] [C2] column_value_new_md5:[d41d8cd98f00b204e9800998ecf8427e](0);[R1] [C2] column_value_old_md5:[d41d8cd98f00b204e9800998ecf8427e](0);[R1] [C3] column_name:tiny_blob;[R1] [C3] column_type:MYSQL_TYPE_TINY_BLOB;[R1] [C3] column_is_rowkey:false;[R1] [C3] column_is_signed:true;[R1] [C3] column_encoding:;[R1] [C3] column_is_not_null:false;[R1] [C3] column_value_new_md5:[d41d8cd98f00b204e9800998ecf8427e](0);[R1] [C3] column_value_old_md5:[d41d8cd98f00b204e9800998ecf8427e](0);[R1] [C4] column_name:text_type;[R1] [C4] column_type:MYSQL_TYPE_BLOB;[R1] [C4] column_is_rowkey:false;[R1] [C4] column_is_signed:true;[R1] [C4] column_encoding:utf8mb4;[R1] [C4] column_is_not_null:false;[R1] [C4] column_value_new_md5:[d41d8cd98f00b204e9800998ecf8427e](0);[R1] [C4] column_value_old_md5:[d41d8cd98f00b204e9800998ecf8427e](0);[R1] [C5] column_name:blob_type;[R1] [C5] column_type:MYSQL_TYPE_BLOB;[R1] [C5] column_is_rowkey:false;[R1] [C5] column_is_signed:true;[R1] [C5] column_encoding:;[R1] [C5] column_is_not_null:false;[R1] [C5] column_value_new_md5:[d41d8cd98f00b204e9800998ecf8427e](0);[R1] [C5] column_value_old_md5:[d41d8cd98f00b204e9800998ecf8427e](0);[R1] [C6] column_name:medium_text;[R1] [C6] column_type:MYSQL_TYPE_MEDIUM_BLOB;[R1] [C6] column_is_rowkey:false;[R1] [C6] column_is_signed:true;[R1] [C6] column_encoding:utf8mb4;[R1] [C6] column_is_not_null:false;[R1] [C6] column_value_new_md5:[d41d8cd98f00b204e9800998ecf8427e](0);[R1] [C6] column_value_old_md5:[d41d8cd98f00b204e9800998ecf8427e](0);[R1] [C7] column_name:medium_blob;[R1] [C7] column_type:MYSQL_TYPE_MEDIUM_BLOB;[R1] [C7] column_is_rowkey:false;[R1] [C7] column_is_signed:true;[R1] [C7] column_encoding:;[R1] [C7] column_is_not_null:false;[R1] [C7] column_value_new_md5:[d41d8cd98f00b204e9800998ecf8427e](0);[R1] [C7] column_value_old_md5:[d41d8cd98f00b204e9800998ecf8427e](0);[R1] [C8] column_name:long_text;[R1] [C8] column_type:MYSQL_TYPE_LONG_BLOB;[R1] [C8] column_is_rowkey:false;[R1] [C8] column_is_signed:true;[R1] [C8] column_encoding:utf8mb4;[R1] [C8] column_is_not_null:false;[R1] [C8] column_value_new_md5:[70f12a7f28d21c9700e7f612dc99a20c](50331648);[R1] [C8] column_value_old_md5:[4cf1a6c97de72dee3c22318050c0d533](11534336);[R1] [C9] column_name:long_blob;[R1] [C9] column_type:MYSQL_TYPE_LONG_BLOB;[R1] [C9] column_is_rowkey:false;[R1] [C9] column_is_signed:true;[R1] [C9] column_encoding:;[R1] [C9] column_is_not_null:false;[R1] [C9] column_value_new_md5:[4cf1a6c97de72dee3c22318050c0d533](11534336);[R1] [C9] column_value_old_md5:[70f12a7f28d21c9700e7f612dc99a20c](50331648);$[R2] COMMIT;
update t1 set medium_text=repeat('e', 11534336), medium_blob=repeat('f', 16777216), long_text=repeat('g', 16777216), long_blob=repeat('h', 16777216) where pk=5;
select md5(medium_text), md5(medium_blob), md5(long_text), md5(long_blob) from t1 where pk = 5;
md5(medium_text)	md5(medium_blob)	md5(long_text)	md5(long_blob)
06247e1a56b142ec268db9b3f386fe3f	c293f256a0536aea96841c43e234f087	f4ebbd7ee987045431259a108166f794	9286278fa964597184ea7c164e899ab3
ob1.oblog.next_dml;
[R0] BEGIN;[R0] org_cluster_id:1;[R1] record_type:UPDATE;[R1] database_name:sys.oblog_db1;[R1] table_name:t1;[R1] log_event:true;[R1] column_count:9;[R1] source_category:SRC_FULL_RECORDED;[R1] source_type:SRC_OCEANBASE_1_0;[R1] has_pk:true;[R1] pk_info:(0);[R1] pks:pk;[R1] has_uk:false;[R1] uk_info:(null);[R1] uks:(null);[R1] [C1] column_name:pk;[R1] [C1] column_type:MYSQL_TYPE_LONG;[R1] [C1] column_is_rowkey:true;[R1] [C1] column_is_signed:true;[R1] [C1] column_encoding:;[R1] [C1] column_is_not_null:true;[R1] [C1] column_value_new:[5](1);[R1] [C1] column_value_old:[5](1);[R1] [C2] column_name:tiny_text;[R1] [C2] column_type:MYSQL_TYPE_TINY_BLOB;[R1] [C2] column_is_rowkey:false;[R1] [C2] column_is_signed:true;[R1] [C2] column_encoding:utf8mb4;[R1] [C2] column_is_not_null:false;[R1] [C2] column_value_new_md5:[d41d8cd98f00b204e9800998ecf8427e](0);[R1] [C2] column_value_old_md5:[d41d8cd98f00b204e9800998ecf8427e](0);[R1] [C3] column_name:tiny_blob;[R1] [C3] column_type:MYSQL_TYPE_TINY_BLOB;[R1] [C3] column_is_rowkey:false;[R1] [C3] column_is_signed:true;[R1] [C3] column_encoding:;[R1] [C3] column_is_not_null:false;[R1] [C3] column_value_new_md5:[d41d8cd98f00b204e9800998ecf8427e](0);[R1] [C3] column_value_old_md5:[d41d8cd98f00b204e9800998ecf8427e](0);[R1] [C4] column_name:text_type;[R1] [C4] column_type:MYSQL_TYPE_BLOB;[R1] [C4] column_is_rowkey:false;[R1] [C4] column_is_signed:true;[R1] [C4] column_encoding:utf8mb4;[R1] [C4] column_is_not_null:false;[R1] [C4] column_value_new_md5:[d41d8cd98f00b204e9800998ecf8427e](0);[R1] [C4] column_value_old_md5:[d41d8cd98f00b204e9800998ecf8427e](0);[R1] [C5] column_name:blob_type;[R1] [C5] column_type:MYSQL_TYPE_BLOB;[R1] [C5] column_is_rowkey:false;[R1] [C5] column_is_signed:true;[R1] [C5] column_encoding:;[R1] [C5] column_is_not_null:false;[R1] [C5] column_value_new_md5:[d41d8cd98f00b204e9800998ecf8427e](0);[R1] [C5] column_value_old_md5:[d41d8cd98f00b204e9800998ecf8427e](0);[R1] [C6] column_name:medium_text;[R1] [C6] column_type:MYSQL_TYPE_MEDIUM_BLOB;[R1] [C6] column_is_rowkey:false;[R1] [C6] column_is_signed:true;[R1] [C6] column_encoding:utf8mb4;[R1] [C6] column_is_not_null:false;[R1] [C6] column_value_new_md5:[06247e1a56b142ec268db9b3f386fe3f](11534336);[R1] [C6] column_value_old_md5:[d41d8cd98f00b204e9800998ecf8427e](0);[R1] [C7] column_name:medium_blob;[R1] [C7] column_type:MYSQL_TYPE_MEDIUM_BLOB;[R1] [C7] column_is_rowkey:false;[R1] [C7] column_is_signed:true;[R1] [C7] column_encoding:;[R1] [C7] column_is_not_null:false;[R1] [C7] column_value_new_md5:[c293f256a0536aea96841c43e234f087](16777216);[R1] [C7] column_value_old_md5:[d41d8cd98f00b204e9800998ecf8427e](0);[R1] [C8] column_name:long_text;[R1] [C8] column_type:MYSQL_TYPE_LONG_BLOB;[R1] [C8] column_is_rowkey:false;[R1] [C8] column_is_signed:true;[R1] [C8] column_encoding:utf8mb4;[R1] [C8] column_is_not_null:false;[R1] [C8] column_value_new_md5:[f4ebbd7ee987045431259a108166f794](16777216);[R1] [C8] column_value_old_md5:[70f12a7f28d21c9700e7f612dc99a20c](50331648);[R1] [C9] column_name:long_blob;[R1] [C9] column_type:MYSQL_TYPE_LONG_BLOB;[R1] [C9] column_is_rowkey:false;[R1] [C9] column_is_signed:true;[R1] [C9] column_encoding:;[R1] [C9] column_is_not_null:false;[R1] [C9] column_value_new_md5:[9286278fa964597184ea7c164e899ab3](16777216);[R1] [C9] column_value_old_md5:[4cf1a6c97de72dee3c22318050c0d533](11534336);$[R2] COMMIT;
begin;
insert into t1 values (100, NULL, NULL, NULL, NULL, NULL, NULL, NULL, NULL);
update t1 set long_blob=repeat('1', 2097152) where pk = 100;
select md5(long_blob) from t1 where pk = 100;
md5(long_blob)
b4fc0c467a8d5b04868d12a0d3f43a92
insert into t1 (pk, text_type) values (200, repeat('2', 16384));
select md5(text_type) from t1 where pk = 200;
md5(text_type)
f49f763496f52447cf31360dd8287701
update t1 set medium_text=repeat('3', 8388608) where pk = 200;
select md5(medium_text) from t1 where pk = 200;
md5(medium_text)
0a3db809cf76aca529fbda3a53b72144
update t1 set long_text=repeat('4', 50331648) where pk = 200;
select md5(long_text) from t1 where pk = 200;
md5(long_text)
db083e766fc6ef3477d930314ab63dac
commit;
ob1.oblog.next_dml;
[R0] BEGIN;[R0] org_cluster_id:1;[R1] record_type:INSERT;[R1] database_name:sys.oblog_db1;[R1] table_name:t1;[R1] log_event:true;[R1] column_count:9;[R1] source_category:SRC_FULL_RECORDED;[R1] source_type:SRC_OCEANBASE_1_0;[R1] has_pk:true;[R1] pk_info:(0);[R1] pks:pk;[R1] has_uk:false;[R1] uk_info:(null);[R1] uks:(null);[R1] [C1] column_name:pk;[R1] [C1] column_type:MYSQL_TYPE_LONG;[R1] [C1] column_is_rowkey:true;[R1] [C1] column_is_signed:true;[R1] [C1] column_encoding:;[R1] [C1] column_is_not_null:true;[R1] [C1] column_value_new:[100](3);[R1] [C2] column_name:tiny_text;[R1] [C2] column_type:MYSQL_TYPE_TINY_BLOB;[R1] [C2] column_is_rowkey:false;[R1] [C2] column_is_signed:true;[R1] [C2] column_encoding:utf8mb4;[R1] [C2] column_is_not_null:false;[R1] [C2] column_value_new_md5:[NULL](0);[R1] [C3] column_name:tiny_blob;[R1] [C3] column_type:MYSQL_TYPE_TINY_BLOB;[R1] [C3] column_is_rowkey:false;[R1] [C3] column_is_signed:true;[R1] [C3] column_encoding:;[R1] [C3] column_is_not_null:false;[R1] [C3] column_value_new_md5:[NULL](0);[R1] [C4] column_name:text_type;[R1] [C4] column_type:MYSQL_TYPE_BLOB;[R1] [C4] column_is_rowkey:false;[R1] [C4] column_is_signed:true;[R1] [C4] column_encoding:utf8mb4;[R1] [C4] column_is_not_null:false;[R1] [C4] column_value_new_md5:[NULL](0);[R1] [C5] column_name:blob_type;[R1] [C5] column_type:MYSQL_TYPE_BLOB;[R1] [C5] column_is_rowkey:false;[R1] [C5] column_is_signed:true;[R1] [C5] column_encoding:;[R1] [C5] column_is_not_null:false;[R1] [C5] column_value_new_md5:[NULL](0);[R1] [C6] column_name:medium_text;[R1] [C6] column_type:MYSQL_TYPE_MEDIUM_BLOB;[R1] [C6] column_is_rowkey:false;[R1] [C6] column_is_signed:true;[R1] [C6] column_encoding:utf8mb4;[R1] [C6] column_is_not_null:false;[R1] [C6] column_value_new_md5:[NULL](0);[R1] [C7] column_name:medium_blob;[R1] [C7] column_type:MYSQL_TYPE_MEDIUM_BLOB;[R1] [C7] column_is_rowkey:false;[R1] [C7] column_is_signed:true;[R1] [C7] column_encoding:;[R1] [C7] column_is_not_null:false;[R1] [C7] column_value_new_md5:[NULL](0);[R1] [C8] column_name:long_text;[R1] [C8] column_type:MYSQL_TYPE_LONG_BLOB;[R1] [C8] column_is_rowkey:false;[R1] [C8] column_is_signed:true;[R1] [C8] column_encoding:utf8mb4;[R1] [C8] column_is_not_null:false;[R1] [C8] column_value_new_md5:[NULL](0);[R1] [C9] column_name:long_blob;[R1] [C9] column_type:MYSQL_TYPE_LONG_BLOB;[R1] [C9] column_is_rowkey:false;[R1] [C9] column_is_signed:true;[R1] [C9] column_encoding:;[R1] [C9] column_is_not_null:false;[R1] [C9] column_value_new_md5:[NULL](0);$[R2] record_type:UPDATE;[R2] database_name:sys.oblog_db1;[R2] table_name:t1;[R2] log_event:true;[R2] column_count:9;[R2] source_category:SRC_FULL_RECORDED;[R2] source_type:SRC_OCEANBASE_1_0;[R2] has_pk:true;[R2] pk_info:(0);[R2] pks:pk;[R2] has_uk:false;[R2] uk_info:(null);[R2] uks:(null);[R2] [C1] column_name:pk;[R2] [C1] column_type:MYSQL_TYPE_LONG;[R2] [C1] column_is_rowkey:true;[R2] [C1] column_is_signed:true;[R2] [C1] column_encoding:;[R2] [C1] column_is_not_null:true;[R2] [C1] column_value_new:[100](3);[R2] [C1] column_value_old:[100](3);[R2] [C2] column_name:tiny_text;[R2] [C2] column_type:MYSQL_TYPE_TINY_BLOB;[R2] [C2] column_is_rowkey:false;[R2] [C2] column_is_signed:true;[R2] [C2] column_encoding:utf8mb4;[R2] [C2] column_is_not_null:false;[R2] [C2] column_value_new_md5:[NULL](0);[R2] [C2] column_value_old_md5:[NULL](0);[R2] [C3] column_name:tiny_blob;[R2] [C3] column_type:MYSQL_TYPE_TINY_BLOB;[R2] [C3] column_is_rowkey:false;[R2] [C3] column_is_signed:true;[R2] [C3] column_encoding:;[R2] [C3] column_is_not_null:false;[R2] [C3] column_value_new_md5:[NULL](0);[R2] [C3] column_value_old_md5:[NULL](0);[R2] [C4] column_name:text_type;[R2] [C4] column_type:MYSQL_TYPE_BLOB;[R2] [C4] column_is_rowkey:false;[R2] [C4] column_is_signed:true;[R2] [C4] column_encoding:utf8mb4;[R2] [C4] column_is_not_null:false;[R2] [C4] column_value_new_md5:[NULL](0);[R2] [C4] column_value_old_md5:[NULL](0);[R2] [C5] column_name:blob_type;[R2] [C5] column_type:MYSQL_TYPE_BLOB;[R2] [C5] column_is_rowkey:false;[R2] [C5] column_is_signed:true;[R2] [C5] column_encoding:;[R2] [C5] column_is_not_null:false;[R2] [C5] column_value_new_md5:[NULL](0);[R2] [C5] column_value_old_md5:[NULL](0);[R2] [C6] column_name:medium_text;[R2] [C6] column_type:MYSQL_TYPE_MEDIUM_BLOB;[R2] [C6] column_is_rowkey:false;[R2] [C6] column_is_signed:true;[R2] [C6] column_encoding:utf8mb4;[R2] [C6] column_is_not_null:false;[R2] [C6] column_value_new_md5:[NULL](0);[R2] [C6] column_value_old_md5:[NULL](0);[R2] [C7] column_name:medium_blob;[R2] [C7] column_type:MYSQL_TYPE_MEDIUM_BLOB;[R2] [C7] column_is_rowkey:false;[R2] [C7] column_is_signed:true;[R2] [C7] column_encoding:;[R2] [C7] column_is_not_null:false;[R2] [C7] column_value_new_md5:[NULL](0);[R2] [C7] column_value_old_md5:[NULL](0);[R2] [C8] column_name:long_text;[R2] [C8] column_type:MYSQL_TYPE_LONG_BLOB;[R2] [C8] column_is_rowkey:false;[R2] [C8] column_is_signed:true;[R2] [C8] column_encoding:utf8mb4;[R2] [C8] column_is_not_null:false;[R2] [C8] column_value_new_md5:[NULL](0);[R2] [C8] column_value_old_md5:[NULL](0);[R2] [C9] column_name:long_blob;[R2] [C9] column_type:MYSQL_TYPE_LONG_BLOB;[R2] [C9] column_is_rowkey:false;[R2] [C9] column_is_signed:true;[R2] [C9] column_encoding:;[R2] [C9] column_is_not_null:false;[R2] [C9] column_value_new_md5:[b4fc0c467a8d5b04868d12a0d3f43a92](2097152);[R2] [C9] column_value_old_md5:[NULL](0);$[R3] record_type:INSERT;[R3] database_name:sys.oblog_db1;[R3] table_name:t1;[R3] log_event:true;[R3] column_count:9;[R3] source_category:SRC_FULL_RECORDED;[R3] source_type:SRC_OCEANBASE_1_0;[R3] has_pk:true;[R3] pk_info:(0);[R3] pks:pk;[R3] has_uk:false;[R3] uk_info:(null);[R3] uks:(null);[R3] [C1] column_name:pk;[R3] [C1] column_type:MYSQL_TYPE_LONG;[R3] [C1] column_is_rowkey:true;[R3] [C1] column_is_signed:true;[R3] [C1] column_encoding:;[R3] [C1] column_is_not_null:true;[R3] [C1] column_value_new:[200](3);[R3] [C2] column_name:tiny_text;[R3] [C2] column_type:MYSQL_TYPE_TINY_BLOB;[R3] [C2] column_is_rowkey:false;[R3] [C2] column_is_signed:true;[R3] [C2] column_encoding:utf8mb4;[R3] [C2] column_is_not_null:false;[R3] [C2] column_value_new_md5:[NULL](0);[R3] [C3] column_name:tiny_blob;[R3] [C3] column_type:MYSQL_TYPE_TINY_BLOB;[R3] [C3] column_is_rowkey:false;[R3] [C3] column_is_signed:true;[R3] [C3] column_encoding:;[R3] [C3] column_is_not_null:false;[R3] [C3] column_value_new_md5:[NULL](0);[R3] [C4] column_name:text_type;[R3] [C4] column_type:MYSQL_TYPE_BLOB;[R3] [C4] column_is_rowkey:false;[R3] [C4] column_is_signed:true;[R3] [C4] column_encoding:utf8mb4;[R3] [C4] column_is_not_null:false;[R3] [C4] column_value_new_md5:[f49f763496f52447cf31360dd8287701](16384);[R3] [C5] column_name:blob_type;[R3] [C5] column_type:MYSQL_TYPE_BLOB;[R3] [C5] column_is_rowkey:false;[R3] [C5] column_is_signed:true;[R3] [C5] column_encoding:;[R3] [C5] column_is_not_null:false;[R3] [C5] column_value_new_md5:[NULL](0);[R3] [C6] column_name:medium_text;[R3] [C6] column_type:MYSQL_TYPE_MEDIUM_BLOB;[R3] [C6] column_is_rowkey:false;[R3] [C6] column_is_signed:true;[R3] [C6] column_encoding:utf8mb4;[R3] [C6] column_is_not_null:false;[R3] [C6] column_value_new_md5:[NULL](0);[R3] [C7] column_name:medium_blob;[R3] [C7] column_type:MYSQL_TYPE_MEDIUM_BLOB;[R3] [C7] column_is_rowkey:false;[R3] [C7] column_is_signed:true;[R3] [C7] column_encoding:;[R3] [C7] column_is_not_null:false;[R3] [C7] column_value_new_md5:[NULL](0);[R3] [C8] column_name:long_text;[R3] [C8] column_type:MYSQL_TYPE_LONG_BLOB;[R3] [C8] column_is_rowkey:false;[R3] [C8] column_is_signed:true;[R3] [C8] column_encoding:utf8mb4;[R3] [C8] column_is_not_null:false;[R3] [C8] column_value_new_md5:[NULL](0);[R3] [C9] column_name:long_blob;[R3] [C9] column_type:MYSQL_TYPE_LONG_BLOB;[R3] [C9] column_is_rowkey:false;[R3] [C9] column_is_signed:true;[R3] [C9] column_encoding:;[R3] [C9] column_is_not_null:false;[R3] [C9] column_value_new_md5:[NULL](0);$[R4] record_type:UPDATE;[R4] database_name:sys.oblog_db1;[R4] table_name:t1;[R4] log_event:true;[R4] column_count:9;[R4] source_category:SRC_FULL_RECORDED;[R4] source_type:SRC_OCEANBASE_1_0;[R4] has_pk:true;[R4] pk_info:(0);[R4] pks:pk;[R4] has_uk:false;[R4] uk_info:(null);[R4] uks:(null);[R4] [C1] column_name:pk;[R4] [C1] column_type:MYSQL_TYPE_LONG;[R4] [C1] column_is_rowkey:true;[R4] [C1] column_is_signed:true;[R4] [C1] column_encoding:;[R4] [C1] column_is_not_null:true;[R4] [C1] column_value_new:[200](3);[R4] [C1] column_value_old:[200](3);[R4] [C2] column_name:tiny_text;[R4] [C2] column_type:MYSQL_TYPE_TINY_BLOB;[R4] [C2] column_is_rowkey:false;[R4] [C2] column_is_signed:true;[R4] [C2] column_encoding:utf8mb4;[R4] [C2] column_is_not_null:false;[R4] [C2] column_value_new_md5:[NULL](0);[R4] [C2] column_value_old_md5:[NULL](0);[R4] [C3] column_name:tiny_blob;[R4] [C3] column_type:MYSQL_TYPE_TINY_BLOB;[R4] [C3] column_is_rowkey:false;[R4] [C3] column_is_signed:true;[R4] [C3] column_encoding:;[R4] [C3] column_is_not_null:false;[R4] [C3] column_value_new_md5:[NULL](0);[R4] [C3] column_value_old_md5:[NULL](0);[R4] [C4] column_name:text_type;[R4] [C4] column_type:MYSQL_TYPE_BLOB;[R4] [C4] column_is_rowkey:false;[R4] [C4] column_is_signed:true;[R4] [C4] column_encoding:utf8mb4;[R4] [C4] column_is_not_null:false;[R4] [C4] column_value_new_md5:[f49f763496f52447cf31360dd8287701](16384);[R4] [C4] column_value_old_md5:[f49f763496f52447cf31360dd8287701](16384);[R4] [C5] column_name:blob_type;[R4] [C5] column_type:MYSQL_TYPE_BLOB;[R4] [C5] column_is_rowkey:false;[R4] [C5] column_is_signed:true;[R4] [C5] column_encoding:;[R4] [C5] column_is_not_null:false;[R4] [C5] column_value_new_md5:[NULL](0);[R4] [C5] column_value_old_md5:[NULL](0);[R4] [C6] column_name:medium_text;[R4] [C6] column_type:MYSQL_TYPE_MEDIUM_BLOB;[R4] [C6] column_is_rowkey:false;[R4] [C6] column_is_signed:true;[R4] [C6] column_encoding:utf8mb4;[R4] [C6] column_is_not_null:false;[R4] [C6] column_value_new_md5:[0a3db809cf76aca529fbda3a53b72144](8388608);[R4] [C6] column_value_old_md5:[NULL](0);[R4] [C7] column_name:medium_blob;[R4] [C7] column_type:MYSQL_TYPE_MEDIUM_BLOB;[R4] [C7] column_is_rowkey:false;[R4] [C7] column_is_signed:true;[R4] [C7] column_encoding:;[R4] [C7] column_is_not_null:false;[R4] [C7] column_value_new_md5:[NULL](0);[R4] [C7] column_value_old_md5:[NULL](0);[R4] [C8] column_name:long_text;[R4] [C8] column_type:MYSQL_TYPE_LONG_BLOB;[R4] [C8] column_is_rowkey:false;[R4] [C8] column_is_signed:true;[R4] [C8] column_encoding:utf8mb4;[R4] [C8] column_is_not_null:false;[R4] [C8] column_value_new_md5:[NULL](0);[R4] [C8] column_value_old_md5:[NULL](0);[R4] [C9] column_name:long_blob;[R4] [C9] column_type:MYSQL_TYPE_LONG_BLOB;[R4] [C9] column_is_rowkey:false;[R4] [C9] column_is_signed:true;[R4] [C9] column_encoding:;[R4] [C9] column_is_not_null:false;[R4] [C9] column_value_new_md5:[NULL](0);[R4] [C9] column_value_old_md5:[NULL](0);$[R5] record_type:UPDATE;[R5] database_name:sys.oblog_db1;[R5] table_name:t1;[R5] log_event:true;[R5] column_count:9;[R5] source_category:SRC_FULL_RECORDED;[R5] source_type:SRC_OCEANBASE_1_0;[R5] has_pk:true;[R5] pk_info:(0);[R5] pks:pk;[R5] has_uk:false;[R5] uk_info:(null);[R5] uks:(null);[R5] [C1] column_name:pk;[R5] [C1] column_type:MYSQL_TYPE_LONG;[R5] [C1] column_is_rowkey:true;[R5] [C1] column_is_signed:true;[R5] [C1] column_encoding:;[R5] [C1] column_is_not_null:true;[R5] [C1] column_value_new:[200](3);[R5] [C1] column_value_old:[200](3);[R5] [C2] column_name:tiny_text;[R5] [C2] column_type:MYSQL_TYPE_TINY_BLOB;[R5] [C2] column_is_rowkey:false;[R5] [C2] column_is_signed:true;[R5] [C2] column_encoding:utf8mb4;[R5] [C2] column_is_not_null:false;[R5] [C2] column_value_new_md5:[NULL](0);[R5] [C2] column_value_old_md5:[NULL](0);[R5] [C3] column_name:tiny_blob;[R5] [C3] column_type:MYSQL_TYPE_TINY_BLOB;[R5] [C3] column_is_rowkey:false;[R5] [C3] column_is_signed:true;[R5] [C3] column_encoding:;[R5] [C3] column_is_not_null:false;[R5] [C3] column_value_new_md5:[NULL](0);[R5] [C3] column_value_old_md5:[NULL](0);[R5] [C4] column_name:text_type;[R5] [C4] column_type:MYSQL_TYPE_BLOB;[R5] [C4] column_is_rowkey:false;[R5] [C4] column_is_signed:true;[R5] [C4] column_encoding:utf8mb4;[R5] [C4] column_is_not_null:false;[R5] [C4] column_value_new_md5:[f49f763496f52447cf31360dd8287701](16384);[R5] [C4] column_value_old_md5:[f49f763496f52447cf31360dd8287701](16384);[R5] [C5] column_name:blob_type;[R5] [C5] column_type:MYSQL_TYPE_BLOB;[R5] [C5] column_is_rowkey:false;[R5] [C5] column_is_signed:true;[R5] [C5] column_encoding:;[R5] [C5] column_is_not_null:false;[R5] [C5] column_value_new_md5:[NULL](0);[R5] [C5] column_value_old_md5:[NULL](0);[R5] [C6] column_name:medium_text;[R5] [C6] column_type:MYSQL_TYPE_MEDIUM_BLOB;[R5] [C6] column_is_rowkey:false;[R5] [C6] column_is_signed:true;[R5] [C6] column_encoding:utf8mb4;[R5] [C6] column_is_not_null:false;[R5] [C6] column_value_new_md5:[0a3db809cf76aca529fbda3a53b72144](8388608);[R5] [C6] column_value_old_md5:[0a3db809cf76aca529fbda3a53b72144](8388608);[R5] [C7] column_name:medium_blob;[R5] [C7] column_type:MYSQL_TYPE_MEDIUM_BLOB;[R5] [C7] column_is_rowkey:false;[R5] [C7] column_is_signed:true;[R5] [C7] column_encoding:;[R5] [C7] column_is_not_null:false;[R5] [C7] column_value_new_md5:[NULL](0);[R5] [C7] column_value_old_md5:[NULL](0);[R5] [C8] column_name:long_text;[R5] [C8] column_type:MYSQL_TYPE_LONG_BLOB;[R5] [C8] column_is_rowkey:false;[R5] [C8] column_is_signed:true;[R5] [C8] column_encoding:utf8mb4;[R5] [C8] column_is_not_null:false;[R5] [C8] column_value_new_md5:[db083e766fc6ef3477d930314ab63dac](50331648);[R5] [C8] column_value_old_md5:[NULL](0);[R5] [C9] column_name:long_blob;[R5] [C9] column_type:MYSQL_TYPE_LONG_BLOB;[R5] [C9] column_is_rowkey:false;[R5] [C9] column_is_signed:true;[R5] [C9] column_encoding:;[R5] [C9] column_is_not_null:false;[R5] [C9] column_value_new_md5:[NULL](0);[R5] [C9] column_value_old_md5:[NULL](0);$[R6] COMMIT;
delete from t1;
ob1.oblog.next_dml;
[R0] BEGIN;[R0] org_cluster_id:1;[R1] record_type:DELETE;[R1] database_name:sys.oblog_db1;[R1] table_name:t1;[R1] log_event:true;[R1] column_count:9;[R1] source_category:SRC_FULL_RECORDED;[R1] source_type:SRC_OCEANBASE_1_0;[R1] has_pk:true;[R1] pk_info:(0);[R1] pks:pk;[R1] has_uk:false;[R1] uk_info:(null);[R1] uks:(null);[R1] [C1] column_name:pk;[R1] [C1] column_type:MYSQL_TYPE_LONG;[R1] [C1] column_is_rowkey:true;[R1] [C1] column_is_signed:true;[R1] [C1] column_encoding:;[R1] [C1] column_is_not_null:true;[R1] [C1] column_value_old:[1](1);[R1] [C2] column_name:tiny_text;[R1] [C2] column_type:MYSQL_TYPE_TINY_BLOB;[R1] [C2] column_is_rowkey:false;[R1] [C2] column_is_signed:true;[R1] [C2] column_encoding:utf8mb4;[R1] [C2] column_is_not_null:false;[R1] [C2] column_value_old_md5:[NULL](0);[R1] [C3] column_name:tiny_blob;[R1] [C3] column_type:MYSQL_TYPE_TINY_BLOB;[R1] [C3] column_is_rowkey:false;[R1] [C3] column_is_signed:true;[R1] [C3] column_encoding:;[R1] [C3] column_is_not_null:false;[R1] [C3] column_value_old_md5:[NULL](0);[R1] [C4] column_name:text_type;[R1] [C4] column_type:MYSQL_TYPE_BLOB;[R1] [C4] column_is_rowkey:false;[R1] [C4] column_is_signed:true;[R1] [C4] column_encoding:utf8mb4;[R1] [C4] column_is_not_null:false;[R1] [C4] column_value_old_md5:[NULL](0);[R1] [C5] column_name:blob_type;[R1] [C5] column_type:MYSQL_TYPE_BLOB;[R1] [C5] column_is_rowkey:false;[R1] [C5] column_is_signed:true;[R1] [C5] column_encoding:;[R1] [C5] column_is_not_null:false;[R1] [C5] column_value_old_md5:[NULL](0);[R1] [C6] column_name:medium_text;[R1] [C6] column_type:MYSQL_TYPE_MEDIUM_BLOB;[R1] [C6] column_is_rowkey:false;[R1] [C6] column_is_signed:true;[R1] [C6] column_encoding:utf8mb4;[R1] [C6] column_is_not_null:false;[R1] [C6] column_value_old_md5:[NULL](0);[R1] [C7] column_name:medium_blob;[R1] [C7] column_type:MYSQL_TYPE_MEDIUM_BLOB;[R1] [C7] column_is_rowkey:false;[R1] [C7] column_is_signed:true;[R1] [C7] column_encoding:;[R1] [C7] column_is_not_null:false;[R1] [C7] column_value_old_md5:[NULL](0);[R1] [C8] column_name:long_text;[R1] [C8] column_type:MYSQL_TYPE_LONG_BLOB;[R1] [C8] column_is_rowkey:false;[R1] [C8] column_is_signed:true;[R1] [C8] column_encoding:utf8mb4;[R1] [C8] column_is_not_null:false;[R1] [C8] column_value_old_md5:[NULL](0);[R1] [C9] column_name:long_blob;[R1] [C9] column_type:MYSQL_TYPE_LONG_BLOB;[R1] [C9] column_is_rowkey:false;[R1] [C9] column_is_signed:true;[R1] [C9] column_encoding:;[R1] [C9] column_is_not_null:false;[R1] [C9] column_value_old_md5:[NULL](0);$[R2] record_type:DELETE;[R2] database_name:sys.oblog_db1;[R2] table_name:t1;[R2] log_event:true;[R2] column_count:9;[R2] source_category:SRC_FULL_RECORDED;[R2] source_type:SRC_OCEANBASE_1_0;[R2] has_pk:true;[R2] pk_info:(0);[R2] pks:pk;[R2] has_uk:false;[R2] uk_info:(null);[R2] uks:(null);[R2] [C1] column_name:pk;[R2] [C1] column_type:MYSQL_TYPE_LONG;[R2] [C1] column_is_rowkey:true;[R2] [C1] column_is_signed:true;[R2] [C1] column_encoding:;[R2] [C1] column_is_not_null:true;[R2] [C1] column_value_old:[2](1);[R2] [C2] column_name:tiny_text;[R2] [C2] column_type:MYSQL_TYPE_TINY_BLOB;[R2] [C2] column_is_rowkey:false;[R2] [C2] column_is_signed:true;[R2] [C2] column_encoding:utf8mb4;[R2] [C2] column_is_not_null:false;[R2] [C2] column_value_old_md5:[d41d8cd98f00b204e9800998ecf8427e](0);[R2] [C3] column_name:tiny_blob;[R2] [C3] column_type:MYSQL_TYPE_TINY_BLOB;[R2] [C3] column_is_rowkey:false;[R2] [C3] column_is_signed:true;[R2] [C3] column_encoding:;[R2] [C3] column_is_not_null:false;[R2] [C3] column_value_old_md5:[d41d8cd98f00b204e9800998ecf8427e](0);[R2] [C4] column_name:text_type;[R2] [C4] column_type:MYSQL_TYPE_BLOB;[R2] [C4] column_is_rowkey:false;[R2] [C4] column_is_signed:true;[R2] [C4] column_encoding:utf8mb4;[R2] [C4] column_is_not_null:false;[R2] [C4] column_value_old_md5:[d41d8cd98f00b204e9800998ecf8427e](0);[R2] [C5] column_name:blob_type;[R2] [C5] column_type:MYSQL_TYPE_BLOB;[R2] [C5] column_is_rowkey:false;[R2] [C5] column_is_signed:true;[R2] [C5] column_encoding:;[R2] [C5] column_is_not_null:false;[R2] [C5] column_value_old_md5:[d41d8cd98f00b204e9800998ecf8427e](0);[R2] [C6] column_name:medium_text;[R2] [C6] column_type:MYSQL_TYPE_MEDIUM_BLOB;[R2] [C6] column_is_rowkey:false;[R2] [C6] column_is_signed:true;[R2] [C6] column_encoding:utf8mb4;[R2] [C6] column_is_not_null:false;[R2] [C6] column_value_old_md5:[d41d8cd98f00b204e9800998ecf8427e](0);[R2] [C7] column_name:medium_blob;[R2] [C7] column_type:MYSQL_TYPE_MEDIUM_BLOB;[R2] [C7] column_is_rowkey:false;[R2] [C7] column_is_signed:true;[R2] [C7] column_encoding:;[R2] [C7] column_is_not_null:false;[R2] [C7] column_value_old_md5:[d41d8cd98f00b204e9800998ecf8427e](0);[R2] [C8] column_name:long_text;[R2] [C8] column_type:MYSQL_TYPE_LONG_BLOB;[R2] [C8] column_is_rowkey:false;[R2] [C8] column_is_signed:true;[R2] [C8] column_encoding:utf8mb4;[R2] [C8] column_is_not_null:false;[R2] [C8] column_value_old_md5:[d41d8cd98f00b204e9800998ecf8427e](0);[R2] [C9] column_name:long_blob;[R2] [C9] column_type:MYSQL_TYPE_LONG_BLOB;[R2] [C9] column_is_rowkey:false;[R2] [C9] column_is_signed:true;[R2] [C9] column_encoding:;[R2] [C9] column_is_not_null:false;[R2] [C9] column_value_old_md5:[d41d8cd98f00b204e9800998ecf8427e](0);$[R3] record_type:DELETE;[R3] database_name:sys.oblog_db1;[R3] table_name:t1;[R3] log_event:true;[R3] column_count:9;[R3] source_category:SRC_FULL_RECORDED;[R3] source_type:SRC_OCEANBASE_1_0;[R3] has_pk:true;[R3] pk_info:(0);[R3] pks:pk;[R3] has_uk:false;[R3] uk_info:(null);[R3] uks:(null);[R3] [C1] column_name:pk;[R3] [C1] column_type:MYSQL_TYPE_LONG;[R3] [C1] column_is_rowkey:true;[R3] [C1] column_is_signed:true;[R3] [C1] column_encoding:;[R3] [C1] column_is_not_null:true;[R3] [C1] column_value_old:[3](1);[R3] [C2] column_name:tiny_text;[R3] [C2] column_type:MYSQL_TYPE_TINY_BLOB;[R3] [C2] column_is_rowkey:false;[R3] [C2] column_is_signed:true;[R3] [C2] column_encoding:utf8mb4;[R3] [C2] column_is_not_null:false;[R3] [C2] column_value_old_md5:[cb63280c6142bddf58025800093901ca](256);[R3] [C3] column_name:tiny_blob;[R3] [C3] column_type:MYSQL_TYPE_TINY_BLOB;[R3] [C3] column_is_rowkey:false;[R3] [C3] column_is_signed:true;[R3] [C3] column_encoding:;[R3] [C3] column_is_not_null:false;[R3] [C3] column_value_old_md5:[7490c42f7f5a2dd8e801021dadbeebe8](256);[R3] [C4] column_name:text_type;[R3] [C4] column_type:MYSQL_TYPE_BLOB;[R3] [C4] column_is_rowkey:false;[R3] [C4] column_is_signed:true;[R3] [C4] column_encoding:utf8mb4;[R3] [C4] column_is_not_null:false;[R3] [C4] column_value_old_md5:[0c8b65a2815c4d303a7f348b4b7aca67](65536);[R3] [C5] column_name:blob_type;[R3] [C5] column_type:MYSQL_TYPE_BLOB;[R3] [C5] column_is_rowkey:false;[R3] [C5] column_is_signed:true;[R3] [C5] column_encoding:;[R3] [C5] column_is_not_null:false;[R3] [C5] column_value_old_md5:[9a8618f4df0feb7290bdac2af7ba389a](65536);[R3] [C6] column_name:medium_text;[R3] [C6] column_type:MYSQL_TYPE_MEDIUM_BLOB;[R3] [C6] column_is_rowkey:false;[R3] [C6] column_is_signed:true;[R3] [C6] column_encoding:utf8mb4;[R3] [C6] column_is_not_null:false;[R3] [C6] column_value_old_md5:[52c2d77c71e95f33b31fdc18fed1a134](16777216);[R3] [C7] column_name:medium_blob;[R3] [C7] column_type:MYSQL_TYPE_MEDIUM_BLOB;[R3] [C7] column_is_rowkey:false;[R3] [C7] column_is_signed:true;[R3] [C7] column_encoding:;[R3] [C7] column_is_not_null:false;[R3] [C7] column_value_old_md5:[5252f385601387fcad48a42063b9b7ce](16777216);[R3] [C8] column_name:long_text;[R3] [C8] column_type:MYSQL_TYPE_LONG_BLOB;[R3] [C8] column_is_rowkey:false;[R3] [C8] column_is_signed:true;[R3] [C8] column_encoding:utf8mb4;[R3] [C8] column_is_not_null:false;[R3] [C8] column_value_old_md5:[d41d8cd98f00b204e9800998ecf8427e](0);[R3] [C9] column_name:long_blob;[R3] [C9] column_type:MYSQL_TYPE_LONG_BLOB;[R3] [C9] column_is_rowkey:false;[R3] [C9] column_is_signed:true;[R3] [C9] column_encoding:;[R3] [C9] column_is_not_null:false;[R3] [C9] column_value_old_md5:[d41d8cd98f00b204e9800998ecf8427e](0);$[R4] record_type:DELETE;[R4] database_name:sys.oblog_db1;[R4] table_name:t1;[R4] log_event:true;[R4] column_count:9;[R4] source_category:SRC_FULL_RECORDED;[R4] source_type:SRC_OCEANBASE_1_0;[R4] has_pk:true;[R4] pk_info:(0);[R4] pks:pk;[R4] has_uk:false;[R4] uk_info:(null);[R4] uks:(null);[R4] [C1] column_name:pk;[R4] [C1] column_type:MYSQL_TYPE_LONG;[R4] [C1] column_is_rowkey:true;[R4] [C1] column_is_signed:true;[R4] [C1] column_encoding:;[R4] [C1] column_is_not_null:true;[R4] [C1] column_value_old:[4](1);[R4] [C2] column_name:tiny_text;[R4] [C2] column_type:MYSQL_TYPE_TINY_BLOB;[R4] [C2] column_is_rowkey:false;[R4] [C2] column_is_signed:true;[R4] [C2] column_encoding:utf8mb4;[R4] [C2] column_is_not_null:false;[R4] [C2] column_value_old_md5:[d41d8cd98f00b204e9800998ecf8427e](0);[R4] [C3] column_name:tiny_blob;[R4] [C3] column_type:MYSQL_TYPE_TINY_BLOB;[R4] [C3] column_is_rowkey:false;[R4] [C3] column_is_signed:true;[R4] [C3] column_encoding:;[R4] [C3] column_is_not_null:false;[R4] [C3] column_value_old_md5:[d41d8cd98f00b204e9800998ecf8427e](0);[R4] [C4] column_name:text_type;[R4] [C4] column_type:MYSQL_TYPE_BLOB;[R4] [C4] column_is_rowkey:false;[R4] [C4] column_is_signed:true;[R4] [C4] column_encoding:utf8mb4;[R4] [C4] column_is_not_null:false;[R4] [C4] column_value_old_md5:[d41d8cd98f00b204e9800998ecf8427e](0);[R4] [C5] column_name:blob_type;[R4] [C5] column_type:MYSQL_TYPE_BLOB;[R4] [C5] column_is_rowkey:false;[R4] [C5] column_is_signed:true;[R4] [C5] column_encoding:;[R4] [C5] column_is_not_null:false;[R4] [C5] column_value_old_md5:[d41d8cd98f00b204e9800998ecf8427e](0);[R4] [C6] column_name:medium_text;[R4] [C6] column_type:MYSQL_TYPE_MEDIUM_BLOB;[R4] [C6] column_is_rowkey:false;[R4] [C6] column_is_signed:true;[R4] [C6] column_encoding:utf8mb4;[R4] [C6] column_is_not_null:false;[R4] [C6] column_value_old_md5:[d41d8cd98f00b204e9800998ecf8427e](0);[R4] [C7] column_name:medium_blob;[R4] [C7] column_type:MYSQL_TYPE_MEDIUM_BLOB;[R4] [C7] column_is_rowkey:false;[R4] [C7] column_is_signed:true;[R4] [C7] column_encoding:;[R4] [C7] column_is_not_null:false;[R4] [C7] column_value_old_md5:[d41d8cd98f00b204e9800998ecf8427e](0);[R4] [C8] column_name:long_text;[R4] [C8] column_type:MYSQL_TYPE_LONG_BLOB;[R4] [C8] column_is_rowkey:false;[R4] [C8] column_is_signed:true;[R4] [C8] column_encoding:utf8mb4;[R4] [C8] column_is_not_null:false;[R4] [C8] column_value_old_md5:[dc802351f6717547cbf4c951b294f952](50331648);[R4] [C9] column_name:long_blob;[R4] [C9] column_type:MYSQL_TYPE_LONG_BLOB;[R4] [C9] column_is_rowkey:false;[R4] [C9] column_is_signed:true;[R4] [C9] column_encoding:;[R4] [C9] column_is_not_null:false;[R4] [C9] column_value_old_md5:[2c935e46cfdb63ec4d3dc7c05351aa7f](11534336);$[R5] record_type:DELETE;[R5] database_name:sys.oblog_db1;[R5] table_name:t1;[R5] log_event:true;[R5] column_count:9;[R5] source_category:SRC_FULL_RECORDED;[R5] source_type:SRC_OCEANBASE_1_0;[R5] has_pk:true;[R5] pk_info:(0);[R5] pks:pk;[R5] has_uk:false;[R5] uk_info:(null);[R5] uks:(null);[R5] [C1] column_name:pk;[R5] [C1] column_type:MYSQL_TYPE_LONG;[R5] [C1] column_is_rowkey:true;[R5] [C1] column_is_signed:true;[R5] [C1] column_encoding:;[R5] [C1] column_is_not_null:true;[R5] [C1] column_value_old:[5](1);[R5] [C2] column_name:tiny_text;[R5] [C2] column_type:MYSQL_TYPE_TINY_BLOB;[R5] [C2] column_is_rowkey:false;[R5] [C2] column_is_signed:true;[R5] [C2] column_encoding:utf8mb4;[R5] [C2] column_is_not_null:false;[R5] [C2] column_value_old_md5:[d41d8cd98f00b204e9800998ecf8427e](0);[R5] [C3] column_name:tiny_blob;[R5] [C3] column_type:MYSQL_TYPE_TINY_BLOB;[R5] [C3] column_is_rowkey:false;[R5] [C3] column_is_signed:true;[R5] [C3] column_encoding:;[R5] [C3] column_is_not_null:false;[R5] [C3] column_value_old_md5:[d41d8cd98f00b204e9800998ecf8427e](0);[R5] [C4] column_name:text_type;[R5] [C4] column_type:MYSQL_TYPE_BLOB;[R5] [C4] column_is_rowkey:false;[R5] [C4] column_is_signed:true;[R5] [C4] column_encoding:utf8mb4;[R5] [C4] column_is_not_null:false;[R5] [C4] column_value_old_md5:[d41d8cd98f00b204e9800998ecf8427e](0);[R5] [C5] column_name:blob_type;[R5] [C5] column_type:MYSQL_TYPE_BLOB;[R5] [C5] column_is_rowkey:false;[R5] [C5] column_is_signed:true;[R5] [C5] column_encoding:;[R5] [C5] column_is_not_null:false;[R5] [C5] column_value_old_md5:[d41d8cd98f00b204e9800998ecf8427e](0);[R5] [C6] column_name:medium_text;[R5] [C6] column_type:MYSQL_TYPE_MEDIUM_BLOB;[R5] [C6] column_is_rowkey:false;[R5] [C6] column_is_signed:true;[R5] [C6] column_encoding:utf8mb4;[R5] [C6] column_is_not_null:false;[R5] [C6] column_value_old_md5:[06247e1a56b142ec268db9b3f386fe3f](11534336);[R5] [C7] column_name:medium_blob;[R5] [C7] column_type:MYSQL_TYPE_MEDIUM_BLOB;[R5] [C7] column_is_rowkey:false;[R5] [C7] column_is_signed:true;[R5] [C7] column_encoding:;[R5] [C7] column_is_not_null:false;[R5] [C7] column_value_old_md5:[c293f256a0536aea96841c43e234f087](16777216);[R5] [C8] column_name:long_text;[R5] [C8] column_type:MYSQL_TYPE_LONG_BLOB;[R5] [C8] column_is_rowkey:false;[R5] [C8] column_is_signed:true;[R5] [C8] column_encoding:utf8mb4;[R5] [C8] column_is_not_null:false;[R5] [C8] column_value_old_md5:[f4ebbd7ee987045431259a108166f794](16777216);[R5] [C9] column_name:long_blob;[R5] [C9] column_type:MYSQL_TYPE_LONG_BLOB;[R5] [C9] column_is_rowkey:false;[R5] [C9] column_is_signed:true;[R5] [C9] column_encoding:;[R5] [C9] column_is_not_null:false;[R5] [C9] column_value_old_md5:[9286278fa964597184ea7c164e899ab3](16777216);$[R6] record_type:DELETE;[R6] database_name:sys.oblog_db1;[R6] table_name:t1;[R6] log_event:true;[R6] column_count:9;[R6] source_category:SRC_FULL_RECORDED;[R6] source_type:SRC_OCEANBASE_1_0;[R6] has_pk:true;[R6] pk_info:(0);[R6] pks:pk;[R6] has_uk:false;[R6] uk_info:(null);[R6] uks:(null);[R6] [C1] column_name:pk;[R6] [C1] column_type:MYSQL_TYPE_LONG;[R6] [C1] column_is_rowkey:true;[R6] [C1] column_is_signed:true;[R6] [C1] column_encoding:;[R6] [C1] column_is_not_null:true;[R6] [C1] column_value_old:[100](3);[R6] [C2] column_name:tiny_text;[R6] [C2] column_type:MYSQL_TYPE_TINY_BLOB;[R6] [C2] column_is_rowkey:false;[R6] [C2] column_is_signed:true;[R6] [C2] column_encoding:utf8mb4;[R6] [C2] column_is_not_null:false;[R6] [C2] column_value_old_md5:[NULL](0);[R6] [C3] column_name:tiny_blob;[R6] [C3] column_type:MYSQL_TYPE_TINY_BLOB;[R6] [C3] column_is_rowkey:false;[R6] [C3] column_is_signed:true;[R6] [C3] column_encoding:;[R6] [C3] column_is_not_null:false;[R6] [C3] column_value_old_md5:[NULL](0);[R6] [C4] column_name:text_type;[R6] [C4] column_type:MYSQL_TYPE_BLOB;[R6] [C4] column_is_rowkey:false;[R6] [C4] column_is_signed:true;[R6] [C4] column_encoding:utf8mb4;[R6] [C4] column_is_not_null:false;[R6] [C4] column_value_old_md5:[NULL](0);[R6] [C5] column_name:blob_type;[R6] [C5] column_type:MYSQL_TYPE_BLOB;[R6] [C5] column_is_rowkey:false;[R6] [C5] column_is_signed:true;[R6] [C5] column_encoding:;[R6] [C5] column_is_not_null:false;[R6] [C5] column_value_old_md5:[NULL](0);[R6] [C6] column_name:medium_text;[R6] [C6] column_type:MYSQL_TYPE_MEDIUM_BLOB;[R6] [C6] column_is_rowkey:false;[R6] [C6] column_is_signed:true;[R6] [C6] column_encoding:utf8mb4;[R6] [C6] column_is_not_null:false;[R6] [C6] column_value_old_md5:[NULL](0);[R6] [C7] column_name:medium_blob;[R6] [C7] column_type:MYSQL_TYPE_MEDIUM_BLOB;[R6] [C7] column_is_rowkey:false;[R6] [C7] column_is_signed:true;[R6] [C7] column_encoding:;[R6] [C7] column_is_not_null:false;[R6] [C7] column_value_old_md5:[NULL](0);[R6] [C8] column_name:long_text;[R6] [C8] column_type:MYSQL_TYPE_LONG_BLOB;[R6] [C8] column_is_rowkey:false;[R6] [C8] column_is_signed:true;[R6] [C8] column_encoding:utf8mb4;[R6] [C8] column_is_not_null:false;[R6] [C8] column_value_old_md5:[NULL](0);[R6] [C9] column_name:long_blob;[R6] [C9] column_type:MYSQL_TYPE_LONG_BLOB;[R6] [C9] column_is_rowkey:false;[R6] [C9] column_is_signed:true;[R6] [C9] column_encoding:;[R6] [C9] column_is_not_null:false;[R6] [C9] column_value_old_md5:[b4fc0c467a8d5b04868d12a0d3f43a92](2097152);$[R7] record_type:DELETE;[R7] database_name:sys.oblog_db1;[R7] table_name:t1;[R7] log_event:true;[R7] column_count:9;[R7] source_category:SRC_FULL_RECORDED;[R7] source_type:SRC_OCEANBASE_1_0;[R7] has_pk:true;[R7] pk_info:(0);[R7] pks:pk;[R7] has_uk:false;[R7] uk_info:(null);[R7] uks:(null);[R7] [C1] column_name:pk;[R7] [C1] column_type:MYSQL_TYPE_LONG;[R7] [C1] column_is_rowkey:true;[R7] [C1] column_is_signed:true;[R7] [C1] column_encoding:;[R7] [C1] column_is_not_null:true;[R7] [C1] column_value_old:[200](3);[R7] [C2] column_name:tiny_text;[R7] [C2] column_type:MYSQL_TYPE_TINY_BLOB;[R7] [C2] column_is_rowkey:false;[R7] [C2] column_is_signed:true;[R7] [C2] column_encoding:utf8mb4;[R7] [C2] column_is_not_null:false;[R7] [C2] column_value_old_md5:[NULL](0);[R7] [C3] column_name:tiny_blob;[R7] [C3] column_type:MYSQL_TYPE_TINY_BLOB;[R7] [C3] column_is_rowkey:false;[R7] [C3] column_is_signed:true;[R7] [C3] column_encoding:;[R7] [C3] column_is_not_null:false;[R7] [C3] column_value_old_md5:[NULL](0);[R7] [C4] column_name:text_type;[R7] [C4] column_type:MYSQL_TYPE_BLOB;[R7] [C4] column_is_rowkey:false;[R7] [C4] column_is_signed:true;[R7] [C4] column_encoding:utf8mb4;[R7] [C4] column_is_not_null:false;[R7] [C4] column_value_old_md5:[f49f763496f52447cf31360dd8287701](16384);[R7] [C5] column_name:blob_type;[R7] [C5] column_type:MYSQL_TYPE_BLOB;[R7] [C5] column_is_rowkey:false;[R7] [C5] column_is_signed:true;[R7] [C5] column_encoding:;[R7] [C5] column_is_not_null:false;[R7] [C5] column_value_old_md5:[NULL](0);[R7] [C6] column_name:medium_text;[R7] [C6] column_type:MYSQL_TYPE_MEDIUM_BLOB;[R7] [C6] column_is_rowkey:false;[R7] [C6] column_is_signed:true;[R7] [C6] column_encoding:utf8mb4;[R7] [C6] column_is_not_null:false;[R7] [C6] column_value_old_md5:[0a3db809cf76aca529fbda3a53b72144](8388608);[R7] [C7] column_name:medium_blob;[R7] [C7] column_type:MYSQL_TYPE_MEDIUM_BLOB;[R7] [C7] column_is_rowkey:false;[R7] [C7] column_is_signed:true;[R7] [C7] column_encoding:;[R7] [C7] column_is_not_null:false;[R7] [C7] column_value_old_md5:[NULL](0);[R7] [C8] column_name:long_text;[R7] [C8] column_type:MYSQL_TYPE_LONG_BLOB;[R7] [C8] column_is_rowkey:false;[R7] [C8] column_is_signed:true;[R7] [C8] column_encoding:utf8mb4;[R7] [C8] column_is_not_null:false;[R7] [C8] column_value_old_md5:[db083e766fc6ef3477d930314ab63dac](50331648);[R7] [C9] column_name:long_blob;[R7] [C9] column_type:MYSQL_TYPE_LONG_BLOB;[R7] [C9] column_is_rowkey:false;[R7] [C9] column_is_signed:true;[R7] [C9] column_encoding:;[R7] [C9] column_is_not_null:false;[R7] [C9] column_value_old_md5:[NULL](0);$[R8] COMMIT;
create table t2(pk int primary key, tiny_text tinytext, tiny_blob tinyblob, text_type text, blob_type blob, medium_text mediumtext, medium_blob mediumblob, long_text longtext, long_blob longblob);
begin;
insert into t1 (pk) values (1);
insert into t2 (pk) values (1);
insert into t1 values (2, repeat('1', 256), repeat('2', 256), repeat('3', 65536), repeat('4', 65536), repeat('5', 1048576), repeat('6', 1048576), "", "");
insert into t2 values (2, repeat('1', 256), repeat('2', 256), repeat('3', 65536), repeat('4', 65536), repeat('5', 1048576), repeat('6', 1048576), "", "");
select md5(tiny_text),  md5(tiny_blob), md5(text_type), md5(blob_type), md5(medium_text), md5(medium_blob), md5(long_text), md5(long_blob) from t1 where pk = 2;
md5(tiny_text)	md5(tiny_blob)	md5(text_type)	md5(blob_type)	md5(medium_text)	md5(medium_blob)	md5(long_text)	md5(long_blob)
cb63280c6142bddf58025800093901ca	7490c42f7f5a2dd8e801021dadbeebe8	0c8b65a2815c4d303a7f348b4b7aca67	9a8618f4df0feb7290bdac2af7ba389a	803b29bfaaec2d131d49d0a3a5161bd3	99952049d5e6088d8a3db1846c04d444	d41d8cd98f00b204e9800998ecf8427e	d41d8cd98f00b204e9800998ecf8427e
insert into t1 values (3, 'a', 'bb', 'ccc', 'dddd', 'eeee', 'fffff', 'gggggg', 'hhhhhhh');
insert into t2 values (3, 'a', 'bb', 'ccc', 'dddd', 'eeee', 'fffff', 'gggggg', 'hhhhhhh');
select md5(tiny_text),  md5(tiny_blob), md5(text_type), md5(blob_type), md5(medium_text), md5(medium_blob), md5(long_text), md5(long_blob) from t1 where pk = 3;
md5(tiny_text)	md5(tiny_blob)	md5(text_type)	md5(blob_type)	md5(medium_text)	md5(medium_blob)	md5(long_text)	md5(long_blob)
0cc175b9c0f1b6a831c399e269772661	21ad0bd836b90d08f4cf640b4c298e7c	9df62e693988eb4e1e1444ece0578579	11ddbaf3386aea1f2974eee984542152	670da91be64127c92faac35c8300e814	a98f6f64e6cdfac22ab2ffd15a7241e3	9cafeef08db2dd477098a0293e71f90a	b5c75e6bbcfcd0e6520b5f1419ded614
insert into t1 values (4, repeat('1', 256), repeat('2', 256), repeat('3', 65536), repeat('4', 65536), repeat('5', 1048576), repeat('6', 1048576), repeat('7', 6291456), repeat('8', 6291456));
insert into t2 values (4, repeat('1', 256), repeat('2', 256), repeat('3', 65536), repeat('4', 65536), repeat('5', 1048576), repeat('6', 1048576), repeat('7', 6291456), repeat('8', 6291456));
select md5(tiny_text),  md5(tiny_blob), md5(text_type), md5(blob_type), md5(medium_text), md5(medium_blob), md5(long_text), md5(long_blob) from t1 where pk = 4;
md5(tiny_text)	md5(tiny_blob)	md5(text_type)	md5(blob_type)	md5(medium_text)	md5(medium_blob)	md5(long_text)	md5(long_blob)
cb63280c6142bddf58025800093901ca	7490c42f7f5a2dd8e801021dadbeebe8	0c8b65a2815c4d303a7f348b4b7aca67	9a8618f4df0feb7290bdac2af7ba389a	803b29bfaaec2d131d49d0a3a5161bd3	99952049d5e6088d8a3db1846c04d444	d6dc533b969c7c6622fce46fb33926f4	f0382b245dd979c9f24486f3b164b60d
insert into t1 values (5, repeat('1', 256), repeat('2', 256), repeat('3', 65536), repeat('4', 65536), repeat('5', 16777216), repeat('6', 16777216), repeat('7', 13631488), repeat('8', 13631488));
insert into t2 values (5, repeat('1', 256), repeat('2', 256), repeat('3', 65536), repeat('4', 65536), repeat('5', 16777216), repeat('6', 16777216), repeat('7', 13631488), repeat('8', 13631488));
select md5(tiny_text),  md5(tiny_blob), md5(text_type), md5(blob_type), md5(medium_text), md5(medium_blob), md5(long_text), md5(long_blob) from t1 where pk = 5;
md5(tiny_text)	md5(tiny_blob)	md5(text_type)	md5(blob_type)	md5(medium_text)	md5(medium_blob)	md5(long_text)	md5(long_blob)
cb63280c6142bddf58025800093901ca	7490c42f7f5a2dd8e801021dadbeebe8	0c8b65a2815c4d303a7f348b4b7aca67	9a8618f4df0feb7290bdac2af7ba389a	52c2d77c71e95f33b31fdc18fed1a134	5252f385601387fcad48a42063b9b7ce	01ec5ac3b20b67f5a7e361ad003be80a	c38cfc9065746da60c28833e89808d01
commit;
ob1.oblog.next_dml;
[R0] BEGIN;[R0] org_cluster_id:1;[R1] record_type:INSERT;[R1] database_name:sys.oblog_db1;[R1] table_name:t1;[R1] log_event:true;[R1] column_count:9;[R1] source_category:SRC_FULL_RECORDED;[R1] source_type:SRC_OCEANBASE_1_0;[R1] has_pk:true;[R1] pk_info:(0);[R1] pks:pk;[R1] has_uk:false;[R1] uk_info:(null);[R1] uks:(null);[R1] [C1] column_name:pk;[R1] [C1] column_type:MYSQL_TYPE_LONG;[R1] [C1] column_is_rowkey:true;[R1] [C1] column_is_signed:true;[R1] [C1] column_encoding:;[R1] [C1] column_is_not_null:true;[R1] [C1] column_value_new:[1](1);[R1] [C2] column_name:tiny_text;[R1] [C2] column_type:MYSQL_TYPE_TINY_BLOB;[R1] [C2] column_is_rowkey:false;[R1] [C2] column_is_signed:true;[R1] [C2] column_encoding:utf8mb4;[R1] [C2] column_is_not_null:false;[R1] [C2] column_value_new_md5:[NULL](0);[R1] [C3] column_name:tiny_blob;[R1] [C3] column_type:MYSQL_TYPE_TINY_BLOB;[R1] [C3] column_is_rowkey:false;[R1] [C3] column_is_signed:true;[R1] [C3] column_encoding:;[R1] [C3] column_is_not_null:false;[R1] [C3] column_value_new_md5:[NULL](0);[R1] [C4] column_name:text_type;[R1] [C4] column_type:MYSQL_TYPE_BLOB;[R1] [C4] column_is_rowkey:false;[R1] [C4] column_is_signed:true;[R1] [C4] column_encoding:utf8mb4;[R1] [C4] column_is_not_null:false;[R1] [C4] column_value_new_md5:[NULL](0);[R1] [C5] column_name:blob_type;[R1] [C5] column_type:MYSQL_TYPE_BLOB;[R1] [C5] column_is_rowkey:false;[R1] [C5] column_is_signed:true;[R1] [C5] column_encoding:;[R1] [C5] column_is_not_null:false;[R1] [C5] column_value_new_md5:[NULL](0);[R1] [C6] column_name:medium_text;[R1] [C6] column_type:MYSQL_TYPE_MEDIUM_BLOB;[R1] [C6] column_is_rowkey:false;[R1] [C6] column_is_signed:true;[R1] [C6] column_encoding:utf8mb4;[R1] [C6] column_is_not_null:false;[R1] [C6] column_value_new_md5:[NULL](0);[R1] [C7] column_name:medium_blob;[R1] [C7] column_type:MYSQL_TYPE_MEDIUM_BLOB;[R1] [C7] column_is_rowkey:false;[R1] [C7] column_is_signed:true;[R1] [C7] column_encoding:;[R1] [C7] column_is_not_null:false;[R1] [C7] column_value_new_md5:[NULL](0);[R1] [C8] column_name:long_text;[R1] [C8] column_type:MYSQL_TYPE_LONG_BLOB;[R1] [C8] column_is_rowkey:false;[R1] [C8] column_is_signed:true;[R1] [C8] column_encoding:utf8mb4;[R1] [C8] column_is_not_null:false;[R1] [C8] column_value_new_md5:[NULL](0);[R1] [C9] column_name:long_blob;[R1] [C9] column_type:MYSQL_TYPE_LONG_BLOB;[R1] [C9] column_is_rowkey:false;[R1] [C9] column_is_signed:true;[R1] [C9] column_encoding:;[R1] [C9] column_is_not_null:false;[R1] [C9] column_value_new_md5:[NULL](0);$[R2] record_type:INSERT;[R2] database_name:sys.oblog_db1;[R2] table_name:t1;[R2] log_event:true;[R2] column_count:9;[R2] source_category:SRC_FULL_RECORDED;[R2] source_type:SRC_OCEANBASE_1_0;[R2] has_pk:true;[R2] pk_info:(0);[R2] pks:pk;[R2] has_uk:false;[R2] uk_info:(null);[R2] uks:(null);[R2] [C1] column_name:pk;[R2] [C1] column_type:MYSQL_TYPE_LONG;[R2] [C1] column_is_rowkey:true;[R2] [C1] column_is_signed:true;[R2] [C1] column_encoding:;[R2] [C1] column_is_not_null:true;[R2] [C1] column_value_new:[2](1);[R2] [C2] column_name:tiny_text;[R2] [C2] column_type:MYSQL_TYPE_TINY_BLOB;[R2] [C2] column_is_rowkey:false;[R2] [C2] column_is_signed:true;[R2] [C2] column_encoding:utf8mb4;[R2] [C2] column_is_not_null:false;[R2] [C2] column_value_new_md5:[cb63280c6142bddf58025800093901ca](256);[R2] [C3] column_name:tiny_blob;[R2] [C3] column_type:MYSQL_TYPE_TINY_BLOB;[R2] [C3] column_is_rowkey:false;[R2] [C3] column_is_signed:true;[R2] [C3] column_encoding:;[R2] [C3] column_is_not_null:false;[R2] [C3] column_value_new_md5:[7490c42f7f5a2dd8e801021dadbeebe8](256);[R2] [C4] column_name:text_type;[R2] [C4] column_type:MYSQL_TYPE_BLOB;[R2] [C4] column_is_rowkey:false;[R2] [C4] column_is_signed:true;[R2] [C4] column_encoding:utf8mb4;[R2] [C4] column_is_not_null:false;[R2] [C4] column_value_new_md5:[0c8b65a2815c4d303a7f348b4b7aca67](65536);[R2] [C5] column_name:blob_type;[R2] [C5] column_type:MYSQL_TYPE_BLOB;[R2] [C5] column_is_rowkey:false;[R2] [C5] column_is_signed:true;[R2] [C5] column_encoding:;[R2] [C5] column_is_not_null:false;[R2] [C5] column_value_new_md5:[9a8618f4df0feb7290bdac2af7ba389a](65536);[R2] [C6] column_name:medium_text;[R2] [C6] column_type:MYSQL_TYPE_MEDIUM_BLOB;[R2] [C6] column_is_rowkey:false;[R2] [C6] column_is_signed:true;[R2] [C6] column_encoding:utf8mb4;[R2] [C6] column_is_not_null:false;[R2] [C6] column_value_new_md5:[803b29bfaaec2d131d49d0a3a5161bd3](1048576);[R2] [C7] column_name:medium_blob;[R2] [C7] column_type:MYSQL_TYPE_MEDIUM_BLOB;[R2] [C7] column_is_rowkey:false;[R2] [C7] column_is_signed:true;[R2] [C7] column_encoding:;[R2] [C7] column_is_not_null:false;[R2] [C7] column_value_new_md5:[99952049d5e6088d8a3db1846c04d444](1048576);[R2] [C8] column_name:long_text;[R2] [C8] column_type:MYSQL_TYPE_LONG_BLOB;[R2] [C8] column_is_rowkey:false;[R2] [C8] column_is_signed:true;[R2] [C8] column_encoding:utf8mb4;[R2] [C8] column_is_not_null:false;[R2] [C8] column_value_new_md5:[d41d8cd98f00b204e9800998ecf8427e](0);[R2] [C9] column_name:long_blob;[R2] [C9] column_type:MYSQL_TYPE_LONG_BLOB;[R2] [C9] column_is_rowkey:false;[R2] [C9] column_is_signed:true;[R2] [C9] column_encoding:;[R2] [C9] column_is_not_null:false;[R2] [C9] column_value_new_md5:[d41d8cd98f00b204e9800998ecf8427e](0);$[R3] record_type:INSERT;[R3] database_name:sys.oblog_db1;[R3] table_name:t1;[R3] log_event:true;[R3] column_count:9;[R3] source_category:SRC_FULL_RECORDED;[R3] source_type:SRC_OCEANBASE_1_0;[R3] has_pk:true;[R3] pk_info:(0);[R3] pks:pk;[R3] has_uk:false;[R3] uk_info:(null);[R3] uks:(null);[R3] [C1] column_name:pk;[R3] [C1] column_type:MYSQL_TYPE_LONG;[R3] [C1] column_is_rowkey:true;[R3] [C1] column_is_signed:true;[R3] [C1] column_encoding:;[R3] [C1] column_is_not_null:true;[R3] [C1] column_value_new:[3](1);[R3] [C2] column_name:tiny_text;[R3] [C2] column_type:MYSQL_TYPE_TINY_BLOB;[R3] [C2] column_is_rowkey:false;[R3] [C2] column_is_signed:true;[R3] [C2] column_encoding:utf8mb4;[R3] [C2] column_is_not_null:false;[R3] [C2] column_value_new_md5:[0cc175b9c0f1b6a831c399e269772661](1);[R3] [C3] column_name:tiny_blob;[R3] [C3] column_type:MYSQL_TYPE_TINY_BLOB;[R3] [C3] column_is_rowkey:false;[R3] [C3] column_is_signed:true;[R3] [C3] column_encoding:;[R3] [C3] column_is_not_null:false;[R3] [C3] column_value_new_md5:[21ad0bd836b90d08f4cf640b4c298e7c](2);[R3] [C4] column_name:text_type;[R3] [C4] column_type:MYSQL_TYPE_BLOB;[R3] [C4] column_is_rowkey:false;[R3] [C4] column_is_signed:true;[R3] [C4] column_encoding:utf8mb4;[R3] [C4] column_is_not_null:false;[R3] [C4] column_value_new_md5:[9df62e693988eb4e1e1444ece0578579](3);[R3] [C5] column_name:blob_type;[R3] [C5] column_type:MYSQL_TYPE_BLOB;[R3] [C5] column_is_rowkey:false;[R3] [C5] column_is_signed:true;[R3] [C5] column_encoding:;[R3] [C5] column_is_not_null:false;[R3] [C5] column_value_new_md5:[11ddbaf3386aea1f2974eee984542152](4);[R3] [C6] column_name:medium_text;[R3] [C6] column_type:MYSQL_TYPE_MEDIUM_BLOB;[R3] [C6] column_is_rowkey:false;[R3] [C6] column_is_signed:true;[R3] [C6] column_encoding:utf8mb4;[R3] [C6] column_is_not_null:false;[R3] [C6] column_value_new_md5:[670da91be64127c92faac35c8300e814](4);[R3] [C7] column_name:medium_blob;[R3] [C7] column_type:MYSQL_TYPE_MEDIUM_BLOB;[R3] [C7] column_is_rowkey:false;[R3] [C7] column_is_signed:true;[R3] [C7] column_encoding:;[R3] [C7] column_is_not_null:false;[R3] [C7] column_value_new_md5:[a98f6f64e6cdfac22ab2ffd15a7241e3](5);[R3] [C8] column_name:long_text;[R3] [C8] column_type:MYSQL_TYPE_LONG_BLOB;[R3] [C8] column_is_rowkey:false;[R3] [C8] column_is_signed:true;[R3] [C8] column_encoding:utf8mb4;[R3] [C8] column_is_not_null:false;[R3] [C8] column_value_new_md5:[9cafeef08db2dd477098a0293e71f90a](6);[R3] [C9] column_name:long_blob;[R3] [C9] column_type:MYSQL_TYPE_LONG_BLOB;[R3] [C9] column_is_rowkey:false;[R3] [C9] column_is_signed:true;[R3] [C9] column_encoding:;[R3] [C9] column_is_not_null:false;[R3] [C9] column_value_new_md5:[b5c75e6bbcfcd0e6520b5f1419ded614](7);$[R4] record_type:INSERT;[R4] database_name:sys.oblog_db1;[R4] table_name:t1;[R4] log_event:true;[R4] column_count:9;[R4] source_category:SRC_FULL_RECORDED;[R4] source_type:SRC_OCEANBASE_1_0;[R4] has_pk:true;[R4] pk_info:(0);[R4] pks:pk;[R4] has_uk:false;[R4] uk_info:(null);[R4] uks:(null);[R4] [C1] column_name:pk;[R4] [C1] column_type:MYSQL_TYPE_LONG;[R4] [C1] column_is_rowkey:true;[R4] [C1] column_is_signed:true;[R4] [C1] column_encoding:;[R4] [C1] column_is_not_null:true;[R4] [C1] column_value_new:[4](1);[R4] [C2] column_name:tiny_text;[R4] [C2] column_type:MYSQL_TYPE_TINY_BLOB;[R4] [C2] column_is_rowkey:false;[R4] [C2] column_is_signed:true;[R4] [C2] column_encoding:utf8mb4;[R4] [C2] column_is_not_null:false;[R4] [C2] column_value_new_md5:[cb63280c6142bddf58025800093901ca](256);[R4] [C3] column_name:tiny_blob;[R4] [C3] column_type:MYSQL_TYPE_TINY_BLOB;[R4] [C3] column_is_rowkey:false;[R4] [C3] column_is_signed:true;[R4] [C3] column_encoding:;[R4] [C3] column_is_not_null:false;[R4] [C3] column_value_new_md5:[7490c42f7f5a2dd8e801021dadbeebe8](256);[R4] [C4] column_name:text_type;[R4] [C4] column_type:MYSQL_TYPE_BLOB;[R4] [C4] column_is_rowkey:false;[R4] [C4] column_is_signed:true;[R4] [C4] column_encoding:utf8mb4;[R4] [C4] column_is_not_null:false;[R4] [C4] column_value_new_md5:[0c8b65a2815c4d303a7f348b4b7aca67](65536);[R4] [C5] column_name:blob_type;[R4] [C5] column_type:MYSQL_TYPE_BLOB;[R4] [C5] column_is_rowkey:false;[R4] [C5] column_is_signed:true;[R4] [C5] column_encoding:;[R4] [C5] column_is_not_null:false;[R4] [C5] column_value_new_md5:[9a8618f4df0feb7290bdac2af7ba389a](65536);[R4] [C6] column_name:medium_text;[R4] [C6] column_type:MYSQL_TYPE_MEDIUM_BLOB;[R4] [C6] column_is_rowkey:false;[R4] [C6] column_is_signed:true;[R4] [C6] column_encoding:utf8mb4;[R4] [C6] column_is_not_null:false;[R4] [C6] column_value_new_md5:[803b29bfaaec2d131d49d0a3a5161bd3](1048576);[R4] [C7] column_name:medium_blob;[R4] [C7] column_type:MYSQL_TYPE_MEDIUM_BLOB;[R4] [C7] column_is_rowkey:false;[R4] [C7] column_is_signed:true;[R4] [C7] column_encoding:;[R4] [C7] column_is_not_null:false;[R4] [C7] column_value_new_md5:[99952049d5e6088d8a3db1846c04d444](1048576);[R4] [C8] column_name:long_text;[R4] [C8] column_type:MYSQL_TYPE_LONG_BLOB;[R4] [C8] column_is_rowkey:false;[R4] [C8] column_is_signed:true;[R4] [C8] column_encoding:utf8mb4;[R4] [C8] column_is_not_null:false;[R4] [C8] column_value_new_md5:[d6dc533b969c7c6622fce46fb33926f4](6291456);[R4] [C9] column_name:long_blob;[R4] [C9] column_type:MYSQL_TYPE_LONG_BLOB;[R4] [C9] column_is_rowkey:false;[R4] [C9] column_is_signed:true;[R4] [C9] column_encoding:;[R4] [C9] column_is_not_null:false;[R4] [C9] column_value_new_md5:[f0382b245dd979c9f24486f3b164b60d](6291456);$[R5] record_type:INSERT;[R5] database_name:sys.oblog_db1;[R5] table_name:t1;[R5] log_event:true;[R5] column_count:9;[R5] source_category:SRC_FULL_RECORDED;[R5] source_type:SRC_OCEANBASE_1_0;[R5] has_pk:true;[R5] pk_info:(0);[R5] pks:pk;[R5] has_uk:false;[R5] uk_info:(null);[R5] uks:(null);[R5] [C1] column_name:pk;[R5] [C1] column_type:MYSQL_TYPE_LONG;[R5] [C1] column_is_rowkey:true;[R5] [C1] column_is_signed:true;[R5] [C1] column_encoding:;[R5] [C1] column_is_not_null:true;[R5] [C1] column_value_new:[5](1);[R5] [C2] column_name:tiny_text;[R5] [C2] column_type:MYSQL_TYPE_TINY_BLOB;[R5] [C2] column_is_rowkey:false;[R5] [C2] column_is_signed:true;[R5] [C2] column_encoding:utf8mb4;[R5] [C2] column_is_not_null:false;[R5] [C2] column_value_new_md5:[cb63280c6142bddf58025800093901ca](256);[R5] [C3] column_name:tiny_blob;[R5] [C3] column_type:MYSQL_TYPE_TINY_BLOB;[R5] [C3] column_is_rowkey:false;[R5] [C3] column_is_signed:true;[R5] [C3] column_encoding:;[R5] [C3] column_is_not_null:false;[R5] [C3] column_value_new_md5:[7490c42f7f5a2dd8e801021dadbeebe8](256);[R5] [C4] column_name:text_type;[R5] [C4] column_type:MYSQL_TYPE_BLOB;[R5] [C4] column_is_rowkey:false;[R5] [C4] column_is_signed:true;[R5] [C4] column_encoding:utf8mb4;[R5] [C4] column_is_not_null:false;[R5] [C4] column_value_new_md5:[0c8b65a2815c4d303a7f348b4b7aca67](65536);[R5] [C5] column_name:blob_type;[R5] [C5] column_type:MYSQL_TYPE_BLOB;[R5] [C5] column_is_rowkey:false;[R5] [C5] column_is_signed:true;[R5] [C5] column_encoding:;[R5] [C5] column_is_not_null:false;[R5] [C5] column_value_new_md5:[9a8618f4df0feb7290bdac2af7ba389a](65536);[R5] [C6] column_name:medium_text;[R5] [C6] column_type:MYSQL_TYPE_MEDIUM_BLOB;[R5] [C6] column_is_rowkey:false;[R5] [C6] column_is_signed:true;[R5] [C6] column_encoding:utf8mb4;[R5] [C6] column_is_not_null:false;[R5] [C6] column_value_new_md5:[52c2d77c71e95f33b31fdc18fed1a134](16777216);[R5] [C7] column_name:medium_blob;[R5] [C7] column_type:MYSQL_TYPE_MEDIUM_BLOB;[R5] [C7] column_is_rowkey:false;[R5] [C7] column_is_signed:true;[R5] [C7] column_encoding:;[R5] [C7] column_is_not_null:false;[R5] [C7] column_value_new_md5:[5252f385601387fcad48a42063b9b7ce](16777216);[R5] [C8] column_name:long_text;[R5] [C8] column_type:MYSQL_TYPE_LONG_BLOB;[R5] [C8] column_is_rowkey:false;[R5] [C8] column_is_signed:true;[R5] [C8] column_encoding:utf8mb4;[R5] [C8] column_is_not_null:false;[R5] [C8] column_value_new_md5:[01ec5ac3b20b67f5a7e361ad003be80a](13631488);[R5] [C9] column_name:long_blob;[R5] [C9] column_type:MYSQL_TYPE_LONG_BLOB;[R5] [C9] column_is_rowkey:false;[R5] [C9] column_is_signed:true;[R5] [C9] column_encoding:;[R5] [C9] column_is_not_null:false;[R5] [C9] column_value_new_md5:[c38cfc9065746da60c28833e89808d01](13631488);$[R6] record_type:INSERT;[R6] database_name:sys.oblog_db1;[R6] table_name:t2;[R6] log_event:true;[R6] column_count:9;[R6] source_category:SRC_FULL_RECORDED;[R6] source_type:SRC_OCEANBASE_1_0;[R6] has_pk:true;[R6] pk_info:(0);[R6] pks:pk;[R6] has_uk:false;[R6] uk_info:(null);[R6] uks:(null);[R6] [C1] column_name:pk;[R6] [C1] column_type:MYSQL_TYPE_LONG;[R6] [C1] column_is_rowkey:true;[R6] [C1] column_is_signed:true;[R6] [C1] column_encoding:;[R6] [C1] column_is_not_null:true;[R6] [C1] column_value_new:[1](1);[R6] [C2] column_name:tiny_text;[R6] [C2] column_type:MYSQL_TYPE_TINY_BLOB;[R6] [C2] column_is_rowkey:false;[R6] [C2] column_is_signed:true;[R6] [C2] column_encoding:utf8mb4;[R6] [C2] column_is_not_null:false;[R6] [C2] column_value_new_md5:[NULL](0);[R6] [C3] column_name:tiny_blob;[R6] [C3] column_type:MYSQL_TYPE_TINY_BLOB;[R6] [C3] column_is_rowkey:false;[R6] [C3] column_is_signed:true;[R6] [C3] column_encoding:;[R6] [C3] column_is_not_null:false;[R6] [C3] column_value_new_md5:[NULL](0);[R6] [C4] column_name:text_type;[R6] [C4] column_type:MYSQL_TYPE_BLOB;[R6] [C4] column_is_rowkey:false;[R6] [C4] column_is_signed:true;[R6] [C4] column_encoding:utf8mb4;[R6] [C4] column_is_not_null:false;[R6] [C4] column_value_new_md5:[NULL](0);[R6] [C5] column_name:blob_type;[R6] [C5] column_type:MYSQL_TYPE_BLOB;[R6] [C5] column_is_rowkey:false;[R6] [C5] column_is_signed:true;[R6] [C5] column_encoding:;[R6] [C5] column_is_not_null:false;[R6] [C5] column_value_new_md5:[NULL](0);[R6] [C6] column_name:medium_text;[R6] [C6] column_type:MYSQL_TYPE_MEDIUM_BLOB;[R6] [C6] column_is_rowkey:false;[R6] [C6] column_is_signed:true;[R6] [C6] column_encoding:utf8mb4;[R6] [C6] column_is_not_null:false;[R6] [C6] column_value_new_md5:[NULL](0);[R6] [C7] column_name:medium_blob;[R6] [C7] column_type:MYSQL_TYPE_MEDIUM_BLOB;[R6] [C7] column_is_rowkey:false;[R6] [C7] column_is_signed:true;[R6] [C7] column_encoding:;[R6] [C7] column_is_not_null:false;[R6] [C7] column_value_new_md5:[NULL](0);[R6] [C8] column_name:long_text;[R6] [C8] column_type:MYSQL_TYPE_LONG_BLOB;[R6] [C8] column_is_rowkey:false;[R6] [C8] column_is_signed:true;[R6] [C8] column_encoding:utf8mb4;[R6] [C8] column_is_not_null:false;[R6] [C8] column_value_new_md5:[NULL](0);[R6] [C9] column_name:long_blob;[R6] [C9] column_type:MYSQL_TYPE_LONG_BLOB;[R6] [C9] column_is_rowkey:false;[R6] [C9] column_is_signed:true;[R6] [C9] column_encoding:;[R6] [C9] column_is_not_null:false;[R6] [C9] column_value_new_md5:[NULL](0);$[R7] record_type:INSERT;[R7] database_name:sys.oblog_db1;[R7] table_name:t2;[R7] log_event:true;[R7] column_count:9;[R7] source_category:SRC_FULL_RECORDED;[R7] source_type:SRC_OCEANBASE_1_0;[R7] has_pk:true;[R7] pk_info:(0);[R7] pks:pk;[R7] has_uk:false;[R7] uk_info:(null);[R7] uks:(null);[R7] [C1] column_name:pk;[R7] [C1] column_type:MYSQL_TYPE_LONG;[R7] [C1] column_is_rowkey:true;[R7] [C1] column_is_signed:true;[R7] [C1] column_encoding:;[R7] [C1] column_is_not_null:true;[R7] [C1] column_value_new:[2](1);[R7] [C2] column_name:tiny_text;[R7] [C2] column_type:MYSQL_TYPE_TINY_BLOB;[R7] [C2] column_is_rowkey:false;[R7] [C2] column_is_signed:true;[R7] [C2] column_encoding:utf8mb4;[R7] [C2] column_is_not_null:false;[R7] [C2] column_value_new_md5:[cb63280c6142bddf58025800093901ca](256);[R7] [C3] column_name:tiny_blob;[R7] [C3] column_type:MYSQL_TYPE_TINY_BLOB;[R7] [C3] column_is_rowkey:false;[R7] [C3] column_is_signed:true;[R7] [C3] column_encoding:;[R7] [C3] column_is_not_null:false;[R7] [C3] column_value_new_md5:[7490c42f7f5a2dd8e801021dadbeebe8](256);[R7] [C4] column_name:text_type;[R7] [C4] column_type:MYSQL_TYPE_BLOB;[R7] [C4] column_is_rowkey:false;[R7] [C4] column_is_signed:true;[R7] [C4] column_encoding:utf8mb4;[R7] [C4] column_is_not_null:false;[R7] [C4] column_value_new_md5:[0c8b65a2815c4d303a7f348b4b7aca67](65536);[R7] [C5] column_name:blob_type;[R7] [C5] column_type:MYSQL_TYPE_BLOB;[R7] [C5] column_is_rowkey:false;[R7] [C5] column_is_signed:true;[R7] [C5] column_encoding:;[R7] [C5] column_is_not_null:false;[R7] [C5] column_value_new_md5:[9a8618f4df0feb7290bdac2af7ba389a](65536);[R7] [C6] column_name:medium_text;[R7] [C6] column_type:MYSQL_TYPE_MEDIUM_BLOB;[R7] [C6] column_is_rowkey:false;[R7] [C6] column_is_signed:true;[R7] [C6] column_encoding:utf8mb4;[R7] [C6] column_is_not_null:false;[R7] [C6] column_value_new_md5:[803b29bfaaec2d131d49d0a3a5161bd3](1048576);[R7] [C7] column_name:medium_blob;[R7] [C7] column_type:MYSQL_TYPE_MEDIUM_BLOB;[R7] [C7] column_is_rowkey:false;[R7] [C7] column_is_signed:true;[R7] [C7] column_encoding:;[R7] [C7] column_is_not_null:false;[R7] [C7] column_value_new_md5:[99952049d5e6088d8a3db1846c04d444](1048576);[R7] [C8] column_name:long_text;[R7] [C8] column_type:MYSQL_TYPE_LONG_BLOB;[R7] [C8] column_is_rowkey:false;[R7] [C8] column_is_signed:true;[R7] [C8] column_encoding:utf8mb4;[R7] [C8] column_is_not_null:false;[R7] [C8] column_value_new_md5:[d41d8cd98f00b204e9800998ecf8427e](0);[R7] [C9] column_name:long_blob;[R7] [C9] column_type:MYSQL_TYPE_LONG_BLOB;[R7] [C9] column_is_rowkey:false;[R7] [C9] column_is_signed:true;[R7] [C9] column_encoding:;[R7] [C9] column_is_not_null:false;[R7] [C9] column_value_new_md5:[d41d8cd98f00b204e9800998ecf8427e](0);$[R8] record_type:INSERT;[R8] database_name:sys.oblog_db1;[R8] table_name:t2;[R8] log_event:true;[R8] column_count:9;[R8] source_category:SRC_FULL_RECORDED;[R8] source_type:SRC_OCEANBASE_1_0;[R8] has_pk:true;[R8] pk_info:(0);[R8] pks:pk;[R8] has_uk:false;[R8] uk_info:(null);[R8] uks:(null);[R8] [C1] column_name:pk;[R8] [C1] column_type:MYSQL_TYPE_LONG;[R8] [C1] column_is_rowkey:true;[R8] [C1] column_is_signed:true;[R8] [C1] column_encoding:;[R8] [C1] column_is_not_null:true;[R8] [C1] column_value_new:[3](1);[R8] [C2] column_name:tiny_text;[R8] [C2] column_type:MYSQL_TYPE_TINY_BLOB;[R8] [C2] column_is_rowkey:false;[R8] [C2] column_is_signed:true;[R8] [C2] column_encoding:utf8mb4;[R8] [C2] column_is_not_null:false;[R8] [C2] column_value_new_md5:[0cc175b9c0f1b6a831c399e269772661](1);[R8] [C3] column_name:tiny_blob;[R8] [C3] column_type:MYSQL_TYPE_TINY_BLOB;[R8] [C3] column_is_rowkey:false;[R8] [C3] column_is_signed:true;[R8] [C3] column_encoding:;[R8] [C3] column_is_not_null:false;[R8] [C3] column_value_new_md5:[21ad0bd836b90d08f4cf640b4c298e7c](2);[R8] [C4] column_name:text_type;[R8] [C4] column_type:MYSQL_TYPE_BLOB;[R8] [C4] column_is_rowkey:false;[R8] [C4] column_is_signed:true;[R8] [C4] column_encoding:utf8mb4;[R8] [C4] column_is_not_null:false;[R8] [C4] column_value_new_md5:[9df62e693988eb4e1e1444ece0578579](3);[R8] [C5] column_name:blob_type;[R8] [C5] column_type:MYSQL_TYPE_BLOB;[R8] [C5] column_is_rowkey:false;[R8] [C5] column_is_signed:true;[R8] [C5] column_encoding:;[R8] [C5] column_is_not_null:false;[R8] [C5] column_value_new_md5:[11ddbaf3386aea1f2974eee984542152](4);[R8] [C6] column_name:medium_text;[R8] [C6] column_type:MYSQL_TYPE_MEDIUM_BLOB;[R8] [C6] column_is_rowkey:false;[R8] [C6] column_is_signed:true;[R8] [C6] column_encoding:utf8mb4;[R8] [C6] column_is_not_null:false;[R8] [C6] column_value_new_md5:[670da91be64127c92faac35c8300e814](4);[R8] [C7] column_name:medium_blob;[R8] [C7] column_type:MYSQL_TYPE_MEDIUM_BLOB;[R8] [C7] column_is_rowkey:false;[R8] [C7] column_is_signed:true;[R8] [C7] column_encoding:;[R8] [C7] column_is_not_null:false;[R8] [C7] column_value_new_md5:[a98f6f64e6cdfac22ab2ffd15a7241e3](5);[R8] [C8] column_name:long_text;[R8] [C8] column_type:MYSQL_TYPE_LONG_BLOB;[R8] [C8] column_is_rowkey:false;[R8] [C8] column_is_signed:true;[R8] [C8] column_encoding:utf8mb4;[R8] [C8] column_is_not_null:false;[R8] [C8] column_value_new_md5:[9cafeef08db2dd477098a0293e71f90a](6);[R8] [C9] column_name:long_blob;[R8] [C9] column_type:MYSQL_TYPE_LONG_BLOB;[R8] [C9] column_is_rowkey:false;[R8] [C9] column_is_signed:true;[R8] [C9] column_encoding:;[R8] [C9] column_is_not_null:false;[R8] [C9] column_value_new_md5:[b5c75e6bbcfcd0e6520b5f1419ded614](7);$[R9] record_type:INSERT;[R9] database_name:sys.oblog_db1;[R9] table_name:t2;[R9] log_event:true;[R9] column_count:9;[R9] source_category:SRC_FULL_RECORDED;[R9] source_type:SRC_OCEANBASE_1_0;[R9] has_pk:true;[R9] pk_info:(0);[R9] pks:pk;[R9] has_uk:false;[R9] uk_info:(null);[R9] uks:(null);[R9] [C1] column_name:pk;[R9] [C1] column_type:MYSQL_TYPE_LONG;[R9] [C1] column_is_rowkey:true;[R9] [C1] column_is_signed:true;[R9] [C1] column_encoding:;[R9] [C1] column_is_not_null:true;[R9] [C1] column_value_new:[4](1);[R9] [C2] column_name:tiny_text;[R9] [C2] column_type:MYSQL_TYPE_TINY_BLOB;[R9] [C2] column_is_rowkey:false;[R9] [C2] column_is_signed:true;[R9] [C2] column_encoding:utf8mb4;[R9] [C2] column_is_not_null:false;[R9] [C2] column_value_new_md5:[cb63280c6142bddf58025800093901ca](256);[R9] [C3] column_name:tiny_blob;[R9] [C3] column_type:MYSQL_TYPE_TINY_BLOB;[R9] [C3] column_is_rowkey:false;[R9] [C3] column_is_signed:true;[R9] [C3] column_encoding:;[R9] [C3] column_is_not_null:false;[R9] [C3] column_value_new_md5:[7490c42f7f5a2dd8e801021dadbeebe8](256);[R9] [C4] column_name:text_type;[R9] [C4] column_type:MYSQL_TYPE_BLOB;[R9] [C4] column_is_rowkey:false;[R9] [C4] column_is_signed:true;[R9] [C4] column_encoding:utf8mb4;[R9] [C4] column_is_not_null:false;[R9] [C4] column_value_new_md5:[0c8b65a2815c4d303a7f348b4b7aca67](65536);[R9] [C5] column_name:blob_type;[R9] [C5] column_type:MYSQL_TYPE_BLOB;[R9] [C5] column_is_rowkey:false;[R9] [C5] column_is_signed:true;[R9] [C5] column_encoding:;[R9] [C5] column_is_not_null:false;[R9] [C5] column_value_new_md5:[9a8618f4df0feb7290bdac2af7ba389a](65536);[R9] [C6] column_name:medium_text;[R9] [C6] column_type:MYSQL_TYPE_MEDIUM_BLOB;[R9] [C6] column_is_rowkey:false;[R9] [C6] column_is_signed:true;[R9] [C6] column_encoding:utf8mb4;[R9] [C6] column_is_not_null:false;[R9] [C6] column_value_new_md5:[803b29bfaaec2d131d49d0a3a5161bd3](1048576);[R9] [C7] column_name:medium_blob;[R9] [C7] column_type:MYSQL_TYPE_MEDIUM_BLOB;[R9] [C7] column_is_rowkey:false;[R9] [C7] column_is_signed:true;[R9] [C7] column_encoding:;[R9] [C7] column_is_not_null:false;[R9] [C7] column_value_new_md5:[99952049d5e6088d8a3db1846c04d444](1048576);[R9] [C8] column_name:long_text;[R9] [C8] column_type:MYSQL_TYPE_LONG_BLOB;[R9] [C8] column_is_rowkey:false;[R9] [C8] column_is_signed:true;[R9] [C8] column_encoding:utf8mb4;[R9] [C8] column_is_not_null:false;[R9] [C8] column_value_new_md5:[d6dc533b969c7c6622fce46fb33926f4](6291456);[R9] [C9] column_name:long_blob;[R9] [C9] column_type:MYSQL_TYPE_LONG_BLOB;[R9] [C9] column_is_rowkey:false;[R9] [C9] column_is_signed:true;[R9] [C9] column_encoding:;[R9] [C9] column_is_not_null:false;[R9] [C9] column_value_new_md5:[f0382b245dd979c9f24486f3b164b60d](6291456);$[R10] record_type:INSERT;[R10] database_name:sys.oblog_db1;[R10] table_name:t2;[R10] log_event:true;[R10] column_count:9;[R10] source_category:SRC_FULL_RECORDED;[R10] source_type:SRC_OCEANBASE_1_0;[R10] has_pk:true;[R10] pk_info:(0);[R10] pks:pk;[R10] has_uk:false;[R10] uk_info:(null);[R10] uks:(null);[R10] [C1] column_name:pk;[R10] [C1] column_type:MYSQL_TYPE_LONG;[R10] [C1] column_is_rowkey:true;[R10] [C1] column_is_signed:true;[R10] [C1] column_encoding:;[R10] [C1] column_is_not_null:true;[R10] [C1] column_value_new:[5](1);[R10] [C2] column_name:tiny_text;[R10] [C2] column_type:MYSQL_TYPE_TINY_BLOB;[R10] [C2] column_is_rowkey:false;[R10] [C2] column_is_signed:true;[R10] [C2] column_encoding:utf8mb4;[R10] [C2] column_is_not_null:false;[R10] [C2] column_value_new_md5:[cb63280c6142bddf58025800093901ca](256);[R10] [C3] column_name:tiny_blob;[R10] [C3] column_type:MYSQL_TYPE_TINY_BLOB;[R10] [C3] column_is_rowkey:false;[R10] [C3] column_is_signed:true;[R10] [C3] column_encoding:;[R10] [C3] column_is_not_null:false;[R10] [C3] column_value_new_md5:[7490c42f7f5a2dd8e801021dadbeebe8](256);[R10] [C4] column_name:text_type;[R10] [C4] column_type:MYSQL_TYPE_BLOB;[R10] [C4] column_is_rowkey:false;[R10] [C4] column_is_signed:true;[R10] [C4] column_encoding:utf8mb4;[R10] [C4] column_is_not_null:false;[R10] [C4] column_value_new_md5:[0c8b65a2815c4d303a7f348b4b7aca67](65536);[R10] [C5] column_name:blob_type;[R10] [C5] column_type:MYSQL_TYPE_BLOB;[R10] [C5] column_is_rowkey:false;[R10] [C5] column_is_signed:true;[R10] [C5] column_encoding:;[R10] [C5] column_is_not_null:false;[R10] [C5] column_value_new_md5:[9a8618f4df0feb7290bdac2af7ba389a](65536);[R10] [C6] column_name:medium_text;[R10] [C6] column_type:MYSQL_TYPE_MEDIUM_BLOB;[R10] [C6] column_is_rowkey:false;[R10] [C6] column_is_signed:true;[R10] [C6] column_encoding:utf8mb4;[R10] [C6] column_is_not_null:false;[R10] [C6] column_value_new_md5:[52c2d77c71e95f33b31fdc18fed1a134](16777216);[R10] [C7] column_name:medium_blob;[R10] [C7] column_type:MYSQL_TYPE_MEDIUM_BLOB;[R10] [C7] column_is_rowkey:false;[R10] [C7] column_is_signed:true;[R10] [C7] column_encoding:;[R10] [C7] column_is_not_null:false;[R10] [C7] column_value_new_md5:[5252f385601387fcad48a42063b9b7ce](16777216);[R10] [C8] column_name:long_text;[R10] [C8] column_type:MYSQL_TYPE_LONG_BLOB;[R10] [C8] column_is_rowkey:false;[R10] [C8] column_is_signed:true;[R10] [C8] column_encoding:utf8mb4;[R10] [C8] column_is_not_null:false;[R10] [C8] column_value_new_md5:[01ec5ac3b20b67f5a7e361ad003be80a](13631488);[R10] [C9] column_name:long_blob;[R10] [C9] column_type:MYSQL_TYPE_LONG_BLOB;[R10] [C9] column_is_rowkey:false;[R10] [C9] column_is_signed:true;[R10] [C9] column_encoding:;[R10] [C9] column_is_not_null:false;[R10] [C9] column_value_new_md5:[c38cfc9065746da60c28833e89808d01](13631488);$[R11] COMMIT;
begin;
update t1 set long_blob="clear longblob";
select md5(long_blob) from t1 where pk = 1;
md5(long_blob)
49214d7046f5120b291cb68f1f12a455
update t2 set medium_blob="clear mediumblob";
select md5(medium_blob) from t2 where pk = 1;
md5(medium_blob)
f417980c2bf6f26bdf9d741d55929e27
update t2 set medium_blob="clear mediumblob";
select md5(medium_blob) from t2 where pk = 1;
md5(medium_blob)
f417980c2bf6f26bdf9d741d55929e27
update t1 set pk = 6 where pk = 5;
commit;
ob1.oblog.next_dml;
[R0] BEGIN;[R0] org_cluster_id:1;[R1] record_type:UPDATE;[R1] database_name:sys.oblog_db1;[R1] table_name:t1;[R1] log_event:true;[R1] column_count:9;[R1] source_category:SRC_FULL_RECORDED;[R1] source_type:SRC_OCEANBASE_1_0;[R1] has_pk:true;[R1] pk_info:(0);[R1] pks:pk;[R1] has_uk:false;[R1] uk_info:(null);[R1] uks:(null);[R1] [C1] column_name:pk;[R1] [C1] column_type:MYSQL_TYPE_LONG;[R1] [C1] column_is_rowkey:true;[R1] [C1] column_is_signed:true;[R1] [C1] column_encoding:;[R1] [C1] column_is_not_null:true;[R1] [C1] column_value_new:[1](1);[R1] [C1] column_value_old:[1](1);[R1] [C2] column_name:tiny_text;[R1] [C2] column_type:MYSQL_TYPE_TINY_BLOB;[R1] [C2] column_is_rowkey:false;[R1] [C2] column_is_signed:true;[R1] [C2] column_encoding:utf8mb4;[R1] [C2] column_is_not_null:false;[R1] [C2] column_value_new_md5:[NULL](0);[R1] [C2] column_value_old_md5:[NULL](0);[R1] [C3] column_name:tiny_blob;[R1] [C3] column_type:MYSQL_TYPE_TINY_BLOB;[R1] [C3] column_is_rowkey:false;[R1] [C3] column_is_signed:true;[R1] [C3] column_encoding:;[R1] [C3] column_is_not_null:false;[R1] [C3] column_value_new_md5:[NULL](0);[R1] [C3] column_value_old_md5:[NULL](0);[R1] [C4] column_name:text_type;[R1] [C4] column_type:MYSQL_TYPE_BLOB;[R1] [C4] column_is_rowkey:false;[R1] [C4] column_is_signed:true;[R1] [C4] column_encoding:utf8mb4;[R1] [C4] column_is_not_null:false;[R1] [C4] column_value_new_md5:[NULL](0);[R1] [C4] column_value_old_md5:[NULL](0);[R1] [C5] column_name:blob_type;[R1] [C5] column_type:MYSQL_TYPE_BLOB;[R1] [C5] column_is_rowkey:false;[R1] [C5] column_is_signed:true;[R1] [C5] column_encoding:;[R1] [C5] column_is_not_null:false;[R1] [C5] column_value_new_md5:[NULL](0);[R1] [C5] column_value_old_md5:[NULL](0);[R1] [C6] column_name:medium_text;[R1] [C6] column_type:MYSQL_TYPE_MEDIUM_BLOB;[R1] [C6] column_is_rowkey:false;[R1] [C6] column_is_signed:true;[R1] [C6] column_encoding:utf8mb4;[R1] [C6] column_is_not_null:false;[R1] [C6] column_value_new_md5:[NULL](0);[R1] [C6] column_value_old_md5:[NULL](0);[R1] [C7] column_name:medium_blob;[R1] [C7] column_type:MYSQL_TYPE_MEDIUM_BLOB;[R1] [C7] column_is_rowkey:false;[R1] [C7] column_is_signed:true;[R1] [C7] column_encoding:;[R1] [C7] column_is_not_null:false;[R1] [C7] column_value_new_md5:[NULL](0);[R1] [C7] column_value_old_md5:[NULL](0);[R1] [C8] column_name:long_text;[R1] [C8] column_type:MYSQL_TYPE_LONG_BLOB;[R1] [C8] column_is_rowkey:false;[R1] [C8] column_is_signed:true;[R1] [C8] column_encoding:utf8mb4;[R1] [C8] column_is_not_null:false;[R1] [C8] column_value_new_md5:[NULL](0);[R1] [C8] column_value_old_md5:[NULL](0);[R1] [C9] column_name:long_blob;[R1] [C9] column_type:MYSQL_TYPE_LONG_BLOB;[R1] [C9] column_is_rowkey:false;[R1] [C9] column_is_signed:true;[R1] [C9] column_encoding:;[R1] [C9] column_is_not_null:false;[R1] [C9] column_value_new_md5:[49214d7046f5120b291cb68f1f12a455](14);[R1] [C9] column_value_old_md5:[NULL](0);$[R2] record_type:UPDATE;[R2] database_name:sys.oblog_db1;[R2] table_name:t1;[R2] log_event:true;[R2] column_count:9;[R2] source_category:SRC_FULL_RECORDED;[R2] source_type:SRC_OCEANBASE_1_0;[R2] has_pk:true;[R2] pk_info:(0);[R2] pks:pk;[R2] has_uk:false;[R2] uk_info:(null);[R2] uks:(null);[R2] [C1] column_name:pk;[R2] [C1] column_type:MYSQL_TYPE_LONG;[R2] [C1] column_is_rowkey:true;[R2] [C1] column_is_signed:true;[R2] [C1] column_encoding:;[R2] [C1] column_is_not_null:true;[R2] [C1] column_value_new:[2](1);[R2] [C1] column_value_old:[2](1);[R2] [C2] column_name:tiny_text;[R2] [C2] column_type:MYSQL_TYPE_TINY_BLOB;[R2] [C2] column_is_rowkey:false;[R2] [C2] column_is_signed:true;[R2] [C2] column_encoding:utf8mb4;[R2] [C2] column_is_not_null:false;[R2] [C2] column_value_new_md5:[cb63280c6142bddf58025800093901ca](256);[R2] [C2] column_value_old_md5:[cb63280c6142bddf58025800093901ca](256);[R2] [C3] column_name:tiny_blob;[R2] [C3] column_type:MYSQL_TYPE_TINY_BLOB;[R2] [C3] column_is_rowkey:false;[R2] [C3] column_is_signed:true;[R2] [C3] column_encoding:;[R2] [C3] column_is_not_null:false;[R2] [C3] column_value_new_md5:[7490c42f7f5a2dd8e801021dadbeebe8](256);[R2] [C3] column_value_old_md5:[7490c42f7f5a2dd8e801021dadbeebe8](256);[R2] [C4] column_name:text_type;[R2] [C4] column_type:MYSQL_TYPE_BLOB;[R2] [C4] column_is_rowkey:false;[R2] [C4] column_is_signed:true;[R2] [C4] column_encoding:utf8mb4;[R2] [C4] column_is_not_null:false;[R2] [C4] column_value_new_md5:[0c8b65a2815c4d303a7f348b4b7aca67](65536);[R2] [C4] column_value_old_md5:[0c8b65a2815c4d303a7f348b4b7aca67](65536);[R2] [C5] column_name:blob_type;[R2] [C5] column_type:MYSQL_TYPE_BLOB;[R2] [C5] column_is_rowkey:false;[R2] [C5] column_is_signed:true;[R2] [C5] column_encoding:;[R2] [C5] column_is_not_null:false;[R2] [C5] column_value_new_md5:[9a8618f4df0feb7290bdac2af7ba389a](65536);[R2] [C5] column_value_old_md5:[9a8618f4df0feb7290bdac2af7ba389a](65536);[R2] [C6] column_name:medium_text;[R2] [C6] column_type:MYSQL_TYPE_MEDIUM_BLOB;[R2] [C6] column_is_rowkey:false;[R2] [C6] column_is_signed:true;[R2] [C6] column_encoding:utf8mb4;[R2] [C6] column_is_not_null:false;[R2] [C6] column_value_new_md5:[803b29bfaaec2d131d49d0a3a5161bd3](1048576);[R2] [C6] column_value_old_md5:[803b29bfaaec2d131d49d0a3a5161bd3](1048576);[R2] [C7] column_name:medium_blob;[R2] [C7] column_type:MYSQL_TYPE_MEDIUM_BLOB;[R2] [C7] column_is_rowkey:false;[R2] [C7] column_is_signed:true;[R2] [C7] column_encoding:;[R2] [C7] column_is_not_null:false;[R2] [C7] column_value_new_md5:[99952049d5e6088d8a3db1846c04d444](1048576);[R2] [C7] column_value_old_md5:[99952049d5e6088d8a3db1846c04d444](1048576);[R2] [C8] column_name:long_text;[R2] [C8] column_type:MYSQL_TYPE_LONG_BLOB;[R2] [C8] column_is_rowkey:false;[R2] [C8] column_is_signed:true;[R2] [C8] column_encoding:utf8mb4;[R2] [C8] column_is_not_null:false;[R2] [C8] column_value_new_md5:[d41d8cd98f00b204e9800998ecf8427e](0);[R2] [C8] column_value_old_md5:[d41d8cd98f00b204e9800998ecf8427e](0);[R2] [C9] column_name:long_blob;[R2] [C9] column_type:MYSQL_TYPE_LONG_BLOB;[R2] [C9] column_is_rowkey:false;[R2] [C9] column_is_signed:true;[R2] [C9] column_encoding:;[R2] [C9] column_is_not_null:false;[R2] [C9] column_value_new_md5:[49214d7046f5120b291cb68f1f12a455](14);[R2] [C9] column_value_old_md5:[d41d8cd98f00b204e9800998ecf8427e](0);$[R3] record_type:UPDATE;[R3] database_name:sys.oblog_db1;[R3] table_name:t1;[R3] log_event:true;[R3] column_count:9;[R3] source_category:SRC_FULL_RECORDED;[R3] source_type:SRC_OCEANBASE_1_0;[R3] has_pk:true;[R3] pk_info:(0);[R3] pks:pk;[R3] has_uk:false;[R3] uk_info:(null);[R3] uks:(null);[R3] [C1] column_name:pk;[R3] [C1] column_type:MYSQL_TYPE_LONG;[R3] [C1] column_is_rowkey:true;[R3] [C1] column_is_signed:true;[R3] [C1] column_encoding:;[R3] [C1] column_is_not_null:true;[R3] [C1] column_value_new:[3](1);[R3] [C1] column_value_old:[3](1);[R3] [C2] column_name:tiny_text;[R3] [C2] column_type:MYSQL_TYPE_TINY_BLOB;[R3] [C2] column_is_rowkey:false;[R3] [C2] column_is_signed:true;[R3] [C2] column_encoding:utf8mb4;[R3] [C2] column_is_not_null:false;[R3] [C2] column_value_new_md5:[0cc175b9c0f1b6a831c399e269772661](1);[R3] [C2] column_value_old_md5:[0cc175b9c0f1b6a831c399e269772661](1);[R3] [C3] column_name:tiny_blob;[R3] [C3] column_type:MYSQL_TYPE_TINY_BLOB;[R3] [C3] column_is_rowkey:false;[R3] [C3] column_is_signed:true;[R3] [C3] column_encoding:;[R3] [C3] column_is_not_null:false;[R3] [C3] column_value_new_md5:[21ad0bd836b90d08f4cf640b4c298e7c](2);[R3] [C3] column_value_old_md5:[21ad0bd836b90d08f4cf640b4c298e7c](2);[R3] [C4] column_name:text_type;[R3] [C4] column_type:MYSQL_TYPE_BLOB;[R3] [C4] column_is_rowkey:false;[R3] [C4] column_is_signed:true;[R3] [C4] column_encoding:utf8mb4;[R3] [C4] column_is_not_null:false;[R3] [C4] column_value_new_md5:[9df62e693988eb4e1e1444ece0578579](3);[R3] [C4] column_value_old_md5:[9df62e693988eb4e1e1444ece0578579](3);[R3] [C5] column_name:blob_type;[R3] [C5] column_type:MYSQL_TYPE_BLOB;[R3] [C5] column_is_rowkey:false;[R3] [C5] column_is_signed:true;[R3] [C5] column_encoding:;[R3] [C5] column_is_not_null:false;[R3] [C5] column_value_new_md5:[11ddbaf3386aea1f2974eee984542152](4);[R3] [C5] column_value_old_md5:[11ddbaf3386aea1f2974eee984542152](4);[R3] [C6] column_name:medium_text;[R3] [C6] column_type:MYSQL_TYPE_MEDIUM_BLOB;[R3] [C6] column_is_rowkey:false;[R3] [C6] column_is_signed:true;[R3] [C6] column_encoding:utf8mb4;[R3] [C6] column_is_not_null:false;[R3] [C6] column_value_new_md5:[670da91be64127c92faac35c8300e814](4);[R3] [C6] column_value_old_md5:[670da91be64127c92faac35c8300e814](4);[R3] [C7] column_name:medium_blob;[R3] [C7] column_type:MYSQL_TYPE_MEDIUM_BLOB;[R3] [C7] column_is_rowkey:false;[R3] [C7] column_is_signed:true;[R3] [C7] column_encoding:;[R3] [C7] column_is_not_null:false;[R3] [C7] column_value_new_md5:[a98f6f64e6cdfac22ab2ffd15a7241e3](5);[R3] [C7] column_value_old_md5:[a98f6f64e6cdfac22ab2ffd15a7241e3](5);[R3] [C8] column_name:long_text;[R3] [C8] column_type:MYSQL_TYPE_LONG_BLOB;[R3] [C8] column_is_rowkey:false;[R3] [C8] column_is_signed:true;[R3] [C8] column_encoding:utf8mb4;[R3] [C8] column_is_not_null:false;[R3] [C8] column_value_new_md5:[9cafeef08db2dd477098a0293e71f90a](6);[R3] [C8] column_value_old_md5:[9cafeef08db2dd477098a0293e71f90a](6);[R3] [C9] column_name:long_blob;[R3] [C9] column_type:MYSQL_TYPE_LONG_BLOB;[R3] [C9] column_is_rowkey:false;[R3] [C9] column_is_signed:true;[R3] [C9] column_encoding:;[R3] [C9] column_is_not_null:false;[R3] [C9] column_value_new_md5:[49214d7046f5120b291cb68f1f12a455](14);[R3] [C9] column_value_old_md5:[b5c75e6bbcfcd0e6520b5f1419ded614](7);$[R4] record_type:UPDATE;[R4] database_name:sys.oblog_db1;[R4] table_name:t1;[R4] log_event:true;[R4] column_count:9;[R4] source_category:SRC_FULL_RECORDED;[R4] source_type:SRC_OCEANBASE_1_0;[R4] has_pk:true;[R4] pk_info:(0);[R4] pks:pk;[R4] has_uk:false;[R4] uk_info:(null);[R4] uks:(null);[R4] [C1] column_name:pk;[R4] [C1] column_type:MYSQL_TYPE_LONG;[R4] [C1] column_is_rowkey:true;[R4] [C1] column_is_signed:true;[R4] [C1] column_encoding:;[R4] [C1] column_is_not_null:true;[R4] [C1] column_value_new:[4](1);[R4] [C1] column_value_old:[4](1);[R4] [C2] column_name:tiny_text;[R4] [C2] column_type:MYSQL_TYPE_TINY_BLOB;[R4] [C2] column_is_rowkey:false;[R4] [C2] column_is_signed:true;[R4] [C2] column_encoding:utf8mb4;[R4] [C2] column_is_not_null:false;[R4] [C2] column_value_new_md5:[cb63280c6142bddf58025800093901ca](256);[R4] [C2] column_value_old_md5:[cb63280c6142bddf58025800093901ca](256);[R4] [C3] column_name:tiny_blob;[R4] [C3] column_type:MYSQL_TYPE_TINY_BLOB;[R4] [C3] column_is_rowkey:false;[R4] [C3] column_is_signed:true;[R4] [C3] column_encoding:;[R4] [C3] column_is_not_null:false;[R4] [C3] column_value_new_md5:[7490c42f7f5a2dd8e801021dadbeebe8](256);[R4] [C3] column_value_old_md5:[7490c42f7f5a2dd8e801021dadbeebe8](256);[R4] [C4] column_name:text_type;[R4] [C4] column_type:MYSQL_TYPE_BLOB;[R4] [C4] column_is_rowkey:false;[R4] [C4] column_is_signed:true;[R4] [C4] column_encoding:utf8mb4;[R4] [C4] column_is_not_null:false;[R4] [C4] column_value_new_md5:[0c8b65a2815c4d303a7f348b4b7aca67](65536);[R4] [C4] column_value_old_md5:[0c8b65a2815c4d303a7f348b4b7aca67](65536);[R4] [C5] column_name:blob_type;[R4] [C5] column_type:MYSQL_TYPE_BLOB;[R4] [C5] column_is_rowkey:false;[R4] [C5] column_is_signed:true;[R4] [C5] column_encoding:;[R4] [C5] column_is_not_null:false;[R4] [C5] column_value_new_md5:[9a8618f4df0feb7290bdac2af7ba389a](65536);[R4] [C5] column_value_old_md5:[9a8618f4df0feb7290bdac2af7ba389a](65536);[R4] [C6] column_name:medium_text;[R4] [C6] column_type:MYSQL_TYPE_MEDIUM_BLOB;[R4] [C6] column_is_rowkey:false;[R4] [C6] column_is_signed:true;[R4] [C6] column_encoding:utf8mb4;[R4] [C6] column_is_not_null:false;[R4] [C6] column_value_new_md5:[803b29bfaaec2d131d49d0a3a5161bd3](1048576);[R4] [C6] column_value_old_md5:[803b29bfaaec2d131d49d0a3a5161bd3](1048576);[R4] [C7] column_name:medium_blob;[R4] [C7] column_type:MYSQL_TYPE_MEDIUM_BLOB;[R4] [C7] column_is_rowkey:false;[R4] [C7] column_is_signed:true;[R4] [C7] column_encoding:;[R4] [C7] column_is_not_null:false;[R4] [C7] column_value_new_md5:[99952049d5e6088d8a3db1846c04d444](1048576);[R4] [C7] column_value_old_md5:[99952049d5e6088d8a3db1846c04d444](1048576);[R4] [C8] column_name:long_text;[R4] [C8] column_type:MYSQL_TYPE_LONG_BLOB;[R4] [C8] column_is_rowkey:false;[R4] [C8] column_is_signed:true;[R4] [C8] column_encoding:utf8mb4;[R4] [C8] column_is_not_null:false;[R4] [C8] column_value_new_md5:[d6dc533b969c7c6622fce46fb33926f4](6291456);[R4] [C8] column_value_old_md5:[d6dc533b969c7c6622fce46fb33926f4](6291456);[R4] [C9] column_name:long_blob;[R4] [C9] column_type:MYSQL_TYPE_LONG_BLOB;[R4] [C9] column_is_rowkey:false;[R4] [C9] column_is_signed:true;[R4] [C9] column_encoding:;[R4] [C9] column_is_not_null:false;[R4] [C9] column_value_new_md5:[49214d7046f5120b291cb68f1f12a455](14);[R4] [C9] column_value_old_md5:[f0382b245dd979c9f24486f3b164b60d](6291456);$[R5] record_type:UPDATE;[R5] database_name:sys.oblog_db1;[R5] table_name:t1;[R5] log_event:true;[R5] column_count:9;[R5] source_category:SRC_FULL_RECORDED;[R5] source_type:SRC_OCEANBASE_1_0;[R5] has_pk:true;[R5] pk_info:(0);[R5] pks:pk;[R5] has_uk:false;[R5] uk_info:(null);[R5] uks:(null);[R5] [C1] column_name:pk;[R5] [C1] column_type:MYSQL_TYPE_LONG;[R5] [C1] column_is_rowkey:true;[R5] [C1] column_is_signed:true;[R5] [C1] column_encoding:;[R5] [C1] column_is_not_null:true;[R5] [C1] column_value_new:[5](1);[R5] [C1] column_value_old:[5](1);[R5] [C2] column_name:tiny_text;[R5] [C2] column_type:MYSQL_TYPE_TINY_BLOB;[R5] [C2] column_is_rowkey:false;[R5] [C2] column_is_signed:true;[R5] [C2] column_encoding:utf8mb4;[R5] [C2] column_is_not_null:false;[R5] [C2] column_value_new_md5:[cb63280c6142bddf58025800093901ca](256);[R5] [C2] column_value_old_md5:[cb63280c6142bddf58025800093901ca](256);[R5] [C3] column_name:tiny_blob;[R5] [C3] column_type:MYSQL_TYPE_TINY_BLOB;[R5] [C3] column_is_rowkey:false;[R5] [C3] column_is_signed:true;[R5] [C3] column_encoding:;[R5] [C3] column_is_not_null:false;[R5] [C3] column_value_new_md5:[7490c42f7f5a2dd8e801021dadbeebe8](256);[R5] [C3] column_value_old_md5:[7490c42f7f5a2dd8e801021dadbeebe8](256);[R5] [C4] column_name:text_type;[R5] [C4] column_type:MYSQL_TYPE_BLOB;[R5] [C4] column_is_rowkey:false;[R5] [C4] column_is_signed:true;[R5] [C4] column_encoding:utf8mb4;[R5] [C4] column_is_not_null:false;[R5] [C4] column_value_new_md5:[0c8b65a2815c4d303a7f348b4b7aca67](65536);[R5] [C4] column_value_old_md5:[0c8b65a2815c4d303a7f348b4b7aca67](65536);[R5] [C5] column_name:blob_type;[R5] [C5] column_type:MYSQL_TYPE_BLOB;[R5] [C5] column_is_rowkey:false;[R5] [C5] column_is_signed:true;[R5] [C5] column_encoding:;[R5] [C5] column_is_not_null:false;[R5] [C5] column_value_new_md5:[9a8618f4df0feb7290bdac2af7ba389a](65536);[R5] [C5] column_value_old_md5:[9a8618f4df0feb7290bdac2af7ba389a](65536);[R5] [C6] column_name:medium_text;[R5] [C6] column_type:MYSQL_TYPE_MEDIUM_BLOB;[R5] [C6] column_is_rowkey:false;[R5] [C6] column_is_signed:true;[R5] [C6] column_encoding:utf8mb4;[R5] [C6] column_is_not_null:false;[R5] [C6] column_value_new_md5:[52c2d77c71e95f33b31fdc18fed1a134](16777216);[R5] [C6] column_value_old_md5:[52c2d77c71e95f33b31fdc18fed1a134](16777216);[R5] [C7] column_name:medium_blob;[R5] [C7] column_type:MYSQL_TYPE_MEDIUM_BLOB;[R5] [C7] column_is_rowkey:false;[R5] [C7] column_is_signed:true;[R5] [C7] column_encoding:;[R5] [C7] column_is_not_null:false;[R5] [C7] column_value_new_md5:[5252f385601387fcad48a42063b9b7ce](16777216);[R5] [C7] column_value_old_md5:[5252f385601387fcad48a42063b9b7ce](16777216);[R5] [C8] column_name:long_text;[R5] [C8] column_type:MYSQL_TYPE_LONG_BLOB;[R5] [C8] column_is_rowkey:false;[R5] [C8] column_is_signed:true;[R5] [C8] column_encoding:utf8mb4;[R5] [C8] column_is_not_null:false;[R5] [C8] column_value_new_md5:[01ec5ac3b20b67f5a7e361ad003be80a](13631488);[R5] [C8] column_value_old_md5:[01ec5ac3b20b67f5a7e361ad003be80a](13631488);[R5] [C9] column_name:long_blob;[R5] [C9] column_type:MYSQL_TYPE_LONG_BLOB;[R5] [C9] column_is_rowkey:false;[R5] [C9] column_is_signed:true;[R5] [C9] column_encoding:;[R5] [C9] column_is_not_null:false;[R5] [C9] column_value_new_md5:[49214d7046f5120b291cb68f1f12a455](14);[R5] [C9] column_value_old_md5:[c38cfc9065746da60c28833e89808d01](13631488);$[R6] record_type:DELETE;[R6] database_name:sys.oblog_db1;[R6] table_name:t1;[R6] log_event:true;[R6] column_count:9;[R6] source_category:SRC_FULL_RECORDED;[R6] source_type:SRC_OCEANBASE_1_0;[R6] has_pk:true;[R6] pk_info:(0);[R6] pks:pk;[R6] has_uk:false;[R6] uk_info:(null);[R6] uks:(null);[R6] [C1] column_name:pk;[R6] [C1] column_type:MYSQL_TYPE_LONG;[R6] [C1] column_is_rowkey:true;[R6] [C1] column_is_signed:true;[R6] [C1] column_encoding:;[R6] [C1] column_is_not_null:true;[R6] [C1] column_value_old:[5](1);[R6] [C2] column_name:tiny_text;[R6] [C2] column_type:MYSQL_TYPE_TINY_BLOB;[R6] [C2] column_is_rowkey:false;[R6] [C2] column_is_signed:true;[R6] [C2] column_encoding:utf8mb4;[R6] [C2] column_is_not_null:false;[R6] [C2] column_value_old_md5:[cb63280c6142bddf58025800093901ca](256);[R6] [C3] column_name:tiny_blob;[R6] [C3] column_type:MYSQL_TYPE_TINY_BLOB;[R6] [C3] column_is_rowkey:false;[R6] [C3] column_is_signed:true;[R6] [C3] column_encoding:;[R6] [C3] column_is_not_null:false;[R6] [C3] column_value_old_md5:[7490c42f7f5a2dd8e801021dadbeebe8](256);[R6] [C4] column_name:text_type;[R6] [C4] column_type:MYSQL_TYPE_BLOB;[R6] [C4] column_is_rowkey:false;[R6] [C4] column_is_signed:true;[R6] [C4] column_encoding:utf8mb4;[R6] [C4] column_is_not_null:false;[R6] [C4] column_value_old_md5:[0c8b65a2815c4d303a7f348b4b7aca67](65536);[R6] [C5] column_name:blob_type;[R6] [C5] column_type:MYSQL_TYPE_BLOB;[R6] [C5] column_is_rowkey:false;[R6] [C5] column_is_signed:true;[R6] [C5] column_encoding:;[R6] [C5] column_is_not_null:false;[R6] [C5] column_value_old_md5:[9a8618f4df0feb7290bdac2af7ba389a](65536);[R6] [C6] column_name:medium_text;[R6] [C6] column_type:MYSQL_TYPE_MEDIUM_BLOB;[R6] [C6] column_is_rowkey:false;[R6] [C6] column_is_signed:true;[R6] [C6] column_encoding:utf8mb4;[R6] [C6] column_is_not_null:false;[R6] [C6] column_value_old_md5:[52c2d77c71e95f33b31fdc18fed1a134](16777216);[R6] [C7] column_name:medium_blob;[R6] [C7] column_type:MYSQL_TYPE_MEDIUM_BLOB;[R6] [C7] column_is_rowkey:false;[R6] [C7] column_is_signed:true;[R6] [C7] column_encoding:;[R6] [C7] column_is_not_null:false;[R6] [C7] column_value_old_md5:[5252f385601387fcad48a42063b9b7ce](16777216);[R6] [C8] column_name:long_text;[R6] [C8] column_type:MYSQL_TYPE_LONG_BLOB;[R6] [C8] column_is_rowkey:false;[R6] [C8] column_is_signed:true;[R6] [C8] column_encoding:utf8mb4;[R6] [C8] column_is_not_null:false;[R6] [C8] column_value_old_md5:[01ec5ac3b20b67f5a7e361ad003be80a](13631488);[R6] [C9] column_name:long_blob;[R6] [C9] column_type:MYSQL_TYPE_LONG_BLOB;[R6] [C9] column_is_rowkey:false;[R6] [C9] column_is_signed:true;[R6] [C9] column_encoding:;[R6] [C9] column_is_not_null:false;[R6] [C9] column_value_old_md5:[49214d7046f5120b291cb68f1f12a455](14);$[R7] record_type:INSERT;[R7] database_name:sys.oblog_db1;[R7] table_name:t1;[R7] log_event:true;[R7] column_count:9;[R7] source_category:SRC_FULL_RECORDED;[R7] source_type:SRC_OCEANBASE_1_0;[R7] has_pk:true;[R7] pk_info:(0);[R7] pks:pk;[R7] has_uk:false;[R7] uk_info:(null);[R7] uks:(null);[R7] [C1] column_name:pk;[R7] [C1] column_type:MYSQL_TYPE_LONG;[R7] [C1] column_is_rowkey:true;[R7] [C1] column_is_signed:true;[R7] [C1] column_encoding:;[R7] [C1] column_is_not_null:true;[R7] [C1] column_value_new:[6](1);[R7] [C2] column_name:tiny_text;[R7] [C2] column_type:MYSQL_TYPE_TINY_BLOB;[R7] [C2] column_is_rowkey:false;[R7] [C2] column_is_signed:true;[R7] [C2] column_encoding:utf8mb4;[R7] [C2] column_is_not_null:false;[R7] [C2] column_value_new_md5:[cb63280c6142bddf58025800093901ca](256);[R7] [C3] column_name:tiny_blob;[R7] [C3] column_type:MYSQL_TYPE_TINY_BLOB;[R7] [C3] column_is_rowkey:false;[R7] [C3] column_is_signed:true;[R7] [C3] column_encoding:;[R7] [C3] column_is_not_null:false;[R7] [C3] column_value_new_md5:[7490c42f7f5a2dd8e801021dadbeebe8](256);[R7] [C4] column_name:text_type;[R7] [C4] column_type:MYSQL_TYPE_BLOB;[R7] [C4] column_is_rowkey:false;[R7] [C4] column_is_signed:true;[R7] [C4] column_encoding:utf8mb4;[R7] [C4] column_is_not_null:false;[R7] [C4] column_value_new_md5:[0c8b65a2815c4d303a7f348b4b7aca67](65536);[R7] [C5] column_name:blob_type;[R7] [C5] column_type:MYSQL_TYPE_BLOB;[R7] [C5] column_is_rowkey:false;[R7] [C5] column_is_signed:true;[R7] [C5] column_encoding:;[R7] [C5] column_is_not_null:false;[R7] [C5] column_value_new_md5:[9a8618f4df0feb7290bdac2af7ba389a](65536);[R7] [C6] column_name:medium_text;[R7] [C6] column_type:MYSQL_TYPE_MEDIUM_BLOB;[R7] [C6] column_is_rowkey:false;[R7] [C6] column_is_signed:true;[R7] [C6] column_encoding:utf8mb4;[R7] [C6] column_is_not_null:false;[R7] [C6] column_value_new_md5:[52c2d77c71e95f33b31fdc18fed1a134](16777216);[R7] [C7] column_name:medium_blob;[R7] [C7] column_type:MYSQL_TYPE_MEDIUM_BLOB;[R7] [C7] column_is_rowkey:false;[R7] [C7] column_is_signed:true;[R7] [C7] column_encoding:;[R7] [C7] column_is_not_null:false;[R7] [C7] column_value_new_md5:[5252f385601387fcad48a42063b9b7ce](16777216);[R7] [C8] column_name:long_text;[R7] [C8] column_type:MYSQL_TYPE_LONG_BLOB;[R7] [C8] column_is_rowkey:false;[R7] [C8] column_is_signed:true;[R7] [C8] column_encoding:utf8mb4;[R7] [C8] column_is_not_null:false;[R7] [C8] column_value_new_md5:[01ec5ac3b20b67f5a7e361ad003be80a](13631488);[R7] [C9] column_name:long_blob;[R7] [C9] column_type:MYSQL_TYPE_LONG_BLOB;[R7] [C9] column_is_rowkey:false;[R7] [C9] column_is_signed:true;[R7] [C9] column_encoding:;[R7] [C9] column_is_not_null:false;[R7] [C9] column_value_new_md5:[49214d7046f5120b291cb68f1f12a455](14);$[R8] record_type:UPDATE;[R8] database_name:sys.oblog_db1;[R8] table_name:t2;[R8] log_event:true;[R8] column_count:9;[R8] source_category:SRC_FULL_RECORDED;[R8] source_type:SRC_OCEANBASE_1_0;[R8] has_pk:true;[R8] pk_info:(0);[R8] pks:pk;[R8] has_uk:false;[R8] uk_info:(null);[R8] uks:(null);[R8] [C1] column_name:pk;[R8] [C1] column_type:MYSQL_TYPE_LONG;[R8] [C1] column_is_rowkey:true;[R8] [C1] column_is_signed:true;[R8] [C1] column_encoding:;[R8] [C1] column_is_not_null:true;[R8] [C1] column_value_new:[1](1);[R8] [C1] column_value_old:[1](1);[R8] [C2] column_name:tiny_text;[R8] [C2] column_type:MYSQL_TYPE_TINY_BLOB;[R8] [C2] column_is_rowkey:false;[R8] [C2] column_is_signed:true;[R8] [C2] column_encoding:utf8mb4;[R8] [C2] column_is_not_null:false;[R8] [C2] column_value_new_md5:[NULL](0);[R8] [C2] column_value_old_md5:[NULL](0);[R8] [C3] column_name:tiny_blob;[R8] [C3] column_type:MYSQL_TYPE_TINY_BLOB;[R8] [C3] column_is_rowkey:false;[R8] [C3] column_is_signed:true;[R8] [C3] column_encoding:;[R8] [C3] column_is_not_null:false;[R8] [C3] column_value_new_md5:[NULL](0);[R8] [C3] column_value_old_md5:[NULL](0);[R8] [C4] column_name:text_type;[R8] [C4] column_type:MYSQL_TYPE_BLOB;[R8] [C4] column_is_rowkey:false;[R8] [C4] column_is_signed:true;[R8] [C4] column_encoding:utf8mb4;[R8] [C4] column_is_not_null:false;[R8] [C4] column_value_new_md5:[NULL](0);[R8] [C4] column_value_old_md5:[NULL](0);[R8] [C5] column_name:blob_type;[R8] [C5] column_type:MYSQL_TYPE_BLOB;[R8] [C5] column_is_rowkey:false;[R8] [C5] column_is_signed:true;[R8] [C5] column_encoding:;[R8] [C5] column_is_not_null:false;[R8] [C5] column_value_new_md5:[NULL](0);[R8] [C5] column_value_old_md5:[NULL](0);[R8] [C6] column_name:medium_text;[R8] [C6] column_type:MYSQL_TYPE_MEDIUM_BLOB;[R8] [C6] column_is_rowkey:false;[R8] [C6] column_is_signed:true;[R8] [C6] column_encoding:utf8mb4;[R8] [C6] column_is_not_null:false;[R8] [C6] column_value_new_md5:[NULL](0);[R8] [C6] column_value_old_md5:[NULL](0);[R8] [C7] column_name:medium_blob;[R8] [C7] column_type:MYSQL_TYPE_MEDIUM_BLOB;[R8] [C7] column_is_rowkey:false;[R8] [C7] column_is_signed:true;[R8] [C7] column_encoding:;[R8] [C7] column_is_not_null:false;[R8] [C7] column_value_new_md5:[f417980c2bf6f26bdf9d741d55929e27](16);[R8] [C7] column_value_old_md5:[NULL](0);[R8] [C8] column_name:long_text;[R8] [C8] column_type:MYSQL_TYPE_LONG_BLOB;[R8] [C8] column_is_rowkey:false;[R8] [C8] column_is_signed:true;[R8] [C8] column_encoding:utf8mb4;[R8] [C8] column_is_not_null:false;[R8] [C8] column_value_new_md5:[NULL](0);[R8] [C8] column_value_old_md5:[NULL](0);[R8] [C9] column_name:long_blob;[R8] [C9] column_type:MYSQL_TYPE_LONG_BLOB;[R8] [C9] column_is_rowkey:false;[R8] [C9] column_is_signed:true;[R8] [C9] column_encoding:;[R8] [C9] column_is_not_null:false;[R8] [C9] column_value_new_md5:[NULL](0);[R8] [C9] column_value_old_md5:[NULL](0);$[R9] record_type:UPDATE;[R9] database_name:sys.oblog_db1;[R9] table_name:t2;[R9] log_event:true;[R9] column_count:9;[R9] source_category:SRC_FULL_RECORDED;[R9] source_type:SRC_OCEANBASE_1_0;[R9] has_pk:true;[R9] pk_info:(0);[R9] pks:pk;[R9] has_uk:false;[R9] uk_info:(null);[R9] uks:(null);[R9] [C1] column_name:pk;[R9] [C1] column_type:MYSQL_TYPE_LONG;[R9] [C1] column_is_rowkey:true;[R9] [C1] column_is_signed:true;[R9] [C1] column_encoding:;[R9] [C1] column_is_not_null:true;[R9] [C1] column_value_new:[2](1);[R9] [C1] column_value_old:[2](1);[R9] [C2] column_name:tiny_text;[R9] [C2] column_type:MYSQL_TYPE_TINY_BLOB;[R9] [C2] column_is_rowkey:false;[R9] [C2] column_is_signed:true;[R9] [C2] column_encoding:utf8mb4;[R9] [C2] column_is_not_null:false;[R9] [C2] column_value_new_md5:[cb63280c6142bddf58025800093901ca](256);[R9] [C2] column_value_old_md5:[cb63280c6142bddf58025800093901ca](256);[R9] [C3] column_name:tiny_blob;[R9] [C3] column_type:MYSQL_TYPE_TINY_BLOB;[R9] [C3] column_is_rowkey:false;[R9] [C3] column_is_signed:true;[R9] [C3] column_encoding:;[R9] [C3] column_is_not_null:false;[R9] [C3] column_value_new_md5:[7490c42f7f5a2dd8e801021dadbeebe8](256);[R9] [C3] column_value_old_md5:[7490c42f7f5a2dd8e801021dadbeebe8](256);[R9] [C4] column_name:text_type;[R9] [C4] column_type:MYSQL_TYPE_BLOB;[R9] [C4] column_is_rowkey:false;[R9] [C4] column_is_signed:true;[R9] [C4] column_encoding:utf8mb4;[R9] [C4] column_is_not_null:false;[R9] [C4] column_value_new_md5:[0c8b65a2815c4d303a7f348b4b7aca67](65536);[R9] [C4] column_value_old_md5:[0c8b65a2815c4d303a7f348b4b7aca67](65536);[R9] [C5] column_name:blob_type;[R9] [C5] column_type:MYSQL_TYPE_BLOB;[R9] [C5] column_is_rowkey:false;[R9] [C5] column_is_signed:true;[R9] [C5] column_encoding:;[R9] [C5] column_is_not_null:false;[R9] [C5] column_value_new_md5:[9a8618f4df0feb7290bdac2af7ba389a](65536);[R9] [C5] column_value_old_md5:[9a8618f4df0feb7290bdac2af7ba389a](65536);[R9] [C6] column_name:medium_text;[R9] [C6] column_type:MYSQL_TYPE_MEDIUM_BLOB;[R9] [C6] column_is_rowkey:false;[R9] [C6] column_is_signed:true;[R9] [C6] column_encoding:utf8mb4;[R9] [C6] column_is_not_null:false;[R9] [C6] column_value_new_md5:[803b29bfaaec2d131d49d0a3a5161bd3](1048576);[R9] [C6] column_value_old_md5:[803b29bfaaec2d131d49d0a3a5161bd3](1048576);[R9] [C7] column_name:medium_blob;[R9] [C7] column_type:MYSQL_TYPE_MEDIUM_BLOB;[R9] [C7] column_is_rowkey:false;[R9] [C7] column_is_signed:true;[R9] [C7] column_encoding:;[R9] [C7] column_is_not_null:false;[R9] [C7] column_value_new_md5:[f417980c2bf6f26bdf9d741d55929e27](16);[R9] [C7] column_value_old_md5:[99952049d5e6088d8a3db1846c04d444](1048576);[R9] [C8] column_name:long_text;[R9] [C8] column_type:MYSQL_TYPE_LONG_BLOB;[R9] [C8] column_is_rowkey:false;[R9] [C8] column_is_signed:true;[R9] [C8] column_encoding:utf8mb4;[R9] [C8] column_is_not_null:false;[R9] [C8] column_value_new_md5:[d41d8cd98f00b204e9800998ecf8427e](0);[R9] [C8] column_value_old_md5:[d41d8cd98f00b204e9800998ecf8427e](0);[R9] [C9] column_name:long_blob;[R9] [C9] column_type:MYSQL_TYPE_LONG_BLOB;[R9] [C9] column_is_rowkey:false;[R9] [C9] column_is_signed:true;[R9] [C9] column_encoding:;[R9] [C9] column_is_not_null:false;[R9] [C9] column_value_new_md5:[d41d8cd98f00b204e9800998ecf8427e](0);[R9] [C9] column_value_old_md5:[d41d8cd98f00b204e9800998ecf8427e](0);$[R10] record_type:UPDATE;[R10] database_name:sys.oblog_db1;[R10] table_name:t2;[R10] log_event:true;[R10] column_count:9;[R10] source_category:SRC_FULL_RECORDED;[R10] source_type:SRC_OCEANBASE_1_0;[R10] has_pk:true;[R10] pk_info:(0);[R10] pks:pk;[R10] has_uk:false;[R10] uk_info:(null);[R10] uks:(null);[R10] [C1] column_name:pk;[R10] [C1] column_type:MYSQL_TYPE_LONG;[R10] [C1] column_is_rowkey:true;[R10] [C1] column_is_signed:true;[R10] [C1] column_encoding:;[R10] [C1] column_is_not_null:true;[R10] [C1] column_value_new:[3](1);[R10] [C1] column_value_old:[3](1);[R10] [C2] column_name:tiny_text;[R10] [C2] column_type:MYSQL_TYPE_TINY_BLOB;[R10] [C2] column_is_rowkey:false;[R10] [C2] column_is_signed:true;[R10] [C2] column_encoding:utf8mb4;[R10] [C2] column_is_not_null:false;[R10] [C2] column_value_new_md5:[0cc175b9c0f1b6a831c399e269772661](1);[R10] [C2] column_value_old_md5:[0cc175b9c0f1b6a831c399e269772661](1);[R10] [C3] column_name:tiny_blob;[R10] [C3] column_type:MYSQL_TYPE_TINY_BLOB;[R10] [C3] column_is_rowkey:false;[R10] [C3] column_is_signed:true;[R10] [C3] column_encoding:;[R10] [C3] column_is_not_null:false;[R10] [C3] column_value_new_md5:[21ad0bd836b90d08f4cf640b4c298e7c](2);[R10] [C3] column_value_old_md5:[21ad0bd836b90d08f4cf640b4c298e7c](2);[R10] [C4] column_name:text_type;[R10] [C4] column_type:MYSQL_TYPE_BLOB;[R10] [C4] column_is_rowkey:false;[R10] [C4] column_is_signed:true;[R10] [C4] column_encoding:utf8mb4;[R10] [C4] column_is_not_null:false;[R10] [C4] column_value_new_md5:[9df62e693988eb4e1e1444ece0578579](3);[R10] [C4] column_value_old_md5:[9df62e693988eb4e1e1444ece0578579](3);[R10] [C5] column_name:blob_type;[R10] [C5] column_type:MYSQL_TYPE_BLOB;[R10] [C5] column_is_rowkey:false;[R10] [C5] column_is_signed:true;[R10] [C5] column_encoding:;[R10] [C5] column_is_not_null:false;[R10] [C5] column_value_new_md5:[11ddbaf3386aea1f2974eee984542152](4);[R10] [C5] column_value_old_md5:[11ddbaf3386aea1f2974eee984542152](4);[R10] [C6] column_name:medium_text;[R10] [C6] column_type:MYSQL_TYPE_MEDIUM_BLOB;[R10] [C6] column_is_rowkey:false;[R10] [C6] column_is_signed:true;[R10] [C6] column_encoding:utf8mb4;[R10] [C6] column_is_not_null:false;[R10] [C6] column_value_new_md5:[670da91be64127c92faac35c8300e814](4);[R10] [C6] column_value_old_md5:[670da91be64127c92faac35c8300e814](4);[R10] [C7] column_name:medium_blob;[R10] [C7] column_type:MYSQL_TYPE_MEDIUM_BLOB;[R10] [C7] column_is_rowkey:false;[R10] [C7] column_is_signed:true;[R10] [C7] column_encoding:;[R10] [C7] column_is_not_null:false;[R10] [C7] column_value_new_md5:[f417980c2bf6f26bdf9d741d55929e27](16);[R10] [C7] column_value_old_md5:[a98f6f64e6cdfac22ab2ffd15a7241e3](5);[R10] [C8] column_name:long_text;[R10] [C8] column_type:MYSQL_TYPE_LONG_BLOB;[R10] [C8] column_is_rowkey:false;[R10] [C8] column_is_signed:true;[R10] [C8] column_encoding:utf8mb4;[R10] [C8] column_is_not_null:false;[R10] [C8] column_value_new_md5:[9cafeef08db2dd477098a0293e71f90a](6);[R10] [C8] column_value_old_md5:[9cafeef08db2dd477098a0293e71f90a](6);[R10] [C9] column_name:long_blob;[R10] [C9] column_type:MYSQL_TYPE_LONG_BLOB;[R10] [C9] column_is_rowkey:false;[R10] [C9] column_is_signed:true;[R10] [C9] column_encoding:;[R10] [C9] column_is_not_null:false;[R10] [C9] column_value_new_md5:[b5c75e6bbcfcd0e6520b5f1419ded614](7);[R10] [C9] column_value_old_md5:[b5c75e6bbcfcd0e6520b5f1419ded614](7);$[R11] record_type:UPDATE;[R11] database_name:sys.oblog_db1;[R11] table_name:t2;[R11] log_event:true;[R11] column_count:9;[R11] source_category:SRC_FULL_RECORDED;[R11] source_type:SRC_OCEANBASE_1_0;[R11] has_pk:true;[R11] pk_info:(0);[R11] pks:pk;[R11] has_uk:false;[R11] uk_info:(null);[R11] uks:(null);[R11] [C1] column_name:pk;[R11] [C1] column_type:MYSQL_TYPE_LONG;[R11] [C1] column_is_rowkey:true;[R11] [C1] column_is_signed:true;[R11] [C1] column_encoding:;[R11] [C1] column_is_not_null:true;[R11] [C1] column_value_new:[4](1);[R11] [C1] column_value_old:[4](1);[R11] [C2] column_name:tiny_text;[R11] [C2] column_type:MYSQL_TYPE_TINY_BLOB;[R11] [C2] column_is_rowkey:false;[R11] [C2] column_is_signed:true;[R11] [C2] column_encoding:utf8mb4;[R11] [C2] column_is_not_null:false;[R11] [C2] column_value_new_md5:[cb63280c6142bddf58025800093901ca](256);[R11] [C2] column_value_old_md5:[cb63280c6142bddf58025800093901ca](256);[R11] [C3] column_name:tiny_blob;[R11] [C3] column_type:MYSQL_TYPE_TINY_BLOB;[R11] [C3] column_is_rowkey:false;[R11] [C3] column_is_signed:true;[R11] [C3] column_encoding:;[R11] [C3] column_is_not_null:false;[R11] [C3] column_value_new_md5:[7490c42f7f5a2dd8e801021dadbeebe8](256);[R11] [C3] column_value_old_md5:[7490c42f7f5a2dd8e801021dadbeebe8](256);[R11] [C4] column_name:text_type;[R11] [C4] column_type:MYSQL_TYPE_BLOB;[R11] [C4] column_is_rowkey:false;[R11] [C4] column_is_signed:true;[R11] [C4] column_encoding:utf8mb4;[R11] [C4] column_is_not_null:false;[R11] [C4] column_value_new_md5:[0c8b65a2815c4d303a7f348b4b7aca67](65536);[R11] [C4] column_value_old_md5:[0c8b65a2815c4d303a7f348b4b7aca67](65536);[R11] [C5] column_name:blob_type;[R11] [C5] column_type:MYSQL_TYPE_BLOB;[R11] [C5] column_is_rowkey:false;[R11] [C5] column_is_signed:true;[R11] [C5] column_encoding:;[R11] [C5] column_is_not_null:false;[R11] [C5] column_value_new_md5:[9a8618f4df0feb7290bdac2af7ba389a](65536);[R11] [C5] column_value_old_md5:[9a8618f4df0feb7290bdac2af7ba389a](65536);[R11] [C6] column_name:medium_text;[R11] [C6] column_type:MYSQL_TYPE_MEDIUM_BLOB;[R11] [C6] column_is_rowkey:false;[R11] [C6] column_is_signed:true;[R11] [C6] column_encoding:utf8mb4;[R11] [C6] column_is_not_null:false;[R11] [C6] column_value_new_md5:[803b29bfaaec2d131d49d0a3a5161bd3](1048576);[R11] [C6] column_value_old_md5:[803b29bfaaec2d131d49d0a3a5161bd3](1048576);[R11] [C7] column_name:medium_blob;[R11] [C7] column_type:MYSQL_TYPE_MEDIUM_BLOB;[R11] [C7] column_is_rowkey:false;[R11] [C7] column_is_signed:true;[R11] [C7] column_encoding:;[R11] [C7] column_is_not_null:false;[R11] [C7] column_value_new_md5:[f417980c2bf6f26bdf9d741d55929e27](16);[R11] [C7] column_value_old_md5:[99952049d5e6088d8a3db1846c04d444](1048576);[R11] [C8] column_name:long_text;[R11] [C8] column_type:MYSQL_TYPE_LONG_BLOB;[R11] [C8] column_is_rowkey:false;[R11] [C8] column_is_signed:true;[R11] [C8] column_encoding:utf8mb4;[R11] [C8] column_is_not_null:false;[R11] [C8] column_value_new_md5:[d6dc533b969c7c6622fce46fb33926f4](6291456);[R11] [C8] column_value_old_md5:[d6dc533b969c7c6622fce46fb33926f4](6291456);[R11] [C9] column_name:long_blob;[R11] [C9] column_type:MYSQL_TYPE_LONG_BLOB;[R11] [C9] column_is_rowkey:false;[R11] [C9] column_is_signed:true;[R11] [C9] column_encoding:;[R11] [C9] column_is_not_null:false;[R11] [C9] column_value_new_md5:[f0382b245dd979c9f24486f3b164b60d](6291456);[R11] [C9] column_value_old_md5:[f0382b245dd979c9f24486f3b164b60d](6291456);$[R12] record_type:UPDATE;[R12] database_name:sys.oblog_db1;[R12] table_name:t2;[R12] log_event:true;[R12] column_count:9;[R12] source_category:SRC_FULL_RECORDED;[R12] source_type:SRC_OCEANBASE_1_0;[R12] has_pk:true;[R12] pk_info:(0);[R12] pks:pk;[R12] has_uk:false;[R12] uk_info:(null);[R12] uks:(null);[R12] [C1] column_name:pk;[R12] [C1] column_type:MYSQL_TYPE_LONG;[R12] [C1] column_is_rowkey:true;[R12] [C1] column_is_signed:true;[R12] [C1] column_encoding:;[R12] [C1] column_is_not_null:true;[R12] [C1] column_value_new:[5](1);[R12] [C1] column_value_old:[5](1);[R12] [C2] column_name:tiny_text;[R12] [C2] column_type:MYSQL_TYPE_TINY_BLOB;[R12] [C2] column_is_rowkey:false;[R12] [C2] column_is_signed:true;[R12] [C2] column_encoding:utf8mb4;[R12] [C2] column_is_not_null:false;[R12] [C2] column_value_new_md5:[cb63280c6142bddf58025800093901ca](256);[R12] [C2] column_value_old_md5:[cb63280c6142bddf58025800093901ca](256);[R12] [C3] column_name:tiny_blob;[R12] [C3] column_type:MYSQL_TYPE_TINY_BLOB;[R12] [C3] column_is_rowkey:false;[R12] [C3] column_is_signed:true;[R12] [C3] column_encoding:;[R12] [C3] column_is_not_null:false;[R12] [C3] column_value_new_md5:[7490c42f7f5a2dd8e801021dadbeebe8](256);[R12] [C3] column_value_old_md5:[7490c42f7f5a2dd8e801021dadbeebe8](256);[R12] [C4] column_name:text_type;[R12] [C4] column_type:MYSQL_TYPE_BLOB;[R12] [C4] column_is_rowkey:false;[R12] [C4] column_is_signed:true;[R12] [C4] column_encoding:utf8mb4;[R12] [C4] column_is_not_null:false;[R12] [C4] column_value_new_md5:[0c8b65a2815c4d303a7f348b4b7aca67](65536);[R12] [C4] column_value_old_md5:[0c8b65a2815c4d303a7f348b4b7aca67](65536);[R12] [C5] column_name:blob_type;[R12] [C5] column_type:MYSQL_TYPE_BLOB;[R12] [C5] column_is_rowkey:false;[R12] [C5] column_is_signed:true;[R12] [C5] column_encoding:;[R12] [C5] column_is_not_null:false;[R12] [C5] column_value_new_md5:[9a8618f4df0feb7290bdac2af7ba389a](65536);[R12] [C5] column_value_old_md5:[9a8618f4df0feb7290bdac2af7ba389a](65536);[R12] [C6] column_name:medium_text;[R12] [C6] column_type:MYSQL_TYPE_MEDIUM_BLOB;[R12] [C6] column_is_rowkey:false;[R12] [C6] column_is_signed:true;[R12] [C6] column_encoding:utf8mb4;[R12] [C6] column_is_not_null:false;[R12] [C6] column_value_new_md5:[52c2d77c71e95f33b31fdc18fed1a134](16777216);[R12] [C6] column_value_old_md5:[52c2d77c71e95f33b31fdc18fed1a134](16777216);[R12] [C7] column_name:medium_blob;[R12] [C7] column_type:MYSQL_TYPE_MEDIUM_BLOB;[R12] [C7] column_is_rowkey:false;[R12] [C7] column_is_signed:true;[R12] [C7] column_encoding:;[R12] [C7] column_is_not_null:false;[R12] [C7] column_value_new_md5:[f417980c2bf6f26bdf9d741d55929e27](16);[R12] [C7] column_value_old_md5:[5252f385601387fcad48a42063b9b7ce](16777216);[R12] [C8] column_name:long_text;[R12] [C8] column_type:MYSQL_TYPE_LONG_BLOB;[R12] [C8] column_is_rowkey:false;[R12] [C8] column_is_signed:true;[R12] [C8] column_encoding:utf8mb4;[R12] [C8] column_is_not_null:false;[R12] [C8] column_value_new_md5:[01ec5ac3b20b67f5a7e361ad003be80a](13631488);[R12] [C8] column_value_old_md5:[01ec5ac3b20b67f5a7e361ad003be80a](13631488);[R12] [C9] column_name:long_blob;[R12] [C9] column_type:MYSQL_TYPE_LONG_BLOB;[R12] [C9] column_is_rowkey:false;[R12] [C9] column_is_signed:true;[R12] [C9] column_encoding:;[R12] [C9] column_is_not_null:false;[R12] [C9] column_value_new_md5:[c38cfc9065746da60c28833e89808d01](13631488);[R12] [C9] column_value_old_md5:[c38cfc9065746da60c28833e89808d01](13631488);$[R13] COMMIT;
begin;
delete from t1 where pk = 1;
delete from t1 where pk = 4;
delete from t1 where pk = 3;
delete from t2 where pk = 2;
delete from t2 where pk = 5;
commit;
ob1.oblog.next_dml;
[R0] BEGIN;[R0] org_cluster_id:1;[R1] record_type:DELETE;[R1] database_name:sys.oblog_db1;[R1] table_name:t1;[R1] log_event:true;[R1] column_count:9;[R1] source_category:SRC_FULL_RECORDED;[R1] source_type:SRC_OCEANBASE_1_0;[R1] has_pk:true;[R1] pk_info:(0);[R1] pks:pk;[R1] has_uk:false;[R1] uk_info:(null);[R1] uks:(null);[R1] [C1] column_name:pk;[R1] [C1] column_type:MYSQL_TYPE_LONG;[R1] [C1] column_is_rowkey:true;[R1] [C1] column_is_signed:true;[R1] [C1] column_encoding:;[R1] [C1] column_is_not_null:true;[R1] [C1] column_value_old:[1](1);[R1] [C2] column_name:tiny_text;[R1] [C2] column_type:MYSQL_TYPE_TINY_BLOB;[R1] [C2] column_is_rowkey:false;[R1] [C2] column_is_signed:true;[R1] [C2] column_encoding:utf8mb4;[R1] [C2] column_is_not_null:false;[R1] [C2] column_value_old_md5:[NULL](0);[R1] [C3] column_name:tiny_blob;[R1] [C3] column_type:MYSQL_TYPE_TINY_BLOB;[R1] [C3] column_is_rowkey:false;[R1] [C3] column_is_signed:true;[R1] [C3] column_encoding:;[R1] [C3] column_is_not_null:false;[R1] [C3] column_value_old_md5:[NULL](0);[R1] [C4] column_name:text_type;[R1] [C4] column_type:MYSQL_TYPE_BLOB;[R1] [C4] column_is_rowkey:false;[R1] [C4] column_is_signed:true;[R1] [C4] column_encoding:utf8mb4;[R1] [C4] column_is_not_null:false;[R1] [C4] column_value_old_md5:[NULL](0);[R1] [C5] column_name:blob_type;[R1] [C5] column_type:MYSQL_TYPE_BLOB;[R1] [C5] column_is_rowkey:false;[R1] [C5] column_is_signed:true;[R1] [C5] column_encoding:;[R1] [C5] column_is_not_null:false;[R1] [C5] column_value_old_md5:[NULL](0);[R1] [C6] column_name:medium_text;[R1] [C6] column_type:MYSQL_TYPE_MEDIUM_BLOB;[R1] [C6] column_is_rowkey:false;[R1] [C6] column_is_signed:true;[R1] [C6] column_encoding:utf8mb4;[R1] [C6] column_is_not_null:false;[R1] [C6] column_value_old_md5:[NULL](0);[R1] [C7] column_name:medium_blob;[R1] [C7] column_type:MYSQL_TYPE_MEDIUM_BLOB;[R1] [C7] column_is_rowkey:false;[R1] [C7] column_is_signed:true;[R1] [C7] column_encoding:;[R1] [C7] column_is_not_null:false;[R1] [C7] column_value_old_md5:[NULL](0);[R1] [C8] column_name:long_text;[R1] [C8] column_type:MYSQL_TYPE_LONG_BLOB;[R1] [C8] column_is_rowkey:false;[R1] [C8] column_is_signed:true;[R1] [C8] column_encoding:utf8mb4;[R1] [C8] column_is_not_null:false;[R1] [C8] column_value_old_md5:[NULL](0);[R1] [C9] column_name:long_blob;[R1] [C9] column_type:MYSQL_TYPE_LONG_BLOB;[R1] [C9] column_is_rowkey:false;[R1] [C9] column_is_signed:true;[R1] [C9] column_encoding:;[R1] [C9] column_is_not_null:false;[R1] [C9] column_value_old_md5:[49214d7046f5120b291cb68f1f12a455](14);$[R2] record_type:DELETE;[R2] database_name:sys.oblog_db1;[R2] table_name:t1;[R2] log_event:true;[R2] column_count:9;[R2] source_category:SRC_FULL_RECORDED;[R2] source_type:SRC_OCEANBASE_1_0;[R2] has_pk:true;[R2] pk_info:(0);[R2] pks:pk;[R2] has_uk:false;[R2] uk_info:(null);[R2] uks:(null);[R2] [C1] column_name:pk;[R2] [C1] column_type:MYSQL_TYPE_LONG;[R2] [C1] column_is_rowkey:true;[R2] [C1] column_is_signed:true;[R2] [C1] column_encoding:;[R2] [C1] column_is_not_null:true;[R2] [C1] column_value_old:[4](1);[R2] [C2] column_name:tiny_text;[R2] [C2] column_type:MYSQL_TYPE_TINY_BLOB;[R2] [C2] column_is_rowkey:false;[R2] [C2] column_is_signed:true;[R2] [C2] column_encoding:utf8mb4;[R2] [C2] column_is_not_null:false;[R2] [C2] column_value_old_md5:[cb63280c6142bddf58025800093901ca](256);[R2] [C3] column_name:tiny_blob;[R2] [C3] column_type:MYSQL_TYPE_TINY_BLOB;[R2] [C3] column_is_rowkey:false;[R2] [C3] column_is_signed:true;[R2] [C3] column_encoding:;[R2] [C3] column_is_not_null:false;[R2] [C3] column_value_old_md5:[7490c42f7f5a2dd8e801021dadbeebe8](256);[R2] [C4] column_name:text_type;[R2] [C4] column_type:MYSQL_TYPE_BLOB;[R2] [C4] column_is_rowkey:false;[R2] [C4] column_is_signed:true;[R2] [C4] column_encoding:utf8mb4;[R2] [C4] column_is_not_null:false;[R2] [C4] column_value_old_md5:[0c8b65a2815c4d303a7f348b4b7aca67](65536);[R2] [C5] column_name:blob_type;[R2] [C5] column_type:MYSQL_TYPE_BLOB;[R2] [C5] column_is_rowkey:false;[R2] [C5] column_is_signed:true;[R2] [C5] column_encoding:;[R2] [C5] column_is_not_null:false;[R2] [C5] column_value_old_md5:[9a8618f4df0feb7290bdac2af7ba389a](65536);[R2] [C6] column_name:medium_text;[R2] [C6] column_type:MYSQL_TYPE_MEDIUM_BLOB;[R2] [C6] column_is_rowkey:false;[R2] [C6] column_is_signed:true;[R2] [C6] column_encoding:utf8mb4;[R2] [C6] column_is_not_null:false;[R2] [C6] column_value_old_md5:[803b29bfaaec2d131d49d0a3a5161bd3](1048576);[R2] [C7] column_name:medium_blob;[R2] [C7] column_type:MYSQL_TYPE_MEDIUM_BLOB;[R2] [C7] column_is_rowkey:false;[R2] [C7] column_is_signed:true;[R2] [C7] column_encoding:;[R2] [C7] column_is_not_null:false;[R2] [C7] column_value_old_md5:[99952049d5e6088d8a3db1846c04d444](1048576);[R2] [C8] column_name:long_text;[R2] [C8] column_type:MYSQL_TYPE_LONG_BLOB;[R2] [C8] column_is_rowkey:false;[R2] [C8] column_is_signed:true;[R2] [C8] column_encoding:utf8mb4;[R2] [C8] column_is_not_null:false;[R2] [C8] column_value_old_md5:[d6dc533b969c7c6622fce46fb33926f4](6291456);[R2] [C9] column_name:long_blob;[R2] [C9] column_type:MYSQL_TYPE_LONG_BLOB;[R2] [C9] column_is_rowkey:false;[R2] [C9] column_is_signed:true;[R2] [C9] column_encoding:;[R2] [C9] column_is_not_null:false;[R2] [C9] column_value_old_md5:[49214d7046f5120b291cb68f1f12a455](14);$[R3] record_type:DELETE;[R3] database_name:sys.oblog_db1;[R3] table_name:t1;[R3] log_event:true;[R3] column_count:9;[R3] source_category:SRC_FULL_RECORDED;[R3] source_type:SRC_OCEANBASE_1_0;[R3] has_pk:true;[R3] pk_info:(0);[R3] pks:pk;[R3] has_uk:false;[R3] uk_info:(null);[R3] uks:(null);[R3] [C1] column_name:pk;[R3] [C1] column_type:MYSQL_TYPE_LONG;[R3] [C1] column_is_rowkey:true;[R3] [C1] column_is_signed:true;[R3] [C1] column_encoding:;[R3] [C1] column_is_not_null:true;[R3] [C1] column_value_old:[3](1);[R3] [C2] column_name:tiny_text;[R3] [C2] column_type:MYSQL_TYPE_TINY_BLOB;[R3] [C2] column_is_rowkey:false;[R3] [C2] column_is_signed:true;[R3] [C2] column_encoding:utf8mb4;[R3] [C2] column_is_not_null:false;[R3] [C2] column_value_old_md5:[0cc175b9c0f1b6a831c399e269772661](1);[R3] [C3] column_name:tiny_blob;[R3] [C3] column_type:MYSQL_TYPE_TINY_BLOB;[R3] [C3] column_is_rowkey:false;[R3] [C3] column_is_signed:true;[R3] [C3] column_encoding:;[R3] [C3] column_is_not_null:false;[R3] [C3] column_value_old_md5:[21ad0bd836b90d08f4cf640b4c298e7c](2);[R3] [C4] column_name:text_type;[R3] [C4] column_type:MYSQL_TYPE_BLOB;[R3] [C4] column_is_rowkey:false;[R3] [C4] column_is_signed:true;[R3] [C4] column_encoding:utf8mb4;[R3] [C4] column_is_not_null:false;[R3] [C4] column_value_old_md5:[9df62e693988eb4e1e1444ece0578579](3);[R3] [C5] column_name:blob_type;[R3] [C5] column_type:MYSQL_TYPE_BLOB;[R3] [C5] column_is_rowkey:false;[R3] [C5] column_is_signed:true;[R3] [C5] column_encoding:;[R3] [C5] column_is_not_null:false;[R3] [C5] column_value_old_md5:[11ddbaf3386aea1f2974eee984542152](4);[R3] [C6] column_name:medium_text;[R3] [C6] column_type:MYSQL_TYPE_MEDIUM_BLOB;[R3] [C6] column_is_rowkey:false;[R3] [C6] column_is_signed:true;[R3] [C6] column_encoding:utf8mb4;[R3] [C6] column_is_not_null:false;[R3] [C6] column_value_old_md5:[670da91be64127c92faac35c8300e814](4);[R3] [C7] column_name:medium_blob;[R3] [C7] column_type:MYSQL_TYPE_MEDIUM_BLOB;[R3] [C7] column_is_rowkey:false;[R3] [C7] column_is_signed:true;[R3] [C7] column_encoding:;[R3] [C7] column_is_not_null:false;[R3] [C7] column_value_old_md5:[a98f6f64e6cdfac22ab2ffd15a7241e3](5);[R3] [C8] column_name:long_text;[R3] [C8] column_type:MYSQL_TYPE_LONG_BLOB;[R3] [C8] column_is_rowkey:false;[R3] [C8] column_is_signed:true;[R3] [C8] column_encoding:utf8mb4;[R3] [C8] column_is_not_null:false;[R3] [C8] column_value_old_md5:[9cafeef08db2dd477098a0293e71f90a](6);[R3] [C9] column_name:long_blob;[R3] [C9] column_type:MYSQL_TYPE_LONG_BLOB;[R3] [C9] column_is_rowkey:false;[R3] [C9] column_is_signed:true;[R3] [C9] column_encoding:;[R3] [C9] column_is_not_null:false;[R3] [C9] column_value_old_md5:[49214d7046f5120b291cb68f1f12a455](14);$[R4] record_type:DELETE;[R4] database_name:sys.oblog_db1;[R4] table_name:t2;[R4] log_event:true;[R4] column_count:9;[R4] source_category:SRC_FULL_RECORDED;[R4] source_type:SRC_OCEANBASE_1_0;[R4] has_pk:true;[R4] pk_info:(0);[R4] pks:pk;[R4] has_uk:false;[R4] uk_info:(null);[R4] uks:(null);[R4] [C1] column_name:pk;[R4] [C1] column_type:MYSQL_TYPE_LONG;[R4] [C1] column_is_rowkey:true;[R4] [C1] column_is_signed:true;[R4] [C1] column_encoding:;[R4] [C1] column_is_not_null:true;[R4] [C1] column_value_old:[2](1);[R4] [C2] column_name:tiny_text;[R4] [C2] column_type:MYSQL_TYPE_TINY_BLOB;[R4] [C2] column_is_rowkey:false;[R4] [C2] column_is_signed:true;[R4] [C2] column_encoding:utf8mb4;[R4] [C2] column_is_not_null:false;[R4] [C2] column_value_old_md5:[cb63280c6142bddf58025800093901ca](256);[R4] [C3] column_name:tiny_blob;[R4] [C3] column_type:MYSQL_TYPE_TINY_BLOB;[R4] [C3] column_is_rowkey:false;[R4] [C3] column_is_signed:true;[R4] [C3] column_encoding:;[R4] [C3] column_is_not_null:false;[R4] [C3] column_value_old_md5:[7490c42f7f5a2dd8e801021dadbeebe8](256);[R4] [C4] column_name:text_type;[R4] [C4] column_type:MYSQL_TYPE_BLOB;[R4] [C4] column_is_rowkey:false;[R4] [C4] column_is_signed:true;[R4] [C4] column_encoding:utf8mb4;[R4] [C4] column_is_not_null:false;[R4] [C4] column_value_old_md5:[0c8b65a2815c4d303a7f348b4b7aca67](65536);[R4] [C5] column_name:blob_type;[R4] [C5] column_type:MYSQL_TYPE_BLOB;[R4] [C5] column_is_rowkey:false;[R4] [C5] column_is_signed:true;[R4] [C5] column_encoding:;[R4] [C5] column_is_not_null:false;[R4] [C5] column_value_old_md5:[9a8618f4df0feb7290bdac2af7ba389a](65536);[R4] [C6] column_name:medium_text;[R4] [C6] column_type:MYSQL_TYPE_MEDIUM_BLOB;[R4] [C6] column_is_rowkey:false;[R4] [C6] column_is_signed:true;[R4] [C6] column_encoding:utf8mb4;[R4] [C6] column_is_not_null:false;[R4] [C6] column_value_old_md5:[803b29bfaaec2d131d49d0a3a5161bd3](1048576);[R4] [C7] column_name:medium_blob;[R4] [C7] column_type:MYSQL_TYPE_MEDIUM_BLOB;[R4] [C7] column_is_rowkey:false;[R4] [C7] column_is_signed:true;[R4] [C7] column_encoding:;[R4] [C7] column_is_not_null:false;[R4] [C7] column_value_old_md5:[f417980c2bf6f26bdf9d741d55929e27](16);[R4] [C8] column_name:long_text;[R4] [C8] column_type:MYSQL_TYPE_LONG_BLOB;[R4] [C8] column_is_rowkey:false;[R4] [C8] column_is_signed:true;[R4] [C8] column_encoding:utf8mb4;[R4] [C8] column_is_not_null:false;[R4] [C8] column_value_old_md5:[d41d8cd98f00b204e9800998ecf8427e](0);[R4] [C9] column_name:long_blob;[R4] [C9] column_type:MYSQL_TYPE_LONG_BLOB;[R4] [C9] column_is_rowkey:false;[R4] [C9] column_is_signed:true;[R4] [C9] column_encoding:;[R4] [C9] column_is_not_null:false;[R4] [C9] column_value_old_md5:[d41d8cd98f00b204e9800998ecf8427e](0);$[R5] record_type:DELETE;[R5] database_name:sys.oblog_db1;[R5] table_name:t2;[R5] log_event:true;[R5] column_count:9;[R5] source_category:SRC_FULL_RECORDED;[R5] source_type:SRC_OCEANBASE_1_0;[R5] has_pk:true;[R5] pk_info:(0);[R5] pks:pk;[R5] has_uk:false;[R5] uk_info:(null);[R5] uks:(null);[R5] [C1] column_name:pk;[R5] [C1] column_type:MYSQL_TYPE_LONG;[R5] [C1] column_is_rowkey:true;[R5] [C1] column_is_signed:true;[R5] [C1] column_encoding:;[R5] [C1] column_is_not_null:true;[R5] [C1] column_value_old:[5](1);[R5] [C2] column_name:tiny_text;[R5] [C2] column_type:MYSQL_TYPE_TINY_BLOB;[R5] [C2] column_is_rowkey:false;[R5] [C2] column_is_signed:true;[R5] [C2] column_encoding:utf8mb4;[R5] [C2] column_is_not_null:false;[R5] [C2] column_value_old_md5:[cb63280c6142bddf58025800093901ca](256);[R5] [C3] column_name:tiny_blob;[R5] [C3] column_type:MYSQL_TYPE_TINY_BLOB;[R5] [C3] column_is_rowkey:false;[R5] [C3] column_is_signed:true;[R5] [C3] column_encoding:;[R5] [C3] column_is_not_null:false;[R5] [C3] column_value_old_md5:[7490c42f7f5a2dd8e801021dadbeebe8](256);[R5] [C4] column_name:text_type;[R5] [C4] column_type:MYSQL_TYPE_BLOB;[R5] [C4] column_is_rowkey:false;[R5] [C4] column_is_signed:true;[R5] [C4] column_encoding:utf8mb4;[R5] [C4] column_is_not_null:false;[R5] [C4] column_value_old_md5:[0c8b65a2815c4d303a7f348b4b7aca67](65536);[R5] [C5] column_name:blob_type;[R5] [C5] column_type:MYSQL_TYPE_BLOB;[R5] [C5] column_is_rowkey:false;[R5] [C5] column_is_signed:true;[R5] [C5] column_encoding:;[R5] [C5] column_is_not_null:false;[R5] [C5] column_value_old_md5:[9a8618f4df0feb7290bdac2af7ba389a](65536);[R5] [C6] column_name:medium_text;[R5] [C6] column_type:MYSQL_TYPE_MEDIUM_BLOB;[R5] [C6] column_is_rowkey:false;[R5] [C6] column_is_signed:true;[R5] [C6] column_encoding:utf8mb4;[R5] [C6] column_is_not_null:false;[R5] [C6] column_value_old_md5:[52c2d77c71e95f33b31fdc18fed1a134](16777216);[R5] [C7] column_name:medium_blob;[R5] [C7] column_type:MYSQL_TYPE_MEDIUM_BLOB;[R5] [C7] column_is_rowkey:false;[R5] [C7] column_is_signed:true;[R5] [C7] column_encoding:;[R5] [C7] column_is_not_null:false;[R5] [C7] column_value_old_md5:[f417980c2bf6f26bdf9d741d55929e27](16);[R5] [C8] column_name:long_text;[R5] [C8] column_type:MYSQL_TYPE_LONG_BLOB;[R5] [C8] column_is_rowkey:false;[R5] [C8] column_is_signed:true;[R5] [C8] column_encoding:utf8mb4;[R5] [C8] column_is_not_null:false;[R5] [C8] column_value_old_md5:[01ec5ac3b20b67f5a7e361ad003be80a](13631488);[R5] [C9] column_name:long_blob;[R5] [C9] column_type:MYSQL_TYPE_LONG_BLOB;[R5] [C9] column_is_rowkey:false;[R5] [C9] column_is_signed:true;[R5] [C9] column_encoding:;[R5] [C9] column_is_not_null:false;[R5] [C9] column_value_old_md5:[c38cfc9065746da60c28833e89808d01](13631488);$[R6] COMMIT;
ob1.oblog.stop;
