ob1=OBI(cluster=1);
ob1.reboot;
ob1.create_client;
create resource unit oblog_box_mysql max_cpu 2, memory_size='10G';
create resource pool oblog_pool_mysql unit = 'oblog_box_mysql', unit_num = 1, zone_list = ('z1');
create tenant oblog_tt replica_num = 1, primary_zone='z1', resource_pool_list=('oblog_pool_mysql') set ob_tcp_invited_nodes='%';
alter tenant oblog_tt set variables max_allowed_packet=1073741824;
set global max_allowed_packet=1073741824;
ob1.oblog.set_extra_argument -m;
ob1.oblog.gen_conf tb_white_list=oblog*.*.* log_level=DEBUG lob_data_storage_memory_limit=128M;
ob1.oblog.restart;
set ob_trx_timeout=100000000;
set ob_query_timeout=1000000000;
create database oblog_db1;
use oblog_db1;
create table t1(pk int primary key, d1 longtext, d2 longblob);
insert into t1 values (1, repeat('1', 4096), repeat('1', 4096));
ob1.oblog.next_dml;
[R0] BEGIN;[R0] org_cluster_id:1;[R1] record_type:INSERT;[R1] database_name:oblog_tt.oblog_db1;[R1] table_name:t1;[R1] log_event:true;[R1] column_count:3;[R1] source_category:SRC_FULL_RECORDED;[R1] source_type:SRC_OCEANBASE_1_0;[R1] has_pk:true;[R1] pk_info:(0);[R1] pks:pk;[R1] has_uk:false;[R1] uk_info:(null);[R1] uks:(null);[R1] [C1] column_name:pk;[R1] [C1] column_type:MYSQL_TYPE_LONG;[R1] [C1] column_is_rowkey:true;[R1] [C1] column_is_signed:true;[R1] [C1] column_encoding:binary;[R1] [C1] column_is_not_null:true;[R1] [C1] column_value_new:[1](1);[R1] [C2] column_name:d1;[R1] [C2] column_type:MYSQL_TYPE_LONG_BLOB;[R1] [C2] column_is_rowkey:false;[R1] [C2] column_is_signed:true;[R1] [C2] column_encoding:utf8mb4;[R1] [C2] column_is_not_null:false;[R1] [C2] column_value_new_md5:[1f25ce6eb2dc9fbb7f4df09236be6bea](4096);[R1] [C3] column_name:d2;[R1] [C3] column_type:MYSQL_TYPE_LONG_BLOB;[R1] [C3] column_is_rowkey:false;[R1] [C3] column_is_signed:true;[R1] [C3] column_encoding:binary;[R1] [C3] column_is_not_null:false;[R1] [C3] column_value_new_md5:[1f25ce6eb2dc9fbb7f4df09236be6bea](4096);$[R2] COMMIT;
select md5(d1), md5(d2) from t1 where pk = 1;
md5(d1)	md5(d2)
1f25ce6eb2dc9fbb7f4df09236be6bea	1f25ce6eb2dc9fbb7f4df09236be6bea
update t1 set d1 = repeat('x', 4000), d2 = repeat('x', 4000) where pk = 1;
ob1.oblog.next_dml;
[R0] BEGIN;[R0] org_cluster_id:1;[R1] record_type:UPDATE;[R1] database_name:oblog_tt.oblog_db1;[R1] table_name:t1;[R1] log_event:true;[R1] column_count:3;[R1] source_category:SRC_FULL_RECORDED;[R1] source_type:SRC_OCEANBASE_1_0;[R1] has_pk:true;[R1] pk_info:(0);[R1] pks:pk;[R1] has_uk:false;[R1] uk_info:(null);[R1] uks:(null);[R1] [C1] column_name:pk;[R1] [C1] column_type:MYSQL_TYPE_LONG;[R1] [C1] column_is_rowkey:true;[R1] [C1] column_is_signed:true;[R1] [C1] column_encoding:binary;[R1] [C1] column_is_not_null:true;[R1] [C1] column_value_new:[1](1);[R1] [C1] column_value_old:[1](1);[R1] [C2] column_name:d1;[R1] [C2] column_type:MYSQL_TYPE_LONG_BLOB;[R1] [C2] column_is_rowkey:false;[R1] [C2] column_is_signed:true;[R1] [C2] column_encoding:utf8mb4;[R1] [C2] column_is_not_null:false;[R1] [C2] column_value_new_md5:[f5aeca478f8510cee5ca4556d96a4d97](4000);[R1] [C2] column_value_old_md5:[1f25ce6eb2dc9fbb7f4df09236be6bea](4096);[R1] [C3] column_name:d2;[R1] [C3] column_type:MYSQL_TYPE_LONG_BLOB;[R1] [C3] column_is_rowkey:false;[R1] [C3] column_is_signed:true;[R1] [C3] column_encoding:binary;[R1] [C3] column_is_not_null:false;[R1] [C3] column_value_new_md5:[f5aeca478f8510cee5ca4556d96a4d97](4000);[R1] [C3] column_value_old_md5:[1f25ce6eb2dc9fbb7f4df09236be6bea](4096);$[R2] COMMIT;
select md5(d1), md5(d2) from t1 where pk = 1;
md5(d1)	md5(d2)
f5aeca478f8510cee5ca4556d96a4d97	f5aeca478f8510cee5ca4556d96a4d97
delete from t1 where pk=1;
ob1.oblog.next_dml;
[R0] BEGIN;[R0] org_cluster_id:1;[R1] record_type:DELETE;[R1] database_name:oblog_tt.oblog_db1;[R1] table_name:t1;[R1] log_event:true;[R1] column_count:3;[R1] source_category:SRC_FULL_RECORDED;[R1] source_type:SRC_OCEANBASE_1_0;[R1] has_pk:true;[R1] pk_info:(0);[R1] pks:pk;[R1] has_uk:false;[R1] uk_info:(null);[R1] uks:(null);[R1] [C1] column_name:pk;[R1] [C1] column_type:MYSQL_TYPE_LONG;[R1] [C1] column_is_rowkey:true;[R1] [C1] column_is_signed:true;[R1] [C1] column_encoding:binary;[R1] [C1] column_is_not_null:true;[R1] [C1] column_value_old:[1](1);[R1] [C2] column_name:d1;[R1] [C2] column_type:MYSQL_TYPE_LONG_BLOB;[R1] [C2] column_is_rowkey:false;[R1] [C2] column_is_signed:true;[R1] [C2] column_encoding:utf8mb4;[R1] [C2] column_is_not_null:false;[R1] [C2] column_value_old_md5:[f5aeca478f8510cee5ca4556d96a4d97](4000);[R1] [C3] column_name:d2;[R1] [C3] column_type:MYSQL_TYPE_LONG_BLOB;[R1] [C3] column_is_rowkey:false;[R1] [C3] column_is_signed:true;[R1] [C3] column_encoding:binary;[R1] [C3] column_is_not_null:false;[R1] [C3] column_value_old_md5:[f5aeca478f8510cee5ca4556d96a4d97](4000);$[R2] COMMIT;
insert into t1 values (2, repeat('2', 65536), repeat('2', 65536));
ob1.oblog.next_dml;
[R0] BEGIN;[R0] org_cluster_id:1;[R1] record_type:INSERT;[R1] database_name:oblog_tt.oblog_db1;[R1] table_name:t1;[R1] log_event:true;[R1] column_count:3;[R1] source_category:SRC_FULL_RECORDED;[R1] source_type:SRC_OCEANBASE_1_0;[R1] has_pk:true;[R1] pk_info:(0);[R1] pks:pk;[R1] has_uk:false;[R1] uk_info:(null);[R1] uks:(null);[R1] [C1] column_name:pk;[R1] [C1] column_type:MYSQL_TYPE_LONG;[R1] [C1] column_is_rowkey:true;[R1] [C1] column_is_signed:true;[R1] [C1] column_encoding:binary;[R1] [C1] column_is_not_null:true;[R1] [C1] column_value_new:[2](1);[R1] [C2] column_name:d1;[R1] [C2] column_type:MYSQL_TYPE_LONG_BLOB;[R1] [C2] column_is_rowkey:false;[R1] [C2] column_is_signed:true;[R1] [C2] column_encoding:utf8mb4;[R1] [C2] column_is_not_null:false;[R1] [C2] column_value_new_md5:[1a3f19879d66d284455a2ff10dc48588](65536);[R1] [C3] column_name:d2;[R1] [C3] column_type:MYSQL_TYPE_LONG_BLOB;[R1] [C3] column_is_rowkey:false;[R1] [C3] column_is_signed:true;[R1] [C3] column_encoding:binary;[R1] [C3] column_is_not_null:false;[R1] [C3] column_value_new_md5:[1a3f19879d66d284455a2ff10dc48588](65536);$[R2] COMMIT;
select md5(d1), md5(d2) from t1 where pk = 2;
md5(d1)	md5(d2)
1a3f19879d66d284455a2ff10dc48588	1a3f19879d66d284455a2ff10dc48588
update t1 set d1 = repeat('y', 65536), d2 = repeat('y', 65536) where pk = 2;
ob1.oblog.next_dml;
[R0] BEGIN;[R0] org_cluster_id:1;[R1] record_type:UPDATE;[R1] database_name:oblog_tt.oblog_db1;[R1] table_name:t1;[R1] log_event:true;[R1] column_count:3;[R1] source_category:SRC_FULL_RECORDED;[R1] source_type:SRC_OCEANBASE_1_0;[R1] has_pk:true;[R1] pk_info:(0);[R1] pks:pk;[R1] has_uk:false;[R1] uk_info:(null);[R1] uks:(null);[R1] [C1] column_name:pk;[R1] [C1] column_type:MYSQL_TYPE_LONG;[R1] [C1] column_is_rowkey:true;[R1] [C1] column_is_signed:true;[R1] [C1] column_encoding:binary;[R1] [C1] column_is_not_null:true;[R1] [C1] column_value_new:[2](1);[R1] [C1] column_value_old:[2](1);[R1] [C2] column_name:d1;[R1] [C2] column_type:MYSQL_TYPE_LONG_BLOB;[R1] [C2] column_is_rowkey:false;[R1] [C2] column_is_signed:true;[R1] [C2] column_encoding:utf8mb4;[R1] [C2] column_is_not_null:false;[R1] [C2] column_value_new_md5:[3e3b68be314e87d77379758cc7de5ed6](65536);[R1] [C2] column_value_old_md5:[1a3f19879d66d284455a2ff10dc48588](65536);[R1] [C3] column_name:d2;[R1] [C3] column_type:MYSQL_TYPE_LONG_BLOB;[R1] [C3] column_is_rowkey:false;[R1] [C3] column_is_signed:true;[R1] [C3] column_encoding:binary;[R1] [C3] column_is_not_null:false;[R1] [C3] column_value_new_md5:[3e3b68be314e87d77379758cc7de5ed6](65536);[R1] [C3] column_value_old_md5:[1a3f19879d66d284455a2ff10dc48588](65536);$[R2] COMMIT;
select md5(d1), md5(d2) from t1 where pk = 2;
md5(d1)	md5(d2)
3e3b68be314e87d77379758cc7de5ed6	3e3b68be314e87d77379758cc7de5ed6
delete from t1 where pk=2;
ob1.oblog.next_dml;
[R0] BEGIN;[R0] org_cluster_id:1;[R1] record_type:DELETE;[R1] database_name:oblog_tt.oblog_db1;[R1] table_name:t1;[R1] log_event:true;[R1] column_count:3;[R1] source_category:SRC_FULL_RECORDED;[R1] source_type:SRC_OCEANBASE_1_0;[R1] has_pk:true;[R1] pk_info:(0);[R1] pks:pk;[R1] has_uk:false;[R1] uk_info:(null);[R1] uks:(null);[R1] [C1] column_name:pk;[R1] [C1] column_type:MYSQL_TYPE_LONG;[R1] [C1] column_is_rowkey:true;[R1] [C1] column_is_signed:true;[R1] [C1] column_encoding:binary;[R1] [C1] column_is_not_null:true;[R1] [C1] column_value_old:[2](1);[R1] [C2] column_name:d1;[R1] [C2] column_type:MYSQL_TYPE_LONG_BLOB;[R1] [C2] column_is_rowkey:false;[R1] [C2] column_is_signed:true;[R1] [C2] column_encoding:utf8mb4;[R1] [C2] column_is_not_null:false;[R1] [C2] column_value_old_origin: PADDING;[R1] [C2] column_value_old_md5:[NULL](0);[R1] [C3] column_name:d2;[R1] [C3] column_type:MYSQL_TYPE_LONG_BLOB;[R1] [C3] column_is_rowkey:false;[R1] [C3] column_is_signed:true;[R1] [C3] column_encoding:binary;[R1] [C3] column_is_not_null:false;[R1] [C3] column_value_old_origin: PADDING;[R1] [C3] column_value_old_md5:[NULL](0);$[R2] COMMIT;
insert into t1 values (3, repeat('2', 262144), repeat('2', 262144 + 2));
ob1.oblog.next_dml;
[R0] BEGIN;[R0] org_cluster_id:1;[R1] record_type:INSERT;[R1] database_name:oblog_tt.oblog_db1;[R1] table_name:t1;[R1] log_event:true;[R1] column_count:3;[R1] source_category:SRC_FULL_RECORDED;[R1] source_type:SRC_OCEANBASE_1_0;[R1] has_pk:true;[R1] pk_info:(0);[R1] pks:pk;[R1] has_uk:false;[R1] uk_info:(null);[R1] uks:(null);[R1] [C1] column_name:pk;[R1] [C1] column_type:MYSQL_TYPE_LONG;[R1] [C1] column_is_rowkey:true;[R1] [C1] column_is_signed:true;[R1] [C1] column_encoding:binary;[R1] [C1] column_is_not_null:true;[R1] [C1] column_value_new:[3](1);[R1] [C2] column_name:d1;[R1] [C2] column_type:MYSQL_TYPE_LONG_BLOB;[R1] [C2] column_is_rowkey:false;[R1] [C2] column_is_signed:true;[R1] [C2] column_encoding:utf8mb4;[R1] [C2] column_is_not_null:false;[R1] [C2] column_value_new_md5:[9d9b5708726c2a2c9fc23e0b6c335413](262144);[R1] [C3] column_name:d2;[R1] [C3] column_type:MYSQL_TYPE_LONG_BLOB;[R1] [C3] column_is_rowkey:false;[R1] [C3] column_is_signed:true;[R1] [C3] column_encoding:binary;[R1] [C3] column_is_not_null:false;[R1] [C3] column_value_new_md5:[53662b3650fb39b5cb20752f756b455d](262146);$[R2] COMMIT;
select md5(d1), md5(d2) from t1 where pk = 3;
md5(d1)	md5(d2)
9d9b5708726c2a2c9fc23e0b6c335413	53662b3650fb39b5cb20752f756b455d
update t1 set d1 = repeat('y', 262144 + 2), d2 = repeat('y', 262144) where pk = 3;
ob1.oblog.next_dml;
[R0] BEGIN;[R0] org_cluster_id:1;[R1] record_type:UPDATE;[R1] database_name:oblog_tt.oblog_db1;[R1] table_name:t1;[R1] log_event:true;[R1] column_count:3;[R1] source_category:SRC_FULL_RECORDED;[R1] source_type:SRC_OCEANBASE_1_0;[R1] has_pk:true;[R1] pk_info:(0);[R1] pks:pk;[R1] has_uk:false;[R1] uk_info:(null);[R1] uks:(null);[R1] [C1] column_name:pk;[R1] [C1] column_type:MYSQL_TYPE_LONG;[R1] [C1] column_is_rowkey:true;[R1] [C1] column_is_signed:true;[R1] [C1] column_encoding:binary;[R1] [C1] column_is_not_null:true;[R1] [C1] column_value_new:[3](1);[R1] [C1] column_value_old:[3](1);[R1] [C2] column_name:d1;[R1] [C2] column_type:MYSQL_TYPE_LONG_BLOB;[R1] [C2] column_is_rowkey:false;[R1] [C2] column_is_signed:true;[R1] [C2] column_encoding:utf8mb4;[R1] [C2] column_is_not_null:false;[R1] [C2] column_value_new_md5:[87dea465de798a8b292512bda1334445](262146);[R1] [C2] column_value_old_md5:[9d9b5708726c2a2c9fc23e0b6c335413](262144);[R1] [C3] column_name:d2;[R1] [C3] column_type:MYSQL_TYPE_LONG_BLOB;[R1] [C3] column_is_rowkey:false;[R1] [C3] column_is_signed:true;[R1] [C3] column_encoding:binary;[R1] [C3] column_is_not_null:false;[R1] [C3] column_value_new_md5:[b97509a2791007d7fe051f4afc2df3d7](262144);[R1] [C3] column_value_old_md5:[53662b3650fb39b5cb20752f756b455d](262146);$[R2] COMMIT;
select md5(d1), md5(d2) from t1 where pk = 3;
md5(d1)	md5(d2)
87dea465de798a8b292512bda1334445	b97509a2791007d7fe051f4afc2df3d7
delete from t1 where pk=3;
ob1.oblog.next_dml;
[R0] BEGIN;[R0] org_cluster_id:1;[R1] record_type:DELETE;[R1] database_name:oblog_tt.oblog_db1;[R1] table_name:t1;[R1] log_event:true;[R1] column_count:3;[R1] source_category:SRC_FULL_RECORDED;[R1] source_type:SRC_OCEANBASE_1_0;[R1] has_pk:true;[R1] pk_info:(0);[R1] pks:pk;[R1] has_uk:false;[R1] uk_info:(null);[R1] uks:(null);[R1] [C1] column_name:pk;[R1] [C1] column_type:MYSQL_TYPE_LONG;[R1] [C1] column_is_rowkey:true;[R1] [C1] column_is_signed:true;[R1] [C1] column_encoding:binary;[R1] [C1] column_is_not_null:true;[R1] [C1] column_value_old:[3](1);[R1] [C2] column_name:d1;[R1] [C2] column_type:MYSQL_TYPE_LONG_BLOB;[R1] [C2] column_is_rowkey:false;[R1] [C2] column_is_signed:true;[R1] [C2] column_encoding:utf8mb4;[R1] [C2] column_is_not_null:false;[R1] [C2] column_value_old_origin: PADDING;[R1] [C2] column_value_old_md5:[NULL](0);[R1] [C3] column_name:d2;[R1] [C3] column_type:MYSQL_TYPE_LONG_BLOB;[R1] [C3] column_is_rowkey:false;[R1] [C3] column_is_signed:true;[R1] [C3] column_encoding:binary;[R1] [C3] column_is_not_null:false;[R1] [C3] column_value_old_origin: PADDING;[R1] [C3] column_value_old_md5:[NULL](0);$[R2] COMMIT;
insert into t1 values (4, repeat('2', 1048576), repeat('2', 1048576));
ob1.oblog.next_dml;
[R0] BEGIN;[R0] org_cluster_id:1;[R1] record_type:INSERT;[R1] database_name:oblog_tt.oblog_db1;[R1] table_name:t1;[R1] log_event:true;[R1] column_count:3;[R1] source_category:SRC_FULL_RECORDED;[R1] source_type:SRC_OCEANBASE_1_0;[R1] has_pk:true;[R1] pk_info:(0);[R1] pks:pk;[R1] has_uk:false;[R1] uk_info:(null);[R1] uks:(null);[R1] [C1] column_name:pk;[R1] [C1] column_type:MYSQL_TYPE_LONG;[R1] [C1] column_is_rowkey:true;[R1] [C1] column_is_signed:true;[R1] [C1] column_encoding:binary;[R1] [C1] column_is_not_null:true;[R1] [C1] column_value_new:[4](1);[R1] [C2] column_name:d1;[R1] [C2] column_type:MYSQL_TYPE_LONG_BLOB;[R1] [C2] column_is_rowkey:false;[R1] [C2] column_is_signed:true;[R1] [C2] column_encoding:utf8mb4;[R1] [C2] column_is_not_null:false;[R1] [C2] column_value_new_md5:[36f2a785be852f732e2d2fd3daa4cd1b](1048576);[R1] [C3] column_name:d2;[R1] [C3] column_type:MYSQL_TYPE_LONG_BLOB;[R1] [C3] column_is_rowkey:false;[R1] [C3] column_is_signed:true;[R1] [C3] column_encoding:binary;[R1] [C3] column_is_not_null:false;[R1] [C3] column_value_new_md5:[36f2a785be852f732e2d2fd3daa4cd1b](1048576);$[R2] COMMIT;
select md5(d1), md5(d2) from t1 where pk = 4;
md5(d1)	md5(d2)
36f2a785be852f732e2d2fd3daa4cd1b	36f2a785be852f732e2d2fd3daa4cd1b
update t1 set d1 = repeat('y', 1048576), d2 = repeat('y', 1048576) where pk = 4;
ob1.oblog.next_dml;
[R0] BEGIN;[R0] org_cluster_id:1;[R1] record_type:UPDATE;[R1] database_name:oblog_tt.oblog_db1;[R1] table_name:t1;[R1] log_event:true;[R1] column_count:3;[R1] source_category:SRC_FULL_RECORDED;[R1] source_type:SRC_OCEANBASE_1_0;[R1] has_pk:true;[R1] pk_info:(0);[R1] pks:pk;[R1] has_uk:false;[R1] uk_info:(null);[R1] uks:(null);[R1] [C1] column_name:pk;[R1] [C1] column_type:MYSQL_TYPE_LONG;[R1] [C1] column_is_rowkey:true;[R1] [C1] column_is_signed:true;[R1] [C1] column_encoding:binary;[R1] [C1] column_is_not_null:true;[R1] [C1] column_value_new:[4](1);[R1] [C1] column_value_old:[4](1);[R1] [C2] column_name:d1;[R1] [C2] column_type:MYSQL_TYPE_LONG_BLOB;[R1] [C2] column_is_rowkey:false;[R1] [C2] column_is_signed:true;[R1] [C2] column_encoding:utf8mb4;[R1] [C2] column_is_not_null:false;[R1] [C2] column_value_new_md5:[b80f5f8f30ede33ee193a14cfc3a9c4f](1048576);[R1] [C2] column_value_old_md5:[36f2a785be852f732e2d2fd3daa4cd1b](1048576);[R1] [C3] column_name:d2;[R1] [C3] column_type:MYSQL_TYPE_LONG_BLOB;[R1] [C3] column_is_rowkey:false;[R1] [C3] column_is_signed:true;[R1] [C3] column_encoding:binary;[R1] [C3] column_is_not_null:false;[R1] [C3] column_value_new_md5:[b80f5f8f30ede33ee193a14cfc3a9c4f](1048576);[R1] [C3] column_value_old_md5:[36f2a785be852f732e2d2fd3daa4cd1b](1048576);$[R2] COMMIT;
select md5(d1), md5(d2) from t1 where pk = 4;
md5(d1)	md5(d2)
b80f5f8f30ede33ee193a14cfc3a9c4f	b80f5f8f30ede33ee193a14cfc3a9c4f
delete from t1 where pk=4;
ob1.oblog.next_dml;
[R0] BEGIN;[R0] org_cluster_id:1;[R1] record_type:DELETE;[R1] database_name:oblog_tt.oblog_db1;[R1] table_name:t1;[R1] log_event:true;[R1] column_count:3;[R1] source_category:SRC_FULL_RECORDED;[R1] source_type:SRC_OCEANBASE_1_0;[R1] has_pk:true;[R1] pk_info:(0);[R1] pks:pk;[R1] has_uk:false;[R1] uk_info:(null);[R1] uks:(null);[R1] [C1] column_name:pk;[R1] [C1] column_type:MYSQL_TYPE_LONG;[R1] [C1] column_is_rowkey:true;[R1] [C1] column_is_signed:true;[R1] [C1] column_encoding:binary;[R1] [C1] column_is_not_null:true;[R1] [C1] column_value_old:[4](1);[R1] [C2] column_name:d1;[R1] [C2] column_type:MYSQL_TYPE_LONG_BLOB;[R1] [C2] column_is_rowkey:false;[R1] [C2] column_is_signed:true;[R1] [C2] column_encoding:utf8mb4;[R1] [C2] column_is_not_null:false;[R1] [C2] column_value_old_origin: PADDING;[R1] [C2] column_value_old_md5:[NULL](0);[R1] [C3] column_name:d2;[R1] [C3] column_type:MYSQL_TYPE_LONG_BLOB;[R1] [C3] column_is_rowkey:false;[R1] [C3] column_is_signed:true;[R1] [C3] column_encoding:binary;[R1] [C3] column_is_not_null:false;[R1] [C3] column_value_old_origin: PADDING;[R1] [C3] column_value_old_md5:[NULL](0);$[R2] COMMIT;
insert into t1 values (5, repeat('2', 16777216), repeat('2', 16777216));
ob1.oblog.next_dml;
[R0] BEGIN;[R0] org_cluster_id:1;[R1] record_type:INSERT;[R1] database_name:oblog_tt.oblog_db1;[R1] table_name:t1;[R1] log_event:true;[R1] column_count:3;[R1] source_category:SRC_FULL_RECORDED;[R1] source_type:SRC_OCEANBASE_1_0;[R1] has_pk:true;[R1] pk_info:(0);[R1] pks:pk;[R1] has_uk:false;[R1] uk_info:(null);[R1] uks:(null);[R1] [C1] column_name:pk;[R1] [C1] column_type:MYSQL_TYPE_LONG;[R1] [C1] column_is_rowkey:true;[R1] [C1] column_is_signed:true;[R1] [C1] column_encoding:binary;[R1] [C1] column_is_not_null:true;[R1] [C1] column_value_new:[5](1);[R1] [C2] column_name:d1;[R1] [C2] column_type:MYSQL_TYPE_LONG_BLOB;[R1] [C2] column_is_rowkey:false;[R1] [C2] column_is_signed:true;[R1] [C2] column_encoding:utf8mb4;[R1] [C2] column_is_not_null:false;[R1] [C2] column_value_new_md5:[59944f8676978d9af57a585769818449](16777216);[R1] [C3] column_name:d2;[R1] [C3] column_type:MYSQL_TYPE_LONG_BLOB;[R1] [C3] column_is_rowkey:false;[R1] [C3] column_is_signed:true;[R1] [C3] column_encoding:binary;[R1] [C3] column_is_not_null:false;[R1] [C3] column_value_new_md5:[59944f8676978d9af57a585769818449](16777216);$[R2] COMMIT;
select md5(d1), md5(d2) from t1 where pk = 5;
md5(d1)	md5(d2)
59944f8676978d9af57a585769818449	59944f8676978d9af57a585769818449
update t1 set d1 = repeat('y', 16777216), d2 = repeat('y', 16777216) where pk = 5;
ob1.oblog.next_dml;
[R0] BEGIN;[R0] org_cluster_id:1;[R1] record_type:UPDATE;[R1] database_name:oblog_tt.oblog_db1;[R1] table_name:t1;[R1] log_event:true;[R1] column_count:3;[R1] source_category:SRC_FULL_RECORDED;[R1] source_type:SRC_OCEANBASE_1_0;[R1] has_pk:true;[R1] pk_info:(0);[R1] pks:pk;[R1] has_uk:false;[R1] uk_info:(null);[R1] uks:(null);[R1] [C1] column_name:pk;[R1] [C1] column_type:MYSQL_TYPE_LONG;[R1] [C1] column_is_rowkey:true;[R1] [C1] column_is_signed:true;[R1] [C1] column_encoding:binary;[R1] [C1] column_is_not_null:true;[R1] [C1] column_value_new:[5](1);[R1] [C1] column_value_old:[5](1);[R1] [C2] column_name:d1;[R1] [C2] column_type:MYSQL_TYPE_LONG_BLOB;[R1] [C2] column_is_rowkey:false;[R1] [C2] column_is_signed:true;[R1] [C2] column_encoding:utf8mb4;[R1] [C2] column_is_not_null:false;[R1] [C2] column_value_new_md5:[009f162345d580c116b4feab7b1e78e5](16777216);[R1] [C2] column_value_old_md5:[59944f8676978d9af57a585769818449](16777216);[R1] [C3] column_name:d2;[R1] [C3] column_type:MYSQL_TYPE_LONG_BLOB;[R1] [C3] column_is_rowkey:false;[R1] [C3] column_is_signed:true;[R1] [C3] column_encoding:binary;[R1] [C3] column_is_not_null:false;[R1] [C3] column_value_new_md5:[009f162345d580c116b4feab7b1e78e5](16777216);[R1] [C3] column_value_old_md5:[59944f8676978d9af57a585769818449](16777216);$[R2] COMMIT;
select md5(d1), md5(d2) from t1 where pk = 5;
md5(d1)	md5(d2)
009f162345d580c116b4feab7b1e78e5	009f162345d580c116b4feab7b1e78e5
delete from t1 where pk=5;
ob1.oblog.next_dml;
[R0] BEGIN;[R0] org_cluster_id:1;[R1] record_type:DELETE;[R1] database_name:oblog_tt.oblog_db1;[R1] table_name:t1;[R1] log_event:true;[R1] column_count:3;[R1] source_category:SRC_FULL_RECORDED;[R1] source_type:SRC_OCEANBASE_1_0;[R1] has_pk:true;[R1] pk_info:(0);[R1] pks:pk;[R1] has_uk:false;[R1] uk_info:(null);[R1] uks:(null);[R1] [C1] column_name:pk;[R1] [C1] column_type:MYSQL_TYPE_LONG;[R1] [C1] column_is_rowkey:true;[R1] [C1] column_is_signed:true;[R1] [C1] column_encoding:binary;[R1] [C1] column_is_not_null:true;[R1] [C1] column_value_old:[5](1);[R1] [C2] column_name:d1;[R1] [C2] column_type:MYSQL_TYPE_LONG_BLOB;[R1] [C2] column_is_rowkey:false;[R1] [C2] column_is_signed:true;[R1] [C2] column_encoding:utf8mb4;[R1] [C2] column_is_not_null:false;[R1] [C2] column_value_old_origin: PADDING;[R1] [C2] column_value_old_md5:[NULL](0);[R1] [C3] column_name:d2;[R1] [C3] column_type:MYSQL_TYPE_LONG_BLOB;[R1] [C3] column_is_rowkey:false;[R1] [C3] column_is_signed:true;[R1] [C3] column_encoding:binary;[R1] [C3] column_is_not_null:false;[R1] [C3] column_value_old_origin: PADDING;[R1] [C3] column_value_old_md5:[NULL](0);$[R2] COMMIT;
insert into t1 values (501, repeat('2', 16777216), repeat('2', 16777216));
ob1.oblog.next_dml;
[R0] BEGIN;[R0] org_cluster_id:1;[R1] record_type:INSERT;[R1] database_name:oblog_tt.oblog_db1;[R1] table_name:t1;[R1] log_event:true;[R1] column_count:3;[R1] source_category:SRC_FULL_RECORDED;[R1] source_type:SRC_OCEANBASE_1_0;[R1] has_pk:true;[R1] pk_info:(0);[R1] pks:pk;[R1] has_uk:false;[R1] uk_info:(null);[R1] uks:(null);[R1] [C1] column_name:pk;[R1] [C1] column_type:MYSQL_TYPE_LONG;[R1] [C1] column_is_rowkey:true;[R1] [C1] column_is_signed:true;[R1] [C1] column_encoding:binary;[R1] [C1] column_is_not_null:true;[R1] [C1] column_value_new:[501](3);[R1] [C2] column_name:d1;[R1] [C2] column_type:MYSQL_TYPE_LONG_BLOB;[R1] [C2] column_is_rowkey:false;[R1] [C2] column_is_signed:true;[R1] [C2] column_encoding:utf8mb4;[R1] [C2] column_is_not_null:false;[R1] [C2] column_value_new_md5:[59944f8676978d9af57a585769818449](16777216);[R1] [C3] column_name:d2;[R1] [C3] column_type:MYSQL_TYPE_LONG_BLOB;[R1] [C3] column_is_rowkey:false;[R1] [C3] column_is_signed:true;[R1] [C3] column_encoding:binary;[R1] [C3] column_is_not_null:false;[R1] [C3] column_value_new_md5:[59944f8676978d9af57a585769818449](16777216);$[R2] COMMIT;
select md5(d1), md5(d2) from t1 where pk = 501;
md5(d1)	md5(d2)
59944f8676978d9af57a585769818449	59944f8676978d9af57a585769818449
update t1 set d1 = repeat('y', 16777216), d2 = repeat('y', 16777216) where pk = 501;
ob1.oblog.next_dml;
[R0] BEGIN;[R0] org_cluster_id:1;[R1] record_type:UPDATE;[R1] database_name:oblog_tt.oblog_db1;[R1] table_name:t1;[R1] log_event:true;[R1] column_count:3;[R1] source_category:SRC_FULL_RECORDED;[R1] source_type:SRC_OCEANBASE_1_0;[R1] has_pk:true;[R1] pk_info:(0);[R1] pks:pk;[R1] has_uk:false;[R1] uk_info:(null);[R1] uks:(null);[R1] [C1] column_name:pk;[R1] [C1] column_type:MYSQL_TYPE_LONG;[R1] [C1] column_is_rowkey:true;[R1] [C1] column_is_signed:true;[R1] [C1] column_encoding:binary;[R1] [C1] column_is_not_null:true;[R1] [C1] column_value_new:[501](3);[R1] [C1] column_value_old:[501](3);[R1] [C2] column_name:d1;[R1] [C2] column_type:MYSQL_TYPE_LONG_BLOB;[R1] [C2] column_is_rowkey:false;[R1] [C2] column_is_signed:true;[R1] [C2] column_encoding:utf8mb4;[R1] [C2] column_is_not_null:false;[R1] [C2] column_value_new_md5:[009f162345d580c116b4feab7b1e78e5](16777216);[R1] [C2] column_value_old_md5:[59944f8676978d9af57a585769818449](16777216);[R1] [C3] column_name:d2;[R1] [C3] column_type:MYSQL_TYPE_LONG_BLOB;[R1] [C3] column_is_rowkey:false;[R1] [C3] column_is_signed:true;[R1] [C3] column_encoding:binary;[R1] [C3] column_is_not_null:false;[R1] [C3] column_value_new_md5:[009f162345d580c116b4feab7b1e78e5](16777216);[R1] [C3] column_value_old_md5:[59944f8676978d9af57a585769818449](16777216);$[R2] COMMIT;
select md5(d1), md5(d2) from t1 where pk = 501;
md5(d1)	md5(d2)
009f162345d580c116b4feab7b1e78e5	009f162345d580c116b4feab7b1e78e5
delete from t1 where pk=501;
ob1.oblog.next_dml;
[R0] BEGIN;[R0] org_cluster_id:1;[R1] record_type:DELETE;[R1] database_name:oblog_tt.oblog_db1;[R1] table_name:t1;[R1] log_event:true;[R1] column_count:3;[R1] source_category:SRC_FULL_RECORDED;[R1] source_type:SRC_OCEANBASE_1_0;[R1] has_pk:true;[R1] pk_info:(0);[R1] pks:pk;[R1] has_uk:false;[R1] uk_info:(null);[R1] uks:(null);[R1] [C1] column_name:pk;[R1] [C1] column_type:MYSQL_TYPE_LONG;[R1] [C1] column_is_rowkey:true;[R1] [C1] column_is_signed:true;[R1] [C1] column_encoding:binary;[R1] [C1] column_is_not_null:true;[R1] [C1] column_value_old:[501](3);[R1] [C2] column_name:d1;[R1] [C2] column_type:MYSQL_TYPE_LONG_BLOB;[R1] [C2] column_is_rowkey:false;[R1] [C2] column_is_signed:true;[R1] [C2] column_encoding:utf8mb4;[R1] [C2] column_is_not_null:false;[R1] [C2] column_value_old_origin: PADDING;[R1] [C2] column_value_old_md5:[NULL](0);[R1] [C3] column_name:d2;[R1] [C3] column_type:MYSQL_TYPE_LONG_BLOB;[R1] [C3] column_is_rowkey:false;[R1] [C3] column_is_signed:true;[R1] [C3] column_encoding:binary;[R1] [C3] column_is_not_null:false;[R1] [C3] column_value_old_origin: PADDING;[R1] [C3] column_value_old_md5:[NULL](0);$[R2] COMMIT;
insert into t1 values (502, repeat('2', 16777216), repeat('2', 16777216));
ob1.oblog.next_dml;
[R0] BEGIN;[R0] org_cluster_id:1;[R1] record_type:INSERT;[R1] database_name:oblog_tt.oblog_db1;[R1] table_name:t1;[R1] log_event:true;[R1] column_count:3;[R1] source_category:SRC_FULL_RECORDED;[R1] source_type:SRC_OCEANBASE_1_0;[R1] has_pk:true;[R1] pk_info:(0);[R1] pks:pk;[R1] has_uk:false;[R1] uk_info:(null);[R1] uks:(null);[R1] [C1] column_name:pk;[R1] [C1] column_type:MYSQL_TYPE_LONG;[R1] [C1] column_is_rowkey:true;[R1] [C1] column_is_signed:true;[R1] [C1] column_encoding:binary;[R1] [C1] column_is_not_null:true;[R1] [C1] column_value_new:[502](3);[R1] [C2] column_name:d1;[R1] [C2] column_type:MYSQL_TYPE_LONG_BLOB;[R1] [C2] column_is_rowkey:false;[R1] [C2] column_is_signed:true;[R1] [C2] column_encoding:utf8mb4;[R1] [C2] column_is_not_null:false;[R1] [C2] column_value_new_md5:[59944f8676978d9af57a585769818449](16777216);[R1] [C3] column_name:d2;[R1] [C3] column_type:MYSQL_TYPE_LONG_BLOB;[R1] [C3] column_is_rowkey:false;[R1] [C3] column_is_signed:true;[R1] [C3] column_encoding:binary;[R1] [C3] column_is_not_null:false;[R1] [C3] column_value_new_md5:[59944f8676978d9af57a585769818449](16777216);$[R2] COMMIT;
select md5(d1), md5(d2) from t1 where pk = 502;
md5(d1)	md5(d2)
59944f8676978d9af57a585769818449	59944f8676978d9af57a585769818449
update t1 set d1 = repeat('y', 16777216), d2 = repeat('y', 16777216) where pk = 502;
ob1.oblog.next_dml;
[R0] BEGIN;[R0] org_cluster_id:1;[R1] record_type:UPDATE;[R1] database_name:oblog_tt.oblog_db1;[R1] table_name:t1;[R1] log_event:true;[R1] column_count:3;[R1] source_category:SRC_FULL_RECORDED;[R1] source_type:SRC_OCEANBASE_1_0;[R1] has_pk:true;[R1] pk_info:(0);[R1] pks:pk;[R1] has_uk:false;[R1] uk_info:(null);[R1] uks:(null);[R1] [C1] column_name:pk;[R1] [C1] column_type:MYSQL_TYPE_LONG;[R1] [C1] column_is_rowkey:true;[R1] [C1] column_is_signed:true;[R1] [C1] column_encoding:binary;[R1] [C1] column_is_not_null:true;[R1] [C1] column_value_new:[502](3);[R1] [C1] column_value_old:[502](3);[R1] [C2] column_name:d1;[R1] [C2] column_type:MYSQL_TYPE_LONG_BLOB;[R1] [C2] column_is_rowkey:false;[R1] [C2] column_is_signed:true;[R1] [C2] column_encoding:utf8mb4;[R1] [C2] column_is_not_null:false;[R1] [C2] column_value_new_md5:[009f162345d580c116b4feab7b1e78e5](16777216);[R1] [C2] column_value_old_md5:[59944f8676978d9af57a585769818449](16777216);[R1] [C3] column_name:d2;[R1] [C3] column_type:MYSQL_TYPE_LONG_BLOB;[R1] [C3] column_is_rowkey:false;[R1] [C3] column_is_signed:true;[R1] [C3] column_encoding:binary;[R1] [C3] column_is_not_null:false;[R1] [C3] column_value_new_md5:[009f162345d580c116b4feab7b1e78e5](16777216);[R1] [C3] column_value_old_md5:[59944f8676978d9af57a585769818449](16777216);$[R2] COMMIT;
select md5(d1), md5(d2) from t1 where pk = 502;
md5(d1)	md5(d2)
009f162345d580c116b4feab7b1e78e5	009f162345d580c116b4feab7b1e78e5
delete from t1 where pk=502;
ob1.oblog.next_dml;
[R0] BEGIN;[R0] org_cluster_id:1;[R1] record_type:DELETE;[R1] database_name:oblog_tt.oblog_db1;[R1] table_name:t1;[R1] log_event:true;[R1] column_count:3;[R1] source_category:SRC_FULL_RECORDED;[R1] source_type:SRC_OCEANBASE_1_0;[R1] has_pk:true;[R1] pk_info:(0);[R1] pks:pk;[R1] has_uk:false;[R1] uk_info:(null);[R1] uks:(null);[R1] [C1] column_name:pk;[R1] [C1] column_type:MYSQL_TYPE_LONG;[R1] [C1] column_is_rowkey:true;[R1] [C1] column_is_signed:true;[R1] [C1] column_encoding:binary;[R1] [C1] column_is_not_null:true;[R1] [C1] column_value_old:[502](3);[R1] [C2] column_name:d1;[R1] [C2] column_type:MYSQL_TYPE_LONG_BLOB;[R1] [C2] column_is_rowkey:false;[R1] [C2] column_is_signed:true;[R1] [C2] column_encoding:utf8mb4;[R1] [C2] column_is_not_null:false;[R1] [C2] column_value_old_origin: PADDING;[R1] [C2] column_value_old_md5:[NULL](0);[R1] [C3] column_name:d2;[R1] [C3] column_type:MYSQL_TYPE_LONG_BLOB;[R1] [C3] column_is_rowkey:false;[R1] [C3] column_is_signed:true;[R1] [C3] column_encoding:binary;[R1] [C3] column_is_not_null:false;[R1] [C3] column_value_old_origin: PADDING;[R1] [C3] column_value_old_md5:[NULL](0);$[R2] COMMIT;
insert into t1 values (503, repeat('2', 16777216), repeat('2', 16777216));
ob1.oblog.next_dml;
[R0] BEGIN;[R0] org_cluster_id:1;[R1] record_type:INSERT;[R1] database_name:oblog_tt.oblog_db1;[R1] table_name:t1;[R1] log_event:true;[R1] column_count:3;[R1] source_category:SRC_FULL_RECORDED;[R1] source_type:SRC_OCEANBASE_1_0;[R1] has_pk:true;[R1] pk_info:(0);[R1] pks:pk;[R1] has_uk:false;[R1] uk_info:(null);[R1] uks:(null);[R1] [C1] column_name:pk;[R1] [C1] column_type:MYSQL_TYPE_LONG;[R1] [C1] column_is_rowkey:true;[R1] [C1] column_is_signed:true;[R1] [C1] column_encoding:binary;[R1] [C1] column_is_not_null:true;[R1] [C1] column_value_new:[503](3);[R1] [C2] column_name:d1;[R1] [C2] column_type:MYSQL_TYPE_LONG_BLOB;[R1] [C2] column_is_rowkey:false;[R1] [C2] column_is_signed:true;[R1] [C2] column_encoding:utf8mb4;[R1] [C2] column_is_not_null:false;[R1] [C2] column_value_new_md5:[59944f8676978d9af57a585769818449](16777216);[R1] [C3] column_name:d2;[R1] [C3] column_type:MYSQL_TYPE_LONG_BLOB;[R1] [C3] column_is_rowkey:false;[R1] [C3] column_is_signed:true;[R1] [C3] column_encoding:binary;[R1] [C3] column_is_not_null:false;[R1] [C3] column_value_new_md5:[59944f8676978d9af57a585769818449](16777216);$[R2] COMMIT;
select md5(d1), md5(d2) from t1 where pk = 503;
md5(d1)	md5(d2)
59944f8676978d9af57a585769818449	59944f8676978d9af57a585769818449
update t1 set d1 = repeat('y', 16777216), d2 = repeat('y', 16777216) where pk = 503;
ob1.oblog.next_dml;
[R0] BEGIN;[R0] org_cluster_id:1;[R1] record_type:UPDATE;[R1] database_name:oblog_tt.oblog_db1;[R1] table_name:t1;[R1] log_event:true;[R1] column_count:3;[R1] source_category:SRC_FULL_RECORDED;[R1] source_type:SRC_OCEANBASE_1_0;[R1] has_pk:true;[R1] pk_info:(0);[R1] pks:pk;[R1] has_uk:false;[R1] uk_info:(null);[R1] uks:(null);[R1] [C1] column_name:pk;[R1] [C1] column_type:MYSQL_TYPE_LONG;[R1] [C1] column_is_rowkey:true;[R1] [C1] column_is_signed:true;[R1] [C1] column_encoding:binary;[R1] [C1] column_is_not_null:true;[R1] [C1] column_value_new:[503](3);[R1] [C1] column_value_old:[503](3);[R1] [C2] column_name:d1;[R1] [C2] column_type:MYSQL_TYPE_LONG_BLOB;[R1] [C2] column_is_rowkey:false;[R1] [C2] column_is_signed:true;[R1] [C2] column_encoding:utf8mb4;[R1] [C2] column_is_not_null:false;[R1] [C2] column_value_new_md5:[009f162345d580c116b4feab7b1e78e5](16777216);[R1] [C2] column_value_old_md5:[59944f8676978d9af57a585769818449](16777216);[R1] [C3] column_name:d2;[R1] [C3] column_type:MYSQL_TYPE_LONG_BLOB;[R1] [C3] column_is_rowkey:false;[R1] [C3] column_is_signed:true;[R1] [C3] column_encoding:binary;[R1] [C3] column_is_not_null:false;[R1] [C3] column_value_new_md5:[009f162345d580c116b4feab7b1e78e5](16777216);[R1] [C3] column_value_old_md5:[59944f8676978d9af57a585769818449](16777216);$[R2] COMMIT;
select md5(d1), md5(d2) from t1 where pk = 503;
md5(d1)	md5(d2)
009f162345d580c116b4feab7b1e78e5	009f162345d580c116b4feab7b1e78e5
delete from t1 where pk=503;
ob1.oblog.next_dml;
[R0] BEGIN;[R0] org_cluster_id:1;[R1] record_type:DELETE;[R1] database_name:oblog_tt.oblog_db1;[R1] table_name:t1;[R1] log_event:true;[R1] column_count:3;[R1] source_category:SRC_FULL_RECORDED;[R1] source_type:SRC_OCEANBASE_1_0;[R1] has_pk:true;[R1] pk_info:(0);[R1] pks:pk;[R1] has_uk:false;[R1] uk_info:(null);[R1] uks:(null);[R1] [C1] column_name:pk;[R1] [C1] column_type:MYSQL_TYPE_LONG;[R1] [C1] column_is_rowkey:true;[R1] [C1] column_is_signed:true;[R1] [C1] column_encoding:binary;[R1] [C1] column_is_not_null:true;[R1] [C1] column_value_old:[503](3);[R1] [C2] column_name:d1;[R1] [C2] column_type:MYSQL_TYPE_LONG_BLOB;[R1] [C2] column_is_rowkey:false;[R1] [C2] column_is_signed:true;[R1] [C2] column_encoding:utf8mb4;[R1] [C2] column_is_not_null:false;[R1] [C2] column_value_old_origin: PADDING;[R1] [C2] column_value_old_md5:[NULL](0);[R1] [C3] column_name:d2;[R1] [C3] column_type:MYSQL_TYPE_LONG_BLOB;[R1] [C3] column_is_rowkey:false;[R1] [C3] column_is_signed:true;[R1] [C3] column_encoding:binary;[R1] [C3] column_is_not_null:false;[R1] [C3] column_value_old_origin: PADDING;[R1] [C3] column_value_old_md5:[NULL](0);$[R2] COMMIT;
insert into t1 values (6, repeat('2', 62914560), repeat('2', 62914560));
ob1.oblog.next_dml;
[R0] BEGIN;[R0] org_cluster_id:1;[R1] record_type:INSERT;[R1] database_name:oblog_tt.oblog_db1;[R1] table_name:t1;[R1] log_event:true;[R1] column_count:3;[R1] source_category:SRC_FULL_RECORDED;[R1] source_type:SRC_OCEANBASE_1_0;[R1] has_pk:true;[R1] pk_info:(0);[R1] pks:pk;[R1] has_uk:false;[R1] uk_info:(null);[R1] uks:(null);[R1] [C1] column_name:pk;[R1] [C1] column_type:MYSQL_TYPE_LONG;[R1] [C1] column_is_rowkey:true;[R1] [C1] column_is_signed:true;[R1] [C1] column_encoding:binary;[R1] [C1] column_is_not_null:true;[R1] [C1] column_value_new:[6](1);[R1] [C2] column_name:d1;[R1] [C2] column_type:MYSQL_TYPE_LONG_BLOB;[R1] [C2] column_is_rowkey:false;[R1] [C2] column_is_signed:true;[R1] [C2] column_encoding:utf8mb4;[R1] [C2] column_is_not_null:false;[R1] [C2] column_value_new_md5:[38d2ddd6dbea7578980caf934671e9e1](62914560);[R1] [C3] column_name:d2;[R1] [C3] column_type:MYSQL_TYPE_LONG_BLOB;[R1] [C3] column_is_rowkey:false;[R1] [C3] column_is_signed:true;[R1] [C3] column_encoding:binary;[R1] [C3] column_is_not_null:false;[R1] [C3] column_value_new_md5:[38d2ddd6dbea7578980caf934671e9e1](62914560);$[R2] COMMIT;
select md5(d1), md5(d2) from t1 where pk = 6;
md5(d1)	md5(d2)
38d2ddd6dbea7578980caf934671e9e1	38d2ddd6dbea7578980caf934671e9e1
update t1 set d1 = repeat('y', 62914560), d2 = repeat('y', 62914560) where pk = 6;
ob1.oblog.next_dml;
[R0] BEGIN;[R0] org_cluster_id:1;[R1] record_type:UPDATE;[R1] database_name:oblog_tt.oblog_db1;[R1] table_name:t1;[R1] log_event:true;[R1] column_count:3;[R1] source_category:SRC_FULL_RECORDED;[R1] source_type:SRC_OCEANBASE_1_0;[R1] has_pk:true;[R1] pk_info:(0);[R1] pks:pk;[R1] has_uk:false;[R1] uk_info:(null);[R1] uks:(null);[R1] [C1] column_name:pk;[R1] [C1] column_type:MYSQL_TYPE_LONG;[R1] [C1] column_is_rowkey:true;[R1] [C1] column_is_signed:true;[R1] [C1] column_encoding:binary;[R1] [C1] column_is_not_null:true;[R1] [C1] column_value_new:[6](1);[R1] [C1] column_value_old:[6](1);[R1] [C2] column_name:d1;[R1] [C2] column_type:MYSQL_TYPE_LONG_BLOB;[R1] [C2] column_is_rowkey:false;[R1] [C2] column_is_signed:true;[R1] [C2] column_encoding:utf8mb4;[R1] [C2] column_is_not_null:false;[R1] [C2] column_value_new_md5:[10ab3aa573b645fa631f6e2649eb2ff7](62914560);[R1] [C2] column_value_old_md5:[38d2ddd6dbea7578980caf934671e9e1](62914560);[R1] [C3] column_name:d2;[R1] [C3] column_type:MYSQL_TYPE_LONG_BLOB;[R1] [C3] column_is_rowkey:false;[R1] [C3] column_is_signed:true;[R1] [C3] column_encoding:binary;[R1] [C3] column_is_not_null:false;[R1] [C3] column_value_new_md5:[10ab3aa573b645fa631f6e2649eb2ff7](62914560);[R1] [C3] column_value_old_md5:[38d2ddd6dbea7578980caf934671e9e1](62914560);$[R2] COMMIT;
select md5(d1), md5(d2) from t1 where pk = 6;
md5(d1)	md5(d2)
10ab3aa573b645fa631f6e2649eb2ff7	10ab3aa573b645fa631f6e2649eb2ff7
delete from t1 where pk=6;
ob1.oblog.next_dml;
[R0] BEGIN;[R0] org_cluster_id:1;[R1] record_type:DELETE;[R1] database_name:oblog_tt.oblog_db1;[R1] table_name:t1;[R1] log_event:true;[R1] column_count:3;[R1] source_category:SRC_FULL_RECORDED;[R1] source_type:SRC_OCEANBASE_1_0;[R1] has_pk:true;[R1] pk_info:(0);[R1] pks:pk;[R1] has_uk:false;[R1] uk_info:(null);[R1] uks:(null);[R1] [C1] column_name:pk;[R1] [C1] column_type:MYSQL_TYPE_LONG;[R1] [C1] column_is_rowkey:true;[R1] [C1] column_is_signed:true;[R1] [C1] column_encoding:binary;[R1] [C1] column_is_not_null:true;[R1] [C1] column_value_old:[6](1);[R1] [C2] column_name:d1;[R1] [C2] column_type:MYSQL_TYPE_LONG_BLOB;[R1] [C2] column_is_rowkey:false;[R1] [C2] column_is_signed:true;[R1] [C2] column_encoding:utf8mb4;[R1] [C2] column_is_not_null:false;[R1] [C2] column_value_old_origin: PADDING;[R1] [C2] column_value_old_md5:[NULL](0);[R1] [C3] column_name:d2;[R1] [C3] column_type:MYSQL_TYPE_LONG_BLOB;[R1] [C3] column_is_rowkey:false;[R1] [C3] column_is_signed:true;[R1] [C3] column_encoding:binary;[R1] [C3] column_is_not_null:false;[R1] [C3] column_value_old_origin: PADDING;[R1] [C3] column_value_old_md5:[NULL](0);$[R2] COMMIT;
insert into t1(pk) values (0);
ob1.oblog.next_dml;
[R0] BEGIN;[R0] org_cluster_id:1;[R1] record_type:INSERT;[R1] database_name:oblog_tt.oblog_db1;[R1] table_name:t1;[R1] log_event:true;[R1] column_count:3;[R1] source_category:SRC_FULL_RECORDED;[R1] source_type:SRC_OCEANBASE_1_0;[R1] has_pk:true;[R1] pk_info:(0);[R1] pks:pk;[R1] has_uk:false;[R1] uk_info:(null);[R1] uks:(null);[R1] [C1] column_name:pk;[R1] [C1] column_type:MYSQL_TYPE_LONG;[R1] [C1] column_is_rowkey:true;[R1] [C1] column_is_signed:true;[R1] [C1] column_encoding:binary;[R1] [C1] column_is_not_null:true;[R1] [C1] column_value_new:[0](1);[R1] [C2] column_name:d1;[R1] [C2] column_type:MYSQL_TYPE_LONG_BLOB;[R1] [C2] column_is_rowkey:false;[R1] [C2] column_is_signed:true;[R1] [C2] column_encoding:utf8mb4;[R1] [C2] column_is_not_null:false;[R1] [C2] column_value_new_md5:[NULL](0);[R1] [C3] column_name:d2;[R1] [C3] column_type:MYSQL_TYPE_LONG_BLOB;[R1] [C3] column_is_rowkey:false;[R1] [C3] column_is_signed:true;[R1] [C3] column_encoding:binary;[R1] [C3] column_is_not_null:false;[R1] [C3] column_value_new_md5:[NULL](0);$[R2] COMMIT;
ob1.oblog.stop;
ob1.oblog.gen_conf tb_white_list=oblog*.*.* log_level=DEBUG enable_lob_data_storage_memory=0;
ob1.oblog.set_start_tstamp_usec $restart_usec;
ob1.oblog.set_extra_argument -m;
ob1.oblog.restart;
ob1.oblog.waitUntilRealtime 2400;
ob1.oblog.next_dml;
[R0] BEGIN;[R0] org_cluster_id:1;[R1] record_type:INSERT;[R1] database_name:oblog_tt.oblog_db1;[R1] table_name:t1;[R1] log_event:true;[R1] column_count:3;[R1] source_category:SRC_FULL_RECORDED;[R1] source_type:SRC_OCEANBASE_1_0;[R1] has_pk:true;[R1] pk_info:(0);[R1] pks:pk;[R1] has_uk:false;[R1] uk_info:(null);[R1] uks:(null);[R1] [C1] column_name:pk;[R1] [C1] column_type:MYSQL_TYPE_LONG;[R1] [C1] column_is_rowkey:true;[R1] [C1] column_is_signed:true;[R1] [C1] column_encoding:binary;[R1] [C1] column_is_not_null:true;[R1] [C1] column_value_new:[1](1);[R1] [C2] column_name:d1;[R1] [C2] column_type:MYSQL_TYPE_LONG_BLOB;[R1] [C2] column_is_rowkey:false;[R1] [C2] column_is_signed:true;[R1] [C2] column_encoding:utf8mb4;[R1] [C2] column_is_not_null:false;[R1] [C2] column_value_new_md5:[1f25ce6eb2dc9fbb7f4df09236be6bea](4096);[R1] [C3] column_name:d2;[R1] [C3] column_type:MYSQL_TYPE_LONG_BLOB;[R1] [C3] column_is_rowkey:false;[R1] [C3] column_is_signed:true;[R1] [C3] column_encoding:binary;[R1] [C3] column_is_not_null:false;[R1] [C3] column_value_new_md5:[1f25ce6eb2dc9fbb7f4df09236be6bea](4096);$[R2] COMMIT;
ob1.oblog.stop;
ob1.oblog.gen_conf tb_white_list=oblog*.*.* log_level=DEBUG enable_lob_data_storage_memory=0;
ob1.oblog.set_extra_argument -m;
ob1.oblog.restart;
ob1.oblog.stop;
