ob1=OBI(cluster=1,init_unit_cpu=5);
ob1.reboot;
ob1.create_client;
create resource unit oblog_box max_cpu 2, memory_size='20G';
create resource pool oblog_pool unit = 'oblog_box', unit_num = 1, zone_list = ('z1');
create tenant oblog_tt replica_num = 1, primary_zone='z1', resource_pool_list=('oblog_pool') set ob_tcp_invited_nodes='%';
create database oblog_db1;
use oblog_db1;
alter tenant oblog_tt set variables max_allowed_packet=52428800;
set global max_allowed_packet=52428800;
set ob_trx_timeout=100000000;
'[CASE_BEGIN] [vector_type]'
ob1.oblog.gen_conf tb_white_list=oblog_tt.*.* log_level=DEBUG skip_ob_version_compat_check=1;
ob1.oblog.set_extra_argument -x;
ob1.oblog.restart;
'[SECTION_BEGIN] [basic_test]'
create table map_t1(c1 int primary key, c2 map(varchar(16),array(array(varchar(16)))), c3 map(float,array(array(float))), c4 map(double,array(array(array(double)))));
ob1.oblog.next;
[R0] record_type:EDDL;[R0] db_name:oblog_tt.oblog_db1;[R0] table_name:;[R0] column_count:1;[R0] column_name:ddl;[R0] ddl_stmt_str: create table map_t1(c1 int primary key, c2 map(varchar(16),array(array(varchar(16)))), c3 map(float,array(array(float))), c4 map(double,array(array(array(double)))));[R0] ddl_stmt_len: 165;
insert into map_t1 values(0, null, null, null);
ob1.oblog.next;
[R0] BEGIN;[R0] org_cluster_id:1;[R1] record_type:INSERT;[R1] database_name:oblog_tt.oblog_db1;[R1] table_name:map_t1;[R1] log_event:true;[R1] column_count:4;[R1] source_category:SRC_FULL_RECORDED;[R1] source_type:SRC_OCEANBASE_1_0;[R1] has_pk:true;[R1] pk_info:(0);[R1] pks:c1;[R1] has_uk:false;[R1] uk_info:(null);[R1] uks:(null);[R1] [C1] column_name:c1;[R1] [C1] column_type:MYSQL_TYPE_LONG;[R1] [C1] column_is_rowkey:true;[R1] [C1] column_is_signed:true;[R1] [C1] column_encoding:binary;[R1] [C1] column_is_not_null:true;[R1] [C1] column_value_new:[0](1);[R1] [C2] column_name:c2;[R1] [C2] column_type:MYSQL_TYPE_OB_MAP;[R1] [C2] column_is_rowkey:false;[R1] [C2] column_is_signed:true;[R1] [C2] column_encoding:binary;[R1] [C2] column_is_not_null:false;[R1] [C2] column_value_new:[NULL](0);[R1] [C3] column_name:c3;[R1] [C3] column_type:MYSQL_TYPE_OB_MAP;[R1] [C3] column_is_rowkey:false;[R1] [C3] column_is_signed:true;[R1] [C3] column_encoding:binary;[R1] [C3] column_is_not_null:false;[R1] [C3] column_value_new:[NULL](0);[R1] [C4] column_name:c4;[R1] [C4] column_type:MYSQL_TYPE_OB_MAP;[R1] [C4] column_is_rowkey:false;[R1] [C4] column_is_signed:true;[R1] [C4] column_encoding:binary;[R1] [C4] column_is_not_null:false;[R1] [C4] column_value_new:[NULL](0);$[R2] COMMIT;
insert into map_t1 values(1, map("a",[["hello", "world"], [null, "hi"]]),
map(1.23,[[5.55, 7.87, 44], [66, 123.67, null], [null, 3.1415, 289.33]]),
map(10,[[[100, 3.1415926, 4.56, 7.88], [5.55, 7.87, 44]], [[null, 3.1415, 289.33],[2.111144455, 3.444555666, null]]]));
ob1.oblog.next;
[R0] BEGIN;[R0] org_cluster_id:1;[R1] record_type:INSERT;[R1] database_name:oblog_tt.oblog_db1;[R1] table_name:map_t1;[R1] log_event:true;[R1] column_count:4;[R1] source_category:SRC_FULL_RECORDED;[R1] source_type:SRC_OCEANBASE_1_0;[R1] has_pk:true;[R1] pk_info:(0);[R1] pks:c1;[R1] has_uk:false;[R1] uk_info:(null);[R1] uks:(null);[R1] [C1] column_name:c1;[R1] [C1] column_type:MYSQL_TYPE_LONG;[R1] [C1] column_is_rowkey:true;[R1] [C1] column_is_signed:true;[R1] [C1] column_encoding:binary;[R1] [C1] column_is_not_null:true;[R1] [C1] column_value_new:[1](1);[R1] [C2] column_name:c2;[R1] [C2] column_type:MYSQL_TYPE_OB_MAP;[R1] [C2] column_is_rowkey:false;[R1] [C2] column_is_signed:true;[R1] [C2] column_encoding:binary;[R1] [C2] column_is_not_null:false;[R1] [C2] column_value_new:[{"a":[["hello","world"],[NULL,"hi"]]}](37);[R1] [C3] column_name:c3;[R1] [C3] column_type:MYSQL_TYPE_OB_MAP;[R1] [C3] column_is_rowkey:false;[R1] [C3] column_is_signed:true;[R1] [C3] column_encoding:binary;[R1] [C3] column_is_not_null:false;[R1] [C3] column_value_new:[{1.23:[[5.55,7.87,44],[66,123.67,NULL],[NULL,3.1415,289.33]]}](61);[R1] [C4] column_name:c4;[R1] [C4] column_type:MYSQL_TYPE_OB_MAP;[R1] [C4] column_is_rowkey:false;[R1] [C4] column_is_signed:true;[R1] [C4] column_encoding:binary;[R1] [C4] column_is_not_null:false;[R1] [C4] column_value_new:[{10:[[[100,3.1415926,4.56,7.88],[5.55,7.87,44]],[[NULL,3.1415,289.33],[2.111144455,3.444555666,NULL]]]}](103);$[R2] COMMIT;
insert into map_t1 values(2, map(null,[null, [null, "hi"]], "aa", [["ocean","base"]]),
map(null,[[5.55, 7.87, 44], null, [null, 3.1415, 289.33]], 2.34, [[1.234,5.678]]),
map(null,[[[100, 3.1415926, 4.56, 7.88], [5.55, 7.87, 44]], null], 100, [[[2.345,3.456]]]));
ob1.oblog.next;
[R0] BEGIN;[R0] org_cluster_id:1;[R1] record_type:INSERT;[R1] database_name:oblog_tt.oblog_db1;[R1] table_name:map_t1;[R1] log_event:true;[R1] column_count:4;[R1] source_category:SRC_FULL_RECORDED;[R1] source_type:SRC_OCEANBASE_1_0;[R1] has_pk:true;[R1] pk_info:(0);[R1] pks:c1;[R1] has_uk:false;[R1] uk_info:(null);[R1] uks:(null);[R1] [C1] column_name:c1;[R1] [C1] column_type:MYSQL_TYPE_LONG;[R1] [C1] column_is_rowkey:true;[R1] [C1] column_is_signed:true;[R1] [C1] column_encoding:binary;[R1] [C1] column_is_not_null:true;[R1] [C1] column_value_new:[2](1);[R1] [C2] column_name:c2;[R1] [C2] column_type:MYSQL_TYPE_OB_MAP;[R1] [C2] column_is_rowkey:false;[R1] [C2] column_is_signed:true;[R1] [C2] column_encoding:binary;[R1] [C2] column_is_not_null:false;[R1] [C2] column_value_new:[{NULL:[NULL,[NULL,"hi"]],"aa":[["ocean","base"]]}](49);[R1] [C3] column_name:c3;[R1] [C3] column_type:MYSQL_TYPE_OB_MAP;[R1] [C3] column_is_rowkey:false;[R1] [C3] column_is_signed:true;[R1] [C3] column_encoding:binary;[R1] [C3] column_is_not_null:false;[R1] [C3] column_value_new:[{NULL:[[5.55,7.87,44],NULL,[NULL,3.1415,289.33]],2.34:[[1.234,5.678]]}](70);[R1] [C4] column_name:c4;[R1] [C4] column_type:MYSQL_TYPE_OB_MAP;[R1] [C4] column_is_rowkey:false;[R1] [C4] column_is_signed:true;[R1] [C4] column_encoding:binary;[R1] [C4] column_is_not_null:false;[R1] [C4] column_value_new:[{NULL:[[[100,3.1415926,4.56,7.88],[5.55,7.87,44]],NULL],100:[[[2.345,3.456]]]}](78);$[R2] COMMIT;
insert into map_t1 values(3, map(null,[null, [null, null]]),
map(null,[null, null, [null, null, null]]),
map(null,[[[null]]]));
ob1.oblog.next;
[R0] BEGIN;[R0] org_cluster_id:1;[R1] record_type:INSERT;[R1] database_name:oblog_tt.oblog_db1;[R1] table_name:map_t1;[R1] log_event:true;[R1] column_count:4;[R1] source_category:SRC_FULL_RECORDED;[R1] source_type:SRC_OCEANBASE_1_0;[R1] has_pk:true;[R1] pk_info:(0);[R1] pks:c1;[R1] has_uk:false;[R1] uk_info:(null);[R1] uks:(null);[R1] [C1] column_name:c1;[R1] [C1] column_type:MYSQL_TYPE_LONG;[R1] [C1] column_is_rowkey:true;[R1] [C1] column_is_signed:true;[R1] [C1] column_encoding:binary;[R1] [C1] column_is_not_null:true;[R1] [C1] column_value_new:[3](1);[R1] [C2] column_name:c2;[R1] [C2] column_type:MYSQL_TYPE_OB_MAP;[R1] [C2] column_is_rowkey:false;[R1] [C2] column_is_signed:true;[R1] [C2] column_encoding:binary;[R1] [C2] column_is_not_null:false;[R1] [C2] column_value_new:[{NULL:[NULL,[NULL,NULL]]}](25);[R1] [C3] column_name:c3;[R1] [C3] column_type:MYSQL_TYPE_OB_MAP;[R1] [C3] column_is_rowkey:false;[R1] [C3] column_is_signed:true;[R1] [C3] column_encoding:binary;[R1] [C3] column_is_not_null:false;[R1] [C3] column_value_new:[{NULL:[NULL,NULL,[NULL,NULL,NULL]]}](35);[R1] [C4] column_name:c4;[R1] [C4] column_type:MYSQL_TYPE_OB_MAP;[R1] [C4] column_is_rowkey:false;[R1] [C4] column_is_signed:true;[R1] [C4] column_encoding:binary;[R1] [C4] column_is_not_null:false;[R1] [C4] column_value_new:[{NULL:[[[NULL]]]}](17);$[R2] COMMIT;
insert into map_t1 values(4, map("bb",[["hello", "world"], [null, "hi"]]),
map(88,[[5, 7, 44], [66, 123, null], [null, 31415, 28933]]),
map(1234,[[[100, 314, 456, 788], [555, 787, 44]], [[null, 31415, 28933],[2115, 3444, null]]]));
ob1.oblog.next;
[R0] BEGIN;[R0] org_cluster_id:1;[R1] record_type:INSERT;[R1] database_name:oblog_tt.oblog_db1;[R1] table_name:map_t1;[R1] log_event:true;[R1] column_count:4;[R1] source_category:SRC_FULL_RECORDED;[R1] source_type:SRC_OCEANBASE_1_0;[R1] has_pk:true;[R1] pk_info:(0);[R1] pks:c1;[R1] has_uk:false;[R1] uk_info:(null);[R1] uks:(null);[R1] [C1] column_name:c1;[R1] [C1] column_type:MYSQL_TYPE_LONG;[R1] [C1] column_is_rowkey:true;[R1] [C1] column_is_signed:true;[R1] [C1] column_encoding:binary;[R1] [C1] column_is_not_null:true;[R1] [C1] column_value_new:[4](1);[R1] [C2] column_name:c2;[R1] [C2] column_type:MYSQL_TYPE_OB_MAP;[R1] [C2] column_is_rowkey:false;[R1] [C2] column_is_signed:true;[R1] [C2] column_encoding:binary;[R1] [C2] column_is_not_null:false;[R1] [C2] column_value_new:[{"bb":[["hello","world"],[NULL,"hi"]]}](38);[R1] [C3] column_name:c3;[R1] [C3] column_type:MYSQL_TYPE_OB_MAP;[R1] [C3] column_is_rowkey:false;[R1] [C3] column_is_signed:true;[R1] [C3] column_encoding:binary;[R1] [C3] column_is_not_null:false;[R1] [C3] column_value_new:[{88:[[5,7,44],[66,123,NULL],[NULL,31415,28933]]}](48);[R1] [C4] column_name:c4;[R1] [C4] column_type:MYSQL_TYPE_OB_MAP;[R1] [C4] column_is_rowkey:false;[R1] [C4] column_is_signed:true;[R1] [C4] column_encoding:binary;[R1] [C4] column_is_not_null:false;[R1] [C4] column_value_new:[{1234:[[[100,314,456,788],[555,787,44]],[[NULL,31415,28933],[2115,3444,NULL]]]}](79);$[R2] COMMIT;
insert into map_t1 values(5, '{}', '{}', '{}');
ob1.oblog.next;
[R0] BEGIN;[R0] org_cluster_id:1;[R1] record_type:INSERT;[R1] database_name:oblog_tt.oblog_db1;[R1] table_name:map_t1;[R1] log_event:true;[R1] column_count:4;[R1] source_category:SRC_FULL_RECORDED;[R1] source_type:SRC_OCEANBASE_1_0;[R1] has_pk:true;[R1] pk_info:(0);[R1] pks:c1;[R1] has_uk:false;[R1] uk_info:(null);[R1] uks:(null);[R1] [C1] column_name:c1;[R1] [C1] column_type:MYSQL_TYPE_LONG;[R1] [C1] column_is_rowkey:true;[R1] [C1] column_is_signed:true;[R1] [C1] column_encoding:binary;[R1] [C1] column_is_not_null:true;[R1] [C1] column_value_new:[5](1);[R1] [C2] column_name:c2;[R1] [C2] column_type:MYSQL_TYPE_OB_MAP;[R1] [C2] column_is_rowkey:false;[R1] [C2] column_is_signed:true;[R1] [C2] column_encoding:binary;[R1] [C2] column_is_not_null:false;[R1] [C2] column_value_new:[{}](2);[R1] [C3] column_name:c3;[R1] [C3] column_type:MYSQL_TYPE_OB_MAP;[R1] [C3] column_is_rowkey:false;[R1] [C3] column_is_signed:true;[R1] [C3] column_encoding:binary;[R1] [C3] column_is_not_null:false;[R1] [C3] column_value_new:[{}](2);[R1] [C4] column_name:c4;[R1] [C4] column_type:MYSQL_TYPE_OB_MAP;[R1] [C4] column_is_rowkey:false;[R1] [C4] column_is_signed:true;[R1] [C4] column_encoding:binary;[R1] [C4] column_is_not_null:false;[R1] [C4] column_value_new:[{}](2);$[R2] COMMIT;
insert into map_t1 values(6, '{"a":[[]]}', '{55.5:[[]]}', '{66.6:[[[]]]}');
ob1.oblog.next;
[R0] BEGIN;[R0] org_cluster_id:1;[R1] record_type:INSERT;[R1] database_name:oblog_tt.oblog_db1;[R1] table_name:map_t1;[R1] log_event:true;[R1] column_count:4;[R1] source_category:SRC_FULL_RECORDED;[R1] source_type:SRC_OCEANBASE_1_0;[R1] has_pk:true;[R1] pk_info:(0);[R1] pks:c1;[R1] has_uk:false;[R1] uk_info:(null);[R1] uks:(null);[R1] [C1] column_name:c1;[R1] [C1] column_type:MYSQL_TYPE_LONG;[R1] [C1] column_is_rowkey:true;[R1] [C1] column_is_signed:true;[R1] [C1] column_encoding:binary;[R1] [C1] column_is_not_null:true;[R1] [C1] column_value_new:[6](1);[R1] [C2] column_name:c2;[R1] [C2] column_type:MYSQL_TYPE_OB_MAP;[R1] [C2] column_is_rowkey:false;[R1] [C2] column_is_signed:true;[R1] [C2] column_encoding:binary;[R1] [C2] column_is_not_null:false;[R1] [C2] column_value_new:[{"a":[[]]}](10);[R1] [C3] column_name:c3;[R1] [C3] column_type:MYSQL_TYPE_OB_MAP;[R1] [C3] column_is_rowkey:false;[R1] [C3] column_is_signed:true;[R1] [C3] column_encoding:binary;[R1] [C3] column_is_not_null:false;[R1] [C3] column_value_new:[{55.5:[[]]}](11);[R1] [C4] column_name:c4;[R1] [C4] column_type:MYSQL_TYPE_OB_MAP;[R1] [C4] column_is_rowkey:false;[R1] [C4] column_is_signed:true;[R1] [C4] column_encoding:binary;[R1] [C4] column_is_not_null:false;[R1] [C4] column_value_new:[{66.6:[[[]]]}](13);$[R2] COMMIT;
update map_t1 set c2=map("a",[["hello", "world"], [null, "hi"]]) where c1 = 0;
ob1.oblog.next;
[R0] BEGIN;[R0] org_cluster_id:1;[R1] record_type:UPDATE;[R1] database_name:oblog_tt.oblog_db1;[R1] table_name:map_t1;[R1] log_event:true;[R1] column_count:4;[R1] source_category:SRC_FULL_RECORDED;[R1] source_type:SRC_OCEANBASE_1_0;[R1] has_pk:true;[R1] pk_info:(0);[R1] pks:c1;[R1] has_uk:false;[R1] uk_info:(null);[R1] uks:(null);[R1] [C1] column_name:c1;[R1] [C1] column_type:MYSQL_TYPE_LONG;[R1] [C1] column_is_rowkey:true;[R1] [C1] column_is_signed:true;[R1] [C1] column_encoding:binary;[R1] [C1] column_is_not_null:true;[R1] [C1] column_value_new:[0](1);[R1] [C1] column_value_old:[0](1);[R1] [C2] column_name:c2;[R1] [C2] column_type:MYSQL_TYPE_OB_MAP;[R1] [C2] column_is_rowkey:false;[R1] [C2] column_is_signed:true;[R1] [C2] column_encoding:binary;[R1] [C2] column_is_not_null:false;[R1] [C2] column_value_new:[{"a":[["hello","world"],[NULL,"hi"]]}](37);[R1] [C2] column_value_old:[NULL](0);[R1] [C3] column_name:c3;[R1] [C3] column_type:MYSQL_TYPE_OB_MAP;[R1] [C3] column_is_rowkey:false;[R1] [C3] column_is_signed:true;[R1] [C3] column_encoding:binary;[R1] [C3] column_is_not_null:false;[R1] [C3] column_value_new:[NULL](0);[R1] [C3] column_value_old:[NULL](0);[R1] [C4] column_name:c4;[R1] [C4] column_type:MYSQL_TYPE_OB_MAP;[R1] [C4] column_is_rowkey:false;[R1] [C4] column_is_signed:true;[R1] [C4] column_encoding:binary;[R1] [C4] column_is_not_null:false;[R1] [C4] column_value_new:[NULL](0);[R1] [C4] column_value_old:[NULL](0);$[R2] COMMIT;
update map_t1 set c2=map("a",[["hello", "world"], [null, "hi"]]) where c1 = 2;
ob1.oblog.next;
[R0] BEGIN;[R0] org_cluster_id:1;[R1] record_type:UPDATE;[R1] database_name:oblog_tt.oblog_db1;[R1] table_name:map_t1;[R1] log_event:true;[R1] column_count:4;[R1] source_category:SRC_FULL_RECORDED;[R1] source_type:SRC_OCEANBASE_1_0;[R1] has_pk:true;[R1] pk_info:(0);[R1] pks:c1;[R1] has_uk:false;[R1] uk_info:(null);[R1] uks:(null);[R1] [C1] column_name:c1;[R1] [C1] column_type:MYSQL_TYPE_LONG;[R1] [C1] column_is_rowkey:true;[R1] [C1] column_is_signed:true;[R1] [C1] column_encoding:binary;[R1] [C1] column_is_not_null:true;[R1] [C1] column_value_new:[2](1);[R1] [C1] column_value_old:[2](1);[R1] [C2] column_name:c2;[R1] [C2] column_type:MYSQL_TYPE_OB_MAP;[R1] [C2] column_is_rowkey:false;[R1] [C2] column_is_signed:true;[R1] [C2] column_encoding:binary;[R1] [C2] column_is_not_null:false;[R1] [C2] column_value_new:[{"a":[["hello","world"],[NULL,"hi"]]}](37);[R1] [C2] column_value_old:[{NULL:[NULL,[NULL,"hi"]],"aa":[["ocean","base"]]}](49);[R1] [C3] column_name:c3;[R1] [C3] column_type:MYSQL_TYPE_OB_MAP;[R1] [C3] column_is_rowkey:false;[R1] [C3] column_is_signed:true;[R1] [C3] column_encoding:binary;[R1] [C3] column_is_not_null:false;[R1] [C3] column_value_new:[{NULL:[[5.55,7.87,44],NULL,[NULL,3.1415,289.33]],2.34:[[1.234,5.678]]}](70);[R1] [C3] column_value_old:[{NULL:[[5.55,7.87,44],NULL,[NULL,3.1415,289.33]],2.34:[[1.234,5.678]]}](70);[R1] [C4] column_name:c4;[R1] [C4] column_type:MYSQL_TYPE_OB_MAP;[R1] [C4] column_is_rowkey:false;[R1] [C4] column_is_signed:true;[R1] [C4] column_encoding:binary;[R1] [C4] column_is_not_null:false;[R1] [C4] column_value_new:[{NULL:[[[100,3.1415926,4.56,7.88],[5.55,7.87,44]],NULL],100:[[[2.345,3.456]]]}](78);[R1] [C4] column_value_old:[{NULL:[[[100,3.1415926,4.56,7.88],[5.55,7.87,44]],NULL],100:[[[2.345,3.456]]]}](78);$[R2] COMMIT;
update map_t1 set c3=map(1.23,[[1.11, 7.87, 44], [66, 123.67, 2.22], [3.33, 3.1415, 289.33]]) where c1=2;
ob1.oblog.next;
[R0] BEGIN;[R0] org_cluster_id:1;[R1] record_type:UPDATE;[R1] database_name:oblog_tt.oblog_db1;[R1] table_name:map_t1;[R1] log_event:true;[R1] column_count:4;[R1] source_category:SRC_FULL_RECORDED;[R1] source_type:SRC_OCEANBASE_1_0;[R1] has_pk:true;[R1] pk_info:(0);[R1] pks:c1;[R1] has_uk:false;[R1] uk_info:(null);[R1] uks:(null);[R1] [C1] column_name:c1;[R1] [C1] column_type:MYSQL_TYPE_LONG;[R1] [C1] column_is_rowkey:true;[R1] [C1] column_is_signed:true;[R1] [C1] column_encoding:binary;[R1] [C1] column_is_not_null:true;[R1] [C1] column_value_new:[2](1);[R1] [C1] column_value_old:[2](1);[R1] [C2] column_name:c2;[R1] [C2] column_type:MYSQL_TYPE_OB_MAP;[R1] [C2] column_is_rowkey:false;[R1] [C2] column_is_signed:true;[R1] [C2] column_encoding:binary;[R1] [C2] column_is_not_null:false;[R1] [C2] column_value_new:[{"a":[["hello","world"],[NULL,"hi"]]}](37);[R1] [C2] column_value_old:[{"a":[["hello","world"],[NULL,"hi"]]}](37);[R1] [C3] column_name:c3;[R1] [C3] column_type:MYSQL_TYPE_OB_MAP;[R1] [C3] column_is_rowkey:false;[R1] [C3] column_is_signed:true;[R1] [C3] column_encoding:binary;[R1] [C3] column_is_not_null:false;[R1] [C3] column_value_new:[{1.23:[[1.11,7.87,44],[66,123.67,2.22],[3.33,3.1415,289.33]]}](61);[R1] [C3] column_value_old:[{NULL:[[5.55,7.87,44],NULL,[NULL,3.1415,289.33]],2.34:[[1.234,5.678]]}](70);[R1] [C4] column_name:c4;[R1] [C4] column_type:MYSQL_TYPE_OB_MAP;[R1] [C4] column_is_rowkey:false;[R1] [C4] column_is_signed:true;[R1] [C4] column_encoding:binary;[R1] [C4] column_is_not_null:false;[R1] [C4] column_value_new:[{NULL:[[[100,3.1415926,4.56,7.88],[5.55,7.87,44]],NULL],100:[[[2.345,3.456]]]}](78);[R1] [C4] column_value_old:[{NULL:[[[100,3.1415926,4.56,7.88],[5.55,7.87,44]],NULL],100:[[[2.345,3.456]]]}](78);$[R2] COMMIT;
update map_t1 set c3=map(1.1, [[1.11, 7.87, 44]], 2.2, [[66, 123.67, 2.22]], 3.3, [[3.33, 3.1415, 289.33]]) where c1=3;
ob1.oblog.next;
[R0] BEGIN;[R0] org_cluster_id:1;[R1] record_type:UPDATE;[R1] database_name:oblog_tt.oblog_db1;[R1] table_name:map_t1;[R1] log_event:true;[R1] column_count:4;[R1] source_category:SRC_FULL_RECORDED;[R1] source_type:SRC_OCEANBASE_1_0;[R1] has_pk:true;[R1] pk_info:(0);[R1] pks:c1;[R1] has_uk:false;[R1] uk_info:(null);[R1] uks:(null);[R1] [C1] column_name:c1;[R1] [C1] column_type:MYSQL_TYPE_LONG;[R1] [C1] column_is_rowkey:true;[R1] [C1] column_is_signed:true;[R1] [C1] column_encoding:binary;[R1] [C1] column_is_not_null:true;[R1] [C1] column_value_new:[3](1);[R1] [C1] column_value_old:[3](1);[R1] [C2] column_name:c2;[R1] [C2] column_type:MYSQL_TYPE_OB_MAP;[R1] [C2] column_is_rowkey:false;[R1] [C2] column_is_signed:true;[R1] [C2] column_encoding:binary;[R1] [C2] column_is_not_null:false;[R1] [C2] column_value_new:[{NULL:[NULL,[NULL,NULL]]}](25);[R1] [C2] column_value_old:[{NULL:[NULL,[NULL,NULL]]}](25);[R1] [C3] column_name:c3;[R1] [C3] column_type:MYSQL_TYPE_OB_MAP;[R1] [C3] column_is_rowkey:false;[R1] [C3] column_is_signed:true;[R1] [C3] column_encoding:binary;[R1] [C3] column_is_not_null:false;[R1] [C3] column_value_new:[{1.1:[[1.11,7.87,44]],2.2:[[66,123.67,2.22]],3.3:[[3.33,3.1415,289.33]]}](72);[R1] [C3] column_value_old:[{NULL:[NULL,NULL,[NULL,NULL,NULL]]}](35);[R1] [C4] column_name:c4;[R1] [C4] column_type:MYSQL_TYPE_OB_MAP;[R1] [C4] column_is_rowkey:false;[R1] [C4] column_is_signed:true;[R1] [C4] column_encoding:binary;[R1] [C4] column_is_not_null:false;[R1] [C4] column_value_new:[{NULL:[[[NULL]]]}](17);[R1] [C4] column_value_old:[{NULL:[[[NULL]]]}](17);$[R2] COMMIT;
update map_t1 set c4=null where c1 = 4;
ob1.oblog.next;
[R0] BEGIN;[R0] org_cluster_id:1;[R1] record_type:UPDATE;[R1] database_name:oblog_tt.oblog_db1;[R1] table_name:map_t1;[R1] log_event:true;[R1] column_count:4;[R1] source_category:SRC_FULL_RECORDED;[R1] source_type:SRC_OCEANBASE_1_0;[R1] has_pk:true;[R1] pk_info:(0);[R1] pks:c1;[R1] has_uk:false;[R1] uk_info:(null);[R1] uks:(null);[R1] [C1] column_name:c1;[R1] [C1] column_type:MYSQL_TYPE_LONG;[R1] [C1] column_is_rowkey:true;[R1] [C1] column_is_signed:true;[R1] [C1] column_encoding:binary;[R1] [C1] column_is_not_null:true;[R1] [C1] column_value_new:[4](1);[R1] [C1] column_value_old:[4](1);[R1] [C2] column_name:c2;[R1] [C2] column_type:MYSQL_TYPE_OB_MAP;[R1] [C2] column_is_rowkey:false;[R1] [C2] column_is_signed:true;[R1] [C2] column_encoding:binary;[R1] [C2] column_is_not_null:false;[R1] [C2] column_value_new:[{"bb":[["hello","world"],[NULL,"hi"]]}](38);[R1] [C2] column_value_old:[{"bb":[["hello","world"],[NULL,"hi"]]}](38);[R1] [C3] column_name:c3;[R1] [C3] column_type:MYSQL_TYPE_OB_MAP;[R1] [C3] column_is_rowkey:false;[R1] [C3] column_is_signed:true;[R1] [C3] column_encoding:binary;[R1] [C3] column_is_not_null:false;[R1] [C3] column_value_new:[{88:[[5,7,44],[66,123,NULL],[NULL,31415,28933]]}](48);[R1] [C3] column_value_old:[{88:[[5,7,44],[66,123,NULL],[NULL,31415,28933]]}](48);[R1] [C4] column_name:c4;[R1] [C4] column_type:MYSQL_TYPE_OB_MAP;[R1] [C4] column_is_rowkey:false;[R1] [C4] column_is_signed:true;[R1] [C4] column_encoding:binary;[R1] [C4] column_is_not_null:false;[R1] [C4] column_value_new:[NULL](0);[R1] [C4] column_value_old:[{1234:[[[100,314,456,788],[555,787,44]],[[NULL,31415,28933],[2115,3444,NULL]]]}](79);$[R2] COMMIT;
update map_t1 set c1 = 12 where c1 = 2;
ob1.oblog.next;
[R0] BEGIN;[R0] org_cluster_id:1;[R1] record_type:DELETE;[R1] database_name:oblog_tt.oblog_db1;[R1] table_name:map_t1;[R1] log_event:true;[R1] column_count:4;[R1] source_category:SRC_FULL_RECORDED;[R1] source_type:SRC_OCEANBASE_1_0;[R1] has_pk:true;[R1] pk_info:(0);[R1] pks:c1;[R1] has_uk:false;[R1] uk_info:(null);[R1] uks:(null);[R1] [C1] column_name:c1;[R1] [C1] column_type:MYSQL_TYPE_LONG;[R1] [C1] column_is_rowkey:true;[R1] [C1] column_is_signed:true;[R1] [C1] column_encoding:binary;[R1] [C1] column_is_not_null:true;[R1] [C1] column_value_old:[2](1);[R1] [C2] column_name:c2;[R1] [C2] column_type:MYSQL_TYPE_OB_MAP;[R1] [C2] column_is_rowkey:false;[R1] [C2] column_is_signed:true;[R1] [C2] column_encoding:binary;[R1] [C2] column_is_not_null:false;[R1] [C2] column_value_old:[{"a":[["hello","world"],[NULL,"hi"]]}](37);[R1] [C3] column_name:c3;[R1] [C3] column_type:MYSQL_TYPE_OB_MAP;[R1] [C3] column_is_rowkey:false;[R1] [C3] column_is_signed:true;[R1] [C3] column_encoding:binary;[R1] [C3] column_is_not_null:false;[R1] [C3] column_value_old:[{1.23:[[1.11,7.87,44],[66,123.67,2.22],[3.33,3.1415,289.33]]}](61);[R1] [C4] column_name:c4;[R1] [C4] column_type:MYSQL_TYPE_OB_MAP;[R1] [C4] column_is_rowkey:false;[R1] [C4] column_is_signed:true;[R1] [C4] column_encoding:binary;[R1] [C4] column_is_not_null:false;[R1] [C4] column_value_old:[{NULL:[[[100,3.1415926,4.56,7.88],[5.55,7.87,44]],NULL],100:[[[2.345,3.456]]]}](78);$[R2] record_type:INSERT;[R2] database_name:oblog_tt.oblog_db1;[R2] table_name:map_t1;[R2] log_event:true;[R2] column_count:4;[R2] source_category:SRC_FULL_RECORDED;[R2] source_type:SRC_OCEANBASE_1_0;[R2] has_pk:true;[R2] pk_info:(0);[R2] pks:c1;[R2] has_uk:false;[R2] uk_info:(null);[R2] uks:(null);[R2] [C1] column_name:c1;[R2] [C1] column_type:MYSQL_TYPE_LONG;[R2] [C1] column_is_rowkey:true;[R2] [C1] column_is_signed:true;[R2] [C1] column_encoding:binary;[R2] [C1] column_is_not_null:true;[R2] [C1] column_value_new:[12](2);[R2] [C2] column_name:c2;[R2] [C2] column_type:MYSQL_TYPE_OB_MAP;[R2] [C2] column_is_rowkey:false;[R2] [C2] column_is_signed:true;[R2] [C2] column_encoding:binary;[R2] [C2] column_is_not_null:false;[R2] [C2] column_value_new:[{"a":[["hello","world"],[NULL,"hi"]]}](37);[R2] [C3] column_name:c3;[R2] [C3] column_type:MYSQL_TYPE_OB_MAP;[R2] [C3] column_is_rowkey:false;[R2] [C3] column_is_signed:true;[R2] [C3] column_encoding:binary;[R2] [C3] column_is_not_null:false;[R2] [C3] column_value_new:[{1.23:[[1.11,7.87,44],[66,123.67,2.22],[3.33,3.1415,289.33]]}](61);[R2] [C4] column_name:c4;[R2] [C4] column_type:MYSQL_TYPE_OB_MAP;[R2] [C4] column_is_rowkey:false;[R2] [C4] column_is_signed:true;[R2] [C4] column_encoding:binary;[R2] [C4] column_is_not_null:false;[R2] [C4] column_value_new:[{NULL:[[[100,3.1415926,4.56,7.88],[5.55,7.87,44]],NULL],100:[[[2.345,3.456]]]}](78);$[R3] COMMIT;
delete from map_t1 where c1 = 1;
ob1.oblog.next;
[R0] BEGIN;[R0] org_cluster_id:1;[R1] record_type:DELETE;[R1] database_name:oblog_tt.oblog_db1;[R1] table_name:map_t1;[R1] log_event:true;[R1] column_count:4;[R1] source_category:SRC_FULL_RECORDED;[R1] source_type:SRC_OCEANBASE_1_0;[R1] has_pk:true;[R1] pk_info:(0);[R1] pks:c1;[R1] has_uk:false;[R1] uk_info:(null);[R1] uks:(null);[R1] [C1] column_name:c1;[R1] [C1] column_type:MYSQL_TYPE_LONG;[R1] [C1] column_is_rowkey:true;[R1] [C1] column_is_signed:true;[R1] [C1] column_encoding:binary;[R1] [C1] column_is_not_null:true;[R1] [C1] column_value_old:[1](1);[R1] [C2] column_name:c2;[R1] [C2] column_type:MYSQL_TYPE_OB_MAP;[R1] [C2] column_is_rowkey:false;[R1] [C2] column_is_signed:true;[R1] [C2] column_encoding:binary;[R1] [C2] column_is_not_null:false;[R1] [C2] column_value_old:[{"a":[["hello","world"],[NULL,"hi"]]}](37);[R1] [C3] column_name:c3;[R1] [C3] column_type:MYSQL_TYPE_OB_MAP;[R1] [C3] column_is_rowkey:false;[R1] [C3] column_is_signed:true;[R1] [C3] column_encoding:binary;[R1] [C3] column_is_not_null:false;[R1] [C3] column_value_old:[{1.23:[[5.55,7.87,44],[66,123.67,NULL],[NULL,3.1415,289.33]]}](61);[R1] [C4] column_name:c4;[R1] [C4] column_type:MYSQL_TYPE_OB_MAP;[R1] [C4] column_is_rowkey:false;[R1] [C4] column_is_signed:true;[R1] [C4] column_encoding:binary;[R1] [C4] column_is_not_null:false;[R1] [C4] column_value_old:[{10:[[[100,3.1415926,4.56,7.88],[5.55,7.87,44]],[[NULL,3.1415,289.33],[2.111144455,3.444555666,NULL]]]}](103);$[R2] COMMIT;
drop table map_t1;
ob1.oblog.next;
[R0] record_type:EDDL;[R0] db_name:oblog_tt.oblog_db1;[R0] table_name:;[R0] column_count:1;[R0] column_name:ddl;[R0] ddl_stmt_str: DROP TABLE `oblog_db1`.`map_t1`;[R0] ddl_stmt_len: 31;
ob1.oblog.stop;
'[SECTION_END] [basic_test]'
'[SECTION_BEGIN] [outrow_test]'
ob1.oblog.set_start_tstamp_usec $start_tstamp_usec;
ob1.oblog.gen_conf tb_white_list=oblog_tt.*.* log_level=DEBUG meta_data_refresh_mode=data_dict;
ob1.oblog.set_extra_argument -m;
ob1.oblog.restart;
ob1.oblog.next;
[R0] record_type:EDDL;[R0] db_name:oblog_tt.oblog_db1;[R0] table_name:;[R0] column_count:1;[R0] column_name:ddl;[R0] ddl_stmt_str: create table map_t1(c1 int primary key, c2 map(varchar(16),array(array(varchar(16)))), c3 map(float,array(array(float))), c4 map(double,array(array(array(double)))));[R0] ddl_stmt_len: 165;
ob1.oblog.next;
[R0] BEGIN;[R0] org_cluster_id:1;[R1] record_type:INSERT;[R1] database_name:oblog_tt.oblog_db1;[R1] table_name:map_t1;[R1] log_event:true;[R1] column_count:4;[R1] source_category:SRC_FULL_RECORDED;[R1] source_type:SRC_OCEANBASE_1_0;[R1] has_pk:true;[R1] pk_info:(0);[R1] pks:c1;[R1] has_uk:false;[R1] uk_info:(null);[R1] uks:(null);[R1] [C1] column_name:c1;[R1] [C1] column_type:MYSQL_TYPE_LONG;[R1] [C1] column_is_rowkey:true;[R1] [C1] column_is_signed:true;[R1] [C1] column_encoding:binary;[R1] [C1] column_is_not_null:true;[R1] [C1] column_value_new:[0](1);[R1] [C2] column_name:c2;[R1] [C2] column_type:MYSQL_TYPE_OB_MAP;[R1] [C2] column_is_rowkey:false;[R1] [C2] column_is_signed:true;[R1] [C2] column_encoding:binary;[R1] [C2] column_is_not_null:false;[R1] [C2] column_value_new_md5:[NULL](0);[R1] [C3] column_name:c3;[R1] [C3] column_type:MYSQL_TYPE_OB_MAP;[R1] [C3] column_is_rowkey:false;[R1] [C3] column_is_signed:true;[R1] [C3] column_encoding:binary;[R1] [C3] column_is_not_null:false;[R1] [C3] column_value_new_md5:[NULL](0);[R1] [C4] column_name:c4;[R1] [C4] column_type:MYSQL_TYPE_OB_MAP;[R1] [C4] column_is_rowkey:false;[R1] [C4] column_is_signed:true;[R1] [C4] column_encoding:binary;[R1] [C4] column_is_not_null:false;[R1] [C4] column_value_new_md5:[NULL](0);$[R2] COMMIT;
ob1.oblog.next;
[R0] BEGIN;[R0] org_cluster_id:1;[R1] record_type:INSERT;[R1] database_name:oblog_tt.oblog_db1;[R1] table_name:map_t1;[R1] log_event:true;[R1] column_count:4;[R1] source_category:SRC_FULL_RECORDED;[R1] source_type:SRC_OCEANBASE_1_0;[R1] has_pk:true;[R1] pk_info:(0);[R1] pks:c1;[R1] has_uk:false;[R1] uk_info:(null);[R1] uks:(null);[R1] [C1] column_name:c1;[R1] [C1] column_type:MYSQL_TYPE_LONG;[R1] [C1] column_is_rowkey:true;[R1] [C1] column_is_signed:true;[R1] [C1] column_encoding:binary;[R1] [C1] column_is_not_null:true;[R1] [C1] column_value_new:[1](1);[R1] [C2] column_name:c2;[R1] [C2] column_type:MYSQL_TYPE_OB_MAP;[R1] [C2] column_is_rowkey:false;[R1] [C2] column_is_signed:true;[R1] [C2] column_encoding:binary;[R1] [C2] column_is_not_null:false;[R1] [C2] column_value_new_md5:[9f735020e2c9976df5aa650a59acd2b0](37);[R1] [C3] column_name:c3;[R1] [C3] column_type:MYSQL_TYPE_OB_MAP;[R1] [C3] column_is_rowkey:false;[R1] [C3] column_is_signed:true;[R1] [C3] column_encoding:binary;[R1] [C3] column_is_not_null:false;[R1] [C3] column_value_new_md5:[eab45c110a9ab3c21deb797268f0ecf5](61);[R1] [C4] column_name:c4;[R1] [C4] column_type:MYSQL_TYPE_OB_MAP;[R1] [C4] column_is_rowkey:false;[R1] [C4] column_is_signed:true;[R1] [C4] column_encoding:binary;[R1] [C4] column_is_not_null:false;[R1] [C4] column_value_new_md5:[b83c4d081426798ddd0dbcbdc8f887d1](103);$[R2] COMMIT;
ob1.oblog.next;
[R0] BEGIN;[R0] org_cluster_id:1;[R1] record_type:INSERT;[R1] database_name:oblog_tt.oblog_db1;[R1] table_name:map_t1;[R1] log_event:true;[R1] column_count:4;[R1] source_category:SRC_FULL_RECORDED;[R1] source_type:SRC_OCEANBASE_1_0;[R1] has_pk:true;[R1] pk_info:(0);[R1] pks:c1;[R1] has_uk:false;[R1] uk_info:(null);[R1] uks:(null);[R1] [C1] column_name:c1;[R1] [C1] column_type:MYSQL_TYPE_LONG;[R1] [C1] column_is_rowkey:true;[R1] [C1] column_is_signed:true;[R1] [C1] column_encoding:binary;[R1] [C1] column_is_not_null:true;[R1] [C1] column_value_new:[2](1);[R1] [C2] column_name:c2;[R1] [C2] column_type:MYSQL_TYPE_OB_MAP;[R1] [C2] column_is_rowkey:false;[R1] [C2] column_is_signed:true;[R1] [C2] column_encoding:binary;[R1] [C2] column_is_not_null:false;[R1] [C2] column_value_new_md5:[a7639a36875c79ab586c189ab81c3670](49);[R1] [C3] column_name:c3;[R1] [C3] column_type:MYSQL_TYPE_OB_MAP;[R1] [C3] column_is_rowkey:false;[R1] [C3] column_is_signed:true;[R1] [C3] column_encoding:binary;[R1] [C3] column_is_not_null:false;[R1] [C3] column_value_new_md5:[0868431de2abdf4dd049370dc27dc646](70);[R1] [C4] column_name:c4;[R1] [C4] column_type:MYSQL_TYPE_OB_MAP;[R1] [C4] column_is_rowkey:false;[R1] [C4] column_is_signed:true;[R1] [C4] column_encoding:binary;[R1] [C4] column_is_not_null:false;[R1] [C4] column_value_new_md5:[1b032937184cb87a0dcf29bfe671cf72](78);$[R2] COMMIT;
ob1.oblog.next;
[R0] BEGIN;[R0] org_cluster_id:1;[R1] record_type:INSERT;[R1] database_name:oblog_tt.oblog_db1;[R1] table_name:map_t1;[R1] log_event:true;[R1] column_count:4;[R1] source_category:SRC_FULL_RECORDED;[R1] source_type:SRC_OCEANBASE_1_0;[R1] has_pk:true;[R1] pk_info:(0);[R1] pks:c1;[R1] has_uk:false;[R1] uk_info:(null);[R1] uks:(null);[R1] [C1] column_name:c1;[R1] [C1] column_type:MYSQL_TYPE_LONG;[R1] [C1] column_is_rowkey:true;[R1] [C1] column_is_signed:true;[R1] [C1] column_encoding:binary;[R1] [C1] column_is_not_null:true;[R1] [C1] column_value_new:[3](1);[R1] [C2] column_name:c2;[R1] [C2] column_type:MYSQL_TYPE_OB_MAP;[R1] [C2] column_is_rowkey:false;[R1] [C2] column_is_signed:true;[R1] [C2] column_encoding:binary;[R1] [C2] column_is_not_null:false;[R1] [C2] column_value_new_md5:[483f519e979cedeaf4858408b485cfc6](25);[R1] [C3] column_name:c3;[R1] [C3] column_type:MYSQL_TYPE_OB_MAP;[R1] [C3] column_is_rowkey:false;[R1] [C3] column_is_signed:true;[R1] [C3] column_encoding:binary;[R1] [C3] column_is_not_null:false;[R1] [C3] column_value_new_md5:[b8192685e246356bb385acfa090d4c60](35);[R1] [C4] column_name:c4;[R1] [C4] column_type:MYSQL_TYPE_OB_MAP;[R1] [C4] column_is_rowkey:false;[R1] [C4] column_is_signed:true;[R1] [C4] column_encoding:binary;[R1] [C4] column_is_not_null:false;[R1] [C4] column_value_new_md5:[3a03fa97bde6c687143103a452f56583](17);$[R2] COMMIT;
ob1.oblog.next;
[R0] BEGIN;[R0] org_cluster_id:1;[R1] record_type:INSERT;[R1] database_name:oblog_tt.oblog_db1;[R1] table_name:map_t1;[R1] log_event:true;[R1] column_count:4;[R1] source_category:SRC_FULL_RECORDED;[R1] source_type:SRC_OCEANBASE_1_0;[R1] has_pk:true;[R1] pk_info:(0);[R1] pks:c1;[R1] has_uk:false;[R1] uk_info:(null);[R1] uks:(null);[R1] [C1] column_name:c1;[R1] [C1] column_type:MYSQL_TYPE_LONG;[R1] [C1] column_is_rowkey:true;[R1] [C1] column_is_signed:true;[R1] [C1] column_encoding:binary;[R1] [C1] column_is_not_null:true;[R1] [C1] column_value_new:[4](1);[R1] [C2] column_name:c2;[R1] [C2] column_type:MYSQL_TYPE_OB_MAP;[R1] [C2] column_is_rowkey:false;[R1] [C2] column_is_signed:true;[R1] [C2] column_encoding:binary;[R1] [C2] column_is_not_null:false;[R1] [C2] column_value_new_md5:[849ff438b339a227cd5539eda83bac51](38);[R1] [C3] column_name:c3;[R1] [C3] column_type:MYSQL_TYPE_OB_MAP;[R1] [C3] column_is_rowkey:false;[R1] [C3] column_is_signed:true;[R1] [C3] column_encoding:binary;[R1] [C3] column_is_not_null:false;[R1] [C3] column_value_new_md5:[8c0c23ffa2316d8ff8c9a559d3eca7d2](48);[R1] [C4] column_name:c4;[R1] [C4] column_type:MYSQL_TYPE_OB_MAP;[R1] [C4] column_is_rowkey:false;[R1] [C4] column_is_signed:true;[R1] [C4] column_encoding:binary;[R1] [C4] column_is_not_null:false;[R1] [C4] column_value_new_md5:[90b64f24a67e9474acf078e60ce0034a](79);$[R2] COMMIT;
ob1.oblog.next;
[R0] BEGIN;[R0] org_cluster_id:1;[R1] record_type:INSERT;[R1] database_name:oblog_tt.oblog_db1;[R1] table_name:map_t1;[R1] log_event:true;[R1] column_count:4;[R1] source_category:SRC_FULL_RECORDED;[R1] source_type:SRC_OCEANBASE_1_0;[R1] has_pk:true;[R1] pk_info:(0);[R1] pks:c1;[R1] has_uk:false;[R1] uk_info:(null);[R1] uks:(null);[R1] [C1] column_name:c1;[R1] [C1] column_type:MYSQL_TYPE_LONG;[R1] [C1] column_is_rowkey:true;[R1] [C1] column_is_signed:true;[R1] [C1] column_encoding:binary;[R1] [C1] column_is_not_null:true;[R1] [C1] column_value_new:[5](1);[R1] [C2] column_name:c2;[R1] [C2] column_type:MYSQL_TYPE_OB_MAP;[R1] [C2] column_is_rowkey:false;[R1] [C2] column_is_signed:true;[R1] [C2] column_encoding:binary;[R1] [C2] column_is_not_null:false;[R1] [C2] column_value_new_md5:[99914b932bd37a50b983c5e7c90ae93b](2);[R1] [C3] column_name:c3;[R1] [C3] column_type:MYSQL_TYPE_OB_MAP;[R1] [C3] column_is_rowkey:false;[R1] [C3] column_is_signed:true;[R1] [C3] column_encoding:binary;[R1] [C3] column_is_not_null:false;[R1] [C3] column_value_new_md5:[99914b932bd37a50b983c5e7c90ae93b](2);[R1] [C4] column_name:c4;[R1] [C4] column_type:MYSQL_TYPE_OB_MAP;[R1] [C4] column_is_rowkey:false;[R1] [C4] column_is_signed:true;[R1] [C4] column_encoding:binary;[R1] [C4] column_is_not_null:false;[R1] [C4] column_value_new_md5:[99914b932bd37a50b983c5e7c90ae93b](2);$[R2] COMMIT;
ob1.oblog.next;
[R0] BEGIN;[R0] org_cluster_id:1;[R1] record_type:INSERT;[R1] database_name:oblog_tt.oblog_db1;[R1] table_name:map_t1;[R1] log_event:true;[R1] column_count:4;[R1] source_category:SRC_FULL_RECORDED;[R1] source_type:SRC_OCEANBASE_1_0;[R1] has_pk:true;[R1] pk_info:(0);[R1] pks:c1;[R1] has_uk:false;[R1] uk_info:(null);[R1] uks:(null);[R1] [C1] column_name:c1;[R1] [C1] column_type:MYSQL_TYPE_LONG;[R1] [C1] column_is_rowkey:true;[R1] [C1] column_is_signed:true;[R1] [C1] column_encoding:binary;[R1] [C1] column_is_not_null:true;[R1] [C1] column_value_new:[6](1);[R1] [C2] column_name:c2;[R1] [C2] column_type:MYSQL_TYPE_OB_MAP;[R1] [C2] column_is_rowkey:false;[R1] [C2] column_is_signed:true;[R1] [C2] column_encoding:binary;[R1] [C2] column_is_not_null:false;[R1] [C2] column_value_new_md5:[4aae9867bbd4e11ea4e7e5965502fd78](10);[R1] [C3] column_name:c3;[R1] [C3] column_type:MYSQL_TYPE_OB_MAP;[R1] [C3] column_is_rowkey:false;[R1] [C3] column_is_signed:true;[R1] [C3] column_encoding:binary;[R1] [C3] column_is_not_null:false;[R1] [C3] column_value_new_md5:[42d6703beae6592d04b7bc4c532b69d9](11);[R1] [C4] column_name:c4;[R1] [C4] column_type:MYSQL_TYPE_OB_MAP;[R1] [C4] column_is_rowkey:false;[R1] [C4] column_is_signed:true;[R1] [C4] column_encoding:binary;[R1] [C4] column_is_not_null:false;[R1] [C4] column_value_new_md5:[bf2f90efd934af14fd1011615dc6f3b7](13);$[R2] COMMIT;
ob1.oblog.next;
[R0] BEGIN;[R0] org_cluster_id:1;[R1] record_type:UPDATE;[R1] database_name:oblog_tt.oblog_db1;[R1] table_name:map_t1;[R1] log_event:true;[R1] column_count:4;[R1] source_category:SRC_FULL_RECORDED;[R1] source_type:SRC_OCEANBASE_1_0;[R1] has_pk:true;[R1] pk_info:(0);[R1] pks:c1;[R1] has_uk:false;[R1] uk_info:(null);[R1] uks:(null);[R1] [C1] column_name:c1;[R1] [C1] column_type:MYSQL_TYPE_LONG;[R1] [C1] column_is_rowkey:true;[R1] [C1] column_is_signed:true;[R1] [C1] column_encoding:binary;[R1] [C1] column_is_not_null:true;[R1] [C1] column_value_new:[0](1);[R1] [C1] column_value_old:[0](1);[R1] [C2] column_name:c2;[R1] [C2] column_type:MYSQL_TYPE_OB_MAP;[R1] [C2] column_is_rowkey:false;[R1] [C2] column_is_signed:true;[R1] [C2] column_encoding:binary;[R1] [C2] column_is_not_null:false;[R1] [C2] column_value_new_md5:[9f735020e2c9976df5aa650a59acd2b0](37);[R1] [C2] column_value_old_md5:[NULL](0);[R1] [C3] column_name:c3;[R1] [C3] column_type:MYSQL_TYPE_OB_MAP;[R1] [C3] column_is_rowkey:false;[R1] [C3] column_is_signed:true;[R1] [C3] column_encoding:binary;[R1] [C3] column_is_not_null:false;[R1] [C3] column_value_new_md5:[NULL](0);[R1] [C3] column_value_old_md5:[NULL](0);[R1] [C4] column_name:c4;[R1] [C4] column_type:MYSQL_TYPE_OB_MAP;[R1] [C4] column_is_rowkey:false;[R1] [C4] column_is_signed:true;[R1] [C4] column_encoding:binary;[R1] [C4] column_is_not_null:false;[R1] [C4] column_value_new_md5:[NULL](0);[R1] [C4] column_value_old_md5:[NULL](0);$[R2] COMMIT;
ob1.oblog.next;
[R0] BEGIN;[R0] org_cluster_id:1;[R1] record_type:UPDATE;[R1] database_name:oblog_tt.oblog_db1;[R1] table_name:map_t1;[R1] log_event:true;[R1] column_count:4;[R1] source_category:SRC_FULL_RECORDED;[R1] source_type:SRC_OCEANBASE_1_0;[R1] has_pk:true;[R1] pk_info:(0);[R1] pks:c1;[R1] has_uk:false;[R1] uk_info:(null);[R1] uks:(null);[R1] [C1] column_name:c1;[R1] [C1] column_type:MYSQL_TYPE_LONG;[R1] [C1] column_is_rowkey:true;[R1] [C1] column_is_signed:true;[R1] [C1] column_encoding:binary;[R1] [C1] column_is_not_null:true;[R1] [C1] column_value_new:[2](1);[R1] [C1] column_value_old:[2](1);[R1] [C2] column_name:c2;[R1] [C2] column_type:MYSQL_TYPE_OB_MAP;[R1] [C2] column_is_rowkey:false;[R1] [C2] column_is_signed:true;[R1] [C2] column_encoding:binary;[R1] [C2] column_is_not_null:false;[R1] [C2] column_value_new_md5:[9f735020e2c9976df5aa650a59acd2b0](37);[R1] [C2] column_value_old_md5:[a7639a36875c79ab586c189ab81c3670](49);[R1] [C3] column_name:c3;[R1] [C3] column_type:MYSQL_TYPE_OB_MAP;[R1] [C3] column_is_rowkey:false;[R1] [C3] column_is_signed:true;[R1] [C3] column_encoding:binary;[R1] [C3] column_is_not_null:false;[R1] [C3] column_value_new_md5:[0868431de2abdf4dd049370dc27dc646](70);[R1] [C3] column_value_old_md5:[0868431de2abdf4dd049370dc27dc646](70);[R1] [C4] column_name:c4;[R1] [C4] column_type:MYSQL_TYPE_OB_MAP;[R1] [C4] column_is_rowkey:false;[R1] [C4] column_is_signed:true;[R1] [C4] column_encoding:binary;[R1] [C4] column_is_not_null:false;[R1] [C4] column_value_new_md5:[1b032937184cb87a0dcf29bfe671cf72](78);[R1] [C4] column_value_old_md5:[1b032937184cb87a0dcf29bfe671cf72](78);$[R2] COMMIT;
ob1.oblog.next;
[R0] BEGIN;[R0] org_cluster_id:1;[R1] record_type:UPDATE;[R1] database_name:oblog_tt.oblog_db1;[R1] table_name:map_t1;[R1] log_event:true;[R1] column_count:4;[R1] source_category:SRC_FULL_RECORDED;[R1] source_type:SRC_OCEANBASE_1_0;[R1] has_pk:true;[R1] pk_info:(0);[R1] pks:c1;[R1] has_uk:false;[R1] uk_info:(null);[R1] uks:(null);[R1] [C1] column_name:c1;[R1] [C1] column_type:MYSQL_TYPE_LONG;[R1] [C1] column_is_rowkey:true;[R1] [C1] column_is_signed:true;[R1] [C1] column_encoding:binary;[R1] [C1] column_is_not_null:true;[R1] [C1] column_value_new:[2](1);[R1] [C1] column_value_old:[2](1);[R1] [C2] column_name:c2;[R1] [C2] column_type:MYSQL_TYPE_OB_MAP;[R1] [C2] column_is_rowkey:false;[R1] [C2] column_is_signed:true;[R1] [C2] column_encoding:binary;[R1] [C2] column_is_not_null:false;[R1] [C2] column_value_new_md5:[9f735020e2c9976df5aa650a59acd2b0](37);[R1] [C2] column_value_old_md5:[9f735020e2c9976df5aa650a59acd2b0](37);[R1] [C3] column_name:c3;[R1] [C3] column_type:MYSQL_TYPE_OB_MAP;[R1] [C3] column_is_rowkey:false;[R1] [C3] column_is_signed:true;[R1] [C3] column_encoding:binary;[R1] [C3] column_is_not_null:false;[R1] [C3] column_value_new_md5:[576a6688e899f51fbdd07cc3fb3cd6cd](61);[R1] [C3] column_value_old_md5:[0868431de2abdf4dd049370dc27dc646](70);[R1] [C4] column_name:c4;[R1] [C4] column_type:MYSQL_TYPE_OB_MAP;[R1] [C4] column_is_rowkey:false;[R1] [C4] column_is_signed:true;[R1] [C4] column_encoding:binary;[R1] [C4] column_is_not_null:false;[R1] [C4] column_value_new_md5:[1b032937184cb87a0dcf29bfe671cf72](78);[R1] [C4] column_value_old_md5:[1b032937184cb87a0dcf29bfe671cf72](78);$[R2] COMMIT;
ob1.oblog.next;
[R0] BEGIN;[R0] org_cluster_id:1;[R1] record_type:UPDATE;[R1] database_name:oblog_tt.oblog_db1;[R1] table_name:map_t1;[R1] log_event:true;[R1] column_count:4;[R1] source_category:SRC_FULL_RECORDED;[R1] source_type:SRC_OCEANBASE_1_0;[R1] has_pk:true;[R1] pk_info:(0);[R1] pks:c1;[R1] has_uk:false;[R1] uk_info:(null);[R1] uks:(null);[R1] [C1] column_name:c1;[R1] [C1] column_type:MYSQL_TYPE_LONG;[R1] [C1] column_is_rowkey:true;[R1] [C1] column_is_signed:true;[R1] [C1] column_encoding:binary;[R1] [C1] column_is_not_null:true;[R1] [C1] column_value_new:[3](1);[R1] [C1] column_value_old:[3](1);[R1] [C2] column_name:c2;[R1] [C2] column_type:MYSQL_TYPE_OB_MAP;[R1] [C2] column_is_rowkey:false;[R1] [C2] column_is_signed:true;[R1] [C2] column_encoding:binary;[R1] [C2] column_is_not_null:false;[R1] [C2] column_value_new_md5:[483f519e979cedeaf4858408b485cfc6](25);[R1] [C2] column_value_old_md5:[483f519e979cedeaf4858408b485cfc6](25);[R1] [C3] column_name:c3;[R1] [C3] column_type:MYSQL_TYPE_OB_MAP;[R1] [C3] column_is_rowkey:false;[R1] [C3] column_is_signed:true;[R1] [C3] column_encoding:binary;[R1] [C3] column_is_not_null:false;[R1] [C3] column_value_new_md5:[3cbd40286fd40377e08afece0564eb13](72);[R1] [C3] column_value_old_md5:[b8192685e246356bb385acfa090d4c60](35);[R1] [C4] column_name:c4;[R1] [C4] column_type:MYSQL_TYPE_OB_MAP;[R1] [C4] column_is_rowkey:false;[R1] [C4] column_is_signed:true;[R1] [C4] column_encoding:binary;[R1] [C4] column_is_not_null:false;[R1] [C4] column_value_new_md5:[3a03fa97bde6c687143103a452f56583](17);[R1] [C4] column_value_old_md5:[3a03fa97bde6c687143103a452f56583](17);$[R2] COMMIT;
ob1.oblog.next;
[R0] BEGIN;[R0] org_cluster_id:1;[R1] record_type:UPDATE;[R1] database_name:oblog_tt.oblog_db1;[R1] table_name:map_t1;[R1] log_event:true;[R1] column_count:4;[R1] source_category:SRC_FULL_RECORDED;[R1] source_type:SRC_OCEANBASE_1_0;[R1] has_pk:true;[R1] pk_info:(0);[R1] pks:c1;[R1] has_uk:false;[R1] uk_info:(null);[R1] uks:(null);[R1] [C1] column_name:c1;[R1] [C1] column_type:MYSQL_TYPE_LONG;[R1] [C1] column_is_rowkey:true;[R1] [C1] column_is_signed:true;[R1] [C1] column_encoding:binary;[R1] [C1] column_is_not_null:true;[R1] [C1] column_value_new:[4](1);[R1] [C1] column_value_old:[4](1);[R1] [C2] column_name:c2;[R1] [C2] column_type:MYSQL_TYPE_OB_MAP;[R1] [C2] column_is_rowkey:false;[R1] [C2] column_is_signed:true;[R1] [C2] column_encoding:binary;[R1] [C2] column_is_not_null:false;[R1] [C2] column_value_new_md5:[849ff438b339a227cd5539eda83bac51](38);[R1] [C2] column_value_old_md5:[849ff438b339a227cd5539eda83bac51](38);[R1] [C3] column_name:c3;[R1] [C3] column_type:MYSQL_TYPE_OB_MAP;[R1] [C3] column_is_rowkey:false;[R1] [C3] column_is_signed:true;[R1] [C3] column_encoding:binary;[R1] [C3] column_is_not_null:false;[R1] [C3] column_value_new_md5:[8c0c23ffa2316d8ff8c9a559d3eca7d2](48);[R1] [C3] column_value_old_md5:[8c0c23ffa2316d8ff8c9a559d3eca7d2](48);[R1] [C4] column_name:c4;[R1] [C4] column_type:MYSQL_TYPE_OB_MAP;[R1] [C4] column_is_rowkey:false;[R1] [C4] column_is_signed:true;[R1] [C4] column_encoding:binary;[R1] [C4] column_is_not_null:false;[R1] [C4] column_value_new_md5:[NULL](0);[R1] [C4] column_value_old_md5:[90b64f24a67e9474acf078e60ce0034a](79);$[R2] COMMIT;
ob1.oblog.next;
[R0] BEGIN;[R0] org_cluster_id:1;[R1] record_type:DELETE;[R1] database_name:oblog_tt.oblog_db1;[R1] table_name:map_t1;[R1] log_event:true;[R1] column_count:4;[R1] source_category:SRC_FULL_RECORDED;[R1] source_type:SRC_OCEANBASE_1_0;[R1] has_pk:true;[R1] pk_info:(0);[R1] pks:c1;[R1] has_uk:false;[R1] uk_info:(null);[R1] uks:(null);[R1] [C1] column_name:c1;[R1] [C1] column_type:MYSQL_TYPE_LONG;[R1] [C1] column_is_rowkey:true;[R1] [C1] column_is_signed:true;[R1] [C1] column_encoding:binary;[R1] [C1] column_is_not_null:true;[R1] [C1] column_value_old:[2](1);[R1] [C2] column_name:c2;[R1] [C2] column_type:MYSQL_TYPE_OB_MAP;[R1] [C2] column_is_rowkey:false;[R1] [C2] column_is_signed:true;[R1] [C2] column_encoding:binary;[R1] [C2] column_is_not_null:false;[R1] [C2] column_value_old_md5:[9f735020e2c9976df5aa650a59acd2b0](37);[R1] [C3] column_name:c3;[R1] [C3] column_type:MYSQL_TYPE_OB_MAP;[R1] [C3] column_is_rowkey:false;[R1] [C3] column_is_signed:true;[R1] [C3] column_encoding:binary;[R1] [C3] column_is_not_null:false;[R1] [C3] column_value_old_md5:[576a6688e899f51fbdd07cc3fb3cd6cd](61);[R1] [C4] column_name:c4;[R1] [C4] column_type:MYSQL_TYPE_OB_MAP;[R1] [C4] column_is_rowkey:false;[R1] [C4] column_is_signed:true;[R1] [C4] column_encoding:binary;[R1] [C4] column_is_not_null:false;[R1] [C4] column_value_old_md5:[1b032937184cb87a0dcf29bfe671cf72](78);$[R2] record_type:INSERT;[R2] database_name:oblog_tt.oblog_db1;[R2] table_name:map_t1;[R2] log_event:true;[R2] column_count:4;[R2] source_category:SRC_FULL_RECORDED;[R2] source_type:SRC_OCEANBASE_1_0;[R2] has_pk:true;[R2] pk_info:(0);[R2] pks:c1;[R2] has_uk:false;[R2] uk_info:(null);[R2] uks:(null);[R2] [C1] column_name:c1;[R2] [C1] column_type:MYSQL_TYPE_LONG;[R2] [C1] column_is_rowkey:true;[R2] [C1] column_is_signed:true;[R2] [C1] column_encoding:binary;[R2] [C1] column_is_not_null:true;[R2] [C1] column_value_new:[12](2);[R2] [C2] column_name:c2;[R2] [C2] column_type:MYSQL_TYPE_OB_MAP;[R2] [C2] column_is_rowkey:false;[R2] [C2] column_is_signed:true;[R2] [C2] column_encoding:binary;[R2] [C2] column_is_not_null:false;[R2] [C2] column_value_new_md5:[9f735020e2c9976df5aa650a59acd2b0](37);[R2] [C3] column_name:c3;[R2] [C3] column_type:MYSQL_TYPE_OB_MAP;[R2] [C3] column_is_rowkey:false;[R2] [C3] column_is_signed:true;[R2] [C3] column_encoding:binary;[R2] [C3] column_is_not_null:false;[R2] [C3] column_value_new_md5:[576a6688e899f51fbdd07cc3fb3cd6cd](61);[R2] [C4] column_name:c4;[R2] [C4] column_type:MYSQL_TYPE_OB_MAP;[R2] [C4] column_is_rowkey:false;[R2] [C4] column_is_signed:true;[R2] [C4] column_encoding:binary;[R2] [C4] column_is_not_null:false;[R2] [C4] column_value_new_md5:[1b032937184cb87a0dcf29bfe671cf72](78);$[R3] COMMIT;
ob1.oblog.next;
[R0] BEGIN;[R0] org_cluster_id:1;[R1] record_type:DELETE;[R1] database_name:oblog_tt.oblog_db1;[R1] table_name:map_t1;[R1] log_event:true;[R1] column_count:4;[R1] source_category:SRC_FULL_RECORDED;[R1] source_type:SRC_OCEANBASE_1_0;[R1] has_pk:true;[R1] pk_info:(0);[R1] pks:c1;[R1] has_uk:false;[R1] uk_info:(null);[R1] uks:(null);[R1] [C1] column_name:c1;[R1] [C1] column_type:MYSQL_TYPE_LONG;[R1] [C1] column_is_rowkey:true;[R1] [C1] column_is_signed:true;[R1] [C1] column_encoding:binary;[R1] [C1] column_is_not_null:true;[R1] [C1] column_value_old:[1](1);[R1] [C2] column_name:c2;[R1] [C2] column_type:MYSQL_TYPE_OB_MAP;[R1] [C2] column_is_rowkey:false;[R1] [C2] column_is_signed:true;[R1] [C2] column_encoding:binary;[R1] [C2] column_is_not_null:false;[R1] [C2] column_value_old_md5:[9f735020e2c9976df5aa650a59acd2b0](37);[R1] [C3] column_name:c3;[R1] [C3] column_type:MYSQL_TYPE_OB_MAP;[R1] [C3] column_is_rowkey:false;[R1] [C3] column_is_signed:true;[R1] [C3] column_encoding:binary;[R1] [C3] column_is_not_null:false;[R1] [C3] column_value_old_md5:[eab45c110a9ab3c21deb797268f0ecf5](61);[R1] [C4] column_name:c4;[R1] [C4] column_type:MYSQL_TYPE_OB_MAP;[R1] [C4] column_is_rowkey:false;[R1] [C4] column_is_signed:true;[R1] [C4] column_encoding:binary;[R1] [C4] column_is_not_null:false;[R1] [C4] column_value_old_md5:[b83c4d081426798ddd0dbcbdc8f887d1](103);$[R2] COMMIT;
ob1.oblog.next;
[R0] record_type:EDDL;[R0] db_name:oblog_tt.oblog_db1;[R0] table_name:;[R0] column_count:1;[R0] column_name:ddl;[R0] ddl_stmt_str: DROP TABLE `oblog_db1`.`map_t1`;[R0] ddl_stmt_len: 31;
SET @large_double_map1:=CONCAT('{1:[',REPEAT('123.321,', 100000),'123.321]}');
SET @large_double_map2:=CONCAT('{1:[',REPEAT('987.05,',100000),'987.05]}');
SET @large_double_map3:=CONCAT('{1:[',REPEAT('0.0001,',100000),'0.0005]}');
create table outrow_map_t1(c1 int primary key, c2 map(int,array(double)));
ob1.oblog.next;
[R0] record_type:EDDL;[R0] db_name:oblog_tt.oblog_db1;[R0] table_name:;[R0] column_count:1;[R0] column_name:ddl;[R0] ddl_stmt_str: create table outrow_map_t1(c1 int primary key, c2 map(int,array(double)));[R0] ddl_stmt_len: 73;
insert into outrow_map_t1 values(1, @large_double_map1);
ob1.oblog.next;
[R0] BEGIN;[R0] org_cluster_id:1;[R1] record_type:INSERT;[R1] database_name:oblog_tt.oblog_db1;[R1] table_name:outrow_map_t1;[R1] log_event:true;[R1] column_count:2;[R1] source_category:SRC_FULL_RECORDED;[R1] source_type:SRC_OCEANBASE_1_0;[R1] has_pk:true;[R1] pk_info:(0);[R1] pks:c1;[R1] has_uk:false;[R1] uk_info:(null);[R1] uks:(null);[R1] [C1] column_name:c1;[R1] [C1] column_type:MYSQL_TYPE_LONG;[R1] [C1] column_is_rowkey:true;[R1] [C1] column_is_signed:true;[R1] [C1] column_encoding:binary;[R1] [C1] column_is_not_null:true;[R1] [C1] column_value_new:[1](1);[R1] [C2] column_name:c2;[R1] [C2] column_type:MYSQL_TYPE_OB_MAP;[R1] [C2] column_is_rowkey:false;[R1] [C2] column_is_signed:true;[R1] [C2] column_encoding:binary;[R1] [C2] column_is_not_null:false;[R1] [C2] column_value_new_md5:[ca711dba2e07b7ec0119dbea47dd5334](800013);$[R2] COMMIT;
select md5(@large_double_map1);
md5(@large_double_map1)
ca711dba2e07b7ec0119dbea47dd5334
insert into outrow_map_t1 values(2, @large_double_map2);
ob1.oblog.next;
[R0] BEGIN;[R0] org_cluster_id:1;[R1] record_type:INSERT;[R1] database_name:oblog_tt.oblog_db1;[R1] table_name:outrow_map_t1;[R1] log_event:true;[R1] column_count:2;[R1] source_category:SRC_FULL_RECORDED;[R1] source_type:SRC_OCEANBASE_1_0;[R1] has_pk:true;[R1] pk_info:(0);[R1] pks:c1;[R1] has_uk:false;[R1] uk_info:(null);[R1] uks:(null);[R1] [C1] column_name:c1;[R1] [C1] column_type:MYSQL_TYPE_LONG;[R1] [C1] column_is_rowkey:true;[R1] [C1] column_is_signed:true;[R1] [C1] column_encoding:binary;[R1] [C1] column_is_not_null:true;[R1] [C1] column_value_new:[2](1);[R1] [C2] column_name:c2;[R1] [C2] column_type:MYSQL_TYPE_OB_MAP;[R1] [C2] column_is_rowkey:false;[R1] [C2] column_is_signed:true;[R1] [C2] column_encoding:binary;[R1] [C2] column_is_not_null:false;[R1] [C2] column_value_new_md5:[e046b687ae1905db281d7dc39e9a9169](700012);$[R2] COMMIT;
select md5(@large_double_map2);
md5(@large_double_map2)
e046b687ae1905db281d7dc39e9a9169
update outrow_map_t1 set c2=@large_double_map3 where c1=1;
ob1.oblog.next;
[R0] BEGIN;[R0] org_cluster_id:1;[R1] record_type:UPDATE;[R1] database_name:oblog_tt.oblog_db1;[R1] table_name:outrow_map_t1;[R1] log_event:true;[R1] column_count:2;[R1] source_category:SRC_FULL_RECORDED;[R1] source_type:SRC_OCEANBASE_1_0;[R1] has_pk:true;[R1] pk_info:(0);[R1] pks:c1;[R1] has_uk:false;[R1] uk_info:(null);[R1] uks:(null);[R1] [C1] column_name:c1;[R1] [C1] column_type:MYSQL_TYPE_LONG;[R1] [C1] column_is_rowkey:true;[R1] [C1] column_is_signed:true;[R1] [C1] column_encoding:binary;[R1] [C1] column_is_not_null:true;[R1] [C1] column_value_new:[1](1);[R1] [C1] column_value_old:[1](1);[R1] [C2] column_name:c2;[R1] [C2] column_type:MYSQL_TYPE_OB_MAP;[R1] [C2] column_is_rowkey:false;[R1] [C2] column_is_signed:true;[R1] [C2] column_encoding:binary;[R1] [C2] column_is_not_null:false;[R1] [C2] column_value_new_md5:[6845c2ac91d8d93bac9c9049b2f79896](700012);[R1] [C2] column_value_old_md5:[ca711dba2e07b7ec0119dbea47dd5334](800013);$[R2] COMMIT;
select md5(@large_double_map3);
md5(@large_double_map3)
6845c2ac91d8d93bac9c9049b2f79896
update outrow_map_t1 set c2=map(2,[1,2,3]) where c1=1;
ob1.oblog.next;
[R0] BEGIN;[R0] org_cluster_id:1;[R1] record_type:UPDATE;[R1] database_name:oblog_tt.oblog_db1;[R1] table_name:outrow_map_t1;[R1] log_event:true;[R1] column_count:2;[R1] source_category:SRC_FULL_RECORDED;[R1] source_type:SRC_OCEANBASE_1_0;[R1] has_pk:true;[R1] pk_info:(0);[R1] pks:c1;[R1] has_uk:false;[R1] uk_info:(null);[R1] uks:(null);[R1] [C1] column_name:c1;[R1] [C1] column_type:MYSQL_TYPE_LONG;[R1] [C1] column_is_rowkey:true;[R1] [C1] column_is_signed:true;[R1] [C1] column_encoding:binary;[R1] [C1] column_is_not_null:true;[R1] [C1] column_value_new:[1](1);[R1] [C1] column_value_old:[1](1);[R1] [C2] column_name:c2;[R1] [C2] column_type:MYSQL_TYPE_OB_MAP;[R1] [C2] column_is_rowkey:false;[R1] [C2] column_is_signed:true;[R1] [C2] column_encoding:binary;[R1] [C2] column_is_not_null:false;[R1] [C2] column_value_new_md5:[cc1c66c17b8fd15806a1bfaf31479cff](11);[R1] [C2] column_value_old_origin: PADDING;[R1] [C2] column_value_old_md5:[NULL](0);$[R2] COMMIT;
update outrow_map_t1 set c2=null where c1=2;
ob1.oblog.next;
[R0] BEGIN;[R0] org_cluster_id:1;[R1] record_type:UPDATE;[R1] database_name:oblog_tt.oblog_db1;[R1] table_name:outrow_map_t1;[R1] log_event:true;[R1] column_count:2;[R1] source_category:SRC_FULL_RECORDED;[R1] source_type:SRC_OCEANBASE_1_0;[R1] has_pk:true;[R1] pk_info:(0);[R1] pks:c1;[R1] has_uk:false;[R1] uk_info:(null);[R1] uks:(null);[R1] [C1] column_name:c1;[R1] [C1] column_type:MYSQL_TYPE_LONG;[R1] [C1] column_is_rowkey:true;[R1] [C1] column_is_signed:true;[R1] [C1] column_encoding:binary;[R1] [C1] column_is_not_null:true;[R1] [C1] column_value_new:[2](1);[R1] [C1] column_value_old:[2](1);[R1] [C2] column_name:c2;[R1] [C2] column_type:MYSQL_TYPE_OB_MAP;[R1] [C2] column_is_rowkey:false;[R1] [C2] column_is_signed:true;[R1] [C2] column_encoding:binary;[R1] [C2] column_is_not_null:false;[R1] [C2] column_value_new_md5:[NULL](0);[R1] [C2] column_value_old_origin: PADDING;[R1] [C2] column_value_old_md5:[NULL](0);$[R2] COMMIT;
update outrow_map_t1 set c2=@large_double_map3 where c1=2;
ob1.oblog.next;
[R0] BEGIN;[R0] org_cluster_id:1;[R1] record_type:UPDATE;[R1] database_name:oblog_tt.oblog_db1;[R1] table_name:outrow_map_t1;[R1] log_event:true;[R1] column_count:2;[R1] source_category:SRC_FULL_RECORDED;[R1] source_type:SRC_OCEANBASE_1_0;[R1] has_pk:true;[R1] pk_info:(0);[R1] pks:c1;[R1] has_uk:false;[R1] uk_info:(null);[R1] uks:(null);[R1] [C1] column_name:c1;[R1] [C1] column_type:MYSQL_TYPE_LONG;[R1] [C1] column_is_rowkey:true;[R1] [C1] column_is_signed:true;[R1] [C1] column_encoding:binary;[R1] [C1] column_is_not_null:true;[R1] [C1] column_value_new:[2](1);[R1] [C1] column_value_old:[2](1);[R1] [C2] column_name:c2;[R1] [C2] column_type:MYSQL_TYPE_OB_MAP;[R1] [C2] column_is_rowkey:false;[R1] [C2] column_is_signed:true;[R1] [C2] column_encoding:binary;[R1] [C2] column_is_not_null:false;[R1] [C2] column_value_new_md5:[6845c2ac91d8d93bac9c9049b2f79896](700012);[R1] [C2] column_value_old_md5:[NULL](0);$[R2] COMMIT;
select md5(@large_double_map3);
md5(@large_double_map3)
6845c2ac91d8d93bac9c9049b2f79896
update outrow_map_t1 set c2=null where c1=1;
ob1.oblog.next;
[R0] BEGIN;[R0] org_cluster_id:1;[R1] record_type:UPDATE;[R1] database_name:oblog_tt.oblog_db1;[R1] table_name:outrow_map_t1;[R1] log_event:true;[R1] column_count:2;[R1] source_category:SRC_FULL_RECORDED;[R1] source_type:SRC_OCEANBASE_1_0;[R1] has_pk:true;[R1] pk_info:(0);[R1] pks:c1;[R1] has_uk:false;[R1] uk_info:(null);[R1] uks:(null);[R1] [C1] column_name:c1;[R1] [C1] column_type:MYSQL_TYPE_LONG;[R1] [C1] column_is_rowkey:true;[R1] [C1] column_is_signed:true;[R1] [C1] column_encoding:binary;[R1] [C1] column_is_not_null:true;[R1] [C1] column_value_new:[1](1);[R1] [C1] column_value_old:[1](1);[R1] [C2] column_name:c2;[R1] [C2] column_type:MYSQL_TYPE_OB_MAP;[R1] [C2] column_is_rowkey:false;[R1] [C2] column_is_signed:true;[R1] [C2] column_encoding:binary;[R1] [C2] column_is_not_null:false;[R1] [C2] column_value_new_md5:[NULL](0);[R1] [C2] column_value_old_md5:[cc1c66c17b8fd15806a1bfaf31479cff](11);$[R2] COMMIT;
update outrow_map_t1 set c2=map(0,[0, 0, 0]) where c1=1;
ob1.oblog.next;
[R0] BEGIN;[R0] org_cluster_id:1;[R1] record_type:UPDATE;[R1] database_name:oblog_tt.oblog_db1;[R1] table_name:outrow_map_t1;[R1] log_event:true;[R1] column_count:2;[R1] source_category:SRC_FULL_RECORDED;[R1] source_type:SRC_OCEANBASE_1_0;[R1] has_pk:true;[R1] pk_info:(0);[R1] pks:c1;[R1] has_uk:false;[R1] uk_info:(null);[R1] uks:(null);[R1] [C1] column_name:c1;[R1] [C1] column_type:MYSQL_TYPE_LONG;[R1] [C1] column_is_rowkey:true;[R1] [C1] column_is_signed:true;[R1] [C1] column_encoding:binary;[R1] [C1] column_is_not_null:true;[R1] [C1] column_value_new:[1](1);[R1] [C1] column_value_old:[1](1);[R1] [C2] column_name:c2;[R1] [C2] column_type:MYSQL_TYPE_OB_MAP;[R1] [C2] column_is_rowkey:false;[R1] [C2] column_is_signed:true;[R1] [C2] column_encoding:binary;[R1] [C2] column_is_not_null:false;[R1] [C2] column_value_new_md5:[4f4bc52c9e423fd72af0e0a2c7d6f1b4](11);[R1] [C2] column_value_old_md5:[NULL](0);$[R2] COMMIT;
delete from outrow_map_t1 where c1=2;
ob1.oblog.next;
[R0] BEGIN;[R0] org_cluster_id:1;[R1] record_type:DELETE;[R1] database_name:oblog_tt.oblog_db1;[R1] table_name:outrow_map_t1;[R1] log_event:true;[R1] column_count:2;[R1] source_category:SRC_FULL_RECORDED;[R1] source_type:SRC_OCEANBASE_1_0;[R1] has_pk:true;[R1] pk_info:(0);[R1] pks:c1;[R1] has_uk:false;[R1] uk_info:(null);[R1] uks:(null);[R1] [C1] column_name:c1;[R1] [C1] column_type:MYSQL_TYPE_LONG;[R1] [C1] column_is_rowkey:true;[R1] [C1] column_is_signed:true;[R1] [C1] column_encoding:binary;[R1] [C1] column_is_not_null:true;[R1] [C1] column_value_old:[2](1);[R1] [C2] column_name:c2;[R1] [C2] column_type:MYSQL_TYPE_OB_MAP;[R1] [C2] column_is_rowkey:false;[R1] [C2] column_is_signed:true;[R1] [C2] column_encoding:binary;[R1] [C2] column_is_not_null:false;[R1] [C2] column_value_old_origin: PADDING;[R1] [C2] column_value_old_md5:[NULL](0);$[R2] COMMIT;
drop table outrow_map_t1;
ob1.oblog.next;
[R0] record_type:EDDL;[R0] db_name:oblog_tt.oblog_db1;[R0] table_name:;[R0] column_count:1;[R0] column_name:ddl;[R0] ddl_stmt_str: DROP TABLE `oblog_db1`.`outrow_map_t1`;[R0] ddl_stmt_len: 38;
SET @long_str_map1:=CONCAT('{1:[',REPEAT('["abc012","xyz456","wuv-+"],',100000),'["abc012","xyz456","wuv-+"]]}');
SET @long_str_map2:=CONCAT('{1:[',REPEAT('["Hello","World"],',100000),'["Hello","World"]]}');
SET @long_str_map3:=CONCAT('{1:[',REPEAT('["aaa","bbb","ccc"],',100000),'["aaa","bbb","ccc"]]}');
create table outrow_map_t2(c1 int primary key, c2 map(int,array(array(varchar(16)))));
ob1.oblog.next;
[R0] record_type:EDDL;[R0] db_name:oblog_tt.oblog_db1;[R0] table_name:;[R0] column_count:1;[R0] column_name:ddl;[R0] ddl_stmt_str: create table outrow_map_t2(c1 int primary key, c2 map(int,array(array(varchar(16)))));[R0] ddl_stmt_len: 85;
insert into outrow_map_t2 values(1, @long_str_map1);
ob1.oblog.next;
[R0] BEGIN;[R0] org_cluster_id:1;[R1] record_type:INSERT;[R1] database_name:oblog_tt.oblog_db1;[R1] table_name:outrow_map_t2;[R1] log_event:true;[R1] column_count:2;[R1] source_category:SRC_FULL_RECORDED;[R1] source_type:SRC_OCEANBASE_1_0;[R1] has_pk:true;[R1] pk_info:(0);[R1] pks:c1;[R1] has_uk:false;[R1] uk_info:(null);[R1] uks:(null);[R1] [C1] column_name:c1;[R1] [C1] column_type:MYSQL_TYPE_LONG;[R1] [C1] column_is_rowkey:true;[R1] [C1] column_is_signed:true;[R1] [C1] column_encoding:binary;[R1] [C1] column_is_not_null:true;[R1] [C1] column_value_new:[1](1);[R1] [C2] column_name:c2;[R1] [C2] column_type:MYSQL_TYPE_OB_MAP;[R1] [C2] column_is_rowkey:false;[R1] [C2] column_is_signed:true;[R1] [C2] column_encoding:binary;[R1] [C2] column_is_not_null:false;[R1] [C2] column_value_new_md5:[66c399f4a30b0621fab193749caefd91](2800033);$[R2] COMMIT;
select md5(@long_str_map1);
md5(@long_str_map1)
66c399f4a30b0621fab193749caefd91
insert into outrow_map_t2 values(2, @long_str_map2);
ob1.oblog.next;
[R0] BEGIN;[R0] org_cluster_id:1;[R1] record_type:INSERT;[R1] database_name:oblog_tt.oblog_db1;[R1] table_name:outrow_map_t2;[R1] log_event:true;[R1] column_count:2;[R1] source_category:SRC_FULL_RECORDED;[R1] source_type:SRC_OCEANBASE_1_0;[R1] has_pk:true;[R1] pk_info:(0);[R1] pks:c1;[R1] has_uk:false;[R1] uk_info:(null);[R1] uks:(null);[R1] [C1] column_name:c1;[R1] [C1] column_type:MYSQL_TYPE_LONG;[R1] [C1] column_is_rowkey:true;[R1] [C1] column_is_signed:true;[R1] [C1] column_encoding:binary;[R1] [C1] column_is_not_null:true;[R1] [C1] column_value_new:[2](1);[R1] [C2] column_name:c2;[R1] [C2] column_type:MYSQL_TYPE_OB_MAP;[R1] [C2] column_is_rowkey:false;[R1] [C2] column_is_signed:true;[R1] [C2] column_encoding:binary;[R1] [C2] column_is_not_null:false;[R1] [C2] column_value_new_md5:[9a6abe6c2485bd6e20bd8321a7b9f5aa](1800023);$[R2] COMMIT;
select md5(@long_str_map2);
md5(@long_str_map2)
9a6abe6c2485bd6e20bd8321a7b9f5aa
update outrow_map_t2 set c2=@long_str_map3 where c1=1;
ob1.oblog.next;
[R0] BEGIN;[R0] org_cluster_id:1;[R1] record_type:UPDATE;[R1] database_name:oblog_tt.oblog_db1;[R1] table_name:outrow_map_t2;[R1] log_event:true;[R1] column_count:2;[R1] source_category:SRC_FULL_RECORDED;[R1] source_type:SRC_OCEANBASE_1_0;[R1] has_pk:true;[R1] pk_info:(0);[R1] pks:c1;[R1] has_uk:false;[R1] uk_info:(null);[R1] uks:(null);[R1] [C1] column_name:c1;[R1] [C1] column_type:MYSQL_TYPE_LONG;[R1] [C1] column_is_rowkey:true;[R1] [C1] column_is_signed:true;[R1] [C1] column_encoding:binary;[R1] [C1] column_is_not_null:true;[R1] [C1] column_value_new:[1](1);[R1] [C1] column_value_old:[1](1);[R1] [C2] column_name:c2;[R1] [C2] column_type:MYSQL_TYPE_OB_MAP;[R1] [C2] column_is_rowkey:false;[R1] [C2] column_is_signed:true;[R1] [C2] column_encoding:binary;[R1] [C2] column_is_not_null:false;[R1] [C2] column_value_new_md5:[e07c3d9e66445c277197061cef7bfe75](2000025);[R1] [C2] column_value_old_md5:[66c399f4a30b0621fab193749caefd91](2800033);$[R2] COMMIT;
select md5(@long_str_map3);
md5(@long_str_map3)
e07c3d9e66445c277197061cef7bfe75
update outrow_map_t2 set c2=map(2,[["1","2","3"]]) where c1=1;
ob1.oblog.next;
[R0] BEGIN;[R0] org_cluster_id:1;[R1] record_type:UPDATE;[R1] database_name:oblog_tt.oblog_db1;[R1] table_name:outrow_map_t2;[R1] log_event:true;[R1] column_count:2;[R1] source_category:SRC_FULL_RECORDED;[R1] source_type:SRC_OCEANBASE_1_0;[R1] has_pk:true;[R1] pk_info:(0);[R1] pks:c1;[R1] has_uk:false;[R1] uk_info:(null);[R1] uks:(null);[R1] [C1] column_name:c1;[R1] [C1] column_type:MYSQL_TYPE_LONG;[R1] [C1] column_is_rowkey:true;[R1] [C1] column_is_signed:true;[R1] [C1] column_encoding:binary;[R1] [C1] column_is_not_null:true;[R1] [C1] column_value_new:[1](1);[R1] [C1] column_value_old:[1](1);[R1] [C2] column_name:c2;[R1] [C2] column_type:MYSQL_TYPE_OB_MAP;[R1] [C2] column_is_rowkey:false;[R1] [C2] column_is_signed:true;[R1] [C2] column_encoding:binary;[R1] [C2] column_is_not_null:false;[R1] [C2] column_value_new_md5:[e448ffbff78a9c127cf3748c8f334ace](19);[R1] [C2] column_value_old_origin: PADDING;[R1] [C2] column_value_old_md5:[NULL](0);$[R2] COMMIT;
update outrow_map_t2 set c2=null where c1=2;
ob1.oblog.next;
[R0] BEGIN;[R0] org_cluster_id:1;[R1] record_type:UPDATE;[R1] database_name:oblog_tt.oblog_db1;[R1] table_name:outrow_map_t2;[R1] log_event:true;[R1] column_count:2;[R1] source_category:SRC_FULL_RECORDED;[R1] source_type:SRC_OCEANBASE_1_0;[R1] has_pk:true;[R1] pk_info:(0);[R1] pks:c1;[R1] has_uk:false;[R1] uk_info:(null);[R1] uks:(null);[R1] [C1] column_name:c1;[R1] [C1] column_type:MYSQL_TYPE_LONG;[R1] [C1] column_is_rowkey:true;[R1] [C1] column_is_signed:true;[R1] [C1] column_encoding:binary;[R1] [C1] column_is_not_null:true;[R1] [C1] column_value_new:[2](1);[R1] [C1] column_value_old:[2](1);[R1] [C2] column_name:c2;[R1] [C2] column_type:MYSQL_TYPE_OB_MAP;[R1] [C2] column_is_rowkey:false;[R1] [C2] column_is_signed:true;[R1] [C2] column_encoding:binary;[R1] [C2] column_is_not_null:false;[R1] [C2] column_value_new_md5:[NULL](0);[R1] [C2] column_value_old_origin: PADDING;[R1] [C2] column_value_old_md5:[NULL](0);$[R2] COMMIT;
update outrow_map_t2 set c2=@long_str_map3 where c1=2;
ob1.oblog.next;
[R0] BEGIN;[R0] org_cluster_id:1;[R1] record_type:UPDATE;[R1] database_name:oblog_tt.oblog_db1;[R1] table_name:outrow_map_t2;[R1] log_event:true;[R1] column_count:2;[R1] source_category:SRC_FULL_RECORDED;[R1] source_type:SRC_OCEANBASE_1_0;[R1] has_pk:true;[R1] pk_info:(0);[R1] pks:c1;[R1] has_uk:false;[R1] uk_info:(null);[R1] uks:(null);[R1] [C1] column_name:c1;[R1] [C1] column_type:MYSQL_TYPE_LONG;[R1] [C1] column_is_rowkey:true;[R1] [C1] column_is_signed:true;[R1] [C1] column_encoding:binary;[R1] [C1] column_is_not_null:true;[R1] [C1] column_value_new:[2](1);[R1] [C1] column_value_old:[2](1);[R1] [C2] column_name:c2;[R1] [C2] column_type:MYSQL_TYPE_OB_MAP;[R1] [C2] column_is_rowkey:false;[R1] [C2] column_is_signed:true;[R1] [C2] column_encoding:binary;[R1] [C2] column_is_not_null:false;[R1] [C2] column_value_new_md5:[e07c3d9e66445c277197061cef7bfe75](2000025);[R1] [C2] column_value_old_md5:[NULL](0);$[R2] COMMIT;
select md5(@long_str_map3);
md5(@long_str_map3)
e07c3d9e66445c277197061cef7bfe75
update outrow_map_t2 set c2=null where c1=1;
ob1.oblog.next;
[R0] BEGIN;[R0] org_cluster_id:1;[R1] record_type:UPDATE;[R1] database_name:oblog_tt.oblog_db1;[R1] table_name:outrow_map_t2;[R1] log_event:true;[R1] column_count:2;[R1] source_category:SRC_FULL_RECORDED;[R1] source_type:SRC_OCEANBASE_1_0;[R1] has_pk:true;[R1] pk_info:(0);[R1] pks:c1;[R1] has_uk:false;[R1] uk_info:(null);[R1] uks:(null);[R1] [C1] column_name:c1;[R1] [C1] column_type:MYSQL_TYPE_LONG;[R1] [C1] column_is_rowkey:true;[R1] [C1] column_is_signed:true;[R1] [C1] column_encoding:binary;[R1] [C1] column_is_not_null:true;[R1] [C1] column_value_new:[1](1);[R1] [C1] column_value_old:[1](1);[R1] [C2] column_name:c2;[R1] [C2] column_type:MYSQL_TYPE_OB_MAP;[R1] [C2] column_is_rowkey:false;[R1] [C2] column_is_signed:true;[R1] [C2] column_encoding:binary;[R1] [C2] column_is_not_null:false;[R1] [C2] column_value_new_md5:[NULL](0);[R1] [C2] column_value_old_md5:[e448ffbff78a9c127cf3748c8f334ace](19);$[R2] COMMIT;
update outrow_map_t2 set c2=map(0,[["0", "0", "0"]]) where c1=1;
ob1.oblog.next;
[R0] BEGIN;[R0] org_cluster_id:1;[R1] record_type:UPDATE;[R1] database_name:oblog_tt.oblog_db1;[R1] table_name:outrow_map_t2;[R1] log_event:true;[R1] column_count:2;[R1] source_category:SRC_FULL_RECORDED;[R1] source_type:SRC_OCEANBASE_1_0;[R1] has_pk:true;[R1] pk_info:(0);[R1] pks:c1;[R1] has_uk:false;[R1] uk_info:(null);[R1] uks:(null);[R1] [C1] column_name:c1;[R1] [C1] column_type:MYSQL_TYPE_LONG;[R1] [C1] column_is_rowkey:true;[R1] [C1] column_is_signed:true;[R1] [C1] column_encoding:binary;[R1] [C1] column_is_not_null:true;[R1] [C1] column_value_new:[1](1);[R1] [C1] column_value_old:[1](1);[R1] [C2] column_name:c2;[R1] [C2] column_type:MYSQL_TYPE_OB_MAP;[R1] [C2] column_is_rowkey:false;[R1] [C2] column_is_signed:true;[R1] [C2] column_encoding:binary;[R1] [C2] column_is_not_null:false;[R1] [C2] column_value_new_md5:[0f6567f0cf8b817ca0ce510b7d2d1ae1](19);[R1] [C2] column_value_old_md5:[NULL](0);$[R2] COMMIT;
delete from outrow_map_t2 where c1=2;
ob1.oblog.next;
[R0] BEGIN;[R0] org_cluster_id:1;[R1] record_type:DELETE;[R1] database_name:oblog_tt.oblog_db1;[R1] table_name:outrow_map_t2;[R1] log_event:true;[R1] column_count:2;[R1] source_category:SRC_FULL_RECORDED;[R1] source_type:SRC_OCEANBASE_1_0;[R1] has_pk:true;[R1] pk_info:(0);[R1] pks:c1;[R1] has_uk:false;[R1] uk_info:(null);[R1] uks:(null);[R1] [C1] column_name:c1;[R1] [C1] column_type:MYSQL_TYPE_LONG;[R1] [C1] column_is_rowkey:true;[R1] [C1] column_is_signed:true;[R1] [C1] column_encoding:binary;[R1] [C1] column_is_not_null:true;[R1] [C1] column_value_old:[2](1);[R1] [C2] column_name:c2;[R1] [C2] column_type:MYSQL_TYPE_OB_MAP;[R1] [C2] column_is_rowkey:false;[R1] [C2] column_is_signed:true;[R1] [C2] column_encoding:binary;[R1] [C2] column_is_not_null:false;[R1] [C2] column_value_old_origin: PADDING;[R1] [C2] column_value_old_md5:[NULL](0);$[R2] COMMIT;
drop table outrow_map_t2;
ob1.oblog.next;
[R0] record_type:EDDL;[R0] db_name:oblog_tt.oblog_db1;[R0] table_name:;[R0] column_count:1;[R0] column_name:ddl;[R0] ddl_stmt_str: DROP TABLE `oblog_db1`.`outrow_map_t2`;[R0] ddl_stmt_len: 38;
'[SECTION_END] [outrow_test]'
'[CASE_END] [case_name]'
