ob1=OBI(cluster=1);
ob1.force_stop;
ob1.clean_backup_dest;
ob1.reboot;
ob1.create_client;
create resource unit oblog_box_mysql max_cpu 2, memory_size='10G';
create resource pool oblog_pool_mysql unit = 'oblog_box_mysql', unit_num = 1, zone_list = ('z1');
create tenant oblog_tt replica_num = 1, primary_zone='z1', resource_pool_list=('oblog_pool_mysql') set ob_tcp_invited_nodes='%';
alter tenant oblog_tt set variables max_allowed_packet=1073741824;
set global max_allowed_packet=1073741824;
set binlog_row_image='MINIMAL';
show variables like "binlog_row_image";
Variable_name	Value
binlog_row_image	MINIMAL
set ob_trx_timeout=100000000;
create database oblog_db1;
use oblog_db1;
create table t1(pk int primary key, tiny_text tinytext, tiny_blob tinyblob, text_type text, blob_type blob, medium_text mediumtext, medium_blob mediumblob, long_text longtext, long_blob longblob);
ob1.check_until_timeout select count(*) as num from oceanbase.__all_virtual_archive_stat, 0, 60;
ob1.mysql alter system archivelog;
ob1.check_until_timeout select status from oceanbase.CDB_OB_ARCHIVELOG where tenant_id=$backup_tenant_id, DOING, 600;
ob1.z1.obs0.check_log_until_success -c "get_data_dict_meta_info";
use oblog_db1;
ob1.oblog.set_extra_argument -m;
ob1.oblog.gen_conf tb_white_list=sys.oblog*.*|oblog_tt.*.* log_level=DEBUG skip_ob_version_compat_check=1;
ob1.oblog.restart;
insert into t1 values (1, "", "", "", "", "", "", repeat('a', 50331647), "");
select md5(long_text), md5(long_blob)  from t1 where pk = 1;
md5(long_text)	md5(long_blob)
c57d4c3741dc0eb85d767497f9736503	d41d8cd98f00b204e9800998ecf8427e
ob1.oblog.next_dml;
[R0] BEGIN;[R0] org_cluster_id:1;[R1] record_type:INSERT;[R1] database_name:oblog_tt.oblog_db1;[R1] table_name:t1;[R1] log_event:true;[R1] column_count:9;[R1] source_category:SRC_FULL_RECORDED;[R1] source_type:SRC_OCEANBASE_1_0;[R1] has_pk:true;[R1] pk_info:(0);[R1] pks:pk;[R1] has_uk:false;[R1] uk_info:(null);[R1] uks:(null);[R1] [C1] column_name:pk;[R1] [C1] column_type:MYSQL_TYPE_LONG;[R1] [C1] column_is_rowkey:true;[R1] [C1] column_is_signed:true;[R1] [C1] column_encoding:binary;[R1] [C1] column_is_not_null:true;[R1] [C1] column_value_new:[1](1);[R1] [C2] column_name:tiny_text;[R1] [C2] column_type:MYSQL_TYPE_TINY_BLOB;[R1] [C2] column_is_rowkey:false;[R1] [C2] column_is_signed:true;[R1] [C2] column_encoding:utf8mb4;[R1] [C2] column_is_not_null:false;[R1] [C2] column_value_new_md5:[d41d8cd98f00b204e9800998ecf8427e](0);[R1] [C3] column_name:tiny_blob;[R1] [C3] column_type:MYSQL_TYPE_TINY_BLOB;[R1] [C3] column_is_rowkey:false;[R1] [C3] column_is_signed:true;[R1] [C3] column_encoding:binary;[R1] [C3] column_is_not_null:false;[R1] [C3] column_value_new_md5:[d41d8cd98f00b204e9800998ecf8427e](0);[R1] [C4] column_name:text_type;[R1] [C4] column_type:MYSQL_TYPE_BLOB;[R1] [C4] column_is_rowkey:false;[R1] [C4] column_is_signed:true;[R1] [C4] column_encoding:utf8mb4;[R1] [C4] column_is_not_null:false;[R1] [C4] column_value_new_md5:[d41d8cd98f00b204e9800998ecf8427e](0);[R1] [C5] column_name:blob_type;[R1] [C5] column_type:MYSQL_TYPE_BLOB;[R1] [C5] column_is_rowkey:false;[R1] [C5] column_is_signed:true;[R1] [C5] column_encoding:binary;[R1] [C5] column_is_not_null:false;[R1] [C5] column_value_new_md5:[d41d8cd98f00b204e9800998ecf8427e](0);[R1] [C6] column_name:medium_text;[R1] [C6] column_type:MYSQL_TYPE_MEDIUM_BLOB;[R1] [C6] column_is_rowkey:false;[R1] [C6] column_is_signed:true;[R1] [C6] column_encoding:utf8mb4;[R1] [C6] column_is_not_null:false;[R1] [C6] column_value_new_md5:[d41d8cd98f00b204e9800998ecf8427e](0);[R1] [C7] column_name:medium_blob;[R1] [C7] column_type:MYSQL_TYPE_MEDIUM_BLOB;[R1] [C7] column_is_rowkey:false;[R1] [C7] column_is_signed:true;[R1] [C7] column_encoding:binary;[R1] [C7] column_is_not_null:false;[R1] [C7] column_value_new_md5:[d41d8cd98f00b204e9800998ecf8427e](0);[R1] [C8] column_name:long_text;[R1] [C8] column_type:MYSQL_TYPE_LONG_BLOB;[R1] [C8] column_is_rowkey:false;[R1] [C8] column_is_signed:true;[R1] [C8] column_encoding:utf8mb4;[R1] [C8] column_is_not_null:false;[R1] [C8] column_value_new_md5:[c57d4c3741dc0eb85d767497f9736503](50331647);[R1] [C9] column_name:long_blob;[R1] [C9] column_type:MYSQL_TYPE_LONG_BLOB;[R1] [C9] column_is_rowkey:false;[R1] [C9] column_is_signed:true;[R1] [C9] column_encoding:binary;[R1] [C9] column_is_not_null:false;[R1] [C9] column_value_new_md5:[d41d8cd98f00b204e9800998ecf8427e](0);$[R2] COMMIT;
insert into t1 values (2, "", "", "", "", "", "", repeat('b', 50331647), "");
select md5(long_text), md5(long_blob)  from t1 where pk = 2;
md5(long_text)	md5(long_blob)
2382bbd355b1c0377240e1d1f79b6081	d41d8cd98f00b204e9800998ecf8427e
ob1.oblog.next_dml;
[R0] BEGIN;[R0] org_cluster_id:1;[R1] record_type:INSERT;[R1] database_name:oblog_tt.oblog_db1;[R1] table_name:t1;[R1] log_event:true;[R1] column_count:9;[R1] source_category:SRC_FULL_RECORDED;[R1] source_type:SRC_OCEANBASE_1_0;[R1] has_pk:true;[R1] pk_info:(0);[R1] pks:pk;[R1] has_uk:false;[R1] uk_info:(null);[R1] uks:(null);[R1] [C1] column_name:pk;[R1] [C1] column_type:MYSQL_TYPE_LONG;[R1] [C1] column_is_rowkey:true;[R1] [C1] column_is_signed:true;[R1] [C1] column_encoding:binary;[R1] [C1] column_is_not_null:true;[R1] [C1] column_value_new:[2](1);[R1] [C2] column_name:tiny_text;[R1] [C2] column_type:MYSQL_TYPE_TINY_BLOB;[R1] [C2] column_is_rowkey:false;[R1] [C2] column_is_signed:true;[R1] [C2] column_encoding:utf8mb4;[R1] [C2] column_is_not_null:false;[R1] [C2] column_value_new_md5:[d41d8cd98f00b204e9800998ecf8427e](0);[R1] [C3] column_name:tiny_blob;[R1] [C3] column_type:MYSQL_TYPE_TINY_BLOB;[R1] [C3] column_is_rowkey:false;[R1] [C3] column_is_signed:true;[R1] [C3] column_encoding:binary;[R1] [C3] column_is_not_null:false;[R1] [C3] column_value_new_md5:[d41d8cd98f00b204e9800998ecf8427e](0);[R1] [C4] column_name:text_type;[R1] [C4] column_type:MYSQL_TYPE_BLOB;[R1] [C4] column_is_rowkey:false;[R1] [C4] column_is_signed:true;[R1] [C4] column_encoding:utf8mb4;[R1] [C4] column_is_not_null:false;[R1] [C4] column_value_new_md5:[d41d8cd98f00b204e9800998ecf8427e](0);[R1] [C5] column_name:blob_type;[R1] [C5] column_type:MYSQL_TYPE_BLOB;[R1] [C5] column_is_rowkey:false;[R1] [C5] column_is_signed:true;[R1] [C5] column_encoding:binary;[R1] [C5] column_is_not_null:false;[R1] [C5] column_value_new_md5:[d41d8cd98f00b204e9800998ecf8427e](0);[R1] [C6] column_name:medium_text;[R1] [C6] column_type:MYSQL_TYPE_MEDIUM_BLOB;[R1] [C6] column_is_rowkey:false;[R1] [C6] column_is_signed:true;[R1] [C6] column_encoding:utf8mb4;[R1] [C6] column_is_not_null:false;[R1] [C6] column_value_new_md5:[d41d8cd98f00b204e9800998ecf8427e](0);[R1] [C7] column_name:medium_blob;[R1] [C7] column_type:MYSQL_TYPE_MEDIUM_BLOB;[R1] [C7] column_is_rowkey:false;[R1] [C7] column_is_signed:true;[R1] [C7] column_encoding:binary;[R1] [C7] column_is_not_null:false;[R1] [C7] column_value_new_md5:[d41d8cd98f00b204e9800998ecf8427e](0);[R1] [C8] column_name:long_text;[R1] [C8] column_type:MYSQL_TYPE_LONG_BLOB;[R1] [C8] column_is_rowkey:false;[R1] [C8] column_is_signed:true;[R1] [C8] column_encoding:utf8mb4;[R1] [C8] column_is_not_null:false;[R1] [C8] column_value_new_md5:[2382bbd355b1c0377240e1d1f79b6081](50331647);[R1] [C9] column_name:long_blob;[R1] [C9] column_type:MYSQL_TYPE_LONG_BLOB;[R1] [C9] column_is_rowkey:false;[R1] [C9] column_is_signed:true;[R1] [C9] column_encoding:binary;[R1] [C9] column_is_not_null:false;[R1] [C9] column_value_new_md5:[d41d8cd98f00b204e9800998ecf8427e](0);$[R2] COMMIT;
insert into t1 values (3, "", "", "", "", "", "", repeat('a', 50331647), repeat('b', 50331647));
select md5(long_text), md5(long_blob)  from t1 where pk = 3;
md5(long_text)	md5(long_blob)
c57d4c3741dc0eb85d767497f9736503	2382bbd355b1c0377240e1d1f79b6081
ob1.oblog.next_dml;
[R0] BEGIN;[R0] org_cluster_id:1;[R1] record_type:INSERT;[R1] database_name:oblog_tt.oblog_db1;[R1] table_name:t1;[R1] log_event:true;[R1] column_count:9;[R1] source_category:SRC_FULL_RECORDED;[R1] source_type:SRC_OCEANBASE_1_0;[R1] has_pk:true;[R1] pk_info:(0);[R1] pks:pk;[R1] has_uk:false;[R1] uk_info:(null);[R1] uks:(null);[R1] [C1] column_name:pk;[R1] [C1] column_type:MYSQL_TYPE_LONG;[R1] [C1] column_is_rowkey:true;[R1] [C1] column_is_signed:true;[R1] [C1] column_encoding:binary;[R1] [C1] column_is_not_null:true;[R1] [C1] column_value_new:[3](1);[R1] [C2] column_name:tiny_text;[R1] [C2] column_type:MYSQL_TYPE_TINY_BLOB;[R1] [C2] column_is_rowkey:false;[R1] [C2] column_is_signed:true;[R1] [C2] column_encoding:utf8mb4;[R1] [C2] column_is_not_null:false;[R1] [C2] column_value_new_md5:[d41d8cd98f00b204e9800998ecf8427e](0);[R1] [C3] column_name:tiny_blob;[R1] [C3] column_type:MYSQL_TYPE_TINY_BLOB;[R1] [C3] column_is_rowkey:false;[R1] [C3] column_is_signed:true;[R1] [C3] column_encoding:binary;[R1] [C3] column_is_not_null:false;[R1] [C3] column_value_new_md5:[d41d8cd98f00b204e9800998ecf8427e](0);[R1] [C4] column_name:text_type;[R1] [C4] column_type:MYSQL_TYPE_BLOB;[R1] [C4] column_is_rowkey:false;[R1] [C4] column_is_signed:true;[R1] [C4] column_encoding:utf8mb4;[R1] [C4] column_is_not_null:false;[R1] [C4] column_value_new_md5:[d41d8cd98f00b204e9800998ecf8427e](0);[R1] [C5] column_name:blob_type;[R1] [C5] column_type:MYSQL_TYPE_BLOB;[R1] [C5] column_is_rowkey:false;[R1] [C5] column_is_signed:true;[R1] [C5] column_encoding:binary;[R1] [C5] column_is_not_null:false;[R1] [C5] column_value_new_md5:[d41d8cd98f00b204e9800998ecf8427e](0);[R1] [C6] column_name:medium_text;[R1] [C6] column_type:MYSQL_TYPE_MEDIUM_BLOB;[R1] [C6] column_is_rowkey:false;[R1] [C6] column_is_signed:true;[R1] [C6] column_encoding:utf8mb4;[R1] [C6] column_is_not_null:false;[R1] [C6] column_value_new_md5:[d41d8cd98f00b204e9800998ecf8427e](0);[R1] [C7] column_name:medium_blob;[R1] [C7] column_type:MYSQL_TYPE_MEDIUM_BLOB;[R1] [C7] column_is_rowkey:false;[R1] [C7] column_is_signed:true;[R1] [C7] column_encoding:binary;[R1] [C7] column_is_not_null:false;[R1] [C7] column_value_new_md5:[d41d8cd98f00b204e9800998ecf8427e](0);[R1] [C8] column_name:long_text;[R1] [C8] column_type:MYSQL_TYPE_LONG_BLOB;[R1] [C8] column_is_rowkey:false;[R1] [C8] column_is_signed:true;[R1] [C8] column_encoding:utf8mb4;[R1] [C8] column_is_not_null:false;[R1] [C8] column_value_new_md5:[c57d4c3741dc0eb85d767497f9736503](50331647);[R1] [C9] column_name:long_blob;[R1] [C9] column_type:MYSQL_TYPE_LONG_BLOB;[R1] [C9] column_is_rowkey:false;[R1] [C9] column_is_signed:true;[R1] [C9] column_encoding:binary;[R1] [C9] column_is_not_null:false;[R1] [C9] column_value_new_md5:[2382bbd355b1c0377240e1d1f79b6081](50331647);$[R2] COMMIT;
update t1 set long_blob = repeat('d', 11534336) where pk = 3;
select md5(long_text), md5(long_blob)  from t1 where pk = 3;
md5(long_text)	md5(long_blob)
c57d4c3741dc0eb85d767497f9736503	21ac45796075552d5e54ff8c8d45db78
ob1.oblog.next_dml;
[R0] BEGIN;[R0] org_cluster_id:1;[R1] record_type:UPDATE;[R1] database_name:oblog_tt.oblog_db1;[R1] table_name:t1;[R1] log_event:true;[R1] column_count:9;[R1] source_category:SRC_FULL_RECORDED;[R1] source_type:SRC_OCEANBASE_1_0;[R1] has_pk:true;[R1] pk_info:(0);[R1] pks:pk;[R1] has_uk:false;[R1] uk_info:(null);[R1] uks:(null);[R1] [C1] column_name:pk;[R1] [C1] column_type:MYSQL_TYPE_LONG;[R1] [C1] column_is_rowkey:true;[R1] [C1] column_is_signed:true;[R1] [C1] column_encoding:binary;[R1] [C1] column_is_not_null:true;[R1] [C1] column_value_new:[3](1);[R1] [C1] column_value_old:[3](1);[R1] [C2] column_name:tiny_text;[R1] [C2] column_type:MYSQL_TYPE_TINY_BLOB;[R1] [C2] column_is_rowkey:false;[R1] [C2] column_is_signed:true;[R1] [C2] column_encoding:utf8mb4;[R1] [C2] column_is_not_null:false;[R1] [C2] column_value_new_origin: PADDING;[R1] [C2] column_value_new_md5:[NULL](0);[R1] [C2] column_value_old_origin: PADDING;[R1] [C2] column_value_old_md5:[NULL](0);[R1] [C3] column_name:tiny_blob;[R1] [C3] column_type:MYSQL_TYPE_TINY_BLOB;[R1] [C3] column_is_rowkey:false;[R1] [C3] column_is_signed:true;[R1] [C3] column_encoding:binary;[R1] [C3] column_is_not_null:false;[R1] [C3] column_value_new_origin: PADDING;[R1] [C3] column_value_new_md5:[NULL](0);[R1] [C3] column_value_old_origin: PADDING;[R1] [C3] column_value_old_md5:[NULL](0);[R1] [C4] column_name:text_type;[R1] [C4] column_type:MYSQL_TYPE_BLOB;[R1] [C4] column_is_rowkey:false;[R1] [C4] column_is_signed:true;[R1] [C4] column_encoding:utf8mb4;[R1] [C4] column_is_not_null:false;[R1] [C4] column_value_new_origin: PADDING;[R1] [C4] column_value_new_md5:[NULL](0);[R1] [C4] column_value_old_origin: PADDING;[R1] [C4] column_value_old_md5:[NULL](0);[R1] [C5] column_name:blob_type;[R1] [C5] column_type:MYSQL_TYPE_BLOB;[R1] [C5] column_is_rowkey:false;[R1] [C5] column_is_signed:true;[R1] [C5] column_encoding:binary;[R1] [C5] column_is_not_null:false;[R1] [C5] column_value_new_origin: PADDING;[R1] [C5] column_value_new_md5:[NULL](0);[R1] [C5] column_value_old_origin: PADDING;[R1] [C5] column_value_old_md5:[NULL](0);[R1] [C6] column_name:medium_text;[R1] [C6] column_type:MYSQL_TYPE_MEDIUM_BLOB;[R1] [C6] column_is_rowkey:false;[R1] [C6] column_is_signed:true;[R1] [C6] column_encoding:utf8mb4;[R1] [C6] column_is_not_null:false;[R1] [C6] column_value_new_origin: PADDING;[R1] [C6] column_value_new_md5:[NULL](0);[R1] [C6] column_value_old_origin: PADDING;[R1] [C6] column_value_old_md5:[NULL](0);[R1] [C7] column_name:medium_blob;[R1] [C7] column_type:MYSQL_TYPE_MEDIUM_BLOB;[R1] [C7] column_is_rowkey:false;[R1] [C7] column_is_signed:true;[R1] [C7] column_encoding:binary;[R1] [C7] column_is_not_null:false;[R1] [C7] column_value_new_origin: PADDING;[R1] [C7] column_value_new_md5:[NULL](0);[R1] [C7] column_value_old_origin: PADDING;[R1] [C7] column_value_old_md5:[NULL](0);[R1] [C8] column_name:long_text;[R1] [C8] column_type:MYSQL_TYPE_LONG_BLOB;[R1] [C8] column_is_rowkey:false;[R1] [C8] column_is_signed:true;[R1] [C8] column_encoding:utf8mb4;[R1] [C8] column_is_not_null:false;[R1] [C8] column_value_new_origin: PADDING;[R1] [C8] column_value_new_md5:[NULL](0);[R1] [C8] column_value_old_origin: PADDING;[R1] [C8] column_value_old_md5:[NULL](0);[R1] [C9] column_name:long_blob;[R1] [C9] column_type:MYSQL_TYPE_LONG_BLOB;[R1] [C9] column_is_rowkey:false;[R1] [C9] column_is_signed:true;[R1] [C9] column_encoding:binary;[R1] [C9] column_is_not_null:false;[R1] [C9] column_value_new_md5:[21ac45796075552d5e54ff8c8d45db78](11534336);[R1] [C9] column_value_old_md5:[2382bbd355b1c0377240e1d1f79b6081](50331647);$[R2] COMMIT;
update t1 set long_text= repeat('d', 11534336), long_blob = repeat('b', 11534336) where pk = 3;
select md5(long_text), md5(long_blob)  from t1 where pk = 3;
md5(long_text)	md5(long_blob)
21ac45796075552d5e54ff8c8d45db78	2c935e46cfdb63ec4d3dc7c05351aa7f
ob1.oblog.next_dml;
[R0] BEGIN;[R0] org_cluster_id:1;[R1] record_type:UPDATE;[R1] database_name:oblog_tt.oblog_db1;[R1] table_name:t1;[R1] log_event:true;[R1] column_count:9;[R1] source_category:SRC_FULL_RECORDED;[R1] source_type:SRC_OCEANBASE_1_0;[R1] has_pk:true;[R1] pk_info:(0);[R1] pks:pk;[R1] has_uk:false;[R1] uk_info:(null);[R1] uks:(null);[R1] [C1] column_name:pk;[R1] [C1] column_type:MYSQL_TYPE_LONG;[R1] [C1] column_is_rowkey:true;[R1] [C1] column_is_signed:true;[R1] [C1] column_encoding:binary;[R1] [C1] column_is_not_null:true;[R1] [C1] column_value_new:[3](1);[R1] [C1] column_value_old:[3](1);[R1] [C2] column_name:tiny_text;[R1] [C2] column_type:MYSQL_TYPE_TINY_BLOB;[R1] [C2] column_is_rowkey:false;[R1] [C2] column_is_signed:true;[R1] [C2] column_encoding:utf8mb4;[R1] [C2] column_is_not_null:false;[R1] [C2] column_value_new_origin: PADDING;[R1] [C2] column_value_new_md5:[NULL](0);[R1] [C2] column_value_old_origin: PADDING;[R1] [C2] column_value_old_md5:[NULL](0);[R1] [C3] column_name:tiny_blob;[R1] [C3] column_type:MYSQL_TYPE_TINY_BLOB;[R1] [C3] column_is_rowkey:false;[R1] [C3] column_is_signed:true;[R1] [C3] column_encoding:binary;[R1] [C3] column_is_not_null:false;[R1] [C3] column_value_new_origin: PADDING;[R1] [C3] column_value_new_md5:[NULL](0);[R1] [C3] column_value_old_origin: PADDING;[R1] [C3] column_value_old_md5:[NULL](0);[R1] [C4] column_name:text_type;[R1] [C4] column_type:MYSQL_TYPE_BLOB;[R1] [C4] column_is_rowkey:false;[R1] [C4] column_is_signed:true;[R1] [C4] column_encoding:utf8mb4;[R1] [C4] column_is_not_null:false;[R1] [C4] column_value_new_origin: PADDING;[R1] [C4] column_value_new_md5:[NULL](0);[R1] [C4] column_value_old_origin: PADDING;[R1] [C4] column_value_old_md5:[NULL](0);[R1] [C5] column_name:blob_type;[R1] [C5] column_type:MYSQL_TYPE_BLOB;[R1] [C5] column_is_rowkey:false;[R1] [C5] column_is_signed:true;[R1] [C5] column_encoding:binary;[R1] [C5] column_is_not_null:false;[R1] [C5] column_value_new_origin: PADDING;[R1] [C5] column_value_new_md5:[NULL](0);[R1] [C5] column_value_old_origin: PADDING;[R1] [C5] column_value_old_md5:[NULL](0);[R1] [C6] column_name:medium_text;[R1] [C6] column_type:MYSQL_TYPE_MEDIUM_BLOB;[R1] [C6] column_is_rowkey:false;[R1] [C6] column_is_signed:true;[R1] [C6] column_encoding:utf8mb4;[R1] [C6] column_is_not_null:false;[R1] [C6] column_value_new_origin: PADDING;[R1] [C6] column_value_new_md5:[NULL](0);[R1] [C6] column_value_old_origin: PADDING;[R1] [C6] column_value_old_md5:[NULL](0);[R1] [C7] column_name:medium_blob;[R1] [C7] column_type:MYSQL_TYPE_MEDIUM_BLOB;[R1] [C7] column_is_rowkey:false;[R1] [C7] column_is_signed:true;[R1] [C7] column_encoding:binary;[R1] [C7] column_is_not_null:false;[R1] [C7] column_value_new_origin: PADDING;[R1] [C7] column_value_new_md5:[NULL](0);[R1] [C7] column_value_old_origin: PADDING;[R1] [C7] column_value_old_md5:[NULL](0);[R1] [C8] column_name:long_text;[R1] [C8] column_type:MYSQL_TYPE_LONG_BLOB;[R1] [C8] column_is_rowkey:false;[R1] [C8] column_is_signed:true;[R1] [C8] column_encoding:utf8mb4;[R1] [C8] column_is_not_null:false;[R1] [C8] column_value_new_md5:[21ac45796075552d5e54ff8c8d45db78](11534336);[R1] [C8] column_value_old_md5:[c57d4c3741dc0eb85d767497f9736503](50331647);[R1] [C9] column_name:long_blob;[R1] [C9] column_type:MYSQL_TYPE_LONG_BLOB;[R1] [C9] column_is_rowkey:false;[R1] [C9] column_is_signed:true;[R1] [C9] column_encoding:binary;[R1] [C9] column_is_not_null:false;[R1] [C9] column_value_new_md5:[2c935e46cfdb63ec4d3dc7c05351aa7f](11534336);[R1] [C9] column_value_old_md5:[21ac45796075552d5e54ff8c8d45db78](11534336);$[R2] COMMIT;
insert into t1 values (4, "", "", repeat('a', 63210), "", repeat('a', 654321), "", repeat('a', 50331647), repeat('b', 50331647));
select pk, md5(tiny_text), md5(tiny_blob), md5(text_type), md5(blob_type), md5(medium_text), md5(medium_blob), md5(long_text), md5(long_blob) from t1 where pk=4;
pk	md5(tiny_text)	md5(tiny_blob)	md5(text_type)	md5(blob_type)	md5(medium_text)	md5(medium_blob)	md5(long_text)	md5(long_blob)
4	d41d8cd98f00b204e9800998ecf8427e	d41d8cd98f00b204e9800998ecf8427e	16a9e4895c6169a9a8da828f6d4b4896	d41d8cd98f00b204e9800998ecf8427e	d5300422b42b6fc65e3213972d51d901	d41d8cd98f00b204e9800998ecf8427e	c57d4c3741dc0eb85d767497f9736503	2382bbd355b1c0377240e1d1f79b6081
ob1.oblog.next_dml;
[R0] BEGIN;[R0] org_cluster_id:1;[R1] record_type:INSERT;[R1] database_name:oblog_tt.oblog_db1;[R1] table_name:t1;[R1] log_event:true;[R1] column_count:9;[R1] source_category:SRC_FULL_RECORDED;[R1] source_type:SRC_OCEANBASE_1_0;[R1] has_pk:true;[R1] pk_info:(0);[R1] pks:pk;[R1] has_uk:false;[R1] uk_info:(null);[R1] uks:(null);[R1] [C1] column_name:pk;[R1] [C1] column_type:MYSQL_TYPE_LONG;[R1] [C1] column_is_rowkey:true;[R1] [C1] column_is_signed:true;[R1] [C1] column_encoding:binary;[R1] [C1] column_is_not_null:true;[R1] [C1] column_value_new:[4](1);[R1] [C2] column_name:tiny_text;[R1] [C2] column_type:MYSQL_TYPE_TINY_BLOB;[R1] [C2] column_is_rowkey:false;[R1] [C2] column_is_signed:true;[R1] [C2] column_encoding:utf8mb4;[R1] [C2] column_is_not_null:false;[R1] [C2] column_value_new_md5:[d41d8cd98f00b204e9800998ecf8427e](0);[R1] [C3] column_name:tiny_blob;[R1] [C3] column_type:MYSQL_TYPE_TINY_BLOB;[R1] [C3] column_is_rowkey:false;[R1] [C3] column_is_signed:true;[R1] [C3] column_encoding:binary;[R1] [C3] column_is_not_null:false;[R1] [C3] column_value_new_md5:[d41d8cd98f00b204e9800998ecf8427e](0);[R1] [C4] column_name:text_type;[R1] [C4] column_type:MYSQL_TYPE_BLOB;[R1] [C4] column_is_rowkey:false;[R1] [C4] column_is_signed:true;[R1] [C4] column_encoding:utf8mb4;[R1] [C4] column_is_not_null:false;[R1] [C4] column_value_new_md5:[16a9e4895c6169a9a8da828f6d4b4896](63210);[R1] [C5] column_name:blob_type;[R1] [C5] column_type:MYSQL_TYPE_BLOB;[R1] [C5] column_is_rowkey:false;[R1] [C5] column_is_signed:true;[R1] [C5] column_encoding:binary;[R1] [C5] column_is_not_null:false;[R1] [C5] column_value_new_md5:[d41d8cd98f00b204e9800998ecf8427e](0);[R1] [C6] column_name:medium_text;[R1] [C6] column_type:MYSQL_TYPE_MEDIUM_BLOB;[R1] [C6] column_is_rowkey:false;[R1] [C6] column_is_signed:true;[R1] [C6] column_encoding:utf8mb4;[R1] [C6] column_is_not_null:false;[R1] [C6] column_value_new_md5:[d5300422b42b6fc65e3213972d51d901](654321);[R1] [C7] column_name:medium_blob;[R1] [C7] column_type:MYSQL_TYPE_MEDIUM_BLOB;[R1] [C7] column_is_rowkey:false;[R1] [C7] column_is_signed:true;[R1] [C7] column_encoding:binary;[R1] [C7] column_is_not_null:false;[R1] [C7] column_value_new_md5:[d41d8cd98f00b204e9800998ecf8427e](0);[R1] [C8] column_name:long_text;[R1] [C8] column_type:MYSQL_TYPE_LONG_BLOB;[R1] [C8] column_is_rowkey:false;[R1] [C8] column_is_signed:true;[R1] [C8] column_encoding:utf8mb4;[R1] [C8] column_is_not_null:false;[R1] [C8] column_value_new_md5:[c57d4c3741dc0eb85d767497f9736503](50331647);[R1] [C9] column_name:long_blob;[R1] [C9] column_type:MYSQL_TYPE_LONG_BLOB;[R1] [C9] column_is_rowkey:false;[R1] [C9] column_is_signed:true;[R1] [C9] column_encoding:binary;[R1] [C9] column_is_not_null:false;[R1] [C9] column_value_new_md5:[2382bbd355b1c0377240e1d1f79b6081](50331647);$[R2] COMMIT;
update t1 set long_text='', long_blob=NULL where pk = 4;
select pk, md5(tiny_text), md5(tiny_blob), md5(text_type), md5(blob_type), md5(medium_text), md5(medium_blob), md5(long_text), md5(long_blob) from t1 where pk=4;
pk	md5(tiny_text)	md5(tiny_blob)	md5(text_type)	md5(blob_type)	md5(medium_text)	md5(medium_blob)	md5(long_text)	md5(long_blob)
4	d41d8cd98f00b204e9800998ecf8427e	d41d8cd98f00b204e9800998ecf8427e	16a9e4895c6169a9a8da828f6d4b4896	d41d8cd98f00b204e9800998ecf8427e	d5300422b42b6fc65e3213972d51d901	d41d8cd98f00b204e9800998ecf8427e	d41d8cd98f00b204e9800998ecf8427e	NULL
ob1.oblog.next_dml;
[R0] BEGIN;[R0] org_cluster_id:1;[R1] record_type:UPDATE;[R1] database_name:oblog_tt.oblog_db1;[R1] table_name:t1;[R1] log_event:true;[R1] column_count:9;[R1] source_category:SRC_FULL_RECORDED;[R1] source_type:SRC_OCEANBASE_1_0;[R1] has_pk:true;[R1] pk_info:(0);[R1] pks:pk;[R1] has_uk:false;[R1] uk_info:(null);[R1] uks:(null);[R1] [C1] column_name:pk;[R1] [C1] column_type:MYSQL_TYPE_LONG;[R1] [C1] column_is_rowkey:true;[R1] [C1] column_is_signed:true;[R1] [C1] column_encoding:binary;[R1] [C1] column_is_not_null:true;[R1] [C1] column_value_new:[4](1);[R1] [C1] column_value_old:[4](1);[R1] [C2] column_name:tiny_text;[R1] [C2] column_type:MYSQL_TYPE_TINY_BLOB;[R1] [C2] column_is_rowkey:false;[R1] [C2] column_is_signed:true;[R1] [C2] column_encoding:utf8mb4;[R1] [C2] column_is_not_null:false;[R1] [C2] column_value_new_origin: PADDING;[R1] [C2] column_value_new_md5:[NULL](0);[R1] [C2] column_value_old_origin: PADDING;[R1] [C2] column_value_old_md5:[NULL](0);[R1] [C3] column_name:tiny_blob;[R1] [C3] column_type:MYSQL_TYPE_TINY_BLOB;[R1] [C3] column_is_rowkey:false;[R1] [C3] column_is_signed:true;[R1] [C3] column_encoding:binary;[R1] [C3] column_is_not_null:false;[R1] [C3] column_value_new_origin: PADDING;[R1] [C3] column_value_new_md5:[NULL](0);[R1] [C3] column_value_old_origin: PADDING;[R1] [C3] column_value_old_md5:[NULL](0);[R1] [C4] column_name:text_type;[R1] [C4] column_type:MYSQL_TYPE_BLOB;[R1] [C4] column_is_rowkey:false;[R1] [C4] column_is_signed:true;[R1] [C4] column_encoding:utf8mb4;[R1] [C4] column_is_not_null:false;[R1] [C4] column_value_new_origin: PADDING;[R1] [C4] column_value_new_md5:[NULL](0);[R1] [C4] column_value_old_origin: PADDING;[R1] [C4] column_value_old_md5:[NULL](0);[R1] [C5] column_name:blob_type;[R1] [C5] column_type:MYSQL_TYPE_BLOB;[R1] [C5] column_is_rowkey:false;[R1] [C5] column_is_signed:true;[R1] [C5] column_encoding:binary;[R1] [C5] column_is_not_null:false;[R1] [C5] column_value_new_origin: PADDING;[R1] [C5] column_value_new_md5:[NULL](0);[R1] [C5] column_value_old_origin: PADDING;[R1] [C5] column_value_old_md5:[NULL](0);[R1] [C6] column_name:medium_text;[R1] [C6] column_type:MYSQL_TYPE_MEDIUM_BLOB;[R1] [C6] column_is_rowkey:false;[R1] [C6] column_is_signed:true;[R1] [C6] column_encoding:utf8mb4;[R1] [C6] column_is_not_null:false;[R1] [C6] column_value_new_origin: PADDING;[R1] [C6] column_value_new_md5:[NULL](0);[R1] [C6] column_value_old_origin: PADDING;[R1] [C6] column_value_old_md5:[NULL](0);[R1] [C7] column_name:medium_blob;[R1] [C7] column_type:MYSQL_TYPE_MEDIUM_BLOB;[R1] [C7] column_is_rowkey:false;[R1] [C7] column_is_signed:true;[R1] [C7] column_encoding:binary;[R1] [C7] column_is_not_null:false;[R1] [C7] column_value_new_origin: PADDING;[R1] [C7] column_value_new_md5:[NULL](0);[R1] [C7] column_value_old_origin: PADDING;[R1] [C7] column_value_old_md5:[NULL](0);[R1] [C8] column_name:long_text;[R1] [C8] column_type:MYSQL_TYPE_LONG_BLOB;[R1] [C8] column_is_rowkey:false;[R1] [C8] column_is_signed:true;[R1] [C8] column_encoding:utf8mb4;[R1] [C8] column_is_not_null:false;[R1] [C8] column_value_new_md5:[d41d8cd98f00b204e9800998ecf8427e](0);[R1] [C8] column_value_old_origin: PADDING;[R1] [C8] column_value_old_md5:[NULL](0);[R1] [C9] column_name:long_blob;[R1] [C9] column_type:MYSQL_TYPE_LONG_BLOB;[R1] [C9] column_is_rowkey:false;[R1] [C9] column_is_signed:true;[R1] [C9] column_encoding:binary;[R1] [C9] column_is_not_null:false;[R1] [C9] column_value_new_md5:[NULL](0);[R1] [C9] column_value_old_origin: PADDING;[R1] [C9] column_value_old_md5:[NULL](0);$[R2] COMMIT;
update t1 set long_text=NULL, long_blob='' where pk = 4;
select pk, md5(tiny_text), md5(tiny_blob), md5(text_type), md5(blob_type), md5(medium_text), md5(medium_blob), md5(long_text), md5(long_blob) from t1 where pk=4;
pk	md5(tiny_text)	md5(tiny_blob)	md5(text_type)	md5(blob_type)	md5(medium_text)	md5(medium_blob)	md5(long_text)	md5(long_blob)
4	d41d8cd98f00b204e9800998ecf8427e	d41d8cd98f00b204e9800998ecf8427e	16a9e4895c6169a9a8da828f6d4b4896	d41d8cd98f00b204e9800998ecf8427e	d5300422b42b6fc65e3213972d51d901	d41d8cd98f00b204e9800998ecf8427e	NULL	d41d8cd98f00b204e9800998ecf8427e
ob1.oblog.next_dml;
[R0] BEGIN;[R0] org_cluster_id:1;[R1] record_type:UPDATE;[R1] database_name:oblog_tt.oblog_db1;[R1] table_name:t1;[R1] log_event:true;[R1] column_count:9;[R1] source_category:SRC_FULL_RECORDED;[R1] source_type:SRC_OCEANBASE_1_0;[R1] has_pk:true;[R1] pk_info:(0);[R1] pks:pk;[R1] has_uk:false;[R1] uk_info:(null);[R1] uks:(null);[R1] [C1] column_name:pk;[R1] [C1] column_type:MYSQL_TYPE_LONG;[R1] [C1] column_is_rowkey:true;[R1] [C1] column_is_signed:true;[R1] [C1] column_encoding:binary;[R1] [C1] column_is_not_null:true;[R1] [C1] column_value_new:[4](1);[R1] [C1] column_value_old:[4](1);[R1] [C2] column_name:tiny_text;[R1] [C2] column_type:MYSQL_TYPE_TINY_BLOB;[R1] [C2] column_is_rowkey:false;[R1] [C2] column_is_signed:true;[R1] [C2] column_encoding:utf8mb4;[R1] [C2] column_is_not_null:false;[R1] [C2] column_value_new_origin: PADDING;[R1] [C2] column_value_new_md5:[NULL](0);[R1] [C2] column_value_old_origin: PADDING;[R1] [C2] column_value_old_md5:[NULL](0);[R1] [C3] column_name:tiny_blob;[R1] [C3] column_type:MYSQL_TYPE_TINY_BLOB;[R1] [C3] column_is_rowkey:false;[R1] [C3] column_is_signed:true;[R1] [C3] column_encoding:binary;[R1] [C3] column_is_not_null:false;[R1] [C3] column_value_new_origin: PADDING;[R1] [C3] column_value_new_md5:[NULL](0);[R1] [C3] column_value_old_origin: PADDING;[R1] [C3] column_value_old_md5:[NULL](0);[R1] [C4] column_name:text_type;[R1] [C4] column_type:MYSQL_TYPE_BLOB;[R1] [C4] column_is_rowkey:false;[R1] [C4] column_is_signed:true;[R1] [C4] column_encoding:utf8mb4;[R1] [C4] column_is_not_null:false;[R1] [C4] column_value_new_origin: PADDING;[R1] [C4] column_value_new_md5:[NULL](0);[R1] [C4] column_value_old_origin: PADDING;[R1] [C4] column_value_old_md5:[NULL](0);[R1] [C5] column_name:blob_type;[R1] [C5] column_type:MYSQL_TYPE_BLOB;[R1] [C5] column_is_rowkey:false;[R1] [C5] column_is_signed:true;[R1] [C5] column_encoding:binary;[R1] [C5] column_is_not_null:false;[R1] [C5] column_value_new_origin: PADDING;[R1] [C5] column_value_new_md5:[NULL](0);[R1] [C5] column_value_old_origin: PADDING;[R1] [C5] column_value_old_md5:[NULL](0);[R1] [C6] column_name:medium_text;[R1] [C6] column_type:MYSQL_TYPE_MEDIUM_BLOB;[R1] [C6] column_is_rowkey:false;[R1] [C6] column_is_signed:true;[R1] [C6] column_encoding:utf8mb4;[R1] [C6] column_is_not_null:false;[R1] [C6] column_value_new_origin: PADDING;[R1] [C6] column_value_new_md5:[NULL](0);[R1] [C6] column_value_old_origin: PADDING;[R1] [C6] column_value_old_md5:[NULL](0);[R1] [C7] column_name:medium_blob;[R1] [C7] column_type:MYSQL_TYPE_MEDIUM_BLOB;[R1] [C7] column_is_rowkey:false;[R1] [C7] column_is_signed:true;[R1] [C7] column_encoding:binary;[R1] [C7] column_is_not_null:false;[R1] [C7] column_value_new_origin: PADDING;[R1] [C7] column_value_new_md5:[NULL](0);[R1] [C7] column_value_old_origin: PADDING;[R1] [C7] column_value_old_md5:[NULL](0);[R1] [C8] column_name:long_text;[R1] [C8] column_type:MYSQL_TYPE_LONG_BLOB;[R1] [C8] column_is_rowkey:false;[R1] [C8] column_is_signed:true;[R1] [C8] column_encoding:utf8mb4;[R1] [C8] column_is_not_null:false;[R1] [C8] column_value_new_md5:[NULL](0);[R1] [C8] column_value_old_md5:[d41d8cd98f00b204e9800998ecf8427e](0);[R1] [C9] column_name:long_blob;[R1] [C9] column_type:MYSQL_TYPE_LONG_BLOB;[R1] [C9] column_is_rowkey:false;[R1] [C9] column_is_signed:true;[R1] [C9] column_encoding:binary;[R1] [C9] column_is_not_null:false;[R1] [C9] column_value_new_md5:[d41d8cd98f00b204e9800998ecf8427e](0);[R1] [C9] column_value_old_md5:[NULL](0);$[R2] COMMIT;
update t1 set long_text= repeat('a', 50331647), long_blob = repeat('b', 50331647) where pk = 4;
select pk, md5(tiny_text), md5(tiny_blob), md5(text_type), md5(blob_type), md5(medium_text), md5(medium_blob), md5(long_text), md5(long_blob) from t1 where pk=4;
pk	md5(tiny_text)	md5(tiny_blob)	md5(text_type)	md5(blob_type)	md5(medium_text)	md5(medium_blob)	md5(long_text)	md5(long_blob)
4	d41d8cd98f00b204e9800998ecf8427e	d41d8cd98f00b204e9800998ecf8427e	16a9e4895c6169a9a8da828f6d4b4896	d41d8cd98f00b204e9800998ecf8427e	d5300422b42b6fc65e3213972d51d901	d41d8cd98f00b204e9800998ecf8427e	c57d4c3741dc0eb85d767497f9736503	2382bbd355b1c0377240e1d1f79b6081
ob1.oblog.next_dml;
[R0] BEGIN;[R0] org_cluster_id:1;[R1] record_type:UPDATE;[R1] database_name:oblog_tt.oblog_db1;[R1] table_name:t1;[R1] log_event:true;[R1] column_count:9;[R1] source_category:SRC_FULL_RECORDED;[R1] source_type:SRC_OCEANBASE_1_0;[R1] has_pk:true;[R1] pk_info:(0);[R1] pks:pk;[R1] has_uk:false;[R1] uk_info:(null);[R1] uks:(null);[R1] [C1] column_name:pk;[R1] [C1] column_type:MYSQL_TYPE_LONG;[R1] [C1] column_is_rowkey:true;[R1] [C1] column_is_signed:true;[R1] [C1] column_encoding:binary;[R1] [C1] column_is_not_null:true;[R1] [C1] column_value_new:[4](1);[R1] [C1] column_value_old:[4](1);[R1] [C2] column_name:tiny_text;[R1] [C2] column_type:MYSQL_TYPE_TINY_BLOB;[R1] [C2] column_is_rowkey:false;[R1] [C2] column_is_signed:true;[R1] [C2] column_encoding:utf8mb4;[R1] [C2] column_is_not_null:false;[R1] [C2] column_value_new_origin: PADDING;[R1] [C2] column_value_new_md5:[NULL](0);[R1] [C2] column_value_old_origin: PADDING;[R1] [C2] column_value_old_md5:[NULL](0);[R1] [C3] column_name:tiny_blob;[R1] [C3] column_type:MYSQL_TYPE_TINY_BLOB;[R1] [C3] column_is_rowkey:false;[R1] [C3] column_is_signed:true;[R1] [C3] column_encoding:binary;[R1] [C3] column_is_not_null:false;[R1] [C3] column_value_new_origin: PADDING;[R1] [C3] column_value_new_md5:[NULL](0);[R1] [C3] column_value_old_origin: PADDING;[R1] [C3] column_value_old_md5:[NULL](0);[R1] [C4] column_name:text_type;[R1] [C4] column_type:MYSQL_TYPE_BLOB;[R1] [C4] column_is_rowkey:false;[R1] [C4] column_is_signed:true;[R1] [C4] column_encoding:utf8mb4;[R1] [C4] column_is_not_null:false;[R1] [C4] column_value_new_origin: PADDING;[R1] [C4] column_value_new_md5:[NULL](0);[R1] [C4] column_value_old_origin: PADDING;[R1] [C4] column_value_old_md5:[NULL](0);[R1] [C5] column_name:blob_type;[R1] [C5] column_type:MYSQL_TYPE_BLOB;[R1] [C5] column_is_rowkey:false;[R1] [C5] column_is_signed:true;[R1] [C5] column_encoding:binary;[R1] [C5] column_is_not_null:false;[R1] [C5] column_value_new_origin: PADDING;[R1] [C5] column_value_new_md5:[NULL](0);[R1] [C5] column_value_old_origin: PADDING;[R1] [C5] column_value_old_md5:[NULL](0);[R1] [C6] column_name:medium_text;[R1] [C6] column_type:MYSQL_TYPE_MEDIUM_BLOB;[R1] [C6] column_is_rowkey:false;[R1] [C6] column_is_signed:true;[R1] [C6] column_encoding:utf8mb4;[R1] [C6] column_is_not_null:false;[R1] [C6] column_value_new_origin: PADDING;[R1] [C6] column_value_new_md5:[NULL](0);[R1] [C6] column_value_old_origin: PADDING;[R1] [C6] column_value_old_md5:[NULL](0);[R1] [C7] column_name:medium_blob;[R1] [C7] column_type:MYSQL_TYPE_MEDIUM_BLOB;[R1] [C7] column_is_rowkey:false;[R1] [C7] column_is_signed:true;[R1] [C7] column_encoding:binary;[R1] [C7] column_is_not_null:false;[R1] [C7] column_value_new_origin: PADDING;[R1] [C7] column_value_new_md5:[NULL](0);[R1] [C7] column_value_old_origin: PADDING;[R1] [C7] column_value_old_md5:[NULL](0);[R1] [C8] column_name:long_text;[R1] [C8] column_type:MYSQL_TYPE_LONG_BLOB;[R1] [C8] column_is_rowkey:false;[R1] [C8] column_is_signed:true;[R1] [C8] column_encoding:utf8mb4;[R1] [C8] column_is_not_null:false;[R1] [C8] column_value_new_md5:[c57d4c3741dc0eb85d767497f9736503](50331647);[R1] [C8] column_value_old_md5:[NULL](0);[R1] [C9] column_name:long_blob;[R1] [C9] column_type:MYSQL_TYPE_LONG_BLOB;[R1] [C9] column_is_rowkey:false;[R1] [C9] column_is_signed:true;[R1] [C9] column_encoding:binary;[R1] [C9] column_is_not_null:false;[R1] [C9] column_value_new_md5:[2382bbd355b1c0377240e1d1f79b6081](50331647);[R1] [C9] column_value_old_md5:[d41d8cd98f00b204e9800998ecf8427e](0);$[R2] COMMIT;
update t1 set long_text= "OceanBase", long_blob = "OceanBase CDC" where pk = 4;
select pk, md5(tiny_text), md5(tiny_blob), md5(text_type), md5(blob_type), md5(medium_text), md5(medium_blob), md5(long_text), md5(long_blob) from t1 where pk=4;
pk	md5(tiny_text)	md5(tiny_blob)	md5(text_type)	md5(blob_type)	md5(medium_text)	md5(medium_blob)	md5(long_text)	md5(long_blob)
4	d41d8cd98f00b204e9800998ecf8427e	d41d8cd98f00b204e9800998ecf8427e	16a9e4895c6169a9a8da828f6d4b4896	d41d8cd98f00b204e9800998ecf8427e	d5300422b42b6fc65e3213972d51d901	d41d8cd98f00b204e9800998ecf8427e	f75702e1f9894f0e15cb45faae9ed0fc	36a03906ff74e6e496273de4b509bd39
ob1.oblog.next_dml;
[R0] BEGIN;[R0] org_cluster_id:1;[R1] record_type:UPDATE;[R1] database_name:oblog_tt.oblog_db1;[R1] table_name:t1;[R1] log_event:true;[R1] column_count:9;[R1] source_category:SRC_FULL_RECORDED;[R1] source_type:SRC_OCEANBASE_1_0;[R1] has_pk:true;[R1] pk_info:(0);[R1] pks:pk;[R1] has_uk:false;[R1] uk_info:(null);[R1] uks:(null);[R1] [C1] column_name:pk;[R1] [C1] column_type:MYSQL_TYPE_LONG;[R1] [C1] column_is_rowkey:true;[R1] [C1] column_is_signed:true;[R1] [C1] column_encoding:binary;[R1] [C1] column_is_not_null:true;[R1] [C1] column_value_new:[4](1);[R1] [C1] column_value_old:[4](1);[R1] [C2] column_name:tiny_text;[R1] [C2] column_type:MYSQL_TYPE_TINY_BLOB;[R1] [C2] column_is_rowkey:false;[R1] [C2] column_is_signed:true;[R1] [C2] column_encoding:utf8mb4;[R1] [C2] column_is_not_null:false;[R1] [C2] column_value_new_origin: PADDING;[R1] [C2] column_value_new_md5:[NULL](0);[R1] [C2] column_value_old_origin: PADDING;[R1] [C2] column_value_old_md5:[NULL](0);[R1] [C3] column_name:tiny_blob;[R1] [C3] column_type:MYSQL_TYPE_TINY_BLOB;[R1] [C3] column_is_rowkey:false;[R1] [C3] column_is_signed:true;[R1] [C3] column_encoding:binary;[R1] [C3] column_is_not_null:false;[R1] [C3] column_value_new_origin: PADDING;[R1] [C3] column_value_new_md5:[NULL](0);[R1] [C3] column_value_old_origin: PADDING;[R1] [C3] column_value_old_md5:[NULL](0);[R1] [C4] column_name:text_type;[R1] [C4] column_type:MYSQL_TYPE_BLOB;[R1] [C4] column_is_rowkey:false;[R1] [C4] column_is_signed:true;[R1] [C4] column_encoding:utf8mb4;[R1] [C4] column_is_not_null:false;[R1] [C4] column_value_new_origin: PADDING;[R1] [C4] column_value_new_md5:[NULL](0);[R1] [C4] column_value_old_origin: PADDING;[R1] [C4] column_value_old_md5:[NULL](0);[R1] [C5] column_name:blob_type;[R1] [C5] column_type:MYSQL_TYPE_BLOB;[R1] [C5] column_is_rowkey:false;[R1] [C5] column_is_signed:true;[R1] [C5] column_encoding:binary;[R1] [C5] column_is_not_null:false;[R1] [C5] column_value_new_origin: PADDING;[R1] [C5] column_value_new_md5:[NULL](0);[R1] [C5] column_value_old_origin: PADDING;[R1] [C5] column_value_old_md5:[NULL](0);[R1] [C6] column_name:medium_text;[R1] [C6] column_type:MYSQL_TYPE_MEDIUM_BLOB;[R1] [C6] column_is_rowkey:false;[R1] [C6] column_is_signed:true;[R1] [C6] column_encoding:utf8mb4;[R1] [C6] column_is_not_null:false;[R1] [C6] column_value_new_origin: PADDING;[R1] [C6] column_value_new_md5:[NULL](0);[R1] [C6] column_value_old_origin: PADDING;[R1] [C6] column_value_old_md5:[NULL](0);[R1] [C7] column_name:medium_blob;[R1] [C7] column_type:MYSQL_TYPE_MEDIUM_BLOB;[R1] [C7] column_is_rowkey:false;[R1] [C7] column_is_signed:true;[R1] [C7] column_encoding:binary;[R1] [C7] column_is_not_null:false;[R1] [C7] column_value_new_origin: PADDING;[R1] [C7] column_value_new_md5:[NULL](0);[R1] [C7] column_value_old_origin: PADDING;[R1] [C7] column_value_old_md5:[NULL](0);[R1] [C8] column_name:long_text;[R1] [C8] column_type:MYSQL_TYPE_LONG_BLOB;[R1] [C8] column_is_rowkey:false;[R1] [C8] column_is_signed:true;[R1] [C8] column_encoding:utf8mb4;[R1] [C8] column_is_not_null:false;[R1] [C8] column_value_new_md5:[f75702e1f9894f0e15cb45faae9ed0fc](9);[R1] [C8] column_value_old_origin: PADDING;[R1] [C8] column_value_old_md5:[NULL](0);[R1] [C9] column_name:long_blob;[R1] [C9] column_type:MYSQL_TYPE_LONG_BLOB;[R1] [C9] column_is_rowkey:false;[R1] [C9] column_is_signed:true;[R1] [C9] column_encoding:binary;[R1] [C9] column_is_not_null:false;[R1] [C9] column_value_new_md5:[36a03906ff74e6e496273de4b509bd39](13);[R1] [C9] column_value_old_origin: PADDING;[R1] [C9] column_value_old_md5:[NULL](0);$[R2] COMMIT;
delete from t1 where pk=3;
ob1.oblog.next_dml;
[R0] BEGIN;[R0] org_cluster_id:1;[R1] record_type:DELETE;[R1] database_name:oblog_tt.oblog_db1;[R1] table_name:t1;[R1] log_event:true;[R1] column_count:9;[R1] source_category:SRC_FULL_RECORDED;[R1] source_type:SRC_OCEANBASE_1_0;[R1] has_pk:true;[R1] pk_info:(0);[R1] pks:pk;[R1] has_uk:false;[R1] uk_info:(null);[R1] uks:(null);[R1] [C1] column_name:pk;[R1] [C1] column_type:MYSQL_TYPE_LONG;[R1] [C1] column_is_rowkey:true;[R1] [C1] column_is_signed:true;[R1] [C1] column_encoding:binary;[R1] [C1] column_is_not_null:true;[R1] [C1] column_value_old:[3](1);[R1] [C2] column_name:tiny_text;[R1] [C2] column_type:MYSQL_TYPE_TINY_BLOB;[R1] [C2] column_is_rowkey:false;[R1] [C2] column_is_signed:true;[R1] [C2] column_encoding:utf8mb4;[R1] [C2] column_is_not_null:false;[R1] [C2] column_value_old_origin: PADDING;[R1] [C2] column_value_old_md5:[NULL](0);[R1] [C3] column_name:tiny_blob;[R1] [C3] column_type:MYSQL_TYPE_TINY_BLOB;[R1] [C3] column_is_rowkey:false;[R1] [C3] column_is_signed:true;[R1] [C3] column_encoding:binary;[R1] [C3] column_is_not_null:false;[R1] [C3] column_value_old_origin: PADDING;[R1] [C3] column_value_old_md5:[NULL](0);[R1] [C4] column_name:text_type;[R1] [C4] column_type:MYSQL_TYPE_BLOB;[R1] [C4] column_is_rowkey:false;[R1] [C4] column_is_signed:true;[R1] [C4] column_encoding:utf8mb4;[R1] [C4] column_is_not_null:false;[R1] [C4] column_value_old_md5:[d41d8cd98f00b204e9800998ecf8427e](0);[R1] [C5] column_name:blob_type;[R1] [C5] column_type:MYSQL_TYPE_BLOB;[R1] [C5] column_is_rowkey:false;[R1] [C5] column_is_signed:true;[R1] [C5] column_encoding:binary;[R1] [C5] column_is_not_null:false;[R1] [C5] column_value_old_md5:[d41d8cd98f00b204e9800998ecf8427e](0);[R1] [C6] column_name:medium_text;[R1] [C6] column_type:MYSQL_TYPE_MEDIUM_BLOB;[R1] [C6] column_is_rowkey:false;[R1] [C6] column_is_signed:true;[R1] [C6] column_encoding:utf8mb4;[R1] [C6] column_is_not_null:false;[R1] [C6] column_value_old_md5:[d41d8cd98f00b204e9800998ecf8427e](0);[R1] [C7] column_name:medium_blob;[R1] [C7] column_type:MYSQL_TYPE_MEDIUM_BLOB;[R1] [C7] column_is_rowkey:false;[R1] [C7] column_is_signed:true;[R1] [C7] column_encoding:binary;[R1] [C7] column_is_not_null:false;[R1] [C7] column_value_old_md5:[d41d8cd98f00b204e9800998ecf8427e](0);[R1] [C8] column_name:long_text;[R1] [C8] column_type:MYSQL_TYPE_LONG_BLOB;[R1] [C8] column_is_rowkey:false;[R1] [C8] column_is_signed:true;[R1] [C8] column_encoding:utf8mb4;[R1] [C8] column_is_not_null:false;[R1] [C8] column_value_old_origin: PADDING;[R1] [C8] column_value_old_md5:[NULL](0);[R1] [C9] column_name:long_blob;[R1] [C9] column_type:MYSQL_TYPE_LONG_BLOB;[R1] [C9] column_is_rowkey:false;[R1] [C9] column_is_signed:true;[R1] [C9] column_encoding:binary;[R1] [C9] column_is_not_null:false;[R1] [C9] column_value_old_origin: PADDING;[R1] [C9] column_value_old_md5:[NULL](0);$[R2] COMMIT;
delete from t1 where pk=4;
ob1.oblog.next_dml;
[R0] BEGIN;[R0] org_cluster_id:1;[R1] record_type:DELETE;[R1] database_name:oblog_tt.oblog_db1;[R1] table_name:t1;[R1] log_event:true;[R1] column_count:9;[R1] source_category:SRC_FULL_RECORDED;[R1] source_type:SRC_OCEANBASE_1_0;[R1] has_pk:true;[R1] pk_info:(0);[R1] pks:pk;[R1] has_uk:false;[R1] uk_info:(null);[R1] uks:(null);[R1] [C1] column_name:pk;[R1] [C1] column_type:MYSQL_TYPE_LONG;[R1] [C1] column_is_rowkey:true;[R1] [C1] column_is_signed:true;[R1] [C1] column_encoding:binary;[R1] [C1] column_is_not_null:true;[R1] [C1] column_value_old:[4](1);[R1] [C2] column_name:tiny_text;[R1] [C2] column_type:MYSQL_TYPE_TINY_BLOB;[R1] [C2] column_is_rowkey:false;[R1] [C2] column_is_signed:true;[R1] [C2] column_encoding:utf8mb4;[R1] [C2] column_is_not_null:false;[R1] [C2] column_value_old_origin: PADDING;[R1] [C2] column_value_old_md5:[NULL](0);[R1] [C3] column_name:tiny_blob;[R1] [C3] column_type:MYSQL_TYPE_TINY_BLOB;[R1] [C3] column_is_rowkey:false;[R1] [C3] column_is_signed:true;[R1] [C3] column_encoding:binary;[R1] [C3] column_is_not_null:false;[R1] [C3] column_value_old_origin: PADDING;[R1] [C3] column_value_old_md5:[NULL](0);[R1] [C4] column_name:text_type;[R1] [C4] column_type:MYSQL_TYPE_BLOB;[R1] [C4] column_is_rowkey:false;[R1] [C4] column_is_signed:true;[R1] [C4] column_encoding:utf8mb4;[R1] [C4] column_is_not_null:false;[R1] [C4] column_value_old_origin: PADDING;[R1] [C4] column_value_old_md5:[NULL](0);[R1] [C5] column_name:blob_type;[R1] [C5] column_type:MYSQL_TYPE_BLOB;[R1] [C5] column_is_rowkey:false;[R1] [C5] column_is_signed:true;[R1] [C5] column_encoding:binary;[R1] [C5] column_is_not_null:false;[R1] [C5] column_value_old_md5:[d41d8cd98f00b204e9800998ecf8427e](0);[R1] [C6] column_name:medium_text;[R1] [C6] column_type:MYSQL_TYPE_MEDIUM_BLOB;[R1] [C6] column_is_rowkey:false;[R1] [C6] column_is_signed:true;[R1] [C6] column_encoding:utf8mb4;[R1] [C6] column_is_not_null:false;[R1] [C6] column_value_old_origin: PADDING;[R1] [C6] column_value_old_md5:[NULL](0);[R1] [C7] column_name:medium_blob;[R1] [C7] column_type:MYSQL_TYPE_MEDIUM_BLOB;[R1] [C7] column_is_rowkey:false;[R1] [C7] column_is_signed:true;[R1] [C7] column_encoding:binary;[R1] [C7] column_is_not_null:false;[R1] [C7] column_value_old_md5:[d41d8cd98f00b204e9800998ecf8427e](0);[R1] [C8] column_name:long_text;[R1] [C8] column_type:MYSQL_TYPE_LONG_BLOB;[R1] [C8] column_is_rowkey:false;[R1] [C8] column_is_signed:true;[R1] [C8] column_encoding:utf8mb4;[R1] [C8] column_is_not_null:false;[R1] [C8] column_value_old_md5:[f75702e1f9894f0e15cb45faae9ed0fc](9);[R1] [C9] column_name:long_blob;[R1] [C9] column_type:MYSQL_TYPE_LONG_BLOB;[R1] [C9] column_is_rowkey:false;[R1] [C9] column_is_signed:true;[R1] [C9] column_encoding:binary;[R1] [C9] column_is_not_null:false;[R1] [C9] column_value_old_md5:[36a03906ff74e6e496273de4b509bd39](13);$[R2] COMMIT;
ob1.oblog.stop;
ob1.oblog.set_start_tstamp_usec $start_tstamp_usec;
ob1.oblog.gen_conf tb_white_list=oblog_tt.*.* log_level=DEBUG fetching_log_mode=direct meta_data_refresh_mode=data_dict archive_dest=$log_backup_dest;
ob1.oblog.set_extra_argument -m;
ob1.oblog.restart;
ob1.oblog.next_dml;
[R0] BEGIN;[R0] org_cluster_id:1;[R1] record_type:INSERT;[R1] database_name:oblog_tt.oblog_db1;[R1] table_name:t1;[R1] log_event:true;[R1] column_count:9;[R1] source_category:SRC_FULL_RECORDED;[R1] source_type:SRC_OCEANBASE_1_0;[R1] has_pk:true;[R1] pk_info:(0);[R1] pks:pk;[R1] has_uk:false;[R1] uk_info:(null);[R1] uks:(null);[R1] [C1] column_name:pk;[R1] [C1] column_type:MYSQL_TYPE_LONG;[R1] [C1] column_is_rowkey:true;[R1] [C1] column_is_signed:true;[R1] [C1] column_encoding:binary;[R1] [C1] column_is_not_null:true;[R1] [C1] column_value_new:[1](1);[R1] [C2] column_name:tiny_text;[R1] [C2] column_type:MYSQL_TYPE_TINY_BLOB;[R1] [C2] column_is_rowkey:false;[R1] [C2] column_is_signed:true;[R1] [C2] column_encoding:utf8mb4;[R1] [C2] column_is_not_null:false;[R1] [C2] column_value_new_md5:[d41d8cd98f00b204e9800998ecf8427e](0);[R1] [C3] column_name:tiny_blob;[R1] [C3] column_type:MYSQL_TYPE_TINY_BLOB;[R1] [C3] column_is_rowkey:false;[R1] [C3] column_is_signed:true;[R1] [C3] column_encoding:binary;[R1] [C3] column_is_not_null:false;[R1] [C3] column_value_new_md5:[d41d8cd98f00b204e9800998ecf8427e](0);[R1] [C4] column_name:text_type;[R1] [C4] column_type:MYSQL_TYPE_BLOB;[R1] [C4] column_is_rowkey:false;[R1] [C4] column_is_signed:true;[R1] [C4] column_encoding:utf8mb4;[R1] [C4] column_is_not_null:false;[R1] [C4] column_value_new_md5:[d41d8cd98f00b204e9800998ecf8427e](0);[R1] [C5] column_name:blob_type;[R1] [C5] column_type:MYSQL_TYPE_BLOB;[R1] [C5] column_is_rowkey:false;[R1] [C5] column_is_signed:true;[R1] [C5] column_encoding:binary;[R1] [C5] column_is_not_null:false;[R1] [C5] column_value_new_md5:[d41d8cd98f00b204e9800998ecf8427e](0);[R1] [C6] column_name:medium_text;[R1] [C6] column_type:MYSQL_TYPE_MEDIUM_BLOB;[R1] [C6] column_is_rowkey:false;[R1] [C6] column_is_signed:true;[R1] [C6] column_encoding:utf8mb4;[R1] [C6] column_is_not_null:false;[R1] [C6] column_value_new_md5:[d41d8cd98f00b204e9800998ecf8427e](0);[R1] [C7] column_name:medium_blob;[R1] [C7] column_type:MYSQL_TYPE_MEDIUM_BLOB;[R1] [C7] column_is_rowkey:false;[R1] [C7] column_is_signed:true;[R1] [C7] column_encoding:binary;[R1] [C7] column_is_not_null:false;[R1] [C7] column_value_new_md5:[d41d8cd98f00b204e9800998ecf8427e](0);[R1] [C8] column_name:long_text;[R1] [C8] column_type:MYSQL_TYPE_LONG_BLOB;[R1] [C8] column_is_rowkey:false;[R1] [C8] column_is_signed:true;[R1] [C8] column_encoding:utf8mb4;[R1] [C8] column_is_not_null:false;[R1] [C8] column_value_new_md5:[c57d4c3741dc0eb85d767497f9736503](50331647);[R1] [C9] column_name:long_blob;[R1] [C9] column_type:MYSQL_TYPE_LONG_BLOB;[R1] [C9] column_is_rowkey:false;[R1] [C9] column_is_signed:true;[R1] [C9] column_encoding:binary;[R1] [C9] column_is_not_null:false;[R1] [C9] column_value_new_md5:[d41d8cd98f00b204e9800998ecf8427e](0);$[R2] COMMIT;
ob1.oblog.next_dml;
[R0] BEGIN;[R0] org_cluster_id:1;[R1] record_type:INSERT;[R1] database_name:oblog_tt.oblog_db1;[R1] table_name:t1;[R1] log_event:true;[R1] column_count:9;[R1] source_category:SRC_FULL_RECORDED;[R1] source_type:SRC_OCEANBASE_1_0;[R1] has_pk:true;[R1] pk_info:(0);[R1] pks:pk;[R1] has_uk:false;[R1] uk_info:(null);[R1] uks:(null);[R1] [C1] column_name:pk;[R1] [C1] column_type:MYSQL_TYPE_LONG;[R1] [C1] column_is_rowkey:true;[R1] [C1] column_is_signed:true;[R1] [C1] column_encoding:binary;[R1] [C1] column_is_not_null:true;[R1] [C1] column_value_new:[2](1);[R1] [C2] column_name:tiny_text;[R1] [C2] column_type:MYSQL_TYPE_TINY_BLOB;[R1] [C2] column_is_rowkey:false;[R1] [C2] column_is_signed:true;[R1] [C2] column_encoding:utf8mb4;[R1] [C2] column_is_not_null:false;[R1] [C2] column_value_new_md5:[d41d8cd98f00b204e9800998ecf8427e](0);[R1] [C3] column_name:tiny_blob;[R1] [C3] column_type:MYSQL_TYPE_TINY_BLOB;[R1] [C3] column_is_rowkey:false;[R1] [C3] column_is_signed:true;[R1] [C3] column_encoding:binary;[R1] [C3] column_is_not_null:false;[R1] [C3] column_value_new_md5:[d41d8cd98f00b204e9800998ecf8427e](0);[R1] [C4] column_name:text_type;[R1] [C4] column_type:MYSQL_TYPE_BLOB;[R1] [C4] column_is_rowkey:false;[R1] [C4] column_is_signed:true;[R1] [C4] column_encoding:utf8mb4;[R1] [C4] column_is_not_null:false;[R1] [C4] column_value_new_md5:[d41d8cd98f00b204e9800998ecf8427e](0);[R1] [C5] column_name:blob_type;[R1] [C5] column_type:MYSQL_TYPE_BLOB;[R1] [C5] column_is_rowkey:false;[R1] [C5] column_is_signed:true;[R1] [C5] column_encoding:binary;[R1] [C5] column_is_not_null:false;[R1] [C5] column_value_new_md5:[d41d8cd98f00b204e9800998ecf8427e](0);[R1] [C6] column_name:medium_text;[R1] [C6] column_type:MYSQL_TYPE_MEDIUM_BLOB;[R1] [C6] column_is_rowkey:false;[R1] [C6] column_is_signed:true;[R1] [C6] column_encoding:utf8mb4;[R1] [C6] column_is_not_null:false;[R1] [C6] column_value_new_md5:[d41d8cd98f00b204e9800998ecf8427e](0);[R1] [C7] column_name:medium_blob;[R1] [C7] column_type:MYSQL_TYPE_MEDIUM_BLOB;[R1] [C7] column_is_rowkey:false;[R1] [C7] column_is_signed:true;[R1] [C7] column_encoding:binary;[R1] [C7] column_is_not_null:false;[R1] [C7] column_value_new_md5:[d41d8cd98f00b204e9800998ecf8427e](0);[R1] [C8] column_name:long_text;[R1] [C8] column_type:MYSQL_TYPE_LONG_BLOB;[R1] [C8] column_is_rowkey:false;[R1] [C8] column_is_signed:true;[R1] [C8] column_encoding:utf8mb4;[R1] [C8] column_is_not_null:false;[R1] [C8] column_value_new_md5:[2382bbd355b1c0377240e1d1f79b6081](50331647);[R1] [C9] column_name:long_blob;[R1] [C9] column_type:MYSQL_TYPE_LONG_BLOB;[R1] [C9] column_is_rowkey:false;[R1] [C9] column_is_signed:true;[R1] [C9] column_encoding:binary;[R1] [C9] column_is_not_null:false;[R1] [C9] column_value_new_md5:[d41d8cd98f00b204e9800998ecf8427e](0);$[R2] COMMIT;
ob1.oblog.next_dml;
[R0] BEGIN;[R0] org_cluster_id:1;[R1] record_type:INSERT;[R1] database_name:oblog_tt.oblog_db1;[R1] table_name:t1;[R1] log_event:true;[R1] column_count:9;[R1] source_category:SRC_FULL_RECORDED;[R1] source_type:SRC_OCEANBASE_1_0;[R1] has_pk:true;[R1] pk_info:(0);[R1] pks:pk;[R1] has_uk:false;[R1] uk_info:(null);[R1] uks:(null);[R1] [C1] column_name:pk;[R1] [C1] column_type:MYSQL_TYPE_LONG;[R1] [C1] column_is_rowkey:true;[R1] [C1] column_is_signed:true;[R1] [C1] column_encoding:binary;[R1] [C1] column_is_not_null:true;[R1] [C1] column_value_new:[3](1);[R1] [C2] column_name:tiny_text;[R1] [C2] column_type:MYSQL_TYPE_TINY_BLOB;[R1] [C2] column_is_rowkey:false;[R1] [C2] column_is_signed:true;[R1] [C2] column_encoding:utf8mb4;[R1] [C2] column_is_not_null:false;[R1] [C2] column_value_new_md5:[d41d8cd98f00b204e9800998ecf8427e](0);[R1] [C3] column_name:tiny_blob;[R1] [C3] column_type:MYSQL_TYPE_TINY_BLOB;[R1] [C3] column_is_rowkey:false;[R1] [C3] column_is_signed:true;[R1] [C3] column_encoding:binary;[R1] [C3] column_is_not_null:false;[R1] [C3] column_value_new_md5:[d41d8cd98f00b204e9800998ecf8427e](0);[R1] [C4] column_name:text_type;[R1] [C4] column_type:MYSQL_TYPE_BLOB;[R1] [C4] column_is_rowkey:false;[R1] [C4] column_is_signed:true;[R1] [C4] column_encoding:utf8mb4;[R1] [C4] column_is_not_null:false;[R1] [C4] column_value_new_md5:[d41d8cd98f00b204e9800998ecf8427e](0);[R1] [C5] column_name:blob_type;[R1] [C5] column_type:MYSQL_TYPE_BLOB;[R1] [C5] column_is_rowkey:false;[R1] [C5] column_is_signed:true;[R1] [C5] column_encoding:binary;[R1] [C5] column_is_not_null:false;[R1] [C5] column_value_new_md5:[d41d8cd98f00b204e9800998ecf8427e](0);[R1] [C6] column_name:medium_text;[R1] [C6] column_type:MYSQL_TYPE_MEDIUM_BLOB;[R1] [C6] column_is_rowkey:false;[R1] [C6] column_is_signed:true;[R1] [C6] column_encoding:utf8mb4;[R1] [C6] column_is_not_null:false;[R1] [C6] column_value_new_md5:[d41d8cd98f00b204e9800998ecf8427e](0);[R1] [C7] column_name:medium_blob;[R1] [C7] column_type:MYSQL_TYPE_MEDIUM_BLOB;[R1] [C7] column_is_rowkey:false;[R1] [C7] column_is_signed:true;[R1] [C7] column_encoding:binary;[R1] [C7] column_is_not_null:false;[R1] [C7] column_value_new_md5:[d41d8cd98f00b204e9800998ecf8427e](0);[R1] [C8] column_name:long_text;[R1] [C8] column_type:MYSQL_TYPE_LONG_BLOB;[R1] [C8] column_is_rowkey:false;[R1] [C8] column_is_signed:true;[R1] [C8] column_encoding:utf8mb4;[R1] [C8] column_is_not_null:false;[R1] [C8] column_value_new_md5:[c57d4c3741dc0eb85d767497f9736503](50331647);[R1] [C9] column_name:long_blob;[R1] [C9] column_type:MYSQL_TYPE_LONG_BLOB;[R1] [C9] column_is_rowkey:false;[R1] [C9] column_is_signed:true;[R1] [C9] column_encoding:binary;[R1] [C9] column_is_not_null:false;[R1] [C9] column_value_new_md5:[2382bbd355b1c0377240e1d1f79b6081](50331647);$[R2] COMMIT;
ob1.oblog.next_dml;
[R0] BEGIN;[R0] org_cluster_id:1;[R1] record_type:UPDATE;[R1] database_name:oblog_tt.oblog_db1;[R1] table_name:t1;[R1] log_event:true;[R1] column_count:9;[R1] source_category:SRC_FULL_RECORDED;[R1] source_type:SRC_OCEANBASE_1_0;[R1] has_pk:true;[R1] pk_info:(0);[R1] pks:pk;[R1] has_uk:false;[R1] uk_info:(null);[R1] uks:(null);[R1] [C1] column_name:pk;[R1] [C1] column_type:MYSQL_TYPE_LONG;[R1] [C1] column_is_rowkey:true;[R1] [C1] column_is_signed:true;[R1] [C1] column_encoding:binary;[R1] [C1] column_is_not_null:true;[R1] [C1] column_value_new:[3](1);[R1] [C1] column_value_old:[3](1);[R1] [C2] column_name:tiny_text;[R1] [C2] column_type:MYSQL_TYPE_TINY_BLOB;[R1] [C2] column_is_rowkey:false;[R1] [C2] column_is_signed:true;[R1] [C2] column_encoding:utf8mb4;[R1] [C2] column_is_not_null:false;[R1] [C2] column_value_new_origin: PADDING;[R1] [C2] column_value_new_md5:[NULL](0);[R1] [C2] column_value_old_origin: PADDING;[R1] [C2] column_value_old_md5:[NULL](0);[R1] [C3] column_name:tiny_blob;[R1] [C3] column_type:MYSQL_TYPE_TINY_BLOB;[R1] [C3] column_is_rowkey:false;[R1] [C3] column_is_signed:true;[R1] [C3] column_encoding:binary;[R1] [C3] column_is_not_null:false;[R1] [C3] column_value_new_origin: PADDING;[R1] [C3] column_value_new_md5:[NULL](0);[R1] [C3] column_value_old_origin: PADDING;[R1] [C3] column_value_old_md5:[NULL](0);[R1] [C4] column_name:text_type;[R1] [C4] column_type:MYSQL_TYPE_BLOB;[R1] [C4] column_is_rowkey:false;[R1] [C4] column_is_signed:true;[R1] [C4] column_encoding:utf8mb4;[R1] [C4] column_is_not_null:false;[R1] [C4] column_value_new_origin: PADDING;[R1] [C4] column_value_new_md5:[NULL](0);[R1] [C4] column_value_old_origin: PADDING;[R1] [C4] column_value_old_md5:[NULL](0);[R1] [C5] column_name:blob_type;[R1] [C5] column_type:MYSQL_TYPE_BLOB;[R1] [C5] column_is_rowkey:false;[R1] [C5] column_is_signed:true;[R1] [C5] column_encoding:binary;[R1] [C5] column_is_not_null:false;[R1] [C5] column_value_new_origin: PADDING;[R1] [C5] column_value_new_md5:[NULL](0);[R1] [C5] column_value_old_origin: PADDING;[R1] [C5] column_value_old_md5:[NULL](0);[R1] [C6] column_name:medium_text;[R1] [C6] column_type:MYSQL_TYPE_MEDIUM_BLOB;[R1] [C6] column_is_rowkey:false;[R1] [C6] column_is_signed:true;[R1] [C6] column_encoding:utf8mb4;[R1] [C6] column_is_not_null:false;[R1] [C6] column_value_new_origin: PADDING;[R1] [C6] column_value_new_md5:[NULL](0);[R1] [C6] column_value_old_origin: PADDING;[R1] [C6] column_value_old_md5:[NULL](0);[R1] [C7] column_name:medium_blob;[R1] [C7] column_type:MYSQL_TYPE_MEDIUM_BLOB;[R1] [C7] column_is_rowkey:false;[R1] [C7] column_is_signed:true;[R1] [C7] column_encoding:binary;[R1] [C7] column_is_not_null:false;[R1] [C7] column_value_new_origin: PADDING;[R1] [C7] column_value_new_md5:[NULL](0);[R1] [C7] column_value_old_origin: PADDING;[R1] [C7] column_value_old_md5:[NULL](0);[R1] [C8] column_name:long_text;[R1] [C8] column_type:MYSQL_TYPE_LONG_BLOB;[R1] [C8] column_is_rowkey:false;[R1] [C8] column_is_signed:true;[R1] [C8] column_encoding:utf8mb4;[R1] [C8] column_is_not_null:false;[R1] [C8] column_value_new_origin: PADDING;[R1] [C8] column_value_new_md5:[NULL](0);[R1] [C8] column_value_old_origin: PADDING;[R1] [C8] column_value_old_md5:[NULL](0);[R1] [C9] column_name:long_blob;[R1] [C9] column_type:MYSQL_TYPE_LONG_BLOB;[R1] [C9] column_is_rowkey:false;[R1] [C9] column_is_signed:true;[R1] [C9] column_encoding:binary;[R1] [C9] column_is_not_null:false;[R1] [C9] column_value_new_md5:[21ac45796075552d5e54ff8c8d45db78](11534336);[R1] [C9] column_value_old_md5:[2382bbd355b1c0377240e1d1f79b6081](50331647);$[R2] COMMIT;
ob1.oblog.next_dml;
[R0] BEGIN;[R0] org_cluster_id:1;[R1] record_type:UPDATE;[R1] database_name:oblog_tt.oblog_db1;[R1] table_name:t1;[R1] log_event:true;[R1] column_count:9;[R1] source_category:SRC_FULL_RECORDED;[R1] source_type:SRC_OCEANBASE_1_0;[R1] has_pk:true;[R1] pk_info:(0);[R1] pks:pk;[R1] has_uk:false;[R1] uk_info:(null);[R1] uks:(null);[R1] [C1] column_name:pk;[R1] [C1] column_type:MYSQL_TYPE_LONG;[R1] [C1] column_is_rowkey:true;[R1] [C1] column_is_signed:true;[R1] [C1] column_encoding:binary;[R1] [C1] column_is_not_null:true;[R1] [C1] column_value_new:[3](1);[R1] [C1] column_value_old:[3](1);[R1] [C2] column_name:tiny_text;[R1] [C2] column_type:MYSQL_TYPE_TINY_BLOB;[R1] [C2] column_is_rowkey:false;[R1] [C2] column_is_signed:true;[R1] [C2] column_encoding:utf8mb4;[R1] [C2] column_is_not_null:false;[R1] [C2] column_value_new_origin: PADDING;[R1] [C2] column_value_new_md5:[NULL](0);[R1] [C2] column_value_old_origin: PADDING;[R1] [C2] column_value_old_md5:[NULL](0);[R1] [C3] column_name:tiny_blob;[R1] [C3] column_type:MYSQL_TYPE_TINY_BLOB;[R1] [C3] column_is_rowkey:false;[R1] [C3] column_is_signed:true;[R1] [C3] column_encoding:binary;[R1] [C3] column_is_not_null:false;[R1] [C3] column_value_new_origin: PADDING;[R1] [C3] column_value_new_md5:[NULL](0);[R1] [C3] column_value_old_origin: PADDING;[R1] [C3] column_value_old_md5:[NULL](0);[R1] [C4] column_name:text_type;[R1] [C4] column_type:MYSQL_TYPE_BLOB;[R1] [C4] column_is_rowkey:false;[R1] [C4] column_is_signed:true;[R1] [C4] column_encoding:utf8mb4;[R1] [C4] column_is_not_null:false;[R1] [C4] column_value_new_origin: PADDING;[R1] [C4] column_value_new_md5:[NULL](0);[R1] [C4] column_value_old_origin: PADDING;[R1] [C4] column_value_old_md5:[NULL](0);[R1] [C5] column_name:blob_type;[R1] [C5] column_type:MYSQL_TYPE_BLOB;[R1] [C5] column_is_rowkey:false;[R1] [C5] column_is_signed:true;[R1] [C5] column_encoding:binary;[R1] [C5] column_is_not_null:false;[R1] [C5] column_value_new_origin: PADDING;[R1] [C5] column_value_new_md5:[NULL](0);[R1] [C5] column_value_old_origin: PADDING;[R1] [C5] column_value_old_md5:[NULL](0);[R1] [C6] column_name:medium_text;[R1] [C6] column_type:MYSQL_TYPE_MEDIUM_BLOB;[R1] [C6] column_is_rowkey:false;[R1] [C6] column_is_signed:true;[R1] [C6] column_encoding:utf8mb4;[R1] [C6] column_is_not_null:false;[R1] [C6] column_value_new_origin: PADDING;[R1] [C6] column_value_new_md5:[NULL](0);[R1] [C6] column_value_old_origin: PADDING;[R1] [C6] column_value_old_md5:[NULL](0);[R1] [C7] column_name:medium_blob;[R1] [C7] column_type:MYSQL_TYPE_MEDIUM_BLOB;[R1] [C7] column_is_rowkey:false;[R1] [C7] column_is_signed:true;[R1] [C7] column_encoding:binary;[R1] [C7] column_is_not_null:false;[R1] [C7] column_value_new_origin: PADDING;[R1] [C7] column_value_new_md5:[NULL](0);[R1] [C7] column_value_old_origin: PADDING;[R1] [C7] column_value_old_md5:[NULL](0);[R1] [C8] column_name:long_text;[R1] [C8] column_type:MYSQL_TYPE_LONG_BLOB;[R1] [C8] column_is_rowkey:false;[R1] [C8] column_is_signed:true;[R1] [C8] column_encoding:utf8mb4;[R1] [C8] column_is_not_null:false;[R1] [C8] column_value_new_md5:[21ac45796075552d5e54ff8c8d45db78](11534336);[R1] [C8] column_value_old_md5:[c57d4c3741dc0eb85d767497f9736503](50331647);[R1] [C9] column_name:long_blob;[R1] [C9] column_type:MYSQL_TYPE_LONG_BLOB;[R1] [C9] column_is_rowkey:false;[R1] [C9] column_is_signed:true;[R1] [C9] column_encoding:binary;[R1] [C9] column_is_not_null:false;[R1] [C9] column_value_new_md5:[2c935e46cfdb63ec4d3dc7c05351aa7f](11534336);[R1] [C9] column_value_old_md5:[21ac45796075552d5e54ff8c8d45db78](11534336);$[R2] COMMIT;
ob1.oblog.next_dml;
[R0] BEGIN;[R0] org_cluster_id:1;[R1] record_type:INSERT;[R1] database_name:oblog_tt.oblog_db1;[R1] table_name:t1;[R1] log_event:true;[R1] column_count:9;[R1] source_category:SRC_FULL_RECORDED;[R1] source_type:SRC_OCEANBASE_1_0;[R1] has_pk:true;[R1] pk_info:(0);[R1] pks:pk;[R1] has_uk:false;[R1] uk_info:(null);[R1] uks:(null);[R1] [C1] column_name:pk;[R1] [C1] column_type:MYSQL_TYPE_LONG;[R1] [C1] column_is_rowkey:true;[R1] [C1] column_is_signed:true;[R1] [C1] column_encoding:binary;[R1] [C1] column_is_not_null:true;[R1] [C1] column_value_new:[4](1);[R1] [C2] column_name:tiny_text;[R1] [C2] column_type:MYSQL_TYPE_TINY_BLOB;[R1] [C2] column_is_rowkey:false;[R1] [C2] column_is_signed:true;[R1] [C2] column_encoding:utf8mb4;[R1] [C2] column_is_not_null:false;[R1] [C2] column_value_new_md5:[d41d8cd98f00b204e9800998ecf8427e](0);[R1] [C3] column_name:tiny_blob;[R1] [C3] column_type:MYSQL_TYPE_TINY_BLOB;[R1] [C3] column_is_rowkey:false;[R1] [C3] column_is_signed:true;[R1] [C3] column_encoding:binary;[R1] [C3] column_is_not_null:false;[R1] [C3] column_value_new_md5:[d41d8cd98f00b204e9800998ecf8427e](0);[R1] [C4] column_name:text_type;[R1] [C4] column_type:MYSQL_TYPE_BLOB;[R1] [C4] column_is_rowkey:false;[R1] [C4] column_is_signed:true;[R1] [C4] column_encoding:utf8mb4;[R1] [C4] column_is_not_null:false;[R1] [C4] column_value_new_md5:[16a9e4895c6169a9a8da828f6d4b4896](63210);[R1] [C5] column_name:blob_type;[R1] [C5] column_type:MYSQL_TYPE_BLOB;[R1] [C5] column_is_rowkey:false;[R1] [C5] column_is_signed:true;[R1] [C5] column_encoding:binary;[R1] [C5] column_is_not_null:false;[R1] [C5] column_value_new_md5:[d41d8cd98f00b204e9800998ecf8427e](0);[R1] [C6] column_name:medium_text;[R1] [C6] column_type:MYSQL_TYPE_MEDIUM_BLOB;[R1] [C6] column_is_rowkey:false;[R1] [C6] column_is_signed:true;[R1] [C6] column_encoding:utf8mb4;[R1] [C6] column_is_not_null:false;[R1] [C6] column_value_new_md5:[d5300422b42b6fc65e3213972d51d901](654321);[R1] [C7] column_name:medium_blob;[R1] [C7] column_type:MYSQL_TYPE_MEDIUM_BLOB;[R1] [C7] column_is_rowkey:false;[R1] [C7] column_is_signed:true;[R1] [C7] column_encoding:binary;[R1] [C7] column_is_not_null:false;[R1] [C7] column_value_new_md5:[d41d8cd98f00b204e9800998ecf8427e](0);[R1] [C8] column_name:long_text;[R1] [C8] column_type:MYSQL_TYPE_LONG_BLOB;[R1] [C8] column_is_rowkey:false;[R1] [C8] column_is_signed:true;[R1] [C8] column_encoding:utf8mb4;[R1] [C8] column_is_not_null:false;[R1] [C8] column_value_new_md5:[c57d4c3741dc0eb85d767497f9736503](50331647);[R1] [C9] column_name:long_blob;[R1] [C9] column_type:MYSQL_TYPE_LONG_BLOB;[R1] [C9] column_is_rowkey:false;[R1] [C9] column_is_signed:true;[R1] [C9] column_encoding:binary;[R1] [C9] column_is_not_null:false;[R1] [C9] column_value_new_md5:[2382bbd355b1c0377240e1d1f79b6081](50331647);$[R2] COMMIT;
ob1.oblog.next_dml;
[R0] BEGIN;[R0] org_cluster_id:1;[R1] record_type:UPDATE;[R1] database_name:oblog_tt.oblog_db1;[R1] table_name:t1;[R1] log_event:true;[R1] column_count:9;[R1] source_category:SRC_FULL_RECORDED;[R1] source_type:SRC_OCEANBASE_1_0;[R1] has_pk:true;[R1] pk_info:(0);[R1] pks:pk;[R1] has_uk:false;[R1] uk_info:(null);[R1] uks:(null);[R1] [C1] column_name:pk;[R1] [C1] column_type:MYSQL_TYPE_LONG;[R1] [C1] column_is_rowkey:true;[R1] [C1] column_is_signed:true;[R1] [C1] column_encoding:binary;[R1] [C1] column_is_not_null:true;[R1] [C1] column_value_new:[4](1);[R1] [C1] column_value_old:[4](1);[R1] [C2] column_name:tiny_text;[R1] [C2] column_type:MYSQL_TYPE_TINY_BLOB;[R1] [C2] column_is_rowkey:false;[R1] [C2] column_is_signed:true;[R1] [C2] column_encoding:utf8mb4;[R1] [C2] column_is_not_null:false;[R1] [C2] column_value_new_origin: PADDING;[R1] [C2] column_value_new_md5:[NULL](0);[R1] [C2] column_value_old_origin: PADDING;[R1] [C2] column_value_old_md5:[NULL](0);[R1] [C3] column_name:tiny_blob;[R1] [C3] column_type:MYSQL_TYPE_TINY_BLOB;[R1] [C3] column_is_rowkey:false;[R1] [C3] column_is_signed:true;[R1] [C3] column_encoding:binary;[R1] [C3] column_is_not_null:false;[R1] [C3] column_value_new_origin: PADDING;[R1] [C3] column_value_new_md5:[NULL](0);[R1] [C3] column_value_old_origin: PADDING;[R1] [C3] column_value_old_md5:[NULL](0);[R1] [C4] column_name:text_type;[R1] [C4] column_type:MYSQL_TYPE_BLOB;[R1] [C4] column_is_rowkey:false;[R1] [C4] column_is_signed:true;[R1] [C4] column_encoding:utf8mb4;[R1] [C4] column_is_not_null:false;[R1] [C4] column_value_new_origin: PADDING;[R1] [C4] column_value_new_md5:[NULL](0);[R1] [C4] column_value_old_origin: PADDING;[R1] [C4] column_value_old_md5:[NULL](0);[R1] [C5] column_name:blob_type;[R1] [C5] column_type:MYSQL_TYPE_BLOB;[R1] [C5] column_is_rowkey:false;[R1] [C5] column_is_signed:true;[R1] [C5] column_encoding:binary;[R1] [C5] column_is_not_null:false;[R1] [C5] column_value_new_origin: PADDING;[R1] [C5] column_value_new_md5:[NULL](0);[R1] [C5] column_value_old_origin: PADDING;[R1] [C5] column_value_old_md5:[NULL](0);[R1] [C6] column_name:medium_text;[R1] [C6] column_type:MYSQL_TYPE_MEDIUM_BLOB;[R1] [C6] column_is_rowkey:false;[R1] [C6] column_is_signed:true;[R1] [C6] column_encoding:utf8mb4;[R1] [C6] column_is_not_null:false;[R1] [C6] column_value_new_origin: PADDING;[R1] [C6] column_value_new_md5:[NULL](0);[R1] [C6] column_value_old_origin: PADDING;[R1] [C6] column_value_old_md5:[NULL](0);[R1] [C7] column_name:medium_blob;[R1] [C7] column_type:MYSQL_TYPE_MEDIUM_BLOB;[R1] [C7] column_is_rowkey:false;[R1] [C7] column_is_signed:true;[R1] [C7] column_encoding:binary;[R1] [C7] column_is_not_null:false;[R1] [C7] column_value_new_origin: PADDING;[R1] [C7] column_value_new_md5:[NULL](0);[R1] [C7] column_value_old_origin: PADDING;[R1] [C7] column_value_old_md5:[NULL](0);[R1] [C8] column_name:long_text;[R1] [C8] column_type:MYSQL_TYPE_LONG_BLOB;[R1] [C8] column_is_rowkey:false;[R1] [C8] column_is_signed:true;[R1] [C8] column_encoding:utf8mb4;[R1] [C8] column_is_not_null:false;[R1] [C8] column_value_new_md5:[d41d8cd98f00b204e9800998ecf8427e](0);[R1] [C8] column_value_old_origin: PADDING;[R1] [C8] column_value_old_md5:[NULL](0);[R1] [C9] column_name:long_blob;[R1] [C9] column_type:MYSQL_TYPE_LONG_BLOB;[R1] [C9] column_is_rowkey:false;[R1] [C9] column_is_signed:true;[R1] [C9] column_encoding:binary;[R1] [C9] column_is_not_null:false;[R1] [C9] column_value_new_md5:[NULL](0);[R1] [C9] column_value_old_origin: PADDING;[R1] [C9] column_value_old_md5:[NULL](0);$[R2] COMMIT;
ob1.oblog.next_dml;
[R0] BEGIN;[R0] org_cluster_id:1;[R1] record_type:UPDATE;[R1] database_name:oblog_tt.oblog_db1;[R1] table_name:t1;[R1] log_event:true;[R1] column_count:9;[R1] source_category:SRC_FULL_RECORDED;[R1] source_type:SRC_OCEANBASE_1_0;[R1] has_pk:true;[R1] pk_info:(0);[R1] pks:pk;[R1] has_uk:false;[R1] uk_info:(null);[R1] uks:(null);[R1] [C1] column_name:pk;[R1] [C1] column_type:MYSQL_TYPE_LONG;[R1] [C1] column_is_rowkey:true;[R1] [C1] column_is_signed:true;[R1] [C1] column_encoding:binary;[R1] [C1] column_is_not_null:true;[R1] [C1] column_value_new:[4](1);[R1] [C1] column_value_old:[4](1);[R1] [C2] column_name:tiny_text;[R1] [C2] column_type:MYSQL_TYPE_TINY_BLOB;[R1] [C2] column_is_rowkey:false;[R1] [C2] column_is_signed:true;[R1] [C2] column_encoding:utf8mb4;[R1] [C2] column_is_not_null:false;[R1] [C2] column_value_new_origin: PADDING;[R1] [C2] column_value_new_md5:[NULL](0);[R1] [C2] column_value_old_origin: PADDING;[R1] [C2] column_value_old_md5:[NULL](0);[R1] [C3] column_name:tiny_blob;[R1] [C3] column_type:MYSQL_TYPE_TINY_BLOB;[R1] [C3] column_is_rowkey:false;[R1] [C3] column_is_signed:true;[R1] [C3] column_encoding:binary;[R1] [C3] column_is_not_null:false;[R1] [C3] column_value_new_origin: PADDING;[R1] [C3] column_value_new_md5:[NULL](0);[R1] [C3] column_value_old_origin: PADDING;[R1] [C3] column_value_old_md5:[NULL](0);[R1] [C4] column_name:text_type;[R1] [C4] column_type:MYSQL_TYPE_BLOB;[R1] [C4] column_is_rowkey:false;[R1] [C4] column_is_signed:true;[R1] [C4] column_encoding:utf8mb4;[R1] [C4] column_is_not_null:false;[R1] [C4] column_value_new_origin: PADDING;[R1] [C4] column_value_new_md5:[NULL](0);[R1] [C4] column_value_old_origin: PADDING;[R1] [C4] column_value_old_md5:[NULL](0);[R1] [C5] column_name:blob_type;[R1] [C5] column_type:MYSQL_TYPE_BLOB;[R1] [C5] column_is_rowkey:false;[R1] [C5] column_is_signed:true;[R1] [C5] column_encoding:binary;[R1] [C5] column_is_not_null:false;[R1] [C5] column_value_new_origin: PADDING;[R1] [C5] column_value_new_md5:[NULL](0);[R1] [C5] column_value_old_origin: PADDING;[R1] [C5] column_value_old_md5:[NULL](0);[R1] [C6] column_name:medium_text;[R1] [C6] column_type:MYSQL_TYPE_MEDIUM_BLOB;[R1] [C6] column_is_rowkey:false;[R1] [C6] column_is_signed:true;[R1] [C6] column_encoding:utf8mb4;[R1] [C6] column_is_not_null:false;[R1] [C6] column_value_new_origin: PADDING;[R1] [C6] column_value_new_md5:[NULL](0);[R1] [C6] column_value_old_origin: PADDING;[R1] [C6] column_value_old_md5:[NULL](0);[R1] [C7] column_name:medium_blob;[R1] [C7] column_type:MYSQL_TYPE_MEDIUM_BLOB;[R1] [C7] column_is_rowkey:false;[R1] [C7] column_is_signed:true;[R1] [C7] column_encoding:binary;[R1] [C7] column_is_not_null:false;[R1] [C7] column_value_new_origin: PADDING;[R1] [C7] column_value_new_md5:[NULL](0);[R1] [C7] column_value_old_origin: PADDING;[R1] [C7] column_value_old_md5:[NULL](0);[R1] [C8] column_name:long_text;[R1] [C8] column_type:MYSQL_TYPE_LONG_BLOB;[R1] [C8] column_is_rowkey:false;[R1] [C8] column_is_signed:true;[R1] [C8] column_encoding:utf8mb4;[R1] [C8] column_is_not_null:false;[R1] [C8] column_value_new_md5:[NULL](0);[R1] [C8] column_value_old_md5:[d41d8cd98f00b204e9800998ecf8427e](0);[R1] [C9] column_name:long_blob;[R1] [C9] column_type:MYSQL_TYPE_LONG_BLOB;[R1] [C9] column_is_rowkey:false;[R1] [C9] column_is_signed:true;[R1] [C9] column_encoding:binary;[R1] [C9] column_is_not_null:false;[R1] [C9] column_value_new_md5:[d41d8cd98f00b204e9800998ecf8427e](0);[R1] [C9] column_value_old_md5:[NULL](0);$[R2] COMMIT;
ob1.oblog.next_dml;
[R0] BEGIN;[R0] org_cluster_id:1;[R1] record_type:UPDATE;[R1] database_name:oblog_tt.oblog_db1;[R1] table_name:t1;[R1] log_event:true;[R1] column_count:9;[R1] source_category:SRC_FULL_RECORDED;[R1] source_type:SRC_OCEANBASE_1_0;[R1] has_pk:true;[R1] pk_info:(0);[R1] pks:pk;[R1] has_uk:false;[R1] uk_info:(null);[R1] uks:(null);[R1] [C1] column_name:pk;[R1] [C1] column_type:MYSQL_TYPE_LONG;[R1] [C1] column_is_rowkey:true;[R1] [C1] column_is_signed:true;[R1] [C1] column_encoding:binary;[R1] [C1] column_is_not_null:true;[R1] [C1] column_value_new:[4](1);[R1] [C1] column_value_old:[4](1);[R1] [C2] column_name:tiny_text;[R1] [C2] column_type:MYSQL_TYPE_TINY_BLOB;[R1] [C2] column_is_rowkey:false;[R1] [C2] column_is_signed:true;[R1] [C2] column_encoding:utf8mb4;[R1] [C2] column_is_not_null:false;[R1] [C2] column_value_new_origin: PADDING;[R1] [C2] column_value_new_md5:[NULL](0);[R1] [C2] column_value_old_origin: PADDING;[R1] [C2] column_value_old_md5:[NULL](0);[R1] [C3] column_name:tiny_blob;[R1] [C3] column_type:MYSQL_TYPE_TINY_BLOB;[R1] [C3] column_is_rowkey:false;[R1] [C3] column_is_signed:true;[R1] [C3] column_encoding:binary;[R1] [C3] column_is_not_null:false;[R1] [C3] column_value_new_origin: PADDING;[R1] [C3] column_value_new_md5:[NULL](0);[R1] [C3] column_value_old_origin: PADDING;[R1] [C3] column_value_old_md5:[NULL](0);[R1] [C4] column_name:text_type;[R1] [C4] column_type:MYSQL_TYPE_BLOB;[R1] [C4] column_is_rowkey:false;[R1] [C4] column_is_signed:true;[R1] [C4] column_encoding:utf8mb4;[R1] [C4] column_is_not_null:false;[R1] [C4] column_value_new_origin: PADDING;[R1] [C4] column_value_new_md5:[NULL](0);[R1] [C4] column_value_old_origin: PADDING;[R1] [C4] column_value_old_md5:[NULL](0);[R1] [C5] column_name:blob_type;[R1] [C5] column_type:MYSQL_TYPE_BLOB;[R1] [C5] column_is_rowkey:false;[R1] [C5] column_is_signed:true;[R1] [C5] column_encoding:binary;[R1] [C5] column_is_not_null:false;[R1] [C5] column_value_new_origin: PADDING;[R1] [C5] column_value_new_md5:[NULL](0);[R1] [C5] column_value_old_origin: PADDING;[R1] [C5] column_value_old_md5:[NULL](0);[R1] [C6] column_name:medium_text;[R1] [C6] column_type:MYSQL_TYPE_MEDIUM_BLOB;[R1] [C6] column_is_rowkey:false;[R1] [C6] column_is_signed:true;[R1] [C6] column_encoding:utf8mb4;[R1] [C6] column_is_not_null:false;[R1] [C6] column_value_new_origin: PADDING;[R1] [C6] column_value_new_md5:[NULL](0);[R1] [C6] column_value_old_origin: PADDING;[R1] [C6] column_value_old_md5:[NULL](0);[R1] [C7] column_name:medium_blob;[R1] [C7] column_type:MYSQL_TYPE_MEDIUM_BLOB;[R1] [C7] column_is_rowkey:false;[R1] [C7] column_is_signed:true;[R1] [C7] column_encoding:binary;[R1] [C7] column_is_not_null:false;[R1] [C7] column_value_new_origin: PADDING;[R1] [C7] column_value_new_md5:[NULL](0);[R1] [C7] column_value_old_origin: PADDING;[R1] [C7] column_value_old_md5:[NULL](0);[R1] [C8] column_name:long_text;[R1] [C8] column_type:MYSQL_TYPE_LONG_BLOB;[R1] [C8] column_is_rowkey:false;[R1] [C8] column_is_signed:true;[R1] [C8] column_encoding:utf8mb4;[R1] [C8] column_is_not_null:false;[R1] [C8] column_value_new_md5:[c57d4c3741dc0eb85d767497f9736503](50331647);[R1] [C8] column_value_old_md5:[NULL](0);[R1] [C9] column_name:long_blob;[R1] [C9] column_type:MYSQL_TYPE_LONG_BLOB;[R1] [C9] column_is_rowkey:false;[R1] [C9] column_is_signed:true;[R1] [C9] column_encoding:binary;[R1] [C9] column_is_not_null:false;[R1] [C9] column_value_new_md5:[2382bbd355b1c0377240e1d1f79b6081](50331647);[R1] [C9] column_value_old_md5:[d41d8cd98f00b204e9800998ecf8427e](0);$[R2] COMMIT;
ob1.oblog.next_dml;
[R0] BEGIN;[R0] org_cluster_id:1;[R1] record_type:UPDATE;[R1] database_name:oblog_tt.oblog_db1;[R1] table_name:t1;[R1] log_event:true;[R1] column_count:9;[R1] source_category:SRC_FULL_RECORDED;[R1] source_type:SRC_OCEANBASE_1_0;[R1] has_pk:true;[R1] pk_info:(0);[R1] pks:pk;[R1] has_uk:false;[R1] uk_info:(null);[R1] uks:(null);[R1] [C1] column_name:pk;[R1] [C1] column_type:MYSQL_TYPE_LONG;[R1] [C1] column_is_rowkey:true;[R1] [C1] column_is_signed:true;[R1] [C1] column_encoding:binary;[R1] [C1] column_is_not_null:true;[R1] [C1] column_value_new:[4](1);[R1] [C1] column_value_old:[4](1);[R1] [C2] column_name:tiny_text;[R1] [C2] column_type:MYSQL_TYPE_TINY_BLOB;[R1] [C2] column_is_rowkey:false;[R1] [C2] column_is_signed:true;[R1] [C2] column_encoding:utf8mb4;[R1] [C2] column_is_not_null:false;[R1] [C2] column_value_new_origin: PADDING;[R1] [C2] column_value_new_md5:[NULL](0);[R1] [C2] column_value_old_origin: PADDING;[R1] [C2] column_value_old_md5:[NULL](0);[R1] [C3] column_name:tiny_blob;[R1] [C3] column_type:MYSQL_TYPE_TINY_BLOB;[R1] [C3] column_is_rowkey:false;[R1] [C3] column_is_signed:true;[R1] [C3] column_encoding:binary;[R1] [C3] column_is_not_null:false;[R1] [C3] column_value_new_origin: PADDING;[R1] [C3] column_value_new_md5:[NULL](0);[R1] [C3] column_value_old_origin: PADDING;[R1] [C3] column_value_old_md5:[NULL](0);[R1] [C4] column_name:text_type;[R1] [C4] column_type:MYSQL_TYPE_BLOB;[R1] [C4] column_is_rowkey:false;[R1] [C4] column_is_signed:true;[R1] [C4] column_encoding:utf8mb4;[R1] [C4] column_is_not_null:false;[R1] [C4] column_value_new_origin: PADDING;[R1] [C4] column_value_new_md5:[NULL](0);[R1] [C4] column_value_old_origin: PADDING;[R1] [C4] column_value_old_md5:[NULL](0);[R1] [C5] column_name:blob_type;[R1] [C5] column_type:MYSQL_TYPE_BLOB;[R1] [C5] column_is_rowkey:false;[R1] [C5] column_is_signed:true;[R1] [C5] column_encoding:binary;[R1] [C5] column_is_not_null:false;[R1] [C5] column_value_new_origin: PADDING;[R1] [C5] column_value_new_md5:[NULL](0);[R1] [C5] column_value_old_origin: PADDING;[R1] [C5] column_value_old_md5:[NULL](0);[R1] [C6] column_name:medium_text;[R1] [C6] column_type:MYSQL_TYPE_MEDIUM_BLOB;[R1] [C6] column_is_rowkey:false;[R1] [C6] column_is_signed:true;[R1] [C6] column_encoding:utf8mb4;[R1] [C6] column_is_not_null:false;[R1] [C6] column_value_new_origin: PADDING;[R1] [C6] column_value_new_md5:[NULL](0);[R1] [C6] column_value_old_origin: PADDING;[R1] [C6] column_value_old_md5:[NULL](0);[R1] [C7] column_name:medium_blob;[R1] [C7] column_type:MYSQL_TYPE_MEDIUM_BLOB;[R1] [C7] column_is_rowkey:false;[R1] [C7] column_is_signed:true;[R1] [C7] column_encoding:binary;[R1] [C7] column_is_not_null:false;[R1] [C7] column_value_new_origin: PADDING;[R1] [C7] column_value_new_md5:[NULL](0);[R1] [C7] column_value_old_origin: PADDING;[R1] [C7] column_value_old_md5:[NULL](0);[R1] [C8] column_name:long_text;[R1] [C8] column_type:MYSQL_TYPE_LONG_BLOB;[R1] [C8] column_is_rowkey:false;[R1] [C8] column_is_signed:true;[R1] [C8] column_encoding:utf8mb4;[R1] [C8] column_is_not_null:false;[R1] [C8] column_value_new_md5:[f75702e1f9894f0e15cb45faae9ed0fc](9);[R1] [C8] column_value_old_origin: PADDING;[R1] [C8] column_value_old_md5:[NULL](0);[R1] [C9] column_name:long_blob;[R1] [C9] column_type:MYSQL_TYPE_LONG_BLOB;[R1] [C9] column_is_rowkey:false;[R1] [C9] column_is_signed:true;[R1] [C9] column_encoding:binary;[R1] [C9] column_is_not_null:false;[R1] [C9] column_value_new_md5:[36a03906ff74e6e496273de4b509bd39](13);[R1] [C9] column_value_old_origin: PADDING;[R1] [C9] column_value_old_md5:[NULL](0);$[R2] COMMIT;
ob1.oblog.next_dml;
[R0] BEGIN;[R0] org_cluster_id:1;[R1] record_type:DELETE;[R1] database_name:oblog_tt.oblog_db1;[R1] table_name:t1;[R1] log_event:true;[R1] column_count:9;[R1] source_category:SRC_FULL_RECORDED;[R1] source_type:SRC_OCEANBASE_1_0;[R1] has_pk:true;[R1] pk_info:(0);[R1] pks:pk;[R1] has_uk:false;[R1] uk_info:(null);[R1] uks:(null);[R1] [C1] column_name:pk;[R1] [C1] column_type:MYSQL_TYPE_LONG;[R1] [C1] column_is_rowkey:true;[R1] [C1] column_is_signed:true;[R1] [C1] column_encoding:binary;[R1] [C1] column_is_not_null:true;[R1] [C1] column_value_old:[3](1);[R1] [C2] column_name:tiny_text;[R1] [C2] column_type:MYSQL_TYPE_TINY_BLOB;[R1] [C2] column_is_rowkey:false;[R1] [C2] column_is_signed:true;[R1] [C2] column_encoding:utf8mb4;[R1] [C2] column_is_not_null:false;[R1] [C2] column_value_old_origin: PADDING;[R1] [C2] column_value_old_md5:[NULL](0);[R1] [C3] column_name:tiny_blob;[R1] [C3] column_type:MYSQL_TYPE_TINY_BLOB;[R1] [C3] column_is_rowkey:false;[R1] [C3] column_is_signed:true;[R1] [C3] column_encoding:binary;[R1] [C3] column_is_not_null:false;[R1] [C3] column_value_old_origin: PADDING;[R1] [C3] column_value_old_md5:[NULL](0);[R1] [C4] column_name:text_type;[R1] [C4] column_type:MYSQL_TYPE_BLOB;[R1] [C4] column_is_rowkey:false;[R1] [C4] column_is_signed:true;[R1] [C4] column_encoding:utf8mb4;[R1] [C4] column_is_not_null:false;[R1] [C4] column_value_old_md5:[d41d8cd98f00b204e9800998ecf8427e](0);[R1] [C5] column_name:blob_type;[R1] [C5] column_type:MYSQL_TYPE_BLOB;[R1] [C5] column_is_rowkey:false;[R1] [C5] column_is_signed:true;[R1] [C5] column_encoding:binary;[R1] [C5] column_is_not_null:false;[R1] [C5] column_value_old_md5:[d41d8cd98f00b204e9800998ecf8427e](0);[R1] [C6] column_name:medium_text;[R1] [C6] column_type:MYSQL_TYPE_MEDIUM_BLOB;[R1] [C6] column_is_rowkey:false;[R1] [C6] column_is_signed:true;[R1] [C6] column_encoding:utf8mb4;[R1] [C6] column_is_not_null:false;[R1] [C6] column_value_old_md5:[d41d8cd98f00b204e9800998ecf8427e](0);[R1] [C7] column_name:medium_blob;[R1] [C7] column_type:MYSQL_TYPE_MEDIUM_BLOB;[R1] [C7] column_is_rowkey:false;[R1] [C7] column_is_signed:true;[R1] [C7] column_encoding:binary;[R1] [C7] column_is_not_null:false;[R1] [C7] column_value_old_md5:[d41d8cd98f00b204e9800998ecf8427e](0);[R1] [C8] column_name:long_text;[R1] [C8] column_type:MYSQL_TYPE_LONG_BLOB;[R1] [C8] column_is_rowkey:false;[R1] [C8] column_is_signed:true;[R1] [C8] column_encoding:utf8mb4;[R1] [C8] column_is_not_null:false;[R1] [C8] column_value_old_origin: PADDING;[R1] [C8] column_value_old_md5:[NULL](0);[R1] [C9] column_name:long_blob;[R1] [C9] column_type:MYSQL_TYPE_LONG_BLOB;[R1] [C9] column_is_rowkey:false;[R1] [C9] column_is_signed:true;[R1] [C9] column_encoding:binary;[R1] [C9] column_is_not_null:false;[R1] [C9] column_value_old_origin: PADDING;[R1] [C9] column_value_old_md5:[NULL](0);$[R2] COMMIT;
ob1.oblog.next_dml;
[R0] BEGIN;[R0] org_cluster_id:1;[R1] record_type:DELETE;[R1] database_name:oblog_tt.oblog_db1;[R1] table_name:t1;[R1] log_event:true;[R1] column_count:9;[R1] source_category:SRC_FULL_RECORDED;[R1] source_type:SRC_OCEANBASE_1_0;[R1] has_pk:true;[R1] pk_info:(0);[R1] pks:pk;[R1] has_uk:false;[R1] uk_info:(null);[R1] uks:(null);[R1] [C1] column_name:pk;[R1] [C1] column_type:MYSQL_TYPE_LONG;[R1] [C1] column_is_rowkey:true;[R1] [C1] column_is_signed:true;[R1] [C1] column_encoding:binary;[R1] [C1] column_is_not_null:true;[R1] [C1] column_value_old:[4](1);[R1] [C2] column_name:tiny_text;[R1] [C2] column_type:MYSQL_TYPE_TINY_BLOB;[R1] [C2] column_is_rowkey:false;[R1] [C2] column_is_signed:true;[R1] [C2] column_encoding:utf8mb4;[R1] [C2] column_is_not_null:false;[R1] [C2] column_value_old_origin: PADDING;[R1] [C2] column_value_old_md5:[NULL](0);[R1] [C3] column_name:tiny_blob;[R1] [C3] column_type:MYSQL_TYPE_TINY_BLOB;[R1] [C3] column_is_rowkey:false;[R1] [C3] column_is_signed:true;[R1] [C3] column_encoding:binary;[R1] [C3] column_is_not_null:false;[R1] [C3] column_value_old_origin: PADDING;[R1] [C3] column_value_old_md5:[NULL](0);[R1] [C4] column_name:text_type;[R1] [C4] column_type:MYSQL_TYPE_BLOB;[R1] [C4] column_is_rowkey:false;[R1] [C4] column_is_signed:true;[R1] [C4] column_encoding:utf8mb4;[R1] [C4] column_is_not_null:false;[R1] [C4] column_value_old_origin: PADDING;[R1] [C4] column_value_old_md5:[NULL](0);[R1] [C5] column_name:blob_type;[R1] [C5] column_type:MYSQL_TYPE_BLOB;[R1] [C5] column_is_rowkey:false;[R1] [C5] column_is_signed:true;[R1] [C5] column_encoding:binary;[R1] [C5] column_is_not_null:false;[R1] [C5] column_value_old_md5:[d41d8cd98f00b204e9800998ecf8427e](0);[R1] [C6] column_name:medium_text;[R1] [C6] column_type:MYSQL_TYPE_MEDIUM_BLOB;[R1] [C6] column_is_rowkey:false;[R1] [C6] column_is_signed:true;[R1] [C6] column_encoding:utf8mb4;[R1] [C6] column_is_not_null:false;[R1] [C6] column_value_old_origin: PADDING;[R1] [C6] column_value_old_md5:[NULL](0);[R1] [C7] column_name:medium_blob;[R1] [C7] column_type:MYSQL_TYPE_MEDIUM_BLOB;[R1] [C7] column_is_rowkey:false;[R1] [C7] column_is_signed:true;[R1] [C7] column_encoding:binary;[R1] [C7] column_is_not_null:false;[R1] [C7] column_value_old_md5:[d41d8cd98f00b204e9800998ecf8427e](0);[R1] [C8] column_name:long_text;[R1] [C8] column_type:MYSQL_TYPE_LONG_BLOB;[R1] [C8] column_is_rowkey:false;[R1] [C8] column_is_signed:true;[R1] [C8] column_encoding:utf8mb4;[R1] [C8] column_is_not_null:false;[R1] [C8] column_value_old_md5:[f75702e1f9894f0e15cb45faae9ed0fc](9);[R1] [C9] column_name:long_blob;[R1] [C9] column_type:MYSQL_TYPE_LONG_BLOB;[R1] [C9] column_is_rowkey:false;[R1] [C9] column_is_signed:true;[R1] [C9] column_encoding:binary;[R1] [C9] column_is_not_null:false;[R1] [C9] column_value_old_md5:[36a03906ff74e6e496273de4b509bd39](13);$[R2] COMMIT;
ob1.oblog.stop;
ob1.oblog.set_start_tstamp_usec $start_tstamp_usec;
ob1.oblog.gen_conf tb_white_list=oblog_tt.*.* log_level=DEBUG meta_data_refresh_mode=data_dict;
ob1.oblog.set_extra_argument -m;
ob1.oblog.restart;
ob1.oblog.next_dml;
[R0] BEGIN;[R0] org_cluster_id:1;[R1] record_type:INSERT;[R1] database_name:oblog_tt.oblog_db1;[R1] table_name:t1;[R1] log_event:true;[R1] column_count:9;[R1] source_category:SRC_FULL_RECORDED;[R1] source_type:SRC_OCEANBASE_1_0;[R1] has_pk:true;[R1] pk_info:(0);[R1] pks:pk;[R1] has_uk:false;[R1] uk_info:(null);[R1] uks:(null);[R1] [C1] column_name:pk;[R1] [C1] column_type:MYSQL_TYPE_LONG;[R1] [C1] column_is_rowkey:true;[R1] [C1] column_is_signed:true;[R1] [C1] column_encoding:binary;[R1] [C1] column_is_not_null:true;[R1] [C1] column_value_new:[1](1);[R1] [C2] column_name:tiny_text;[R1] [C2] column_type:MYSQL_TYPE_TINY_BLOB;[R1] [C2] column_is_rowkey:false;[R1] [C2] column_is_signed:true;[R1] [C2] column_encoding:utf8mb4;[R1] [C2] column_is_not_null:false;[R1] [C2] column_value_new_md5:[d41d8cd98f00b204e9800998ecf8427e](0);[R1] [C3] column_name:tiny_blob;[R1] [C3] column_type:MYSQL_TYPE_TINY_BLOB;[R1] [C3] column_is_rowkey:false;[R1] [C3] column_is_signed:true;[R1] [C3] column_encoding:binary;[R1] [C3] column_is_not_null:false;[R1] [C3] column_value_new_md5:[d41d8cd98f00b204e9800998ecf8427e](0);[R1] [C4] column_name:text_type;[R1] [C4] column_type:MYSQL_TYPE_BLOB;[R1] [C4] column_is_rowkey:false;[R1] [C4] column_is_signed:true;[R1] [C4] column_encoding:utf8mb4;[R1] [C4] column_is_not_null:false;[R1] [C4] column_value_new_md5:[d41d8cd98f00b204e9800998ecf8427e](0);[R1] [C5] column_name:blob_type;[R1] [C5] column_type:MYSQL_TYPE_BLOB;[R1] [C5] column_is_rowkey:false;[R1] [C5] column_is_signed:true;[R1] [C5] column_encoding:binary;[R1] [C5] column_is_not_null:false;[R1] [C5] column_value_new_md5:[d41d8cd98f00b204e9800998ecf8427e](0);[R1] [C6] column_name:medium_text;[R1] [C6] column_type:MYSQL_TYPE_MEDIUM_BLOB;[R1] [C6] column_is_rowkey:false;[R1] [C6] column_is_signed:true;[R1] [C6] column_encoding:utf8mb4;[R1] [C6] column_is_not_null:false;[R1] [C6] column_value_new_md5:[d41d8cd98f00b204e9800998ecf8427e](0);[R1] [C7] column_name:medium_blob;[R1] [C7] column_type:MYSQL_TYPE_MEDIUM_BLOB;[R1] [C7] column_is_rowkey:false;[R1] [C7] column_is_signed:true;[R1] [C7] column_encoding:binary;[R1] [C7] column_is_not_null:false;[R1] [C7] column_value_new_md5:[d41d8cd98f00b204e9800998ecf8427e](0);[R1] [C8] column_name:long_text;[R1] [C8] column_type:MYSQL_TYPE_LONG_BLOB;[R1] [C8] column_is_rowkey:false;[R1] [C8] column_is_signed:true;[R1] [C8] column_encoding:utf8mb4;[R1] [C8] column_is_not_null:false;[R1] [C8] column_value_new_md5:[c57d4c3741dc0eb85d767497f9736503](50331647);[R1] [C9] column_name:long_blob;[R1] [C9] column_type:MYSQL_TYPE_LONG_BLOB;[R1] [C9] column_is_rowkey:false;[R1] [C9] column_is_signed:true;[R1] [C9] column_encoding:binary;[R1] [C9] column_is_not_null:false;[R1] [C9] column_value_new_md5:[d41d8cd98f00b204e9800998ecf8427e](0);$[R2] COMMIT;
ob1.oblog.next_dml;
[R0] BEGIN;[R0] org_cluster_id:1;[R1] record_type:INSERT;[R1] database_name:oblog_tt.oblog_db1;[R1] table_name:t1;[R1] log_event:true;[R1] column_count:9;[R1] source_category:SRC_FULL_RECORDED;[R1] source_type:SRC_OCEANBASE_1_0;[R1] has_pk:true;[R1] pk_info:(0);[R1] pks:pk;[R1] has_uk:false;[R1] uk_info:(null);[R1] uks:(null);[R1] [C1] column_name:pk;[R1] [C1] column_type:MYSQL_TYPE_LONG;[R1] [C1] column_is_rowkey:true;[R1] [C1] column_is_signed:true;[R1] [C1] column_encoding:binary;[R1] [C1] column_is_not_null:true;[R1] [C1] column_value_new:[2](1);[R1] [C2] column_name:tiny_text;[R1] [C2] column_type:MYSQL_TYPE_TINY_BLOB;[R1] [C2] column_is_rowkey:false;[R1] [C2] column_is_signed:true;[R1] [C2] column_encoding:utf8mb4;[R1] [C2] column_is_not_null:false;[R1] [C2] column_value_new_md5:[d41d8cd98f00b204e9800998ecf8427e](0);[R1] [C3] column_name:tiny_blob;[R1] [C3] column_type:MYSQL_TYPE_TINY_BLOB;[R1] [C3] column_is_rowkey:false;[R1] [C3] column_is_signed:true;[R1] [C3] column_encoding:binary;[R1] [C3] column_is_not_null:false;[R1] [C3] column_value_new_md5:[d41d8cd98f00b204e9800998ecf8427e](0);[R1] [C4] column_name:text_type;[R1] [C4] column_type:MYSQL_TYPE_BLOB;[R1] [C4] column_is_rowkey:false;[R1] [C4] column_is_signed:true;[R1] [C4] column_encoding:utf8mb4;[R1] [C4] column_is_not_null:false;[R1] [C4] column_value_new_md5:[d41d8cd98f00b204e9800998ecf8427e](0);[R1] [C5] column_name:blob_type;[R1] [C5] column_type:MYSQL_TYPE_BLOB;[R1] [C5] column_is_rowkey:false;[R1] [C5] column_is_signed:true;[R1] [C5] column_encoding:binary;[R1] [C5] column_is_not_null:false;[R1] [C5] column_value_new_md5:[d41d8cd98f00b204e9800998ecf8427e](0);[R1] [C6] column_name:medium_text;[R1] [C6] column_type:MYSQL_TYPE_MEDIUM_BLOB;[R1] [C6] column_is_rowkey:false;[R1] [C6] column_is_signed:true;[R1] [C6] column_encoding:utf8mb4;[R1] [C6] column_is_not_null:false;[R1] [C6] column_value_new_md5:[d41d8cd98f00b204e9800998ecf8427e](0);[R1] [C7] column_name:medium_blob;[R1] [C7] column_type:MYSQL_TYPE_MEDIUM_BLOB;[R1] [C7] column_is_rowkey:false;[R1] [C7] column_is_signed:true;[R1] [C7] column_encoding:binary;[R1] [C7] column_is_not_null:false;[R1] [C7] column_value_new_md5:[d41d8cd98f00b204e9800998ecf8427e](0);[R1] [C8] column_name:long_text;[R1] [C8] column_type:MYSQL_TYPE_LONG_BLOB;[R1] [C8] column_is_rowkey:false;[R1] [C8] column_is_signed:true;[R1] [C8] column_encoding:utf8mb4;[R1] [C8] column_is_not_null:false;[R1] [C8] column_value_new_md5:[2382bbd355b1c0377240e1d1f79b6081](50331647);[R1] [C9] column_name:long_blob;[R1] [C9] column_type:MYSQL_TYPE_LONG_BLOB;[R1] [C9] column_is_rowkey:false;[R1] [C9] column_is_signed:true;[R1] [C9] column_encoding:binary;[R1] [C9] column_is_not_null:false;[R1] [C9] column_value_new_md5:[d41d8cd98f00b204e9800998ecf8427e](0);$[R2] COMMIT;
ob1.oblog.next_dml;
[R0] BEGIN;[R0] org_cluster_id:1;[R1] record_type:INSERT;[R1] database_name:oblog_tt.oblog_db1;[R1] table_name:t1;[R1] log_event:true;[R1] column_count:9;[R1] source_category:SRC_FULL_RECORDED;[R1] source_type:SRC_OCEANBASE_1_0;[R1] has_pk:true;[R1] pk_info:(0);[R1] pks:pk;[R1] has_uk:false;[R1] uk_info:(null);[R1] uks:(null);[R1] [C1] column_name:pk;[R1] [C1] column_type:MYSQL_TYPE_LONG;[R1] [C1] column_is_rowkey:true;[R1] [C1] column_is_signed:true;[R1] [C1] column_encoding:binary;[R1] [C1] column_is_not_null:true;[R1] [C1] column_value_new:[3](1);[R1] [C2] column_name:tiny_text;[R1] [C2] column_type:MYSQL_TYPE_TINY_BLOB;[R1] [C2] column_is_rowkey:false;[R1] [C2] column_is_signed:true;[R1] [C2] column_encoding:utf8mb4;[R1] [C2] column_is_not_null:false;[R1] [C2] column_value_new_md5:[d41d8cd98f00b204e9800998ecf8427e](0);[R1] [C3] column_name:tiny_blob;[R1] [C3] column_type:MYSQL_TYPE_TINY_BLOB;[R1] [C3] column_is_rowkey:false;[R1] [C3] column_is_signed:true;[R1] [C3] column_encoding:binary;[R1] [C3] column_is_not_null:false;[R1] [C3] column_value_new_md5:[d41d8cd98f00b204e9800998ecf8427e](0);[R1] [C4] column_name:text_type;[R1] [C4] column_type:MYSQL_TYPE_BLOB;[R1] [C4] column_is_rowkey:false;[R1] [C4] column_is_signed:true;[R1] [C4] column_encoding:utf8mb4;[R1] [C4] column_is_not_null:false;[R1] [C4] column_value_new_md5:[d41d8cd98f00b204e9800998ecf8427e](0);[R1] [C5] column_name:blob_type;[R1] [C5] column_type:MYSQL_TYPE_BLOB;[R1] [C5] column_is_rowkey:false;[R1] [C5] column_is_signed:true;[R1] [C5] column_encoding:binary;[R1] [C5] column_is_not_null:false;[R1] [C5] column_value_new_md5:[d41d8cd98f00b204e9800998ecf8427e](0);[R1] [C6] column_name:medium_text;[R1] [C6] column_type:MYSQL_TYPE_MEDIUM_BLOB;[R1] [C6] column_is_rowkey:false;[R1] [C6] column_is_signed:true;[R1] [C6] column_encoding:utf8mb4;[R1] [C6] column_is_not_null:false;[R1] [C6] column_value_new_md5:[d41d8cd98f00b204e9800998ecf8427e](0);[R1] [C7] column_name:medium_blob;[R1] [C7] column_type:MYSQL_TYPE_MEDIUM_BLOB;[R1] [C7] column_is_rowkey:false;[R1] [C7] column_is_signed:true;[R1] [C7] column_encoding:binary;[R1] [C7] column_is_not_null:false;[R1] [C7] column_value_new_md5:[d41d8cd98f00b204e9800998ecf8427e](0);[R1] [C8] column_name:long_text;[R1] [C8] column_type:MYSQL_TYPE_LONG_BLOB;[R1] [C8] column_is_rowkey:false;[R1] [C8] column_is_signed:true;[R1] [C8] column_encoding:utf8mb4;[R1] [C8] column_is_not_null:false;[R1] [C8] column_value_new_md5:[c57d4c3741dc0eb85d767497f9736503](50331647);[R1] [C9] column_name:long_blob;[R1] [C9] column_type:MYSQL_TYPE_LONG_BLOB;[R1] [C9] column_is_rowkey:false;[R1] [C9] column_is_signed:true;[R1] [C9] column_encoding:binary;[R1] [C9] column_is_not_null:false;[R1] [C9] column_value_new_md5:[2382bbd355b1c0377240e1d1f79b6081](50331647);$[R2] COMMIT;
ob1.oblog.next_dml;
[R0] BEGIN;[R0] org_cluster_id:1;[R1] record_type:UPDATE;[R1] database_name:oblog_tt.oblog_db1;[R1] table_name:t1;[R1] log_event:true;[R1] column_count:9;[R1] source_category:SRC_FULL_RECORDED;[R1] source_type:SRC_OCEANBASE_1_0;[R1] has_pk:true;[R1] pk_info:(0);[R1] pks:pk;[R1] has_uk:false;[R1] uk_info:(null);[R1] uks:(null);[R1] [C1] column_name:pk;[R1] [C1] column_type:MYSQL_TYPE_LONG;[R1] [C1] column_is_rowkey:true;[R1] [C1] column_is_signed:true;[R1] [C1] column_encoding:binary;[R1] [C1] column_is_not_null:true;[R1] [C1] column_value_new:[3](1);[R1] [C1] column_value_old:[3](1);[R1] [C2] column_name:tiny_text;[R1] [C2] column_type:MYSQL_TYPE_TINY_BLOB;[R1] [C2] column_is_rowkey:false;[R1] [C2] column_is_signed:true;[R1] [C2] column_encoding:utf8mb4;[R1] [C2] column_is_not_null:false;[R1] [C2] column_value_new_origin: PADDING;[R1] [C2] column_value_new_md5:[NULL](0);[R1] [C2] column_value_old_origin: PADDING;[R1] [C2] column_value_old_md5:[NULL](0);[R1] [C3] column_name:tiny_blob;[R1] [C3] column_type:MYSQL_TYPE_TINY_BLOB;[R1] [C3] column_is_rowkey:false;[R1] [C3] column_is_signed:true;[R1] [C3] column_encoding:binary;[R1] [C3] column_is_not_null:false;[R1] [C3] column_value_new_origin: PADDING;[R1] [C3] column_value_new_md5:[NULL](0);[R1] [C3] column_value_old_origin: PADDING;[R1] [C3] column_value_old_md5:[NULL](0);[R1] [C4] column_name:text_type;[R1] [C4] column_type:MYSQL_TYPE_BLOB;[R1] [C4] column_is_rowkey:false;[R1] [C4] column_is_signed:true;[R1] [C4] column_encoding:utf8mb4;[R1] [C4] column_is_not_null:false;[R1] [C4] column_value_new_origin: PADDING;[R1] [C4] column_value_new_md5:[NULL](0);[R1] [C4] column_value_old_origin: PADDING;[R1] [C4] column_value_old_md5:[NULL](0);[R1] [C5] column_name:blob_type;[R1] [C5] column_type:MYSQL_TYPE_BLOB;[R1] [C5] column_is_rowkey:false;[R1] [C5] column_is_signed:true;[R1] [C5] column_encoding:binary;[R1] [C5] column_is_not_null:false;[R1] [C5] column_value_new_origin: PADDING;[R1] [C5] column_value_new_md5:[NULL](0);[R1] [C5] column_value_old_origin: PADDING;[R1] [C5] column_value_old_md5:[NULL](0);[R1] [C6] column_name:medium_text;[R1] [C6] column_type:MYSQL_TYPE_MEDIUM_BLOB;[R1] [C6] column_is_rowkey:false;[R1] [C6] column_is_signed:true;[R1] [C6] column_encoding:utf8mb4;[R1] [C6] column_is_not_null:false;[R1] [C6] column_value_new_origin: PADDING;[R1] [C6] column_value_new_md5:[NULL](0);[R1] [C6] column_value_old_origin: PADDING;[R1] [C6] column_value_old_md5:[NULL](0);[R1] [C7] column_name:medium_blob;[R1] [C7] column_type:MYSQL_TYPE_MEDIUM_BLOB;[R1] [C7] column_is_rowkey:false;[R1] [C7] column_is_signed:true;[R1] [C7] column_encoding:binary;[R1] [C7] column_is_not_null:false;[R1] [C7] column_value_new_origin: PADDING;[R1] [C7] column_value_new_md5:[NULL](0);[R1] [C7] column_value_old_origin: PADDING;[R1] [C7] column_value_old_md5:[NULL](0);[R1] [C8] column_name:long_text;[R1] [C8] column_type:MYSQL_TYPE_LONG_BLOB;[R1] [C8] column_is_rowkey:false;[R1] [C8] column_is_signed:true;[R1] [C8] column_encoding:utf8mb4;[R1] [C8] column_is_not_null:false;[R1] [C8] column_value_new_origin: PADDING;[R1] [C8] column_value_new_md5:[NULL](0);[R1] [C8] column_value_old_origin: PADDING;[R1] [C8] column_value_old_md5:[NULL](0);[R1] [C9] column_name:long_blob;[R1] [C9] column_type:MYSQL_TYPE_LONG_BLOB;[R1] [C9] column_is_rowkey:false;[R1] [C9] column_is_signed:true;[R1] [C9] column_encoding:binary;[R1] [C9] column_is_not_null:false;[R1] [C9] column_value_new_md5:[21ac45796075552d5e54ff8c8d45db78](11534336);[R1] [C9] column_value_old_md5:[2382bbd355b1c0377240e1d1f79b6081](50331647);$[R2] COMMIT;
ob1.oblog.next_dml;
[R0] BEGIN;[R0] org_cluster_id:1;[R1] record_type:UPDATE;[R1] database_name:oblog_tt.oblog_db1;[R1] table_name:t1;[R1] log_event:true;[R1] column_count:9;[R1] source_category:SRC_FULL_RECORDED;[R1] source_type:SRC_OCEANBASE_1_0;[R1] has_pk:true;[R1] pk_info:(0);[R1] pks:pk;[R1] has_uk:false;[R1] uk_info:(null);[R1] uks:(null);[R1] [C1] column_name:pk;[R1] [C1] column_type:MYSQL_TYPE_LONG;[R1] [C1] column_is_rowkey:true;[R1] [C1] column_is_signed:true;[R1] [C1] column_encoding:binary;[R1] [C1] column_is_not_null:true;[R1] [C1] column_value_new:[3](1);[R1] [C1] column_value_old:[3](1);[R1] [C2] column_name:tiny_text;[R1] [C2] column_type:MYSQL_TYPE_TINY_BLOB;[R1] [C2] column_is_rowkey:false;[R1] [C2] column_is_signed:true;[R1] [C2] column_encoding:utf8mb4;[R1] [C2] column_is_not_null:false;[R1] [C2] column_value_new_origin: PADDING;[R1] [C2] column_value_new_md5:[NULL](0);[R1] [C2] column_value_old_origin: PADDING;[R1] [C2] column_value_old_md5:[NULL](0);[R1] [C3] column_name:tiny_blob;[R1] [C3] column_type:MYSQL_TYPE_TINY_BLOB;[R1] [C3] column_is_rowkey:false;[R1] [C3] column_is_signed:true;[R1] [C3] column_encoding:binary;[R1] [C3] column_is_not_null:false;[R1] [C3] column_value_new_origin: PADDING;[R1] [C3] column_value_new_md5:[NULL](0);[R1] [C3] column_value_old_origin: PADDING;[R1] [C3] column_value_old_md5:[NULL](0);[R1] [C4] column_name:text_type;[R1] [C4] column_type:MYSQL_TYPE_BLOB;[R1] [C4] column_is_rowkey:false;[R1] [C4] column_is_signed:true;[R1] [C4] column_encoding:utf8mb4;[R1] [C4] column_is_not_null:false;[R1] [C4] column_value_new_origin: PADDING;[R1] [C4] column_value_new_md5:[NULL](0);[R1] [C4] column_value_old_origin: PADDING;[R1] [C4] column_value_old_md5:[NULL](0);[R1] [C5] column_name:blob_type;[R1] [C5] column_type:MYSQL_TYPE_BLOB;[R1] [C5] column_is_rowkey:false;[R1] [C5] column_is_signed:true;[R1] [C5] column_encoding:binary;[R1] [C5] column_is_not_null:false;[R1] [C5] column_value_new_origin: PADDING;[R1] [C5] column_value_new_md5:[NULL](0);[R1] [C5] column_value_old_origin: PADDING;[R1] [C5] column_value_old_md5:[NULL](0);[R1] [C6] column_name:medium_text;[R1] [C6] column_type:MYSQL_TYPE_MEDIUM_BLOB;[R1] [C6] column_is_rowkey:false;[R1] [C6] column_is_signed:true;[R1] [C6] column_encoding:utf8mb4;[R1] [C6] column_is_not_null:false;[R1] [C6] column_value_new_origin: PADDING;[R1] [C6] column_value_new_md5:[NULL](0);[R1] [C6] column_value_old_origin: PADDING;[R1] [C6] column_value_old_md5:[NULL](0);[R1] [C7] column_name:medium_blob;[R1] [C7] column_type:MYSQL_TYPE_MEDIUM_BLOB;[R1] [C7] column_is_rowkey:false;[R1] [C7] column_is_signed:true;[R1] [C7] column_encoding:binary;[R1] [C7] column_is_not_null:false;[R1] [C7] column_value_new_origin: PADDING;[R1] [C7] column_value_new_md5:[NULL](0);[R1] [C7] column_value_old_origin: PADDING;[R1] [C7] column_value_old_md5:[NULL](0);[R1] [C8] column_name:long_text;[R1] [C8] column_type:MYSQL_TYPE_LONG_BLOB;[R1] [C8] column_is_rowkey:false;[R1] [C8] column_is_signed:true;[R1] [C8] column_encoding:utf8mb4;[R1] [C8] column_is_not_null:false;[R1] [C8] column_value_new_md5:[21ac45796075552d5e54ff8c8d45db78](11534336);[R1] [C8] column_value_old_md5:[c57d4c3741dc0eb85d767497f9736503](50331647);[R1] [C9] column_name:long_blob;[R1] [C9] column_type:MYSQL_TYPE_LONG_BLOB;[R1] [C9] column_is_rowkey:false;[R1] [C9] column_is_signed:true;[R1] [C9] column_encoding:binary;[R1] [C9] column_is_not_null:false;[R1] [C9] column_value_new_md5:[2c935e46cfdb63ec4d3dc7c05351aa7f](11534336);[R1] [C9] column_value_old_md5:[21ac45796075552d5e54ff8c8d45db78](11534336);$[R2] COMMIT;
ob1.oblog.next_dml;
[R0] BEGIN;[R0] org_cluster_id:1;[R1] record_type:INSERT;[R1] database_name:oblog_tt.oblog_db1;[R1] table_name:t1;[R1] log_event:true;[R1] column_count:9;[R1] source_category:SRC_FULL_RECORDED;[R1] source_type:SRC_OCEANBASE_1_0;[R1] has_pk:true;[R1] pk_info:(0);[R1] pks:pk;[R1] has_uk:false;[R1] uk_info:(null);[R1] uks:(null);[R1] [C1] column_name:pk;[R1] [C1] column_type:MYSQL_TYPE_LONG;[R1] [C1] column_is_rowkey:true;[R1] [C1] column_is_signed:true;[R1] [C1] column_encoding:binary;[R1] [C1] column_is_not_null:true;[R1] [C1] column_value_new:[4](1);[R1] [C2] column_name:tiny_text;[R1] [C2] column_type:MYSQL_TYPE_TINY_BLOB;[R1] [C2] column_is_rowkey:false;[R1] [C2] column_is_signed:true;[R1] [C2] column_encoding:utf8mb4;[R1] [C2] column_is_not_null:false;[R1] [C2] column_value_new_md5:[d41d8cd98f00b204e9800998ecf8427e](0);[R1] [C3] column_name:tiny_blob;[R1] [C3] column_type:MYSQL_TYPE_TINY_BLOB;[R1] [C3] column_is_rowkey:false;[R1] [C3] column_is_signed:true;[R1] [C3] column_encoding:binary;[R1] [C3] column_is_not_null:false;[R1] [C3] column_value_new_md5:[d41d8cd98f00b204e9800998ecf8427e](0);[R1] [C4] column_name:text_type;[R1] [C4] column_type:MYSQL_TYPE_BLOB;[R1] [C4] column_is_rowkey:false;[R1] [C4] column_is_signed:true;[R1] [C4] column_encoding:utf8mb4;[R1] [C4] column_is_not_null:false;[R1] [C4] column_value_new_md5:[16a9e4895c6169a9a8da828f6d4b4896](63210);[R1] [C5] column_name:blob_type;[R1] [C5] column_type:MYSQL_TYPE_BLOB;[R1] [C5] column_is_rowkey:false;[R1] [C5] column_is_signed:true;[R1] [C5] column_encoding:binary;[R1] [C5] column_is_not_null:false;[R1] [C5] column_value_new_md5:[d41d8cd98f00b204e9800998ecf8427e](0);[R1] [C6] column_name:medium_text;[R1] [C6] column_type:MYSQL_TYPE_MEDIUM_BLOB;[R1] [C6] column_is_rowkey:false;[R1] [C6] column_is_signed:true;[R1] [C6] column_encoding:utf8mb4;[R1] [C6] column_is_not_null:false;[R1] [C6] column_value_new_md5:[d5300422b42b6fc65e3213972d51d901](654321);[R1] [C7] column_name:medium_blob;[R1] [C7] column_type:MYSQL_TYPE_MEDIUM_BLOB;[R1] [C7] column_is_rowkey:false;[R1] [C7] column_is_signed:true;[R1] [C7] column_encoding:binary;[R1] [C7] column_is_not_null:false;[R1] [C7] column_value_new_md5:[d41d8cd98f00b204e9800998ecf8427e](0);[R1] [C8] column_name:long_text;[R1] [C8] column_type:MYSQL_TYPE_LONG_BLOB;[R1] [C8] column_is_rowkey:false;[R1] [C8] column_is_signed:true;[R1] [C8] column_encoding:utf8mb4;[R1] [C8] column_is_not_null:false;[R1] [C8] column_value_new_md5:[c57d4c3741dc0eb85d767497f9736503](50331647);[R1] [C9] column_name:long_blob;[R1] [C9] column_type:MYSQL_TYPE_LONG_BLOB;[R1] [C9] column_is_rowkey:false;[R1] [C9] column_is_signed:true;[R1] [C9] column_encoding:binary;[R1] [C9] column_is_not_null:false;[R1] [C9] column_value_new_md5:[2382bbd355b1c0377240e1d1f79b6081](50331647);$[R2] COMMIT;
ob1.oblog.next_dml;
[R0] BEGIN;[R0] org_cluster_id:1;[R1] record_type:UPDATE;[R1] database_name:oblog_tt.oblog_db1;[R1] table_name:t1;[R1] log_event:true;[R1] column_count:9;[R1] source_category:SRC_FULL_RECORDED;[R1] source_type:SRC_OCEANBASE_1_0;[R1] has_pk:true;[R1] pk_info:(0);[R1] pks:pk;[R1] has_uk:false;[R1] uk_info:(null);[R1] uks:(null);[R1] [C1] column_name:pk;[R1] [C1] column_type:MYSQL_TYPE_LONG;[R1] [C1] column_is_rowkey:true;[R1] [C1] column_is_signed:true;[R1] [C1] column_encoding:binary;[R1] [C1] column_is_not_null:true;[R1] [C1] column_value_new:[4](1);[R1] [C1] column_value_old:[4](1);[R1] [C2] column_name:tiny_text;[R1] [C2] column_type:MYSQL_TYPE_TINY_BLOB;[R1] [C2] column_is_rowkey:false;[R1] [C2] column_is_signed:true;[R1] [C2] column_encoding:utf8mb4;[R1] [C2] column_is_not_null:false;[R1] [C2] column_value_new_origin: PADDING;[R1] [C2] column_value_new_md5:[NULL](0);[R1] [C2] column_value_old_origin: PADDING;[R1] [C2] column_value_old_md5:[NULL](0);[R1] [C3] column_name:tiny_blob;[R1] [C3] column_type:MYSQL_TYPE_TINY_BLOB;[R1] [C3] column_is_rowkey:false;[R1] [C3] column_is_signed:true;[R1] [C3] column_encoding:binary;[R1] [C3] column_is_not_null:false;[R1] [C3] column_value_new_origin: PADDING;[R1] [C3] column_value_new_md5:[NULL](0);[R1] [C3] column_value_old_origin: PADDING;[R1] [C3] column_value_old_md5:[NULL](0);[R1] [C4] column_name:text_type;[R1] [C4] column_type:MYSQL_TYPE_BLOB;[R1] [C4] column_is_rowkey:false;[R1] [C4] column_is_signed:true;[R1] [C4] column_encoding:utf8mb4;[R1] [C4] column_is_not_null:false;[R1] [C4] column_value_new_origin: PADDING;[R1] [C4] column_value_new_md5:[NULL](0);[R1] [C4] column_value_old_origin: PADDING;[R1] [C4] column_value_old_md5:[NULL](0);[R1] [C5] column_name:blob_type;[R1] [C5] column_type:MYSQL_TYPE_BLOB;[R1] [C5] column_is_rowkey:false;[R1] [C5] column_is_signed:true;[R1] [C5] column_encoding:binary;[R1] [C5] column_is_not_null:false;[R1] [C5] column_value_new_origin: PADDING;[R1] [C5] column_value_new_md5:[NULL](0);[R1] [C5] column_value_old_origin: PADDING;[R1] [C5] column_value_old_md5:[NULL](0);[R1] [C6] column_name:medium_text;[R1] [C6] column_type:MYSQL_TYPE_MEDIUM_BLOB;[R1] [C6] column_is_rowkey:false;[R1] [C6] column_is_signed:true;[R1] [C6] column_encoding:utf8mb4;[R1] [C6] column_is_not_null:false;[R1] [C6] column_value_new_origin: PADDING;[R1] [C6] column_value_new_md5:[NULL](0);[R1] [C6] column_value_old_origin: PADDING;[R1] [C6] column_value_old_md5:[NULL](0);[R1] [C7] column_name:medium_blob;[R1] [C7] column_type:MYSQL_TYPE_MEDIUM_BLOB;[R1] [C7] column_is_rowkey:false;[R1] [C7] column_is_signed:true;[R1] [C7] column_encoding:binary;[R1] [C7] column_is_not_null:false;[R1] [C7] column_value_new_origin: PADDING;[R1] [C7] column_value_new_md5:[NULL](0);[R1] [C7] column_value_old_origin: PADDING;[R1] [C7] column_value_old_md5:[NULL](0);[R1] [C8] column_name:long_text;[R1] [C8] column_type:MYSQL_TYPE_LONG_BLOB;[R1] [C8] column_is_rowkey:false;[R1] [C8] column_is_signed:true;[R1] [C8] column_encoding:utf8mb4;[R1] [C8] column_is_not_null:false;[R1] [C8] column_value_new_md5:[d41d8cd98f00b204e9800998ecf8427e](0);[R1] [C8] column_value_old_origin: PADDING;[R1] [C8] column_value_old_md5:[NULL](0);[R1] [C9] column_name:long_blob;[R1] [C9] column_type:MYSQL_TYPE_LONG_BLOB;[R1] [C9] column_is_rowkey:false;[R1] [C9] column_is_signed:true;[R1] [C9] column_encoding:binary;[R1] [C9] column_is_not_null:false;[R1] [C9] column_value_new_md5:[NULL](0);[R1] [C9] column_value_old_origin: PADDING;[R1] [C9] column_value_old_md5:[NULL](0);$[R2] COMMIT;
ob1.oblog.next_dml;
[R0] BEGIN;[R0] org_cluster_id:1;[R1] record_type:UPDATE;[R1] database_name:oblog_tt.oblog_db1;[R1] table_name:t1;[R1] log_event:true;[R1] column_count:9;[R1] source_category:SRC_FULL_RECORDED;[R1] source_type:SRC_OCEANBASE_1_0;[R1] has_pk:true;[R1] pk_info:(0);[R1] pks:pk;[R1] has_uk:false;[R1] uk_info:(null);[R1] uks:(null);[R1] [C1] column_name:pk;[R1] [C1] column_type:MYSQL_TYPE_LONG;[R1] [C1] column_is_rowkey:true;[R1] [C1] column_is_signed:true;[R1] [C1] column_encoding:binary;[R1] [C1] column_is_not_null:true;[R1] [C1] column_value_new:[4](1);[R1] [C1] column_value_old:[4](1);[R1] [C2] column_name:tiny_text;[R1] [C2] column_type:MYSQL_TYPE_TINY_BLOB;[R1] [C2] column_is_rowkey:false;[R1] [C2] column_is_signed:true;[R1] [C2] column_encoding:utf8mb4;[R1] [C2] column_is_not_null:false;[R1] [C2] column_value_new_origin: PADDING;[R1] [C2] column_value_new_md5:[NULL](0);[R1] [C2] column_value_old_origin: PADDING;[R1] [C2] column_value_old_md5:[NULL](0);[R1] [C3] column_name:tiny_blob;[R1] [C3] column_type:MYSQL_TYPE_TINY_BLOB;[R1] [C3] column_is_rowkey:false;[R1] [C3] column_is_signed:true;[R1] [C3] column_encoding:binary;[R1] [C3] column_is_not_null:false;[R1] [C3] column_value_new_origin: PADDING;[R1] [C3] column_value_new_md5:[NULL](0);[R1] [C3] column_value_old_origin: PADDING;[R1] [C3] column_value_old_md5:[NULL](0);[R1] [C4] column_name:text_type;[R1] [C4] column_type:MYSQL_TYPE_BLOB;[R1] [C4] column_is_rowkey:false;[R1] [C4] column_is_signed:true;[R1] [C4] column_encoding:utf8mb4;[R1] [C4] column_is_not_null:false;[R1] [C4] column_value_new_origin: PADDING;[R1] [C4] column_value_new_md5:[NULL](0);[R1] [C4] column_value_old_origin: PADDING;[R1] [C4] column_value_old_md5:[NULL](0);[R1] [C5] column_name:blob_type;[R1] [C5] column_type:MYSQL_TYPE_BLOB;[R1] [C5] column_is_rowkey:false;[R1] [C5] column_is_signed:true;[R1] [C5] column_encoding:binary;[R1] [C5] column_is_not_null:false;[R1] [C5] column_value_new_origin: PADDING;[R1] [C5] column_value_new_md5:[NULL](0);[R1] [C5] column_value_old_origin: PADDING;[R1] [C5] column_value_old_md5:[NULL](0);[R1] [C6] column_name:medium_text;[R1] [C6] column_type:MYSQL_TYPE_MEDIUM_BLOB;[R1] [C6] column_is_rowkey:false;[R1] [C6] column_is_signed:true;[R1] [C6] column_encoding:utf8mb4;[R1] [C6] column_is_not_null:false;[R1] [C6] column_value_new_origin: PADDING;[R1] [C6] column_value_new_md5:[NULL](0);[R1] [C6] column_value_old_origin: PADDING;[R1] [C6] column_value_old_md5:[NULL](0);[R1] [C7] column_name:medium_blob;[R1] [C7] column_type:MYSQL_TYPE_MEDIUM_BLOB;[R1] [C7] column_is_rowkey:false;[R1] [C7] column_is_signed:true;[R1] [C7] column_encoding:binary;[R1] [C7] column_is_not_null:false;[R1] [C7] column_value_new_origin: PADDING;[R1] [C7] column_value_new_md5:[NULL](0);[R1] [C7] column_value_old_origin: PADDING;[R1] [C7] column_value_old_md5:[NULL](0);[R1] [C8] column_name:long_text;[R1] [C8] column_type:MYSQL_TYPE_LONG_BLOB;[R1] [C8] column_is_rowkey:false;[R1] [C8] column_is_signed:true;[R1] [C8] column_encoding:utf8mb4;[R1] [C8] column_is_not_null:false;[R1] [C8] column_value_new_md5:[NULL](0);[R1] [C8] column_value_old_md5:[d41d8cd98f00b204e9800998ecf8427e](0);[R1] [C9] column_name:long_blob;[R1] [C9] column_type:MYSQL_TYPE_LONG_BLOB;[R1] [C9] column_is_rowkey:false;[R1] [C9] column_is_signed:true;[R1] [C9] column_encoding:binary;[R1] [C9] column_is_not_null:false;[R1] [C9] column_value_new_md5:[d41d8cd98f00b204e9800998ecf8427e](0);[R1] [C9] column_value_old_md5:[NULL](0);$[R2] COMMIT;
ob1.oblog.next_dml;
[R0] BEGIN;[R0] org_cluster_id:1;[R1] record_type:UPDATE;[R1] database_name:oblog_tt.oblog_db1;[R1] table_name:t1;[R1] log_event:true;[R1] column_count:9;[R1] source_category:SRC_FULL_RECORDED;[R1] source_type:SRC_OCEANBASE_1_0;[R1] has_pk:true;[R1] pk_info:(0);[R1] pks:pk;[R1] has_uk:false;[R1] uk_info:(null);[R1] uks:(null);[R1] [C1] column_name:pk;[R1] [C1] column_type:MYSQL_TYPE_LONG;[R1] [C1] column_is_rowkey:true;[R1] [C1] column_is_signed:true;[R1] [C1] column_encoding:binary;[R1] [C1] column_is_not_null:true;[R1] [C1] column_value_new:[4](1);[R1] [C1] column_value_old:[4](1);[R1] [C2] column_name:tiny_text;[R1] [C2] column_type:MYSQL_TYPE_TINY_BLOB;[R1] [C2] column_is_rowkey:false;[R1] [C2] column_is_signed:true;[R1] [C2] column_encoding:utf8mb4;[R1] [C2] column_is_not_null:false;[R1] [C2] column_value_new_origin: PADDING;[R1] [C2] column_value_new_md5:[NULL](0);[R1] [C2] column_value_old_origin: PADDING;[R1] [C2] column_value_old_md5:[NULL](0);[R1] [C3] column_name:tiny_blob;[R1] [C3] column_type:MYSQL_TYPE_TINY_BLOB;[R1] [C3] column_is_rowkey:false;[R1] [C3] column_is_signed:true;[R1] [C3] column_encoding:binary;[R1] [C3] column_is_not_null:false;[R1] [C3] column_value_new_origin: PADDING;[R1] [C3] column_value_new_md5:[NULL](0);[R1] [C3] column_value_old_origin: PADDING;[R1] [C3] column_value_old_md5:[NULL](0);[R1] [C4] column_name:text_type;[R1] [C4] column_type:MYSQL_TYPE_BLOB;[R1] [C4] column_is_rowkey:false;[R1] [C4] column_is_signed:true;[R1] [C4] column_encoding:utf8mb4;[R1] [C4] column_is_not_null:false;[R1] [C4] column_value_new_origin: PADDING;[R1] [C4] column_value_new_md5:[NULL](0);[R1] [C4] column_value_old_origin: PADDING;[R1] [C4] column_value_old_md5:[NULL](0);[R1] [C5] column_name:blob_type;[R1] [C5] column_type:MYSQL_TYPE_BLOB;[R1] [C5] column_is_rowkey:false;[R1] [C5] column_is_signed:true;[R1] [C5] column_encoding:binary;[R1] [C5] column_is_not_null:false;[R1] [C5] column_value_new_origin: PADDING;[R1] [C5] column_value_new_md5:[NULL](0);[R1] [C5] column_value_old_origin: PADDING;[R1] [C5] column_value_old_md5:[NULL](0);[R1] [C6] column_name:medium_text;[R1] [C6] column_type:MYSQL_TYPE_MEDIUM_BLOB;[R1] [C6] column_is_rowkey:false;[R1] [C6] column_is_signed:true;[R1] [C6] column_encoding:utf8mb4;[R1] [C6] column_is_not_null:false;[R1] [C6] column_value_new_origin: PADDING;[R1] [C6] column_value_new_md5:[NULL](0);[R1] [C6] column_value_old_origin: PADDING;[R1] [C6] column_value_old_md5:[NULL](0);[R1] [C7] column_name:medium_blob;[R1] [C7] column_type:MYSQL_TYPE_MEDIUM_BLOB;[R1] [C7] column_is_rowkey:false;[R1] [C7] column_is_signed:true;[R1] [C7] column_encoding:binary;[R1] [C7] column_is_not_null:false;[R1] [C7] column_value_new_origin: PADDING;[R1] [C7] column_value_new_md5:[NULL](0);[R1] [C7] column_value_old_origin: PADDING;[R1] [C7] column_value_old_md5:[NULL](0);[R1] [C8] column_name:long_text;[R1] [C8] column_type:MYSQL_TYPE_LONG_BLOB;[R1] [C8] column_is_rowkey:false;[R1] [C8] column_is_signed:true;[R1] [C8] column_encoding:utf8mb4;[R1] [C8] column_is_not_null:false;[R1] [C8] column_value_new_md5:[c57d4c3741dc0eb85d767497f9736503](50331647);[R1] [C8] column_value_old_md5:[NULL](0);[R1] [C9] column_name:long_blob;[R1] [C9] column_type:MYSQL_TYPE_LONG_BLOB;[R1] [C9] column_is_rowkey:false;[R1] [C9] column_is_signed:true;[R1] [C9] column_encoding:binary;[R1] [C9] column_is_not_null:false;[R1] [C9] column_value_new_md5:[2382bbd355b1c0377240e1d1f79b6081](50331647);[R1] [C9] column_value_old_md5:[d41d8cd98f00b204e9800998ecf8427e](0);$[R2] COMMIT;
ob1.oblog.next_dml;
[R0] BEGIN;[R0] org_cluster_id:1;[R1] record_type:UPDATE;[R1] database_name:oblog_tt.oblog_db1;[R1] table_name:t1;[R1] log_event:true;[R1] column_count:9;[R1] source_category:SRC_FULL_RECORDED;[R1] source_type:SRC_OCEANBASE_1_0;[R1] has_pk:true;[R1] pk_info:(0);[R1] pks:pk;[R1] has_uk:false;[R1] uk_info:(null);[R1] uks:(null);[R1] [C1] column_name:pk;[R1] [C1] column_type:MYSQL_TYPE_LONG;[R1] [C1] column_is_rowkey:true;[R1] [C1] column_is_signed:true;[R1] [C1] column_encoding:binary;[R1] [C1] column_is_not_null:true;[R1] [C1] column_value_new:[4](1);[R1] [C1] column_value_old:[4](1);[R1] [C2] column_name:tiny_text;[R1] [C2] column_type:MYSQL_TYPE_TINY_BLOB;[R1] [C2] column_is_rowkey:false;[R1] [C2] column_is_signed:true;[R1] [C2] column_encoding:utf8mb4;[R1] [C2] column_is_not_null:false;[R1] [C2] column_value_new_origin: PADDING;[R1] [C2] column_value_new_md5:[NULL](0);[R1] [C2] column_value_old_origin: PADDING;[R1] [C2] column_value_old_md5:[NULL](0);[R1] [C3] column_name:tiny_blob;[R1] [C3] column_type:MYSQL_TYPE_TINY_BLOB;[R1] [C3] column_is_rowkey:false;[R1] [C3] column_is_signed:true;[R1] [C3] column_encoding:binary;[R1] [C3] column_is_not_null:false;[R1] [C3] column_value_new_origin: PADDING;[R1] [C3] column_value_new_md5:[NULL](0);[R1] [C3] column_value_old_origin: PADDING;[R1] [C3] column_value_old_md5:[NULL](0);[R1] [C4] column_name:text_type;[R1] [C4] column_type:MYSQL_TYPE_BLOB;[R1] [C4] column_is_rowkey:false;[R1] [C4] column_is_signed:true;[R1] [C4] column_encoding:utf8mb4;[R1] [C4] column_is_not_null:false;[R1] [C4] column_value_new_origin: PADDING;[R1] [C4] column_value_new_md5:[NULL](0);[R1] [C4] column_value_old_origin: PADDING;[R1] [C4] column_value_old_md5:[NULL](0);[R1] [C5] column_name:blob_type;[R1] [C5] column_type:MYSQL_TYPE_BLOB;[R1] [C5] column_is_rowkey:false;[R1] [C5] column_is_signed:true;[R1] [C5] column_encoding:binary;[R1] [C5] column_is_not_null:false;[R1] [C5] column_value_new_origin: PADDING;[R1] [C5] column_value_new_md5:[NULL](0);[R1] [C5] column_value_old_origin: PADDING;[R1] [C5] column_value_old_md5:[NULL](0);[R1] [C6] column_name:medium_text;[R1] [C6] column_type:MYSQL_TYPE_MEDIUM_BLOB;[R1] [C6] column_is_rowkey:false;[R1] [C6] column_is_signed:true;[R1] [C6] column_encoding:utf8mb4;[R1] [C6] column_is_not_null:false;[R1] [C6] column_value_new_origin: PADDING;[R1] [C6] column_value_new_md5:[NULL](0);[R1] [C6] column_value_old_origin: PADDING;[R1] [C6] column_value_old_md5:[NULL](0);[R1] [C7] column_name:medium_blob;[R1] [C7] column_type:MYSQL_TYPE_MEDIUM_BLOB;[R1] [C7] column_is_rowkey:false;[R1] [C7] column_is_signed:true;[R1] [C7] column_encoding:binary;[R1] [C7] column_is_not_null:false;[R1] [C7] column_value_new_origin: PADDING;[R1] [C7] column_value_new_md5:[NULL](0);[R1] [C7] column_value_old_origin: PADDING;[R1] [C7] column_value_old_md5:[NULL](0);[R1] [C8] column_name:long_text;[R1] [C8] column_type:MYSQL_TYPE_LONG_BLOB;[R1] [C8] column_is_rowkey:false;[R1] [C8] column_is_signed:true;[R1] [C8] column_encoding:utf8mb4;[R1] [C8] column_is_not_null:false;[R1] [C8] column_value_new_md5:[f75702e1f9894f0e15cb45faae9ed0fc](9);[R1] [C8] column_value_old_origin: PADDING;[R1] [C8] column_value_old_md5:[NULL](0);[R1] [C9] column_name:long_blob;[R1] [C9] column_type:MYSQL_TYPE_LONG_BLOB;[R1] [C9] column_is_rowkey:false;[R1] [C9] column_is_signed:true;[R1] [C9] column_encoding:binary;[R1] [C9] column_is_not_null:false;[R1] [C9] column_value_new_md5:[36a03906ff74e6e496273de4b509bd39](13);[R1] [C9] column_value_old_origin: PADDING;[R1] [C9] column_value_old_md5:[NULL](0);$[R2] COMMIT;
ob1.oblog.next_dml;
[R0] BEGIN;[R0] org_cluster_id:1;[R1] record_type:DELETE;[R1] database_name:oblog_tt.oblog_db1;[R1] table_name:t1;[R1] log_event:true;[R1] column_count:9;[R1] source_category:SRC_FULL_RECORDED;[R1] source_type:SRC_OCEANBASE_1_0;[R1] has_pk:true;[R1] pk_info:(0);[R1] pks:pk;[R1] has_uk:false;[R1] uk_info:(null);[R1] uks:(null);[R1] [C1] column_name:pk;[R1] [C1] column_type:MYSQL_TYPE_LONG;[R1] [C1] column_is_rowkey:true;[R1] [C1] column_is_signed:true;[R1] [C1] column_encoding:binary;[R1] [C1] column_is_not_null:true;[R1] [C1] column_value_old:[3](1);[R1] [C2] column_name:tiny_text;[R1] [C2] column_type:MYSQL_TYPE_TINY_BLOB;[R1] [C2] column_is_rowkey:false;[R1] [C2] column_is_signed:true;[R1] [C2] column_encoding:utf8mb4;[R1] [C2] column_is_not_null:false;[R1] [C2] column_value_old_origin: PADDING;[R1] [C2] column_value_old_md5:[NULL](0);[R1] [C3] column_name:tiny_blob;[R1] [C3] column_type:MYSQL_TYPE_TINY_BLOB;[R1] [C3] column_is_rowkey:false;[R1] [C3] column_is_signed:true;[R1] [C3] column_encoding:binary;[R1] [C3] column_is_not_null:false;[R1] [C3] column_value_old_origin: PADDING;[R1] [C3] column_value_old_md5:[NULL](0);[R1] [C4] column_name:text_type;[R1] [C4] column_type:MYSQL_TYPE_BLOB;[R1] [C4] column_is_rowkey:false;[R1] [C4] column_is_signed:true;[R1] [C4] column_encoding:utf8mb4;[R1] [C4] column_is_not_null:false;[R1] [C4] column_value_old_md5:[d41d8cd98f00b204e9800998ecf8427e](0);[R1] [C5] column_name:blob_type;[R1] [C5] column_type:MYSQL_TYPE_BLOB;[R1] [C5] column_is_rowkey:false;[R1] [C5] column_is_signed:true;[R1] [C5] column_encoding:binary;[R1] [C5] column_is_not_null:false;[R1] [C5] column_value_old_md5:[d41d8cd98f00b204e9800998ecf8427e](0);[R1] [C6] column_name:medium_text;[R1] [C6] column_type:MYSQL_TYPE_MEDIUM_BLOB;[R1] [C6] column_is_rowkey:false;[R1] [C6] column_is_signed:true;[R1] [C6] column_encoding:utf8mb4;[R1] [C6] column_is_not_null:false;[R1] [C6] column_value_old_md5:[d41d8cd98f00b204e9800998ecf8427e](0);[R1] [C7] column_name:medium_blob;[R1] [C7] column_type:MYSQL_TYPE_MEDIUM_BLOB;[R1] [C7] column_is_rowkey:false;[R1] [C7] column_is_signed:true;[R1] [C7] column_encoding:binary;[R1] [C7] column_is_not_null:false;[R1] [C7] column_value_old_md5:[d41d8cd98f00b204e9800998ecf8427e](0);[R1] [C8] column_name:long_text;[R1] [C8] column_type:MYSQL_TYPE_LONG_BLOB;[R1] [C8] column_is_rowkey:false;[R1] [C8] column_is_signed:true;[R1] [C8] column_encoding:utf8mb4;[R1] [C8] column_is_not_null:false;[R1] [C8] column_value_old_origin: PADDING;[R1] [C8] column_value_old_md5:[NULL](0);[R1] [C9] column_name:long_blob;[R1] [C9] column_type:MYSQL_TYPE_LONG_BLOB;[R1] [C9] column_is_rowkey:false;[R1] [C9] column_is_signed:true;[R1] [C9] column_encoding:binary;[R1] [C9] column_is_not_null:false;[R1] [C9] column_value_old_origin: PADDING;[R1] [C9] column_value_old_md5:[NULL](0);$[R2] COMMIT;
ob1.oblog.next_dml;
[R0] BEGIN;[R0] org_cluster_id:1;[R1] record_type:DELETE;[R1] database_name:oblog_tt.oblog_db1;[R1] table_name:t1;[R1] log_event:true;[R1] column_count:9;[R1] source_category:SRC_FULL_RECORDED;[R1] source_type:SRC_OCEANBASE_1_0;[R1] has_pk:true;[R1] pk_info:(0);[R1] pks:pk;[R1] has_uk:false;[R1] uk_info:(null);[R1] uks:(null);[R1] [C1] column_name:pk;[R1] [C1] column_type:MYSQL_TYPE_LONG;[R1] [C1] column_is_rowkey:true;[R1] [C1] column_is_signed:true;[R1] [C1] column_encoding:binary;[R1] [C1] column_is_not_null:true;[R1] [C1] column_value_old:[4](1);[R1] [C2] column_name:tiny_text;[R1] [C2] column_type:MYSQL_TYPE_TINY_BLOB;[R1] [C2] column_is_rowkey:false;[R1] [C2] column_is_signed:true;[R1] [C2] column_encoding:utf8mb4;[R1] [C2] column_is_not_null:false;[R1] [C2] column_value_old_origin: PADDING;[R1] [C2] column_value_old_md5:[NULL](0);[R1] [C3] column_name:tiny_blob;[R1] [C3] column_type:MYSQL_TYPE_TINY_BLOB;[R1] [C3] column_is_rowkey:false;[R1] [C3] column_is_signed:true;[R1] [C3] column_encoding:binary;[R1] [C3] column_is_not_null:false;[R1] [C3] column_value_old_origin: PADDING;[R1] [C3] column_value_old_md5:[NULL](0);[R1] [C4] column_name:text_type;[R1] [C4] column_type:MYSQL_TYPE_BLOB;[R1] [C4] column_is_rowkey:false;[R1] [C4] column_is_signed:true;[R1] [C4] column_encoding:utf8mb4;[R1] [C4] column_is_not_null:false;[R1] [C4] column_value_old_origin: PADDING;[R1] [C4] column_value_old_md5:[NULL](0);[R1] [C5] column_name:blob_type;[R1] [C5] column_type:MYSQL_TYPE_BLOB;[R1] [C5] column_is_rowkey:false;[R1] [C5] column_is_signed:true;[R1] [C5] column_encoding:binary;[R1] [C5] column_is_not_null:false;[R1] [C5] column_value_old_md5:[d41d8cd98f00b204e9800998ecf8427e](0);[R1] [C6] column_name:medium_text;[R1] [C6] column_type:MYSQL_TYPE_MEDIUM_BLOB;[R1] [C6] column_is_rowkey:false;[R1] [C6] column_is_signed:true;[R1] [C6] column_encoding:utf8mb4;[R1] [C6] column_is_not_null:false;[R1] [C6] column_value_old_origin: PADDING;[R1] [C6] column_value_old_md5:[NULL](0);[R1] [C7] column_name:medium_blob;[R1] [C7] column_type:MYSQL_TYPE_MEDIUM_BLOB;[R1] [C7] column_is_rowkey:false;[R1] [C7] column_is_signed:true;[R1] [C7] column_encoding:binary;[R1] [C7] column_is_not_null:false;[R1] [C7] column_value_old_md5:[d41d8cd98f00b204e9800998ecf8427e](0);[R1] [C8] column_name:long_text;[R1] [C8] column_type:MYSQL_TYPE_LONG_BLOB;[R1] [C8] column_is_rowkey:false;[R1] [C8] column_is_signed:true;[R1] [C8] column_encoding:utf8mb4;[R1] [C8] column_is_not_null:false;[R1] [C8] column_value_old_md5:[f75702e1f9894f0e15cb45faae9ed0fc](9);[R1] [C9] column_name:long_blob;[R1] [C9] column_type:MYSQL_TYPE_LONG_BLOB;[R1] [C9] column_is_rowkey:false;[R1] [C9] column_is_signed:true;[R1] [C9] column_encoding:binary;[R1] [C9] column_is_not_null:false;[R1] [C9] column_value_old_md5:[36a03906ff74e6e496273de4b509bd39](13);$[R2] COMMIT;
ob1.oblog.stop;
