ob1=OBI(cluster=1,init_unit_cpu=2);
ob1.reboot;
ob1.create_client;
create resource unit oblog_box max_cpu 2, memory_size='20G';
create resource pool oblog_pool unit = 'oblog_box', unit_num = 1, zone_list = ('z1');
create tenant oblog_tt replica_num = 1, primary_zone='z1', resource_pool_list=('oblog_pool') set ob_tcp_invited_nodes='%';
ob1.oblog.gen_conf tb_white_list=oblog_tt.oblog_db1.* log_level=DEBUG;
ob1.oblog.set_extra_argument -i;
ob1.oblog.restart;
create database oblog_db1;
ob1.oblog.next;
[R0] record_type:EDDL;[R0] db_name:oblog_tt;[R0] table_name:;[R0] column_count:1;[R0] column_name:ddl;[R0] ddl_stmt_str: create database oblog_db1;[R0] ddl_stmt_len: 25;
use oblog_db1;
set sql_mode = 'STRICT_ALL_TABLES,ALLOW_INVALID_DATES';
create table simple_mysql_date(c0 date, c1 datetime, c2 datetime(6));
ob1.oblog.next;
[R0] record_type:EDDL;[R0] db_name:oblog_tt.oblog_db1;[R0] table_name:;[R0] column_count:1;[R0] column_name:ddl;[R0] ddl_stmt_str: create table simple_mysql_date(c0 date, c1 datetime, c2 datetime(6));[R0] ddl_stmt_len: 68;
insert into simple_mysql_date values(date'2024-07-30', '2024-07-30 18:30:45', '2024-07-30 18:30:45.123456');
ob1.oblog.next;
[R0] BEGIN;[R0] org_cluster_id:1;[R1] record_type:INSERT;[R1] database_name:oblog_tt.oblog_db1;[R1] table_name:simple_mysql_date;[R1] log_event:true;[R1] column_count:4;[R1] source_category:SRC_FULL_RECORDED;[R1] source_type:SRC_OCEANBASE_1_0;[R1] has_pk:true;[R1] pk_info:(0);[R1] pks:__pk_increment;[R1] has_uk:false;[R1] uk_info:(null);[R1] uks:(null);[R1] [C1] column_name:__pk_increment;[R1] [C1] column_type:MYSQL_TYPE_LONGLONG;[R1] [C1] column_is_rowkey:true;[R1] [C1] column_is_signed:false;[R1] [C1] column_encoding:binary;[R1] [C1] column_is_not_null:true;[R1] [C1] column_value_new:[1](1);[R1] [C2] column_name:c0;[R1] [C2] column_type:MYSQL_TYPE_DATE;[R1] [C2] column_is_rowkey:false;[R1] [C2] column_is_signed:true;[R1] [C2] column_encoding:binary;[R1] [C2] column_is_not_null:false;[R1] [C2] column_value_new:[2024-07-30](10);[R1] [C3] column_name:c1;[R1] [C3] column_type:MYSQL_TYPE_DATETIME;[R1] [C3] column_is_rowkey:false;[R1] [C3] column_is_signed:true;[R1] [C3] column_encoding:binary;[R1] [C3] column_is_not_null:false;[R1] [C3] column_scale:0;[R1] [C3] column_value_new:[2024-07-30 18:30:45](19);[R1] [C4] column_name:c2;[R1] [C4] column_type:MYSQL_TYPE_DATETIME;[R1] [C4] column_is_rowkey:false;[R1] [C4] column_is_signed:true;[R1] [C4] column_encoding:binary;[R1] [C4] column_is_not_null:false;[R1] [C4] column_scale:6;[R1] [C4] column_value_new:[2024-07-30 18:30:45.123456](26);$[R2] COMMIT;
insert into simple_mysql_date values(date'2024-02-31', '2024-02-31 18:30:45', '2024-02-31 18:30:45.123456');
ob1.oblog.next;
[R0] BEGIN;[R0] org_cluster_id:1;[R1] record_type:INSERT;[R1] database_name:oblog_tt.oblog_db1;[R1] table_name:simple_mysql_date;[R1] log_event:true;[R1] column_count:4;[R1] source_category:SRC_FULL_RECORDED;[R1] source_type:SRC_OCEANBASE_1_0;[R1] has_pk:true;[R1] pk_info:(0);[R1] pks:__pk_increment;[R1] has_uk:false;[R1] uk_info:(null);[R1] uks:(null);[R1] [C1] column_name:__pk_increment;[R1] [C1] column_type:MYSQL_TYPE_LONGLONG;[R1] [C1] column_is_rowkey:true;[R1] [C1] column_is_signed:false;[R1] [C1] column_encoding:binary;[R1] [C1] column_is_not_null:true;[R1] [C1] column_value_new:[2](1);[R1] [C2] column_name:c0;[R1] [C2] column_type:MYSQL_TYPE_DATE;[R1] [C2] column_is_rowkey:false;[R1] [C2] column_is_signed:true;[R1] [C2] column_encoding:binary;[R1] [C2] column_is_not_null:false;[R1] [C2] column_value_new:[2024-02-31](10);[R1] [C3] column_name:c1;[R1] [C3] column_type:MYSQL_TYPE_DATETIME;[R1] [C3] column_is_rowkey:false;[R1] [C3] column_is_signed:true;[R1] [C3] column_encoding:binary;[R1] [C3] column_is_not_null:false;[R1] [C3] column_scale:0;[R1] [C3] column_value_new:[2024-02-31 18:30:45](19);[R1] [C4] column_name:c2;[R1] [C4] column_type:MYSQL_TYPE_DATETIME;[R1] [C4] column_is_rowkey:false;[R1] [C4] column_is_signed:true;[R1] [C4] column_encoding:binary;[R1] [C4] column_is_not_null:false;[R1] [C4] column_scale:6;[R1] [C4] column_value_new:[2024-02-31 18:30:45.123456](26);$[R2] COMMIT;
insert into simple_mysql_date values('2024-00-31', '2024-00-31 18:30:45', '2024-00-31 18:30:45.654321');
ob1.oblog.next;
[R0] BEGIN;[R0] org_cluster_id:1;[R1] record_type:INSERT;[R1] database_name:oblog_tt.oblog_db1;[R1] table_name:simple_mysql_date;[R1] log_event:true;[R1] column_count:4;[R1] source_category:SRC_FULL_RECORDED;[R1] source_type:SRC_OCEANBASE_1_0;[R1] has_pk:true;[R1] pk_info:(0);[R1] pks:__pk_increment;[R1] has_uk:false;[R1] uk_info:(null);[R1] uks:(null);[R1] [C1] column_name:__pk_increment;[R1] [C1] column_type:MYSQL_TYPE_LONGLONG;[R1] [C1] column_is_rowkey:true;[R1] [C1] column_is_signed:false;[R1] [C1] column_encoding:binary;[R1] [C1] column_is_not_null:true;[R1] [C1] column_value_new:[3](1);[R1] [C2] column_name:c0;[R1] [C2] column_type:MYSQL_TYPE_DATE;[R1] [C2] column_is_rowkey:false;[R1] [C2] column_is_signed:true;[R1] [C2] column_encoding:binary;[R1] [C2] column_is_not_null:false;[R1] [C2] column_value_new:[2024-00-31](10);[R1] [C3] column_name:c1;[R1] [C3] column_type:MYSQL_TYPE_DATETIME;[R1] [C3] column_is_rowkey:false;[R1] [C3] column_is_signed:true;[R1] [C3] column_encoding:binary;[R1] [C3] column_is_not_null:false;[R1] [C3] column_scale:0;[R1] [C3] column_value_new:[2024-00-31 18:30:45](19);[R1] [C4] column_name:c2;[R1] [C4] column_type:MYSQL_TYPE_DATETIME;[R1] [C4] column_is_rowkey:false;[R1] [C4] column_is_signed:true;[R1] [C4] column_encoding:binary;[R1] [C4] column_is_not_null:false;[R1] [C4] column_scale:6;[R1] [C4] column_value_new:[2024-00-31 18:30:45.654321](26);$[R2] COMMIT;
insert into simple_mysql_date values('2024-01-00', '2024-06-00 18:30:45', '2024-12-00 18:30:45.654321');
ob1.oblog.next;
[R0] BEGIN;[R0] org_cluster_id:1;[R1] record_type:INSERT;[R1] database_name:oblog_tt.oblog_db1;[R1] table_name:simple_mysql_date;[R1] log_event:true;[R1] column_count:4;[R1] source_category:SRC_FULL_RECORDED;[R1] source_type:SRC_OCEANBASE_1_0;[R1] has_pk:true;[R1] pk_info:(0);[R1] pks:__pk_increment;[R1] has_uk:false;[R1] uk_info:(null);[R1] uks:(null);[R1] [C1] column_name:__pk_increment;[R1] [C1] column_type:MYSQL_TYPE_LONGLONG;[R1] [C1] column_is_rowkey:true;[R1] [C1] column_is_signed:false;[R1] [C1] column_encoding:binary;[R1] [C1] column_is_not_null:true;[R1] [C1] column_value_new:[4](1);[R1] [C2] column_name:c0;[R1] [C2] column_type:MYSQL_TYPE_DATE;[R1] [C2] column_is_rowkey:false;[R1] [C2] column_is_signed:true;[R1] [C2] column_encoding:binary;[R1] [C2] column_is_not_null:false;[R1] [C2] column_value_new:[2024-01-00](10);[R1] [C3] column_name:c1;[R1] [C3] column_type:MYSQL_TYPE_DATETIME;[R1] [C3] column_is_rowkey:false;[R1] [C3] column_is_signed:true;[R1] [C3] column_encoding:binary;[R1] [C3] column_is_not_null:false;[R1] [C3] column_scale:0;[R1] [C3] column_value_new:[2024-06-00 18:30:45](19);[R1] [C4] column_name:c2;[R1] [C4] column_type:MYSQL_TYPE_DATETIME;[R1] [C4] column_is_rowkey:false;[R1] [C4] column_is_signed:true;[R1] [C4] column_encoding:binary;[R1] [C4] column_is_not_null:false;[R1] [C4] column_scale:6;[R1] [C4] column_value_new:[2024-12-00 18:30:45.654321](26);$[R2] COMMIT;
insert into simple_mysql_date values('2024-00-00', '2024-00-00 18:30:45', '2024-00-00 18:30:45.654321');
ob1.oblog.next;
[R0] BEGIN;[R0] org_cluster_id:1;[R1] record_type:INSERT;[R1] database_name:oblog_tt.oblog_db1;[R1] table_name:simple_mysql_date;[R1] log_event:true;[R1] column_count:4;[R1] source_category:SRC_FULL_RECORDED;[R1] source_type:SRC_OCEANBASE_1_0;[R1] has_pk:true;[R1] pk_info:(0);[R1] pks:__pk_increment;[R1] has_uk:false;[R1] uk_info:(null);[R1] uks:(null);[R1] [C1] column_name:__pk_increment;[R1] [C1] column_type:MYSQL_TYPE_LONGLONG;[R1] [C1] column_is_rowkey:true;[R1] [C1] column_is_signed:false;[R1] [C1] column_encoding:binary;[R1] [C1] column_is_not_null:true;[R1] [C1] column_value_new:[5](1);[R1] [C2] column_name:c0;[R1] [C2] column_type:MYSQL_TYPE_DATE;[R1] [C2] column_is_rowkey:false;[R1] [C2] column_is_signed:true;[R1] [C2] column_encoding:binary;[R1] [C2] column_is_not_null:false;[R1] [C2] column_value_new:[2024-00-00](10);[R1] [C3] column_name:c1;[R1] [C3] column_type:MYSQL_TYPE_DATETIME;[R1] [C3] column_is_rowkey:false;[R1] [C3] column_is_signed:true;[R1] [C3] column_encoding:binary;[R1] [C3] column_is_not_null:false;[R1] [C3] column_scale:0;[R1] [C3] column_value_new:[2024-00-00 18:30:45](19);[R1] [C4] column_name:c2;[R1] [C4] column_type:MYSQL_TYPE_DATETIME;[R1] [C4] column_is_rowkey:false;[R1] [C4] column_is_signed:true;[R1] [C4] column_encoding:binary;[R1] [C4] column_is_not_null:false;[R1] [C4] column_scale:6;[R1] [C4] column_value_new:[2024-00-00 18:30:45.654321](26);$[R2] COMMIT;
insert into simple_mysql_date values(0, 0, 0);
ob1.oblog.next;
[R0] BEGIN;[R0] org_cluster_id:1;[R1] record_type:INSERT;[R1] database_name:oblog_tt.oblog_db1;[R1] table_name:simple_mysql_date;[R1] log_event:true;[R1] column_count:4;[R1] source_category:SRC_FULL_RECORDED;[R1] source_type:SRC_OCEANBASE_1_0;[R1] has_pk:true;[R1] pk_info:(0);[R1] pks:__pk_increment;[R1] has_uk:false;[R1] uk_info:(null);[R1] uks:(null);[R1] [C1] column_name:__pk_increment;[R1] [C1] column_type:MYSQL_TYPE_LONGLONG;[R1] [C1] column_is_rowkey:true;[R1] [C1] column_is_signed:false;[R1] [C1] column_encoding:binary;[R1] [C1] column_is_not_null:true;[R1] [C1] column_value_new:[6](1);[R1] [C2] column_name:c0;[R1] [C2] column_type:MYSQL_TYPE_DATE;[R1] [C2] column_is_rowkey:false;[R1] [C2] column_is_signed:true;[R1] [C2] column_encoding:binary;[R1] [C2] column_is_not_null:false;[R1] [C2] column_value_new:[0000-00-00](10);[R1] [C3] column_name:c1;[R1] [C3] column_type:MYSQL_TYPE_DATETIME;[R1] [C3] column_is_rowkey:false;[R1] [C3] column_is_signed:true;[R1] [C3] column_encoding:binary;[R1] [C3] column_is_not_null:false;[R1] [C3] column_scale:0;[R1] [C3] column_value_new:[0000-00-00 00:00:00](19);[R1] [C4] column_name:c2;[R1] [C4] column_type:MYSQL_TYPE_DATETIME;[R1] [C4] column_is_rowkey:false;[R1] [C4] column_is_signed:true;[R1] [C4] column_encoding:binary;[R1] [C4] column_is_not_null:false;[R1] [C4] column_scale:6;[R1] [C4] column_value_new:[0000-00-00 00:00:00.000000](26);$[R2] COMMIT;
insert into simple_mysql_date values(null, null, null);
ob1.oblog.next;
[R0] BEGIN;[R0] org_cluster_id:1;[R1] record_type:INSERT;[R1] database_name:oblog_tt.oblog_db1;[R1] table_name:simple_mysql_date;[R1] log_event:true;[R1] column_count:4;[R1] source_category:SRC_FULL_RECORDED;[R1] source_type:SRC_OCEANBASE_1_0;[R1] has_pk:true;[R1] pk_info:(0);[R1] pks:__pk_increment;[R1] has_uk:false;[R1] uk_info:(null);[R1] uks:(null);[R1] [C1] column_name:__pk_increment;[R1] [C1] column_type:MYSQL_TYPE_LONGLONG;[R1] [C1] column_is_rowkey:true;[R1] [C1] column_is_signed:false;[R1] [C1] column_encoding:binary;[R1] [C1] column_is_not_null:true;[R1] [C1] column_value_new:[7](1);[R1] [C2] column_name:c0;[R1] [C2] column_type:MYSQL_TYPE_DATE;[R1] [C2] column_is_rowkey:false;[R1] [C2] column_is_signed:true;[R1] [C2] column_encoding:binary;[R1] [C2] column_is_not_null:false;[R1] [C2] column_value_new:[NULL](0);[R1] [C3] column_name:c1;[R1] [C3] column_type:MYSQL_TYPE_DATETIME;[R1] [C3] column_is_rowkey:false;[R1] [C3] column_is_signed:true;[R1] [C3] column_encoding:binary;[R1] [C3] column_is_not_null:false;[R1] [C3] column_scale:0;[R1] [C3] column_value_new:[NULL](0);[R1] [C4] column_name:c2;[R1] [C4] column_type:MYSQL_TYPE_DATETIME;[R1] [C4] column_is_rowkey:false;[R1] [C4] column_is_signed:true;[R1] [C4] column_encoding:binary;[R1] [C4] column_is_not_null:false;[R1] [C4] column_scale:6;[R1] [C4] column_value_new:[NULL](0);$[R2] COMMIT;
set sql_mode = 'STRICT_ALL_TABLES,NO_ZERO_IN_DATE';
insert into simple_mysql_date values('2024-00-31', '2024-00-31 18:30:45', '2024-00-31 18:30:45.654321');
ERROR 22007: Incorrect datetime value for column 'c0' at row 1
insert into simple_mysql_date values('2024-01-00', '2024-06-00 18:30:45', '2024-12-00 18:30:45.654321');
ERROR 22007: Incorrect datetime value for column 'c0' at row 1
insert into simple_mysql_date values('2024-00-00', '2024-00-00 18:30:45', '2024-00-00 18:30:45.654321');
ERROR 22007: Incorrect datetime value for column 'c0' at row 1
insert into simple_mysql_date values(0, 0, 0);
ob1.oblog.next;
[R0] BEGIN;[R0] org_cluster_id:1;[R1] record_type:INSERT;[R1] database_name:oblog_tt.oblog_db1;[R1] table_name:simple_mysql_date;[R1] log_event:true;[R1] column_count:4;[R1] source_category:SRC_FULL_RECORDED;[R1] source_type:SRC_OCEANBASE_1_0;[R1] has_pk:true;[R1] pk_info:(0);[R1] pks:__pk_increment;[R1] has_uk:false;[R1] uk_info:(null);[R1] uks:(null);[R1] [C1] column_name:__pk_increment;[R1] [C1] column_type:MYSQL_TYPE_LONGLONG;[R1] [C1] column_is_rowkey:true;[R1] [C1] column_is_signed:false;[R1] [C1] column_encoding:binary;[R1] [C1] column_is_not_null:true;[R1] [C1] column_value_new:[8](1);[R1] [C2] column_name:c0;[R1] [C2] column_type:MYSQL_TYPE_DATE;[R1] [C2] column_is_rowkey:false;[R1] [C2] column_is_signed:true;[R1] [C2] column_encoding:binary;[R1] [C2] column_is_not_null:false;[R1] [C2] column_value_new:[0000-00-00](10);[R1] [C3] column_name:c1;[R1] [C3] column_type:MYSQL_TYPE_DATETIME;[R1] [C3] column_is_rowkey:false;[R1] [C3] column_is_signed:true;[R1] [C3] column_encoding:binary;[R1] [C3] column_is_not_null:false;[R1] [C3] column_scale:0;[R1] [C3] column_value_new:[0000-00-00 00:00:00](19);[R1] [C4] column_name:c2;[R1] [C4] column_type:MYSQL_TYPE_DATETIME;[R1] [C4] column_is_rowkey:false;[R1] [C4] column_is_signed:true;[R1] [C4] column_encoding:binary;[R1] [C4] column_is_not_null:false;[R1] [C4] column_scale:6;[R1] [C4] column_value_new:[0000-00-00 00:00:00.000000](26);$[R2] COMMIT;
set sql_mode = 'STRICT_ALL_TABLES,ALLOW_INVALID_DATES';
select * from simple_mysql_date;
c0	c1	c2
2024-07-30	2024-07-30 18:30:45	2024-07-30 18:30:45.123456
2024-02-31	2024-02-31 18:30:45	2024-02-31 18:30:45.123456
2024-00-31	2024-00-31 18:30:45	2024-00-31 18:30:45.654321
2024-01-00	2024-06-00 18:30:45	2024-12-00 18:30:45.654321
2024-00-00	2024-00-00 18:30:45	2024-00-00 18:30:45.654321
0000-00-00	0000-00-00 00:00:00	0000-00-00 00:00:00.000000
NULL	NULL	NULL
0000-00-00	0000-00-00 00:00:00	0000-00-00 00:00:00.000000
update simple_mysql_date set c0 = date'2024-02-31';
ob1.oblog.next;
[R0] BEGIN;[R0] org_cluster_id:1;[R1] record_type:UPDATE;[R1] database_name:oblog_tt.oblog_db1;[R1] table_name:simple_mysql_date;[R1] log_event:true;[R1] column_count:4;[R1] source_category:SRC_FULL_RECORDED;[R1] source_type:SRC_OCEANBASE_1_0;[R1] has_pk:true;[R1] pk_info:(0);[R1] pks:__pk_increment;[R1] has_uk:false;[R1] uk_info:(null);[R1] uks:(null);[R1] [C1] column_name:__pk_increment;[R1] [C1] column_type:MYSQL_TYPE_LONGLONG;[R1] [C1] column_is_rowkey:true;[R1] [C1] column_is_signed:false;[R1] [C1] column_encoding:binary;[R1] [C1] column_is_not_null:true;[R1] [C1] column_value_new:[1](1);[R1] [C1] column_value_old:[1](1);[R1] [C2] column_name:c0;[R1] [C2] column_type:MYSQL_TYPE_DATE;[R1] [C2] column_is_rowkey:false;[R1] [C2] column_is_signed:true;[R1] [C2] column_encoding:binary;[R1] [C2] column_is_not_null:false;[R1] [C2] column_value_new:[2024-02-31](10);[R1] [C2] column_value_old:[2024-07-30](10);[R1] [C3] column_name:c1;[R1] [C3] column_type:MYSQL_TYPE_DATETIME;[R1] [C3] column_is_rowkey:false;[R1] [C3] column_is_signed:true;[R1] [C3] column_encoding:binary;[R1] [C3] column_is_not_null:false;[R1] [C3] column_scale:0;[R1] [C3] column_value_new:[2024-07-30 18:30:45](19);[R1] [C3] column_value_old:[2024-07-30 18:30:45](19);[R1] [C4] column_name:c2;[R1] [C4] column_type:MYSQL_TYPE_DATETIME;[R1] [C4] column_is_rowkey:false;[R1] [C4] column_is_signed:true;[R1] [C4] column_encoding:binary;[R1] [C4] column_is_not_null:false;[R1] [C4] column_scale:6;[R1] [C4] column_value_new:[2024-07-30 18:30:45.123456](26);[R1] [C4] column_value_old:[2024-07-30 18:30:45.123456](26);$[R2] record_type:UPDATE;[R2] database_name:oblog_tt.oblog_db1;[R2] table_name:simple_mysql_date;[R2] log_event:true;[R2] column_count:4;[R2] source_category:SRC_FULL_RECORDED;[R2] source_type:SRC_OCEANBASE_1_0;[R2] has_pk:true;[R2] pk_info:(0);[R2] pks:__pk_increment;[R2] has_uk:false;[R2] uk_info:(null);[R2] uks:(null);[R2] [C1] column_name:__pk_increment;[R2] [C1] column_type:MYSQL_TYPE_LONGLONG;[R2] [C1] column_is_rowkey:true;[R2] [C1] column_is_signed:false;[R2] [C1] column_encoding:binary;[R2] [C1] column_is_not_null:true;[R2] [C1] column_value_new:[3](1);[R2] [C1] column_value_old:[3](1);[R2] [C2] column_name:c0;[R2] [C2] column_type:MYSQL_TYPE_DATE;[R2] [C2] column_is_rowkey:false;[R2] [C2] column_is_signed:true;[R2] [C2] column_encoding:binary;[R2] [C2] column_is_not_null:false;[R2] [C2] column_value_new:[2024-02-31](10);[R2] [C2] column_value_old:[2024-00-31](10);[R2] [C3] column_name:c1;[R2] [C3] column_type:MYSQL_TYPE_DATETIME;[R2] [C3] column_is_rowkey:false;[R2] [C3] column_is_signed:true;[R2] [C3] column_encoding:binary;[R2] [C3] column_is_not_null:false;[R2] [C3] column_scale:0;[R2] [C3] column_value_new:[2024-00-31 18:30:45](19);[R2] [C3] column_value_old:[2024-00-31 18:30:45](19);[R2] [C4] column_name:c2;[R2] [C4] column_type:MYSQL_TYPE_DATETIME;[R2] [C4] column_is_rowkey:false;[R2] [C4] column_is_signed:true;[R2] [C4] column_encoding:binary;[R2] [C4] column_is_not_null:false;[R2] [C4] column_scale:6;[R2] [C4] column_value_new:[2024-00-31 18:30:45.654321](26);[R2] [C4] column_value_old:[2024-00-31 18:30:45.654321](26);$[R3] record_type:UPDATE;[R3] database_name:oblog_tt.oblog_db1;[R3] table_name:simple_mysql_date;[R3] log_event:true;[R3] column_count:4;[R3] source_category:SRC_FULL_RECORDED;[R3] source_type:SRC_OCEANBASE_1_0;[R3] has_pk:true;[R3] pk_info:(0);[R3] pks:__pk_increment;[R3] has_uk:false;[R3] uk_info:(null);[R3] uks:(null);[R3] [C1] column_name:__pk_increment;[R3] [C1] column_type:MYSQL_TYPE_LONGLONG;[R3] [C1] column_is_rowkey:true;[R3] [C1] column_is_signed:false;[R3] [C1] column_encoding:binary;[R3] [C1] column_is_not_null:true;[R3] [C1] column_value_new:[4](1);[R3] [C1] column_value_old:[4](1);[R3] [C2] column_name:c0;[R3] [C2] column_type:MYSQL_TYPE_DATE;[R3] [C2] column_is_rowkey:false;[R3] [C2] column_is_signed:true;[R3] [C2] column_encoding:binary;[R3] [C2] column_is_not_null:false;[R3] [C2] column_value_new:[2024-02-31](10);[R3] [C2] column_value_old:[2024-01-00](10);[R3] [C3] column_name:c1;[R3] [C3] column_type:MYSQL_TYPE_DATETIME;[R3] [C3] column_is_rowkey:false;[R3] [C3] column_is_signed:true;[R3] [C3] column_encoding:binary;[R3] [C3] column_is_not_null:false;[R3] [C3] column_scale:0;[R3] [C3] column_value_new:[2024-06-00 18:30:45](19);[R3] [C3] column_value_old:[2024-06-00 18:30:45](19);[R3] [C4] column_name:c2;[R3] [C4] column_type:MYSQL_TYPE_DATETIME;[R3] [C4] column_is_rowkey:false;[R3] [C4] column_is_signed:true;[R3] [C4] column_encoding:binary;[R3] [C4] column_is_not_null:false;[R3] [C4] column_scale:6;[R3] [C4] column_value_new:[2024-12-00 18:30:45.654321](26);[R3] [C4] column_value_old:[2024-12-00 18:30:45.654321](26);$[R4] record_type:UPDATE;[R4] database_name:oblog_tt.oblog_db1;[R4] table_name:simple_mysql_date;[R4] log_event:true;[R4] column_count:4;[R4] source_category:SRC_FULL_RECORDED;[R4] source_type:SRC_OCEANBASE_1_0;[R4] has_pk:true;[R4] pk_info:(0);[R4] pks:__pk_increment;[R4] has_uk:false;[R4] uk_info:(null);[R4] uks:(null);[R4] [C1] column_name:__pk_increment;[R4] [C1] column_type:MYSQL_TYPE_LONGLONG;[R4] [C1] column_is_rowkey:true;[R4] [C1] column_is_signed:false;[R4] [C1] column_encoding:binary;[R4] [C1] column_is_not_null:true;[R4] [C1] column_value_new:[5](1);[R4] [C1] column_value_old:[5](1);[R4] [C2] column_name:c0;[R4] [C2] column_type:MYSQL_TYPE_DATE;[R4] [C2] column_is_rowkey:false;[R4] [C2] column_is_signed:true;[R4] [C2] column_encoding:binary;[R4] [C2] column_is_not_null:false;[R4] [C2] column_value_new:[2024-02-31](10);[R4] [C2] column_value_old:[2024-00-00](10);[R4] [C3] column_name:c1;[R4] [C3] column_type:MYSQL_TYPE_DATETIME;[R4] [C3] column_is_rowkey:false;[R4] [C3] column_is_signed:true;[R4] [C3] column_encoding:binary;[R4] [C3] column_is_not_null:false;[R4] [C3] column_scale:0;[R4] [C3] column_value_new:[2024-00-00 18:30:45](19);[R4] [C3] column_value_old:[2024-00-00 18:30:45](19);[R4] [C4] column_name:c2;[R4] [C4] column_type:MYSQL_TYPE_DATETIME;[R4] [C4] column_is_rowkey:false;[R4] [C4] column_is_signed:true;[R4] [C4] column_encoding:binary;[R4] [C4] column_is_not_null:false;[R4] [C4] column_scale:6;[R4] [C4] column_value_new:[2024-00-00 18:30:45.654321](26);[R4] [C4] column_value_old:[2024-00-00 18:30:45.654321](26);$[R5] record_type:UPDATE;[R5] database_name:oblog_tt.oblog_db1;[R5] table_name:simple_mysql_date;[R5] log_event:true;[R5] column_count:4;[R5] source_category:SRC_FULL_RECORDED;[R5] source_type:SRC_OCEANBASE_1_0;[R5] has_pk:true;[R5] pk_info:(0);[R5] pks:__pk_increment;[R5] has_uk:false;[R5] uk_info:(null);[R5] uks:(null);[R5] [C1] column_name:__pk_increment;[R5] [C1] column_type:MYSQL_TYPE_LONGLONG;[R5] [C1] column_is_rowkey:true;[R5] [C1] column_is_signed:false;[R5] [C1] column_encoding:binary;[R5] [C1] column_is_not_null:true;[R5] [C1] column_value_new:[6](1);[R5] [C1] column_value_old:[6](1);[R5] [C2] column_name:c0;[R5] [C2] column_type:MYSQL_TYPE_DATE;[R5] [C2] column_is_rowkey:false;[R5] [C2] column_is_signed:true;[R5] [C2] column_encoding:binary;[R5] [C2] column_is_not_null:false;[R5] [C2] column_value_new:[2024-02-31](10);[R5] [C2] column_value_old:[0000-00-00](10);[R5] [C3] column_name:c1;[R5] [C3] column_type:MYSQL_TYPE_DATETIME;[R5] [C3] column_is_rowkey:false;[R5] [C3] column_is_signed:true;[R5] [C3] column_encoding:binary;[R5] [C3] column_is_not_null:false;[R5] [C3] column_scale:0;[R5] [C3] column_value_new:[0000-00-00 00:00:00](19);[R5] [C3] column_value_old:[0000-00-00 00:00:00](19);[R5] [C4] column_name:c2;[R5] [C4] column_type:MYSQL_TYPE_DATETIME;[R5] [C4] column_is_rowkey:false;[R5] [C4] column_is_signed:true;[R5] [C4] column_encoding:binary;[R5] [C4] column_is_not_null:false;[R5] [C4] column_scale:6;[R5] [C4] column_value_new:[0000-00-00 00:00:00.000000](26);[R5] [C4] column_value_old:[0000-00-00 00:00:00.000000](26);$[R6] record_type:UPDATE;[R6] database_name:oblog_tt.oblog_db1;[R6] table_name:simple_mysql_date;[R6] log_event:true;[R6] column_count:4;[R6] source_category:SRC_FULL_RECORDED;[R6] source_type:SRC_OCEANBASE_1_0;[R6] has_pk:true;[R6] pk_info:(0);[R6] pks:__pk_increment;[R6] has_uk:false;[R6] uk_info:(null);[R6] uks:(null);[R6] [C1] column_name:__pk_increment;[R6] [C1] column_type:MYSQL_TYPE_LONGLONG;[R6] [C1] column_is_rowkey:true;[R6] [C1] column_is_signed:false;[R6] [C1] column_encoding:binary;[R6] [C1] column_is_not_null:true;[R6] [C1] column_value_new:[7](1);[R6] [C1] column_value_old:[7](1);[R6] [C2] column_name:c0;[R6] [C2] column_type:MYSQL_TYPE_DATE;[R6] [C2] column_is_rowkey:false;[R6] [C2] column_is_signed:true;[R6] [C2] column_encoding:binary;[R6] [C2] column_is_not_null:false;[R6] [C2] column_value_new:[2024-02-31](10);[R6] [C2] column_value_old:[NULL](0);[R6] [C3] column_name:c1;[R6] [C3] column_type:MYSQL_TYPE_DATETIME;[R6] [C3] column_is_rowkey:false;[R6] [C3] column_is_signed:true;[R6] [C3] column_encoding:binary;[R6] [C3] column_is_not_null:false;[R6] [C3] column_scale:0;[R6] [C3] column_value_new:[NULL](0);[R6] [C3] column_value_old:[NULL](0);[R6] [C4] column_name:c2;[R6] [C4] column_type:MYSQL_TYPE_DATETIME;[R6] [C4] column_is_rowkey:false;[R6] [C4] column_is_signed:true;[R6] [C4] column_encoding:binary;[R6] [C4] column_is_not_null:false;[R6] [C4] column_scale:6;[R6] [C4] column_value_new:[NULL](0);[R6] [C4] column_value_old:[NULL](0);$[R7] record_type:UPDATE;[R7] database_name:oblog_tt.oblog_db1;[R7] table_name:simple_mysql_date;[R7] log_event:true;[R7] column_count:4;[R7] source_category:SRC_FULL_RECORDED;[R7] source_type:SRC_OCEANBASE_1_0;[R7] has_pk:true;[R7] pk_info:(0);[R7] pks:__pk_increment;[R7] has_uk:false;[R7] uk_info:(null);[R7] uks:(null);[R7] [C1] column_name:__pk_increment;[R7] [C1] column_type:MYSQL_TYPE_LONGLONG;[R7] [C1] column_is_rowkey:true;[R7] [C1] column_is_signed:false;[R7] [C1] column_encoding:binary;[R7] [C1] column_is_not_null:true;[R7] [C1] column_value_new:[8](1);[R7] [C1] column_value_old:[8](1);[R7] [C2] column_name:c0;[R7] [C2] column_type:MYSQL_TYPE_DATE;[R7] [C2] column_is_rowkey:false;[R7] [C2] column_is_signed:true;[R7] [C2] column_encoding:binary;[R7] [C2] column_is_not_null:false;[R7] [C2] column_value_new:[2024-02-31](10);[R7] [C2] column_value_old:[0000-00-00](10);[R7] [C3] column_name:c1;[R7] [C3] column_type:MYSQL_TYPE_DATETIME;[R7] [C3] column_is_rowkey:false;[R7] [C3] column_is_signed:true;[R7] [C3] column_encoding:binary;[R7] [C3] column_is_not_null:false;[R7] [C3] column_scale:0;[R7] [C3] column_value_new:[0000-00-00 00:00:00](19);[R7] [C3] column_value_old:[0000-00-00 00:00:00](19);[R7] [C4] column_name:c2;[R7] [C4] column_type:MYSQL_TYPE_DATETIME;[R7] [C4] column_is_rowkey:false;[R7] [C4] column_is_signed:true;[R7] [C4] column_encoding:binary;[R7] [C4] column_is_not_null:false;[R7] [C4] column_scale:6;[R7] [C4] column_value_new:[0000-00-00 00:00:00.000000](26);[R7] [C4] column_value_old:[0000-00-00 00:00:00.000000](26);$[R8] COMMIT;
select * from simple_mysql_date;
c0	c1	c2
2024-02-31	2024-07-30 18:30:45	2024-07-30 18:30:45.123456
2024-02-31	2024-02-31 18:30:45	2024-02-31 18:30:45.123456
2024-02-31	2024-00-31 18:30:45	2024-00-31 18:30:45.654321
2024-02-31	2024-06-00 18:30:45	2024-12-00 18:30:45.654321
2024-02-31	2024-00-00 18:30:45	2024-00-00 18:30:45.654321
2024-02-31	0000-00-00 00:00:00	0000-00-00 00:00:00.000000
2024-02-31	NULL	NULL
2024-02-31	0000-00-00 00:00:00	0000-00-00 00:00:00.000000
update simple_mysql_date set c1 = '2024-00-01';
ob1.oblog.next;
[R0] BEGIN;[R0] org_cluster_id:1;[R1] record_type:UPDATE;[R1] database_name:oblog_tt.oblog_db1;[R1] table_name:simple_mysql_date;[R1] log_event:true;[R1] column_count:4;[R1] source_category:SRC_FULL_RECORDED;[R1] source_type:SRC_OCEANBASE_1_0;[R1] has_pk:true;[R1] pk_info:(0);[R1] pks:__pk_increment;[R1] has_uk:false;[R1] uk_info:(null);[R1] uks:(null);[R1] [C1] column_name:__pk_increment;[R1] [C1] column_type:MYSQL_TYPE_LONGLONG;[R1] [C1] column_is_rowkey:true;[R1] [C1] column_is_signed:false;[R1] [C1] column_encoding:binary;[R1] [C1] column_is_not_null:true;[R1] [C1] column_value_new:[1](1);[R1] [C1] column_value_old:[1](1);[R1] [C2] column_name:c0;[R1] [C2] column_type:MYSQL_TYPE_DATE;[R1] [C2] column_is_rowkey:false;[R1] [C2] column_is_signed:true;[R1] [C2] column_encoding:binary;[R1] [C2] column_is_not_null:false;[R1] [C2] column_value_new:[2024-02-31](10);[R1] [C2] column_value_old:[2024-02-31](10);[R1] [C3] column_name:c1;[R1] [C3] column_type:MYSQL_TYPE_DATETIME;[R1] [C3] column_is_rowkey:false;[R1] [C3] column_is_signed:true;[R1] [C3] column_encoding:binary;[R1] [C3] column_is_not_null:false;[R1] [C3] column_scale:0;[R1] [C3] column_value_new:[2024-00-01 00:00:00](19);[R1] [C3] column_value_old:[2024-07-30 18:30:45](19);[R1] [C4] column_name:c2;[R1] [C4] column_type:MYSQL_TYPE_DATETIME;[R1] [C4] column_is_rowkey:false;[R1] [C4] column_is_signed:true;[R1] [C4] column_encoding:binary;[R1] [C4] column_is_not_null:false;[R1] [C4] column_scale:6;[R1] [C4] column_value_new:[2024-07-30 18:30:45.123456](26);[R1] [C4] column_value_old:[2024-07-30 18:30:45.123456](26);$[R2] record_type:UPDATE;[R2] database_name:oblog_tt.oblog_db1;[R2] table_name:simple_mysql_date;[R2] log_event:true;[R2] column_count:4;[R2] source_category:SRC_FULL_RECORDED;[R2] source_type:SRC_OCEANBASE_1_0;[R2] has_pk:true;[R2] pk_info:(0);[R2] pks:__pk_increment;[R2] has_uk:false;[R2] uk_info:(null);[R2] uks:(null);[R2] [C1] column_name:__pk_increment;[R2] [C1] column_type:MYSQL_TYPE_LONGLONG;[R2] [C1] column_is_rowkey:true;[R2] [C1] column_is_signed:false;[R2] [C1] column_encoding:binary;[R2] [C1] column_is_not_null:true;[R2] [C1] column_value_new:[2](1);[R2] [C1] column_value_old:[2](1);[R2] [C2] column_name:c0;[R2] [C2] column_type:MYSQL_TYPE_DATE;[R2] [C2] column_is_rowkey:false;[R2] [C2] column_is_signed:true;[R2] [C2] column_encoding:binary;[R2] [C2] column_is_not_null:false;[R2] [C2] column_value_new:[2024-02-31](10);[R2] [C2] column_value_old:[2024-02-31](10);[R2] [C3] column_name:c1;[R2] [C3] column_type:MYSQL_TYPE_DATETIME;[R2] [C3] column_is_rowkey:false;[R2] [C3] column_is_signed:true;[R2] [C3] column_encoding:binary;[R2] [C3] column_is_not_null:false;[R2] [C3] column_scale:0;[R2] [C3] column_value_new:[2024-00-01 00:00:00](19);[R2] [C3] column_value_old:[2024-02-31 18:30:45](19);[R2] [C4] column_name:c2;[R2] [C4] column_type:MYSQL_TYPE_DATETIME;[R2] [C4] column_is_rowkey:false;[R2] [C4] column_is_signed:true;[R2] [C4] column_encoding:binary;[R2] [C4] column_is_not_null:false;[R2] [C4] column_scale:6;[R2] [C4] column_value_new:[2024-02-31 18:30:45.123456](26);[R2] [C4] column_value_old:[2024-02-31 18:30:45.123456](26);$[R3] record_type:UPDATE;[R3] database_name:oblog_tt.oblog_db1;[R3] table_name:simple_mysql_date;[R3] log_event:true;[R3] column_count:4;[R3] source_category:SRC_FULL_RECORDED;[R3] source_type:SRC_OCEANBASE_1_0;[R3] has_pk:true;[R3] pk_info:(0);[R3] pks:__pk_increment;[R3] has_uk:false;[R3] uk_info:(null);[R3] uks:(null);[R3] [C1] column_name:__pk_increment;[R3] [C1] column_type:MYSQL_TYPE_LONGLONG;[R3] [C1] column_is_rowkey:true;[R3] [C1] column_is_signed:false;[R3] [C1] column_encoding:binary;[R3] [C1] column_is_not_null:true;[R3] [C1] column_value_new:[3](1);[R3] [C1] column_value_old:[3](1);[R3] [C2] column_name:c0;[R3] [C2] column_type:MYSQL_TYPE_DATE;[R3] [C2] column_is_rowkey:false;[R3] [C2] column_is_signed:true;[R3] [C2] column_encoding:binary;[R3] [C2] column_is_not_null:false;[R3] [C2] column_value_new:[2024-02-31](10);[R3] [C2] column_value_old:[2024-02-31](10);[R3] [C3] column_name:c1;[R3] [C3] column_type:MYSQL_TYPE_DATETIME;[R3] [C3] column_is_rowkey:false;[R3] [C3] column_is_signed:true;[R3] [C3] column_encoding:binary;[R3] [C3] column_is_not_null:false;[R3] [C3] column_scale:0;[R3] [C3] column_value_new:[2024-00-01 00:00:00](19);[R3] [C3] column_value_old:[2024-00-31 18:30:45](19);[R3] [C4] column_name:c2;[R3] [C4] column_type:MYSQL_TYPE_DATETIME;[R3] [C4] column_is_rowkey:false;[R3] [C4] column_is_signed:true;[R3] [C4] column_encoding:binary;[R3] [C4] column_is_not_null:false;[R3] [C4] column_scale:6;[R3] [C4] column_value_new:[2024-00-31 18:30:45.654321](26);[R3] [C4] column_value_old:[2024-00-31 18:30:45.654321](26);$[R4] record_type:UPDATE;[R4] database_name:oblog_tt.oblog_db1;[R4] table_name:simple_mysql_date;[R4] log_event:true;[R4] column_count:4;[R4] source_category:SRC_FULL_RECORDED;[R4] source_type:SRC_OCEANBASE_1_0;[R4] has_pk:true;[R4] pk_info:(0);[R4] pks:__pk_increment;[R4] has_uk:false;[R4] uk_info:(null);[R4] uks:(null);[R4] [C1] column_name:__pk_increment;[R4] [C1] column_type:MYSQL_TYPE_LONGLONG;[R4] [C1] column_is_rowkey:true;[R4] [C1] column_is_signed:false;[R4] [C1] column_encoding:binary;[R4] [C1] column_is_not_null:true;[R4] [C1] column_value_new:[4](1);[R4] [C1] column_value_old:[4](1);[R4] [C2] column_name:c0;[R4] [C2] column_type:MYSQL_TYPE_DATE;[R4] [C2] column_is_rowkey:false;[R4] [C2] column_is_signed:true;[R4] [C2] column_encoding:binary;[R4] [C2] column_is_not_null:false;[R4] [C2] column_value_new:[2024-02-31](10);[R4] [C2] column_value_old:[2024-02-31](10);[R4] [C3] column_name:c1;[R4] [C3] column_type:MYSQL_TYPE_DATETIME;[R4] [C3] column_is_rowkey:false;[R4] [C3] column_is_signed:true;[R4] [C3] column_encoding:binary;[R4] [C3] column_is_not_null:false;[R4] [C3] column_scale:0;[R4] [C3] column_value_new:[2024-00-01 00:00:00](19);[R4] [C3] column_value_old:[2024-06-00 18:30:45](19);[R4] [C4] column_name:c2;[R4] [C4] column_type:MYSQL_TYPE_DATETIME;[R4] [C4] column_is_rowkey:false;[R4] [C4] column_is_signed:true;[R4] [C4] column_encoding:binary;[R4] [C4] column_is_not_null:false;[R4] [C4] column_scale:6;[R4] [C4] column_value_new:[2024-12-00 18:30:45.654321](26);[R4] [C4] column_value_old:[2024-12-00 18:30:45.654321](26);$[R5] record_type:UPDATE;[R5] database_name:oblog_tt.oblog_db1;[R5] table_name:simple_mysql_date;[R5] log_event:true;[R5] column_count:4;[R5] source_category:SRC_FULL_RECORDED;[R5] source_type:SRC_OCEANBASE_1_0;[R5] has_pk:true;[R5] pk_info:(0);[R5] pks:__pk_increment;[R5] has_uk:false;[R5] uk_info:(null);[R5] uks:(null);[R5] [C1] column_name:__pk_increment;[R5] [C1] column_type:MYSQL_TYPE_LONGLONG;[R5] [C1] column_is_rowkey:true;[R5] [C1] column_is_signed:false;[R5] [C1] column_encoding:binary;[R5] [C1] column_is_not_null:true;[R5] [C1] column_value_new:[5](1);[R5] [C1] column_value_old:[5](1);[R5] [C2] column_name:c0;[R5] [C2] column_type:MYSQL_TYPE_DATE;[R5] [C2] column_is_rowkey:false;[R5] [C2] column_is_signed:true;[R5] [C2] column_encoding:binary;[R5] [C2] column_is_not_null:false;[R5] [C2] column_value_new:[2024-02-31](10);[R5] [C2] column_value_old:[2024-02-31](10);[R5] [C3] column_name:c1;[R5] [C3] column_type:MYSQL_TYPE_DATETIME;[R5] [C3] column_is_rowkey:false;[R5] [C3] column_is_signed:true;[R5] [C3] column_encoding:binary;[R5] [C3] column_is_not_null:false;[R5] [C3] column_scale:0;[R5] [C3] column_value_new:[2024-00-01 00:00:00](19);[R5] [C3] column_value_old:[2024-00-00 18:30:45](19);[R5] [C4] column_name:c2;[R5] [C4] column_type:MYSQL_TYPE_DATETIME;[R5] [C4] column_is_rowkey:false;[R5] [C4] column_is_signed:true;[R5] [C4] column_encoding:binary;[R5] [C4] column_is_not_null:false;[R5] [C4] column_scale:6;[R5] [C4] column_value_new:[2024-00-00 18:30:45.654321](26);[R5] [C4] column_value_old:[2024-00-00 18:30:45.654321](26);$[R6] record_type:UPDATE;[R6] database_name:oblog_tt.oblog_db1;[R6] table_name:simple_mysql_date;[R6] log_event:true;[R6] column_count:4;[R6] source_category:SRC_FULL_RECORDED;[R6] source_type:SRC_OCEANBASE_1_0;[R6] has_pk:true;[R6] pk_info:(0);[R6] pks:__pk_increment;[R6] has_uk:false;[R6] uk_info:(null);[R6] uks:(null);[R6] [C1] column_name:__pk_increment;[R6] [C1] column_type:MYSQL_TYPE_LONGLONG;[R6] [C1] column_is_rowkey:true;[R6] [C1] column_is_signed:false;[R6] [C1] column_encoding:binary;[R6] [C1] column_is_not_null:true;[R6] [C1] column_value_new:[6](1);[R6] [C1] column_value_old:[6](1);[R6] [C2] column_name:c0;[R6] [C2] column_type:MYSQL_TYPE_DATE;[R6] [C2] column_is_rowkey:false;[R6] [C2] column_is_signed:true;[R6] [C2] column_encoding:binary;[R6] [C2] column_is_not_null:false;[R6] [C2] column_value_new:[2024-02-31](10);[R6] [C2] column_value_old:[2024-02-31](10);[R6] [C3] column_name:c1;[R6] [C3] column_type:MYSQL_TYPE_DATETIME;[R6] [C3] column_is_rowkey:false;[R6] [C3] column_is_signed:true;[R6] [C3] column_encoding:binary;[R6] [C3] column_is_not_null:false;[R6] [C3] column_scale:0;[R6] [C3] column_value_new:[2024-00-01 00:00:00](19);[R6] [C3] column_value_old:[0000-00-00 00:00:00](19);[R6] [C4] column_name:c2;[R6] [C4] column_type:MYSQL_TYPE_DATETIME;[R6] [C4] column_is_rowkey:false;[R6] [C4] column_is_signed:true;[R6] [C4] column_encoding:binary;[R6] [C4] column_is_not_null:false;[R6] [C4] column_scale:6;[R6] [C4] column_value_new:[0000-00-00 00:00:00.000000](26);[R6] [C4] column_value_old:[0000-00-00 00:00:00.000000](26);$[R7] record_type:UPDATE;[R7] database_name:oblog_tt.oblog_db1;[R7] table_name:simple_mysql_date;[R7] log_event:true;[R7] column_count:4;[R7] source_category:SRC_FULL_RECORDED;[R7] source_type:SRC_OCEANBASE_1_0;[R7] has_pk:true;[R7] pk_info:(0);[R7] pks:__pk_increment;[R7] has_uk:false;[R7] uk_info:(null);[R7] uks:(null);[R7] [C1] column_name:__pk_increment;[R7] [C1] column_type:MYSQL_TYPE_LONGLONG;[R7] [C1] column_is_rowkey:true;[R7] [C1] column_is_signed:false;[R7] [C1] column_encoding:binary;[R7] [C1] column_is_not_null:true;[R7] [C1] column_value_new:[7](1);[R7] [C1] column_value_old:[7](1);[R7] [C2] column_name:c0;[R7] [C2] column_type:MYSQL_TYPE_DATE;[R7] [C2] column_is_rowkey:false;[R7] [C2] column_is_signed:true;[R7] [C2] column_encoding:binary;[R7] [C2] column_is_not_null:false;[R7] [C2] column_value_new:[2024-02-31](10);[R7] [C2] column_value_old:[2024-02-31](10);[R7] [C3] column_name:c1;[R7] [C3] column_type:MYSQL_TYPE_DATETIME;[R7] [C3] column_is_rowkey:false;[R7] [C3] column_is_signed:true;[R7] [C3] column_encoding:binary;[R7] [C3] column_is_not_null:false;[R7] [C3] column_scale:0;[R7] [C3] column_value_new:[2024-00-01 00:00:00](19);[R7] [C3] column_value_old:[NULL](0);[R7] [C4] column_name:c2;[R7] [C4] column_type:MYSQL_TYPE_DATETIME;[R7] [C4] column_is_rowkey:false;[R7] [C4] column_is_signed:true;[R7] [C4] column_encoding:binary;[R7] [C4] column_is_not_null:false;[R7] [C4] column_scale:6;[R7] [C4] column_value_new:[NULL](0);[R7] [C4] column_value_old:[NULL](0);$[R8] record_type:UPDATE;[R8] database_name:oblog_tt.oblog_db1;[R8] table_name:simple_mysql_date;[R8] log_event:true;[R8] column_count:4;[R8] source_category:SRC_FULL_RECORDED;[R8] source_type:SRC_OCEANBASE_1_0;[R8] has_pk:true;[R8] pk_info:(0);[R8] pks:__pk_increment;[R8] has_uk:false;[R8] uk_info:(null);[R8] uks:(null);[R8] [C1] column_name:__pk_increment;[R8] [C1] column_type:MYSQL_TYPE_LONGLONG;[R8] [C1] column_is_rowkey:true;[R8] [C1] column_is_signed:false;[R8] [C1] column_encoding:binary;[R8] [C1] column_is_not_null:true;[R8] [C1] column_value_new:[8](1);[R8] [C1] column_value_old:[8](1);[R8] [C2] column_name:c0;[R8] [C2] column_type:MYSQL_TYPE_DATE;[R8] [C2] column_is_rowkey:false;[R8] [C2] column_is_signed:true;[R8] [C2] column_encoding:binary;[R8] [C2] column_is_not_null:false;[R8] [C2] column_value_new:[2024-02-31](10);[R8] [C2] column_value_old:[2024-02-31](10);[R8] [C3] column_name:c1;[R8] [C3] column_type:MYSQL_TYPE_DATETIME;[R8] [C3] column_is_rowkey:false;[R8] [C3] column_is_signed:true;[R8] [C3] column_encoding:binary;[R8] [C3] column_is_not_null:false;[R8] [C3] column_scale:0;[R8] [C3] column_value_new:[2024-00-01 00:00:00](19);[R8] [C3] column_value_old:[0000-00-00 00:00:00](19);[R8] [C4] column_name:c2;[R8] [C4] column_type:MYSQL_TYPE_DATETIME;[R8] [C4] column_is_rowkey:false;[R8] [C4] column_is_signed:true;[R8] [C4] column_encoding:binary;[R8] [C4] column_is_not_null:false;[R8] [C4] column_scale:6;[R8] [C4] column_value_new:[0000-00-00 00:00:00.000000](26);[R8] [C4] column_value_old:[0000-00-00 00:00:00.000000](26);$[R9] COMMIT;
select * from simple_mysql_date;
c0	c1	c2
2024-02-31	2024-00-01 00:00:00	2024-07-30 18:30:45.123456
2024-02-31	2024-00-01 00:00:00	2024-02-31 18:30:45.123456
2024-02-31	2024-00-01 00:00:00	2024-00-31 18:30:45.654321
2024-02-31	2024-00-01 00:00:00	2024-12-00 18:30:45.654321
2024-02-31	2024-00-01 00:00:00	2024-00-00 18:30:45.654321
2024-02-31	2024-00-01 00:00:00	0000-00-00 00:00:00.000000
2024-02-31	2024-00-01 00:00:00	NULL
2024-02-31	2024-00-01 00:00:00	0000-00-00 00:00:00.000000
update simple_mysql_date set c1 = '2024-12-00 12:34:56';
ob1.oblog.next;
[R0] BEGIN;[R0] org_cluster_id:1;[R1] record_type:UPDATE;[R1] database_name:oblog_tt.oblog_db1;[R1] table_name:simple_mysql_date;[R1] log_event:true;[R1] column_count:4;[R1] source_category:SRC_FULL_RECORDED;[R1] source_type:SRC_OCEANBASE_1_0;[R1] has_pk:true;[R1] pk_info:(0);[R1] pks:__pk_increment;[R1] has_uk:false;[R1] uk_info:(null);[R1] uks:(null);[R1] [C1] column_name:__pk_increment;[R1] [C1] column_type:MYSQL_TYPE_LONGLONG;[R1] [C1] column_is_rowkey:true;[R1] [C1] column_is_signed:false;[R1] [C1] column_encoding:binary;[R1] [C1] column_is_not_null:true;[R1] [C1] column_value_new:[1](1);[R1] [C1] column_value_old:[1](1);[R1] [C2] column_name:c0;[R1] [C2] column_type:MYSQL_TYPE_DATE;[R1] [C2] column_is_rowkey:false;[R1] [C2] column_is_signed:true;[R1] [C2] column_encoding:binary;[R1] [C2] column_is_not_null:false;[R1] [C2] column_value_new:[2024-02-31](10);[R1] [C2] column_value_old:[2024-02-31](10);[R1] [C3] column_name:c1;[R1] [C3] column_type:MYSQL_TYPE_DATETIME;[R1] [C3] column_is_rowkey:false;[R1] [C3] column_is_signed:true;[R1] [C3] column_encoding:binary;[R1] [C3] column_is_not_null:false;[R1] [C3] column_scale:0;[R1] [C3] column_value_new:[2024-12-00 12:34:56](19);[R1] [C3] column_value_old:[2024-00-01 00:00:00](19);[R1] [C4] column_name:c2;[R1] [C4] column_type:MYSQL_TYPE_DATETIME;[R1] [C4] column_is_rowkey:false;[R1] [C4] column_is_signed:true;[R1] [C4] column_encoding:binary;[R1] [C4] column_is_not_null:false;[R1] [C4] column_scale:6;[R1] [C4] column_value_new:[2024-07-30 18:30:45.123456](26);[R1] [C4] column_value_old:[2024-07-30 18:30:45.123456](26);$[R2] record_type:UPDATE;[R2] database_name:oblog_tt.oblog_db1;[R2] table_name:simple_mysql_date;[R2] log_event:true;[R2] column_count:4;[R2] source_category:SRC_FULL_RECORDED;[R2] source_type:SRC_OCEANBASE_1_0;[R2] has_pk:true;[R2] pk_info:(0);[R2] pks:__pk_increment;[R2] has_uk:false;[R2] uk_info:(null);[R2] uks:(null);[R2] [C1] column_name:__pk_increment;[R2] [C1] column_type:MYSQL_TYPE_LONGLONG;[R2] [C1] column_is_rowkey:true;[R2] [C1] column_is_signed:false;[R2] [C1] column_encoding:binary;[R2] [C1] column_is_not_null:true;[R2] [C1] column_value_new:[2](1);[R2] [C1] column_value_old:[2](1);[R2] [C2] column_name:c0;[R2] [C2] column_type:MYSQL_TYPE_DATE;[R2] [C2] column_is_rowkey:false;[R2] [C2] column_is_signed:true;[R2] [C2] column_encoding:binary;[R2] [C2] column_is_not_null:false;[R2] [C2] column_value_new:[2024-02-31](10);[R2] [C2] column_value_old:[2024-02-31](10);[R2] [C3] column_name:c1;[R2] [C3] column_type:MYSQL_TYPE_DATETIME;[R2] [C3] column_is_rowkey:false;[R2] [C3] column_is_signed:true;[R2] [C3] column_encoding:binary;[R2] [C3] column_is_not_null:false;[R2] [C3] column_scale:0;[R2] [C3] column_value_new:[2024-12-00 12:34:56](19);[R2] [C3] column_value_old:[2024-00-01 00:00:00](19);[R2] [C4] column_name:c2;[R2] [C4] column_type:MYSQL_TYPE_DATETIME;[R2] [C4] column_is_rowkey:false;[R2] [C4] column_is_signed:true;[R2] [C4] column_encoding:binary;[R2] [C4] column_is_not_null:false;[R2] [C4] column_scale:6;[R2] [C4] column_value_new:[2024-02-31 18:30:45.123456](26);[R2] [C4] column_value_old:[2024-02-31 18:30:45.123456](26);$[R3] record_type:UPDATE;[R3] database_name:oblog_tt.oblog_db1;[R3] table_name:simple_mysql_date;[R3] log_event:true;[R3] column_count:4;[R3] source_category:SRC_FULL_RECORDED;[R3] source_type:SRC_OCEANBASE_1_0;[R3] has_pk:true;[R3] pk_info:(0);[R3] pks:__pk_increment;[R3] has_uk:false;[R3] uk_info:(null);[R3] uks:(null);[R3] [C1] column_name:__pk_increment;[R3] [C1] column_type:MYSQL_TYPE_LONGLONG;[R3] [C1] column_is_rowkey:true;[R3] [C1] column_is_signed:false;[R3] [C1] column_encoding:binary;[R3] [C1] column_is_not_null:true;[R3] [C1] column_value_new:[3](1);[R3] [C1] column_value_old:[3](1);[R3] [C2] column_name:c0;[R3] [C2] column_type:MYSQL_TYPE_DATE;[R3] [C2] column_is_rowkey:false;[R3] [C2] column_is_signed:true;[R3] [C2] column_encoding:binary;[R3] [C2] column_is_not_null:false;[R3] [C2] column_value_new:[2024-02-31](10);[R3] [C2] column_value_old:[2024-02-31](10);[R3] [C3] column_name:c1;[R3] [C3] column_type:MYSQL_TYPE_DATETIME;[R3] [C3] column_is_rowkey:false;[R3] [C3] column_is_signed:true;[R3] [C3] column_encoding:binary;[R3] [C3] column_is_not_null:false;[R3] [C3] column_scale:0;[R3] [C3] column_value_new:[2024-12-00 12:34:56](19);[R3] [C3] column_value_old:[2024-00-01 00:00:00](19);[R3] [C4] column_name:c2;[R3] [C4] column_type:MYSQL_TYPE_DATETIME;[R3] [C4] column_is_rowkey:false;[R3] [C4] column_is_signed:true;[R3] [C4] column_encoding:binary;[R3] [C4] column_is_not_null:false;[R3] [C4] column_scale:6;[R3] [C4] column_value_new:[2024-00-31 18:30:45.654321](26);[R3] [C4] column_value_old:[2024-00-31 18:30:45.654321](26);$[R4] record_type:UPDATE;[R4] database_name:oblog_tt.oblog_db1;[R4] table_name:simple_mysql_date;[R4] log_event:true;[R4] column_count:4;[R4] source_category:SRC_FULL_RECORDED;[R4] source_type:SRC_OCEANBASE_1_0;[R4] has_pk:true;[R4] pk_info:(0);[R4] pks:__pk_increment;[R4] has_uk:false;[R4] uk_info:(null);[R4] uks:(null);[R4] [C1] column_name:__pk_increment;[R4] [C1] column_type:MYSQL_TYPE_LONGLONG;[R4] [C1] column_is_rowkey:true;[R4] [C1] column_is_signed:false;[R4] [C1] column_encoding:binary;[R4] [C1] column_is_not_null:true;[R4] [C1] column_value_new:[4](1);[R4] [C1] column_value_old:[4](1);[R4] [C2] column_name:c0;[R4] [C2] column_type:MYSQL_TYPE_DATE;[R4] [C2] column_is_rowkey:false;[R4] [C2] column_is_signed:true;[R4] [C2] column_encoding:binary;[R4] [C2] column_is_not_null:false;[R4] [C2] column_value_new:[2024-02-31](10);[R4] [C2] column_value_old:[2024-02-31](10);[R4] [C3] column_name:c1;[R4] [C3] column_type:MYSQL_TYPE_DATETIME;[R4] [C3] column_is_rowkey:false;[R4] [C3] column_is_signed:true;[R4] [C3] column_encoding:binary;[R4] [C3] column_is_not_null:false;[R4] [C3] column_scale:0;[R4] [C3] column_value_new:[2024-12-00 12:34:56](19);[R4] [C3] column_value_old:[2024-00-01 00:00:00](19);[R4] [C4] column_name:c2;[R4] [C4] column_type:MYSQL_TYPE_DATETIME;[R4] [C4] column_is_rowkey:false;[R4] [C4] column_is_signed:true;[R4] [C4] column_encoding:binary;[R4] [C4] column_is_not_null:false;[R4] [C4] column_scale:6;[R4] [C4] column_value_new:[2024-12-00 18:30:45.654321](26);[R4] [C4] column_value_old:[2024-12-00 18:30:45.654321](26);$[R5] record_type:UPDATE;[R5] database_name:oblog_tt.oblog_db1;[R5] table_name:simple_mysql_date;[R5] log_event:true;[R5] column_count:4;[R5] source_category:SRC_FULL_RECORDED;[R5] source_type:SRC_OCEANBASE_1_0;[R5] has_pk:true;[R5] pk_info:(0);[R5] pks:__pk_increment;[R5] has_uk:false;[R5] uk_info:(null);[R5] uks:(null);[R5] [C1] column_name:__pk_increment;[R5] [C1] column_type:MYSQL_TYPE_LONGLONG;[R5] [C1] column_is_rowkey:true;[R5] [C1] column_is_signed:false;[R5] [C1] column_encoding:binary;[R5] [C1] column_is_not_null:true;[R5] [C1] column_value_new:[5](1);[R5] [C1] column_value_old:[5](1);[R5] [C2] column_name:c0;[R5] [C2] column_type:MYSQL_TYPE_DATE;[R5] [C2] column_is_rowkey:false;[R5] [C2] column_is_signed:true;[R5] [C2] column_encoding:binary;[R5] [C2] column_is_not_null:false;[R5] [C2] column_value_new:[2024-02-31](10);[R5] [C2] column_value_old:[2024-02-31](10);[R5] [C3] column_name:c1;[R5] [C3] column_type:MYSQL_TYPE_DATETIME;[R5] [C3] column_is_rowkey:false;[R5] [C3] column_is_signed:true;[R5] [C3] column_encoding:binary;[R5] [C3] column_is_not_null:false;[R5] [C3] column_scale:0;[R5] [C3] column_value_new:[2024-12-00 12:34:56](19);[R5] [C3] column_value_old:[2024-00-01 00:00:00](19);[R5] [C4] column_name:c2;[R5] [C4] column_type:MYSQL_TYPE_DATETIME;[R5] [C4] column_is_rowkey:false;[R5] [C4] column_is_signed:true;[R5] [C4] column_encoding:binary;[R5] [C4] column_is_not_null:false;[R5] [C4] column_scale:6;[R5] [C4] column_value_new:[2024-00-00 18:30:45.654321](26);[R5] [C4] column_value_old:[2024-00-00 18:30:45.654321](26);$[R6] record_type:UPDATE;[R6] database_name:oblog_tt.oblog_db1;[R6] table_name:simple_mysql_date;[R6] log_event:true;[R6] column_count:4;[R6] source_category:SRC_FULL_RECORDED;[R6] source_type:SRC_OCEANBASE_1_0;[R6] has_pk:true;[R6] pk_info:(0);[R6] pks:__pk_increment;[R6] has_uk:false;[R6] uk_info:(null);[R6] uks:(null);[R6] [C1] column_name:__pk_increment;[R6] [C1] column_type:MYSQL_TYPE_LONGLONG;[R6] [C1] column_is_rowkey:true;[R6] [C1] column_is_signed:false;[R6] [C1] column_encoding:binary;[R6] [C1] column_is_not_null:true;[R6] [C1] column_value_new:[6](1);[R6] [C1] column_value_old:[6](1);[R6] [C2] column_name:c0;[R6] [C2] column_type:MYSQL_TYPE_DATE;[R6] [C2] column_is_rowkey:false;[R6] [C2] column_is_signed:true;[R6] [C2] column_encoding:binary;[R6] [C2] column_is_not_null:false;[R6] [C2] column_value_new:[2024-02-31](10);[R6] [C2] column_value_old:[2024-02-31](10);[R6] [C3] column_name:c1;[R6] [C3] column_type:MYSQL_TYPE_DATETIME;[R6] [C3] column_is_rowkey:false;[R6] [C3] column_is_signed:true;[R6] [C3] column_encoding:binary;[R6] [C3] column_is_not_null:false;[R6] [C3] column_scale:0;[R6] [C3] column_value_new:[2024-12-00 12:34:56](19);[R6] [C3] column_value_old:[2024-00-01 00:00:00](19);[R6] [C4] column_name:c2;[R6] [C4] column_type:MYSQL_TYPE_DATETIME;[R6] [C4] column_is_rowkey:false;[R6] [C4] column_is_signed:true;[R6] [C4] column_encoding:binary;[R6] [C4] column_is_not_null:false;[R6] [C4] column_scale:6;[R6] [C4] column_value_new:[0000-00-00 00:00:00.000000](26);[R6] [C4] column_value_old:[0000-00-00 00:00:00.000000](26);$[R7] record_type:UPDATE;[R7] database_name:oblog_tt.oblog_db1;[R7] table_name:simple_mysql_date;[R7] log_event:true;[R7] column_count:4;[R7] source_category:SRC_FULL_RECORDED;[R7] source_type:SRC_OCEANBASE_1_0;[R7] has_pk:true;[R7] pk_info:(0);[R7] pks:__pk_increment;[R7] has_uk:false;[R7] uk_info:(null);[R7] uks:(null);[R7] [C1] column_name:__pk_increment;[R7] [C1] column_type:MYSQL_TYPE_LONGLONG;[R7] [C1] column_is_rowkey:true;[R7] [C1] column_is_signed:false;[R7] [C1] column_encoding:binary;[R7] [C1] column_is_not_null:true;[R7] [C1] column_value_new:[7](1);[R7] [C1] column_value_old:[7](1);[R7] [C2] column_name:c0;[R7] [C2] column_type:MYSQL_TYPE_DATE;[R7] [C2] column_is_rowkey:false;[R7] [C2] column_is_signed:true;[R7] [C2] column_encoding:binary;[R7] [C2] column_is_not_null:false;[R7] [C2] column_value_new:[2024-02-31](10);[R7] [C2] column_value_old:[2024-02-31](10);[R7] [C3] column_name:c1;[R7] [C3] column_type:MYSQL_TYPE_DATETIME;[R7] [C3] column_is_rowkey:false;[R7] [C3] column_is_signed:true;[R7] [C3] column_encoding:binary;[R7] [C3] column_is_not_null:false;[R7] [C3] column_scale:0;[R7] [C3] column_value_new:[2024-12-00 12:34:56](19);[R7] [C3] column_value_old:[2024-00-01 00:00:00](19);[R7] [C4] column_name:c2;[R7] [C4] column_type:MYSQL_TYPE_DATETIME;[R7] [C4] column_is_rowkey:false;[R7] [C4] column_is_signed:true;[R7] [C4] column_encoding:binary;[R7] [C4] column_is_not_null:false;[R7] [C4] column_scale:6;[R7] [C4] column_value_new:[NULL](0);[R7] [C4] column_value_old:[NULL](0);$[R8] record_type:UPDATE;[R8] database_name:oblog_tt.oblog_db1;[R8] table_name:simple_mysql_date;[R8] log_event:true;[R8] column_count:4;[R8] source_category:SRC_FULL_RECORDED;[R8] source_type:SRC_OCEANBASE_1_0;[R8] has_pk:true;[R8] pk_info:(0);[R8] pks:__pk_increment;[R8] has_uk:false;[R8] uk_info:(null);[R8] uks:(null);[R8] [C1] column_name:__pk_increment;[R8] [C1] column_type:MYSQL_TYPE_LONGLONG;[R8] [C1] column_is_rowkey:true;[R8] [C1] column_is_signed:false;[R8] [C1] column_encoding:binary;[R8] [C1] column_is_not_null:true;[R8] [C1] column_value_new:[8](1);[R8] [C1] column_value_old:[8](1);[R8] [C2] column_name:c0;[R8] [C2] column_type:MYSQL_TYPE_DATE;[R8] [C2] column_is_rowkey:false;[R8] [C2] column_is_signed:true;[R8] [C2] column_encoding:binary;[R8] [C2] column_is_not_null:false;[R8] [C2] column_value_new:[2024-02-31](10);[R8] [C2] column_value_old:[2024-02-31](10);[R8] [C3] column_name:c1;[R8] [C3] column_type:MYSQL_TYPE_DATETIME;[R8] [C3] column_is_rowkey:false;[R8] [C3] column_is_signed:true;[R8] [C3] column_encoding:binary;[R8] [C3] column_is_not_null:false;[R8] [C3] column_scale:0;[R8] [C3] column_value_new:[2024-12-00 12:34:56](19);[R8] [C3] column_value_old:[2024-00-01 00:00:00](19);[R8] [C4] column_name:c2;[R8] [C4] column_type:MYSQL_TYPE_DATETIME;[R8] [C4] column_is_rowkey:false;[R8] [C4] column_is_signed:true;[R8] [C4] column_encoding:binary;[R8] [C4] column_is_not_null:false;[R8] [C4] column_scale:6;[R8] [C4] column_value_new:[0000-00-00 00:00:00.000000](26);[R8] [C4] column_value_old:[0000-00-00 00:00:00.000000](26);$[R9] COMMIT;
select * from simple_mysql_date;
c0	c1	c2
2024-02-31	2024-12-00 12:34:56	2024-07-30 18:30:45.123456
2024-02-31	2024-12-00 12:34:56	2024-02-31 18:30:45.123456
2024-02-31	2024-12-00 12:34:56	2024-00-31 18:30:45.654321
2024-02-31	2024-12-00 12:34:56	2024-12-00 18:30:45.654321
2024-02-31	2024-12-00 12:34:56	2024-00-00 18:30:45.654321
2024-02-31	2024-12-00 12:34:56	0000-00-00 00:00:00.000000
2024-02-31	2024-12-00 12:34:56	NULL
2024-02-31	2024-12-00 12:34:56	0000-00-00 00:00:00.000000
update simple_mysql_date set c2 = '2024-00-00 00:00:00.999999';
ob1.oblog.next;
[R0] BEGIN;[R0] org_cluster_id:1;[R1] record_type:UPDATE;[R1] database_name:oblog_tt.oblog_db1;[R1] table_name:simple_mysql_date;[R1] log_event:true;[R1] column_count:4;[R1] source_category:SRC_FULL_RECORDED;[R1] source_type:SRC_OCEANBASE_1_0;[R1] has_pk:true;[R1] pk_info:(0);[R1] pks:__pk_increment;[R1] has_uk:false;[R1] uk_info:(null);[R1] uks:(null);[R1] [C1] column_name:__pk_increment;[R1] [C1] column_type:MYSQL_TYPE_LONGLONG;[R1] [C1] column_is_rowkey:true;[R1] [C1] column_is_signed:false;[R1] [C1] column_encoding:binary;[R1] [C1] column_is_not_null:true;[R1] [C1] column_value_new:[1](1);[R1] [C1] column_value_old:[1](1);[R1] [C2] column_name:c0;[R1] [C2] column_type:MYSQL_TYPE_DATE;[R1] [C2] column_is_rowkey:false;[R1] [C2] column_is_signed:true;[R1] [C2] column_encoding:binary;[R1] [C2] column_is_not_null:false;[R1] [C2] column_value_new:[2024-02-31](10);[R1] [C2] column_value_old:[2024-02-31](10);[R1] [C3] column_name:c1;[R1] [C3] column_type:MYSQL_TYPE_DATETIME;[R1] [C3] column_is_rowkey:false;[R1] [C3] column_is_signed:true;[R1] [C3] column_encoding:binary;[R1] [C3] column_is_not_null:false;[R1] [C3] column_scale:0;[R1] [C3] column_value_new:[2024-12-00 12:34:56](19);[R1] [C3] column_value_old:[2024-12-00 12:34:56](19);[R1] [C4] column_name:c2;[R1] [C4] column_type:MYSQL_TYPE_DATETIME;[R1] [C4] column_is_rowkey:false;[R1] [C4] column_is_signed:true;[R1] [C4] column_encoding:binary;[R1] [C4] column_is_not_null:false;[R1] [C4] column_scale:6;[R1] [C4] column_value_new:[2024-00-00 00:00:00.999999](26);[R1] [C4] column_value_old:[2024-07-30 18:30:45.123456](26);$[R2] record_type:UPDATE;[R2] database_name:oblog_tt.oblog_db1;[R2] table_name:simple_mysql_date;[R2] log_event:true;[R2] column_count:4;[R2] source_category:SRC_FULL_RECORDED;[R2] source_type:SRC_OCEANBASE_1_0;[R2] has_pk:true;[R2] pk_info:(0);[R2] pks:__pk_increment;[R2] has_uk:false;[R2] uk_info:(null);[R2] uks:(null);[R2] [C1] column_name:__pk_increment;[R2] [C1] column_type:MYSQL_TYPE_LONGLONG;[R2] [C1] column_is_rowkey:true;[R2] [C1] column_is_signed:false;[R2] [C1] column_encoding:binary;[R2] [C1] column_is_not_null:true;[R2] [C1] column_value_new:[2](1);[R2] [C1] column_value_old:[2](1);[R2] [C2] column_name:c0;[R2] [C2] column_type:MYSQL_TYPE_DATE;[R2] [C2] column_is_rowkey:false;[R2] [C2] column_is_signed:true;[R2] [C2] column_encoding:binary;[R2] [C2] column_is_not_null:false;[R2] [C2] column_value_new:[2024-02-31](10);[R2] [C2] column_value_old:[2024-02-31](10);[R2] [C3] column_name:c1;[R2] [C3] column_type:MYSQL_TYPE_DATETIME;[R2] [C3] column_is_rowkey:false;[R2] [C3] column_is_signed:true;[R2] [C3] column_encoding:binary;[R2] [C3] column_is_not_null:false;[R2] [C3] column_scale:0;[R2] [C3] column_value_new:[2024-12-00 12:34:56](19);[R2] [C3] column_value_old:[2024-12-00 12:34:56](19);[R2] [C4] column_name:c2;[R2] [C4] column_type:MYSQL_TYPE_DATETIME;[R2] [C4] column_is_rowkey:false;[R2] [C4] column_is_signed:true;[R2] [C4] column_encoding:binary;[R2] [C4] column_is_not_null:false;[R2] [C4] column_scale:6;[R2] [C4] column_value_new:[2024-00-00 00:00:00.999999](26);[R2] [C4] column_value_old:[2024-02-31 18:30:45.123456](26);$[R3] record_type:UPDATE;[R3] database_name:oblog_tt.oblog_db1;[R3] table_name:simple_mysql_date;[R3] log_event:true;[R3] column_count:4;[R3] source_category:SRC_FULL_RECORDED;[R3] source_type:SRC_OCEANBASE_1_0;[R3] has_pk:true;[R3] pk_info:(0);[R3] pks:__pk_increment;[R3] has_uk:false;[R3] uk_info:(null);[R3] uks:(null);[R3] [C1] column_name:__pk_increment;[R3] [C1] column_type:MYSQL_TYPE_LONGLONG;[R3] [C1] column_is_rowkey:true;[R3] [C1] column_is_signed:false;[R3] [C1] column_encoding:binary;[R3] [C1] column_is_not_null:true;[R3] [C1] column_value_new:[3](1);[R3] [C1] column_value_old:[3](1);[R3] [C2] column_name:c0;[R3] [C2] column_type:MYSQL_TYPE_DATE;[R3] [C2] column_is_rowkey:false;[R3] [C2] column_is_signed:true;[R3] [C2] column_encoding:binary;[R3] [C2] column_is_not_null:false;[R3] [C2] column_value_new:[2024-02-31](10);[R3] [C2] column_value_old:[2024-02-31](10);[R3] [C3] column_name:c1;[R3] [C3] column_type:MYSQL_TYPE_DATETIME;[R3] [C3] column_is_rowkey:false;[R3] [C3] column_is_signed:true;[R3] [C3] column_encoding:binary;[R3] [C3] column_is_not_null:false;[R3] [C3] column_scale:0;[R3] [C3] column_value_new:[2024-12-00 12:34:56](19);[R3] [C3] column_value_old:[2024-12-00 12:34:56](19);[R3] [C4] column_name:c2;[R3] [C4] column_type:MYSQL_TYPE_DATETIME;[R3] [C4] column_is_rowkey:false;[R3] [C4] column_is_signed:true;[R3] [C4] column_encoding:binary;[R3] [C4] column_is_not_null:false;[R3] [C4] column_scale:6;[R3] [C4] column_value_new:[2024-00-00 00:00:00.999999](26);[R3] [C4] column_value_old:[2024-00-31 18:30:45.654321](26);$[R4] record_type:UPDATE;[R4] database_name:oblog_tt.oblog_db1;[R4] table_name:simple_mysql_date;[R4] log_event:true;[R4] column_count:4;[R4] source_category:SRC_FULL_RECORDED;[R4] source_type:SRC_OCEANBASE_1_0;[R4] has_pk:true;[R4] pk_info:(0);[R4] pks:__pk_increment;[R4] has_uk:false;[R4] uk_info:(null);[R4] uks:(null);[R4] [C1] column_name:__pk_increment;[R4] [C1] column_type:MYSQL_TYPE_LONGLONG;[R4] [C1] column_is_rowkey:true;[R4] [C1] column_is_signed:false;[R4] [C1] column_encoding:binary;[R4] [C1] column_is_not_null:true;[R4] [C1] column_value_new:[4](1);[R4] [C1] column_value_old:[4](1);[R4] [C2] column_name:c0;[R4] [C2] column_type:MYSQL_TYPE_DATE;[R4] [C2] column_is_rowkey:false;[R4] [C2] column_is_signed:true;[R4] [C2] column_encoding:binary;[R4] [C2] column_is_not_null:false;[R4] [C2] column_value_new:[2024-02-31](10);[R4] [C2] column_value_old:[2024-02-31](10);[R4] [C3] column_name:c1;[R4] [C3] column_type:MYSQL_TYPE_DATETIME;[R4] [C3] column_is_rowkey:false;[R4] [C3] column_is_signed:true;[R4] [C3] column_encoding:binary;[R4] [C3] column_is_not_null:false;[R4] [C3] column_scale:0;[R4] [C3] column_value_new:[2024-12-00 12:34:56](19);[R4] [C3] column_value_old:[2024-12-00 12:34:56](19);[R4] [C4] column_name:c2;[R4] [C4] column_type:MYSQL_TYPE_DATETIME;[R4] [C4] column_is_rowkey:false;[R4] [C4] column_is_signed:true;[R4] [C4] column_encoding:binary;[R4] [C4] column_is_not_null:false;[R4] [C4] column_scale:6;[R4] [C4] column_value_new:[2024-00-00 00:00:00.999999](26);[R4] [C4] column_value_old:[2024-12-00 18:30:45.654321](26);$[R5] record_type:UPDATE;[R5] database_name:oblog_tt.oblog_db1;[R5] table_name:simple_mysql_date;[R5] log_event:true;[R5] column_count:4;[R5] source_category:SRC_FULL_RECORDED;[R5] source_type:SRC_OCEANBASE_1_0;[R5] has_pk:true;[R5] pk_info:(0);[R5] pks:__pk_increment;[R5] has_uk:false;[R5] uk_info:(null);[R5] uks:(null);[R5] [C1] column_name:__pk_increment;[R5] [C1] column_type:MYSQL_TYPE_LONGLONG;[R5] [C1] column_is_rowkey:true;[R5] [C1] column_is_signed:false;[R5] [C1] column_encoding:binary;[R5] [C1] column_is_not_null:true;[R5] [C1] column_value_new:[5](1);[R5] [C1] column_value_old:[5](1);[R5] [C2] column_name:c0;[R5] [C2] column_type:MYSQL_TYPE_DATE;[R5] [C2] column_is_rowkey:false;[R5] [C2] column_is_signed:true;[R5] [C2] column_encoding:binary;[R5] [C2] column_is_not_null:false;[R5] [C2] column_value_new:[2024-02-31](10);[R5] [C2] column_value_old:[2024-02-31](10);[R5] [C3] column_name:c1;[R5] [C3] column_type:MYSQL_TYPE_DATETIME;[R5] [C3] column_is_rowkey:false;[R5] [C3] column_is_signed:true;[R5] [C3] column_encoding:binary;[R5] [C3] column_is_not_null:false;[R5] [C3] column_scale:0;[R5] [C3] column_value_new:[2024-12-00 12:34:56](19);[R5] [C3] column_value_old:[2024-12-00 12:34:56](19);[R5] [C4] column_name:c2;[R5] [C4] column_type:MYSQL_TYPE_DATETIME;[R5] [C4] column_is_rowkey:false;[R5] [C4] column_is_signed:true;[R5] [C4] column_encoding:binary;[R5] [C4] column_is_not_null:false;[R5] [C4] column_scale:6;[R5] [C4] column_value_new:[2024-00-00 00:00:00.999999](26);[R5] [C4] column_value_old:[2024-00-00 18:30:45.654321](26);$[R6] record_type:UPDATE;[R6] database_name:oblog_tt.oblog_db1;[R6] table_name:simple_mysql_date;[R6] log_event:true;[R6] column_count:4;[R6] source_category:SRC_FULL_RECORDED;[R6] source_type:SRC_OCEANBASE_1_0;[R6] has_pk:true;[R6] pk_info:(0);[R6] pks:__pk_increment;[R6] has_uk:false;[R6] uk_info:(null);[R6] uks:(null);[R6] [C1] column_name:__pk_increment;[R6] [C1] column_type:MYSQL_TYPE_LONGLONG;[R6] [C1] column_is_rowkey:true;[R6] [C1] column_is_signed:false;[R6] [C1] column_encoding:binary;[R6] [C1] column_is_not_null:true;[R6] [C1] column_value_new:[6](1);[R6] [C1] column_value_old:[6](1);[R6] [C2] column_name:c0;[R6] [C2] column_type:MYSQL_TYPE_DATE;[R6] [C2] column_is_rowkey:false;[R6] [C2] column_is_signed:true;[R6] [C2] column_encoding:binary;[R6] [C2] column_is_not_null:false;[R6] [C2] column_value_new:[2024-02-31](10);[R6] [C2] column_value_old:[2024-02-31](10);[R6] [C3] column_name:c1;[R6] [C3] column_type:MYSQL_TYPE_DATETIME;[R6] [C3] column_is_rowkey:false;[R6] [C3] column_is_signed:true;[R6] [C3] column_encoding:binary;[R6] [C3] column_is_not_null:false;[R6] [C3] column_scale:0;[R6] [C3] column_value_new:[2024-12-00 12:34:56](19);[R6] [C3] column_value_old:[2024-12-00 12:34:56](19);[R6] [C4] column_name:c2;[R6] [C4] column_type:MYSQL_TYPE_DATETIME;[R6] [C4] column_is_rowkey:false;[R6] [C4] column_is_signed:true;[R6] [C4] column_encoding:binary;[R6] [C4] column_is_not_null:false;[R6] [C4] column_scale:6;[R6] [C4] column_value_new:[2024-00-00 00:00:00.999999](26);[R6] [C4] column_value_old:[0000-00-00 00:00:00.000000](26);$[R7] record_type:UPDATE;[R7] database_name:oblog_tt.oblog_db1;[R7] table_name:simple_mysql_date;[R7] log_event:true;[R7] column_count:4;[R7] source_category:SRC_FULL_RECORDED;[R7] source_type:SRC_OCEANBASE_1_0;[R7] has_pk:true;[R7] pk_info:(0);[R7] pks:__pk_increment;[R7] has_uk:false;[R7] uk_info:(null);[R7] uks:(null);[R7] [C1] column_name:__pk_increment;[R7] [C1] column_type:MYSQL_TYPE_LONGLONG;[R7] [C1] column_is_rowkey:true;[R7] [C1] column_is_signed:false;[R7] [C1] column_encoding:binary;[R7] [C1] column_is_not_null:true;[R7] [C1] column_value_new:[7](1);[R7] [C1] column_value_old:[7](1);[R7] [C2] column_name:c0;[R7] [C2] column_type:MYSQL_TYPE_DATE;[R7] [C2] column_is_rowkey:false;[R7] [C2] column_is_signed:true;[R7] [C2] column_encoding:binary;[R7] [C2] column_is_not_null:false;[R7] [C2] column_value_new:[2024-02-31](10);[R7] [C2] column_value_old:[2024-02-31](10);[R7] [C3] column_name:c1;[R7] [C3] column_type:MYSQL_TYPE_DATETIME;[R7] [C3] column_is_rowkey:false;[R7] [C3] column_is_signed:true;[R7] [C3] column_encoding:binary;[R7] [C3] column_is_not_null:false;[R7] [C3] column_scale:0;[R7] [C3] column_value_new:[2024-12-00 12:34:56](19);[R7] [C3] column_value_old:[2024-12-00 12:34:56](19);[R7] [C4] column_name:c2;[R7] [C4] column_type:MYSQL_TYPE_DATETIME;[R7] [C4] column_is_rowkey:false;[R7] [C4] column_is_signed:true;[R7] [C4] column_encoding:binary;[R7] [C4] column_is_not_null:false;[R7] [C4] column_scale:6;[R7] [C4] column_value_new:[2024-00-00 00:00:00.999999](26);[R7] [C4] column_value_old:[NULL](0);$[R8] record_type:UPDATE;[R8] database_name:oblog_tt.oblog_db1;[R8] table_name:simple_mysql_date;[R8] log_event:true;[R8] column_count:4;[R8] source_category:SRC_FULL_RECORDED;[R8] source_type:SRC_OCEANBASE_1_0;[R8] has_pk:true;[R8] pk_info:(0);[R8] pks:__pk_increment;[R8] has_uk:false;[R8] uk_info:(null);[R8] uks:(null);[R8] [C1] column_name:__pk_increment;[R8] [C1] column_type:MYSQL_TYPE_LONGLONG;[R8] [C1] column_is_rowkey:true;[R8] [C1] column_is_signed:false;[R8] [C1] column_encoding:binary;[R8] [C1] column_is_not_null:true;[R8] [C1] column_value_new:[8](1);[R8] [C1] column_value_old:[8](1);[R8] [C2] column_name:c0;[R8] [C2] column_type:MYSQL_TYPE_DATE;[R8] [C2] column_is_rowkey:false;[R8] [C2] column_is_signed:true;[R8] [C2] column_encoding:binary;[R8] [C2] column_is_not_null:false;[R8] [C2] column_value_new:[2024-02-31](10);[R8] [C2] column_value_old:[2024-02-31](10);[R8] [C3] column_name:c1;[R8] [C3] column_type:MYSQL_TYPE_DATETIME;[R8] [C3] column_is_rowkey:false;[R8] [C3] column_is_signed:true;[R8] [C3] column_encoding:binary;[R8] [C3] column_is_not_null:false;[R8] [C3] column_scale:0;[R8] [C3] column_value_new:[2024-12-00 12:34:56](19);[R8] [C3] column_value_old:[2024-12-00 12:34:56](19);[R8] [C4] column_name:c2;[R8] [C4] column_type:MYSQL_TYPE_DATETIME;[R8] [C4] column_is_rowkey:false;[R8] [C4] column_is_signed:true;[R8] [C4] column_encoding:binary;[R8] [C4] column_is_not_null:false;[R8] [C4] column_scale:6;[R8] [C4] column_value_new:[2024-00-00 00:00:00.999999](26);[R8] [C4] column_value_old:[0000-00-00 00:00:00.000000](26);$[R9] COMMIT;
select * from simple_mysql_date;
c0	c1	c2
2024-02-31	2024-12-00 12:34:56	2024-00-00 00:00:00.999999
2024-02-31	2024-12-00 12:34:56	2024-00-00 00:00:00.999999
2024-02-31	2024-12-00 12:34:56	2024-00-00 00:00:00.999999
2024-02-31	2024-12-00 12:34:56	2024-00-00 00:00:00.999999
2024-02-31	2024-12-00 12:34:56	2024-00-00 00:00:00.999999
2024-02-31	2024-12-00 12:34:56	2024-00-00 00:00:00.999999
2024-02-31	2024-12-00 12:34:56	2024-00-00 00:00:00.999999
2024-02-31	2024-12-00 12:34:56	2024-00-00 00:00:00.999999
drop table simple_mysql_date;
ob1.oblog.next;
[R0] record_type:EDDL;[R0] db_name:oblog_tt.oblog_db1;[R0] table_name:;[R0] column_count:1;[R0] column_name:ddl;[R0] ddl_stmt_str: DROP TABLE `oblog_db1`.`simple_mysql_date`;[R0] ddl_stmt_len: 42;
create table simple_mysql_date(c1 date, c2 datetime, c3 int, primary key(c1, c2));
ob1.oblog.next;
[R0] record_type:EDDL;[R0] db_name:oblog_tt.oblog_db1;[R0] table_name:;[R0] column_count:1;[R0] column_name:ddl;[R0] ddl_stmt_str: create table simple_mysql_date(c1 date, c2 datetime, c3 int, primary key(c1, c2));[R0] ddl_stmt_len: 81;
insert into simple_mysql_date values(date'2024-02-31', '2024-02-31 12:34:56', 1);
delete from simple_mysql_date;
insert into simple_mysql_date values(date'2024-00-31', '2024-00-31 12:34:56', 2);
delete from simple_mysql_date;
insert into simple_mysql_date values(date'2024-00-00', '2024-00-00 12:34:56', 3);
delete from simple_mysql_date;
ob1.oblog.next;
[R0] BEGIN;[R0] org_cluster_id:1;[R1] record_type:INSERT;[R1] database_name:oblog_tt.oblog_db1;[R1] table_name:simple_mysql_date;[R1] log_event:true;[R1] column_count:3;[R1] source_category:SRC_FULL_RECORDED;[R1] source_type:SRC_OCEANBASE_1_0;[R1] has_pk:true;[R1] pk_info:(0,1);[R1] pks:c1,c2;[R1] has_uk:false;[R1] uk_info:(null);[R1] uks:(null);[R1] [C1] column_name:c1;[R1] [C1] column_type:MYSQL_TYPE_DATE;[R1] [C1] column_is_rowkey:true;[R1] [C1] column_is_signed:true;[R1] [C1] column_encoding:binary;[R1] [C1] column_is_not_null:true;[R1] [C1] column_value_new:[2024-02-31](10);[R1] [C2] column_name:c2;[R1] [C2] column_type:MYSQL_TYPE_DATETIME;[R1] [C2] column_is_rowkey:true;[R1] [C2] column_is_signed:true;[R1] [C2] column_encoding:binary;[R1] [C2] column_is_not_null:true;[R1] [C2] column_scale:0;[R1] [C2] column_value_new:[2024-02-31 12:34:56](19);[R1] [C3] column_name:c3;[R1] [C3] column_type:MYSQL_TYPE_LONG;[R1] [C3] column_is_rowkey:false;[R1] [C3] column_is_signed:true;[R1] [C3] column_encoding:binary;[R1] [C3] column_is_not_null:false;[R1] [C3] column_value_new:[1](1);$[R2] COMMIT;
ob1.oblog.next;
[R0] BEGIN;[R0] org_cluster_id:1;[R1] record_type:DELETE;[R1] database_name:oblog_tt.oblog_db1;[R1] table_name:simple_mysql_date;[R1] log_event:true;[R1] column_count:3;[R1] source_category:SRC_FULL_RECORDED;[R1] source_type:SRC_OCEANBASE_1_0;[R1] has_pk:true;[R1] pk_info:(0,1);[R1] pks:c1,c2;[R1] has_uk:false;[R1] uk_info:(null);[R1] uks:(null);[R1] [C1] column_name:c1;[R1] [C1] column_type:MYSQL_TYPE_DATE;[R1] [C1] column_is_rowkey:true;[R1] [C1] column_is_signed:true;[R1] [C1] column_encoding:binary;[R1] [C1] column_is_not_null:true;[R1] [C1] column_value_old:[2024-02-31](10);[R1] [C2] column_name:c2;[R1] [C2] column_type:MYSQL_TYPE_DATETIME;[R1] [C2] column_is_rowkey:true;[R1] [C2] column_is_signed:true;[R1] [C2] column_encoding:binary;[R1] [C2] column_is_not_null:true;[R1] [C2] column_scale:0;[R1] [C2] column_value_old:[2024-02-31 12:34:56](19);[R1] [C3] column_name:c3;[R1] [C3] column_type:MYSQL_TYPE_LONG;[R1] [C3] column_is_rowkey:false;[R1] [C3] column_is_signed:true;[R1] [C3] column_encoding:binary;[R1] [C3] column_is_not_null:false;[R1] [C3] column_value_old:[1](1);$[R2] COMMIT;
ob1.oblog.next;
[R0] BEGIN;[R0] org_cluster_id:1;[R1] record_type:INSERT;[R1] database_name:oblog_tt.oblog_db1;[R1] table_name:simple_mysql_date;[R1] log_event:true;[R1] column_count:3;[R1] source_category:SRC_FULL_RECORDED;[R1] source_type:SRC_OCEANBASE_1_0;[R1] has_pk:true;[R1] pk_info:(0,1);[R1] pks:c1,c2;[R1] has_uk:false;[R1] uk_info:(null);[R1] uks:(null);[R1] [C1] column_name:c1;[R1] [C1] column_type:MYSQL_TYPE_DATE;[R1] [C1] column_is_rowkey:true;[R1] [C1] column_is_signed:true;[R1] [C1] column_encoding:binary;[R1] [C1] column_is_not_null:true;[R1] [C1] column_value_new:[2024-00-31](10);[R1] [C2] column_name:c2;[R1] [C2] column_type:MYSQL_TYPE_DATETIME;[R1] [C2] column_is_rowkey:true;[R1] [C2] column_is_signed:true;[R1] [C2] column_encoding:binary;[R1] [C2] column_is_not_null:true;[R1] [C2] column_scale:0;[R1] [C2] column_value_new:[2024-00-31 12:34:56](19);[R1] [C3] column_name:c3;[R1] [C3] column_type:MYSQL_TYPE_LONG;[R1] [C3] column_is_rowkey:false;[R1] [C3] column_is_signed:true;[R1] [C3] column_encoding:binary;[R1] [C3] column_is_not_null:false;[R1] [C3] column_value_new:[2](1);$[R2] COMMIT;
ob1.oblog.next;
[R0] BEGIN;[R0] org_cluster_id:1;[R1] record_type:DELETE;[R1] database_name:oblog_tt.oblog_db1;[R1] table_name:simple_mysql_date;[R1] log_event:true;[R1] column_count:3;[R1] source_category:SRC_FULL_RECORDED;[R1] source_type:SRC_OCEANBASE_1_0;[R1] has_pk:true;[R1] pk_info:(0,1);[R1] pks:c1,c2;[R1] has_uk:false;[R1] uk_info:(null);[R1] uks:(null);[R1] [C1] column_name:c1;[R1] [C1] column_type:MYSQL_TYPE_DATE;[R1] [C1] column_is_rowkey:true;[R1] [C1] column_is_signed:true;[R1] [C1] column_encoding:binary;[R1] [C1] column_is_not_null:true;[R1] [C1] column_value_old:[2024-00-31](10);[R1] [C2] column_name:c2;[R1] [C2] column_type:MYSQL_TYPE_DATETIME;[R1] [C2] column_is_rowkey:true;[R1] [C2] column_is_signed:true;[R1] [C2] column_encoding:binary;[R1] [C2] column_is_not_null:true;[R1] [C2] column_scale:0;[R1] [C2] column_value_old:[2024-00-31 12:34:56](19);[R1] [C3] column_name:c3;[R1] [C3] column_type:MYSQL_TYPE_LONG;[R1] [C3] column_is_rowkey:false;[R1] [C3] column_is_signed:true;[R1] [C3] column_encoding:binary;[R1] [C3] column_is_not_null:false;[R1] [C3] column_value_old:[2](1);$[R2] COMMIT;
ob1.oblog.next;
[R0] BEGIN;[R0] org_cluster_id:1;[R1] record_type:INSERT;[R1] database_name:oblog_tt.oblog_db1;[R1] table_name:simple_mysql_date;[R1] log_event:true;[R1] column_count:3;[R1] source_category:SRC_FULL_RECORDED;[R1] source_type:SRC_OCEANBASE_1_0;[R1] has_pk:true;[R1] pk_info:(0,1);[R1] pks:c1,c2;[R1] has_uk:false;[R1] uk_info:(null);[R1] uks:(null);[R1] [C1] column_name:c1;[R1] [C1] column_type:MYSQL_TYPE_DATE;[R1] [C1] column_is_rowkey:true;[R1] [C1] column_is_signed:true;[R1] [C1] column_encoding:binary;[R1] [C1] column_is_not_null:true;[R1] [C1] column_value_new:[2024-00-00](10);[R1] [C2] column_name:c2;[R1] [C2] column_type:MYSQL_TYPE_DATETIME;[R1] [C2] column_is_rowkey:true;[R1] [C2] column_is_signed:true;[R1] [C2] column_encoding:binary;[R1] [C2] column_is_not_null:true;[R1] [C2] column_scale:0;[R1] [C2] column_value_new:[2024-00-00 12:34:56](19);[R1] [C3] column_name:c3;[R1] [C3] column_type:MYSQL_TYPE_LONG;[R1] [C3] column_is_rowkey:false;[R1] [C3] column_is_signed:true;[R1] [C3] column_encoding:binary;[R1] [C3] column_is_not_null:false;[R1] [C3] column_value_new:[3](1);$[R2] COMMIT;
ob1.oblog.next;
[R0] BEGIN;[R0] org_cluster_id:1;[R1] record_type:DELETE;[R1] database_name:oblog_tt.oblog_db1;[R1] table_name:simple_mysql_date;[R1] log_event:true;[R1] column_count:3;[R1] source_category:SRC_FULL_RECORDED;[R1] source_type:SRC_OCEANBASE_1_0;[R1] has_pk:true;[R1] pk_info:(0,1);[R1] pks:c1,c2;[R1] has_uk:false;[R1] uk_info:(null);[R1] uks:(null);[R1] [C1] column_name:c1;[R1] [C1] column_type:MYSQL_TYPE_DATE;[R1] [C1] column_is_rowkey:true;[R1] [C1] column_is_signed:true;[R1] [C1] column_encoding:binary;[R1] [C1] column_is_not_null:true;[R1] [C1] column_value_old:[2024-00-00](10);[R1] [C2] column_name:c2;[R1] [C2] column_type:MYSQL_TYPE_DATETIME;[R1] [C2] column_is_rowkey:true;[R1] [C2] column_is_signed:true;[R1] [C2] column_encoding:binary;[R1] [C2] column_is_not_null:true;[R1] [C2] column_scale:0;[R1] [C2] column_value_old:[2024-00-00 12:34:56](19);[R1] [C3] column_name:c3;[R1] [C3] column_type:MYSQL_TYPE_LONG;[R1] [C3] column_is_rowkey:false;[R1] [C3] column_is_signed:true;[R1] [C3] column_encoding:binary;[R1] [C3] column_is_not_null:false;[R1] [C3] column_value_old:[3](1);$[R2] COMMIT;
ob1.oblog.stop;
ob1.oblog.set_start_tstamp $start_tstamp;
ob1.oblog.gen_conf tb_white_list=oblog_tt.oblog_db1.* log_level=DEBUG;
ob1.oblog.set_extra_argument -i;
ob1.oblog.restart;
ob1.oblog.next;
[R0] BEGIN;[R0] org_cluster_id:1;[R1] record_type:INSERT;[R1] database_name:oblog_tt.oblog_db1;[R1] table_name:simple_mysql_date;[R1] log_event:true;[R1] column_count:3;[R1] source_category:SRC_FULL_RECORDED;[R1] source_type:SRC_OCEANBASE_1_0;[R1] has_pk:true;[R1] pk_info:(0,1);[R1] pks:c1,c2;[R1] has_uk:false;[R1] uk_info:(null);[R1] uks:(null);[R1] [C1] column_name:c1;[R1] [C1] column_type:MYSQL_TYPE_DATE;[R1] [C1] column_is_rowkey:true;[R1] [C1] column_is_signed:true;[R1] [C1] column_encoding:binary;[R1] [C1] column_is_not_null:true;[R1] [C1] column_value_new:[2024-02-31](10);[R1] [C2] column_name:c2;[R1] [C2] column_type:MYSQL_TYPE_DATETIME;[R1] [C2] column_is_rowkey:true;[R1] [C2] column_is_signed:true;[R1] [C2] column_encoding:binary;[R1] [C2] column_is_not_null:true;[R1] [C2] column_scale:0;[R1] [C2] column_value_new:[2024-02-31 12:34:56](19);[R1] [C3] column_name:c3;[R1] [C3] column_type:MYSQL_TYPE_LONG;[R1] [C3] column_is_rowkey:false;[R1] [C3] column_is_signed:true;[R1] [C3] column_encoding:binary;[R1] [C3] column_is_not_null:false;[R1] [C3] column_value_new:[1](1);$[R2] COMMIT;
ob1.oblog.next;
[R0] BEGIN;[R0] org_cluster_id:1;[R1] record_type:DELETE;[R1] database_name:oblog_tt.oblog_db1;[R1] table_name:simple_mysql_date;[R1] log_event:true;[R1] column_count:3;[R1] source_category:SRC_FULL_RECORDED;[R1] source_type:SRC_OCEANBASE_1_0;[R1] has_pk:true;[R1] pk_info:(0,1);[R1] pks:c1,c2;[R1] has_uk:false;[R1] uk_info:(null);[R1] uks:(null);[R1] [C1] column_name:c1;[R1] [C1] column_type:MYSQL_TYPE_DATE;[R1] [C1] column_is_rowkey:true;[R1] [C1] column_is_signed:true;[R1] [C1] column_encoding:binary;[R1] [C1] column_is_not_null:true;[R1] [C1] column_value_old:[2024-02-31](10);[R1] [C2] column_name:c2;[R1] [C2] column_type:MYSQL_TYPE_DATETIME;[R1] [C2] column_is_rowkey:true;[R1] [C2] column_is_signed:true;[R1] [C2] column_encoding:binary;[R1] [C2] column_is_not_null:true;[R1] [C2] column_scale:0;[R1] [C2] column_value_old:[2024-02-31 12:34:56](19);[R1] [C3] column_name:c3;[R1] [C3] column_type:MYSQL_TYPE_LONG;[R1] [C3] column_is_rowkey:false;[R1] [C3] column_is_signed:true;[R1] [C3] column_encoding:binary;[R1] [C3] column_is_not_null:false;[R1] [C3] column_value_old:[1](1);$[R2] COMMIT;
ob1.oblog.next;
[R0] BEGIN;[R0] org_cluster_id:1;[R1] record_type:INSERT;[R1] database_name:oblog_tt.oblog_db1;[R1] table_name:simple_mysql_date;[R1] log_event:true;[R1] column_count:3;[R1] source_category:SRC_FULL_RECORDED;[R1] source_type:SRC_OCEANBASE_1_0;[R1] has_pk:true;[R1] pk_info:(0,1);[R1] pks:c1,c2;[R1] has_uk:false;[R1] uk_info:(null);[R1] uks:(null);[R1] [C1] column_name:c1;[R1] [C1] column_type:MYSQL_TYPE_DATE;[R1] [C1] column_is_rowkey:true;[R1] [C1] column_is_signed:true;[R1] [C1] column_encoding:binary;[R1] [C1] column_is_not_null:true;[R1] [C1] column_value_new:[2024-00-31](10);[R1] [C2] column_name:c2;[R1] [C2] column_type:MYSQL_TYPE_DATETIME;[R1] [C2] column_is_rowkey:true;[R1] [C2] column_is_signed:true;[R1] [C2] column_encoding:binary;[R1] [C2] column_is_not_null:true;[R1] [C2] column_scale:0;[R1] [C2] column_value_new:[2024-00-31 12:34:56](19);[R1] [C3] column_name:c3;[R1] [C3] column_type:MYSQL_TYPE_LONG;[R1] [C3] column_is_rowkey:false;[R1] [C3] column_is_signed:true;[R1] [C3] column_encoding:binary;[R1] [C3] column_is_not_null:false;[R1] [C3] column_value_new:[2](1);$[R2] COMMIT;
ob1.oblog.next;
[R0] BEGIN;[R0] org_cluster_id:1;[R1] record_type:DELETE;[R1] database_name:oblog_tt.oblog_db1;[R1] table_name:simple_mysql_date;[R1] log_event:true;[R1] column_count:3;[R1] source_category:SRC_FULL_RECORDED;[R1] source_type:SRC_OCEANBASE_1_0;[R1] has_pk:true;[R1] pk_info:(0,1);[R1] pks:c1,c2;[R1] has_uk:false;[R1] uk_info:(null);[R1] uks:(null);[R1] [C1] column_name:c1;[R1] [C1] column_type:MYSQL_TYPE_DATE;[R1] [C1] column_is_rowkey:true;[R1] [C1] column_is_signed:true;[R1] [C1] column_encoding:binary;[R1] [C1] column_is_not_null:true;[R1] [C1] column_value_old:[2024-00-31](10);[R1] [C2] column_name:c2;[R1] [C2] column_type:MYSQL_TYPE_DATETIME;[R1] [C2] column_is_rowkey:true;[R1] [C2] column_is_signed:true;[R1] [C2] column_encoding:binary;[R1] [C2] column_is_not_null:true;[R1] [C2] column_scale:0;[R1] [C2] column_value_old:[2024-00-31 12:34:56](19);[R1] [C3] column_name:c3;[R1] [C3] column_type:MYSQL_TYPE_LONG;[R1] [C3] column_is_rowkey:false;[R1] [C3] column_is_signed:true;[R1] [C3] column_encoding:binary;[R1] [C3] column_is_not_null:false;[R1] [C3] column_value_old:[2](1);$[R2] COMMIT;
ob1.oblog.next;
[R0] BEGIN;[R0] org_cluster_id:1;[R1] record_type:INSERT;[R1] database_name:oblog_tt.oblog_db1;[R1] table_name:simple_mysql_date;[R1] log_event:true;[R1] column_count:3;[R1] source_category:SRC_FULL_RECORDED;[R1] source_type:SRC_OCEANBASE_1_0;[R1] has_pk:true;[R1] pk_info:(0,1);[R1] pks:c1,c2;[R1] has_uk:false;[R1] uk_info:(null);[R1] uks:(null);[R1] [C1] column_name:c1;[R1] [C1] column_type:MYSQL_TYPE_DATE;[R1] [C1] column_is_rowkey:true;[R1] [C1] column_is_signed:true;[R1] [C1] column_encoding:binary;[R1] [C1] column_is_not_null:true;[R1] [C1] column_value_new:[2024-00-00](10);[R1] [C2] column_name:c2;[R1] [C2] column_type:MYSQL_TYPE_DATETIME;[R1] [C2] column_is_rowkey:true;[R1] [C2] column_is_signed:true;[R1] [C2] column_encoding:binary;[R1] [C2] column_is_not_null:true;[R1] [C2] column_scale:0;[R1] [C2] column_value_new:[2024-00-00 12:34:56](19);[R1] [C3] column_name:c3;[R1] [C3] column_type:MYSQL_TYPE_LONG;[R1] [C3] column_is_rowkey:false;[R1] [C3] column_is_signed:true;[R1] [C3] column_encoding:binary;[R1] [C3] column_is_not_null:false;[R1] [C3] column_value_new:[3](1);$[R2] COMMIT;
ob1.oblog.next;
[R0] BEGIN;[R0] org_cluster_id:1;[R1] record_type:DELETE;[R1] database_name:oblog_tt.oblog_db1;[R1] table_name:simple_mysql_date;[R1] log_event:true;[R1] column_count:3;[R1] source_category:SRC_FULL_RECORDED;[R1] source_type:SRC_OCEANBASE_1_0;[R1] has_pk:true;[R1] pk_info:(0,1);[R1] pks:c1,c2;[R1] has_uk:false;[R1] uk_info:(null);[R1] uks:(null);[R1] [C1] column_name:c1;[R1] [C1] column_type:MYSQL_TYPE_DATE;[R1] [C1] column_is_rowkey:true;[R1] [C1] column_is_signed:true;[R1] [C1] column_encoding:binary;[R1] [C1] column_is_not_null:true;[R1] [C1] column_value_old:[2024-00-00](10);[R1] [C2] column_name:c2;[R1] [C2] column_type:MYSQL_TYPE_DATETIME;[R1] [C2] column_is_rowkey:true;[R1] [C2] column_is_signed:true;[R1] [C2] column_encoding:binary;[R1] [C2] column_is_not_null:true;[R1] [C2] column_scale:0;[R1] [C2] column_value_old:[2024-00-00 12:34:56](19);[R1] [C3] column_name:c3;[R1] [C3] column_type:MYSQL_TYPE_LONG;[R1] [C3] column_is_rowkey:false;[R1] [C3] column_is_signed:true;[R1] [C3] column_encoding:binary;[R1] [C3] column_is_not_null:false;[R1] [C3] column_value_old:[3](1);$[R2] COMMIT;
ob1.oblog.stop;
