ob1=OBI(cluster=1:1:1,oblog_version=current);
ob1.force_stop;
ob1.clean_backup_dest;
ob1.reboot;
set global recyclebin=off;
create resource unit mysql_oblog_box max_cpu 1, memory_size='5G';
create resource pool mysql_oblog_pool unit = 'mysql_oblog_box', unit_num = 1, zone_list = ('z1');
create tenant cdc_mysql replica_num = 1, primary_zone='z1', resource_pool_list=('mysql_oblog_pool') set ob_tcp_invited_nodes='%';
create user obcdc identified by "obcdc";
grant all on *.* to obcdc;
set autocommit=1;
ob1.mysql alter system set resource_hard_limit= 800;
drop tenant if exists oracle;
drop resource pool if exists oracle_oblog_pool;
drop resource unit if exists oracle_oblog_box;
ob1.mysql create resource unit oracle_oblog_box max_cpu 1, memory_size='5G';
ob1.mysql create resource pool oracle_oblog_pool unit = 'oracle_oblog_box', unit_num = 1;
ob1.mysql create tenant oracle replica_num = 1, resource_pool_list=('oracle_oblog_pool') set ob_tcp_invited_nodes='%', ob_compatibility_mode='oracle';
ob1.mysql alter tenant oracle set variables autocommit='on';
ob1.mysql alter tenant oracle set variables nls_date_format='YYYY-MM-DD HH24:MI:SS';
ob1.mysql alter tenant oracle set variables nls_timestamp_format='YYYY-MM-DD HH24:MI:SS.FF';
ob1.mysql alter tenant oracle set variables nls_timestamp_tz_format='YYYY-MM-DD HH24:MI:SS.FF TZR TZD';
create user obtest IDENTIFIED BY "obtest";
grant all on *.* to obtest WITH GRANT OPTION;
grant dba to obtest;
grant dba to ORAAUDITOR;
ob1.mysql alter system archivelog;
ob1.check_until_timeout select count(*) from oceanbase.CDB_OB_ARCHIVELOG where status = 'DOING', 2, 600;
ob1.z1.obs0.check_log_until_success -c "get_data_dict_meta_info(tenant_id_=1004";
ob1.z1.obs0.check_log_until_success -c "get_data_dict_meta_info(tenant_id_=1006";
ob1.oblog.gen_conf tb_white_list=cdc_mysql.*.* log_level=DEBUG;
ob1.oblog.restart;
create database ddl_basic_db1;
ob1.oblog.next;
[R0] record_type:EDDL;[R0] db_name:cdc_mysql;[R0] table_name:;[R0] column_count:1;[R0] column_name:ddl;[R0] ddl_stmt_str: create database ddl_basic_db1;[R0] ddl_stmt_len: 29;
use ddl_basic_db1;
create database ddl_basic_db2;
ob1.oblog.next;
[R0] record_type:EDDL;[R0] db_name:cdc_mysql;[R0] table_name:;[R0] column_count:1;[R0] column_name:ddl;[R0] ddl_stmt_str: create database ddl_basic_db2;[R0] ddl_stmt_len: 29;
drop database ddl_basic_db2;
ob1.oblog.next;
[R0] record_type:EDDL;[R0] db_name:cdc_mysql.ddl_basic_db2;[R0] table_name:;[R0] column_count:1;[R0] column_name:ddl;[R0] ddl_stmt_str: drop database ddl_basic_db2;[R0] ddl_stmt_len: 27;
create table ddl_basic_db1.ddl_t1 (pk int primary key);
ob1.oblog.next;
[R0] record_type:EDDL;[R0] db_name:cdc_mysql.ddl_basic_db1;[R0] table_name:;[R0] column_count:1;[R0] column_name:ddl;[R0] ddl_stmt_str: create table ddl_basic_db1.ddl_t1 (pk int primary key);[R0] ddl_stmt_len: 54;
create table ddl_basic_db1.ddl_t2 (pk int primary key);
ob1.oblog.next;
[R0] record_type:EDDL;[R0] db_name:cdc_mysql.ddl_basic_db1;[R0] table_name:;[R0] column_count:1;[R0] column_name:ddl;[R0] ddl_stmt_str: create table ddl_basic_db1.ddl_t2 (pk int primary key);[R0] ddl_stmt_len: 54;
create table if not exists ddl_basic_db1.t3 (c1 int primary key, c2 int, c3 int, c4 int, c5 int, key idx_1 (c1,c2,c3), key idx_2 (c2,c4), key idx_3 (c3,c2), unique key uk_test (c4,c2,c5),unique key uk_test1 (c2,c1));
ob1.oblog.next;
[R0] record_type:EDDL;[R0] db_name:cdc_mysql.ddl_basic_db1;[R0] table_name:;[R0] column_count:1;[R0] column_name:ddl;[R0] ddl_stmt_str: create table if not exists ddl_basic_db1.t3 (c1 int primary key, c2 int, c3 int, c4 int, c5 int, key idx_1 (c1,c2,c3), key idx_2 (c2,c4), key idx_3 (c3,c2), unique key uk_test (c4,c2,c5),unique key uk_test1 (c2,c1));[R0] ddl_stmt_len: 215;
DROP INDEX idx_2 on t3;
ob1.oblog.next;
[R0] record_type:EDDL;[R0] db_name:cdc_mysql.ddl_basic_db1;[R0] table_name:;[R0] column_count:1;[R0] column_name:ddl;[R0] ddl_stmt_str: DROP INDEX idx_2 on t3;[R0] ddl_stmt_len: 22;
CREATE INDEX idx_2a on t3(c4,c2);
ob1.oblog.next;
[R0] record_type:EDDL;[R0] db_name:cdc_mysql.ddl_basic_db1;[R0] table_name:;[R0] column_count:1;[R0] column_name:ddl;[R0] ddl_stmt_str: CREATE INDEX idx_2a on t3(c4,c2);[R0] ddl_stmt_len: 32;
DROP INDEX uk_test on t3;
ob1.oblog.next;
[R0] record_type:EDDL;[R0] db_name:cdc_mysql.ddl_basic_db1;[R0] table_name:;[R0] column_count:1;[R0] column_name:ddl;[R0] ddl_stmt_str: DROP INDEX uk_test on t3;[R0] ddl_stmt_len: 24;
CREATE INDEX uk_testa on t3(c4,c2);
ob1.oblog.next;
[R0] record_type:EDDL;[R0] db_name:cdc_mysql.ddl_basic_db1;[R0] table_name:;[R0] column_count:1;[R0] column_name:ddl;[R0] ddl_stmt_str: CREATE INDEX uk_testa on t3(c4,c2);[R0] ddl_stmt_len: 34;
create table table_with_generate_column(c1 int, c2 int, c3 int as (c1 + c2));
ob1.oblog.next;
[R0] record_type:EDDL;[R0] db_name:cdc_mysql.ddl_basic_db1;[R0] table_name:;[R0] column_count:1;[R0] column_name:ddl;[R0] ddl_stmt_str: create table table_with_generate_column(c1 int, c2 int, c3 int as (c1 + c2));[R0] ddl_stmt_len: 76;
insert into table_with_generate_column (c1, c2) VALUES(1, 2);
ob1.oblog.next;
[R0] BEGIN;[R0] org_cluster_id:1;[R1] record_type:INSERT;[R1] database_name:cdc_mysql.ddl_basic_db1;[R1] table_name:table_with_generate_column;[R1] log_event:true;[R1] column_count:3;[R1] source_category:SRC_FULL_RECORDED;[R1] source_type:SRC_OCEANBASE_1_0;[R1] has_pk:true;[R1] pk_info:(0);[R1] pks:__pk_increment;[R1] has_uk:false;[R1] uk_info:(null);[R1] uks:(null);[R1] [C1] column_name:__pk_increment;[R1] [C1] column_type:MYSQL_TYPE_LONGLONG;[R1] [C1] column_is_rowkey:true;[R1] [C1] column_is_signed:false;[R1] [C1] column_encoding:binary;[R1] [C1] column_is_not_null:true;[R1] [C1] column_value_new:[1](1);[R1] [C2] column_name:c1;[R1] [C2] column_type:MYSQL_TYPE_LONG;[R1] [C2] column_is_rowkey:false;[R1] [C2] column_is_signed:true;[R1] [C2] column_encoding:binary;[R1] [C2] column_is_not_null:false;[R1] [C2] column_value_new:[1](1);[R1] [C3] column_name:c2;[R1] [C3] column_type:MYSQL_TYPE_LONG;[R1] [C3] column_is_rowkey:false;[R1] [C3] column_is_signed:true;[R1] [C3] column_encoding:binary;[R1] [C3] column_is_not_null:false;[R1] [C3] column_value_new:[2](1);$[R2] COMMIT;
insert into table_with_generate_column (c1, c2) VALUES(3, 4);
ob1.oblog.next;
[R0] BEGIN;[R0] org_cluster_id:1;[R1] record_type:INSERT;[R1] database_name:cdc_mysql.ddl_basic_db1;[R1] table_name:table_with_generate_column;[R1] log_event:true;[R1] column_count:3;[R1] source_category:SRC_FULL_RECORDED;[R1] source_type:SRC_OCEANBASE_1_0;[R1] has_pk:true;[R1] pk_info:(0);[R1] pks:__pk_increment;[R1] has_uk:false;[R1] uk_info:(null);[R1] uks:(null);[R1] [C1] column_name:__pk_increment;[R1] [C1] column_type:MYSQL_TYPE_LONGLONG;[R1] [C1] column_is_rowkey:true;[R1] [C1] column_is_signed:false;[R1] [C1] column_encoding:binary;[R1] [C1] column_is_not_null:true;[R1] [C1] column_value_new:[2](1);[R1] [C2] column_name:c1;[R1] [C2] column_type:MYSQL_TYPE_LONG;[R1] [C2] column_is_rowkey:false;[R1] [C2] column_is_signed:true;[R1] [C2] column_encoding:binary;[R1] [C2] column_is_not_null:false;[R1] [C2] column_value_new:[3](1);[R1] [C3] column_name:c2;[R1] [C3] column_type:MYSQL_TYPE_LONG;[R1] [C3] column_is_rowkey:false;[R1] [C3] column_is_signed:true;[R1] [C3] column_encoding:binary;[R1] [C3] column_is_not_null:false;[R1] [C3] column_value_new:[4](1);$[R2] COMMIT;
drop table table_with_generate_column;
ob1.oblog.next;
[R0] record_type:EDDL;[R0] db_name:cdc_mysql.ddl_basic_db1;[R0] table_name:;[R0] column_count:1;[R0] column_name:ddl;[R0] ddl_stmt_str: DROP TABLE `ddl_basic_db1`.`table_with_generate_column`;[R0] ddl_stmt_len: 55;
drop table ddl_basic_db1.ddl_t1;
ob1.oblog.next;
[R0] record_type:EDDL;[R0] db_name:cdc_mysql.ddl_basic_db1;[R0] table_name:;[R0] column_count:1;[R0] column_name:ddl;[R0] ddl_stmt_str: DROP TABLE `ddl_basic_db1`.`ddl_t1`;[R0] ddl_stmt_len: 35;
alter table ddl_basic_db1.ddl_t2  ADD COLUMN c1 int;
ob1.oblog.next;
[R0] record_type:EDDL;[R0] db_name:cdc_mysql.ddl_basic_db1;[R0] table_name:;[R0] column_count:1;[R0] column_name:ddl;[R0] ddl_stmt_str: alter table ddl_basic_db1.ddl_t2  ADD COLUMN c1 int;[R0] ddl_stmt_len: 51;
alter table ddl_basic_db1.ddl_t2  ADD COLUMN c2 int;
ob1.oblog.next;
[R0] record_type:EDDL;[R0] db_name:cdc_mysql.ddl_basic_db1;[R0] table_name:;[R0] column_count:1;[R0] column_name:ddl;[R0] ddl_stmt_str: alter table ddl_basic_db1.ddl_t2  ADD COLUMN c2 int;[R0] ddl_stmt_len: 51;
alter table ddl_basic_db1.ddl_t2 drop COLUMN c2;
ob1.oblog.next;
[R0] record_type:EDDL;[R0] db_name:cdc_mysql.ddl_basic_db1;[R0] table_name:;[R0] column_count:1;[R0] column_name:ddl;[R0] ddl_stmt_str: alter table ddl_basic_db1.ddl_t2 drop COLUMN c2;[R0] ddl_stmt_len: 47;
alter table ddl_basic_db1.ddl_t2  RENAME to ddl_t200;
ob1.oblog.next;
[R0] record_type:EDDL;[R0] db_name:cdc_mysql.ddl_basic_db1;[R0] table_name:;[R0] column_count:1;[R0] column_name:ddl;[R0] ddl_stmt_str: alter table ddl_basic_db1.ddl_t2  RENAME to ddl_t200;[R0] ddl_stmt_len: 52;
RENAME table ddl_basic_db1.ddl_t200 to ddl_t300;
ob1.oblog.next;
[R0] record_type:EDDL;[R0] db_name:cdc_mysql.ddl_basic_db1;[R0] table_name:;[R0] column_count:1;[R0] column_name:ddl;[R0] ddl_stmt_str: RENAME TABLE `ddl_basic_db1`.`ddl_t200` TO `ddl_basic_db1`.`ddl_t300`;[R0] ddl_stmt_len: 69;
insert into ddl_basic_db1.ddl_t300 VALUE(1, 1);
ob1.oblog.next;
[R0] BEGIN;[R0] org_cluster_id:1;[R1] record_type:INSERT;[R1] database_name:cdc_mysql.ddl_basic_db1;[R1] table_name:ddl_t300;[R1] log_event:true;[R1] column_count:2;[R1] source_category:SRC_FULL_RECORDED;[R1] source_type:SRC_OCEANBASE_1_0;[R1] has_pk:true;[R1] pk_info:(0);[R1] pks:pk;[R1] has_uk:false;[R1] uk_info:(null);[R1] uks:(null);[R1] [C1] column_name:pk;[R1] [C1] column_type:MYSQL_TYPE_LONG;[R1] [C1] column_is_rowkey:true;[R1] [C1] column_is_signed:true;[R1] [C1] column_encoding:binary;[R1] [C1] column_is_not_null:true;[R1] [C1] column_value_new:[1](1);[R1] [C2] column_name:c1;[R1] [C2] column_type:MYSQL_TYPE_LONG;[R1] [C2] column_is_rowkey:false;[R1] [C2] column_is_signed:true;[R1] [C2] column_encoding:binary;[R1] [C2] column_is_not_null:false;[R1] [C2] column_value_new:[1](1);$[R2] COMMIT;
create database dml_basic_db1;
ob1.oblog.next;
[R0] record_type:EDDL;[R0] db_name:cdc_mysql;[R0] table_name:;[R0] column_count:1;[R0] column_name:ddl;[R0] ddl_stmt_str: create database dml_basic_db1;[R0] ddl_stmt_len: 29;
use dml_basic_db1;
create table t_dml (id int primary key auto_increment, col1 varchar(10), col2 decimal(10,2));
ob1.oblog.next;
[R0] record_type:EDDL;[R0] db_name:cdc_mysql.dml_basic_db1;[R0] table_name:;[R0] column_count:1;[R0] column_name:ddl;[R0] ddl_stmt_str: create table t_dml (id int primary key auto_increment, col1 varchar(10), col2 decimal(10,2));[R0] ddl_stmt_len: 92;
insert into t_dml(col1, col2) values ('aaaaa', 9.15);
ob1.oblog.next;
[R0] BEGIN;[R0] org_cluster_id:1;[R1] record_type:INSERT;[R1] database_name:cdc_mysql.dml_basic_db1;[R1] table_name:t_dml;[R1] log_event:true;[R1] column_count:3;[R1] source_category:SRC_FULL_RECORDED;[R1] source_type:SRC_OCEANBASE_1_0;[R1] has_pk:true;[R1] pk_info:(0);[R1] pks:id;[R1] has_uk:false;[R1] uk_info:(null);[R1] uks:(null);[R1] [C1] column_name:id;[R1] [C1] column_type:MYSQL_TYPE_LONG;[R1] [C1] column_is_rowkey:true;[R1] [C1] column_is_signed:true;[R1] [C1] column_encoding:binary;[R1] [C1] column_is_not_null:true;[R1] [C1] column_value_new:[1](1);[R1] [C2] column_name:col1;[R1] [C2] column_type:MYSQL_TYPE_VAR_STRING;[R1] [C2] column_is_rowkey:false;[R1] [C2] column_is_signed:true;[R1] [C2] column_encoding:utf8mb4;[R1] [C2] column_is_not_null:false;[R1] [C2] column_value_new:[aaaaa](5);[R1] [C3] column_name:col2;[R1] [C3] column_type:MYSQL_TYPE_NEWDECIMAL;[R1] [C3] column_is_rowkey:false;[R1] [C3] column_is_signed:true;[R1] [C3] column_encoding:binary;[R1] [C3] column_is_not_null:false;[R1] [C3] column_value_new:[9.15](4);$[R2] COMMIT;
insert into t_dml(col1, col2) values ('bbbbb', 899.99);
ob1.oblog.next;
[R0] BEGIN;[R0] org_cluster_id:1;[R1] record_type:INSERT;[R1] database_name:cdc_mysql.dml_basic_db1;[R1] table_name:t_dml;[R1] log_event:true;[R1] column_count:3;[R1] source_category:SRC_FULL_RECORDED;[R1] source_type:SRC_OCEANBASE_1_0;[R1] has_pk:true;[R1] pk_info:(0);[R1] pks:id;[R1] has_uk:false;[R1] uk_info:(null);[R1] uks:(null);[R1] [C1] column_name:id;[R1] [C1] column_type:MYSQL_TYPE_LONG;[R1] [C1] column_is_rowkey:true;[R1] [C1] column_is_signed:true;[R1] [C1] column_encoding:binary;[R1] [C1] column_is_not_null:true;[R1] [C1] column_value_new:[2](1);[R1] [C2] column_name:col1;[R1] [C2] column_type:MYSQL_TYPE_VAR_STRING;[R1] [C2] column_is_rowkey:false;[R1] [C2] column_is_signed:true;[R1] [C2] column_encoding:utf8mb4;[R1] [C2] column_is_not_null:false;[R1] [C2] column_value_new:[bbbbb](5);[R1] [C3] column_name:col2;[R1] [C3] column_type:MYSQL_TYPE_NEWDECIMAL;[R1] [C3] column_is_rowkey:false;[R1] [C3] column_is_signed:true;[R1] [C3] column_encoding:binary;[R1] [C3] column_is_not_null:false;[R1] [C3] column_value_new:[899.99](6);$[R2] COMMIT;
begin;
insert into t_dml(col1, col2) values ('ccccc', 333.33);
update t_dml set col2=300 where col1='ccccc';
commit;
ob1.oblog.next;
[R0] BEGIN;[R0] org_cluster_id:1;[R1] record_type:INSERT;[R1] database_name:cdc_mysql.dml_basic_db1;[R1] table_name:t_dml;[R1] log_event:true;[R1] column_count:3;[R1] source_category:SRC_FULL_RECORDED;[R1] source_type:SRC_OCEANBASE_1_0;[R1] has_pk:true;[R1] pk_info:(0);[R1] pks:id;[R1] has_uk:false;[R1] uk_info:(null);[R1] uks:(null);[R1] [C1] column_name:id;[R1] [C1] column_type:MYSQL_TYPE_LONG;[R1] [C1] column_is_rowkey:true;[R1] [C1] column_is_signed:true;[R1] [C1] column_encoding:binary;[R1] [C1] column_is_not_null:true;[R1] [C1] column_value_new:[3](1);[R1] [C2] column_name:col1;[R1] [C2] column_type:MYSQL_TYPE_VAR_STRING;[R1] [C2] column_is_rowkey:false;[R1] [C2] column_is_signed:true;[R1] [C2] column_encoding:utf8mb4;[R1] [C2] column_is_not_null:false;[R1] [C2] column_value_new:[ccccc](5);[R1] [C3] column_name:col2;[R1] [C3] column_type:MYSQL_TYPE_NEWDECIMAL;[R1] [C3] column_is_rowkey:false;[R1] [C3] column_is_signed:true;[R1] [C3] column_encoding:binary;[R1] [C3] column_is_not_null:false;[R1] [C3] column_value_new:[333.33](6);$[R2] record_type:UPDATE;[R2] database_name:cdc_mysql.dml_basic_db1;[R2] table_name:t_dml;[R2] log_event:true;[R2] column_count:3;[R2] source_category:SRC_FULL_RECORDED;[R2] source_type:SRC_OCEANBASE_1_0;[R2] has_pk:true;[R2] pk_info:(0);[R2] pks:id;[R2] has_uk:false;[R2] uk_info:(null);[R2] uks:(null);[R2] [C1] column_name:id;[R2] [C1] column_type:MYSQL_TYPE_LONG;[R2] [C1] column_is_rowkey:true;[R2] [C1] column_is_signed:true;[R2] [C1] column_encoding:binary;[R2] [C1] column_is_not_null:true;[R2] [C1] column_value_new:[3](1);[R2] [C1] column_value_old:[3](1);[R2] [C2] column_name:col1;[R2] [C2] column_type:MYSQL_TYPE_VAR_STRING;[R2] [C2] column_is_rowkey:false;[R2] [C2] column_is_signed:true;[R2] [C2] column_encoding:utf8mb4;[R2] [C2] column_is_not_null:false;[R2] [C2] column_value_new:[ccccc](5);[R2] [C2] column_value_old:[ccccc](5);[R2] [C3] column_name:col2;[R2] [C3] column_type:MYSQL_TYPE_NEWDECIMAL;[R2] [C3] column_is_rowkey:false;[R2] [C3] column_is_signed:true;[R2] [C3] column_encoding:binary;[R2] [C3] column_is_not_null:false;[R2] [C3] column_value_new:[300.00](6);[R2] [C3] column_value_old:[333.33](6);$[R3] COMMIT;
delete from t_dml where col1='aaaaa';
ob1.oblog.next;
[R0] BEGIN;[R0] org_cluster_id:1;[R1] record_type:DELETE;[R1] database_name:cdc_mysql.dml_basic_db1;[R1] table_name:t_dml;[R1] log_event:true;[R1] column_count:3;[R1] source_category:SRC_FULL_RECORDED;[R1] source_type:SRC_OCEANBASE_1_0;[R1] has_pk:true;[R1] pk_info:(0);[R1] pks:id;[R1] has_uk:false;[R1] uk_info:(null);[R1] uks:(null);[R1] [C1] column_name:id;[R1] [C1] column_type:MYSQL_TYPE_LONG;[R1] [C1] column_is_rowkey:true;[R1] [C1] column_is_signed:true;[R1] [C1] column_encoding:binary;[R1] [C1] column_is_not_null:true;[R1] [C1] column_value_old:[1](1);[R1] [C2] column_name:col1;[R1] [C2] column_type:MYSQL_TYPE_VAR_STRING;[R1] [C2] column_is_rowkey:false;[R1] [C2] column_is_signed:true;[R1] [C2] column_encoding:utf8mb4;[R1] [C2] column_is_not_null:false;[R1] [C2] column_value_old:[aaaaa](5);[R1] [C3] column_name:col2;[R1] [C3] column_type:MYSQL_TYPE_NEWDECIMAL;[R1] [C3] column_is_rowkey:false;[R1] [C3] column_is_signed:true;[R1] [C3] column_encoding:binary;[R1] [C3] column_is_not_null:false;[R1] [C3] column_value_old:[9.15](4);$[R2] COMMIT;
ob1.oblog.stop;
ob1.oblog.gen_conf tb_white_list=oracle.*.* log_level=DEBUG;
ob1.oblog.restart;
create or replace procedure proc is begin null; end;
ob1.oblog.next;
[R0] record_type:EDDL;[R0] db_name:oracle.OBTEST;[R0] table_name:;[R0] column_count:1;[R0] column_name:ddl;[R0] ddl_stmt_str: create or replace procedure proc is begin null; end;[R0] ddl_stmt_len: 51;
drop procedure proc;
ob1.oblog.next;
[R0] record_type:EDDL;[R0] db_name:oracle.OBTEST;[R0] table_name:;[R0] column_count:1;[R0] column_name:ddl;[R0] ddl_stmt_str: drop procedure proc;[R0] ddl_stmt_len: 19;
create or replace function func return int is begin return 1; end;
ob1.oblog.next;
[R0] record_type:EDDL;[R0] db_name:oracle.OBTEST;[R0] table_name:;[R0] column_count:1;[R0] column_name:ddl;[R0] ddl_stmt_str: create or replace function func return int is begin return 1; end;[R0] ddl_stmt_len: 65;
drop function func;
ob1.oblog.next;
[R0] record_type:EDDL;[R0] db_name:oracle.OBTEST;[R0] table_name:;[R0] column_count:1;[R0] column_name:ddl;[R0] ddl_stmt_str: drop function func;[R0] ddl_stmt_len: 18;
create or replace package pack is x int; y char(1); procedure proc; end;
ob1.oblog.next;
[R0] record_type:EDDL;[R0] db_name:oracle.OBTEST;[R0] table_name:;[R0] column_count:1;[R0] column_name:ddl;[R0] ddl_stmt_str: create or replace package pack is x int; y char(1); procedure proc; end;[R0] ddl_stmt_len: 71;
drop package pack;
ob1.oblog.next;
[R0] record_type:EDDL;[R0] db_name:oracle.OBTEST;[R0] table_name:;[R0] column_count:1;[R0] column_name:ddl;[R0] ddl_stmt_str: drop package pack;[R0] ddl_stmt_len: 17;
create or replace package body pack is procedure proc is begin null; end; end;
ob1.oblog.next;
[R0] record_type:EDDL;[R0] db_name:oracle.OBTEST;[R0] table_name:;[R0] column_count:1;[R0] column_name:ddl;[R0] ddl_stmt_str: create or replace package body pack is procedure proc is begin null; end; end;[R0] ddl_stmt_len: 77;
drop package body pack;
ob1.oblog.next;
[R0] record_type:EDDL;[R0] db_name:oracle.OBTEST;[R0] table_name:;[R0] column_count:1;[R0] column_name:ddl;[R0] ddl_stmt_str: drop package body pack;[R0] ddl_stmt_len: 22;
create or replace package pack is x int; y char(1); procedure proc; end;
ob1.oblog.next;
[R0] record_type:EDDL;[R0] db_name:oracle.OBTEST;[R0] table_name:;[R0] column_count:1;[R0] column_name:ddl;[R0] ddl_stmt_str: create or replace package pack is x int; y char(1); procedure proc; end;[R0] ddl_stmt_len: 71;
create or replace package body pack is procedure proc is begin null; end; end;
ob1.oblog.next;
[R0] record_type:EDDL;[R0] db_name:oracle.OBTEST;[R0] table_name:;[R0] column_count:1;[R0] column_name:ddl;[R0] ddl_stmt_str: create or replace package body pack is procedure proc is begin null; end; end;[R0] ddl_stmt_len: 77;
drop package pack;
ob1.oblog.next;
[R0] record_type:EDDL;[R0] db_name:oracle.OBTEST;[R0] table_name:;[R0] column_count:1;[R0] column_name:ddl;[R0] ddl_stmt_str: drop package pack;[R0] ddl_stmt_len: 17;
create or replace type ty is table of int;
ob1.oblog.next;
[R0] record_type:EDDL;[R0] db_name:oracle.OBTEST;[R0] table_name:;[R0] column_count:1;[R0] column_name:ddl;[R0] ddl_stmt_str: create or replace type ty is table of int;[R0] ddl_stmt_len: 41;
drop type ty;
ob1.oblog.next;
[R0] record_type:EDDL;[R0] db_name:oracle.OBTEST;[R0] table_name:;[R0] column_count:1;[R0] column_name:ddl;[R0] ddl_stmt_str: drop type ty;[R0] ddl_stmt_len: 12;
create or replace type ty is object(col1 int, col2 int);
ob1.oblog.next;
[R0] record_type:EDDL;[R0] db_name:oracle.OBTEST;[R0] table_name:;[R0] column_count:1;[R0] column_name:ddl;[R0] ddl_stmt_str: create or replace type ty is object(col1 int, col2 int);[R0] ddl_stmt_len: 55;
drop type ty;
ob1.oblog.next;
[R0] record_type:EDDL;[R0] db_name:oracle.OBTEST;[R0] table_name:;[R0] column_count:1;[R0] column_name:ddl;[R0] ddl_stmt_str: drop type ty;[R0] ddl_stmt_len: 12;
create table t(col int);
ob1.oblog.next;
[R0] record_type:EDDL;[R0] db_name:oracle.OBTEST;[R0] table_name:;[R0] column_count:1;[R0] column_name:ddl;[R0] ddl_stmt_str: create table t(col int);[R0] ddl_stmt_len: 23;
begin insert into t values(1); insert into t values(2); update t set col = 3 where col = 1; end;
ob1.oblog.next;
[R0] BEGIN;[R0] org_cluster_id:1;[R1] record_type:INSERT;[R1] database_name:oracle.OBTEST;[R1] table_name:T;[R1] log_event:true;[R1] column_count:2;[R1] source_category:SRC_FULL_RECORDED;[R1] source_type:SRC_OCEANBASE_1_0;[R1] has_pk:true;[R1] pk_info:(0);[R1] pks:__pk_increment;[R1] has_uk:false;[R1] uk_info:(null);[R1] uks:(null);[R1] [C1] column_name:__pk_increment;[R1] [C1] column_type:MYSQL_TYPE_LONGLONG;[R1] [C1] column_is_rowkey:true;[R1] [C1] column_is_signed:false;[R1] [C1] column_encoding:binary;[R1] [C1] column_is_not_null:true;[R1] [C1] column_value_new:[1](1);[R1] [C2] column_name:COL;[R1] [C2] column_type:MYSQL_TYPE_NEWDECIMAL;[R1] [C2] column_is_rowkey:false;[R1] [C2] column_is_signed:true;[R1] [C2] column_encoding:binary;[R1] [C2] column_is_not_null:false;[R1] [C2] column_value_new:[1](1);$[R2] record_type:INSERT;[R2] database_name:oracle.OBTEST;[R2] table_name:T;[R2] log_event:true;[R2] column_count:2;[R2] source_category:SRC_FULL_RECORDED;[R2] source_type:SRC_OCEANBASE_1_0;[R2] has_pk:true;[R2] pk_info:(0);[R2] pks:__pk_increment;[R2] has_uk:false;[R2] uk_info:(null);[R2] uks:(null);[R2] [C1] column_name:__pk_increment;[R2] [C1] column_type:MYSQL_TYPE_LONGLONG;[R2] [C1] column_is_rowkey:true;[R2] [C1] column_is_signed:false;[R2] [C1] column_encoding:binary;[R2] [C1] column_is_not_null:true;[R2] [C1] column_value_new:[2](1);[R2] [C2] column_name:COL;[R2] [C2] column_type:MYSQL_TYPE_NEWDECIMAL;[R2] [C2] column_is_rowkey:false;[R2] [C2] column_is_signed:true;[R2] [C2] column_encoding:binary;[R2] [C2] column_is_not_null:false;[R2] [C2] column_value_new:[2](1);$[R3] record_type:UPDATE;[R3] database_name:oracle.OBTEST;[R3] table_name:T;[R3] log_event:true;[R3] column_count:2;[R3] source_category:SRC_FULL_RECORDED;[R3] source_type:SRC_OCEANBASE_1_0;[R3] has_pk:true;[R3] pk_info:(0);[R3] pks:__pk_increment;[R3] has_uk:false;[R3] uk_info:(null);[R3] uks:(null);[R3] [C1] column_name:__pk_increment;[R3] [C1] column_type:MYSQL_TYPE_LONGLONG;[R3] [C1] column_is_rowkey:true;[R3] [C1] column_is_signed:false;[R3] [C1] column_encoding:binary;[R3] [C1] column_is_not_null:true;[R3] [C1] column_value_new:[1](1);[R3] [C1] column_value_old:[1](1);[R3] [C2] column_name:COL;[R3] [C2] column_type:MYSQL_TYPE_NEWDECIMAL;[R3] [C2] column_is_rowkey:false;[R3] [C2] column_is_signed:true;[R3] [C2] column_encoding:binary;[R3] [C2] column_is_not_null:false;[R3] [C2] column_value_new:[3](1);[R3] [C2] column_value_old:[1](1);$[R4] COMMIT;
declare type t is table of int; x t; begin select col bulk collect into x from t; end;
create or replace procedure proc is begin delete from t; end;
ob1.oblog.next;
[R0] record_type:EDDL;[R0] db_name:oracle.OBTEST;[R0] table_name:;[R0] column_count:1;[R0] column_name:ddl;[R0] ddl_stmt_str: create or replace procedure proc is begin delete from t; end;[R0] ddl_stmt_len: 60;
call proc();
ob1.oblog.next;
[R0] BEGIN;[R0] org_cluster_id:1;[R1] record_type:DELETE;[R1] database_name:oracle.OBTEST;[R1] table_name:T;[R1] log_event:true;[R1] column_count:2;[R1] source_category:SRC_FULL_RECORDED;[R1] source_type:SRC_OCEANBASE_1_0;[R1] has_pk:true;[R1] pk_info:(0);[R1] pks:__pk_increment;[R1] has_uk:false;[R1] uk_info:(null);[R1] uks:(null);[R1] [C1] column_name:__pk_increment;[R1] [C1] column_type:MYSQL_TYPE_LONGLONG;[R1] [C1] column_is_rowkey:true;[R1] [C1] column_is_signed:false;[R1] [C1] column_encoding:binary;[R1] [C1] column_is_not_null:true;[R1] [C1] column_value_old:[1](1);[R1] [C2] column_name:COL;[R1] [C2] column_type:MYSQL_TYPE_NEWDECIMAL;[R1] [C2] column_is_rowkey:false;[R1] [C2] column_is_signed:true;[R1] [C2] column_encoding:binary;[R1] [C2] column_is_not_null:false;[R1] [C2] column_value_old:[3](1);$[R2] record_type:DELETE;[R2] database_name:oracle.OBTEST;[R2] table_name:T;[R2] log_event:true;[R2] column_count:2;[R2] source_category:SRC_FULL_RECORDED;[R2] source_type:SRC_OCEANBASE_1_0;[R2] has_pk:true;[R2] pk_info:(0);[R2] pks:__pk_increment;[R2] has_uk:false;[R2] uk_info:(null);[R2] uks:(null);[R2] [C1] column_name:__pk_increment;[R2] [C1] column_type:MYSQL_TYPE_LONGLONG;[R2] [C1] column_is_rowkey:true;[R2] [C1] column_is_signed:false;[R2] [C1] column_encoding:binary;[R2] [C1] column_is_not_null:true;[R2] [C1] column_value_old:[2](1);[R2] [C2] column_name:COL;[R2] [C2] column_type:MYSQL_TYPE_NEWDECIMAL;[R2] [C2] column_is_rowkey:false;[R2] [C2] column_is_signed:true;[R2] [C2] column_encoding:binary;[R2] [C2] column_is_not_null:false;[R2] [C2] column_value_old:[2](1);$[R3] COMMIT;
drop procedure proc;
ob1.oblog.next;
[R0] record_type:EDDL;[R0] db_name:oracle.OBTEST;[R0] table_name:;[R0] column_count:1;[R0] column_name:ddl;[R0] ddl_stmt_str: drop procedure proc;[R0] ddl_stmt_len: 19;
create or replace package pack is procedure proc; end;
ob1.oblog.next;
[R0] record_type:EDDL;[R0] db_name:oracle.OBTEST;[R0] table_name:;[R0] column_count:1;[R0] column_name:ddl;[R0] ddl_stmt_str: create or replace package pack is procedure proc; end;[R0] ddl_stmt_len: 53;
create or replace package body pack is procedure proc is begin delete from t; end; end;
ob1.oblog.next;
[R0] record_type:EDDL;[R0] db_name:oracle.OBTEST;[R0] table_name:;[R0] column_count:1;[R0] column_name:ddl;[R0] ddl_stmt_str: create or replace package body pack is procedure proc is begin delete from t; end; end;[R0] ddl_stmt_len: 86;
insert into t values(1);
ob1.oblog.next;
[R0] BEGIN;[R0] org_cluster_id:1;[R1] record_type:INSERT;[R1] database_name:oracle.OBTEST;[R1] table_name:T;[R1] log_event:true;[R1] column_count:2;[R1] source_category:SRC_FULL_RECORDED;[R1] source_type:SRC_OCEANBASE_1_0;[R1] has_pk:true;[R1] pk_info:(0);[R1] pks:__pk_increment;[R1] has_uk:false;[R1] uk_info:(null);[R1] uks:(null);[R1] [C1] column_name:__pk_increment;[R1] [C1] column_type:MYSQL_TYPE_LONGLONG;[R1] [C1] column_is_rowkey:true;[R1] [C1] column_is_signed:false;[R1] [C1] column_encoding:binary;[R1] [C1] column_is_not_null:true;[R1] [C1] column_value_new:[3](1);[R1] [C2] column_name:COL;[R1] [C2] column_type:MYSQL_TYPE_NEWDECIMAL;[R1] [C2] column_is_rowkey:false;[R1] [C2] column_is_signed:true;[R1] [C2] column_encoding:binary;[R1] [C2] column_is_not_null:false;[R1] [C2] column_value_new:[1](1);$[R2] COMMIT;
call pack.proc();
ob1.oblog.next;
[R0] BEGIN;[R0] org_cluster_id:1;[R1] record_type:DELETE;[R1] database_name:oracle.OBTEST;[R1] table_name:T;[R1] log_event:true;[R1] column_count:2;[R1] source_category:SRC_FULL_RECORDED;[R1] source_type:SRC_OCEANBASE_1_0;[R1] has_pk:true;[R1] pk_info:(0);[R1] pks:__pk_increment;[R1] has_uk:false;[R1] uk_info:(null);[R1] uks:(null);[R1] [C1] column_name:__pk_increment;[R1] [C1] column_type:MYSQL_TYPE_LONGLONG;[R1] [C1] column_is_rowkey:true;[R1] [C1] column_is_signed:false;[R1] [C1] column_encoding:binary;[R1] [C1] column_is_not_null:true;[R1] [C1] column_value_old:[3](1);[R1] [C2] column_name:COL;[R1] [C2] column_type:MYSQL_TYPE_NEWDECIMAL;[R1] [C2] column_is_rowkey:false;[R1] [C2] column_is_signed:true;[R1] [C2] column_encoding:binary;[R1] [C2] column_is_not_null:false;[R1] [C2] column_value_old:[1](1);$[R2] COMMIT;
drop package pack;
ob1.oblog.next;
[R0] record_type:EDDL;[R0] db_name:oracle.OBTEST;[R0] table_name:;[R0] column_count:1;[R0] column_name:ddl;[R0] ddl_stmt_str: drop package pack;[R0] ddl_stmt_len: 17;
begin execute immediate 'drop table t;'; end;
ob1.oblog.next;
[R0] record_type:EDDL;[R0] db_name:oracle.OBTEST;[R0] table_name:;[R0] column_count:1;[R0] column_name:ddl;[R0] ddl_stmt_str: DROP TABLE "OBTEST"."T";[R0] ddl_stmt_len: 23;
begin execute immediate 'create table t(col int)'; execute immediate 'insert into t values(1)'; end;
ob1.oblog.next;
[R0] record_type:EDDL;[R0] db_name:oracle.OBTEST;[R0] table_name:;[R0] column_count:1;[R0] column_name:ddl;[R0] ddl_stmt_str: create table t(col int);[R0] ddl_stmt_len: 23;
ob1.oblog.next;
[R0] BEGIN;[R0] org_cluster_id:1;[R1] record_type:INSERT;[R1] database_name:oracle.OBTEST;[R1] table_name:T;[R1] log_event:true;[R1] column_count:2;[R1] source_category:SRC_FULL_RECORDED;[R1] source_type:SRC_OCEANBASE_1_0;[R1] has_pk:true;[R1] pk_info:(0);[R1] pks:__pk_increment;[R1] has_uk:false;[R1] uk_info:(null);[R1] uks:(null);[R1] [C1] column_name:__pk_increment;[R1] [C1] column_type:MYSQL_TYPE_LONGLONG;[R1] [C1] column_is_rowkey:true;[R1] [C1] column_is_signed:false;[R1] [C1] column_encoding:binary;[R1] [C1] column_is_not_null:true;[R1] [C1] column_value_new:[1](1);[R1] [C2] column_name:COL;[R1] [C2] column_type:MYSQL_TYPE_NEWDECIMAL;[R1] [C2] column_is_rowkey:false;[R1] [C2] column_is_signed:true;[R1] [C2] column_encoding:binary;[R1] [C2] column_is_not_null:false;[R1] [C2] column_value_new:[1](1);$[R2] COMMIT;
drop table t;
ob1.oblog.next;
[R0] record_type:EDDL;[R0] db_name:oracle.OBTEST;[R0] table_name:;[R0] column_count:1;[R0] column_name:ddl;[R0] ddl_stmt_str: DROP TABLE "OBTEST"."T";[R0] ddl_stmt_len: 23;
create user oblog_db identified by "passwd";
ob1.oblog.next;
[R0] record_type:EDDL;[R0] db_name:oracle;[R0] table_name:;[R0] column_count:1;[R0] column_name:ddl;[R0] ddl_stmt_str: CREATE USER  "OBLOG_DB" IDENTIFIED BY VALUES "*59c70da2f3e3a5bdf46b68f5c8b8f25762bccef0";[R0] ddl_stmt_len: 88;
alter session set current_schema = oblog_db;
create table basic_1(c0 int primary key, c1 number, c2 varchar(10));
ob1.oblog.next;
[R0] record_type:EDDL;[R0] db_name:oracle.OBLOG_DB;[R0] table_name:;[R0] column_count:1;[R0] column_name:ddl;[R0] ddl_stmt_str: create table basic_1(c0 int primary key, c1 number, c2 varchar(10));[R0] ddl_stmt_len: 67;
insert into basic_1 values (1, 1.1, 'aaaa');
select c0, c1, c2 from basic_1;
C0	C1	C2
1	1.1	aaaa
ob1.oblog.next;
[R0] BEGIN;[R0] org_cluster_id:1;[R1] record_type:INSERT;[R1] database_name:oracle.OBLOG_DB;[R1] table_name:BASIC_1;[R1] log_event:true;[R1] column_count:3;[R1] source_category:SRC_FULL_RECORDED;[R1] source_type:SRC_OCEANBASE_1_0;[R1] has_pk:true;[R1] pk_info:(0);[R1] pks:C0;[R1] has_uk:false;[R1] uk_info:(null);[R1] uks:(null);[R1] [C1] column_name:C0;[R1] [C1] column_type:MYSQL_TYPE_NEWDECIMAL;[R1] [C1] column_is_rowkey:true;[R1] [C1] column_is_signed:true;[R1] [C1] column_encoding:binary;[R1] [C1] column_is_not_null:true;[R1] [C1] column_value_new:[1](1);[R1] [C2] column_name:C1;[R1] [C2] column_type:MYSQL_TYPE_NEWDECIMAL;[R1] [C2] column_is_rowkey:false;[R1] [C2] column_is_signed:true;[R1] [C2] column_encoding:binary;[R1] [C2] column_is_not_null:false;[R1] [C2] column_value_new:[1.1](3);[R1] [C3] column_name:C2;[R1] [C3] column_type:MYSQL_TYPE_VAR_STRING;[R1] [C3] column_is_rowkey:false;[R1] [C3] column_is_signed:true;[R1] [C3] column_encoding:utf8mb4;[R1] [C3] column_is_not_null:false;[R1] [C3] column_value_new:[aaaa](4);$[R2] COMMIT;
insert into basic_1 values (2, 2.22, 'bbbbbbbbbb');
select c0, c1, c2 from basic_1;
C0	C1	C2
1	1.1	aaaa
2	2.22	bbbbbbbbbb
ob1.oblog.next;
[R0] BEGIN;[R0] org_cluster_id:1;[R1] record_type:INSERT;[R1] database_name:oracle.OBLOG_DB;[R1] table_name:BASIC_1;[R1] log_event:true;[R1] column_count:3;[R1] source_category:SRC_FULL_RECORDED;[R1] source_type:SRC_OCEANBASE_1_0;[R1] has_pk:true;[R1] pk_info:(0);[R1] pks:C0;[R1] has_uk:false;[R1] uk_info:(null);[R1] uks:(null);[R1] [C1] column_name:C0;[R1] [C1] column_type:MYSQL_TYPE_NEWDECIMAL;[R1] [C1] column_is_rowkey:true;[R1] [C1] column_is_signed:true;[R1] [C1] column_encoding:binary;[R1] [C1] column_is_not_null:true;[R1] [C1] column_value_new:[2](1);[R1] [C2] column_name:C1;[R1] [C2] column_type:MYSQL_TYPE_NEWDECIMAL;[R1] [C2] column_is_rowkey:false;[R1] [C2] column_is_signed:true;[R1] [C2] column_encoding:binary;[R1] [C2] column_is_not_null:false;[R1] [C2] column_value_new:[2.22](4);[R1] [C3] column_name:C2;[R1] [C3] column_type:MYSQL_TYPE_VAR_STRING;[R1] [C3] column_is_rowkey:false;[R1] [C3] column_is_signed:true;[R1] [C3] column_encoding:utf8mb4;[R1] [C3] column_is_not_null:false;[R1] [C3] column_value_new:[bbbbbbbbbb](10);$[R2] COMMIT;
update basic_1 set c1=2.2 where c0=2;
select c0, c1, c2 from basic_1;
C0	C1	C2
1	1.1	aaaa
2	2.2	bbbbbbbbbb
ob1.oblog.next;
[R0] BEGIN;[R0] org_cluster_id:1;[R1] record_type:UPDATE;[R1] database_name:oracle.OBLOG_DB;[R1] table_name:BASIC_1;[R1] log_event:true;[R1] column_count:3;[R1] source_category:SRC_FULL_RECORDED;[R1] source_type:SRC_OCEANBASE_1_0;[R1] has_pk:true;[R1] pk_info:(0);[R1] pks:C0;[R1] has_uk:false;[R1] uk_info:(null);[R1] uks:(null);[R1] [C1] column_name:C0;[R1] [C1] column_type:MYSQL_TYPE_NEWDECIMAL;[R1] [C1] column_is_rowkey:true;[R1] [C1] column_is_signed:true;[R1] [C1] column_encoding:binary;[R1] [C1] column_is_not_null:true;[R1] [C1] column_value_new:[2](1);[R1] [C1] column_value_old:[2](1);[R1] [C2] column_name:C1;[R1] [C2] column_type:MYSQL_TYPE_NEWDECIMAL;[R1] [C2] column_is_rowkey:false;[R1] [C2] column_is_signed:true;[R1] [C2] column_encoding:binary;[R1] [C2] column_is_not_null:false;[R1] [C2] column_value_new:[2.2](3);[R1] [C2] column_value_old:[2.22](4);[R1] [C3] column_name:C2;[R1] [C3] column_type:MYSQL_TYPE_VAR_STRING;[R1] [C3] column_is_rowkey:false;[R1] [C3] column_is_signed:true;[R1] [C3] column_encoding:utf8mb4;[R1] [C3] column_is_not_null:false;[R1] [C3] column_value_new:[bbbbbbbbbb](10);[R1] [C3] column_value_old:[bbbbbbbbbb](10);$[R2] COMMIT;
delete from basic_1;
select c0, c1, c2 from basic_1;
C0	C1	C2
ob1.oblog.next;
[R0] BEGIN;[R0] org_cluster_id:1;[R1] record_type:DELETE;[R1] database_name:oracle.OBLOG_DB;[R1] table_name:BASIC_1;[R1] log_event:true;[R1] column_count:3;[R1] source_category:SRC_FULL_RECORDED;[R1] source_type:SRC_OCEANBASE_1_0;[R1] has_pk:true;[R1] pk_info:(0);[R1] pks:C0;[R1] has_uk:false;[R1] uk_info:(null);[R1] uks:(null);[R1] [C1] column_name:C0;[R1] [C1] column_type:MYSQL_TYPE_NEWDECIMAL;[R1] [C1] column_is_rowkey:true;[R1] [C1] column_is_signed:true;[R1] [C1] column_encoding:binary;[R1] [C1] column_is_not_null:true;[R1] [C1] column_value_old:[1](1);[R1] [C2] column_name:C1;[R1] [C2] column_type:MYSQL_TYPE_NEWDECIMAL;[R1] [C2] column_is_rowkey:false;[R1] [C2] column_is_signed:true;[R1] [C2] column_encoding:binary;[R1] [C2] column_is_not_null:false;[R1] [C2] column_value_old:[1.1](3);[R1] [C3] column_name:C2;[R1] [C3] column_type:MYSQL_TYPE_VAR_STRING;[R1] [C3] column_is_rowkey:false;[R1] [C3] column_is_signed:true;[R1] [C3] column_encoding:utf8mb4;[R1] [C3] column_is_not_null:false;[R1] [C3] column_value_old:[aaaa](4);$[R2] record_type:DELETE;[R2] database_name:oracle.OBLOG_DB;[R2] table_name:BASIC_1;[R2] log_event:true;[R2] column_count:3;[R2] source_category:SRC_FULL_RECORDED;[R2] source_type:SRC_OCEANBASE_1_0;[R2] has_pk:true;[R2] pk_info:(0);[R2] pks:C0;[R2] has_uk:false;[R2] uk_info:(null);[R2] uks:(null);[R2] [C1] column_name:C0;[R2] [C1] column_type:MYSQL_TYPE_NEWDECIMAL;[R2] [C1] column_is_rowkey:true;[R2] [C1] column_is_signed:true;[R2] [C1] column_encoding:binary;[R2] [C1] column_is_not_null:true;[R2] [C1] column_value_old:[2](1);[R2] [C2] column_name:C1;[R2] [C2] column_type:MYSQL_TYPE_NEWDECIMAL;[R2] [C2] column_is_rowkey:false;[R2] [C2] column_is_signed:true;[R2] [C2] column_encoding:binary;[R2] [C2] column_is_not_null:false;[R2] [C2] column_value_old:[2.2](3);[R2] [C3] column_name:C2;[R2] [C3] column_type:MYSQL_TYPE_VAR_STRING;[R2] [C3] column_is_rowkey:false;[R2] [C3] column_is_signed:true;[R2] [C3] column_encoding:utf8mb4;[R2] [C3] column_is_not_null:false;[R2] [C3] column_value_old:[bbbbbbbbbb](10);$[R3] COMMIT;
ob1.oblog.stop;
alter tenant cdc_mysql set variables max_allowed_packet=1073741824;
set ob_trx_timeout=100000000;
set ob_query_timeout=100000000;
create database lob_basic_db1;
use lob_basic_db1;
create table lob_basic_1(pk int primary key, tiny_text tinytext, tiny_blob tinyblob, text_type text, blob_type blob, medium_text mediumtext, medium_blob mediumblob, long_text longtext, long_blob longblob);
ob1.oblog.set_extra_argument -m;
ob1.oblog.gen_conf tb_white_list=sys.oblog*.*|cdc_mysql.*.*|oracle.*.* log_level=DEBUG;
ob1.oblog.restart;
insert into lob_basic_1 values (1, "", "", "", "", "", "", repeat('a', 50331647), "");
select md5(long_text), md5(long_blob)  from lob_basic_1 where pk = 1;
md5(long_text)	md5(long_blob)
c57d4c3741dc0eb85d767497f9736503	d41d8cd98f00b204e9800998ecf8427e
ob1.oblog.next_dml;
[R0] BEGIN;[R0] org_cluster_id:1;[R1] record_type:INSERT;[R1] database_name:cdc_mysql.lob_basic_db1;[R1] table_name:lob_basic_1;[R1] log_event:true;[R1] column_count:9;[R1] source_category:SRC_FULL_RECORDED;[R1] source_type:SRC_OCEANBASE_1_0;[R1] has_pk:true;[R1] pk_info:(0);[R1] pks:pk;[R1] has_uk:false;[R1] uk_info:(null);[R1] uks:(null);[R1] [C1] column_name:pk;[R1] [C1] column_type:MYSQL_TYPE_LONG;[R1] [C1] column_is_rowkey:true;[R1] [C1] column_is_signed:true;[R1] [C1] column_encoding:binary;[R1] [C1] column_is_not_null:true;[R1] [C1] column_value_new:[1](1);[R1] [C2] column_name:tiny_text;[R1] [C2] column_type:MYSQL_TYPE_TINY_BLOB;[R1] [C2] column_is_rowkey:false;[R1] [C2] column_is_signed:true;[R1] [C2] column_encoding:utf8mb4;[R1] [C2] column_is_not_null:false;[R1] [C2] column_value_new_md5:[d41d8cd98f00b204e9800998ecf8427e](0);[R1] [C3] column_name:tiny_blob;[R1] [C3] column_type:MYSQL_TYPE_TINY_BLOB;[R1] [C3] column_is_rowkey:false;[R1] [C3] column_is_signed:true;[R1] [C3] column_encoding:binary;[R1] [C3] column_is_not_null:false;[R1] [C3] column_value_new_md5:[d41d8cd98f00b204e9800998ecf8427e](0);[R1] [C4] column_name:text_type;[R1] [C4] column_type:MYSQL_TYPE_BLOB;[R1] [C4] column_is_rowkey:false;[R1] [C4] column_is_signed:true;[R1] [C4] column_encoding:utf8mb4;[R1] [C4] column_is_not_null:false;[R1] [C4] column_value_new_md5:[d41d8cd98f00b204e9800998ecf8427e](0);[R1] [C5] column_name:blob_type;[R1] [C5] column_type:MYSQL_TYPE_BLOB;[R1] [C5] column_is_rowkey:false;[R1] [C5] column_is_signed:true;[R1] [C5] column_encoding:binary;[R1] [C5] column_is_not_null:false;[R1] [C5] column_value_new_md5:[d41d8cd98f00b204e9800998ecf8427e](0);[R1] [C6] column_name:medium_text;[R1] [C6] column_type:MYSQL_TYPE_MEDIUM_BLOB;[R1] [C6] column_is_rowkey:false;[R1] [C6] column_is_signed:true;[R1] [C6] column_encoding:utf8mb4;[R1] [C6] column_is_not_null:false;[R1] [C6] column_value_new_md5:[d41d8cd98f00b204e9800998ecf8427e](0);[R1] [C7] column_name:medium_blob;[R1] [C7] column_type:MYSQL_TYPE_MEDIUM_BLOB;[R1] [C7] column_is_rowkey:false;[R1] [C7] column_is_signed:true;[R1] [C7] column_encoding:binary;[R1] [C7] column_is_not_null:false;[R1] [C7] column_value_new_md5:[d41d8cd98f00b204e9800998ecf8427e](0);[R1] [C8] column_name:long_text;[R1] [C8] column_type:MYSQL_TYPE_LONG_BLOB;[R1] [C8] column_is_rowkey:false;[R1] [C8] column_is_signed:true;[R1] [C8] column_encoding:utf8mb4;[R1] [C8] column_is_not_null:false;[R1] [C8] column_value_new_md5:[c57d4c3741dc0eb85d767497f9736503](50331647);[R1] [C9] column_name:long_blob;[R1] [C9] column_type:MYSQL_TYPE_LONG_BLOB;[R1] [C9] column_is_rowkey:false;[R1] [C9] column_is_signed:true;[R1] [C9] column_encoding:binary;[R1] [C9] column_is_not_null:false;[R1] [C9] column_value_new_md5:[d41d8cd98f00b204e9800998ecf8427e](0);$[R2] COMMIT;
insert into lob_basic_1 values (2, "", "", "", "", "", "", repeat('b', 50331647), "");
select md5(long_text), md5(long_blob)  from lob_basic_1 where pk = 2;
md5(long_text)	md5(long_blob)
2382bbd355b1c0377240e1d1f79b6081	d41d8cd98f00b204e9800998ecf8427e
ob1.oblog.next_dml;
[R0] BEGIN;[R0] org_cluster_id:1;[R1] record_type:INSERT;[R1] database_name:cdc_mysql.lob_basic_db1;[R1] table_name:lob_basic_1;[R1] log_event:true;[R1] column_count:9;[R1] source_category:SRC_FULL_RECORDED;[R1] source_type:SRC_OCEANBASE_1_0;[R1] has_pk:true;[R1] pk_info:(0);[R1] pks:pk;[R1] has_uk:false;[R1] uk_info:(null);[R1] uks:(null);[R1] [C1] column_name:pk;[R1] [C1] column_type:MYSQL_TYPE_LONG;[R1] [C1] column_is_rowkey:true;[R1] [C1] column_is_signed:true;[R1] [C1] column_encoding:binary;[R1] [C1] column_is_not_null:true;[R1] [C1] column_value_new:[2](1);[R1] [C2] column_name:tiny_text;[R1] [C2] column_type:MYSQL_TYPE_TINY_BLOB;[R1] [C2] column_is_rowkey:false;[R1] [C2] column_is_signed:true;[R1] [C2] column_encoding:utf8mb4;[R1] [C2] column_is_not_null:false;[R1] [C2] column_value_new_md5:[d41d8cd98f00b204e9800998ecf8427e](0);[R1] [C3] column_name:tiny_blob;[R1] [C3] column_type:MYSQL_TYPE_TINY_BLOB;[R1] [C3] column_is_rowkey:false;[R1] [C3] column_is_signed:true;[R1] [C3] column_encoding:binary;[R1] [C3] column_is_not_null:false;[R1] [C3] column_value_new_md5:[d41d8cd98f00b204e9800998ecf8427e](0);[R1] [C4] column_name:text_type;[R1] [C4] column_type:MYSQL_TYPE_BLOB;[R1] [C4] column_is_rowkey:false;[R1] [C4] column_is_signed:true;[R1] [C4] column_encoding:utf8mb4;[R1] [C4] column_is_not_null:false;[R1] [C4] column_value_new_md5:[d41d8cd98f00b204e9800998ecf8427e](0);[R1] [C5] column_name:blob_type;[R1] [C5] column_type:MYSQL_TYPE_BLOB;[R1] [C5] column_is_rowkey:false;[R1] [C5] column_is_signed:true;[R1] [C5] column_encoding:binary;[R1] [C5] column_is_not_null:false;[R1] [C5] column_value_new_md5:[d41d8cd98f00b204e9800998ecf8427e](0);[R1] [C6] column_name:medium_text;[R1] [C6] column_type:MYSQL_TYPE_MEDIUM_BLOB;[R1] [C6] column_is_rowkey:false;[R1] [C6] column_is_signed:true;[R1] [C6] column_encoding:utf8mb4;[R1] [C6] column_is_not_null:false;[R1] [C6] column_value_new_md5:[d41d8cd98f00b204e9800998ecf8427e](0);[R1] [C7] column_name:medium_blob;[R1] [C7] column_type:MYSQL_TYPE_MEDIUM_BLOB;[R1] [C7] column_is_rowkey:false;[R1] [C7] column_is_signed:true;[R1] [C7] column_encoding:binary;[R1] [C7] column_is_not_null:false;[R1] [C7] column_value_new_md5:[d41d8cd98f00b204e9800998ecf8427e](0);[R1] [C8] column_name:long_text;[R1] [C8] column_type:MYSQL_TYPE_LONG_BLOB;[R1] [C8] column_is_rowkey:false;[R1] [C8] column_is_signed:true;[R1] [C8] column_encoding:utf8mb4;[R1] [C8] column_is_not_null:false;[R1] [C8] column_value_new_md5:[2382bbd355b1c0377240e1d1f79b6081](50331647);[R1] [C9] column_name:long_blob;[R1] [C9] column_type:MYSQL_TYPE_LONG_BLOB;[R1] [C9] column_is_rowkey:false;[R1] [C9] column_is_signed:true;[R1] [C9] column_encoding:binary;[R1] [C9] column_is_not_null:false;[R1] [C9] column_value_new_md5:[d41d8cd98f00b204e9800998ecf8427e](0);$[R2] COMMIT;
insert into lob_basic_1 values (3, "", "", "", "", "", "", repeat('a', 50331647), repeat('b', 50331647));
select md5(long_text), md5(long_blob)  from lob_basic_1 where pk = 3;
md5(long_text)	md5(long_blob)
c57d4c3741dc0eb85d767497f9736503	2382bbd355b1c0377240e1d1f79b6081
ob1.oblog.next_dml;
[R0] BEGIN;[R0] org_cluster_id:1;[R1] record_type:INSERT;[R1] database_name:cdc_mysql.lob_basic_db1;[R1] table_name:lob_basic_1;[R1] log_event:true;[R1] column_count:9;[R1] source_category:SRC_FULL_RECORDED;[R1] source_type:SRC_OCEANBASE_1_0;[R1] has_pk:true;[R1] pk_info:(0);[R1] pks:pk;[R1] has_uk:false;[R1] uk_info:(null);[R1] uks:(null);[R1] [C1] column_name:pk;[R1] [C1] column_type:MYSQL_TYPE_LONG;[R1] [C1] column_is_rowkey:true;[R1] [C1] column_is_signed:true;[R1] [C1] column_encoding:binary;[R1] [C1] column_is_not_null:true;[R1] [C1] column_value_new:[3](1);[R1] [C2] column_name:tiny_text;[R1] [C2] column_type:MYSQL_TYPE_TINY_BLOB;[R1] [C2] column_is_rowkey:false;[R1] [C2] column_is_signed:true;[R1] [C2] column_encoding:utf8mb4;[R1] [C2] column_is_not_null:false;[R1] [C2] column_value_new_md5:[d41d8cd98f00b204e9800998ecf8427e](0);[R1] [C3] column_name:tiny_blob;[R1] [C3] column_type:MYSQL_TYPE_TINY_BLOB;[R1] [C3] column_is_rowkey:false;[R1] [C3] column_is_signed:true;[R1] [C3] column_encoding:binary;[R1] [C3] column_is_not_null:false;[R1] [C3] column_value_new_md5:[d41d8cd98f00b204e9800998ecf8427e](0);[R1] [C4] column_name:text_type;[R1] [C4] column_type:MYSQL_TYPE_BLOB;[R1] [C4] column_is_rowkey:false;[R1] [C4] column_is_signed:true;[R1] [C4] column_encoding:utf8mb4;[R1] [C4] column_is_not_null:false;[R1] [C4] column_value_new_md5:[d41d8cd98f00b204e9800998ecf8427e](0);[R1] [C5] column_name:blob_type;[R1] [C5] column_type:MYSQL_TYPE_BLOB;[R1] [C5] column_is_rowkey:false;[R1] [C5] column_is_signed:true;[R1] [C5] column_encoding:binary;[R1] [C5] column_is_not_null:false;[R1] [C5] column_value_new_md5:[d41d8cd98f00b204e9800998ecf8427e](0);[R1] [C6] column_name:medium_text;[R1] [C6] column_type:MYSQL_TYPE_MEDIUM_BLOB;[R1] [C6] column_is_rowkey:false;[R1] [C6] column_is_signed:true;[R1] [C6] column_encoding:utf8mb4;[R1] [C6] column_is_not_null:false;[R1] [C6] column_value_new_md5:[d41d8cd98f00b204e9800998ecf8427e](0);[R1] [C7] column_name:medium_blob;[R1] [C7] column_type:MYSQL_TYPE_MEDIUM_BLOB;[R1] [C7] column_is_rowkey:false;[R1] [C7] column_is_signed:true;[R1] [C7] column_encoding:binary;[R1] [C7] column_is_not_null:false;[R1] [C7] column_value_new_md5:[d41d8cd98f00b204e9800998ecf8427e](0);[R1] [C8] column_name:long_text;[R1] [C8] column_type:MYSQL_TYPE_LONG_BLOB;[R1] [C8] column_is_rowkey:false;[R1] [C8] column_is_signed:true;[R1] [C8] column_encoding:utf8mb4;[R1] [C8] column_is_not_null:false;[R1] [C8] column_value_new_md5:[c57d4c3741dc0eb85d767497f9736503](50331647);[R1] [C9] column_name:long_blob;[R1] [C9] column_type:MYSQL_TYPE_LONG_BLOB;[R1] [C9] column_is_rowkey:false;[R1] [C9] column_is_signed:true;[R1] [C9] column_encoding:binary;[R1] [C9] column_is_not_null:false;[R1] [C9] column_value_new_md5:[2382bbd355b1c0377240e1d1f79b6081](50331647);$[R2] COMMIT;
update lob_basic_1 set long_blob = repeat('d', 11534336) where pk = 3;
select md5(long_text), md5(long_blob)  from lob_basic_1 where pk = 3;
md5(long_text)	md5(long_blob)
c57d4c3741dc0eb85d767497f9736503	21ac45796075552d5e54ff8c8d45db78
ob1.oblog.next_dml;
[R0] BEGIN;[R0] org_cluster_id:1;[R1] record_type:UPDATE;[R1] database_name:cdc_mysql.lob_basic_db1;[R1] table_name:lob_basic_1;[R1] log_event:true;[R1] column_count:9;[R1] source_category:SRC_FULL_RECORDED;[R1] source_type:SRC_OCEANBASE_1_0;[R1] has_pk:true;[R1] pk_info:(0);[R1] pks:pk;[R1] has_uk:false;[R1] uk_info:(null);[R1] uks:(null);[R1] [C1] column_name:pk;[R1] [C1] column_type:MYSQL_TYPE_LONG;[R1] [C1] column_is_rowkey:true;[R1] [C1] column_is_signed:true;[R1] [C1] column_encoding:binary;[R1] [C1] column_is_not_null:true;[R1] [C1] column_value_new:[3](1);[R1] [C1] column_value_old:[3](1);[R1] [C2] column_name:tiny_text;[R1] [C2] column_type:MYSQL_TYPE_TINY_BLOB;[R1] [C2] column_is_rowkey:false;[R1] [C2] column_is_signed:true;[R1] [C2] column_encoding:utf8mb4;[R1] [C2] column_is_not_null:false;[R1] [C2] column_value_new_md5:[d41d8cd98f00b204e9800998ecf8427e](0);[R1] [C2] column_value_old_md5:[d41d8cd98f00b204e9800998ecf8427e](0);[R1] [C3] column_name:tiny_blob;[R1] [C3] column_type:MYSQL_TYPE_TINY_BLOB;[R1] [C3] column_is_rowkey:false;[R1] [C3] column_is_signed:true;[R1] [C3] column_encoding:binary;[R1] [C3] column_is_not_null:false;[R1] [C3] column_value_new_md5:[d41d8cd98f00b204e9800998ecf8427e](0);[R1] [C3] column_value_old_md5:[d41d8cd98f00b204e9800998ecf8427e](0);[R1] [C4] column_name:text_type;[R1] [C4] column_type:MYSQL_TYPE_BLOB;[R1] [C4] column_is_rowkey:false;[R1] [C4] column_is_signed:true;[R1] [C4] column_encoding:utf8mb4;[R1] [C4] column_is_not_null:false;[R1] [C4] column_value_new_md5:[d41d8cd98f00b204e9800998ecf8427e](0);[R1] [C4] column_value_old_md5:[d41d8cd98f00b204e9800998ecf8427e](0);[R1] [C5] column_name:blob_type;[R1] [C5] column_type:MYSQL_TYPE_BLOB;[R1] [C5] column_is_rowkey:false;[R1] [C5] column_is_signed:true;[R1] [C5] column_encoding:binary;[R1] [C5] column_is_not_null:false;[R1] [C5] column_value_new_md5:[d41d8cd98f00b204e9800998ecf8427e](0);[R1] [C5] column_value_old_md5:[d41d8cd98f00b204e9800998ecf8427e](0);[R1] [C6] column_name:medium_text;[R1] [C6] column_type:MYSQL_TYPE_MEDIUM_BLOB;[R1] [C6] column_is_rowkey:false;[R1] [C6] column_is_signed:true;[R1] [C6] column_encoding:utf8mb4;[R1] [C6] column_is_not_null:false;[R1] [C6] column_value_new_md5:[d41d8cd98f00b204e9800998ecf8427e](0);[R1] [C6] column_value_old_md5:[d41d8cd98f00b204e9800998ecf8427e](0);[R1] [C7] column_name:medium_blob;[R1] [C7] column_type:MYSQL_TYPE_MEDIUM_BLOB;[R1] [C7] column_is_rowkey:false;[R1] [C7] column_is_signed:true;[R1] [C7] column_encoding:binary;[R1] [C7] column_is_not_null:false;[R1] [C7] column_value_new_md5:[d41d8cd98f00b204e9800998ecf8427e](0);[R1] [C7] column_value_old_md5:[d41d8cd98f00b204e9800998ecf8427e](0);[R1] [C8] column_name:long_text;[R1] [C8] column_type:MYSQL_TYPE_LONG_BLOB;[R1] [C8] column_is_rowkey:false;[R1] [C8] column_is_signed:true;[R1] [C8] column_encoding:utf8mb4;[R1] [C8] column_is_not_null:false;[R1] [C8] column_value_new_origin: PADDING;[R1] [C8] column_value_new_md5:[NULL](0);[R1] [C8] column_value_old_origin: PADDING;[R1] [C8] column_value_old_md5:[NULL](0);[R1] [C9] column_name:long_blob;[R1] [C9] column_type:MYSQL_TYPE_LONG_BLOB;[R1] [C9] column_is_rowkey:false;[R1] [C9] column_is_signed:true;[R1] [C9] column_encoding:binary;[R1] [C9] column_is_not_null:false;[R1] [C9] column_value_new_md5:[21ac45796075552d5e54ff8c8d45db78](11534336);[R1] [C9] column_value_old_md5:[2382bbd355b1c0377240e1d1f79b6081](50331647);$[R2] COMMIT;
update lob_basic_1 set long_text= repeat('d', 11534336), long_blob = repeat('b', 11534336) where pk = 3;
select md5(long_text), md5(long_blob)  from lob_basic_1 where pk = 3;
md5(long_text)	md5(long_blob)
21ac45796075552d5e54ff8c8d45db78	2c935e46cfdb63ec4d3dc7c05351aa7f
ob1.oblog.next_dml;
[R0] BEGIN;[R0] org_cluster_id:1;[R1] record_type:UPDATE;[R1] database_name:cdc_mysql.lob_basic_db1;[R1] table_name:lob_basic_1;[R1] log_event:true;[R1] column_count:9;[R1] source_category:SRC_FULL_RECORDED;[R1] source_type:SRC_OCEANBASE_1_0;[R1] has_pk:true;[R1] pk_info:(0);[R1] pks:pk;[R1] has_uk:false;[R1] uk_info:(null);[R1] uks:(null);[R1] [C1] column_name:pk;[R1] [C1] column_type:MYSQL_TYPE_LONG;[R1] [C1] column_is_rowkey:true;[R1] [C1] column_is_signed:true;[R1] [C1] column_encoding:binary;[R1] [C1] column_is_not_null:true;[R1] [C1] column_value_new:[3](1);[R1] [C1] column_value_old:[3](1);[R1] [C2] column_name:tiny_text;[R1] [C2] column_type:MYSQL_TYPE_TINY_BLOB;[R1] [C2] column_is_rowkey:false;[R1] [C2] column_is_signed:true;[R1] [C2] column_encoding:utf8mb4;[R1] [C2] column_is_not_null:false;[R1] [C2] column_value_new_md5:[d41d8cd98f00b204e9800998ecf8427e](0);[R1] [C2] column_value_old_md5:[d41d8cd98f00b204e9800998ecf8427e](0);[R1] [C3] column_name:tiny_blob;[R1] [C3] column_type:MYSQL_TYPE_TINY_BLOB;[R1] [C3] column_is_rowkey:false;[R1] [C3] column_is_signed:true;[R1] [C3] column_encoding:binary;[R1] [C3] column_is_not_null:false;[R1] [C3] column_value_new_md5:[d41d8cd98f00b204e9800998ecf8427e](0);[R1] [C3] column_value_old_md5:[d41d8cd98f00b204e9800998ecf8427e](0);[R1] [C4] column_name:text_type;[R1] [C4] column_type:MYSQL_TYPE_BLOB;[R1] [C4] column_is_rowkey:false;[R1] [C4] column_is_signed:true;[R1] [C4] column_encoding:utf8mb4;[R1] [C4] column_is_not_null:false;[R1] [C4] column_value_new_md5:[d41d8cd98f00b204e9800998ecf8427e](0);[R1] [C4] column_value_old_md5:[d41d8cd98f00b204e9800998ecf8427e](0);[R1] [C5] column_name:blob_type;[R1] [C5] column_type:MYSQL_TYPE_BLOB;[R1] [C5] column_is_rowkey:false;[R1] [C5] column_is_signed:true;[R1] [C5] column_encoding:binary;[R1] [C5] column_is_not_null:false;[R1] [C5] column_value_new_md5:[d41d8cd98f00b204e9800998ecf8427e](0);[R1] [C5] column_value_old_md5:[d41d8cd98f00b204e9800998ecf8427e](0);[R1] [C6] column_name:medium_text;[R1] [C6] column_type:MYSQL_TYPE_MEDIUM_BLOB;[R1] [C6] column_is_rowkey:false;[R1] [C6] column_is_signed:true;[R1] [C6] column_encoding:utf8mb4;[R1] [C6] column_is_not_null:false;[R1] [C6] column_value_new_md5:[d41d8cd98f00b204e9800998ecf8427e](0);[R1] [C6] column_value_old_md5:[d41d8cd98f00b204e9800998ecf8427e](0);[R1] [C7] column_name:medium_blob;[R1] [C7] column_type:MYSQL_TYPE_MEDIUM_BLOB;[R1] [C7] column_is_rowkey:false;[R1] [C7] column_is_signed:true;[R1] [C7] column_encoding:binary;[R1] [C7] column_is_not_null:false;[R1] [C7] column_value_new_md5:[d41d8cd98f00b204e9800998ecf8427e](0);[R1] [C7] column_value_old_md5:[d41d8cd98f00b204e9800998ecf8427e](0);[R1] [C8] column_name:long_text;[R1] [C8] column_type:MYSQL_TYPE_LONG_BLOB;[R1] [C8] column_is_rowkey:false;[R1] [C8] column_is_signed:true;[R1] [C8] column_encoding:utf8mb4;[R1] [C8] column_is_not_null:false;[R1] [C8] column_value_new_md5:[21ac45796075552d5e54ff8c8d45db78](11534336);[R1] [C8] column_value_old_md5:[c57d4c3741dc0eb85d767497f9736503](50331647);[R1] [C9] column_name:long_blob;[R1] [C9] column_type:MYSQL_TYPE_LONG_BLOB;[R1] [C9] column_is_rowkey:false;[R1] [C9] column_is_signed:true;[R1] [C9] column_encoding:binary;[R1] [C9] column_is_not_null:false;[R1] [C9] column_value_new_md5:[2c935e46cfdb63ec4d3dc7c05351aa7f](11534336);[R1] [C9] column_value_old_md5:[21ac45796075552d5e54ff8c8d45db78](11534336);$[R2] COMMIT;
insert into lob_basic_1 values (4, "", "", repeat('a', 63210), "", repeat('a', 654321), "", repeat('a', 50331647), repeat('b', 50331647));
select pk, md5(tiny_text), md5(tiny_blob), md5(text_type), md5(blob_type), md5(medium_text), md5(medium_blob), md5(long_text), md5(long_blob) from lob_basic_1 where pk=4;
pk	md5(tiny_text)	md5(tiny_blob)	md5(text_type)	md5(blob_type)	md5(medium_text)	md5(medium_blob)	md5(long_text)	md5(long_blob)
4	d41d8cd98f00b204e9800998ecf8427e	d41d8cd98f00b204e9800998ecf8427e	16a9e4895c6169a9a8da828f6d4b4896	d41d8cd98f00b204e9800998ecf8427e	d5300422b42b6fc65e3213972d51d901	d41d8cd98f00b204e9800998ecf8427e	c57d4c3741dc0eb85d767497f9736503	2382bbd355b1c0377240e1d1f79b6081
ob1.oblog.next_dml;
[R0] BEGIN;[R0] org_cluster_id:1;[R1] record_type:INSERT;[R1] database_name:cdc_mysql.lob_basic_db1;[R1] table_name:lob_basic_1;[R1] log_event:true;[R1] column_count:9;[R1] source_category:SRC_FULL_RECORDED;[R1] source_type:SRC_OCEANBASE_1_0;[R1] has_pk:true;[R1] pk_info:(0);[R1] pks:pk;[R1] has_uk:false;[R1] uk_info:(null);[R1] uks:(null);[R1] [C1] column_name:pk;[R1] [C1] column_type:MYSQL_TYPE_LONG;[R1] [C1] column_is_rowkey:true;[R1] [C1] column_is_signed:true;[R1] [C1] column_encoding:binary;[R1] [C1] column_is_not_null:true;[R1] [C1] column_value_new:[4](1);[R1] [C2] column_name:tiny_text;[R1] [C2] column_type:MYSQL_TYPE_TINY_BLOB;[R1] [C2] column_is_rowkey:false;[R1] [C2] column_is_signed:true;[R1] [C2] column_encoding:utf8mb4;[R1] [C2] column_is_not_null:false;[R1] [C2] column_value_new_md5:[d41d8cd98f00b204e9800998ecf8427e](0);[R1] [C3] column_name:tiny_blob;[R1] [C3] column_type:MYSQL_TYPE_TINY_BLOB;[R1] [C3] column_is_rowkey:false;[R1] [C3] column_is_signed:true;[R1] [C3] column_encoding:binary;[R1] [C3] column_is_not_null:false;[R1] [C3] column_value_new_md5:[d41d8cd98f00b204e9800998ecf8427e](0);[R1] [C4] column_name:text_type;[R1] [C4] column_type:MYSQL_TYPE_BLOB;[R1] [C4] column_is_rowkey:false;[R1] [C4] column_is_signed:true;[R1] [C4] column_encoding:utf8mb4;[R1] [C4] column_is_not_null:false;[R1] [C4] column_value_new_md5:[16a9e4895c6169a9a8da828f6d4b4896](63210);[R1] [C5] column_name:blob_type;[R1] [C5] column_type:MYSQL_TYPE_BLOB;[R1] [C5] column_is_rowkey:false;[R1] [C5] column_is_signed:true;[R1] [C5] column_encoding:binary;[R1] [C5] column_is_not_null:false;[R1] [C5] column_value_new_md5:[d41d8cd98f00b204e9800998ecf8427e](0);[R1] [C6] column_name:medium_text;[R1] [C6] column_type:MYSQL_TYPE_MEDIUM_BLOB;[R1] [C6] column_is_rowkey:false;[R1] [C6] column_is_signed:true;[R1] [C6] column_encoding:utf8mb4;[R1] [C6] column_is_not_null:false;[R1] [C6] column_value_new_md5:[d5300422b42b6fc65e3213972d51d901](654321);[R1] [C7] column_name:medium_blob;[R1] [C7] column_type:MYSQL_TYPE_MEDIUM_BLOB;[R1] [C7] column_is_rowkey:false;[R1] [C7] column_is_signed:true;[R1] [C7] column_encoding:binary;[R1] [C7] column_is_not_null:false;[R1] [C7] column_value_new_md5:[d41d8cd98f00b204e9800998ecf8427e](0);[R1] [C8] column_name:long_text;[R1] [C8] column_type:MYSQL_TYPE_LONG_BLOB;[R1] [C8] column_is_rowkey:false;[R1] [C8] column_is_signed:true;[R1] [C8] column_encoding:utf8mb4;[R1] [C8] column_is_not_null:false;[R1] [C8] column_value_new_md5:[c57d4c3741dc0eb85d767497f9736503](50331647);[R1] [C9] column_name:long_blob;[R1] [C9] column_type:MYSQL_TYPE_LONG_BLOB;[R1] [C9] column_is_rowkey:false;[R1] [C9] column_is_signed:true;[R1] [C9] column_encoding:binary;[R1] [C9] column_is_not_null:false;[R1] [C9] column_value_new_md5:[2382bbd355b1c0377240e1d1f79b6081](50331647);$[R2] COMMIT;
update lob_basic_1 set long_text= "OceanBase", long_blob = "OceanBase CDC" where pk = 4;
select pk, md5(tiny_text), md5(tiny_blob), md5(text_type), md5(blob_type), md5(medium_text), md5(medium_blob), md5(long_text), md5(long_blob) from lob_basic_1 where pk=4;
pk	md5(tiny_text)	md5(tiny_blob)	md5(text_type)	md5(blob_type)	md5(medium_text)	md5(medium_blob)	md5(long_text)	md5(long_blob)
4	d41d8cd98f00b204e9800998ecf8427e	d41d8cd98f00b204e9800998ecf8427e	16a9e4895c6169a9a8da828f6d4b4896	d41d8cd98f00b204e9800998ecf8427e	d5300422b42b6fc65e3213972d51d901	d41d8cd98f00b204e9800998ecf8427e	f75702e1f9894f0e15cb45faae9ed0fc	36a03906ff74e6e496273de4b509bd39
ob1.oblog.next_dml;
[R0] BEGIN;[R0] org_cluster_id:1;[R1] record_type:UPDATE;[R1] database_name:cdc_mysql.lob_basic_db1;[R1] table_name:lob_basic_1;[R1] log_event:true;[R1] column_count:9;[R1] source_category:SRC_FULL_RECORDED;[R1] source_type:SRC_OCEANBASE_1_0;[R1] has_pk:true;[R1] pk_info:(0);[R1] pks:pk;[R1] has_uk:false;[R1] uk_info:(null);[R1] uks:(null);[R1] [C1] column_name:pk;[R1] [C1] column_type:MYSQL_TYPE_LONG;[R1] [C1] column_is_rowkey:true;[R1] [C1] column_is_signed:true;[R1] [C1] column_encoding:binary;[R1] [C1] column_is_not_null:true;[R1] [C1] column_value_new:[4](1);[R1] [C1] column_value_old:[4](1);[R1] [C2] column_name:tiny_text;[R1] [C2] column_type:MYSQL_TYPE_TINY_BLOB;[R1] [C2] column_is_rowkey:false;[R1] [C2] column_is_signed:true;[R1] [C2] column_encoding:utf8mb4;[R1] [C2] column_is_not_null:false;[R1] [C2] column_value_new_md5:[d41d8cd98f00b204e9800998ecf8427e](0);[R1] [C2] column_value_old_md5:[d41d8cd98f00b204e9800998ecf8427e](0);[R1] [C3] column_name:tiny_blob;[R1] [C3] column_type:MYSQL_TYPE_TINY_BLOB;[R1] [C3] column_is_rowkey:false;[R1] [C3] column_is_signed:true;[R1] [C3] column_encoding:binary;[R1] [C3] column_is_not_null:false;[R1] [C3] column_value_new_md5:[d41d8cd98f00b204e9800998ecf8427e](0);[R1] [C3] column_value_old_md5:[d41d8cd98f00b204e9800998ecf8427e](0);[R1] [C4] column_name:text_type;[R1] [C4] column_type:MYSQL_TYPE_BLOB;[R1] [C4] column_is_rowkey:false;[R1] [C4] column_is_signed:true;[R1] [C4] column_encoding:utf8mb4;[R1] [C4] column_is_not_null:false;[R1] [C4] column_value_new_origin: PADDING;[R1] [C4] column_value_new_md5:[NULL](0);[R1] [C4] column_value_old_origin: PADDING;[R1] [C4] column_value_old_md5:[NULL](0);[R1] [C5] column_name:blob_type;[R1] [C5] column_type:MYSQL_TYPE_BLOB;[R1] [C5] column_is_rowkey:false;[R1] [C5] column_is_signed:true;[R1] [C5] column_encoding:binary;[R1] [C5] column_is_not_null:false;[R1] [C5] column_value_new_md5:[d41d8cd98f00b204e9800998ecf8427e](0);[R1] [C5] column_value_old_md5:[d41d8cd98f00b204e9800998ecf8427e](0);[R1] [C6] column_name:medium_text;[R1] [C6] column_type:MYSQL_TYPE_MEDIUM_BLOB;[R1] [C6] column_is_rowkey:false;[R1] [C6] column_is_signed:true;[R1] [C6] column_encoding:utf8mb4;[R1] [C6] column_is_not_null:false;[R1] [C6] column_value_new_origin: PADDING;[R1] [C6] column_value_new_md5:[NULL](0);[R1] [C6] column_value_old_origin: PADDING;[R1] [C6] column_value_old_md5:[NULL](0);[R1] [C7] column_name:medium_blob;[R1] [C7] column_type:MYSQL_TYPE_MEDIUM_BLOB;[R1] [C7] column_is_rowkey:false;[R1] [C7] column_is_signed:true;[R1] [C7] column_encoding:binary;[R1] [C7] column_is_not_null:false;[R1] [C7] column_value_new_md5:[d41d8cd98f00b204e9800998ecf8427e](0);[R1] [C7] column_value_old_md5:[d41d8cd98f00b204e9800998ecf8427e](0);[R1] [C8] column_name:long_text;[R1] [C8] column_type:MYSQL_TYPE_LONG_BLOB;[R1] [C8] column_is_rowkey:false;[R1] [C8] column_is_signed:true;[R1] [C8] column_encoding:utf8mb4;[R1] [C8] column_is_not_null:false;[R1] [C8] column_value_new_md5:[f75702e1f9894f0e15cb45faae9ed0fc](9);[R1] [C8] column_value_old_origin: PADDING;[R1] [C8] column_value_old_md5:[NULL](0);[R1] [C9] column_name:long_blob;[R1] [C9] column_type:MYSQL_TYPE_LONG_BLOB;[R1] [C9] column_is_rowkey:false;[R1] [C9] column_is_signed:true;[R1] [C9] column_encoding:binary;[R1] [C9] column_is_not_null:false;[R1] [C9] column_value_new_md5:[36a03906ff74e6e496273de4b509bd39](13);[R1] [C9] column_value_old_origin: PADDING;[R1] [C9] column_value_old_md5:[NULL](0);$[R2] COMMIT;
update lob_basic_1 set long_text= repeat('a', 50331647), long_blob = repeat('b', 50331647) where pk = 4;
select pk, md5(tiny_text), md5(tiny_blob), md5(text_type), md5(blob_type), md5(medium_text), md5(medium_blob), md5(long_text), md5(long_blob) from lob_basic_1 where pk=4;
pk	md5(tiny_text)	md5(tiny_blob)	md5(text_type)	md5(blob_type)	md5(medium_text)	md5(medium_blob)	md5(long_text)	md5(long_blob)
4	d41d8cd98f00b204e9800998ecf8427e	d41d8cd98f00b204e9800998ecf8427e	16a9e4895c6169a9a8da828f6d4b4896	d41d8cd98f00b204e9800998ecf8427e	d5300422b42b6fc65e3213972d51d901	d41d8cd98f00b204e9800998ecf8427e	c57d4c3741dc0eb85d767497f9736503	2382bbd355b1c0377240e1d1f79b6081
ob1.oblog.next_dml;
[R0] BEGIN;[R0] org_cluster_id:1;[R1] record_type:UPDATE;[R1] database_name:cdc_mysql.lob_basic_db1;[R1] table_name:lob_basic_1;[R1] log_event:true;[R1] column_count:9;[R1] source_category:SRC_FULL_RECORDED;[R1] source_type:SRC_OCEANBASE_1_0;[R1] has_pk:true;[R1] pk_info:(0);[R1] pks:pk;[R1] has_uk:false;[R1] uk_info:(null);[R1] uks:(null);[R1] [C1] column_name:pk;[R1] [C1] column_type:MYSQL_TYPE_LONG;[R1] [C1] column_is_rowkey:true;[R1] [C1] column_is_signed:true;[R1] [C1] column_encoding:binary;[R1] [C1] column_is_not_null:true;[R1] [C1] column_value_new:[4](1);[R1] [C1] column_value_old:[4](1);[R1] [C2] column_name:tiny_text;[R1] [C2] column_type:MYSQL_TYPE_TINY_BLOB;[R1] [C2] column_is_rowkey:false;[R1] [C2] column_is_signed:true;[R1] [C2] column_encoding:utf8mb4;[R1] [C2] column_is_not_null:false;[R1] [C2] column_value_new_md5:[d41d8cd98f00b204e9800998ecf8427e](0);[R1] [C2] column_value_old_md5:[d41d8cd98f00b204e9800998ecf8427e](0);[R1] [C3] column_name:tiny_blob;[R1] [C3] column_type:MYSQL_TYPE_TINY_BLOB;[R1] [C3] column_is_rowkey:false;[R1] [C3] column_is_signed:true;[R1] [C3] column_encoding:binary;[R1] [C3] column_is_not_null:false;[R1] [C3] column_value_new_md5:[d41d8cd98f00b204e9800998ecf8427e](0);[R1] [C3] column_value_old_md5:[d41d8cd98f00b204e9800998ecf8427e](0);[R1] [C4] column_name:text_type;[R1] [C4] column_type:MYSQL_TYPE_BLOB;[R1] [C4] column_is_rowkey:false;[R1] [C4] column_is_signed:true;[R1] [C4] column_encoding:utf8mb4;[R1] [C4] column_is_not_null:false;[R1] [C4] column_value_new_origin: PADDING;[R1] [C4] column_value_new_md5:[NULL](0);[R1] [C4] column_value_old_origin: PADDING;[R1] [C4] column_value_old_md5:[NULL](0);[R1] [C5] column_name:blob_type;[R1] [C5] column_type:MYSQL_TYPE_BLOB;[R1] [C5] column_is_rowkey:false;[R1] [C5] column_is_signed:true;[R1] [C5] column_encoding:binary;[R1] [C5] column_is_not_null:false;[R1] [C5] column_value_new_md5:[d41d8cd98f00b204e9800998ecf8427e](0);[R1] [C5] column_value_old_md5:[d41d8cd98f00b204e9800998ecf8427e](0);[R1] [C6] column_name:medium_text;[R1] [C6] column_type:MYSQL_TYPE_MEDIUM_BLOB;[R1] [C6] column_is_rowkey:false;[R1] [C6] column_is_signed:true;[R1] [C6] column_encoding:utf8mb4;[R1] [C6] column_is_not_null:false;[R1] [C6] column_value_new_origin: PADDING;[R1] [C6] column_value_new_md5:[NULL](0);[R1] [C6] column_value_old_origin: PADDING;[R1] [C6] column_value_old_md5:[NULL](0);[R1] [C7] column_name:medium_blob;[R1] [C7] column_type:MYSQL_TYPE_MEDIUM_BLOB;[R1] [C7] column_is_rowkey:false;[R1] [C7] column_is_signed:true;[R1] [C7] column_encoding:binary;[R1] [C7] column_is_not_null:false;[R1] [C7] column_value_new_md5:[d41d8cd98f00b204e9800998ecf8427e](0);[R1] [C7] column_value_old_md5:[d41d8cd98f00b204e9800998ecf8427e](0);[R1] [C8] column_name:long_text;[R1] [C8] column_type:MYSQL_TYPE_LONG_BLOB;[R1] [C8] column_is_rowkey:false;[R1] [C8] column_is_signed:true;[R1] [C8] column_encoding:utf8mb4;[R1] [C8] column_is_not_null:false;[R1] [C8] column_value_new_md5:[c57d4c3741dc0eb85d767497f9736503](50331647);[R1] [C8] column_value_old_md5:[f75702e1f9894f0e15cb45faae9ed0fc](9);[R1] [C9] column_name:long_blob;[R1] [C9] column_type:MYSQL_TYPE_LONG_BLOB;[R1] [C9] column_is_rowkey:false;[R1] [C9] column_is_signed:true;[R1] [C9] column_encoding:binary;[R1] [C9] column_is_not_null:false;[R1] [C9] column_value_new_md5:[2382bbd355b1c0377240e1d1f79b6081](50331647);[R1] [C9] column_value_old_md5:[36a03906ff74e6e496273de4b509bd39](13);$[R2] COMMIT;
update lob_basic_1 set long_text = '', long_blob = NULL where pk = 4;
ob1.oblog.next_dml;
[R0] BEGIN;[R0] org_cluster_id:1;[R1] record_type:UPDATE;[R1] database_name:cdc_mysql.lob_basic_db1;[R1] table_name:lob_basic_1;[R1] log_event:true;[R1] column_count:9;[R1] source_category:SRC_FULL_RECORDED;[R1] source_type:SRC_OCEANBASE_1_0;[R1] has_pk:true;[R1] pk_info:(0);[R1] pks:pk;[R1] has_uk:false;[R1] uk_info:(null);[R1] uks:(null);[R1] [C1] column_name:pk;[R1] [C1] column_type:MYSQL_TYPE_LONG;[R1] [C1] column_is_rowkey:true;[R1] [C1] column_is_signed:true;[R1] [C1] column_encoding:binary;[R1] [C1] column_is_not_null:true;[R1] [C1] column_value_new:[4](1);[R1] [C1] column_value_old:[4](1);[R1] [C2] column_name:tiny_text;[R1] [C2] column_type:MYSQL_TYPE_TINY_BLOB;[R1] [C2] column_is_rowkey:false;[R1] [C2] column_is_signed:true;[R1] [C2] column_encoding:utf8mb4;[R1] [C2] column_is_not_null:false;[R1] [C2] column_value_new_md5:[d41d8cd98f00b204e9800998ecf8427e](0);[R1] [C2] column_value_old_md5:[d41d8cd98f00b204e9800998ecf8427e](0);[R1] [C3] column_name:tiny_blob;[R1] [C3] column_type:MYSQL_TYPE_TINY_BLOB;[R1] [C3] column_is_rowkey:false;[R1] [C3] column_is_signed:true;[R1] [C3] column_encoding:binary;[R1] [C3] column_is_not_null:false;[R1] [C3] column_value_new_md5:[d41d8cd98f00b204e9800998ecf8427e](0);[R1] [C3] column_value_old_md5:[d41d8cd98f00b204e9800998ecf8427e](0);[R1] [C4] column_name:text_type;[R1] [C4] column_type:MYSQL_TYPE_BLOB;[R1] [C4] column_is_rowkey:false;[R1] [C4] column_is_signed:true;[R1] [C4] column_encoding:utf8mb4;[R1] [C4] column_is_not_null:false;[R1] [C4] column_value_new_origin: PADDING;[R1] [C4] column_value_new_md5:[NULL](0);[R1] [C4] column_value_old_origin: PADDING;[R1] [C4] column_value_old_md5:[NULL](0);[R1] [C5] column_name:blob_type;[R1] [C5] column_type:MYSQL_TYPE_BLOB;[R1] [C5] column_is_rowkey:false;[R1] [C5] column_is_signed:true;[R1] [C5] column_encoding:binary;[R1] [C5] column_is_not_null:false;[R1] [C5] column_value_new_md5:[d41d8cd98f00b204e9800998ecf8427e](0);[R1] [C5] column_value_old_md5:[d41d8cd98f00b204e9800998ecf8427e](0);[R1] [C6] column_name:medium_text;[R1] [C6] column_type:MYSQL_TYPE_MEDIUM_BLOB;[R1] [C6] column_is_rowkey:false;[R1] [C6] column_is_signed:true;[R1] [C6] column_encoding:utf8mb4;[R1] [C6] column_is_not_null:false;[R1] [C6] column_value_new_origin: PADDING;[R1] [C6] column_value_new_md5:[NULL](0);[R1] [C6] column_value_old_origin: PADDING;[R1] [C6] column_value_old_md5:[NULL](0);[R1] [C7] column_name:medium_blob;[R1] [C7] column_type:MYSQL_TYPE_MEDIUM_BLOB;[R1] [C7] column_is_rowkey:false;[R1] [C7] column_is_signed:true;[R1] [C7] column_encoding:binary;[R1] [C7] column_is_not_null:false;[R1] [C7] column_value_new_md5:[d41d8cd98f00b204e9800998ecf8427e](0);[R1] [C7] column_value_old_md5:[d41d8cd98f00b204e9800998ecf8427e](0);[R1] [C8] column_name:long_text;[R1] [C8] column_type:MYSQL_TYPE_LONG_BLOB;[R1] [C8] column_is_rowkey:false;[R1] [C8] column_is_signed:true;[R1] [C8] column_encoding:utf8mb4;[R1] [C8] column_is_not_null:false;[R1] [C8] column_value_new_md5:[d41d8cd98f00b204e9800998ecf8427e](0);[R1] [C8] column_value_old_origin: PADDING;[R1] [C8] column_value_old_md5:[NULL](0);[R1] [C9] column_name:long_blob;[R1] [C9] column_type:MYSQL_TYPE_LONG_BLOB;[R1] [C9] column_is_rowkey:false;[R1] [C9] column_is_signed:true;[R1] [C9] column_encoding:binary;[R1] [C9] column_is_not_null:false;[R1] [C9] column_value_new_md5:[NULL](0);[R1] [C9] column_value_old_origin: PADDING;[R1] [C9] column_value_old_md5:[NULL](0);$[R2] COMMIT;
update lob_basic_1 set long_text = NULL, long_blob = '' where pk = 4;
ob1.oblog.next_dml;
[R0] BEGIN;[R0] org_cluster_id:1;[R1] record_type:UPDATE;[R1] database_name:cdc_mysql.lob_basic_db1;[R1] table_name:lob_basic_1;[R1] log_event:true;[R1] column_count:9;[R1] source_category:SRC_FULL_RECORDED;[R1] source_type:SRC_OCEANBASE_1_0;[R1] has_pk:true;[R1] pk_info:(0);[R1] pks:pk;[R1] has_uk:false;[R1] uk_info:(null);[R1] uks:(null);[R1] [C1] column_name:pk;[R1] [C1] column_type:MYSQL_TYPE_LONG;[R1] [C1] column_is_rowkey:true;[R1] [C1] column_is_signed:true;[R1] [C1] column_encoding:binary;[R1] [C1] column_is_not_null:true;[R1] [C1] column_value_new:[4](1);[R1] [C1] column_value_old:[4](1);[R1] [C2] column_name:tiny_text;[R1] [C2] column_type:MYSQL_TYPE_TINY_BLOB;[R1] [C2] column_is_rowkey:false;[R1] [C2] column_is_signed:true;[R1] [C2] column_encoding:utf8mb4;[R1] [C2] column_is_not_null:false;[R1] [C2] column_value_new_md5:[d41d8cd98f00b204e9800998ecf8427e](0);[R1] [C2] column_value_old_md5:[d41d8cd98f00b204e9800998ecf8427e](0);[R1] [C3] column_name:tiny_blob;[R1] [C3] column_type:MYSQL_TYPE_TINY_BLOB;[R1] [C3] column_is_rowkey:false;[R1] [C3] column_is_signed:true;[R1] [C3] column_encoding:binary;[R1] [C3] column_is_not_null:false;[R1] [C3] column_value_new_md5:[d41d8cd98f00b204e9800998ecf8427e](0);[R1] [C3] column_value_old_md5:[d41d8cd98f00b204e9800998ecf8427e](0);[R1] [C4] column_name:text_type;[R1] [C4] column_type:MYSQL_TYPE_BLOB;[R1] [C4] column_is_rowkey:false;[R1] [C4] column_is_signed:true;[R1] [C4] column_encoding:utf8mb4;[R1] [C4] column_is_not_null:false;[R1] [C4] column_value_new_origin: PADDING;[R1] [C4] column_value_new_md5:[NULL](0);[R1] [C4] column_value_old_origin: PADDING;[R1] [C4] column_value_old_md5:[NULL](0);[R1] [C5] column_name:blob_type;[R1] [C5] column_type:MYSQL_TYPE_BLOB;[R1] [C5] column_is_rowkey:false;[R1] [C5] column_is_signed:true;[R1] [C5] column_encoding:binary;[R1] [C5] column_is_not_null:false;[R1] [C5] column_value_new_md5:[d41d8cd98f00b204e9800998ecf8427e](0);[R1] [C5] column_value_old_md5:[d41d8cd98f00b204e9800998ecf8427e](0);[R1] [C6] column_name:medium_text;[R1] [C6] column_type:MYSQL_TYPE_MEDIUM_BLOB;[R1] [C6] column_is_rowkey:false;[R1] [C6] column_is_signed:true;[R1] [C6] column_encoding:utf8mb4;[R1] [C6] column_is_not_null:false;[R1] [C6] column_value_new_origin: PADDING;[R1] [C6] column_value_new_md5:[NULL](0);[R1] [C6] column_value_old_origin: PADDING;[R1] [C6] column_value_old_md5:[NULL](0);[R1] [C7] column_name:medium_blob;[R1] [C7] column_type:MYSQL_TYPE_MEDIUM_BLOB;[R1] [C7] column_is_rowkey:false;[R1] [C7] column_is_signed:true;[R1] [C7] column_encoding:binary;[R1] [C7] column_is_not_null:false;[R1] [C7] column_value_new_md5:[d41d8cd98f00b204e9800998ecf8427e](0);[R1] [C7] column_value_old_md5:[d41d8cd98f00b204e9800998ecf8427e](0);[R1] [C8] column_name:long_text;[R1] [C8] column_type:MYSQL_TYPE_LONG_BLOB;[R1] [C8] column_is_rowkey:false;[R1] [C8] column_is_signed:true;[R1] [C8] column_encoding:utf8mb4;[R1] [C8] column_is_not_null:false;[R1] [C8] column_value_new_md5:[NULL](0);[R1] [C8] column_value_old_md5:[d41d8cd98f00b204e9800998ecf8427e](0);[R1] [C9] column_name:long_blob;[R1] [C9] column_type:MYSQL_TYPE_LONG_BLOB;[R1] [C9] column_is_rowkey:false;[R1] [C9] column_is_signed:true;[R1] [C9] column_encoding:binary;[R1] [C9] column_is_not_null:false;[R1] [C9] column_value_new_md5:[d41d8cd98f00b204e9800998ecf8427e](0);[R1] [C9] column_value_old_md5:[NULL](0);$[R2] COMMIT;
update lob_basic_1 set long_text= repeat('a', 50331647), long_blob = repeat('b', 50331647) where pk = 4;
ob1.oblog.next_dml;
[R0] BEGIN;[R0] org_cluster_id:1;[R1] record_type:UPDATE;[R1] database_name:cdc_mysql.lob_basic_db1;[R1] table_name:lob_basic_1;[R1] log_event:true;[R1] column_count:9;[R1] source_category:SRC_FULL_RECORDED;[R1] source_type:SRC_OCEANBASE_1_0;[R1] has_pk:true;[R1] pk_info:(0);[R1] pks:pk;[R1] has_uk:false;[R1] uk_info:(null);[R1] uks:(null);[R1] [C1] column_name:pk;[R1] [C1] column_type:MYSQL_TYPE_LONG;[R1] [C1] column_is_rowkey:true;[R1] [C1] column_is_signed:true;[R1] [C1] column_encoding:binary;[R1] [C1] column_is_not_null:true;[R1] [C1] column_value_new:[4](1);[R1] [C1] column_value_old:[4](1);[R1] [C2] column_name:tiny_text;[R1] [C2] column_type:MYSQL_TYPE_TINY_BLOB;[R1] [C2] column_is_rowkey:false;[R1] [C2] column_is_signed:true;[R1] [C2] column_encoding:utf8mb4;[R1] [C2] column_is_not_null:false;[R1] [C2] column_value_new_md5:[d41d8cd98f00b204e9800998ecf8427e](0);[R1] [C2] column_value_old_md5:[d41d8cd98f00b204e9800998ecf8427e](0);[R1] [C3] column_name:tiny_blob;[R1] [C3] column_type:MYSQL_TYPE_TINY_BLOB;[R1] [C3] column_is_rowkey:false;[R1] [C3] column_is_signed:true;[R1] [C3] column_encoding:binary;[R1] [C3] column_is_not_null:false;[R1] [C3] column_value_new_md5:[d41d8cd98f00b204e9800998ecf8427e](0);[R1] [C3] column_value_old_md5:[d41d8cd98f00b204e9800998ecf8427e](0);[R1] [C4] column_name:text_type;[R1] [C4] column_type:MYSQL_TYPE_BLOB;[R1] [C4] column_is_rowkey:false;[R1] [C4] column_is_signed:true;[R1] [C4] column_encoding:utf8mb4;[R1] [C4] column_is_not_null:false;[R1] [C4] column_value_new_origin: PADDING;[R1] [C4] column_value_new_md5:[NULL](0);[R1] [C4] column_value_old_origin: PADDING;[R1] [C4] column_value_old_md5:[NULL](0);[R1] [C5] column_name:blob_type;[R1] [C5] column_type:MYSQL_TYPE_BLOB;[R1] [C5] column_is_rowkey:false;[R1] [C5] column_is_signed:true;[R1] [C5] column_encoding:binary;[R1] [C5] column_is_not_null:false;[R1] [C5] column_value_new_md5:[d41d8cd98f00b204e9800998ecf8427e](0);[R1] [C5] column_value_old_md5:[d41d8cd98f00b204e9800998ecf8427e](0);[R1] [C6] column_name:medium_text;[R1] [C6] column_type:MYSQL_TYPE_MEDIUM_BLOB;[R1] [C6] column_is_rowkey:false;[R1] [C6] column_is_signed:true;[R1] [C6] column_encoding:utf8mb4;[R1] [C6] column_is_not_null:false;[R1] [C6] column_value_new_origin: PADDING;[R1] [C6] column_value_new_md5:[NULL](0);[R1] [C6] column_value_old_origin: PADDING;[R1] [C6] column_value_old_md5:[NULL](0);[R1] [C7] column_name:medium_blob;[R1] [C7] column_type:MYSQL_TYPE_MEDIUM_BLOB;[R1] [C7] column_is_rowkey:false;[R1] [C7] column_is_signed:true;[R1] [C7] column_encoding:binary;[R1] [C7] column_is_not_null:false;[R1] [C7] column_value_new_md5:[d41d8cd98f00b204e9800998ecf8427e](0);[R1] [C7] column_value_old_md5:[d41d8cd98f00b204e9800998ecf8427e](0);[R1] [C8] column_name:long_text;[R1] [C8] column_type:MYSQL_TYPE_LONG_BLOB;[R1] [C8] column_is_rowkey:false;[R1] [C8] column_is_signed:true;[R1] [C8] column_encoding:utf8mb4;[R1] [C8] column_is_not_null:false;[R1] [C8] column_value_new_md5:[c57d4c3741dc0eb85d767497f9736503](50331647);[R1] [C8] column_value_old_md5:[NULL](0);[R1] [C9] column_name:long_blob;[R1] [C9] column_type:MYSQL_TYPE_LONG_BLOB;[R1] [C9] column_is_rowkey:false;[R1] [C9] column_is_signed:true;[R1] [C9] column_encoding:binary;[R1] [C9] column_is_not_null:false;[R1] [C9] column_value_new_md5:[2382bbd355b1c0377240e1d1f79b6081](50331647);[R1] [C9] column_value_old_md5:[d41d8cd98f00b204e9800998ecf8427e](0);$[R2] COMMIT;
delete from lob_basic_1 where pk=3;
ob1.oblog.next_dml;
[R0] BEGIN;[R0] org_cluster_id:1;[R1] record_type:DELETE;[R1] database_name:cdc_mysql.lob_basic_db1;[R1] table_name:lob_basic_1;[R1] log_event:true;[R1] column_count:9;[R1] source_category:SRC_FULL_RECORDED;[R1] source_type:SRC_OCEANBASE_1_0;[R1] has_pk:true;[R1] pk_info:(0);[R1] pks:pk;[R1] has_uk:false;[R1] uk_info:(null);[R1] uks:(null);[R1] [C1] column_name:pk;[R1] [C1] column_type:MYSQL_TYPE_LONG;[R1] [C1] column_is_rowkey:true;[R1] [C1] column_is_signed:true;[R1] [C1] column_encoding:binary;[R1] [C1] column_is_not_null:true;[R1] [C1] column_value_old:[3](1);[R1] [C2] column_name:tiny_text;[R1] [C2] column_type:MYSQL_TYPE_TINY_BLOB;[R1] [C2] column_is_rowkey:false;[R1] [C2] column_is_signed:true;[R1] [C2] column_encoding:utf8mb4;[R1] [C2] column_is_not_null:false;[R1] [C2] column_value_old_md5:[d41d8cd98f00b204e9800998ecf8427e](0);[R1] [C3] column_name:tiny_blob;[R1] [C3] column_type:MYSQL_TYPE_TINY_BLOB;[R1] [C3] column_is_rowkey:false;[R1] [C3] column_is_signed:true;[R1] [C3] column_encoding:binary;[R1] [C3] column_is_not_null:false;[R1] [C3] column_value_old_md5:[d41d8cd98f00b204e9800998ecf8427e](0);[R1] [C4] column_name:text_type;[R1] [C4] column_type:MYSQL_TYPE_BLOB;[R1] [C4] column_is_rowkey:false;[R1] [C4] column_is_signed:true;[R1] [C4] column_encoding:utf8mb4;[R1] [C4] column_is_not_null:false;[R1] [C4] column_value_old_md5:[d41d8cd98f00b204e9800998ecf8427e](0);[R1] [C5] column_name:blob_type;[R1] [C5] column_type:MYSQL_TYPE_BLOB;[R1] [C5] column_is_rowkey:false;[R1] [C5] column_is_signed:true;[R1] [C5] column_encoding:binary;[R1] [C5] column_is_not_null:false;[R1] [C5] column_value_old_md5:[d41d8cd98f00b204e9800998ecf8427e](0);[R1] [C6] column_name:medium_text;[R1] [C6] column_type:MYSQL_TYPE_MEDIUM_BLOB;[R1] [C6] column_is_rowkey:false;[R1] [C6] column_is_signed:true;[R1] [C6] column_encoding:utf8mb4;[R1] [C6] column_is_not_null:false;[R1] [C6] column_value_old_md5:[d41d8cd98f00b204e9800998ecf8427e](0);[R1] [C7] column_name:medium_blob;[R1] [C7] column_type:MYSQL_TYPE_MEDIUM_BLOB;[R1] [C7] column_is_rowkey:false;[R1] [C7] column_is_signed:true;[R1] [C7] column_encoding:binary;[R1] [C7] column_is_not_null:false;[R1] [C7] column_value_old_md5:[d41d8cd98f00b204e9800998ecf8427e](0);[R1] [C8] column_name:long_text;[R1] [C8] column_type:MYSQL_TYPE_LONG_BLOB;[R1] [C8] column_is_rowkey:false;[R1] [C8] column_is_signed:true;[R1] [C8] column_encoding:utf8mb4;[R1] [C8] column_is_not_null:false;[R1] [C8] column_value_old_origin: PADDING;[R1] [C8] column_value_old_md5:[NULL](0);[R1] [C9] column_name:long_blob;[R1] [C9] column_type:MYSQL_TYPE_LONG_BLOB;[R1] [C9] column_is_rowkey:false;[R1] [C9] column_is_signed:true;[R1] [C9] column_encoding:binary;[R1] [C9] column_is_not_null:false;[R1] [C9] column_value_old_origin: PADDING;[R1] [C9] column_value_old_md5:[NULL](0);$[R2] COMMIT;
delete from lob_basic_1 where pk=4;
ob1.oblog.next_dml;
[R0] BEGIN;[R0] org_cluster_id:1;[R1] record_type:DELETE;[R1] database_name:cdc_mysql.lob_basic_db1;[R1] table_name:lob_basic_1;[R1] log_event:true;[R1] column_count:9;[R1] source_category:SRC_FULL_RECORDED;[R1] source_type:SRC_OCEANBASE_1_0;[R1] has_pk:true;[R1] pk_info:(0);[R1] pks:pk;[R1] has_uk:false;[R1] uk_info:(null);[R1] uks:(null);[R1] [C1] column_name:pk;[R1] [C1] column_type:MYSQL_TYPE_LONG;[R1] [C1] column_is_rowkey:true;[R1] [C1] column_is_signed:true;[R1] [C1] column_encoding:binary;[R1] [C1] column_is_not_null:true;[R1] [C1] column_value_old:[4](1);[R1] [C2] column_name:tiny_text;[R1] [C2] column_type:MYSQL_TYPE_TINY_BLOB;[R1] [C2] column_is_rowkey:false;[R1] [C2] column_is_signed:true;[R1] [C2] column_encoding:utf8mb4;[R1] [C2] column_is_not_null:false;[R1] [C2] column_value_old_md5:[d41d8cd98f00b204e9800998ecf8427e](0);[R1] [C3] column_name:tiny_blob;[R1] [C3] column_type:MYSQL_TYPE_TINY_BLOB;[R1] [C3] column_is_rowkey:false;[R1] [C3] column_is_signed:true;[R1] [C3] column_encoding:binary;[R1] [C3] column_is_not_null:false;[R1] [C3] column_value_old_md5:[d41d8cd98f00b204e9800998ecf8427e](0);[R1] [C4] column_name:text_type;[R1] [C4] column_type:MYSQL_TYPE_BLOB;[R1] [C4] column_is_rowkey:false;[R1] [C4] column_is_signed:true;[R1] [C4] column_encoding:utf8mb4;[R1] [C4] column_is_not_null:false;[R1] [C4] column_value_old_origin: PADDING;[R1] [C4] column_value_old_md5:[NULL](0);[R1] [C5] column_name:blob_type;[R1] [C5] column_type:MYSQL_TYPE_BLOB;[R1] [C5] column_is_rowkey:false;[R1] [C5] column_is_signed:true;[R1] [C5] column_encoding:binary;[R1] [C5] column_is_not_null:false;[R1] [C5] column_value_old_md5:[d41d8cd98f00b204e9800998ecf8427e](0);[R1] [C6] column_name:medium_text;[R1] [C6] column_type:MYSQL_TYPE_MEDIUM_BLOB;[R1] [C6] column_is_rowkey:false;[R1] [C6] column_is_signed:true;[R1] [C6] column_encoding:utf8mb4;[R1] [C6] column_is_not_null:false;[R1] [C6] column_value_old_origin: PADDING;[R1] [C6] column_value_old_md5:[NULL](0);[R1] [C7] column_name:medium_blob;[R1] [C7] column_type:MYSQL_TYPE_MEDIUM_BLOB;[R1] [C7] column_is_rowkey:false;[R1] [C7] column_is_signed:true;[R1] [C7] column_encoding:binary;[R1] [C7] column_is_not_null:false;[R1] [C7] column_value_old_md5:[d41d8cd98f00b204e9800998ecf8427e](0);[R1] [C8] column_name:long_text;[R1] [C8] column_type:MYSQL_TYPE_LONG_BLOB;[R1] [C8] column_is_rowkey:false;[R1] [C8] column_is_signed:true;[R1] [C8] column_encoding:utf8mb4;[R1] [C8] column_is_not_null:false;[R1] [C8] column_value_old_origin: PADDING;[R1] [C8] column_value_old_md5:[NULL](0);[R1] [C9] column_name:long_blob;[R1] [C9] column_type:MYSQL_TYPE_LONG_BLOB;[R1] [C9] column_is_rowkey:false;[R1] [C9] column_is_signed:true;[R1] [C9] column_encoding:binary;[R1] [C9] column_is_not_null:false;[R1] [C9] column_value_old_origin: PADDING;[R1] [C9] column_value_old_md5:[NULL](0);$[R2] COMMIT;
set ob_trx_timeout=100000000;
set ob_query_timeout=100000000;
create tablegroup obpay_tablegroup_001 partition by list columns 1 ( partition p0 values ('00'), partition p1 values ('01'), partition p2 values ('02'), partition p3 values ('03'), partition p4 values ('04'), partition p5 values ('05'), partition p6 values ('06'), partition p7 values ('07'), partition p8 values ('08'), partition p9 values ('09'), partition p10 values ('10'), partition p11 values ('11'), partition p12 values ('12'), partition p13 values ('13'), partition p14 values ('14'), partition p15 values ('15'), partition p16 values ('16'), partition p17 values ('17'), partition p18 values ('18'), partition p19 values ('19'), partition p20 values ('20'), partition p21 values ('21'), partition p22 values ('22'), partition p23 values ('23'), partition p24 values ('24'), partition p25 values ('25'), partition p26 values ('26'), partition p27 values ('27'), partition p28 values ('28'), partition p29 values ('29'), partition p30 values ('30'), partition p31 values ('31'), partition p32 values ('32'), partition p33 values ('33'), partition p34 values ('34'), partition p35 values ('35'), partition p36 values ('36'), partition p37 values ('37'), partition p38 values ('38'), partition p39 values ('39'), partition p40 values ('40'), partition p41 values ('41'), partition p42 values ('42'), partition p43 values ('43'), partition p44 values ('44'), partition p45 values ('45'), partition p46 values ('46'), partition p47 values ('47'), partition p48 values ('48'), partition p49 values ('49'), partition p50 values ('50'), partition p51 values ('51'), partition p52 values ('52'), partition p53 values ('53'), partition p54 values ('54'), partition p55 values ('55'), partition p56 values ('56'), partition p57 values ('57'), partition p58 values ('58'), partition p59 values ('59'), partition p60 values ('60'), partition p61 values ('61'), partition p62 values ('62'), partition p63 values ('63'), partition p64 values ('64'), partition p65 values ('65'), partition p66 values ('66'), partition p67 values ('67'), partition p68 values ('68'), partition p69 values ('69'), partition p70 values ('70'), partition p71 values ('71'), partition p72 values ('72'), partition p73 values ('73'), partition p74 values ('74'), partition p75 values ('75'), partition p76 values ('76'), partition p77 values ('77'), partition p78 values ('78'), partition p79 values ('79'), partition p80 values ('80'), partition p81 values ('81'), partition p82 values ('82'), partition p83 values ('83'), partition p84 values ('84'), partition p85 values ('85'), partition p86 values ('86'), partition p87 values ('87'), partition p88 values ('88'), partition p89 values ('89'), partition p90 values ('90'), partition p91 values ('91'), partition p92 values ('92'), partition p93 values ('93'), partition p94 values ('94'), partition p95 values ('95'), partition p96 values ('96'), partition p97 values ('97'), partition p98 values ('98'), partition p99 values ('99'));
ob1.oblog.next;
[R0] record_type:EDDL;[R0] db_name:oracle;[R0] table_name:;[R0] column_count:1;[R0] column_name:ddl;[R0] ddl_stmt_str: create tablegroup obpay_tablegroup_001 partition by list columns 1 ( partition p0 values ('00'), partition p1 values ('01'), partition p2 values ('02'), partition p3 values ('03'), partition p4 values ('04'), partition p5 values ('05'), partition p6 values ('06'), partition p7 values ('07'), partition p8 values ('08'), partition p9 values ('09'), partition p10 values ('10'), partition p11 values ('11'), partition p12 values ('12'), partition p13 values ('13'), partition p14 values ('14'), partition p15 values ('15'), partition p16 values ('16'), partition p17 values ('17'), partition p18 values ('18'), partition p19 values ('19'), partition p20 values ('20'), partition p21 values ('21'), partition p22 values ('22'), partition p23 values ('23'), partition p24 values ('24'), partition p25 values ('25'), partition p26 values ('26'), partition p27 values ('27'), partition p28 values ('28'), partition p29 values ('29'), partition p30 values ('30'), partition p31 values ('31'), partition p32 values ('32'), partition p33 values ('33'), partition p34 values ('34'), partition p35 values ('35'), partition p36 values ('36'), partition p37 values ('37'), partition p38 values ('38'), partition p39 values ('39'), partition p40 values ('40'), partition p41 values ('41'), partition p42 values ('42'), partition p43 values ('43'), partition p44 values ('44'), partition p45 values ('45'), partition p46 values ('46'), partition p47 values ('47'), partition p48 values ('48'), partition p49 values ('49'), partition p50 values ('50'), partition p51 values ('51'), partition p52 values ('52'), partition p53 values ('53'), partition p54 values ('54'), partition p55 values ('55'), partition p56 values ('56'), partition p57 values ('57'), partition p58 values ('58'), partition p59 values ('59'), partition p60 values ('60'), partition p61 values ('61'), partition p62 values ('62'), partition p63 values ('63'), partition p64 values ('64'), partition p65 values ('65'), partition p66 values ('66'), partition p67 values ('67'), partition p68 values ('68'), partition p69 values ('69'), partition p70 values ('70'), partition p71 values ('71'), partition p72 values ('72'), partition p73 values ('73'), partition p74 values ('74'), partition p75 values ('75'), partition p76 values ('76'), partition p77 values ('77'), partition p78 values ('78'), partition p79 values ('79'), partition p80 values ('80'), partition p81 values ('81'), partition p82 values ('82'), partition p83 values ('83'), partition p84 values ('84'), partition p85 values ('85'), partition p86 values ('86'), partition p87 values ('87'), partition p88 values ('88'), partition p89 values ('89'), partition p90 values ('90'), partition p91 values ('91'), partition p92 values ('92'), partition p93 values ('93'), partition p94 values ('94'), partition p95 values ('95'), partition p96 values ('96'), partition p97 values ('97'), partition p98 values ('98'), partition p99 values ('99'));[R0] ddl_stmt_len: 2958;
CREATE TABLE pmt_biz_ext_info_001 ( payment_id_prefix varchar(1) DEFAULT NULL , payment_id varchar(64) NOT NULL , out_biz_context varchar(4000) DEFAULT NULL , env_context varchar(2048) DEFAULT NULL , gmt_create timestamp(6) NOT NULL , sec_context varchar(4000) DEFAULT NULL , partition_id varchar(8) GENERATED ALWAYS AS (substr(payment_id,18,2)) VIRTUAL, PRIMARY KEY (payment_id)) TABLEGROUP = obpay_tablegroup_001 partition by list (partition_id) (partition p0 values ('00'), partition p1 values ('01'), partition p2 values ('02'), partition p3 values ('03'), partition p4 values ('04'), partition p5 values ('05'), partition p6 values ('06'), partition p7 values ('07'), partition p8 values ('08'), partition p9 values ('09'), partition p10 values ('10'), partition p11 values ('11'), partition p12 values ('12'), partition p13 values ('13'), partition p14 values ('14'), partition p15 values ('15'), partition p16 values ('16'), partition p17 values ('17'), partition p18 values ('18'), partition p19 values ('19'), partition p20 values ('20'), partition p21 values ('21'), partition p22 values ('22'), partition p23 values ('23'), partition p24 values ('24'), partition p25 values ('25'), partition p26 values ('26'), partition p27 values ('27'), partition p28 values ('28'), partition p29 values ('29'), partition p30 values ('30'), partition p31 values ('31'), partition p32 values ('32'), partition p33 values ('33'), partition p34 values ('34'), partition p35 values ('35'), partition p36 values ('36'), partition p37 values ('37'), partition p38 values ('38'), partition p39 values ('39'), partition p40 values ('40'), partition p41 values ('41'), partition p42 values ('42'), partition p43 values ('43'), partition p44 values ('44'), partition p45 values ('45'), partition p46 values ('46'), partition p47 values ('47'), partition p48 values ('48'), partition p49 values ('49'), partition p50 values ('50'), partition p51 values ('51'), partition p52 values ('52'), partition p53 values ('53'), partition p54 values ('54'), partition p55 values ('55'), partition p56 values ('56'), partition p57 values ('57'), partition p58 values ('58'), partition p59 values ('59'), partition p60 values ('60'), partition p61 values ('61'), partition p62 values ('62'), partition p63 values ('63'), partition p64 values ('64'), partition p65 values ('65'), partition p66 values ('66'), partition p67 values ('67'), partition p68 values ('68'), partition p69 values ('69'), partition p70 values ('70'), partition p71 values ('71'), partition p72 values ('72'), partition p73 values ('73'), partition p74 values ('74'), partition p75 values ('75'), partition p76 values ('76'), partition p77 values ('77'), partition p78 values ('78'), partition p79 values ('79'), partition p80 values ('80'), partition p81 values ('81'), partition p82 values ('82'), partition p83 values ('83'), partition p84 values ('84'), partition p85 values ('85'), partition p86 values ('86'), partition p87 values ('87'), partition p88 values ('88'), partition p89 values ('89'), partition p90 values ('90'), partition p91 values ('91'), partition p92 values ('92'), partition p93 values ('93'), partition p94 values ('94'), partition p95 values ('95'), partition p96 values ('96'), partition p97 values ('97'), partition p98 values ('98'), partition p99 values ('99'));
ob1.oblog.next;
[R0] record_type:EDDL;[R0] db_name:oracle.OBTEST;[R0] table_name:;[R0] column_count:1;[R0] column_name:ddl;[R0] ddl_stmt_str: CREATE TABLE pmt_biz_ext_info_001 ( payment_id_prefix varchar(1) DEFAULT NULL , payment_id varchar(64) NOT NULL , out_biz_context varchar(4000) DEFAULT NULL , env_context varchar(2048) DEFAULT NULL , gmt_create timestamp(6) NOT NULL , sec_context varchar(4000) DEFAULT NULL , partition_id varchar(8) GENERATED ALWAYS AS (substr(payment_id,18,2)) VIRTUAL, PRIMARY KEY (payment_id)) TABLEGROUP = obpay_tablegroup_001 partition by list (partition_id) (partition p0 values ('00'), partition p1 values ('01'), partition p2 values ('02'), partition p3 values ('03'), partition p4 values ('04'), partition p5 values ('05'), partition p6 values ('06'), partition p7 values ('07'), partition p8 values ('08'), partition p9 values ('09'), partition p10 values ('10'), partition p11 values ('11'), partition p12 values ('12'), partition p13 values ('13'), partition p14 values ('14'), partition p15 values ('15'), partition p16 values ('16'), partition p17 values ('17'), partition p18 values ('18'), partition p19 values ('19'), partition p20 values ('20'), partition p21 values ('21'), partition p22 values ('22'), partition p23 values ('23'), partition p24 values ('24'), partition p25 values ('25'), partition p26 values ('26'), partition p27 values ('27'), partition p28 values ('28'), partition p29 values ('29'), partition p30 values ('30'), partition p31 values ('31'), partition p32 values ('32'), partition p33 values ('33'), partition p34 values ('34'), partition p35 values ('35'), partition p36 values ('36'), partition p37 values ('37'), partition p38 values ('38'), partition p39 values ('39'), partition p40 values ('40'), partition p41 values ('41'), partition p42 values ('42'), partition p43 values ('43'), partition p44 values ('44'), partition p45 values ('45'), partition p46 values ('46'), partition p47 values ('47'), partition p48 values ('48'), partition p49 values ('49'), partition p50 values ('50'), partition p51 values ('51'), partition p52 values ('52'), partition p53 values ('53'), partition p54 values ('54'), partition p55 values ('55'), partition p56 values ('56'), partition p57 values ('57'), partition p58 values ('58'), partition p59 values ('59'), partition p60 values ('60'), partition p61 values ('61'), partition p62 values ('62'), partition p63 values ('63'), partition p64 values ('64'), partition p65 values ('65'), partition p66 values ('66'), partition p67 values ('67'), partition p68 values ('68'), partition p69 values ('69'), partition p70 values ('70'), partition p71 values ('71'), partition p72 values ('72'), partition p73 values ('73'), partition p74 values ('74'), partition p75 values ('75'), partition p76 values ('76'), partition p77 values ('77'), partition p78 values ('78'), partition p79 values ('79'), partition p80 values ('80'), partition p81 values ('81'), partition p82 values ('82'), partition p83 values ('83'), partition p84 values ('84'), partition p85 values ('85'), partition p86 values ('86'), partition p87 values ('87'), partition p88 values ('88'), partition p89 values ('89'), partition p90 values ('90'), partition p91 values ('91'), partition p92 values ('92'), partition p93 values ('93'), partition p94 values ('94'), partition p95 values ('95'), partition p96 values ('96'), partition p97 values ('97'), partition p98 values ('98'), partition p99 values ('99'));[R0] ddl_stmt_len: 3338;
CREATE TABLE pmt_biz_ext_info_003 ( payment_id_prefix varchar(1) DEFAULT NULL , payment_id varchar(64) NOT NULL , out_biz_context varchar(4000) DEFAULT NULL , env_context varchar(2048) DEFAULT NULL , gmt_create timestamp(6) NOT NULL , sec_context varchar(4000) DEFAULT NULL , partition_id varchar(8) GENERATED ALWAYS AS (substr(payment_id,18,2)) VIRTUAL, PRIMARY KEY (payment_id)) TABLEGROUP = obpay_tablegroup_001 partition by list (partition_id) (partition payment_id_prefix_partition_abcdabcdabcdabcdabcdabcd0 values ('00'), partition payment_id_prefix_partition_abcdabcdabcdabcdabcdabcd1 values ('01'), partition payment_id_prefix_partition_abcdabcdabcdabcdabcdabcd2 values ('02'), partition payment_id_prefix_partition_abcdabcdabcdabcdabcdabcd3 values ('03'), partition payment_id_prefix_partition_abcdabcdabcdabcdabcdabcd4 values ('04'), partition  payment_id_prefix_partition_abcdabcdabcdabcdabcdabcd5 values ('05'), partition payment_id_prefix_partition_abcdabcdabcdabcdabcdabcd6 values ('06'), partition payment_id_prefix_partition_abcdabcdabcdabcdabcdabcd7 values ('07'), partition payment_id_prefix_partition_abcdabcdabcdabcdabcdabcd8 values ('08'), partition payment_id_prefix_partition_abcdabcdabcdabcdabcdabcd9 values ('09'), partition payment_id_prefix_partition_abcdabcdabcdabcdabcdabcd10 values ('10'), partition payment_id_prefix_partition_abcdabcdabcdabcdabcdabcd11 values ('11'), partition payment_id_prefix_partition_abcdabcdabcdabcdabcdabcd12 values ('12'), partition payment_id_prefix_partition_abcdabcdabcdabcdabcdabcd13 values ('13'), partition payment_id_prefix_partition_abcdabcdabcdabcdabcdabcd14 values ('14'), partition payment_id_prefix_partition_abcdabcdabcdabcdabcdabcd15 values ('15'), partition payment_id_prefix_partition_abcdabcdabcdabcdabcdabcd16 values ('16'), partition payment_id_prefix_partition_abcdabcdabcdabcdabcdabcd17 values ('17'), partition payment_id_prefix_partition_abcdabcdabcdabcdabcdabcd18 values ('18'), partition payment_id_prefix_partition_abcdabcdabcdabcdabcdabcd19 values ('19'), partition payment_id_prefix_partition_abcdabcdabcdabcdabcdabcd20 values ('20'), partition payment_id_prefix_partition_abcdabcdabcdabcdabcdabcd21 values ('21'), partition payment_id_prefix_partition_abcdabcdabcdabcdabcdabcd22 values ('22'), partition payment_id_prefix_partition_abcdabcdabcdabcdabcdabcd23 values ('23'), partition payment_id_prefix_partition_abcdabcdabcdabcdabcdabcd24 values ('24'), partition payment_id_prefix_partition_abcdabcdabcdabcdabcdabcd25 values ('25'), partition payment_id_prefix_partition_abcdabcdabcdabcdabcdabcd26 values ('26'), partition payment_id_prefix_partition_abcdabcdabcdabcdabcdabcd27 values ('27'), partition payment_id_prefix_partition_abcdabcdabcdabcdabcdabcd28 values ('28'), partition payment_id_prefix_partition_abcdabcdabcdabcdabcdabcd29 values ('29'), partition payment_id_prefix_partition_abcdabcdabcdabcdabcdabcd30 values ('30'), partition payment_id_prefix_partition_abcdabcdabcdabcdabcdabcd31 values ('31'), partition payment_id_prefix_partition_abcdabcdabcdabcdabcdabcd32 values ('32'), partition payment_id_prefix_partition_abcdabcdabcdabcdabcdabcd33 values ('33'), partition payment_id_prefix_partition_abcdabcdabcdabcdabcdabcd34 values ('34'), partition payment_id_prefix_partition_abcdabcdabcdabcdabcdabcd35 values ('35'), partition payment_id_prefix_partition_abcdabcdabcdabcdabcdabcd36 values ('36'), partition payment_id_prefix_partition_abcdabcdabcdabcdabcdabcd37 values ('37'), partition payment_id_prefix_partition_abcdabcdabcdabcdabcdabcd38 values ('38'), partition payment_id_prefix_partition_abcdabcdabcdabcdabcdabcd39 values ('39'), partition payment_id_prefix_partition_abcdabcdabcdabcdabcdabcd40 values ('40'), partition payment_id_prefix_partition_abcdabcdabcdabcdabcdabcd41 values ('41'), partition payment_id_prefix_partition_abcdabcdabcdabcdabcdabcd42 values ('42'), partition payment_id_prefix_partition_abcdabcdabcdabcdabcdabcd43 values ('43'), partition payment_id_prefix_partition_abcdabcdabcdabcdabcdabcd44 values ('44'), partition payment_id_prefix_partition_abcdabcdabcdabcdabcdabcd45 values ('45'), partition payment_id_prefix_partition_abcdabcdabcdabcdabcdabcd46 values ('46'), partition payment_id_prefix_partition_abcdabcdabcdabcdabcdabcd47 values ('47'), partition payment_id_prefix_partition_abcdabcdabcdabcdabcdabcd48 values ('48'), partition payment_id_prefix_partition_abcdabcdabcdabcdabcdabcd49 values ('49'), partition payment_id_prefix_partition_abcdabcdabcdabcdabcdabcd50 values ('50'), partition payment_id_prefix_partition_abcdabcdabcdabcdabcdabcd51 values ('51'), partition payment_id_prefix_partition_abcdabcdabcdabcdabcdabcd52 values ('52'), partition payment_id_prefix_partition_abcdabcdabcdabcdabcdabcd53 values ('53'), partition payment_id_prefix_partition_abcdabcdabcdabcdabcdabcd54 values ('54'), partition payment_id_prefix_partition_abcdabcdabcdabcdabcdabcd55 values ('55'), partition payment_id_prefix_partition_abcdabcdabcdabcdabcdabcd56 values ('56'), partition payment_id_prefix_partition_abcdabcdabcdabcdabcdabcd57 values ('57'), partition payment_id_prefix_partition_abcdabcdabcdabcdabcdabcd58 values ('58'), partition payment_id_prefix_partition_abcdabcdabcdabcdabcdabcd59 values ('59'), partition payment_id_prefix_partition_abcdabcdabcdabcdabcdabcd60 values ('60'), partition payment_id_prefix_partition_abcdabcdabcdabcdabcdabcd61 values ('61'), partition payment_id_prefix_partition_abcdabcdabcdabcdabcdabcd62 values ('62'), partition payment_id_prefix_partition_abcdabcdabcdabcdabcdabcd63 values ('63'), partition payment_id_prefix_partition_abcdabcdabcdabcdabcdabcd64 values ('64'), partition payment_id_prefix_partition_abcdabcdabcdabcdabcdabcd65 values ('65'), partition payment_id_prefix_partition_abcdabcdabcdabcdabcdabcd66 values ('66'), partition payment_id_prefix_partition_abcdabcdabcdabcdabcdabcd67 values ('67'), partition payment_id_prefix_partition_abcdabcdabcdabcdabcdabcd68 values ('68'), partition payment_id_prefix_partition_abcdabcdabcdabcdabcdabcd69 values ('69'), partition payment_id_prefix_partition_abcdabcdabcdabcdabcdabcd70 values ('70'), partition payment_id_prefix_partition_abcdabcdabcdabcdabcdabcd71 values ('71'), partition payment_id_prefix_partition_abcdabcdabcdabcdabcdabcd72 values ('72'), partition payment_id_prefix_partition_abcdabcdabcdabcdabcdabcd73 values ('73'), partition payment_id_prefix_partition_abcdabcdabcdabcdabcdabcd74 values ('74'), partition payment_id_prefix_partition_abcdabcdabcdabcdabcdabcd75 values ('75'), partition payment_id_prefix_partition_abcdabcdabcdabcdabcdabcd76 values ('76'), partition payment_id_prefix_partition_abcdabcdabcdabcdabcdabcd77 values ('77'), partition payment_id_prefix_partition_abcdabcdabcdabcdabcdabcd78 values ('78'), partition payment_id_prefix_partition_abcdabcdabcdabcdabcdabcd79 values ('79'), partition payment_id_prefix_partition_abcdabcdabcdabcdabcdabcd80 values ('80'), partition payment_id_prefix_partition_abcdabcdabcdabcdabcdabcd81 values ('81'), partition payment_id_prefix_partition_abcdabcdabcdabcdabcdabcd82 values ('82'), partition payment_id_prefix_partition_abcdabcdabcdabcdabcdabcd83 values ('83'), partition payment_id_prefix_partition_abcdabcdabcdabcdabcdabcd84 values ('84'), partition payment_id_prefix_partition_abcdabcdabcdabcdabcdabcd85 values ('85'), partition payment_id_prefix_partition_abcdabcdabcdabcdabcdabcd86 values ('86'), partition payment_id_prefix_partition_abcdabcdabcdabcdabcdabcd87 values ('87'), partition payment_id_prefix_partition_abcdabcdabcdabcdabcdabcd88 values ('88'), partition payment_id_prefix_partition_abcdabcdabcdabcdabcdabcd89 values ('89'), partition payment_id_prefix_partition_abcdabcdabcdabcdabcdabcd90 values ('90'), partition payment_id_prefix_partition_abcdabcdabcdabcdabcdabcd91 values ('91'), partition payment_id_prefix_partition_abcdabcdabcdabcdabcdabcd92 values ('92'), partition payment_id_prefix_partition_abcdabcdabcdabcdabcdabcd93 values ('93'), partition payment_id_prefix_partition_abcdabcdabcdabcdabcdabcd94 values ('94'), partition payment_id_prefix_partition_abcdabcdabcdabcdabcdabcd95 values ('95'), partition payment_id_prefix_partition_abcdabcdabcdabcdabcdabcd96 values ('96'), partition payment_id_prefix_partition_abcdabcdabcdabcdabcdabcd97 values ('97'), partition payment_id_prefix_partition_abcdabcdabcdabcdabcdabcd98 values ('98'), partition payment_id_prefix_partition_abcdabcdabcdabcdabcdabcd99 values ('99'));
ob1.oblog.next;
[R0] record_type:EDDL;[R0] db_name:oracle.OBTEST;[R0] table_name:;[R0] column_count:1;[R0] column_name:ddl;[R0] ddl_stmt_str: CREATE TABLE pmt_biz_ext_info_003 ( payment_id_prefix varchar(1) DEFAULT NULL , payment_id varchar(64) NOT NULL , out_biz_context varchar(4000) DEFAULT NULL , env_context varchar(2048) DEFAULT NULL , gmt_create timestamp(6) NOT NULL , sec_context varchar(4000) DEFAULT NULL , partition_id varchar(8) GENERATED ALWAYS AS (substr(payment_id,18,2)) VIRTUAL, PRIMARY KEY (payment_id)) TABLEGROUP = obpay_tablegroup_001 partition by list (partition_id) (partition payment_id_prefix_partition_abcdabcdabcdabcdabcdabcd0 values ('00'), partition payment_id_prefix_partition_abcdabcdabcdabcdabcdabcd1 values ('01'), partition payment_id_prefix_partition_abcdabcdabcdabcdabcdabcd2 values ('02'), partition payment_id_prefix_partition_abcdabcdabcdabcdabcdabcd3 values ('03'), partition payment_id_prefix_partition_abcdabcdabcdabcdabcdabcd4 values ('04'), partition  payment_id_prefix_partition_abcdabcdabcdabcdabcdabcd5 values ('05'), partition payment_id_prefix_partition_abcdabcdabcdabcdabcdabcd6 values ('06'), partition payment_id_prefix_partition_abcdabcdabcdabcdabcdabcd7 values ('07'), partition payment_id_prefix_partition_abcdabcdabcdabcdabcdabcd8 values ('08'), partition payment_id_prefix_partition_abcdabcdabcdabcdabcdabcd9 values ('09'), partition payment_id_prefix_partition_abcdabcdabcdabcdabcdabcd10 values ('10'), partition payment_id_prefix_partition_abcdabcdabcdabcdabcdabcd11 values ('11'), partition payment_id_prefix_partition_abcdabcdabcdabcdabcdabcd12 values ('12'), partition payment_id_prefix_partition_abcdabcdabcdabcdabcdabcd13 values ('13'), partition payment_id_prefix_partition_abcdabcdabcdabcdabcdabcd14 values ('14'), partition payment_id_prefix_partition_abcdabcdabcdabcdabcdabcd15 values ('15'), partition payment_id_prefix_partition_abcdabcdabcdabcdabcdabcd16 values ('16'), partition payment_id_prefix_partition_abcdabcdabcdabcdabcdabcd17 values ('17'), partition payment_id_prefix_partition_abcdabcdabcdabcdabcdabcd18 values ('18'), partition payment_id_prefix_partition_abcdabcdabcdabcdabcdabcd19 values ('19'), partition payment_id_prefix_partition_abcdabcdabcdabcdabcdabcd20 values ('20'), partition payment_id_prefix_partition_abcdabcdabcdabcdabcdabcd21 values ('21'), partition payment_id_prefix_partition_abcdabcdabcdabcdabcdabcd22 values ('22'), partition payment_id_prefix_partition_abcdabcdabcdabcdabcdabcd23 values ('23'), partition payment_id_prefix_partition_abcdabcdabcdabcdabcdabcd24 values ('24'), partition payment_id_prefix_partition_abcdabcdabcdabcdabcdabcd25 values ('25'), partition payment_id_prefix_partition_abcdabcdabcdabcdabcdabcd26 values ('26'), partition payment_id_prefix_partition_abcdabcdabcdabcdabcdabcd27 values ('27'), partition payment_id_prefix_partition_abcdabcdabcdabcdabcdabcd28 values ('28'), partition payment_id_prefix_partition_abcdabcdabcdabcdabcdabcd29 values ('29'), partition payment_id_prefix_partition_abcdabcdabcdabcdabcdabcd30 values ('30'), partition payment_id_prefix_partition_abcdabcdabcdabcdabcdabcd31 values ('31'), partition payment_id_prefix_partition_abcdabcdabcdabcdabcdabcd32 values ('32'), partition payment_id_prefix_partition_abcdabcdabcdabcdabcdabcd33 values ('33'), partition payment_id_prefix_partition_abcdabcdabcdabcdabcdabcd34 values ('34'), partition payment_id_prefix_partition_abcdabcdabcdabcdabcdabcd35 values ('35'), partition payment_id_prefix_partition_abcdabcdabcdabcdabcdabcd36 values ('36'), partition payment_id_prefix_partition_abcdabcdabcdabcdabcdabcd37 values ('37'), partition payment_id_prefix_partition_abcdabcdabcdabcdabcdabcd38 values ('38'), partition payment_id_prefix_partition_abcdabcdabcdabcdabcdabcd39 values ('39'), partition payment_id_prefix_partition_abcdabcdabcdabcdabcdabcd40 values ('40'), partition payment_id_prefix_partition_abcdabcdabcdabcdabcdabcd41 values ('41'), partition payment_id_prefix_partition_abcdabcdabcdabcdabcdabcd42 values ('42'), partition payment_id_prefix_partition_abcdabcdabcdabcdabcdabcd43 values ('43'), partition payment_id_prefix_partition_abcdabcdabcdabcdabcdabcd44 values ('44'), partition payment_id_prefix_partition_abcdabcdabcdabcdabcdabcd45 values ('45'), partition payment_id_prefix_partition_abcdabcdabcdabcdabcdabcd46 values ('46'), partition payment_id_prefix_partition_abcdabcdabcdabcdabcdabcd47 values ('47'), partition payment_id_prefix_partition_abcdabcdabcdabcdabcdabcd48 values ('48'), partition payment_id_prefix_partition_abcdabcdabcdabcdabcdabcd49 values ('49'), partition payment_id_prefix_partition_abcdabcdabcdabcdabcdabcd50 values ('50'), partition payment_id_prefix_partition_abcdabcdabcdabcdabcdabcd51 values ('51'), partition payment_id_prefix_partition_abcdabcdabcdabcdabcdabcd52 values ('52'), partition payment_id_prefix_partition_abcdabcdabcdabcdabcdabcd53 values ('53'), partition payment_id_prefix_partition_abcdabcdabcdabcdabcdabcd54 values ('54'), partition payment_id_prefix_partition_abcdabcdabcdabcdabcdabcd55 values ('55'), partition payment_id_prefix_partition_abcdabcdabcdabcdabcdabcd56 values ('56'), partition payment_id_prefix_partition_abcdabcdabcdabcdabcdabcd57 values ('57'), partition payment_id_prefix_partition_abcdabcdabcdabcdabcdabcd58 values ('58'), partition payment_id_prefix_partition_abcdabcdabcdabcdabcdabcd59 values ('59'), partition payment_id_prefix_partition_abcdabcdabcdabcdabcdabcd60 values ('60'), partition payment_id_prefix_partition_abcdabcdabcdabcdabcdabcd61 values ('61'), partition payment_id_prefix_partition_abcdabcdabcdabcdabcdabcd62 values ('62'), partition payment_id_prefix_partition_abcdabcdabcdabcdabcdabcd63 values ('63'), partition payment_id_prefix_partition_abcdabcdabcdabcdabcdabcd64 values ('64'), partition payment_id_prefix_partition_abcdabcdabcdabcdabcdabcd65 values ('65'), partition payment_id_prefix_partition_abcdabcdabcdabcdabcdabcd66 values ('66'), partition payment_id_prefix_partition_abcdabcdabcdabcdabcdabcd67 values ('67'), partition payment_id_prefix_partition_abcdabcdabcdabcdabcdabcd68 values ('68'), partition payment_id_prefix_partition_abcdabcdabcdabcdabcdabcd69 values ('69'), partition payment_id_prefix_partition_abcdabcdabcdabcdabcdabcd70 values ('70'), partition payment_id_prefix_partition_abcdabcdabcdabcdabcdabcd71 values ('71'), partition payment_id_prefix_partition_abcdabcdabcdabcdabcdabcd72 values ('72'), partition payment_id_prefix_partition_abcdabcdabcdabcdabcdabcd73 values ('73'), partition payment_id_prefix_partition_abcdabcdabcdabcdabcdabcd74 values ('74'), partition payment_id_prefix_partition_abcdabcdabcdabcdabcdabcd75 values ('75'), partition payment_id_prefix_partition_abcdabcdabcdabcdabcdabcd76 values ('76'), partition payment_id_prefix_partition_abcdabcdabcdabcdabcdabcd77 values ('77'), partition payment_id_prefix_partition_abcdabcdabcdabcdabcdabcd78 values ('78'), partition payment_id_prefix_partition_abcdabcdabcdabcdabcdabcd79 values ('79'), partition payment_id_prefix_partition_abcdabcdabcdabcdabcdabcd80 values ('80'), partition payment_id_prefix_partition_abcdabcdabcdabcdabcdabcd81 values ('81'), partition payment_id_prefix_partition_abcdabcdabcdabcdabcdabcd82 values ('82'), partition payment_id_prefix_partition_abcdabcdabcdabcdabcdabcd83 values ('83'), partition payment_id_prefix_partition_abcdabcdabcdabcdabcdabcd84 values ('84'), partition payment_id_prefix_partition_abcdabcdabcdabcdabcdabcd85 values ('85'), partition payment_id_prefix_partition_abcdabcdabcdabcdabcdabcd86 values ('86'), partition payment_id_prefix_partition_abcdabcdabcdabcdabcdabcd87 values ('87'), partition payment_id_prefix_partition_abcdabcdabcdabcdabcdabcd88 values ('88'), partition payment_id_prefix_partition_abcdabcdabcdabcdabcdabcd89 values ('89'), partition payment_id_prefix_partition_abcdabcdabcdabcdabcdabcd90 values ('90'), partition payment_id_prefix_partition_abcdabcdabcdabcdabcdabcd91 values ('91'), partition payment_id_prefix_partition_abcdabcdabcdabcdabcdabcd92 values ('92'), partition payment_id_prefix_partition_abcdabcdabcdabcdabcdabcd93 values ('93'), partition payment_id_prefix_partition_abcdabcdabcdabcdabcdabcd94 values ('94'), partition payment_id_prefix_partition_abcdabcdabcdabcdabcdabcd95 values ('95'), partition payment_id_prefix_partition_abcdabcdabcdabcdabcdabcd96 values ('96'), partition payment_id_prefix_partition_abcdabcdabcdabcdabcdabcd97 values ('97'), partition payment_id_prefix_partition_abcdabcdabcdabcdabcdabcd98 values ('98'), partition payment_id_prefix_partition_abcdabcdabcdabcdabcdabcd99 values ('99'));[R0] ddl_stmt_len: 8439;
ob1.oblog.stop;
alter tenant cdc_mysql set variables max_allowed_packet=1073741824;
set ob_trx_timeout=100000000;
set ob_query_timeout=100000000;
set ob_default_lob_inrow_threshold = 4096;
create database json_basic_db1;
use json_basic_db1;
ob1.oblog.set_extra_argument -m;
ob1.oblog.gen_conf tb_white_list=sys.oblog*.*|cdc_mysql.*.*|oracle.*.* log_level=DEBUG;
ob1.oblog.restart;
CREATE TABLE t1(pk int primary key, json_col_1 JSON);
ob1.oblog.next;
[R0] record_type:EDDL;[R0] db_name:cdc_mysql.json_basic_db1;[R0] table_name:;[R0] column_count:1;[R0] column_name:ddl;[R0] ddl_stmt_str: CREATE TABLE t1(pk int primary key, json_col_1 JSON);[R0] ddl_stmt_len: 52;
INSERT INTO t1 VALUES(1, '{"name": "john", "age": 100, "likes": [1, true, null]}');
select md5(json_col_1) from t1 where pk = 1;
md5(json_col_1)
87054834bd2d10a738cf45103da08061
ob1.oblog.next;
[R0] BEGIN;[R0] org_cluster_id:1;[R1] record_type:INSERT;[R1] database_name:cdc_mysql.json_basic_db1;[R1] table_name:t1;[R1] log_event:true;[R1] column_count:2;[R1] source_category:SRC_FULL_RECORDED;[R1] source_type:SRC_OCEANBASE_1_0;[R1] has_pk:true;[R1] pk_info:(0);[R1] pks:pk;[R1] has_uk:false;[R1] uk_info:(null);[R1] uks:(null);[R1] [C1] column_name:pk;[R1] [C1] column_type:MYSQL_TYPE_LONG;[R1] [C1] column_is_rowkey:true;[R1] [C1] column_is_signed:true;[R1] [C1] column_encoding:binary;[R1] [C1] column_is_not_null:true;[R1] [C1] column_value_new:[1](1);[R1] [C2] column_name:json_col_1;[R1] [C2] column_type:MYSQL_TYPE_JSON;[R1] [C2] column_is_rowkey:false;[R1] [C2] column_is_signed:true;[R1] [C2] column_encoding:utf8mb4;[R1] [C2] column_is_not_null:false;[R1] [C2] column_value_new_md5:[87054834bd2d10a738cf45103da08061](54);$[R2] COMMIT;
update t1 set json_col_1 = '{"name": "john", "age": 100, "likes": ["1", "true", null]}' where pk = 1;
select md5(json_col_1) from t1 where pk = 1;
md5(json_col_1)
8625d1293b3b9e0a95768965f2d4f66b
ob1.oblog.next;
[R0] BEGIN;[R0] org_cluster_id:1;[R1] record_type:UPDATE;[R1] database_name:cdc_mysql.json_basic_db1;[R1] table_name:t1;[R1] log_event:true;[R1] column_count:2;[R1] source_category:SRC_FULL_RECORDED;[R1] source_type:SRC_OCEANBASE_1_0;[R1] has_pk:true;[R1] pk_info:(0);[R1] pks:pk;[R1] has_uk:false;[R1] uk_info:(null);[R1] uks:(null);[R1] [C1] column_name:pk;[R1] [C1] column_type:MYSQL_TYPE_LONG;[R1] [C1] column_is_rowkey:true;[R1] [C1] column_is_signed:true;[R1] [C1] column_encoding:binary;[R1] [C1] column_is_not_null:true;[R1] [C1] column_value_new:[1](1);[R1] [C1] column_value_old:[1](1);[R1] [C2] column_name:json_col_1;[R1] [C2] column_type:MYSQL_TYPE_JSON;[R1] [C2] column_is_rowkey:false;[R1] [C2] column_is_signed:true;[R1] [C2] column_encoding:utf8mb4;[R1] [C2] column_is_not_null:false;[R1] [C2] column_value_new_md5:[8625d1293b3b9e0a95768965f2d4f66b](58);[R1] [C2] column_value_old_md5:[87054834bd2d10a738cf45103da08061](54);$[R2] COMMIT;
INSERT INTO t1 VALUES(2, '{"name": "mike", "age": 10, "likes": ["fish", 1.2, "null"]}');
select md5(json_col_1) from t1 where pk = 2;
md5(json_col_1)
27e200eaaa8f5934efdd93faf10e8ad2
ob1.oblog.next;
[R0] BEGIN;[R0] org_cluster_id:1;[R1] record_type:INSERT;[R1] database_name:cdc_mysql.json_basic_db1;[R1] table_name:t1;[R1] log_event:true;[R1] column_count:2;[R1] source_category:SRC_FULL_RECORDED;[R1] source_type:SRC_OCEANBASE_1_0;[R1] has_pk:true;[R1] pk_info:(0);[R1] pks:pk;[R1] has_uk:false;[R1] uk_info:(null);[R1] uks:(null);[R1] [C1] column_name:pk;[R1] [C1] column_type:MYSQL_TYPE_LONG;[R1] [C1] column_is_rowkey:true;[R1] [C1] column_is_signed:true;[R1] [C1] column_encoding:binary;[R1] [C1] column_is_not_null:true;[R1] [C1] column_value_new:[2](1);[R1] [C2] column_name:json_col_1;[R1] [C2] column_type:MYSQL_TYPE_JSON;[R1] [C2] column_is_rowkey:false;[R1] [C2] column_is_signed:true;[R1] [C2] column_encoding:utf8mb4;[R1] [C2] column_is_not_null:false;[R1] [C2] column_value_new_md5:[27e200eaaa8f5934efdd93faf10e8ad2](59);$[R2] COMMIT;
update t1 set json_col_1 = CONCAT('[',REPEAT('"a",',20001),'"a"]') where pk = 2;
select md5(json_col_1) from t1 where pk = 2;
md5(json_col_1)
6401f9c4c119797cc436200b4f87914a
ob1.oblog.next;
[R0] BEGIN;[R0] org_cluster_id:1;[R1] record_type:UPDATE;[R1] database_name:cdc_mysql.json_basic_db1;[R1] table_name:t1;[R1] log_event:true;[R1] column_count:2;[R1] source_category:SRC_FULL_RECORDED;[R1] source_type:SRC_OCEANBASE_1_0;[R1] has_pk:true;[R1] pk_info:(0);[R1] pks:pk;[R1] has_uk:false;[R1] uk_info:(null);[R1] uks:(null);[R1] [C1] column_name:pk;[R1] [C1] column_type:MYSQL_TYPE_LONG;[R1] [C1] column_is_rowkey:true;[R1] [C1] column_is_signed:true;[R1] [C1] column_encoding:binary;[R1] [C1] column_is_not_null:true;[R1] [C1] column_value_new:[2](1);[R1] [C1] column_value_old:[2](1);[R1] [C2] column_name:json_col_1;[R1] [C2] column_type:MYSQL_TYPE_JSON;[R1] [C2] column_is_rowkey:false;[R1] [C2] column_is_signed:true;[R1] [C2] column_encoding:utf8mb4;[R1] [C2] column_is_not_null:false;[R1] [C2] column_value_new_md5:[6401f9c4c119797cc436200b4f87914a](100010);[R1] [C2] column_value_old_md5:[27e200eaaa8f5934efdd93faf10e8ad2](59);$[R2] COMMIT;
INSERT INTO t1 VALUES(3, CONCAT('[',REPEAT('"a",',20002),'"a"]'));
select md5(json_col_1) from t1 where pk = 3;
md5(json_col_1)
8cd5575d4dd208134cc2987130cb57ae
ob1.oblog.next;
[R0] BEGIN;[R0] org_cluster_id:1;[R1] record_type:INSERT;[R1] database_name:cdc_mysql.json_basic_db1;[R1] table_name:t1;[R1] log_event:true;[R1] column_count:2;[R1] source_category:SRC_FULL_RECORDED;[R1] source_type:SRC_OCEANBASE_1_0;[R1] has_pk:true;[R1] pk_info:(0);[R1] pks:pk;[R1] has_uk:false;[R1] uk_info:(null);[R1] uks:(null);[R1] [C1] column_name:pk;[R1] [C1] column_type:MYSQL_TYPE_LONG;[R1] [C1] column_is_rowkey:true;[R1] [C1] column_is_signed:true;[R1] [C1] column_encoding:binary;[R1] [C1] column_is_not_null:true;[R1] [C1] column_value_new:[3](1);[R1] [C2] column_name:json_col_1;[R1] [C2] column_type:MYSQL_TYPE_JSON;[R1] [C2] column_is_rowkey:false;[R1] [C2] column_is_signed:true;[R1] [C2] column_encoding:utf8mb4;[R1] [C2] column_is_not_null:false;[R1] [C2] column_value_new_md5:[8cd5575d4dd208134cc2987130cb57ae](100015);$[R2] COMMIT;
update t1 set json_col_1 = CONCAT('[',REPEAT('"b",',200003),'"b"]') where pk = 3;
select md5(json_col_1) from t1 where pk = 3;
md5(json_col_1)
e88f2553acd2e5269482ec943c9787ed
ob1.oblog.next;
[R0] BEGIN;[R0] org_cluster_id:1;[R1] record_type:UPDATE;[R1] database_name:cdc_mysql.json_basic_db1;[R1] table_name:t1;[R1] log_event:true;[R1] column_count:2;[R1] source_category:SRC_FULL_RECORDED;[R1] source_type:SRC_OCEANBASE_1_0;[R1] has_pk:true;[R1] pk_info:(0);[R1] pks:pk;[R1] has_uk:false;[R1] uk_info:(null);[R1] uks:(null);[R1] [C1] column_name:pk;[R1] [C1] column_type:MYSQL_TYPE_LONG;[R1] [C1] column_is_rowkey:true;[R1] [C1] column_is_signed:true;[R1] [C1] column_encoding:binary;[R1] [C1] column_is_not_null:true;[R1] [C1] column_value_new:[3](1);[R1] [C1] column_value_old:[3](1);[R1] [C2] column_name:json_col_1;[R1] [C2] column_type:MYSQL_TYPE_JSON;[R1] [C2] column_is_rowkey:false;[R1] [C2] column_is_signed:true;[R1] [C2] column_encoding:utf8mb4;[R1] [C2] column_is_not_null:false;[R1] [C2] column_value_new_md5:[e88f2553acd2e5269482ec943c9787ed](1000020);[R1] [C2] column_value_old_md5:[8cd5575d4dd208134cc2987130cb57ae](100015);$[R2] COMMIT;
update t1 set json_col_1 = CONCAT('[',REPEAT('"a",',50),'"a"]') where pk = 3;
select md5(json_col_1) from t1 where pk = 3;
md5(json_col_1)
a06176f33f84bd049ab30a947c7208fb
ob1.oblog.next;
[R0] BEGIN;[R0] org_cluster_id:1;[R1] record_type:UPDATE;[R1] database_name:cdc_mysql.json_basic_db1;[R1] table_name:t1;[R1] log_event:true;[R1] column_count:2;[R1] source_category:SRC_FULL_RECORDED;[R1] source_type:SRC_OCEANBASE_1_0;[R1] has_pk:true;[R1] pk_info:(0);[R1] pks:pk;[R1] has_uk:false;[R1] uk_info:(null);[R1] uks:(null);[R1] [C1] column_name:pk;[R1] [C1] column_type:MYSQL_TYPE_LONG;[R1] [C1] column_is_rowkey:true;[R1] [C1] column_is_signed:true;[R1] [C1] column_encoding:binary;[R1] [C1] column_is_not_null:true;[R1] [C1] column_value_new:[3](1);[R1] [C1] column_value_old:[3](1);[R1] [C2] column_name:json_col_1;[R1] [C2] column_type:MYSQL_TYPE_JSON;[R1] [C2] column_is_rowkey:false;[R1] [C2] column_is_signed:true;[R1] [C2] column_encoding:utf8mb4;[R1] [C2] column_is_not_null:false;[R1] [C2] column_value_new_md5:[a06176f33f84bd049ab30a947c7208fb](255);[R1] [C2] column_value_old_origin: PADDING;[R1] [C2] column_value_old_md5:[NULL](0);$[R2] COMMIT;
delete from t1 where pk = 3;
ob1.oblog.next;
[R0] BEGIN;[R0] org_cluster_id:1;[R1] record_type:DELETE;[R1] database_name:cdc_mysql.json_basic_db1;[R1] table_name:t1;[R1] log_event:true;[R1] column_count:2;[R1] source_category:SRC_FULL_RECORDED;[R1] source_type:SRC_OCEANBASE_1_0;[R1] has_pk:true;[R1] pk_info:(0);[R1] pks:pk;[R1] has_uk:false;[R1] uk_info:(null);[R1] uks:(null);[R1] [C1] column_name:pk;[R1] [C1] column_type:MYSQL_TYPE_LONG;[R1] [C1] column_is_rowkey:true;[R1] [C1] column_is_signed:true;[R1] [C1] column_encoding:binary;[R1] [C1] column_is_not_null:true;[R1] [C1] column_value_old:[3](1);[R1] [C2] column_name:json_col_1;[R1] [C2] column_type:MYSQL_TYPE_JSON;[R1] [C2] column_is_rowkey:false;[R1] [C2] column_is_signed:true;[R1] [C2] column_encoding:utf8mb4;[R1] [C2] column_is_not_null:false;[R1] [C2] column_value_old_md5:[a06176f33f84bd049ab30a947c7208fb](255);$[R2] COMMIT;
insert into t1 values(30001, CONCAT('{"K1": "', REPEAT('x', 40960),'"}'));
select md5(json_col_1) from t1 where pk = 30001;
md5(json_col_1)
ac54ef3bd3f9010611f4f70d9a89a115
ob1.oblog.next;
[R0] BEGIN;[R0] org_cluster_id:1;[R1] record_type:INSERT;[R1] database_name:cdc_mysql.json_basic_db1;[R1] table_name:t1;[R1] log_event:true;[R1] column_count:2;[R1] source_category:SRC_FULL_RECORDED;[R1] source_type:SRC_OCEANBASE_1_0;[R1] has_pk:true;[R1] pk_info:(0);[R1] pks:pk;[R1] has_uk:false;[R1] uk_info:(null);[R1] uks:(null);[R1] [C1] column_name:pk;[R1] [C1] column_type:MYSQL_TYPE_LONG;[R1] [C1] column_is_rowkey:true;[R1] [C1] column_is_signed:true;[R1] [C1] column_encoding:binary;[R1] [C1] column_is_not_null:true;[R1] [C1] column_value_new:[30001](5);[R1] [C2] column_name:json_col_1;[R1] [C2] column_type:MYSQL_TYPE_JSON;[R1] [C2] column_is_rowkey:false;[R1] [C2] column_is_signed:true;[R1] [C2] column_encoding:utf8mb4;[R1] [C2] column_is_not_null:false;[R1] [C2] column_value_new_md5:[ac54ef3bd3f9010611f4f70d9a89a115](40970);$[R2] COMMIT;
update t1 set pk = 30002 where pk = 30001;
ob1.oblog.next;
[R0] BEGIN;[R0] org_cluster_id:1;[R1] record_type:DELETE;[R1] database_name:cdc_mysql.json_basic_db1;[R1] table_name:t1;[R1] log_event:true;[R1] column_count:2;[R1] source_category:SRC_FULL_RECORDED;[R1] source_type:SRC_OCEANBASE_1_0;[R1] has_pk:true;[R1] pk_info:(0);[R1] pks:pk;[R1] has_uk:false;[R1] uk_info:(null);[R1] uks:(null);[R1] [C1] column_name:pk;[R1] [C1] column_type:MYSQL_TYPE_LONG;[R1] [C1] column_is_rowkey:true;[R1] [C1] column_is_signed:true;[R1] [C1] column_encoding:binary;[R1] [C1] column_is_not_null:true;[R1] [C1] column_value_old:[30001](5);[R1] [C2] column_name:json_col_1;[R1] [C2] column_type:MYSQL_TYPE_JSON;[R1] [C2] column_is_rowkey:false;[R1] [C2] column_is_signed:true;[R1] [C2] column_encoding:utf8mb4;[R1] [C2] column_is_not_null:false;[R1] [C2] column_value_old_origin: PADDING;[R1] [C2] column_value_old_md5:[NULL](0);$[R2] record_type:INSERT;[R2] database_name:cdc_mysql.json_basic_db1;[R2] table_name:t1;[R2] log_event:true;[R2] column_count:2;[R2] source_category:SRC_FULL_RECORDED;[R2] source_type:SRC_OCEANBASE_1_0;[R2] has_pk:true;[R2] pk_info:(0);[R2] pks:pk;[R2] has_uk:false;[R2] uk_info:(null);[R2] uks:(null);[R2] [C1] column_name:pk;[R2] [C1] column_type:MYSQL_TYPE_LONG;[R2] [C1] column_is_rowkey:true;[R2] [C1] column_is_signed:true;[R2] [C1] column_encoding:binary;[R2] [C1] column_is_not_null:true;[R2] [C1] column_value_new:[30002](5);[R2] [C2] column_name:json_col_1;[R2] [C2] column_type:MYSQL_TYPE_JSON;[R2] [C2] column_is_rowkey:false;[R2] [C2] column_is_signed:true;[R2] [C2] column_encoding:utf8mb4;[R2] [C2] column_is_not_null:false;[R2] [C2] column_value_new_md5:[ac54ef3bd3f9010611f4f70d9a89a115](40970);$[R3] COMMIT;
delete from t1 where pk = 30002;
ob1.oblog.next;
[R0] BEGIN;[R0] org_cluster_id:1;[R1] record_type:DELETE;[R1] database_name:cdc_mysql.json_basic_db1;[R1] table_name:t1;[R1] log_event:true;[R1] column_count:2;[R1] source_category:SRC_FULL_RECORDED;[R1] source_type:SRC_OCEANBASE_1_0;[R1] has_pk:true;[R1] pk_info:(0);[R1] pks:pk;[R1] has_uk:false;[R1] uk_info:(null);[R1] uks:(null);[R1] [C1] column_name:pk;[R1] [C1] column_type:MYSQL_TYPE_LONG;[R1] [C1] column_is_rowkey:true;[R1] [C1] column_is_signed:true;[R1] [C1] column_encoding:binary;[R1] [C1] column_is_not_null:true;[R1] [C1] column_value_old:[30002](5);[R1] [C2] column_name:json_col_1;[R1] [C2] column_type:MYSQL_TYPE_JSON;[R1] [C2] column_is_rowkey:false;[R1] [C2] column_is_signed:true;[R1] [C2] column_encoding:utf8mb4;[R1] [C2] column_is_not_null:false;[R1] [C2] column_value_old_origin: PADDING;[R1] [C2] column_value_old_md5:[NULL](0);$[R2] COMMIT;
delete from t1;
ob1.oblog.next;
[R0] BEGIN;[R0] org_cluster_id:1;[R1] record_type:DELETE;[R1] database_name:cdc_mysql.json_basic_db1;[R1] table_name:t1;[R1] log_event:true;[R1] column_count:2;[R1] source_category:SRC_FULL_RECORDED;[R1] source_type:SRC_OCEANBASE_1_0;[R1] has_pk:true;[R1] pk_info:(0);[R1] pks:pk;[R1] has_uk:false;[R1] uk_info:(null);[R1] uks:(null);[R1] [C1] column_name:pk;[R1] [C1] column_type:MYSQL_TYPE_LONG;[R1] [C1] column_is_rowkey:true;[R1] [C1] column_is_signed:true;[R1] [C1] column_encoding:binary;[R1] [C1] column_is_not_null:true;[R1] [C1] column_value_old:[1](1);[R1] [C2] column_name:json_col_1;[R1] [C2] column_type:MYSQL_TYPE_JSON;[R1] [C2] column_is_rowkey:false;[R1] [C2] column_is_signed:true;[R1] [C2] column_encoding:utf8mb4;[R1] [C2] column_is_not_null:false;[R1] [C2] column_value_old_md5:[8625d1293b3b9e0a95768965f2d4f66b](58);$[R2] record_type:DELETE;[R2] database_name:cdc_mysql.json_basic_db1;[R2] table_name:t1;[R2] log_event:true;[R2] column_count:2;[R2] source_category:SRC_FULL_RECORDED;[R2] source_type:SRC_OCEANBASE_1_0;[R2] has_pk:true;[R2] pk_info:(0);[R2] pks:pk;[R2] has_uk:false;[R2] uk_info:(null);[R2] uks:(null);[R2] [C1] column_name:pk;[R2] [C1] column_type:MYSQL_TYPE_LONG;[R2] [C1] column_is_rowkey:true;[R2] [C1] column_is_signed:true;[R2] [C1] column_encoding:binary;[R2] [C1] column_is_not_null:true;[R2] [C1] column_value_old:[2](1);[R2] [C2] column_name:json_col_1;[R2] [C2] column_type:MYSQL_TYPE_JSON;[R2] [C2] column_is_rowkey:false;[R2] [C2] column_is_signed:true;[R2] [C2] column_encoding:utf8mb4;[R2] [C2] column_is_not_null:false;[R2] [C2] column_value_old_origin: PADDING;[R2] [C2] column_value_old_md5:[NULL](0);$[R3] COMMIT;
set log_row_value_options="partial_json";
create table json_test(pk int primary key, j json, b longtext) JSON(j) store as (CHUNK '1K');;
ob1.oblog.next;
[R0] record_type:EDDL;[R0] db_name:cdc_mysql.json_basic_db1;[R0] table_name:;[R0] column_count:1;[R0] column_name:ddl;[R0] ddl_stmt_str: create table json_test(pk int primary key, j json, b longtext) JSON(j) store as (CHUNK '1K');;[R0] ddl_stmt_len: 93;
select lob_chunk_size from oceanbase.__all_table t join oceanbase.__all_column c on t.table_id=c.table_id where t.table_name='json_test' and column_name='j';
lob_chunk_size
1024
select lob_chunk_size from oceanbase.__all_table t join oceanbase.__all_column c on t.table_id=c.table_id where t.table_name='json_test' and column_name='b';
lob_chunk_size
262144
insert json_test values(2, json_object('name', 'dark', 'age', 30, 'position', 'software engineer', 'profile', repeat('e', 4096), 'like', json_array('code', 'dream', 'sleep'), 'tags', json_array('sql boy', 'programer', 'summer', 10000), 'money' , json_object('RMB', 1000, 'Dollers', 20000, 'BTC', 12), 'nickname', 'noone'), repeat('y', 5000));
select md5(j), md5(b) from json_test where pk = 2;
md5(j)	md5(b)
f83db12e2592303d3bdd9070fd199193	a1afb2336d5b67da1f874c942dcf58f3
ob1.oblog.next;
[R0] BEGIN;[R0] org_cluster_id:1;[R1] record_type:INSERT;[R1] database_name:cdc_mysql.json_basic_db1;[R1] table_name:json_test;[R1] log_event:true;[R1] column_count:3;[R1] source_category:SRC_FULL_RECORDED;[R1] source_type:SRC_OCEANBASE_1_0;[R1] has_pk:true;[R1] pk_info:(0);[R1] pks:pk;[R1] has_uk:false;[R1] uk_info:(null);[R1] uks:(null);[R1] [C1] column_name:pk;[R1] [C1] column_type:MYSQL_TYPE_LONG;[R1] [C1] column_is_rowkey:true;[R1] [C1] column_is_signed:true;[R1] [C1] column_encoding:binary;[R1] [C1] column_is_not_null:true;[R1] [C1] column_value_new:[2](1);[R1] [C2] column_name:j;[R1] [C2] column_type:MYSQL_TYPE_JSON;[R1] [C2] column_is_rowkey:false;[R1] [C2] column_is_signed:true;[R1] [C2] column_encoding:utf8mb4;[R1] [C2] column_is_not_null:false;[R1] [C2] column_value_new_md5:[f83db12e2592303d3bdd9070fd199193](4332);[R1] [C3] column_name:b;[R1] [C3] column_type:MYSQL_TYPE_LONG_BLOB;[R1] [C3] column_is_rowkey:false;[R1] [C3] column_is_signed:true;[R1] [C3] column_encoding:utf8mb4;[R1] [C3] column_is_not_null:false;[R1] [C3] column_value_new_md5:[a1afb2336d5b67da1f874c942dcf58f3](5000);$[R2] COMMIT;
update json_test set j = json_replace(j, '$.name', 'shadow') where pk = 2;
select md5(j), md5(b) from json_test where pk = 2;
md5(j)	md5(b)
bae119eaaa2ab10abb22a17cfc44efad	a1afb2336d5b67da1f874c942dcf58f3
select md5('{"version": 1, "diffs": [{"op": "replace", "path": "$.\\"name\\"", "value": "shadow"}]}') as diff_md5;
diff_md5
ff6663a0d1cea08469980bb1c3bc6abd
ob1.oblog.next;
[R0] BEGIN;[R0] org_cluster_id:1;[R1] record_type:UPDATE;[R1] database_name:cdc_mysql.json_basic_db1;[R1] table_name:json_test;[R1] log_event:true;[R1] column_count:3;[R1] source_category:SRC_FULL_RECORDED;[R1] source_type:SRC_OCEANBASE_1_0;[R1] has_pk:true;[R1] pk_info:(0);[R1] pks:pk;[R1] has_uk:false;[R1] uk_info:(null);[R1] uks:(null);[R1] [C1] column_name:pk;[R1] [C1] column_type:MYSQL_TYPE_LONG;[R1] [C1] column_is_rowkey:true;[R1] [C1] column_is_signed:true;[R1] [C1] column_encoding:binary;[R1] [C1] column_is_not_null:true;[R1] [C1] column_value_new:[2](1);[R1] [C1] column_value_old:[2](1);[R1] [C2] column_name:j;[R1] [C2] column_type:MYSQL_TYPE_JSON;[R1] [C2] column_is_rowkey:false;[R1] [C2] column_is_signed:true;[R1] [C2] column_encoding:utf8mb4;[R1] [C2] column_is_not_null:false;[R1] [C2] is_json_diff:true;[R1] [C2] column_value_new_md5:[ff6663a0d1cea08469980bb1c3bc6abd](85);[R1] [C2] column_value_old_origin: PADDING;[R1] [C2] column_value_old_md5:[NULL](0);[R1] [C3] column_name:b;[R1] [C3] column_type:MYSQL_TYPE_LONG_BLOB;[R1] [C3] column_is_rowkey:false;[R1] [C3] column_is_signed:true;[R1] [C3] column_encoding:utf8mb4;[R1] [C3] column_is_not_null:false;[R1] [C3] column_value_new_origin: PADDING;[R1] [C3] column_value_new_md5:[NULL](0);[R1] [C3] column_value_old_origin: PADDING;[R1] [C3] column_value_old_md5:[NULL](0);$[R2] COMMIT;
update json_test set j = json_remove(json_replace(j, '$.tags[3]', 2), '$.tags[1]') where pk = 2;
select md5(j), md5(b) from json_test where pk = 2;
md5(j)	md5(b)
44699490e4f8afa86c89ceed3f18721c	a1afb2336d5b67da1f874c942dcf58f3
select md5('{"version": 1, "diffs": [{"op": "replace", "path": "$.\\"tags\\"[3]", "value": 2}, {"op": "replace", "path": "$.\\"tags\\"", "value": ["sql boy", "summer", 2]}]}') as diff_md5;
diff_md5
f5b92cb672f0f38d5b45191798dcad66
ob1.oblog.next;
[R0] BEGIN;[R0] org_cluster_id:1;[R1] record_type:UPDATE;[R1] database_name:cdc_mysql.json_basic_db1;[R1] table_name:json_test;[R1] log_event:true;[R1] column_count:3;[R1] source_category:SRC_FULL_RECORDED;[R1] source_type:SRC_OCEANBASE_1_0;[R1] has_pk:true;[R1] pk_info:(0);[R1] pks:pk;[R1] has_uk:false;[R1] uk_info:(null);[R1] uks:(null);[R1] [C1] column_name:pk;[R1] [C1] column_type:MYSQL_TYPE_LONG;[R1] [C1] column_is_rowkey:true;[R1] [C1] column_is_signed:true;[R1] [C1] column_encoding:binary;[R1] [C1] column_is_not_null:true;[R1] [C1] column_value_new:[2](1);[R1] [C1] column_value_old:[2](1);[R1] [C2] column_name:j;[R1] [C2] column_type:MYSQL_TYPE_JSON;[R1] [C2] column_is_rowkey:false;[R1] [C2] column_is_signed:true;[R1] [C2] column_encoding:utf8mb4;[R1] [C2] column_is_not_null:false;[R1] [C2] is_json_diff:true;[R1] [C2] column_value_new_md5:[f5b92cb672f0f38d5b45191798dcad66](157);[R1] [C2] column_value_old_origin: PADDING;[R1] [C2] column_value_old_md5:[NULL](0);[R1] [C3] column_name:b;[R1] [C3] column_type:MYSQL_TYPE_LONG_BLOB;[R1] [C3] column_is_rowkey:false;[R1] [C3] column_is_signed:true;[R1] [C3] column_encoding:utf8mb4;[R1] [C3] column_is_not_null:false;[R1] [C3] column_value_new_origin: PADDING;[R1] [C3] column_value_new_md5:[NULL](0);[R1] [C3] column_value_old_origin: PADDING;[R1] [C3] column_value_old_md5:[NULL](0);$[R2] COMMIT;
update json_test set j = json_set(j, '$.position', 'se'), b = repeat('x', 3000) where pk = 2;
select md5(j), md5(b) from json_test where pk = 2;
md5(j)	md5(b)
daa0a936267b6eba35c352a069dbb16f	33d7ac42e3aa0f3146843833c23e4365
select md5('{"version": 1, "diffs": [{"op": "replace", "path": "$.\\"position\\"", "value": "se"}]}') as diff_md5;
diff_md5
e51bb4bcd086d67bb20350f342eef8a5
ob1.oblog.next;
[R0] BEGIN;[R0] org_cluster_id:1;[R1] record_type:UPDATE;[R1] database_name:cdc_mysql.json_basic_db1;[R1] table_name:json_test;[R1] log_event:true;[R1] column_count:3;[R1] source_category:SRC_FULL_RECORDED;[R1] source_type:SRC_OCEANBASE_1_0;[R1] has_pk:true;[R1] pk_info:(0);[R1] pks:pk;[R1] has_uk:false;[R1] uk_info:(null);[R1] uks:(null);[R1] [C1] column_name:pk;[R1] [C1] column_type:MYSQL_TYPE_LONG;[R1] [C1] column_is_rowkey:true;[R1] [C1] column_is_signed:true;[R1] [C1] column_encoding:binary;[R1] [C1] column_is_not_null:true;[R1] [C1] column_value_new:[2](1);[R1] [C1] column_value_old:[2](1);[R1] [C2] column_name:j;[R1] [C2] column_type:MYSQL_TYPE_JSON;[R1] [C2] column_is_rowkey:false;[R1] [C2] column_is_signed:true;[R1] [C2] column_encoding:utf8mb4;[R1] [C2] column_is_not_null:false;[R1] [C2] is_json_diff:true;[R1] [C2] column_value_new_md5:[e51bb4bcd086d67bb20350f342eef8a5](85);[R1] [C2] column_value_old_origin: PADDING;[R1] [C2] column_value_old_md5:[NULL](0);[R1] [C3] column_name:b;[R1] [C3] column_type:MYSQL_TYPE_LONG_BLOB;[R1] [C3] column_is_rowkey:false;[R1] [C3] column_is_signed:true;[R1] [C3] column_encoding:utf8mb4;[R1] [C3] column_is_not_null:false;[R1] [C3] column_value_new_md5:[33d7ac42e3aa0f3146843833c23e4365](3000);[R1] [C3] column_value_old_origin: PADDING;[R1] [C3] column_value_old_md5:[NULL](0);$[R2] COMMIT;
delete from json_test;
ob1.oblog.next;
[R0] BEGIN;[R0] org_cluster_id:1;[R1] record_type:DELETE;[R1] database_name:cdc_mysql.json_basic_db1;[R1] table_name:json_test;[R1] log_event:true;[R1] column_count:3;[R1] source_category:SRC_FULL_RECORDED;[R1] source_type:SRC_OCEANBASE_1_0;[R1] has_pk:true;[R1] pk_info:(0);[R1] pks:pk;[R1] has_uk:false;[R1] uk_info:(null);[R1] uks:(null);[R1] [C1] column_name:pk;[R1] [C1] column_type:MYSQL_TYPE_LONG;[R1] [C1] column_is_rowkey:true;[R1] [C1] column_is_signed:true;[R1] [C1] column_encoding:binary;[R1] [C1] column_is_not_null:true;[R1] [C1] column_value_old:[2](1);[R1] [C2] column_name:j;[R1] [C2] column_type:MYSQL_TYPE_JSON;[R1] [C2] column_is_rowkey:false;[R1] [C2] column_is_signed:true;[R1] [C2] column_encoding:utf8mb4;[R1] [C2] column_is_not_null:false;[R1] [C2] column_value_old_origin: PADDING;[R1] [C2] column_value_old_md5:[NULL](0);[R1] [C3] column_name:b;[R1] [C3] column_type:MYSQL_TYPE_LONG_BLOB;[R1] [C3] column_is_rowkey:false;[R1] [C3] column_is_signed:true;[R1] [C3] column_encoding:utf8mb4;[R1] [C3] column_is_not_null:false;[R1] [C3] column_value_old_md5:[33d7ac42e3aa0f3146843833c23e4365](3000);$[R2] COMMIT;
set log_row_value_options="";
drop table json_test;
ob1.oblog.next;
[R0] record_type:EDDL;[R0] db_name:cdc_mysql.json_basic_db1;[R0] table_name:;[R0] column_count:1;[R0] column_name:ddl;[R0] ddl_stmt_str: DROP TABLE `json_basic_db1`.`json_test`;[R0] ddl_stmt_len: 39;
ob1.oblog.stop;
set ob_trx_timeout=100000000;
set ob_query_timeout=100000000;
set ob_default_lob_inrow_threshold = 4096;
ob1.oblog.set_extra_argument -m;
ob1.oblog.gen_conf tb_white_list=sys.oblog*.*|cdc_mysql.*.*|oracle.*.* log_level=DEBUG;
ob1.oblog.restart;
create table simple_xml_test(pk int primary key, x xmltype);
ob1.oblog.next;
[R0] record_type:EDDL;[R0] db_name:oracle.OBTEST;[R0] table_name:;[R0] column_count:1;[R0] column_name:ddl;[R0] ddl_stmt_str: create table simple_xml_test(pk int primary key, x xmltype);[R0] ddl_stmt_len: 59;
select LOWER(RAWTOHEX(DBMS_CRYPTO.HASH(TO_CLOB('<data><name>first</name></data>'),DBMS_CRYPTO.HASH_MD5))) as xml_md5 from dual;
XML_MD5
fd05b71814b3dd0bef571b1a3d1ef54a
insert into simple_xml_test values(1, xmltype('<data><name>first</name></data>'));
ob1.oblog.next;
[R0] BEGIN;[R0] org_cluster_id:1;[R1] record_type:INSERT;[R1] database_name:oracle.OBTEST;[R1] table_name:SIMPLE_XML_TEST;[R1] log_event:true;[R1] column_count:2;[R1] source_category:SRC_FULL_RECORDED;[R1] source_type:SRC_OCEANBASE_1_0;[R1] has_pk:true;[R1] pk_info:(0);[R1] pks:PK;[R1] has_uk:false;[R1] uk_info:(null);[R1] uks:(null);[R1] [C1] column_name:PK;[R1] [C1] column_type:MYSQL_TYPE_NEWDECIMAL;[R1] [C1] column_is_rowkey:true;[R1] [C1] column_is_signed:true;[R1] [C1] column_encoding:binary;[R1] [C1] column_is_not_null:true;[R1] [C1] column_value_new:[1](1);[R1] [C2] column_name:X;[R1] [C2] column_type:MYSQL_TYPE_ORA_XML;[R1] [C2] column_is_rowkey:false;[R1] [C2] column_is_signed:true;[R1] [C2] column_encoding:utf8mb4;[R1] [C2] column_is_not_null:false;[R1] [C2] column_value_new_md5:[fd05b71814b3dd0bef571b1a3d1ef54a](31);$[R2] COMMIT;
select LOWER(RAWTOHEX(DBMS_CRYPTO.HASH(TO_CLOB('<data><name>second</name></data>'),DBMS_CRYPTO.HASH_MD5))) as xml_md5 from dual;
XML_MD5
9b15a9eb1c97f7a6cbffb0bdf53c4864
update simple_xml_test set x = xmltype('<data><name>second</name></data>') where pk=1;
ob1.oblog.next;
[R0] BEGIN;[R0] org_cluster_id:1;[R1] record_type:UPDATE;[R1] database_name:oracle.OBTEST;[R1] table_name:SIMPLE_XML_TEST;[R1] log_event:true;[R1] column_count:2;[R1] source_category:SRC_FULL_RECORDED;[R1] source_type:SRC_OCEANBASE_1_0;[R1] has_pk:true;[R1] pk_info:(0);[R1] pks:PK;[R1] has_uk:false;[R1] uk_info:(null);[R1] uks:(null);[R1] [C1] column_name:PK;[R1] [C1] column_type:MYSQL_TYPE_NEWDECIMAL;[R1] [C1] column_is_rowkey:true;[R1] [C1] column_is_signed:true;[R1] [C1] column_encoding:binary;[R1] [C1] column_is_not_null:true;[R1] [C1] column_value_new:[1](1);[R1] [C1] column_value_old:[1](1);[R1] [C2] column_name:X;[R1] [C2] column_type:MYSQL_TYPE_ORA_XML;[R1] [C2] column_is_rowkey:false;[R1] [C2] column_is_signed:true;[R1] [C2] column_encoding:utf8mb4;[R1] [C2] column_is_not_null:false;[R1] [C2] column_value_new_md5:[9b15a9eb1c97f7a6cbffb0bdf53c4864](32);[R1] [C2] column_value_old_md5:[fd05b71814b3dd0bef571b1a3d1ef54a](31);$[R2] COMMIT;
select LOWER(RAWTOHEX(DBMS_CRYPTO.HASH(TO_CLOB('<biglob>') || rpad(TO_CLOB('xxxx'), 10000, 'x') || '</biglob>', DBMS_CRYPTO.HASH_MD5))) as xml_md5 from dual;
XML_MD5
757f486c2330c35c9e6614459c18f95c
update simple_xml_test set x = xmltype(TO_CLOB('<biglob>') || rpad(TO_CLOB('xxxx'), 10000, 'x') || '</biglob>') where pk=1;
ob1.oblog.next;
[R0] BEGIN;[R0] org_cluster_id:1;[R1] record_type:UPDATE;[R1] database_name:oracle.OBTEST;[R1] table_name:SIMPLE_XML_TEST;[R1] log_event:true;[R1] column_count:2;[R1] source_category:SRC_FULL_RECORDED;[R1] source_type:SRC_OCEANBASE_1_0;[R1] has_pk:true;[R1] pk_info:(0);[R1] pks:PK;[R1] has_uk:false;[R1] uk_info:(null);[R1] uks:(null);[R1] [C1] column_name:PK;[R1] [C1] column_type:MYSQL_TYPE_NEWDECIMAL;[R1] [C1] column_is_rowkey:true;[R1] [C1] column_is_signed:true;[R1] [C1] column_encoding:binary;[R1] [C1] column_is_not_null:true;[R1] [C1] column_value_new:[1](1);[R1] [C1] column_value_old:[1](1);[R1] [C2] column_name:X;[R1] [C2] column_type:MYSQL_TYPE_ORA_XML;[R1] [C2] column_is_rowkey:false;[R1] [C2] column_is_signed:true;[R1] [C2] column_encoding:utf8mb4;[R1] [C2] column_is_not_null:false;[R1] [C2] column_value_new_md5:[757f486c2330c35c9e6614459c18f95c](10017);[R1] [C2] column_value_old_md5:[9b15a9eb1c97f7a6cbffb0bdf53c4864](32);$[R2] COMMIT;
delete from simple_xml_test where pk = 1;
ob1.oblog.next;
[R0] BEGIN;[R0] org_cluster_id:1;[R1] record_type:DELETE;[R1] database_name:oracle.OBTEST;[R1] table_name:SIMPLE_XML_TEST;[R1] log_event:true;[R1] column_count:2;[R1] source_category:SRC_FULL_RECORDED;[R1] source_type:SRC_OCEANBASE_1_0;[R1] has_pk:true;[R1] pk_info:(0);[R1] pks:PK;[R1] has_uk:false;[R1] uk_info:(null);[R1] uks:(null);[R1] [C1] column_name:PK;[R1] [C1] column_type:MYSQL_TYPE_NEWDECIMAL;[R1] [C1] column_is_rowkey:true;[R1] [C1] column_is_signed:true;[R1] [C1] column_encoding:binary;[R1] [C1] column_is_not_null:true;[R1] [C1] column_value_old:[1](1);[R1] [C2] column_name:X;[R1] [C2] column_type:MYSQL_TYPE_ORA_XML;[R1] [C2] column_is_rowkey:false;[R1] [C2] column_is_signed:true;[R1] [C2] column_encoding:utf8mb4;[R1] [C2] column_is_not_null:false;[R1] [C2] column_value_old_origin: PADDING;[R1] [C2] column_value_old_md5:[NULL](0);$[R2] COMMIT;
select LOWER(RAWTOHEX(DBMS_CRYPTO.HASH(TO_CLOB('<biglob>') || rpad(TO_CLOB('xxxx'), 10000, 'y') || '</biglob>', DBMS_CRYPTO.HASH_MD5))) as xml_md5 from dual;
XML_MD5
4347f320c70064bc20ebf9487fb6510b
insert into simple_xml_test values(3, xmltype(TO_CLOB('<biglob>') || rpad(TO_CLOB('xxxx'), 10000, 'y') || '</biglob>'));
ob1.oblog.next;
[R0] BEGIN;[R0] org_cluster_id:1;[R1] record_type:INSERT;[R1] database_name:oracle.OBTEST;[R1] table_name:SIMPLE_XML_TEST;[R1] log_event:true;[R1] column_count:2;[R1] source_category:SRC_FULL_RECORDED;[R1] source_type:SRC_OCEANBASE_1_0;[R1] has_pk:true;[R1] pk_info:(0);[R1] pks:PK;[R1] has_uk:false;[R1] uk_info:(null);[R1] uks:(null);[R1] [C1] column_name:PK;[R1] [C1] column_type:MYSQL_TYPE_NEWDECIMAL;[R1] [C1] column_is_rowkey:true;[R1] [C1] column_is_signed:true;[R1] [C1] column_encoding:binary;[R1] [C1] column_is_not_null:true;[R1] [C1] column_value_new:[3](1);[R1] [C2] column_name:X;[R1] [C2] column_type:MYSQL_TYPE_ORA_XML;[R1] [C2] column_is_rowkey:false;[R1] [C2] column_is_signed:true;[R1] [C2] column_encoding:utf8mb4;[R1] [C2] column_is_not_null:false;[R1] [C2] column_value_new_md5:[4347f320c70064bc20ebf9487fb6510b](10017);$[R2] COMMIT;
select LOWER(RAWTOHEX(DBMS_CRYPTO.HASH(concat(concat(to_clob('<big>'), rpad(to_clob('d'), 5033, 'd')), '</big>'),DBMS_CRYPTO.HASH_MD5))) as xml_md5 from dual;
XML_MD5
a74ecb440735ca52be4ac62e7fe61c97
update simple_xml_test set x = xmltype(concat(concat(to_clob('<big>'), rpad(to_clob('d'), 5033, 'd')), '</big>')) where pk=3;
ob1.oblog.next;
[R0] BEGIN;[R0] org_cluster_id:1;[R1] record_type:UPDATE;[R1] database_name:oracle.OBTEST;[R1] table_name:SIMPLE_XML_TEST;[R1] log_event:true;[R1] column_count:2;[R1] source_category:SRC_FULL_RECORDED;[R1] source_type:SRC_OCEANBASE_1_0;[R1] has_pk:true;[R1] pk_info:(0);[R1] pks:PK;[R1] has_uk:false;[R1] uk_info:(null);[R1] uks:(null);[R1] [C1] column_name:PK;[R1] [C1] column_type:MYSQL_TYPE_NEWDECIMAL;[R1] [C1] column_is_rowkey:true;[R1] [C1] column_is_signed:true;[R1] [C1] column_encoding:binary;[R1] [C1] column_is_not_null:true;[R1] [C1] column_value_new:[3](1);[R1] [C1] column_value_old:[3](1);[R1] [C2] column_name:X;[R1] [C2] column_type:MYSQL_TYPE_ORA_XML;[R1] [C2] column_is_rowkey:false;[R1] [C2] column_is_signed:true;[R1] [C2] column_encoding:utf8mb4;[R1] [C2] column_is_not_null:false;[R1] [C2] column_value_new_md5:[a74ecb440735ca52be4ac62e7fe61c97](5044);[R1] [C2] column_value_old_md5:[4347f320c70064bc20ebf9487fb6510b](10017);$[R2] COMMIT;
update simple_xml_test set x = xmltype('<data><name>third</name></data>') where pk=3;
select LOWER(RAWTOHEX(DBMS_CRYPTO.HASH(TO_CLOB('<data><name>third</name></data>'),DBMS_CRYPTO.HASH_MD5))) as xml_md5 from dual;
XML_MD5
d5527b9537a202b134b6b93b2a4620dd
ob1.oblog.next;
[R0] BEGIN;[R0] org_cluster_id:1;[R1] record_type:UPDATE;[R1] database_name:oracle.OBTEST;[R1] table_name:SIMPLE_XML_TEST;[R1] log_event:true;[R1] column_count:2;[R1] source_category:SRC_FULL_RECORDED;[R1] source_type:SRC_OCEANBASE_1_0;[R1] has_pk:true;[R1] pk_info:(0);[R1] pks:PK;[R1] has_uk:false;[R1] uk_info:(null);[R1] uks:(null);[R1] [C1] column_name:PK;[R1] [C1] column_type:MYSQL_TYPE_NEWDECIMAL;[R1] [C1] column_is_rowkey:true;[R1] [C1] column_is_signed:true;[R1] [C1] column_encoding:binary;[R1] [C1] column_is_not_null:true;[R1] [C1] column_value_new:[3](1);[R1] [C1] column_value_old:[3](1);[R1] [C2] column_name:X;[R1] [C2] column_type:MYSQL_TYPE_ORA_XML;[R1] [C2] column_is_rowkey:false;[R1] [C2] column_is_signed:true;[R1] [C2] column_encoding:utf8mb4;[R1] [C2] column_is_not_null:false;[R1] [C2] column_value_new_md5:[d5527b9537a202b134b6b93b2a4620dd](31);[R1] [C2] column_value_old_origin: PADDING;[R1] [C2] column_value_old_md5:[NULL](0);$[R2] COMMIT;
delete from simple_xml_test where pk = 3;
ob1.oblog.next;
[R0] BEGIN;[R0] org_cluster_id:1;[R1] record_type:DELETE;[R1] database_name:oracle.OBTEST;[R1] table_name:SIMPLE_XML_TEST;[R1] log_event:true;[R1] column_count:2;[R1] source_category:SRC_FULL_RECORDED;[R1] source_type:SRC_OCEANBASE_1_0;[R1] has_pk:true;[R1] pk_info:(0);[R1] pks:PK;[R1] has_uk:false;[R1] uk_info:(null);[R1] uks:(null);[R1] [C1] column_name:PK;[R1] [C1] column_type:MYSQL_TYPE_NEWDECIMAL;[R1] [C1] column_is_rowkey:true;[R1] [C1] column_is_signed:true;[R1] [C1] column_encoding:binary;[R1] [C1] column_is_not_null:true;[R1] [C1] column_value_old:[3](1);[R1] [C2] column_name:X;[R1] [C2] column_type:MYSQL_TYPE_ORA_XML;[R1] [C2] column_is_rowkey:false;[R1] [C2] column_is_signed:true;[R1] [C2] column_encoding:utf8mb4;[R1] [C2] column_is_not_null:false;[R1] [C2] column_value_old_md5:[d5527b9537a202b134b6b93b2a4620dd](31);$[R2] COMMIT;
select LOWER(RAWTOHEX(DBMS_CRYPTO.HASH(TO_CLOB('<biglob>') || rpad(TO_CLOB('xxxx'), 8000, 'z') || '</biglob>', DBMS_CRYPTO.HASH_MD5))) as xml_md5 from dual;
XML_MD5
1c2bcf6cfde7b1bb300a8e1f9f0779fe
insert into simple_xml_test values(30001, xmltype(TO_CLOB('<biglob>') || rpad(TO_CLOB('xxxx'), 8000, 'z') || '</biglob>'));
ob1.oblog.next;
[R0] BEGIN;[R0] org_cluster_id:1;[R1] record_type:INSERT;[R1] database_name:oracle.OBTEST;[R1] table_name:SIMPLE_XML_TEST;[R1] log_event:true;[R1] column_count:2;[R1] source_category:SRC_FULL_RECORDED;[R1] source_type:SRC_OCEANBASE_1_0;[R1] has_pk:true;[R1] pk_info:(0);[R1] pks:PK;[R1] has_uk:false;[R1] uk_info:(null);[R1] uks:(null);[R1] [C1] column_name:PK;[R1] [C1] column_type:MYSQL_TYPE_NEWDECIMAL;[R1] [C1] column_is_rowkey:true;[R1] [C1] column_is_signed:true;[R1] [C1] column_encoding:binary;[R1] [C1] column_is_not_null:true;[R1] [C1] column_value_new:[30001](5);[R1] [C2] column_name:X;[R1] [C2] column_type:MYSQL_TYPE_ORA_XML;[R1] [C2] column_is_rowkey:false;[R1] [C2] column_is_signed:true;[R1] [C2] column_encoding:utf8mb4;[R1] [C2] column_is_not_null:false;[R1] [C2] column_value_new_md5:[1c2bcf6cfde7b1bb300a8e1f9f0779fe](8017);$[R2] COMMIT;
update simple_xml_test set pk = 30002 where pk = 30001;
ob1.oblog.next;
[R0] BEGIN;[R0] org_cluster_id:1;[R1] record_type:DELETE;[R1] database_name:oracle.OBTEST;[R1] table_name:SIMPLE_XML_TEST;[R1] log_event:true;[R1] column_count:2;[R1] source_category:SRC_FULL_RECORDED;[R1] source_type:SRC_OCEANBASE_1_0;[R1] has_pk:true;[R1] pk_info:(0);[R1] pks:PK;[R1] has_uk:false;[R1] uk_info:(null);[R1] uks:(null);[R1] [C1] column_name:PK;[R1] [C1] column_type:MYSQL_TYPE_NEWDECIMAL;[R1] [C1] column_is_rowkey:true;[R1] [C1] column_is_signed:true;[R1] [C1] column_encoding:binary;[R1] [C1] column_is_not_null:true;[R1] [C1] column_value_old:[30001](5);[R1] [C2] column_name:X;[R1] [C2] column_type:MYSQL_TYPE_ORA_XML;[R1] [C2] column_is_rowkey:false;[R1] [C2] column_is_signed:true;[R1] [C2] column_encoding:utf8mb4;[R1] [C2] column_is_not_null:false;[R1] [C2] column_value_old_origin: PADDING;[R1] [C2] column_value_old_md5:[NULL](0);$[R2] record_type:INSERT;[R2] database_name:oracle.OBTEST;[R2] table_name:SIMPLE_XML_TEST;[R2] log_event:true;[R2] column_count:2;[R2] source_category:SRC_FULL_RECORDED;[R2] source_type:SRC_OCEANBASE_1_0;[R2] has_pk:true;[R2] pk_info:(0);[R2] pks:PK;[R2] has_uk:false;[R2] uk_info:(null);[R2] uks:(null);[R2] [C1] column_name:PK;[R2] [C1] column_type:MYSQL_TYPE_NEWDECIMAL;[R2] [C1] column_is_rowkey:true;[R2] [C1] column_is_signed:true;[R2] [C1] column_encoding:binary;[R2] [C1] column_is_not_null:true;[R2] [C1] column_value_new:[30002](5);[R2] [C2] column_name:X;[R2] [C2] column_type:MYSQL_TYPE_ORA_XML;[R2] [C2] column_is_rowkey:false;[R2] [C2] column_is_signed:true;[R2] [C2] column_encoding:utf8mb4;[R2] [C2] column_is_not_null:false;[R2] [C2] column_value_new_md5:[1c2bcf6cfde7b1bb300a8e1f9f0779fe](8017);$[R3] COMMIT;
delete from simple_xml_test where pk = 30002;
ob1.oblog.next;
[R0] BEGIN;[R0] org_cluster_id:1;[R1] record_type:DELETE;[R1] database_name:oracle.OBTEST;[R1] table_name:SIMPLE_XML_TEST;[R1] log_event:true;[R1] column_count:2;[R1] source_category:SRC_FULL_RECORDED;[R1] source_type:SRC_OCEANBASE_1_0;[R1] has_pk:true;[R1] pk_info:(0);[R1] pks:PK;[R1] has_uk:false;[R1] uk_info:(null);[R1] uks:(null);[R1] [C1] column_name:PK;[R1] [C1] column_type:MYSQL_TYPE_NEWDECIMAL;[R1] [C1] column_is_rowkey:true;[R1] [C1] column_is_signed:true;[R1] [C1] column_encoding:binary;[R1] [C1] column_is_not_null:true;[R1] [C1] column_value_old:[30002](5);[R1] [C2] column_name:X;[R1] [C2] column_type:MYSQL_TYPE_ORA_XML;[R1] [C2] column_is_rowkey:false;[R1] [C2] column_is_signed:true;[R1] [C2] column_encoding:utf8mb4;[R1] [C2] column_is_not_null:false;[R1] [C2] column_value_old_origin: PADDING;[R1] [C2] column_value_old_md5:[NULL](0);$[R2] COMMIT;
ob1.oblog.stop;
create database geo_basic_db1;
use geo_basic_db1;
ob1.oblog.set_extra_argument -m;
ob1.oblog.gen_conf tb_white_list=sys.oblog*.*|cdc_mysql.*.*|oracle.*.* log_level=DEBUG;
ob1.oblog.restart;
create table t1(id int primary key, g1 geometry);
ob1.oblog.next;
[R0] record_type:EDDL;[R0] db_name:cdc_mysql.geo_basic_db1;[R0] table_name:;[R0] column_count:1;[R0] column_name:ddl;[R0] ddl_stmt_str: create table t1(id int primary key, g1 geometry);[R0] ddl_stmt_len: 48;
insert into t1 values(1, ST_GeomFromText('POINT(-1234 5678)'));
select md5(concat('SRID=0;', st_astext(g1))) from t1 where id = 1;
md5(concat('SRID=0;', st_astext(g1)))
17d88fd5a581af58917f9f1325725b84
ob1.oblog.next;
[R0] BEGIN;[R0] org_cluster_id:1;[R1] record_type:INSERT;[R1] database_name:cdc_mysql.geo_basic_db1;[R1] table_name:t1;[R1] log_event:true;[R1] column_count:2;[R1] source_category:SRC_FULL_RECORDED;[R1] source_type:SRC_OCEANBASE_1_0;[R1] has_pk:true;[R1] pk_info:(0);[R1] pks:id;[R1] has_uk:false;[R1] uk_info:(null);[R1] uks:(null);[R1] [C1] column_name:id;[R1] [C1] column_type:MYSQL_TYPE_LONG;[R1] [C1] column_is_rowkey:true;[R1] [C1] column_is_signed:true;[R1] [C1] column_encoding:binary;[R1] [C1] column_is_not_null:true;[R1] [C1] column_value_new:[1](1);[R1] [C2] column_name:g1;[R1] [C2] column_type:MYSQL_TYPE_GEOMETRY;[R1] [C2] column_is_rowkey:false;[R1] [C2] column_is_signed:true;[R1] [C2] column_encoding:binary;[R1] [C2] column_is_not_null:false;[R1] [C2] column_value_new_md5:[17d88fd5a581af58917f9f1325725b84](24);$[R2] COMMIT;
insert into t1 values(2, ST_GeomFromText('LINESTRING(0 0,-4 8,2000 2000)'));
select md5(concat('SRID=0;', st_astext(g1))) from t1 where id = 2;
md5(concat('SRID=0;', st_astext(g1)))
fa65a9ccb93487db97dba1b7b7689d59
ob1.oblog.next;
[R0] BEGIN;[R0] org_cluster_id:1;[R1] record_type:INSERT;[R1] database_name:cdc_mysql.geo_basic_db1;[R1] table_name:t1;[R1] log_event:true;[R1] column_count:2;[R1] source_category:SRC_FULL_RECORDED;[R1] source_type:SRC_OCEANBASE_1_0;[R1] has_pk:true;[R1] pk_info:(0);[R1] pks:id;[R1] has_uk:false;[R1] uk_info:(null);[R1] uks:(null);[R1] [C1] column_name:id;[R1] [C1] column_type:MYSQL_TYPE_LONG;[R1] [C1] column_is_rowkey:true;[R1] [C1] column_is_signed:true;[R1] [C1] column_encoding:binary;[R1] [C1] column_is_not_null:true;[R1] [C1] column_value_new:[2](1);[R1] [C2] column_name:g1;[R1] [C2] column_type:MYSQL_TYPE_GEOMETRY;[R1] [C2] column_is_rowkey:false;[R1] [C2] column_is_signed:true;[R1] [C2] column_encoding:binary;[R1] [C2] column_is_not_null:false;[R1] [C2] column_value_new_md5:[fa65a9ccb93487db97dba1b7b7689d59](37);$[R2] COMMIT;
insert into t1 values(3, ST_GeomFromText('Polygon((0 0,0 8,8 8,8 10,-10 10,-10 0,0 0))'));
select md5(concat('SRID=0;', st_astext(g1))) from t1 where id = 3;
md5(concat('SRID=0;', st_astext(g1)))
b66d77ddbe3a3e7e7a050caf650e35d1
ob1.oblog.next;
[R0] BEGIN;[R0] org_cluster_id:1;[R1] record_type:INSERT;[R1] database_name:cdc_mysql.geo_basic_db1;[R1] table_name:t1;[R1] log_event:true;[R1] column_count:2;[R1] source_category:SRC_FULL_RECORDED;[R1] source_type:SRC_OCEANBASE_1_0;[R1] has_pk:true;[R1] pk_info:(0);[R1] pks:id;[R1] has_uk:false;[R1] uk_info:(null);[R1] uks:(null);[R1] [C1] column_name:id;[R1] [C1] column_type:MYSQL_TYPE_LONG;[R1] [C1] column_is_rowkey:true;[R1] [C1] column_is_signed:true;[R1] [C1] column_encoding:binary;[R1] [C1] column_is_not_null:true;[R1] [C1] column_value_new:[3](1);[R1] [C2] column_name:g1;[R1] [C2] column_type:MYSQL_TYPE_GEOMETRY;[R1] [C2] column_is_rowkey:false;[R1] [C2] column_is_signed:true;[R1] [C2] column_encoding:binary;[R1] [C2] column_is_not_null:false;[R1] [C2] column_value_new_md5:[b66d77ddbe3a3e7e7a050caf650e35d1](51);$[R2] COMMIT;
insert into t1 values(4, ST_GeomFromText('MULTIPOINT(1 1,11 11,11 21,21 21)'));
select md5(concat('SRID=0;', st_astext(g1))) from t1 where id = 4;
md5(concat('SRID=0;', st_astext(g1)))
3a7e808926e60f5c8f0503fb86e3e669
ob1.oblog.next;
[R0] BEGIN;[R0] org_cluster_id:1;[R1] record_type:INSERT;[R1] database_name:cdc_mysql.geo_basic_db1;[R1] table_name:t1;[R1] log_event:true;[R1] column_count:2;[R1] source_category:SRC_FULL_RECORDED;[R1] source_type:SRC_OCEANBASE_1_0;[R1] has_pk:true;[R1] pk_info:(0);[R1] pks:id;[R1] has_uk:false;[R1] uk_info:(null);[R1] uks:(null);[R1] [C1] column_name:id;[R1] [C1] column_type:MYSQL_TYPE_LONG;[R1] [C1] column_is_rowkey:true;[R1] [C1] column_is_signed:true;[R1] [C1] column_encoding:binary;[R1] [C1] column_is_not_null:true;[R1] [C1] column_value_new:[4](1);[R1] [C2] column_name:g1;[R1] [C2] column_type:MYSQL_TYPE_GEOMETRY;[R1] [C2] column_is_rowkey:false;[R1] [C2] column_is_signed:true;[R1] [C2] column_encoding:binary;[R1] [C2] column_is_not_null:false;[R1] [C2] column_value_new_md5:[3a7e808926e60f5c8f0503fb86e3e669](48);$[R2] COMMIT;
insert into t1 values(5, ST_GeomFromText('MULTILINESTRING((10 48,10 21,10 0),(16 0,16 23,16 48))'));
select md5(concat('SRID=0;', st_astext(g1))) from t1 where id = 5;
md5(concat('SRID=0;', st_astext(g1)))
fc370ce9f089653044e3892802121bea
ob1.oblog.next;
[R0] BEGIN;[R0] org_cluster_id:1;[R1] record_type:INSERT;[R1] database_name:cdc_mysql.geo_basic_db1;[R1] table_name:t1;[R1] log_event:true;[R1] column_count:2;[R1] source_category:SRC_FULL_RECORDED;[R1] source_type:SRC_OCEANBASE_1_0;[R1] has_pk:true;[R1] pk_info:(0);[R1] pks:id;[R1] has_uk:false;[R1] uk_info:(null);[R1] uks:(null);[R1] [C1] column_name:id;[R1] [C1] column_type:MYSQL_TYPE_LONG;[R1] [C1] column_is_rowkey:true;[R1] [C1] column_is_signed:true;[R1] [C1] column_encoding:binary;[R1] [C1] column_is_not_null:true;[R1] [C1] column_value_new:[5](1);[R1] [C2] column_name:g1;[R1] [C2] column_type:MYSQL_TYPE_GEOMETRY;[R1] [C2] column_is_rowkey:false;[R1] [C2] column_is_signed:true;[R1] [C2] column_encoding:binary;[R1] [C2] column_is_not_null:false;[R1] [C2] column_value_new_md5:[fc370ce9f089653044e3892802121bea](61);$[R2] COMMIT;
insert into t1 values(6, ST_GeomFromText('MULTIPOLYGON(((28 26,28 0,84 0,84 42,28 26),(52 18,66 23,73 9,48 6,52 18)),((59 18,67 18,67 13,59 13,59 18)))'));
select md5(concat('SRID=0;', st_astext(g1))) from t1 where id = 6;
md5(concat('SRID=0;', st_astext(g1)))
2d3a2f821bff3cdf391b6ee1748db475
ob1.oblog.next;
[R0] BEGIN;[R0] org_cluster_id:1;[R1] record_type:INSERT;[R1] database_name:cdc_mysql.geo_basic_db1;[R1] table_name:t1;[R1] log_event:true;[R1] column_count:2;[R1] source_category:SRC_FULL_RECORDED;[R1] source_type:SRC_OCEANBASE_1_0;[R1] has_pk:true;[R1] pk_info:(0);[R1] pks:id;[R1] has_uk:false;[R1] uk_info:(null);[R1] uks:(null);[R1] [C1] column_name:id;[R1] [C1] column_type:MYSQL_TYPE_LONG;[R1] [C1] column_is_rowkey:true;[R1] [C1] column_is_signed:true;[R1] [C1] column_encoding:binary;[R1] [C1] column_is_not_null:true;[R1] [C1] column_value_new:[6](1);[R1] [C2] column_name:g1;[R1] [C2] column_type:MYSQL_TYPE_GEOMETRY;[R1] [C2] column_is_rowkey:false;[R1] [C2] column_is_signed:true;[R1] [C2] column_encoding:binary;[R1] [C2] column_is_not_null:false;[R1] [C2] column_value_new_md5:[2d3a2f821bff3cdf391b6ee1748db475](116);$[R2] COMMIT;
insert into t1 values(7, ST_GeomFromText('GEOMETRYCOLLECTION EMPTY'));
select md5(concat('SRID=0;', st_astext(g1))) from t1 where id = 7;
md5(concat('SRID=0;', st_astext(g1)))
0e984af8535b2f4b659e6992816b3ced
ob1.oblog.next;
[R0] BEGIN;[R0] org_cluster_id:1;[R1] record_type:INSERT;[R1] database_name:cdc_mysql.geo_basic_db1;[R1] table_name:t1;[R1] log_event:true;[R1] column_count:2;[R1] source_category:SRC_FULL_RECORDED;[R1] source_type:SRC_OCEANBASE_1_0;[R1] has_pk:true;[R1] pk_info:(0);[R1] pks:id;[R1] has_uk:false;[R1] uk_info:(null);[R1] uks:(null);[R1] [C1] column_name:id;[R1] [C1] column_type:MYSQL_TYPE_LONG;[R1] [C1] column_is_rowkey:true;[R1] [C1] column_is_signed:true;[R1] [C1] column_encoding:binary;[R1] [C1] column_is_not_null:true;[R1] [C1] column_value_new:[7](1);[R1] [C2] column_name:g1;[R1] [C2] column_type:MYSQL_TYPE_GEOMETRY;[R1] [C2] column_is_rowkey:false;[R1] [C2] column_is_signed:true;[R1] [C2] column_encoding:binary;[R1] [C2] column_is_not_null:false;[R1] [C2] column_value_new_md5:[0e984af8535b2f4b659e6992816b3ced](31);$[R2] COMMIT;
insert into t1 values(8, ST_GeomFromText('GEOMETRYCOLLECTION ()'));
select md5(concat('SRID=0;', st_astext(g1))) from t1 where id = 8;
md5(concat('SRID=0;', st_astext(g1)))
0e984af8535b2f4b659e6992816b3ced
ob1.oblog.next;
[R0] BEGIN;[R0] org_cluster_id:1;[R1] record_type:INSERT;[R1] database_name:cdc_mysql.geo_basic_db1;[R1] table_name:t1;[R1] log_event:true;[R1] column_count:2;[R1] source_category:SRC_FULL_RECORDED;[R1] source_type:SRC_OCEANBASE_1_0;[R1] has_pk:true;[R1] pk_info:(0);[R1] pks:id;[R1] has_uk:false;[R1] uk_info:(null);[R1] uks:(null);[R1] [C1] column_name:id;[R1] [C1] column_type:MYSQL_TYPE_LONG;[R1] [C1] column_is_rowkey:true;[R1] [C1] column_is_signed:true;[R1] [C1] column_encoding:binary;[R1] [C1] column_is_not_null:true;[R1] [C1] column_value_new:[8](1);[R1] [C2] column_name:g1;[R1] [C2] column_type:MYSQL_TYPE_GEOMETRY;[R1] [C2] column_is_rowkey:false;[R1] [C2] column_is_signed:true;[R1] [C2] column_encoding:binary;[R1] [C2] column_is_not_null:false;[R1] [C2] column_value_new_md5:[0e984af8535b2f4b659e6992816b3ced](31);$[R2] COMMIT;
insert into t1 values(9, ST_GeomFromText('GEOMETRYCOLLECTION(Point(9 9),LINESTRING(1 5,0 0),POLYGON((2 2,2 8,8 8,8 2,2 2)))'));
select md5(concat('SRID=0;', st_astext(g1))) from t1 where id = 9;
md5(concat('SRID=0;', st_astext(g1)))
c306e47ee5bcb31dbb507cd060a40599
ob1.oblog.next;
[R0] BEGIN;[R0] org_cluster_id:1;[R1] record_type:INSERT;[R1] database_name:cdc_mysql.geo_basic_db1;[R1] table_name:t1;[R1] log_event:true;[R1] column_count:2;[R1] source_category:SRC_FULL_RECORDED;[R1] source_type:SRC_OCEANBASE_1_0;[R1] has_pk:true;[R1] pk_info:(0);[R1] pks:id;[R1] has_uk:false;[R1] uk_info:(null);[R1] uks:(null);[R1] [C1] column_name:id;[R1] [C1] column_type:MYSQL_TYPE_LONG;[R1] [C1] column_is_rowkey:true;[R1] [C1] column_is_signed:true;[R1] [C1] column_encoding:binary;[R1] [C1] column_is_not_null:true;[R1] [C1] column_value_new:[9](1);[R1] [C2] column_name:g1;[R1] [C2] column_type:MYSQL_TYPE_GEOMETRY;[R1] [C2] column_is_rowkey:false;[R1] [C2] column_is_signed:true;[R1] [C2] column_encoding:binary;[R1] [C2] column_is_not_null:false;[R1] [C2] column_value_new_md5:[c306e47ee5bcb31dbb507cd060a40599](88);$[R2] COMMIT;
insert into t1 values(10, ST_GEOMFROMTEXT('GEOMETRYCOLLECTION(POLYGON((0 0,50 45,40 50,0 0)),LINESTRING(-10 -10,0 0),LINESTRING(46.666666666666664 46.666666666666664,200 200,199 201,45.333333333333336 47.333333333333336),LINESTRING(8 10,-11 -9))'));
select md5(concat('SRID=0;', st_astext(g1))) from t1 where id = 10;
md5(concat('SRID=0;', st_astext(g1)))
4f63d7af78e1d6834ac2b672256ad33a
ob1.oblog.next;
[R0] BEGIN;[R0] org_cluster_id:1;[R1] record_type:INSERT;[R1] database_name:cdc_mysql.geo_basic_db1;[R1] table_name:t1;[R1] log_event:true;[R1] column_count:2;[R1] source_category:SRC_FULL_RECORDED;[R1] source_type:SRC_OCEANBASE_1_0;[R1] has_pk:true;[R1] pk_info:(0);[R1] pks:id;[R1] has_uk:false;[R1] uk_info:(null);[R1] uks:(null);[R1] [C1] column_name:id;[R1] [C1] column_type:MYSQL_TYPE_LONG;[R1] [C1] column_is_rowkey:true;[R1] [C1] column_is_signed:true;[R1] [C1] column_encoding:binary;[R1] [C1] column_is_not_null:true;[R1] [C1] column_value_new:[10](2);[R1] [C2] column_name:g1;[R1] [C2] column_type:MYSQL_TYPE_GEOMETRY;[R1] [C2] column_is_rowkey:false;[R1] [C2] column_is_signed:true;[R1] [C2] column_encoding:binary;[R1] [C2] column_is_not_null:false;[R1] [C2] column_value_new_md5:[4f63d7af78e1d6834ac2b672256ad33a](209);$[R2] COMMIT;
insert into t1 values(11, ST_GEOMFROMTEXT('GEOMETRYCOLLECTION(GEOMETRYCOLLECTION(POINT(1 1)),GEOMETRYCOLLECTION(LINESTRING(1 1,2 2)))'));
select md5(concat('SRID=0;', st_astext(g1))) from t1 where id = 11;
md5(concat('SRID=0;', st_astext(g1)))
aef2e4d80ec02d8ce8c718202fbba70a
ob1.oblog.next;
[R0] BEGIN;[R0] org_cluster_id:1;[R1] record_type:INSERT;[R1] database_name:cdc_mysql.geo_basic_db1;[R1] table_name:t1;[R1] log_event:true;[R1] column_count:2;[R1] source_category:SRC_FULL_RECORDED;[R1] source_type:SRC_OCEANBASE_1_0;[R1] has_pk:true;[R1] pk_info:(0);[R1] pks:id;[R1] has_uk:false;[R1] uk_info:(null);[R1] uks:(null);[R1] [C1] column_name:id;[R1] [C1] column_type:MYSQL_TYPE_LONG;[R1] [C1] column_is_rowkey:true;[R1] [C1] column_is_signed:true;[R1] [C1] column_encoding:binary;[R1] [C1] column_is_not_null:true;[R1] [C1] column_value_new:[11](2);[R1] [C2] column_name:g1;[R1] [C2] column_type:MYSQL_TYPE_GEOMETRY;[R1] [C2] column_is_rowkey:false;[R1] [C2] column_is_signed:true;[R1] [C2] column_encoding:binary;[R1] [C2] column_is_not_null:false;[R1] [C2] column_value_new_md5:[aef2e4d80ec02d8ce8c718202fbba70a](97);$[R2] COMMIT;
insert into t1 values(12, ST_GEOMFROMTEXT('GEOMETRYCOLLECTION(GEOMETRYCOLLECTION(),GEOMETRYCOLLECTION EMPTY, GEOMETRYCOLLECTION(POINT(1 1)), MULTILINESTRING((10 48,10 21,10 0),(16 0,16 23,16 48)), MULTIPOLYGON(((28 26,28 0,84 0,84 42,28 26),(52 18,66 23,73 9,48 6,52 18)),((59 18,67 18,67 13,59 13,59 18))), MULTIPOINT((0 0),(10 10),(10 20),(20 20)), MULTIPOINT(1 1, 11 11, 11 21, 21 21), GEOMETRYCOLLECTION(LINESTRING(1 1,2 2)), GEOMETRYCOLLECTION(POLYGON((0 0,50 45,40 50,0 0)),LINESTRING(-10 -10,0 0),LINESTRING(46.666666666666664 46.666666666666664,200 200,199 201,45.333333333333336 47.333333333333336),LINESTRING(8 10,-11 -9)))'));
select md5(concat('SRID=0;', st_astext(g1))) from t1 where id = 12;
md5(concat('SRID=0;', st_astext(g1)))
72c3a6e6f665e12aa1b0a47c8e5985c8
ob1.oblog.next;
[R0] BEGIN;[R0] org_cluster_id:1;[R1] record_type:INSERT;[R1] database_name:cdc_mysql.geo_basic_db1;[R1] table_name:t1;[R1] log_event:true;[R1] column_count:2;[R1] source_category:SRC_FULL_RECORDED;[R1] source_type:SRC_OCEANBASE_1_0;[R1] has_pk:true;[R1] pk_info:(0);[R1] pks:id;[R1] has_uk:false;[R1] uk_info:(null);[R1] uks:(null);[R1] [C1] column_name:id;[R1] [C1] column_type:MYSQL_TYPE_LONG;[R1] [C1] column_is_rowkey:true;[R1] [C1] column_is_signed:true;[R1] [C1] column_encoding:binary;[R1] [C1] column_is_not_null:true;[R1] [C1] column_value_new:[12](2);[R1] [C2] column_name:g1;[R1] [C2] column_type:MYSQL_TYPE_GEOMETRY;[R1] [C2] column_is_rowkey:false;[R1] [C2] column_is_signed:true;[R1] [C2] column_encoding:binary;[R1] [C2] column_is_not_null:false;[R1] [C2] column_value_new_md5:[72c3a6e6f665e12aa1b0a47c8e5985c8](599);$[R2] COMMIT;
update t1 set g1=ST_GEOMFROMTEXT('point(7000e-7 1e-10)') WHERE id=1;
select md5(concat('SRID=0;', st_astext(g1))) from t1 where id = 1;
md5(concat('SRID=0;', st_astext(g1)))
e08bd0ee7e2b7609e0c3379654d9400f
ob1.oblog.next;
[R0] BEGIN;[R0] org_cluster_id:1;[R1] record_type:UPDATE;[R1] database_name:cdc_mysql.geo_basic_db1;[R1] table_name:t1;[R1] log_event:true;[R1] column_count:2;[R1] source_category:SRC_FULL_RECORDED;[R1] source_type:SRC_OCEANBASE_1_0;[R1] has_pk:true;[R1] pk_info:(0);[R1] pks:id;[R1] has_uk:false;[R1] uk_info:(null);[R1] uks:(null);[R1] [C1] column_name:id;[R1] [C1] column_type:MYSQL_TYPE_LONG;[R1] [C1] column_is_rowkey:true;[R1] [C1] column_is_signed:true;[R1] [C1] column_encoding:binary;[R1] [C1] column_is_not_null:true;[R1] [C1] column_value_new:[1](1);[R1] [C1] column_value_old:[1](1);[R1] [C2] column_name:g1;[R1] [C2] column_type:MYSQL_TYPE_GEOMETRY;[R1] [C2] column_is_rowkey:false;[R1] [C2] column_is_signed:true;[R1] [C2] column_encoding:binary;[R1] [C2] column_is_not_null:false;[R1] [C2] column_value_new_md5:[e08bd0ee7e2b7609e0c3379654d9400f](33);[R1] [C2] column_value_old_md5:[17d88fd5a581af58917f9f1325725b84](24);$[R2] COMMIT;
update t1 set g1=ST_GEOMFROMTEXT(concat('GEOMETRYCOLLECTION(', 'POINT(3 1)', repeat(',POINT(2 2)', 5000), ')')) WHERE id=2;
select md5(concat('SRID=0;', st_astext(g1))) from t1 where id = 2;
md5(concat('SRID=0;', st_astext(g1)))
da89165bbadbb82e4905a95a96efac50
ob1.oblog.next;
[R0] BEGIN;[R0] org_cluster_id:1;[R1] record_type:UPDATE;[R1] database_name:cdc_mysql.geo_basic_db1;[R1] table_name:t1;[R1] log_event:true;[R1] column_count:2;[R1] source_category:SRC_FULL_RECORDED;[R1] source_type:SRC_OCEANBASE_1_0;[R1] has_pk:true;[R1] pk_info:(0);[R1] pks:id;[R1] has_uk:false;[R1] uk_info:(null);[R1] uks:(null);[R1] [C1] column_name:id;[R1] [C1] column_type:MYSQL_TYPE_LONG;[R1] [C1] column_is_rowkey:true;[R1] [C1] column_is_signed:true;[R1] [C1] column_encoding:binary;[R1] [C1] column_is_not_null:true;[R1] [C1] column_value_new:[2](1);[R1] [C1] column_value_old:[2](1);[R1] [C2] column_name:g1;[R1] [C2] column_type:MYSQL_TYPE_GEOMETRY;[R1] [C2] column_is_rowkey:false;[R1] [C2] column_is_signed:true;[R1] [C2] column_encoding:binary;[R1] [C2] column_is_not_null:false;[R1] [C2] column_value_new_md5:[da89165bbadbb82e4905a95a96efac50](55037);[R1] [C2] column_value_old_md5:[fa65a9ccb93487db97dba1b7b7689d59](37);$[R2] COMMIT;
delete from t1 where id=2;
ob1.oblog.next;
[R0] BEGIN;[R0] org_cluster_id:1;[R1] record_type:DELETE;[R1] database_name:cdc_mysql.geo_basic_db1;[R1] table_name:t1;[R1] log_event:true;[R1] column_count:2;[R1] source_category:SRC_FULL_RECORDED;[R1] source_type:SRC_OCEANBASE_1_0;[R1] has_pk:true;[R1] pk_info:(0);[R1] pks:id;[R1] has_uk:false;[R1] uk_info:(null);[R1] uks:(null);[R1] [C1] column_name:id;[R1] [C1] column_type:MYSQL_TYPE_LONG;[R1] [C1] column_is_rowkey:true;[R1] [C1] column_is_signed:true;[R1] [C1] column_encoding:binary;[R1] [C1] column_is_not_null:true;[R1] [C1] column_value_old:[2](1);[R1] [C2] column_name:g1;[R1] [C2] column_type:MYSQL_TYPE_GEOMETRY;[R1] [C2] column_is_rowkey:false;[R1] [C2] column_is_signed:true;[R1] [C2] column_encoding:binary;[R1] [C2] column_is_not_null:false;[R1] [C2] column_value_old_origin: PADDING;[R1] [C2] column_value_old_md5:[NULL](0);$[R2] COMMIT;
insert into t1 values(19, ST_GEOMFROMTEXT(concat('GEOMETRYCOLLECTION(', 'POINT(1 1)', repeat(',POINT(1 1)', 5000), ')')));
select md5(concat('SRID=0;', st_astext(g1))) from t1 where id = 19;
md5(concat('SRID=0;', st_astext(g1)))
0a8d715eefca3f607e123045188e40cf
ob1.oblog.next;
[R0] BEGIN;[R0] org_cluster_id:1;[R1] record_type:INSERT;[R1] database_name:cdc_mysql.geo_basic_db1;[R1] table_name:t1;[R1] log_event:true;[R1] column_count:2;[R1] source_category:SRC_FULL_RECORDED;[R1] source_type:SRC_OCEANBASE_1_0;[R1] has_pk:true;[R1] pk_info:(0);[R1] pks:id;[R1] has_uk:false;[R1] uk_info:(null);[R1] uks:(null);[R1] [C1] column_name:id;[R1] [C1] column_type:MYSQL_TYPE_LONG;[R1] [C1] column_is_rowkey:true;[R1] [C1] column_is_signed:true;[R1] [C1] column_encoding:binary;[R1] [C1] column_is_not_null:true;[R1] [C1] column_value_new:[19](2);[R1] [C2] column_name:g1;[R1] [C2] column_type:MYSQL_TYPE_GEOMETRY;[R1] [C2] column_is_rowkey:false;[R1] [C2] column_is_signed:true;[R1] [C2] column_encoding:binary;[R1] [C2] column_is_not_null:false;[R1] [C2] column_value_new_md5:[0a8d715eefca3f607e123045188e40cf](55037);$[R2] COMMIT;
update t1 set g1=ST_GEOMFROMTEXT(concat('GEOMETRYCOLLECTION(', 'POINT(4 1)', repeat(',POINT(5 2)', 5000), ')')) WHERE id=19;
select md5(concat('SRID=0;', st_astext(g1))) from t1 where id = 19;
md5(concat('SRID=0;', st_astext(g1)))
25653721aa872e85c57bc743b57b2d8b
ob1.oblog.next;
[R0] BEGIN;[R0] org_cluster_id:1;[R1] record_type:UPDATE;[R1] database_name:cdc_mysql.geo_basic_db1;[R1] table_name:t1;[R1] log_event:true;[R1] column_count:2;[R1] source_category:SRC_FULL_RECORDED;[R1] source_type:SRC_OCEANBASE_1_0;[R1] has_pk:true;[R1] pk_info:(0);[R1] pks:id;[R1] has_uk:false;[R1] uk_info:(null);[R1] uks:(null);[R1] [C1] column_name:id;[R1] [C1] column_type:MYSQL_TYPE_LONG;[R1] [C1] column_is_rowkey:true;[R1] [C1] column_is_signed:true;[R1] [C1] column_encoding:binary;[R1] [C1] column_is_not_null:true;[R1] [C1] column_value_new:[19](2);[R1] [C1] column_value_old:[19](2);[R1] [C2] column_name:g1;[R1] [C2] column_type:MYSQL_TYPE_GEOMETRY;[R1] [C2] column_is_rowkey:false;[R1] [C2] column_is_signed:true;[R1] [C2] column_encoding:binary;[R1] [C2] column_is_not_null:false;[R1] [C2] column_value_new_md5:[25653721aa872e85c57bc743b57b2d8b](55037);[R1] [C2] column_value_old_md5:[0a8d715eefca3f607e123045188e40cf](55037);$[R2] COMMIT;
update t1 set id=20 where id=19;
ob1.oblog.next;
[R0] BEGIN;[R0] org_cluster_id:1;[R1] record_type:DELETE;[R1] database_name:cdc_mysql.geo_basic_db1;[R1] table_name:t1;[R1] log_event:true;[R1] column_count:2;[R1] source_category:SRC_FULL_RECORDED;[R1] source_type:SRC_OCEANBASE_1_0;[R1] has_pk:true;[R1] pk_info:(0);[R1] pks:id;[R1] has_uk:false;[R1] uk_info:(null);[R1] uks:(null);[R1] [C1] column_name:id;[R1] [C1] column_type:MYSQL_TYPE_LONG;[R1] [C1] column_is_rowkey:true;[R1] [C1] column_is_signed:true;[R1] [C1] column_encoding:binary;[R1] [C1] column_is_not_null:true;[R1] [C1] column_value_old:[19](2);[R1] [C2] column_name:g1;[R1] [C2] column_type:MYSQL_TYPE_GEOMETRY;[R1] [C2] column_is_rowkey:false;[R1] [C2] column_is_signed:true;[R1] [C2] column_encoding:binary;[R1] [C2] column_is_not_null:false;[R1] [C2] column_value_old_origin: PADDING;[R1] [C2] column_value_old_md5:[NULL](0);$[R2] record_type:INSERT;[R2] database_name:cdc_mysql.geo_basic_db1;[R2] table_name:t1;[R2] log_event:true;[R2] column_count:2;[R2] source_category:SRC_FULL_RECORDED;[R2] source_type:SRC_OCEANBASE_1_0;[R2] has_pk:true;[R2] pk_info:(0);[R2] pks:id;[R2] has_uk:false;[R2] uk_info:(null);[R2] uks:(null);[R2] [C1] column_name:id;[R2] [C1] column_type:MYSQL_TYPE_LONG;[R2] [C1] column_is_rowkey:true;[R2] [C1] column_is_signed:true;[R2] [C1] column_encoding:binary;[R2] [C1] column_is_not_null:true;[R2] [C1] column_value_new:[20](2);[R2] [C2] column_name:g1;[R2] [C2] column_type:MYSQL_TYPE_GEOMETRY;[R2] [C2] column_is_rowkey:false;[R2] [C2] column_is_signed:true;[R2] [C2] column_encoding:binary;[R2] [C2] column_is_not_null:false;[R2] [C2] column_value_new_md5:[25653721aa872e85c57bc743b57b2d8b](55037);$[R3] COMMIT;
update t1 set g1=ST_GeomFromText('MULTIPOLYGON(((28 26,28 3,84 3,84 42,28 26),(52 18,66 23,73 9,48 6,52 18)),((59 18,67 18,67 13,59 13,59 18)))') WHERE id=20;
select md5(concat('SRID=0;', st_astext(g1))) from t1 where id = 20;
md5(concat('SRID=0;', st_astext(g1)))
72f21d84538e5684e8a9070aca3007a6
ob1.oblog.next;
[R0] BEGIN;[R0] org_cluster_id:1;[R1] record_type:UPDATE;[R1] database_name:cdc_mysql.geo_basic_db1;[R1] table_name:t1;[R1] log_event:true;[R1] column_count:2;[R1] source_category:SRC_FULL_RECORDED;[R1] source_type:SRC_OCEANBASE_1_0;[R1] has_pk:true;[R1] pk_info:(0);[R1] pks:id;[R1] has_uk:false;[R1] uk_info:(null);[R1] uks:(null);[R1] [C1] column_name:id;[R1] [C1] column_type:MYSQL_TYPE_LONG;[R1] [C1] column_is_rowkey:true;[R1] [C1] column_is_signed:true;[R1] [C1] column_encoding:binary;[R1] [C1] column_is_not_null:true;[R1] [C1] column_value_new:[20](2);[R1] [C1] column_value_old:[20](2);[R1] [C2] column_name:g1;[R1] [C2] column_type:MYSQL_TYPE_GEOMETRY;[R1] [C2] column_is_rowkey:false;[R1] [C2] column_is_signed:true;[R1] [C2] column_encoding:binary;[R1] [C2] column_is_not_null:false;[R1] [C2] column_value_new_md5:[72f21d84538e5684e8a9070aca3007a6](116);[R1] [C2] column_value_old_origin: PADDING;[R1] [C2] column_value_old_md5:[NULL](0);$[R2] COMMIT;
delete from t1 where id=20;
ob1.oblog.next;
[R0] BEGIN;[R0] org_cluster_id:1;[R1] record_type:DELETE;[R1] database_name:cdc_mysql.geo_basic_db1;[R1] table_name:t1;[R1] log_event:true;[R1] column_count:2;[R1] source_category:SRC_FULL_RECORDED;[R1] source_type:SRC_OCEANBASE_1_0;[R1] has_pk:true;[R1] pk_info:(0);[R1] pks:id;[R1] has_uk:false;[R1] uk_info:(null);[R1] uks:(null);[R1] [C1] column_name:id;[R1] [C1] column_type:MYSQL_TYPE_LONG;[R1] [C1] column_is_rowkey:true;[R1] [C1] column_is_signed:true;[R1] [C1] column_encoding:binary;[R1] [C1] column_is_not_null:true;[R1] [C1] column_value_old:[20](2);[R1] [C2] column_name:g1;[R1] [C2] column_type:MYSQL_TYPE_GEOMETRY;[R1] [C2] column_is_rowkey:false;[R1] [C2] column_is_signed:true;[R1] [C2] column_encoding:binary;[R1] [C2] column_is_not_null:false;[R1] [C2] column_value_old_md5:[72f21d84538e5684e8a9070aca3007a6](116);$[R2] COMMIT;
delete from t1;
ob1.oblog.next;
[R0] BEGIN;[R0] org_cluster_id:1;[R1] record_type:DELETE;[R1] database_name:cdc_mysql.geo_basic_db1;[R1] table_name:t1;[R1] log_event:true;[R1] column_count:2;[R1] source_category:SRC_FULL_RECORDED;[R1] source_type:SRC_OCEANBASE_1_0;[R1] has_pk:true;[R1] pk_info:(0);[R1] pks:id;[R1] has_uk:false;[R1] uk_info:(null);[R1] uks:(null);[R1] [C1] column_name:id;[R1] [C1] column_type:MYSQL_TYPE_LONG;[R1] [C1] column_is_rowkey:true;[R1] [C1] column_is_signed:true;[R1] [C1] column_encoding:binary;[R1] [C1] column_is_not_null:true;[R1] [C1] column_value_old:[1](1);[R1] [C2] column_name:g1;[R1] [C2] column_type:MYSQL_TYPE_GEOMETRY;[R1] [C2] column_is_rowkey:false;[R1] [C2] column_is_signed:true;[R1] [C2] column_encoding:binary;[R1] [C2] column_is_not_null:false;[R1] [C2] column_value_old_md5:[e08bd0ee7e2b7609e0c3379654d9400f](33);$[R2] record_type:DELETE;[R2] database_name:cdc_mysql.geo_basic_db1;[R2] table_name:t1;[R2] log_event:true;[R2] column_count:2;[R2] source_category:SRC_FULL_RECORDED;[R2] source_type:SRC_OCEANBASE_1_0;[R2] has_pk:true;[R2] pk_info:(0);[R2] pks:id;[R2] has_uk:false;[R2] uk_info:(null);[R2] uks:(null);[R2] [C1] column_name:id;[R2] [C1] column_type:MYSQL_TYPE_LONG;[R2] [C1] column_is_rowkey:true;[R2] [C1] column_is_signed:true;[R2] [C1] column_encoding:binary;[R2] [C1] column_is_not_null:true;[R2] [C1] column_value_old:[3](1);[R2] [C2] column_name:g1;[R2] [C2] column_type:MYSQL_TYPE_GEOMETRY;[R2] [C2] column_is_rowkey:false;[R2] [C2] column_is_signed:true;[R2] [C2] column_encoding:binary;[R2] [C2] column_is_not_null:false;[R2] [C2] column_value_old_md5:[b66d77ddbe3a3e7e7a050caf650e35d1](51);$[R3] record_type:DELETE;[R3] database_name:cdc_mysql.geo_basic_db1;[R3] table_name:t1;[R3] log_event:true;[R3] column_count:2;[R3] source_category:SRC_FULL_RECORDED;[R3] source_type:SRC_OCEANBASE_1_0;[R3] has_pk:true;[R3] pk_info:(0);[R3] pks:id;[R3] has_uk:false;[R3] uk_info:(null);[R3] uks:(null);[R3] [C1] column_name:id;[R3] [C1] column_type:MYSQL_TYPE_LONG;[R3] [C1] column_is_rowkey:true;[R3] [C1] column_is_signed:true;[R3] [C1] column_encoding:binary;[R3] [C1] column_is_not_null:true;[R3] [C1] column_value_old:[4](1);[R3] [C2] column_name:g1;[R3] [C2] column_type:MYSQL_TYPE_GEOMETRY;[R3] [C2] column_is_rowkey:false;[R3] [C2] column_is_signed:true;[R3] [C2] column_encoding:binary;[R3] [C2] column_is_not_null:false;[R3] [C2] column_value_old_md5:[3a7e808926e60f5c8f0503fb86e3e669](48);$[R4] record_type:DELETE;[R4] database_name:cdc_mysql.geo_basic_db1;[R4] table_name:t1;[R4] log_event:true;[R4] column_count:2;[R4] source_category:SRC_FULL_RECORDED;[R4] source_type:SRC_OCEANBASE_1_0;[R4] has_pk:true;[R4] pk_info:(0);[R4] pks:id;[R4] has_uk:false;[R4] uk_info:(null);[R4] uks:(null);[R4] [C1] column_name:id;[R4] [C1] column_type:MYSQL_TYPE_LONG;[R4] [C1] column_is_rowkey:true;[R4] [C1] column_is_signed:true;[R4] [C1] column_encoding:binary;[R4] [C1] column_is_not_null:true;[R4] [C1] column_value_old:[5](1);[R4] [C2] column_name:g1;[R4] [C2] column_type:MYSQL_TYPE_GEOMETRY;[R4] [C2] column_is_rowkey:false;[R4] [C2] column_is_signed:true;[R4] [C2] column_encoding:binary;[R4] [C2] column_is_not_null:false;[R4] [C2] column_value_old_md5:[fc370ce9f089653044e3892802121bea](61);$[R5] record_type:DELETE;[R5] database_name:cdc_mysql.geo_basic_db1;[R5] table_name:t1;[R5] log_event:true;[R5] column_count:2;[R5] source_category:SRC_FULL_RECORDED;[R5] source_type:SRC_OCEANBASE_1_0;[R5] has_pk:true;[R5] pk_info:(0);[R5] pks:id;[R5] has_uk:false;[R5] uk_info:(null);[R5] uks:(null);[R5] [C1] column_name:id;[R5] [C1] column_type:MYSQL_TYPE_LONG;[R5] [C1] column_is_rowkey:true;[R5] [C1] column_is_signed:true;[R5] [C1] column_encoding:binary;[R5] [C1] column_is_not_null:true;[R5] [C1] column_value_old:[6](1);[R5] [C2] column_name:g1;[R5] [C2] column_type:MYSQL_TYPE_GEOMETRY;[R5] [C2] column_is_rowkey:false;[R5] [C2] column_is_signed:true;[R5] [C2] column_encoding:binary;[R5] [C2] column_is_not_null:false;[R5] [C2] column_value_old_md5:[2d3a2f821bff3cdf391b6ee1748db475](116);$[R6] record_type:DELETE;[R6] database_name:cdc_mysql.geo_basic_db1;[R6] table_name:t1;[R6] log_event:true;[R6] column_count:2;[R6] source_category:SRC_FULL_RECORDED;[R6] source_type:SRC_OCEANBASE_1_0;[R6] has_pk:true;[R6] pk_info:(0);[R6] pks:id;[R6] has_uk:false;[R6] uk_info:(null);[R6] uks:(null);[R6] [C1] column_name:id;[R6] [C1] column_type:MYSQL_TYPE_LONG;[R6] [C1] column_is_rowkey:true;[R6] [C1] column_is_signed:true;[R6] [C1] column_encoding:binary;[R6] [C1] column_is_not_null:true;[R6] [C1] column_value_old:[7](1);[R6] [C2] column_name:g1;[R6] [C2] column_type:MYSQL_TYPE_GEOMETRY;[R6] [C2] column_is_rowkey:false;[R6] [C2] column_is_signed:true;[R6] [C2] column_encoding:binary;[R6] [C2] column_is_not_null:false;[R6] [C2] column_value_old_md5:[0e984af8535b2f4b659e6992816b3ced](31);$[R7] record_type:DELETE;[R7] database_name:cdc_mysql.geo_basic_db1;[R7] table_name:t1;[R7] log_event:true;[R7] column_count:2;[R7] source_category:SRC_FULL_RECORDED;[R7] source_type:SRC_OCEANBASE_1_0;[R7] has_pk:true;[R7] pk_info:(0);[R7] pks:id;[R7] has_uk:false;[R7] uk_info:(null);[R7] uks:(null);[R7] [C1] column_name:id;[R7] [C1] column_type:MYSQL_TYPE_LONG;[R7] [C1] column_is_rowkey:true;[R7] [C1] column_is_signed:true;[R7] [C1] column_encoding:binary;[R7] [C1] column_is_not_null:true;[R7] [C1] column_value_old:[8](1);[R7] [C2] column_name:g1;[R7] [C2] column_type:MYSQL_TYPE_GEOMETRY;[R7] [C2] column_is_rowkey:false;[R7] [C2] column_is_signed:true;[R7] [C2] column_encoding:binary;[R7] [C2] column_is_not_null:false;[R7] [C2] column_value_old_md5:[0e984af8535b2f4b659e6992816b3ced](31);$[R8] record_type:DELETE;[R8] database_name:cdc_mysql.geo_basic_db1;[R8] table_name:t1;[R8] log_event:true;[R8] column_count:2;[R8] source_category:SRC_FULL_RECORDED;[R8] source_type:SRC_OCEANBASE_1_0;[R8] has_pk:true;[R8] pk_info:(0);[R8] pks:id;[R8] has_uk:false;[R8] uk_info:(null);[R8] uks:(null);[R8] [C1] column_name:id;[R8] [C1] column_type:MYSQL_TYPE_LONG;[R8] [C1] column_is_rowkey:true;[R8] [C1] column_is_signed:true;[R8] [C1] column_encoding:binary;[R8] [C1] column_is_not_null:true;[R8] [C1] column_value_old:[9](1);[R8] [C2] column_name:g1;[R8] [C2] column_type:MYSQL_TYPE_GEOMETRY;[R8] [C2] column_is_rowkey:false;[R8] [C2] column_is_signed:true;[R8] [C2] column_encoding:binary;[R8] [C2] column_is_not_null:false;[R8] [C2] column_value_old_md5:[c306e47ee5bcb31dbb507cd060a40599](88);$[R9] record_type:DELETE;[R9] database_name:cdc_mysql.geo_basic_db1;[R9] table_name:t1;[R9] log_event:true;[R9] column_count:2;[R9] source_category:SRC_FULL_RECORDED;[R9] source_type:SRC_OCEANBASE_1_0;[R9] has_pk:true;[R9] pk_info:(0);[R9] pks:id;[R9] has_uk:false;[R9] uk_info:(null);[R9] uks:(null);[R9] [C1] column_name:id;[R9] [C1] column_type:MYSQL_TYPE_LONG;[R9] [C1] column_is_rowkey:true;[R9] [C1] column_is_signed:true;[R9] [C1] column_encoding:binary;[R9] [C1] column_is_not_null:true;[R9] [C1] column_value_old:[10](2);[R9] [C2] column_name:g1;[R9] [C2] column_type:MYSQL_TYPE_GEOMETRY;[R9] [C2] column_is_rowkey:false;[R9] [C2] column_is_signed:true;[R9] [C2] column_encoding:binary;[R9] [C2] column_is_not_null:false;[R9] [C2] column_value_old_md5:[4f63d7af78e1d6834ac2b672256ad33a](209);$[R10] record_type:DELETE;[R10] database_name:cdc_mysql.geo_basic_db1;[R10] table_name:t1;[R10] log_event:true;[R10] column_count:2;[R10] source_category:SRC_FULL_RECORDED;[R10] source_type:SRC_OCEANBASE_1_0;[R10] has_pk:true;[R10] pk_info:(0);[R10] pks:id;[R10] has_uk:false;[R10] uk_info:(null);[R10] uks:(null);[R10] [C1] column_name:id;[R10] [C1] column_type:MYSQL_TYPE_LONG;[R10] [C1] column_is_rowkey:true;[R10] [C1] column_is_signed:true;[R10] [C1] column_encoding:binary;[R10] [C1] column_is_not_null:true;[R10] [C1] column_value_old:[11](2);[R10] [C2] column_name:g1;[R10] [C2] column_type:MYSQL_TYPE_GEOMETRY;[R10] [C2] column_is_rowkey:false;[R10] [C2] column_is_signed:true;[R10] [C2] column_encoding:binary;[R10] [C2] column_is_not_null:false;[R10] [C2] column_value_old_md5:[aef2e4d80ec02d8ce8c718202fbba70a](97);$[R11] record_type:DELETE;[R11] database_name:cdc_mysql.geo_basic_db1;[R11] table_name:t1;[R11] log_event:true;[R11] column_count:2;[R11] source_category:SRC_FULL_RECORDED;[R11] source_type:SRC_OCEANBASE_1_0;[R11] has_pk:true;[R11] pk_info:(0);[R11] pks:id;[R11] has_uk:false;[R11] uk_info:(null);[R11] uks:(null);[R11] [C1] column_name:id;[R11] [C1] column_type:MYSQL_TYPE_LONG;[R11] [C1] column_is_rowkey:true;[R11] [C1] column_is_signed:true;[R11] [C1] column_encoding:binary;[R11] [C1] column_is_not_null:true;[R11] [C1] column_value_old:[12](2);[R11] [C2] column_name:g1;[R11] [C2] column_type:MYSQL_TYPE_GEOMETRY;[R11] [C2] column_is_rowkey:false;[R11] [C2] column_is_signed:true;[R11] [C2] column_encoding:binary;[R11] [C2] column_is_not_null:false;[R11] [C2] column_value_old_md5:[72c3a6e6f665e12aa1b0a47c8e5985c8](599);$[R12] COMMIT;
ob1.oblog.stop;
ob1.oblog.gen_conf tb_white_list=*.*.* log_level=INFO skip_ob_version_compat_check=1;
ob1.oblog.set_start_tstamp_usec $compat_current_start_tstamp_usec;
ob1.oblog.set_extra_argument -m;
ob1.oblog.restart;
ob1.oblog.checkRealTime;
ob1.oblog.stop;
ob1.oblog.gen_conf tb_white_list=cdc_mysql.*.* log_level=INFO meta_data_refresh_mode=data_dict fetching_log_mode=direct archive_dest=$log_backup_dest_cdc_mysql tenant_user=obcdc@cdc_mysql tenant_password=obcdc tenant_endpoint=$ip:$port;
ob1.oblog.set_start_tstamp_usec $compat_current_start_tstamp_usec_tenant_created;
ob1.oblog.set_extra_argument -m;
ob1.oblog.restart;
ob1.oblog.checkRealTime;
ob1.oblog.stop;
ob1.oblog.gen_conf tb_white_list=oracle.*.* log_level=INFO meta_data_refresh_mode=data_dict fetching_log_mode=direct archive_dest=$log_backup_dest_oracle tenant_user=obtest@oracle tenant_password=obtest tenant_endpoint=$ip:$port;
ob1.oblog.set_start_tstamp_usec $compat_current_start_tstamp_usec_tenant_created;
ob1.oblog.set_extra_argument -m;
ob1.oblog.restart;
ob1.oblog.checkRealTime;
ob1.oblog.stop;
ob1.oblog.gen_conf tb_white_list=cdc_mysql.*.* log_level=INFO meta_data_refresh_mode=data_dict tenant_user=obcdc@cdc_mysql tenant_password=obcdc tenant_endpoint=$ip:$port;
ob1.oblog.set_start_tstamp_usec $compat_current_start_tstamp_usec_tenant_created;
ob1.oblog.set_extra_argument -m;
ob1.oblog.restart;
ob1.oblog.checkRealTime;
ob1.oblog.stop;
ob1.oblog.gen_conf tb_white_list=oracle.*.* log_level=INFO meta_data_refresh_mode=data_dict tenant_user=obtest@oracle tenant_password=obtest tenant_endpoint=$ip:$port;
ob1.oblog.set_start_tstamp_usec $compat_current_start_tstamp_usec_tenant_created;
ob1.oblog.set_extra_argument -m;
ob1.oblog.restart;
ob1.oblog.checkRealTime;
ob1.oblog.stop;
