ob1=OBI(cluster=1:1:1, init_unit_cpu=5);
ob1.reboot;
create resource unit oblog_box max_cpu 2, memory_size='20G';
create resource pool oblog_pool unit = 'oblog_box', unit_num = 1, zone_list = ('z1');
create tenant oblog_tt replica_num = 1, primary_zone='z1', resource_pool_list=('oblog_pool') set ob_tcp_invited_nodes='%';
alter system set dump_data_dictionary_to_log_interval = '3s';
set global max_allowed_packet=1073741824;
set ob_query_timeout=100000000;
set ob_trx_timeout=100000000;
create database obcdc_db1;
use obcdc_db1;
ob1.oblog.gen_conf tb_white_list=oblog_tt.*.* enable_output_by_table_def=1 enable_output_hidden_primary_key=1 log_level=DEBUG skip_ob_version_compat_check=1;
ob1.oblog.set_extra_argument -m -i;
ob1.oblog.restart;
'#################### [CASE_BEGIN] Lob Column ####################'
create table lob_tbl (id int primary key, c1 varchar(10) generated always as ('OceanBase') virtual);
insert into lob_tbl(id) values (1);
ob1.oblog.next_dml;
[R0] BEGIN;[R0] org_cluster_id:1;[R1] record_type:INSERT;[R1] database_name:oblog_tt.obcdc_db1;[R1] table_name:lob_tbl;[R1] log_event:true;[R1] column_count:1;[R1] source_category:SRC_FULL_RECORDED;[R1] source_type:SRC_OCEANBASE_1_0;[R1] has_pk:true;[R1] pk_info:(0);[R1] pks:id;[R1] has_uk:false;[R1] uk_info:(null);[R1] uks:(null);[R1] [C1] column_name:id;[R1] [C1] column_type:MYSQL_TYPE_LONG;[R1] [C1] column_is_rowkey:true;[R1] [C1] column_is_signed:true;[R1] [C1] column_encoding:binary;[R1] [C1] column_is_not_null:true;[R1] [C1] column_value_new:[1](1);$[R2] COMMIT;
alter table lob_tbl add column c2 tinytext before c1;
insert into lob_tbl(id, c2) values (2, 'aaaaa');
select md5(c2) from lob_tbl where id=2;
md5(c2)
594f803b380a41396ed63dca39503542
ob1.oblog.next_dml;
[R0] BEGIN;[R0] org_cluster_id:1;[R1] record_type:INSERT;[R1] database_name:oblog_tt.obcdc_db1;[R1] table_name:lob_tbl;[R1] log_event:true;[R1] column_count:2;[R1] source_category:SRC_FULL_RECORDED;[R1] source_type:SRC_OCEANBASE_1_0;[R1] has_pk:true;[R1] pk_info:(0);[R1] pks:id;[R1] has_uk:false;[R1] uk_info:(null);[R1] uks:(null);[R1] [C1] column_name:id;[R1] [C1] column_type:MYSQL_TYPE_LONG;[R1] [C1] column_is_rowkey:true;[R1] [C1] column_is_signed:true;[R1] [C1] column_encoding:binary;[R1] [C1] column_is_not_null:true;[R1] [C1] column_value_new:[2](1);[R1] [C2] column_name:c2;[R1] [C2] column_type:MYSQL_TYPE_TINY_BLOB;[R1] [C2] column_is_rowkey:false;[R1] [C2] column_is_signed:true;[R1] [C2] column_encoding:utf8mb4;[R1] [C2] column_is_not_null:false;[R1] [C2] column_value_new_md5:[594f803b380a41396ed63dca39503542](5);$[R2] COMMIT;
alter table lob_tbl modify column c2 text;
insert into lob_tbl(id, c2) values (3, 'bbbbb');
select md5(c2) from lob_tbl where id=3;
md5(c2)
a21075a36eeddd084e17611a238c7101
ob1.oblog.next_dml;
[R0] BEGIN;[R0] org_cluster_id:1;[R1] record_type:INSERT;[R1] database_name:oblog_tt.obcdc_db1;[R1] table_name:lob_tbl;[R1] log_event:true;[R1] column_count:2;[R1] source_category:SRC_FULL_RECORDED;[R1] source_type:SRC_OCEANBASE_1_0;[R1] has_pk:true;[R1] pk_info:(0);[R1] pks:id;[R1] has_uk:false;[R1] uk_info:(null);[R1] uks:(null);[R1] [C1] column_name:id;[R1] [C1] column_type:MYSQL_TYPE_LONG;[R1] [C1] column_is_rowkey:true;[R1] [C1] column_is_signed:true;[R1] [C1] column_encoding:binary;[R1] [C1] column_is_not_null:true;[R1] [C1] column_value_new:[3](1);[R1] [C2] column_name:c2;[R1] [C2] column_type:MYSQL_TYPE_BLOB;[R1] [C2] column_is_rowkey:false;[R1] [C2] column_is_signed:true;[R1] [C2] column_encoding:utf8mb4;[R1] [C2] column_is_not_null:false;[R1] [C2] column_value_new_md5:[a21075a36eeddd084e17611a238c7101](5);$[R2] COMMIT;
alter table lob_tbl drop column c2, add column c3 longblob after c1;
insert into lob_tbl(id, c3) values (4, repeat('a', 50331647));
select md5(c3) from lob_tbl where id=4;
md5(c3)
c57d4c3741dc0eb85d767497f9736503
ob1.oblog.next_dml;
[R0] BEGIN;[R0] org_cluster_id:1;[R1] record_type:INSERT;[R1] database_name:oblog_tt.obcdc_db1;[R1] table_name:lob_tbl;[R1] log_event:true;[R1] column_count:2;[R1] source_category:SRC_FULL_RECORDED;[R1] source_type:SRC_OCEANBASE_1_0;[R1] has_pk:true;[R1] pk_info:(0);[R1] pks:id;[R1] has_uk:false;[R1] uk_info:(null);[R1] uks:(null);[R1] [C1] column_name:id;[R1] [C1] column_type:MYSQL_TYPE_LONG;[R1] [C1] column_is_rowkey:true;[R1] [C1] column_is_signed:true;[R1] [C1] column_encoding:binary;[R1] [C1] column_is_not_null:true;[R1] [C1] column_value_new:[4](1);[R1] [C2] column_name:c3;[R1] [C2] column_type:MYSQL_TYPE_LONG_BLOB;[R1] [C2] column_is_rowkey:false;[R1] [C2] column_is_signed:true;[R1] [C2] column_encoding:binary;[R1] [C2] column_is_not_null:false;[R1] [C2] column_value_new_md5:[c57d4c3741dc0eb85d767497f9736503](50331647);$[R2] COMMIT;
update lob_tbl set c3='c3longblob' where id=1;
select md5(c3) from lob_tbl where id=1;
md5(c3)
c02b95a0df2cf28490643e97ba3db50f
ob1.oblog.next_dml;
[R0] BEGIN;[R0] org_cluster_id:1;[R1] record_type:UPDATE;[R1] database_name:oblog_tt.obcdc_db1;[R1] table_name:lob_tbl;[R1] log_event:true;[R1] column_count:2;[R1] source_category:SRC_FULL_RECORDED;[R1] source_type:SRC_OCEANBASE_1_0;[R1] has_pk:true;[R1] pk_info:(0);[R1] pks:id;[R1] has_uk:false;[R1] uk_info:(null);[R1] uks:(null);[R1] [C1] column_name:id;[R1] [C1] column_type:MYSQL_TYPE_LONG;[R1] [C1] column_is_rowkey:true;[R1] [C1] column_is_signed:true;[R1] [C1] column_encoding:binary;[R1] [C1] column_is_not_null:true;[R1] [C1] column_value_new:[1](1);[R1] [C1] column_value_old:[1](1);[R1] [C2] column_name:c3;[R1] [C2] column_type:MYSQL_TYPE_LONG_BLOB;[R1] [C2] column_is_rowkey:false;[R1] [C2] column_is_signed:true;[R1] [C2] column_encoding:binary;[R1] [C2] column_is_not_null:false;[R1] [C2] column_value_new_md5:[c02b95a0df2cf28490643e97ba3db50f](10);[R1] [C2] column_value_old_md5:[NULL](0);$[R2] COMMIT;
delete from lob_tbl where id=1;
ob1.oblog.next_dml;
[R0] BEGIN;[R0] org_cluster_id:1;[R1] record_type:DELETE;[R1] database_name:oblog_tt.obcdc_db1;[R1] table_name:lob_tbl;[R1] log_event:true;[R1] column_count:2;[R1] source_category:SRC_FULL_RECORDED;[R1] source_type:SRC_OCEANBASE_1_0;[R1] has_pk:true;[R1] pk_info:(0);[R1] pks:id;[R1] has_uk:false;[R1] uk_info:(null);[R1] uks:(null);[R1] [C1] column_name:id;[R1] [C1] column_type:MYSQL_TYPE_LONG;[R1] [C1] column_is_rowkey:true;[R1] [C1] column_is_signed:true;[R1] [C1] column_encoding:binary;[R1] [C1] column_is_not_null:true;[R1] [C1] column_value_old:[1](1);[R1] [C2] column_name:c3;[R1] [C2] column_type:MYSQL_TYPE_LONG_BLOB;[R1] [C2] column_is_rowkey:false;[R1] [C2] column_is_signed:true;[R1] [C2] column_encoding:binary;[R1] [C2] column_is_not_null:false;[R1] [C2] column_value_old_md5:[c02b95a0df2cf28490643e97ba3db50f](10);$[R2] COMMIT;
create index lob_idx on lob_tbl (c3(10));
insert into lob_tbl(id, c3) values (5, 'bbbbbbb');
select md5(c3) from lob_tbl where id=5;
md5(c3)
e1faffe9c3c801f2f8c3fbe7cb032cb2
ob1.oblog.next_dml;
[R0] BEGIN;[R0] org_cluster_id:1;[R1] record_type:INSERT;[R1] database_name:oblog_tt.obcdc_db1;[R1] table_name:lob_tbl;[R1] log_event:true;[R1] column_count:2;[R1] source_category:SRC_FULL_RECORDED;[R1] source_type:SRC_OCEANBASE_1_0;[R1] has_pk:true;[R1] pk_info:(0);[R1] pks:id;[R1] has_uk:false;[R1] uk_info:(null);[R1] uks:(null);[R1] [C1] column_name:id;[R1] [C1] column_type:MYSQL_TYPE_LONG;[R1] [C1] column_is_rowkey:true;[R1] [C1] column_is_signed:true;[R1] [C1] column_encoding:binary;[R1] [C1] column_is_not_null:true;[R1] [C1] column_value_new:[5](1);[R1] [C2] column_name:c3;[R1] [C2] column_type:MYSQL_TYPE_LONG_BLOB;[R1] [C2] column_is_rowkey:false;[R1] [C2] column_is_signed:true;[R1] [C2] column_encoding:binary;[R1] [C2] column_is_not_null:false;[R1] [C2] column_is_dep_col_of_gen_col:true;[R1] [C2] column_value_new_md5:[e1faffe9c3c801f2f8c3fbe7cb032cb2](7);$[R2] COMMIT;
alter table lob_tbl add column c4 blob before c1;
insert into lob_tbl(id, c3, c4) values (6, repeat('c', 50331647), repeat('a', 65535));
select md5(c3), md5(c4) from lob_tbl where id=6;
md5(c3)	md5(c4)
1c273a781ce88675380f7d163d4a0718	22686eba65441cdc1795f276dcdd4e45
ob1.oblog.next_dml;
[R0] BEGIN;[R0] org_cluster_id:1;[R1] record_type:INSERT;[R1] database_name:oblog_tt.obcdc_db1;[R1] table_name:lob_tbl;[R1] log_event:true;[R1] column_count:3;[R1] source_category:SRC_FULL_RECORDED;[R1] source_type:SRC_OCEANBASE_1_0;[R1] has_pk:true;[R1] pk_info:(0);[R1] pks:id;[R1] has_uk:false;[R1] uk_info:(null);[R1] uks:(null);[R1] [C1] column_name:id;[R1] [C1] column_type:MYSQL_TYPE_LONG;[R1] [C1] column_is_rowkey:true;[R1] [C1] column_is_signed:true;[R1] [C1] column_encoding:binary;[R1] [C1] column_is_not_null:true;[R1] [C1] column_value_new:[6](1);[R1] [C2] column_name:c4;[R1] [C2] column_type:MYSQL_TYPE_BLOB;[R1] [C2] column_is_rowkey:false;[R1] [C2] column_is_signed:true;[R1] [C2] column_encoding:binary;[R1] [C2] column_is_not_null:false;[R1] [C2] column_value_new_md5:[22686eba65441cdc1795f276dcdd4e45](65535);[R1] [C3] column_name:c3;[R1] [C3] column_type:MYSQL_TYPE_LONG_BLOB;[R1] [C3] column_is_rowkey:false;[R1] [C3] column_is_signed:true;[R1] [C3] column_encoding:binary;[R1] [C3] column_is_not_null:false;[R1] [C3] column_is_dep_col_of_gen_col:true;[R1] [C3] column_value_new_md5:[1c273a781ce88675380f7d163d4a0718](50331647);$[R2] COMMIT;
delete from lob_tbl where id=3;
ob1.oblog.next_dml;
[R0] BEGIN;[R0] org_cluster_id:1;[R1] record_type:DELETE;[R1] database_name:oblog_tt.obcdc_db1;[R1] table_name:lob_tbl;[R1] log_event:true;[R1] column_count:3;[R1] source_category:SRC_FULL_RECORDED;[R1] source_type:SRC_OCEANBASE_1_0;[R1] has_pk:true;[R1] pk_info:(0);[R1] pks:id;[R1] has_uk:false;[R1] uk_info:(null);[R1] uks:(null);[R1] [C1] column_name:id;[R1] [C1] column_type:MYSQL_TYPE_LONG;[R1] [C1] column_is_rowkey:true;[R1] [C1] column_is_signed:true;[R1] [C1] column_encoding:binary;[R1] [C1] column_is_not_null:true;[R1] [C1] column_value_old:[3](1);[R1] [C2] column_name:c4;[R1] [C2] column_type:MYSQL_TYPE_BLOB;[R1] [C2] column_is_rowkey:false;[R1] [C2] column_is_signed:true;[R1] [C2] column_encoding:binary;[R1] [C2] column_is_not_null:false;[R1] [C2] column_value_old_md5:[NULL](0);[R1] [C3] column_name:c3;[R1] [C3] column_type:MYSQL_TYPE_LONG_BLOB;[R1] [C3] column_is_rowkey:false;[R1] [C3] column_is_signed:true;[R1] [C3] column_encoding:binary;[R1] [C3] column_is_not_null:false;[R1] [C3] column_is_dep_col_of_gen_col:true;[R1] [C3] column_value_old_md5:[NULL](0);$[R2] COMMIT;
alter table lob_tbl modify column c4 mediumblob;
update lob_tbl set c3='ccccc', c4 = repeat('a', 16777215) where id=6;
select md5(c3), md5(c4) from lob_tbl where id=6;
md5(c3)	md5(c4)
67c762276bced09ee4df0ed537d164ea	59bc7c3cf08fcff32cf523fcd58df01d
ob1.oblog.next_dml;
[R0] BEGIN;[R0] org_cluster_id:1;[R1] record_type:UPDATE;[R1] database_name:oblog_tt.obcdc_db1;[R1] table_name:lob_tbl;[R1] log_event:true;[R1] column_count:3;[R1] source_category:SRC_FULL_RECORDED;[R1] source_type:SRC_OCEANBASE_1_0;[R1] has_pk:true;[R1] pk_info:(0);[R1] pks:id;[R1] has_uk:false;[R1] uk_info:(null);[R1] uks:(null);[R1] [C1] column_name:id;[R1] [C1] column_type:MYSQL_TYPE_LONG;[R1] [C1] column_is_rowkey:true;[R1] [C1] column_is_signed:true;[R1] [C1] column_encoding:binary;[R1] [C1] column_is_not_null:true;[R1] [C1] column_value_new:[6](1);[R1] [C1] column_value_old:[6](1);[R1] [C2] column_name:c4;[R1] [C2] column_type:MYSQL_TYPE_MEDIUM_BLOB;[R1] [C2] column_is_rowkey:false;[R1] [C2] column_is_signed:true;[R1] [C2] column_encoding:binary;[R1] [C2] column_is_not_null:false;[R1] [C2] column_value_new_md5:[59bc7c3cf08fcff32cf523fcd58df01d](16777215);[R1] [C2] column_value_old_md5:[22686eba65441cdc1795f276dcdd4e45](65535);[R1] [C3] column_name:c3;[R1] [C3] column_type:MYSQL_TYPE_LONG_BLOB;[R1] [C3] column_is_rowkey:false;[R1] [C3] column_is_signed:true;[R1] [C3] column_encoding:binary;[R1] [C3] column_is_not_null:false;[R1] [C3] column_is_dep_col_of_gen_col:true;[R1] [C3] column_value_new_md5:[67c762276bced09ee4df0ed537d164ea](5);[R1] [C3] column_value_old_md5:[1c273a781ce88675380f7d163d4a0718](50331647);$[R2] COMMIT;
update lob_tbl set c3='ddddd', c4 = repeat('b', 16777215) where id=6;
select md5(c3), md5(c4) from lob_tbl where id=6;
md5(c3)	md5(c4)
50f84daf3a6dfd6a9f20c9f8ef428942	f7947c3138becb8e8f0eafe783f639c6
ob1.oblog.next_dml;
[R0] BEGIN;[R0] org_cluster_id:1;[R1] record_type:UPDATE;[R1] database_name:oblog_tt.obcdc_db1;[R1] table_name:lob_tbl;[R1] log_event:true;[R1] column_count:3;[R1] source_category:SRC_FULL_RECORDED;[R1] source_type:SRC_OCEANBASE_1_0;[R1] has_pk:true;[R1] pk_info:(0);[R1] pks:id;[R1] has_uk:false;[R1] uk_info:(null);[R1] uks:(null);[R1] [C1] column_name:id;[R1] [C1] column_type:MYSQL_TYPE_LONG;[R1] [C1] column_is_rowkey:true;[R1] [C1] column_is_signed:true;[R1] [C1] column_encoding:binary;[R1] [C1] column_is_not_null:true;[R1] [C1] column_value_new:[6](1);[R1] [C1] column_value_old:[6](1);[R1] [C2] column_name:c4;[R1] [C2] column_type:MYSQL_TYPE_MEDIUM_BLOB;[R1] [C2] column_is_rowkey:false;[R1] [C2] column_is_signed:true;[R1] [C2] column_encoding:binary;[R1] [C2] column_is_not_null:false;[R1] [C2] column_value_new_md5:[f7947c3138becb8e8f0eafe783f639c6](16777215);[R1] [C2] column_value_old_md5:[59bc7c3cf08fcff32cf523fcd58df01d](16777215);[R1] [C3] column_name:c3;[R1] [C3] column_type:MYSQL_TYPE_LONG_BLOB;[R1] [C3] column_is_rowkey:false;[R1] [C3] column_is_signed:true;[R1] [C3] column_encoding:binary;[R1] [C3] column_is_not_null:false;[R1] [C3] column_is_dep_col_of_gen_col:true;[R1] [C3] column_value_new_md5:[50f84daf3a6dfd6a9f20c9f8ef428942](5);[R1] [C3] column_value_old_md5:[67c762276bced09ee4df0ed537d164ea](5);$[R2] COMMIT;
update lob_tbl set c3=repeat('a', 5242880) where id=6;
select md5(c3), md5(c4) from lob_tbl where id=6;
md5(c3)	md5(c4)
79b281060d337b9b2b84ccf390adcf74	f7947c3138becb8e8f0eafe783f639c6
ob1.oblog.next_dml;
[R0] BEGIN;[R0] org_cluster_id:1;[R1] record_type:UPDATE;[R1] database_name:oblog_tt.obcdc_db1;[R1] table_name:lob_tbl;[R1] log_event:true;[R1] column_count:3;[R1] source_category:SRC_FULL_RECORDED;[R1] source_type:SRC_OCEANBASE_1_0;[R1] has_pk:true;[R1] pk_info:(0);[R1] pks:id;[R1] has_uk:false;[R1] uk_info:(null);[R1] uks:(null);[R1] [C1] column_name:id;[R1] [C1] column_type:MYSQL_TYPE_LONG;[R1] [C1] column_is_rowkey:true;[R1] [C1] column_is_signed:true;[R1] [C1] column_encoding:binary;[R1] [C1] column_is_not_null:true;[R1] [C1] column_value_new:[6](1);[R1] [C1] column_value_old:[6](1);[R1] [C2] column_name:c4;[R1] [C2] column_type:MYSQL_TYPE_MEDIUM_BLOB;[R1] [C2] column_is_rowkey:false;[R1] [C2] column_is_signed:true;[R1] [C2] column_encoding:binary;[R1] [C2] column_is_not_null:false;[R1] [C2] column_value_new_md5:[NULL](0);[R1] [C2] column_value_old_md5:[NULL](0);[R1] [C3] column_name:c3;[R1] [C3] column_type:MYSQL_TYPE_LONG_BLOB;[R1] [C3] column_is_rowkey:false;[R1] [C3] column_is_signed:true;[R1] [C3] column_encoding:binary;[R1] [C3] column_is_not_null:false;[R1] [C3] column_is_dep_col_of_gen_col:true;[R1] [C3] column_value_new_md5:[79b281060d337b9b2b84ccf390adcf74](5242880);[R1] [C3] column_value_old_md5:[50f84daf3a6dfd6a9f20c9f8ef428942](5);$[R2] COMMIT;
delete from lob_tbl where id = 5;
ob1.oblog.next_dml;
[R0] BEGIN;[R0] org_cluster_id:1;[R1] record_type:DELETE;[R1] database_name:oblog_tt.obcdc_db1;[R1] table_name:lob_tbl;[R1] log_event:true;[R1] column_count:3;[R1] source_category:SRC_FULL_RECORDED;[R1] source_type:SRC_OCEANBASE_1_0;[R1] has_pk:true;[R1] pk_info:(0);[R1] pks:id;[R1] has_uk:false;[R1] uk_info:(null);[R1] uks:(null);[R1] [C1] column_name:id;[R1] [C1] column_type:MYSQL_TYPE_LONG;[R1] [C1] column_is_rowkey:true;[R1] [C1] column_is_signed:true;[R1] [C1] column_encoding:binary;[R1] [C1] column_is_not_null:true;[R1] [C1] column_value_old:[5](1);[R1] [C2] column_name:c4;[R1] [C2] column_type:MYSQL_TYPE_MEDIUM_BLOB;[R1] [C2] column_is_rowkey:false;[R1] [C2] column_is_signed:true;[R1] [C2] column_encoding:binary;[R1] [C2] column_is_not_null:false;[R1] [C2] column_value_old_md5:[NULL](0);[R1] [C3] column_name:c3;[R1] [C3] column_type:MYSQL_TYPE_LONG_BLOB;[R1] [C3] column_is_rowkey:false;[R1] [C3] column_is_signed:true;[R1] [C3] column_encoding:binary;[R1] [C3] column_is_not_null:false;[R1] [C3] column_is_dep_col_of_gen_col:true;[R1] [C3] column_value_old_md5:[e1faffe9c3c801f2f8c3fbe7cb032cb2](7);$[R2] COMMIT;
alter table lob_tbl drop primary key;
insert into lob_tbl(id, c3, c4) values (7, 'eee', 'ddd');
select md5(c3), md5(c4) from lob_tbl where id=7;
md5(c3)	md5(c4)
d2f2297d6e829cd3493aa7de4416a18f	77963b7a931377ad4ab5ad6a9cd718aa
ob1.oblog.next_dml;
[R0] BEGIN;[R0] org_cluster_id:1;[R1] record_type:INSERT;[R1] database_name:oblog_tt.obcdc_db1;[R1] table_name:lob_tbl;[R1] log_event:true;[R1] column_count:4;[R1] source_category:SRC_FULL_RECORDED;[R1] source_type:SRC_OCEANBASE_1_0;[R1] has_pk:true;[R1] pk_info:(3);[R1] pks:__pk_increment;[R1] has_uk:false;[R1] uk_info:(null);[R1] uks:(null);[R1] [C1] column_name:id;[R1] [C1] column_type:MYSQL_TYPE_LONG;[R1] [C1] column_is_rowkey:false;[R1] [C1] column_is_signed:true;[R1] [C1] column_encoding:binary;[R1] [C1] column_is_not_null:true;[R1] [C1] column_value_new:[7](1);[R1] [C2] column_name:c4;[R1] [C2] column_type:MYSQL_TYPE_MEDIUM_BLOB;[R1] [C2] column_is_rowkey:false;[R1] [C2] column_is_signed:true;[R1] [C2] column_encoding:binary;[R1] [C2] column_is_not_null:false;[R1] [C2] column_value_new_md5:[77963b7a931377ad4ab5ad6a9cd718aa](3);[R1] [C3] column_name:c3;[R1] [C3] column_type:MYSQL_TYPE_LONG_BLOB;[R1] [C3] column_is_rowkey:false;[R1] [C3] column_is_signed:true;[R1] [C3] column_encoding:binary;[R1] [C3] column_is_not_null:false;[R1] [C3] column_is_dep_col_of_gen_col:true;[R1] [C3] column_value_new_md5:[d2f2297d6e829cd3493aa7de4416a18f](3);[R1] [C4] column_name:__pk_increment;[R1] [C4] column_type:MYSQL_TYPE_LONGLONG;[R1] [C4] column_is_rowkey:true;[R1] [C4] column_is_signed:false;[R1] [C4] column_encoding:binary;[R1] [C4] column_is_not_null:true;[R1] [C4] column_value_new:[10001](5);$[R2] COMMIT;
alter table lob_tbl modify column c1 varchar(10) generated always as ('OceanBase') virtual first, modify column c3 longblob after c1, modify column c4 mediumblob after c3, modify column id int after c4;
insert into lob_tbl(id, c3, c4) values (8, 'fff', repeat('e', 16777215));
select md5(c3), md5(c4) from lob_tbl where id=8;
md5(c3)	md5(c4)
343d9040a671c45832ee5381860e2996	74d3cfe47b3df992dc047893e6020b94
ob1.oblog.next_dml;
[R0] BEGIN;[R0] org_cluster_id:1;[R1] record_type:INSERT;[R1] database_name:oblog_tt.obcdc_db1;[R1] table_name:lob_tbl;[R1] log_event:true;[R1] column_count:4;[R1] source_category:SRC_FULL_RECORDED;[R1] source_type:SRC_OCEANBASE_1_0;[R1] has_pk:true;[R1] pk_info:(3);[R1] pks:__pk_increment;[R1] has_uk:false;[R1] uk_info:(null);[R1] uks:(null);[R1] [C1] column_name:c3;[R1] [C1] column_type:MYSQL_TYPE_LONG_BLOB;[R1] [C1] column_is_rowkey:false;[R1] [C1] column_is_signed:true;[R1] [C1] column_encoding:binary;[R1] [C1] column_is_not_null:false;[R1] [C1] column_is_dep_col_of_gen_col:true;[R1] [C1] column_value_new_md5:[343d9040a671c45832ee5381860e2996](3);[R1] [C2] column_name:c4;[R1] [C2] column_type:MYSQL_TYPE_MEDIUM_BLOB;[R1] [C2] column_is_rowkey:false;[R1] [C2] column_is_signed:true;[R1] [C2] column_encoding:binary;[R1] [C2] column_is_not_null:false;[R1] [C2] column_value_new_md5:[74d3cfe47b3df992dc047893e6020b94](16777215);[R1] [C3] column_name:id;[R1] [C3] column_type:MYSQL_TYPE_LONG;[R1] [C3] column_is_rowkey:false;[R1] [C3] column_is_signed:true;[R1] [C3] column_encoding:binary;[R1] [C3] column_is_not_null:false;[R1] [C3] column_value_new:[8](1);[R1] [C4] column_name:__pk_increment;[R1] [C4] column_type:MYSQL_TYPE_LONGLONG;[R1] [C4] column_is_rowkey:true;[R1] [C4] column_is_signed:false;[R1] [C4] column_encoding:binary;[R1] [C4] column_is_not_null:true;[R1] [C4] column_value_new:[20001](5);$[R2] COMMIT;
alter table lob_tbl add column c5 int generated always as (id+1) stored before id;
insert into lob_tbl(id, c3, c4) values (9, repeat('g', 16777215) , repeat('f', 16777215));
select md5(c3), md5(c4) from lob_tbl where id=9;
md5(c3)	md5(c4)
302a43721d74c0442eda8741a016aaef	c2692c60eecd0a043304ba5022b9aa94
ob1.oblog.next_dml;
[R0] BEGIN;[R0] org_cluster_id:1;[R1] record_type:INSERT;[R1] database_name:oblog_tt.obcdc_db1;[R1] table_name:lob_tbl;[R1] log_event:true;[R1] column_count:5;[R1] source_category:SRC_FULL_RECORDED;[R1] source_type:SRC_OCEANBASE_1_0;[R1] has_pk:true;[R1] pk_info:(4);[R1] pks:__pk_increment;[R1] has_uk:false;[R1] uk_info:(null);[R1] uks:(null);[R1] [C1] column_name:c3;[R1] [C1] column_type:MYSQL_TYPE_LONG_BLOB;[R1] [C1] column_is_rowkey:false;[R1] [C1] column_is_signed:true;[R1] [C1] column_encoding:binary;[R1] [C1] column_is_not_null:false;[R1] [C1] column_is_dep_col_of_gen_col:true;[R1] [C1] column_value_new_md5:[302a43721d74c0442eda8741a016aaef](16777215);[R1] [C2] column_name:c4;[R1] [C2] column_type:MYSQL_TYPE_MEDIUM_BLOB;[R1] [C2] column_is_rowkey:false;[R1] [C2] column_is_signed:true;[R1] [C2] column_encoding:binary;[R1] [C2] column_is_not_null:false;[R1] [C2] column_value_new_md5:[c2692c60eecd0a043304ba5022b9aa94](16777215);[R1] [C3] column_name:c5;[R1] [C3] column_type:MYSQL_TYPE_LONG;[R1] [C3] column_is_rowkey:false;[R1] [C3] column_is_signed:true;[R1] [C3] column_encoding:binary;[R1] [C3] column_is_not_null:false;[R1] [C3] is_generated_column:1;[R1] [C3] column_value_new:[10](2);[R1] [C4] column_name:id;[R1] [C4] column_type:MYSQL_TYPE_LONG;[R1] [C4] column_is_rowkey:false;[R1] [C4] column_is_signed:true;[R1] [C4] column_encoding:binary;[R1] [C4] column_is_not_null:false;[R1] [C4] column_is_dep_col_of_gen_col:true;[R1] [C4] column_value_new:[9](1);[R1] [C5] column_name:__pk_increment;[R1] [C5] column_type:MYSQL_TYPE_LONGLONG;[R1] [C5] column_is_rowkey:true;[R1] [C5] column_is_signed:false;[R1] [C5] column_encoding:binary;[R1] [C5] column_is_not_null:true;[R1] [C5] column_value_new:[30001](5);$[R2] COMMIT;
update lob_tbl set c3='hhhhhhh' where id=2;
select md5(c3) from lob_tbl where id=2;
md5(c3)
b5c75e6bbcfcd0e6520b5f1419ded614
ob1.oblog.next_dml;
[R0] BEGIN;[R0] org_cluster_id:1;[R1] record_type:UPDATE;[R1] database_name:oblog_tt.obcdc_db1;[R1] table_name:lob_tbl;[R1] log_event:true;[R1] column_count:5;[R1] source_category:SRC_FULL_RECORDED;[R1] source_type:SRC_OCEANBASE_1_0;[R1] has_pk:true;[R1] pk_info:(4);[R1] pks:__pk_increment;[R1] has_uk:false;[R1] uk_info:(null);[R1] uks:(null);[R1] [C1] column_name:c3;[R1] [C1] column_type:MYSQL_TYPE_LONG_BLOB;[R1] [C1] column_is_rowkey:false;[R1] [C1] column_is_signed:true;[R1] [C1] column_encoding:binary;[R1] [C1] column_is_not_null:false;[R1] [C1] column_is_dep_col_of_gen_col:true;[R1] [C1] column_value_new_md5:[b5c75e6bbcfcd0e6520b5f1419ded614](7);[R1] [C1] column_value_old_md5:[NULL](0);[R1] [C2] column_name:c4;[R1] [C2] column_type:MYSQL_TYPE_MEDIUM_BLOB;[R1] [C2] column_is_rowkey:false;[R1] [C2] column_is_signed:true;[R1] [C2] column_encoding:binary;[R1] [C2] column_is_not_null:false;[R1] [C2] column_value_new_md5:[NULL](0);[R1] [C2] column_value_old_md5:[NULL](0);[R1] [C3] column_name:c5;[R1] [C3] column_type:MYSQL_TYPE_LONG;[R1] [C3] column_is_rowkey:false;[R1] [C3] column_is_signed:true;[R1] [C3] column_encoding:binary;[R1] [C3] column_is_not_null:false;[R1] [C3] is_generated_column:1;[R1] [C3] column_value_new:[3](1);[R1] [C3] column_value_old:[3](1);[R1] [C4] column_name:id;[R1] [C4] column_type:MYSQL_TYPE_LONG;[R1] [C4] column_is_rowkey:false;[R1] [C4] column_is_signed:true;[R1] [C4] column_encoding:binary;[R1] [C4] column_is_not_null:false;[R1] [C4] column_is_dep_col_of_gen_col:true;[R1] [C4] column_value_new:[2](1);[R1] [C4] column_value_old:[2](1);[R1] [C5] column_name:__pk_increment;[R1] [C5] column_type:MYSQL_TYPE_LONGLONG;[R1] [C5] column_is_rowkey:true;[R1] [C5] column_is_signed:false;[R1] [C5] column_encoding:binary;[R1] [C5] column_is_not_null:true;[R1] [C5] column_value_new:[1](1);[R1] [C5] column_value_old:[1](1);$[R2] COMMIT;
delete from lob_tbl where id=4;
ob1.oblog.next_dml;
[R0] BEGIN;[R0] org_cluster_id:1;[R1] record_type:DELETE;[R1] database_name:oblog_tt.obcdc_db1;[R1] table_name:lob_tbl;[R1] log_event:true;[R1] column_count:5;[R1] source_category:SRC_FULL_RECORDED;[R1] source_type:SRC_OCEANBASE_1_0;[R1] has_pk:true;[R1] pk_info:(4);[R1] pks:__pk_increment;[R1] has_uk:false;[R1] uk_info:(null);[R1] uks:(null);[R1] [C1] column_name:c3;[R1] [C1] column_type:MYSQL_TYPE_LONG_BLOB;[R1] [C1] column_is_rowkey:false;[R1] [C1] column_is_signed:true;[R1] [C1] column_encoding:binary;[R1] [C1] column_is_not_null:false;[R1] [C1] column_is_dep_col_of_gen_col:true;[R1] [C1] column_value_old_md5:[NULL](0);[R1] [C2] column_name:c4;[R1] [C2] column_type:MYSQL_TYPE_MEDIUM_BLOB;[R1] [C2] column_is_rowkey:false;[R1] [C2] column_is_signed:true;[R1] [C2] column_encoding:binary;[R1] [C2] column_is_not_null:false;[R1] [C2] column_value_old_md5:[NULL](0);[R1] [C3] column_name:c5;[R1] [C3] column_type:MYSQL_TYPE_LONG;[R1] [C3] column_is_rowkey:false;[R1] [C3] column_is_signed:true;[R1] [C3] column_encoding:binary;[R1] [C3] column_is_not_null:false;[R1] [C3] is_generated_column:1;[R1] [C3] column_value_old:[5](1);[R1] [C4] column_name:id;[R1] [C4] column_type:MYSQL_TYPE_LONG;[R1] [C4] column_is_rowkey:false;[R1] [C4] column_is_signed:true;[R1] [C4] column_encoding:binary;[R1] [C4] column_is_not_null:false;[R1] [C4] column_is_dep_col_of_gen_col:true;[R1] [C4] column_value_old:[4](1);[R1] [C5] column_name:__pk_increment;[R1] [C5] column_type:MYSQL_TYPE_LONGLONG;[R1] [C5] column_is_rowkey:true;[R1] [C5] column_is_signed:false;[R1] [C5] column_encoding:binary;[R1] [C5] column_is_not_null:true;[R1] [C5] column_value_old:[2](1);$[R2] COMMIT;
'#################### [CASE_END] Lob Column ####################'
'#################### [CASE_BEGIN] Enum Set Column ####################'
create table enum_set_tbl(id int, c1 enum('e', 'n', 'u', 'm'));
insert into enum_set_tbl(id, c1) values (1, 1);
ob1.oblog.next_dml;
[R0] BEGIN;[R0] org_cluster_id:1;[R1] record_type:INSERT;[R1] database_name:oblog_tt.obcdc_db1;[R1] table_name:enum_set_tbl;[R1] log_event:true;[R1] column_count:3;[R1] source_category:SRC_FULL_RECORDED;[R1] source_type:SRC_OCEANBASE_1_0;[R1] has_pk:true;[R1] pk_info:(2);[R1] pks:__pk_increment;[R1] has_uk:false;[R1] uk_info:(null);[R1] uks:(null);[R1] [C1] column_name:id;[R1] [C1] column_type:MYSQL_TYPE_LONG;[R1] [C1] column_is_rowkey:false;[R1] [C1] column_is_signed:true;[R1] [C1] column_encoding:binary;[R1] [C1] column_is_not_null:false;[R1] [C1] column_value_new:[1](1);[R1] [C2] column_name:c1;[R1] [C2] column_type:MYSQL_TYPE_ENUM;[R1] [C2] column_is_rowkey:false;[R1] [C2] column_is_signed:true;[R1] [C2] column_encoding:utf8mb4;[R1] [C2] column_is_not_null:false;[R1] [C2] column_extend_info:e,n,u,m;[R1] [C2] column_value_new:[e](1);[R1] [C3] column_name:__pk_increment;[R1] [C3] column_type:MYSQL_TYPE_LONGLONG;[R1] [C3] column_is_rowkey:true;[R1] [C3] column_is_signed:false;[R1] [C3] column_encoding:binary;[R1] [C3] column_is_not_null:true;[R1] [C3] column_value_new:[1](1);$[R2] COMMIT;
alter table enum_set_tbl add column c2 set('s', 'e', 't') default 's';
insert into enum_set_tbl(id, c1, c2) values (2, 'n', 's');
ob1.oblog.next_dml;
[R0] BEGIN;[R0] org_cluster_id:1;[R1] record_type:INSERT;[R1] database_name:oblog_tt.obcdc_db1;[R1] table_name:enum_set_tbl;[R1] log_event:true;[R1] column_count:4;[R1] source_category:SRC_FULL_RECORDED;[R1] source_type:SRC_OCEANBASE_1_0;[R1] has_pk:true;[R1] pk_info:(2);[R1] pks:__pk_increment;[R1] has_uk:false;[R1] uk_info:(null);[R1] uks:(null);[R1] [C1] column_name:id;[R1] [C1] column_type:MYSQL_TYPE_LONG;[R1] [C1] column_is_rowkey:false;[R1] [C1] column_is_signed:true;[R1] [C1] column_encoding:binary;[R1] [C1] column_is_not_null:false;[R1] [C1] column_value_new:[2](1);[R1] [C2] column_name:c1;[R1] [C2] column_type:MYSQL_TYPE_ENUM;[R1] [C2] column_is_rowkey:false;[R1] [C2] column_is_signed:true;[R1] [C2] column_encoding:utf8mb4;[R1] [C2] column_is_not_null:false;[R1] [C2] column_extend_info:e,n,u,m;[R1] [C2] column_value_new:[n](1);[R1] [C3] column_name:__pk_increment;[R1] [C3] column_type:MYSQL_TYPE_LONGLONG;[R1] [C3] column_is_rowkey:true;[R1] [C3] column_is_signed:false;[R1] [C3] column_encoding:binary;[R1] [C3] column_is_not_null:true;[R1] [C3] column_value_new:[2](1);[R1] [C4] column_name:c2;[R1] [C4] column_type:MYSQL_TYPE_SET;[R1] [C4] column_is_rowkey:false;[R1] [C4] column_is_signed:true;[R1] [C4] column_encoding:utf8mb4;[R1] [C4] column_is_not_null:false;[R1] [C4] column_extend_info:s,e,t;[R1] [C4] column_value_new:[s](1);$[R2] COMMIT;
alter table enum_set_tbl add primary key (c1);
insert into enum_set_tbl(id, c1, c2) values (3, 'u', 'e');
ob1.oblog.next_dml;
[R0] BEGIN;[R0] org_cluster_id:1;[R1] record_type:INSERT;[R1] database_name:oblog_tt.obcdc_db1;[R1] table_name:enum_set_tbl;[R1] log_event:true;[R1] column_count:3;[R1] source_category:SRC_FULL_RECORDED;[R1] source_type:SRC_OCEANBASE_1_0;[R1] has_pk:true;[R1] pk_info:(1);[R1] pks:c1;[R1] has_uk:false;[R1] uk_info:(null);[R1] uks:(null);[R1] [C1] column_name:id;[R1] [C1] column_type:MYSQL_TYPE_LONG;[R1] [C1] column_is_rowkey:false;[R1] [C1] column_is_signed:true;[R1] [C1] column_encoding:binary;[R1] [C1] column_is_not_null:false;[R1] [C1] column_value_new:[3](1);[R1] [C2] column_name:c1;[R1] [C2] column_type:MYSQL_TYPE_ENUM;[R1] [C2] column_is_rowkey:true;[R1] [C2] column_is_signed:true;[R1] [C2] column_encoding:utf8mb4;[R1] [C2] column_is_not_null:true;[R1] [C2] column_extend_info:e,n,u,m;[R1] [C2] column_value_new:[u](1);[R1] [C3] column_name:c2;[R1] [C3] column_type:MYSQL_TYPE_SET;[R1] [C3] column_is_rowkey:false;[R1] [C3] column_is_signed:true;[R1] [C3] column_encoding:utf8mb4;[R1] [C3] column_is_not_null:false;[R1] [C3] column_extend_info:s,e,t;[R1] [C3] column_value_new:[e](1);$[R2] COMMIT;
alter table enum_set_tbl drop primary key, add primary key (id);
insert into enum_set_tbl(id, c1, c2) values (4, 'm', 't');
ob1.oblog.next_dml;
[R0] BEGIN;[R0] org_cluster_id:1;[R1] record_type:INSERT;[R1] database_name:oblog_tt.obcdc_db1;[R1] table_name:enum_set_tbl;[R1] log_event:true;[R1] column_count:3;[R1] source_category:SRC_FULL_RECORDED;[R1] source_type:SRC_OCEANBASE_1_0;[R1] has_pk:true;[R1] pk_info:(0);[R1] pks:id;[R1] has_uk:false;[R1] uk_info:(null);[R1] uks:(null);[R1] [C1] column_name:id;[R1] [C1] column_type:MYSQL_TYPE_LONG;[R1] [C1] column_is_rowkey:true;[R1] [C1] column_is_signed:true;[R1] [C1] column_encoding:binary;[R1] [C1] column_is_not_null:true;[R1] [C1] column_value_new:[4](1);[R1] [C2] column_name:c1;[R1] [C2] column_type:MYSQL_TYPE_ENUM;[R1] [C2] column_is_rowkey:false;[R1] [C2] column_is_signed:true;[R1] [C2] column_encoding:utf8mb4;[R1] [C2] column_is_not_null:true;[R1] [C2] column_extend_info:e,n,u,m;[R1] [C2] column_value_new:[m](1);[R1] [C3] column_name:c2;[R1] [C3] column_type:MYSQL_TYPE_SET;[R1] [C3] column_is_rowkey:false;[R1] [C3] column_is_signed:true;[R1] [C3] column_encoding:utf8mb4;[R1] [C3] column_is_not_null:false;[R1] [C3] column_extend_info:s,e,t;[R1] [C3] column_value_new:[t](1);$[R2] COMMIT;
delete from enum_set_tbl where id=2;
ob1.oblog.next_dml;
[R0] BEGIN;[R0] org_cluster_id:1;[R1] record_type:DELETE;[R1] database_name:oblog_tt.obcdc_db1;[R1] table_name:enum_set_tbl;[R1] log_event:true;[R1] column_count:3;[R1] source_category:SRC_FULL_RECORDED;[R1] source_type:SRC_OCEANBASE_1_0;[R1] has_pk:true;[R1] pk_info:(0);[R1] pks:id;[R1] has_uk:false;[R1] uk_info:(null);[R1] uks:(null);[R1] [C1] column_name:id;[R1] [C1] column_type:MYSQL_TYPE_LONG;[R1] [C1] column_is_rowkey:true;[R1] [C1] column_is_signed:true;[R1] [C1] column_encoding:binary;[R1] [C1] column_is_not_null:true;[R1] [C1] column_value_old:[2](1);[R1] [C2] column_name:c1;[R1] [C2] column_type:MYSQL_TYPE_ENUM;[R1] [C2] column_is_rowkey:false;[R1] [C2] column_is_signed:true;[R1] [C2] column_encoding:utf8mb4;[R1] [C2] column_is_not_null:true;[R1] [C2] column_extend_info:e,n,u,m;[R1] [C2] column_value_old:[n](1);[R1] [C3] column_name:c2;[R1] [C3] column_type:MYSQL_TYPE_SET;[R1] [C3] column_is_rowkey:false;[R1] [C3] column_is_signed:true;[R1] [C3] column_encoding:utf8mb4;[R1] [C3] column_is_not_null:false;[R1] [C3] column_extend_info:s,e,t;[R1] [C3] column_value_old:[s](1);$[R2] COMMIT;
alter table enum_set_tbl add column c3 varchar(20) generated always as (concat(c1, c2)) virtual;
insert into enum_set_tbl(id, c1, c2) values (5, 'e','s,t');
ob1.oblog.next_dml;
[R0] BEGIN;[R0] org_cluster_id:1;[R1] record_type:INSERT;[R1] database_name:oblog_tt.obcdc_db1;[R1] table_name:enum_set_tbl;[R1] log_event:true;[R1] column_count:3;[R1] source_category:SRC_FULL_RECORDED;[R1] source_type:SRC_OCEANBASE_1_0;[R1] has_pk:true;[R1] pk_info:(0);[R1] pks:id;[R1] has_uk:false;[R1] uk_info:(null);[R1] uks:(null);[R1] [C1] column_name:id;[R1] [C1] column_type:MYSQL_TYPE_LONG;[R1] [C1] column_is_rowkey:true;[R1] [C1] column_is_signed:true;[R1] [C1] column_encoding:binary;[R1] [C1] column_is_not_null:true;[R1] [C1] column_value_new:[5](1);[R1] [C2] column_name:c1;[R1] [C2] column_type:MYSQL_TYPE_ENUM;[R1] [C2] column_is_rowkey:false;[R1] [C2] column_is_signed:true;[R1] [C2] column_encoding:utf8mb4;[R1] [C2] column_is_not_null:true;[R1] [C2] column_is_dep_col_of_gen_col:true;[R1] [C2] column_extend_info:e,n,u,m;[R1] [C2] column_value_new:[e](1);[R1] [C3] column_name:c2;[R1] [C3] column_type:MYSQL_TYPE_SET;[R1] [C3] column_is_rowkey:false;[R1] [C3] column_is_signed:true;[R1] [C3] column_encoding:utf8mb4;[R1] [C3] column_is_not_null:false;[R1] [C3] column_is_dep_col_of_gen_col:true;[R1] [C3] column_extend_info:s,e,t;[R1] [C3] column_value_new:[s,t](3);$[R2] COMMIT;
update enum_set_tbl set c2 = 's,e' where id=1;
ob1.oblog.next_dml;
[R0] BEGIN;[R0] org_cluster_id:1;[R1] record_type:UPDATE;[R1] database_name:oblog_tt.obcdc_db1;[R1] table_name:enum_set_tbl;[R1] log_event:true;[R1] column_count:3;[R1] source_category:SRC_FULL_RECORDED;[R1] source_type:SRC_OCEANBASE_1_0;[R1] has_pk:true;[R1] pk_info:(0);[R1] pks:id;[R1] has_uk:false;[R1] uk_info:(null);[R1] uks:(null);[R1] [C1] column_name:id;[R1] [C1] column_type:MYSQL_TYPE_LONG;[R1] [C1] column_is_rowkey:true;[R1] [C1] column_is_signed:true;[R1] [C1] column_encoding:binary;[R1] [C1] column_is_not_null:true;[R1] [C1] column_value_new:[1](1);[R1] [C1] column_value_old:[1](1);[R1] [C2] column_name:c1;[R1] [C2] column_type:MYSQL_TYPE_ENUM;[R1] [C2] column_is_rowkey:false;[R1] [C2] column_is_signed:true;[R1] [C2] column_encoding:utf8mb4;[R1] [C2] column_is_not_null:true;[R1] [C2] column_is_dep_col_of_gen_col:true;[R1] [C2] column_extend_info:e,n,u,m;[R1] [C2] column_value_new:[e](1);[R1] [C2] column_value_old:[e](1);[R1] [C3] column_name:c2;[R1] [C3] column_type:MYSQL_TYPE_SET;[R1] [C3] column_is_rowkey:false;[R1] [C3] column_is_signed:true;[R1] [C3] column_encoding:utf8mb4;[R1] [C3] column_is_not_null:false;[R1] [C3] column_is_dep_col_of_gen_col:true;[R1] [C3] column_extend_info:s,e,t;[R1] [C3] column_value_new:[s,e](3);[R1] [C3] column_value_old:[s](1);$[R2] COMMIT;
delete from enum_set_tbl where id=1;
ob1.oblog.next_dml;
[R0] BEGIN;[R0] org_cluster_id:1;[R1] record_type:DELETE;[R1] database_name:oblog_tt.obcdc_db1;[R1] table_name:enum_set_tbl;[R1] log_event:true;[R1] column_count:3;[R1] source_category:SRC_FULL_RECORDED;[R1] source_type:SRC_OCEANBASE_1_0;[R1] has_pk:true;[R1] pk_info:(0);[R1] pks:id;[R1] has_uk:false;[R1] uk_info:(null);[R1] uks:(null);[R1] [C1] column_name:id;[R1] [C1] column_type:MYSQL_TYPE_LONG;[R1] [C1] column_is_rowkey:true;[R1] [C1] column_is_signed:true;[R1] [C1] column_encoding:binary;[R1] [C1] column_is_not_null:true;[R1] [C1] column_value_old:[1](1);[R1] [C2] column_name:c1;[R1] [C2] column_type:MYSQL_TYPE_ENUM;[R1] [C2] column_is_rowkey:false;[R1] [C2] column_is_signed:true;[R1] [C2] column_encoding:utf8mb4;[R1] [C2] column_is_not_null:true;[R1] [C2] column_is_dep_col_of_gen_col:true;[R1] [C2] column_extend_info:e,n,u,m;[R1] [C2] column_value_old:[e](1);[R1] [C3] column_name:c2;[R1] [C3] column_type:MYSQL_TYPE_SET;[R1] [C3] column_is_rowkey:false;[R1] [C3] column_is_signed:true;[R1] [C3] column_encoding:utf8mb4;[R1] [C3] column_is_not_null:false;[R1] [C3] column_is_dep_col_of_gen_col:true;[R1] [C3] column_extend_info:s,e,t;[R1] [C3] column_value_old:[s,e](3);$[R2] COMMIT;
alter table enum_set_tbl modify column c2 set('s', 'e', 't') after id, modify column c1 enum('e', 'n', 'u', 'm') after c2;
insert into enum_set_tbl(id, c1, c2) values (6, 'n', 's,e,t');
ob1.oblog.next_dml;
[R0] BEGIN;[R0] org_cluster_id:1;[R1] record_type:INSERT;[R1] database_name:oblog_tt.obcdc_db1;[R1] table_name:enum_set_tbl;[R1] log_event:true;[R1] column_count:3;[R1] source_category:SRC_FULL_RECORDED;[R1] source_type:SRC_OCEANBASE_1_0;[R1] has_pk:true;[R1] pk_info:(0);[R1] pks:id;[R1] has_uk:false;[R1] uk_info:(null);[R1] uks:(null);[R1] [C1] column_name:id;[R1] [C1] column_type:MYSQL_TYPE_LONG;[R1] [C1] column_is_rowkey:true;[R1] [C1] column_is_signed:true;[R1] [C1] column_encoding:binary;[R1] [C1] column_is_not_null:true;[R1] [C1] column_value_new:[6](1);[R1] [C2] column_name:c2;[R1] [C2] column_type:MYSQL_TYPE_SET;[R1] [C2] column_is_rowkey:false;[R1] [C2] column_is_signed:true;[R1] [C2] column_encoding:utf8mb4;[R1] [C2] column_is_not_null:false;[R1] [C2] column_is_dep_col_of_gen_col:true;[R1] [C2] column_extend_info:s,e,t;[R1] [C2] column_value_new:[s,e,t](5);[R1] [C3] column_name:c1;[R1] [C3] column_type:MYSQL_TYPE_ENUM;[R1] [C3] column_is_rowkey:false;[R1] [C3] column_is_signed:true;[R1] [C3] column_encoding:utf8mb4;[R1] [C3] column_is_not_null:false;[R1] [C3] column_is_dep_col_of_gen_col:true;[R1] [C3] column_extend_info:e,n,u,m;[R1] [C3] column_value_new:[n](1);$[R2] COMMIT;
'#################### [CASE_END] Enum Set Column ####################'
ob1.oblog.stop;
'#################### [CASE_BEGIN] Fetch History ####################'
ob1.oblog.set_start_tstamp_usec $start_timestamp_usec;
ob1.oblog.gen_conf tb_white_list=oblog_tt.*.* enable_output_by_table_def=1 enable_output_hidden_primary_key=1 log_level=DEBUG skip_ob_version_compat_check=1;
ob1.oblog.set_extra_argument -m -i;
ob1.oblog.restart;
ob1.oblog.next_dml;
[R0] BEGIN;[R0] org_cluster_id:1;[R1] record_type:INSERT;[R1] database_name:oblog_tt.obcdc_db1;[R1] table_name:lob_tbl;[R1] log_event:true;[R1] column_count:1;[R1] source_category:SRC_FULL_RECORDED;[R1] source_type:SRC_OCEANBASE_1_0;[R1] has_pk:true;[R1] pk_info:(0);[R1] pks:id;[R1] has_uk:false;[R1] uk_info:(null);[R1] uks:(null);[R1] [C1] column_name:id;[R1] [C1] column_type:MYSQL_TYPE_LONG;[R1] [C1] column_is_rowkey:true;[R1] [C1] column_is_signed:true;[R1] [C1] column_encoding:binary;[R1] [C1] column_is_not_null:true;[R1] [C1] column_value_new:[1](1);$[R2] COMMIT;
ob1.oblog.next_dml;
[R0] BEGIN;[R0] org_cluster_id:1;[R1] record_type:INSERT;[R1] database_name:oblog_tt.obcdc_db1;[R1] table_name:lob_tbl;[R1] log_event:true;[R1] column_count:2;[R1] source_category:SRC_FULL_RECORDED;[R1] source_type:SRC_OCEANBASE_1_0;[R1] has_pk:true;[R1] pk_info:(0);[R1] pks:id;[R1] has_uk:false;[R1] uk_info:(null);[R1] uks:(null);[R1] [C1] column_name:id;[R1] [C1] column_type:MYSQL_TYPE_LONG;[R1] [C1] column_is_rowkey:true;[R1] [C1] column_is_signed:true;[R1] [C1] column_encoding:binary;[R1] [C1] column_is_not_null:true;[R1] [C1] column_value_new:[2](1);[R1] [C2] column_name:c2;[R1] [C2] column_type:MYSQL_TYPE_TINY_BLOB;[R1] [C2] column_is_rowkey:false;[R1] [C2] column_is_signed:true;[R1] [C2] column_encoding:utf8mb4;[R1] [C2] column_is_not_null:false;[R1] [C2] column_value_new_md5:[594f803b380a41396ed63dca39503542](5);$[R2] COMMIT;
ob1.oblog.next_dml;
[R0] BEGIN;[R0] org_cluster_id:1;[R1] record_type:INSERT;[R1] database_name:oblog_tt.obcdc_db1;[R1] table_name:lob_tbl;[R1] log_event:true;[R1] column_count:2;[R1] source_category:SRC_FULL_RECORDED;[R1] source_type:SRC_OCEANBASE_1_0;[R1] has_pk:true;[R1] pk_info:(0);[R1] pks:id;[R1] has_uk:false;[R1] uk_info:(null);[R1] uks:(null);[R1] [C1] column_name:id;[R1] [C1] column_type:MYSQL_TYPE_LONG;[R1] [C1] column_is_rowkey:true;[R1] [C1] column_is_signed:true;[R1] [C1] column_encoding:binary;[R1] [C1] column_is_not_null:true;[R1] [C1] column_value_new:[3](1);[R1] [C2] column_name:c2;[R1] [C2] column_type:MYSQL_TYPE_BLOB;[R1] [C2] column_is_rowkey:false;[R1] [C2] column_is_signed:true;[R1] [C2] column_encoding:utf8mb4;[R1] [C2] column_is_not_null:false;[R1] [C2] column_value_new_md5:[a21075a36eeddd084e17611a238c7101](5);$[R2] COMMIT;
ob1.oblog.next_dml;
[R0] BEGIN;[R0] org_cluster_id:1;[R1] record_type:INSERT;[R1] database_name:oblog_tt.obcdc_db1;[R1] table_name:lob_tbl;[R1] log_event:true;[R1] column_count:2;[R1] source_category:SRC_FULL_RECORDED;[R1] source_type:SRC_OCEANBASE_1_0;[R1] has_pk:true;[R1] pk_info:(0);[R1] pks:id;[R1] has_uk:false;[R1] uk_info:(null);[R1] uks:(null);[R1] [C1] column_name:id;[R1] [C1] column_type:MYSQL_TYPE_LONG;[R1] [C1] column_is_rowkey:true;[R1] [C1] column_is_signed:true;[R1] [C1] column_encoding:binary;[R1] [C1] column_is_not_null:true;[R1] [C1] column_value_new:[4](1);[R1] [C2] column_name:c3;[R1] [C2] column_type:MYSQL_TYPE_LONG_BLOB;[R1] [C2] column_is_rowkey:false;[R1] [C2] column_is_signed:true;[R1] [C2] column_encoding:binary;[R1] [C2] column_is_not_null:false;[R1] [C2] column_value_new_md5:[c57d4c3741dc0eb85d767497f9736503](50331647);$[R2] COMMIT;
ob1.oblog.next_dml;
[R0] BEGIN;[R0] org_cluster_id:1;[R1] record_type:UPDATE;[R1] database_name:oblog_tt.obcdc_db1;[R1] table_name:lob_tbl;[R1] log_event:true;[R1] column_count:2;[R1] source_category:SRC_FULL_RECORDED;[R1] source_type:SRC_OCEANBASE_1_0;[R1] has_pk:true;[R1] pk_info:(0);[R1] pks:id;[R1] has_uk:false;[R1] uk_info:(null);[R1] uks:(null);[R1] [C1] column_name:id;[R1] [C1] column_type:MYSQL_TYPE_LONG;[R1] [C1] column_is_rowkey:true;[R1] [C1] column_is_signed:true;[R1] [C1] column_encoding:binary;[R1] [C1] column_is_not_null:true;[R1] [C1] column_value_new:[1](1);[R1] [C1] column_value_old:[1](1);[R1] [C2] column_name:c3;[R1] [C2] column_type:MYSQL_TYPE_LONG_BLOB;[R1] [C2] column_is_rowkey:false;[R1] [C2] column_is_signed:true;[R1] [C2] column_encoding:binary;[R1] [C2] column_is_not_null:false;[R1] [C2] column_value_new_md5:[c02b95a0df2cf28490643e97ba3db50f](10);[R1] [C2] column_value_old_md5:[NULL](0);$[R2] COMMIT;
ob1.oblog.next_dml;
[R0] BEGIN;[R0] org_cluster_id:1;[R1] record_type:DELETE;[R1] database_name:oblog_tt.obcdc_db1;[R1] table_name:lob_tbl;[R1] log_event:true;[R1] column_count:2;[R1] source_category:SRC_FULL_RECORDED;[R1] source_type:SRC_OCEANBASE_1_0;[R1] has_pk:true;[R1] pk_info:(0);[R1] pks:id;[R1] has_uk:false;[R1] uk_info:(null);[R1] uks:(null);[R1] [C1] column_name:id;[R1] [C1] column_type:MYSQL_TYPE_LONG;[R1] [C1] column_is_rowkey:true;[R1] [C1] column_is_signed:true;[R1] [C1] column_encoding:binary;[R1] [C1] column_is_not_null:true;[R1] [C1] column_value_old:[1](1);[R1] [C2] column_name:c3;[R1] [C2] column_type:MYSQL_TYPE_LONG_BLOB;[R1] [C2] column_is_rowkey:false;[R1] [C2] column_is_signed:true;[R1] [C2] column_encoding:binary;[R1] [C2] column_is_not_null:false;[R1] [C2] column_value_old_md5:[c02b95a0df2cf28490643e97ba3db50f](10);$[R2] COMMIT;
ob1.oblog.next_dml;
[R0] BEGIN;[R0] org_cluster_id:1;[R1] record_type:INSERT;[R1] database_name:oblog_tt.obcdc_db1;[R1] table_name:lob_tbl;[R1] log_event:true;[R1] column_count:2;[R1] source_category:SRC_FULL_RECORDED;[R1] source_type:SRC_OCEANBASE_1_0;[R1] has_pk:true;[R1] pk_info:(0);[R1] pks:id;[R1] has_uk:false;[R1] uk_info:(null);[R1] uks:(null);[R1] [C1] column_name:id;[R1] [C1] column_type:MYSQL_TYPE_LONG;[R1] [C1] column_is_rowkey:true;[R1] [C1] column_is_signed:true;[R1] [C1] column_encoding:binary;[R1] [C1] column_is_not_null:true;[R1] [C1] column_value_new:[5](1);[R1] [C2] column_name:c3;[R1] [C2] column_type:MYSQL_TYPE_LONG_BLOB;[R1] [C2] column_is_rowkey:false;[R1] [C2] column_is_signed:true;[R1] [C2] column_encoding:binary;[R1] [C2] column_is_not_null:false;[R1] [C2] column_is_dep_col_of_gen_col:true;[R1] [C2] column_value_new_md5:[e1faffe9c3c801f2f8c3fbe7cb032cb2](7);$[R2] COMMIT;
ob1.oblog.next_dml;
[R0] BEGIN;[R0] org_cluster_id:1;[R1] record_type:INSERT;[R1] database_name:oblog_tt.obcdc_db1;[R1] table_name:lob_tbl;[R1] log_event:true;[R1] column_count:3;[R1] source_category:SRC_FULL_RECORDED;[R1] source_type:SRC_OCEANBASE_1_0;[R1] has_pk:true;[R1] pk_info:(0);[R1] pks:id;[R1] has_uk:false;[R1] uk_info:(null);[R1] uks:(null);[R1] [C1] column_name:id;[R1] [C1] column_type:MYSQL_TYPE_LONG;[R1] [C1] column_is_rowkey:true;[R1] [C1] column_is_signed:true;[R1] [C1] column_encoding:binary;[R1] [C1] column_is_not_null:true;[R1] [C1] column_value_new:[6](1);[R1] [C2] column_name:c4;[R1] [C2] column_type:MYSQL_TYPE_BLOB;[R1] [C2] column_is_rowkey:false;[R1] [C2] column_is_signed:true;[R1] [C2] column_encoding:binary;[R1] [C2] column_is_not_null:false;[R1] [C2] column_value_new_md5:[22686eba65441cdc1795f276dcdd4e45](65535);[R1] [C3] column_name:c3;[R1] [C3] column_type:MYSQL_TYPE_LONG_BLOB;[R1] [C3] column_is_rowkey:false;[R1] [C3] column_is_signed:true;[R1] [C3] column_encoding:binary;[R1] [C3] column_is_not_null:false;[R1] [C3] column_is_dep_col_of_gen_col:true;[R1] [C3] column_value_new_md5:[1c273a781ce88675380f7d163d4a0718](50331647);$[R2] COMMIT;
ob1.oblog.next_dml;
[R0] BEGIN;[R0] org_cluster_id:1;[R1] record_type:DELETE;[R1] database_name:oblog_tt.obcdc_db1;[R1] table_name:lob_tbl;[R1] log_event:true;[R1] column_count:3;[R1] source_category:SRC_FULL_RECORDED;[R1] source_type:SRC_OCEANBASE_1_0;[R1] has_pk:true;[R1] pk_info:(0);[R1] pks:id;[R1] has_uk:false;[R1] uk_info:(null);[R1] uks:(null);[R1] [C1] column_name:id;[R1] [C1] column_type:MYSQL_TYPE_LONG;[R1] [C1] column_is_rowkey:true;[R1] [C1] column_is_signed:true;[R1] [C1] column_encoding:binary;[R1] [C1] column_is_not_null:true;[R1] [C1] column_value_old:[3](1);[R1] [C2] column_name:c4;[R1] [C2] column_type:MYSQL_TYPE_BLOB;[R1] [C2] column_is_rowkey:false;[R1] [C2] column_is_signed:true;[R1] [C2] column_encoding:binary;[R1] [C2] column_is_not_null:false;[R1] [C2] column_value_old_md5:[NULL](0);[R1] [C3] column_name:c3;[R1] [C3] column_type:MYSQL_TYPE_LONG_BLOB;[R1] [C3] column_is_rowkey:false;[R1] [C3] column_is_signed:true;[R1] [C3] column_encoding:binary;[R1] [C3] column_is_not_null:false;[R1] [C3] column_is_dep_col_of_gen_col:true;[R1] [C3] column_value_old_md5:[NULL](0);$[R2] COMMIT;
ob1.oblog.next_dml;
[R0] BEGIN;[R0] org_cluster_id:1;[R1] record_type:UPDATE;[R1] database_name:oblog_tt.obcdc_db1;[R1] table_name:lob_tbl;[R1] log_event:true;[R1] column_count:3;[R1] source_category:SRC_FULL_RECORDED;[R1] source_type:SRC_OCEANBASE_1_0;[R1] has_pk:true;[R1] pk_info:(0);[R1] pks:id;[R1] has_uk:false;[R1] uk_info:(null);[R1] uks:(null);[R1] [C1] column_name:id;[R1] [C1] column_type:MYSQL_TYPE_LONG;[R1] [C1] column_is_rowkey:true;[R1] [C1] column_is_signed:true;[R1] [C1] column_encoding:binary;[R1] [C1] column_is_not_null:true;[R1] [C1] column_value_new:[6](1);[R1] [C1] column_value_old:[6](1);[R1] [C2] column_name:c4;[R1] [C2] column_type:MYSQL_TYPE_MEDIUM_BLOB;[R1] [C2] column_is_rowkey:false;[R1] [C2] column_is_signed:true;[R1] [C2] column_encoding:binary;[R1] [C2] column_is_not_null:false;[R1] [C2] column_value_new_md5:[59bc7c3cf08fcff32cf523fcd58df01d](16777215);[R1] [C2] column_value_old_md5:[22686eba65441cdc1795f276dcdd4e45](65535);[R1] [C3] column_name:c3;[R1] [C3] column_type:MYSQL_TYPE_LONG_BLOB;[R1] [C3] column_is_rowkey:false;[R1] [C3] column_is_signed:true;[R1] [C3] column_encoding:binary;[R1] [C3] column_is_not_null:false;[R1] [C3] column_is_dep_col_of_gen_col:true;[R1] [C3] column_value_new_md5:[67c762276bced09ee4df0ed537d164ea](5);[R1] [C3] column_value_old_md5:[1c273a781ce88675380f7d163d4a0718](50331647);$[R2] COMMIT;
ob1.oblog.next_dml;
[R0] BEGIN;[R0] org_cluster_id:1;[R1] record_type:UPDATE;[R1] database_name:oblog_tt.obcdc_db1;[R1] table_name:lob_tbl;[R1] log_event:true;[R1] column_count:3;[R1] source_category:SRC_FULL_RECORDED;[R1] source_type:SRC_OCEANBASE_1_0;[R1] has_pk:true;[R1] pk_info:(0);[R1] pks:id;[R1] has_uk:false;[R1] uk_info:(null);[R1] uks:(null);[R1] [C1] column_name:id;[R1] [C1] column_type:MYSQL_TYPE_LONG;[R1] [C1] column_is_rowkey:true;[R1] [C1] column_is_signed:true;[R1] [C1] column_encoding:binary;[R1] [C1] column_is_not_null:true;[R1] [C1] column_value_new:[6](1);[R1] [C1] column_value_old:[6](1);[R1] [C2] column_name:c4;[R1] [C2] column_type:MYSQL_TYPE_MEDIUM_BLOB;[R1] [C2] column_is_rowkey:false;[R1] [C2] column_is_signed:true;[R1] [C2] column_encoding:binary;[R1] [C2] column_is_not_null:false;[R1] [C2] column_value_new_md5:[f7947c3138becb8e8f0eafe783f639c6](16777215);[R1] [C2] column_value_old_md5:[59bc7c3cf08fcff32cf523fcd58df01d](16777215);[R1] [C3] column_name:c3;[R1] [C3] column_type:MYSQL_TYPE_LONG_BLOB;[R1] [C3] column_is_rowkey:false;[R1] [C3] column_is_signed:true;[R1] [C3] column_encoding:binary;[R1] [C3] column_is_not_null:false;[R1] [C3] column_is_dep_col_of_gen_col:true;[R1] [C3] column_value_new_md5:[50f84daf3a6dfd6a9f20c9f8ef428942](5);[R1] [C3] column_value_old_md5:[67c762276bced09ee4df0ed537d164ea](5);$[R2] COMMIT;
ob1.oblog.next_dml;
[R0] BEGIN;[R0] org_cluster_id:1;[R1] record_type:UPDATE;[R1] database_name:oblog_tt.obcdc_db1;[R1] table_name:lob_tbl;[R1] log_event:true;[R1] column_count:3;[R1] source_category:SRC_FULL_RECORDED;[R1] source_type:SRC_OCEANBASE_1_0;[R1] has_pk:true;[R1] pk_info:(0);[R1] pks:id;[R1] has_uk:false;[R1] uk_info:(null);[R1] uks:(null);[R1] [C1] column_name:id;[R1] [C1] column_type:MYSQL_TYPE_LONG;[R1] [C1] column_is_rowkey:true;[R1] [C1] column_is_signed:true;[R1] [C1] column_encoding:binary;[R1] [C1] column_is_not_null:true;[R1] [C1] column_value_new:[6](1);[R1] [C1] column_value_old:[6](1);[R1] [C2] column_name:c4;[R1] [C2] column_type:MYSQL_TYPE_MEDIUM_BLOB;[R1] [C2] column_is_rowkey:false;[R1] [C2] column_is_signed:true;[R1] [C2] column_encoding:binary;[R1] [C2] column_is_not_null:false;[R1] [C2] column_value_new_md5:[NULL](0);[R1] [C2] column_value_old_md5:[NULL](0);[R1] [C3] column_name:c3;[R1] [C3] column_type:MYSQL_TYPE_LONG_BLOB;[R1] [C3] column_is_rowkey:false;[R1] [C3] column_is_signed:true;[R1] [C3] column_encoding:binary;[R1] [C3] column_is_not_null:false;[R1] [C3] column_is_dep_col_of_gen_col:true;[R1] [C3] column_value_new_md5:[79b281060d337b9b2b84ccf390adcf74](5242880);[R1] [C3] column_value_old_md5:[50f84daf3a6dfd6a9f20c9f8ef428942](5);$[R2] COMMIT;
ob1.oblog.next_dml;
[R0] BEGIN;[R0] org_cluster_id:1;[R1] record_type:DELETE;[R1] database_name:oblog_tt.obcdc_db1;[R1] table_name:lob_tbl;[R1] log_event:true;[R1] column_count:3;[R1] source_category:SRC_FULL_RECORDED;[R1] source_type:SRC_OCEANBASE_1_0;[R1] has_pk:true;[R1] pk_info:(0);[R1] pks:id;[R1] has_uk:false;[R1] uk_info:(null);[R1] uks:(null);[R1] [C1] column_name:id;[R1] [C1] column_type:MYSQL_TYPE_LONG;[R1] [C1] column_is_rowkey:true;[R1] [C1] column_is_signed:true;[R1] [C1] column_encoding:binary;[R1] [C1] column_is_not_null:true;[R1] [C1] column_value_old:[5](1);[R1] [C2] column_name:c4;[R1] [C2] column_type:MYSQL_TYPE_MEDIUM_BLOB;[R1] [C2] column_is_rowkey:false;[R1] [C2] column_is_signed:true;[R1] [C2] column_encoding:binary;[R1] [C2] column_is_not_null:false;[R1] [C2] column_value_old_md5:[NULL](0);[R1] [C3] column_name:c3;[R1] [C3] column_type:MYSQL_TYPE_LONG_BLOB;[R1] [C3] column_is_rowkey:false;[R1] [C3] column_is_signed:true;[R1] [C3] column_encoding:binary;[R1] [C3] column_is_not_null:false;[R1] [C3] column_is_dep_col_of_gen_col:true;[R1] [C3] column_value_old_md5:[e1faffe9c3c801f2f8c3fbe7cb032cb2](7);$[R2] COMMIT;
ob1.oblog.next_dml;
[R0] BEGIN;[R0] org_cluster_id:1;[R1] record_type:INSERT;[R1] database_name:oblog_tt.obcdc_db1;[R1] table_name:lob_tbl;[R1] log_event:true;[R1] column_count:4;[R1] source_category:SRC_FULL_RECORDED;[R1] source_type:SRC_OCEANBASE_1_0;[R1] has_pk:true;[R1] pk_info:(3);[R1] pks:__pk_increment;[R1] has_uk:false;[R1] uk_info:(null);[R1] uks:(null);[R1] [C1] column_name:id;[R1] [C1] column_type:MYSQL_TYPE_LONG;[R1] [C1] column_is_rowkey:false;[R1] [C1] column_is_signed:true;[R1] [C1] column_encoding:binary;[R1] [C1] column_is_not_null:true;[R1] [C1] column_value_new:[7](1);[R1] [C2] column_name:c4;[R1] [C2] column_type:MYSQL_TYPE_MEDIUM_BLOB;[R1] [C2] column_is_rowkey:false;[R1] [C2] column_is_signed:true;[R1] [C2] column_encoding:binary;[R1] [C2] column_is_not_null:false;[R1] [C2] column_value_new_md5:[77963b7a931377ad4ab5ad6a9cd718aa](3);[R1] [C3] column_name:c3;[R1] [C3] column_type:MYSQL_TYPE_LONG_BLOB;[R1] [C3] column_is_rowkey:false;[R1] [C3] column_is_signed:true;[R1] [C3] column_encoding:binary;[R1] [C3] column_is_not_null:false;[R1] [C3] column_is_dep_col_of_gen_col:true;[R1] [C3] column_value_new_md5:[d2f2297d6e829cd3493aa7de4416a18f](3);[R1] [C4] column_name:__pk_increment;[R1] [C4] column_type:MYSQL_TYPE_LONGLONG;[R1] [C4] column_is_rowkey:true;[R1] [C4] column_is_signed:false;[R1] [C4] column_encoding:binary;[R1] [C4] column_is_not_null:true;[R1] [C4] column_value_new:[10001](5);$[R2] COMMIT;
ob1.oblog.next_dml;
[R0] BEGIN;[R0] org_cluster_id:1;[R1] record_type:INSERT;[R1] database_name:oblog_tt.obcdc_db1;[R1] table_name:lob_tbl;[R1] log_event:true;[R1] column_count:4;[R1] source_category:SRC_FULL_RECORDED;[R1] source_type:SRC_OCEANBASE_1_0;[R1] has_pk:true;[R1] pk_info:(3);[R1] pks:__pk_increment;[R1] has_uk:false;[R1] uk_info:(null);[R1] uks:(null);[R1] [C1] column_name:c3;[R1] [C1] column_type:MYSQL_TYPE_LONG_BLOB;[R1] [C1] column_is_rowkey:false;[R1] [C1] column_is_signed:true;[R1] [C1] column_encoding:binary;[R1] [C1] column_is_not_null:false;[R1] [C1] column_is_dep_col_of_gen_col:true;[R1] [C1] column_value_new_md5:[343d9040a671c45832ee5381860e2996](3);[R1] [C2] column_name:c4;[R1] [C2] column_type:MYSQL_TYPE_MEDIUM_BLOB;[R1] [C2] column_is_rowkey:false;[R1] [C2] column_is_signed:true;[R1] [C2] column_encoding:binary;[R1] [C2] column_is_not_null:false;[R1] [C2] column_value_new_md5:[74d3cfe47b3df992dc047893e6020b94](16777215);[R1] [C3] column_name:id;[R1] [C3] column_type:MYSQL_TYPE_LONG;[R1] [C3] column_is_rowkey:false;[R1] [C3] column_is_signed:true;[R1] [C3] column_encoding:binary;[R1] [C3] column_is_not_null:false;[R1] [C3] column_value_new:[8](1);[R1] [C4] column_name:__pk_increment;[R1] [C4] column_type:MYSQL_TYPE_LONGLONG;[R1] [C4] column_is_rowkey:true;[R1] [C4] column_is_signed:false;[R1] [C4] column_encoding:binary;[R1] [C4] column_is_not_null:true;[R1] [C4] column_value_new:[20001](5);$[R2] COMMIT;
ob1.oblog.next_dml;
[R0] BEGIN;[R0] org_cluster_id:1;[R1] record_type:INSERT;[R1] database_name:oblog_tt.obcdc_db1;[R1] table_name:lob_tbl;[R1] log_event:true;[R1] column_count:5;[R1] source_category:SRC_FULL_RECORDED;[R1] source_type:SRC_OCEANBASE_1_0;[R1] has_pk:true;[R1] pk_info:(4);[R1] pks:__pk_increment;[R1] has_uk:false;[R1] uk_info:(null);[R1] uks:(null);[R1] [C1] column_name:c3;[R1] [C1] column_type:MYSQL_TYPE_LONG_BLOB;[R1] [C1] column_is_rowkey:false;[R1] [C1] column_is_signed:true;[R1] [C1] column_encoding:binary;[R1] [C1] column_is_not_null:false;[R1] [C1] column_is_dep_col_of_gen_col:true;[R1] [C1] column_value_new_md5:[302a43721d74c0442eda8741a016aaef](16777215);[R1] [C2] column_name:c4;[R1] [C2] column_type:MYSQL_TYPE_MEDIUM_BLOB;[R1] [C2] column_is_rowkey:false;[R1] [C2] column_is_signed:true;[R1] [C2] column_encoding:binary;[R1] [C2] column_is_not_null:false;[R1] [C2] column_value_new_md5:[c2692c60eecd0a043304ba5022b9aa94](16777215);[R1] [C3] column_name:c5;[R1] [C3] column_type:MYSQL_TYPE_LONG;[R1] [C3] column_is_rowkey:false;[R1] [C3] column_is_signed:true;[R1] [C3] column_encoding:binary;[R1] [C3] column_is_not_null:false;[R1] [C3] is_generated_column:1;[R1] [C3] column_value_new:[10](2);[R1] [C4] column_name:id;[R1] [C4] column_type:MYSQL_TYPE_LONG;[R1] [C4] column_is_rowkey:false;[R1] [C4] column_is_signed:true;[R1] [C4] column_encoding:binary;[R1] [C4] column_is_not_null:false;[R1] [C4] column_is_dep_col_of_gen_col:true;[R1] [C4] column_value_new:[9](1);[R1] [C5] column_name:__pk_increment;[R1] [C5] column_type:MYSQL_TYPE_LONGLONG;[R1] [C5] column_is_rowkey:true;[R1] [C5] column_is_signed:false;[R1] [C5] column_encoding:binary;[R1] [C5] column_is_not_null:true;[R1] [C5] column_value_new:[30001](5);$[R2] COMMIT;
ob1.oblog.next_dml;
[R0] BEGIN;[R0] org_cluster_id:1;[R1] record_type:UPDATE;[R1] database_name:oblog_tt.obcdc_db1;[R1] table_name:lob_tbl;[R1] log_event:true;[R1] column_count:5;[R1] source_category:SRC_FULL_RECORDED;[R1] source_type:SRC_OCEANBASE_1_0;[R1] has_pk:true;[R1] pk_info:(4);[R1] pks:__pk_increment;[R1] has_uk:false;[R1] uk_info:(null);[R1] uks:(null);[R1] [C1] column_name:c3;[R1] [C1] column_type:MYSQL_TYPE_LONG_BLOB;[R1] [C1] column_is_rowkey:false;[R1] [C1] column_is_signed:true;[R1] [C1] column_encoding:binary;[R1] [C1] column_is_not_null:false;[R1] [C1] column_is_dep_col_of_gen_col:true;[R1] [C1] column_value_new_md5:[b5c75e6bbcfcd0e6520b5f1419ded614](7);[R1] [C1] column_value_old_md5:[NULL](0);[R1] [C2] column_name:c4;[R1] [C2] column_type:MYSQL_TYPE_MEDIUM_BLOB;[R1] [C2] column_is_rowkey:false;[R1] [C2] column_is_signed:true;[R1] [C2] column_encoding:binary;[R1] [C2] column_is_not_null:false;[R1] [C2] column_value_new_md5:[NULL](0);[R1] [C2] column_value_old_md5:[NULL](0);[R1] [C3] column_name:c5;[R1] [C3] column_type:MYSQL_TYPE_LONG;[R1] [C3] column_is_rowkey:false;[R1] [C3] column_is_signed:true;[R1] [C3] column_encoding:binary;[R1] [C3] column_is_not_null:false;[R1] [C3] is_generated_column:1;[R1] [C3] column_value_new:[3](1);[R1] [C3] column_value_old:[3](1);[R1] [C4] column_name:id;[R1] [C4] column_type:MYSQL_TYPE_LONG;[R1] [C4] column_is_rowkey:false;[R1] [C4] column_is_signed:true;[R1] [C4] column_encoding:binary;[R1] [C4] column_is_not_null:false;[R1] [C4] column_is_dep_col_of_gen_col:true;[R1] [C4] column_value_new:[2](1);[R1] [C4] column_value_old:[2](1);[R1] [C5] column_name:__pk_increment;[R1] [C5] column_type:MYSQL_TYPE_LONGLONG;[R1] [C5] column_is_rowkey:true;[R1] [C5] column_is_signed:false;[R1] [C5] column_encoding:binary;[R1] [C5] column_is_not_null:true;[R1] [C5] column_value_new:[1](1);[R1] [C5] column_value_old:[1](1);$[R2] COMMIT;
ob1.oblog.next_dml;
[R0] BEGIN;[R0] org_cluster_id:1;[R1] record_type:DELETE;[R1] database_name:oblog_tt.obcdc_db1;[R1] table_name:lob_tbl;[R1] log_event:true;[R1] column_count:5;[R1] source_category:SRC_FULL_RECORDED;[R1] source_type:SRC_OCEANBASE_1_0;[R1] has_pk:true;[R1] pk_info:(4);[R1] pks:__pk_increment;[R1] has_uk:false;[R1] uk_info:(null);[R1] uks:(null);[R1] [C1] column_name:c3;[R1] [C1] column_type:MYSQL_TYPE_LONG_BLOB;[R1] [C1] column_is_rowkey:false;[R1] [C1] column_is_signed:true;[R1] [C1] column_encoding:binary;[R1] [C1] column_is_not_null:false;[R1] [C1] column_is_dep_col_of_gen_col:true;[R1] [C1] column_value_old_md5:[NULL](0);[R1] [C2] column_name:c4;[R1] [C2] column_type:MYSQL_TYPE_MEDIUM_BLOB;[R1] [C2] column_is_rowkey:false;[R1] [C2] column_is_signed:true;[R1] [C2] column_encoding:binary;[R1] [C2] column_is_not_null:false;[R1] [C2] column_value_old_md5:[NULL](0);[R1] [C3] column_name:c5;[R1] [C3] column_type:MYSQL_TYPE_LONG;[R1] [C3] column_is_rowkey:false;[R1] [C3] column_is_signed:true;[R1] [C3] column_encoding:binary;[R1] [C3] column_is_not_null:false;[R1] [C3] is_generated_column:1;[R1] [C3] column_value_old:[5](1);[R1] [C4] column_name:id;[R1] [C4] column_type:MYSQL_TYPE_LONG;[R1] [C4] column_is_rowkey:false;[R1] [C4] column_is_signed:true;[R1] [C4] column_encoding:binary;[R1] [C4] column_is_not_null:false;[R1] [C4] column_is_dep_col_of_gen_col:true;[R1] [C4] column_value_old:[4](1);[R1] [C5] column_name:__pk_increment;[R1] [C5] column_type:MYSQL_TYPE_LONGLONG;[R1] [C5] column_is_rowkey:true;[R1] [C5] column_is_signed:false;[R1] [C5] column_encoding:binary;[R1] [C5] column_is_not_null:true;[R1] [C5] column_value_old:[2](1);$[R2] COMMIT;
ob1.oblog.next_dml;
[R0] BEGIN;[R0] org_cluster_id:1;[R1] record_type:INSERT;[R1] database_name:oblog_tt.obcdc_db1;[R1] table_name:enum_set_tbl;[R1] log_event:true;[R1] column_count:3;[R1] source_category:SRC_FULL_RECORDED;[R1] source_type:SRC_OCEANBASE_1_0;[R1] has_pk:true;[R1] pk_info:(2);[R1] pks:__pk_increment;[R1] has_uk:false;[R1] uk_info:(null);[R1] uks:(null);[R1] [C1] column_name:id;[R1] [C1] column_type:MYSQL_TYPE_LONG;[R1] [C1] column_is_rowkey:false;[R1] [C1] column_is_signed:true;[R1] [C1] column_encoding:binary;[R1] [C1] column_is_not_null:false;[R1] [C1] column_value_new:[1](1);[R1] [C2] column_name:c1;[R1] [C2] column_type:MYSQL_TYPE_ENUM;[R1] [C2] column_is_rowkey:false;[R1] [C2] column_is_signed:true;[R1] [C2] column_encoding:utf8mb4;[R1] [C2] column_is_not_null:false;[R1] [C2] column_extend_info:e,n,u,m;[R1] [C2] column_value_new:[e](1);[R1] [C3] column_name:__pk_increment;[R1] [C3] column_type:MYSQL_TYPE_LONGLONG;[R1] [C3] column_is_rowkey:true;[R1] [C3] column_is_signed:false;[R1] [C3] column_encoding:binary;[R1] [C3] column_is_not_null:true;[R1] [C3] column_value_new:[1](1);$[R2] COMMIT;
ob1.oblog.next_dml;
[R0] BEGIN;[R0] org_cluster_id:1;[R1] record_type:INSERT;[R1] database_name:oblog_tt.obcdc_db1;[R1] table_name:enum_set_tbl;[R1] log_event:true;[R1] column_count:4;[R1] source_category:SRC_FULL_RECORDED;[R1] source_type:SRC_OCEANBASE_1_0;[R1] has_pk:true;[R1] pk_info:(2);[R1] pks:__pk_increment;[R1] has_uk:false;[R1] uk_info:(null);[R1] uks:(null);[R1] [C1] column_name:id;[R1] [C1] column_type:MYSQL_TYPE_LONG;[R1] [C1] column_is_rowkey:false;[R1] [C1] column_is_signed:true;[R1] [C1] column_encoding:binary;[R1] [C1] column_is_not_null:false;[R1] [C1] column_value_new:[2](1);[R1] [C2] column_name:c1;[R1] [C2] column_type:MYSQL_TYPE_ENUM;[R1] [C2] column_is_rowkey:false;[R1] [C2] column_is_signed:true;[R1] [C2] column_encoding:utf8mb4;[R1] [C2] column_is_not_null:false;[R1] [C2] column_extend_info:e,n,u,m;[R1] [C2] column_value_new:[n](1);[R1] [C3] column_name:__pk_increment;[R1] [C3] column_type:MYSQL_TYPE_LONGLONG;[R1] [C3] column_is_rowkey:true;[R1] [C3] column_is_signed:false;[R1] [C3] column_encoding:binary;[R1] [C3] column_is_not_null:true;[R1] [C3] column_value_new:[2](1);[R1] [C4] column_name:c2;[R1] [C4] column_type:MYSQL_TYPE_SET;[R1] [C4] column_is_rowkey:false;[R1] [C4] column_is_signed:true;[R1] [C4] column_encoding:utf8mb4;[R1] [C4] column_is_not_null:false;[R1] [C4] column_extend_info:s,e,t;[R1] [C4] column_value_new:[s](1);$[R2] COMMIT;
ob1.oblog.next_dml;
[R0] BEGIN;[R0] org_cluster_id:1;[R1] record_type:INSERT;[R1] database_name:oblog_tt.obcdc_db1;[R1] table_name:enum_set_tbl;[R1] log_event:true;[R1] column_count:3;[R1] source_category:SRC_FULL_RECORDED;[R1] source_type:SRC_OCEANBASE_1_0;[R1] has_pk:true;[R1] pk_info:(1);[R1] pks:c1;[R1] has_uk:false;[R1] uk_info:(null);[R1] uks:(null);[R1] [C1] column_name:id;[R1] [C1] column_type:MYSQL_TYPE_LONG;[R1] [C1] column_is_rowkey:false;[R1] [C1] column_is_signed:true;[R1] [C1] column_encoding:binary;[R1] [C1] column_is_not_null:false;[R1] [C1] column_value_new:[3](1);[R1] [C2] column_name:c1;[R1] [C2] column_type:MYSQL_TYPE_ENUM;[R1] [C2] column_is_rowkey:true;[R1] [C2] column_is_signed:true;[R1] [C2] column_encoding:utf8mb4;[R1] [C2] column_is_not_null:true;[R1] [C2] column_extend_info:e,n,u,m;[R1] [C2] column_value_new:[u](1);[R1] [C3] column_name:c2;[R1] [C3] column_type:MYSQL_TYPE_SET;[R1] [C3] column_is_rowkey:false;[R1] [C3] column_is_signed:true;[R1] [C3] column_encoding:utf8mb4;[R1] [C3] column_is_not_null:false;[R1] [C3] column_extend_info:s,e,t;[R1] [C3] column_value_new:[e](1);$[R2] COMMIT;
ob1.oblog.next_dml;
[R0] BEGIN;[R0] org_cluster_id:1;[R1] record_type:INSERT;[R1] database_name:oblog_tt.obcdc_db1;[R1] table_name:enum_set_tbl;[R1] log_event:true;[R1] column_count:3;[R1] source_category:SRC_FULL_RECORDED;[R1] source_type:SRC_OCEANBASE_1_0;[R1] has_pk:true;[R1] pk_info:(0);[R1] pks:id;[R1] has_uk:false;[R1] uk_info:(null);[R1] uks:(null);[R1] [C1] column_name:id;[R1] [C1] column_type:MYSQL_TYPE_LONG;[R1] [C1] column_is_rowkey:true;[R1] [C1] column_is_signed:true;[R1] [C1] column_encoding:binary;[R1] [C1] column_is_not_null:true;[R1] [C1] column_value_new:[4](1);[R1] [C2] column_name:c1;[R1] [C2] column_type:MYSQL_TYPE_ENUM;[R1] [C2] column_is_rowkey:false;[R1] [C2] column_is_signed:true;[R1] [C2] column_encoding:utf8mb4;[R1] [C2] column_is_not_null:true;[R1] [C2] column_extend_info:e,n,u,m;[R1] [C2] column_value_new:[m](1);[R1] [C3] column_name:c2;[R1] [C3] column_type:MYSQL_TYPE_SET;[R1] [C3] column_is_rowkey:false;[R1] [C3] column_is_signed:true;[R1] [C3] column_encoding:utf8mb4;[R1] [C3] column_is_not_null:false;[R1] [C3] column_extend_info:s,e,t;[R1] [C3] column_value_new:[t](1);$[R2] COMMIT;
ob1.oblog.next_dml;
[R0] BEGIN;[R0] org_cluster_id:1;[R1] record_type:DELETE;[R1] database_name:oblog_tt.obcdc_db1;[R1] table_name:enum_set_tbl;[R1] log_event:true;[R1] column_count:3;[R1] source_category:SRC_FULL_RECORDED;[R1] source_type:SRC_OCEANBASE_1_0;[R1] has_pk:true;[R1] pk_info:(0);[R1] pks:id;[R1] has_uk:false;[R1] uk_info:(null);[R1] uks:(null);[R1] [C1] column_name:id;[R1] [C1] column_type:MYSQL_TYPE_LONG;[R1] [C1] column_is_rowkey:true;[R1] [C1] column_is_signed:true;[R1] [C1] column_encoding:binary;[R1] [C1] column_is_not_null:true;[R1] [C1] column_value_old:[2](1);[R1] [C2] column_name:c1;[R1] [C2] column_type:MYSQL_TYPE_ENUM;[R1] [C2] column_is_rowkey:false;[R1] [C2] column_is_signed:true;[R1] [C2] column_encoding:utf8mb4;[R1] [C2] column_is_not_null:true;[R1] [C2] column_extend_info:e,n,u,m;[R1] [C2] column_value_old:[n](1);[R1] [C3] column_name:c2;[R1] [C3] column_type:MYSQL_TYPE_SET;[R1] [C3] column_is_rowkey:false;[R1] [C3] column_is_signed:true;[R1] [C3] column_encoding:utf8mb4;[R1] [C3] column_is_not_null:false;[R1] [C3] column_extend_info:s,e,t;[R1] [C3] column_value_old:[s](1);$[R2] COMMIT;
ob1.oblog.next_dml;
[R0] BEGIN;[R0] org_cluster_id:1;[R1] record_type:INSERT;[R1] database_name:oblog_tt.obcdc_db1;[R1] table_name:enum_set_tbl;[R1] log_event:true;[R1] column_count:3;[R1] source_category:SRC_FULL_RECORDED;[R1] source_type:SRC_OCEANBASE_1_0;[R1] has_pk:true;[R1] pk_info:(0);[R1] pks:id;[R1] has_uk:false;[R1] uk_info:(null);[R1] uks:(null);[R1] [C1] column_name:id;[R1] [C1] column_type:MYSQL_TYPE_LONG;[R1] [C1] column_is_rowkey:true;[R1] [C1] column_is_signed:true;[R1] [C1] column_encoding:binary;[R1] [C1] column_is_not_null:true;[R1] [C1] column_value_new:[5](1);[R1] [C2] column_name:c1;[R1] [C2] column_type:MYSQL_TYPE_ENUM;[R1] [C2] column_is_rowkey:false;[R1] [C2] column_is_signed:true;[R1] [C2] column_encoding:utf8mb4;[R1] [C2] column_is_not_null:true;[R1] [C2] column_is_dep_col_of_gen_col:true;[R1] [C2] column_extend_info:e,n,u,m;[R1] [C2] column_value_new:[e](1);[R1] [C3] column_name:c2;[R1] [C3] column_type:MYSQL_TYPE_SET;[R1] [C3] column_is_rowkey:false;[R1] [C3] column_is_signed:true;[R1] [C3] column_encoding:utf8mb4;[R1] [C3] column_is_not_null:false;[R1] [C3] column_is_dep_col_of_gen_col:true;[R1] [C3] column_extend_info:s,e,t;[R1] [C3] column_value_new:[s,t](3);$[R2] COMMIT;
ob1.oblog.next_dml;
[R0] BEGIN;[R0] org_cluster_id:1;[R1] record_type:UPDATE;[R1] database_name:oblog_tt.obcdc_db1;[R1] table_name:enum_set_tbl;[R1] log_event:true;[R1] column_count:3;[R1] source_category:SRC_FULL_RECORDED;[R1] source_type:SRC_OCEANBASE_1_0;[R1] has_pk:true;[R1] pk_info:(0);[R1] pks:id;[R1] has_uk:false;[R1] uk_info:(null);[R1] uks:(null);[R1] [C1] column_name:id;[R1] [C1] column_type:MYSQL_TYPE_LONG;[R1] [C1] column_is_rowkey:true;[R1] [C1] column_is_signed:true;[R1] [C1] column_encoding:binary;[R1] [C1] column_is_not_null:true;[R1] [C1] column_value_new:[1](1);[R1] [C1] column_value_old:[1](1);[R1] [C2] column_name:c1;[R1] [C2] column_type:MYSQL_TYPE_ENUM;[R1] [C2] column_is_rowkey:false;[R1] [C2] column_is_signed:true;[R1] [C2] column_encoding:utf8mb4;[R1] [C2] column_is_not_null:true;[R1] [C2] column_is_dep_col_of_gen_col:true;[R1] [C2] column_extend_info:e,n,u,m;[R1] [C2] column_value_new:[e](1);[R1] [C2] column_value_old:[e](1);[R1] [C3] column_name:c2;[R1] [C3] column_type:MYSQL_TYPE_SET;[R1] [C3] column_is_rowkey:false;[R1] [C3] column_is_signed:true;[R1] [C3] column_encoding:utf8mb4;[R1] [C3] column_is_not_null:false;[R1] [C3] column_is_dep_col_of_gen_col:true;[R1] [C3] column_extend_info:s,e,t;[R1] [C3] column_value_new:[s,e](3);[R1] [C3] column_value_old:[s](1);$[R2] COMMIT;
ob1.oblog.next_dml;
[R0] BEGIN;[R0] org_cluster_id:1;[R1] record_type:DELETE;[R1] database_name:oblog_tt.obcdc_db1;[R1] table_name:enum_set_tbl;[R1] log_event:true;[R1] column_count:3;[R1] source_category:SRC_FULL_RECORDED;[R1] source_type:SRC_OCEANBASE_1_0;[R1] has_pk:true;[R1] pk_info:(0);[R1] pks:id;[R1] has_uk:false;[R1] uk_info:(null);[R1] uks:(null);[R1] [C1] column_name:id;[R1] [C1] column_type:MYSQL_TYPE_LONG;[R1] [C1] column_is_rowkey:true;[R1] [C1] column_is_signed:true;[R1] [C1] column_encoding:binary;[R1] [C1] column_is_not_null:true;[R1] [C1] column_value_old:[1](1);[R1] [C2] column_name:c1;[R1] [C2] column_type:MYSQL_TYPE_ENUM;[R1] [C2] column_is_rowkey:false;[R1] [C2] column_is_signed:true;[R1] [C2] column_encoding:utf8mb4;[R1] [C2] column_is_not_null:true;[R1] [C2] column_is_dep_col_of_gen_col:true;[R1] [C2] column_extend_info:e,n,u,m;[R1] [C2] column_value_old:[e](1);[R1] [C3] column_name:c2;[R1] [C3] column_type:MYSQL_TYPE_SET;[R1] [C3] column_is_rowkey:false;[R1] [C3] column_is_signed:true;[R1] [C3] column_encoding:utf8mb4;[R1] [C3] column_is_not_null:false;[R1] [C3] column_is_dep_col_of_gen_col:true;[R1] [C3] column_extend_info:s,e,t;[R1] [C3] column_value_old:[s,e](3);$[R2] COMMIT;
ob1.oblog.next_dml;
[R0] BEGIN;[R0] org_cluster_id:1;[R1] record_type:INSERT;[R1] database_name:oblog_tt.obcdc_db1;[R1] table_name:enum_set_tbl;[R1] log_event:true;[R1] column_count:3;[R1] source_category:SRC_FULL_RECORDED;[R1] source_type:SRC_OCEANBASE_1_0;[R1] has_pk:true;[R1] pk_info:(0);[R1] pks:id;[R1] has_uk:false;[R1] uk_info:(null);[R1] uks:(null);[R1] [C1] column_name:id;[R1] [C1] column_type:MYSQL_TYPE_LONG;[R1] [C1] column_is_rowkey:true;[R1] [C1] column_is_signed:true;[R1] [C1] column_encoding:binary;[R1] [C1] column_is_not_null:true;[R1] [C1] column_value_new:[6](1);[R1] [C2] column_name:c2;[R1] [C2] column_type:MYSQL_TYPE_SET;[R1] [C2] column_is_rowkey:false;[R1] [C2] column_is_signed:true;[R1] [C2] column_encoding:utf8mb4;[R1] [C2] column_is_not_null:false;[R1] [C2] column_is_dep_col_of_gen_col:true;[R1] [C2] column_extend_info:s,e,t;[R1] [C2] column_value_new:[s,e,t](5);[R1] [C3] column_name:c1;[R1] [C3] column_type:MYSQL_TYPE_ENUM;[R1] [C3] column_is_rowkey:false;[R1] [C3] column_is_signed:true;[R1] [C3] column_encoding:utf8mb4;[R1] [C3] column_is_not_null:false;[R1] [C3] column_is_dep_col_of_gen_col:true;[R1] [C3] column_extend_info:e,n,u,m;[R1] [C3] column_value_new:[n](1);$[R2] COMMIT;
ob1.oblog.stop;
'#################### [CASE_END] Fetch History ####################'
'#################### [CASE_BEGIN] Fetch History Using Data Dict ####################'
ob1.oblog.set_start_tstamp_usec $start_timestamp_usec;
ob1.oblog.gen_conf tb_white_list=oblog_tt.*.* enable_output_by_table_def=1 enable_output_hidden_primary_key=1 meta_data_refresh_mode=data_dict log_level=DEBUG;
ob1.oblog.set_extra_argument -m -i;
ob1.oblog.restart;
ob1.oblog.next_dml;
[R0] BEGIN;[R0] org_cluster_id:1;[R1] record_type:INSERT;[R1] database_name:oblog_tt.obcdc_db1;[R1] table_name:lob_tbl;[R1] log_event:true;[R1] column_count:1;[R1] source_category:SRC_FULL_RECORDED;[R1] source_type:SRC_OCEANBASE_1_0;[R1] has_pk:true;[R1] pk_info:(0);[R1] pks:id;[R1] has_uk:false;[R1] uk_info:(null);[R1] uks:(null);[R1] [C1] column_name:id;[R1] [C1] column_type:MYSQL_TYPE_LONG;[R1] [C1] column_is_rowkey:true;[R1] [C1] column_is_signed:true;[R1] [C1] column_encoding:binary;[R1] [C1] column_is_not_null:true;[R1] [C1] column_value_new:[1](1);$[R2] COMMIT;
ob1.oblog.next_dml;
[R0] BEGIN;[R0] org_cluster_id:1;[R1] record_type:INSERT;[R1] database_name:oblog_tt.obcdc_db1;[R1] table_name:lob_tbl;[R1] log_event:true;[R1] column_count:2;[R1] source_category:SRC_FULL_RECORDED;[R1] source_type:SRC_OCEANBASE_1_0;[R1] has_pk:true;[R1] pk_info:(0);[R1] pks:id;[R1] has_uk:false;[R1] uk_info:(null);[R1] uks:(null);[R1] [C1] column_name:id;[R1] [C1] column_type:MYSQL_TYPE_LONG;[R1] [C1] column_is_rowkey:true;[R1] [C1] column_is_signed:true;[R1] [C1] column_encoding:binary;[R1] [C1] column_is_not_null:true;[R1] [C1] column_value_new:[2](1);[R1] [C2] column_name:c2;[R1] [C2] column_type:MYSQL_TYPE_TINY_BLOB;[R1] [C2] column_is_rowkey:false;[R1] [C2] column_is_signed:true;[R1] [C2] column_encoding:utf8mb4;[R1] [C2] column_is_not_null:false;[R1] [C2] column_value_new_md5:[594f803b380a41396ed63dca39503542](5);$[R2] COMMIT;
ob1.oblog.next_dml;
[R0] BEGIN;[R0] org_cluster_id:1;[R1] record_type:INSERT;[R1] database_name:oblog_tt.obcdc_db1;[R1] table_name:lob_tbl;[R1] log_event:true;[R1] column_count:2;[R1] source_category:SRC_FULL_RECORDED;[R1] source_type:SRC_OCEANBASE_1_0;[R1] has_pk:true;[R1] pk_info:(0);[R1] pks:id;[R1] has_uk:false;[R1] uk_info:(null);[R1] uks:(null);[R1] [C1] column_name:id;[R1] [C1] column_type:MYSQL_TYPE_LONG;[R1] [C1] column_is_rowkey:true;[R1] [C1] column_is_signed:true;[R1] [C1] column_encoding:binary;[R1] [C1] column_is_not_null:true;[R1] [C1] column_value_new:[3](1);[R1] [C2] column_name:c2;[R1] [C2] column_type:MYSQL_TYPE_BLOB;[R1] [C2] column_is_rowkey:false;[R1] [C2] column_is_signed:true;[R1] [C2] column_encoding:utf8mb4;[R1] [C2] column_is_not_null:false;[R1] [C2] column_value_new_md5:[a21075a36eeddd084e17611a238c7101](5);$[R2] COMMIT;
ob1.oblog.next_dml;
[R0] BEGIN;[R0] org_cluster_id:1;[R1] record_type:INSERT;[R1] database_name:oblog_tt.obcdc_db1;[R1] table_name:lob_tbl;[R1] log_event:true;[R1] column_count:2;[R1] source_category:SRC_FULL_RECORDED;[R1] source_type:SRC_OCEANBASE_1_0;[R1] has_pk:true;[R1] pk_info:(0);[R1] pks:id;[R1] has_uk:false;[R1] uk_info:(null);[R1] uks:(null);[R1] [C1] column_name:id;[R1] [C1] column_type:MYSQL_TYPE_LONG;[R1] [C1] column_is_rowkey:true;[R1] [C1] column_is_signed:true;[R1] [C1] column_encoding:binary;[R1] [C1] column_is_not_null:true;[R1] [C1] column_value_new:[4](1);[R1] [C2] column_name:c3;[R1] [C2] column_type:MYSQL_TYPE_LONG_BLOB;[R1] [C2] column_is_rowkey:false;[R1] [C2] column_is_signed:true;[R1] [C2] column_encoding:binary;[R1] [C2] column_is_not_null:false;[R1] [C2] column_value_new_md5:[c57d4c3741dc0eb85d767497f9736503](50331647);$[R2] COMMIT;
ob1.oblog.next_dml;
[R0] BEGIN;[R0] org_cluster_id:1;[R1] record_type:UPDATE;[R1] database_name:oblog_tt.obcdc_db1;[R1] table_name:lob_tbl;[R1] log_event:true;[R1] column_count:2;[R1] source_category:SRC_FULL_RECORDED;[R1] source_type:SRC_OCEANBASE_1_0;[R1] has_pk:true;[R1] pk_info:(0);[R1] pks:id;[R1] has_uk:false;[R1] uk_info:(null);[R1] uks:(null);[R1] [C1] column_name:id;[R1] [C1] column_type:MYSQL_TYPE_LONG;[R1] [C1] column_is_rowkey:true;[R1] [C1] column_is_signed:true;[R1] [C1] column_encoding:binary;[R1] [C1] column_is_not_null:true;[R1] [C1] column_value_new:[1](1);[R1] [C1] column_value_old:[1](1);[R1] [C2] column_name:c3;[R1] [C2] column_type:MYSQL_TYPE_LONG_BLOB;[R1] [C2] column_is_rowkey:false;[R1] [C2] column_is_signed:true;[R1] [C2] column_encoding:binary;[R1] [C2] column_is_not_null:false;[R1] [C2] column_value_new_md5:[c02b95a0df2cf28490643e97ba3db50f](10);[R1] [C2] column_value_old_md5:[NULL](0);$[R2] COMMIT;
ob1.oblog.next_dml;
[R0] BEGIN;[R0] org_cluster_id:1;[R1] record_type:DELETE;[R1] database_name:oblog_tt.obcdc_db1;[R1] table_name:lob_tbl;[R1] log_event:true;[R1] column_count:2;[R1] source_category:SRC_FULL_RECORDED;[R1] source_type:SRC_OCEANBASE_1_0;[R1] has_pk:true;[R1] pk_info:(0);[R1] pks:id;[R1] has_uk:false;[R1] uk_info:(null);[R1] uks:(null);[R1] [C1] column_name:id;[R1] [C1] column_type:MYSQL_TYPE_LONG;[R1] [C1] column_is_rowkey:true;[R1] [C1] column_is_signed:true;[R1] [C1] column_encoding:binary;[R1] [C1] column_is_not_null:true;[R1] [C1] column_value_old:[1](1);[R1] [C2] column_name:c3;[R1] [C2] column_type:MYSQL_TYPE_LONG_BLOB;[R1] [C2] column_is_rowkey:false;[R1] [C2] column_is_signed:true;[R1] [C2] column_encoding:binary;[R1] [C2] column_is_not_null:false;[R1] [C2] column_value_old_md5:[c02b95a0df2cf28490643e97ba3db50f](10);$[R2] COMMIT;
ob1.oblog.next_dml;
[R0] BEGIN;[R0] org_cluster_id:1;[R1] record_type:INSERT;[R1] database_name:oblog_tt.obcdc_db1;[R1] table_name:lob_tbl;[R1] log_event:true;[R1] column_count:2;[R1] source_category:SRC_FULL_RECORDED;[R1] source_type:SRC_OCEANBASE_1_0;[R1] has_pk:true;[R1] pk_info:(0);[R1] pks:id;[R1] has_uk:false;[R1] uk_info:(null);[R1] uks:(null);[R1] [C1] column_name:id;[R1] [C1] column_type:MYSQL_TYPE_LONG;[R1] [C1] column_is_rowkey:true;[R1] [C1] column_is_signed:true;[R1] [C1] column_encoding:binary;[R1] [C1] column_is_not_null:true;[R1] [C1] column_value_new:[5](1);[R1] [C2] column_name:c3;[R1] [C2] column_type:MYSQL_TYPE_LONG_BLOB;[R1] [C2] column_is_rowkey:false;[R1] [C2] column_is_signed:true;[R1] [C2] column_encoding:binary;[R1] [C2] column_is_not_null:false;[R1] [C2] column_is_dep_col_of_gen_col:true;[R1] [C2] column_value_new_md5:[e1faffe9c3c801f2f8c3fbe7cb032cb2](7);$[R2] COMMIT;
ob1.oblog.next_dml;
[R0] BEGIN;[R0] org_cluster_id:1;[R1] record_type:INSERT;[R1] database_name:oblog_tt.obcdc_db1;[R1] table_name:lob_tbl;[R1] log_event:true;[R1] column_count:3;[R1] source_category:SRC_FULL_RECORDED;[R1] source_type:SRC_OCEANBASE_1_0;[R1] has_pk:true;[R1] pk_info:(0);[R1] pks:id;[R1] has_uk:false;[R1] uk_info:(null);[R1] uks:(null);[R1] [C1] column_name:id;[R1] [C1] column_type:MYSQL_TYPE_LONG;[R1] [C1] column_is_rowkey:true;[R1] [C1] column_is_signed:true;[R1] [C1] column_encoding:binary;[R1] [C1] column_is_not_null:true;[R1] [C1] column_value_new:[6](1);[R1] [C2] column_name:c4;[R1] [C2] column_type:MYSQL_TYPE_BLOB;[R1] [C2] column_is_rowkey:false;[R1] [C2] column_is_signed:true;[R1] [C2] column_encoding:binary;[R1] [C2] column_is_not_null:false;[R1] [C2] column_value_new_md5:[22686eba65441cdc1795f276dcdd4e45](65535);[R1] [C3] column_name:c3;[R1] [C3] column_type:MYSQL_TYPE_LONG_BLOB;[R1] [C3] column_is_rowkey:false;[R1] [C3] column_is_signed:true;[R1] [C3] column_encoding:binary;[R1] [C3] column_is_not_null:false;[R1] [C3] column_is_dep_col_of_gen_col:true;[R1] [C3] column_value_new_md5:[1c273a781ce88675380f7d163d4a0718](50331647);$[R2] COMMIT;
ob1.oblog.next_dml;
[R0] BEGIN;[R0] org_cluster_id:1;[R1] record_type:DELETE;[R1] database_name:oblog_tt.obcdc_db1;[R1] table_name:lob_tbl;[R1] log_event:true;[R1] column_count:3;[R1] source_category:SRC_FULL_RECORDED;[R1] source_type:SRC_OCEANBASE_1_0;[R1] has_pk:true;[R1] pk_info:(0);[R1] pks:id;[R1] has_uk:false;[R1] uk_info:(null);[R1] uks:(null);[R1] [C1] column_name:id;[R1] [C1] column_type:MYSQL_TYPE_LONG;[R1] [C1] column_is_rowkey:true;[R1] [C1] column_is_signed:true;[R1] [C1] column_encoding:binary;[R1] [C1] column_is_not_null:true;[R1] [C1] column_value_old:[3](1);[R1] [C2] column_name:c4;[R1] [C2] column_type:MYSQL_TYPE_BLOB;[R1] [C2] column_is_rowkey:false;[R1] [C2] column_is_signed:true;[R1] [C2] column_encoding:binary;[R1] [C2] column_is_not_null:false;[R1] [C2] column_value_old_md5:[NULL](0);[R1] [C3] column_name:c3;[R1] [C3] column_type:MYSQL_TYPE_LONG_BLOB;[R1] [C3] column_is_rowkey:false;[R1] [C3] column_is_signed:true;[R1] [C3] column_encoding:binary;[R1] [C3] column_is_not_null:false;[R1] [C3] column_is_dep_col_of_gen_col:true;[R1] [C3] column_value_old_md5:[NULL](0);$[R2] COMMIT;
ob1.oblog.next_dml;
[R0] BEGIN;[R0] org_cluster_id:1;[R1] record_type:UPDATE;[R1] database_name:oblog_tt.obcdc_db1;[R1] table_name:lob_tbl;[R1] log_event:true;[R1] column_count:3;[R1] source_category:SRC_FULL_RECORDED;[R1] source_type:SRC_OCEANBASE_1_0;[R1] has_pk:true;[R1] pk_info:(0);[R1] pks:id;[R1] has_uk:false;[R1] uk_info:(null);[R1] uks:(null);[R1] [C1] column_name:id;[R1] [C1] column_type:MYSQL_TYPE_LONG;[R1] [C1] column_is_rowkey:true;[R1] [C1] column_is_signed:true;[R1] [C1] column_encoding:binary;[R1] [C1] column_is_not_null:true;[R1] [C1] column_value_new:[6](1);[R1] [C1] column_value_old:[6](1);[R1] [C2] column_name:c4;[R1] [C2] column_type:MYSQL_TYPE_MEDIUM_BLOB;[R1] [C2] column_is_rowkey:false;[R1] [C2] column_is_signed:true;[R1] [C2] column_encoding:binary;[R1] [C2] column_is_not_null:false;[R1] [C2] column_value_new_md5:[59bc7c3cf08fcff32cf523fcd58df01d](16777215);[R1] [C2] column_value_old_md5:[22686eba65441cdc1795f276dcdd4e45](65535);[R1] [C3] column_name:c3;[R1] [C3] column_type:MYSQL_TYPE_LONG_BLOB;[R1] [C3] column_is_rowkey:false;[R1] [C3] column_is_signed:true;[R1] [C3] column_encoding:binary;[R1] [C3] column_is_not_null:false;[R1] [C3] column_is_dep_col_of_gen_col:true;[R1] [C3] column_value_new_md5:[67c762276bced09ee4df0ed537d164ea](5);[R1] [C3] column_value_old_md5:[1c273a781ce88675380f7d163d4a0718](50331647);$[R2] COMMIT;
ob1.oblog.next_dml;
[R0] BEGIN;[R0] org_cluster_id:1;[R1] record_type:UPDATE;[R1] database_name:oblog_tt.obcdc_db1;[R1] table_name:lob_tbl;[R1] log_event:true;[R1] column_count:3;[R1] source_category:SRC_FULL_RECORDED;[R1] source_type:SRC_OCEANBASE_1_0;[R1] has_pk:true;[R1] pk_info:(0);[R1] pks:id;[R1] has_uk:false;[R1] uk_info:(null);[R1] uks:(null);[R1] [C1] column_name:id;[R1] [C1] column_type:MYSQL_TYPE_LONG;[R1] [C1] column_is_rowkey:true;[R1] [C1] column_is_signed:true;[R1] [C1] column_encoding:binary;[R1] [C1] column_is_not_null:true;[R1] [C1] column_value_new:[6](1);[R1] [C1] column_value_old:[6](1);[R1] [C2] column_name:c4;[R1] [C2] column_type:MYSQL_TYPE_MEDIUM_BLOB;[R1] [C2] column_is_rowkey:false;[R1] [C2] column_is_signed:true;[R1] [C2] column_encoding:binary;[R1] [C2] column_is_not_null:false;[R1] [C2] column_value_new_md5:[f7947c3138becb8e8f0eafe783f639c6](16777215);[R1] [C2] column_value_old_md5:[59bc7c3cf08fcff32cf523fcd58df01d](16777215);[R1] [C3] column_name:c3;[R1] [C3] column_type:MYSQL_TYPE_LONG_BLOB;[R1] [C3] column_is_rowkey:false;[R1] [C3] column_is_signed:true;[R1] [C3] column_encoding:binary;[R1] [C3] column_is_not_null:false;[R1] [C3] column_is_dep_col_of_gen_col:true;[R1] [C3] column_value_new_md5:[50f84daf3a6dfd6a9f20c9f8ef428942](5);[R1] [C3] column_value_old_md5:[67c762276bced09ee4df0ed537d164ea](5);$[R2] COMMIT;
ob1.oblog.next_dml;
[R0] BEGIN;[R0] org_cluster_id:1;[R1] record_type:UPDATE;[R1] database_name:oblog_tt.obcdc_db1;[R1] table_name:lob_tbl;[R1] log_event:true;[R1] column_count:3;[R1] source_category:SRC_FULL_RECORDED;[R1] source_type:SRC_OCEANBASE_1_0;[R1] has_pk:true;[R1] pk_info:(0);[R1] pks:id;[R1] has_uk:false;[R1] uk_info:(null);[R1] uks:(null);[R1] [C1] column_name:id;[R1] [C1] column_type:MYSQL_TYPE_LONG;[R1] [C1] column_is_rowkey:true;[R1] [C1] column_is_signed:true;[R1] [C1] column_encoding:binary;[R1] [C1] column_is_not_null:true;[R1] [C1] column_value_new:[6](1);[R1] [C1] column_value_old:[6](1);[R1] [C2] column_name:c4;[R1] [C2] column_type:MYSQL_TYPE_MEDIUM_BLOB;[R1] [C2] column_is_rowkey:false;[R1] [C2] column_is_signed:true;[R1] [C2] column_encoding:binary;[R1] [C2] column_is_not_null:false;[R1] [C2] column_value_new_md5:[NULL](0);[R1] [C2] column_value_old_md5:[NULL](0);[R1] [C3] column_name:c3;[R1] [C3] column_type:MYSQL_TYPE_LONG_BLOB;[R1] [C3] column_is_rowkey:false;[R1] [C3] column_is_signed:true;[R1] [C3] column_encoding:binary;[R1] [C3] column_is_not_null:false;[R1] [C3] column_is_dep_col_of_gen_col:true;[R1] [C3] column_value_new_md5:[79b281060d337b9b2b84ccf390adcf74](5242880);[R1] [C3] column_value_old_md5:[50f84daf3a6dfd6a9f20c9f8ef428942](5);$[R2] COMMIT;
ob1.oblog.next_dml;
[R0] BEGIN;[R0] org_cluster_id:1;[R1] record_type:DELETE;[R1] database_name:oblog_tt.obcdc_db1;[R1] table_name:lob_tbl;[R1] log_event:true;[R1] column_count:3;[R1] source_category:SRC_FULL_RECORDED;[R1] source_type:SRC_OCEANBASE_1_0;[R1] has_pk:true;[R1] pk_info:(0);[R1] pks:id;[R1] has_uk:false;[R1] uk_info:(null);[R1] uks:(null);[R1] [C1] column_name:id;[R1] [C1] column_type:MYSQL_TYPE_LONG;[R1] [C1] column_is_rowkey:true;[R1] [C1] column_is_signed:true;[R1] [C1] column_encoding:binary;[R1] [C1] column_is_not_null:true;[R1] [C1] column_value_old:[5](1);[R1] [C2] column_name:c4;[R1] [C2] column_type:MYSQL_TYPE_MEDIUM_BLOB;[R1] [C2] column_is_rowkey:false;[R1] [C2] column_is_signed:true;[R1] [C2] column_encoding:binary;[R1] [C2] column_is_not_null:false;[R1] [C2] column_value_old_md5:[NULL](0);[R1] [C3] column_name:c3;[R1] [C3] column_type:MYSQL_TYPE_LONG_BLOB;[R1] [C3] column_is_rowkey:false;[R1] [C3] column_is_signed:true;[R1] [C3] column_encoding:binary;[R1] [C3] column_is_not_null:false;[R1] [C3] column_is_dep_col_of_gen_col:true;[R1] [C3] column_value_old_md5:[e1faffe9c3c801f2f8c3fbe7cb032cb2](7);$[R2] COMMIT;
ob1.oblog.next_dml;
[R0] BEGIN;[R0] org_cluster_id:1;[R1] record_type:INSERT;[R1] database_name:oblog_tt.obcdc_db1;[R1] table_name:lob_tbl;[R1] log_event:true;[R1] column_count:4;[R1] source_category:SRC_FULL_RECORDED;[R1] source_type:SRC_OCEANBASE_1_0;[R1] has_pk:true;[R1] pk_info:(3);[R1] pks:__pk_increment;[R1] has_uk:false;[R1] uk_info:(null);[R1] uks:(null);[R1] [C1] column_name:id;[R1] [C1] column_type:MYSQL_TYPE_LONG;[R1] [C1] column_is_rowkey:false;[R1] [C1] column_is_signed:true;[R1] [C1] column_encoding:binary;[R1] [C1] column_is_not_null:true;[R1] [C1] column_value_new:[7](1);[R1] [C2] column_name:c4;[R1] [C2] column_type:MYSQL_TYPE_MEDIUM_BLOB;[R1] [C2] column_is_rowkey:false;[R1] [C2] column_is_signed:true;[R1] [C2] column_encoding:binary;[R1] [C2] column_is_not_null:false;[R1] [C2] column_value_new_md5:[77963b7a931377ad4ab5ad6a9cd718aa](3);[R1] [C3] column_name:c3;[R1] [C3] column_type:MYSQL_TYPE_LONG_BLOB;[R1] [C3] column_is_rowkey:false;[R1] [C3] column_is_signed:true;[R1] [C3] column_encoding:binary;[R1] [C3] column_is_not_null:false;[R1] [C3] column_is_dep_col_of_gen_col:true;[R1] [C3] column_value_new_md5:[d2f2297d6e829cd3493aa7de4416a18f](3);[R1] [C4] column_name:__pk_increment;[R1] [C4] column_type:MYSQL_TYPE_LONGLONG;[R1] [C4] column_is_rowkey:true;[R1] [C4] column_is_signed:false;[R1] [C4] column_encoding:binary;[R1] [C4] column_is_not_null:true;[R1] [C4] column_value_new:[10001](5);$[R2] COMMIT;
ob1.oblog.next_dml;
[R0] BEGIN;[R0] org_cluster_id:1;[R1] record_type:INSERT;[R1] database_name:oblog_tt.obcdc_db1;[R1] table_name:lob_tbl;[R1] log_event:true;[R1] column_count:4;[R1] source_category:SRC_FULL_RECORDED;[R1] source_type:SRC_OCEANBASE_1_0;[R1] has_pk:true;[R1] pk_info:(3);[R1] pks:__pk_increment;[R1] has_uk:false;[R1] uk_info:(null);[R1] uks:(null);[R1] [C1] column_name:c3;[R1] [C1] column_type:MYSQL_TYPE_LONG_BLOB;[R1] [C1] column_is_rowkey:false;[R1] [C1] column_is_signed:true;[R1] [C1] column_encoding:binary;[R1] [C1] column_is_not_null:false;[R1] [C1] column_is_dep_col_of_gen_col:true;[R1] [C1] column_value_new_md5:[343d9040a671c45832ee5381860e2996](3);[R1] [C2] column_name:c4;[R1] [C2] column_type:MYSQL_TYPE_MEDIUM_BLOB;[R1] [C2] column_is_rowkey:false;[R1] [C2] column_is_signed:true;[R1] [C2] column_encoding:binary;[R1] [C2] column_is_not_null:false;[R1] [C2] column_value_new_md5:[74d3cfe47b3df992dc047893e6020b94](16777215);[R1] [C3] column_name:id;[R1] [C3] column_type:MYSQL_TYPE_LONG;[R1] [C3] column_is_rowkey:false;[R1] [C3] column_is_signed:true;[R1] [C3] column_encoding:binary;[R1] [C3] column_is_not_null:false;[R1] [C3] column_value_new:[8](1);[R1] [C4] column_name:__pk_increment;[R1] [C4] column_type:MYSQL_TYPE_LONGLONG;[R1] [C4] column_is_rowkey:true;[R1] [C4] column_is_signed:false;[R1] [C4] column_encoding:binary;[R1] [C4] column_is_not_null:true;[R1] [C4] column_value_new:[20001](5);$[R2] COMMIT;
ob1.oblog.next_dml;
[R0] BEGIN;[R0] org_cluster_id:1;[R1] record_type:INSERT;[R1] database_name:oblog_tt.obcdc_db1;[R1] table_name:lob_tbl;[R1] log_event:true;[R1] column_count:5;[R1] source_category:SRC_FULL_RECORDED;[R1] source_type:SRC_OCEANBASE_1_0;[R1] has_pk:true;[R1] pk_info:(4);[R1] pks:__pk_increment;[R1] has_uk:false;[R1] uk_info:(null);[R1] uks:(null);[R1] [C1] column_name:c3;[R1] [C1] column_type:MYSQL_TYPE_LONG_BLOB;[R1] [C1] column_is_rowkey:false;[R1] [C1] column_is_signed:true;[R1] [C1] column_encoding:binary;[R1] [C1] column_is_not_null:false;[R1] [C1] column_is_dep_col_of_gen_col:true;[R1] [C1] column_value_new_md5:[302a43721d74c0442eda8741a016aaef](16777215);[R1] [C2] column_name:c4;[R1] [C2] column_type:MYSQL_TYPE_MEDIUM_BLOB;[R1] [C2] column_is_rowkey:false;[R1] [C2] column_is_signed:true;[R1] [C2] column_encoding:binary;[R1] [C2] column_is_not_null:false;[R1] [C2] column_value_new_md5:[c2692c60eecd0a043304ba5022b9aa94](16777215);[R1] [C3] column_name:c5;[R1] [C3] column_type:MYSQL_TYPE_LONG;[R1] [C3] column_is_rowkey:false;[R1] [C3] column_is_signed:true;[R1] [C3] column_encoding:binary;[R1] [C3] column_is_not_null:false;[R1] [C3] is_generated_column:1;[R1] [C3] column_value_new:[10](2);[R1] [C4] column_name:id;[R1] [C4] column_type:MYSQL_TYPE_LONG;[R1] [C4] column_is_rowkey:false;[R1] [C4] column_is_signed:true;[R1] [C4] column_encoding:binary;[R1] [C4] column_is_not_null:false;[R1] [C4] column_is_dep_col_of_gen_col:true;[R1] [C4] column_value_new:[9](1);[R1] [C5] column_name:__pk_increment;[R1] [C5] column_type:MYSQL_TYPE_LONGLONG;[R1] [C5] column_is_rowkey:true;[R1] [C5] column_is_signed:false;[R1] [C5] column_encoding:binary;[R1] [C5] column_is_not_null:true;[R1] [C5] column_value_new:[30001](5);$[R2] COMMIT;
ob1.oblog.next_dml;
[R0] BEGIN;[R0] org_cluster_id:1;[R1] record_type:UPDATE;[R1] database_name:oblog_tt.obcdc_db1;[R1] table_name:lob_tbl;[R1] log_event:true;[R1] column_count:5;[R1] source_category:SRC_FULL_RECORDED;[R1] source_type:SRC_OCEANBASE_1_0;[R1] has_pk:true;[R1] pk_info:(4);[R1] pks:__pk_increment;[R1] has_uk:false;[R1] uk_info:(null);[R1] uks:(null);[R1] [C1] column_name:c3;[R1] [C1] column_type:MYSQL_TYPE_LONG_BLOB;[R1] [C1] column_is_rowkey:false;[R1] [C1] column_is_signed:true;[R1] [C1] column_encoding:binary;[R1] [C1] column_is_not_null:false;[R1] [C1] column_is_dep_col_of_gen_col:true;[R1] [C1] column_value_new_md5:[b5c75e6bbcfcd0e6520b5f1419ded614](7);[R1] [C1] column_value_old_md5:[NULL](0);[R1] [C2] column_name:c4;[R1] [C2] column_type:MYSQL_TYPE_MEDIUM_BLOB;[R1] [C2] column_is_rowkey:false;[R1] [C2] column_is_signed:true;[R1] [C2] column_encoding:binary;[R1] [C2] column_is_not_null:false;[R1] [C2] column_value_new_md5:[NULL](0);[R1] [C2] column_value_old_md5:[NULL](0);[R1] [C3] column_name:c5;[R1] [C3] column_type:MYSQL_TYPE_LONG;[R1] [C3] column_is_rowkey:false;[R1] [C3] column_is_signed:true;[R1] [C3] column_encoding:binary;[R1] [C3] column_is_not_null:false;[R1] [C3] is_generated_column:1;[R1] [C3] column_value_new:[3](1);[R1] [C3] column_value_old:[3](1);[R1] [C4] column_name:id;[R1] [C4] column_type:MYSQL_TYPE_LONG;[R1] [C4] column_is_rowkey:false;[R1] [C4] column_is_signed:true;[R1] [C4] column_encoding:binary;[R1] [C4] column_is_not_null:false;[R1] [C4] column_is_dep_col_of_gen_col:true;[R1] [C4] column_value_new:[2](1);[R1] [C4] column_value_old:[2](1);[R1] [C5] column_name:__pk_increment;[R1] [C5] column_type:MYSQL_TYPE_LONGLONG;[R1] [C5] column_is_rowkey:true;[R1] [C5] column_is_signed:false;[R1] [C5] column_encoding:binary;[R1] [C5] column_is_not_null:true;[R1] [C5] column_value_new:[1](1);[R1] [C5] column_value_old:[1](1);$[R2] COMMIT;
ob1.oblog.next_dml;
[R0] BEGIN;[R0] org_cluster_id:1;[R1] record_type:DELETE;[R1] database_name:oblog_tt.obcdc_db1;[R1] table_name:lob_tbl;[R1] log_event:true;[R1] column_count:5;[R1] source_category:SRC_FULL_RECORDED;[R1] source_type:SRC_OCEANBASE_1_0;[R1] has_pk:true;[R1] pk_info:(4);[R1] pks:__pk_increment;[R1] has_uk:false;[R1] uk_info:(null);[R1] uks:(null);[R1] [C1] column_name:c3;[R1] [C1] column_type:MYSQL_TYPE_LONG_BLOB;[R1] [C1] column_is_rowkey:false;[R1] [C1] column_is_signed:true;[R1] [C1] column_encoding:binary;[R1] [C1] column_is_not_null:false;[R1] [C1] column_is_dep_col_of_gen_col:true;[R1] [C1] column_value_old_md5:[NULL](0);[R1] [C2] column_name:c4;[R1] [C2] column_type:MYSQL_TYPE_MEDIUM_BLOB;[R1] [C2] column_is_rowkey:false;[R1] [C2] column_is_signed:true;[R1] [C2] column_encoding:binary;[R1] [C2] column_is_not_null:false;[R1] [C2] column_value_old_md5:[NULL](0);[R1] [C3] column_name:c5;[R1] [C3] column_type:MYSQL_TYPE_LONG;[R1] [C3] column_is_rowkey:false;[R1] [C3] column_is_signed:true;[R1] [C3] column_encoding:binary;[R1] [C3] column_is_not_null:false;[R1] [C3] is_generated_column:1;[R1] [C3] column_value_old:[5](1);[R1] [C4] column_name:id;[R1] [C4] column_type:MYSQL_TYPE_LONG;[R1] [C4] column_is_rowkey:false;[R1] [C4] column_is_signed:true;[R1] [C4] column_encoding:binary;[R1] [C4] column_is_not_null:false;[R1] [C4] column_is_dep_col_of_gen_col:true;[R1] [C4] column_value_old:[4](1);[R1] [C5] column_name:__pk_increment;[R1] [C5] column_type:MYSQL_TYPE_LONGLONG;[R1] [C5] column_is_rowkey:true;[R1] [C5] column_is_signed:false;[R1] [C5] column_encoding:binary;[R1] [C5] column_is_not_null:true;[R1] [C5] column_value_old:[2](1);$[R2] COMMIT;
ob1.oblog.next_dml;
[R0] BEGIN;[R0] org_cluster_id:1;[R1] record_type:INSERT;[R1] database_name:oblog_tt.obcdc_db1;[R1] table_name:enum_set_tbl;[R1] log_event:true;[R1] column_count:3;[R1] source_category:SRC_FULL_RECORDED;[R1] source_type:SRC_OCEANBASE_1_0;[R1] has_pk:true;[R1] pk_info:(2);[R1] pks:__pk_increment;[R1] has_uk:false;[R1] uk_info:(null);[R1] uks:(null);[R1] [C1] column_name:id;[R1] [C1] column_type:MYSQL_TYPE_LONG;[R1] [C1] column_is_rowkey:false;[R1] [C1] column_is_signed:true;[R1] [C1] column_encoding:binary;[R1] [C1] column_is_not_null:false;[R1] [C1] column_value_new:[1](1);[R1] [C2] column_name:c1;[R1] [C2] column_type:MYSQL_TYPE_ENUM;[R1] [C2] column_is_rowkey:false;[R1] [C2] column_is_signed:true;[R1] [C2] column_encoding:utf8mb4;[R1] [C2] column_is_not_null:false;[R1] [C2] column_extend_info:e,n,u,m;[R1] [C2] column_value_new:[e](1);[R1] [C3] column_name:__pk_increment;[R1] [C3] column_type:MYSQL_TYPE_LONGLONG;[R1] [C3] column_is_rowkey:true;[R1] [C3] column_is_signed:false;[R1] [C3] column_encoding:binary;[R1] [C3] column_is_not_null:true;[R1] [C3] column_value_new:[1](1);$[R2] COMMIT;
ob1.oblog.next_dml;
[R0] BEGIN;[R0] org_cluster_id:1;[R1] record_type:INSERT;[R1] database_name:oblog_tt.obcdc_db1;[R1] table_name:enum_set_tbl;[R1] log_event:true;[R1] column_count:4;[R1] source_category:SRC_FULL_RECORDED;[R1] source_type:SRC_OCEANBASE_1_0;[R1] has_pk:true;[R1] pk_info:(2);[R1] pks:__pk_increment;[R1] has_uk:false;[R1] uk_info:(null);[R1] uks:(null);[R1] [C1] column_name:id;[R1] [C1] column_type:MYSQL_TYPE_LONG;[R1] [C1] column_is_rowkey:false;[R1] [C1] column_is_signed:true;[R1] [C1] column_encoding:binary;[R1] [C1] column_is_not_null:false;[R1] [C1] column_value_new:[2](1);[R1] [C2] column_name:c1;[R1] [C2] column_type:MYSQL_TYPE_ENUM;[R1] [C2] column_is_rowkey:false;[R1] [C2] column_is_signed:true;[R1] [C2] column_encoding:utf8mb4;[R1] [C2] column_is_not_null:false;[R1] [C2] column_extend_info:e,n,u,m;[R1] [C2] column_value_new:[n](1);[R1] [C3] column_name:__pk_increment;[R1] [C3] column_type:MYSQL_TYPE_LONGLONG;[R1] [C3] column_is_rowkey:true;[R1] [C3] column_is_signed:false;[R1] [C3] column_encoding:binary;[R1] [C3] column_is_not_null:true;[R1] [C3] column_value_new:[2](1);[R1] [C4] column_name:c2;[R1] [C4] column_type:MYSQL_TYPE_SET;[R1] [C4] column_is_rowkey:false;[R1] [C4] column_is_signed:true;[R1] [C4] column_encoding:utf8mb4;[R1] [C4] column_is_not_null:false;[R1] [C4] column_extend_info:s,e,t;[R1] [C4] column_value_new:[s](1);$[R2] COMMIT;
ob1.oblog.next_dml;
[R0] BEGIN;[R0] org_cluster_id:1;[R1] record_type:INSERT;[R1] database_name:oblog_tt.obcdc_db1;[R1] table_name:enum_set_tbl;[R1] log_event:true;[R1] column_count:3;[R1] source_category:SRC_FULL_RECORDED;[R1] source_type:SRC_OCEANBASE_1_0;[R1] has_pk:true;[R1] pk_info:(1);[R1] pks:c1;[R1] has_uk:false;[R1] uk_info:(null);[R1] uks:(null);[R1] [C1] column_name:id;[R1] [C1] column_type:MYSQL_TYPE_LONG;[R1] [C1] column_is_rowkey:false;[R1] [C1] column_is_signed:true;[R1] [C1] column_encoding:binary;[R1] [C1] column_is_not_null:false;[R1] [C1] column_value_new:[3](1);[R1] [C2] column_name:c1;[R1] [C2] column_type:MYSQL_TYPE_ENUM;[R1] [C2] column_is_rowkey:true;[R1] [C2] column_is_signed:true;[R1] [C2] column_encoding:utf8mb4;[R1] [C2] column_is_not_null:true;[R1] [C2] column_extend_info:e,n,u,m;[R1] [C2] column_value_new:[u](1);[R1] [C3] column_name:c2;[R1] [C3] column_type:MYSQL_TYPE_SET;[R1] [C3] column_is_rowkey:false;[R1] [C3] column_is_signed:true;[R1] [C3] column_encoding:utf8mb4;[R1] [C3] column_is_not_null:false;[R1] [C3] column_extend_info:s,e,t;[R1] [C3] column_value_new:[e](1);$[R2] COMMIT;
ob1.oblog.next_dml;
[R0] BEGIN;[R0] org_cluster_id:1;[R1] record_type:INSERT;[R1] database_name:oblog_tt.obcdc_db1;[R1] table_name:enum_set_tbl;[R1] log_event:true;[R1] column_count:3;[R1] source_category:SRC_FULL_RECORDED;[R1] source_type:SRC_OCEANBASE_1_0;[R1] has_pk:true;[R1] pk_info:(0);[R1] pks:id;[R1] has_uk:false;[R1] uk_info:(null);[R1] uks:(null);[R1] [C1] column_name:id;[R1] [C1] column_type:MYSQL_TYPE_LONG;[R1] [C1] column_is_rowkey:true;[R1] [C1] column_is_signed:true;[R1] [C1] column_encoding:binary;[R1] [C1] column_is_not_null:true;[R1] [C1] column_value_new:[4](1);[R1] [C2] column_name:c1;[R1] [C2] column_type:MYSQL_TYPE_ENUM;[R1] [C2] column_is_rowkey:false;[R1] [C2] column_is_signed:true;[R1] [C2] column_encoding:utf8mb4;[R1] [C2] column_is_not_null:true;[R1] [C2] column_extend_info:e,n,u,m;[R1] [C2] column_value_new:[m](1);[R1] [C3] column_name:c2;[R1] [C3] column_type:MYSQL_TYPE_SET;[R1] [C3] column_is_rowkey:false;[R1] [C3] column_is_signed:true;[R1] [C3] column_encoding:utf8mb4;[R1] [C3] column_is_not_null:false;[R1] [C3] column_extend_info:s,e,t;[R1] [C3] column_value_new:[t](1);$[R2] COMMIT;
ob1.oblog.next_dml;
[R0] BEGIN;[R0] org_cluster_id:1;[R1] record_type:DELETE;[R1] database_name:oblog_tt.obcdc_db1;[R1] table_name:enum_set_tbl;[R1] log_event:true;[R1] column_count:3;[R1] source_category:SRC_FULL_RECORDED;[R1] source_type:SRC_OCEANBASE_1_0;[R1] has_pk:true;[R1] pk_info:(0);[R1] pks:id;[R1] has_uk:false;[R1] uk_info:(null);[R1] uks:(null);[R1] [C1] column_name:id;[R1] [C1] column_type:MYSQL_TYPE_LONG;[R1] [C1] column_is_rowkey:true;[R1] [C1] column_is_signed:true;[R1] [C1] column_encoding:binary;[R1] [C1] column_is_not_null:true;[R1] [C1] column_value_old:[2](1);[R1] [C2] column_name:c1;[R1] [C2] column_type:MYSQL_TYPE_ENUM;[R1] [C2] column_is_rowkey:false;[R1] [C2] column_is_signed:true;[R1] [C2] column_encoding:utf8mb4;[R1] [C2] column_is_not_null:true;[R1] [C2] column_extend_info:e,n,u,m;[R1] [C2] column_value_old:[n](1);[R1] [C3] column_name:c2;[R1] [C3] column_type:MYSQL_TYPE_SET;[R1] [C3] column_is_rowkey:false;[R1] [C3] column_is_signed:true;[R1] [C3] column_encoding:utf8mb4;[R1] [C3] column_is_not_null:false;[R1] [C3] column_extend_info:s,e,t;[R1] [C3] column_value_old:[s](1);$[R2] COMMIT;
ob1.oblog.next_dml;
[R0] BEGIN;[R0] org_cluster_id:1;[R1] record_type:INSERT;[R1] database_name:oblog_tt.obcdc_db1;[R1] table_name:enum_set_tbl;[R1] log_event:true;[R1] column_count:3;[R1] source_category:SRC_FULL_RECORDED;[R1] source_type:SRC_OCEANBASE_1_0;[R1] has_pk:true;[R1] pk_info:(0);[R1] pks:id;[R1] has_uk:false;[R1] uk_info:(null);[R1] uks:(null);[R1] [C1] column_name:id;[R1] [C1] column_type:MYSQL_TYPE_LONG;[R1] [C1] column_is_rowkey:true;[R1] [C1] column_is_signed:true;[R1] [C1] column_encoding:binary;[R1] [C1] column_is_not_null:true;[R1] [C1] column_value_new:[5](1);[R1] [C2] column_name:c1;[R1] [C2] column_type:MYSQL_TYPE_ENUM;[R1] [C2] column_is_rowkey:false;[R1] [C2] column_is_signed:true;[R1] [C2] column_encoding:utf8mb4;[R1] [C2] column_is_not_null:true;[R1] [C2] column_is_dep_col_of_gen_col:true;[R1] [C2] column_extend_info:e,n,u,m;[R1] [C2] column_value_new:[e](1);[R1] [C3] column_name:c2;[R1] [C3] column_type:MYSQL_TYPE_SET;[R1] [C3] column_is_rowkey:false;[R1] [C3] column_is_signed:true;[R1] [C3] column_encoding:utf8mb4;[R1] [C3] column_is_not_null:false;[R1] [C3] column_is_dep_col_of_gen_col:true;[R1] [C3] column_extend_info:s,e,t;[R1] [C3] column_value_new:[s,t](3);$[R2] COMMIT;
ob1.oblog.next_dml;
[R0] BEGIN;[R0] org_cluster_id:1;[R1] record_type:UPDATE;[R1] database_name:oblog_tt.obcdc_db1;[R1] table_name:enum_set_tbl;[R1] log_event:true;[R1] column_count:3;[R1] source_category:SRC_FULL_RECORDED;[R1] source_type:SRC_OCEANBASE_1_0;[R1] has_pk:true;[R1] pk_info:(0);[R1] pks:id;[R1] has_uk:false;[R1] uk_info:(null);[R1] uks:(null);[R1] [C1] column_name:id;[R1] [C1] column_type:MYSQL_TYPE_LONG;[R1] [C1] column_is_rowkey:true;[R1] [C1] column_is_signed:true;[R1] [C1] column_encoding:binary;[R1] [C1] column_is_not_null:true;[R1] [C1] column_value_new:[1](1);[R1] [C1] column_value_old:[1](1);[R1] [C2] column_name:c1;[R1] [C2] column_type:MYSQL_TYPE_ENUM;[R1] [C2] column_is_rowkey:false;[R1] [C2] column_is_signed:true;[R1] [C2] column_encoding:utf8mb4;[R1] [C2] column_is_not_null:true;[R1] [C2] column_is_dep_col_of_gen_col:true;[R1] [C2] column_extend_info:e,n,u,m;[R1] [C2] column_value_new:[e](1);[R1] [C2] column_value_old:[e](1);[R1] [C3] column_name:c2;[R1] [C3] column_type:MYSQL_TYPE_SET;[R1] [C3] column_is_rowkey:false;[R1] [C3] column_is_signed:true;[R1] [C3] column_encoding:utf8mb4;[R1] [C3] column_is_not_null:false;[R1] [C3] column_is_dep_col_of_gen_col:true;[R1] [C3] column_extend_info:s,e,t;[R1] [C3] column_value_new:[s,e](3);[R1] [C3] column_value_old:[s](1);$[R2] COMMIT;
ob1.oblog.next_dml;
[R0] BEGIN;[R0] org_cluster_id:1;[R1] record_type:DELETE;[R1] database_name:oblog_tt.obcdc_db1;[R1] table_name:enum_set_tbl;[R1] log_event:true;[R1] column_count:3;[R1] source_category:SRC_FULL_RECORDED;[R1] source_type:SRC_OCEANBASE_1_0;[R1] has_pk:true;[R1] pk_info:(0);[R1] pks:id;[R1] has_uk:false;[R1] uk_info:(null);[R1] uks:(null);[R1] [C1] column_name:id;[R1] [C1] column_type:MYSQL_TYPE_LONG;[R1] [C1] column_is_rowkey:true;[R1] [C1] column_is_signed:true;[R1] [C1] column_encoding:binary;[R1] [C1] column_is_not_null:true;[R1] [C1] column_value_old:[1](1);[R1] [C2] column_name:c1;[R1] [C2] column_type:MYSQL_TYPE_ENUM;[R1] [C2] column_is_rowkey:false;[R1] [C2] column_is_signed:true;[R1] [C2] column_encoding:utf8mb4;[R1] [C2] column_is_not_null:true;[R1] [C2] column_is_dep_col_of_gen_col:true;[R1] [C2] column_extend_info:e,n,u,m;[R1] [C2] column_value_old:[e](1);[R1] [C3] column_name:c2;[R1] [C3] column_type:MYSQL_TYPE_SET;[R1] [C3] column_is_rowkey:false;[R1] [C3] column_is_signed:true;[R1] [C3] column_encoding:utf8mb4;[R1] [C3] column_is_not_null:false;[R1] [C3] column_is_dep_col_of_gen_col:true;[R1] [C3] column_extend_info:s,e,t;[R1] [C3] column_value_old:[s,e](3);$[R2] COMMIT;
ob1.oblog.next_dml;
[R0] BEGIN;[R0] org_cluster_id:1;[R1] record_type:INSERT;[R1] database_name:oblog_tt.obcdc_db1;[R1] table_name:enum_set_tbl;[R1] log_event:true;[R1] column_count:3;[R1] source_category:SRC_FULL_RECORDED;[R1] source_type:SRC_OCEANBASE_1_0;[R1] has_pk:true;[R1] pk_info:(0);[R1] pks:id;[R1] has_uk:false;[R1] uk_info:(null);[R1] uks:(null);[R1] [C1] column_name:id;[R1] [C1] column_type:MYSQL_TYPE_LONG;[R1] [C1] column_is_rowkey:true;[R1] [C1] column_is_signed:true;[R1] [C1] column_encoding:binary;[R1] [C1] column_is_not_null:true;[R1] [C1] column_value_new:[6](1);[R1] [C2] column_name:c2;[R1] [C2] column_type:MYSQL_TYPE_SET;[R1] [C2] column_is_rowkey:false;[R1] [C2] column_is_signed:true;[R1] [C2] column_encoding:utf8mb4;[R1] [C2] column_is_not_null:false;[R1] [C2] column_is_dep_col_of_gen_col:true;[R1] [C2] column_extend_info:s,e,t;[R1] [C2] column_value_new:[s,e,t](5);[R1] [C3] column_name:c1;[R1] [C3] column_type:MYSQL_TYPE_ENUM;[R1] [C3] column_is_rowkey:false;[R1] [C3] column_is_signed:true;[R1] [C3] column_encoding:utf8mb4;[R1] [C3] column_is_not_null:false;[R1] [C3] column_is_dep_col_of_gen_col:true;[R1] [C3] column_extend_info:e,n,u,m;[R1] [C3] column_value_new:[n](1);$[R2] COMMIT;
ob1.oblog.stop;
'#################### [CASE_END] Fetch History Using Data Dict ####################'
