ob1=OBI(cluster=1:1:1, init_unit_cpu=5);
ob1.z1.obs0.set extra_config=_private_buffer_size='1B';
ob1.z2.obs0.set extra_config=_private_buffer_size='1B';
ob1.z3.obs0.set extra_config=_private_buffer_size='1B';
ob1.reboot;
drop tenant if exists oblog_tt;
drop resource pool if exists oblog_pool;
drop resource unit if exists oblog_box;
create resource unit oblog_box max_cpu 2, memory_size='10G';
create resource pool oblog_pool unit = 'oblog_box', unit_num = 1, zone_list = ('z1', 'z2', 'z3');
create tenant oblog_tt replica_num = 1, primary_zone='z1', resource_pool_list=('oblog_pool') set ob_tcp_invited_nodes='%';
set ob_query_timeout=90000000;
set ob_trx_timeout=1200000000;
create database oblog_db;
use oblog_db;
create table t1 (a int primary key, b int);
create table t2 (a int, b int);
create table t3 (a int, b int);
ob1.oblog.gen_conf tb_white_list=oblog_tt.oblog_db.* sort_trans_participants=1 log_level=TLOG.*:DEBUG skip_ob_version_compat_check=1 check_switch_server_interval_sec=10 log_router_background_refresh_interval_sec=10;
ob1.oblog.restart;
begin;
savepoint sp1;
insert into t1 values(123, 123);
rollback to sp1;
commit;
select * from t1;
a	b
begin;
savepoint sp1;
insert into t1 values(122, 122);
rollback to sp1;
insert into t1 values(123, 123);
update t1 set b = 12345 where a = 123;
commit;
select * from t1;
a	b
123	12345
ob1.oblog.next_dml;
[R0] BEGIN;[R0] org_cluster_id:1;[R1] record_type:INSERT;[R1] database_name:oblog_tt.oblog_db;[R1] table_name:t1;[R1] log_event:true;[R1] column_count:2;[R1] source_category:SRC_FULL_RECORDED;[R1] source_type:SRC_OCEANBASE_1_0;[R1] has_pk:true;[R1] pk_info:(0);[R1] pks:a;[R1] has_uk:false;[R1] uk_info:(null);[R1] uks:(null);[R1] [C1] column_name:a;[R1] [C1] column_type:MYSQL_TYPE_LONG;[R1] [C1] column_is_rowkey:true;[R1] [C1] column_is_signed:true;[R1] [C1] column_encoding:binary;[R1] [C1] column_is_not_null:true;[R1] [C1] column_value_new:[123](3);[R1] [C2] column_name:b;[R1] [C2] column_type:MYSQL_TYPE_LONG;[R1] [C2] column_is_rowkey:false;[R1] [C2] column_is_signed:true;[R1] [C2] column_encoding:binary;[R1] [C2] column_is_not_null:false;[R1] [C2] column_value_new:[123](3);$[R2] record_type:UPDATE;[R2] database_name:oblog_tt.oblog_db;[R2] table_name:t1;[R2] log_event:true;[R2] column_count:2;[R2] source_category:SRC_FULL_RECORDED;[R2] source_type:SRC_OCEANBASE_1_0;[R2] has_pk:true;[R2] pk_info:(0);[R2] pks:a;[R2] has_uk:false;[R2] uk_info:(null);[R2] uks:(null);[R2] [C1] column_name:a;[R2] [C1] column_type:MYSQL_TYPE_LONG;[R2] [C1] column_is_rowkey:true;[R2] [C1] column_is_signed:true;[R2] [C1] column_encoding:binary;[R2] [C1] column_is_not_null:true;[R2] [C1] column_value_new:[123](3);[R2] [C1] column_value_old:[123](3);[R2] [C2] column_name:b;[R2] [C2] column_type:MYSQL_TYPE_LONG;[R2] [C2] column_is_rowkey:false;[R2] [C2] column_is_signed:true;[R2] [C2] column_encoding:binary;[R2] [C2] column_is_not_null:false;[R2] [C2] column_value_new:[12345](5);[R2] [C2] column_value_old:[123](3);$[R3] COMMIT;
begin;
insert into t1 values(122, 122);
savepoint sp1;
update t1 set b = 345 where a = 122;
insert into t1 values(124, 124);
rollback to sp1;
update t1 set b = 12346 where a = 123;
commit;
select * from t1;
a	b
122	122
123	12346
ob1.oblog.next_dml;
[R0] BEGIN;[R0] org_cluster_id:1;[R1] record_type:INSERT;[R1] database_name:oblog_tt.oblog_db;[R1] table_name:t1;[R1] log_event:true;[R1] column_count:2;[R1] source_category:SRC_FULL_RECORDED;[R1] source_type:SRC_OCEANBASE_1_0;[R1] has_pk:true;[R1] pk_info:(0);[R1] pks:a;[R1] has_uk:false;[R1] uk_info:(null);[R1] uks:(null);[R1] [C1] column_name:a;[R1] [C1] column_type:MYSQL_TYPE_LONG;[R1] [C1] column_is_rowkey:true;[R1] [C1] column_is_signed:true;[R1] [C1] column_encoding:binary;[R1] [C1] column_is_not_null:true;[R1] [C1] column_value_new:[122](3);[R1] [C2] column_name:b;[R1] [C2] column_type:MYSQL_TYPE_LONG;[R1] [C2] column_is_rowkey:false;[R1] [C2] column_is_signed:true;[R1] [C2] column_encoding:binary;[R1] [C2] column_is_not_null:false;[R1] [C2] column_value_new:[122](3);$[R2] record_type:UPDATE;[R2] database_name:oblog_tt.oblog_db;[R2] table_name:t1;[R2] log_event:true;[R2] column_count:2;[R2] source_category:SRC_FULL_RECORDED;[R2] source_type:SRC_OCEANBASE_1_0;[R2] has_pk:true;[R2] pk_info:(0);[R2] pks:a;[R2] has_uk:false;[R2] uk_info:(null);[R2] uks:(null);[R2] [C1] column_name:a;[R2] [C1] column_type:MYSQL_TYPE_LONG;[R2] [C1] column_is_rowkey:true;[R2] [C1] column_is_signed:true;[R2] [C1] column_encoding:binary;[R2] [C1] column_is_not_null:true;[R2] [C1] column_value_new:[123](3);[R2] [C1] column_value_old:[123](3);[R2] [C2] column_name:b;[R2] [C2] column_type:MYSQL_TYPE_LONG;[R2] [C2] column_is_rowkey:false;[R2] [C2] column_is_signed:true;[R2] [C2] column_encoding:binary;[R2] [C2] column_is_not_null:false;[R2] [C2] column_value_new:[12346](5);[R2] [C2] column_value_old:[12345](5);$[R3] COMMIT;
begin;
savepoint sp1;
insert into t1 values(1234, 1234);
savepoint sp2;
delete from t1 where a = 1234;
insert into t1 values(126, 126);
rollback to sp2;
update t1 set b = 12347 where a = 123;
commit;
select * from t1;
a	b
122	122
123	12347
1234	1234
ob1.oblog.next_dml;
[R0] BEGIN;[R0] org_cluster_id:1;[R1] record_type:INSERT;[R1] database_name:oblog_tt.oblog_db;[R1] table_name:t1;[R1] log_event:true;[R1] column_count:2;[R1] source_category:SRC_FULL_RECORDED;[R1] source_type:SRC_OCEANBASE_1_0;[R1] has_pk:true;[R1] pk_info:(0);[R1] pks:a;[R1] has_uk:false;[R1] uk_info:(null);[R1] uks:(null);[R1] [C1] column_name:a;[R1] [C1] column_type:MYSQL_TYPE_LONG;[R1] [C1] column_is_rowkey:true;[R1] [C1] column_is_signed:true;[R1] [C1] column_encoding:binary;[R1] [C1] column_is_not_null:true;[R1] [C1] column_value_new:[1234](4);[R1] [C2] column_name:b;[R1] [C2] column_type:MYSQL_TYPE_LONG;[R1] [C2] column_is_rowkey:false;[R1] [C2] column_is_signed:true;[R1] [C2] column_encoding:binary;[R1] [C2] column_is_not_null:false;[R1] [C2] column_value_new:[1234](4);$[R2] record_type:UPDATE;[R2] database_name:oblog_tt.oblog_db;[R2] table_name:t1;[R2] log_event:true;[R2] column_count:2;[R2] source_category:SRC_FULL_RECORDED;[R2] source_type:SRC_OCEANBASE_1_0;[R2] has_pk:true;[R2] pk_info:(0);[R2] pks:a;[R2] has_uk:false;[R2] uk_info:(null);[R2] uks:(null);[R2] [C1] column_name:a;[R2] [C1] column_type:MYSQL_TYPE_LONG;[R2] [C1] column_is_rowkey:true;[R2] [C1] column_is_signed:true;[R2] [C1] column_encoding:binary;[R2] [C1] column_is_not_null:true;[R2] [C1] column_value_new:[123](3);[R2] [C1] column_value_old:[123](3);[R2] [C2] column_name:b;[R2] [C2] column_type:MYSQL_TYPE_LONG;[R2] [C2] column_is_rowkey:false;[R2] [C2] column_is_signed:true;[R2] [C2] column_encoding:binary;[R2] [C2] column_is_not_null:false;[R2] [C2] column_value_new:[12347](5);[R2] [C2] column_value_old:[12346](5);$[R3] COMMIT;
begin;
savepoint sp1;
insert into t1 values(1238, 1238);
savepoint sp2;
insert into t1 values(127, 127);
rollback to sp2;
insert into t1 values(128, 128);
delete from t1 where a = 1238;
rollback to sp1;
update t1 set b = 123481 where a = 123;
commit;
select * from t1;
a	b
122	122
123	123481
1234	1234
ob1.oblog.next_dml;
[R0] BEGIN;[R0] org_cluster_id:1;[R1] record_type:UPDATE;[R1] database_name:oblog_tt.oblog_db;[R1] table_name:t1;[R1] log_event:true;[R1] column_count:2;[R1] source_category:SRC_FULL_RECORDED;[R1] source_type:SRC_OCEANBASE_1_0;[R1] has_pk:true;[R1] pk_info:(0);[R1] pks:a;[R1] has_uk:false;[R1] uk_info:(null);[R1] uks:(null);[R1] [C1] column_name:a;[R1] [C1] column_type:MYSQL_TYPE_LONG;[R1] [C1] column_is_rowkey:true;[R1] [C1] column_is_signed:true;[R1] [C1] column_encoding:binary;[R1] [C1] column_is_not_null:true;[R1] [C1] column_value_new:[123](3);[R1] [C1] column_value_old:[123](3);[R1] [C2] column_name:b;[R1] [C2] column_type:MYSQL_TYPE_LONG;[R1] [C2] column_is_rowkey:false;[R1] [C2] column_is_signed:true;[R1] [C2] column_encoding:binary;[R1] [C2] column_is_not_null:false;[R1] [C2] column_value_new:[123481](6);[R1] [C2] column_value_old:[12347](5);$[R2] COMMIT;
begin;
savepoint sp1;
insert into t1 values(129, 129);
savepoint sp2;
insert into t1 values(130, 130);
rollback to sp1;
insert into t1 values(131, 131);
update t1 set b = 12349 where a = 123;
commit;
select * from t1;
a	b
122	122
123	12349
131	131
1234	1234
ob1.oblog.next_dml;
[R0] BEGIN;[R0] org_cluster_id:1;[R1] record_type:INSERT;[R1] database_name:oblog_tt.oblog_db;[R1] table_name:t1;[R1] log_event:true;[R1] column_count:2;[R1] source_category:SRC_FULL_RECORDED;[R1] source_type:SRC_OCEANBASE_1_0;[R1] has_pk:true;[R1] pk_info:(0);[R1] pks:a;[R1] has_uk:false;[R1] uk_info:(null);[R1] uks:(null);[R1] [C1] column_name:a;[R1] [C1] column_type:MYSQL_TYPE_LONG;[R1] [C1] column_is_rowkey:true;[R1] [C1] column_is_signed:true;[R1] [C1] column_encoding:binary;[R1] [C1] column_is_not_null:true;[R1] [C1] column_value_new:[131](3);[R1] [C2] column_name:b;[R1] [C2] column_type:MYSQL_TYPE_LONG;[R1] [C2] column_is_rowkey:false;[R1] [C2] column_is_signed:true;[R1] [C2] column_encoding:binary;[R1] [C2] column_is_not_null:false;[R1] [C2] column_value_new:[131](3);$[R2] record_type:UPDATE;[R2] database_name:oblog_tt.oblog_db;[R2] table_name:t1;[R2] log_event:true;[R2] column_count:2;[R2] source_category:SRC_FULL_RECORDED;[R2] source_type:SRC_OCEANBASE_1_0;[R2] has_pk:true;[R2] pk_info:(0);[R2] pks:a;[R2] has_uk:false;[R2] uk_info:(null);[R2] uks:(null);[R2] [C1] column_name:a;[R2] [C1] column_type:MYSQL_TYPE_LONG;[R2] [C1] column_is_rowkey:true;[R2] [C1] column_is_signed:true;[R2] [C1] column_encoding:binary;[R2] [C1] column_is_not_null:true;[R2] [C1] column_value_new:[123](3);[R2] [C1] column_value_old:[123](3);[R2] [C2] column_name:b;[R2] [C2] column_type:MYSQL_TYPE_LONG;[R2] [C2] column_is_rowkey:false;[R2] [C2] column_is_signed:true;[R2] [C2] column_encoding:binary;[R2] [C2] column_is_not_null:false;[R2] [C2] column_value_new:[12349](5);[R2] [C2] column_value_old:[123481](6);$[R3] COMMIT;
begin;
savepoint sp1;
insert into t1 values(132, 132);
savepoint sp2;
insert into t1 values(133, 133);
count(*)
0
count(*)
1
rollback to sp1;
insert into t1 values(134, 134);
rollback to sp2;
ERROR 42000: savepoint does not exist
insert into t1 values(135, 135);
update t1 set b = 12350 where a = 123;
commit;
select * from t1;
a	b
122	122
123	12350
131	131
134	134
135	135
1234	1234
ob1.oblog.next_dml;
[R0] BEGIN;[R0] org_cluster_id:1;[R1] record_type:INSERT;[R1] database_name:oblog_tt.oblog_db;[R1] table_name:t1;[R1] log_event:true;[R1] column_count:2;[R1] source_category:SRC_FULL_RECORDED;[R1] source_type:SRC_OCEANBASE_1_0;[R1] has_pk:true;[R1] pk_info:(0);[R1] pks:a;[R1] has_uk:false;[R1] uk_info:(null);[R1] uks:(null);[R1] [C1] column_name:a;[R1] [C1] column_type:MYSQL_TYPE_LONG;[R1] [C1] column_is_rowkey:true;[R1] [C1] column_is_signed:true;[R1] [C1] column_encoding:binary;[R1] [C1] column_is_not_null:true;[R1] [C1] column_value_new:[134](3);[R1] [C2] column_name:b;[R1] [C2] column_type:MYSQL_TYPE_LONG;[R1] [C2] column_is_rowkey:false;[R1] [C2] column_is_signed:true;[R1] [C2] column_encoding:binary;[R1] [C2] column_is_not_null:false;[R1] [C2] column_value_new:[134](3);$[R2] record_type:INSERT;[R2] database_name:oblog_tt.oblog_db;[R2] table_name:t1;[R2] log_event:true;[R2] column_count:2;[R2] source_category:SRC_FULL_RECORDED;[R2] source_type:SRC_OCEANBASE_1_0;[R2] has_pk:true;[R2] pk_info:(0);[R2] pks:a;[R2] has_uk:false;[R2] uk_info:(null);[R2] uks:(null);[R2] [C1] column_name:a;[R2] [C1] column_type:MYSQL_TYPE_LONG;[R2] [C1] column_is_rowkey:true;[R2] [C1] column_is_signed:true;[R2] [C1] column_encoding:binary;[R2] [C1] column_is_not_null:true;[R2] [C1] column_value_new:[135](3);[R2] [C2] column_name:b;[R2] [C2] column_type:MYSQL_TYPE_LONG;[R2] [C2] column_is_rowkey:false;[R2] [C2] column_is_signed:true;[R2] [C2] column_encoding:binary;[R2] [C2] column_is_not_null:false;[R2] [C2] column_value_new:[135](3);$[R3] record_type:UPDATE;[R3] database_name:oblog_tt.oblog_db;[R3] table_name:t1;[R3] log_event:true;[R3] column_count:2;[R3] source_category:SRC_FULL_RECORDED;[R3] source_type:SRC_OCEANBASE_1_0;[R3] has_pk:true;[R3] pk_info:(0);[R3] pks:a;[R3] has_uk:false;[R3] uk_info:(null);[R3] uks:(null);[R3] [C1] column_name:a;[R3] [C1] column_type:MYSQL_TYPE_LONG;[R3] [C1] column_is_rowkey:true;[R3] [C1] column_is_signed:true;[R3] [C1] column_encoding:binary;[R3] [C1] column_is_not_null:true;[R3] [C1] column_value_new:[123](3);[R3] [C1] column_value_old:[123](3);[R3] [C2] column_name:b;[R3] [C2] column_type:MYSQL_TYPE_LONG;[R3] [C2] column_is_rowkey:false;[R3] [C2] column_is_signed:true;[R3] [C2] column_encoding:binary;[R3] [C2] column_is_not_null:false;[R3] [C2] column_value_new:[12350](5);[R3] [C2] column_value_old:[12349](5);$[R4] COMMIT;
begin;
update t1 set b = 12351 where a = 123;
savepoint sp1;
insert into t1 values(136, 136);
savepoint sp2;
insert into t1 values(137, 137);
savepoint sp3;
release savepoint sp2;
rollback to sp3;
ERROR 42000: savepoint does not exist
rollback to sp2;
ERROR 42000: savepoint does not exist
rollback to sp1;
commit;
select * from t1;
a	b
122	122
123	12351
131	131
134	134
135	135
1234	1234
ob1.oblog.next_dml;
[R0] BEGIN;[R0] org_cluster_id:1;[R1] record_type:UPDATE;[R1] database_name:oblog_tt.oblog_db;[R1] table_name:t1;[R1] log_event:true;[R1] column_count:2;[R1] source_category:SRC_FULL_RECORDED;[R1] source_type:SRC_OCEANBASE_1_0;[R1] has_pk:true;[R1] pk_info:(0);[R1] pks:a;[R1] has_uk:false;[R1] uk_info:(null);[R1] uks:(null);[R1] [C1] column_name:a;[R1] [C1] column_type:MYSQL_TYPE_LONG;[R1] [C1] column_is_rowkey:true;[R1] [C1] column_is_signed:true;[R1] [C1] column_encoding:binary;[R1] [C1] column_is_not_null:true;[R1] [C1] column_value_new:[123](3);[R1] [C1] column_value_old:[123](3);[R1] [C2] column_name:b;[R1] [C2] column_type:MYSQL_TYPE_LONG;[R1] [C2] column_is_rowkey:false;[R1] [C2] column_is_signed:true;[R1] [C2] column_encoding:binary;[R1] [C2] column_is_not_null:false;[R1] [C2] column_value_new:[12351](5);[R1] [C2] column_value_old:[12350](5);$[R2] COMMIT;
begin;
savepoint sp1;
update t1 set b = 12352 where a = 123;
savepoint sp1;
update t1 set b = 12353 where a = 123;
rollback to sp1;
commit;
select * from t1;
a	b
122	122
123	12352
131	131
134	134
135	135
1234	1234
ob1.oblog.next_dml;
[R0] BEGIN;[R0] org_cluster_id:1;[R1] record_type:UPDATE;[R1] database_name:oblog_tt.oblog_db;[R1] table_name:t1;[R1] log_event:true;[R1] column_count:2;[R1] source_category:SRC_FULL_RECORDED;[R1] source_type:SRC_OCEANBASE_1_0;[R1] has_pk:true;[R1] pk_info:(0);[R1] pks:a;[R1] has_uk:false;[R1] uk_info:(null);[R1] uks:(null);[R1] [C1] column_name:a;[R1] [C1] column_type:MYSQL_TYPE_LONG;[R1] [C1] column_is_rowkey:true;[R1] [C1] column_is_signed:true;[R1] [C1] column_encoding:binary;[R1] [C1] column_is_not_null:true;[R1] [C1] column_value_new:[123](3);[R1] [C1] column_value_old:[123](3);[R1] [C2] column_name:b;[R1] [C2] column_type:MYSQL_TYPE_LONG;[R1] [C2] column_is_rowkey:false;[R1] [C2] column_is_signed:true;[R1] [C2] column_encoding:binary;[R1] [C2] column_is_not_null:false;[R1] [C2] column_value_new:[12352](5);[R1] [C2] column_value_old:[12351](5);$[R2] COMMIT;
begin;
savepoint sp1;
delete from t1 where a = 123;
insert into t2 values(123, 123);
insert into t3 values(124, 124);
savepoint sp2;
update t2 set a = 321 where b = 123;
update t3 set a = 421 where b = 124;
rollback to sp2;
commit;
select * from t1;
a	b
122	122
131	131
134	134
135	135
1234	1234
select * from t2;
a	b
123	123
select * from t3;
a	b
124	124
ob1.oblog.next_dml;
[R0] BEGIN;[R0] org_cluster_id:1;[R1] record_type:DELETE;[R1] database_name:oblog_tt.oblog_db;[R1] table_name:t1;[R1] log_event:true;[R1] column_count:2;[R1] source_category:SRC_FULL_RECORDED;[R1] source_type:SRC_OCEANBASE_1_0;[R1] has_pk:true;[R1] pk_info:(0);[R1] pks:a;[R1] has_uk:false;[R1] uk_info:(null);[R1] uks:(null);[R1] [C1] column_name:a;[R1] [C1] column_type:MYSQL_TYPE_LONG;[R1] [C1] column_is_rowkey:true;[R1] [C1] column_is_signed:true;[R1] [C1] column_encoding:binary;[R1] [C1] column_is_not_null:true;[R1] [C1] column_value_old:[123](3);[R1] [C2] column_name:b;[R1] [C2] column_type:MYSQL_TYPE_LONG;[R1] [C2] column_is_rowkey:false;[R1] [C2] column_is_signed:true;[R1] [C2] column_encoding:binary;[R1] [C2] column_is_not_null:false;[R1] [C2] column_value_old:[12352](5);$[R2] record_type:INSERT;[R2] database_name:oblog_tt.oblog_db;[R2] table_name:t2;[R2] log_event:true;[R2] column_count:3;[R2] source_category:SRC_FULL_RECORDED;[R2] source_type:SRC_OCEANBASE_1_0;[R2] has_pk:true;[R2] pk_info:(0);[R2] pks:__pk_increment;[R2] has_uk:false;[R2] uk_info:(null);[R2] uks:(null);[R2] [C1] column_name:__pk_increment;[R2] [C1] column_type:MYSQL_TYPE_LONGLONG;[R2] [C1] column_is_rowkey:true;[R2] [C1] column_is_signed:false;[R2] [C1] column_encoding:binary;[R2] [C1] column_is_not_null:true;[R2] [C1] column_value_new:[1](1);[R2] [C2] column_name:a;[R2] [C2] column_type:MYSQL_TYPE_LONG;[R2] [C2] column_is_rowkey:false;[R2] [C2] column_is_signed:true;[R2] [C2] column_encoding:binary;[R2] [C2] column_is_not_null:false;[R2] [C2] column_value_new:[123](3);[R2] [C3] column_name:b;[R2] [C3] column_type:MYSQL_TYPE_LONG;[R2] [C3] column_is_rowkey:false;[R2] [C3] column_is_signed:true;[R2] [C3] column_encoding:binary;[R2] [C3] column_is_not_null:false;[R2] [C3] column_value_new:[123](3);$[R3] record_type:INSERT;[R3] database_name:oblog_tt.oblog_db;[R3] table_name:t3;[R3] log_event:true;[R3] column_count:3;[R3] source_category:SRC_FULL_RECORDED;[R3] source_type:SRC_OCEANBASE_1_0;[R3] has_pk:true;[R3] pk_info:(0);[R3] pks:__pk_increment;[R3] has_uk:false;[R3] uk_info:(null);[R3] uks:(null);[R3] [C1] column_name:__pk_increment;[R3] [C1] column_type:MYSQL_TYPE_LONGLONG;[R3] [C1] column_is_rowkey:true;[R3] [C1] column_is_signed:false;[R3] [C1] column_encoding:binary;[R3] [C1] column_is_not_null:true;[R3] [C1] column_value_new:[1](1);[R3] [C2] column_name:a;[R3] [C2] column_type:MYSQL_TYPE_LONG;[R3] [C2] column_is_rowkey:false;[R3] [C2] column_is_signed:true;[R3] [C2] column_encoding:binary;[R3] [C2] column_is_not_null:false;[R3] [C2] column_value_new:[124](3);[R3] [C3] column_name:b;[R3] [C3] column_type:MYSQL_TYPE_LONG;[R3] [C3] column_is_rowkey:false;[R3] [C3] column_is_signed:true;[R3] [C3] column_encoding:binary;[R3] [C3] column_is_not_null:false;[R3] [C3] column_value_new:[124](3);$[R4] COMMIT;
ob1.oblog.stop;
ob1.oblog.stat_check_log_cnt "rollback row by RollbackToSavepoint";
18
ob1.oblog.check_log "need_switch_server";
ob1.oblog.check_log "exist higher priority server, need switch server";
ob1.oblog.check_log "CHECK_NEED_SWITCH_SERVER] find different server";
ob1.oblog.set_start_tstamp_usec $start_tstamp_usec;
ob1.oblog.gen_conf tb_white_list=oblog_tt.oblog_db.* sort_trans_participants=1 log_level=TLOG.*:DEBUG skip_ob_version_compat_check=1;
ob1.oblog.restart;
ob1.oblog.next_dml;
[R0] BEGIN;[R0] org_cluster_id:1;[R1] record_type:INSERT;[R1] database_name:oblog_tt.oblog_db;[R1] table_name:t1;[R1] log_event:true;[R1] column_count:2;[R1] source_category:SRC_FULL_RECORDED;[R1] source_type:SRC_OCEANBASE_1_0;[R1] has_pk:true;[R1] pk_info:(0);[R1] pks:a;[R1] has_uk:false;[R1] uk_info:(null);[R1] uks:(null);[R1] [C1] column_name:a;[R1] [C1] column_type:MYSQL_TYPE_LONG;[R1] [C1] column_is_rowkey:true;[R1] [C1] column_is_signed:true;[R1] [C1] column_encoding:binary;[R1] [C1] column_is_not_null:true;[R1] [C1] column_value_new:[123](3);[R1] [C2] column_name:b;[R1] [C2] column_type:MYSQL_TYPE_LONG;[R1] [C2] column_is_rowkey:false;[R1] [C2] column_is_signed:true;[R1] [C2] column_encoding:binary;[R1] [C2] column_is_not_null:false;[R1] [C2] column_value_new:[123](3);$[R2] record_type:UPDATE;[R2] database_name:oblog_tt.oblog_db;[R2] table_name:t1;[R2] log_event:true;[R2] column_count:2;[R2] source_category:SRC_FULL_RECORDED;[R2] source_type:SRC_OCEANBASE_1_0;[R2] has_pk:true;[R2] pk_info:(0);[R2] pks:a;[R2] has_uk:false;[R2] uk_info:(null);[R2] uks:(null);[R2] [C1] column_name:a;[R2] [C1] column_type:MYSQL_TYPE_LONG;[R2] [C1] column_is_rowkey:true;[R2] [C1] column_is_signed:true;[R2] [C1] column_encoding:binary;[R2] [C1] column_is_not_null:true;[R2] [C1] column_value_new:[123](3);[R2] [C1] column_value_old:[123](3);[R2] [C2] column_name:b;[R2] [C2] column_type:MYSQL_TYPE_LONG;[R2] [C2] column_is_rowkey:false;[R2] [C2] column_is_signed:true;[R2] [C2] column_encoding:binary;[R2] [C2] column_is_not_null:false;[R2] [C2] column_value_new:[12345](5);[R2] [C2] column_value_old:[123](3);$[R3] COMMIT;
ob1.oblog.next_dml;
[R0] BEGIN;[R0] org_cluster_id:1;[R1] record_type:INSERT;[R1] database_name:oblog_tt.oblog_db;[R1] table_name:t1;[R1] log_event:true;[R1] column_count:2;[R1] source_category:SRC_FULL_RECORDED;[R1] source_type:SRC_OCEANBASE_1_0;[R1] has_pk:true;[R1] pk_info:(0);[R1] pks:a;[R1] has_uk:false;[R1] uk_info:(null);[R1] uks:(null);[R1] [C1] column_name:a;[R1] [C1] column_type:MYSQL_TYPE_LONG;[R1] [C1] column_is_rowkey:true;[R1] [C1] column_is_signed:true;[R1] [C1] column_encoding:binary;[R1] [C1] column_is_not_null:true;[R1] [C1] column_value_new:[122](3);[R1] [C2] column_name:b;[R1] [C2] column_type:MYSQL_TYPE_LONG;[R1] [C2] column_is_rowkey:false;[R1] [C2] column_is_signed:true;[R1] [C2] column_encoding:binary;[R1] [C2] column_is_not_null:false;[R1] [C2] column_value_new:[122](3);$[R2] record_type:UPDATE;[R2] database_name:oblog_tt.oblog_db;[R2] table_name:t1;[R2] log_event:true;[R2] column_count:2;[R2] source_category:SRC_FULL_RECORDED;[R2] source_type:SRC_OCEANBASE_1_0;[R2] has_pk:true;[R2] pk_info:(0);[R2] pks:a;[R2] has_uk:false;[R2] uk_info:(null);[R2] uks:(null);[R2] [C1] column_name:a;[R2] [C1] column_type:MYSQL_TYPE_LONG;[R2] [C1] column_is_rowkey:true;[R2] [C1] column_is_signed:true;[R2] [C1] column_encoding:binary;[R2] [C1] column_is_not_null:true;[R2] [C1] column_value_new:[123](3);[R2] [C1] column_value_old:[123](3);[R2] [C2] column_name:b;[R2] [C2] column_type:MYSQL_TYPE_LONG;[R2] [C2] column_is_rowkey:false;[R2] [C2] column_is_signed:true;[R2] [C2] column_encoding:binary;[R2] [C2] column_is_not_null:false;[R2] [C2] column_value_new:[12346](5);[R2] [C2] column_value_old:[12345](5);$[R3] COMMIT;
ob1.oblog.next_dml;
[R0] BEGIN;[R0] org_cluster_id:1;[R1] record_type:INSERT;[R1] database_name:oblog_tt.oblog_db;[R1] table_name:t1;[R1] log_event:true;[R1] column_count:2;[R1] source_category:SRC_FULL_RECORDED;[R1] source_type:SRC_OCEANBASE_1_0;[R1] has_pk:true;[R1] pk_info:(0);[R1] pks:a;[R1] has_uk:false;[R1] uk_info:(null);[R1] uks:(null);[R1] [C1] column_name:a;[R1] [C1] column_type:MYSQL_TYPE_LONG;[R1] [C1] column_is_rowkey:true;[R1] [C1] column_is_signed:true;[R1] [C1] column_encoding:binary;[R1] [C1] column_is_not_null:true;[R1] [C1] column_value_new:[1234](4);[R1] [C2] column_name:b;[R1] [C2] column_type:MYSQL_TYPE_LONG;[R1] [C2] column_is_rowkey:false;[R1] [C2] column_is_signed:true;[R1] [C2] column_encoding:binary;[R1] [C2] column_is_not_null:false;[R1] [C2] column_value_new:[1234](4);$[R2] record_type:UPDATE;[R2] database_name:oblog_tt.oblog_db;[R2] table_name:t1;[R2] log_event:true;[R2] column_count:2;[R2] source_category:SRC_FULL_RECORDED;[R2] source_type:SRC_OCEANBASE_1_0;[R2] has_pk:true;[R2] pk_info:(0);[R2] pks:a;[R2] has_uk:false;[R2] uk_info:(null);[R2] uks:(null);[R2] [C1] column_name:a;[R2] [C1] column_type:MYSQL_TYPE_LONG;[R2] [C1] column_is_rowkey:true;[R2] [C1] column_is_signed:true;[R2] [C1] column_encoding:binary;[R2] [C1] column_is_not_null:true;[R2] [C1] column_value_new:[123](3);[R2] [C1] column_value_old:[123](3);[R2] [C2] column_name:b;[R2] [C2] column_type:MYSQL_TYPE_LONG;[R2] [C2] column_is_rowkey:false;[R2] [C2] column_is_signed:true;[R2] [C2] column_encoding:binary;[R2] [C2] column_is_not_null:false;[R2] [C2] column_value_new:[12347](5);[R2] [C2] column_value_old:[12346](5);$[R3] COMMIT;
ob1.oblog.next_dml;
[R0] BEGIN;[R0] org_cluster_id:1;[R1] record_type:UPDATE;[R1] database_name:oblog_tt.oblog_db;[R1] table_name:t1;[R1] log_event:true;[R1] column_count:2;[R1] source_category:SRC_FULL_RECORDED;[R1] source_type:SRC_OCEANBASE_1_0;[R1] has_pk:true;[R1] pk_info:(0);[R1] pks:a;[R1] has_uk:false;[R1] uk_info:(null);[R1] uks:(null);[R1] [C1] column_name:a;[R1] [C1] column_type:MYSQL_TYPE_LONG;[R1] [C1] column_is_rowkey:true;[R1] [C1] column_is_signed:true;[R1] [C1] column_encoding:binary;[R1] [C1] column_is_not_null:true;[R1] [C1] column_value_new:[123](3);[R1] [C1] column_value_old:[123](3);[R1] [C2] column_name:b;[R1] [C2] column_type:MYSQL_TYPE_LONG;[R1] [C2] column_is_rowkey:false;[R1] [C2] column_is_signed:true;[R1] [C2] column_encoding:binary;[R1] [C2] column_is_not_null:false;[R1] [C2] column_value_new:[123481](6);[R1] [C2] column_value_old:[12347](5);$[R2] COMMIT;
ob1.oblog.stop;
ob1.oblog.stat_check_log_cnt "rollback row by RollbackToSavepoint";
18
