drop database  IF EXISTS  ob100x;
Warnings:
Note	1008	Can't drop database 'ob100x'; database doesn't exist
create database ob100x  character set utf8;
use ob100x;
select database();
database()
ob100x
instr-1-1  0个参数
SELECT instr() FROM dual;
ERROR 42000: Incorrect parameter count in the call to native function 'instr'
instr-2-1  1个参数
SELECT instr(500) FROM dual;
ERROR 42000: Incorrect parameter count in the call to native function 'instr'
instr-1-3-1    第一个参数包含第二个参数
select instr('helloworld','l') from dual;
instr('helloworld','l')
3
instr-1-3-2   第一个参数不包含第二个参数
select instr('helloworld','7') from dual;
instr('helloworld','7')
0
instr-1-3-3     第一个参数等于第二个参数
select instr('helloworld','helloworld') from dual;
instr('helloworld','helloworld')
1
instr-1-3-4     第二个参数为空
select instr('helloworld','') from dual;
instr('helloworld','')
1
instr-1-3-5     第一个参数为空
select instr('','helloworld') from dual;
instr('','helloworld')
0
instr-1-3-6     第二个参数为null
select instr('helloworld',null) from dual;
instr('helloworld',null)
NULL
instr-1-3-7     第一个参数为null
select instr(null,'helloworld') from dual;
instr(null,'helloworld')
NULL
instr-1-3-8    第二个参数包含第一个参数
select instr('hellow','helloworld') from dual;
instr('hellow','helloworld')
0
instr-1-4-1     起始位置和匹配序号能匹配到值
select instr('helloworld','l',2,2) from dual;
ERROR 42000: Incorrect parameter count in the call to native function 'instr'
instr-1-4-2    起始位置和匹配序号不能匹配到值 
select instr('helloworld','l',5,2) from dual;
ERROR 42000: Incorrect parameter count in the call to native function 'instr'
instr-1-4-3    起始位置大于字符串长度 
select instr('helloworld','l',15,2) from dual;
ERROR 42000: Incorrect parameter count in the call to native function 'instr'
instr-1-4-4    匹配序号过大
select instr('helloworld','l',2,4) from dual;
ERROR 42000: Incorrect parameter count in the call to native function 'instr'
instr-1-4-5   匹配序号为0
select instr('helloworld','l',2,4) from dual;
ERROR 42000: Incorrect parameter count in the call to native function 'instr'
instr-1-4-6   匹配序号为负数
select instr('helloworld','l',2,-4) from dual;
ERROR 42000: Incorrect parameter count in the call to native function 'instr'
instr-1-4-7  起始位置为0
select instr('helloworld','l',0,1) from dual;
ERROR 42000: Incorrect parameter count in the call to native function 'instr'
instr-1-4-8  起始位置为负数
select instr('helloworld','l',-10,4) from dual;
ERROR 42000: Incorrect parameter count in the call to native function 'instr'
instr-2-1-1    char               
drop   table  if  exists   emp;
Warnings:
Note	1051	Unknown table 'ob100x.emp'
create table EMP(a char(20));
insert into EMP values('helloworld');
select instr(a,'l') from EMP;
instr(a,'l')
3
instr-2-1-2   varchar2    
drop   table  if  exists   emp;
create table EMP(a VARCHAR(20));
insert into EMP values('helloworld');
select instr(a,'l') from EMP;
instr(a,'l')
3
instr-2-1-3   TEXT               
drop   table  if  exists   emp;
create table EMP(a  TEXT);
insert into EMP values('helloworld');
select instr(a,'l') from EMP;
instr(a,'l')
3
instr-2-1-4   BLOB
drop   table  if  exists   emp;
create table EMP(a BLOB(20));
insert into EMP values('helloworld');
select instr(a,'l') from EMP;
instr(a,'l')
3
instr-2-2-1    int    
drop   table  if  exists   emp;
create table EMP(a  INT);
insert into EMP values('10000');
select instr(a,'l') from EMP;
instr(a,'l')
0
instr-2-2-2    float        
drop   table  if  exists   emp;
create table EMP(a FLOAT);
insert into EMP values('10000');
select instr(a,'l') from EMP;
instr(a,'l')
0
instr-2-2-3    DOUBLE
drop   table  if  exists   emp;
create table EMP(a  DOUBLE);
insert into EMP values('10000');
select instr(a,'0') from EMP;
instr(a,'0')
2
instr-2-2-4    BOOL
drop   table  if  exists   emp;
create table EMP(a BOOL);
insert into EMP values('100');
select instr(a,'0') from EMP;
instr(a,'0')
2
instr-2-2-5    DECIMAL
drop   table  if  exists   emp;
create table EMP(a DECIMAL);
insert into EMP values('10000');
select instr(a,'0') from EMP;
instr(a,'0')
2
instr-2-3-1   LONGTEXT             
drop   table  if  exists   emp;
create table EMP(a LONGTEXT);
insert into EMP values('10000');
select instr(a,'0') from EMP;
instr(a,'0')
2
instr-2-3-2  BINARY
drop   table  if  exists   emp;
create table EMP(a BINARY);
insert into EMP values('0');
select instr(a,'0') from EMP;
instr(a,'0')
1
instr-2-3-3   blob        
drop   table  if  exists   emp;
create table EMP(a BLOB);
insert into EMP values('10000');
select instr(a,'0') from EMP;
instr(a,'0')
2
drop   table  if  exists   emp;
create   TABLE   EMP (empno int,ename VARCHAR(10),job VARCHAR(9),mgr int,hiredate DATE,
sal FLOAT(7,0),comm FLOAT(7,0),deptno int,tno int);
insert into EMP (empno, ename, job, mgr, hiredate, sal, comm, deptno,tno)values (7369, 'SMITH001', 'CLERK001', 7902, '7980-12-07',  800, null, 20,1);
insert into EMP (empno, ename, job, mgr, hiredate, sal, comm, deptno,tno)values (7370, 'SMITH002', 'CLERK002', 7902, '7980-12-07',  900, 15, 10,2);
insert into EMP (empno, ename, job, mgr, hiredate, sal, comm, deptno,tno)values (7371, 'SMITH003', 'CLERK003', 7902, '7980-12-07',  250, 25, 50,3);
insert into EMP (empno, ename, job, mgr, hiredate, sal, comm, deptno,tno)values (7372, 'SMITH004', 'CLERK004', 7902, '7980-12-07',  100, 35, 30,4);
insert into EMP (empno, ename, job, mgr, hiredate, sal, comm, deptno,tno)values (7373, 'SMITH005', 'CLERK005', 7902, '7980-12-07',  200, 45, 80,5);
insert into EMP (empno, ename, job, mgr, hiredate, sal, comm, deptno,tno)values (7374, 'SMITH006', 'CLERK002', 7902, '7980-12-07',  300, 55, 10,6);
insert into EMP (empno, ename, job, mgr, hiredate, sal, comm, deptno,tno)values (7375, 'SMITH007', 'CLERK003', 7902, '7980-12-07',  400, 65, 20,7);
insert into EMP (empno, ename, job, mgr, hiredate, sal, comm, deptno,tno)values (7376, 'SMITH008', 'CLERK006', 7902, '7980-12-07',  500, null, 20,8);
insert into EMP (empno, ename, job, mgr, hiredate, sal, comm, deptno,tno)values (7377, 'SMITH009', 'CLERK008', 7902, '7980-12-07',  600, 75, 30,9);
insert into EMP (empno, ename, job, mgr, hiredate, sal, comm, deptno,tno)values (7378, 'SMITH010', 'CLERK009', 7902, '7980-12-07',  800, 95, 20,10);
insert into EMP (empno, ename, job, mgr, hiredate, sal, comm, deptno,tno)values (7379, 'SMITH011', 'CLERK003', 7902, '7980-12-07',  700, null, 20,11);
instr-3-1-1-1  select   
SELECT instr(e.ename, 'M')   eee FROM EMP e   ORDER  BY   eee  desc;
eee
2
2
2
2
2
2
2
2
2
2
2
instr-3-1-1-2  select嵌套 
SELECT instr(e.ename,'S',instr(e.ename, 'M'),1)   eee FROM EMP e   ORDER  BY   eee  desc;
ERROR 42000: Incorrect parameter count in the call to native function 'instr'
instr-3-1-1-3    some,any,all
SELECT sum(instr(e.ename, 'M'))   eee FROM EMP e   ORDER  BY   eee  desc;
eee
22
SELECT min(instr(e.ename, 'M'))   eee FROM EMP e   ORDER  BY   eee  desc;
eee
2
SELECT max(instr(e.ename, 'M'))   eee FROM EMP e   ORDER  BY   eee  desc;
eee
2
SELECT avg(instr(e.ename, 'M'))   eee FROM EMP e   ORDER  BY   eee  desc;
eee
2.0000
instr-3-1-1-4    create as        
drop   table  if  exists   EMP001;
Warnings:
Note	1051	Unknown table 'ob100x.emp001'
DROP VIEW  if  exists   EMP001;
Warnings:
Note	1051	Unknown table 'ob100x.emp001'
create TABLE    EMP001   as  SELECT instr(e.ename, 'M')   eee FROM EMP e   ORDER  BY   eee  desc;
select  *    FROM    EMP001   ORDER BY  eee;
eee
2
2
2
2
2
2
2
2
2
2
2
instr-3-1-2   where  语句    
select        instr(e.ename, 'S')   eee   from    emp e  WHERE  e.sal > 2000    ORDER  BY   eee;
eee
instr-3-1-3     order by 子句
select        instr(e.ename, 'S')   eee   from    emp e  WHERE  e.sal > 2000  OR   e.sal <1000     ORDER  BY   eee;
eee
1
1
1
1
1
1
1
1
1
1
1
instr-3-1-4     group by   子句
select        instr(e.ename, 'S')    eee    from    emp e    GROUP  BY   e.ename   ORDER BY eee;
eee
1
1
1
1
1
1
1
1
1
1
1
instr-3-1-5     group by  having   子句
select        instr(e.ename, 'S')    eee    from    emp e    GROUP  BY   e.ename   HAVING   instr(e.ename, 'S')>0   ORDER BY eee;
eee
1
1
1
1
1
1
1
1
1
1
1
instr-3-2-1   根据字段插入
insert into EMP (empno, ename, job, mgr, hiredate, sal, comm, deptno,tno)values (9000, 'SMITH011', 'CLERK003', 7902, '7980-12-07',  700, null, instr('helloworld','l'),11);
select  *    FROM    EMP    e   WHERE   e.EMPNO=9000;
empno	ename	job	mgr	hiredate	sal	comm	deptno	tno
9000	SMITH011	CLERK003	7902	7980-12-07	700	NULL	3	11
instr-3-2-2    根据表插入
insert into EMP (empno, ename, job, mgr, hiredate, sal, comm, deptno,tno)values (8000, 'SMITH011', 'CLERK003', 7902, '7980-12-07',  700, null, instr('helloworld','l'),11);
select  *    FROM    EMP    e   WHERE   e.EMPNO=8000;
empno	ename	job	mgr	hiredate	sal	comm	deptno	tno
8000	SMITH011	CLERK003	7902	7980-12-07	700	NULL	3	11
instr-3-2-3    插入语句中使用嵌套
insert into EMP (empno, ename, job, mgr, hiredate, sal, comm, deptno,tno)values (7000, 'SMITH011', 'CLERK003', 7902, '7980-12-07',  700, null, instr('helloworld','l'),11);
select  *    FROM    EMP    e   WHERE   e.EMPNO=7000;
empno	ename	job	mgr	hiredate	sal	comm	deptno	tno
7000	SMITH011	CLERK003	7902	7980-12-07	700	NULL	3	11
instr-3-3-1   单列              
UPDATE    EMP  e  SET    e.DEPTNO = instr('helloworld','l')   WHERE   e.EMPNO = 7369;
select  *    FROM    EMP    e   WHERE   e.EMPNO=7369;
empno	ename	job	mgr	hiredate	sal	comm	deptno	tno
7369	SMITH001	CLERK001	7902	7980-12-07	800	NULL	3	1
instr-3-3-2  多列      
UPDATE    EMP  e  SET    e.DEPTNO = instr('helloworld','l');
select  *    FROM    EMP    e   ORDER  BY e.EMPNO,e.TNO;
empno	ename	job	mgr	hiredate	sal	comm	deptno	tno
7000	SMITH011	CLERK003	7902	7980-12-07	700	NULL	3	11
7369	SMITH001	CLERK001	7902	7980-12-07	800	NULL	3	1
7370	SMITH002	CLERK002	7902	7980-12-07	900	15	3	2
7371	SMITH003	CLERK003	7902	7980-12-07	250	25	3	3
7372	SMITH004	CLERK004	7902	7980-12-07	100	35	3	4
7373	SMITH005	CLERK005	7902	7980-12-07	200	45	3	5
7374	SMITH006	CLERK002	7902	7980-12-07	300	55	3	6
7375	SMITH007	CLERK003	7902	7980-12-07	400	65	3	7
7376	SMITH008	CLERK006	7902	7980-12-07	500	NULL	3	8
7377	SMITH009	CLERK008	7902	7980-12-07	600	75	3	9
7378	SMITH010	CLERK009	7902	7980-12-07	800	95	3	10
7379	SMITH011	CLERK003	7902	7980-12-07	700	NULL	3	11
8000	SMITH011	CLERK003	7902	7980-12-07	700	NULL	3	11
9000	SMITH011	CLERK003	7902	7980-12-07	700	NULL	3	11
instr-3-4-1   单列              
DELETE  FROM     EMP      WHERE   EMPNO = 7369  and  DEPTNO = instr('helloworld','l');
select  *    FROM    EMP       WHERE   EMPNO=7369;
empno	ename	job	mgr	hiredate	sal	comm	deptno	tno
instr-3-4-2  多列      
DELETE  FROM     EMP      WHERE    DEPTNO = instr('helloworld','l');
select      count(*)     FROM    EMP;
count(*)
0
instr-3-5    多列
with e as (SELECT   instr('helloworld','l')  from    emp e)  select * from e;
instr('helloworld','l')
insert into EMP (empno, ename, job, mgr, hiredate, sal, comm, deptno,tno)values (8000, 'SMITH011', 'CLERK003', 7902, '7980-12-07',  700, null, instr('helloworld','l'),11);
insert into EMP (empno, ename, job, mgr, hiredate, sal, comm, deptno,tno)values (8000, 'SMITH011', 'CLERK003', 7902, '7980-12-07',  700, null, instr('helloworld','l'),11);
insert into EMP (empno, ename, job, mgr, hiredate, sal, comm, deptno,tno)values (8000, 'SMITH011', 'CLERK003', 7902, '7980-12-07',  700, null, instr('helloworld','l'),11);
insert into EMP (empno, ename, job, mgr, hiredate, sal, comm, deptno,tno)values (8000, 'SMITH011', 'CLERK003', 7902, '7980-12-07',  700, null, instr('helloworld','l'),11);
instr-3-6     CASE WHEN语句
SELECT   sum(empno),  COUNT (CASE WHEN  instr('helloworld','l') = 1 THEN 1 
ELSE       NULL      END) 数据A,         
COUNT (CASE WHEN instr('helloworld','l') = 2 THEN 1                      
ELSE       NULL       END) 数据B   
FROM EMP e   ORDER  BY MOD(e.empno,e.sal);
sum(empno)	数据A	数据B
32000	0	0
drop   table  if  exists   emp;
create   TABLE   EMP (empno int,ename VARCHAR(10),job VARCHAR(9),mgr int,hiredate DATE,
sal FLOAT(7,0),comm FLOAT(7,0),deptno int,tno int);
insert into EMP (empno, ename, job, mgr, hiredate, sal, comm, deptno,tno)values (7369, 'SMITH001', 'CLERK001', 7902, '7980-12-07',  800, null, 20,1);
insert into EMP (empno, ename, job, mgr, hiredate, sal, comm, deptno,tno)values (7370, 'SMITH002', 'CLERK002', 7902, '7980-12-07',  900, 15, 10,2);
insert into EMP (empno, ename, job, mgr, hiredate, sal, comm, deptno,tno)values (7371, 'SMITH003', 'CLERK003', 7902, '7980-12-07',  250, 25, 50,3);
insert into EMP (empno, ename, job, mgr, hiredate, sal, comm, deptno,tno)values (7372, 'SMITH004', 'CLERK004', 7902, '7980-12-07',  100, 35, 30,4);
insert into EMP (empno, ename, job, mgr, hiredate, sal, comm, deptno,tno)values (7373, 'SMITH005', 'CLERK005', 7902, '7980-12-07',  200, 45, 80,5);
insert into EMP (empno, ename, job, mgr, hiredate, sal, comm, deptno,tno)values (7374, 'SMITH006', 'CLERK002', 7902, '7980-12-07',  300, 55, 10,6);
insert into EMP (empno, ename, job, mgr, hiredate, sal, comm, deptno,tno)values (7375, 'SMITH007', 'CLERK003', 7902, '7980-12-07',  400, 65, 20,7);
insert into EMP (empno, ename, job, mgr, hiredate, sal, comm, deptno,tno)values (7376, 'SMITH008', 'CLERK006', 7902, '7980-12-07',  500, null, 20,8);
insert into EMP (empno, ename, job, mgr, hiredate, sal, comm, deptno,tno)values (7377, 'SMITH009', 'CLERK008', 7902, '7980-12-07',  600, 75, 30,9);
insert into EMP (empno, ename, job, mgr, hiredate, sal, comm, deptno,tno)values (7378, 'SMITH010', 'CLERK009', 7902, '7980-12-07',  800, 95, 20,10);
insert into EMP (empno, ename, job, mgr, hiredate, sal, comm, deptno,tno)values (7379, 'SMITH011', 'CLERK003', 7902, '7980-12-07',  700, null, 20,11);
drop   table  if  exists   EMP001;
CREATE OR  REPLACE  VIEW EMP001 AS   SELECT  *    FROM   emp;
instr-4-1-1-1-1  select   
SELECT instr(e.ename, 'M')   eee   FROM EMP001 e   ORDER BY  eee;
eee
2
2
2
2
2
2
2
2
2
2
2
instr-4-1-1-1-2  select嵌套 
select       instr(e.ename, 'M', instr(e.ename, 'M'),  instr(e.ename, 'M'))  eee   from    EMP001 e   ORDER BY  eee;
ERROR 42000: Incorrect parameter count in the call to native function 'instr'
instr-4-1-1-1-3    聚合函数
SELECT sum(instr(e.ename, 'M'))   eee FROM EMP001 e   ORDER  BY   eee  desc;
eee
22
SELECT min(instr(e.ename, 'M'))   eee FROM EMP001 e   ORDER  BY   eee  desc;
eee
2
SELECT max(instr(e.ename, 'M'))   eee FROM EMP001 e   ORDER  BY   eee  desc;
eee
2
SELECT avg(instr(e.ename, 'M'))   eee FROM EMP001 e   ORDER  BY   eee  desc;
eee
2.0000
instr-4-1-1-1-4    create as        
drop   table  if  exists   EMP002;
Warnings:
Note	1051	Unknown table 'ob100x.emp002'
create TABLE    EMP002   as   SELECT   instr(e.ename,'M')  eee   from    EMP001 e;
select  *    FROM    EMP002;
eee
2
2
2
2
2
2
2
2
2
2
2
instr-4-1-1-2   where  语句    
select      instr(e.ename, 'S')    eee  from    EMP001 e  WHERE  e.sal > 200  ORDER BY  eee;
eee
1
1
1
1
1
1
1
1
1
instr-4-1-1-3     order by 子句
select       instr(e.ename, 'L') eee   from    EMP001 e        ORDER BY  eee;
eee
0
0
0
0
0
0
0
0
0
0
0
instr-4-1-1-4     group by   子句
select      instr(e.ename, 's')  eee    from    EMP001 e    GROUP  BY   e.ename    ORDER BY  eee;
eee
1
1
1
1
1
1
1
1
1
1
1
instr-4-1-1-5     group by  having   子句
select      instr(e.ename, 'S')  eee    from    EMP001 e    GROUP  BY   e.ename    HAVING   LENGTH(e.ename)>0   ORDER BY  eee;
eee
1
1
1
1
1
1
1
1
1
1
1
instr-4-1-2-1   根据字段插入
insert into EMP001 (empno, ename, job, mgr, hiredate, sal, comm, deptno,tno)values (9000, 'SMITH', 'CLERK', 7902,  '1980-12-17', 800, null, instr('helloworld','l'),1);
select  *    FROM    EMP001    e   WHERE   e.EMPNO=9000;
empno	ename	job	mgr	hiredate	sal	comm	deptno	tno
9000	SMITH	CLERK	7902	1980-12-17	800	NULL	3	1
instr-4-1-2-2    根据表插入
insert into EMP001 values (8000, 'SMITH', 'CLERK', 7902,  '1980-12-17', 800, null, instr('helloworld','l'),1);
select  *    FROM    EMP001    e   WHERE   e.EMPNO=8000;
empno	ename	job	mgr	hiredate	sal	comm	deptno	tno
8000	SMITH	CLERK	7902	1980-12-17	800	NULL	3	1
instr-4-1-2-3    插入语句中使用嵌套
insert into EMP001 values (7000, 'SMITH', 'CLERK', 7902,  '1980-12-17', 800, null, instr('helloworld', CAST(instr('helloworld','l') AS CHAR)),1);
select  *    FROM    EMP001    e   WHERE   e.EMPNO=7000;
empno	ename	job	mgr	hiredate	sal	comm	deptno	tno
7000	SMITH	CLERK	7902	1980-12-17	800	NULL	0	1
instr-4-1-3-1   单列              
UPDATE    EMP001  e  SET    e.DEPTNO =instr('helloworld','l')   WHERE   e.EMPNO = 7369;
select  *    FROM    EMP001    e   WHERE   e.EMPNO=7369;
empno	ename	job	mgr	hiredate	sal	comm	deptno	tno
7369	SMITH001	CLERK001	7902	7980-12-07	800	NULL	3	1
instr-4-1-3-2  多列      
UPDATE    EMP001  e  SET    e.DEPTNO = instr('helloworld','l');
select  *    FROM    EMP001    e   ORDER  BY e.EMPNO,e.TNO;
empno	ename	job	mgr	hiredate	sal	comm	deptno	tno
7000	SMITH	CLERK	7902	1980-12-17	800	NULL	3	1
7369	SMITH001	CLERK001	7902	7980-12-07	800	NULL	3	1
7370	SMITH002	CLERK002	7902	7980-12-07	900	15	3	2
7371	SMITH003	CLERK003	7902	7980-12-07	250	25	3	3
7372	SMITH004	CLERK004	7902	7980-12-07	100	35	3	4
7373	SMITH005	CLERK005	7902	7980-12-07	200	45	3	5
7374	SMITH006	CLERK002	7902	7980-12-07	300	55	3	6
7375	SMITH007	CLERK003	7902	7980-12-07	400	65	3	7
7376	SMITH008	CLERK006	7902	7980-12-07	500	NULL	3	8
7377	SMITH009	CLERK008	7902	7980-12-07	600	75	3	9
7378	SMITH010	CLERK009	7902	7980-12-07	800	95	3	10
7379	SMITH011	CLERK003	7902	7980-12-07	700	NULL	3	11
8000	SMITH	CLERK	7902	1980-12-17	800	NULL	3	1
9000	SMITH	CLERK	7902	1980-12-17	800	NULL	3	1
instr-4-1-4-1   单列              
DELETE  FROM     EMP001       WHERE   EMPNO = 7369   and   DEPTNO = instr('helloworld','l');
select  *    FROM    EMP001        WHERE   EMPNO=7369;
empno	ename	job	mgr	hiredate	sal	comm	deptno	tno
instr-4-1-4-2  多列      
DELETE          FROM     EMP001  WHERE     DEPTNO = instr('helloworld','l');
select      count(*)     FROM    EMP001;
count(*)
0
instr-4-1-5    多列
with e as (SELECT    instr(e.ename, 'S')  from    EMP001 e)  select * from e;
instr(e.ename, 'S')
instr-4-1-6     CASE WHEN语句
SELECT   sum(empno),  COUNT (CASE WHEN  instr(e.ename, 'S') = 1 THEN 1 
ELSE       NULL      END) 数据A,         
COUNT (CASE WHEN instr(e.ename, 'S')= 2 THEN 1                      
ELSE       NULL       END) 数据B   
FROM EMP001 e   ORDER  BY MOD(e.empno,e.sal);
sum(empno)	数据A	数据B
NULL	0	0
drop   table  if  exists   DEPT;
Warnings:
Note	1051	Unknown table 'ob100x.dept'
CREATE TABLE DEPT (DEPTNO int,DNAME VARCHAR(14) ,LOC VARCHAR(13));
INSERT INTO DEPT VALUES(10,'ACCOUNTING','NEW YORK');
INSERT INTO DEPT VALUES (20,'RESEARCH','DALLAS');
INSERT INTO DEPT VALUES(30,'SALES','CHICAGO');
INSERT INTO DEPT VALUES(40,'OPERATIONS','BOSTON');
drop   table  if  exists   emp;
create   TABLE   EMP (empno int,ename VARCHAR(10),job VARCHAR(9),mgr int,hiredate DATE,
sal FLOAT(7,0),comm FLOAT(7,0),deptno int,tno int);
insert into EMP (empno, ename, job, mgr, hiredate, sal, comm, deptno,tno)values (7369, 'SMITH001', 'CLERK001', 7902, '7980-12-07',  800, null, 20,1);
insert into EMP (empno, ename, job, mgr, hiredate, sal, comm, deptno,tno)values (7370, 'SMITH002', 'CLERK002', 7902, '7980-12-07',  900, 15, 10,2);
insert into EMP (empno, ename, job, mgr, hiredate, sal, comm, deptno,tno)values (7371, 'SMITH003', 'CLERK003', 7902, '7980-12-07',  250, 25, 50,3);
insert into EMP (empno, ename, job, mgr, hiredate, sal, comm, deptno,tno)values (7372, 'SMITH004', 'CLERK004', 7902, '7980-12-07',  100, 35, 30,4);
insert into EMP (empno, ename, job, mgr, hiredate, sal, comm, deptno,tno)values (7373, 'SMITH005', 'CLERK005', 7902, '7980-12-07',  200, 45, 80,5);
insert into EMP (empno, ename, job, mgr, hiredate, sal, comm, deptno,tno)values (7374, 'SMITH006', 'CLERK002', 7902, '7980-12-07',  300, 55, 10,6);
insert into EMP (empno, ename, job, mgr, hiredate, sal, comm, deptno,tno)values (7375, 'SMITH007', 'CLERK003', 7902, '7980-12-07',  400, 65, 20,7);
insert into EMP (empno, ename, job, mgr, hiredate, sal, comm, deptno,tno)values (7376, 'SMITH008', 'CLERK006', 7902, '7980-12-07',  500, null, 20,8);
insert into EMP (empno, ename, job, mgr, hiredate, sal, comm, deptno,tno)values (7377, 'SMITH009', 'CLERK008', 7902, '7980-12-07',  600, 75, 30,9);
insert into EMP (empno, ename, job, mgr, hiredate, sal, comm, deptno,tno)values (7378, 'SMITH010', 'CLERK009', 7902, '7980-12-07',  800, 95, 20,10);
insert into EMP (empno, ename, job, mgr, hiredate, sal, comm, deptno,tno)values (7379, 'SMITH011', 'CLERK003', 7902, '7980-12-07',  700, null, 20,11);
instr-4-2-1     内连接
SELECT   instr(e.ename, 'S')  from emp e  join dept d  on e.deptno = d.deptno;
instr(e.ename, 'S')
1
1
1
1
1
1
1
1
1
instr-4-2-2
select     instr(e.ename, 'S')   eee  from emp e left  join  dept d on e.deptno = d.deptno   ORDER BY  eee;
eee
1
1
1
1
1
1
1
1
1
1
1
select    instr(e.ename, 'S')    eee  from emp e left outer join  dept d on e.deptno = d.deptno   ORDER BY  eee;
eee
1
1
1
1
1
1
1
1
1
1
1
instr-4-2-3
select      instr(e.ename, 'S')    eee   from emp e right join dept d on e.deptno = d.deptno  ORDER BY  eee;
eee
NULL
1
1
1
1
1
1
1
1
1
select      instr(e.ename, 'S')    eee  from emp e right outer join  dept d on e.deptno = d.deptno  ORDER BY  eee;
eee
NULL
1
1
1
1
1
1
1
1
1
instr-4-2-4    全连接full join
select    instr(e.ename, 'S')  eee  from emp e full join dept d on e.DEPTNO=d.DEPTNO    ORDER BY  eee;
eee
NULL
1
1
1
1
1
1
1
1
1
1
1
instr-4-3-1  
SELECT empno,ename,job    FROM emp     WHERE deptno  in(SELECT instr(ename, 'S') FROM  emp);
empno	ename	job
instr-4-3-2
SELECT empno,ename,job    FROM emp  e    WHERE deptno  NOT  in(SELECT instr(ename, 'S') FROM  emp)   ORDER BY  e.empno;
empno	ename	job
7369	SMITH001	CLERK001
7370	SMITH002	CLERK002
7371	SMITH003	CLERK003
7372	SMITH004	CLERK004
7373	SMITH005	CLERK005
7374	SMITH006	CLERK002
7375	SMITH007	CLERK003
7376	SMITH008	CLERK006
7377	SMITH009	CLERK008
7378	SMITH010	CLERK009
7379	SMITH011	CLERK003
instr-5-1-1                    
select  substr(e.ename,2, instr(e.ename, 'S')) eee from emp e  ORDER BY  eee;
eee
M
M
M
M
M
M
M
M
M
M
M
instr-5-1-2
SELECT   replace(e.ename,'SMITH',substr(e.ename,2, instr(e.ename, 'S')))   eee  FROM   emp e  ORDER BY  eee;
eee
M001
M002
M003
M004
M005
M006
M007
M008
M009
M010
M011
instr-5-1-3
SELECT   ABS(instr(ename, 'S'))   eee  FROM   emp e  ORDER BY  eee;
eee
1
1
1
1
1
1
1
1
1
1
1
instr-5-1-4
SELECT   CEIL(instr(ename, 'S'))   eee  FROM   emp e  ORDER BY  eee;
eee
1
1
1
1
1
1
1
1
1
1
1
instr-5-1-5
SELECT   FLOOR(instr(ename, 'S'))  eee   FROM   emp e   ORDER BY  eee;
eee
1
1
1
1
1
1
1
1
1
1
1
instr-5-1-6
SELECT   MOD(instr(ename, 'S'),100)   eee  FROM   emp e   ORDER BY  eee;
eee
1
1
1
1
1
1
1
1
1
1
1
instr-5-1-7
SELECT   hex(CHAR(instr(ename, 'S')))   eee  FROM   emp e  ORDER BY  eee;
eee
01
01
01
01
01
01
01
01
01
01
01
instr-5-1-8
SELECT   LENGTH(MOD(instr(e.ename, 'S'),100))   FROM   emp e;
LENGTH(MOD(instr(e.ename, 'S'),100))
1
1
1
1
1
1
1
1
1
1
1
instr-5-1-9
SELECT  MOD(LENGTH(INSTR('Hello world','or')),instr(e.ename, 'S'))   eee FROM  emp e    ORDER BY  eee;
eee
0
0
0
0
0
0
0
0
0
0
0
instr-5-1-10
SELECT   LOG(12,instr(e.ename, 'S')/1000)   eee  FROM   emp e   ORDER BY  eee;
eee
-2.7798852240873804
-2.7798852240873804
-2.7798852240873804
-2.7798852240873804
-2.7798852240873804
-2.7798852240873804
-2.7798852240873804
-2.7798852240873804
-2.7798852240873804
-2.7798852240873804
-2.7798852240873804
instr-5-1-11
SELECT   POWER(1,instr(e.ename, 'S'))   eee  FROM   emp e   ORDER BY  eee;
eee
1
1
1
1
1
1
1
1
1
1
1
instr-5-1-12
SELECT   SQRT(MOD(e.empno,e.sal))   eee  FROM   emp e   ORDER BY  eee;
eee
8.48528137423857
11
13
13.038404810405298
13.152946437965905
13.19090595827292
13.228756555322953
13.30413469565007
13.341664064126334
19.390719429665317
19.467922333931785
instr-5-1-13
SELECT   TRUNC(MOD(e.empno,e.sal),2)   eee  FROM   emp e   ORDER BY  eee;
ERROR 42000: FUNCTION TRUNC does not exist
instr-5-1-14
SELECT ENAME,JOB,SAL,NVL(COMM,MOD(e.empno,e.sal)) FROM EMP e WHERE SAL<2000   ORDER  BY   sal;
ENAME	JOB	SAL	NVL(COMM,MOD(e.empno,e.sal))
SMITH004	CLERK004	100	35
SMITH005	CLERK005	200	45
SMITH003	CLERK003	250	25
SMITH006	CLERK002	300	55
SMITH007	CLERK003	400	65
SMITH008	CLERK006	500	376
SMITH009	CLERK008	600	75
SMITH011	CLERK003	700	379
SMITH001	CLERK001	800	169
SMITH010	CLERK009	800	95
SMITH002	CLERK002	900	15
instr-5-1-15
SELECT   COALESCE (instr(e.ename, 'S'),instr(e.ename, 'S'))  eee    FROM   emp e   ORDER BY  eee;
eee
1
1
1
1
1
1
1
1
1
1
1
instr-5-1-16
SELECT   decode(MOD(e.empno,e.sal),instr(e.ename, 'S'),100,99)   FROM   emp e;
ERROR 42000: Incorrect parameter count in the call to native function 'decode'
instr-5-1-17
select cast(instr(e.ename, 'S') as varchar(10)) as eee    from emp e   ORDER  BY   eee;
ERROR 42000: You have an error in your SQL syntax; check the manual that corresponds to your OceanBase version for the right syntax to use near 'varchar(10)) as eee    from emp e   ORDER  BY   eee' at line 1
instr-5-2
SELECT     hex(CONCAT(CHAR(instr(e.ename, 'S')),CHAR(e.empno)))  eee    from emp e   ORDER  BY   eee;
eee
011CC9
011CCA
011CCB
011CCC
011CCD
011CCE
011CCF
011CD0
011CD1
011CD2
011CD3
instr-6-1-1
SELECT   MOD(e.empno,e.sal)+instr(e.ename, 'S') eee    from emp e   ORDER  BY   eee;
eee
73
122
170
171
174
175
176
178
179
377
380
instr-6-1-2
SELECT   MOD(e.empno,e.sal)-instr(e.ename, 'S')    eee    from emp e   ORDER  BY   eee;
eee
71
120
168
169
172
173
174
176
177
375
378
instr-6-1-3
SELECT   MOD(e.empno,e.sal)*instr(e.ename, 'S')    eee    from emp e   ORDER  BY   eee;
eee
72
121
169
170
173
174
175
177
178
376
379
instr-6-1-4
SELECT   MOD(e.empno,e.sal)/instr(e.ename, 'S')    eee    from emp e   ORDER  BY   eee;
eee
72.0000
121.0000
169.0000
170.0000
173.0000
174.0000
175.0000
177.0000
178.0000
376.0000
379.0000
instr-6-2-1
SELECT   *    FROM   emp e  WHERE  MOD(e.empno,e.sal) NOT IN(SELECT instr(e.ename, 'S')    FROM emp)   ORDER BY empno;
empno	ename	job	mgr	hiredate	sal	comm	deptno	tno
7369	SMITH001	CLERK001	7902	7980-12-07	800	NULL	20	1
7370	SMITH002	CLERK002	7902	7980-12-07	900	15	10	2
7371	SMITH003	CLERK003	7902	7980-12-07	250	25	50	3
7372	SMITH004	CLERK004	7902	7980-12-07	100	35	30	4
7373	SMITH005	CLERK005	7902	7980-12-07	200	45	80	5
7374	SMITH006	CLERK002	7902	7980-12-07	300	55	10	6
7375	SMITH007	CLERK003	7902	7980-12-07	400	65	20	7
7376	SMITH008	CLERK006	7902	7980-12-07	500	NULL	20	8
7377	SMITH009	CLERK008	7902	7980-12-07	600	75	30	9
7378	SMITH010	CLERK009	7902	7980-12-07	800	95	20	10
7379	SMITH011	CLERK003	7902	7980-12-07	700	NULL	20	11
instr-6-2-2
SELECT   *    FROM   emp e  WHERE  MOD(e.empno,e.sal)<sal  AND  instr(e.ename, 'S') >tno  ORDER BY empno;
empno	ename	job	mgr	hiredate	sal	comm	deptno	tno
instr-6-2-3    
SELECT   *    FROM   emp e  WHERE  MOD(e.empno,e.sal)<sal  or  instr(e.ename, 'S') >tno  ORDER BY empno;
empno	ename	job	mgr	hiredate	sal	comm	deptno	tno
7369	SMITH001	CLERK001	7902	7980-12-07	800	NULL	20	1
7370	SMITH002	CLERK002	7902	7980-12-07	900	15	10	2
7371	SMITH003	CLERK003	7902	7980-12-07	250	25	50	3
7372	SMITH004	CLERK004	7902	7980-12-07	100	35	30	4
7373	SMITH005	CLERK005	7902	7980-12-07	200	45	80	5
7374	SMITH006	CLERK002	7902	7980-12-07	300	55	10	6
7375	SMITH007	CLERK003	7902	7980-12-07	400	65	20	7
7376	SMITH008	CLERK006	7902	7980-12-07	500	NULL	20	8
7377	SMITH009	CLERK008	7902	7980-12-07	600	75	30	9
7378	SMITH010	CLERK009	7902	7980-12-07	800	95	20	10
7379	SMITH011	CLERK003	7902	7980-12-07	700	NULL	20	11
instr-6-3-1
SELECT   *   FROM   emp e   WHERE   e.sal =instr(e.ename, 'S')    ORDER BY e.EMPNO,e.sal;
empno	ename	job	mgr	hiredate	sal	comm	deptno	tno
instr-6-3-2
SELECT   *   FROM   emp e   WHERE   e.sal >= instr(e.ename, 'S')   ORDER BY e.EMPNO,e.sal;
empno	ename	job	mgr	hiredate	sal	comm	deptno	tno
7369	SMITH001	CLERK001	7902	7980-12-07	800	NULL	20	1
7370	SMITH002	CLERK002	7902	7980-12-07	900	15	10	2
7371	SMITH003	CLERK003	7902	7980-12-07	250	25	50	3
7372	SMITH004	CLERK004	7902	7980-12-07	100	35	30	4
7373	SMITH005	CLERK005	7902	7980-12-07	200	45	80	5
7374	SMITH006	CLERK002	7902	7980-12-07	300	55	10	6
7375	SMITH007	CLERK003	7902	7980-12-07	400	65	20	7
7376	SMITH008	CLERK006	7902	7980-12-07	500	NULL	20	8
7377	SMITH009	CLERK008	7902	7980-12-07	600	75	30	9
7378	SMITH010	CLERK009	7902	7980-12-07	800	95	20	10
7379	SMITH011	CLERK003	7902	7980-12-07	700	NULL	20	11
instr-6-3-3
SELECT   *   FROM   emp e   WHERE   e.sal < instr(e.ename, 'S')     ORDER BY e.EMPNO,e.sal;
empno	ename	job	mgr	hiredate	sal	comm	deptno	tno
instr-6-3-4
SELECT   *   FROM   emp e   WHERE   e.sal <= instr(e.ename, 'S')    ORDER BY e.EMPNO,e.sal;
empno	ename	job	mgr	hiredate	sal	comm	deptno	tno
instr-6-3-5
SELECT   *   FROM   emp e   WHERE   e.sal != instr(e.ename, 'S')    ORDER BY e.EMPNO,e.sal;
empno	ename	job	mgr	hiredate	sal	comm	deptno	tno
7369	SMITH001	CLERK001	7902	7980-12-07	800	NULL	20	1
7370	SMITH002	CLERK002	7902	7980-12-07	900	15	10	2
7371	SMITH003	CLERK003	7902	7980-12-07	250	25	50	3
7372	SMITH004	CLERK004	7902	7980-12-07	100	35	30	4
7373	SMITH005	CLERK005	7902	7980-12-07	200	45	80	5
7374	SMITH006	CLERK002	7902	7980-12-07	300	55	10	6
7375	SMITH007	CLERK003	7902	7980-12-07	400	65	20	7
7376	SMITH008	CLERK006	7902	7980-12-07	500	NULL	20	8
7377	SMITH009	CLERK008	7902	7980-12-07	600	75	30	9
7378	SMITH010	CLERK009	7902	7980-12-07	800	95	20	10
7379	SMITH011	CLERK003	7902	7980-12-07	700	NULL	20	11
instr-6-3-6
SELECT   *   FROM   emp e   WHERE   e.sal <> instr(e.ename, 'S')    ORDER BY e.EMPNO,e.sal;
empno	ename	job	mgr	hiredate	sal	comm	deptno	tno
7369	SMITH001	CLERK001	7902	7980-12-07	800	NULL	20	1
7370	SMITH002	CLERK002	7902	7980-12-07	900	15	10	2
7371	SMITH003	CLERK003	7902	7980-12-07	250	25	50	3
7372	SMITH004	CLERK004	7902	7980-12-07	100	35	30	4
7373	SMITH005	CLERK005	7902	7980-12-07	200	45	80	5
7374	SMITH006	CLERK002	7902	7980-12-07	300	55	10	6
7375	SMITH007	CLERK003	7902	7980-12-07	400	65	20	7
7376	SMITH008	CLERK006	7902	7980-12-07	500	NULL	20	8
7377	SMITH009	CLERK008	7902	7980-12-07	600	75	30	9
7378	SMITH010	CLERK009	7902	7980-12-07	800	95	20	10
7379	SMITH011	CLERK003	7902	7980-12-07	700	NULL	20	11
drop   table  if  exists   emp;
create   TABLE   EMP (empno int,ename VARCHAR(10),job VARCHAR(9),mgr int,hiredate DATE,
sal FLOAT(7,0),comm FLOAT(7,0),deptno int,tno int);
instr-7-1-1  无参数的存储过程
drop procedure if exists myproc1;
create procedure myproc1()
begin
insert into EMP (empno, ename, job, mgr, hiredate, sal, comm, deptno,tno)values (7369, 'SMITH001', 'CLERK001', 7902, '7980-12-07',  800, null, instr('helloworld','l'),1);
insert into EMP (empno, ename, job, mgr, hiredate, sal, comm, deptno,tno)values (7370, 'SMITH002', 'CLERK002', 7902, '7980-12-07',  900, 15, instr('helloworld','o'),2);
insert into EMP (empno, ename, job, mgr, hiredate, sal, comm, deptno,tno)values (7371, 'SMITH003', 'CLERK003', 7902, '7980-12-07',  250, 25, instr('helloworld','w'),3);
insert into EMP (empno, ename, job, mgr, hiredate, sal, comm, deptno,tno)values (7372, 'SMITH004', 'CLERK004', 7902, '7980-12-07',  100, 35, instr('helloworld','d'),4);
insert into EMP (empno, ename, job, mgr, hiredate, sal, comm, deptno,tno)values (7373, 'SMITH005', 'CLERK005', 7902, '7980-12-07',  200, 45, instr('helloworld','e'),5);
end 
//
call myproc1();
select  *  from   emp e order by  e.empno;
empno	ename	job	mgr	hiredate	sal	comm	deptno	tno
7369	SMITH001	CLERK001	7902	7980-12-07	800	NULL	3	1
7370	SMITH002	CLERK002	7902	7980-12-07	900	15	5	2
7371	SMITH003	CLERK003	7902	7980-12-07	250	25	6	3
7372	SMITH004	CLERK004	7902	7980-12-07	100	35	10	4
7373	SMITH005	CLERK005	7902	7980-12-07	200	45	2	5
instr-7-1-2    只有一个 in 参数的存储过程 
drop procedure if exists myproc2;
create procedure myproc2(in userId int)
begin
SELECT    substr(e.ename,userId/10, instr(e.ename, 'S'))      FROM emp  e;
end
//
set @dum =10;
call myproc2(@dum);
substr(e.ename,userId/10, instr(e.ename, 'S'))
S
S
S
S
S
SELECT    substr(e.ename,@dum/10, instr(e.ename, 'S'))      FROM emp  e;
substr(e.ename,@dum/10, instr(e.ename, 'S'))
S
S
S
S
S
instr-7-1-3    :包含 in 参数和 out 参数的存储过程,只能将一行的查询到的用户名赋值给username 
drop procedure if exists myproc3;
create procedure myproc3(in userId int, out username varchar(20))
begin
set username= userId;	
SELECT *  FROM emp d where  d.DEPTNO> username;		
end
//
--  调用时，传入查询的userid 和 全局变量 @username
call myproc3(instr('helloworld','l'),@username);
empno	ename	job	mgr	hiredate	sal	comm	deptno	tno
7370	SMITH002	CLERK002	7902	7980-12-07	900	15	5	2
7371	SMITH003	CLERK003	7902	7980-12-07	250	25	6	3
7372	SMITH004	CLERK004	7902	7980-12-07	100	35	10	4
select  *  from   emp e order by  e.empno;
empno	ename	job	mgr	hiredate	sal	comm	deptno	tno
7369	SMITH001	CLERK001	7902	7980-12-07	800	NULL	3	1
7370	SMITH002	CLERK002	7902	7980-12-07	900	15	5	2
7371	SMITH003	CLERK003	7902	7980-12-07	250	25	6	3
7372	SMITH004	CLERK004	7902	7980-12-07	100	35	10	4
7373	SMITH005	CLERK005	7902	7980-12-07	200	45	2	5
instr-7-1-4     包含 inout 参数的存储过程
drop procedure if exists myproc4;
create procedure myproc4(inout a char(10))
begin
SELECT     instr(a,'l')     FROM emp  e;	
end//
--  用户变量 （全局的变量）作用域： 用户变量: 在当前连接（即当前会话）中都有效
set @num ='helloworld';
call  myproc4(@num);
instr(a,'l')
3
3
3
3
3
SELECT     instr(@num,'l')     FROM emp  e;
instr(@num,'l')
3
3
3
3
3
instr-7-2-1 无参数的自定义函数
drop function  IF EXISTS salemp001;
CREATE FUNCTION salemp001(saller001 int) RETURNS DOUBLE
BEGIN
DECLARE ag DOUBLE DEFAULT 0;#定义局部变量并初始化
SELECT  sum(instr('helloworld','l'))  INTO ag #为局部变量赋值
FROM emp e INNER JOIN dept d ON e.DEPTNO=d.DEPTNO where  e.sal >saller001 GROUP BY d.DEPTNO having d.DEPTNO>1;
RETURN ag;
end//
SELECT salemp001(100);
salemp001(100)
0
instr-7-2-2  自定义函数  有参数
drop function  IF EXISTS salemp001;
CREATE FUNCTION salemp001(saller001 int) RETURNS DOUBLE
BEGIN
DECLARE ag DOUBLE DEFAULT 0;#定义局部变量并初始化
SELECT   sum(instr('helloworld','l')) INTO ag #为局部变量赋值
FROM emp e INNER JOIN dept d ON e.DEPTNO=d.DEPTNO where  e.sal >saller001 GROUP BY d.DEPTNO having d.DEPTNO>10;
RETURN ag;
end//
SELECT salemp001(100);
salemp001(100)
0
instr-7-2-3   自定义函数使用循环 
drop function  IF EXISTS salemp001;
CREATE FUNCTION salemp001(saller001 int) RETURNS DOUBLE
BEGIN
DECLARE ag DOUBLE DEFAULT 0;
DECLARE i INT DEFAULT 1;
WHILE i<=1000 DO
insert into EMP (empno, ename, job, mgr, hiredate, sal, comm, deptno,tno)values (saller001+i*10, 'SMITH001', 'CLERK001', 7902, '7980-12-07',  800, null, instr('helloworld','l'),1);
SET i = i+1;
END WHILE;
SELECT  count(*)  into  ag   from   EMP;
RETURN ag;
end
//
SELECT salemp001(100);
salemp001(100)
1005
drop database  IF EXISTS  ob100x;
