mysql_json_table-4
DROP TABLE json_test1;
CREATE TABLE json_test1(
c1 DECIMAL(38,0), 
c2 VARCHAR(100) ,
c3 json not null,
c4 json,
c5 VARCHAR(100));
insert into json_test1 values(1,12,'12','"2022-10-10"',null);
insert into json_test1 values(2,'{"a":[1,2]}','12','"2022-10-10"','123.12');
insert into json_test1 values(3,'"a"','"123"',null,'"sadf"');
insert into json_test1 values(4,'[1,"asdfasd1",{"a":12321564654},{"a":[1,2]},[]]','[1,2,{},{"a":[1,2]},[]]',null,'[1,"a",[],{}]');
insert into json_test1 values(5,'{"a":[1,2]}','[1,"asdfasd1",{"a":12321564654},{"a":[1,2]},[]]',null,'{"a":[1,2]}');
insert into json_test1 values(6,'true','true',null,'false');
insert into json_test1 values(7,'[]','{}',null,'false');
DROP TABLE json_test2;
CREATE TABLE json_test2(
c1 DECIMAL(38,0), 
c2 VARCHAR(100) ,
c3 json not null,
c4 json,
c5 BLOB);
insert into json_test2 values(1,12,'12','"2022-10-10"',null);
insert into json_test2 values(2,'{"a":[1,2]}','12','"2022-10-10"','123.12');
insert into json_test2 values(3,'"a"','"123"',null,'"sadf"');
insert into json_test2 values(4,'[1,"asdfasd1",{"a":12321564654},{"a":[1,2]},[]]','[1,2,{},{"a":[1,2]},[]]',null,'[1,"a",[],{}]');
insert into json_test2 values(5,'{"a":[1,2]}','[1,"asdfasd1",{"a":12321564654},{"a":[1,2]},[]]',null,'{"a":[1,2]}');
insert into json_test2 values(6,'true','true',null,'false');
insert into json_test2 values(7,'[]','{}',null,'false');
mysql_json_table-4-4 select group by cte
select avg(t.a) from json_test1 t1 INNER JOIN JSON_TABLE(t1.c3,'$[*]' COLUMNS(a FOR ORDINALITY ,
b VARCHAR(200) PATH "$.b[1]" default '0' ON EMPTY default '1' ON ERROR,
c VARCHAR(200) EXISTS PATH '$.b[1]')) as t  on t1.c1 = t.a
;
avg(t.a)
4.5000
SELECT max(t.a2 ) FROM json_test1 t1, JSON_TABLE(t1.c3, '$' 
COLUMNS ( a FOR ORDINALITY ,
a1 json PATH '$.MailID' DEFAULT '10000' ON EMPTY DEFAULT '20000' ON ERROR,
a2 json PATH '$' DEFAULT '110000' ON EMPTY DEFAULT '220000' ON ERROR,
a3 VARCHAR(200) EXISTS PATH '$[1]',
a4 json PATH '$[*]')) AS t  
group by t.a2,t.a3,t1.c3
having t.a2 > 0 and t.a2 like '%1%'
order by t.a3;
max(t.a2 )
12
"123"
[1, 2, {}, {"a": [1, 2]}, []]
[1, "asdfasd1", {"a": 12321564654}, {"a": [1, 2]}, []]
SELECT max(t.a2 ) FROM json_test1 t1, JSON_TABLE('[1,"aaaa汉",true,null,[1,"aaaa汉",true,null],{"a": true, "b": [null,"汉字"]}]', '$[*]' 
COLUMNS ( a2 json PATH '$' DEFAULT '110000' ON EMPTY DEFAULT '220000' ON ERROR)) AS t  
group by t.a2;
max(t.a2 )
1
"aaaa汉"
true
NULL
[1, "aaaa汉", true, null]
{"a": true, "b": [null, "汉字"]}
WITH json_cte AS (
SELECT t1.c1,t.* FROM json_test1 t1, JSON_TABLE(t1.c3, '$' 
COLUMNS ( a FOR ORDINALITY ,
a1 json PATH '$[0]' DEFAULT '10000' ON EMPTY DEFAULT '20000' ON ERROR,
a2 json PATH '$[0]' DEFAULT '110000' ON EMPTY DEFAULT '220000' ON ERROR,
a3 VARCHAR(200) EXISTS PATH '$[1]',
a4 json PATH '$[0]')) AS t
) SELECT tt.* from json_cte t1,JSON_TABLE(t1.a1, '$' 
COLUMNS ( a FOR ORDINALITY ,
a1 json PATH '$[0]' DEFAULT '10000' ON EMPTY DEFAULT '20000' ON ERROR,
a2 json PATH '$[0]' DEFAULT '110000' ON EMPTY DEFAULT '220000' ON ERROR,
a3 VARCHAR(200) EXISTS PATH '$[1]',
a4 json PATH '$[0]')) AS tt;
a	a1	a2	a3	a4
1	12	12	0	12
1	12	12	0	12
1	"123"	"123"	0	"123"
1	1	1	0	1
1	1	1	0	1
1	true	true	0	true
1	{}	{}	0	{}
WITH json_cte AS (
SELECT t1.* FROM json_test1 t1
) SELECT tt.* from json_cte t1,JSON_TABLE('[1,"aaaa汉",true,null,[1,"aaaa汉",true,null],{"a": true, "b": [null,"汉字"]}]', '$[*]' 
COLUMNS ( a FOR ORDINALITY ,
a1 json PATH '$[0]' DEFAULT '10000' ON EMPTY DEFAULT '20000' ON ERROR,
a2 json PATH '$[0]' DEFAULT '110000' ON EMPTY DEFAULT '220000' ON ERROR,
a3 VARCHAR(200) EXISTS PATH '$[1]',
a4 json PATH '$[0]')) AS tt order by tt.a;
a	a1	a2	a3	a4
1	1	1	0	1
1	1	1	0	1
1	1	1	0	1
1	1	1	0	1
1	1	1	0	1
1	1	1	0	1
1	1	1	0	1
2	"aaaa汉"	"aaaa汉"	0	"aaaa汉"
2	"aaaa汉"	"aaaa汉"	0	"aaaa汉"
2	"aaaa汉"	"aaaa汉"	0	"aaaa汉"
2	"aaaa汉"	"aaaa汉"	0	"aaaa汉"
2	"aaaa汉"	"aaaa汉"	0	"aaaa汉"
2	"aaaa汉"	"aaaa汉"	0	"aaaa汉"
2	"aaaa汉"	"aaaa汉"	0	"aaaa汉"
3	true	true	0	true
3	true	true	0	true
3	true	true	0	true
3	true	true	0	true
3	true	true	0	true
3	true	true	0	true
3	true	true	0	true
4	NULL	NULL	0	NULL
4	NULL	NULL	0	NULL
4	NULL	NULL	0	NULL
4	NULL	NULL	0	NULL
4	NULL	NULL	0	NULL
4	NULL	NULL	0	NULL
4	NULL	NULL	0	NULL
5	1	1	1	1
5	1	1	1	1
5	1	1	1	1
5	1	1	1	1
5	1	1	1	1
5	1	1	1	1
5	1	1	1	1
6	{"a": true, "b": [null, "汉字"]}	{"a": true, "b": [null, "汉字"]}	0	{"a": true, "b": [null, "汉字"]}
6	{"a": true, "b": [null, "汉字"]}	{"a": true, "b": [null, "汉字"]}	0	{"a": true, "b": [null, "汉字"]}
6	{"a": true, "b": [null, "汉字"]}	{"a": true, "b": [null, "汉字"]}	0	{"a": true, "b": [null, "汉字"]}
6	{"a": true, "b": [null, "汉字"]}	{"a": true, "b": [null, "汉字"]}	0	{"a": true, "b": [null, "汉字"]}
6	{"a": true, "b": [null, "汉字"]}	{"a": true, "b": [null, "汉字"]}	0	{"a": true, "b": [null, "汉字"]}
6	{"a": true, "b": [null, "汉字"]}	{"a": true, "b": [null, "汉字"]}	0	{"a": true, "b": [null, "汉字"]}
6	{"a": true, "b": [null, "汉字"]}	{"a": true, "b": [null, "汉字"]}	0	{"a": true, "b": [null, "汉字"]}
mysql_json_table-4-1 dml insert
insert into json_test1 select t.* from JSON_TABLE('[1,"aaaa汉",true,null,[1,"aaaa汉",true,null],{"a": true, "b": [null,"汉字"]}]',"$[*]" COLUMNS(a1 FOR ORDINALITY,
a2 varchar(100) PATH '$[1]' default '0' ON EMPTY default '1' ON ERROR,
a3 varchar(100) PATH '$[2]' default '0' ON EMPTY default '1' ON ERROR,
a4 varchar(100) PATH '$[2]' default '0' ON EMPTY default '1' ON ERROR,
a5 varchar(100) PATH '$[0]')) as t;
select * from json_test1;
c1	c2	c3	c4	c5
1	12	12	"2022-10-10"	NULL
2	{"a":[1,2]}	12	"2022-10-10"	123.12
3	"a"	"123"	NULL	"sadf"
4	[1,"asdfasd1",{"a":12321564654},{"a":[1,2]},[]]	[1, 2, {}, {"a": [1, 2]}, []]	NULL	[1,"a",[],{}]
5	{"a":[1,2]}	[1, "asdfasd1", {"a": 12321564654}, {"a": [1, 2]}, []]	NULL	{"a":[1,2]}
6	true	true	NULL	false
7	[]	{}	NULL	false
1	0	0	0	1
2	0	0	0	aaaa汉
3	0	0	0	true
4	0	0	0	NULL
5	aaaa汉	true	true	1
6	0	0	0	NULL
insert into json_test1(c1,c3,c5) select t.* from json_test1 ,JSON_TABLE(json_test1.c3,"$[*]" COLUMNS(a1 FOR ORDINALITY,
a3 varchar(100) PATH '$[2]' default '0' ON EMPTY default '1' ON ERROR,
a5 varchar(100) PATH '$[0]')) as t;
select * from json_test1;
c1	c2	c3	c4	c5
1	12	12	"2022-10-10"	NULL
2	{"a":[1,2]}	12	"2022-10-10"	123.12
3	"a"	"123"	NULL	"sadf"
4	[1,"asdfasd1",{"a":12321564654},{"a":[1,2]},[]]	[1, 2, {}, {"a": [1, 2]}, []]	NULL	[1,"a",[],{}]
5	{"a":[1,2]}	[1, "asdfasd1", {"a": 12321564654}, {"a": [1, 2]}, []]	NULL	{"a":[1,2]}
6	true	true	NULL	false
7	[]	{}	NULL	false
1	0	0	0	1
2	0	0	0	aaaa汉
3	0	0	0	true
4	0	0	0	NULL
5	aaaa汉	true	true	1
6	0	0	0	NULL
1	NULL	0	NULL	1
2	NULL	0	NULL	2
3	NULL	0	NULL	NULL
4	NULL	0	NULL	NULL
5	NULL	0	NULL	NULL
1	NULL	0	NULL	1
2	NULL	0	NULL	asdfasd1
3	NULL	0	NULL	NULL
4	NULL	0	NULL	NULL
5	NULL	0	NULL	NULL
delete from json_test1;
insert into json_test1 select t.a1,t.a2,t.a3,t.a4,t.a1 from json_test2 t2,JSON_TABLE(t2.c3,"$[*]" COLUMNS(
a2 varchar(100) PATH '$[1]' default '0' ON EMPTY default '1' ON ERROR,
a3 varchar(100) PATH '$[2]' default '0' ON EMPTY default '1' ON ERROR,
a4 varchar(100) PATH '$[2]' default '0' ON EMPTY default '1' ON ERROR,
a5 varchar(100) PATH '$[0]' ,
a1 FOR ORDINALITY)) as t;
select * from json_test1;
c1	c2	c3	c4	c5
1	0	0	0	1
2	0	0	0	2
3	0	0	0	3
4	0	0	0	4
5	0	0	0	5
1	0	0	0	1
2	0	0	0	2
3	0	0	0	3
4	0	0	0	4
5	0	0	0	5
DROP TABLE json_test3;
CREATE TABLE json_test3(
c1 bool, 
c2 DECIMAL(38,2),
c3 DATETIME,
c4 TIMESTAMP,
c5 VARCHAR(200),
c6 BINARY(100),
c7 BLOB,
c8 TEXT,
c9 json);
insert into json_test3(c1) select t.a1 from JSON_TABLE('[1,"aaaa汉",true,null,[1,"aaaa汉",true,null],{"a": true, "b": [null,"汉字"]}]',"$[*]" COLUMNS(a1 FOR ORDINALITY)) as t;
insert into json_test3(c2) select t.a1 from JSON_TABLE('[1,"aaaa汉",true,null,[1,"aaaa汉",true,null],{"a": true, "b": [null,"汉字"]}]',"$[*]" 
COLUMNS(a1 DECIMAL(38,2) PATH '$[0]' default '10' ON EMPTY default '21' ON ERROR)) as t;
insert into json_test3(c3) select t.a1 from JSON_TABLE('[77771231235959,"7777-12-31 23:59:59",true,null,[1,"aaaa汉",true,null],{"a": true, "b": [null,"汉字"]}]',"$[*]" 
COLUMNS(a1 DATETIME PATH '$[0]' DEFAULT '"8888-12-31 23:59:59"' ON EMPTY DEFAULT '"9999-12-31 23:59:59"' ON ERROR)) as t;
select * from json_test3;
c1	c2	c3	c4	c5	c6	c7	c8	c9
1	NULL	NULL	NULL	NULL	NULL	NULL	NULL	NULL
2	NULL	NULL	NULL	NULL	NULL	NULL	NULL	NULL
3	NULL	NULL	NULL	NULL	NULL	NULL	NULL	NULL
4	NULL	NULL	NULL	NULL	NULL	NULL	NULL	NULL
5	NULL	NULL	NULL	NULL	NULL	NULL	NULL	NULL
6	NULL	NULL	NULL	NULL	NULL	NULL	NULL	NULL
NULL	1.00	NULL	NULL	NULL	NULL	NULL	NULL	NULL
NULL	21.00	NULL	NULL	NULL	NULL	NULL	NULL	NULL
NULL	1.00	NULL	NULL	NULL	NULL	NULL	NULL	NULL
NULL	NULL	NULL	NULL	NULL	NULL	NULL	NULL	NULL
NULL	1.00	NULL	NULL	NULL	NULL	NULL	NULL	NULL
NULL	21.00	NULL	NULL	NULL	NULL	NULL	NULL	NULL
NULL	NULL	7777-12-31 23:59:59	NULL	NULL	NULL	NULL	NULL	NULL
NULL	NULL	7777-12-31 23:59:59	NULL	NULL	NULL	NULL	NULL	NULL
NULL	NULL	9999-12-31 23:59:59	NULL	NULL	NULL	NULL	NULL	NULL
NULL	NULL	NULL	NULL	NULL	NULL	NULL	NULL	NULL
NULL	NULL	9999-12-31 23:59:59	NULL	NULL	NULL	NULL	NULL	NULL
NULL	NULL	9999-12-31 23:59:59	NULL	NULL	NULL	NULL	NULL	NULL
insert into json_test3(c5) select t.a1 from JSON_TABLE('[1,"aaaa汉",true,null,[1,"aaaa汉",true,null],{"a": true, "b": [null,"汉字"]}]',"$[*]" 
COLUMNS(a1 VARCHAR(200) PATH '$[0]' DEFAULT '"空"' ON EMPTY DEFAULT '"错"' ON ERROR)) as t;
insert into json_test3(c6) select t.a1 from JSON_TABLE('[1,"aaaa汉",true,null,[1,"aaaa汉",true,null],{"a": true, "b": [null,"汉字"]}]',"$[*]" 
COLUMNS(a1 BINARY(50) PATH '$[0]' DEFAULT '2' ON EMPTY DEFAULT '0' ON ERROR)) as t;
select * from json_test3;
c1	c2	c3	c4	c5	c6	c7	c8	c9
1	NULL	NULL	NULL	NULL	NULL	NULL	NULL	NULL
2	NULL	NULL	NULL	NULL	NULL	NULL	NULL	NULL
3	NULL	NULL	NULL	NULL	NULL	NULL	NULL	NULL
4	NULL	NULL	NULL	NULL	NULL	NULL	NULL	NULL
5	NULL	NULL	NULL	NULL	NULL	NULL	NULL	NULL
6	NULL	NULL	NULL	NULL	NULL	NULL	NULL	NULL
NULL	1.00	NULL	NULL	NULL	NULL	NULL	NULL	NULL
NULL	21.00	NULL	NULL	NULL	NULL	NULL	NULL	NULL
NULL	1.00	NULL	NULL	NULL	NULL	NULL	NULL	NULL
NULL	NULL	NULL	NULL	NULL	NULL	NULL	NULL	NULL
NULL	1.00	NULL	NULL	NULL	NULL	NULL	NULL	NULL
NULL	21.00	NULL	NULL	NULL	NULL	NULL	NULL	NULL
NULL	NULL	7777-12-31 23:59:59	NULL	NULL	NULL	NULL	NULL	NULL
NULL	NULL	7777-12-31 23:59:59	NULL	NULL	NULL	NULL	NULL	NULL
NULL	NULL	9999-12-31 23:59:59	NULL	NULL	NULL	NULL	NULL	NULL
NULL	NULL	NULL	NULL	NULL	NULL	NULL	NULL	NULL
NULL	NULL	9999-12-31 23:59:59	NULL	NULL	NULL	NULL	NULL	NULL
NULL	NULL	9999-12-31 23:59:59	NULL	NULL	NULL	NULL	NULL	NULL
NULL	NULL	NULL	NULL	1	NULL	NULL	NULL	NULL
NULL	NULL	NULL	NULL	aaaa汉	NULL	NULL	NULL	NULL
NULL	NULL	NULL	NULL	true	NULL	NULL	NULL	NULL
NULL	NULL	NULL	NULL	NULL	NULL	NULL	NULL	NULL
NULL	NULL	NULL	NULL	1	NULL	NULL	NULL	NULL
NULL	NULL	NULL	NULL	错	NULL	NULL	NULL	NULL
NULL	NULL	NULL	NULL	NULL	1                                                                                                   	NULL	NULL	NULL
NULL	NULL	NULL	NULL	NULL	aaaa汉                                                                                             	NULL	NULL	NULL
NULL	NULL	NULL	NULL	NULL	true                                                                                                	NULL	NULL	NULL
NULL	NULL	NULL	NULL	NULL	NULL	NULL	NULL	NULL
NULL	NULL	NULL	NULL	NULL	1                                                                                                   	NULL	NULL	NULL
NULL	NULL	NULL	NULL	NULL	0                                                                                                   	NULL	NULL	NULL
delete from json_test3;
insert into json_test3(c7) select t.a1 from JSON_TABLE('[1,"aaaa汉",true,null,[1,"aaaa汉",true,null],{"a": true, "b": [null,"汉字"]}]',"$[*]" 
COLUMNS(a1 BLOB PATH '$[0]' DEFAULT '2' ON EMPTY DEFAULT '0' ON ERROR)) as t;
insert into json_test3(c9) select t.a1 from JSON_TABLE('[1,"aaaa汉",true,null,[1,"aaaa汉",true,null],{"a": true, "b": [null,"汉字"]}]',"$[*]" 
COLUMNS(a1 json PATH '$[0]' DEFAULT '2' ON EMPTY DEFAULT '0' ON ERROR)) as t;
insert into json_test3(c5) select t.a1 from JSON_TABLE('[1,"aaaa汉",true,null,[1,"aaaa汉",true,null],{"a": true, "b": [null,"汉字"]}]',"$[*]" 
COLUMNS(a1 json PATH '$[0]' DEFAULT '2' ON EMPTY DEFAULT '0' ON ERROR)) as t;
select * from json_test3;
c1	c2	c3	c4	c5	c6	c7	c8	c9
NULL	NULL	NULL	NULL	NULL	NULL	1	NULL	NULL
NULL	NULL	NULL	NULL	NULL	NULL	aaaa汉	NULL	NULL
NULL	NULL	NULL	NULL	NULL	NULL	true	NULL	NULL
NULL	NULL	NULL	NULL	NULL	NULL	NULL	NULL	NULL
NULL	NULL	NULL	NULL	NULL	NULL	1	NULL	NULL
NULL	NULL	NULL	NULL	NULL	NULL	0	NULL	NULL
NULL	NULL	NULL	NULL	NULL	NULL	NULL	NULL	1
NULL	NULL	NULL	NULL	NULL	NULL	NULL	NULL	"aaaa汉"
NULL	NULL	NULL	NULL	NULL	NULL	NULL	NULL	true
NULL	NULL	NULL	NULL	NULL	NULL	NULL	NULL	NULL
NULL	NULL	NULL	NULL	NULL	NULL	NULL	NULL	1
NULL	NULL	NULL	NULL	NULL	NULL	NULL	NULL	{"a": true, "b": [null, "汉字"]}
NULL	NULL	NULL	NULL	1	NULL	NULL	NULL	NULL
NULL	NULL	NULL	NULL	"aaaa汉"	NULL	NULL	NULL	NULL
NULL	NULL	NULL	NULL	true	NULL	NULL	NULL	NULL
NULL	NULL	NULL	NULL	NULL	NULL	NULL	NULL	NULL
NULL	NULL	NULL	NULL	1	NULL	NULL	NULL	NULL
NULL	NULL	NULL	NULL	{"a": true, "b": [null, "汉字"]}	NULL	NULL	NULL	NULL
delete from json_test3;
insert into json_test3(c9) select t.a1 from JSON_TABLE('[1,[1,"aaaa汉",true,null],{"a": true, "b": [null,"汉字"]}]',"$[*]" 
COLUMNS(a1 int EXISTS PATH '$.b[1]')) as t;
ERROR 22032: Invalid JSON text.
insert into json_test3(c9) select t.a1 from JSON_TABLE('[1,[1,"aaaa汉",true,null],{"a": true, "b": [null,"汉字"]}]',"$[*]" 
COLUMNS(a1 DECIMAL(38,2) EXISTS PATH '$.b[1]')) as t;
ERROR 22032: Invalid JSON text.
insert into json_test3(c9) select t.a1 from JSON_TABLE('[1,[1,"aaaa汉",true,null],{"a": true, "b": [null,"汉字"]}]',"$[*]" 
COLUMNS(a1 VARCHAR(200) EXISTS PATH '$.b[1]')) as t;
insert into json_test3(c9) select t.a1 from JSON_TABLE('[1,[1,"aaaa汉",true,null],{"a": true, "b": [null,"汉字"]}]',"$[*]" 
COLUMNS(a1 TEXT EXISTS PATH '$.b[1]')) as t;
select * from json_test3;
c1	c2	c3	c4	c5	c6	c7	c8	c9
NULL	NULL	NULL	NULL	NULL	NULL	NULL	NULL	0
NULL	NULL	NULL	NULL	NULL	NULL	NULL	NULL	0
NULL	NULL	NULL	NULL	NULL	NULL	NULL	NULL	1
NULL	NULL	NULL	NULL	NULL	NULL	NULL	NULL	0
NULL	NULL	NULL	NULL	NULL	NULL	NULL	NULL	0
NULL	NULL	NULL	NULL	NULL	NULL	NULL	NULL	1
delete from json_test3;
mysql_json_table-4-2 dml update
DROP TABLE json_test1;
CREATE TABLE json_test1(
c1 DECIMAL(38,0), 
c2 VARCHAR(100) ,
c3 json not null,
c4 json,
c5 VARCHAR(100));
insert into json_test1 values(1,12,'12','"2022-10-10"',null);
insert into json_test1 values(2,'{"a":[1,2]}','12','"2022-10-10"','123.12');
insert into json_test1 values(3,'"a"','[{"MailID":2,"AttachFlag":"8"},{"MailID":3,"AttachFlag":"9"}]',null,'"sadf"');
insert into json_test1 values(4,'[1,"asdfasd1",{"a":12321564654},{"a":[1,2]},[]]','[1,2,{},{"a":[1,2]},[]]',null,'[1,"a",[],{}]');
insert into json_test1 values(5,'{"a":[1,2]}','[1,"asdfasd1",{"a":12321564654},{"a":[1,2]},[]]',null,'{"a":[1,2]}');
insert into json_test1 values(6,'true','true',null,'false');
insert into json_test1 values(7,'[]','[{"MailID":4,"AttachFlag":"88"},{"MailID":5,"AttachFlag":"99"}]',null,'false');
update json_test1 t1 INNER JOIN JSON_TABLE('[{"MailID":2,"AttachFlag":"8"},{"MailID":3,"AttachFlag":"9"}]','$[*]' COLUMNS(a FOR ORDINALITY ,
b VARCHAR(200) PATH "$.MailID" default '9999' ON EMPTY default '8888' ON ERROR,
c VARCHAR(200) PATH "$.AttachFlag" ,
d VARCHAR(200) EXISTS PATH '$.b[1]',
NESTED PATH "$" COLUMNS(aa FOR ORDINALITY, bb varchar(100) PATH "$" default '99999' ON EMPTY default '88888' ON ERROR,cc int EXISTS PATH '$[0]' ))) as t  on t1.c1 = t.b
set t1.c2 = t.c;
select * from json_test1;
c1	c2	c3	c4	c5
1	12	12	"2022-10-10"	NULL
2	8	12	"2022-10-10"	123.12
3	9	[{"MailID": 2, "AttachFlag": "8"}, {"MailID": 3, "AttachFlag": "9"}]	NULL	"sadf"
4	[1,"asdfasd1",{"a":12321564654},{"a":[1,2]},[]]	[1, 2, {}, {"a": [1, 2]}, []]	NULL	[1,"a",[],{}]
5	{"a":[1,2]}	[1, "asdfasd1", {"a": 12321564654}, {"a": [1, 2]}, []]	NULL	{"a":[1,2]}
6	true	true	NULL	false
7	[]	[{"MailID": 4, "AttachFlag": "88"}, {"MailID": 5, "AttachFlag": "99"}]	NULL	false
update json_test1 t1 INNER JOIN JSON_TABLE(t1.c3,'$[*]' COLUMNS(a FOR ORDINALITY ,
b VARCHAR(200) PATH "$.MailID" default '9999' ON EMPTY default '8888' ON ERROR,
c VARCHAR(200) PATH "$.AttachFlag" ,
d VARCHAR(200) EXISTS PATH '$.b[1]',
NESTED PATH "$" COLUMNS(aa FOR ORDINALITY, bb varchar(100) PATH "$" default '99999' ON EMPTY default '88888' ON ERROR,cc int EXISTS PATH '$[0]' ))) as t  on t1.c1 = t.b
set t1.c2 = t.bb;
select * from json_test1;
c1	c2	c3	c4	c5
1	12	12	"2022-10-10"	NULL
2	8	12	"2022-10-10"	123.12
3	88888	[{"MailID": 2, "AttachFlag": "8"}, {"MailID": 3, "AttachFlag": "9"}]	NULL	"sadf"
4	[1,"asdfasd1",{"a":12321564654},{"a":[1,2]},[]]	[1, 2, {}, {"a": [1, 2]}, []]	NULL	[1,"a",[],{}]
5	{"a":[1,2]}	[1, "asdfasd1", {"a": 12321564654}, {"a": [1, 2]}, []]	NULL	{"a":[1,2]}
6	true	true	NULL	false
7	[]	[{"MailID": 4, "AttachFlag": "88"}, {"MailID": 5, "AttachFlag": "99"}]	NULL	false
update json_test1 set c2 = (select t.a from json_test2 t2, JSON_TABLE(t2.c2,'$[*]' COLUMNS(a FOR ORDINALITY ,
b VARCHAR(200) PATH "$.b[1]" default '0' ON EMPTY default '1' ON ERROR,
c VARCHAR(200) EXISTS PATH '$.b[1]')) as t  where t.a = 1)
where c1 = 1;
select * from json_test1;
c1	c2	c3	c4	c5
1	1	12	"2022-10-10"	NULL
2	8	12	"2022-10-10"	123.12
3	88888	[{"MailID": 2, "AttachFlag": "8"}, {"MailID": 3, "AttachFlag": "9"}]	NULL	"sadf"
4	[1,"asdfasd1",{"a":12321564654},{"a":[1,2]},[]]	[1, 2, {}, {"a": [1, 2]}, []]	NULL	[1,"a",[],{}]
5	{"a":[1,2]}	[1, "asdfasd1", {"a": 12321564654}, {"a": [1, 2]}, []]	NULL	{"a":[1,2]}
6	true	true	NULL	false
7	[]	[{"MailID": 4, "AttachFlag": "88"}, {"MailID": 5, "AttachFlag": "99"}]	NULL	false
update json_test1 t1 INNER JOIN JSON_TABLE(t1.c3,'$[*]' COLUMNS(a FOR ORDINALITY ,
b VARCHAR(200) PATH "$.a[1]" default '0' ON EMPTY default '1' ON ERROR,
c VARCHAR(200) EXISTS PATH '$.b[1]')) as t  on t1.c1 = t.a
set t1.c2 = t.b;
select * from json_test1;
c1	c2	c3	c4	c5
1	1	12	"2022-10-10"	NULL
2	8	12	"2022-10-10"	123.12
3	88888	[{"MailID": 2, "AttachFlag": "8"}, {"MailID": 3, "AttachFlag": "9"}]	NULL	"sadf"
4	2	[1, 2, {}, {"a": [1, 2]}, []]	NULL	[1,"a",[],{}]
5	0	[1, "asdfasd1", {"a": 12321564654}, {"a": [1, 2]}, []]	NULL	{"a":[1,2]}
6	true	true	NULL	false
7	[]	[{"MailID": 4, "AttachFlag": "88"}, {"MailID": 5, "AttachFlag": "99"}]	NULL	false
update json_test1 t1 INNER JOIN JSON_TABLE(t1.c3,'$[*]' COLUMNS(a FOR ORDINALITY ,
b int PATH "$.MailID" default '0' ON EMPTY default '1' ON ERROR,
c VARCHAR(200) PATH "$.AttachFlag" ,
d VARCHAR(200) EXISTS PATH '$.b[1]')) as t  on t1.c1 = t.b
set t1.c2 = t.c;
select * from json_test1;
c1	c2	c3	c4	c5
1	1	12	"2022-10-10"	NULL
2	8	12	"2022-10-10"	123.12
3	9	[{"MailID": 2, "AttachFlag": "8"}, {"MailID": 3, "AttachFlag": "9"}]	NULL	"sadf"
4	2	[1, 2, {}, {"a": [1, 2]}, []]	NULL	[1,"a",[],{}]
5	0	[1, "asdfasd1", {"a": 12321564654}, {"a": [1, 2]}, []]	NULL	{"a":[1,2]}
6	true	true	NULL	false
7	[]	[{"MailID": 4, "AttachFlag": "88"}, {"MailID": 5, "AttachFlag": "99"}]	NULL	false
mysql_json_table-4-3 dml replace
REPLACE INTO json_test1 (c1, c3, c5) select t.* from JSON_TABLE('[1,"aaaa汉",true,[1,"aaaa汉",true,null],{"a": true, "b": [null,"汉字"]}]',"$[*]" 
COLUMNS(a FOR ORDINALITY ,a1 json PATH '$[0]' DEFAULT '2' ON EMPTY DEFAULT '0' ON ERROR,a2 json PATH '$[0]')) as t;
select * from json_test1;
c1	c2	c3	c4	c5
1	1	12	"2022-10-10"	NULL
2	8	12	"2022-10-10"	123.12
3	9	[{"MailID": 2, "AttachFlag": "8"}, {"MailID": 3, "AttachFlag": "9"}]	NULL	"sadf"
4	2	[1, 2, {}, {"a": [1, 2]}, []]	NULL	[1,"a",[],{}]
5	0	[1, "asdfasd1", {"a": 12321564654}, {"a": [1, 2]}, []]	NULL	{"a":[1,2]}
6	true	true	NULL	false
7	[]	[{"MailID": 4, "AttachFlag": "88"}, {"MailID": 5, "AttachFlag": "99"}]	NULL	false
1	NULL	1	NULL	1
2	NULL	"aaaa汉"	NULL	"aaaa汉"
3	NULL	true	NULL	true
4	NULL	1	NULL	1
5	NULL	{"a": true, "b": [null, "汉字"]}	NULL	{"a": true, "b": [null, "汉字"]}
DROP TABLE json_test1;
CREATE TABLE json_test1(
c1 DECIMAL(38,0) PRIMARY KEY, 
c2 VARCHAR(100) ,
c3 json not null,
c4 json,
c5 VARCHAR(100));
insert into json_test1 values(1,12,'12','"2022-10-10"',null);
insert into json_test1 values(2,'{"a":[1,2]}','12','"2022-10-10"','123.12');
insert into json_test1 values(3,'"a"','[{"MailID":2,"AttachFlag":"8"},{"MailID":3,"AttachFlag":"9"}]',null,'"sadf"');
insert into json_test1 values(4,'[1,"asdfasd1",{"a":12321564654},{"a":[1,2]},[]]','[1,2,{},{"a":[1,2]},[]]',null,'[1,"a",[],{}]');
insert into json_test1 values(5,'{"a":[1,2]}','[1,"asdfasd1",{"a":12321564654},{"a":[1,2]},[]]',null,'{"a":[1,2]}');
insert into json_test1 values(6,'true','true',null,'false');
insert into json_test1 values(7,'[]','[{"MailID":22,"AttachFlag":"88"},{"MailID":33,"AttachFlag":"99"}]',null,'false');
REPLACE INTO json_test1 select t.* from JSON_TABLE('[1,"aaaa汉",true,[1,"aaaa汉",true,null],{"a": true, "b": [null,"汉字"]}]',"$[*]" 
COLUMNS(a FOR ORDINALITY ,
a1 json PATH '$[0]' DEFAULT '2' ON EMPTY DEFAULT '0' ON ERROR,
a2 json PATH '$[0]',
a3 VARCHAR(200) EXISTS PATH '$.b[1]',
a4 json PATH '$[0]')) as t;
select * from json_test1;
c1	c2	c3	c4	c5
1	1	1	0	1
2	"aaaa汉"	"aaaa汉"	0	"aaaa汉"
3	true	true	0	true
4	1	1	0	1
5	{"a": true, "b": [null, "汉字"]}	{"a": true, "b": [null, "汉字"]}	1	{"a": true, "b": [null, "汉字"]}
6	true	true	NULL	false
7	[]	[{"MailID": 22, "AttachFlag": "88"}, {"MailID": 33, "AttachFlag": "99"}]	NULL	false
mysql_json_table-4-4 mysql_json_table-5 表类型
DROP TABLE json_test1;
CREATE TABLE json_test1(
c1 int PRIMARY KEY, 
c2 VARCHAR(100) ,
c3 json not null,
c4 json,
c5 VARCHAR(100))
PARTITION BY RANGE (c1)
(PARTITION less_3 VALUES less than (3),
PARTITION b_3_8 VALUES less than (8),
PARTITION b_8_2000 VALUES less than (2000),
PARTITION greater_2000 VALUES less than MAXVALUE);
insert into json_test1 values(1,12,'12','"2022-10-10"',null);
insert into json_test1 values(2,'{"a":[1,2]}','12','"2022-10-10"','123.12');
insert into json_test1 values(3,'"a"','[{"MailID":2,"AttachFlag":"8"},{"MailID":3,"AttachFlag":"9"}]',null,'"sadf"');
insert into json_test1 values(4,'[1,"asdfasd1",{"a":12321564654},{"a":[1,2]},[]]','[1,2,{},{"a":[1,2]},[]]',null,'[1,"a",[],{}]');
insert into json_test1 values(5,'{"a":[1,2]}','[1,"asdfasd1",{"a":12321564654},{"a":[1,2]},[]]',null,'{"a":[1,2]}');
insert into json_test1 values(6,'true','true',null,'false');
insert into json_test1 values(7777,'[]','[{"MailID":22,"AttachFlag":"88"},{"MailID":33,"AttachFlag":"99"}]',null,'false');
CREATE INDEX INDEX_json_test1_T5 USING HASH ON json_test1(c2);
drop view v1;
CREATE  VIEW v1 AS
SELECT t1.c1,t.* FROM json_test1 t1, JSON_TABLE(t1.c3, '$' 
COLUMNS ( a FOR ORDINALITY ,
a1 json PATH '$.MailID' DEFAULT '10000' ON EMPTY DEFAULT '20000' ON ERROR,
a2 json PATH '$' DEFAULT '110000' ON EMPTY DEFAULT '220000' ON ERROR,
a3 VARCHAR(200) EXISTS PATH '$[1]',
a4 json PATH '$[*]')) AS t;
select * from v1;
c1	a	a1	a2	a3	a4
1	1	10000	12	0	NULL
2	1	10000	12	0	NULL
3	1	10000	[{"MailID": 2, "AttachFlag": "8"}, {"MailID": 3, "AttachFlag": "9"}]	1	[{"MailID": 2, "AttachFlag": "8"}, {"MailID": 3, "AttachFlag": "9"}]
4	1	10000	[1, 2, {}, {"a": [1, 2]}, []]	1	[1, 2, {}, {"a": [1, 2]}, []]
5	1	10000	[1, "asdfasd1", {"a": 12321564654}, {"a": [1, 2]}, []]	1	[1, "asdfasd1", {"a": 12321564654}, {"a": [1, 2]}, []]
6	1	10000	true	0	NULL
7777	1	10000	[{"MailID": 22, "AttachFlag": "88"}, {"MailID": 33, "AttachFlag": "99"}]	1	[{"MailID": 22, "AttachFlag": "88"}, {"MailID": 33, "AttachFlag": "99"}]
delete from json_test1 where c1 = 1;
select * from v1;
c1	a	a1	a2	a3	a4
2	1	10000	12	0	NULL
3	1	10000	[{"MailID": 2, "AttachFlag": "8"}, {"MailID": 3, "AttachFlag": "9"}]	1	[{"MailID": 2, "AttachFlag": "8"}, {"MailID": 3, "AttachFlag": "9"}]
4	1	10000	[1, 2, {}, {"a": [1, 2]}, []]	1	[1, 2, {}, {"a": [1, 2]}, []]
5	1	10000	[1, "asdfasd1", {"a": 12321564654}, {"a": [1, 2]}, []]	1	[1, "asdfasd1", {"a": 12321564654}, {"a": [1, 2]}, []]
6	1	10000	true	0	NULL
7777	1	10000	[{"MailID": 22, "AttachFlag": "88"}, {"MailID": 33, "AttachFlag": "99"}]	1	[{"MailID": 22, "AttachFlag": "88"}, {"MailID": 33, "AttachFlag": "99"}]
drop view v1;
CREATE VIEW v1 AS
SELECT t1.c1,t.* FROM json_test1 t1, JSON_TABLE(t1.c3, '$[*]' 
COLUMNS ( a FOR ORDINALITY ,
a1 json PATH '$.MailID' DEFAULT '10000' ON EMPTY DEFAULT '20000' ON ERROR,
a2 json PATH '$' DEFAULT '110000' ON EMPTY DEFAULT '220000' ON ERROR,
a3 VARCHAR(200) EXISTS PATH '$[1]',
a4 json PATH '$[*]')) AS t;
select * from v1;
c1	a	a1	a2	a3	a4
3	1	2	{"MailID": 2, "AttachFlag": "8"}	0	NULL
3	2	3	{"MailID": 3, "AttachFlag": "9"}	0	NULL
4	1	10000	1	0	NULL
4	2	10000	2	0	NULL
4	3	10000	{}	0	NULL
4	4	10000	{"a": [1, 2]}	0	NULL
4	5	10000	[]	0	NULL
5	1	10000	1	0	NULL
5	2	10000	"asdfasd1"	0	NULL
5	3	10000	{"a": 12321564654}	0	NULL
5	4	10000	{"a": [1, 2]}	0	NULL
5	5	10000	[]	0	NULL
7777	1	22	{"MailID": 22, "AttachFlag": "88"}	0	NULL
7777	2	33	{"MailID": 33, "AttachFlag": "99"}	0	NULL
delete from json_test1 where c1 = 3;
select * from v1;
c1	a	a1	a2	a3	a4
4	1	10000	1	0	NULL
4	2	10000	2	0	NULL
4	3	10000	{}	0	NULL
4	4	10000	{"a": [1, 2]}	0	NULL
4	5	10000	[]	0	NULL
5	1	10000	1	0	NULL
5	2	10000	"asdfasd1"	0	NULL
5	3	10000	{"a": 12321564654}	0	NULL
5	4	10000	{"a": [1, 2]}	0	NULL
5	5	10000	[]	0	NULL
7777	1	22	{"MailID": 22, "AttachFlag": "88"}	0	NULL
7777	2	33	{"MailID": 33, "AttachFlag": "99"}	0	NULL
drop view v1;
CREATE OR REPLACE ALGORITHM = MERGE  VIEW v1 AS
SELECT t1.c1,t.* FROM json_test1 t1, JSON_TABLE(t1.c3, '$' 
COLUMNS ( a FOR ORDINALITY ,
a1 json PATH '$[0]' DEFAULT '10000' ON EMPTY DEFAULT '20000' ON ERROR,
a2 json PATH '$[0]' DEFAULT '110000' ON EMPTY DEFAULT '220000' ON ERROR,
a3 VARCHAR(200) EXISTS PATH '$[1]',
a4 json PATH '$[0]')) AS t WITH  LOCAL CHECK OPTION;
ERROR HY000: join view with check option not allowed
drop view v1;
CREATE VIEW v1 AS
SELECT t1.c1,t.* FROM json_test1 t1 left JOIN JSON_TABLE('[1,"aaaa汉",true,null,[],{"a": true, "b": [null,"汉字"]}]','$[*]' COLUMNS(a FOR ORDINALITY ,
b int PATH "$[0]" default '0' ON EMPTY default '1' ON ERROR,
c VARCHAR(200) PATH "$[0]" ,
d VARCHAR(200) EXISTS PATH '$[1]')) as t  on t1.c1 = t.a;
select * from v1;
c1	a	b	c	d
2	2	1	aaaa汉	0
4	4	NULL	NULL	0
5	5	0	NULL	0
6	6	1	NULL	0
7777	NULL	NULL	NULL	NULL
delete from json_test1 where c1 = 5;
select * from v1;
c1	a	b	c	d
2	2	1	aaaa汉	0
4	4	NULL	NULL	0
6	6	1	NULL	0
7777	NULL	NULL	NULL	NULL
drop view v1;
DROP TABLE json_test1;
DROP TABLE json_test3;
DROP TABLE json_test2;
