DROP TABLE IF EXISTS table2_bigint;
CREATE TABLE table2_bigint (
col_char_20 char(20),
col_timestamp_default_current timestamp not null DEFAULT CURRENT_TIMESTAMP ON UPDATE CURRENT_TIMESTAMP,
col_bigint bigint,
pk bigint,
col_decimal_20_0 decimal(20,0),
primary key (pk) ) ;
INSERT INTO table2_bigint VALUES  (NULL, '2009-03-28 09:17:58.021780', -12601, 1, 127) ,  ('in', '2004-08-27 09:25:21.015195', 14196, 2, 0) ;
SELECT col_decimal_20_0, pk, col_char_20 , col_timestamp_default_current , col_bigint FROM table2_bigint ORDER BY pk;
col_decimal_20_0	pk	col_char_20	col_timestamp_default_current	col_bigint
127	1	NULL	2009-03-28 09:17:58	-12601
0	2	in	2004-08-27 09:25:21	14196
SET TIMESTAMP = ABS( 10 );
select current_timestamp;
current_timestamp
1970-01-01 08:00:10
explain basic UPDATE table2_bigint SET col_bigint = col_bigint WHERE ROUND( ABS( ROUND( ABS( ROUND( FLOOR( col_decimal_20_0 ) ) ) ) ) ) <=> col_decimal_20_0 ORDER BY pk DESC LIMIT 1;
Query Plan
=============================================
|ID|OPERATOR         |NAME                  |
---------------------------------------------
|0 |UPDATE           |                      |
|1 |└─TABLE FULL SCAN|table2_bigint(Reverse)|
=============================================
Outputs & filters:
-------------------------------------
  0 - output(nil), filter(nil)
      table_columns([{table2_bigint: ({table2_bigint: (table2_bigint.pk, table2_bigint.col_char_20, table2_bigint.col_timestamp_default_current, table2_bigint.col_bigint,
       table2_bigint.col_decimal_20_0)})}]),
      update([table2_bigint.col_bigint=column_conv(BIGINT,PS:(20,0),NULL,table2_bigint.col_bigint)], [table2_bigint.col_timestamp_default_current=column_conv(TIMESTAMP,
      PS:(19,0),NOT NULL,cast(current_timestamp(), TIMESTAMP(19, 0)))])
  1 - output([table2_bigint.pk], [table2_bigint.col_bigint], [table2_bigint.col_timestamp_default_current], [table2_bigint.col_char_20], [table2_bigint.col_decimal_20_0]), filter([ROUND(ABS(ROUND(ABS(R
      OUND(FLOOR(table2_bigint.col_decimal_20_0)))))) <=> table2_bigint.col_decimal_20_0]), rowset=16
      access([table2_bigint.pk], [table2_bigint.col_bigint], [table2_bigint.col_timestamp_default_current], [table2_bigint.col_char_20], [table2_bigint.col_decimal_20_0]), partitions(p0)
      limit(1), offset(nil), is_index_back=false, is_global_index=false, filter_before_indexback[false], 
      range_key([table2_bigint.pk]), range(MIN ; MAX)always true
UPDATE table2_bigint SET col_bigint = col_bigint WHERE ROUND( ABS( ROUND( ABS( ROUND( FLOOR( col_decimal_20_0 ) ) ) ) ) ) <=> col_decimal_20_0 ORDER BY pk DESC LIMIT 1 ;
SELECT col_decimal_20_0, pk, col_char_20 , col_timestamp_default_current , col_bigint FROM table2_bigint ORDER BY pk;
col_decimal_20_0	pk	col_char_20	col_timestamp_default_current	col_bigint
127	1	NULL	2009-03-28 09:17:58	-12601
0	2	in	2004-08-27 09:25:21	14196
explain basic UPDATE  /*+ ENABLE_PARALLEL_DML PARALLEL(3) */ table2_bigint SET col_bigint = col_bigint WHERE ROUND( ABS( ROUND( ABS( ROUND( FLOOR( col_decimal_20_0 ) ) ) ) ) ) <=> col_decimal_20_0 ORDER BY pk DESC LIMIT 1;
Query Plan
==========================================================
|ID|OPERATOR                      |NAME                  |
----------------------------------------------------------
|0 |DISTRIBUTED UPDATE            |                      |
|1 |└─LIMIT                       |                      |
|2 |  └─PX COORDINATOR MERGE SORT |                      |
|3 |    └─EXCHANGE OUT DISTR      |:EX10000              |
|4 |      └─LIMIT                 |                      |
|5 |        └─PX BLOCK ITERATOR   |                      |
|6 |          └─TABLE FULL SCAN   |table2_bigint(Reverse)|
==========================================================
Outputs & filters:
-------------------------------------
  0 - output(nil), filter(nil)
      table_columns([{table2_bigint: ({table2_bigint: (table2_bigint.pk, table2_bigint.col_char_20, table2_bigint.col_timestamp_default_current, table2_bigint.col_bigint,
       table2_bigint.col_decimal_20_0)})}]),
      update([table2_bigint.col_bigint=column_conv(BIGINT,PS:(20,0),NULL,table2_bigint.col_bigint)], [table2_bigint.col_timestamp_default_current=column_conv(TIMESTAMP,
      PS:(19,0),NOT NULL,cast(current_timestamp(), TIMESTAMP(19, 0)))])
  1 - output([table2_bigint.pk], [table2_bigint.col_char_20], [table2_bigint.col_timestamp_default_current], [table2_bigint.col_bigint], [table2_bigint.col_decimal_20_0]), filter(nil), rowset=16
      limit(1), offset(nil)
  2 - output([table2_bigint.pk], [table2_bigint.col_char_20], [table2_bigint.col_timestamp_default_current], [table2_bigint.col_bigint], [table2_bigint.col_decimal_20_0]), filter(nil), rowset=16
      sort_keys([table2_bigint.pk, DESC])
  3 - output([table2_bigint.pk], [table2_bigint.col_char_20], [table2_bigint.col_timestamp_default_current], [table2_bigint.col_bigint], [table2_bigint.col_decimal_20_0]), filter(nil), rowset=16
      dop=3
  4 - output([table2_bigint.pk], [table2_bigint.col_char_20], [table2_bigint.col_timestamp_default_current], [table2_bigint.col_bigint], [table2_bigint.col_decimal_20_0]), filter(nil), rowset=16
      limit(1), offset(nil)
  5 - output([table2_bigint.pk], [table2_bigint.col_bigint], [table2_bigint.col_timestamp_default_current], [table2_bigint.col_char_20], [table2_bigint.col_decimal_20_0]), filter(nil), rowset=16
      desc
  6 - output([table2_bigint.pk], [table2_bigint.col_bigint], [table2_bigint.col_timestamp_default_current], [table2_bigint.col_char_20], [table2_bigint.col_decimal_20_0]), filter([ROUND(ABS(ROUND(ABS(R
      OUND(FLOOR(table2_bigint.col_decimal_20_0)))))) <=> table2_bigint.col_decimal_20_0]), rowset=16
      access([table2_bigint.pk], [table2_bigint.col_bigint], [table2_bigint.col_timestamp_default_current], [table2_bigint.col_char_20], [table2_bigint.col_decimal_20_0]), partitions(p0)
      limit(1), offset(nil), is_index_back=false, is_global_index=false, filter_before_indexback[false], 
      range_key([table2_bigint.pk]), range(MIN ; MAX)always true
UPDATE /*+ ENABLE_PARALLEL_DML PARALLEL(3) */  table2_bigint SET col_bigint = col_bigint WHERE ROUND( ABS( ROUND( ABS( ROUND( FLOOR( col_decimal_20_0 ) ) ) ) ) ) <=> col_decimal_20_0 ORDER BY pk DESC LIMIT 1 ;
SELECT col_decimal_20_0, pk, col_char_20 , col_timestamp_default_current , col_bigint FROM table2_bigint ORDER BY pk;
col_decimal_20_0	pk	col_char_20	col_timestamp_default_current	col_bigint
127	1	NULL	2009-03-28 09:17:58	-12601
0	2	in	2004-08-27 09:25:21	14196
