alter system set_tp tp_no = 217, error_code = 1234, frequency = 1;
drop table if exists s,p,p4,p5;
create table s(c1 int ,c2 int ,c3 int);
delete from s;
insert into s values (0,0,0), (1,1,1),(2,2,2), (3,3,3);
select * from s order by c1;
c1	c2	c3
0	0	0
1	1	1
2	2	2
3	3	3
explain basic update /*+parallel(2),enable_parallel_dml*/ s set c3 = c1 + c2;
Query Plan
=================================================
|ID|OPERATOR                           |NAME    |
-------------------------------------------------
|0 |PX COORDINATOR                     |        |
|1 |└─EXCHANGE OUT DISTR               |:EX10001|
|2 |  └─UPDATE                         |        |
|3 |    └─EXCHANGE IN DISTR            |        |
|4 |      └─EXCHANGE OUT DISTR (RANDOM)|:EX10000|
|5 |        └─PX BLOCK ITERATOR        |        |
|6 |          └─TABLE FULL SCAN        |s       |
=================================================
Outputs & filters:
-------------------------------------
  0 - output(nil), filter(nil), rowset=16
  1 - output(nil), filter(nil), rowset=16
      dop=2
  2 - output(nil), filter(nil)
      table_columns([{s: ({s: (s.__pk_increment, s.c1, s.c2, s.c3)})}]),
      update([s.c3=column_conv(INT,PS:(11,0),NULL,cast(s.c1 + s.c2, INT(-1, 0)))])
  3 - output([s.__pk_increment], [s.c1], [s.c2], [s.c3]), filter(nil), rowset=16
  4 - output([s.__pk_increment], [s.c1], [s.c2], [s.c3]), filter(nil), rowset=16
      dop=2
  5 - output([s.__pk_increment], [s.c3], [s.c1], [s.c2]), filter(nil), rowset=16
  6 - output([s.__pk_increment], [s.c3], [s.c1], [s.c2]), filter(nil), rowset=16
      access([s.__pk_increment], [s.c3], [s.c1], [s.c2]), partitions(p0)
      is_index_back=false, is_global_index=false, 
      range_key([s.__pk_increment]), range(MIN ; MAX)always true
update /*+parallel(2),enable_parallel_dml*/ s set c3 = c1 + c2;
select * from s;
c1	c2	c3
0	0	0
1	1	2
2	2	4
3	3	6
delete from s;
insert into s values (0,0,0), (1,1,1),(2,2,2), (3,3,3);
select * from s order by c1;
c1	c2	c3
0	0	0
1	1	1
2	2	2
3	3	3
explain basic update /*+parallel(2),enable_parallel_dml*/ s set c3 = c1 + c2 where c1 > 1;
Query Plan
=================================================
|ID|OPERATOR                           |NAME    |
-------------------------------------------------
|0 |PX COORDINATOR                     |        |
|1 |└─EXCHANGE OUT DISTR               |:EX10001|
|2 |  └─UPDATE                         |        |
|3 |    └─EXCHANGE IN DISTR            |        |
|4 |      └─EXCHANGE OUT DISTR (RANDOM)|:EX10000|
|5 |        └─PX BLOCK ITERATOR        |        |
|6 |          └─TABLE FULL SCAN        |s       |
=================================================
Outputs & filters:
-------------------------------------
  0 - output(nil), filter(nil), rowset=16
  1 - output(nil), filter(nil), rowset=16
      dop=2
  2 - output(nil), filter(nil)
      table_columns([{s: ({s: (s.__pk_increment, s.c1, s.c2, s.c3)})}]),
      update([s.c3=column_conv(INT,PS:(11,0),NULL,cast(s.c1 + s.c2, INT(-1, 0)))])
  3 - output([s.__pk_increment], [s.c1], [s.c2], [s.c3]), filter(nil), rowset=16
  4 - output([s.__pk_increment], [s.c1], [s.c2], [s.c3]), filter(nil), rowset=16
      dop=2
  5 - output([s.__pk_increment], [s.c3], [s.c1], [s.c2]), filter(nil), rowset=16
  6 - output([s.__pk_increment], [s.c3], [s.c1], [s.c2]), filter([s.c1 > 1]), rowset=16
      access([s.__pk_increment], [s.c3], [s.c1], [s.c2]), partitions(p0)
      is_index_back=false, is_global_index=false, filter_before_indexback[false], 
      range_key([s.__pk_increment]), range(MIN ; MAX)always true
update /*+parallel(2),enable_parallel_dml*/ s set c3 = c1 + c2 where c1 > 1;
select * from s;
c1	c2	c3
0	0	0
1	1	1
2	2	4
3	3	6
create table p4(c1 int , c2 int ,c3 int) partition by hash(c1) partitions 4;
delete from p4;
insert into p4 values (0,0,0), (1,1,1),(2,2,2), (3,3,3);
select * from s order by c1;
c1	c2	c3
0	0	0
1	1	1
2	2	4
3	3	6
explain basic update /*+parallel(2),enable_parallel_dml*/ p4 set c3 = c1 + c2;
Query Plan
======================================================
|ID|OPERATOR                                |NAME    |
------------------------------------------------------
|0 |PX COORDINATOR                          |        |
|1 |└─EXCHANGE OUT DISTR                    |:EX10001|
|2 |  └─UPDATE                              |        |
|3 |    └─EXCHANGE IN DISTR                 |        |
|4 |      └─EXCHANGE OUT DISTR (PKEY RANDOM)|:EX10000|
|5 |        └─PX BLOCK ITERATOR             |        |
|6 |          └─TABLE FULL SCAN             |p4      |
======================================================
Outputs & filters:
-------------------------------------
  0 - output(nil), filter(nil), rowset=16
  1 - output(nil), filter(nil), rowset=16
      dop=2
  2 - output(nil), filter(nil)
      table_columns([{p4: ({p4: (p4.__pk_increment, p4.c1, p4.c2, p4.c3)})}]),
      update([p4.c3=column_conv(INT,PS:(11,0),NULL,cast(p4.c1 + p4.c2, INT(-1, 0)))])
  3 - output([PARTITION_ID], [p4.__pk_increment], [p4.c1], [p4.c2], [p4.c3]), filter(nil), rowset=16
  4 - output([PARTITION_ID], [p4.__pk_increment], [p4.c1], [p4.c2], [p4.c3]), filter(nil), rowset=16
      (#keys=1, [p4.c1]), dop=2
  5 - output([p4.__pk_increment], [p4.c1], [p4.c3], [p4.c2]), filter(nil), rowset=16
  6 - output([p4.__pk_increment], [p4.c1], [p4.c3], [p4.c2]), filter(nil), rowset=16
      access([p4.__pk_increment], [p4.c1], [p4.c3], [p4.c2]), partitions(p[0-3])
      is_index_back=false, is_global_index=false, 
      range_key([p4.__pk_increment]), range(MIN ; MAX)always true
update /*+parallel(2),enable_parallel_dml*/ p4 set c3 = c1 + c2 where c1 > 1;
select * from p4;
c1	c2	c3
0	0	0
1	1	1
2	2	4
3	3	6
delete from p4;
insert into p4 values (0,0,0), (1,1,1),(2,2,2), (3,3,3);
select * from s order by c1;
c1	c2	c3
0	0	0
1	1	1
2	2	4
3	3	6
explain basic update /*+parallel(20),enable_parallel_dml*/ p4 set c3 = c1 + c2;
Query Plan
======================================================
|ID|OPERATOR                                |NAME    |
------------------------------------------------------
|0 |PX COORDINATOR                          |        |
|1 |└─EXCHANGE OUT DISTR                    |:EX10001|
|2 |  └─UPDATE                              |        |
|3 |    └─EXCHANGE IN DISTR                 |        |
|4 |      └─EXCHANGE OUT DISTR (PKEY RANDOM)|:EX10000|
|5 |        └─PX BLOCK ITERATOR             |        |
|6 |          └─TABLE FULL SCAN             |p4      |
======================================================
Outputs & filters:
-------------------------------------
  0 - output(nil), filter(nil), rowset=16
  1 - output(nil), filter(nil), rowset=16
      dop=20
  2 - output(nil), filter(nil)
      table_columns([{p4: ({p4: (p4.__pk_increment, p4.c1, p4.c2, p4.c3)})}]),
      update([p4.c3=column_conv(INT,PS:(11,0),NULL,cast(p4.c1 + p4.c2, INT(-1, 0)))])
  3 - output([PARTITION_ID], [p4.__pk_increment], [p4.c1], [p4.c2], [p4.c3]), filter(nil), rowset=16
  4 - output([PARTITION_ID], [p4.__pk_increment], [p4.c1], [p4.c2], [p4.c3]), filter(nil), rowset=16
      (#keys=1, [p4.c1]), dop=20
  5 - output([p4.__pk_increment], [p4.c1], [p4.c3], [p4.c2]), filter(nil), rowset=16
  6 - output([p4.__pk_increment], [p4.c1], [p4.c3], [p4.c2]), filter(nil), rowset=16
      access([p4.__pk_increment], [p4.c1], [p4.c3], [p4.c2]), partitions(p[0-3])
      is_index_back=false, is_global_index=false, 
      range_key([p4.__pk_increment]), range(MIN ; MAX)always true
update /*+parallel(2),enable_parallel_dml*/ p4 set c3 = c1 + c2 where c1 > 1;
select * from p4;
c1	c2	c3
0	0	0
1	1	1
2	2	4
3	3	6
drop table if exists t1, t2;
create table t1(id int, value int);
create table t2(id int, value int);
insert into t1 values(1, 0);
insert into t1 values(1, 1);
explain basic update /*+ USE_PX PARALLEL(8) ENABLE_PARALLEL_DML */ t1 left join t2 on t1.id = t2.id set t2.value = t1.value + 1;
Query Plan
========================================================
|ID|OPERATOR                                  |NAME    |
--------------------------------------------------------
|0 |PX COORDINATOR                            |        |
|1 |└─EXCHANGE OUT DISTR                      |:EX10002|
|2 |  └─UPDATE                                |        |
|3 |    └─EXCHANGE IN DISTR                   |        |
|4 |      └─EXCHANGE OUT DISTR (HASH)         |:EX10001|
|5 |        └─SHARED HASH RIGHT OUTER JOIN    |        |
|6 |          ├─EXCHANGE IN DISTR             |        |
|7 |          │ └─EXCHANGE OUT DISTR (BC2HOST)|:EX10000|
|8 |          │   └─PX BLOCK ITERATOR         |        |
|9 |          │     └─TABLE FULL SCAN         |t2      |
|10|          └─PX BLOCK ITERATOR             |        |
|11|            └─TABLE FULL SCAN             |t1      |
========================================================
Outputs & filters:
-------------------------------------
  0 - output(nil), filter(nil), rowset=16
  1 - output(nil), filter(nil), rowset=16
      dop=8
  2 - output(nil), filter(nil)
      table_columns([{t2: ({t2: (t2.__pk_increment, t2.id, t2.value)}), hash_distinct}]),
      update([t2.value=column_conv(INT,PS:(11,0),NULL,cast(t1.value + 1, INT(-1, 0)))])
  3 - output([t2.__pk_increment], [t2.id], [t2.value], [t1.value]), filter(nil), rowset=16
  4 - output([t2.__pk_increment], [t2.id], [t2.value], [t1.value]), filter(nil), rowset=16
      (#keys=1, [t2.__pk_increment]), dop=8
  5 - output([t2.__pk_increment], [t2.id], [t2.value], [t1.value]), filter(nil), rowset=16
      equal_conds([t1.id = t2.id]), other_conds(nil)
  6 - output([t2.__pk_increment], [t2.id], [t2.value]), filter(nil), rowset=16
  7 - output([t2.__pk_increment], [t2.id], [t2.value]), filter(nil), rowset=16
      dop=8
  8 - output([t2.__pk_increment], [t2.id], [t2.value]), filter(nil), rowset=16
  9 - output([t2.__pk_increment], [t2.id], [t2.value]), filter(nil), rowset=16
      access([t2.__pk_increment], [t2.id], [t2.value]), partitions(p0)
      is_index_back=false, is_global_index=false, 
      range_key([t2.__pk_increment]), range(MIN ; MAX)always true
 10 - output([t1.id], [t1.value]), filter(nil), rowset=16
 11 - output([t1.id], [t1.value]), filter(nil), rowset=16
      access([t1.id], [t1.value]), partitions(p0)
      is_index_back=false, is_global_index=false, 
      range_key([t1.__pk_increment]), range(MIN ; MAX)always true
update /*+ USE_PX PARALLEL(8) ENABLE_PARALLEL_DML */ t1 left join t2 on t1.id = t2.id set t2.value = t1.value + 1;
select * from t2;
id	value
insert into t2 values(1, 10);
explain basic update /*+ USE_PX PARALLEL(8) ENABLE_PARALLEL_DML */ t1 left join t2 on t1.id = t2.id set t2.value = t1.value + 1;
Query Plan
========================================================
|ID|OPERATOR                                  |NAME    |
--------------------------------------------------------
|0 |PX COORDINATOR                            |        |
|1 |└─EXCHANGE OUT DISTR                      |:EX10002|
|2 |  └─UPDATE                                |        |
|3 |    └─EXCHANGE IN DISTR                   |        |
|4 |      └─EXCHANGE OUT DISTR (HASH)         |:EX10001|
|5 |        └─SHARED HASH RIGHT OUTER JOIN    |        |
|6 |          ├─EXCHANGE IN DISTR             |        |
|7 |          │ └─EXCHANGE OUT DISTR (BC2HOST)|:EX10000|
|8 |          │   └─PX BLOCK ITERATOR         |        |
|9 |          │     └─TABLE FULL SCAN         |t2      |
|10|          └─PX BLOCK ITERATOR             |        |
|11|            └─TABLE FULL SCAN             |t1      |
========================================================
Outputs & filters:
-------------------------------------
  0 - output(nil), filter(nil), rowset=16
  1 - output(nil), filter(nil), rowset=16
      dop=8
  2 - output(nil), filter(nil)
      table_columns([{t2: ({t2: (t2.__pk_increment, t2.id, t2.value)}), hash_distinct}]),
      update([t2.value=column_conv(INT,PS:(11,0),NULL,cast(t1.value + 1, INT(-1, 0)))])
  3 - output([t2.__pk_increment], [t2.id], [t2.value], [t1.value]), filter(nil), rowset=16
  4 - output([t2.__pk_increment], [t2.id], [t2.value], [t1.value]), filter(nil), rowset=16
      (#keys=1, [t2.__pk_increment]), dop=8
  5 - output([t2.__pk_increment], [t2.id], [t2.value], [t1.value]), filter(nil), rowset=16
      equal_conds([t1.id = t2.id]), other_conds(nil)
  6 - output([t2.__pk_increment], [t2.id], [t2.value]), filter(nil), rowset=16
  7 - output([t2.__pk_increment], [t2.id], [t2.value]), filter(nil), rowset=16
      dop=8
  8 - output([t2.__pk_increment], [t2.id], [t2.value]), filter(nil), rowset=16
  9 - output([t2.__pk_increment], [t2.id], [t2.value]), filter(nil), rowset=16
      access([t2.__pk_increment], [t2.id], [t2.value]), partitions(p0)
      is_index_back=false, is_global_index=false, 
      range_key([t2.__pk_increment]), range(MIN ; MAX)always true
 10 - output([t1.id], [t1.value]), filter(nil), rowset=16
 11 - output([t1.id], [t1.value]), filter(nil), rowset=16
      access([t1.id], [t1.value]), partitions(p0)
      is_index_back=false, is_global_index=false, 
      range_key([t1.__pk_increment]), range(MIN ; MAX)always true
update /*+ USE_PX PARALLEL(8) ENABLE_PARALLEL_DML */ t1 left join t2 on t1.id = t2.id set t2.value = t1.value + 1;
select * from t2;
id	value
1	1
drop table t1, t2;
alter system set_tp tp_no = 217, error_code = 1234, frequency = 0;
