drop table if exists t1,t22;
create table t22(a int primary key, b int, c int, d timestamp DEFAULT CURRENT_TIMESTAMP ON UPDATE CURRENT_TIMESTAMP) partition by hash(a) partitions 5;
create index idx on t22(c, d) global;
insert into t22 values(1, 1, 1, now());
set _force_parallel_dml_dop = 3;
insert into t22 values(2,2,2,now());
insert into t22 values(3,3,3,now());
insert into t22 values(4,4,4,now());
select count(*) from t22 group by d;
count(*)
4
update t22 set b=b+1, c=1 where a>1;
select count(*) from t22 group by d;
count(*)
1
3
select /*+index(t22 idx)*/ count(*) from t22 group by d;
count(*)
1
3
explain update t22 set d=now() where a>1;
Query Plan
==========================================================================================
|ID|OPERATOR                                              |NAME    |EST.ROWS|EST.TIME(us)|
------------------------------------------------------------------------------------------
|0 |PX COORDINATOR                                        |        |3       |108         |
|1 |└─EXCHANGE OUT DISTR                                  |:EX10003|3       |106         |
|2 |  └─INDEX INSERT                                      |t22(idx)|3       |104         |
|3 |    └─EXCHANGE IN DISTR                               |        |3       |79          |
|4 |      └─EXCHANGE OUT DISTR (HASH)                     |:EX10002|3       |78          |
|5 |        └─MATERIAL                                    |        |3       |77          |
|6 |          └─INDEX DELETE                              |t22(idx)|3       |77          |
|7 |            └─EXCHANGE IN DISTR                       |        |3       |55          |
|8 |              └─EXCHANGE OUT DISTR (HASH)             |:EX10001|3       |54          |
|9 |                └─MATERIAL                            |        |3       |53          |
|10|                  └─UPDATE                            |        |3       |53          |
|11|                    └─EXCHANGE IN DISTR               |        |3       |6           |
|12|                      └─EXCHANGE OUT DISTR (PKEY HASH)|:EX10000|3       |6           |
|13|                        └─PX BLOCK ITERATOR           |        |3       |4           |
|14|                          └─TABLE RANGE SCAN          |t22     |3       |4           |
==========================================================================================
Outputs & filters:
-------------------------------------
  0 - output(nil), filter(nil), rowset=16
  1 - output(nil), filter(nil), rowset=16
      dop=3
  2 - output(nil), filter(nil)
      columns([{t22: ({idx: (t22.c, t22.d, t22.a)})}]), partitions(p0), 
      column_values([t22.c], [column_conv(TIMESTAMP,PS:(19,0),NOT NULL,timestamp_nvl(cast(current_timestamp(), TIMESTAMP(-1, 0)), cast(current_timestamp(),
       TIMESTAMP(19, 0))))], [t22.a])
  3 - output([t22.c], [t22.a]), filter(nil), rowset=16
  4 - output([t22.c], [t22.a]), filter(nil), rowset=16
      (#keys=3, [t22.c], [column_conv(TIMESTAMP,PS:(19,0),NOT NULL,timestamp_nvl(cast(current_timestamp(), TIMESTAMP(-1, 0)), cast(current_timestamp(), 
      TIMESTAMP(19, 0))))], [t22.a]), dop=3
  5 - output([t22.c], [t22.a]), filter(nil), rowset=16
  6 - output([t22.c], [t22.a]), filter(nil)
      table_columns([{t22: ({idx: (t22.c, t22.d, t22.a)})}]), with_barrier
  7 - output([t22.c], [t22.a], [t22.d]), filter(nil), rowset=16
  8 - output([t22.c], [t22.a], [t22.d]), filter(nil), rowset=16
      (#keys=3, [t22.c], [t22.d], [t22.a]), dop=3
  9 - output([t22.c], [t22.a], [t22.d]), filter(nil), rowset=16
 10 - output([t22.c], [t22.a], [t22.d]), filter(nil)
      table_columns([{t22: ({t22: (t22.a, t22.b, t22.c, t22.d)})}]),
      update([t22.d=column_conv(TIMESTAMP,PS:(19,0),NOT NULL,timestamp_nvl(cast(current_timestamp(), TIMESTAMP(-1, 0)), cast(current_timestamp(), TIMESTAMP(19,
       0))))])
 11 - output([t22.c], [t22.a], [t22.d], [PARTITION_ID], [t22.b]), filter(nil), rowset=16
 12 - output([t22.c], [t22.a], [t22.d], [PARTITION_ID], [t22.b]), filter(nil), rowset=16
      (#keys=1, [t22.a]), dop=3
 13 - output([t22.a], [t22.d], [t22.b], [t22.c]), filter(nil), rowset=16
 14 - output([t22.a], [t22.d], [t22.b], [t22.c]), filter(nil), rowset=16
      access([t22.a], [t22.d], [t22.b], [t22.c]), partitions(p[0-4])
      is_index_back=false, is_global_index=false, 
      range_key([t22.a]), range(1 ; MAX), 
      range_cond([t22.a > 1])
explain update t22 set b=5, c=1 where a>1;
Query Plan
===============================================================
|ID|OPERATOR                   |NAME    |EST.ROWS|EST.TIME(us)|
---------------------------------------------------------------
|0 |DISTRIBUTED UPDATE         |        |3       |88          |
|1 |└─PX COORDINATOR           |        |3       |18          |
|2 |  └─EXCHANGE OUT DISTR     |:EX10000|3       |16          |
|3 |    └─PX PARTITION ITERATOR|        |3       |11          |
|4 |      └─TABLE RANGE SCAN   |t22     |3       |11          |
===============================================================
Outputs & filters:
-------------------------------------
  0 - output(nil), filter(nil)
      table_columns([{t22: ({t22: (t22.a, t22.b, t22.c, t22.d)}, {idx: (t22.c, t22.d, t22.a)})}]),
      update([t22.b=column_conv(INT,PS:(11,0),NULL,5)], [t22.c=column_conv(INT,PS:(11,0),NULL,1)], [t22.d=column_conv(TIMESTAMP,PS:(19,0),NOT NULL,cast(current_timestamp(),
       TIMESTAMP(19, 0)))])
  1 - output([t22.a], [t22.b], [t22.c], [t22.d]), filter(nil), rowset=16
  2 - output([t22.a], [t22.b], [t22.c], [t22.d]), filter(nil), rowset=16
      dop=1
  3 - output([t22.a], [t22.b], [t22.c], [t22.d]), filter(nil), rowset=16
      force partition granule
  4 - output([t22.a], [t22.b], [t22.c], [t22.d]), filter(nil), rowset=16
      access([t22.a], [t22.b], [t22.c], [t22.d]), partitions(p[0-4])
      is_index_back=false, is_global_index=false, 
      range_key([t22.a]), range(1 ; MAX), 
      range_cond([t22.a > 1])
update t22 set b=5, c=1 where a>1;
update t22 set b=5, c=1 where a>1;
update t22 set c=c where a=1;
select count(*) from t22 group by d;
count(*)
1
1
2
select /*+index(t22 idx)*/ count(d) from t22 group by d;
count(d)
1
1
2
drop table t22;
create table t1(c1 int primary key, c2 int, c3 timestamp DEFAULT CURRENT_TIMESTAMP ON UPDATE CURRENT_TIMESTAMP, c4 timestamp DEFAULT CURRENT_TIMESTAMP ON UPDATE CURRENT_TIMESTAMP, c5 int, c6 int) partition by hash(c1) partitions 5;
create index t1_idx on t1(c2, c3, c4) global;
insert into t1 values(1,1,now(),now(),1,1);
insert into t1 values(2,2,now(),now(),2,2);
insert into t1 values(3,3,now(),now(),3,3);
select count(*) from t1 group by c1;
count(*)
1
1
1
update t1 set c2 = 10 where c1 > 0;
select count(*) from t1 group by c3;
count(*)
3
select /*+index(t1 idx)*/ count(*) from t1 group by c3;
count(*)
3
update t1 set c2 = c2 where c1 > 0;
select count(*) from t1 group by c4;
count(*)
3
select /*+index(t1 idx)*/ count(*) from t1 group by c3;
count(*)
3
drop table t1;
set _force_parallel_dml_dop = 0;
