alter system set_tp tp_no = 217, error_code = 1234, frequency = 1;
drop table if exists s,p,p4,p5,t1;
create table s(c1 int ,c2 int ,c3 int, KEY idx1(c3) GLOBAL);
delete from s;
insert into s values (0,0,0), (1,1,1),(2,2,2), (3,3,3);
select * from s;
c1	c2	c3
0	0	0
1	1	1
2	2	2
3	3	3
explain basic update /*+parallel(2),enable_parallel_dml*/ s set c3 = c1 + c2;
Query Plan
=================================================
|ID|OPERATOR                           |NAME    |
-------------------------------------------------
|0 |PX COORDINATOR                     |        |
|1 |└─EXCHANGE OUT DISTR               |:EX10001|
|2 |  └─UPDATE                         |        |
|3 |    └─EXCHANGE IN DISTR            |        |
|4 |      └─EXCHANGE OUT DISTR (RANDOM)|:EX10000|
|5 |        └─PX BLOCK ITERATOR        |        |
|6 |          └─TABLE FULL SCAN        |s       |
=================================================
Outputs & filters:
-------------------------------------
  0 - output(nil), filter(nil), rowset=16
  1 - output(nil), filter(nil), rowset=16
      dop=2
  2 - output(nil), filter(nil)
      table_columns([{s: ({s: (s.__pk_increment, s.c1, s.c2, s.c3)})}]),
      update([s.c3=column_conv(INT,PS:(11,0),NULL,cast(s.c1 + s.c2, INT(-1, 0)))])
  3 - output([s.__pk_increment], [s.c1], [s.c2], [s.c3]), filter(nil), rowset=16
  4 - output([s.__pk_increment], [s.c1], [s.c2], [s.c3]), filter(nil), rowset=16
      dop=2
  5 - output([s.__pk_increment], [s.c3], [s.c1], [s.c2]), filter(nil), rowset=16
  6 - output([s.__pk_increment], [s.c3], [s.c1], [s.c2]), filter(nil), rowset=16
      access([s.__pk_increment], [s.c3], [s.c1], [s.c2]), partitions(p0)
      is_index_back=false, is_global_index=false, 
      range_key([s.__pk_increment]), range(MIN ; MAX)always true
update /*+parallel(2),enable_parallel_dml*/ s set c3 = c1 + c2;
select * from s;
c1	c2	c3
0	0	0
1	1	2
2	2	4
3	3	6
explain basic update /*+parallel(2),enable_parallel_dml*/ s set c2 = c1 + c2;
Query Plan
=================================================
|ID|OPERATOR                           |NAME    |
-------------------------------------------------
|0 |PX COORDINATOR                     |        |
|1 |└─EXCHANGE OUT DISTR               |:EX10001|
|2 |  └─UPDATE                         |        |
|3 |    └─EXCHANGE IN DISTR            |        |
|4 |      └─EXCHANGE OUT DISTR (RANDOM)|:EX10000|
|5 |        └─PX BLOCK ITERATOR        |        |
|6 |          └─TABLE FULL SCAN        |s       |
=================================================
Outputs & filters:
-------------------------------------
  0 - output(nil), filter(nil), rowset=16
  1 - output(nil), filter(nil), rowset=16
      dop=2
  2 - output(nil), filter(nil)
      table_columns([{s: ({s: (s.__pk_increment, s.c1, s.c2, s.c3)})}]),
      update([s.c2=column_conv(INT,PS:(11,0),NULL,cast(s.c1 + s.c2, INT(-1, 0)))])
  3 - output([s.__pk_increment], [s.c1], [s.c2], [s.c3]), filter(nil), rowset=16
  4 - output([s.__pk_increment], [s.c1], [s.c2], [s.c3]), filter(nil), rowset=16
      dop=2
  5 - output([s.__pk_increment], [s.c2], [s.c1], [s.c3]), filter(nil), rowset=16
  6 - output([s.__pk_increment], [s.c2], [s.c1], [s.c3]), filter(nil), rowset=16
      access([s.__pk_increment], [s.c2], [s.c1], [s.c3]), partitions(p0)
      is_index_back=false, is_global_index=false, 
      range_key([s.__pk_increment]), range(MIN ; MAX)always true
update /*+parallel(2),enable_parallel_dml*/ s set c2 = c1 + c2;
select * from s;
c1	c2	c3
0	0	0
1	2	2
2	4	4
3	6	6
delete from s;
insert into s values (0,0,0), (1,1,1),(2,2,2), (3,3,3);
select * from s;
c1	c2	c3
0	0	0
1	1	1
2	2	2
3	3	3
explain basic update /*+parallel(2),enable_parallel_dml*/ s set c3 = c1 + c2 where c1 > 1;
Query Plan
=================================================
|ID|OPERATOR                           |NAME    |
-------------------------------------------------
|0 |PX COORDINATOR                     |        |
|1 |└─EXCHANGE OUT DISTR               |:EX10001|
|2 |  └─UPDATE                         |        |
|3 |    └─EXCHANGE IN DISTR            |        |
|4 |      └─EXCHANGE OUT DISTR (RANDOM)|:EX10000|
|5 |        └─PX BLOCK ITERATOR        |        |
|6 |          └─TABLE FULL SCAN        |s       |
=================================================
Outputs & filters:
-------------------------------------
  0 - output(nil), filter(nil), rowset=16
  1 - output(nil), filter(nil), rowset=16
      dop=2
  2 - output(nil), filter(nil)
      table_columns([{s: ({s: (s.__pk_increment, s.c1, s.c2, s.c3)})}]),
      update([s.c3=column_conv(INT,PS:(11,0),NULL,cast(s.c1 + s.c2, INT(-1, 0)))])
  3 - output([s.__pk_increment], [s.c1], [s.c2], [s.c3]), filter(nil), rowset=16
  4 - output([s.__pk_increment], [s.c1], [s.c2], [s.c3]), filter(nil), rowset=16
      dop=2
  5 - output([s.__pk_increment], [s.c3], [s.c1], [s.c2]), filter(nil), rowset=16
  6 - output([s.__pk_increment], [s.c3], [s.c1], [s.c2]), filter([s.c1 > 1]), rowset=16
      access([s.__pk_increment], [s.c3], [s.c1], [s.c2]), partitions(p0)
      is_index_back=false, is_global_index=false, filter_before_indexback[false], 
      range_key([s.__pk_increment]), range(MIN ; MAX)always true
update /*+parallel(2),enable_parallel_dml*/ s set c3 = c1 + c2 where c1 > 1;
select * from s;
c1	c2	c3
0	0	0
1	1	1
2	2	4
3	3	6
create table p4(c1 int primary key, c2 int ,c3 int, KEY idx1(c3) GLOBAL) partition by hash(c1) partitions 4;
delete from p4;
insert into p4 values (0,0,0), (1,1,1),(2,2,2), (3,3,3);
select * from p4;
c1	c2	c3
0	0	0
1	1	1
2	2	2
3	3	3
explain basic update /*+parallel(2),enable_parallel_dml*/ p4 set c3 = c1 + c2;
Query Plan
====================================================================
|ID|OPERATOR                                              |NAME    |
--------------------------------------------------------------------
|0 |PX COORDINATOR                                        |        |
|1 |└─EXCHANGE OUT DISTR                                  |:EX10003|
|2 |  └─INDEX INSERT                                      |p4(idx1)|
|3 |    └─EXCHANGE IN DISTR                               |        |
|4 |      └─EXCHANGE OUT DISTR (HASH)                     |:EX10002|
|5 |        └─MATERIAL                                    |        |
|6 |          └─INDEX DELETE                              |p4(idx1)|
|7 |            └─EXCHANGE IN DISTR                       |        |
|8 |              └─EXCHANGE OUT DISTR (HASH)             |:EX10001|
|9 |                └─MATERIAL                            |        |
|10|                  └─UPDATE                            |        |
|11|                    └─EXCHANGE IN DISTR               |        |
|12|                      └─EXCHANGE OUT DISTR (PKEY HASH)|:EX10000|
|13|                        └─PX BLOCK ITERATOR           |        |
|14|                          └─TABLE FULL SCAN           |p4      |
====================================================================
Outputs & filters:
-------------------------------------
  0 - output(nil), filter(nil), rowset=16
  1 - output(nil), filter(nil), rowset=16
      dop=2
  2 - output(nil), filter(nil)
      columns([{p4: ({idx1: (p4.c3, p4.c1)})}]), partitions(p0), 
      column_values([column_conv(INT,PS:(11,0),NULL,cast(p4.c1 + p4.c2, INT(-1, 0)))], [p4.c1])
  3 - output([column_conv(INT,PS:(11,0),NULL,cast(p4.c1 + p4.c2, INT(-1, 0)))], [p4.c1]), filter(nil), rowset=16
  4 - output([column_conv(INT,PS:(11,0),NULL,cast(p4.c1 + p4.c2, INT(-1, 0)))], [p4.c1]), filter(nil), rowset=16
      (#keys=2, [column_conv(INT,PS:(11,0),NULL,cast(p4.c1 + p4.c2, INT(-1, 0)))], [p4.c1]), dop=2
  5 - output([column_conv(INT,PS:(11,0),NULL,cast(p4.c1 + p4.c2, INT(-1, 0)))], [p4.c1]), filter(nil), rowset=16
  6 - output([column_conv(INT,PS:(11,0),NULL,cast(p4.c1 + p4.c2, INT(-1, 0)))], [p4.c1]), filter(nil)
      table_columns([{p4: ({idx1: (p4.c3, p4.c1)})}]), with_barrier
  7 - output([column_conv(INT,PS:(11,0),NULL,cast(p4.c1 + p4.c2, INT(-1, 0)))], [p4.c1], [p4.c3]), filter(nil), rowset=16
  8 - output([column_conv(INT,PS:(11,0),NULL,cast(p4.c1 + p4.c2, INT(-1, 0)))], [p4.c1], [p4.c3]), filter(nil), rowset=16
      (#keys=2, [p4.c3], [p4.c1]), dop=2
  9 - output([column_conv(INT,PS:(11,0),NULL,cast(p4.c1 + p4.c2, INT(-1, 0)))], [p4.c1], [p4.c3]), filter(nil), rowset=16
 10 - output([column_conv(INT,PS:(11,0),NULL,cast(p4.c1 + p4.c2, INT(-1, 0)))], [p4.c1], [p4.c3]), filter(nil)
      table_columns([{p4: ({p4: (p4.c1, p4.c2, p4.c3)})}]),
      update([p4.c3=column_conv(INT,PS:(11,0),NULL,cast(p4.c1 + p4.c2, INT(-1, 0)))])
 11 - output([p4.c1], [p4.c3], [PARTITION_ID], [p4.c2]), filter(nil), rowset=16
 12 - output([p4.c1], [p4.c3], [PARTITION_ID], [p4.c2]), filter(nil), rowset=16
      (#keys=1, [p4.c1]), dop=2
 13 - output([p4.c1], [p4.c3], [p4.c2]), filter(nil), rowset=16
 14 - output([p4.c1], [p4.c3], [p4.c2]), filter(nil), rowset=16
      access([p4.c1], [p4.c3], [p4.c2]), partitions(p[0-3])
      is_index_back=false, is_global_index=false, 
      range_key([p4.c1]), range(MIN ; MAX)always true
update /*+parallel(2),enable_parallel_dml*/ p4 set c3 = c1 + c2 where c1 > 1;
select * from p4;
c1	c2	c3
0	0	0
1	1	1
2	2	4
3	3	6
delete from p4;
insert into p4 values (0,0,0), (1,1,1),(2,2,2), (3,3,3);
select * from p4 order by c1;
c1	c2	c3
0	0	0
1	1	1
2	2	2
3	3	3
explain basic update /*+parallel(20),enable_parallel_dml*/ p4 set c3 = c1 + c2;
Query Plan
====================================================================
|ID|OPERATOR                                              |NAME    |
--------------------------------------------------------------------
|0 |PX COORDINATOR                                        |        |
|1 |└─EXCHANGE OUT DISTR                                  |:EX10003|
|2 |  └─INDEX INSERT                                      |p4(idx1)|
|3 |    └─EXCHANGE IN DISTR                               |        |
|4 |      └─EXCHANGE OUT DISTR (HASH)                     |:EX10002|
|5 |        └─MATERIAL                                    |        |
|6 |          └─INDEX DELETE                              |p4(idx1)|
|7 |            └─EXCHANGE IN DISTR                       |        |
|8 |              └─EXCHANGE OUT DISTR (HASH)             |:EX10001|
|9 |                └─MATERIAL                            |        |
|10|                  └─UPDATE                            |        |
|11|                    └─EXCHANGE IN DISTR               |        |
|12|                      └─EXCHANGE OUT DISTR (PKEY HASH)|:EX10000|
|13|                        └─PX BLOCK ITERATOR           |        |
|14|                          └─TABLE FULL SCAN           |p4      |
====================================================================
Outputs & filters:
-------------------------------------
  0 - output(nil), filter(nil), rowset=16
  1 - output(nil), filter(nil), rowset=16
      dop=20
  2 - output(nil), filter(nil)
      columns([{p4: ({idx1: (p4.c3, p4.c1)})}]), partitions(p0), 
      column_values([column_conv(INT,PS:(11,0),NULL,cast(p4.c1 + p4.c2, INT(-1, 0)))], [p4.c1])
  3 - output([column_conv(INT,PS:(11,0),NULL,cast(p4.c1 + p4.c2, INT(-1, 0)))], [p4.c1]), filter(nil), rowset=16
  4 - output([column_conv(INT,PS:(11,0),NULL,cast(p4.c1 + p4.c2, INT(-1, 0)))], [p4.c1]), filter(nil), rowset=16
      (#keys=2, [column_conv(INT,PS:(11,0),NULL,cast(p4.c1 + p4.c2, INT(-1, 0)))], [p4.c1]), dop=20
  5 - output([column_conv(INT,PS:(11,0),NULL,cast(p4.c1 + p4.c2, INT(-1, 0)))], [p4.c1]), filter(nil), rowset=16
  6 - output([column_conv(INT,PS:(11,0),NULL,cast(p4.c1 + p4.c2, INT(-1, 0)))], [p4.c1]), filter(nil)
      table_columns([{p4: ({idx1: (p4.c3, p4.c1)})}]), with_barrier
  7 - output([column_conv(INT,PS:(11,0),NULL,cast(p4.c1 + p4.c2, INT(-1, 0)))], [p4.c1], [p4.c3]), filter(nil), rowset=16
  8 - output([column_conv(INT,PS:(11,0),NULL,cast(p4.c1 + p4.c2, INT(-1, 0)))], [p4.c1], [p4.c3]), filter(nil), rowset=16
      (#keys=2, [p4.c3], [p4.c1]), dop=20
  9 - output([column_conv(INT,PS:(11,0),NULL,cast(p4.c1 + p4.c2, INT(-1, 0)))], [p4.c1], [p4.c3]), filter(nil), rowset=16
 10 - output([column_conv(INT,PS:(11,0),NULL,cast(p4.c1 + p4.c2, INT(-1, 0)))], [p4.c1], [p4.c3]), filter(nil)
      table_columns([{p4: ({p4: (p4.c1, p4.c2, p4.c3)})}]),
      update([p4.c3=column_conv(INT,PS:(11,0),NULL,cast(p4.c1 + p4.c2, INT(-1, 0)))])
 11 - output([p4.c1], [p4.c3], [PARTITION_ID], [p4.c2]), filter(nil), rowset=16
 12 - output([p4.c1], [p4.c3], [PARTITION_ID], [p4.c2]), filter(nil), rowset=16
      (#keys=1, [p4.c1]), dop=20
 13 - output([p4.c1], [p4.c3], [p4.c2]), filter(nil), rowset=16
 14 - output([p4.c1], [p4.c3], [p4.c2]), filter(nil), rowset=16
      access([p4.c1], [p4.c3], [p4.c2]), partitions(p[0-3])
      is_index_back=false, is_global_index=false, 
      range_key([p4.c1]), range(MIN ; MAX)always true
update /*+parallel(2),enable_parallel_dml*/ p4 set c3 = c1 + c2 where c1 > 1;
select * from p4;
c1	c2	c3
0	0	0
1	1	1
2	2	4
3	3	6
CREATE TABLE t1 (c1 int(11),c2 int(11),c3 int(11),c4 int(11),c5 int(11),c6 int(11),PRIMARY KEY (c1),KEY t1_i1 (c2, c1) GLOBAL,KEY t1_i2 (c3, c4) GLOBAL,KEY t1_i3 (c5) GLOBAL,KEY t1_i4 (c4, c5) GLOBAL) partition by hash(c1) partitions 3;
insert into t1 values (1,2,3,4,5,6),(10,20,30,40,50,60),(100,200,300,400,500,600),(1000,2000,3000,4000,5000,6000);
select * from p4 order by c1;
c1	c2	c3
0	0	0
1	1	1
2	2	4
3	3	6
explain basic update /*+ parallel(3) enable_parallel_dml */ t1 set c4 = 9;
Query Plan
=====================================================================================
|ID|OPERATOR                                                              |NAME     |
-------------------------------------------------------------------------------------
|0 |PX COORDINATOR                                                        |         |
|1 |└─EXCHANGE OUT DISTR                                                  |:EX10005 |
|2 |  └─INDEX INSERT                                                      |t1(t1_i4)|
|3 |    └─EXCHANGE IN DISTR                                               |         |
|4 |      └─EXCHANGE OUT DISTR (HASH)                                     |:EX10004 |
|5 |        └─MATERIAL                                                    |         |
|6 |          └─INDEX DELETE                                              |t1(t1_i4)|
|7 |            └─EXCHANGE IN DISTR                                       |         |
|8 |              └─EXCHANGE OUT DISTR (HASH)                             |:EX10003 |
|9 |                └─MATERIAL                                            |         |
|10|                  └─INDEX INSERT                                      |t1(t1_i2)|
|11|                    └─EXCHANGE IN DISTR                               |         |
|12|                      └─EXCHANGE OUT DISTR (HASH)                     |:EX10002 |
|13|                        └─MATERIAL                                    |         |
|14|                          └─INDEX DELETE                              |t1(t1_i2)|
|15|                            └─EXCHANGE IN DISTR                       |         |
|16|                              └─EXCHANGE OUT DISTR (HASH)             |:EX10001 |
|17|                                └─MATERIAL                            |         |
|18|                                  └─UPDATE                            |         |
|19|                                    └─EXCHANGE IN DISTR               |         |
|20|                                      └─EXCHANGE OUT DISTR (PKEY HASH)|:EX10000 |
|21|                                        └─PX BLOCK ITERATOR           |         |
|22|                                          └─TABLE FULL SCAN           |t1       |
=====================================================================================
Outputs & filters:
-------------------------------------
  0 - output(nil), filter(nil), rowset=16
  1 - output(nil), filter(nil), rowset=16
      dop=3
  2 - output(nil), filter(nil)
      columns([{t1: ({t1_i4: (t1.c4, t1.c5, t1.c1)})}]), partitions(p0), 
      column_values([column_conv(INT,PS:(11,0),NULL,9)], [t1.c5], [t1.c1])
  3 - output([t1.c5], [t1.c1]), filter(nil), rowset=16
  4 - output([t1.c5], [t1.c1]), filter(nil), rowset=16
      (#keys=3, [column_conv(INT,PS:(11,0),NULL,9)], [t1.c5], [t1.c1]), dop=3
  5 - output([t1.c5], [t1.c1]), filter(nil), rowset=16
  6 - output([t1.c5], [t1.c1]), filter(nil)
      table_columns([{t1: ({t1_i4: (t1.c4, t1.c5, t1.c1)})}]), with_barrier
  7 - output([t1.c5], [t1.c1], [t1.c4]), filter(nil), rowset=16
  8 - output([t1.c5], [t1.c1], [t1.c4]), filter(nil), rowset=16
      (#keys=3, [t1.c4], [t1.c5], [t1.c1]), dop=3
  9 - output([t1.c5], [t1.c1], [t1.c4]), filter(nil), rowset=16
 10 - output([t1.c5], [t1.c1], [t1.c4]), filter(nil)
      columns([{t1: ({t1_i2: (t1.c3, t1.c4, t1.c1)})}]), partitions(p0), 
      column_values([t1.c3], [column_conv(INT,PS:(11,0),NULL,9)], [t1.c1])
 11 - output([t1.c5], [t1.c1], [t1.c4], [t1.c3]), filter(nil), rowset=16
 12 - output([t1.c5], [t1.c1], [t1.c4], [t1.c3]), filter(nil), rowset=16
      (#keys=3, [t1.c3], [column_conv(INT,PS:(11,0),NULL,9)], [t1.c1]), dop=3
 13 - output([t1.c5], [t1.c1], [t1.c4], [t1.c3]), filter(nil), rowset=16
 14 - output([t1.c5], [t1.c1], [t1.c4], [t1.c3]), filter(nil)
      table_columns([{t1: ({t1_i2: (t1.c3, t1.c4, t1.c1)})}]), with_barrier
 15 - output([t1.c5], [t1.c1], [t1.c4], [t1.c3]), filter(nil), rowset=16
 16 - output([t1.c5], [t1.c1], [t1.c4], [t1.c3]), filter(nil), rowset=16
      (#keys=3, [t1.c3], [t1.c4], [t1.c1]), dop=3
 17 - output([t1.c5], [t1.c1], [t1.c4], [t1.c3]), filter(nil), rowset=16
 18 - output([t1.c5], [t1.c1], [t1.c4], [t1.c3]), filter(nil)
      table_columns([{t1: ({t1: (t1.c1, t1.c2, t1.c3, t1.c4, t1.c5, t1.c6)})}]),
      update([t1.c4=column_conv(INT,PS:(11,0),NULL,9)])
 19 - output([t1.c5], [t1.c1], [t1.c4], [t1.c3], [PARTITION_ID], [t1.c2], [t1.c6]), filter(nil), rowset=16
 20 - output([t1.c5], [t1.c1], [t1.c4], [t1.c3], [PARTITION_ID], [t1.c2], [t1.c6]), filter(nil), rowset=16
      (#keys=1, [t1.c1]), dop=3
 21 - output([t1.c1], [t1.c4], [t1.c2], [t1.c3], [t1.c5], [t1.c6]), filter(nil), rowset=16
 22 - output([t1.c1], [t1.c4], [t1.c2], [t1.c3], [t1.c5], [t1.c6]), filter(nil), rowset=16
      access([t1.c1], [t1.c4], [t1.c2], [t1.c3], [t1.c5], [t1.c6]), partitions(p[0-2])
      is_index_back=false, is_global_index=false, 
      range_key([t1.c1]), range(MIN ; MAX)always true
update /*+ parallel(3) enable_parallel_dml */ t1 set c4  = 91;
select * from t1 order by c1;
c1	c2	c3	c4	c5	c6
1	2	3	91	5	6
10	20	30	91	50	60
100	200	300	91	500	600
1000	2000	3000	91	5000	6000
explain basic update /*+ parallel(3) enable_parallel_dml */ t1 set c4 = 9,c3=12;
Query Plan
=====================================================================================
|ID|OPERATOR                                                              |NAME     |
-------------------------------------------------------------------------------------
|0 |PX COORDINATOR                                                        |         |
|1 |└─EXCHANGE OUT DISTR                                                  |:EX10005 |
|2 |  └─INDEX INSERT                                                      |t1(t1_i4)|
|3 |    └─EXCHANGE IN DISTR                                               |         |
|4 |      └─EXCHANGE OUT DISTR (HASH)                                     |:EX10004 |
|5 |        └─MATERIAL                                                    |         |
|6 |          └─INDEX DELETE                                              |t1(t1_i4)|
|7 |            └─EXCHANGE IN DISTR                                       |         |
|8 |              └─EXCHANGE OUT DISTR (HASH)                             |:EX10003 |
|9 |                └─MATERIAL                                            |         |
|10|                  └─INDEX INSERT                                      |t1(t1_i2)|
|11|                    └─EXCHANGE IN DISTR                               |         |
|12|                      └─EXCHANGE OUT DISTR (HASH)                     |:EX10002 |
|13|                        └─MATERIAL                                    |         |
|14|                          └─INDEX DELETE                              |t1(t1_i2)|
|15|                            └─EXCHANGE IN DISTR                       |         |
|16|                              └─EXCHANGE OUT DISTR (HASH)             |:EX10001 |
|17|                                └─MATERIAL                            |         |
|18|                                  └─UPDATE                            |         |
|19|                                    └─EXCHANGE IN DISTR               |         |
|20|                                      └─EXCHANGE OUT DISTR (PKEY HASH)|:EX10000 |
|21|                                        └─PX BLOCK ITERATOR           |         |
|22|                                          └─TABLE FULL SCAN           |t1       |
=====================================================================================
Outputs & filters:
-------------------------------------
  0 - output(nil), filter(nil), rowset=16
  1 - output(nil), filter(nil), rowset=16
      dop=3
  2 - output(nil), filter(nil)
      columns([{t1: ({t1_i4: (t1.c4, t1.c5, t1.c1)})}]), partitions(p0), 
      column_values([column_conv(INT,PS:(11,0),NULL,9)], [t1.c5], [t1.c1])
  3 - output([t1.c5], [t1.c1]), filter(nil), rowset=16
  4 - output([t1.c5], [t1.c1]), filter(nil), rowset=16
      (#keys=3, [column_conv(INT,PS:(11,0),NULL,9)], [t1.c5], [t1.c1]), dop=3
  5 - output([t1.c5], [t1.c1]), filter(nil), rowset=16
  6 - output([t1.c5], [t1.c1]), filter(nil)
      table_columns([{t1: ({t1_i4: (t1.c4, t1.c5, t1.c1)})}]), with_barrier
  7 - output([t1.c5], [t1.c1], [t1.c4]), filter(nil), rowset=16
  8 - output([t1.c5], [t1.c1], [t1.c4]), filter(nil), rowset=16
      (#keys=3, [t1.c4], [t1.c5], [t1.c1]), dop=3
  9 - output([t1.c5], [t1.c1], [t1.c4]), filter(nil), rowset=16
 10 - output([t1.c5], [t1.c1], [t1.c4]), filter(nil)
      columns([{t1: ({t1_i2: (t1.c3, t1.c4, t1.c1)})}]), partitions(p0), 
      column_values([column_conv(INT,PS:(11,0),NULL,12)], [column_conv(INT,PS:(11,0),NULL,9)], [t1.c1])
 11 - output([t1.c5], [t1.c1], [t1.c4]), filter(nil), rowset=16
 12 - output([t1.c5], [t1.c1], [t1.c4]), filter(nil), rowset=16
      (#keys=3, [column_conv(INT,PS:(11,0),NULL,12)], [column_conv(INT,PS:(11,0),NULL,9)], [t1.c1]), dop=3
 13 - output([t1.c5], [t1.c1], [t1.c4]), filter(nil), rowset=16
 14 - output([t1.c5], [t1.c1], [t1.c4]), filter(nil)
      table_columns([{t1: ({t1_i2: (t1.c3, t1.c4, t1.c1)})}]), with_barrier
 15 - output([t1.c5], [t1.c1], [t1.c4], [t1.c3]), filter(nil), rowset=16
 16 - output([t1.c5], [t1.c1], [t1.c4], [t1.c3]), filter(nil), rowset=16
      (#keys=3, [t1.c3], [t1.c4], [t1.c1]), dop=3
 17 - output([t1.c5], [t1.c1], [t1.c4], [t1.c3]), filter(nil), rowset=16
 18 - output([t1.c5], [t1.c1], [t1.c4], [t1.c3]), filter(nil)
      table_columns([{t1: ({t1: (t1.c1, t1.c2, t1.c3, t1.c4, t1.c5, t1.c6)})}]),
      update([t1.c4=column_conv(INT,PS:(11,0),NULL,9)], [t1.c3=column_conv(INT,PS:(11,0),NULL,12)])
 19 - output([t1.c5], [t1.c1], [t1.c4], [t1.c3], [PARTITION_ID], [t1.c2], [t1.c6]), filter(nil), rowset=16
 20 - output([t1.c5], [t1.c1], [t1.c4], [t1.c3], [PARTITION_ID], [t1.c2], [t1.c6]), filter(nil), rowset=16
      (#keys=1, [t1.c1]), dop=3
 21 - output([t1.c1], [t1.c4], [t1.c3], [t1.c2], [t1.c5], [t1.c6]), filter(nil), rowset=16
 22 - output([t1.c1], [t1.c4], [t1.c3], [t1.c2], [t1.c5], [t1.c6]), filter(nil), rowset=16
      access([t1.c1], [t1.c4], [t1.c3], [t1.c2], [t1.c5], [t1.c6]), partitions(p[0-2])
      is_index_back=false, is_global_index=false, 
      range_key([t1.c1]), range(MIN ; MAX)always true
update /*+ parallel(3) enable_parallel_dml */ t1 set c4  = 91,c3=12;
select * from t1;
c1	c2	c3	c4	c5	c6
1	2	12	91	5	6
10	20	12	91	50	60
100	200	12	91	500	600
1000	2000	12	91	5000	6000
drop table t1;
create table t1(a int, b int);
insert into t1 values(1, 1), (2, 2), (3, 3);
create index i1 on t1(a, b) partition by hash(b) partitions 1;
update /*+parallel(2) enable_parallel_dml*/ t1 set a=3;
select /*+index(t1 primary)*/ a, b from t1;
a	b
3	1
3	2
3	3
select /*+index(t1 i1)*/ a, b from t1;
a	b
3	1
3	2
3	3
delete from t1;
drop table t1;
alter system set_tp tp_no = 217, error_code = 1234, frequency = 0;
