drop table t1;
drop table t2;
# with implicit autoinc column
create table t1 (c1 int, c2 int) partition by hash(c1) partitions 3;
explain insert into t1 values (1,1),(2,2),(3,3),(4,4),(5,5);
Query Plan
==================================================
|ID|OPERATOR          |NAME|EST.ROWS|EST.TIME(us)|
--------------------------------------------------
|0 |DISTRIBUTED INSERT|    |5       |39          |
|1 |└─EXPRESSION      |    |5       |1           |
==================================================
Outputs & filters:
-------------------------------------
  0 - output(nil), filter(nil)
      columns([{t1: ({t1: (t1.__pk_increment, t1.c1, t1.c2)})}]), 
      column_values([T_HIDDEN_PK], [column_conv(INT,PS:(11,0),NULL,__values.c1)], [column_conv(INT,PS:(11,0),NULL,__values.c2)])
  1 - output([__values.c1], [__values.c2]), filter(nil)
      values({1, 1}, {2, 2}, {3, 3}, {4, 4}, {5, 5})
insert into t1 values (1,1),(2,2),(3,3),(4,4),(5,5);
select * from t1;
c1	c2
1	1
2	2
3	3
4	4
5	5
delete from t1;
explain insert /*+ parallel(2) */ into t1 values (1,1),(2,2),(3,3),(4,4),(5,5);
Query Plan
==================================================
|ID|OPERATOR          |NAME|EST.ROWS|EST.TIME(us)|
--------------------------------------------------
|0 |DISTRIBUTED INSERT|    |5       |39          |
|1 |└─EXPRESSION      |    |5       |1           |
==================================================
Outputs & filters:
-------------------------------------
  0 - output(nil), filter(nil)
      columns([{t1: ({t1: (t1.__pk_increment, t1.c1, t1.c2)})}]), 
      column_values([T_HIDDEN_PK], [column_conv(INT,PS:(11,0),NULL,__values.c1)], [column_conv(INT,PS:(11,0),NULL,__values.c2)])
  1 - output([__values.c1], [__values.c2]), filter(nil)
      values({1, 1}, {2, 2}, {3, 3}, {4, 4}, {5, 5})
insert  /*+ parallel(2) */ into t1 values (1,1),(2,2),(3,3),(4,4),(5,5);
select * from t1;
c1	c2
1	1
2	2
3	3
4	4
5	5
delete from t1;
explain insert /*+ parallel(2) enable_parallel_dml */ into t1 values (1,1),(2,2),(3,3),(4,4),(5,5);
Query Plan
==================================================
|ID|OPERATOR          |NAME|EST.ROWS|EST.TIME(us)|
--------------------------------------------------
|0 |DISTRIBUTED INSERT|    |5       |39          |
|1 |└─EXPRESSION      |    |5       |1           |
==================================================
Outputs & filters:
-------------------------------------
  0 - output(nil), filter(nil)
      columns([{t1: ({t1: (t1.__pk_increment, t1.c1, t1.c2)})}]), 
      column_values([T_HIDDEN_PK], [column_conv(INT,PS:(11,0),NULL,__values.c1)], [column_conv(INT,PS:(11,0),NULL,__values.c2)])
  1 - output([__values.c1], [__values.c2]), filter(nil)
      values({1, 1}, {2, 2}, {3, 3}, {4, 4}, {5, 5})
insert  /*+ parallel(2) enable_parallel_dml */ into t1 values (1,1),(2,2),(3,3),(4,4),(5,5);
select * from t1;
c1	c2
1	1
2	2
3	3
4	4
5	5
set _force_parallel_dml_dop = 3;
delete from t1;
explain insert into t1 values (1,1),(2,2),(3,3),(4,4),(5,5);
Query Plan
==================================================
|ID|OPERATOR          |NAME|EST.ROWS|EST.TIME(us)|
--------------------------------------------------
|0 |DISTRIBUTED INSERT|    |5       |39          |
|1 |└─EXPRESSION      |    |5       |1           |
==================================================
Outputs & filters:
-------------------------------------
  0 - output(nil), filter(nil)
      columns([{t1: ({t1: (t1.__pk_increment, t1.c1, t1.c2)})}]), 
      column_values([T_HIDDEN_PK], [column_conv(INT,PS:(11,0),NULL,__values.c1)], [column_conv(INT,PS:(11,0),NULL,__values.c2)])
  1 - output([__values.c1], [__values.c2]), filter(nil)
      values({1, 1}, {2, 2}, {3, 3}, {4, 4}, {5, 5})
insert into t1 values (1,1),(2,2),(3,3),(4,4),(5,5);
select * from t1;
c1	c2
1	1
2	2
3	3
4	4
5	5
# with primary key, no auto inc column
set _force_parallel_dml_dop = 1;
create table t2 (c1 int primary key, c2 int) partition by hash(c1) partitions 3;
explain insert into t2 values (1,1),(2,2),(3,3),(4,4),(5,5);
Query Plan
==================================================
|ID|OPERATOR          |NAME|EST.ROWS|EST.TIME(us)|
--------------------------------------------------
|0 |DISTRIBUTED INSERT|    |5       |39          |
|1 |└─EXPRESSION      |    |5       |1           |
==================================================
Outputs & filters:
-------------------------------------
  0 - output(nil), filter(nil)
      columns([{t2: ({t2: (t2.c1, t2.c2)})}]), 
      column_values([column_conv(INT,PS:(11,0),NOT NULL,__values.c1)], [column_conv(INT,PS:(11,0),NULL,__values.c2)])
  1 - output([__values.c1], [__values.c2]), filter(nil)
      values({1, 1}, {2, 2}, {3, 3}, {4, 4}, {5, 5})
insert into t2 values (1,1),(2,2),(3,3),(4,4),(5,5);
select * from t1;
c1	c2
1	1
2	2
3	3
4	4
5	5
delete from t2;
explain insert /*+ parallel(2) */ into t2 values (1,1),(2,2),(3,3),(4,4),(5,5);
Query Plan
==================================================
|ID|OPERATOR          |NAME|EST.ROWS|EST.TIME(us)|
--------------------------------------------------
|0 |DISTRIBUTED INSERT|    |5       |39          |
|1 |└─EXPRESSION      |    |5       |1           |
==================================================
Outputs & filters:
-------------------------------------
  0 - output(nil), filter(nil)
      columns([{t2: ({t2: (t2.c1, t2.c2)})}]), 
      column_values([column_conv(INT,PS:(11,0),NOT NULL,__values.c1)], [column_conv(INT,PS:(11,0),NULL,__values.c2)])
  1 - output([__values.c1], [__values.c2]), filter(nil)
      values({1, 1}, {2, 2}, {3, 3}, {4, 4}, {5, 5})
insert  /*+ parallel(2) */ into t2 values (1,1),(2,2),(3,3),(4,4),(5,5);
select * from t1;
c1	c2
1	1
2	2
3	3
4	4
5	5
delete from t2;
explain insert /*+ parallel(2) enable_parallel_dml */ into t2 values (1,1),(2,2),(3,3),(4,4),(5,5);
Query Plan
==================================================
|ID|OPERATOR          |NAME|EST.ROWS|EST.TIME(us)|
--------------------------------------------------
|0 |DISTRIBUTED INSERT|    |5       |39          |
|1 |└─EXPRESSION      |    |5       |1           |
==================================================
Outputs & filters:
-------------------------------------
  0 - output(nil), filter(nil)
      columns([{t2: ({t2: (t2.c1, t2.c2)})}]), 
      column_values([column_conv(INT,PS:(11,0),NOT NULL,__values.c1)], [column_conv(INT,PS:(11,0),NULL,__values.c2)])
  1 - output([__values.c1], [__values.c2]), filter(nil)
      values({1, 1}, {2, 2}, {3, 3}, {4, 4}, {5, 5})
insert  /*+ parallel(2) enable_parallel_dml */ into t2 values (1,1),(2,2),(3,3),(4,4),(5,5);
select * from t1;
c1	c2
1	1
2	2
3	3
4	4
5	5
set _force_parallel_dml_dop = 3;
delete from t2;
explain insert into t2 values (1,1),(2,2),(3,3),(4,4),(5,5);
Query Plan
==================================================
|ID|OPERATOR          |NAME|EST.ROWS|EST.TIME(us)|
--------------------------------------------------
|0 |DISTRIBUTED INSERT|    |5       |39          |
|1 |└─EXPRESSION      |    |5       |1           |
==================================================
Outputs & filters:
-------------------------------------
  0 - output(nil), filter(nil)
      columns([{t2: ({t2: (t2.c1, t2.c2)})}]), 
      column_values([column_conv(INT,PS:(11,0),NOT NULL,__values.c1)], [column_conv(INT,PS:(11,0),NULL,__values.c2)])
  1 - output([__values.c1], [__values.c2]), filter(nil)
      values({1, 1}, {2, 2}, {3, 3}, {4, 4}, {5, 5})
insert into t2 values (1,1),(2,2),(3,3),(4,4),(5,5);
select * from t1;
c1	c2
1	1
2	2
3	3
4	4
5	5
