#Environmental cleaning
DROP USER wmj456@'%';
DROP DATABASE obwmjtest;
DROP DATABASE obwmjtest2;
CREATE DATABASE obwmjtest;
CREATE USER wmj456 IDENTIFIED BY 'wmj456';
GRANT ALL ON *.* TO wmj456 WITH GRANT OPTION;
DROP TABLE t1;
DROP TEMPORARY TABLE t1;
DROP TABLE t2;
DROP TABLE obwmjtest2.t1;
DROP VIEW obwmjtest2.t1_view;
DROP TABLE t8;
DROP TABLE t8_dup;
DROP VIEW t8_view;
DROP TABLE t9;
DROP VIEW t9_view;
DROP TABLE t10;
DROP VIEW t10_view;
DROP TABLE t12;
DROP VIEW t12_view;
DROP FUNCTION f_test;
DROP PROCEDURE p_test;
CREATE TABLE t1(
a bigint,
b date
)partition by range columns(b) 
( 
partition part_1 values less than ('2016-09-01'),
partition part_2 values less than ('2020-09-01'),
partition part_3 values less than ('2021-09-01')
);
CREATE VIEW t1_view AS SELECT * FROM t1;
CREATE TABLE t9(
id BIGINT,
brand VARCHAR(255) DEFAULT '中国',
color int NOT NULL,
primary key (id,brand)
);
CREATE VIEW t9_view AS SELECT * FROM t9,t1_view WHERE t1_view.a=t9.id ORDER BY t1_view.a;
SELECT TABLE_NAME,COLUMN_NAME,ORDINAL_POSITION,COLUMN_DEFAULT FROM INFORMATION_SCHEMA.COLUMNS WHERE TABLE_NAME='t9_view' AND TABLE_SCHEMA='obwmjtest';
TABLE_NAME	COLUMN_NAME	ORDINAL_POSITION	COLUMN_DEFAULT
t9_view	id	1	NULL
t9_view	brand	2	中国
t9_view	color	3	NULL
t9_view	a	4	NULL
t9_view	b	5	NULL
SELECT COLUMN_TYPE,COLUMN_NAME,IS_NULLABLE,COLUMN_KEY,EXTRA FROM INFORMATION_SCHEMA.COLUMNS WHERE TABLE_NAME='t9_view' AND TABLE_SCHEMA='obwmjtest';
COLUMN_TYPE	COLUMN_NAME	IS_NULLABLE	COLUMN_KEY	EXTRA
bigint(20)	id	NO		
varchar(255)	brand	NO		
int(11)	color	NO		
bigint(20)	a	YES		
date	b	YES		
SELECT COLUMN_TYPE,DATA_TYPE,COLUMN_COMMENT,GENERATION_EXPRESSION FROM INFORMATION_SCHEMA.COLUMNS WHERE TABLE_NAME='t9_view' AND TABLE_SCHEMA='obwmjtest';
COLUMN_TYPE	DATA_TYPE	COLUMN_COMMENT	GENERATION_EXPRESSION
bigint(20)	bigint		
varchar(255)	varchar		
int(11)	int		
bigint(20)	bigint		
date	date		
DROP TABLE t9;
DROP TABLE t1;
DROP VIEW t1_view;
DROP VIEW t9_view;
CREATE TABLE t1(
a bigint,
b date
)partition by range columns(b) 
( 
partition part_1 values less than ('2016-09-01'),
partition part_2 values less than ('2020-09-01'),
partition part_3 values less than ('2021-09-01')
);
CREATE VIEW t1_view AS SELECT * FROM t1;
CREATE TABLE t9(
id BIGINT,
brand VARCHAR(255) DEFAULT '中国',
color int NOT NULL,
primary key (id,brand)
);
CREATE VIEW t9_view AS SELECT * FROM t9 LEFT JOIN t1_view ON t1_view.a=t9.id ORDER BY t1_view.a;
SELECT TABLE_NAME,COLUMN_NAME,ORDINAL_POSITION,COLUMN_DEFAULT FROM INFORMATION_SCHEMA.COLUMNS WHERE TABLE_NAME='t9_view' AND TABLE_SCHEMA='obwmjtest';
TABLE_NAME	COLUMN_NAME	ORDINAL_POSITION	COLUMN_DEFAULT
t9_view	id	1	NULL
t9_view	brand	2	中国
t9_view	color	3	NULL
t9_view	a	4	NULL
t9_view	b	5	NULL
SELECT COLUMN_TYPE,COLUMN_NAME,IS_NULLABLE,COLUMN_KEY,EXTRA FROM INFORMATION_SCHEMA.COLUMNS WHERE TABLE_NAME='t9_view' AND TABLE_SCHEMA='obwmjtest';
COLUMN_TYPE	COLUMN_NAME	IS_NULLABLE	COLUMN_KEY	EXTRA
bigint(20)	id	NO		
varchar(255)	brand	NO		
int(11)	color	NO		
bigint(20)	a	YES		
date	b	YES		
SELECT COLUMN_TYPE,DATA_TYPE,COLUMN_COMMENT,GENERATION_EXPRESSION FROM INFORMATION_SCHEMA.COLUMNS WHERE TABLE_NAME='t9_view' AND TABLE_SCHEMA='obwmjtest';
COLUMN_TYPE	DATA_TYPE	COLUMN_COMMENT	GENERATION_EXPRESSION
bigint(20)	bigint		
varchar(255)	varchar		
int(11)	int		
bigint(20)	bigint		
date	date		
DROP TABLE t9;
DROP TABLE t1;
DROP VIEW t1_view;
DROP VIEW t9_view;
CREATE TABLE t1(
a bigint,
b date
)partition by range columns(b) 
( 
partition part_1 values less than ('2016-09-01'),
partition part_2 values less than ('2020-09-01'),
partition part_3 values less than ('2021-09-01')
);
CREATE VIEW t1_view AS SELECT * FROM t1;
CREATE TABLE t9(
id BIGINT,
brand VARCHAR(255) DEFAULT '中国',
color int NOT NULL,
primary key (id,brand)
);
CREATE VIEW t9_view AS SELECT * FROM t1_view right JOIN t9 ON t1_view.a=t9.id ORDER BY t1_view.a;
SELECT TABLE_NAME,COLUMN_NAME,ORDINAL_POSITION,COLUMN_DEFAULT FROM INFORMATION_SCHEMA.COLUMNS WHERE TABLE_NAME='t9_view' AND TABLE_SCHEMA='obwmjtest';
TABLE_NAME	COLUMN_NAME	ORDINAL_POSITION	COLUMN_DEFAULT
t9_view	a	1	NULL
t9_view	b	2	NULL
t9_view	id	3	NULL
t9_view	brand	4	中国
t9_view	color	5	NULL
SELECT COLUMN_TYPE,COLUMN_NAME,IS_NULLABLE,COLUMN_KEY,EXTRA FROM INFORMATION_SCHEMA.COLUMNS WHERE TABLE_NAME='t9_view' AND TABLE_SCHEMA='obwmjtest';
COLUMN_TYPE	COLUMN_NAME	IS_NULLABLE	COLUMN_KEY	EXTRA
bigint(20)	a	YES		
date	b	YES		
bigint(20)	id	NO		
varchar(255)	brand	NO		
int(11)	color	NO		
SELECT COLUMN_TYPE,DATA_TYPE,COLUMN_COMMENT,GENERATION_EXPRESSION FROM INFORMATION_SCHEMA.COLUMNS WHERE TABLE_NAME='t9_view' AND TABLE_SCHEMA='obwmjtest';
COLUMN_TYPE	DATA_TYPE	COLUMN_COMMENT	GENERATION_EXPRESSION
bigint(20)	bigint		
date	date		
bigint(20)	bigint		
varchar(255)	varchar		
int(11)	int		
DROP TABLE t9;
DROP TABLE t1;
DROP VIEW t1_view;
DROP VIEW t9_view;
CREATE TABLE t1(
a bigint,
b date
)partition by range columns(b) 
( 
partition part_1 values less than ('2016-09-01'),
partition part_2 values less than ('2020-09-01'),
partition part_3 values less than ('2021-09-01')
);
CREATE VIEW t1_view AS SELECT * FROM t1;
CREATE TABLE t9(
id BIGINT,
brand VARCHAR(255) DEFAULT '中国',
color int NOT NULL,
primary key (id,brand)
);
CREATE VIEW t9_view AS SELECT * FROM t1_view CROSS JOIN t9;
SELECT TABLE_NAME,COLUMN_NAME,ORDINAL_POSITION,COLUMN_DEFAULT FROM INFORMATION_SCHEMA.COLUMNS WHERE TABLE_NAME='t9_view' AND TABLE_SCHEMA='obwmjtest';
TABLE_NAME	COLUMN_NAME	ORDINAL_POSITION	COLUMN_DEFAULT
t9_view	a	1	NULL
t9_view	b	2	NULL
t9_view	id	3	NULL
t9_view	brand	4	中国
t9_view	color	5	NULL
SELECT COLUMN_TYPE,COLUMN_NAME,IS_NULLABLE,COLUMN_KEY,EXTRA FROM INFORMATION_SCHEMA.COLUMNS WHERE TABLE_NAME='t9_view' AND TABLE_SCHEMA='obwmjtest';
COLUMN_TYPE	COLUMN_NAME	IS_NULLABLE	COLUMN_KEY	EXTRA
bigint(20)	a	YES		
date	b	YES		
bigint(20)	id	NO		
varchar(255)	brand	NO		
int(11)	color	NO		
SELECT COLUMN_TYPE,DATA_TYPE,COLUMN_COMMENT,GENERATION_EXPRESSION FROM INFORMATION_SCHEMA.COLUMNS WHERE TABLE_NAME='t9_view' AND TABLE_SCHEMA='obwmjtest';
COLUMN_TYPE	DATA_TYPE	COLUMN_COMMENT	GENERATION_EXPRESSION
bigint(20)	bigint		
date	date		
bigint(20)	bigint		
varchar(255)	varchar		
int(11)	int		
DROP TABLE t9;
DROP TABLE t1;
DROP VIEW t1_view;
DROP VIEW t9_view;
CREATE TABLE t1(
a bigint,
b date
)partition by range columns(b) 
( 
partition part_1 values less than ('2016-09-01'),
partition part_2 values less than ('2020-09-01'),
partition part_3 values less than ('2021-09-01')
);
CREATE VIEW t1_view AS SELECT * FROM t1;
CREATE TABLE t9(
id BIGINT,
brand VARCHAR(255) DEFAULT '中国',
color int NOT NULL,
primary key (id,brand)
);
CREATE VIEW t9_view AS SELECT * FROM t1_view NATURAL JOIN t9;
SELECT TABLE_NAME,COLUMN_NAME,ORDINAL_POSITION,COLUMN_DEFAULT FROM INFORMATION_SCHEMA.COLUMNS WHERE TABLE_NAME='t9_view' AND TABLE_SCHEMA='obwmjtest';
TABLE_NAME	COLUMN_NAME	ORDINAL_POSITION	COLUMN_DEFAULT
t9_view	a	1	NULL
t9_view	b	2	NULL
t9_view	id	3	NULL
t9_view	brand	4	中国
t9_view	color	5	NULL
SELECT COLUMN_TYPE,COLUMN_NAME,IS_NULLABLE,COLUMN_KEY,EXTRA FROM INFORMATION_SCHEMA.COLUMNS WHERE TABLE_NAME='t9_view' AND TABLE_SCHEMA='obwmjtest';
COLUMN_TYPE	COLUMN_NAME	IS_NULLABLE	COLUMN_KEY	EXTRA
bigint(20)	a	YES		
date	b	YES		
bigint(20)	id	NO		
varchar(255)	brand	NO		
int(11)	color	NO		
SELECT COLUMN_TYPE,DATA_TYPE,COLUMN_COMMENT,GENERATION_EXPRESSION FROM INFORMATION_SCHEMA.COLUMNS WHERE TABLE_NAME='t9_view' AND TABLE_SCHEMA='obwmjtest';
COLUMN_TYPE	DATA_TYPE	COLUMN_COMMENT	GENERATION_EXPRESSION
bigint(20)	bigint		
date	date		
bigint(20)	bigint		
varchar(255)	varchar		
int(11)	int		
DROP TABLE t9;
DROP TABLE t1;
DROP VIEW t1_view;
DROP VIEW t9_view;
CREATE TABLE t1(
dd INT,
name VARCHAR(20)
) PARTITION BY KEY(dd) PARTITIONS 2;
CREATE VIEW t1_view AS SELECT * FROM t1;
CREATE TABLE t8(
id BIGINT,
brand VARCHAR(255) DEFAULT '中国',
color int NOT NULL,
primary key (id,brand)
);
CREATE VIEW t8_view AS SELECT * FROM t8;
CREATE VIEW t9_view AS SELECT * FROM t1_view,t8_view;
SELECT TABLE_NAME,COLUMN_NAME,ORDINAL_POSITION,COLUMN_DEFAULT FROM INFORMATION_SCHEMA.COLUMNS WHERE TABLE_NAME='t9_view' AND TABLE_SCHEMA='obwmjtest';
TABLE_NAME	COLUMN_NAME	ORDINAL_POSITION	COLUMN_DEFAULT
t9_view	dd	1	NULL
t9_view	name	2	NULL
t9_view	id	3	NULL
t9_view	brand	4	中国
t9_view	color	5	NULL
SELECT COLUMN_TYPE,COLUMN_NAME,IS_NULLABLE,COLUMN_KEY,EXTRA FROM INFORMATION_SCHEMA.COLUMNS WHERE TABLE_NAME='t9_view' AND TABLE_SCHEMA='obwmjtest';
COLUMN_TYPE	COLUMN_NAME	IS_NULLABLE	COLUMN_KEY	EXTRA
int(11)	dd	YES		
varchar(20)	name	YES		
bigint(20)	id	NO		
varchar(255)	brand	NO		
int(11)	color	NO		
SELECT COLUMN_TYPE,COLUMN_COMMENT,GENERATION_EXPRESSION FROM INFORMATION_SCHEMA.COLUMNS WHERE TABLE_NAME='t9_view' AND TABLE_SCHEMA='obwmjtest';
COLUMN_TYPE	COLUMN_COMMENT	GENERATION_EXPRESSION
int(11)		
varchar(20)		
bigint(20)		
varchar(255)		
int(11)		
DROP TABLE t8;
DROP TABLE t1;
DROP VIEW t9_view;
DROP VIEW t8_view;
DROP VIEW t1_view;
CREATE TABLE t1(
dd INT,
name VARCHAR(20)
) PARTITION BY KEY(dd) PARTITIONS 2;
CREATE VIEW t1_view AS SELECT * FROM t1;
CREATE TABLE t8(
id BIGINT,
brand VARCHAR(255) DEFAULT '中国',
color int NOT NULL,
primary key (id,brand)
);
CREATE VIEW t8_view AS SELECT * FROM t8;
CREATE VIEW t9_view AS SELECT * FROM t8_view RIGHT JOIN t1_view ON t1_view.dd=t8_view.id;
SELECT TABLE_NAME,COLUMN_NAME,ORDINAL_POSITION,COLUMN_DEFAULT FROM INFORMATION_SCHEMA.COLUMNS WHERE TABLE_NAME='t9_view' AND TABLE_SCHEMA='obwmjtest';
TABLE_NAME	COLUMN_NAME	ORDINAL_POSITION	COLUMN_DEFAULT
t9_view	id	1	NULL
t9_view	brand	2	中国
t9_view	color	3	NULL
t9_view	dd	4	NULL
t9_view	name	5	NULL
SELECT COLUMN_TYPE,COLUMN_NAME,IS_NULLABLE,COLUMN_KEY,EXTRA FROM INFORMATION_SCHEMA.COLUMNS WHERE TABLE_NAME='t9_view' AND TABLE_SCHEMA='obwmjtest';
COLUMN_TYPE	COLUMN_NAME	IS_NULLABLE	COLUMN_KEY	EXTRA
bigint(20)	id	NO		
varchar(255)	brand	NO		
int(11)	color	NO		
int(11)	dd	YES		
varchar(20)	name	YES		
SELECT COLUMN_TYPE,COLUMN_COMMENT,GENERATION_EXPRESSION FROM INFORMATION_SCHEMA.COLUMNS WHERE TABLE_NAME='t9_view' AND TABLE_SCHEMA='obwmjtest';
COLUMN_TYPE	COLUMN_COMMENT	GENERATION_EXPRESSION
bigint(20)		
varchar(255)		
int(11)		
int(11)		
varchar(20)		
DROP TABLE t8;
DROP TABLE t1;
DROP VIEW t9_view;
DROP VIEW t8_view;
DROP VIEW t1_view;
CREATE DATABASE obwmjtest2;
CREATE TABLE obwmjtest2.t1(
dd INT PRIMARY KEY,
name VARCHAR(20) NOT NULL
) PARTITION BY KEY(dd) PARTITIONS 2;
CREATE VIEW obwmjtest2.t1_view AS SELECT * FROM obwmjtest2.t1;
CREATE TABLE t8(
id BIGINT,
brand VARCHAR(255) DEFAULT '中国',
color int NOT NULL COMMENT 'COLOR FIELD',
primary key (id,brand)
);
CREATE VIEW t8_view AS SELECT * FROM t8;
CREATE VIEW t9_view AS SELECT * FROM t8_view RIGHT JOIN obwmjtest2.t1_view ON obwmjtest2.t1_view.dd=t8_view.id;
SELECT TABLE_NAME,COLUMN_NAME,ORDINAL_POSITION,COLUMN_DEFAULT FROM INFORMATION_SCHEMA.COLUMNS WHERE TABLE_NAME='t9_view' AND TABLE_SCHEMA='obwmjtest';
TABLE_NAME	COLUMN_NAME	ORDINAL_POSITION	COLUMN_DEFAULT
t9_view	id	1	NULL
t9_view	brand	2	中国
t9_view	color	3	NULL
t9_view	dd	4	NULL
t9_view	name	5	NULL
SELECT COLUMN_TYPE,COLUMN_NAME,IS_NULLABLE,COLUMN_KEY,EXTRA FROM INFORMATION_SCHEMA.COLUMNS WHERE TABLE_NAME='t9_view' AND TABLE_SCHEMA='obwmjtest';
COLUMN_TYPE	COLUMN_NAME	IS_NULLABLE	COLUMN_KEY	EXTRA
bigint(20)	id	NO		
varchar(255)	brand	NO		
int(11)	color	NO		
int(11)	dd	NO		
varchar(20)	name	NO		
SELECT COLUMN_TYPE,COLUMN_COMMENT,GENERATION_EXPRESSION FROM INFORMATION_SCHEMA.COLUMNS WHERE TABLE_NAME='t9_view' AND TABLE_SCHEMA='obwmjtest';
COLUMN_TYPE	COLUMN_COMMENT	GENERATION_EXPRESSION
bigint(20)		
varchar(255)		
int(11)		
int(11)		
varchar(20)		
DROP TABLE t8;
DROP TABLE obwmjtest2.t1;
DROP VIEW t9_view;
DROP VIEW t8_view;
DROP VIEW obwmjtest2.t1_view;
DROP DATABASE obwmjtest2;
CREATE DATABASE obwmjtest2;
CREATE TABLE obwmjtest2.t1(
dd INT PRIMARY KEY,
name VARCHAR(20) NOT NULL
) PARTITION BY KEY(dd) PARTITIONS 2;
CREATE VIEW obwmjtest2.t1_view AS SELECT * FROM obwmjtest2.t1;
CREATE TABLE t8(
id BIGINT,
brand VARCHAR(255) DEFAULT '中国',
color int NOT NULL COMMENT 'COLOR FIELD',
primary key (id,brand)
);
CREATE VIEW t8_view AS SELECT * FROM t8;
CREATE VIEW t9_view AS SELECT * FROM obwmjtest2.t1_view RIGHT JOIN t8_view ON obwmjtest2.t1_view.dd=t8_view.id;
DROP DATABASE obwmjtest2;
SELECT TABLE_NAME,COLUMN_NAME,ORDINAL_POSITION,COLUMN_DEFAULT FROM INFORMATION_SCHEMA.COLUMNS WHERE TABLE_NAME='t9_view' AND TABLE_SCHEMA='obwmjtest';
TABLE_NAME	COLUMN_NAME	ORDINAL_POSITION	COLUMN_DEFAULT
t9_view	dd	1	NULL
t9_view	name	2	NULL
t9_view	id	3	NULL
t9_view	brand	4	中国
t9_view	color	5	NULL
SELECT COLUMN_TYPE,COLUMN_NAME,IS_NULLABLE,COLUMN_KEY,EXTRA FROM INFORMATION_SCHEMA.COLUMNS WHERE TABLE_NAME='t9_view' AND TABLE_SCHEMA='obwmjtest';
COLUMN_TYPE	COLUMN_NAME	IS_NULLABLE	COLUMN_KEY	EXTRA
int(11)	dd	NO		
varchar(20)	name	NO		
bigint(20)	id	NO		
varchar(255)	brand	NO		
int(11)	color	NO		
SELECT COLUMN_TYPE,COLUMN_COMMENT,GENERATION_EXPRESSION FROM INFORMATION_SCHEMA.COLUMNS WHERE TABLE_NAME='t9_view' AND TABLE_SCHEMA='obwmjtest';
COLUMN_TYPE	COLUMN_COMMENT	GENERATION_EXPRESSION
int(11)		
varchar(20)		
bigint(20)		
varchar(255)		
int(11)		
DROP TABLE t8;
DROP VIEW t9_view;
DROP VIEW t8_view;
CREATE DATABASE obwmjtest2;
CREATE TABLE obwmjtest2.t1(
dd INT PRIMARY KEY,
name VARCHAR(20) NOT NULL
) PARTITION BY KEY(dd) PARTITIONS 2;
CREATE VIEW obwmjtest2.t1_view AS SELECT * FROM obwmjtest2.t1;
CREATE TABLE t8(
id BIGINT,
brand VARCHAR(255) DEFAULT '中国',
color int NOT NULL COMMENT 'COLOR FIELD',
primary key (id,brand)
);
CREATE VIEW t8_view AS SELECT * FROM t8;
CREATE VIEW t9_view AS SELECT * FROM obwmjtest2.t1_view RIGHT JOIN t8_view ON obwmjtest2.t1_view.dd=t8_view.id;
DROP VIEW obwmjtest2.t1_view;
SELECT TABLE_NAME,COLUMN_NAME,ORDINAL_POSITION,COLUMN_DEFAULT FROM INFORMATION_SCHEMA.COLUMNS WHERE TABLE_NAME='t9_view' AND TABLE_SCHEMA='obwmjtest';
TABLE_NAME	COLUMN_NAME	ORDINAL_POSITION	COLUMN_DEFAULT
SELECT COLUMN_TYPE,COLUMN_NAME,IS_NULLABLE,COLUMN_KEY,EXTRA FROM INFORMATION_SCHEMA.COLUMNS WHERE TABLE_NAME='t9_view' AND TABLE_SCHEMA='obwmjtest';
COLUMN_TYPE	COLUMN_NAME	IS_NULLABLE	COLUMN_KEY	EXTRA
SELECT COLUMN_TYPE,COLUMN_COMMENT,GENERATION_EXPRESSION FROM INFORMATION_SCHEMA.COLUMNS WHERE TABLE_NAME='t9_view' AND TABLE_SCHEMA='obwmjtest';
COLUMN_TYPE	COLUMN_COMMENT	GENERATION_EXPRESSION
DROP TABLE t8;
DROP TABLE obwmjtest2.t1;
DROP VIEW t9_view;
DROP VIEW t8_view;
DROP DATABASE obwmjtest2;
CREATE TABLE t1(
dd INT,
name VARCHAR(20)
) PARTITION BY KEY(dd) PARTITIONS 2;
CREATE VIEW t1_view AS SELECT * FROM t1;
CREATE TABLE t8(
id BIGINT,
brand VARCHAR(255) DEFAULT '中国',
color int NOT NULL,
primary key (id,brand)
);
CREATE VIEW t8_view AS SELECT * FROM t8;
CREATE VIEW t9_view AS SELECT * FROM t1_view,t8_view;
ALTER TABLE t1 modify column dd varchar(20) ;
SELECT TABLE_NAME,COLUMN_NAME,ORDINAL_POSITION,COLUMN_DEFAULT FROM INFORMATION_SCHEMA.COLUMNS WHERE TABLE_NAME='t9_view' AND TABLE_SCHEMA='obwmjtest';
TABLE_NAME	COLUMN_NAME	ORDINAL_POSITION	COLUMN_DEFAULT
t9_view	dd	1	NULL
t9_view	name	2	NULL
t9_view	id	3	NULL
t9_view	brand	4	中国
t9_view	color	5	NULL
SELECT COLUMN_TYPE,COLUMN_NAME,IS_NULLABLE,COLUMN_KEY,EXTRA FROM INFORMATION_SCHEMA.COLUMNS WHERE TABLE_NAME='t9_view' AND TABLE_SCHEMA='obwmjtest';
COLUMN_TYPE	COLUMN_NAME	IS_NULLABLE	COLUMN_KEY	EXTRA
varchar(20)	dd	NO		
varchar(20)	name	NO		
bigint(20)	id	NO		
varchar(255)	brand	NO		
int(11)	color	NO		
SELECT COLUMN_TYPE,COLUMN_COMMENT,GENERATION_EXPRESSION FROM INFORMATION_SCHEMA.COLUMNS WHERE TABLE_NAME='t9_view' AND TABLE_SCHEMA='obwmjtest';
COLUMN_TYPE	COLUMN_COMMENT	GENERATION_EXPRESSION
varchar(20)	NULL	NULL
varchar(20)	NULL	NULL
bigint(20)	NULL	NULL
varchar(255)	NULL	NULL
int(11)	NULL	NULL
DROP TABLE t1;
DROP TABLE t8;
DROP VIEW t1_view;
DROP VIEW t8_view;
DROP VIEW t9_view;
CREATE TABLE t1(
dd INT,
name VARCHAR(20)
) PARTITION BY KEY(dd) PARTITIONS 2;
CREATE VIEW t1_view AS SELECT * FROM t1;
CREATE TABLE t8(
id BIGINT,
brand VARCHAR(255) DEFAULT '中国',
color int NOT NULL,
primary key (id,brand)
);
CREATE VIEW t8_view AS SELECT * FROM t8;
CREATE VIEW t9_view AS SELECT * FROM t8_view RIGHT JOIN t1_view ON t1_view.dd=t8_view.id;
ALTER TABLE t1 DROP COLUMN name ;
SELECT TABLE_NAME,COLUMN_NAME,ORDINAL_POSITION,COLUMN_DEFAULT FROM INFORMATION_SCHEMA.COLUMNS WHERE TABLE_NAME='t9_view' AND TABLE_SCHEMA='obwmjtest';
TABLE_NAME	COLUMN_NAME	ORDINAL_POSITION	COLUMN_DEFAULT
Warnings:
Warning	1356	View 'obwmjtest.t9_view' references invalid table(s) or column(s) or function(s) or definer/invoker of view lack rights to use them
SELECT COLUMN_TYPE,COLUMN_NAME,IS_NULLABLE,COLUMN_KEY,EXTRA FROM INFORMATION_SCHEMA.COLUMNS WHERE TABLE_NAME='t9_view' AND TABLE_SCHEMA='obwmjtest';
COLUMN_TYPE	COLUMN_NAME	IS_NULLABLE	COLUMN_KEY	EXTRA
Warnings:
Warning	1356	View 'obwmjtest.t9_view' references invalid table(s) or column(s) or function(s) or definer/invoker of view lack rights to use them
SELECT COLUMN_TYPE,COLUMN_COMMENT,GENERATION_EXPRESSION FROM INFORMATION_SCHEMA.COLUMNS WHERE TABLE_NAME='t9_view' AND TABLE_SCHEMA='obwmjtest';
COLUMN_TYPE	COLUMN_COMMENT	GENERATION_EXPRESSION
Warnings:
Warning	1356	View 'obwmjtest.t9_view' references invalid table(s) or column(s) or function(s) or definer/invoker of view lack rights to use them
DROP TABLE t1;
DROP TABLE t8;
DROP VIEW t1_view;
DROP VIEW t8_view;
DROP VIEW t9_view;
CREATE TABLE t1(a INT , b VARCHAR(50)) PARTITION BY LIST columns(b)(
PARTITION p0 VALUES IN ('abc\def','中国\人民'),
PARTITION p1 VALUES IN ('hig\多多','klm \ \ ')
);
CREATE VIEW t1_view AS SELECT * FROM t1;
CREATE TABLE t8(
id BIGINT,
brand VARCHAR(255) DEFAULT '中国',
color int NOT NULL,
primary key (id,brand)
);
CREATE VIEW t8_view AS SELECT * FROM t8;
CREATE VIEW t9_view AS SELECT * FROM t8_view RIGHT JOIN t1_view ON t8_view.id=t1_view.a;
ALTER TABLE t8 RENAME TO t8_dup;
SELECT TABLE_NAME,COLUMN_NAME,ORDINAL_POSITION,COLUMN_DEFAULT FROM INFORMATION_SCHEMA.COLUMNS WHERE TABLE_NAME='t9_view' AND TABLE_SCHEMA='obwmjtest';
TABLE_NAME	COLUMN_NAME	ORDINAL_POSITION	COLUMN_DEFAULT
SELECT COLUMN_TYPE,COLUMN_NAME,IS_NULLABLE,COLUMN_KEY,EXTRA FROM INFORMATION_SCHEMA.COLUMNS WHERE TABLE_NAME='t9_view' AND TABLE_SCHEMA='obwmjtest';
COLUMN_TYPE	COLUMN_NAME	IS_NULLABLE	COLUMN_KEY	EXTRA
SELECT COLUMN_TYPE,COLUMN_COMMENT,GENERATION_EXPRESSION FROM INFORMATION_SCHEMA.COLUMNS WHERE TABLE_NAME='t9_view' AND TABLE_SCHEMA='obwmjtest';
COLUMN_TYPE	COLUMN_COMMENT	GENERATION_EXPRESSION
DROP TABLE t1;
DROP TABLE t8_dup;
DROP VIEW t1_view;
DROP VIEW t8_view;
DROP VIEW t9_view;
CREATE VIEW t1_view AS SELECT 1 + 1, 2+2 FROM DUAL;
SELECT TABLE_NAME,COLUMN_NAME,ORDINAL_POSITION,COLUMN_DEFAULT FROM INFORMATION_SCHEMA.COLUMNS WHERE TABLE_NAME='t1_view' AND TABLE_SCHEMA='obwmjtest';
TABLE_NAME	COLUMN_NAME	ORDINAL_POSITION	COLUMN_DEFAULT
t1_view	1 + 1	1	NULL
t1_view	2+2	2	NULL
SELECT COLUMN_TYPE,COLUMN_NAME,IS_NULLABLE,COLUMN_KEY,EXTRA FROM INFORMATION_SCHEMA.COLUMNS WHERE TABLE_NAME='t1_view' AND TABLE_SCHEMA='obwmjtest';
COLUMN_TYPE	COLUMN_NAME	IS_NULLABLE	COLUMN_KEY	EXTRA
bigint(2)	1 + 1	NO		
bigint(2)	2+2	NO		
SELECT COLUMN_TYPE,COLUMN_COMMENT,GENERATION_EXPRESSION FROM INFORMATION_SCHEMA.COLUMNS WHERE TABLE_NAME='t1_view' AND TABLE_SCHEMA='obwmjtest';
COLUMN_TYPE	COLUMN_COMMENT	GENERATION_EXPRESSION
bigint(2)		
bigint(2)		
DROP VIEW t1_view;
DROP VIEW t1_viewxxxxxxxxxxxxxxxxxxxxxxxxxxxxxxxxxxxxxxxxxxx1111111uiosidu;
CREATE VIEW t1_viewxxxxxxxxxxxxxxxxxxxxxxxxxxxxxxxxxxxxxxxxxxx1111111uiosidu AS SELECT 1 + 1, 2+2 FROM DUAL;
SELECT TABLE_NAME,COLUMN_NAME,ORDINAL_POSITION,COLUMN_DEFAULT FROM INFORMATION_SCHEMA.COLUMNS WHERE TABLE_NAME='t1_viewxxxxxxxxxxxxxxxxxxxxxxxxxxxxxxxxxxxxxxxxxxx1111111uiosidu' AND TABLE_SCHEMA='obwmjtest';
TABLE_NAME	COLUMN_NAME	ORDINAL_POSITION	COLUMN_DEFAULT
t1_viewxxxxxxxxxxxxxxxxxxxxxxxxxxxxxxxxxxxxxxxxxxx1111111uiosidu	1 + 1	1	NULL
t1_viewxxxxxxxxxxxxxxxxxxxxxxxxxxxxxxxxxxxxxxxxxxx1111111uiosidu	2+2	2	NULL
SELECT COLUMN_TYPE,COLUMN_NAME,IS_NULLABLE,COLUMN_KEY,EXTRA FROM INFORMATION_SCHEMA.COLUMNS WHERE TABLE_NAME='t1_viewxxxxxxxxxxxxxxxxxxxxxxxxxxxxxxxxxxxxxxxxxxx1111111uiosidu' AND TABLE_SCHEMA='obwmjtest';
COLUMN_TYPE	COLUMN_NAME	IS_NULLABLE	COLUMN_KEY	EXTRA
bigint(2)	1 + 1	NO		
bigint(2)	2+2	NO		
SELECT COLUMN_TYPE,COLUMN_COMMENT,GENERATION_EXPRESSION FROM INFORMATION_SCHEMA.COLUMNS WHERE TABLE_NAME='t1_viewxxxxxxxxxxxxxxxxxxxxxxxxxxxxxxxxxxxxxxxxxxx1111111uiosidu' AND TABLE_SCHEMA='obwmjtest';
COLUMN_TYPE	COLUMN_COMMENT	GENERATION_EXPRESSION
bigint(2)		
bigint(2)		
DROP VIEW t1_viewxxxxxxxxxxxxxxxxxxxxxxxxxxxxxxxxxxxxxxxxxxx1111111uiosidu;
CREATE VIEW t1_view AS SELECT 1 + 1, 2+222222222222221111111111111111222222222222222222222222222222222,2+222222222222221111111111111111222222222222222222222222222222222,2+222222222222221111111111111111222222222222222222222222222222222,2+222222222222221111111111111111222222222222222222222222222222222,2+222222222222221111111111111111222222222222222222222222222222222 FROM DUAL;
SELECT TABLE_NAME,COLUMN_NAME,ORDINAL_POSITION,COLUMN_DEFAULT FROM INFORMATION_SCHEMA.COLUMNS WHERE TABLE_NAME='t1_view' AND TABLE_SCHEMA='obwmjtest';
TABLE_NAME	COLUMN_NAME	ORDINAL_POSITION	COLUMN_DEFAULT
t1_view	1 + 1	1	NULL
t1_view	Name_exp_1	2	NULL
t1_view	Name_exp_2	3	NULL
t1_view	Name_exp_3	4	NULL
t1_view	Name_exp_4	5	NULL
t1_view	Name_exp_5	6	NULL
SELECT COLUMN_TYPE,COLUMN_NAME,IS_NULLABLE,COLUMN_KEY,EXTRA FROM INFORMATION_SCHEMA.COLUMNS WHERE TABLE_NAME='t1_view' AND TABLE_SCHEMA='obwmjtest';
COLUMN_TYPE	COLUMN_NAME	IS_NULLABLE	COLUMN_KEY	EXTRA
bigint(2)	1 + 1	NO		
decimal(64,0)	Name_exp_1	NO		
decimal(64,0)	Name_exp_2	NO		
decimal(64,0)	Name_exp_3	NO		
decimal(64,0)	Name_exp_4	NO		
decimal(64,0)	Name_exp_5	NO		
SELECT COLUMN_TYPE,COLUMN_COMMENT,GENERATION_EXPRESSION FROM INFORMATION_SCHEMA.COLUMNS WHERE TABLE_NAME='t1_view' AND TABLE_SCHEMA='obwmjtest';
COLUMN_TYPE	COLUMN_COMMENT	GENERATION_EXPRESSION
bigint(2)		
decimal(64,0)		
decimal(64,0)		
decimal(64,0)		
decimal(64,0)		
decimal(64,0)		
DROP VIEW t1_view;
CREATE VIEW t1_view AS SELECT CHARSET(char('' USING utf8mb4));
SELECT TABLE_NAME,COLUMN_NAME,ORDINAL_POSITION,COLUMN_DEFAULT FROM INFORMATION_SCHEMA.COLUMNS WHERE TABLE_NAME='t1_view' AND TABLE_SCHEMA='obwmjtest';
TABLE_NAME	COLUMN_NAME	ORDINAL_POSITION	COLUMN_DEFAULT
t1_view	CHARSET(char('' USING utf8mb4))	1	NULL
SELECT COLUMN_TYPE,COLUMN_NAME,IS_NULLABLE,COLUMN_KEY,EXTRA FROM INFORMATION_SCHEMA.COLUMNS WHERE TABLE_NAME='t1_view' AND TABLE_SCHEMA='obwmjtest';
COLUMN_TYPE	COLUMN_NAME	IS_NULLABLE	COLUMN_KEY	EXTRA
varchar(256)	CHARSET(char('' USING utf8mb4))	YES		
SELECT COLUMN_TYPE,COLUMN_COMMENT,GENERATION_EXPRESSION FROM INFORMATION_SCHEMA.COLUMNS WHERE TABLE_NAME='t1_view' AND TABLE_SCHEMA='obwmjtest';
COLUMN_TYPE	COLUMN_COMMENT	GENERATION_EXPRESSION
varchar(256)		
DROP VIEW t1_view;
CREATE VIEW t9_view AS SELECT CAST(0 AS DATE);
SELECT TABLE_NAME,COLUMN_NAME,ORDINAL_POSITION,COLUMN_DEFAULT FROM INFORMATION_SCHEMA.COLUMNS WHERE TABLE_NAME='t9_view' AND TABLE_SCHEMA='obwmjtest';
TABLE_NAME	COLUMN_NAME	ORDINAL_POSITION	COLUMN_DEFAULT
t9_view	CAST(0 AS DATE)	1	NULL
SELECT COLUMN_TYPE,COLUMN_NAME,IS_NULLABLE,COLUMN_KEY,EXTRA FROM INFORMATION_SCHEMA.COLUMNS WHERE TABLE_NAME='t9_view' AND TABLE_SCHEMA='obwmjtest';
COLUMN_TYPE	COLUMN_NAME	IS_NULLABLE	COLUMN_KEY	EXTRA
date	CAST(0 AS DATE)	NO		
SELECT COLUMN_TYPE,COLUMN_COMMENT,GENERATION_EXPRESSION FROM INFORMATION_SCHEMA.COLUMNS WHERE TABLE_NAME='t9_view' AND TABLE_SCHEMA='obwmjtest';
COLUMN_TYPE	COLUMN_COMMENT	GENERATION_EXPRESSION
date		
DROP VIEW t9_view;
CREATE FUNCTION f_test()
returns varchar(20)
BEGIN
declare a varchar(200);
SELECT CONCAT('111','222','333') FROM DUAL INTO a;
return a;
END;
//
CREATE VIEW t9_view AS SELECT f_test();
SELECT TABLE_NAME,COLUMN_NAME,ORDINAL_POSITION,COLUMN_DEFAULT FROM INFORMATION_SCHEMA.COLUMNS WHERE TABLE_NAME='t9_view' AND TABLE_SCHEMA='obwmjtest';
TABLE_NAME	COLUMN_NAME	ORDINAL_POSITION	COLUMN_DEFAULT
t9_view	f_test()	1	NULL
SELECT COLUMN_TYPE,COLUMN_NAME,IS_NULLABLE,COLUMN_KEY,EXTRA FROM INFORMATION_SCHEMA.COLUMNS WHERE TABLE_NAME='t9_view' AND TABLE_SCHEMA='obwmjtest';
COLUMN_TYPE	COLUMN_NAME	IS_NULLABLE	COLUMN_KEY	EXTRA
varchar(20)	f_test()	YES		
SELECT COLUMN_TYPE,COLUMN_COMMENT,GENERATION_EXPRESSION FROM INFORMATION_SCHEMA.COLUMNS WHERE TABLE_NAME='t9_view' AND TABLE_SCHEMA='obwmjtest';
COLUMN_TYPE	COLUMN_COMMENT	GENERATION_EXPRESSION
varchar(20)		
DROP VIEW t9_view;
DROP FUNCTION f_test;
CREATE FUNCTION f_test(samplename varchar(200))
returns varchar(13)  
begin
declare a varchar(200);
SELECT CONCAT('111','222','333') FROM DUAL INTO a;
return a;
END;
//
CREATE VIEW t9_view AS SELECT f_test('xxxx');
SELECT TABLE_NAME,COLUMN_NAME,ORDINAL_POSITION,COLUMN_DEFAULT FROM INFORMATION_SCHEMA.COLUMNS WHERE TABLE_NAME='t9_view' AND TABLE_SCHEMA='obwmjtest';
TABLE_NAME	COLUMN_NAME	ORDINAL_POSITION	COLUMN_DEFAULT
t9_view	f_test('xxxx')	1	NULL
SELECT COLUMN_TYPE,COLUMN_NAME,IS_NULLABLE,COLUMN_KEY,EXTRA FROM INFORMATION_SCHEMA.COLUMNS WHERE TABLE_NAME='t9_view' AND TABLE_SCHEMA='obwmjtest';
COLUMN_TYPE	COLUMN_NAME	IS_NULLABLE	COLUMN_KEY	EXTRA
varchar(13)	f_test('xxxx')	YES		
SELECT COLUMN_TYPE,COLUMN_COMMENT,GENERATION_EXPRESSION FROM INFORMATION_SCHEMA.COLUMNS WHERE TABLE_NAME='t9_view' AND TABLE_SCHEMA='obwmjtest';
COLUMN_TYPE	COLUMN_COMMENT	GENERATION_EXPRESSION
varchar(13)		
DROP VIEW t9_view;
DROP FUNCTION f_test;
CREATE DEFINER = 'TEST_A1'@'%' FUNCTION f_test(samplename varchar(200))
returns varchar(13)  
begin
declare a varchar(200);
SELECT CONCAT('111','222','333') FROM DUAL INTO a;
return a;
END;
//
CREATE VIEW t9_view AS SELECT f_test('xxxx');
SELECT TABLE_NAME,COLUMN_NAME,ORDINAL_POSITION,COLUMN_DEFAULT FROM INFORMATION_SCHEMA.COLUMNS WHERE TABLE_NAME='t9_view' AND TABLE_SCHEMA='obwmjtest';
TABLE_NAME	COLUMN_NAME	ORDINAL_POSITION	COLUMN_DEFAULT
t9_view	f_test('xxxx')	1	NULL
SELECT COLUMN_TYPE,COLUMN_NAME,IS_NULLABLE,COLUMN_KEY,EXTRA FROM INFORMATION_SCHEMA.COLUMNS WHERE TABLE_NAME='t9_view' AND TABLE_SCHEMA='obwmjtest';
COLUMN_TYPE	COLUMN_NAME	IS_NULLABLE	COLUMN_KEY	EXTRA
varchar(13)	f_test('xxxx')	YES		
SELECT COLUMN_TYPE,COLUMN_COMMENT,GENERATION_EXPRESSION FROM INFORMATION_SCHEMA.COLUMNS WHERE TABLE_NAME='t9_view' AND TABLE_SCHEMA='obwmjtest';
COLUMN_TYPE	COLUMN_COMMENT	GENERATION_EXPRESSION
varchar(13)		
DROP VIEW t9_view;
DROP FUNCTION f_test;
CREATE TABLE t1 (
id int NOT NULL,
consumer char(20) DEFAULT NULL,
price varchar(20) DEFAULT NULL,
sal int DEFAULT NULL,
datetime1 DATE,
`datetime2` bigint
);
INSERT INTO t1 VALUES(1,'书局','7000',5000,'2020-09-22',20200923121200);
CREATE FUNCTION f_test(samplename varchar(200))
returns varchar(13)  
begin
IF samplename IS NOT NULL then
CALL p_test(3);
END IF;
RETURN 0;
END;
//
CREATE PROCEDURE p_test(in p_in int)
begin
update t1 set id=p_in;
END;
//
CREATE VIEW t9_view(aa) AS SELECT f_test('xxxx');
SELECT TABLE_NAME,COLUMN_NAME,ORDINAL_POSITION,COLUMN_DEFAULT FROM INFORMATION_SCHEMA.COLUMNS WHERE TABLE_NAME='t9_view' AND TABLE_SCHEMA='obwmjtest';
TABLE_NAME	COLUMN_NAME	ORDINAL_POSITION	COLUMN_DEFAULT
t9_view	aa	1	NULL
SELECT COLUMN_TYPE,COLUMN_NAME,IS_NULLABLE,COLUMN_KEY,EXTRA FROM INFORMATION_SCHEMA.COLUMNS WHERE TABLE_NAME='t9_view' AND TABLE_SCHEMA='obwmjtest';
COLUMN_TYPE	COLUMN_NAME	IS_NULLABLE	COLUMN_KEY	EXTRA
varchar(13)	aa	YES		
SELECT COLUMN_TYPE,COLUMN_COMMENT,GENERATION_EXPRESSION FROM INFORMATION_SCHEMA.COLUMNS WHERE TABLE_NAME='t9_view' AND TABLE_SCHEMA='obwmjtest';
COLUMN_TYPE	COLUMN_COMMENT	GENERATION_EXPRESSION
varchar(13)		
DROP TABLE t1;
DROP VIEW t9_view;
DROP FUNCTION f_test;
DROP PROCEDURE p_test;
CREATE TABLE t1 (
id int NOT NULL,
consumer char(20) DEFAULT NULL,
price varchar(20) DEFAULT NULL,
sal int DEFAULT NULL,
datetime1 DATE,
`datetime2` bigint
);
INSERT INTO t1 VALUES(1,'书局','7000',5000,'2020-09-22',20200923121200);
INSERT INTO t1 VALUES(2,'微山','3000',-4000,'2020-09-21',20200921101159);
INSERT INTO t1 VALUES(3,'深咖','5000',0,'2020-08-21',20190821101159);
CREATE FUNCTION f_test(samplename varchar(200))
returns varchar(13)  
begin
IF samplename IS NOT NULL then
CALL p_test(4);
END IF;
RETURN 4;
END;
//
CREATE PROCEDURE p_test(in p_in int)
begin
update t1 set id=p_in;
END;
//
CREATE VIEW t9_view AS SELECT * FROM t1 WHERE t1.id = f_test(t1.consumer);
SELECT TABLE_NAME,COLUMN_NAME,ORDINAL_POSITION,COLUMN_DEFAULT FROM INFORMATION_SCHEMA.COLUMNS WHERE TABLE_NAME='t9_view' AND TABLE_SCHEMA='obwmjtest';
TABLE_NAME	COLUMN_NAME	ORDINAL_POSITION	COLUMN_DEFAULT
t9_view	id	1	NULL
t9_view	consumer	2	NULL
t9_view	price	3	NULL
t9_view	sal	4	NULL
t9_view	datetime1	5	NULL
t9_view	datetime2	6	NULL
SELECT COLUMN_TYPE,COLUMN_NAME,IS_NULLABLE,COLUMN_KEY,EXTRA FROM INFORMATION_SCHEMA.COLUMNS WHERE TABLE_NAME='t9_view' AND TABLE_SCHEMA='obwmjtest';
COLUMN_TYPE	COLUMN_NAME	IS_NULLABLE	COLUMN_KEY	EXTRA
int(11)	id	NO		
char(20)	consumer	YES		
varchar(20)	price	YES		
int(11)	sal	YES		
date	datetime1	YES		
bigint(20)	datetime2	YES		
SELECT COLUMN_TYPE,COLUMN_COMMENT,GENERATION_EXPRESSION FROM INFORMATION_SCHEMA.COLUMNS WHERE TABLE_NAME='t9_view' AND TABLE_SCHEMA='obwmjtest';
COLUMN_TYPE	COLUMN_COMMENT	GENERATION_EXPRESSION
int(11)		
char(20)		
varchar(20)		
int(11)		
date		
bigint(20)		
DROP TABLE t1;
DROP VIEW t9_view;
DROP FUNCTION f_test;
DROP PROCEDURE p_test;
CREATE VIEW t9_view as WITH
cte1 AS (SELECT 1 as a, 2 as b FROM dual),
cte2 AS (SELECT 1 as c, 4 as d FROM dual)
SELECT b, d FROM cte1 JOIN cte2
WHERE cte1.a = cte2.c;
SELECT TABLE_NAME,COLUMN_NAME,ORDINAL_POSITION,COLUMN_DEFAULT FROM INFORMATION_SCHEMA.COLUMNS WHERE TABLE_NAME='t9_view' AND TABLE_SCHEMA='obwmjtest';
TABLE_NAME	COLUMN_NAME	ORDINAL_POSITION	COLUMN_DEFAULT
t9_view	b	1	NULL
t9_view	d	2	NULL
SELECT COLUMN_TYPE,COLUMN_NAME,IS_NULLABLE,COLUMN_KEY,EXTRA FROM INFORMATION_SCHEMA.COLUMNS WHERE TABLE_NAME='t9_view' AND TABLE_SCHEMA='obwmjtest';
COLUMN_TYPE	COLUMN_NAME	IS_NULLABLE	COLUMN_KEY	EXTRA
bigint(1)	b	NO		
bigint(1)	d	NO		
SELECT COLUMN_TYPE,COLUMN_COMMENT,GENERATION_EXPRESSION FROM INFORMATION_SCHEMA.COLUMNS WHERE TABLE_NAME='t9_view' AND TABLE_SCHEMA='obwmjtest';
COLUMN_TYPE	COLUMN_COMMENT	GENERATION_EXPRESSION
bigint(1)		
bigint(1)		
DROP VIEW t9_view;
CREATE TABLE `t1` (
`id` int NOT NULL AUTO_INCREMENT,
`consumer` char(20) DEFAULT NULL,
`brand` varchar(20) DEFAULT NULL,
`sal` int DEFAULT NULL,
PRIMARY KEY (`id`)
);
INSERT INTO t1 VALUES(1,'书局','apple',5000);
INSERT INTO t1 VALUES(2,'微山','xiaomi',-4000);
INSERT INTO t1 VALUES(3,'深咖','oppo',0);
CREATE VIEW t9_view as select id, sal, sign(case when sal=0 then 200 else sal end ) from t1 ORDER BY id;
SELECT TABLE_NAME,COLUMN_NAME,ORDINAL_POSITION,COLUMN_DEFAULT FROM INFORMATION_SCHEMA.COLUMNS WHERE TABLE_NAME='t9_view' AND TABLE_SCHEMA='obwmjtest';
TABLE_NAME	COLUMN_NAME	ORDINAL_POSITION	COLUMN_DEFAULT
t9_view	id	1	NULL
t9_view	sal	2	NULL
t9_view	sign(case when sal=0 then 200 else sal end )	3	NULL
SELECT COLUMN_TYPE,COLUMN_NAME,IS_NULLABLE,COLUMN_KEY,EXTRA FROM INFORMATION_SCHEMA.COLUMNS WHERE TABLE_NAME='t9_view' AND TABLE_SCHEMA='obwmjtest';
COLUMN_TYPE	COLUMN_NAME	IS_NULLABLE	COLUMN_KEY	EXTRA
int(11)	id	NO		
int(11)	sal	YES		
bigint(20)	sign(case when sal=0 then 200 else sal end )	YES		
SELECT COLUMN_TYPE,COLUMN_COMMENT,GENERATION_EXPRESSION FROM INFORMATION_SCHEMA.COLUMNS WHERE TABLE_NAME='t9_view' AND TABLE_SCHEMA='obwmjtest';
COLUMN_TYPE	COLUMN_COMMENT	GENERATION_EXPRESSION
int(11)		
int(11)		
bigint(20)		
DROP VIEW t9_view;
DROP TABLE t1;
CREATE TABLE `t1` (
`id` int NOT NULL AUTO_INCREMENT,
`consumer` char(20) DEFAULT NULL,
`brand` varchar(20) DEFAULT NULL,
`sal` int DEFAULT NULL,
PRIMARY KEY (`id`)
);
INSERT INTO t1 VALUES(1,'书局','apple',5000);
INSERT INTO t1 VALUES(2,'微山','xiaomi',-4000);
INSERT INTO t1 VALUES(3,'深咖','oppo',0);
CREATE VIEW t9_view as SELECT brand, sign(brand) FROM t1 e WHERE e.brand LIKE '%a%';
SELECT TABLE_NAME,COLUMN_NAME,ORDINAL_POSITION,COLUMN_DEFAULT FROM INFORMATION_SCHEMA.COLUMNS WHERE TABLE_NAME='t9_view' AND TABLE_SCHEMA='obwmjtest';
TABLE_NAME	COLUMN_NAME	ORDINAL_POSITION	COLUMN_DEFAULT
t9_view	brand	1	NULL
t9_view	sign(brand)	2	NULL
SELECT COLUMN_TYPE,COLUMN_NAME,IS_NULLABLE,COLUMN_KEY,EXTRA FROM INFORMATION_SCHEMA.COLUMNS WHERE TABLE_NAME='t9_view' AND TABLE_SCHEMA='obwmjtest';
COLUMN_TYPE	COLUMN_NAME	IS_NULLABLE	COLUMN_KEY	EXTRA
varchar(20)	brand	YES		
bigint(20)	sign(brand)	YES		
SELECT COLUMN_TYPE,COLUMN_COMMENT,GENERATION_EXPRESSION FROM INFORMATION_SCHEMA.COLUMNS WHERE TABLE_NAME='t9_view' AND TABLE_SCHEMA='obwmjtest';
COLUMN_TYPE	COLUMN_COMMENT	GENERATION_EXPRESSION
varchar(20)		
bigint(20)		
DROP VIEW t9_view;
DROP TABLE t1;
CREATE TABLE t1( STU_ID INT, LESSON VARCHAR(30), NAME VARCHAR(30), SCORE INT);
INSERT INTO t1 VALUES (1,'L1001','小明',90);
INSERT INTO t1 VALUES (1,'L1002','小明',80);
INSERT INTO t1 VALUES (1,'L1003','小明',88);
INSERT INTO t1 VALUES (2,'L1001','小红',50);
INSERT INTO t1 VALUES (2,'L1002','小红',66);
INSERT INTO t1 VALUES (2,'L1003','小红',68.5);
INSERT INTO t1 VALUES (3,'L1002','小紫',92);
CREATE VIEW t9_view AS SELECT * FROM (SELECT STU_ID, ROW_NUMBER() OVER (PARTITION BY STU_ID ORDER BY SCORE DESC) AS score_order, LESSON, NAME, SCORE FROM t1) t WHERE t.score_order <= 3;
SELECT TABLE_NAME,COLUMN_NAME,ORDINAL_POSITION,COLUMN_DEFAULT FROM INFORMATION_SCHEMA.COLUMNS WHERE TABLE_NAME='t9_view' AND TABLE_SCHEMA='obwmjtest';
TABLE_NAME	COLUMN_NAME	ORDINAL_POSITION	COLUMN_DEFAULT
t9_view	STU_ID	1	NULL
t9_view	score_order	2	0
t9_view	LESSON	3	NULL
t9_view	NAME	4	NULL
t9_view	SCORE	5	NULL
SELECT COLUMN_TYPE,COLUMN_NAME,IS_NULLABLE,COLUMN_KEY,EXTRA FROM INFORMATION_SCHEMA.COLUMNS WHERE TABLE_NAME='t9_view' AND TABLE_SCHEMA='obwmjtest';
COLUMN_TYPE	COLUMN_NAME	IS_NULLABLE	COLUMN_KEY	EXTRA
int(11)	STU_ID	YES		
bigint(20) unsigned	score_order	NO		
varchar(30)	LESSON	YES		
varchar(30)	NAME	YES		
int(11)	SCORE	YES		
SELECT COLUMN_TYPE,COLUMN_COMMENT,GENERATION_EXPRESSION FROM INFORMATION_SCHEMA.COLUMNS WHERE TABLE_NAME='t9_view' AND TABLE_SCHEMA='obwmjtest';
COLUMN_TYPE	COLUMN_COMMENT	GENERATION_EXPRESSION
int(11)		
bigint(20) unsigned		
varchar(30)		
varchar(30)		
int(11)		
DROP VIEW t9_view;
DROP TABLE t1;
CREATE VIEW t9_view as select "xx","yy" from dual;
SELECT TABLE_NAME,COLUMN_NAME,ORDINAL_POSITION,COLUMN_DEFAULT FROM INFORMATION_SCHEMA.COLUMNS WHERE TABLE_NAME='t9_view' AND TABLE_SCHEMA='obwmjtest';
TABLE_NAME	COLUMN_NAME	ORDINAL_POSITION	COLUMN_DEFAULT
t9_view	xx	1	NULL
t9_view	yy	2	NULL
SELECT COLUMN_TYPE,COLUMN_NAME,IS_NULLABLE,COLUMN_KEY,EXTRA FROM INFORMATION_SCHEMA.COLUMNS WHERE TABLE_NAME='t9_view' AND TABLE_SCHEMA='obwmjtest';
COLUMN_TYPE	COLUMN_NAME	IS_NULLABLE	COLUMN_KEY	EXTRA
varchar(2)	xx	NO		
varchar(2)	yy	NO		
SELECT COLUMN_TYPE,COLUMN_COMMENT,GENERATION_EXPRESSION FROM INFORMATION_SCHEMA.COLUMNS WHERE TABLE_NAME='t9_view' AND TABLE_SCHEMA='obwmjtest';
COLUMN_TYPE	COLUMN_COMMENT	GENERATION_EXPRESSION
varchar(2)		
varchar(2)		
DROP VIEW t9_view;
CREATE TABLE t1( STU_ID INT, LESSON VARCHAR(30), NAME VARCHAR(30), SCORE INT);
INSERT INTO t1 VALUES (1,'L1001','小明',90);
INSERT INTO t1 VALUES (2,'L1003','小红',68.5);
INSERT INTO t1 VALUES (3,'L1002','小紫',92);
CREATE VIEW t9_view AS SELECT DISTINCT STU_ID,LESSON FROM t1;
SELECT TABLE_NAME,COLUMN_NAME,ORDINAL_POSITION,COLUMN_DEFAULT FROM INFORMATION_SCHEMA.COLUMNS WHERE TABLE_NAME='t9_view' AND TABLE_SCHEMA='obwmjtest';
TABLE_NAME	COLUMN_NAME	ORDINAL_POSITION	COLUMN_DEFAULT
t9_view	STU_ID	1	NULL
t9_view	LESSON	2	NULL
SELECT COLUMN_TYPE,COLUMN_NAME,IS_NULLABLE,COLUMN_KEY,EXTRA FROM INFORMATION_SCHEMA.COLUMNS WHERE TABLE_NAME='t9_view' AND TABLE_SCHEMA='obwmjtest';
COLUMN_TYPE	COLUMN_NAME	IS_NULLABLE	COLUMN_KEY	EXTRA
int(11)	STU_ID	YES		
varchar(30)	LESSON	YES		
SELECT COLUMN_TYPE,COLUMN_COMMENT,GENERATION_EXPRESSION FROM INFORMATION_SCHEMA.COLUMNS WHERE TABLE_NAME='t9_view' AND TABLE_SCHEMA='obwmjtest';
COLUMN_TYPE	COLUMN_COMMENT	GENERATION_EXPRESSION
int(11)		
varchar(30)		
DROP VIEW t9_view;
DROP TABLE t1;
CREATE TABLE t1( STU_ID INT, LESSON VARCHAR(30), NAME VARCHAR(30), SCORE INT);
INSERT INTO t1 VALUES (1,'L1001','小明',90);
INSERT INTO t1 VALUES (2,'L1001','小红',50);
INSERT INTO t1 VALUES (3,'L1002','小紫',92);
CREATE VIEW t9_view AS SELECT DISTINCT STU_ID,LESSON FROM t1 GROUP BY LESSON HAVING STU_ID<10;
SELECT TABLE_NAME,COLUMN_NAME,ORDINAL_POSITION,COLUMN_DEFAULT FROM INFORMATION_SCHEMA.COLUMNS WHERE TABLE_NAME='t9_view' AND TABLE_SCHEMA='obwmjtest';
TABLE_NAME	COLUMN_NAME	ORDINAL_POSITION	COLUMN_DEFAULT
t9_view	STU_ID	1	NULL
t9_view	LESSON	2	NULL
SELECT COLUMN_TYPE,COLUMN_NAME,IS_NULLABLE,COLUMN_KEY,EXTRA FROM INFORMATION_SCHEMA.COLUMNS WHERE TABLE_NAME='t9_view' AND TABLE_SCHEMA='obwmjtest';
COLUMN_TYPE	COLUMN_NAME	IS_NULLABLE	COLUMN_KEY	EXTRA
int(11)	STU_ID	YES		
varchar(30)	LESSON	YES		
SELECT COLUMN_TYPE,COLUMN_COMMENT,GENERATION_EXPRESSION FROM INFORMATION_SCHEMA.COLUMNS WHERE TABLE_NAME='t9_view' AND TABLE_SCHEMA='obwmjtest';
COLUMN_TYPE	COLUMN_COMMENT	GENERATION_EXPRESSION
int(11)		
varchar(30)		
DROP VIEW t9_view;
DROP TABLE t1;
# Clean up users
DROP DATABASE obwmjtest;
DROP DATABASE obwmjtest2;
drop user wmj456@'%' ;
