#Environmental cleaning
drop user hjw@'%';
create user hjw identified by 'hjw';
grant all on *.* to hjw WITH GRANT OPTION;
#view-2-3  update
#view-2-4  delete
#view-2-5  约束
#view-2-6  索引
#view-3    多表
create database hz;
use hz;
drop table test1;
drop table test2;
drop view v1,v2;
drop view v3;
#view-2-3  update
create table test1(a1 int primary key AUTO_INCREMENT,name varchar(20),chinese BIGINT,math BIGINT,english INTEGER);
insert into test1(name,chinese,math,english) values('小明',101,115,113);
insert into test1(name,chinese,math,english) values('小王',103,125,115);
insert into test1(name,chinese,math,english) values('小超',107,135,108);
insert into test1(name,chinese,math,english) values('小李',119,145,100);
create or REPLACE view v1 as SELECT * from test1 where chinese<=121 and math>=100 and english<120 WITH CHECK OPTION;
SELECT * from test1 order by a1 asc;
a1	name	chinese	math	english
1	小明	101	115	113
2	小王	103	125	115
3	小超	107	135	108
4	小李	119	145	100
SELECT * from v1 order by a1 asc;
a1	name	chinese	math	english
1	小明	101	115	113
2	小王	103	125	115
3	小超	107	135	108
4	小李	119	145	100
update v1 set chinese=chinese+2;
SELECT * from test1 order by a1 asc;
a1	name	chinese	math	english
1	小明	103	115	113
2	小王	105	125	115
3	小超	109	135	108
4	小李	121	145	100
SELECT * from v1 order by a1 asc;
a1	name	chinese	math	english
1	小明	103	115	113
2	小王	105	125	115
3	小超	109	135	108
4	小李	121	145	100
update v1 set chinese=chinese-1,math=math+1,english=english+3;
SELECT * from test1 order by a1 asc;
a1	name	chinese	math	english
1	小明	102	116	116
2	小王	104	126	118
3	小超	108	136	111
4	小李	120	146	103
SELECT * from v1 order by a1 asc;
a1	name	chinese	math	english
1	小明	102	116	116
2	小王	104	126	118
3	小超	108	136	111
4	小李	120	146	103
update ((SELECT * from v1)) set chinese=chinese-1 ;
update v1 set chinese=(select chinese from test1 LIMIT 1);
SELECT * from test1 order by a1 asc;
a1	name	chinese	math	english
1	小明	102	116	116
2	小王	102	126	118
3	小超	102	136	111
4	小李	102	146	103
SELECT * from v1 order by a1 asc;
a1	name	chinese	math	english
1	小明	102	116	116
2	小王	102	126	118
3	小超	102	136	111
4	小李	102	146	103
update v1 set chinese=(select math from test1 where math=126 );
SELECT * from test1 order by a1 asc;
a1	name	chinese	math	english
1	小明	102	116	116
2	小王	102	126	118
3	小超	102	136	111
4	小李	102	146	103
SELECT * from v1 order by a1 asc;
a1	name	chinese	math	english
1	小明	102	116	116
2	小王	102	126	118
3	小超	102	136	111
4	小李	102	146	103
update v1 set chinese=(select math from test1 where math<=116 LIMIT 1 );
SELECT * from test1 order by a1 asc;
a1	name	chinese	math	english
1	小明	116	116	116
2	小王	116	126	118
3	小超	116	136	111
4	小李	116	146	103
SELECT * from v1 order by a1 asc;
a1	name	chinese	math	english
1	小明	116	116	116
2	小王	116	126	118
3	小超	116	136	111
4	小李	116	146	103
update v1 set chinese=(select math from test1 where math=(select math from test1 where math=116));
SELECT * from test1 order by a1 asc;
a1	name	chinese	math	english
1	小明	116	116	116
2	小王	116	126	118
3	小超	116	136	111
4	小李	116	146	103
SELECT * from v1 order by a1 asc;
a1	name	chinese	math	english
1	小明	116	116	116
2	小王	116	126	118
3	小超	116	136	111
4	小李	116	146	103
update v1 set chinese=chinese-1 and math=math+1 and english=english+3;
SELECT * from test1 order by a1 asc;
a1	name	chinese	math	english
1	小明	0	116	116
2	小王	0	126	118
3	小超	0	136	111
4	小李	0	146	103
SELECT * from v1 order by a1 asc;
a1	name	chinese	math	english
1	小明	0	116	116
2	小王	0	126	118
3	小超	0	136	111
4	小李	0	146	103
update v1 set chinese=chinese-1 or math=math+1 or english=english+3;
SELECT * from test1 order by a1 asc;
a1	name	chinese	math	english
1	小明	1	116	116
2	小王	1	126	118
3	小超	1	136	111
4	小李	1	146	103
SELECT * from v1 order by a1 asc;
a1	name	chinese	math	english
1	小明	1	116	116
2	小王	1	126	118
3	小超	1	136	111
4	小李	1	146	103
drop view v1;
drop table test1;
create table test1(a1 int primary key AUTO_INCREMENT,name varchar(20),chinese BIGINT,math BIGINT,english INTEGER);
insert into test1(name,chinese,math,english) values('小明',101,115,113);
insert into test1(name,chinese,math,english) values('小王',103,125,115);
insert into test1(name,chinese,math,english) values('小超',107,135,108);
insert into test1(name,chinese,math,english) values('小李',119,145,100);
create or REPLACE view v1 as SELECT * from test1 where chinese<=121 and math>=100 and english<120 WITH CHECK OPTION;
update v1 set chinese=log(81);
SELECT * from test1 order by a1 asc;
a1	name	chinese	math	english
1	小明	4	115	113
2	小王	4	125	115
3	小超	4	135	108
4	小李	4	145	100
SELECT * from v1 order by a1 asc;
a1	name	chinese	math	english
1	小明	4	115	113
2	小王	4	125	115
3	小超	4	135	108
4	小李	4	145	100
update v1 set chinese=log(81)+log10(81);
SELECT * from test1 order by a1 asc;
a1	name	chinese	math	english
1	小明	6	115	113
2	小王	6	125	115
3	小超	6	135	108
4	小李	6	145	100
SELECT * from v1 order by a1 asc;
a1	name	chinese	math	english
1	小明	6	115	113
2	小王	6	125	115
3	小超	6	135	108
4	小李	6	145	100
update (SELECT chinese from v1 ) set chinese=log(81)+log10(81);
update v1 set chinese=log(log10(81));
SELECT * from test1 order by a1 asc;
a1	name	chinese	math	english
1	小明	1	115	113
2	小王	1	125	115
3	小超	1	135	108
4	小李	1	145	100
SELECT * from v1 order by a1 asc;
a1	name	chinese	math	english
1	小明	1	115	113
2	小王	1	125	115
3	小超	1	135	108
4	小李	1	145	100
update v1 set english=english-log(log10(81));
SELECT * from test1 order by a1 asc;
a1	name	chinese	math	english
1	小明	1	115	112
2	小王	1	125	114
3	小超	1	135	107
4	小李	1	145	99
SELECT * from v1 order by a1 asc;
a1	name	chinese	math	english
1	小明	1	115	112
2	小王	1	125	114
3	小超	1	135	107
4	小李	1	145	99
update v1 set english=english*log(log10(81));
SELECT * from test1 order by a1 asc;
a1	name	chinese	math	english
1	小明	1	115	72
2	小王	1	125	74
3	小超	1	135	69
4	小李	1	145	64
SELECT * from v1 order by a1 asc;
a1	name	chinese	math	english
1	小明	1	115	72
2	小王	1	125	74
3	小超	1	135	69
4	小李	1	145	64
update v1 set english=english-abs(bin(81));
SELECT * from test1 order by a1 asc;
a1	name	chinese	math	english
1	小明	1	115	-1009929
2	小王	1	125	-1009927
3	小超	1	135	-1009932
4	小李	1	145	-1009937
SELECT * from v1 order by a1 asc;
a1	name	chinese	math	english
1	小明	1	115	-1009929
2	小王	1	125	-1009927
3	小超	1	135	-1009932
4	小李	1	145	-1009937
update v1 set english=english-abs(bin(81));
SELECT * from test1 order by a1 asc;
a1	name	chinese	math	english
1	小明	1	115	-2019930
2	小王	1	125	-2019928
3	小超	1	135	-2019933
4	小李	1	145	-2019938
SELECT * from v1 order by a1 asc;
a1	name	chinese	math	english
1	小明	1	115	-2019930
2	小王	1	125	-2019928
3	小超	1	135	-2019933
4	小李	1	145	-2019938
update v1 set english=english*exp(ln(81));
SELECT * from test1 order by a1 asc;
a1	name	chinese	math	english
1	小明	1	115	-163614330
2	小王	1	125	-163614168
3	小超	1	135	-163614573
4	小李	1	145	-163614978
SELECT * from v1 order by a1 asc;
a1	name	chinese	math	english
1	小明	1	115	-163614330
2	小王	1	125	-163614168
3	小超	1	135	-163614573
4	小李	1	145	-163614978
drop view v1;
drop table test1;
create table test1(a1 int primary key AUTO_INCREMENT,name varchar(20),chinese BIGINT,math BIGINT,english INTEGER);
insert into test1(name,chinese,math,english) values('小明',101,115,113);
insert into test1(name,chinese,math,english) values('小王',103,125,115);
insert into test1(name,chinese,math,english) values('小超',107,135,108);
insert into test1(name,chinese,math,english) values('小李',119,145,100);
create or REPLACE view v1 as SELECT * from test1 where chinese<=121 and math>=100 and english<120 WITH CHECK OPTION;
SELECT * from test1 order by a1 asc;
a1	name	chinese	math	english
1	小明	101	115	113
2	小王	103	125	115
3	小超	107	135	108
4	小李	119	145	100
SELECT * from v1 order by a1 asc;
a1	name	chinese	math	english
1	小明	101	115	113
2	小王	103	125	115
3	小超	107	135	108
4	小李	119	145	100
update v1 set english=english*sin(tan(81));
SELECT * from test1 order by a1 asc;
a1	name	chinese	math	english
1	小明	101	115	-82
2	小王	103	125	-83
3	小超	107	135	-78
4	小李	119	145	-72
SELECT * from v1 order by a1 asc;
a1	name	chinese	math	english
1	小明	101	115	-82
2	小王	103	125	-83
3	小超	107	135	-78
4	小李	119	145	-72
update v1 set english=english*sin(cos(81));
SELECT * from test1 order by a1 asc;
a1	name	chinese	math	english
1	小明	101	115	-57
2	小王	103	125	-58
3	小超	107	135	-55
4	小李	119	145	-50
SELECT * from v1 order by a1 asc;
a1	name	chinese	math	english
1	小明	101	115	-57
2	小王	103	125	-58
3	小超	107	135	-55
4	小李	119	145	-50
update v1 set english=log(8100)+log10(8100)-ln(6400) ;
SELECT * from test1 order by a1 asc;
a1	name	chinese	math	english
1	小明	101	115	4
2	小王	103	125	4
3	小超	107	135	4
4	小李	119	145	4
SELECT * from v1 order by a1 asc;
a1	name	chinese	math	english
1	小明	101	115	4
2	小王	103	125	4
3	小超	107	135	4
4	小李	119	145	4
update v1 set english=(select chinese from test1 where chinese=log(log10(81)) LIMIT 1) ;
SELECT * from test1 order by a1 asc;
a1	name	chinese	math	english
1	小明	101	115	4
2	小王	103	125	4
3	小超	107	135	4
4	小李	119	145	4
SELECT * from v1 order by a1 asc;
a1	name	chinese	math	english
1	小明	101	115	4
2	小王	103	125	4
3	小超	107	135	4
4	小李	119	145	4
update v1 set english=(update v1 set english=log(log10(81)) LIMIT 1) ;
update v1 set english=english*sin(asin(81));
SELECT * from test1 order by a1 asc;
a1	name	chinese	math	english
1	小明	101	115	4
2	小王	103	125	4
3	小超	107	135	4
4	小李	119	145	4
SELECT * from v1 order by a1 asc;
a1	name	chinese	math	english
1	小明	101	115	4
2	小王	103	125	4
3	小超	107	135	4
4	小李	119	145	4
drop view v1;
drop table test1;
#view-2-4  delete删除内容
#view-2-4-1-1  嵌套语句
create table test1(a1 int ,name varchar(20),chinese BIGINT,math BIGINT,english INTEGER);
insert into test1 values(1,'小明',101,125,98);
insert into test1 values(2,'小王',103,135,88);
insert into test1 values(3,'小超',107,145,48);
insert into test1 values(4,'小李',119,155,18);
create or REPLACE view v1 as SELECT * from test1 where chinese<=150 and math>=120 and english<100 WITH CHECK OPTION;
SELECT * from test1 order by a1 asc;
a1	name	chinese	math	english
1	小明	101	125	98
2	小王	103	135	88
3	小超	107	145	48
4	小李	119	155	18
SELECT * from v1 order by a1 asc;
a1	name	chinese	math	english
1	小明	101	125	98
2	小王	103	135	88
3	小超	107	145	48
4	小李	119	155	18
delete from v1 where english=(SELECT english from v1 where english=98);
SELECT * from test1 order by a1 asc;
a1	name	chinese	math	english
2	小王	103	135	88
3	小超	107	145	48
4	小李	119	155	18
SELECT * from v1 order by a1 asc;
a1	name	chinese	math	english
2	小王	103	135	88
3	小超	107	145	48
4	小李	119	155	18
delete from v1 where EXISTS(SELECT english from v1 where english=98);
SELECT * from test1 order by a1 asc;
a1	name	chinese	math	english
2	小王	103	135	88
3	小超	107	145	48
4	小李	119	155	18
SELECT * from v1 order by a1 asc;
a1	name	chinese	math	english
2	小王	103	135	88
3	小超	107	145	48
4	小李	119	155	18
delete from v1 where english=all(SELECT english from v1 where english=98);
SELECT * from test1 order by a1 asc;
a1	name	chinese	math	english
SELECT * from v1 order by a1 asc;
a1	name	chinese	math	english
insert into test1 values(1,'小明',101,125,98);
insert into test1 values(2,'小王',103,135,88);
insert into test1 values(3,'小超',107,145,48);
insert into test1 values(4,'小李',119,155,18);
SELECT * from test1 order by a1 asc;
a1	name	chinese	math	english
1	小明	101	125	98
2	小王	103	135	88
3	小超	107	145	48
4	小李	119	155	18
SELECT * from v1 order by a1 asc;
a1	name	chinese	math	english
1	小明	101	125	98
2	小王	103	135	88
3	小超	107	145	48
4	小李	119	155	18
delete from v1 where english>all(SELECT english from v1 where english=98);
SELECT * from test1 order by a1 asc;
a1	name	chinese	math	english
1	小明	101	125	98
2	小王	103	135	88
3	小超	107	145	48
4	小李	119	155	18
SELECT * from v1 order by a1 asc;
a1	name	chinese	math	english
1	小明	101	125	98
2	小王	103	135	88
3	小超	107	145	48
4	小李	119	155	18
delete from v1 where english<all(SELECT english from v1 where english=98);
SELECT * from test1 order by a1 asc;
a1	name	chinese	math	english
1	小明	101	125	98
SELECT * from v1 order by a1 asc;
a1	name	chinese	math	english
1	小明	101	125	98
DELETE from test1;
drop view v1;
insert into test1 values(1,'小明',101,125,98);
insert into test1 values(2,'小王',103,135,88);
insert into test1 values(3,'小超',107,145,48);
insert into test1 values(4,'小李',119,155,18);
create or REPLACE view v1 as SELECT * from test1 where chinese<=150 and math>=120 and english<100 WITH CHECK OPTION;
SELECT * from test1 order by a1 asc;
a1	name	chinese	math	english
1	小明	101	125	98
2	小王	103	135	88
3	小超	107	145	48
4	小李	119	155	18
SELECT * from v1 order by a1 asc;
a1	name	chinese	math	english
1	小明	101	125	98
2	小王	103	135	88
3	小超	107	145	48
4	小李	119	155	18
delete from v1 where english=any(SELECT english from v1 where english=98);
SELECT * from test1 order by a1 asc;
a1	name	chinese	math	english
2	小王	103	135	88
3	小超	107	145	48
4	小李	119	155	18
SELECT * from v1 order by a1 asc;
a1	name	chinese	math	english
2	小王	103	135	88
3	小超	107	145	48
4	小李	119	155	18
delete from v1 where english=some(SELECT english from v1 where english=98);
SELECT * from test1 order by a1 asc;
a1	name	chinese	math	english
2	小王	103	135	88
3	小超	107	145	48
4	小李	119	155	18
SELECT * from v1 order by a1 asc;
a1	name	chinese	math	english
2	小王	103	135	88
3	小超	107	145	48
4	小李	119	155	18
delete from v1 where english in(SELECT english from v1 where english=98);
SELECT * from test1 order by a1 asc;
a1	name	chinese	math	english
2	小王	103	135	88
3	小超	107	145	48
4	小李	119	155	18
SELECT * from v1 order by a1 asc;
a1	name	chinese	math	english
2	小王	103	135	88
3	小超	107	145	48
4	小李	119	155	18
drop view v1;
drop table test1;
#view-2-4-1-2  单列字段数据
create table test1(a1 int ,name varchar(20),chinese BIGINT,math BIGINT,english INTEGER);
insert into test1 values(1,'小明',101,125,98);
insert into test1 values(2,'小王',103,135,88);
insert into test1 values(3,'小超',107,145,48);
insert into test1 values(4,'小李',119,155,18);
create or REPLACE view v1 as SELECT * from test1 where chinese<=150 and math>=120 and english<100 WITH CHECK OPTION;
create or REPLACE view v2 as SELECT * from test1 where chinese<=150 and math>=120 and english<100 WITH CHECK OPTION;
create or REPLACE view v3 as SELECT * from test1 where chinese<=150 and math>=120 and english<100 WITH CHECK OPTION;
SELECT * from test1 order by a1 asc;
a1	name	chinese	math	english
1	小明	101	125	98
2	小王	103	135	88
3	小超	107	145	48
4	小李	119	155	18
SELECT * from v1 order by a1 asc;
a1	name	chinese	math	english
1	小明	101	125	98
2	小王	103	135	88
3	小超	107	145	48
4	小李	119	155	18
delete from v1 where english=18;
SELECT * from test1 order by a1 asc;
a1	name	chinese	math	english
1	小明	101	125	98
2	小王	103	135	88
3	小超	107	145	48
SELECT * from v1 order by a1 asc;
a1	name	chinese	math	english
1	小明	101	125	98
2	小王	103	135	88
3	小超	107	145	48
UPDATE v1 set english=null;
SELECT * from test1 order by a1 asc;
a1	name	chinese	math	english
1	小明	101	125	98
2	小王	103	135	88
3	小超	107	145	48
SELECT * from v1 order by a1 asc;
a1	name	chinese	math	english
1	小明	101	125	98
2	小王	103	135	88
3	小超	107	145	48
DELETE from v1;
SELECT * from test1 order by a1 asc;
a1	name	chinese	math	english
SELECT * from v1 order by a1 asc;
a1	name	chinese	math	english
#view-2-4-1-3
DELETE from v2 v3;
drop view v2,v3;
drop view v1;
drop table test1;
#view-2-5  约束
#NOT NULL 非空
create table test1(a1 int ,name varchar(20),chinese BIGINT not null,math BIGINT,english INTEGER);
insert into test1 values(1,'小明',101,125,98);
create or REPLACE view v1 as SELECT * from test1 where chinese<=null and math>=120 and english<100 WITH CHECK OPTION;
SELECT * from test1 order by a1 asc;
a1	name	chinese	math	english
1	小明	101	125	98
SELECT * from v1 order by a1 asc;
a1	name	chinese	math	english
replace into v1 values(1,'小明',null,125,98);
replace into v1 values(1,'小明',0,125,98);
replace into v1 values(2,'小明',-1,125,98);
SELECT * from test1 order by a1 asc;
a1	name	chinese	math	english
1	小明	101	125	98
SELECT * from v1 order by a1 asc;
a1	name	chinese	math	english
drop view v1;
drop table test1;
#UNIQUE Key 唯一
create table test1(a1 int,name varchar(20),chinese BIGINT UNIQUE Key,math BIGINT,english INTEGER);
insert into test1 values(1,'小明',101,125,98);
create or REPLACE view v1 as SELECT * from test1 where chinese>=101 and math>=120 and english<100 WITH CHECK OPTION;
replace into v1 values(2,'小明',101,125,98);
replace into v1 values(3,'小明',101,125,98);
SELECT * from test1 order by a1 asc;
a1	name	chinese	math	english
3	小明	101	125	98
SELECT * from v1 order by a1 asc;
a1	name	chinese	math	english
3	小明	101	125	98
drop view v1;
drop table test1;
# FOREIGN KEY 外键
create table test1(a1 int PRIMARY KEY,name varchar(20),chinese BIGINT,math BIGINT,english INTEGER);
insert into test1 values(1,'小明',101,125,98);
create table test2(a1 int,name varchar(20),chinese BIGINT,math BIGINT,english INTEGER,constraint fk_test1_test2_a1 FOREIGN key(a1) REFERENCES test1(a1));
insert into test1 values(5,'小张',91,121,80);
create or REPLACE view v1 as SELECT * from test1 where chinese>=101 and math>=120 and english<100 WITH CHECK OPTION;
SELECT * from test1 order by a1 asc;
a1	name	chinese	math	english
1	小明	101	125	98
5	小张	91	121	80
SELECT * from v1 order by a1 asc;
a1	name	chinese	math	english
1	小明	101	125	98
insert into v1 values(2,'小明',99,124,78);
replace into v1 values(2,'小明',103,124,78);
insert into v1 values(3,'小王',103,124,78);
insert into v1 values(4,'小草',110,130,70);
SELECT * from test1 order by a1 asc;
a1	name	chinese	math	english
1	小明	101	125	98
2	小明	103	124	78
3	小王	103	124	78
4	小草	110	130	70
5	小张	91	121	80
SELECT * from v1 order by a1 asc;
a1	name	chinese	math	english
1	小明	101	125	98
2	小明	103	124	78
3	小王	103	124	78
4	小草	110	130	70
drop view v1;
drop table test2;
drop table test1;
# PRIMARY KEY 主键
create table test1(a1 int PRIMARY KEY,name varchar(20),chinese BIGINT,math BIGINT,english INTEGER);
insert into test1 values(1,'小明',101,125,98);
create or REPLACE view v1 as SELECT * from test1 where chinese>=101 and math>=120 and english<100 WITH CHECK OPTION;
SELECT * from test1 order by a1 asc;
a1	name	chinese	math	english
1	小明	101	125	98
SELECT * from v1 order by a1 asc;
a1	name	chinese	math	english
1	小明	101	125	98
replace into v1 values(2,'小明',100,125,98);
replace into v1 values(3,'小明',102,125,98);
SELECT * from test1 order by a1 asc;
a1	name	chinese	math	english
1	小明	101	125	98
3	小明	102	125	98
SELECT * from v1 order by a1 asc;
a1	name	chinese	math	english
1	小明	101	125	98
3	小明	102	125	98
drop view v1;
drop table test1;
#view-2-6  索引
create table test1(a1 int PRIMARY KEY,name varchar(20),chinese BIGINT,math BIGINT,english INTEGER,index suoyin(chinese));
insert into test1 values(1,'小明',101,125,98);
create or REPLACE view v1 as SELECT * from test1 where chinese>=101 and math>=120 and english<100 WITH CHECK OPTION;
SELECT * from test1 order by a1 asc;
a1	name	chinese	math	english
1	小明	101	125	98
SELECT * from v1 order by a1 asc;
a1	name	chinese	math	english
1	小明	101	125	98
insert into v1 values(2,'小明',103,125,98);
replace into v1 values(3,'小明',102,125,98);
SELECT * from test1 order by a1 asc;
a1	name	chinese	math	english
1	小明	101	125	98
2	小明	103	125	98
3	小明	102	125	98
SELECT * from v1 order by a1 asc;
a1	name	chinese	math	english
1	小明	101	125	98
2	小明	103	125	98
3	小明	102	125	98
UPDATE v1 set chinese=chinese-1;
SELECT * from test1 order by a1 asc;
a1	name	chinese	math	english
1	小明	101	125	98
2	小明	103	125	98
3	小明	102	125	98
SELECT * from v1 order by a1 asc;
a1	name	chinese	math	english
1	小明	101	125	98
2	小明	103	125	98
3	小明	102	125	98
UPDATE v1 set chinese=chinese+21;
SELECT * from test1 order by a1 asc;
a1	name	chinese	math	english
1	小明	122	125	98
2	小明	124	125	98
3	小明	123	125	98
SELECT * from v1 order by a1 asc;
a1	name	chinese	math	english
1	小明	122	125	98
2	小明	124	125	98
3	小明	123	125	98
DELETE from v1;
drop view v1;
drop table test1;
#view-3  多表
create table test1(a1 int,name varchar(20),chinese BIGINT,math BIGINT,english INTEGER);
insert into test1 values(1,'小明',101,115,113);
insert into test1 values(2,'小王',103,110,115);
insert into test1 values(3,'小超',107,116,108);
insert into test1 values(4,'小李',119,119,100);
create table test2(b1 int,xuexiao varchar(20),beiyong BIGINT,fenshu BIGINT,banji BIGINT);
insert into test2 values(1,'中国科学院',99,120,1);
insert into test2 values(2,'中国社会科学院',102,130,2);
insert into test2 values(3,'清华大学',130,140,2);
insert into test2 values(4,'北京大学',30,150,1);
#多表连接
create view v1 as SELECT * from test1,test2 where test1.a1 = test2.b1 WITH CHECK OPTION;
create view v2 as SELECT test1.a1,test2.b1 from test1,test2 where a1 = b1 WITH CHECK OPTION;
create view v3 as SELECT * from test1,test2 WITH CHECK OPTION;
create view v4 as SELECT * from test1 RIGHT JOIN test2 on test1.a1 = test2.b1 WITH CHECK OPTION;
create view v5 as SELECT * from test1 union SELECT * from test2 WITH CHECK OPTION;
create view v6 as SELECT * from test1 LEFT JOIN test2 on test1.a1 = test2.b1 WITH CHECK OPTION;
drop table test1;
drop table test2;
# Clean up users
drop user hjw@'%' ;
