#Environmental cleaning
drop user hjw@'%';
create user hjw identified by 'hjw';
grant all on *.* to hjw WITH GRANT OPTION;
#view-4   分区
#view-5   视图嵌套
create database hz;
use hz;
drop table test1;
drop TABLE test2;
drop view v1;
drop view v2;
drop view v3;
drop view v4;
#分区-4
#分区-4-1  list分区
create table test1(a1 int,chinese int,math int,english int)partition by list(a1)(partition p2 values in(1,2));
create or REPLACE view v1 as SELECT * from test1 where chinese<=121 and math>=100 and english<120 WITH CHECK OPTION;
replace INTO v1 partition(p0) VALUES(0,110,101,119);
replace INTO v1 partition(p0) VALUES(1,112,150,100);
replace INTO v1 partition(p0) VALUES(2,110,101,119);
SELECT * from test1 order by a1 asc;
a1	chinese	math	english
1	112	150	100
2	110	101	119
SELECT * from v1 order by a1 asc;
a1	chinese	math	english
1	112	150	100
2	110	101	119
replace INTO v1 partition(p0) VALUES(3,110,101,119);
replace INTO v1 partition(p1) VALUES(0,110,101,119);
replace INTO v1 partition(p1) VALUES(1,110,101,119);
replace INTO v1 partition(p1) VALUES(2,110,101,119);
replace INTO v1 partition(p1) VALUES(3,110,101,119);
INSERT INTO v1 partition(p2) VALUES(0,110,101,119);
INSERT INTO v1 partition(p2) VALUES(1,110,101,119);
INSERT INTO v1 partition(p2) VALUES(2,110,101,119);
INSERT INTO v1 partition(p2) VALUES(3,110,101,119);
SELECT * from test1 order by a1 asc;
a1	chinese	math	english
1	112	150	100
1	110	101	119
1	110	101	119
2	110	101	119
2	110	101	119
2	110	101	119
SELECT * from v1 order by a1 asc;
a1	chinese	math	english
1	112	150	100
1	110	101	119
1	110	101	119
2	110	101	119
2	110	101	119
2	110	101	119
UPDATE v1 partition(p0) set english=math-1;
UPDATE v1 partition(p0) set english=english-20;
SELECT * from test1 order by a1 asc;
a1	chinese	math	english
1	112	150	80
1	110	101	99
1	110	101	99
2	110	101	99
2	110	101	99
2	110	101	99
SELECT * from v1 partition(p0) order by a1 asc;
a1	chinese	math	english
1	112	150	80
1	110	101	99
1	110	101	99
2	110	101	99
2	110	101	99
2	110	101	99
delete from v1 partition(p0) where math=some(SELECT math from v1 where math=101);
delete from v1 partition(p0) where math>(SELECT math from v1 where math=101);
SELECT * from test1 order by a1 asc;
a1	chinese	math	english
1	112	150	80
SELECT * from v1 partition(p0) order by a1 asc;
a1	chinese	math	english
1	112	150	80
UPDATE v1 partition(p0) set english=null;
SELECT * from test1 order by a1 asc;
a1	chinese	math	english
1	112	150	80
SELECT * from v1 partition(p0) order by a1 asc;
a1	chinese	math	english
1	112	150	80
UPDATE v1 partition(p0) set english=119;
SELECT * from test1 order by a1 asc;
a1	chinese	math	english
1	112	150	119
SELECT * from v1 partition(p0) order by a1 asc;
a1	chinese	math	english
1	112	150	119
UPDATE v1 partition(p1) set english=english+119;
drop view v1;
drop table test1;
#分区-4-2    hash 分区
create table test1(a1 int,chinese int,math int,english int)partition by hash(a1);
create or REPLACE view v1 as SELECT * from test1 where chinese<=121 and math>=100 and english<120 WITH CHECK OPTION;
replace INTO v1 partition(p0) VALUES(1,110,101,119);
insert  INTO v1 partition(p0) VALUES(2,112,150,100);
insert  INTO v1 partition(p0) VALUES(3,118,140,115);
SELECT * from test1 order by a1 asc;
a1	chinese	math	english
1	110	101	119
2	112	150	100
3	118	140	115
SELECT * from v1 partition(p0) order by a1 asc;
a1	chinese	math	english
1	110	101	119
2	112	150	100
3	118	140	115
delete from v1 partition(p0) where english=100 LIMIT 1;
SELECT * from test1 order by a1 asc;
a1	chinese	math	english
1	110	101	119
3	118	140	115
SELECT * from v1 partition(p0) order by a1 asc;
a1	chinese	math	english
1	110	101	119
3	118	140	115
delete from v1 partition(p0) where english<(SELECT english from v1 where english=(SELECT english from v1 where english=115));
SELECT * from test1 order by a1 asc;
a1	chinese	math	english
1	110	101	119
3	118	140	115
SELECT * from v1 partition(p0) order by a1 asc;
a1	chinese	math	english
1	110	101	119
3	118	140	115
update v1 partition(p0) set english=120 where english=115;
update v1 partition(p0) set english=119 where english=115;
SELECT * from test1 order by a1 asc;
a1	chinese	math	english
1	110	101	119
3	118	140	119
SELECT * from v1 partition(p0) order by a1 asc;
a1	chinese	math	english
1	110	101	119
3	118	140	119
update v1  partition(p0) set english=101 LIMIT 1;
SELECT * from test1 order by a1 asc;
a1	chinese	math	english
1	110	101	101
3	118	140	119
SELECT * from v1 partition(p0) order by a1 asc;
a1	chinese	math	english
1	110	101	101
3	118	140	119
drop view v1;
drop table test1;
#分区-4-3  range 分区
create table test1(a1 int,chinese int,math int,english int)partition by range(a1)(partition p0 VALUES less than MAXVALUE);
create or REPLACE view v1 as SELECT * from test1 where chinese<=121 and math>=100 and english<120 WITH CHECK OPTION;
replace INTO v1 partition(p0) VALUES(1,110,101,119);
insert  INTO v1 partition(p0) VALUES(2,112,150,100);
insert  INTO v1 partition(p0) VALUES(3,118,140,115);
replace INTO v1 partition(p1) VALUES(1,110,101,119);
insert  INTO v1 partition(p1) VALUES(2,112,150,100);
replace INTO v1 partition(p2) VALUES(1,110,101,119);
insert  INTO v1 partition(p2) VALUES(2,112,150,100);
SELECT * from test1 order by a1 asc;
a1	chinese	math	english
1	110	101	119
1	110	101	119
1	110	101	119
2	112	150	100
2	112	150	100
2	112	150	100
3	118	140	115
SELECT * from v1 partition(p0) order by a1 asc;
a1	chinese	math	english
1	110	101	119
1	110	101	119
1	110	101	119
2	112	150	100
2	112	150	100
2	112	150	100
3	118	140	115
delete from v1 partition(p0) where english=100 LIMIT 1;
SELECT * from test1 order by a1 asc;
a1	chinese	math	english
1	110	101	119
1	110	101	119
1	110	101	119
2	112	150	100
2	112	150	100
3	118	140	115
SELECT * from v1 partition(p0) order by a1 asc;
a1	chinese	math	english
1	110	101	119
1	110	101	119
1	110	101	119
2	112	150	100
2	112	150	100
3	118	140	115
delete from v1 partition(p0) where english<(SELECT english from v1 where english=(SELECT english from v1 where english=115));
SELECT * from test1 order by a1 asc;
a1	chinese	math	english
1	110	101	119
1	110	101	119
1	110	101	119
3	118	140	115
SELECT * from v1 partition(p0) order by a1 asc;
a1	chinese	math	english
1	110	101	119
1	110	101	119
1	110	101	119
3	118	140	115
update v1 partition(p0) set english=120 where english=115;
update v1 partition(p0) set english=119 where english=115;
SELECT * from test1 order by a1 asc;
a1	chinese	math	english
1	110	101	119
1	110	101	119
1	110	101	119
3	118	140	119
SELECT * from v1 partition(p0) order by a1 asc;
a1	chinese	math	english
1	110	101	119
1	110	101	119
1	110	101	119
3	118	140	119
update v1 partition(p0) set english=101 LIMIT 1;
SELECT * from test1 order by a1 asc;
a1	chinese	math	english
1	110	101	101
1	110	101	119
1	110	101	119
3	118	140	119
SELECT * from v1 partition(p0) order by a1 asc;
a1	chinese	math	english
1	110	101	101
1	110	101	119
1	110	101	119
3	118	140	119
drop view v1;
drop table test1;
#分区-4-4   key 分区
create table test1(a1 int,chinese int,math int,english int)partition by key(a1);
create or REPLACE view v1 as SELECT * from test1 where chinese<=121 and math>=100 and english<120 WITH CHECK OPTION;
replace INTO v1 partition(p0) VALUES(1,110,101,119);
insert  INTO v1 partition(p0) VALUES(2,112,150,100);
insert  INTO v1 partition(p0) VALUES(3,118,140,115);
SELECT * from test1 order by a1 asc;
a1	chinese	math	english
1	110	101	119
2	112	150	100
3	118	140	115
SELECT * from v1 partition(p0) order by a1 asc;
a1	chinese	math	english
1	110	101	119
2	112	150	100
3	118	140	115
delete from v1  partition(p0) where english=100 LIMIT 1;
SELECT * from test1 order by a1 asc;
a1	chinese	math	english
1	110	101	119
3	118	140	115
SELECT * from v1 partition(p0) order by a1 asc;
a1	chinese	math	english
1	110	101	119
3	118	140	115
delete from v1 partition(p0) where english<(SELECT english from v1 where english=(SELECT english from v1 where english=115));
SELECT * from test1 order by a1 asc;
a1	chinese	math	english
1	110	101	119
3	118	140	115
SELECT * from v1 partition(p0) order by a1 asc;
a1	chinese	math	english
1	110	101	119
3	118	140	115
update v1 partition(p0) set english=120 where english=115;
update v1  partition(p0) set english=109 where english=(SELECT english from v1 where english=119 LIMIT 1 );
SELECT * from test1 order by a1 asc;
a1	chinese	math	english
1	110	101	109
3	118	140	115
SELECT * from v1 partition(p0) order by a1 asc;
a1	chinese	math	english
1	110	101	109
3	118	140	115
update v1 partition(p0) set english=101 LIMIT 1;
SELECT * from test1 order by a1 asc;
a1	chinese	math	english
1	110	101	101
3	118	140	115
SELECT * from v1 partition(p0) order by a1 asc;
a1	chinese	math	english
1	110	101	101
3	118	140	115
drop view v1;
drop table test1;
#view-5   视图嵌套
#view-5-1  WITH CHECK OPTION嵌套
create table test1(a1 int ,name varchar(20),chinese BIGINT,math BIGINT,english INTEGER);
insert into test1 values(1,'小明',101,115,113);
create or REPLACE view v2 as SELECT * from test1 where chinese<=121 and math>=100 and english<120 WITH CHECK OPTION;
create or REPLACE view v3 as SELECT * from test1 where chinese>=30 and math<160 and english>=60 WITH CHECK OPTION;
create or REPLACE view v4 as SELECT * from v3 where chinese<=(select chinese from v2 LIMIT 1 ) WITH CHECK OPTION;
create or REPLACE view v4 as SELECT * from v3 where chinese<=110 and math<155 and english>=59.5 WITH CHECK OPTION;
replace into v4 values(2,'小王',29,110,115);
replace into v4 values(2,'小超',107,154,108);
replace into v4 values(3,'小李',100,129,59.51);
replace into v4 values(4,'小李',100,129,59.59);
replace into v4 values(5,'小李',100,129,60.1);
update v4 set english=75 where english=(SELECT english from v3 where a1=5);
SELECT * from test1 order by a1 asc;
a1	name	chinese	math	english
1	小明	101	115	113
2	小超	107	154	108
3	小李	100	129	75
4	小李	100	129	75
5	小李	100	129	75
SELECT * from v4 order by a1 asc;
a1	name	chinese	math	english
1	小明	101	115	113
2	小超	107	154	108
3	小李	100	129	75
4	小李	100	129	75
5	小李	100	129	75
update v4 set english=75 where english=65 LIMIT 1;
SELECT * from test1 order by a1 asc;
a1	name	chinese	math	english
1	小明	101	115	113
2	小超	107	154	108
3	小李	100	129	75
4	小李	100	129	75
5	小李	100	129	75
SELECT * from v4 order by a1 asc;
a1	name	chinese	math	english
1	小明	101	115	113
2	小超	107	154	108
3	小李	100	129	75
4	小李	100	129	75
5	小李	100	129	75
update v4 set english=75 where english=(SELECT english from v3 where a1=(SELECT a1 from v3 LIMIT 1));
SELECT * from test1 order by a1 asc;
a1	name	chinese	math	english
1	小明	101	115	75
2	小超	107	154	108
3	小李	100	129	75
4	小李	100	129	75
5	小李	100	129	75
SELECT * from v4 order by a1 asc;
a1	name	chinese	math	english
1	小明	101	115	75
2	小超	107	154	108
3	小李	100	129	75
4	小李	100	129	75
5	小李	100	129	75
DELETE from v4 where english=(SELECT english from v3 where english=65 LIMIT 1);
SELECT * from test1 order by a1 asc;
a1	name	chinese	math	english
1	小明	101	115	75
2	小超	107	154	108
3	小李	100	129	75
4	小李	100	129	75
5	小李	100	129	75
SELECT * from v4 order by a1 asc;
a1	name	chinese	math	english
1	小明	101	115	75
2	小超	107	154	108
3	小李	100	129	75
4	小李	100	129	75
5	小李	100	129	75
DELETE from v4 where english=(SELECT english from v3 where english=75 LIMIT 1) LIMIT 1;
SELECT * from test1 order by a1 asc;
a1	name	chinese	math	english
2	小超	107	154	108
3	小李	100	129	75
4	小李	100	129	75
5	小李	100	129	75
SELECT * from v4 order by a1 asc;
a1	name	chinese	math	english
2	小超	107	154	108
3	小李	100	129	75
4	小李	100	129	75
5	小李	100	129	75
DELETE from v4 where english+math;
SELECT * from test1 order by a1 asc;
a1	name	chinese	math	english
SELECT * from v4 order by a1 asc;
a1	name	chinese	math	english
drop table test1;
drop view v2;
drop view v3;
drop view v4;
#view-5-2  WITH LOCAL CHECK OPTION嵌套
create table test1(a1 int ,name varchar(20),chinese BIGINT,math BIGINT,english INTEGER);
insert into test1 values(1,'小明',101,115,113);
create or REPLACE view v3 as SELECT * from test1 where chinese<=121 and math>=100 and english<120 WITH LOCAL CHECK OPTION;
create or REPLACE view v4 as SELECT * from v3 where chinese>=100 and math<155 and english>=60 WITH LOCAL CHECK OPTION;
replace into v4 values(2,'小王',29,110,115);
replace into v4 values(2,'小超',107,154,108);
replace into v4 values(3,'小李',100,129,59.51);
replace into v4 values(4,'小李',100,129,60*2-1);
replace into v4 values(5,'小李',100,129,30+30-10+20);
SELECT * from v4 order by a1 asc;
a1	name	chinese	math	english
1	小明	101	115	113
2	小超	107	154	108
3	小李	100	129	60
4	小李	100	129	119
5	小李	100	129	70
update v4 set english=75 where english=(SELECT english from v3 where a1=5);
SELECT * from test1 order by a1 asc;
a1	name	chinese	math	english
1	小明	101	115	113
2	小超	107	154	108
3	小李	100	129	60
4	小李	100	129	119
5	小李	100	129	75
SELECT * from v4 order by a1 asc;
a1	name	chinese	math	english
1	小明	101	115	113
2	小超	107	154	108
3	小李	100	129	60
4	小李	100	129	119
5	小李	100	129	75
update v4 set english=75 where english=60 LIMIT 1;
SELECT * from test1 order by a1 asc;
a1	name	chinese	math	english
1	小明	101	115	113
2	小超	107	154	108
3	小李	100	129	75
4	小李	100	129	119
5	小李	100	129	75
SELECT * from v4 order by a1 asc;
a1	name	chinese	math	english
1	小明	101	115	113
2	小超	107	154	108
3	小李	100	129	75
4	小李	100	129	119
5	小李	100	129	75
update v4 set english=75 where english=(SELECT english from v3 where a1=(SELECT a1 from v3 LIMIT 1));
SELECT * from test1 order by a1 asc;
a1	name	chinese	math	english
1	小明	101	115	75
2	小超	107	154	108
3	小李	100	129	75
4	小李	100	129	119
5	小李	100	129	75
SELECT * from v4 order by a1 asc;
a1	name	chinese	math	english
1	小明	101	115	75
2	小超	107	154	108
3	小李	100	129	75
4	小李	100	129	119
5	小李	100	129	75
DELETE from v4 where english=(SELECT english from v3 where english=75 LIMIT 1)LIMIT 1;
SELECT * from test1 order by a1 asc;
a1	name	chinese	math	english
2	小超	107	154	108
3	小李	100	129	75
4	小李	100	129	119
5	小李	100	129	75
SELECT * from v4 order by a1 asc;
a1	name	chinese	math	english
2	小超	107	154	108
3	小李	100	129	75
4	小李	100	129	119
5	小李	100	129	75
DELETE from v4 where english=(SELECT english from v3 where english=119 LIMIT 1) LIMIT 1;
SELECT * from test1 order by a1 asc;
a1	name	chinese	math	english
2	小超	107	154	108
3	小李	100	129	75
5	小李	100	129	75
SELECT * from v4 order by a1 asc;
a1	name	chinese	math	english
2	小超	107	154	108
3	小李	100	129	75
5	小李	100	129	75
DELETE from v4 where english+math;
SELECT * from test1 order by a1 asc;
a1	name	chinese	math	english
SELECT * from v4 order by a1 asc;
a1	name	chinese	math	english
drop table test1;
drop view v3;
drop view v4;
#view-5-3  WITH CASCADED CHECK OPTION嵌套
create table test1(a1 int ,name varchar(20),chinese BIGINT,math BIGINT,english INTEGER);
insert into test1 values(1,'小明',101,115,113);
create or REPLACE view v3 as SELECT * from test1 where chinese<=121 and math>=100 and english<120 WITH CASCADED CHECK OPTION;
create or REPLACE view v4 as SELECT * from v3 where chinese>=100 and math<155 and english>=60 WITH CASCADED CHECK OPTION;
replace into v4 values(2,'小王',29,110,115);
replace into v4 values(2,'小超',107,154,108);
replace into v4 values(3,'小李',100,129,59.51);
replace into v4 values(4,'小李',100,129,60*2-1);
replace into v4 values(5,'小李',100,129,30+30-10+20);
SELECT * from v4 order by a1 asc;
a1	name	chinese	math	english
1	小明	101	115	113
2	小超	107	154	108
3	小李	100	129	60
4	小李	100	129	119
5	小李	100	129	70
update v4 set english=75 where english=(SELECT english from v3 where a1=5);
SELECT * from test1 order by a1 asc;
a1	name	chinese	math	english
1	小明	101	115	113
2	小超	107	154	108
3	小李	100	129	60
4	小李	100	129	119
5	小李	100	129	75
SELECT * from v4 order by a1 asc;
a1	name	chinese	math	english
1	小明	101	115	113
2	小超	107	154	108
3	小李	100	129	60
4	小李	100	129	119
5	小李	100	129	75
update v4 set english=75 where english=60 LIMIT 1;
SELECT * from test1 order by a1 asc;
a1	name	chinese	math	english
1	小明	101	115	113
2	小超	107	154	108
3	小李	100	129	75
4	小李	100	129	119
5	小李	100	129	75
SELECT * from v4 order by a1 asc;
a1	name	chinese	math	english
1	小明	101	115	113
2	小超	107	154	108
3	小李	100	129	75
4	小李	100	129	119
5	小李	100	129	75
update v4 set english=75 where english=(SELECT english from v3 where a1=(SELECT a1 from v3 LIMIT 1));
SELECT * from test1 order by a1 asc;
a1	name	chinese	math	english
1	小明	101	115	75
2	小超	107	154	108
3	小李	100	129	75
4	小李	100	129	119
5	小李	100	129	75
SELECT * from v4 order by a1 asc;
a1	name	chinese	math	english
1	小明	101	115	75
2	小超	107	154	108
3	小李	100	129	75
4	小李	100	129	119
5	小李	100	129	75
DELETE from v4 where english=(SELECT english from v3 where english=75 LIMIT 1)LIMIT 1;
SELECT * from test1 order by a1 asc;
a1	name	chinese	math	english
2	小超	107	154	108
3	小李	100	129	75
4	小李	100	129	119
5	小李	100	129	75
SELECT * from v4 order by a1 asc;
a1	name	chinese	math	english
2	小超	107	154	108
3	小李	100	129	75
4	小李	100	129	119
5	小李	100	129	75
DELETE from v4 where english=(SELECT english from v3 where english=119 LIMIT 1) LIMIT 1;
SELECT * from test1 order by a1 asc;
a1	name	chinese	math	english
2	小超	107	154	108
3	小李	100	129	75
5	小李	100	129	75
SELECT * from v4 order by a1 asc;
a1	name	chinese	math	english
2	小超	107	154	108
3	小李	100	129	75
5	小李	100	129	75
DELETE from v4 where math-english;
SELECT * from test1 order by a1 asc;
a1	name	chinese	math	english
SELECT * from v4 order by a1 asc;
a1	name	chinese	math	english
drop table test1;
drop view v3;
drop view v4;
# Clean up users
drop user hjw@'%' ;
