alter system set _enable_adaptive_compaction = True tenant sys;
alter system set _enable_adaptive_compaction = True tenant all_user;
alter system set _enable_adaptive_compaction = True tenant all_meta;
alter system set minor_compact_trigger = 10 tenant sys;
alter system set minor_compact_trigger = 10 tenant all_user;
alter system set minor_compact_trigger = 10 tenant all_meta;
drop table if exists tomb_table;
create table tomb_table (c1 int, c2 int, c3 int, c4 int, PRIMARY KEY (`c1`));
select count(1) from tomb_table;
count(1)
5000
alter system minor freeze;
select count(1) from tomb_table;
count(1)
10000
update tomb_table set c3 = c3 + 1, c4 = c4 + 2 where c1 < 5000;
alter system minor freeze;
delete from tomb_table where c1 < 2000;
alter system minor freeze;
update tomb_table set c2 = c2 + 4 where c1 < 4000;
alter system minor freeze;
select count(1) from tomb_table where c1 < 6000;
count(1)
4000
delete from tomb_table where c1 < 8000;
alter system minor freeze;
alter system set _enable_adaptive_compaction = False tenant sys;
alter system set _enable_adaptive_compaction = False tenant all_user;
alter system set _enable_adaptive_compaction = False tenant all_meta;
alter system set minor_compact_trigger = 2 tenant sys;
alter system set minor_compact_trigger = 2 tenant all_user;
alter system set minor_compact_trigger = 2 tenant all_meta;
drop table if exists tomb_table;
