result_format: 4
SET character_set_client = 'utf8mb4';
SET character_set_connection = 'utf8mb4';
SET character_set_results = 'utf8mb4';
SET SESSION sql_mode ='STRICT_ALL_TABLES,NO_ZERO_IN_DATE';
####################CHARACTER_LENGTH()####################
drop table CHARACTER_LENGTH_table;
create table CHARACTER_LENGTH_table(id int, sal double, name varchar(40),date_time datetime);
insert into CHARACTER_LENGTH_table values(10,3000.265 ,'kebi','2020-05-01 12:01:35'),(15,2100.25,'maidd','2020-05-17 18:02:30'),(29,1500.69,'yaoming','2020-05-23 23:59:59');
select e.id,e.name,CHARACTER_LENGTH(CHARACTER_LENGTH(e.sal)) from CHARACTER_LENGTH_table e order by e.id desc;
+------+---------+-------------------------------------------+
| id   | name    | CHARACTER_LENGTH(CHARACTER_LENGTH(e.sal)) |
+------+---------+-------------------------------------------+
|   29 | yaoming |                                         1 |
|   15 | maidd   |                                         1 |
|   10 | kebi    |                                         1 |
+------+---------+-------------------------------------------+
select e.id,e.name,CHARACTER_LENGTH(sum(e.sal)) from CHARACTER_LENGTH_table e order by e.id desc;
+------+------+------------------------------+
| id   | name | CHARACTER_LENGTH(sum(e.sal)) |
+------+------+------------------------------+
|   10 | kebi |                            8 |
+------+------+------------------------------+
select e.id,e.name,sum(CHARACTER_LENGTH(e.sal)) from CHARACTER_LENGTH_table e group by 1,2 having sum(CHARACTER_LENGTH(e.sal)) >= 4 order by id desc;
+------+---------+------------------------------+
| id   | name    | sum(CHARACTER_LENGTH(e.sal)) |
+------+---------+------------------------------+
|   29 | yaoming |                            7 |
|   15 | maidd   |                            7 |
|   10 | kebi    |                            8 |
+------+---------+------------------------------+
select e.id,e.name,CHARACTER_LENGTH(max(e.sal)) from CHARACTER_LENGTH_table e order by e.id desc;
+------+------+------------------------------+
| id   | name | CHARACTER_LENGTH(max(e.sal)) |
+------+------+------------------------------+
|   10 | kebi |                            8 |
+------+------+------------------------------+
select e.id,e.name,max(CHARACTER_LENGTH(e.sal)) from CHARACTER_LENGTH_table e group by 1,2 having sum(CHARACTER_LENGTH(e.sal)) > 4 order by id desc;
+------+---------+------------------------------+
| id   | name    | max(CHARACTER_LENGTH(e.sal)) |
+------+---------+------------------------------+
|   29 | yaoming |                            7 |
|   15 | maidd   |                            7 |
|   10 | kebi    |                            8 |
+------+---------+------------------------------+
select e.id,e.name,CHARACTER_LENGTH(min(e.sal)) from CHARACTER_LENGTH_table e order by e.id desc;
+------+------+------------------------------+
| id   | name | CHARACTER_LENGTH(min(e.sal)) |
+------+------+------------------------------+
|   10 | kebi |                            7 |
+------+------+------------------------------+
select e.id,e.name,min(CHARACTER_LENGTH(e.sal)) from CHARACTER_LENGTH_table e group by 1,2 having sum(CHARACTER_LENGTH(e.sal)) > 4 order by id desc;
+------+---------+------------------------------+
| id   | name    | min(CHARACTER_LENGTH(e.sal)) |
+------+---------+------------------------------+
|   29 | yaoming |                            7 |
|   15 | maidd   |                            7 |
|   10 | kebi    |                            8 |
+------+---------+------------------------------+
select e.id,e.name,CHARACTER_LENGTH(avg(e.sal)) from CHARACTER_LENGTH_table e order by e.id desc;
+------+------+------------------------------+
| id   | name | CHARACTER_LENGTH(avg(e.sal)) |
+------+------+------------------------------+
|   10 | kebi |                           18 |
+------+------+------------------------------+
select e.id,e.name,avg(CHARACTER_LENGTH(e.sal)) from CHARACTER_LENGTH_table e group by 1,2 having avg(CHARACTER_LENGTH(e.sal)) > 4 order by id desc;
+------+---------+------------------------------+
| id   | name    | avg(CHARACTER_LENGTH(e.sal)) |
+------+---------+------------------------------+
|   29 | yaoming |                       7.0000 |
|   15 | maidd   |                       7.0000 |
|   10 | kebi    |                       8.0000 |
+------+---------+------------------------------+
select e.id,e.name,CHARACTER_LENGTH(abs(e.sal)) from CHARACTER_LENGTH_table e order by e.id desc;
+------+---------+------------------------------+
| id   | name    | CHARACTER_LENGTH(abs(e.sal)) |
+------+---------+------------------------------+
|   29 | yaoming |                            7 |
|   15 | maidd   |                            7 |
|   10 | kebi    |                            8 |
+------+---------+------------------------------+
select e.id,e.name,abs(CHARACTER_LENGTH(e.sal)) from CHARACTER_LENGTH_table e group by 1,2  order by id desc limit 2;
+------+---------+------------------------------+
| id   | name    | abs(CHARACTER_LENGTH(e.sal)) |
+------+---------+------------------------------+
|   29 | yaoming |                            7 |
|   15 | maidd   |                            7 |
+------+---------+------------------------------+
select e.id,e.name,CHARACTER_LENGTH(ceil(e.sal)) from CHARACTER_LENGTH_table e order by e.id desc;
+------+---------+-------------------------------+
| id   | name    | CHARACTER_LENGTH(ceil(e.sal)) |
+------+---------+-------------------------------+
|   29 | yaoming |                             4 |
|   15 | maidd   |                             4 |
|   10 | kebi    |                             4 |
+------+---------+-------------------------------+
select e.id,e.name,ceil(CHARACTER_LENGTH(e.sal)) from CHARACTER_LENGTH_table e group by 1,2  order by id desc limit 2;
+------+---------+-------------------------------+
| id   | name    | ceil(CHARACTER_LENGTH(e.sal)) |
+------+---------+-------------------------------+
|   29 | yaoming |                             7 |
|   15 | maidd   |                             7 |
+------+---------+-------------------------------+
select e.id,e.name,CHARACTER_LENGTH(floor(e.sal)) from CHARACTER_LENGTH_table e order by e.id desc;
+------+---------+--------------------------------+
| id   | name    | CHARACTER_LENGTH(floor(e.sal)) |
+------+---------+--------------------------------+
|   29 | yaoming |                              4 |
|   15 | maidd   |                              4 |
|   10 | kebi    |                              4 |
+------+---------+--------------------------------+
select e.id,e.name,floor(CHARACTER_LENGTH(e.sal)) from CHARACTER_LENGTH_table e group by 1,2  order by id desc limit 2;
+------+---------+--------------------------------+
| id   | name    | floor(CHARACTER_LENGTH(e.sal)) |
+------+---------+--------------------------------+
|   29 | yaoming |                              7 |
|   15 | maidd   |                              7 |
+------+---------+--------------------------------+
select e.id,e.name,CHARACTER_LENGTH(mod(e.sal,7.8)) from CHARACTER_LENGTH_table e order by e.id desc;
+------+---------+----------------------------------+
| id   | name    | CHARACTER_LENGTH(mod(e.sal,7.8)) |
+------+---------+----------------------------------+
|   29 | yaoming |                               18 |
|   15 | maidd   |                               17 |
|   10 | kebi    |                               17 |
+------+---------+----------------------------------+
select e.id,e.name,mod(CHARACTER_LENGTH(e.sal),7.8) from CHARACTER_LENGTH_table e group by 1,2  order by id desc;
+------+---------+----------------------------------+
| id   | name    | mod(CHARACTER_LENGTH(e.sal),7.8) |
+------+---------+----------------------------------+
|   29 | yaoming |                              7.0 |
|   15 | maidd   |                              7.0 |
|   10 | kebi    |                              0.2 |
+------+---------+----------------------------------+
select e.id,e.name,CHARACTER_LENGTH(CHARACTER_LENGTH(e.sal)) from CHARACTER_LENGTH_table e order by e.id desc;
+------+---------+-------------------------------------------+
| id   | name    | CHARACTER_LENGTH(CHARACTER_LENGTH(e.sal)) |
+------+---------+-------------------------------------------+
|   29 | yaoming |                                         1 |
|   15 | maidd   |                                         1 |
|   10 | kebi    |                                         1 |
+------+---------+-------------------------------------------+
select e.id,e.name,CHARACTER_LENGTH(CHARACTER_LENGTH(e.sal)) from CHARACTER_LENGTH_table e group by 1,2  order by id desc;
+------+---------+-------------------------------------------+
| id   | name    | CHARACTER_LENGTH(CHARACTER_LENGTH(e.sal)) |
+------+---------+-------------------------------------------+
|   29 | yaoming |                                         1 |
|   15 | maidd   |                                         1 |
|   10 | kebi    |                                         1 |
+------+---------+-------------------------------------------+
select e.id,instr(CHARACTER_LENGTH(e.name),'i'),e.sal from CHARACTER_LENGTH_table e order by id desc;
+------+-------------------------------------+----------+
| id   | instr(CHARACTER_LENGTH(e.name),'i') | sal      |
+------+-------------------------------------+----------+
|   29 |                                   0 |  1500.69 |
|   15 |                                   0 |  2100.25 |
|   10 |                                   0 | 3000.265 |
+------+-------------------------------------+----------+
select e.id,CHARACTER_LENGTH(instr(e.name,'i')),e.sal from CHARACTER_LENGTH_table e order by id desc;
+------+-------------------------------------+----------+
| id   | CHARACTER_LENGTH(instr(e.name,'i')) | sal      |
+------+-------------------------------------+----------+
|   29 |                                   1 |  1500.69 |
|   15 |                                   1 |  2100.25 |
|   10 |                                   1 | 3000.265 |
+------+-------------------------------------+----------+
select e.id,e.name,CHARACTER_LENGTH(e.sal)+100 from CHARACTER_LENGTH_table e ;
+------+---------+-----------------------------+
| id   | name    | CHARACTER_LENGTH(e.sal)+100 |
+------+---------+-----------------------------+
|   10 | kebi    |                         108 |
|   15 | maidd   |                         107 |
|   29 | yaoming |                         107 |
+------+---------+-----------------------------+
select e.id,e.name,CHARACTER_LENGTH(e.sal)-100 from CHARACTER_LENGTH_table e ;
+------+---------+-----------------------------+
| id   | name    | CHARACTER_LENGTH(e.sal)-100 |
+------+---------+-----------------------------+
|   10 | kebi    |                         -92 |
|   15 | maidd   |                         -93 |
|   29 | yaoming |                         -93 |
+------+---------+-----------------------------+
select e.id,e.name,CHARACTER_LENGTH(e.sal)*100 from CHARACTER_LENGTH_table e ;
+------+---------+-----------------------------+
| id   | name    | CHARACTER_LENGTH(e.sal)*100 |
+------+---------+-----------------------------+
|   10 | kebi    |                         800 |
|   15 | maidd   |                         700 |
|   29 | yaoming |                         700 |
+------+---------+-----------------------------+
select e.id,e.name,CHARACTER_LENGTH(e.sal)/100 from CHARACTER_LENGTH_table e ;
+------+---------+-----------------------------+
| id   | name    | CHARACTER_LENGTH(e.sal)/100 |
+------+---------+-----------------------------+
|   10 | kebi    |                      0.0800 |
|   15 | maidd   |                      0.0700 |
|   29 | yaoming |                      0.0700 |
+------+---------+-----------------------------+
select e.id,e.name,e.sal from CHARACTER_LENGTH_table e where CHARACTER_LENGTH(e.sal) > 1500 and CHARACTER_LENGTH(e.sal) < 3000;
+------+------+------+
| id   | name | sal  |
+------+------+------+
+------+------+------+
select e.id,e.name,e.sal from CHARACTER_LENGTH_table e where CHARACTER_LENGTH(e.sal) > 2000 or e.id >20;
+------+---------+---------+
| id   | name    | sal     |
+------+---------+---------+
|   29 | yaoming | 1500.69 |
+------+---------+---------+
select e.id,e.name,e.sal from CHARACTER_LENGTH_table e where not(CHARACTER_LENGTH(e.sal)) < 1500;
+------+------+------+
| id   | name | sal  |
+------+------+------+
+------+------+------+
select e.id,e.name,e.sal from CHARACTER_LENGTH_table e where not(CHARACTER_LENGTH(e.sal)) > 2000;
+------+---------+----------+
| id   | name    | sal      |
+------+---------+----------+
|   10 | kebi    | 3000.265 |
|   15 | maidd   |  2100.25 |
|   29 | yaoming |  1500.69 |
+------+---------+----------+
select e.id,e.name,e.sal from CHARACTER_LENGTH_table e where CHARACTER_LENGTH(e.sal) >= 2000;
+------+------+------+
| id   | name | sal  |
+------+------+------+
+------+------+------+
select e.id,e.name,e.sal from CHARACTER_LENGTH_table e where CHARACTER_LENGTH(e.sal) <= 2000;
+------+---------+----------+
| id   | name    | sal      |
+------+---------+----------+
|   10 | kebi    | 3000.265 |
|   15 | maidd   |  2100.25 |
|   29 | yaoming |  1500.69 |
+------+---------+----------+
select e.id,e.name,e.sal from CHARACTER_LENGTH_table e where CHARACTER_LENGTH(e.sal)  = 1501;
+------+------+------+
| id   | name | sal  |
+------+------+------+
+------+------+------+
select e.id,e.name,e.sal from CHARACTER_LENGTH_table e where CHARACTER_LENGTH(e.sal)  > 1501;
+------+------+------+
| id   | name | sal  |
+------+------+------+
+------+------+------+
select e.id,e.name,e.sal from CHARACTER_LENGTH_table e where CHARACTER_LENGTH(e.sal)  < 1502;
+------+---------+----------+
| id   | name    | sal      |
+------+---------+----------+
|   10 | kebi    | 3000.265 |
|   15 | maidd   |  2100.25 |
|   29 | yaoming |  1500.69 |
+------+---------+----------+
select e.id,e.name,e.sal from CHARACTER_LENGTH_table e where CHARACTER_LENGTH(e.sal) <> 1501;
+------+---------+----------+
| id   | name    | sal      |
+------+---------+----------+
|   10 | kebi    | 3000.265 |
|   15 | maidd   |  2100.25 |
|   29 | yaoming |  1500.69 |
+------+---------+----------+
select e.id,e.name,e.sal from CHARACTER_LENGTH_table e where CHARACTER_LENGTH(e.sal) != 1501;
+------+---------+----------+
| id   | name    | sal      |
+------+---------+----------+
|   10 | kebi    | 3000.265 |
|   15 | maidd   |  2100.25 |
|   29 | yaoming |  1500.69 |
+------+---------+----------+
create index CHARACTER_LENGTH_name on CHARACTER_LENGTH_table(id);
select CHARACTER_LENGTH(e.id) from CHARACTER_LENGTH_table e;
+------------------------+
| CHARACTER_LENGTH(e.id) |
+------------------------+
|                      2 |
|                      2 |
|                      2 |
+------------------------+
select e.name,e.sal from CHARACTER_LENGTH_table e where CHARACTER_LENGTH(e.id) = '10';
+------+------+
| name | sal  |
+------+------+
+------+------+
select e.name,e.sal from CHARACTER_LENGTH_table e where CHARACTER_LENGTH(e.id) > '10' order by e.sal desc;
+------+------+
| name | sal  |
+------+------+
+------+------+
insert into CHARACTER_LENGTH_table  select * from CHARACTER_LENGTH_table e where CHARACTER_LENGTH(e.id) = '10';
select * from CHARACTER_LENGTH_table;
+------+----------+---------+---------------------+
| id   | sal      | name    | date_time           |
+------+----------+---------+---------------------+
|   10 | 3000.265 | kebi    | 2020-05-01 12:01:35 |
|   15 |  2100.25 | maidd   | 2020-05-17 18:02:30 |
|   29 |  1500.69 | yaoming | 2020-05-23 23:59:59 |
+------+----------+---------+---------------------+
update CHARACTER_LENGTH_table e set name = 'zanms' where CHARACTER_LENGTH(e.id) = '10';
select * from CHARACTER_LENGTH_table;
+------+----------+---------+---------------------+
| id   | sal      | name    | date_time           |
+------+----------+---------+---------------------+
|   10 | 3000.265 | kebi    | 2020-05-01 12:01:35 |
|   15 |  2100.25 | maidd   | 2020-05-17 18:02:30 |
|   29 |  1500.69 | yaoming | 2020-05-23 23:59:59 |
+------+----------+---------+---------------------+
delete from CHARACTER_LENGTH_table  where CHARACTER_LENGTH(id) = '10' ;
select * from CHARACTER_LENGTH_table;
+------+----------+---------+---------------------+
| id   | sal      | name    | date_time           |
+------+----------+---------+---------------------+
|   10 | 3000.265 | kebi    | 2020-05-01 12:01:35 |
|   15 |  2100.25 | maidd   | 2020-05-17 18:02:30 |
|   29 |  1500.69 | yaoming | 2020-05-23 23:59:59 |
+------+----------+---------+---------------------+
drop table CHARACTER_LENGTH_table;
create table CHARACTER_LENGTH_table(id int primary key, sal double unique, name varchar(40) not null,date_time datetime);
insert into CHARACTER_LENGTH_table values(10,3000.265 ,'kebi','2020-05-01 12:01:35'),(15,2100.25,'maidd','2020-05-17 18:02:30'),(29,1500.69,'yaoming','2020-05-23 23:59:59');
select CHARACTER_LENGTH(id),CHARACTER_LENGTH(sal),CHARACTER_LENGTH(name) from CHARACTER_LENGTH_table;
+----------------------+-----------------------+------------------------+
| CHARACTER_LENGTH(id) | CHARACTER_LENGTH(sal) | CHARACTER_LENGTH(name) |
+----------------------+-----------------------+------------------------+
|                    2 |                     8 |                      4 |
|                    2 |                     7 |                      5 |
|                    2 |                     7 |                      7 |
+----------------------+-----------------------+------------------------+
select CHARACTER_LENGTH(id),CHARACTER_LENGTH(sal),CHARACTER_LENGTH(name) from CHARACTER_LENGTH_table where CHARACTER_LENGTH(sal) = 6;
+----------------------+-----------------------+------------------------+
| CHARACTER_LENGTH(id) | CHARACTER_LENGTH(sal) | CHARACTER_LENGTH(name) |
+----------------------+-----------------------+------------------------+
+----------------------+-----------------------+------------------------+
select CHARACTER_LENGTH(id),CHARACTER_LENGTH(sal),CHARACTER_LENGTH(name) from CHARACTER_LENGTH_table where CHARACTER_LENGTH(sal) = 8 order by id;
+----------------------+-----------------------+------------------------+
| CHARACTER_LENGTH(id) | CHARACTER_LENGTH(sal) | CHARACTER_LENGTH(name) |
+----------------------+-----------------------+------------------------+
|                    2 |                     8 |                      4 |
+----------------------+-----------------------+------------------------+
insert into CHARACTER_LENGTH_table  select CHARACTER_LENGTH(id+1)id,CHARACTER_LENGTH(e.sal),CHARACTER_LENGTH(e.name),e.date_time from CHARACTER_LENGTH_table e where CHARACTER_LENGTH(e.sal) = 8 ;
select count(*) from CHARACTER_LENGTH_table;
+----------+
| count(*) |
+----------+
|        4 |
+----------+
update CHARACTER_LENGTH_table  set name = 'zanms' where CHARACTER_LENGTH(sal) = 8;
select * from CHARACTER_LENGTH_table;
+----+----------+---------+---------------------+
| id | sal      | name    | date_time           |
+----+----------+---------+---------------------+
|  2 |        8 | 4       | 2020-05-01 12:01:35 |
| 10 | 3000.265 | zanms   | 2020-05-01 12:01:35 |
| 15 |  2100.25 | maidd   | 2020-05-17 18:02:30 |
| 29 |  1500.69 | yaoming | 2020-05-23 23:59:59 |
+----+----------+---------+---------------------+
##delete
delete from CHARACTER_LENGTH_table  where CHARACTER_LENGTH(sal) = 8 ;
select count(*) from CHARACTER_LENGTH_table;
+----------+
| count(*) |
+----------+
|        3 |
+----------+
drop table CHARACTER_LENGTH_table;
