drop table if exists t1,t2,t3,t4,t5;
result_format: 4
CREATE TABLE t1 (
  `date` date ,
  `time` time ,
  `seq` int(10) unsigned NOT NULL auto_increment,
  PRIMARY KEY  (`seq`),
  KEY `seq` (`seq`),
  KEY `time` (`time`),
  KEY `date` (`date`)
);

## test plan generate
explain DELETE FROM t1 ORDER BY date ASC, time ASC LIMIT 1;
Query Plan
===================================================
|ID|OPERATOR           |NAME|EST.ROWS|EST.TIME(us)|
---------------------------------------------------
|0 |DELETE             |    |1       |14          |
|1 |└─TOP-N SORT       |    |1       |3           |
|2 |  └─TABLE FULL SCAN|t1  |1       |3           |
===================================================
Outputs & filters:
-------------------------------------
  0 - output(nil), filter(nil)
      table_columns([{t1: ({t1: (t1.seq, t1.date, t1.time)})}])
  1 - output([t1.TRANS_DEBUG_INFO], [t1.seq], [t1.date], [t1.time]), filter(nil), rowset=16
      sort_keys([t1.date, ASC], [t1.time, ASC]), topn(1)
  2 - output([t1.seq], [t1.date], [t1.time], [t1.TRANS_DEBUG_INFO]), filter(nil), rowset=16
      access([t1.seq], [t1.date], [t1.time]), partitions(p0)
      is_index_back=false, is_global_index=false, 
      range_key([t1.seq]), range(MIN ; MAX)always true
DELETE FROM t1 ORDER BY date ASC, time ASC LIMIT 1;
drop table t1;

CREATE TABLE t1 (a int not null,b int not null);
CREATE TABLE t2 (a int not null, b int not null, primary key (a,b));
CREATE TABLE t3 (a int not null, b int not null, primary key (a,b));
insert into t1 values (1,1),(2,1),(1,3);
insert into t2 values (1,1),(2,2),(3,3);
insert into t3 values (1,1),(2,1),(1,3);
commit;
explain delete t2.*,t3.* from t1,t2,t3 where t1.a=t2.a AND t2.b=t3.a and t1.b=t3.b;
Query Plan
=========================================================
|ID|OPERATOR                 |NAME|EST.ROWS|EST.TIME(us)|
---------------------------------------------------------
|0 |DISTRIBUTED DELETE       |    |3       |37          |
|1 |└─MERGE JOIN             |    |3       |8           |
|2 |  ├─TABLE FULL SCAN      |t3  |3       |3           |
|3 |  └─SORT                 |    |3       |6           |
|4 |    └─MERGE JOIN         |    |3       |6           |
|5 |      ├─TABLE FULL SCAN  |t2  |3       |3           |
|6 |      └─SORT             |    |3       |3           |
|7 |        └─TABLE FULL SCAN|t1  |3       |3           |
=========================================================
Outputs & filters:
-------------------------------------
  0 - output(nil), filter(nil)
      table_columns([{t2: ({t2: (t2.a, t2.b)}), hash_distinct}], [{t3: ({t3: (t3.a, t3.b)}), hash_distinct}])
  1 - output([t2.TRANS_DEBUG_INFO], [t3.TRANS_DEBUG_INFO], [t2.a], [t2.b], [t3.a], [t3.b]), filter(nil), rowset=16
      equal_conds([t2.b = t3.a], [t1.b = t3.b]), other_conds(nil)
      merge_directions([ASC], [ASC])
  2 - output([t3.a], [t3.b], [t3.TRANS_DEBUG_INFO]), filter(nil), rowset=16
      access([t3.a], [t3.b]), partitions(p0)
      is_index_back=false, is_global_index=false, 
      range_key([t3.a], [t3.b]), range(MIN,MIN ; MAX,MAX)always true
  3 - output([t2.TRANS_DEBUG_INFO], [t2.a], [t2.b], [t1.b]), filter(nil), rowset=16
      sort_keys([t2.b, ASC], [t1.b, ASC])
  4 - output([t2.TRANS_DEBUG_INFO], [t2.a], [t2.b], [t1.b]), filter(nil), rowset=16
      equal_conds([t1.a = t2.a]), other_conds(nil)
      merge_directions([ASC])
  5 - output([t2.a], [t2.b], [t2.TRANS_DEBUG_INFO]), filter(nil), rowset=16
      access([t2.a], [t2.b]), partitions(p0)
      is_index_back=false, is_global_index=false, 
      range_key([t2.a], [t2.b]), range(MIN,MIN ; MAX,MAX)always true
  6 - output([t1.b], [t1.a]), filter(nil), rowset=16
      sort_keys([t1.a, ASC])
  7 - output([t1.a], [t1.b]), filter(nil), rowset=16
      access([t1.a], [t1.b]), partitions(p0)
      is_index_back=false, is_global_index=false, 
      range_key([t1.__pk_increment]), range(MIN ; MAX)always true
delete t2.*,t3.* from t1,t2,t3 where t1.a=t2.a AND t2.b=t3.a and t1.b=t3.b;
select * from t2;
+---+---+
| a | b |
+---+---+
| 3 | 3 |
+---+---+
select * from t3;
+---+---+
| a | b |
+---+---+
+---+---+
rollback;

explain delete t1, t2 from t1 left join t2 on t1.a = t2.a where t1.a > 0;
Query Plan
=========================================================
|ID|OPERATOR                 |NAME|EST.ROWS|EST.TIME(us)|
---------------------------------------------------------
|0 |DISTRIBUTED DELETE       |    |1       |20          |
|1 |└─MERGE RIGHT OUTER JOIN |    |1       |5           |
|2 |  ├─TABLE RANGE SCAN     |t2  |3       |3           |
|3 |  └─SORT                 |    |1       |3           |
|4 |    └─TABLE FULL SCAN    |t1  |1       |3           |
=========================================================
Outputs & filters:
-------------------------------------
  0 - output(nil), filter(nil)
      table_columns([{t1: ({t1: (t1.__pk_increment, t1.a, t1.b)}), hash_distinct}], [{t2: ({t2: (t2.a, t2.b)}), hash_distinct}])
  1 - output([t1.TRANS_DEBUG_INFO], [t2.TRANS_DEBUG_INFO], [t1.__pk_increment], [t1.a], [t1.b], [t2.a], [t2.b]), filter(nil), rowset=16
      equal_conds([t1.a = t2.a]), other_conds(nil)
      merge_directions([ASC])
  2 - output([t2.a], [t2.b], [t2.TRANS_DEBUG_INFO]), filter(nil), rowset=16
      access([t2.a], [t2.b]), partitions(p0)
      is_index_back=false, is_global_index=false, 
      range_key([t2.a], [t2.b]), range(0,MAX ; MAX,MAX), 
      range_cond([t2.a > 0])
  3 - output([t1.TRANS_DEBUG_INFO], [t1.__pk_increment], [t1.a], [t1.b]), filter(nil), rowset=16
      sort_keys([t1.a, ASC])
  4 - output([t1.__pk_increment], [t1.a], [t1.b], [t1.TRANS_DEBUG_INFO]), filter([t1.a > 0]), rowset=16
      access([t1.__pk_increment], [t1.a], [t1.b]), partitions(p0)
      is_index_back=false, is_global_index=false, filter_before_indexback[false], 
      range_key([t1.__pk_increment]), range(MIN ; MAX)always true
delete t1, t2 from t1 left join t2 on t1.a = t2.a where t1.a > 0;
select * from t1;
+---+---+
| a | b |
+---+---+
+---+---+
select * from t2;
+---+---+
| a | b |
+---+---+
| 3 | 3 |
+---+---+
rollback;

explain delete /*+use_nl(t1, t2), leading(t1)*/ t1, t2 from t1 left join t2 on t1.a = t2.a where t1.a > 0;
Query Plan
=========================================================
|ID|OPERATOR                 |NAME|EST.ROWS|EST.TIME(us)|
---------------------------------------------------------
|0 |DISTRIBUTED DELETE       |    |1       |33          |
|1 |└─NESTED-LOOP OUTER JOIN |    |1       |19          |
|2 |  ├─TABLE FULL SCAN      |t1  |1       |3           |
|3 |  └─TABLE RANGE SCAN     |t2  |1       |16          |
=========================================================
Outputs & filters:
-------------------------------------
  0 - output(nil), filter(nil)
      table_columns([{t1: ({t1: (t1.__pk_increment, t1.a, t1.b)}), hash_distinct}], [{t2: ({t2: (t2.a, t2.b)}), hash_distinct}])
  1 - output([t1.TRANS_DEBUG_INFO], [t2.TRANS_DEBUG_INFO], [t1.__pk_increment], [t1.a], [t1.b], [t2.a], [t2.b]), filter(nil), rowset=16
      conds(nil), nl_params_([t1.a(:0)]), use_batch=true
  2 - output([t1.__pk_increment], [t1.a], [t1.b], [t1.TRANS_DEBUG_INFO]), filter([t1.a > 0]), rowset=16
      access([t1.__pk_increment], [t1.a], [t1.b]), partitions(p0)
      is_index_back=false, is_global_index=false, filter_before_indexback[false], 
      range_key([t1.__pk_increment]), range(MIN ; MAX)always true
  3 - output([t2.a], [t2.b], [t2.TRANS_DEBUG_INFO]), filter(nil), rowset=16
      access([GROUP_ID], [t2.a], [t2.b]), partitions(p0)
      is_index_back=false, is_global_index=false, 
      range_key([t2.a], [t2.b]), range(MIN ; MAX), 
      range_cond([:0 = t2.a])
delete /*+use_nl(t1, t2), leading(t1)*/ t1, t2 from t1 left join t2 on t1.a = t2.a where t1.a > 0;
select * from t1;
+---+---+
| a | b |
+---+---+
+---+---+
select * from t2;
+---+---+
| a | b |
+---+---+
| 3 | 3 |
+---+---+
rollback;
explain delete t1,t2,t3 from t1 inner join t2 on t1.a = t2.a inner join t3 on t2.a = t3.a where t1.a > 0;
Query Plan
=======================================================
|ID|OPERATOR               |NAME|EST.ROWS|EST.TIME(us)|
-------------------------------------------------------
|0 |DISTRIBUTED DELETE     |    |1       |28          |
|1 |└─MERGE JOIN           |    |1       |7           |
|2 |  ├─MERGE JOIN         |    |1       |5           |
|3 |  │ ├─SORT             |    |1       |3           |
|4 |  │ │ └─TABLE FULL SCAN|t1  |1       |3           |
|5 |  │ └─TABLE RANGE SCAN |t2  |3       |3           |
|6 |  └─TABLE RANGE SCAN   |t3  |3       |3           |
=======================================================
Outputs & filters:
-------------------------------------
  0 - output(nil), filter(nil)
      table_columns([{t1: ({t1: (t1.__pk_increment, t1.a, t1.b)}), hash_distinct}], [{t2: ({t2: (t2.a, t2.b)}), hash_distinct}], [{t3: ({t3: (t3.a, t3.b)}),
       hash_distinct}])
  1 - output([t1.TRANS_DEBUG_INFO], [t2.TRANS_DEBUG_INFO], [t3.TRANS_DEBUG_INFO], [t1.__pk_increment], [t1.a], [t1.b], [t2.a], [t2.b], [t3.a], [t3.b]), filter(nil), rowset=16
      equal_conds([t3.a = t1.a]), other_conds(nil)
      merge_directions([ASC])
  2 - output([t1.TRANS_DEBUG_INFO], [t2.TRANS_DEBUG_INFO], [t1.__pk_increment], [t1.a], [t1.b], [t2.a], [t2.b]), filter(nil), rowset=16
      equal_conds([t1.a = t2.a]), other_conds(nil)
      merge_directions([ASC])
  3 - output([t1.TRANS_DEBUG_INFO], [t1.__pk_increment], [t1.a], [t1.b]), filter(nil), rowset=16
      sort_keys([t1.a, ASC])
  4 - output([t1.__pk_increment], [t1.a], [t1.b], [t1.TRANS_DEBUG_INFO]), filter([t1.a > 0]), rowset=16
      access([t1.__pk_increment], [t1.a], [t1.b]), partitions(p0)
      is_index_back=false, is_global_index=false, filter_before_indexback[false], 
      range_key([t1.__pk_increment]), range(MIN ; MAX)always true
  5 - output([t2.a], [t2.b], [t2.TRANS_DEBUG_INFO]), filter(nil), rowset=16
      access([t2.a], [t2.b]), partitions(p0)
      is_index_back=false, is_global_index=false, 
      range_key([t2.a], [t2.b]), range(0,MAX ; MAX,MAX), 
      range_cond([t2.a > 0])
  6 - output([t3.a], [t3.b], [t3.TRANS_DEBUG_INFO]), filter(nil), rowset=16
      access([t3.a], [t3.b]), partitions(p0)
      is_index_back=false, is_global_index=false, 
      range_key([t3.a], [t3.b]), range(0,MAX ; MAX,MAX), 
      range_cond([t3.a > 0])
delete t1,t2,t3 from t1 inner join t2 on t1.a = t2.a inner join t3 on t2.a = t3.a where t1.a > 0;
select * from t1;
+---+---+
| a | b |
+---+---+
+---+---+
select * from t2;
+---+---+
| a | b |
+---+---+
| 3 | 3 |
+---+---+
select * from t3;
+---+---+
| a | b |
+---+---+
+---+---+
rollback;

explain delete from t1 where t1.a in (select t2.a from t2) limit 1;
Query Plan
=========================================================
|ID|OPERATOR                 |NAME|EST.ROWS|EST.TIME(us)|
---------------------------------------------------------
|0 |DELETE                   |    |1       |17          |
|1 |└─LIMIT                  |    |1       |5           |
|2 |  └─HASH RIGHT SEMI JOIN |    |1       |5           |
|3 |    ├─TABLE FULL SCAN    |t2  |3       |3           |
|4 |    └─TABLE FULL SCAN    |t1  |1       |3           |
=========================================================
Outputs & filters:
-------------------------------------
  0 - output(nil), filter(nil)
      table_columns([{t1: ({t1: (t1.__pk_increment, t1.a, t1.b)})}])
  1 - output([t1.TRANS_DEBUG_INFO], [t1.__pk_increment], [t1.a], [t1.b]), filter(nil), rowset=16
      limit(1), offset(nil)
  2 - output([t1.TRANS_DEBUG_INFO], [t1.__pk_increment], [t1.a], [t1.b]), filter(nil), rowset=16
      equal_conds([t1.a = t2.a]), other_conds(nil)
  3 - output([t2.a]), filter(nil), rowset=16
      access([t2.a]), partitions(p0)
      is_index_back=false, is_global_index=false, 
      range_key([t2.a], [t2.b]), range(MIN,MIN ; MAX,MAX)always true
  4 - output([t1.__pk_increment], [t1.a], [t1.b], [t1.TRANS_DEBUG_INFO]), filter(nil), rowset=16
      access([t1.__pk_increment], [t1.a], [t1.b]), partitions(p0)
      is_index_back=false, is_global_index=false, 
      range_key([t1.__pk_increment]), range(MIN ; MAX)always true
delete from t1 where t1.a in (select t2.a from t2) limit 1;
select * from t1;
+---+---+
| a | b |
+---+---+
| 2 | 1 |
| 1 | 3 |
+---+---+
rollback;
drop table t1, t2, t3;

create table t1(c1 int primary key, c2 int, c3 int, c4 int);
create index t1_idx_01 on t1(c2);
create index t1_idx_02 on t1(c3);
insert into t1 values(1,1,1,1),(2,2,2,2),(3,3,3,3),(4,4,4,4);
commit;
explain delete from t1 where c2 = 2 or c3 = 3;
Query Plan
=================================================
|ID|OPERATOR         |NAME|EST.ROWS|EST.TIME(us)|
-------------------------------------------------
|0 |DELETE           |    |2       |17          |
|1 |└─TABLE FULL SCAN|t1  |2       |3           |
=================================================
Outputs & filters:
-------------------------------------
  0 - output(nil), filter(nil)
      table_columns([{t1: ({t1: (t1.c1, t1.c2, t1.c3, t1.c4)})}])
  1 - output([t1.c1], [t1.c2], [t1.c3], [t1.c4], [t1.TRANS_DEBUG_INFO]), filter([t1.c2 = 2 OR t1.c3 = 3]), rowset=16
      access([t1.c1], [t1.c2], [t1.c3], [t1.c4]), partitions(p0)
      is_index_back=false, is_global_index=false, filter_before_indexback[false], 
      range_key([t1.c1]), range(MIN ; MAX)always true
delete from t1 where c2 = 2 or c3 = 3;
rollback;
explain delete /*+use_concat()*/ from t1 where c2 = 2 or c3 = 3;
Query Plan
===============================================================
|ID|OPERATOR              |NAME         |EST.ROWS|EST.TIME(us)|
---------------------------------------------------------------
|0 |DELETE                |             |2       |30          |
|1 |└─SUBPLAN SCAN        |VIEW1        |2       |14          |
|2 |  └─UNION ALL         |             |2       |14          |
|3 |    ├─TABLE RANGE SCAN|t1(t1_idx_01)|1       |7           |
|4 |    └─TABLE RANGE SCAN|t1(t1_idx_02)|1       |7           |
===============================================================
Outputs & filters:
-------------------------------------
  0 - output(nil), filter(nil)
      table_columns([{VIEW1: ({t1: (VIEW1.t1.c1, VIEW1.t1.c2, VIEW1.t1.c3, VIEW1.t1.c4)}), hash_distinct}])
  1 - output([VIEW1.t1.c1], [VIEW1.t1.c2], [VIEW1.t1.c3], [VIEW1.t1.c4]), filter(nil), rowset=16
      access([VIEW1.t1.c1], [VIEW1.t1.c2], [VIEW1.t1.c3], [VIEW1.t1.c4])
  2 - output([UNION([1])], [UNION([2])], [UNION([3])], [UNION([4])]), filter(nil), rowset=16
  3 - output([t1.c1], [t1.c2], [t1.c3], [t1.c4]), filter(nil), rowset=16
      access([t1.c1], [t1.c2], [t1.c3], [t1.c4]), partitions(p0)
      is_index_back=true, is_global_index=false, 
      range_key([t1.c2], [t1.c1]), range(2,MIN ; 2,MAX), 
      range_cond([t1.c2 = 2])
  4 - output([t1.c1], [t1.c2], [t1.c3], [t1.c4]), filter([lnnvl(cast(t1.c2 = 2, TINYINT(-1, 0)))]), rowset=16
      access([t1.c1], [t1.c2], [t1.c3], [t1.c4]), partitions(p0)
      is_index_back=true, is_global_index=false, filter_before_indexback[false], 
      range_key([t1.c3], [t1.c1]), range(3,MIN ; 3,MAX), 
      range_cond([t1.c3 = 3])
drop table t1;

## test parttiion table
create table t1(c1 int, c2 varchar(20), c3 int, c4 varchar(10), primary key(c1, c3)) partition by hash (c3) partitions 4;
create unique index t1_idx_01 on t1(c4) global;
insert into t1 values(1,'1',1,'1'),(2,'2',2,'2'),(3,'3',3,'3'),(4,'4',4,'4'),(5,'5',5,'5');
commit;
explain delete from t1 where c4 = '4' or c4 = '5';
Query Plan
================================================================
|ID|OPERATOR               |NAME         |EST.ROWS|EST.TIME(us)|
----------------------------------------------------------------
|0 |DISTRIBUTED DELETE     |             |2       |88          |
|1 |└─DISTRIBUTED TABLE GET|t1(t1_idx_01)|2       |65          |
================================================================
Outputs & filters:
-------------------------------------
  0 - output(nil), filter(nil)
      table_columns([{t1: ({t1: (t1.c1, t1.c3, t1.c2, t1.c4)}, {t1_idx_01: (t1.c4, t1.c1, t1.c3)})}])
  1 - output([t1.c1], [t1.c3], [t1.c2], [t1.c4], [t1.TRANS_DEBUG_INFO]), filter(nil), rowset=16
      access([t1.c1], [t1.c3], [t1.c2], [t1.c4]), partitions(p0)
      is_index_back=true, is_global_index=true, 
      range_key([t1.c4], [t1.shadow_pk_0], [t1.shadow_pk_1]), range[4,NULL,NULL ; 4,NULL,NULL], [5,NULL,NULL ; 5,NULL,NULL], 
      range_cond([t1.c4 = '4' OR t1.c4 = '5'])
delete from t1 where c4 = '4' or c4 = '5';
select * from t1 order by c1;
+----+------+----+------+
| c1 | c2   | c3 | c4   |
+----+------+----+------+
|  1 | 1    |  1 | 1    |
|  2 | 2    |  2 | 2    |
|  3 | 3    |  3 | 3    |
+----+------+----+------+
rollback;

create table t2(c1 int, c2 varchar(20), c3 int, c4 int, primary key(c1, c3)) partition by hash(c1) partitions 3;
create index t2_idx_01 on t2(c2) global;
insert into t2 values(1,'1',1,1),(2,'2',2,2),(3,'3',3,3),(4,'4',4,4),(5,'5',5,5);
commit;

explain delete from t1 where t1.c4 in (select t2.c2 from t2 where t2.c2 > '1');
Query Plan
=========================================================================
|ID|OPERATOR                        |NAME         |EST.ROWS|EST.TIME(us)|
-------------------------------------------------------------------------
|0 |DISTRIBUTED DELETE              |             |4       |144         |
|1 |└─MERGE SEMI JOIN               |             |4       |111         |
|2 |  ├─DISTRIBUTED TABLE RANGE SCAN|t1(t1_idx_01)|4       |108         |
|3 |  └─SUBPLAN SCAN                |VIEW1        |4       |3           |
|4 |    └─TABLE RANGE SCAN          |t2(t2_idx_01)|4       |3           |
=========================================================================
Outputs & filters:
-------------------------------------
  0 - output(nil), filter(nil)
      table_columns([{t1: ({t1: (t1.c1, t1.c3, t1.c2, t1.c4)}, {t1_idx_01: (t1.c4, t1.c1, t1.c3)})}])
  1 - output([t1.TRANS_DEBUG_INFO], [t1.c1], [t1.c3], [t1.c2], [t1.c4]), filter(nil), rowset=16
      equal_conds([t1.c4 = VIEW1.c2]), other_conds(nil)
      merge_directions([ASC])
  2 - output([t1.c1], [t1.c3], [t1.c2], [t1.c4], [t1.TRANS_DEBUG_INFO]), filter(nil), rowset=16
      access([t1.c1], [t1.c3], [t1.c2], [t1.c4]), partitions(p0)
      is_index_back=true, is_global_index=true, keep_ordering=true, 
      range_key([t1.c4], [t1.shadow_pk_0], [t1.shadow_pk_1]), range(1,MAX,MAX ; MAX,MAX,MAX), 
      range_cond([t1.c4 > '1'])
  3 - output([VIEW1.c2]), filter(nil), rowset=16
      access([VIEW1.c2])
  4 - output([t2.c2]), filter(nil), rowset=16
      access([t2.c2]), partitions(p0)
      is_index_back=false, is_global_index=true, 
      range_key([t2.c2], [t2.c1], [t2.c3]), range(1,MAX,MAX ; MAX,MAX,MAX), 
      range_cond([t2.c2 > '1'])
delete from t1 where t1.c4 in (select t2.c2 from t2 where t2.c2 > '1');
select * from t1 order by c1;
+----+------+----+------+
| c1 | c2   | c3 | c4   |
+----+------+----+------+
|  1 | 1    |  1 | 1    |
+----+------+----+------+
rollback;

explain delete t1, t2 from t1 left join t2 on t1.c4 = t2.c2 where t1.c1 > 1;
Query Plan
=================================================================
|ID|OPERATOR                     |NAME    |EST.ROWS|EST.TIME(us)|
-----------------------------------------------------------------
|0 |DISTRIBUTED DELETE           |        |4       |85          |
|1 |└─HASH OUTER JOIN            |        |4       |39          |
|2 |  ├─PX COORDINATOR           |        |4       |18          |
|3 |  │ └─EXCHANGE OUT DISTR     |:EX10000|4       |15          |
|4 |  │   └─PX PARTITION ITERATOR|        |4       |9           |
|5 |  │     └─TABLE RANGE SCAN   |t1      |4       |9           |
|6 |  └─PX COORDINATOR           |        |5       |18          |
|7 |    └─EXCHANGE OUT DISTR     |:EX20000|5       |15          |
|8 |      └─PX PARTITION ITERATOR|        |5       |7           |
|9 |        └─TABLE FULL SCAN    |t2      |5       |7           |
=================================================================
Outputs & filters:
-------------------------------------
  0 - output(nil), filter(nil)
      table_columns([{t1: ({t1: (t1.c1, t1.c3, t1.c2, t1.c4)}, {t1_idx_01: (t1.c4, t1.c1, t1.c3)}), hash_distinct}], [{t2: ({t2: (t2.c1, t2.c3, t2.c2, t2.c4)},
       {t2_idx_01: (t2.c2, t2.c1, t2.c3)}), hash_distinct}])
  1 - output([t1.TRANS_DEBUG_INFO], [t2.TRANS_DEBUG_INFO], [t1.c1], [t1.c3], [t1.c2], [t1.c4], [t2.c1], [t2.c3], [t2.c2], [t2.c4]), filter(nil), rowset=16
      equal_conds([t1.c4 = t2.c2]), other_conds(nil)
  2 - output([t1.TRANS_DEBUG_INFO], [t1.c1], [t1.c3], [t1.c2], [t1.c4]), filter(nil), rowset=16
  3 - output([t1.TRANS_DEBUG_INFO], [t1.c1], [t1.c3], [t1.c2], [t1.c4]), filter(nil), rowset=16
      dop=1
  4 - output([t1.c1], [t1.c3], [t1.c4], [t1.c2], [t1.TRANS_DEBUG_INFO]), filter(nil), rowset=16
      force partition granule
  5 - output([t1.c1], [t1.c3], [t1.c4], [t1.c2], [t1.TRANS_DEBUG_INFO]), filter(nil), rowset=16
      access([t1.c1], [t1.c3], [t1.c4], [t1.c2]), partitions(p[0-3])
      is_index_back=false, is_global_index=false, 
      range_key([t1.c1], [t1.c3]), range(1,MAX ; MAX,MAX), 
      range_cond([t1.c1 > 1])
  6 - output([t2.TRANS_DEBUG_INFO], [t2.c1], [t2.c3], [t2.c2], [t2.c4]), filter(nil), rowset=16
  7 - output([t2.TRANS_DEBUG_INFO], [t2.c1], [t2.c3], [t2.c2], [t2.c4]), filter(nil), rowset=16
      dop=1
  8 - output([t2.c1], [t2.c3], [t2.c2], [t2.c4], [t2.TRANS_DEBUG_INFO]), filter(nil), rowset=16
      force partition granule
  9 - output([t2.c1], [t2.c3], [t2.c2], [t2.c4], [t2.TRANS_DEBUG_INFO]), filter(nil), rowset=16
      access([t2.c1], [t2.c3], [t2.c2], [t2.c4]), partitions(p[0-2])
      is_index_back=false, is_global_index=false, 
      range_key([t2.c1], [t2.c3]), range(MIN,MIN ; MAX,MAX)always true
delete t1, t2 from t1 left join t2 on t1.c4 = t2.c2 where t1.c1 > 1;
select * from t1 order by c1;
+----+------+----+------+
| c1 | c2   | c3 | c4   |
+----+------+----+------+
|  1 | 1    |  1 | 1    |
+----+------+----+------+
select * from t2 order by c1;
+----+------+----+------+
| c1 | c2   | c3 | c4   |
+----+------+----+------+
|  1 | 1    |  1 |    1 |
+----+------+----+------+
rollback;

explain delete from t2 where t2.c2 = '1' or t2.c2 = '2';
Query Plan
=======================================================================
|ID|OPERATOR                      |NAME         |EST.ROWS|EST.TIME(us)|
-----------------------------------------------------------------------
|0 |DISTRIBUTED DELETE            |             |2       |84          |
|1 |└─DISTRIBUTED TABLE RANGE SCAN|t2(t2_idx_01)|2       |61          |
=======================================================================
Outputs & filters:
-------------------------------------
  0 - output(nil), filter(nil)
      table_columns([{t2: ({t2: (t2.c1, t2.c3, t2.c2, t2.c4)}, {t2_idx_01: (t2.c2, t2.c1, t2.c3)})}])
  1 - output([t2.c1], [t2.c3], [t2.c2], [t2.c4], [t2.TRANS_DEBUG_INFO]), filter(nil), rowset=16
      access([t2.c1], [t2.c3], [t2.c2], [t2.c4]), partitions(p0)
      is_index_back=true, is_global_index=true, 
      range_key([t2.c2], [t2.c1], [t2.c3]), range(1,MIN,MIN ; 1,MAX,MAX), (2,MIN,MIN ; 2,MAX,MAX), 
      range_cond([t2.c2 = '1' OR t2.c2 = '2'])
delete from t2 where t2.c2 = '1' or t2.c2 = '2';
select /*+index(t2 t2_idx_01)*/ * from t1 order by c1;
+----+------+----+------+
| c1 | c2   | c3 | c4   |
+----+------+----+------+
|  1 | 1    |  1 | 1    |
|  2 | 2    |  2 | 2    |
|  3 | 3    |  3 | 3    |
|  4 | 4    |  4 | 4    |
|  5 | 5    |  5 | 5    |
+----+------+----+------+
rollback;

drop table t1, t2;
set autocommit = 1;

alter system set _enable_defensive_check = '1';
alter system set_tp tp_no = 308, error_code = 0, frequency = 1;
