drop table if exists t1,t2,t3,t4,t5;
result_format: 4
## 简单dml语句, 单表更新，两表join更新，单表delete，两表join delete
create table t1(c1 int primary key, c2 int, c3 int);
create index t1_idx_1 on t1(c3);
insert into t1 values(1,1,1);
insert into t1 values(2,2,2);
insert into t1 values(3,3,3);
commit;
explain select * from t1 where c3 > 0;
Query Plan
========================================================
|ID|OPERATOR        |NAME        |EST.ROWS|EST.TIME(us)|
--------------------------------------------------------
|0 |TABLE RANGE SCAN|t1(t1_idx_1)|3       |12          |
========================================================
Outputs & filters:
-------------------------------------
  0 - output([t1.c1], [t1.c2], [t1.c3]), filter(nil), rowset=16
      access([t1.c1], [t1.c3], [t1.c2]), partitions(p0)
      is_index_back=true, is_global_index=false, 
      range_key([t1.c3], [t1.c1]), range(0,MAX ; MAX,MAX), 
      range_cond([t1.c3 > 0])
select * from t1 where c3 > 0;
+----+------+------+
| c1 | c2   | c3   |
+----+------+------+
|  1 |    1 |    1 |
|  2 |    2 |    2 |
|  3 |    3 |    3 |
+----+------+------+
explain update t1 set c2 = c2 + 1 where c3 > 0;
Query Plan
==========================================================
|ID|OPERATOR          |NAME        |EST.ROWS|EST.TIME(us)|
----------------------------------------------------------
|0 |UPDATE            |            |3       |59          |
|1 |└─TABLE RANGE SCAN|t1(t1_idx_1)|3       |12          |
==========================================================
Outputs & filters:
-------------------------------------
  0 - output(nil), filter(nil)
      table_columns([{t1: ({t1: (t1.c1, t1.c2, t1.c3)})}]),
      update([t1.c2=column_conv(INT,PS:(11,0),NULL,cast(t1.c2 + 1, INT(-1, 0)))])
  1 - output([t1.c1], [t1.c2], [t1.c3], [t1.TRANS_DEBUG_INFO]), filter(nil), rowset=16
      access([t1.c1], [t1.c2], [t1.c3]), partitions(p0)
      is_index_back=true, is_global_index=false, 
      range_key([t1.c3], [t1.c1]), range(0,MAX ; MAX,MAX), 
      range_cond([t1.c3 > 0])
update t1 set c2 = c2 + 1 where c3 > 0;
select * from t1;
+----+------+------+
| c1 | c2   | c3   |
+----+------+------+
|  1 |    2 |    1 |
|  2 |    3 |    2 |
|  3 |    4 |    3 |
+----+------+------+
rollback;

explain delete from t1 where c3 > 1;
Query Plan
==========================================================
|ID|OPERATOR          |NAME        |EST.ROWS|EST.TIME(us)|
----------------------------------------------------------
|0 |DELETE            |            |2       |26          |
|1 |└─TABLE RANGE SCAN|t1(t1_idx_1)|2       |10          |
==========================================================
Outputs & filters:
-------------------------------------
  0 - output(nil), filter(nil)
      table_columns([{t1: ({t1: (t1.c1, t1.c2, t1.c3)})}])
  1 - output([t1.c1], [t1.c2], [t1.c3], [t1.TRANS_DEBUG_INFO]), filter(nil), rowset=16
      access([t1.c1], [t1.c2], [t1.c3]), partitions(p0)
      is_index_back=true, is_global_index=false, 
      range_key([t1.c3], [t1.c1]), range(1,MAX ; MAX,MAX), 
      range_cond([t1.c3 > 1])
delete from t1 where c3 > 1;
select * from t1;
+----+------+------+
| c1 | c2   | c3   |
+----+------+------+
|  1 |    1 |    1 |
+----+------+------+
rollback;

create table t2(c1 int primary key, c2 int, c3 int, c4 int);
create index t2_idx_01 on t2(c2);
create index t2_idx_02 on t2(c3);
insert into t2 values(1,1,1,1);
insert into t2 values(2,2,2,2);
insert into t2 values(3,3,3,3);
insert into t2 values(4,4,4,4);
insert into t2 values(5,5,5,5);
commit;
explain update t2 set c4 = c4 + 10 where c2 = 1 or c3 = 2;
Query Plan
=================================================
|ID|OPERATOR         |NAME|EST.ROWS|EST.TIME(us)|
-------------------------------------------------
|0 |UPDATE           |    |2       |38          |
|1 |└─TABLE FULL SCAN|t2  |2       |3           |
=================================================
Outputs & filters:
-------------------------------------
  0 - output(nil), filter(nil)
      table_columns([{t2: ({t2: (t2.c1, t2.c2, t2.c3, t2.c4)})}]),
      update([t2.c4=column_conv(INT,PS:(11,0),NULL,cast(t2.c4 + 10, INT(-1, 0)))])
  1 - output([t2.c1], [t2.c4], [t2.c2], [t2.c3], [t2.TRANS_DEBUG_INFO]), filter([t2.c2 = 1 OR t2.c3 = 2]), rowset=16
      access([t2.c1], [t2.c4], [t2.c2], [t2.c3]), partitions(p0)
      is_index_back=false, is_global_index=false, filter_before_indexback[false], 
      range_key([t2.c1]), range(MIN ; MAX)always true
update t2 set c4 = c4 + 10 where c2 = 1 or c3 = 2;
select * from t2;
+----+------+------+------+
| c1 | c2   | c3   | c4   |
+----+------+------+------+
|  1 |    1 |    1 |   11 |
|  2 |    2 |    2 |   12 |
|  3 |    3 |    3 |    3 |
|  4 |    4 |    4 |    4 |
|  5 |    5 |    5 |    5 |
+----+------+------+------+
explain update /*+use_concat()*/ t2 set c4 = c4 + 10 where c2 = 1 or c3 = 2;
Query Plan
===============================================================
|ID|OPERATOR              |NAME         |EST.ROWS|EST.TIME(us)|
---------------------------------------------------------------
|0 |UPDATE                |             |2       |53          |
|1 |└─SUBPLAN SCAN        |VIEW1        |2       |14          |
|2 |  └─UNION ALL         |             |2       |14          |
|3 |    ├─TABLE RANGE SCAN|t2(t2_idx_01)|1       |7           |
|4 |    └─TABLE RANGE SCAN|t2(t2_idx_02)|1       |7           |
===============================================================
Outputs & filters:
-------------------------------------
  0 - output(nil), filter(nil)
      table_columns([{VIEW1: ({t2: (VIEW1.t2.c1, VIEW1.t2.c2, VIEW1.t2.c3, VIEW1.t2.c4)}), hash_distinct}]),
      update([VIEW1.t2.c4=column_conv(INT,PS:(11,0),NULL,cast(VIEW1.t2.c4 + 10, INT(-1, 0)))])
  1 - output([VIEW1.t2.c1], [VIEW1.t2.c2], [VIEW1.t2.c3], [VIEW1.t2.c4]), filter(nil), rowset=16
      access([VIEW1.t2.c1], [VIEW1.t2.c2], [VIEW1.t2.c3], [VIEW1.t2.c4])
  2 - output([UNION([1])], [UNION([2])], [UNION([3])], [UNION([4])]), filter(nil), rowset=16
  3 - output([t2.c1], [t2.c2], [t2.c3], [t2.c4]), filter(nil), rowset=16
      access([t2.c1], [t2.c4], [t2.c2], [t2.c3]), partitions(p0)
      is_index_back=true, is_global_index=false, 
      range_key([t2.c2], [t2.c1]), range(1,MIN ; 1,MAX), 
      range_cond([t2.c2 = 1])
  4 - output([t2.c1], [t2.c2], [t2.c3], [t2.c4]), filter([lnnvl(cast(t2.c2 = 1, TINYINT(-1, 0)))]), rowset=16
      access([t2.c1], [t2.c4], [t2.c2], [t2.c3]), partitions(p0)
      is_index_back=true, is_global_index=false, filter_before_indexback[false], 
      range_key([t2.c3], [t2.c1]), range(2,MIN ; 2,MAX), 
      range_cond([t2.c3 = 2])
update /*+use_concat()*/ t2 set c4 = c4 + 10 where c2 = 1 or c3 = 2;
rollback;
explain update t1 left join t2 on t1.c1 = t2.c1 set t1.c3 = t1.c3 + 100, t2.c4 = t2.c4 + 100 where t1.c1 < 3;
Query Plan
====================================================
|ID|OPERATOR            |NAME|EST.ROWS|EST.TIME(us)|
----------------------------------------------------
|0 |DISTRIBUTED UPDATE  |    |2       |68          |
|1 |└─MERGE OUTER JOIN  |    |2       |5           |
|2 |  ├─TABLE RANGE SCAN|t1  |2       |3           |
|3 |  └─TABLE RANGE SCAN|t2  |2       |3           |
====================================================
Outputs & filters:
-------------------------------------
  0 - output(nil), filter(nil)
      table_columns([{t1: ({t1: (t1.c1, t1.c2, t1.c3)})}], [{t2: ({t2: (t2.c1, t2.c2, t2.c3, t2.c4)}), hash_distinct}]),
      update([t1.c3=column_conv(INT,PS:(11,0),NULL,cast(t1.c3 + 100, INT(-1, 0)))], [t2.c4=column_conv(INT,PS:(11,0),NULL,cast(t2.c4 + 100, INT(-1, 0)))])
  1 - output([t1.TRANS_DEBUG_INFO], [t2.TRANS_DEBUG_INFO], [t1.c1], [t1.c2], [t1.c3], [t2.c1], [t2.c2], [t2.c3], [t2.c4]), filter(nil), rowset=16
      equal_conds([t1.c1 = t2.c1]), other_conds(nil)
      merge_directions([ASC])
  2 - output([t1.c1], [t1.c3], [t1.c2], [t1.TRANS_DEBUG_INFO]), filter(nil), rowset=16
      access([t1.c1], [t1.c3], [t1.c2]), partitions(p0)
      is_index_back=false, is_global_index=false, 
      range_key([t1.c1]), range(NULL ; 3), 
      range_cond([t1.c1 < 3])
  3 - output([t2.c1], [t2.c4], [t2.c2], [t2.c3], [t2.TRANS_DEBUG_INFO]), filter(nil), rowset=16
      access([t2.c1], [t2.c4], [t2.c2], [t2.c3]), partitions(p0)
      is_index_back=false, is_global_index=false, 
      range_key([t2.c1]), range(NULL ; 3), 
      range_cond([t2.c1 < 3])
update t1 left join t2 on t1.c1 = t2.c1 set t1.c3 = t1.c3 + 100, t2.c4 = t2.c4 + 100 where t1.c1 < 3;
select * from t1;
+----+------+------+
| c1 | c2   | c3   |
+----+------+------+
|  1 |    1 |  101 |
|  2 |    2 |  102 |
|  3 |    3 |    3 |
+----+------+------+
select * from t2;
+----+------+------+------+
| c1 | c2   | c3   | c4   |
+----+------+------+------+
|  1 |    1 |    1 |  101 |
|  2 |    2 |    2 |  102 |
|  3 |    3 |    3 |    3 |
|  4 |    4 |    4 |    4 |
|  5 |    5 |    5 |    5 |
+----+------+------+------+
rollback;

explain update t1, t2 set t1.c3 = t1.c3 + 100, t2.c4 = t2.c4 + 100 where t2.c2 = 3 or t2.c3 = 4;
Query Plan
=============================================================
|ID|OPERATOR                     |NAME|EST.ROWS|EST.TIME(us)|
-------------------------------------------------------------
|0 |DISTRIBUTED UPDATE           |    |5       |86          |
|1 |└─NESTED-LOOP JOIN CARTESIAN |    |5       |6           |
|2 |  ├─TABLE FULL SCAN          |t1  |3       |3           |
|3 |  └─MATERIAL                 |    |2       |3           |
|4 |    └─TABLE FULL SCAN        |t2  |2       |3           |
=============================================================
Outputs & filters:
-------------------------------------
  0 - output(nil), filter(nil)
      table_columns([{t1: ({t1: (t1.c1, t1.c2, t1.c3)}), hash_distinct}], [{t2: ({t2: (t2.c1, t2.c2, t2.c3, t2.c4)}), hash_distinct}]),
      update([t1.c3=column_conv(INT,PS:(11,0),NULL,cast(t1.c3 + 100, INT(-1, 0)))], [t2.c4=column_conv(INT,PS:(11,0),NULL,cast(t2.c4 + 100, INT(-1, 0)))])
  1 - output([t1.TRANS_DEBUG_INFO], [t2.TRANS_DEBUG_INFO], [t1.c1], [t1.c2], [t1.c3], [t2.c1], [t2.c2], [t2.c3], [t2.c4]), filter(nil), rowset=16
      conds(nil), nl_params_(nil), use_batch=false
  2 - output([t1.c1], [t1.c3], [t1.c2], [t1.TRANS_DEBUG_INFO]), filter(nil), rowset=16
      access([t1.c1], [t1.c3], [t1.c2]), partitions(p0)
      is_index_back=false, is_global_index=false, 
      range_key([t1.c1]), range(MIN ; MAX)always true
  3 - output([t2.TRANS_DEBUG_INFO], [t2.c1], [t2.c2], [t2.c3], [t2.c4]), filter(nil), rowset=16
  4 - output([t2.c1], [t2.c4], [t2.c2], [t2.c3], [t2.TRANS_DEBUG_INFO]), filter([t2.c2 = 3 OR t2.c3 = 4]), rowset=16
      access([t2.c1], [t2.c4], [t2.c2], [t2.c3]), partitions(p0)
      is_index_back=false, is_global_index=false, filter_before_indexback[false], 
      range_key([t2.c1]), range(MIN ; MAX)always true
update t1, t2 set t1.c3 = t1.c3 + 100, t2.c4 = t2.c4 + 100 where t2.c2 = 3 or t2.c3 = 4;
select * from t1;
+----+------+------+
| c1 | c2   | c3   |
+----+------+------+
|  1 |    1 |  101 |
|  2 |    2 |  102 |
|  3 |    3 |  103 |
+----+------+------+
select * from t2;
+----+------+------+------+
| c1 | c2   | c3   | c4   |
+----+------+------+------+
|  1 |    1 |    1 |    1 |
|  2 |    2 |    2 |    2 |
|  3 |    3 |    3 |  103 |
|  4 |    4 |    4 |  104 |
|  5 |    5 |    5 |    5 |
+----+------+------+------+
rollback;

## 测试delete相关
explain delete from t1 where c1 = 2;
Query Plan
===========================================
|ID|OPERATOR   |NAME|EST.ROWS|EST.TIME(us)|
-------------------------------------------
|0 |DELETE     |    |1       |17          |
|1 |└─TABLE GET|t1  |1       |5           |
===========================================
Outputs & filters:
-------------------------------------
  0 - output(nil), filter(nil)
      table_columns([{t1: ({t1: (t1.c1, t1.c2, t1.c3)})}])
  1 - output([t1.c1], [t1.c2], [t1.c3], [t1.TRANS_DEBUG_INFO]), filter(nil), rowset=16
      access([t1.c1], [t1.c2], [t1.c3]), partitions(p0)
      is_index_back=false, is_global_index=false, 
      range_key([t1.c1]), range[2 ; 2], 
      range_cond([t1.c1 = 2])
delete from t1 where c1 = 1;
explain delete /*+index(t1 t1_idx_1)*/ from t1 where c3 = 2;
Query Plan
==========================================================
|ID|OPERATOR          |NAME        |EST.ROWS|EST.TIME(us)|
----------------------------------------------------------
|0 |DELETE            |            |1       |19          |
|1 |└─TABLE RANGE SCAN|t1(t1_idx_1)|1       |7           |
==========================================================
Outputs & filters:
-------------------------------------
  0 - output(nil), filter(nil)
      table_columns([{t1: ({t1: (t1.c1, t1.c2, t1.c3)})}])
  1 - output([t1.c1], [t1.c2], [t1.c3], [t1.TRANS_DEBUG_INFO]), filter(nil), rowset=16
      access([t1.c1], [t1.c2], [t1.c3]), partitions(p0)
      is_index_back=true, is_global_index=false, 
      range_key([t1.c3], [t1.c1]), range(2,MIN ; 2,MAX), 
      range_cond([t1.c3 = 2])
delete /*+index(t1 t1_idx_1)*/ from t1 where c3 = 2;
select * from t1;
+----+------+------+
| c1 | c2   | c3   |
+----+------+------+
|  3 |    3 |    3 |
+----+------+------+
explain delete from t2 where c2 = 1 or c3 = 2;
Query Plan
=================================================
|ID|OPERATOR         |NAME|EST.ROWS|EST.TIME(us)|
-------------------------------------------------
|0 |DELETE           |    |2       |17          |
|1 |└─TABLE FULL SCAN|t2  |2       |3           |
=================================================
Outputs & filters:
-------------------------------------
  0 - output(nil), filter(nil)
      table_columns([{t2: ({t2: (t2.c1, t2.c2, t2.c3, t2.c4)})}])
  1 - output([t2.c1], [t2.c2], [t2.c3], [t2.c4], [t2.TRANS_DEBUG_INFO]), filter([t2.c2 = 1 OR t2.c3 = 2]), rowset=16
      access([t2.c1], [t2.c2], [t2.c3], [t2.c4]), partitions(p0)
      is_index_back=false, is_global_index=false, filter_before_indexback[false], 
      range_key([t2.c1]), range(MIN ; MAX)always true
delete from t2 where c2 = 1 or c3 = 2;
select * from t2;
+----+------+------+------+
| c1 | c2   | c3   | c4   |
+----+------+------+------+
|  3 |    3 |    3 |    3 |
|  4 |    4 |    4 |    4 |
|  5 |    5 |    5 |    5 |
+----+------+------+------+
explain delete /*+use_concat()*/ from t2 where c2 = 5 or c3 = 4;
Query Plan
===============================================================
|ID|OPERATOR              |NAME         |EST.ROWS|EST.TIME(us)|
---------------------------------------------------------------
|0 |DELETE                |             |2       |30          |
|1 |└─SUBPLAN SCAN        |VIEW1        |2       |14          |
|2 |  └─UNION ALL         |             |2       |14          |
|3 |    ├─TABLE RANGE SCAN|t2(t2_idx_01)|1       |7           |
|4 |    └─TABLE RANGE SCAN|t2(t2_idx_02)|1       |7           |
===============================================================
Outputs & filters:
-------------------------------------
  0 - output(nil), filter(nil)
      table_columns([{VIEW1: ({t2: (VIEW1.t2.c1, VIEW1.t2.c2, VIEW1.t2.c3, VIEW1.t2.c4)}), hash_distinct}])
  1 - output([VIEW1.t2.c1], [VIEW1.t2.c2], [VIEW1.t2.c3], [VIEW1.t2.c4]), filter(nil), rowset=16
      access([VIEW1.t2.c1], [VIEW1.t2.c2], [VIEW1.t2.c3], [VIEW1.t2.c4])
  2 - output([UNION([1])], [UNION([2])], [UNION([3])], [UNION([4])]), filter(nil), rowset=16
  3 - output([t2.c1], [t2.c2], [t2.c3], [t2.c4]), filter(nil), rowset=16
      access([t2.c1], [t2.c2], [t2.c3], [t2.c4]), partitions(p0)
      is_index_back=true, is_global_index=false, 
      range_key([t2.c2], [t2.c1]), range(5,MIN ; 5,MAX), 
      range_cond([t2.c2 = 5])
  4 - output([t2.c1], [t2.c2], [t2.c3], [t2.c4]), filter([lnnvl(cast(t2.c2 = 5, TINYINT(-1, 0)))]), rowset=16
      access([t2.c1], [t2.c2], [t2.c3], [t2.c4]), partitions(p0)
      is_index_back=true, is_global_index=false, filter_before_indexback[false], 
      range_key([t2.c3], [t2.c1]), range(4,MIN ; 4,MAX), 
      range_cond([t2.c3 = 4])
delete /*+use_concat()*/ from t2 where c2 = 5 or c3 = 4;
select * from t2;
+----+------+------+------+
| c1 | c2   | c3   | c4   |
+----+------+------+------+
|  3 |    3 |    3 |    3 |
+----+------+------+------+
rollback;

## 测试多表join delete
explain delete t1, t2 from t1 left join t2 on t1.c1 = t2.c1 where t1.c1 < 3;
Query Plan
====================================================
|ID|OPERATOR            |NAME|EST.ROWS|EST.TIME(us)|
----------------------------------------------------
|0 |DISTRIBUTED DELETE  |    |2       |28          |
|1 |└─MERGE OUTER JOIN  |    |2       |5           |
|2 |  ├─TABLE RANGE SCAN|t1  |2       |3           |
|3 |  └─TABLE RANGE SCAN|t2  |2       |3           |
====================================================
Outputs & filters:
-------------------------------------
  0 - output(nil), filter(nil)
      table_columns([{t1: ({t1: (t1.c1, t1.c2, t1.c3)})}], [{t2: ({t2: (t2.c1, t2.c2, t2.c3, t2.c4)}), hash_distinct}])
  1 - output([t1.TRANS_DEBUG_INFO], [t2.TRANS_DEBUG_INFO], [t1.c1], [t1.c2], [t1.c3], [t2.c1], [t2.c2], [t2.c3], [t2.c4]), filter(nil), rowset=16
      equal_conds([t1.c1 = t2.c1]), other_conds(nil)
      merge_directions([ASC])
  2 - output([t1.c1], [t1.c2], [t1.c3], [t1.TRANS_DEBUG_INFO]), filter(nil), rowset=16
      access([t1.c1], [t1.c2], [t1.c3]), partitions(p0)
      is_index_back=false, is_global_index=false, 
      range_key([t1.c1]), range(NULL ; 3), 
      range_cond([t1.c1 < 3])
  3 - output([t2.c1], [t2.c2], [t2.c3], [t2.c4], [t2.TRANS_DEBUG_INFO]), filter(nil), rowset=16
      access([t2.c1], [t2.c2], [t2.c3], [t2.c4]), partitions(p0)
      is_index_back=false, is_global_index=false, 
      range_key([t2.c1]), range(NULL ; 3), 
      range_cond([t2.c1 < 3])
delete t1, t2 from t1 left join t2 on t1.c1 = t2.c1 where t1.c1 < 3;
select * from t1;
+----+------+------+
| c1 | c2   | c3   |
+----+------+------+
|  3 |    3 |    3 |
+----+------+------+
select * from t2;
+----+------+------+------+
| c1 | c2   | c3   | c4   |
+----+------+------+------+
|  3 |    3 |    3 |    3 |
|  4 |    4 |    4 |    4 |
|  5 |    5 |    5 |    5 |
+----+------+------+------+
rollback;
drop table t1;
drop table t2;

create table t3(a int primary key, b int) partition by hash(a) partitions 3;
create index t3_idx_01 on t3(b) global;
insert into t3 values(1, 1), (2, 2), (3, 3), (4, 4), (5, 5);
explain update t3 set b=b+1 where a>0;
Query Plan
===============================================================
|ID|OPERATOR                   |NAME    |EST.ROWS|EST.TIME(us)|
---------------------------------------------------------------
|0 |DISTRIBUTED UPDATE         |        |5       |98          |
|1 |└─PX COORDINATOR           |        |5       |12          |
|2 |  └─EXCHANGE OUT DISTR     |:EX10000|5       |10          |
|3 |    └─PX PARTITION ITERATOR|        |5       |7           |
|4 |      └─TABLE RANGE SCAN   |t3      |5       |7           |
===============================================================
Outputs & filters:
-------------------------------------
  0 - output(nil), filter(nil)
      table_columns([{t3: ({t3: (t3.a, t3.b)}, {t3_idx_01: (t3.b, t3.a)})}]),
      update([t3.b=column_conv(INT,PS:(11,0),NULL,cast(t3.b + 1, INT(-1, 0)))])
  1 - output([t3.TRANS_DEBUG_INFO], [t3.a], [t3.b]), filter(nil), rowset=16
  2 - output([t3.TRANS_DEBUG_INFO], [t3.a], [t3.b]), filter(nil), rowset=16
      dop=1
  3 - output([t3.a], [t3.b], [t3.TRANS_DEBUG_INFO]), filter(nil), rowset=16
      force partition granule
  4 - output([t3.a], [t3.b], [t3.TRANS_DEBUG_INFO]), filter(nil), rowset=16
      access([t3.a], [t3.b]), partitions(p[0-2])
      is_index_back=false, is_global_index=false, 
      range_key([t3.a]), range(0 ; MAX), 
      range_cond([t3.a > 0])
update t3 set b=b+1 where a>0;
select * from t3 order by a;
+---+------+
| a | b    |
+---+------+
| 1 |    2 |
| 2 |    3 |
| 3 |    4 |
| 4 |    5 |
| 5 |    6 |
+---+------+
explain delete from t3 where t3.a > 2;
Query Plan
===============================================================
|ID|OPERATOR                   |NAME    |EST.ROWS|EST.TIME(us)|
---------------------------------------------------------------
|0 |DISTRIBUTED DELETE         |        |3       |38          |
|1 |└─PX COORDINATOR           |        |3       |10          |
|2 |  └─EXCHANGE OUT DISTR     |:EX10000|3       |9           |
|3 |    └─PX PARTITION ITERATOR|        |3       |7           |
|4 |      └─TABLE RANGE SCAN   |t3      |3       |7           |
===============================================================
Outputs & filters:
-------------------------------------
  0 - output(nil), filter(nil)
      table_columns([{t3: ({t3: (t3.a, t3.b)}, {t3_idx_01: (t3.b, t3.a)})}])
  1 - output([t3.TRANS_DEBUG_INFO], [t3.a], [t3.b]), filter(nil), rowset=16
  2 - output([t3.TRANS_DEBUG_INFO], [t3.a], [t3.b]), filter(nil), rowset=16
      dop=1
  3 - output([t3.a], [t3.b], [t3.TRANS_DEBUG_INFO]), filter(nil), rowset=16
      force partition granule
  4 - output([t3.a], [t3.b], [t3.TRANS_DEBUG_INFO]), filter(nil), rowset=16
      access([t3.a], [t3.b]), partitions(p[0-2])
      is_index_back=false, is_global_index=false, 
      range_key([t3.a]), range(2 ; MAX), 
      range_cond([t3.a > 2])
delete from t3 where t3.a > 2;
select * from t3 order by a;
+---+------+
| a | b    |
+---+------+
| 1 |    2 |
| 2 |    3 |
+---+------+
drop table t3;

create table t1(a int primary key, b int) partition by hash(a) partitions 3;
create table t2(a int primary key, b int) partition by hash(a) partitions 3;
insert into t1 values(1, 1), (2, 2), (3, 3), (4, 4), (5, 5);
explain update /*+use_nl(t1, t2), leading(t1)*/ t1 set b=b+1 where a in (select a from t2);
Query Plan
=============================================================
|ID|OPERATOR                 |NAME    |EST.ROWS|EST.TIME(us)|
-------------------------------------------------------------
|0 |PX COORDINATOR           |        |1       |119         |
|1 |└─EXCHANGE OUT DISTR     |:EX10000|1       |119         |
|2 |  └─PX PARTITION ITERATOR|        |1       |119         |
|3 |    └─UPDATE             |        |1       |119         |
|4 |      └─NESTED-LOOP JOIN |        |1       |88          |
|5 |        ├─TABLE FULL SCAN|t1      |5       |7           |
|6 |        └─TABLE GET      |t2      |1       |46          |
=============================================================
Outputs & filters:
-------------------------------------
  0 - output(nil), filter(nil), rowset=16
  1 - output(nil), filter(nil), rowset=16
      dop=1
  2 - output(nil), filter(nil), rowset=16
      partition wise, force partition granule
  3 - output(nil), filter(nil)
      table_columns([{t1: ({t1: (t1.a, t1.b)})}]),
      update([t1.b=column_conv(INT,PS:(11,0),NULL,cast(t1.b + 1, INT(-1, 0)))])
  4 - output([t1.TRANS_DEBUG_INFO], [t1.a], [t1.b]), filter(nil), rowset=16
      conds(nil), nl_params_([t1.a(:0)]), use_batch=true
  5 - output([t1.a], [t1.b], [t1.TRANS_DEBUG_INFO]), filter(nil), rowset=16
      access([t1.a], [t1.b]), partitions(p[0-2])
      is_index_back=false, is_global_index=false, 
      range_key([t1.a]), range(MIN ; MAX)always true
  6 - output(nil), filter(nil), rowset=16
      access([GROUP_ID]), partitions(p[0-2])
      is_index_back=false, is_global_index=false, 
      range_key([t2.a]), range(MIN ; MAX), 
      range_cond([:0 = t2.a])
update /*+use_nl(t1, t2), leading(t1)*/ t1 set b=b+1 where a in (select a from t2);
select * from t1 order by a;
+---+------+
| a | b    |
+---+------+
| 1 |    1 |
| 2 |    2 |
| 3 |    3 |
| 4 |    4 |
| 5 |    5 |
+---+------+
select * from t1 order by b;
+---+------+
| a | b    |
+---+------+
| 1 |    1 |
| 2 |    2 |
| 3 |    3 |
| 4 |    4 |
| 5 |    5 |
+---+------+
drop table t1, t2;

CREATE TABLE t1 (
  lfdnr int(10) unsigned NOT NULL default '0',
  ticket int(10) unsigned NOT NULL default '0',
  client varchar(255) NOT NULL default '',
  replyto varchar(255) NOT NULL default '',
  subject varchar(100) NOT NULL default '',
  timestamp int(10) unsigned NOT NULL default '0',
  tstamp timestamp NOT NULL,
  status int(3) NOT NULL default '0',
  type varchar(15) NOT NULL default '',
  assignment int(10) unsigned NOT NULL default '0',
  fupcount int(4) unsigned NOT NULL default '0',
  parent int(10) unsigned NOT NULL default '0',
  activity int(10) unsigned NOT NULL default '0',
  priority tinyint(1) unsigned NOT NULL default '1',
  cc varchar(255) NOT NULL default '',
  bcc varchar(255) NOT NULL default '',
  body varchar(255) NOT NULL,
  comment varchar(255),
  header varchar(255),
  PRIMARY KEY  (lfdnr),
  KEY k1 (timestamp),
  KEY k2 (type),
  KEY k3 (parent),
  KEY k4 (assignment),
  KEY ticket (ticket)
) ;

INSERT INTO t1 VALUES (773,773,'','','',980257344,20010318180652,0,'Open',10,0,0,0,1,'','','','','');
alter table t1 change lfdnr lfdnr int(10) unsigned not null auto_increment;
explain update t1 set status=1 where type='Open';
Query Plan
====================================================
|ID|OPERATOR          |NAME  |EST.ROWS|EST.TIME(us)|
----------------------------------------------------
|0 |UPDATE            |      |1       |41          |
|1 |└─TABLE RANGE SCAN|t1(k2)|1       |9           |
====================================================
Outputs & filters:
-------------------------------------
  0 - output(nil), filter(nil)
      table_columns([{t1: ({t1: (t1.lfdnr, t1.ticket, t1.client, t1.replyto, t1.subject, t1.timestamp, t1.tstamp, t1.status, t1.type, t1.assignment, t1.fupcount,
       t1.parent, t1.activity, t1.priority, t1.cc, t1.bcc, t1.body, t1.comment, t1.header)})}]),
      update([t1.status=column_conv(INT,PS:(3,0),NOT NULL,1)], [t1.tstamp=column_conv(TIMESTAMP,PS:(19,0),NOT NULL,cast(current_timestamp(), TIMESTAMP(19,
       0)))])
  1 - output([t1.lfdnr], [t1.status], [t1.tstamp], [t1.ticket], [t1.client], [t1.replyto], [t1.subject], [t1.timestamp], [t1.type], [t1.assignment], [t1.fupcount],
       [t1.parent], [t1.activity], [t1.priority], [t1.cc], [t1.bcc], [t1.body], [t1.comment], [t1.header], [t1.TRANS_DEBUG_INFO]), filter(nil), rowset=16
      access([t1.lfdnr], [t1.status], [t1.tstamp], [t1.ticket], [t1.client], [t1.replyto], [t1.subject], [t1.timestamp], [t1.type], [t1.assignment], [t1.fupcount],
       [t1.parent], [t1.activity], [t1.priority], [t1.cc], [t1.bcc], [t1.body], [t1.comment], [t1.header]), partitions(p0)
      is_index_back=true, is_global_index=false, 
      range_key([t1.type], [t1.lfdnr]), range(Open,MIN ; Open,MAX), 
      range_cond([t1.type = 'Open'])
update t1 set status=1 where type='Open';
select status from t1;
+--------+
| status |
+--------+
|      1 |
+--------+
drop table t1;

CREATE TABLE t1 (
   `id_param` smallint(3) unsigned NOT NULL default '0',
   `nom_option` char(40) NOT NULL default '',
   `valid` tinyint(1) NOT NULL default '0',
   KEY `id_param` (`id_param`,`nom_option`)
 );

INSERT INTO t1 (id_param,nom_option,valid) VALUES (185,'600x1200',1);
explain UPDATE t1 SET nom_option='test' WHERE id_param=185 AND nom_option='600x1200' AND valid=1 LIMIT 1;
Query Plan
==========================================================
|ID|OPERATOR          |NAME        |EST.ROWS|EST.TIME(us)|
----------------------------------------------------------
|0 |UPDATE            |            |1       |39          |
|1 |└─TABLE RANGE SCAN|t1(id_param)|1       |7           |
==========================================================
Outputs & filters:
-------------------------------------
  0 - output(nil), filter(nil)
      table_columns([{t1: ({t1: (t1.__pk_increment, t1.id_param, t1.nom_option, t1.valid)})}]),
      update([t1.nom_option=column_conv(CHAR,utf8mb4_general_ci,length:40,NOT NULL,cast(inner_trim(2, cast(' ', VARCHAR(1048576)), cast('test', VARCHAR(1048576))),
       CHAR(1048576)))])
  1 - output([t1.__pk_increment], [t1.nom_option], [t1.id_param], [t1.valid], [t1.TRANS_DEBUG_INFO]), filter([t1.valid = 1]), rowset=16
      access([t1.__pk_increment], [t1.nom_option], [t1.id_param], [t1.valid]), partitions(p0)
      limit(1), offset(nil), is_index_back=true, is_global_index=false, filter_before_indexback[false], 
      range_key([t1.id_param], [t1.nom_option], [t1.__pk_increment]), range(185,600x1200,MIN ; 185,600x1200,MAX), 
      range_cond([t1.id_param = 185], [t1.nom_option = '600x1200'])
UPDATE t1 SET nom_option='test' WHERE id_param=185 AND nom_option='600x1200' AND valid=1 LIMIT 1;
select * from t1;
+----------+------------+-------+
| id_param | nom_option | valid |
+----------+------------+-------+
|      185 | test       |     1 |
+----------+------------+-------+
drop table t1;

create table t1 (c1 int, c2 char(6), c3 int);
create table t2 (c1 int, c2 char(6));
insert into t1 values (1, "t1c2-1", 10), (2, "t1c2-2", 20);
explain update t1 left join t2 on t1.c1 = t2.c1 set t2.c2 = "t2c2-1" where t1.c3 = 10;
Query Plan
========================================================
|ID|OPERATOR                |NAME|EST.ROWS|EST.TIME(us)|
--------------------------------------------------------
|0 |UPDATE                  |    |1       |37          |
|1 |└─HASH RIGHT OUTER JOIN |    |1       |5           |
|2 |  ├─TABLE FULL SCAN     |t2  |1       |3           |
|3 |  └─TABLE FULL SCAN     |t1  |1       |3           |
========================================================
Outputs & filters:
-------------------------------------
  0 - output(nil), filter(nil)
      table_columns([{t2: ({t2: (t2.__pk_increment, t2.c1, t2.c2)}), hash_distinct}]),
      update([t2.c2=column_conv(CHAR,utf8mb4_general_ci,length:6,NULL,cast(inner_trim(2, cast(' ', VARCHAR(1048576)), cast('t2c2-1', VARCHAR(1048576))),
       CHAR(1048576)))])
  1 - output([t2.TRANS_DEBUG_INFO], [t2.__pk_increment], [t2.c1], [t2.c2]), filter(nil), rowset=16
      equal_conds([t1.c1 = t2.c1]), other_conds(nil)
  2 - output([t2.__pk_increment], [t2.c1], [t2.c2], [t2.TRANS_DEBUG_INFO]), filter(nil), rowset=16
      access([t2.__pk_increment], [t2.c1], [t2.c2]), partitions(p0)
      is_index_back=false, is_global_index=false, 
      range_key([t2.__pk_increment]), range(MIN ; MAX)always true
  3 - output([t1.c1]), filter([t1.c3 = 10]), rowset=16
      access([t1.c1], [t1.c3]), partitions(p0)
      is_index_back=false, is_global_index=false, filter_before_indexback[false], 
      range_key([t1.__pk_increment]), range(MIN ; MAX)always true
update t1 left join t2 on t1.c1 = t2.c1 set t2.c2 = "t2c2-1" where t1.c3 = 10;
select * from t1;
+------+--------+------+
| c1   | c2     | c3   |
+------+--------+------+
|    1 | t1c2-1 |   10 |
|    2 | t1c2-2 |   20 |
+------+--------+------+
select * from t2;
+------+------+
| c1   | c2   |
+------+------+
+------+------+
drop table t1, t2;

create table t1(c1 int primary key, c2 int);
create table t2(c1 int primary key, c2 int);
insert into t1 values(1, 1), (2, 2);
insert into t2 values(2, 2), (3, 3);
explain update t1, (select count(1) as a from t2) t set t1.c1=t.a+1 where t1.c1=1;
Query Plan
=============================================================
|ID|OPERATOR                     |NAME|EST.ROWS|EST.TIME(us)|
-------------------------------------------------------------
|0 |UPDATE                       |    |1       |40          |
|1 |└─NESTED-LOOP JOIN CARTESIAN |    |1       |8           |
|2 |  ├─TABLE GET                |t1  |1       |5           |
|3 |  └─SUBPLAN SCAN             |t   |1       |3           |
|4 |    └─SCALAR GROUP BY        |    |1       |3           |
|5 |      └─TABLE FULL SCAN      |t2  |2       |3           |
=============================================================
Outputs & filters:
-------------------------------------
  0 - output(nil), filter(nil)
      table_columns([{t1: ({t1: (t1.c1, t1.c2)}), hash_distinct}]),
      update([t1.c1=column_conv(INT,PS:(11,0),NOT NULL,cast(t.a + 1, INT(-1, 0)))])
  1 - output([t1.TRANS_DEBUG_INFO], [t1.c1], [t1.c2], [t.a]), filter(nil), rowset=16
      conds(nil), nl_params_(nil), use_batch=false
  2 - output([t1.c1], [t1.c2], [t1.TRANS_DEBUG_INFO]), filter(nil), rowset=16
      access([t1.c1], [t1.c2]), partitions(p0)
      is_index_back=false, is_global_index=false, 
      range_key([t1.c1]), range[1 ; 1], 
      range_cond([t1.c1 = 1])
  3 - output([t.a]), filter(nil), rowset=16
      access([t.a])
  4 - output([T_FUN_COUNT_SUM(T_FUN_COUNT(*))]), filter(nil), rowset=16
      group(nil), agg_func([T_FUN_COUNT_SUM(T_FUN_COUNT(*))])
  5 - output([T_FUN_COUNT(*)]), filter(nil), rowset=16
      access(nil), partitions(p0)
      is_index_back=false, is_global_index=false, 
      range_key([t2.c1]), range(MIN ; MAX)always true, 
      pushdown_aggregation([T_FUN_COUNT(*)])
update t1, (select count(1) as a from t2) t set t1.c1=t.a+1 where t1.c1=1;
select * from t1;
+----+------+
| c1 | c2   |
+----+------+
|  2 |    2 |
|  3 |    1 |
+----+------+
explain update t1 join t2 using(c1) set c1=1 where t1.c1=1;
Query Plan
=============================================================
|ID|OPERATOR                     |NAME|EST.ROWS|EST.TIME(us)|
-------------------------------------------------------------
|0 |UPDATE                       |    |1       |42          |
|1 |└─NESTED-LOOP JOIN CARTESIAN |    |1       |10          |
|2 |  ├─TABLE GET                |t1  |1       |5           |
|3 |  └─TABLE GET                |t2  |1       |5           |
=============================================================
Outputs & filters:
-------------------------------------
  0 - output(nil), filter(nil)
      table_columns([{t1: ({t1: (t1.c1, t1.c2)})}]),
      update([t1.c1=column_conv(INT,PS:(11,0),NOT NULL,1)])
  1 - output([t1.TRANS_DEBUG_INFO], [t1.c1], [t1.c2]), filter(nil), rowset=16
      conds(nil), nl_params_(nil), use_batch=false
  2 - output([t1.c1], [t1.c2], [t1.TRANS_DEBUG_INFO]), filter(nil), rowset=16
      access([t1.c1], [t1.c2]), partitions(p0)
      is_index_back=false, is_global_index=false, 
      range_key([t1.c1]), range[1 ; 1], 
      range_cond([t1.c1 = 1])
  3 - output(nil), filter(nil), rowset=16
      access(nil), partitions(p0)
      is_index_back=false, is_global_index=false, 
      range_key([t2.c1]), range[1 ; 1], 
      range_cond([t2.c1 = 1])
update t1 join t2 using(c1) set c1=1 where t1.c1=1;
select * from t1;
+----+------+
| c1 | c2   |
+----+------+
|  2 |    2 |
|  3 |    1 |
+----+------+
explain update t1, t2 set t1.c1=t2.c1+2, t2.c1=t1.c1+2 where t1.c2=t2.c2;
Query Plan
===================================================
|ID|OPERATOR           |NAME|EST.ROWS|EST.TIME(us)|
---------------------------------------------------
|0 |DISTRIBUTED UPDATE |    |2       |69          |
|1 |└─HASH JOIN        |    |2       |6           |
|2 |  ├─TABLE FULL SCAN|t2  |2       |3           |
|3 |  └─TABLE FULL SCAN|t1  |3       |3           |
===================================================
Outputs & filters:
-------------------------------------
  0 - output(nil), filter(nil)
      table_columns([{t1: ({t1: (t1.c1, t1.c2)}), hash_distinct}], [{t2: ({t2: (t2.c1, t2.c2)}), hash_distinct}]),
      update([t1.c1=column_conv(INT,PS:(11,0),NOT NULL,cast(t2.c1 + 2, INT(-1, 0)))], [t2.c1=column_conv(INT,PS:(11,0),NOT NULL,cast(t1.c1 + 2, INT(-1, 
      0)))])
  1 - output([t1.TRANS_DEBUG_INFO], [t2.TRANS_DEBUG_INFO], [t1.c1], [t1.c2], [t2.c1], [t2.c2]), filter(nil), rowset=16
      equal_conds([t1.c2 = t2.c2]), other_conds(nil)
  2 - output([t2.c1], [t2.c2], [t2.TRANS_DEBUG_INFO]), filter(nil), rowset=16
      access([t2.c1], [t2.c2]), partitions(p0)
      is_index_back=false, is_global_index=false, 
      range_key([t2.c1]), range(MIN ; MAX)always true
  3 - output([t1.c1], [t1.c2], [t1.TRANS_DEBUG_INFO]), filter(nil), rowset=16
      access([t1.c1], [t1.c2]), partitions(p0)
      is_index_back=false, is_global_index=false, 
      range_key([t1.c1]), range(MIN ; MAX)always true
update t1, t2 set t1.c1=t2.c1+2, t2.c1=t1.c1+2 where t1.c2=t2.c2;
select * from t1;
+----+------+
| c1 | c2   |
+----+------+
|  3 |    1 |
|  4 |    2 |
+----+------+
drop table t1, t2;

CREATE TABLE t1(c1 MEDIUMINT NOT NULL);
INSERT INTO t1 (c1) VALUES(0),(1),(2),(3),(4),(5),(6),(7),(8),(9);
explain UPDATE t1 SET c1 = -1 ORDER BY c1 LIMIT 2;
Query Plan
===================================================
|ID|OPERATOR           |NAME|EST.ROWS|EST.TIME(us)|
---------------------------------------------------
|0 |UPDATE             |    |2       |42          |
|1 |└─TOP-N SORT       |    |2       |3           |
|2 |  └─TABLE FULL SCAN|t1  |10      |3           |
===================================================
Outputs & filters:
-------------------------------------
  0 - output(nil), filter(nil)
      table_columns([{t1: ({t1: (t1.__pk_increment, t1.c1)})}]),
      update([t1.c1=column_conv(MEDIUMINT,PS:(9,0),NOT NULL,-1)])
  1 - output([t1.TRANS_DEBUG_INFO], [t1.__pk_increment], [t1.c1]), filter(nil), rowset=16
      sort_keys([t1.c1, ASC]), topn(2)
  2 - output([t1.__pk_increment], [t1.c1], [t1.TRANS_DEBUG_INFO]), filter(nil), rowset=16
      access([t1.__pk_increment], [t1.c1]), partitions(p0)
      is_index_back=false, is_global_index=false, 
      range_key([t1.__pk_increment]), range(MIN ; MAX)always true
UPDATE t1 SET c1 = -1 ORDER BY c1 LIMIT 2;
SELECT * FROM t1 ORDER BY c1;
+----+
| c1 |
+----+
| -1 |
| -1 |
|  2 |
|  3 |
|  4 |
|  5 |
|  6 |
|  7 |
|  8 |
|  9 |
+----+

explain UPDATE t1 SET c1 = -10  WHERE c1 >= 5 ORDER BY c1 LIMIT 1;
Query Plan
===================================================
|ID|OPERATOR           |NAME|EST.ROWS|EST.TIME(us)|
---------------------------------------------------
|0 |UPDATE             |    |1       |35          |
|1 |└─TOP-N SORT       |    |1       |3           |
|2 |  └─TABLE FULL SCAN|t1  |1       |3           |
===================================================
Outputs & filters:
-------------------------------------
  0 - output(nil), filter(nil)
      table_columns([{t1: ({t1: (t1.__pk_increment, t1.c1)})}]),
      update([t1.c1=column_conv(MEDIUMINT,PS:(9,0),NOT NULL,-10)])
  1 - output([t1.TRANS_DEBUG_INFO], [t1.__pk_increment], [t1.c1]), filter(nil), rowset=16
      sort_keys([t1.c1, ASC]), topn(1)
  2 - output([t1.__pk_increment], [t1.c1], [t1.TRANS_DEBUG_INFO]), filter([t1.c1 >= 5]), rowset=16
      access([t1.__pk_increment], [t1.c1]), partitions(p0)
      is_index_back=false, is_global_index=false, filter_before_indexback[false], 
      range_key([t1.__pk_increment]), range(MIN ; MAX)always true
UPDATE t1 SET c1 = -10  WHERE c1 >= 5 ORDER BY c1 LIMIT 1;
SELECT * FROM t1 ORDER BY c1;
+-----+
| c1  |
+-----+
| -10 |
|  -1 |
|  -1 |
|   2 |
|   3 |
|   4 |
|   6 |
|   7 |
|   8 |
|   9 |
+-----+
DROP TABLE t1;

create table t1(c1 int, c2 int, c3 int);
insert into t1 values(1,1,1),(2,2,2),(3,3,3),(5,5,5);
create table t2(c1 int, c2 int, c3 int) partition by hash(c2) partitions 3;
insert into t2 values(2,2,2),(3,3,3),(4,4,4);
explain update t1 left join t2 on t1.c1=t2.c1 set t2.c2=t2.c2+1;
Query Plan
=================================================================
|ID|OPERATOR                     |NAME    |EST.ROWS|EST.TIME(us)|
-----------------------------------------------------------------
|0 |DISTRIBUTED UPDATE           |        |4       |69          |
|1 |└─HASH OUTER JOIN            |        |4       |15          |
|2 |  ├─TABLE FULL SCAN          |t1      |4       |3           |
|3 |  └─PX COORDINATOR           |        |3       |12          |
|4 |    └─EXCHANGE OUT DISTR     |:EX10000|3       |10          |
|5 |      └─PX PARTITION ITERATOR|        |3       |7           |
|6 |        └─TABLE FULL SCAN    |t2      |3       |7           |
=================================================================
Outputs & filters:
-------------------------------------
  0 - output(nil), filter(nil)
      table_columns([{t2: ({t2: (t2.__pk_increment, t2.c1, t2.c2, t2.c3)}), hash_distinct}]),
      update([t2.c2=column_conv(INT,PS:(11,0),NULL,cast(t2.c2 + 1, INT(-1, 0)))], [t2.__pk_increment=T_HIDDEN_PK])
  1 - output([t2.TRANS_DEBUG_INFO], [t2.__pk_increment], [t2.c1], [t2.c2], [t2.c3]), filter(nil), rowset=16
      equal_conds([t1.c1 = t2.c1]), other_conds(nil)
  2 - output([t1.c1]), filter(nil), rowset=16
      access([t1.c1]), partitions(p0)
      is_index_back=false, is_global_index=false, 
      range_key([t1.__pk_increment]), range(MIN ; MAX)always true
  3 - output([t2.TRANS_DEBUG_INFO], [t2.__pk_increment], [t2.c1], [t2.c2], [t2.c3]), filter(nil), rowset=16
  4 - output([t2.TRANS_DEBUG_INFO], [t2.__pk_increment], [t2.c1], [t2.c2], [t2.c3]), filter(nil), rowset=16
      dop=1
  5 - output([t2.__pk_increment], [t2.c2], [t2.c1], [t2.c3], [t2.TRANS_DEBUG_INFO]), filter(nil), rowset=16
      force partition granule
  6 - output([t2.__pk_increment], [t2.c2], [t2.c1], [t2.c3], [t2.TRANS_DEBUG_INFO]), filter(nil), rowset=16
      access([t2.__pk_increment], [t2.c2], [t2.c1], [t2.c3]), partitions(p[0-2])
      is_index_back=false, is_global_index=false, 
      range_key([t2.__pk_increment]), range(MIN ; MAX)always true
update t1 left join t2 on t1.c1=t2.c1 set t2.c2=t2.c2+1;
select * from t2 order by c1;
+------+------+------+
| c1   | c2   | c3   |
+------+------+------+
|    2 |    3 |    2 |
|    3 |    4 |    3 |
|    4 |    4 |    4 |
+------+------+------+
drop table t2;
drop table t1;

create table t1 (pk1 int,pk2 int, i1 int, v1 varchar(20),primary key(i1,pk2));
create unique index idx1 on t1(pk1,i1,pk2);
insert into t1 values(1,1,1,'a'),(2,2,2,'b'),(3,3,3,'c'),(4,4,4,'d'),(5,5,5,'e');
explain update/*+index(t1 primary)*/ t1 set pk1=4 where pk1<15 limit 2;
Query Plan
=================================================
|ID|OPERATOR         |NAME|EST.ROWS|EST.TIME(us)|
-------------------------------------------------
|0 |UPDATE           |    |1       |31          |
|1 |└─TABLE FULL SCAN|t1  |1       |3           |
=================================================
Outputs & filters:
-------------------------------------
  0 - output(nil), filter(nil)
      table_columns([{t1: ({t1: (t1.i1, t1.pk2, t1.pk1, t1.v1)})}]),
      update([t1.pk1=column_conv(INT,PS:(11,0),NULL,4)])
  1 - output([t1.i1], [t1.pk2], [t1.pk1], [t1.v1], [t1.TRANS_DEBUG_INFO]), filter([t1.pk1 < 15]), rowset=16
      access([t1.i1], [t1.pk2], [t1.pk1], [t1.v1]), partitions(p0)
      limit(2), offset(nil), is_index_back=false, is_global_index=false, filter_before_indexback[false], 
      range_key([t1.i1], [t1.pk2]), range(MIN,MIN ; MAX,MAX)always true
update/*+index(t1 primary)*/ t1 set pk1=4 where pk1<15 limit 2;
select * from t1;
+------+-----+----+------+
| pk1  | pk2 | i1 | v1   |
+------+-----+----+------+
|    4 |   1 |  1 | a    |
|    4 |   2 |  2 | b    |
|    3 |   3 |  3 | c    |
|    4 |   4 |  4 | d    |
|    5 |   5 |  5 | e    |
+------+-----+----+------+
rollback;

explain update/*+index(t1 primary)*/ t1 set pk1=8 where pk1<15 order by pk2 asc limit 2;
Query Plan
===================================================
|ID|OPERATOR           |NAME|EST.ROWS|EST.TIME(us)|
---------------------------------------------------
|0 |UPDATE             |    |1       |27          |
|1 |└─TOP-N SORT       |    |1       |3           |
|2 |  └─TABLE FULL SCAN|t1  |1       |3           |
===================================================
Outputs & filters:
-------------------------------------
  0 - output(nil), filter(nil)
      table_columns([{t1: ({t1: (t1.i1, t1.pk2, t1.pk1, t1.v1)})}]),
      update([t1.pk1=column_conv(INT,PS:(11,0),NULL,8)])
  1 - output([t1.TRANS_DEBUG_INFO], [t1.i1], [t1.pk2], [t1.pk1], [t1.v1]), filter(nil), rowset=16
      sort_keys([t1.pk2, ASC]), topn(2)
  2 - output([t1.i1], [t1.pk2], [t1.pk1], [t1.v1], [t1.TRANS_DEBUG_INFO]), filter([t1.pk1 < 15]), rowset=16
      access([t1.i1], [t1.pk2], [t1.pk1], [t1.v1]), partitions(p0)
      is_index_back=false, is_global_index=false, filter_before_indexback[false], 
      range_key([t1.i1], [t1.pk2]), range(MIN,MIN ; MAX,MAX)always true
update/*+index(t1 primary)*/ t1 set pk1=8 where pk1<15 order by pk2 asc limit 2;
select * from t1;
+------+-----+----+------+
| pk1  | pk2 | i1 | v1   |
+------+-----+----+------+
+------+-----+----+------+
rollback;

explain delete/*+index(t1 idx1)*/ from t1 where pk1<15 limit 2;
Query Plan
======================================================
|ID|OPERATOR          |NAME    |EST.ROWS|EST.TIME(us)|
------------------------------------------------------
|0 |DELETE            |        |1       |19          |
|1 |└─TABLE RANGE SCAN|t1(idx1)|1       |7           |
======================================================
Outputs & filters:
-------------------------------------
  0 - output(nil), filter(nil)
      table_columns([{t1: ({t1: (t1.i1, t1.pk2, t1.pk1, t1.v1)})}])
  1 - output([t1.i1], [t1.pk2], [t1.pk1], [t1.v1], [t1.TRANS_DEBUG_INFO]), filter(nil), rowset=16
      access([t1.i1], [t1.pk2], [t1.pk1], [t1.v1]), partitions(p0)
      limit(2), offset(nil), is_index_back=true, is_global_index=false, 
      range_key([t1.pk1], [t1.i1], [t1.pk2], [t1.shadow_pk_0], [t1.shadow_pk_1]), range(NULL,MAX,MAX,MAX,MAX ; 15,MIN,MIN,MIN,MIN), 
      range_cond([t1.pk1 < 15])
delete/*+index(t1 idx1)*/ from t1 where pk1<15 limit 2;
select * from t1;
+------+-----+----+------+
| pk1  | pk2 | i1 | v1   |
+------+-----+----+------+
+------+-----+----+------+
rollback;

explain update/*+index(t1 primary)*/ t1 set pk1=-1 where (pk2,i1) in ((1,1),(1,2),(2,2),(3,3)) order by pk2 asc limit 5;
Query Plan
=============================================
|ID|OPERATOR     |NAME|EST.ROWS|EST.TIME(us)|
---------------------------------------------
|0 |UPDATE       |    |4       |74          |
|1 |└─TOP-N SORT |    |4       |20          |
|2 |  └─TABLE GET|t1  |4       |19          |
=============================================
Outputs & filters:
-------------------------------------
  0 - output(nil), filter(nil)
      table_columns([{t1: ({t1: (t1.i1, t1.pk2, t1.pk1, t1.v1)})}]),
      update([t1.pk1=column_conv(INT,PS:(11,0),NULL,-1)])
  1 - output([t1.TRANS_DEBUG_INFO], [t1.i1], [t1.pk2], [t1.pk1], [t1.v1]), filter(nil), rowset=16
      sort_keys([t1.pk2, ASC]), topn(5)
  2 - output([t1.i1], [t1.pk2], [t1.pk1], [t1.v1], [t1.TRANS_DEBUG_INFO]), filter(nil), rowset=16
      access([t1.i1], [t1.pk2], [t1.pk1], [t1.v1]), partitions(p0)
      is_index_back=false, is_global_index=false, 
      range_key([t1.i1], [t1.pk2]), range[1,1 ; 1,1], [2,1 ; 2,1], [2,2 ; 2,2], [3,3 ; 3,3], 
      range_cond([(t1.pk2, t1.i1) IN ((1, 1), (1, 2), (2, 2), (3, 3))])
update/*+index(t1 primary)*/ t1 set pk1=-1 where (pk2,i1) in ((1,1),(1,2),(2,2),(3,3)) order by pk2 asc limit 5;
select * from t1;
+------+-----+----+------+
| pk1  | pk2 | i1 | v1   |
+------+-----+----+------+
+------+-----+----+------+
drop table t1;

create table t1(f1 int, f2 int);
create table t2(f3 int, f4 int);
create index idx on t2(f3);
insert into t1 values(1,0),(2,0);
insert into t2 values(1,1),(2,2);
explain UPDATE t1 SET t1.f2=(SELECT MAX(t2.f4) FROM t2 WHERE t2.f3=t1.f1);
Query Plan
========================================================
|ID|OPERATOR               |NAME |EST.ROWS|EST.TIME(us)|
--------------------------------------------------------
|0 |UPDATE                 |     |2       |45          |
|1 |└─HASH OUTER JOIN      |     |2       |6           |
|2 |  ├─TABLE FULL SCAN    |t1   |2       |3           |
|3 |  └─SUBPLAN SCAN       |VIEW1|2       |3           |
|4 |    └─HASH GROUP BY    |     |2       |3           |
|5 |      └─TABLE FULL SCAN|t2   |2       |3           |
========================================================
Outputs & filters:
-------------------------------------
  0 - output(nil), filter(nil)
      table_columns([{t1: ({t1: (t1.__pk_increment, t1.f1, t1.f2)})}]),
      update([t1.f2=column_conv(INT,PS:(11,0),NULL,VIEW1.MAX(t2.f4))])
  1 - output([t1.TRANS_DEBUG_INFO], [t1.__pk_increment], [t1.f1], [t1.f2], [VIEW1.MAX(t2.f4)]), filter(nil), rowset=16
      equal_conds([VIEW1.t2.f3 = t1.f1]), other_conds(nil)
  2 - output([t1.__pk_increment], [t1.f2], [t1.f1], [t1.TRANS_DEBUG_INFO]), filter(nil), rowset=16
      access([t1.__pk_increment], [t1.f2], [t1.f1]), partitions(p0)
      is_index_back=false, is_global_index=false, 
      range_key([t1.__pk_increment]), range(MIN ; MAX)always true
  3 - output([VIEW1.MAX(t2.f4)], [VIEW1.t2.f3]), filter(nil), rowset=16
      access([VIEW1.MAX(t2.f4)], [VIEW1.t2.f3])
  4 - output([T_FUN_MAX(t2.f4)], [t2.f3]), filter(nil), rowset=16
      group([t2.f3]), agg_func([T_FUN_MAX(t2.f4)])
  5 - output([t2.f3], [t2.f4]), filter(nil), rowset=16
      access([t2.f3], [t2.f4]), partitions(p0)
      is_index_back=false, is_global_index=false, 
      range_key([t2.__pk_increment]), range(MIN ; MAX)always true
UPDATE t1 SET t1.f2=(SELECT MAX(t2.f4) FROM t2 WHERE t2.f3=t1.f1);
select * from t1;
+------+------+
| f1   | f2   |
+------+------+
|    1 |    1 |
|    2 |    2 |
+------+------+
drop table t1,t2;

create table t1(h1 int PRIMARY key AUTO_INCREMENT,h2 varchar(20) not null,h3 FLOAT not null,h4 date not null,h5 char(20) not null);
create table t2(h1 int PRIMARY key AUTO_INCREMENT,h2 varchar(20) not null,h3 FLOAT not null,h4 date not null,h5 char(20) not null);
insert into t1(h2,h3,h4,h5) values('xiaowang',60.5,'2022-05-01','一组');
insert into t1(h2,h3,h4,h5) values('xiaolizi',65.420,'2022-06-16','二组');
insert into t2(h2,h3,h4,h5) values('zhaoyun',107,'2023-10-01','一组');
insert into t2(h2,h3,h4,h5) values('akeyashi',65.420,'2022-01-01','二组');
EXPLAIN UPDATE t1 full join  t2 ON t1.h3=null set t1.h2='null' where t2.h2=( select * from (select DISTINCT(t2.h2) from t2 order by t2.h3 asc LIMIT 1 ) as t2);
Query Plan
=========================================================================
|ID|OPERATOR                                |NAME |EST.ROWS|EST.TIME(us)|
-------------------------------------------------------------------------
|0 |UPDATE                                  |     |2       |51          |
|1 |└─SUBPLAN FILTER                        |     |2       |12          |
|2 |  ├─SUBPLAN SCAN                        |VIEW1|2       |9           |
|3 |  │ └─UNION ALL                         |     |2       |9           |
|4 |  │   ├─NESTED-LOOP OUTER JOIN          |     |1       |5           |
|5 |  │   │ ├─TABLE FULL SCAN               |t1   |2       |3           |
|6 |  │   │ └─MATERIAL                      |     |2       |3           |
|7 |  │   │   └─TABLE FULL SCAN             |t2   |2       |3           |
|8 |  │   └─NESTED-LOOP ANTI JOIN CARTESIAN |     |1       |5           |
|9 |  │     ├─TABLE FULL SCAN               |t2   |1       |3           |
|10|  │     └─MATERIAL                      |     |0       |3           |
|11|  │       └─SUBPLAN SCAN                |VIEW2|0       |3           |
|12|  │         └─TABLE FULL SCAN           |t1   |0       |3           |
|13|  └─TOP-N SORT                          |     |1       |3           |
|14|    └─HASH DISTINCT                     |     |2       |3           |
|15|      └─TABLE FULL SCAN                 |t2   |2       |3           |
=========================================================================
Outputs & filters:
-------------------------------------
  0 - output(nil), filter(nil)
      table_columns([{VIEW1: ({t1: (VIEW1.t1.h1, VIEW1.t1.h2, VIEW1.t1.h3, VIEW1.t1.h4, VIEW1.t1.h5)}), hash_distinct}]),
      update([VIEW1.t1.h2=column_conv(VARCHAR,utf8mb4_general_ci,length:20,NOT NULL,'null')])
  1 - output([VIEW1.t1.h1], [VIEW1.t1.h2], [VIEW1.t1.h3], [VIEW1.t1.h4], [VIEW1.t1.h5]), filter(nil), rowset=16
      exec_params_(nil), onetime_exprs_([subquery(1)(:0)]), init_plan_idxs_(nil), use_batch=false
  2 - output([VIEW1.t1.h1], [VIEW1.t1.h2], [VIEW1.t1.h3], [VIEW1.t1.h4], [VIEW1.t1.h5]), filter(nil), rowset=16
      access([VIEW1.t1.h1], [VIEW1.t1.h2], [VIEW1.t1.h3], [VIEW1.t1.h4], [VIEW1.t1.h5])
  3 - output([UNION([1])], [UNION([2])], [UNION([3])], [UNION([4])], [UNION([5])], [UNION([6])]), filter(nil), rowset=16
  4 - output([t2.h2], [t1.h1], [t1.h2], [t1.h3], [t1.h4], [t1.h5]), filter([t2.h2 = :0]), rowset=16
      conds([t1.h3 = cast(NULL, FLOAT(-1, -1))]), nl_params_(nil), use_batch=false
  5 - output([t1.h1], [t1.h3], [t1.h2], [t1.h4], [t1.h5]), filter(nil), rowset=16
      access([t1.h1], [t1.h3], [t1.h2], [t1.h4], [t1.h5]), partitions(p0)
      is_index_back=false, is_global_index=false, 
      range_key([t1.h1]), range(MIN ; MAX)always true
  6 - output([t2.h2]), filter(nil), rowset=16
  7 - output([t2.h2]), filter(nil), rowset=16
      access([t2.h2]), partitions(p0)
      is_index_back=false, is_global_index=false, 
      range_key([t2.h1]), range(MIN ; MAX)always true
  8 - output([t2.h2], [cast(NULL, INT(11, 0))], [cast(NULL, VARCHAR(20))], [cast(NULL, FLOAT(-1, -1))], [cast(NULL, MYSQL_DATE(10, 0))], [cast(NULL, CHAR(20))]), filter(nil), rowset=16
      conds(nil), nl_params_(nil), use_batch=false
  9 - output([t2.h2]), filter([t2.h2 = :0]), rowset=16
      access([t2.h2]), partitions(p0)
      is_index_back=false, is_global_index=false, filter_before_indexback[false], 
      range_key([t2.h1]), range(MIN ; MAX)always true
 10 - output(nil), filter(nil), startup_filter([0]), rowset=16
 11 - output(nil), filter(nil), rowset=16
      access(nil)
 12 - output([1]), filter(nil), rowset=16
      access(nil), partitions(p0)
      limit(1), offset(nil), is_index_back=false, is_global_index=false, 
      range_key([t1.h1]), range(MIN ; MAX)always true
 13 - output([t2.h2]), filter(nil), rowset=16
      sort_keys([t2.h3, ASC]), topn(1)
 14 - output([t2.h3], [t2.h2]), filter(nil), rowset=16
      distinct([t2.h2])
 15 - output([t2.h2], [t2.h3]), filter(nil), rowset=16
      access([t2.h2], [t2.h3]), partitions(p0)
      is_index_back=false, is_global_index=false, 
      range_key([t2.h1]), range(MIN ; MAX)always true
UPDATE t1 full join  t2 ON t1.h3=null set t1.h2='null' where t2.h2=( select * from (select DISTINCT(t2.h2) from t2 order by t2.h3 asc LIMIT 1 ) as t2);
select * from t1;
+----+----------+-------+------------+--------+
| h1 | h2       | h3    | h4         | h5     |
+----+----------+-------+------------+--------+
|  1 | xiaowang |  60.5 | 2022-05-01 | 一组   |
|  2 | xiaolizi | 65.42 | 2022-06-16 | 二组   |
+----+----------+-------+------------+--------+
drop table t1,t2;

set autocommit = 1;

alter system set _enable_defensive_check = '1';
alter system set_tp tp_no = 308, error_code = 0, frequency = 1;

