DROP TABLE IF EXISTS t0,t1,t2,t3,t4,t5,t6,t7,t8,t9;
DROP VIEW IF EXISTS v1,v2,v3,v4,v5,v6;
CREATE TABLE t1 (a int, id int primary key) partition by hash(id) partitions 2;
CREATE TABLE t2 (a int, id int primary key) partition by hash(id) partitions 2;
CREATE TABLE t3 (a int, id int primary key) partition by hash(id) partitions 2;
CREATE INDEX i1 on t1(a) global;
CREATE INDEX i2 on t2(a) global;
CREATE INDEX i3 on t3(a) global;
INSERT INTO t1 VALUES (1, 1);
INSERT INTO t2 VALUES (2, 2);
INSERT INTO t3 VALUES (2, 3);
INSERT INTO t1 VALUES (2, 4);
SELECT /*+index(t1 i1), index(t2 i2), index(t3 i3), use_nl(t2 t3), use_merge((t2, t3), t1), leading((t2, t3), t1)*/ t1.a, t1.id, t2.a, t2.id, t3.a, t3.id FROM t1 LEFT JOIN (t2 LEFT JOIN t3 ON t2.a=t3.a) ON t1.a=t3.a order by t1.id, t2.id, t3.id;
a	id	a	id	a	id
1	1	NULL	NULL	NULL	NULL
2	4	2	2	2	3
DELETE FROM t1 WHERE a=2;
SELECT /*+index(t1 i1), index(t2 i2), index(t3 i3), use_nl(t2 t3), use_merge((t2, t3), t1), leading((t2, t3), t1)*/ * FROM t1 LEFT JOIN (t2 LEFT JOIN t3 ON t2.a=t3.a) ON t1.a=t3.a order by t1.a;
a	id	a	id	a	id
1	1	NULL	NULL	NULL	NULL
DELETE FROM t2;
SELECT /*+index(t1 i1), index(t2 i2), index(t3 i3), use_nl(t2 t3), use_merge((t2, t3), t1), leading((t2, t3), t1)*/ * FROM t1 LEFT JOIN (t2 LEFT JOIN t3 ON t2.a=t3.a) ON t1.a=t3.a order by t1.a;
a	id	a	id	a	id
1	1	NULL	NULL	NULL	NULL
DROP TABLE t1,t2,t3;
CREATE TABLE t1(a int, id int primary key, key (a)) partition by hash(id) partitions 2;
CREATE TABLE t2(b int, id int primary key, key (b)) partition by hash(id) partitions 2;
CREATE TABLE t3(c int, id int primary key, key (c)) partition by hash(id) partitions 2;
INSERT INTO t1 VALUES (NULL, -1), (0, 0), (1, 1), (2, 2), (3, 3), (4, 4), (5, 5), (6, 6),
(7, 7), (8, 8), (9, 9), (10, 10), (11, 11), (12, 12), (13, 13), (14, 14), (15, 15),
(16, 16), (17, 17), (18, 18), (19, 19);
INSERT INTO t2 VALUES (NULL, -1), (0, 0), (1, 1), (2, 2), (3, 3), (4, 4), (5, 5), (6, 6),
(7, 7), (8, 8), (9, 9), (10, 10), (11, 11), (12, 12), (13, 13), (14, 14), (15, 15),
(16, 16), (17, 17), (18, 18), (19, 19);
INSERT INTO t3 VALUES (0, 0), (1, 1), (2, 2), (3, 3), (4, 4), (5, 5);
SELECT /*+use_nl(t1, (t2, t3)), use_nl(t2, t3), leading(t1, (t2, t3))*/ a, b, c FROM t1 LEFT JOIN (t2 join t3) ON c < 3 and b = c;
a	b	c
0	0	0
0	1	1
0	2	2
1	0	0
1	1	1
1	2	2
10	0	0
10	1	1
10	2	2
11	0	0
11	1	1
11	2	2
12	0	0
12	1	1
12	2	2
13	0	0
13	1	1
13	2	2
14	0	0
14	1	1
14	2	2
15	0	0
15	1	1
15	2	2
16	0	0
16	1	1
16	2	2
17	0	0
17	1	1
17	2	2
18	0	0
18	1	1
18	2	2
19	0	0
19	1	1
19	2	2
2	0	0
2	1	1
2	2	2
3	0	0
3	1	1
3	2	2
4	0	0
4	1	1
4	2	2
5	0	0
5	1	1
5	2	2
6	0	0
6	1	1
6	2	2
7	0	0
7	1	1
7	2	2
8	0	0
8	1	1
8	2	2
9	0	0
9	1	1
9	2	2
NULL	0	0
NULL	1	1
NULL	2	2
SELECT /*+use_nl(t1, (t2, t3)), use_nl(t2, t3), leading(t1, (t2, t3))*/ a, b, c FROM t1 LEFT JOIN (t2 join t3) ON b < 3 and b = c;
a	b	c
0	0	0
0	1	1
0	2	2
1	0	0
1	1	1
1	2	2
10	0	0
10	1	1
10	2	2
11	0	0
11	1	1
11	2	2
12	0	0
12	1	1
12	2	2
13	0	0
13	1	1
13	2	2
14	0	0
14	1	1
14	2	2
15	0	0
15	1	1
15	2	2
16	0	0
16	1	1
16	2	2
17	0	0
17	1	1
17	2	2
18	0	0
18	1	1
18	2	2
19	0	0
19	1	1
19	2	2
2	0	0
2	1	1
2	2	2
3	0	0
3	1	1
3	2	2
4	0	0
4	1	1
4	2	2
5	0	0
5	1	1
5	2	2
6	0	0
6	1	1
6	2	2
7	0	0
7	1	1
7	2	2
8	0	0
8	1	1
8	2	2
9	0	0
9	1	1
9	2	2
NULL	0	0
NULL	1	1
NULL	2	2
DELETE FROM t3;
SELECT /*+use_nl(t1, (t2, t3)), use_nl(t2, t3), leading(t1, (t2, t3))*/ a, b, c FROM t1 LEFT JOIN (t2 join t3) ON b < 3 and b = c;
a	b	c
0	NULL	NULL
1	NULL	NULL
10	NULL	NULL
11	NULL	NULL
12	NULL	NULL
13	NULL	NULL
14	NULL	NULL
15	NULL	NULL
16	NULL	NULL
17	NULL	NULL
18	NULL	NULL
19	NULL	NULL
2	NULL	NULL
3	NULL	NULL
4	NULL	NULL
5	NULL	NULL
6	NULL	NULL
7	NULL	NULL
8	NULL	NULL
9	NULL	NULL
NULL	NULL	NULL
DROP TABLE t1,t2,t3;
CREATE TABLE t1 (goods int(12) NOT NULL primary key, price varchar(128) NOT NULL);
INSERT INTO t1 VALUES (23, 2340), (26, 9900);
CREATE TABLE t2 (goods int(12) primary key, name varchar(50), shop char(2))
partition by hash(goods) partitions 2;
CREATE INDEX i2 on t2(shop) global;
INSERT INTO t2 VALUES (23, 'as300', 'fr'), (26, 'as600', 'fr');
create table t3 (groupid int(12) NOT NULL primary key, goodsid int(12) NOT NULL)
partition by hash(groupid) partitions 2;
CREATE INDEX i3 on t3(goodsid) global;
INSERT INTO t3 VALUES (3,23), (6,26);
CREATE TABLE t4 (groupid int(12) primary key);
INSERT INTO t4 VALUES (1), (2), (3), (4), (5), (6);
SELECT * FROM
(SELECT DISTINCT gl.groupid, gp.price
FROM t4 gl
LEFT JOIN
(t3 g INNER JOIN t2 p ON g.goodsid = p.goods
INNER JOIN t1 gp ON p.goods = gp.goods)
ON gl.groupid = g.groupid and p.shop = 'fr' order by gl.groupid, gp.price) t;
groupid	price
1	NULL
2	NULL
3	2340
4	NULL
5	NULL
6	9900
CREATE VIEW v1 AS
SELECT g.groupid groupid, p.goods goods,
p.name name, p.shop shop,
gp.price price
FROM t3 g INNER JOIN t2 p ON g.goodsid = p.goods
INNER JOIN t1 gp on p.goods = gp.goods;
CREATE VIEW v2 AS
SELECT DISTINCT g.groupid, fr.price
FROM t4 g
LEFT JOIN
v1 fr on g.groupid = fr.groupid and fr.shop = 'fr';
SELECT * FROM v2 order by groupid, price;
groupid	price
1	NULL
2	NULL
3	2340
4	NULL
5	NULL
6	9900
SELECT * FROM
(SELECT DISTINCT g.groupid, fr.price
FROM t4 g
LEFT JOIN
v1 fr on g.groupid = fr.groupid and fr.shop = 'fr' order by g.groupid, fr.price) t;
groupid	price
1	NULL
2	NULL
3	2340
4	NULL
5	NULL
6	9900
DROP VIEW v1,v2;
DROP TABLE t1,t2,t3,t4;
CREATE TABLE t1 (id1 int PRIMARY KEY, id2 int);
create index i1 on t1(id2) partition by hash(id2) partitions 2;
CREATE TABLE t2 (id1 int PRIMARY KEY, id2 int);
create index i2 on t2(id2) partition by hash(id2) partitions 2;
CREATE TABLE t3 (id1 int PRIMARY KEY, id2 int);
create index i3 on t3(id2) partition by hash(id2) partitions 2;
CREATE TABLE t4 (id1 int PRIMARY KEY, id2 int);
create index i4 on t4(id2) partition by hash(id2) partitions 2;
CREATE TABLE t5 (id1 int PRIMARY KEY, id2 int);
create index i5 on t5(id2) partition by hash(id2) partitions 2;
SELECT t1.id1 AS id, t5.id1 AS ngroupbynsa
FROM t1 INNER JOIN t2 ON t2.id2 = t1.id1
LEFT OUTER JOIN
(t3 INNER JOIN t4 ON t4.id1 = t3.id2 INNER JOIN t5 ON t4.id2 = t5.id1)
ON t3.id2 IS NOT NULL
WHERE t1.id1=2;
id	ngroupbynsa
SELECT t1.id1 AS id, t5.id1 AS ngroupbynsa
FROM t1 INNER JOIN t2 ON t2.id2 = t1.id1
LEFT OUTER JOIN
(t3 INNER JOIN t4 ON t4.id1 = t3.id2 INNER JOIN t5 ON t4.id2 = t5.id1)
ON t3.id2 IS NOT NULL
WHERE t1.id1=2;
id	ngroupbynsa
INSERT INTO t1 VALUES (1,1), (2,1), (3,2);
INSERT INTO t2 VALUES (2,1), (3,2), (4,3);
INSERT INTO t3 VALUES (1,1), (3,2), (2,NULL);
INSERT INTO t4 VALUES (1,1), (2,1), (3,3);
INSERT INTO t5 VALUES (1,1), (2,2), (3,3), (4,3);
SELECT t1.id1 AS id, t5.id1 AS ngroupbynsa
FROM t1 INNER JOIN t2 ON t2.id2 = t1.id1
LEFT OUTER JOIN
(t3 INNER JOIN t4 ON t4.id1 = t3.id2 INNER JOIN t5 ON t4.id2 = t5.id1)
ON t3.id2 IS NOT NULL
WHERE t1.id1=2;
id	ngroupbynsa
2	1
2	1
drop table t1, t2, t3, t4, t5;
CREATE TABLE t1 (
carrier char(2) default NULL,
id int NOT NULL auto_increment PRIMARY KEY
);
create index i1 on t1(carrier) partition by key(carrier) partitions 2;
INSERT INTO t1 VALUES
('CO',235371754),('CO',235376554),('CO',235376884),('CO',235377874),
('CO',231060394),('CO',231059224),('CO',231059314),('CO',231060484),
('CO',231060274),('CO',231060124),('CO',231060244),('CO',231058594),
('CO',231058924),('CO',231058504),('CO',231059344),('CO',231060424),
('CO',231059554),('CO',231060304),('CO',231059644),('CO',231059464),
('CO',231059764),('CO',231058294),('CO',231058624),('CO',231058864),
('CO',231059374),('CO',231059584),('CO',231059734),('CO',231059014),
('CO',231059854),('CO',231059494),('CO',231059794),('CO',231058534),
('CO',231058324),('CO',231058684),('CO',231059524),('CO',231059974);
CREATE TABLE t2 (
scan_date date default NULL,
package_id int default NULL,
INDEX scan_date(scan_date),
INDEX package_id(package_id)
);
INSERT INTO t2 VALUES
('2008-12-29',231062944),('2008-12-29',231065764),('2008-12-29',231066124),
('2008-12-29',231060094),('2008-12-29',231061054),('2008-12-29',231065644),
('2008-12-29',231064384),('2008-12-29',231064444),('2008-12-29',231073774),
('2008-12-29',231058594),('2008-12-29',231059374),('2008-12-29',231066004),
('2008-12-29',231068494),('2008-12-29',231070174),('2008-12-29',231071884),
('2008-12-29',231063274),('2008-12-29',231063754),('2008-12-29',231064144),
('2008-12-29',231069424),('2008-12-29',231073714),('2008-12-29',231058414),
('2008-12-29',231060994),('2008-12-29',231069154),('2008-12-29',231068614),
('2008-12-29',231071464),('2008-12-29',231074014),('2008-12-29',231059614),
('2008-12-29',231059074),('2008-12-29',231059464),('2008-12-29',231069094),
('2008-12-29',231067294),('2008-12-29',231070144),('2008-12-29',231073804),
('2008-12-29',231072634),('2008-12-29',231058294),('2008-12-29',231065344),
('2008-12-29',231066094),('2008-12-29',231069034),('2008-12-29',231058594),
('2008-12-29',231059854),('2008-12-29',231059884),('2008-12-29',231059914),
('2008-12-29',231063664),('2008-12-29',231063814),('2008-12-29',231063904);
CREATE TABLE t3 (
package_id int default NULL,
INDEX package_id(package_id)
);
INSERT INTO t3 VALUES
(231058294),(231058324),(231058354),(231058384),(231058414),(231058444),
(231058474),(231058504),(231058534),(231058564),(231058594),(231058624),
(231058684),(231058744),(231058804),(231058864),(231058924),(231058954),
(231059014),(231059074),(231059104),(231059134),(231059164),(231059194),
(231059224),(231059254),(231059284),(231059314),(231059344),(231059374),
(231059404),(231059434),(231059464),(231059494),(231059524),(231059554),
(231059584),(231059614),(231059644),(231059674),(231059704),(231059734),
(231059764),(231059794),(231059824),(231059854),(231059884),(231059914),
(231059944),(231059974),(231060004),(231060034),(231060064),(231060094),
(231060124),(231060154),(231060184),(231060214),(231060244),(231060274),
(231060304),(231060334),(231060364),(231060394),(231060424),(231060454),
(231060484),(231060514),(231060544),(231060574),(231060604),(231060634),
(231060664),(231060694),(231060724),(231060754),(231060784),(231060814),
(231060844),(231060874),(231060904),(231060934),(231060964),(231060994),
(231061024),(231061054),(231061084),(231061144),(231061174),(231061204),
(231061234),(231061294),(231061354),(231061384),(231061414),(231061474),
(231061564),(231061594),(231061624),(231061684),(231061714),(231061774),
(231061804),(231061894),(231061984),(231062074),(231062134),(231062224),
(231062254),(231062314),(231062374),(231062434),(231062494),(231062554),
(231062584),(231062614),(231062644),(231062704),(231062734),(231062794),
(231062854),(231062884),(231062944),(231063004),(231063034),(231063064),
(231063124),(231063154),(231063184),(231063214),(231063274),(231063334),
(231063394),(231063424),(231063454),(231063514),(231063574),(231063664);
CREATE TABLE t4 (
carrier char(2) NOT NULL default '' PRIMARY KEY,
id int(11) default NULL,
INDEX id(id) global
) partition by key(carrier) partitions 2;
INSERT INTO t4 VALUES
('99',6),('SK',456),('UA',486),('AI',1081),('OS',1111),('VS',1510);
CREATE TABLE t5 (
carrier_id int default NULL,
INDEX carrier_id(carrier_id)
);
INSERT INTO t5 VALUES
(6),(6),(6),(6),(6),(6),(6),(6),(6),(6),(6),(6),(6),(6),(6),(6),(6),(6),(6),
(6),(6),(6),(6),(6),(6),(6),(6),(6),(6),(6),(6),(6),(6),(6),(6),(6),(6),(6),
(6),(6),(6),(6),(6),(6),(6),(6),(6),(6),(6),(6),(6),(6),(6),(6),(6),(6),(6),
(6),(6),(6),(6),(6),(6),(6),(6),(6),(6),(6),(6),(6),(6),(6),(6),(6),(6),(6),
(6),(6),(6),(6),(6),(6),(6),(6),(6),(6),(6),(6),(6),(6),(6),(6),(6),(6),(6),
(6),(6),(6),(6),(6),(6),(6),(6),(6),(6),(6),(6),(6),(6),(456),(456),(456),
(456),(456),(456),(456),(456),(456),(456),(456),(456),(456),(456),(456),
(456),(486),(1081),(1111),(1111),(1111),(1111),(1510);
SELECT COUNT(*)
FROM((t2 JOIN t1 ON t2.package_id = t1.id)
JOIN t3 ON t3.package_id = t1.id);
COUNT(*)
6
SELECT COUNT(*)
FROM ((t2 JOIN t1 ON t2.package_id = t1.id)
JOIN t3 ON t3.package_id = t1.id)
LEFT JOIN
(t5 JOIN t4 ON t5.carrier_id = t4.id)
ON t4.carrier = t1.carrier;
COUNT(*)
6
DROP TABLE t1,t2,t3,t4,t5;
alter system set _enable_defensive_check = '1';
