# 环境清理
purge recyclebin;
result_format: 4
explain_protocol: 0
TIME-TC-1
expr1->time
select addtime(time '00:00:00','00:00:00');
+-------------------------------------+
| addtime(time '00:00:00','00:00:00') |
+-------------------------------------+
| 00:00:00                            |
+-------------------------------------+
select addtime(time '11:00:00',0);
+----------------------------+
| addtime(time '11:00:00',0) |
+----------------------------+
| 11:00:00                   |
+----------------------------+
select addtime(time '11:00:00',1);
+----------------------------+
| addtime(time '11:00:00',1) |
+----------------------------+
| 11:00:01                   |
+----------------------------+
select addtime(time '11:00:00','00:00');
+----------------------------------+
| addtime(time '11:00:00','00:00') |
+----------------------------------+
| 11:00:00                         |
+----------------------------------+
select addtime(time '11:00:00','01:01');
+----------------------------------+
| addtime(time '11:00:00','01:01') |
+----------------------------------+
| 12:01:00                         |
+----------------------------------+
select addtime(time '11:00:00','01:01:00');
+-------------------------------------+
| addtime(time '11:00:00','01:01:00') |
+-------------------------------------+
| 12:01:00                            |
+-------------------------------------+
select addtime(time '11:00:00','00:01:01');
+-------------------------------------+
| addtime(time '11:00:00','00:01:01') |
+-------------------------------------+
| 11:01:01                            |
+-------------------------------------+
select addtime(time '11:00:00','-01:01:00');
+--------------------------------------+
| addtime(time '11:00:00','-01:01:00') |
+--------------------------------------+
| 09:59:00                             |
+--------------------------------------+
select addtime(time '11:00:00','-00:-01:-01');
+----------------------------------------+
| addtime(time '11:00:00','-00:-01:-01') |
+----------------------------------------+
| 11:00:00                               |
+----------------------------------------+
select addtime(time '11:00:00','00:01:-01');
+--------------------------------------+
| addtime(time '11:00:00','00:01:-01') |
+--------------------------------------+
| 11:01:00                             |
+--------------------------------------+
select addtime(time '11:59:59','13:01:01');
+-------------------------------------+
| addtime(time '11:59:59','13:01:01') |
+-------------------------------------+
| 25:01:00                            |
+-------------------------------------+
select addtime(time '11:00:00',null);
+-------------------------------+
| addtime(time '11:00:00',null) |
+-------------------------------+
| NULL                          |
+-------------------------------+
select addtime(time '11:00:00','');
+-----------------------------+
| addtime(time '11:00:00','') |
+-----------------------------+
| NULL                        |
+-----------------------------+
select addtime(time '11:00:00','1:1');
+--------------------------------+
| addtime(time '11:00:00','1:1') |
+--------------------------------+
| 12:01:00                       |
+--------------------------------+
select addtime(time '11:00:00','0:1:1');
+----------------------------------+
| addtime(time '11:00:00','0:1:1') |
+----------------------------------+
| 11:01:01                         |
+----------------------------------+
select addtime(time'11:00:00',60);
+----------------------------+
| addtime(time'11:00:00',60) |
+----------------------------+
| NULL                       |
+----------------------------+
select addtime(time'11:00:00',59);
+----------------------------+
| addtime(time'11:00:00',59) |
+----------------------------+
| 11:00:59                   |
+----------------------------+
select addtime(time '11:00:00',100);
+------------------------------+
| addtime(time '11:00:00',100) |
+------------------------------+
| 11:01:00                     |
+------------------------------+
select addtime(time '11:00:00',110);
+------------------------------+
| addtime(time '11:00:00',110) |
+------------------------------+
| 11:01:10                     |
+------------------------------+
select addtime(time '11:00:00',160);
+------------------------------+
| addtime(time '11:00:00',160) |
+------------------------------+
| NULL                         |
+------------------------------+
select addtime(time '11:00:00',200);
+------------------------------+
| addtime(time '11:00:00',200) |
+------------------------------+
| 11:02:00                     |
+------------------------------+
时间最大最小值验证   expr1和expr2的最大最小值为'±838:59:59'
select addtime('400:59:59','400:59:59');
+----------------------------------+
| addtime('400:59:59','400:59:59') |
+----------------------------------+
| 801:59:58                        |
+----------------------------------+
select addtime('838:59:59','0');
+--------------------------+
| addtime('838:59:59','0') |
+--------------------------+
| 838:59:59                |
+--------------------------+
select addtime('839:00:00','0');
+--------------------------+
| addtime('839:00:00','0') |
+--------------------------+
| 838:59:59                |
+--------------------------+
select addtime('0','838:59:59');
+--------------------------+
| addtime('0','838:59:59') |
+--------------------------+
| 838:59:59                |
+--------------------------+
select addtime('0','839:00:00');
+--------------------------+
| addtime('0','839:00:00') |
+--------------------------+
| 838:59:59                |
+--------------------------+
select addtime('500:59:59','499:00:00');
+----------------------------------+
| addtime('500:59:59','499:00:00') |
+----------------------------------+
| 838:59:59                        |
+----------------------------------+
select addtime('500:59:59','499:00:01');
+----------------------------------+
| addtime('500:59:59','499:00:01') |
+----------------------------------+
| 838:59:59                        |
+----------------------------------+
select addtime('838:59:59','838:59:59');
+----------------------------------+
| addtime('838:59:59','838:59:59') |
+----------------------------------+
| 838:59:59                        |
+----------------------------------+
select addtime('839:59:59','839:59:59');
+----------------------------------+
| addtime('839:59:59','839:59:59') |
+----------------------------------+
| 838:59:59                        |
+----------------------------------+
select addtime('1839:59:59','1839:59:59');
+------------------------------------+
| addtime('1839:59:59','1839:59:59') |
+------------------------------------+
| 838:59:59                          |
+------------------------------------+
select addtime('-400:59:59','-400:59:59');
+------------------------------------+
| addtime('-400:59:59','-400:59:59') |
+------------------------------------+
| -801:59:58                         |
+------------------------------------+
select addtime('-838:59:59','0');
+---------------------------+
| addtime('-838:59:59','0') |
+---------------------------+
| -838:59:59                |
+---------------------------+
select addtime('-839:00:00','0');
+---------------------------+
| addtime('-839:00:00','0') |
+---------------------------+
| -838:59:59                |
+---------------------------+
select addtime('0','-838:59:59');
+---------------------------+
| addtime('0','-838:59:59') |
+---------------------------+
| -838:59:59                |
+---------------------------+
select addtime('0','-839:00:00');
+---------------------------+
| addtime('0','-839:00:00') |
+---------------------------+
| -838:59:59                |
+---------------------------+
select addtime('-500:59:59','-499:00:00');
+------------------------------------+
| addtime('-500:59:59','-499:00:00') |
+------------------------------------+
| -838:59:59                         |
+------------------------------------+
select addtime('-500:59:59','-499:00:01');
+------------------------------------+
| addtime('-500:59:59','-499:00:01') |
+------------------------------------+
| -838:59:59                         |
+------------------------------------+
select addtime('-838:59:59','-838:59:59');
+------------------------------------+
| addtime('-838:59:59','-838:59:59') |
+------------------------------------+
| -838:59:59                         |
+------------------------------------+
select addtime('-839:59:59','-839:59:59');
+------------------------------------+
| addtime('-839:59:59','-839:59:59') |
+------------------------------------+
| -838:59:59                         |
+------------------------------------+
select addtime('11:00:00',1);
+-----------------------+
| addtime('11:00:00',1) |
+-----------------------+
| 11:00:01              |
+-----------------------+
select addtime('11:00:00',0);
+-----------------------+
| addtime('11:00:00',0) |
+-----------------------+
| 11:00:00              |
+-----------------------+
select addtime('23:59:59', '1') ;
+--------------------------+
| addtime('23:59:59', '1') |
+--------------------------+
| 24:00:00                 |
+--------------------------+
select addtime('23:59:59', '1:0:2');
+------------------------------+
| addtime('23:59:59', '1:0:2') |
+------------------------------+
| 25:00:01                     |
+------------------------------+
select addtime('11:00:00',59);
+------------------------+
| addtime('11:00:00',59) |
+------------------------+
| 11:00:59               |
+------------------------+
select addtime('11:00:00',60);
+------------------------+
| addtime('11:00:00',60) |
+------------------------+
| NULL                   |
+------------------------+
select addtime('11:00:00',259);
+-------------------------+
| addtime('11:00:00',259) |
+-------------------------+
| 11:02:59                |
+-------------------------+
select addtime('11:00:00',6000);
+--------------------------+
| addtime('11:00:00',6000) |
+--------------------------+
| NULL                     |
+--------------------------+
select addtime('11:00:00',0.000001);
+------------------------------+
| addtime('11:00:00',0.000001) |
+------------------------------+
| 11:00:00.000001              |
+------------------------------+
select addtime('11:00:00',-0.000001);
+-------------------------------+
| addtime('11:00:00',-0.000001) |
+-------------------------------+
| 10:59:59.999999               |
+-------------------------------+
select addtime('11:00:00',-61);
+-------------------------+
| addtime('11:00:00',-61) |
+-------------------------+
| NULL                    |
+-------------------------+
select addtime('11:00:00',-100);
+--------------------------+
| addtime('11:00:00',-100) |
+--------------------------+
| 10:59:00                 |
+--------------------------+
expr1->date
ob结果为 '2007-12-31 00:00:01'   MySQL结果'00:00:01'
select addtime(date'2007-12-31', '1') ;
+--------------------------------+
| addtime(date'2007-12-31', '1') |
+--------------------------------+
| 2007-12-31 00:00:01            |
+--------------------------------+
ob结果为 '00:20:08'   MySQL结果'00:20:08'
select addtime('2007-12-31', '1') ;
+----------------------------+
| addtime('2007-12-31', '1') |
+----------------------------+
| 00:20:08                   |
+----------------------------+
ob结果为 '2008-01-01 01:01:01'   MySQL结果'25:01:01 '
select addtime(date'2007-12-31', '1 01:01:01') ;
+-----------------------------------------+
| addtime(date'2007-12-31', '1 01:01:01') |
+-----------------------------------------+
| 2008-01-01 01:01:01                     |
+-----------------------------------------+
select addtime(date'2007-12-31', null) ;
+---------------------------------+
| addtime(date'2007-12-31', null) |
+---------------------------------+
| NULL                            |
+---------------------------------+
select addtime(date'2007-12-31', '') ;
+-------------------------------+
| addtime(date'2007-12-31', '') |
+-------------------------------+
| NULL                          |
+-------------------------------+
select addtime('2007-12-31', null) ;
+-----------------------------+
| addtime('2007-12-31', null) |
+-----------------------------+
| NULL                        |
+-----------------------------+
select addtime('2007-12-31', '') ;
+---------------------------+
| addtime('2007-12-31', '') |
+---------------------------+
| NULL                      |
+---------------------------+
select addtime('2007-12-31', '01:01:01') ;
+-----------------------------------+
| addtime('2007-12-31', '01:01:01') |
+-----------------------------------+
| 01:21:08                          |
+-----------------------------------+
select addtime('2007/12/31', '01:01:01') ;
+-----------------------------------+
| addtime('2007/12/31', '01:01:01') |
+-----------------------------------+
| 01:21:08                          |
+-----------------------------------+
ob结果为 '2008-01-01 01:01:01'   MySQL结果'25:01:01 '
select addtime(date'2007/12/31', '25:01:01') ;
+---------------------------------------+
| addtime(date'2007/12/31', '25:01:01') |
+---------------------------------------+
| 2008-01-01 01:01:01                   |
+---------------------------------------+
ob结果为 '2008-02-04 00:00:00 '   MySQL结果'816:00:00'
select addtime(date '2008-01-01', '34 00:00:00') ;
+-------------------------------------------+
| addtime(date '2008-01-01', '34 00:00:00') |
+-------------------------------------------+
| 2008-02-04 00:00:00                       |
+-------------------------------------------+
超过第二个参数的最大值'±838:59:59'
select addtime(date '2008-01-01', '35 00:00:00') ;
+-------------------------------------------+
| addtime(date '2008-01-01', '35 00:00:00') |
+-------------------------------------------+
| 2008-02-04 22:59:59                       |
+-------------------------------------------+
select addtime(date '2008-01-01', '34 22:59:59') ;
+-------------------------------------------+
| addtime(date '2008-01-01', '34 22:59:59') |
+-------------------------------------------+
| 2008-02-04 22:59:59                       |
+-------------------------------------------+
select addtime(date '2008-06-01', '-34 22:59:59') ;
+--------------------------------------------+
| addtime(date '2008-06-01', '-34 22:59:59') |
+--------------------------------------------+
| 2008-04-27 01:00:01                        |
+--------------------------------------------+
select addtime(date '2008-06-01', '-34 23:00:00') ;
+--------------------------------------------+
| addtime(date '2008-06-01', '-34 23:00:00') |
+--------------------------------------------+
| 2008-04-27 01:00:01                        |
+--------------------------------------------+
expr1->year
select addtime('2007', '0') ;
+----------------------+
| addtime('2007', '0') |
+----------------------+
| 00:20:07             |
+----------------------+
select addtime('2007', '100') ;
+------------------------+
| addtime('2007', '100') |
+------------------------+
| 00:21:07               |
+------------------------+
select addtime('2007', 'null') ;
+-------------------------+
| addtime('2007', 'null') |
+-------------------------+
| 00:20:07                |
+-------------------------+
select addtime('2007', '') ;
+---------------------+
| addtime('2007', '') |
+---------------------+
| NULL                |
+---------------------+
expr1->timedate
select addtime(datetime '2007-12-31 23:59:59', '01:01:01') ;
ERROR 42000: Incorrect parameters in the call to native function 'addtime'
select addtime(datetime'2007-02-28 23:59:59', '1') ;
ERROR 42000: Incorrect parameters in the call to native function 'addtime'
select addtime(datetime'2007-03-01 00:00:00', '-1') ;
ERROR 42000: Incorrect parameters in the call to native function 'addtime'
select addtime(datetime '2022-10-30 23:58:59','0:1:1');
ERROR 42000: Incorrect parameters in the call to native function 'addtime'
select addtime('2007-12-31 23:59:59', '1') ;
+-------------------------------------+
| addtime('2007-12-31 23:59:59', '1') |
+-------------------------------------+
| 2008-01-01 00:00:00                 |
+-------------------------------------+
select addtime('2007-02-28 23:59:59', '1') ;
+-------------------------------------+
| addtime('2007-02-28 23:59:59', '1') |
+-------------------------------------+
| 2007-03-01 00:00:00                 |
+-------------------------------------+
select addtime('2007-03-01 00:00:00', '-1') ;
+--------------------------------------+
| addtime('2007-03-01 00:00:00', '-1') |
+--------------------------------------+
| 2007-02-28 23:59:59                  |
+--------------------------------------+
select addtime('2007-12-31 23:59:59', '1 1:1:1.000001') ;
+--------------------------------------------------+
| addtime('2007-12-31 23:59:59', '1 1:1:1.000001') |
+--------------------------------------------------+
| 2008-01-02 01:01:00.000001                       |
+--------------------------------------------------+
select addtime('2007-12-31 23:59:59', '1 1:1:1.000002') ;
+--------------------------------------------------+
| addtime('2007-12-31 23:59:59', '1 1:1:1.000002') |
+--------------------------------------------------+
| 2008-01-02 01:01:00.000002                       |
+--------------------------------------------------+
select addtime('2021-4-20 11:00:00', 61) ;
+-----------------------------------+
| addtime('2021-4-20 11:00:00', 61) |
+-----------------------------------+
| NULL                              |
+-----------------------------------+
select addtime('2021-4-20 11:00:00', 100.000001) ;
+-------------------------------------------+
| addtime('2021-4-20 11:00:00', 100.000001) |
+-------------------------------------------+
| 2021-04-20 11:01:00.000001                |
+-------------------------------------------+
select addtime('2021-4-20 11:00:00', null) ;
+-------------------------------------+
| addtime('2021-4-20 11:00:00', null) |
+-------------------------------------+
| NULL                                |
+-------------------------------------+
select addtime('2021-4-20 11:00:00', '') ;
+-----------------------------------+
| addtime('2021-4-20 11:00:00', '') |
+-----------------------------------+
| NULL                              |
+-----------------------------------+
expr1->timestamp
select addtime(timestamp '2007-12-31 23:59:59.999999', '1:1:1.000001') ;
+-----------------------------------------------------------------+
| addtime(timestamp '2007-12-31 23:59:59.999999', '1:1:1.000001') |
+-----------------------------------------------------------------+
| 2008-01-01 01:01:01.000000                                      |
+-----------------------------------------------------------------+
select addtime('2007-12-31 23:59:59.999999', '1 1:1:1.000002') ;
+---------------------------------------------------------+
| addtime('2007-12-31 23:59:59.999999', '1 1:1:1.000002') |
+---------------------------------------------------------+
| 2008-01-02 01:01:01.000001                              |
+---------------------------------------------------------+
select addtime('2007-12-31 23:59:59.999999', null) ;
+---------------------------------------------+
| addtime('2007-12-31 23:59:59.999999', null) |
+---------------------------------------------+
| NULL                                        |
+---------------------------------------------+
select addtime('2007-12-31 23:59:59.999999', '') ;
+-------------------------------------------+
| addtime('2007-12-31 23:59:59.999999', '') |
+-------------------------------------------+
| NULL                                      |
+-------------------------------------------+
SELECT addtime('2020-10-31 23:59:59','0:1:1'),addtime('10:30:59','5:10:37') ;
+----------------------------------------+-------------------------------+
| addtime('2020-10-31 23:59:59','0:1:1') | addtime('10:30:59','5:10:37') |
+----------------------------------------+-------------------------------+
| 2020-11-01 00:01:00                    | 15:41:36                      |
+----------------------------------------+-------------------------------+
select addtime(null,'01:00:00') ;
+--------------------------+
| addtime(null,'01:00:00') |
+--------------------------+
| NULL                     |
+--------------------------+
select addtime('','01:00:00') ;
+------------------------+
| addtime('','01:00:00') |
+------------------------+
| NULL                   |
+------------------------+
expr1->字符或数字
select addtime('20220905',0);
+-----------------------+
| addtime('20220905',0) |
+-----------------------+
| 838:59:59             |
+-----------------------+
select addtime('20220905000000',0);
+-----------------------------+
| addtime('20220905000000',0) |
+-----------------------------+
| 2022-09-05 00:00:00         |
+-----------------------------+
select addtime(20220905000000,0);
+---------------------------+
| addtime(20220905000000,0) |
+---------------------------+
| 2022-09-05 00:00:00       |
+---------------------------+
select addtime(202209050000000,0);
+----------------------------+
| addtime(202209050000000,0) |
+----------------------------+
| NULL                       |
+----------------------------+
select addtime(0,0);
+--------------+
| addtime(0,0) |
+--------------+
| 00:00:00     |
+--------------+
参数1时间格式不对
select addtime('1970-00-00 00:00:00.000000','0.000001') ;
+--------------------------------------------------+
| addtime('1970-00-00 00:00:00.000000','0.000001') |
+--------------------------------------------------+
| 1969-12-31 00:00:00.000001                       |
+--------------------------------------------------+
select addtime('1970-01-00 00:00:00.000000','0.000001') ;
+--------------------------------------------------+
| addtime('1970-01-00 00:00:00.000000','0.000001') |
+--------------------------------------------------+
| 1969-12-31 00:00:00.000001                       |
+--------------------------------------------------+
select addtime('1970-00-01 00:00:00.000000','0.000001') ;
+--------------------------------------------------+
| addtime('1970-00-01 00:00:00.000000','0.000001') |
+--------------------------------------------------+
| 1969-12-31 00:00:00.000001                       |
+--------------------------------------------------+
select addtime('-0000-01-01 00:00:00.000000','0.000001') ;
+---------------------------------------------------+
| addtime('-0000-01-01 00:00:00.000000','0.000001') |
+---------------------------------------------------+
| 00:00:00.000001                                   |
+---------------------------------------------------+
参数2为日期表达式
select addtime('2007-12-31 23:59:59.999999', '01-01 1:1:1.000001') ;
+-------------------------------------------------------------+
| addtime('2007-12-31 23:59:59.999999', '01-01 1:1:1.000001') |
+-------------------------------------------------------------+
| 2008-01-01 00:00:00.999999                                  |
+-------------------------------------------------------------+
select addtime('2007-12-12 23:59:59.999999', '02-02-02') ;
+---------------------------------------------------+
| addtime('2007-12-12 23:59:59.999999', '02-02-02') |
+---------------------------------------------------+
| 2007-12-13 00:00:01.999999                        |
+---------------------------------------------------+
参数2为布尔
select addtime('2007-12-12 23:59:59.999999', true) ;
+---------------------------------------------+
| addtime('2007-12-12 23:59:59.999999', true) |
+---------------------------------------------+
| 2007-12-13 00:00:00.999999                  |
+---------------------------------------------+
select addtime('2007-12-12 23:59:59.999999', false) ;
+----------------------------------------------+
| addtime('2007-12-12 23:59:59.999999', false) |
+----------------------------------------------+
| 2007-12-12 23:59:59.999999                   |
+----------------------------------------------+
缺少参数
select addtime('2022-09-05 11:00:00') ;
ERROR 42000: Incorrect parameter count in the call to native function 'addtime'
select addtime('01:01:01') ;
ERROR 42000: Incorrect parameter count in the call to native function 'addtime'
select addtime();
ERROR 42000: Incorrect parameter count in the call to native function 'addtime'
select addtime('1970-00-00 00:00:00.000000','0.000001',true);
ERROR 42000: Incorrect parameter count in the call to native function 'addtime'
TIME-TC-2
函数嵌套
select cast(addtime('1970-09-05 00:00:00',0) as char(20)) ;
+----------------------------------------------------+
| cast(addtime('1970-09-05 00:00:00',0) as char(20)) |
+----------------------------------------------------+
| 1970-09-05 00:00:00                                |
+----------------------------------------------------+
select convert(addtime('1970-09-05 00:00:00',0),char(20)) ;
+----------------------------------------------------+
| convert(addtime('1970-09-05 00:00:00',0),char(20)) |
+----------------------------------------------------+
| 1970-09-05 00:00:00                                |
+----------------------------------------------------+
select addtime('2022-09-05 11:00:00',second('2017-05-15 10:37:14.123456')) as result ;
+---------------------+
| result              |
+---------------------+
| 2022-09-05 11:00:14 |
+---------------------+
select addtime('2022-09-05 11:00:00',extract(second from '2017-05-15 10:37:14.123456')) as result ;
+---------------------+
| result              |
+---------------------+
| 2022-09-05 11:00:14 |
+---------------------+
select addtime(now(),'01:00:00') ;
select addtime(curdate(),'01:00:00') ;
select addtime(curtime(),'01:00:00') ;
select addtime(curtime(),'100') ;
select addtime(addtime('2007-12-31 23:59:59.999999', 1), 1) ;
+------------------------------------------------------+
| addtime(addtime('2007-12-31 23:59:59.999999', 1), 1) |
+------------------------------------------------------+
| 2008-01-01 00:00:01.999999                           |
+------------------------------------------------------+
select addtime(current_timestamp(),100) as result ;
select addtime(localtime(),100) as result ;
select addtime(localtime,100) as result ;
select addtime(localtimestamp(),100) as result ;
select addtime(localtimestamp,100) as result ;
select addtime(sysdate(),100) as result ;
select addtime(TIMESTAMP('2017-05-15'), 1) as result ;
+----------------------------+
| result                     |
+----------------------------+
| 2017-05-15 00:00:01.000000 |
+----------------------------+
select addtime('2022-09-05 11:00:00',interval 1 day);
ERROR 42000: You have an error in your SQL syntax; check the manual that corresponds to your OceanBase version for the right syntax to use near ')' at line 1
select addtime(date_add('2022-09-05 11:00:00',interval 1 year), 1) as result ;
+---------------------+
| result              |
+---------------------+
| 2023-09-05 11:00:01 |
+---------------------+
select addtime(date_sub('2022-09-05 11:00:00',interval 1 year), 1) as result ;
+---------------------+
| result              |
+---------------------+
| 2021-09-05 11:00:01 |
+---------------------+
select addtime(adddate('2022-09-05',interval '1' day),100) as result;
+----------+
| result   |
+----------+
| 00:21:22 |
+----------+
select addtime(adddate(DATE '2022-09-05',interval '1' day),100) as result;
+---------------------+
| result              |
+---------------------+
| 2022-09-06 00:01:00 |
+---------------------+
select addtime(convert_tz('2022-01-01 12:00:00','+00:00','+10:00'),'100') as result;
+----------------------------+
| result                     |
+----------------------------+
| 2022-01-01 22:01:00.000000 |
+----------------------------+
select addtime('2022-09-05 11:00:00',datediff('2022-01-22 23:59:59','2022-1-21')) as result;
+---------------------+
| result              |
+---------------------+
| 2022-09-05 11:00:01 |
+---------------------+
select dayofmonth(addtime('2007-12-31 23:59:59.999999', 1)) as result;
+--------+
| result |
+--------+
|      1 |
+--------+
select dayname(addtime('2007-12-31 23:59:59.999999', 1)) as result;
+---------+
| result  |
+---------+
| Tuesday |
+---------+
select dayofweek(addtime('2007-12-31 23:59:59.999999', 1)) as result;
+--------+
| result |
+--------+
|      3 |
+--------+
select dayofyear(addtime('2007-12-31 23:59:59.999999', 1)) as result;
+--------+
| result |
+--------+
|      1 |
+--------+
select addtime(from_unixtime('1647738565','%Y %M %D %h:%i:%s'),0);
+------------------------------------------------------------+
| addtime(from_unixtime('1647738565','%Y %M %D %h:%i:%s'),0) |
+------------------------------------------------------------+
| 00:20:22                                                   |
+------------------------------------------------------------+
select last_day(addtime('2022-09-05 11:00:00',000)) as result;
+------------+
| result     |
+------------+
| 2022-09-30 |
+------------+
select addtime(makedate(2022,1),100) as result;
+---------------------+
| result              |
+---------------------+
| 2022-01-01 00:01:00 |
+---------------------+
select addtime(maketime(11,11,11),200) as result;
+-----------------+
| result          |
+-----------------+
| 11:13:11.000000 |
+-----------------+
select addtime('2022-09-05 11:00:00',time('2022-09-05 11:00:00')) as result;
+---------------------+
| result              |
+---------------------+
| 2022-09-05 22:00:00 |
+---------------------+
select addtime(date_add(current_timestamp(),interval 1 year), 1) as result ;
select addtime(date_sub(current_timestamp(),interval 1 year), 1) as result ;
select concat('datetime:',addtime('1970-09-05 00:00:00',0)) ;
+------------------------------------------------------+
| concat('datetime:',addtime('1970-09-05 00:00:00',0)) |
+------------------------------------------------------+
| datetime:1970-09-05 00:00:00                         |
+------------------------------------------------------+
select nullif(addtime('1970-09-05 00:00:00',1),addtime('1970-09-05 00:00:00',1));
+---------------------------------------------------------------------------+
| nullif(addtime('1970-09-05 00:00:00',1),addtime('1970-09-05 00:00:00',1)) |
+---------------------------------------------------------------------------+
| NULL                                                                      |
+---------------------------------------------------------------------------+
select nullif(addtime('1970-09-05 00:00:00',1),addtime('1970-09-05 00:00:00',0));
+---------------------------------------------------------------------------+
| nullif(addtime('1970-09-05 00:00:00',1),addtime('1970-09-05 00:00:00',0)) |
+---------------------------------------------------------------------------+
| 1970-09-05 00:00:01                                                       |
+---------------------------------------------------------------------------+
select ifnull(null,addtime('1970-09-05 00:00:00','01:01:01')) as result;
+---------------------+
| result              |
+---------------------+
| 1970-09-05 01:01:01 |
+---------------------+
select coalesce(null,null,addtime('1970-09-05 00:00:00',1)) ;
+------------------------------------------------------+
| coalesce(null,null,addtime('1970-09-05 00:00:00',1)) |
+------------------------------------------------------+
| 1970-09-05 00:00:01                                  |
+------------------------------------------------------+
drop table t1;
create table t1(c1 int,c2 datetime);
insert into t1 values(1,'1970-09-05 00:00:00');
insert into t1 values(2,'1980-09-05 00:00:00');
insert into t1 values(3,'1990-09-05 00:00:00');
select case c2 when addtime('1970-09-05 00:00:00','0') then addtime('1970-09-05 00:00:00','100')
               else '2022-09-05 00:00:00'
end as c3
from t1;
+---------------------+
| c3                  |
+---------------------+
| 1970-09-05 00:01:00 |
| 2022-09-05 00:00:00 |
| 2022-09-05 00:00:00 |
+---------------------+
select case  when c2 < addtime('1980-09-05 00:00:00','100') then addtime('1970-09-05 00:00:00','0')
             else '2022-09-05 00:00:00'
end as c3
from t1;
+---------------------+
| c3                  |
+---------------------+
| 1970-09-05 00:00:00 |
| 1970-09-05 00:00:00 |
| 2022-09-05 00:00:00 |
+---------------------+
select if(addtime('1970-09-05 00:00:00','0') = '1970-09-05 00:00:00',1,0) as result;
+--------+
| result |
+--------+
|      1 |
+--------+
select if(addtime('1970-09-05 00:00:00','01:01:01') = '1970-09-05 00:00:00',1,0) as result;
+--------+
| result |
+--------+
|      0 |
+--------+
TIME-TC-3
不同数据数据类型
drop table t1;
create table t1(
c1 bigint DEFAULT NULL,
c2 float DEFAULT NULL,
c3 double DEFAULT NULL,
c4 date DEFAULT NULL,
c5 time DEFAULT NULL,
c6 year DEFAULT NULL,
c7 timestamp DEFAULT NULL,
c8 char(20) DEFAULT NULL,
c9 varchar(20) DEFAULT NULL,
c10 text DEFAULT NULL);
insert into t1(c1) values(addtime('1970-09-05 00:00:00',1));
ERROR 01000: Data truncated for column 'c1' at row 1
insert into t1(c2) values(addtime('1970-09-05 00:00:00',1));
ERROR 01000: Data truncated for column 'c2' at row 1
insert into t1(c3) values(addtime('1970-09-05 00:00:00',1));
ERROR 01000: Data truncated for column 'c3' at row 1
insert into t1(c4) values(addtime('1970-09-05 00:00:00',1));
insert into t1(c5) values(addtime('1970-09-05 00:00:00',1));
insert into t1(c6) values(addtime('1970-09-05 00:00:00',1));
ERROR 01000: Data truncated for column 'c6' at row 1
insert into t1(c7) values(addtime('1970-09-05 00:00:00',1));
insert into t1(c8) values(addtime('1970-09-05 00:00:00',1));
insert into t1(c9) values(addtime('1970-09-05 00:00:00',1));
insert into t1(c10) values(addtime('1970-09-05 00:00:00',1));
select * from t1;
+------+------+------+------------+----------+------+---------------------+---------------------+---------------------+---------------------+
| c1   | c2   | c3   | c4         | c5       | c6   | c7                  | c8                  | c9                  | c10                 |
+------+------+------+------------+----------+------+---------------------+---------------------+---------------------+---------------------+
| NULL | NULL | NULL | 1970-09-05 | NULL     | NULL | NULL                | NULL                | NULL                | NULL                |
| NULL | NULL | NULL | NULL       | 00:00:01 | NULL | NULL                | NULL                | NULL                | NULL                |
| NULL | NULL | NULL | NULL       | NULL     | NULL | 1970-09-05 00:00:01 | NULL                | NULL                | NULL                |
| NULL | NULL | NULL | NULL       | NULL     | NULL | NULL                | 1970-09-05 00:00:01 | NULL                | NULL                |
| NULL | NULL | NULL | NULL       | NULL     | NULL | NULL                | NULL                | 1970-09-05 00:00:01 | NULL                |
| NULL | NULL | NULL | NULL       | NULL     | NULL | NULL                | NULL                | NULL                | 1970-09-05 00:00:01 |
+------+------+------+------------+----------+------+---------------------+---------------------+---------------------+---------------------+
select addtime(c4,0) from t1;
+---------------------+
| addtime(c4,0)       |
+---------------------+
| 1970-09-05 00:00:00 |
| NULL                |
| NULL                |
| NULL                |
| NULL                |
| NULL                |
+---------------------+
select addtime(c5,0) from t1;
+---------------+
| addtime(c5,0) |
+---------------+
| NULL          |
| 00:00:01      |
| NULL          |
| NULL          |
| NULL          |
| NULL          |
+---------------+
select addtime(c7,0) from t1;
+---------------------+
| addtime(c7,0)       |
+---------------------+
| NULL                |
| NULL                |
| 1970-09-05 00:00:01 |
| NULL                |
| NULL                |
| NULL                |
+---------------------+
select addtime(c8,0) from t1;
+---------------------+
| addtime(c8,0)       |
+---------------------+
| NULL                |
| NULL                |
| NULL                |
| 1970-09-05 00:00:01 |
| NULL                |
| NULL                |
+---------------------+
select addtime(c9,0) from t1;
+---------------------+
| addtime(c9,0)       |
+---------------------+
| NULL                |
| NULL                |
| NULL                |
| NULL                |
| 1970-09-05 00:00:01 |
| NULL                |
+---------------------+
select addtime(c10,0) from t1;
+---------------------+
| addtime(c10,0)      |
+---------------------+
| NULL                |
| NULL                |
| NULL                |
| NULL                |
| NULL                |
| 1970-09-05 00:00:01 |
+---------------------+
TIME-TC-4
DML
drop table t1;
create table t1(c1 datetime);
insert into t1 values('2022-09-05 11:00:00');
insert into t1 values('2022-09-05 11:03:00');
insert into t1 values('2022-09-05 11:05:00');
select c1,addtime('2022-09-05 11:00:00',0) from t1;
+---------------------+----------------------------------+
| c1                  | addtime('2022-09-05 11:00:00',0) |
+---------------------+----------------------------------+
| 2022-09-05 11:00:00 | 2022-09-05 11:00:00              |
| 2022-09-05 11:03:00 | 2022-09-05 11:00:00              |
| 2022-09-05 11:05:00 | 2022-09-05 11:00:00              |
+---------------------+----------------------------------+
select addtime('2022-09-05 11:00:00',1) as result from dual order by 1;
+---------------------+
| result              |
+---------------------+
| 2022-09-05 11:00:01 |
+---------------------+
select addtime('2022-09-05 11:00:00',1) as result from dual group by 1;
+---------------------+
| result              |
+---------------------+
| 2022-09-05 11:00:01 |
+---------------------+
insert into t1 values(addtime('2022-09-05 12:00:00',0));
alter table t1 add c2 datetime default null;
insert into t1(c1,c2) values(addtime('2022-09-05 12:00:00',0),addtime('2023-09-05 12:00:00',0));
insert into t1(c1,c2) values(addtime('2022-09-05 13:00:00',0),addtime('2023-09-05 13:00:00',0)),
(addtime('2022-09-05 14:00:00',0),addtime('2023-09-05 14:00:00',0)),
(addtime('2022-09-05 15:00:00',0),addtime('2023-09-05 15:00:00',0));
update t1 set c1 = addtime('2022-09-05 11:00:00','0');
update t1 set
c1 = addtime('2022-09-06 11:00:00','0'),
c2 = addtime('2022-09-07 11:00:00','0');
delete from t1 where c2 = addtime('2022-09-07 11:00:00','0');
运算符
insert into t1(c1,c2) values(addtime('2022-09-05 13:00:00',0),addtime('2023-09-05 13:00:00',0)),
(addtime('2022-09-05 14:00:00',0),addtime('2023-09-05 14:00:00',0)),
(addtime('2022-09-05 15:00:00',0),addtime('2023-09-05 15:00:00',0));
select c1 from t1 where c1 = addtime('2022-09-05 13:00:00',0);
+---------------------+
| c1                  |
+---------------------+
| 2022-09-05 13:00:00 |
+---------------------+
select c1 from t1 where c1 < addtime('2022-09-05 14:00:00',0);
+---------------------+
| c1                  |
+---------------------+
| 2022-09-05 13:00:00 |
+---------------------+
select c1 from t1 where c1 <= addtime('2022-09-05 14:00:00',1);
+---------------------+
| c1                  |
+---------------------+
| 2022-09-05 13:00:00 |
| 2022-09-05 14:00:00 |
+---------------------+
select c1 from t1 where c1 > addtime('2022-09-05 14:00:00',1);
+---------------------+
| c1                  |
+---------------------+
| 2022-09-05 15:00:00 |
+---------------------+
select c1 from t1 where c1 >= addtime('2022-09-05 14:00:00',0);
+---------------------+
| c1                  |
+---------------------+
| 2022-09-05 14:00:00 |
| 2022-09-05 15:00:00 |
+---------------------+
select c1 from t1 where c1 != addtime('2022-09-05 15:00:00',0);
+---------------------+
| c1                  |
+---------------------+
| 2022-09-05 13:00:00 |
| 2022-09-05 14:00:00 |
+---------------------+
select c1 from t1 where c1 <> addtime('2022-09-05 15:00:00',1);
+---------------------+
| c1                  |
+---------------------+
| 2022-09-05 13:00:00 |
| 2022-09-05 14:00:00 |
| 2022-09-05 15:00:00 |
+---------------------+
select c1,c2 from t1 where c1 = addtime('2022-09-05 14:00:01',-1) and c2 = addtime('2023-09-05 13:59:59',1);
+---------------------+---------------------+
| c1                  | c2                  |
+---------------------+---------------------+
| 2022-09-05 14:00:00 | 2023-09-05 14:00:00 |
+---------------------+---------------------+
select c1,c2 from t1 where c1 = addtime('2022-09-05 14:00:01',-1) or c2 = addtime('2023-09-05 14:59:59',1);
+---------------------+---------------------+
| c1                  | c2                  |
+---------------------+---------------------+
| 2022-09-05 14:00:00 | 2023-09-05 14:00:00 |
| 2022-09-05 15:00:00 | 2023-09-05 15:00:00 |
+---------------------+---------------------+
select c1,c2 from t1 where not c1 = addtime('2022-09-05 14:00:01',-1);
+---------------------+---------------------+
| c1                  | c2                  |
+---------------------+---------------------+
| 2022-09-05 13:00:00 | 2023-09-05 13:00:00 |
| 2022-09-05 15:00:00 | 2023-09-05 15:00:00 |
+---------------------+---------------------+
select c1,c2 from t1 where c1 = addtime('2022-09-05 14:00:01',-1) and c2 is null;
+------+------+
| c1   | c2   |
+------+------+
+------+------+
select c1,c2 from t1 where c1 = addtime('2022-09-05 14:00:01',-1) and c2 is not null;
+---------------------+---------------------+
| c1                  | c2                  |
+---------------------+---------------------+
| 2022-09-05 14:00:00 | 2023-09-05 14:00:00 |
+---------------------+---------------------+
select c1,c2 from t1 where c1 in (addtime('2022-09-05 14:00:01',-1),addtime('2022-09-05 15:00:01',-1));
+---------------------+---------------------+
| c1                  | c2                  |
+---------------------+---------------------+
| 2022-09-05 14:00:00 | 2023-09-05 14:00:00 |
| 2022-09-05 15:00:00 | 2023-09-05 15:00:00 |
+---------------------+---------------------+
select c1,c2 from t1 where exists (select c1 from t1 where c1 = addtime('2022-09-05 13:00:00',0));
+---------------------+---------------------+
| c1                  | c2                  |
+---------------------+---------------------+
| 2022-09-05 13:00:00 | 2023-09-05 13:00:00 |
| 2022-09-05 14:00:00 | 2023-09-05 14:00:00 |
| 2022-09-05 15:00:00 | 2023-09-05 15:00:00 |
+---------------------+---------------------+
select c1,c2 from t1 where not exists (select c1 from t1 where c1 = addtime('2022-09-05 13:00:00',0));
+------+------+
| c1   | c2   |
+------+------+
+------+------+
select c1,c2 from t1 where c1 > any(select c1 from t1 where c1 > addtime('2022-09-05 13:00:00','-1'));
+---------------------+---------------------+
| c1                  | c2                  |
+---------------------+---------------------+
| 2022-09-05 14:00:00 | 2023-09-05 14:00:00 |
| 2022-09-05 15:00:00 | 2023-09-05 15:00:00 |
+---------------------+---------------------+
select c1,c2 from t1 where c1 < all(select c1 from t1 where c1 > addtime('2022-09-05 15:00:00','1'));
+---------------------+---------------------+
| c1                  | c2                  |
+---------------------+---------------------+
| 2022-09-05 13:00:00 | 2023-09-05 13:00:00 |
| 2022-09-05 14:00:00 | 2023-09-05 14:00:00 |
| 2022-09-05 15:00:00 | 2023-09-05 15:00:00 |
+---------------------+---------------------+
select c1,c2 from t1 where c1 between addtime('2022-09-05 13:00:00',1) and addtime('2022-09-05 15:00:00',-1);
+---------------------+---------------------+
| c1                  | c2                  |
+---------------------+---------------------+
| 2022-09-05 14:00:00 | 2023-09-05 14:00:00 |
+---------------------+---------------------+
TIME-TC-5
分区表
drop table t1;
CREATE TABLE t1(c1 DATETIME)
PARTITION BY RANGE(day(c1))
(
PARTITION p10 VALUES LESS THAN (10),
 PARTITION p20 VALUES LESS THAN (20),
 PARTITION pmax VALUES LESS THAN (maxvalue)
);
insert into t1 values(addtime('2022-09-01 00:00:00','1 01:01:01')),
(addtime('2022-09-05 00:00:00','-1 02:02:02')),
(addtime('2022-09-11 00:00:00','1 03:03:03')),
(addtime('2022-09-19 00:00:00','-1 04:04:04')),
(addtime('2022-09-25 00:00:00','1 05:05:05'));
update t1 set c1 = addtime('2022-09-01 00:00:00','22 01:01:01') where c1 = addtime('2022-09-01 00:00:00','1 01:01:01');
select * from t1 partition(pmax) where c1 = addtime('2022-09-25 00:00:00','1 05:05:05');
+---------------------+
| c1                  |
+---------------------+
| 2022-09-26 05:05:05 |
+---------------------+
drop table t1;
CREATE TABLE t1 (c1 INT, c2 varchar(20), c3 datetime) PARTITION BY RANGE(c1) 
SUBPARTITION BY KEY(c2, c3) SUBPARTITIONS 5
(PARTITION p0 VALUES LESS THAN(100), PARTITION p1 VALUES LESS THAN(10000000));
insert into t1(c1,c3) values(1,addtime('2022-09-01 00:00:00','1 01:01:01')),
(11,addtime('2022-09-05 00:00:00','-1 02:02:02')),
(111,addtime('2022-09-11 00:00:00','1 03:03:03')),
(1111,addtime('2022-09-19 00:00:00','-1 04:04:04')),
(11111,addtime('2022-09-25 00:00:00','1 05:05:05'));
select * from t1 partition (p0) order by 1;
+------+------+---------------------+
| c1   | c2   | c3                  |
+------+------+---------------------+
|    1 | NULL | 2022-09-02 01:01:01 |
|   11 | NULL | 2022-09-03 21:57:58 |
+------+------+---------------------+
select * from t1 partition (p1) order by 1;
+-------+------+---------------------+
| c1    | c2   | c3                  |
+-------+------+---------------------+
|   111 | NULL | 2022-09-12 03:03:03 |
|  1111 | NULL | 2022-09-17 19:55:56 |
| 11111 | NULL | 2022-09-26 05:05:05 |
+-------+------+---------------------+
update t1 set c2 = addtime(c3,'1 00:00:00') where c3 <= addtime('2022-09-10 00:00:00','100');
update t1 set c2 = addtime(c3,'-1 00:00:00') where c3 > addtime('2022-09-10 00:00:00','100');
delete from t1 where c2 = addtime('2022-09-11 00:00:00','03:03:03');
select *,addtime(sysdate(),0)from t1 order by 1;
视图
drop view v1;
create view v1 as select c1,c3 from t1;
select * from v1 order by 1;
+-------+---------------------+
| c1    | c3                  |
+-------+---------------------+
|     1 | 2022-09-02 01:01:01 |
|    11 | 2022-09-03 21:57:58 |
|  1111 | 2022-09-17 19:55:56 |
| 11111 | 2022-09-26 05:05:05 |
+-------+---------------------+
insert into v1 values(111,addtime('2022-11-11 00:00:00',0));
delete from t1 where c3 = addtime('2022-09-25 01:01:01','1 04:04:04');
update t1 set c3 = addtime('2022-09-01 00:00:00','25:00:00') where c3 = addtime('2022-09-02 00:00:00','01:01:01');
select * from v1 order by 1;
+------+---------------------+
| c1   | c3                  |
+------+---------------------+
|    1 | 2022-09-02 01:00:00 |
|   11 | 2022-09-03 21:57:58 |
|  111 | 2022-11-11 00:00:00 |
| 1111 | 2022-09-17 19:55:56 |
+------+---------------------+
复制表
drop table t1;
drop table t2;
create table t1 (c1 int ,c2 datetime);
insert into t1 values(1,'2022-09-05 00:00:00');
insert into t1 values(2,'2022-09-06 00:00:00');
select addtime(c2,'01:01:01') as time2 from t1;
+---------------------+
| time2               |
+---------------------+
| 2022-09-05 01:01:01 |
| 2022-09-06 01:01:01 |
+---------------------+
create table t2 as select addtime(c2,'01:01:01') from t1;
select * from t2;
+------------------------+
| addtime(c2,'01:01:01') |
+------------------------+
| 2022-09-05 01:01:01    |
| 2022-09-06 01:01:01    |
+------------------------+
生成列
drop table t1;
create table t1(c0 int,
c1 time,
c2 time as (2*c1)
);
insert into t1(c1) values(addtime('01:01:01','01:01:01'));
select * from t1;
+------+----------+----------+
| c0   | c1       | c2       |
+------+----------+----------+
| NULL | 02:02:02 | 04:04:04 |
+------+----------+----------+
drop table t1;
create table t1(c0 int,
c1 date,
c2 date as (2*c1)
);
insert into t1(c1) values(addtime(date '2022-01-01','01:01:01'));
select * from t1;
+------+------------+------------+
| c0   | c1         | c2         |
+------+------------+------------+
| NULL | 2022-01-01 | 4044-02-02 |
+------+------------+------------+
insert into t1(c1) values(addtime(date '5022-01-01','13:31:31'));
ERROR 22007: Incorrect datetime value for column 'c2' at row 1
insert into t1(c1) values(addtime(date '2022-01-01','13:31:31'));
insert into t1(c1) values(addtime(date '2022-07-16','13:31:31'));
ERROR 22007: Incorrect datetime value for column 'c2' at row 1
drop table t1;
create table t1(c0 int,
c1 datetime,
c2 datetime as (2*c1)
);
insert into t1(c1) values(addtime('2022-01-01 00:00:00','13:31:31'));
ERROR 22007: Incorrect datetime value for column 'c2' at row 1
insert into t1(c1) values(addtime('2022-01-01 00:00:00','11:11:11'));
select * from t1;
+------+---------------------+---------------------+
| c0   | c1                  | c2                  |
+------+---------------------+---------------------+
| NULL | 2022-01-01 11:11:11 | 4044-02-02 22:22:22 |
+------+---------------------+---------------------+
drop table t1;
create table t1(c0 int,
c1 varchar(20),
c2 varchar(20) as (2*c1)
);
insert into t1(c1) values(addtime('20220905000000',0));
ERROR 01000: Data truncated for column 'c2' at row 1
insert into t1(c1) values(addtime('20220505000000',0));
ERROR 01000: Data truncated for column 'c2' at row 1
select * from t1;
+------+------+------+
| c0   | c1   | c2   |
+------+------+------+
+------+------+------+
存储过程中的使用
drop procedure p1;
create procedure p1(in aa datetime)
 begin
  case 
  when aa < addtime('2022-09-05 00:00:00',0) then
    select '之前的时间' as result;
  when aa > addtime('2022-09-05 00:00:00',0) then
    select '以后的时间' as result;
  else
  select '就是现在' as result;
  end case;
 end /
call p1(addtime('2022-09-05 00:00:00',0);
ERROR 42000: You have an error in your SQL syntax; check the manual that corresponds to your OceanBase version for the right syntax to use near ')' at line 1
call p1('2022-09-05 00:00:00');
+--------------+
| result       |
+--------------+
| 就是现在     |
+--------------+
call p1('2022-09-04 00:00:00');
+-----------------+
| result          |
+-----------------+
| 之前的时间      |
+-----------------+
drop procedure p1;
create procedure p1(in aa datetime,out bb datetime)
 begin
  set bb = '2022-09-05 00:00:00';
  while aa > bb do
    set bb = addtime(bb,'1 00:00:00');
    end while;
  select bb;
 end /
call p1('2022-09-10 00:00:00',@bb);
+---------------------+
| bb                  |
+---------------------+
| 2022-09-10 00:00:00 |
+---------------------+
触发器
drop table t1;
create table t1(c1 datetime,c2 datetime);
drop table t2;
create table t2(c1 datetime,c2 datetime);
drop trigger trg_addtime;
create trigger trg_addtime
after insert on t1
for each row
insert into t2
values(addtime(new.c1,'01:00:00'),addtime(new.c2,'01:00:00'));
insert into t1 values(addtime('2022-09-10 00:00:00',0),addtime('2023-09-10 00:00:00',0));
select * from t1;
+---------------------+---------------------+
| c1                  | c2                  |
+---------------------+---------------------+
| 2022-09-10 00:00:00 | 2023-09-10 00:00:00 |
+---------------------+---------------------+
select * from t2;
+---------------------+---------------------+
| c1                  | c2                  |
+---------------------+---------------------+
| 2022-09-10 01:00:00 | 2023-09-10 01:00:00 |
+---------------------+---------------------+
自定义函数
drop function f1;
create function f1(aa datetime,bb time) returns varchar(20)
begin
	return addtime(aa,bb);
end;
/
select f1('2022-09-10 00:00:00','01:01:01');
+--------------------------------------+
| f1('2022-09-10 00:00:00','01:01:01') |
+--------------------------------------+
| 2022-09-10 01:01:01                  |
+--------------------------------------+
TIME-TC-6 
字符集
drop table t1;
create table t1(
c1 time default null,
c2 date default null,
c3 datetime default null,
c4 timestamp default null,
c5 varchar(20) default null) DEFAULT CHARSET = utf8;
insert into t1(c1) values(addtime(time '01:01:01','01:01:01'));
insert into t1(c2) values(addtime(date '2022-09-05','01:01:01'));
insert into t1(c3) values(addtime('2022-09-05 01:01:01','01:01:01'));
insert into t1(c4) values(addtime(timestamp '2022-09-05 01:01:01.000001','01:01:01.000001'));
insert into t1(c5) values(addtime('20220905010101','01:01:01'));
select * from t1;
+----------+------------+---------------------+---------------------+---------------------+
| c1       | c2         | c3                  | c4                  | c5                  |
+----------+------------+---------------------+---------------------+---------------------+
| 02:02:02 | NULL       | NULL                | NULL                | NULL                |
| NULL     | 2022-09-05 | NULL                | NULL                | NULL                |
| NULL     | NULL       | 2022-09-05 02:02:02 | NULL                | NULL                |
| NULL     | NULL       | NULL                | 2022-09-05 02:02:02 | NULL                |
| NULL     | NULL       | NULL                | NULL                | 2022-09-05 02:02:02 |
+----------+------------+---------------------+---------------------+---------------------+
update t1 set c1 = addtime('11:11:11','01:01:01');
update t1 set c2 = addtime('2022-09-05','01:01:01');
ERROR 22007: Incorrect datetime value for column 'c2' at row 1
update t1 set c2 = addtime(date '2022-09-05','25:00:00');
update t1 set c3 = addtime('2022-09-05 00:00:00','01:00:00');
update t1 set c4 = addtime(timestamp '2022-09-06 01:01:01.000001','01:01:01.000001');
update t1 set c5 = addtime('20220905020202','01:01:01');
select * from t1;
+----------+------------+---------------------+---------------------+---------------------+
| c1       | c2         | c3                  | c4                  | c5                  |
+----------+------------+---------------------+---------------------+---------------------+
| 12:12:12 | 2022-09-06 | 2022-09-05 01:00:00 | 2022-09-06 02:02:02 | 2022-09-05 03:03:03 |
| 12:12:12 | 2022-09-06 | 2022-09-05 01:00:00 | 2022-09-06 02:02:02 | 2022-09-05 03:03:03 |
| 12:12:12 | 2022-09-06 | 2022-09-05 01:00:00 | 2022-09-06 02:02:02 | 2022-09-05 03:03:03 |
| 12:12:12 | 2022-09-06 | 2022-09-05 01:00:00 | 2022-09-06 02:02:02 | 2022-09-05 03:03:03 |
| 12:12:12 | 2022-09-06 | 2022-09-05 01:00:00 | 2022-09-06 02:02:02 | 2022-09-05 03:03:03 |
+----------+------------+---------------------+---------------------+---------------------+
delete from t1 where c1 = addtime('11:11:11','01:01:01') and c2 = addtime(date '2022-09-05','25:00:00') limit 1;
delete from t1 where c1 = addtime('11:11:11','01:01:01') and c2 = cast(addtime(date '2022-09-05','25:00:00') as date) limit 1;
delete from t1 where c1 = addtime('11:11:11','01:01:01') and c2 = convert(addtime(date '2022-09-05','25:00:00'),date) limit 1;
delete from t1 where c1 = addtime('11:11:11','01:01:01') limit 1;
select *,addtime(now(),0) from t1;
drop table t1;
create table t1(
c1 time default null,
c2 date default null,
c3 datetime default null,
c4 timestamp default null,
c5 varchar(20) default null) DEFAULT CHARSET = gbk;
insert into t1(c1) values(addtime(time '01:01:01','01:01:01'));
insert into t1(c2) values(addtime(date '2022-09-05','01:01:01'));
insert into t1(c3) values(addtime('2022-09-05 01:01:01','01:01:01'));
insert into t1(c4) values(addtime(timestamp '2022-09-05 01:01:01.000001','01:01:01.000001'));
insert into t1(c5) values(addtime('20220905010101','01:01:01'));
select * from t1;
+----------+------------+---------------------+---------------------+---------------------+
| c1       | c2         | c3                  | c4                  | c5                  |
+----------+------------+---------------------+---------------------+---------------------+
| 02:02:02 | NULL       | NULL                | NULL                | NULL                |
| NULL     | 2022-09-05 | NULL                | NULL                | NULL                |
| NULL     | NULL       | 2022-09-05 02:02:02 | NULL                | NULL                |
| NULL     | NULL       | NULL                | 2022-09-05 02:02:02 | NULL                |
| NULL     | NULL       | NULL                | NULL                | 2022-09-05 02:02:02 |
+----------+------------+---------------------+---------------------+---------------------+
update t1 set c1 = addtime('11:11:11','01:01:01');
update t1 set c2 = addtime('2022-09-05','01:01:01');
ERROR 22007: Incorrect datetime value for column 'c2' at row 1
update t1 set c2 = addtime(date '2022-09-05','25:00:00');
update t1 set c3 = addtime('2022-09-05 00:00:00','01:00:00');
update t1 set c4 = addtime(timestamp '2022-09-06 01:01:01.000001','01:01:01.000001');
update t1 set c5 = addtime('20220905020202','01:01:01');
select * from t1;
+----------+------------+---------------------+---------------------+---------------------+
| c1       | c2         | c3                  | c4                  | c5                  |
+----------+------------+---------------------+---------------------+---------------------+
| 12:12:12 | 2022-09-06 | 2022-09-05 01:00:00 | 2022-09-06 02:02:02 | 2022-09-05 03:03:03 |
| 12:12:12 | 2022-09-06 | 2022-09-05 01:00:00 | 2022-09-06 02:02:02 | 2022-09-05 03:03:03 |
| 12:12:12 | 2022-09-06 | 2022-09-05 01:00:00 | 2022-09-06 02:02:02 | 2022-09-05 03:03:03 |
| 12:12:12 | 2022-09-06 | 2022-09-05 01:00:00 | 2022-09-06 02:02:02 | 2022-09-05 03:03:03 |
| 12:12:12 | 2022-09-06 | 2022-09-05 01:00:00 | 2022-09-06 02:02:02 | 2022-09-05 03:03:03 |
+----------+------------+---------------------+---------------------+---------------------+
delete from t1 where c1 = addtime('11:11:11','01:01:01') and c2 = addtime(date '2022-09-05','25:00:00') limit 1;
delete from t1 where c1 = addtime('11:11:11','01:01:01') and c2 = cast(addtime(date '2022-09-05','25:00:00') as date) limit 1;
delete from t1 where c1 = addtime('11:11:11','01:01:01') and c2 = convert(addtime(date '2022-09-05','25:00:00'),date) limit 1;
delete from t1 where c1 = addtime('11:11:11','01:01:01') limit 1;
select *,addtime(now(),0) from t1;
drop table t1;
create table t1(
c1 time default null,
c2 date default null,
c3 datetime default null,
c4 timestamp default null,
c5 varchar(20) default null) DEFAULT CHARSET = gb18030;
insert into t1(c1) values(addtime(time '01:01:01','01:01:01'));
insert into t1(c2) values(addtime(date '2022-09-05','01:01:01'));
insert into t1(c3) values(addtime('2022-09-05 01:01:01','01:01:01'));
insert into t1(c4) values(addtime(timestamp '2022-09-05 01:01:01.000001','01:01:01.000001'));
insert into t1(c5) values(addtime('20220905010101','01:01:01'));
select * from t1;
+----------+------------+---------------------+---------------------+---------------------+
| c1       | c2         | c3                  | c4                  | c5                  |
+----------+------------+---------------------+---------------------+---------------------+
| 02:02:02 | NULL       | NULL                | NULL                | NULL                |
| NULL     | 2022-09-05 | NULL                | NULL                | NULL                |
| NULL     | NULL       | 2022-09-05 02:02:02 | NULL                | NULL                |
| NULL     | NULL       | NULL                | 2022-09-05 02:02:02 | NULL                |
| NULL     | NULL       | NULL                | NULL                | 2022-09-05 02:02:02 |
+----------+------------+---------------------+---------------------+---------------------+
update t1 set c1 = addtime('11:11:11','01:01:01');
update t1 set c2 = addtime('2022-09-05','01:01:01');
ERROR 22007: Incorrect datetime value for column 'c2' at row 1
update t1 set c2 = addtime(date '2022-09-05','25:00:00');
update t1 set c3 = addtime('2022-09-05 00:00:00','01:00:00');
update t1 set c4 = addtime(timestamp '2022-09-06 01:01:01.000001','01:01:01.000001');
update t1 set c5 = addtime('20220905020202','01:01:01');
select * from t1;
+----------+------------+---------------------+---------------------+---------------------+
| c1       | c2         | c3                  | c4                  | c5                  |
+----------+------------+---------------------+---------------------+---------------------+
| 12:12:12 | 2022-09-06 | 2022-09-05 01:00:00 | 2022-09-06 02:02:02 | 2022-09-05 03:03:03 |
| 12:12:12 | 2022-09-06 | 2022-09-05 01:00:00 | 2022-09-06 02:02:02 | 2022-09-05 03:03:03 |
| 12:12:12 | 2022-09-06 | 2022-09-05 01:00:00 | 2022-09-06 02:02:02 | 2022-09-05 03:03:03 |
| 12:12:12 | 2022-09-06 | 2022-09-05 01:00:00 | 2022-09-06 02:02:02 | 2022-09-05 03:03:03 |
| 12:12:12 | 2022-09-06 | 2022-09-05 01:00:00 | 2022-09-06 02:02:02 | 2022-09-05 03:03:03 |
+----------+------------+---------------------+---------------------+---------------------+
delete from t1 where c1 = addtime('11:11:11','01:01:01') and c2 = addtime(date '2022-09-05','25:00:00') limit 1;
delete from t1 where c1 = addtime('11:11:11','01:01:01') and c2 = cast(addtime(date '2022-09-05','25:00:00') as date) limit 1;
delete from t1 where c1 = addtime('11:11:11','01:01:01') and c2 = convert(addtime(date '2022-09-05','25:00:00'),date) limit 1;
delete from t1 where c1 = addtime('11:11:11','01:01:01') limit 1;
select *,addtime(now(),0) from t1;
drop table t1;
create table t1(
c1 time default null,
c2 date default null,
c3 datetime default null,
c4 timestamp default null,
c5 varchar(20) default null) DEFAULT CHARSET = utf8mb4;
insert into t1(c1) values(addtime(time '01:01:01','01:01:01'));
insert into t1(c2) values(addtime(date '2022-09-05','01:01:01'));
insert into t1(c3) values(addtime('2022-09-05 01:01:01','01:01:01'));
insert into t1(c4) values(addtime(timestamp '2022-09-05 01:01:01.000001','01:01:01.000001'));
insert into t1(c5) values(addtime('20220905010101','01:01:01'));
select * from t1;
+----------+------------+---------------------+---------------------+---------------------+
| c1       | c2         | c3                  | c4                  | c5                  |
+----------+------------+---------------------+---------------------+---------------------+
| 02:02:02 | NULL       | NULL                | NULL                | NULL                |
| NULL     | 2022-09-05 | NULL                | NULL                | NULL                |
| NULL     | NULL       | 2022-09-05 02:02:02 | NULL                | NULL                |
| NULL     | NULL       | NULL                | 2022-09-05 02:02:02 | NULL                |
| NULL     | NULL       | NULL                | NULL                | 2022-09-05 02:02:02 |
+----------+------------+---------------------+---------------------+---------------------+
update t1 set c1 = addtime('11:11:11','01:01:01');
update t1 set c2 = addtime('2022-09-05','01:01:01');
ERROR 22007: Incorrect datetime value for column 'c2' at row 1
update t1 set c2 = addtime(date '2022-09-05','25:00:00');
update t1 set c3 = addtime('2022-09-05 00:00:00','01:00:00');
update t1 set c4 = addtime(timestamp '2022-09-06 01:01:01.000001','01:01:01.000001');
update t1 set c5 = addtime('20220905020202','01:01:01');
select * from t1;
+----------+------------+---------------------+---------------------+---------------------+
| c1       | c2         | c3                  | c4                  | c5                  |
+----------+------------+---------------------+---------------------+---------------------+
| 12:12:12 | 2022-09-06 | 2022-09-05 01:00:00 | 2022-09-06 02:02:02 | 2022-09-05 03:03:03 |
| 12:12:12 | 2022-09-06 | 2022-09-05 01:00:00 | 2022-09-06 02:02:02 | 2022-09-05 03:03:03 |
| 12:12:12 | 2022-09-06 | 2022-09-05 01:00:00 | 2022-09-06 02:02:02 | 2022-09-05 03:03:03 |
| 12:12:12 | 2022-09-06 | 2022-09-05 01:00:00 | 2022-09-06 02:02:02 | 2022-09-05 03:03:03 |
| 12:12:12 | 2022-09-06 | 2022-09-05 01:00:00 | 2022-09-06 02:02:02 | 2022-09-05 03:03:03 |
+----------+------------+---------------------+---------------------+---------------------+
delete from t1 where c1 = addtime('11:11:11','01:01:01') and c2 = addtime(date '2022-09-05','25:00:00') limit 1;
delete from t1 where c1 = addtime('11:11:11','01:01:01') and c2 = cast(addtime(date '2022-09-05','25:00:00') as date) limit 1;
delete from t1 where c1 = addtime('11:11:11','01:01:01') and c2 = convert(addtime(date '2022-09-05','25:00:00'),date) limit 1;
delete from t1 where c1 = addtime('11:11:11','01:01:01') limit 1;
select *,addtime(now(),0) from t1;
PURGE RECYCLEBIN;
