# 环境清理
purge recyclebin;
result_format: 4
explain_protocol: 0
TIME-TC-1
expr1->time
select subtime(time '11:00:00',1);
+----------------------------+
| subtime(time '11:00:00',1) |
+----------------------------+
| 10:59:59                   |
+----------------------------+
select subtime(time '11:00:00',0);
+----------------------------+
| subtime(time '11:00:00',0) |
+----------------------------+
| 11:00:00                   |
+----------------------------+
select subtime('11:00:00',1);
+-----------------------+
| subtime('11:00:00',1) |
+-----------------------+
| 10:59:59              |
+-----------------------+
select subtime('11:00:00',0);
+-----------------------+
| subtime('11:00:00',0) |
+-----------------------+
| 11:00:00              |
+-----------------------+
select subtime(time '11:00:00',null);
+-------------------------------+
| subtime(time '11:00:00',null) |
+-------------------------------+
| NULL                          |
+-------------------------------+
select subtime(time '11:00:00','');
+-----------------------------+
| subtime(time '11:00:00','') |
+-----------------------------+
| NULL                        |
+-----------------------------+
select subtime(time '11:00:00','1:1');
+--------------------------------+
| subtime(time '11:00:00','1:1') |
+--------------------------------+
| 09:59:00                       |
+--------------------------------+
select subtime(time '11:00:00','0:1:1');
+----------------------------------+
| subtime(time '11:00:00','0:1:1') |
+----------------------------------+
| 10:58:59                         |
+----------------------------------+
select subtime('23:59:59', '-1') ;
+---------------------------+
| subtime('23:59:59', '-1') |
+---------------------------+
| 24:00:00                  |
+---------------------------+
select subtime('23:59:59', '-1:0:2');
+-------------------------------+
| subtime('23:59:59', '-1:0:2') |
+-------------------------------+
| 25:00:01                      |
+-------------------------------+
select subtime('11:00:00',59);
+------------------------+
| subtime('11:00:00',59) |
+------------------------+
| 10:59:01               |
+------------------------+
select subtime(time'11:00:00',60);
+----------------------------+
| subtime(time'11:00:00',60) |
+----------------------------+
| NULL                       |
+----------------------------+
select subtime(time'11:00:00',59);
+----------------------------+
| subtime(time'11:00:00',59) |
+----------------------------+
| 10:59:01                   |
+----------------------------+
select subtime('11:00:00',60);
+------------------------+
| subtime('11:00:00',60) |
+------------------------+
| NULL                   |
+------------------------+
select subtime(time '11:00:00',100);
+------------------------------+
| subtime(time '11:00:00',100) |
+------------------------------+
| 10:59:00                     |
+------------------------------+
select subtime(time '11:00:00',110);
+------------------------------+
| subtime(time '11:00:00',110) |
+------------------------------+
| 10:58:50                     |
+------------------------------+
select subtime(time '11:00:00',160);
+------------------------------+
| subtime(time '11:00:00',160) |
+------------------------------+
| NULL                         |
+------------------------------+
select subtime(time '11:00:00',200);
+------------------------------+
| subtime(time '11:00:00',200) |
+------------------------------+
| 10:58:00                     |
+------------------------------+
select subtime('11:00:00',259);
+-------------------------+
| subtime('11:00:00',259) |
+-------------------------+
| 10:57:01                |
+-------------------------+
select subtime('11:00:00',6000);
+--------------------------+
| subtime('11:00:00',6000) |
+--------------------------+
| NULL                     |
+--------------------------+
select subtime('11:00:00',0.000001);
+------------------------------+
| subtime('11:00:00',0.000001) |
+------------------------------+
| 10:59:59.999999              |
+------------------------------+
select subtime('11:00:00',-0.000001);
+-------------------------------+
| subtime('11:00:00',-0.000001) |
+-------------------------------+
| 11:00:00.000001               |
+-------------------------------+
select subtime('11:00:00',-61);
+-------------------------+
| subtime('11:00:00',-61) |
+-------------------------+
| NULL                    |
+-------------------------+
select subtime('11:00:00',-100);
+--------------------------+
| subtime('11:00:00',-100) |
+--------------------------+
| 11:01:00                 |
+--------------------------+
时间最大最小值验证   expr1和expr2的最大最小值为'±838:59:59'
select subtime('400:59:59','-400:59:59');
+-----------------------------------+
| subtime('400:59:59','-400:59:59') |
+-----------------------------------+
| 801:59:58                         |
+-----------------------------------+
select subtime('838:59:59','0');
+--------------------------+
| subtime('838:59:59','0') |
+--------------------------+
| 838:59:59                |
+--------------------------+
select subtime('839:00:00','0');
+--------------------------+
| subtime('839:00:00','0') |
+--------------------------+
| 838:59:59                |
+--------------------------+
select subtime('0','838:59:59');
+--------------------------+
| subtime('0','838:59:59') |
+--------------------------+
| -838:59:59               |
+--------------------------+
select subtime('0','839:00:00');
+--------------------------+
| subtime('0','839:00:00') |
+--------------------------+
| -838:59:59               |
+--------------------------+
select subtime('500:59:59','-499:00:00');
+-----------------------------------+
| subtime('500:59:59','-499:00:00') |
+-----------------------------------+
| 838:59:59                         |
+-----------------------------------+
select subtime('500:59:59','-499:00:01');
+-----------------------------------+
| subtime('500:59:59','-499:00:01') |
+-----------------------------------+
| 838:59:59                         |
+-----------------------------------+
select subtime('838:59:59','-838:59:59');
+-----------------------------------+
| subtime('838:59:59','-838:59:59') |
+-----------------------------------+
| 838:59:59                         |
+-----------------------------------+
select subtime('839:59:59','-839:59:59');
+-----------------------------------+
| subtime('839:59:59','-839:59:59') |
+-----------------------------------+
| 838:59:59                         |
+-----------------------------------+
select subtime('1839:59:59','-1839:59:59');
+-------------------------------------+
| subtime('1839:59:59','-1839:59:59') |
+-------------------------------------+
| 838:59:59                           |
+-------------------------------------+
select subtime('-400:59:59','400:59:59');
+-----------------------------------+
| subtime('-400:59:59','400:59:59') |
+-----------------------------------+
| -801:59:58                        |
+-----------------------------------+
select subtime('-838:59:59','0');
+---------------------------+
| subtime('-838:59:59','0') |
+---------------------------+
| -838:59:59                |
+---------------------------+
select subtime('-839:00:00','0');
+---------------------------+
| subtime('-839:00:00','0') |
+---------------------------+
| -838:59:59                |
+---------------------------+
select subtime('0','-838:59:59');
+---------------------------+
| subtime('0','-838:59:59') |
+---------------------------+
| 838:59:59                 |
+---------------------------+
select subtime('0','-839:00:00');
+---------------------------+
| subtime('0','-839:00:00') |
+---------------------------+
| 838:59:59                 |
+---------------------------+
select subtime('-500:59:59','499:00:00');
+-----------------------------------+
| subtime('-500:59:59','499:00:00') |
+-----------------------------------+
| -838:59:59                        |
+-----------------------------------+
select subtime('-500:59:59','499:00:01');
+-----------------------------------+
| subtime('-500:59:59','499:00:01') |
+-----------------------------------+
| -838:59:59                        |
+-----------------------------------+
select subtime('-838:59:59','838:59:59');
+-----------------------------------+
| subtime('-838:59:59','838:59:59') |
+-----------------------------------+
| -838:59:59                        |
+-----------------------------------+
select subtime('-839:59:59','839:59:59');
+-----------------------------------+
| subtime('-839:59:59','839:59:59') |
+-----------------------------------+
| -838:59:59                        |
+-----------------------------------+
expr1->date
select subtime(date'2007-12-31', '1') ;
+--------------------------------+
| subtime(date'2007-12-31', '1') |
+--------------------------------+
| 2007-12-30 23:59:59            |
+--------------------------------+
select subtime(date'2007-12-31', '1 01:01:01') ;
+-----------------------------------------+
| subtime(date'2007-12-31', '1 01:01:01') |
+-----------------------------------------+
| 2007-12-29 22:58:59                     |
+-----------------------------------------+
select subtime(date'2007-12-31', null) ;
+---------------------------------+
| subtime(date'2007-12-31', null) |
+---------------------------------+
| NULL                            |
+---------------------------------+
select subtime(date'2007-12-31', '') ;
+-------------------------------+
| subtime(date'2007-12-31', '') |
+-------------------------------+
| NULL                          |
+-------------------------------+
select subtime('2007-12-31', '1') ;
+----------------------------+
| subtime('2007-12-31', '1') |
+----------------------------+
| 00:20:06                   |
+----------------------------+
select subtime('2007-12-31', '01:01:01') ;
+-----------------------------------+
| subtime('2007-12-31', '01:01:01') |
+-----------------------------------+
| -00:40:54                         |
+-----------------------------------+
select subtime('2007-12-31', null) ;
+-----------------------------+
| subtime('2007-12-31', null) |
+-----------------------------+
| NULL                        |
+-----------------------------+
select subtime('2007-12-31', '') ;
+---------------------------+
| subtime('2007-12-31', '') |
+---------------------------+
| NULL                      |
+---------------------------+
select subtime(date '2008-01-01', '34 00:00:00') ;
+-------------------------------------------+
| subtime(date '2008-01-01', '34 00:00:00') |
+-------------------------------------------+
| 2007-11-28 00:00:00                       |
+-------------------------------------------+
超过第二个参数的最大值'±34 22:59:59'
select subtime(date '2008-01-01', '35 00:00:00') ;
+-------------------------------------------+
| subtime(date '2008-01-01', '35 00:00:00') |
+-------------------------------------------+
| 2007-11-27 01:00:01                       |
+-------------------------------------------+
select subtime(date '2008-01-01', '34 22:59:59') ;
+-------------------------------------------+
| subtime(date '2008-01-01', '34 22:59:59') |
+-------------------------------------------+
| 2007-11-27 01:00:01                       |
+-------------------------------------------+
select subtime(date '2008-06-01', '-34 22:59:59') ;
+--------------------------------------------+
| subtime(date '2008-06-01', '-34 22:59:59') |
+--------------------------------------------+
| 2008-07-05 22:59:59                        |
+--------------------------------------------+
select subtime(date '2008-06-01', '-34 23:00:00') ;
+--------------------------------------------+
| subtime(date '2008-06-01', '-34 23:00:00') |
+--------------------------------------------+
| 2008-07-05 22:59:59                        |
+--------------------------------------------+
expr1->year
select subtime('2007', '0') ;
+----------------------+
| subtime('2007', '0') |
+----------------------+
| 00:20:07             |
+----------------------+
select subtime('2007', '100') ;
+------------------------+
| subtime('2007', '100') |
+------------------------+
| 00:19:07               |
+------------------------+
select subtime('2007', 'null') ;
+-------------------------+
| subtime('2007', 'null') |
+-------------------------+
| 00:20:07                |
+-------------------------+
select subtime('2007', '') ;
+---------------------+
| subtime('2007', '') |
+---------------------+
| NULL                |
+---------------------+
expr1->timedate
select subtime(datetime '2007-12-31 23:59:59', '-01:01:01') ;
ERROR 42000: Incorrect parameters in the call to native function 'subtime'
select subtime(datetime'2007-02-28 23:59:59', '-1') ;
ERROR 42000: Incorrect parameters in the call to native function 'subtime'
select subtime(datetime'2007-03-01 00:00:00', '-1') ;
ERROR 42000: Incorrect parameters in the call to native function 'subtime'
select subtime(datetime '2022-10-30 23:58:59','0:1:1');
ERROR 42000: Incorrect parameters in the call to native function 'subtime'
select subtime('2007-12-31 23:59:59', '1') ;
+-------------------------------------+
| subtime('2007-12-31 23:59:59', '1') |
+-------------------------------------+
| 2007-12-31 23:59:58                 |
+-------------------------------------+
select subtime('2007-02-28 23:59:59', '1') ;
+-------------------------------------+
| subtime('2007-02-28 23:59:59', '1') |
+-------------------------------------+
| 2007-02-28 23:59:58                 |
+-------------------------------------+
select subtime('2007-03-01 00:00:00', '-1') ;
+--------------------------------------+
| subtime('2007-03-01 00:00:00', '-1') |
+--------------------------------------+
| 2007-03-01 00:00:01                  |
+--------------------------------------+
select subtime('2007-12-31 23:59:59', '1 1:1:1.000001') ;
+--------------------------------------------------+
| subtime('2007-12-31 23:59:59', '1 1:1:1.000001') |
+--------------------------------------------------+
| 2007-12-30 22:58:57.999999                       |
+--------------------------------------------------+
select subtime('2007-12-31 23:59:59', '1 1:1:1.000002') ;
+--------------------------------------------------+
| subtime('2007-12-31 23:59:59', '1 1:1:1.000002') |
+--------------------------------------------------+
| 2007-12-30 22:58:57.999998                       |
+--------------------------------------------------+
select subtime('2021-4-20 11:00:00', 61) ;
+-----------------------------------+
| subtime('2021-4-20 11:00:00', 61) |
+-----------------------------------+
| NULL                              |
+-----------------------------------+
select subtime('2021-4-20 11:00:00', 100.000001) ;
+-------------------------------------------+
| subtime('2021-4-20 11:00:00', 100.000001) |
+-------------------------------------------+
| 2021-04-20 10:58:59.999999                |
+-------------------------------------------+
select subtime('2021-4-20 11:00:00', null) ;
+-------------------------------------+
| subtime('2021-4-20 11:00:00', null) |
+-------------------------------------+
| NULL                                |
+-------------------------------------+
select subtime('2021-4-20 11:00:00', '') ;
+-----------------------------------+
| subtime('2021-4-20 11:00:00', '') |
+-----------------------------------+
| NULL                              |
+-----------------------------------+
expr1->timestamp
select subtime(timestamp '2008-01-01 00:00:00.999999', '1:1:1.000001') ;
+-----------------------------------------------------------------+
| subtime(timestamp '2008-01-01 00:00:00.999999', '1:1:1.000001') |
+-----------------------------------------------------------------+
| 2007-12-31 22:58:59.999998                                      |
+-----------------------------------------------------------------+
select subtime('2007-12-01 23:59:59.999999', '1 1:1:1.000002') ;
+---------------------------------------------------------+
| subtime('2007-12-01 23:59:59.999999', '1 1:1:1.000002') |
+---------------------------------------------------------+
| 2007-11-30 22:58:58.999997                              |
+---------------------------------------------------------+
select subtime('2007-12-31 23:59:59.999999', null) ;
+---------------------------------------------+
| subtime('2007-12-31 23:59:59.999999', null) |
+---------------------------------------------+
| NULL                                        |
+---------------------------------------------+
select subtime('2007-12-31 23:59:59.999999', '') ;
+-------------------------------------------+
| subtime('2007-12-31 23:59:59.999999', '') |
+-------------------------------------------+
| NULL                                      |
+-------------------------------------------+
SELECT subtime('2020-10-31 23:59:59','0:1:1'),subtime('10:30:59','5:10:37') ;
+----------------------------------------+-------------------------------+
| subtime('2020-10-31 23:59:59','0:1:1') | subtime('10:30:59','5:10:37') |
+----------------------------------------+-------------------------------+
| 2020-10-31 23:58:58                    | 05:20:22                      |
+----------------------------------------+-------------------------------+
select subtime(null,'01:00:00') ;
+--------------------------+
| subtime(null,'01:00:00') |
+--------------------------+
| NULL                     |
+--------------------------+
select subtime('','01:00:00') ;
+------------------------+
| subtime('','01:00:00') |
+------------------------+
| NULL                   |
+------------------------+
expr1->varchar
select subtime('20220905',0);
+-----------------------+
| subtime('20220905',0) |
+-----------------------+
| 838:59:59             |
+-----------------------+
select subtime('20220905000000',0);
+-----------------------------+
| subtime('20220905000000',0) |
+-----------------------------+
| 2022-09-05 00:00:00         |
+-----------------------------+
select subtime(20220905000000,0);
+---------------------------+
| subtime(20220905000000,0) |
+---------------------------+
| 2022-09-05 00:00:00       |
+---------------------------+
select subtime(202209050000000,0);
+----------------------------+
| subtime(202209050000000,0) |
+----------------------------+
| NULL                       |
+----------------------------+
select subtime(0,0);
+--------------+
| subtime(0,0) |
+--------------+
| 00:00:00     |
+--------------+
参数1时间格式不对
select subtime('1970-00-00 00:00:00.000000','0.000001') ;
+--------------------------------------------------+
| subtime('1970-00-00 00:00:00.000000','0.000001') |
+--------------------------------------------------+
| 1969-12-30 23:59:59.999999                       |
+--------------------------------------------------+
select subtime('1970-01-00 00:00:00.000000','0.000001') ;
+--------------------------------------------------+
| subtime('1970-01-00 00:00:00.000000','0.000001') |
+--------------------------------------------------+
| 1969-12-30 23:59:59.999999                       |
+--------------------------------------------------+
select subtime('1970-00-01 00:00:00.000000','0.000001') ;
+--------------------------------------------------+
| subtime('1970-00-01 00:00:00.000000','0.000001') |
+--------------------------------------------------+
| 1969-12-30 23:59:59.999999                       |
+--------------------------------------------------+
select subtime('-0000-01-01 00:00:00.000000','0.000001') ;
+---------------------------------------------------+
| subtime('-0000-01-01 00:00:00.000000','0.000001') |
+---------------------------------------------------+
| -00:00:00.000001                                  |
+---------------------------------------------------+
参数2为日期表达式
select subtime('2008-01-01 00:00:00', '01-01 1:1:1.000001') ;
+------------------------------------------------------+
| subtime('2008-01-01 00:00:00', '01-01 1:1:1.000001') |
+------------------------------------------------------+
| 2007-12-31 23:59:59                                  |
+------------------------------------------------------+
select subtime('2008-01-01 00:00:00', '02-02-02') ;
+--------------------------------------------+
| subtime('2008-01-01 00:00:00', '02-02-02') |
+--------------------------------------------+
| 2007-12-31 23:59:58                        |
+--------------------------------------------+
参数2为布尔
select subtime('2008-01-01 00:00:00', true) ;
+--------------------------------------+
| subtime('2008-01-01 00:00:00', true) |
+--------------------------------------+
| 2007-12-31 23:59:59                  |
+--------------------------------------+
select subtime('2008-01-01 00:00:00', false) ;
+---------------------------------------+
| subtime('2008-01-01 00:00:00', false) |
+---------------------------------------+
| 2008-01-01 00:00:00                   |
+---------------------------------------+
缺少参数
select subtime('2022-09-05 11:00:00') ;
ERROR 42000: Incorrect parameter count in the call to native function 'subtime'
select subtime('01:01:01') ;
ERROR 42000: Incorrect parameter count in the call to native function 'subtime'
select subtime();
ERROR 42000: Incorrect parameter count in the call to native function 'subtime'
参数多余
select subtime('1970-00-00 00:00:00.000000','0.000001',true);
ERROR 42000: Incorrect parameter count in the call to native function 'subtime'
TIME-TC-2
函数嵌套
select cast(subtime('1970-09-05 00:00:00',0) as char(20)) ;
+----------------------------------------------------+
| cast(subtime('1970-09-05 00:00:00',0) as char(20)) |
+----------------------------------------------------+
| 1970-09-05 00:00:00                                |
+----------------------------------------------------+
select convert(subtime('1970-09-05 00:00:00',0),char(20)) ;
+----------------------------------------------------+
| convert(subtime('1970-09-05 00:00:00',0),char(20)) |
+----------------------------------------------------+
| 1970-09-05 00:00:00                                |
+----------------------------------------------------+
select subtime('2022-09-05 11:00:00',second('2017-05-15 10:37:14.123456')) as result ;
+---------------------+
| result              |
+---------------------+
| 2022-09-05 10:59:46 |
+---------------------+
select subtime('2022-09-05 11:00:00',extract(second from '2017-05-15 10:37:14.123456')) as result ;
+---------------------+
| result              |
+---------------------+
| 2022-09-05 10:59:46 |
+---------------------+
select subtime(now(),'01:00:00') ;
select subtime(curdate(),'01:00:00') ;
select subtime(curtime(),'01:00:00') ;
select subtime(curtime(),'100') ;
select subtime(subtime('2007-12-31 23:59:59.999999', 1), 1) ;
+------------------------------------------------------+
| subtime(subtime('2007-12-31 23:59:59.999999', 1), 1) |
+------------------------------------------------------+
| 2007-12-31 23:59:57.999999                           |
+------------------------------------------------------+
select subtime(current_timestamp(),100) as result ;
select subtime(localtime(),100) as result ;
select subtime(localtime,100) as result ;
select subtime(localtimestamp(),100) as result ;
select subtime(localtimestamp,100) as result ;
select subtime(sysdate(),100) as result ;
select subtime(TIMESTAMP('2017-05-15'), 1) as result ;
+----------------------------+
| result                     |
+----------------------------+
| 2017-05-14 23:59:59.000000 |
+----------------------------+
select subtime('2022-09-05 11:00:00',interval 1 day);
ERROR 42000: You have an error in your SQL syntax; check the manual that corresponds to your OceanBase version for the right syntax to use near ')' at line 1
select subtime(date_add('2022-09-05 11:00:00',interval 1 year), 1) as result ;
+---------------------+
| result              |
+---------------------+
| 2023-09-05 10:59:59 |
+---------------------+
select subtime(date_sub('2022-09-05 11:00:00',interval 1 year), 1) as result ;
+---------------------+
| result              |
+---------------------+
| 2021-09-05 10:59:59 |
+---------------------+
select subtime(adddate('2022-09-05',interval '1' day),100) as result;
+----------+
| result   |
+----------+
| 00:19:22 |
+----------+
select subtime(adddate(DATE '2022-09-05',interval '1' day),100) as result;
+---------------------+
| result              |
+---------------------+
| 2022-09-05 23:59:00 |
+---------------------+
select subtime(convert_tz('2022-01-01 12:00:00','+00:00','+10:00'),'100') as result;
+----------------------------+
| result                     |
+----------------------------+
| 2022-01-01 21:59:00.000000 |
+----------------------------+
select subtime('2022-09-05 11:00:00',datediff('2022-01-22 23:59:59','2022-1-21')) as result;
+---------------------+
| result              |
+---------------------+
| 2022-09-05 10:59:59 |
+---------------------+
select dayofmonth(subtime('2007-12-31 23:59:59.999999', 1)) as result;
+--------+
| result |
+--------+
|     31 |
+--------+
select dayname(subtime('2007-12-31 23:59:59.999999', 1)) as result;
+--------+
| result |
+--------+
| Monday |
+--------+
select dayofweek(subtime('2007-12-31 23:59:59.999999', 1)) as result;
+--------+
| result |
+--------+
|      2 |
+--------+
select dayofyear(subtime('2007-12-31 23:59:59.999999', 1)) as result;
+--------+
| result |
+--------+
|    365 |
+--------+
select subtime(from_unixtime('1647738565','%Y %M %D %h:%i:%s'),0);
+------------------------------------------------------------+
| subtime(from_unixtime('1647738565','%Y %M %D %h:%i:%s'),0) |
+------------------------------------------------------------+
| 00:20:22                                                   |
+------------------------------------------------------------+
select last_day(subtime('2022-09-05 11:00:00',000)) as result;
+------------+
| result     |
+------------+
| 2022-09-30 |
+------------+
select subtime(makedate(2022,1),100) as result;
+---------------------+
| result              |
+---------------------+
| 2021-12-31 23:59:00 |
+---------------------+
select subtime(maketime(11,11,11),200) as result;
+-----------------+
| result          |
+-----------------+
| 11:09:11.000000 |
+-----------------+
select subtime('2022-09-05 11:00:00',time('2022-09-05 11:00:00')) as result;
+---------------------+
| result              |
+---------------------+
| 2022-09-05 00:00:00 |
+---------------------+
select subtime(date_add(current_timestamp(),interval 1 year), 1) as result ;
select subtime(date_sub(current_timestamp(),interval 1 year), 1) as result ;
select concat('datetime:',subtime('1970-09-05 00:00:00',0)) ;
+------------------------------------------------------+
| concat('datetime:',subtime('1970-09-05 00:00:00',0)) |
+------------------------------------------------------+
| datetime:1970-09-05 00:00:00                         |
+------------------------------------------------------+
select nullif(subtime('1970-09-05 00:00:00',1),subtime('1970-09-05 00:00:00',1));
+---------------------------------------------------------------------------+
| nullif(subtime('1970-09-05 00:00:00',1),subtime('1970-09-05 00:00:00',1)) |
+---------------------------------------------------------------------------+
| NULL                                                                      |
+---------------------------------------------------------------------------+
select nullif(subtime('1970-09-05 00:00:00',1),subtime('1970-09-05 00:00:00',0));
+---------------------------------------------------------------------------+
| nullif(subtime('1970-09-05 00:00:00',1),subtime('1970-09-05 00:00:00',0)) |
+---------------------------------------------------------------------------+
| 1970-09-04 23:59:59                                                       |
+---------------------------------------------------------------------------+
select ifnull(null,subtime('1970-09-05 00:00:00','01:01:01')) as result;
+---------------------+
| result              |
+---------------------+
| 1970-09-04 22:58:59 |
+---------------------+
select coalesce(null,null,subtime('1970-09-05 00:00:00',1)) ;
+------------------------------------------------------+
| coalesce(null,null,subtime('1970-09-05 00:00:00',1)) |
+------------------------------------------------------+
| 1970-09-04 23:59:59                                  |
+------------------------------------------------------+
drop table t1;
create table t1(c1 int,c2 datetime);
insert into t1 values(1,'1970-09-05 00:00:00');
insert into t1 values(2,'1980-09-05 00:00:00');
insert into t1 values(3,'1990-09-05 00:00:00');
select case c2 when subtime('1970-09-05 00:00:00','0') then subtime('1970-09-05 00:00:00','100')
               else '2022-09-05 00:00:00'
end as c3
from t1;
+---------------------+
| c3                  |
+---------------------+
| 1970-09-04 23:59:00 |
| 2022-09-05 00:00:00 |
| 2022-09-05 00:00:00 |
+---------------------+
select case  when c2 < subtime('1980-09-05 00:00:00','100') then subtime('1970-09-05 00:00:00','0')
             else '2022-09-05 00:00:00'
end as c3
from t1;
+---------------------+
| c3                  |
+---------------------+
| 1970-09-05 00:00:00 |
| 2022-09-05 00:00:00 |
| 2022-09-05 00:00:00 |
+---------------------+
select if(subtime('1970-09-05 00:00:00','0') = '1970-09-05 00:00:00',1,0) as result;
+--------+
| result |
+--------+
|      1 |
+--------+
select if(subtime('1970-09-05 00:00:00','01:01:01') = '1970-09-05 00:00:00',1,0) as result;
+--------+
| result |
+--------+
|      0 |
+--------+
TIME-TC-3
不同数据数据类型
drop table t1;
create table t1(
c1 bigint DEFAULT NULL,
c2 float DEFAULT NULL,
c3 double DEFAULT NULL,
c4 date DEFAULT NULL,
c5 time DEFAULT NULL,
c6 year DEFAULT NULL,
c7 timestamp DEFAULT NULL,
c8 char(20) DEFAULT NULL,
c9 varchar(20) DEFAULT NULL,
c10 text DEFAULT NULL);
insert into t1(c1) values(subtime('1970-09-05 00:00:00',1));
ERROR 01000: Data truncated for column 'c1' at row 1
insert into t1(c2) values(subtime('1970-09-05 00:00:00',1));
ERROR 01000: Data truncated for column 'c2' at row 1
insert into t1(c3) values(subtime('1970-09-05 00:00:00',1));
ERROR 01000: Data truncated for column 'c3' at row 1
insert into t1(c4) values(subtime('1970-09-05 00:00:00',1));
insert into t1(c5) values(subtime('1970-09-05 00:00:00',1));
insert into t1(c6) values(subtime('1970-09-05 00:00:00',1));
ERROR 01000: Data truncated for column 'c6' at row 1
insert into t1(c7) values(subtime('1970-09-05 00:00:00',1));
insert into t1(c8) values(subtime('1970-09-05 00:00:00',1));
insert into t1(c9) values(subtime('1970-09-05 00:00:00',1));
insert into t1(c10) values(subtime('1970-09-05 00:00:00',1));
select * from t1;
+------+------+------+------------+----------+------+---------------------+---------------------+---------------------+---------------------+
| c1   | c2   | c3   | c4         | c5       | c6   | c7                  | c8                  | c9                  | c10                 |
+------+------+------+------------+----------+------+---------------------+---------------------+---------------------+---------------------+
| NULL | NULL | NULL | 1970-09-04 | NULL     | NULL | NULL                | NULL                | NULL                | NULL                |
| NULL | NULL | NULL | NULL       | 23:59:59 | NULL | NULL                | NULL                | NULL                | NULL                |
| NULL | NULL | NULL | NULL       | NULL     | NULL | 1970-09-04 23:59:59 | NULL                | NULL                | NULL                |
| NULL | NULL | NULL | NULL       | NULL     | NULL | NULL                | 1970-09-04 23:59:59 | NULL                | NULL                |
| NULL | NULL | NULL | NULL       | NULL     | NULL | NULL                | NULL                | 1970-09-04 23:59:59 | NULL                |
| NULL | NULL | NULL | NULL       | NULL     | NULL | NULL                | NULL                | NULL                | 1970-09-04 23:59:59 |
+------+------+------+------------+----------+------+---------------------+---------------------+---------------------+---------------------+
select subtime(c4,0) from t1;
+---------------------+
| subtime(c4,0)       |
+---------------------+
| 1970-09-04 00:00:00 |
| NULL                |
| NULL                |
| NULL                |
| NULL                |
| NULL                |
+---------------------+
select subtime(c5,0) from t1;
+---------------+
| subtime(c5,0) |
+---------------+
| NULL          |
| 23:59:59      |
| NULL          |
| NULL          |
| NULL          |
| NULL          |
+---------------+
select subtime(c7,0) from t1;
+---------------------+
| subtime(c7,0)       |
+---------------------+
| NULL                |
| NULL                |
| 1970-09-04 23:59:59 |
| NULL                |
| NULL                |
| NULL                |
+---------------------+
select subtime(c8,0) from t1;
+---------------------+
| subtime(c8,0)       |
+---------------------+
| NULL                |
| NULL                |
| NULL                |
| 1970-09-04 23:59:59 |
| NULL                |
| NULL                |
+---------------------+
select subtime(c9,0) from t1;
+---------------------+
| subtime(c9,0)       |
+---------------------+
| NULL                |
| NULL                |
| NULL                |
| NULL                |
| 1970-09-04 23:59:59 |
| NULL                |
+---------------------+
select subtime(c10,0) from t1;
+---------------------+
| subtime(c10,0)      |
+---------------------+
| NULL                |
| NULL                |
| NULL                |
| NULL                |
| NULL                |
| 1970-09-04 23:59:59 |
+---------------------+
TIME-TC-4
DML
drop table t1;
create table t1(c1 datetime);
insert into t1 values('2022-09-05 11:00:00');
insert into t1 values('2022-09-05 11:03:00');
insert into t1 values('2022-09-05 11:05:00');
select c1,subtime('2022-09-05 11:00:00',0) from t1;
+---------------------+----------------------------------+
| c1                  | subtime('2022-09-05 11:00:00',0) |
+---------------------+----------------------------------+
| 2022-09-05 11:00:00 | 2022-09-05 11:00:00              |
| 2022-09-05 11:03:00 | 2022-09-05 11:00:00              |
| 2022-09-05 11:05:00 | 2022-09-05 11:00:00              |
+---------------------+----------------------------------+
select subtime('2022-09-05 11:00:00',1) as result from dual order by 1;
+---------------------+
| result              |
+---------------------+
| 2022-09-05 10:59:59 |
+---------------------+
select subtime('2022-09-05 11:00:00',1) as result from dual group by 1;
+---------------------+
| result              |
+---------------------+
| 2022-09-05 10:59:59 |
+---------------------+
insert into t1 values(subtime('2022-09-05 12:00:00',0));
alter table t1 add c2 datetime default null;
insert into t1(c1,c2) values(subtime('2022-09-05 12:00:00',0),subtime('2023-09-05 12:00:00',0));
insert into t1(c1,c2) values(subtime('2022-09-05 13:00:00',0),subtime('2023-09-05 13:00:00',0)),
(subtime('2022-09-05 14:00:00',0),subtime('2023-09-05 14:00:00',0)),
(subtime('2022-09-05 15:00:00',0),subtime('2023-09-05 15:00:00',0));
update t1 set c1 = subtime('2022-09-05 11:00:00','0');
update t1 set
c1 = subtime('2022-09-06 11:00:00','0'),
c2 = subtime('2022-09-07 11:00:00','0');
delete from t1 where c2 = subtime('2022-09-07 11:00:00','0');
运算符
insert into t1(c1,c2) values(subtime('2022-09-05 13:00:00',0),subtime('2023-09-05 13:00:00',0)),
(subtime('2022-09-05 14:00:00',0),subtime('2023-09-05 14:00:00',0)),
(subtime('2022-09-05 15:00:00',0),subtime('2023-09-05 15:00:00',0));
select c1 from t1 where c1 = subtime('2022-09-05 13:00:00',0);
+---------------------+
| c1                  |
+---------------------+
| 2022-09-05 13:00:00 |
+---------------------+
select c1 from t1 where c1 < subtime('2022-09-05 14:00:00',0);
+---------------------+
| c1                  |
+---------------------+
| 2022-09-05 13:00:00 |
+---------------------+
select c1 from t1 where c1 <= subtime('2022-09-05 14:00:00',1);
+---------------------+
| c1                  |
+---------------------+
| 2022-09-05 13:00:00 |
+---------------------+
select c1 from t1 where c1 > subtime('2022-09-05 14:00:00',1);
+---------------------+
| c1                  |
+---------------------+
| 2022-09-05 14:00:00 |
| 2022-09-05 15:00:00 |
+---------------------+
select c1 from t1 where c1 >= subtime('2022-09-05 14:00:00',0);
+---------------------+
| c1                  |
+---------------------+
| 2022-09-05 14:00:00 |
| 2022-09-05 15:00:00 |
+---------------------+
select c1 from t1 where c1 != subtime('2022-09-05 15:00:00',0);
+---------------------+
| c1                  |
+---------------------+
| 2022-09-05 13:00:00 |
| 2022-09-05 14:00:00 |
+---------------------+
select c1 from t1 where c1 <> subtime('2022-09-05 15:00:00',1);
+---------------------+
| c1                  |
+---------------------+
| 2022-09-05 13:00:00 |
| 2022-09-05 14:00:00 |
| 2022-09-05 15:00:00 |
+---------------------+
select c1,c2 from t1 where c1 = subtime('2022-09-05 14:00:01',-1) and c2 = subtime('2023-09-05 13:59:59',1);
+------+------+
| c1   | c2   |
+------+------+
+------+------+
select c1,c2 from t1 where c1 = subtime('2022-09-05 14:00:01',-1) or c2 = subtime('2023-09-05 14:59:59',1);
+------+------+
| c1   | c2   |
+------+------+
+------+------+
select c1,c2 from t1 where not c1 = subtime('2022-09-05 14:00:01',-1);
+---------------------+---------------------+
| c1                  | c2                  |
+---------------------+---------------------+
| 2022-09-05 13:00:00 | 2023-09-05 13:00:00 |
| 2022-09-05 14:00:00 | 2023-09-05 14:00:00 |
| 2022-09-05 15:00:00 | 2023-09-05 15:00:00 |
+---------------------+---------------------+
select c1,c2 from t1 where c1 = subtime('2022-09-05 14:00:01',-1) and c2 is null;
+------+------+
| c1   | c2   |
+------+------+
+------+------+
select c1,c2 from t1 where c1 = subtime('2022-09-05 14:00:01',-1) and c2 is not null;
+------+------+
| c1   | c2   |
+------+------+
+------+------+
select c1,c2 from t1 where c1 in (subtime('2022-09-05 14:00:01',-1),subtime('2022-09-05 15:00:01',-1));
+------+------+
| c1   | c2   |
+------+------+
+------+------+
select c1,c2 from t1 where exists (select c1 from t1 where c1 = subtime('2022-09-05 13:00:00',0));
+---------------------+---------------------+
| c1                  | c2                  |
+---------------------+---------------------+
| 2022-09-05 13:00:00 | 2023-09-05 13:00:00 |
| 2022-09-05 14:00:00 | 2023-09-05 14:00:00 |
| 2022-09-05 15:00:00 | 2023-09-05 15:00:00 |
+---------------------+---------------------+
select c1,c2 from t1 where not exists (select c1 from t1 where c1 = subtime('2022-09-05 13:00:00',0));
+------+------+
| c1   | c2   |
+------+------+
+------+------+
select c1,c2 from t1 where c1 > any(select c1 from t1 where c1 > subtime('2022-09-05 13:00:00','-1'));
+---------------------+---------------------+
| c1                  | c2                  |
+---------------------+---------------------+
| 2022-09-05 15:00:00 | 2023-09-05 15:00:00 |
+---------------------+---------------------+
select c1,c2 from t1 where c1 < all(select c1 from t1 where c1 > subtime('2022-09-05 15:00:00','1'));
+---------------------+---------------------+
| c1                  | c2                  |
+---------------------+---------------------+
| 2022-09-05 13:00:00 | 2023-09-05 13:00:00 |
| 2022-09-05 14:00:00 | 2023-09-05 14:00:00 |
+---------------------+---------------------+
select c1,c2 from t1 where c1 between subtime('2022-09-05 13:00:00',1) and subtime('2022-09-05 15:00:00',-1);
+---------------------+---------------------+
| c1                  | c2                  |
+---------------------+---------------------+
| 2022-09-05 13:00:00 | 2023-09-05 13:00:00 |
| 2022-09-05 14:00:00 | 2023-09-05 14:00:00 |
| 2022-09-05 15:00:00 | 2023-09-05 15:00:00 |
+---------------------+---------------------+
TIME-TC-5
分区表
drop table t1;
CREATE TABLE t1(c1 DATETIME)
PARTITION BY RANGE(day(c1))
(
PARTITION p10 VALUES LESS THAN (10),
 PARTITION p20 VALUES LESS THAN (20),
 PARTITION pmax VALUES LESS THAN (maxvalue)
);
insert into t1 values(subtime('2022-09-01 00:00:00','1 01:01:01')),
(subtime('2022-09-05 00:00:00','-1 02:02:02')),
(subtime('2022-09-11 00:00:00','1 03:03:03')),
(subtime('2022-09-19 00:00:00','-1 04:04:04')),
(subtime('2022-09-25 00:00:00','1 05:05:05'));
update t1 set c1 = subtime('2022-09-01 00:00:00','22 01:01:01') where c1 = subtime('2022-09-01 00:00:00','1 01:01:01');
select * from t1 partition(pmax) where c1 = subtime('2022-09-25 00:00:00','1 05:05:05');
+---------------------+
| c1                  |
+---------------------+
| 2022-09-23 18:54:55 |
+---------------------+
drop table t1;
CREATE TABLE t1 (c1 INT, c2 varchar(20), c3 datetime) PARTITION BY RANGE(c1) 
SUBPARTITION BY KEY(c2, c3) SUBPARTITIONS 5
(PARTITION p0 VALUES LESS THAN(100), PARTITION p1 VALUES LESS THAN(10000000));
insert into t1(c1,c3) values(1,subtime('2022-09-01 00:00:00','1 01:01:01')),
(11,subtime('2022-09-05 00:00:00','-1 02:02:02')),
(111,subtime('2022-09-11 00:00:00','1 03:03:03')),
(1111,subtime('2022-09-19 00:00:00','-1 04:04:04')),
(11111,subtime('2022-09-25 00:00:00','1 05:05:05'));
select * from t1 partition (p0) order by 1;
+------+------+---------------------+
| c1   | c2   | c3                  |
+------+------+---------------------+
|    1 | NULL | 2022-08-30 22:58:59 |
|   11 | NULL | 2022-09-06 02:02:02 |
+------+------+---------------------+
select * from t1 partition (p1) order by 1;
+-------+------+---------------------+
| c1    | c2   | c3                  |
+-------+------+---------------------+
|   111 | NULL | 2022-09-09 20:56:57 |
|  1111 | NULL | 2022-09-20 04:04:04 |
| 11111 | NULL | 2022-09-23 18:54:55 |
+-------+------+---------------------+
update t1 set c2 = subtime(c3,'1 00:00:00') where c3 <= subtime('2022-09-10 00:00:00','100');
update t1 set c2 = subtime(c3,'-1 00:00:00') where c3 > subtime('2022-09-10 00:00:00','100');
delete from t1 where c2 = subtime('2022-09-11 00:00:00','03:03:03');
select *,subtime(sysdate(),0)from t1 order by 1;
视图
drop view v1;
create view v1 as select c1,c3 from t1;
select * from v1 order by 1;
+-------+---------------------+
| c1    | c3                  |
+-------+---------------------+
|     1 | 2022-08-30 22:58:59 |
|    11 | 2022-09-06 02:02:02 |
|   111 | 2022-09-09 20:56:57 |
|  1111 | 2022-09-20 04:04:04 |
| 11111 | 2022-09-23 18:54:55 |
+-------+---------------------+
insert into v1 values(111,subtime('2022-11-11 00:00:00',0));
delete from t1 where c3 = subtime('2022-09-25 01:01:01','1 04:04:04');
update t1 set c3 = subtime('2022-09-01 00:00:00','25:00:00') where c3 = subtime('2022-09-02 00:00:00','01:01:01');
select * from v1 order by 1;
+-------+---------------------+
| c1    | c3                  |
+-------+---------------------+
|     1 | 2022-08-30 22:58:59 |
|    11 | 2022-09-06 02:02:02 |
|   111 | 2022-09-09 20:56:57 |
|   111 | 2022-11-11 00:00:00 |
|  1111 | 2022-09-20 04:04:04 |
| 11111 | 2022-09-23 18:54:55 |
+-------+---------------------+
复制表
drop table t1;
drop table t2;
create table t1 (c1 int ,c2 datetime);
insert into t1 values(1,'2022-09-05 00:00:00');
insert into t1 values(2,'2022-09-06 00:00:00');
select subtime(c2,'01:01:01') as time2 from t1;
+---------------------+
| time2               |
+---------------------+
| 2022-09-04 22:58:59 |
| 2022-09-05 22:58:59 |
+---------------------+
create table t2 as select subtime(c2,'01:01:01') from t1;
select * from t2;
+------------------------+
| subtime(c2,'01:01:01') |
+------------------------+
| 2022-09-04 22:58:59    |
| 2022-09-05 22:58:59    |
+------------------------+
生成列
drop table t1;
create table t1(c0 int,
c1 time,
c2 time as (2*c1)
);
insert into t1(c1) values(subtime('01:01:01','01:01:01'));
select * from t1;
+------+----------+----------+
| c0   | c1       | c2       |
+------+----------+----------+
| NULL | 00:00:00 | 00:00:00 |
+------+----------+----------+
drop table t1;
create table t1(c0 int,
c1 date,
c2 date as (2*c1)
);
insert into t1(c1) values(subtime(date '2022-01-01','01:01:01'));
ERROR 22007: Incorrect datetime value for column 'c2' at row 1
insert into t1(c1) values(subtime(date '2022-01-01','0'));
drop table t1;
create table t1(c0 int,
c1 datetime,
c2 datetime as (2*c1)
);
insert into t1(c1) values(subtime('2022-01-01 00:00:00','13:31:31'));
ERROR 22007: Incorrect datetime value for column 'c2' at row 1
insert into t1(c1) values(subtime('2022-01-01 00:00:00','11:11:11'));
ERROR 22007: Incorrect datetime value for column 'c2' at row 1
select * from t1;
+------+------+------+
| c0   | c1   | c2   |
+------+------+------+
+------+------+------+
drop table t1;
create table t1(c0 int,
c1 varchar(20),
c2 varchar(20) as (2*c1)
);
insert into t1(c1) values(subtime('20220905000000',0));
ERROR 01000: Data truncated for column 'c2' at row 1
insert into t1(c1) values(subtime('20220505000000',0));
ERROR 01000: Data truncated for column 'c2' at row 1
select * from t1;
+------+------+------+
| c0   | c1   | c2   |
+------+------+------+
+------+------+------+
存储过程中的使用
drop procedure p1;
create procedure p1(in aa datetime)
 begin
  case 
  when aa < subtime('2022-09-05 00:00:00',0) then
    select '之前的时间' as result;
  when aa > subtime('2022-09-05 00:00:00',0) then
    select '以后的时间' as result;
  else
  select '就是现在' as result;
  end case;
 end /
call p1(subtime('2022-09-05 00:00:00',0);
ERROR 42000: You have an error in your SQL syntax; check the manual that corresponds to your OceanBase version for the right syntax to use near ')' at line 1
call p1('2022-09-05 00:00:00');
+--------------+
| result       |
+--------------+
| 就是现在     |
+--------------+
call p1('2022-09-04 00:00:00');
+-----------------+
| result          |
+-----------------+
| 之前的时间      |
+-----------------+
drop procedure p1;
create procedure p1(in aa datetime,out bb datetime)
 begin
  set bb = '2022-09-05 00:00:00';
  while aa > bb do
    set bb = subtime(bb,'1 00:00:00');
    end while;
  select bb;
 end /
call p1('2022-09-10 00:00:00',@bb);
+------+
| bb   |
+------+
| NULL |
+------+
触发器
drop table t1;
create table t1(c1 datetime,c2 datetime);
drop table t2;
create table t2(c1 datetime,c2 datetime);
drop trigger trg_subtime;
create trigger trg_subtime
after insert on t1
for each row
insert into t2
values(subtime(new.c1,'01:00:00'),subtime(new.c2,'01:00:00'));
insert into t1 values(subtime('2022-09-10 00:00:00',0),subtime('2023-09-10 00:00:00',0));
select * from t1;
+---------------------+---------------------+
| c1                  | c2                  |
+---------------------+---------------------+
| 2022-09-10 00:00:00 | 2023-09-10 00:00:00 |
+---------------------+---------------------+
select * from t2;
+---------------------+---------------------+
| c1                  | c2                  |
+---------------------+---------------------+
| 2022-09-09 23:00:00 | 2023-09-09 23:00:00 |
+---------------------+---------------------+
自定义函数
drop function f1;
create function f1(aa datetime,bb time) returns varchar(20)
begin
	return subtime(aa,bb);
end;
/
select f1('2022-09-10 00:00:00','01:01:01');
+--------------------------------------+
| f1('2022-09-10 00:00:00','01:01:01') |
+--------------------------------------+
| 2022-09-09 22:58:59                  |
+--------------------------------------+
TIME-TC-6 
字符集
drop table t1;
create table t1(
c1 time default null,
c2 date default null,
c3 datetime default null,
c4 timestamp default null,
c5 varchar(20) default null) DEFAULT CHARSET = utf8;
insert into t1(c1) values(subtime(time '01:01:01','01:01:01'));
insert into t1(c2) values(subtime(date '2022-09-05','01:01:01'));
insert into t1(c3) values(subtime('2022-09-05 01:01:01','01:01:01'));
insert into t1(c4) values(subtime(timestamp '2022-09-05 01:01:01.000001','01:01:01.000001'));
insert into t1(c5) values(subtime('20220905010101','01:01:01'));
select * from t1;
+----------+------------+---------------------+---------------------+---------------------+
| c1       | c2         | c3                  | c4                  | c5                  |
+----------+------------+---------------------+---------------------+---------------------+
| 00:00:00 | NULL       | NULL                | NULL                | NULL                |
| NULL     | 2022-09-04 | NULL                | NULL                | NULL                |
| NULL     | NULL       | 2022-09-05 00:00:00 | NULL                | NULL                |
| NULL     | NULL       | NULL                | 2022-09-05 00:00:00 | NULL                |
| NULL     | NULL       | NULL                | NULL                | 2022-09-05 00:00:00 |
+----------+------------+---------------------+---------------------+---------------------+
update t1 set c1 = subtime('11:11:11','01:01:01');
update t1 set c2 = subtime('2022-09-05','01:01:01');
ERROR 22007: Incorrect datetime value for column 'c2' at row 1
update t1 set c2 = subtime(date '2022-09-05','25:00:00');
update t1 set c3 = subtime('2022-09-05 00:00:00','01:00:00');
update t1 set c4 = subtime(timestamp '2022-09-06 01:01:01.000001','01:01:01.000001');
update t1 set c5 = subtime('20220905020202','01:01:01');
select * from t1;
+----------+------------+---------------------+---------------------+---------------------+
| c1       | c2         | c3                  | c4                  | c5                  |
+----------+------------+---------------------+---------------------+---------------------+
| 10:10:10 | 2022-09-03 | 2022-09-04 23:00:00 | 2022-09-06 00:00:00 | 2022-09-05 01:01:01 |
| 10:10:10 | 2022-09-03 | 2022-09-04 23:00:00 | 2022-09-06 00:00:00 | 2022-09-05 01:01:01 |
| 10:10:10 | 2022-09-03 | 2022-09-04 23:00:00 | 2022-09-06 00:00:00 | 2022-09-05 01:01:01 |
| 10:10:10 | 2022-09-03 | 2022-09-04 23:00:00 | 2022-09-06 00:00:00 | 2022-09-05 01:01:01 |
| 10:10:10 | 2022-09-03 | 2022-09-04 23:00:00 | 2022-09-06 00:00:00 | 2022-09-05 01:01:01 |
+----------+------------+---------------------+---------------------+---------------------+
delete from t1 where c1 = subtime('11:11:11','01:01:01') and c2 = subtime(date '2022-09-05','25:00:00') limit 1;
delete from t1 where c1 = subtime('11:11:11','01:01:01') and c2 = cast(subtime(date '2022-09-05','25:00:00') as date) limit 1;
delete from t1 where c1 = subtime('11:11:11','01:01:01') and c2 = convert(subtime(date '2022-09-05','25:00:00'),date) limit 1;
delete from t1 where c1 = subtime('11:11:11','01:01:01') limit 1;
select *,subtime(now(),0) from t1;
drop table t1;
create table t1(
c1 time default null,
c2 date default null,
c3 datetime default null,
c4 timestamp default null,
c5 varchar(20) default null) DEFAULT CHARSET = gbk;
insert into t1(c1) values(subtime(time '01:01:01','01:01:01'));
insert into t1(c2) values(subtime(date '2022-09-05','01:01:01'));
insert into t1(c3) values(subtime('2022-09-05 01:01:01','01:01:01'));
insert into t1(c4) values(subtime(timestamp '2022-09-05 01:01:01.000001','01:01:01.000001'));
insert into t1(c5) values(subtime('20220905010101','01:01:01'));
select * from t1;
+----------+------------+---------------------+---------------------+---------------------+
| c1       | c2         | c3                  | c4                  | c5                  |
+----------+------------+---------------------+---------------------+---------------------+
| 00:00:00 | NULL       | NULL                | NULL                | NULL                |
| NULL     | 2022-09-04 | NULL                | NULL                | NULL                |
| NULL     | NULL       | 2022-09-05 00:00:00 | NULL                | NULL                |
| NULL     | NULL       | NULL                | 2022-09-05 00:00:00 | NULL                |
| NULL     | NULL       | NULL                | NULL                | 2022-09-05 00:00:00 |
+----------+------------+---------------------+---------------------+---------------------+
update t1 set c1 = subtime('11:11:11','01:01:01');
update t1 set c2 = subtime('2022-09-05','01:01:01');
ERROR 22007: Incorrect datetime value for column 'c2' at row 1
update t1 set c2 = subtime(date '2022-09-05','25:00:00');
update t1 set c3 = subtime('2022-09-05 00:00:00','01:00:00');
update t1 set c4 = subtime(timestamp '2022-09-06 01:01:01.000001','01:01:01.000001');
update t1 set c5 = subtime('20220905020202','01:01:01');
select * from t1;
+----------+------------+---------------------+---------------------+---------------------+
| c1       | c2         | c3                  | c4                  | c5                  |
+----------+------------+---------------------+---------------------+---------------------+
| 10:10:10 | 2022-09-03 | 2022-09-04 23:00:00 | 2022-09-06 00:00:00 | 2022-09-05 01:01:01 |
| 10:10:10 | 2022-09-03 | 2022-09-04 23:00:00 | 2022-09-06 00:00:00 | 2022-09-05 01:01:01 |
| 10:10:10 | 2022-09-03 | 2022-09-04 23:00:00 | 2022-09-06 00:00:00 | 2022-09-05 01:01:01 |
| 10:10:10 | 2022-09-03 | 2022-09-04 23:00:00 | 2022-09-06 00:00:00 | 2022-09-05 01:01:01 |
| 10:10:10 | 2022-09-03 | 2022-09-04 23:00:00 | 2022-09-06 00:00:00 | 2022-09-05 01:01:01 |
+----------+------------+---------------------+---------------------+---------------------+
delete from t1 where c1 = subtime('11:11:11','01:01:01') and c2 = subtime(date '2022-09-05','25:00:00') limit 1;
delete from t1 where c1 = subtime('11:11:11','01:01:01') and c2 = cast(subtime(date '2022-09-05','25:00:00') as date) limit 1;
delete from t1 where c1 = subtime('11:11:11','01:01:01') and c2 = convert(subtime(date '2022-09-05','25:00:00'),date) limit 1;
delete from t1 where c1 = subtime('11:11:11','01:01:01') limit 1;
select *,subtime(now(),0) from t1;
drop table t1;
create table t1(
c1 time default null,
c2 date default null,
c3 datetime default null,
c4 timestamp default null,
c5 varchar(20) default null) DEFAULT CHARSET = gb18030;
insert into t1(c1) values(subtime(time '01:01:01','01:01:01'));
insert into t1(c2) values(subtime(date '2022-09-05','01:01:01'));
insert into t1(c3) values(subtime('2022-09-05 01:01:01','01:01:01'));
insert into t1(c4) values(subtime(timestamp '2022-09-05 01:01:01.000001','01:01:01.000001'));
insert into t1(c5) values(subtime('20220905010101','01:01:01'));
select * from t1;
+----------+------------+---------------------+---------------------+---------------------+
| c1       | c2         | c3                  | c4                  | c5                  |
+----------+------------+---------------------+---------------------+---------------------+
| 00:00:00 | NULL       | NULL                | NULL                | NULL                |
| NULL     | 2022-09-04 | NULL                | NULL                | NULL                |
| NULL     | NULL       | 2022-09-05 00:00:00 | NULL                | NULL                |
| NULL     | NULL       | NULL                | 2022-09-05 00:00:00 | NULL                |
| NULL     | NULL       | NULL                | NULL                | 2022-09-05 00:00:00 |
+----------+------------+---------------------+---------------------+---------------------+
update t1 set c1 = subtime('11:11:11','01:01:01');
update t1 set c2 = subtime('2022-09-05','01:01:01');
ERROR 22007: Incorrect datetime value for column 'c2' at row 1
update t1 set c2 = subtime(date '2022-09-05','25:00:00');
update t1 set c3 = subtime('2022-09-05 00:00:00','01:00:00');
update t1 set c4 = subtime(timestamp '2022-09-06 01:01:01.000001','01:01:01.000001');
update t1 set c5 = subtime('20220905020202','01:01:01');
select * from t1;
+----------+------------+---------------------+---------------------+---------------------+
| c1       | c2         | c3                  | c4                  | c5                  |
+----------+------------+---------------------+---------------------+---------------------+
| 10:10:10 | 2022-09-03 | 2022-09-04 23:00:00 | 2022-09-06 00:00:00 | 2022-09-05 01:01:01 |
| 10:10:10 | 2022-09-03 | 2022-09-04 23:00:00 | 2022-09-06 00:00:00 | 2022-09-05 01:01:01 |
| 10:10:10 | 2022-09-03 | 2022-09-04 23:00:00 | 2022-09-06 00:00:00 | 2022-09-05 01:01:01 |
| 10:10:10 | 2022-09-03 | 2022-09-04 23:00:00 | 2022-09-06 00:00:00 | 2022-09-05 01:01:01 |
| 10:10:10 | 2022-09-03 | 2022-09-04 23:00:00 | 2022-09-06 00:00:00 | 2022-09-05 01:01:01 |
+----------+------------+---------------------+---------------------+---------------------+
delete from t1 where c1 = subtime('11:11:11','01:01:01') and c2 = subtime(date '2022-09-05','25:00:00') limit 1;
delete from t1 where c1 = subtime('11:11:11','01:01:01') and c2 = cast(subtime(date '2022-09-05','25:00:00') as date) limit 1;
delete from t1 where c1 = subtime('11:11:11','01:01:01') and c2 = convert(subtime(date '2022-09-05','25:00:00'),date) limit 1;
delete from t1 where c1 = subtime('11:11:11','01:01:01') limit 1;
select *,subtime(now(),0) from t1;
drop table t1;
create table t1(
c1 time default null,
c2 date default null,
c3 datetime default null,
c4 timestamp default null,
c5 varchar(20) default null) DEFAULT CHARSET = utf8mb4;
insert into t1(c1) values(subtime(time '01:01:01','01:01:01'));
insert into t1(c2) values(subtime(date '2022-09-05','01:01:01'));
insert into t1(c3) values(subtime('2022-09-05 01:01:01','01:01:01'));
insert into t1(c4) values(subtime(timestamp '2022-09-05 01:01:01.000001','01:01:01.000001'));
insert into t1(c5) values(subtime('20220905010101','01:01:01'));
select * from t1;
+----------+------------+---------------------+---------------------+---------------------+
| c1       | c2         | c3                  | c4                  | c5                  |
+----------+------------+---------------------+---------------------+---------------------+
| 00:00:00 | NULL       | NULL                | NULL                | NULL                |
| NULL     | 2022-09-04 | NULL                | NULL                | NULL                |
| NULL     | NULL       | 2022-09-05 00:00:00 | NULL                | NULL                |
| NULL     | NULL       | NULL                | 2022-09-05 00:00:00 | NULL                |
| NULL     | NULL       | NULL                | NULL                | 2022-09-05 00:00:00 |
+----------+------------+---------------------+---------------------+---------------------+
update t1 set c1 = subtime('11:11:11','01:01:01');
update t1 set c2 = subtime('2022-09-05','01:01:01');
ERROR 22007: Incorrect datetime value for column 'c2' at row 1
update t1 set c2 = subtime(date '2022-09-05','25:00:00');
update t1 set c3 = subtime('2022-09-05 00:00:00','01:00:00');
update t1 set c4 = subtime(timestamp '2022-09-06 01:01:01.000001','01:01:01.000001');
update t1 set c5 = subtime('20220905020202','01:01:01');
select * from t1;
+----------+------------+---------------------+---------------------+---------------------+
| c1       | c2         | c3                  | c4                  | c5                  |
+----------+------------+---------------------+---------------------+---------------------+
| 10:10:10 | 2022-09-03 | 2022-09-04 23:00:00 | 2022-09-06 00:00:00 | 2022-09-05 01:01:01 |
| 10:10:10 | 2022-09-03 | 2022-09-04 23:00:00 | 2022-09-06 00:00:00 | 2022-09-05 01:01:01 |
| 10:10:10 | 2022-09-03 | 2022-09-04 23:00:00 | 2022-09-06 00:00:00 | 2022-09-05 01:01:01 |
| 10:10:10 | 2022-09-03 | 2022-09-04 23:00:00 | 2022-09-06 00:00:00 | 2022-09-05 01:01:01 |
| 10:10:10 | 2022-09-03 | 2022-09-04 23:00:00 | 2022-09-06 00:00:00 | 2022-09-05 01:01:01 |
+----------+------------+---------------------+---------------------+---------------------+
delete from t1 where c1 = subtime('11:11:11','01:01:01') and c2 = subtime(date '2022-09-05','25:00:00') limit 1;
delete from t1 where c1 = subtime('11:11:11','01:01:01') and c2 = cast(subtime(date '2022-09-05','25:00:00') as date) limit 1;
delete from t1 where c1 = subtime('11:11:11','01:01:01') and c2 = convert(subtime(date '2022-09-05','25:00:00'),date) limit 1;
delete from t1 where c1 = subtime('11:11:11','01:01:01') limit 1;
select *,subtime(now(),0) from t1;
PURGE RECYCLEBIN;
