# ç¯å¢ƒæ¸…ç†
purge recyclebin;
result_format: 4
drop DATABASE IF EXISTS yx5493;
CREATE DATABASE yx5493;
USE yx5493;
#des_encryptã€des_decrypt
basic
select des_encrypt('str');
+--------------------+
| des_encrypt('str') |
+--------------------+
| €>Ïe‘œçf               |
+--------------------+
select des_decrypt(des_encrypt('str'));
+---------------------------------+
| des_decrypt(des_encrypt('str')) |
+---------------------------------+
| str                             |
+---------------------------------+
passwordæœªå¯¹åº”ï¼Œè¿”å›null
select des_decrypt(des_encrypt('str'),1);
+-----------------------------------+
| des_decrypt(des_encrypt('str'),1) |
+-----------------------------------+
| NULL                              |
+-----------------------------------+
select des_decrypt(des_encrypt('str'),'abc');
+---------------------------------------+
| des_decrypt(des_encrypt('str'),'abc') |
+---------------------------------------+
| NULL                                  |
+---------------------------------------+
select des_encrypt('str',0);
+----------------------+
| des_encrypt('str',0) |
+----------------------+
| €>Ïe‘œçf                 |
+----------------------+
select des_decrypt(des_encrypt('str',0));
+-----------------------------------+
| des_decrypt(des_encrypt('str',0)) |
+-----------------------------------+
| str                               |
+-----------------------------------+
passwordæœªå¯¹åº”ï¼Œè¿”å›null
select des_decrypt(des_encrypt('str',0),0);
+-------------------------------------+
| des_decrypt(des_encrypt('str',0),0) |
+-------------------------------------+
| NULL                                |
+-------------------------------------+
select des_encrypt('str',1);
+----------------------+
| des_encrypt('str',1) |
+----------------------+
| >Ïe‘œçf                 |
+----------------------+
select des_decrypt(des_encrypt('str',1));
+-----------------------------------+
| des_decrypt(des_encrypt('str',1)) |
+-----------------------------------+
| str                               |
+-----------------------------------+
select des_decrypt(des_encrypt('str',1),1);
+-------------------------------------+
| des_decrypt(des_encrypt('str',1),1) |
+-------------------------------------+
| NULL                                |
+-------------------------------------+
select des_encrypt('str',2);
+----------------------+
| des_encrypt('str',2) |
+----------------------+
| ‚>Ïe‘œçf                 |
+----------------------+
select des_encrypt('str',3);
+----------------------+
| des_encrypt('str',3) |
+----------------------+
| ƒ>Ïe‘œçf                 |
+----------------------+
select des_encrypt('str',4);
+----------------------+
| des_encrypt('str',4) |
+----------------------+
| „>Ïe‘œçf                 |
+----------------------+
select des_encrypt('str',5);
+----------------------+
| des_encrypt('str',5) |
+----------------------+
| …>Ïe‘œçf                 |
+----------------------+
select des_encrypt('str',6);
+----------------------+
| des_encrypt('str',6) |
+----------------------+
| †>Ïe‘œçf                 |
+----------------------+
select des_encrypt('str',7);
+----------------------+
| des_encrypt('str',7) |
+----------------------+
| ‡>Ïe‘œçf                 |
+----------------------+
select des_encrypt('str',8);
+----------------------+
| des_encrypt('str',8) |
+----------------------+
| ˆ>Ïe‘œçf                 |
+----------------------+
select des_encrypt('str',9);
+----------------------+
| des_encrypt('str',9) |
+----------------------+
| ‰>Ïe‘œçf                 |
+----------------------+
select des_encrypt('str','9');
+------------------------+
| des_encrypt('str','9') |
+------------------------+
| ÿÔhn&¦)0                 |
+------------------------+
select des_decrypt(des_encrypt('str','9'));
+-------------------------------------+
| des_decrypt(des_encrypt('str','9')) |
+-------------------------------------+
| NULL                                |
+-------------------------------------+
Warnings:
Warning	1108	Incorrect parameters to procedure 'des_decrypt'
select des_decrypt(des_encrypt('str','9'),'9');
+-----------------------------------------+
| des_decrypt(des_encrypt('str','9'),'9') |
+-----------------------------------------+
| str                                     |
+-----------------------------------------+
select des_decrypt(des_encrypt('str','9'),9);
+---------------------------------------+
| des_decrypt(des_encrypt('str','9'),9) |
+---------------------------------------+
| str                                   |
+---------------------------------------+
ç»“æœè¿”å›null,passwordçº¯æ•´æ•°é™åˆ¶0-9
select des_encrypt('str',10);
+-----------------------+
| des_encrypt('str',10) |
+-----------------------+
| NULL                  |
+-----------------------+
Warnings:
Warning	1108	Incorrect parameters to procedure 'des_encrypt'
select des_encrypt('str',99);
+-----------------------+
| des_encrypt('str',99) |
+-----------------------+
| NULL                  |
+-----------------------+
Warnings:
Warning	1108	Incorrect parameters to procedure 'des_encrypt'
select des_decrypt(des_encrypt('str',100));
+-------------------------------------+
| des_decrypt(des_encrypt('str',100)) |
+-------------------------------------+
| NULL                                |
+-------------------------------------+
Warnings:
Warning	1108	Incorrect parameters to procedure 'des_encrypt'
select des_encrypt('str',0.01);
+-------------------------+
| des_encrypt('str',0.01) |
+-------------------------+
| ÿ£2à0)t                  |
+-------------------------+
select des_decrypt(des_encrypt('str',0.01));
+--------------------------------------+
| des_decrypt(des_encrypt('str',0.01)) |
+--------------------------------------+
| NULL                                 |
+--------------------------------------+
Warnings:
Warning	1108	Incorrect parameters to procedure 'des_decrypt'
select des_decrypt(des_encrypt('str',0.01),0.01);
+-------------------------------------------+
| des_decrypt(des_encrypt('str',0.01),0.01) |
+-------------------------------------------+
| str                                       |
+-------------------------------------------+
select des_encrypt('str',-1234);
+--------------------------+
| des_encrypt('str',-1234) |
+--------------------------+
| NULL                     |
+--------------------------+
Warnings:
Warning	1108	Incorrect parameters to procedure 'des_encrypt'
select des_decrypt(des_encrypt('str',-1234));
+---------------------------------------+
| des_decrypt(des_encrypt('str',-1234)) |
+---------------------------------------+
| NULL                                  |
+---------------------------------------+
Warnings:
Warning	1108	Incorrect parameters to procedure 'des_encrypt'
select des_decrypt(des_encrypt('str',-1234),-1234);
+---------------------------------------------+
| des_decrypt(des_encrypt('str',-1234),-1234) |
+---------------------------------------------+
| NULL                                        |
+---------------------------------------------+
Warnings:
Warning	1108	Incorrect parameters to procedure 'des_encrypt'
select des_encrypt('str',1.234e3);
+----------------------------+
| des_encrypt('str',1.234e3) |
+----------------------------+
| ÿš¤Ò„€R‹                        |
+----------------------------+
select des_decrypt(des_encrypt('str',1.234e3));
+-----------------------------------------+
| des_decrypt(des_encrypt('str',1.234e3)) |
+-----------------------------------------+
| NULL                                    |
+-----------------------------------------+
Warnings:
Warning	1108	Incorrect parameters to procedure 'des_decrypt'
select des_decrypt(des_encrypt('str',1.234e3),1.234e3);
+-------------------------------------------------+
| des_decrypt(des_encrypt('str',1.234e3),1.234e3) |
+-------------------------------------------------+
| str                                             |
+-------------------------------------------------+
#DES_DECRYPT(crypt_str[,key_str_str]):å¦‚æœcrypt_strå‚æ•°ä¸æ˜¯åŠ å¯†å­—ç¬¦ä¸²ï¼Œè¿”å›ç»™å®šçš„ crypt_str
select des_decrypt(123);
+------------------+
| des_decrypt(123) |
+------------------+
| 123              |
+------------------+
select des_decrypt(123,123);
+----------------------+
| des_decrypt(123,123) |
+----------------------+
| 123                  |
+----------------------+
select des_decrypt('abc');
+--------------------+
| des_decrypt('abc') |
+--------------------+
| abc                |
+--------------------+
select des_decrypt('abc',1);
+----------------------+
| des_decrypt('abc',1) |
+----------------------+
| abc                  |
+----------------------+
select des_decrypt('ä¸­æ–‡æ±‰å­—');
+-----------------------------+
| des_decrypt('ä¸­æ–‡æ±‰å­—')     |
+-----------------------------+
| ä¸­æ–‡æ±‰å­—                    |
+-----------------------------+
select des_decrypt('ä¸­æ–‡æ±‰å­—',1);
+-------------------------------+
| des_decrypt('ä¸­æ–‡æ±‰å­—',1)     |
+-------------------------------+
| ä¸­æ–‡æ±‰å­—                      |
+-------------------------------+
select des_decrypt('~!@#$');
+----------------------+
| des_decrypt('~!@#$') |
+----------------------+
| ~!@#$                |
+----------------------+
select des_decrypt('~!@#$',1);
+------------------------+
| des_decrypt('~!@#$',1) |
+------------------------+
| ~!@#$                  |
+------------------------+
select des_decrypt(true);
+-------------------+
| des_decrypt(true) |
+-------------------+
| 1                 |
+-------------------+
select des_decrypt(false,1);
+----------------------+
| des_decrypt(false,1) |
+----------------------+
| 0                    |
+----------------------+
select des_encrypt('str','passwordstring') as åŠ å¯†;
+-----------+
| åŠ å¯†      |
+-----------+
| ÿ¸dv=n Ü     |
+-----------+
select des_decrypt(des_encrypt('str','passwordstring'),'passwordstring') as è§£å¯†;
+--------+
| è§£å¯†   |
+--------+
| str    |
+--------+
select des_encrypt('str','è¿™æ˜¯ä¸€ä¸ªå¯†ç ') as åŠ å¯†;
+-----------+
| åŠ å¯†      |
+-----------+
| ÿzPÑÏ'â´õ       |
+-----------+
select des_decrypt(des_encrypt('str','è¿™æ˜¯ä¸€ä¸ªå¯†ç '),'è¿™æ˜¯ä¸€ä¸ªå¯†ç ') as è§£å¯†;
+--------+
| è§£å¯†   |
+--------+
| str    |
+--------+
select des_encrypt('str','111aaa') as åŠ å¯†;
+-----------+
| åŠ å¯†      |
+-----------+
| ÿ:Jı–„ö>      |
+-----------+
select des_decrypt(des_encrypt('str','111aaa'),'111aaa') as è§£å¯†;
+--------+
| è§£å¯†   |
+--------+
| str    |
+--------+
select des_encrypt('str','å¯†ç 123abc') as åŠ å¯†;
+-----------+
| åŠ å¯†      |
+-----------+
| ÿßoış8›Ëp       |
+-----------+
select des_decrypt(des_encrypt('str','å¯†ç 123abc'),'å¯†ç 123abc') as è§£å¯†;
+--------+
| è§£å¯†   |
+--------+
| str    |
+--------+
select des_encrypt('str','ã“ã‚“ã«ã¡ã¯') as åŠ å¯†;
+-----------+
| åŠ å¯†      |
+-----------+
| ÿˆÃä¨Õ„nÃ        |
+-----------+
select des_decrypt(des_encrypt('str','ã“ã‚“ã«ã¡ã¯'),'ã“ã‚“ã«ã¡ã¯') as è§£å¯†;
+--------+
| è§£å¯†   |
+--------+
| str    |
+--------+
select des_encrypt('str','ì•ˆë…•í•˜ì‹­ë‹ˆê¹Œ') as åŠ å¯†;
+-----------+
| åŠ å¯†      |
+-----------+
| ÿºoşñx˜q'      |
+-----------+
select des_decrypt(des_encrypt('str','ì•ˆë…•í•˜ì‹­ë‹ˆê¹Œ'),'ì•ˆë…•í•˜ì‹­ë‹ˆê¹Œ') as è§£å¯†;
+--------+
| è§£å¯†   |
+--------+
| str    |
+--------+
select des_encrypt('str','~') as åŠ å¯†;
+-----------+
| åŠ å¯†      |
+-----------+
| ÿJ)^ÅÒ[9    |
+-----------+
select des_decrypt(des_encrypt('str','~'),'~') as è§£å¯†;
+--------+
| è§£å¯†   |
+--------+
| str    |
+--------+
select des_encrypt('str','~ï¼@#ï¿¥%â€¦â€¦&*') as åŠ å¯†;
+-----------+
| åŠ å¯†      |
+-----------+
| ÿÉÑŸy×2V     |
+-----------+
select des_decrypt(des_encrypt('str','~ï¼@#ï¿¥%â€¦â€¦&*'),'~ï¼@#ï¿¥%â€¦â€¦&*') as è§£å¯†;
+--------+
| è§£å¯†   |
+--------+
| str    |
+--------+
select des_encrypt('str',null) as åŠ å¯†;
+--------+
| åŠ å¯†   |
+--------+
| NULL   |
+--------+
Warnings:
Warning	1108	Incorrect parameters to procedure 'des_encrypt'
select des_decrypt(des_encrypt('str',null),null) as è§£å¯†;
+--------+
| è§£å¯†   |
+--------+
| NULL   |
+--------+
Warnings:
Warning	1108	Incorrect parameters to procedure 'des_encrypt'
select des_encrypt('str','') as åŠ å¯†;
+-----------+
| åŠ å¯†      |
+-----------+
| ÿ!ÿyº…hX2     |
+-----------+
select des_decrypt(des_encrypt('str',''),'') as è§£å¯†;
+--------+
| è§£å¯†   |
+--------+
| str    |
+--------+
select des_encrypt('str',' ') as åŠ å¯†;
+-----------+
| åŠ å¯†      |
+-----------+
| ÿ9VY¾uì­     |
+-----------+
select des_decrypt(des_encrypt('str',' '),' ') as è§£å¯†;
+--------+
| è§£å¯†   |
+--------+
| str    |
+--------+
select des_encrypt('str',true) as åŠ å¯†;
+-----------+
| åŠ å¯†      |
+-----------+
| >Ïe‘œçf      |
+-----------+
select des_decrypt(des_encrypt('str',true),true) as è§£å¯†;
+--------+
| è§£å¯†   |
+--------+
| NULL   |
+--------+
select des_decrypt(des_encrypt('str',true),1) as è§£å¯†;
+--------+
| è§£å¯†   |
+--------+
| NULL   |
+--------+
select des_encrypt('str',false) as åŠ å¯†;
+-----------+
| åŠ å¯†      |
+-----------+
| €>Ïe‘œçf      |
+-----------+
select des_decrypt(des_encrypt('str',false),false) as è§£å¯†;
+--------+
| è§£å¯†   |
+--------+
| NULL   |
+--------+
select des_decrypt(des_encrypt('str',false),0) as è§£å¯†;
+--------+
| è§£å¯†   |
+--------+
| NULL   |
+--------+
select des_encrypt('str','\n') as åŠ å¯†;
+-----------+
| åŠ å¯†      |
+-----------+
| ÿÿÍ+ÍÑ¬      |
+-----------+
select des_decrypt(des_encrypt('str','\n'),'\n') as è§£å¯†;
+--------+
| è§£å¯†   |
+--------+
| str    |
+--------+
select des_encrypt('str',10000000000000000000000000000000000000000000000000000000000000000000000000000000000000000000) as åŠ å¯†;
+-----------+
| åŠ å¯†      |
+-----------+
| ÿYø;­ğ·       |
+-----------+
select to_base64(des_encrypt('str',10000000000000000000000000000000000000000000000000000000000000000000000000000000000000000000)) as åŠ å¯†;
+--------------+
| åŠ å¯†         |
+--------------+
| /1n4Oxat8I63 |
+--------------+
select des_decrypt(des_encrypt('str',10000000000000000000000000000000000000000000000000000000000000000000000000000000000000000000),
10000000000000000000000000000000000000000000000000000000000000000000000000000000000000000000) as è§£å¯†;
+--------+
| è§£å¯†   |
+--------+
| str    |
+--------+
select des_encrypt('str',rpad('å¯†ç ',100,'å¯†ç ')) as åŠ å¯†;
+-----------+
| åŠ å¯†      |
+-----------+
| ÿ‚wÂ>•Ö¾      |
+-----------+
select des_decrypt(des_encrypt('str',rpad('å¯†ç ',100,'å¯†ç ')),rpad('å¯†ç ',100,'å¯†ç ')) as è§£å¯†;
+--------+
| è§£å¯†   |
+--------+
| str    |
+--------+
select des_encrypt('str',rpad('å¯†ç ',10,'å¯†ç ')) as åŠ å¯†;
+-----------+
| åŠ å¯†      |
+-----------+
| ÿ™KTäA£     |
+-----------+
select des_decrypt(des_encrypt('str',rpad('å¯†ç ',10,'å¯†ç ')),'å¯†ç å¯†ç å¯†ç å¯†ç å¯†ç ') as è§£å¯†;
+--------+
| è§£å¯†   |
+--------+
| str    |
+--------+
select des_encrypt('str',time'01:02:03') as åŠ å¯†;
+-----------+
| åŠ å¯†      |
+-----------+
| ÿé|\'Å)éÊ      |
+-----------+
select des_decrypt(des_encrypt('str',time'01:02:03'),time'01:02:03') as è§£å¯†;
+--------+
| è§£å¯†   |
+--------+
| str    |
+--------+
select des_encrypt('str',date'2022-10-14') as åŠ å¯†;
+-----------+
| åŠ å¯†      |
+-----------+
| ÿÇ6œ¸H]s5     |
+-----------+
select des_decrypt(des_encrypt('str',date'2022-10-14'),date'2022-10-14') as è§£å¯†;
+--------+
| è§£å¯†   |
+--------+
| str    |
+--------+
select des_encrypt('str',timestamp'2022-10-14 11:11:11') as åŠ å¯†;
+-----------+
| åŠ å¯†      |
+-----------+
| ÿM¼Ÿ{ÂøŸÙ        |
+-----------+
select des_decrypt(des_encrypt('str',timestamp'2022-10-14 11:11:11'),timestamp'2022-10-14 11:11:11') as è§£å¯†;
+--------+
| è§£å¯†   |
+--------+
| str    |
+--------+
#å‚æ•°ç±»å‹
#å‚æ•°1
select des_encrypt(999) as åŠ å¯†;
+-----------+
| åŠ å¯†      |
+-----------+
| €&dü|`=o   |
+-----------+
select des_decrypt(des_encrypt(999)) as è§£å¯†;
+--------+
| è§£å¯†   |
+--------+
| 999    |
+--------+
select des_encrypt(1,'key_str') as åŠ å¯†;
+-----------+
| åŠ å¯†      |
+-----------+
| ÿc”!çÉşÈ        |
+-----------+
select des_decrypt(des_encrypt(1,'key_str'),'key_str') as è§£å¯†;
+--------+
| è§£å¯†   |
+--------+
| 1      |
+--------+
select to_base64(des_encrypt(1,'key_str')) as åŠ å¯†;
+--------------+
| åŠ å¯†         |
+--------------+
| /2OOlCHnyf7I |
+--------------+
select des_decrypt(from_base64('/2OOlCHnyf7I'),'key_str') as è§£å¯†;
+--------+
| è§£å¯†   |
+--------+
| 1      |
+--------+
select des_encrypt(0,'key_str') as åŠ å¯†;
+-----------+
| åŠ å¯†      |
+-----------+
| ÿ¸ôOLohb     |
+-----------+
select des_decrypt(des_encrypt(0,'key_str'),'key_str') as è§£å¯†;
+--------+
| è§£å¯†   |
+--------+
| 0      |
+--------+
select to_base64(des_encrypt(0,'key_str')) as åŠ å¯†;
+--------------+
| åŠ å¯†         |
+--------------+
| /7j0T55Mb2hi |
+--------------+
select des_decrypt(from_base64('/7j0T55Mb2hi'),'key_str') as è§£å¯†;
+--------+
| è§£å¯†   |
+--------+
| 0      |
+--------+
select des_encrypt(0.01,'key_str') as åŠ å¯†;
+-----------+
| åŠ å¯†      |
+-----------+
| ÿ 8$$   |
+-----------+
select des_decrypt(des_encrypt(0.01,'key_str'),'key_str') as è§£å¯†;
+--------+
| è§£å¯†   |
+--------+
| 0.01   |
+--------+
select to_base64(des_encrypt(0.01,'key_str')) as åŠ å¯†;
+--------------+
| åŠ å¯†         |
+--------------+
| /6A4FAsYJA4k |
+--------------+
select des_decrypt(from_base64('/6A4FAsYJA4k'),'key_str') as è§£å¯†;
+--------+
| è§£å¯†   |
+--------+
| 0.01   |
+--------+
select des_encrypt(-1234,'key_str') as åŠ å¯†;
+-----------+
| åŠ å¯†      |
+-----------+
| ÿœ€$5ùF#"     |
+-----------+
select des_decrypt(des_encrypt(-1234,'key_str'),'key_str') as è§£å¯†;
+--------+
| è§£å¯†   |
+--------+
| -1234  |
+--------+
select to_base64(des_encrypt(-1234,'key_str')) as åŠ å¯†;
+--------------+
| åŠ å¯†         |
+--------------+
| /5yAJDX5RiMi |
+--------------+
select des_decrypt(from_base64('/5yAJDX5RiMi'),'key_str') as è§£å¯†;
+--------+
| è§£å¯†   |
+--------+
| -1234  |
+--------+
select des_encrypt(1.1234e8,'key_str') as åŠ å¯†;
+-------------------+
| åŠ å¯†              |
+-------------------+
| ÿ‘´ŸO Ö=ÏFgâ¿æÃ             |
+-------------------+
select des_decrypt(des_encrypt(1.1234e8,'key_str'),'key_str') as è§£å¯†;
+-----------+
| è§£å¯†      |
+-----------+
| 112340000 |
+-----------+
select to_base64(des_encrypt(1.1234e8,'key_str')) as åŠ å¯†;
+--------------------------+
| åŠ å¯†                     |
+--------------------------+
| /5G0n0+gjtY9z0Zn4r8Q5sM= |
+--------------------------+
select des_decrypt(from_base64('/5G0n0+gjtY9z0Zn4r8Q5sM='),'key_str') as è§£å¯†;
+-----------+
| è§£å¯†      |
+-----------+
| 112340000 |
+-----------+
select des_encrypt('helloworld','key_str') as åŠ å¯†;
+-------------------+
| åŠ å¯†              |
+-------------------+
| ÿÙPbÎl6XøgQvo$ß      |
+-------------------+
select des_decrypt(des_encrypt('helloworld','key_str'),'key_str') as è§£å¯†;
+------------+
| è§£å¯†       |
+------------+
| helloworld |
+------------+
select to_base64(des_encrypt('helloworld','key_str')) as åŠ å¯†;
+--------------------------+
| åŠ å¯†                     |
+--------------------------+
| /9lQYh7ObDZY+BlnUXZvJN8= |
+--------------------------+
select des_decrypt(from_base64('/9lQYh7ObDZY+BlnUXZvJN8='),'key_str') as è§£å¯†;
+------------+
| è§£å¯†       |
+------------+
| helloworld |
+------------+
select des_encrypt('ä½ å¥½ä¸–ç•Œ','key_str') as åŠ å¯†;
+-------------------+
| åŠ å¯†              |
+-------------------+
| ÿ©‹(G?˜8 Êù4°f         |
+-------------------+
select des_decrypt(des_encrypt('ä½ å¥½ä¸–ç•Œ','key_str'),'key_str') as è§£å¯†;
+--------------+
| è§£å¯†         |
+--------------+
| ä½ å¥½ä¸–ç•Œ     |
+--------------+
select to_base64(des_encrypt('ä½ å¥½ä¸–ç•Œ','key_str')) as åŠ å¯†;
+--------------------------+
| åŠ å¯†                     |
+--------------------------+
| /6mLGShHAz+YOADK+TSdsGY= |
+--------------------------+
select des_decrypt(from_base64('/6mLGShHAz+YOADK+TSdsGY='),'key_str') as è§£å¯†;
+--------------+
| è§£å¯†         |
+--------------+
| ä½ å¥½ä¸–ç•Œ     |
+--------------+
select des_encrypt('123abc','key_str') as åŠ å¯†;
+-----------+
| åŠ å¯†      |
+-----------+
| ÿbw¾‹ûÿÀà        |
+-----------+
select des_decrypt(des_encrypt('123abc','key_str'),'key_str') as è§£å¯†;
+--------+
| è§£å¯†   |
+--------+
| 123abc |
+--------+
select to_base64(des_encrypt('123abc','key_str')) as åŠ å¯†;
+--------------+
| åŠ å¯†         |
+--------------+
| /2J3vov7/8Dg |
+--------------+
select des_decrypt(from_base64('/2J3vov7/8Dg'),'key_str') as è§£å¯†;
+--------+
| è§£å¯†   |
+--------+
| 123abc |
+--------+
select des_encrypt('123abcè¿™æ˜¯å¯†æ–‡','key_str') as åŠ å¯†;
+---------------------------+
| åŠ å¯†                      |
+---------------------------+
| ÿ«ß5/‰Xš5N¸ î\øU_‡X%           |
+---------------------------+
select des_decrypt(des_encrypt('123abcè¿™æ˜¯å¯†æ–‡','key_str'),'key_str') as è§£å¯†;
+--------------------+
| è§£å¯†               |
+--------------------+
| 123abcè¿™æ˜¯å¯†æ–‡     |
+--------------------+
select to_base64(des_encrypt('123abcè¿™æ˜¯å¯†æ–‡','key_str')) as åŠ å¯†;
+--------------------------------------+
| åŠ å¯†                                 |
+--------------------------------------+
| /x0Iq98WNS+JWJo1Hk64oO5c+FVfh1glfw== |
+--------------------------------------+
select des_decrypt(from_base64('/x0Iq98WNS+JWJo1Hk64oO5c+FVfh1glfw=='),'key_str') as è§£å¯†;
+--------------------+
| è§£å¯†               |
+--------------------+
| 123abcè¿™æ˜¯å¯†æ–‡     |
+--------------------+
select des_encrypt('ã“ã‚“ã«ã¡ã¯','key_str') as åŠ å¯†;
+-------------------+
| åŠ å¯†              |
+-------------------+
| ÿåtfBK5‰¡—aÚi       |
+-------------------+
select des_decrypt(des_encrypt('ã“ã‚“ã«ã¡ã¯','key_str'),'key_str') as è§£å¯†;
+-----------------+
| è§£å¯†            |
+-----------------+
| ã“ã‚“ã«ã¡ã¯      |
+-----------------+
select to_base64(des_encrypt('ã“ã‚“ã«ã¡ã¯','key_str')) as åŠ å¯†;
+--------------------------+
| åŠ å¯†                     |
+--------------------------+
| /x3lB3QDZkJLNYkDoZdh2mk= |
+--------------------------+
select des_decrypt(from_base64('/x3lB3QDZkJLNYkDoZdh2mk='),'key_str') as è§£å¯†;
+-----------------+
| è§£å¯†            |
+-----------------+
| ã“ã‚“ã«ã¡ã¯      |
+-----------------+
select des_encrypt('ì•ˆë…•í•˜ì‹­ë‹ˆê¹Œ','key_str') as åŠ å¯†;
+---------------------------+
| åŠ å¯†                      |
+---------------------------+
| ÿCEyöˆõÄĞe]	°:Ÿ‚uõîŸí                |
+---------------------------+
select des_decrypt(des_encrypt('ì•ˆë…•í•˜ì‹­ë‹ˆê¹Œ','key_str'),'key_str') as è§£å¯†;
+--------------------+
| è§£å¯†               |
+--------------------+
| ì•ˆë…•í•˜ì‹­ë‹ˆê¹Œ       |
+--------------------+
select to_base64(des_encrypt('ì•ˆë…•í•˜ì‹­ë‹ˆê¹Œ','key_str')) as åŠ å¯†;
+--------------------------------------+
| åŠ å¯†                                 |
+--------------------------------------+
| /0NFefaI9cTQZRhdCbAGOp2fgo519e6f7Q== |
+--------------------------------------+
select des_decrypt(from_base64('/0NFefaI9cTQZRhdCbAGOp2fgo519e6f7Q=='),'key_str') as è§£å¯†;
+--------------------+
| è§£å¯†               |
+--------------------+
| ì•ˆë…•í•˜ì‹­ë‹ˆê¹Œ       |
+--------------------+
select des_encrypt('~','key_str') as åŠ å¯†;
+-----------+
| åŠ å¯†      |
+-----------+
| ÿy|~_©¤ù     |
+-----------+
select des_decrypt(des_encrypt('~','key_str'),'key_str') as è§£å¯†;
+--------+
| è§£å¯†   |
+--------+
| ~      |
+--------+
select des_encrypt('&','key_str') as åŠ å¯†;
+-----------+
| åŠ å¯†      |
+-----------+
| ÿ¥<¥B˜şT      |
+-----------+
select des_decrypt(des_encrypt('&','key_str'),'key_str') as è§£å¯†;
+--------+
| è§£å¯†   |
+--------+
| &      |
+--------+
select des_encrypt('$','key_str') as åŠ å¯†;
+-----------+
| åŠ å¯†      |
+-----------+
| ÿ†(ß”Úò«       |
+-----------+
select des_decrypt(des_encrypt('$','key_str'),'key_str') as è§£å¯†;
+--------+
| è§£å¯†   |
+--------+
| $      |
+--------+
select to_base64(des_encrypt('$','key_str')) as åŠ å¯†;
+--------------+
| åŠ å¯†         |
+--------------+
| /4Yo35Ta8qsY |
+--------------+
select des_decrypt(from_base64('/4Yo35Ta8qsY'),'key_str') as è§£å¯†;
+--------+
| è§£å¯†   |
+--------+
| $      |
+--------+
select des_encrypt('@','key_str') as åŠ å¯†;
+-----------+
| åŠ å¯†      |
+-----------+
| ÿ@LQÜBH®    |
+-----------+
select des_decrypt(des_encrypt('@','key_str'),'key_str') as è§£å¯†;
+--------+
| è§£å¯†   |
+--------+
| @      |
+--------+
select des_encrypt('#','key_str') as åŠ å¯†;
+-----------+
| åŠ å¯†      |
+-----------+
| ÿ¡‘¯k:çwU      |
+-----------+
select des_decrypt(des_encrypt('#','key_str'),'key_str') as è§£å¯†;
+--------+
| è§£å¯†   |
+--------+
| #      |
+--------+
select des_encrypt('~ï¼@#ï¿¥%^&*()_+','key_str') as åŠ å¯†;
+---------------------------+
| åŠ å¯†                      |
+---------------------------+
| ÿ§Úr*BŒzw<|3Ğe1â×1x*          |
+---------------------------+
select des_decrypt(des_encrypt('~ï¼@#ï¿¥%^&*()_+','key_str'),'key_str') as è§£å¯†;
+-------------------+
| è§£å¯†              |
+-------------------+
| ~ï¼@#ï¿¥%^&*()_+   |
+-------------------+
select to_base64(des_encrypt('~ï¼@#ï¿¥%^&*()_+','key_str')) as åŠ å¯†;
+--------------------------------------+
| åŠ å¯†                                 |
+--------------------------------------+
| /xen2nIqQg0GjHp3PHwz0GUx4hLXMXgqoA== |
+--------------------------------------+
select des_decrypt(from_base64('/xen2nIqQg0GjHp3PHwz0GUx4hLXMXgqoA=='),'key_str') as è§£å¯†;
+-------------------+
| è§£å¯†              |
+-------------------+
| ~ï¼@#ï¿¥%^&*()_+   |
+-------------------+
select des_encrypt(null,'key_str') as åŠ å¯†;
+--------+
| åŠ å¯†   |
+--------+
| NULL   |
+--------+
select des_decrypt(des_encrypt(null,'key_str'),'key_str') as è§£å¯†;
+--------+
| è§£å¯†   |
+--------+
| NULL   |
+--------+
select to_base64(des_encrypt(null,'key_str')) as åŠ å¯†;
+--------+
| åŠ å¯†   |
+--------+
| NULL   |
+--------+
select des_decrypt(from_base64(null),'key_str') as è§£å¯†;
+--------+
| è§£å¯†   |
+--------+
| NULL   |
+--------+
select des_encrypt('','key_str') as åŠ å¯†;
+--------+
| åŠ å¯†   |
+--------+
|        |
+--------+
select des_decrypt(des_encrypt('','key_str'),'key_str') as è§£å¯†;
+--------+
| è§£å¯†   |
+--------+
|        |
+--------+
select to_base64(des_encrypt('','key_str')) as åŠ å¯†;
+--------+
| åŠ å¯†   |
+--------+
|        |
+--------+
select des_decrypt(from_base64(''),'key_str') as è§£å¯†;
+--------+
| è§£å¯†   |
+--------+
|        |
+--------+
select des_encrypt(' ','key_str') as åŠ å¯†;
+-----------+
| åŠ å¯†      |
+-----------+
| ÿİİ—S•x      |
+-----------+
select des_decrypt(des_encrypt(' ','key_str'),'key_str') as è§£å¯†;
+--------+
| è§£å¯†   |
+--------+
|        |
+--------+
select to_base64(des_encrypt(' ','key_str')) as åŠ å¯†;
+--------------+
| åŠ å¯†         |
+--------------+
| /93dDJdTlXgL |
+--------------+
select des_decrypt(from_base64('/93dDJdTlXgL'),'key_str') as è§£å¯†;
+--------+
| è§£å¯†   |
+--------+
|        |
+--------+
select des_encrypt(true,'key_str') as åŠ å¯†;
+-----------+
| åŠ å¯†      |
+-----------+
| ÿc”!çÉşÈ        |
+-----------+
select des_decrypt(des_encrypt(true,'key_str'),'key_str') as è§£å¯†;
+--------+
| è§£å¯†   |
+--------+
| 1      |
+--------+
select to_base64(des_encrypt(true,'key_str')) as åŠ å¯†;
+--------------+
| åŠ å¯†         |
+--------------+
| /2OOlCHnyf7I |
+--------------+
select des_decrypt(from_base64('/2OOlCHnyf7I'),'key_str') as è§£å¯†;
+--------+
| è§£å¯†   |
+--------+
| 1      |
+--------+
select des_encrypt(false,'key_str') as åŠ å¯†;
+-----------+
| åŠ å¯†      |
+-----------+
| ÿ¸ôOLohb     |
+-----------+
select des_decrypt(des_encrypt(false,'key_str'),'key_str') as è§£å¯†;
+--------+
| è§£å¯†   |
+--------+
| 0      |
+--------+
select to_base64(des_encrypt(false,'key_str')) as åŠ å¯†;
+--------------+
| åŠ å¯†         |
+--------------+
| /7j0T55Mb2hi |
+--------------+
select des_decrypt(from_base64('/7j0T55Mb2hi'),'key_str') as è§£å¯†;
+--------+
| è§£å¯†   |
+--------+
| 0      |
+--------+
select des_encrypt(1000000000000000000000000000000000000000000000000000000000000000000000000000000000,'key_str') as åŠ å¯†;
+-------------------------------------------------------------------------------------------+
| åŠ å¯†                                                                                      |
+-------------------------------------------------------------------------------------------+
| ÿS»‚ÒÙ¢}í8äF™İ›(‘œŸÜ~Õæ`Z	Äxæ+ìšÓx—é’j*q»–êËÒÛ†ò=0ÁhJî$~‹û€'ß¡ı%‹tp“×–F)ZT6                                          |
+-------------------------------------------------------------------------------------------+
select des_decrypt(des_encrypt(1000000000000000000000000000000000000000000000000000000000000000000000000000000000,'key_str'),'key_str') as è§£å¯†;
+------------------------------------------------------------------------------------+
| è§£å¯†                                                                               |
+------------------------------------------------------------------------------------+
| 1000000000000000000000000000000000000000000000000000000000000000000000000000000000 |
+------------------------------------------------------------------------------------+
select des_encrypt(99999999999999999999999999999999999999999999999999999999999999999,'key_str') as åŠ å¯†;
+---------------------------------------------------------------------------+
| åŠ å¯†                                                                      |
+---------------------------------------------------------------------------+
| ÿEê_6))tËóÖ™„”°f¾FZØÓÖÿ¥RÃq
 c¡>¼/{FX;i˜aåu2«3~I6‡Éñ)ãn¸ ìm[5ÇtIƒó                              |
+---------------------------------------------------------------------------+
select des_decrypt(des_encrypt(99999999999999999999999999999999999999999999999999999999999999999,'key_str'),'key_str') as è§£å¯†;
+-------------------------------------------------------------------+
| è§£å¯†                                                              |
+-------------------------------------------------------------------+
| 99999999999999999999999999999999999999999999999999999999999999999 |
+-------------------------------------------------------------------+
select to_base64(des_encrypt(99999999999999999999999999999999999999999999999999999999999999999,'key_str')) as åŠ å¯†;
+-------------------------------------------------------------------------------------------------------+
| åŠ å¯†                                                                                                  |
+-------------------------------------------------------------------------------------------------------+
| /0XqXzYpKXTL89aZhJSwZhO+RloO2NPW/6VSw3EKIGOhPrwve0YMWAQ7aZhh5XUyqzMDfkk2h8nx
KeNuuB4A7G0PWzXHdEmD8w== |
+-------------------------------------------------------------------------------------------------------+
select des_decrypt(from_base64('/0XqXzYpKXTL89aZhJSwZhO+RloO2NPW/6VSw3EKIGOhPrwve0YMWAQ7aZhh5XUyqzMDfkk2h8nx
KeNuuB4A7G0PWzXHdEmD8w=='),'key_str') as è§£å¯†;
+-------------------------------------------------------------------+
| è§£å¯†                                                              |
+-------------------------------------------------------------------+
| 99999999999999999999999999999999999999999999999999999999999999999 |
+-------------------------------------------------------------------+
select des_encrypt(10000000000000000000000000000000000000000000000000000000000000000000000000000000000000000000000,'key_str') as åŠ å¯†;
+---------------------------------------------------------------------------------------------------+
| åŠ å¯†                                                                                              |
+---------------------------------------------------------------------------------------------------+
| ÿS»‚ÒÙ¢}í8äF™İ›(‘œŸÜ~Õæ`Z	Äxæ+ìšÓx—é’j*q»–êËÒÛ†ò=0ÁhJî$~‹û€'ß¡ı%‹tp“×–Ö¶* ¢Kõ\èÏTW¢                                                |
+---------------------------------------------------------------------------------------------------+
select des_decrypt(des_encrypt(10000000000000000000000000000000000000000000000000000000000000000000000000000000000000000000000,'key_str'),'key_str') as è§£å¯†;
+-------------------------------------------------------------------------------------------------+
| è§£å¯†                                                                                            |
+-------------------------------------------------------------------------------------------------+
| 10000000000000000000000000000000000000000000000000000000000000000000000000000000000000000000000 |
+-------------------------------------------------------------------------------------------------+
select to_base64(des_encrypt(10000000000000000000000000000000000000000000000000000000000000000000000000000000000000000000000,'key_str')) as åŠ å¯†;
+---------------------------------------------------------------------------------------------------------------------------------------+
| åŠ å¯†                                                                                                                                  |
+---------------------------------------------------------------------------------------------------------------------------------------+
| /1O7gtLZCKJ97TjkRpndCJsokZyfDtx+1eZgWgnEeOYr7JrTeJfpgZJqKnERu5bqywLS24byPTDB
aEruJBZ+i/uAJ9+h/RoOJYt0cJPXlhsd1rYTKgwAokv1XOjPBVRXog== |
+---------------------------------------------------------------------------------------------------------------------------------------+
select des_decrypt(from_base64('/1O7gtLZCKJ97TjkRpndCJsokZyfDtx+1eZgWgnEeOYr7JrTeJfpgZJqKnERu5bqywLS24byPTDB
aEruJBZ+i/uAJ9+h/RoOJYt0cJPXlhsd1rYTKgwAokv1XOjPBVRXog=='),'key_str') as è§£å¯†;
+-------------------------------------------------------------------------------------------------+
| è§£å¯†                                                                                            |
+-------------------------------------------------------------------------------------------------+
| 10000000000000000000000000000000000000000000000000000000000000000000000000000000000000000000000 |
+-------------------------------------------------------------------------------------------------+
select des_encrypt(rpad('ä¸€',100,'ä¸€'),'key_str') as åŠ å¯†;
+-------------------------------------------------------------------------------------------------------------------------------------------------------------------------------------------------------------------------------------------------------------------------------------------------------------------+
| åŠ å¯†                                                                                                                                                                                                                                                                                                              |
+-------------------------------------------------------------------------------------------------------------------------------------------------------------------------------------------------------------------------------------------------------------------------------------------------------------------+
| ÿm¤&>6F®^ñ2–E]oUš${{ÇF÷ö<ç“¦–Üé­HÓg(ÄÂ7«OôˆDûrÖÿœÂ=%õÏıwàÔ†:$Jhğ^·úçüöIÖæ(ÁÔ
cR<ä³ÊÔHdö¤¶şgò›ásªkğ÷p]I¾Mz“…hòi1]¦(Æ]ùeÒF\ÓÚfm	µgÀó=…>œÃW%:Z±3N]å¼HRøˆ×iUrWÎÉ9y/Ä“úAp/csÀ™n90ŞÌ)6.]aY,¸¯¡ˆD^5 z_¢©-)÷qòÿÌ›îM]°š¤'šczà² “‹$*dÓÊ _ı˜t¤PŠ_†—¾µë’ğSõÿé½”H9¸Ä”CíâÈ±]ƒ·Kˆã)ïïÊAâ-\„ä                                                                                                                                           |
+-------------------------------------------------------------------------------------------------------------------------------------------------------------------------------------------------------------------------------------------------------------------------------------------------------------------+
select des_decrypt(des_encrypt(rpad('ä¸€',100,'ä¸€'),'key_str'),'key_str') as è§£å¯†;
+--------------------------------------------------------------------------------------------------------------------------------------------------------------------------------------------------------------------------------------------------------------------------------------------------------------+
| è§£å¯†                                                                                                                                                                                                                                                                                                         |
+--------------------------------------------------------------------------------------------------------------------------------------------------------------------------------------------------------------------------------------------------------------------------------------------------------------+
| ä¸€ä¸€ä¸€ä¸€ä¸€ä¸€ä¸€ä¸€ä¸€ä¸€ä¸€ä¸€ä¸€ä¸€ä¸€ä¸€ä¸€ä¸€ä¸€ä¸€ä¸€ä¸€ä¸€ä¸€ä¸€ä¸€ä¸€ä¸€ä¸€ä¸€ä¸€ä¸€ä¸€ä¸€ä¸€ä¸€ä¸€ä¸€ä¸€ä¸€ä¸€ä¸€ä¸€ä¸€ä¸€ä¸€ä¸€ä¸€ä¸€ä¸€ä¸€ä¸€ä¸€ä¸€ä¸€ä¸€ä¸€ä¸€ä¸€ä¸€ä¸€ä¸€ä¸€ä¸€ä¸€ä¸€ä¸€ä¸€ä¸€ä¸€ä¸€ä¸€ä¸€ä¸€ä¸€ä¸€ä¸€ä¸€ä¸€ä¸€ä¸€ä¸€ä¸€ä¸€ä¸€ä¸€ä¸€ä¸€ä¸€ä¸€ä¸€ä¸€ä¸€ä¸€ä¸€ä¸€ä¸€ä¸€ä¸€ä¸€                                                                                                     |
+--------------------------------------------------------------------------------------------------------------------------------------------------------------------------------------------------------------------------------------------------------------------------------------------------------------+
select des_encrypt(time'01:02:03','key_str') as åŠ å¯†;
+-------------------+
| åŠ å¯†              |
+-------------------+
| ÿX›IİÛAI®şğ­IBü¢€            |
+-------------------+
select des_decrypt(des_encrypt(time'01:02:03','key_str'),'key_str') as è§£å¯†;
+----------+
| è§£å¯†     |
+----------+
| 01:02:03 |
+----------+
select to_base64(des_encrypt(time'01:02:03','key_str')) as åŠ å¯†;
+--------------------------+
| åŠ å¯†                     |
+--------------------------+
| /1ibSd3bQUmu/vCtSUL8ooA= |
+--------------------------+
select des_decrypt(from_base64('/1ibSd3bQUmu/vCtSUL8ooA='),'key_str') as è§£å¯†;
+----------+
| è§£å¯†     |
+----------+
| 01:02:03 |
+----------+
select des_encrypt(date'2022-10-14','key_str') as åŠ å¯†;
+-------------------+
| åŠ å¯†              |
+-------------------+
| ÿ{ÜÓïV*İkĞãcwœ          |
+-------------------+
select des_decrypt(des_encrypt(date'2022-10-14','key_str'),'key_str') as è§£å¯†;
+------------+
| è§£å¯†       |
+------------+
| 2022-10-14 |
+------------+
select to_base64(des_encrypt(date'2022-10-14','key_str')) as åŠ å¯†;
+--------------------------+
| åŠ å¯†                     |
+--------------------------+
| /3vcFdPvVirda9DjYxqed5w= |
+--------------------------+
select des_decrypt(from_base64('/3vcFdPvVirda9DjYxqed5w='),'key_str') as è§£å¯†;
+------------+
| è§£å¯†       |
+------------+
| 2022-10-14 |
+------------+
select des_encrypt(date'2022-10-14','key_str') as åŠ å¯†;
+-------------------+
| åŠ å¯†              |
+-------------------+
| ÿ{ÜÓïV*İkĞãcwœ          |
+-------------------+
select des_decrypt(des_encrypt(date'2022-10-14','key_str'),'key_str') as è§£å¯†;
+------------+
| è§£å¯†       |
+------------+
| 2022-10-14 |
+------------+
select to_base64(des_encrypt(date'2022-10-14','key_str')) as åŠ å¯†;
+--------------------------+
| åŠ å¯†                     |
+--------------------------+
| /3vcFdPvVirda9DjYxqed5w= |
+--------------------------+
select des_decrypt(from_base64('/3vcFdPvVirda9DjYxqed5w='),'key_str') as è§£å¯†;
+------------+
| è§£å¯†       |
+------------+
| 2022-10-14 |
+------------+
select des_encrypt(timestamp'2022-10-14 11:11:11','key_str') as åŠ å¯†;
+---------------------------+
| åŠ å¯†                      |
+---------------------------+
| ÿ{ÜÓïV*İx_‰¥úÒs†ö«ef              |
+---------------------------+
select des_decrypt(des_encrypt(timestamp'2022-10-14 11:11:11','key_str'),'key_str') as è§£å¯†;
+---------------------+
| è§£å¯†                |
+---------------------+
| 2022-10-14 11:11:11 |
+---------------------+
select to_base64(des_encrypt(timestamp'2022-10-14 11:11:11','key_str')) as åŠ å¯†;
+--------------------------------------+
| åŠ å¯†                                 |
+--------------------------------------+
| /3vcFdPvVirdf3hfiaX60nONhvYXEKtlZg== |
+--------------------------------------+
select des_decrypt(from_base64('/3vcFdPvVirdf3hfiaX60nONhvYXEKtlZg=='),'key_str') as è§£å¯†;
+---------------------+
| è§£å¯†                |
+---------------------+
| 2022-10-14 11:11:11 |
+---------------------+
drop table t1;
create table t1(
c1 time,
c2 date,
c3 year,
c4 datetime,
c5 timestamp
) default charset = utf8mb4;
insert into t1 values('01:02:03','2022-10-14','2022','2022-10-14 11:11:11','2022-10-14 11:11:11.123456');
insert into t1 values('02:02:03','2022-10-15','2023','2022-10-15 11:11:11','2022-10-15 11:11:11.123456');
insert into t1 values('03:02:03','2022-10-16','2024','2022-10-16 11:11:11','2022-10-16 11:11:11.123456');
insert into t1 values('04:02:03','2022-10-17','2025','2022-10-17 11:11:11','2022-10-17 11:11:11.123456');
select * from t1;
+----------+------------+------+---------------------+---------------------+
| c1       | c2         | c3   | c4                  | c5                  |
+----------+------------+------+---------------------+---------------------+
| 01:02:03 | 2022-10-14 | 2022 | 2022-10-14 11:11:11 | 2022-10-14 11:11:11 |
| 02:02:03 | 2022-10-15 | 2023 | 2022-10-15 11:11:11 | 2022-10-15 11:11:11 |
| 03:02:03 | 2022-10-16 | 2024 | 2022-10-16 11:11:11 | 2022-10-16 11:11:11 |
| 04:02:03 | 2022-10-17 | 2025 | 2022-10-17 11:11:11 | 2022-10-17 11:11:11 |
+----------+------------+------+---------------------+---------------------+
select des_encrypt(c1,'passwordstring') as c1,
des_encrypt(c2,'passwordstring') as c2,
des_encrypt(c3,'passwordstring') as c3,
des_encrypt(c4,'passwordstring') as c4,
des_encrypt(c4,'passwordstring') as c5 
from t1;
+-------------------+-------------------+-----------+---------------------------+---------------------------+
| c1                | c2                | c3        | c4                        | c5                        |
+-------------------+-------------------+-----------+---------------------------+---------------------------+
| ÿ¹†‘ÕİÃ§(eI}st         | ÿcIRe+vè^¢³ºÅŸY       | ÿ%mß!–é'     | ÿcIRe+vè”b®áÁ‘›]…À)²¥              | ÿcIRe+vè”b®áÁ‘›]…À)²¥              |
| ÿyà°+÷ÉP”ÿ=—JíT          | ÿcIRe+vè4IŸÜ      | ÿËÈ¯İˆ¿       | ÿcIRe+vèÊóRÒã.¹Eß•ÔçÎ            | ÿcIRe+vèÊóRÒã.¹Eß•ÔçÎ            |
| ÿ’Ç™c5¹Ğµñ¶äeâæ0           | ÿcIRe+vè´2Ôö²|°        | ÿá Éï)        | ÿcIRe+vèÎä<Mq¹°'B%ktÊÁ,         | ÿcIRe+vèÎä<Mq¹°'B%ktÊÁ,         |
| ÿŠ³Ú)ıBP¬5¤£š.DY          | ÿcIRe+vèä’lusĞÅ       | ÿ­S­ë¾…       | ÿcIRe+vè˜Kš–4÷¡ÁtP™¤R¸             | ÿcIRe+vè˜Kš–4÷¡ÁtP™¤R¸             |
+-------------------+-------------------+-----------+---------------------------+---------------------------+
select des_decrypt(des_encrypt(c1,'passwordstring'),'passwordstring') as c1,
des_decrypt(des_encrypt(c2,'passwordstring'),'passwordstring') as c2,
des_decrypt(des_encrypt(c3,'passwordstring'),'passwordstring') as c3,
des_decrypt(des_encrypt(c4,'passwordstring'),'passwordstring') as c4,
des_decrypt(des_encrypt(c5,'passwordstring'),'passwordstring') as c5 
from t1;
+----------+------------+------+---------------------+---------------------+
| c1       | c2         | c3   | c4                  | c5                  |
+----------+------------+------+---------------------+---------------------+
| 01:02:03 | 2022-10-14 | 2022 | 2022-10-14 11:11:11 | 2022-10-14 11:11:11 |
| 02:02:03 | 2022-10-15 | 2023 | 2022-10-15 11:11:11 | 2022-10-15 11:11:11 |
| 03:02:03 | 2022-10-16 | 2024 | 2022-10-16 11:11:11 | 2022-10-16 11:11:11 |
| 04:02:03 | 2022-10-17 | 2025 | 2022-10-17 11:11:11 | 2022-10-17 11:11:11 |
+----------+------------+------+---------------------+---------------------+
select des_encrypt('str',c1) as c1,
des_encrypt('str',c2) as c2,
des_encrypt('str',c3) as c3,
des_encrypt('str',c4) as c4,
des_encrypt('str',c5) as c5 from t1;
+-----------+-----------+------+-----------+-----------+
| c1        | c2        | c3   | c4        | c5        |
+-----------+-----------+------+-----------+-----------+
| ÿé|\'Å)éÊ      | ÿÇ6œ¸H]s5     | NULL | ÿM¼Ÿ{ÂøŸÙ        | ÿM¼Ÿ{ÂøŸÙ        |
| ÿ¤µF9Ë¶9@     | ÿì'Eƒ´T²      | NULL | ÿ€?`
ô0á     | ÿ€?`
ô0á     |
| ÿl“Y¶ñ§,      | ÿø&jøŸ"/?     | NULL | ÿL¶çÿ±        | ÿL¶çÿ±        |
| ÿo
ebFêŞ    | ÿ!´Õ>ø¡ˆ       | NULL | ÿ[{Ğ“y–|    | ÿ[{Ğ“y–|    |
+-----------+-----------+------+-----------+-----------+
Warnings:
Warning	1108	Incorrect parameters to procedure 'des_encrypt'
Warning	1108	Incorrect parameters to procedure 'des_encrypt'
Warning	1108	Incorrect parameters to procedure 'des_encrypt'
Warning	1108	Incorrect parameters to procedure 'des_encrypt'
select des_decrypt(des_encrypt('str1',c1),c1) as c1,
des_decrypt(des_encrypt('str2',c2),c2) as c2,
des_decrypt(des_encrypt('str3',c3),c3) as c3,
des_decrypt(des_encrypt('str4',c4),c4) as c4,
des_decrypt(des_encrypt('str5',c5),c5) as c5 
from t1;
+------+------+------+------+------+
| c1   | c2   | c3   | c4   | c5   |
+------+------+------+------+------+
| str1 | str2 | NULL | str4 | str5 |
| str1 | str2 | NULL | str4 | str5 |
| str1 | str2 | NULL | str4 | str5 |
| str1 | str2 | NULL | str4 | str5 |
+------+------+------+------+------+
Warnings:
Warning	1108	Incorrect parameters to procedure 'des_encrypt'
Warning	1108	Incorrect parameters to procedure 'des_encrypt'
Warning	1108	Incorrect parameters to procedure 'des_encrypt'
Warning	1108	Incorrect parameters to procedure 'des_encrypt'
drop table t1;
create table t1(
c1 tinyint,
c2 smallint,
c3 mediumint,
c4 int,
c5 bigint,
c6 decimal(5,2),
c7 float,
c8 double,
c9 bit(64)
) default charset = utf8mb4;
insert into t1() values(1,2,3,4,5,6,7,8,9);
insert into t1() values(11,22,33,44,55,66,77,88,99);
insert into t1() values(111,222,333,444,555,666,777,888,999);
select c1,c2,c3,c4,c5,c6,c7,c8,c9+0 from t1;
+------+------+------+------+------+--------+------+------+------+
| c1   | c2   | c3   | c4   | c5   | c6     | c7   | c8   | c9+0 |
+------+------+------+------+------+--------+------+------+------+
|    1 |    2 |    3 |    4 |    5 |   6.00 |    7 |    8 |    9 |
|   11 |   22 |   33 |   44 |   55 |  66.00 |   77 |   88 |   99 |
|  111 |  222 |  333 |  444 |  555 | 666.00 |  777 |  888 |  999 |
+------+------+------+------+------+--------+------+------+------+
select des_encrypt(c1,'passwordstring') as c1,
des_encrypt(c2,'passwordstring') as c2,
des_encrypt(c3,'passwordstring') as c3,
des_encrypt(c4,'passwordstring') as c4,
des_encrypt(c5,'passwordstring') as c5,
des_encrypt(c6,'passwordstring') as c6,
des_encrypt(c7,'passwordstring') as c7,
des_encrypt(c8,'passwordstring') as c8,
des_encrypt(c9+0,'passwordstring') as c9
from t1;
+-----------+-----------+-----------+-----------+-----------+-----------+-----------+-----------+-----------+
| c1        | c2        | c3        | c4        | c5        | c6        | c7        | c8        | c9        |
+-----------+-----------+-----------+-----------+-----------+-----------+-----------+-----------+-----------+
| ÿDğğ¼¥LÄ„       | ÿ,ò†z'
M@    | ÿ‰÷íÅ;<Á½        | ÿ…Ÿ,óLSë]      | ÿñQ'ƒÏÒwº       | ÿ©NüäZÇç        | ÿ‡V4‚oÿƒ­       | ÿÅÅ•<ÈÏ       | ÿOõ•pîéR      |
| ÿ ,gˆ½oÆ      | ÿ$`²¥©}       | ÿ\ïnTÜÿ     | ÿèï¡œ÷m       | ÿ€_æ1Ùé1      | ÿİE)lÅ
    | ÿdÀŞGP ë"     | ÿ\¡ÖÎÜãKÍ        | ÿëş¯çÕZû        |
| ÿN‘îüÉÁm       | ÿ…¾(‰a—å       | ÿ¤¡äUITÆQ      | ÿ!ÎÕ*¶sèÁ       | ÿã6ï´Ûš      | ÿo1QĞ,<n_   | ÿöó;›Ud’       | ÿ^Y±1¨‹Òâ       | ÿ² Ë»òİÒ       |
+-----------+-----------+-----------+-----------+-----------+-----------+-----------+-----------+-----------+
select des_decrypt(des_encrypt(c1,'passwordstring'),'passwordstring') as c1,
des_decrypt(des_encrypt(c2,'passwordstring'),'passwordstring') as c2,
des_decrypt(des_encrypt(c3,'passwordstring'),'passwordstring') as c3,
des_decrypt(des_encrypt(c4,'passwordstring'),'passwordstring') as c4,
des_decrypt(des_encrypt(c5,'passwordstring'),'passwordstring') as c5,
des_decrypt(des_encrypt(c6,'passwordstring'),'passwordstring') as c6,
des_decrypt(des_encrypt(c7,'passwordstring'),'passwordstring') as c7,
des_decrypt(des_encrypt(c8,'passwordstring'),'passwordstring') as c8,
des_decrypt(des_encrypt(c9+0,'passwordstring'),'passwordstring') as c9
from t1;
+------+------+------+------+------+--------+------+------+------+
| c1   | c2   | c3   | c4   | c5   | c6     | c7   | c8   | c9   |
+------+------+------+------+------+--------+------+------+------+
| 1    | 2    | 3    | 4    | 5    | 6.00   | 7    | 8    | 9    |
| 11   | 22   | 33   | 44   | 55   | 66.00  | 77   | 88   | 99   |
| 111  | 222  | 333  | 444  | 555  | 666.00 | 777  | 888  | 999  |
+------+------+------+------+------+--------+------+------+------+
select des_encrypt('str1',c1) as c1,
des_encrypt('str2',c2) as c2,
des_encrypt('str3',c3) as c3,
des_encrypt('str4',c4) as c4,
des_encrypt('str5',c5) as c5,
des_encrypt('str6',c6) as c6,
des_encrypt('str7',c7) as c7,
des_encrypt('str8',c8) as c8,
des_encrypt('str9',c9) as c9 from t1;
+-----------+-----------+-----------+-----------+-----------+-----------+-----------+-----------+-----------+
| c1        | c2        | c3        | c4        | c5        | c6        | c7        | c8        | c9        |
+-----------+-----------+-----------+-----------+-----------+-----------+-----------+-----------+-----------+
| LùÜVCb	6    | ‚Ç1gª'v@u    | ƒ«±‚–FšÜ         | „éÀ ;¹ÄF        | …NŞ…Š9Î¯Z     | ÿæØ?´WY      | ÿn·z#E†©—      | ÿyÁ¼
É-òí       | ‰ÔÍÕšÛ(n¶       |
| NULL      | NULL      | NULL      | NULL      | NULL      | ÿ‡Şq8÷X¾      | ÿ4h02ïš    | ÿ ÕPf^nfd   | NULL      |
| NULL      | NULL      | NULL      | NULL      | NULL      | ÿİ~ÙD‡Ò{†       | ÿÀ]‚@t÷1     | ÿÜü'^iU     | NULL      |
+-----------+-----------+-----------+-----------+-----------+-----------+-----------+-----------+-----------+
Warnings:
Warning	1108	Incorrect parameters to procedure 'des_encrypt'
Warning	1108	Incorrect parameters to procedure 'des_encrypt'
Warning	1108	Incorrect parameters to procedure 'des_encrypt'
Warning	1108	Incorrect parameters to procedure 'des_encrypt'
Warning	1108	Incorrect parameters to procedure 'des_encrypt'
Warning	1108	Incorrect parameters to procedure 'des_encrypt'
Warning	1108	Incorrect parameters to procedure 'des_encrypt'
Warning	1108	Incorrect parameters to procedure 'des_encrypt'
Warning	1108	Incorrect parameters to procedure 'des_encrypt'
Warning	1108	Incorrect parameters to procedure 'des_encrypt'
Warning	1108	Incorrect parameters to procedure 'des_encrypt'
Warning	1108	Incorrect parameters to procedure 'des_encrypt'
select des_decrypt(des_encrypt('str1',c1),c1) as c1,
des_decrypt(des_encrypt('str2',c2),c2) as c2,
des_decrypt(des_encrypt('str3',c3),c3) as c3,
des_decrypt(des_encrypt('str4',c4),c4) as c4,
des_decrypt(des_encrypt('str5',c5),c5) as c5,
des_decrypt(des_encrypt('str6',c6),c6) as c6,
des_decrypt(des_encrypt('str7',c7),c7) as c7,
des_decrypt(des_encrypt('str8',c8),c8) as c9,
des_decrypt(des_encrypt('str9',c9),c9) as c9
from t1;
+------+------+------+------+------+------+------+------+------+
| c1   | c2   | c3   | c4   | c5   | c6   | c7   | c9   | c9   |
+------+------+------+------+------+------+------+------+------+
| NULL | NULL | NULL | NULL | NULL | str6 | str7 | str8 | NULL |
| NULL | NULL | NULL | NULL | NULL | str6 | str7 | str8 | NULL |
| NULL | NULL | NULL | NULL | NULL | str6 | str7 | str8 | NULL |
+------+------+------+------+------+------+------+------+------+
Warnings:
Warning	1108	Incorrect parameters to procedure 'des_encrypt'
Warning	1108	Incorrect parameters to procedure 'des_encrypt'
Warning	1108	Incorrect parameters to procedure 'des_encrypt'
Warning	1108	Incorrect parameters to procedure 'des_encrypt'
Warning	1108	Incorrect parameters to procedure 'des_encrypt'
Warning	1108	Incorrect parameters to procedure 'des_encrypt'
Warning	1108	Incorrect parameters to procedure 'des_encrypt'
Warning	1108	Incorrect parameters to procedure 'des_encrypt'
Warning	1108	Incorrect parameters to procedure 'des_encrypt'
Warning	1108	Incorrect parameters to procedure 'des_encrypt'
Warning	1108	Incorrect parameters to procedure 'des_encrypt'
Warning	1108	Incorrect parameters to procedure 'des_encrypt'
drop table t1;
create table t1(
c1 char(2),
c2 varchar(255),
c3 tinyblob,
c4 tinytext,
c5 blob,
c6 text,
c7 mediumblob,
c8 mediumtext,
c9 longblob,
c10 longtext
);
insert into t1() values('å¯Œå¼º','æ°‘ä¸»','æ–‡æ˜','å’Œè°','è‡ªç”±','å¹³ç­‰','å…¬æ­£','æ³•æ²»','çˆ±å›½','æ•¬ä¸š');
select 
des_encrypt(c1,'passwordstring') as c1,
des_encrypt(c2,'passwordstring') as c2,
des_encrypt(c3,'passwordstring') as c3,
des_encrypt(c4,'passwordstring') as c4,
des_encrypt(c5,'passwordstring') as c5,
des_encrypt(c6,'passwordstring') as c6,
des_encrypt(c7,'passwordstring') as c7,
des_encrypt(c8,'passwordstring') as c8,
des_encrypt(c9,'passwordstring') as c9,
des_encrypt(c10,'passwordstring') as c10
from t1;
+-----------+-----------+-----------+-----------+-----------+-----------+-----------+-----------+-----------+-----------+
| c1        | c2        | c3        | c4        | c5        | c6        | c7        | c8        | c9        | c10       |
+-----------+-----------+-----------+-----------+-----------+-----------+-----------+-----------+-----------+-----------+
| ÿ®å{-³ç      | ÿ?¯M»³ıƒ       | ÿGóZ”¤;9     | ÿÙ781¿éç       | ÿwÔ›6,ä%¹     | ÿMÈZfÚôˆ      | ÿ›¿Xíü/       | ÿÌ?Ãê´K1       | ÿÉ˜¶¼ñxû       | ÿÁ1íH·wrÕ      |
+-----------+-----------+-----------+-----------+-----------+-----------+-----------+-----------+-----------+-----------+
select 
des_decrypt(des_encrypt(c1,'passwordstring'),'passwordstring') as c1,
des_decrypt(des_encrypt(c2,'passwordstring'),'passwordstring') as c2,
des_decrypt(des_encrypt(c3,'passwordstring'),'passwordstring') as c3,
des_decrypt(des_encrypt(c4,'passwordstring'),'passwordstring') as c4,
des_decrypt(des_encrypt(c5,'passwordstring'),'passwordstring') as c5,
des_decrypt(des_encrypt(c6,'passwordstring'),'passwordstring') as c6,
des_decrypt(des_encrypt(c7,'passwordstring'),'passwordstring') as c7,
des_decrypt(des_encrypt(c8,'passwordstring'),'passwordstring') as c8,
des_decrypt(des_encrypt(c9,'passwordstring'),'passwordstring') as c9,
des_decrypt(des_encrypt(c10,'passwordstring'),'passwordstring') as c10
from t1;
+--------+--------+--------+--------+--------+--------+--------+--------+--------+--------+
| c1     | c2     | c3     | c4     | c5     | c6     | c7     | c8     | c9     | c10    |
+--------+--------+--------+--------+--------+--------+--------+--------+--------+--------+
| å¯Œå¼º   | æ°‘ä¸»   | æ–‡æ˜   | å’Œè°   | è‡ªç”±   | å¹³ç­‰   | å…¬æ­£   | æ³•æ²»   | çˆ±å›½   | æ•¬ä¸š   |
+--------+--------+--------+--------+--------+--------+--------+--------+--------+--------+
select des_encrypt('str1',c1) as c1,
des_encrypt('str2',c2) as c2,
des_encrypt('str3',c3) as c3,
des_encrypt('str4',c4) as c4,
des_encrypt('str5',c5) as c5,
des_encrypt('str6',c6) as c6,
des_encrypt('str7',c7) as c7,
des_encrypt('str8',c8) as c8,
des_encrypt('str9',c9) as c9,
des_encrypt('str10',c10) as c10 from t1;
+-----------+-----------+-----------+-----------+-----------+-----------+-----------+-----------+-----------+-----------+
| c1        | c2        | c3        | c4        | c5        | c6        | c7        | c8        | c9        | c10       |
+-----------+-----------+-----------+-----------+-----------+-----------+-----------+-----------+-----------+-----------+
| ÿj‡t\·ó      | ÿHŒˆ§Bsi¤      | ÿ?y)Ÿ€ªd­      | ÿ»‚ÿëéÏ        | ÿ|J5    | ÿiÇØ˜>Hœ     | ÿDFÅdˆ    | ÿ¥/z&x)B‹    | ÿ‡ÑD>¹óÎ®       | ÿ¨!±Y{Bçõ      |
+-----------+-----------+-----------+-----------+-----------+-----------+-----------+-----------+-----------+-----------+
select des_decrypt(des_encrypt('str1',c1),c1) as c1,
des_decrypt(des_encrypt('str2',c2),c2) as c2,
des_decrypt(des_encrypt('str3',c3),c3) as c3,
des_decrypt(des_encrypt('str4',c4),c4) as c4,
des_decrypt(des_encrypt('str5',c5),c5) as c5,
des_decrypt(des_encrypt('str6',c6),c6) as c6,
des_decrypt(des_encrypt('str7',c7),c7) as c7,
des_decrypt(des_encrypt('str8',c8),c8) as c9,
des_decrypt(des_encrypt('str9',c9),c9) as c9,
des_decrypt(des_encrypt('str10',c10),c10) as c10
from t1;
+------+------+------+------+------+------+------+------+------+-------+
| c1   | c2   | c3   | c4   | c5   | c6   | c7   | c9   | c9   | c10   |
+------+------+------+------+------+------+------+------+------+-------+
| str1 | str2 | str3 | str4 | str5 | str6 | str7 | str8 | str9 | str10 |
+------+------+------+------+------+------+------+------+------+-------+
drop table t1;
create table t1(
c1 enum('è¯šä¿¡','å‹å–„'),
c2 set('æ­å·','é‡‘å','è¡¢å·')
) default charset = utf8mb4;
insert into t1() values('è¯šä¿¡','æ­å·,é‡‘å');
insert into t1() values('å‹å–„','æ­å·,è¡¢å·');
select * from t1;
+--------+---------------+
| c1     | c2            |
+--------+---------------+
| è¯šä¿¡   | æ­å·,é‡‘å     |
| å‹å–„   | æ­å·,è¡¢å·     |
+--------+---------------+
select 
des_encrypt(c1,'passwordstring') as c1,
des_encrypt(c2,'passwordstring') as c2
from t1;
+-----------+-------------------+
| c1        | c2                |
+-----------+-------------------+
| ÿ£­“ ˜MÅ¯       | ÿ:7Bƒò«aêó.       |
| ÿ@Ò?–Œ¶¬       | ÿ—Ğ‚™–1Ò“|N©4O          |
+-----------+-------------------+
select 
des_decrypt(des_encrypt(c1,'passwordstring'),'passwordstring') as c1,
des_decrypt(des_encrypt(c2,'passwordstring'),'passwordstring') as c2
from t1;
+--------+---------------+
| c1     | c2            |
+--------+---------------+
| è¯šä¿¡   | æ­å·,é‡‘å     |
| å‹å–„   | æ­å·,è¡¢å·     |
+--------+---------------+
select des_encrypt('str1',c1) as c1,
des_encrypt('str2',c2) as c2 from t1;
+-----------+-----------+
| c1        | c2        |
+-----------+-----------+
| ÿÁXˆBÖå      | ÿŒ‰µ‚L)      |
| ÿéĞ·ÃĞˆH      | ÿ~eYqó~Øˆ    |
+-----------+-----------+
select des_decrypt(des_encrypt('str1',c1),c1) as c1,
des_decrypt(des_encrypt('str2',c2),c2) as c2
from t1;
+------+------+
| c1   | c2   |
+------+------+
| str1 | str2 |
| str1 | str2 |
+------+------+
#å‚æ•°ä¸ªæ•°
select des_encrypt();
ERROR 42000: Incorrect parameter count in the call to native function 'des_encrypt'
select des_encrypt('a','b','c');
ERROR 42000: Incorrect parameter count in the call to native function 'des_encrypt'
select des_decrypt();
ERROR 42000: Incorrect parameter count in the call to native function 'des_decrypt'
select des_decrypt('1','2','3');
ERROR 42000: Incorrect parameter count in the call to native function 'des_decrypt'
select des_encrypt(1,'aa');
+---------------------+
| des_encrypt(1,'aa') |
+---------------------+
| ÿµÌ­¶Ü~J                |
+---------------------+
select des_decrypt(des_encrypt(1,'aa'),'aa','aa');
ERROR 42000: Incorrect parameter count in the call to native function 'des_decrypt'
#å­—ç¬¦é›†
utf8mb4ã€utf16ã€binaryã€gbkã€gb18030
select des_encrypt('str1',_utf8mb4'key');
+-----------------------------------+
| des_encrypt('str1',_utf8mb4'key') |
+-----------------------------------+
| ÿ³]Ç»RàÏ                              |
+-----------------------------------+
select des_encrypt('1234',_utf16'key2');
+----------------------------------+
| des_encrypt('1234',_utf16'key2') |
+----------------------------------+
| ÿàêRÜ{$”˜                              |
+----------------------------------+
select des_encrypt('abcd',_binary'key');
+----------------------------------+
| des_encrypt('abcd',_binary'key') |
+----------------------------------+
| ÿ;ş?…Ö                            |
+----------------------------------+
select des_encrypt('æ±‰å­—',_gbk'key');
+---------------------------------+
| des_encrypt('æ±‰å­—',_gbk'key')   |
+---------------------------------+
| ÿk¼¤`‰²Ò                             |
+---------------------------------+
select des_encrypt('ä¸­æ–‡123',_gb18030'key');
+----------------------------------------+
| des_encrypt('ä¸­æ–‡123',_gb18030'key')   |
+----------------------------------------+
| ÿ§¥úÚ~€ßQœödåğÎÆò                                    |
+----------------------------------------+
select des_encrypt(_utf8mb4'str1','key');
+-----------------------------------+
| des_encrypt(_utf8mb4'str1','key') |
+-----------------------------------+
| ÿ³]Ç»RàÏ                              |
+-----------------------------------+
select des_encrypt(_utf16'1234','key');
+---------------------------------+
| des_encrypt(_utf16'1234','key') |
+---------------------------------+
| ÿkÔçN}¢ó                            |
+---------------------------------+
select des_encrypt(_binary'abcd','key');
+----------------------------------+
| des_encrypt(_binary'abcd','key') |
+----------------------------------+
| ÿ;ş?…Ö                            |
+----------------------------------+
select des_encrypt(_gbk'æ±‰å­—','key');
+---------------------------------+
| des_encrypt(_gbk'æ±‰å­—','key')   |
+---------------------------------+
| ÿk¼¤`‰²Ò                             |
+---------------------------------+
select des_encrypt(_gb18030'ä¸­æ–‡123','key');
+----------------------------------------+
| des_encrypt(_gb18030'ä¸­æ–‡123','key')   |
+----------------------------------------+
| ÿ§¥úÚ~€ßQœödåğÎÆò                                    |
+----------------------------------------+
select des_encrypt('ï¼@#ï¿¥%â€¦â€¦&*',_utf8mb4'key' collate utf8mb4_general_ci) as utf8mb4;
+---------------------------+
| utf8mb4                   |
+---------------------------+
| ÿ8¤Íƒ¦YEÇ¥HR»˜ºZ6Z½?/          |
+---------------------------+
select des_encrypt('123abc',_utf8mb4'key' collate utf8mb4_unicode_ci) as utf8mb4;
+-----------+
| utf8mb4   |
+-----------+
| ÿ]Èø®HZŞ\      |
+-----------+
select des_encrypt('utf8mb4',_utf8mb4'key' collate utf8mb4_bin) as utf8mb4;
+-----------+
| utf8mb4   |
+-----------+
| ÿ—–”b7Óv~      |
+-----------+
select des_encrypt('åŠ å¯†æ–‡æœ¬',_utf16'password' collate utf16_general_ci) as utf16;
+-------------------+
| utf16             |
+-------------------+
| ÿÂ·ILîK6õÖ‰İı¼°          |
+-------------------+
select des_encrypt('abcdef',_utf16'password' collate utf16_bin) as utf16;
+-----------+
| utf16     |
+-----------+
| ÿ_u†–7íÚ9      |
+-----------+
select des_encrypt('123456',_utf16'password' collate utf16_unicode_ci) as utf16;
+-----------+
| utf16     |
+-----------+
| ÿ;KNzx{‘   |
+-----------+
select des_encrypt('text',_gbk'key' collate gbk_chinese_ci) as gbk;
+-----------+
| gbk       |
+-----------+
| ÿ§‰¬ëĞj       |
+-----------+
select des_encrypt('encrypt',_gbk'key' collate gbk_bin) as gbk;
+-----------+
| gbk       |
+-----------+
| ÿ
àÀ™twûG      |
+-----------+
select des_encrypt('_gb18030',_gb18030'key' collate gb18030_chinese_ci) as gb18030;
+-------------------+
| gb18030           |
+-------------------+
| ÿs"||	÷æ†À*6ôdKç         |
+-------------------+
select des_encrypt('gb18030_bin',_gb18030'key' collate gb18030_bin) as gb18030;
+-------------------+
| gb18030           |
+-------------------+
| ÿ½úµÜ¥³³nLw®~+          |
+-------------------+
select des_encrypt(_utf8mb4'utf8mb4_general_ci' collate utf8mb4_general_ci, 'key') as utf8mb4;
+---------------------------+
| utf8mb4                   |
+---------------------------+
| ÿ|ôòzòä|¨l&‰ç1ğv?¬†
             |
+---------------------------+
select des_encrypt(_utf8mb4'utf8mb4_unicode_ci' collate utf8mb4_unicode_ci, 'key') as utf8mb4;
+---------------------------+
| utf8mb4                   |
+---------------------------+
| ÿ|ôòzòä|’‘—ë˜ÍŸÃo:
h%’              |
+---------------------------+
select des_encrypt(_utf8mb4'utf8mb4_bin' collate utf8mb4_bin, 'key') as utf8mb4;
+-------------------+
| utf8mb4           |
+-------------------+
| ÿ|ôòzòä|w¿Èôš¶J            |
+-------------------+
select des_encrypt(_utf16'utf16_general_ci' collate utf16_general_ci, 'key') as utf16;
+---------------------------+
| utf16                     |
+---------------------------+
| ÿØÕ*rPsë_òn CúpÉëóÉ* ÉG            |
+---------------------------+
select des_encrypt(_utf16'88' collate utf16_bin, 'key') as utf16;
+-----------+
| utf16     |
+-----------+
| ÿª«j Ÿş’        |
+-----------+
select des_encrypt(_utf16'utf16_unicode_ci' collate utf16_unicode_ci, 'key') as utf16;
+---------------------------+
| utf16                     |
+---------------------------+
| ÿ³dc•ÒòƒÇ4¶|¬?wær¦–©Å¨                |
+---------------------------+
select des_encrypt(_gbk'gbk_chinese_ci' collate gbk_chinese_ci, 'key') gbk;
+-------------------+
| gbk               |
+-------------------+
| ÿ¨ Ä,%:Ì?×^Éœ{         |
+-------------------+
select des_encrypt(_gbk'gbk_bin' collate gbk_bin, 'key') gbk;
+-----------+
| gbk       |
+-----------+
| ÿïà!=     |
+-----------+
select des_encrypt(_gb18030'gb18030_chinese_ci' collate gb18030_chinese_ci, 'key') as gb18030;
+---------------------------+
| gb18030                   |
+---------------------------+
| ÿ½úµÜ¥³Ç%òÿÂôù\ÂßÃûêH                    |
+---------------------------+
select des_encrypt(_gb18030'gb18030_bin' collate gb18030_bin, 'key') as gb18030;
+-------------------+
| gb18030           |
+-------------------+
| ÿ½úµÜ¥³³nLw®~+          |
+-------------------+
select des_decrypt(des_encrypt('str1',_utf8mb4'key'),'key');
+------------------------------------------------------+
| des_decrypt(des_encrypt('str1',_utf8mb4'key'),'key') |
+------------------------------------------------------+
| str1                                                 |
+------------------------------------------------------+
select des_decrypt(des_encrypt('1234',_utf16'key2'),'key2');
+------------------------------------------------------+
| des_decrypt(des_encrypt('1234',_utf16'key2'),'key2') |
+------------------------------------------------------+
| 1234                                                 |
+------------------------------------------------------+
select des_decrypt(des_encrypt('abcd',_binary'key'),'key');
+-----------------------------------------------------+
| des_decrypt(des_encrypt('abcd',_binary'key'),'key') |
+-----------------------------------------------------+
| abcd                                                |
+-----------------------------------------------------+
select des_decrypt(des_encrypt('æ±‰å­—',_gbk'key'),'key');
+----------------------------------------------------+
| des_decrypt(des_encrypt('æ±‰å­—',_gbk'key'),'key')   |
+----------------------------------------------------+
| æ±‰å­—                                               |
+----------------------------------------------------+
select des_decrypt(des_encrypt('ä¸­æ–‡123',_gb18030'key'),'key');
+-----------------------------------------------------------+
| des_decrypt(des_encrypt('ä¸­æ–‡123',_gb18030'key'),'key')   |
+-----------------------------------------------------------+
| ä¸­æ–‡123                                                   |
+-----------------------------------------------------------+
select des_decrypt(des_encrypt(_utf8mb4'str1','key'),'key');
+------------------------------------------------------+
| des_decrypt(des_encrypt(_utf8mb4'str1','key'),'key') |
+------------------------------------------------------+
| str1                                                 |
+------------------------------------------------------+
select des_decrypt(des_encrypt(_utf16'1234','key'),'key');
+----------------------------------------------------+
| des_decrypt(des_encrypt(_utf16'1234','key'),'key') |
+----------------------------------------------------+
| 1234                                               |
+----------------------------------------------------+
select des_decrypt(des_encrypt(_binary'abcd','key'),'key');
+-----------------------------------------------------+
| des_decrypt(des_encrypt(_binary'abcd','key'),'key') |
+-----------------------------------------------------+
| abcd                                                |
+-----------------------------------------------------+
select des_decrypt(des_encrypt(_gbk'æ±‰å­—','key'),'key');
+----------------------------------------------------+
| des_decrypt(des_encrypt(_gbk'æ±‰å­—','key'),'key')   |
+----------------------------------------------------+
| æ±‰å­—                                               |
+----------------------------------------------------+
select des_decrypt(des_encrypt(_gb18030'ä¸­æ–‡123','key'),'key');
+-----------------------------------------------------------+
| des_decrypt(des_encrypt(_gb18030'ä¸­æ–‡123','key'),'key')   |
+-----------------------------------------------------------+
| ä¸­æ–‡123                                                   |
+-----------------------------------------------------------+
select des_decrypt(des_encrypt('ï¼@#ï¿¥%â€¦â€¦&*',_utf8mb4'key' collate utf8mb4_general_ci),'key') as utf8mb4;
+-------------------+
| utf8mb4           |
+-------------------+
| ï¼@#ï¿¥%â€¦â€¦&*       |
+-------------------+
select des_decrypt(des_encrypt('123abc',_utf8mb4'key' collate utf8mb4_unicode_ci),'key') as utf8mb4;
+---------+
| utf8mb4 |
+---------+
| 123abc  |
+---------+
select des_decrypt(des_encrypt('utf8mb4',_utf8mb4'key' collate utf8mb4_bin),'key') as utf8mb4;
+---------+
| utf8mb4 |
+---------+
| utf8mb4 |
+---------+
select des_decrypt(des_encrypt('åŠ å¯†æ–‡æœ¬',_utf16'password' collate utf16_general_ci),'password') as utf16;
+--------------+
| utf16        |
+--------------+
| åŠ å¯†æ–‡æœ¬     |
+--------------+
select des_decrypt(des_encrypt('abcdef',_utf16'password' collate utf16_bin),'password') as utf16;
+--------+
| utf16  |
+--------+
| abcdef |
+--------+
select des_decrypt(des_encrypt('123456',_utf16'password' collate utf16_unicode_ci),'password') as utf16;
+--------+
| utf16  |
+--------+
| 123456 |
+--------+
select des_decrypt(des_encrypt('text',_gbk'key' collate gbk_chinese_ci),'key') as gbk;
+------+
| gbk  |
+------+
| text |
+------+
select des_decrypt(des_encrypt('encrypt',_gbk'key' collate gbk_bin),'key') as gbk;
+---------+
| gbk     |
+---------+
| encrypt |
+---------+
select des_decrypt(des_encrypt('_gb18030',_gb18030'key' collate gb18030_chinese_ci),'key') as gb18030;
+----------+
| gb18030  |
+----------+
| _gb18030 |
+----------+
select des_decrypt(des_encrypt('gb18030_bin',_gb18030'key' collate gb18030_bin),'key') as gb18030;
+-------------+
| gb18030     |
+-------------+
| gb18030_bin |
+-------------+
select des_decrypt(des_encrypt(_utf8mb4'utf8mb4_general_ci' collate utf8mb4_general_ci, 'key'),'key') as utf8mb4;
+--------------------+
| utf8mb4            |
+--------------------+
| utf8mb4_general_ci |
+--------------------+
select des_decrypt(des_encrypt(_utf8mb4'utf8mb4_unicode_ci' collate utf8mb4_unicode_ci, 'key'),'key') as utf8mb4;
+--------------------+
| utf8mb4            |
+--------------------+
| utf8mb4_unicode_ci |
+--------------------+
select des_decrypt(des_encrypt(_utf8mb4'utf8mb4_bin' collate utf8mb4_bin, 'key'),'key') as utf8mb4;
+-------------+
| utf8mb4     |
+-------------+
| utf8mb4_bin |
+-------------+
select des_decrypt(des_encrypt(_utf16'utf16_general_ci' collate utf16_general_ci, 'key'),'key') as utf16;
+------------------+
| utf16            |
+------------------+
| utf16_general_ci |
+------------------+
select des_decrypt(des_encrypt(_utf16'88' collate utf16_bin, 'key'),'key') as utf16;
+-------+
| utf16 |
+-------+
| 88    |
+-------+
select des_decrypt(des_encrypt(_utf16'utf16_unicode_ci' collate utf16_unicode_ci, 'key'),'key') as utf16;
+------------------+
| utf16            |
+------------------+
| utf16_unicode_ci |
+------------------+
select des_decrypt(des_encrypt(_gbk'gbk_chinese_ci' collate gbk_chinese_ci, 'key'),'key') gbk;
+----------------+
| gbk            |
+----------------+
| gbk_chinese_ci |
+----------------+
select des_decrypt(des_encrypt(_gbk'gbk_bin' collate gbk_bin, 'key'),'key') gbk;
+---------+
| gbk     |
+---------+
| gbk_bin |
+---------+
select des_decrypt(des_encrypt(_gb18030'gb18030_chinese_ci' collate gb18030_chinese_ci, 'key'),'key') as gb18030;
+--------------------+
| gb18030            |
+--------------------+
| gb18030_chinese_ci |
+--------------------+
select des_decrypt(des_encrypt(_gb18030'gb18030_bin' collate gb18030_bin, 'key'),'key') as gb18030;
+-------------+
| gb18030     |
+-------------+
| gb18030_bin |
+-------------+
#åŸºç¡€sqlè¯­å¥ã€è§†å›¾ã€çº¦æŸã€ç´¢å¼•ã€å‡½æ•°åµŒå¥—
drop table t1;
create table t1 as select des_encrypt('test','key') as c2;
alter table t1 add c1 int first;
alter table t1 modify c1 int auto_increment primary key;
desc t1;
+-------+---------------+------+-----+---------+----------------+
| Field | Type          | Null | Key | Default | Extra          |
+-------+---------------+------+-----+---------+----------------+
| c1    | int(11)       | NO   | PRI | NULL    | auto_increment |
| c2    | varbinary(25) | YES  |     | NULL    |                |
+-------+---------------+------+-----+---------+----------------+
insert into t1(c2) values(des_encrypt('222','key'));
insert into t1(c2) values(des_encrypt('333','key'));
insert into t1(c2) values(des_encrypt('444','key'));
select * from t1;
+----+-----------+
| c1 | c2        |
+----+-----------+
|  1 | ÿ6µ×ià–!      |
|  2 | ÿ.€¼šóŠD        |
|  3 | ÿ¶Ì3}˜Ç       |
|  4 | ÿ?‹P¥ÁK;     |
+----+-----------+
select c1,des_decrypt(c2,'key') from t1;
+----+-----------------------+
| c1 | des_decrypt(c2,'key') |
+----+-----------------------+
|  1 | test                  |
|  2 | 222                   |
|  3 | 333                   |
|  4 | 444                   |
+----+-----------------------+
select c1,des_decrypt(c2,'key') as 'key' from t1 where c1 = 1 group by c1,'key';
+----+------+
| c1 | key  |
+----+------+
|  1 | test |
+----+------+
select c1,des_decrypt(c2,'key') as 'key' from t1 where c1 = 2 order by 1;
+----+------+
| c1 | key  |
+----+------+
|  2 | 222  |
+----+------+
select des_decrypt(c2,'key') as 'key' from t1 where c1 = 3 order by 1 limit 1;
+------+
| key  |
+------+
| 333  |
+------+
select c1,des_decrypt(c2,'key') as 'key' from t1 tt1 where exists(select * from t1 tt2 where tt2.c1 = tt1.c1 and tt2.c1 <= 1);
+----+------+
| c1 | key  |
+----+------+
|  1 | test |
+----+------+
select c1,des_decrypt(c2,'key') as 'key' from t1 tt1 where not exists(select * from t1 tt2 where tt2.c1 = tt1.c1 and tt2.c1 <= 1);
+----+------+
| c1 | key  |
+----+------+
|  2 | 222  |
|  3 | 333  |
|  4 | 444  |
+----+------+
select c1,des_decrypt(c2,'key') as 'key' from t1 where des_decrypt(c2,'key') in('test','333');
+----+------+
| c1 | key  |
+----+------+
|  1 | test |
|  3 | 333  |
+----+------+
select c1,des_decrypt(c2,'key') as 'key' from t1 where des_decrypt(c2,'key') not in('test','333');
+----+------+
| c1 | key  |
+----+------+
|  2 | 222  |
|  4 | 444  |
+----+------+
select c1,des_decrypt(c2,'key') as 'key' from t1 tt1 where c1 < any(select c1 from t1 tt2 where tt2.c1 > 2);
+----+------+
| c1 | key  |
+----+------+
|  1 | test |
|  2 | 222  |
|  3 | 333  |
+----+------+
select c1,des_decrypt(c2,'key') as 'key' from t1 tt1 where c1 = some(select c1 from t1 tt2 where tt2.c1 > 2);
+----+------+
| c1 | key  |
+----+------+
|  3 | 333  |
|  4 | 444  |
+----+------+
select c1,des_decrypt(c2,'key') as 'key' from t1 tt1 where c1 > all(select c1 from t1 tt2 where tt2.c1 < 2);
+----+------+
| c1 | key  |
+----+------+
|  2 | 222  |
|  3 | 333  |
|  4 | 444  |
+----+------+
update t1 set c2 = des_encrypt('111','key') where des_decrypt(c2,'key') = 'test';
delete from t1 where des_decrypt(c2,'key') > des_decrypt(des_encrypt(111,'111'),'111');
select c1,des_decrypt(c2,'key') as new_c2 from t1;
+----+--------+
| c1 | new_c2 |
+----+--------+
|  1 | 111    |
+----+--------+
#å‡½æ•°åµŒå¥—
select des_encrypt(des_decrypt(des_encrypt('123','password1'),'password1'),'password2');
+----------------------------------------------------------------------------------+
| des_encrypt(des_decrypt(des_encrypt('123','password1'),'password1'),'password2') |
+----------------------------------------------------------------------------------+
| ÿc	!©q”„                                                                            |
+----------------------------------------------------------------------------------+
select des_decrypt(des_encrypt(des_decrypt(des_encrypt('123','password1'),'password1'),'password2'),'password2');
+-----------------------------------------------------------------------------------------------------------+
| des_decrypt(des_encrypt(des_decrypt(des_encrypt('123','password1'),'password1'),'password2'),'password2') |
+-----------------------------------------------------------------------------------------------------------+
| 123                                                                                                       |
+-----------------------------------------------------------------------------------------------------------+
select length(des_encrypt('aaa','bbbbb'));
+------------------------------------+
| length(des_encrypt('aaa','bbbbb')) |
+------------------------------------+
|                                  9 |
+------------------------------------+
select length(des_decrypt(des_encrypt('geeksforgeeks123', 'passwordstring'),'passwordstring'));
+-----------------------------------------------------------------------------------------+
| length(des_decrypt(des_encrypt('geeksforgeeks123', 'passwordstring'),'passwordstring')) |
+-----------------------------------------------------------------------------------------+
|                                                                                      16 |
+-----------------------------------------------------------------------------------------+
select des_encrypt(length('12345'),'abc');
+------------------------------------+
| des_encrypt(length('12345'),'abc') |
+------------------------------------+
| ÿ”é0ß½‡L                               |
+------------------------------------+
select des_decrypt(des_encrypt(length('12345'),'abc'),'abc');
+-------------------------------------------------------+
| des_decrypt(des_encrypt(length('12345'),'abc'),'abc') |
+-------------------------------------------------------+
| 5                                                     |
+-------------------------------------------------------+
select des_encrypt(concat('abc','123'),'password');
+---------------------------------------------+
| des_encrypt(concat('abc','123'),'password') |
+---------------------------------------------+
| ÿ,ê3nÓƒ|	                                      |
+---------------------------------------------+
select des_decrypt(des_encrypt(concat('abc','123'),'password'),'password');
+---------------------------------------------------------------------+
| des_decrypt(des_encrypt(concat('abc','123'),'password'),'password') |
+---------------------------------------------------------------------+
| abc123                                                              |
+---------------------------------------------------------------------+
select des_encrypt('123',concat('pass','word'));
+------------------------------------------+
| des_encrypt('123',concat('pass','word')) |
+------------------------------------------+
| ÿ® 4ÏÈHÊp                                      |
+------------------------------------------+
select des_decrypt(des_encrypt('123',concat('pass','word')),concat('pass','word'));
+-----------------------------------------------------------------------------+
| des_decrypt(des_encrypt('123',concat('pass','word')),concat('pass','word')) |
+-----------------------------------------------------------------------------+
| 123                                                                         |
+-----------------------------------------------------------------------------+
select des_encrypt('cleartext', concat('my_random_salt',null,'my_secret_password'));
+------------------------------------------------------------------------------+
| des_encrypt('cleartext', concat('my_random_salt',null,'my_secret_password')) |
+------------------------------------------------------------------------------+
| NULL                                                                         |
+------------------------------------------------------------------------------+
Warnings:
Warning	1108	Incorrect parameters to procedure 'des_encrypt'
select des_decrypt(des_encrypt('cleartext', concat('my_random_salt-','my_secret_password')),'my_random_salt-my_secret_password') as è§£å¯†;
+-----------+
| è§£å¯†      |
+-----------+
| cleartext |
+-----------+
select des_decrypt(des_encrypt('cleartext', concat('my_random_salt',null,'my_secret_password')),null);
+------------------------------------------------------------------------------------------------+
| des_decrypt(des_encrypt('cleartext', concat('my_random_salt',null,'my_secret_password')),null) |
+------------------------------------------------------------------------------------------------+
| NULL                                                                                           |
+------------------------------------------------------------------------------------------------+
Warnings:
Warning	1108	Incorrect parameters to procedure 'des_encrypt'
select bin(des_decrypt(des_encrypt(8,'123'),'123'));
+----------------------------------------------+
| bin(des_decrypt(des_encrypt(8,'123'),'123')) |
+----------------------------------------------+
| 1000                                         |
+----------------------------------------------+
select md5(des_decrypt(des_encrypt('str','password'),'password'));
+------------------------------------------------------------+
| md5(des_decrypt(des_encrypt('str','password'),'password')) |
+------------------------------------------------------------+
| 341be97d9aff90c9978347f66f945b77                           |
+------------------------------------------------------------+
select lower(des_decrypt(des_encrypt('STR','password'),'password'));
+--------------------------------------------------------------+
| lower(des_decrypt(des_encrypt('STR','password'),'password')) |
+--------------------------------------------------------------+
| STR                                                          |
+--------------------------------------------------------------+
select upper(des_decrypt(des_encrypt('str','password'),'password'));
+--------------------------------------------------------------+
| upper(des_decrypt(des_encrypt('str','password'),'password')) |
+--------------------------------------------------------------+
| str                                                          |
+--------------------------------------------------------------+
select left(des_decrypt(des_encrypt('string','password'),'password'),3);
+------------------------------------------------------------------+
| left(des_decrypt(des_encrypt('string','password'),'password'),3) |
+------------------------------------------------------------------+
| str                                                              |
+------------------------------------------------------------------+
select right(des_decrypt(des_encrypt('string','password'),'password'),6);
+-------------------------------------------------------------------+
| right(des_decrypt(des_encrypt('string','password'),'password'),6) |
+-------------------------------------------------------------------+
| string                                                            |
+-------------------------------------------------------------------+
select reverse(des_decrypt(des_encrypt('string','password'),'password'));
+-------------------------------------------------------------------+
| reverse(des_decrypt(des_encrypt('string','password'),'password')) |
+-------------------------------------------------------------------+
| gnirts                                                            |
+-------------------------------------------------------------------+
select substring(des_decrypt(des_encrypt('string','password'),'password'),4);
+-----------------------------------------------------------------------+
| substring(des_decrypt(des_encrypt('string','password'),'password'),4) |
+-----------------------------------------------------------------------+
| ing                                                                   |
+-----------------------------------------------------------------------+
select if(1=1,des_encrypt('cleartext', 'password'),des_decrypt(des_encrypt('cleartext', 'password'),'password'));
+-----------------------------------------------------------------------------------------------------------+
| if(1=1,des_encrypt('cleartext', 'password'),des_decrypt(des_encrypt('cleartext', 'password'),'password')) |
+-----------------------------------------------------------------------------------------------------------+
| ÿõ(WŞV[!yé{×]½òí+                                                                                                 |
+-----------------------------------------------------------------------------------------------------------+
select if(1>1,des_encrypt('cleartext', 'password'),des_decrypt(des_encrypt('cleartext', 'password'),'password'));
+-----------------------------------------------------------------------------------------------------------+
| if(1>1,des_encrypt('cleartext', 'password'),des_decrypt(des_encrypt('cleartext', 'password'),'password')) |
+-----------------------------------------------------------------------------------------------------------+
| cleartext                                                                                                 |
+-----------------------------------------------------------------------------------------------------------+
select ifnull(null,des_decrypt(des_encrypt('cleartext', 'password'),'password'));
+---------------------------------------------------------------------------+
| ifnull(null,des_decrypt(des_encrypt('cleartext', 'password'),'password')) |
+---------------------------------------------------------------------------+
| cleartext                                                                 |
+---------------------------------------------------------------------------+
select nullif(des_decrypt(des_encrypt('cleartext', 'password'),'password'),des_encrypt('cleartext', 'password'));
+-----------------------------------------------------------------------------------------------------------+
| nullif(des_decrypt(des_encrypt('cleartext', 'password'),'password'),des_encrypt('cleartext', 'password')) |
+-----------------------------------------------------------------------------------------------------------+
| cleartext                                                                                                 |
+-----------------------------------------------------------------------------------------------------------+
select case des_decrypt(des_encrypt('cleartext','password'),'password')
	when 'cleartext' then 'æˆåŠŸè§£å¯†'
	else 'è§£å¯†å¤±è´¥'
	end as col1;
+--------------+
| col1         |
+--------------+
| æˆåŠŸè§£å¯†     |
+--------------+
select case when des_decrypt(des_encrypt('cleartext','password'),'password') = 'cleartext' 
	then 'æˆåŠŸè§£å¯†' 
	else 'è§£å¯†å¤±è´¥' 
	end as col2;
+--------------+
| col2         |
+--------------+
| æˆåŠŸè§£å¯†     |
+--------------+
select case des_decrypt(des_encrypt('cleartext','password'),'password') 
	when des_decrypt(des_encrypt('cleartext','password'),'password') then 'æˆåŠŸè§£å¯†'
	when des_decrypt(des_encrypt('text','password'),'password') then 'è§£å¯†å¤±è´¥'
	end as col3;
+--------------+
| col3         |
+--------------+
| æˆåŠŸè§£å¯†     |
+--------------+
#è§†å›¾
drop table t1;
create table t1 as select des_encrypt('test','key') as c2;
alter table t1 add c1 int first;
alter table t1 modify c1 int auto_increment primary key;
desc t1;
+-------+---------------+------+-----+---------+----------------+
| Field | Type          | Null | Key | Default | Extra          |
+-------+---------------+------+-----+---------+----------------+
| c1    | int(11)       | NO   | PRI | NULL    | auto_increment |
| c2    | varbinary(25) | YES  |     | NULL    |                |
+-------+---------------+------+-----+---------+----------------+
insert into t1(c2) values(des_encrypt('222','key'));
insert into t1(c2) values(des_encrypt('333','key'));
insert into t1(c2) values(des_encrypt('444','key'));
select * from t1;
+----+-----------+
| c1 | c2        |
+----+-----------+
|  1 | ÿ6µ×ià–!      |
|  2 | ÿ.€¼šóŠD        |
|  3 | ÿ¶Ì3}˜Ç       |
|  4 | ÿ?‹P¥ÁK;     |
+----+-----------+
drop view v1;
create view v1 as select * from t1;
select des_decrypt(c2,'key') from v1;
+-----------------------+
| des_decrypt(c2,'key') |
+-----------------------+
| test                  |
| 222                   |
| 333                   |
| 444                   |
+-----------------------+
select c1,des_decrypt(c2,'key') as 'key' from v1 where c1 = 1 group by c1,'key';
+----+------+
| c1 | key  |
+----+------+
|  1 | test |
+----+------+
select c1,des_decrypt(c2,'key') as 'key' from v1 where c1 = 2 order by 1;
+----+------+
| c1 | key  |
+----+------+
|  2 | 222  |
+----+------+
select des_decrypt(c2,'key') as 'key' from v1 where c1 = 3 order by 1 limit 1;
+------+
| key  |
+------+
| 333  |
+------+
select c1,des_decrypt(c2,'key') as 'key' from v1 where des_decrypt(c2,'key') in('test','333');
+----+------+
| c1 | key  |
+----+------+
|  1 | test |
|  3 | 333  |
+----+------+
select c1,des_decrypt(c2,'key') as 'key' from v1 where des_decrypt(c2,'key') not in('test','333');
+----+------+
| c1 | key  |
+----+------+
|  2 | 222  |
|  4 | 444  |
+----+------+
update v1 set c2 = des_encrypt('111','key') where des_decrypt(c2,'key') = 'test';
delete from v1 where des_decrypt(c2,'key') > des_decrypt(des_encrypt(111,'111'),'111');
select c1,des_decrypt(c2,'key') as new_c2 from v1;
+----+--------+
| c1 | new_c2 |
+----+--------+
|  1 | 111    |
+----+--------+
å¤åˆ¶è¡¨
drop table t;
create table t as select des_encrypt('test','key') as c2;
alter table t add c1 int first;
alter table t modify c1 int auto_increment primary key;
desc t;
+-------+---------------+------+-----+---------+----------------+
| Field | Type          | Null | Key | Default | Extra          |
+-------+---------------+------+-----+---------+----------------+
| c1    | int(11)       | NO   | PRI | NULL    | auto_increment |
| c2    | varbinary(25) | YES  |     | NULL    |                |
+-------+---------------+------+-----+---------+----------------+
drop table t1;
create table t1 select * from t;
alter table t1 modify c1 int auto_increment primary key;
insert into t1(c2) values(des_encrypt('222','key'));
insert into t1(c2) values(des_encrypt('333','key'));
insert into t1(c2) values(des_encrypt('444','key'));
select * from t1;
+----+-----------+
| c1 | c2        |
+----+-----------+
|  1 | ÿ6µ×ià–!      |
|  2 | ÿ.€¼šóŠD        |
|  3 | ÿ¶Ì3}˜Ç       |
|  4 | ÿ?‹P¥ÁK;     |
+----+-----------+
select c1,des_decrypt(c2,'key') from t1;
+----+-----------------------+
| c1 | des_decrypt(c2,'key') |
+----+-----------------------+
|  1 | test                  |
|  2 | 222                   |
|  3 | 333                   |
|  4 | 444                   |
+----+-----------------------+
select c1,des_decrypt(c2,'key') as 'key' from t1 where c1 = 1 group by c1,'key';
+----+------+
| c1 | key  |
+----+------+
|  1 | test |
+----+------+
select c1,des_decrypt(c2,'key') as 'key' from t1 where c1 = 2 order by 1;
+----+------+
| c1 | key  |
+----+------+
|  2 | 222  |
+----+------+
select des_decrypt(c2,'key') as 'key' from t1 where c1 = 3 order by 1 limit 1;
+------+
| key  |
+------+
| 333  |
+------+
select c1,des_decrypt(c2,'key') as 'key' from t1 tt1 where exists(select * from t1 tt2 where tt2.c1 = tt1.c1 and tt2.c1 <= 1);
+----+------+
| c1 | key  |
+----+------+
|  1 | test |
+----+------+
select c1,des_decrypt(c2,'key') as 'key' from t1 tt1 where not exists(select * from t1 tt2 where tt2.c1 = tt1.c1 and tt2.c1 <= 1);
+----+------+
| c1 | key  |
+----+------+
|  2 | 222  |
|  3 | 333  |
|  4 | 444  |
+----+------+
select c1,des_decrypt(c2,'key') as 'key' from t1 where des_decrypt(c2,'key') in('test','333');
+----+------+
| c1 | key  |
+----+------+
|  1 | test |
|  3 | 333  |
+----+------+
select c1,des_decrypt(c2,'key') as 'key' from t1 where des_decrypt(c2,'key') not in('test','333');
+----+------+
| c1 | key  |
+----+------+
|  2 | 222  |
|  4 | 444  |
+----+------+
select c1,des_decrypt(c2,'key') as 'key' from t1 tt1 where c1 < any(select c1 from t1 tt2 where tt2.c1 > 2);
+----+------+
| c1 | key  |
+----+------+
|  1 | test |
|  2 | 222  |
|  3 | 333  |
+----+------+
select c1,des_decrypt(c2,'key') as 'key' from t1 tt1 where c1 = some(select c1 from t1 tt2 where tt2.c1 > 2);
+----+------+
| c1 | key  |
+----+------+
|  3 | 333  |
|  4 | 444  |
+----+------+
select c1,des_decrypt(c2,'key') as 'key' from t1 tt1 where c1 > all(select c1 from t1 tt2 where tt2.c1 < 2);
+----+------+
| c1 | key  |
+----+------+
|  2 | 222  |
|  3 | 333  |
|  4 | 444  |
+----+------+
update t1 set c2 = des_encrypt('111','key') where des_decrypt(c2,'key') = 'test';
delete from t1 where des_decrypt(c2,'key') > des_decrypt(des_encrypt(111,'111'),'111');
select c1,des_decrypt(c2,'key') as new_c2 from t1;
+----+--------+
| c1 | new_c2 |
+----+--------+
|  1 | 111    |
+----+--------+
åˆ†åŒºè¡¨
hash
drop table t1;
create table t1(
c1 int,
c2 blob
)
partition by hash(c1)(
partition p0,
partition p1);
insert into t1() values(1,des_encrypt('c1=1','password1'));
insert into t1() values(2,des_encrypt('c1=2','password2'));
insert into t1() values(3,des_encrypt('c1=3','password3'));
insert into t1() values(4,des_encrypt('c1=4','password4'));
select * from t1 partition(p0);
+------+-----------+
| c1   | c2        |
+------+-----------+
|    2 | ÿ¯Êr}’Šc      |
|    4 | ÿaû40…Vì     |
+------+-----------+
select * from t1 partition(p1);
+------+-----------+
| c1   | c2        |
+------+-----------+
|    1 | ÿ.5/ZÄÂY-    |
|    3 | ÿ‚‡âşª!       |
+------+-----------+
select c1,des_decrypt(c2,'password1') from t1 where c2 = des_encrypt('c1=1','password1');
+------+-----------------------------+
| c1   | des_decrypt(c2,'password1') |
+------+-----------------------------+
|    1 | c1=1                        |
+------+-----------------------------+
update t1 set c1 = 22 where c2 = des_encrypt('c1=2','password2');
delete from t1 where c1 = 3 or des_decrypt(c2,'password4') = 'c1=4';
select * from t1 order by 1,2;
+------+-----------+
| c1   | c2        |
+------+-----------+
|    1 | ÿ.5/ZÄÂY-    |
|   22 | ÿ¯Êr}’Šc      |
+------+-----------+
range
drop table t1;
create table t1(
c1 int,
c2 blob)
partition by range(c1)(
partition p0 values less than (10),
partition p1 values less than (20),
partition pmax values less than (maxvalue));
insert into t1() values(1,des_encrypt('1','1'));
insert into t1() values(5,des_encrypt('5','5'));
insert into t1() values(12,des_encrypt('12','12'));
insert into t1() values(17,des_encrypt('17','17'));
insert into t1() values(55,des_encrypt('55','55'));
select * from t1;
+------+-----------+
| c1   | c2        |
+------+-----------+
|    1 | ÿ†b^¡@£·Â       |
|    5 | ÿç£iøÅYğ       |
|   12 | ÿlçï®fzR     |
|   17 | ÿeXèÄ
¡Ã       |
|   55 | ÿU‚™PÇ     |
+------+-----------+
insert into t1() values(99,des_decrypt(des_encrypt('99','99'),'99'));
select c1,des_decrypt(c2,'1') from t1 where c2 = des_encrypt('1','1');
+------+---------------------+
| c1   | des_decrypt(c2,'1') |
+------+---------------------+
|    1 | 1                   |
+------+---------------------+
update t1 set c2 = des_encrypt('99','99') where c1 = 99;
delete from t1 where c2 = des_encrypt('1','1') or c1 <99;
select * from t1 order by 1,2;
+------+-----------+
| c1   | c2        |
+------+-----------+
|   99 | ÿ®qàé¬¬Á        |
+------+-----------+
list
drop table t1;
create table t1(
c1 int,c2 blob)
partition by list(c1)(
partition p0 values in(1,2,3),
partition p1 values in(4,5,6),
partition p2 values in(7,8,9)
);
insert into t1() values(1,des_encrypt('2','3'));
insert into t1() values(4,des_encrypt('5','6'));
insert into t1() values(7,des_encrypt('8','9'));
select * from t1 partition(p0);
+------+-----------+
| c1   | c2        |
+------+-----------+
|    1 | ÿ„~$Wiy“    |
+------+-----------+
select * from t1 partition(p1);
+------+-----------+
| c1   | c2        |
+------+-----------+
|    4 | ÿytuô#u    |
+------+-----------+
select * from t1 partition(p2);
+------+-----------+
| c1   | c2        |
+------+-----------+
|    7 | ÿ c—<éİÎó        |
+------+-----------+
select c1,des_decrypt(c2,'3') from t1 where c2 = des_encrypt('2','3');
+------+---------------------+
| c1   | des_decrypt(c2,'3') |
+------+---------------------+
|    1 | 2                   |
+------+---------------------+
update t1 set c1 = 5 where c1 = des_decrypt(des_encrypt('4','4'),'4');
delete from t1 where c2 = des_encrypt('8','9');
select * from t1 order by 1,2;
+------+-----------+
| c1   | c2        |
+------+-----------+
|    1 | ÿ„~$Wiy“    |
|    5 | ÿytuô#u    |
+------+-----------+
key
drop table t1;
create table t1(
c1 int,c2 blob)
partition by key(c1)
partitions 2;
insert into t1() values(1,des_encrypt('a','password1'));
insert into t1() values(2,des_encrypt('b','password2'));
insert into t1() values(3,des_encrypt('c','password3'));
insert into t1() values(4,des_encrypt('d','password4'));
select * from t1 order by 1,2;
+------+-----------+
| c1   | c2        |
+------+-----------+
|    1 | ÿ)|´÷üÜ      |
|    2 | ÿ¯–­ Xß›      |
|    3 | ÿÌVPf†C°ã      |
|    4 | ÿ¶U½,¼       |
+------+-----------+
select c1,des_decrypt(c2,'password1') from t1 where c2 = des_encrypt('a','password1');
+------+-----------------------------+
| c1   | des_decrypt(c2,'password1') |
+------+-----------------------------+
|    1 | a                           |
+------+-----------------------------+
update t1 set c1 = 22 where c2 = des_encrypt('b','password2');
delete from t1 where c1 = 3 or des_decrypt(c2,'password4') = 'd';
select * from t1 order by 1,2;
+------+-----------+
| c1   | c2        |
+------+-----------+
|    1 | ÿ)|´÷üÜ      |
|   22 | ÿ¯–­ Xß›      |
+------+-----------+
range-hash
drop table t1;
create table t1(
id int auto_increment,
username varchar(255) not null,
password blob,
birthdate date not null,
primary key (id,birthdate),
key idx_usr(username))
partition by range(id)
subpartition by hash(year(birthdate))
subpartitions 3
(
partition p1 values less than (100),
partition p2 values less than maxvalue
);
insert into t1() values(1,'xiaoyi',des_encrypt(123456,'123456'),'2018-01-01');
insert into t1() values(2,'xiaoer',des_encrypt('abcdef','abcdef'),'2019-02-02');
insert into t1() values(3,'xiaosan',des_encrypt('é»„é¾™æ—¶ä»£','æ—¶ä»£å¹¿åœº'),'2020-03-03');
insert into t1() values(4,'xiaosi',des_encrypt('123justçˆ¬','password'),'2021-04-04');
select * from t1 order by 1,2,3,4;
+----+----------+-------------------+------------+
| id | username | password          | birthdate  |
+----+----------+-------------------+------------+
|  1 | xiaoyi   | ÿ5*Öã½Ğ              | 2018-01-01 |
|  2 | xiaoer   | ÿ¹å+>¿§¦<               | 2019-02-02 |
|  3 | xiaosan  | ÿ/†Zh!Ğ1)šÂ0‘,        | 2020-03-03 |
|  4 | xiaosi   | ÿ ÿVJCÈ˜‘™–eˆá         | 2021-04-04 |
+----+----------+-------------------+------------+
select des_decrypt(password,'123456') from t1 where password = des_encrypt(123456,'123456');
+--------------------------------+
| des_decrypt(password,'123456') |
+--------------------------------+
| 123456                         |
+--------------------------------+
update t1 set password = des_encrypt(654321,'654321') where birthdate = '2018-01-01';
delete from t1 where password = des_encrypt('123justçˆ¬','password');
select * from t1 order by 1,2,3,4;
+----+----------+-------------------+------------+
| id | username | password          | birthdate  |
+----+----------+-------------------+------------+
|  1 | xiaoyi   | ÿRîêV„”ä               | 2018-01-01 |
|  2 | xiaoer   | ÿ¹å+>¿§¦<               | 2019-02-02 |
|  3 | xiaosan  | ÿ/†Zh!Ğ1)šÂ0‘,        | 2020-03-03 |
+----+----------+-------------------+------------+
#å­˜å‚¨è¿‡ç¨‹
drop table t1;
create table t1(id int auto_increment primary key,name varchar(255),password varchar(255));
insert into t1 values(1,'å¼ ä¸‰','a123456');
insert into t1 values(2,'æå››','b223456');
insert into t1 values(3,'ç‹äº”','c323456');
insert into t1 values(4,'å°å…­','d423456');
drop table t2;
create table t2(sid int,miwen blob,mingwen varchar(255));
#æ— å‚æ•°çš„å­˜å‚¨è¿‡ç¨‹
drop procedure p1_des_encrypt;//
create procedure p1_des_encrypt()
begin
    declare a blob;
	declare b varchar(255);
    declare i int default 1;
    while i <= 4 do
	  select des_encrypt(password,'key'),des_decrypt(des_encrypt(password,'key'),'key') into a,b from t1 where id = i;
	  insert into t2 values(i,a,b);
	  set i = i + 1;
	end while;
end;
//
call p1_des_encrypt();
select * from t2 order by 1,2;
+------+-----------+---------+
| sid  | miwen     | mingwen |
+------+-----------+---------+
|    1 | ÿô™ôøÓ¡       | a123456 |
|    2 | ÿø¾%E    | b223456 |
|    3 | ÿ(­DòTTvÕ     | c323456 |
|    4 | ÿ•ŞubIÜv(     | d423456 |
+------+-----------+---------+
#æœ‰å‚æ•°çš„å­˜å‚¨è¿‡ç¨‹(in)
delete from t2;
drop procedure p1_des_encrypt;//
create procedure p1_des_encrypt(in aa int)
begin
    declare a blob;
	declare b varchar(255);
    declare i int default aa;
    repeat
	  select des_encrypt(password,'key'),des_decrypt(des_encrypt(password,'key'),'key') into a,b from t1 where id = i;
	  insert into t2 values(i,a,b);
	  set i = i + 1;
	until i > 4
	end repeat;
end;
//
call p1_des_encrypt(1);
select * from t2 order by 1,2;
+------+-----------+---------+
| sid  | miwen     | mingwen |
+------+-----------+---------+
|    1 | ÿô™ôøÓ¡       | a123456 |
|    2 | ÿø¾%E    | b223456 |
|    3 | ÿ(­DòTTvÕ     | c323456 |
|    4 | ÿ•ŞubIÜv(     | d423456 |
+------+-----------+---------+
#æœ‰å‚æ•°çš„å­˜å‚¨è¿‡ç¨‹(out)
delete from t2;
drop procedure p1_des_encrypt//
create procedure p1_des_encrypt(out aa blob,out bb varchar(255))
begin
    declare i int default 1;
    while i <= 4 do
	  select des_encrypt(password,'key'),password into aa,bb from t1 where id = i;
	  insert into t2 values(i,aa,bb);
	  set i = i + 1;
	end while;
end;
//
call p1_des_encrypt(@aa,@bb);
select * from t2 order by 1,2;
+------+-----------+---------+
| sid  | miwen     | mingwen |
+------+-----------+---------+
|    1 | ÿô™ôøÓ¡       | a123456 |
|    2 | ÿø¾%E    | b223456 |
|    3 | ÿ(­DòTTvÕ     | c323456 |
|    4 | ÿ•ŞubIÜv(     | d423456 |
+------+-----------+---------+
#è‡ªå®šä¹‰å‡½æ•°
drop function f_des_encrypt;//
create  function f_des_encrypt() returns  blob READS SQL DATA
begin
    declare aa blob;
	select des_encrypt(password,'key') into aa from t1 where id = 1;
	return aa;
end;
//
select f_des_encrypt();
+-----------------+
| f_des_encrypt() |
+-----------------+
| ÿô™ôøÓ¡             |
+-----------------+
#è§¦å‘å™¨
delete from t2;
insert into t2 select id,des_encrypt(password,'key'),des_decrypt(des_encrypt(password,'key'),'key') from t1;
drop trigger trigger_des_encrypt;//
create trigger trigger_des_encrypt before update 
on t2 for each row
begin
    set new.miwen = des_encrypt('abc123','update');
	set new.mingwen = des_decrypt(des_encrypt('abc123','update'),'update');
end;
//
update t2 set sid = 44 where sid = 4;
select * from t2 order by 1;
+------+-----------+---------+
| sid  | miwen     | mingwen |
+------+-----------+---------+
|    1 | ÿô™ôøÓ¡       | a123456 |
|    2 | ÿø¾%E    | b223456 |
|    3 | ÿ(­DòTTvÕ     | c323456 |
|   44 | ÿ\Z5¤Œ7b    | abc123  |
+------+-----------+---------+
drop database if exists yx5493;
PURGE RECYCLEBIN;
