# ç¯å¢ƒæ¸…ç†
purge recyclebin;
result_format: 4
drop DATABASE IF EXISTS yx5493;
CREATE DATABASE yx5493;
USE yx5493;
#encode decode
#basic
drop table t1;
create table t1(
username varchar(128),
password blob
);
insert into t1(username,password) values('xiaoxin',encode('xiaoxinxin','passwordstring'));
select  * from t1;
+----------+------------+
| username | password   |
+----------+------------+
| xiaoxin  | Ô¸®T¼q…
;A     |
+----------+------------+
select username,decode(password,'passwordstring') as password from t1;
+----------+------------+
| username | password   |
+----------+------------+
| xiaoxin  | xiaoxinxin |
+----------+------------+
#å¯†é’¥ä¸å¯¹åº”æ—¶è§£å¯†å¤±è´¥
select username,decode(password,'wrongpassword') as password from t1;
+----------+------------+
| username | password   |
+----------+------------+
| xiaoxin  | ÉX;éà—Â¦ù       |
+----------+------------+
#å‚æ•°ç±»å‹
#å‚æ•°1
select encode(1,'key') as åŠ å¯†;
+--------+
| åŠ å¯†   |
+--------+
| í       |
+--------+
select decode(encode(1,'key'),'key') as è§£å¯†;
+--------+
| è§£å¯†   |
+--------+
| 1      |
+--------+
select to_base64(encode(1,'key')) as åŠ å¯†;
+--------+
| åŠ å¯†   |
+--------+
| 7Q==   |
+--------+
select decode(from_base64('7Q=='),'key') as è§£å¯†;
+--------+
| è§£å¯†   |
+--------+
| 1      |
+--------+
select hex(encode(1,'key')) as åŠ å¯†;
+--------+
| åŠ å¯†   |
+--------+
| ED     |
+--------+
select decode(unhex('ED'),'key') as è§£å¯†;
+--------+
| è§£å¯†   |
+--------+
| 1      |
+--------+
select encode(0,'key') as åŠ å¯†;
+--------+
| åŠ å¯†   |
+--------+
| z      |
+--------+
select decode(encode(0,'key'),'key') as è§£å¯†;
+--------+
| è§£å¯†   |
+--------+
| 0      |
+--------+
select to_base64(encode(0,'key')) as åŠ å¯†;
+--------+
| åŠ å¯†   |
+--------+
| eg==   |
+--------+
select decode(from_base64('eg=='),'key') as è§£å¯†;
+--------+
| è§£å¯†   |
+--------+
| 0      |
+--------+
select hex(encode(0,'key')) as åŠ å¯†;
+--------+
| åŠ å¯†   |
+--------+
| 7A     |
+--------+
select decode(unhex('7A'),'key') as è§£å¯†;
+--------+
| è§£å¯†   |
+--------+
| 0      |
+--------+
select encode(0.01,'key') as åŠ å¯†;
+--------+
| åŠ å¯†   |
+--------+
| zÛğ+     |
+--------+
select decode(encode(0.01,'key'),'key') as è§£å¯†;
+--------+
| è§£å¯†   |
+--------+
| 0.01   |
+--------+
select to_base64(encode(0.01,'key')) as åŠ å¯†;
+----------+
| åŠ å¯†     |
+----------+
| etvwKw== |
+----------+
select decode(from_base64('etvwKw=='),'key') as è§£å¯†;
+--------+
| è§£å¯†   |
+--------+
| 0.01   |
+--------+
select hex(encode(0.01,'key')) as åŠ å¯†;
+----------+
| åŠ å¯†     |
+----------+
| 7ADBF02B |
+----------+
select decode(unhex('7ADBF02B'),'key') as è§£å¯†;
+--------+
| è§£å¯†   |
+--------+
| 0.01   |
+--------+
select encode(-1234,'key') as åŠ å¯†;
+--------+
| åŠ å¯†   |
+--------+
| ÷ÛÏ
     |
+--------+
select decode(encode(-1234,'key'),'key') as è§£å¯†;
+--------+
| è§£å¯†   |
+--------+
| -1234  |
+--------+
select to_base64(encode(-1234,'key')) as åŠ å¯†;
+----------+
| åŠ å¯†     |
+----------+
| 99vPHQo= |
+----------+
select decode(from_base64('99vPHQo='),'key') as è§£å¯†;
+--------+
| è§£å¯†   |
+--------+
| -1234  |
+--------+
select encode(1.1234e8,'key') as åŠ å¯†;
+-----------+
| åŠ å¯†      |
+-----------+
| íÇÓ)_A    |
+-----------+
select decode(encode(1.1234e8,'key'),'key') as è§£å¯†;
+-----------+
| è§£å¯†      |
+-----------+
| 112340000 |
+-----------+
select to_base64(encode(1.1234e8,'key')) as åŠ å¯†;
+--------------+
| åŠ å¯†         |
+--------------+
| 7cfTARYpXx1B |
+--------------+
select decode(from_base64('7cfTARYpXx1B'),'key') as è§£å¯†;
+-----------+
| è§£å¯†      |
+-----------+
| 112340000 |
+-----------+
select encode('helloworld','key') as åŠ å¯†;
+------------+
| åŠ å¯†       |
+------------+
| %v+3;è27    |
+------------+
select decode(encode('helloworld','key'),'key') as è§£å¯†;
+------------+
| è§£å¯†       |
+------------+
| helloworld |
+------------+
select to_base64(encode('helloworld','key')) as åŠ å¯†;
+------------------+
| åŠ å¯†             |
+------------------+
| JXadjSszO+gyNw== |
+------------------+
select decode(from_base64('JXadjSszO+gyNw=='),'key') as è§£å¯†;
+------------+
| è§£å¯†       |
+------------+
| helloworld |
+------------+
select encode('ä½ å¥½ä¸–ç•Œ','key') as åŠ å¯†;
+--------------+
| åŠ å¯†         |
+--------------+
| ‡øGªØ£§ÒšÂf        |
+--------------+
select decode(encode('ä½ å¥½ä¸–ç•Œ','key'),'key') as è§£å¯†;
+--------------+
| è§£å¯†         |
+--------------+
| ä½ å¥½ä¸–ç•Œ     |
+--------------+
select to_base64(encode('ä½ å¥½ä¸–ç•Œ','key')) as åŠ å¯†;
+------------------+
| åŠ å¯†             |
+------------------+
| h/hHqgbYo6fSmsJm |
+------------------+
select decode(from_base64('h/hHqgbYo6fSmsJm'),'key') as è§£å¯†;
+--------------+
| è§£å¯†         |
+--------------+
| ä½ å¥½ä¸–ç•Œ     |
+--------------+
select encode('123abc','key') as åŠ å¯†;
+--------+
| åŠ å¯†   |
+--------+
| ímLzS  |
+--------+
select decode(encode('123abc','key'),'key') as è§£å¯†;
+--------+
| è§£å¯†   |
+--------+
| 123abc |
+--------+
select to_base64(encode('123abc','key')) as åŠ å¯†;
+----------+
| åŠ å¯†     |
+----------+
| 7W1MehZT |
+----------+
select decode(from_base64('7W1MehZT'),'key') as è§£å¯†;
+--------+
| è§£å¯†   |
+--------+
| 123abc |
+--------+
select encode('123abcè¿™æ˜¯å¯†æ–‡','key') as åŠ å¯†;
+--------------------+
| åŠ å¯†               |
+--------------------+
| ímLzSP³zû^fYÎ’      |
+--------------------+
select decode(encode('123abcè¿™æ˜¯å¯†æ–‡','key'),'key') as è§£å¯†;
+--------------------+
| è§£å¯†               |
+--------------------+
| 123abcè¿™æ˜¯å¯†æ–‡     |
+--------------------+
select to_base64(encode('123abcè¿™æ˜¯å¯†æ–‡','key')) as åŠ å¯†;
+--------------------------+
| åŠ å¯†                     |
+--------------------------+
| 7W1MehZTULN6CxX7XmZZzpIg |
+--------------------------+
select decode(from_base64('7W1MehZTULN6CxX7XmZZzpIg'),'key') as è§£å¯†;
+--------------------+
| è§£å¯†               |
+--------------------+
| 123abcè¿™æ˜¯å¯†æ–‡     |
+--------------------+
select encode('ã“ã‚“ã«ã¡ã¯','key') as åŠ å¯†;
+-----------------+
| åŠ å¯†            |
+-----------------+
| —kÙŒÙ´!6¤Üö4•         |
+-----------------+
select decode(encode('ã“ã‚“ã«ã¡ã¯','key'),'key') as è§£å¯†;
+-----------------+
| è§£å¯†            |
+-----------------+
| ã“ã‚“ã«ã¡ã¯      |
+-----------------+
select to_base64(encode('ã“ã‚“ã«ã¡ã¯','key')) as åŠ å¯†;
+----------------------+
| åŠ å¯†                 |
+----------------------+
| l2vZjozZtCE2pNz2NA+V |
+----------------------+
select decode(from_base64('l2vZjozZtCE2pNz2NA+V'),'key') as è§£å¯†;
+-----------------+
| è§£å¯†            |
+-----------------+
| ã“ã‚“ã«ã¡ã¯      |
+-----------------+
select encode('ì•ˆë…•í•˜ì‹­ë‹ˆê¹Œ','key') as åŠ å¯†;
+--------------------+
| åŠ å¯†               |
+--------------------+
| §z¦U–t|8G´Á¼ÆO0        |
+--------------------+
select decode(encode('ì•ˆë…•í•˜ì‹­ë‹ˆê¹Œ','key'),'key') as è§£å¯†;
+--------------------+
| è§£å¯†               |
+--------------------+
| ì•ˆë…•í•˜ì‹­ë‹ˆê¹Œ       |
+--------------------+
select to_base64(encode('ì•ˆë…•í•˜ì‹­ë‹ˆê¹Œ','key')) as åŠ å¯†;
+--------------------------+
| åŠ å¯†                     |
+--------------------------+
| p3qmVZZ0fDhHtMG8xhxPFTAd |
+--------------------------+
select decode(from_base64('p3qmVZZ0fDhHtMG8xhxPFTAd'),'key') as è§£å¯†;
+--------------------+
| è§£å¯†               |
+--------------------+
| ì•ˆë…•í•˜ì‹­ë‹ˆê¹Œ       |
+--------------------+
select encode('~','key') as åŠ å¯†;
+--------+
| åŠ å¯†   |
+--------+
| Á       |
+--------+
select decode(encode('~','key'),'key') as è§£å¯†;
+--------+
| è§£å¯†   |
+--------+
| ~      |
+--------+
select encode('&','key') as åŠ å¯†;
+--------+
| åŠ å¯†   |
+--------+
| ”       |
+--------+
select decode(encode('&','key'),'key') as è§£å¯†;
+--------+
| è§£å¯†   |
+--------+
| &      |
+--------+
select encode('$','key') as åŠ å¯†;
+--------+
| åŠ å¯†   |
+--------+
|       |
+--------+
select decode(encode('$','key'),'key') as è§£å¯†;
+--------+
| è§£å¯†   |
+--------+
| $      |
+--------+
select to_base64(encode('$','key')) as åŠ å¯†;
+--------+
| åŠ å¯†   |
+--------+
| Fw==   |
+--------+
select decode(from_base64('Fw=='),'key') as è§£å¯†;
+--------+
| è§£å¯†   |
+--------+
| $      |
+--------+
select encode('@','key') as åŠ å¯†;
+--------+
| åŠ å¯†   |
+--------+
| š       |
+--------+
select decode(encode('@','key'),'key') as è§£å¯†;
+--------+
| è§£å¯†   |
+--------+
| @      |
+--------+
select encode('#','key') as åŠ å¯†;
+--------+
| åŠ å¯†   |
+--------+
|       |
+--------+
select decode(encode('#','key'),'key') as è§£å¯†;
+--------+
| è§£å¯†   |
+--------+
| #      |
+--------+
select encode('~ï¼@#ï¿¥%^&*()_+','key') as åŠ å¯†;
+-------------------+
| åŠ å¯†              |
+-------------------+
| ÁêV—+“­ÕtŞ›ßÔ           |
+-------------------+
select decode(encode('~ï¼@#ï¿¥%^&*()_+','key'),'key') as è§£å¯†;
+-------------------+
| è§£å¯†              |
+-------------------+
| ~ï¼@#ï¿¥%^&*()_+   |
+-------------------+
select to_base64(encode('~ï¼@#ï¿¥%^&*()_+','key')) as åŠ å¯†;
+--------------------------+
| åŠ å¯†                     |
+--------------------------+
| wRrqVh6XkCuTrdV03pvf1I4= |
+--------------------------+
select decode(from_base64('wRrqVh6XkCuTrdV03pvf1I4='),'key') as è§£å¯†;
+-------------------+
| è§£å¯†              |
+-------------------+
| ~ï¼@#ï¿¥%^&*()_+   |
+-------------------+
select encode(null,'key') as åŠ å¯†;
+--------+
| åŠ å¯†   |
+--------+
| NULL   |
+--------+
select decode(encode(null,'key'),'key') as è§£å¯†;
+--------+
| è§£å¯†   |
+--------+
| NULL   |
+--------+
select to_base64(encode(null,'key')) as åŠ å¯†;
+--------+
| åŠ å¯†   |
+--------+
| NULL   |
+--------+
select decode(from_base64(null),'key') as è§£å¯†;
+--------+
| è§£å¯†   |
+--------+
| NULL   |
+--------+
select encode('','key') as åŠ å¯†;
+--------+
| åŠ å¯†   |
+--------+
|        |
+--------+
select decode(encode('','key'),'key') as è§£å¯†;
+--------+
| è§£å¯†   |
+--------+
|        |
+--------+
select to_base64(encode('','key')) as åŠ å¯†;
+--------+
| åŠ å¯†   |
+--------+
|        |
+--------+
select decode(from_base64(''),'key') as è§£å¯†;
+--------+
| è§£å¯†   |
+--------+
|        |
+--------+
select encode(' ','key') as åŠ å¯†;
+--------+
| åŠ å¯†   |
+--------+
| (      |
+--------+
select decode(encode(' ','key'),'key') as è§£å¯†;
+--------+
| è§£å¯†   |
+--------+
|        |
+--------+
select to_base64(encode(' ','key')) as åŠ å¯†;
+--------+
| åŠ å¯†   |
+--------+
| KA==   |
+--------+
select decode(from_base64('KA=='),'key') as è§£å¯†;
+--------+
| è§£å¯†   |
+--------+
|        |
+--------+
select encode(true,'key') as åŠ å¯†;
+--------+
| åŠ å¯†   |
+--------+
| í       |
+--------+
select decode(encode(true,'key'),'key') as è§£å¯†;
+--------+
| è§£å¯†   |
+--------+
| 1      |
+--------+
select to_base64(encode(true,'key')) as åŠ å¯†;
+--------+
| åŠ å¯†   |
+--------+
| 7Q==   |
+--------+
select decode(from_base64('7Q=='),'key') as è§£å¯†;
+--------+
| è§£å¯†   |
+--------+
| 1      |
+--------+
select encode(false,'key') as åŠ å¯†;
+--------+
| åŠ å¯†   |
+--------+
| z      |
+--------+
select decode(encode(false,'key'),'key') as è§£å¯†;
+--------+
| è§£å¯†   |
+--------+
| 0      |
+--------+
select to_base64(encode(false,'key')) as åŠ å¯†;
+--------+
| åŠ å¯†   |
+--------+
| eg==   |
+--------+
select decode(from_base64('eg=='),'key') as è§£å¯†;
+--------+
| è§£å¯†   |
+--------+
| 0      |
+--------+
select encode(1000000000000000000000000000000000000000000000000000000000000000000000000000000000,'key') as åŠ å¯†;
+------------------------------------------------------------------------------------+
| åŠ å¯†                                                                               |
+------------------------------------------------------------------------------------+
| íPï£S-[E²êÑ=?j8¶	¬¢æXZ§]æ¢hµ;ú±MüŞRAÎ.mU¨vE÷ó¸Gì@J7Ò¤KğÙ5 ³;¤ßˆœ,
×ƒ™                                 |
+------------------------------------------------------------------------------------+
select decode(encode(1000000000000000000000000000000000000000000000000000000000000000000000000000000000,'key'),'key') as è§£å¯†;
+------------------------------------------------------------------------------------+
| è§£å¯†                                                                               |
+------------------------------------------------------------------------------------+
| 1000000000000000000000000000000000000000000000000000000000000000000000000000000000 |
+------------------------------------------------------------------------------------+
select encode(99999999999999999999999999999999999999999999999999999999999999999,'key') as åŠ å¯†;
+-------------------------------------------------------------------+
| åŠ å¯†                                                              |
+-------------------------------------------------------------------+
| öÔb'Ş©ÖÈ6n\¹²îµ2„(/bÕ†×#Ğb&˜ì8¿w5ÉxSÖ•ÌJ‰£éØ,û‚Ès~<ÊhÍÎºV)                                 |
+-------------------------------------------------------------------+
select decode(encode(99999999999999999999999999999999999999999999999999999999999999999,'key'),'key') as è§£å¯†;
+-------------------------------------------------------------------+
| è§£å¯†                                                              |
+-------------------------------------------------------------------+
| 99999999999999999999999999999999999999999999999999999999999999999 |
+-------------------------------------------------------------------+
select to_base64(encode(99999999999999999999999999999999999999999999999999999999999999999,'key')) as åŠ å¯†;
+-------------------------------------------------------------------------------------------+
| åŠ å¯†                                                                                      |
+-------------------------------------------------------------------------------------------+
| 9tRiJ96p1p3INpBuXLmy7rUyhCgvYtWG1yPQYgImmOw4v3c1nsmeeFPWlYHMShOJo+nYLPuCyHN+
PMpozc66Vik= |
+-------------------------------------------------------------------------------------------+
select decode(from_base64('9tRiJ96p1p3INpBuXLmy7rUyhCgvYtWG1yPQYgImmOw4v3c1nsmeeFPWlYHMShOJo+nYLPuCyHN+PMpozc66Vik='),'key') as è§£å¯†;
+-------------------------------------------------------------------+
| è§£å¯†                                                              |
+-------------------------------------------------------------------+
| 99999999999999999999999999999999999999999999999999999999999999999 |
+-------------------------------------------------------------------+
select encode(10000000000000000000000000000000000000000000000000000000000000000000000000000000000000000000000,'key') as åŠ å¯†;
+-------------------------------------------------------------------------------------------------+
| åŠ å¯†                                                                                            |
+-------------------------------------------------------------------------------------------------+
| íPï£S-[E²êÑ=?j8¶	¬¢æXZ§]æ¢hµ;ú±MüŞRAÎ.mU¨vE÷ó¸Gì@J7Ò¤KğÙ5 ³;¤ßˆœ,
×ƒ™ı'2HÁ2¥b°                                      |
+-------------------------------------------------------------------------------------------------+
select decode(encode(10000000000000000000000000000000000000000000000000000000000000000000000000000000000000000000000,'key'),'key') as è§£å¯†;
+-------------------------------------------------------------------------------------------------+
| è§£å¯†                                                                                            |
+-------------------------------------------------------------------------------------------------+
| 10000000000000000000000000000000000000000000000000000000000000000000000000000000000000000000000 |
+-------------------------------------------------------------------------------------------------+
select to_base64(encode(10000000000000000000000000000000000000000000000000000000000000000000000000000000000000000000000,'key')) as åŠ å¯†;
+-----------------------------------------------------------------------------------------------------------------------------------+
| åŠ å¯†                                                                                                                              |
+-----------------------------------------------------------------------------------------------------------------------------------+
| 7VDvo1MtWxlFsh3q0T0/aji2Cayi5lgCWqdd5o+iFWi1O/qxE00T/N5SGAVBzp4NLm1VqHYGRffz
uEfsQEo30qRL8Nk1ALMHO6TfiJwsCteDmQ/9ESeQMkjBMqVisAg= |
+-----------------------------------------------------------------------------------------------------------------------------------+
select decode(from_base64('7VDvo1MtWxlFsh3q0T0/aji2Cayi5lgCWqdd5o+iFWi1O/qxE00T/N5SGAVBzp4NLm1VqHYGRffz
uEfsQEo30qRL8Nk1ALMHO6TfiJwsCteDmQ/9ESeQMkjBMqVisAg='),'key') as è§£å¯†;
+-------------------------------------------------------------------------------------------------+
| è§£å¯†                                                                                            |
+-------------------------------------------------------------------------------------------------+
| 10000000000000000000000000000000000000000000000000000000000000000000000000000000000000000000000 |
+-------------------------------------------------------------------------------------------------+
select encode(rpad('ä¸€',100,'ä¸€'),'key') as åŠ å¯†;
+--------------------------------------------------------------------------------------------------------------------------------------------------------------------------------------------------------------------------------------------------------------------------------------------------------------+
| åŠ å¯†                                                                                                                                                                                                                                                                                                         |
+--------------------------------------------------------------------------------------------------------------------------------------------------------------------------------------------------------------------------------------------------------------------------------------------------------------+
| ‡ê`³N§£Ê¢K‰-‡°znÕõ-öa¦ÒöÙÁéÒ:+¬Òï÷œìˆ1ä¿ÎŞÈnÒ×Ú¸ e¹M|¨¼ğ¸Âò(cºådÇP˜ÊOöm‰Yí"¢Îí ^Y™É¿À")â!)®h;ê¿ˆóóıõ«}zİÅw<îÃ².hÖø× &NÙhÀÇT?&)É^"7{5×v®³˜
ë·ÿép.¹)ÎÂ‘Æ±¨äáø`9êÀ—ÓÛÓ†;¥tq™äˆ·À§G×R4å²˜y·ıñ&n¤^=ºˆQ|ó¬Õ‚£^îaÃÆMşıQÚ3:0OO	Êh¶Ã[èÔ²ƒuˆ2†ºøiµ?¯õê‡YXìáş^(ıFÃ@                                                                                                                                                           |
+--------------------------------------------------------------------------------------------------------------------------------------------------------------------------------------------------------------------------------------------------------------------------------------------------------------+
select decode(encode(rpad('ä¸€',100,'ä¸€'),'key'),'key') as è§£å¯†;
+--------------------------------------------------------------------------------------------------------------------------------------------------------------------------------------------------------------------------------------------------------------------------------------------------------------+
| è§£å¯†                                                                                                                                                                                                                                                                                                         |
+--------------------------------------------------------------------------------------------------------------------------------------------------------------------------------------------------------------------------------------------------------------------------------------------------------------+
| ä¸€ä¸€ä¸€ä¸€ä¸€ä¸€ä¸€ä¸€ä¸€ä¸€ä¸€ä¸€ä¸€ä¸€ä¸€ä¸€ä¸€ä¸€ä¸€ä¸€ä¸€ä¸€ä¸€ä¸€ä¸€ä¸€ä¸€ä¸€ä¸€ä¸€ä¸€ä¸€ä¸€ä¸€ä¸€ä¸€ä¸€ä¸€ä¸€ä¸€ä¸€ä¸€ä¸€ä¸€ä¸€ä¸€ä¸€ä¸€ä¸€ä¸€ä¸€ä¸€ä¸€ä¸€ä¸€ä¸€ä¸€ä¸€ä¸€ä¸€ä¸€ä¸€ä¸€ä¸€ä¸€ä¸€ä¸€ä¸€ä¸€ä¸€ä¸€ä¸€ä¸€ä¸€ä¸€ä¸€ä¸€ä¸€ä¸€ä¸€ä¸€ä¸€ä¸€ä¸€ä¸€ä¸€ä¸€ä¸€ä¸€ä¸€ä¸€ä¸€ä¸€ä¸€ä¸€ä¸€ä¸€ä¸€ä¸€ä¸€                                                                                                     |
+--------------------------------------------------------------------------------------------------------------------------------------------------------------------------------------------------------------------------------------------------------------------------------------------------------------+
select encode(time'01:02:03','key') as åŠ å¯†;
+----------+
| åŠ å¯†     |
+----------+
| zÆq©d»Yº     |
+----------+
select decode(encode(time'01:02:03','key'),'key') as è§£å¯†;
+----------+
| è§£å¯†     |
+----------+
| 01:02:03 |
+----------+
select to_base64(encode(time'01:02:03','key')) as åŠ å¯†;
+--------------+
| åŠ å¯†         |
+--------------+
| esZxqWS7Wbo= |
+--------------+
select decode(from_base64('esZxqWS7Wbo='),'key') as è§£å¯†;
+----------+
| è§£å¯†     |
+----------+
| 01:02:03 |
+----------+
select encode(date'2022-10-14','key') as åŠ å¯†;
+------------+
| åŠ å¯†       |
+------------+
| GSÑŸİ¤D‹Ğô      |
+------------+
select decode(encode(date'2022-10-14','key'),'key') as è§£å¯†;
+------------+
| è§£å¯†       |
+------------+
| 2022-10-14 |
+------------+
select to_base64(encode(date'2022-10-14','key')) as åŠ å¯†;
+------------------+
| åŠ å¯†             |
+------------------+
| R1PRn92kRIvQ9A== |
+------------------+
select decode(from_base64('R1PRn92kRIvQ9A=='),'key') as è§£å¯†;
+------------+
| è§£å¯†       |
+------------+
| 2022-10-14 |
+------------+
select encode(date'2022-10-14','key') as åŠ å¯†;
+------------+
| åŠ å¯†       |
+------------+
| GSÑŸİ¤D‹Ğô      |
+------------+
select decode(encode(date'2022-10-14','key'),'key') as è§£å¯†;
+------------+
| è§£å¯†       |
+------------+
| 2022-10-14 |
+------------+
select to_base64(encode(date'2022-10-14','key')) as åŠ å¯†;
+------------------+
| åŠ å¯†             |
+------------------+
| R1PRn92kRIvQ9A== |
+------------------+
select decode(from_base64('R1PRn92kRIvQ9A=='),'key') as è§£å¯†;
+------------+
| è§£å¯†       |
+------------+
| 2022-10-14 |
+------------+
select encode(timestamp'2022-10-14 11:11:11','key') as åŠ å¯†;
+---------------------+
| åŠ å¯†                |
+---------------------+
| GSÑŸİ¤D‹ĞôHjP´µá»6ˆ           |
+---------------------+
select decode(encode(timestamp'2022-10-14 11:11:11','key'),'key') as è§£å¯†;
+---------------------+
| è§£å¯†                |
+---------------------+
| 2022-10-14 11:11:11 |
+---------------------+
select to_base64(encode(timestamp'2022-10-14 11:11:11','key')) as åŠ å¯†;
+------------------------------+
| åŠ å¯†                         |
+------------------------------+
| R1PRn92kRIvQ9EhqULS14bs2iA== |
+------------------------------+
select decode(from_base64('R1PRn92kRIvQ9EhqULS14bs2iA=='),'key') as è§£å¯†;
+---------------------+
| è§£å¯†                |
+---------------------+
| 2022-10-14 11:11:11 |
+---------------------+
drop table t1;
create table t1(
c1 time,
c2 date,
c3 year,
c4 datetime,
c5 timestamp);
insert into t1 values('01:02:03','2022-10-14','2022','2022-10-14 11:11:11','2022-10-14 11:11:11.123456');
insert into t1 values('02:02:03','2022-10-15','2022','2022-10-15 11:11:11','2022-10-15 11:11:11.123456');
insert into t1 values('03:02:03','2022-10-16','2022','2022-10-16 11:11:11','2022-10-16 11:11:11.123456');
insert into t1 values('04:02:03','2022-10-17','2022','2022-10-17 11:11:11','2022-10-17 11:11:11.123456');
select * from t1;
+----------+------------+------+---------------------+---------------------+
| c1       | c2         | c3   | c4                  | c5                  |
+----------+------------+------+---------------------+---------------------+
| 01:02:03 | 2022-10-14 | 2022 | 2022-10-14 11:11:11 | 2022-10-14 11:11:11 |
| 02:02:03 | 2022-10-15 | 2022 | 2022-10-15 11:11:11 | 2022-10-15 11:11:11 |
| 03:02:03 | 2022-10-16 | 2022 | 2022-10-16 11:11:11 | 2022-10-16 11:11:11 |
| 04:02:03 | 2022-10-17 | 2022 | 2022-10-17 11:11:11 | 2022-10-17 11:11:11 |
+----------+------------+------+---------------------+---------------------+
select encode(c1,'passwordstring') as c1,encode(c2,'passwordstring') as c2,encode(c3,'passwordstring') as c3,
encode(c4,'passwordstring') as c4,encode(c5,'passwordstring') as c5 from t1;
+----------+------------+------+---------------------+---------------------+
| c1       | c2         | c3   | c4                  | c5                  |
+----------+------------+------+---------------------+---------------------+
| ¼fUOnüíI    | ·nêL¯ğ©¶P       | ·nê   | ·nêL¯ğ©¶PâÇÂøÃÕd¶              | ·nêL¯ğ©¶PâÇÂøÃÕd¶              |
| ¼VLmÿîJ    | ·nêL¯ğ©¶Ó        | ·nê   | ·nêL¯ğ©¶ÓãÆÃùÂÔe·               | ·nêL¯ğ©¶ÓãÆÃùÂÔe·               |
| ¼ÍWMlşïK     | ·nêL¯ğ©¶Ï        | ·nê   | ·nêL¯ğ©¶ÏàÅÀúÁ×f´               | ·nêL¯ğ©¶ÏàÅÀúÁ×f´               |
| ¼‚PJkùèL     | ·nêL¯ğ©¶#       | ·nê   | ·nêL¯ğ©¶#áÄÁûÀÖgµ              | ·nêL¯ğ©¶#áÄÁûÀÖgµ              |
+----------+------------+------+---------------------+---------------------+
select decode(encode(c1,'passwordstring'),'passwordstring') as c1,decode(encode(c2,'passwordstring'),'passwordstring') as c2,
decode(encode(c3,'passwordstring'),'passwordstring') as c3,decode(encode(c4,'passwordstring'),'passwordstring') as c4,
decode(encode(c5,'passwordstring'),'passwordstring') as c5 from t1;
+----------+------------+------+---------------------+---------------------+
| c1       | c2         | c3   | c4                  | c5                  |
+----------+------------+------+---------------------+---------------------+
| 01:02:03 | 2022-10-14 | 2022 | 2022-10-14 11:11:11 | 2022-10-14 11:11:11 |
| 02:02:03 | 2022-10-15 | 2022 | 2022-10-15 11:11:11 | 2022-10-15 11:11:11 |
| 03:02:03 | 2022-10-16 | 2022 | 2022-10-16 11:11:11 | 2022-10-16 11:11:11 |
| 04:02:03 | 2022-10-17 | 2022 | 2022-10-17 11:11:11 | 2022-10-17 11:11:11 |
+----------+------------+------+---------------------+---------------------+
select encode('str',c1) as c1,encode('str',c2) as c2,encode('str',c3) as c3,
encode('str',c4) as c4,encode('str',c5) as c5 from t1;
+------+------+------+------+------+
| c1   | c2   | c3   | c4   | c5   |
+------+------+------+------+------+
| 8.  | ¯²j    | ÉÔş     | /ı£    | /ı£    |
| ÓBm   | 1#ÿ   | ÉÔş     | ìœÙ     | ìœÙ     |
| ¸Cø    | Æ¦‰    | ÉÔş     | YÂ   | YÂ   |
| zÑ   | ¥ïá     | ÉÔş     | «gS   | «gS   |
+------+------+------+------+------+
select decode(encode('str1',c1),c1) as c1,decode(encode('str2',c2),c2) as c2,
decode(encode('str3',c3),c3) as c3,decode(encode('str4',c4),c4) as c4,
decode(encode('str5',c5),c5) as c5 from t1;
+------+------+------+------+------+
| c1   | c2   | c3   | c4   | c5   |
+------+------+------+------+------+
| str1 | str2 | str3 | str4 | str5 |
| str1 | str2 | str3 | str4 | str5 |
| str1 | str2 | str3 | str4 | str5 |
| str1 | str2 | str3 | str4 | str5 |
+------+------+------+------+------+
drop table t1;
create table t1(
c1 tinyint,
c2 smallint,
c3 mediumint,
c4 int,
c5 bigint,
c6 decimal(5,2),
c7 float,
c8 double,
c9 bit(64)
);
insert into t1() values(1,2,3,4,5,6,7,8,9);
insert into t1() values(11,22,33,44,55,66,77,88,99);
insert into t1() values(111,222,333,444,555,666,777,888,999);
select c1,c2,c3,c4,c5,c6,c7,c8,c9+0 from t1;
+------+------+------+------+------+--------+------+------+------+
| c1   | c2   | c3   | c4   | c5   | c6     | c7   | c8   | c9+0 |
+------+------+------+------+------+--------+------+------+------+
|    1 |    2 |    3 |    4 |    5 |   6.00 |    7 |    8 |    9 |
|   11 |   22 |   33 |   44 |   55 |  66.00 |   77 |   88 |   99 |
|  111 |  222 |  333 |  444 |  555 | 666.00 |  777 |  888 |  999 |
+------+------+------+------+------+--------+------+------+------+
select encode(c1,'passwordstring') as c1,encode(c2,'passwordstring') as c2,encode(c3,'passwordstring') as c3,
encode(c4,'passwordstring') as c4,encode(c5,'passwordstring') as c5,encode(c6,'passwordstring') as c6,
encode(c7,'passwordstring') as c7,encode(c8,'passwordstring') as c8,encode(c9,'passwordstring') as c9
from t1;
+------+------+------+------+------+--------+------+------+----------+
| c1   | c2   | c3   | c4   | c5   | c6     | c7   | c8   | c9       |
+------+------+------+------+------+--------+------+------+----------+
| o    |     | Ä     | ‹     |     | "Ú\    | ø     | µ     | ¥œÛmÒJ÷+      |
| og   |    | ÄÎ     | ‹†     |    | SZÕ   | øö     | µ´     | ¥œÛmÒJ÷f      |
| og  | l  | ÄÎº    | ‹†õ     | v  | jÓÓ{   | øö†     | µ´Ë     | ¥œÛmÒJÔZ      |
+------+------+------+------+------+--------+------+------+----------+
select 
decode(encode(c1,'passwordstring'),'passwordstring') as c1,
decode(encode(c2,'passwordstring'),'passwordstring') as c2,
decode(encode(c3,'passwordstring'),'passwordstring') as c3,
decode(encode(c4,'passwordstring'),'passwordstring') as c4,
decode(encode(c5,'passwordstring'),'passwordstring') as c5,
decode(encode(c6,'passwordstring'),'passwordstring') as c6,
decode(encode(c7,'passwordstring'),'passwordstring') as c7,
decode(encode(c8,'passwordstring'),'passwordstring') as c8,
decode(encode(c9,'passwordstring'),'passwordstring') as c9
from t1;
+------+------+------+------+------+--------+------+------+----------+
| c1   | c2   | c3   | c4   | c5   | c6     | c7   | c8   | c9       |
+------+------+------+------+------+--------+------+------+----------+
| 1    | 2    | 3    | 4    | 5    | 6.00   | 7    | 8    |        	 |
| 11   | 22   | 33   | 44   | 55   | 66.00  | 77   | 88   |        c |
| 111  | 222  | 333  | 444  | 555  | 666.00 | 777  | 888  |       ç  |
+------+------+------+------+------+--------+------+------+----------+
select encode('str',c1) as c1,
encode('str',c2) as c2,
encode('str',c3) as c3,
encode('str',c4) as c4,
encode('str',c5) as c5,
encode('str',c6) as c6,
encode('str',c7) as c7,
encode('str',c8) as c8,
encode('str',c9) as c9
from t1;
+------+------+------+------+------+------+------+------+------+
| c1   | c2   | c3   | c4   | c5   | c6   | c7   | c8   | c9   |
+------+------+------+------+------+------+------+------+------+
| 3°­    | Oå   | M  | ,ç    | oUx  | l·L   | «La   | 8¥h   | oI<  |
| Ew¶   | ¹Ü
    | ,ƒZ   | *ïã    | Z¾   | ß¦¨    | I·ß    | ı};   | ]–Ê    |
| 0X‹   | ûV„    | v®ò    | *¼    | 6u  | M“Õ    | GP  | 2·»    | s®%   |
+------+------+------+------+------+------+------+------+------+
select decode(encode('str1',c1),c1) as c1,
decode(encode('str2',c2),c2) as c2,
decode(encode('str3',c3),c3) as c3,
decode(encode('str4',c4),c4) as c4,
decode(encode('str5',c5),c5) as c5,
decode(encode('str6',c6),c6) as c6,
decode(encode('str7',c7),c7) as c7,
decode(encode('str8',c8),c8) as c8,
decode(encode('str9',c9),c9) as c9
from t1;
+------+------+------+------+------+------+------+------+------+
| c1   | c2   | c3   | c4   | c5   | c6   | c7   | c8   | c9   |
+------+------+------+------+------+------+------+------+------+
| str1 | str2 | str3 | str4 | str5 | str6 | str7 | str8 | str9 |
| str1 | str2 | str3 | str4 | str5 | str6 | str7 | str8 | str9 |
| str1 | str2 | str3 | str4 | str5 | str6 | str7 | str8 | str9 |
+------+------+------+------+------+------+------+------+------+
drop table t1;
create table t1(
c1 char(2),
c2 varchar(255),
c3 tinyblob,
c4 tinytext,
c5 blob,
c6 text,
c7 mediumblob,
c8 mediumtext,
c9 longblob,
c10 longtext
);
insert into t1() values('å¯Œå¼º','æ°‘ä¸»','æ–‡æ˜','å’Œè°','è‡ªç”±','å¹³ç­‰','å…¬æ­£','æ³•æ²»','çˆ±å›½','æ•¬ä¸š');
select 
encode(c1,'passwordstring') as c1,
encode(c2,'passwordstring') as c2,
encode(c3,'passwordstring') as c3,
encode(c4,'passwordstring') as c4,
encode(c5,'passwordstring') as c5,
encode(c6,'passwordstring') as c6,
encode(c7,'passwordstring') as c7,
encode(c8,'passwordstring') as c8,
encode(c9,'passwordstring') as c9,
encode(c10,'passwordstring') as c10
from t1;
+--------+--------+--------+--------+--------+--------+--------+--------+--------+--------+
| c1     | c2     | c3     | c4     | c5     | c6     | c7     | c8     | c9     | c10    |
+--------+--------+--------+--------+--------+--------+--------+--------+--------+--------+
| ò"8     | V3Ãc  | Vvki#I | Ø¥ºõ      | –´÷ê|H     | ÃÀÁ     | 4Rãx    | V>ô^§   | çG ™~ÿ    | V ƒÛ{s   |
+--------+--------+--------+--------+--------+--------+--------+--------+--------+--------+
select 
decode(encode(c1,'passwordstring'),'passwordstring') as c1,
decode(encode(c2,'passwordstring'),'passwordstring') as c2,
decode(encode(c3,'passwordstring'),'passwordstring') as c3,
decode(encode(c4,'passwordstring'),'passwordstring') as c4,
decode(encode(c5,'passwordstring'),'passwordstring') as c5,
decode(encode(c6,'passwordstring'),'passwordstring') as c6,
decode(encode(c7,'passwordstring'),'passwordstring') as c7,
decode(encode(c8,'passwordstring'),'passwordstring') as c8,
decode(encode(c9,'passwordstring'),'passwordstring') as c9,
decode(encode(c10,'passwordstring'),'passwordstring') as c10
from t1;
+--------+--------+--------+--------+--------+--------+--------+--------+--------+--------+
| c1     | c2     | c3     | c4     | c5     | c6     | c7     | c8     | c9     | c10    |
+--------+--------+--------+--------+--------+--------+--------+--------+--------+--------+
| å¯Œå¼º   | æ°‘ä¸»   | æ–‡æ˜   | å’Œè°   | è‡ªç”±   | å¹³ç­‰   | å…¬æ­£   | æ³•æ²»   | çˆ±å›½   | æ•¬ä¸š   |
+--------+--------+--------+--------+--------+--------+--------+--------+--------+--------+
select encode('str',c1) as c1,
encode('str',c2) as c2,
encode('str',c3) as c3,
encode('str',c4) as c4,
encode('str',c5) as c5,
encode('str',c6) as c6,
encode('str',c7) as c7,
encode('str',c8) as c8,
encode('str',c9) as c9,
encode('str',c10) as c10
from t1;
+------+------+------+------+------+------+------+------+------+------+
| c1   | c2   | c3   | c4   | c5   | c6   | c7   | c8   | c9   | c10  |
+------+------+------+------+------+------+------+------+------+------+
| ¤Êx    | ˆÀÁ     | îuš    | lß6   | F•€    | Œ«S    | %°Û    | @Ä†   | "+=  | wG  |
+------+------+------+------+------+------+------+------+------+------+
select decode(encode('str1',c1),c1) as c1,
decode(encode('str2',c2),c2) as c2,
decode(encode('str3',c3),c3) as c3,
decode(encode('str4',c4),c4) as c4,
decode(encode('str5',c5),c5) as c5,
decode(encode('str6',c6),c6) as c6,
decode(encode('str7',c7),c7) as c7,
decode(encode('str8',c8),c8) as c8,
decode(encode('str9',c9),c9) as c9,
decode(encode('str10',c10),c10) as c10
from t1;
+------+------+------+------+------+------+------+------+------+-------+
| c1   | c2   | c3   | c4   | c5   | c6   | c7   | c8   | c9   | c10   |
+------+------+------+------+------+------+------+------+------+-------+
| str1 | str2 | str3 | str4 | str5 | str6 | str7 | str8 | str9 | str10 |
+------+------+------+------+------+------+------+------+------+-------+
drop table t1;
create table t1(
c1 enum('è¯šä¿¡','å‹å–„'),
c2 set('æ­å·','é‡‘å','è¡¢å·')
);
insert into t1() values('è¯šä¿¡','æ­å·,é‡‘å');
insert into t1() values('å‹å–„','æ­å·,è¡¢å·');
select * from t1;
+--------+---------------+
| c1     | c2            |
+--------+---------------+
| è¯šä¿¡   | æ­å·,é‡‘å     |
| å‹å–„   | æ­å·,è¡¢å·     |
+--------+---------------+
select 
encode(c1,'passwordstring') as c1,
encode(c2,'passwordstring') as c2
from t1;
+--------+---------------+
| c1     | c2            |
+--------+---------------+
| –ÿ&Ùè«      | VÊ»‘ü4U `ª¸1      |
| ¶¦Úá      | VÊ»‘ü4UÆØkÅo       |
+--------+---------------+
select 
decode(encode(c1,'passwordstring'),'passwordstring') as c1,
decode(encode(c2,'passwordstring'),'passwordstring') as c2
from t1;
+--------+---------------+
| c1     | c2            |
+--------+---------------+
| è¯šä¿¡   | æ­å·,é‡‘å     |
| å‹å–„   | æ­å·,è¡¢å·     |
+--------+---------------+
select encode('str',c1) as c1,
encode('str',c2) as c2
from t1;
+------+------+
| c1   | c2   |
+------+------+
| »¸     | ¬š7    |
| w‘   | —aû    |
+------+------+
select decode(encode('str1',c1),c1) as c1,
decode(encode('str2',c2),c2) as c2
from t1;
+------+------+
| c1   | c2   |
+------+------+
| str1 | str2 |
| str1 | str2 |
+------+------+
#å‚æ•°2
select encode('str',1) as åŠ å¯†;
+--------+
| åŠ å¯†   |
+--------+
| 3°­      |
+--------+
select decode(encode('str',1),1) as è§£å¯†;
+--------+
| è§£å¯†   |
+--------+
| str    |
+--------+
select encode('str',0) as åŠ å¯†;
+--------+
| åŠ å¯†   |
+--------+
| i#     |
+--------+
select decode(encode('str',0),0) as è§£å¯†;
+--------+
| è§£å¯†   |
+--------+
| str    |
+--------+
select encode('str',0.001) as åŠ å¯†;
+--------+
| åŠ å¯†   |
+--------+
| :Ó     |
+--------+
select decode(encode('str',0.001),0.001) as è§£å¯†;
+--------+
| è§£å¯†   |
+--------+
| str    |
+--------+
select encode('str',-999) as åŠ å¯†;
+--------+
| åŠ å¯†   |
+--------+
| ¯9ÿ      |
+--------+
select decode(encode('str',-999),-999) as è§£å¯†;
+--------+
| è§£å¯†   |
+--------+
| str    |
+--------+
select encode('str',1.234e4) as åŠ å¯†;
+--------+
| åŠ å¯†   |
+--------+
| ·ğ      |
+--------+
select decode(encode('str',1.234e4),1.234e4) as è§£å¯†;
+--------+
| è§£å¯†   |
+--------+
| str    |
+--------+
select encode('str','passwordstring') as åŠ å¯†;
+--------+
| åŠ å¯†   |
+--------+
| üzL     |
+--------+
select decode(encode('str','passwordstring'),'passwordstring') as è§£å¯†;
+--------+
| è§£å¯†   |
+--------+
| str    |
+--------+
select encode('str','è¿™æ˜¯ä¸€ä¸ªå¯†ç ') as åŠ å¯†;
+--------+
| åŠ å¯†   |
+--------+
| ŠÅ      |
+--------+
select decode(encode('str','è¿™æ˜¯ä¸€ä¸ªå¯†ç '),'è¿™æ˜¯ä¸€ä¸ªå¯†ç ') as è§£å¯†;
+--------+
| è§£å¯†   |
+--------+
| str    |
+--------+
select encode('str','111aaa') as åŠ å¯†;
+--------+
| åŠ å¯†   |
+--------+
| xx    |
+--------+
select decode(encode('str','111aaa'),'111aaa') as è§£å¯†;
+--------+
| è§£å¯†   |
+--------+
| str    |
+--------+
select encode('str','å¯†ç 123abc') as åŠ å¯†;
+--------+
| åŠ å¯†   |
+--------+
| ûŠä       |
+--------+
select decode(encode('str','å¯†ç 123abc'),'å¯†ç 123abc') as è§£å¯†;
+--------+
| è§£å¯†   |
+--------+
| str    |
+--------+
select encode('str','ã“ã‚“ã«ã¡ã¯') as åŠ å¯†;
+--------+
| åŠ å¯†   |
+--------+
| ™     |
+--------+
select decode(encode('str','ã“ã‚“ã«ã¡ã¯'),'ã“ã‚“ã«ã¡ã¯') as è§£å¯†;
+--------+
| è§£å¯†   |
+--------+
| str    |
+--------+
select encode('str','ì•ˆë…•í•˜ì‹­ë‹ˆê¹Œ') as åŠ å¯†;
+--------+
| åŠ å¯†   |
+--------+
| ´¸      |
+--------+
select decode(encode('str','ì•ˆë…•í•˜ì‹­ë‹ˆê¹Œ'),'ì•ˆë…•í•˜ì‹­ë‹ˆê¹Œ') as è§£å¯†;
+--------+
| è§£å¯†   |
+--------+
| str    |
+--------+
select encode('str','~') as åŠ å¯†;
+--------+
| åŠ å¯†   |
+--------+
| »[     |
+--------+
select decode(encode('str','~'),'~') as è§£å¯†;
+--------+
| è§£å¯†   |
+--------+
| str    |
+--------+
select encode('str','~ï¼@#ï¿¥%â€¦â€¦&*') as åŠ å¯†;
+--------+
| åŠ å¯†   |
+--------+
| ã6      |
+--------+
select decode(encode('str','~ï¼@#ï¿¥%â€¦â€¦&*'),'~ï¼@#ï¿¥%â€¦â€¦&*') as è§£å¯†;
+--------+
| è§£å¯†   |
+--------+
| str    |
+--------+
select encode('str',null) as åŠ å¯†;
+--------+
| åŠ å¯†   |
+--------+
| NULL   |
+--------+
select decode(encode('str',null),null) as è§£å¯†;
+--------+
| è§£å¯†   |
+--------+
| NULL   |
+--------+
select encode('str','') as åŠ å¯†;
+--------+
| åŠ å¯†   |
+--------+
| ”Ùa      |
+--------+
select decode(encode('str',''),'') as è§£å¯†;
+--------+
| è§£å¯†   |
+--------+
| str    |
+--------+
select encode('str',' ') as åŠ å¯†;
+--------+
| åŠ å¯†   |
+--------+
| ”Ùa      |
+--------+
select decode(encode('str',' '),' ') as è§£å¯†;
+--------+
| è§£å¯†   |
+--------+
| str    |
+--------+
select encode('str',true) as åŠ å¯†;
+--------+
| åŠ å¯†   |
+--------+
| 3°­      |
+--------+
select decode(encode('str',true),true) as è§£å¯†;
+--------+
| è§£å¯†   |
+--------+
| str    |
+--------+
select encode('str',false) as åŠ å¯†;
+--------+
| åŠ å¯†   |
+--------+
| i#     |
+--------+
select decode(encode('str',false),false) as è§£å¯†;
+--------+
| è§£å¯†   |
+--------+
| str    |
+--------+
select encode('str','\n') as åŠ å¯†;
+--------+
| åŠ å¯†   |
+--------+
| åcÏ      |
+--------+
select decode(encode('str','\n'),'\n') as è§£å¯†;
+--------+
| è§£å¯†   |
+--------+
| str    |
+--------+
select encode('str',10000000000000000000000000000000000000000000000000000000000000000000000000000000000000000000) as åŠ å¯†;
+--------+
| åŠ å¯†   |
+--------+
| æ{@     |
+--------+
select decode(encode('str',10000000000000000000000000000000000000000000000000000000000000000000000000000000000000000000),
10000000000000000000000000000000000000000000000000000000000000000000000000000000000000000000) as è§£å¯†;
+--------+
| è§£å¯†   |
+--------+
| str    |
+--------+
select encode('str',rpad('å¯†ç ',100,'å¯†ç ')) as åŠ å¯†;
+--------+
| åŠ å¯†   |
+--------+
| Õ£d     |
+--------+
select decode(encode('str',rpad('å¯†ç ',100,'å¯†ç ')),rpad('å¯†ç ',100,'å¯†ç ')) as è§£å¯†;
+--------+
| è§£å¯†   |
+--------+
| str    |
+--------+
select encode('str',rpad('å¯†ç ',10,'å¯†ç ')) as åŠ å¯†;
+--------+
| åŠ å¯†   |
+--------+
| @*Å     |
+--------+
select decode(encode('str',rpad('å¯†ç ',10,'å¯†ç ')),'å¯†ç å¯†ç å¯†ç å¯†ç å¯†ç ') as è§£å¯†;
+--------+
| è§£å¯†   |
+--------+
| str    |
+--------+
select encode('str',time'01:02:03') as åŠ å¯†;
+--------+
| åŠ å¯†   |
+--------+
| 8.    |
+--------+
select decode(encode('str',time'01:02:03'),time'01:02:03') as è§£å¯†;
+--------+
| è§£å¯†   |
+--------+
| str    |
+--------+
select encode('str',date'2022-10-14') as åŠ å¯†;
+--------+
| åŠ å¯†   |
+--------+
| ¯²j      |
+--------+
select decode(encode('str',date'2022-10-14'),date'2022-10-14') as è§£å¯†;
+--------+
| è§£å¯†   |
+--------+
| str    |
+--------+
select encode('str',datetime'2022-10-14 11:11:11') as åŠ å¯†;
ERROR 42000: Incorrect parameters in the call to native function 'encode'
select decode(encode('str',datetime'2022-10-14 11:11:11'),datetime'2022-10-14 11:11:11') as è§£å¯†;
ERROR 42000: Incorrect parameters in the call to native function 'encode'
select encode('str',timestamp'2022-10-14 11:11:11') as åŠ å¯†;
+--------+
| åŠ å¯†   |
+--------+
| /ı£      |
+--------+
select decode(encode('str',timestamp'2022-10-14 11:11:11'),timestamp'2022-10-14 11:11:11') as è§£å¯†;
+--------+
| è§£å¯†   |
+--------+
| str    |
+--------+
#å‚æ•°ä¸ªæ•°
select encode();
ERROR 42000: Incorrect parameter count in the call to native function 'encode'
select encode('a');
ERROR 42000: Incorrect parameter count in the call to native function 'encode'
select encode('a','b','c');
ERROR 42000: Incorrect parameter count in the call to native function 'encode'
select decode();
ERROR 42000: Incorrect parameter count in the call to native function 'decode'
select decode('1');
ERROR 42000: Incorrect parameter count in the call to native function 'decode'
select decode('1','2','3');
ERROR 42000: Incorrect parameter count in the call to native function 'decode'
select encode(1,'aa');
+----------------+
| encode(1,'aa') |
+----------------+
|               |
+----------------+
select decode(encode(1,'aa'),'aa','aa');
ERROR 42000: Incorrect parameter count in the call to native function 'decode'
#å­—ç¬¦é›†
utf8mb4ã€utf16ã€binaryã€gbkã€gb18030
select encode('str1',_utf8mb4'key');
+------------------------------+
| encode('str1',_utf8mb4'key') |
+------------------------------+
| é¤Sp                           |
+------------------------------+
select encode('1234',_utf16'key2');
+-----------------------------+
| encode('1234',_utf16'key2') |
+-----------------------------+
| n+                         |
+-----------------------------+
select encode('abcd',_binary'key');
+-----------------------------+
| encode('abcd',_binary'key') |
+-----------------------------+
| ¢‘"                          |
+-----------------------------+
select encode('æ±‰å­—',_gbk'key');
+----------------------------+
| encode('æ±‰å­—',_gbk'key')   |
+----------------------------+
| lĞƒÓ                         |
+----------------------------+
select encode('ä¸­æ–‡123',_gb18030'key');
+-----------------------------------+
| encode('ä¸­æ–‡123',_gb18030'key')   |
+-----------------------------------+
| ‡êXu‹ÉË"à                               |
+-----------------------------------+
select encode(_utf8mb4'str1','key');
+------------------------------+
| encode(_utf8mb4'str1','key') |
+------------------------------+
| é¤Sp                           |
+------------------------------+
select encode(_utf16'1234','key');
+----------------------------+
| encode(_utf16'1234','key') |
+----------------------------+
| ímLç                         |
+----------------------------+
select encode(_binary'abcd','key');
+-----------------------------+
| encode(_binary'abcd','key') |
+-----------------------------+
| ¢‘"                          |
+-----------------------------+
select encode(_gbk'æ±‰å­—','key');
+----------------------------+
| encode(_gbk'æ±‰å­—','key')   |
+----------------------------+
| lĞƒÓ                         |
+----------------------------+
select encode(_gb18030'ä¸­æ–‡123','key');
+-----------------------------------+
| encode(_gb18030'ä¸­æ–‡123','key')   |
+-----------------------------------+
| ‡êXu‹ÉË"à                               |
+-----------------------------------+
select encode('ï¼@#ï¿¥%â€¦â€¦&*',_utf8mb4'key' collate utf8mb4_general_ci) as utf8mb4;
+-------------------+
| utf8mb4           |
+-------------------+
| T §¨'¾Mü)™İÔ          |
+-------------------+
select encode('123abc',_utf8mb4'key' collate utf8mb4_unicode_ci) as utf8mb4;
+---------+
| utf8mb4 |
+---------+
| ímLzS   |
+---------+
select encode('utf8mb4',_utf8mb4'key' collate utf8mb4_bin) as utf8mb4;
+---------+
| utf8mb4 |
+---------+
| ²¢^A~;O   |
+---------+
select encode('åŠ å¯†æ–‡æœ¬',_utf16'password' collate utf16_general_ci) as utf16;
+--------------+
| utf16        |
+--------------+
| pÿr“&1à{šì      |
+--------------+
select encode('abcdef',_utf16'password' collate utf16_bin) as utf16;
+--------+
| utf16  |
+--------+
| ¬`pÖ°°    |
+--------+
select encode('123456',_utf16'password' collate utf16_unicode_ci) as utf16;
+--------+
| utf16  |
+--------+
| UÙ|éA   |
+--------+
select encode('text',_gbk'key' collate gbk_chinese_ci) as gbk;
+------+
| gbk  |
+------+
| ÌjM  |
+------+
select encode('encrypt',_gbk'key' collate gbk_bin) as gbk;
+---------+
| gbk     |
+---------+
| J™@$ÿ   |
+---------+
select encode('_gb18030',_gb18030'key' collate gb18030_chinese_ci) as gb18030;
+----------+
| gb18030  |
+----------+
| ¹UÃ_O˜x     |
+----------+
select encode('gb18030_bin',_gb18030'key' collate gb18030_bin) as gb18030;
+-------------+
| gb18030     |
+-------------+
| |^UÔ1©9    |
+-------------+
select encode(_utf8mb4'utf8mb4_general_ci' collate utf8mb4_general_ci, 'key') as utf8mb4;
+--------------------+
| utf8mb4            |
+--------------------+
| ²¢^A~;O kóX”aÕWŞ         |
+--------------------+
select encode(_utf8mb4'utf8mb4_unicode_ci' collate utf8mb4_unicode_ci, 'key') as utf8mb4;
+--------------------+
| utf8mb4            |
+--------------------+
| ²¢^A~;O·ƒî™`Ü^×          |
+--------------------+
select encode(_utf8mb4'utf8mb4_bin' collate utf8mb4_bin, 'key') as utf8mb4;
+-------------+
| utf8mb4     |
+-------------+
| ²¢^A~;Ojòb     |
+-------------+
select encode(_utf16'utf16_general_ci' collate utf16_general_ci, 'key') as utf16;
+------------------+
| utf16            |
+------------------+
| ²¢^b¿7¯G‹†T         |
+------------------+
select encode(_utf16'88' collate utf16_bin, 'key') as utf16;
+-------+
| utf16 |
+-------+
| Îí      |
+-------+
select encode(_utf16'utf16_unicode_ci' collate utf16_unicode_ci, 'key') as utf16;
+------------------+
| utf16            |
+------------------+
| ²¢^b¿­,H²FJŠ]         |
+------------------+
select encode(_gbk'gbk_chinese_ci' collate gbk_chinese_ci, 'key') gbk;
+----------------+
| gbk            |
+----------------+
| Ğ?H5HHV½V   |
+----------------+
select encode(_gbk'gbk_bin' collate gbk_bin, 'key') gbk;
+---------+
| gbk     |
+---------+
| Ğ?vg.  |
+---------+
select encode(_gb18030'gb18030_chinese_ci' collate gb18030_chinese_ci, 'key') as gb18030;
+--------------------+
| gb18030            |
+--------------------+
| |^UÔXß_—Ã–;‡Œ        |
+--------------------+
select encode(_gb18030'gb18030_bin' collate gb18030_bin, 'key') as gb18030;
+-------------+
| gb18030     |
+-------------+
| |^UÔ1©9    |
+-------------+
select decode(encode('str1',_utf8mb4'key'),'key');
+--------------------------------------------+
| decode(encode('str1',_utf8mb4'key'),'key') |
+--------------------------------------------+
| str1                                       |
+--------------------------------------------+
select decode(encode('1234',_utf16'key2'),'key2');
+--------------------------------------------+
| decode(encode('1234',_utf16'key2'),'key2') |
+--------------------------------------------+
| 1234                                       |
+--------------------------------------------+
select decode(encode('abcd',_binary'key'),'key');
+-------------------------------------------+
| decode(encode('abcd',_binary'key'),'key') |
+-------------------------------------------+
| abcd                                      |
+-------------------------------------------+
select decode(encode('æ±‰å­—',_gbk'key'),'key');
+------------------------------------------+
| decode(encode('æ±‰å­—',_gbk'key'),'key')   |
+------------------------------------------+
| æ±‰å­—                                     |
+------------------------------------------+
select decode(encode('ä¸­æ–‡123',_gb18030'key'),'key');
+-------------------------------------------------+
| decode(encode('ä¸­æ–‡123',_gb18030'key'),'key')   |
+-------------------------------------------------+
| ä¸­æ–‡123                                         |
+-------------------------------------------------+
select decode(encode(_utf8mb4'str1','key'),'key');
+--------------------------------------------+
| decode(encode(_utf8mb4'str1','key'),'key') |
+--------------------------------------------+
| str1                                       |
+--------------------------------------------+
select decode(encode(_utf16'1234','key'),'key');
+------------------------------------------+
| decode(encode(_utf16'1234','key'),'key') |
+------------------------------------------+
| 1234                                     |
+------------------------------------------+
select decode(encode(_binary'abcd','key'),'key');
+-------------------------------------------+
| decode(encode(_binary'abcd','key'),'key') |
+-------------------------------------------+
| abcd                                      |
+-------------------------------------------+
select decode(encode(_gbk'æ±‰å­—','key'),'key');
+------------------------------------------+
| decode(encode(_gbk'æ±‰å­—','key'),'key')   |
+------------------------------------------+
| æ±‰å­—                                     |
+------------------------------------------+
select decode(encode(_gb18030'ä¸­æ–‡123','key'),'key');
+-------------------------------------------------+
| decode(encode(_gb18030'ä¸­æ–‡123','key'),'key')   |
+-------------------------------------------------+
| ä¸­æ–‡123                                         |
+-------------------------------------------------+
select decode(encode('ï¼@#ï¿¥%â€¦â€¦&*',_utf8mb4'key' collate utf8mb4_general_ci),'key') as utf8mb4;
+-------------------+
| utf8mb4           |
+-------------------+
| ï¼@#ï¿¥%â€¦â€¦&*       |
+-------------------+
select decode(encode('123abc',_utf8mb4'key' collate utf8mb4_unicode_ci),'key') as utf8mb4;
+---------+
| utf8mb4 |
+---------+
| 123abc  |
+---------+
select decode(encode('utf8mb4',_utf8mb4'key' collate utf8mb4_bin),'key') as utf8mb4;
+---------+
| utf8mb4 |
+---------+
| utf8mb4 |
+---------+
select decode(encode('åŠ å¯†æ–‡æœ¬',_utf16'password' collate utf16_general_ci),'password') as utf16;
+--------------+
| utf16        |
+--------------+
| åŠ å¯†æ–‡æœ¬     |
+--------------+
select decode(encode('abcdef',_utf16'password' collate utf16_bin),'password') as utf16;
+--------+
| utf16  |
+--------+
| abcdef |
+--------+
select decode(encode('123456',_utf16'password' collate utf16_unicode_ci),'password') as utf16;
+--------+
| utf16  |
+--------+
| 123456 |
+--------+
select decode(encode('text',_gbk'key' collate gbk_chinese_ci),'key') as gbk;
+------+
| gbk  |
+------+
| text |
+------+
select decode(encode('encrypt',_gbk'key' collate gbk_bin),'key') as gbk;
+---------+
| gbk     |
+---------+
| encrypt |
+---------+
select decode(encode('_gb18030',_gb18030'key' collate gb18030_chinese_ci),'key') as gb18030;
+----------+
| gb18030  |
+----------+
| _gb18030 |
+----------+
select decode(encode('gb18030_bin',_gb18030'key' collate gb18030_bin),'key') as gb18030;
+-------------+
| gb18030     |
+-------------+
| gb18030_bin |
+-------------+
select decode(encode(_utf8mb4'utf8mb4_general_ci' collate utf8mb4_general_ci, 'key'),'key') as utf8mb4;
+--------------------+
| utf8mb4            |
+--------------------+
| utf8mb4_general_ci |
+--------------------+
select decode(encode(_utf8mb4'utf8mb4_unicode_ci' collate utf8mb4_unicode_ci, 'key'),'key') as utf8mb4;
+--------------------+
| utf8mb4            |
+--------------------+
| utf8mb4_unicode_ci |
+--------------------+
select decode(encode(_utf8mb4'utf8mb4_bin' collate utf8mb4_bin, 'key'),'key') as utf8mb4;
+-------------+
| utf8mb4     |
+-------------+
| utf8mb4_bin |
+-------------+
select decode(encode(_utf16'utf16_general_ci' collate utf16_general_ci, 'key'),'key') as utf16;
+------------------+
| utf16            |
+------------------+
| utf16_general_ci |
+------------------+
select decode(encode(_utf16'88' collate utf16_bin, 'key'),'key') as utf16;
+-------+
| utf16 |
+-------+
| 88    |
+-------+
select decode(encode(_utf16'utf16_unicode_ci' collate utf16_unicode_ci, 'key'),'key') as utf16;
+------------------+
| utf16            |
+------------------+
| utf16_unicode_ci |
+------------------+
select decode(encode(_gbk'gbk_chinese_ci' collate gbk_chinese_ci, 'key'),'key') gbk;
+----------------+
| gbk            |
+----------------+
| gbk_chinese_ci |
+----------------+
select decode(encode(_gbk'gbk_bin' collate gbk_bin, 'key'),'key') gbk;
+---------+
| gbk     |
+---------+
| gbk_bin |
+---------+
select decode(encode(_gb18030'gb18030_chinese_ci' collate gb18030_chinese_ci, 'key'),'key') as gb18030;
+--------------------+
| gb18030            |
+--------------------+
| gb18030_chinese_ci |
+--------------------+
select decode(encode(_gb18030'gb18030_bin' collate gb18030_bin, 'key'),'key') as gb18030;
+-------------+
| gb18030     |
+-------------+
| gb18030_bin |
+-------------+
#åŸºç¡€sqlè¯­å¥ã€è§†å›¾ã€çº¦æŸã€ç´¢å¼•ã€å‡½æ•°åµŒå¥—
drop table t1;
create table t1(
id int auto_increment,
username varchar(128),
password blob,
primary key(id));
insert into t1(username,password) values('xiaoxin',encode('xiaoxinxin','passwordstring'));
insert into t1(username,password) values('xiaoli',encode('xiaolizi','passwordstring'));
insert into t1(username,password) values('xiaochao',encode('xiaochaochao','passwordstring'));
insert into t1(username,password) values('xiaowang',encode('xiaowangwang','passwordstring'));
select  * from t1;
+----+----------+--------------+
| id | username | password     |
+----+----------+--------------+
|  1 | xiaoxin  | Ô¸®T¼q…
;A       |
|  2 | xiaoli   | Ô¸®T@e.'       |
|  3 | xiaochao | Ô¸®T°ø‡'ûéÙ         |
|  4 | xiaowang | Ô¸®TúF‚ˆH_öl       |
+----+----------+--------------+
select username,decode(password,'passwordstring') from t1;
+----------+-----------------------------------+
| username | decode(password,'passwordstring') |
+----------+-----------------------------------+
| xiaoxin  | xiaoxinxin                        |
| xiaoli   | xiaolizi                          |
| xiaochao | xiaochaochao                      |
| xiaowang | xiaowangwang                      |
+----------+-----------------------------------+
select username,decode(password,'passwordstring') as password from t1 where username = 'xiaoxin';
+----------+------------+
| username | password   |
+----------+------------+
| xiaoxin  | xiaoxinxin |
+----------+------------+
select username,decode(password,'passwordstring') as password from t1 where username = 'xiaoli' group by username,password;
+----------+----------+
| username | password |
+----------+----------+
| xiaoli   | xiaolizi |
+----------+----------+
Warnings:
Warning	1052	Column 'password' in group statement is ambiguous
select username,decode(password,'passwordstring') as password from t1 where username = 'xiaochao' order by 1;
+----------+--------------+
| username | password     |
+----------+--------------+
| xiaochao | xiaochaochao |
+----------+--------------+
select username,decode(password,'passwordstring') as password from t1 where username = 'xiaoli' order by 1,2 limit 1;
+----------+----------+
| username | password |
+----------+----------+
| xiaoli   | xiaolizi |
+----------+----------+
select username,decode(password,'passwordstring') as password from t1 tt1 where exists(
	select * from t1 tt2 where tt2.username = tt1.username and tt2.username like '%n%');
+----------+--------------+
| username | password     |
+----------+--------------+
| xiaoxin  | xiaoxinxin   |
| xiaowang | xiaowangwang |
+----------+--------------+
select username,decode(password,'passwordstring') as password from t1 tt1 where not exists(
	select * from t1 tt2 where tt2.username = tt1.username and tt2.username like '%n%');
+----------+--------------+
| username | password     |
+----------+--------------+
| xiaoli   | xiaolizi     |
| xiaochao | xiaochaochao |
+----------+--------------+
select username,decode(password,'passwordstring') as password from t1 where username in('xiaoli','xiaochao');
+----------+--------------+
| username | password     |
+----------+--------------+
| xiaoli   | xiaolizi     |
| xiaochao | xiaochaochao |
+----------+--------------+
select username,decode(password,'passwordstring') as password from t1 where username not in('xiaoli','xiaochao');
+----------+--------------+
| username | password     |
+----------+--------------+
| xiaoxin  | xiaoxinxin   |
| xiaowang | xiaowangwang |
+----------+--------------+
select username,decode(password,'passwordstring') as password from t1 tt1 where id > any(select id from t1 tt2 where tt2.id > 2);
+----------+--------------+
| username | password     |
+----------+--------------+
| xiaowang | xiaowangwang |
+----------+--------------+
select username,decode(password,'passwordstring') as password from t1 tt1 where id = some(select id from t1 tt2 where tt2.id > 2);
+----------+--------------+
| username | password     |
+----------+--------------+
| xiaochao | xiaochaochao |
| xiaowang | xiaowangwang |
+----------+--------------+
select username,decode(password,'passwordstring') as password from t1 tt1 where id < all(select id from t1 tt2 where tt2.id > 1);
+----------+------------+
| username | password   |
+----------+------------+
| xiaoxin  | xiaoxinxin |
+----------+------------+
select id,username,decode(password,'passwordstring') as password from t1 where decode(password,'passwordstring') like '%c%';
+----+----------+--------------+
| id | username | password     |
+----+----------+--------------+
|  3 | xiaochao | xiaochaochao |
+----+----------+--------------+
update t1 set password = encode('xiaoxinxin','xinxin') where username = 'xiaoxin';
delete from t1 where username in ('xiaoli','xiaochao') or password = encode('xiaowangwang','passwordstring');
select  * from t1;
+----+----------+------------+
| id | username | password   |
+----+----------+------------+
|  1 | xiaoxin  | U\”èbù\š½       |
+----+----------+------------+
#å‡½æ•°åµŒå¥—
select encode(decode(encode('123','password1'),'password1'),'password2');
+-------------------------------------------------------------------+
| encode(decode(encode('123','password1'),'password1'),'password2') |
+-------------------------------------------------------------------+
| ÓÜó                                                                  |
+-------------------------------------------------------------------+
select decode(encode(decode(encode('123','password1'),'password1'),'password2'),'password2');
+---------------------------------------------------------------------------------------+
| decode(encode(decode(encode('123','password1'),'password1'),'password2'),'password2') |
+---------------------------------------------------------------------------------------+
| 123                                                                                   |
+---------------------------------------------------------------------------------------+
select length(encode('aaa','bbbbb'));
+-------------------------------+
| length(encode('aaa','bbbbb')) |
+-------------------------------+
|                             3 |
+-------------------------------+
select length(decode(encode('geeksforgeeks123', 'passwordstring'),'passwordstring'));
+-------------------------------------------------------------------------------+
| length(decode(encode('geeksforgeeks123', 'passwordstring'),'passwordstring')) |
+-------------------------------------------------------------------------------+
|                                                                            16 |
+-------------------------------------------------------------------------------+
select encode(length('12345'),'abc');
+-------------------------------+
| encode(length('12345'),'abc') |
+-------------------------------+
| ø                              |
+-------------------------------+
select decode(encode(length('12345'),'abc'),'abc');
+---------------------------------------------+
| decode(encode(length('12345'),'abc'),'abc') |
+---------------------------------------------+
| 5                                           |
+---------------------------------------------+
select encode(concat('abc','123'),'password');
+----------------------------------------+
| encode(concat('abc','123'),'password') |
+----------------------------------------+
| ¬`p‹v                                    |
+----------------------------------------+
select decode(encode(concat('abc','123'),'password'),'password');
+-----------------------------------------------------------+
| decode(encode(concat('abc','123'),'password'),'password') |
+-----------------------------------------------------------+
| abc123                                                    |
+-----------------------------------------------------------+
select encode('123',concat('pass','word'));
+-------------------------------------+
| encode('123',concat('pass','word')) |
+-------------------------------------+
| UÙ                                  |
+-------------------------------------+
select decode(encode('123',concat('pass','word')),concat('pass','word'));
+-------------------------------------------------------------------+
| decode(encode('123',concat('pass','word')),concat('pass','word')) |
+-------------------------------------------------------------------+
| 123                                                               |
+-------------------------------------------------------------------+
select encode('cleartext', concat('my_random_salt',null,'my_secret_password'));
+-------------------------------------------------------------------------+
| encode('cleartext', concat('my_random_salt',null,'my_secret_password')) |
+-------------------------------------------------------------------------+
| NULL                                                                    |
+-------------------------------------------------------------------------+
select decode(encode('cleartext', concat('my_random_salt-','my_secret_password')),'my_random_salt-my_secret_password') as è§£å¯†;
+-----------+
| è§£å¯†      |
+-----------+
| cleartext |
+-----------+
select decode(encode('cleartext', concat('my_random_salt',null,'my_secret_password')),null);
+--------------------------------------------------------------------------------------+
| decode(encode('cleartext', concat('my_random_salt',null,'my_secret_password')),null) |
+--------------------------------------------------------------------------------------+
| NULL                                                                                 |
+--------------------------------------------------------------------------------------+
select bin(decode(encode(8,123),123));
+--------------------------------+
| bin(decode(encode(8,123),123)) |
+--------------------------------+
| 1000                           |
+--------------------------------+
select md5(decode(encode('str','password'),'password'));
+--------------------------------------------------+
| md5(decode(encode('str','password'),'password')) |
+--------------------------------------------------+
| 341be97d9aff90c9978347f66f945b77                 |
+--------------------------------------------------+
select lower(decode(encode('STR','password'),'password'));
+----------------------------------------------------+
| lower(decode(encode('STR','password'),'password')) |
+----------------------------------------------------+
| STR                                                |
+----------------------------------------------------+
select upper(decode(encode('str','password'),'password'));
+----------------------------------------------------+
| upper(decode(encode('str','password'),'password')) |
+----------------------------------------------------+
| str                                                |
+----------------------------------------------------+
select left(decode(encode('string','password'),'password'),3);
+--------------------------------------------------------+
| left(decode(encode('string','password'),'password'),3) |
+--------------------------------------------------------+
| str                                                    |
+--------------------------------------------------------+
select right(decode(encode('string','password'),'password'),6);
+---------------------------------------------------------+
| right(decode(encode('string','password'),'password'),6) |
+---------------------------------------------------------+
| string                                                  |
+---------------------------------------------------------+
select reverse(decode(encode('string','password'),'password'));
+---------------------------------------------------------+
| reverse(decode(encode('string','password'),'password')) |
+---------------------------------------------------------+
| gnirts                                                  |
+---------------------------------------------------------+
select substring(decode(encode('string','password'),'password'),4);
+-------------------------------------------------------------+
| substring(decode(encode('string','password'),'password'),4) |
+-------------------------------------------------------------+
| ing                                                         |
+-------------------------------------------------------------+
select if(1=1,encode('cleartext', 'password'),decode(encode('cleartext', 'password'),'password'));
+--------------------------------------------------------------------------------------------+
| if(1=1,encode('cleartext', 'password'),decode(encode('cleartext', 'password'),'password')) |
+--------------------------------------------------------------------------------------------+
| MËxÉ²Â—>                                                                                     |
+--------------------------------------------------------------------------------------------+
select if(1>1,encode('cleartext', 'password'),decode(encode('cleartext', 'password'),'password'));
+--------------------------------------------------------------------------------------------+
| if(1>1,encode('cleartext', 'password'),decode(encode('cleartext', 'password'),'password')) |
+--------------------------------------------------------------------------------------------+
| cleartext                                                                                  |
+--------------------------------------------------------------------------------------------+
select ifnull(null,decode(encode('cleartext', 'password'),'password'));
+-----------------------------------------------------------------+
| ifnull(null,decode(encode('cleartext', 'password'),'password')) |
+-----------------------------------------------------------------+
| cleartext                                                       |
+-----------------------------------------------------------------+
select nullif(decode(encode('cleartext', 'password'),'password'),encode('cleartext', 'password'));
+--------------------------------------------------------------------------------------------+
| nullif(decode(encode('cleartext', 'password'),'password'),encode('cleartext', 'password')) |
+--------------------------------------------------------------------------------------------+
| cleartext                                                                                  |
+--------------------------------------------------------------------------------------------+
select case decode(encode('cleartext','password'),'password')
	when 'cleartext' then 'æˆåŠŸè§£å¯†'
	else 'è§£å¯†å¤±è´¥'
	end as col1;
+--------------+
| col1         |
+--------------+
| æˆåŠŸè§£å¯†     |
+--------------+
select case when decode(encode('cleartext','password'),'password') = 'cleartext' 
	then 'æˆåŠŸè§£å¯†' 
	else 'è§£å¯†å¤±è´¥' 
	end as col2;
+--------------+
| col2         |
+--------------+
| æˆåŠŸè§£å¯†     |
+--------------+
select case decode(encode('cleartext','password'),'password') 
	when decode(encode('cleartext','password'),'password') then 'æˆåŠŸè§£å¯†'
	when decode(encode('text','password'),'password') then 'è§£å¯†å¤±è´¥'
	end as col3;
+--------------+
| col3         |
+--------------+
| æˆåŠŸè§£å¯†     |
+--------------+
è‡ªå®šä¹‰å˜é‡
set @aa = '123456';
select encode(@aa,@aa);
+-----------------+
| encode(@aa,@aa) |
+-----------------+
| I2^)=[          |
+-----------------+
select encode('123456',@aa);
+----------------------+
| encode('123456',@aa) |
+----------------------+
| I2^)=[               |
+----------------------+
select encode(@aa,'123456');
+----------------------+
| encode(@aa,'123456') |
+----------------------+
| I2^)=[               |
+----------------------+
select decode(encode(@aa,@aa),'123456');
+----------------------------------+
| decode(encode(@aa,@aa),'123456') |
+----------------------------------+
| 123456                           |
+----------------------------------+
select decode(encode(@aa,'123456'),@aa);
+----------------------------------+
| decode(encode(@aa,'123456'),@aa) |
+----------------------------------+
| 123456                           |
+----------------------------------+
prepare
prepare p_encode from 'select encode(?,''key'')';
set @s1 = 'abcd';
execute p_encode using @s1;
+-----------------+
| encode(?,'key') |
+-----------------+
| ¢‘"              |
+-----------------+
prepare p_encode2 from 'select encode(''test'',?)';
set @s1 = 'key';
execute p_encode2 using @s1;
+------------------+
| encode('test',?) |
+------------------+
| ÌjlF              |
+------------------+
#è§†å›¾
drop table t1;
create table t1(
id int auto_increment,
username varchar(128),
password blob,
primary key(id));
insert into t1(username,password) values('xiaoxin',encode('xiaoxinxin','passwordstring'));
insert into t1(username,password) values('xiaoli',encode('xiaolizi','passwordstring'));
insert into t1(username,password) values('xiaochao',encode('xiaochaochao','passwordstring'));
insert into t1(username,password) values('xiaowang',encode('xiaowangwang','passwordstring'));
select  * from t1;
+----+----------+--------------+
| id | username | password     |
+----+----------+--------------+
|  1 | xiaoxin  | Ô¸®T¼q…
;A       |
|  2 | xiaoli   | Ô¸®T@e.'       |
|  3 | xiaochao | Ô¸®T°ø‡'ûéÙ         |
|  4 | xiaowang | Ô¸®TúF‚ˆH_öl       |
+----+----------+--------------+
drop view v1;
create view v1 as select * from t1;
select decode(password,'passwordstring') from v1;
+-----------------------------------+
| decode(password,'passwordstring') |
+-----------------------------------+
| xiaoxinxin                        |
| xiaolizi                          |
| xiaochaochao                      |
| xiaowangwang                      |
+-----------------------------------+
select username,decode(password,'passwordstring') as password from v1 where username = 'xiaoxin';
+----------+------------+
| username | password   |
+----------+------------+
| xiaoxin  | xiaoxinxin |
+----------+------------+
select username,decode(password,'passwordstring') as password from v1 where username = 'xiaoli' group by username,password;
+----------+----------+
| username | password |
+----------+----------+
| xiaoli   | xiaolizi |
+----------+----------+
Warnings:
Warning	1052	Column 'password' in group statement is ambiguous
select username,decode(password,'passwordstring') as password from v1 where username = 'xiaochao' order by 1;
+----------+--------------+
| username | password     |
+----------+--------------+
| xiaochao | xiaochaochao |
+----------+--------------+
select username,decode(password,'passwordstring') as password from v1 where username = 'xiaoli' order by 1,2 limit 1;
+----------+----------+
| username | password |
+----------+----------+
| xiaoli   | xiaolizi |
+----------+----------+
select username,decode(password,'passwordstring') as password from v1 where username in('xiaoli','xiaochao');
+----------+--------------+
| username | password     |
+----------+--------------+
| xiaoli   | xiaolizi     |
| xiaochao | xiaochaochao |
+----------+--------------+
select username,decode(password,'passwordstring') as password from v1 where username not in('xiaoli','xiaochao');
+----------+--------------+
| username | password     |
+----------+--------------+
| xiaoxin  | xiaoxinxin   |
| xiaowang | xiaowangwang |
+----------+--------------+
select id,username,decode(password,'passwordstring') as password from v1 where decode(password,'passwordstring') like '%c%';
+----+----------+--------------+
| id | username | password     |
+----+----------+--------------+
|  3 | xiaochao | xiaochaochao |
+----+----------+--------------+
update v1 set password = encode('xiaoxinxin','xinxin') where username = 'xiaoxin';
delete from v1 where username in ('xiaoli','xiaochao') or password = encode('xiaowangwang','passwordstring');
select  * from v1;
+----+----------+------------+
| id | username | password   |
+----+----------+------------+
|  1 | xiaoxin  | U\”èbù\š½       |
+----+----------+------------+
å¤åˆ¶è¡¨
drop table t1;
create table t1(
id int auto_increment,
username varchar(128),
password blob,
primary key(id));
drop table t2;
create table t2 like t1;
desc t2;
+----------+--------------+------+-----+---------+----------------+
| Field    | Type         | Null | Key | Default | Extra          |
+----------+--------------+------+-----+---------+----------------+
| id       | int(11)      | NO   | PRI | NULL    | auto_increment |
| username | varchar(128) | YES  |     | NULL    |                |
| password | blob         | YES  |     | NULL    |                |
+----------+--------------+------+-----+---------+----------------+
insert into t2(username,password) values('xiaoxin',encode('xiaoxinxin','passwordstring'));
insert into t2(username,password) values('xiaoli',encode('xiaolizi','passwordstring'));
insert into t2(username,password) values('xiaochao',encode('xiaochaochao','passwordstring'));
insert into t2(username,password) values('xiaowang',encode('xiaowangwang','passwordstring'));
select * from t2;
+----+----------+--------------+
| id | username | password     |
+----+----------+--------------+
|  1 | xiaoxin  | Ô¸®T¼q…
;A       |
|  2 | xiaoli   | Ô¸®T@e.'       |
|  3 | xiaochao | Ô¸®T°ø‡'ûéÙ         |
|  4 | xiaowang | Ô¸®TúF‚ˆH_öl       |
+----+----------+--------------+
select username,decode(password,'passwordstring') as password from t2 where username = 'xiaoxin';
+----------+------------+
| username | password   |
+----------+------------+
| xiaoxin  | xiaoxinxin |
+----------+------------+
select username,decode(password,'passwordstring') as password from t2 where username = 'xiaoli' group by username,password;
+----------+----------+
| username | password |
+----------+----------+
| xiaoli   | xiaolizi |
+----------+----------+
Warnings:
Warning	1052	Column 'password' in group statement is ambiguous
select username,decode(password,'passwordstring') as password from t2 where username = 'xiaochao' order by 1;
+----------+--------------+
| username | password     |
+----------+--------------+
| xiaochao | xiaochaochao |
+----------+--------------+
select username,decode(password,'passwordstring') as password from t2 where username = 'xiaoli' order by 1,2 limit 1;
+----------+----------+
| username | password |
+----------+----------+
| xiaoli   | xiaolizi |
+----------+----------+
select username,decode(password,'passwordstring') as password from t2 where username in('xiaoli','xiaochao');
+----------+--------------+
| username | password     |
+----------+--------------+
| xiaoli   | xiaolizi     |
| xiaochao | xiaochaochao |
+----------+--------------+
select username,decode(password,'passwordstring') as password from t2 where username not in('xiaoli','xiaochao');
+----------+--------------+
| username | password     |
+----------+--------------+
| xiaoxin  | xiaoxinxin   |
| xiaowang | xiaowangwang |
+----------+--------------+
select id,username,decode(password,'passwordstring') as password from t2 where decode(password,'passwordstring') like '%c%';
+----+----------+--------------+
| id | username | password     |
+----+----------+--------------+
|  3 | xiaochao | xiaochaochao |
+----+----------+--------------+
update t2 set password = encode('xiaoxinxin','xinxin') where username = 'xiaoxin';
delete from t2 where username in ('xiaoli','xiaochao') or password = encode('xiaowangwang','passwordstring');
select  * from t2;
+----+----------+------------+
| id | username | password   |
+----+----------+------------+
|  1 | xiaoxin  | U\”èbù\š½       |
+----+----------+------------+
åˆ†åŒºè¡¨
hash
drop table t1;
create table t1(
c1 int,
c2 blob
)
partition by hash(c1)(
partition p0,
partition p1);
insert into t1() values(1,encode('c1=1','password1'));
insert into t1() values(2,encode('c1=2','password2'));
insert into t1() values(3,encode('c1=3','password3'));
insert into t1() values(4,encode('c1=4','password4'));
select * from t1 partition(p0);
+------+------+
| c1   | c2   |
+------+------+
|    2 | ÊŠQã   |
|    4 | [~	 |
+------+------+
select * from t1 partition(p1);
+------+------+
| c1   | c2   |
+------+------+
|    1 | ßg  |
|    3 | °¯ÿÀ     |
+------+------+
select c1,decode(c2,'password1') from t1 where c2 = encode('c1=1','password1');
+------+------------------------+
| c1   | decode(c2,'password1') |
+------+------------------------+
|    1 | c1=1                   |
+------+------------------------+
update t1 set c1 = 22 where c2 = encode('c1=2','password2');
delete from t1 where c1 = 3 or decode(c2,'password4') = 'c1=4';
select * from t1;
+------+------+
| c1   | c2   |
+------+------+
|   22 | ÊŠQã   |
|    1 | ßg  |
+------+------+
range
drop table t1;
create table t1(
c1 int,
c2 blob)
partition by range(c1)(
partition p0 values less than (10),
partition p1 values less than (20),
partition pmax values less than (maxvalue));
insert into t1() values(1,encode('1','1'));
insert into t1() values(5,encode('5','5'));
insert into t1() values(12,encode('12','12'));
insert into t1() values(17,encode('17','17'));
insert into t1() values(55,encode('55','55'));
select * from t1 partition(p0);
+------+------+
| c1   | c2   |
+------+------+
|    1 | !    |
|    5 | •     |
+------+------+
select * from t1 partition(p1);
+------+------+
| c1   | c2   |
+------+------+
|   12 | ‰İ     |
|   17 | Øy    |
+------+------+
select * from t1 partition(pmax);
+------+------+
| c1   | c2   |
+------+------+
|   55 | Ë    |
+------+------+
insert into t1() values(99,decode(encode('99','99'),'99'));
select c1,decode(c2,'1') from t1 where c2 = encode('1','1');
+------+----------------+
| c1   | decode(c2,'1') |
+------+----------------+
|    1 | 1              |
+------+----------------+
update t1 set c2 = encode('99','99') where c1 = 99;
delete from t1 where c2 = encode('1','1');
select * from t1;
+------+------+
| c1   | c2   |
+------+------+
|    5 | •     |
|   12 | ‰İ     |
|   17 | Øy    |
|   55 | Ë    |
|   99 | +;   |
+------+------+
list
drop table t1;
create table t1(
c1 int,c2 blob)
partition by list(c1)(
partition p0 values in(1,2,3),
partition p1 values in(4,5,6),
partition p2 values in(7,8,9)
);
insert into t1() values(1,encode('2','3'));
insert into t1() values(4,encode('5','6'));
insert into t1() values(7,encode('8','9'));
select * from t1 partition(p0);
+------+------+
| c1   | c2   |
+------+------+
|    1 | 3    |
+------+------+
select * from t1 partition(p1);
+------+------+
| c1   | c2   |
+------+------+
|    4 | ø     |
+------+------+
select * from t1 partition(p2);
+------+------+
| c1   | c2   |
+------+------+
|    7 | @    |
+------+------+
select c1,decode(c2,'3') from t1 where c2 = encode('2','3');
+------+----------------+
| c1   | decode(c2,'3') |
+------+----------------+
|    1 | 2              |
+------+----------------+
update t1 set c1 = 5 where c1 = decode(encode('4','4'),'4');
delete from t1 where c2 = encode('8','9');
select * from t1;
+------+------+
| c1   | c2   |
+------+------+
|    1 | 3    |
|    5 | ø     |
+------+------+
key
drop table t1;
create table t1(
c1 int,c2 blob)
partition by key(c1)
partitions 2;
insert into t1() values(1,encode('a','password1'));
insert into t1() values(2,encode('b','password2'));
insert into t1() values(3,encode('c','password3'));
insert into t1() values(4,encode('d','password4'));
select * from t1;
+------+------+
| c1   | c2   |
+------+------+
|    1 | ¢     |
|    2 | J    |
|    3 | °     |
|    4 | K    |
+------+------+
select c1,decode(c2,'password1') from t1 where c2 = encode('a','password1');
+------+------------------------+
| c1   | decode(c2,'password1') |
+------+------------------------+
|    1 | a                      |
+------+------------------------+
update t1 set c1 = 22 where c2 = encode('b','password2');
delete from t1 where c1 = 3 or decode(c2,'password4') = 'd';
select * from t1;
+------+------+
| c1   | c2   |
+------+------+
|    1 | ¢     |
|   22 | J    |
+------+------+
range-hash
drop table t1;
create table t1(
id int auto_increment,
username varchar(255) not null,
password blob,
birthdate date not null,
primary key (id,birthdate),
key idx_usr(username))
partition by range(id)
subpartition by hash(year(birthdate))
subpartitions 3
(
partition p1 values less than (100),
partition p2 values less than maxvalue
);
insert into t1() values(1,'xiaoyi',encode(123456,'123456'),'2018-01-01');
insert into t1() values(2,'xiaoer',encode('abcdef','abcdef'),'2019-02-02');
insert into t1() values(3,'xiaosan',encode('é»„é¾™æ—¶ä»£','æ—¶ä»£å¹¿åœº'),'2020-03-03');
insert into t1() values(4,'xiaosi',encode('123justçˆ¬','password'),'2021-04-04');
select decode(password,'123456') from t1 where password = encode(123456,'123456');
+---------------------------+
| decode(password,'123456') |
+---------------------------+
| 123456                    |
+---------------------------+
update t1 set password = encode(654321,'654321') where birthdate = '2018-01-01';
delete from t1 where password = encode('123justçˆ¬','password');
select * from t1 order by 1;
+----+----------+--------------+------------+
| id | username | password     | birthdate  |
+----+----------+--------------+------------+
|  1 | xiaoyi   | ãCaŠ#          | 2018-01-01 |
|  2 | xiaoer   | İ¯¯½Q           | 2019-02-02 |
|  3 | xiaosan  | ú%QçÏ’qğºi:Ì       | 2020-03-03 |
+----+----------+--------------+------------+
#å­˜å‚¨è¿‡ç¨‹
drop table t1;
create table t1(id int auto_increment primary key,name varchar(255),password varchar(255));
insert into t1 values(1,'å¼ ä¸‰','a123456');
insert into t1 values(2,'æå››','b223456');
insert into t1 values(3,'ç‹äº”','c323456');
insert into t1 values(4,'å°å…­','d423456');
drop table t2;
create table t2(sid int,miwen blob,mingwen varchar(255));
#æ— å‚æ•°çš„å­˜å‚¨è¿‡ç¨‹
drop procedure p1_encode;//
create procedure p1_encode()
begin
    declare a blob;
	declare b varchar(255);
    declare i int default 1;
    while i <= 4 do
	  select encode(password,'key'),decode(encode(password,'key'),'key') into a,b from t1 where id = i;
	  insert into t2 values(i,a,b);
	  set i = i + 1;
	end while;
end;
//
call p1_encode();
select * from t2 order by 1,2;
+------+---------+---------+
| sid  | miwen   | mingwen |
+------+---------+---------+
|    1 | ¢—ƒQFC     | a123456 |
|    2 | o>ƒQFC   | b223456 |
|    3 | £ƒQFC    | c323456 |
|    4 | ª@ƒQFC    | d423456 |
+------+---------+---------+
#æœ‰å‚æ•°çš„å­˜å‚¨è¿‡ç¨‹(in)
delete from t2;
drop procedure p1_encode;//
create procedure p1_encode(in aa int)
begin
    declare a blob;
	declare b varchar(255);
    declare i int default aa;
    repeat
	  select encode(password,'key'),decode(encode(password,'key'),'key') into a,b from t1 where id = i;
	  insert into t2 values(i,a,b);
	  set i = i + 1;
	until i > 4
	end repeat;
end;
//
call p1_encode(1);
select * from t2 order by 1,2;
+------+---------+---------+
| sid  | miwen   | mingwen |
+------+---------+---------+
|    1 | ¢—ƒQFC     | a123456 |
|    2 | o>ƒQFC   | b223456 |
|    3 | £ƒQFC    | c323456 |
|    4 | ª@ƒQFC    | d423456 |
+------+---------+---------+
#æœ‰å‚æ•°çš„å­˜å‚¨è¿‡ç¨‹(out)
delete from t2;
drop procedure p1_encode;//
create procedure p1_encode(out aa blob,out bb varchar(255))
begin
    declare i int default 1;
    while i <= 4 do
	  select encode(password,'key'),decode(encode(password,'key'),'key') into aa,bb from t1 where id = i;
	  insert into t2 values(i,aa,bb);
	  set i = i + 1;
	end while;
end;
//
call p1_encode(@aa,@bb);
select * from t2 order by 1,2;
+------+---------+---------+
| sid  | miwen   | mingwen |
+------+---------+---------+
|    1 | ¢—ƒQFC     | a123456 |
|    2 | o>ƒQFC   | b223456 |
|    3 | £ƒQFC    | c323456 |
|    4 | ª@ƒQFC    | d423456 |
+------+---------+---------+
#è‡ªå®šä¹‰å‡½æ•°
drop function f_encode;//
create  function f_encode() returns  blob READS SQL DATA
begin
    declare aa blob;
	select encode(password,'key') into aa from t1 where id = 1;
	return aa;
end;
//
select f_encode();
+------------+
| f_encode() |
+------------+
| ¢—ƒQFC        |
+------------+

#è§¦å‘å™¨  
delete from t2;
insert into t2 select id,encode(password,'key'),decode(encode(password,'key'),'key') from t1;
drop trigger trigger_encode;//
create trigger trigger_encode before update 
on t2 for each row
begin
    set new.miwen = encode(new.mingwen,'update');
end;
//
update t2 set mingwen = 'e523456' where mingwen = 'd423456';
select * from t2 order by 1;
+------+---------+---------+
| sid  | miwen   | mingwen |
+------+---------+---------+
|    1 | ¢—ƒQFC     | a123456 |
|    2 | o>ƒQFC   | b223456 |
|    3 | £ƒQFC    | c323456 |
|    4 | {¨$PËƒ   | e523456 |
+------+---------+---------+
drop database if exists yx5493;
PURGE RECYCLEBIN;
