# 环境清理
purge recyclebin;
result_format: 4
drop DATABASE IF EXISTS yx5493;
CREATE DATABASE yx5493;
USE yx5493;
#ENCRYPT(str[,salt])
#basic
#参数2没有指定,使用随机值
#select encrypt('helloworld');
select encrypt('helloworld','passwordstring');
+----------------------------------------+
| encrypt('helloworld','passwordstring') |
+----------------------------------------+
| pa44EbV1fclG2                          |
+----------------------------------------+
参数2必须是至少包含两个字符的字符串，否则结果为NULL.
select encrypt('test',1);
+-------------------+
| encrypt('test',1) |
+-------------------+
| NULL              |
+-------------------+
select encrypt('test',12);
+--------------------+
| encrypt('test',12) |
+--------------------+
| 126D8rSh5sjUE      |
+--------------------+
select encrypt('testtest',12);
+------------------------+
| encrypt('testtest',12) |
+------------------------+
| 12SddsiYCoHyw          |
+------------------------+
只加密str的前8位，结果与上相同
select encrypt('testtesttest',12);
+----------------------------+
| encrypt('testtesttest',12) |
+----------------------------+
| 12SddsiYCoHyw              |
+----------------------------+
参数2取前两位字符为有效
select encrypt('testtesttest',123);
+-----------------------------+
| encrypt('testtesttest',123) |
+-----------------------------+
| 12SddsiYCoHyw               |
+-----------------------------+
select encrypt('test2','a');
+----------------------+
| encrypt('test2','a') |
+----------------------+
| NULL                 |
+----------------------+
select encrypt('test2','ab');
+-----------------------+
| encrypt('test2','ab') |
+-----------------------+
| abaqiTooRE3XA         |
+-----------------------+
select encrypt('test2','abc');
+------------------------+
| encrypt('test2','abc') |
+------------------------+
| abaqiTooRE3XA          |
+------------------------+
select encrypt('test2','abdsgfjhksdfjhkdsgfjkhsdgkjf');
+-------------------------------------------------+
| encrypt('test2','abdsgfjhksdfjhkdsgfjkhsdgkjf') |
+-------------------------------------------------+
| abaqiTooRE3XA                                   |
+-------------------------------------------------+
select encrypt('testtest','ab');
+--------------------------+
| encrypt('testtest','ab') |
+--------------------------+
| aboqU0xf8M452            |
+--------------------------+
select encrypt('testtesttest','ab');
+------------------------------+
| encrypt('testtesttest','ab') |
+------------------------------+
| aboqU0xf8M452                |
+------------------------------+
select encrypt('str',sum(9+2));
+-------------------------+
| encrypt('str',sum(9+2)) |
+-------------------------+
| 11p17FBAxSCVA           |
+-------------------------+
select encrypt('str',min(11));
+------------------------+
| encrypt('str',min(11)) |
+------------------------+
| 11p17FBAxSCVA          |
+------------------------+
select encrypt('str',max(11));
+------------------------+
| encrypt('str',max(11)) |
+------------------------+
| 11p17FBAxSCVA          |
+------------------------+
select encrypt('str',0);
+------------------+
| encrypt('str',0) |
+------------------+
| NULL             |
+------------------+
select encrypt('str',0.1);
+--------------------+
| encrypt('str',0.1) |
+--------------------+
| 0.0Kqeny4UUAg      |
+--------------------+
select encrypt('str',0.01);
+---------------------+
| encrypt('str',0.01) |
+---------------------+
| 0.0Kqeny4UUAg       |
+---------------------+
select encrypt('str','0.');
+---------------------+
| encrypt('str','0.') |
+---------------------+
| 0.0Kqeny4UUAg       |
+---------------------+
select encrypt('str',.1);
+-------------------+
| encrypt('str',.1) |
+-------------------+
| 0.0Kqeny4UUAg     |
+-------------------+
不支持salt为负数
select encrypt('str',-999);
+---------------------+
| encrypt('str',-999) |
+---------------------+
| NULL                |
+---------------------+
select encrypt('str',-999.999);
+-------------------------+
| encrypt('str',-999.999) |
+-------------------------+
| NULL                    |
+-------------------------+
select encrypt(999,999);
+------------------+
| encrypt(999,999) |
+------------------+
| 99XncKvmqq0Bs    |
+------------------+
select encrypt('str',1.2345e4);
+-------------------------+
| encrypt('str',1.2345e4) |
+-------------------------+
| 12.ByWV5nxtyo           |
+-------------------------+
select encrypt('str',-1.2345e4);
+--------------------------+
| encrypt('str',-1.2345e4) |
+--------------------------+
| NULL                     |
+--------------------------+
salt只支持数字和字母
select encrypt('其实我超过8个字符长度了','1a');
+----------------------------------------------------+
| encrypt('其实我超过8个字符长度了','1a')            |
+----------------------------------------------------+
| 1aZ2uEA950TZo                                      |
+----------------------------------------------------+
select encrypt('其实我超过8个字符长度了','1一');
+------------------------------------------------------+
| encrypt('其实我超过8个字符长度了','1一')             |
+------------------------------------------------------+
| NULL                                                 |
+------------------------------------------------------+
select encrypt('其实我超过8个字符长度了','a一');
+------------------------------------------------------+
| encrypt('其实我超过8个字符长度了','a一')             |
+------------------------------------------------------+
| NULL                                                 |
+------------------------------------------------------+
select encrypt('1234abcd','1a');
+--------------------------+
| encrypt('1234abcd','1a') |
+--------------------------+
| 1ak8iEUalh4jI            |
+--------------------------+
select encrypt('1234abcd','中文');
+------------------------------+
| encrypt('1234abcd','中文')   |
+------------------------------+
| NULL                         |
+------------------------------+
select encrypt('test','这是错误的密钥');
+-----------------------------------------+
| encrypt('test','这是错误的密钥')        |
+-----------------------------------------+
| NULL                                    |
+-----------------------------------------+
select encrypt('test','数字123');
+-----------------------------+
| encrypt('test','数字123')   |
+-----------------------------+
| NULL                        |
+-----------------------------+
select encrypt('test','字母abc');
+-----------------------------+
| encrypt('test','字母abc')   |
+-----------------------------+
| NULL                        |
+-----------------------------+
select encrypt('test','组合123abc');
+--------------------------------+
| encrypt('test','组合123abc')   |
+--------------------------------+
| NULL                           |
+--------------------------------+
select encrypt('test','こんにちは');
+-----------------------------------+
| encrypt('test','こんにちは')      |
+-----------------------------------+
| NULL                              |
+-----------------------------------+
select encrypt('test','안녕하십니까');
+--------------------------------------+
| encrypt('test','안녕하십니까')       |
+--------------------------------------+
| NULL                                 |
+--------------------------------------+
select encrypt('test','~');
+---------------------+
| encrypt('test','~') |
+---------------------+
| NULL                |
+---------------------+
select encrypt('test','~！@#￥%……&*');
+--------------------------------------+
| encrypt('test','~！@#￥%……&*')       |
+--------------------------------------+
| NULL                                 |
+--------------------------------------+
select encrypt('test',null);
+----------------------+
| encrypt('test',null) |
+----------------------+
| NULL                 |
+----------------------+
select encrypt('test','');
+--------------------+
| encrypt('test','') |
+--------------------+
| NULL               |
+--------------------+
select encrypt('test',' ');
+---------------------+
| encrypt('test',' ') |
+---------------------+
| NULL                |
+---------------------+
select encrypt('test',"");
+--------------------+
| encrypt('test',"") |
+--------------------+
| NULL               |
+--------------------+
select encrypt('test',true);
+----------------------+
| encrypt('test',true) |
+----------------------+
| NULL                 |
+----------------------+
select encrypt('test',false);
+-----------------------+
| encrypt('test',false) |
+-----------------------+
| NULL                  |
+-----------------------+
select encrypt('test','\n');
+----------------------+
| encrypt('test','\n') |
+----------------------+
| NULL                 |
+----------------------+
select encrypt('test','\t');
+----------------------+
| encrypt('test','\t') |
+----------------------+
| NULL                 |
+----------------------+
select encrypt('test',1000000000000000000000000000000000000000000000000000000000000000000000000000000000);
+----------------------------------------------------------------------------------------------------+
| encrypt('test',1000000000000000000000000000000000000000000000000000000000000000000000000000000000) |
+----------------------------------------------------------------------------------------------------+
| 109qlJe/bF3vE                                                                                      |
+----------------------------------------------------------------------------------------------------+
select encrypt('test',10000000000000000000000000000000000000000000000000000000);
+--------------------------------------------------------------------------+
| encrypt('test',10000000000000000000000000000000000000000000000000000000) |
+--------------------------------------------------------------------------+
| 109qlJe/bF3vE                                                            |
+--------------------------------------------------------------------------+
select encrypt('test',rpad('abc',100,'abc'));
+---------------------------------------+
| encrypt('test',rpad('abc',100,'abc')) |
+---------------------------------------+
| abgOeLfPimXQo                         |
+---------------------------------------+
select encrypt('test',concat('a','b'));
+---------------------------------+
| encrypt('test',concat('a','b')) |
+---------------------------------+
| abgOeLfPimXQo                   |
+---------------------------------+
drop table t1;
create table t1(
c1 time,
c2 date,
c3 year,
c4 datetime,
c5 timestamp);
insert into t1 values('01:02:03','2022-10-14','2022','2022-10-14 11:11:11','2022-10-14 11:11:11.123456');
insert into t1 values('02:02:03','2022-10-15','2022','2022-10-15 11:11:11','2022-10-15 11:11:11.123456');
insert into t1 values('03:02:03','2022-10-16','2022','2022-10-16 11:11:11','2022-10-16 11:11:11.123456');
insert into t1 values('04:02:03','2022-10-17','2022','2022-10-17 11:11:11','2022-10-17 11:11:11.123456');
select * from t1;
+----------+------------+------+---------------------+---------------------+
| c1       | c2         | c3   | c4                  | c5                  |
+----------+------------+------+---------------------+---------------------+
| 01:02:03 | 2022-10-14 | 2022 | 2022-10-14 11:11:11 | 2022-10-14 11:11:11 |
| 02:02:03 | 2022-10-15 | 2022 | 2022-10-15 11:11:11 | 2022-10-15 11:11:11 |
| 03:02:03 | 2022-10-16 | 2022 | 2022-10-16 11:11:11 | 2022-10-16 11:11:11 |
| 04:02:03 | 2022-10-17 | 2022 | 2022-10-17 11:11:11 | 2022-10-17 11:11:11 |
+----------+------------+------+---------------------+---------------------+
select encrypt('str',c1),encrypt('str',c2),encrypt('str',c3),encrypt('str',c4),encrypt('str',c5) from t1;
+-------------------+-------------------+-------------------+-------------------+-------------------+
| encrypt('str',c1) | encrypt('str',c2) | encrypt('str',c3) | encrypt('str',c4) | encrypt('str',c5) |
+-------------------+-------------------+-------------------+-------------------+-------------------+
| 01YoDKUvrJask     | 20iNP1M8QyyT6     | 20iNP1M8QyyT6     | 20iNP1M8QyyT6     | 20iNP1M8QyyT6     |
| 02D4mFk2UVr2w     | 20iNP1M8QyyT6     | 20iNP1M8QyyT6     | 20iNP1M8QyyT6     | 20iNP1M8QyyT6     |
| 038D38EpMkik2     | 20iNP1M8QyyT6     | 20iNP1M8QyyT6     | 20iNP1M8QyyT6     | 20iNP1M8QyyT6     |
| 04vAyMM0b5K.c     | 20iNP1M8QyyT6     | 20iNP1M8QyyT6     | 20iNP1M8QyyT6     | 20iNP1M8QyyT6     |
+-------------------+-------------------+-------------------+-------------------+-------------------+
drop table t1;
create table t1(
c1 tinyint,
c2 smallint,
c3 mediumint,
c4 int,
c5 bigint,
c6 decimal(5,2),
c7 float,
c8 double,
c9 bit(64)
);
insert into t1() values(1,2,3,4,5,6,7,8,9);
insert into t1() values(11,22,33,44,55,66,77,88,99);
insert into t1() values(111,222,333,444,555,666,777,888,999);
select c1,c2,c3,c4,c5,c6,c7,c8,c9+0 from t1;
+------+------+------+------+------+--------+------+------+------+
| c1   | c2   | c3   | c4   | c5   | c6     | c7   | c8   | c9+0 |
+------+------+------+------+------+--------+------+------+------+
|    1 |    2 |    3 |    4 |    5 |   6.00 |    7 |    8 |    9 |
|   11 |   22 |   33 |   44 |   55 |  66.00 |   77 |   88 |   99 |
|  111 |  222 |  333 |  444 |  555 | 666.00 |  777 |  888 |  999 |
+------+------+------+------+------+--------+------+------+------+
select encrypt('str',c1) as c1,
encrypt('str',c2) as c2,
encrypt('str',c3) as c3,
encrypt('str',c4) as c4,
encrypt('str',c5) as c5,
encrypt('str',c6) as c6,
encrypt('str',c7) as c7,
encrypt('str',c8) as c8,
encrypt('str',c9) as c9
from t1;
+---------------+---------------+---------------+---------------+---------------+---------------+---------------+---------------+------+
| c1            | c2            | c3            | c4            | c5            | c6            | c7            | c8            | c9   |
+---------------+---------------+---------------+---------------+---------------+---------------+---------------+---------------+------+
| NULL          | NULL          | NULL          | NULL          | NULL          | 6.cSGy9sPU1aA | NULL          | NULL          | NULL |
| 11p17FBAxSCVA | 225WrQbHdMsYA | 33MQx/W/UoYwE | 44Echk.TbSlJA | 55AUn8pq1KfMI | 66eAdbOr89Rm. | 77G9tsBNFuzQ. | 88VaPlgXkMvow | NULL |
| 11p17FBAxSCVA | 225WrQbHdMsYA | 33MQx/W/UoYwE | 44Echk.TbSlJA | 55AUn8pq1KfMI | 66eAdbOr89Rm. | 77G9tsBNFuzQ. | 88VaPlgXkMvow | NULL |
+---------------+---------------+---------------+---------------+---------------+---------------+---------------+---------------+------+
密码不能是中文
drop table t1;
create table t1(
c1 char(2),
c2 varchar(255),
c3 tinyblob,
c4 tinytext,
c5 blob,
c6 text,
c7 mediumblob,
c8 mediumtext,
c9 longblob,
c10 longtext,
c11 enum('诚信','友善'),
c12 set('杭州','金华','衢州')
);
insert into t1() values('富强','民主','文明','和谐','自由','平等','公正','法治','爱国','敬业','诚信','杭州,金华');
select encrypt('str',c1) as c1,
encrypt('str',c2) as c2,
encrypt('str',c3) as c3,
encrypt('str',c4) as c4,
encrypt('str',c5) as c5,
encrypt('str',c6) as c6,
encrypt('str',c7) as c7,
encrypt('str',c8) as c8,
encrypt('str',c9) as c9,
encrypt('str',c10) as c10,
encrypt('str',c11) as c11,
encrypt('str',c12) as c12
from t1;
+------+------+------+------+------+------+------+------+------+------+------+------+
| c1   | c2   | c3   | c4   | c5   | c6   | c7   | c8   | c9   | c10  | c11  | c12  |
+------+------+------+------+------+------+------+------+------+------+------+------+
| NULL | NULL | NULL | NULL | NULL | NULL | NULL | NULL | NULL | NULL | NULL | NULL |
+------+------+------+------+------+------+------+------+------+------+------+------+
#参数类型
#参数1
select encrypt(1,'password');
+-----------------------+
| encrypt(1,'password') |
+-----------------------+
| pa9GY.rwtojJM         |
+-----------------------+
select encrypt(true,'password');
+--------------------------+
| encrypt(true,'password') |
+--------------------------+
| pa9GY.rwtojJM            |
+--------------------------+
select encrypt(0,'password');
+-----------------------+
| encrypt(0,'password') |
+-----------------------+
| pa5y.tEMAsAWE         |
+-----------------------+
select encrypt(false,'password');
+---------------------------+
| encrypt(false,'password') |
+---------------------------+
| pa5y.tEMAsAWE             |
+---------------------------+
select encrypt(0.01,'password');
+--------------------------+
| encrypt(0.01,'password') |
+--------------------------+
| paiLsbeYZIq7.            |
+--------------------------+
select encrypt(-1234,'password');
+---------------------------+
| encrypt(-1234,'password') |
+---------------------------+
| paKXhROI0UZqM             |
+---------------------------+
select encrypt(1.1234e8,'password');
+------------------------------+
| encrypt(1.1234e8,'password') |
+------------------------------+
| pajLRMdGj.AnU                |
+------------------------------+
select encrypt('helloworld','password');
+----------------------------------+
| encrypt('helloworld','password') |
+----------------------------------+
| pa44EbV1fclG2                    |
+----------------------------------+
select encrypt('你好世界','password');
+------------------------------------+
| encrypt('你好世界','password')     |
+------------------------------------+
| pa8TDuxT5iNeo                      |
+------------------------------------+
select encrypt('123abc','password');
+------------------------------+
| encrypt('123abc','password') |
+------------------------------+
| pa9sqcgGjDTdg                |
+------------------------------+
select encrypt('123abc这是密文','password');
+------------------------------------------+
| encrypt('123abc这是密文','password')     |
+------------------------------------------+
| pasvhxq98Yarw                            |
+------------------------------------------+
select encrypt('こんにちは','password');
+---------------------------------------+
| encrypt('こんにちは','password')      |
+---------------------------------------+
| pa8AnnS1Zb8Bw                         |
+---------------------------------------+
select encrypt('안녕하십니까','password');
+------------------------------------------+
| encrypt('안녕하십니까','password')       |
+------------------------------------------+
| padUCmBsz/eik                            |
+------------------------------------------+
select encrypt('~','password');
+-------------------------+
| encrypt('~','password') |
+-------------------------+
| pakwuPL04Cv5o           |
+-------------------------+
select encrypt('&','password');
+-------------------------+
| encrypt('&','password') |
+-------------------------+
| panzj9gqNN4iw           |
+-------------------------+
select encrypt('$','password');
+-------------------------+
| encrypt('$','password') |
+-------------------------+
| paUR7GXEiWmGQ           |
+-------------------------+
select encrypt('@','password');
+-------------------------+
| encrypt('@','password') |
+-------------------------+
| paO7LSwKS1LcI           |
+-------------------------+
select encrypt('#','password');
+-------------------------+
| encrypt('#','password') |
+-------------------------+
| paT3Fz4i1V6RU           |
+-------------------------+
select encrypt('~！@#￥%^&*()_+','password');
+-----------------------------------------+
| encrypt('~！@#￥%^&*()_+','password')   |
+-----------------------------------------+
| pavraoChFac0k                           |
+-----------------------------------------+
select encrypt(null,'password');
+--------------------------+
| encrypt(null,'password') |
+--------------------------+
| NULL                     |
+--------------------------+
select encrypt('','password');
+------------------------+
| encrypt('','password') |
+------------------------+
|                        |
+------------------------+
select encrypt(' ','password');
+-------------------------+
| encrypt(' ','password') |
+-------------------------+
| paxF/cvFHik7c           |
+-------------------------+
select encrypt('        ','password');
+--------------------------------+
| encrypt('        ','password') |
+--------------------------------+
| paOJAVXW8OZW2                  |
+--------------------------------+
select encrypt(10000000,'password');
+------------------------------+
| encrypt(10000000,'password') |
+------------------------------+
| paKvNqmCn6guk                |
+------------------------------+
select encrypt(1000000000000000000000000000000000000000000000000000000000000000000000000000000000,'password');
+--------------------------------------------------------------------------------------------------------+
| encrypt(1000000000000000000000000000000000000000000000000000000000000000000000000000000000,'password') |
+--------------------------------------------------------------------------------------------------------+
| paKvNqmCn6guk                                                                                          |
+--------------------------------------------------------------------------------------------------------+
select encrypt(rpad('一',100,'一'),'password');
+-------------------------------------------+
| encrypt(rpad('一',100,'一'),'password')   |
+-------------------------------------------+
| pa4MMpL4WrTmY                             |
+-------------------------------------------+
drop table t1;
create table t1(
c1 time,
c2 date,
c3 year,
c4 datetime,
c5 timestamp);
insert into t1 values('01:02:03','2022-10-14','2022','2022-10-14 11:11:11','2022-10-14 11:11:11.123456');
insert into t1 values('02:02:03','2022-10-15','2022','2022-10-15 11:11:11','2022-10-15 11:11:11.123456');
insert into t1 values('03:02:03','2022-10-16','2022','2022-10-16 11:11:11','2022-10-16 11:11:11.123456');
insert into t1 values('04:02:03','2022-10-17','2022','2022-10-17 11:11:11','2022-10-17 11:11:11.123456');
select * from t1;
+----------+------------+------+---------------------+---------------------+
| c1       | c2         | c3   | c4                  | c5                  |
+----------+------------+------+---------------------+---------------------+
| 01:02:03 | 2022-10-14 | 2022 | 2022-10-14 11:11:11 | 2022-10-14 11:11:11 |
| 02:02:03 | 2022-10-15 | 2022 | 2022-10-15 11:11:11 | 2022-10-15 11:11:11 |
| 03:02:03 | 2022-10-16 | 2022 | 2022-10-16 11:11:11 | 2022-10-16 11:11:11 |
| 04:02:03 | 2022-10-17 | 2022 | 2022-10-17 11:11:11 | 2022-10-17 11:11:11 |
+----------+------------+------+---------------------+---------------------+
select encrypt(c1,'passwordstring') as c1,encrypt(c2,'passwordstring') as c2,encrypt(c3,'passwordstring') as c3,
encrypt(c4,'passwordstring') as c4,encrypt(c4,'passwordstring') as c5 from t1;
+---------------+---------------+---------------+---------------+---------------+
| c1            | c2            | c3            | c4            | c5            |
+---------------+---------------+---------------+---------------+---------------+
| paLibRgmEck7k | pa.SioBws5wfM | pamIndzoja4/M | pa.SioBws5wfM | pa.SioBws5wfM |
| papiW6VBAuDlg | pa.SioBws5wfM | pamIndzoja4/M | pa.SioBws5wfM | pa.SioBws5wfM |
| pa060nxJuJoeE | pa.SioBws5wfM | pamIndzoja4/M | pa.SioBws5wfM | pa.SioBws5wfM |
| pahnxMscuhdfA | pa.SioBws5wfM | pamIndzoja4/M | pa.SioBws5wfM | pa.SioBws5wfM |
+---------------+---------------+---------------+---------------+---------------+
drop table t1;
create table t1(
c1 tinyint,
c2 smallint,
c3 mediumint,
c4 int,
c5 bigint,
c6 decimal(5,2),
c7 float,
c8 double,
c9 bit(64)
);
insert into t1() values(1,2,3,4,5,6,7,8,9);
insert into t1() values(11,22,33,44,55,66,77,88,99);
insert into t1() values(111,222,333,444,555,666,777,888,999);
select c1,c2,c3,c4,c5,c6,c7,c8,c9+0 from t1;
+------+------+------+------+------+--------+------+------+------+
| c1   | c2   | c3   | c4   | c5   | c6     | c7   | c8   | c9+0 |
+------+------+------+------+------+--------+------+------+------+
|    1 |    2 |    3 |    4 |    5 |   6.00 |    7 |    8 |    9 |
|   11 |   22 |   33 |   44 |   55 |  66.00 |   77 |   88 |   99 |
|  111 |  222 |  333 |  444 |  555 | 666.00 |  777 |  888 |  999 |
+------+------+------+------+------+--------+------+------+------+
select encrypt(c1,'passwordstring') as c1,
encrypt(c2,'passwordstring') as c2,
encrypt(c3,'passwordstring') as c3,
encrypt(c4,'passwordstring') as c4,
encrypt(c5,'passwordstring') as c5,
encrypt(c6,'passwordstring') as c6,
encrypt(c7,'passwordstring') as c7,
encrypt(c8,'passwordstring') as c8,
encrypt(c9+0,'passwordstring') as c9
from t1;
+---------------+---------------+---------------+---------------+---------------+---------------+---------------+---------------+---------------+
| c1            | c2            | c3            | c4            | c5            | c6            | c7            | c8            | c9            |
+---------------+---------------+---------------+---------------+---------------+---------------+---------------+---------------+---------------+
| pa9GY.rwtojJM | paPF01ZyHzfII | paSzEFh9JUrNA | paKv./8jfmSeY | pa6jJ5j1FwAvg | paoutVCR3LTu6 | paBnOsjCcM4WE | pa5vt70MqaamQ | paQLeOlczhQGA |
| paml86vW/yLnQ | pa4kNAbC/6MgY | paA/znd3wkooI | padkfqrlsHmog | pa2/htZeR8Z7A | paCRW69GnPW.Y | palGSQ05EjVhk | payBf38pRbWfs | padK1kA.MO3cw |
| paAUzR2bzvo26 | paFRgS5FHYEWQ | pa1Ot5/6bGFtM | paw4bI0BIj7ZY | parLWLmzuXMVc | paZgcjH/t/Bh. | pa5OK0b3wYqx2 | paKxx/m7jd8zo | pa0DNUvzaUlJk |
+---------------+---------------+---------------+---------------+---------------+---------------+---------------+---------------+---------------+
drop table t1;
create table t1(
c1 char(2),
c2 varchar(255),
c3 tinyblob,
c4 tinytext,
c5 blob,
c6 text,
c7 mediumblob,
c8 mediumtext,
c9 longblob,
c10 longtext
);
insert into t1() values('富强','民主','文明','和谐','自由','平等','公正','法治','爱国','敬业');
select 
encrypt(c1,'passwordstring') as c1,
encrypt(c2,'passwordstring') as c2,
encrypt(c3,'passwordstring') as c3,
encrypt(c4,'passwordstring') as c4,
encrypt(c5,'passwordstring') as c5,
encrypt(c6,'passwordstring') as c6,
encrypt(c7,'passwordstring') as c7,
encrypt(c8,'passwordstring') as c8,
encrypt(c9,'passwordstring') as c9,
encrypt(c10,'passwordstring') as c10
from t1;
+---------------+---------------+---------------+---------------+---------------+---------------+---------------+---------------+---------------+---------------+
| c1            | c2            | c3            | c4            | c5            | c6            | c7            | c8            | c9            | c10           |
+---------------+---------------+---------------+---------------+---------------+---------------+---------------+---------------+---------------+---------------+
| paF1aHJ.tFMnE | pag94NNnvSSs. | pa/NWOhcr/FiM | paSZ1L/7dKtkU | paDI.Xup3dRsU | pauvITkemlY0o | pa4NRt7yTMIZQ | pa56lblYtAFwA | pa9oTN9Qd7D72 | paTGcLYF0Xwus |
+---------------+---------------+---------------+---------------+---------------+---------------+---------------+---------------+---------------+---------------+
drop table t1;
create table t1(
c1 enum('诚信','友善'),
c2 set('杭州','金华','衢州')
);
insert into t1() values('诚信','杭州,金华');
insert into t1() values('友善','杭州,衢州');
select * from t1;
+--------+---------------+
| c1     | c2            |
+--------+---------------+
| 诚信   | 杭州,金华     |
| 友善   | 杭州,衢州     |
+--------+---------------+
select 
encrypt(c1,'passwordstring') as c1,
encrypt(c2,'passwordstring') as c2
from t1;
+---------------+---------------+
| c1            | c2            |
+---------------+---------------+
| paexgV7XMhrqw | pam0JIsRtKi/U |
| paTPyXhC8wM1I | paPybuuJdBx.A |
+---------------+---------------+
#参数个数
select encrypt();
ERROR 42000: Incorrect parameter count in the call to native function 'encrypt'
select encrypt('aa','bb','bb');
ERROR 42000: Incorrect parameter count in the call to native function 'encrypt'
#字符集
utf8mb4、utf16、binary、gbk、gb18030
select encrypt('str1',_utf8mb4'key');
+-------------------------------+
| encrypt('str1',_utf8mb4'key') |
+-------------------------------+
| ke7WErrerdYxM                 |
+-------------------------------+
select encrypt('1234',_utf16'key2');
+------------------------------+
| encrypt('1234',_utf16'key2') |
+------------------------------+
| keGUu7Gke0qBU                |
+------------------------------+
select encrypt('abcd',_binary'key');
+------------------------------+
| encrypt('abcd',_binary'key') |
+------------------------------+
| keWNwdAlqvHko                |
+------------------------------+
select encrypt('汉字',_gbk'key');
+-----------------------------+
| encrypt('汉字',_gbk'key')   |
+-----------------------------+
| ke8eZJOk73wps               |
+-----------------------------+
select encrypt('中文123',_gb18030'key');
+------------------------------------+
| encrypt('中文123',_gb18030'key')   |
+------------------------------------+
| keHvOojmOT6QA                      |
+------------------------------------+
select encrypt(_utf8mb4'str1','key');
+-------------------------------+
| encrypt(_utf8mb4'str1','key') |
+-------------------------------+
| ke7WErrerdYxM                 |
+-------------------------------+
select encrypt(_utf16'1234','key');
+-----------------------------+
| encrypt(_utf16'1234','key') |
+-----------------------------+
| keGUu7Gke0qBU               |
+-----------------------------+
select encrypt(_binary'abcd','key');
+------------------------------+
| encrypt(_binary'abcd','key') |
+------------------------------+
| keWNwdAlqvHko                |
+------------------------------+
select encrypt(_gbk'汉字','key');
+-----------------------------+
| encrypt(_gbk'汉字','key')   |
+-----------------------------+
| ke8eZJOk73wps               |
+-----------------------------+
select encrypt(_gb18030'中文123','key');
+------------------------------------+
| encrypt(_gb18030'中文123','key')   |
+------------------------------------+
| keHvOojmOT6QA                      |
+------------------------------------+
select encrypt('！@#￥%……&*',_utf8mb4'key' collate utf8mb4_general_ci) as utf8mb4;
+---------------+
| utf8mb4       |
+---------------+
| keeawRwZI0z96 |
+---------------+
select encrypt('123abc',_utf8mb4'key' collate utf8mb4_unicode_ci) as utf8mb4;
+---------------+
| utf8mb4       |
+---------------+
| keKs61tlo173s |
+---------------+
select encrypt('utf8mb4',_utf8mb4'key' collate utf8mb4_bin) as utf8mb4;
+---------------+
| utf8mb4       |
+---------------+
| ke2.iMMRZ3L12 |
+---------------+
select encrypt('加密文本',_utf16'password' collate utf16_general_ci) as utf16;
+---------------+
| utf16         |
+---------------+
| pafYU6mixyC.k |
+---------------+
select encrypt('abcdef',_utf16'password' collate utf16_bin) as utf16;
+---------------+
| utf16         |
+---------------+
| paqvaGMdT4ZDg |
+---------------+
select encrypt('123456',_utf16'password' collate utf16_unicode_ci) as utf16;
+---------------+
| utf16         |
+---------------+
| paa5KD6arxLr2 |
+---------------+
select encrypt('text',_gbk'key' collate gbk_chinese_ci) as gbk;
+---------------+
| gbk           |
+---------------+
| keVFbnvIy1Ejo |
+---------------+
select encrypt('encrypt',_gbk'key' collate gbk_bin) as gbk;
+---------------+
| gbk           |
+---------------+
| kePK.qYPJ02k2 |
+---------------+
select encrypt('_gb18030',_gb18030'key' collate gb18030_chinese_ci) as gb18030;
+---------------+
| gb18030       |
+---------------+
| ke/MxDs62t3/s |
+---------------+
select encrypt('gb18030_bin',_gb18030'key' collate gb18030_bin) as gb18030;
+---------------+
| gb18030       |
+---------------+
| keg1gIJPFUdBs |
+---------------+
select encrypt(_utf8mb4'utf8mb4_general_ci' collate utf8mb4_general_ci, 'key') as utf8mb4;
+---------------+
| utf8mb4       |
+---------------+
| keWnn/rT9jnQQ |
+---------------+
select encrypt(_utf8mb4'utf8mb4_unicode_ci' collate utf8mb4_unicode_ci, 'key') as utf8mb4;
+---------------+
| utf8mb4       |
+---------------+
| keWnn/rT9jnQQ |
+---------------+
select encrypt(_utf8mb4'utf8mb4_bin' collate utf8mb4_bin, 'key') as utf8mb4;
+---------------+
| utf8mb4       |
+---------------+
| keWnn/rT9jnQQ |
+---------------+
select encrypt(_utf16'utf16_general_ci' collate utf16_general_ci, 'key') as utf16;
+---------------+
| utf16         |
+---------------+
| kerwU7GD4Qc/w |
+---------------+
select encrypt(_utf16'88' collate utf16_bin, 'key') as utf16;
+---------------+
| utf16         |
+---------------+
| kem6UO3Zb2/4g |
+---------------+
select encrypt(_utf16'utf16_unicode_ci' collate utf16_unicode_ci, 'key') as utf16;
+---------------+
| utf16         |
+---------------+
| kevM7v6hFOoRA |
+---------------+
select encrypt(_gbk'gbk_chinese_ci' collate gbk_chinese_ci, 'key') gbk;
+---------------+
| gbk           |
+---------------+
| kemYDAy3WKRY. |
+---------------+
select encrypt(_gbk'gbk_bin' collate gbk_bin, 'key') gbk;
+---------------+
| gbk           |
+---------------+
| keqrksXl9W1pw |
+---------------+
select encrypt(_gb18030'gb18030_chinese_ci' collate gb18030_chinese_ci, 'key') as gb18030;
+---------------+
| gb18030       |
+---------------+
| keg1gIJPFUdBs |
+---------------+
select encrypt(_gb18030'gb18030_bin' collate gb18030_bin, 'key') as gb18030;
+---------------+
| gb18030       |
+---------------+
| keg1gIJPFUdBs |
+---------------+
#基础sql语句、视图、约束、索引、函数嵌套
drop table t1;
create table t1(c1 int auto_increment primary key,c2 varbinary(100));
insert into t1(c2) values(encrypt('test','key'));
insert into t1(c2) values(encrypt('222','key'));
insert into t1(c2) values(encrypt('333','key'));
insert into t1(c2) values(encrypt('444','key'));
select * from t1;
+----+---------------+
| c1 | c2            |
+----+---------------+
|  1 | kexq.N/GxyBCQ |
|  2 | ke3s9uoj4sWtc |
|  3 | keH1Amk5H6Lyo |
|  4 | kezzQMMDZjOPY |
+----+---------------+
select * from t1 where c2 = encrypt('test','key');
+----+---------------+
| c1 | c2            |
+----+---------------+
|  1 | kexq.N/GxyBCQ |
+----+---------------+
select c1,c2 from t1 where c2 = encrypt('222','key') group by c1,c2;
+----+---------------+
| c1 | c2            |
+----+---------------+
|  2 | ke3s9uoj4sWtc |
+----+---------------+
select c1,c2 from t1 where c2 = encrypt('333','key') order by 1,2;
+----+---------------+
| c1 | c2            |
+----+---------------+
|  3 | keH1Amk5H6Lyo |
+----+---------------+
select c1,c2 from t1 where c2 = encrypt('333','key') order by 1,2 limit 1;
+----+---------------+
| c1 | c2            |
+----+---------------+
|  3 | keH1Amk5H6Lyo |
+----+---------------+
select c1,c2 from t1 tt1 where exists(select * from t1 tt2 where tt2.c2 = tt1.c2 and tt2.c2 = encrypt('444','key'));
+----+---------------+
| c1 | c2            |
+----+---------------+
|  4 | kezzQMMDZjOPY |
+----+---------------+
select c1,c2 from t1 tt1 where not exists(select * from t1 tt2 where tt2.c2 = tt1.c2 and tt2.c2 = encrypt('444','key'));
+----+---------------+
| c1 | c2            |
+----+---------------+
|  1 | kexq.N/GxyBCQ |
|  2 | ke3s9uoj4sWtc |
|  3 | keH1Amk5H6Lyo |
+----+---------------+
select c1,c2 from t1 where c2 in(encrypt('test','key'),encrypt('222','key'));
+----+---------------+
| c1 | c2            |
+----+---------------+
|  1 | kexq.N/GxyBCQ |
|  2 | ke3s9uoj4sWtc |
+----+---------------+
select c1,c2 from t1 where c2 not in(encrypt('test','key'),encrypt('222','key'));
+----+---------------+
| c1 | c2            |
+----+---------------+
|  3 | keH1Amk5H6Lyo |
|  4 | kezzQMMDZjOPY |
+----+---------------+
select c1,c2 from t1 tt1 where c1 < any(select c1 from t1 tt2 where tt2.c2 in (encrypt('test','key'),encrypt('222','key')));
+----+---------------+
| c1 | c2            |
+----+---------------+
|  1 | kexq.N/GxyBCQ |
+----+---------------+
select c1,c2 from t1 tt1 where c1 = some(select c1 from t1 tt2 where tt2.c2 in (encrypt('test','key'),encrypt('222','key')));
+----+---------------+
| c1 | c2            |
+----+---------------+
|  1 | kexq.N/GxyBCQ |
|  2 | ke3s9uoj4sWtc |
+----+---------------+
select c1,c2 from t1 tt1 where c1 > all(select c1 from t1 tt2 where tt2.c2 in (encrypt('test','key'),encrypt('222','key')));
+----+---------------+
| c1 | c2            |
+----+---------------+
|  3 | keH1Amk5H6Lyo |
|  4 | kezzQMMDZjOPY |
+----+---------------+
update t1 set c2 = encrypt('111','key') where c2 = encrypt('test','key');
delete from t1 where c2 = encrypt('444','key') or c1 between 2 and 3;
select * from t1 order by 1,2;
+----+---------------+
| c1 | c2            |
+----+---------------+
|  1 | keeuWIHXgEYdc |
+----+---------------+
#函数嵌套
select encrypt(encrypt('string','password'),'password');
+--------------------------------------------------+
| encrypt(encrypt('string','password'),'password') |
+--------------------------------------------------+
| paWI9QHMZ.Ykg                                    |
+--------------------------------------------------+
select length(encrypt('aaa','bbbbb'));
+--------------------------------+
| length(encrypt('aaa','bbbbb')) |
+--------------------------------+
|                             13 |
+--------------------------------+
select encrypt(length('12345'),'abc');
+--------------------------------+
| encrypt(length('12345'),'abc') |
+--------------------------------+
| abeDxehHJoJBQ                  |
+--------------------------------+
select encrypt(concat('abc','123'),'password');
+-----------------------------------------+
| encrypt(concat('abc','123'),'password') |
+-----------------------------------------+
| pap3Dci16rN.k                           |
+-----------------------------------------+
select encrypt('123',concat('pass','word'));
+--------------------------------------+
| encrypt('123',concat('pass','word')) |
+--------------------------------------+
| paN8aiEIonqJE                        |
+--------------------------------------+
select bin(encrypt(8,'123'));
+-----------------------+
| bin(encrypt(8,'123')) |
+-----------------------+
| 1100                  |
+-----------------------+
select md5(encrypt('str','password'));
+----------------------------------+
| md5(encrypt('str','password'))   |
+----------------------------------+
| 3997af9436851f980b0e2f7f9b629ecf |
+----------------------------------+
select left(encrypt('string','password'),3);
+--------------------------------------+
| left(encrypt('string','password'),3) |
+--------------------------------------+
| paE                                  |
+--------------------------------------+
select right(encrypt('string','password'),3);
+---------------------------------------+
| right(encrypt('string','password'),3) |
+---------------------------------------+
| uUw                                   |
+---------------------------------------+
select reverse(encrypt('string','password'));
+---------------------------------------+
| reverse(encrypt('string','password')) |
+---------------------------------------+
| wUuhX0VMy3Eap                         |
+---------------------------------------+
select substring(encrypt('str','password'),4);
+----------------------------------------+
| substring(encrypt('str','password'),4) |
+----------------------------------------+
| HrO5E86gxc                             |
+----------------------------------------+
select if(1=1,encrypt('if1', 'password'),encrypt('if2', 'password'));
+---------------------------------------------------------------+
| if(1=1,encrypt('if1', 'password'),encrypt('if2', 'password')) |
+---------------------------------------------------------------+
| pa15ZBPu2ppSc                                                 |
+---------------------------------------------------------------+
select if(1>1,encrypt('if1', 'password'),encrypt('if2', 'password'));
+---------------------------------------------------------------+
| if(1>1,encrypt('if1', 'password'),encrypt('if2', 'password')) |
+---------------------------------------------------------------+
| paxVNgeU57FVo                                                 |
+---------------------------------------------------------------+
select ifnull(null,encrypt('cleartext', 'password'));
+-----------------------------------------------+
| ifnull(null,encrypt('cleartext', 'password')) |
+-----------------------------------------------+
| pa9PvnwNB1u7Q                                 |
+-----------------------------------------------+
select nullif(encrypt('str1', 'password'),encrypt('str2', 'password'));
+-----------------------------------------------------------------+
| nullif(encrypt('str1', 'password'),encrypt('str2', 'password')) |
+-----------------------------------------------------------------+
| pal5C8Z5tDib6                                                   |
+-----------------------------------------------------------------+
select case encrypt('case1','password')
	when encrypt('case1','pa') then '成功解密'
	else '解密失败'
	end as col1;
+--------------+
| col1         |
+--------------+
| 成功解密     |
+--------------+
select case when encrypt('123case2','password') = encrypt('123case2222','password') 
	then '成功解密' 
	else '解密失败' 
	end as col1;
+--------------+
| col1         |
+--------------+
| 成功解密     |
+--------------+
select case encrypt('case3','password')
	when encrypt('case','password') then 'oh!'
	when encrypt('case3','password') then 'yah'
	end as col1;
+------+
| col1 |
+------+
| yah  |
+------+
#视图
drop table t1;
create table t1(c1 int auto_increment primary key,c2 varbinary(100));
insert into t1(c2) values(encrypt('1','key'));
insert into t1(c2) values(encrypt('22','key'));
insert into t1(c2) values(encrypt('333','key'));
insert into t1(c2) values(encrypt('4444','key'));
select * from t1;
+----+---------------+
| c1 | c2            |
+----+---------------+
|  1 | kejDWW0p7.U4M |
|  2 | kezrB31pNYVRQ |
|  3 | keH1Amk5H6Lyo |
|  4 | ken4YOezXy9tI |
+----+---------------+
drop view tp1;
create view tp1 as select * from t1;
select encrypt(c2,'password') from tp1;
+------------------------+
| encrypt(c2,'password') |
+------------------------+
| pa/SuZPQlAwGg          |
| pao2sPfgdK.XQ          |
| pa4RaWDGpt28A          |
| paMIXzV841YeE          |
+------------------------+
select * from tp1 where c2  = encrypt('1','key');
+----+---------------+
| c1 | c2            |
+----+---------------+
|  1 | kejDWW0p7.U4M |
+----+---------------+
select c1,c2 from tp1 where c2 = encrypt('22','key') group by c1,c2;
+----+---------------+
| c1 | c2            |
+----+---------------+
|  2 | kezrB31pNYVRQ |
+----+---------------+
select c1,c2 from tp1 where c2 = encrypt('333','key') order by 1,2;
+----+---------------+
| c1 | c2            |
+----+---------------+
|  3 | keH1Amk5H6Lyo |
+----+---------------+
select c1,c2 from tp1 where c2 = encrypt('4444','key') order by 1,2 limit 1;
+----+---------------+
| c1 | c2            |
+----+---------------+
|  4 | ken4YOezXy9tI |
+----+---------------+
select c1,c2 from tp1 where c2 in(encrypt('1','key'),encrypt('22','key'));
+----+---------------+
| c1 | c2            |
+----+---------------+
|  1 | kejDWW0p7.U4M |
|  2 | kezrB31pNYVRQ |
+----+---------------+
select c1,c2 from tp1 where c2 not in(encrypt('1','key'),encrypt('22','key'));
+----+---------------+
| c1 | c2            |
+----+---------------+
|  3 | keH1Amk5H6Lyo |
|  4 | ken4YOezXy9tI |
+----+---------------+
update tp1 set c2 = encrypt('111','key') where c2 = encrypt('test','key');
delete from tp1 where c2 = encrypt('4444','key') or c1 between 2 and 3;
select * from tp1 order by 1,2;
+----+---------------+
| c1 | c2            |
+----+---------------+
|  1 | kejDWW0p7.U4M |
+----+---------------+
复制表
drop table test;
create table test(c1 int auto_increment primary key,c2 varbinary(100));
drop table t1;
create table t1 select * from test;
alter table t1 modify c1 int auto_increment primary key;
insert into t1(c2) values(encrypt('a','key'));
insert into t1(c2) values(encrypt('ab','key'));
insert into t1(c2) values(encrypt('abc','key'));
insert into t1(c2) values(encrypt('abcd','key'));
select * from t1;
+----+---------------+
| c1 | c2            |
+----+---------------+
|  1 | keda3lT2TTWHc |
|  2 | ked0Jip4wYJ06 |
|  3 | keM8X5Eg.JKRQ |
|  4 | keWNwdAlqvHko |
+----+---------------+
select encrypt(c2,'key') from t1;
+-------------------+
| encrypt(c2,'key') |
+-------------------+
| key3Dar5JYsus     |
| ke/Rc8s6O7myM     |
| ke.2kUGS2P9T2     |
| kefaFsKBDZ8ts     |
+-------------------+
select * from t1 where c2 = encrypt('a','key');
+----+---------------+
| c1 | c2            |
+----+---------------+
|  1 | keda3lT2TTWHc |
+----+---------------+
select c1,c2 from t1 where c2 = encrypt('ab','key') group by c1,c2;
+----+---------------+
| c1 | c2            |
+----+---------------+
|  2 | ked0Jip4wYJ06 |
+----+---------------+
select c1,c2 from t1 where c2 = encrypt('abc','key') order by 1,2;
+----+---------------+
| c1 | c2            |
+----+---------------+
|  3 | keM8X5Eg.JKRQ |
+----+---------------+
select c1,c2 from t1 where c2 = encrypt('abcd','key') order by 1,2 limit 1;
+----+---------------+
| c1 | c2            |
+----+---------------+
|  4 | keWNwdAlqvHko |
+----+---------------+
select c1,c2 from t1 tt1 where exists(select * from t1 tt2 where tt2.c2 = tt1.c2 and tt2.c2 = encrypt('abcd','key'));
+----+---------------+
| c1 | c2            |
+----+---------------+
|  4 | keWNwdAlqvHko |
+----+---------------+
select c1,c2 from t1 tt1 where not exists(select * from t1 tt2 where tt2.c2 = tt1.c2 and tt2.c2 = encrypt('abcd','key'));
+----+---------------+
| c1 | c2            |
+----+---------------+
|  1 | keda3lT2TTWHc |
|  2 | ked0Jip4wYJ06 |
|  3 | keM8X5Eg.JKRQ |
+----+---------------+
select c1,c2 from t1 where c2 in(encrypt('a','key'),encrypt('ab','key'));
+----+---------------+
| c1 | c2            |
+----+---------------+
|  1 | keda3lT2TTWHc |
|  2 | ked0Jip4wYJ06 |
+----+---------------+
select c1,c2 from t1 where c2 not in(encrypt('a','key'),encrypt('ab','key'));
+----+---------------+
| c1 | c2            |
+----+---------------+
|  3 | keM8X5Eg.JKRQ |
|  4 | keWNwdAlqvHko |
+----+---------------+
select c1,c2 from t1 tt1 where c1 < any(select c1 from t1 tt2 where tt2.c2 in (encrypt('a','key'),encrypt('ab','key')));
+----+---------------+
| c1 | c2            |
+----+---------------+
|  1 | keda3lT2TTWHc |
+----+---------------+
select c1,c2 from t1 tt1 where c1 = some(select c1 from t1 tt2 where tt2.c2 in (encrypt('a','key'),encrypt('ab','key')));
+----+---------------+
| c1 | c2            |
+----+---------------+
|  1 | keda3lT2TTWHc |
|  2 | ked0Jip4wYJ06 |
+----+---------------+
select c1,c2 from t1 tt1 where c1 > all(select c1 from t1 tt2 where tt2.c2 in (encrypt('a','key'),encrypt('ab','key')));
+----+---------------+
| c1 | c2            |
+----+---------------+
|  3 | keM8X5Eg.JKRQ |
|  4 | keWNwdAlqvHko |
+----+---------------+
update t1 set c2 = encrypt('AAAA','key') where c2 = encrypt('a','key');
delete from t1 where c2 = encrypt('abcd','key') or c1 between 2 and 3;
select * from t1 order by 1,2;
+----+---------------+
| c1 | c2            |
+----+---------------+
|  1 | kejJ7ue2AoF4E |
+----+---------------+
分区表
hash
drop table t1;
create table t1(
c1 int,
c2 varbinary(100)
)
partition by hash(c1)(
partition p0,
partition p1);
insert into t1() values(1,encrypt('一','password1'));
insert into t1() values(2,encrypt('二','password2'));
insert into t1() values(3,encrypt('三','password3'));
insert into t1() values(4,encrypt('四','password4'));
select * from t1 partition(p0);
+------+---------------+
| c1   | c2            |
+------+---------------+
|    2 | pa7NVil9hIoVY |
|    4 | paU7Tg3tECI36 |
+------+---------------+
select * from t1 partition(p1);
+------+---------------+
| c1   | c2            |
+------+---------------+
|    1 | pav4BEbWeso9o |
|    3 | paspuE4HXJX.. |
+------+---------------+
select c1,encrypt(c2,'key') from t1 where c1 = 1 and c2 = encrypt('一','password1');
+------+-------------------+
| c1   | encrypt(c2,'key') |
+------+-------------------+
|    1 | keiNb0nDVt0KE     |
+------+-------------------+
update t1 set c1 = 22 where c2 = encrypt('二','password2');
delete from t1 where c1 = 3 or c2 = encrypt('四','password4');
select * from t1 order by 1,2;
+------+---------------+
| c1   | c2            |
+------+---------------+
|    1 | pav4BEbWeso9o |
|   22 | pa7NVil9hIoVY |
+------+---------------+
range
drop table t1;
create table t1(
c1 int,
c2 varbinary(100))
partition by range(c1)(
partition p0 values less than (10),
partition p1 values less than (20),
partition pmax values less than (maxvalue));
insert into t1() values(1,encrypt('01','01'));
insert into t1() values(3,encrypt('03','03'));
insert into t1() values(11,encrypt('11','11'));
insert into t1() values(21,encrypt('21','21'));
select * from t1;
+------+---------------+
| c1   | c2            |
+------+---------------+
|    1 | 01dLL7DVIjVMQ |
|    3 | 03A1/GhjxDiAs |
|   11 | 11aU9op2K293Y |
|   21 | 21mJ/VWxpw1EI |
+------+---------------+
insert into t1() values(31,encrypt('31','31'));
select * from t1 where c1 = 1 and c2 = encrypt('01','01');
+------+---------------+
| c1   | c2            |
+------+---------------+
|    1 | 01dLL7DVIjVMQ |
+------+---------------+
update t1 set c2 = encrypt('99','99') where c2 = encrypt('21','21');
delete from t1 where c2 = encrypt('03','03');
select * from t1 order by 1,2;
+------+---------------+
| c1   | c2            |
+------+---------------+
|    1 | 01dLL7DVIjVMQ |
|   11 | 11aU9op2K293Y |
|   21 | 995m4y2LvJQrU |
|   31 | 31JBS0y.pruf6 |
+------+---------------+
list
drop table t1;
create table t1(
c1 int,c2 blob)
partition by list(c1)(
partition p0 values in(1,2,3),
partition p1 values in(4,5,6),
partition p2 values in(7,8,9)
);
insert into t1() values(1,encrypt('123','11'));
insert into t1() values(4,encrypt('abc','aa'));
insert into t1() values(7,encrypt('汉字','hz'));
select * from t1 partition(p0);
+------+---------------+
| c1   | c2            |
+------+---------------+
|    1 | 11pYmQYVpCokU |
+------+---------------+
select * from t1 partition(p1);
+------+---------------+
| c1   | c2            |
+------+---------------+
|    4 | aaMjTET7rKV4Y |
+------+---------------+
select * from t1 partition(p2);
+------+---------------+
| c1   | c2            |
+------+---------------+
|    7 | hz6OvV1xCvb42 |
+------+---------------+
select * from t1 tt1 left join t1 tt2 on tt1.c2 = tt2.c2 where tt1.c2 = encrypt('123','11');
+------+---------------+------+---------------+
| c1   | c2            | c1   | c2            |
+------+---------------+------+---------------+
|    1 | 11pYmQYVpCokU |    1 | 11pYmQYVpCokU |
+------+---------------+------+---------------+
update t1 set c1 = 5 where c2 = encrypt('abc','aa');
delete from t1 where c2 = encrypt('汉字','hz');
select * from t1 order by 1,2;
+------+---------------+
| c1   | c2            |
+------+---------------+
|    1 | 11pYmQYVpCokU |
|    5 | aaMjTET7rKV4Y |
+------+---------------+
key
drop table t1;
create table t1(
c1 int,c2 blob)
partition by key(c1)
partitions 2;
insert into t1() values(1,encrypt('a','password1'));
insert into t1() values(2,encrypt('b','password2'));
insert into t1() values(3,encrypt('c','password3'));
insert into t1() values(4,encrypt('d','password4'));
select * from t1 order by 1,2;
+------+---------------+
| c1   | c2            |
+------+---------------+
|    1 | paCnv9ivNC20o |
|    2 | pa0nOH/Fzv9xE |
|    3 | paH8Pzts9gDnA |
|    4 | paraNuK4CgSPc |
+------+---------------+
select c1,encrypt(c2,'password1') as new_c2 from t1;
+------+---------------+
| c1   | new_c2        |
+------+---------------+
|    1 | pa1el3KVZ8mHk |
|    2 | pasu0Bs7tli1s |
|    3 | paDAi3KnwQYA6 |
|    4 | paCxWqkGCpY32 |
+------+---------------+
update t1 set c2 = encrypt('bcde','key2') where c1 = 2;
delete from t1 where c1 = 3 or c2 = encrypt('d','password4');
select * from t1 order by 1,2;
+------+---------------+
| c1   | c2            |
+------+---------------+
|    1 | paCnv9ivNC20o |
|    2 | keDiv0IcCBu6Y |
+------+---------------+
range-hash
drop table t1;
create table t1(
id int auto_increment,
username varchar(255) not null,
password blob,
birthdate date not null,
primary key (id,birthdate),
key idx_usr(username))
partition by range(id)
subpartition by hash(year(birthdate))
subpartitions 3
(
partition p1 values less than (100),
partition p2 values less than maxvalue
);
insert into t1() values(1,'xiaoyi',encrypt(123456,'123456'),'2018-01-01');
insert into t1() values(2,'xiaoer',encrypt('abcdef','abcdef'),'2019-02-02');
insert into t1() values(3,'xiaosan',encrypt('黄龙时代','hlsd'),'2020-03-03');
insert into t1() values(4,'xiaosi',encrypt('123just爬','up'),'2021-04-04');
select * from t1 order by 1,2,3,4;
+----+----------+---------------+------------+
| id | username | password      | birthdate  |
+----+----------+---------------+------------+
|  1 | xiaoyi   | 12tir.zIbWQ3c | 2018-01-01 |
|  2 | xiaoer   | abDMWw5NL.afs | 2019-02-02 |
|  3 | xiaosan  | hlnS61MWPH/Mk | 2020-03-03 |
|  4 | xiaosi   | up/tyzmxYY.eY | 2021-04-04 |
+----+----------+---------------+------------+
select * from t1 where password = encrypt(123456,'123456');
+----+----------+---------------+------------+
| id | username | password      | birthdate  |
+----+----------+---------------+------------+
|  1 | xiaoyi   | 12tir.zIbWQ3c | 2018-01-01 |
+----+----------+---------------+------------+
update t1 set password = encrypt(654321,'654321') where birthdate = '2018-01-01';
delete from t1 where password = encrypt('123just爬','up');
select * from t1 order by 1,2,3,4;
+----+----------+---------------+------------+
| id | username | password      | birthdate  |
+----+----------+---------------+------------+
|  1 | xiaoyi   | 65zLuiSASj6m2 | 2018-01-01 |
|  2 | xiaoer   | abDMWw5NL.afs | 2019-02-02 |
|  3 | xiaosan  | hlnS61MWPH/Mk | 2020-03-03 |
+----+----------+---------------+------------+
#存储过程
drop table t1;
create table t1(id int auto_increment primary key,name varchar(255),password varchar(255));
insert into t1 values(1,'张三','a123456');
insert into t1 values(2,'李四','b223456');
insert into t1 values(3,'王五','c323456');
insert into t1 values(4,'小六','d423456');
drop table t2;
create table t2(sid int,miwen varchar(255));
#无参数的存储过程
drop procedure p1_encrypt;//
create procedure p1_encrypt()
begin
    declare a varchar(255);
    declare i int default 1;
    while i <= 4 do
	  select encrypt(password,'key') into a from t1 where id = i;
	  insert into t2 values(i,a);
	  set i = i + 1;
	end while;
end;
//
call p1_encrypt();
select * from t2 order by 1,2;
+------+---------------+
| sid  | miwen         |
+------+---------------+
|    1 | keDhWOP5QSk3I |
|    2 | kePAy0.1PK64U |
|    3 | keG1mgAKo8eag |
|    4 | kehS8FgUrh47. |
+------+---------------+
#有参数的存储过程(in)
delete from t2;
drop procedure p1_encrypt;//
create procedure p1_encrypt(in aa int)
begin
    declare a varchar(255);
    declare i int default aa;
    repeat
	  select encrypt(password,'key') into a from t1 where id = i;
	  insert into t2 values(i,a);
	  set i = i + 1;
	until i > 4
	end repeat;
end;
//
call p1_encrypt(1);
select * from t2 order by 1,2;
+------+---------------+
| sid  | miwen         |
+------+---------------+
|    1 | keDhWOP5QSk3I |
|    2 | kePAy0.1PK64U |
|    3 | keG1mgAKo8eag |
|    4 | kehS8FgUrh47. |
+------+---------------+
#有参数的存储过程(out)
delete from t2;
drop procedure p1_encrypt;//
create procedure p1_encrypt(out aa varchar(255))
begin
    declare i int default 1;
    while i <= 4 do
	  select encrypt(password,'key') into aa from t1 where id = i;
	  insert into t2 values(i,aa);
	  set i = i + 1;
	end while;
end;
//
call p1_encrypt(@aa);
select * from t2 order by 1,2;
+------+---------------+
| sid  | miwen         |
+------+---------------+
|    1 | keDhWOP5QSk3I |
|    2 | kePAy0.1PK64U |
|    3 | keG1mgAKo8eag |
|    4 | kehS8FgUrh47. |
+------+---------------+
#自定义函数
drop function f_encrypt;//
create  function f_encrypt() returns  varchar(255) READS SQL DATA
begin
    declare aa varchar(255);
	select encrypt(password,'key') into aa from t1 where id = 1;
	return aa;
end;
//
select f_encrypt();
+---------------+
| f_encrypt()   |
+---------------+
| keDhWOP5QSk3I |
+---------------+
drop function f_encrypt;
create function f_encrypt(aa varchar(255),bb varchar(255)) returns varchar(255)
begin
	return encrypt(aa,bb);
end;
//
select f_encrypt('str1','key');
+-------------------------+
| f_encrypt('str1','key') |
+-------------------------+
| ke7WErrerdYxM           |
+-------------------------+
drop function f_encrypt;
create function f_encrypt() returns varchar(255)
begin
	declare value varchar(255);
	declare value1 varchar(255);
	set value = 'str2';
	set value1 = 'key';
	return encrypt(value,value1);
end;
//
select f_encrypt();
+---------------+
| f_encrypt()   |
+---------------+
| keB2Gk9QOJJXc |
+---------------+
#触发器
drop trigger trigger_encrypt;//
create trigger trigger_encrypt before insert 
on t1 for each row
begin
    set new.password = encrypt(new.name,'insert');
end;
//
insert into t1(id,name) values(5,'七七');
select * from t1 order by 1;
+----+--------+---------------+
| id | name   | password      |
+----+--------+---------------+
|  1 | 张三   | a123456       |
|  2 | 李四   | b223456       |
|  3 | 王五   | c323456       |
|  4 | 小六   | d423456       |
|  5 | 七七   | in5iqIf9xyjV2 |
+----+--------+---------------+
drop database if exists yx5493;
PURGE RECYCLEBIN;
