drop user cwx;
drop database if exists cwx;
create database cwx;
use cwx;
create user 'cwx'@'%' identified by 'cwx';
grant all privileges on *.* to 'cwx'@'%';
DROP TABLE IF EXISTS cool_deal;
select @@sql_mode;
@@sql_mode
STRICT_ALL_TABLES,NO_ZERO_IN_DATE,NO_AUTO_CREATE_USER
CREATE TABLE `cool_deal` (
`deal_id` int(11) NOT NULL AUTO_INCREMENT COMMENT '交易流水ID',
`agent_id` varchar(11) DEFAULT NULL,
`business_id` varchar(11) DEFAULT NULL,
`door_id` varchar(11) DEFAULT NULL,
`out_trade_id` varchar(40) DEFAULT NULL,
`status` int(1) NOT NULL DEFAULT '0' COMMENT '状态（1,已支付，2，未支付，3已退款，4部分退款,5订单撤销，支付宝和微信主动退款）',
`transation_id` varchar(32) DEFAULT NULL COMMENT '微信订单号',
`total_fee` decimal(10,2) DEFAULT NULL COMMENT '总金额',
`bonus_fee` decimal(10,2) DEFAULT '0.00' COMMENT '微信补贴',
`cash_fee` decimal(10,2) NOT NULL COMMENT '实际支付',
`pay_type` varchar(20) DEFAULT NULL COMMENT '支付方式',
`pay_pass` varchar(20) NOT NULL DEFAULT '010',
`admin_id` varchar(11) DEFAULT NULL,
`regtime` varchar(11) DEFAULT NULL,
`remark_one_value` varchar(255) DEFAULT NULL COMMENT '备注一',
`remark_two_value` varchar(255) DEFAULT NULL COMMENT '备注二',
`remark_three_value` varchar(255) DEFAULT NULL COMMENT '备注三',
`from_business_trade_id` varchar(128) DEFAULT NULL,
`is_read` int(1) NOT NULL DEFAULT '0',
`app_id` varchar(200) DEFAULT NULL,
`open_id` varchar(255) DEFAULT '0' COMMENT '支付人微信OPENID',
`order_type` int(11) DEFAULT NULL,
`order_regtime` int(11) DEFAULT NULL,
`discount_amt` decimal(10,2) DEFAULT NULL,
`offer_type` varchar(20) DEFAULT NULL,
`device_id` int(11) DEFAULT NULL COMMENT '扫码设备编号,设备表bind_flag_no',
`attach` varchar(255) DEFAULT NULL COMMENT '附加数据',
`bank_type` varchar(30) DEFAULT NULL COMMENT '付款银行',
`pay_log_id` varchar(40) DEFAULT NULL COMMENT '西银在线流水号',
`activity_type` varchar(30) DEFAULT NULL COMMENT '三方平台活动类型',
`user_id` varchar(11) DEFAULT NULL COMMENT '用户标识',
`trade_body` varchar(255) DEFAULT NULL COMMENT '商品信息',
`longitude` decimal(15,10) DEFAULT '0.0000000000' COMMENT '经度',
`latitude` decimal(15,10) DEFAULT '0.0000000000' COMMENT '纬度',
`ip` varchar(30) DEFAULT '' COMMENT 'ip地址',
`pay_card_type` varchar(2) DEFAULT '' COMMENT '支付卡类型：01-借记卡，02-信用卡，03-余额，04-其他',
`order_source` varchar(3) DEFAULT '001' COMMENT '订单来源，默认001 西银惠付',
PRIMARY KEY (`deal_id`),
UNIQUE KEY `out_trade_id` (`out_trade_id`),
KEY `business_id` (`business_id`),
KEY `door_id` (`door_id`),
KEY `regtime_bdoor_idx` (`regtime`, `business_id`, `door_id`),
KEY `regtime_idx` (`regtime`),
KEY `pay_log_id` (`pay_log_id`),
KEY `origin_trade_no` (`from_business_trade_id`),
KEY `b_d_u_r_idx` (`business_id`, `door_id`, `user_id`, `regtime`),
KEY `b_o_o_idx` (`business_id`, `order_regtime`, `order_type`)
) AUTO_INCREMENT = 8178461 DEFAULT CHARSET = utf8mb4 ROW_FORMAT = DYNAMIC;
INSERT ignore INTO cool_deal (`agent_id`,`business_id`,`door_id`,`out_trade_id`,`status`,`transation_id`,`total_fee`,`bonus_fee`,`cash_fee`,`pay_type`,`pay_pass`,`admin_id`,`regtime`,`remark_one_value`,`remark_two_value`,`remark_three_value`,`from_business_trade_id`,`app_id`,`user_id`) VALUES ('a','a','a','a',10,'a',10,10,10,'a','a','a','a','a','a','a','a','a','a');
INSERT ignore INTO cool_deal (`agent_id`,`business_id`,`door_id`,`out_trade_id`,`status`,`transation_id`,`total_fee`,`bonus_fee`,`cash_fee`,`pay_type`,`pay_pass`,`admin_id`,`regtime`,`remark_one_value`,`remark_two_value`,`remark_three_value`,`from_business_trade_id`,`app_id`,`user_id`) VALUES ('a','a','a','a',10,'a',10,10,10,'a','a','a','a','a','a','a','a','a','a');
INSERT ignore INTO cool_deal (`agent_id`,`business_id`,`door_id`,`out_trade_id`,`status`,`transation_id`,`total_fee`,`bonus_fee`,`cash_fee`,`pay_type`,`pay_pass`,`admin_id`,`regtime`,`remark_one_value`,`remark_two_value`,`remark_three_value`,`from_business_trade_id`,`app_id`,`user_id`) VALUES ('','','','','','','','','','','','','','','','','','','');
INSERT ignore INTO cool_deal (`agent_id`,`business_id`,`door_id`,`out_trade_id`,`status`,`transation_id`,`total_fee`,`bonus_fee`,`cash_fee`,`pay_type`,`pay_pass`,`admin_id`,`regtime`,`remark_one_value`,`remark_two_value`,`remark_three_value`,`from_business_trade_id`,`app_id`,`user_id`) VALUES ('1','1','1','1','1','1','1','1','1','1','1','1','1','1','1','1','1','1','1');
INSERT ignore INTO cool_deal (`agent_id`,`business_id`,`door_id`,`out_trade_id`,`status`,`transation_id`,`total_fee`,`bonus_fee`,`cash_fee`,`pay_type`,`pay_pass`,`admin_id`,`regtime`,`remark_one_value`,`remark_two_value`,`remark_three_value`,`from_business_trade_id`,`app_id`,`user_id`) VALUES (rpad('1',100,'1'),rpad('1',100,'1'),rpad('1',100,'1'),rpad('1',100,'1'),rpad('1',100,'1'),rpad('1',100,'1'),rpad('1',100,'1'),rpad('1',100,'1'),rpad('1',100,'1'),rpad('1',100,'1'),rpad('1',100,'1'),rpad('1',100,'1'),rpad('1',100,'1'),rpad('1',100,'1'),rpad('1',100,'1'),rpad('1',100,'1'),rpad('1',100,'1'),rpad('1',100,'1'),rpad('1',100,'1'));
select agent_id,business_id,door_id,out_trade_id,status,transation_id,total_fee,bonus_fee,cash_fee,pay_type,pay_pass,admin_id,regtime,remark_one_value,remark_two_value,remark_three_value,from_business_trade_id,is_read,app_id,open_id,order_type,order_regtime,discount_amt,offer_type,device_id,attach,bank_type,pay_log_id,activity_type,user_id,trade_body,longitude,latitude,ip,pay_card_type,order_source from cool_deal order by deal_id;
agent_id	business_id	door_id	out_trade_id	status	transation_id	total_fee	bonus_fee	cash_fee	pay_type	pay_pass	admin_id	regtime	remark_one_value	remark_two_value	remark_three_value	from_business_trade_id	is_read	app_id	open_id	order_type	order_regtime	discount_amt	offer_type	device_id	attach	bank_type	pay_log_id	activity_type	user_id	trade_body	longitude	latitude	ip	pay_card_type	order_source
a	a	a	a	10	a	10.00	10.00	10.00	a	a	a	a	a	a	a	a	0	a	0	NULL	NULL	NULL	NULL	NULL	NULL	NULL	NULL	NULL	a	NULL	0.0000000000	0.0000000000			001
				0		0.00	0.00	0.00									0		0	NULL	NULL	NULL	NULL	NULL	NULL	NULL	NULL	NULL		NULL	0.0000000000	0.0000000000			001
1	1	1	1	1	1	1.00	1.00	1.00	1	1	1	1	1	1	1	1	0	1	0	NULL	NULL	NULL	NULL	NULL	NULL	NULL	NULL	NULL	1	NULL	0.0000000000	0.0000000000			001
11111111111	11111111111	11111111111	1111111111111111111111111111111111111111	2147483647	11111111111111111111111111111111	99999999.99	99999999.99	99999999.99	11111111111111111111	11111111111111111111	11111111111	11111111111	1111111111111111111111111111111111111111111111111111111111111111111111111111111111111111111111111111	1111111111111111111111111111111111111111111111111111111111111111111111111111111111111111111111111111	1111111111111111111111111111111111111111111111111111111111111111111111111111111111111111111111111111	1111111111111111111111111111111111111111111111111111111111111111111111111111111111111111111111111111	0	1111111111111111111111111111111111111111111111111111111111111111111111111111111111111111111111111111	0	NULL	NULL	NULL	NULL	NULL	NULL	NULL	NULL	NULL	11111111111	NULL	0.0000000000	0.0000000000			001
delete from cool_deal;
INSERT ignore INTO cool_deal (`agent_id`,`business_id`,`door_id`,`out_trade_id`,`status`,`transation_id`,`total_fee`,`bonus_fee`,`cash_fee`,`pay_type`,`pay_pass`,`admin_id`,`regtime`,`remark_one_value`,`remark_two_value`,`remark_three_value`,`from_business_trade_id`,`app_id`,`user_id`) VALUES ('1','1','1','\n','1','1','1','1','1','1','1','1','1','1','1','1','1','1','1');
INSERT ignore INTO cool_deal (`agent_id`,`business_id`,`door_id`,`out_trade_id`,`status`,`transation_id`,`total_fee`,`bonus_fee`,`cash_fee`,`pay_type`,`pay_pass`,`admin_id`,`regtime`,`remark_one_value`,`remark_two_value`,`remark_three_value`,`from_business_trade_id`,`app_id`,`user_id`) VALUES ('1','1','1','\t','1','1','1','1','1','1','1','1','1','1','1','1','1','1','1');
INSERT ignore INTO cool_deal (`agent_id`,`business_id`,`door_id`,`out_trade_id`,`status`,`transation_id`,`total_fee`,`bonus_fee`,`cash_fee`,`pay_type`,`pay_pass`,`admin_id`,`regtime`,`remark_one_value`,`remark_two_value`,`remark_three_value`,`from_business_trade_id`,`app_id`,`user_id`) VALUES ('1','1','1','','1','1','1','1','1','1','1','1','1','1','1','1','1','1','1'),('1','1','1',null,'1','1','1','1','1','1','1','1','1','1','1','1','1','1','1'),('1','1','1',NULL,'1','1','1','1','1','1','1','1','1','1','1','1','1','1','1');
select agent_id,business_id,door_id,out_trade_id,status,transation_id,total_fee,bonus_fee,cash_fee,pay_type,pay_pass,admin_id,regtime,remark_one_value,remark_two_value,remark_three_value,from_business_trade_id,is_read,app_id,open_id,order_type,order_regtime,discount_amt,offer_type,device_id,attach,bank_type,pay_log_id,activity_type,user_id,trade_body,longitude,latitude,ip,pay_card_type,order_source from cool_deal order by deal_id;
agent_id	business_id	door_id	out_trade_id	status	transation_id	total_fee	bonus_fee	cash_fee	pay_type	pay_pass	admin_id	regtime	remark_one_value	remark_two_value	remark_three_value	from_business_trade_id	is_read	app_id	open_id	order_type	order_regtime	discount_amt	offer_type	device_id	attach	bank_type	pay_log_id	activity_type	user_id	trade_body	longitude	latitude	ip	pay_card_type	order_source
1	1	1	
	1	1	1.00	1.00	1.00	1	1	1	1	1	1	1	1	0	1	0	NULL	NULL	NULL	NULL	NULL	NULL	NULL	NULL	NULL	1	NULL	0.0000000000	0.0000000000			001
1	1	1			1	1	1.00	1.00	1.00	1	1	1	1	1	1	1	1	0	1	0	NULL	NULL	NULL	NULL	NULL	NULL	NULL	NULL	NULL	1	NULL	0.0000000000	0.0000000000			001
1	1	1		1	1	1.00	1.00	1.00	1	1	1	1	1	1	1	1	0	1	0	NULL	NULL	NULL	NULL	NULL	NULL	NULL	NULL	NULL	1	NULL	0.0000000000	0.0000000000			001
1	1	1	NULL	1	1	1.00	1.00	1.00	1	1	1	1	1	1	1	1	0	1	0	NULL	NULL	NULL	NULL	NULL	NULL	NULL	NULL	NULL	1	NULL	0.0000000000	0.0000000000			001
1	1	1	NULL	1	1	1.00	1.00	1.00	1	1	1	1	1	1	1	1	0	1	0	NULL	NULL	NULL	NULL	NULL	NULL	NULL	NULL	NULL	1	NULL	0.0000000000	0.0000000000			001
delete from cool_deal;
INSERT ignore INTO cool_deal (`agent_id`,`business_id`,`door_id`,`out_trade_id`,`status`,`transation_id`,`total_fee`,`bonus_fee`,`cash_fee`,`pay_type`,`pay_pass`,`admin_id`,`regtime`,`remark_one_value`,`remark_two_value`,`remark_three_value`,`from_business_trade_id`,`app_id`,`user_id`) VALUES ('1','1','1','','1','1','1','1','1','1','1','1','1','1','1','1','1','1','1'),('1','1','1',null,'1','1','1','1','1','1','1','1','1','1','1','1','1','1','1'),('1','1','1',NULL,'1','1','1','1','1','1','1','1','1','1','1','1','1','1','1');
INSERT ignore INTO cool_deal (`agent_id`,`business_id`,`door_id`,`out_trade_id`,`status`,`transation_id`,`total_fee`,`bonus_fee`,`cash_fee`,`pay_type`,`pay_pass`,`admin_id`,`regtime`,`remark_one_value`,`remark_two_value`,`remark_three_value`,`from_business_trade_id`,`app_id`,`user_id`) VALUES ('1','1','1','aaa','1','1','1','1','1','1','1','1','1','1','1','1','1','1','1'),('1','1','1',upper('aaa'),'1','1','1','1','1','1','1','1','1','1','1','1','1','1','1'),('1','1','1',replace('aab','b','a'),'1','1','1','1','1','1','1','1','1','1','1','1','1','1','1'),('1','1','1',concat('aa','a'),'1','1','1','1','1','1','1','1','1','1','1','1','1','1','1');
select agent_id,business_id,door_id,out_trade_id,status,transation_id,total_fee,bonus_fee,cash_fee,pay_type,pay_pass,admin_id,regtime,remark_one_value,remark_two_value,remark_three_value,from_business_trade_id,is_read,app_id,open_id,order_type,order_regtime,discount_amt,offer_type,device_id,attach,bank_type,pay_log_id,activity_type,user_id,trade_body,longitude,latitude,ip,pay_card_type,order_source from cool_deal order by deal_id;
agent_id	business_id	door_id	out_trade_id	status	transation_id	total_fee	bonus_fee	cash_fee	pay_type	pay_pass	admin_id	regtime	remark_one_value	remark_two_value	remark_three_value	from_business_trade_id	is_read	app_id	open_id	order_type	order_regtime	discount_amt	offer_type	device_id	attach	bank_type	pay_log_id	activity_type	user_id	trade_body	longitude	latitude	ip	pay_card_type	order_source
1	1	1		1	1	1.00	1.00	1.00	1	1	1	1	1	1	1	1	0	1	0	NULL	NULL	NULL	NULL	NULL	NULL	NULL	NULL	NULL	1	NULL	0.0000000000	0.0000000000			001
1	1	1	NULL	1	1	1.00	1.00	1.00	1	1	1	1	1	1	1	1	0	1	0	NULL	NULL	NULL	NULL	NULL	NULL	NULL	NULL	NULL	1	NULL	0.0000000000	0.0000000000			001
1	1	1	NULL	1	1	1.00	1.00	1.00	1	1	1	1	1	1	1	1	0	1	0	NULL	NULL	NULL	NULL	NULL	NULL	NULL	NULL	NULL	1	NULL	0.0000000000	0.0000000000			001
1	1	1	aaa	1	1	1.00	1.00	1.00	1	1	1	1	1	1	1	1	0	1	0	NULL	NULL	NULL	NULL	NULL	NULL	NULL	NULL	NULL	1	NULL	0.0000000000	0.0000000000			001
delete from cool_deal;
INSERT ignore INTO cool_deal (`agent_id`,`business_id`,`door_id`,`out_trade_id`,`status`,`transation_id`,`total_fee`,`bonus_fee`,`cash_fee`,`pay_type`,`pay_pass`,`admin_id`,`regtime`,`remark_one_value`,`remark_two_value`,`remark_three_value`,`from_business_trade_id`,`app_id`,`user_id`) VALUES (1,1,1,'',1,1,1,1,1,1,1,1,1,1,1,1,1,1,1),(1,1,1,null,1,1,1,1,1,1,1,1,1,1,1,1,1,1,1),(1,1,1,NULL,1,1,1,1,1,1,1,1,1,1,1,1,1,1,1);
INSERT ignore INTO cool_deal (`agent_id`,`business_id`,`door_id`,`out_trade_id`,`status`,`transation_id`,`total_fee`,`bonus_fee`,`cash_fee`,`pay_type`,`pay_pass`,`admin_id`,`regtime`,`remark_one_value`,`remark_two_value`,`remark_three_value`,`from_business_trade_id`,`app_id`,`user_id`) VALUES ('0','0','0','','0','0','0','0','0','0','0','0','0','0','0','0','0','0','0'),('0','0','0',null,'0','0','0','0','0','0','0','0','0','0','0','0','0','0','0'),('0','0','0',NULL,'0','0','0','0','0','0','0','0','0','0','0','0','0','0','0');
INSERT ignore INTO cool_deal (`agent_id`,`business_id`,`door_id`,`out_trade_id`,`status`,`transation_id`,`total_fee`,`bonus_fee`,`cash_fee`,`pay_type`,`pay_pass`,`admin_id`,`regtime`,`remark_one_value`,`remark_two_value`,`remark_three_value`,`from_business_trade_id`,`app_id`,`user_id`) VALUES (0,0,0,'',0,0,0,0,0,0,0,0,0,0,0,0,0,0,0),(0,0,0,null,0,0,0,0,0,0,0,0,0,0,0,0,0,0,0),(0,0,0,NULL,0,0,0,0,0,0,0,0,0,0,0,0,0,0,0);
INSERT ignore INTO cool_deal (`agent_id`,`business_id`,`door_id`,`out_trade_id`,`status`,`transation_id`,`total_fee`,`bonus_fee`,`cash_fee`,`pay_type`,`pay_pass`,`admin_id`,`regtime`,`remark_one_value`,`remark_two_value`,`remark_three_value`,`from_business_trade_id`,`app_id`,`user_id`) VALUES ('a','a','a','b',10,'a',10,10,10,'a','a','a','a','a','a','a','a','a','a');
select agent_id,business_id,door_id,out_trade_id,status,transation_id,total_fee,bonus_fee,cash_fee,pay_type,pay_pass,admin_id,regtime,remark_one_value,remark_two_value,remark_three_value,from_business_trade_id,is_read,app_id,open_id,order_type,order_regtime,discount_amt,offer_type,device_id,attach,bank_type,pay_log_id,activity_type,user_id,trade_body,longitude,latitude,ip,pay_card_type,order_source from cool_deal order by deal_id;
agent_id	business_id	door_id	out_trade_id	status	transation_id	total_fee	bonus_fee	cash_fee	pay_type	pay_pass	admin_id	regtime	remark_one_value	remark_two_value	remark_three_value	from_business_trade_id	is_read	app_id	open_id	order_type	order_regtime	discount_amt	offer_type	device_id	attach	bank_type	pay_log_id	activity_type	user_id	trade_body	longitude	latitude	ip	pay_card_type	order_source
1	1	1		1	1	1.00	1.00	1.00	1	1	1	1	1	1	1	1	0	1	0	NULL	NULL	NULL	NULL	NULL	NULL	NULL	NULL	NULL	1	NULL	0.0000000000	0.0000000000			001
1	1	1	NULL	1	1	1.00	1.00	1.00	1	1	1	1	1	1	1	1	0	1	0	NULL	NULL	NULL	NULL	NULL	NULL	NULL	NULL	NULL	1	NULL	0.0000000000	0.0000000000			001
1	1	1	NULL	1	1	1.00	1.00	1.00	1	1	1	1	1	1	1	1	0	1	0	NULL	NULL	NULL	NULL	NULL	NULL	NULL	NULL	NULL	1	NULL	0.0000000000	0.0000000000			001
0	0	0	NULL	0	0	0.00	0.00	0.00	0	0	0	0	0	0	0	0	0	0	0	NULL	NULL	NULL	NULL	NULL	NULL	NULL	NULL	NULL	0	NULL	0.0000000000	0.0000000000			001
0	0	0	NULL	0	0	0.00	0.00	0.00	0	0	0	0	0	0	0	0	0	0	0	NULL	NULL	NULL	NULL	NULL	NULL	NULL	NULL	NULL	0	NULL	0.0000000000	0.0000000000			001
0	0	0	NULL	0	0	0.00	0.00	0.00	0	0	0	0	0	0	0	0	0	0	0	NULL	NULL	NULL	NULL	NULL	NULL	NULL	NULL	NULL	0	NULL	0.0000000000	0.0000000000			001
0	0	0	NULL	0	0	0.00	0.00	0.00	0	0	0	0	0	0	0	0	0	0	0	NULL	NULL	NULL	NULL	NULL	NULL	NULL	NULL	NULL	0	NULL	0.0000000000	0.0000000000			001
a	a	a	b	10	a	10.00	10.00	10.00	a	a	a	a	a	a	a	a	0	a	0	NULL	NULL	NULL	NULL	NULL	NULL	NULL	NULL	NULL	a	NULL	0.0000000000	0.0000000000			001
delete from cool_deal;
INSERT ignore INTO cool_deal (out_trade_id,cash_fee) values('',10),(null,10),(NULL,10),(' ',10),('\t',10),('\n',10);
INSERT ignore INTO cool_deal (out_trade_id,status,cash_fee) values('x',1,10),(rpad('a',44,'a'),5,10),(rpad('a',40,'a'),20,10);
INSERT ignore INTO cool_deal (out_trade_id,status,cash_fee) values('x',1,10),(rpad('a',40,'a'),20,10),(rpad('a',44,'a'),5,10);
INSERT ignore INTO cool_deal (out_trade_id,status,cash_fee) values('aaa',10,10),('aa a',200000,10),('aa\na',50000000000000,10),('aaa',600000,10),('aa\t\na',70000,10);
INSERT ignore INTO cool_deal (out_trade_id,status,cash_fee) values ('',10,10),("'",10,10);
select agent_id,business_id,door_id,out_trade_id,status,transation_id,total_fee,bonus_fee,cash_fee,pay_type,pay_pass,admin_id,regtime,remark_one_value,remark_two_value,remark_three_value,from_business_trade_id,is_read,app_id,open_id,order_type,order_regtime,discount_amt,offer_type,device_id,attach,bank_type,pay_log_id,activity_type,user_id,trade_body,longitude,latitude,ip,pay_card_type,order_source from cool_deal order by deal_id;
agent_id	business_id	door_id	out_trade_id	status	transation_id	total_fee	bonus_fee	cash_fee	pay_type	pay_pass	admin_id	regtime	remark_one_value	remark_two_value	remark_three_value	from_business_trade_id	is_read	app_id	open_id	order_type	order_regtime	discount_amt	offer_type	device_id	attach	bank_type	pay_log_id	activity_type	user_id	trade_body	longitude	latitude	ip	pay_card_type	order_source
NULL	NULL	NULL		0	NULL	NULL	0.00	10.00	NULL	010	NULL	NULL	NULL	NULL	NULL	NULL	0	NULL	0	NULL	NULL	NULL	NULL	NULL	NULL	NULL	NULL	NULL	NULL	NULL	0.0000000000	0.0000000000			001
NULL	NULL	NULL	NULL	0	NULL	NULL	0.00	10.00	NULL	010	NULL	NULL	NULL	NULL	NULL	NULL	0	NULL	0	NULL	NULL	NULL	NULL	NULL	NULL	NULL	NULL	NULL	NULL	NULL	0.0000000000	0.0000000000			001
NULL	NULL	NULL	NULL	0	NULL	NULL	0.00	10.00	NULL	010	NULL	NULL	NULL	NULL	NULL	NULL	0	NULL	0	NULL	NULL	NULL	NULL	NULL	NULL	NULL	NULL	NULL	NULL	NULL	0.0000000000	0.0000000000			001
NULL	NULL	NULL			0	NULL	NULL	0.00	10.00	NULL	010	NULL	NULL	NULL	NULL	NULL	NULL	0	NULL	0	NULL	NULL	NULL	NULL	NULL	NULL	NULL	NULL	NULL	NULL	NULL	0.0000000000	0.0000000000			001
NULL	NULL	NULL	
	0	NULL	NULL	0.00	10.00	NULL	010	NULL	NULL	NULL	NULL	NULL	NULL	0	NULL	0	NULL	NULL	NULL	NULL	NULL	NULL	NULL	NULL	NULL	NULL	NULL	0.0000000000	0.0000000000			001
NULL	NULL	NULL	x	1	NULL	NULL	0.00	10.00	NULL	010	NULL	NULL	NULL	NULL	NULL	NULL	0	NULL	0	NULL	NULL	NULL	NULL	NULL	NULL	NULL	NULL	NULL	NULL	NULL	0.0000000000	0.0000000000			001
NULL	NULL	NULL	aaaaaaaaaaaaaaaaaaaaaaaaaaaaaaaaaaaaaaaa	5	NULL	NULL	0.00	10.00	NULL	010	NULL	NULL	NULL	NULL	NULL	NULL	0	NULL	0	NULL	NULL	NULL	NULL	NULL	NULL	NULL	NULL	NULL	NULL	NULL	0.0000000000	0.0000000000			001
NULL	NULL	NULL	aaa	10	NULL	NULL	0.00	10.00	NULL	010	NULL	NULL	NULL	NULL	NULL	NULL	0	NULL	0	NULL	NULL	NULL	NULL	NULL	NULL	NULL	NULL	NULL	NULL	NULL	0.0000000000	0.0000000000			001
NULL	NULL	NULL	aa a	200000	NULL	NULL	0.00	10.00	NULL	010	NULL	NULL	NULL	NULL	NULL	NULL	0	NULL	0	NULL	NULL	NULL	NULL	NULL	NULL	NULL	NULL	NULL	NULL	NULL	0.0000000000	0.0000000000			001
NULL	NULL	NULL	aa
a	2147483647	NULL	NULL	0.00	10.00	NULL	010	NULL	NULL	NULL	NULL	NULL	NULL	0	NULL	0	NULL	NULL	NULL	NULL	NULL	NULL	NULL	NULL	NULL	NULL	NULL	0.0000000000	0.0000000000			001
NULL	NULL	NULL	aa	
a	70000	NULL	NULL	0.00	10.00	NULL	010	NULL	NULL	NULL	NULL	NULL	NULL	0	NULL	0	NULL	NULL	NULL	NULL	NULL	NULL	NULL	NULL	NULL	NULL	NULL	0.0000000000	0.0000000000			001
NULL	NULL	NULL	'	10	NULL	NULL	0.00	10.00	NULL	010	NULL	NULL	NULL	NULL	NULL	NULL	0	NULL	0	NULL	NULL	NULL	NULL	NULL	NULL	NULL	NULL	NULL	NULL	NULL	0.0000000000	0.0000000000			001
DROP TABLE IF EXISTS cool_bill;
CREATE TABLE `cool_bill` (
`bill_id` int(11) unsigned NOT NULL AUTO_INCREMENT,
`trade_time` varchar(30) DEFAULT NULL COMMENT '交易时间',
`app_id` varchar(20) DEFAULT NULL COMMENT '公众账号ID',
`mch_id` varchar(30) DEFAULT NULL COMMENT '商户号',
`sub_mch` varchar(30) DEFAULT NULL COMMENT '子商户号',
`device_id` varchar(50) DEFAULT NULL COMMENT '设备号',
`wx_order` varchar(50) DEFAULT NULL COMMENT '微信订单号',
`order_no` varchar(50) DEFAULT NULL COMMENT '商户订单号',
`openid` varchar(50) DEFAULT NULL COMMENT 'openid',
`trade_type` varchar(50) DEFAULT NULL COMMENT '交易类型 0 支付, 1 退款',
`trade_status` varchar(50) DEFAULT NULL COMMENT '交易状态',
`bank` varchar(100) DEFAULT NULL COMMENT '付款银行',
`cny` varchar(20) DEFAULT NULL COMMENT '货币种类',
`total_money` varchar(20) DEFAULT NULL COMMENT '总金额',
`redpacket_money` varchar(20) DEFAULT NULL COMMENT '代金券或立减优惠金额',
`aprefund_time` varchar(30) DEFAULT NULL COMMENT '退款申请时间',
`surefund_time` varchar(30) DEFAULT NULL COMMENT '退款成功时间',
`wxrefund_no` varchar(50) DEFAULT NULL COMMENT '微信退款单号',
`mcrefund_no` varchar(50) DEFAULT NULL COMMENT '商户退款单号',
`refund_money` varchar(20) DEFAULT NULL COMMENT '退款金额',
`redpacket_refund_money` varchar(20) DEFAULT NULL COMMENT '代金券或立减优惠退款金额',
`refund_type` varchar(20) DEFAULT NULL COMMENT '退款类型，1全部退款，2部分退款',
`refund_status` varchar(20) DEFAULT NULL COMMENT '退款状态',
`product_target_name` varchar(100) DEFAULT NULL COMMENT '商品名称',
`data_packet` varchar(255) DEFAULT NULL COMMENT '商户数据包',
`fee` varchar(20) DEFAULT NULL COMMENT '手续费',
`rate` varchar(20) DEFAULT NULL COMMENT '费率',
`business_id` varchar(11) DEFAULT NULL,
`door_id` varchar(11) DEFAULT NULL,
`pay_type` varchar(100) DEFAULT NULL COMMENT '支付方式',
`pay_pass` varchar(100) DEFAULT NULL,
`agent_id` varchar(11) DEFAULT NULL COMMENT '代理商编号',
`agent_fr_fee` varchar(100) DEFAULT NULL COMMENT '代理商分润金额',
`qd_fr_fee` varchar(100) DEFAULT NULL COMMENT '渠道商分润金额',
`td_cost_fee` varchar(100) DEFAULT NULL COMMENT '第三方成本',
`from_business_trade_id` varchar(128) DEFAULT NULL,
`bill_time` varchar(30) DEFAULT NULL,
`channel_id` int(11) DEFAULT NULL COMMENT '渠道号',
`activity_type` varchar(30) DEFAULT NULL COMMENT '三方平台活动类型',
`pay_log_id` varchar(40) DEFAULT NULL COMMENT '西银在线流水号',
`user_id` varchar(11) DEFAULT NULL COMMENT '用户标识',
`order_source` varchar(3) DEFAULT '001' COMMENT '订单来源，默认001 西银惠付',
PRIMARY KEY (`bill_id`),
UNIQUE KEY `uiq_order_type_refund` (`order_no`, `trade_type`, `wxrefund_no`),
KEY `mch_id_idx` (`mch_id`),
KEY `agent_id_idx` (`agent_id`),
KEY `bill_time_idx` (`bill_time`),
KEY `trade_time_idx` (`trade_time`),
KEY `business_id_idx` (`business_id`),
KEY `agent_id_idx1` (`agent_id`),
KEY `door_id_idx` (`door_id`),
KEY `bus_id_b_t_time_idx` (`business_id`, `bill_time`, `trade_time`)
) AUTO_INCREMENT = 10055453 DEFAULT CHARSET = utf8mb4 ROW_FORMAT = DYNAMIC;
INSERT ignore INTO cool_bill (`agent_id`,`pay_pass`,`refund_money`,`surefund_time`,`rate`,`trade_type`,`product_target_name`,`trade_time`,`order_no`,`mch_id`,`sub_mch`,`fee`,`total_money`,`business_id`,`door_id`,`pay_type`,`agent_fr_fee`,`qd_fr_fee`,`redpacket_money`,`td_cost_fee`,`from_business_trade_id`,`wxrefund_no`,`bill_time`,`channel_id`,`user_id`) VALUES (1,1,1,1,1,1,1,1,1,1,1,1,1,1,1,1,1,1,1,1,1,1,1,1,1),(1,1,1,1,1,1,1,1,1,1,1,1,1,1,1,1,1,1,1,1,1,1,1,1,1),('1','1','1','1','1','1','1','1','1','1','1','1','1','1','1','1','1','1','1','1','1','1','1','1','1'),('1','1','1','1','1','1','1','1','1','1','1','1','1','1','1','1','1','1','1','1','1','1','1','1','1');
INSERT ignore INTO cool_bill (`agent_id`,`pay_pass`,`refund_money`,`surefund_time`,`rate`,`trade_type`,`product_target_name`,`trade_time`,`order_no`,`mch_id`,`sub_mch`,`fee`,`total_money`,`business_id`,`door_id`,`pay_type`,`agent_fr_fee`,`qd_fr_fee`,`redpacket_money`,`td_cost_fee`,`from_business_trade_id`,`wxrefund_no`,`bill_time`,`channel_id`,`user_id`) VALUES (1,1,1,1,1,1,1,1,1,1,1,1,1,1,1,1,1,1,1,1,1,1,1,1,1),(1,1,1,1,1,1,1,1,1,1,1,1,1,1,1,1,1,1,1,1,1,1,1,1,1),('1','1','1','1','1','1','1','1','1','1','1','1','1','1','1','1','1','1','1','1','1','1','1','1','1'),('1','1','1','1','1','1','1','1','1','1','1','1','1','1','1','1','1','1','1','1','1','1','1','1','1');
INSERT ignore INTO cool_bill (`agent_id`,`pay_pass`,`refund_money`,`surefund_time`,`rate`,`trade_type`,`product_target_name`,`trade_time`,`order_no`,`mch_id`,`sub_mch`,`fee`,`total_money`,`business_id`,`door_id`,`pay_type`,`agent_fr_fee`,`qd_fr_fee`,`redpacket_money`,`td_cost_fee`,`from_business_trade_id`,`wxrefund_no`,`bill_time`,`channel_id`,`user_id`) VALUES (0,0,0,0,0,0,0,0,0,0,0,0,0,0,0,0,0,0,0,0,0,0,0,0,0),(0,0,0,0,0,0,0,0,0,0,0,0,0,0,0,0,0,0,0,0,0,0,0,0,0),('0','0','0','0','0','0','0','0','0','0','0','0','0','0','0','0','0','0','0','0','0','0','0','0','0'),('0','0','0','0','0','0','0','0','0','0','0','0','0','0','0','0','0','0','0','0','0','0','0','0','0');
delete from cool_bill;
INSERT ignore INTO cool_bill (`agent_id`,`pay_pass`,`refund_money`,`surefund_time`,`rate`,`trade_type`,`product_target_name`,`trade_time`,`order_no`,`mch_id`,`sub_mch`,`fee`,`total_money`,`business_id`,`door_id`,`pay_type`,`agent_fr_fee`,`qd_fr_fee`,`redpacket_money`,`td_cost_fee`,`from_business_trade_id`,`refund_type`,`wxrefund_no`,`bill_time`,`channel_id`,`user_id`) values(1,1,1,1,1,1,1,1,1,1,1,1,1,1,1,1,1,1,1,1,1,1,1,1,1,1),(0,0,0,0,0,0,0,0,0,0,0,0,0,0,0,0,0,0,0,0,0,0,0,0,0,0),('','','','','','','','','','','','','','','','','','','','','','','','','',''),(00,00,00,00,00,00,00,00,00,00,00,00,00,00,00,00,00,00,00,00,00,00,00,00,00,00);
delete from cool_bill;
INSERT ignore INTO cool_bill (`agent_id`,`pay_pass`,`refund_money`,`surefund_time`,`rate`,`trade_type`,`product_target_name`,`trade_time`,`order_no`,`mch_id`,`sub_mch`,`fee`,`total_money`,`business_id`,`door_id`,`pay_type`,`agent_fr_fee`,`qd_fr_fee`,`redpacket_money`,`td_cost_fee`,`from_business_trade_id`,`refund_type`,`wxrefund_no`,`bill_time`,`channel_id`,`user_id`) values(1,1,1,1,1,1,1,1,1,1,1,1,1,1,1,1,1,1,1,1,1,1,1,1,1,1);
select trade_time,app_id,mch_id,sub_mch,device_id,wx_order,order_no,openid,trade_type,trade_status,bank,cny,total_money,redpacket_money,aprefund_time,surefund_time,wxrefund_no,mcrefund_no,refund_money,redpacket_refund_money,refund_type,refund_status,product_target_name,data_packet,fee,rate,business_id,door_id,pay_type,pay_pass,agent_id,agent_fr_fee,qd_fr_fee,td_cost_fee,from_business_trade_id,bill_time,channel_id,activity_type,pay_log_id,user_id,order_source from cool_bill order by bill_id;
trade_time	app_id	mch_id	sub_mch	device_id	wx_order	order_no	openid	trade_type	trade_status	bank	cny	total_money	redpacket_money	aprefund_time	surefund_time	wxrefund_no	mcrefund_no	refund_money	redpacket_refund_money	refund_type	refund_status	product_target_name	data_packet	fee	rate	business_id	door_id	pay_type	pay_pass	agent_id	agent_fr_fee	qd_fr_fee	td_cost_fee	from_business_trade_id	bill_time	channel_id	activity_type	pay_log_id	user_id	order_source
1	NULL	1	1	NULL	NULL	1	NULL	1	NULL	NULL	NULL	1	1	NULL	1	1	NULL	1	NULL	1	NULL	1	NULL	1	1	1	1	1	1	1	1	1	1	1	1	1	NULL	NULL	1	001
delete from cool_bill;
INSERT ignore INTO cool_bill (`order_no`, `trade_type`, `wxrefund_no`) values(0,0,0),(-1,0,0),(1,0,0),(0,-1,0),(0,1,0),(0,0,-1),(0,0,1),(-1,-1,-1),(1,1,1),(0,-1,-1),(0,1,1),(-1,0,-1),(1,0,1),(1,1,0),(-1,-1,0),(null,NULL,''),(NULL,null,''),(NULL,'',null);
select trade_time,app_id,mch_id,sub_mch,device_id,wx_order,order_no,openid,trade_type,trade_status,bank,cny,total_money,redpacket_money,aprefund_time,surefund_time,wxrefund_no,mcrefund_no,refund_money,redpacket_refund_money,refund_type,refund_status,product_target_name,data_packet,fee,rate,business_id,door_id,pay_type,pay_pass,agent_id,agent_fr_fee,qd_fr_fee,td_cost_fee,from_business_trade_id,bill_time,channel_id,activity_type,pay_log_id,user_id,order_source from cool_bill order by bill_id;
trade_time	app_id	mch_id	sub_mch	device_id	wx_order	order_no	openid	trade_type	trade_status	bank	cny	total_money	redpacket_money	aprefund_time	surefund_time	wxrefund_no	mcrefund_no	refund_money	redpacket_refund_money	refund_type	refund_status	product_target_name	data_packet	fee	rate	business_id	door_id	pay_type	pay_pass	agent_id	agent_fr_fee	qd_fr_fee	td_cost_fee	from_business_trade_id	bill_time	channel_id	activity_type	pay_log_id	user_id	order_source
NULL	NULL	NULL	NULL	NULL	NULL	0	NULL	0	NULL	NULL	NULL	NULL	NULL	NULL	NULL	0	NULL	NULL	NULL	NULL	NULL	NULL	NULL	NULL	NULL	NULL	NULL	NULL	NULL	NULL	NULL	NULL	NULL	NULL	NULL	NULL	NULL	NULL	NULL	001
NULL	NULL	NULL	NULL	NULL	NULL	-1	NULL	0	NULL	NULL	NULL	NULL	NULL	NULL	NULL	0	NULL	NULL	NULL	NULL	NULL	NULL	NULL	NULL	NULL	NULL	NULL	NULL	NULL	NULL	NULL	NULL	NULL	NULL	NULL	NULL	NULL	NULL	NULL	001
NULL	NULL	NULL	NULL	NULL	NULL	1	NULL	0	NULL	NULL	NULL	NULL	NULL	NULL	NULL	0	NULL	NULL	NULL	NULL	NULL	NULL	NULL	NULL	NULL	NULL	NULL	NULL	NULL	NULL	NULL	NULL	NULL	NULL	NULL	NULL	NULL	NULL	NULL	001
NULL	NULL	NULL	NULL	NULL	NULL	0	NULL	-1	NULL	NULL	NULL	NULL	NULL	NULL	NULL	0	NULL	NULL	NULL	NULL	NULL	NULL	NULL	NULL	NULL	NULL	NULL	NULL	NULL	NULL	NULL	NULL	NULL	NULL	NULL	NULL	NULL	NULL	NULL	001
NULL	NULL	NULL	NULL	NULL	NULL	0	NULL	1	NULL	NULL	NULL	NULL	NULL	NULL	NULL	0	NULL	NULL	NULL	NULL	NULL	NULL	NULL	NULL	NULL	NULL	NULL	NULL	NULL	NULL	NULL	NULL	NULL	NULL	NULL	NULL	NULL	NULL	NULL	001
NULL	NULL	NULL	NULL	NULL	NULL	0	NULL	0	NULL	NULL	NULL	NULL	NULL	NULL	NULL	-1	NULL	NULL	NULL	NULL	NULL	NULL	NULL	NULL	NULL	NULL	NULL	NULL	NULL	NULL	NULL	NULL	NULL	NULL	NULL	NULL	NULL	NULL	NULL	001
NULL	NULL	NULL	NULL	NULL	NULL	0	NULL	0	NULL	NULL	NULL	NULL	NULL	NULL	NULL	1	NULL	NULL	NULL	NULL	NULL	NULL	NULL	NULL	NULL	NULL	NULL	NULL	NULL	NULL	NULL	NULL	NULL	NULL	NULL	NULL	NULL	NULL	NULL	001
NULL	NULL	NULL	NULL	NULL	NULL	-1	NULL	-1	NULL	NULL	NULL	NULL	NULL	NULL	NULL	-1	NULL	NULL	NULL	NULL	NULL	NULL	NULL	NULL	NULL	NULL	NULL	NULL	NULL	NULL	NULL	NULL	NULL	NULL	NULL	NULL	NULL	NULL	NULL	001
NULL	NULL	NULL	NULL	NULL	NULL	1	NULL	1	NULL	NULL	NULL	NULL	NULL	NULL	NULL	1	NULL	NULL	NULL	NULL	NULL	NULL	NULL	NULL	NULL	NULL	NULL	NULL	NULL	NULL	NULL	NULL	NULL	NULL	NULL	NULL	NULL	NULL	NULL	001
NULL	NULL	NULL	NULL	NULL	NULL	0	NULL	-1	NULL	NULL	NULL	NULL	NULL	NULL	NULL	-1	NULL	NULL	NULL	NULL	NULL	NULL	NULL	NULL	NULL	NULL	NULL	NULL	NULL	NULL	NULL	NULL	NULL	NULL	NULL	NULL	NULL	NULL	NULL	001
NULL	NULL	NULL	NULL	NULL	NULL	0	NULL	1	NULL	NULL	NULL	NULL	NULL	NULL	NULL	1	NULL	NULL	NULL	NULL	NULL	NULL	NULL	NULL	NULL	NULL	NULL	NULL	NULL	NULL	NULL	NULL	NULL	NULL	NULL	NULL	NULL	NULL	NULL	001
NULL	NULL	NULL	NULL	NULL	NULL	-1	NULL	0	NULL	NULL	NULL	NULL	NULL	NULL	NULL	-1	NULL	NULL	NULL	NULL	NULL	NULL	NULL	NULL	NULL	NULL	NULL	NULL	NULL	NULL	NULL	NULL	NULL	NULL	NULL	NULL	NULL	NULL	NULL	001
NULL	NULL	NULL	NULL	NULL	NULL	1	NULL	0	NULL	NULL	NULL	NULL	NULL	NULL	NULL	1	NULL	NULL	NULL	NULL	NULL	NULL	NULL	NULL	NULL	NULL	NULL	NULL	NULL	NULL	NULL	NULL	NULL	NULL	NULL	NULL	NULL	NULL	NULL	001
NULL	NULL	NULL	NULL	NULL	NULL	1	NULL	1	NULL	NULL	NULL	NULL	NULL	NULL	NULL	0	NULL	NULL	NULL	NULL	NULL	NULL	NULL	NULL	NULL	NULL	NULL	NULL	NULL	NULL	NULL	NULL	NULL	NULL	NULL	NULL	NULL	NULL	NULL	001
NULL	NULL	NULL	NULL	NULL	NULL	-1	NULL	-1	NULL	NULL	NULL	NULL	NULL	NULL	NULL	0	NULL	NULL	NULL	NULL	NULL	NULL	NULL	NULL	NULL	NULL	NULL	NULL	NULL	NULL	NULL	NULL	NULL	NULL	NULL	NULL	NULL	NULL	NULL	001
NULL	NULL	NULL	NULL	NULL	NULL	NULL	NULL	NULL	NULL	NULL	NULL	NULL	NULL	NULL	NULL		NULL	NULL	NULL	NULL	NULL	NULL	NULL	NULL	NULL	NULL	NULL	NULL	NULL	NULL	NULL	NULL	NULL	NULL	NULL	NULL	NULL	NULL	NULL	001
NULL	NULL	NULL	NULL	NULL	NULL	NULL	NULL	NULL	NULL	NULL	NULL	NULL	NULL	NULL	NULL		NULL	NULL	NULL	NULL	NULL	NULL	NULL	NULL	NULL	NULL	NULL	NULL	NULL	NULL	NULL	NULL	NULL	NULL	NULL	NULL	NULL	NULL	NULL	001
NULL	NULL	NULL	NULL	NULL	NULL	NULL	NULL		NULL	NULL	NULL	NULL	NULL	NULL	NULL	NULL	NULL	NULL	NULL	NULL	NULL	NULL	NULL	NULL	NULL	NULL	NULL	NULL	NULL	NULL	NULL	NULL	NULL	NULL	NULL	NULL	NULL	NULL	NULL	001
truncate table cool_bill;
INSERT ignore INTO cool_bill (`order_no`, `trade_type`, `wxrefund_no`) values(0,0,0),(-1,0,0),(1,0,0),(0,-1,0),(0,1,0),(0,0,-1),(0,0,1),(-1,-1,-1),(1,1,1),(0,-1,-1),(0,1,1),(-1,0,-1),(1,0,1),(1,1,0),(-1,-1,0),(null,NULL,''),(NULL,null,''),(NULL,'',null);
select trade_time,app_id,mch_id,sub_mch,device_id,wx_order,order_no,openid,trade_type,trade_status,bank,cny,total_money,redpacket_money,aprefund_time,surefund_time,wxrefund_no,mcrefund_no,refund_money,redpacket_refund_money,refund_type,refund_status,product_target_name,data_packet,fee,rate,business_id,door_id,pay_type,pay_pass,agent_id,agent_fr_fee,qd_fr_fee,td_cost_fee,from_business_trade_id,bill_time,channel_id,activity_type,pay_log_id,user_id,order_source from cool_bill order by bill_id;
trade_time	app_id	mch_id	sub_mch	device_id	wx_order	order_no	openid	trade_type	trade_status	bank	cny	total_money	redpacket_money	aprefund_time	surefund_time	wxrefund_no	mcrefund_no	refund_money	redpacket_refund_money	refund_type	refund_status	product_target_name	data_packet	fee	rate	business_id	door_id	pay_type	pay_pass	agent_id	agent_fr_fee	qd_fr_fee	td_cost_fee	from_business_trade_id	bill_time	channel_id	activity_type	pay_log_id	user_id	order_source
NULL	NULL	NULL	NULL	NULL	NULL	0	NULL	0	NULL	NULL	NULL	NULL	NULL	NULL	NULL	0	NULL	NULL	NULL	NULL	NULL	NULL	NULL	NULL	NULL	NULL	NULL	NULL	NULL	NULL	NULL	NULL	NULL	NULL	NULL	NULL	NULL	NULL	NULL	001
NULL	NULL	NULL	NULL	NULL	NULL	-1	NULL	0	NULL	NULL	NULL	NULL	NULL	NULL	NULL	0	NULL	NULL	NULL	NULL	NULL	NULL	NULL	NULL	NULL	NULL	NULL	NULL	NULL	NULL	NULL	NULL	NULL	NULL	NULL	NULL	NULL	NULL	NULL	001
NULL	NULL	NULL	NULL	NULL	NULL	1	NULL	0	NULL	NULL	NULL	NULL	NULL	NULL	NULL	0	NULL	NULL	NULL	NULL	NULL	NULL	NULL	NULL	NULL	NULL	NULL	NULL	NULL	NULL	NULL	NULL	NULL	NULL	NULL	NULL	NULL	NULL	NULL	001
NULL	NULL	NULL	NULL	NULL	NULL	0	NULL	-1	NULL	NULL	NULL	NULL	NULL	NULL	NULL	0	NULL	NULL	NULL	NULL	NULL	NULL	NULL	NULL	NULL	NULL	NULL	NULL	NULL	NULL	NULL	NULL	NULL	NULL	NULL	NULL	NULL	NULL	NULL	001
NULL	NULL	NULL	NULL	NULL	NULL	0	NULL	1	NULL	NULL	NULL	NULL	NULL	NULL	NULL	0	NULL	NULL	NULL	NULL	NULL	NULL	NULL	NULL	NULL	NULL	NULL	NULL	NULL	NULL	NULL	NULL	NULL	NULL	NULL	NULL	NULL	NULL	NULL	001
NULL	NULL	NULL	NULL	NULL	NULL	0	NULL	0	NULL	NULL	NULL	NULL	NULL	NULL	NULL	-1	NULL	NULL	NULL	NULL	NULL	NULL	NULL	NULL	NULL	NULL	NULL	NULL	NULL	NULL	NULL	NULL	NULL	NULL	NULL	NULL	NULL	NULL	NULL	001
NULL	NULL	NULL	NULL	NULL	NULL	0	NULL	0	NULL	NULL	NULL	NULL	NULL	NULL	NULL	1	NULL	NULL	NULL	NULL	NULL	NULL	NULL	NULL	NULL	NULL	NULL	NULL	NULL	NULL	NULL	NULL	NULL	NULL	NULL	NULL	NULL	NULL	NULL	001
NULL	NULL	NULL	NULL	NULL	NULL	-1	NULL	-1	NULL	NULL	NULL	NULL	NULL	NULL	NULL	-1	NULL	NULL	NULL	NULL	NULL	NULL	NULL	NULL	NULL	NULL	NULL	NULL	NULL	NULL	NULL	NULL	NULL	NULL	NULL	NULL	NULL	NULL	NULL	001
NULL	NULL	NULL	NULL	NULL	NULL	1	NULL	1	NULL	NULL	NULL	NULL	NULL	NULL	NULL	1	NULL	NULL	NULL	NULL	NULL	NULL	NULL	NULL	NULL	NULL	NULL	NULL	NULL	NULL	NULL	NULL	NULL	NULL	NULL	NULL	NULL	NULL	NULL	001
NULL	NULL	NULL	NULL	NULL	NULL	0	NULL	-1	NULL	NULL	NULL	NULL	NULL	NULL	NULL	-1	NULL	NULL	NULL	NULL	NULL	NULL	NULL	NULL	NULL	NULL	NULL	NULL	NULL	NULL	NULL	NULL	NULL	NULL	NULL	NULL	NULL	NULL	NULL	001
NULL	NULL	NULL	NULL	NULL	NULL	0	NULL	1	NULL	NULL	NULL	NULL	NULL	NULL	NULL	1	NULL	NULL	NULL	NULL	NULL	NULL	NULL	NULL	NULL	NULL	NULL	NULL	NULL	NULL	NULL	NULL	NULL	NULL	NULL	NULL	NULL	NULL	NULL	001
NULL	NULL	NULL	NULL	NULL	NULL	-1	NULL	0	NULL	NULL	NULL	NULL	NULL	NULL	NULL	-1	NULL	NULL	NULL	NULL	NULL	NULL	NULL	NULL	NULL	NULL	NULL	NULL	NULL	NULL	NULL	NULL	NULL	NULL	NULL	NULL	NULL	NULL	NULL	001
NULL	NULL	NULL	NULL	NULL	NULL	1	NULL	0	NULL	NULL	NULL	NULL	NULL	NULL	NULL	1	NULL	NULL	NULL	NULL	NULL	NULL	NULL	NULL	NULL	NULL	NULL	NULL	NULL	NULL	NULL	NULL	NULL	NULL	NULL	NULL	NULL	NULL	NULL	001
NULL	NULL	NULL	NULL	NULL	NULL	1	NULL	1	NULL	NULL	NULL	NULL	NULL	NULL	NULL	0	NULL	NULL	NULL	NULL	NULL	NULL	NULL	NULL	NULL	NULL	NULL	NULL	NULL	NULL	NULL	NULL	NULL	NULL	NULL	NULL	NULL	NULL	NULL	001
NULL	NULL	NULL	NULL	NULL	NULL	-1	NULL	-1	NULL	NULL	NULL	NULL	NULL	NULL	NULL	0	NULL	NULL	NULL	NULL	NULL	NULL	NULL	NULL	NULL	NULL	NULL	NULL	NULL	NULL	NULL	NULL	NULL	NULL	NULL	NULL	NULL	NULL	NULL	001
NULL	NULL	NULL	NULL	NULL	NULL	NULL	NULL	NULL	NULL	NULL	NULL	NULL	NULL	NULL	NULL		NULL	NULL	NULL	NULL	NULL	NULL	NULL	NULL	NULL	NULL	NULL	NULL	NULL	NULL	NULL	NULL	NULL	NULL	NULL	NULL	NULL	NULL	NULL	001
NULL	NULL	NULL	NULL	NULL	NULL	NULL	NULL	NULL	NULL	NULL	NULL	NULL	NULL	NULL	NULL		NULL	NULL	NULL	NULL	NULL	NULL	NULL	NULL	NULL	NULL	NULL	NULL	NULL	NULL	NULL	NULL	NULL	NULL	NULL	NULL	NULL	NULL	NULL	001
NULL	NULL	NULL	NULL	NULL	NULL	NULL	NULL		NULL	NULL	NULL	NULL	NULL	NULL	NULL	NULL	NULL	NULL	NULL	NULL	NULL	NULL	NULL	NULL	NULL	NULL	NULL	NULL	NULL	NULL	NULL	NULL	NULL	NULL	NULL	NULL	NULL	NULL	NULL	001
INSERT ignore INTO cool_bill (`order_no`, `trade_type`, `wxrefund_no`) values('','',''),(null,null,null),(NULL,NULL,NULL),(' ',' ',' '),('\t','\t','\t'),('\n','\n','\n');
INSERT ignore INTO cool_bill (`order_no`, `trade_type`, `wxrefund_no`) values(0x656,0x656,0x656),(0x656,0x656,0x656),(0x653,0x653,0x653);
INSERT ignore INTO cool_bill (`order_no`, `trade_type`, `wxrefund_no`) values('哈','哈','哈'),('哈','哈','哈');
INSERT ignore INTO cool_bill (`order_no`, `trade_type`, `wxrefund_no`) values(0x6666202020202020202021,0x6666202020202020202021,0x6666202020202020202021),('哈哈      ! ','哈哈      ! ','哈哈      ! '),('哈哈     ! ','哈哈      ! ','哈哈      ! ');
INSERT ignore INTO cool_bill (`order_no`, `trade_type`, `wxrefund_no`,mch_id) values(substr(substr(replace(length(rpad('哈哈',53,' '))-5,2,10),1,2)+6.4,1,instr(substr(replace(length(rpad('哈哈',53,' '))-5,2,10),1,2)+6.4,'.')+1)-4.4,substr(substr(replace(length(rpad('哈哈',53,' '))-5,2,10),1,2)+6.4,1,instr(substr(replace(length(rpad('哈哈',53,' '))-5,2,10),1,2)+6.4,'.')+1)-4.4,substr(substr(replace(length(rpad('哈哈',53,' '))-5,2,10),1,2)+6.4,1,instr(substr(replace(length(rpad('哈哈',53,' '))-5,2,10),1,2)+6.4,'.')+1)-4.4,9),(53,53,53,1),('53','53','53',2),(ascii(5),ascii(5),ascii(5),3),(concat(5,3),concat(5,3),concat(5,3),4),(replace('52','2','3'),replace('52','2','3'),replace('52','2','3'),5),(substr(88765344,5,2),substr(88765344,5,2),substr(88765344,5,2),6),(replace(substr(8876588747344,5,2),8,3),replace(substr(8876588747344,5,2),8,3),replace(substr(8876588747344,5,2),8,3),7),(53.0,53.0,53.0,8);
select trade_time,app_id,mch_id,sub_mch,device_id,wx_order,order_no,openid,trade_type,trade_status,bank,cny,total_money,redpacket_money,aprefund_time,surefund_time,wxrefund_no,mcrefund_no,refund_money,redpacket_refund_money,refund_type,refund_status,product_target_name,data_packet,fee,rate,business_id,door_id,pay_type,pay_pass,agent_id,agent_fr_fee,qd_fr_fee,td_cost_fee,from_business_trade_id,bill_time,channel_id,activity_type,pay_log_id,user_id,order_source from cool_bill order by bill_id;
trade_time	app_id	mch_id	sub_mch	device_id	wx_order	order_no	openid	trade_type	trade_status	bank	cny	total_money	redpacket_money	aprefund_time	surefund_time	wxrefund_no	mcrefund_no	refund_money	redpacket_refund_money	refund_type	refund_status	product_target_name	data_packet	fee	rate	business_id	door_id	pay_type	pay_pass	agent_id	agent_fr_fee	qd_fr_fee	td_cost_fee	from_business_trade_id	bill_time	channel_id	activity_type	pay_log_id	user_id	order_source
NULL	NULL	NULL	NULL	NULL	NULL	0	NULL	0	NULL	NULL	NULL	NULL	NULL	NULL	NULL	0	NULL	NULL	NULL	NULL	NULL	NULL	NULL	NULL	NULL	NULL	NULL	NULL	NULL	NULL	NULL	NULL	NULL	NULL	NULL	NULL	NULL	NULL	NULL	001
NULL	NULL	NULL	NULL	NULL	NULL	-1	NULL	0	NULL	NULL	NULL	NULL	NULL	NULL	NULL	0	NULL	NULL	NULL	NULL	NULL	NULL	NULL	NULL	NULL	NULL	NULL	NULL	NULL	NULL	NULL	NULL	NULL	NULL	NULL	NULL	NULL	NULL	NULL	001
NULL	NULL	NULL	NULL	NULL	NULL	1	NULL	0	NULL	NULL	NULL	NULL	NULL	NULL	NULL	0	NULL	NULL	NULL	NULL	NULL	NULL	NULL	NULL	NULL	NULL	NULL	NULL	NULL	NULL	NULL	NULL	NULL	NULL	NULL	NULL	NULL	NULL	NULL	001
NULL	NULL	NULL	NULL	NULL	NULL	0	NULL	-1	NULL	NULL	NULL	NULL	NULL	NULL	NULL	0	NULL	NULL	NULL	NULL	NULL	NULL	NULL	NULL	NULL	NULL	NULL	NULL	NULL	NULL	NULL	NULL	NULL	NULL	NULL	NULL	NULL	NULL	NULL	001
NULL	NULL	NULL	NULL	NULL	NULL	0	NULL	1	NULL	NULL	NULL	NULL	NULL	NULL	NULL	0	NULL	NULL	NULL	NULL	NULL	NULL	NULL	NULL	NULL	NULL	NULL	NULL	NULL	NULL	NULL	NULL	NULL	NULL	NULL	NULL	NULL	NULL	NULL	001
NULL	NULL	NULL	NULL	NULL	NULL	0	NULL	0	NULL	NULL	NULL	NULL	NULL	NULL	NULL	-1	NULL	NULL	NULL	NULL	NULL	NULL	NULL	NULL	NULL	NULL	NULL	NULL	NULL	NULL	NULL	NULL	NULL	NULL	NULL	NULL	NULL	NULL	NULL	001
NULL	NULL	NULL	NULL	NULL	NULL	0	NULL	0	NULL	NULL	NULL	NULL	NULL	NULL	NULL	1	NULL	NULL	NULL	NULL	NULL	NULL	NULL	NULL	NULL	NULL	NULL	NULL	NULL	NULL	NULL	NULL	NULL	NULL	NULL	NULL	NULL	NULL	NULL	001
NULL	NULL	NULL	NULL	NULL	NULL	-1	NULL	-1	NULL	NULL	NULL	NULL	NULL	NULL	NULL	-1	NULL	NULL	NULL	NULL	NULL	NULL	NULL	NULL	NULL	NULL	NULL	NULL	NULL	NULL	NULL	NULL	NULL	NULL	NULL	NULL	NULL	NULL	NULL	001
NULL	NULL	NULL	NULL	NULL	NULL	1	NULL	1	NULL	NULL	NULL	NULL	NULL	NULL	NULL	1	NULL	NULL	NULL	NULL	NULL	NULL	NULL	NULL	NULL	NULL	NULL	NULL	NULL	NULL	NULL	NULL	NULL	NULL	NULL	NULL	NULL	NULL	NULL	001
NULL	NULL	NULL	NULL	NULL	NULL	0	NULL	-1	NULL	NULL	NULL	NULL	NULL	NULL	NULL	-1	NULL	NULL	NULL	NULL	NULL	NULL	NULL	NULL	NULL	NULL	NULL	NULL	NULL	NULL	NULL	NULL	NULL	NULL	NULL	NULL	NULL	NULL	NULL	001
NULL	NULL	NULL	NULL	NULL	NULL	0	NULL	1	NULL	NULL	NULL	NULL	NULL	NULL	NULL	1	NULL	NULL	NULL	NULL	NULL	NULL	NULL	NULL	NULL	NULL	NULL	NULL	NULL	NULL	NULL	NULL	NULL	NULL	NULL	NULL	NULL	NULL	NULL	001
NULL	NULL	NULL	NULL	NULL	NULL	-1	NULL	0	NULL	NULL	NULL	NULL	NULL	NULL	NULL	-1	NULL	NULL	NULL	NULL	NULL	NULL	NULL	NULL	NULL	NULL	NULL	NULL	NULL	NULL	NULL	NULL	NULL	NULL	NULL	NULL	NULL	NULL	NULL	001
NULL	NULL	NULL	NULL	NULL	NULL	1	NULL	0	NULL	NULL	NULL	NULL	NULL	NULL	NULL	1	NULL	NULL	NULL	NULL	NULL	NULL	NULL	NULL	NULL	NULL	NULL	NULL	NULL	NULL	NULL	NULL	NULL	NULL	NULL	NULL	NULL	NULL	NULL	001
NULL	NULL	NULL	NULL	NULL	NULL	1	NULL	1	NULL	NULL	NULL	NULL	NULL	NULL	NULL	0	NULL	NULL	NULL	NULL	NULL	NULL	NULL	NULL	NULL	NULL	NULL	NULL	NULL	NULL	NULL	NULL	NULL	NULL	NULL	NULL	NULL	NULL	NULL	001
NULL	NULL	NULL	NULL	NULL	NULL	-1	NULL	-1	NULL	NULL	NULL	NULL	NULL	NULL	NULL	0	NULL	NULL	NULL	NULL	NULL	NULL	NULL	NULL	NULL	NULL	NULL	NULL	NULL	NULL	NULL	NULL	NULL	NULL	NULL	NULL	NULL	NULL	NULL	001
NULL	NULL	NULL	NULL	NULL	NULL	NULL	NULL	NULL	NULL	NULL	NULL	NULL	NULL	NULL	NULL		NULL	NULL	NULL	NULL	NULL	NULL	NULL	NULL	NULL	NULL	NULL	NULL	NULL	NULL	NULL	NULL	NULL	NULL	NULL	NULL	NULL	NULL	NULL	001
NULL	NULL	NULL	NULL	NULL	NULL	NULL	NULL	NULL	NULL	NULL	NULL	NULL	NULL	NULL	NULL		NULL	NULL	NULL	NULL	NULL	NULL	NULL	NULL	NULL	NULL	NULL	NULL	NULL	NULL	NULL	NULL	NULL	NULL	NULL	NULL	NULL	NULL	NULL	001
NULL	NULL	NULL	NULL	NULL	NULL	NULL	NULL		NULL	NULL	NULL	NULL	NULL	NULL	NULL	NULL	NULL	NULL	NULL	NULL	NULL	NULL	NULL	NULL	NULL	NULL	NULL	NULL	NULL	NULL	NULL	NULL	NULL	NULL	NULL	NULL	NULL	NULL	NULL	001
NULL	NULL	NULL	NULL	NULL	NULL		NULL		NULL	NULL	NULL	NULL	NULL	NULL	NULL		NULL	NULL	NULL	NULL	NULL	NULL	NULL	NULL	NULL	NULL	NULL	NULL	NULL	NULL	NULL	NULL	NULL	NULL	NULL	NULL	NULL	NULL	NULL	001
NULL	NULL	NULL	NULL	NULL	NULL	NULL	NULL	NULL	NULL	NULL	NULL	NULL	NULL	NULL	NULL	NULL	NULL	NULL	NULL	NULL	NULL	NULL	NULL	NULL	NULL	NULL	NULL	NULL	NULL	NULL	NULL	NULL	NULL	NULL	NULL	NULL	NULL	NULL	NULL	001
NULL	NULL	NULL	NULL	NULL	NULL	NULL	NULL	NULL	NULL	NULL	NULL	NULL	NULL	NULL	NULL	NULL	NULL	NULL	NULL	NULL	NULL	NULL	NULL	NULL	NULL	NULL	NULL	NULL	NULL	NULL	NULL	NULL	NULL	NULL	NULL	NULL	NULL	NULL	NULL	001
NULL	NULL	NULL	NULL	NULL	NULL			NULL			NULL	NULL	NULL	NULL	NULL	NULL	NULL			NULL	NULL	NULL	NULL	NULL	NULL	NULL	NULL	NULL	NULL	NULL	NULL	NULL	NULL	NULL	NULL	NULL	NULL	NULL	NULL	NULL	NULL	NULL	001
NULL	NULL	NULL	NULL	NULL	NULL	
	NULL	
	NULL	NULL	NULL	NULL	NULL	NULL	NULL	
	NULL	NULL	NULL	NULL	NULL	NULL	NULL	NULL	NULL	NULL	NULL	NULL	NULL	NULL	NULL	NULL	NULL	NULL	NULL	NULL	NULL	NULL	NULL	001
NULL	NULL	NULL	NULL	NULL	NULL	V	NULL	V	NULL	NULL	NULL	NULL	NULL	NULL	NULL	V	NULL	NULL	NULL	NULL	NULL	NULL	NULL	NULL	NULL	NULL	NULL	NULL	NULL	NULL	NULL	NULL	NULL	NULL	NULL	NULL	NULL	NULL	NULL	001
NULL	NULL	NULL	NULL	NULL	NULL	S	NULL	S	NULL	NULL	NULL	NULL	NULL	NULL	NULL	S	NULL	NULL	NULL	NULL	NULL	NULL	NULL	NULL	NULL	NULL	NULL	NULL	NULL	NULL	NULL	NULL	NULL	NULL	NULL	NULL	NULL	NULL	NULL	001
NULL	NULL	NULL	NULL	NULL	NULL	哈	NULL	哈	NULL	NULL	NULL	NULL	NULL	NULL	NULL	哈	NULL	NULL	NULL	NULL	NULL	NULL	NULL	NULL	NULL	NULL	NULL	NULL	NULL	NULL	NULL	NULL	NULL	NULL	NULL	NULL	NULL	NULL	NULL	001
NULL	NULL	NULL	NULL	NULL	NULL	ff        !	NULL	ff        !	NULL	NULL	NULL	NULL	NULL	NULL	NULL	ff        !	NULL	NULL	NULL	NULL	NULL	NULL	NULL	NULL	NULL	NULL	NULL	NULL	NULL	NULL	NULL	NULL	NULL	NULL	NULL	NULL	NULL	NULL	NULL	001
NULL	NULL	NULL	NULL	NULL	NULL	哈哈      ! 	NULL	哈哈      ! 	NULL	NULL	NULL	NULL	NULL	NULL	NULL	哈哈      ! 	NULL	NULL	NULL	NULL	NULL	NULL	NULL	NULL	NULL	NULL	NULL	NULL	NULL	NULL	NULL	NULL	NULL	NULL	NULL	NULL	NULL	NULL	NULL	001
NULL	NULL	NULL	NULL	NULL	NULL	哈哈     ! 	NULL	哈哈      ! 	NULL	NULL	NULL	NULL	NULL	NULL	NULL	哈哈      ! 	NULL	NULL	NULL	NULL	NULL	NULL	NULL	NULL	NULL	NULL	NULL	NULL	NULL	NULL	NULL	NULL	NULL	NULL	NULL	NULL	NULL	NULL	NULL	001
NULL	NULL	9	NULL	NULL	NULL	53	NULL	53	NULL	NULL	NULL	NULL	NULL	NULL	NULL	53	NULL	NULL	NULL	NULL	NULL	NULL	NULL	NULL	NULL	NULL	NULL	NULL	NULL	NULL	NULL	NULL	NULL	NULL	NULL	NULL	NULL	NULL	NULL	001
NULL	NULL	8	NULL	NULL	NULL	53.0	NULL	53.0	NULL	NULL	NULL	NULL	NULL	NULL	NULL	53.0	NULL	NULL	NULL	NULL	NULL	NULL	NULL	NULL	NULL	NULL	NULL	NULL	NULL	NULL	NULL	NULL	NULL	NULL	NULL	NULL	NULL	NULL	NULL	001
DROP TABLE IF EXISTS cool_fenrun;
CREATE TABLE `cool_fenrun` (
`fenrun_id` int(11) NOT NULL AUTO_INCREMENT,
`mch_no` varchar(255) DEFAULT NULL COMMENT '商户号',
`tran_type` tinyint(1) DEFAULT NULL COMMENT '交易类型   0 支付  1  退款',
`trade_money` varchar(255) DEFAULT NULL COMMENT '交易金额',
`channel_id` varchar(11) DEFAULT NULL COMMENT '所属渠道商Id',
`qd_fr_total` varchar(100) DEFAULT NULL COMMENT '渠道商分润金额',
`agent_one_id` varchar(100) DEFAULT NULL COMMENT '一级代理商ID',
`agent_one_fr_total` varchar(100) DEFAULT NULL COMMENT '一级代理商分润金额',
`agent_two_id` varchar(100) DEFAULT NULL COMMENT '二级代理商ID',
`agent_two_fr_total` varchar(100) DEFAULT NULL COMMENT '二级代理商分润金额',
`pay_pass` varchar(20) DEFAULT NULL COMMENT '支付渠道',
`regtime` varchar(50) DEFAULT NULL COMMENT '分润时间',
`order_no` varchar(100) DEFAULT NULL COMMENT '订单编号',
`is_true` tinyint(1) DEFAULT '0' COMMENT '分润数据是否错误标志 0 正确 1 失败',
`created_at` int(10) DEFAULT NULL COMMENT '操作入库时间',
PRIMARY KEY (`fenrun_id`),
KEY `index_m` (`mch_no`),
KEY `index_r` (`regtime`),
KEY `index_p` (`pay_pass`),
KEY `created_at_two_id_idx` (`created_at`, `agent_two_id`),
KEY `agent_one_id_r_indx` (`agent_one_id`, `regtime`),
KEY `agent_two_id_r_indx` (`agent_two_id`, `regtime`),
KEY `mch_no_r_indx` (`mch_no`, `regtime`)
) AUTO_INCREMENT = 1001136810 DEFAULT CHARSET = utf8mb4 ROW_FORMAT = DYNAMIC;
INSERT ignore INTO cool_fenrun (`mch_no`,`trade_money`,`agent_one_id`,`agent_one_fr_total`,`channel_id`,`qd_fr_total`,`pay_pass`,`regtime`,`created_at`) VALUES('','','','','','','','',''),('','','','','','','','',''),(null,null,null,null,null,null,null,null,null),(NULL,NULL,NULL,NULL,NULL,NULL,NULL,NULL,NULL),(0,0,0,0,0,0,0,0,0),(0,0,0,0,0,0,0,0,0),(1,1,1,1,1,1,1,1,1),(1,1,1,1,1,1,1,1,1),(1.00,1.00,1.00,1.00,1.00,1.00,1.00,1.00,1.00),('哈','哈','哈','哈','哈','哈','哈','哈','哈'),(0x6666202020202020202021,0x6666202020202020202021,0x6666202020202020202021,0x6666202020202020202021,0x6666202020202020202021,0x6666202020202020202021,0x6666202020202020202021,0x6666202020202020202021,0x6666202020202020202021),(0x656,0x656,0x656,0x656,0x656,0x656,0x656,0x656,0x656),('哈哈     ! ','哈哈      ! ','哈哈      ! ','哈哈     ! ','哈哈      ! ','哈哈      ! ','哈哈     ! ','哈哈      ! ','哈哈      ! ');
delete from cool_fenrun;
INSERT ignore INTO cool_fenrun (`mch_no`,`order_no`,`pay_pass`,`tran_type`,`trade_money`,`agent_one_id`,`agent_one_fr_total`,`agent_two_id`,`agent_two_fr_total`,`channel_id`,`qd_fr_total`,`regtime`,`is_true`,`created_at`) VALUES('','','','','','','','','','','','','',''),('','','','','','','','','','','','','',''),(null,null,null,null,null,null,null,null,null,null,null,null,null,null),(NULL,NULL,NULL,NULL,NULL,NULL,NULL,NULL,NULL,NULL,NULL,NULL,NULL,NULL),(0,0,0,0,0,0,0,0,0,0,0,0,0,0),(0,0,0,0,0,0,0,0,0,0,0,0,0,0),(1,1,1,1,1,1,1,1,1,1,1,1,1,1),(1,1,1,1,1,1,1,1,1,1,1,1,1,1),(1.00,1.00,1.00,1.00,1.00,1.00,1.00,1.00,1.00,1.00,1.00,1.00,1.00,1.00),('哈','哈','哈','哈','哈','哈','哈','哈','哈','哈','哈','哈','哈','哈'),(0x6666202020202020202021,0x6666202020202020202021,0x6666202020202020202021,0x6666202020202020202021,0x6666202020202020202021,0x6666202020202020202021,0x6666202020202020202021,0x6666202020202020202021,0x6666202020202020202021,0x6666202020202020202021,0x6666202020202020202021,0x6666202020202020202021,0x6666202020202020202021,0x6666202020202020202021),(0x656,0x656,0x656,0x656,0x656,0x656,0x656,0x656,0x656,0x656,0x656,0x656,0x656,0x656),('哈哈     ! ','哈哈      ! ','哈哈      ! ','哈哈     ! ','哈哈      ! ','哈哈      ! ','哈哈      ! ','哈哈      ! ','哈哈     ! ','哈哈      ! ','哈哈      ! ','哈哈     ! ','哈哈      ! ','哈哈      ! ');
select mch_no,tran_type,trade_money,channel_id,qd_fr_total,agent_one_id,agent_one_fr_total,agent_two_id,agent_two_fr_total,pay_pass,regtime,order_no,is_true,created_at from cool_fenrun order by fenrun_id;
mch_no	tran_type	trade_money	channel_id	qd_fr_total	agent_one_id	agent_one_fr_total	agent_two_id	agent_two_fr_total	pay_pass	regtime	order_no	is_true	created_at
	0											0	0
	0											0	0
NULL	NULL	NULL	NULL	NULL	NULL	NULL	NULL	NULL	NULL	NULL	NULL	NULL	NULL
NULL	NULL	NULL	NULL	NULL	NULL	NULL	NULL	NULL	NULL	NULL	NULL	NULL	NULL
0	0	0	0	0	0	0	0	0	0	0	0	0	0
0	0	0	0	0	0	0	0	0	0	0	0	0	0
1	1	1	1	1	1	1	1	1	1	1	1	1	1
1	1	1	1	1	1	1	1	1	1	1	1	1	1
1.00	1	1.00	1.00	1.00	1.00	1.00	1.00	1.00	1.00	1.00	1.00	1	1
哈	0	哈	哈	哈	哈	哈	哈	哈	哈	哈	哈	0	0
ff        !	127	ff        !	ff        !	ff        !	ff        !	ff        !	ff        !	ff        !	ff        !	ff        !	ff        !	127	2147483647
V	127	V	V	V	V	V	V	V	V	V	V	127	1622
哈哈     ! 	0	哈哈      ! 	哈哈      ! 	哈哈      ! 	哈哈      ! 	哈哈      ! 	哈哈      ! 	哈哈     ! 	哈哈      ! 	哈哈     ! 	哈哈      ! 	0	0
DROP TABLE IF EXISTS sys_role_uri;
CREATE TABLE `sys_role_uri` (
`sys_uri_id` int(11) DEFAULT NULL,
`role` int(11) DEFAULT NULL
) DEFAULT CHARSET = utf8mb4 ROW_FORMAT = DYNAMIC;
INSERT ignore INTO `sys_role_uri` (`sys_uri_id`,`role`) VALUES('',''),('',''),(null,null),(NULL,NULL),(0,0),(0,0),(1,1),(1,1),(1.00,1.00),('哈','哈'),(0x6666202020202020202021,0x6666202020202020202021),(0x656,0x656),('哈哈     ! ','哈哈      ! ');
INSERT ignore INTO `sys_role_uri` (`sys_uri_id`,`role`) VALUES('',''),('',''),(null,null),(NULL,NULL),(0,0),(0,0),(1,1),(1,1),(1.00,1.00),('哈','哈'),(0x6666202020202020202021,0x6666202020202020202021),(0x656,0x656),('哈哈     ! ','哈哈      ! '),(4294967295,4294967295),(4294967299,4294967299),(9999999999999999999999999,9999999999999999999999999);
delete from sys_role_uri;
INSERT ignore INTO `sys_role_uri` (`sys_uri_id`,`role`) VALUES('eeeeeeee','eeeeeeee'),(18446744073709551617.1,18446744073709551617.1),('1x','1x'),(now(),now()),(now(6),now(6)),('1970-01-02 00:01:40.0','1970-01-02 00:01:40.0'),(cast(3 as unsigned),cast(3 as unsigned)),(-1,-1),('a','a'),('A','A'),("0.0","0.0"),(default,default),("+111111111.11","+111111111.11"),('xxxxxxlsl@kkdis.com','xxxxxxlsl@kkdis.com'),('a,','a,'),('ffffffffffffffffffffffffffffffffffffffffffffffffffffffffffffffffffffffffffffffffffffffffffffffffffffffffffffffffffffffffffffffffffffffffffffffffffffffffffffffffffffffffffffffffffffffffffffffffffffffffffffffffffffffffffffffffffffffffffffffffffffffffffffffffffffffffffffffffffffffffffffffffffffffffffffffffffffffffffffffffffffffffffffffffffffffffffffffffffffffffffffffffffffffffffffffffffffffffffffffffffffffffffffffffffffffffffffffffffffffffffffffffffffffffffffffffffffffffffffffffffffffffffffffffffffffffffffffffffffffffffffffffffffffffffffffffffffffffffffffffffffffffffffffffffffffffffffffffffffffffffffffffffffffffffffffffffffffffffffffffffffffffffffffffffffffffffffffffffffffffffffffffffffffffffffffffffffffffffffffffffffffffffffffffffffffffffffffffffffffffffffffffffffffffffffffffffffffffffffffffffffffffffffffffffffffffffffffFFFF','ffffffffffffffffffffffffffffffffffffffffffffffffffffffffffffffffffffffffffffffffffffffffffffffffffffffffffffffffffffffffffffffffffffffffffffffffffffffffffffffffffffffffffffffffffffffffffffffffffffffffffffffffffffffffffffffffffffffffffffffffffffffffffffffffffffffffffffffffffffffffffffffffffffffffffffffffffffffffffffffffffffffffffffffffffffffffffffffffffffffffffffffffffffffffffffffffffffffffffffffffffffffffffffffffffffffffffffffffffffffffffffffffffffffffffffffffffffffffffffffffffffffffffffffffffffffffffffffffffffffffffffffffffffffffffffffffffffffffffffffffffffffffffffffffffffffffffffffffffffffffffffffffffffffffffffffffffffffffffffffffffffffffffffffffffffffffffffffffffffffffffffffffffffffffffffffffffffffffffffffffffffffffffffffffffffffffffffffffffffffffffffffffffffffffffffffffffffffffffffffffffffffffffffffffffffffffffffffFFFF'),('1234567890abcdef1234567890abcdef1234567890abcdef1234567890abcdef1234567890abcdef1234567890abcdef1234567890abcdef1234567890abcdef1234567890abcdef1234567890abcdef1234567890abcdef1234567890abcdef1234567890','1234567890abcdef1234567890abcdef1234567890abcdef1234567890abcdef1234567890abcdef1234567890abcdef1234567890abcdef1234567890abcdef1234567890abcdef1234567890abcdef1234567890abcdef1234567890abcdef1234567890'),((1+2) || 1 ||1 || 1 ||1||1||1||1||1||1||'1'||1||1||1||1||1||1||1||1||'11'||(3*2)||(5-2)||1||1||1||1||1||1||1||1||1||1||1||1||1||1||1||1||1||1||1||1||1||1||1||1||1||1||1||1||1||1||1||1||1||1||1||1||1||1||1||1||1||1||1||1||1||1||1||1||1||1||1||1||1||1||1||1||1||1||1||1||1||1||1||1||1||1||1||1||1||1||1||1||1||1||1||1||1||1||1||1||1||1||1||1||1||1||1||1||1||1||1||1||1||1||1||1||1||1||1||(2||4)||1||1||1||1||1||1||1||1||1||1||1||1||1||1||1||1||1||1||1||1||1||1||1||1||1||1||1||1||1||1||1||(2||4)||1||1||1||1||1||1||1||1||1||1||1||1||1||1||1||1||1||1||1||1||1||1||1||1||1||1||1||1||1||1||1||(2||4),(1+2) || 1 ||1 || 1 ||1||1||1||1||1||1||'1'||1||1||1||1||1||1||1||1||'11'||(3*2)||(5-2)||1||1||1||1||1||1||1||1||1||1||1||1||1||1||1||1||1||1||1||1||1||1||1||1||1||1||1||1||1||1||1||1||1||1||1||1||1||1||1||1||1||1||1||1||1||1||1||1||1||1||1||1||1||1||1||1||1||1||1||1||1||1||1||1||1||1||1||1||1||1||1||1||1||1||1||1||1||1||1||1||1||1||1||1||1||1||1||1||1||1||1||1||1||1||1||1||1||1||1||(2||4)||1||1||1||1||1||1||1||1||1||1||1||1||1||1||1||1||1||1||1||1||1||1||1||1||1||1||1||1||1||1||1||(2||4)||1||1||1||1||1||1||1||1||1||1||1||1||1||1||1||1||1||1||1||1||1||1||1||1||1||1||1||1||1||1||1||(2||4)),('FFFFFFFFFFFFFFFFFFFFFFFFFFFFFFFFFFFFFFFFFFFFFFFFFFFFFFFFFFFFFFFFFFFFFFFFFFFFFFFFFFFFFFFFFFFFFFFFFFFFFFFFFFFFFFFFFFFFFFFFFFFFFFFFFFFFFFFFFFFFFFFFFFFFFFFFFFFFFFFFFFFFFFFFFFFFFFFFFFFFFFFFFFFFFFFFFFFFFFFFFFFFFFFFFFFFFFFFFFFFFFFFFFFFFFFFFFFFFFFFFFFFFFFFFFFFFFFFFFFFFFFFFFFFFFFFFFFFFFFFFFFFFFFFFFFFFFFFFFFFFFFFFFFFFFFFFFFFFFFFFFFFFFFFFFFFFFFFFFFFFFFFFFFFFFFFFFFFFFFFFFFFFFFFFFFFFFFFFFFFFFFFFFFFFFFFFFFFFFFFFFFFFFFFFFFFFFFFFFFFFFFFFFFFFFFFFFFFFFFFFFFFFFFFFFFFFFFFFFFFFFFFFFFFFFFFFFFFFFFFFFFFFFFFFFFFFFFFFFFFFFFFFFFFFFFFFFFFFFFFFFFFFFFFFFFFFFFFFFFFFFFFFFFFFFFFFFFFFFFFFFFFFFFFFFFFFFFFFFFFFFFFFFFFFFFFFFFFFFFFFFFFFFFFFFFFFFFFFFFFFFFFFFFFFFFFFFFFFFFFFFFFFFFFFFFFFFFFFFFFFFFFFFFFFFFFFFFFFFFFFFFFFFFFFFFFFFFFFFFFFFFFFFFFFFFFFFFFFFFFFFFFFFFFFFFFFFFFFFFFFFFFFFFFFFFFFFFFFFFFFFFFFFFFFFFFFFFFFFFFFFFFFFFFFFFFFFFFFFFFFFFFFFFFFFFFFFFFFFFFFFFFFFFFFFFFFFFFFFFFFFFFFFFFFFFFFFFFFFFFFFFFFFFFFFFFFFFFFFFFFFFFFFFFFFFFFFFFFFFFFFFFFFFFFFFFFFFFFFFFFFFFFFFFFFFFFFFFFFFFFFFFFFFFFFFFFFFFFFFFFFFFFFFFFFFFFFFFFFFFFFFFFFFFFFFFFFFFFFFF','FFFFFFFFFFFFFFFFFFFFFFFFFFFFFFFFFFFFFFFFFFFFFFFFFFFFFFFFFFFFFFFFFFFFFFFFFFFFFFFFFFFFFFFFFFFFFFFFFFFFFFFFFFFFFFFFFFFFFFFFFFFFFFFFFFFFFFFFFFFFFFFFFFFFFFFFFFFFFFFFFFFFFFFFFFFFFFFFFFFFFFFFFFFFFFFFFFFFFFFFFFFFFFFFFFFFFFFFFFFFFFFFFFFFFFFFFFFFFFFFFFFFFFFFFFFFFFFFFFFFFFFFFFFFFFFFFFFFFFFFFFFFFFFFFFFFFFFFFFFFFFFFFFFFFFFFFFFFFFFFFFFFFFFFFFFFFFFFFFFFFFFFFFFFFFFFFFFFFFFFFFFFFFFFFFFFFFFFFFFFFFFFFFFFFFFFFFFFFFFFFFFFFFFFFFFFFFFFFFFFFFFFFFFFFFFFFFFFFFFFFFFFFFFFFFFFFFFFFFFFFFFFFFFFFFFFFFFFFFFFFFFFFFFFFFFFFFFFFFFFFFFFFFFFFFFFFFFFFFFFFFFFFFFFFFFFFFFFFFFFFFFFFFFFFFFFFFFFFFFFFFFFFFFFFFFFFFFFFFFFFFFFFFFFFFFFFFFFFFFFFFFFFFFFFFFFFFFFFFFFFFFFFFFFFFFFFFFFFFFFFFFFFFFFFFFFFFFFFFFFFFFFFFFFFFFFFFFFFFFFFFFFFFFFFFFFFFFFFFFFFFFFFFFFFFFFFFFFFFFFFFFFFFFFFFFFFFFFFFFFFFFFFFFFFFFFFFFFFFFFFFFFFFFFFFFFFFFFFFFFFFFFFFFFFFFFFFFFFFFFFFFFFFFFFFFFFFFFFFFFFFFFFFFFFFFFFFFFFFFFFFFFFFFFFFFFFFFFFFFFFFFFFFFFFFFFFFFFFFFFFFFFFFFFFFFFFFFFFFFFFFFFFFFFFFFFFFFFFFFFFFFFFFFFFFFFFFFFFFFFFFFFFFFFFFFFFFFFFFFFFFFFFFFFFFFFFFFFFFFFFFFFFFFFFFFFFFFFFFFF'),('1234567890abcdef1234567890abcdef1234567890abcdef1234567890abcdef1234567890abcdef1234567890abcdef1234567890abcdef1234567890abcdef1234567890abcdef1234567890abcdef1234567890abcdef1234567890abcdef1234567890abcdef1234567890abcdef1234567890abcdef1234567890abcdef1234567890abcdef1234567890abcdef1234567890abcdef1234567890abcdef1234567890abcdef1234567890abcdef1234567890abcdef1234567890abcdef1234567890abcdef1234567890abcdef1234567890abcdef1234567890abcdef1234567890abcdef1234567890abcdef1234567890abcdef1234567890abcdef1234567890abcdef1234567890abcdef1234567890abcdef1234567890abcdef1234567890abcdef1234567890abcdef1234567890abcdef1234567890abcdef1234567890abcdef1234567890abcdef1234567890abcdef1234567890abcdef1234567890abcdef1234567890abcdef1234567890abcdef1234567890abcdef1234567890abcdef1234567890abcdef1234567890abcdef1234567890abcdef1234567890abcdef1234567890abcdef1234567890abcdef1234567890abcdef1234567890abcdef1234567890abcdef1234567890abcdef1234567890abcdef34567890abcdef1234567890abcdef123456789','1234567890abcdef1234567890abcdef1234567890abcdef1234567890abcdef1234567890abcdef1234567890abcdef1234567890abcdef1234567890abcdef1234567890abcdef1234567890abcdef1234567890abcdef1234567890abcdef1234567890abcdef1234567890abcdef1234567890abcdef1234567890abcdef1234567890abcdef1234567890abcdef1234567890abcdef1234567890abcdef1234567890abcdef1234567890abcdef1234567890abcdef1234567890abcdef1234567890abcdef1234567890abcdef1234567890abcdef1234567890abcdef1234567890abcdef1234567890abcdef1234567890abcdef1234567890abcdef1234567890abcdef1234567890abcdef1234567890abcdef1234567890abcdef1234567890abcdef1234567890abcdef1234567890abcdef1234567890abcdef1234567890abcdef1234567890abcdef1234567890abcdef1234567890abcdef1234567890abcdef1234567890abcdef1234567890abcdef1234567890abcdef1234567890abcdef1234567890abcdef1234567890abcdef1234567890abcdef1234567890abcdef1234567890abcdef1234567890abcdef1234567890abcdef1234567890abcdef1234567890abcdef1234567890abcdef1234567890abcdef34567890abcdef1234567890abcdef123456789'),('0o11','0o11'),(0xff,0xff),('21023456789abcdefABCDEF','21023456789abcdefABCDEF'),('-9.D','-9.D'),('.5d','.5d'),('1.23254e2 * 1.5769032e1 * 2.434343 * 59.075478965 * 4.44444444f','1.23254e2 * 1.5769032e1 * 2.434343 * 59.075478965 * 4.44444444f'),('-0','-1d'),('-0','-1d'),('+0','+1d'),('+0','+1d'),('1.923e-10f','1.923e-10f'),('1.245454e-30','1.245454e-30'),('1.245454e-30d','1.245454e-30d'),(cast(20010101010101 as datetime),cast(20010101010101 as datetime)),("-.1","-.1"),("00000000000001","00000000000001"),('',''),('',''),(null,null),(NULL,NULL),(0,0),(0,0),(1,1),(1,1),(1.00,1.00),('哈','哈'),(0x6666202020202020202021,0x6666202020202020202021),(0x656,0x656),('哈哈     ! ','哈哈      ! ');
INSERT ignore INTO `sys_role_uri` (`sys_uri_id`,`role`) VALUES('eeeeeeee','eeeeeeee'),(18446744073709551617.1,18446744073709551617.1),('1x','1x'),(str_to_date('20191022','%Y%m%d'),str_to_date('20191022','%Y%m%d')),('1970-01-02 00:01:40.0','1970-01-02 00:01:40.0'),(cast(3 as unsigned),cast(3 as unsigned)),(-1,-1),('a','a'),('A','A'),("0.0","0.0"),(default,default),("+111111111.11","+111111111.11"),('xxxxxxlsl@kkdis.com','xxxxxxlsl@kkdis.com'),('a,','a,'),(rpad('Ff',800,'fF'),rpad('Ff',800,'fF')),(rpad('1234567890abcdef',800,'1234567890abcdef'),rpad('1234567890abcdef',800,'1234567890abcdef')),((1+2) || 1 ||1 || 1 ||1||1||1||1||1||1||'1'||1||1||1||1||1||1||1||1||'11'||(3*2)||(5-2)||1||1||1||1||1||1||1||1||1||1||1||1||1||1||1||1||1||1||1||1||1||1||1||1||1||1||1||1||1||1||1||1||1||1||1||1||1||1||1||1||1||1||1||1||1||1||1||1||1||1||1||1||1||1||1||1||1||1||1||1||1||1||1||1||1||1||1||1||1||1||1||1||1||1||1||1||1||1||1||1||1||1||1||1||1||1||1||1||1||1||1||1||1||1||1||1||1||1||1||(2||4)||1||1||1||1||1||1||1||1||1||1||1||1||1||1||1||1||1||1||1||1||1||1||1||1||1||1||1||1||1||1||1||(2||4)||1||1||1||1||1||1||1||1||1||1||1||1||1||1||1||1||1||1||1||1||1||1||1||1||1||1||1||1||1||1||1||(2||4),(1+2) || 1 ||1 || 1 ||1||1||1||1||1||1||'1'||1||1||1||1||1||1||1||1||'11'||(3*2)||(5-2)||1||1||1||1||1||1||1||1||1||1||1||1||1||1||1||1||1||1||1||1||1||1||1||1||1||1||1||1||1||1||1||1||1||1||1||1||1||1||1||1||1||1||1||1||1||1||1||1||1||1||1||1||1||1||1||1||1||1||1||1||1||1||1||1||1||1||1||1||1||1||1||1||1||1||1||1||1||1||1||1||1||1||1||1||1||1||1||1||1||1||1||1||1||1||1||1||1||1||1||(2||4)||1||1||1||1||1||1||1||1||1||1||1||1||1||1||1||1||1||1||1||1||1||1||1||1||1||1||1||1||1||1||1||(2||4)||1||1||1||1||1||1||1||1||1||1||1||1||1||1||1||1||1||1||1||1||1||1||1||1||1||1||1||1||1||1||1||(2||4)),(rpad('F',1000,'F'),rpad('F',1000,'F')),('0o11','0o11'),(0xff,0xff),('21023456789abcdefABCDEF','21023456789abcdefABCDEF'),('-9.D','-9.D'),('.5d','.5d'),('1.23254e2 * 1.5769032e1 * 2.434343 * 59.075478965 * 4.44444444f','1.23254e2 * 1.5769032e1 * 2.434343 * 59.075478965 * 4.44444444f'),('-0','-0'),('-1d','-1d'),('+0','+0'),('+1d','+1d'),('1.923e-10f','1.923e-10f'),('1.245454e-30','1.245454e-30'),('1.245454e-30d','1.245454e-30d'),(cast(20010101010101 as datetime),cast(20010101010101 as datetime)),("-.1","-.1"),("00000000000001","00000000000001"),(default,default),(0,0),(1,1),('',''),(-1,-1);
select sys_uri_id,role from sys_role_uri order by sys_uri_id,role;
sys_uri_id	role
NULL	NULL
NULL	NULL
NULL	NULL
NULL	NULL
NULL	NULL
-9	-9
-9	-9
-1	-1
-1	-1
-1	-1
-1	-1
0	-1
0	-1
0	0
0	0
0	0
0	0
0	0
0	0
0	0
0	0
0	0
0	0
0	0
0	0
0	0
0	0
0	0
0	0
0	0
0	0
0	0
0	0
0	0
0	0
0	0
0	0
0	0
0	0
0	0
0	0
0	0
0	0
0	0
0	0
0	0
0	0
0	0
0	0
0	1
0	1
1	1
1	1
1	1
1	1
1	1
1	1
1	1
1	1
1	1
1	1
1	1
1	1
1	1
3	3
3	3
123	123
123	123
255	255
255	255
1622	1622
1970	1970
1970	1970
20191022	20191022
111111111	111111111
111111111	111111111
1234567890	1234567890
1234567890	1234567890
1234567890	1234567890
2147483647	2147483647
2147483647	2147483647
2147483647	2147483647
2147483647	2147483647
2147483647	2147483647
2147483647	2147483647
2147483647	2147483647
2147483647	2147483647
2147483647	2147483647
DROP TABLE IF EXISTS cool_deal_card;
CREATE TABLE `cool_deal_card` (
`deal_id` int(11) unsigned NOT NULL AUTO_INCREMENT,
`agent_id` int(11) DEFAULT NULL,
`business_id` int(11) DEFAULT '0',
`door_id` int(11) DEFAULT NULL,
`status` varchar(20) DEFAULT '' COMMENT '交易类型(PUR 支付 RFD 退款 VID 撤销)',
`out_trade_id` varchar(32) DEFAULT '' COMMENT '商户订单号(西银惠付)',
`cur` varchar(20) DEFAULT 'CNY' COMMENT '交易币别',
`total_fee` decimal(14,2) DEFAULT '0.00' COMMENT '交易金额',
`cash_fee` decimal(10,2) DEFAULT '0.00' COMMENT '实付金额',
`mch_no_sft` varchar(15) DEFAULT '' COMMENT '盛付通商户号',
`terminal_id` varchar(8) DEFAULT '' COMMENT '终端号',
`trace_no` varchar(6) DEFAULT '' COMMENT '终端流水号(凭证号)',
`batch_no` varchar(6) DEFAULT '' COMMENT '终端批次号',
`order_id_sft` varchar(12) DEFAULT '' COMMENT '盛付通订单号',
`regtime` int(11) DEFAULT '0' COMMENT '交易时间',
`trade_ref` varchar(20) DEFAULT '' COMMENT '交易参考号',
`trade_result` varchar(2) DEFAULT '0' COMMENT '交易应答码,00交易成功;其他失败',
`short_pan` varchar(10) DEFAULT '' COMMENT '卡号末4位',
`ext_data` varchar(255) DEFAULT '' COMMENT '附加信息，内含发卡机构和微信userId',
`orig_trade_ref` varchar(50) DEFAULT '' COMMENT '原交易参考号',
PRIMARY KEY (`deal_id`)
) AUTO_INCREMENT = 4000067 DEFAULT CHARSET = utf8mb4 ROW_FORMAT = DYNAMIC;
INSERT ignore INTO cool_deal_card (`agent_id`,`business_id`,`door_id`,`status`,`out_trade_id`,`cur`,`total_fee`,`cash_fee`,`mch_no_sft`,`terminal_id`,`trace_no`,`batch_no`,`order_id_sft`,`regtime`,`trade_ref`,`trade_result`,`short_pan`,`ext_data`,`orig_trade_ref`) VALUES('','','','','','','','','','','','','','','','','','','');
delete from cool_deal_card;
select agent_id,business_id,door_id,status,out_trade_id,cur,total_fee,cash_fee,mch_no_sft,terminal_id,trace_no,batch_no,order_id_sft,regtime,trade_ref,trade_result,short_pan,ext_data,orig_trade_ref from cool_deal_card order by deal_id;
agent_id	business_id	door_id	status	out_trade_id	cur	total_fee	cash_fee	mch_no_sft	terminal_id	trace_no	batch_no	order_id_sft	regtime	trade_ref	trade_result	short_pan	ext_data	orig_trade_ref
INSERT ignore INTO cool_deal_card (`agent_id`,`business_id`,`door_id`,`status`,`out_trade_id`,`cur`,`total_fee`,`cash_fee`,`mch_no_sft`,`terminal_id`,`trace_no`,`batch_no`,`order_id_sft`,`regtime`,`trade_ref`,`trade_result`,`short_pan`,`ext_data`,`orig_trade_ref`) VALUES('eeeeeeee','eeeeeeee','eeeeeeee','eeeeeeee','eeeeeeee','eeeeeeee','eeeeeeee','eeeeeeee','eeeeeeee','eeeeeeee','eeeeeeee','eeeeeeee','eeeeeeee','eeeeeeee','eeeeeeee','eeeeeeee','eeeeeeee','eeeeeeee','eeeeeeee'),
(18446744073709551617.1,18446744073709551617.1,18446744073709551617.1,18446744073709551617.1,18446744073709551617.1,18446744073709551617.1,18446744073709551617.1,18446744073709551617.1,18446744073709551617.1,18446744073709551617.1,18446744073709551617.1,18446744073709551617.1,18446744073709551617.1,18446744073709551617.1,18446744073709551617.1,18446744073709551617.1,18446744073709551617.1,18446744073709551617.1,18446744073709551617.1),
('1x','1x','1x','1x','1x','1x','1x','1x','1x','1x','1x','1x','1x','1x','1x','1x','1x','1x','1x'),
(str_to_date('20191022','%Y%m%d'),str_to_date('20191022','%Y%m%d'),str_to_date('20191022','%Y%m%d'),str_to_date('20191022','%Y%m%d'),str_to_date('20191022','%Y%m%d'),str_to_date('20191022','%Y%m%d'),str_to_date('20191022','%Y%m%d'),str_to_date('20191022','%Y%m%d'),str_to_date('20191022','%Y%m%d'),str_to_date('20191022','%Y%m%d'),str_to_date('20191022','%Y%m%d'),str_to_date('20191022','%Y%m%d'),str_to_date('20191022','%Y%m%d'),str_to_date('20191022','%Y%m%d'),str_to_date('20191022','%Y%m%d'),str_to_date('20191022','%Y%m%d'),str_to_date('20191022','%Y%m%d'),str_to_date('20191022','%Y%m%d'),str_to_date('20191022','%Y%m%d')),
('1970-01-02 00:01:40.0','1970-01-02 00:01:40.0','1970-01-02 00:01:40.0','1970-01-02 00:01:40.0','1970-01-02 00:01:40.0','1970-01-02 00:01:40.0','1970-01-02 00:01:40.0','1970-01-02 00:01:40.0','1970-01-02 00:01:40.0','1970-01-02 00:01:40.0','1970-01-02 00:01:40.0','1970-01-02 00:01:40.0','1970-01-02 00:01:40.0','1970-01-02 00:01:40.0','1970-01-02 00:01:40.0','1970-01-02 00:01:40.0','1970-01-02 00:01:40.0','1970-01-02 00:01:40.0','1970-01-02 00:01:40.0'),
(cast(3 as unsigned),cast(3 as unsigned),cast(3 as unsigned),cast(3 as unsigned),cast(3 as unsigned),cast(3 as unsigned),cast(3 as unsigned),cast(3 as unsigned),cast(3 as unsigned),cast(3 as unsigned),cast(3 as unsigned),cast(3 as unsigned),cast(3 as unsigned),cast(3 as unsigned),cast(3 as unsigned),cast(3 as unsigned),cast(3 as unsigned),cast(3 as unsigned),cast(3 as unsigned));
INSERT ignore INTO cool_deal_card (`agent_id`,`business_id`,`door_id`,`status`,`out_trade_id`,`cur`,`total_fee`,`cash_fee`,`mch_no_sft`,`terminal_id`,`trace_no`,`batch_no`,`order_id_sft`,`regtime`,`trade_ref`,`trade_result`,`short_pan`,`ext_data`,`orig_trade_ref`) VALUES(-1,-1,-1,-1,-1,-1,-1,-1,-1,-1,-1,-1,-1,-1,-1,-1,-1,-1,-1),
('a','a','a','a','a','a','a','a','a','a','a','a','a','a','a','a','a','a','a'),
('A','A','A','A','A','A','A','A','A','A','A','A','A','A','A','A','A','A','A'),
("0.0","0.0","0.0","0.0","0.0","0.0","0.0","0.0","0.0","0.0","0.0","0.0","0.0","0.0","0.0","0.0","0.0","0.0","0.0"),
(default,default,default,default,default,default,default,default,default,default,default,default,default,default,default,default,default,default,default),
("+111111111.11","+111111111.11","+111111111.11","+111111111.11","+111111111.11","+111111111.11","+111111111.11","+111111111.11","+111111111.11","+111111111.11","+111111111.11","+111111111.11","+111111111.11","+111111111.11","+111111111.11","+111111111.11","+111111111.11","+111111111.11","+111111111.11"),
('xxxxxxlsl@kkdis.com','xxxxxxlsl@kkdis.com','xxxxxxlsl@kkdis.com','xxxxxxlsl@kkdis.com','xxxxxxlsl@kkdis.com','xxxxxxlsl@kkdis.com','xxxxxxlsl@kkdis.com','xxxxxxlsl@kkdis.com','xxxxxxlsl@kkdis.com','xxxxxxlsl@kkdis.com','xxxxxxlsl@kkdis.com','xxxxxxlsl@kkdis.com','xxxxxxlsl@kkdis.com','xxxxxxlsl@kkdis.com','xxxxxxlsl@kkdis.com','xxxxxxlsl@kkdis.com','xxxxxxlsl@kkdis.com','xxxxxxlsl@kkdis.com','xxxxxxlsl@kkdis.com'),
('a,','a,','a,','a,','a,','a,','a,','a,','a,','a,','a,','a,','a,','a,','a,','a,','a,','a,','a,'),
(rpad('Ff',800,'fF'),rpad('Ff',800,'fF'),rpad('Ff',800,'fF'),rpad('Ff',800,'fF'),rpad('Ff',800,'fF'),rpad('Ff',800,'fF'),rpad('Ff',800,'fF'),rpad('Ff',800,'fF'),rpad('Ff',800,'fF'),rpad('Ff',800,'fF'),rpad('Ff',800,'fF'),rpad('Ff',800,'fF'),rpad('Ff',800,'fF'),rpad('Ff',800,'fF'),rpad('Ff',800,'fF'),rpad('Ff',800,'fF'),rpad('Ff',800,'fF'),rpad('Ff',800,'fF'),rpad('Ff',800,'fF')),
(rpad('1234567890abcdef',800,'1234567890abcdef'),rpad('1234567890abcdef',800,'1234567890abcdef'),rpad('1234567890abcdef',800,'1234567890abcdef'),rpad('1234567890abcdef',800,'1234567890abcdef'),rpad('1234567890abcdef',800,'1234567890abcdef'),rpad('1234567890abcdef',800,'1234567890abcdef'),rpad('1234567890abcdef',800,'1234567890abcdef'),rpad('1234567890abcdef',800,'1234567890abcdef'),rpad('1234567890abcdef',800,'1234567890abcdef'),rpad('1234567890abcdef',800,'1234567890abcdef'),rpad('1234567890abcdef',800,'1234567890abcdef'),rpad('1234567890abcdef',800,'1234567890abcdef'),rpad('1234567890abcdef',800,'1234567890abcdef'),rpad('1234567890abcdef',800,'1234567890abcdef'),rpad('1234567890abcdef',800,'1234567890abcdef'),rpad('1234567890abcdef',800,'1234567890abcdef'),rpad('1234567890abcdef',800,'1234567890abcdef'),rpad('1234567890abcdef',800,'1234567890abcdef'),rpad('1234567890abcdef',800,'1234567890abcdef'));
INSERT ignore INTO cool_deal_card (`agent_id`,`business_id`,`door_id`,`status`,`out_trade_id`,`cur`,`total_fee`,`cash_fee`,`mch_no_sft`,`terminal_id`,`trace_no`,`batch_no`,`order_id_sft`,`regtime`,`trade_ref`,`trade_result`,`short_pan`,`ext_data`,`orig_trade_ref`) VALUES((1+2) || 1 ||1 || 1 ||1||1||1||1||1||1||'1'||1||1||1||1||1||1||1||1||'11'||(3*2)||(5-2)||1||1||1||1||1||1||1||1||1||1||1||1||1||1||1||1||1||1||1||1||1||1||1||1||1||1||1||1||1||1||1||1||1||1||1||1||1||1||1||1||1||1||1||1||1||1||1||1||1||1||1||1||1||1||1||1||1||1||1||1||1||1||1||1||1||1||1||1||1||1||1||1||1||1||1||1||1||1||1||1||1||1||1||1||1||1||1||1||1||1||1||1||1||1||1||1||1||1||1||(2||4)||1||1||1||1||1||1||1||1||1||1||1||1||1||1||1||1||1||1||1||1||1||1||1||1||1||1||1||1||1||1||1||(2||4)||1||1||1||1||1||1||1||1||1||1||1||1||1||1||1||1||1||1||1||1||1||1||1||1||1||1||1||1||1||1||1||(2||4),(1+2) || 1 ||1 || 1 ||1||1||1||1||1||1||'1'||1||1||1||1||1||1||1||1||'11'||(3*2)||(5-2)||1||1||1||1||1||1||1||1||1||1||1||1||1||1||1||1||1||1||1||1||1||1||1||1||1||1||1||1||1||1||1||1||1||1||1||1||1||1||1||1||1||1||1||1||1||1||1||1||1||1||1||1||1||1||1||1||1||1||1||1||1||1||1||1||1||1||1||1||1||1||1||1||1||1||1||1||1||1||1||1||1||1||1||1||1||1||1||1||1||1||1||1||1||1||1||1||1||1||1||(2||4)||1||1||1||1||1||1||1||1||1||1||1||1||1||1||1||1||1||1||1||1||1||1||1||1||1||1||1||1||1||1||1||(2||4)||1||1||1||1||1||1||1||1||1||1||1||1||1||1||1||1||1||1||1||1||1||1||1||1||1||1||1||1||1||1||1||(2||4),(1+2) || 1 ||1 || 1 ||1||1||1||1||1||1||'1'||1||1||1||1||1||1||1||1||'11'||(3*2)||(5-2)||1||1||1||1||1||1||1||1||1||1||1||1||1||1||1||1||1||1||1||1||1||1||1||1||1||1||1||1||1||1||1||1||1||1||1||1||1||1||1||1||1||1||1||1||1||1||1||1||1||1||1||1||1||1||1||1||1||1||1||1||1||1||1||1||1||1||1||1||1||1||1||1||1||1||1||1||1||1||1||1||1||1||1||1||1||1||1||1||1||1||1||1||1||1||1||1||1||1||1||(2||4)||1||1||1||1||1||1||1||1||1||1||1||1||1||1||1||1||1||1||1||1||1||1||1||1||1||1||1||1||1||1||1||(2||4)||1||1||1||1||1||1||1||1||1||1||1||1||1||1||1||1||1||1||1||1||1||1||1||1||1||1||1||1||1||1||1||(2||4),(1+2) || 1 ||1 || 1 ||1||1||1||1||1||1||'1'||1||1||1||1||1||1||1||1||'11'||(3*2)||(5-2)||1||1||1||1||1||1||1||1||1||1||1||1||1||1||1||1||1||1||1||1||1||1||1||1||1||1||1||1||1||1||1||1||1||1||1||1||1||1||1||1||1||1||1||1||1||1||1||1||1||1||1||1||1||1||1||1||1||1||1||1||1||1||1||1||1||1||1||1||1||1||1||1||1||1||1||1||1||1||1||1||1||1||1||1||1||1||1||1||1||1||1||1||1||1||1||1||1||1||1||(2||4)||1||1||1||1||1||1||1||1||1||1||1||1||1||1||1||1||1||1||1||1||1||1||1||1||1||1||1||1||1||1||1||(2||4)||1||1||1||1||1||1||1||1||1||1||1||1||1||1||1||1||1||1||1||1||1||1||1||1||1||1||1||1||1||1||1||(2||4),(1+2) || 1 ||1 || 1 ||1||1||1||1||1||1||'1'||1||1||1||1||1||1||1||1||'11'||(3*2)||(5-2)||1||1||1||1||1||1||1||1||1||1||1||1||1||1||1||1||1||1||1||1||1||1||1||1||1||1||1||1||1||1||1||1||1||1||1||1||1||1||1||1||1||1||1||1||1||1||1||1||1||1||1||1||1||1||1||1||1||1||1||1||1||1||1||1||1||1||1||1||1||1||1||1||1||1||1||1||1||1||1||1||1||1||1||1||1||1||1||1||1||1||1||1||1||1||1||1||1||1||1||(2||4)||1||1||1||1||1||1||1||1||1||1||1||1||1||1||1||1||1||1||1||1||1||1||1||1||1||1||1||1||1||1||1||(2||4)||1||1||1||1||1||1||1||1||1||1||1||1||1||1||1||1||1||1||1||1||1||1||1||1||1||1||1||1||1||1||1||(2||4),(1+2) || 1 ||1 || 1 ||1||1||1||1||1||1||'1'||1||1||1||1||1||1||1||1||'11'||(3*2)||(5-2)||1||1||1||1||1||1||1||1||1||1||1||1||1||1||1||1||1||1||1||1||1||1||1||1||1||1||1||1||1||1||1||1||1||1||1||1||1||1||1||1||1||1||1||1||1||1||1||1||1||1||1||1||1||1||1||1||1||1||1||1||1||1||1||1||1||1||1||1||1||1||1||1||1||1||1||1||1||1||1||1||1||1||1||1||1||1||1||1||1||1||1||1||1||1||1||1||1||1||1||(2||4)||1||1||1||1||1||1||1||1||1||1||1||1||1||1||1||1||1||1||1||1||1||1||1||1||1||1||1||1||1||1||1||(2||4)||1||1||1||1||1||1||1||1||1||1||1||1||1||1||1||1||1||1||1||1||1||1||1||1||1||1||1||1||1||1||1||(2||4),(1+2) || 1 ||1 || 1 ||1||1||1||1||1||1||'1'||1||1||1||1||1||1||1||1||'11'||(3*2)||(5-2)||1||1||1||1||1||1||1||1||1||1||1||1||1||1||1||1||1||1||1||1||1||1||1||1||1||1||1||1||1||1||1||1||1||1||1||1||1||1||1||1||1||1||1||1||1||1||1||1||1||1||1||1||1||1||1||1||1||1||1||1||1||1||1||1||1||1||1||1||1||1||1||1||1||1||1||1||1||1||1||1||1||1||1||1||1||1||1||1||1||1||1||1||1||1||1||1||1||1||1||(2||4)||1||1||1||1||1||1||1||1||1||1||1||1||1||1||1||1||1||1||1||1||1||1||1||1||1||1||1||1||1||1||1||(2||4)||1||1||1||1||1||1||1||1||1||1||1||1||1||1||1||1||1||1||1||1||1||1||1||1||1||1||1||1||1||1||1||(2||4),(1+2) || 1 ||1 || 1 ||1||1||1||1||1||1||'1'||1||1||1||1||1||1||1||1||'11'||(3*2)||(5-2)||1||1||1||1||1||1||1||1||1||1||1||1||1||1||1||1||1||1||1||1||1||1||1||1||1||1||1||1||1||1||1||1||1||1||1||1||1||1||1||1||1||1||1||1||1||1||1||1||1||1||1||1||1||1||1||1||1||1||1||1||1||1||1||1||1||1||1||1||1||1||1||1||1||1||1||1||1||1||1||1||1||1||1||1||1||1||1||1||1||1||1||1||1||1||1||1||1||1||1||(2||4)||1||1||1||1||1||1||1||1||1||1||1||1||1||1||1||1||1||1||1||1||1||1||1||1||1||1||1||1||1||1||1||(2||4)||1||1||1||1||1||1||1||1||1||1||1||1||1||1||1||1||1||1||1||1||1||1||1||1||1||1||1||1||1||1||1||(2||4),(1+2) || 1 ||1 || 1 ||1||1||1||1||1||1||'1'||1||1||1||1||1||1||1||1||'11'||(3*2)||(5-2)||1||1||1||1||1||1||1||1||1||1||1||1||1||1||1||1||1||1||1||1||1||1||1||1||1||1||1||1||1||1||1||1||1||1||1||1||1||1||1||1||1||1||1||1||1||1||1||1||1||1||1||1||1||1||1||1||1||1||1||1||1||1||1||1||1||1||1||1||1||1||1||1||1||1||1||1||1||1||1||1||1||1||1||1||1||1||1||1||1||1||1||1||1||1||1||1||1||1||1||(2||4)||1||1||1||1||1||1||1||1||1||1||1||1||1||1||1||1||1||1||1||1||1||1||1||1||1||1||1||1||1||1||1||(2||4)||1||1||1||1||1||1||1||1||1||1||1||1||1||1||1||1||1||1||1||1||1||1||1||1||1||1||1||1||1||1||1||(2||4),(1+2) || 1 ||1 || 1 ||1||1||1||1||1||1||'1'||1||1||1||1||1||1||1||1||'11'||(3*2)||(5-2)||1||1||1||1||1||1||1||1||1||1||1||1||1||1||1||1||1||1||1||1||1||1||1||1||1||1||1||1||1||1||1||1||1||1||1||1||1||1||1||1||1||1||1||1||1||1||1||1||1||1||1||1||1||1||1||1||1||1||1||1||1||1||1||1||1||1||1||1||1||1||1||1||1||1||1||1||1||1||1||1||1||1||1||1||1||1||1||1||1||1||1||1||1||1||1||1||1||1||1||(2||4)||1||1||1||1||1||1||1||1||1||1||1||1||1||1||1||1||1||1||1||1||1||1||1||1||1||1||1||1||1||1||1||(2||4)||1||1||1||1||1||1||1||1||1||1||1||1||1||1||1||1||1||1||1||1||1||1||1||1||1||1||1||1||1||1||1||(2||4),(1+2) || 1 ||1 || 1 ||1||1||1||1||1||1||'1'||1||1||1||1||1||1||1||1||'11'||(3*2)||(5-2)||1||1||1||1||1||1||1||1||1||1||1||1||1||1||1||1||1||1||1||1||1||1||1||1||1||1||1||1||1||1||1||1||1||1||1||1||1||1||1||1||1||1||1||1||1||1||1||1||1||1||1||1||1||1||1||1||1||1||1||1||1||1||1||1||1||1||1||1||1||1||1||1||1||1||1||1||1||1||1||1||1||1||1||1||1||1||1||1||1||1||1||1||1||1||1||1||1||1||1||(2||4)||1||1||1||1||1||1||1||1||1||1||1||1||1||1||1||1||1||1||1||1||1||1||1||1||1||1||1||1||1||1||1||(2||4)||1||1||1||1||1||1||1||1||1||1||1||1||1||1||1||1||1||1||1||1||1||1||1||1||1||1||1||1||1||1||1||(2||4),(1+2) || 1 ||1 || 1 ||1||1||1||1||1||1||'1'||1||1||1||1||1||1||1||1||'11'||(3*2)||(5-2)||1||1||1||1||1||1||1||1||1||1||1||1||1||1||1||1||1||1||1||1||1||1||1||1||1||1||1||1||1||1||1||1||1||1||1||1||1||1||1||1||1||1||1||1||1||1||1||1||1||1||1||1||1||1||1||1||1||1||1||1||1||1||1||1||1||1||1||1||1||1||1||1||1||1||1||1||1||1||1||1||1||1||1||1||1||1||1||1||1||1||1||1||1||1||1||1||1||1||1||(2||4)||1||1||1||1||1||1||1||1||1||1||1||1||1||1||1||1||1||1||1||1||1||1||1||1||1||1||1||1||1||1||1||(2||4)||1||1||1||1||1||1||1||1||1||1||1||1||1||1||1||1||1||1||1||1||1||1||1||1||1||1||1||1||1||1||1||(2||4),(1+2) || 1 ||1 || 1 ||1||1||1||1||1||1||'1'||1||1||1||1||1||1||1||1||'11'||(3*2)||(5-2)||1||1||1||1||1||1||1||1||1||1||1||1||1||1||1||1||1||1||1||1||1||1||1||1||1||1||1||1||1||1||1||1||1||1||1||1||1||1||1||1||1||1||1||1||1||1||1||1||1||1||1||1||1||1||1||1||1||1||1||1||1||1||1||1||1||1||1||1||1||1||1||1||1||1||1||1||1||1||1||1||1||1||1||1||1||1||1||1||1||1||1||1||1||1||1||1||1||1||1||(2||4)||1||1||1||1||1||1||1||1||1||1||1||1||1||1||1||1||1||1||1||1||1||1||1||1||1||1||1||1||1||1||1||(2||4)||1||1||1||1||1||1||1||1||1||1||1||1||1||1||1||1||1||1||1||1||1||1||1||1||1||1||1||1||1||1||1||(2||4),(1+2) || 1 ||1 || 1 ||1||1||1||1||1||1||'1'||1||1||1||1||1||1||1||1||'11'||(3*2)||(5-2)||1||1||1||1||1||1||1||1||1||1||1||1||1||1||1||1||1||1||1||1||1||1||1||1||1||1||1||1||1||1||1||1||1||1||1||1||1||1||1||1||1||1||1||1||1||1||1||1||1||1||1||1||1||1||1||1||1||1||1||1||1||1||1||1||1||1||1||1||1||1||1||1||1||1||1||1||1||1||1||1||1||1||1||1||1||1||1||1||1||1||1||1||1||1||1||1||1||1||1||(2||4)||1||1||1||1||1||1||1||1||1||1||1||1||1||1||1||1||1||1||1||1||1||1||1||1||1||1||1||1||1||1||1||(2||4)||1||1||1||1||1||1||1||1||1||1||1||1||1||1||1||1||1||1||1||1||1||1||1||1||1||1||1||1||1||1||1||(2||4),(1+2) || 1 ||1 || 1 ||1||1||1||1||1||1||'1'||1||1||1||1||1||1||1||1||'11'||(3*2)||(5-2)||1||1||1||1||1||1||1||1||1||1||1||1||1||1||1||1||1||1||1||1||1||1||1||1||1||1||1||1||1||1||1||1||1||1||1||1||1||1||1||1||1||1||1||1||1||1||1||1||1||1||1||1||1||1||1||1||1||1||1||1||1||1||1||1||1||1||1||1||1||1||1||1||1||1||1||1||1||1||1||1||1||1||1||1||1||1||1||1||1||1||1||1||1||1||1||1||1||1||1||(2||4)||1||1||1||1||1||1||1||1||1||1||1||1||1||1||1||1||1||1||1||1||1||1||1||1||1||1||1||1||1||1||1||(2||4)||1||1||1||1||1||1||1||1||1||1||1||1||1||1||1||1||1||1||1||1||1||1||1||1||1||1||1||1||1||1||1||(2||4),(1+2) || 1 ||1 || 1 ||1||1||1||1||1||1||'1'||1||1||1||1||1||1||1||1||'11'||(3*2)||(5-2)||1||1||1||1||1||1||1||1||1||1||1||1||1||1||1||1||1||1||1||1||1||1||1||1||1||1||1||1||1||1||1||1||1||1||1||1||1||1||1||1||1||1||1||1||1||1||1||1||1||1||1||1||1||1||1||1||1||1||1||1||1||1||1||1||1||1||1||1||1||1||1||1||1||1||1||1||1||1||1||1||1||1||1||1||1||1||1||1||1||1||1||1||1||1||1||1||1||1||1||(2||4)||1||1||1||1||1||1||1||1||1||1||1||1||1||1||1||1||1||1||1||1||1||1||1||1||1||1||1||1||1||1||1||(2||4)||1||1||1||1||1||1||1||1||1||1||1||1||1||1||1||1||1||1||1||1||1||1||1||1||1||1||1||1||1||1||1||(2||4),(1+2) || 1 ||1 || 1 ||1||1||1||1||1||1||'1'||1||1||1||1||1||1||1||1||'11'||(3*2)||(5-2)||1||1||1||1||1||1||1||1||1||1||1||1||1||1||1||1||1||1||1||1||1||1||1||1||1||1||1||1||1||1||1||1||1||1||1||1||1||1||1||1||1||1||1||1||1||1||1||1||1||1||1||1||1||1||1||1||1||1||1||1||1||1||1||1||1||1||1||1||1||1||1||1||1||1||1||1||1||1||1||1||1||1||1||1||1||1||1||1||1||1||1||1||1||1||1||1||1||1||1||(2||4)||1||1||1||1||1||1||1||1||1||1||1||1||1||1||1||1||1||1||1||1||1||1||1||1||1||1||1||1||1||1||1||(2||4)||1||1||1||1||1||1||1||1||1||1||1||1||1||1||1||1||1||1||1||1||1||1||1||1||1||1||1||1||1||1||1||(2||4),(1+2) || 1 ||1 || 1 ||1||1||1||1||1||1||'1'||1||1||1||1||1||1||1||1||'11'||(3*2)||(5-2)||1||1||1||1||1||1||1||1||1||1||1||1||1||1||1||1||1||1||1||1||1||1||1||1||1||1||1||1||1||1||1||1||1||1||1||1||1||1||1||1||1||1||1||1||1||1||1||1||1||1||1||1||1||1||1||1||1||1||1||1||1||1||1||1||1||1||1||1||1||1||1||1||1||1||1||1||1||1||1||1||1||1||1||1||1||1||1||1||1||1||1||1||1||1||1||1||1||1||1||(2||4)||1||1||1||1||1||1||1||1||1||1||1||1||1||1||1||1||1||1||1||1||1||1||1||1||1||1||1||1||1||1||1||(2||4)||1||1||1||1||1||1||1||1||1||1||1||1||1||1||1||1||1||1||1||1||1||1||1||1||1||1||1||1||1||1||1||(2||4),(1+2) || 1 ||1 || 1 ||1||1||1||1||1||1||'1'||1||1||1||1||1||1||1||1||'11'||(3*2)||(5-2)||1||1||1||1||1||1||1||1||1||1||1||1||1||1||1||1||1||1||1||1||1||1||1||1||1||1||1||1||1||1||1||1||1||1||1||1||1||1||1||1||1||1||1||1||1||1||1||1||1||1||1||1||1||1||1||1||1||1||1||1||1||1||1||1||1||1||1||1||1||1||1||1||1||1||1||1||1||1||1||1||1||1||1||1||1||1||1||1||1||1||1||1||1||1||1||1||1||1||1||(2||4)||1||1||1||1||1||1||1||1||1||1||1||1||1||1||1||1||1||1||1||1||1||1||1||1||1||1||1||1||1||1||1||(2||4)||1||1||1||1||1||1||1||1||1||1||1||1||1||1||1||1||1||1||1||1||1||1||1||1||1||1||1||1||1||1||1||(2||4));
INSERT ignore INTO cool_deal_card (`agent_id`,`business_id`,`door_id`,`status`,`out_trade_id`,`cur`,`total_fee`,`cash_fee`,`mch_no_sft`,`terminal_id`,`trace_no`,`batch_no`,`order_id_sft`,`regtime`,`trade_ref`,`trade_result`,`short_pan`,`ext_data`,`orig_trade_ref`) VALUES(rpad('F',1000,'F'),rpad('F',1000,'F'),rpad('F',1000,'F'),rpad('F',1000,'F'),rpad('F',1000,'F'),rpad('F',1000,'F'),rpad('F',1000,'F'),rpad('F',1000,'F'),rpad('F',1000,'F'),rpad('F',1000,'F'),rpad('F',1000,'F'),rpad('F',1000,'F'),rpad('F',1000,'F'),rpad('F',1000,'F'),rpad('F',1000,'F'),rpad('F',1000,'F'),rpad('F',1000,'F'),rpad('F',1000,'F'),rpad('F',1000,'F')),('0o11','0o11','0o11','0o11','0o11','0o11','0o11','0o11','0o11','0o11','0o11','0o11','0o11','0o11','0o11','0o11','0o11','0o11','0o11'),('21023456789abcdefABCDEF','21023456789abcdefABCDEF','21023456789abcdefABCDEF','21023456789abcdefABCDEF','21023456789abcdefABCDEF','21023456789abcdefABCDEF','21023456789abcdefABCDEF','21023456789abcdefABCDEF','21023456789abcdefABCDEF','21023456789abcdefABCDEF','21023456789abcdefABCDEF','21023456789abcdefABCDEF','21023456789abcdefABCDEF','21023456789abcdefABCDEF','21023456789abcdefABCDEF','21023456789abcdefABCDEF','21023456789abcdefABCDEF','21023456789abcdefABCDEF','21023456789abcdefABCDEF'),('-9.D','-9.D','-9.D','-9.D','-9.D','-9.D','-9.D','-9.D','-9.D','-9.D','-9.D','-9.D','-9.D','-9.D','-9.D','-9.D','-9.D','-9.D','-9.D'),('.5d','.5d','.5d','.5d','.5d','.5d','.5d','.5d','.5d','.5d','.5d','.5d','.5d','.5d','.5d','.5d','.5d','.5d','.5d'),('1.23254e2 * 1.5769032e1 * 2.434343 * 59.075478965 * 4.44444444f','1.23254e2 * 1.5769032e1 * 2.434343 * 59.075478965 * 4.44444444f','1.23254e2 * 1.5769032e1 * 2.434343 * 59.075478965 * 4.44444444f','1.23254e2 * 1.5769032e1 * 2.434343 * 59.075478965 * 4.44444444f','1.23254e2 * 1.5769032e1 * 2.434343 * 59.075478965 * 4.44444444f','1.23254e2 * 1.5769032e1 * 2.434343 * 59.075478965 * 4.44444444f','1.23254e2 * 1.5769032e1 * 2.434343 * 59.075478965 * 4.44444444f','1.23254e2 * 1.5769032e1 * 2.434343 * 59.075478965 * 4.44444444f','1.23254e2 * 1.5769032e1 * 2.434343 * 59.075478965 * 4.44444444f','1.23254e2 * 1.5769032e1 * 2.434343 * 59.075478965 * 4.44444444f','1.23254e2 * 1.5769032e1 * 2.434343 * 59.075478965 * 4.44444444f','1.23254e2 * 1.5769032e1 * 2.434343 * 59.075478965 * 4.44444444f','1.23254e2 * 1.5769032e1 * 2.434343 * 59.075478965 * 4.44444444f','1.23254e2 * 1.5769032e1 * 2.434343 * 59.075478965 * 4.44444444f','1.23254e2 * 1.5769032e1 * 2.434343 * 59.075478965 * 4.44444444f','1.23254e2 * 1.5769032e1 * 2.434343 * 59.075478965 * 4.44444444f','1.23254e2 * 1.5769032e1 * 2.434343 * 59.075478965 * 4.44444444f','1.23254e2 * 1.5769032e1 * 2.434343 * 59.075478965 * 4.44444444f','1.23254e2 * 1.5769032e1 * 2.434343 * 59.075478965 * 4.44444444f'),('-0','-0','-0','-0','-0','-0','-0','-0','-0','-0','-0','-0','-0','-0','-0','-0','-0','-0','-0'),('-1d','-1d','-1d','-1d','-1d','-1d','-1d','-1d','-1d','-1d','-1d','-1d','-1d','-1d','-1d','-1d','-1d','-1d','-1d'),('+0','+0','+0','+0','+0','+0','+0','+0','+0','+0','+0','+0','+0','+0','+0','+0','+0','+0','+0'),('+1d','+1d','+1d','+1d','+1d','+1d','+1d','+1d','+1d','+1d','+1d','+1d','+1d','+1d','+1d','+1d','+1d','+1d','+1d'),
('1.923e-10f','1.923e-10f','1.923e-10f','1.923e-10f','1.923e-10f','1.923e-10f','1.923e-10f','1.923e-10f','1.923e-10f','1.923e-10f','1.923e-10f','1.923e-10f','1.923e-10f','1.923e-10f','1.923e-10f','1.923e-10f','1.923e-10f','1.923e-10f','1.923e-10f'),
('1.245454e-30','1.245454e-30','1.245454e-30','1.245454e-30','1.245454e-30','1.245454e-30','1.245454e-30','1.245454e-30','1.245454e-30','1.245454e-30','1.245454e-30','1.245454e-30','1.245454e-30','1.245454e-30','1.245454e-30','1.245454e-30','1.245454e-30','1.245454e-30','1.245454e-30'),
('1.245454e-30d','1.245454e-30d','1.245454e-30d','1.245454e-30d','1.245454e-30d','1.245454e-30d','1.245454e-30d','1.245454e-30d','1.245454e-30d','1.245454e-30d','1.245454e-30d','1.245454e-30d','1.245454e-30d','1.245454e-30d','1.245454e-30d','1.245454e-30d','1.245454e-30d','1.245454e-30d','1.245454e-30d');
INSERT ignore INTO cool_deal_card (`agent_id`,`business_id`,`door_id`,`status`,`out_trade_id`,`cur`,`total_fee`,`cash_fee`,`mch_no_sft`,`terminal_id`,`trace_no`,`batch_no`,`order_id_sft`,`regtime`,`trade_ref`,`trade_result`,`short_pan`,`ext_data`,`orig_trade_ref`) VALUES(cast(20010101010101 as datetime),cast(20010101010101 as datetime),cast(20010101010101 as datetime),cast(20010101010101 as datetime),cast(20010101010101 as datetime),cast(20010101010101 as datetime),cast(20010101010101 as datetime),cast(20010101010101 as datetime),cast(20010101010101 as datetime),cast(20010101010101 as datetime),cast(20010101010101 as datetime),cast(20010101010101 as datetime),cast(20010101010101 as datetime),cast(20010101010101 as datetime),cast(20010101010101 as datetime),cast(20010101010101 as datetime),cast(20010101010101 as datetime),cast(20010101010101 as datetime),cast(20010101010101 as datetime)),
("-.1","-.1","-.1","-.1","-.1","-.1","-.1","-.1","-.1","-.1","-.1","-.1","-.1","-.1","-.1","-.1","-.1","-.1","-.1"),
("00000000000001","00000000000001","00000000000001","00000000000001","00000000000001","00000000000001","00000000000001","00000000000001","00000000000001","00000000000001","00000000000001","00000000000001","00000000000001","00000000000001","00000000000001","00000000000001","00000000000001","00000000000001","00000000000001"),
(default,default,default,default,default,default,default,default,default,default,default,default,default,default,default,default,default,default,default),
(0,0,0,0,0,0,0,0,0,0,0,0,0,0,0,0,0,0,0),
(1,1,1,1,1,1,1,1,1,1,1,1,1,1,1,1,1,1,1),
('','','','','','','','','','','','','','','','','','',''),
(-1,-1,-1,-1,-1,-1,-1,-1,-1,-1,-1,-1,-1,-1,-1,-1,-1,-1,-1);
select agent_id,business_id,door_id,status,out_trade_id,cur,total_fee,cash_fee,mch_no_sft,terminal_id,trace_no,batch_no,order_id_sft,regtime,trade_ref,trade_result,short_pan,ext_data,orig_trade_ref from cool_deal_card order by deal_id;
agent_id	business_id	door_id	status	out_trade_id	cur	total_fee	cash_fee	mch_no_sft	terminal_id	trace_no	batch_no	order_id_sft	regtime	trade_ref	trade_result	short_pan	ext_data	orig_trade_ref
0	0	0	eeeeeeee	eeeeeeee	eeeeeeee	0.00	0.00	eeeeeeee	eeeeeeee	eeeeee	eeeeee	eeeeeeee	0	eeeeeeee	ee	eeeeeeee	eeeeeeee	eeeeeeee
2147483647	2147483647	2147483647	18446744073709551617	18446744073709551617.1	18446744073709551617	999999999999.99	99999999.99	184467440737095	18446744	184467	184467	184467440737	2147483647	18446744073709551617	18	1844674407	18446744073709551617.1	18446744073709551617.1
1	1	1	1x	1x	1x	1.00	1.00	1x	1x	1x	1x	1x	1	1x	1x	1x	1x	1x
20191022	20191022	20191022	2019-10-22	2019-10-22	2019-10-22	20191022.00	20191022.00	2019-10-22	2019-10-	2019-1	2019-1	2019-10-22	20191022	2019-10-22	20	2019-10-22	2019-10-22	2019-10-22
1970	1970	1970	1970-01-02 00:01:40.	1970-01-02 00:01:40.0	1970-01-02 00:01:40.	1970.00	1970.00	1970-01-02 00:0	1970-01-	1970-0	1970-0	1970-01-02 0	1970	1970-01-02 00:01:40.	19	1970-01-02	1970-01-02 00:01:40.0	1970-01-02 00:01:40.0
3	3	3	3	3	3	3.00	3.00	3	3	3	3	3	3	3	3	3	3	3
-1	-1	-1	-1	-1	-1	-1.00	-1.00	-1	-1	-1	-1	-1	-1	-1	-1	-1	-1	-1
0	0	0	a	a	a	0.00	0.00	a	a	a	a	a	0	a	a	a	a	a
0	0	0	A	A	A	0.00	0.00	A	A	A	A	A	0	A	A	A	A	A
0	0	0	0.0	0.0	0.0	0.00	0.00	0.0	0.0	0.0	0.0	0.0	0	0.0	0.	0.0	0.0	0.0
NULL	0	NULL			CNY	0.00	0.00						0		0			
111111111	111111111	111111111	+111111111.11	+111111111.11	+111111111.11	111111111.11	99999999.99	+111111111.11	+1111111	+11111	+11111	+111111111.1	111111111	+111111111.11	+1	+111111111	+111111111.11	+111111111.11
0	0	0	xxxxxxlsl@kkdis.com	xxxxxxlsl@kkdis.com	xxxxxxlsl@kkdis.com	0.00	0.00	xxxxxxlsl@kkdis	xxxxxxls	xxxxxx	xxxxxx	xxxxxxlsl@kk	0	xxxxxxlsl@kkdis.com	xx	xxxxxxlsl@	xxxxxxlsl@kkdis.com	xxxxxxlsl@kkdis.com
0	0	0	a,	a,	a,	0.00	0.00	a,	a,	a,	a,	a,	0	a,	a,	a,	a,	a,
0	0	0	FffFfFfFfFfFfFfFfFfF	FffFfFfFfFfFfFfFfFfFfFfFfFfFfFfF	FffFfFfFfFfFfFfFfFfF	0.00	0.00	FffFfFfFfFfFfFf	FffFfFfF	FffFfF	FffFfF	FffFfFfFfFfF	0	FffFfFfFfFfFfFfFfFfF	Ff	FffFfFfFfF	FffFfFfFfFfFfFfFfFfFfFfFfFfFfFfFfFfFfFfFfFfFfFfFfFfFfFfFfFfFfFfFfFfFfFfFfFfFfFfFfFfFfFfFfFfFfFfFfFfFfFfFfFfFfFfFfFfFfFfFfFfFfFfFfFfFfFfFfFfFfFfFfFfFfFfFfFfFfFfFfFfFfFfFfFfFfFfFfFfFfFfFfFfFfFfFfFfFfFfFfFfFfFfFfFfFfFfFfFfFfFfFfFfFfFfFfFfFfFfFfFfFfFfFfFfFfFf	FffFfFfFfFfFfFfFfFfFfFfFfFfFfFfFfFfFfFfFfFfFfFfFfF
1234567890	1234567890	1234567890	1234567890abcdef1234	1234567890abcdef1234567890abcdef	1234567890abcdef1234	1234567890.00	99999999.99	1234567890abcde	12345678	123456	123456	1234567890ab	1234567890	1234567890abcdef1234	12	1234567890	1234567890abcdef1234567890abcdef1234567890abcdef1234567890abcdef1234567890abcdef1234567890abcdef1234567890abcdef1234567890abcdef1234567890abcdef1234567890abcdef1234567890abcdef1234567890abcdef1234567890abcdef1234567890abcdef1234567890abcdef1234567890abcde	1234567890abcdef1234567890abcdef1234567890abcdef12
1	1	1	1	1	1	1.00	1.00	1	1	1	1	1	1	1	1	1	1	1
0	0	0	FFFFFFFFFFFFFFFFFFFF	FFFFFFFFFFFFFFFFFFFFFFFFFFFFFFFF	FFFFFFFFFFFFFFFFFFFF	0.00	0.00	FFFFFFFFFFFFFFF	FFFFFFFF	FFFFFF	FFFFFF	FFFFFFFFFFFF	0	FFFFFFFFFFFFFFFFFFFF	FF	FFFFFFFFFF	FFFFFFFFFFFFFFFFFFFFFFFFFFFFFFFFFFFFFFFFFFFFFFFFFFFFFFFFFFFFFFFFFFFFFFFFFFFFFFFFFFFFFFFFFFFFFFFFFFFFFFFFFFFFFFFFFFFFFFFFFFFFFFFFFFFFFFFFFFFFFFFFFFFFFFFFFFFFFFFFFFFFFFFFFFFFFFFFFFFFFFFFFFFFFFFFFFFFFFFFFFFFFFFFFFFFFFFFFFFFFFFFFFFFFFFFFFFFFFFFFFFFFFFFFFFFFFF	FFFFFFFFFFFFFFFFFFFFFFFFFFFFFFFFFFFFFFFFFFFFFFFFFF
0	0	0	0o11	0o11	0o11	0.00	0.00	0o11	0o11	0o11	0o11	0o11	0	0o11	0o	0o11	0o11	0o11
2147483647	2147483647	2147483647	21023456789abcdefABC	21023456789abcdefABCDEF	21023456789abcdefABC	21023456789.00	99999999.99	21023456789abcd	21023456	210234	210234	21023456789a	2147483647	21023456789abcdefABC	21	2102345678	21023456789abcdefABCDEF	21023456789abcdefABCDEF
-9	-9	-9	-9.D	-9.D	-9.D	-9.00	-9.00	-9.D	-9.D	-9.D	-9.D	-9.D	-9	-9.D	-9	-9.D	-9.D	-9.D
1	1	1	.5d	.5d	.5d	0.50	0.50	.5d	.5d	.5d	.5d	.5d	1	.5d	.5	.5d	.5d	.5d
123	123	123	1.23254e2 * 1.576903	1.23254e2 * 1.5769032e1 * 2.4343	1.23254e2 * 1.576903	123.25	123.25	1.23254e2 * 1.5	1.23254e	1.2325	1.2325	1.23254e2 * 	123	1.23254e2 * 1.576903	1.	1.23254e2 	1.23254e2 * 1.5769032e1 * 2.434343 * 59.075478965 * 4.44444444f	1.23254e2 * 1.5769032e1 * 2.434343 * 59.075478965 
0	0	0	-0	-0	-0	0.00	0.00	-0	-0	-0	-0	-0	0	-0	-0	-0	-0	-0
-1	-1	-1	-1d	-1d	-1d	-1.00	-1.00	-1d	-1d	-1d	-1d	-1d	-1	-1d	-1	-1d	-1d	-1d
0	0	0	+0	+0	+0	0.00	0.00	+0	+0	+0	+0	+0	0	+0	+0	+0	+0	+0
1	1	1	+1d	+1d	+1d	1.00	1.00	+1d	+1d	+1d	+1d	+1d	1	+1d	+1	+1d	+1d	+1d
0	0	0	1.923e-10f	1.923e-10f	1.923e-10f	0.00	0.00	1.923e-10f	1.923e-1	1.923e	1.923e	1.923e-10f	0	1.923e-10f	1.	1.923e-10f	1.923e-10f	1.923e-10f
0	0	0	1.245454e-30	1.245454e-30	1.245454e-30	0.00	0.00	1.245454e-30	1.245454	1.2454	1.2454	1.245454e-30	0	1.245454e-30	1.	1.245454e-	1.245454e-30	1.245454e-30
0	0	0	1.245454e-30d	1.245454e-30d	1.245454e-30d	0.00	0.00	1.245454e-30d	1.245454	1.2454	1.2454	1.245454e-30	0	1.245454e-30d	1.	1.245454e-	1.245454e-30d	1.245454e-30d
2147483647	2147483647	2147483647	2001-01-01 01:01:01	2001-01-01 01:01:01	2001-01-01 01:01:01	999999999999.99	99999999.99	2001-01-01 01:0	2001-01-	2001-0	2001-0	2001-01-01 0	2147483647	2001-01-01 01:01:01	20	2001-01-01	2001-01-01 01:01:01	2001-01-01 01:01:01
0	0	0	-.1	-.1	-.1	-0.10	-0.10	-.1	-.1	-.1	-.1	-.1	0	-.1	-.	-.1	-.1	-.1
1	1	1	00000000000001	00000000000001	00000000000001	1.00	1.00	00000000000001	00000000	000000	000000	000000000000	1	00000000000001	00	0000000000	00000000000001	00000000000001
NULL	0	NULL			CNY	0.00	0.00						0		0			
0	0	0	0	0	0	0.00	0.00	0	0	0	0	0	0	0	0	0	0	0
1	1	1	1	1	1	1.00	1.00	1	1	1	1	1	1	1	1	1	1	1
0	0	0				0.00	0.00						0					
-1	-1	-1	-1	-1	-1	-1.00	-1.00	-1	-1	-1	-1	-1	-1	-1	-1	-1	-1	-1
DROP TABLE IF EXISTS cool_bill_card;
CREATE TABLE `cool_bill_card` (
`bill_id` int(11) unsigned NOT NULL AUTO_INCREMENT,
`mch_no_sft` varchar(15) NOT NULL DEFAULT '' COMMENT '盛付通商户号（pos机商户号）',
`terminal_id` varchar(8) DEFAULT '' COMMENT '终端号',
`batch_no` varchar(6) DEFAULT '' COMMENT '终端批次号',
`trace_no` varchar(6) DEFAULT '0' COMMENT '终端流水号',
`order_no` varchar(32) DEFAULT '' COMMENT '商户订单号',
`trade_type` varchar(20) DEFAULT '' COMMENT '交易类型 0 支付 1 退款',
`trade_time` int(11) DEFAULT '0' COMMENT '交易时间',
`short_account` varchar(12) DEFAULT '' COMMENT '缩略主账号',
`card_type` varchar(10) DEFAULT '' COMMENT '卡类型',
`trade_money` decimal(10,2) DEFAULT '0.00' COMMENT '交易金额',
`fee` decimal(10,2) DEFAULT '0.00' COMMENT '收单手续费',
`cash_money` decimal(10,2) DEFAULT '0.00' COMMENT '实际结算金额',
`door_id` int(11) DEFAULT NULL,
`business_id` int(11) DEFAULT NULL,
`agent_id` int(11) DEFAULT NULL,
`created_at` int(11) DEFAULT NULL COMMENT '操作入库时间',
PRIMARY KEY (`bill_id`)
) AUTO_INCREMENT = 4000012 DEFAULT CHARSET = utf8mb4 ROW_FORMAT = DYNAMIC;
INSERT ignore INTO cool_bill_card (`mch_no_sft`,`terminal_id`,`batch_no`,`trace_no`,`order_no`,`trade_type`,`trade_time`,`short_account`,`card_type`,`trade_money`,`fee`,`cash_money`,`door_id`,`business_id`,`agent_id`,`created_at`) VALUES('eeeeeeee','eeeeeeee','eeeeeeee','eeeeeeee','eeeeeeee','eeeeeeee','eeeeeeee','eeeeeeee','eeeeeeee','eeeeeeee','eeeeeeee','eeeeeeee','eeeeeeee','eeeeeeee','eeeeeeee','eeeeeeee'),(18446744073709551617.1,18446744073709551617.1,18446744073709551617.1,18446744073709551617.1,18446744073709551617.1,18446744073709551617.1,18446744073709551617.1,18446744073709551617.1,18446744073709551617.1,18446744073709551617.1,18446744073709551617.1,18446744073709551617.1,18446744073709551617.1,18446744073709551617.1,18446744073709551617.1,18446744073709551617.1),('1x','1x','1x','1x','1x','1x','1x','1x','1x','1x','1x','1x','1x','1x','1x','1x'),(str_to_date('20191022','%Y%m%d'),str_to_date('20191022','%Y%m%d'),str_to_date('20191022','%Y%m%d'),str_to_date('20191022','%Y%m%d'),str_to_date('20191022','%Y%m%d'),str_to_date('20191022','%Y%m%d'),str_to_date('20191022','%Y%m%d'),str_to_date('20191022','%Y%m%d'),str_to_date('20191022','%Y%m%d'),str_to_date('20191022','%Y%m%d'),str_to_date('20191022','%Y%m%d'),str_to_date('20191022','%Y%m%d'),str_to_date('20191022','%Y%m%d'),str_to_date('20191022','%Y%m%d'),str_to_date('20191022','%Y%m%d'),str_to_date('20191022','%Y%m%d')),('1970-01-02 00:01:40.0','1970-01-02 00:01:40.0','1970-01-02 00:01:40.0','1970-01-02 00:01:40.0','1970-01-02 00:01:40.0','1970-01-02 00:01:40.0','1970-01-02 00:01:40.0','1970-01-02 00:01:40.0','1970-01-02 00:01:40.0','1970-01-02 00:01:40.0','1970-01-02 00:01:40.0','1970-01-02 00:01:40.0','1970-01-02 00:01:40.0','1970-01-02 00:01:40.0','1970-01-02 00:01:40.0','1970-01-02 00:01:40.0'),(cast(3 as unsigned),cast(3 as unsigned),cast(3 as unsigned),cast(3 as unsigned),cast(3 as unsigned),cast(3 as unsigned),cast(3 as unsigned),cast(3 as unsigned),cast(3 as unsigned),cast(3 as unsigned),cast(3 as unsigned),cast(3 as unsigned),cast(3 as unsigned),cast(3 as unsigned),cast(3 as unsigned),cast(3 as unsigned)),(-1,-1,-1,-1,-1,-1,-1,-1,-1,-1,-1,-1,-1,-1,-1,-1),('a','a','a','a','a','a','a','a','a','a','a','a','a','a','a','a'),('A','A','A','A','A','A','A','A','A','A','A','A','A','A','A','A'),("0.0","0.0","0.0","0.0","0.0","0.0","0.0","0.0","0.0","0.0","0.0","0.0","0.0","0.0","0.0","0.0"),(default,default,default,default,default,default,default,default,default,default,default,default,default,default,default,default),("+111111111.11","+111111111.11","+111111111.11","+111111111.11","+111111111.11","+111111111.11","+111111111.11","+111111111.11","+111111111.11","+111111111.11","+111111111.11","+111111111.11","+111111111.11","+111111111.11","+111111111.11","+111111111.11"),('xxxxxxlsl@kkdis.com','xxxxxxlsl@kkdis.com','xxxxxxlsl@kkdis.com','xxxxxxlsl@kkdis.com','xxxxxxlsl@kkdis.com','xxxxxxlsl@kkdis.com','xxxxxxlsl@kkdis.com','xxxxxxlsl@kkdis.com','xxxxxxlsl@kkdis.com','xxxxxxlsl@kkdis.com','xxxxxxlsl@kkdis.com','xxxxxxlsl@kkdis.com','xxxxxxlsl@kkdis.com','xxxxxxlsl@kkdis.com','xxxxxxlsl@kkdis.com','xxxxxxlsl@kkdis.com'),('a,','a,','a,','a,','a,','a,','a,','a,','a,','a,','a,','a,','a,','a,','a,','a,'),(rpad('Ff',800,'fF'),rpad('Ff',800,'fF'),rpad('Ff',800,'fF'),rpad('Ff',800,'fF'),rpad('Ff',800,'fF'),rpad('Ff',800,'fF'),rpad('Ff',800,'fF'),rpad('Ff',800,'fF'),rpad('Ff',800,'fF'),rpad('Ff',800,'fF'),rpad('Ff',800,'fF'),rpad('Ff',800,'fF'),rpad('Ff',800,'fF'),rpad('Ff',800,'fF'),rpad('Ff',800,'fF'),rpad('Ff',800,'fF')),(rpad('1234567890abcdef',800,'1234567890abcdef'),rpad('1234567890abcdef',800,'1234567890abcdef'),rpad('1234567890abcdef',800,'1234567890abcdef'),rpad('1234567890abcdef',800,'1234567890abcdef'),rpad('1234567890abcdef',800,'1234567890abcdef'),rpad('1234567890abcdef',800,'1234567890abcdef'),rpad('1234567890abcdef',800,'1234567890abcdef'),rpad('1234567890abcdef',800,'1234567890abcdef'),rpad('1234567890abcdef',800,'1234567890abcdef'),rpad('1234567890abcdef',800,'1234567890abcdef'),rpad('1234567890abcdef',800,'1234567890abcdef'),rpad('1234567890abcdef',800,'1234567890abcdef'),rpad('1234567890abcdef',800,'1234567890abcdef'),rpad('1234567890abcdef',800,'1234567890abcdef'),rpad('1234567890abcdef',800,'1234567890abcdef'),rpad('1234567890abcdef',800,'1234567890abcdef'));
select mch_no_sft,terminal_id,batch_no,trace_no,order_no,trade_type,trade_time,short_account,card_type,trade_money,fee,cash_money,door_id,business_id,agent_id,created_at from cool_bill_card order by bill_id;
mch_no_sft	terminal_id	batch_no	trace_no	order_no	trade_type	trade_time	short_account	card_type	trade_money	fee	cash_money	door_id	business_id	agent_id	created_at
eeeeeeee	eeeeeeee	eeeeee	eeeeee	eeeeeeee	eeeeeeee	0	eeeeeeee	eeeeeeee	0.00	0.00	0.00	0	0	0	0
184467440737095	18446744	184467	184467	18446744073709551617.1	18446744073709551617	2147483647	184467440737	1844674407	99999999.99	99999999.99	99999999.99	2147483647	2147483647	2147483647	2147483647
1x	1x	1x	1x	1x	1x	1	1x	1x	1.00	1.00	1.00	1	1	1	1
2019-10-22	2019-10-	2019-1	2019-1	2019-10-22	2019-10-22	20191022	2019-10-22	2019-10-22	20191022.00	20191022.00	20191022.00	20191022	20191022	20191022	20191022
1970-01-02 00:0	1970-01-	1970-0	1970-0	1970-01-02 00:01:40.0	1970-01-02 00:01:40.	1970	1970-01-02 0	1970-01-02	1970.00	1970.00	1970.00	1970	1970	1970	1970
3	3	3	3	3	3	3	3	3	3.00	3.00	3.00	3	3	3	3
-1	-1	-1	-1	-1	-1	-1	-1	-1	-1.00	-1.00	-1.00	-1	-1	-1	-1
a	a	a	a	a	a	0	a	a	0.00	0.00	0.00	0	0	0	0
A	A	A	A	A	A	0	A	A	0.00	0.00	0.00	0	0	0	0
0.0	0.0	0.0	0.0	0.0	0.0	0	0.0	0.0	0.00	0.00	0.00	0	0	0	0
			0			0			0.00	0.00	0.00	NULL	NULL	NULL	NULL
+111111111.11	+1111111	+11111	+11111	+111111111.11	+111111111.11	111111111	+111111111.1	+111111111	99999999.99	99999999.99	99999999.99	111111111	111111111	111111111	111111111
xxxxxxlsl@kkdis	xxxxxxls	xxxxxx	xxxxxx	xxxxxxlsl@kkdis.com	xxxxxxlsl@kkdis.com	0	xxxxxxlsl@kk	xxxxxxlsl@	0.00	0.00	0.00	0	0	0	0
a,	a,	a,	a,	a,	a,	0	a,	a,	0.00	0.00	0.00	0	0	0	0
FffFfFfFfFfFfFf	FffFfFfF	FffFfF	FffFfF	FffFfFfFfFfFfFfFfFfFfFfFfFfFfFfF	FffFfFfFfFfFfFfFfFfF	0	FffFfFfFfFfF	FffFfFfFfF	0.00	0.00	0.00	0	0	0	0
1234567890abcde	12345678	123456	123456	1234567890abcdef1234567890abcdef	1234567890abcdef1234	1234567890	1234567890ab	1234567890	99999999.99	99999999.99	99999999.99	1234567890	1234567890	1234567890	1234567890
delete from cool_bill_card;
INSERT ignore INTO cool_bill_card (`mch_no_sft`,`terminal_id`,`batch_no`,`trace_no`,`order_no`,`trade_type`,`trade_time`,`short_account`,`card_type`,`trade_money`,`fee`,`cash_money`,`door_id`,`business_id`,`agent_id`,`created_at`) VALUES((1+2) || 1 ||1 || 1 ||1||1||1||1||1||1||'1'||1||1||1||1||1||1||1||1||'11'||(3*2)||(5-2)||1||1||1||1||1||1||1||1||1||1||1||1||1||1||1||1||1||1||1||1||1||1||1||1||1||1||1||1||1||1||1||1||1||1||1||1||1||1||1||1||1||1||1||1||1||1||1||1||1||1||1||1||1||1||1||1||1||1||1||1||1||1||1||1||1||1||1||1||1||1||1||1||1||1||1||1||1||1||1||1||1||1||1||1||1||1||1||1||1||1||1||1||1||1||1||1||1||1||1||(2||4)||1||1||1||1||1||1||1||1||1||1||1||1||1||1||1||1||1||1||1||1||1||1||1||1||1||1||1||1||1||1||1||(2||4)||1||1||1||1||1||1||1||1||1||1||1||1||1||1||1||1||1||1||1||1||1||1||1||1||1||1||1||1||1||1||1||(2||4),(1+2) || 1 ||1 || 1 ||1||1||1||1||1||1||'1'||1||1||1||1||1||1||1||1||'11'||(3*2)||(5-2)||1||1||1||1||1||1||1||1||1||1||1||1||1||1||1||1||1||1||1||1||1||1||1||1||1||1||1||1||1||1||1||1||1||1||1||1||1||1||1||1||1||1||1||1||1||1||1||1||1||1||1||1||1||1||1||1||1||1||1||1||1||1||1||1||1||1||1||1||1||1||1||1||1||1||1||1||1||1||1||1||1||1||1||1||1||1||1||1||1||1||1||1||1||1||1||1||1||1||1||(2||4)||1||1||1||1||1||1||1||1||1||1||1||1||1||1||1||1||1||1||1||1||1||1||1||1||1||1||1||1||1||1||1||(2||4)||1||1||1||1||1||1||1||1||1||1||1||1||1||1||1||1||1||1||1||1||1||1||1||1||1||1||1||1||1||1||1||(2||4),(1+2) || 1 ||1 || 1 ||1||1||1||1||1||1||'1'||1||1||1||1||1||1||1||1||'11'||(3*2)||(5-2)||1||1||1||1||1||1||1||1||1||1||1||1||1||1||1||1||1||1||1||1||1||1||1||1||1||1||1||1||1||1||1||1||1||1||1||1||1||1||1||1||1||1||1||1||1||1||1||1||1||1||1||1||1||1||1||1||1||1||1||1||1||1||1||1||1||1||1||1||1||1||1||1||1||1||1||1||1||1||1||1||1||1||1||1||1||1||1||1||1||1||1||1||1||1||1||1||1||1||1||(2||4)||1||1||1||1||1||1||1||1||1||1||1||1||1||1||1||1||1||1||1||1||1||1||1||1||1||1||1||1||1||1||1||(2||4)||1||1||1||1||1||1||1||1||1||1||1||1||1||1||1||1||1||1||1||1||1||1||1||1||1||1||1||1||1||1||1||(2||4),(1+2) || 1 ||1 || 1 ||1||1||1||1||1||1||'1'||1||1||1||1||1||1||1||1||'11'||(3*2)||(5-2)||1||1||1||1||1||1||1||1||1||1||1||1||1||1||1||1||1||1||1||1||1||1||1||1||1||1||1||1||1||1||1||1||1||1||1||1||1||1||1||1||1||1||1||1||1||1||1||1||1||1||1||1||1||1||1||1||1||1||1||1||1||1||1||1||1||1||1||1||1||1||1||1||1||1||1||1||1||1||1||1||1||1||1||1||1||1||1||1||1||1||1||1||1||1||1||1||1||1||1||(2||4)||1||1||1||1||1||1||1||1||1||1||1||1||1||1||1||1||1||1||1||1||1||1||1||1||1||1||1||1||1||1||1||(2||4)||1||1||1||1||1||1||1||1||1||1||1||1||1||1||1||1||1||1||1||1||1||1||1||1||1||1||1||1||1||1||1||(2||4),(1+2) || 1 ||1 || 1 ||1||1||1||1||1||1||'1'||1||1||1||1||1||1||1||1||'11'||(3*2)||(5-2)||1||1||1||1||1||1||1||1||1||1||1||1||1||1||1||1||1||1||1||1||1||1||1||1||1||1||1||1||1||1||1||1||1||1||1||1||1||1||1||1||1||1||1||1||1||1||1||1||1||1||1||1||1||1||1||1||1||1||1||1||1||1||1||1||1||1||1||1||1||1||1||1||1||1||1||1||1||1||1||1||1||1||1||1||1||1||1||1||1||1||1||1||1||1||1||1||1||1||1||(2||4)||1||1||1||1||1||1||1||1||1||1||1||1||1||1||1||1||1||1||1||1||1||1||1||1||1||1||1||1||1||1||1||(2||4)||1||1||1||1||1||1||1||1||1||1||1||1||1||1||1||1||1||1||1||1||1||1||1||1||1||1||1||1||1||1||1||(2||4),(1+2) || 1 ||1 || 1 ||1||1||1||1||1||1||'1'||1||1||1||1||1||1||1||1||'11'||(3*2)||(5-2)||1||1||1||1||1||1||1||1||1||1||1||1||1||1||1||1||1||1||1||1||1||1||1||1||1||1||1||1||1||1||1||1||1||1||1||1||1||1||1||1||1||1||1||1||1||1||1||1||1||1||1||1||1||1||1||1||1||1||1||1||1||1||1||1||1||1||1||1||1||1||1||1||1||1||1||1||1||1||1||1||1||1||1||1||1||1||1||1||1||1||1||1||1||1||1||1||1||1||1||(2||4)||1||1||1||1||1||1||1||1||1||1||1||1||1||1||1||1||1||1||1||1||1||1||1||1||1||1||1||1||1||1||1||(2||4)||1||1||1||1||1||1||1||1||1||1||1||1||1||1||1||1||1||1||1||1||1||1||1||1||1||1||1||1||1||1||1||(2||4),(1+2) || 1 ||1 || 1 ||1||1||1||1||1||1||'1'||1||1||1||1||1||1||1||1||'11'||(3*2)||(5-2)||1||1||1||1||1||1||1||1||1||1||1||1||1||1||1||1||1||1||1||1||1||1||1||1||1||1||1||1||1||1||1||1||1||1||1||1||1||1||1||1||1||1||1||1||1||1||1||1||1||1||1||1||1||1||1||1||1||1||1||1||1||1||1||1||1||1||1||1||1||1||1||1||1||1||1||1||1||1||1||1||1||1||1||1||1||1||1||1||1||1||1||1||1||1||1||1||1||1||1||(2||4)||1||1||1||1||1||1||1||1||1||1||1||1||1||1||1||1||1||1||1||1||1||1||1||1||1||1||1||1||1||1||1||(2||4)||1||1||1||1||1||1||1||1||1||1||1||1||1||1||1||1||1||1||1||1||1||1||1||1||1||1||1||1||1||1||1||(2||4),(1+2) || 1 ||1 || 1 ||1||1||1||1||1||1||'1'||1||1||1||1||1||1||1||1||'11'||(3*2)||(5-2)||1||1||1||1||1||1||1||1||1||1||1||1||1||1||1||1||1||1||1||1||1||1||1||1||1||1||1||1||1||1||1||1||1||1||1||1||1||1||1||1||1||1||1||1||1||1||1||1||1||1||1||1||1||1||1||1||1||1||1||1||1||1||1||1||1||1||1||1||1||1||1||1||1||1||1||1||1||1||1||1||1||1||1||1||1||1||1||1||1||1||1||1||1||1||1||1||1||1||1||(2||4)||1||1||1||1||1||1||1||1||1||1||1||1||1||1||1||1||1||1||1||1||1||1||1||1||1||1||1||1||1||1||1||(2||4)||1||1||1||1||1||1||1||1||1||1||1||1||1||1||1||1||1||1||1||1||1||1||1||1||1||1||1||1||1||1||1||(2||4),(1+2) || 1 ||1 || 1 ||1||1||1||1||1||1||'1'||1||1||1||1||1||1||1||1||'11'||(3*2)||(5-2)||1||1||1||1||1||1||1||1||1||1||1||1||1||1||1||1||1||1||1||1||1||1||1||1||1||1||1||1||1||1||1||1||1||1||1||1||1||1||1||1||1||1||1||1||1||1||1||1||1||1||1||1||1||1||1||1||1||1||1||1||1||1||1||1||1||1||1||1||1||1||1||1||1||1||1||1||1||1||1||1||1||1||1||1||1||1||1||1||1||1||1||1||1||1||1||1||1||1||1||(2||4)||1||1||1||1||1||1||1||1||1||1||1||1||1||1||1||1||1||1||1||1||1||1||1||1||1||1||1||1||1||1||1||(2||4)||1||1||1||1||1||1||1||1||1||1||1||1||1||1||1||1||1||1||1||1||1||1||1||1||1||1||1||1||1||1||1||(2||4),(1+2) || 1 ||1 || 1 ||1||1||1||1||1||1||'1'||1||1||1||1||1||1||1||1||'11'||(3*2)||(5-2)||1||1||1||1||1||1||1||1||1||1||1||1||1||1||1||1||1||1||1||1||1||1||1||1||1||1||1||1||1||1||1||1||1||1||1||1||1||1||1||1||1||1||1||1||1||1||1||1||1||1||1||1||1||1||1||1||1||1||1||1||1||1||1||1||1||1||1||1||1||1||1||1||1||1||1||1||1||1||1||1||1||1||1||1||1||1||1||1||1||1||1||1||1||1||1||1||1||1||1||(2||4)||1||1||1||1||1||1||1||1||1||1||1||1||1||1||1||1||1||1||1||1||1||1||1||1||1||1||1||1||1||1||1||(2||4)||1||1||1||1||1||1||1||1||1||1||1||1||1||1||1||1||1||1||1||1||1||1||1||1||1||1||1||1||1||1||1||(2||4),(1+2) || 1 ||1 || 1 ||1||1||1||1||1||1||'1'||1||1||1||1||1||1||1||1||'11'||(3*2)||(5-2)||1||1||1||1||1||1||1||1||1||1||1||1||1||1||1||1||1||1||1||1||1||1||1||1||1||1||1||1||1||1||1||1||1||1||1||1||1||1||1||1||1||1||1||1||1||1||1||1||1||1||1||1||1||1||1||1||1||1||1||1||1||1||1||1||1||1||1||1||1||1||1||1||1||1||1||1||1||1||1||1||1||1||1||1||1||1||1||1||1||1||1||1||1||1||1||1||1||1||1||(2||4)||1||1||1||1||1||1||1||1||1||1||1||1||1||1||1||1||1||1||1||1||1||1||1||1||1||1||1||1||1||1||1||(2||4)||1||1||1||1||1||1||1||1||1||1||1||1||1||1||1||1||1||1||1||1||1||1||1||1||1||1||1||1||1||1||1||(2||4),(1+2) || 1 ||1 || 1 ||1||1||1||1||1||1||'1'||1||1||1||1||1||1||1||1||'11'||(3*2)||(5-2)||1||1||1||1||1||1||1||1||1||1||1||1||1||1||1||1||1||1||1||1||1||1||1||1||1||1||1||1||1||1||1||1||1||1||1||1||1||1||1||1||1||1||1||1||1||1||1||1||1||1||1||1||1||1||1||1||1||1||1||1||1||1||1||1||1||1||1||1||1||1||1||1||1||1||1||1||1||1||1||1||1||1||1||1||1||1||1||1||1||1||1||1||1||1||1||1||1||1||1||(2||4)||1||1||1||1||1||1||1||1||1||1||1||1||1||1||1||1||1||1||1||1||1||1||1||1||1||1||1||1||1||1||1||(2||4)||1||1||1||1||1||1||1||1||1||1||1||1||1||1||1||1||1||1||1||1||1||1||1||1||1||1||1||1||1||1||1||(2||4),(1+2) || 1 ||1 || 1 ||1||1||1||1||1||1||'1'||1||1||1||1||1||1||1||1||'11'||(3*2)||(5-2)||1||1||1||1||1||1||1||1||1||1||1||1||1||1||1||1||1||1||1||1||1||1||1||1||1||1||1||1||1||1||1||1||1||1||1||1||1||1||1||1||1||1||1||1||1||1||1||1||1||1||1||1||1||1||1||1||1||1||1||1||1||1||1||1||1||1||1||1||1||1||1||1||1||1||1||1||1||1||1||1||1||1||1||1||1||1||1||1||1||1||1||1||1||1||1||1||1||1||1||(2||4)||1||1||1||1||1||1||1||1||1||1||1||1||1||1||1||1||1||1||1||1||1||1||1||1||1||1||1||1||1||1||1||(2||4)||1||1||1||1||1||1||1||1||1||1||1||1||1||1||1||1||1||1||1||1||1||1||1||1||1||1||1||1||1||1||1||(2||4),(1+2) || 1 ||1 || 1 ||1||1||1||1||1||1||'1'||1||1||1||1||1||1||1||1||'11'||(3*2)||(5-2)||1||1||1||1||1||1||1||1||1||1||1||1||1||1||1||1||1||1||1||1||1||1||1||1||1||1||1||1||1||1||1||1||1||1||1||1||1||1||1||1||1||1||1||1||1||1||1||1||1||1||1||1||1||1||1||1||1||1||1||1||1||1||1||1||1||1||1||1||1||1||1||1||1||1||1||1||1||1||1||1||1||1||1||1||1||1||1||1||1||1||1||1||1||1||1||1||1||1||1||(2||4)||1||1||1||1||1||1||1||1||1||1||1||1||1||1||1||1||1||1||1||1||1||1||1||1||1||1||1||1||1||1||1||(2||4)||1||1||1||1||1||1||1||1||1||1||1||1||1||1||1||1||1||1||1||1||1||1||1||1||1||1||1||1||1||1||1||(2||4),(1+2) || 1 ||1 || 1 ||1||1||1||1||1||1||'1'||1||1||1||1||1||1||1||1||'11'||(3*2)||(5-2)||1||1||1||1||1||1||1||1||1||1||1||1||1||1||1||1||1||1||1||1||1||1||1||1||1||1||1||1||1||1||1||1||1||1||1||1||1||1||1||1||1||1||1||1||1||1||1||1||1||1||1||1||1||1||1||1||1||1||1||1||1||1||1||1||1||1||1||1||1||1||1||1||1||1||1||1||1||1||1||1||1||1||1||1||1||1||1||1||1||1||1||1||1||1||1||1||1||1||1||(2||4)||1||1||1||1||1||1||1||1||1||1||1||1||1||1||1||1||1||1||1||1||1||1||1||1||1||1||1||1||1||1||1||(2||4)||1||1||1||1||1||1||1||1||1||1||1||1||1||1||1||1||1||1||1||1||1||1||1||1||1||1||1||1||1||1||1||(2||4),(1+2) || 1 ||1 || 1 ||1||1||1||1||1||1||'1'||1||1||1||1||1||1||1||1||'11'||(3*2)||(5-2)||1||1||1||1||1||1||1||1||1||1||1||1||1||1||1||1||1||1||1||1||1||1||1||1||1||1||1||1||1||1||1||1||1||1||1||1||1||1||1||1||1||1||1||1||1||1||1||1||1||1||1||1||1||1||1||1||1||1||1||1||1||1||1||1||1||1||1||1||1||1||1||1||1||1||1||1||1||1||1||1||1||1||1||1||1||1||1||1||1||1||1||1||1||1||1||1||1||1||1||(2||4)||1||1||1||1||1||1||1||1||1||1||1||1||1||1||1||1||1||1||1||1||1||1||1||1||1||1||1||1||1||1||1||(2||4)||1||1||1||1||1||1||1||1||1||1||1||1||1||1||1||1||1||1||1||1||1||1||1||1||1||1||1||1||1||1||1||(2||4));
INSERT ignore INTO cool_bill_card (`mch_no_sft`,`terminal_id`,`batch_no`,`trace_no`,`order_no`,`trade_type`,`trade_time`,`short_account`,`card_type`,`trade_money`,`fee`,`cash_money`,`door_id`,`business_id`,`agent_id`,`created_at`) VALUES(rpad('F',1000,'F'),rpad('F',1000,'F'),rpad('F',1000,'F'),rpad('F',1000,'F'),rpad('F',1000,'F'),rpad('F',1000,'F'),rpad('F',1000,'F'),rpad('F',1000,'F'),rpad('F',1000,'F'),rpad('F',1000,'F'),rpad('F',1000,'F'),rpad('F',1000,'F'),rpad('F',1000,'F'),rpad('F',1000,'F'),rpad('F',1000,'F'),rpad('F',1000,'F')),('0o11','0o11','0o11','0o11','0o11','0o11','0o11','0o11','0o11','0o11','0o11','0o11','0o11','0o11','0o11','0o11'),('0xff','0xff','0xff','0xff','0xff','0xff','0xff','0xff','0xff','0xff','0xff','0xff','0xff','0xff','0xff','0xff');
INSERT ignore INTO cool_bill_card (`mch_no_sft`,`terminal_id`,`batch_no`,`trace_no`,`order_no`,`trade_type`,`trade_time`,`short_account`,`card_type`,`trade_money`,`fee`,`cash_money`,`door_id`,`business_id`,`agent_id`,`created_at`) VALUES('21023456789abcdefABCDEF','21023456789abcdefABCDEF','21023456789abcdefABCDEF','21023456789abcdefABCDEF','21023456789abcdefABCDEF','21023456789abcdefABCDEF','21023456789abcdefABCDEF','21023456789abcdefABCDEF','21023456789abcdefABCDEF','21023456789abcdefABCDEF','21023456789abcdefABCDEF','21023456789abcdefABCDEF','21023456789abcdefABCDEF','21023456789abcdefABCDEF','21023456789abcdefABCDEF','21023456789abcdefABCDEF'),('-9.D','-9.D','-9.D','-9.D','-9.D','-9.D','-9.D','-9.D','-9.D','-9.D','-9.D','-9.D','-9.D','-9.D','-9.D','-9.D'),('.5d','.5d','.5d','.5d','.5d','.5d','.5d','.5d','.5d','.5d','.5d','.5d','.5d','.5d','.5d','.5d'),('1.23254e2 * 1.5769032e1 * 2.434343 * 59.075478965 * 4.44444444f','1.23254e2 * 1.5769032e1 * 2.434343 * 59.075478965 * 4.44444444f','1.23254e2 * 1.5769032e1 * 2.434343 * 59.075478965 * 4.44444444f','1.23254e2 * 1.5769032e1 * 2.434343 * 59.075478965 * 4.44444444f','1.23254e2 * 1.5769032e1 * 2.434343 * 59.075478965 * 4.44444444f','1.23254e2 * 1.5769032e1 * 2.434343 * 59.075478965 * 4.44444444f','1.23254e2 * 1.5769032e1 * 2.434343 * 59.075478965 * 4.44444444f','1.23254e2 * 1.5769032e1 * 2.434343 * 59.075478965 * 4.44444444f','1.23254e2 * 1.5769032e1 * 2.434343 * 59.075478965 * 4.44444444f','1.23254e2 * 1.5769032e1 * 2.434343 * 59.075478965 * 4.44444444f','1.23254e2 * 1.5769032e1 * 2.434343 * 59.075478965 * 4.44444444f','1.23254e2 * 1.5769032e1 * 2.434343 * 59.075478965 * 4.44444444f','1.23254e2 * 1.5769032e1 * 2.434343 * 59.075478965 * 4.44444444f','1.23254e2 * 1.5769032e1 * 2.434343 * 59.075478965 * 4.44444444f','1.23254e2 * 1.5769032e1 * 2.434343 * 59.075478965 * 4.44444444f','1.23254e2 * 1.5769032e1 * 2.434343 * 59.075478965 * 4.44444444f'),('-0','-0','-0','-0','-0','-0','-0','-0','-0','-0','-0','-0','-0','-0','-0','-0'),('-1d','-1d','-1d','-1d','-1d','-1d','-1d','-1d','-1d','-1d','-1d','-1d','-1d','-1d','-1d','-1d'),('+0','+0','+0','+0','+0','+0','+0','+0','+0','+0','+0','+0','+0','+0','+0','+0'),('+1d','+1d','+1d','+1d','+1d','+1d','+1d','+1d','+1d','+1d','+1d','+1d','+1d','+1d','+1d','+1d'),('1.923e-10f','1.923e-10f','1.923e-10f','1.923e-10f','1.923e-10f','1.923e-10f','1.923e-10f','1.923e-10f','1.923e-10f','1.923e-10f','1.923e-10f','1.923e-10f','1.923e-10f','1.923e-10f','1.923e-10f','1.923e-10f'),('1.245454e-30','1.245454e-30','1.245454e-30','1.245454e-30','1.245454e-30','1.245454e-30','1.245454e-30','1.245454e-30','1.245454e-30','1.245454e-30','1.245454e-30','1.245454e-30','1.245454e-30','1.245454e-30','1.245454e-30','1.245454e-30'),('1.245454e-30d','1.245454e-30d','1.245454e-30d','1.245454e-30d','1.245454e-30d','1.245454e-30d','1.245454e-30d','1.245454e-30d','1.245454e-30d','1.245454e-30d','1.245454e-30d','1.245454e-30d','1.245454e-30d','1.245454e-30d','1.245454e-30d','1.245454e-30d');
INSERT ignore INTO cool_bill_card (`mch_no_sft`,`terminal_id`,`batch_no`,`trace_no`,`order_no`,`trade_type`,`trade_time`,`short_account`,`card_type`,`trade_money`,`fee`,`cash_money`,`door_id`,`business_id`,`agent_id`,`created_at`) VALUES(cast(20010101010101 as datetime),cast(20010101010101 as datetime),cast(20010101010101 as datetime),cast(20010101010101 as datetime),cast(20010101010101 as datetime),cast(20010101010101 as datetime),cast(20010101010101 as datetime),cast(20010101010101 as datetime),cast(20010101010101 as datetime),cast(20010101010101 as datetime),cast(20010101010101 as datetime),cast(20010101010101 as datetime),cast(20010101010101 as datetime),cast(20010101010101 as datetime),cast(20010101010101 as datetime),cast(20010101010101 as datetime)),("-.1","-.1","-.1","-.1","-.1","-.1","-.1","-.1","-.1","-.1","-.1","-.1","-.1","-.1","-.1","-.1"),("00000000000001","00000000000001","00000000000001","00000000000001","00000000000001","00000000000001","00000000000001","00000000000001","00000000000001","00000000000001","00000000000001","00000000000001","00000000000001","00000000000001","00000000000001","00000000000001"),(default,default,default,default,default,default,default,default,default,default,default,default,default,default,default,default),(0,0,0,0,0,0,0,0,0,0,0,0,0,0,0,0),(1,1,1,1,1,1,1,1,1,1,1,1,1,1,1,1),('','','','','','','','','','','','','','','',''),(-1,-1,-1,-1,-1,-1,-1,-1,-1,-1,-1,-1,-1,-1,-1,-1);
select mch_no_sft,terminal_id,batch_no,trace_no,order_no,trade_type,trade_time,short_account,card_type,trade_money,fee,cash_money,door_id,business_id,agent_id,created_at from cool_bill_card order by bill_id;
mch_no_sft	terminal_id	batch_no	trace_no	order_no	trade_type	trade_time	short_account	card_type	trade_money	fee	cash_money	door_id	business_id	agent_id	created_at
1	1	1	1	1	1	1	1	1	1.00	1.00	1.00	1	1	1	1
FFFFFFFFFFFFFFF	FFFFFFFF	FFFFFF	FFFFFF	FFFFFFFFFFFFFFFFFFFFFFFFFFFFFFFF	FFFFFFFFFFFFFFFFFFFF	0	FFFFFFFFFFFF	FFFFFFFFFF	0.00	0.00	0.00	0	0	0	0
0o11	0o11	0o11	0o11	0o11	0o11	0	0o11	0o11	0.00	0.00	0.00	0	0	0	0
0xff	0xff	0xff	0xff	0xff	0xff	0	0xff	0xff	0.00	0.00	0.00	0	0	0	0
21023456789abcd	21023456	210234	210234	21023456789abcdefABCDEF	21023456789abcdefABC	2147483647	21023456789a	2102345678	99999999.99	99999999.99	99999999.99	2147483647	2147483647	2147483647	2147483647
-9.D	-9.D	-9.D	-9.D	-9.D	-9.D	-9	-9.D	-9.D	-9.00	-9.00	-9.00	-9	-9	-9	-9
.5d	.5d	.5d	.5d	.5d	.5d	1	.5d	.5d	0.50	0.50	0.50	1	1	1	1
1.23254e2 * 1.5	1.23254e	1.2325	1.2325	1.23254e2 * 1.5769032e1 * 2.4343	1.23254e2 * 1.576903	123	1.23254e2 * 	1.23254e2 	123.25	123.25	123.25	123	123	123	123
-0	-0	-0	-0	-0	-0	0	-0	-0	0.00	0.00	0.00	0	0	0	0
-1d	-1d	-1d	-1d	-1d	-1d	-1	-1d	-1d	-1.00	-1.00	-1.00	-1	-1	-1	-1
+0	+0	+0	+0	+0	+0	0	+0	+0	0.00	0.00	0.00	0	0	0	0
+1d	+1d	+1d	+1d	+1d	+1d	1	+1d	+1d	1.00	1.00	1.00	1	1	1	1
1.923e-10f	1.923e-1	1.923e	1.923e	1.923e-10f	1.923e-10f	0	1.923e-10f	1.923e-10f	0.00	0.00	0.00	0	0	0	0
1.245454e-30	1.245454	1.2454	1.2454	1.245454e-30	1.245454e-30	0	1.245454e-30	1.245454e-	0.00	0.00	0.00	0	0	0	0
1.245454e-30d	1.245454	1.2454	1.2454	1.245454e-30d	1.245454e-30d	0	1.245454e-30	1.245454e-	0.00	0.00	0.00	0	0	0	0
2001-01-01 01:0	2001-01-	2001-0	2001-0	2001-01-01 01:01:01	2001-01-01 01:01:01	2147483647	2001-01-01 0	2001-01-01	99999999.99	99999999.99	99999999.99	2147483647	2147483647	2147483647	2147483647
-.1	-.1	-.1	-.1	-.1	-.1	0	-.1	-.1	-0.10	-0.10	-0.10	0	0	0	0
00000000000001	00000000	000000	000000	00000000000001	00000000000001	1	000000000000	0000000000	1.00	1.00	1.00	1	1	1	1
			0			0			0.00	0.00	0.00	NULL	NULL	NULL	NULL
0	0	0	0	0	0	0	0	0	0.00	0.00	0.00	0	0	0	0
1	1	1	1	1	1	1	1	1	1.00	1.00	1.00	1	1	1	1
						0			0.00	0.00	0.00	0	0	0	0
-1	-1	-1	-1	-1	-1	-1	-1	-1	-1.00	-1.00	-1.00	-1	-1	-1	-1
DROP TABLE IF EXISTS cool_refund_card;
CREATE TABLE `cool_refund_card` (
`refund_card_id` int(11) NOT NULL AUTO_INCREMENT COMMENT '退款ID',
`status` varchar(10) DEFAULT '' COMMENT '退款类型( RFD 退款 ，VID 撤销 )',
`refund_money` decimal(14,2) DEFAULT '0.00' COMMENT '退款金额',
`out_trade_id` varchar(35) DEFAULT NULL COMMENT '西银惠付订单号',
`mch_no_sft` varchar(15) DEFAULT '' COMMENT '盛付通商户号',
`terminal_id` varchar(8) DEFAULT '' COMMENT '终端号',
`trace_no` varchar(6) DEFAULT '' COMMENT '终端流水号(凭证号)',
`order_id_sft` varchar(12) DEFAULT '' COMMENT '盛付通订单号',
`regtime` int(10) DEFAULT '0' COMMENT '退款时间',
`trade_ref` varchar(20) DEFAULT '' COMMENT '交易参考号',
`trade_result` varchar(2) DEFAULT '0' COMMENT '交易应答码,00交易成功;其他失败',
`orig_trade_ref` varchar(50) DEFAULT '' COMMENT '原交易参考号',
PRIMARY KEY (`refund_card_id`)
) AUTO_INCREMENT = 8000034 DEFAULT CHARSET = utf8mb4 ROW_FORMAT = DYNAMIC;
盛付通相关
INSERT ignore INTO cool_refund_card (`status`,`refund_money`,`out_trade_id`,`mch_no_sft`,`terminal_id`,`trace_no`,`order_id_sft`,`regtime`,`trade_ref`,`trade_result`,`orig_trade_ref`) VALUES ('eeeeeeee','eeeeeeee','eeeeeeee','eeeeeeee','eeeeeeee','eeeeeeee','eeeeeeee','eeeeeeee','eeeeeeee','eeeeeeee','eeeeeeee'),(18446744073709551617.1,18446744073709551617.1,18446744073709551617.1,18446744073709551617.1,18446744073709551617.1,18446744073709551617.1,18446744073709551617.1,18446744073709551617.1,18446744073709551617.1,18446744073709551617.1,18446744073709551617.1),('1x','1x','1x','1x','1x','1x','1x','1x','1x','1x','1x'),(str_to_date('20191022','%Y%m%d'),str_to_date('20191022','%Y%m%d'),str_to_date('20191022','%Y%m%d'),str_to_date('20191022','%Y%m%d'),str_to_date('20191022','%Y%m%d'),str_to_date('20191022','%Y%m%d'),str_to_date('20191022','%Y%m%d'),str_to_date('20191022','%Y%m%d'),str_to_date('20191022','%Y%m%d'),str_to_date('20191022','%Y%m%d'),str_to_date('20191022','%Y%m%d')),('1970-01-02 00:01:40.0','1970-01-02 00:01:40.0','1970-01-02 00:01:40.0','1970-01-02 00:01:40.0','1970-01-02 00:01:40.0','1970-01-02 00:01:40.0','1970-01-02 00:01:40.0','1970-01-02 00:01:40.0','1970-01-02 00:01:40.0','1970-01-02 00:01:40.0','1970-01-02 00:01:40.0'),(cast(3 as unsigned),cast(3 as unsigned),cast(3 as unsigned),cast(3 as unsigned),cast(3 as unsigned),cast(3 as unsigned),cast(3 as unsigned),cast(3 as unsigned),cast(3 as unsigned),cast(3 as unsigned),cast(3 as unsigned)),(-1,-1,-1,-1,-1,-1,-1,-1,-1,-1,-1),('a','a','a','a','a','a','a','a','a','a','a'),('A','A','A','A','A','A','A','A','A','A','A'),("0.0","0.0","0.0","0.0","0.0","0.0","0.0","0.0","0.0","0.0","0.0"),(default,default,default,default,default,default,default,default,default,default,default),("+111111111.11","+111111111.11","+111111111.11","+111111111.11","+111111111.11","+111111111.11","+111111111.11","+111111111.11","+111111111.11","+111111111.11","+111111111.11"),('xxxxxxlsl@kkdis.com','xxxxxxlsl@kkdis.com','xxxxxxlsl@kkdis.com','xxxxxxlsl@kkdis.com','xxxxxxlsl@kkdis.com','xxxxxxlsl@kkdis.com','xxxxxxlsl@kkdis.com','xxxxxxlsl@kkdis.com','xxxxxxlsl@kkdis.com','xxxxxxlsl@kkdis.com','xxxxxxlsl@kkdis.com'),('a,','a,','a,','a,','a,','a,','a,','a,','a,','a,','a,'),(rpad('Ff',800,'fF'),rpad('Ff',800,'fF'),rpad('Ff',800,'fF'),rpad('Ff',800,'fF'),rpad('Ff',800,'fF'),rpad('Ff',800,'fF'),rpad('Ff',800,'fF'),rpad('Ff',800,'fF'),rpad('Ff',800,'fF'),rpad('Ff',800,'fF'),rpad('Ff',800,'fF')),(rpad('1234567890abcdef',800,'1234567890abcdef'),rpad('1234567890abcdef',800,'1234567890abcdef'),rpad('1234567890abcdef',800,'1234567890abcdef'),rpad('1234567890abcdef',800,'1234567890abcdef'),rpad('1234567890abcdef',800,'1234567890abcdef'),rpad('1234567890abcdef',800,'1234567890abcdef'),rpad('1234567890abcdef',800,'1234567890abcdef'),rpad('1234567890abcdef',800,'1234567890abcdef'),rpad('1234567890abcdef',800,'1234567890abcdef'),rpad('1234567890abcdef',800,'1234567890abcdef'),rpad('1234567890abcdef',800,'1234567890abcdef'));
INSERT ignore INTO cool_refund_card (`status`,`refund_money`,`out_trade_id`,`mch_no_sft`,`terminal_id`,`trace_no`,`order_id_sft`,`regtime`,`trade_ref`,`trade_result`,`orig_trade_ref`) VALUES ((1+2) || 1 ||1 || 1 ||1||1||1||1||1||1||'1'||1||1||1||1||1||1||1||1||'11'||(3*2)||(5-2)||1||1||1||1||1||1||1||1||1||1||1||1||1||1||1||1||1||1||1||1||1||1||1||1||1||1||1||1||1||1||1||1||1||1||1||1||1||1||1||1||1||1||1||1||1||1||1||1||1||1||1||1||1||1||1||1||1||1||1||1||1||1||1||1||1||1||1||1||1||1||1||1||1||1||1||1||1||1||1||1||1||1||1||1||1||1||1||1||1||1||1||1||1||1||1||1||1||1||1||(2||4)||1||1||1||1||1||1||1||1||1||1||1||1||1||1||1||1||1||1||1||1||1||1||1||1||1||1||1||1||1||1||1||(2||4)||1||1||1||1||1||1||1||1||1||1||1||1||1||1||1||1||1||1||1||1||1||1||1||1||1||1||1||1||1||1||1||(2||4),(1+2) || 1 ||1 || 1 ||1||1||1||1||1||1||'1'||1||1||1||1||1||1||1||1||'11'||(3*2)||(5-2)||1||1||1||1||1||1||1||1||1||1||1||1||1||1||1||1||1||1||1||1||1||1||1||1||1||1||1||1||1||1||1||1||1||1||1||1||1||1||1||1||1||1||1||1||1||1||1||1||1||1||1||1||1||1||1||1||1||1||1||1||1||1||1||1||1||1||1||1||1||1||1||1||1||1||1||1||1||1||1||1||1||1||1||1||1||1||1||1||1||1||1||1||1||1||1||1||1||1||1||(2||4)||1||1||1||1||1||1||1||1||1||1||1||1||1||1||1||1||1||1||1||1||1||1||1||1||1||1||1||1||1||1||1||(2||4)||1||1||1||1||1||1||1||1||1||1||1||1||1||1||1||1||1||1||1||1||1||1||1||1||1||1||1||1||1||1||1||(2||4),(1+2) || 1 ||1 || 1 ||1||1||1||1||1||1||'1'||1||1||1||1||1||1||1||1||'11'||(3*2)||(5-2)||1||1||1||1||1||1||1||1||1||1||1||1||1||1||1||1||1||1||1||1||1||1||1||1||1||1||1||1||1||1||1||1||1||1||1||1||1||1||1||1||1||1||1||1||1||1||1||1||1||1||1||1||1||1||1||1||1||1||1||1||1||1||1||1||1||1||1||1||1||1||1||1||1||1||1||1||1||1||1||1||1||1||1||1||1||1||1||1||1||1||1||1||1||1||1||1||1||1||1||(2||4)||1||1||1||1||1||1||1||1||1||1||1||1||1||1||1||1||1||1||1||1||1||1||1||1||1||1||1||1||1||1||1||(2||4)||1||1||1||1||1||1||1||1||1||1||1||1||1||1||1||1||1||1||1||1||1||1||1||1||1||1||1||1||1||1||1||(2||4),(1+2) || 1 ||1 || 1 ||1||1||1||1||1||1||'1'||1||1||1||1||1||1||1||1||'11'||(3*2)||(5-2)||1||1||1||1||1||1||1||1||1||1||1||1||1||1||1||1||1||1||1||1||1||1||1||1||1||1||1||1||1||1||1||1||1||1||1||1||1||1||1||1||1||1||1||1||1||1||1||1||1||1||1||1||1||1||1||1||1||1||1||1||1||1||1||1||1||1||1||1||1||1||1||1||1||1||1||1||1||1||1||1||1||1||1||1||1||1||1||1||1||1||1||1||1||1||1||1||1||1||1||(2||4)||1||1||1||1||1||1||1||1||1||1||1||1||1||1||1||1||1||1||1||1||1||1||1||1||1||1||1||1||1||1||1||(2||4)||1||1||1||1||1||1||1||1||1||1||1||1||1||1||1||1||1||1||1||1||1||1||1||1||1||1||1||1||1||1||1||(2||4),(1+2) || 1 ||1 || 1 ||1||1||1||1||1||1||'1'||1||1||1||1||1||1||1||1||'11'||(3*2)||(5-2)||1||1||1||1||1||1||1||1||1||1||1||1||1||1||1||1||1||1||1||1||1||1||1||1||1||1||1||1||1||1||1||1||1||1||1||1||1||1||1||1||1||1||1||1||1||1||1||1||1||1||1||1||1||1||1||1||1||1||1||1||1||1||1||1||1||1||1||1||1||1||1||1||1||1||1||1||1||1||1||1||1||1||1||1||1||1||1||1||1||1||1||1||1||1||1||1||1||1||1||(2||4)||1||1||1||1||1||1||1||1||1||1||1||1||1||1||1||1||1||1||1||1||1||1||1||1||1||1||1||1||1||1||1||(2||4)||1||1||1||1||1||1||1||1||1||1||1||1||1||1||1||1||1||1||1||1||1||1||1||1||1||1||1||1||1||1||1||(2||4),(1+2) || 1 ||1 || 1 ||1||1||1||1||1||1||'1'||1||1||1||1||1||1||1||1||'11'||(3*2)||(5-2)||1||1||1||1||1||1||1||1||1||1||1||1||1||1||1||1||1||1||1||1||1||1||1||1||1||1||1||1||1||1||1||1||1||1||1||1||1||1||1||1||1||1||1||1||1||1||1||1||1||1||1||1||1||1||1||1||1||1||1||1||1||1||1||1||1||1||1||1||1||1||1||1||1||1||1||1||1||1||1||1||1||1||1||1||1||1||1||1||1||1||1||1||1||1||1||1||1||1||1||(2||4)||1||1||1||1||1||1||1||1||1||1||1||1||1||1||1||1||1||1||1||1||1||1||1||1||1||1||1||1||1||1||1||(2||4)||1||1||1||1||1||1||1||1||1||1||1||1||1||1||1||1||1||1||1||1||1||1||1||1||1||1||1||1||1||1||1||(2||4),(1+2) || 1 ||1 || 1 ||1||1||1||1||1||1||'1'||1||1||1||1||1||1||1||1||'11'||(3*2)||(5-2)||1||1||1||1||1||1||1||1||1||1||1||1||1||1||1||1||1||1||1||1||1||1||1||1||1||1||1||1||1||1||1||1||1||1||1||1||1||1||1||1||1||1||1||1||1||1||1||1||1||1||1||1||1||1||1||1||1||1||1||1||1||1||1||1||1||1||1||1||1||1||1||1||1||1||1||1||1||1||1||1||1||1||1||1||1||1||1||1||1||1||1||1||1||1||1||1||1||1||1||(2||4)||1||1||1||1||1||1||1||1||1||1||1||1||1||1||1||1||1||1||1||1||1||1||1||1||1||1||1||1||1||1||1||(2||4)||1||1||1||1||1||1||1||1||1||1||1||1||1||1||1||1||1||1||1||1||1||1||1||1||1||1||1||1||1||1||1||(2||4),(1+2) || 1 ||1 || 1 ||1||1||1||1||1||1||'1'||1||1||1||1||1||1||1||1||'11'||(3*2)||(5-2)||1||1||1||1||1||1||1||1||1||1||1||1||1||1||1||1||1||1||1||1||1||1||1||1||1||1||1||1||1||1||1||1||1||1||1||1||1||1||1||1||1||1||1||1||1||1||1||1||1||1||1||1||1||1||1||1||1||1||1||1||1||1||1||1||1||1||1||1||1||1||1||1||1||1||1||1||1||1||1||1||1||1||1||1||1||1||1||1||1||1||1||1||1||1||1||1||1||1||1||(2||4)||1||1||1||1||1||1||1||1||1||1||1||1||1||1||1||1||1||1||1||1||1||1||1||1||1||1||1||1||1||1||1||(2||4)||1||1||1||1||1||1||1||1||1||1||1||1||1||1||1||1||1||1||1||1||1||1||1||1||1||1||1||1||1||1||1||(2||4),(1+2) || 1 ||1 || 1 ||1||1||1||1||1||1||'1'||1||1||1||1||1||1||1||1||'11'||(3*2)||(5-2)||1||1||1||1||1||1||1||1||1||1||1||1||1||1||1||1||1||1||1||1||1||1||1||1||1||1||1||1||1||1||1||1||1||1||1||1||1||1||1||1||1||1||1||1||1||1||1||1||1||1||1||1||1||1||1||1||1||1||1||1||1||1||1||1||1||1||1||1||1||1||1||1||1||1||1||1||1||1||1||1||1||1||1||1||1||1||1||1||1||1||1||1||1||1||1||1||1||1||1||(2||4)||1||1||1||1||1||1||1||1||1||1||1||1||1||1||1||1||1||1||1||1||1||1||1||1||1||1||1||1||1||1||1||(2||4)||1||1||1||1||1||1||1||1||1||1||1||1||1||1||1||1||1||1||1||1||1||1||1||1||1||1||1||1||1||1||1||(2||4),(1+2) || 1 ||1 || 1 ||1||1||1||1||1||1||'1'||1||1||1||1||1||1||1||1||'11'||(3*2)||(5-2)||1||1||1||1||1||1||1||1||1||1||1||1||1||1||1||1||1||1||1||1||1||1||1||1||1||1||1||1||1||1||1||1||1||1||1||1||1||1||1||1||1||1||1||1||1||1||1||1||1||1||1||1||1||1||1||1||1||1||1||1||1||1||1||1||1||1||1||1||1||1||1||1||1||1||1||1||1||1||1||1||1||1||1||1||1||1||1||1||1||1||1||1||1||1||1||1||1||1||1||(2||4)||1||1||1||1||1||1||1||1||1||1||1||1||1||1||1||1||1||1||1||1||1||1||1||1||1||1||1||1||1||1||1||(2||4)||1||1||1||1||1||1||1||1||1||1||1||1||1||1||1||1||1||1||1||1||1||1||1||1||1||1||1||1||1||1||1||(2||4),(1+2) || 1 ||1 || 1 ||1||1||1||1||1||1||'1'||1||1||1||1||1||1||1||1||'11'||(3*2)||(5-2)||1||1||1||1||1||1||1||1||1||1||1||1||1||1||1||1||1||1||1||1||1||1||1||1||1||1||1||1||1||1||1||1||1||1||1||1||1||1||1||1||1||1||1||1||1||1||1||1||1||1||1||1||1||1||1||1||1||1||1||1||1||1||1||1||1||1||1||1||1||1||1||1||1||1||1||1||1||1||1||1||1||1||1||1||1||1||1||1||1||1||1||1||1||1||1||1||1||1||1||(2||4)||1||1||1||1||1||1||1||1||1||1||1||1||1||1||1||1||1||1||1||1||1||1||1||1||1||1||1||1||1||1||1||(2||4)||1||1||1||1||1||1||1||1||1||1||1||1||1||1||1||1||1||1||1||1||1||1||1||1||1||1||1||1||1||1||1||(2||4));
INSERT ignore INTO cool_refund_card (`status`,`refund_money`,`out_trade_id`,`mch_no_sft`,`terminal_id`,`trace_no`,`order_id_sft`,`regtime`,`trade_ref`,`trade_result`,`orig_trade_ref`) VALUES (rpad('F',1000,'F'),rpad('F',1000,'F'),rpad('F',1000,'F'),rpad('F',1000,'F'),rpad('F',1000,'F'),rpad('F',1000,'F'),rpad('F',1000,'F'),rpad('F',1000,'F'),rpad('F',1000,'F'),rpad('F',1000,'F'),rpad('F',1000,'F')),('0o11','0o11','0o11','0o11','0o11','0o11','0o11','0o11','0o11','0o11','0o11'),('21023456789abcdefABCDEF','21023456789abcdefABCDEF','21023456789abcdefABCDEF','21023456789abcdefABCDEF','21023456789abcdefABCDEF','21023456789abcdefABCDEF','21023456789abcdefABCDEF','21023456789abcdefABCDEF','21023456789abcdefABCDEF','21023456789abcdefABCDEF','21023456789abcdefABCDEF'),('-9.D','-9.D','-9.D','-9.D','-9.D','-9.D','-9.D','-9.D','-9.D','-9.D','-9.D'),('.5d','.5d','.5d','.5d','.5d','.5d','.5d','.5d','.5d','.5d','.5d'),('1.23254e2 * 1.5769032e1 * 2.434343 * 59.075478965 * 4.44444444f','1.23254e2 * 1.5769032e1 * 2.434343 * 59.075478965 * 4.44444444f','1.23254e2 * 1.5769032e1 * 2.434343 * 59.075478965 * 4.44444444f','1.23254e2 * 1.5769032e1 * 2.434343 * 59.075478965 * 4.44444444f','1.23254e2 * 1.5769032e1 * 2.434343 * 59.075478965 * 4.44444444f','1.23254e2 * 1.5769032e1 * 2.434343 * 59.075478965 * 4.44444444f','1.23254e2 * 1.5769032e1 * 2.434343 * 59.075478965 * 4.44444444f','1.23254e2 * 1.5769032e1 * 2.434343 * 59.075478965 * 4.44444444f','1.23254e2 * 1.5769032e1 * 2.434343 * 59.075478965 * 4.44444444f','1.23254e2 * 1.5769032e1 * 2.434343 * 59.075478965 * 4.44444444f','1.23254e2 * 1.5769032e1 * 2.434343 * 59.075478965 * 4.44444444f'),('-0','-0','-0','-0','-0','-0','-0','-0','-0','-0','-0'),('-1d','-1d','-1d','-1d','-1d','-1d','-1d','-1d','-1d','-1d','-1d'),('+0','+0','+0','+0','+0','+0','+0','+0','+0','+0','+0'),('+1d','+1d','+1d','+1d','+1d','+1d','+1d','+1d','+1d','+1d','+1d'),('1.923e-10f','1.923e-10f','1.923e-10f','1.923e-10f','1.923e-10f','1.923e-10f','1.923e-10f','1.923e-10f','1.923e-10f','1.923e-10f','1.923e-10f'),('1.245454e-30','1.245454e-30','1.245454e-30','1.245454e-30','1.245454e-30','1.245454e-30','1.245454e-30','1.245454e-30','1.245454e-30','1.245454e-30','1.245454e-30'),('1.245454e-30d','1.245454e-30d','1.245454e-30d','1.245454e-30d','1.245454e-30d','1.245454e-30d','1.245454e-30d','1.245454e-30d','1.245454e-30d','1.245454e-30d','1.245454e-30d'),(cast(20010101010101 as datetime),cast(20010101010101 as datetime),cast(20010101010101 as datetime),cast(20010101010101 as datetime),cast(20010101010101 as datetime),cast(20010101010101 as datetime),cast(20010101010101 as datetime),cast(20010101010101 as datetime),cast(20010101010101 as datetime),cast(20010101010101 as datetime),cast(20010101010101 as datetime)),("-.1","-.1","-.1","-.1","-.1","-.1","-.1","-.1","-.1","-.1","-.1"),("00000000000001","00000000000001","00000000000001","00000000000001","00000000000001","00000000000001","00000000000001","00000000000001","00000000000001","00000000000001","00000000000001"),(default,default,default,default,default,default,default,default,default,default,default),(0,0,0,0,0,0,0,0,0,0,0),(1,1,1,1,1,1,1,1,1,1,1),('','','','','','','','','','',''),(-1,-1,-1,-1,-1,-1,-1,-1,-1,-1,-1);
select status,refund_money,out_trade_id,mch_no_sft,terminal_id,trace_no,order_id_sft,regtime,trade_ref,trade_result,orig_trade_ref from cool_refund_card order by refund_card_id;
status	refund_money	out_trade_id	mch_no_sft	terminal_id	trace_no	order_id_sft	regtime	trade_ref	trade_result	orig_trade_ref
eeeeeeee	0.00	eeeeeeee	eeeeeeee	eeeeeeee	eeeeee	eeeeeeee	0	eeeeeeee	ee	eeeeeeee
1844674407	999999999999.99	18446744073709551617.1	184467440737095	18446744	184467	184467440737	2147483647	18446744073709551617	18	18446744073709551617.1
1x	1.00	1x	1x	1x	1x	1x	1	1x	1x	1x
2019-10-22	20191022.00	2019-10-22	2019-10-22	2019-10-	2019-1	2019-10-22	20191022	2019-10-22	20	2019-10-22
1970-01-02	1970.00	1970-01-02 00:01:40.0	1970-01-02 00:0	1970-01-	1970-0	1970-01-02 0	1970	1970-01-02 00:01:40.	19	1970-01-02 00:01:40.0
3	3.00	3	3	3	3	3	3	3	3	3
-1	-1.00	-1	-1	-1	-1	-1	-1	-1	-1	-1
a	0.00	a	a	a	a	a	0	a	a	a
A	0.00	A	A	A	A	A	0	A	A	A
0.0	0.00	0.0	0.0	0.0	0.0	0.0	0	0.0	0.	0.0
	0.00	NULL					0		0	
+111111111	111111111.11	+111111111.11	+111111111.11	+1111111	+11111	+111111111.1	111111111	+111111111.11	+1	+111111111.11
xxxxxxlsl@	0.00	xxxxxxlsl@kkdis.com	xxxxxxlsl@kkdis	xxxxxxls	xxxxxx	xxxxxxlsl@kk	0	xxxxxxlsl@kkdis.com	xx	xxxxxxlsl@kkdis.com
a,	0.00	a,	a,	a,	a,	a,	0	a,	a,	a,
FffFfFfFfF	0.00	FffFfFfFfFfFfFfFfFfFfFfFfFfFfFfFfFf	FffFfFfFfFfFfFf	FffFfFfF	FffFfF	FffFfFfFfFfF	0	FffFfFfFfFfFfFfFfFfF	Ff	FffFfFfFfFfFfFfFfFfFfFfFfFfFfFfFfFfFfFfFfFfFfFfFfF
1234567890	1234567890.00	1234567890abcdef1234567890abcdef123	1234567890abcde	12345678	123456	1234567890ab	1234567890	1234567890abcdef1234	12	1234567890abcdef1234567890abcdef1234567890abcdef12
1	1.00	1	1	1	1	1	1	1	1	1
FFFFFFFFFF	0.00	FFFFFFFFFFFFFFFFFFFFFFFFFFFFFFFFFFF	FFFFFFFFFFFFFFF	FFFFFFFF	FFFFFF	FFFFFFFFFFFF	0	FFFFFFFFFFFFFFFFFFFF	FF	FFFFFFFFFFFFFFFFFFFFFFFFFFFFFFFFFFFFFFFFFFFFFFFFFF
0o11	0.00	0o11	0o11	0o11	0o11	0o11	0	0o11	0o	0o11
2102345678	21023456789.00	21023456789abcdefABCDEF	21023456789abcd	21023456	210234	21023456789a	2147483647	21023456789abcdefABC	21	21023456789abcdefABCDEF
-9.D	-9.00	-9.D	-9.D	-9.D	-9.D	-9.D	-9	-9.D	-9	-9.D
.5d	0.50	.5d	.5d	.5d	.5d	.5d	1	.5d	.5	.5d
1.23254e2 	123.25	1.23254e2 * 1.5769032e1 * 2.434343 	1.23254e2 * 1.5	1.23254e	1.2325	1.23254e2 * 	123	1.23254e2 * 1.576903	1.	1.23254e2 * 1.5769032e1 * 2.434343 * 59.075478965 
-0	0.00	-0	-0	-0	-0	-0	0	-0	-0	-0
-1d	-1.00	-1d	-1d	-1d	-1d	-1d	-1	-1d	-1	-1d
+0	0.00	+0	+0	+0	+0	+0	0	+0	+0	+0
+1d	1.00	+1d	+1d	+1d	+1d	+1d	1	+1d	+1	+1d
1.923e-10f	0.00	1.923e-10f	1.923e-10f	1.923e-1	1.923e	1.923e-10f	0	1.923e-10f	1.	1.923e-10f
1.245454e-	0.00	1.245454e-30	1.245454e-30	1.245454	1.2454	1.245454e-30	0	1.245454e-30	1.	1.245454e-30
1.245454e-	0.00	1.245454e-30d	1.245454e-30d	1.245454	1.2454	1.245454e-30	0	1.245454e-30d	1.	1.245454e-30d
2001-01-01	999999999999.99	2001-01-01 01:01:01	2001-01-01 01:0	2001-01-	2001-0	2001-01-01 0	2147483647	2001-01-01 01:01:01	20	2001-01-01 01:01:01
-.1	-0.10	-.1	-.1	-.1	-.1	-.1	0	-.1	-.	-.1
0000000000	1.00	00000000000001	00000000000001	00000000	000000	000000000000	1	00000000000001	00	00000000000001
	0.00	NULL					0		0	
0	0.00	0	0	0	0	0	0	0	0	0
1	1.00	1	1	1	1	1	1	1	1	1
	0.00						0			
-1	-1.00	-1	-1	-1	-1	-1	-1	-1	-1	-1
drop database cwx;
drop user cwx;
drop database if exists cwx;
