drop user cwx;
drop database if exists cwx;
create database cwx;
use cwx;
create user 'cwx'@'%' identified by 'cwx';
grant all privileges on *.* to 'cwx'@'%';
# 由于后续存在非strict模式下not null的列插入null会打印warnings，warnings是在resolver阶段打印的，所以走plan_cache时就不会打印出来，所以case不稳定，此处关闭plan_cache
set ob_enable_plan_cache = 0;
各类null值插入（严格模式）
set sql_mode='STRICT_ALL_TABLES';
select @@sql_mode;
@@sql_mode
STRICT_ALL_TABLES
DROP TABLE IF EXISTS cool_deal;
CREATE TABLE `cool_deal` (
`deal_id` int(11) NOT NULL AUTO_INCREMENT COMMENT '交易流水ID',
`agent_id` varchar(11) DEFAULT NULL,
`business_id` varchar(11) DEFAULT NULL,
`door_id` varchar(11) DEFAULT NULL,
`out_trade_id` varchar(40) DEFAULT NULL,
`status` int(1) NOT NULL DEFAULT '0' COMMENT '状态（1,已支付，2，未支付，3已退款，4部分退款,5订单撤销，支付宝和微信主动退款）',
`regtime` varchar(11) DEFAULT NULL,
`remark_one_value` varchar(255) DEFAULT NULL COMMENT '备注一',
`from_business_trade_id` varchar(128) DEFAULT NULL,
`is_read` int(1) NOT NULL DEFAULT '0',
`app_id` varchar(200) DEFAULT NULL,
`open_id` varchar(255) DEFAULT '0' COMMENT '支付人微信OPENID',
`order_type` int(11) DEFAULT NULL,
`order_regtime` int(11) DEFAULT NULL,
`discount_amt` decimal(10,2) DEFAULT NULL,
`offer_type` varchar(20) DEFAULT NULL,
`device_id` int(11) DEFAULT NULL COMMENT '扫码设备编号,设备表bind_flag_no',
`attach` varchar(255) DEFAULT NULL COMMENT '附加数据',
`bank_type` varchar(30) DEFAULT NULL COMMENT '付款银行',
`pay_log_id` varchar(40) DEFAULT NULL COMMENT '西银在线流水号',
`activity_type` varchar(30) DEFAULT NULL COMMENT '三方平台活动类型',
`user_id` varchar(11) DEFAULT NULL COMMENT '用户标识',
`trade_body` varchar(255) DEFAULT NULL COMMENT '商品信息',
PRIMARY KEY (`deal_id`),
UNIQUE KEY `out_trade_id` (`out_trade_id`),
KEY `business_id` (`business_id`),
KEY `door_id` (`door_id`),
KEY `regtime_bdoor_idx` (`regtime`, `business_id`, `door_id`),
KEY `regtime_idx` (`regtime`),
KEY `pay_log_id` (`pay_log_id`),
KEY `origin_trade_no` (`from_business_trade_id`),
KEY `b_d_u_r_idx` (`business_id`, `door_id`, `user_id`, `regtime`),
KEY `b_o_o_idx` (`business_id`, `order_regtime`, `order_type`)
) AUTO_INCREMENT = 8178461 DEFAULT CHARSET = utf8mb4 ROW_FORMAT = DYNAMIC;
insert into cool_deal(deal_id) values('');
ERROR HY000: Incorrect integer value for column 'deal_id' at row 1
insert into cool_deal(deal_id) values(null);
insert into cool_deal(deal_id) values(null),(NULL);
select * from cool_deal order by deal_id;
deal_id	agent_id	business_id	door_id	out_trade_id	status	regtime	remark_one_value	from_business_trade_id	is_read	app_id	open_id	order_type	order_regtime	discount_amt	offer_type	device_id	attach	bank_type	pay_log_id	activity_type	user_id	trade_body
8178461	NULL	NULL	NULL	NULL	0	NULL	NULL	NULL	0	NULL	0	NULL	NULL	NULL	NULL	NULL	NULL	NULL	NULL	NULL	NULL	NULL
8178462	NULL	NULL	NULL	NULL	0	NULL	NULL	NULL	0	NULL	0	NULL	NULL	NULL	NULL	NULL	NULL	NULL	NULL	NULL	NULL	NULL
8178463	NULL	NULL	NULL	NULL	0	NULL	NULL	NULL	0	NULL	0	NULL	NULL	NULL	NULL	NULL	NULL	NULL	NULL	NULL	NULL	NULL
insert ignore into cool_deal(deal_id) values(''),(null),(NULL),('\t'),('\n'),(''),('');
select * from cool_deal order by deal_id;
deal_id	agent_id	business_id	door_id	out_trade_id	status	regtime	remark_one_value	from_business_trade_id	is_read	app_id	open_id	order_type	order_regtime	discount_amt	offer_type	device_id	attach	bank_type	pay_log_id	activity_type	user_id	trade_body
8178461	NULL	NULL	NULL	NULL	0	NULL	NULL	NULL	0	NULL	0	NULL	NULL	NULL	NULL	NULL	NULL	NULL	NULL	NULL	NULL	NULL
8178462	NULL	NULL	NULL	NULL	0	NULL	NULL	NULL	0	NULL	0	NULL	NULL	NULL	NULL	NULL	NULL	NULL	NULL	NULL	NULL	NULL
8178463	NULL	NULL	NULL	NULL	0	NULL	NULL	NULL	0	NULL	0	NULL	NULL	NULL	NULL	NULL	NULL	NULL	NULL	NULL	NULL	NULL
8178464	NULL	NULL	NULL	NULL	0	NULL	NULL	NULL	0	NULL	0	NULL	NULL	NULL	NULL	NULL	NULL	NULL	NULL	NULL	NULL	NULL
8178465	NULL	NULL	NULL	NULL	0	NULL	NULL	NULL	0	NULL	0	NULL	NULL	NULL	NULL	NULL	NULL	NULL	NULL	NULL	NULL	NULL
8178466	NULL	NULL	NULL	NULL	0	NULL	NULL	NULL	0	NULL	0	NULL	NULL	NULL	NULL	NULL	NULL	NULL	NULL	NULL	NULL	NULL
8178467	NULL	NULL	NULL	NULL	0	NULL	NULL	NULL	0	NULL	0	NULL	NULL	NULL	NULL	NULL	NULL	NULL	NULL	NULL	NULL	NULL
8178468	NULL	NULL	NULL	NULL	0	NULL	NULL	NULL	0	NULL	0	NULL	NULL	NULL	NULL	NULL	NULL	NULL	NULL	NULL	NULL	NULL
8178469	NULL	NULL	NULL	NULL	0	NULL	NULL	NULL	0	NULL	0	NULL	NULL	NULL	NULL	NULL	NULL	NULL	NULL	NULL	NULL	NULL
8178470	NULL	NULL	NULL	NULL	0	NULL	NULL	NULL	0	NULL	0	NULL	NULL	NULL	NULL	NULL	NULL	NULL	NULL	NULL	NULL	NULL
delete from cool_deal;
各类null值插入（非严格模式）
set sql_mode='';
select @@sql_mode;
@@sql_mode

DROP TABLE IF EXISTS cool_deal;
CREATE TABLE `cool_deal` (
`deal_id` int(11) NOT NULL AUTO_INCREMENT COMMENT '交易流水ID',
`business_id` varchar(11) DEFAULT NULL,
`out_trade_id` varchar(40) DEFAULT NULL,
`status` int(1) NOT NULL DEFAULT '0' COMMENT '状态（1,已支付，2，未支付，3已退款，4部分退款,5订单撤销，支付宝和微信主动退款）',
`regtime` varchar(11) DEFAULT NULL,
PRIMARY KEY (`deal_id`),
UNIQUE KEY `out_trade_id` (`out_trade_id`),
KEY `business_id` (`business_id`)
) AUTO_INCREMENT = 8178461 DEFAULT CHARSET = utf8mb4 ROW_FORMAT = DYNAMIC;
insert into cool_deal(deal_id) values(null);
insert into cool_deal(deal_id) values(null),(NULL);
select * from cool_deal order by deal_id;
deal_id	business_id	out_trade_id	status	regtime
8178461	NULL	NULL	0	NULL
8178462	NULL	NULL	0	NULL
8178463	NULL	NULL	0	NULL
delete from cool_deal;
insert ignore into cool_deal(deal_id) values(''),(null),(NULL),('\t'),('\n'),(''),('');
select * from cool_deal order by deal_id;
deal_id	business_id	out_trade_id	status	regtime
8178464	NULL	NULL	0	NULL
8178465	NULL	NULL	0	NULL
8178466	NULL	NULL	0	NULL
8178467	NULL	NULL	0	NULL
8178468	NULL	NULL	0	NULL
8178469	NULL	NULL	0	NULL
8178470	NULL	NULL	0	NULL
边界值测试（严格模式） -2147483648，2147483647
set sql_mode='STRICT_ALL_TABLES';
select @@sql_mode;
@@sql_mode
STRICT_ALL_TABLES
DROP TABLE IF EXISTS cool_deal;
CREATE TABLE `cool_deal` (
`deal_id` int(11) NOT NULL AUTO_INCREMENT COMMENT '交易流水ID',
`business_id` varchar(11) DEFAULT NULL,
`out_trade_id` varchar(40) DEFAULT NULL,
`status` int(1) NOT NULL DEFAULT '0' COMMENT '状态（1,已支付，2，未支付，3已退款，4部分退款,5订单撤销，支付宝和微信主动退款）',
`regtime` varchar(11) DEFAULT NULL,
PRIMARY KEY (`deal_id`),
UNIQUE KEY `out_trade_id` (`out_trade_id`),
KEY `business_id` (`business_id`)
) AUTO_INCREMENT = 8178461 DEFAULT CHARSET = utf8mb4 ROW_FORMAT = DYNAMIC;
insert into cool_deal(deal_id) values(-2147483649);
ERROR 22003: Out of range value for column 'deal_id' at row 1
insert into cool_deal(deal_id) values(2147483648);
ERROR 22003: Out of range value for column 'deal_id' at row 1
truncate table cool_deal;
insert into cool_deal(deal_id) values(-2147483648),(2147483647);
select * from cool_deal order by deal_id;
deal_id	business_id	out_trade_id	status	regtime
-2147483648	NULL	NULL	0	NULL
2147483647	NULL	NULL	0	NULL
insert into cool_deal(deal_id) values(0),(74.09),(-76.0),(0.0001);
ERROR 23000: Duplicate entry '2147483647' for key 'PRIMARY'
select * from cool_deal order by deal_id;
deal_id	business_id	out_trade_id	status	regtime
-2147483648	NULL	NULL	0	NULL
2147483647	NULL	NULL	0	NULL
insert into cool_deal(deal_id) values(-65535);
insert into cool_deal(deal_id) values(-64);
select * from cool_deal order by deal_id;
deal_id	business_id	out_trade_id	status	regtime
-2147483648	NULL	NULL	0	NULL
-65535	NULL	NULL	0	NULL
-64	NULL	NULL	0	NULL
2147483647	NULL	NULL	0	NULL
边界值测试（非严格模式） -2147483648，2147483647
set sql_mode='';
select @@sql_mode;
@@sql_mode

DROP TABLE IF EXISTS cool_deal;
CREATE TABLE `cool_deal` (
`deal_id` int(11) NOT NULL AUTO_INCREMENT COMMENT '交易流水ID',
`business_id` varchar(11) DEFAULT NULL,
`out_trade_id` varchar(40) DEFAULT NULL,
`status` int(1) NOT NULL DEFAULT '0' COMMENT '状态（1,已支付，2，未支付，3已退款，4部分退款,5订单撤销，支付宝和微信主动退款）',
`regtime` varchar(11) DEFAULT NULL,
PRIMARY KEY (`deal_id`),
UNIQUE KEY `out_trade_id` (`out_trade_id`),
KEY `business_id` (`business_id`)
) AUTO_INCREMENT = 8178461 DEFAULT CHARSET = utf8mb4 ROW_FORMAT = DYNAMIC;
insert into cool_deal(deal_id) values(-2147483649);
insert into cool_deal(deal_id) values(2147483648);
select * from cool_deal order by deal_id;
deal_id	business_id	out_trade_id	status	regtime
-2147483648	NULL	NULL	0	NULL
2147483647	NULL	NULL	0	NULL
insert into cool_deal(deal_id) values(-2147483648);
ERROR 23000: Duplicate entry '-2147483648' for key 'PRIMARY'
insert into cool_deal(deal_id) values(2147483647);
ERROR 23000: Duplicate entry '2147483647' for key 'PRIMARY'
insert ignore into cool_deal(deal_id) values(2147483647),(-2147483648);
insert into cool_deal(deal_id) values(0),(74.09),(-76.0),(0.0001);
ERROR 23000: Duplicate entry '2147483647' for key 'PRIMARY'
insert ignore into cool_deal(deal_id) values(0),(74.09),(0.0001);
select * from cool_deal order by deal_id;
deal_id	business_id	out_trade_id	status	regtime
-2147483648	NULL	NULL	0	NULL
74	NULL	NULL	0	NULL
2147483647	NULL	NULL	0	NULL
insert into cool_deal(deal_id) values(-65535);
insert into cool_deal(deal_id) values(-64);
select * from cool_deal order by deal_id;
deal_id	business_id	out_trade_id	status	regtime
-2147483648	NULL	NULL	0	NULL
-65535	NULL	NULL	0	NULL
-64	NULL	NULL	0	NULL
74	NULL	NULL	0	NULL
2147483647	NULL	NULL	0	NULL
隐式类型转换（非严格模式）
set sql_mode='';
select @@sql_mode;
@@sql_mode

DROP TABLE IF EXISTS cool_deal;
CREATE TABLE `cool_deal` (
`deal_id` int(11) NOT NULL AUTO_INCREMENT COMMENT '交易流水ID',
`business_id` varchar(11) NOT NULL,
`out_trade_id` varchar(40) DEFAULT NULL,
`status` int(1) NOT NULL DEFAULT '0' COMMENT '状态（1,已支付，2，未支付，3已退款，4部分退款,5订单撤销，支付宝和微信主动退款）',
`regtime` varchar(11) DEFAULT NULL,
PRIMARY KEY (`deal_id`),
UNIQUE KEY `out_trade_id` (`out_trade_id`),
KEY `business_id` (`business_id`)
) AUTO_INCREMENT = 8178461 DEFAULT CHARSET = utf8mb4 ROW_FORMAT = DYNAMIC;
insert /*+USE_PLAN_CACHE(NONE)*/ into cool_deal(deal_id) values(cast(20010101010101 as datetime));
Warnings:
Warning	1364	Field 'business_id' doesn't have a default value
insert ignore into cool_deal(deal_id) values(cast(20010101010101 as datetime));
Warnings:
Warning	1364	Field 'business_id' doesn't have a default value
insert into cool_deal(deal_id) values('20191105'),('3.141592653');
Warnings:
Warning	1364	Field 'business_id' doesn't have a default value
insert ignore into cool_deal(deal_id) values('20191105'),('3.141592653'),(0.00001);
Warnings:
Warning	1364	Field 'business_id' doesn't have a default value
insert ignore into cool_deal(out_trade_id) values(''),(null),('哈哈');
Warnings:
Warning	1364	Field 'business_id' doesn't have a default value
select * from cool_deal order by deal_id;
deal_id	business_id	out_trade_id	status	regtime
3		NULL	0	NULL
20191105		NULL	0	NULL
2147483647		NULL	0	NULL
insert into cool_deal(out_trade_id) values(10);
ERROR 23000: Duplicate entry '2147483647' for key 'PRIMARY'
delete from cool_deal;
insert /*+USE_PLAN_CACHE(NONE)*/ into cool_deal(out_trade_id) values(10);
Warnings:
Warning	1364	Field 'business_id' doesn't have a default value
insert into cool_deal(deal_id,out_trade_id) values(-1,20);
Warnings:
Warning	1364	Field 'business_id' doesn't have a default value
select * from cool_deal order by deal_id;
deal_id	business_id	out_trade_id	status	regtime
-1		20	0	NULL
2147483647		10	0	NULL
delete from cool_deal;
insert into cool_deal(deal_id) values (hex(100));
Warnings:
Warning	1364	Field 'business_id' doesn't have a default value
insert into cool_deal(deal_id) values ((100-60+40)*5/4);
Warnings:
Warning	1364	Field 'business_id' doesn't have a default value
select * from cool_deal order by deal_id;
deal_id	business_id	out_trade_id	status	regtime
64		NULL	0	NULL
100		NULL	0	NULL
delete from cool_deal;
隐式类型转换（严格模式）
set sql_mode='STRICT_ALL_TABLES';
select @@sql_mode;
@@sql_mode
STRICT_ALL_TABLES
DROP TABLE IF EXISTS cool_deal;
CREATE TABLE `cool_deal` (
`deal_id` int(11) NOT NULL AUTO_INCREMENT COMMENT '交易流水ID',
`business_id` varchar(11) NOT NULL,
`out_trade_id` varchar(40) DEFAULT NULL,
`status` int(1) NOT NULL DEFAULT '0' COMMENT '状态（1,已支付，2，未支付，3已退款，4部分退款,5订单撤销，支付宝和微信主动退款）',
`regtime` varchar(11) DEFAULT NULL,
PRIMARY KEY (`deal_id`),
UNIQUE KEY `out_trade_id` (`out_trade_id`),
KEY `business_id` (`business_id`)
) AUTO_INCREMENT = 8178461 DEFAULT CHARSET = utf8mb4 ROW_FORMAT = DYNAMIC;
insert into cool_deal(deal_id) values(10);
ERROR HY000: Field 'business_id' doesn't have a default value
insert into cool_deal(deal_id,business_id) values('20191105',0),('3.141592653',0);
select * from cool_deal order by deal_id;
deal_id	business_id	out_trade_id	status	regtime
3	0	NULL	0	NULL
20191105	0	NULL	0	NULL
insert into cool_deal(out_trade_id) values(10);
Got one of the listed errors
delete from cool_deal;
insert into cool_deal(deal_id,business_id) values('aaaaaa',10);
ERROR HY000: Incorrect integer value for column 'deal_id' at row 1
problem set 
bug_id:23315591
set sql_mode='';
DROP TABLE IF EXISTS cool_deal;
CREATE TABLE `cool_deal` (
`deal_id` int(11) NOT NULL AUTO_INCREMENT COMMENT '交易流水ID',
`business_id` varchar(11) DEFAULT NULL,
`out_trade_id` varchar(40) DEFAULT NULL,
`status` int(1) NOT NULL DEFAULT '0' COMMENT '状态（1,已支付，2，未支付，3已退款，4部分退款,5订单撤销，支付宝和微信主动退款）',
`regtime` varchar(11) DEFAULT NULL,
PRIMARY KEY (`deal_id`),
UNIQUE KEY `out_trade_id` (`out_trade_id`),
KEY `business_id` (`business_id`)
) AUTO_INCREMENT = 8178461 DEFAULT CHARSET = utf8mb4 ROW_FORMAT = DYNAMIC;
insert into cool_deal(deal_id) values('');
select * from cool_deal;
deal_id	business_id	out_trade_id	status	regtime
8178461	NULL	NULL	0	NULL
bug_id:23316763
set sql_mode='STRICT_ALL_TABLES';
DROP TABLE IF EXISTS cool_deal;
CREATE TABLE `cool_deal` (
`deal_id` int(11) NOT NULL AUTO_INCREMENT COMMENT '交易流水ID',
`business_id` varchar(11) DEFAULT NULL,
`out_trade_id` varchar(40) DEFAULT NULL,
`status` int(1) NOT NULL DEFAULT '0' COMMENT '状态（1,已支付，2，未支付，3已退款，4部分退款,5订单撤销，支付宝和微信主动退款）',
`regtime` varchar(11) DEFAULT NULL,
PRIMARY KEY (`deal_id`),
UNIQUE KEY `out_trade_id` (`out_trade_id`),
KEY `business_id` (`business_id`)
) AUTO_INCREMENT = 8178461 DEFAULT CHARSET = utf8mb4 ROW_FORMAT = DYNAMIC;
insert ignore into cool_deal(deal_id) values(0),(74.09),(-76.087),(0.0001);
select * from cool_deal order by deal_id;
deal_id	business_id	out_trade_id	status	regtime
-76	NULL	NULL	0	NULL
74	NULL	NULL	0	NULL
8178461	NULL	NULL	0	NULL
8178462	NULL	NULL	0	NULL
bug_id:23319196
set sql_mode='';
DROP TABLE IF EXISTS cool_deal;
CREATE TABLE `cool_deal` (
`deal_id` int(11) NOT NULL AUTO_INCREMENT COMMENT '交易流水ID',
`business_id` varchar(11) NOT NULL,
`out_trade_id` varchar(40) DEFAULT NULL,
`status` int(1) NOT NULL DEFAULT '0' COMMENT '状态（1,已支付，2，未支付，3已退款，4部分退款,5订单撤销，支付宝和微信主动退款）',
`regtime` varchar(11) DEFAULT NULL,
PRIMARY KEY (`deal_id`),
UNIQUE KEY `out_trade_id` (`out_trade_id`),
KEY `business_id` (`business_id`)
) AUTO_INCREMENT = 8178461 DEFAULT CHARSET = utf8mb4 ROW_FORMAT = DYNAMIC;
insert ignore into cool_deal(business_id) values(null);
Warnings:
Warning	1048	Column 'business_id' cannot be null
bug_id:23320315
set sql_mode='STRICT_ALL_TABLES';
DROP TABLE IF EXISTS cool_deal;
CREATE TABLE `cool_deal` (
`deal_id` int(11) NOT NULL AUTO_INCREMENT COMMENT '交易流水ID',
`business_id` varchar(11) NOT NULL,
`out_trade_id` varchar(40) DEFAULT NULL,
`status` int(1) NOT NULL DEFAULT '0' COMMENT '状态（1,已支付，2，未支付，3已退款，4部分退款,5订单撤销，支付宝和微信主动退款）',
`regtime` varchar(11) DEFAULT NULL,
PRIMARY KEY (`deal_id`),
UNIQUE KEY `out_trade_id` (`out_trade_id`),
KEY `business_id` (`business_id`)
) AUTO_INCREMENT = 8178461 DEFAULT CHARSET = utf8mb4 ROW_FORMAT = DYNAMIC;
insert into cool_deal(deal_id,business_id) values('20191105',0),('3.141592653',0);
select * from cool_deal order by deal_id;
deal_id	business_id	out_trade_id	status	regtime
3	0	NULL	0	NULL
20191105	0	NULL	0	NULL
insert into cool_deal(business_id) values('');
select * from cool_deal order by deal_id;
deal_id	business_id	out_trade_id	status	regtime
3	0	NULL	0	NULL
20191105	0	NULL	0	NULL
20191106		NULL	0	NULL
bug_id:23322339
set sql_mode='';
DROP TABLE IF EXISTS cool_deal;
CREATE TABLE `cool_deal` (
`deal_id` int(11) NOT NULL AUTO_INCREMENT COMMENT '交易流水ID',
`business_id` varchar(11) NOT NULL,
`out_trade_id` varchar(40) DEFAULT NULL,
`status` int(1) NOT NULL DEFAULT '0' COMMENT '状态（1,已支付，2，未支付，3已退款，4部分退款,5订单撤销，支付宝和微信主动退款）',
`regtime` varchar(11) DEFAULT NULL,
PRIMARY KEY (`deal_id`),
UNIQUE KEY `out_trade_id` (`out_trade_id`),
KEY `business_id` (`business_id`)
) AUTO_INCREMENT = 8178461 DEFAULT CHARSET = utf8mb4 ROW_FORMAT = DYNAMIC;
insert into cool_deal(deal_id) values('aaaaaa');
Warnings:
Warning	1364	Field 'business_id' doesn't have a default value
select * from cool_deal;
deal_id	business_id	out_trade_id	status	regtime
8178461		NULL	0	NULL
bug_id:23323379
set sql_mode='';
DROP TABLE IF EXISTS default_test;
CREATE TABLE `default_test` (
`id` int(11) NOT NULL AUTO_INCREMENT,
`name` varchar(20) NOT NULL,
`content` text NOT NULL default '',
PRIMARY KEY (`id`)) ENGINE=InnoDB DEFAULT CHARSET=utf8;
ERROR 42000: Invalid default value for 'content'
set ob_enable_plan_cache = 1;
drop database cwx;
drop user cwx;
drop database if exists cwx;
