result_format: 4
drop materialized view log on t1;
drop table t1;
drop view t1_v1;
drop materialized view t1_mv1;
drop materialized view t1_rt_mv1;
create table t1(c1 int primary key, c2 int, c3 int, c4 int);
insert into t1 values(1,1,1,1);
create materialized view log on t1 with primary key, rowid, sequence (c2, c3) including new values;

create or replace view t1_v1 as
select c2 as c2, count(*) cnt, count(c3) cnt_c3, sum(c3) sum_c3, avg(c3) avg_c3, avg(c3)*sum(c3)/c2 calc_1 from t1 group by c2;

create materialized view t1_mv1 refresh fast on demand as
select c2 as c2, count(*) cnt, count(c3) cnt_c3, sum(c3) sum_c3, avg(c3) avg_c3, avg(c3)*sum(c3)/c2 calc_1 from t1 group by c2;

create materialized view t1_rt_mv1
refresh fast on demand
enable on query computation
as
select count(*) cnt, count(c3) cnt_c3, sum(c3) sum_c3, avg(c3) avg_c3, avg(c3)*sum(c3)/c2 calc_1 from t1 group by c2;
ERROR HY000: cannot ENABLE ON QUERY COMPUTATION for the materialized view T1_RT_MV1: all group by column are required in the select item list

create materialized view t1_rt_mv1
refresh fast on demand
enable on query computation
as
select c2 as c2, count(*) cnt, count(c3) cnt_c3, sum(c3) sum_c3, avg(c3) avg_c3, avg(c3)*sum(c3)/c2 calc_1 from t1 group by c2;

create index t1_rt_mv1_idx on t1_rt_mv1(abs(c2));
ERROR 0A000: internal error code, arguments: -4007, use functional index on materialized view not supported

create or replace view res_compare
as
select * from (
    select t1_v1.*, '1.normal view' view_type from t1_v1
    union all
    select t1_mv1.*, '2.mview' from t1_mv1
    union all
    select t1_rt_mv1.*, '3.rt-mview' from t1_rt_mv1)
order by c2, view_type;

explain basic select * from t1_rt_mv1;
Query Plan
==============================================
|ID|OPERATOR                   |NAME         |
----------------------------------------------
|0 |HASH GROUP BY              |             |
|1 |└─SUBPLAN SCAN             |INNER_RT_MV$$|
|2 |  └─UNION ALL              |             |
|3 |    ├─TABLE FULL SCAN      |T1_RT_MV1    |
|4 |    └─HASH GROUP BY        |             |
|5 |      └─SUBPLAN SCAN       |DLT_T$$      |
|6 |        └─WINDOW FUNCTION  |             |
|7 |          └─TABLE FULL SCAN|MLOG$_T1     |
==============================================
Outputs & filters:
-------------------------------------
  0 - output([INNER_RT_MV$$.C2], [cast(T_FUN_SUM(INNER_RT_MV$$.CNT), NUMBER(38, 0))], [cast(T_FUN_SUM(INNER_RT_MV$$.CNT_C3), NUMBER(38, 0))], [CASE WHEN 
      T_FUN_SUM(INNER_RT_MV$$.CNT_C3) = 0 THEN NULL ELSE T_FUN_SUM(INNER_RT_MV$$.SUM_C3) END], [CASE WHEN T_FUN_SUM(INNER_RT_MV$$.CNT_C3) = 0 THEN NULL ELSE T_FUN_SUM(INNER_RT_MV$$.SUM_C3) 
      END / T_FUN_SUM(INNER_RT_MV$$.CNT_C3)], [CASE WHEN T_FUN_SUM(INNER_RT_MV$$.CNT_C3) = 0 THEN NULL ELSE T_FUN_SUM(INNER_RT_MV$$.SUM_C3) END / T_FUN_SUM(INNER_RT_MV$$.CNT_C3) 
      * CASE WHEN T_FUN_SUM(INNER_RT_MV$$.CNT_C3) = 0 THEN NULL ELSE T_FUN_SUM(INNER_RT_MV$$.SUM_C3) END / INNER_RT_MV$$.C2]), filter([T_FUN_SUM(INNER_RT_MV$$.CNT) 
      > 0]), rowset=16
      group([INNER_RT_MV$$.C2]), agg_func([T_FUN_SUM(INNER_RT_MV$$.CNT)], [T_FUN_SUM(INNER_RT_MV$$.CNT_C3)], [T_FUN_SUM(INNER_RT_MV$$.SUM_C3)])
  1 - output([INNER_RT_MV$$.C2], [INNER_RT_MV$$.CNT], [INNER_RT_MV$$.CNT_C3], [INNER_RT_MV$$.SUM_C3]), filter(nil), rowset=16
      access([INNER_RT_MV$$.C2], [INNER_RT_MV$$.CNT], [INNER_RT_MV$$.CNT_C3], [INNER_RT_MV$$.SUM_C3])
  2 - output([UNION([1])], [UNION([2])], [UNION([3])], [UNION([4])]), filter(nil), rowset=16
  3 - output([T1_RT_MV1.C2], [T1_RT_MV1.CNT], [T1_RT_MV1.CNT_C3], [T1_RT_MV1.SUM_C3]), filter(nil), rowset=16
      access([T1_RT_MV1.C2], [T1_RT_MV1.CNT], [T1_RT_MV1.CNT_C3], [T1_RT_MV1.SUM_C3]), partitions(p0)
      is_index_back=false, is_global_index=false, 
      range_key([T1_RT_MV1.__pk_increment]), range(MIN ; MAX)always true
  4 - output([DLT_T$$.C2], [T_FUN_SUM(CASE WHEN DLT_T$$.OLD_NEW$$ = cast('N', VARCHAR2(1048576 )) THEN 1 ELSE (T_OP_NEG, 1) END)], [T_FUN_SUM(CASE WHEN 
      DLT_T$$.OLD_NEW$$ = cast('N', VARCHAR2(1048576 )) THEN 1 ELSE (T_OP_NEG, 1) END * CASE WHEN DLT_T$$.C3 IS NULL THEN 0 ELSE 1 END)], [T_FUN_SUM(CASE WHEN 
      DLT_T$$.OLD_NEW$$ = cast('N', VARCHAR2(1048576 )) THEN 1 ELSE (T_OP_NEG, 1) END * DLT_T$$.C3)]), filter(nil), rowset=16
      group([DLT_T$$.C2]), agg_func([T_FUN_SUM(CASE WHEN DLT_T$$.OLD_NEW$$ = cast('N', VARCHAR2(1048576 )) THEN 1 ELSE (T_OP_NEG, 1) END)], [T_FUN_SUM(CASE 
      WHEN DLT_T$$.OLD_NEW$$ = cast('N', VARCHAR2(1048576 )) THEN 1 ELSE (T_OP_NEG, 1) END * CASE WHEN DLT_T$$.C3 IS NULL THEN 0 ELSE 1 END)], [T_FUN_SUM(CASE 
      WHEN DLT_T$$.OLD_NEW$$ = cast('N', VARCHAR2(1048576 )) THEN 1 ELSE (T_OP_NEG, 1) END * DLT_T$$.C3)])
  5 - output([DLT_T$$.C2], [DLT_T$$.C3], [CASE WHEN DLT_T$$.OLD_NEW$$ = cast('N', VARCHAR2(1048576 )) THEN 1 ELSE (T_OP_NEG, 1) END]), filter([DLT_T$$.OLD_NEW$$ 
      = cast('N', VARCHAR2(1048576 )) AND DLT_T$$.SEQUENCE$$ = DLT_T$$.MAXSEQ$$ OR DLT_T$$.OLD_NEW$$ = cast('O', VARCHAR2(1048576 )) AND DLT_T$$.SEQUENCE$$ = 
      DLT_T$$.MINSEQ$$]), rowset=16
      access([DLT_T$$.OLD_NEW$$], [DLT_T$$.SEQUENCE$$], [DLT_T$$.MAXSEQ$$], [DLT_T$$.MINSEQ$$], [DLT_T$$.C2], [DLT_T$$.C3])
  6 - output([MLOG$_T1.OLD_NEW$$], [MLOG$_T1.SEQUENCE$$], [T_FUN_MAX(MLOG$_T1.SEQUENCE$$)], [T_FUN_MIN(MLOG$_T1.SEQUENCE$$)], [MLOG$_T1.C2], [MLOG$_T1.C3]), filter(nil), rowset=16
      win_expr(T_FUN_MAX(MLOG$_T1.SEQUENCE$$)), partition_by([MLOG$_T1.C1]), order_by(nil), window_type(RANGE), upper(UNBOUNDED PRECEDING), lower(UNBOUNDED 
      FOLLOWING)
      win_expr(T_FUN_MIN(MLOG$_T1.SEQUENCE$$)), partition_by([MLOG$_T1.C1]), order_by(nil), window_type(RANGE), upper(UNBOUNDED PRECEDING), lower(UNBOUNDED 
      FOLLOWING)
  7 - output([MLOG$_T1.C1], [MLOG$_T1.SEQUENCE$$], [MLOG$_T1.OLD_NEW$$], [MLOG$_T1.C2], [MLOG$_T1.C3]), filter([cast(ORA_ROWSCN, NUMBER(-1, -1)) > last_refresh_scn(xxxxxx)]), rowset=16
      access([MLOG$_T1.C1], [MLOG$_T1.SEQUENCE$$], [MLOG$_T1.OLD_NEW$$], [MLOG$_T1.C2], [MLOG$_T1.C3], [ORA_ROWSCN]), partitions(p0)
      is_index_back=false, is_global_index=false, filter_before_indexback[false], 
      range_key([MLOG$_T1.C1], [MLOG$_T1.SEQUENCE$$]), range(MIN,MIN ; MAX,MAX)always true

select * from res_compare;
+------+------+--------+--------+--------+--------+---------------+
| C2   | CNT  | CNT_C3 | SUM_C3 | AVG_C3 | CALC_1 | VIEW_TYPE     |
+------+------+--------+--------+--------+--------+---------------+
|    1 |    1 |      1 |      1 |      1 |      1 | 1.normal view |
|    1 |    1 |      1 |      1 |      1 |      1 | 2.mview       |
|    1 |    1 |      1 |      1 |      1 |      1 | 3.rt-mview    |
+------+------+--------+--------+--------+--------+---------------+

insert into t1 values(2,1,2,1);
insert into t1 values(3,1,3,1);

select * from res_compare;
+------+------+--------+--------+--------+--------+---------------+
| C2   | CNT  | CNT_C3 | SUM_C3 | AVG_C3 | CALC_1 | VIEW_TYPE     |
+------+------+--------+--------+--------+--------+---------------+
|    1 |    3 |      3 |      6 |      2 |     12 | 1.normal view |
|    1 |    1 |      1 |      1 |      1 |      1 | 2.mview       |
|    1 |    3 |      3 |      6 |      2 |     12 | 3.rt-mview    |
+------+------+--------+--------+--------+--------+---------------+

call DBMS_MVIEW.REFRESH('t1_mv1', 'f');
call DBMS_MVIEW.REFRESH('t1_rt_mv1', 'f');

select * from res_compare;
+------+------+--------+--------+--------+--------+---------------+
| C2   | CNT  | CNT_C3 | SUM_C3 | AVG_C3 | CALC_1 | VIEW_TYPE     |
+------+------+--------+--------+--------+--------+---------------+
|    1 |    3 |      3 |      6 |      2 |     12 | 1.normal view |
|    1 |    3 |      3 |      6 |      2 |     12 | 2.mview       |
|    1 |    3 |      3 |      6 |      2 |     12 | 3.rt-mview    |
+------+------+--------+--------+--------+--------+---------------+

insert into t1 values(4,1,4,1);
insert into t1 values(5,2,5,1);
select * from res_compare;
+------+------+--------+--------+--------+--------+---------------+
| C2   | CNT  | CNT_C3 | SUM_C3 | AVG_C3 | CALC_1 | VIEW_TYPE     |
+------+------+--------+--------+--------+--------+---------------+
|    1 |    4 |      4 |     10 |    2.5 |     25 | 1.normal view |
|    1 |    3 |      3 |      6 |      2 |     12 | 2.mview       |
|    1 |    4 |      4 |     10 |    2.5 |     25 | 3.rt-mview    |
|    2 |    1 |      1 |      5 |      5 |   12.5 | 1.normal view |
|    2 |    1 |      1 |      5 |      5 |   12.5 | 3.rt-mview    |
+------+------+--------+--------+--------+--------+---------------+

update t1 set c2 = c3/2 where c3 > 3;
delete from t1 where c1 = 1;
select * from res_compare;
+------+------+--------+--------+--------+------------------------------------------+---------------+
| C2   | CNT  | CNT_C3 | SUM_C3 | AVG_C3 | CALC_1                                   | VIEW_TYPE     |
+------+------+--------+--------+--------+------------------------------------------+---------------+
|    1 |    2 |      2 |      5 |    2.5 |                                     12.5 | 1.normal view |
|    1 |    3 |      3 |      6 |      2 |                                       12 | 2.mview       |
|    1 |    2 |      2 |      5 |    2.5 |                                     12.5 | 3.rt-mview    |
|    2 |    1 |      1 |      4 |      4 |                                        8 | 1.normal view |
|    2 |    1 |      1 |      4 |      4 |                                        8 | 3.rt-mview    |
|    3 |    1 |      1 |      5 |      5 | 8.33333333333333333333333333333333333333 | 1.normal view |
|    3 |    1 |      1 |      5 |      5 | 8.33333333333333333333333333333333333333 | 3.rt-mview    |
+------+------+--------+--------+--------+------------------------------------------+---------------+

call DBMS_MVIEW.REFRESH('t1_mv1', 'f');
call DBMS_MVIEW.REFRESH('t1_rt_mv1', 'f');

select * from res_compare;
+------+------+--------+--------+--------+------------------------------------------+---------------+
| C2   | CNT  | CNT_C3 | SUM_C3 | AVG_C3 | CALC_1                                   | VIEW_TYPE     |
+------+------+--------+--------+--------+------------------------------------------+---------------+
|    1 |    2 |      2 |      5 |    2.5 |                                     12.5 | 1.normal view |
|    1 |    2 |      2 |      5 |    2.5 |                                     12.5 | 2.mview       |
|    1 |    2 |      2 |      5 |    2.5 |                                     12.5 | 3.rt-mview    |
|    2 |    1 |      1 |      4 |      4 |                                        8 | 1.normal view |
|    2 |    1 |      1 |      4 |      4 |                                        8 | 2.mview       |
|    2 |    1 |      1 |      4 |      4 |                                        8 | 3.rt-mview    |
|    3 |    1 |      1 |      5 |      5 | 8.33333333333333333333333333333333333333 | 1.normal view |
|    3 |    1 |      1 |      5 |      5 | 8.33333333333333333333333333333333333333 | 2.mview       |
|    3 |    1 |      1 |      5 |      5 | 8.33333333333333333333333333333333333333 | 3.rt-mview    |
+------+------+--------+--------+--------+------------------------------------------+---------------+

drop materialized view log on t1;
drop table t1;
drop view t1_v1;
drop materialized view t1_mv1;
drop materialized view t1_rt_mv1;
