drop database  IF EXISTS  db1;
create database db1;
use db1;
SET wait_timeout=30000000;
SET ob_trx_timeout = 30000000;
SET ob_query_timeout = 30000000;
##设置相同sql_mode;
SET @@sql_mode='STRICT_TRANS_TABLES,NO_ENGINE_SUBSTITUTION,no_zero_date,no_zero_in_date,PIPES_AS_CONCAT';
##参数验证
select day();
ERROR 42000: You have an error in your SQL syntax; check the manual that corresponds to your OceanBase version for the right syntax to use near ')' at line 1
select day(" ");
day(" ")
NULL
Warnings:
Warning	5086	Not timestamp Can not cast varchar value to timestamp type
select day("null");
day("null")
NULL
Warnings:
Warning	5086	Not timestamp Can not cast varchar value to timestamp type
select day(0);
day(0)
0
select day(1);
day(1)
NULL
Warnings:
Warning	5086	Not timestamp Can not cast varchar value to timestamp type
select day("0000-00-00");
day("0000-00-00")
NULL
Warnings:
Warning	5086	Not timestamp Can not cast varchar value to timestamp type
select day('1969-12-31 23:59:59.9999999');
day('1969-12-31 23:59:59.9999999')
1
##ob和MySQL5.7结果不一致;
select day('0000-02-29');
day('0000-02-29')
NULL
Warnings:
Warning	5086	Not timestamp Can not cast varchar value to timestamp type
select day(current_time(),current_timestamp());
ERROR 42000: You have an error in your SQL syntax; check the manual that corresponds to your OceanBase version for the right syntax to use near ',current_timestamp())' at line 1
select day('monday'), day('Tuesday'), day('Wednesday'),day('Sunday'),day('Thursday'),day('Friday'),day('Saturday');
day('monday')	day('Tuesday')	day('Wednesday')	day('Sunday')	day('Thursday')	day('Friday')	day('Saturday')
NULL	NULL	NULL	NULL	NULL	NULL	NULL
Warnings:
Warning	5086	Not timestamp Can not cast varchar value to timestamp type
Warning	5086	Not timestamp Can not cast varchar value to timestamp type
Warning	5086	Not timestamp Can not cast varchar value to timestamp type
Warning	5086	Not timestamp Can not cast varchar value to timestamp type
Warning	5086	Not timestamp Can not cast varchar value to timestamp type
Warning	5086	Not timestamp Can not cast varchar value to timestamp type
Warning	5086	Not timestamp Can not cast varchar value to timestamp type
select day('0.01.01');
day('0.01.01')
1
select day('9999.12.31');
day('9999.12.31')
31
select day(+"2022-09-05");
day(+"2022-09-05")
5
select day(-"2022-09-05");
day(-"2022-09-05")
NULL
Warnings:
Warning	1292	Truncated incorrect DOUBLE value: '2022-09-05'
Warning	5086	Not timestamp Can not cast varchar value to timestamp type
select day('a');
day('a')
NULL
Warnings:
Warning	5086	Not timestamp Can not cast varchar value to timestamp type
select day('@@@');
day('@@@')
NULL
Warnings:
Warning	5086	Not timestamp Can not cast varchar value to timestamp type
select day('#');
day('#')
NULL
Warnings:
Warning	5086	Not timestamp Can not cast varchar value to timestamp type
select day('""');
day('""')
NULL
Warnings:
Warning	5086	Not timestamp Can not cast varchar value to timestamp type
select day('_');
day('_')
NULL
Warnings:
Warning	5086	Not timestamp Can not cast varchar value to timestamp type
select day('false');
day('false')
NULL
Warnings:
Warning	5086	Not timestamp Can not cast varchar value to timestamp type
select day('true');
day('true')
NULL
Warnings:
Warning	5086	Not timestamp Can not cast varchar value to timestamp type
select day('2022-09-05')+4;
day('2022-09-05')+4
9
select day('2022-09-05')+false;
day('2022-09-05')+false
5
select day('2022-09-05')+true;
day('2022-09-05')+true
6
select day('星期一');
day('星期一')
NULL
Warnings:
Warning	5086	Not timestamp Can not cast varchar value to timestamp type
select day('星期一1999-12-31');
day('星期一1999-12-31')
NULL
Warnings:
Warning	5086	Not timestamp Can not cast varchar value to timestamp type
select day('星期一@#');
day('星期一@#')
NULL
Warnings:
Warning	5086	Not timestamp Can not cast varchar value to timestamp type
select day('1999-12-31星期一');
day('1999-12-31星期一')
31
select day(1.175494351E-38) From dual;
day(1.175494351E-38)
0
select day('-1970-12-31');
day('-1970-12-31')
NULL
Warnings:
Warning	5086	Not timestamp Can not cast varchar value to timestamp type
select day('にににににににに');
day('にににににににに')
NULL
Warnings:
Warning	5086	Not timestamp Can not cast varchar value to timestamp type
select day('천구백구십칠년 일월 오일');
day('천구백구십칠년 일월 오일')
NULL
Warnings:
Warning	5086	Not timestamp Can not cast varchar value to timestamp type
select day('一九九九零二二六');
day('一九九九零二二六')
NULL
Warnings:
Warning	5086	Not timestamp Can not cast varchar value to timestamp type
select day('壹玖玖捌零伍贰贰');
day('壹玖玖捌零伍贰贰')
NULL
Warnings:
Warning	5086	Not timestamp Can not cast varchar value to timestamp type
select day('2022-09-07')<'monday';
day('2022-09-07')<'monday'
0
Warnings:
Warning	1292	Truncated incorrect DECIMAL value: 'monday'
select day('2022-09-07')>'monday';
day('2022-09-07')>'monday'
1
Warnings:
Warning	1292	Truncated incorrect DECIMAL value: 'monday'
select day('2022-09-07') != 'Wednesday';
day('2022-09-07') != 'Wednesday'
1
Warnings:
Warning	1292	Truncated incorrect DECIMAL value: 'Wednesday'
select day('2022-09-07') >= 'Wednesday';
day('2022-09-07') >= 'Wednesday'
1
Warnings:
Warning	1292	Truncated incorrect DECIMAL value: 'Wednesday'
select day('2022-09-07') <= 'Wednesday';
day('2022-09-07') <= 'Wednesday'
0
Warnings:
Warning	1292	Truncated incorrect DECIMAL value: 'Wednesday'
select day('2022-09-07') = 'Wednesday';
day('2022-09-07') = 'Wednesday'
0
Warnings:
Warning	1292	Truncated incorrect DECIMAL value: 'Wednesday'
select day(date '2022-09-15');
day(date '2022-09-15')
15
select day(date '0000-00-00');
ERROR HY000: Incorrect DATE value: '0000-00-00'
select day(date '9999-12-31');
day(date '9999-12-31')
31
OB会显示系统时间,MySQL5.7直接报错;
select day(time '17:01:60');
ERROR HY000: Incorrect TIME value: '17:01:60'
select day('2022-09-15 23:59:59');
day('2022-09-15 23:59:59')
15
select day('2022-09-15 00:00:00');
day('2022-09-15 00:00:00')
15
select day('2022-09-15 00:59:59');
day('2022-09-15 00:59:59')
15
##ob和MySQL5.7结果不一致;
select day('1999-12-31星期1999-12-30');
day('1999-12-31星期1999-12-30')
NULL
Warnings:
Warning	5086	Not timestamp Can not cast varchar value to timestamp type
select day('1995.02.28')+2000000000000000;
day('1995.02.28')+2000000000000000
2000000000000028
select day('9999-12-31 23:59:59.999999')+0;
day('9999-12-31 23:59:59.999999')+0
31
select day('9999-12-31 23:59:59.999999')-0;
day('9999-12-31 23:59:59.999999')-0
31
select day('9999-12-31 23:59:59.999999')*1;
day('9999-12-31 23:59:59.999999')*1
31
select day('9999-12-31 23:59:59.999999')/1;
day('9999-12-31 23:59:59.999999')/1
31.0000
表字符集测试
set names binary;
select day('');
day('')
NULL
Warnings:
Warning	5086	Not timestamp Can not cast varchar value to timestamp type
select day('0');
day('0')
NULL
Warnings:
Warning	5086	Not timestamp Can not cast varchar value to timestamp type
select day(0);
day(0)
0
select day('+1');
day('+1')
NULL
Warnings:
Warning	5086	Not timestamp Can not cast varchar value to timestamp type
select day('-1');
day('-1')
NULL
Warnings:
Warning	5086	Not timestamp Can not cast varchar value to timestamp type
select day('-false');
day('-false')
NULL
Warnings:
Warning	5086	Not timestamp Can not cast varchar value to timestamp type
select day('-true');
day('-true')
NULL
Warnings:
Warning	5086	Not timestamp Can not cast varchar value to timestamp type
select day('null');
day('null')
NULL
Warnings:
Warning	5086	Not timestamp Can not cast varchar value to timestamp type
select day('1970-01-01');
day('1970-01-01')
1
select day('9999-12-31');
day('9999-12-31')
31
select day('1000-01-01');
day('1000-01-01')
1
drop table t1;
CREATE TABLE t1(c1 TIME ,
c2 date ,
c3 DATETIME ,
c4 TIMESTAMP DEFAULT '2000-01-01 00:00:00',
c5 YEAR ) default charset=binary;
INSERT INTO t1 VALUES('20:12:12','2000-12-12','2000-01-01 01:01:01','2001-01-01 23:59:59.9999999','2000'),
('21:12:13','2001-12-22','2001-01-02 13:01:01','2001-11-02 00:00:01.999999','2001'),
('22:12:14','2002-12-02','2002-01-03 14:01:01','2002-12-03 02:01:01.299999','2002'),
('23:12:15','2003-12-11','2003-01-04 15:01:01','2002-11-04 03:01:01.399999','2003'),
('20:22:16','2004-12-12','2004-01-05 16:01:01','2002-02-05 05:01:01.499999','2004'),
('20:32:17','2021-12-13','2010-01-06 21:01:01','2003-03-06 04:01:01.599999','2005'),
('20:12:18','2005-12-12','2000-01-07 01:01:01','2001-01-07 12:01:01.699999','2006'),
('11:12:19','2006-12-22','2011-01-08 13:01:01','2001-11-08 11:01:01.799999','2007'),
('02:12:20','2007-12-02','2012-01-09 14:01:01','2002-12-09 02:01:01.899999','2008'),
('03:12:21','2008-12-11','2013-01-10 15:01:01','2002-11-10 03:01:01.999999','2009'),
('00:22:22','2009-12-12','2010-01-11 16:01:01','2002-02-11 05:01:01.000001','2010'),
('00:32:23','2001-12-13','2010-01-12 21:01:01','2003-03-31 04:59:59.000000','2011');
select day(c2) from t1 where c2 ='2008-12-11';
day(c2)
11
select day(c3) from t1 where c3 ='2010-01-12 21:01:01';
day(c3)
12
select day(c4) from t1 where c4 ='2001-01-01 23:59:59.9999999';
day(c4)
2
select day(c5) from t1 where c5 ='2011';
day(c5)
NULL
Warnings:
Warning	5086	Not timestamp Can not cast varchar value to timestamp type
drop table t1;
SET NAMES 'utf8mb4';
select day('');
day('')
NULL
Warnings:
Warning	5086	Not timestamp Can not cast varchar value to timestamp type
select day('0');
day('0')
NULL
Warnings:
Warning	5086	Not timestamp Can not cast varchar value to timestamp type
select day(0);
day(0)
0
select day('+1');
day('+1')
NULL
Warnings:
Warning	5086	Not timestamp Can not cast varchar value to timestamp type
select day('-1');
day('-1')
NULL
Warnings:
Warning	5086	Not timestamp Can not cast varchar value to timestamp type
select day('-false');
day('-false')
NULL
Warnings:
Warning	5086	Not timestamp Can not cast varchar value to timestamp type
select day('-true');
day('-true')
NULL
Warnings:
Warning	5086	Not timestamp Can not cast varchar value to timestamp type
select day('null');
day('null')
NULL
Warnings:
Warning	5086	Not timestamp Can not cast varchar value to timestamp type
select day('1970-01-01');
day('1970-01-01')
1
select day('9999-12-31');
day('9999-12-31')
31
select day('1000-01-01');
day('1000-01-01')
1
CREATE TABLE t1(c1 TIME ,
c2 date ,
c3 DATETIME ,
c4 TIMESTAMP DEFAULT '2000-01-01 00:00:00',
c5 YEAR ) default charset=utf8mb4;
INSERT INTO t1 VALUES('20:12:12','2000-12-12','2000-01-01 01:01:01','2001-01-01 23:59:59.9999999','2000'),
('21:12:13','2001-12-22','2001-01-02 13:01:01','2001-11-02 00:00:01.999999','2001'),
('22:12:14','2002-12-02','2002-01-03 14:01:01','2002-12-03 02:01:01.299999','2002'),
('23:12:15','2003-12-11','2003-01-04 15:01:01','2002-11-04 03:01:01.399999','2003'),
('20:22:16','2004-12-12','2004-01-05 16:01:01','2002-02-05 05:01:01.499999','2004'),
('20:32:17','2021-12-13','2010-01-06 21:01:01','2003-03-06 04:01:01.599999','2005'),
('20:12:18','2005-12-12','2000-01-07 01:01:01','2001-01-07 12:01:01.699999','2006'),
('11:12:19','2006-12-22','2011-01-08 13:01:01','2001-11-08 11:01:01.799999','2007'),
('02:12:20','2007-12-02','2012-01-09 14:01:01','2002-12-09 02:01:01.899999','2008'),
('03:12:21','2008-12-11','2013-01-10 15:01:01','2002-11-10 03:01:01.999999','2009'),
('00:22:22','2009-12-12','2010-01-11 16:01:01','2002-02-11 05:01:01.000001','2010'),
('00:32:23','2001-12-13','2010-01-12 21:01:01','2003-03-31 04:59:59.000000','2011');
select day(c2) from t1 where c2 ='2008-12-11';
day(c2)
11
select day(c3) from t1 where c3 ='2010-01-12 21:01:01';
day(c3)
12
select day(c4) from t1 where c4 ='2001-01-01 23:59:59.9999999';
day(c4)
2
select day(c5) from t1 where c5 ='2011';
day(c5)
NULL
Warnings:
Warning	5086	Not timestamp Can not cast varchar value to timestamp type
drop table t1;
SET NAMES 'gbk';
select day('');
day('')
NULL
Warnings:
Warning	5086	Not timestamp Can not cast varchar value to timestamp type
select day('0');
day('0')
NULL
Warnings:
Warning	5086	Not timestamp Can not cast varchar value to timestamp type
select day(0);
day(0)
0
select day('+1');
day('+1')
NULL
Warnings:
Warning	5086	Not timestamp Can not cast varchar value to timestamp type
select day('-1');
day('-1')
NULL
Warnings:
Warning	5086	Not timestamp Can not cast varchar value to timestamp type
select day('-false');
day('-false')
NULL
Warnings:
Warning	5086	Not timestamp Can not cast varchar value to timestamp type
select day('-true');
day('-true')
NULL
Warnings:
Warning	5086	Not timestamp Can not cast varchar value to timestamp type
select day('null');
day('null')
NULL
Warnings:
Warning	5086	Not timestamp Can not cast varchar value to timestamp type
select day('1970-01-01');
day('1970-01-01')
1
select day('9999-12-31');
day('9999-12-31')
31
select day('1000-01-01');
day('1000-01-01')
1
CREATE TABLE t1(c1 TIME ,
c2 date ,
c3 DATETIME ,
c4 TIMESTAMP DEFAULT '2000-01-01 00:00:00',
c5 YEAR ) default charset=gbk;
INSERT INTO t1 VALUES('20:12:12','2000-12-12','2000-01-01 01:01:01','2001-01-01 23:59:59.9999999','2000'),
('21:12:13','2001-12-22','2001-01-02 13:01:01','2001-11-02 00:00:01.999999','2001'),
('22:12:14','2002-12-02','2002-01-03 14:01:01','2002-12-03 02:01:01.299999','2002'),
('23:12:15','2003-12-11','2003-01-04 15:01:01','2002-11-04 03:01:01.399999','2003'),
('20:22:16','2004-12-12','2004-01-05 16:01:01','2002-02-05 05:01:01.499999','2004'),
('20:32:17','2021-12-13','2010-01-06 21:01:01','2003-03-06 04:01:01.599999','2005'),
('20:12:18','2005-12-12','2000-01-07 01:01:01','2001-01-07 12:01:01.699999','2006'),
('11:12:19','2006-12-22','2011-01-08 13:01:01','2001-11-08 11:01:01.799999','2007'),
('02:12:20','2007-12-02','2012-01-09 14:01:01','2002-12-09 02:01:01.899999','2008'),
('03:12:21','2008-12-11','2013-01-10 15:01:01','2002-11-10 03:01:01.999999','2009'),
('00:22:22','2009-12-12','2010-01-11 16:01:01','2002-02-11 05:01:01.000001','2010'),
('00:32:23','2001-12-13','2010-01-12 21:01:01','2003-03-31 04:59:59.000000','2011');
select day(c2) from t1 where c2 ='2008-12-11';
day(c2)
11
select day(c3) from t1 where c3 ='2010-01-12 21:01:01';
day(c3)
12
select day(c4) from t1 where c4 ='2001-01-01 23:59:59.9999999';
day(c4)
2
select day(c5) from t1 where c5 ='2011';
day(c5)
NULL
Warnings:
Warning	5086	Not timestamp Can not cast varchar value to timestamp type
drop table t1;
SET NAMES 'gb18030';
select day('');
day('')
NULL
Warnings:
Warning	5086	Not timestamp Can not cast varchar value to timestamp type
select day('0');
day('0')
NULL
Warnings:
Warning	5086	Not timestamp Can not cast varchar value to timestamp type
select day(0);
day(0)
0
select day('+1');
day('+1')
NULL
Warnings:
Warning	5086	Not timestamp Can not cast varchar value to timestamp type
select day('-1');
day('-1')
NULL
Warnings:
Warning	5086	Not timestamp Can not cast varchar value to timestamp type
select day('-false');
day('-false')
NULL
Warnings:
Warning	5086	Not timestamp Can not cast varchar value to timestamp type
select day('-true');
day('-true')
NULL
Warnings:
Warning	5086	Not timestamp Can not cast varchar value to timestamp type
select day('null');
day('null')
NULL
Warnings:
Warning	5086	Not timestamp Can not cast varchar value to timestamp type
select day('1970-01-01');
day('1970-01-01')
1
select day('9999-12-31');
day('9999-12-31')
31
select day('1000-01-01');
day('1000-01-01')
1
CREATE TABLE t1(c1 TIME ,
c2 date ,
c3 DATETIME ,
c4 TIMESTAMP DEFAULT '2000-01-01 00:00:00',
c5 YEAR ) default charset=gb18030;
INSERT INTO t1 VALUES('20:12:12','2000-12-12','2000-01-01 01:01:01','2001-01-01 23:59:59.9999999','2000'),
('21:12:13','2001-12-22','2001-01-02 13:01:01','2001-11-02 00:00:01.999999','2001'),
('22:12:14','2002-12-02','2002-01-03 14:01:01','2002-12-03 02:01:01.299999','2002'),
('23:12:15','2003-12-11','2003-01-04 15:01:01','2002-11-04 03:01:01.399999','2003'),
('20:22:16','2004-12-12','2004-01-05 16:01:01','2002-02-05 05:01:01.499999','2004'),
('20:32:17','2021-12-13','2010-01-06 21:01:01','2003-03-06 04:01:01.599999','2005'),
('20:12:18','2005-12-12','2000-01-07 01:01:01','2001-01-07 12:01:01.699999','2006'),
('11:12:19','2006-12-22','2011-01-08 13:01:01','2001-11-08 11:01:01.799999','2007'),
('02:12:20','2007-12-02','2012-01-09 14:01:01','2002-12-09 02:01:01.899999','2008'),
('03:12:21','2008-12-11','2013-01-10 15:01:01','2002-11-10 03:01:01.999999','2009'),
('00:22:22','2009-12-12','2010-01-11 16:01:01','2002-02-11 05:01:01.000001','2010'),
('00:32:23','2001-12-13','2010-01-12 21:01:01','2003-03-31 04:59:59.000000','2011');
select day(c2) from t1 where c2 ='2008-12-11';
day(c2)
11
select day(c3) from t1 where c3 ='2010-01-12 21:01:01';
day(c3)
12
select day(c4) from t1 where c4 ='2001-01-01 23:59:59.9999999';
day(c4)
2
select day(c5) from t1 where c5 ='2011';
day(c5)
NULL
Warnings:
Warning	5086	Not timestamp Can not cast varchar value to timestamp type
drop table t1;
##数据类型验证
##TINYINT,SMALLINT,MEDIUMINT,int,BIGINT,FLOAT,DOUBLE,DECIMAL
create table t1(c1 TINYINT,c2 SMALLINT,c3 MEDIUMINT,c4 int,c5 BIGINT,c6 FLOAT,c7 DOUBLE,c8 DECIMAL(5,2));
insert into t1 values(22,621,0721,0621,1221,0621.221,0621.01,0621.02);
insert into t1 values(23,622,0722,0622,1222,0622.221,0622.01,0622.02);
insert into t1 values(24,null,null,null,null,null,null,null);
select * from t1 ORDER by c1 asc;
c1	c2	c3	c4	c5	c6	c7	c8
22	621	721	621	1221	621.221	621.01	621.02
23	622	722	622	1222	622.221	622.01	622.02
24	NULL	NULL	NULL	NULL	NULL	NULL	NULL
select * from t1 ORDER by day(c1) asc;
c1	c2	c3	c4	c5	c6	c7	c8
22	621	721	621	1221	621.221	621.01	621.02
23	622	722	622	1222	622.221	622.01	622.02
24	NULL	NULL	NULL	NULL	NULL	NULL	NULL
Warnings:
Warning	5086	Not timestamp Can not cast varchar value to timestamp type
Warning	5086	Not timestamp Can not cast varchar value to timestamp type
Warning	5086	Not timestamp Can not cast varchar value to timestamp type
select day(c2+1) from t1;
day(c2+1)
22
23
NULL
select day(c2-1) from t1;
day(c2-1)
20
21
NULL
select day(c2*1) from t1;
day(c2*1)
21
22
NULL
select day(c2/1) from t1;
day(c2/1)
21
22
NULL
select c1,day(c1) from t1;
c1	day(c1)
22	NULL
23	NULL
24	NULL
Warnings:
Warning	5086	Not timestamp Can not cast varchar value to timestamp type
Warning	5086	Not timestamp Can not cast varchar value to timestamp type
Warning	5086	Not timestamp Can not cast varchar value to timestamp type
select c2,day(c2) from t1;
c2	day(c2)
621	21
622	22
NULL	NULL
select c3,day(c3) from t1;
c3	day(c3)
721	21
722	22
NULL	NULL
select c4,day(c4) from t1;
c4	day(c4)
621	21
622	22
NULL	NULL
select c5,day(c5) from t1;
c5	day(c5)
1221	21
1222	22
NULL	NULL
select c6,day(c6) from t1;
c6	day(c6)
621.221	21
622.221	22
NULL	NULL
select c7,day(c7) from t1;
c7	day(c7)
621.01	21
622.01	22
NULL	NULL
select c8,day(c8) from t1;
c8	day(c8)
621.02	21
622.02	22
NULL	NULL
SELECT * FROM t1 WHERE day(c2) ORDER by c1 asc;
c1	c2	c3	c4	c5	c6	c7	c8
22	621	721	621	1221	621.221	621.01	621.02
23	622	722	622	1222	622.221	622.01	622.02
drop table t1;
##CHAR,VARCHAR,TINYBLOB,TINYTEXT,BLOB,TEXT,MEDIUMBLOB,MEDIUMTEXT,LONGBLOB,LONGTEXT
create table t1(c1 CHAR(20),c2 VARCHAR(50),c3 TINYBLOB,c4 TINYTEXT,c5 BLOB,c6 TEXT,c7 MEDIUMBLOB,c8 MEDIUMTEXT,c9 LONGBLOB,c10 LONGTEXT);
insert into t1 values('5好好2','','疯为来','#啊啊#','大懂','18','2019-01-12','21:00:00','2018-11-13 17:16:25','2015-07-05 20:18:18');
insert into t1 values('上的','','撒法发','￥@#','发送方','59','2019-05-23','11:29:29','2012-12-19 01:59:03','2008-05-13 10:25:19');
insert into t1 values('房贷首付','','阿斯蒂芬','#@#@','咳咳咳','','2020-01-07','13:59:12','2020-01-07 13:59:59','2020-09-23 11:22:33');
insert into t1 values('ADK','','反馈卡','','覆盖掉开发','','1995-01-07','23:59:59','1995-12-07 18:59:59','1998-09-23 11:22:33');
insert into t1 values('大苏','','sss','99mmhn','222手动','so','2010-05-09','07:59:19','2011-11-01 23:59:59','2015-07-21 10:11:23');
select c1,day(c1) from t1;
c1	day(c1)
5好好2	NULL
上的	NULL
房贷首付	NULL
ADK	NULL
大苏	NULL
Warnings:
Warning	5086	Not timestamp Can not cast varchar value to timestamp type
Warning	5086	Not timestamp Can not cast varchar value to timestamp type
Warning	5086	Not timestamp Can not cast varchar value to timestamp type
Warning	5086	Not timestamp Can not cast varchar value to timestamp type
Warning	5086	Not timestamp Can not cast varchar value to timestamp type
select c2,day(c2) from t1;
c2	day(c2)
	NULL
	NULL
	NULL
	NULL
	NULL
Warnings:
Warning	5086	Not timestamp Can not cast varchar value to timestamp type
Warning	5086	Not timestamp Can not cast varchar value to timestamp type
Warning	5086	Not timestamp Can not cast varchar value to timestamp type
Warning	5086	Not timestamp Can not cast varchar value to timestamp type
Warning	5086	Not timestamp Can not cast varchar value to timestamp type
select c3,day(c3) from t1;
c3	day(c3)
疯为来	NULL
撒法发	NULL
阿斯蒂芬	NULL
反馈卡	NULL
sss	NULL
Warnings:
Warning	5086	Not timestamp Can not cast varchar value to timestamp type
Warning	5086	Not timestamp Can not cast varchar value to timestamp type
Warning	5086	Not timestamp Can not cast varchar value to timestamp type
Warning	5086	Not timestamp Can not cast varchar value to timestamp type
Warning	5086	Not timestamp Can not cast varchar value to timestamp type
select c4,day(c4) from t1;
c4	day(c4)
#啊啊#	NULL
￥@#	NULL
#@#@	NULL
	NULL
99mmhn	NULL
Warnings:
Warning	5086	Not timestamp Can not cast varchar value to timestamp type
Warning	5086	Not timestamp Can not cast varchar value to timestamp type
Warning	5086	Not timestamp Can not cast varchar value to timestamp type
Warning	5086	Not timestamp Can not cast varchar value to timestamp type
Warning	5086	Not timestamp Can not cast varchar value to timestamp type
select c5,day(c5) from t1;
c5	day(c5)
大懂	NULL
发送方	NULL
咳咳咳	NULL
覆盖掉开发	NULL
222手动	NULL
Warnings:
Warning	5086	Not timestamp Can not cast varchar value to timestamp type
Warning	5086	Not timestamp Can not cast varchar value to timestamp type
Warning	5086	Not timestamp Can not cast varchar value to timestamp type
Warning	5086	Not timestamp Can not cast varchar value to timestamp type
Warning	5086	Not timestamp Can not cast varchar value to timestamp type
select c6,day(c6) from t1;
c6	day(c6)
18	NULL
59	NULL
	NULL
	NULL
so	NULL
Warnings:
Warning	5086	Not timestamp Can not cast varchar value to timestamp type
Warning	5086	Not timestamp Can not cast varchar value to timestamp type
Warning	5086	Not timestamp Can not cast varchar value to timestamp type
Warning	5086	Not timestamp Can not cast varchar value to timestamp type
Warning	5086	Not timestamp Can not cast varchar value to timestamp type
select c7,day(c7) from t1;
c7	day(c7)
2019-01-12	12
2019-05-23	23
2020-01-07	7
1995-01-07	7
2010-05-09	9
select c8,day(c8) from t1;
c8	day(c8)
21:00:00	0
11:29:29	NULL
13:59:12	NULL
23:59:59	NULL
07:59:19	NULL
Warnings:
Warning	5086	Not timestamp Can not cast varchar value to timestamp type
Warning	5086	Not timestamp Can not cast varchar value to timestamp type
Warning	5086	Not timestamp Can not cast varchar value to timestamp type
Warning	5086	Not timestamp Can not cast varchar value to timestamp type
select c9,day(c9) from t1;
c9	day(c9)
2018-11-13 17:16:25	13
2012-12-19 01:59:03	19
2020-01-07 13:59:59	7
1995-12-07 18:59:59	7
2011-11-01 23:59:59	1
select c10,day(c10) from t1;
c10	day(c10)
2015-07-05 20:18:18	5
2008-05-13 10:25:19	13
2020-09-23 11:22:33	23
1998-09-23 11:22:33	23
2015-07-21 10:11:23	21
drop table t1;
## TIME,date,DATETIME,TIMESTAMP,YEAR
CREATE TABLE t1(c1 TIME ,
c2 date ,
c3 DATETIME ,
c4 TIMESTAMP DEFAULT '2000-01-01 00:00:00',
c5 YEAR ) ;
INSERT INTO t1 VALUES('20:12:12','2000-12-12','2000-01-01 01:01:01','2001-01-01 23:59:59.9999999','2000'),
('21:12:13','2001-12-22','2001-01-02 13:01:01','2001-11-02 00:00:01.999999','2001'),
('22:12:14','2002-12-02','2002-01-03 14:01:01','2002-12-03 02:01:01.299999','2002'),
('23:12:15','2003-12-11','2003-01-04 15:01:01','2002-11-04 03:01:01.399999','2003'),
('20:22:16','2004-12-12','2004-01-05 16:01:01','2002-02-05 05:01:01.499999','2004'),
('20:32:17','2021-12-13','2010-01-06 21:01:01','2003-03-06 04:01:01.599999','2005'),
('20:12:18','2005-12-12','2000-01-07 01:01:01','2001-01-07 12:01:01.699999','2006'),
('11:12:19','2006-12-22','2011-01-08 13:01:01','2001-11-08 11:01:01.799999','2007'),
('02:12:20','2007-12-02','2012-01-09 14:01:01','2002-12-09 02:01:01.899999','2008'),
('03:12:21','2008-12-11','2013-01-10 15:01:01','2002-11-10 03:01:01.999999','2009'),
('00:22:22','2009-12-12','2010-01-11 16:01:01','2002-02-11 05:01:01.000001','2010'),
('00:32:23','2001-12-13','2010-01-12 21:01:01','2003-03-31 04:59:59.000000','2011');
select c2,day(c2) from t1;
c2	day(c2)
2000-12-12	12
2001-12-22	22
2002-12-02	2
2003-12-11	11
2004-12-12	12
2021-12-13	13
2005-12-12	12
2006-12-22	22
2007-12-02	2
2008-12-11	11
2009-12-12	12
2001-12-13	13
select c3,day(c3) from t1;
c3	day(c3)
2000-01-01 01:01:01	1
2001-01-02 13:01:01	2
2002-01-03 14:01:01	3
2003-01-04 15:01:01	4
2004-01-05 16:01:01	5
2010-01-06 21:01:01	6
2000-01-07 01:01:01	7
2011-01-08 13:01:01	8
2012-01-09 14:01:01	9
2013-01-10 15:01:01	10
2010-01-11 16:01:01	11
2010-01-12 21:01:01	12
select c4,day(c4) from t1;
c4	day(c4)
2001-01-02 00:00:00	2
2001-11-02 00:00:02	2
2002-12-03 02:01:01	3
2002-11-04 03:01:01	4
2002-02-05 05:01:01	5
2003-03-06 04:01:02	6
2001-01-07 12:01:02	7
2001-11-08 11:01:02	8
2002-12-09 02:01:02	9
2002-11-10 03:01:02	10
2002-02-11 05:01:01	11
2003-03-31 04:59:59	31
select c5,day(c5) from t1;
c5	day(c5)
2000	NULL
2001	NULL
2002	NULL
2003	NULL
2004	NULL
2005	NULL
2006	NULL
2007	NULL
2008	NULL
2009	NULL
2010	NULL
2011	NULL
Warnings:
Warning	5086	Not timestamp Can not cast varchar value to timestamp type
Warning	5086	Not timestamp Can not cast varchar value to timestamp type
Warning	5086	Not timestamp Can not cast varchar value to timestamp type
Warning	5086	Not timestamp Can not cast varchar value to timestamp type
Warning	5086	Not timestamp Can not cast varchar value to timestamp type
Warning	5086	Not timestamp Can not cast varchar value to timestamp type
Warning	5086	Not timestamp Can not cast varchar value to timestamp type
Warning	5086	Not timestamp Can not cast varchar value to timestamp type
Warning	5086	Not timestamp Can not cast varchar value to timestamp type
Warning	5086	Not timestamp Can not cast varchar value to timestamp type
Warning	5086	Not timestamp Can not cast varchar value to timestamp type
Warning	5086	Not timestamp Can not cast varchar value to timestamp type
drop table t1;
##运算符验证
##算数运算符
select +day('2022-09-15');
+day('2022-09-15')
15
select -day('2022-09-15');
-day('2022-09-15')
-15
select day('2022-09-15')+1;
day('2022-09-15')+1
16
select day('2022-09-15')-0;
day('2022-09-15')-0
15
select day('2022-09-15')+9999999999999999999;
day('2022-09-15')+9999999999999999999
10000000000000000014
select day('2022-09-15')-9999999999999999999;
ERROR 22003: BIGINT UNSIGNED value is out of range in ''(15 - 9999999999999999999)''
select day('2022-09-15')-20210618;
day('2022-09-15')-20210618
-20210603
select day('2022-09-15')-'a';
day('2022-09-15')-'a'
15
Warnings:
Warning	1292	Truncated incorrect DOUBLE value: 'a'
select day('2022-09-15')+'bb';
day('2022-09-15')+'bb'
15
Warnings:
Warning	1292	Truncated incorrect DOUBLE value: 'bb'
select day('2022-09-15');
day('2022-09-15')
15
select day('2022-09-15')+'2020-06-17';
day('2022-09-15')+'2020-06-17'
2035
Warnings:
Warning	1292	Truncated incorrect DOUBLE value: '2020-06-17'
select day('2022-09-15')-'2020-06-17';
day('2022-09-15')-'2020-06-17'
-2005
Warnings:
Warning	1292	Truncated incorrect DOUBLE value: '2020-06-17'
select 1+day('2022-09-15');
1+day('2022-09-15')
16
select 1-day('2022-09-15');
1-day('2022-09-15')
-14
select 20200913-day('2022-09-15');
20200913-day('2022-09-15')
20200898
select 20200913*day('2022-09-15');
20200913*day('2022-09-15')
303013695
select 20200913/day('2022-09-15');
20200913/day('2022-09-15')
1346727.5333
select 20200913%day('2022-09-15');
20200913%day('2022-09-15')
8
select 20200913 div day('2022-09-15');
20200913 div day('2022-09-15')
1346727
select 20200913 mod day('2022-09-15');
20200913 mod day('2022-09-15')
8
select day('2022-09-15')*0;
day('2022-09-15')*0
0
select day('2022-09-15')*10;
day('2022-09-15')*10
150
select day('2022-09-15')*'a';
day('2022-09-15')*'a'
0
Warnings:
Warning	1292	Truncated incorrect DOUBLE value: 'a'
select day('2022-09-15')*'2020-06-17';
day('2022-09-15')*'2020-06-17'
30300
Warnings:
Warning	1292	Truncated incorrect DOUBLE value: '2020-06-17'
select (day('2022-09-15')+9)*1000;
(day('2022-09-15')+9)*1000
24000
select (day('2022-09-15')+9)*-1000.632;
(day('2022-09-15')+9)*-1000.632
-24015.168
select day('2022-09-15')/0;
day('2022-09-15')/0
NULL
select day('2022-09-15')/10;
day('2022-09-15')/10
1.5000
select day('2022-09-15')/'a';
day('2022-09-15')/'a'
NULL
Warnings:
Warning	1292	Truncated incorrect DOUBLE value: 'a'
select day('2022-09-15')/'2020-06-17';
day('2022-09-15')/'2020-06-17'
0.007425742574257425
Warnings:
Warning	1292	Truncated incorrect DOUBLE value: '2020-06-17'
select (day('2022-09-15')+1)/50.55;
(day('2022-09-15')+1)/50.55
0.3165
select (day('2022-09-15')+1)/-50.55;
(day('2022-09-15')+1)/-50.55
-0.3165
select day('2022-09-15')%0;
day('2022-09-15')%0
NULL
select day('2022-09-15')%10;
day('2022-09-15')%10
5
select day('2022-09-15')%'a';
day('2022-09-15')%'a'
NULL
Warnings:
Warning	1292	Truncated incorrect DOUBLE value: 'a'
select day('2022-09-15')%'2020-06-17';
day('2022-09-15')%'2020-06-17'
15
Warnings:
Warning	1292	Truncated incorrect DOUBLE value: '2020-06-17'
select (day('2022-09-15')+0)%0;
(day('2022-09-15')+0)%0
NULL
select (day('2022-09-15')+0)%2;
(day('2022-09-15')+0)%2
1
select (day('2022-09-15')+0)%3.2;
(day('2022-09-15')+0)%3.2
2.2
select day('2022-09-15')DIV0;
DIV0
15
select day('2022-09-15')DIV10;
DIV10
15
select day('2022-09-15')DIV'a';
day('2022-09-15')DIV'a'
NULL
Warnings:
Warning	1292	Truncated incorrect DECIMAL value: 'a'
select day('2022-09-15')DIV'2020-06-17';
day('2022-09-15')DIV'2020-06-17'
0
Warnings:
Warning	1292	Truncated incorrect DECIMAL value: '2020-06-17'
select (day('2022-09-15')+0) DIV -8;
(day('2022-09-15')+0) DIV -8
-1
select day('2022-09-15') MOD 0;
day('2022-09-15') MOD 0
NULL
select day('2022-09-15') MOD 10;
day('2022-09-15') MOD 10
5
select day('2022-09-15') MOD 'a';
day('2022-09-15') MOD 'a'
NULL
Warnings:
Warning	1292	Truncated incorrect DOUBLE value: 'a'
select day('2022-09-15') MOD '2020-06-17';
day('2022-09-15') MOD '2020-06-17'
15
Warnings:
Warning	1292	Truncated incorrect DOUBLE value: '2020-06-17'
select day('2022-09-15') || day('2022-09-15')+0;
day('2022-09-15') || day('2022-09-15')+0
1515
select day('2022-09-15')+0+1000;
day('2022-09-15')+0+1000
1015
select day('2022-09-15')-1-1000;
day('2022-09-15')-1-1000
-986
select (day('2022-09-15')-1)*1000;
(day('2022-09-15')-1)*1000
14000
select (day('2022-09-15')-1)/1000;
(day('2022-09-15')-1)/1000
0.0140
select (day('2022-09-15')-1)%1000;
(day('2022-09-15')-1)%1000
14
select (day('2022-09-15')-1) DIV 1000;
(day('2022-09-15')-1) DIV 1000
0
select (day('2022-09-15')-1) MOD 1000;
(day('2022-09-15')-1) MOD 1000
14
select day('2022-09-15')|| day('2022-09-15');
day('2022-09-15')|| day('2022-09-15')
1515
select day('2022-09-15')|| 'a';
day('2022-09-15')|| 'a'
15a
select day('2022-09-15')|| 1000;
day('2022-09-15')|| 1000
151000
select day('2022-09-15')|| '2020-06-17';
day('2022-09-15')|| '2020-06-17'
152020-06-17
select day('2022-09-15')+1|| 'b';
day('2022-09-15')+1|| 'b'
16
Warnings:
Warning	1292	Truncated incorrect DOUBLE value: '1b'
select day('2022-09-15')+1|| DATE_FORMAT(day('2022-09-15'),GET_FORMAT(DATETIME,'EUR'));
day('2022-09-15')+1|| DATE_FORMAT(day('2022-09-15'),GET_FORMAT(DATETIME,'EUR'))
NULL
select day('2022-09-15')+1|| day('2022-09-15')+1;
day('2022-09-15')+1|| day('2022-09-15')+1
131
select day('2022-09-15')+1|| day('2022-09-15')+1;
day('2022-09-15')+1|| day('2022-09-15')+1
131
select day('2022-09-15')+1+ day('2022-09-15')+1;
day('2022-09-15')+1+ day('2022-09-15')+1
32
select day('2022-09-15')+1- day('2022-09-15')+1;
day('2022-09-15')+1- day('2022-09-15')+1
2
select (day('2022-09-15')+1)*(day('2022-09-15')+1);
(day('2022-09-15')+1)*(day('2022-09-15')+1)
256
select (day('2022-09-15')+1)/(day('2022-09-15')+1);
(day('2022-09-15')+1)/(day('2022-09-15')+1)
1.0000
select (day('2022-09-15')+1)%(day('2022-09-15')+1);
(day('2022-09-15')+1)%(day('2022-09-15')+1)
0
select (day('2022-09-15')+1) MOD (day('2022-09-15')+1);
(day('2022-09-15')+1) MOD (day('2022-09-15')+1)
0
select (day('2022-09-15')+1) div (day('2022-09-15')+1);
(day('2022-09-15')+1) div (day('2022-09-15')+1)
1
select day('2022-09-15')+ day('2022-09-15');
day('2022-09-15')+ day('2022-09-15')
30
select day('2022-09-15')- day('2022-09-15');
day('2022-09-15')- day('2022-09-15')
0
select day('2022-09-15')*day('2022-09-15');
day('2022-09-15')*day('2022-09-15')
225
select day('2022-09-15')/day('2022-09-15');
day('2022-09-15')/day('2022-09-15')
1.0000
select day('2022-09-15')%day('2022-09-15');
day('2022-09-15')%day('2022-09-15')
0
select day('2022-09-15') MOD day('2022-09-15');
day('2022-09-15') MOD day('2022-09-15')
0
select day('2022-09-15') div day('2022-09-15');
day('2022-09-15') div day('2022-09-15')
1
select day('2022-09-15')+day('2022-09-15');
day('2022-09-15')+day('2022-09-15')
30
select day('2022-09-15')+GET_FORMAT(DATETIME,'EUR');
day('2022-09-15')+GET_FORMAT(DATETIME,'EUR')
15
Warnings:
Warning	1292	Truncated incorrect DOUBLE value: '%Y-%m-%d %H.%i.%s'
select day('2022-09-15')-GET_FORMAT(DATETIME,'EUR');
day('2022-09-15')-GET_FORMAT(DATETIME,'EUR')
15
Warnings:
Warning	1292	Truncated incorrect DOUBLE value: '%Y-%m-%d %H.%i.%s'
select day('2022-09-15')=day('2022-09-15');
day('2022-09-15')=day('2022-09-15')
1
select day('2022-09-15')=day('2022-09-15')+1;
day('2022-09-15')=day('2022-09-15')+1
0
select day('2022-09-15')+1=day('2022-09-15')+1;
day('2022-09-15')+1=day('2022-09-15')+1
1
select day('2022-09-15')<>day('2022-09-15');
day('2022-09-15')<>day('2022-09-15')
0
select day('2022-09-15')<>day('2022-09-15')+1;
day('2022-09-15')<>day('2022-09-15')+1
1
select day('2022-09-15')+1<>day('2022-09-15')+1;
day('2022-09-15')+1<>day('2022-09-15')+1
0
select day('2022-09-15')<=>day('2022-09-15');
day('2022-09-15')<=>day('2022-09-15')
1
select day('2022-09-15')<=>day('2022-09-15')+1;
day('2022-09-15')<=>day('2022-09-15')+1
0
select day('2022-09-15')+1<=>day('2022-09-15')+1;
day('2022-09-15')+1<=>day('2022-09-15')+1
1
select day('2022-09-15')<day('2022-09-15');
day('2022-09-15')<day('2022-09-15')
0
select day('2022-09-15')<day('2022-09-15')+1;
day('2022-09-15')<day('2022-09-15')+1
1
select day('2022-09-15')+1<day('2022-09-15')+1;
day('2022-09-15')+1<day('2022-09-15')+1
0
select day('2022-09-15')<=day('2022-09-15');
day('2022-09-15')<=day('2022-09-15')
1
select day('2022-09-15')<=day('2022-09-15')+1;
day('2022-09-15')<=day('2022-09-15')+1
1
select day('2022-09-15')+1<=day('2022-09-15')+1;
day('2022-09-15')+1<=day('2022-09-15')+1
1
select day('2022-09-15')>=day('2022-09-15');
day('2022-09-15')>=day('2022-09-15')
1
select day('2022-09-15')>=day('2022-09-15')+1;
day('2022-09-15')>=day('2022-09-15')+1
0
select day('2022-09-15')+1>=day('2022-09-15')+1;
day('2022-09-15')+1>=day('2022-09-15')+1
1
select day('2022-09-15')>day('2022-09-15');
day('2022-09-15')>day('2022-09-15')
0
select day('2022-09-15')>day('2022-09-15')+1;
day('2022-09-15')>day('2022-09-15')+1
0
select day('2022-09-15')+1>day('2022-09-15')+1;
day('2022-09-15')+1>day('2022-09-15')+1
0
select day('2022-09-15') between day('2022-09-15')-1 and day('2022-09-15')+9;
day('2022-09-15') between day('2022-09-15')-1 and day('2022-09-15')+9
1
select day('2022-09-15') between day('2022-09-15')+1 and day('2022-09-15')+9;
day('2022-09-15') between day('2022-09-15')+1 and day('2022-09-15')+9
0
select day('2022-09-15')-1 between day('2022-09-15') and day('2022-09-15')+9;
day('2022-09-15')-1 between day('2022-09-15') and day('2022-09-15')+9
0
select day('2022-09-15')+7 between day('2022-09-15')+1 and day('2022-09-15')+9;
day('2022-09-15')+7 between day('2022-09-15')+1 and day('2022-09-15')+9
1
select day('2022-09-15')-20200912 in (1,2,3,4,5);
day('2022-09-15')-20200912 in (1,2,3,4,5)
0
select day('2022-09-15') in (11,12,13,14,15);
day('2022-09-15') in (11,12,13,14,15)
1
select day('2022-09-15') in (day('2022-09-15'),day('2022-09-15')+1,day('2022-09-15')+2);
day('2022-09-15') in (day('2022-09-15'),day('2022-09-15')+1,day('2022-09-15')+2)
1
select day('2022-09-15')-1 in (day('2022-09-15'),day('2022-09-15')+1,day('2022-09-15')+2);
day('2022-09-15')-1 in (day('2022-09-15'),day('2022-09-15')+1,day('2022-09-15')+2)
0
select day('2022-09-15') in (day('2022-09-15')+1,day('2022-09-15')+2);
day('2022-09-15') in (day('2022-09-15')+1,day('2022-09-15')+2)
0
select day('2022-09-15')-1 in (day('2022-09-15')-5,day('2022-09-15')+1,day('2022-09-15')+2);
day('2022-09-15')-1 in (day('2022-09-15')-5,day('2022-09-15')+1,day('2022-09-15')+2)
0
select day('2022-09-15')-1 in (day('2022-09-15')-5,day('2022-09-15')-1,day('2022-09-15')+2);
day('2022-09-15')-1 in (day('2022-09-15')-5,day('2022-09-15')-1,day('2022-09-15')+2)
1
select day('2022-09-15') not in (day('2022-09-15'),day('2022-09-15')+1,day('2022-09-15')+2);
day('2022-09-15') not in (day('2022-09-15'),day('2022-09-15')+1,day('2022-09-15')+2)
0
select day('2022-09-15')-1 not in (day('2022-09-15'),day('2022-09-15')+1,day('2022-09-15')+2);
day('2022-09-15')-1 not in (day('2022-09-15'),day('2022-09-15')+1,day('2022-09-15')+2)
1
select day('2022-09-15') not in (day('2022-09-15')+1,day('2022-09-15')+2);
day('2022-09-15') not in (day('2022-09-15')+1,day('2022-09-15')+2)
1
select day('2022-09-15')-1 not in (day('2022-09-15')-5,day('2022-09-15')+1,day('2022-09-15')+2);
day('2022-09-15')-1 not in (day('2022-09-15')-5,day('2022-09-15')+1,day('2022-09-15')+2)
1
select day('2022-09-15')-1  not in (day('2022-09-15')-5,day('2022-09-15')-1,day('2022-09-15')+2);
day('2022-09-15')-1  not in (day('2022-09-15')-5,day('2022-09-15')-1,day('2022-09-15')+2)
0
select day('2022-09-15') is NULL;
day('2022-09-15') is NULL
0
select day('2022-09-15')+0 is NULL;
day('2022-09-15')+0 is NULL
0
select day('2022-09-15')  like '20%';
day('2022-09-15')  like '20%'
0
select day('2022-09-15')+0  like day('2022-09-15');
day('2022-09-15')+0  like day('2022-09-15')
1
select day('2022-09-15')  like day('2022-09-15');
day('2022-09-15')  like day('2022-09-15')
1
select day('2022-09-15')+0 not like '20%';
day('2022-09-15')+0 not like '20%'
1
select day('2022-09-15')+0 not  like day('2022-09-15');
day('2022-09-15')+0 not  like day('2022-09-15')
0
select day('2022-09-15') REGEXP day('2022-09-15');
day('2022-09-15') REGEXP day('2022-09-15')
1
select day('2022-09-15') REGEXP day('2022-09-15')+0;
day('2022-09-15') REGEXP day('2022-09-15')+0
1
select day('2022-09-15')+0 REGEXP day('2022-09-15');
day('2022-09-15')+0 REGEXP day('2022-09-15')
1
select day('2022-09-15')+0 REGEXP day('2022-09-15')+0;
day('2022-09-15')+0 REGEXP day('2022-09-15')+0
1
select day('2022-09-15')&day('2022-09-15');
day('2022-09-15')&day('2022-09-15')
15
select day('2022-09-15')+0&day('2022-09-15');
day('2022-09-15')+0&day('2022-09-15')
15
select day('2022-09-15')+0&day('2022-09-15')+0;
day('2022-09-15')+0&day('2022-09-15')+0
15
select day('2022-09-15')|day('2022-09-15');
day('2022-09-15')|day('2022-09-15')
15
select day('2022-09-15')|day('2022-09-15')+1;
day('2022-09-15')|day('2022-09-15')+1
31
select day('2022-09-15')+0|day('2022-09-15')+0;
day('2022-09-15')+0|day('2022-09-15')+0
15
select day('2022-09-15')^day('2022-09-15');
day('2022-09-15')^day('2022-09-15')
0
select day('2022-09-15')^day('2022-09-15')+1;
day('2022-09-15')^day('2022-09-15')+1
1
select day('2022-09-15')+0^day('2022-09-15')+0;
day('2022-09-15')+0^day('2022-09-15')+0
30
select day('2022-09-15')>>day('2022-09-15');
day('2022-09-15')>>day('2022-09-15')
0
select day('2022-09-15')>>day('2022-09-15')+1;
day('2022-09-15')>>day('2022-09-15')+1
0
select day('2022-09-15')+0>>day('2022-09-15')+0;
day('2022-09-15')+0>>day('2022-09-15')+0
0
select day('2022-09-15')<<day('2022-09-15');
day('2022-09-15')<<day('2022-09-15')
491520
select day('2022-09-15')<<day('2022-09-15')+1;
day('2022-09-15')<<day('2022-09-15')+1
983040
select day('2022-09-15')+0<<day('2022-09-15')+0;
day('2022-09-15')+0<<day('2022-09-15')+0
491520
select ~day('2022-09-15');
~day('2022-09-15')
18446744073709551600
select ~day('2022-09-15')-10;
~day('2022-09-15')-10
18446744073709551590
select day('2022-09-15') and day('2022-09-15');
day('2022-09-15') and day('2022-09-15')
1
select day('2022-09-15')+1 and day('2022-09-15')-1;
day('2022-09-15')+1 and day('2022-09-15')-1
1
select day('2022-09-15') and day('2022-09-15')-1;
day('2022-09-15') and day('2022-09-15')-1
1
select day('2022-09-15') or day('2022-09-15');
day('2022-09-15') or day('2022-09-15')
1
select day('2022-09-15') or null;
day('2022-09-15') or null
1
select day('2022-09-15')+1 or null;
day('2022-09-15')+1 or null
1
select day('2022-09-15')+1 or day('2022-09-15')-1;
day('2022-09-15')+1 or day('2022-09-15')-1
1
select day('2022-09-15') or day('2022-09-15')-1;
day('2022-09-15') or day('2022-09-15')-1
1
select not day('2022-09-15')-1;
not day('2022-09-15')-1
0
select not day('2022-09-15');
not day('2022-09-15')
0
select !day('2022-09-15')-1;
!day('2022-09-15')-1
-1
select !day('2022-09-15');
!day('2022-09-15')
0
select day('2022-09-15') xor day('2022-09-15');
day('2022-09-15') xor day('2022-09-15')
0
select day('2022-09-15')+1 xor day('2022-09-15')-1;
day('2022-09-15')+1 xor day('2022-09-15')-1
0
select day('2022-09-15') xor day('2022-09-15')-1;
day('2022-09-15') xor day('2022-09-15')-1
0
drop table t1;
##日期时间函数校验
select CURRENT_TIME(day('2022-09-07'));
ERROR 42000: You have an error in your SQL syntax; check the manual that corresponds to your OceanBase version for the right syntax to use near 'day('2022-09-07'))' at line 1
select CURRENT_TIME(day('2022-09-07')-day('2022-09-07'));
ERROR 42000: You have an error in your SQL syntax; check the manual that corresponds to your OceanBase version for the right syntax to use near 'day('2022-09-07')-day('2022-09-07'))' at line 1
select CURRENT_TIMESTAMP(day('2022-09-07')-day('2022-09-07'));
ERROR 42000: You have an error in your SQL syntax; check the manual that corresponds to your OceanBase version for the right syntax to use near 'day('2022-09-07')-day('2022-09-07'))' at line 1
select DATE_ADD(day('2022-09-07 23:59:59'),INTERVAL '1:1' MINUTE_SECOND);
DATE_ADD(day('2022-09-07 23:59:59'),INTERVAL '1:1' MINUTE_SECOND)
NULL
SELECT day(DATE_ADD('2022-09-07 23:59:59',INTERVAL '1:1' MINUTE_SECOND));
day(DATE_ADD('2022-09-07 23:59:59',INTERVAL '1:1' MINUTE_SECOND))
8
select day(date_format('2022-01-27 13:23:00', '%Y-%c-%d'))as result;
result
27
select date_format(day('2022-01-27 13:23:00'),'%Y %c %d')as result;
result
NULL
select day('2009-10-01') = DATE_FORMAT('2009-10-01 22:23:00', '%W');
day('2009-10-01') = DATE_FORMAT('2009-10-01 22:23:00', '%W')
0
Warnings:
Warning	1292	Truncated incorrect DECIMAL value: 'Thursday'
select day(date_sub(date '2022-01-22',interval '3' day));
day(date_sub(date '2022-01-22',interval '3' day))
19
select DATE_SUB(day('2022-09-07'),INTERVAL 5 DAY);
DATE_SUB(day('2022-09-07'),INTERVAL 5 DAY)
NULL
select DATEDIFF(day('2022-09-07'),day('2021-09-07'));
DATEDIFF(day('2022-09-07'),day('2021-09-07'))
NULL
select day(DATEDIFF('2000-01-22 23:59:59','1000-01-21'));
day(DATEDIFF('2000-01-22 23:59:59','1000-01-21'))
NULL
Warnings:
Warning	5086	Not timestamp Can not cast varchar value to timestamp type
select EXTRACT(week from day('2022-09-07'));
EXTRACT(week from day('2022-09-07'))
NULL
select EXTRACT(week from day('2022-09-07'));
EXTRACT(week from day('2022-09-07'))
NULL
select from_days(day('2022-09-07'));
from_days(day('2022-09-07'))
0000-00-00
select day(from_days(738565));
day(from_days(738565))
14
select FROM_UNIXTIME(day('2022-09-07'),GET_FORMAT(DATE,'USA'));
FROM_UNIXTIME(day('2022-09-07'),GET_FORMAT(DATE,'USA'))
01.01.1970
select day(FROM_UNIXTIME(1647738456));
day(FROM_UNIXTIME(1647738456))
20
select MONTH(day('2022-09-07'));
MONTH(day('2022-09-07'))
NULL
Warnings:
Warning	5086	Not timestamp Can not cast varchar value to timestamp type
select day(month('2022-09-07'));
day(month('2022-09-07'))
NULL
Warnings:
Warning	5086	Not timestamp Can not cast varchar value to timestamp type
select PERIOD_DIFF(day('2022-09-07'),day('2022-09-07'));
PERIOD_DIFF(day('2022-09-07'),day('2022-09-07'))
0
select day(str_to_date('2022-01-06 10:20:30','%Y-%m-%d %H:%i:%s')) as result;
result
6
select STR_TO_DATE(day('2022-09-07'));
ERROR 42000: Incorrect parameter count in the call to native function 'STR_TO_DATE'
select time(day('2022-09-07 23:59:59.999999'));
time(day('2022-09-07 23:59:59.999999'))
00:00:07
select TIME_TO_SEC(day('2022-09-07'));
TIME_TO_SEC(day('2022-09-07'))
7
select day(TIME_TO_SEC('2022-09-07'));
day(TIME_TO_SEC('2022-09-07'))
22
select TIMEDIFF(day('2022-09-07'),day('2022-09-07'));
TIMEDIFF(day('2022-09-07'),day('2022-09-07'))
00:00:00
SELECT day(TIMESTAMPADD(MINUTE,1,'2003-01-02'));
day(TIMESTAMPADD(MINUTE,1,'2003-01-02'))
2
SELECT TIMESTAMPADD(WEEK,1,day('2003-01-02'));
TIMESTAMPADD(WEEK,1,day('2003-01-02'))
NULL
select TIMESTAMPDIFF(day,day('2022-09-07') , day('2022-09-07'));
TIMESTAMPDIFF(day,day('2022-09-07') , day('2022-09-07'))
NULL
select day(TIMESTAMPDIFF(MONTH,'2003-02-01','2003-05-01'));
day(TIMESTAMPDIFF(MONTH,'2003-02-01','2003-05-01'))
NULL
Warnings:
Warning	5086	Not timestamp Can not cast varchar value to timestamp type
select TO_DAYS(day('2003-02-01'));
TO_DAYS(day('2003-02-01'))
NULL
select day(TO_DAYS('2003-02-01'));
day(TO_DAYS('2003-02-01'))
NULL
Warnings:
Warning	5086	Not timestamp Can not cast varchar value to timestamp type
select SEC_TO_TIME(day('2003-02-01'));
SEC_TO_TIME(day('2003-02-01'))
00:00:01
select UNIX_TIMESTAMP(day('2022-09-07'));
UNIX_TIMESTAMP(day('2022-09-07'))
0
select day(UNIX_TIMESTAMP('2022-09-07'));
day(UNIX_TIMESTAMP('2022-09-07'))
NULL
Warnings:
Warning	5086	Not timestamp Can not cast varchar value to timestamp type
select UTC_TIMESTAMP(day('2022-09-07'));
ERROR 42000: You have an error in your SQL syntax; check the manual that corresponds to your OceanBase version for the right syntax to use near 'day('2022-09-07'))' at line 1
select YEAR(day('2022-09-07'));
YEAR(day('2022-09-07'))
NULL
Warnings:
Warning	5086	Not timestamp Can not cast varchar value to timestamp type
select day(year('2022-09-07'));
day(year('2022-09-07'))
NULL
Warnings:
Warning	5086	Not timestamp Can not cast varchar value to timestamp type
#结果不一致
select YEAR(day('2022-09-07')+10000);
YEAR(day('2022-09-07')+10000)
2001
##字符串函数
select CONCAT(day('2022-09-07'),day('2022-09-07'));
CONCAT(day('2022-09-07'),day('2022-09-07'))
77
select CONCAT_WS('_',day('2022-09-07'),day('2022-09-07'));
CONCAT_WS('_',day('2022-09-07'),day('2022-09-07'))
7_7
select FORMAT(day('2022-09-08'),3);
FORMAT(day('2022-09-08'),3)
8.000
select day(FORMAT(1025.12356,2));
day(FORMAT(1025.12356,2))
NULL
Warnings:
Warning	5086	Not timestamp Can not cast varchar value to timestamp type
select SUBSTR(day('2022-09-07'),1);
SUBSTR(day('2022-09-07'),1)
7
select day(SUBSTR('20220907',1));
day(SUBSTR('20220907',1))
7
select SUBSTRING(day('2022-09-07'),1,1);
SUBSTRING(day('2022-09-07'),1,1)
7
select day(SUBSTRING('2022-09-07',1,10));
day(SUBSTRING('2022-09-07',1,10))
7
select TRIM(  day(' 2022-09-07  ')  );
TRIM(  day(' 2022-09-07  ')  )
7
select day(TRIM(' 2022-09-07 '));
day(TRIM(' 2022-09-07 '))
7
select RTRIM(day('2022-09-07'));
RTRIM(day('2022-09-07'))
7
select day(RTRIM('2022-09-07'));
day(RTRIM('2022-09-07'))
7
select ascii(day('2022-09-07'));
ascii(day('2022-09-07'))
55
select day(ascii('2022-09-07'));
day(ascii('2022-09-07'))
NULL
Warnings:
Warning	5086	Not timestamp Can not cast varchar value to timestamp type
select ORD(day('2022-09-07'));
ORD(day('2022-09-07'))
55
select day(ORD('2022-09-07'));
day(ORD('2022-09-07'))
NULL
Warnings:
Warning	5086	Not timestamp Can not cast varchar value to timestamp type
select LENGTH(day('2022-09-07'));
LENGTH(day('2022-09-07'))
1
select day(LENGTH('2022-09-07'));
day(LENGTH('2022-09-07'))
NULL
Warnings:
Warning	5086	Not timestamp Can not cast varchar value to timestamp type
select CHAR_LENGTH(day('2022-09-07'));
CHAR_LENGTH(day('2022-09-07'))
1
select day(CHAR_LENGTH('2022-09-07'));
day(CHAR_LENGTH('2022-09-07'))
NULL
Warnings:
Warning	5086	Not timestamp Can not cast varchar value to timestamp type
select UPPER(day('2022-09-07'));
UPPER(day('2022-09-07'))
7
select day(UPPER('2022-09-07'));
day(UPPER('2022-09-07'))
7
select lower(day('2022-09-07'));
lower(day('2022-09-07'))
7
select day(lower('2022-09-07'));
day(lower('2022-09-07'))
7
select HEX(day('2022-09-07'));
HEX(day('2022-09-07'))
7
select day(HEX('2022-09-07'));
day(HEX('2022-09-07'))
NULL
Warnings:
Warning	5086	Not timestamp Can not cast varchar value to timestamp type
select UNHEX(day('2022-09-07'));
UNHEX(day('2022-09-07'))

select day(UNHEX('2022-09-07'));
day(UNHEX('2022-09-07'))
NULL
select MD5(day('2022-09-07'));
MD5(day('2022-09-07'))
8f14e45fceea167a5a36dedd4bea2543
select day(MD5('2022-09-07'));
day(MD5('2022-09-07'))
NULL
Warnings:
Warning	5086	Not timestamp Can not cast varchar value to timestamp type
select INT2IP(day('2022-09-07'));
INT2IP(day('2022-09-07'))
0.0.0.7
select day(INT2IP('2022-09-07'));
day(INT2IP('2022-09-07'))
7
Warnings:
Warning	1292	Truncated incorrect INTEGER value: '2022-09-07'
SELECT day('2022-09-07') LIKE 'W%';
day('2022-09-07') LIKE 'W%'
0
SELECT day('2022-09-07') REGEXP day('2022-09-08');
day('2022-09-07') REGEXP day('2022-09-08')
0
SELECT REPEAT(day('2022-09-07'), 5);
REPEAT(day('2022-09-07'), 5)
77777
SELECT day(REPEAT('2022-09-07',1));
day(REPEAT('2022-09-07',1))
7
SELECT REPEAT(day('2022-09-07'), day('2022-09-07'));
REPEAT(day('2022-09-07'), day('2022-09-07'))
7777777
SELECT SPACE(day('2022-09-07'),0);
ERROR 42000: Incorrect parameter count in the call to native function 'SPACE'
SELECT day(SPACE('2022-09-07'));
day(SPACE('2022-09-07'))
NULL
Warnings:
Warning	1292	Truncated incorrect INTEGER value: '2022-09-07'
Warning	5086	Not timestamp Can not cast varchar value to timestamp type
SELECT SUBSTRING_INDEX(day('2022-09-07'),' ',1);
SUBSTRING_INDEX(day('2022-09-07'),' ',1)
7
SELECT day(SUBSTRING_INDEX('2022-09-07','-',3));
day(SUBSTRING_INDEX('2022-09-07','-',3))
7
SELECT LOCATE(day('2022-09-07'),day('2022-09-07'));
LOCATE(day('2022-09-07'),day('2022-09-07'))
1
SELECT LOCATE(day('2022-09-07'),day('2022-09-08'));
LOCATE(day('2022-09-07'),day('2022-09-08'))
0
SELECT POSITION(day('2022-09-07') in day('2022-09-07'));
POSITION(day('2022-09-07') in day('2022-09-07'))
1
SELECT POSITION(day('2022-09-07') in day('2022-09-08'));
POSITION(day('2022-09-07') in day('2022-09-08'))
0
SELECT INSTR(day('2022-09-07'),day('2022-09-07'));
INSTR(day('2022-09-07'),day('2022-09-07'))
1
SELECT INSTR(day('2022-09-07'),day('2022-09-08'));
INSTR(day('2022-09-07'),day('2022-09-08'))
0
SELECT REPLACE(day('2022-09-07'),day('2022-09-07'),day('2022-09-07'));
REPLACE(day('2022-09-07'),day('2022-09-07'),day('2022-09-07'))
7
SELECT REPLACE(day('2022-09-07'),day('2022-09-07'),day('2022-09-08'));
REPLACE(day('2022-09-07'),day('2022-09-07'),day('2022-09-08'))
8
SELECT FIELD(day('2022-09-07'),day('2022-09-07'),day('2022-09-07'));
FIELD(day('2022-09-07'),day('2022-09-07'),day('2022-09-07'))
1
SELECT FIELD(day('2022-09-07'),day('2022-09-07'),day('2022-09-08'));
FIELD(day('2022-09-07'),day('2022-09-07'),day('2022-09-08'))
1
SELECT ELT(1,day('2022-09-07'),day('2022-09-07'));
ELT(1,day('2022-09-07'),day('2022-09-07'))
7
SELECT ELT(2,day('2022-09-07'),day('2022-09-08'));
ELT(2,day('2022-09-07'),day('2022-09-08'))
8
SELECT LPAD(day('2022-09-07'),day('2022-09-07'),day('2022-09-07'));
LPAD(day('2022-09-07'),day('2022-09-07'),day('2022-09-07'))
7777777
SELECT RPAD(day('2022-09-07'),day('2022-09-07'),day('2022-09-07'));
RPAD(day('2022-09-07'),day('2022-09-07'),day('2022-09-07'))
7777777
SELECT bin(day('2022-09-07'));
bin(day('2022-09-07'))
111
SELECT bin(day('2022-09-08'));
bin(day('2022-09-08'))
1000
SELECT quote(day('2022-09-07'));
quote(day('2022-09-07'))
'7'
SELECT quote(day('2022-09-08'));
quote(day('2022-09-08'))
'8'
SELECT REGEXP_SUBSTR(day('2022-09-07'));
ERROR 42000: Incorrect parameter count in the call to native function 'REGEXP_SUBSTR'
##转换函数与数学函数
select CAST(day('2022-09-07') as date);
CAST(day('2022-09-07') as date)
NULL
select CAST(day('2022-09-07') as time);
CAST(day('2022-09-07') as time)
00:00:07
select day(CAST('2022-09-07' as date));
day(CAST('2022-09-07' as date))
7
select ROUND(day(2022-09-07),1);
ROUND(day(2022-09-07),1)
NULL
Warnings:
Warning	5086	Not timestamp Can not cast varchar value to timestamp type
select day(round(20220907.984));
day(round(20220907.984))
8
select day(ROUND('2022-09-07'),ROUND('2022-09-07'));
ERROR 42000: You have an error in your SQL syntax; check the manual that corresponds to your OceanBase version for the right syntax to use near ',ROUND('2022-09-07'))' at line 1
select ROUND(day('2022-09-07'),day('2022-09-07')-20200916);
ROUND(day('2022-09-07'),day('2022-09-07')-20200916)
0
select day(CEIL('20220907'));
day(CEIL('20220907'))
7
select day(CEIL('20220908 23:59:59.999999'));
day(CEIL('20220908 23:59:59.999999'))
8
Warnings:
Warning	1292	Truncated incorrect DOUBLE value: '20220908 23:59:59.999999'
select day(FLOOR('20220907'));
day(FLOOR('20220907'))
7
select day(FLOOR('20220908 23:59:59.999999'));
day(FLOOR('20220908 23:59:59.999999'))
8
Warnings:
Warning	1292	Truncated incorrect DOUBLE value: '20220908 23:59:59.999999'
select day(ABS(20220907+1));
day(ABS(20220907+1))
8
select day(ABS(20220908-1));
day(ABS(20220908-1))
7
select day(SIGN(20220907));
day(SIGN(20220907))
NULL
Warnings:
Warning	5086	Not timestamp Can not cast varchar value to timestamp type
select day(SIGN(20220907));
day(SIGN(20220907))
NULL
Warnings:
Warning	5086	Not timestamp Can not cast varchar value to timestamp type
select day(CONV(20220907+1));
ERROR 42000: Incorrect parameter count in the call to native function 'CONV'
select day(CONV(20220907-1));
ERROR 42000: Incorrect parameter count in the call to native function 'CONV'
select MOD(day('2022-09-07'),1);
MOD(day('2022-09-07'),1)
0
select day(MOD(20220907,1));
day(MOD(20220907,1))
0
select POW(day(20220907),null);
POW(day(20220907),null)
NULL
select day(POW(20220907),1);
ERROR 42000: You have an error in your SQL syntax; check the manual that corresponds to your OceanBase version for the right syntax to use near ',1)' at line 1
select POWER(day(20220907),null);
POWER(day(20220907),null)
NULL
select day(POWER(20220907),1);
ERROR 42000: You have an error in your SQL syntax; check the manual that corresponds to your OceanBase version for the right syntax to use near ',1)' at line 1
select rand(day(2022-09-07));
rand(day(2022-09-07))
0.15522042769493574
Warnings:
Warning	5086	Not timestamp Can not cast varchar value to timestamp type
select day(rand(2022-09-07));
day(rand(2022-09-07))
0
##流程控制函数与比较函数
select GREATEST(day('2022-09-07'),'1');
GREATEST(day('2022-09-07'),'1')
7
select LEAST(day('2022-09-07'),'1');
LEAST(day('2022-09-07'),'1')
1
select isnull(day('2022-09-07'));
isnull(day('2022-09-07'))
0
select isnull(day('2022-09-07')+0);
isnull(day('2022-09-07')+0)
0
select CASE day('2022-09-08') when day('2022-09-08') then 1 when day('2022-09-07') then 2 END as result;
result
1
select if(day('2022-09-07')<day('2022-09-08'),day('2022-09-07'),day('2022-09-08')) as result;
result
7
select ifnull(null,day('2022-09-07'));
ifnull(null,day('2022-09-07'))
7
select nullif(day('2022-09-07'),day('2022-09-07'));
nullif(day('2022-09-07'),day('2022-09-07'))
NULL
select COALESCE(day('2022-09-07'));
COALESCE(day('2022-09-07'))
7
select sleep(day(20200900));
sleep(day(20200900))
0
##使用场景 
##表table
##create as select
drop table t1;
drop table t2;
create table t1 (c1 int ,c2 varchar(20),c3 date);
insert into t1 values(1,'test01','20220907');
insert into t1 values(2,'test02','20220909');
insert into t1 values(3,'test03','2022-08-20');
insert into t1 values(4,'test04','2022-09-15');
insert into t1 values(5,'test05','2022-09-16');
select day(c3) as a from t1;
a
7
9
20
15
16
create table t2 as select day(c3) from t1;
select * from t2;
day(c3)
7
9
20
15
16
drop table t2;
select DATEDIFF(day(c3)-1,day(c3)) from t1;
DATEDIFF(day(c3)-1,day(c3))
NULL
NULL
NULL
NULL
NULL
select MOD(day('2022-09-15')+5,day('2022-09-15')) from t1;
MOD(day('2022-09-15')+5,day('2022-09-15'))
5
5
5
5
5
select time(day('2022-09-15')),COALESCE(day('2022-09-15')) from t1;
time(day('2022-09-15'))	COALESCE(day('2022-09-15'))
00:00:15	15
00:00:15	15
00:00:15	15
00:00:15	15
00:00:15	15
SELECT INSTR(day('2022-09-15'),day('2022-09-15')+0) from t1;
INSTR(day('2022-09-15'),day('2022-09-15')+0)
1
1
1
1
1
select LENGTH(day('2022-09-15')+1),LENGTH(day('2022-09-15')) from t1;
LENGTH(day('2022-09-15')+1)	LENGTH(day('2022-09-15'))
2	2
2	2
2	2
2	2
2	2
SELECT LOCATE(2,day('2022-09-15')+0,day('2022-09-15')-20200911) from t1;
LOCATE(2,day('2022-09-15')+0,day('2022-09-15')-20200911)
0
0
0
0
0
select MD5(day('2022-09-15')),MD5(day('2022-09-15')+1) from t1;
MD5(day('2022-09-15'))	MD5(day('2022-09-15')+1)
9bf31c7ff062936a96d3c8bd1f8f2ff3	c74d97b01eae257e44aa9d5bade97baf
9bf31c7ff062936a96d3c8bd1f8f2ff3	c74d97b01eae257e44aa9d5bade97baf
9bf31c7ff062936a96d3c8bd1f8f2ff3	c74d97b01eae257e44aa9d5bade97baf
9bf31c7ff062936a96d3c8bd1f8f2ff3	c74d97b01eae257e44aa9d5bade97baf
9bf31c7ff062936a96d3c8bd1f8f2ff3	c74d97b01eae257e44aa9d5bade97baf
##聚合函数
select count(day(c3)) from t1;
count(day(c3))
5
select sum(day(c3)) from t1;
sum(day(c3))
67
select avg(day(c3)) from t1;
avg(day(c3))
13.4000
select min(day(c3)) from t1;
min(day(c3))
7
select max(day(c3)) from t1;
max(day(c3))
20
select GROUP_CONCAT(day(c3)) from t1;
GROUP_CONCAT(day(c3))
7,9,20,15,16
##where子句
select t1.*, day(c3) from t1 where day(c3)=7;
c1	c2	c3	day(c3)
1	test01	2022-09-07	7
select t1.*, day(c3) from t1 where day(c3)>='7';
c1	c2	c3	day(c3)
1	test01	2022-09-07	7
2	test02	2022-09-09	9
3	test03	2022-08-20	20
4	test04	2022-09-15	15
5	test05	2022-09-16	16
select t1.*, day(c3) from t1 where day(c3)<='7';
c1	c2	c3	day(c3)
1	test01	2022-09-07	7
select t1.*, day(c3) from t1 where day(c3)='7';
c1	c2	c3	day(c3)
1	test01	2022-09-07	7
select t1.*, day(c3) from t1 where day(c3)<'9';
c1	c2	c3	day(c3)
1	test01	2022-09-07	7
select t1.*, day(c3) from t1 where day(c3)>'9';
c1	c2	c3	day(c3)
3	test03	2022-08-20	20
4	test04	2022-09-15	15
5	test05	2022-09-16	16
select t1.*, day(c3) from t1 where day(c3) between '9' and '7';
c1	c2	c3	day(c3)
select t1.*, day(c3) from t1 where day(c3) like '7%';
c1	c2	c3	day(c3)
1	test01	2022-09-07	7
select t1.*, day(c3) from t1 where exists (select day(c3));
c1	c2	c3	day(c3)
1	test01	2022-09-07	7
2	test02	2022-09-09	9
3	test03	2022-08-20	20
4	test04	2022-09-15	15
5	test05	2022-09-16	16
select t1.*, day(c3) from t1 where '7' in  (select day(c3));
c1	c2	c3	day(c3)
1	test01	2022-09-07	7
select t1.*, day(c3) from t1 where '50' > all(select day(c3));
c1	c2	c3	day(c3)
1	test01	2022-09-07	7
2	test02	2022-09-09	9
3	test03	2022-08-20	20
4	test04	2022-09-15	15
5	test05	2022-09-16	16
select t1.*, day(c3) from t1 where c1 =2 or c2 ='test03';
c1	c2	c3	day(c3)
2	test02	2022-09-09	9
3	test03	2022-08-20	20
select t1.*, day(c3) from t1 where c1 =2 and c2 ='test02';
c1	c2	c3	day(c3)
2	test02	2022-09-09	9
create table t2(a1 int ,a2 int);
insert into t2 values(1,1);
insert into t2 values(2,2);
insert into t2 values(3,3);
select t1.*,day(c3) from t1 inner join t2 on t1.c1=t2.a1;
c1	c2	c3	day(c3)
1	test01	2022-09-07	7
2	test02	2022-09-09	9
3	test03	2022-08-20	20
select t1.*,day(c3) from t1 left join t2 on t1.c1=t2.a1;
c1	c2	c3	day(c3)
1	test01	2022-09-07	7
2	test02	2022-09-09	9
3	test03	2022-08-20	20
4	test04	2022-09-15	15
5	test05	2022-09-16	16
select t1.*,day(c3) from t1 right join t2 on t1.c1=t2.a1;
c1	c2	c3	day(c3)
1	test01	2022-09-07	7
2	test02	2022-09-09	9
3	test03	2022-08-20	20
mysql5.7不支持
with tt as (select day(c3)  from t1)  select * from tt;
day(c3)
7
9
20
15
16
select day(c3)+day(c3) from t1 where c1>3;
day(c3)+day(c3)
30
32
select day(c3)-day(c3) from t1;
day(c3)-day(c3)
0
0
0
0
0
select day(c3)*day(c3) from t1;
day(c3)*day(c3)
49
81
400
225
256
select day(c3)/day(c3) from t1;
day(c3)/day(c3)
1.0000
1.0000
1.0000
1.0000
1.0000
select day(c3)%day(c3) from t1;
day(c3)%day(c3)
0
0
0
0
0
select day(c3) div day(c3) from t1;
day(c3) div day(c3)
1
1
1
1
1
select day(c3) mod day(c3) from t1;
day(c3) mod day(c3)
0
0
0
0
0
select -day(c3) from t1;
-day(c3)
-7
-9
-20
-15
-16
select +day(c3) from t1;
+day(c3)
7
9
20
15
16
select day(c3)+0+day(c3) from t1 where c1>3;
day(c3)+0+day(c3)
30
32
select day(c3)-day(c3)+0 from t1;
day(c3)-day(c3)+0
0
0
0
0
0
select day(c3)*day(c3)+0 from t1;
day(c3)*day(c3)+0
49
81
400
225
256
select day(c3)+0/day(c3) from t1;
day(c3)+0/day(c3)
7.0000
9.0000
20.0000
15.0000
16.0000
select day(c3)%day(c3)+0 from t1;
day(c3)%day(c3)+0
0
0
0
0
0
select day(c3)+0 div day(c3) from t1;
day(c3)+0 div day(c3)
7
9
20
15
16
select day(c3) mod day(c3)+0 from t1;
day(c3) mod day(c3)+0
0
0
0
0
0
select -day(c3)+0 from t1;
-day(c3)+0
-7
-9
-20
-15
-16
select +day(c3)+0 from t1;
+day(c3)+0
7
9
20
15
16
select day(c3)+0+day(c3)+0 from t1 where c1=3;
day(c3)+0+day(c3)+0
40
select day(c3)+0-day(c3)+0 from t1;
day(c3)+0-day(c3)+0
0
0
0
0
0
select day(c3)+0*day(c3)+0 from t1;
day(c3)+0*day(c3)+0
7
9
20
15
16
select day(c3)+0/day(c3)+0 from t1;
day(c3)+0/day(c3)+0
7.0000
9.0000
20.0000
15.0000
16.0000
select day(c3)+0%day(c3)+0 from t1;
day(c3)+0%day(c3)+0
7
9
20
15
16
select day(c3)+0 div day(c3)+0 from t1;
day(c3)+0 div day(c3)+0
7
9
20
15
16
select day(c3)+0 mod day(c3)+0 from t1;
day(c3)+0 mod day(c3)+0
7
9
20
15
16
select distinct day(c3) from t1;
day(c3)
7
9
20
15
16
select distinct day(c3)+20 from t1;
day(c3)+20
27
29
40
35
36
select  day(c3) from t1;
day(c3)
7
9
20
15
16
select  day(c3)+1 from t1;
day(c3)+1
8
10
21
16
17
select t1.*,day(c3)-0, day(c3) from t1 group by c1;
c1	c2	c3	day(c3)-0	day(c3)
1	test01	2022-09-07	7	7
2	test02	2022-09-09	9	9
3	test03	2022-08-20	20	20
4	test04	2022-09-15	15	15
5	test05	2022-09-16	16	16
select t1.*,day(c3)-0, day(c3) from t1 group by day(c3),day(c3)+0;
c1	c2	c3	day(c3)-0	day(c3)
1	test01	2022-09-07	7	7
2	test02	2022-09-09	9	9
3	test03	2022-08-20	20	20
4	test04	2022-09-15	15	15
5	test05	2022-09-16	16	16
select t1.*,day(c3)-0, day(c3) from t1 group by day(c3) having day(c3)>='2020-09-13';
c1	c2	c3	day(c3)-0	day(c3)
Warnings:
Warning	1292	Truncated incorrect DECIMAL value: '2020-09-13'
Warning	1292	Truncated incorrect DECIMAL value: '2020-09-13'
select t1.*,day(c3)-0, day(c3) from t1 group by day(c3) having day(c3)-0>='2020-09-13';
c1	c2	c3	day(c3)-0	day(c3)
Warnings:
Warning	1292	Truncated incorrect DECIMAL value: '2020-09-13'
Warning	1292	Truncated incorrect DECIMAL value: '2020-09-13'
select t1.*,day(c3)-0, day(c3) from t1 order by day(c3);
c1	c2	c3	day(c3)-0	day(c3)
1	test01	2022-09-07	7	7
2	test02	2022-09-09	9	9
4	test04	2022-09-15	15	15
5	test05	2022-09-16	16	16
3	test03	2022-08-20	20	20
select t1.*,day(c3)-0, day(c3) from t1 order by day(c3)+0;
c1	c2	c3	day(c3)-0	day(c3)
1	test01	2022-09-07	7	7
2	test02	2022-09-09	9	9
4	test04	2022-09-15	15	15
5	test05	2022-09-16	16	16
3	test03	2022-08-20	20	20
select t1.*,day(c3)-0, day(c3) from t1  where 9 =day(c3) order by day(c3);
c1	c2	c3	day(c3)-0	day(c3)
2	test02	2022-09-09	9	9
select t1.*,day(c3)-0, day(c3) from t1 where 9 =day(c3)+0 order by day(c3)+0;
c1	c2	c3	day(c3)-0	day(c3)
2	test02	2022-09-09	9	9
select t1.* , case day(c3)  when day(c3)  then day(c3)  when day(c3)+1  then    day(c3)+1  end as a  from t1;
c1	c2	c3	a
1	test01	2022-09-07	7
2	test02	2022-09-09	9
3	test03	2022-08-20	20
4	test04	2022-09-15	15
5	test05	2022-09-16	16
select t1.* , case day(c3)+1  when day(c3)  then day(c3)  when day(c3)+1  then    day(c3)+1  end as a  from t1;
c1	c2	c3	a
1	test01	2022-09-07	8
2	test02	2022-09-09	10
3	test03	2022-08-20	21
4	test04	2022-09-15	16
5	test05	2022-09-16	17
select count(day(c3)) from t1;
count(day(c3))
5
select count(day(c3)+0) from t1;
count(day(c3)+0)
5
select sum(day(c3)) from t1;
sum(day(c3))
67
select sum(day(c3)+0) from t1;
sum(day(c3)+0)
67
select avg(day(c3)) from t1;
avg(day(c3))
13.4000
select avg(day(c3)+0) from t1;
avg(day(c3)+0)
13.4000
select min(day(c3)) from t1;
min(day(c3))
7
select min(day(c3)+0) from t1;
min(day(c3)+0)
7
select max(day(c3)) from t1;
max(day(c3))
20
select max(day(c3)+0) from t1;
max(day(c3)+0)
20
select GROUP_CONCAT(day(c3)) from t1;
GROUP_CONCAT(day(c3))
7,9,20,15,16
select GROUP_CONCAT(day(c3)+0) from t1;
GROUP_CONCAT(day(c3)+0)
7,9,20,15,16
drop table t2;
drop table t1;
create table t1(c1 int,c2 varchar(20));
create table t2(c1 int,c2 varchar(20));
insert into t1 values(1,'2022-09-15');
insert into t1 values(2,'2022-09-14');
insert into t2 values(1,'2022-09-16');
insert into t1 values(3,'2022-09-13');
select day(c2),day(c2)+0 from t1 union select day(c2),day(c2)+0 from t2;
day(c2)	day(c2)+0
15	15
14	14
13	13
16	16
select day(c2),day(c2)+0 from t1 union all select day(c2),day(c2)+0 from t2;
day(c2)	day(c2)+0
15	15
14	14
13	13
16	16
select day(c2),day(c2)+0 from t1 intersect select day(c2),day(c2)+0 from t2;
day(c2)	day(c2)+0
select day(c2),day(c2)+1 from t1 except select day(c2),day(c2)+0 from t2;
day(c2)	day(c2)+1
15	16
14	15
13	14
select day(c2),day(c2)+2 from t1 minus select day(c2),day(c2)+0 from t2;
day(c2)	day(c2)+2
15	17
14	16
13	15
drop table t2;
drop table t1;
##insert into
create table t1(a bool,b bool);
insert into t1 values(111,111.999999);
select day(a) from t1;
day(a)
11
select day(b) from t1;
day(b)
12
drop table t1;
create table t1(a BOOLEAN,b BOOLEAN);
insert into t1 values(111,111.999999);
select day(a) from t1;
day(a)
11
select day(b) from t1;
day(b)
12
drop table t1;
create table t1(a TINYINT,b TINYINT);
insert into t1 values(126.999999,12.22);
select day(a) from t1;
day(a)
27
select day(b) from t1;
day(b)
NULL
Warnings:
Warning	5086	Not timestamp Can not cast varchar value to timestamp type
drop table t1;
create table t1(a SMALLINT,b SMALLINT);
insert into t1 values(20913.999999,927.1111);
select day(a) from t1;
day(a)
14
select day(b) from t1;
day(b)
27
drop table t1;
create table t1(a MEDIUMINT,b MEDIUMINT);
insert into t1 values(220929.99,220927.1111);
select day(a) from t1;
day(a)
30
select day(b) from t1;
day(b)
27
drop table t1;
create table t1(a INT,b int);
insert into t1 values(220913.999999,220927.1111);
select day(a) from t1;
day(a)
14
select day(b) from t1;
day(b)
27
drop table t1;
create table t1(a INTEGER,b INTEGER);
insert into t1 values(220913.999999,220927.1111);
select day(a) from t1;
day(a)
14
select day(b) from t1;
day(b)
27
drop table t1;
create table t1(a BIGINT,b BIGINT);
insert into t1 values(220913.999999,220927.1111);
select day(a) from t1;
day(a)
14
select day(b) from t1;
day(b)
27
drop table t1;
create table t1(a DECIMAL,b DECIMAL);
insert into t1 values(220913.999999,220927.1111);
Warnings:
Warning	1265	Data truncated for column 'a' at row 1
Warning	1265	Data truncated for column 'b' at row 1
select day(a) from t1;
day(a)
14
select day(b) from t1;
day(b)
27
drop table t1;
create table t1(a NUMERIC,b NUMERIC);
insert into t1 values(220913.999999,220927.1111);
Warnings:
Warning	1265	Data truncated for column 'a' at row 1
Warning	1265	Data truncated for column 'b' at row 1
select day(a) from t1;
day(a)
14
select day(b) from t1;
day(b)
27
drop table t1;
create table t1(a FLOAT,b FLOAT);
insert into t1 values(220913.999999,220927.1111);
select day(a) from t1;
day(a)
14
select day(b) from t1;
day(b)
27
drop table t1;
create table t1(a DOUBLE,b DOUBLE);
insert into t1 values(220929.999999,220927.1111);
select day(a) from t1;
day(a)
29
select day(b) from t1;
day(b)
27
drop table t1;
create table t1(a BIT,b bit);
insert into t1 values(0,1);
select day(a) from t1;
day(a)
NULL
Warnings:
Warning	5086	Not timestamp Can not cast varchar value to timestamp type
select day(b) from t1;
day(b)
NULL
Warnings:
Warning	5086	Not timestamp Can not cast varchar value to timestamp type
drop table t1;
create table t1(a DATETIME,b DATETIME);
insert into t1 values(220913,220927);
select day(a) from t1;
day(a)
13
select day(b) from t1;
day(b)
27
drop table t1;
create table t1(a TIMESTAMP,b TIMESTAMP);
insert into t1 values('2022-09-13 23:59:59.999999','2038-01-19 03:14:07.999999');
select day(a) from t1;
day(a)
14
select day(b) from t1;
day(b)
19
drop table t1;
create table t1(a DATE,b DATE);
insert into t1 values('1970-01-01 23:59:59','2038-01-19 03:14:07');
select day(a) from t1;
day(a)
1
select day(b) from t1;
day(b)
19
drop table t1;
create table t1(a TIME,b TIME);
insert into t1 values('23:59:59.999999','2038-01-19 23:59:59.999999');
drop table t1;
create table t1(a YEAR,b year);
insert into t1 values('2022','2038');
select day(a) from t1;
day(a)
NULL
Warnings:
Warning	5086	Not timestamp Can not cast varchar value to timestamp type
select day(b) from t1;
day(b)
NULL
Warnings:
Warning	5086	Not timestamp Can not cast varchar value to timestamp type
drop table t1;
create table t1(a VARCHAR(50),b VARCHAR(50));
insert into t1 values('2022-09-27 23:59:59.999999','2038-01-19 23:59:59.999999');
select day(a) from t1;
day(a)
27
select day(b) from t1;
day(b)
19
drop table t1;
create table t1(a VARBINARY(50),b VARBINARY(50));
insert into t1 values('2022-09-27 23:59:59.999999','2038-01-19 23:59:59.999999');
select day(a) from t1;
day(a)
27
select day(b) from t1;
day(b)
19
drop table t1;
create table t1(a CHAR(50),b CHAR(50));
insert into t1 values('2022-09-27 23:59:59.999999','2038-01-19 23:59:59.999999');
select day(a) from t1;
day(a)
27
select day(b) from t1;
day(b)
19
drop table t1;
create table t1(a BINARY(10),b BINARY(10));
insert into t1 values('10111101','11111011');
select day(a) from t1;
day(a)
NULL
Warnings:
Warning	5086	Not timestamp Can not cast varchar value to timestamp type
select day(b) from t1;
day(b)
NULL
Warnings:
Warning	5086	Not timestamp Can not cast varchar value to timestamp type
drop table t1;
create table t1(a enum ('2022-09-27 23:59:59.999999','2038-01-19 23:59:59.999999'),b enum ('10111101','11111011'));
insert into t1 values('2022-09-27 23:59:59.999999','10111101');
select day(a) from t1;
day(a)
27
select day(b) from t1;
day(b)
1
drop table t1;
create table t1(a set ('2022-09-27 23:59:59.999999','2038-01-19 23:59:59.999999'),b set ('10111101','11111011'));
insert into t1 values('2022-09-27 23:59:59.999999','10111101');
select day(a) from t1;
day(a)
27
select day(b) from t1;
day(b)
1
drop table t1;
create table t1(a TINYTEXT,b TINYTEXT);
insert into t1 values('2022-09-27 23:59:59.999999','10111101');
select day(a) from t1;
day(a)
27
select day(b) from t1;
day(b)
1
drop table t1;
create table t1(a TINYBLOB,b TINYBLOB);
insert into t1 values('2022-09-27 23:59:59.999999','10111101');
select day(a) from t1;
day(a)
27
select day(b) from t1;
day(b)
1
drop table t1;
create table t1(a TEXT,b TEXT);
insert into t1 values('2022-09-27 23:59:59.999999','10111101');
select day(a) from t1;
day(a)
27
select day(b) from t1;
day(b)
1
drop table t1;
create table t1(a BLOB,b BLOB);
insert into t1 values('2022-09-27 23:59:59.999999','10111101');
select day(a) from t1;
day(a)
27
select day(b) from t1;
day(b)
1
drop table t1;
create table t1(a MEDIUMTEXT,b MEDIUMTEXT);
insert into t1 values('2022-09-27 23:59:59.999999','10111101');
select day(a) from t1;
day(a)
27
select day(b) from t1;
day(b)
1
drop table t1;
create table t1(a MEDIUMBLOB,b MEDIUMBLOB);
insert into t1 values('2022-09-27 23:59:59.999999','10111101');
select day(a) from t1;
day(a)
27
select day(b) from t1;
day(b)
1
drop table t1;
create table t1(a LONGTEXT,b LONGTEXT);
insert into t1 values('2022-09-27 23:59:59.999999','10111101');
select day(a) from t1;
day(a)
27
select day(b) from t1;
day(b)
1
drop table t1;
create table t1(a LONGBLOB,b LONGBLOB);
insert into t1 values('2022-09-27 23:59:59.999999','10111101');
select day(a) from t1;
day(a)
27
select day(b) from t1;
day(b)
1
drop table t1;
create table t1 (c1 int ,c2 varchar(40),c3 date);
insert into t1 values(1,'test01','20220811');
insert into t1 values(2,'test02','20220915');
insert into t1 values(3,'test03','2022-08-20');
insert into t1 values(4,'test04','2022-09-15');
select * from t1;
c1	c2	c3
1	test01	2022-08-11
2	test02	2022-09-15
3	test03	2022-08-20
4	test04	2022-09-15
drop table t2;
create table t2 (a1 int ,a2 varchar(20));
insert into t2(a1, a2)  select 1,day('2022-09-15');
select * from t2;
a1	a2
1	15
drop table t2;
insert into t1(c1) values(-day('2022-09-15'));
insert into t1(c1) values(+day('2022-09-15'));
insert into t1(c2) values(-day('2022-09-15'));
insert into t1(c1) values(day('2022-09-15')+day('2022-09-15'));
insert into t1(c1) values(day('2022-09-15')*day('2022-09-15'));
insert into t1(c1) values(day('2022-09-15')/1);
##预期插入失败,OB插入成功,此处bug
insert into t1 values(day('2022-09-15')%1,day('2022-09-15')%1,day('2022-09-15')%1);
insert into t1 values(day('2022-09-15') mod 1,day('2022-09-15') mod 1,day('2022-09-15') mod 1);
insert into t1 values(day('2022-09-15') div 1,day('2022-09-15') div 1,day('2022-09-15') div 1);
ERROR 22007: Incorrect datetime value for column 'c3' at row 1
insert into t1 values(day('2022-09-15')+0%1,day('2022-09-15')+1%1,day('2022-09-15')+1%1);
ERROR 22007: Incorrect datetime value for column 'c3' at row 1
insert into t1 values(day('2022-09-15')-1 div 1,day('2022-09-15')-2 div 1,day('2022-09-15')-1 div 1);
ERROR 22007: Incorrect datetime value for column 'c3' at row 1
insert into t1 values(day('2022-09-15')-1 mod 1,day('2022-09-15')-1 mod 1,day('2022-09-15')-1 mod 1);
ERROR 22007: Incorrect datetime value for column 'c3' at row 1
insert into t1 values(day('2022-09-15')-1 * 1,day('2022-09-15')-1 * 1,day('2022-09-15')-1 * 1);
ERROR 22007: Incorrect datetime value for column 'c3' at row 1
select * from t1;
c1	c2	c3
1	test01	2022-08-11
2	test02	2022-09-15
3	test03	2022-08-20
4	test04	2022-09-15
-15	NULL	NULL
15	NULL	NULL
NULL	-15	NULL
30	NULL	NULL
225	NULL	NULL
15	NULL	NULL
0	0	0000-00-00
0	0	0000-00-00
drop table t1;
## update
create table t1 (c1 int ,c2 varchar(20),c3 date);
insert into t1 values(1,'test01','20220811');
insert into t1 values(2,'test02','20220915');
insert into t1 values(3,'test03','2022-08-20');
insert into t1 values(4,'test04','2022-09-15');
update t1 set c1= day(20220811) where c2='test01';
update t1 set c1= day(20220811)+0 where c2='test01';
update t1 set c1= day(20220811) where c2 in ('test01','test02');
update t1 set c1= day(20220811),c3=day(20220811) where c2 in ('test01','test02');
ERROR 22007: Incorrect datetime value for column 'c3' at row 1
update t1 set c1= day(20220811),c3=day(20220811)+0 where c2 in ('test01','test02');
ERROR 22007: Incorrect datetime value for column 'c3' at row 1
update t1 set c1= day(20220811) where c3>day(20220811);
ERROR 22007: Incorrect value
update t1 set c1= day(20220811)+0  where c3>day(20220811)+0;
ERROR 22007: Incorrect value
update t1 set c1= day(20220811) where c3>day(20220811);
ERROR 22007: Incorrect value
update t1 set c1= day(20220811)+0  where c3<day(20220811)+0;
ERROR 22007: Incorrect value
update t1 set c1= day(20220811) where c3=day(20220811);
ERROR 22007: Incorrect value
update t1 set c1= day(20220811) where c3<=day(20220811);
ERROR 22007: Incorrect value
update t1 set c1= day(20220811) where c3 between day() and day(20220811)+3 ;
ERROR 42000: You have an error in your SQL syntax; check the manual that corresponds to your OceanBase version for the right syntax to use near ') and day(20220811)+3' at line 1
update t1 set c1= day(20220811)+0 where c3 = day(20220811)  or c1=day(20220811) ;
ERROR 22007: Incorrect value
update t1 set c1= day(20220811)+0 where c2 like 'test%' ;
update t1 set c1= day(20220811) where c2 not like 'test%' ;
update t1 set c1= day(20220812) where c3>any(select day(20220811));
ERROR 22007: Incorrect value
update t1 set c1= day(20220811)+1 where c3<all(select day(20220811));
ERROR 22007: Incorrect value
update t1 set c1= abs(day(20220811));
update t1 set c1= abs(day(20220811)+1);
update t1 set c1= TO_DAYS(day(20220811));
ERROR 22007: Incorrect datetime value for column 'c1' at row 1
update t1 set c1= LOCATE(day(20220811)-1,day(20220811));
update t1 set c1= DATE_ADD(day()+0,INTERVAL 5 DAY);
ERROR 42000: You have an error in your SQL syntax; check the manual that corresponds to your OceanBase version for the right syntax to use near ')+0,INTERVAL 5 DAY)' at line 1
select * from t1;
c1	c2	c3
0	test01	2022-08-11
0	test02	2022-09-15
0	test03	2022-08-20
0	test04	2022-09-15
drop table t1;
##delete
create table t1 (c1 int ,c2 varchar(20),c3 date);
insert into t1 values(1,day('20220907'),'20220907');
insert into t1 values(2,day(20220909),'20220909');
insert into t1 values(3,day('2022-08-20'),'2022-08-20');
insert into t1 values(4,day('2022-09-15'),'2022-09-15');
insert into t1 values(5,day('2022-09-16'),'2022-09-16');
select * from t1;
c1	c2	c3
1	7	2022-09-07
2	9	2022-09-09
3	20	2022-08-20
4	15	2022-09-15
5	16	2022-09-16
delete  from t1 where c2 = day('2022-09-16');
delete from t1 where day(c3) = 15;
select * from t1;
c1	c2	c3
1	7	2022-09-07
2	9	2022-09-09
3	20	2022-08-20
drop table t1;
create table t1(c1 int, c2 varchar(30));
alter  table t1 modify  column c1 int(day('2022-09-13'));
ERROR 42000: You have an error in your SQL syntax; check the manual that corresponds to your OceanBase version for the right syntax to use near 'day('2022-09-13'))' at line 1
alter  table t1 modify  column c1 varchar(30)  DEFAULT day('2022-09-13');
ERROR 42000: You have an error in your SQL syntax; check the manual that corresponds to your OceanBase version for the right syntax to use near 'day('2022-09-13')' at line 1
目前 OB 不支持这样改变列类型。小类型可以改大，大的不能改小。也不能跨大类型改。
alter  table t1 modify  column c1 varchar(30)  GENERATED ALWAYS AS (day('2022-09-13')) STORED NOT NULL COMMENT '日期';
ERROR HY000: 'Changing the STORED status' is not supported for generated columns.
drop table t1;
create table t1 (c1 int primary key, c2 varchar(30)) partition by hash(day(c1)) partitions 3;
ERROR HY000: Constant or random or timezone-dependent expressions in (sub)partitioning function are not allowed
create table t1 (c1 int primary key, c2 varchar(30)) partition by hash(c1) partitions 3;
insert into t1 values(1,day('2022-09-15'));
insert into t1 values(2,day('2022-09-16'));
insert into t1 values(3,day('2022-09-17'));
insert into t1 values(4,day('2022-09-18'));
select * from t1;
c1	c2
3	17
1	15
4	18
2	16
update t1 set c2 =day('2022-09-19');
delete from t1 where c2 =day('2022-09-19');
select * from t1;
c1	c2
drop table t1;
drop table t1;
create table t1 (c1 int primary key, c2 varchar(30)) partition by range(c1) (
PARTITION p0 VALUES LESS THAN (2),
PARTITION p1 VALUES LESS THAN (4),
PARTITION p2 VALUES LESS THAN (6)
);
insert into t1 values(day('2022-09-01'),'2022-09-01');
insert into t1 values(day('2022-09-02'),'2022-09-02');
insert into t1 values(day('2022-09-03'),'2022-09-03');
insert into t1 values(day('2022-09-04'),'2022-09-04');
select * from t1;
c1	c2
1	2022-09-01
2	2022-09-02
3	2022-09-03
4	2022-09-04
update t1 set c2 =day('2022-09-19');
delete from t1 where c2 =day('2022-09-19');
select * from t1;
c1	c2
drop table t1;
drop table t1;
create table t1 (c1 int primary key, c2 varchar(30)) partition by list(c1) (
PARTITION p0 VALUES IN (1,2),
PARTITION p1 VALUES IN (3,4),
PARTITION p2 VALUES IN (5,6)
);
insert into t1 values(day('2022-09-01'),'2022-09-01');
insert into t1 values(day('2022-09-02'),'2022-09-02');
insert into t1 values(day('2022-09-03'),'2022-09-03');
insert into t1 values(day('2022-09-05'),'2022-09-05');
select * from t1;
c1	c2
1	2022-09-01
2	2022-09-02
3	2022-09-03
5	2022-09-05
update t1 set c2 =day('2022-09-19');
delete from t1 where c2 =day('2022-09-19');
select * from t1;
c1	c2
drop table t1;
drop table t1;
create table t1 (c1 int primary key, c2 varchar(30)) partition by key(day(c1)) partitions 3;
ERROR 42000: You have an error in your SQL syntax; check the manual that corresponds to your OceanBase version for the right syntax to use near '(c1)) partitions 3' at line 1
create table t1 (c1 int primary key, c2 varchar(30)) partition by key(c1) partitions 3;
insert into t1 values(day('2022-09-01'),'2022-09-01');
insert into t1 values(day('2022-09-02'),'2022-09-02');
insert into t1 values(day('2022-09-03'),'2022-09-03');
insert into t1 values(day('2022-09-05'),'2022-09-05');
select * from t1 order by day(c2);
c1	c2
1	2022-09-01
2	2022-09-02
3	2022-09-03
5	2022-09-05
update t1 set c2 =day('2022-09-19');
delete from t1 where c2 =day('2022-09-19');
select * from t1;
c1	c2
drop table t1;
## 视图
drop table t1;
create table t1 (c1 int ,c2 varchar(20),c3 date);
insert into t1 values(1,'test01','20220907');
insert into t1 values(2,'test02','20220909');
insert into t1 values(3,'test03','2022-08-20');
insert into t1 values(4,'test04','2022-09-15');
insert into t1 values(5,'test05','2022-09-16');
drop view t1_view;
create view t1_view as select * from t1;
select * from t1_view;
c1	c2	c3
1	test01	2022-09-07
2	test02	2022-09-09
3	test03	2022-08-20
4	test04	2022-09-15
5	test05	2022-09-16
select t1_view.*, day(c3) from t1_view where day(c3)=15;
c1	c2	c3	day(c3)
4	test04	2022-09-15	15
select t1_view.*, day(c3) from t1_view where day(c3)>=15;
c1	c2	c3	day(c3)
3	test03	2022-08-20	20
4	test04	2022-09-15	15
5	test05	2022-09-16	16
select t1_view.*, day(c3) from t1_view where day(c3)<=15;
c1	c2	c3	day(c3)
1	test01	2022-09-07	7
2	test02	2022-09-09	9
4	test04	2022-09-15	15
select t1_view.*, day(c3) from t1_view where day(c3)=15;
c1	c2	c3	day(c3)
4	test04	2022-09-15	15
select t1_view.*, day(c3) from t1_view where day(c3)<15;
c1	c2	c3	day(c3)
1	test01	2022-09-07	7
2	test02	2022-09-09	9
select t1_view.*, day(c3) from t1_view where day(c3)>15;
c1	c2	c3	day(c3)
3	test03	2022-08-20	20
5	test05	2022-09-16	16
select t1_view.*, day(c3) from t1_view where day(c3) between 15 and 16;
c1	c2	c3	day(c3)
4	test04	2022-09-15	15
5	test05	2022-09-16	16
select t1_view.*, day(c3) from t1_view where day(c3) like '1%';
c1	c2	c3	day(c3)
4	test04	2022-09-15	15
5	test05	2022-09-16	16
select t1_view.*, day(c3) from t1_view where exists (select day(c3),day(c3));
c1	c2	c3	day(c3)
1	test01	2022-09-07	7
2	test02	2022-09-09	9
3	test03	2022-08-20	20
4	test04	2022-09-15	15
5	test05	2022-09-16	16
select t1_view.*, day(c3) from t1_view where 20 in  (select day(c3));
c1	c2	c3	day(c3)
3	test03	2022-08-20	20
select t1_view.*, day(c3) from t1_view where 20 > all(select day(c3));
c1	c2	c3	day(c3)
1	test01	2022-09-07	7
2	test02	2022-09-09	9
4	test04	2022-09-15	15
5	test05	2022-09-16	16
select t1_view.*, day(c3) from t1_view where c1 =2 or c2 ='test03';
c1	c2	c3	day(c3)
2	test02	2022-09-09	9
3	test03	2022-08-20	20
select t1_view.*, day(c3) from t1_view where c1 =2 and c2 ='test02';
c1	c2	c3	day(c3)
2	test02	2022-09-09	9
insert into t1_view(c1) values(day('202209167'));
ERROR 22007: Incorrect value
insert into t1_view(c1) values(day('20220916'));
insert into t1_view(c1,c2,c3) values(0,day('20220914'),'20220914');
insert into t1_view(c1,c2,c3) values(6,day('20220918'),'20220918');
delete from t1_view where c2=day('20220918');
ERROR 22007: Truncated incorrect DECIMAL value: 'test01'
drop table t1;
drop view t1_view;
##PL块
drop table t1;
drop table t2;
DROP PROCEDURE pro1;
CREATE  PROCEDURE pro1( out a varchar(30))
begin
select day('2022-09-14') into a;
end;
//
CALL pro1(@aa);
select @aa;
@aa
14
DROP PROCEDURE pro1;
DROP PROCEDURE pro2;
CREATE  PROCEDURE pro2( out b int)
begin
select day('2022-09-14') into b;
end;
//
CALL pro2(@bb);
select @bb;
@bb
14
DROP PROCEDURE pro2;
drop table t1;
create table t1(c1 int,c2 varchar(30));
DROP PROCEDURE pro3;
CREATE PROCEDURE pro3(in a varchar(20))
begin
declare i int;
set i=20220910;
while i <=20220914  DO
if i > a then
select day(i);
end if;
insert into t1 values(i,day(i));
set i = i + 1;
end WHILE;
end;
//
CALL pro3(20220920);
DROP PROCEDURE pro3;
drop table t1;
create table t1(c1 int,c2 varchar(30));
DROP PROCEDURE pro4;
CREATE PROCEDURE pro4(in a int)
begin
declare i int;
declare b int;
set i=20220910;
while i <=20220914  DO
if a =20220920 then
select day(a);
end if;
insert into t1 values(a ,day(a));
set i = i + 1;
end WHILE;
select a into b;
end;
//
CALL pro4(20220920);
day(a)
day(a)
day(a)
day(a)
day(a)
20
20
20
20
20
select * from t1;
c1	c2
20220920	20
20220920	20
20220920	20
20220920	20
20220920	20
DROP PROCEDURE pro4;
drop table t1;
create table t1(c1 int,c2 varchar(30));
drop function  f1;
create function f1(aa  int) returns varchar(30)
begin
return day(aa);
end;
//
select f1(20220914);
f1(20220914)
14
drop table t1;
drop function  f1;
##insert型触发器
drop table t1;
drop table t2;
drop trigger t1_trigger;
create table t1 (c1 int ,c2 varchar(20),c3 date);
insert into t1 values(1,'test01','20220907');
insert into t1 values(2,'test02','20220909');
insert into t1 values(3,'test03','2022-08-20');
insert into t1 values(4,'test04','2022-09-15');
insert into t1 values(5,'test05','2022-09-16');
select * from t1;
c1	c2	c3
1	test01	2022-09-07
2	test02	2022-09-09
3	test03	2022-08-20
4	test04	2022-09-15
5	test05	2022-09-16
create table t2 (a1 int ,a2 varchar(20));
insert into t2 values(1,'test08');
insert into t2 values(2,'test09');
select * from t2;
a1	a2
1	test08
2	test09
create trigger t1_trigger after insert on  t2
for each row
begin 
update t1 set c2=day('2022-09-16') where c3="2022-09-16";
end //
insert into t2 values(3,'test03');
##update型触发器
drop table t1;
drop table t2;
drop trigger t1_trigger;
create table t1 (c1 int ,c2 varchar(20),c3 date);
insert into t1 values(1,'test01','20220907');
insert into t1 values(2,'test02','20220909');
insert into t1 values(3,'test03','2022-08-20');
insert into t1 values(4,'test04','2022-09-15');
insert into t1 values(5,'test05','2022-09-16');
select * from t1;
c1	c2	c3
1	test01	2022-09-07
2	test02	2022-09-09
3	test03	2022-08-20
4	test04	2022-09-15
5	test05	2022-09-16
create table t2 (a1 int ,a2 varchar(20));
insert into t2 values(1,'test08');
insert into t2 values(2,'test09');
select * from t2;
a1	a2
1	test08
2	test09
create trigger t1_trigger after update on  t2
for each row
begin 
update t1 set c2=day('2022-09-16') where c3="2022-09-16";
end //
update t2 set a2=day('2022-09-15') where a1=1;
##delete型触发器
drop table t1;
drop table t2;
drop trigger t1_trigger;
create table t1 (c1 int ,c2 varchar(20),c3 date);
insert into t1 values(1,'test01','20220907');
insert into t1 values(2,'test02','20220909');
insert into t1 values(3,'test03','2022-08-20');
insert into t1 values(4,'test04','2022-09-15');
insert into t1 values(5,'test05','2022-09-16');
select * from t1;
c1	c2	c3
1	test01	2022-09-07
2	test02	2022-09-09
3	test03	2022-08-20
4	test04	2022-09-15
5	test05	2022-09-16
create table t2 (a1 int ,a2 varchar(20));
insert into t2 values(1,'test08');
insert into t2 values(2,'test09');
select * from t2;
a1	a2
1	test08
2	test09
create trigger t1_trigger after delete on  t2
for each row
begin 
update t1 set c2=day('2022-09-16') where c3="2022-09-16";
end //
delete from t2 where a1=2;
drop table t1;
drop table t2;
drop trigger t1_trigger;
##约束
drop table t1;
create table t1(c1 varchar(20) primary key,c2 varchar(20) default '10');
drop table t2;
create table t2(a1 varchar(20) unique key ,a2 varchar(20),a3 varchar(20),CONSTRAINT for_key FOREIGN KEY (a3) REFERENCES  t1 (c1));
drop table t3;
create table t3(b1 varchar(20) not null ,b2 varchar(20));
insert into t1 values(day('2022-09-14'),day('2022-09-15'));
insert into t1(c1) values(day('2022-09-16'));
update t1 set c1=day('2022-09-17'),c2=day('2022-09-18') where c2='10';
select * from t1;
c1	c2
14	15
17	18
insert into t2 values(day('2022-09-14'),'test',day('2022-09-15'));
ERROR 23000: Cannot add or update a child row: a foreign key constraint fails
insert into t2 values('test',day('2022-09-18'),day('2022-09-17'));
select * from t2;
a1	a2	a3
test	18	17
update t2 set a1=day('2022-09-18') where a3=day('2022-09-17');
update t2 set a3=day('2022-09-19');
ERROR 23000: Cannot add or update a child row: a foreign key constraint fails
insert into t3 values(day('2022-09-18'),day('2022-09-16'));
select * from t3;
b1	b2
18	16
##索引
CREATE INDEX indexName ON t1 (c1);
insert into t1 values(day('2022-09-18'),day('2022-09-19'));
update t1 set c2=('2022-09-20')  where c2=day('2022-09-19');
select * from t1 ;
c1	c2
14	15
17	18
18	2022-09-20
########清空回收站，删除测试数据库，表等 ##########
drop database  IF EXISTS db1;
