result_format: 4
##控制 Hybrid Hash DM 是否开启的开关##
alter system set _px_join_skew_handling = 1;
##设置并行 join 中倾斜值必须满足的最低频率，出现比例小于该频率的值都不算倾斜值##
alter system set _px_join_skew_minfreq = 10;
##ADD_DATA##
drop procedure if exists insert_data;
create PROCEDURE insert_data(tab_nam varchar(100),var int)
begin
	set @i = 1;
	
	while @i <= var do
		SET @IN_VA_SQL = CONCAT(
		"INSERT INTO ",tab_nam," VALUES (",@i,",",@i,");");
		
		PREPARE STMT FROM @IN_VA_SQL;
		EXECUTE STMT;
		
		set @i = @i+1;
	end while;
	deallocate PREPARE STMT;
end;
//
drop procedure if exists insert_data_oneval;
create PROCEDURE insert_data_oneval(tab_nam varchar(20),var int)
begin
	set @i = 1;
	SET @IN_VA_SQL = CONCAT("INSERT INTO ",tab_nam," VALUES (1,1);");
	PREPARE STMT FROM @IN_VA_SQL;
	while @i <= var do
		EXECUTE STMT;
		set @i = @i+1;
	end while;
	deallocate PREPARE STMT;
end;
//
drop procedure if exists insert_data_onecol;
create PROCEDURE insert_data_onecol(tab_nam varchar(20),col varchar(20),var int)
begin
	set @i = 1;
	SET @IN_VA_SQL = CONCAT("INSERT INTO ",tab_nam,"(",col,") VALUES (1);");
	PREPARE STMT FROM @IN_VA_SQL;
	while @i <= var do
		EXECUTE STMT;
		set @i = @i+1;
	end while;
	deallocate PREPARE STMT;
end;
//
drop table if exists FF1;
drop table if exists FF2;
create table FF1 (A1 int , B1 int);
call insert_data('FF1',10);
create table FF2 (A2 INT , B2 INT);
call insert_data('FF2',66);
call insert_data_oneval('FF2',10);
##统计直方图##
call dbms_stats.gather_table_stats(NULL,'FF2',method_opt=>'for all columns size 100');
drop table if exists FF3;
CREATE TABLE FF3 (A3 INT, B3 INT);
INSERT INTO FF3 SELECT /*+ LEADING(L R) USE_HASH(R) PQ_DISTRIBUTE(R HASH HASH) PARALLEL(4)*/ A1,B2 FROM FF1 L RIGHT JOIN FF2 R ON R.A2 = L.A1;
SELECT COUNT(*) FROM FF3;
+----------+
| COUNT(*) |
+----------+
|       76 |
+----------+
UPDATE FF3 SET B3 = 1 WHERE A3 IN (SELECT /*+ LEADING(L R) USE_HASH(R) PQ_DISTRIBUTE(R HASH HASH) PARALLEL(4)*/ A1 FROM FF1 L RIGHT JOIN FF2 R ON R.A2 = L.A1);
SELECT COUNT(*) FROM FF3;
+----------+
| COUNT(*) |
+----------+
|       76 |
+----------+
DELETE FROM FF3 WHERE A3 IN (SELECT /*+ LEADING(L R) USE_HASH(R) PQ_DISTRIBUTE(R HASH HASH) PARALLEL(4)*/ A1 FROM FF1 L RIGHT JOIN FF2 R ON R.A2 = L.A1);
SELECT COUNT(*) FROM FF3;
+----------+
| COUNT(*) |
+----------+
|       56 |
+----------+
##INNER JOIN##
INSERT INTO FF3 SELECT /*+ LEADING(L R) USE_HASH(R) PQ_DISTRIBUTE(R HASH HASH) PARALLEL(4)*/ A1,B2 FROM FF1 L INNER JOIN FF2 R ON R.A2 = L.A1;
SELECT COUNT(*) FROM FF3;
+----------+
| COUNT(*) |
+----------+
|       76 |
+----------+
UPDATE FF3 SET B3 = 1 WHERE A3 IN (SELECT /*+ LEADING(L R) USE_HASH(R) PQ_DISTRIBUTE(R HASH HASH) PARALLEL(4)*/ A1 FROM FF1 L INNER JOIN FF2 R ON R.A2 = L.A1);
SELECT COUNT(*) FROM FF3;
+----------+
| COUNT(*) |
+----------+
|       76 |
+----------+
DELETE FROM FF3 WHERE A3 IN (SELECT /*+ LEADING(L R) USE_HASH(R) PQ_DISTRIBUTE(R HASH HASH) PARALLEL(4)*/ A1 FROM FF1 L INNER JOIN FF2 R ON R.A2 = L.A1);
SELECT COUNT(*) FROM FF3;
+----------+
| COUNT(*) |
+----------+
|       56 |
+----------+
##,##
INSERT INTO FF3 SELECT /*+ LEADING(L R) USE_HASH(R) PQ_DISTRIBUTE(R HASH HASH) PARALLEL(4)*/ A1,B2 FROM FF1 L , FF2 R WHERE R.A2 = L.A1;
SELECT COUNT(*) FROM FF3;
+----------+
| COUNT(*) |
+----------+
|       76 |
+----------+
UPDATE FF3 SET B3 = 1 WHERE A3 IN (SELECT /*+ LEADING(L R) USE_HASH(R) PQ_DISTRIBUTE(R HASH HASH) PARALLEL(4)*/ A1 FROM FF1 L , FF2 R WHERE R.A2 = L.A1);
SELECT COUNT(*) FROM FF3;
+----------+
| COUNT(*) |
+----------+
|       76 |
+----------+
DELETE FROM FF3 WHERE A3 IN (SELECT /*+ LEADING(L R) USE_HASH(R) PQ_DISTRIBUTE(R HASH HASH) PARALLEL(4)*/ A1 FROM FF1 L , FF2 R WHERE R.A2 = L.A1);
SELECT COUNT(*) FROM FF3;
+----------+
| COUNT(*) |
+----------+
|       56 |
+----------+
###merge join###
##RIGHT JOIN##
INSERT INTO FF3 SELECT /*+ LEADING(L R) USE_MERGE(R) PQ_DISTRIBUTE(R HASH HASH) PARALLEL(4)*/ A1,B2 FROM FF1 L RIGHT JOIN FF2 R ON R.A2 = L.A1;
SELECT COUNT(*) FROM FF3;
+----------+
| COUNT(*) |
+----------+
|      132 |
+----------+
UPDATE FF3 SET B3 = 1 WHERE A3 IN (SELECT /*+ LEADING(L R) USE_MERGE(R) PQ_DISTRIBUTE(R HASH HASH) PARALLEL(4)*/ A1 FROM FF1 L RIGHT JOIN FF2 R ON R.A2 = L.A1);
SELECT COUNT(*) FROM FF3;
+----------+
| COUNT(*) |
+----------+
|      132 |
+----------+
DELETE FROM FF3 WHERE A3 IN (SELECT /*+ LEADING(L R) USE_MERGE(R) PQ_DISTRIBUTE(R HASH HASH) PARALLEL(4)*/ A1 FROM FF1 L RIGHT JOIN FF2 R ON R.A2 = L.A1);
SELECT COUNT(*) FROM FF3;
+----------+
| COUNT(*) |
+----------+
|      112 |
+----------+
##INNER JOIN##
INSERT INTO FF3 SELECT /*+ LEADING(L R) USE_MERGE(R) PQ_DISTRIBUTE(R HASH HASH) PARALLEL(4)*/ A1,B2 FROM FF1 L INNER JOIN FF2 R ON R.A2 = L.A1;
SELECT COUNT(*) FROM FF3;
+----------+
| COUNT(*) |
+----------+
|      132 |
+----------+
UPDATE FF3 SET B3 = 1 WHERE A3 IN (SELECT /*+ LEADING(L R) USE_MERGE(R) PQ_DISTRIBUTE(R HASH HASH) PARALLEL(4)*/ A1 FROM FF1 L INNER JOIN FF2 R ON R.A2 = L.A1);
SELECT COUNT(*) FROM FF3;
+----------+
| COUNT(*) |
+----------+
|      132 |
+----------+
DELETE FROM FF3 WHERE A3 IN (SELECT /*+ LEADING(L R) USE_MERGE(R) PQ_DISTRIBUTE(R HASH HASH) PARALLEL(4)*/ A1 FROM FF1 L INNER JOIN FF2 R ON R.A2 = L.A1);
SELECT COUNT(*) FROM FF3;
+----------+
| COUNT(*) |
+----------+
|      112 |
+----------+
##,##
INSERT INTO FF3 SELECT /*+ LEADING(L R) USE_MERGE(R) PQ_DISTRIBUTE(R HASH HASH) PARALLEL(4)*/ A1,B2 FROM FF1 L , FF2 R WHERE R.A2 = L.A1;
SELECT COUNT(*) FROM FF3;
+----------+
| COUNT(*) |
+----------+
|      132 |
+----------+
UPDATE FF3 SET B3 = 1 WHERE A3 IN (SELECT /*+ LEADING(L R) USE_MERGE(R) PQ_DISTRIBUTE(R HASH HASH) PARALLEL(4)*/ A1 FROM FF1 L , FF2 R WHERE R.A2 = L.A1);
SELECT COUNT(*) FROM FF3;
+----------+
| COUNT(*) |
+----------+
|      132 |
+----------+
DELETE FROM FF3 WHERE A3 IN (SELECT /*+ LEADING(L R) USE_MERGE(R) PQ_DISTRIBUTE(R HASH HASH) PARALLEL(4)*/ A1 FROM FF1 L , FF2 R WHERE R.A2 = L.A1);
SELECT COUNT(*) FROM FF3;
+----------+
| COUNT(*) |
+----------+
|      112 |
+----------+
drop table if exists FF1;
drop table if exists FF2;
drop table if exists FF3;
