purge recyclebin;
drop database IF EXISTS obljh;
create database obljh ;
use obljh;
set timestamp = 1600000000;
set ob_trx_timeout = 10000000000;
set ob_query_timeout = 10000000000;
alter system set ob_vector_memory_limit_percentage =44;
CREATE TABLE t1 (c1 int primary key, c2 int[],c3 float[],c4 varchar(256)[]);
insert into t1 values(1,[1,false],[1.123,null,96666],['中文ing123','abc','1']);
insert into t1 values(2,[0,0,99999,null],[0.12345,null,966.66],[null,'a','sss']);
insert into t1 values(3,null,null,null);
select array_map((x) -> (c2), [null]) from t1 order by c1;
array_map((x) -> (c2), [null])
[[1,0]]
[[0,0,99999,NULL]]
[NULL]
select array_map((x) -> (c3), [null]) from t1 order by c1;
array_map((x) -> (c3), [null])
[[1.123,NULL,96666]]
[[0.12345,NULL,966.66]]
[NULL]
select array_map((x) -> (c4), [null]) from t1 order by c1;
array_map((x) -> (c4), [null])
[["中文ing123","abc","1"]]
[[NULL,"a","sss"]]
[NULL]
drop table if exists t1;
CREATE TABLE t1 (c1 int primary key, c2 int[],c3 float[],c4 varchar(2560000000000000000)[]);
ERROR 42000: Column length too big for column 'varchar' (max = 262144)
CREATE TABLE t1 (c1 int primary key, c2 int(1000000000000)[],c3 float(1000000000000)[],c4 varchar(2560000000000000000)[]);
ERROR 42000: Column length too big for column 'varchar' (max = 262144)
CREATE TABLE t1 (c1 int primary key, c2 int[],c3 float[],c4 varchar(256)[]);
insert into t1 values(1,[1,false],[1.123,null,96666],[lpad('x',257,'a')]);
ERROR 22001: Data too long for column 'c4' at row 1
drop table if exists t1;
CREATE TABLE t1 (c1 int primary key, c2 int[],c3 float[],c4 varchar(256)[]);
insert into t1 values(1,[1,false],[1.123,null,96666],['中文ing123',1,'1']);
insert into t1 values(2,[0,0,99999,null],[0.12345,null,966.66],[null,'a','sss']);
insert into t1 values(3,[0,0,99999,null],[0.12345,null,966.66],['null','a','sss']);
insert into t1 values(4,null,null,null);
insert into t1 values(5,[null],[null],[null]);
select c1,c2,c3,array_map((x) -> (c2), [1]) from t1 where c2 = array_map((x) -> ((x)), [1,0]);
c1	c2	c3	array_map((x) -> (c2), [1])
1	[1,0]	[1.123,NULL,96666]	[[1,0]]
select c1,c2,c3,array_map((x) -> (c3), [1]) from t1 where c3 = array_map((x) -> ((x)), [1.123,null,96666]);
c1	c2	c3	array_map((x) -> (c3), [1])
select c1,c2,c3,array_map((x) -> (c4), [1]) from t1 where c4 = array_map((x) -> ((x)), [null,'a','sss']);
c1	c2	c3	array_map((x) -> (c4), [1])
2	[0,0,99999,NULL]	[0.12345,NULL,966.66]	[[NULL,"a","sss"]]
select c1,c2,c3,array_map((x) -> (c2), [1]) from t1 where array_map((x) -> ((x)), [1,0]) = c2;
c1	c2	c3	array_map((x) -> (c2), [1])
1	[1,0]	[1.123,NULL,96666]	[[1,0]]
select c1,c2,c3,array_map((x) -> (c3), [1]) from t1 where array_map((x) -> ((x)), [1.123,null,96666]) = c3;
c1	c2	c3	array_map((x) -> (c3), [1])
select c1,c2,c3,array_map((x) -> (c4), [1]) from t1 where array_map((x) -> ((x)), [null,'a','sss']) = c4;
c1	c2	c3	array_map((x) -> (c4), [1])
2	[0,0,99999,NULL]	[0.12345,NULL,966.66]	[[NULL,"a","sss"]]
select c1,c2,c3,array_map((x) -> ((array_map((x) -> (x), x))), [c2]) from t1 order by c1;
c1	c2	c3	array_map((x) -> ((array_map((x) -> (x), x))), [c2])
1	[1,0]	[1.123,NULL,96666]	[[1,0]]
2	[0,0,99999,NULL]	[0.12345,NULL,966.66]	[[0,0,99999,NULL]]
3	[0,0,99999,NULL]	[0.12345,NULL,966.66]	[[0,0,99999,NULL]]
4	NULL	NULL	[NULL]
5	[NULL]	[NULL]	[[NULL]]
select c1,c2,c3,array_map((x) -> ((array_map((x) -> (x), x))), [c3]) from t1 order by c1;
c1	c2	c3	array_map((x) -> ((array_map((x) -> (x), x))), [c3])
1	[1,0]	[1.123,NULL,96666]	[[1.123,NULL,96666]]
2	[0,0,99999,NULL]	[0.12345,NULL,966.66]	[[0.12345,NULL,966.66]]
3	[0,0,99999,NULL]	[0.12345,NULL,966.66]	[[0.12345,NULL,966.66]]
4	NULL	NULL	[NULL]
5	[NULL]	[NULL]	[[NULL]]
select c1,c2,c3,array_map((x) -> ((array_map((x) -> (x), x))), [c4]) from t1 order by c1;
c1	c2	c3	array_map((x) -> ((array_map((x) -> (x), x))), [c4])
1	[1,0]	[1.123,NULL,96666]	[["中文ing123","1","1"]]
2	[0,0,99999,NULL]	[0.12345,NULL,966.66]	[[NULL,"a","sss"]]
3	[0,0,99999,NULL]	[0.12345,NULL,966.66]	[["null","a","sss"]]
4	NULL	NULL	[NULL]
5	[NULL]	[NULL]	[[NULL]]
select c1,c2,c3,array_map((x) -> ((array_map((x) -> (c1), x))), [c2]) from t1 order by c1;
c1	c2	c3	array_map((x) -> ((array_map((x) -> (c1), x))), [c2])
1	[1,0]	[1.123,NULL,96666]	[[1,1]]
2	[0,0,99999,NULL]	[0.12345,NULL,966.66]	[[2,2,2,2]]
3	[0,0,99999,NULL]	[0.12345,NULL,966.66]	[[3,3,3,3]]
4	NULL	NULL	[NULL]
5	[NULL]	[NULL]	[[5]]
select c1,c2,c3,array_map((x) -> ((array_map((x) -> (c2), x))), [c3]) from t1 order by c1;
c1	c2	c3	array_map((x) -> ((array_map((x) -> (c2), x))), [c3])
1	[1,0]	[1.123,NULL,96666]	[[[1,0],[1,0],[1,0]]]
2	[0,0,99999,NULL]	[0.12345,NULL,966.66]	[[[0,0,99999,NULL],[0,0,99999,NULL],[0,0,99999,NULL]]]
3	[0,0,99999,NULL]	[0.12345,NULL,966.66]	[[[0,0,99999,NULL],[0,0,99999,NULL],[0,0,99999,NULL]]]
4	NULL	NULL	[NULL]
5	[NULL]	[NULL]	[[[NULL]]]
select c1,c2,c3,array_map((x) -> ((array_map((x) -> (c3), x))), [c4]) from t1 order by c1;
c1	c2	c3	array_map((x) -> ((array_map((x) -> (c3), x))), [c4])
1	[1,0]	[1.123,NULL,96666]	[[[1.123,NULL,96666],[1.123,NULL,96666],[1.123,NULL,96666]]]
2	[0,0,99999,NULL]	[0.12345,NULL,966.66]	[[[0.12345,NULL,966.66],[0.12345,NULL,966.66],[0.12345,NULL,966.66]]]
3	[0,0,99999,NULL]	[0.12345,NULL,966.66]	[[[0.12345,NULL,966.66],[0.12345,NULL,966.66],[0.12345,NULL,966.66]]]
4	NULL	NULL	[NULL]
5	[NULL]	[NULL]	[[[NULL]]]
select c1,c2,c3,array_map((x) -> ((array_map((x) -> (c4), x))), [c4]) from t1 order by c1;
c1	c2	c3	array_map((x) -> ((array_map((x) -> (c4), x))), [c4])
1	[1,0]	[1.123,NULL,96666]	[[["中文ing123","1","1"],["中文ing123","1","1"],["中文ing123","1","1"]]]
2	[0,0,99999,NULL]	[0.12345,NULL,966.66]	[[[NULL,"a","sss"],[NULL,"a","sss"],[NULL,"a","sss"]]]
3	[0,0,99999,NULL]	[0.12345,NULL,966.66]	[[["null","a","sss"],["null","a","sss"],["null","a","sss"]]]
4	NULL	NULL	[NULL]
5	[NULL]	[NULL]	[[[NULL]]]
select c1,c2,c3,array_map((x) -> (c2), [null]) from t1 where c1 > array_map((x) -> ((x)), [1,0]);
ERROR 22000: Invalid data type for the operation
select c1,c2,c3,array_map((x) -> (c2), [null]) from t1 where c1 >= array_map((x) -> ((x)), [1,0]);
ERROR 22000: Invalid data type for the operation
select c1,c2,c3,array_map((x) -> (c2), [null]) from t1 where c1 < array_map((x) -> ((x)), [1,0]);
ERROR 22000: Invalid data type for the operation
select c1,c2,c3,array_map((x) -> (c2), [null]) from t1 where c1 <= array_map((x) -> ((x)), [1,0]);
ERROR 22000: Invalid data type for the operation
select c1,c2,c3,array_map((x) -> (c2), [null]) from t1 where c1 <> array_map((x) -> (c1), [1,0]);
ERROR HY000: Invalid argument
select c1,c2,c3,array_map((x) -> (c2), [null]) from t1 where c2 = array_map((x) -> ((x)), [0,0,99999,null]) and c1 =2;
c1	c2	c3	array_map((x) -> (c2), [null])
2	[0,0,99999,NULL]	[0.12345,NULL,966.66]	[[0,0,99999,NULL]]
select c1,c2,c3,array_map((x) -> (c4), [null]) from t1 where c4 = array_map((x) -> ((x)), ['null','a','sss']) and c2 = array_map((x) -> ((x)), [0,0,99999,null]);
c1	c2	c3	array_map((x) -> (c4), [null])
3	[0,0,99999,NULL]	[0.12345,NULL,966.66]	[["null","a","sss"]]
select c1,c2,c3,array_map((x) -> (c4), [null]) from t1 where c4 = array_map((x) -> ((x)), ['null','a','sss']) or c2 = array_map((x) -> ((x)), [0,0,99999,null]) order  by c1;
c1	c2	c3	array_map((x) -> (c4), [null])
2	[0,0,99999,NULL]	[0.12345,NULL,966.66]	[[NULL,"a","sss"]]
3	[0,0,99999,NULL]	[0.12345,NULL,966.66]	[["null","a","sss"]]
select c1,c2,c3,array_map((x) -> (c4), [null]) from t1 where c4 between array_map((x) -> (x), ['null','a','sss']) and array_map((x) -> ((x)), ['中文ing123',1,'1']) ;
ERROR 22000: Invalid data type for the operation
select c1,c2,c3,array_map((x) -> (c4), [null]) from t1 where array_map((x) -> (c4), ['null','a','sss']) between ['null','a','sss'] and ['中文ing123',1,'1'];
ERROR 22000: Invalid data type for the operation
select c1,c2,c3,c4 from t1 where array_map((x) -> (c4), ['null','a','sss']) like array_map((x) -> (c4), ['null','a','sss']);
ERROR 22000: Invalid data type for the operation
select c1,c2,c3,c4 from t1 where array_map((x) -> (c4), ['null','a','sss']) like '%[[%';
ERROR 22000: Invalid data type for the operation
select c1,c2,c3,c4 from t1 where array_map((x) -> (c4), ['null','a','sss']) not like '%[[%';
ERROR 22000: Invalid data type for the operation
SELECT c1,c2,array_map((x) -> (c2), [null]) from t1 where  EXISTS (SELECT array_map((x) -> (c4), c2) FROM t1) order by c1;
c1	c2	array_map((x) -> (c2), [null])
1	[1,0]	[[1,0]]
2	[0,0,99999,NULL]	[[0,0,99999,NULL]]
3	[0,0,99999,NULL]	[[0,0,99999,NULL]]
4	NULL	[NULL]
5	[NULL]	[[NULL]]
SELECT c1,c2,array_map((x) -> (c2), [null]) from t1 where  not EXISTS (SELECT array_map((x) -> (c4), ['null','a','sss']) FROM t1) order by c1;
c1	c2	array_map((x) -> (c2), [null])
SELECT c1,c2,array_map((x) -> (c2), [null]) from t1 where array_map((x) -> (c4), ['null','a','sss']) = any (SELECT array_map((x) -> (c4), ['null','a','sss']) FROM t1) order by c1;
ERROR 22000: Invalid data type for the operation
SELECT c1,c2,array_map((x) -> (c2), [null]) from t1 where array_map((x) -> (c4), ['null','a','sss']) >= any (SELECT array_map((x) -> (c4), ['null','a','sss']) FROM t1) order by c1;
ERROR 22000: Invalid data type for the operation
SELECT c1,c2,array_map((x) -> (c2), [null]) from t1 where array_map((x) -> (c4), ['null','a','sss']) <= any (SELECT array_map((x) -> (c4), ['null','a','sss']) FROM t1) order by c1;
ERROR 22000: Invalid data type for the operation
SELECT c1,c2,array_map((x) -> (c2), [null]) from t1 where array_map((x) -> (c4), ['null','a','sss']) <> any (SELECT array_map((x) -> (c4), ['null','a','sss']) FROM t1) order by c1;
ERROR 22000: Invalid data type for the operation
SELECT c1,c2,array_map((x) -> (c2), [null]) from t1 where array_map((x) -> (c4), ['null','a','sss']) != any (SELECT array_map((x) -> (c4), ['null','a','sss']) FROM t1) order by c1;
ERROR 22000: Invalid data type for the operation
SELECT c1,c2,array_map((x) -> (c2), [null]) from t1 where array_map((x) -> (c4), ['null','a','sss']) > any (SELECT array_map((x) -> (c4), ['null','a','sss']) FROM t1) order by c1;
ERROR 22000: Invalid data type for the operation
SELECT c1,c2,array_map((x) -> (c2), [null]) from t1 where array_map((x) -> (c4), ['null','a','sss']) < any (SELECT array_map((x) -> (c4), ['null','a','sss']) FROM t1) order by c1;
ERROR 22000: Invalid data type for the operation
SELECT c1,c2,c3,c4,array_map((x) -> (c2), [null]) from t1 where c2 in (array_map((x) -> (c2), [1]),array_map((x) -> (c2), [1]));
ERROR 22000: Invalid data type for the operation
SELECT c1,c2,c3,c4,array_map((x) -> (c2), [null]) from t1 where c1 in (null,1);
c1	c2	c3	c4	array_map((x) -> (c2), [null])
1	[1,0]	[1.123,NULL,96666]	["中文ing123","1","1"]	[[1,0]]
SELECT c1,c2,c3,c4,array_map((x) -> (c2), [null]) from t1 where array_map((x) -> (c2), [1]) in (select array_map((x) -> (c2), [1]) from t1 limit 1);
ERROR 22000: Invalid data type for the operation
SELECT c1,c2,c3,c4,array_map((x) -> (c2), [null]) from t1 where array_map((x) -> (c2), [1]) in ([[1,0]]);
c1	c2	c3	c4	array_map((x) -> (c2), [null])
1	[1,0]	[1.123,NULL,96666]	["中文ing123","1","1"]	[[1,0]]
SELECT c1,c2,c3,c4,array_map((x) -> (c2), [null]) from t1 where c2 not in (array_map((x) -> (c2), [1]),array_map((x) -> (c2), [1])) order by c1;
ERROR 22000: Invalid data type for the operation
SELECT c1,c2,c3,c4,array_map((x) -> (c2), [null]) from t1 where c1 not in (null,1) order by c1;
c1	c2	c3	c4	array_map((x) -> (c2), [null])
SELECT c1,c2,c3,c4,array_map((x) -> (c2), [null]) from t1 where array_map((x) -> (c2), [1]) not in (select array_map((x) -> (c2), [1]) from t1 limit 1) order by c1;
ERROR 22000: Invalid data type for the operation
SELECT c1,c2,c3,c4,array_map((x) -> (c2), [null]) from t1 where array_map((x) -> (c2), [1]) not in ([[1,0]]) order by c1;
c1	c2	c3	c4	array_map((x) -> (c2), [null])
2	[0,0,99999,NULL]	[0.12345,NULL,966.66]	[NULL,"a","sss"]	[[0,0,99999,NULL]]
3	[0,0,99999,NULL]	[0.12345,NULL,966.66]	["null","a","sss"]	[[0,0,99999,NULL]]
4	NULL	NULL	NULL	[NULL]
5	[NULL]	[NULL]	[NULL]	[[NULL]]
drop table if exists t1;
CREATE TABLE t1 (c1 int primary key, c2 int[],c3 float[],c4 varchar(256)[]);
insert into t1 values(1,[1,false],[1.123,null,96666],['中文ing123',1,'1']);
insert into t1 values(2,[0,0,99999,null],[0.12345,null,966.66],[null,'a','sss']);
insert into t1 values(3,[0,0,99999,null],[0.12345,null,966.66],['null','a','sss']);
insert into t1 values(4,[2,3,2,5],[2,3,3,5],[2,3,4,5]);
drop table if exists t2;
create table t2 like t1;
replace into t2 select * from t1;
select array_map((x) -> (c1), [1]) from t1 union  select array_map((x) -> (c2), [1]) from t2;
ERROR 22000: array type mismatch found between definition and data
select array_map((x) -> (c3), [1]) from t1 union  select array_map((x) -> (c4), [1]) from t2;
array_map((x) -> (c3), [1])
[["1.123",NULL,"96666"]]
[["0.12345",NULL,"966.66"]]
[["2","3","3","5"]]
[["中文ing123","1","1"]]
[[NULL,"a","sss"]]
[["null","a","sss"]]
[["2","3","4","5"]]
select array_map((x) -> (c4), [1]) from t1 union  select array_map((x) -> (c1), [1]) from t2;
ERROR 22000: array type mismatch found between definition and data
select * from t1,t2 where array_map((x) -> (t1.c3), [1])=array_map((x) -> (t2.c3), [1]) order by t1.c1,t2.c1;
c1	c2	c3	c4	c1	c2	c3	c4
1	[1,0]	[1.123,NULL,96666]	["中文ing123","1","1"]	1	[1,0]	[1.123,NULL,96666]	["中文ing123","1","1"]
2	[0,0,99999,NULL]	[0.12345,NULL,966.66]	[NULL,"a","sss"]	2	[0,0,99999,NULL]	[0.12345,NULL,966.66]	[NULL,"a","sss"]
2	[0,0,99999,NULL]	[0.12345,NULL,966.66]	[NULL,"a","sss"]	3	[0,0,99999,NULL]	[0.12345,NULL,966.66]	["null","a","sss"]
3	[0,0,99999,NULL]	[0.12345,NULL,966.66]	["null","a","sss"]	2	[0,0,99999,NULL]	[0.12345,NULL,966.66]	[NULL,"a","sss"]
3	[0,0,99999,NULL]	[0.12345,NULL,966.66]	["null","a","sss"]	3	[0,0,99999,NULL]	[0.12345,NULL,966.66]	["null","a","sss"]
4	[2,3,2,5]	[2,3,3,5]	["2","3","4","5"]	4	[2,3,2,5]	[2,3,3,5]	["2","3","4","5"]
select * from t1,t2 where array_map((x) -> (t1.c3), [1])<>array_map((x) -> (t2.c3), [1]) order by t1.c1,t2.c1;
c1	c2	c3	c4	c1	c2	c3	c4
1	[1,0]	[1.123,NULL,96666]	["中文ing123","1","1"]	2	[0,0,99999,NULL]	[0.12345,NULL,966.66]	[NULL,"a","sss"]
1	[1,0]	[1.123,NULL,96666]	["中文ing123","1","1"]	3	[0,0,99999,NULL]	[0.12345,NULL,966.66]	["null","a","sss"]
1	[1,0]	[1.123,NULL,96666]	["中文ing123","1","1"]	4	[2,3,2,5]	[2,3,3,5]	["2","3","4","5"]
2	[0,0,99999,NULL]	[0.12345,NULL,966.66]	[NULL,"a","sss"]	1	[1,0]	[1.123,NULL,96666]	["中文ing123","1","1"]
2	[0,0,99999,NULL]	[0.12345,NULL,966.66]	[NULL,"a","sss"]	4	[2,3,2,5]	[2,3,3,5]	["2","3","4","5"]
3	[0,0,99999,NULL]	[0.12345,NULL,966.66]	["null","a","sss"]	1	[1,0]	[1.123,NULL,96666]	["中文ing123","1","1"]
3	[0,0,99999,NULL]	[0.12345,NULL,966.66]	["null","a","sss"]	4	[2,3,2,5]	[2,3,3,5]	["2","3","4","5"]
4	[2,3,2,5]	[2,3,3,5]	["2","3","4","5"]	1	[1,0]	[1.123,NULL,96666]	["中文ing123","1","1"]
4	[2,3,2,5]	[2,3,3,5]	["2","3","4","5"]	2	[0,0,99999,NULL]	[0.12345,NULL,966.66]	[NULL,"a","sss"]
4	[2,3,2,5]	[2,3,3,5]	["2","3","4","5"]	3	[0,0,99999,NULL]	[0.12345,NULL,966.66]	["null","a","sss"]
select * from t1,t2 where t1.c3<>t2.c3 order by t1.c1,t2.c1;
c1	c2	c3	c4	c1	c2	c3	c4
1	[1,0]	[1.123,NULL,96666]	["中文ing123","1","1"]	2	[0,0,99999,NULL]	[0.12345,NULL,966.66]	[NULL,"a","sss"]
1	[1,0]	[1.123,NULL,96666]	["中文ing123","1","1"]	3	[0,0,99999,NULL]	[0.12345,NULL,966.66]	["null","a","sss"]
1	[1,0]	[1.123,NULL,96666]	["中文ing123","1","1"]	4	[2,3,2,5]	[2,3,3,5]	["2","3","4","5"]
2	[0,0,99999,NULL]	[0.12345,NULL,966.66]	[NULL,"a","sss"]	1	[1,0]	[1.123,NULL,96666]	["中文ing123","1","1"]
2	[0,0,99999,NULL]	[0.12345,NULL,966.66]	[NULL,"a","sss"]	4	[2,3,2,5]	[2,3,3,5]	["2","3","4","5"]
3	[0,0,99999,NULL]	[0.12345,NULL,966.66]	["null","a","sss"]	1	[1,0]	[1.123,NULL,96666]	["中文ing123","1","1"]
3	[0,0,99999,NULL]	[0.12345,NULL,966.66]	["null","a","sss"]	4	[2,3,2,5]	[2,3,3,5]	["2","3","4","5"]
4	[2,3,2,5]	[2,3,3,5]	["2","3","4","5"]	1	[1,0]	[1.123,NULL,96666]	["中文ing123","1","1"]
4	[2,3,2,5]	[2,3,3,5]	["2","3","4","5"]	2	[0,0,99999,NULL]	[0.12345,NULL,966.66]	[NULL,"a","sss"]
4	[2,3,2,5]	[2,3,3,5]	["2","3","4","5"]	3	[0,0,99999,NULL]	[0.12345,NULL,966.66]	["null","a","sss"]
select * from t1,t2 where array_map((x) -> (t1.c3), [1])>array_map((x) -> (t2.c3), [1]) order by t1.c1,t2.c1;
ERROR 22000: Invalid data type for the operation
select * from t1,t2 where array_map((x) -> (t1.c3), [1])>=array_map((x) -> (t2.c3), [1]) order by t1.c1,t2.c1;
ERROR 22000: Invalid data type for the operation
select * from t1,t2 where array_map((x) -> (t1.c3), [1])<=>array_map((x) -> (t2.c3), [1]) order by t1.c1,t2.c1;
ERROR 22000: Invalid data type for the operation
select t1.c1,array_map((x) -> (t1.c4), [1]) from t1  join t2  on array_map((x) -> (t1.c4), [1])=array_map((x) -> (t2.c4), [1])  order by t1.c1;
c1	array_map((x) -> (t1.c4), [1])
1	[["中文ing123","1","1"]]
2	[[NULL,"a","sss"]]
3	[["null","a","sss"]]
4	[["2","3","4","5"]]
select t1.c1,array_map((x) -> (t1.c3), [1]) from t1  inner join t2  on array_map((x) -> (t1.c3), [1])=array_map((x) -> (t2.c3), [1])  order by t1.c1;
c1	array_map((x) -> (t1.c3), [1])
1	[[1.123,NULL,96666]]
2	[[0.12345,NULL,966.66]]
2	[[0.12345,NULL,966.66]]
3	[[0.12345,NULL,966.66]]
3	[[0.12345,NULL,966.66]]
4	[[2,3,3,5]]
select t1.c1,array_map((x) -> (t1.c3), [1]) from t1  right join t2  on array_map((x) -> (t1.c3), [1])=array_map((x) -> (t2.c3), [1])  order by t1.c1;
c1	array_map((x) -> (t1.c3), [1])
1	[[1.123,NULL,96666]]
2	[[0.12345,NULL,966.66]]
2	[[0.12345,NULL,966.66]]
3	[[0.12345,NULL,966.66]]
3	[[0.12345,NULL,966.66]]
4	[[2,3,3,5]]
select t1.c1,array_map((x) -> (t1.c3), [1]) from t1  left join t2  on array_map((x) -> (t1.c3), [1])=array_map((x) -> (t2.c3), [1])  order by t1.c1;
c1	array_map((x) -> (t1.c3), [1])
1	[[1.123,NULL,96666]]
2	[[0.12345,NULL,966.66]]
2	[[0.12345,NULL,966.66]]
3	[[0.12345,NULL,966.66]]
3	[[0.12345,NULL,966.66]]
4	[[2,3,3,5]]
select t1.c1,array_map((x) -> (t1.c3), [1]) from t1  cross  join t2  on array_map((x) -> (t1.c3), [1])=array_map((x) -> (t2.c3), [1])  order by t1.c1;
c1	array_map((x) -> (t1.c3), [1])
1	[[1.123,NULL,96666]]
2	[[0.12345,NULL,966.66]]
2	[[0.12345,NULL,966.66]]
3	[[0.12345,NULL,966.66]]
3	[[0.12345,NULL,966.66]]
4	[[2,3,3,5]]
select * from t1,t2 where t1.c2<>t2.c2 order by t1.c1,t2.c1;
c1	c2	c3	c4	c1	c2	c3	c4
1	[1,0]	[1.123,NULL,96666]	["中文ing123","1","1"]	2	[0,0,99999,NULL]	[0.12345,NULL,966.66]	[NULL,"a","sss"]
1	[1,0]	[1.123,NULL,96666]	["中文ing123","1","1"]	3	[0,0,99999,NULL]	[0.12345,NULL,966.66]	["null","a","sss"]
1	[1,0]	[1.123,NULL,96666]	["中文ing123","1","1"]	4	[2,3,2,5]	[2,3,3,5]	["2","3","4","5"]
2	[0,0,99999,NULL]	[0.12345,NULL,966.66]	[NULL,"a","sss"]	1	[1,0]	[1.123,NULL,96666]	["中文ing123","1","1"]
2	[0,0,99999,NULL]	[0.12345,NULL,966.66]	[NULL,"a","sss"]	4	[2,3,2,5]	[2,3,3,5]	["2","3","4","5"]
3	[0,0,99999,NULL]	[0.12345,NULL,966.66]	["null","a","sss"]	1	[1,0]	[1.123,NULL,96666]	["中文ing123","1","1"]
3	[0,0,99999,NULL]	[0.12345,NULL,966.66]	["null","a","sss"]	4	[2,3,2,5]	[2,3,3,5]	["2","3","4","5"]
4	[2,3,2,5]	[2,3,3,5]	["2","3","4","5"]	1	[1,0]	[1.123,NULL,96666]	["中文ing123","1","1"]
4	[2,3,2,5]	[2,3,3,5]	["2","3","4","5"]	2	[0,0,99999,NULL]	[0.12345,NULL,966.66]	[NULL,"a","sss"]
4	[2,3,2,5]	[2,3,3,5]	["2","3","4","5"]	3	[0,0,99999,NULL]	[0.12345,NULL,966.66]	["null","a","sss"]
drop table if exists t1;
CREATE TABLE t1 (c1 int primary key, c2 vector(4),c3 float[],c4 varchar(256)[]);
insert into t1 values(1,array_distinct([1,2,3,4,1,2,3,4]),[1.2,2.3,6.9,-1.02,1.2,2.3,6.9,-1.02],['中文ing123',1,'1','中文ing123',1,'1']);
insert into t1 values(2,array_distinct([2,3,4,6,2,3,4,6]),[1.123,2.3126,2.30,-0.25,1.123,2.3126,2.30,-0.25],[null,'a','sss',null,'a','sss']);
insert into t1 values(3,array_distinct([7,1,5,9,7,1,5,9]),[0.12345,null,966.66,0.12345,null,966.66],['null','a','sss','null','a','sss']);
insert into t1 values(4,null,null,null);
create view v1 as  select c1, array_map((x) -> (x), c2) c2,array_map((x) -> (x), c3) c3,array_map((x) -> (x), c4) c4 from t1;
select array_map((x) -> (x), a.c2) from v1 a,t1 b order by a.c1;
array_map((x) -> (x), a.c2)
[1,2,3,4]
[1,2,3,4]
[1,2,3,4]
[1,2,3,4]
[2,3,4,6]
[2,3,4,6]
[2,3,4,6]
[2,3,4,6]
[7,1,5,9]
[7,1,5,9]
[7,1,5,9]
[7,1,5,9]
NULL
NULL
NULL
NULL
select * from v1 a,t1 b order by a.c1;
c1	c2	c3	c4	c1	c2	c3	c4
1	[1,2,3,4]	[1.2,2.3,6.9,-1.02,1.2,2.3,6.9,-1.02]	["中文ing123","1","1","中文ing123","1","1"]	1	[1,2,3,4]	[1.2,2.3,6.9,-1.02,1.2,2.3,6.9,-1.02]	["中文ing123","1","1","中文ing123","1","1"]
1	[1,2,3,4]	[1.2,2.3,6.9,-1.02,1.2,2.3,6.9,-1.02]	["中文ing123","1","1","中文ing123","1","1"]	2	[2,3,4,6]	[1.123,2.3126,2.3,-0.25,1.123,2.3126,2.3,-0.25]	[NULL,"a","sss",NULL,"a","sss"]
1	[1,2,3,4]	[1.2,2.3,6.9,-1.02,1.2,2.3,6.9,-1.02]	["中文ing123","1","1","中文ing123","1","1"]	3	[7,1,5,9]	[0.12345,NULL,966.66,0.12345,NULL,966.66]	["null","a","sss","null","a","sss"]
1	[1,2,3,4]	[1.2,2.3,6.9,-1.02,1.2,2.3,6.9,-1.02]	["中文ing123","1","1","中文ing123","1","1"]	4	NULL	NULL	NULL
2	[2,3,4,6]	[1.123,2.3126,2.3,-0.25,1.123,2.3126,2.3,-0.25]	[NULL,"a","sss",NULL,"a","sss"]	1	[1,2,3,4]	[1.2,2.3,6.9,-1.02,1.2,2.3,6.9,-1.02]	["中文ing123","1","1","中文ing123","1","1"]
2	[2,3,4,6]	[1.123,2.3126,2.3,-0.25,1.123,2.3126,2.3,-0.25]	[NULL,"a","sss",NULL,"a","sss"]	2	[2,3,4,6]	[1.123,2.3126,2.3,-0.25,1.123,2.3126,2.3,-0.25]	[NULL,"a","sss",NULL,"a","sss"]
2	[2,3,4,6]	[1.123,2.3126,2.3,-0.25,1.123,2.3126,2.3,-0.25]	[NULL,"a","sss",NULL,"a","sss"]	3	[7,1,5,9]	[0.12345,NULL,966.66,0.12345,NULL,966.66]	["null","a","sss","null","a","sss"]
2	[2,3,4,6]	[1.123,2.3126,2.3,-0.25,1.123,2.3126,2.3,-0.25]	[NULL,"a","sss",NULL,"a","sss"]	4	NULL	NULL	NULL
3	[7,1,5,9]	[0.12345,NULL,966.66,0.12345,NULL,966.66]	["null","a","sss","null","a","sss"]	1	[1,2,3,4]	[1.2,2.3,6.9,-1.02,1.2,2.3,6.9,-1.02]	["中文ing123","1","1","中文ing123","1","1"]
3	[7,1,5,9]	[0.12345,NULL,966.66,0.12345,NULL,966.66]	["null","a","sss","null","a","sss"]	2	[2,3,4,6]	[1.123,2.3126,2.3,-0.25,1.123,2.3126,2.3,-0.25]	[NULL,"a","sss",NULL,"a","sss"]
3	[7,1,5,9]	[0.12345,NULL,966.66,0.12345,NULL,966.66]	["null","a","sss","null","a","sss"]	3	[7,1,5,9]	[0.12345,NULL,966.66,0.12345,NULL,966.66]	["null","a","sss","null","a","sss"]
3	[7,1,5,9]	[0.12345,NULL,966.66,0.12345,NULL,966.66]	["null","a","sss","null","a","sss"]	4	NULL	NULL	NULL
4	NULL	NULL	NULL	1	[1,2,3,4]	[1.2,2.3,6.9,-1.02,1.2,2.3,6.9,-1.02]	["中文ing123","1","1","中文ing123","1","1"]
4	NULL	NULL	NULL	2	[2,3,4,6]	[1.123,2.3126,2.3,-0.25,1.123,2.3126,2.3,-0.25]	[NULL,"a","sss",NULL,"a","sss"]
4	NULL	NULL	NULL	3	[7,1,5,9]	[0.12345,NULL,966.66,0.12345,NULL,966.66]	["null","a","sss","null","a","sss"]
4	NULL	NULL	NULL	4	NULL	NULL	NULL
select * from t1,v1 where array_map((x) -> (x), t1.c2)=array_map((x) -> (x), v1.c2) order by t1.c1,v1.c1;
c1	c2	c3	c4	c1	c2	c3	c4
1	[1,2,3,4]	[1.2,2.3,6.9,-1.02,1.2,2.3,6.9,-1.02]	["中文ing123","1","1","中文ing123","1","1"]	1	[1,2,3,4]	[1.2,2.3,6.9,-1.02,1.2,2.3,6.9,-1.02]	["中文ing123","1","1","中文ing123","1","1"]
2	[2,3,4,6]	[1.123,2.3126,2.3,-0.25,1.123,2.3126,2.3,-0.25]	[NULL,"a","sss",NULL,"a","sss"]	2	[2,3,4,6]	[1.123,2.3126,2.3,-0.25,1.123,2.3126,2.3,-0.25]	[NULL,"a","sss",NULL,"a","sss"]
3	[7,1,5,9]	[0.12345,NULL,966.66,0.12345,NULL,966.66]	["null","a","sss","null","a","sss"]	3	[7,1,5,9]	[0.12345,NULL,966.66,0.12345,NULL,966.66]	["null","a","sss","null","a","sss"]
select * from t1,v1 where array_map((x) -> (x), t1.c2)<>array_map((x) -> (x), v1.c2) order by t1.c1,v1.c1;
c1	c2	c3	c4	c1	c2	c3	c4
1	[1,2,3,4]	[1.2,2.3,6.9,-1.02,1.2,2.3,6.9,-1.02]	["中文ing123","1","1","中文ing123","1","1"]	2	[2,3,4,6]	[1.123,2.3126,2.3,-0.25,1.123,2.3126,2.3,-0.25]	[NULL,"a","sss",NULL,"a","sss"]
1	[1,2,3,4]	[1.2,2.3,6.9,-1.02,1.2,2.3,6.9,-1.02]	["中文ing123","1","1","中文ing123","1","1"]	3	[7,1,5,9]	[0.12345,NULL,966.66,0.12345,NULL,966.66]	["null","a","sss","null","a","sss"]
2	[2,3,4,6]	[1.123,2.3126,2.3,-0.25,1.123,2.3126,2.3,-0.25]	[NULL,"a","sss",NULL,"a","sss"]	1	[1,2,3,4]	[1.2,2.3,6.9,-1.02,1.2,2.3,6.9,-1.02]	["中文ing123","1","1","中文ing123","1","1"]
2	[2,3,4,6]	[1.123,2.3126,2.3,-0.25,1.123,2.3126,2.3,-0.25]	[NULL,"a","sss",NULL,"a","sss"]	3	[7,1,5,9]	[0.12345,NULL,966.66,0.12345,NULL,966.66]	["null","a","sss","null","a","sss"]
3	[7,1,5,9]	[0.12345,NULL,966.66,0.12345,NULL,966.66]	["null","a","sss","null","a","sss"]	1	[1,2,3,4]	[1.2,2.3,6.9,-1.02,1.2,2.3,6.9,-1.02]	["中文ing123","1","1","中文ing123","1","1"]
3	[7,1,5,9]	[0.12345,NULL,966.66,0.12345,NULL,966.66]	["null","a","sss","null","a","sss"]	2	[2,3,4,6]	[1.123,2.3126,2.3,-0.25,1.123,2.3126,2.3,-0.25]	[NULL,"a","sss",NULL,"a","sss"]
select * from t1 a,t1 b where array_map((x) -> (x), a.c2)<>array_map((x) -> (x), b.c2) order by a.c1,b.c1;
c1	c2	c3	c4	c1	c2	c3	c4
1	[1,2,3,4]	[1.2,2.3,6.9,-1.02,1.2,2.3,6.9,-1.02]	["中文ing123","1","1","中文ing123","1","1"]	2	[2,3,4,6]	[1.123,2.3126,2.3,-0.25,1.123,2.3126,2.3,-0.25]	[NULL,"a","sss",NULL,"a","sss"]
1	[1,2,3,4]	[1.2,2.3,6.9,-1.02,1.2,2.3,6.9,-1.02]	["中文ing123","1","1","中文ing123","1","1"]	3	[7,1,5,9]	[0.12345,NULL,966.66,0.12345,NULL,966.66]	["null","a","sss","null","a","sss"]
2	[2,3,4,6]	[1.123,2.3126,2.3,-0.25,1.123,2.3126,2.3,-0.25]	[NULL,"a","sss",NULL,"a","sss"]	1	[1,2,3,4]	[1.2,2.3,6.9,-1.02,1.2,2.3,6.9,-1.02]	["中文ing123","1","1","中文ing123","1","1"]
2	[2,3,4,6]	[1.123,2.3126,2.3,-0.25,1.123,2.3126,2.3,-0.25]	[NULL,"a","sss",NULL,"a","sss"]	3	[7,1,5,9]	[0.12345,NULL,966.66,0.12345,NULL,966.66]	["null","a","sss","null","a","sss"]
3	[7,1,5,9]	[0.12345,NULL,966.66,0.12345,NULL,966.66]	["null","a","sss","null","a","sss"]	1	[1,2,3,4]	[1.2,2.3,6.9,-1.02,1.2,2.3,6.9,-1.02]	["中文ing123","1","1","中文ing123","1","1"]
3	[7,1,5,9]	[0.12345,NULL,966.66,0.12345,NULL,966.66]	["null","a","sss","null","a","sss"]	2	[2,3,4,6]	[1.123,2.3126,2.3,-0.25,1.123,2.3126,2.3,-0.25]	[NULL,"a","sss",NULL,"a","sss"]
select * from t1 a,t1 b where array_map((x) -> (x), [a.c2])<>array_map((x) -> (x), [b.c2]) order by a.c1,b.c1;
c1	c2	c3	c4	c1	c2	c3	c4
1	[1,2,3,4]	[1.2,2.3,6.9,-1.02,1.2,2.3,6.9,-1.02]	["中文ing123","1","1","中文ing123","1","1"]	2	[2,3,4,6]	[1.123,2.3126,2.3,-0.25,1.123,2.3126,2.3,-0.25]	[NULL,"a","sss",NULL,"a","sss"]
1	[1,2,3,4]	[1.2,2.3,6.9,-1.02,1.2,2.3,6.9,-1.02]	["中文ing123","1","1","中文ing123","1","1"]	3	[7,1,5,9]	[0.12345,NULL,966.66,0.12345,NULL,966.66]	["null","a","sss","null","a","sss"]
1	[1,2,3,4]	[1.2,2.3,6.9,-1.02,1.2,2.3,6.9,-1.02]	["中文ing123","1","1","中文ing123","1","1"]	4	NULL	NULL	NULL
2	[2,3,4,6]	[1.123,2.3126,2.3,-0.25,1.123,2.3126,2.3,-0.25]	[NULL,"a","sss",NULL,"a","sss"]	1	[1,2,3,4]	[1.2,2.3,6.9,-1.02,1.2,2.3,6.9,-1.02]	["中文ing123","1","1","中文ing123","1","1"]
2	[2,3,4,6]	[1.123,2.3126,2.3,-0.25,1.123,2.3126,2.3,-0.25]	[NULL,"a","sss",NULL,"a","sss"]	3	[7,1,5,9]	[0.12345,NULL,966.66,0.12345,NULL,966.66]	["null","a","sss","null","a","sss"]
2	[2,3,4,6]	[1.123,2.3126,2.3,-0.25,1.123,2.3126,2.3,-0.25]	[NULL,"a","sss",NULL,"a","sss"]	4	NULL	NULL	NULL
3	[7,1,5,9]	[0.12345,NULL,966.66,0.12345,NULL,966.66]	["null","a","sss","null","a","sss"]	1	[1,2,3,4]	[1.2,2.3,6.9,-1.02,1.2,2.3,6.9,-1.02]	["中文ing123","1","1","中文ing123","1","1"]
3	[7,1,5,9]	[0.12345,NULL,966.66,0.12345,NULL,966.66]	["null","a","sss","null","a","sss"]	2	[2,3,4,6]	[1.123,2.3126,2.3,-0.25,1.123,2.3126,2.3,-0.25]	[NULL,"a","sss",NULL,"a","sss"]
3	[7,1,5,9]	[0.12345,NULL,966.66,0.12345,NULL,966.66]	["null","a","sss","null","a","sss"]	4	NULL	NULL	NULL
4	NULL	NULL	NULL	1	[1,2,3,4]	[1.2,2.3,6.9,-1.02,1.2,2.3,6.9,-1.02]	["中文ing123","1","1","中文ing123","1","1"]
4	NULL	NULL	NULL	2	[2,3,4,6]	[1.123,2.3126,2.3,-0.25,1.123,2.3126,2.3,-0.25]	[NULL,"a","sss",NULL,"a","sss"]
4	NULL	NULL	NULL	3	[7,1,5,9]	[0.12345,NULL,966.66,0.12345,NULL,966.66]	["null","a","sss","null","a","sss"]
select * from t1 a,v1 b,t1 c where array_map((x) -> (x), a.c2)=array_map((x) -> (x), b.c2) and array_map((x) -> (x), a.c2)=array_map((x) -> (x), c.c2) order by a.c1,b.c1;
c1	c2	c3	c4	c1	c2	c3	c4	c1	c2	c3	c4
1	[1,2,3,4]	[1.2,2.3,6.9,-1.02,1.2,2.3,6.9,-1.02]	["中文ing123","1","1","中文ing123","1","1"]	1	[1,2,3,4]	[1.2,2.3,6.9,-1.02,1.2,2.3,6.9,-1.02]	["中文ing123","1","1","中文ing123","1","1"]	1	[1,2,3,4]	[1.2,2.3,6.9,-1.02,1.2,2.3,6.9,-1.02]	["中文ing123","1","1","中文ing123","1","1"]
2	[2,3,4,6]	[1.123,2.3126,2.3,-0.25,1.123,2.3126,2.3,-0.25]	[NULL,"a","sss",NULL,"a","sss"]	2	[2,3,4,6]	[1.123,2.3126,2.3,-0.25,1.123,2.3126,2.3,-0.25]	[NULL,"a","sss",NULL,"a","sss"]	2	[2,3,4,6]	[1.123,2.3126,2.3,-0.25,1.123,2.3126,2.3,-0.25]	[NULL,"a","sss",NULL,"a","sss"]
3	[7,1,5,9]	[0.12345,NULL,966.66,0.12345,NULL,966.66]	["null","a","sss","null","a","sss"]	3	[7,1,5,9]	[0.12345,NULL,966.66,0.12345,NULL,966.66]	["null","a","sss","null","a","sss"]	3	[7,1,5,9]	[0.12345,NULL,966.66,0.12345,NULL,966.66]	["null","a","sss","null","a","sss"]
drop table if exists t1;
CREATE TABLE t1 (c1 int primary key, c2 vector(8),c3 float[],c4 varchar(256)[]);
insert into t1 values(1,[1,2,3,4,1,2,3,4],[1.2,2.3,6.9,-1.02,1.2,2.3,6.9,-1.02],['中文ing123',1,'1','中文ing123',1,'1']);
insert into t1 values(2,[2,3,4,6,2,3,4,6],[1.123,2.3126,2.30,-0.25,1.123,2.3126,2.30,-0.25],[null,'a','sss',null,'a','sss']);
insert into t1 values(3,[7,1,5,9,7,1,5,9],[0.12345,null,966.66,0.12345,null,966.66],['null','a','sss','null','a','sss']);
insert into t1 values(4,null,null,null);
create table tt1 like t1;
replace into tt1 select * from t1;
select array_map((x) -> (a.c2), [1]) from tt1 a ,t1 b order by a.c1,b.c1;
array_map((x) -> (a.c2), [1])
[[1,2,3,4,1,2,3,4]]
[[1,2,3,4,1,2,3,4]]
[[1,2,3,4,1,2,3,4]]
[[1,2,3,4,1,2,3,4]]
[[2,3,4,6,2,3,4,6]]
[[2,3,4,6,2,3,4,6]]
[[2,3,4,6,2,3,4,6]]
[[2,3,4,6,2,3,4,6]]
[[7,1,5,9,7,1,5,9]]
[[7,1,5,9,7,1,5,9]]
[[7,1,5,9,7,1,5,9]]
[[7,1,5,9,7,1,5,9]]
[NULL]
[NULL]
[NULL]
[NULL]
drop table if exists t1;
CREATE TABLE t1 (c1 int AUTO_INCREMENT , c2 int[],c3 float[],c4 varchar(256)[][])partition by hash(c1);
drop  view if exists v1;
create  view v1 as select * from t1;
insert into t1 values(1,[1,2,3,5],[2.123,2.123,3.123,4.123],[['中文ing123',1,'1']]);
insert into t1 values(2,[2,3,4,5],[2.123,2.123,3.123,4.123],[[null,'a','sss']]);
insert into t1 values(3,[3,3,3,3],[3.123,2.123,3.123,4.123],[['null','a','sss']]);
insert into t1 values(4,[2,3,4,5],[4.123,2.123,3.123,4.123],[[2,3,4,5]]);
drop table if exists tt1;
create table tt1 like t1;
replace into tt1 select * from t1;
select array_map((x) -> (a.c2), [1]) from tt1 a ,t1 b order by a.c1,b.c1;
array_map((x) -> (a.c2), [1])
[[1,2,3,5]]
[[1,2,3,5]]
[[1,2,3,5]]
[[1,2,3,5]]
[[2,3,4,5]]
[[2,3,4,5]]
[[2,3,4,5]]
[[2,3,4,5]]
[[3,3,3,3]]
[[3,3,3,3]]
[[3,3,3,3]]
[[3,3,3,3]]
[[2,3,4,5]]
[[2,3,4,5]]
[[2,3,4,5]]
[[2,3,4,5]]
drop  view if exists v1;
drop table if exists t1;
CREATE TABLE t1 (c1 int primary key, c2 VARCHAR(30),c3 vector(3) ,c4 vector(3)) partition by list columns (c1)(
PARTITION p0 VALUES in(10),
PARTITION p1 VALUES in(50)
);
drop table if exists tt1;
create table tt1 like t1;
replace into tt1 values(10,'[1,1,2]','[2,2,3]','[1,3,2]');
replace into t1 values(10,'[1,1,2]','[2,2,3]','[1,3,2]');
select array_map((x) -> (a.c2), [1]) from tt1 a ,t1 b order by a.c1,b.c1;
array_map((x) -> (a.c2), [1])
["[1,1,2]"]
drop table if exists t1;
CREATE TABLE t1 (c1 int primary key, c2 vector(8),c3 float[],c4 varchar(256)[]);
insert into t1 values(1,[1,2,3,4,1,2,3,4],[1.2,2.3,6.9,-1.02,1.2,2.3,6.9,-1.02],['中文ing123',1,'1','中文ing123',1,'1']);
insert into t1 values(2,[2,3,4,6,2,3,4,6],[1.123,2.3126,2.30,-0.25,1.123,2.3126,2.30,-0.25],[null,'a','sss',null,'a','sss']);
insert into t1 values(3,[7,1,5,9,7,1,5,9],[0.12345,null,966.66,0.12345,null,966.66],['null','a','sss','null','a','sss']);
insert into t1 values(4,null,null,null);
drop table if exists t1;
CREATE TABLE t1 (c1 int primary key, c2 vector(8),c3 float[],c4 varchar(256)[]);
insert into t1 values(1,[1,2,3,4,1,2,3,4],[1.2,2.3,6.9,-1.02,1.2,2.3,6.9,-1.02],['中文ing123',1,'1','中文ing123',1,'1']);
insert into t1 values(2,[2,3,4,6,2,3,4,6],[1.123,2.3126,2.30,-0.25,1.123,2.3126,2.30,-0.25],[null,'a','sss',null,'a','sss']);
insert into t1 values(3,[7,1,5,9,7,1,5,9],[0.12345,null,966.66,0.12345,null,966.66],['null','a','sss','null','a','sss']);
insert into t1 values(4,null,null,null);
drop materialized view if exists mv1;
create materialized view mv1(primary key(c1))  as select * from t1;
drop materialized view if exists mv2;
create materialized view mv2(primary key(c1))  as select * from t1;
select array_map((x) -> (a.c2), [1]) from mv1 a,mv2 b order by a.c1,b.c1;
array_map((x) -> (a.c2), [1])
[[1,2,3,4,1,2,3,4]]
[[1,2,3,4,1,2,3,4]]
[[1,2,3,4,1,2,3,4]]
[[1,2,3,4,1,2,3,4]]
[[2,3,4,6,2,3,4,6]]
[[2,3,4,6,2,3,4,6]]
[[2,3,4,6,2,3,4,6]]
[[2,3,4,6,2,3,4,6]]
[[7,1,5,9,7,1,5,9]]
[[7,1,5,9,7,1,5,9]]
[[7,1,5,9,7,1,5,9]]
[[7,1,5,9,7,1,5,9]]
[NULL]
[NULL]
[NULL]
[NULL]
drop  view if exists v1;
create  view v1 as select * from t1;
drop  view if exists v2;
create  view v2  as select * from t1;
select array_map((x) -> (a.c2), [1]) from v1 a,v2 b order by a.c1,b.c1;
array_map((x) -> (a.c2), [1])
[[1,2,3,4,1,2,3,4]]
[[1,2,3,4,1,2,3,4]]
[[1,2,3,4,1,2,3,4]]
[[1,2,3,4,1,2,3,4]]
[[2,3,4,6,2,3,4,6]]
[[2,3,4,6,2,3,4,6]]
[[2,3,4,6,2,3,4,6]]
[[2,3,4,6,2,3,4,6]]
[[7,1,5,9,7,1,5,9]]
[[7,1,5,9,7,1,5,9]]
[[7,1,5,9,7,1,5,9]]
[[7,1,5,9,7,1,5,9]]
[NULL]
[NULL]
[NULL]
[NULL]
drop materialized view if exists mv1;
create materialized view mv1  as select array_map((x) -> (c2), c2)  from t1;
desc mv1;
Field	Type	Null	Key	Default	Extra
array_map((x) -> (c2), c2)	ARRAY(VECTOR(8))	YES		NULL	
select * from mv1;
array_map((x) -> (c2), c2)
NULL
[[1,2,3,4,1,2,3,4],[1,2,3,4,1,2,3,4],[1,2,3,4,1,2,3,4],[1,2,3,4,1,2,3,4],[1,2,3,4,1,2,3,4],[1,2,3,4,1,2,3,4],[1,2,3,4,1,2,3,4],[1,2,3,4,1,2,3,4]]
[[2,3,4,6,2,3,4,6],[2,3,4,6,2,3,4,6],[2,3,4,6,2,3,4,6],[2,3,4,6,2,3,4,6],[2,3,4,6,2,3,4,6],[2,3,4,6,2,3,4,6],[2,3,4,6,2,3,4,6],[2,3,4,6,2,3,4,6]]
[[7,1,5,9,7,1,5,9],[7,1,5,9,7,1,5,9],[7,1,5,9,7,1,5,9],[7,1,5,9,7,1,5,9],[7,1,5,9,7,1,5,9],[7,1,5,9,7,1,5,9],[7,1,5,9,7,1,5,9],[7,1,5,9,7,1,5,9]]
drop materialized view if exists mv1;
create materialized view mv1(primary key(c1))  as select c1, array_map((x) -> (x), c2) c2,array_map((x) -> (x), c3) c3,array_map((x) -> (x), c4) c4 from t1;
show create table mv1;
View	Create View	character_set_client	collation_connection
mv1	CREATE MATERIALIZED VIEW `mv1` (PRIMARY KEY (c1)) DEFAULT CHARSET = utf8mb4 ROW_FORMAT = DYNAMIC COMPRESSION = 'zstd_1.3.8' REPLICA_NUM = 1 BLOCK_SIZE = 16384 USE_BLOOM_FILTER = FALSE ENABLE_MACRO_BLOCK_BLOOM_FILTER = FALSE TABLET_SIZE = 134217728 PCTFREE = 10 REFRESH FORCE ON DEMAND  AS select `obljh`.`t1`.`c1` AS `c1`,array_map((para0)->(para0),`obljh`.`t1`.`c2`) AS `c2`,array_map((para0)->(para0),`obljh`.`t1`.`c3`) AS `c3`,array_map((para0)->(para0),`obljh`.`t1`.`c4`) AS `c4` from `obljh`.`t1`	utf8mb4	utf8mb4_general_ci
select count(a.c2) from mv1 a,t1 b order by a.c1;
count(a.c2)
12
select element_at(c2,8) from mv1 order by c1;
element_at(c2,8)
4
6
9
NULL
select array_map((x) -> (c2), [1]) from mv1 order by c1;
array_map((x) -> (c2), [1])
[[1,2,3,4,1,2,3,4]]
[[2,3,4,6,2,3,4,6]]
[[7,1,5,9,7,1,5,9]]
[NULL]
select * from mv1 where array_map((x) -> (x), c2) is null order by c1;
c1	c2	c3	c4
4	NULL	NULL	NULL
select count(array_distinct(a.c2)) from mv1 a,t1 b order by a.c1;
count(array_distinct(a.c2))
12
select count(array_append(a.c2,1)) from mv1 a,t1 b order by a.c1;
count(array_append(a.c2,1))
12
select count(array_remove(a.c2,2)) from mv1 a,t1 b order by a.c1;
count(array_remove(a.c2,2))
12
select count(array_map((x) -> (x), a.c2)) from mv1 a,t1 b order by a.c1;
count(array_map((x) -> (x), a.c2))
12
select count(array_map((x) -> (a.c2),[1])) from mv1 a,t1 b order by a.c1;
count(array_map((x) -> (a.c2),[1]))
16
select count(array_map((x) -> ([a.c2]),[1])) from mv1 a,t1 b order by a.c1;
count(array_map((x) -> ([a.c2]),[1]))
16
drop materialized view if exists mv1;
create materialized view mv1(primary key(c1))  as select * from t1;
select array_distinct(a.c2) from mv1 a,t1 b order by a.c1;
array_distinct(a.c2)
[1,2,3,4]
[1,2,3,4]
[1,2,3,4]
[1,2,3,4]
[2,3,4,6]
[2,3,4,6]
[2,3,4,6]
[2,3,4,6]
[7,1,5,9]
[7,1,5,9]
[7,1,5,9]
[7,1,5,9]
NULL
NULL
NULL
NULL
select count(array_map((x) -> (x), a.c2)) from mv1 a,t1 b order by a.c1;
count(array_map((x) -> (x), a.c2))
12
select count(array_map((x) -> (a.c2),[1])) from mv1 a,t1 b order by a.c1;
count(array_map((x) -> (a.c2),[1]))
16
select count(array_map((x) -> ([a.c2]),[1])) from mv1 a,t1 b order by a.c1;
count(array_map((x) -> ([a.c2]),[1]))
16
select /*+ ENABLE_PARALLEL_DML PARALLEL(3) */count(a.c2) from mv1 a,t1 b order by a.c1;
count(a.c2)
12
select /*+ ENABLE_PARALLEL_DML PARALLEL(3) */count(array_map((x) -> (x), a.c2)) from mv1 a,t1 b order by a.c1;
count(array_map((x) -> (x), a.c2))
12
select count(array_map((x) -> (x), a.c2)) from mv1 a,t1 b,mv1 c order by a.c1;
count(array_map((x) -> (x), a.c2))
48
select count(*) from mv1 a,t1 b,mv1 c order by a.c1;
count(*)
64
select count(*) from mv1 a,t1 b order by a.c1;
count(*)
16
drop table if exists t1;
CREATE TABLE t1 (c1 int primary key, c2 vector(4),c3 float[],c4 varchar(256)[]);
insert into t1 values(1,[1,2,3,4],[1.2,2.3,6.9,-1.02],['中文ing123',1,'1']);
insert into t1 values(2,[2,3,4,6],[1.123,2.3126,2.30,-0.25],[null,'a','sss']);
insert into t1 values(3,[7,1,5,9],[0.12345,null,966.66],['null','a','sss']);
insert into t1 values(4,null,null,null);
drop materialized view if exists mv1;
create materialized view mv1(primary key(c1))  as select c1, array_distinct(c2) c2,array_distinct(c3) c3,array_distinct(c4) c4 from t1;
replace into t1 select c1,c2,c3,c4 from mv1;
drop view if exists v1;
create view v1 as  select c1, array_distinct(c2) c2,array_distinct(c3) c3,array_distinct(c4) c4 from t1;
replace into t1 select c1,c2,c3,c4 from v1;
select * from t1 a,mv1 b,v1 c order by a.c1;
c1	c2	c3	c4	c1	c2	c3	c4	c1	c2	c3	c4
1	[1,2,3,4]	[1.2,2.3,6.9,-1.02]	["中文ing123","1"]	1	[1,2,3,4]	[1.2,2.3,6.9,-1.02]	["中文ing123","1"]	1	[1,2,3,4]	[1.2,2.3,6.9,-1.02]	["中文ing123","1"]
1	[1,2,3,4]	[1.2,2.3,6.9,-1.02]	["中文ing123","1"]	1	[1,2,3,4]	[1.2,2.3,6.9,-1.02]	["中文ing123","1"]	2	[2,3,4,6]	[1.123,2.3126,2.3,-0.25]	[NULL,"a","sss"]
1	[1,2,3,4]	[1.2,2.3,6.9,-1.02]	["中文ing123","1"]	1	[1,2,3,4]	[1.2,2.3,6.9,-1.02]	["中文ing123","1"]	3	[7,1,5,9]	[NULL,0.12345,966.66]	["null","a","sss"]
1	[1,2,3,4]	[1.2,2.3,6.9,-1.02]	["中文ing123","1"]	1	[1,2,3,4]	[1.2,2.3,6.9,-1.02]	["中文ing123","1"]	4	NULL	NULL	NULL
1	[1,2,3,4]	[1.2,2.3,6.9,-1.02]	["中文ing123","1"]	2	[2,3,4,6]	[1.123,2.3126,2.3,-0.25]	[NULL,"a","sss"]	1	[1,2,3,4]	[1.2,2.3,6.9,-1.02]	["中文ing123","1"]
1	[1,2,3,4]	[1.2,2.3,6.9,-1.02]	["中文ing123","1"]	2	[2,3,4,6]	[1.123,2.3126,2.3,-0.25]	[NULL,"a","sss"]	2	[2,3,4,6]	[1.123,2.3126,2.3,-0.25]	[NULL,"a","sss"]
1	[1,2,3,4]	[1.2,2.3,6.9,-1.02]	["中文ing123","1"]	2	[2,3,4,6]	[1.123,2.3126,2.3,-0.25]	[NULL,"a","sss"]	3	[7,1,5,9]	[NULL,0.12345,966.66]	["null","a","sss"]
1	[1,2,3,4]	[1.2,2.3,6.9,-1.02]	["中文ing123","1"]	2	[2,3,4,6]	[1.123,2.3126,2.3,-0.25]	[NULL,"a","sss"]	4	NULL	NULL	NULL
1	[1,2,3,4]	[1.2,2.3,6.9,-1.02]	["中文ing123","1"]	3	[7,1,5,9]	[NULL,0.12345,966.66]	["null","a","sss"]	1	[1,2,3,4]	[1.2,2.3,6.9,-1.02]	["中文ing123","1"]
1	[1,2,3,4]	[1.2,2.3,6.9,-1.02]	["中文ing123","1"]	3	[7,1,5,9]	[NULL,0.12345,966.66]	["null","a","sss"]	2	[2,3,4,6]	[1.123,2.3126,2.3,-0.25]	[NULL,"a","sss"]
1	[1,2,3,4]	[1.2,2.3,6.9,-1.02]	["中文ing123","1"]	3	[7,1,5,9]	[NULL,0.12345,966.66]	["null","a","sss"]	3	[7,1,5,9]	[NULL,0.12345,966.66]	["null","a","sss"]
1	[1,2,3,4]	[1.2,2.3,6.9,-1.02]	["中文ing123","1"]	3	[7,1,5,9]	[NULL,0.12345,966.66]	["null","a","sss"]	4	NULL	NULL	NULL
1	[1,2,3,4]	[1.2,2.3,6.9,-1.02]	["中文ing123","1"]	4	NULL	NULL	NULL	1	[1,2,3,4]	[1.2,2.3,6.9,-1.02]	["中文ing123","1"]
1	[1,2,3,4]	[1.2,2.3,6.9,-1.02]	["中文ing123","1"]	4	NULL	NULL	NULL	2	[2,3,4,6]	[1.123,2.3126,2.3,-0.25]	[NULL,"a","sss"]
1	[1,2,3,4]	[1.2,2.3,6.9,-1.02]	["中文ing123","1"]	4	NULL	NULL	NULL	3	[7,1,5,9]	[NULL,0.12345,966.66]	["null","a","sss"]
1	[1,2,3,4]	[1.2,2.3,6.9,-1.02]	["中文ing123","1"]	4	NULL	NULL	NULL	4	NULL	NULL	NULL
2	[2,3,4,6]	[1.123,2.3126,2.3,-0.25]	[NULL,"a","sss"]	1	[1,2,3,4]	[1.2,2.3,6.9,-1.02]	["中文ing123","1"]	1	[1,2,3,4]	[1.2,2.3,6.9,-1.02]	["中文ing123","1"]
2	[2,3,4,6]	[1.123,2.3126,2.3,-0.25]	[NULL,"a","sss"]	1	[1,2,3,4]	[1.2,2.3,6.9,-1.02]	["中文ing123","1"]	2	[2,3,4,6]	[1.123,2.3126,2.3,-0.25]	[NULL,"a","sss"]
2	[2,3,4,6]	[1.123,2.3126,2.3,-0.25]	[NULL,"a","sss"]	1	[1,2,3,4]	[1.2,2.3,6.9,-1.02]	["中文ing123","1"]	3	[7,1,5,9]	[NULL,0.12345,966.66]	["null","a","sss"]
2	[2,3,4,6]	[1.123,2.3126,2.3,-0.25]	[NULL,"a","sss"]	1	[1,2,3,4]	[1.2,2.3,6.9,-1.02]	["中文ing123","1"]	4	NULL	NULL	NULL
2	[2,3,4,6]	[1.123,2.3126,2.3,-0.25]	[NULL,"a","sss"]	2	[2,3,4,6]	[1.123,2.3126,2.3,-0.25]	[NULL,"a","sss"]	1	[1,2,3,4]	[1.2,2.3,6.9,-1.02]	["中文ing123","1"]
2	[2,3,4,6]	[1.123,2.3126,2.3,-0.25]	[NULL,"a","sss"]	2	[2,3,4,6]	[1.123,2.3126,2.3,-0.25]	[NULL,"a","sss"]	2	[2,3,4,6]	[1.123,2.3126,2.3,-0.25]	[NULL,"a","sss"]
2	[2,3,4,6]	[1.123,2.3126,2.3,-0.25]	[NULL,"a","sss"]	2	[2,3,4,6]	[1.123,2.3126,2.3,-0.25]	[NULL,"a","sss"]	3	[7,1,5,9]	[NULL,0.12345,966.66]	["null","a","sss"]
2	[2,3,4,6]	[1.123,2.3126,2.3,-0.25]	[NULL,"a","sss"]	2	[2,3,4,6]	[1.123,2.3126,2.3,-0.25]	[NULL,"a","sss"]	4	NULL	NULL	NULL
2	[2,3,4,6]	[1.123,2.3126,2.3,-0.25]	[NULL,"a","sss"]	3	[7,1,5,9]	[NULL,0.12345,966.66]	["null","a","sss"]	1	[1,2,3,4]	[1.2,2.3,6.9,-1.02]	["中文ing123","1"]
2	[2,3,4,6]	[1.123,2.3126,2.3,-0.25]	[NULL,"a","sss"]	3	[7,1,5,9]	[NULL,0.12345,966.66]	["null","a","sss"]	2	[2,3,4,6]	[1.123,2.3126,2.3,-0.25]	[NULL,"a","sss"]
2	[2,3,4,6]	[1.123,2.3126,2.3,-0.25]	[NULL,"a","sss"]	3	[7,1,5,9]	[NULL,0.12345,966.66]	["null","a","sss"]	3	[7,1,5,9]	[NULL,0.12345,966.66]	["null","a","sss"]
2	[2,3,4,6]	[1.123,2.3126,2.3,-0.25]	[NULL,"a","sss"]	3	[7,1,5,9]	[NULL,0.12345,966.66]	["null","a","sss"]	4	NULL	NULL	NULL
2	[2,3,4,6]	[1.123,2.3126,2.3,-0.25]	[NULL,"a","sss"]	4	NULL	NULL	NULL	1	[1,2,3,4]	[1.2,2.3,6.9,-1.02]	["中文ing123","1"]
2	[2,3,4,6]	[1.123,2.3126,2.3,-0.25]	[NULL,"a","sss"]	4	NULL	NULL	NULL	2	[2,3,4,6]	[1.123,2.3126,2.3,-0.25]	[NULL,"a","sss"]
2	[2,3,4,6]	[1.123,2.3126,2.3,-0.25]	[NULL,"a","sss"]	4	NULL	NULL	NULL	3	[7,1,5,9]	[NULL,0.12345,966.66]	["null","a","sss"]
2	[2,3,4,6]	[1.123,2.3126,2.3,-0.25]	[NULL,"a","sss"]	4	NULL	NULL	NULL	4	NULL	NULL	NULL
3	[7,1,5,9]	[NULL,0.12345,966.66]	["null","a","sss"]	1	[1,2,3,4]	[1.2,2.3,6.9,-1.02]	["中文ing123","1"]	1	[1,2,3,4]	[1.2,2.3,6.9,-1.02]	["中文ing123","1"]
3	[7,1,5,9]	[NULL,0.12345,966.66]	["null","a","sss"]	1	[1,2,3,4]	[1.2,2.3,6.9,-1.02]	["中文ing123","1"]	2	[2,3,4,6]	[1.123,2.3126,2.3,-0.25]	[NULL,"a","sss"]
3	[7,1,5,9]	[NULL,0.12345,966.66]	["null","a","sss"]	1	[1,2,3,4]	[1.2,2.3,6.9,-1.02]	["中文ing123","1"]	3	[7,1,5,9]	[NULL,0.12345,966.66]	["null","a","sss"]
3	[7,1,5,9]	[NULL,0.12345,966.66]	["null","a","sss"]	1	[1,2,3,4]	[1.2,2.3,6.9,-1.02]	["中文ing123","1"]	4	NULL	NULL	NULL
3	[7,1,5,9]	[NULL,0.12345,966.66]	["null","a","sss"]	2	[2,3,4,6]	[1.123,2.3126,2.3,-0.25]	[NULL,"a","sss"]	1	[1,2,3,4]	[1.2,2.3,6.9,-1.02]	["中文ing123","1"]
3	[7,1,5,9]	[NULL,0.12345,966.66]	["null","a","sss"]	2	[2,3,4,6]	[1.123,2.3126,2.3,-0.25]	[NULL,"a","sss"]	2	[2,3,4,6]	[1.123,2.3126,2.3,-0.25]	[NULL,"a","sss"]
3	[7,1,5,9]	[NULL,0.12345,966.66]	["null","a","sss"]	2	[2,3,4,6]	[1.123,2.3126,2.3,-0.25]	[NULL,"a","sss"]	3	[7,1,5,9]	[NULL,0.12345,966.66]	["null","a","sss"]
3	[7,1,5,9]	[NULL,0.12345,966.66]	["null","a","sss"]	2	[2,3,4,6]	[1.123,2.3126,2.3,-0.25]	[NULL,"a","sss"]	4	NULL	NULL	NULL
3	[7,1,5,9]	[NULL,0.12345,966.66]	["null","a","sss"]	3	[7,1,5,9]	[NULL,0.12345,966.66]	["null","a","sss"]	1	[1,2,3,4]	[1.2,2.3,6.9,-1.02]	["中文ing123","1"]
3	[7,1,5,9]	[NULL,0.12345,966.66]	["null","a","sss"]	3	[7,1,5,9]	[NULL,0.12345,966.66]	["null","a","sss"]	2	[2,3,4,6]	[1.123,2.3126,2.3,-0.25]	[NULL,"a","sss"]
3	[7,1,5,9]	[NULL,0.12345,966.66]	["null","a","sss"]	3	[7,1,5,9]	[NULL,0.12345,966.66]	["null","a","sss"]	3	[7,1,5,9]	[NULL,0.12345,966.66]	["null","a","sss"]
3	[7,1,5,9]	[NULL,0.12345,966.66]	["null","a","sss"]	3	[7,1,5,9]	[NULL,0.12345,966.66]	["null","a","sss"]	4	NULL	NULL	NULL
3	[7,1,5,9]	[NULL,0.12345,966.66]	["null","a","sss"]	4	NULL	NULL	NULL	1	[1,2,3,4]	[1.2,2.3,6.9,-1.02]	["中文ing123","1"]
3	[7,1,5,9]	[NULL,0.12345,966.66]	["null","a","sss"]	4	NULL	NULL	NULL	2	[2,3,4,6]	[1.123,2.3126,2.3,-0.25]	[NULL,"a","sss"]
3	[7,1,5,9]	[NULL,0.12345,966.66]	["null","a","sss"]	4	NULL	NULL	NULL	3	[7,1,5,9]	[NULL,0.12345,966.66]	["null","a","sss"]
3	[7,1,5,9]	[NULL,0.12345,966.66]	["null","a","sss"]	4	NULL	NULL	NULL	4	NULL	NULL	NULL
4	NULL	NULL	NULL	1	[1,2,3,4]	[1.2,2.3,6.9,-1.02]	["中文ing123","1"]	1	[1,2,3,4]	[1.2,2.3,6.9,-1.02]	["中文ing123","1"]
4	NULL	NULL	NULL	1	[1,2,3,4]	[1.2,2.3,6.9,-1.02]	["中文ing123","1"]	2	[2,3,4,6]	[1.123,2.3126,2.3,-0.25]	[NULL,"a","sss"]
4	NULL	NULL	NULL	1	[1,2,3,4]	[1.2,2.3,6.9,-1.02]	["中文ing123","1"]	3	[7,1,5,9]	[NULL,0.12345,966.66]	["null","a","sss"]
4	NULL	NULL	NULL	1	[1,2,3,4]	[1.2,2.3,6.9,-1.02]	["中文ing123","1"]	4	NULL	NULL	NULL
4	NULL	NULL	NULL	2	[2,3,4,6]	[1.123,2.3126,2.3,-0.25]	[NULL,"a","sss"]	1	[1,2,3,4]	[1.2,2.3,6.9,-1.02]	["中文ing123","1"]
4	NULL	NULL	NULL	2	[2,3,4,6]	[1.123,2.3126,2.3,-0.25]	[NULL,"a","sss"]	2	[2,3,4,6]	[1.123,2.3126,2.3,-0.25]	[NULL,"a","sss"]
4	NULL	NULL	NULL	2	[2,3,4,6]	[1.123,2.3126,2.3,-0.25]	[NULL,"a","sss"]	3	[7,1,5,9]	[NULL,0.12345,966.66]	["null","a","sss"]
4	NULL	NULL	NULL	2	[2,3,4,6]	[1.123,2.3126,2.3,-0.25]	[NULL,"a","sss"]	4	NULL	NULL	NULL
4	NULL	NULL	NULL	3	[7,1,5,9]	[NULL,0.12345,966.66]	["null","a","sss"]	1	[1,2,3,4]	[1.2,2.3,6.9,-1.02]	["中文ing123","1"]
4	NULL	NULL	NULL	3	[7,1,5,9]	[NULL,0.12345,966.66]	["null","a","sss"]	2	[2,3,4,6]	[1.123,2.3126,2.3,-0.25]	[NULL,"a","sss"]
4	NULL	NULL	NULL	3	[7,1,5,9]	[NULL,0.12345,966.66]	["null","a","sss"]	3	[7,1,5,9]	[NULL,0.12345,966.66]	["null","a","sss"]
4	NULL	NULL	NULL	3	[7,1,5,9]	[NULL,0.12345,966.66]	["null","a","sss"]	4	NULL	NULL	NULL
4	NULL	NULL	NULL	4	NULL	NULL	NULL	1	[1,2,3,4]	[1.2,2.3,6.9,-1.02]	["中文ing123","1"]
4	NULL	NULL	NULL	4	NULL	NULL	NULL	2	[2,3,4,6]	[1.123,2.3126,2.3,-0.25]	[NULL,"a","sss"]
4	NULL	NULL	NULL	4	NULL	NULL	NULL	3	[7,1,5,9]	[NULL,0.12345,966.66]	["null","a","sss"]
4	NULL	NULL	NULL	4	NULL	NULL	NULL	4	NULL	NULL	NULL
select /*+ ENABLE_PARALLEL_DML PARALLEL(3) */* from t1 a,mv1 b,v1 c order by a.c1;
c1	c2	c3	c4	c1	c2	c3	c4	c1	c2	c3	c4
1	[1,2,3,4]	[1.2,2.3,6.9,-1.02]	["中文ing123","1"]	1	[1,2,3,4]	[1.2,2.3,6.9,-1.02]	["中文ing123","1"]	1	[1,2,3,4]	[1.2,2.3,6.9,-1.02]	["中文ing123","1"]
1	[1,2,3,4]	[1.2,2.3,6.9,-1.02]	["中文ing123","1"]	1	[1,2,3,4]	[1.2,2.3,6.9,-1.02]	["中文ing123","1"]	2	[2,3,4,6]	[1.123,2.3126,2.3,-0.25]	[NULL,"a","sss"]
1	[1,2,3,4]	[1.2,2.3,6.9,-1.02]	["中文ing123","1"]	1	[1,2,3,4]	[1.2,2.3,6.9,-1.02]	["中文ing123","1"]	3	[7,1,5,9]	[NULL,0.12345,966.66]	["null","a","sss"]
1	[1,2,3,4]	[1.2,2.3,6.9,-1.02]	["中文ing123","1"]	1	[1,2,3,4]	[1.2,2.3,6.9,-1.02]	["中文ing123","1"]	4	NULL	NULL	NULL
1	[1,2,3,4]	[1.2,2.3,6.9,-1.02]	["中文ing123","1"]	2	[2,3,4,6]	[1.123,2.3126,2.3,-0.25]	[NULL,"a","sss"]	1	[1,2,3,4]	[1.2,2.3,6.9,-1.02]	["中文ing123","1"]
1	[1,2,3,4]	[1.2,2.3,6.9,-1.02]	["中文ing123","1"]	2	[2,3,4,6]	[1.123,2.3126,2.3,-0.25]	[NULL,"a","sss"]	2	[2,3,4,6]	[1.123,2.3126,2.3,-0.25]	[NULL,"a","sss"]
1	[1,2,3,4]	[1.2,2.3,6.9,-1.02]	["中文ing123","1"]	2	[2,3,4,6]	[1.123,2.3126,2.3,-0.25]	[NULL,"a","sss"]	3	[7,1,5,9]	[NULL,0.12345,966.66]	["null","a","sss"]
1	[1,2,3,4]	[1.2,2.3,6.9,-1.02]	["中文ing123","1"]	2	[2,3,4,6]	[1.123,2.3126,2.3,-0.25]	[NULL,"a","sss"]	4	NULL	NULL	NULL
1	[1,2,3,4]	[1.2,2.3,6.9,-1.02]	["中文ing123","1"]	3	[7,1,5,9]	[NULL,0.12345,966.66]	["null","a","sss"]	1	[1,2,3,4]	[1.2,2.3,6.9,-1.02]	["中文ing123","1"]
1	[1,2,3,4]	[1.2,2.3,6.9,-1.02]	["中文ing123","1"]	3	[7,1,5,9]	[NULL,0.12345,966.66]	["null","a","sss"]	2	[2,3,4,6]	[1.123,2.3126,2.3,-0.25]	[NULL,"a","sss"]
1	[1,2,3,4]	[1.2,2.3,6.9,-1.02]	["中文ing123","1"]	3	[7,1,5,9]	[NULL,0.12345,966.66]	["null","a","sss"]	3	[7,1,5,9]	[NULL,0.12345,966.66]	["null","a","sss"]
1	[1,2,3,4]	[1.2,2.3,6.9,-1.02]	["中文ing123","1"]	3	[7,1,5,9]	[NULL,0.12345,966.66]	["null","a","sss"]	4	NULL	NULL	NULL
1	[1,2,3,4]	[1.2,2.3,6.9,-1.02]	["中文ing123","1"]	4	NULL	NULL	NULL	1	[1,2,3,4]	[1.2,2.3,6.9,-1.02]	["中文ing123","1"]
1	[1,2,3,4]	[1.2,2.3,6.9,-1.02]	["中文ing123","1"]	4	NULL	NULL	NULL	2	[2,3,4,6]	[1.123,2.3126,2.3,-0.25]	[NULL,"a","sss"]
1	[1,2,3,4]	[1.2,2.3,6.9,-1.02]	["中文ing123","1"]	4	NULL	NULL	NULL	3	[7,1,5,9]	[NULL,0.12345,966.66]	["null","a","sss"]
1	[1,2,3,4]	[1.2,2.3,6.9,-1.02]	["中文ing123","1"]	4	NULL	NULL	NULL	4	NULL	NULL	NULL
2	[2,3,4,6]	[1.123,2.3126,2.3,-0.25]	[NULL,"a","sss"]	1	[1,2,3,4]	[1.2,2.3,6.9,-1.02]	["中文ing123","1"]	1	[1,2,3,4]	[1.2,2.3,6.9,-1.02]	["中文ing123","1"]
2	[2,3,4,6]	[1.123,2.3126,2.3,-0.25]	[NULL,"a","sss"]	1	[1,2,3,4]	[1.2,2.3,6.9,-1.02]	["中文ing123","1"]	2	[2,3,4,6]	[1.123,2.3126,2.3,-0.25]	[NULL,"a","sss"]
2	[2,3,4,6]	[1.123,2.3126,2.3,-0.25]	[NULL,"a","sss"]	1	[1,2,3,4]	[1.2,2.3,6.9,-1.02]	["中文ing123","1"]	3	[7,1,5,9]	[NULL,0.12345,966.66]	["null","a","sss"]
2	[2,3,4,6]	[1.123,2.3126,2.3,-0.25]	[NULL,"a","sss"]	1	[1,2,3,4]	[1.2,2.3,6.9,-1.02]	["中文ing123","1"]	4	NULL	NULL	NULL
2	[2,3,4,6]	[1.123,2.3126,2.3,-0.25]	[NULL,"a","sss"]	2	[2,3,4,6]	[1.123,2.3126,2.3,-0.25]	[NULL,"a","sss"]	1	[1,2,3,4]	[1.2,2.3,6.9,-1.02]	["中文ing123","1"]
2	[2,3,4,6]	[1.123,2.3126,2.3,-0.25]	[NULL,"a","sss"]	2	[2,3,4,6]	[1.123,2.3126,2.3,-0.25]	[NULL,"a","sss"]	2	[2,3,4,6]	[1.123,2.3126,2.3,-0.25]	[NULL,"a","sss"]
2	[2,3,4,6]	[1.123,2.3126,2.3,-0.25]	[NULL,"a","sss"]	2	[2,3,4,6]	[1.123,2.3126,2.3,-0.25]	[NULL,"a","sss"]	3	[7,1,5,9]	[NULL,0.12345,966.66]	["null","a","sss"]
2	[2,3,4,6]	[1.123,2.3126,2.3,-0.25]	[NULL,"a","sss"]	2	[2,3,4,6]	[1.123,2.3126,2.3,-0.25]	[NULL,"a","sss"]	4	NULL	NULL	NULL
2	[2,3,4,6]	[1.123,2.3126,2.3,-0.25]	[NULL,"a","sss"]	3	[7,1,5,9]	[NULL,0.12345,966.66]	["null","a","sss"]	1	[1,2,3,4]	[1.2,2.3,6.9,-1.02]	["中文ing123","1"]
2	[2,3,4,6]	[1.123,2.3126,2.3,-0.25]	[NULL,"a","sss"]	3	[7,1,5,9]	[NULL,0.12345,966.66]	["null","a","sss"]	2	[2,3,4,6]	[1.123,2.3126,2.3,-0.25]	[NULL,"a","sss"]
2	[2,3,4,6]	[1.123,2.3126,2.3,-0.25]	[NULL,"a","sss"]	3	[7,1,5,9]	[NULL,0.12345,966.66]	["null","a","sss"]	3	[7,1,5,9]	[NULL,0.12345,966.66]	["null","a","sss"]
2	[2,3,4,6]	[1.123,2.3126,2.3,-0.25]	[NULL,"a","sss"]	3	[7,1,5,9]	[NULL,0.12345,966.66]	["null","a","sss"]	4	NULL	NULL	NULL
2	[2,3,4,6]	[1.123,2.3126,2.3,-0.25]	[NULL,"a","sss"]	4	NULL	NULL	NULL	1	[1,2,3,4]	[1.2,2.3,6.9,-1.02]	["中文ing123","1"]
2	[2,3,4,6]	[1.123,2.3126,2.3,-0.25]	[NULL,"a","sss"]	4	NULL	NULL	NULL	2	[2,3,4,6]	[1.123,2.3126,2.3,-0.25]	[NULL,"a","sss"]
2	[2,3,4,6]	[1.123,2.3126,2.3,-0.25]	[NULL,"a","sss"]	4	NULL	NULL	NULL	3	[7,1,5,9]	[NULL,0.12345,966.66]	["null","a","sss"]
2	[2,3,4,6]	[1.123,2.3126,2.3,-0.25]	[NULL,"a","sss"]	4	NULL	NULL	NULL	4	NULL	NULL	NULL
3	[7,1,5,9]	[NULL,0.12345,966.66]	["null","a","sss"]	1	[1,2,3,4]	[1.2,2.3,6.9,-1.02]	["中文ing123","1"]	1	[1,2,3,4]	[1.2,2.3,6.9,-1.02]	["中文ing123","1"]
3	[7,1,5,9]	[NULL,0.12345,966.66]	["null","a","sss"]	1	[1,2,3,4]	[1.2,2.3,6.9,-1.02]	["中文ing123","1"]	2	[2,3,4,6]	[1.123,2.3126,2.3,-0.25]	[NULL,"a","sss"]
3	[7,1,5,9]	[NULL,0.12345,966.66]	["null","a","sss"]	1	[1,2,3,4]	[1.2,2.3,6.9,-1.02]	["中文ing123","1"]	3	[7,1,5,9]	[NULL,0.12345,966.66]	["null","a","sss"]
3	[7,1,5,9]	[NULL,0.12345,966.66]	["null","a","sss"]	1	[1,2,3,4]	[1.2,2.3,6.9,-1.02]	["中文ing123","1"]	4	NULL	NULL	NULL
3	[7,1,5,9]	[NULL,0.12345,966.66]	["null","a","sss"]	2	[2,3,4,6]	[1.123,2.3126,2.3,-0.25]	[NULL,"a","sss"]	1	[1,2,3,4]	[1.2,2.3,6.9,-1.02]	["中文ing123","1"]
3	[7,1,5,9]	[NULL,0.12345,966.66]	["null","a","sss"]	2	[2,3,4,6]	[1.123,2.3126,2.3,-0.25]	[NULL,"a","sss"]	2	[2,3,4,6]	[1.123,2.3126,2.3,-0.25]	[NULL,"a","sss"]
3	[7,1,5,9]	[NULL,0.12345,966.66]	["null","a","sss"]	2	[2,3,4,6]	[1.123,2.3126,2.3,-0.25]	[NULL,"a","sss"]	3	[7,1,5,9]	[NULL,0.12345,966.66]	["null","a","sss"]
3	[7,1,5,9]	[NULL,0.12345,966.66]	["null","a","sss"]	2	[2,3,4,6]	[1.123,2.3126,2.3,-0.25]	[NULL,"a","sss"]	4	NULL	NULL	NULL
3	[7,1,5,9]	[NULL,0.12345,966.66]	["null","a","sss"]	3	[7,1,5,9]	[NULL,0.12345,966.66]	["null","a","sss"]	1	[1,2,3,4]	[1.2,2.3,6.9,-1.02]	["中文ing123","1"]
3	[7,1,5,9]	[NULL,0.12345,966.66]	["null","a","sss"]	3	[7,1,5,9]	[NULL,0.12345,966.66]	["null","a","sss"]	2	[2,3,4,6]	[1.123,2.3126,2.3,-0.25]	[NULL,"a","sss"]
3	[7,1,5,9]	[NULL,0.12345,966.66]	["null","a","sss"]	3	[7,1,5,9]	[NULL,0.12345,966.66]	["null","a","sss"]	3	[7,1,5,9]	[NULL,0.12345,966.66]	["null","a","sss"]
3	[7,1,5,9]	[NULL,0.12345,966.66]	["null","a","sss"]	3	[7,1,5,9]	[NULL,0.12345,966.66]	["null","a","sss"]	4	NULL	NULL	NULL
3	[7,1,5,9]	[NULL,0.12345,966.66]	["null","a","sss"]	4	NULL	NULL	NULL	1	[1,2,3,4]	[1.2,2.3,6.9,-1.02]	["中文ing123","1"]
3	[7,1,5,9]	[NULL,0.12345,966.66]	["null","a","sss"]	4	NULL	NULL	NULL	2	[2,3,4,6]	[1.123,2.3126,2.3,-0.25]	[NULL,"a","sss"]
3	[7,1,5,9]	[NULL,0.12345,966.66]	["null","a","sss"]	4	NULL	NULL	NULL	3	[7,1,5,9]	[NULL,0.12345,966.66]	["null","a","sss"]
3	[7,1,5,9]	[NULL,0.12345,966.66]	["null","a","sss"]	4	NULL	NULL	NULL	4	NULL	NULL	NULL
4	NULL	NULL	NULL	1	[1,2,3,4]	[1.2,2.3,6.9,-1.02]	["中文ing123","1"]	1	[1,2,3,4]	[1.2,2.3,6.9,-1.02]	["中文ing123","1"]
4	NULL	NULL	NULL	1	[1,2,3,4]	[1.2,2.3,6.9,-1.02]	["中文ing123","1"]	2	[2,3,4,6]	[1.123,2.3126,2.3,-0.25]	[NULL,"a","sss"]
4	NULL	NULL	NULL	1	[1,2,3,4]	[1.2,2.3,6.9,-1.02]	["中文ing123","1"]	3	[7,1,5,9]	[NULL,0.12345,966.66]	["null","a","sss"]
4	NULL	NULL	NULL	1	[1,2,3,4]	[1.2,2.3,6.9,-1.02]	["中文ing123","1"]	4	NULL	NULL	NULL
4	NULL	NULL	NULL	2	[2,3,4,6]	[1.123,2.3126,2.3,-0.25]	[NULL,"a","sss"]	1	[1,2,3,4]	[1.2,2.3,6.9,-1.02]	["中文ing123","1"]
4	NULL	NULL	NULL	2	[2,3,4,6]	[1.123,2.3126,2.3,-0.25]	[NULL,"a","sss"]	2	[2,3,4,6]	[1.123,2.3126,2.3,-0.25]	[NULL,"a","sss"]
4	NULL	NULL	NULL	2	[2,3,4,6]	[1.123,2.3126,2.3,-0.25]	[NULL,"a","sss"]	3	[7,1,5,9]	[NULL,0.12345,966.66]	["null","a","sss"]
4	NULL	NULL	NULL	2	[2,3,4,6]	[1.123,2.3126,2.3,-0.25]	[NULL,"a","sss"]	4	NULL	NULL	NULL
4	NULL	NULL	NULL	3	[7,1,5,9]	[NULL,0.12345,966.66]	["null","a","sss"]	1	[1,2,3,4]	[1.2,2.3,6.9,-1.02]	["中文ing123","1"]
4	NULL	NULL	NULL	3	[7,1,5,9]	[NULL,0.12345,966.66]	["null","a","sss"]	2	[2,3,4,6]	[1.123,2.3126,2.3,-0.25]	[NULL,"a","sss"]
4	NULL	NULL	NULL	3	[7,1,5,9]	[NULL,0.12345,966.66]	["null","a","sss"]	3	[7,1,5,9]	[NULL,0.12345,966.66]	["null","a","sss"]
4	NULL	NULL	NULL	3	[7,1,5,9]	[NULL,0.12345,966.66]	["null","a","sss"]	4	NULL	NULL	NULL
4	NULL	NULL	NULL	4	NULL	NULL	NULL	1	[1,2,3,4]	[1.2,2.3,6.9,-1.02]	["中文ing123","1"]
4	NULL	NULL	NULL	4	NULL	NULL	NULL	2	[2,3,4,6]	[1.123,2.3126,2.3,-0.25]	[NULL,"a","sss"]
4	NULL	NULL	NULL	4	NULL	NULL	NULL	3	[7,1,5,9]	[NULL,0.12345,966.66]	["null","a","sss"]
4	NULL	NULL	NULL	4	NULL	NULL	NULL	4	NULL	NULL	NULL
select c2 from t1 union select c2 from v1;
c2
[1,2,3,4]
[2,3,4,6]
[7,1,5,9]
NULL
select c3 from t1 union select c3 from v1;
c3
[1.2,2.3,6.9,-1.02]
[1.123,2.3126,2.3,-0.25]
[NULL,0.12345,966.66]
NULL
select c4 from t1 union select c4 from v1;
c4
["中文ing123","1"]
[NULL,"a","sss"]
["null","a","sss"]
NULL
select c2 from t1 union select c2 from mv1;
c2
[1,2,3,4]
[2,3,4,6]
[7,1,5,9]
NULL
select c3 from t1 union select c3 from mv1;
c3
[1.2,2.3,6.9,-1.02]
[1.123,2.3126,2.3,-0.25]
[NULL,0.12345,966.66]
NULL
select c4 from t1 union select c4 from mv1;
c4
["中文ing123","1"]
[NULL,"a","sss"]
["null","a","sss"]
NULL
select c2 from mv1 union select c2 from t1;
c2
[1,2,3,4]
[2,3,4,6]
[7,1,5,9]
NULL
select c3 from mv1 union select c3 from t1;
c3
[1.2,2.3,6.9,-1.02]
[1.123,2.3126,2.3,-0.25]
[NULL,0.12345,966.66]
NULL
select c4 from mv1 union select c4 from t1;
c4
["中文ing123","1"]
[NULL,"a","sss"]
["null","a","sss"]
NULL
drop table if exists t1;
CREATE TABLE t1 (c1 int primary key, c2 vector(4),c3 float[],c4 varchar(256)[]);
insert into t1 values(1,[1,2,3,4],[1.2,2.3,6.9,-1.02],['中文ing123',1,'1']);
insert into t1 values(2,[2,3,4,6],[1.123,2.3126,2.30,-0.25],[null,'a','sss']);
insert into t1 values(3,[7,1,5,9],[0.12345,null,966.66],['null','a','sss']);
insert into t1 values(4,null,null,null);
select count(*) from t1 a,t1 b,t1 c ;
count(*)
64
select count(array_map((x) -> (x), a.c2)) from t1 a,t1 b,t1 c order by a.c1;
count(array_map((x) -> (x), a.c2))
48
select count(array_map((x) -> (x), a.c3)) from t1 a,t1 b,t1 c order by a.c1;
count(array_map((x) -> (x), a.c3))
48
select count(array_map((x) -> (x), a.c4)) from t1 a,t1 b,t1 c order by a.c1;
count(array_map((x) -> (x), a.c4))
48
select count(array_map((x) -> (x), a.c2)) from t1 a,t1 b,t1 c where array_map((x) -> (x), a.c2)=array_map((x) -> (x), b.c2) and array_map((x) -> (x), a.c2)=array_map((x) -> (x), c.c2) order by a.c1;
count(array_map((x) -> (x), a.c2))
3
select count(array_map((x) -> (x), a.c3)) from t1 a,t1 b,t1 c where array_map((x) -> (x), a.c3)=array_map((x) -> (x), b.c3) and array_map((x) -> (x), a.c3)=array_map((x) -> (x), c.c3) order by a.c1;
count(array_map((x) -> (x), a.c3))
3
select count(array_map((x) -> (x), a.c4)) from t1 a,t1 b,t1 c where array_map((x) -> (x), a.c4)=array_map((x) -> (x), b.c4) and array_map((x) -> (x), a.c4)=array_map((x) -> (x), c.c4) order by a.c1;
count(array_map((x) -> (x), a.c4))
3
drop table if exists t1;
CREATE TABLE t1 (c1 int primary key, c2 int[],c3 float[],c4 varchar(256)[]);
insert into t1 values(1,[1,false],[1.123,null,96666],['中文ing123',1,'1']);
insert into t1 values(2,[0,0,99999,null],[0.12345,null,966.66],[null,'a','sss']);
insert into t1 values(3,[0,0,99999,null],[0.12345,null,966.66],['null','a','sss']);
insert into t1 values(4,[2,3,2,5],[2,3,3,5],[2,3,4,5]);
insert into t1 values(5,null,null,null);
SELECT c1,c2,c3,c4,array_map((x) -> (c2), [null]) from t1 group by array_map((x) -> (t1.c3), [1]);
ERROR 22000: Invalid data type for the operation
SELECT c1,c2,c3,c4,array_map((x) -> (c2), [null]) from t1 group by array_map((x) -> (x), [1]);
c1	c2	c3	c4	array_map((x) -> (c2), [null])
1	[1,0]	[1.123,NULL,96666]	["中文ing123","1","1"]	[[1,0]]
SELECT c1,c2,c3,c4,array_map((x) -> (c2), [null]) from t1 group by array_map((x) -> (null), [1]);
c1	c2	c3	c4	array_map((x) -> (c2), [null])
1	[1,0]	[1.123,NULL,96666]	["中文ing123","1","1"]	[[1,0]]
SELECT c1,c2,c3,c4,array_map((x) -> (c2), [null]) from t1 group by c1 having array_map((x) -> (x), null);
c1	c2	c3	c4	array_map((x) -> (c2), [null])
SELECT c1,c2,c3,c4,array_map((x) -> (c2), [null]) from t1 group by array_map((x) -> (null), [1]) having max(c1);
c1	c2	c3	c4	array_map((x) -> (c2), [null])
1	[1,0]	[1.123,NULL,96666]	["中文ing123","1","1"]	[[1,0]]
SELECT c1,c2,c3,c4,array_map((x) -> (c2), [null]) from t1 group by array_map((x) -> (null), [1]) having max(c2);
ERROR HY000: Invalid argument
drop table if exists t1;
CREATE TABLE t1 (c1 int primary key, c2 int[],c3 float[],c4 varchar(256)[]);
insert into t1 values(1,[1,false],[1.123,null,96666],['中文ing123',1,'1']);
insert into t1 values(2,[0,0,99999,null],[0.12345,null,966.66],[null,'a','sss']);
insert into t1 values(3,[0,0,99999,null],[0.12345,null,966.66],['null','a','sss']);
insert into t1 values(4,[2,3,2,5],[2,3,3,5],[2,3,4,5]);
insert into t1 values(5,null,null,null);
select c1,array_distinct(c4) from t1 where array_map((x)-> (null),null) is null order by c1;
c1	array_distinct(c4)
1	["中文ing123","1"]
2	[NULL,"a","sss"]
3	["null","a","sss"]
4	["2","3","4","5"]
5	NULL
select array_map((x) -> (t1.c3), [1]),(select array_map((x) -> (t1.c3), [1]) from t1 order by c1 limit 1) from t1 order by c1;
array_map((x) -> (t1.c3), [1])	(select array_map((x) -> (t1.c3), [1]) from t1 order by c1 limit 1)
[[1.123,NULL,96666]]	[[1.123,NULL,96666]]
[[0.12345,NULL,966.66]]	[[1.123,NULL,96666]]
[[0.12345,NULL,966.66]]	[[1.123,NULL,96666]]
[[2,3,3,5]]	[[1.123,NULL,96666]]
[NULL]	[[1.123,NULL,96666]]
select array_map((x) -> (a.c2), [1]) from (select c1,array_map((x) -> (t1.c3+t1.c3), [1]) c2 from t1 order by c1 limit 1) a order by a.c1;
array_map((x) -> (a.c2), [1])
[[[2.246,NULL,193332]]]
select array_map((x) -> (a.c2), [1]) from (select c1,array_map((x) -> (t1.c4), [1]) c2 from t1 order by c1 limit 1) a order by a.c1;
array_map((x) -> (a.c2), [1])
[[["中文ing123","1","1"]]]
select array_map((x) -> (a.c2), [1]) from (select c1,array_map((x) -> (t1.c2), [1]) c2 from t1 order by c1 limit 1) a order by a.c1;
array_map((x) -> (a.c2), [1])
[[[1,0]]]
select array_map((x) -> (t1.c2), [1]) from t1,(select c1,array_map((x) -> (t1.c3), [1]) c2 from t1 order by c1 limit 1) a where a.c1=t1.c1 order by a.c1;
array_map((x) -> (t1.c2), [1])
[[1,0]]
drop table if exists t1;
CREATE TABLE t1 (c1 int primary key, c2 int[],c3 float[],c4 varchar(256)[]);
insert into t1 values(1,[1,false],[1.123,null,96666],['中文ing123',1,'1']);
insert into t1 values(2,[0,0,99999,null],[0.12345,null,966.66],[null,'a','sss']);
insert into t1 values(3,[0,0,99999,null],[0.12345,null,966.66],['null','a','sss']);
insert into t1 values(4,[2,3,2,5],[2,3,3,5],[2,3,4,5]);
select * from t1 order by c2;
ERROR 22000: Invalid data type for the operation
select * from t1 order by array_map((x) -> (t1.c3), [1]);
ERROR 22000: Invalid data type for the operation
select * from t1 order by array_map((x) -> (null), [1]);
c1	c2	c3	c4
1	[1,0]	[1.123,NULL,96666]	["中文ing123","1","1"]
2	[0,0,99999,NULL]	[0.12345,NULL,966.66]	[NULL,"a","sss"]
3	[0,0,99999,NULL]	[0.12345,NULL,966.66]	["null","a","sss"]
4	[2,3,2,5]	[2,3,3,5]	["2","3","4","5"]
select * from t1 order by array_map((x) -> ([1,2,3]), [1]);
c1	c2	c3	c4
1	[1,0]	[1.123,NULL,96666]	["中文ing123","1","1"]
2	[0,0,99999,NULL]	[0.12345,NULL,966.66]	[NULL,"a","sss"]
3	[0,0,99999,NULL]	[0.12345,NULL,966.66]	["null","a","sss"]
4	[2,3,2,5]	[2,3,3,5]	["2","3","4","5"]
select * from t1 order by array_map((x) -> ([1,null,3]), [1]);
c1	c2	c3	c4
1	[1,0]	[1.123,NULL,96666]	["中文ing123","1","1"]
2	[0,0,99999,NULL]	[0.12345,NULL,966.66]	[NULL,"a","sss"]
3	[0,0,99999,NULL]	[0.12345,NULL,966.66]	["null","a","sss"]
4	[2,3,2,5]	[2,3,3,5]	["2","3","4","5"]
select * from t1 order by array_map((x) -> ([1,'a',3]), [1]);
c1	c2	c3	c4
1	[1,0]	[1.123,NULL,96666]	["中文ing123","1","1"]
2	[0,0,99999,NULL]	[0.12345,NULL,966.66]	[NULL,"a","sss"]
3	[0,0,99999,NULL]	[0.12345,NULL,966.66]	["null","a","sss"]
4	[2,3,2,5]	[2,3,3,5]	["2","3","4","5"]
select * from t1 order by array_map((x) -> (['abc']), [1]);
c1	c2	c3	c4
1	[1,0]	[1.123,NULL,96666]	["中文ing123","1","1"]
2	[0,0,99999,NULL]	[0.12345,NULL,966.66]	[NULL,"a","sss"]
3	[0,0,99999,NULL]	[0.12345,NULL,966.66]	["null","a","sss"]
4	[2,3,2,5]	[2,3,3,5]	["2","3","4","5"]
select * from t1 order by array_map((x) -> ((select 1)), [1]);
ERROR 0A000: expr in lambda function not supported
select * from t1 order by c2 desc;
ERROR 22000: Invalid data type for the operation
select * from t1 order by array_map((x) -> (t1.c3), [1]) desc ;
ERROR 22000: Invalid data type for the operation
select * from t1 order by array_map((x) -> (null), [1]) desc ;
c1	c2	c3	c4
1	[1,0]	[1.123,NULL,96666]	["中文ing123","1","1"]
2	[0,0,99999,NULL]	[0.12345,NULL,966.66]	[NULL,"a","sss"]
3	[0,0,99999,NULL]	[0.12345,NULL,966.66]	["null","a","sss"]
4	[2,3,2,5]	[2,3,3,5]	["2","3","4","5"]
select * from t1 order by c2 desc;
ERROR 22000: Invalid data type for the operation
select * from t1 order by array_map((x) -> (t1.c3), [1]) asc ;
ERROR 22000: Invalid data type for the operation
select * from t1 order by array_map((x) -> (null), [1]) asc ;
c1	c2	c3	c4
1	[1,0]	[1.123,NULL,96666]	["中文ing123","1","1"]
2	[0,0,99999,NULL]	[0.12345,NULL,966.66]	[NULL,"a","sss"]
3	[0,0,99999,NULL]	[0.12345,NULL,966.66]	["null","a","sss"]
4	[2,3,2,5]	[2,3,3,5]	["2","3","4","5"]
select * from t1 order by array_map((x) -> (1), [1]) asc ;
c1	c2	c3	c4
1	[1,0]	[1.123,NULL,96666]	["中文ing123","1","1"]
2	[0,0,99999,NULL]	[0.12345,NULL,966.66]	[NULL,"a","sss"]
3	[0,0,99999,NULL]	[0.12345,NULL,966.66]	["null","a","sss"]
4	[2,3,2,5]	[2,3,3,5]	["2","3","4","5"]
drop table if exists t1;
CREATE TABLE t1 (c1 int primary key, c2 int[],c3 float[],c4 varchar(256)[]);
insert into t1 values(1,[1,2,3,5],[2.123,2.123,3.123,4.123],['中文ing123',1,'1']);
insert into t1 values(2,[2,3,4,4],[2.123,2.123,3.123,4.123],[null,'a','sss']);
insert into t1 values(3,[3,3,3,3],[3.123,2.123,3.123,4.123],['null','a','sss']);
insert into t1 values(4,[2,3,4,5],[4.123,2.123,3.123,4.123],[2,3,4,5]);
insert into t1 values(5,null,null,null);
select array_map((x) -> (x), (select c4 from t1 order by c1 limit 1)) from t1 order by c1;
array_map((x) -> (x), (select c4 from t1 order by c1 limit 1))
["中文ing123","1","1"]
["中文ing123","1","1"]
["中文ing123","1","1"]
["中文ing123","1","1"]
["中文ing123","1","1"]
select array_map((x,y) -> (x+y), c2,c3+c2) from t1 order by c1;
array_map((x,y) -> (x+y), c2,c3+c2)
[4.122999906539917,6.122999906539917,9.122999906539917,14.123000144958496]
[6.122999906539917,8.122999906539917,11.122999906539917,12.123000144958496]
[9.122999906539917,8.122999906539917,9.122999906539917,10.123000144958496]
[8.123000144958496,8.122999906539917,11.122999906539917,14.123000144958496]
NULL
select array_map((x,y) -> (x+y), c2,c3+[1,2,3,4]) from t1 order by c1;
array_map((x,y) -> (x+y), c2,c3+[1,2,3,4])
[4.122999906539917,6.122999906539917,9.122999906539917,13.123000144958496]
[5.122999906539917,7.122999906539917,10.122999906539917,12.123000144958496]
[7.122999906539917,7.122999906539917,9.122999906539917,11.123000144958496]
[7.123000144958496,7.122999906539917,10.122999906539917,13.123000144958496]
NULL
select array_map((x,y) -> (x+y), c2,c3) +c2 from t1 order by c1;
array_map((x,y) -> (x+y), c2,c3) +c2
[4.122999906539917,6.122999906539917,9.122999906539917,14.123000144958496]
[6.122999906539917,8.122999906539917,11.122999906539917,12.123000144958496]
[9.122999906539917,8.122999906539917,9.122999906539917,10.123000144958496]
[8.123000144958496,8.122999906539917,11.122999906539917,14.123000144958496]
NULL
select array_map((x,y) -> (x+y), c2,c3) +c3 from t1 order by c1;
array_map((x,y) -> (x+y), c2,c3) +c3
[5.245999813079834,6.245999813079834,9.245999813079834,13.246000289916992]
[6.245999813079834,7.245999813079834,10.245999813079834,12.246000289916992]
[9.245999813079834,7.245999813079834,9.245999813079834,11.246000289916992]
[10.246000289916992,7.245999813079834,10.245999813079834,13.246000289916992]
NULL
select array_map((x,y) -> (x*y), c2,c3+c2) from t1 order by c1;
array_map((x,y) -> (x*y), c2,c3+c2)
[3.122999906539917,8.245999813079834,18.36899971961975,45.61500072479248]
[8.245999813079834,15.368999719619751,28.491999626159668,32.492000579833984]
[18.36899971961975,15.368999719619751,18.36899971961975,21.36900043487549]
[12.246000289916992,15.368999719619751,28.491999626159668,45.61500072479248]
NULL
select array_map((x,y) -> (x*y), c2,c3+[1,2,3,4]) from t1 order by c1;
array_map((x,y) -> (x*y), c2,c3+[1,2,3,4])
[3.122999906539917,8.245999813079834,18.36899971961975,40.61500072479248]
[6.245999813079834,12.368999719619751,24.491999626159668,32.492000579833984]
[12.368999719619751,12.368999719619751,18.36899971961975,24.36900043487549]
[10.246000289916992,12.368999719619751,24.491999626159668,40.61500072479248]
NULL
select array_map((x,y) -> (x*y), c2,c3) +c2 from t1 order by c1;
array_map((x,y) -> (x*y), c2,c3) +c2
[3.122999906539917,6.245999813079834,12.368999719619751,25.61500072479248]
[6.245999813079834,9.368999719619751,16.491999626159668,20.492000579833984]
[12.368999719619751,9.368999719619751,12.368999719619751,15.369000434875488]
[10.246000289916992,9.368999719619751,16.491999626159668,25.61500072479248]
NULL
select array_map((x,y) -> (x*y), c2,c3) +c3 from t1 order by c1;
array_map((x,y) -> (x*y), c2,c3) +c3
[4.245999813079834,6.368999719619751,12.491999626159668,24.738000869750977]
[6.368999719619751,8.491999626159668,15.614999532699585,20.61500072479248]
[12.491999626159668,8.491999626159668,12.491999626159668,16.492000579833984]
[12.369000434875488,8.491999626159668,15.614999532699585,24.738000869750977]
NULL
select array_map((x,y) -> (x-y), c2,c3+c2) from t1 order by c1;
array_map((x,y) -> (x-y), c2,c3+c2)
[-2.122999906539917,-2.122999906539917,-3.122999906539917,-4.123000144958496]
[-2.122999906539917,-2.122999906539917,-3.122999906539917,-4.123000144958496]
[-3.122999906539917,-2.122999906539917,-3.122999906539917,-4.123000144958496]
[-4.123000144958496,-2.122999906539917,-3.122999906539917,-4.123000144958496]
NULL
select array_map((x,y) -> (x-y), c2,c3+[1,2,3,4]) from t1 order by c1;
array_map((x,y) -> (x-y), c2,c3+[1,2,3,4])
[-2.122999906539917,-2.122999906539917,-3.122999906539917,-3.123000144958496]
[-1.122999906539917,-1.122999906539917,-2.122999906539917,-4.123000144958496]
[-1.122999906539917,-1.122999906539917,-3.122999906539917,-5.123000144958496]
[-3.123000144958496,-1.122999906539917,-2.122999906539917,-3.123000144958496]
NULL
select array_map((x,y) -> (x-y), c2,c3) +c2 from t1 order by c1;
array_map((x,y) -> (x-y), c2,c3) +c2
[-0.12299990653991699,1.877000093460083,2.877000093460083,5.876999855041504]
[1.877000093460083,3.877000093460083,4.877000093460083,3.876999855041504]
[2.877000093460083,3.877000093460083,2.877000093460083,1.876999855041504]
[-0.1230001449584961,3.877000093460083,4.877000093460083,5.876999855041504]
NULL
select array_map((x,y) -> (x-y), c2,c3) +c3 from t1 order by c1;
array_map((x,y) -> (x-y), c2,c3) +c3
[1,2,3,5]
[2,3,4,4]
[3,3,3,3]
[2,3,4,5]
NULL
select array_map((x,y) -> (x/y), c2,c3+c2) from t1 order by c1;
array_map((x,y) -> (x/y), c2,c3+c2)
[0.32020494073851435,0.4850836879301387,0.48995591144721873,0.5480653206788639]
[0.4850836879301387,0.5855943889771033,0.5615611473372949,0.4924288967891478]
[0.48995591144721873,0.5855943889771033,0.48995591144721873,0.42117084640568686]
[0.32663726157947964,0.5855943889771033,0.5615611473372949,0.5480653206788639]
NULL
select array_map((x,y) -> (x/y), c2,c3+[1,2,3,4]) from t1 order by c1;
array_map((x,y) -> (x/y), c2,c3+[1,2,3,4])
[0.32020494073851435,0.4850836879301387,0.48995591144721873,0.6155361209864347]
[0.6404098814770287,0.727625531895208,0.6532745485962916,0.4924288967891478]
[0.727625531895208,0.727625531895208,0.48995591144721873,0.3693216725918609]
[0.3903962411494726,0.727625531895208,0.6532745485962916,0.6155361209864347]
NULL
select array_map((x,y) -> (x/y), c2,c3) +c2 from t1 order by c1;
array_map((x,y) -> (x/y), c2,c3) +c2
[1.4710315798505185,2.942063159701037,3.9606148222155433,6.212709149698643]
[2.942063159701037,4.413094739551555,5.280819762954057,4.9701673197589145]
[3.9606148222155433,4.413094739551555,3.9606148222155433,3.727625489819186]
[2.4850836598794572,4.413094739551555,5.280819762954057,6.212709149698643]
NULL
select array_map((x,y) -> (x/y), c2,c3) +c3 from t1 order by c1;
array_map((x,y) -> (x/y), c2,c3) +c3
[2.5940314863904352,3.065063066240954,4.08361472875546,5.335709294657139]
[3.065063066240954,3.536094646091472,4.403819669493974,5.0931674647174106]
[4.08361472875546,3.536094646091472,4.08361472875546,4.850625634777682]
[4.608083804837953,3.536094646091472,4.403819669493974,5.335709294657139]
NULL
select array_map((x,y) -> (x/y+x*y-x), c2,c3+c2) from t1 order by c1;
array_map((x,y) -> (x/y+x*y-x), c2,c3+c2)
[2.443204847278431,6.731083501009973,15.85895563106697,41.163066045471346]
[6.731083501009973,12.954594108596854,25.05356077349696,28.984429476623134]
[15.85895563106697,12.954594108596854,15.85895563106697,18.790171281281175]
[10.572637551496472,12.954594108596854,25.05356077349696,41.163066045471346]
NULL
select array_map((x,y) -> (x/y+x*y-x), c2,c3+[1,2,3,4]) from t1 order by c1;
array_map((x,y) -> (x/y+x*y-x), c2,c3+[1,2,3,4])
[2.443204847278431,6.731083501009973,15.85895563106697,36.230536845778914]
[4.886409694556862,10.09662525151496,21.14527417475596,28.984429476623134]
[10.09662525151496,10.09662525151496,15.85895563106697,21.73832210746735]
[8.636396531066465,10.09662525151496,21.14527417475596,36.230536845778914]
NULL
select array_map((x,y) -> (x/y+x*y-x), c2,c3) +c2 from t1 order by c1;
array_map((x,y) -> (x/y+x*y-x), c2,c3) +c2
[2.5940314863904352,5.1880629727808705,10.329614541835294,21.827709874491124]
[5.1880629727808705,7.782094459171306,13.772819389113724,17.4621678995929]
[10.329614541835294,7.782094459171306,10.329614541835294,13.096625924694674]
[8.73108394979645,7.782094459171306,13.772819389113724,21.827709874491124]
NULL
select array_map((x,y) -> (x/y+x*y-x), c2,c3) +c3 from t1 order by c1;
array_map((x,y) -> (x/y+x*y-x), c2,c3) +c3
[3.7170313929303522,5.3110628793207875,10.452614448375211,20.95071001944962]
[5.3110628793207875,6.905094365711223,12.895819295653641,17.585168044551395]
[10.452614448375211,6.905094365711223,10.452614448375211,14.21962606965317]
[10.854084094754946,6.905094365711223,12.895819295653641,20.95071001944962]
NULL
drop table if exists t1;
CREATE TABLE t1 (c1 int primary key, c2 int[],c3 float[],c4 varchar(256)[]);
insert into t1 values(1,[1,2,3,5],[2.123,2.123,3.123,4.123],['中文ing123',1,'1']);
insert into t1 values(2,[2,3,4,4],[2.123,2.123,3.123,4.123],[null,'a','sss']);
insert into t1 values(3,[3,3,3,3],[3.123,2.123,3.123,4.123],['null','a','sss']);
insert into t1 values(4,[2,3,4,5],[4.123,2.123,3.123,4.123],[2,3,4,5]);
insert into t1 values(5,null,null,null);
select array_map((x,y) -> ((cast(c2 as json))), c2,c3) from t1 order by c1;
ERROR 22000: Invalid data type for the operation
select array_map((x,y) -> (cast(c2 as json)), c2,c3)  from t1 order by c1;
ERROR 22000: Invalid data type for the operation
select cast(array_map((x,y) -> (x+y), c2,c3)  as  char(30))  from t1 order by c1;
ERROR 22000: Invalid data type for the operation
select cast(array_map((x,y) -> (x+y), c2,c3)  as  json)  from t1 order by c1;
ERROR 22000: Invalid data type for the operation
drop table if exists t1;
CREATE TABLE t1 (c1 int primary key, c2 int[],c3 float[],c4 varchar(256)[]);
insert into t1 values(1,[1,2,3,5],[2.123,2.123,3.123,4.123],['中文ing123',1,'1']);
insert into t1 values(2,[2,3,4,4],[2.123,2.123,3.123,4.123],[null,'a','sss']);
insert into t1 values(3,[3,3,3,3],[3.123,2.123,3.123,4.123],['null','a','sss']);
insert into t1 values(4,[2,3,4,5],[4.123,2.123,3.123,4.123],[2,3,4,5]);
insert into t1 values(5,null,null,null);
select distinct array_map((x) -> (c1), c2) from t1 order by c1;
ERROR 22000: Invalid data type for the operation
select distinct array_map((x) -> (null), c2) from t1 order by c1;
ERROR 22000: Invalid data type for the operation
select  array_map((x) -> ( distinct c1), c2) from t1 order by c1;
ERROR 42000: You have an error in your SQL syntax; check the manual that corresponds to your OceanBase version for the right syntax to use near 'distinct c1), c2) from t1 order by c1' at line 1
select  array_map((x) -> ( c1), distinct c2) from t1 order by c1;
ERROR 42000: You have an error in your SQL syntax; check the manual that corresponds to your OceanBase version for the right syntax to use near 'distinct c2) from t1 order by c1' at line 1
drop table if exists t1;
CREATE TABLE t1 (c1 int primary key, c2 int[],c3 float[],c4 varchar(256)[]);
insert into t1 values(1,[1,2,3,5],[2.123,2.123,3.123,4.123],['中文ing123',1,'1']);
insert into t1 values(2,[2,3,4,4],[2.123,2.123,3.123,4.123],[null,'a','sss']);
insert into t1 values(3,[3,3,3,3],[3.123,2.123,3.123,4.123],['null','a','sss']);
insert into t1 values(4,[2,3,4,5],[4.123,2.123,3.123,4.123],[2,3,4,5]);
insert into t1 values(5,null,null,null);
select array_map((x) -> (max(c1)), c2)  from t1 order by c1;
ERROR 0A000: expr in lambda function not supported
select max(array_map((x) -> (c1), c2))  from t1 order by c1;
ERROR HY000: Invalid argument
select array_map((x) -> (c1), max(c2))  from t1 order by c1;
ERROR HY000: Invalid argument
select array_map((x) -> (c1), max(c1))  from t1 order by c1;
ERROR 22000: Invalid data type for the operation
select array_map((x) -> (c1+max(c1)), c2)  from t1 order by c1;
ERROR 0A000: aggr expr in lambda function not supported
select array_map((x) -> (min(c1)), c2)  from t1 order by c1;
ERROR 0A000: expr in lambda function not supported
select min(array_map((x) -> (c1), c2))  from t1 order by c1;
ERROR HY000: Invalid argument
select array_map((x) -> (c1), min(c2))  from t1 order by c1;
ERROR HY000: Invalid argument
select array_map((x) -> (c1), min(c1))  from t1 order by c1;
ERROR 22000: Invalid data type for the operation
select array_map((x) -> (c1+min(c1)), c2)  from t1 order by c1;
ERROR 0A000: aggr expr in lambda function not supported
select array_map((x) -> (count(c1)), c2)  from t1 order by c1;
ERROR 0A000: expr in lambda function not supported
select count(array_map((x) -> (c1), c2))  from t1 order by c1;
count(array_map((x) -> (c1), c2))
4
select array_map((x) -> (c1), count(c2))  from t1 order by c1;
ERROR 22000: Invalid data type for the operation
select array_map((x) -> (c1), count(c1))  from t1 order by c1;
ERROR 22000: Invalid data type for the operation
select array_map((x) -> (c1+count(c1)), c2)  from t1 order by c1;
ERROR 0A000: aggr expr in lambda function not supported
select array_map((x) -> (sum(c1)), c2)  from t1 order by c1;
ERROR 0A000: expr in lambda function not supported
select sum(array_map((x) -> (c1), c2))  from t1 order by c1;
ERROR 0A000: Not supported feature or function
select array_map((x) -> (c1), sum(c2))  from t1 order by c1;
ERROR 0A000: Not supported feature or function
select array_map((x) -> (c1), sum(c1))  from t1 order by c1;
ERROR 22000: Invalid data type for the operation
select array_map((x) -> (c1+sum(c1)), c2)  from t1 order by c1;
ERROR 0A000: aggr expr in lambda function not supported
drop table if exists t1;
CREATE TABLE t1 (c1 int primary key, c2 int[],c3 float[],c4 varchar(256)[]);
insert into t1 values(1,[1,2,3,5],[2.123,2.123,3.123,4.123],['中文ing123',1,'1']);
insert into t1 values(2,[2,3,4,4],[2.123,2.123,3.123,4.123],[null,'a','sss']);
insert into t1 values(3,[3,3,3,3],[3.123,2.123,3.123,4.123],['null','a','sss']);
insert into t1 values(4,[2,3,4,5],[4.123,2.123,3.123,4.123],[2,3,4,5]);
insert into t1 values(5,null,null,null);
drop table if exists t2;
create table t2 like t1;
replace into t2 select * from t1;
select array_map((x) -> (x), (select array_map((x) -> (t1.c4), t1.c2) from t1 order by c1 limit 1));
array_map((x) -> (x), (select array_map((x) -> (t1.c4), t1.c2) from t1 order by c1 limit 1))
[["中文ing123","1","1"],["中文ing123","1","1"],["中文ing123","1","1"],["中文ing123","1","1"]]
select array_map((x) -> (x), (select array_map((x) -> (t1.c3), t1.c2) from t1 order by c1 limit 1));
array_map((x) -> (x), (select array_map((x) -> (t1.c3), t1.c2) from t1 order by c1 limit 1))
[[2.123,2.123,3.123,4.123],[2.123,2.123,3.123,4.123],[2.123,2.123,3.123,4.123],[2.123,2.123,3.123,4.123]]
with ct1 as(
select array_map((x) -> (c2), c2) from t1 order by c1)
select array_map((x) -> (c4), c2) from t1 where c3 is not null order by c1 ;
array_map((x) -> (c4), c2)
[["中文ing123","1","1"],["中文ing123","1","1"],["中文ing123","1","1"],["中文ing123","1","1"]]
[[NULL,"a","sss"],[NULL,"a","sss"],[NULL,"a","sss"],[NULL,"a","sss"]]
[["null","a","sss"],["null","a","sss"],["null","a","sss"],["null","a","sss"]]
[["2","3","4","5"],["2","3","4","5"],["2","3","4","5"],["2","3","4","5"]]
with ct1 as(
select  array_map((x) -> (t1.c2), t1.c2) from t1 order by c1)
select  t1.c1,t2.c2,array_map((x) -> (t1.c4), t1.c2) from t1 join t2 on array_map((x) -> (t1.c4), t1.c2)=array_map((x) -> (t2.c4), t2.c2) order by t1.c1;
c1	c2	array_map((x) -> (t1.c4), t1.c2)
1	[1,2,3,5]	[["中文ing123","1","1"],["中文ing123","1","1"],["中文ing123","1","1"],["中文ing123","1","1"]]
2	[2,3,4,4]	[[NULL,"a","sss"],[NULL,"a","sss"],[NULL,"a","sss"],[NULL,"a","sss"]]
3	[3,3,3,3]	[["null","a","sss"],["null","a","sss"],["null","a","sss"],["null","a","sss"]]
4	[2,3,4,5]	[["2","3","4","5"],["2","3","4","5"],["2","3","4","5"],["2","3","4","5"]]
SELECT count(t1.c1), CASE WHEN array_map((x) -> (t1.c2), t1.c2)=[[1,2,3,5],[1,2,3,5],[1,2,3,5],[1,2,3,5]] THEN 'High' ELSE 'Low' END AS A FROM T1;
count(t1.c1)	A
5	High
drop table if exists t1;
CREATE TABLE t1 (c1 int primary key, c2 int[],c3 float[],c4 varchar(256)[]);
insert into t1 values(1,[1,2,3,5],[2.123,2.123,3.123,4.123],['中文ing123',1,'1']);
insert into t1 values(2,[2,3,4,4],[2.123,2.123,3.123,4.123],[null,'a','sss']);
insert into t1 values(3,[3,3,3,3],[3.123,2.123,3.123,4.123],['null','a','sss']);
insert into t1 values(4,[2,3,4,5],[4.123,2.123,3.123,4.123],[2,3,4,5]);
insert into t1 values(5,null,null,null);
drop table if exists t2;
create table t2 like t1;
replace into t2 select * from t1;
select * from t1 limit array_map((x) -> (c2), [1]);
ERROR 42000: You have an error in your SQL syntax; check the manual that corresponds to your OceanBase version for the right syntax to use near 'array_map((x) -> (c2), [1])' at line 1
select * from t1,t2 where t1.c2=t2.c2 order by t1.c1 limit array_map((x) -> (t1.c2), t1.c2)=[[1,2,3,5],[1,2,3,5],[1,2,3,5],[1,2,3,5]];
ERROR 42000: You have an error in your SQL syntax; check the manual that corresponds to your OceanBase version for the right syntax to use near 'array_map((x) -> (t1.c2), t1.c2)=[[1,2,3,5],[1,2,3,5],[1,2,3,5],[1,2,3,5]]' at line 1
drop table if exists t1;
CREATE TABLE t1 (c1 int primary key, c2 int[],c3 float[],c4 varchar(256)[]);
insert into t1 values(1,[1,2,3,5],[2.123,2.123,3.123,4.123],['中文ing123',1,'1']);
insert into t1 values(2,[2,3,4,4],[2.123,2.123,3.123,4.123],[null,'a','sss']);
insert into t1 values(3,[3,3,3,3],[3.123,2.123,3.123,4.123],['null','a','sss']);
insert into t1 values(4,[2,3,4,5],[4.123,2.123,3.123,4.123],[2,3,4,5]);
insert into t1 values(5,null,null,null);
drop table if exists t2;
create table t2 like t1;
replace into t2 select * from t1;
select c1,c2,c3,c4 from t1 where array_map((x) -> (x), c2) = [1,2,3,5] ;
c1	c2	c3	c4
1	[1,2,3,5]	[2.123,2.123,3.123,4.123]	["中文ing123","1","1"]
select c1,c2,c3,c4 from t1 where array_map((x) -> (x), c2) = [1,2,3,5] for update;
c1	c2	c3	c4
1	[1,2,3,5]	[2.123,2.123,3.123,4.123]	["中文ing123","1","1"]
select c1,c2,c3,c4 from t1 where array_map((x) -> (x), c4) = ['中文ing123',1,'1'] ;
c1	c2	c3	c4
1	[1,2,3,5]	[2.123,2.123,3.123,4.123]	["中文ing123","1","1"]
select c1,c2,c3,c4 from t1 where array_map((x) -> (x), c4) = ['中文ing123',1,'1'] for update;
c1	c2	c3	c4
1	[1,2,3,5]	[2.123,2.123,3.123,4.123]	["中文ing123","1","1"]
select array_map((x) -> (c2), c3) from t1 order by t1.c1 for update;
array_map((x) -> (c2), c3)
[[1,2,3,5],[1,2,3,5],[1,2,3,5],[1,2,3,5]]
[[2,3,4,4],[2,3,4,4],[2,3,4,4],[2,3,4,4]]
[[3,3,3,3],[3,3,3,3],[3,3,3,3],[3,3,3,3]]
[[2,3,4,5],[2,3,4,5],[2,3,4,5],[2,3,4,5]]
NULL
select /*+ ENABLE_PARALLEL_DML PARALLEL(3) */array_map((x) -> (c2), c3) from t1 order by t1.c1 for update;
array_map((x) -> (c2), c3)
[[1,2,3,5],[1,2,3,5],[1,2,3,5],[1,2,3,5]]
[[2,3,4,4],[2,3,4,4],[2,3,4,4],[2,3,4,4]]
[[3,3,3,3],[3,3,3,3],[3,3,3,3],[3,3,3,3]]
[[2,3,4,5],[2,3,4,5],[2,3,4,5],[2,3,4,5]]
NULL
select array_map((x) -> (t1.c2), t1.c3) from t1,t2 where t1.c2=t2.c2 order by t1.c1 for update;
array_map((x) -> (t1.c2), t1.c3)
[[1,2,3,5],[1,2,3,5],[1,2,3,5],[1,2,3,5]]
[[2,3,4,4],[2,3,4,4],[2,3,4,4],[2,3,4,4]]
[[3,3,3,3],[3,3,3,3],[3,3,3,3],[3,3,3,3]]
[[2,3,4,5],[2,3,4,5],[2,3,4,5],[2,3,4,5]]
select array_map((x) -> (t2.c2), t2.c4) from t1,t2 where t1.c2=t2.c2 order by t1.c1 for update;
array_map((x) -> (t2.c2), t2.c4)
[[1,2,3,5],[1,2,3,5],[1,2,3,5]]
[[2,3,4,4],[2,3,4,4],[2,3,4,4]]
[[3,3,3,3],[3,3,3,3],[3,3,3,3]]
[[2,3,4,5],[2,3,4,5],[2,3,4,5],[2,3,4,5]]
select /*+ ENABLE_PARALLEL_DML PARALLEL(3) */array_map((x) -> (t1.c2), t1.c3) from t1,t2 where t1.c2=t2.c2 order by t1.c1 for update;
array_map((x) -> (t1.c2), t1.c3)
[[1,2,3,5],[1,2,3,5],[1,2,3,5],[1,2,3,5]]
[[2,3,4,4],[2,3,4,4],[2,3,4,4],[2,3,4,4]]
[[3,3,3,3],[3,3,3,3],[3,3,3,3],[3,3,3,3]]
[[2,3,4,5],[2,3,4,5],[2,3,4,5],[2,3,4,5]]
select /*+ ENABLE_PARALLEL_DML PARALLEL(3) */array_map((x) -> (t2.c2), t2.c4) from t1,t2 where t1.c2=t2.c2 order by t1.c1 for update;
array_map((x) -> (t2.c2), t2.c4)
[[1,2,3,5],[1,2,3,5],[1,2,3,5]]
[[2,3,4,4],[2,3,4,4],[2,3,4,4]]
[[3,3,3,3],[3,3,3,3],[3,3,3,3]]
[[2,3,4,5],[2,3,4,5],[2,3,4,5],[2,3,4,5]]
drop table if exists t1;
CREATE TABLE t1 (c1 int primary key, c2 int[],c3 float[],c4 varchar(256)[]);
insert into t1 values(1,[1,2,3,5],[2.123,2.123,3.123,4.123],['中文ing123',1,'1']);
insert into t1 values(2,[2,3,4,4],[2.123,2.123,3.123,4.123],[null,'a','sss']);
insert into t1 values(3,[3,3,3,3],[3.123,2.123,3.123,4.123],['null','a','sss']);
insert into t1 values(4,[2,3,4,5],[4.123,2.123,3.123,4.123],[2,3,4,5]);
insert into t1 values(5,null,null,null);
drop table if exists t2;
create table t2 like t1;
replace into t2 select * from t1;
select array_map((x) -> (c2), c3) a   from t1 order by t1.c1  ;
a
[[1,2,3,5],[1,2,3,5],[1,2,3,5],[1,2,3,5]]
[[2,3,4,4],[2,3,4,4],[2,3,4,4],[2,3,4,4]]
[[3,3,3,3],[3,3,3,3],[3,3,3,3],[3,3,3,3]]
[[2,3,4,5],[2,3,4,5],[2,3,4,5],[2,3,4,5]]
NULL
select /*+ ENABLE_PARALLEL_DML PARALLEL(3) */array_map((x) -> (c2), c3)  a from t1 order by t1.c1;
a
[[1,2,3,5],[1,2,3,5],[1,2,3,5],[1,2,3,5]]
[[2,3,4,4],[2,3,4,4],[2,3,4,4],[2,3,4,4]]
[[3,3,3,3],[3,3,3,3],[3,3,3,3],[3,3,3,3]]
[[2,3,4,5],[2,3,4,5],[2,3,4,5],[2,3,4,5]]
NULL
select array_map((x) -> (c2), c3) x ,array_map((x) -> (c2), c3) x, array_map((x) -> (c2), c3) x from t1 order by t1.c1  ;
x	x	x
[[1,2,3,5],[1,2,3,5],[1,2,3,5],[1,2,3,5]]	[[1,2,3,5],[1,2,3,5],[1,2,3,5],[1,2,3,5]]	[[1,2,3,5],[1,2,3,5],[1,2,3,5],[1,2,3,5]]
[[2,3,4,4],[2,3,4,4],[2,3,4,4],[2,3,4,4]]	[[2,3,4,4],[2,3,4,4],[2,3,4,4],[2,3,4,4]]	[[2,3,4,4],[2,3,4,4],[2,3,4,4],[2,3,4,4]]
[[3,3,3,3],[3,3,3,3],[3,3,3,3],[3,3,3,3]]	[[3,3,3,3],[3,3,3,3],[3,3,3,3],[3,3,3,3]]	[[3,3,3,3],[3,3,3,3],[3,3,3,3],[3,3,3,3]]
[[2,3,4,5],[2,3,4,5],[2,3,4,5],[2,3,4,5]]	[[2,3,4,5],[2,3,4,5],[2,3,4,5],[2,3,4,5]]	[[2,3,4,5],[2,3,4,5],[2,3,4,5],[2,3,4,5]]
NULL	NULL	NULL
select array_map((x) -> (c2), c3) 中文中文中文中文中文中文,array_map((x) -> (c2), c3) 中文中文中文中文中文, array_map((x) -> (c2), c3) 中文中文中文中文中文中文 from t1 order by t1.c1  ;
中文中文中文中文中文中文	中文中文中文中文中文	中文中文中文中文中文中文
[[1,2,3,5],[1,2,3,5],[1,2,3,5],[1,2,3,5]]	[[1,2,3,5],[1,2,3,5],[1,2,3,5],[1,2,3,5]]	[[1,2,3,5],[1,2,3,5],[1,2,3,5],[1,2,3,5]]
[[2,3,4,4],[2,3,4,4],[2,3,4,4],[2,3,4,4]]	[[2,3,4,4],[2,3,4,4],[2,3,4,4],[2,3,4,4]]	[[2,3,4,4],[2,3,4,4],[2,3,4,4],[2,3,4,4]]
[[3,3,3,3],[3,3,3,3],[3,3,3,3],[3,3,3,3]]	[[3,3,3,3],[3,3,3,3],[3,3,3,3],[3,3,3,3]]	[[3,3,3,3],[3,3,3,3],[3,3,3,3],[3,3,3,3]]
[[2,3,4,5],[2,3,4,5],[2,3,4,5],[2,3,4,5]]	[[2,3,4,5],[2,3,4,5],[2,3,4,5],[2,3,4,5]]	[[2,3,4,5],[2,3,4,5],[2,3,4,5],[2,3,4,5]]
NULL	NULL	NULL
drop table if exists t1;
CREATE TABLE t1 (c1 int primary key, c2 int[],c3 float[],c4 varchar(256)[]);
insert into t1 values(1,[1,2,3,5],[2.123,2.123,3.123,4.123],['中文ing123',1,'1']);
insert into t1 values(2,[2,3,4,4],[2.123,2.123,3.123,4.123],[null,'a','sss']);
insert into t1 values(3,[3,3,3,3],[3.123,2.123,3.123,4.123],['null','a','sss']);
insert into t1 values(4,[2,3,4,5],[4.123,2.123,3.123,4.123],[2,3,4,5]);
insert into t1 values(5,null,null,null);
drop table if exists t2;
create table t2 like t1;
replace into t2 select * from t1;
SELECT avg(C2) OVER (PARTITION BY array_map((x) -> (c2), c3)) FROM T1  order by c1;
ERROR 0A000: Not supported feature or function
SELECT sum(C2) OVER (PARTITION BY array_map((x) -> (c2), c3)) FROM T1  order by c1;
ERROR 0A000: Not supported feature or function
SELECT count(C2) OVER (PARTITION BY array_map((x) -> (c2), c3)) FROM T1  order by c1;
ERROR 22000: Invalid data type for the operation
SELECT min(C2) OVER (PARTITION BY array_map((x) -> (c2), c3)) FROM T1 order by c1 ;
ERROR HY000: Invalid argument
SELECT max(C2) OVER (PARTITION BY array_map((x) -> (c2), c3)) FROM T1  order by c1;
ERROR HY000: Invalid argument
drop table if exists t1;
CREATE TABLE t1 (c1 int primary key, c2 int[],c3 float[],c4 varchar(256)[][]);
insert into t1 values(1,[1,2,3,5],[2.123,2.123,3.123,4.123],[['中文ing123',1,'1']]);
insert into t1 values(2,[2,3,4,4],[2.123,2.123,3.123,4.123],[[null,'a','sss']]);
insert into t1 values(3,[3,3,3,3],[3.123,2.123,3.123,4.123],[['null','a','sss']]);
insert into t1 values(4,[2,3,4,5],[4.123,2.123,3.123,4.123],[[2,3,4,5]]);
insert into t1 values(5,null,null,null);
update t1 set c1=38 where c2=array_map((x) -> (null), null);
update t1 set c1=array_map((x) -> (c2), c3) where c1=1;
ERROR 22000: Invalid data type for the operation
update t1 set c2=array_map((x) -> (null), null) where c1=1;
update t1 set c2=array_map((x) -> (x), c2) where c2 is not null;
update t1 set c2=array_map((x) -> (cast(x as TIME)), [123]) where c2 is not null;
ERROR 0A000: array element type not supported
update t1 set c4=array_map((x) -> (['哦我饿哦请问',1,null]), [1]) where c1 =5;
update t1 set c4=array_map((x) -> (c3), [1]) where c1 =5;
update t1 set c4=(select array_map((x) -> (['哦我饿哦请问',1,null]), [1]) from t1 order by c1 limit 1) where c1 =5;
update t1 set c1 = 10 where c1 =5;
update t1 set c4 =array_map((x) -> ([1,23,abs(null)]), [1])  where c1 =10;
select * from t1 order by c1;
c1	c2	c3	c4
1	NULL	[2.123,2.123,3.123,4.123]	[["中文ing123","1","1"]]
2	[2,3,4,4]	[2.123,2.123,3.123,4.123]	[[NULL,"a","sss"]]
3	[3,3,3,3]	[3.123,2.123,3.123,4.123]	[["null","a","sss"]]
4	[2,3,4,5]	[4.123,2.123,3.123,4.123]	[["2","3","4","5"]]
10	NULL	NULL	[["1","23",NULL]]
drop table if exists t1;
CREATE TABLE t1 (c1 int primary key, c2 int[],c3 float[],c4 varchar(256)[][]);
insert into t1 values(1,[1,2,3,5],[2.123,2.123,3.123,4.123],[['中文ing123',1,'1']]);
insert into t1 values(2,[2,3,4,4],[2.123,2.123,3.123,4.123],[[null,'a','sss']]);
insert into t1 values(3,[3,3,3,3],[3.123,2.123,3.123,4.123],[['null','a','sss']]);
insert into t1 values(4,[2,3,4,5],[4.123,2.123,3.123,4.123],[[2,3,4,5]]);
insert into t1 values(5,null,null,null);
update t1 set c1=38 where c2=array_map((x) -> (null), null);
update t1 set c1=array_map((x) -> (c2), c3) where c1=1;
ERROR 22000: Invalid data type for the operation
update t1 set c2=array_map((x) -> (null), null) where c1=1;
update t1 set c2=array_map((x) -> (x), c2) where c2 is not null;
update t1 set c2=array_map((x) -> (cast(x as TIME)), [123]) where c2 is not null;
ERROR 0A000: array element type not supported
update t1 set c4=array_map((x) -> (['哦我饿哦请问',1,null]), [1]) where c1 =5;
update t1 set c4=array_map((x) -> (c3), [1]) where c1 =5;
update t1 set c4=(select array_map((x) -> (['哦我饿哦请问',1,null]), [1]) from t1 order by c1 limit 1) where c1 =5;
update t1 set c1 = 10 where c1 =5;
update t1 set c4 =array_map((x) -> ([1,23,abs(null)]), [1])  where c1 =10;
update t1 set c4 =[array_map((x) -> (cast('2024-11-25 11.22.11' as char(20))), [1])] where c1 =10;
select * from t1 order by c1;
c1	c2	c3	c4
1	NULL	[2.123,2.123,3.123,4.123]	[["中文ing123","1","1"]]
2	[2,3,4,4]	[2.123,2.123,3.123,4.123]	[[NULL,"a","sss"]]
3	[3,3,3,3]	[3.123,2.123,3.123,4.123]	[["null","a","sss"]]
4	[2,3,4,5]	[4.123,2.123,3.123,4.123]	[["2","3","4","5"]]
10	NULL	NULL	[["2024-11-25 11.22.11"]]
drop table if exists t1;
CREATE TABLE t1 (c1 int primary key, c2 int[],c3 float[],c4 varchar(256)[][]);
insert into t1 values(1,[1,2,3,5],[2.123,2.123,3.123,4.123],[['中文ing123',1,'1']]);
insert into t1 values(2,[2,3,4,5],[2.123,2.123,3.123,4.123],[[null,'a','sss']]);
insert into t1 values(3,[3,3,3,3],[3.123,2.123,3.123,4.123],[['null','a','sss']]);
insert into t1 values(4,[2,3,4,5],[4.123,2.123,3.123,4.123],[[2,3,4,5]]);
insert into t1 values(5,null,null,null);
drop table if exists t2;
create table t2 like t1;
insert  into t2 select * from t1;
update t1 set t1.c2 =[1,2,4,2] where c4 in (select array_map((x) -> (t1.c2), [1]) from t1 inner join t2 on t1.c2=t2.c2 order by t1.c1 limit 1,1);
ERROR 22000: Invalid data type for the operation
update t1 set t1.c2 =[1,2,4,2] where c4 in ([[2,3,4,5]]);
update t1 set t1.c2 =[1,2,4,3] where c4 in (select [[2,3,4,5]]);
ERROR 22000: Invalid data type for the operation
update t1 join t2 on t1.c1 =t2.c1 set t1.c4 =array_map((x) -> ([1,2,3,4]), [1]) where t1.c3 is null;
update t1 set c2 = array_map((x) -> (null), [1]) where c1 in (select t1.c1 from t1 inner join t2 on t1.c2=t2.c2 order by t1.c1 limit 1);
drop table if exists t1;
CREATE TABLE t1 (c1 int primary key, c2 int[],c3 float[],c4 varchar(256)[][]);
insert into t1 values(1,[1,2,3,5],[2.123,2.123,3.123,4.123],[['中文ing123',1,'1']]);
insert into t1 values(2,[2,3,4,5],[2.123,2.123,3.123,4.123],[[null,'a','sss']]);
insert into t1 values(3,[3,3,3,3],[3.123,2.123,3.123,4.123],[['null','a','sss']]);
insert into t1 values(4,[2,3,4,5],[4.123,2.123,3.123,4.123],[[2,3,4,5]]);
insert into t1 values(5,null,null,null);
drop table if exists t2;
create table t2 like t1;
insert  into t2 select * from t1;
update t1 set c1 = 10 where c3 is null;
update t1 set c4 = array_map((x) -> ([1,2,3,4]), [1])  where c1> 1 order by c1 limit 100;
with cte as (select c3,c4 from t1 order by c1 )
update t2 set c4 = array_map((x) -> ([1,2,3,4]), [1]) where c3 is null ;
select * from t2 order by c1;
c1	c2	c3	c4
1	[1,2,3,5]	[2.123,2.123,3.123,4.123]	[["中文ing123","1","1"]]
2	[2,3,4,5]	[2.123,2.123,3.123,4.123]	[[NULL,"a","sss"]]
3	[3,3,3,3]	[3.123,2.123,3.123,4.123]	[["null","a","sss"]]
4	[2,3,4,5]	[4.123,2.123,3.123,4.123]	[["2","3","4","5"]]
5	NULL	NULL	[["1","2","3","4"]]
drop table if exists t1;
CREATE TABLE t1 (c1 int primary key, c2 int[],c3 float[],c4 varchar(256)[][]);
insert into t1 values(1,[1,2,3,5],[2.123,2.123,3.123,4.123],[['中文ing123',1,'1']]);
insert into t1 values(2,[2,3,4,5],[2.123,2.123,3.123,4.123],[[null,'a','sss']]);
insert into t1 values(3,[3,3,3,3],[3.123,2.123,3.123,4.123],[['null','a','sss']]);
insert into t1 values(4,[2,3,4,5],[4.123,2.123,3.123,4.123],[[2,3,4,5]]);
insert into t1 values(5,null,null,null);
drop table if exists t2;
create table t2 like t1;
insert  into t2 select * from t1;
insert into t1(c1,c2,c3,c4) values(10,array_map((x,y)->(x+y), array_map(x2->(x2+1),[1,2,3]),array_map(x1->(x1+2),[1,2,3])),array_map((x,y)->(x+y), array_map(x2->(x2+1),[1,2,3]),array_map(x1->(x1+2),[1,2,3])),array_map((x) -> ([1,2,3,4]), [1]));
replace into t1(c1,c2,c3,c4) values(11,array_map((x,y)->(x+y), array_map(x2->(x2+1),[1,2,3]),array_map(x1->(x1+2),[1,2,3])),array_map((x,y)->(x+y), array_map(x2->(x2+1),[1,2,3]),array_map(x1->(x1+2),[1,2,3])),array_map((x) -> ([1,2,3,4]), [1]));
replace into t1(c1,c2,c3,c4) values(11,array_map((x,y)->(x+y), array_map(x2->(x2+1),[1,2,3]),array_map(x1->(x1+2),[1,2,3])),array_map((x,y)->(x+y), array_map(x2->(x2+1),[1,2,3]),array_map(x1->(x1+2),[1,2,3])),array_map((x) -> ([1,2,3,4]), [1]));
drop table if exists t1;
CREATE TABLE t1 (c1 int AUTO_INCREMENT, c2 int[],c3 float[],c4 varchar(256)[][]);
insert into t1 values(1,[1,2,3,5],[2.123,2.123,3.123,4.123],[['中文ing123',1,'1']]);
insert into t1 values(2,[2,3,4,5],[2.123,2.123,3.123,4.123],[[null,'a','sss']]);
insert into t1 values(3,[3,3,3,3],[3.123,2.123,3.123,4.123],[['null','a','sss']]);
insert into t1 values(4,[2,3,4,5],[4.123,2.123,3.123,4.123],[[2,3,4,5]]);
drop table if exists t2;
CREATE TABLE t2 (c1 int primary key, c2 int[],c3 float[],c4 varchar(256)[]);
insert into t2 values(1,[1,2,3,5],[2.123,2.123,3.123,4.123],['中文ing123',1,'1']);
insert into t2 values(2,[2,3,4,5],[2.123,2.123,3.123,4.123],[null,'a','sss']);
insert into t2 values(3,[3,3,3,3],[3.123,2.123,3.123,4.123],['null','a','sss']);
insert into t2 values(4,[2,3,4,5],[4.123,2.123,3.123,4.123],[2,3,4,5]);
insert into t1(c4) select [[1,2,3]] from t2;
insert into t1(c4) select array_map((x) -> (c4), [1]) from t2;
insert into t1(c4) select array_map((x,y)->(x+y), array_map(x2->([x2+1]),[1,2,3]),array_map(x1->([x1+2]),[1,2,3])) ;
insert into t1(c2) select array_map((x,y)->(x+y), array_map(x2->(x2+1),[1,2,3]),array_map(x1->(x1+2),[1,2,3])) ;
replace into t1(c4) select [[1,2,3]] from t2;
replace into t1(c4) select array_map((x) -> (x), [['中文','a']]) from t2;
replace into t1(c4) select array_map((x,y)->(x+y), array_map(x2->([x2+1]),[1,2,3]),array_map(x1->([x1+2]),[1,2,3])) ;
replace into t1(c2) select array_map((x,y)->(x+y), array_map(x2->(x2+1),[1,2,3]),array_map(x1->(x1+2),[1,2,3])) ;
select count(*) from t1 order by c1 ;
count(*)
24
drop table if exists t1;
CREATE TABLE t1 (c1 int AUTO_INCREMENT primary key, c2 int[],c3 float[],c4 varchar(256)[][]);
insert into t1(c2,c3,c4) values(array_map((x) -> (1), [1])+ array_map((x) -> (2), [1]),array_map((x) -> (2), [1])+array_map((x) -> (3), [1]),array_map((x) -> ([null]), [1]));
insert into t1(c2,c3,c4) values(array_map((x) -> (1), [1])- array_map((x) -> (2), [1]),array_map((x) -> (2), [1])+array_map((x) -> (3), [1]),array_map((x) -> ([null]), [1]));
insert into t1(c2,c3,c4) values(array_map((x) -> (1), [1])* array_map((x) -> (2), [1]),array_map((x) -> (2), [1])+array_map((x) -> (3), [1]),array_map((x) -> ([null]), [1]));
insert into t1(c2,c3,c4) values(array_map((x) -> (1), [1])/ array_map((x) -> (2), [1]),array_map((x) -> (2), [1])+array_map((x) -> (3), [1]),array_map((x) -> ([null]), [1]));
ERROR 22000: Invalid data type for the operation
select c1,array_map((x) -> (c2+c3), [1]) from t1 order by c1;
c1	array_map((x) -> (c2+c3), [1])
1	[[8]]
2	[[4]]
3	[[7]]
drop table if exists t1;
CREATE TABLE t1 (c1 int AUTO_INCREMENT primary key, c2 int[],c3 float[],c4 varchar(256)[][]);
INSERT IGNORE t1(c2,c3,c4) values(array_map((x) -> (1), [1])+ array_map((x) -> (2), [1]),array_map((x) -> (2), [1])+array_map((x) -> (3), [1]),array_map((x) -> ([null]), [1]));
INSERT IGNORE t1(c2,c3,c4) values(array_map((x) -> (1), [1])- array_map((x) -> (2), [1]),array_map((x) -> (2), [1])+array_map((x) -> (3), [1]),array_map((x) -> ([null]), [1]));
INSERT IGNORE t1(c2,c3,c4) values(array_map((x) -> (1), [1])* array_map((x) -> (2), [1]),array_map((x) -> (2), [1])+array_map((x) -> (3), [1]),array_map((x) -> ([null]), [1]));
select c1,array_map((x) -> (c2+c3), [1]) from t1 order by c1;
c1	array_map((x) -> (c2+c3), [1])
1	[[8]]
2	[[4]]
3	[[7]]
drop table if exists t1;
CREATE TABLE t1 (c1 int AUTO_INCREMENT primary key, c2 int[],c3 float[],c4 varchar(256)[][]);
insert into t1 values(1,[1,2,3,5],[2.123,2.123,3.123,4.123],[['中文ing123',1,'1']]);
insert into t1 values(2,[2,3,4,5],[2.123,2.123,3.123,4.123],[[null,'a','sss']]);
insert into t1 values(3,[3,3,3,3],[3.123,2.123,3.123,4.123],[['null','a','sss']]);
insert into t1 values(4,[2,3,4,5],[4.123,2.123,3.123,4.123],[[2,3,4,5]]);
insert into t1(c1) values(5) ;
insert into t1(c1) values(5) ON DUPLICATE KEY UPDATE c4 = array_map((x) -> (c2+c3), [1]);
insert into t1(c1) values(5)ON DUPLICATE KEY UPDATE c2=array_map((x,y)->(x+y), array_map(x2->(x2+1),[1,2,3,4]),array_map(x1->(x1+2),[1,2,3,3])) ;
insert into t1(c1) values(2)ON DUPLICATE KEY UPDATE c2=array_map((x,y)->(x+y), array_map(x2->(x2+1),[1,2,3,5]),array_map(x1->(x1+2),[1,2,3,4])) ;
insert into t1(c2,c3,c4) values([1,2,3,3],[1,3,3,3],[[2,1,2,3]]) ON DUPLICATE KEY UPDATE c4=array_map((x) -> (c2+c3), [1]);
insert into t1(c2,c3,c4) values([1,6,3,3],[1,4,3,3],[[2,3,2,3]]) ON DUPLICATE KEY UPDATE c4=array_map((x) -> (c2+c3), [1]);
insert into t1(c1) values(5) ON DUPLICATE KEY UPDATE c4 = array_map((x) -> (c2+c3), [1]);
select array_map((x) -> (c2+c3), [1]) from t1 order by c1;
array_map((x) -> (c2+c3), [1])
[[3.122999906539917,4.122999906539917,6.122999906539917,9.123000144958496]]
[[7.122999906539917,9.122999906539917,12.122999906539917,16.123000144958496]]
[[6.122999906539917,5.122999906539917,6.122999906539917,7.123000144958496]]
[[6.123000144958496,5.122999906539917,7.122999906539917,9.123000144958496]]
[NULL]
[[2,5,6,6]]
[[2,10,6,6]]
drop table if exists t1;
CREATE TABLE t1 (c1 int AUTO_INCREMENT primary key, c2 int[],c3 float[],c4 varchar(256)[][]);
insert into t1 values(1,[1,2,3,5],[2.123,2.123,3.123,4.123],[['中文ing123',1,'1']]);
insert into t1 values(2,[2,3,4,5],[2.123,2.123,3.123,4.123],[[null,'a','sss']]);
insert into t1 values(3,[3,3,3,3],[3.123,2.123,3.123,4.123],[['null','a','sss']]);
insert into t1 values(4,[2,3,4,5],[4.123,2.123,3.123,4.123],[[2,3,4,5]]);
insert into t1(c1) values(5) ;
insert /*+ parallel(10) */ overwrite t1(c4) select array_map((x) -> (c2+c3), [1]) from t1 where c1>2;
insert /*+ parallel(10) */ overwrite t1(c4) select array_map((x) -> (x), [c2]) from t1 where c1>2;
insert /*+ parallel(10) */ overwrite t1(c2) select array_map((x) -> (x), c2) from t1 where c1>2;
insert /*+ parallel(10) */ overwrite t1(c2) select array_map((x,y)->(x+y), array_map(x2->(x2+1),[1,2,3]),array_map(x1->(x1+2),[1,2,3]));
select * from t1;
c1	c2	c3	c4
15	[5,7,9]	NULL	NULL
drop table if exists t1;
drop view if exists v1;
CREATE TABLE t1 (c1 int AUTO_INCREMENT , c2 int[],c3 float[],c4 varchar(256)[][]);
insert into t1 values(1,[1,2,3,5],[2.123,2.123,3.123,4.123],[['中文ing123',1,'1']]);
insert into t1 values(2,[2,3,4,5],[2.123,2.123,3.123,4.123],[[null,'a','sss']]);
insert into t1 values(3,[3,3,3,3],[3.123,2.123,3.123,4.123],[['null','a','sss']]);
insert into t1 values(4,[2,3,4,5],[4.123,2.123,3.123,4.123],[[2,3,4,5]]);
insert into t1(c1) values(5) ;
create view v1 as select * from t1;
insert /*+ direct(true,100) enable_parallel_dml parallel(2)*/ into v1 select c1,c2,c3,c4 from t1;
insert /*+ direct(true,100) enable_parallel_dml parallel(2) append*/ into t1(c2) select array_map((x,y)->(x+y), array_map(x2->(x2+1),[1,2,3]),array_map(x1->(x1+2),[1,2,3])) from t1;
insert /*+ direct(true,100) enable_parallel_dml parallel(2) append*/ into t1(c4) select array_map((x) -> (['1,2,3,4','中文','abc']), [1]) from t1;
insert /*+ direct(true,100) enable_parallel_dml parallel(2) append*/ into t1(c2,c4) select array_map((x,y)->(x+y), array_map(x2->(x2+1),[1,2,3]),array_map(x1->(x1+2),[1,2,3])),array_map((x) -> (['1,2,3,4','中文','abc']), [1]) from t1;
select count(*) from t1;
count(*)
80
drop table if exists t1;
drop view if exists v1;
CREATE TABLE t1 (c1 int AUTO_INCREMENT , c2 int[],c3 float[],c4 varchar(256)[][])partition by hash(c1);
insert into t1 values(1,[1,2,3,5],[2.123,2.123,3.123,4.123],[['中文ing123',1,'1']]);
insert into t1 values(2,[2,3,4,5],[2.123,2.123,3.123,4.123],[[null,'a','sss']]);
insert into t1 values(3,[3,3,3,3],[3.123,2.123,3.123,4.123],[['null','a','sss']]);
insert into t1 values(4,[2,3,4,5],[4.123,2.123,3.123,4.123],[[2,3,4,5]]);
insert into t1(c1) values(5) ;
insert /*+ direct(true,100) enable_parallel_dml parallel(2) append*/ into t1(c2) select array_map((x,y)->(x+y), array_map(x2->(x2+1),[1,2,3]),array_map(x1->(x1+2),[1,2,3])) from t1;
insert /*+ direct(true,100) enable_parallel_dml parallel(2) append*/ into t1(c4) select array_map((x) -> (['1,2,3,4','中文','abc']), [1]) from t1;
insert /*+ direct(true,100) enable_parallel_dml parallel(2) append*/ into t1(c2,c4) select array_map((x,y)->(x+y), array_map(x2->(x2+1),[1,2,3]),array_map(x1->(x1+2),[1,2,3])),array_map((x) -> (['1,2,3,4','中文','abc']), [1]) from t1;
select count(*) from t1;
count(*)
40
select count(array_map((x) -> (c4), [1])) from t1;
count(array_map((x) -> (c4), [1]))
40
select count(array_map((x) -> (c3), [1])) from t1;
count(array_map((x) -> (c3), [1]))
40
select count(array_map((x) -> (c2), [1])) from t1;
count(array_map((x) -> (c2), [1]))
40
drop table if exists t1;
CREATE TABLE t1 (c1 int AUTO_INCREMENT primary key, c2 int[],c3 float[],c4 varchar(256)[][])partition by hash(c1);
insert into t1 values(1,[1,2,3,5],[2.123,2.123,3.123,4.123],[['中文ing123',1,'1']]);
insert into t1 values(2,[2,3,4,5],[2.123,2.123,3.123,4.123],[[null,'a','sss']]);
insert into t1 values(3,[3,3,3,3],[3.123,2.123,3.123,4.123],[['null','a','sss']]);
insert into t1 values(4,[2,3,4,5],[4.123,2.123,3.123,4.123],[[2,3,4,5]]);
insert into t1 values(5,[null],[null],[[null]]);
insert into t1(c1) values(6) ;
delete from t1 where c2=array_map((x) -> (x), [null]) order by c1;
delete from t1 where c2=array_map((x) -> (x), [null]) limit 1;
delete from t1 where c4=array_map((x) -> (x), [[null,'a','sss']]);
delete from t1 where c3=array_map((x) -> (x), c3);
delete from t1;
drop table if exists t1;
CREATE TABLE t1 (c1 int AUTO_INCREMENT primary key, c2 int[],c3 float[],c4 varchar(256)[][])partition by hash(c1);
insert into t1 values(1,[1,2,3,5],[2.123,2.123,3.123,4.123],[['中文ing123',1,'1']]);
insert into t1 values(2,[2,3,4,5],[2.123,2.123,3.123,4.123],[[null,'a','sss']]);
insert into t1 values(3,[3,3,3,3],[3.123,2.123,3.123,4.123],[['null','a','sss']]);
insert into t1 values(4,[2,3,4,5],[4.123,2.123,3.123,4.123],[[2,3,4,5]]);
insert into t1 values(5,[null],[null],[[null]]);
insert into t1(c1) values(6) ;
select array_map((x) -> (x), c3) from t1 order by c1;
array_map((x) -> (x), c3)
[2.123,2.123,3.123,4.123]
[2.123,2.123,3.123,4.123]
[3.123,2.123,3.123,4.123]
[4.123,2.123,3.123,4.123]
[NULL]
NULL
select /*+enable_parallel_dml parallel(2) */array_map((x) -> (x), c3) from t1 order by c1;
array_map((x) -> (x), c3)
[2.123,2.123,3.123,4.123]
[2.123,2.123,3.123,4.123]
[3.123,2.123,3.123,4.123]
[4.123,2.123,3.123,4.123]
[NULL]
NULL
select array_map((x) -> (c3), c3) from t1 order by c1;
array_map((x) -> (c3), c3)
[[2.123,2.123,3.123,4.123],[2.123,2.123,3.123,4.123],[2.123,2.123,3.123,4.123],[2.123,2.123,3.123,4.123]]
[[2.123,2.123,3.123,4.123],[2.123,2.123,3.123,4.123],[2.123,2.123,3.123,4.123],[2.123,2.123,3.123,4.123]]
[[3.123,2.123,3.123,4.123],[3.123,2.123,3.123,4.123],[3.123,2.123,3.123,4.123],[3.123,2.123,3.123,4.123]]
[[4.123,2.123,3.123,4.123],[4.123,2.123,3.123,4.123],[4.123,2.123,3.123,4.123],[4.123,2.123,3.123,4.123]]
[[NULL]]
NULL
select array_map((x) -> (c4), c3) from t1 order by c1;
array_map((x) -> (c4), c3)
[[["中文ing123","1","1"]],[["中文ing123","1","1"]],[["中文ing123","1","1"]],[["中文ing123","1","1"]]]
[[[NULL,"a","sss"]],[[NULL,"a","sss"]],[[NULL,"a","sss"]],[[NULL,"a","sss"]]]
[[["null","a","sss"]],[["null","a","sss"]],[["null","a","sss"]],[["null","a","sss"]]]
[[["2","3","4","5"]],[["2","3","4","5"]],[["2","3","4","5"]],[["2","3","4","5"]]]
[[[NULL]]]
NULL
drop table if exists t1;
create table t1 as select array_map((x) -> (1), null);
drop table if exists t1;
drop table if exists tt1;
CREATE TABLE t1 (c1 int , c2 int[]);
insert into t1 values(1,[1,false]);
insert into t1 values(2,[0,0]);
select array_map((x) -> (c1), [1]) from t1 order by c1;
array_map((x) -> (c1), [1])
[1]
[2]
select array_map((x) -> (c2+c2), c2) from t1 order by c1;
array_map((x) -> (c2+c2), c2)
[[2,0],[2,0]]
[[0,0],[0,0]]
create table tt1 like t1;
insert into tt1 select /*+ enable_parallel_dml parallel(2) */* from t1 order by c1;
replace into tt1 select /*+ enable_parallel_dml parallel(2) */* from t1 order by c1;
select * from t1,tt1 where array_map((x) -> (tt1.c1), ['中二五年'])=array_map((x) -> (t1.c1), [1]) order by t1.c1,tt1.c1 ;
c1	c2	c1	c2
1	[1,0]	1	[1,0]
1	[1,0]	1	[1,0]
2	[0,0]	2	[0,0]
2	[0,0]	2	[0,0]
select * from t1 where array_map((x) -> (c2), [1])  =[[1,0]] order by t1.c1 ;
c1	c2
1	[1,0]
select /*+ ENABLE_PARALLEL_DML PARALLEL(3) */array_map((c2) -> (c2), [1])  from t1 order by t1.c1 ;
array_map((c2) -> (c2), [1])
[1]
[1]
insert /*+ direct(true,100) enable_parallel_dml parallel(2) append*/ into t1 select c1,array_map((c2) -> (c2), [1]) from t1 order by t1.c1  ;
replace  into t1 select c1,array_map((c2) -> (c2), [1]) from t1 ;
########清空回收站，删除测试数据库，表等 ##########
drop database  IF EXISTS  obljh;
purge recyclebin;
