purge recyclebin;
drop database IF EXISTS obljh;
create database obljh ;
use obljh;
set timestamp = 1600000000;
set ob_trx_timeout = 10000000000;
set ob_query_timeout = 10000000000;
alter system set ob_vector_memory_limit_percentage =44;
drop table if exists t1;
CREATE TABLE t1 (c1 int primary key, c2 int[],c3 float[],c4 varchar(256)[]);
insert into t1 values(1,[1,false],[1.123,null,96666],['中文ing123','abc','1']);
insert into t1 values(2,[0,0,99999,null],[0.12345,null,966.66],[null,'a','sss']);
insert into t1 values(3,null,null,null);
select array_append([[1,2,3,4]],c4) from t1 order by c1;
array_append([[1,2,3,4]],c4)
[["1","2","3","4"],["中文ing123","abc","1"]]
[["1","2","3","4"],[NULL,"a","sss"]]
[["1","2","3","4"],NULL]
select array_append([[1,2,3,4]],c3) from t1 order by c1;
array_append([[1,2,3,4]],c3)
[[1,2,3,4],[1.1230000257492065,NULL,96666]]
[[1,2,3,4],[0.12345000356435776,NULL,966.6599731445312]]
[[1,2,3,4],NULL]
select array_append([[1,2,3,4]],c2) from t1 order by c1;
array_append([[1,2,3,4]],c2)
[[1,2,3,4],[1,0]]
[[1,2,3,4],[0,0,99999,NULL]]
[[1,2,3,4],NULL]
select array_append(c4,null) from t1 order by c1;
array_append(c4,null)
["中文ing123","abc","1",NULL]
[NULL,"a","sss",NULL]
NULL
select array_append(c4,1) from t1 order by c1;
array_append(c4,1)
["中文ing123","abc","1","1"]
[NULL,"a","sss","1"]
NULL
select array_append(c4,'a') from t1 order by c1;
array_append(c4,'a')
["中文ing123","abc","1","a"]
[NULL,"a","sss","a"]
NULL
select array_append(c4,b'1011') from t1 order by c1;
ERROR 22000: Invalid data type for the operation
select array_append(c3,null) from t1 order by c1;
array_append(c3,null)
[1.123,NULL,96666,NULL]
[0.12345,NULL,966.66,NULL]
NULL
select array_append(c3,1) from t1 order by c1;
array_append(c3,1)
[1.1230000257492065,NULL,96666,1]
[0.12345000356435776,NULL,966.6599731445312,1]
NULL
select array_append(c3,'a') from t1 order by c1;
array_append(c3,'a')
["1.123",NULL,"96666","a"]
["0.12345",NULL,"966.66","a"]
NULL
select array_append(c3,b'1011') from t1 order by c1;
ERROR 22000: Invalid data type for the operation
select array_append(c2,null) from t1 order by c1;
array_append(c2,null)
[1,0,NULL]
[0,0,99999,NULL,NULL]
NULL
select array_append(c2,1) from t1 order by c1;
array_append(c2,1)
[1,0,1]
[0,0,99999,NULL,1]
NULL
select array_append(c2,'a') from t1 order by c1;
array_append(c2,'a')
["1","0","a"]
["0","0","99999",NULL,"a"]
NULL
select array_append(c2,b'1011') from t1 order by c1;
ERROR 22000: Invalid data type for the operation
drop table if exists t1;
CREATE TABLE t1 (c1 int primary key, c2 int[],c3 float[],c4 varchar(2560000000000000000)[]);
ERROR 42000: Column length too big for column 'varchar' (max = 262144)
drop table if exists t1;
CREATE TABLE t1 (c1 int primary key, c2 int(1000000000000)[],c3 float(1000000000000)[],c4 varchar(2560000000000000000)[]);
ERROR 42000: Column length too big for column 'varchar' (max = 262144)
drop table if exists t1;
CREATE TABLE t1 (c1 int primary key, c2 int[],c3 float[],c4 varchar(256)[]);
insert into t1 values(1,[1,false],[1.123,null,96666],[lpad('x',257,'a')]);
ERROR 22001: Data too long for column 'c4' at row 1
drop table if exists t1;
CREATE TABLE t1 (c1 int primary key, c2 int[],c3 float[],c4 varchar(256)[]);
insert into t1 values(1,[1,false],[1.123,null,96666],['中文ing123',1,'1']);
insert into t1 values(2,[0,0,99999,null],[0.12345,null,966.66],[null,'a','sss']);
insert into t1 values(3,null,[0.12345,null,966.66],['null','a','sss']);
insert into t1 values(4,null,null,null);
select c1,c2,c3,array_append(c2, 1) from t1 where c2 = array_append([0,0,99999],(null)) order by c1;
c1	c2	c3	array_append(c2, 1)
2	[0,0,99999,NULL]	[0.12345,NULL,966.66]	[0,0,99999,NULL,1]
select c1,c2,c3,array_append(c3, 1) from t1 where c3 = array_append([0.12345,null],966.66) order by c1;
c1	c2	c3	array_append(c3, 1)
select c1,c2,c3,array_append(c4, 1) from t1 where c2 is null order by c1;
c1	c2	c3	array_append(c4, 1)
3	NULL	[0.12345,NULL,966.66]	["null","a","sss","1"]
4	NULL	NULL	NULL
select c1,c2,c3,array_append([['a',1,2,3]], c2) from t1 where c2 = array_append([0,0,99999],(null)) order by c1;
c1	c2	c3	array_append([['a',1,2,3]], c2)
2	[0,0,99999,NULL]	[0.12345,NULL,966.66]	[["a","1","2","3"],["0","0","99999",NULL]]
select c1,c2,c3,array_append([['a',1,2,3]], c3) from t1 where c3 = array_append([0.12345,null],966.66) order by c1;
c1	c2	c3	array_append([['a',1,2,3]], c3)
select c1,c2,c3,array_append([['a',1,2,3]], c4) from t1 where c2 is null order by c1;
c1	c2	c3	array_append([['a',1,2,3]], c4)
3	NULL	[0.12345,NULL,966.66]	[["a","1","2","3"],["null","a","sss"]]
4	NULL	NULL	[["a","1","2","3"],NULL]
select c1,c2,c3,array_append(c2, 1) from t1 where c2 > array_append(c2, 1);
ERROR 22000: Invalid data type for the operation
select c1,c2,c3,array_append(c2, 1) from t1 where c3 < array_append(c2, 1);
ERROR 22000: Invalid data type for the operation
select c1,c2,c3,array_append(c2, 1) from t1 where c4 <= array_append(c2, 1);
ERROR 22000: Invalid data type for the operation
select c1,c2,c3,array_append(c2, 1) from t1 where c4 <> array_append(c2, 1) order by c1;
c1	c2	c3	array_append(c2, 1)
1	[1,0]	[1.123,NULL,96666]	[1,0,1]
2	[0,0,99999,NULL]	[0.12345,NULL,966.66]	[0,0,99999,NULL,1]
SELECT c1,c2,array_append(c2, 1) from t1 where array_append(c2, 1) = any (SELECT array_append(c2, 1) FROM t1) order by c1;
ERROR 22000: Invalid data type for the operation
SELECT c1,c2,c3,c4,array_append(c2, 1) from t1 where array_append(c2, 1) in ([1,0,1]);
c1	c2	c3	c4	array_append(c2, 1)
1	[1,0]	[1.123,NULL,96666]	["中文ing123","1","1"]	[1,0,1]
SELECT c1,c2,c3,c4,array_append(c2, 1) from t1 where array_append(c2, 1) in ([1,0,1],[1]);
ERROR 22000: Invalid data type for the operation
SELECT c1,c2,array_append([[c4]], [c2]) from t1 where  EXISTS (SELECT array_append([[c4]], [c2]) FROM t1) order by c1;
c1	c2	array_append([[c4]], [c2])
1	[1,0]	[[["中文ing123","1","1"]],[["1","0"]]]
2	[0,0,99999,NULL]	[[[NULL,"a","sss"]],[["0","0","99999",NULL]]]
3	NULL	[[["null","a","sss"]],[NULL]]
4	NULL	[[NULL],[NULL]]
SELECT c1,c2,array_append([[c4]], [c2]) from t1 where  not EXISTS (SELECT array_append([[c4]], [c2]) FROM t1) order by c1;
c1	c2	array_append([[c4]], [c2])
drop table if exists t1;
CREATE TABLE t1 (c1 int primary key, c2 int[],c3 float[],c4 varchar(256)[][]);
insert into t1 values(1,[1,false],[1.123,null,96666],[['中文ing123',1,'1']]);
insert into t1 values(2,[0,0,99999,null],[0.12345,null,966.66],[[null,'a','sss']]);
insert into t1 values(3,[0,0,99999,null],[0.12345,null,966.66],[['null','a','sss']]);
insert into t1 values(4,[2,3,2,5],[2,3,3,5],[[2,3,4,5]]);
insert into t1 values(5,null,null,null);
drop table if exists t2;
create table t2 like t1;
replace into t2 select * from t1;
select * from t1,t2 where array_append([t1.c4], [t1.c2])=array_append([t2.c4], [t2.c2]) order by t1.c1,t2.c1;
c1	c2	c3	c4	c1	c2	c3	c4
1	[1,0]	[1.123,NULL,96666]	[["中文ing123","1","1"]]	1	[1,0]	[1.123,NULL,96666]	[["中文ing123","1","1"]]
2	[0,0,99999,NULL]	[0.12345,NULL,966.66]	[[NULL,"a","sss"]]	2	[0,0,99999,NULL]	[0.12345,NULL,966.66]	[[NULL,"a","sss"]]
3	[0,0,99999,NULL]	[0.12345,NULL,966.66]	[["null","a","sss"]]	3	[0,0,99999,NULL]	[0.12345,NULL,966.66]	[["null","a","sss"]]
4	[2,3,2,5]	[2,3,3,5]	[["2","3","4","5"]]	4	[2,3,2,5]	[2,3,3,5]	[["2","3","4","5"]]
5	NULL	NULL	NULL	5	NULL	NULL	NULL
select * from t1,t2 where array_append([t1.c4], [t1.c2])<>array_append([t2.c4], [t2.c2]) order by t1.c1,t2.c1;
c1	c2	c3	c4	c1	c2	c3	c4
1	[1,0]	[1.123,NULL,96666]	[["中文ing123","1","1"]]	2	[0,0,99999,NULL]	[0.12345,NULL,966.66]	[[NULL,"a","sss"]]
1	[1,0]	[1.123,NULL,96666]	[["中文ing123","1","1"]]	3	[0,0,99999,NULL]	[0.12345,NULL,966.66]	[["null","a","sss"]]
1	[1,0]	[1.123,NULL,96666]	[["中文ing123","1","1"]]	4	[2,3,2,5]	[2,3,3,5]	[["2","3","4","5"]]
1	[1,0]	[1.123,NULL,96666]	[["中文ing123","1","1"]]	5	NULL	NULL	NULL
2	[0,0,99999,NULL]	[0.12345,NULL,966.66]	[[NULL,"a","sss"]]	1	[1,0]	[1.123,NULL,96666]	[["中文ing123","1","1"]]
2	[0,0,99999,NULL]	[0.12345,NULL,966.66]	[[NULL,"a","sss"]]	3	[0,0,99999,NULL]	[0.12345,NULL,966.66]	[["null","a","sss"]]
2	[0,0,99999,NULL]	[0.12345,NULL,966.66]	[[NULL,"a","sss"]]	4	[2,3,2,5]	[2,3,3,5]	[["2","3","4","5"]]
2	[0,0,99999,NULL]	[0.12345,NULL,966.66]	[[NULL,"a","sss"]]	5	NULL	NULL	NULL
3	[0,0,99999,NULL]	[0.12345,NULL,966.66]	[["null","a","sss"]]	1	[1,0]	[1.123,NULL,96666]	[["中文ing123","1","1"]]
3	[0,0,99999,NULL]	[0.12345,NULL,966.66]	[["null","a","sss"]]	2	[0,0,99999,NULL]	[0.12345,NULL,966.66]	[[NULL,"a","sss"]]
3	[0,0,99999,NULL]	[0.12345,NULL,966.66]	[["null","a","sss"]]	4	[2,3,2,5]	[2,3,3,5]	[["2","3","4","5"]]
3	[0,0,99999,NULL]	[0.12345,NULL,966.66]	[["null","a","sss"]]	5	NULL	NULL	NULL
4	[2,3,2,5]	[2,3,3,5]	[["2","3","4","5"]]	1	[1,0]	[1.123,NULL,96666]	[["中文ing123","1","1"]]
4	[2,3,2,5]	[2,3,3,5]	[["2","3","4","5"]]	2	[0,0,99999,NULL]	[0.12345,NULL,966.66]	[[NULL,"a","sss"]]
4	[2,3,2,5]	[2,3,3,5]	[["2","3","4","5"]]	3	[0,0,99999,NULL]	[0.12345,NULL,966.66]	[["null","a","sss"]]
4	[2,3,2,5]	[2,3,3,5]	[["2","3","4","5"]]	5	NULL	NULL	NULL
5	NULL	NULL	NULL	1	[1,0]	[1.123,NULL,96666]	[["中文ing123","1","1"]]
5	NULL	NULL	NULL	2	[0,0,99999,NULL]	[0.12345,NULL,966.66]	[[NULL,"a","sss"]]
5	NULL	NULL	NULL	3	[0,0,99999,NULL]	[0.12345,NULL,966.66]	[["null","a","sss"]]
5	NULL	NULL	NULL	4	[2,3,2,5]	[2,3,3,5]	[["2","3","4","5"]]
select * from t1,t2 where array_append([t1.c4], null)=array_append([t2.c4], null) order by t1.c1,t2.c1;
c1	c2	c3	c4	c1	c2	c3	c4
1	[1,0]	[1.123,NULL,96666]	[["中文ing123","1","1"]]	1	[1,0]	[1.123,NULL,96666]	[["中文ing123","1","1"]]
2	[0,0,99999,NULL]	[0.12345,NULL,966.66]	[[NULL,"a","sss"]]	2	[0,0,99999,NULL]	[0.12345,NULL,966.66]	[[NULL,"a","sss"]]
3	[0,0,99999,NULL]	[0.12345,NULL,966.66]	[["null","a","sss"]]	3	[0,0,99999,NULL]	[0.12345,NULL,966.66]	[["null","a","sss"]]
4	[2,3,2,5]	[2,3,3,5]	[["2","3","4","5"]]	4	[2,3,2,5]	[2,3,3,5]	[["2","3","4","5"]]
5	NULL	NULL	NULL	5	NULL	NULL	NULL
select * from t1,t2 where t1.c3<>t2.c3 order by t1.c1,t2.c1;
c1	c2	c3	c4	c1	c2	c3	c4
1	[1,0]	[1.123,NULL,96666]	[["中文ing123","1","1"]]	2	[0,0,99999,NULL]	[0.12345,NULL,966.66]	[[NULL,"a","sss"]]
1	[1,0]	[1.123,NULL,96666]	[["中文ing123","1","1"]]	3	[0,0,99999,NULL]	[0.12345,NULL,966.66]	[["null","a","sss"]]
1	[1,0]	[1.123,NULL,96666]	[["中文ing123","1","1"]]	4	[2,3,2,5]	[2,3,3,5]	[["2","3","4","5"]]
2	[0,0,99999,NULL]	[0.12345,NULL,966.66]	[[NULL,"a","sss"]]	1	[1,0]	[1.123,NULL,96666]	[["中文ing123","1","1"]]
2	[0,0,99999,NULL]	[0.12345,NULL,966.66]	[[NULL,"a","sss"]]	4	[2,3,2,5]	[2,3,3,5]	[["2","3","4","5"]]
3	[0,0,99999,NULL]	[0.12345,NULL,966.66]	[["null","a","sss"]]	1	[1,0]	[1.123,NULL,96666]	[["中文ing123","1","1"]]
3	[0,0,99999,NULL]	[0.12345,NULL,966.66]	[["null","a","sss"]]	4	[2,3,2,5]	[2,3,3,5]	[["2","3","4","5"]]
4	[2,3,2,5]	[2,3,3,5]	[["2","3","4","5"]]	1	[1,0]	[1.123,NULL,96666]	[["中文ing123","1","1"]]
4	[2,3,2,5]	[2,3,3,5]	[["2","3","4","5"]]	2	[0,0,99999,NULL]	[0.12345,NULL,966.66]	[[NULL,"a","sss"]]
4	[2,3,2,5]	[2,3,3,5]	[["2","3","4","5"]]	3	[0,0,99999,NULL]	[0.12345,NULL,966.66]	[["null","a","sss"]]
select t1.c1,array_append(t1.c4, t1.c2) from t1  join t2  on array_append([t1.c4], [t1.c2])=array_append([t2.c4], [t2.c2])  order by t1.c1;
c1	array_append(t1.c4, t1.c2)
1	[["中文ing123","1","1"],["1","0"]]
2	[[NULL,"a","sss"],["0","0","99999",NULL]]
3	[["null","a","sss"],["0","0","99999",NULL]]
4	[["2","3","4","5"],["2","3","2","5"]]
5	NULL
select t1.c1,array_append(t1.c4, t1.c2) from t1  inner join t2  on array_append([t1.c4], [t1.c2])=array_append([t2.c4], [t2.c2])  order by t1.c1;
c1	array_append(t1.c4, t1.c2)
1	[["中文ing123","1","1"],["1","0"]]
2	[[NULL,"a","sss"],["0","0","99999",NULL]]
3	[["null","a","sss"],["0","0","99999",NULL]]
4	[["2","3","4","5"],["2","3","2","5"]]
5	NULL
select t1.c1,array_append(t1.c4, t1.c2) from t1  right join t2  on array_append([t1.c4], [t1.c2])=array_append([t2.c4], [t2.c2])  order by t1.c1;
c1	array_append(t1.c4, t1.c2)
1	[["中文ing123","1","1"],["1","0"]]
2	[[NULL,"a","sss"],["0","0","99999",NULL]]
3	[["null","a","sss"],["0","0","99999",NULL]]
4	[["2","3","4","5"],["2","3","2","5"]]
5	NULL
select t1.c1,array_append(t1.c4, t1.c2) from t1  left join t2  on array_append([t1.c4], [t1.c2])=array_append([t2.c4], [t2.c2])  order by t1.c1;
c1	array_append(t1.c4, t1.c2)
1	[["中文ing123","1","1"],["1","0"]]
2	[[NULL,"a","sss"],["0","0","99999",NULL]]
3	[["null","a","sss"],["0","0","99999",NULL]]
4	[["2","3","4","5"],["2","3","2","5"]]
5	NULL
select t1.c1,array_append(t1.c4, t1.c2) from t1  cross  join t2  on array_append([t1.c4], [t1.c2])=array_append([t2.c4], [t2.c2])  order by t1.c1;
c1	array_append(t1.c4, t1.c2)
1	[["中文ing123","1","1"],["1","0"]]
2	[[NULL,"a","sss"],["0","0","99999",NULL]]
3	[["null","a","sss"],["0","0","99999",NULL]]
4	[["2","3","4","5"],["2","3","2","5"]]
5	NULL
select * from t1,t2 where t1.c2<>t2.c2 order by t1.c1,t2.c1;
c1	c2	c3	c4	c1	c2	c3	c4
1	[1,0]	[1.123,NULL,96666]	[["中文ing123","1","1"]]	2	[0,0,99999,NULL]	[0.12345,NULL,966.66]	[[NULL,"a","sss"]]
1	[1,0]	[1.123,NULL,96666]	[["中文ing123","1","1"]]	3	[0,0,99999,NULL]	[0.12345,NULL,966.66]	[["null","a","sss"]]
1	[1,0]	[1.123,NULL,96666]	[["中文ing123","1","1"]]	4	[2,3,2,5]	[2,3,3,5]	[["2","3","4","5"]]
2	[0,0,99999,NULL]	[0.12345,NULL,966.66]	[[NULL,"a","sss"]]	1	[1,0]	[1.123,NULL,96666]	[["中文ing123","1","1"]]
2	[0,0,99999,NULL]	[0.12345,NULL,966.66]	[[NULL,"a","sss"]]	4	[2,3,2,5]	[2,3,3,5]	[["2","3","4","5"]]
3	[0,0,99999,NULL]	[0.12345,NULL,966.66]	[["null","a","sss"]]	1	[1,0]	[1.123,NULL,96666]	[["中文ing123","1","1"]]
3	[0,0,99999,NULL]	[0.12345,NULL,966.66]	[["null","a","sss"]]	4	[2,3,2,5]	[2,3,3,5]	[["2","3","4","5"]]
4	[2,3,2,5]	[2,3,3,5]	[["2","3","4","5"]]	1	[1,0]	[1.123,NULL,96666]	[["中文ing123","1","1"]]
4	[2,3,2,5]	[2,3,3,5]	[["2","3","4","5"]]	2	[0,0,99999,NULL]	[0.12345,NULL,966.66]	[[NULL,"a","sss"]]
4	[2,3,2,5]	[2,3,3,5]	[["2","3","4","5"]]	3	[0,0,99999,NULL]	[0.12345,NULL,966.66]	[["null","a","sss"]]
DROP TABLE if exists t1;
drop materialized view if exists mv1;
CREATE TABLE t1 (c1 int primary key, c2 vector(3),c3 vector(3) ,c4 int[]);
insert into t1 values(1,'[1,1,2]',[2,2,3],[1,2,3]);
insert into t1 values(2,'[2,2,3]',[1,2,3],[1,2,3]);
insert into t1 values(3,'[29,2,2]',[3,2,3],[1,2,3]);
insert into t1 values(4,'[-1,-2,-2]',[3,2,3],[1,2,3]);
insert into t1 values(5,null,null,null);
create materialized view mv1  parallel 10 refresh complete on demand  as select array_append(t1.c3, 1) c3 from t1;
select * from mv1,t1 where mv1.c3=array_append(t1.c3, 1) and t1.c3 is not null order by t1.c1,c2;
c3	c1	c2	c3	c4
[2,2,3,1]	1	[1,1,2]	[2,2,3]	[1,2,3]
[1,2,3,1]	2	[2,2,3]	[1,2,3]	[1,2,3]
[3,2,3,1]	3	[29,2,2]	[3,2,3]	[1,2,3]
[3,2,3,1]	3	[29,2,2]	[3,2,3]	[1,2,3]
[3,2,3,1]	4	[-1,-2,-2]	[3,2,3]	[1,2,3]
[3,2,3,1]	4	[-1,-2,-2]	[3,2,3]	[1,2,3]
drop  view if exists v1;
create view v1 as  select array_append(t1.c3, 1) c3 from t1;
select * from v1,t1 where v1.c3=array_append(t1.c3, 1) and t1.c3 is not null order by t1.c1,c2;
c3	c1	c2	c3	c4
[2,2,3,1]	1	[1,1,2]	[2,2,3]	[1,2,3]
[1,2,3,1]	2	[2,2,3]	[1,2,3]	[1,2,3]
[3,2,3,1]	3	[29,2,2]	[3,2,3]	[1,2,3]
[3,2,3,1]	3	[29,2,2]	[3,2,3]	[1,2,3]
[3,2,3,1]	4	[-1,-2,-2]	[3,2,3]	[1,2,3]
[3,2,3,1]	4	[-1,-2,-2]	[3,2,3]	[1,2,3]
drop table if exists t1;
drop materialized view if exists mv1;
CREATE TABLE t1 (c1 int primary key, c2 bigint[],c3 float[] ,c4 double[]);
insert into t1 values(1,'[1,1,2]','[2,2,3]','[1,3,2]');
insert into t1 values(2,'[1,0,3]','[1,0,3]','[2,3,2]');
insert into t1 values(3,'[-1,2,2]','[-3,2,3]','[4,3,3]');
insert into t1 values(4,'[-1,-2,-2]','[-4,2,3]',null);
insert into t1 values(5,'[-1,-3,-2]',null,'[2,3,1]');
create materialized view mv1  parallel 2 refresh complete on demand  as select * from t1;
select array_append(c2, 1) c from mv1 order by c1;
c
[1,1,2,1]
[1,0,3,1]
[-1,2,2,1]
[-1,-2,-2,1]
[-1,-3,-2,1]
select array_append(c3, 1) c from mv1 order by c1;
c
[2,2,3,1]
[1,0,3,1]
[-3,2,3,1]
[-4,2,3,1]
NULL
select array_append(c4, 1) c from mv1 order by c1;
c
[1,3,2,1]
[2,3,2,1]
[4,3,3,1]
NULL
[2,3,1,1]
drop table if exists t1;
CREATE TABLE t1 (c1 int primary key, c2 vector(4),c3 float[],c4 varchar(256)[]);
insert into t1 values(1,array_distinct([1,2,3,4,1,2,3,4]),[1.2,2.3,6.9,-1.02,1.2,2.3,6.9,-1.02],['中文ing123',1,'1','中文ing123',1,'1']);
insert into t1 values(2,array_distinct([2,3,4,6,2,3,4,6]),[1.123,2.3126,2.30,-0.25,1.123,2.3126,2.30,-0.25],[null,'a','sss',null,'a','sss']);
insert into t1 values(3,array_distinct([7,1,5,9,7,1,5,9]),[0.12345,null,966.66,0.12345,null,966.66],['null','a','sss','null','a','sss']);
insert into t1 values(4,null,null,null);
drop view if exists v1;
create view v1 as  select  c1,array_append(c3, 1) c from t1;
desc v1;
Field	Type	Null	Key	Default	Extra
c1	int(11)	NO		NULL	
c	ARRAY(DOUBLE)	YES		NULL	
select * from v1 order by v1.c1;
c1	c
1	[1.2000000476837158,2.299999952316284,6.900000095367432,-1.0199999809265137,1.2000000476837158,2.299999952316284,6.900000095367432,-1.0199999809265137,1]
2	[1.1230000257492065,2.3125998973846436,2.299999952316284,-0.25,1.1230000257492065,2.3125998973846436,2.299999952316284,-0.25,1]
3	[0.12345000356435776,NULL,966.6599731445312,0.12345000356435776,NULL,966.6599731445312,1]
4	NULL
drop view if exists v1;
create view v1 as  select  c1,array_append(c2, 1) c from t1;
desc v1;
Field	Type	Null	Key	Default	Extra
c1	int(11)	NO		NULL	
c	ARRAY(DOUBLE)	YES		NULL	
select * from v1 order by v1.c1;
c1	c
1	[1,2,3,4,1]
2	[2,3,4,6,1]
3	[7,1,5,9,1]
4	NULL
select count(*) from v1 a,t1 b order by a.c1;
count(*)
16
select * from t1,v1 where array_append(c, 1)=array_append(c2,  1) order by t1.c1,v1.c1;
c1	c2	c3	c4	c1	c
select * from t1,v1 where array_append(c, 1)=array_append(array_append(c2, 1), 1) order by t1.c1,v1.c1;
c1	c2	c3	c4	c1	c
1	[1,2,3,4]	[1.2,2.3,6.9,-1.02,1.2,2.3,6.9,-1.02]	["中文ing123","1","1","中文ing123","1","1"]	1	[1,2,3,4,1]
2	[2,3,4,6]	[1.123,2.3126,2.3,-0.25,1.123,2.3126,2.3,-0.25]	[NULL,"a","sss",NULL,"a","sss"]	2	[2,3,4,6,1]
3	[7,1,5,9]	[0.12345,NULL,966.66,0.12345,NULL,966.66]	["null","a","sss","null","a","sss"]	3	[7,1,5,9,1]
select * from t1,v1 where array_append(c, 1)<>array_append(c2,  1) order by t1.c1,v1.c1;
c1	c2	c3	c4	c1	c
1	[1,2,3,4]	[1.2,2.3,6.9,-1.02,1.2,2.3,6.9,-1.02]	["中文ing123","1","1","中文ing123","1","1"]	1	[1,2,3,4,1]
1	[1,2,3,4]	[1.2,2.3,6.9,-1.02,1.2,2.3,6.9,-1.02]	["中文ing123","1","1","中文ing123","1","1"]	2	[2,3,4,6,1]
1	[1,2,3,4]	[1.2,2.3,6.9,-1.02,1.2,2.3,6.9,-1.02]	["中文ing123","1","1","中文ing123","1","1"]	3	[7,1,5,9,1]
2	[2,3,4,6]	[1.123,2.3126,2.3,-0.25,1.123,2.3126,2.3,-0.25]	[NULL,"a","sss",NULL,"a","sss"]	1	[1,2,3,4,1]
2	[2,3,4,6]	[1.123,2.3126,2.3,-0.25,1.123,2.3126,2.3,-0.25]	[NULL,"a","sss",NULL,"a","sss"]	2	[2,3,4,6,1]
2	[2,3,4,6]	[1.123,2.3126,2.3,-0.25,1.123,2.3126,2.3,-0.25]	[NULL,"a","sss",NULL,"a","sss"]	3	[7,1,5,9,1]
3	[7,1,5,9]	[0.12345,NULL,966.66,0.12345,NULL,966.66]	["null","a","sss","null","a","sss"]	1	[1,2,3,4,1]
3	[7,1,5,9]	[0.12345,NULL,966.66,0.12345,NULL,966.66]	["null","a","sss","null","a","sss"]	2	[2,3,4,6,1]
3	[7,1,5,9]	[0.12345,NULL,966.66,0.12345,NULL,966.66]	["null","a","sss","null","a","sss"]	3	[7,1,5,9,1]
select * from t1 a,t1 b where array_append(a.c2, 1)<>array_append(array_append(b.c2, 1), 1) order by a.c1,b.c1;
c1	c2	c3	c4	c1	c2	c3	c4
1	[1,2,3,4]	[1.2,2.3,6.9,-1.02,1.2,2.3,6.9,-1.02]	["中文ing123","1","1","中文ing123","1","1"]	1	[1,2,3,4]	[1.2,2.3,6.9,-1.02,1.2,2.3,6.9,-1.02]	["中文ing123","1","1","中文ing123","1","1"]
1	[1,2,3,4]	[1.2,2.3,6.9,-1.02,1.2,2.3,6.9,-1.02]	["中文ing123","1","1","中文ing123","1","1"]	2	[2,3,4,6]	[1.123,2.3126,2.3,-0.25,1.123,2.3126,2.3,-0.25]	[NULL,"a","sss",NULL,"a","sss"]
1	[1,2,3,4]	[1.2,2.3,6.9,-1.02,1.2,2.3,6.9,-1.02]	["中文ing123","1","1","中文ing123","1","1"]	3	[7,1,5,9]	[0.12345,NULL,966.66,0.12345,NULL,966.66]	["null","a","sss","null","a","sss"]
2	[2,3,4,6]	[1.123,2.3126,2.3,-0.25,1.123,2.3126,2.3,-0.25]	[NULL,"a","sss",NULL,"a","sss"]	1	[1,2,3,4]	[1.2,2.3,6.9,-1.02,1.2,2.3,6.9,-1.02]	["中文ing123","1","1","中文ing123","1","1"]
2	[2,3,4,6]	[1.123,2.3126,2.3,-0.25,1.123,2.3126,2.3,-0.25]	[NULL,"a","sss",NULL,"a","sss"]	2	[2,3,4,6]	[1.123,2.3126,2.3,-0.25,1.123,2.3126,2.3,-0.25]	[NULL,"a","sss",NULL,"a","sss"]
2	[2,3,4,6]	[1.123,2.3126,2.3,-0.25,1.123,2.3126,2.3,-0.25]	[NULL,"a","sss",NULL,"a","sss"]	3	[7,1,5,9]	[0.12345,NULL,966.66,0.12345,NULL,966.66]	["null","a","sss","null","a","sss"]
3	[7,1,5,9]	[0.12345,NULL,966.66,0.12345,NULL,966.66]	["null","a","sss","null","a","sss"]	1	[1,2,3,4]	[1.2,2.3,6.9,-1.02,1.2,2.3,6.9,-1.02]	["中文ing123","1","1","中文ing123","1","1"]
3	[7,1,5,9]	[0.12345,NULL,966.66,0.12345,NULL,966.66]	["null","a","sss","null","a","sss"]	2	[2,3,4,6]	[1.123,2.3126,2.3,-0.25,1.123,2.3126,2.3,-0.25]	[NULL,"a","sss",NULL,"a","sss"]
3	[7,1,5,9]	[0.12345,NULL,966.66,0.12345,NULL,966.66]	["null","a","sss","null","a","sss"]	3	[7,1,5,9]	[0.12345,NULL,966.66,0.12345,NULL,966.66]	["null","a","sss","null","a","sss"]
select * from t1 a,v1 b,t1 c where array_append(b.c, 1)=array_append(array_append(a.c2, 1), 1) and array_append(b.c, 1)=array_append(array_append(c.c2, 1), 1) order by a.c1,b.c1;
c1	c2	c3	c4	c1	c	c1	c2	c3	c4
1	[1,2,3,4]	[1.2,2.3,6.9,-1.02,1.2,2.3,6.9,-1.02]	["中文ing123","1","1","中文ing123","1","1"]	1	[1,2,3,4,1]	1	[1,2,3,4]	[1.2,2.3,6.9,-1.02,1.2,2.3,6.9,-1.02]	["中文ing123","1","1","中文ing123","1","1"]
2	[2,3,4,6]	[1.123,2.3126,2.3,-0.25,1.123,2.3126,2.3,-0.25]	[NULL,"a","sss",NULL,"a","sss"]	2	[2,3,4,6,1]	2	[2,3,4,6]	[1.123,2.3126,2.3,-0.25,1.123,2.3126,2.3,-0.25]	[NULL,"a","sss",NULL,"a","sss"]
3	[7,1,5,9]	[0.12345,NULL,966.66,0.12345,NULL,966.66]	["null","a","sss","null","a","sss"]	3	[7,1,5,9,1]	3	[7,1,5,9]	[0.12345,NULL,966.66,0.12345,NULL,966.66]	["null","a","sss","null","a","sss"]
drop table if exists t1;
CREATE TABLE t1 (c1 int primary key, c2 vector(8),c3 float[],c4 varchar(256)[]);
insert into t1 values(1,[1,2,3,4,1,2,3,4],[1.2,2.3,6.9,-1.02,1.2,2.3,6.9,-1.02],['中文ing123',1,'1','中文ing123',1,'1']);
insert into t1 values(2,[2,3,4,6,2,3,4,6],[1.123,2.3126,2.30,-0.25,1.123,2.3126,2.30,-0.25],[null,'a','sss',null,'a','sss']);
insert into t1 values(3,[7,1,5,9,7,1,5,9],[0.12345,null,966.66,0.12345,null,966.66],['null','a','sss','null','a','sss']);
insert into t1 values(4,null,null,null);
drop table if exists tt1;
create table tt1 like t1;
replace into tt1 select * from t1;
select count(array_append(a.c2, 1)) c from tt1 a ,t1 b;
c
12
select count(array_append(a.c3, 1)) c from tt1 a ,t1 b;
c
12
select count(array_append(a.c4, 1)) c from tt1 a ,t1 b;
c
12
drop table if exists t1;
CREATE TABLE t1 (c1 int AUTO_INCREMENT , c2 int[],c3 float[],c4 varchar(256)[][])partition by hash(c1);
drop  view if exists v1;
create  view v1 as select * from t1;
insert into t1 values(1,[1,2,3,5],[2.123,2.123,3.123,4.123],[['中文ing123',1,'1']]);
insert into t1 values(2,[2,3,4,5],[2.123,2.123,3.123,4.123],[[null,'a','sss']]);
insert into t1 values(3,[3,3,3,3],[3.123,2.123,3.123,4.123],[['null','a','sss']]);
insert into t1 values(4,[2,3,4,5],[4.123,2.123,3.123,4.123],[[2,3,4,5]]);
drop table if exists tt1;
create table tt1 like t1;
replace into tt1 select * from t1;
select array_append(a.c2, 1) c  from tt1 a ,t1 b order by a.c1,b.c1;
c
[1,2,3,5,1]
[1,2,3,5,1]
[1,2,3,5,1]
[1,2,3,5,1]
[2,3,4,5,1]
[2,3,4,5,1]
[2,3,4,5,1]
[2,3,4,5,1]
[3,3,3,3,1]
[3,3,3,3,1]
[3,3,3,3,1]
[3,3,3,3,1]
[2,3,4,5,1]
[2,3,4,5,1]
[2,3,4,5,1]
[2,3,4,5,1]
drop  view if exists v1;
drop table if exists t1;
CREATE TABLE t1 (c1 int primary key, c2 VARCHAR(30),c3 vector(3) ,c4 vector(3)) partition by list columns (c1)(
PARTITION p0 VALUES in(10),
PARTITION p1 VALUES in(50)
);
drop table if exists tt1;
create table tt1 like t1;
replace into tt1 values(10,'[1,1,2]','[2,2,3]','[1,3,2]');
replace into t1 values(10,'[1,1,2]','[2,2,3]','[1,3,2]');
select array_append(a.c3, 1) c  from tt1 a ,t1 b order by a.c1,b.c1;
c
[2,2,3,1]
select array_append(a.c3, a.c2) c  from tt1 a ,t1 b order by a.c1,b.c1;
c
["2","2","3","[1,1,2]"]
drop table if exists t1;
CREATE TABLE t1 (c1 int primary key, c2 vector(8),c3 float[],c4 varchar(256)[]);
insert into t1 values(1,[1,2,3,4,1,2,3,4],[1.2,2.3,6.9,-1.02,1.2,2.3,6.9,-1.02],['中文ing123',1,'1','中文ing123',1,'1']);
insert into t1 values(2,[2,3,4,6,2,3,4,6],[1.123,2.3126,2.30,-0.25,1.123,2.3126,2.30,-0.25],[null,'a','sss',null,'a','sss']);
insert into t1 values(3,[7,1,5,9,7,1,5,9],[0.12345,null,966.66,0.12345,null,966.66],['null','a','sss','null','a','sss']);
insert into t1 values(4,null,null,null);
drop materialized view if exists mv1;
drop materialized view if exists mv2;
create materialized view mv1(primary key(c1))  as select * from t1;
create materialized view mv2(primary key(c1))  as select * from t1;
select array_append(a.c3, 1) c  from mv1 a,mv2 b order by a.c1,b.c1;
c
[1.2000000476837158,2.299999952316284,6.900000095367432,-1.0199999809265137,1.2000000476837158,2.299999952316284,6.900000095367432,-1.0199999809265137,1]
[1.2000000476837158,2.299999952316284,6.900000095367432,-1.0199999809265137,1.2000000476837158,2.299999952316284,6.900000095367432,-1.0199999809265137,1]
[1.2000000476837158,2.299999952316284,6.900000095367432,-1.0199999809265137,1.2000000476837158,2.299999952316284,6.900000095367432,-1.0199999809265137,1]
[1.2000000476837158,2.299999952316284,6.900000095367432,-1.0199999809265137,1.2000000476837158,2.299999952316284,6.900000095367432,-1.0199999809265137,1]
[1.1230000257492065,2.3125998973846436,2.299999952316284,-0.25,1.1230000257492065,2.3125998973846436,2.299999952316284,-0.25,1]
[1.1230000257492065,2.3125998973846436,2.299999952316284,-0.25,1.1230000257492065,2.3125998973846436,2.299999952316284,-0.25,1]
[1.1230000257492065,2.3125998973846436,2.299999952316284,-0.25,1.1230000257492065,2.3125998973846436,2.299999952316284,-0.25,1]
[1.1230000257492065,2.3125998973846436,2.299999952316284,-0.25,1.1230000257492065,2.3125998973846436,2.299999952316284,-0.25,1]
[0.12345000356435776,NULL,966.6599731445312,0.12345000356435776,NULL,966.6599731445312,1]
[0.12345000356435776,NULL,966.6599731445312,0.12345000356435776,NULL,966.6599731445312,1]
[0.12345000356435776,NULL,966.6599731445312,0.12345000356435776,NULL,966.6599731445312,1]
[0.12345000356435776,NULL,966.6599731445312,0.12345000356435776,NULL,966.6599731445312,1]
NULL
NULL
NULL
NULL
select array_append(a.c2, 1) c  from mv1 a,mv2 b order by a.c1,b.c1;
c
[1,2,3,4,1,2,3,4,1]
[1,2,3,4,1,2,3,4,1]
[1,2,3,4,1,2,3,4,1]
[1,2,3,4,1,2,3,4,1]
[2,3,4,6,2,3,4,6,1]
[2,3,4,6,2,3,4,6,1]
[2,3,4,6,2,3,4,6,1]
[2,3,4,6,2,3,4,6,1]
[7,1,5,9,7,1,5,9,1]
[7,1,5,9,7,1,5,9,1]
[7,1,5,9,7,1,5,9,1]
[7,1,5,9,7,1,5,9,1]
NULL
NULL
NULL
NULL
select array_append(a.c4, 1) c  from mv1 a,mv2 b order by a.c1,b.c1;
c
["中文ing123","1","1","中文ing123","1","1","1"]
["中文ing123","1","1","中文ing123","1","1","1"]
["中文ing123","1","1","中文ing123","1","1","1"]
["中文ing123","1","1","中文ing123","1","1","1"]
[NULL,"a","sss",NULL,"a","sss","1"]
[NULL,"a","sss",NULL,"a","sss","1"]
[NULL,"a","sss",NULL,"a","sss","1"]
[NULL,"a","sss",NULL,"a","sss","1"]
["null","a","sss","null","a","sss","1"]
["null","a","sss","null","a","sss","1"]
["null","a","sss","null","a","sss","1"]
["null","a","sss","null","a","sss","1"]
NULL
NULL
NULL
NULL
drop  view if exists v1;
create  view v1 as select * from t1;
drop  view if exists v2;
Warnings:
Note	1051	Unknown table 'obljh.v2'
create  view v2  as select * from t1;
select array_append(a.c3, 1) c  from v1 a,v2 b order by a.c1,b.c1;
c
[1.2000000476837158,2.299999952316284,6.900000095367432,-1.0199999809265137,1.2000000476837158,2.299999952316284,6.900000095367432,-1.0199999809265137,1]
[1.2000000476837158,2.299999952316284,6.900000095367432,-1.0199999809265137,1.2000000476837158,2.299999952316284,6.900000095367432,-1.0199999809265137,1]
[1.2000000476837158,2.299999952316284,6.900000095367432,-1.0199999809265137,1.2000000476837158,2.299999952316284,6.900000095367432,-1.0199999809265137,1]
[1.2000000476837158,2.299999952316284,6.900000095367432,-1.0199999809265137,1.2000000476837158,2.299999952316284,6.900000095367432,-1.0199999809265137,1]
[1.1230000257492065,2.3125998973846436,2.299999952316284,-0.25,1.1230000257492065,2.3125998973846436,2.299999952316284,-0.25,1]
[1.1230000257492065,2.3125998973846436,2.299999952316284,-0.25,1.1230000257492065,2.3125998973846436,2.299999952316284,-0.25,1]
[1.1230000257492065,2.3125998973846436,2.299999952316284,-0.25,1.1230000257492065,2.3125998973846436,2.299999952316284,-0.25,1]
[1.1230000257492065,2.3125998973846436,2.299999952316284,-0.25,1.1230000257492065,2.3125998973846436,2.299999952316284,-0.25,1]
[0.12345000356435776,NULL,966.6599731445312,0.12345000356435776,NULL,966.6599731445312,1]
[0.12345000356435776,NULL,966.6599731445312,0.12345000356435776,NULL,966.6599731445312,1]
[0.12345000356435776,NULL,966.6599731445312,0.12345000356435776,NULL,966.6599731445312,1]
[0.12345000356435776,NULL,966.6599731445312,0.12345000356435776,NULL,966.6599731445312,1]
NULL
NULL
NULL
NULL
select array_append(a.c2, 1) c  from v1 a,v2 b order by a.c1,b.c1;
c
[1,2,3,4,1,2,3,4,1]
[1,2,3,4,1,2,3,4,1]
[1,2,3,4,1,2,3,4,1]
[1,2,3,4,1,2,3,4,1]
[2,3,4,6,2,3,4,6,1]
[2,3,4,6,2,3,4,6,1]
[2,3,4,6,2,3,4,6,1]
[2,3,4,6,2,3,4,6,1]
[7,1,5,9,7,1,5,9,1]
[7,1,5,9,7,1,5,9,1]
[7,1,5,9,7,1,5,9,1]
[7,1,5,9,7,1,5,9,1]
NULL
NULL
NULL
NULL
select array_append(a.c4, 1) c  from v1 a,v2 b order by a.c1,b.c1;
c
["中文ing123","1","1","中文ing123","1","1","1"]
["中文ing123","1","1","中文ing123","1","1","1"]
["中文ing123","1","1","中文ing123","1","1","1"]
["中文ing123","1","1","中文ing123","1","1","1"]
[NULL,"a","sss",NULL,"a","sss","1"]
[NULL,"a","sss",NULL,"a","sss","1"]
[NULL,"a","sss",NULL,"a","sss","1"]
[NULL,"a","sss",NULL,"a","sss","1"]
["null","a","sss","null","a","sss","1"]
["null","a","sss","null","a","sss","1"]
["null","a","sss","null","a","sss","1"]
["null","a","sss","null","a","sss","1"]
NULL
NULL
NULL
NULL
drop materialized view if exists mv1;
create materialized view mv1  as select c1,array_append(c2, 1) c   from t1;
desc mv1;
Field	Type	Null	Key	Default	Extra
c1	int(11)	YES		NULL	
c	ARRAY(DOUBLE)	YES		NULL	
call DBMS_MVIEW.REFRESH('mv1','c');
select * from mv1 order by c1;
c1	c
1	[1,2,3,4,1,2,3,4,1]
2	[2,3,4,6,2,3,4,6,1]
3	[7,1,5,9,7,1,5,9,1]
4	NULL
drop table if exists t1;
CREATE TABLE t1 (c1 int primary key, c2 vector(4),c3 float[],c4 varchar(256)[]);
insert into t1 values(1,[1,2,3,4],[1.2,2.3,6.9,-1.02],['中文ing123',1,'1']);
insert into t1 values(2,[2,3,4,6],[1.123,2.3126,2.30,-0.25],[null,'a','sss']);
insert into t1 values(3,[7,1,5,9],[0.12345,null,966.66],['null','a','sss']);
insert into t1 values(4,null,null,null);
drop materialized view if exists mv1;
create materialized view mv1(primary key(c1))  as select c1, [1,2,3,4] c2,[2,3,4,5] c3,[4,5,6,7] c4 from t1;
drop view if exists v1;
create view v1 as   select c1, [1,2,3,4] c2,[2,3,4,5] c3,[4,5,6,7] c4 from t1;
select c2 from t1 union select c2 from v1;
c2
[1,2,3,4]
[2,3,4,6]
[7,1,5,9]
NULL
select c3 from t1 union select c3 from v1;
c3
[1.2000000476837158,2.299999952316284,6.900000095367432,-1.0199999809265137]
[1.1230000257492065,2.3125998973846436,2.299999952316284,-0.25]
[0.12345000356435776,NULL,966.6599731445312]
NULL
[2,3,4,5]
select c4 from t1 union select c4 from v1;
c4
["中文ing123","1","1"]
[NULL,"a","sss"]
["null","a","sss"]
NULL
["4","5","6","7"]
select * from t1 union select * from mv1;
c1	c2	c3	c4
1	[1,2,3,4]	[1.2000000476837158,2.299999952316284,6.900000095367432,-1.0199999809265137]	["中文ing123","1","1"]
1	[1,2,3,4]	[2,3,4,5]	["4","5","6","7"]
2	[1,2,3,4]	[2,3,4,5]	["4","5","6","7"]
2	[2,3,4,6]	[1.1230000257492065,2.3125998973846436,2.299999952316284,-0.25]	[NULL,"a","sss"]
3	[1,2,3,4]	[2,3,4,5]	["4","5","6","7"]
3	[7,1,5,9]	[0.12345000356435776,NULL,966.6599731445312]	["null","a","sss"]
4	NULL	NULL	NULL
4	[1,2,3,4]	[2,3,4,5]	["4","5","6","7"]
select c2 from t1 union select c2 from mv1;
c2
NULL
[1,2,3,4]
[2,3,4,6]
[7,1,5,9]
select c3 from t1 union select c3 from mv1;
c3
NULL
[0.12345000356435776,NULL,966.6599731445312]
[1.1230000257492065,2.3125998973846436,2.299999952316284,-0.25]
[1.2000000476837158,2.299999952316284,6.900000095367432,-1.0199999809265137]
[2,3,4,5]
select c4 from t1 union select c4 from mv1;
c4
NULL
["4","5","6","7"]
["null","a","sss"]
["中文ing123","1","1"]
[NULL,"a","sss"]
drop table if exists t1;
CREATE TABLE t1 (c1 int , c2 vector(4),c3 float[],c4 varchar(256)[]);
insert into t1 values(1,[1,2,3,4],[1.2,2.3,6.9,-1.02],['中文ing123',1,'1']);
insert into t1 values(2,[2,3,4,6],[1.123,2.3126,2.30,-0.25],[null,'a','sss']);
insert into t1 values(3,[7,1,5,9],[0.12345,null,966.66],['null','a','sss']);
insert into t1 values(4,null,null,null);
drop table if exists t2;
CREATE TABLE t2 (c1 int primary key, c2 vector(3),c3 float[],c4 varchar(256)[]);
insert into t2 values(1,[1,2,3],[1.2,2.3,6.9],['中文ing123',1,'1']);
insert into t2 values(2,[2,3,4],[1.123,2.3126,2.30],[null,'a','sss']);
insert into t2 values(3,[7,1,5],[0.12345,null],['null','a','sss']);
insert into t2 values(4,null,null,null);
insert into t1 select c1,array_append(c2, c1),array_append(c3, 1) c3,array_append(c4, 1) c4 from t2;
insert /*+ ENABLE_PARALLEL_DML PARALLEL(3) */into t1 select c1,array_append(c2, c1),array_append(c3, 1) c3,array_append(c4, 1) c4 from t2;
select count(*) from t1,t2;
count(*)
48
drop table if exists t1;
CREATE TABLE t1 (c1 int primary key, c2 vector(4),c3 float[],c4 varchar(256)[]);
insert into t1 values(1,[1,2,3,4],[1.2,2.3,6.9,-1.02],['中文ing123',1,'1']);
insert into t1 values(2,[2,3,4,6],[1.123,2.3126,2.30,-0.25],[null,'a','sss']);
insert into t1 values(3,[7,1,5,9],[0.12345,null,966.66],['null','a','sss']);
insert into t1 values(4,null,null,null);
drop table if exists t2;
CREATE TABLE t2 (c1 int primary key, c2 vector(3),c3 float[],c4 varchar(256)[]);
insert into t2 values(1,[1,2,3],[1.2,2.3,6.9],['中文ing123',1,'1']);
insert into t2 values(2,[2,3,4],[1.123,2.3126,2.30],[null,'a','sss']);
insert into t2 values(3,[7,1,5],[0.12345,null],['null','a','sss']);
insert into t2 values(4,null,null,null);
drop view if exists v1;
create view v1 as   select a.c1, array_append(a.c2, 1) c2 ,array_append(b.c3, 1) c3,array_append(a.c4, 1) c4 from t1 a,t2 b;
select count(*) from v1;
count(*)
16
select /*+ ENABLE_PARALLEL_DML PARALLEL(3) */count(*) from v1;
count(*)
16
drop materialized view if exists mv1;
create materialized view mv1(primary key(c1))  as select c1, array_append(c2, 1) c2 ,array_append(c3, 1) c3,array_append(c4, 1) c4 from t2;
replace into t1 select c1,c2,c3,c4 from mv1;
select count(*) from mv1;
count(*)
4
select /*+ ENABLE_PARALLEL_DML PARALLEL(3) */count(*) from mv1;
count(*)
4
drop table if exists t1;
CREATE TABLE t1 (c1 int primary key, c2 vector(4),c3 float[],c4 varchar(256)[]);
insert into t1 values(1,[1,2,3,4],[1.2,2.3,6.9,-1.02],['中文ing123',1,'1']);
insert into t1 values(2,[2,3,4,6],[1.123,2.3126,2.30,-0.25],[null,'a','sss']);
insert into t1 values(3,[7,1,5,9],[0.12345,null,966.66],['null','a','sss']);
insert into t1 values(4,null,null,null);
select count(*) from t1 a,t1 b,t1 c ;
count(*)
64
select count(array_append(a.c2,1)) from t1 a,t1 b,t1 c order by a.c1;
count(array_append(a.c2,1))
48
select count(array_append(b.c3,1)) from t1 a,t1 b,t1 c order by a.c1;
count(array_append(b.c3,1))
48
select count(array_append(c.c4,null)) from t1 a,t1 b,t1 c order by a.c1;
count(array_append(c.c4,null))
48
select count(array_append([c.c4],[null])) from t1 a,t1 b,t1 c order by a.c1;
count(array_append([c.c4],[null]))
64
drop table if exists t1;
CREATE TABLE t1 (c1 int primary key, c2 int[],c3 float[],c4 varchar(256)[][]);
insert into t1 values(1,'[1,1,2]','[2,2,3]','[[1,3,2]]');
insert into t1 values(2,'[1,0,3]','[1,0,3]','[[2,3,2]]');
insert into t1 values(3,'[-1,2,2]','[-3,2,3]','[[4,3,3]]');
insert into t1 values(4,'[-1,-2,-2]','[-4,2,3]',null);
insert into t1 values(5,'[-1,-3,-2]',null,'[[2,3,1]]');
select array_append(t1.c4, t1.c2),(select array_append(t1.c4, t1.c2) from t1 order by c1 limit 1) from t1 order by c1;
array_append(t1.c4, t1.c2)	(select array_append(t1.c4, t1.c2) from t1 order by c1 limit 1)
[["1","3","2"],["1","1","2"]]	[["1","3","2"],["1","1","2"]]
[["2","3","2"],["1","0","3"]]	[["1","3","2"],["1","1","2"]]
[["4","3","3"],["-1","2","2"]]	[["1","3","2"],["1","1","2"]]
NULL	[["1","3","2"],["1","1","2"]]
[["2","3","1"],["-1","-3","-2"]]	[["1","3","2"],["1","1","2"]]
select array_append(a.c4, [c1]) from (select c1,array_append(t1.c4, t1.c2) c4 from t1 order by c1 limit 1) a order by a.c1;
array_append(a.c4, [c1])
[["1","3","2"],["1","1","2"],["1"]]
select array_append(a.c4, [c1]) from (select c1,array_append(t1.c4, t1.c2) c4 from t1 order by c1 limit 1) a order by a.c1;
array_append(a.c4, [c1])
[["1","3","2"],["1","1","2"],["1"]]
select array_append(a.c4, [c1]) from (select c1,array_append(t1.c4, t1.c2) c4 from t1 order by c1 limit 1) a order by a.c1;
array_append(a.c4, [c1])
[["1","3","2"],["1","1","2"],["1"]]
drop table if exists t1;
CREATE TABLE t1 (c1 int primary key, c2 int[],c3 float[],c4 varchar(256)[][]);
insert into t1 values(1,[1,false],[1.123,null,96666],[['中文ing123',1,'1']]);
insert into t1 values(2,[0,0,99999,null],[0.12345,null,966.66],[[null,'a','sss']]);
insert into t1 values(3,[0,0,99999,null],[0.12345,null,966.66],[['null','a','sss']]);
insert into t1 values(4,[2,3,2,5],[2,3,3,5],[[2,3,4,5]]);
insert into t1 values(5,null,null,null);
select * from t1 order by c2;
ERROR 22000: Invalid data type for the operation
select * from t1 order by array_append(c4, c2);
ERROR 22000: Invalid data type for the operation
select * from t1 order by array_append(c4, c2) desc;
ERROR 22000: Invalid data type for the operation
select * from t1 order by array_append(c4, c2) asc;
ERROR 22000: Invalid data type for the operation
drop table if exists t1;
CREATE TABLE t1 (c1 int primary key, c2 int[],c3 float[],c4 varchar(256)[]);
insert into t1 values(1,[1,2,3,5],[2.123,2.123,3.123,4.123],['中文ing123',1,'1']);
insert into t1 values(2,[2,3,4,4],[2.123,2.123,3.123,4.123],[null,'a','sss']);
insert into t1 values(3,[3,3,3,3],[3.123,2.123,3.123,4.123],['null','a','sss']);
insert into t1 values(4,[2,3,4,5],[4.123,2.123,3.123,4.123],[2,3,4,5]);
insert into t1 values(5,null,null,null);
select c1,array_append(c2, 1) * array_append(c3, 1) from t1 order by c1 limit 1;
c1	array_append(c2, 1) * array_append(c3, 1)
1	[2.123,4.246,9.369,20.615,1]
select c1,array_append(c2, 1) - array_append(c3, 1) from t1 order by c1 limit 1;
c1	array_append(c2, 1) - array_append(c3, 1)
1	[-1.122999906539917,-0.12299990653991699,-0.12299990653991699,0.8769998550415039,0]
select c1,array_append(c2, 1) + array_append(c3, 1) from t1 order by c1 limit 1;
c1	array_append(c2, 1) + array_append(c3, 1)
1	[3.122999906539917,4.122999906539917,6.122999906539917,9.123000144958496,2]
select c1,array_append(c2, 1) / array_append(c3, 1) from t1 order by c1 limit 1;
ERROR 22000: Invalid data type for the operation
select c1,array_append(c2*c3, 1/0)  from t1 order by c1 limit 1;
c1	array_append(c2*c3, 1/0)
1	[2.123,4.246,9.369,20.615,NULL]
select c1,array_append(c2-c3, 1/0)  from t1 order by c1 limit 1;
c1	array_append(c2-c3, 1/0)
1	[-1.122999906539917,-0.12299990653991699,-0.12299990653991699,0.8769998550415039,NULL]
select c1,array_append(c2+c3, 1/0)  from t1 order by c1 limit 1;
c1	array_append(c2+c3, 1/0)
1	[3.122999906539917,4.122999906539917,6.122999906539917,9.123000144958496,NULL]
select array_append(c4,cast(null as date)) from t1 order by c1 limit 1;
ERROR 22000: Invalid data type for the operation
select array_append(c4,cast(20241115 as date)) from t1 order by c1 limit 1;
ERROR 22000: Invalid data type for the operation
select array_append(c4,cast(20241115 as datetime)) from t1 order by c1 limit 1;
ERROR 22000: Invalid data type for the operation
select array_append(c4,cast(20241115 as time)) from t1 order by c1 limit 1;
ERROR 22000: Invalid data type for the operation
select array_append(c4,cast(20241115 as year)) from t1 order by c1 limit 1;
ERROR 22000: Invalid data type for the operation
select array_append(c4,cast(20241115 as BINARY )) from t1 order by c1 limit 1;
ERROR 0A000: array element in binary type not supported
select array_append(c4,cast(20241115 as CHAR(20))) from t1 order by c1 limit 1;
array_append(c4,cast(20241115 as CHAR(20)))
["中文ing123","1","1","20241115"]
select array_append(c4,cast(20241115 as BINARY )) from t1 order by c1 limit 1;
ERROR 0A000: array element in binary type not supported
select array_append(c4,cast(20241115 as CHAR(20))) from t1 order by c1 limit 1;
array_append(c4,cast(20241115 as CHAR(20)))
["中文ing123","1","1","20241115"]
select array_append(c4,cast('[oceanbase]' as CHAR(20))) from t1 order by c1 limit 1;
array_append(c4,cast('[oceanbase]' as CHAR(20)))
["中文ing123","1","1","[oceanbase]"]
select array_append(c4,cast(20241115 as DECIMAL(32))) from t1 order by c1 limit 1;
array_append(c4,cast(20241115 as DECIMAL(32)))
["中文ing123","1","1","20241115"]
select array_append(c2,cast(1.123 as float)) from t1 order by c1 limit 1;
array_append(c2,cast(1.123 as float))
[1,2,3,5,1.1230000257492065]
select array_append(c2,cast(c2 as json)) from t1 order by c1 limit 1;
ERROR 22000: Invalid data type for the operation
select distinct array_append([c4],c2) from t1 order by c1 limit 1;
ERROR 22000: Invalid data type for the operation
select distinct array_append(null,c2) from t1 order by c1 limit 1;
array_append(null,c2)
NULL
select distinct array_append(c2,null) from t1 order by c1 limit 1;
ERROR 22000: Invalid data type for the operation
select array_append(distinct c2,null) from t1 order by c1 limit 1;
ERROR 42000: You have an error in your SQL syntax; check the manual that corresponds to your OceanBase version for the right syntax to use near 'distinct c2,null) from t1 order by c1 limit 1' at line 1
select array_append(distinct [1,2,3],c1) from t1 order by c1 limit 1;
ERROR 42000: You have an error in your SQL syntax; check the manual that corresponds to your OceanBase version for the right syntax to use near 'distinct [1,2,3],c1) from t1 order by c1 limit 1' at line 1
drop table if exists t1;
CREATE TABLE t1 (c1 int primary key, c2 int[],c3 float[],c4 varchar(256)[]);
insert into t1 values(1,[1,2,3,5],[2.123,2.123,3.123,4.123],['中文ing123',1,'1']);
insert into t1 values(2,[2,3,4,4],[2.123,2.123,3.123,4.123],[null,'a','sss']);
insert into t1 values(3,[3,3,3,3],[3.123,2.123,3.123,4.123],['null','a','sss']);
insert into t1 values(4,[2,3,4,5],[4.123,2.123,3.123,4.123],[2,3,4,5]);
insert into t1 values(5,null,null,null);
select array_append(max(c2),c1) from t1 order by c1 limit 1;
ERROR HY000: Invalid argument
select array_append(min(c2),c1) from t1 order by c1 limit 1;
ERROR HY000: Invalid argument
select array_append(avg(c2),c1) from t1 order by c1 limit 1;
ERROR 0A000: Not supported feature or function
select array_append(count(c2),c1) from t1 order by c1 limit 1;
ERROR 22000: invalid obj type for type promotion: left_type=ARRAY right_type=BIGINT
select array_append(sum(c2),c1) from t1 order by c1 limit 1;
ERROR 0A000: Not supported feature or function
select array_append((c2),max(c2)) from t1 order by c1 limit 1;
ERROR HY000: Invalid argument
select array_append((c2),sum(c2)) from t1 order by c1 limit 1;
ERROR 0A000: Not supported feature or function
select array_append((c2),min(c2)) from t1 order by c1 limit 1;
ERROR HY000: Invalid argument
select array_append((c2),count(c2)) from t1 order by c1 limit 1;
array_append((c2),count(c2))
[1,2,3,5,4]
select array_append((c2),avg(c2)) from t1 order by c1 limit 1;
ERROR 0A000: Not supported feature or function
select array_append((c2),max(c1)) from t1 order by c1 limit 1;
array_append((c2),max(c1))
[1,2,3,5,5]
select array_append((c2),sum(c1)) from t1 order by c1 limit 1;
array_append((c2),sum(c1))
[1,2,3,5,15]
select array_append((c2),min(c1)) from t1 order by c1 limit 1;
array_append((c2),min(c1))
[1,2,3,5,1]
select array_append((c2),count(c1)) from t1 order by c1 limit 1;
array_append((c2),count(c1))
[1,2,3,5,5]
select array_append((c2),avg(c1)) from t1 order by c1 limit 1;
array_append((c2),avg(c1))
[1,2,3,5,3]
drop table if exists t1;
CREATE TABLE t1 (c1 int primary key, c2 int[],c3 float[],c4 varchar(256)[]);
insert into t1 values(1,[1,2,3,5],[2.123,2.123,3.123,4.123],['中文ing123',1,'1']);
insert into t1 values(2,[2,3,4,4],[2.123,2.123,3.123,4.123],[null,'a','sss']);
insert into t1 values(3,[3,3,3,3],[3.123,2.123,3.123,4.123],['null','a','sss']);
insert into t1 values(4,[2,3,4,5],[4.123,2.123,3.123,4.123],[2,3,4,5]);
insert into t1 values(5,null,null,null);
drop table if exists t2;
create table t2 like t1;
replace into t2 select * from t1;
with ct1 as(
select array_append(c2,1) from t1 order by c1)
select array_append(c2,1) from t1 where c3 is not null order by c1 ;
array_append(c2,1)
[1,2,3,5,1]
[2,3,4,4,1]
[3,3,3,3,1]
[2,3,4,5,1]
with ct1 as(
select array_append(c3,1) from t1 order by c1)
select array_append(c3,1) from t1 where c3 is not null order by c1 ;
array_append(c3,1)
[2.122999906539917,2.122999906539917,3.122999906539917,4.123000144958496,1]
[2.122999906539917,2.122999906539917,3.122999906539917,4.123000144958496,1]
[3.122999906539917,2.122999906539917,3.122999906539917,4.123000144958496,1]
[4.123000144958496,2.122999906539917,3.122999906539917,4.123000144958496,1]
with ct1 as(
select array_append(c4,1) from t1 order by c1)
select array_append(c4,1) from t1 where c3 is not null order by c1 ;
array_append(c4,1)
["中文ing123","1","1","1"]
[NULL,"a","sss","1"]
["null","a","sss","1"]
["2","3","4","5","1"]
SELECT c2, CASE c2 WHEN array_append(c4,1) THEN 'High' ELSE 'Low' END AS A FROM T1 order by c1;
c2	A
[1,2,3,5]	Low
[2,3,4,4]	Low
[3,3,3,3]	Low
[2,3,4,5]	Low
NULL	Low
drop table if exists t1;
CREATE TABLE t1 (c1 int primary key, c2 int[],c3 float[],c4 varchar(256)[]);
insert into t1 values(1,[1,2,3,5],[2.123,2.123,3.123,4.123],['中文ing123',1,'1']);
insert into t1 values(2,[2,3,4,4],[2.123,2.123,3.123,4.123],[null,'a','sss']);
insert into t1 values(3,[3,3,3,3],[3.123,2.123,3.123,4.123],['null','a','sss']);
insert into t1 values(4,[2,3,4,5],[4.123,2.123,3.123,4.123],[2,3,4,5]);
insert into t1 values(5,null,null,null);
drop table if exists t2;
create table t2 like t1;
replace into t2 select * from t1;
select * from t1 limit array_append(c4,1);
ERROR 42000: You have an error in your SQL syntax; check the manual that corresponds to your OceanBase version for the right syntax to use near 'array_append(c4,1)' at line 1
select array_append(t1.c4,1) from t1,t2 where t1.c2=t2.c2 order by t1.c1 limit 1,2;
array_append(t1.c4,1)
[NULL,"a","sss","1"]
["null","a","sss","1"]
select array_append(t1.c4,1) from t1,t2 where t1.c2=t2.c2 order by t1.c1 limit 0,2;
array_append(t1.c4,1)
["中文ing123","1","1","1"]
[NULL,"a","sss","1"]
select array_append(t1.c4,1) from t1,t2 where t1.c2=t2.c2 order by t1.c1 limit 10000;
array_append(t1.c4,1)
["中文ing123","1","1","1"]
[NULL,"a","sss","1"]
["null","a","sss","1"]
["2","3","4","5","1"]
select /*+ ENABLE_PARALLEL_DML PARALLEL(3) */array_append(t1.c4,1) from t1,t2 where t1.c2=t2.c2 order by t1.c1 limit 1,2;
array_append(t1.c4,1)
[NULL,"a","sss","1"]
["null","a","sss","1"]
select /*+ ENABLE_PARALLEL_DML PARALLEL(3) */array_append(t1.c4,1) from t1,t2 where t1.c2=t2.c2 order by t1.c1 limit 0,2;
array_append(t1.c4,1)
["中文ing123","1","1","1"]
[NULL,"a","sss","1"]
select /*+ ENABLE_PARALLEL_DML PARALLEL(3) */array_append(t1.c4,1) from t1,t2 where t1.c2=t2.c2 order by t1.c1 limit 10000;
array_append(t1.c4,1)
["中文ing123","1","1","1"]
[NULL,"a","sss","1"]
["null","a","sss","1"]
["2","3","4","5","1"]
drop table if exists t1;
CREATE TABLE t1 (c1 int primary key, c2 int[],c3 float[],c4 varchar(256)[]);
insert into t1 values(1,[1,2,3,5],[2.123,2.123,3.123,4.123],['中文ing123',1,'1']);
insert into t1 values(2,[2,3,4,4],[2.123,2.123,3.123,4.123],[null,'a','sss']);
insert into t1 values(3,[3,3,3,3],[3.123,2.123,3.123,4.123],['null','a','sss']);
insert into t1 values(4,[2,3,4,5],[4.123,2.123,3.123,4.123],[2,3,4,5]);
insert into t1 values(5,null,null,null);
drop table if exists t2;
create table t2 like t1;
replace into t2 select * from t1;
select c1,c2,c3,c4 from t1 where array_append(t1.c4,null) = [null] ;
c1	c2	c3	c4
select c1,c2,c3,c4 from t1 where array_append(t1.c4,null) = [null] for update;
c1	c2	c3	c4
select c1,c2,c3,c4 from t1 where array_append(t1.c4,null) = [2,3,4,5,null] ;
c1	c2	c3	c4
4	[2,3,4,5]	[4.123,2.123,3.123,4.123]	["2","3","4","5"]
select c1,c2,c3,c4 from t1 where array_append(t1.c4,null) = [2,3,4,5,null] for update;
c1	c2	c3	c4
4	[2,3,4,5]	[4.123,2.123,3.123,4.123]	["2","3","4","5"]
select c1,c2,c3,c4 from t1 where array_append(t1.c4,1) = [2,3,4,5,1] ;
c1	c2	c3	c4
4	[2,3,4,5]	[4.123,2.123,3.123,4.123]	["2","3","4","5"]
select c1,c2,c3,c4 from t1 where array_append(t1.c4,1) = [2,3,4,5,1] for update;
c1	c2	c3	c4
4	[2,3,4,5]	[4.123,2.123,3.123,4.123]	["2","3","4","5"]
drop table if exists t1;
CREATE TABLE t1 (c1 int primary key, c2 int[],c3 float[],c4 varchar(256)[]);
insert into t1 values(1,[1,2,3,5],[2.123,2.123,3.123,4.123],['中文ing123',1,'1']);
insert into t1 values(2,[2,3,4,4],[2.123,2.123,3.123,4.123],[null,'a','sss']);
insert into t1 values(3,[3,3,3,3],[3.123,2.123,3.123,4.123],['null','a','sss']);
insert into t1 values(4,[2,3,4,5],[4.123,2.123,3.123,4.123],[2,3,4,5]);
insert into t1 values(5,null,null,null);
drop table if exists t2;
create table t2 like t1;
replace into t2 select * from t1;
select array_append(t1.c4,1) a   from t1 order by t1.c1  ;
a
["中文ing123","1","1","1"]
[NULL,"a","sss","1"]
["null","a","sss","1"]
["2","3","4","5","1"]
NULL
select /*+ ENABLE_PARALLEL_DML PARALLEL(3) */array_append(t1.c4,1)  a from t1 order by t1.c1;
a
["中文ing123","1","1","1"]
[NULL,"a","sss","1"]
["null","a","sss","1"]
["2","3","4","5","1"]
NULL
select array_append(t1.c2,1) x ,array_append(t1.c3,1) x,array_append(t1.c4,1) x from t1 order by t1.c1  ;
x	x	x
[1,2,3,5,1]	[2.122999906539917,2.122999906539917,3.122999906539917,4.123000144958496,1]	["中文ing123","1","1","1"]
[2,3,4,4,1]	[2.122999906539917,2.122999906539917,3.122999906539917,4.123000144958496,1]	[NULL,"a","sss","1"]
[3,3,3,3,1]	[3.122999906539917,2.122999906539917,3.122999906539917,4.123000144958496,1]	["null","a","sss","1"]
[2,3,4,5,1]	[4.123000144958496,2.122999906539917,3.122999906539917,4.123000144958496,1]	["2","3","4","5","1"]
NULL	NULL	NULL
select array_append(t1.c2,1) 中文中文中文中文中文中文,array_append(t1.c3,1) 中文中文中文中文中文, array_append(t1.c4,1) 中文中文中文中文中文中文 from t1 order by t1.c1  ;
中文中文中文中文中文中文	中文中文中文中文中文	中文中文中文中文中文中文
[1,2,3,5,1]	[2.122999906539917,2.122999906539917,3.122999906539917,4.123000144958496,1]	["中文ing123","1","1","1"]
[2,3,4,4,1]	[2.122999906539917,2.122999906539917,3.122999906539917,4.123000144958496,1]	[NULL,"a","sss","1"]
[3,3,3,3,1]	[3.122999906539917,2.122999906539917,3.122999906539917,4.123000144958496,1]	["null","a","sss","1"]
[2,3,4,5,1]	[4.123000144958496,2.122999906539917,3.122999906539917,4.123000144958496,1]	["2","3","4","5","1"]
NULL	NULL	NULL
drop table if exists t1;
CREATE TABLE t1 (c1 int primary key, c2 int[],c3 float[],c4 varchar(256)[]);
insert into t1 values(1,[1,2,3,5],[2.123,2.123,3.123,4.123],['中文ing123',1,'1']);
insert into t1 values(2,[2,3,4,4],[2.123,2.123,3.123,4.123],[null,'a','sss']);
insert into t1 values(3,[3,3,3,3],[3.123,2.123,3.123,4.123],['null','a','sss']);
insert into t1 values(4,[2,3,4,5],[4.123,2.123,3.123,4.123],[2,3,4,5]);
insert into t1 values(5,null,null,null);
drop table if exists t2;
create table t2 like t1;
replace into t2 select * from t1;
SELECT avg(C2) OVER (PARTITION BY array_append(t1.c4,1)) FROM T1  order by c1;
ERROR 0A000: Not supported feature or function
SELECT sum(C2) OVER (PARTITION BY array_append(t1.c4,1)) FROM T1  order by c1;
ERROR 0A000: Not supported feature or function
SELECT count(C2) OVER (PARTITION BY array_append(t1.c4,1)) FROM T1  order by c1;
ERROR 22000: Invalid data type for the operation
SELECT min(C2) OVER (PARTITION BY array_append(t1.c4,1)) FROM T1 order by c1 ;
ERROR HY000: Invalid argument
SELECT max(C2) OVER (PARTITION BY array_append(t1.c4,1)) FROM T1  order by c1;
ERROR HY000: Invalid argument
drop table if exists t1;
CREATE TABLE t1 (c1 int primary key, c2 int[],c3 float[],c4 varchar(256)[][]);
insert into t1 values(1,[1,2,3,5],[2.123,2.123,3.123,4.123],[['中文ing123',1,'1']]);
insert into t1 values(2,[2,3,4,4],[2.123,2.123,3.123,4.123],[[null,'a','sss']]);
insert into t1 values(3,[3,3,3,3],[3.123,2.123,3.123,4.123],[['null','a','sss'],['这家safasf']]);
insert into t1 values(4,[2,3,4,5],[4.123,2.123,3.123,4.123],[[2,3,4,' '],[1]]);
insert into t1 values(5,null,null,null);
update t1 set c1=38 where c4=array_append([[2,3,4,' ']],[1]);
update t1 set c1=33 where c4=array_append([['null','a','sss']],['这家safasf']);
update t1 set c2=array_append([4.123,2.123,3.123],4.123) where c4 is null;
update t1 set c2=array_append([3,3,3,3],1111) where c1=1;
update t1 set c4=array_append([[3,3,3,3]],[null]) where c4 is null;
update t1 set c3=array_append([3,3,3,3],1.123) where c3 is null;
update t1 set c3=(select array_append([null],null) from dual ) where c2 is not null;
select * from t1 order by c1;
c1	c2	c3	c4
1	[3,3,3,3,1111]	[NULL,NULL]	[["中文ing123","1","1"]]
2	[2,3,4,4]	[NULL,NULL]	[[NULL,"a","sss"]]
5	[4,2,3,4]	[NULL,NULL]	[["3","3","3","3"],[NULL]]
33	[3,3,3,3]	[NULL,NULL]	[["null","a","sss"],["这家safasf"]]
38	[2,3,4,5]	[NULL,NULL]	[["2","3","4"," "],["1"]]
drop table if exists t1;
CREATE TABLE t1 (c1 int primary key, c2 int[],c3 float[],c4 varchar(256)[][]);
insert into t1 values(1,[1,2,3,5],[2.123,2.123,3.123,4.123],[['中文ing123',1,'1']]);
insert into t1 values(2,[2,3,4,4],[2.123,2.123,3.123,4.123],[[null,'a','sss']]);
insert into t1 values(3,[3,3,3,3],[3.123,2.123,3.123,4.123],[['null','a','sss'],['这家safasf']]);
insert into t1 values(4,[2,3,4,5],[4.123,2.123,3.123,4.123],[[2,3,4,' '],[1]]);
insert into t1 values(5,null,null,null);
drop table if exists t2;
create table t2 like t1;
insert  into t2 select * from t1;
update t1 set t1.c2 =[1,2,4,2] where c4 in (select array_append([[2,3,4,' ']],[1]) from t1 inner join t2 on t1.c2=t2.c2 order by t1.c1 limit 1,1);
ERROR 22000: Invalid data type for the operation
update t1 join t2 on array_append(t1.c2,111)=array_append(t2.c2,111) set t1.c4 =array_append([[2,3,4,' ']],[1]) where t1.c3 is not null;
update t1 set c2 = array_append([4.123,2.123,3.123],4.123) where c1 in (select t1.c1 from t1 inner join t2 on t1.c2=t2.c2 order by t1.c1 limit 1);
select * from t1 order by c1;
c1	c2	c3	c4
1	[4,2,3,4]	[2.123,2.123,3.123,4.123]	[["2","3","4"," "],["1"]]
2	[2,3,4,4]	[2.123,2.123,3.123,4.123]	[["2","3","4"," "],["1"]]
3	[3,3,3,3]	[3.123,2.123,3.123,4.123]	[["2","3","4"," "],["1"]]
4	[2,3,4,5]	[4.123,2.123,3.123,4.123]	[["2","3","4"," "],["1"]]
5	NULL	NULL	NULL
drop table if exists t1;
CREATE TABLE t1 (c1 int primary key, c2 int[],c3 float[],c4 varchar(256)[][]);
insert into t1 values(1,[1,2,3,5],[2.123,2.123,3.123,4.123],[['中文ing123',1,'1']]);
insert into t1 values(2,[2,3,4,5],[2.123,2.123,3.123,4.123],[[null,'a','sss']]);
insert into t1 values(3,[3,3,3,3],[3.123,2.123,3.123,4.123],[['null','a','sss']]);
insert into t1 values(4,[2,3,4,5],[4.123,2.123,3.123,4.123],[[2,3,4,5]]);
insert into t1 values(5,null,null,null);
drop table if exists t2;
create table t2 like t1;
insert  into t2 select * from t1;
insert into t1(c1,c2,c3,c4) values(10,array_append([null],null),array_append([null],null),array_append([[null]],[null]));
replace into t1(c1,c2,c3,c4) values(10,array_append([1],null),array_append([1],null),array_append([[1]],[null]));
replace into t1(c1,c2,c3,c4) values(10,array_append([1],null),array_append([1],null),array_append([[1]],[null]));
replace into t1(c1,c2,c3,c4) values(11,array_append([1],null),array_append([1],null),array_append([[1],[1],['中文']],[null]));
replace into t1(c1,c2,c3,c4) values(11,array_append([1],null),array_append([1],null),array_append([[1],[1],['中文']],[null]));
drop table if exists t1;
CREATE TABLE t1 (c1 int AUTO_INCREMENT, c2 int[],c3 float[],c4 varchar(256)[][]);
insert into t1 values(1,[1,2,3,5],[2.123,2.123,3.123,4.123],[['中文ing123',1,'1']]);
insert into t1 values(2,[2,3,4,5],[2.123,2.123,3.123,4.123],[[null,'a','sss']]);
insert into t1 values(3,[3,3,3,3],[3.123,2.123,3.123,4.123],[['null','a','sss']]);
insert into t1 values(4,[2,3,4,5],[4.123,2.123,3.123,4.123],[[2,3,4,5]]);
insert into t1 values(5,null,null,null);
drop table if exists t2;
CREATE TABLE t2 (c1 int primary key, c2 int[],c3 float[],c4 varchar(256)[][]);
insert into t2 values(1,[1,2,3,5],[2.123,2.123,3.123,4.123],[['中文ing123',1],['1']]);
insert into t2 values(2,[2,3,4,5],[2.123,2.123,3.123,4.123],[[null,'a'],['sss']]);
insert into t2 values(3,[3,3,3,3],[3.123,2.123,3.123,4.123],[['null','a'],['sss']]);
insert into t2 values(4,[2,3,4,5],[4.123,2.123,3.123,4.123],[[2,3,4,5],['sss']]);
insert into t2 values(5,null,null,null);
insert into t1(c2) select array_append(c2,null) from t2;
insert into t1(c3) select array_append(c3,null) from t2;
insert into t1(c4) select array_append(c4,[null]) from t2;
replace into t1(c2) select array_append(c2,null) from t2;
replace into t1(c3) select array_append(c3,null) from t2;
replace into t1(c4) select array_append(c4,[null]) from t2;
select count(*) from t1 order by c1 ;
count(*)
35
drop table if exists t1;
CREATE TABLE t1 (c1 int AUTO_INCREMENT primary key, c2 int[],c3 float[],c4 varchar(256)[][]);
insert IGNORE t1 values(1,[1,2,3,5],[2.123,2.123,3.123,4.123],[['中文ing123',1,'1']]);
insert IGNORE t1 values(2,[2,3,4,5],[2.123,2.123,3.123,4.123],[[null,'a','sss']]);
insert IGNORE t1 values(3,[3,3,3,3],[3.123,2.123,3.123,4.123],[['null','a','sss']]);
insert IGNORE t1 values(4,[2,3,4,5],[4.123,2.123,3.123,4.123],[[2,3,4,5]]);
insert IGNORE t1 values(5,null,null,null);
select count(*) from t1 order by c1 ;
count(*)
5
drop table if exists t1;
CREATE TABLE t1 (c1 int AUTO_INCREMENT primary key, c2 int[],c3 float[],c4 varchar(256)[][]);
insert into t1 values(1,[1,2,3,5],[2.123,2.123,3.123,4.123],[['中文ing123',1,'1']]);
insert into t1 values(2,[2,3,4,5],[2.123,2.123,3.123,4.123],[[null,'a','sss']]);
insert into t1 values(3,[3,3,3,3],[3.123,2.123,3.123,4.123],[['null','a','sss']]);
insert into t1 values(4,[2,3,4,5],[4.123,2.123,3.123,4.123],[[2,3,4,5]]);
insert into t1(c1) values(5) ;
insert into t1(c1) values(5) ON DUPLICATE KEY UPDATE c4 = array_append([[2,3,4,5]],[null]);
insert into t1(c1) values(3)ON DUPLICATE KEY UPDATE c2=array_append([2,3,4,5],null) ;
insert into t1(c2,c3,c4) values([1,2,3,5],[2.123,2.123,3.123,4.123],[['中文ing123',1,'1']]) ON DUPLICATE KEY UPDATE c4=array_append([[2,3,4,5]],[null]);
insert into t1(c2,c3,c4) values([1,2,3,5],[2.123,2.123,3.123,4.123],[['中文ing123',1,'1']]) ON DUPLICATE KEY UPDATE c4=array_append([[2,3,4,5]],[null]);
select * from t1 order by c1;
c1	c2	c3	c4
1	[1,2,3,5]	[2.123,2.123,3.123,4.123]	[["中文ing123","1","1"]]
2	[2,3,4,5]	[2.123,2.123,3.123,4.123]	[[NULL,"a","sss"]]
3	[2,3,4,5,NULL]	[3.123,2.123,3.123,4.123]	[["null","a","sss"]]
4	[2,3,4,5]	[4.123,2.123,3.123,4.123]	[["2","3","4","5"]]
5	NULL	NULL	[["2","3","4","5"],[NULL]]
6	[1,2,3,5]	[2.123,2.123,3.123,4.123]	[["中文ing123","1","1"]]
7	[1,2,3,5]	[2.123,2.123,3.123,4.123]	[["中文ing123","1","1"]]
drop table if exists t1;
CREATE TABLE t1 (c1 int AUTO_INCREMENT primary key, c2 int[],c3 float[],c4 varchar(256)[][]);
insert into t1 values(1,[1,2,3,5],[2.123,2.123,3.123,4.123],[['中文ing123',1,'1']]);
insert into t1 values(2,[2,3,4,5],[2.123,2.123,3.123,4.123],[[null,'a','sss']]);
insert into t1 values(3,[3,3,3,3],[3.123,2.123,3.123,4.123],[['null','a','sss']]);
insert into t1 values(4,[2,3,4,5],[4.123,2.123,3.123,4.123],[[2,3,4,5]]);
insert into t1(c1) values(5) ;
insert /*+ parallel(10) */ overwrite t1(c4) select array_append([[2,3,4,5]],[null]) from t1 where c1>2;
insert /*+ parallel(10) */ overwrite t1(c4) select array_append([[2,3,4,5]],[null]) from t1 where c1>2;
insert /*+ parallel(10) */ overwrite t1(c2) select array_append([2,3,4,5],null) from t1 where c1>2;
select * from t1 order by c1;
c1	c2	c3	c4
12	[2,3,4,5,NULL]	NULL	NULL
13	[2,3,4,5,NULL]	NULL	NULL
14	[2,3,4,5,NULL]	NULL	NULL
drop table if exists t1;
drop view if exists v1;
CREATE TABLE t1 (c1 int AUTO_INCREMENT , c2 int[],c3 float[],c4 varchar(256)[][]);
insert into t1 values(1,[1,2,3,5],[2.123,2.123,3.123,4.123],[['中文ing123',1,'1']]);
insert into t1 values(2,[2,3,4,5],[2.123,2.123,3.123,4.123],[[null,'a','sss']]);
insert into t1 values(3,[3,3,3,3],[3.123,2.123,3.123,4.123],[['null','a','sss']]);
insert into t1 values(4,[2,3,4,5],[4.123,2.123,3.123,4.123],[[2,3,4,5]]);
insert into t1(c1) values(5) ;
insert /*+ direct(true,100) enable_parallel_dml parallel(2) append*/ into t1(c2) select array_append([2,3,4,5],null) from t1;
insert /*+ direct(true,100) enable_parallel_dml parallel(2) append*/ into t1(c4) select array_append([[2,3,4,5]],[null]) from t1;
insert /*+ enable_parallel_dml parallel(2) */ into t1(c2) select array_append([2,3,4,5],null) from t1;
insert /*+ enable_parallel_dml parallel(2) */ into t1(c4) select array_append([[2,3,4,5]],[null]) from t1;
select count(*) from t1;
count(*)
80
drop table if exists t1;
drop view if exists v1;
CREATE TABLE t1 (c1 int AUTO_INCREMENT , c2 int[],c3 float[],c4 varchar(256)[][])partition by hash(c1);
insert into t1 values(1,[1,2,3,5],[2.123,2.123,3.123,4.123],[['中文ing123',1,'1']]);
insert into t1 values(2,[2,3,4,5],[2.123,2.123,3.123,4.123],[[null,'a','sss']]);
insert into t1 values(3,[3,3,3,3],[3.123,2.123,3.123,4.123],[['null','a','sss']]);
insert into t1 values(4,[2,3,4,5],[4.123,2.123,3.123,4.123],[[2,3,4,5]]);
insert into t1(c1) values(5) ;
insert /*+ direct(true,100) enable_parallel_dml parallel(2) append*/ into t1(c2) select array_append([2,3,4,5],null) from t1;
insert /*+ direct(true,100) enable_parallel_dml parallel(2) append*/ into t1(c4) select array_append([[2,3,4,5]],[null]) from t1;
insert /*+ enable_parallel_dml parallel(2) */ into t1(c2) select array_append([2,3,4,5],null) from t1;
insert /*+ enable_parallel_dml parallel(2) */ into t1(c4) select array_append([[2,3,4,5]],[null]) from t1;
select count(*) from t1;
count(*)
80
drop table if exists t1;
CREATE TABLE t1 (c1 int AUTO_INCREMENT primary key, c2 int[],c3 float[],c4 varchar(256)[][])partition by hash(c1);
insert into t1 values(1,[1,2,3,5],[2.123,2.123,3.123,4.123],[['中文ing123',1,'1']]);
insert into t1 values(2,[2,3,4,5],[2.123,2.123,3.123,4.123],[[null,'a','sss']]);
insert into t1 values(3,[3,3,3,3],[3.123,2.123,3.123,4.123],[['null','a','sss'],[null]]);
insert into t1 values(4,[2,3,4,5],[4.123,2.123,3.123,4.123],[[2,3,4,5]]);
insert into t1 values(5,[null],[null],[[null]]);
insert into t1(c1) values(6) ;
delete from t1 where c2=array_append([2,3,5],4) order by c1;
delete from t1 where c2=array_append([2,3,4],5) order by c1;
delete from t1 where c4=array_append([['null','a','sss']],[null]) limit 1;
delete from t1;
drop table if exists t1;
CREATE TABLE t1 (c1 int AUTO_INCREMENT primary key, c2 int[],c3 float[],c4 varchar(256)[][])partition by hash(c1);
insert into t1 values(1,[1,2,3,5],[2.123,2.123,3.123,4.123],[['中文ing123',1,'1']]);
insert into t1 values(2,[2,3,4,5],[2.123,2.123,3.123,4.123],[[null,'a','sss']]);
insert into t1 values(3,[3,3,3,3],[3.123,2.123,3.123,4.123],[['null','a','sss']]);
insert into t1 values(4,[2,3,4,5],[4.123,2.123,3.123,4.123],[[2,3,4,5]]);
insert into t1 values(5,[null],[null],[[null]]);
insert into t1(c1) values(6) ;
select array_append(c2,null) from t1 order by c1;
array_append(c2,null)
[1,2,3,5,NULL]
[2,3,4,5,NULL]
[3,3,3,3,NULL]
[2,3,4,5,NULL]
[NULL,NULL]
NULL
select /*+enable_parallel_dml parallel(2) */ array_append(c2,null) from t1 order by c1;
array_append(c2,null)
[1,2,3,5,NULL]
[2,3,4,5,NULL]
[3,3,3,3,NULL]
[2,3,4,5,NULL]
[NULL,NULL]
NULL
select array_append(c3,null) from t1 order by c1;
array_append(c3,null)
[2.123,2.123,3.123,4.123,NULL]
[2.123,2.123,3.123,4.123,NULL]
[3.123,2.123,3.123,4.123,NULL]
[4.123,2.123,3.123,4.123,NULL]
[NULL,NULL]
NULL
select /*+enable_parallel_dml parallel(2) */ array_append(c3,null) from t1 order by c1;
array_append(c3,null)
[2.123,2.123,3.123,4.123,NULL]
[2.123,2.123,3.123,4.123,NULL]
[3.123,2.123,3.123,4.123,NULL]
[4.123,2.123,3.123,4.123,NULL]
[NULL,NULL]
NULL
select array_append(c3,null) from t1 order by c1;
array_append(c3,null)
[2.123,2.123,3.123,4.123,NULL]
[2.123,2.123,3.123,4.123,NULL]
[3.123,2.123,3.123,4.123,NULL]
[4.123,2.123,3.123,4.123,NULL]
[NULL,NULL]
NULL
select array_append(c4,[null]) from t1 order by c1;
array_append(c4,[null])
[["中文ing123","1","1"],[NULL]]
[[NULL,"a","sss"],[NULL]]
[["null","a","sss"],[NULL]]
[["2","3","4","5"],[NULL]]
[[NULL],[NULL]]
NULL
########清空回收站，删除测试数据库，表等 ##########
drop database  IF EXISTS  obljh;
purge recyclebin;
