purge recyclebin;
drop database IF EXISTS obljh;
create database obljh ;
use obljh;
set timestamp = 1600000000;
set ob_trx_timeout = 10000000000;
set ob_query_timeout = 10000000000;
alter system set ob_vector_memory_limit_percentage =44;
drop table if exists t1;
CREATE TABLE t1 (c1 int primary key, c2 int[],c3 float[],c4 varchar(256)[][][][][][]);
insert into t1 values(1,[1,false,0],[1.123,null,96666],[[[[[['中文ing123','abc','1']]]]]]);
insert into t1 values(2,[0,0,99999,null,null],[0.12345,null,966.66],[[[[[[null,'a','sss']]]]]]);
insert into t1 values(3,null,null,null);
select *,array_distinct(c2) from t1 order by c1;
c1	c2	c3	c4	array_distinct(c2)
1	[1,0,0]	[1.123,NULL,96666]	[[[[[["中文ing123","abc","1"]]]]]]	[1,0]
2	[0,0,99999,NULL,NULL]	[0.12345,NULL,966.66]	[[[[[[NULL,"a","sss"]]]]]]	[NULL,0,99999]
3	NULL	NULL	NULL	NULL
select *,array_distinct(c3) from t1 order by c1;
c1	c2	c3	c4	array_distinct(c3)
1	[1,0,0]	[1.123,NULL,96666]	[[[[[["中文ing123","abc","1"]]]]]]	[NULL,1.123,96666]
2	[0,0,99999,NULL,NULL]	[0.12345,NULL,966.66]	[[[[[[NULL,"a","sss"]]]]]]	[NULL,0.12345,966.66]
3	NULL	NULL	NULL	NULL
select *,array_distinct(c4) from t1 order by c1;
c1	c2	c3	c4	array_distinct(c4)
1	[1,0,0]	[1.123,NULL,96666]	[[[[[["中文ing123","abc","1"]]]]]]	[[[[[["中文ing123","abc","1"]]]]]]
2	[0,0,99999,NULL,NULL]	[0.12345,NULL,966.66]	[[[[[[NULL,"a","sss"]]]]]]	[[[[[[NULL,"a","sss"]]]]]]
3	NULL	NULL	NULL	NULL
drop table if exists t1;
create table t1 (c1 int[], c2 varchar(256)[], c3 bigint[], c4 TINYINT[], c5 float[], c6 double[], c7 SMALLINT[],c8 vector(3) as (array_distinct(c1)));
insert into t1(c1,c2,c3,c4,c5,c6,c7) values([1,1,2,4],['abc'],[999999999],[22],[1.123456],[2.2133],[1.123]);
select  c1 from t1;
c1
[1,1,2,4]
select /*+ ENABLE_PARALLEL_DML PARALLEL(3) */ c1 from t1;
c1
[1,1,2,4]
select /*+ ENABLE_PARALLEL_DML PARALLEL(3) */ array_distinct(c1) from t1;
array_distinct(c1)
[1,2,4]
select array_distinct(c1),array_distinct(c2),array_distinct(c3),array_distinct(c4),array_distinct(c5),array_distinct(c6),array_distinct(c7),array_distinct(c8) from t1;
array_distinct(c1)	array_distinct(c2)	array_distinct(c3)	array_distinct(c4)	array_distinct(c5)	array_distinct(c6)	array_distinct(c7)	array_distinct(c8)
[1,2,4]	["abc"]	[999999999]	[22]	[1.12346]	[2.2133]	[1]	[1,2,4]
select *,array_distinct(c1) from t1 where array_distinct(c1) is null;
c1	c2	c3	c4	c5	c6	c7	c8	array_distinct(c1)
select *,array_distinct(c2) from t1 where array_distinct(c1)=[1];
c1	c2	c3	c4	c5	c6	c7	c8	array_distinct(c2)
select *,array_distinct(c3) from t1 where array_distinct(c2)=['abc'];
c1	c2	c3	c4	c5	c6	c7	c8	array_distinct(c3)
[1,1,2,4]	["abc"]	[999999999]	[22]	[1.12346]	[2.2133]	[1]	[1,2,4]	[999999999]
select *,array_distinct(c4) from t1 where array_distinct(c3)=[999999999];
c1	c2	c3	c4	c5	c6	c7	c8	array_distinct(c4)
[1,1,2,4]	["abc"]	[999999999]	[22]	[1.12346]	[2.2133]	[1]	[1,2,4]	[22]
select *,array_distinct(c5) from t1 where array_distinct(c4)=[22];
c1	c2	c3	c4	c5	c6	c7	c8	array_distinct(c5)
[1,1,2,4]	["abc"]	[999999999]	[22]	[1.12346]	[2.2133]	[1]	[1,2,4]	[1.12346]
select *,array_distinct(c6) from t1 where array_distinct(c5)=[1.123456];
c1	c2	c3	c4	c5	c6	c7	c8	array_distinct(c6)
select *,array_distinct(c7) from t1 where array_distinct(c6)=[2.2133];
c1	c2	c3	c4	c5	c6	c7	c8	array_distinct(c7)
[1,1,2,4]	["abc"]	[999999999]	[22]	[1.12346]	[2.2133]	[1]	[1,2,4]	[1]
select *,array_distinct(c8) from t1 where array_distinct(c7)=[1.123];
c1	c2	c3	c4	c5	c6	c7	c8	array_distinct(c8)
select * from t1 a,t1 b where array_distinct(a.c7)<>array_distinct(b.c7);
c1	c2	c3	c4	c5	c6	c7	c8	c1	c2	c3	c4	c5	c6	c7	c8
select * from t1 a,t1 b where array_distinct(a.c6)=array_distinct(b.c7);
c1	c2	c3	c4	c5	c6	c7	c8	c1	c2	c3	c4	c5	c6	c7	c8
select * from t1 a,t1 b where array_distinct(a.c5)<>array_distinct(b.c7);
c1	c2	c3	c4	c5	c6	c7	c8	c1	c2	c3	c4	c5	c6	c7	c8
[1,1,2,4]	["abc"]	[999999999]	[22]	[1.12346]	[2.2133]	[1]	[1,2,4]	[1,1,2,4]	["abc"]	[999999999]	[22]	[1.12346]	[2.2133]	[1]	[1,2,4]
select * from t1 a,t1 b where array_distinct(a.c4)<>array_distinct(b.c7);
c1	c2	c3	c4	c5	c6	c7	c8	c1	c2	c3	c4	c5	c6	c7	c8
[1,1,2,4]	["abc"]	[999999999]	[22]	[1.12346]	[2.2133]	[1]	[1,2,4]	[1,1,2,4]	["abc"]	[999999999]	[22]	[1.12346]	[2.2133]	[1]	[1,2,4]
select * from t1 a,t1 b where array_distinct(a.c3)<>array_distinct(b.c7);
c1	c2	c3	c4	c5	c6	c7	c8	c1	c2	c3	c4	c5	c6	c7	c8
[1,1,2,4]	["abc"]	[999999999]	[22]	[1.12346]	[2.2133]	[1]	[1,2,4]	[1,1,2,4]	["abc"]	[999999999]	[22]	[1.12346]	[2.2133]	[1]	[1,2,4]
select * from t1 a,t1 b where array_distinct(a.c2)<>array_distinct(b.c7);
c1	c2	c3	c4	c5	c6	c7	c8	c1	c2	c3	c4	c5	c6	c7	c8
[1,1,2,4]	["abc"]	[999999999]	[22]	[1.12346]	[2.2133]	[1]	[1,2,4]	[1,1,2,4]	["abc"]	[999999999]	[22]	[1.12346]	[2.2133]	[1]	[1,2,4]
drop table if exists t1;
CREATE TABLE t1 (c1 int primary key, c2 int[],c3 float[],c4 varchar(256)[]);
insert into t1 values(1,[1,1,2,3],[1.123,null,96666],['中文ing123',1,'1']);
insert into t1 values(2,[2,3,4,4],[0.12345,null,966.66],[null,'a','sss']);
insert into t1 values(3,[1,2,3,4],[0.12345,null,966.66],['null','a','sss']);
insert into t1 values(4,null,null,null);
insert into t1 values(5,[null,null,null,1],[null,null,null,1],[null,null,null,1]);
insert into t1 values(6,array_distinct([1,2,3,4,1,null]),[1.123],['']);
drop table if exists tt1;
CREATE table tt1 like t1;
replace into tt1 select c1,array_distinct(c2) c2,array_distinct(c3) c3,array_distinct(c4) c4 from t1;
select count(*) from t1,tt1 where array_distinct(t1.c2)=array_distinct(tt1.c2) order by t1.c1;
count(*)
5
select count(*) from t1,tt1 where array_distinct([t1.c2])=array_distinct([tt1.c2]) order by t1.c1;
count(*)
3
select count(*) from t1,tt1 where array_distinct([[[[[t1.c2]]]]])=array_distinct([[[[[tt1.c2]]]]]) order by t1.c1;
count(*)
3
select count(*) from t1,tt1 where array_distinct(t1.c2)<>array_distinct(tt1.c2) order by t1.c1;
count(*)
20
select count(*) from t1,tt1 where array_distinct(t1.c2)=array_distinct(tt1.c2) order by t1.c1;
count(*)
5
drop table if exists t1;
CREATE TABLE t1 (c1 int primary key, c2 int[],c3 float[],c4 varchar(256)[]);
insert into t1 values(1,[1,2,3,4,1,2,3,4],[1.2,2.3,6.9,-1.02,1.2,2.3,6.9,-1.02],['中文ing123',1,'1','中文ing123',1,'1']);
insert into t1 values(2,[2,3,4,6,2,3,4,6],[1.123,2.3126,2.30,-0.25,1.123,2.3126,2.30,-0.25],[null,'a','sss',null,'a','sss']);
insert into t1 values(3,[7,1,5,9,7,1,5,9],[0.12345,null,966.66,0.12345,null,966.66],['null','a','sss','null','a','sss']);
insert into t1 values(4,null,null,null);
select c1,c3,array_distinct(c2) from t1 where array_distinct(c4) = ['中文ing123',1];
c1	c3	array_distinct(c2)
1	[1.2,2.3,6.9,-1.02,1.2,2.3,6.9,-1.02]	[1,2,3,4]
select c1,c2,array_distinct(c3) from t1 where array_distinct(c4) = [null,'a','sss'];
c1	c2	array_distinct(c3)
2	[2,3,4,6,2,3,4,6]	[1.123,2.3126,2.3,-0.25]
select c1,array_distinct(c4) from t1 where array_distinct(c4) = ['null','a','sss'];
c1	array_distinct(c4)
3	["null","a","sss"]
select c1,array_distinct(c4) from t1 where element_at(c4,1) is null;
c1	array_distinct(c4)
2	[NULL,"a","sss"]
4	NULL
select c1,c2,c3,array_distinct(c3) from t1 where array_distinct(c3) = [1.2,2.3,6.9,-1.02];
c1	c2	c3	array_distinct(c3)
select c1,c2,c3,c4 from t1 where c2 > array_distinct(c2) order by c1;
ERROR 22000: Invalid data type for the operation
select c1,c2,c3,c4 from t1 where c2 < array_distinct(c2) order by c1;
ERROR 22000: Invalid data type for the operation
select c1,c2,c3,c4 from t1 where c2 <= array_distinct(c2) order by c1;
ERROR 22000: Invalid data type for the operation
select c1,c2,c3,c4 from t1 where c2 <> array_distinct(c2) order by c1;
c1	c2	c3	c4
1	[1,2,3,4,1,2,3,4]	[1.2,2.3,6.9,-1.02,1.2,2.3,6.9,-1.02]	["中文ing123","1","1","中文ing123","1","1"]
2	[2,3,4,6,2,3,4,6]	[1.123,2.3126,2.3,-0.25,1.123,2.3126,2.3,-0.25]	[NULL,"a","sss",NULL,"a","sss"]
3	[7,1,5,9,7,1,5,9]	[0.12345,NULL,966.66,0.12345,NULL,966.66]	["null","a","sss","null","a","sss"]
select c1,c2,c3,c4 from t1 where c2 = array_distinct(c2) order by c1;
c1	c2	c3	c4
select c1,c2,c3,c4 from t1 where c1 between array_distinct(c2) and array_distinct(c3) ;
ERROR HY000: Invalid argument
select c1,c2,c3,c4 from t1 where c2 between array_distinct(c2) and array_distinct(c3) ;
ERROR 22000: Invalid data type for the operation
select c1,c2,c3,c4 from t1 where array_distinct(c2) between array_distinct(c2) and array_distinct(c3) ;
ERROR 22000: Invalid data type for the operation
select c1,c2,c3,c4 from t1 where array_distinct(c2) like '%2%';
ERROR 22000: Invalid data type for the operation
select c1,c2,c3,c4 from t1 where array_distinct(c3) like '%2%';
ERROR 22000: Invalid data type for the operation
select c1,c2,c3,c4 from t1 where array_distinct(c4) like '%中文%';
ERROR 22000: Invalid data type for the operation
select c1,c2,c3,c4 from t1 where array_distinct(c2) not like '%2%';
ERROR 22000: Invalid data type for the operation
select c1,c2,c3,c4 from t1 where array_distinct(c3) not like '%2%';
ERROR 22000: Invalid data type for the operation
select c1,c2,c3,c4 from t1 where array_distinct(c4) not like '%中文%';
ERROR 22000: Invalid data type for the operation
select c1,c2,c3,c4,array_distinct(c4) from t1 where EXISTS (SELECT array_distinct(c4) FROM t1) order by c1;
c1	c2	c3	c4	array_distinct(c4)
1	[1,2,3,4,1,2,3,4]	[1.2,2.3,6.9,-1.02,1.2,2.3,6.9,-1.02]	["中文ing123","1","1","中文ing123","1","1"]	["中文ing123","1"]
2	[2,3,4,6,2,3,4,6]	[1.123,2.3126,2.3,-0.25,1.123,2.3126,2.3,-0.25]	[NULL,"a","sss",NULL,"a","sss"]	[NULL,"a","sss"]
3	[7,1,5,9,7,1,5,9]	[0.12345,NULL,966.66,0.12345,NULL,966.66]	["null","a","sss","null","a","sss"]	["null","a","sss"]
4	NULL	NULL	NULL	NULL
select c1,c2,c3,c4,array_distinct(c4) from t1 where not EXISTS (SELECT array_distinct(c4) FROM t1) order by c1;
c1	c2	c3	c4	array_distinct(c4)
SELECT c1,c2,c3,c4,array_distinct(c4) from t1 where c2 = any (SELECT array_distinct(c2) FROM t1) order by c1;
ERROR 22000: Invalid data type for the operation
SELECT c1,c2,c3,c4,array_distinct(c4) from t1 where c2 >= any (SELECT array_distinct(c2) FROM t1) order by c1;
ERROR 22000: Invalid data type for the operation
SELECT c1,c2,c3,c4,array_distinct(c4) from t1 where c2 <= any (SELECT array_distinct(c2) FROM t1) order by c1;
ERROR 22000: Invalid data type for the operation
SELECT c1,c2,c3,c4,array_distinct(c4) from t1 where c2 <> any (SELECT array_distinct(c2) FROM t1) order by c1;
ERROR 22000: Invalid data type for the operation
SELECT c1,c2,c3,c4,array_distinct(c4) from t1 where c2 != any (SELECT array_distinct(c2) FROM t1) order by c1;
ERROR 22000: Invalid data type for the operation
SELECT c1,c2,c3,c4,array_distinct(c4) from t1 where c2 > any (SELECT array_distinct(c2) FROM t1) order by c1;
ERROR 22000: Invalid data type for the operation
SELECT c1,c2,c3,c4,array_distinct(c4) from t1 where c2 < any (SELECT array_distinct(c2) FROM t1) order by c1;
ERROR 22000: Invalid data type for the operation
select array_distinct([array_distinct(c2),array_distinct(c3),array_distinct(c4)]) from t1 order by c1 ;
array_distinct([array_distinct(c2),array_distinct(c3),array_distinct(c4)])
[["1","2","3","4"],["1.2","2.3","6.9","-1.02"],["中文ing123","1"]]
[["2","3","4","6"],["1.123","2.3126","2.3","-0.25"],[NULL,"a","sss"]]
[["7","1","5","9"],[NULL,"0.12345","966.66"],["null","a","sss"]]
[NULL]
SELECT c1,c2,c3,c4,array_distinct(c4) from t1 where array_distinct(c4) in (array_distinct(c4)) order by c1;
c1	c2	c3	c4	array_distinct(c4)
1	[1,2,3,4,1,2,3,4]	[1.2,2.3,6.9,-1.02,1.2,2.3,6.9,-1.02]	["中文ing123","1","1","中文ing123","1","1"]	["中文ing123","1"]
2	[2,3,4,6,2,3,4,6]	[1.123,2.3126,2.3,-0.25,1.123,2.3126,2.3,-0.25]	[NULL,"a","sss",NULL,"a","sss"]	[NULL,"a","sss"]
3	[7,1,5,9,7,1,5,9]	[0.12345,NULL,966.66,0.12345,NULL,966.66]	["null","a","sss","null","a","sss"]	["null","a","sss"]
SELECT c1,c2,c3,c4,array_distinct(c4) from t1 where c4 in (array_distinct(c4),array_distinct(c4),array_distinct(c4)) order by c1;
ERROR 22000: Invalid data type for the operation
SELECT c1,c2,c3,c4,array_distinct(c4) from t1 where c3 in (array_distinct(c3),array_distinct(c3),array_distinct(c3)) order by c1;
ERROR 22000: Invalid data type for the operation
SELECT c1,c2,c3,c4,array_distinct(c4) from t1 where c2 in (array_distinct(c2),array_distinct(c2),array_distinct(c2)) order by c1;
ERROR 22000: Invalid data type for the operation
SELECT c1,c2,c3,c4,array_distinct(c2) from t1 where c1 in (array_distinct(c2),array_distinct(c2),array_distinct(c2)) order by c1;
ERROR 22000: Invalid data type for the operation
SELECT c1,c2,c3,c4,array_distinct(c4) from t1 where array_distinct(c4) not in (array_distinct(c4)) order by c1;
c1	c2	c3	c4	array_distinct(c4)
SELECT c1,c2,c3,c4,array_distinct(c4) from t1 where c4 not in (array_distinct(c4),array_distinct(c4),array_distinct(c4)) order by c1;
ERROR 22000: Invalid data type for the operation
SELECT c1,c2,c3,c4,array_distinct(c4) from t1 where c3 not in (array_distinct(c3),array_distinct(c3),array_distinct(c3)) order by c1;
ERROR 22000: Invalid data type for the operation
SELECT c1,c2,c3,c4,array_distinct(c4) from t1 where c2 not in (array_distinct(c2),array_distinct(c2),array_distinct(c2)) order by c1;
ERROR 22000: Invalid data type for the operation
SELECT c1,c2,c3,c4,array_distinct(c2) from t1 where c1 not in (array_distinct(c2),array_distinct(c2),array_distinct(c2)) order by c1;
ERROR 22000: Invalid data type for the operation
drop table if exists t1;
CREATE TABLE t1 (c1 int primary key, c2 int[],c3 float[],c4 varchar(256)[]);
insert into t1 values(1,[1,2,3,4,1,2,3,4],[1.2,2.3,6.9,-1.02,1.2,2.3,6.9,-1.02],['中文ing123',1,'1','中文ing123',1,'1']);
insert into t1 values(2,[2,3,4,6,2,3,4,6],[1.123,2.3126,2.30,-0.25,1.123,2.3126,2.30,-0.25],[null,'a','sss',null,'a','sss']);
insert into t1 values(3,[7,1,5,9,7,1,5,9],[0.12345,null,966.66,0.12345,null,966.66],['null','a','sss','null','a','sss']);
insert into t1 values(4,null,null,null);
drop table if exists t2;
create table t2 like t1;
replace into t2 select * from t1;
select array_distinct(t1.c3) = c3 from t1;
array_distinct(t1.c3) = c3
0
0
0
NULL
select * from t1,t2 where array_distinct(t1.c3)=array_distinct(t2.c3) order by t1.c1,t2.c1;
c1	c2	c3	c4	c1	c2	c3	c4
1	[1,2,3,4,1,2,3,4]	[1.2,2.3,6.9,-1.02,1.2,2.3,6.9,-1.02]	["中文ing123","1","1","中文ing123","1","1"]	1	[1,2,3,4,1,2,3,4]	[1.2,2.3,6.9,-1.02,1.2,2.3,6.9,-1.02]	["中文ing123","1","1","中文ing123","1","1"]
2	[2,3,4,6,2,3,4,6]	[1.123,2.3126,2.3,-0.25,1.123,2.3126,2.3,-0.25]	[NULL,"a","sss",NULL,"a","sss"]	2	[2,3,4,6,2,3,4,6]	[1.123,2.3126,2.3,-0.25,1.123,2.3126,2.3,-0.25]	[NULL,"a","sss",NULL,"a","sss"]
3	[7,1,5,9,7,1,5,9]	[0.12345,NULL,966.66,0.12345,NULL,966.66]	["null","a","sss","null","a","sss"]	3	[7,1,5,9,7,1,5,9]	[0.12345,NULL,966.66,0.12345,NULL,966.66]	["null","a","sss","null","a","sss"]
select * from t1,t2 where array_distinct(t1.c3)<>array_distinct(t2.c3) order by t1.c1,t1.c2,t1.c3;
c1	c2	c3	c4	c1	c2	c3	c4
1	[1,2,3,4,1,2,3,4]	[1.2,2.3,6.9,-1.02,1.2,2.3,6.9,-1.02]	["中文ing123","1","1","中文ing123","1","1"]	2	[2,3,4,6,2,3,4,6]	[1.123,2.3126,2.3,-0.25,1.123,2.3126,2.3,-0.25]	[NULL,"a","sss",NULL,"a","sss"]
1	[1,2,3,4,1,2,3,4]	[1.2,2.3,6.9,-1.02,1.2,2.3,6.9,-1.02]	["中文ing123","1","1","中文ing123","1","1"]	3	[7,1,5,9,7,1,5,9]	[0.12345,NULL,966.66,0.12345,NULL,966.66]	["null","a","sss","null","a","sss"]
2	[2,3,4,6,2,3,4,6]	[1.123,2.3126,2.3,-0.25,1.123,2.3126,2.3,-0.25]	[NULL,"a","sss",NULL,"a","sss"]	1	[1,2,3,4,1,2,3,4]	[1.2,2.3,6.9,-1.02,1.2,2.3,6.9,-1.02]	["中文ing123","1","1","中文ing123","1","1"]
2	[2,3,4,6,2,3,4,6]	[1.123,2.3126,2.3,-0.25,1.123,2.3126,2.3,-0.25]	[NULL,"a","sss",NULL,"a","sss"]	3	[7,1,5,9,7,1,5,9]	[0.12345,NULL,966.66,0.12345,NULL,966.66]	["null","a","sss","null","a","sss"]
3	[7,1,5,9,7,1,5,9]	[0.12345,NULL,966.66,0.12345,NULL,966.66]	["null","a","sss","null","a","sss"]	1	[1,2,3,4,1,2,3,4]	[1.2,2.3,6.9,-1.02,1.2,2.3,6.9,-1.02]	["中文ing123","1","1","中文ing123","1","1"]
3	[7,1,5,9,7,1,5,9]	[0.12345,NULL,966.66,0.12345,NULL,966.66]	["null","a","sss","null","a","sss"]	2	[2,3,4,6,2,3,4,6]	[1.123,2.3126,2.3,-0.25,1.123,2.3126,2.3,-0.25]	[NULL,"a","sss",NULL,"a","sss"]
select * from t1,t2 where t1.c3<>t2.c3 order by t1.c1,t1.c2,t1.c3;
c1	c2	c3	c4	c1	c2	c3	c4
1	[1,2,3,4,1,2,3,4]	[1.2,2.3,6.9,-1.02,1.2,2.3,6.9,-1.02]	["中文ing123","1","1","中文ing123","1","1"]	2	[2,3,4,6,2,3,4,6]	[1.123,2.3126,2.3,-0.25,1.123,2.3126,2.3,-0.25]	[NULL,"a","sss",NULL,"a","sss"]
1	[1,2,3,4,1,2,3,4]	[1.2,2.3,6.9,-1.02,1.2,2.3,6.9,-1.02]	["中文ing123","1","1","中文ing123","1","1"]	3	[7,1,5,9,7,1,5,9]	[0.12345,NULL,966.66,0.12345,NULL,966.66]	["null","a","sss","null","a","sss"]
2	[2,3,4,6,2,3,4,6]	[1.123,2.3126,2.3,-0.25,1.123,2.3126,2.3,-0.25]	[NULL,"a","sss",NULL,"a","sss"]	1	[1,2,3,4,1,2,3,4]	[1.2,2.3,6.9,-1.02,1.2,2.3,6.9,-1.02]	["中文ing123","1","1","中文ing123","1","1"]
2	[2,3,4,6,2,3,4,6]	[1.123,2.3126,2.3,-0.25,1.123,2.3126,2.3,-0.25]	[NULL,"a","sss",NULL,"a","sss"]	3	[7,1,5,9,7,1,5,9]	[0.12345,NULL,966.66,0.12345,NULL,966.66]	["null","a","sss","null","a","sss"]
3	[7,1,5,9,7,1,5,9]	[0.12345,NULL,966.66,0.12345,NULL,966.66]	["null","a","sss","null","a","sss"]	1	[1,2,3,4,1,2,3,4]	[1.2,2.3,6.9,-1.02,1.2,2.3,6.9,-1.02]	["中文ing123","1","1","中文ing123","1","1"]
3	[7,1,5,9,7,1,5,9]	[0.12345,NULL,966.66,0.12345,NULL,966.66]	["null","a","sss","null","a","sss"]	2	[2,3,4,6,2,3,4,6]	[1.123,2.3126,2.3,-0.25,1.123,2.3126,2.3,-0.25]	[NULL,"a","sss",NULL,"a","sss"]
select * from t1,t2 where array_distinct(t1.c3)>array_distinct(t2.c3) order by t1.c1,t2.c1;
ERROR 22000: Invalid data type for the operation
select * from t1,t2 where array_distinct(t1.c3)<array_distinct(t2.c3) order by t1.c1,t2.c1;
ERROR 22000: Invalid data type for the operation
select * from t1,t2 where array_distinct(t1.c3)<=>array_distinct(t2.c3) order by t1.c1,t2.c1;
ERROR 22000: Invalid data type for the operation
select t1.c1,array_distinct(t1.c3) from t1  join t2  on array_distinct(t1.c3)=array_distinct(t2.c3)  order by t1.c1;
c1	array_distinct(t1.c3)
1	[1.2,2.3,6.9,-1.02]
2	[1.123,2.3126,2.3,-0.25]
3	[NULL,0.12345,966.66]
select t1.c1,array_distinct(t1.c3) from t1  inner join t2  on array_distinct(t1.c3)=array_distinct(t2.c3)  order by t1.c1;
c1	array_distinct(t1.c3)
1	[1.2,2.3,6.9,-1.02]
2	[1.123,2.3126,2.3,-0.25]
3	[NULL,0.12345,966.66]
select t1.c1,array_distinct(t1.c3) from t1  right join t2  on array_distinct(t1.c3)=array_distinct(t2.c3)  order by t1.c1;
c1	array_distinct(t1.c3)
NULL	NULL
1	[1.2,2.3,6.9,-1.02]
2	[1.123,2.3126,2.3,-0.25]
3	[NULL,0.12345,966.66]
select t1.c1,array_distinct(t1.c3) from t1  left join t2  on array_distinct(t1.c3)=array_distinct(t2.c3)  order by t1.c1;
c1	array_distinct(t1.c3)
1	[1.2,2.3,6.9,-1.02]
2	[1.123,2.3126,2.3,-0.25]
3	[NULL,0.12345,966.66]
4	NULL
select t1.c1,array_distinct(t1.c3) from t1  cross  join t2 on array_distinct(t1.c3)=array_distinct(t2.c3)  order by t1.c1;
c1	array_distinct(t1.c3)
1	[1.2,2.3,6.9,-1.02]
2	[1.123,2.3126,2.3,-0.25]
3	[NULL,0.12345,966.66]
select t1.c1,array_distinct(t1.c4) from t1  join t2  on array_distinct(t1.c4)=array_distinct(t2.c4)  order by t1.c1;
c1	array_distinct(t1.c4)
1	["中文ing123","1"]
2	[NULL,"a","sss"]
3	["null","a","sss"]
select t1.c1,array_distinct(t1.c4) from t1  inner join t2  on array_distinct(t1.c4)=array_distinct(t2.c4)  order by t1.c1;
c1	array_distinct(t1.c4)
1	["中文ing123","1"]
2	[NULL,"a","sss"]
3	["null","a","sss"]
select t1.c1,array_distinct(t1.c4) from t1  right join t2  on array_distinct(t1.c4)=array_distinct(t2.c4)  order by t1.c1;
c1	array_distinct(t1.c4)
NULL	NULL
1	["中文ing123","1"]
2	[NULL,"a","sss"]
3	["null","a","sss"]
select t1.c1,array_distinct(t1.c4) from t1  left join t2  on array_distinct(t1.c4)=array_distinct(t2.c4)  order by t1.c1;
c1	array_distinct(t1.c4)
1	["中文ing123","1"]
2	[NULL,"a","sss"]
3	["null","a","sss"]
4	NULL
select t1.c1,array_distinct(t1.c4) from t1  cross  join t2 on array_distinct(t1.c4)=array_distinct(t2.c4)  order by t1.c1;
c1	array_distinct(t1.c4)
1	["中文ing123","1"]
2	[NULL,"a","sss"]
3	["null","a","sss"]
drop table if exists t1;
CREATE TABLE t1 (c1 int primary key, c2 vector(4),c3 float[],c4 varchar(256)[]);
insert into t1 values(1,array_distinct([1,2,3,4,1,2,3,4]),[1.2,2.3,6.9,-1.02,1.2,2.3,6.9,-1.02],['中文ing123',1,'1','中文ing123',1,'1']);
insert into t1 values(2,array_distinct([2,3,4,6,2,3,4,6]),[1.123,2.3126,2.30,-0.25,1.123,2.3126,2.30,-0.25],[null,'a','sss',null,'a','sss']);
insert into t1 values(3,array_distinct([7,1,5,9,7,1,5,9]),[0.12345,null,966.66,0.12345,null,966.66],['null','a','sss','null','a','sss']);
insert into t1 values(4,null,null,null);
drop view if exists v1;
create view v1 as  select c1, array_distinct(c2) c2,array_distinct(c3) c3,array_distinct(c4) c4 from t1;
select array_distinct(a.c2) from v1 a,t1 b order by a.c1,b.c1;
array_distinct(a.c2)
[1,2,3,4]
[1,2,3,4]
[1,2,3,4]
[1,2,3,4]
[2,3,4,6]
[2,3,4,6]
[2,3,4,6]
[2,3,4,6]
[7,1,5,9]
[7,1,5,9]
[7,1,5,9]
[7,1,5,9]
NULL
NULL
NULL
NULL
select * from v1 a,t1 b order by a.c1;
c1	c2	c3	c4	c1	c2	c3	c4
1	[1,2,3,4]	[1.2,2.3,6.9,-1.02]	["中文ing123","1"]	1	[1,2,3,4]	[1.2,2.3,6.9,-1.02,1.2,2.3,6.9,-1.02]	["中文ing123","1","1","中文ing123","1","1"]
1	[1,2,3,4]	[1.2,2.3,6.9,-1.02]	["中文ing123","1"]	2	[2,3,4,6]	[1.123,2.3126,2.3,-0.25,1.123,2.3126,2.3,-0.25]	[NULL,"a","sss",NULL,"a","sss"]
1	[1,2,3,4]	[1.2,2.3,6.9,-1.02]	["中文ing123","1"]	3	[7,1,5,9]	[0.12345,NULL,966.66,0.12345,NULL,966.66]	["null","a","sss","null","a","sss"]
1	[1,2,3,4]	[1.2,2.3,6.9,-1.02]	["中文ing123","1"]	4	NULL	NULL	NULL
2	[2,3,4,6]	[1.123,2.3126,2.3,-0.25]	[NULL,"a","sss"]	1	[1,2,3,4]	[1.2,2.3,6.9,-1.02,1.2,2.3,6.9,-1.02]	["中文ing123","1","1","中文ing123","1","1"]
2	[2,3,4,6]	[1.123,2.3126,2.3,-0.25]	[NULL,"a","sss"]	2	[2,3,4,6]	[1.123,2.3126,2.3,-0.25,1.123,2.3126,2.3,-0.25]	[NULL,"a","sss",NULL,"a","sss"]
2	[2,3,4,6]	[1.123,2.3126,2.3,-0.25]	[NULL,"a","sss"]	3	[7,1,5,9]	[0.12345,NULL,966.66,0.12345,NULL,966.66]	["null","a","sss","null","a","sss"]
2	[2,3,4,6]	[1.123,2.3126,2.3,-0.25]	[NULL,"a","sss"]	4	NULL	NULL	NULL
3	[7,1,5,9]	[NULL,0.12345,966.66]	["null","a","sss"]	1	[1,2,3,4]	[1.2,2.3,6.9,-1.02,1.2,2.3,6.9,-1.02]	["中文ing123","1","1","中文ing123","1","1"]
3	[7,1,5,9]	[NULL,0.12345,966.66]	["null","a","sss"]	2	[2,3,4,6]	[1.123,2.3126,2.3,-0.25,1.123,2.3126,2.3,-0.25]	[NULL,"a","sss",NULL,"a","sss"]
3	[7,1,5,9]	[NULL,0.12345,966.66]	["null","a","sss"]	3	[7,1,5,9]	[0.12345,NULL,966.66,0.12345,NULL,966.66]	["null","a","sss","null","a","sss"]
3	[7,1,5,9]	[NULL,0.12345,966.66]	["null","a","sss"]	4	NULL	NULL	NULL
4	NULL	NULL	NULL	1	[1,2,3,4]	[1.2,2.3,6.9,-1.02,1.2,2.3,6.9,-1.02]	["中文ing123","1","1","中文ing123","1","1"]
4	NULL	NULL	NULL	2	[2,3,4,6]	[1.123,2.3126,2.3,-0.25,1.123,2.3126,2.3,-0.25]	[NULL,"a","sss",NULL,"a","sss"]
4	NULL	NULL	NULL	3	[7,1,5,9]	[0.12345,NULL,966.66,0.12345,NULL,966.66]	["null","a","sss","null","a","sss"]
4	NULL	NULL	NULL	4	NULL	NULL	NULL
select * from t1,v1 where array_distinct(t1.c2)=array_distinct(v1.c2) order by t1.c1,v1.c1;
c1	c2	c3	c4	c1	c2	c3	c4
1	[1,2,3,4]	[1.2,2.3,6.9,-1.02,1.2,2.3,6.9,-1.02]	["中文ing123","1","1","中文ing123","1","1"]	1	[1,2,3,4]	[1.2,2.3,6.9,-1.02]	["中文ing123","1"]
2	[2,3,4,6]	[1.123,2.3126,2.3,-0.25,1.123,2.3126,2.3,-0.25]	[NULL,"a","sss",NULL,"a","sss"]	2	[2,3,4,6]	[1.123,2.3126,2.3,-0.25]	[NULL,"a","sss"]
3	[7,1,5,9]	[0.12345,NULL,966.66,0.12345,NULL,966.66]	["null","a","sss","null","a","sss"]	3	[7,1,5,9]	[NULL,0.12345,966.66]	["null","a","sss"]
select * from t1,v1 where array_distinct(t1.c2)<>array_distinct(v1.c2) order by t1.c1,v1.c1;
c1	c2	c3	c4	c1	c2	c3	c4
1	[1,2,3,4]	[1.2,2.3,6.9,-1.02,1.2,2.3,6.9,-1.02]	["中文ing123","1","1","中文ing123","1","1"]	2	[2,3,4,6]	[1.123,2.3126,2.3,-0.25]	[NULL,"a","sss"]
1	[1,2,3,4]	[1.2,2.3,6.9,-1.02,1.2,2.3,6.9,-1.02]	["中文ing123","1","1","中文ing123","1","1"]	3	[7,1,5,9]	[NULL,0.12345,966.66]	["null","a","sss"]
2	[2,3,4,6]	[1.123,2.3126,2.3,-0.25,1.123,2.3126,2.3,-0.25]	[NULL,"a","sss",NULL,"a","sss"]	1	[1,2,3,4]	[1.2,2.3,6.9,-1.02]	["中文ing123","1"]
2	[2,3,4,6]	[1.123,2.3126,2.3,-0.25,1.123,2.3126,2.3,-0.25]	[NULL,"a","sss",NULL,"a","sss"]	3	[7,1,5,9]	[NULL,0.12345,966.66]	["null","a","sss"]
3	[7,1,5,9]	[0.12345,NULL,966.66,0.12345,NULL,966.66]	["null","a","sss","null","a","sss"]	1	[1,2,3,4]	[1.2,2.3,6.9,-1.02]	["中文ing123","1"]
3	[7,1,5,9]	[0.12345,NULL,966.66,0.12345,NULL,966.66]	["null","a","sss","null","a","sss"]	2	[2,3,4,6]	[1.123,2.3126,2.3,-0.25]	[NULL,"a","sss"]
select * from t1 a,t1 b where array_distinct(a.c2)<>array_distinct(b.c2) order by a.c1,b.c1;
c1	c2	c3	c4	c1	c2	c3	c4
1	[1,2,3,4]	[1.2,2.3,6.9,-1.02,1.2,2.3,6.9,-1.02]	["中文ing123","1","1","中文ing123","1","1"]	2	[2,3,4,6]	[1.123,2.3126,2.3,-0.25,1.123,2.3126,2.3,-0.25]	[NULL,"a","sss",NULL,"a","sss"]
1	[1,2,3,4]	[1.2,2.3,6.9,-1.02,1.2,2.3,6.9,-1.02]	["中文ing123","1","1","中文ing123","1","1"]	3	[7,1,5,9]	[0.12345,NULL,966.66,0.12345,NULL,966.66]	["null","a","sss","null","a","sss"]
2	[2,3,4,6]	[1.123,2.3126,2.3,-0.25,1.123,2.3126,2.3,-0.25]	[NULL,"a","sss",NULL,"a","sss"]	1	[1,2,3,4]	[1.2,2.3,6.9,-1.02,1.2,2.3,6.9,-1.02]	["中文ing123","1","1","中文ing123","1","1"]
2	[2,3,4,6]	[1.123,2.3126,2.3,-0.25,1.123,2.3126,2.3,-0.25]	[NULL,"a","sss",NULL,"a","sss"]	3	[7,1,5,9]	[0.12345,NULL,966.66,0.12345,NULL,966.66]	["null","a","sss","null","a","sss"]
3	[7,1,5,9]	[0.12345,NULL,966.66,0.12345,NULL,966.66]	["null","a","sss","null","a","sss"]	1	[1,2,3,4]	[1.2,2.3,6.9,-1.02,1.2,2.3,6.9,-1.02]	["中文ing123","1","1","中文ing123","1","1"]
3	[7,1,5,9]	[0.12345,NULL,966.66,0.12345,NULL,966.66]	["null","a","sss","null","a","sss"]	2	[2,3,4,6]	[1.123,2.3126,2.3,-0.25,1.123,2.3126,2.3,-0.25]	[NULL,"a","sss",NULL,"a","sss"]
select * from t1 a,t1 b where array_distinct([a.c2])<>array_distinct([b.c2]) order by a.c1,b.c1;
c1	c2	c3	c4	c1	c2	c3	c4
1	[1,2,3,4]	[1.2,2.3,6.9,-1.02,1.2,2.3,6.9,-1.02]	["中文ing123","1","1","中文ing123","1","1"]	2	[2,3,4,6]	[1.123,2.3126,2.3,-0.25,1.123,2.3126,2.3,-0.25]	[NULL,"a","sss",NULL,"a","sss"]
1	[1,2,3,4]	[1.2,2.3,6.9,-1.02,1.2,2.3,6.9,-1.02]	["中文ing123","1","1","中文ing123","1","1"]	3	[7,1,5,9]	[0.12345,NULL,966.66,0.12345,NULL,966.66]	["null","a","sss","null","a","sss"]
1	[1,2,3,4]	[1.2,2.3,6.9,-1.02,1.2,2.3,6.9,-1.02]	["中文ing123","1","1","中文ing123","1","1"]	4	NULL	NULL	NULL
2	[2,3,4,6]	[1.123,2.3126,2.3,-0.25,1.123,2.3126,2.3,-0.25]	[NULL,"a","sss",NULL,"a","sss"]	1	[1,2,3,4]	[1.2,2.3,6.9,-1.02,1.2,2.3,6.9,-1.02]	["中文ing123","1","1","中文ing123","1","1"]
2	[2,3,4,6]	[1.123,2.3126,2.3,-0.25,1.123,2.3126,2.3,-0.25]	[NULL,"a","sss",NULL,"a","sss"]	3	[7,1,5,9]	[0.12345,NULL,966.66,0.12345,NULL,966.66]	["null","a","sss","null","a","sss"]
2	[2,3,4,6]	[1.123,2.3126,2.3,-0.25,1.123,2.3126,2.3,-0.25]	[NULL,"a","sss",NULL,"a","sss"]	4	NULL	NULL	NULL
3	[7,1,5,9]	[0.12345,NULL,966.66,0.12345,NULL,966.66]	["null","a","sss","null","a","sss"]	1	[1,2,3,4]	[1.2,2.3,6.9,-1.02,1.2,2.3,6.9,-1.02]	["中文ing123","1","1","中文ing123","1","1"]
3	[7,1,5,9]	[0.12345,NULL,966.66,0.12345,NULL,966.66]	["null","a","sss","null","a","sss"]	2	[2,3,4,6]	[1.123,2.3126,2.3,-0.25,1.123,2.3126,2.3,-0.25]	[NULL,"a","sss",NULL,"a","sss"]
3	[7,1,5,9]	[0.12345,NULL,966.66,0.12345,NULL,966.66]	["null","a","sss","null","a","sss"]	4	NULL	NULL	NULL
4	NULL	NULL	NULL	1	[1,2,3,4]	[1.2,2.3,6.9,-1.02,1.2,2.3,6.9,-1.02]	["中文ing123","1","1","中文ing123","1","1"]
4	NULL	NULL	NULL	2	[2,3,4,6]	[1.123,2.3126,2.3,-0.25,1.123,2.3126,2.3,-0.25]	[NULL,"a","sss",NULL,"a","sss"]
4	NULL	NULL	NULL	3	[7,1,5,9]	[0.12345,NULL,966.66,0.12345,NULL,966.66]	["null","a","sss","null","a","sss"]
select * from t1 a,v1 b,t1 c where array_distinct(a.c2)=array_distinct(b.c2) and array_distinct(a.c2)=array_distinct(c.c2) order by a.c1,b.c1;
c1	c2	c3	c4	c1	c2	c3	c4	c1	c2	c3	c4
1	[1,2,3,4]	[1.2,2.3,6.9,-1.02,1.2,2.3,6.9,-1.02]	["中文ing123","1","1","中文ing123","1","1"]	1	[1,2,3,4]	[1.2,2.3,6.9,-1.02]	["中文ing123","1"]	1	[1,2,3,4]	[1.2,2.3,6.9,-1.02,1.2,2.3,6.9,-1.02]	["中文ing123","1","1","中文ing123","1","1"]
2	[2,3,4,6]	[1.123,2.3126,2.3,-0.25,1.123,2.3126,2.3,-0.25]	[NULL,"a","sss",NULL,"a","sss"]	2	[2,3,4,6]	[1.123,2.3126,2.3,-0.25]	[NULL,"a","sss"]	2	[2,3,4,6]	[1.123,2.3126,2.3,-0.25,1.123,2.3126,2.3,-0.25]	[NULL,"a","sss",NULL,"a","sss"]
3	[7,1,5,9]	[0.12345,NULL,966.66,0.12345,NULL,966.66]	["null","a","sss","null","a","sss"]	3	[7,1,5,9]	[NULL,0.12345,966.66]	["null","a","sss"]	3	[7,1,5,9]	[0.12345,NULL,966.66,0.12345,NULL,966.66]	["null","a","sss","null","a","sss"]
drop table if exists t1;
CREATE TABLE t1 (c1 int primary key, c2 vector(8),c3 float[],c4 varchar(256)[]);
insert into t1 values(1,[1,2,3,4,1,2,3,4],[1.2,2.3,6.9,-1.02,1.2,2.3,6.9,-1.02],['中文ing123',1,'1','中文ing123',1,'1']);
insert into t1 values(2,[2,3,4,6,2,3,4,6],[1.123,2.3126,2.30,-0.25,1.123,2.3126,2.30,-0.25],[null,'a','sss',null,'a','sss']);
insert into t1 values(3,[7,1,5,9,7,1,5,9],[0.12345,null,966.66,0.12345,null,966.66],['null','a','sss','null','a','sss']);
insert into t1 values(4,null,null,null);
drop materialized view if exists mv1;
create materialized view mv1(primary key(c1))  as select c1, array_distinct(c2) c2,array_distinct(c3) c3,array_distinct(c4) c4 from t1;
select array_distinct(a.c2) from mv1 a,t1 b order by a.c1,b.c1;
array_distinct(a.c2)
[1,2,3,4]
[1,2,3,4]
[1,2,3,4]
[1,2,3,4]
[2,3,4,6]
[2,3,4,6]
[2,3,4,6]
[2,3,4,6]
[7,1,5,9]
[7,1,5,9]
[7,1,5,9]
[7,1,5,9]
NULL
NULL
NULL
NULL
select /*+ ENABLE_PARALLEL_DML PARALLEL(3) */a.c2 from mv1 a,t1 b order by a.c1,b.c1;
c2
[1,2,3,4]
[1,2,3,4]
[1,2,3,4]
[1,2,3,4]
[2,3,4,6]
[2,3,4,6]
[2,3,4,6]
[2,3,4,6]
[7,1,5,9]
[7,1,5,9]
[7,1,5,9]
[7,1,5,9]
NULL
NULL
NULL
NULL
select /*+ ENABLE_PARALLEL_DML PARALLEL(3) */array_distinct(a.c2) from mv1 a,t1 b order by a.c1,b.c1;
array_distinct(a.c2)
[1,2,3,4]
[1,2,3,4]
[1,2,3,4]
[1,2,3,4]
[2,3,4,6]
[2,3,4,6]
[2,3,4,6]
[2,3,4,6]
[7,1,5,9]
[7,1,5,9]
[7,1,5,9]
[7,1,5,9]
NULL
NULL
NULL
NULL
select count(*) from mv1 a,t1 b order by a.c1;
count(*)
16
select count(*) from mv1 a,t1 b,mv1 c order by a.c1;
count(*)
64
select count(*) from mv1 a,t1 b,mv1 c order by a.c1;
count(*)
64
select count(*) from mv1 a,t1 b order by a.c1;
count(*)
16
select count(array_distinct(a.c2)) from mv1 a,t1 b,mv1 c order by a.c1;
count(array_distinct(a.c2))
48
select count(*) from mv1 a,t1 b,mv1 c order by a.c1;
count(*)
64
select count(*) from mv1 a,t1 b order by a.c1;
count(*)
16
select /*+ OPT_PARAM('enable_rich_vector_format', 'FALSE') */ count(*) from mv1 a,t1 b order by a.c1;
count(*)
16
select /*+ OPT_PARAM('rowsets_enabled', 'FALSE') */count(*) from mv1 a,t1 b order by a.c1;
count(*)
16
drop materialized view if exists mv1;
create materialized view mv1(primary key(c1))  as select * from t1;
select count(*) from mv1 a,t1 b order by a.c1;
count(*)
16
drop table if exists t1;
CREATE TABLE t1 (c1 int primary key, c2 vector(4),c3 float[],c4 varchar(256)[]);
insert into t1 values(1,[1,2,3,4],[1.2,2.3,6.9,-1.02],['中文ing123',1,'1']);
insert into t1 values(2,[2,3,4,6],[1.123,2.3126,2.30,-0.25],[null,'a','sss']);
insert into t1 values(3,[7,1,5,9],[0.12345,null,966.66],['null','a','sss']);
insert into t1 values(4,null,null,null);
drop materialized view if exists mv1;
create materialized view mv1(primary key(c1))  as select c1, array_distinct(c2) c2,array_distinct(c3) c3,array_distinct(c4) c4 from t1;
replace into t1 select c1,c2,c3,c4 from mv1;
drop view if exists v1;
create view v1 as  select c1, array_distinct(c2) c2,array_distinct(c3) c3,array_distinct(c4) c4 from t1;
replace into t1 select c1,c2,c3,c4 from v1;
select count(*) from t1 a,mv1 b,v1 c order by a.c1;
count(*)
64
select /*+ ENABLE_PARALLEL_DML PARALLEL(3) */count(*) from t1 a,mv1 b,v1 c order by a.c1;
count(*)
64
drop table if exists t1;
CREATE TABLE t1 (c1 int primary key, c2 vector(8),c3 float[],c4 varchar(256)[]);
insert into t1 values(1,[1,2,3,4,1,2,3,4],[1.2,2.3,6.9,-1.02,1.2,2.3,6.9,-1.02],['中文ing123',1,'1','中文ing123',1,'1']);
insert into t1 values(2,[2,3,4,6,2,3,4,6],[1.123,2.3126,2.30,-0.25,1.123,2.3126,2.30,-0.25],[null,'a','sss',null,'a','sss']);
insert into t1 values(3,[7,1,5,9,7,1,5,9],[0.12345,null,966.66,0.12345,null,966.66],['null','a','sss','null','a','sss']);
insert into t1 values(4,null,null,null);
drop materialized view if exists mv1;
create materialized view mv1  as select c1,array_distinct(c2) c2  from t1 ;
call DBMS_MVIEW.REFRESH('mv1','c');
select array_distinct(c2) from mv1 order by c1;
array_distinct(c2)
[1,2,3,4]
[2,3,4,6]
[7,1,5,9]
NULL
drop materialized view if exists mv1;
create materialized view mv1  as select c1,array_distinct(c2) * array_distinct(c2) c2 from t1 ;
select array_distinct(c2) from mv1 order by c1;
array_distinct(c2)
[1,4,9,16]
[4,9,16,36]
[49,1,25,81]
NULL
drop materialized view if exists mv1;
create materialized view mv1  as select a.c1,array_distinct(b.c2) c2 from t1 a,t1 b where a.c2=b.c2;
select array_distinct(c2) from mv1 order by c1;
array_distinct(c2)
[1,2,3,4]
[2,3,4,6]
[7,1,5,9]
drop table if exists t1;
CREATE TABLE t1 (c1 int primary key, c2 vector(4),c3 float[],c4 varchar(256)[]);
insert into t1 values(1,[1,2,3,4],[1.2,2.3,6.9,-1.02],['中文ing123',1,'1']);
insert into t1 values(2,[2,3,4,6],[1.123,2.3126,2.30,-0.25],[null,'a','sss']);
insert into t1 values(3,[7,1,5,9],[0.12345,null,966.66],['null','a','sss']);
insert into t1 values(4,null,null,null);
select count(*) from t1 a,t1 b,t1 c ;
count(*)
64
select count(array_distinct(a.c2)) from t1 a,t1 b,t1 c order by a.c1;
count(array_distinct(a.c2))
48
select count(array_distinct(a.c3)) from t1 a,t1 b,t1 c order by a.c1;
count(array_distinct(a.c3))
48
select count(array_distinct(a.c4)) from t1 a,t1 b,t1 c order by a.c1;
count(array_distinct(a.c4))
48
select count(array_distinct(a.c2)) from t1 a,t1 b,t1 c where array_distinct(a.c2)=array_distinct(b.c2) and array_distinct(a.c2)=array_distinct(c.c2) order by a.c1;
count(array_distinct(a.c2))
3
select count(array_distinct(a.c3)) from t1 a,t1 b,t1 c where array_distinct(a.c3)=array_distinct(b.c3) and array_distinct(a.c3)=array_distinct(c.c3) order by a.c1;
count(array_distinct(a.c3))
3
select count(array_distinct(a.c4)) from t1 a,t1 b,t1 c where array_distinct(a.c4)=array_distinct(b.c4) and array_distinct(a.c4)=array_distinct(c.c4) order by a.c1;
count(array_distinct(a.c4))
3
drop table if exists t1;
CREATE TABLE t1 (c1 int primary key, c2 vector(4),c3 float[],c4 varchar(256)[]);
insert into t1 values(1,[1,2,3,4],[1.2,2.3,6.9,-1.02],['中文ing123',1,'1']);
insert into t1 values(2,[2,3,4,6],[1.123,2.3126,2.30,-0.25],[null,'a','sss']);
insert into t1 values(3,[7,1,5,9],[0.12345,null,966.66],['null','a','sss']);
insert into t1 values(4,null,null,null);
select c1,c2,count(c2),array_distinct(c2) from t1 group by array_distinct([1,2,3,4,5,6,1,2,312,14]) order by c1;
c1	c2	count(c2)	array_distinct(c2)
1	[1,2,3,4]	3	[1,2,3,4]
select * from t1 group by c1 having array_distinct([1,2,3,4,5,6])  order by c1;
ERROR 22000: Invalid data type for the operation
select c1,c3,c4 from t1 group by c1 having array_distinct([c4])  order by c1;
ERROR 22000: Invalid data type for the operation
select c1,c3,c4 from t1 group by c1 having array_distinct(c3)  order by c1;
ERROR 22000: Invalid data type for the operation
drop table if exists t1;
CREATE TABLE t1 (c1 int primary key, c2 int[],c3 float[],c4 varchar(256)[]);
insert into t1 values(1,[1,2,3,4],[1.2,2.3,6.9,-1.02],['中文ing123',1,'1']);
insert into t1 values(2,[2,3,4,6],[1.123,2.3126,2.30,-0.25],[null,'a','sss']);
insert into t1 values(3,[7,1,5,9],[0.12345,null,966.66],['null','a','sss']);
insert into t1 values(4,[2,3,2,5],[2,3,3,5],[2,3,4,5]);
insert into t1 values(5,null,null,null);
select c1,(select array_distinct(t1.c4) from t1 order by c1 limit 1) from t1 order by c1;
c1	(select array_distinct(t1.c4) from t1 order by c1 limit 1)
1	["中文ing123","1"]
2	["中文ing123","1"]
3	["中文ing123","1"]
4	["中文ing123","1"]
5	["中文ing123","1"]
select c1 from (select c1,array_distinct(c2+c3) c2 from t1 order by c1 limit 1) a order by a.c1;
c1
1
select array_distinct(c2)  from (select c1,array_distinct([c2]) c2 from t1 order by c1 limit 1) a order by a.c1;
array_distinct(c2)
[[1,2,3,4]]
select array_distinct(t1.c2) from t1,(select c1,array_distinct([c2]) c2 from t1 order by c1 limit 1) a where a.c1=t1.c1 order by a.c1;
array_distinct(t1.c2)
[1,2,3,4]
drop table if exists t1;
CREATE TABLE t1 (c1 int primary key, c2 int[],c3 float[],c4 varchar(256)[]);
insert into t1 values(1,[1,false],[1.123,null,96666],['中文ing123',1,'1']);
insert into t1 values(2,[0,0,99999,null],[0.12345,null,966.66],[null,'a','sss']);
insert into t1 values(3,[0,0,99999,null],[0.12345,null,966.66],['null','a','sss']);
insert into t1 values(4,[2,3,2,5],[2,3,3,5],[2,3,4,5]);
select * from t1 order by array_distinct(null),1,2,3;
c1	c2	c3	c4
1	[1,0]	[1.123,NULL,96666]	["中文ing123","1","1"]
2	[0,0,99999,NULL]	[0.12345,NULL,966.66]	[NULL,"a","sss"]
3	[0,0,99999,NULL]	[0.12345,NULL,966.66]	["null","a","sss"]
4	[2,3,2,5]	[2,3,3,5]	["2","3","4","5"]
select * from t1 order by array_distinct([c2]);
ERROR 22000: Invalid data type for the operation
select * from t1 order by array_distinct(c2);
ERROR 22000: Invalid data type for the operation
select * from t1 order by array_distinct(c3);
ERROR 22000: Invalid data type for the operation
select * from t1 order by array_distinct(c4);
ERROR 22000: Invalid data type for the operation
select * from t1 order by array_distinct(c2) desc ;
ERROR 22000: Invalid data type for the operation
select * from t1 order by array_distinct(c3) desc;
ERROR 22000: Invalid data type for the operation
select * from t1 order by array_distinct(c4) desc;
ERROR 22000: Invalid data type for the operation
select * from t1 order by array_distinct(c2) asc ;
ERROR 22000: Invalid data type for the operation
select * from t1 order by array_distinct(c3) asc;
ERROR 22000: Invalid data type for the operation
select * from t1 order by array_distinct(c4) asc;
ERROR 22000: Invalid data type for the operation
drop table if exists t1;
CREATE TABLE t1 (c1 int primary key, c2 int[],c3 float[],c4 varchar(256)[]);
insert into t1 values(1,[1,2,3,5],[2.123,2.123,3.123,4.123],['中文ing123',1,'1']);
insert into t1 values(2,[2,3,4,4],[2.123,2.123,3.123,4.123],[null,'a','sss']);
insert into t1 values(3,[3,3,3,3],[3.123,2.123,3.123,4.123],['null','a','sss']);
insert into t1 values(4,[2,3,4,5],[4.123,2.123,3.123,4.123],[2,3,4,5]);
insert into t1 values(5,null,null,null);
select array_distinct(c2+c2) from t1 order by c1;
array_distinct(c2+c2)
[2,4,6,10]
[4,6,8]
[6]
[4,6,8,10]
NULL
select array_distinct(c3+c2) from t1 order by c1;
array_distinct(c3+c2)
[3.122999906539917,4.122999906539917,6.122999906539917,9.123000144958496]
[4.122999906539917,5.122999906539917,7.122999906539917,8.123000144958496]
[6.122999906539917,5.122999906539917,7.123000144958496]
[6.123000144958496,5.122999906539917,7.122999906539917,9.123000144958496]
NULL
select array_distinct(c4+c2) from t1 order by c1;
ERROR HY000: Invalid argument
select array_distinct(c2) + array_distinct(c2) from t1 order by c1;
array_distinct(c2) + array_distinct(c2)
[2,4,6,10]
[4,6,8]
[6]
[4,6,8,10]
NULL
select array_distinct(c2) - array_distinct(c2) from t1 order by c1;
array_distinct(c2) - array_distinct(c2)
[0,0,0,0]
[0,0,0]
[0]
[0,0,0,0]
NULL
select array_distinct(c2) * array_distinct(c2) from t1 order by c1;
array_distinct(c2) * array_distinct(c2)
[1,4,9,25]
[4,9,16]
[9]
[4,9,16,25]
NULL
select array_distinct(c2) / array_distinct(c2) from t1 order by c1;
ERROR 22000: Invalid data type for the operation
select array_distinct(c2) + array_distinct(c2) - array_distinct(c3) from t1 order by c1;
ERROR 22000: array type mismatch found between definition and data
select array_distinct(c2) - array_distinct(c2) - array_distinct(c3) from t1 order by c1;
ERROR 22000: array type mismatch found between definition and data
select array_distinct(c2) * array_distinct(c2) - array_distinct(c3) from t1 order by c1;
ERROR 22000: array type mismatch found between definition and data
select array_distinct(c2) / array_distinct(c2) - array_distinct(c3) from t1 order by c1;
ERROR 22000: Invalid data type for the operation
select array_distinct(c2) + array_distinct(c2) / array_distinct(c3) from t1 order by c1;
ERROR 22000: Invalid data type for the operation
select array_distinct(c2) - array_distinct(c2) * array_distinct(c3) from t1 order by c1;
ERROR 22000: Invalid dimension for vector.
select array_distinct(c2) * array_distinct(c2) - array_distinct(c3) from t1 order by c1;
ERROR 22000: array type mismatch found between definition and data
select array_distinct(c2) / array_distinct(c2) + array_distinct(c3) from t1 order by c1;
ERROR 22000: Invalid data type for the operation
drop table if exists t1;
CREATE TABLE t1 (c1 int primary key, c2 int[],c3 float[],c4 varchar(256)[]);
insert into t1 values(1,[1,2,3,5],[2.123,2.123,3.123,4.123],['中文ing123',1,'1']);
insert into t1 values(2,[2,3,4,4],[2.123,2.123,3.123,4.123],[null,'a','sss']);
insert into t1 values(3,[3,3,3,3],[3.123,2.123,3.123,4.123],['null','a','sss']);
insert into t1 values(4,[2,3,4,5],[4.123,2.123,3.123,4.123],[2,3,4,5]);
insert into t1 values(5,null,null,null);
select array_distinct(cast(c2 as json)) from t1 order by c1;
ERROR 22000: Invalid data type for the operation
select array_distinct(cast(c2 as date)) from t1 order by c1;
ERROR 22000: Invalid data type for the operation
select array_distinct(cast(c2 as TIME)) from t1 order by c1;
ERROR 22000: Invalid data type for the operation
select array_distinct(cast(c2 as DATETIME(4))) from t1 order by c1;
ERROR 22000: Invalid data type for the operation
select array_distinct(cast(c2 as DECIMAL(10,2))) from t1 order by c1;
ERROR 22000: Invalid data type for the operation
select array_distinct(cast(c2 as char(20))) from t1 order by c1;
ERROR 22000: Invalid data type for the operation
select array_distinct(cast(c2 as UNSIGNED)) from t1 order by c1;
ERROR 22000: Invalid data type for the operation
select array_distinct(cast(c2 AS CHAR CHARACTER SET gbk)) from t1 order by c1;
ERROR 22000: Invalid data type for the operation
drop table if exists t1;
CREATE TABLE t1 (c1 int primary key, c2 int[],c3 float[],c4 varchar(256)[]);
insert into t1 values(1,[1,2,3,5],[2.123,2.123,3.123,4.123],['中文ing123',1,'1']);
insert into t1 values(2,[2,3,4,4],[2.123,2.123,3.123,4.123],[null,'a','sss']);
insert into t1 values(3,[3,3,3,3],[3.123,2.123,3.123,4.123],['null','a','sss']);
insert into t1 values(4,[2,3,4,5],[4.123,2.123,3.123,4.123],[2,3,4,5]);
insert into t1 values(5,null,null,null);
select  distinct array_distinct(c4) from t1 order by c1;
ERROR 22000: Invalid data type for the operation
select  array_distinct((select distinct array_distinct(c2) from t1 order by c1 limit 1)) from t1 order by c1;
ERROR 22000: Invalid data type for the operation
select  array_distinct(distinct c2) from t1 order by c1;
ERROR 42000: You have an error in your SQL syntax; check the manual that corresponds to your OceanBase version for the right syntax to use near 'distinct c2) from t1 order by c1' at line 1
select  array_distinct((select c2 from t1 order by c1 limit 1)) from t1 order by c1;
array_distinct((select c2 from t1 order by c1 limit 1))
[1,2,3,5]
[1,2,3,5]
[1,2,3,5]
[1,2,3,5]
[1,2,3,5]
select  array_distinct((select [c4] from t1 order by c1 limit 1)) from t1 order by c1;
array_distinct((select [c4] from t1 order by c1 limit 1))
[["中文ing123","1","1"]]
[["中文ing123","1","1"]]
[["中文ing123","1","1"]]
[["中文ing123","1","1"]]
[["中文ing123","1","1"]]
select  array_distinct((select [[c4]] from t1 order by c1 limit 1)) from t1 order by c1;
array_distinct((select [[c4]] from t1 order by c1 limit 1))
[[["中文ing123","1","1"]]]
[[["中文ing123","1","1"]]]
[[["中文ing123","1","1"]]]
[[["中文ing123","1","1"]]]
[[["中文ing123","1","1"]]]
drop table if exists t1;
CREATE TABLE t1 (c1 int primary key, c2 int[],c3 float[],c4 varchar(256)[]);
insert into t1 values(1,[1,2,3,5],[2.123,2.123,3.123,4.123],['中文ing123',1,'1']);
insert into t1 values(2,[2,3,4,4],[2.123,2.123,3.123,4.123],[null,'a','sss']);
insert into t1 values(3,[3,3,3,3],[3.123,2.123,3.123,4.123],['null','a','sss']);
insert into t1 values(4,[2,3,4,5],[4.123,2.123,3.123,4.123],[2,3,4,5]);
insert into t1 values(5,null,null,null);
select array_distinct(max(c2)) from t1 order by c1;
ERROR HY000: Invalid argument
select array_distinct(min(c2)) from t1 order by c1;
ERROR HY000: Invalid argument
select array_distinct(avg(c2)) from t1 order by c1;
ERROR 0A000: Not supported feature or function
select array_distinct(count(c2)) from t1 order by c1;
ERROR 22000: Invalid data type for the operation
select array_distinct(sum(c2)) from t1 order by c1;
ERROR 0A000: Not supported feature or function
select max(array_distinct(c2)) from t1 order by c1;
ERROR HY000: Invalid argument
select min(array_distinct(c2)) from t1 order by c1;
ERROR HY000: Invalid argument
select count(array_distinct(c2)) from t1 order by c1;
count(array_distinct(c2))
4
select avg(array_distinct(c2)) from t1 order by c1;
ERROR 0A000: Not supported feature or function
select sum(array_distinct(c2)) from t1 order by c1;
ERROR 0A000: Not supported feature or function
select max(array_distinct(c3)) from t1 order by c1;
ERROR HY000: Invalid argument
select min(array_distinct(c3)) from t1 order by c1;
ERROR HY000: Invalid argument
select count(array_distinct(c3)) from t1 order by c1;
count(array_distinct(c3))
4
select avg(array_distinct(c3)) from t1 order by c1;
ERROR 0A000: Not supported feature or function
select sum(array_distinct(c3)) from t1 order by c1;
ERROR 0A000: Not supported feature or function
select max(array_distinct(c3)) + min(array_distinct(c3)) from t1 order by c1;
ERROR HY000: Invalid argument
drop table if exists t1;
CREATE TABLE t1 (c1 int primary key, c2 vector(8),c3 float[],c4 varchar(256)[]);
insert into t1 values(1,[1,2,3,4,1,2,3,4],[1.2,2.3,6.9,-1.02,1.2,2.3,6.9,-1.02],['中文ing123',1,'1','中文ing123',1,'1']);
insert into t1 values(2,[2,3,4,6,2,3,4,6],[1.123,2.3126,2.30,-0.25,1.123,2.3126,2.30,-0.25],[null,'a','sss',null,'a','sss']);
insert into t1 values(3,[7,1,5,9,7,1,5,9],[0.12345,null,966.66,0.12345,null,966.66],['null','a','sss','null','a','sss']);
insert into t1 values(4,null,null,null);
drop table if exists t2;
create table t2 like t1;
replace into t2 select * from t1;
select array_map((x) -> (x), [(select array_distinct(c2) from t1 order by c1 limit 1)]);
array_map((x) -> (x), [(select array_distinct(c2) from t1 order by c1 limit 1)])
[[1,2,3,4]]
select array_map((x) -> (x), [(select array_distinct(c3) from t1 order by c1 limit 1)]);
array_map((x) -> (x), [(select array_distinct(c3) from t1 order by c1 limit 1)])
[[1.2,2.3,6.9,-1.02]]
select array_map((x) -> (x), [(select array_distinct(c4) from t1 order by c1 limit 1)]);
array_map((x) -> (x), [(select array_distinct(c4) from t1 order by c1 limit 1)])
[["中文ing123","1"]]
with ct1 as(
select array_distinct(c2) from t1 order by c1)
select array_distinct(c2) from t1 where c3 is not null order by c1 ;
array_distinct(c2)
[1,2,3,4]
[2,3,4,6]
[7,1,5,9]
with ct1 as(
select  array_distinct(t1.c4) from t1 order by c1)
select  t1.c1,t2.c2,array_distinct(t1.c4) from t1 join t2 on array_distinct(t1.c4)=array_distinct(t2.c4) order by t1.c1,t1.c2;
c1	c2	array_distinct(t1.c4)
1	[1,2,3,4,1,2,3,4]	["中文ing123","1"]
2	[2,3,4,6,2,3,4,6]	[NULL,"a","sss"]
3	[7,1,5,9,7,1,5,9]	["null","a","sss"]
with ct1 as(
select  array_distinct(t1.c4) from t1 order by c1)
select  t1.c1,t2.c2,array_distinct(t1.c4) from t1 join t2 on array_distinct(t1.c4)<>array_distinct(t2.c4) order by t1.c1,t1.c2;
c1	c2	array_distinct(t1.c4)
1	[2,3,4,6,2,3,4,6]	["中文ing123","1"]
1	[7,1,5,9,7,1,5,9]	["中文ing123","1"]
2	[1,2,3,4,1,2,3,4]	[NULL,"a","sss"]
2	[7,1,5,9,7,1,5,9]	[NULL,"a","sss"]
3	[1,2,3,4,1,2,3,4]	["null","a","sss"]
3	[2,3,4,6,2,3,4,6]	["null","a","sss"]
SELECT count(c4), CASE WHEN array_distinct(t1.c4)=['中文ing123',1,'1'] THEN [1,2,3] ELSE [2,3,4] END AS A FROM T1;
count(c4)	A
3	[2,3,4]
SELECT count(c1), CASE WHEN array_distinct(t1.c4)=['中文ing123',1,'1'] THEN array_distinct(t1.c4) ELSE array_distinct(t1.c3) END AS A FROM T1;
count(c1)	A
4	["1.2","2.3","6.9","-1.02"]
drop table if exists t1;
CREATE TABLE t1 (c1 int primary key, c2 int[],c3 float[],c4 varchar(256)[]);
insert into t1 values(1,[1,2,3,5],[2.123,2.123,3.123,4.123],['中文ing123',1,'1']);
insert into t1 values(2,[2,3,4,4],[2.123,2.123,3.123,4.123],[null,'a','sss']);
insert into t1 values(3,[3,3,3,3],[3.123,2.123,3.123,4.123],['null','a','sss']);
insert into t1 values(4,[2,3,4,5],[4.123,2.123,3.123,4.123],[2,3,4,5]);
insert into t1 values(5,null,null,null);
drop table if exists t2;
create table t2 like t1;
replace into t2 select * from t1;
select * from t1 limit array_distinct(c2);
ERROR 42000: You have an error in your SQL syntax; check the manual that corresponds to your OceanBase version for the right syntax to use near 'array_distinct(c2)' at line 1
select array_distinct(c2)  from t1 order by c1 limit 10000000000000000000;
array_distinct(c2)
[1,2,3,5]
[2,3,4]
[3]
[2,3,4,5]
NULL
select array_distinct([c2])  from t1 order by c1 limit 10000000000000000000;
array_distinct([c2])
[[1,2,3,5]]
[[2,3,4,4]]
[[3,3,3,3]]
[[2,3,4,5]]
[NULL]
drop table if exists t1;
CREATE TABLE t1 (c1 int primary key, c2 int[],c3 float[],c4 varchar(256)[]);
insert into t1 values(1,[1,2,3,5],[2.123,2.123,3.123,4.123],['中文ing123',1,'1']);
insert into t1 values(2,[2,3,4,4],[2.123,2.123,3.123,4.123],[null,'a','sss']);
insert into t1 values(3,[3,3,3,3],[3.123,2.123,3.123,4.123],['null','a','sss']);
insert into t1 values(4,[2,3,4,5],[4.123,2.123,3.123,4.123],[2,3,4,5]);
insert into t1 values(5,null,null,null);
drop table if exists t2;
create table t2 like t1;
replace into t2 select * from t1;
select c1,c2,c3,c4,array_distinct(c4) from t1 where array_distinct(c4) = ['中文ing123',1] ;
c1	c2	c3	c4	array_distinct(c4)
1	[1,2,3,5]	[2.123,2.123,3.123,4.123]	["中文ing123","1","1"]	["中文ing123","1"]
select c1,c2,c3,c4,array_distinct(c4) from t1 where array_distinct(c4) = ['中文ing123',1] for update;
c1	c2	c3	c4	array_distinct(c4)
1	[1,2,3,5]	[2.123,2.123,3.123,4.123]	["中文ing123","1","1"]	["中文ing123","1"]
select c1,c2,c3,c4,array_distinct(c4) from t1 where array_distinct([c4]) = [['中文ing123',1,'1']] ;
c1	c2	c3	c4	array_distinct(c4)
1	[1,2,3,5]	[2.123,2.123,3.123,4.123]	["中文ing123","1","1"]	["中文ing123","1"]
select c1,c2,c3,c4,array_distinct(c4) from t1 where array_distinct([c4]) = [['中文ing123',1,'1']] for update;
c1	c2	c3	c4	array_distinct(c4)
1	[1,2,3,5]	[2.123,2.123,3.123,4.123]	["中文ing123","1","1"]	["中文ing123","1"]
select /*+ ENABLE_PARALLEL_DML PARALLEL(3) */c1,c2,c3,c4,array_distinct(c4) from t1 where array_distinct([c4]) = [['中文ing123',1,'1']] for update;
c1	c2	c3	c4	array_distinct(c4)
1	[1,2,3,5]	[2.123,2.123,3.123,4.123]	["中文ing123","1","1"]	["中文ing123","1"]
drop table if exists t1;
CREATE TABLE t1 (c1 int primary key, c2 int[],c3 float[],c4 varchar(256)[]);
insert into t1 values(1,[1,2,3,5],[2.123,2.123,3.123,4.123],['中文ing123',1,'1']);
insert into t1 values(2,[2,3,4,4],[2.123,2.123,3.123,4.123],[null,'a','sss']);
insert into t1 values(3,[3,3,3,3],[3.123,2.123,3.123,4.123],['null','a','sss']);
insert into t1 values(4,[2,3,4,5],[4.123,2.123,3.123,4.123],[2,3,4,5]);
insert into t1 values(5,null,null,null);
drop table if exists t2;
create table t2 like t1;
replace into t2 select * from t1;
select array_distinct(c4) a   from t1 order by t1.c1  ;
a
["中文ing123","1"]
[NULL,"a","sss"]
["null","a","sss"]
["2","3","4","5"]
NULL
select /*+ ENABLE_PARALLEL_DML PARALLEL(3) */array_distinct(c4)  a from t1 order by t1.c1;
a
["中文ing123","1"]
[NULL,"a","sss"]
["null","a","sss"]
["2","3","4","5"]
NULL
select array_distinct(c4) x ,array_distinct(c4) x, array_distinct(c4) x from t1 order by t1.c1  ;
x	x	x
["中文ing123","1"]	["中文ing123","1"]	["中文ing123","1"]
[NULL,"a","sss"]	[NULL,"a","sss"]	[NULL,"a","sss"]
["null","a","sss"]	["null","a","sss"]	["null","a","sss"]
["2","3","4","5"]	["2","3","4","5"]	["2","3","4","5"]
NULL	NULL	NULL
select array_distinct(c4) 中文中文中文中文中文中文,array_distinct(c4) 中文中文中文中文中文中文 from t1 order by t1.c1  ;
中文中文中文中文中文中文	中文中文中文中文中文中文
["中文ing123","1"]	["中文ing123","1"]
[NULL,"a","sss"]	[NULL,"a","sss"]
["null","a","sss"]	["null","a","sss"]
["2","3","4","5"]	["2","3","4","5"]
NULL	NULL
drop table if exists t1;
CREATE TABLE t1 (c1 int primary key, c2 int[],c3 float[],c4 varchar(256)[]);
insert into t1 values(1,[1,2,3,5],[2.123,2.123,3.123,4.123],['中文ing123',1,'1']);
insert into t1 values(2,[2,3,4,4],[2.123,2.123,3.123,4.123],[null,'a','sss']);
insert into t1 values(3,[3,3,3,3],[3.123,2.123,3.123,4.123],['null','a','sss']);
insert into t1 values(4,[2,3,4,5],[4.123,2.123,3.123,4.123],[2,3,4,5]);
insert into t1 values(5,null,null,null);
drop table if exists t2;
create table t2 like t1;
replace into t2 select * from t1;
SELECT avg(C1) OVER (PARTITION BY array_distinct(c4)) FROM T1  order by c1;
ERROR 22000: Invalid data type for the operation
SELECT sum(C1) OVER (PARTITION BY array_distinct(c4)) FROM T1  order by c1;
ERROR 22000: Invalid data type for the operation
SELECT count(C1) OVER (PARTITION BY array_distinct(c4)) FROM T1  order by c1;
ERROR 22000: Invalid data type for the operation
SELECT min(C1) OVER (PARTITION BY array_distinct(c4)) FROM T1 order by c1 ;
ERROR 22000: Invalid data type for the operation
SELECT max(C1) OVER (PARTITION BY array_distinct(c4)) FROM T1  order by c1;
ERROR 22000: Invalid data type for the operation
drop table if exists t1;
CREATE TABLE t1 (c1 int primary key, c2 int[],c3 float[],c4 varchar(256)[][]);
insert into t1 values(1,[1,2,3,5],[2.123,2.123,3.123,4.123],[['中文ing123',1,'1']]);
insert into t1 values(2,[2,3,4,4],[2.123,2.123,3.123,4.123],[[null,'a','sss']]);
insert into t1 values(3,[3,3,3,3],[3.123,2.123,3.123,4.123],[['null','a','sss']]);
insert into t1 values(4,[2,3,4,5],[4.123,2.123,3.123,4.123],[[2,3,4,5]]);
insert into t1 values(5,null,null,null);
update t1 set c1=38 where array_distinct(c2)=[3];
update t1 set c1=10 where array_distinct(c2) is null;
update t1 set c4=(select array_distinct(c4) from t1 order by c1 limit 1) where c1 =10;
truncate table t1;
select * from t1 order by c1;
c1	c2	c3	c4
drop table if exists t1;
CREATE TABLE t1 (c1 int primary key, c2 int[],c3 float[],c4 varchar(256)[][]);
insert into t1 values(1,[1,2,3,5],[2.123,2.123,3.123,4.123],[['中文ing123',1,'1']]);
insert into t1 values(2,[2,3,4,4],[2.123,2.123,3.123,4.123],[[null,'a','sss']]);
insert into t1 values(3,[3,3,3,3],[3.123,2.123,3.123,4.123],[['null','a','sss']]);
insert into t1 values(4,[2,3,4,5],[4.123,2.123,3.123,4.123],[[2,3,4,5]]);
insert into t1 values(5,null,null,null);
update /*+enable_parallel_dml parallel(2) */t1 set c1=38 where array_distinct(c2)=[3];
update /*+enable_parallel_dml parallel(2) */t1 set c1=10 where array_distinct(c2) is null;
update /*+enable_parallel_dml parallel(2) */t1 set c4=(select array_distinct(c4) from t1 order by c1 limit 1) where c1 =10;
truncate table t1;
select * from t1 order by c1;
c1	c2	c3	c4
drop table if exists t1;
CREATE TABLE t1 (c1 int primary key, c2 int[],c3 float[],c4 varchar(256)[][]);
insert into t1 values(1,[1,2,3,5],[2.123,2.123,3.123,4.123],[['中文ing123',1,'1']]);
insert into t1 values(2,[2,3,4,4],[2.123,2.123,3.123,4.123],[[null,'a','sss']]);
insert into t1 values(3,[3,3,3,3],[3.123,2.123,3.123,4.123],[['null','a','sss']]);
insert into t1 values(4,[2,3,4,5],[4.123,2.123,3.123,4.123],[[2,3,4,5]]);
insert into t1 values(5,null,null,null);
update /*+read_consistency(weak) */t1 set c1=38 where array_distinct(c2)=[3];
update /*+read_consistency(weak) */t1 set c1=10 where array_distinct(c2) is null;
update /*+read_consistency(weak) */t1 set c4=(select array_distinct(c4) from t1 order by c1 limit 1) where c1 =10;
truncate table t1;
select * from t1 order by c1;
c1	c2	c3	c4
drop table if exists t1;
CREATE TABLE t1 (c1 int primary key, c2 int[],c3 float[],c4 varchar(256)[][]);
insert into t1 values(1,[1,2,3,5],[2.123,2.123,3.123,4.123],[['中文ing123',1,'1']]);
insert into t1 values(2,[2,3,4,5],[2.123,2.123,3.123,4.123],[[null,'a','sss']]);
insert into t1 values(3,[3,3,3,3],[3.123,2.123,3.123,4.123],[['null','a','sss']]);
insert into t1 values(4,[2,3,4,5],[4.123,2.123,3.123,4.123],[[2,3,4,5]]);
insert into t1 values(5,null,null,null);
drop table if exists t2;
create table t2 like t1;
insert  into t2 select * from t1;
update t1 set t1.c2 =[1,2,4,2] where c2 in (select array_distinct(t1.c2) from t1 inner join t2 on t1.c2=t2.c2 order by t1.c1 limit 1,1);
ERROR 22000: Invalid data type for the operation
update t1 set t1.c2 =[1,2,4,3] where c2 in (array_distinct([1,2,3,5]),array_distinct([1,2,3,5]));
ERROR 22000: Invalid data type for the operation
update t1 set t1.c2 =[1,2,4,3] where c2 in (array_distinct([1,2,3,5]));
update t1 join t2 on t1.c1 =t2.c1 set t1.c4 =array_distinct([[1,2,3,4,5]])  where t1.c3 is null;
select count(*) from t1,t2 where  array_distinct(t1.c4)= array_distinct(t2.c4);
count(*)
4
drop table if exists t1;
CREATE TABLE t1 (c1 int primary key, c2 int[],c3 float[],c4 varchar(256)[][]);
insert into t1 values(1,[1,2,3,5],[2.123,2.123,3.123,4.123],[['中文ing123',1,'1']]);
insert into t1 values(2,[2,3,4,5],[2.123,2.123,3.123,4.123],[[null,'a','sss']]);
insert into t1 values(3,[3,3,3,3],[3.123,2.123,3.123,4.123],[['null','a','sss']]);
insert into t1 values(4,[2,3,4,5],[4.123,2.123,3.123,4.123],[[2,3,4,5]]);
insert into t1 values(5,null,null,null);
drop table if exists t2;
create table t2 like t1;
insert  into t2 select * from t1;
update t1 set c1 = 10 where c3 is null;
update t1 set c2 = array_distinct([1,2,3,312,231,3,2,2,2,3])  where c1> 1 order by c1 limit 100;
update t1 set c3 = array_distinct([1,2,3,312,231,3,2,2,2,3])  where c1> 1 order by c1 limit 100;
update t1 set c4 = array_distinct([[1,2,3,312,231,3,2,2,2,3]])  where c1> 1 order by c1 limit 100;
select * from t1 order by c1;
c1	c2	c3	c4
1	[1,2,3,5]	[2.123,2.123,3.123,4.123]	[["中文ing123","1","1"]]
2	[1,2,3,312,231]	[1,2,3,312,231]	[["1","2","3","312","231","3","2","2","2","3"]]
3	[1,2,3,312,231]	[1,2,3,312,231]	[["1","2","3","312","231","3","2","2","2","3"]]
4	[1,2,3,312,231]	[1,2,3,312,231]	[["1","2","3","312","231","3","2","2","2","3"]]
10	[1,2,3,312,231]	[1,2,3,312,231]	[["1","2","3","312","231","3","2","2","2","3"]]
drop table if exists t1;
CREATE TABLE t1 (c1 int primary key, c2 int[],c3 float[],c4 varchar(256)[][]);
insert into t1 values(1,[1,2,3,5],[2.123,2.123,3.123,4.123],[['中文ing123',1,'1']]);
insert into t1 values(2,[2,3,4,5],[2.123,2.123,3.123,4.123],[[null,'a','sss']]);
insert into t1 values(3,[3,3,3,3],[3.123,2.123,3.123,4.123],[['null','a','sss']]);
insert into t1 values(4,[2,3,4,5],[4.123,2.123,3.123,4.123],[[2,3,4,5]]);
insert into t1 values(5,null,null,null);
drop table if exists t2;
create table t2 like t1;
insert  into t2 select * from t1;
insert into t1(c1,c2,c3,c4) values(10,array_distinct([1,2,3,4,5,5,6,6,7,7,745,345,345,2,3]),array_distinct([1,2,3,4,5,5,345,2,3]),array_distinct([[1,2,3,4,5,5,6,6,7,7,745,345,345,2,3]]));
replace into t1(c1,c2,c3,c4) values(11,array_distinct([1,2,3,4,5,5,6,6,7,7,745,345,345,2,3]),array_distinct([1,2,3,4,5,345,2,3]),array_distinct([[1,2,3,4,5,5,6,6,7,7,745,345,345,2,3]]));
replace into t1(c1,c2,c3,c4) values(11,array_distinct([1,2,3,4,5,5,6,6,7,745,345,345,2,3]),array_distinct([1,2,3,4,5,5,345,2,3]),array_distinct([[1,2,3,4,5,5,6,6,7,7,745,345,345,2,3]]));
select count(*) from t1;
count(*)
7
drop table if exists t1;
CREATE TABLE t1 (c1 int AUTO_INCREMENT, c2 int[],c3 float[],c4 varchar(256)[][]);
insert into t1 values(1,[1,2,3,5],[2.123,2.123,3.123,4.123],[['中文ing123',1,'1']]);
insert into t1 values(2,[2,3,4,5],[2.123,2.123,3.123,4.123],[[null,'a','sss']]);
insert into t1 values(3,[3,3,3,3],[3.123,2.123,3.123,4.123],[['null','a','sss']]);
insert into t1 values(4,[2,3,4,5],[4.123,2.123,3.123,4.123],[[2,3,4,5]]);
drop table if exists t2;
CREATE TABLE t2 (c1 int primary key, c2 int[],c3 float[],c4 varchar(256)[]);
insert into t2 values(1,[1,2,3,5],[2.123,2.123,3.123,4.123],['中文ing123',1,'1']);
insert into t2 values(2,[2,3,4,5],[2.123,2.123,3.123,4.123],[null,'a','sss']);
insert into t2 values(3,[3,3,3,3],[3.123,2.123,3.123,4.123],['null','a','sss']);
insert into t2 values(4,[2,3,4,5],[4.123,2.123,3.123,4.123],[2,3,4,5]);
insert into t1(c4) select array_distinct([[1,2,3,4,5,5,6,6,7,7,745,345,345,2,3],c2]) from t2;
replace into t1(c4) select array_distinct([c2]) from t2;
select count(*) from t1;
count(*)
12
select count(*) from t2;
count(*)
4
drop table if exists t1;
CREATE TABLE t1 (c1 int AUTO_INCREMENT primary key, c2 int[],c3 float[],c4 varchar(256)[][]);
insert into t1(c2,c3,c4) values(array_distinct([12,3,4,31,1]) + array_distinct([12,3,4,31,1]),array_distinct([12,3,4,31,2])+array_distinct([12,3,4,31,2]),array_distinct([[12,3,4,31,'中文']]));
insert into t1(c2,c3,c4) values(array_distinct([12,3,4,31,1]) + array_distinct([12,3,4,31,1]),array_distinct([12,3,4,31,2])+array_distinct([12,3,4,31,2]),array_distinct([[12,3,4,31,'中文']]));
insert into t1(c2,c3,c4) values(array_distinct([12,3,4,31,1]) + array_distinct([12,3,4,31,1]),array_distinct([12,3,4,31,2])+array_distinct([12,3,4,31,2]),array_distinct([[12,3,4,31,'中文']]));
insert into t1(c2,c3,c4) values(array_distinct([12,3,4,31,1]) + array_distinct([12,3,4,31,1]),array_distinct([12,3,4,31,2])+array_distinct([12,3,4,31,2]),array_distinct([[12,3,4,31,'中文']]));
select c1,array_distinct(c2) from t1 order by c1;
c1	array_distinct(c2)
1	[24,6,8,62,2]
2	[24,6,8,62,2]
3	[24,6,8,62,2]
4	[24,6,8,62,2]
select c1,array_distinct(c3) from t1 order by c1;
c1	array_distinct(c3)
1	[24,6,8,62,4]
2	[24,6,8,62,4]
3	[24,6,8,62,4]
4	[24,6,8,62,4]
select c1,array_distinct(c4) from t1 order by c1;
c1	array_distinct(c4)
1	[["12","3","4","31","中文"]]
2	[["12","3","4","31","中文"]]
3	[["12","3","4","31","中文"]]
4	[["12","3","4","31","中文"]]
drop table if exists t1;
CREATE TABLE t1 (c1 int AUTO_INCREMENT primary key, c2 int[],c3 float[],c4 varchar(256)[][]);
insert IGNORE t1(c2,c3,c4) values(array_distinct([12,3,4,31,1]) + array_distinct([12,3,4,31,1]),array_distinct([12,3,4,31,2])+array_distinct([12,3,4,31,2]),array_distinct([[12,3,4,31,'中文']]));
insert IGNORE t1(c2,c3,c4) values(array_distinct([12,3,4,31,1]) + array_distinct([12,3,4,31,1]),array_distinct([12,3,4,31,2])+array_distinct([12,3,4,31,2]),array_distinct([[12,3,4,31,'中文']]));
insert IGNORE t1(c2,c3,c4) values(array_distinct([12,3,4,31,1]) + array_distinct([12,3,4,31,1]),array_distinct([12,3,4,31,2])+array_distinct([12,3,4,31,2]),array_distinct([[12,3,4,31,'中文']]));
insert IGNORE t1(c2,c3,c4) values(array_distinct([12,3,4,31,1]) + array_distinct([12,3,4,31,1]),array_distinct([12,3,4,31,2])+array_distinct([12,3,4,31,2]),array_distinct([[12,3,4,31,'中文']]));
select c1,array_distinct(c2) from t1 order by c1;
c1	array_distinct(c2)
1	[24,6,8,62,2]
2	[24,6,8,62,2]
3	[24,6,8,62,2]
4	[24,6,8,62,2]
select c1,array_distinct(c3) from t1 order by c1;
c1	array_distinct(c3)
1	[24,6,8,62,4]
2	[24,6,8,62,4]
3	[24,6,8,62,4]
4	[24,6,8,62,4]
select c1,array_distinct(c4) from t1 order by c1;
c1	array_distinct(c4)
1	[["12","3","4","31","中文"]]
2	[["12","3","4","31","中文"]]
3	[["12","3","4","31","中文"]]
4	[["12","3","4","31","中文"]]
drop table if exists t1;
CREATE TABLE t1 (c1 int AUTO_INCREMENT primary key, c2 int[],c3 float[],c4 varchar(256)[][]);
insert into t1 values(1,[1,2,3,5],[2.123,2.123,3.123,4.123],[['中文ing123',1,'1']]);
insert into t1 values(2,[2,3,4,5],[2.123,2.123,3.123,4.123],[[null,'a','sss']]);
insert into t1 values(3,[3,3,3,3],[3.123,2.123,3.123,4.123],[['null','a','sss']]);
insert into t1 values(4,[2,3,4,5],[4.123,2.123,3.123,4.123],[[2,3,4,5]]);
insert into t1(c1) values(4) ON DUPLICATE KEY UPDATE c4 = array_distinct([[12,3,4,31,'中文']]);
insert into t1(c1) values(5)ON DUPLICATE KEY UPDATE c2= array_distinct([12,3,4,31,2]);
insert into t1(c1) values(5)ON DUPLICATE KEY UPDATE c2= array_distinct([12,3,4,31,2]);
insert into t1(c2,c3,c4) values([1,2,3,3],[1,3,3,3],[[2,1,2,3]]) ON DUPLICATE KEY UPDATE c4=array_distinct([[2,1,2,3]]);
insert into t1(c1) values(5) ON DUPLICATE KEY UPDATE c4 = array_distinct([[12,3,4,31,'中文']]);
select count(array_distinct(c2)) from t1 order by c1;
count(array_distinct(c2))
6
drop table if exists t1;
CREATE TABLE t1 (c1 int AUTO_INCREMENT primary key, c2 int[],c3 float[],c4 varchar(256)[][]);
insert into t1 values(1,[1,2,3,5],[2.123,2.123,3.123,4.123],[['中文ing123',1,'1']]);
insert into t1 values(2,[2,3,4,5],[2.123,2.123,3.123,4.123],[[null,'a','sss']]);
insert into t1 values(3,[3,3,3,3],[3.123,2.123,3.123,4.123],[['null','a','sss']]);
insert into t1 values(4,[2,3,4,5],[4.123,2.123,3.123,4.123],[[2,3,4,5]]);
insert into t1(c1) values(5) ;
insert /*+ parallel(10) */ overwrite t1(c4) select array_distinct([[12,3,4,31,'中文']]) from t1 where c1>2;
insert /*+ parallel(10) */ overwrite t1(c4) select array_distinct([[12,3,4,31,'中文']]) from t1 where c1>2;
insert /*+ parallel(10) */ overwrite t1(c2) select array_distinct([12,3,4,31]) from t1 where c1>2;
insert /*+ parallel(10) */ overwrite t1(c2) select array_distinct([12,3,4,32]);
select * from t1;
c1	c2	c3	c4
15	[12,3,4,32]	NULL	NULL
drop table if exists t1;
drop view if exists v1;
CREATE TABLE t1 (c1 int AUTO_INCREMENT , c2 int[],c3 float[],c4 varchar(256)[][]);
insert into t1 values(1,[1,2,3,5],[2.123,2.123,3.123,4.123],[['中文ing123',1,'1']]);
insert into t1 values(2,[2,3,4,5],[2.123,2.123,3.123,4.123],[[null,'a','sss']]);
insert into t1 values(3,[3,3,3,3],[3.123,2.123,3.123,4.123],[['null','a','sss']]);
insert into t1 values(4,[2,3,4,5],[4.123,2.123,3.123,4.123],[[2,3,4,5]]);
insert into t1(c1) values(5) ;
create view v1 as select c2 from t1;
insert /*+ direct(true,100) enable_parallel_dml parallel(2)*/ into v1 select array_distinct([12,3,4,32]) from t1;
insert /*+ direct(true,100) enable_parallel_dml parallel(2) append*/ into t1(c2) select array_distinct([12,3,4,32]) from t1;
insert /*+ direct(true,100) enable_parallel_dml parallel(2) append*/ into t1(c4) select array_distinct([[12,3,4,31,'中文']]) from t1;
insert /*+ direct(true,100) enable_parallel_dml parallel(2) append*/ into t1(c2,c4) select array_distinct([12,3,4,32]), array_distinct([[12,3,4,31,'中文']]) from t1;
select count(*) from t1;
count(*)
80
drop table if exists t1;
drop view if exists v1;
CREATE TABLE t1 (c1 int AUTO_INCREMENT , c2 int[],c3 float[],c4 varchar(256)[][])partition by hash(c1);
insert into t1 values(1,[1,2,3,5],[2.123,2.123,3.123,4.123],[['中文ing123',1,'1']]);
insert into t1 values(2,[2,3,4,5],[2.123,2.123,3.123,4.123],[[null,'a','sss']]);
insert into t1 values(3,[3,3,3,3],[3.123,2.123,3.123,4.123],[['null','a','sss']]);
insert into t1 values(4,[2,3,4,5],[4.123,2.123,3.123,4.123],[[2,3,4,5]]);
insert into t1(c1) values(5) ;
insert /*+ direct(true,100) enable_parallel_dml parallel(2) append*/ into t1(c2) select array_distinct([12,3,4,32]) from t1;
insert /*+ direct(true,100) enable_parallel_dml parallel(2) append*/ into t1(c4) select array_distinct([[12,3,4,31,'中文']]) from t1;
insert /*+ direct(true,100) enable_parallel_dml parallel(2) append*/ into t1(c2,c4) select array_distinct([12,3,4,32]), array_distinct([[12,3,4,31,'中文']]) from t1;
select count(*) from t1;
count(*)
40
drop table if exists t1;
CREATE TABLE t1 (c1 int AUTO_INCREMENT, c2 vector(8),c3 float[],c4 varchar(256)[]);
insert into t1 values(1,[1,2,3,4,1,2,3,4],[1.2,2.3,6.9,-1.02,1.2,2.3,6.9,-1.02],['中文ing123',1,'1','中文ing123',1,'1']);
insert into t1 values(2,[2,3,4,6,2,3,4,6],[1.123,2.3126,2.30,-0.25,1.123,2.3126,2.30,-0.25],[null,'a','sss',null,'a','sss']);
insert into t1 values(3,[7,1,5,9,7,1,5,9],[0.12345,null,966.66,0.12345,null,966.66],['null','a','sss','null','a','sss']);
insert into t1 values(4,null,null,null);
insert /*+ direct(true,100) enable_parallel_dml parallel(2) append*/ into t1(c2) select array_distinct([12,4,32,1,7,8,9,0]) from t1;
insert /*+ direct(true,100) enable_parallel_dml parallel(2) append*/ into t1(c2) select array_distinct([12,4,32,1,7,8,9,0]) from t1;
insert /*+ direct(true,100) enable_parallel_dml parallel(2) append*/ into t1(c2) select array_distinct([12,4,32,1,7,8,9,0]) from t1;
select count(*) from t1;
count(*)
32
select count(array_distinct(c2)) from t1;
count(array_distinct(c2))
31
drop table if exists t1;
CREATE TABLE t1 (c1 int AUTO_INCREMENT primary key, c2 int[],c3 float[],c4 varchar(256)[][])partition by hash(c1);
insert into t1 values(1,[1,2,3,5],[2.123,2.123,3.123,4.123],[['中文ing123',1,'1']]);
insert into t1 values(2,[2,3,4,5],[2.123,2.123,3.123,4.123],[[null,'a','sss']]);
insert into t1 values(3,[3,3,3,3],[3.123,2.123,3.123,4.123],[['null','a','sss']]);
insert into t1 values(4,[2,3,4,5],[4.123,2.123,3.123,4.123],[[2,3,4,5]]);
insert into t1 values(5,[null],[null],[[null]]);
insert into t1(c1) values(6) ;
delete from t1 where c2=(select array_distinct(c2) from t1 order by c1 limit 1) order by c1;
delete from t1 where c4=array_distinct([[null,'a','sss']]) ;
delete from t1 where c3=array_distinct([4.123,2.123,3.123,4.123]);
delete from t1;
truncate table t1;
select * from t1;
c1	c2	c3	c4
drop table if exists t1;
CREATE TABLE t1 (c1 int AUTO_INCREMENT primary key, c2 int[],c3 float[],c4 varchar(256)[][])partition by hash(c1);
insert into t1 values(1,[1,2,3,5],[2.123,2.123,3.123,4.123],[['中文ing123',1,'1']]);
insert into t1 values(2,[2,3,4,5],[2.123,2.123,3.123,4.123],[[null,'a','sss']]);
insert into t1 values(3,[3,3,3,3],[3.123,2.123,3.123,4.123],[['null','a','sss']]);
insert into t1 values(4,[2,3,4,5],[4.123,2.123,3.123,4.123],[[2,3,4,5]]);
insert into t1 values(5,[null],[null],[[null]]);
insert into t1(c1) values(6) ;
select array_distinct(c2) from t1 order by c1;
array_distinct(c2)
[1,2,3,5]
[2,3,4,5]
[3]
[2,3,4,5]
[NULL]
NULL
select /*+enable_parallel_dml parallel(2) */array_distinct(c2) from t1 order by c1;
array_distinct(c2)
[1,2,3,5]
[2,3,4,5]
[3]
[2,3,4,5]
[NULL]
NULL
select array_distinct(c3) from t1 order by c1;
array_distinct(c3)
[2.123,3.123,4.123]
[2.123,3.123,4.123]
[3.123,2.123,4.123]
[4.123,2.123,3.123]
[NULL]
NULL
select array_distinct(c4) from t1 order by c1;
array_distinct(c4)
[["中文ing123","1","1"]]
[[NULL,"a","sss"]]
[["null","a","sss"]]
[["2","3","4","5"]]
[[NULL]]
NULL
########清空回收站，删除测试数据库，表等 ##########
drop database  IF EXISTS  obljh;
purge recyclebin;
