purge recyclebin;
drop database IF EXISTS obljh;
create database obljh ;
use obljh;
set timestamp = 1600000000;
set ob_trx_timeout = 10000000000;
set ob_query_timeout = 10000000000;
alter system set ob_vector_memory_limit_percentage =44;
drop table if exists t1;
CREATE TABLE t1 (c1 int primary key, c2 int[],c3 float[],c4 varchar(256)[][]);
insert into t1 values(3,null,null,null);
select element_at(c2,1) from t1;
element_at(c2,1)
NULL
select element_at(c3,1) from t1;
element_at(c3,1)
NULL
select element_at(c4,1) from t1;
element_at(c4,1)
NULL
drop table if exists t1;
CREATE TABLE t1 (c1 int primary key, c2 int[],c3 float[],c4 varchar(256)[]);
insert into t1 values(1,[1,2,3,4],[1.2,2.3,6.9,-1.02],['中文ing123',1,'1']);
insert into t1 values(2,[2,3,4,6],[1.123,2.3126,2.30,-0.25],[null,'a','sss']);
insert into t1 values(3,[7,1,5,9],[0.12345,null,966.66],['null','a','sss']);
insert into t1 values(4,null,null,null);
select c1,c2,c3,element_at(c4,c1) from t1 where element_at(c4,1) = '中文ing123';
c1	c2	c3	element_at(c4,c1)
1	[1,2,3,4]	[1.2,2.3,6.9,-1.02]	中文ing123
select c1,c2,c3,element_at(c3,1) from t1 where element_at(c3,1) = 0.12345;
c1	c2	c3	element_at(c3,1)
select c1,c2,c3,element_at(c2,4) from t1 where element_at(c2,3) = 99999 order by c1;
c1	c2	c3	element_at(c2,4)
select c1,c2,c3,c4 from t1 where c1 > element_at(c2,3) order by c1;
c1	c2	c3	c4
select c1,c2,c3,c4 from t1 where c1 < element_at(c2,3) order by c1;
c1	c2	c3	c4
1	[1,2,3,4]	[1.2,2.3,6.9,-1.02]	["中文ing123","1","1"]
2	[2,3,4,6]	[1.123,2.3126,2.3,-0.25]	[NULL,"a","sss"]
3	[7,1,5,9]	[0.12345,NULL,966.66]	["null","a","sss"]
select c1,c2,c3,c4 from t1 where c1 <= element_at(c2,3) order by c1;
c1	c2	c3	c4
1	[1,2,3,4]	[1.2,2.3,6.9,-1.02]	["中文ing123","1","1"]
2	[2,3,4,6]	[1.123,2.3126,2.3,-0.25]	[NULL,"a","sss"]
3	[7,1,5,9]	[0.12345,NULL,966.66]	["null","a","sss"]
select c1,c2,c3,c4 from t1 where c1 <> element_at(c2,3) order by c1;
c1	c2	c3	c4
1	[1,2,3,4]	[1.2,2.3,6.9,-1.02]	["中文ing123","1","1"]
2	[2,3,4,6]	[1.123,2.3126,2.3,-0.25]	[NULL,"a","sss"]
3	[7,1,5,9]	[0.12345,NULL,966.66]	["null","a","sss"]
select c1,c2,c3,c4 from t1 where c1 = element_at(c2,3) order by c1;
c1	c2	c3	c4
select c1,c2,c3,c4 from t1 where c1 between element_at(c2,1) and element_at(c3,1) ;
c1	c2	c3	c4
1	[1,2,3,4]	[1.2,2.3,6.9,-1.02]	["中文ing123","1","1"]
select c1,c2,c3,c4 from t1 where element_at(c2,1) like '%2%';
c1	c2	c3	c4
2	[2,3,4,6]	[1.123,2.3126,2.3,-0.25]	[NULL,"a","sss"]
select c1,c2,c3,c4 from t1 where element_at(c3,1) like '%2%';
c1	c2	c3	c4
1	[1,2,3,4]	[1.2,2.3,6.9,-1.02]	["中文ing123","1","1"]
2	[2,3,4,6]	[1.123,2.3126,2.3,-0.25]	[NULL,"a","sss"]
3	[7,1,5,9]	[0.12345,NULL,966.66]	["null","a","sss"]
select c1,c2,c3,c4 from t1 where element_at(c4,1) like '%中文%';
c1	c2	c3	c4
1	[1,2,3,4]	[1.2,2.3,6.9,-1.02]	["中文ing123","1","1"]
select c1,c2,c3,c4 from t1 where element_at(c2,1) not like '%2%';
c1	c2	c3	c4
1	[1,2,3,4]	[1.2,2.3,6.9,-1.02]	["中文ing123","1","1"]
3	[7,1,5,9]	[0.12345,NULL,966.66]	["null","a","sss"]
select c1,c2,c3,c4 from t1 where element_at(c3,1) not like '%2%';
c1	c2	c3	c4
select c1,c2,c3,c4 from t1 where element_at(c4,1) not like '%中文%';
c1	c2	c3	c4
3	[7,1,5,9]	[0.12345,NULL,966.66]	["null","a","sss"]
select c1,c2,c3,c4,element_at(c4,1) from t1 where EXISTS (SELECT element_at(c4,1) FROM t1) order by c1;
c1	c2	c3	c4	element_at(c4,1)
1	[1,2,3,4]	[1.2,2.3,6.9,-1.02]	["中文ing123","1","1"]	中文ing123
2	[2,3,4,6]	[1.123,2.3126,2.3,-0.25]	[NULL,"a","sss"]	NULL
3	[7,1,5,9]	[0.12345,NULL,966.66]	["null","a","sss"]	null
4	NULL	NULL	NULL	NULL
select c1,c2,c3,c4,element_at(c4,1) from t1 where not EXISTS (SELECT element_at(c4,1) FROM t1) order by c1;
c1	c2	c3	c4	element_at(c4,1)
SELECT c1,c2,c3,c4,element_at(c4,1) from t1 where c1 = any (SELECT element_at(c2,1) FROM t1) order by c1;
c1	c2	c3	c4	element_at(c4,1)
1	[1,2,3,4]	[1.2,2.3,6.9,-1.02]	["中文ing123","1","1"]	中文ing123
2	[2,3,4,6]	[1.123,2.3126,2.3,-0.25]	[NULL,"a","sss"]	NULL
SELECT c1,c2,c3,c4,element_at(c4,1) from t1 where c1 >= any (SELECT element_at(c2,1) FROM t1) order by c1;
c1	c2	c3	c4	element_at(c4,1)
1	[1,2,3,4]	[1.2,2.3,6.9,-1.02]	["中文ing123","1","1"]	中文ing123
2	[2,3,4,6]	[1.123,2.3126,2.3,-0.25]	[NULL,"a","sss"]	NULL
3	[7,1,5,9]	[0.12345,NULL,966.66]	["null","a","sss"]	null
4	NULL	NULL	NULL	NULL
SELECT c1,c2,c3,c4,element_at(c4,1) from t1 where c1 <= any (SELECT element_at(c2,1) FROM t1) order by c1;
c1	c2	c3	c4	element_at(c4,1)
1	[1,2,3,4]	[1.2,2.3,6.9,-1.02]	["中文ing123","1","1"]	中文ing123
2	[2,3,4,6]	[1.123,2.3126,2.3,-0.25]	[NULL,"a","sss"]	NULL
3	[7,1,5,9]	[0.12345,NULL,966.66]	["null","a","sss"]	null
4	NULL	NULL	NULL	NULL
SELECT c1,c2,c3,c4,element_at(c4,1) from t1 where c1 <> any (SELECT element_at(c2,1) FROM t1) order by c1;
c1	c2	c3	c4	element_at(c4,1)
1	[1,2,3,4]	[1.2,2.3,6.9,-1.02]	["中文ing123","1","1"]	中文ing123
2	[2,3,4,6]	[1.123,2.3126,2.3,-0.25]	[NULL,"a","sss"]	NULL
3	[7,1,5,9]	[0.12345,NULL,966.66]	["null","a","sss"]	null
4	NULL	NULL	NULL	NULL
SELECT c1,c2,c3,c4,element_at(c4,1) from t1 where c1 != any (SELECT element_at(c2,1) FROM t1) order by c1;
c1	c2	c3	c4	element_at(c4,1)
1	[1,2,3,4]	[1.2,2.3,6.9,-1.02]	["中文ing123","1","1"]	中文ing123
2	[2,3,4,6]	[1.123,2.3126,2.3,-0.25]	[NULL,"a","sss"]	NULL
3	[7,1,5,9]	[0.12345,NULL,966.66]	["null","a","sss"]	null
4	NULL	NULL	NULL	NULL
SELECT c1,c2,c3,c4,element_at(c4,1) from t1 where c1 > any (SELECT element_at(c2,1) FROM t1) order by c1;
c1	c2	c3	c4	element_at(c4,1)
2	[2,3,4,6]	[1.123,2.3126,2.3,-0.25]	[NULL,"a","sss"]	NULL
3	[7,1,5,9]	[0.12345,NULL,966.66]	["null","a","sss"]	null
4	NULL	NULL	NULL	NULL
SELECT c1,c2,c3,c4,element_at(c4,1) from t1 where c1 < any (SELECT element_at(c2,1) FROM t1) order by c1;
c1	c2	c3	c4	element_at(c4,1)
1	[1,2,3,4]	[1.2,2.3,6.9,-1.02]	["中文ing123","1","1"]	中文ing123
2	[2,3,4,6]	[1.123,2.3126,2.3,-0.25]	[NULL,"a","sss"]	NULL
3	[7,1,5,9]	[0.12345,NULL,966.66]	["null","a","sss"]	null
4	NULL	NULL	NULL	NULL
select [element_at(c2,1),element_at(c3,1),element_at(c4,1)] from t1 order by c1 ;
[element_at(c2,1),element_at(c3,1),element_at(c4,1)]
["1","1.2","中文ing123"]
["2","1.123",NULL]
["7","0.12345","null"]
[NULL,NULL,NULL]
SELECT c1,c2,c3,c4,element_at(c4,1) from t1 where c4 in ([element_at(c4,1),element_at(c4,2),element_at(c4,3)]) order by c1;
c1	c2	c3	c4	element_at(c4,1)
1	[1,2,3,4]	[1.2,2.3,6.9,-1.02]	["中文ing123","1","1"]	中文ing123
2	[2,3,4,6]	[1.123,2.3126,2.3,-0.25]	[NULL,"a","sss"]	NULL
3	[7,1,5,9]	[0.12345,NULL,966.66]	["null","a","sss"]	null
SELECT c1,c2,c3,c4,element_at(c4,1) from t1 where c3 in ([element_at(c4,1),element_at(c4,2),element_at(c4,3)]) order by c1;
c1	c2	c3	c4	element_at(c4,1)
SELECT c1,c2,c3,c4,element_at(c4,1) from t1 where c2 in ([element_at(c4,1),element_at(c4,2),element_at(c4,3)]) order by c1;
c1	c2	c3	c4	element_at(c4,1)
SELECT c1,c2,c3,c4,element_at(c2,1) from t1 where c1 in (element_at(c2,1),element_at(c2,2),element_at(c2,3)) order by c1;
c1	c2	c3	c4	element_at(c2,1)
1	[1,2,3,4]	[1.2,2.3,6.9,-1.02]	["中文ing123","1","1"]	1
2	[2,3,4,6]	[1.123,2.3126,2.3,-0.25]	[NULL,"a","sss"]	2
SELECT c1,c2,c3,c4,element_at(c4,1) from t1 where c4 not in ([element_at(c4,1),element_at(c4,2),element_at(c4,3)]) order by c1;
c1	c2	c3	c4	element_at(c4,1)
SELECT c1,c2,c3,c4,element_at(c4,1) from t1 where c3 not in ([element_at(c4,1),element_at(c4,2),element_at(c4,3)]) order by c1;
c1	c2	c3	c4	element_at(c4,1)
1	[1,2,3,4]	[1.2,2.3,6.9,-1.02]	["中文ing123","1","1"]	中文ing123
2	[2,3,4,6]	[1.123,2.3126,2.3,-0.25]	[NULL,"a","sss"]	NULL
3	[7,1,5,9]	[0.12345,NULL,966.66]	["null","a","sss"]	null
SELECT c1,c2,c3,c4,element_at(c4,1) from t1 where c2 not in ([element_at(c4,1),element_at(c4,2),element_at(c4,3)]) order by c1;
c1	c2	c3	c4	element_at(c4,1)
1	[1,2,3,4]	[1.2,2.3,6.9,-1.02]	["中文ing123","1","1"]	中文ing123
2	[2,3,4,6]	[1.123,2.3126,2.3,-0.25]	[NULL,"a","sss"]	NULL
3	[7,1,5,9]	[0.12345,NULL,966.66]	["null","a","sss"]	null
SELECT c1,c2,c3,c4,element_at(c2,1) from t1 where c1 not in (element_at(c2,1),element_at(c2,2),element_at(c2,3)) order by c1;
c1	c2	c3	c4	element_at(c2,1)
3	[7,1,5,9]	[0.12345,NULL,966.66]	["null","a","sss"]	7
drop table if exists t1;
drop materialized view if exists mv1;
CREATE TABLE t1 (c1 int primary key, c2 int[],c3 float[],c4 varchar(256)[]);
insert into t1 values(1,[1,2,3,4],[1.2,2.3,6.9,-1.02],['中文ing123',1,'1']);
insert into t1 values(2,[2,3,4,6],[1.123,2.3126,2.30,-0.25],[null,'a','sss']);
insert into t1 values(3,[7,1,5,9],[0.12345,null,966.66],['null','a','sss']);
insert into t1 values(4,null,null,null);
drop table if exists t2;
create table t2 like t1;
replace into t2 select * from t1;
create materialized view mv1  parallel 2 refresh complete on demand  as select * from t2;
select * from t1,t2 where element_at(t1.c3,1)=element_at(t2.c3, 1) order by t1.c1,t2.c1;
c1	c2	c3	c4	c1	c2	c3	c4
1	[1,2,3,4]	[1.2,2.3,6.9,-1.02]	["中文ing123","1","1"]	1	[1,2,3,4]	[1.2,2.3,6.9,-1.02]	["中文ing123","1","1"]
2	[2,3,4,6]	[1.123,2.3126,2.3,-0.25]	[NULL,"a","sss"]	2	[2,3,4,6]	[1.123,2.3126,2.3,-0.25]	[NULL,"a","sss"]
3	[7,1,5,9]	[0.12345,NULL,966.66]	["null","a","sss"]	3	[7,1,5,9]	[0.12345,NULL,966.66]	["null","a","sss"]
select * from t1,t2 where element_at(t1.c3,2)<>element_at(t2.c3,2) order by t1.c1,t2.c1;
c1	c2	c3	c4	c1	c2	c3	c4
1	[1,2,3,4]	[1.2,2.3,6.9,-1.02]	["中文ing123","1","1"]	2	[2,3,4,6]	[1.123,2.3126,2.3,-0.25]	[NULL,"a","sss"]
2	[2,3,4,6]	[1.123,2.3126,2.3,-0.25]	[NULL,"a","sss"]	1	[1,2,3,4]	[1.2,2.3,6.9,-1.02]	["中文ing123","1","1"]
select * from t1,t2 where t1.c3>t2.c3 order by t1.c1,t2.c1;
ERROR 22000: Invalid data type for the operation
select * from t1,t2 where t1.c3<t2.c3 order by t1.c1,t2.c1;
ERROR 22000: Invalid data type for the operation
select * from t1,t2 where element_at(t1.c3,1)>element_at(t2.c3, 1) order by t1.c1,t2.c1;
c1	c2	c3	c4	c1	c2	c3	c4
1	[1,2,3,4]	[1.2,2.3,6.9,-1.02]	["中文ing123","1","1"]	2	[2,3,4,6]	[1.123,2.3126,2.3,-0.25]	[NULL,"a","sss"]
1	[1,2,3,4]	[1.2,2.3,6.9,-1.02]	["中文ing123","1","1"]	3	[7,1,5,9]	[0.12345,NULL,966.66]	["null","a","sss"]
2	[2,3,4,6]	[1.123,2.3126,2.3,-0.25]	[NULL,"a","sss"]	3	[7,1,5,9]	[0.12345,NULL,966.66]	["null","a","sss"]
select * from t1,t2 where element_at(t1.c3,1)<element_at(t2.c3, 1) order by t1.c1,t2.c1;
c1	c2	c3	c4	c1	c2	c3	c4
2	[2,3,4,6]	[1.123,2.3126,2.3,-0.25]	[NULL,"a","sss"]	1	[1,2,3,4]	[1.2,2.3,6.9,-1.02]	["中文ing123","1","1"]
3	[7,1,5,9]	[0.12345,NULL,966.66]	["null","a","sss"]	1	[1,2,3,4]	[1.2,2.3,6.9,-1.02]	["中文ing123","1","1"]
3	[7,1,5,9]	[0.12345,NULL,966.66]	["null","a","sss"]	2	[2,3,4,6]	[1.123,2.3126,2.3,-0.25]	[NULL,"a","sss"]
select * from t1,t2 where element_at(t1.c3,1)<=>element_at(t2.c3, 1) order by t1.c1,t2.c1;
c1	c2	c3	c4	c1	c2	c3	c4
1	[1,2,3,4]	[1.2,2.3,6.9,-1.02]	["中文ing123","1","1"]	1	[1,2,3,4]	[1.2,2.3,6.9,-1.02]	["中文ing123","1","1"]
2	[2,3,4,6]	[1.123,2.3126,2.3,-0.25]	[NULL,"a","sss"]	2	[2,3,4,6]	[1.123,2.3126,2.3,-0.25]	[NULL,"a","sss"]
3	[7,1,5,9]	[0.12345,NULL,966.66]	["null","a","sss"]	3	[7,1,5,9]	[0.12345,NULL,966.66]	["null","a","sss"]
4	NULL	NULL	NULL	4	NULL	NULL	NULL
select t1.c1,element_at(t1.c3,1) from t1  join t2  on element_at(t1.c3,1)=element_at(t2.c3, 1)  order by t1.c1;
c1	element_at(t1.c3,1)
1	1.2
2	1.123
3	0.12345
select t1.c1,element_at(t1.c3,1) from t1  inner join t2  on element_at(t1.c3,1)=element_at(t2.c3, 1)  order by t1.c1;
c1	element_at(t1.c3,1)
1	1.2
2	1.123
3	0.12345
select t1.c1,element_at(t1.c3,1) from t1  right join t2  on element_at(t1.c3,1)=element_at(t2.c3, 1)  order by t1.c1;
c1	element_at(t1.c3,1)
NULL	NULL
1	1.2
2	1.123
3	0.12345
select t1.c1,element_at(t1.c3,1) from t1  left join t2  on element_at(t1.c3,1)=element_at(t2.c3, 1)  order by t1.c1;
c1	element_at(t1.c3,1)
1	1.2
2	1.123
3	0.12345
4	NULL
select t1.c1,element_at(t1.c3,1) from t1  cross  join t2 on element_at(t1.c3,1)=element_at(t2.c3, 1)  order by t1.c1;
c1	element_at(t1.c3,1)
1	1.2
2	1.123
3	0.12345
select t1.c1,element_at(t1.c3,1) from t1  join t2  on element_at(t1.c4,1)=element_at(t2.c4, 1)  order by t1.c1;
c1	element_at(t1.c3,1)
1	1.2
3	0.12345
select t1.c1,element_at(t1.c3,1) from t1  inner join t2  on element_at(t1.c4,1)=element_at(t2.c4, 1)  order by t1.c1;
c1	element_at(t1.c3,1)
1	1.2
3	0.12345
select t1.c1,element_at(t1.c3,1) from t1  right join t2  on element_at(t1.c4,1)=element_at(t2.c4, 1)  order by t1.c1;
c1	element_at(t1.c3,1)
NULL	NULL
NULL	NULL
1	1.2
3	0.12345
select t1.c1,element_at(t1.c3,1) from t1  left join t2  on element_at(t1.c4,1)=element_at(t2.c4, 1)  order by t1.c1;
c1	element_at(t1.c3,1)
1	1.2
2	1.123
3	0.12345
4	NULL
select t1.c1,element_at(t1.c3,1) from t1  cross  join t2 on element_at(t1.c4,1)=element_at(t2.c4, 1)  order by t1.c1;
c1	element_at(t1.c3,1)
1	1.2
3	0.12345
drop table if exists t1;
CREATE TABLE t1 (c1 int primary key, c2 int[],c3 float[],c4 varchar(256)[]);
insert into t1 values(1,[1,2,3,4],[1.2,2.3,6.9,-1.02],['中文ing123',1,'1']);
insert into t1 values(2,[2,3,4,6],[1.123,2.3126,2.30,-0.25],[null,'a','sss']);
insert into t1 values(3,[7,1,5,9],[0.12345,null,966.66],['null','a','sss']);
insert into t1 values(4,null,null,null);
drop table if exists t2;
create table t2 like t1;
replace into t2 select * from t1;
drop table if exists t1;
CREATE TABLE t1 (c1 int primary key, c2 vector(4),c3 float[],c4 varchar(256)[]);
insert into t1 values(1,[1,2,3,4],[1.2,2.3,6.9,-1.02],['中文ing123',1,'1']);
insert into t1 values(2,[2,3,4,6],[1.123,2.3126,2.30,-0.25],[null,'a','sss']);
insert into t1 values(3,[7,1,5,9],[0.12345,null,966.66],['null','a','sss']);
insert into t1 values(4,null,null,null);
drop view if exists v1;
create view v1 as select * from t1;
select * from t1,v1 where element_at(t1.c2,1)=element_at(v1.c2, 1) order by t1.c1;
c1	c2	c3	c4	c1	c2	c3	c4
1	[1,2,3,4]	[1.2,2.3,6.9,-1.02]	["中文ing123","1","1"]	1	[1,2,3,4]	[1.2,2.3,6.9,-1.02]	["中文ing123","1","1"]
2	[2,3,4,6]	[1.123,2.3126,2.3,-0.25]	[NULL,"a","sss"]	2	[2,3,4,6]	[1.123,2.3126,2.3,-0.25]	[NULL,"a","sss"]
3	[7,1,5,9]	[0.12345,NULL,966.66]	["null","a","sss"]	3	[7,1,5,9]	[0.12345,NULL,966.66]	["null","a","sss"]
select * from t1,v1 where element_at(t1.c2,1)<>element_at(v1.c2, 1) ;
c1	c2	c3	c4	c1	c2	c3	c4
1	[1,2,3,4]	[1.2,2.3,6.9,-1.02]	["中文ing123","1","1"]	2	[2,3,4,6]	[1.123,2.3126,2.3,-0.25]	[NULL,"a","sss"]
1	[1,2,3,4]	[1.2,2.3,6.9,-1.02]	["中文ing123","1","1"]	3	[7,1,5,9]	[0.12345,NULL,966.66]	["null","a","sss"]
2	[2,3,4,6]	[1.123,2.3126,2.3,-0.25]	[NULL,"a","sss"]	1	[1,2,3,4]	[1.2,2.3,6.9,-1.02]	["中文ing123","1","1"]
2	[2,3,4,6]	[1.123,2.3126,2.3,-0.25]	[NULL,"a","sss"]	3	[7,1,5,9]	[0.12345,NULL,966.66]	["null","a","sss"]
3	[7,1,5,9]	[0.12345,NULL,966.66]	["null","a","sss"]	1	[1,2,3,4]	[1.2,2.3,6.9,-1.02]	["中文ing123","1","1"]
3	[7,1,5,9]	[0.12345,NULL,966.66]	["null","a","sss"]	2	[2,3,4,6]	[1.123,2.3126,2.3,-0.25]	[NULL,"a","sss"]
select * from t1 a,t1 b where element_at(a.c2,1)<>element_at(b.c2, 1) ;
c1	c2	c3	c4	c1	c2	c3	c4
1	[1,2,3,4]	[1.2,2.3,6.9,-1.02]	["中文ing123","1","1"]	2	[2,3,4,6]	[1.123,2.3126,2.3,-0.25]	[NULL,"a","sss"]
1	[1,2,3,4]	[1.2,2.3,6.9,-1.02]	["中文ing123","1","1"]	3	[7,1,5,9]	[0.12345,NULL,966.66]	["null","a","sss"]
2	[2,3,4,6]	[1.123,2.3126,2.3,-0.25]	[NULL,"a","sss"]	1	[1,2,3,4]	[1.2,2.3,6.9,-1.02]	["中文ing123","1","1"]
2	[2,3,4,6]	[1.123,2.3126,2.3,-0.25]	[NULL,"a","sss"]	3	[7,1,5,9]	[0.12345,NULL,966.66]	["null","a","sss"]
3	[7,1,5,9]	[0.12345,NULL,966.66]	["null","a","sss"]	1	[1,2,3,4]	[1.2,2.3,6.9,-1.02]	["中文ing123","1","1"]
3	[7,1,5,9]	[0.12345,NULL,966.66]	["null","a","sss"]	2	[2,3,4,6]	[1.123,2.3126,2.3,-0.25]	[NULL,"a","sss"]
select * from t1 a,t1 b where element_at([a.c2],1)<>element_at([b.c2], 1) ;
c1	c2	c3	c4	c1	c2	c3	c4
1	[1,2,3,4]	[1.2,2.3,6.9,-1.02]	["中文ing123","1","1"]	2	[2,3,4,6]	[1.123,2.3126,2.3,-0.25]	[NULL,"a","sss"]
1	[1,2,3,4]	[1.2,2.3,6.9,-1.02]	["中文ing123","1","1"]	3	[7,1,5,9]	[0.12345,NULL,966.66]	["null","a","sss"]
2	[2,3,4,6]	[1.123,2.3126,2.3,-0.25]	[NULL,"a","sss"]	1	[1,2,3,4]	[1.2,2.3,6.9,-1.02]	["中文ing123","1","1"]
2	[2,3,4,6]	[1.123,2.3126,2.3,-0.25]	[NULL,"a","sss"]	3	[7,1,5,9]	[0.12345,NULL,966.66]	["null","a","sss"]
3	[7,1,5,9]	[0.12345,NULL,966.66]	["null","a","sss"]	1	[1,2,3,4]	[1.2,2.3,6.9,-1.02]	["中文ing123","1","1"]
3	[7,1,5,9]	[0.12345,NULL,966.66]	["null","a","sss"]	2	[2,3,4,6]	[1.123,2.3126,2.3,-0.25]	[NULL,"a","sss"]
drop table if exists t1;
drop materialized view if exists mv1;
CREATE TABLE t1 (c1 int primary key, c2 vector(8),c3 float[],c4 varchar(256)[]);
insert into t1 values(1,[1,2,3,4,1,2,3,4],[1.2,2.3,6.9,-1.02,1.2,2.3,6.9,-1.02],['中文ing123',1,'1','中文ing123',1,'1']);
insert into t1 values(2,[2,3,4,6,2,3,4,6],[1.123,2.3126,2.30,-0.25,1.123,2.3126,2.30,-0.25],[null,'a','sss',null,'a','sss']);
insert into t1 values(3,[7,1,5,9,7,1,5,9],[0.12345,null,966.66,0.12345,null,966.66],['null','a','sss','null','a','sss']);
insert into t1 values(4,null,null,null);
create materialized view mv1(primary key(c1))  as select * from t1;
select a.c2 from mv1 a,t1 b order by a.c1;
c2
NULL
NULL
NULL
NULL
[1,2,3,4,1,2,3,4]
[1,2,3,4,1,2,3,4]
[1,2,3,4,1,2,3,4]
[1,2,3,4,1,2,3,4]
[2,3,4,6,2,3,4,6]
[2,3,4,6,2,3,4,6]
[2,3,4,6,2,3,4,6]
[2,3,4,6,2,3,4,6]
[7,1,5,9,7,1,5,9]
[7,1,5,9,7,1,5,9]
[7,1,5,9,7,1,5,9]
[7,1,5,9,7,1,5,9]
select a.c1,element_at(a.c2,1) from mv1 a,t1 b order by a.c1;
c1	element_at(a.c2,1)
1	1
1	1
1	1
1	1
2	2
2	2
2	2
2	2
3	7
3	7
3	7
3	7
4	NULL
4	NULL
4	NULL
4	NULL
select count(*) from mv1 a,t1 b order by a.c1;
count(*)
16
select count(*) from mv1 a,t1 b,mv1 c order by a.c1;
count(*)
64
select count(*) from mv1 a,t1 b,mv1 c order by a.c1;
count(*)
64
select count(*) from mv1 a,t1 b order by a.c1;
count(*)
16
select count(array_distinct(a.c2)) from mv1 a,t1 b,mv1 c order by a.c1;
count(array_distinct(a.c2))
48
select count(*) from mv1 a,t1 b,mv1 c order by a.c1;
count(*)
64
select count(*) from mv1 a,t1 b order by a.c1;
count(*)
16
drop table if exists t1;
CREATE TABLE t1 (c1 int primary key, c2 vector(4),c3 float[],c4 varchar(256)[]);
insert into t1 values(1,[1,2,3,4],[1.2,2.3,6.9,-1.02],['中文ing123',1,'1']);
insert into t1 values(2,[2,3,4,6],[1.123,2.3126,2.30,-0.25],[null,'a','sss']);
insert into t1 values(3,[7,1,5,9],[0.12345,null,966.66],['null','a','sss']);
insert into t1 values(4,null,null,null);
select count(*) from t1 a,t1 b,t1 c ;
count(*)
64
drop table if exists t1;
CREATE TABLE t1 (c1 int primary key, c2 vector(4),c3 float[],c4 varchar(256)[]);
insert into t1 values(1,[1,2,3,4],[1.2,2.3,6.9,-1.02],['中文ing123',1,'1']);
insert into t1 values(2,[2,3,4,6],[1.123,2.3126,2.30,-0.25],[null,'a','sss']);
insert into t1 values(3,[7,1,5,9],[0.12345,null,966.66],['null','a','sss']);
insert into t1 values(4,null,null,null);
select c1,c2,count(c2),element_at(c2,3) from t1 group by element_at([1,2,3,4,5,6],6) order by c1;
c1	c2	count(c2)	element_at(c2,3)
1	[1,2,3,4]	3	3
select * from t1 group by c1 having element_at([1,2,3,4,5,6],6)  order by c1;
c1	c2	c3	c4
1	[1,2,3,4]	[1.2,2.3,6.9,-1.02]	["中文ing123","1","1"]
2	[2,3,4,6]	[1.123,2.3126,2.3,-0.25]	[NULL,"a","sss"]
3	[7,1,5,9]	[0.12345,NULL,966.66]	["null","a","sss"]
4	NULL	NULL	NULL
select c1,c3,c4 from t1 group by c1 having element_at([c4],1)  order by c1;
ERROR 22000: Invalid data type for the operation
select c1,c3,c4 from t1 group by c1 having element_at(c3,1)  order by c1;
c1	c3	c4
1	[1.2,2.3,6.9,-1.02]	["中文ing123","1","1"]
2	[1.123,2.3126,2.3,-0.25]	[NULL,"a","sss"]
3	[0.12345,NULL,966.66]	["null","a","sss"]
drop table if exists t1;
CREATE TABLE t1 (c1 int primary key, c2 int[],c3 float[],c4 varchar(256)[]);
insert into t1 values(1,[1,2,3,4],[1.2,2.3,6.9,-1.02],['中文ing123',1,'1']);
insert into t1 values(2,[2,3,4,6],[1.123,2.3126,2.30,-0.25],[null,'a','sss']);
insert into t1 values(3,[7,1,5,9],[0.12345,null,966.66],['null','a','sss']);
insert into t1 values(4,[2,3,2,5],[2,3,3,5],[2,3,4,5]);
insert into t1 values(5,null,null,null);
select c1,(select element_at(t1.c4,1) from t1 order by c1 limit 1) from t1 order by c1;
c1	(select element_at(t1.c4,1) from t1 order by c1 limit 1)
1	中文ing123
2	中文ing123
3	中文ing123
4	中文ing123
5	中文ing123
select c1 from (select c1,element_at(c2+c3,1) c2 from t1 order by c1 limit 1) a order by a.c1;
c1
1
select element_at(c2,2)  from (select c1,element_at([c2],1) c2 from t1 order by c1 limit 1) a order by a.c1;
element_at(c2,2)
2
select element_at(t1.c2,2) from t1,(select c1,element_at([c2],1) c2 from t1 order by c1 limit 1) a where a.c1=t1.c1 order by a.c1;
element_at(t1.c2,2)
2
drop table if exists t1;
CREATE TABLE t1 (c1 int primary key, c2 int[],c3 float[],c4 varchar(256)[]);
insert into t1 values(1,[1,false],[1.123,null,96666],['中文ing123',1,'1']);
insert into t1 values(2,[0,0,99999,null],[0.12345,null,966.66],[null,'a','sss']);
insert into t1 values(3,[0,0,99999,null],[0.12345,null,966.66],['null','a','sss']);
insert into t1 values(4,[2,3,2,5],[2,3,3,5],[2,3,4,5]);
select * from t1 order by element_at([c2],1);
ERROR 22000: Invalid data type for the operation
select * from t1 order by element_at(null,null);
c1	c2	c3	c4
1	[1,0]	[1.123,NULL,96666]	["中文ing123","1","1"]
2	[0,0,99999,NULL]	[0.12345,NULL,966.66]	[NULL,"a","sss"]
3	[0,0,99999,NULL]	[0.12345,NULL,966.66]	["null","a","sss"]
4	[2,3,2,5]	[2,3,3,5]	["2","3","4","5"]
select * from t1 order by element_at(c2,1);
c1	c2	c3	c4
2	[0,0,99999,NULL]	[0.12345,NULL,966.66]	[NULL,"a","sss"]
3	[0,0,99999,NULL]	[0.12345,NULL,966.66]	["null","a","sss"]
1	[1,0]	[1.123,NULL,96666]	["中文ing123","1","1"]
4	[2,3,2,5]	[2,3,3,5]	["2","3","4","5"]
select * from t1 order by element_at(c3,1);
c1	c2	c3	c4
2	[0,0,99999,NULL]	[0.12345,NULL,966.66]	[NULL,"a","sss"]
3	[0,0,99999,NULL]	[0.12345,NULL,966.66]	["null","a","sss"]
1	[1,0]	[1.123,NULL,96666]	["中文ing123","1","1"]
4	[2,3,2,5]	[2,3,3,5]	["2","3","4","5"]
select * from t1 order by element_at(c4,1);
c1	c2	c3	c4
2	[0,0,99999,NULL]	[0.12345,NULL,966.66]	[NULL,"a","sss"]
4	[2,3,2,5]	[2,3,3,5]	["2","3","4","5"]
3	[0,0,99999,NULL]	[0.12345,NULL,966.66]	["null","a","sss"]
1	[1,0]	[1.123,NULL,96666]	["中文ing123","1","1"]
select * from t1 order by element_at(c4,(select c1));
c1	c2	c3	c4
4	[2,3,2,5]	[2,3,3,5]	["2","3","4","5"]
2	[0,0,99999,NULL]	[0.12345,NULL,966.66]	[NULL,"a","sss"]
3	[0,0,99999,NULL]	[0.12345,NULL,966.66]	["null","a","sss"]
1	[1,0]	[1.123,NULL,96666]	["中文ing123","1","1"]
select * from t1 order by element_at(c2,1) desc ;
c1	c2	c3	c4
4	[2,3,2,5]	[2,3,3,5]	["2","3","4","5"]
1	[1,0]	[1.123,NULL,96666]	["中文ing123","1","1"]
2	[0,0,99999,NULL]	[0.12345,NULL,966.66]	[NULL,"a","sss"]
3	[0,0,99999,NULL]	[0.12345,NULL,966.66]	["null","a","sss"]
select * from t1 order by element_at(c3,1) desc;
c1	c2	c3	c4
4	[2,3,2,5]	[2,3,3,5]	["2","3","4","5"]
1	[1,0]	[1.123,NULL,96666]	["中文ing123","1","1"]
2	[0,0,99999,NULL]	[0.12345,NULL,966.66]	[NULL,"a","sss"]
3	[0,0,99999,NULL]	[0.12345,NULL,966.66]	["null","a","sss"]
select * from t1 order by element_at(c4,1) desc;
c1	c2	c3	c4
1	[1,0]	[1.123,NULL,96666]	["中文ing123","1","1"]
3	[0,0,99999,NULL]	[0.12345,NULL,966.66]	["null","a","sss"]
4	[2,3,2,5]	[2,3,3,5]	["2","3","4","5"]
2	[0,0,99999,NULL]	[0.12345,NULL,966.66]	[NULL,"a","sss"]
select * from t1 order by element_at(c4,(select c1)) desc;
c1	c2	c3	c4
1	[1,0]	[1.123,NULL,96666]	["中文ing123","1","1"]
3	[0,0,99999,NULL]	[0.12345,NULL,966.66]	["null","a","sss"]
2	[0,0,99999,NULL]	[0.12345,NULL,966.66]	[NULL,"a","sss"]
4	[2,3,2,5]	[2,3,3,5]	["2","3","4","5"]
select * from t1 order by element_at(c2,1) asc ;
c1	c2	c3	c4
2	[0,0,99999,NULL]	[0.12345,NULL,966.66]	[NULL,"a","sss"]
3	[0,0,99999,NULL]	[0.12345,NULL,966.66]	["null","a","sss"]
1	[1,0]	[1.123,NULL,96666]	["中文ing123","1","1"]
4	[2,3,2,5]	[2,3,3,5]	["2","3","4","5"]
select * from t1 order by element_at(c3,1) asc;
c1	c2	c3	c4
2	[0,0,99999,NULL]	[0.12345,NULL,966.66]	[NULL,"a","sss"]
3	[0,0,99999,NULL]	[0.12345,NULL,966.66]	["null","a","sss"]
1	[1,0]	[1.123,NULL,96666]	["中文ing123","1","1"]
4	[2,3,2,5]	[2,3,3,5]	["2","3","4","5"]
select * from t1 order by element_at(c4,1) asc;
c1	c2	c3	c4
2	[0,0,99999,NULL]	[0.12345,NULL,966.66]	[NULL,"a","sss"]
4	[2,3,2,5]	[2,3,3,5]	["2","3","4","5"]
3	[0,0,99999,NULL]	[0.12345,NULL,966.66]	["null","a","sss"]
1	[1,0]	[1.123,NULL,96666]	["中文ing123","1","1"]
select * from t1 order by element_at(c4,(select c1)) asc;
c1	c2	c3	c4
4	[2,3,2,5]	[2,3,3,5]	["2","3","4","5"]
2	[0,0,99999,NULL]	[0.12345,NULL,966.66]	[NULL,"a","sss"]
3	[0,0,99999,NULL]	[0.12345,NULL,966.66]	["null","a","sss"]
1	[1,0]	[1.123,NULL,96666]	["中文ing123","1","1"]
drop table if exists t1;
CREATE TABLE t1 (c1 int primary key, c2 int[],c3 float[],c4 varchar(256)[]);
insert into t1 values(1,[1,2,3,5],[2.123,2.123,3.123,4.123],['中文ing123',1,'1']);
insert into t1 values(2,[2,3,4,4],[2.123,2.123,3.123,4.123],[null,'a','sss']);
insert into t1 values(3,[3,3,3,3],[3.123,2.123,3.123,4.123],['null','a','sss']);
insert into t1 values(4,[2,3,4,5],[4.123,2.123,3.123,4.123],[2,3,4,5]);
insert into t1 values(5,null,null,null);
select element_at(c2+c2,1) from t1 order by c1;
element_at(c2+c2,1)
2
4
6
4
NULL
select element_at(c3+c2,1) from t1 order by c1;
element_at(c3+c2,1)
3.122999906539917
4.122999906539917
6.122999906539917
6.123000144958496
NULL
select element_at(c4+c2,1) from t1 order by c1;
ERROR HY000: Invalid argument
select element_at(c2,2) + element_at(c2,3) from t1 order by c1;
element_at(c2,2) + element_at(c2,3)
5
7
6
7
NULL
select element_at(c2,3) - element_at(c2,2) from t1 order by c1;
element_at(c2,3) - element_at(c2,2)
1
1
0
1
NULL
select element_at(c2,4) * element_at(c2,4) from t1 order by c1;
element_at(c2,4) * element_at(c2,4)
25
16
9
25
NULL
select element_at(c2,1) / element_at(c2,2) from t1 order by c1;
element_at(c2,1) / element_at(c2,2)
0.5000
0.6667
1.0000
0.6667
NULL
select element_at(c2,2) + element_at(c2,3) - element_at(c3,3) from t1 order by c1;
element_at(c2,2) + element_at(c2,3) - element_at(c3,3)
1.877000093460083
3.877000093460083
2.877000093460083
3.877000093460083
NULL
select element_at(c2,3) - element_at(c2,2) - element_at(c3,3) from t1 order by c1;
element_at(c2,3) - element_at(c2,2) - element_at(c3,3)
-2.122999906539917
-2.122999906539917
-3.122999906539917
-2.122999906539917
NULL
select element_at(c2,4) * element_at(c2,4) - element_at(c3,3) from t1 order by c1;
element_at(c2,4) * element_at(c2,4) - element_at(c3,3)
21.877000093460083
12.877000093460083
5.877000093460083
21.877000093460083
NULL
select element_at(c2,1) / element_at(c2,2) - element_at(c3,3) from t1 order by c1;
element_at(c2,1) / element_at(c2,2) - element_at(c3,3)
-2.622999906539917
-2.4563332405399168
-2.122999906539917
-2.4563332405399168
NULL
select element_at(c2,2) + element_at(c2,3) / element_at(c3,3) from t1 order by c1;
element_at(c2,2) + element_at(c2,3) / element_at(c3,3)
2.9606148222155433
4.280819762954057
3.9606148222155433
4.280819762954057
NULL
select element_at(c2,3) - element_at(c2,2) * element_at(c3,3) from t1 order by c1;
element_at(c2,3) - element_at(c2,2) * element_at(c3,3)
-3.245999813079834
-5.368999719619751
-6.368999719619751
-5.368999719619751
NULL
select element_at(c2,4) * element_at(c2,4) - element_at(c3,3) from t1 order by c1;
element_at(c2,4) * element_at(c2,4) - element_at(c3,3)
21.877000093460083
12.877000093460083
5.877000093460083
21.877000093460083
NULL
select element_at(c2,1) / element_at(c2,2) + element_at(c3,3) from t1 order by c1;
element_at(c2,1) / element_at(c2,2) + element_at(c3,3)
3.622999906539917
3.7896665725399172
4.122999906539917
3.7896665725399172
NULL
drop table if exists t1;
CREATE TABLE t1 (c1 int primary key, c2 int[],c3 float[],c4 varchar(256)[]);
insert into t1 values(1,[1,2,3,5],[2.123,2.123,3.123,4.123],['中文ing123',1,'1']);
insert into t1 values(2,[2,3,4,4],[2.123,2.123,3.123,4.123],[null,'a','sss']);
insert into t1 values(3,[3,3,3,3],[3.123,2.123,3.123,4.123],['null','a','sss']);
insert into t1 values(4,[2,3,4,5],[4.123,2.123,3.123,4.123],[2,3,4,5]);
insert into t1 values(5,null,null,null);
select element_at(c2,cast(1 as json)) from t1 order by c1;
element_at(c2,cast(1 as json))
1
2
3
2
NULL
select element_at(c2,cast(1 as date)) from t1 order by c1;
element_at(c2,cast(1 as date))
NULL
NULL
NULL
NULL
NULL
select element_at(c2,cast(1 as TIME)) from t1 order by c1;
element_at(c2,cast(1 as TIME))
1
2
3
2
NULL
select element_at(c2,cast(1 as DATETIME(4))) from t1 order by c1;
element_at(c2,cast(1 as DATETIME(4)))
NULL
NULL
NULL
NULL
NULL
select element_at(c2,cast(1 as DECIMAL(10,2))) from t1 order by c1;
element_at(c2,cast(1 as DECIMAL(10,2)))
1
2
3
2
NULL
select element_at(c2,cast(1 as char(20))) from t1 order by c1;
element_at(c2,cast(1 as char(20)))
1
2
3
2
NULL
select element_at(c2,cast(1 as UNSIGNED)) from t1 order by c1;
element_at(c2,cast(1 as UNSIGNED))
1
2
3
2
NULL
select element_at(c2,cast(1 AS CHAR CHARACTER SET gbk)) from t1 order by c1;
element_at(c2,cast(1 AS CHAR CHARACTER SET gbk))
1
2
3
2
NULL
drop table if exists t1;
CREATE TABLE t1 (c1 int primary key, c2 int[],c3 float[],c4 varchar(256)[]);
insert into t1 values(1,[1,2,3,5],[2.123,2.123,3.123,4.123],['中文ing123',1,'1']);
insert into t1 values(2,[2,3,4,4],[2.123,2.123,3.123,4.123],[null,'a','sss']);
insert into t1 values(3,[3,3,3,3],[3.123,2.123,3.123,4.123],['null','a','sss']);
insert into t1 values(4,[2,3,4,5],[4.123,2.123,3.123,4.123],[2,3,4,5]);
insert into t1 values(5,null,null,null);
select  distinct element_at(c4,2) from t1 order by c1;
element_at(c4,2)
1
a
3
NULL
select  element_at(c2,(select distinct element_at(c2,1) from t1 order by c1 limit 1)) from t1 order by c1;
element_at(c2,(select distinct element_at(c2,1) from t1 order by c1 limit 1))
1
2
3
2
NULL
select  element_at(distinct c2,1) from t1 order by c1;
ERROR 42000: You have an error in your SQL syntax; check the manual that corresponds to your OceanBase version for the right syntax to use near 'distinct c2,1) from t1 order by c1' at line 1
select  element_at((select c2 from t1 order by c1 limit 1),1) from t1 order by c1;
element_at((select c2 from t1 order by c1 limit 1),1)
1
1
1
1
1
select  element_at((select [c4] from t1 order by c1 limit 1),1) from t1 order by c1;
element_at((select [c4] from t1 order by c1 limit 1),1)
["中文ing123","1","1"]
["中文ing123","1","1"]
["中文ing123","1","1"]
["中文ing123","1","1"]
["中文ing123","1","1"]
select  element_at((select [[c4]] from t1 order by c1 limit 1),1) from t1 order by c1;
element_at((select [[c4]] from t1 order by c1 limit 1),1)
[["中文ing123","1","1"]]
[["中文ing123","1","1"]]
[["中文ing123","1","1"]]
[["中文ing123","1","1"]]
[["中文ing123","1","1"]]
drop table if exists t1;
CREATE TABLE t1 (c1 int primary key, c2 int[],c3 float[],c4 varchar(256)[]);
insert into t1 values(1,[1,2,3,5],[2.123,2.123,3.123,4.123],['中文ing123',1,'1']);
insert into t1 values(2,[2,3,4,4],[2.123,2.123,3.123,4.123],[null,'a','sss']);
insert into t1 values(3,[3,3,3,3],[3.123,2.123,3.123,4.123],['null','a','sss']);
insert into t1 values(4,[2,3,4,5],[4.123,2.123,3.123,4.123],[2,3,4,5]);
insert into t1 values(5,null,null,null);
select element_at(c2,max(c1)-1) from t1 order by c1;
element_at(c2,max(c1)-1)
5
select element_at(c2,min(c1)) from t1 order by c1;
element_at(c2,min(c1))
1
select element_at(c2,avg(c1)) from t1 order by c1;
element_at(c2,avg(c1))
3
select element_at(c2,count(c1)) from t1 order by c1;
element_at(c2,count(c1))
NULL
select element_at(c2,sum(c1)) from t1 order by c1;
element_at(c2,sum(c1))
NULL
select max(element_at(c2,1)) from t1 order by c1;
max(element_at(c2,1))
3
select min(element_at(c2,1)) from t1 order by c1;
min(element_at(c2,1))
1
select count(element_at(c2,1)) from t1 order by c1;
count(element_at(c2,1))
4
select avg(element_at(c2,1)) from t1 order by c1;
avg(element_at(c2,1))
2.0000
select count(element_at(c2,1)) from t1 order by c1;
count(element_at(c2,1))
4
select max(element_at(c3,1)) from t1 order by c1;
max(element_at(c3,1))
4.123
select min(element_at(c3,1)) from t1 order by c1;
min(element_at(c3,1))
2.123
select count(element_at(c3,1)) from t1 order by c1;
count(element_at(c3,1))
4
select avg(element_at(c3,1)) from t1 order by c1;
avg(element_at(c3,1))
2.8729999661445618
select sum(element_at(c3,1)) from t1 order by c1;
sum(element_at(c3,1))
11.491999864578247
select max(element_at(c3,1)) + min(element_at(c3,1)) from t1 order by c1;
max(element_at(c3,1)) + min(element_at(c3,1))
6.246000051498413
select max(element_at([c3],1)) from t1 order by c1;
ERROR HY000: Invalid argument
select min(element_at([c3],1)) from t1 order by c1;
ERROR HY000: Invalid argument
select count(element_at([c3],1)) from t1 order by c1;
count(element_at([c3],1))
4
select avg(element_at([c3],1)) from t1 order by c1;
ERROR 0A000: Not supported feature or function
select sum(element_at([c3],1)) from t1 order by c1;
ERROR 0A000: Not supported feature or function
drop table if exists t1;
CREATE TABLE t1 (c1 int primary key, c2 int[],c3 float[],c4 varchar(256)[]);
insert into t1 values(1,[1,2,3,5],[2.123,2.123,3.123,4.123],['中文ing123',1,'1']);
insert into t1 values(2,[2,3,4,4],[2.123,2.123,3.123,4.123],[null,'a','sss']);
insert into t1 values(3,[3,3,3,3],[3.123,2.123,3.123,4.123],['null','a','sss']);
insert into t1 values(4,[2,3,4,5],[4.123,2.123,3.123,4.123],[2,3,4,5]);
insert into t1 values(5,null,null,null);
drop table if exists t2;
create table t2 like t1;
replace into t2 select * from t1;
select array_map((x) -> (x), [(select element_at(c2,2) from t1 order by c1 limit 1)]);
array_map((x) -> (x), [(select element_at(c2,2) from t1 order by c1 limit 1)])
[2]
select array_map((x) -> (x), [(select element_at(c3,2) from t1 order by c1 limit 1)]);
array_map((x) -> (x), [(select element_at(c3,2) from t1 order by c1 limit 1)])
[2.123]
select array_map((x) -> (x), [(select element_at(c4,2) from t1 order by c1 limit 1)]);
array_map((x) -> (x), [(select element_at(c4,2) from t1 order by c1 limit 1)])
["1"]
with ct1 as(
select element_at(c2,2) from t1 order by c1)
select element_at(c2,2) from t1 where c3 is not null order by c1 ;
element_at(c2,2)
2
3
3
3
with ct1 as(
select  element_at(t1.c4,2) from t1 order by c1)
select  t1.c1,t2.c2,element_at(t1.c4,2) from t1 join t2 on element_at(t1.c4,2)=element_at(t1.c4,2) order by t1.c1,t1.c2;
c1	c2	element_at(t1.c4,2)
1	NULL	1
1	[1,2,3,5]	1
1	[2,3,4,4]	1
1	[2,3,4,5]	1
1	[3,3,3,3]	1
2	NULL	a
2	[1,2,3,5]	a
2	[2,3,4,4]	a
2	[2,3,4,5]	a
2	[3,3,3,3]	a
3	NULL	a
3	[1,2,3,5]	a
3	[2,3,4,4]	a
3	[2,3,4,5]	a
3	[3,3,3,3]	a
4	NULL	3
4	[1,2,3,5]	3
4	[2,3,4,4]	3
4	[2,3,4,5]	3
4	[3,3,3,3]	3
with ct1 as(
select  element_at(t1.c4,2) from t1 order by c1)
select  t1.c1,t2.c2,element_at(t1.c4,2) from t1 join t2 on element_at(t1.c4,2)<>element_at(t1.c4,2) order by t1.c1,t1.c2;
c1	c2	element_at(t1.c4,2)
SELECT count(c4), CASE WHEN element_at([t1.c4],1)=['中文ing123',1,'1'] THEN [1,2,3] ELSE [2,3,4] END AS A FROM T1;
count(c4)	A
4	[1,2,3]
SELECT count(c1), CASE WHEN element_at([t1.c4],1)=['中文ing123',1,'1'] THEN element_at(t1.c4,2) ELSE element_at(t1.c3,3) END AS A FROM T1;
count(c1)	A
5	1
drop table if exists t1;
CREATE TABLE t1 (c1 int primary key, c2 int[],c3 float[],c4 varchar(256)[]);
insert into t1 values(1,[1,2,3,5],[2.123,2.123,3.123,4.123],['中文ing123',1,'1']);
insert into t1 values(2,[2,3,4,4],[2.123,2.123,3.123,4.123],[null,'a','sss']);
insert into t1 values(3,[3,3,3,3],[3.123,2.123,3.123,4.123],['null','a','sss']);
insert into t1 values(4,[2,3,4,5],[4.123,2.123,3.123,4.123],[2,3,4,5]);
insert into t1 values(5,null,null,null);
drop table if exists t2;
create table t2 like t1;
replace into t2 select * from t1;
select * from t1 limit element_at(c2,2);
ERROR 42000: You have an error in your SQL syntax; check the manual that corresponds to your OceanBase version for the right syntax to use near 'element_at(c2,2)' at line 1
select element_at(c2,2)  from t1 order by c1 limit 10000000000000000000;
element_at(c2,2)
2
3
3
3
NULL
select element_at([c2],1)  from t1 order by c1 limit 10000000000000000000;
element_at([c2],1)
[1,2,3,5]
[2,3,4,4]
[3,3,3,3]
[2,3,4,5]
NULL
drop table if exists t1;
CREATE TABLE t1 (c1 int primary key, c2 int[],c3 float[],c4 varchar(256)[]);
insert into t1 values(1,[1,2,3,5],[2.123,2.123,3.123,4.123],['中文ing123',1,'1']);
insert into t1 values(2,[2,3,4,4],[2.123,2.123,3.123,4.123],[null,'a','sss']);
insert into t1 values(3,[3,3,3,3],[3.123,2.123,3.123,4.123],['null','a','sss']);
insert into t1 values(4,[2,3,4,5],[4.123,2.123,3.123,4.123],[2,3,4,5]);
insert into t1 values(5,null,null,null);
drop table if exists t2;
create table t2 like t1;
replace into t2 select * from t1;
select c1,c2,c3,c4,element_at(c4,1) from t1 where element_at(c4,1) = '中文ing123' ;
c1	c2	c3	c4	element_at(c4,1)
1	[1,2,3,5]	[2.123,2.123,3.123,4.123]	["中文ing123","1","1"]	中文ing123
select c1,c2,c3,c4,element_at(c4,1) from t1 where element_at(c4,1) = '中文ing123' for update;
c1	c2	c3	c4	element_at(c4,1)
1	[1,2,3,5]	[2.123,2.123,3.123,4.123]	["中文ing123","1","1"]	中文ing123
select c1,c2,c3,c4,element_at(c4,1) from t1 where element_at([c4],1) = ['中文ing123',1,'1'] ;
c1	c2	c3	c4	element_at(c4,1)
1	[1,2,3,5]	[2.123,2.123,3.123,4.123]	["中文ing123","1","1"]	中文ing123
select c1,c2,c3,c4,element_at(c4,1) from t1 where element_at([c4],1) = ['中文ing123',1,'1'] for update;
c1	c2	c3	c4	element_at(c4,1)
1	[1,2,3,5]	[2.123,2.123,3.123,4.123]	["中文ing123","1","1"]	中文ing123
select /*+ ENABLE_PARALLEL_DML PARALLEL(3) */c1,c2,c3,c4,element_at(c4,1) from t1 where element_at([c4],1) = ['中文ing123',1,'1'] for update;
c1	c2	c3	c4	element_at(c4,1)
1	[1,2,3,5]	[2.123,2.123,3.123,4.123]	["中文ing123","1","1"]	中文ing123
drop table if exists t1;
CREATE TABLE t1 (c1 int primary key, c2 int[],c3 float[],c4 varchar(256)[]);
insert into t1 values(1,[1,2,3,5],[2.123,2.123,3.123,4.123],['中文ing123',1,'1']);
insert into t1 values(2,[2,3,4,4],[2.123,2.123,3.123,4.123],[null,'a','sss']);
insert into t1 values(3,[3,3,3,3],[3.123,2.123,3.123,4.123],['null','a','sss']);
insert into t1 values(4,[2,3,4,5],[4.123,2.123,3.123,4.123],[2,3,4,5]);
insert into t1 values(5,null,null,null);
drop table if exists t2;
create table t2 like t1;
replace into t2 select * from t1;
select element_at(c4,1) a   from t1 order by t1.c1  ;
a
中文ing123
NULL
null
2
NULL
select /*+ ENABLE_PARALLEL_DML PARALLEL(3) */element_at(c4,1)  a from t1 order by t1.c1;
a
中文ing123
NULL
null
2
NULL
select element_at(c4,1) x ,element_at(c4,1) x, element_at(c4,1) x from t1 order by t1.c1  ;
x	x	x
中文ing123	中文ing123	中文ing123
NULL	NULL	NULL
null	null	null
2	2	2
NULL	NULL	NULL
select element_at(c4,1) 中文中文中文中文中文中文,element_at(c4,1) 中文中文中文中文中文中文 from t1 order by t1.c1  ;
中文中文中文中文中文中文	中文中文中文中文中文中文
中文ing123	中文ing123
NULL	NULL
null	null
2	2
NULL	NULL
drop table if exists t1;
CREATE TABLE t1 (c1 int primary key, c2 int[],c3 float[],c4 varchar(256)[]);
insert into t1 values(1,[1,2,3,5],[2.123,2.123,3.123,4.123],['中文ing123',1,'1']);
insert into t1 values(2,[2,3,4,4],[2.123,2.123,3.123,4.123],[null,'a','sss']);
insert into t1 values(3,[3,3,3,3],[3.123,2.123,3.123,4.123],['null','a','sss']);
insert into t1 values(4,[2,3,4,5],[4.123,2.123,3.123,4.123],[2,3,4,5]);
insert into t1 values(5,null,null,null);
drop table if exists t2;
create table t2 like t1;
replace into t2 select * from t1;
SELECT avg(C1) OVER (PARTITION BY element_at(c4,1)) FROM T1  order by c1;
avg(C1) OVER (PARTITION BY element_at(c4,1))
1.0000
3.5000
3.0000
4.0000
3.5000
SELECT sum(C2) OVER (PARTITION BY element_at(c4,1)) FROM T1  order by c1;
ERROR 0A000: Not supported feature or function
SELECT count(C1) OVER (PARTITION BY element_at(c4,1)) FROM T1  order by c1;
count(C1) OVER (PARTITION BY element_at(c4,1))
1
2
1
1
2
SELECT min(C1) OVER (PARTITION BY element_at(c4,1)) FROM T1 order by c1 ;
min(C1) OVER (PARTITION BY element_at(c4,1))
1
2
3
4
2
SELECT max(C1) OVER (PARTITION BY element_at(c4,1)) FROM T1  order by c1;
max(C1) OVER (PARTITION BY element_at(c4,1))
1
5
3
4
5
drop table if exists t1;
CREATE TABLE t1 (c1 int primary key, c2 int[],c3 float[],c4 varchar(256)[][]);
insert into t1 values(1,[1,2,3,5],[2.123,2.123,3.123,4.123],[['中文ing123',1,'1']]);
insert into t1 values(2,[2,3,4,4],[2.123,2.123,3.123,4.123],[[null,'a','sss']]);
insert into t1 values(3,[3,3,3,3],[3.123,2.123,3.123,4.123],[['null','a','sss']]);
insert into t1 values(4,[2,3,4,5],[4.123,2.123,3.123,4.123],[[2,3,4,5]]);
insert into t1 values(5,null,null,null);
update t1 set c1=38 where c2=element_at(c4,1);
update t1 set c1=element_at([1,5,3,8,5],4) where c1=1;
update t1 set c2=element_at([[1,5,3,8,5]],1) where c1=2;
update t1 set c2=element_at([[1,5,3,8,5]],1) where c2 is not null;
update t1 set c4=element_at([[[1,5,3,8,5]]],1) where c1 =5;
update t1 set c4=(select element_at([c4],1) from t1 order by c1 limit 1) where c1 =5;
truncate table t1;
select * from t1 order by c1;
c1	c2	c3	c4
drop table if exists t1;
CREATE TABLE t1 (c1 int primary key, c2 int[],c3 float[],c4 varchar(256)[][]);
insert into t1 values(1,[1,2,3,5],[2.123,2.123,3.123,4.123],[['中文ing123',1,'1']]);
insert into t1 values(2,[2,3,4,4],[2.123,2.123,3.123,4.123],[[null,'a','sss']]);
insert into t1 values(3,[3,3,3,3],[3.123,2.123,3.123,4.123],[['null','a','sss']]);
insert into t1 values(4,[2,3,4,5],[4.123,2.123,3.123,4.123],[[2,3,4,5]]);
insert into t1 values(5,null,null,null);
update /*+enable_parallel_dml parallel(2) */t1 set c1=38 where c2=element_at(c4,1);
update /*+enable_parallel_dml parallel(2) */t1 set c1=element_at([1,5,3,8,5],4) where c1=1;
update /*+enable_parallel_dml parallel(2) */t1 set c2=element_at([[1,5,3,8,5]],1) where c1=2;
update /*+enable_parallel_dml parallel(2) */t1 set c2=element_at([[1,5,3,8,5]],1) where c2 is not null;
update /*+enable_parallel_dml parallel(2) */t1 set c4=element_at([[[1,5,3,8,5]]],1) where c1 =5;
update /*+enable_parallel_dml parallel(2) */t1 set c4=(select element_at([c4],1) from t1 order by c1 limit 1) where c1 =5;
truncate table t1;
select * from t1 order by c1;
c1	c2	c3	c4
drop table if exists t1;
CREATE TABLE t1 (c1 int primary key, c2 int[],c3 float[],c4 varchar(256)[][]);
insert into t1 values(1,[1,2,3,5],[2.123,2.123,3.123,4.123],[['中文ing123',1,'1']]);
insert into t1 values(2,[2,3,4,4],[2.123,2.123,3.123,4.123],[[null,'a','sss']]);
insert into t1 values(3,[3,3,3,3],[3.123,2.123,3.123,4.123],[['null','a','sss']]);
insert into t1 values(4,[2,3,4,5],[4.123,2.123,3.123,4.123],[[2,3,4,5]]);
insert into t1 values(5,null,null,null);
update /*+read_consistency(weak) */t1 set c1=38 where c2=element_at(c4,1);
update /*+read_consistency(weak) */t1 set c1=element_at([1,5,3,8,5],4) where c1=1;
update /*+read_consistency(weak) */t1 set c2=element_at([[1,5,3,8,5]],1) where c1=2;
update /*+read_consistency(weak) */t1 set c2=element_at([[1,5,3,8,5]],1) where c2 is not null;
update /*+read_consistency(weak) */t1 set c4=element_at([[[1,5,3,8,5]]],1) where c1 =5;
update /*+read_consistency(weak) */t1 set c4=(select element_at([c4],1) from t1 order by c1 limit 1) where c1 =5;
truncate table t1;
select * from t1 order by c1;
c1	c2	c3	c4
drop table if exists t1;
CREATE TABLE t1 (c1 int primary key, c2 int[],c3 float[],c4 varchar(256)[][]);
insert into t1 values(1,[1,2,3,5],[2.123,2.123,3.123,4.123],[['中文ing123',1,'1']]);
insert into t1 values(2,[2,3,4,5],[2.123,2.123,3.123,4.123],[[null,'a','sss']]);
insert into t1 values(3,[3,3,3,3],[3.123,2.123,3.123,4.123],[['null','a','sss']]);
insert into t1 values(4,[2,3,4,5],[4.123,2.123,3.123,4.123],[[2,3,4,5]]);
insert into t1 values(5,null,null,null);
drop table if exists t2;
create table t2 like t1;
insert  into t2 select * from t1;
update t1 set t1.c2 =[1,2,4,2] where c1 in (select element_at(t1.c2,1) from t1 inner join t2 on t1.c2=t2.c2 order by t1.c1 limit 1,1);
update t1 set t1.c2 =[1,2,4,3] where c1 in (select element_at(c2,1));
update t1 join t2 on t1.c1 =t2.c1 set t1.c4 =element_at([[[1,2,3,4,5]]],1)  where t1.c3 is null;
select count(*) from t1,t2 where  element_at(t1.c4,1)= element_at(t2.c4,1);
count(*)
4
drop table if exists t1;
CREATE TABLE t1 (c1 int primary key, c2 int[],c3 float[],c4 varchar(256)[][]);
insert into t1 values(1,[1,2,3,5],[2.123,2.123,3.123,4.123],[['中文ing123',1,'1']]);
insert into t1 values(2,[2,3,4,5],[2.123,2.123,3.123,4.123],[[null,'a','sss']]);
insert into t1 values(3,[3,3,3,3],[3.123,2.123,3.123,4.123],[['null','a','sss']]);
insert into t1 values(4,[2,3,4,5],[4.123,2.123,3.123,4.123],[[2,3,4,5]]);
insert into t1 values(5,null,null,null);
drop table if exists t2;
create table t2 like t1;
insert  into t2 select * from t1;
update t1 set c1 = 10 where c3 is null;
update t1 set c4 = element_at([[t1.c2]],1)  where c1> 1 order by c1 limit 100;
drop table if exists t1;
CREATE TABLE t1 (c1 int primary key, c2 int[],c3 float[],c4 varchar(256)[][]);
insert into t1 values(1,[1,2,3,5],[2.123,2.123,3.123,4.123],[['中文ing123',1,'1']]);
insert into t1 values(2,[2,3,4,5],[2.123,2.123,3.123,4.123],[[null,'a','sss']]);
insert into t1 values(3,[3,3,3,3],[3.123,2.123,3.123,4.123],[['null','a','sss']]);
insert into t1 values(4,[2,3,4,5],[4.123,2.123,3.123,4.123],[[2,3,4,5]]);
insert into t1 values(5,null,null,null);
drop table if exists t2;
create table t2 like t1;
insert  into t2 select * from t1;
insert into t1(c1,c2,c3,c4) values(10,element_at([[1,2,3,4,5,5,6,6,7,7,745,345,345,2,3],[1,2,3,3]],2),element_at([[1,2,3,4,5,5,345,2,3]],1),element_at([[[1,2,3,4,5,5,6,6,7,7,745,345,345,2,3]]],1));
replace into t1(c1,c2,c3,c4) values(11,element_at([[1,2,3,4,5,5,6,6,7,7,745,345,345,2,3]],1),element_at([[1,2,3,4,5,345,2,3]],1),element_at([[[1,2,3,4,5,5,6,6,7,7,745,345,345,2,3]]],1));
replace into t1(c1,c2,c3,c4) values(11,element_at([[1,2,3,4,5,5,6,6,7,745,345,345,2,3]],1),element_at([[1,2,3,4,5,5,345,2,3]],1),element_at([[[1,2,3,4,5,5,6,6,7,7,745,345,345,2,3]]],1));
select count(*) from t1;
count(*)
7
drop table if exists t1;
CREATE TABLE t1 (c1 int AUTO_INCREMENT, c2 int[],c3 float[],c4 varchar(256)[][]);
insert into t1 values(1,[1,2,3,5],[2.123,2.123,3.123,4.123],[['中文ing123',1,'1']]);
insert into t1 values(2,[2,3,4,5],[2.123,2.123,3.123,4.123],[[null,'a','sss']]);
insert into t1 values(3,[3,3,3,3],[3.123,2.123,3.123,4.123],[['null','a','sss']]);
insert into t1 values(4,[2,3,4,5],[4.123,2.123,3.123,4.123],[[2,3,4,5]]);
drop table if exists t2;
CREATE TABLE t2 (c1 int primary key, c2 int[],c3 float[],c4 varchar(256)[]);
insert into t2 values(1,[1,2,3,5],[2.123,2.123,3.123,4.123],['中文ing123',1,'1']);
insert into t2 values(2,[2,3,4,5],[2.123,2.123,3.123,4.123],[null,'a','sss']);
insert into t2 values(3,[3,3,3,3],[3.123,2.123,3.123,4.123],['null','a','sss']);
insert into t2 values(4,[2,3,4,5],[4.123,2.123,3.123,4.123],[2,3,4,5]);
insert into t1(c4) select element_at([[[1,2,3,4,5,5,6,6,7,7,745,345,345,2,3],c2]],1) from t2;
replace into t1(c4) select element_at([[c2]],1) from t2;
select count(*) from t1;
count(*)
12
select count(*) from t2;
count(*)
4
drop table if exists t1;
CREATE TABLE t1 (c1 int AUTO_INCREMENT primary key, c2 int[],c3 float[],c4 varchar(256)[][]);
insert into t1(c2,c3,c4) values(element_at([[12,3,4,31,1]],1) + element_at([[12,3,4,31,1]],1),element_at([[12,3,4,31,2]],1)+element_at([[12,3,4,31,3]],1),element_at([[[12,3,4,31,'中文']]],1));
insert into t1(c2,c3,c4) values(element_at([[12,3,4,31,1]],1) + element_at([[12,3,4,31,1]],1),element_at([[12,3,4,31,2]],1)+element_at([[12,3,4,31,3]],1),element_at([[[12,3,4,31,'中文']]],1));
insert into t1(c2,c3,c4) values(element_at([[12,3,4,31,1]],1) + element_at([[12,3,4,31,1]],1),element_at([[12,3,4,31,2]],1)+element_at([[12,3,4,31,3]],1),element_at([[[12,3,4,31,'中文']]],1));
replace into t1(c2,c3,c4) values(element_at([[12,3,4,31,1]],1) + element_at([[12,3,4,31,1]],1),element_at([[12,3,4,31,2]],1)+element_at([[12,3,4,31,3]],1),element_at([[[12,3,4,31,'中文']]],1));
select c1,element_at([c2],1) from t1 order by c1;
c1	element_at([c2],1)
1	[24,6,8,62,2]
2	[24,6,8,62,2]
3	[24,6,8,62,2]
4	[24,6,8,62,2]
drop table if exists t1;
CREATE TABLE t1 (c1 int AUTO_INCREMENT primary key, c2 int[],c3 float[],c4 varchar(256)[][]);
insert IGNORE t1(c2,c3,c4) values(element_at([[12,3,4,31,1]],1) + element_at([[12,3,4,31,1]],1),element_at([[12,3,4,31,2]],1)+element_at([[12,3,4,31,3]],1),element_at([[[12,3,4,31,'中文']]],1));
insert IGNORE t1(c2,c3,c4) values(element_at([[12,3,4,31,1]],1) + element_at([[12,3,4,31,1]],1),element_at([[12,3,4,31,2]],1)+element_at([[12,3,4,31,3]],1),element_at([[[12,3,4,31,'中文']]],1));
insert IGNORE t1(c2,c3,c4) values(element_at([[12,3,4,31,1]],1) + element_at([[12,3,4,31,1]],1),element_at([[12,3,4,31,2]],1)+element_at([[12,3,4,31,3]],1),element_at([[[12,3,4,31,'中文']]],1));
replace IGNORE t1(c2,c3,c4) values(element_at([[12,3,4,31,1]],1) + element_at([[12,3,4,31,1]],1),element_at([[12,3,4,31,2]],1)+element_at([[12,3,4,31,3]],1),element_at([[[12,3,4,31,'中文']]],1));
ERROR 0A000: replace statement with ignore not supported
select c1,element_at([c2],1) from t1 order by c1;
c1	element_at([c2],1)
1	[24,6,8,62,2]
2	[24,6,8,62,2]
3	[24,6,8,62,2]
drop table if exists t1;
CREATE TABLE t1 (c1 int AUTO_INCREMENT primary key, c2 int[],c3 float[],c4 varchar(256)[][]);
insert into t1 values(1,[1,2,3,5],[2.123,2.123,3.123,4.123],[['中文ing123',1,'1']]);
insert into t1 values(2,[2,3,4,5],[2.123,2.123,3.123,4.123],[[null,'a','sss']]);
insert into t1 values(3,[3,3,3,3],[3.123,2.123,3.123,4.123],[['null','a','sss']]);
insert into t1 values(4,[2,3,4,5],[4.123,2.123,3.123,4.123],[[2,3,4,5]]);
insert into t1(c1) values(4) ON DUPLICATE KEY UPDATE c4 = element_at([[[12,3,4,31,'中文']]],1);
insert into t1(c1) values(5)ON DUPLICATE KEY UPDATE c2= element_at([[12,3,4,31,2],[1,2,3,4]],2);
insert into t1(c1) values(5)ON DUPLICATE KEY UPDATE c2= element_at([[12,3,4,31,2],[1,2,3,4]],2);
insert into t1(c2,c3,c4) values([1,2,3,3],[1,3,3,3],[[2,1,2,3]]) ON DUPLICATE KEY UPDATE c4=element_at([[[2,1,2,3]]],1);
insert into t1(c1) values(5) ON DUPLICATE KEY UPDATE c4 = element_at([[[12,3,4,31,'中文']]],1);
select count(element_at(c2,1)) from t1 order by c1;
count(element_at(c2,1))
6
drop table if exists t1;
CREATE TABLE t1 (c1 int AUTO_INCREMENT primary key, c2 int[],c3 float[],c4 varchar(256)[][]);
insert into t1 values(1,[1,2,3,5],[2.123,2.123,3.123,4.123],[['中文ing123',1,'1']]);
insert into t1 values(2,[2,3,4,5],[2.123,2.123,3.123,4.123],[[null,'a','sss']]);
insert into t1 values(3,[3,3,3,3],[3.123,2.123,3.123,4.123],[['null','a','sss']]);
insert into t1 values(4,[2,3,4,5],[4.123,2.123,3.123,4.123],[[2,3,4,5]]);
insert into t1(c1) values(5) ;
insert /*+ parallel(10) */ overwrite t1(c4) select element_at([[[12,3,4,31,'中文']]],1) from t1 where c1>2;
insert /*+ parallel(10) */ overwrite t1(c4) select element_at([[[12,3,4,31,'中文']]],1) from t1 where c1>2;
insert /*+ parallel(10) */ overwrite t1(c2) select element_at([[12,3,4,31]],1) from t1 where c1>2;
insert /*+ parallel(10) */ overwrite t1(c2) select element_at([[12,3,4,32]],1);
select * from t1;
c1	c2	c3	c4
15	[12,3,4,32]	NULL	NULL
drop table if exists t1;
drop view if exists v1;
CREATE TABLE t1 (c1 int AUTO_INCREMENT , c2 int[],c3 float[],c4 varchar(256)[][]);
insert into t1 values(1,[1,2,3,5],[2.123,2.123,3.123,4.123],[['中文ing123',1,'1']]);
insert into t1 values(2,[2,3,4,5],[2.123,2.123,3.123,4.123],[[null,'a','sss']]);
insert into t1 values(3,[3,3,3,3],[3.123,2.123,3.123,4.123],[['null','a','sss']]);
insert into t1 values(4,[2,3,4,5],[4.123,2.123,3.123,4.123],[[2,3,4,5]]);
insert into t1(c1) values(5) ;
create view v1 as select c2 from t1;
insert /*+ direct(true,100) enable_parallel_dml parallel(2)*/ into v1 select element_at([[12,3,4,32]],1) from t1;
insert /*+ direct(true,100) enable_parallel_dml parallel(2) append*/ into t1(c2) select element_at([[12,3,4,32]],1) from t1;
insert /*+ direct(true,100) enable_parallel_dml parallel(2) append*/ into t1(c4) select element_at([[[12,3,4,31,'中文']]],1) from t1;
insert /*+ direct(true,100) enable_parallel_dml parallel(2) append*/ into t1(c2,c4) select element_at([[12,3,4,32]],1), element_at([[[12,3,4,31,'中文']]],1) from t1;
select count(*) from t1;
count(*)
80
drop table if exists t1;
drop view if exists v1;
CREATE TABLE t1 (c1 int AUTO_INCREMENT , c2 int[],c3 float[],c4 varchar(256)[][])partition by hash(c1);
insert into t1 values(1,[1,2,3,5],[2.123,2.123,3.123,4.123],[['中文ing123',1,'1']]);
insert into t1 values(2,[2,3,4,5],[2.123,2.123,3.123,4.123],[[null,'a','sss']]);
insert into t1 values(3,[3,3,3,3],[3.123,2.123,3.123,4.123],[['null','a','sss']]);
insert into t1 values(4,[2,3,4,5],[4.123,2.123,3.123,4.123],[[2,3,4,5]]);
insert into t1(c1) values(5) ;
insert /*+ direct(true,100) enable_parallel_dml parallel(2) append*/ into t1(c2) select element_at([[12,3,4,32]],1) from t1;
insert /*+ direct(true,100) enable_parallel_dml parallel(2) append*/ into t1(c4) select element_at([[[12,3,4,31,'中文']]],1) from t1;
insert /*+ direct(true,100) enable_parallel_dml parallel(2) append*/ into t1(c2,c4) select element_at([[12,3,4,32]],1), element_at([[[12,3,4,31,'中文']]],1) from t1;
select count(*) from t1;
count(*)
40
drop table if exists t1;
CREATE TABLE t1 (c1 int AUTO_INCREMENT primary key, c2 int[],c3 float[],c4 varchar(256)[][])partition by hash(c1);
insert into t1 values(1,[1,2,3,5],[2.123,2.123,3.123,4.123],[['中文ing123',1,'1']]);
insert into t1 values(2,[2,3,4,5],[2.123,2.123,3.123,4.123],[[null,'a','sss']]);
insert into t1 values(3,[3,3,3,3],[3.123,2.123,3.123,4.123],[['null','a','sss']]);
insert into t1 values(4,[2,3,4,5],[4.123,2.123,3.123,4.123],[[2,3,4,5]]);
insert into t1 values(5,[null],[null],[[null]]);
insert into t1(c1) values(6) ;
delete from t1 where c2=(select element_at([c2],1) from t1 order by c1 limit 1) order by c1;
delete from t1 where c4=element_at([[[null,'a','sss']]],1) ;
delete from t1 where c3=element_at([[4.123,2.123,3.123,4.123]],1);
delete from t1;
truncate table t1;
select * from t1;
c1	c2	c3	c4
drop table if exists t1;
CREATE TABLE t1 (c1 int AUTO_INCREMENT primary key, c2 int[],c3 float[],c4 varchar(256)[][])partition by hash(c1);
insert into t1 values(1,[1,2,3,5],[2.123,2.123,3.123,4.123],[['中文ing123',1,'1']]);
insert into t1 values(2,[2,3,4,5],[2.123,2.123,3.123,4.123],[[null,'a','sss']]);
insert into t1 values(3,[3,3,3,3],[3.123,2.123,3.123,4.123],[['null','a','sss']]);
insert into t1 values(4,[2,3,4,5],[4.123,2.123,3.123,4.123],[[2,3,4,5]]);
insert into t1 values(5,[null],[null],[[null]]);
insert into t1(c1) values(6) ;
select element_at([c2],1) from t1 order by c1;
element_at([c2],1)
[1,2,3,5]
[2,3,4,5]
[3,3,3,3]
[2,3,4,5]
[NULL]
NULL
select /*+enable_parallel_dml parallel(2) */element_at([c2],1) from t1 order by c1;
element_at([c2],1)
[1,2,3,5]
[2,3,4,5]
[3,3,3,3]
[2,3,4,5]
[NULL]
NULL
select element_at([c3],1) from t1 order by c1;
element_at([c3],1)
[2.123,2.123,3.123,4.123]
[2.123,2.123,3.123,4.123]
[3.123,2.123,3.123,4.123]
[4.123,2.123,3.123,4.123]
[NULL]
NULL
select element_at([c4],1) from t1 order by c1;
element_at([c4],1)
[["中文ing123","1","1"]]
[[NULL,"a","sss"]]
[["null","a","sss"]]
[["2","3","4","5"]]
[[NULL]]
NULL
########清空回收站，删除测试数据库，表等 ##########
drop database  IF EXISTS  obljh;
purge recyclebin;
