purge recyclebin;
drop database IF EXISTS obljh;
create database obljh ;
use obljh;
set timestamp = 1600000000;
set ob_trx_timeout = 10000000000;
set ob_query_timeout = 10000000000;
alter system set ob_vector_memory_limit_percentage =44;
drop table if exists t1;
CREATE TABLE t1 (c1 int PRIMARY KEY, c2 varchar(30),c3 varchar(30)[]);
INSERT INTO t1 VALUES (1,'中文1', ['中文1']), (2,'中文2', ['中文2']), (3,'中文3', ['中文3']), (4,'中文4', ['中文4']), (5,null, null);
select string_to_array(c2, c2) from t1 order by c1 ;
string_to_array(c2, c2)
["",""]
["",""]
["",""]
["",""]
NULL
select string_to_array(c2, ',') from t1 order by c1;
string_to_array(c2, ',')
["中文1"]
["中文2"]
["中文3"]
["中文4"]
NULL
select c1,c2,c3,string_to_array(c2,null) from t1 where  string_to_array(c2, null) is null order by c1;
c1	c2	c3	string_to_array(c2,null)
5	NULL	NULL	NULL
select c1,c2,c3,string_to_array(c2,',') from t1 where  string_to_array(c2, ',')  = c3 order by c1;
c1	c2	c3	string_to_array(c2,',')
1	中文1	["中文1"]	["中文1"]
2	中文2	["中文2"]	["中文2"]
3	中文3	["中文3"]	["中文3"]
4	中文4	["中文4"]	["中文4"]
select c1,c2,c3,string_to_array(c2,',') from t1 where  string_to_array(c2, ',')  <> c3 order by c1;
c1	c2	c3	string_to_array(c2,',')
select c1,c2,c3,string_to_array(c2,',') from t1 where  string_to_array(c2, ',')  > c3 order by c1;
ERROR 22000: Invalid data type for the operation
select c1,c2,c3,string_to_array(c2,',') from t1 where  string_to_array(c2, ',')  < c3 order by c1;
ERROR 22000: Invalid data type for the operation
select c1,c2,c3,string_to_array(c2,',') from t1 where  string_to_array(c2, ',')  <= c3 order by c1;
ERROR 22000: Invalid data type for the operation
select c1,c2,c3,string_to_array(c2,',') from t1 where  string_to_array(c2, ',')  >= c3 order by c1;
ERROR 22000: Invalid data type for the operation
select c1,c2,c3,string_to_array(c2,',') from t1 where  string_to_array(c2, ',')  <=> c3 order by c1;
ERROR 22000: Invalid data type for the operation
select c1,c2,c3,string_to_array(c2,',') from t1 where  [c2]  =string_to_array(c2, ',') order by c1;
c1	c2	c3	string_to_array(c2,',')
1	中文1	["中文1"]	["中文1"]
2	中文2	["中文2"]	["中文2"]
3	中文3	["中文3"]	["中文3"]
4	中文4	["中文4"]	["中文4"]
select c1,c2,c3,c4 from t1 where [c2] between string_to_array(c2, ',') and string_to_array(c2, ',') ;
ERROR 22000: Invalid data type for the operation
select c1,c2,c3,c4 from t1 where string_to_array(c2, ',') like '%2%';
ERROR 22000: Invalid data type for the operation
select c1,c2,c3,string_to_array(c2, ',') from t1 where EXISTS (SELECT string_to_array(c2, ',') FROM t1) order by c1;
c1	c2	c3	string_to_array(c2, ',')
1	中文1	["中文1"]	["中文1"]
2	中文2	["中文2"]	["中文2"]
3	中文3	["中文3"]	["中文3"]
4	中文4	["中文4"]	["中文4"]
5	NULL	NULL	NULL
select c1,c2,c3,string_to_array(c2, ',') from t1 where not EXISTS (SELECT string_to_array(c2, ',') FROM t1) order by c1;
c1	c2	c3	string_to_array(c2, ',')
SELECT c1,c2,c3,string_to_array(c2, ',') from t1 where c3 = any (SELECT string_to_array(c2, ',') FROM t1) order by c1;
ERROR 22000: Invalid data type for the operation
SELECT c1,c2,c3,string_to_array(c2, ',') from t1 where c3 >= any (SELECT string_to_array(c2, ',') FROM t1) order by c1;
ERROR 22000: Invalid data type for the operation
SELECT c1,c2,c3,string_to_array(c2, ',') from t1 where c3 <= any (SELECT string_to_array(c2, ',') FROM t1) order by c1;
ERROR 22000: Invalid data type for the operation
SELECT c1,c2,c3,string_to_array(c2, ',') from t1 where c3 <> any (SELECT string_to_array(c2, ',') FROM t1) order by c1;
ERROR 22000: Invalid data type for the operation
SELECT c1,c2,c3,string_to_array(c2, ',') from t1 where c3 != any (SELECT string_to_array(c2, ',') FROM t1) order by c1;
ERROR 22000: Invalid data type for the operation
SELECT c1,c2,c3,string_to_array(c2, ',') from t1 where c3 > any (SELECT string_to_array(c2, ',') FROM t1) order by c1;
ERROR 22000: Invalid data type for the operation
SELECT c1,c2,c3,string_to_array(c2, ',') from t1 where c3 < any (SELECT string_to_array(c2, ',') FROM t1) order by c1;
ERROR 22000: Invalid data type for the operation
select [string_to_array(c2, ','),string_to_array(c2, ','),string_to_array(c2, ',')] from t1 order by c1 ;
[string_to_array(c2, ','),string_to_array(c2, ','),string_to_array(c2, ',')]
[["中文1"],["中文1"],["中文1"]]
[["中文2"],["中文2"],["中文2"]]
[["中文3"],["中文3"],["中文3"]]
[["中文4"],["中文4"],["中文4"]]
[NULL,NULL,NULL]
select [[[[[string_to_array(c2, ','),string_to_array(c2, ','),string_to_array(c2, ',')]]]]] from t1 order by c1 ;
[[[[[string_to_array(c2, ','),string_to_array(c2, ','),string_to_array(c2, ',')]]]]]
[[[[[["中文1"],["中文1"],["中文1"]]]]]]
[[[[[["中文2"],["中文2"],["中文2"]]]]]]
[[[[[["中文3"],["中文3"],["中文3"]]]]]]
[[[[[["中文4"],["中文4"],["中文4"]]]]]]
[[[[[NULL,NULL,NULL]]]]]
SELECT c1,c2,c3,string_to_array(c2, ',') from t1 where c3 in (string_to_array(c2, ',')) order by c1;
c1	c2	c3	string_to_array(c2, ',')
1	中文1	["中文1"]	["中文1"]
2	中文2	["中文2"]	["中文2"]
3	中文3	["中文3"]	["中文3"]
4	中文4	["中文4"]	["中文4"]
SELECT c1,c2,c3,string_to_array(c2, ',') from t1 where c3 in (string_to_array(c2, ','),string_to_array(c2, ','),string_to_array(c2, ',')) order by c1;
ERROR 22000: Invalid data type for the operation
drop table if exists t1;
drop materialized view if exists mv1;
CREATE TABLE t1 (c1 int PRIMARY KEY, c2 varchar(30),c3 varchar(30)[]);
INSERT INTO t1 VALUES (1,'中文1', ['中文1']), (2,'中文2', ['中文2']), (3,'中文3', ['中文3']), (4,'中文4', ['中文4']), (5,null, null);
drop table if exists t2;
create table t2 like t1;
replace into t2 select * from t1;
create materialized view mv1  parallel 2 refresh complete on demand  as select * from t2;
select /*+parallel(10)*/ string_to_array(c2, ',') from t1 union  select string_to_array(c2, ',') from mv1;
ERROR 22000: Invalid data type for the operation
select /*+parallel(10)*/ c3 from t1 union  select c3 from mv1;
ERROR 22000: Invalid data type for the operation
select string_to_array(c2, ',') from t1 union  select string_to_array(c2, ',') from t2;
string_to_array(c2, ',')
["中文1"]
["中文2"]
["中文3"]
["中文4"]
NULL
select string_to_array(c2, ',') from t1 union all select string_to_array(c2, ',') from t2;
string_to_array(c2, ',')
["中文1"]
["中文2"]
["中文3"]
["中文4"]
NULL
["中文1"]
["中文2"]
["中文3"]
["中文4"]
NULL
select * from t1,t2 where string_to_array(t1.c2, ',')=string_to_array(t2.c2, ',') order by t1.c1,t2.c1;
c1	c2	c3	c1	c2	c3
1	中文1	["中文1"]	1	中文1	["中文1"]
2	中文2	["中文2"]	2	中文2	["中文2"]
3	中文3	["中文3"]	3	中文3	["中文3"]
4	中文4	["中文4"]	4	中文4	["中文4"]
select /*+parallel(10)*/* from t1,t2 where string_to_array(t1.c2, ',')=string_to_array(t2.c2, ',') order by t1.c1,t2.c1;
c1	c2	c3	c1	c2	c3
1	中文1	["中文1"]	1	中文1	["中文1"]
2	中文2	["中文2"]	2	中文2	["中文2"]
3	中文3	["中文3"]	3	中文3	["中文3"]
4	中文4	["中文4"]	4	中文4	["中文4"]
select * from t1,t2 where string_to_array(t1.c2, ',')<>string_to_array(t2.c2, ',') order by t1.c1,t2.c1;
c1	c2	c3	c1	c2	c3
1	中文1	["中文1"]	2	中文2	["中文2"]
1	中文1	["中文1"]	3	中文3	["中文3"]
1	中文1	["中文1"]	4	中文4	["中文4"]
2	中文2	["中文2"]	1	中文1	["中文1"]
2	中文2	["中文2"]	3	中文3	["中文3"]
2	中文2	["中文2"]	4	中文4	["中文4"]
3	中文3	["中文3"]	1	中文1	["中文1"]
3	中文3	["中文3"]	2	中文2	["中文2"]
3	中文3	["中文3"]	4	中文4	["中文4"]
4	中文4	["中文4"]	1	中文1	["中文1"]
4	中文4	["中文4"]	2	中文2	["中文2"]
4	中文4	["中文4"]	3	中文3	["中文3"]
select * from t1,t2 where string_to_array(t1.c2, ',')>string_to_array(t2.c2, ',') order by t1.c1,t2.c1;
ERROR 22000: Invalid data type for the operation
select * from t1,t2 where string_to_array(t1.c2, ',')<string_to_array(t2.c2, ',') order by t1.c1,t2.c1;
ERROR 22000: Invalid data type for the operation
select * from t1,t2 where string_to_array(t1.c2, ',')<=>string_to_array(t2.c2, ',') order by t1.c1,t2.c1;
ERROR 22000: Invalid data type for the operation
select t1.c1,string_to_array(t1.c2, ',') from t1  join t2  on string_to_array(t1.c2, ',')=t2.c3  order by t1.c1;
c1	string_to_array(t1.c2, ',')
1	["中文1"]
2	["中文2"]
3	["中文3"]
4	["中文4"]
select t1.c1,string_to_array(t1.c2, ',') from t1  inner join t2  on string_to_array(t1.c2, ',')=t2.c3  order by t1.c1;
c1	string_to_array(t1.c2, ',')
1	["中文1"]
2	["中文2"]
3	["中文3"]
4	["中文4"]
select t1.c1,string_to_array(t1.c2, ',') from t1  right join t2  on string_to_array(t1.c2, ',')=t2.c3  order by t1.c1;
c1	string_to_array(t1.c2, ',')
NULL	NULL
1	["中文1"]
2	["中文2"]
3	["中文3"]
4	["中文4"]
select t1.c1,string_to_array(t1.c2, ',') from t1  left join t2  on string_to_array(t1.c2, ',')=t2.c3  order by t1.c1;
c1	string_to_array(t1.c2, ',')
1	["中文1"]
2	["中文2"]
3	["中文3"]
4	["中文4"]
5	NULL
select t1.c1,string_to_array(t1.c2, ',') from t1  cross  join t2 on string_to_array(t1.c2, ',')=t2.c3  order by t1.c1;
c1	string_to_array(t1.c2, ',')
1	["中文1"]
2	["中文2"]
3	["中文3"]
4	["中文4"]
drop table if exists t1;
drop view if exists v1;
CREATE TABLE t1 (c1 int PRIMARY KEY, c2 varchar(30),c3 varchar(30)[]);
INSERT INTO t1 VALUES (1,'中文1', ['中文1']), (2,'中文2', ['中文2']), (3,'中文3', ['中文3']), (4,'中文4', ['中文4']), (5,null, null);
create view v1 as select * from t1;
select *,string_to_array(t1.c2, ',') from t1,v1 where string_to_array(t1.c2, ',')=v1.c3 order by t1.c1;
c1	c2	c3	c1	c2	c3	string_to_array(t1.c2, ',')
1	中文1	["中文1"]	1	中文1	["中文1"]	["中文1"]
2	中文2	["中文2"]	2	中文2	["中文2"]	["中文2"]
3	中文3	["中文3"]	3	中文3	["中文3"]	["中文3"]
4	中文4	["中文4"]	4	中文4	["中文4"]	["中文4"]
select *,string_to_array(t1.c2, ',') from t1,v1 where string_to_array(t1.c2, ',')<>v1.c3 order by t1.c1;
c1	c2	c3	c1	c2	c3	string_to_array(t1.c2, ',')
1	中文1	["中文1"]	2	中文2	["中文2"]	["中文1"]
1	中文1	["中文1"]	3	中文3	["中文3"]	["中文1"]
1	中文1	["中文1"]	4	中文4	["中文4"]	["中文1"]
2	中文2	["中文2"]	1	中文1	["中文1"]	["中文2"]
2	中文2	["中文2"]	3	中文3	["中文3"]	["中文2"]
2	中文2	["中文2"]	4	中文4	["中文4"]	["中文2"]
3	中文3	["中文3"]	1	中文1	["中文1"]	["中文3"]
3	中文3	["中文3"]	2	中文2	["中文2"]	["中文3"]
3	中文3	["中文3"]	4	中文4	["中文4"]	["中文3"]
4	中文4	["中文4"]	1	中文1	["中文1"]	["中文4"]
4	中文4	["中文4"]	2	中文2	["中文2"]	["中文4"]
4	中文4	["中文4"]	3	中文3	["中文3"]	["中文4"]
select string_to_array(v1.c2, ',') from v1 union select string_to_array(t1.c2, ',') from t1;
string_to_array(v1.c2, ',')
["中文1"]
["中文2"]
["中文3"]
["中文4"]
NULL
select /*+parallel(10)*/string_to_array(v1.c2, ',') from v1 union select string_to_array(t1.c2, ',') from t1;
ERROR 22000: Invalid data type for the operation
select /*+parallel(10)*/c3 from v1 union select c3 from t1;
ERROR 22000: Invalid data type for the operation
drop table if exists t1;
CREATE TABLE t1 (c1 int PRIMARY KEY, c2 varchar(30),c3 varchar(30)[]);
INSERT INTO t1 VALUES (1,'中文1', ['中文1']), (2,'中文2', ['中文2']), (3,'中文3', ['中文3']), (4,'中文4', ['中文4']), (5,null, null);
drop materialized view if exists mv1;
create materialized view mv1(primary key(c1))  as select * from t1;
select a.c1,string_to_array(a.c2, ',') from mv1 a,t1 b order by a.c1;
c1	string_to_array(a.c2, ',')
1	["中文1"]
1	["中文1"]
1	["中文1"]
1	["中文1"]
1	["中文1"]
2	["中文2"]
2	["中文2"]
2	["中文2"]
2	["中文2"]
2	["中文2"]
3	["中文3"]
3	["中文3"]
3	["中文3"]
3	["中文3"]
3	["中文3"]
4	["中文4"]
4	["中文4"]
4	["中文4"]
4	["中文4"]
4	["中文4"]
5	NULL
5	NULL
5	NULL
5	NULL
5	NULL
select /*+parallel(10)*/a.c1,string_to_array(a.c2, ',') from mv1 a,t1 b order by a.c1;
c1	string_to_array(a.c2, ',')
1	["中文1"]
1	["中文1"]
1	["中文1"]
1	["中文1"]
1	["中文1"]
2	["中文2"]
2	["中文2"]
2	["中文2"]
2	["中文2"]
2	["中文2"]
3	["中文3"]
3	["中文3"]
3	["中文3"]
3	["中文3"]
3	["中文3"]
4	["中文4"]
4	["中文4"]
4	["中文4"]
4	["中文4"]
4	["中文4"]
5	NULL
5	NULL
5	NULL
5	NULL
5	NULL
select string_to_array(mv1.c2, ',') from mv1 union select string_to_array(t1.c2, ',') from t1;
string_to_array(mv1.c2, ',')
["中文1"]
["中文2"]
["中文3"]
["中文4"]
NULL
select /*+parallel(10)*/string_to_array(mv1.c2, ',') from mv1 union select string_to_array(t1.c2, ',') from t1;
ERROR 22000: Invalid data type for the operation
select count(string_to_array(a.c2, ',')) from mv1 a,t1 b,mv1 c order by a.c1;
count(string_to_array(a.c2, ','))
100
select  count(string_to_array(a.c2, ','))from mv1 a,t1 b,mv1 c order by a.c1;
count(string_to_array(a.c2, ','))
100
drop table if exists t1;
CREATE TABLE t1 (c1 int PRIMARY KEY, c2 varchar(30),c3 varchar(30)[]);
INSERT INTO t1 VALUES (1,'中文1', ['中文1']), (2,'中文2', ['中文2']), (3,'中文3', ['中文3']), (4,'中文4', ['中文4']), (5,null, null);
select count(*) from t1 a,t1 b,t1 c where string_to_array(a.c2, ',')=string_to_array(b.c2, ',') and string_to_array(a.c2, ',')=string_to_array(c.c2, ',');
count(*)
4
select count(*) from t1 a,t1 b,t1 c where string_to_array(a.c2, ',')=string_to_array(b.c2, ',') or string_to_array(a.c2, ',')=string_to_array(c.c2, ',');
count(*)
36
select count(*) from t1 a,t1 b,t1 c where string_to_array(a.c2, ',')=string_to_array(b.c2, ',') or string_to_array(a.c2, ',')=c.c3;
count(*)
36
drop table if exists t1;
CREATE TABLE t1 (c1 int PRIMARY KEY, c2 varchar(30),c3 varchar(30)[]);
INSERT INTO t1 VALUES (1,'中文1', ['中文1']), (2,'中文2', ['中文2']), (3,'中文3', ['中文3']), (4,'中文4', ['中文4']), (5,null, null);
select c1,c2,count(c2),string_to_array(c2, ',') from t1 group by string_to_array(c2, ',') order by c1;
ERROR 22000: Invalid data type for the operation
select * from t1 group by c1 having string_to_array(c2, ',')  order by c1;
ERROR 22000: Invalid data type for the operation
drop table if exists t1;
CREATE TABLE t1 (c1 int PRIMARY KEY, c2 varchar(30),c3 varchar(30)[]);
INSERT INTO t1 VALUES (1,'中文1', ['中文1']), (2,'中文2', ['中文2']), (3,'中文3', ['中文3']), (4,'中文4', ['中文4']), (5,null, null);
select c1,(select string_to_array(c2, ',') from t1 order by c1 limit 1) from t1 order by c1;
c1	(select string_to_array(c2, ',') from t1 order by c1 limit 1)
1	["中文1"]
2	["中文1"]
3	["中文1"]
4	["中文1"]
5	["中文1"]
select c1 from (select c1,string_to_array(c2, ',') c2 from t1 order by c1 limit 1) a order by a.c1;
c1
1
select string_to_array(c2, ',')  from (select c1,c2 from t1 order by c1 limit 1) a order by a.c1;
string_to_array(c2, ',')
["中文1"]
select * from t1,(select c1,string_to_array(c2, ',') c2 from t1 order by c1 limit 1) a where a.c1=t1.c1 order by a.c1;
c1	c2	c3	c1	c2
1	中文1	["中文1"]	1	["中文1"]
drop table if exists t1;
CREATE TABLE t1 (c1 int PRIMARY KEY, c2 varchar(30),c3 varchar(30)[]);
INSERT INTO t1 VALUES (1,'中文1', ['中文1']), (2,'中文2', ['中文2']), (3,'中文3', ['中文3']), (4,'中文4', ['中文4']), (5,null, null);
select * from t1 order by string_to_array(c2, ',');
ERROR 22000: Invalid data type for the operation
select * from t1 order by string_to_array(null,null);
c1	c2	c3
1	中文1	["中文1"]
2	中文2	["中文2"]
3	中文3	["中文3"]
4	中文4	["中文4"]
5	NULL	NULL
select * from t1 order by string_to_array(c2, ',') desc ;
ERROR 22000: Invalid data type for the operation
select * from t1 order by string_to_array(c2, ',') asc;
ERROR 22000: Invalid data type for the operation
drop table if exists t1;
CREATE TABLE t1 (c1 int PRIMARY KEY, c2 varchar(30),c3 varchar(30)[]);
INSERT INTO t1 VALUES (1,'1', ['中文1']), (2,'2', ['中文2']), (3,'3', ['中文3']), (4,'4', ['中文4']), (5,null, null);
select string_to_array(c2, ',') + string_to_array(c2, ',') from t1 order by c1;
ERROR HY000: Invalid argument
select string_to_array(c2+c2, ',') + string_to_array(c2+c2, ',') from t1 order by c1;
ERROR 22000: invalid obj type for type promotion: left_type=VARCHAR right_type=DOUBLE
drop table if exists t1;
CREATE TABLE t1 (c1 int PRIMARY KEY, c2 varchar(30),c3 varchar(30)[]);
INSERT INTO t1 VALUES (1,'中文1', ['中文1']), (2,'中文2', ['中文2']), (3,'中文3', ['中文3']), (4,'中文4', ['中文4']), (5,null, null);
select string_to_array(c2,cast(1 as json)) from t1 order by c1;
ERROR 22000: invalid obj type for type promotion: left_type=VARCHAR right_type=JSON
select string_to_array(c2,cast(1 as date)) from t1 order by c1;
ERROR 22000: invalid obj type for type promotion: left_type=VARCHAR right_type=MYSQL_DATE
select string_to_array(c2,cast(1 as TIME)) from t1 order by c1;
ERROR 22000: invalid obj type for type promotion: left_type=VARCHAR right_type=TIME
select string_to_array(c2,cast(1 as DATETIME(4))) from t1 order by c1;
ERROR 22000: invalid obj type for type promotion: left_type=VARCHAR right_type=MYSQL_DATETIME
select string_to_array(c2,cast(1 as DECIMAL(10,2))) from t1 order by c1;
ERROR 22000: invalid obj type for type promotion: left_type=VARCHAR right_type=DECIMAL
select string_to_array(c2,cast('中文' as char(20))) from t1 order by c1;
string_to_array(c2,cast('中文' as char(20)))
["","1"]
["","2"]
["","3"]
["","4"]
NULL
select string_to_array(c2,cast(1 as UNSIGNED)) from t1 order by c1;
ERROR 22000: invalid obj type for type promotion: left_type=VARCHAR right_type=BIGINT UNSIGNED
select string_to_array(c2,cast('中文' AS CHAR CHARACTER SET gbk)) from t1 order by c1;
string_to_array(c2,cast('中文' AS CHAR CHARACTER SET gbk))
["","1"]
["","2"]
["","3"]
["","4"]
NULL
drop table if exists t1;
CREATE TABLE t1 (c1 int PRIMARY KEY, c2 varchar(30),c3 varchar(30)[]);
INSERT INTO t1 VALUES (1,'中文1', ['中文1']), (2,'中文2', ['中文2']), (3,'中文3', ['中文3']), (4,'中文4', ['中文4']), (5,null, null);
select  distinct string_to_array(c2,',') from t1 order by c1;
ERROR 22000: Invalid data type for the operation
select  string_to_array(c2,(select distinct string_to_array(c2,1) from t1 order by c1 limit 1)) from t1 order by c1;
ERROR 22000: invalid obj type for type promotion: left_type=VARCHAR right_type=BIGINT
drop table if exists t1;
CREATE TABLE t1 (c1 int PRIMARY KEY, c2 varchar(30),c3 varchar(30)[]);
INSERT INTO t1 VALUES (1,'中文1', ['中文1']), (2,'中文2', ['中文2']), (3,'中文3', ['中文3']), (4,'中文4', ['中文4']), (5,null, null);
select max(string_to_array(c2,',')) from t1 order by c1;
ERROR HY000: Invalid argument
select min(string_to_array(c2,',')) from t1 order by c1;
ERROR HY000: Invalid argument
select count(string_to_array(c2,',')) from t1 order by c1;
count(string_to_array(c2,','))
4
select avg(string_to_array(c2,',')) from t1 order by c1;
ERROR 0A000: Not supported feature or function
select sum(string_to_array(c2,',')) from t1 order by c1;
ERROR 0A000: Not supported feature or function
drop table if exists t1;
CREATE TABLE t1 (c1 int PRIMARY KEY, c2 varchar(30),c3 varchar(30)[]);
INSERT INTO t1 VALUES (1,'中文1', ['中文1']), (2,'中文2', ['中文2']), (3,'中文3', ['中文3']), (4,'中文4', ['中文4']), (5,null, null);
drop table if exists t2;
create table t2 like t1;
replace into t2 select * from t1;
with ct1 as(
select string_to_array(c2,',') from t1 order by c1)
select string_to_array(c2,',') from t1 where c3 is not null order by c1 ;
string_to_array(c2,',')
["中文1"]
["中文2"]
["中文3"]
["中文4"]
with ct1 as(
select  string_to_array(c2,',') from t1 order by c1)
select  count(string_to_array(t1.c2,',')) from t1 join t2 on string_to_array(t1.c2,',')=string_to_array(t1.c2,',') order by t1.c1,t1.c2;
count(string_to_array(t1.c2,','))
20
drop table if exists t1;
CREATE TABLE t1 (c1 int PRIMARY KEY, c2 varchar(30),c3 varchar(30)[]);
INSERT INTO t1 VALUES (1,'中文1', ['中文1']), (2,'中文2', ['中文2']), (3,'中文3', ['中文3']), (4,'中文4', ['中文4']), (5,null, null);
drop table if exists t2;
create table t2 like t1;
replace into t2 select * from t1;
select * from t1 limit string_to_array(c2,',');
ERROR 42000: You have an error in your SQL syntax; check the manual that corresponds to your OceanBase version for the right syntax to use near 'string_to_array(c2,',')' at line 1
select string_to_array(c2,',')  from t1 order by c1 limit 10000000000000000000;
string_to_array(c2,',')
["中文1"]
["中文2"]
["中文3"]
["中文4"]
NULL
drop table if exists t1;
CREATE TABLE t1 (c1 int PRIMARY KEY, c2 varchar(30),c3 varchar(30)[]);
INSERT INTO t1 VALUES (1,'中文1', ['中文1']), (2,'中文2', ['中文2']), (3,'中文3', ['中文3']), (4,'中文4', ['中文4']), (5,null, null);
drop table if exists t2;
create table t2 like t1;
replace into t2 select * from t1;
select c1,c2,c3,string_to_array(c2,',') from t1 where string_to_array(c2,',') = c3 order by c1;
c1	c2	c3	string_to_array(c2,',')
1	中文1	["中文1"]	["中文1"]
2	中文2	["中文2"]	["中文2"]
3	中文3	["中文3"]	["中文3"]
4	中文4	["中文4"]	["中文4"]
select c1,c2,c3,string_to_array(c2,',') from t1 where string_to_array(c2,',') = c3 order by c1 for update;
c1	c2	c3	string_to_array(c2,',')
1	中文1	["中文1"]	["中文1"]
2	中文2	["中文2"]	["中文2"]
3	中文3	["中文3"]	["中文3"]
4	中文4	["中文4"]	["中文4"]
select /*+ ENABLE_PARALLEL_DML PARALLEL(3) */c1,c2,c3,string_to_array(c2,',') from t1 where string_to_array(c2,',') = c3 order by c1 for update;
c1	c2	c3	string_to_array(c2,',')
1	中文1	["中文1"]	["中文1"]
2	中文2	["中文2"]	["中文2"]
3	中文3	["中文3"]	["中文3"]
4	中文4	["中文4"]	["中文4"]
drop table if exists t1;
CREATE TABLE t1 (c1 int PRIMARY KEY, c2 varchar(30),c3 varchar(30)[]);
INSERT INTO t1 VALUES (1,'中文1', ['中文1']), (2,'中文2', ['中文2']), (3,'中文3', ['中文3']), (4,'中文4', ['中文4']), (5,null, null);
drop table if exists t2;
create table t2 like t1;
replace into t2 select * from t1;
select string_to_array(c2,',') a   from t1 order by t1.c1  ;
a
["中文1"]
["中文2"]
["中文3"]
["中文4"]
NULL
select /*+ ENABLE_PARALLEL_DML PARALLEL(3) */string_to_array(c2,',')  a from t1 order by t1.c1;
a
["中文1"]
["中文2"]
["中文3"]
["中文4"]
NULL
select string_to_array(c2,',') x ,string_to_array(c2,',') x, string_to_array(c2,',') x from t1 order by t1.c1  ;
x	x	x
["中文1"]	["中文1"]	["中文1"]
["中文2"]	["中文2"]	["中文2"]
["中文3"]	["中文3"]	["中文3"]
["中文4"]	["中文4"]	["中文4"]
NULL	NULL	NULL
select string_to_array(c2,',') 中文中文中文中文中文中文,string_to_array(c2,',') 中文中文中文中文中文中文 from t1 order by t1.c1  ;
中文中文中文中文中文中文	中文中文中文中文中文中文
["中文1"]	["中文1"]
["中文2"]	["中文2"]
["中文3"]	["中文3"]
["中文4"]	["中文4"]
NULL	NULL
drop table if exists t1;
CREATE TABLE t1 (c1 int PRIMARY KEY, c2 varchar(30),c3 varchar(30)[]);
INSERT INTO t1 VALUES (1,'中文1', ['中文1']), (2,'中文2', ['中文2']), (3,'中文3', ['中文3']), (4,'中文4', ['中文4']), (5,null, null);
update t1 set c1=38 where c2 is null;
update t1 set c3=string_to_array(c2,',') where c1=1;
update t1 set c3=string_to_array(c2,',') where c2 is not null;
update t1 set c3=string_to_array(c2,',') where c1 =5;
truncate table t1;
select * from t1 order by c1;
c1	c2	c3
drop table if exists t1;
CREATE TABLE t1 (c1 int PRIMARY KEY, c2 varchar(30),c3 varchar(30)[]);
INSERT INTO t1 VALUES (1,'中文1', ['中文1']), (2,'中文2', ['中文2']), (3,'中文3', ['中文3']), (4,'中文4', ['中文4']), (5,null, null);
update /*+enable_parallel_dml parallel(2) */t1 set c1=38 where c2 is null;
update /*+enable_parallel_dml parallel(2) */t1 set c3=string_to_array(c2,',') where c1=1;
update /*+enable_parallel_dml parallel(2) */t1 set c3=string_to_array(c2,',') where c2 is not null;
update /*+enable_parallel_dml parallel(2) */t1 set c3=string_to_array(c2,',') where c1 =5;
truncate table t1;
select * from t1 order by c1;
c1	c2	c3
drop table if exists t1;
CREATE TABLE t1 (c1 int PRIMARY KEY, c2 varchar(30),c3 varchar(30)[]);
INSERT INTO t1 VALUES (1,'中文1', ['中文1']), (2,'中文2', ['中文2']), (3,'中文3', ['中文3']), (4,'中文4', ['中文4']), (5,null, null);
drop table if exists t2;
create table t2 like t1;
insert  into t2 select * from t1;
update t1 set t1.c3 =['z'] where c3 in (select string_to_array(t1.c2,',') from t1 inner join t2 on t1.c2=t2.c2 order by t1.c1 limit 1,1);
ERROR 22000: Invalid data type for the operation
update t1 join t2 on t1.c1 =t2.c1 set t1.c3 =string_to_array(t1.c2,',')  where t1.c3 is null;
select count(*) from t1,t2 where  string_to_array(t1.c2,',')= string_to_array(t2.c2,',');
count(*)
4
drop table if exists t1;
CREATE TABLE t1 (c1 int PRIMARY KEY, c2 varchar(30),c3 varchar(30)[]);
INSERT INTO t1 VALUES (1,'中文1', ['中文1']), (2,'中文2', ['中文2']), (3,'中文3', ['中文3']), (4,'中文4', ['中文4']), (5,null, null);
drop table if exists t2;
create table t2 like t1;
insert  into t2 select * from t1;
insert into t1(c1,c2,c3) values(10,'中文1',string_to_array('123',','));
replace into t1(c1,c2,c3) values(10,'中文1',string_to_array('123',','));
drop table if exists t1;
CREATE TABLE t1 (c1 int , c2 varchar(30),c3 varchar(30)[]);
INSERT INTO t1 VALUES (1,'中文1', ['中文1']), (2,'中文2', ['中文2']), (3,'中文3', ['中文3']), (4,'中文4', ['中文4']), (5,null, null);
drop table if exists t2;
CREATE TABLE t2 (c1 int , c2 varchar(30),c3 varchar(30)[]);
INSERT INTO t2 VALUES (1,'中文1', ['中文1']), (2,'中文2', ['中文2']), (3,'中文3', ['中文3']), (4,'中文4', ['中文4']), (5,null, null);
insert into t1(c3) select string_to_array(c2,',') from t2;
replace into t1(c3) select string_to_array(c2,',') from t2;
select count(*) from t1;
count(*)
15
select count(*) from t2;
count(*)
5
drop table if exists t1;
CREATE TABLE t1 (c1 int PRIMARY KEY, c2 varchar(30),c3 varchar(30)[]);
INSERT IGNORE t1 VALUES (1,'中文1', string_to_array('aaaa',','));
select * from t1;
c1	c2	c3
1	中文1	["aaaa"]
drop table if exists t1;
CREATE TABLE t1 (c1 int , c2 varchar(30),c3 varchar(30)[]);
INSERT INTO t1 VALUES (1,'中文1', ['中文1']), (2,'中文2', ['中文2']), (3,'中文3', ['中文3']), (4,'中文4', ['中文4']), (5,null, null);
insert into t1(c1) values(4) ON DUPLICATE KEY UPDATE c3 = string_to_array('zsss',',');
insert into t1(c1) values(5)ON DUPLICATE KEY UPDATE c3= string_to_array('zsss',',');
insert into t1(c1) values(5)ON DUPLICATE KEY UPDATE c3= string_to_array('zsss',',');
select count(string_to_array(c2,',')) from t1 order by c1;
count(string_to_array(c2,','))
4
drop table if exists t1;
CREATE TABLE t1 (c1 int primary key AUTO_INCREMENT, c2 varchar(30),c3 varchar(30)[]);
INSERT INTO t1 VALUES (1,'中文1', ['中文1']), (2,'中文2', ['中文2']), (3,'中文3', ['中文3']), (4,'中文4', ['中文4']), (5,null, null);
insert /*+ parallel(10) */ overwrite t1(c3) select string_to_array('zsss',',') from t1 where c1>2;
insert /*+ parallel(10) */ overwrite t1(c3) select string_to_array('zsss',',') from t1 where c1>2;
insert /*+ parallel(10) */ overwrite t1(c3) select string_to_array('zsss',',') from t1 where c1>2;
insert /*+ parallel(10) */ overwrite t1(c3) select string_to_array('zsss',',');
select * from t1;
c1	c2	c3
15	NULL	["zsss"]
drop table if exists t1;
drop view if exists v1;
CREATE TABLE t1 (c1 int AUTO_INCREMENT, c2 varchar(30),c3 varchar(30)[]);
INSERT INTO t1 VALUES (1,'中文1', ['中文1']), (2,'中文2', ['中文2']), (3,'中文3', ['中文3']), (4,'中文4', ['中文4']), (5,null, null);
create view v1 as select c3 from t1;
insert /*+ direct(true,100) enable_parallel_dml parallel(2)*/ into v1 select string_to_array(c2,',') from t1;
insert /*+ direct(true,100) enable_parallel_dml parallel(2) append*/ into t1(c3) select string_to_array(c2,',') from t1;
insert /*+ direct(true,100) enable_parallel_dml parallel(2) append*/ into t1(c3) select string_to_array(c2,',') from t1;
select count(*) from t1;
count(*)
40
drop table if exists t1;
drop view if exists v1;
CREATE TABLE t1 (c1 int AUTO_INCREMENT, c2 varchar(30),c3 varchar(30)[]);
INSERT INTO t1 VALUES (1,'中文1', ['中文1']), (2,'中文2', ['中文2']), (3,'中文3', ['中文3']), (4,'中文4', ['中文4']), (5,null, null);
insert into t1(c1) values(6) ;
delete from t1 where c3=(select string_to_array(c2,',') from t1 order by c1 limit 1) order by c1;
delete from t1 where string_to_array(c2,',') is null;
truncate table t1;
select * from t1;
c1	c2	c3
drop table if exists t1;
CREATE TABLE t1 (c1 int AUTO_INCREMENT, c2 varchar(30),c3 varchar(30)[]);
INSERT INTO t1 VALUES (1,'中文1', ['中文1']), (2,'中文2', ['中文2']), (3,'中文3', ['中文3']), (4,'中文4', ['中文4']), (5,null, null);
select string_to_array(c2,',') from t1 order by c1;
string_to_array(c2,',')
["中文1"]
["中文2"]
["中文3"]
["中文4"]
NULL
select /*+enable_parallel_dml parallel(2) */string_to_array(c2,',') from t1 order by c1;
string_to_array(c2,',')
["中文1"]
["中文2"]
["中文3"]
["中文4"]
NULL
select string_to_array(c2,',') from t1 order by c1;
string_to_array(c2,',')
["中文1"]
["中文2"]
["中文3"]
["中文4"]
NULL
########清空回收站，删除测试数据库，表等 ##########
drop database  IF EXISTS  obljh;
purge recyclebin;
