#Environmental cleaning
drop user hjw@'%';
create user hjw identified by 'hjw';
grant all on *.* to hjw WITH GRANT OPTION;
#crc32-6       运算符
#crc32-7       视图索引约束
#crc32-8       分区表
create database hz;
use hz;
drop table test1;
drop table test2;
drop view v1;
#crc32-6       运算符
#crc32-6-1     算术运算符
#crc32-6-2     逻辑运算符
#crc32-6-3     比较运算符
#crc32-6-1     算术运算符
#加法
SELECT crc32(-1+1) from dual;
crc32(-1+1)
4108050209
SELECT crc32(-1+0) from dual;
crc32(-1+0)
808273962
SELECT crc32(-1+null) from dual;
crc32(-1+null)
NULL
SELECT crc32(null+null) from dual;
crc32(null+null)
NULL
#减法
SELECT crc32(-1-1) from dual;
crc32(-1-1)
2837715344
SELECT crc32(-1-0) from dual;
crc32(-1-0)
808273962
SELECT crc32(-1-null) from dual;
crc32(-1-null)
NULL
SELECT crc32(null-1) from dual;
crc32(null-1)
NULL
SELECT crc32(-1-(null)) from dual;
crc32(-1-(null))
NULL
#乘法
SELECT crc32(-1*1) from dual;
crc32(-1*1)
808273962
SELECT crc32(-1*0) from dual;
crc32(-1*0)
4108050209
SELECT crc32(-1*null) from dual;
crc32(-1*null)
NULL
SELECT crc32(null*0) from dual;
crc32(null*0)
NULL
SELECT crc32(gu*@yh) from dual;
SELECT crc32(1*@yh) from dual;
crc32(1*@yh)
NULL
SELECT crc32(null*@yh) from dual;
crc32(null*@yh)
NULL
#除法
SELECT crc32(-1/1) from dual;
crc32(-1/1)
2936985889
SELECT crc32(-1/0) from dual;
crc32(-1/0)
NULL
SELECT crc32(-1/null) from dual;
crc32(-1/null)
NULL
SELECT crc32(null/0) from dual;
crc32(null/0)
NULL
SELECT crc32(gu/@yh) from dual;
SELECT crc32(1/yh) from dual;
SELECT crc32(null/@yh) from dual;
crc32(null/@yh)
NULL
SELECT crc32(crc32()/crc32()) from dual;
SELECT 'a' FROM dual WHERE crc32(1=1)+2-3*2/10>1;
a
a
SELECT 'a' FROM dual WHERE crc32(1!=NULL)+2-3*2/10>1;
a
SELECT 'a' FROM dual WHERE crc32(1=1)-100+2-3*2/10>1;
a
a
SELECT 'a' FROM dual WHERE crc32(1!=NULL)-11+2-3*2/10>1;
a
#crc32-6-2     逻辑运算符
SELECT crc32(1!=1) AND crc32(2<1) FROM dual;
crc32(1!=1) AND crc32(2<1)
1
SELECT crc32(1!=NULL) && crc32(2<1) FROM dual;
crc32(1!=NULL) && crc32(2<1)
NULL
SELECT crc32(1!=NULL) && crc32(2>1) FROM dual;
crc32(1!=NULL) && crc32(2>1)
NULL
SELECT crc32(1!=NULL) OR crc32(2<1) FROM dual;
crc32(1!=NULL) OR crc32(2<1)
1
SELECT crc32(1=1) || crc32(2<1) FROM dual;
crc32(1=1) || crc32(2<1)
1
SELECT crc32(1=1) || crc32(2>1) FROM dual;
crc32(1=1) || crc32(2>1)
1
SELECT NOT crc32(1=1) FROM dual ;
NOT crc32(1=1)
0
SELECT ! crc32(1!=NULL) FROM dual ;
! crc32(1!=NULL)
NULL
SELECT crc32(1!=NULL) XOR crc32(2<1) FROM dual;
crc32(1!=NULL) XOR crc32(2<1)
NULL
SELECT crc32(1!=NULL) XOR crc32(2>1) FROM dual ;
crc32(1!=NULL) XOR crc32(2>1)
NULL
SELECT crc32(1=1) IS NULL FROM dual ;
crc32(1=1) IS NULL
0
SELECT crc32(1!=NULL) IS NULL FROM dual ;
crc32(1!=NULL) IS NULL
1
SELECT crc32(1=1) IS NOT NULL FROM dual ;
crc32(1=1) IS NOT NULL
1
SELECT crc32(1!=NULL) IS NOT NULL FROM dual ;
crc32(1!=NULL) IS NOT NULL
0
SELECT crc32(1=1) IN (1,NULL) FROM dual ;
crc32(1=1) IN (1,NULL)
NULL
SELECT crc32(1!=NULL) IN (1,NULL) FROM dual ;
crc32(1!=NULL) IN (1,NULL)
NULL
SELECT crc32(1=1) NOT IN (1,NULL) FROM dual ;
crc32(1=1) NOT IN (1,NULL)
NULL
SELECT crc32(1!=NULL) NOT IN (1,NULL) FROM dual ;
crc32(1!=NULL) NOT IN (1,NULL)
NULL
SELECT crc32(1=1) BETWEEN 1 AND 2 FROM dual;
crc32(1=1) BETWEEN 1 AND 2
0
SELECT crc32(1!=NULL) BETWEEN 1 AND NULL FROM dual ;
crc32(1!=NULL) BETWEEN 1 AND NULL
NULL
SELECT crc32(1=1) NOT BETWEEN 1 AND NULL FROM dual;
crc32(1=1) NOT BETWEEN 1 AND NULL
NULL
SELECT crc32(1!=NULL) NOT BETWEEN 1 AND 5 FROM dual;
crc32(1!=NULL) NOT BETWEEN 1 AND 5
NULL
#crc32-6-3     比较运算符
SELECT crc32(1=1)>1 FROM dual;
crc32(1=1)>1
1
SELECT crc32(1!=NULL)>1 FROM dual ;
crc32(1!=NULL)>1
NULL
SELECT crc32(1=1)>=1 FROM dual ;
crc32(1=1)>=1
1
SELECT crc32(1!=NULL)>=1 FROM dual;
crc32(1!=NULL)>=1
NULL
SELECT crc32(1=1)<1 FROM dual ;
crc32(1=1)<1
0
SELECT crc32(1!=NULL)<1 FROM dual;
crc32(1!=NULL)<1
NULL
SELECT crc32(1=1)<=1 FROM dual;
crc32(1=1)<=1
0
SELECT crc32(1!=NULL)<=1 FROM dual;
crc32(1!=NULL)<=1
NULL
SELECT crc32(1=1)=1 FROM dual;
crc32(1=1)=1
0
SELECT crc32(1!=NULL)=1 FROM dual ;
crc32(1!=NULL)=1
NULL
SELECT crc32(1=1)<=>1 FROM dual;
crc32(1=1)<=>1
0
SELECT crc32(1!=NULL)<=>NULL FROM dual ;
crc32(1!=NULL)<=>NULL
1
SELECT crc32(1=1)!=1 FROM dual;
crc32(1=1)!=1
1
SELECT crc32(1!=NULL)!=1 FROM dual ;
crc32(1!=NULL)!=1
NULL
SELECT crc32(1=1)<>1 FROM dual;
crc32(1=1)<>1
1
SELECT crc32(1!=NULL)<>1 FROM dual;
crc32(1!=NULL)<>1
NULL
SELECT crc32('@')<1 FROM dual;
crc32('@')<1
0
SELECT crc32(12*'ghy')<1 FROM dual;
crc32(12*'ghy')<1
0
Warnings:
Warning	1292	Truncated incorrect DOUBLE value: 'ghy'
SELECT crc32(12*!)<1 FROM dual;
SELECT crc32(100%)=1 FROM dual;
#crc32-7       视图索引约束
#crc32-7-1    视图
create table test1(b1 int,b2 varchar(20),b3 bigint,b4 bigint);
insert into test1 values(1,'鲁班',98,70);
insert into test1 values(2,'王者',100,100);
insert into test1 values(3,'韩信',70,60);
insert into test1 values(4,'null',null,null);
CREATE view v1 as SELECT * from test1;
SELECT * from v1 order by b1 asc;
b1	b2	b3	b4
1	鲁班	98	70
2	王者	100	100
3	韩信	70	60
4	null	NULL	NULL
#insert
INSERT INTO v1(b1) VALUES(crc32(-15));
SELECT * from v1 order by b1 asc;
b1	b2	b3	b4
1	鲁班	98	70
2	王者	100	100
3	韩信	70	60
4	null	NULL	NULL
1597689648	NULL	NULL	NULL
INSERT INTO v1(b2) VALUES(crc32('瑶'!='妲己'));
SELECT * from v1 order by b1 asc;
b1	b2	b3	b4
NULL	2212294583	NULL	NULL
1	鲁班	98	70
2	王者	100	100
3	韩信	70	60
4	null	NULL	NULL
1597689648	NULL	NULL	NULL
INSERT INTO v1(b3) VALUES(crc32(90>2));
SELECT * from v1 order by b1 asc;
b1	b2	b3	b4
NULL	2212294583	NULL	NULL
NULL	NULL	2212294583	NULL
1	鲁班	98	70
2	王者	100	100
3	韩信	70	60
4	null	NULL	NULL
1597689648	NULL	NULL	NULL
INSERT INTO v1(b4) VALUES(crc32(20191212!=20191212));
SELECT * from v1 order by b1 asc;
b1	b2	b3	b4
NULL	2212294583	NULL	NULL
NULL	NULL	2212294583	NULL
NULL	NULL	NULL	4108050209
1	鲁班	98	70
2	王者	100	100
3	韩信	70	60
4	null	NULL	NULL
1597689648	NULL	NULL	NULL
INSERT INTO v1(b4) VALUES(crc32(20191212!=null));
SELECT * from v1 order by b1 asc;
b1	b2	b3	b4
NULL	2212294583	NULL	NULL
NULL	NULL	2212294583	NULL
NULL	NULL	NULL	4108050209
NULL	NULL	NULL	NULL
1	鲁班	98	70
2	王者	100	100
3	韩信	70	60
4	null	NULL	NULL
1597689648	NULL	NULL	NULL
INSERT INTO v1 VALUES(crc32(-10),crc32('瑶'!='妲己'),crc32(crc32(90>2)),crc32(20191212!=null));
SELECT * FROM v1 order by b1 asc;
b1	b2	b3	b4
NULL	2212294583	NULL	NULL
NULL	NULL	2212294583	NULL
NULL	NULL	NULL	4108050209
NULL	NULL	NULL	NULL
1	鲁班	98	70
2	王者	100	100
3	韩信	70	60
4	null	NULL	NULL
793787327	2212294583	3925204110	NULL
1597689648	NULL	NULL	NULL
INSERT INTO v1(b4) VALUES((SELECT 100 FROM v1 WHERE crc32(b2 IS NULL) GROUP BY b1 HAVING crc32(b1<3) LIMIT 1));
SELECT * FROM v1 order by b1 asc;
b1	b2	b3	b4
NULL	2212294583	NULL	NULL
NULL	NULL	2212294583	NULL
NULL	NULL	NULL	4108050209
NULL	NULL	NULL	NULL
NULL	NULL	NULL	100
1	鲁班	98	70
2	王者	100	100
3	韩信	70	60
4	null	NULL	NULL
793787327	2212294583	3925204110	NULL
1597689648	NULL	NULL	NULL
#select
SELECT crc32(b1<3),crc32(b2='王者'),crc32(b3>30),crc32(b4 IS NULL) FROM v1;
crc32(b1<3)	crc32(b2='王者')	crc32(b3>30)	crc32(b4 IS NULL)
2212294583	4108050209	2212294583	4108050209
2212294583	2212294583	2212294583	4108050209
4108050209	4108050209	2212294583	4108050209
4108050209	4108050209	NULL	2212294583
4108050209	NULL	NULL	2212294583
NULL	4108050209	NULL	2212294583
NULL	NULL	2212294583	2212294583
NULL	NULL	NULL	4108050209
NULL	NULL	NULL	2212294583
4108050209	4108050209	2212294583	2212294583
NULL	NULL	NULL	4108050209
SELECT * FROM (SELECT * FROM v1 WHERE crc32(b1<3) AND crc32(b2='王者') AND NOT crc32(90>2) OR crc32(b4 IS NULL)) test1 WHERE crc32(b1!=2) ORDER BY b1 asc;
b1	b2	b3	b4
1	鲁班	98	70
2	王者	100	100
3	韩信	70	60
4	null	NULL	NULL
793787327	2212294583	3925204110	NULL
1597689648	NULL	NULL	NULL
SELECT * FROM v1 WHERE crc32(b1<3) AND crc32(b2='韩信') AND NOT crc32(b3>45) OR crc32(b4 IS NOT NULL) ORDER BY b1 asc;
b1	b2	b3	b4
NULL	2212294583	NULL	NULL
NULL	NULL	2212294583	NULL
NULL	NULL	NULL	4108050209
NULL	NULL	NULL	NULL
NULL	NULL	NULL	100
1	鲁班	98	70
2	王者	100	100
3	韩信	70	60
4	null	NULL	NULL
793787327	2212294583	3925204110	NULL
1597689648	NULL	NULL	NULL
SELECT * FROM v1 WHERE crc32(b3=100) GROUP BY crc32(b4>45) ORDER BY b1 asc;
b1	b2	b3	b4
NULL	NULL	2212294583	NULL
1	鲁班	98	70
SELECT b2,b3 FROM v1 WHERE crc32(b1>2.5) GROUP BY b2,b3 HAVING crc32(b3=100) OR crc32(b3=70) ORDER BY b1 asc;
b2	b3
鲁班	98
王者	100
韩信	70
2212294583	3925204110
SELECT * FROM v1 ORDER BY crc32(b3>75 or b3>null) asc ;
b1	b2	b3	b4
3	韩信	70	60
4	null	NULL	NULL
1597689648	NULL	NULL	NULL
NULL	2212294583	NULL	NULL
NULL	NULL	NULL	4108050209
NULL	NULL	NULL	NULL
NULL	NULL	NULL	100
1	鲁班	98	70
2	王者	100	100
NULL	NULL	2212294583	NULL
793787327	2212294583	3925204110	NULL
SELECT (CASE WHEN crc32(b1>2) THEN b1 ELSE b1+1 END) FROM v1 ORDER BY b1 asc;
(CASE WHEN crc32(b1>2) THEN b1 ELSE b1+1 END)
NULL
NULL
NULL
NULL
NULL
1
2
3
4
793787327
1597689648
SELECT (CASE WHEN crc32(b1 IS NULL) THEN b1 ELSE 2 END) FROM v1 ORDER BY b1 asc;
(CASE WHEN crc32(b1 IS NULL) THEN b1 ELSE 2 END)
NULL
NULL
NULL
NULL
NULL
1
2
3
4
793787327
1597689648
SELECT (CASE crc32(b1 IS NULL) WHEN 1 THEN b1 WHEN NULL THEN 2 ELSE 3 END) FROM v1  ORDER BY b1 asc;
(CASE crc32(b1 IS NULL) WHEN 1 THEN b1 WHEN NULL THEN 2 ELSE 3 END)
3
3
3
3
3
3
3
3
3
3
3
SELECT DISTINCT crc32(b1 IS NOT NULL) FROM v1 ORDER BY b1 asc;
crc32(b1 IS NOT NULL)
4108050209
2212294583
#update
UPDATE v1 SET b1=crc32(b1<2) WHERE b1 IS NOT NULL;
UPDATE v1 SET b1=(SELECT max(b1) FROM v1 WHERE crc32(b1>2)) WHERE b2 IS NOT NULL;
SELECT * FROM v1 order by b1 asc;
b1	b2	b3	b4
NULL	NULL	2212294583	NULL
NULL	NULL	NULL	4108050209
NULL	NULL	NULL	NULL
NULL	NULL	NULL	100
1597689648	鲁班	98	70
1597689648	王者	100	100
1597689648	韩信	70	60
1597689648	null	NULL	NULL
1597689648	NULL	NULL	NULL
1597689648	2212294583	NULL	NULL
1597689648	2212294583	3925204110	NULL
UPDATE v1 SET b1=(SELECT avg(b3) FROM (SELECT b2||'5.5544' b2 FROM v1 WHERE crc32(b1>2) GROUP BY b2 HAVING crc32(b1>=2) OR crc32(b1<=2) ORDER BY 1) test1 limit 1) WHERE b2 IS NULL;
Warnings:
Warning	1052	Column 'b2' in group statement is ambiguous
UPDATE v1 SET b1='5' WHERE crc32(b3<101) AND b1 IS NOT NULL;
SELECT * FROM v1 order by b1 asc;
b1	b2	b3	b4
NULL	NULL	NULL	NULL
NULL	NULL	2212294583	NULL
NULL	NULL	NULL	4108050209
NULL	NULL	NULL	NULL
NULL	NULL	NULL	100
5	鲁班	98	70
5	王者	100	100
5	韩信	70	60
5	2212294583	3925204110	NULL
1597689648	null	NULL	NULL
1597689648	2212294583	NULL	NULL
UPDATE v1 SET b1='6' WHERE b2 = (SELECT max(b2) FROM v1 WHERE crc32(b1>2));
SELECT * FROM v1 order by b1 asc;
b1	b2	b3	b4
NULL	NULL	NULL	NULL
NULL	NULL	2212294583	NULL
NULL	NULL	NULL	4108050209
NULL	NULL	NULL	NULL
NULL	NULL	NULL	100
5	王者	100	100
5	韩信	70	60
5	2212294583	3925204110	NULL
6	鲁班	98	70
1597689648	null	NULL	NULL
1597689648	2212294583	NULL	NULL
UPDATE v1 SET b1='7' WHERE b2+9.9 < (SELECT avg(b1) FROM (SELECT 10+b2 b1 FROM v1 WHERE crc32(b1>4) GROUP BY b2 HAVING crc32(b2>=2) OR crc32(b1<=2) ORDER BY 1) test1 limit 1) AND crc32(b1 IS NULL);
UPDATE v1 SET b1='6' WHERE crc32((SELECT max(b3) FROM v1 WHERE crc32(b1>2)) IS NULL);
SELECT * FROM v1 order by b1 asc;
b1	b2	b3	b4
6	鲁班	98	70
6	王者	100	100
6	韩信	70	60
6	null	NULL	NULL
6	NULL	NULL	NULL
6	2212294583	NULL	NULL
6	NULL	2212294583	NULL
6	NULL	NULL	4108050209
6	NULL	NULL	NULL
6	2212294583	3925204110	NULL
6	NULL	NULL	100
UPDATE v1 SET b1='7' WHERE crc32(b3+9.9<(SELECT avg(b4)||12 FROM (SELECT 10+b3 b4 FROM v1 WHERE crc32(b1>4) GROUP BY b2 HAVING crc32(b3>=2) OR crc32(b4<=200) ORDER BY 1) test1 limit 1));
SELECT * FROM v1 order by b1 asc;
b1	b2	b3	b4
6	null	NULL	NULL
6	NULL	NULL	NULL
6	2212294583	NULL	NULL
6	NULL	NULL	4108050209
6	NULL	NULL	NULL
6	NULL	NULL	100
7	鲁班	98	70
7	王者	100	100
7	韩信	70	60
7	NULL	2212294583	NULL
7	2212294583	3925204110	NULL
DROP table test1;
DROP view v1;
#delete
create table test1(b1 int,b2 varchar(20),b3 bigint,b4 bigint);
insert into test1 values(1,'鲁班',98,70);
insert into test1 values(2,'王者',100,100);
insert into test1 values(3,'韩信',70,60);
insert into test1 values(4,'null',null,null);
CREATE view v1 as SELECT * from test1;
SELECT * FROM v1 order by b1 asc;
b1	b2	b3	b4
1	鲁班	98	70
2	王者	100	100
3	韩信	70	60
4	null	NULL	NULL
DELETE FROM v1 WHERE crc32(crc32(b4<65));
SELECT * FROM v1 order by b1 asc;
b1	b2	b3	b4
4	null	NULL	NULL
DELETE FROM v1 WHERE b3=(SELECT b3 FROM v1 WHERE crc32(b3=null) AND b3 IS NOT NULL);
SELECT * FROM v1 order by b1 asc;
b1	b2	b3	b4
4	null	NULL	NULL
delete from v1;
insert into test1 values(1,'鲁班',98,70);
insert into test1 values(2,'王者',100,100);
insert into test1 values(3,'韩信',70,60);
insert into test1 values(4,'null',null,null);
DELETE FROM v1 WHERE b3 BETWEEN (SELECT b3 FROM v1 WHERE crc32(b2>2) AND b3 IS NOT NULL) AND (SELECT max(b3) FROM v1 WHERE crc32(b2<2) AND b3 IS NOT NULL);
DELETE FROM v1 WHERE b3+9.9 < (SELECT avg(b3) FROM (SELECT 10+b3 FROM v1 WHERE crc32(b1>4) GROUP BY b3 HAVING crc32(b3>=2) OR crc32(b3<=2) ORDER BY 1) test1 limit 1) AND crc32(b1 IS NULL);
DELETE FROM v1 WHERE crc32((SELECT max(b3) FROM v1 WHERE crc32(b3=null)) IS NULL);
SELECT * FROM v1 order by b1 asc;
b1	b2	b3	b4
drop table test1;
drop view v1;
#crc32-7-2     索引
CREATE TABLE test1(b1 decimal(5,1), b2 decimal(5,1));
CREATE INDEX index_test1 ON test1(b1);
CREATE INDEX index_test2 ON test1(b2);
INSERT INTO test1(b1) SELECT 5 FROM dual WHERE crc32(1!=1);
SELECT * FROM test1;
b1	b2
5.0	NULL
UPDATE test1 SET b1 = (SELECT 6 FROM dual WHERE crc32(1!=1)) WHERE crc32(b2 IS NOT NULL);
SELECT * FROM test1;
b1	b2
6.0	NULL
DELETE FROM test1 WHERE crc32(b2=3);
DELETE FROM test1 WHERE crc32(b2=null);
drop table test1;
#crc32-7-3   约束
#crc32-7-3-1    非空约束
create table test1(a1 int ,name varchar(20),chinese BIGINT not null,math BIGINT,english INTEGER);
insert into test1 values(1,'小明',101,125,98);
SELECT * from test1 order by a1 asc;
a1	name	chinese	math	english
1	小明	101	125	98
insert into test1 values(1,'小明',null,125,98);
insert into test1 values(2,'小明',0,125,98);
insert into test1 values(3,'小明',-1,125,98);
SELECT * from test1 order by a1 asc;
a1	name	chinese	math	english
1	小明	101	125	98
2	小明	0	125	98
3	小明	-1	125	98
INSERT INTO test1(chinese) SELECT 5 FROM dual WHERE crc32(null);
SELECT * from test1 order by a1 asc;
a1	name	chinese	math	english
1	小明	101	125	98
2	小明	0	125	98
3	小明	-1	125	98
insert into test1 values(4,'小明',crc32(null),125,98);
UPDATE test1 set chinese=crc32(null) where chinese=0;
UPDATE test1 set chinese=crc32(1) where chinese=0;
SELECT * from test1 order by a1 asc;
a1	name	chinese	math	english
1	小明	101	125	98
2	小明	2212294583	125	98
3	小明	-1	125	98
DELETE FROM test1 where chinese=crc32(1);
SELECT * from test1 order by a1 asc;
a1	name	chinese	math	english
1	小明	101	125	98
3	小明	-1	125	98
drop table test1;
#unique   唯一约束
create table test1(a1 int,name varchar(20),chinese BIGINT UNIQUE Key,math BIGINT,english INTEGER);
insert into test1 values(1,'小明',101,125,98);
insert into test1 values(2,'小明',101,125,98);
insert into test1 values(2,'小明',102,125,98);
SELECT * from test1 order by a1 asc;
a1	name	chinese	math	english
1	小明	101	125	98
2	小明	102	125	98
insert into test1 values(2,'小明',crc32(102),125,98);
SELECT * from test1 order by a1 asc;
a1	name	chinese	math	english
1	小明	101	125	98
2	小明	102	125	98
2	小明	3447271878	125	98
UPDATE test1 set chinese=crc32(101) where chinese=crc32(102);
SELECT * from test1 order by a1 asc;
a1	name	chinese	math	english
1	小明	101	125	98
2	小明	102	125	98
2	小明	1416650876	125	98
DELETE from test1 where crc32(crc32(101));
SELECT * from test1 order by a1 asc;
a1	name	chinese	math	english
drop table test1;
#PRIMARY KEY 主键
create table test1(a1 int PRIMARY KEY,name varchar(20),chinese BIGINT,math BIGINT,english INTEGER);
insert into test1 values(1,'小明',101,125,98);
SELECT * from test1 order by a1 asc;
a1	name	chinese	math	english
1	小明	101	125	98
insert into test1 values(2,'小明',100,125,98);
insert into test1 values(3,'小明',102,125,98);
SELECT * from test1 order by a1 asc;
a1	name	chinese	math	english
1	小明	101	125	98
2	小明	100	125	98
3	小明	102	125	98
UPDATE test1 set a1=1 where a1=crc32(1);
DELETE from test1 where crc32(a1<4);
drop table test1;
#FOREIGN KEY   外键约束
create table test1(a1 int PRIMARY KEY,name varchar(20),chinese BIGINT,math BIGINT,english INTEGER);
insert into test1 values(1,'小明',101,125,98);
create table test2(a1 int,name varchar(20),chinese BIGINT,math BIGINT,english INTEGER,constraint fk_test1_test2_a1 FOREIGN key(a1) REFERENCES test1(a1));
insert into test1 values(5,'小张',91,121,80);
SELECT * from test1 order by a1 asc;
a1	name	chinese	math	english
1	小明	101	125	98
5	小张	91	121	80
insert into test1 values(2,'小草',99,124,78);
insert into test1 values(3,'小明',103,124,78);
insert into test1 values(4,'小王',103,124,78);
insert into test1 values(5,'小草',110,130,70);
SELECT * from test1 order by a1 asc;
a1	name	chinese	math	english
1	小明	101	125	98
2	小草	99	124	78
3	小明	103	124	78
4	小王	103	124	78
5	小张	91	121	80
UPDATE test2 set a1=1 where a1=crc32(1);
UPDATE test2 set a1=crc32(1);
DELETE from test1 where a1=crc32(1);
DELETE from test2;
drop table test2;
drop table test1;
#crc32-8       分区表
#hash   分区
create table test1(a1 int,chinese int,math int,english int)partition by hash(a1);
insert INTO test1 partition(p0) VALUES(1,110,101,119);
insert  INTO test1 partition(p0) VALUES(2,112,150,100);
insert  INTO test1 partition(p0) VALUES(3,118,140,115);
SELECT * from test1 order by a1 asc;
a1	chinese	math	english
1	110	101	119
2	112	150	100
3	118	140	115
delete from test1 partition(p0) where crc32(english=100) LIMIT 1;
SELECT * from test1 order by a1 asc;
a1	chinese	math	english
2	112	150	100
3	118	140	115
delete from test1 partition(p0) where english<(SELECT english from test1 where crc32(english=(SELECT english from test1 where crc32(english=115) LIMIT 1) )LIMIT 1);
SELECT * from test1 order by a1 asc;
a1	chinese	math	english
2	112	150	100
3	118	140	115
update test1 partition(p0) set crc32(english=120) where crc32(english=115);
update test1 partition(p0) set english=120 where crc32(english=115);
SELECT * from test1 order by a1 asc;
a1	chinese	math	english
2	112	150	120
3	118	140	120
update test1  partition(p0) set crc32(english=120) LIMIT 1;
update test1  partition(p0) set english=crc32(120) LIMIT 1;
SELECT * from test1 order by a1 asc;
a1	chinese	math	english
2	112	150	289485416
3	118	140	120
drop table test1;
#list   分区
create table test1(a1 int,chinese int,math int,english int)partition by list(a1)(partition p2 values in(1,2));
insert INTO test1 partition(p2) VALUES(1,112,150,100);
insert INTO test1 partition(p2) VALUES(2,110,101,119);
SELECT * from test1 order by a1 asc;
a1	chinese	math	english
1	112	150	100
2	110	101	119
UPDATE test1 partition(p2) set english=crc32(math-1);
SELECT * from test1 partition(p2) order by a1 asc;
a1	chinese	math	english
1	112	150	1053240650
2	110	101	595022058
UPDATE test1 partition(p2) set english=crc32(english-2);
SELECT * from test1 partition(p2) order by a1 asc;
a1	chinese	math	english
1	112	150	1088041342
2	110	101	774847822
delete from test1 partition(p2) where math=some(SELECT math from test1 where crc32(math=101));
delete from test1 partition(p2) where math>(SELECT math from test1 where crc32(math=101));
SELECT * from test1 partition(p2) order by a1 asc;
a1	chinese	math	english
UPDATE test1 partition(p2) set english=crc32(null);
SELECT * from test1 partition(p2) order by a1 asc;
a1	chinese	math	english
UPDATE test1 partition(p2) set english=crc32(english=119);
SELECT * from test1 partition(p2) order by a1 asc;
a1	chinese	math	english
UPDATE test1 partition(p2) set english=crc32(english+119);
drop table test1;
#range  分区
create table test1(a1 int,chinese int,math int,english int)partition by range(a1)(partition p0 VALUES less than MAXVALUE);
insert INTO test1 partition(p0) VALUES(1,110,101,119);
insert  INTO test1 partition(p0) VALUES(2,112,150,100);
insert  INTO test1 partition(p0) VALUES(3,118,140,115);
SELECT * from test1 partition(p0) order by a1 asc;
a1	chinese	math	english
1	110	101	119
2	112	150	100
3	118	140	115
delete from test1 partition(p0) where crc32(english=100) LIMIT 1;
SELECT * from test1 partition(p0) order by a1 asc;
a1	chinese	math	english
2	112	150	100
3	118	140	115
delete from test1 partition(p0) where english<(SELECT english from test1 where english=(SELECT english from test1 where crc32(english=115) LIMIT 1));
SELECT * from test1 partition(p0) order by a1 asc;
a1	chinese	math	english
2	112	150	100
3	118	140	115
update test1 partition(p0) set english=120 where crc32(english=115);
update test1 partition(p0) set english=119 where english=crc32(115+115);
SELECT * from test1 partition(p0) order by a1 asc;
a1	chinese	math	english
2	112	150	120
3	118	140	120
update test1 partition(p0) set english=crc32(101) LIMIT 1;
SELECT * from test1 partition(p0) order by a1 asc;
a1	chinese	math	english
2	112	150	1416650876
3	118	140	120
drop table test1;
#key    分区
create table test1(a1 int,chinese int,math int,english int)partition by key(a1);
insert INTO test1 partition(p0) VALUES(1,110,101,119);
insert  INTO test1 partition(p0) VALUES(2,112,150,100);
insert  INTO test1 partition(p0) VALUES(3,118,140,115);
SELECT * from test1 partition(p0) order by a1 asc;
a1	chinese	math	english
1	110	101	119
2	112	150	100
3	118	140	115
delete from test1  partition(p0) where crc32(english=100) LIMIT 1;
SELECT * from test1 partition(p0) order by a1 asc;
a1	chinese	math	english
2	112	150	100
3	118	140	115
delete from test1 partition(p0) where english<(SELECT english from test1 where crc32(english=(SELECT english from test1 where english=115 LIMIT 1) )LIMIT 1);
SELECT * from test1 partition(p0) order by a1 asc;
a1	chinese	math	english
2	112	150	100
3	118	140	115
update test1 partition(p0) set english=crc32(120) where english=115;
update test1  partition(p0) set english=crc32(english+109) where english=(SELECT english from test1 where english=119 LIMIT 1 );
SELECT * from test1 partition(p0) order by a1 asc;
a1	chinese	math	english
2	112	150	100
3	118	140	289485416
update test1 partition(p0) set english=crc32(english+101) LIMIT 1;
SELECT * from test1 partition(p0) order by a1 asc;
a1	chinese	math	english
2	112	150	1446436389
3	118	140	289485416
drop table test1;
# Clean up users
drop user hjw@'%' ;
