drop table if exists t1,t2;
result_format: 4
create table t1(c1 int, c2 int, c3 int);
create table t2(c1 int primary key, c2 int, c3 int, unique key uk0(c2));

## 1. batch insert
insert into t2 select * from t1;
ERROR 23000: Duplicate entry '0' for key 'PRIMARY'
select sum(c1), sum(c2), sum(c3) from t2;
+---------+---------+---------+
| sum(c1) | sum(c2) | sum(c3) |
+---------+---------+---------+
|    NULL |    NULL |    NULL |
+---------+---------+---------+
insert into t2 select * from t1 on duplicate key update c3 = c3 + 1;
select sum(c1), sum(c2), sum(c3) from t2;
+---------+---------+---------+
| sum(c1) | sum(c2) | sum(c3) |
+---------+---------+---------+
|  499500 |  499500 |  500500 |
+---------+---------+---------+

## 2. test merge uncommitted
begin;
delete from t2;
rollback;
insert into t2 select * from t1 on duplicate key update c3 = c3 + 1;
insert ignore into t2 select * from t1;
select sum(c1), sum(c2), sum(c3) from t2;
+---------+---------+---------+
| sum(c1) | sum(c2) | sum(c3) |
+---------+---------+---------+
|  499500 |  499500 |  502500 |
+---------+---------+---------+
replace into t2 select * from t1;
select sum(c1), sum(c2), sum(c3) from t2;
+---------+---------+---------+
| sum(c1) | sum(c2) | sum(c3) |
+---------+---------+---------+
|  499500 | 1499500 |  499500 |
+---------+---------+---------+

begin;
delete from t2;
alter system minor freeze tenant = sys;
alter system minor freeze tenant = all_user;
alter system minor freeze tenant = all_meta;
insert into t2 select * from t1 on duplicate key update c3 = c3 + 1;
alter system minor freeze tenant = sys;
alter system minor freeze tenant = all_user;
alter system minor freeze tenant = all_meta;
insert into t2 values(2000, 2000, 2000);
alter system minor freeze tenant = sys;
alter system minor freeze tenant = all_user;
alter system minor freeze tenant = all_meta;
insert into t2 values(3000, 3000, 3000);
alter system minor freeze tenant = sys;
alter system minor freeze tenant = all_user;
alter system minor freeze tenant = all_meta;
select sum(c1), sum(c2), sum(c3) from t2;
+---------+---------+---------+
| sum(c1) | sum(c2) | sum(c3) |
+---------+---------+---------+
|  504500 |  504500 |  505500 |
+---------+---------+---------+
alter system minor freeze tenant = sys;
alter system minor freeze tenant = all_user;
alter system minor freeze tenant = all_meta;
select sum(c1), sum(c2), sum(c3) from t2;
+---------+---------+---------+
| sum(c1) | sum(c2) | sum(c3) |
+---------+---------+---------+
|  504500 |  504500 |  505500 |
+---------+---------+---------+
commit;
insert into t2 select * from t1 on duplicate key update c3 = c3 + 1;
select sum(c1), sum(c2), sum(c3) from t2;
+---------+---------+---------+
| sum(c1) | sum(c2) | sum(c3) |
+---------+---------+---------+
|  504500 |  504500 |  507500 |
+---------+---------+---------+
delete from t2;

begin;
insert into t2 select * from t1 on duplicate key update c3 = c3 + 1;
select sum(c1), sum(c2), sum(c3) from t2;
+---------+---------+---------+
| sum(c1) | sum(c2) | sum(c3) |
+---------+---------+---------+
|  499500 |  499500 |  500500 |
+---------+---------+---------+
alter system minor freeze tenant = sys;
alter system minor freeze tenant = all_user;
alter system minor freeze tenant = all_meta;
insert into t2 select * from t1 on duplicate key update c3 = c3 + 1;
select sum(c1), sum(c2), sum(c3) from t2;
+---------+---------+---------+
| sum(c1) | sum(c2) | sum(c3) |
+---------+---------+---------+
|  499500 |  499500 |  502500 |
+---------+---------+---------+
alter system minor freeze tenant = sys;
alter system minor freeze tenant = all_user;
alter system minor freeze tenant = all_meta;
insert into t2 select * from t1 on duplicate key update c3 = c3 + 1;
select sum(c1), sum(c2), sum(c3) from t2;
+---------+---------+---------+
| sum(c1) | sum(c2) | sum(c3) |
+---------+---------+---------+
|  499500 |  499500 |  504500 |
+---------+---------+---------+
alter system minor freeze tenant = sys;
alter system minor freeze tenant = all_user;
alter system minor freeze tenant = all_meta;
rollback;
insert into t2 select * from t1 on duplicate key update c3 = c3 + 1;
select sum(c1), sum(c2), sum(c3) from t2;
+---------+---------+---------+
| sum(c1) | sum(c2) | sum(c3) |
+---------+---------+---------+
|  499500 |  499500 |  500500 |
+---------+---------+---------+

begin;
insert into t2 select * from t1 on duplicate key update c3 = c3 + 1;
delete from t2;
alter system minor freeze tenant = sys;
alter system minor freeze tenant = all_user;
alter system minor freeze tenant = all_meta;
select sum(c1), sum(c2), sum(c3) from t2;
+---------+---------+---------+
| sum(c1) | sum(c2) | sum(c3) |
+---------+---------+---------+
|    NULL |    NULL |    NULL |
+---------+---------+---------+
insert into t2 select * from t1 on duplicate key update c3 = c3 + 1;
alter system minor freeze tenant = sys;
alter system minor freeze tenant = all_user;
alter system minor freeze tenant = all_meta;
delete from t2;
alter system minor freeze tenant = sys;
alter system minor freeze tenant = all_user;
alter system minor freeze tenant = all_meta;
select sum(c1), sum(c2), sum(c3) from t2;
+---------+---------+---------+
| sum(c1) | sum(c2) | sum(c3) |
+---------+---------+---------+
|    NULL |    NULL |    NULL |
+---------+---------+---------+
rollback;
insert into t2 select * from t1 on duplicate key update c3 = c3 + 1;
select sum(c1), sum(c2), sum(c3) from t2;
+---------+---------+---------+
| sum(c1) | sum(c2) | sum(c3) |
+---------+---------+---------+
|  499500 |  499500 |  502500 |
+---------+---------+---------+

## 3. test primary key conflict and unique key conflict
delete from t2;
insert into t2 select * from t1 on duplicate key update c3 = c3 + 1;
## 更新pk，会拆分成delete + insert, 不会报主键冲突
## 更新唯一索引且跨越了存储层一批的边界会冲突
update t2 set c2 = c2 + 500;
ERROR 23000: Duplicate entry '500' for key 'uk0'

update t2 set c1 = c1 + 2000;
update t2 set c2 = c2 + 2000;
select sum(c1), sum(c2), sum(c3) from t2;
+---------+---------+---------+
| sum(c1) | sum(c2) | sum(c3) |
+---------+---------+---------+
| 2499500 | 2499500 |  500500 |
+---------+---------+---------+
insert into t2 select * from t1 on duplicate key update c1 = c1 + 1000;
select sum(c1), sum(c2), sum(c3) from t2;
+---------+---------+---------+
| sum(c1) | sum(c2) | sum(c3) |
+---------+---------+---------+
| 3999000 | 2999000 | 1000000 |
+---------+---------+---------+
insert into t2 select * from t1 on duplicate key update c2 = c2 + 3000;
select sum(c1), sum(c2), sum(c3) from t2;
+---------+---------+---------+
| sum(c1) | sum(c2) | sum(c3) |
+---------+---------+---------+
| 4498500 | 7498500 | 1499500 |
+---------+---------+---------+
insert into t2 select * from t1 on duplicate key update c3 = c3 + 1;
select sum(c1), sum(c2), sum(c3) from t2;
+---------+---------+---------+
| sum(c1) | sum(c2) | sum(c3) |
+---------+---------+---------+
| 4498500 | 7498500 | 1501500 |
+---------+---------+---------+

drop table t1;
drop table t2;
