drop table if exists t1, t2, t3, t4, t5, t6, t9;
result_format: 4
create table t1(c1 int primary key, c2 int, c3 int);
insert into t1 values(1,1,1),(2,2,2),(3,3,3),(4,4,4),(1,1,1),(2,2,2) on duplicate key update c2 = c2 + 100, c3 = c3 + 10;
insert into t1 values(4,4,4),(6, 6, 6),(7,7,7),(8,8,8) on duplicate key update c2 = c2 + 100, c3 = c3 + 10;
insert into t1 values(((9)),(9),((9))),(((10)),(10),((10))),(((11)), (11), ((11))) on duplicate key update c2 = c2, c3 = c3;
insert into t1 values(((12)),(12),((12))),(((13)),(13),((13))) on duplicate key update c2 = c2, c3 = c3;
select * from t1;
+----+------+------+
| c1 | c2   | c3   |
+----+------+------+
|  1 |  101 |   11 |
|  2 |  102 |   12 |
|  3 |    3 |    3 |
|  4 |  104 |   14 |
|  6 |    6 |    6 |
|  7 |    7 |    7 |
|  8 |    8 |    8 |
|  9 |    9 |    9 |
| 10 |   10 |   10 |
| 11 |   11 |   11 |
| 12 |   12 |   12 |
| 13 |   13 |   13 |
+----+------+------+
insert into t1 values(((9)),(9),((9))),(((10)),(10),((10))),(((11)), (11), ((11))) on duplicate key update c2 = 99, c3 = 100;
select * from t1;
+----+------+------+
| c1 | c2   | c3   |
+----+------+------+
|  1 |  101 |   11 |
|  2 |  102 |   12 |
|  3 |    3 |    3 |
|  4 |  104 |   14 |
|  6 |    6 |    6 |
|  7 |    7 |    7 |
|  8 |    8 |    8 |
|  9 |   99 |  100 |
| 10 |   99 |  100 |
| 11 |   99 |  100 |
| 12 |   12 |   12 |
| 13 |   13 |   13 |
+----+------+------+

select hit_count, is_batched_multi_stmt, statement from oceanbase.gv$OB_PLAN_CACHE_PLAN_STAT where statement like 'insert into t1%' order by hit_count;
+-----------+-----------------------+---------------------------------------------------------------------------------+
| hit_count | is_batched_multi_stmt | statement                                                                       |
+-----------+-----------------------+---------------------------------------------------------------------------------+
|         0 |                     1 | insert into t1 values(((?)),(?),((?))) on duplicate key update c2 = ?, c3 = ?   |
|         1 |                     1 | insert into t1 values(?,?,?) on duplicate key update c2 = c2 + ?, c3 = c3 + ?   |
|         1 |                     1 | insert into t1 values(((?)),(?),((?))) on duplicate key update c2 = c2, c3 = c3 |
+-----------+-----------------------+---------------------------------------------------------------------------------+
insert into t1 values(4,4,4),(6, 6, 6),(7,7,7),(8,8,8) on duplicate ke update c2 = c2 + 100, c3 = c3 + 10;
ERROR 42000: You have an error in your SQL syntax; check the manual that corresponds to your OceanBase version for the right syntax to use near 'ke update c2 = c2 + 100, c3 = c3 + 10' at line 1

insert into t1 values(4,4,4),(6, 6, 6),(7,7,7),(8,8,8) on key update c2 = c2 + 100, c3 = c3 + 10;
ERROR 42000: You have an error in your SQL syntax; check the manual that corresponds to your OceanBase version for the right syntax to use near 'key update c2 = c2 + 100, c3 = c3 + 10' at line 1

insert into t1 values(4,4,4),(6, 6, 6),(7,7,7),(8,8,8) on duplicate key update set c2 = c2 + 100, c3 = c3 + 10;
ERROR 42000: You have an error in your SQL syntax; check the manual that corresponds to your OceanBase version for the right syntax to use near 'c2 = c2 + 100, c3 = c3 + 10;' at line 1

insert into t1 values(4,4,4),(6, 6, 6),(7,7,7),(8,8,8) on duplicate key c2 = c2 + 100, c3 = c3 + 10;
ERROR 42000: You have an error in your SQL syntax; check the manual that corresponds to your OceanBase version for the right syntax to use near 'c2 = c2 + 100, c3 = c3 + 10' at line 1

insert into values(4,4,4),(6, 6, 6),(7,7,7) on duplicate key update c2 = c2 + 100, c3 = c3 + 10;
ERROR 42000: You have an error in your SQL syntax; check the manual that corresponds to your OceanBase version for the right syntax to use near 'values(4,4,4) on duplicate key update c2 = c2 + 100, c3 = c3 + 10;' at line 1

insert into t1 values(4,4,4)(6,6,6)(7,7,7) on duplicate key update c2 = c2 + 100, c3 = c3 + 10;
ERROR 42000: You have an error in your SQL syntax; check the manual that corresponds to your OceanBase version for the right syntax to use near '(6,6,6)(7,7,7) on duplicate key update c2 = c2 + 100, c3 = c3 + 10' at line 1

insert into t1 values(4,4,4),(6,6,6),(7,7,7) on duplicate key update c2 = c2 + 100 c3 = c3 + 10;
ERROR 42000: You have an error in your SQL syntax; check the manual that corresponds to your OceanBase version for the right syntax to use near 'c3 = c3 + 10;' at line 1

insert into t1 values(4,4,4),(6,6,6),(7,7,7) on duplicate key update c2 =;
ERROR 42000: You have an error in your SQL syntax; check the manual that corresponds to your OceanBase version for the right syntax to use near ';' at line 1

insert into t1 values(4,4,4),(6,6,6),(7,7,7) on duplicate key update c2 + 100;
ERROR 42000: You have an error in your SQL syntax; check the manual that corresponds to your OceanBase version for the right syntax to use near '+ 100;' at line 1

delete from t1;

alter system flush plan cache global;

insert into t1 values(1,1+1,1+1),(2,2+1,2+1),(3,3+1,3+1),(1,1+1,1+1) on duplicate key update c2 = c2 + 100, c3 = c3 + 10;
insert into t1 values(10,10+1,10+1),(12,12+1,12+1),(13,13+1,13+1),(10,10+1,10+1) on duplicate key update c2 = c2 + 100, c3 = c3 + 10;

## can't do batch , Can't find the values token position exactly
insert into t1 values(10,10+1,10+1),(12,12+1,12+1),(13,13+1,13+1),(10,10+1,10+1) on duplicate key update c2 = values(c2), c3 = values(c3);
insert into t1 values(10,10+10,10+10),(12 ,12+12, 12+12) on duplicate key update c2 = values(c2), c3 = values(c3);
select * from t1;
+----+------+------+
| c1 | c2   | c3   |
+----+------+------+
|  1 |  102 |   12 |
|  2 |    3 |    3 |
|  3 |    4 |    4 |
| 10 |   20 |   20 |
| 12 |   24 |   24 |
| 13 |   14 |   14 |
+----+------+------+

select hit_count, is_batched_multi_stmt, statement from oceanbase.gv$OB_PLAN_CACHE_PLAN_STAT where statement like 'insert into t1 values%' order by hit_count;
+-----------+-----------------------+-------------------------------------------------------------------------------------------------------------------------------+
| hit_count | is_batched_multi_stmt | statement                                                                                                                     |
+-----------+-----------------------+-------------------------------------------------------------------------------------------------------------------------------+
|         0 |                     0 | insert into t1 values(?,?+?,?+?),(?,?+?,?+?),(?,?+?,?+?),(?,?+?,?+?) on duplicate key update c2 = values(c2), c3 = values(c3) |
|         0 |                     0 | insert into t1 values(?,?+?,?+?),(? ,?+?, ?+?) on duplicate key update c2 = values(c2), c3 = values(c3)                       |
|         1 |                     1 | insert into t1 values(?,?+?,?+?) on duplicate key update c2 = c2 + ?, c3 = c3 + ?                                             |
+-----------+-----------------------+-------------------------------------------------------------------------------------------------------------------------------+
drop table t1;

create table t2(c1 int auto_increment, c2 varchar(20) primary key, c3 int);
insert into t2(c2, c3) values('1',1),('2',2),('3',3);
insert into t2(c2, c3) values('4',4),('5',5),('6',6);
select * from t2;
+----+----+------+
| c1 | c2 | c3   |
+----+----+------+
|  1 | 1  |    1 |
|  2 | 2  |    2 |
|  3 | 3  |    3 |
|  4 | 4  |    4 |
|  5 | 5  |    5 |
|  6 | 6  |    6 |
+----+----+------+

select hit_count, is_batched_multi_stmt, statement from oceanbase.gv$OB_PLAN_CACHE_PLAN_STAT where statement like 'insert into t2%' order by hit_count;
+-----------+-----------------------+------------------------------------+
| hit_count | is_batched_multi_stmt | statement                          |
+-----------+-----------------------+------------------------------------+
|         1 |                     1 | insert into t2(c2, c3) values(?,?) |
+-----------+-----------------------+------------------------------------+
drop table t2;

create table t3(c1 int, c2 int, c3 int);
insert into t3 values(1,1),(2,2),(3,3);
ERROR 21S01: Column count doesn't match value count at row 1
insert into t3(c2,c3) values(1,1),(2,2 ),(3 , 3);
insert into t3(c2,c3) values(1,1),( 2 ,2 ),( 3, 3);
select * from t3;
+------+------+------+
| c1   | c2   | c3   |
+------+------+------+
| NULL |    1 |    1 |
| NULL |    2 |    2 |
| NULL |    3 |    3 |
| NULL |    1 |    1 |
| NULL |    2 |    2 |
| NULL |    3 |    3 |
+------+------+------+
select hit_count, is_batched_multi_stmt, statement from oceanbase.gv$OB_PLAN_CACHE_PLAN_STAT where statement like 'insert into t3%' order by hit_count;
+-----------+-----------------------+-----------------------------------+
| hit_count | is_batched_multi_stmt | statement                         |
+-----------+-----------------------+-----------------------------------+
|         1 |                     1 | insert into t3(c2,c3) values(?,?) |
+-----------+-----------------------+-----------------------------------+
drop table t3;

## test plan can't reuse
create table t4(c1 int, c2 varchar(20), c3 varchar(20));
insert into t4 values(1, cast('111' as char(3)), '1'),(2, cast('222' as char(3)), '2'),(3, cast('333' as char(3)), '3');
insert into t4 values(11, cast('111' as char(3)), '11'),(12, cast('222' as char(3)), '12');
insert into t4 values(21, cast('111' as char(10)), '21'),(22, cast('222' as char(10)), '22');
insert into t4 values(5, cast('555' as char(10)), '5'),(6, cast('666' as char(12)), '6');

select * from t4;
+------+------+------+
| c1   | c2   | c3   |
+------+------+------+
|    1 | 111  | 1    |
|    2 | 222  | 2    |
|    3 | 333  | 3    |
|   11 | 111  | 11   |
|   12 | 222  | 12   |
|   21 | 111  | 21   |
|   22 | 222  | 22   |
|    5 | 555  | 5    |
|    6 | 666  | 6    |
+------+------+------+
select hit_count, is_batched_multi_stmt, statement from oceanbase.gv$OB_PLAN_CACHE_PLAN_STAT where statement like 'insert into t4%' order by hit_count;
+-----------+-----------------------+--------------------------------------------------+
| hit_count | is_batched_multi_stmt | statement                                        |
+-----------+-----------------------+--------------------------------------------------+
|         1 |                     1 | insert into t4 values(?, cast(? as char(3)), ?)  |
|         1 |                     1 | insert into t4 values(?, cast(? as char(10)), ?) |
+-----------+-----------------------+--------------------------------------------------+
alter system flush plan cache global;

insert into t4 values(7,'7',SUBSTR('777',2)),(8,'8',SUBSTR('888',3)),(9,'9',SUBSTR('999',1));
insert into t4 values(17,'17',SUBSTR('777',2)),(18,'18',SUBSTR('999',2)),(19,'19',SUBSTR('000',2));
insert into t4 values(21,'21',SUBSTR('222',2)),(22,'22',SUBSTR('888',2));
insert into t4 values(31,'31',SUBSTR('333',1)),(32,'32',SUBSTR('888',1));
select * from t4;
+------+------+------+
| c1   | c2   | c3   |
+------+------+------+
|    1 | 111  | 1    |
|    2 | 222  | 2    |
|    3 | 333  | 3    |
|   11 | 111  | 11   |
|   12 | 222  | 12   |
|   21 | 111  | 21   |
|   22 | 222  | 22   |
|    5 | 555  | 5    |
|    6 | 666  | 6    |
|    7 | 7    | 77   |
|    8 | 8    | 8    |
|    9 | 9    | 999  |
|   17 | 17   | 77   |
|   18 | 18   | 99   |
|   19 | 19   | 00   |
|   21 | 21   | 22   |
|   22 | 22   | 88   |
|   31 | 31   | 333  |
|   32 | 32   | 888  |
+------+------+------+

select hit_count, is_batched_multi_stmt, statement from oceanbase.gv$OB_PLAN_CACHE_PLAN_STAT where statement like 'insert into t4%' order by hit_count;
+-----------+-----------------------+----------------------------------------------------------------------------+
| hit_count | is_batched_multi_stmt | statement                                                                  |
+-----------+-----------------------+----------------------------------------------------------------------------+
|         0 |                     0 | insert into t4 values(?,?,SUBSTR(?,2)),(?,?,SUBSTR(?,3)),(?,?,SUBSTR(?,1)) |
|         0 |                     1 | insert into t4 values(?,?,SUBSTR(?,1))                                     |
|         1 |                     1 | insert into t4 values(?,?,SUBSTR(?,2))                                     |
+-----------+-----------------------+----------------------------------------------------------------------------+
drop table t4;

create table t5(c1 int, c2 int, c3 varchar(20), c4 int);

insert into t5 values(1,1+1,concat('1','1'),1-1),(2,2+2,concat('2','2'),2-1),(3,3+3,concat('3','3'),3-1);
insert into t5 values(1,1+1,concat('1','1'),1-1),(2,2+2,concat('2',2),2-1),(3,3+3,concat('3','3'),3-1);
insert into t5 values(7,7,'7',7),(8,8,'8',8+8),(9,9,'9',9+0);

select * from t5;
+------+------+------+------+
| c1   | c2   | c3   | c4   |
+------+------+------+------+
|    1 |    2 | 11   |    0 |
|    2 |    4 | 22   |    1 |
|    3 |    6 | 33   |    2 |
|    1 |    2 | 11   |    0 |
|    2 |    4 | 22   |    1 |
|    3 |    6 | 33   |    2 |
|    7 |    7 | 7    |    7 |
|    8 |    8 | 8    |   16 |
|    9 |    9 | 9    |    9 |
+------+------+------+------+
delete from t5;

insert into t5 values(7,7,'7' + '7',7),(8,8,'8' + '8',8),(9,9,'9' + 9,9);
select * from t5;
+------+------+------+------+
| c1   | c2   | c3   | c4   |
+------+------+------+------+
|    7 |    7 | 14   |    7 |
|    8 |    8 | 16   |    8 |
|    9 |    9 | 18   |    9 |
+------+------+------+------+

select hit_count, is_batched_multi_stmt, statement from oceanbase.gv$OB_PLAN_CACHE_PLAN_STAT where statement like 'insert into t5%' order by hit_count;
+-----------+-----------------------+----------------------------------------------------------------------------------------------+
| hit_count | is_batched_multi_stmt | statement                                                                                    |
+-----------+-----------------------+----------------------------------------------------------------------------------------------+
|         0 |                     1 | insert into t5 values(?,?+?,concat(?,?),?-?)                                                 |
|         0 |                     0 | insert into t5 values(?,?+?,concat(?,?),?-?),(?,?+?,concat(?,?),?-?),(?,?+?,concat(?,?),?-?) |
|         0 |                     0 | insert into t5 values(?,?,?,?),(?,?,?,?+?),(?,?,?,?+?)                                       |
|         0 |                     0 | insert into t5 values(?,?,? + ?,?),(?,?,? + ?,?),(?,?,? + ?,?)                               |
+-----------+-----------------------+----------------------------------------------------------------------------------------------+
drop table t5;

create table t6(c1 varchar(20));
insert into t6 values(concat(1,1)),(concat(2,2));
insert into t6 values(concat('1','1')),(concat('2','2'));
select * from t6;
+------+
| c1   |
+------+
| 11   |
| 22   |
| 11   |
| 22   |
+------+
select hit_count, is_batched_multi_stmt, statement from oceanbase.gv$OB_PLAN_CACHE_PLAN_STAT where statement like 'insert into t6%' order by hit_count;
+-----------+-----------------------+------------------------------------+
| hit_count | is_batched_multi_stmt | statement                          |
+-----------+-----------------------+------------------------------------+
|         0 |                     1 | insert into t6 values(concat(?,?)) |
|         0 |                     1 | insert into t6 values(concat(?,?)) |
+-----------+-----------------------+------------------------------------+
drop table t6;


