drop table if exists t1, t2, t3, t4, t5, t6, t9;
result_format: 4

create table t1(c1 int primary key, c2 int, c3 varchar(20), c4 decimal(10,3), c5 enum('car','bicycle','bus','train'), c6 timestamp default 0, c7 datetime, c8 varchar(20));
## test basic batch opt
insert into t1 values(1,1,'1',1.11,'car','2022-2-1 01:01:01','2022-2-2 02:02:01','1'),(2,2,'2',2.222,'bicycle','2022-2-2 02:02:02','2022-2-3 02:03:03','2'),(3,3,'3',3.333,'bus','2022-2-2 02:02:04','2022-2-3 02:04:03','3');
select * from t1;
+----+------+------+-------+---------+---------------------+---------------------+------+
| c1 | c2   | c3   | c4    | c5      | c6                  | c7                  | c8   |
+----+------+------+-------+---------+---------------------+---------------------+------+
|  1 |    1 | 1    | 1.110 | car     | 2022-02-01 01:01:01 | 2022-02-02 02:02:01 | 1    |
|  2 |    2 | 2    | 2.222 | bicycle | 2022-02-02 02:02:02 | 2022-02-03 02:03:03 | 2    |
|  3 |    3 | 3    | 3.333 | bus     | 2022-02-02 02:02:04 | 2022-02-03 02:04:03 | 3    |
+----+------+------+-------+---------+---------------------+---------------------+------+
delete from t1;

insert into t1 values(1 ,1,'1', 1.11 ,'car','2022-2-1 01:01:01' ,'2022-2-2 02:02:01','1' ),(2,2,'2',2.222,'bicycle','2022-2-2 02:02:02','2022-2-3 02:03:03','2'),(3,3,'3', 3.333,'bus' ,'2022-2-2 02:02:04' , '2022-2-3 02:04:03','3'),(4,4,'4', 4.333,'train' ,'2022-2-5 05:02:04','2022-2-5 05:04:03','4' );
select * from t1;
+----+------+------+-------+---------+---------------------+---------------------+------+
| c1 | c2   | c3   | c4    | c5      | c6                  | c7                  | c8   |
+----+------+------+-------+---------+---------------------+---------------------+------+
|  1 |    1 | 1    | 1.110 | car     | 2022-02-01 01:01:01 | 2022-02-02 02:02:01 | 1    |
|  2 |    2 | 2    | 2.222 | bicycle | 2022-02-02 02:02:02 | 2022-02-03 02:03:03 | 2    |
|  3 |    3 | 3    | 3.333 | bus     | 2022-02-02 02:02:04 | 2022-02-03 02:04:03 | 3    |
|  4 |    4 | 4    | 4.333 | train   | 2022-02-05 05:02:04 | 2022-02-05 05:04:03 | 4    |
+----+------+------+-------+---------+---------------------+---------------------+------+
delete from t1;

select hit_count, is_batched_multi_stmt, statement from oceanbase.gv$OB_PLAN_CACHE_PLAN_STAT where statement like 'insert into t1 values%' order by hit_count;
+-----------+-----------------------+---------------------------------------------+
| hit_count | is_batched_multi_stmt | statement                                   |
+-----------+-----------------------+---------------------------------------------+
|         0 |                     1 | insert into t1 values(?,?,?,?,?,?,?,?)      |
|         0 |                     1 | insert into t1 values(? ,?,?, ? ,?,? ,?,? ) |
+-----------+-----------------------+---------------------------------------------+

insert into t1 values(1 ,1,'1', 1.11 ,'car','2022-2-1 01:01:01' ,'2022-2-2 02:02:01','1' ),(2,2,'2',2.222,'bicycle','2022-2-2 02:02:02','2022-2-3 02:03:03','2'),(3,3,'3', 3.333,'bus' ,'2022-2-2 02:02:04' , '2022-2-3 02:04:03','3'),(4,4,'4', 4.333,'train' ,'2022-2-5 05:02:04','2022-2-5 05:04:03','4' ) on duplicate key update c2 = c2 + 10, c4 = c4 + 10;
select * from t1;
+----+------+------+-------+---------+---------------------+---------------------+------+
| c1 | c2   | c3   | c4    | c5      | c6                  | c7                  | c8   |
+----+------+------+-------+---------+---------------------+---------------------+------+
|  1 |    1 | 1    | 1.110 | car     | 2022-02-01 01:01:01 | 2022-02-02 02:02:01 | 1    |
|  2 |    2 | 2    | 2.222 | bicycle | 2022-02-02 02:02:02 | 2022-02-03 02:03:03 | 2    |
|  3 |    3 | 3    | 3.333 | bus     | 2022-02-02 02:02:04 | 2022-02-03 02:04:03 | 3    |
|  4 |    4 | 4    | 4.333 | train   | 2022-02-05 05:02:04 | 2022-02-05 05:04:03 | 4    |
+----+------+------+-------+---------+---------------------+---------------------+------+

insert into t1 values(1 ,1,'1', 1.11 ,'car','2022-2-1 01:01:01' ,'2022-2-2 02:02:01','1' ),(2,2,'2',2.222,'bicycle','2022-2-2 02:02:02','2022-2-3 02:03:03','2'),(3,3,'3', 3.333,'bus' ,'2022-2-2 02:02:04' , '2022-2-3 02:04:03','3'),(4,4,'4', 4.333,'train' ,'2022-2-5 05:02:04','2022-2-5 05:04:03','4' ) on duplicate key update c2 = c2 + 10, c4 = c4 + 10;
select * from t1;
+----+------+------+--------+---------+---------------------+---------------------+------+
| c1 | c2   | c3   | c4     | c5      | c6                  | c7                  | c8   |
+----+------+------+--------+---------+---------------------+---------------------+------+
|  1 |   11 | 1    | 11.110 | car     | 2022-02-01 01:01:01 | 2022-02-02 02:02:01 | 1    |
|  2 |   12 | 2    | 12.222 | bicycle | 2022-02-02 02:02:02 | 2022-02-03 02:03:03 | 2    |
|  3 |   13 | 3    | 13.333 | bus     | 2022-02-02 02:02:04 | 2022-02-03 02:04:03 | 3    |
|  4 |   14 | 4    | 14.333 | train   | 2022-02-05 05:02:04 | 2022-02-05 05:04:03 | 4    |
+----+------+------+--------+---------+---------------------+---------------------+------+

replace into t1 values(1 ,11,'11', 11.11 ,'car','2022-2-1 11:01:01' ,'2022-2-2 12:02:01','11' ),(2,22,'22',22.222,'bicycle','2022-2-2 22:02:02','2022-2-3 22:03:03','22'),(3,33,'33', 33.333,'bus' ,'2022-2-2 12:02:04' , '2022-2-3 12:04:03','33'),(4,44,'44', 44.333,'train' ,'2022-2-5 15:02:04','2022-2-5 15:04:03','44' );
select * from t1;
+----+------+------+--------+---------+---------------------+---------------------+------+
| c1 | c2   | c3   | c4     | c5      | c6                  | c7                  | c8   |
+----+------+------+--------+---------+---------------------+---------------------+------+
|  1 |   11 | 11   | 11.110 | car     | 2022-02-01 11:01:01 | 2022-02-02 12:02:01 | 11   |
|  2 |   22 | 22   | 22.222 | bicycle | 2022-02-02 22:02:02 | 2022-02-03 22:03:03 | 22   |
|  3 |   33 | 33   | 33.333 | bus     | 2022-02-02 12:02:04 | 2022-02-03 12:04:03 | 33   |
|  4 |   44 | 44   | 44.333 | train   | 2022-02-05 15:02:04 | 2022-02-05 15:04:03 | 44   |
+----+------+------+--------+---------+---------------------+---------------------+------+
drop table t1;

select hit_count, is_batched_multi_stmt, statement from oceanbase.gv$OB_PLAN_CACHE_PLAN_STAT where statement like 'insert into t1 values%' order by hit_count;
+-----------+-----------------------+----------------------------------------------------------------------------------------------+
| hit_count | is_batched_multi_stmt | statement                                                                                    |
+-----------+-----------------------+----------------------------------------------------------------------------------------------+
|         0 |                     1 | insert into t1 values(?,?,?,?,?,?,?,?)                                                       |
|         0 |                     1 | insert into t1 values(? ,?,?, ? ,?,? ,?,? )                                                  |
|         1 |                     1 | insert into t1 values(? ,?,?, ? ,?,? ,?,? ) on duplicate key update c2 = c2 + ?, c4 = c4 + ? |
+-----------+-----------------------+----------------------------------------------------------------------------------------------+
create table t2(c1 int primary key, c2 int, c3 int, c4 varchar(50));
insert into t2 values(1,1,1,'1'),(2,2,2,'2'),(3,3,3,'3'),(4,4,4,'4'),(5,5,5,'5');
insert into t2 values(6, 6, 6 ,  '6'  ),( 7,  7,  7 , '7'),(8,8,8, '8' ),(9 , 9, 9, '9');
insert into t2 values(10, 10, 10 ,  '10'  ),(11,11,11, '11'),(12,12,12, '12' ),( 13 , 13, 13 , '13' );
insert into t2(c1,c2,c3,c4) values(15,15,15,'15'), (16, 16 , 16, '16' ),(17, 17, 17 , '17' ) , (18, 18, 18,'18');
insert into t2(c1,c2,c3,c4) values(20,20,20,'20'),(21,21,21, '21' ),(22, 22 , 22 , '22' );
insert into t2 values(24,-24,24,'24'),(25, -25, -25,'25'),(26,26,-26,'26');
insert into t2 values(27,27,-27,'27'),(28,-28,-28,'28'),(29,-29,29,'29');

insert into t2(c1,c2,c3,c4) values(30, 30+1,30-1,'30'), (31, 31+1, 31-1,'31') , (32, 32+1 , 32-1, '32');
insert into t2(c1,c2,c3,c4) values(40, 40+10,40-10,'40') , (41, 41+10 , 41-10, '41'),(42,42+10, 42-10,'42');

select * from t2;
+----+------+------+------+
| c1 | c2   | c3   | c4   |
+----+------+------+------+
|  1 |    1 |    1 | 1    |
|  2 |    2 |    2 | 2    |
|  3 |    3 |    3 | 3    |
|  4 |    4 |    4 | 4    |
|  5 |    5 |    5 | 5    |
|  6 |    6 |    6 | 6    |
|  7 |    7 |    7 | 7    |
|  8 |    8 |    8 | 8    |
|  9 |    9 |    9 | 9    |
| 10 |   10 |   10 | 10   |
| 11 |   11 |   11 | 11   |
| 12 |   12 |   12 | 12   |
| 13 |   13 |   13 | 13   |
| 15 |   15 |   15 | 15   |
| 16 |   16 |   16 | 16   |
| 17 |   17 |   17 | 17   |
| 18 |   18 |   18 | 18   |
| 20 |   20 |   20 | 20   |
| 21 |   21 |   21 | 21   |
| 22 |   22 |   22 | 22   |
| 24 |  -24 |   24 | 24   |
| 25 |  -25 |  -25 | 25   |
| 26 |   26 |  -26 | 26   |
| 27 |   27 |  -27 | 27   |
| 28 |  -28 |  -28 | 28   |
| 29 |  -29 |   29 | 29   |
| 30 |   31 |   29 | 30   |
| 31 |   32 |   30 | 31   |
| 32 |   33 |   31 | 32   |
| 40 |   50 |   30 | 40   |
| 41 |   51 |   31 | 41   |
| 42 |   52 |   32 | 42   |
+----+------+------+------+

select hit_count, is_batched_multi_stmt, statement from oceanbase.gv$OB_PLAN_CACHE_PLAN_STAT where statement like 'insert into t2%' order by hit_count;
+-----------+-----------------------+--------------------------------------------------+
| hit_count | is_batched_multi_stmt | statement                                        |
+-----------+-----------------------+--------------------------------------------------+
|         1 |                     1 | insert into t2 values(?, ?, ? ,  ?  )            |
|         1 |                     1 | insert into t2(c1,c2,c3,c4) values(?,?,?,?)      |
|         1 |                     1 | insert into t2(c1,c2,c3,c4) values(?, ?+?,?-?,?) |
|         2 |                     1 | insert into t2 values(?,?,?,?)                   |
+-----------+-----------------------+--------------------------------------------------+
delete from t2;
alter system flush plan cache global;

insert into t2 values(1, 1 + 1, 1 - 1, '1'),(2,2+1,2-1,'2'),(3,3+1,3-1,'3');
insert into t2 values(5, 5 + 1, 5 - 1, '5'),(6, 6 + 1, 6-1,'6'),(7,7+1,7-1,'7');
insert into t2 values(10, 10 * 1, 10 / 1, '10'),(11, 11 * 2, 11 / 1,'11'), (12, 12*2, 12/2,'12');

select hit_count, is_batched_multi_stmt, statement from oceanbase.gv$OB_PLAN_CACHE_PLAN_STAT where statement like 'insert into t2%' order by hit_count;
+-----------+-----------------------+--------------------------------------------------------------------------------+
| hit_count | is_batched_multi_stmt | statement                                                                      |
+-----------+-----------------------+--------------------------------------------------------------------------------+
|         0 |                     0 | insert into t2 values(?, ? + ?, ? - ?, ?),(?,?+?,?-?,?),(?,?+?,?-?,?)          |
|         0 |                     0 | insert into t2 values(?, ? + ?, ? - ?, ?),(?, ? + ?, ?-?,?),(?,?+?,?-?,?)      |
|         0 |                     0 | insert into t2 values(?, ? * ?, ? / ?, ?),(?, ? * ?, ? / ?,?), (?, ?*?, ?/?,?) |
+-----------+-----------------------+--------------------------------------------------------------------------------+
select * from t2;
+----+------+------+------+
| c1 | c2   | c3   | c4   |
+----+------+------+------+
|  1 |    2 |    0 | 1    |
|  2 |    3 |    1 | 2    |
|  3 |    4 |    2 | 3    |
|  5 |    6 |    4 | 5    |
|  6 |    7 |    5 | 6    |
|  7 |    8 |    6 | 7    |
| 10 |   10 |   10 | 10   |
| 11 |   22 |   11 | 11   |
| 12 |   24 |    6 | 12   |
+----+------+------+------+
drop table t2;

## disable insert values with subquery
create table t3(c1 int primary key, c2 int, c3 int);
create table t4(c1 int primary key, c2 int, c3 int);
insert into t3 values((1),(1),1),((2), (2), (2)),((3),(3),3);
insert into t3 values(((4)),((4)),((4))),(((5)),((5)),((5))),(((6)),((6)),((6)));
insert into t3 values(((7)),((7)),((7))),( ( (8 ) ), (( 8) ) , ( (8) ) ),( ( (9) ), ( (9 )) , ((9)) );
select * from t3;
+----+------+------+
| c1 | c2   | c3   |
+----+------+------+
|  1 |    1 |    1 |
|  2 |    2 |    2 |
|  3 |    3 |    3 |
|  4 |    4 |    4 |
|  5 |    5 |    5 |
|  6 |    6 |    6 |
|  7 |    7 |    7 |
|  8 |    8 |    8 |
|  9 |    9 |    9 |
+----+------+------+
select hit_count, is_batched_multi_stmt, statement from oceanbase.gv$OB_PLAN_CACHE_PLAN_STAT where statement like 'insert into t3%' order by hit_count;
+-----------+-----------------------+--------------------------------------------------------------+
| hit_count | is_batched_multi_stmt | statement                                                    |
+-----------+-----------------------+--------------------------------------------------------------+
|         0 |                     0 | insert into t3 values((?),(?),?),((?), (?), (?)),((?),(?),?) |
|         1 |                     1 | insert into t3 values(((?)),((?)),((?)))                     |
+-----------+-----------------------+--------------------------------------------------------------+
insert into t4 values(1,1,(select c2 from t3 where c1 = 1)),(2,2,(select c2 from t3 where c1 = 2)),(3,3,(select c2 from t3 where c1 = 3));
select hit_count, is_batched_multi_stmt, statement from oceanbase.gv$OB_PLAN_CACHE_PLAN_STAT where statement like 'insert into t4%' order by hit_count;
+-----------+-----------------------+-------------------------------------------------------------------------------------------------------------------------------------------+
| hit_count | is_batched_multi_stmt | statement                                                                                                                                 |
+-----------+-----------------------+-------------------------------------------------------------------------------------------------------------------------------------------+
|         0 |                     0 | insert into t4 values(?,?,(select c2 from t3 where c1 = ?)),(?,?,(select c2 from t3 where c1 = ?)),(?,?,(select c2 from t3 where c1 = ?)) |
+-----------+-----------------------+-------------------------------------------------------------------------------------------------------------------------------------------+
drop table t3;
drop table t4;

## test for global index
create table t5(c1 int primary key, c2 decimal(10, 3), c3 varchar(20), c4 tinyint, c5 date) partition by hash(c1) partitions 3;
create unique index t5_idx_01 on t5(c3) global;
insert into t5 values(1,1.11,'1',1,'2022-02-02'),(2,2.22, '2', 2, '2022-02-03'),(3 , 3.33 , '3', 3, '2022-02-04'),(4,4.4,'4',4,'2022-02-05');
insert into t5 values(6,6.666,'6',6,'2022-02-06'),(7, 7.77,'7' , 7, '2022-02-07');
select /*+index(t5 t5_idx_01)*/ * from t5 order by c1;
+----+-------+------+------+------------+
| c1 | c2    | c3   | c4   | c5         |
+----+-------+------+------+------------+
|  1 | 1.110 | 1    |    1 | 2022-02-02 |
|  2 | 2.220 | 2    |    2 | 2022-02-03 |
|  3 | 3.330 | 3    |    3 | 2022-02-04 |
|  4 | 4.400 | 4    |    4 | 2022-02-05 |
|  6 | 6.666 | 6    |    6 | 2022-02-06 |
|  7 | 7.770 | 7    |    7 | 2022-02-07 |
+----+-------+------+------+------------+
delete from t5;
insert into t5 values(1,1.11,concat('1-','1'),1,'2022-02-02'),(2,2.22, concat('2-', '2'),2, '2022-02-03'),(3 , 3.33 , concat('3-', '3'),3, '2022-02-04');
insert into t5 values(5,5.555,concat('5-','5'),5,'2022-02-05'),(6 , 6.666, concat('6-', '6'),6, '2022-02-06'),(7 , 7.7 , concat('7-', '7'),7, '2022-02-07');
## test for an error SQL syntax
insert into t5 values(5,5.555,concat('5-','5'),5,'2022-02-05'),(6 , 6.666, concat('6-', '6'),6, '2022-02-06'),(7 , 7.7 , co ncat('7-', '7'),7, '2022-02-07');
ERROR 42000: You have an error in your SQL syntax; check the manual that corresponds to your OceanBase version for the right syntax to use near 'ncat('7-', '7'),7, '2022-02-07')' at line 1

insert into t5 values(10, 10.10, left(concat('10-','10'), 4), 10 ,'2022-02-10'), (11, 11.11, left(concat('11-','11'), 4), 11 ,'2022-02-11'), (12, 12.12, left(concat('12-','12'), 4), 12 ,'2022-02-12');
insert into t5 values(20, 20.20, left(concat('20-','20'), 4), 20 ,'2022-02-20'), (21, 21.21 , left(concat('21-' , '21') , 4) , 21 , '2022-02-21'), (22, 22.22, left(concat('22-','22'), 4), 22 ,'2022-02-22');

select /*+index(t5 t5_idx_01)*/ * from t5 order by c1;
+----+--------+------+------+------------+
| c1 | c2     | c3   | c4   | c5         |
+----+--------+------+------+------------+
|  1 |  1.110 | 1-1  |    1 | 2022-02-02 |
|  2 |  2.220 | 2-2  |    2 | 2022-02-03 |
|  3 |  3.330 | 3-3  |    3 | 2022-02-04 |
|  5 |  5.555 | 5-5  |    5 | 2022-02-05 |
|  6 |  6.666 | 6-6  |    6 | 2022-02-06 |
|  7 |  7.700 | 7-7  |    7 | 2022-02-07 |
| 10 | 10.100 | 10-1 |   10 | 2022-02-10 |
| 11 | 11.110 | 11-1 |   11 | 2022-02-11 |
| 12 | 12.120 | 12-1 |   12 | 2022-02-12 |
| 20 | 20.200 | 20-2 |   20 | 2022-02-20 |
| 21 | 21.210 | 21-2 |   21 | 2022-02-21 |
| 22 | 22.220 | 22-2 |   22 | 2022-02-22 |
+----+--------+------+------+------------+

select hit_count, is_batched_multi_stmt, statement from oceanbase.gv$OB_PLAN_CACHE_PLAN_STAT where statement like 'insert into t5%' order by hit_count;
+-----------+-----------------------+---------------------------------------------------------+
| hit_count | is_batched_multi_stmt | statement                                               |
+-----------+-----------------------+---------------------------------------------------------+
|         1 |                     1 | insert into t5 values(?,?,?,?,?)                        |
|         1 |                     1 | insert into t5 values(?,?,concat(?,?),?,?)              |
|         1 |                     1 | insert into t5 values(?, ?, left(concat(?,?), 4), ? ,?) |
+-----------+-----------------------+---------------------------------------------------------+
drop table t5;

create table t6(c1 int, c2 varchar(20), c3 int);

insert into t6 values((1,'1',1)),((2,'2',2)),((3,'3',3));
ERROR 21S01: Column count doesn't match value count at row 1
insert into t6 values((4),'4',(4)),((5),'5',(5)),((6),'6',(6));
insert into t6 values((7),'7',(7)),((8),'8',(8)),((9),'9',(9));
insert into t6 values(((10,'10',10)),(((11,'11',11)),(((12,'12',12));
ERROR 42000: You have an error in your SQL syntax; check the manual that corresponds to your OceanBase version for the right syntax to use near ')' at line 1
insert into t6 values(10,'10',10)),(11,'11',11)),(12,'12',12));
ERROR 42000: You have an error in your SQL syntax; check the manual that corresponds to your OceanBase version for the right syntax to use near '),(11,'11',11)),(12,'12',12))' at line 1

insert into t6 values(10,('10',10)),(11,('11',11)),(12,('12',12));
ERROR 21S01: Column count doesn't match value count at row 1
insert into t6 values(10,('10',10),),(11,('11',11),),(12,('12',12),);
ERROR 42000: You have an error in your SQL syntax; check the manual that corresponds to your OceanBase version for the right syntax to use near ');' at line 1

insert values(10,'10',10),(11,'11',11),(12,'12',12);
ERROR 42000: You have an error in your SQL syntax; check the manual that corresponds to your OceanBase version for the right syntax to use near 'values(10,'10',10);' at line 1
insert into t6 values(10,'10'),10,(11,'11'),11,(12,'12'),12;
ERROR 42000: You have an error in your SQL syntax; check the manual that corresponds to your OceanBase version for the right syntax to use near '10,(11,'11'),11,(12,'12'),12' at line 1
insert into t6 values(10,'10',10) (11,'11',11) (12,'12',12);
ERROR 42000: You have an error in your SQL syntax; check the manual that corresponds to your OceanBase version for the right syntax to use near '(11,'11',11) (12,'12',12)' at line 1

select hit_count, is_batched_multi_stmt, statement from oceanbase.gv$OB_PLAN_CACHE_PLAN_STAT where statement like 'insert into t6%' order by hit_count;
+-----------+-----------------------+----------------------------------+
| hit_count | is_batched_multi_stmt | statement                        |
+-----------+-----------------------+----------------------------------+
|         1 |                     1 | insert into t6 values((?),?,(?)) |
+-----------+-----------------------+----------------------------------+
drop table t6;
