result_format: 4
drop table if exists t1,t2,t3,t4,t5,t6,t7,t8,t9,t10;
affected rows: 0
result_format: 4
create table t1(c1 int, c2 int, c3 int);
affected rows: 0
insert into t1 values(1,1,1),(2,2,2),(3,3,3),(4,4,4),(5,5,5),(6,6,6);
affected rows: 6
info: Records: 6  Duplicates: 0  Warnings: 0
insert into t1 values(7,7,7),(8,8,8),(9,9,9);
affected rows: 3
info: Records: 3  Duplicates: 0  Warnings: 0
select * from t1;
+------+------+------+
| c1   | c2   | c3   |
+------+------+------+
|    1 |    1 |    1 |
|    2 |    2 |    2 |
|    3 |    3 |    3 |
|    4 |    4 |    4 |
|    5 |    5 |    5 |
|    6 |    6 |    6 |
|    7 |    7 |    7 |
|    8 |    8 |    8 |
|    9 |    9 |    9 |
+------+------+------+
affected rows: 9

insert into t1 values((10),10,(10)),((11),11,(11)),((12),12,(12));
affected rows: 3
info: Records: 3  Duplicates: 0  Warnings: 0
insert into t1 values((14),14,(14)),((15),15,(15)),((16),16,(16));
affected rows: 3
info: Records: 3  Duplicates: 0  Warnings: 0
select * from t1;
+------+------+------+
| c1   | c2   | c3   |
+------+------+------+
|    1 |    1 |    1 |
|    2 |    2 |    2 |
|    3 |    3 |    3 |
|    4 |    4 |    4 |
|    5 |    5 |    5 |
|    6 |    6 |    6 |
|    7 |    7 |    7 |
|    8 |    8 |    8 |
|    9 |    9 |    9 |
|   10 |   10 |   10 |
|   11 |   11 |   11 |
|   12 |   12 |   12 |
|   14 |   14 |   14 |
|   15 |   15 |   15 |
|   16 |   16 |   16 |
+------+------+------+
affected rows: 15

## 查询 plan_cache_plan_stat表，确定是否走优化
select hit_count, is_batched_multi_stmt, statement, query_sql from oceanbase.gv$OB_PLAN_CACHE_PLAN_STAT where statement like 'insert into t1 %' order by hit_count;
+-----------+-----------------------+----------------------------------+----------------------------------------------------------------------+
| hit_count | is_batched_multi_stmt | statement                        | query_sql                                                            |
+-----------+-----------------------+----------------------------------+----------------------------------------------------------------------+
|         1 |                     1 | insert into t1 values(?,?,?)     | insert into t1 values(1,1,1),(2,2,2),(3,3,3),(4,4,4),(5,5,5),(6,6,6) |
|         1 |                     1 | insert into t1 values((?),?,(?)) | insert into t1 values((10),10,(10)),((11),11,(11)),((12),12,(12))    |
+-----------+-----------------------+----------------------------------+----------------------------------------------------------------------+
affected rows: 2
INSERT into t1 VALUES(20,20,(20)),(21,21,(21)),(22,22,(22));
affected rows: 3
info: Records: 3  Duplicates: 0  Warnings: 0
INSERT into t1 VALUES(23,23,(23)),(24,24,(24)),(25,25,(25));
affected rows: 3
info: Records: 3  Duplicates: 0  Warnings: 0

select * from t1;
+------+------+------+
| c1   | c2   | c3   |
+------+------+------+
|    1 |    1 |    1 |
|    2 |    2 |    2 |
|    3 |    3 |    3 |
|    4 |    4 |    4 |
|    5 |    5 |    5 |
|    6 |    6 |    6 |
|    7 |    7 |    7 |
|    8 |    8 |    8 |
|    9 |    9 |    9 |
|   10 |   10 |   10 |
|   11 |   11 |   11 |
|   12 |   12 |   12 |
|   14 |   14 |   14 |
|   15 |   15 |   15 |
|   16 |   16 |   16 |
|   20 |   20 |   20 |
|   21 |   21 |   21 |
|   22 |   22 |   22 |
|   23 |   23 |   23 |
|   24 |   24 |   24 |
|   25 |   25 |   25 |
+------+------+------+
affected rows: 21

## 查询 plan_cache_plan_stat表，确定是否走优化
select hit_count, is_batched_multi_stmt, statement, query_sql from oceanbase.gv$OB_PLAN_CACHE_PLAN_STAT where statement like 'INSERT into t1 %' order by hit_count;
+-----------+-----------------------+----------------------------------+----------------------------------------------------------------------+
| hit_count | is_batched_multi_stmt | statement                        | query_sql                                                            |
+-----------+-----------------------+----------------------------------+----------------------------------------------------------------------+
|         1 |                     1 | insert into t1 values(?,?,?)     | insert into t1 values(1,1,1),(2,2,2),(3,3,3),(4,4,4),(5,5,5),(6,6,6) |
|         1 |                     1 | insert into t1 values((?),?,(?)) | insert into t1 values((10),10,(10)),((11),11,(11)),((12),12,(12))    |
|         1 |                     1 | INSERT into t1 VALUES(?,?,(?))   | INSERT into t1 VALUES(20,20,(20)),(21,21,(21)),(22,22,(22))          |
+-----------+-----------------------+----------------------------------+----------------------------------------------------------------------+
affected rows: 3
drop table t1;
affected rows: 0

create table t2(c1 int primary key, c2 int, c3 varchar(50), c4 date, c5 char(20));
affected rows: 0
insert into t2 values(1,1,'11','2012-1-1','111'),(2,2,'222','2012-1-2','2222');
affected rows: 2
info: Records: 2  Duplicates: 0  Warnings: 0
insert into t2 values(3,3,'33','2012-1-3','33333'),(4,4,'444','2012-1-4','44444444');
affected rows: 2
info: Records: 2  Duplicates: 0  Warnings: 0

insert into t2 values(5,5,'55',str_to_date('05-05-2020', '%m-%d-%Y'),'5555'),(6,6,'66',str_to_date('06-05-2020', '%m-%d-%Y'),'6666'),(7,7,'77',str_to_date('07-05-2020', '%m-%d-%Y'),'777');
affected rows: 3
info: Records: 3  Duplicates: 0  Warnings: 0
insert into t2 values(8,8,'88',str_to_date('08-05-2020', '%m-%d-%Y'),'8888'),(9,9,'99',str_to_date('09-05-2020', '%m-%d-%Y'),'9999'),(10,10,'1010',str_to_date('10-05-2020', '%m-%d-%Y'),'10101');
affected rows: 3
info: Records: 3  Duplicates: 0  Warnings: 0

select * from t2;
+----+------+------+------------+----------+
| c1 | c2   | c3   | c4         | c5       |
+----+------+------+------------+----------+
|  1 |    1 | 11   | 2012-01-01 | 111      |
|  2 |    2 | 222  | 2012-01-02 | 2222     |
|  3 |    3 | 33   | 2012-01-03 | 33333    |
|  4 |    4 | 444  | 2012-01-04 | 44444444 |
|  5 |    5 | 55   | 2020-05-05 | 5555     |
|  6 |    6 | 66   | 2020-06-05 | 6666     |
|  7 |    7 | 77   | 2020-07-05 | 777      |
|  8 |    8 | 88   | 2020-08-05 | 8888     |
|  9 |    9 | 99   | 2020-09-05 | 9999     |
| 10 |   10 | 1010 | 2020-10-05 | 10101    |
+----+------+------+------------+----------+
affected rows: 10
select hit_count, is_batched_multi_stmt, statement, query_sql from oceanbase.gv$OB_PLAN_CACHE_PLAN_STAT where statement like 'insert into t2 %' order by hit_count;
+-----------+-----------------------+-----------------------------------------------------------+---------------------------------------------------------------------------------------------------------------------------------------------------------------------------------------------+
| hit_count | is_batched_multi_stmt | statement                                                 | query_sql                                                                                                                                                                                   |
+-----------+-----------------------+-----------------------------------------------------------+---------------------------------------------------------------------------------------------------------------------------------------------------------------------------------------------+
|         1 |                     1 | insert into t2 values(?,?,?,?,?)                          | insert into t2 values(1,1,'11','2012-1-1','111'),(2,2,'222','2012-1-2','2222')                                                                                                              |
|         1 |                     1 | insert into t2 values(?,?,?,str_to_date(?, '%m-%d-%Y'),?) | insert into t2 values(5,5,'55',str_to_date('05-05-2020', '%m-%d-%Y'),'5555'),(6,6,'66',str_to_date('06-05-2020', '%m-%d-%Y'),'6666'),(7,7,'77',str_to_date('07-05-2020', '%m-%d-%Y'),'777') |
+-----------+-----------------------+-----------------------------------------------------------+---------------------------------------------------------------------------------------------------------------------------------------------------------------------------------------------+
affected rows: 2
drop table t2;
affected rows: 0

## 回退场景
create table t4(c1 int, c2 int, c3 int);
affected rows: 0
insert into t4 values(1,1,1),(2,2,2),(3,3,3),(4,4,4),(5,5,5);
affected rows: 5
info: Records: 5  Duplicates: 0  Warnings: 0
insert into t4 values(6,6,6),(7,7,7),(8,8,8);
affected rows: 3
info: Records: 3  Duplicates: 0  Warnings: 0
create table t3(c1 int primary key, c2 int, c3 int);
affected rows: 0
insert into t3 select * from t4;
affected rows: 8
info: Records: 8  Duplicates: 0  Warnings: 0
insert into t3 values(11,11,11),((12),(12),(12)),(13,(13),13);
affected rows: 3
info: Records: 3  Duplicates: 0  Warnings: 0
insert into t3 values((14),14,14),(15,(15),15);
affected rows: 2
info: Records: 2  Duplicates: 0  Warnings: 0
select * from t3;
+----+------+------+
| c1 | c2   | c3   |
+----+------+------+
|  1 |    1 |    1 |
|  2 |    2 |    2 |
|  3 |    3 |    3 |
|  4 |    4 |    4 |
|  5 |    5 |    5 |
|  6 |    6 |    6 |
|  7 |    7 |    7 |
|  8 |    8 |    8 |
| 11 |   11 |   11 |
| 12 |   12 |   12 |
| 13 |   13 |   13 |
| 14 |   14 |   14 |
| 15 |   15 |   15 |
+----+------+------+
affected rows: 13

## 主键冲突了
insert into t3 values(20,20,20),(21,21,21),(22,22,22),(20,20,20);
ERROR 23000: Duplicate entry '20' for key 'PRIMARY'
select * from t3;
+----+------+------+
| c1 | c2   | c3   |
+----+------+------+
|  1 |    1 |    1 |
|  2 |    2 |    2 |
|  3 |    3 |    3 |
|  4 |    4 |    4 |
|  5 |    5 |    5 |
|  6 |    6 |    6 |
|  7 |    7 |    7 |
|  8 |    8 |    8 |
| 11 |   11 |   11 |
| 12 |   12 |   12 |
| 13 |   13 |   13 |
| 14 |   14 |   14 |
| 15 |   15 |   15 |
+----+------+------+
affected rows: 13
insert into t3 values(20,20,20),(21,21,21),(22,22,22),(23,23,23);
affected rows: 4
info: Records: 4  Duplicates: 0  Warnings: 0
select type, hit_count, is_batched_multi_stmt, statement, query_sql from oceanbase.gv$OB_PLAN_CACHE_PLAN_STAT where statement like 'insert into t3 %' order by hit_count;
+------+-----------+-----------------------+------------------------------------------------------+------------------------------------------------------------------+
| type | hit_count | is_batched_multi_stmt | statement                                            | query_sql                                                        |
+------+-----------+-----------------------+------------------------------------------------------+------------------------------------------------------------------+
|    1 |         0 |                     0 | insert into t3 select * from t4                      | insert into t3 select * from t4                                  |
|    2 |         0 |                     0 | insert into t3 select * from t4                      | insert into t3 select * from t4                                  |
|    1 |         0 |                     0 | insert into t3 values(?,?,?),((?),(?),(?)),(?,(?),?) | insert into t3 values(11,11,11),((12),(12),(12)),(13,(13),13)    |
|    1 |         0 |                     0 | insert into t3 values((?),?,?),(?,(?),?)             | insert into t3 values((14),14,14),(15,(15),15)                   |
|    1 |         1 |                     1 | insert into t3 values(?,?,?)                         | insert into t3 values(20,20,20),(21,21,21),(22,22,22),(20,20,20) |
+------+-----------+-----------------------+------------------------------------------------------+------------------------------------------------------------------+
affected rows: 5
drop table t3;
affected rows: 0
drop table t4;
affected rows: 0

## 测试字符串中有括号等场景
create table t5(c1 int primary key, c2 varchar(50), c3 varchar(50));
affected rows: 0
insert into t5 values(1, '((aa)()aaabb))(()', '999(()))(9)))'),(2, '((s(d)f)gh', 'hh)))(sd'),(3, 'saddd)))))', '((dadas))');
affected rows: 3
info: Records: 3  Duplicates: 0  Warnings: 0
insert into t5 values(4, '(((dsdd)))', '((((aaa))))'),(5, '(((sdsd)))', '((dkz))');
affected rows: 2
info: Records: 2  Duplicates: 0  Warnings: 0
select * from t5;
+----+-------------------+---------------+
| c1 | c2                | c3            |
+----+-------------------+---------------+
|  1 | ((aa)()aaabb))(() | 999(()))(9))) |
|  2 | ((s(d)f)gh        | hh)))(sd      |
|  3 | saddd)))))        | ((dadas))     |
|  4 | (((dsdd)))        | ((((aaa))))   |
|  5 | (((sdsd)))        | ((dkz))       |
+----+-------------------+---------------+
affected rows: 5
select hit_count, is_batched_multi_stmt, statement, query_sql from oceanbase.gv$OB_PLAN_CACHE_PLAN_STAT where statement like 'insert into t5 %' order by hit_count;
+-----------+-----------------------+--------------------------------+-----------------------------------------------------------------------------------------------------------------------------+
| hit_count | is_batched_multi_stmt | statement                      | query_sql                                                                                                                   |
+-----------+-----------------------+--------------------------------+-----------------------------------------------------------------------------------------------------------------------------+
|         1 |                     1 | insert into t5 values(?, ?, ?) | insert into t5 values(1, '((aa)()aaabb))(()', '999(()))(9)))'),(2, '((s(d)f)gh', 'hh)))(sd'),(3, 'saddd)))))', '((dadas))') |
+-----------+-----------------------+--------------------------------+-----------------------------------------------------------------------------------------------------------------------------+
affected rows: 1
insert into t5 values (6, 'dkz', 'ddd'), (7,'dsr','dsrdsr'), (8, '99()9', 'dsadds');
affected rows: 3
info: Records: 3  Duplicates: 0  Warnings: 0
insert into t5 values (9, 'dkzdkz', 'dddddd'), (10,'dsrdsr','dsrdsr2'), (11, '99(99)9', 'dsadds2');
affected rows: 3
info: Records: 3  Duplicates: 0  Warnings: 0
insert into t5 value(12,'asd','aa'),(13,'bcd','def'),(14,'kkk','lll');
affected rows: 3
info: Records: 3  Duplicates: 0  Warnings: 0

select hit_count, is_batched_multi_stmt, statement, query_sql from oceanbase.gv$OB_PLAN_CACHE_PLAN_STAT where statement like 'insert into t5 %' order by hit_count;
+-----------+-----------------------+---------------------------------------------+-----------------------------------------------------------------------------------------------------------------------------+
| hit_count | is_batched_multi_stmt | statement                                   | query_sql                                                                                                                   |
+-----------+-----------------------+---------------------------------------------+-----------------------------------------------------------------------------------------------------------------------------+
|         0 |                     0 | insert into t5 value(?,?,?),(?,?,?),(?,?,?) | insert into t5 value(12,'asd','aa'),(13,'bcd','def'),(14,'kkk','lll')                                                       |
|         1 |                     1 | insert into t5 values(?, ?, ?)              | insert into t5 values(1, '((aa)()aaabb))(()', '999(()))(9)))'),(2, '((s(d)f)gh', 'hh)))(sd'),(3, 'saddd)))))', '((dadas))') |
|         1 |                     1 | insert into t5 values (?, ?, ?)             | insert into t5 values (6, 'dkz', 'ddd'), (7,'dsr','dsrdsr'), (8, '99()9', 'dsadds')                                         |
+-----------+-----------------------+---------------------------------------------+-----------------------------------------------------------------------------------------------------------------------------+
affected rows: 3
drop table t5;
affected rows: 0

## 测试带hint的场景
create table t6(c1 int, c2 int, c3 int);
affected rows: 0
insert /*+PARALLEL(5)*/ into t6 values(1,1,1),(2,2,2);
affected rows: 2
info: Records: 2  Duplicates: 0  Warnings: 0
select * from t6;
+------+------+------+
| c1   | c2   | c3   |
+------+------+------+
|    1 |    1 |    1 |
|    2 |    2 |    2 |
+------+------+------+
affected rows: 2

select hit_count, is_batched_multi_stmt, statement, query_sql from oceanbase.gv$OB_PLAN_CACHE_PLAN_STAT where statement like 'insert % into t6 %' order by hit_count;
+-----------+-----------------------+-----------------------------------------------+-------------------------------------------------------+
| hit_count | is_batched_multi_stmt | statement                                     | query_sql                                             |
+-----------+-----------------------+-----------------------------------------------+-------------------------------------------------------+
|         0 |                     1 | insert /*+PARALLEL(5)*/ into t6 values(?,?,?) | insert /*+PARALLEL(5)*/ into t6 values(1,1,1),(2,2,2) |
+-----------+-----------------------+-----------------------------------------------+-------------------------------------------------------+
affected rows: 1
drop table t6;
affected rows: 0

## 测试insert select不会被改写
create table t7(c1 int, c2 varchar(20), c3 int);
affected rows: 0
create table t8(c1 int, c2 varchar(20), c3 int);
affected rows: 0
insert into t7 values(1, '111', 1), (2, '222', 2), (3, '333', 3);
affected rows: 3
info: Records: 3  Duplicates: 0  Warnings: 0
insert into t8 select c1, c2, c3 from t7;
affected rows: 3
info: Records: 3  Duplicates: 0  Warnings: 0
select type, hit_count, is_batched_multi_stmt, statement, query_sql from oceanbase.gv$OB_PLAN_CACHE_PLAN_STAT where statement like 'insert into t8 select %' order by hit_count;
+------+-----------+-----------------------+------------------------------------------+------------------------------------------+
| type | hit_count | is_batched_multi_stmt | statement                                | query_sql                                |
+------+-----------+-----------------------+------------------------------------------+------------------------------------------+
|    1 |         0 |                     0 | insert into t8 select c1, c2, c3 from t7 | insert into t8 select c1, c2, c3 from t7 |
|    2 |         0 |                     0 | insert into t8 select c1, c2, c3 from t7 | insert into t8 select c1, c2, c3 from t7 |
+------+-----------+-----------------------+------------------------------------------+------------------------------------------+
affected rows: 2
drop table t7;
affected rows: 0
drop table t8;
affected rows: 0

## issue 
CREATE TABLE t10 (`pk` int(11) NOT NULL AUTO_INCREMENT PRIMARY KEY);
affected rows: 0
INSERT INTO t10 VALUES (NULL),(3);
affected rows: 2
info: Records: 2  Duplicates: 0  Warnings: 0
delete from t10;
affected rows: 2
INSERT INTO t10 VALUES (NULL),(NULL);
affected rows: 2
info: Records: 2  Duplicates: 0  Warnings: 0
INSERT INTO t10 VALUES (NULL),(NULL);
affected rows: 2
info: Records: 2  Duplicates: 0  Warnings: 0
INSERT INTO t10 VALUES ('1'),('1');
ERROR 23000: Duplicate entry '1' for key 'PRIMARY'
select * from t10;
+----+
| pk |
+----+
|  4 |
|  5 |
|  6 |
|  7 |
+----+
affected rows: 4
drop table t10;
affected rows: 0

alter system flush plan cache global;
affected rows: 0
## 默认打开batch优化的开关
alter system set ob_enable_batched_multi_statement=true;
affected rows: 0
drop table if exists t1,t2,t3,t4,t5,t6,t7,t8,t9,t10;
affected rows: 0
result_format: 4
create table t1(c1 int, c2 int, c3 int);
affected rows: 0
insert into t1 values(1,1,1),(2,2,2),(3,3,3),(4,4,4),(5,5,5),(6,6,6);
affected rows: 6
info: Records: 6  Duplicates: 0  Warnings: 0
insert into t1 values(7,7,7),(8,8,8),(9,9,9);
affected rows: 3
info: Records: 3  Duplicates: 0  Warnings: 0
select * from t1;
+------+------+------+
| c1   | c2   | c3   |
+------+------+------+
|    1 |    1 |    1 |
|    2 |    2 |    2 |
|    3 |    3 |    3 |
|    4 |    4 |    4 |
|    5 |    5 |    5 |
|    6 |    6 |    6 |
|    7 |    7 |    7 |
|    8 |    8 |    8 |
|    9 |    9 |    9 |
+------+------+------+
affected rows: 9

insert into t1 values((10),10,(10)),((11),11,(11)),((12),12,(12));
affected rows: 3
info: Records: 3  Duplicates: 0  Warnings: 0
insert into t1 values((14),14,(14)),((15),15,(15)),((16),16,(16));
affected rows: 3
info: Records: 3  Duplicates: 0  Warnings: 0
select * from t1;
+------+------+------+
| c1   | c2   | c3   |
+------+------+------+
|    1 |    1 |    1 |
|    2 |    2 |    2 |
|    3 |    3 |    3 |
|    4 |    4 |    4 |
|    5 |    5 |    5 |
|    6 |    6 |    6 |
|    7 |    7 |    7 |
|    8 |    8 |    8 |
|    9 |    9 |    9 |
|   10 |   10 |   10 |
|   11 |   11 |   11 |
|   12 |   12 |   12 |
|   14 |   14 |   14 |
|   15 |   15 |   15 |
|   16 |   16 |   16 |
+------+------+------+
affected rows: 15

## 查询 plan_cache_plan_stat表，确定是否走优化
select hit_count, is_batched_multi_stmt, statement, query_sql from oceanbase.gv$OB_PLAN_CACHE_PLAN_STAT where statement like 'insert into t1 %' order by hit_count;
+-----------+-----------------------+----------------------------------+----------------------------------------------------------------------+
| hit_count | is_batched_multi_stmt | statement                        | query_sql                                                            |
+-----------+-----------------------+----------------------------------+----------------------------------------------------------------------+
|         1 |                     1 | insert into t1 values(?,?,?)     | insert into t1 values(1,1,1),(2,2,2),(3,3,3),(4,4,4),(5,5,5),(6,6,6) |
|         1 |                     1 | insert into t1 values((?),?,(?)) | insert into t1 values((10),10,(10)),((11),11,(11)),((12),12,(12))    |
+-----------+-----------------------+----------------------------------+----------------------------------------------------------------------+
affected rows: 2
INSERT into t1 VALUES(20,20,(20)),(21,21,(21)),(22,22,(22));
affected rows: 3
info: Records: 3  Duplicates: 0  Warnings: 0
INSERT into t1 VALUES(23,23,(23)),(24,24,(24)),(25,25,(25));
affected rows: 3
info: Records: 3  Duplicates: 0  Warnings: 0

select * from t1;
+------+------+------+
| c1   | c2   | c3   |
+------+------+------+
|    1 |    1 |    1 |
|    2 |    2 |    2 |
|    3 |    3 |    3 |
|    4 |    4 |    4 |
|    5 |    5 |    5 |
|    6 |    6 |    6 |
|    7 |    7 |    7 |
|    8 |    8 |    8 |
|    9 |    9 |    9 |
|   10 |   10 |   10 |
|   11 |   11 |   11 |
|   12 |   12 |   12 |
|   14 |   14 |   14 |
|   15 |   15 |   15 |
|   16 |   16 |   16 |
|   20 |   20 |   20 |
|   21 |   21 |   21 |
|   22 |   22 |   22 |
|   23 |   23 |   23 |
|   24 |   24 |   24 |
|   25 |   25 |   25 |
+------+------+------+
affected rows: 21

## 查询 plan_cache_plan_stat表，确定是否走优化
select hit_count, is_batched_multi_stmt, statement, query_sql from oceanbase.gv$OB_PLAN_CACHE_PLAN_STAT where statement like 'INSERT into t1 %' order by hit_count;
+-----------+-----------------------+----------------------------------+----------------------------------------------------------------------+
| hit_count | is_batched_multi_stmt | statement                        | query_sql                                                            |
+-----------+-----------------------+----------------------------------+----------------------------------------------------------------------+
|         1 |                     1 | insert into t1 values(?,?,?)     | insert into t1 values(1,1,1),(2,2,2),(3,3,3),(4,4,4),(5,5,5),(6,6,6) |
|         1 |                     1 | insert into t1 values((?),?,(?)) | insert into t1 values((10),10,(10)),((11),11,(11)),((12),12,(12))    |
|         1 |                     1 | INSERT into t1 VALUES(?,?,(?))   | INSERT into t1 VALUES(20,20,(20)),(21,21,(21)),(22,22,(22))          |
+-----------+-----------------------+----------------------------------+----------------------------------------------------------------------+
affected rows: 3
drop table t1;
affected rows: 0

create table t2(c1 int primary key, c2 int, c3 varchar(50), c4 date, c5 char(20));
affected rows: 0
insert into t2 values(1,1,'11','2012-1-1','111'),(2,2,'222','2012-1-2','2222');
affected rows: 2
info: Records: 2  Duplicates: 0  Warnings: 0
insert into t2 values(3,3,'33','2012-1-3','33333'),(4,4,'444','2012-1-4','44444444');
affected rows: 2
info: Records: 2  Duplicates: 0  Warnings: 0

insert into t2 values(5,5,'55',str_to_date('05-05-2020', '%m-%d-%Y'),'5555'),(6,6,'66',str_to_date('06-05-2020', '%m-%d-%Y'),'6666'),(7,7,'77',str_to_date('07-05-2020', '%m-%d-%Y'),'777');
affected rows: 3
info: Records: 3  Duplicates: 0  Warnings: 0
insert into t2 values(8,8,'88',str_to_date('08-05-2020', '%m-%d-%Y'),'8888'),(9,9,'99',str_to_date('09-05-2020', '%m-%d-%Y'),'9999'),(10,10,'1010',str_to_date('10-05-2020', '%m-%d-%Y'),'10101');
affected rows: 3
info: Records: 3  Duplicates: 0  Warnings: 0

select * from t2;
+----+------+------+------------+----------+
| c1 | c2   | c3   | c4         | c5       |
+----+------+------+------------+----------+
|  1 |    1 | 11   | 2012-01-01 | 111      |
|  2 |    2 | 222  | 2012-01-02 | 2222     |
|  3 |    3 | 33   | 2012-01-03 | 33333    |
|  4 |    4 | 444  | 2012-01-04 | 44444444 |
|  5 |    5 | 55   | 2020-05-05 | 5555     |
|  6 |    6 | 66   | 2020-06-05 | 6666     |
|  7 |    7 | 77   | 2020-07-05 | 777      |
|  8 |    8 | 88   | 2020-08-05 | 8888     |
|  9 |    9 | 99   | 2020-09-05 | 9999     |
| 10 |   10 | 1010 | 2020-10-05 | 10101    |
+----+------+------+------------+----------+
affected rows: 10
select hit_count, is_batched_multi_stmt, statement, query_sql from oceanbase.gv$OB_PLAN_CACHE_PLAN_STAT where statement like 'insert into t2 %' order by hit_count;
+-----------+-----------------------+-----------------------------------------------------------+---------------------------------------------------------------------------------------------------------------------------------------------------------------------------------------------+
| hit_count | is_batched_multi_stmt | statement                                                 | query_sql                                                                                                                                                                                   |
+-----------+-----------------------+-----------------------------------------------------------+---------------------------------------------------------------------------------------------------------------------------------------------------------------------------------------------+
|         1 |                     1 | insert into t2 values(?,?,?,?,?)                          | insert into t2 values(1,1,'11','2012-1-1','111'),(2,2,'222','2012-1-2','2222')                                                                                                              |
|         1 |                     1 | insert into t2 values(?,?,?,str_to_date(?, '%m-%d-%Y'),?) | insert into t2 values(5,5,'55',str_to_date('05-05-2020', '%m-%d-%Y'),'5555'),(6,6,'66',str_to_date('06-05-2020', '%m-%d-%Y'),'6666'),(7,7,'77',str_to_date('07-05-2020', '%m-%d-%Y'),'777') |
+-----------+-----------------------+-----------------------------------------------------------+---------------------------------------------------------------------------------------------------------------------------------------------------------------------------------------------+
affected rows: 2
drop table t2;
affected rows: 0

## 回退场景
create table t4(c1 int, c2 int, c3 int);
affected rows: 0
insert into t4 values(1,1,1),(2,2,2),(3,3,3),(4,4,4),(5,5,5);
affected rows: 5
info: Records: 5  Duplicates: 0  Warnings: 0
insert into t4 values(6,6,6),(7,7,7),(8,8,8);
affected rows: 3
info: Records: 3  Duplicates: 0  Warnings: 0
create table t3(c1 int primary key, c2 int, c3 int);
affected rows: 0
insert into t3 select * from t4;
affected rows: 8
info: Records: 8  Duplicates: 0  Warnings: 0
insert into t3 values(11,11,11),((12),(12),(12)),(13,(13),13);
affected rows: 3
info: Records: 3  Duplicates: 0  Warnings: 0
insert into t3 values((14),14,14),(15,(15),15);
affected rows: 2
info: Records: 2  Duplicates: 0  Warnings: 0
select * from t3;
+----+------+------+
| c1 | c2   | c3   |
+----+------+------+
|  1 |    1 |    1 |
|  2 |    2 |    2 |
|  3 |    3 |    3 |
|  4 |    4 |    4 |
|  5 |    5 |    5 |
|  6 |    6 |    6 |
|  7 |    7 |    7 |
|  8 |    8 |    8 |
| 11 |   11 |   11 |
| 12 |   12 |   12 |
| 13 |   13 |   13 |
| 14 |   14 |   14 |
| 15 |   15 |   15 |
+----+------+------+
affected rows: 13

## 主键冲突了
insert into t3 values(20,20,20),(21,21,21),(22,22,22),(20,20,20);
ERROR 23000: Duplicate entry '20' for key 'PRIMARY'
select * from t3;
+----+------+------+
| c1 | c2   | c3   |
+----+------+------+
|  1 |    1 |    1 |
|  2 |    2 |    2 |
|  3 |    3 |    3 |
|  4 |    4 |    4 |
|  5 |    5 |    5 |
|  6 |    6 |    6 |
|  7 |    7 |    7 |
|  8 |    8 |    8 |
| 11 |   11 |   11 |
| 12 |   12 |   12 |
| 13 |   13 |   13 |
| 14 |   14 |   14 |
| 15 |   15 |   15 |
+----+------+------+
affected rows: 13
insert into t3 values(20,20,20),(21,21,21),(22,22,22),(23,23,23);
affected rows: 4
info: Records: 4  Duplicates: 0  Warnings: 0
select type, hit_count, is_batched_multi_stmt, statement, query_sql from oceanbase.gv$OB_PLAN_CACHE_PLAN_STAT where statement like 'insert into t3 %' order by hit_count;
+------+-----------+-----------------------+------------------------------------------------------+------------------------------------------------------------------+
| type | hit_count | is_batched_multi_stmt | statement                                            | query_sql                                                        |
+------+-----------+-----------------------+------------------------------------------------------+------------------------------------------------------------------+
|    1 |         0 |                     0 | insert into t3 select * from t4                      | insert into t3 select * from t4                                  |
|    2 |         0 |                     0 | insert into t3 select * from t4                      | insert into t3 select * from t4                                  |
|    1 |         0 |                     0 | insert into t3 values(?,?,?),((?),(?),(?)),(?,(?),?) | insert into t3 values(11,11,11),((12),(12),(12)),(13,(13),13)    |
|    1 |         0 |                     0 | insert into t3 values((?),?,?),(?,(?),?)             | insert into t3 values((14),14,14),(15,(15),15)                   |
|    1 |         1 |                     1 | insert into t3 values(?,?,?)                         | insert into t3 values(20,20,20),(21,21,21),(22,22,22),(20,20,20) |
+------+-----------+-----------------------+------------------------------------------------------+------------------------------------------------------------------+
affected rows: 5
drop table t3;
affected rows: 0
drop table t4;
affected rows: 0

## 测试字符串中有括号等场景
create table t5(c1 int primary key, c2 varchar(50), c3 varchar(50));
affected rows: 0
insert into t5 values(1, '((aa)()aaabb))(()', '999(()))(9)))'),(2, '((s(d)f)gh', 'hh)))(sd'),(3, 'saddd)))))', '((dadas))');
affected rows: 3
info: Records: 3  Duplicates: 0  Warnings: 0
insert into t5 values(4, '(((dsdd)))', '((((aaa))))'),(5, '(((sdsd)))', '((dkz))');
affected rows: 2
info: Records: 2  Duplicates: 0  Warnings: 0
select * from t5;
+----+-------------------+---------------+
| c1 | c2                | c3            |
+----+-------------------+---------------+
|  1 | ((aa)()aaabb))(() | 999(()))(9))) |
|  2 | ((s(d)f)gh        | hh)))(sd      |
|  3 | saddd)))))        | ((dadas))     |
|  4 | (((dsdd)))        | ((((aaa))))   |
|  5 | (((sdsd)))        | ((dkz))       |
+----+-------------------+---------------+
affected rows: 5
select hit_count, is_batched_multi_stmt, statement, query_sql from oceanbase.gv$OB_PLAN_CACHE_PLAN_STAT where statement like 'insert into t5 %' order by hit_count;
+-----------+-----------------------+--------------------------------+-----------------------------------------------------------------------------------------------------------------------------+
| hit_count | is_batched_multi_stmt | statement                      | query_sql                                                                                                                   |
+-----------+-----------------------+--------------------------------+-----------------------------------------------------------------------------------------------------------------------------+
|         1 |                     1 | insert into t5 values(?, ?, ?) | insert into t5 values(1, '((aa)()aaabb))(()', '999(()))(9)))'),(2, '((s(d)f)gh', 'hh)))(sd'),(3, 'saddd)))))', '((dadas))') |
+-----------+-----------------------+--------------------------------+-----------------------------------------------------------------------------------------------------------------------------+
affected rows: 1
insert into t5 values (6, 'dkz', 'ddd'), (7,'dsr','dsrdsr'), (8, '99()9', 'dsadds');
affected rows: 3
info: Records: 3  Duplicates: 0  Warnings: 0
insert into t5 values (9, 'dkzdkz', 'dddddd'), (10,'dsrdsr','dsrdsr2'), (11, '99(99)9', 'dsadds2');
affected rows: 3
info: Records: 3  Duplicates: 0  Warnings: 0
insert into t5 value(12,'asd','aa'),(13,'bcd','def'),(14,'kkk','lll');
affected rows: 3
info: Records: 3  Duplicates: 0  Warnings: 0

select hit_count, is_batched_multi_stmt, statement, query_sql from oceanbase.gv$OB_PLAN_CACHE_PLAN_STAT where statement like 'insert into t5 %' order by hit_count;
+-----------+-----------------------+---------------------------------------------+-----------------------------------------------------------------------------------------------------------------------------+
| hit_count | is_batched_multi_stmt | statement                                   | query_sql                                                                                                                   |
+-----------+-----------------------+---------------------------------------------+-----------------------------------------------------------------------------------------------------------------------------+
|         0 |                     0 | insert into t5 value(?,?,?),(?,?,?),(?,?,?) | insert into t5 value(12,'asd','aa'),(13,'bcd','def'),(14,'kkk','lll')                                                       |
|         1 |                     1 | insert into t5 values(?, ?, ?)              | insert into t5 values(1, '((aa)()aaabb))(()', '999(()))(9)))'),(2, '((s(d)f)gh', 'hh)))(sd'),(3, 'saddd)))))', '((dadas))') |
|         1 |                     1 | insert into t5 values (?, ?, ?)             | insert into t5 values (6, 'dkz', 'ddd'), (7,'dsr','dsrdsr'), (8, '99()9', 'dsadds')                                         |
+-----------+-----------------------+---------------------------------------------+-----------------------------------------------------------------------------------------------------------------------------+
affected rows: 3
drop table t5;
affected rows: 0

## 测试带hint的场景
create table t6(c1 int, c2 int, c3 int);
affected rows: 0
insert /*+PARALLEL(5)*/ into t6 values(1,1,1),(2,2,2);
affected rows: 2
info: Records: 2  Duplicates: 0  Warnings: 0
select * from t6;
+------+------+------+
| c1   | c2   | c3   |
+------+------+------+
|    1 |    1 |    1 |
|    2 |    2 |    2 |
+------+------+------+
affected rows: 2

select hit_count, is_batched_multi_stmt, statement, query_sql from oceanbase.gv$OB_PLAN_CACHE_PLAN_STAT where statement like 'insert % into t6 %' order by hit_count;
+-----------+-----------------------+-----------------------------------------------+-------------------------------------------------------+
| hit_count | is_batched_multi_stmt | statement                                     | query_sql                                             |
+-----------+-----------------------+-----------------------------------------------+-------------------------------------------------------+
|         0 |                     1 | insert /*+PARALLEL(5)*/ into t6 values(?,?,?) | insert /*+PARALLEL(5)*/ into t6 values(1,1,1),(2,2,2) |
+-----------+-----------------------+-----------------------------------------------+-------------------------------------------------------+
affected rows: 1
drop table t6;
affected rows: 0

## 测试insert select不会被改写
create table t7(c1 int, c2 varchar(20), c3 int);
affected rows: 0
create table t8(c1 int, c2 varchar(20), c3 int);
affected rows: 0
insert into t7 values(1, '111', 1), (2, '222', 2), (3, '333', 3);
affected rows: 3
info: Records: 3  Duplicates: 0  Warnings: 0
insert into t8 select c1, c2, c3 from t7;
affected rows: 3
info: Records: 3  Duplicates: 0  Warnings: 0
select type, hit_count, is_batched_multi_stmt, statement, query_sql from oceanbase.gv$OB_PLAN_CACHE_PLAN_STAT where statement like 'insert into t8 select %' order by hit_count;
+------+-----------+-----------------------+------------------------------------------+------------------------------------------+
| type | hit_count | is_batched_multi_stmt | statement                                | query_sql                                |
+------+-----------+-----------------------+------------------------------------------+------------------------------------------+
|    1 |         0 |                     0 | insert into t8 select c1, c2, c3 from t7 | insert into t8 select c1, c2, c3 from t7 |
|    2 |         0 |                     0 | insert into t8 select c1, c2, c3 from t7 | insert into t8 select c1, c2, c3 from t7 |
+------+-----------+-----------------------+------------------------------------------+------------------------------------------+
affected rows: 2
drop table t7;
affected rows: 0
drop table t8;
affected rows: 0

## issue 
CREATE TABLE t10 (`pk` int(11) NOT NULL AUTO_INCREMENT PRIMARY KEY);
affected rows: 0
INSERT INTO t10 VALUES (NULL),(3);
affected rows: 2
info: Records: 2  Duplicates: 0  Warnings: 0
delete from t10;
affected rows: 2
INSERT INTO t10 VALUES (NULL),(NULL);
affected rows: 2
info: Records: 2  Duplicates: 0  Warnings: 0
INSERT INTO t10 VALUES (NULL),(NULL);
affected rows: 2
info: Records: 2  Duplicates: 0  Warnings: 0
INSERT INTO t10 VALUES ('1'),('1');
ERROR 23000: Duplicate entry '1' for key 'PRIMARY'
select * from t10;
+----+
| pk |
+----+
|  4 |
|  5 |
|  6 |
|  7 |
+----+
affected rows: 4
drop table t10;
affected rows: 0
alter system set ob_enable_batched_multi_statement=false;
affected rows: 0
