drop table if exists t1;
result_format: 4
set autocommit = false;
affected rows: 0
create table t1(a int primary key, b int, c int);
affected rows: 0
insert into t1 values(1, 1, 1), (2, 2, 2), (3, 3, 3);
affected rows: 3
info: Records: 3  Duplicates: 0  Warnings: 0
explain update t1 set b = 0 where a = 1;explain update t1 set b = 0 where a = 2;explain update t1 set b = 0 where a = 3;//
Query Plan
Query Plan
Query Plan
===========================================
|ID|OPERATOR   |NAME|EST.ROWS|EST.TIME(us)|
-------------------------------------------
|0 |UPDATE     |    |1       |37          |
|1 |└─TABLE GET|t1  |1       |5           |
===========================================
Outputs & filters:
-------------------------------------
  0 - output(nil), filter(nil)
      table_columns([{t1: ({t1: (t1.a, t1.b, t1.c)})}]),
      update([t1.b=column_conv(INT,PS:(11,0),NULL,0)])
  1 - output([t1.a], [t1.b], [t1.c]), filter(nil), rowset=16
      access([t1.a], [t1.b], [t1.c]), partitions(p0)
      is_index_back=false, is_global_index=false, 
      range_key([t1.a]), range[1 ; 1], 
      range_cond([t1.a = 1])
===========================================
|ID|OPERATOR   |NAME|EST.ROWS|EST.TIME(us)|
-------------------------------------------
|0 |UPDATE     |    |1       |37          |
|1 |└─TABLE GET|t1  |1       |5           |
===========================================
Outputs & filters:
-------------------------------------
  0 - output(nil), filter(nil)
      table_columns([{t1: ({t1: (t1.a, t1.b, t1.c)})}]),
      update([t1.b=column_conv(INT,PS:(11,0),NULL,0)])
  1 - output([t1.a], [t1.b], [t1.c]), filter(nil), rowset=16
      access([t1.a], [t1.b], [t1.c]), partitions(p0)
      is_index_back=false, is_global_index=false, 
      range_key([t1.a]), range[2 ; 2], 
      range_cond([t1.a = 2])
===========================================
|ID|OPERATOR   |NAME|EST.ROWS|EST.TIME(us)|
-------------------------------------------
|0 |UPDATE     |    |1       |37          |
|1 |└─TABLE GET|t1  |1       |5           |
===========================================
Outputs & filters:
-------------------------------------
  0 - output(nil), filter(nil)
      table_columns([{t1: ({t1: (t1.a, t1.b, t1.c)})}]),
      update([t1.b=column_conv(INT,PS:(11,0),NULL,0)])
  1 - output([t1.a], [t1.b], [t1.c]), filter(nil), rowset=16
      access([t1.a], [t1.b], [t1.c]), partitions(p0)
      is_index_back=false, is_global_index=false, 
      range_key([t1.a]), range[3 ; 3], 
      range_cond([t1.a = 3])
affected rows: 16
affected rows: 16
affected rows: 16
commit;
affected rows: 0
select * from t1 order by a, b;
+---+------+------+
| a | b    | c    |
+---+------+------+
| 1 |    1 |    1 |
| 2 |    2 |    2 |
| 3 |    3 |    3 |
+---+------+------+
affected rows: 3
drop table t1;
affected rows: 0

set autocommit = false;
affected rows: 0
create table t1(a int primary key, b int, c int);
affected rows: 0
insert into t1 values(1, 1, 1), (2, 2, 2), (3, 3, 3);
affected rows: 3
info: Records: 3  Duplicates: 0  Warnings: 0
explain update t1 set b = 0 where a = 1;update t1 set b = 0 where a = 2;update t1 set b = 0 where a = 3;//
Query Plan
===========================================
|ID|OPERATOR   |NAME|EST.ROWS|EST.TIME(us)|
-------------------------------------------
|0 |UPDATE     |    |1       |37          |
|1 |└─TABLE GET|t1  |1       |5           |
===========================================
Outputs & filters:
-------------------------------------
  0 - output(nil), filter(nil)
      table_columns([{t1: ({t1: (t1.a, t1.b, t1.c)})}]),
      update([t1.b=column_conv(INT,PS:(11,0),NULL,0)])
  1 - output([t1.a], [t1.b], [t1.c]), filter(nil), rowset=16
      access([t1.a], [t1.b], [t1.c]), partitions(p0)
      is_index_back=false, is_global_index=false, 
      range_key([t1.a]), range[1 ; 1], 
      range_cond([t1.a = 1])
affected rows: 16
affected rows: 1
info:  Rows matched: 1  Changed: 1  Warnings: 0
affected rows: 1
info: Rows matched: 1  Changed: 1  Warnings: 0
commit;
affected rows: 0
select * from t1 order by a, b;
+---+------+------+
| a | b    | c    |
+---+------+------+
| 1 |    1 |    1 |
| 2 |    0 |    2 |
| 3 |    0 |    3 |
+---+------+------+
affected rows: 3
drop table t1;
affected rows: 0

set autocommit = false;
affected rows: 0
create table t1(a int primary key, b int, c int);
affected rows: 0
insert into t1 values(1, 1, 1), (2, 2, 2), (3, 3, 3);
affected rows: 3
info: Records: 3  Duplicates: 0  Warnings: 0
update t1 set b = 0 where a = 1;explain update t1 set b = 0 where a = 2;update t1 set b = 0 where a = 3;//
+--------------------------------------------------------------+
| Query Plan                                                   |
+--------------------------------------------------------------+
| ===========================================                  |
| |ID|OPERATOR   |NAME|EST.ROWS|EST.TIME(us)|                  |
| -------------------------------------------                  |
| |0 |UPDATE     |    |1       |37          |                  |
| |1 |└─TABLE GET|t1  |1       |5           |                  |
| ===========================================                  |
| Outputs & filters:                                           |
| -------------------------------------                        |
|   0 - output(nil), filter(nil)                               |
|       table_columns([{t1: ({t1: (t1.a, t1.b, t1.c)})}]),     |
|       update([t1.b=column_conv(INT,PS:(11,0),NULL,0)])       |
|   1 - output([t1.a], [t1.b], [t1.c]), filter(nil), rowset=16 |
|       access([t1.a], [t1.b], [t1.c]), partitions(p0)         |
|       is_index_back=false, is_global_index=false,            |
|       range_key([t1.a]), range[2 ; 2],                       |
|       range_cond([t1.a = 2])                                 |
affected rows: 1
info:  Rows matched: 1  Changed: 1  Warnings: 0
+--------------------------------------------------------------+
affected rows: 16
affected rows: 1
info: Rows matched: 1  Changed: 1  Warnings: 0
commit;
affected rows: 0
select * from t1 order by a, b;
+---+------+------+
| a | b    | c    |
+---+------+------+
| 1 |    0 |    1 |
| 2 |    2 |    2 |
| 3 |    0 |    3 |
+---+------+------+
affected rows: 3
drop table t1;
affected rows: 0

set autocommit = false;
affected rows: 0
create table t1(a int primary key, b int, c int);
affected rows: 0
insert into t1 values(1, 1, 1), (2, 2, 2), (3, 3, 3);
affected rows: 3
info: Records: 3  Duplicates: 0  Warnings: 0
update t1 set b = 0 where a = 1;update t1 set b = 0 where a = 2;update t1 set b = 0 where a = 3;//
affected rows: 1
info:  Rows matched: 1  Changed: 1  Warnings: 0
affected rows: 1
info:  Rows matched: 1  Changed: 1  Warnings: 0
affected rows: 1
info: Rows matched: 1  Changed: 1  Warnings: 0
commit;
affected rows: 0
select * from t1 order by a, b;
+---+------+------+
| a | b    | c    |
+---+------+------+
| 1 |    0 |    1 |
| 2 |    0 |    2 |
| 3 |    0 |    3 |
+---+------+------+
affected rows: 3
drop table t1;
affected rows: 0

set autocommit = false;
affected rows: 0
create table t1(a int primary key, b int, c int);
affected rows: 0
insert into t1 values(1, 1, 1), (2, 2, 2), (3, 3, 3);
affected rows: 3
info: Records: 3  Duplicates: 0  Warnings: 0
explain update t1 set b = 0 where a = 1;explain update t1 set b = 0 where a = 2;explain update t1 set b = 0 where a = 3;//
ERROR 0A000: Not supported feature or function
commit;
affected rows: 0
select * from t1 order by a, b;
+---+------+------+
| a | b    | c    |
+---+------+------+
| 1 |    1 |    1 |
| 2 |    2 |    2 |
| 3 |    3 |    3 |
+---+------+------+
affected rows: 3
drop table t1;
affected rows: 0

set autocommit = false;
affected rows: 0
create table t1(a int primary key, b int, c int);
affected rows: 0
insert into t1 values(1, 1, 1), (2, 2, 2), (3, 3, 3);
affected rows: 3
info: Records: 3  Duplicates: 0  Warnings: 0
explain update t1 set b = 0 where a = 1;update t1 set b = 0 where a = 2;explain update t1 set b = 0 where a = 3;//
ERROR 0A000: Not supported feature or function
commit;
affected rows: 0
select * from t1 order by a, b;
+---+------+------+
| a | b    | c    |
+---+------+------+
| 1 |    1 |    1 |
| 2 |    2 |    2 |
| 3 |    3 |    3 |
+---+------+------+
affected rows: 3
drop table t1;
affected rows: 0

set autocommit = false;
affected rows: 0
create table t1(a int primary key, b int, c int);
affected rows: 0
insert into t1 values(1, 1, 1), (2, 2, 2), (3, 3, 3);
affected rows: 3
info: Records: 3  Duplicates: 0  Warnings: 0
update t1 set b = 0 where a = 1;update t1 set b = 0 where a = 2;update t1 set b = 0 where a = 3;//
affected rows: 1
info:  Rows matched: 1  Changed: 1  Warnings: 0
affected rows: 1
info:  Rows matched: 1  Changed: 1  Warnings: 0
affected rows: 1
info: Rows matched: 1  Changed: 1  Warnings: 0
commit;
affected rows: 0
select * from t1 order by a, b;
+---+------+------+
| a | b    | c    |
+---+------+------+
| 1 |    0 |    1 |
| 2 |    0 |    2 |
| 3 |    0 |    3 |
+---+------+------+
affected rows: 3
drop table t1;
affected rows: 0

alter system set ob_enable_batched_multi_statement=false;
affected rows: 0
alter system set_tp tp_no = 403, error_code = 0, frequency = 1;
affected rows: 0

