drop table if exists t1,t2,t3,t4,t5,t6;
result_format: 4
alter system set ob_enable_batched_multi_statement=true;
affected rows: 0
set autocommit = 0;
affected rows: 0

create table t1(a int, b int, c int);
affected rows: 0
insert into t1 values(1,1,1),(2,2,2),(3,3,3),(4,4,4),(5,5,5),(6,6,6),(7,7,7);
affected rows: 7
info: Records: 7  Duplicates: 0  Warnings: 0
commit;
affected rows: 0
delete from t1 where a = 1 ; delete from t1 where a = 2 ; delete from t1 where a = 3;//
affected rows: 1
affected rows: 1
affected rows: 1
select * from t1;
+------+------+------+
| a    | b    | c    |
+------+------+------+
|    4 |    4 |    4 |
|    5 |    5 |    5 |
|    6 |    6 |    6 |
|    7 |    7 |    7 |
+------+------+------+
affected rows: 4
select hit_count, is_batched_multi_stmt, statement, query_sql from oceanbase.gv$OB_PLAN_CACHE_PLAN_STAT where statement like '%delete from t1 where a = %' order by hit_count;
+-----------+-----------------------+----------------------------+---------------------------------------------------------------------------------------+
| hit_count | is_batched_multi_stmt | statement                  | query_sql                                                                             |
+-----------+-----------------------+----------------------------+---------------------------------------------------------------------------------------+
|         0 |                     1 | delete from t1 where a = ? | delete from t1 where a = 1 ; delete from t1 where a = 2 ; delete from t1 where a = 3; |
+-----------+-----------------------+----------------------------+---------------------------------------------------------------------------------------+
affected rows: 1
rollback;
affected rows: 0
update t1 set a = a + 10 where b = 1; update t1 set a = a + 10 where b = 2 ; update t1 set a = a + 10 where b = 3;//
affected rows: 1
info:  Rows matched: 1  Changed: 1  Warnings: 0
affected rows: 1
info:  Rows matched: 1  Changed: 1  Warnings: 0
affected rows: 1
info: Rows matched: 1  Changed: 1  Warnings: 0
select * from t1;
+------+------+------+
| a    | b    | c    |
+------+------+------+
|   11 |    1 |    1 |
|   12 |    2 |    2 |
|   13 |    3 |    3 |
|    4 |    4 |    4 |
|    5 |    5 |    5 |
|    6 |    6 |    6 |
|    7 |    7 |    7 |
+------+------+------+
affected rows: 7
select hit_count, is_batched_multi_stmt, statement, query_sql from oceanbase.gv$OB_PLAN_CACHE_PLAN_STAT where statement like '%update t1 set a =%' order by hit_count;
+-----------+-----------------------+-------------------------------------+--------------------------------------------------------------------------------------------------------------------+
| hit_count | is_batched_multi_stmt | statement                           | query_sql                                                                                                          |
+-----------+-----------------------+-------------------------------------+--------------------------------------------------------------------------------------------------------------------+
|         0 |                     1 | update t1 set a = a + ? where b = ? | update t1 set a = a + 10 where b = 1; update t1 set a = a + 10 where b = 2 ; update t1 set a = a + 10 where b = 3; |
+-----------+-----------------------+-------------------------------------+--------------------------------------------------------------------------------------------------------------------+
affected rows: 1
commit;
affected rows: 0

set autocommit = true;
affected rows: 0
alter system set ob_enable_batched_multi_statement=false;
affected rows: 0
