drop table if exists t1,t2,t3,t4,t5,t6;
result_format: 4
set autocommit = false;
alter system set ob_enable_batched_multi_statement=true;

create table t1(c1 int, c2 int, c3 int, c4 int);
affected rows: 0
create table t2(c1 int, c2 int, c3 int, c4 int);
affected rows: 0
insert into t2 values(1,1,1,1),(2,2,2,2),(3,3,3,3),(4,4,4,4),(5,5,5,5),(6,6,6,6),(7,7,7,7),(8,8,8,8);
affected rows: 8
info: Records: 8  Duplicates: 0  Warnings: 0
insert into t1 select * from t2 where t2.c1 = 1;insert into t1 select * from t2 where t2.c1 = 2;//
affected rows: 1
affected rows: 1
commit;
affected rows: 0
select * from t1;
+------+------+------+------+
| c1   | c2   | c3   | c4   |
+------+------+------+------+
|    1 |    1 |    1 |    1 |
|    2 |    2 |    2 |    2 |
+------+------+------+------+
affected rows: 2

insert into t1 select * from t2 where t2.c1 = 4;insert into t1 select * from t2 where t2.c1 = 5;insert into t1 select * from t2 where t2.c1 = 6;//
affected rows: 1
affected rows: 1
affected rows: 1
commit;
affected rows: 0
select * from t1;
+------+------+------+------+
| c1   | c2   | c3   | c4   |
+------+------+------+------+
|    1 |    1 |    1 |    1 |
|    2 |    2 |    2 |    2 |
|    4 |    4 |    4 |    4 |
|    5 |    5 |    5 |    5 |
|    6 |    6 |    6 |    6 |
+------+------+------+------+
affected rows: 5

insert into t1 select * from t2 where t2.c1 = 7;insert into t1 select * from t2 where t2.c1 = 8;//
affected rows: 1
affected rows: 1
commit;
affected rows: 0
select * from t1;
+------+------+------+------+
| c1   | c2   | c3   | c4   |
+------+------+------+------+
|    1 |    1 |    1 |    1 |
|    2 |    2 |    2 |    2 |
|    4 |    4 |    4 |    4 |
|    5 |    5 |    5 |    5 |
|    6 |    6 |    6 |    6 |
|    7 |    7 |    7 |    7 |
|    8 |    8 |    8 |    8 |
+------+------+------+------+
affected rows: 7

select hit_count, is_batched_multi_stmt, statement, query_sql from oceanbase.gv$OB_PLAN_CACHE_PLAN_STAT where statement like 'insert into t1 % from t2 where t2.c1 = %' order by hit_count;
+-----------+-----------------------+--------------------------------------------------+--------------------------------------------------+
| hit_count | is_batched_multi_stmt | statement                                        | query_sql                                        |
+-----------+-----------------------+--------------------------------------------------+--------------------------------------------------+
|         6 |                     0 | insert into t1 select * from t2 where t2.c1 = ?; | insert into t1 select * from t2 where t2.c1 = 1; |
+-----------+-----------------------+--------------------------------------------------+--------------------------------------------------+
affected rows: 1
delete from t1;
affected rows: 7

insert into t1 select 1, 2, c3, c4 from t2 where t2.c1 = 1;insert into t1 select 3, 4, c3, c4 from t2 where t2.c1 = 2;//
affected rows: 1
affected rows: 1
insert into t1 select 5, 6, c3, c4 from t2 where t2.c1 = 3;insert into t1 select 7, 8, c3, c4 from t2 where t2.c1 = 4;//
affected rows: 1
affected rows: 1
commit;
affected rows: 0
select * from t1;
+------+------+------+------+
| c1   | c2   | c3   | c4   |
+------+------+------+------+
|    1 |    2 |    1 |    1 |
|    3 |    4 |    2 |    2 |
|    5 |    6 |    3 |    3 |
|    7 |    8 |    4 |    4 |
+------+------+------+------+
affected rows: 4

select hit_count, is_batched_multi_stmt, statement, query_sql from oceanbase.gv$OB_PLAN_CACHE_PLAN_STAT where statement like 'insert into t1 % c3, c4 from t2 where t2.c1 = %' order by hit_count;
+-----------+-----------------------+-------------------------------------------------------------+-------------------------------------------------------------+
| hit_count | is_batched_multi_stmt | statement                                                   | query_sql                                                   |
+-----------+-----------------------+-------------------------------------------------------------+-------------------------------------------------------------+
|         3 |                     0 | insert into t1 select ?, ?, c3, c4 from t2 where t2.c1 = ?; | insert into t1 select 1, 2, c3, c4 from t2 where t2.c1 = 1; |
+-----------+-----------------------+-------------------------------------------------------------+-------------------------------------------------------------+
affected rows: 1
delete from t1;
affected rows: 4

insert into t1 select 1+1, 2+2, c3, c4 from t2 where t2.c1 = 1;insert into t1 select 3+3, 4+4, c3, c4 from t2 where t2.c1 = 2;//
affected rows: 1
affected rows: 1
insert into t1 select 5+5, 6+6, c3, c4 from t2 where t2.c1 = 3;insert into t1 select 7+7, 8+8, c3, c4 from t2 where t2.c1 = 4;//
affected rows: 1
affected rows: 1
commit;
affected rows: 0
select * from t1;
+------+------+------+------+
| c1   | c2   | c3   | c4   |
+------+------+------+------+
|    2 |    4 |    1 |    1 |
|    6 |    8 |    2 |    2 |
|   10 |   12 |    3 |    3 |
|   14 |   16 |    4 |    4 |
+------+------+------+------+
affected rows: 4

delete from t1;
affected rows: 4

insert into t1 select 1+1, 2+2, c3, c4 from t2 where t2.c1 = 1+1;insert into t1 select 3+3, 4+4, c3, c4 from t2 where t2.c1 = 2+2;//
affected rows: 1
affected rows: 1
insert into t1 select 5+5, 6+6, c3, c4 from t2 where t2.c1 = 3+3;insert into t1 select 7+7, 8+8, c3, c4 from t2 where t2.c1 = 4+4;//
affected rows: 1
affected rows: 1
commit;
affected rows: 0
select * from t1;
+------+------+------+------+
| c1   | c2   | c3   | c4   |
+------+------+------+------+
|    2 |    4 |    2 |    2 |
|    6 |    8 |    4 |    4 |
|   10 |   12 |    6 |    6 |
|   14 |   16 |    8 |    8 |
+------+------+------+------+
affected rows: 4

select hit_count, is_batched_multi_stmt, statement, query_sql from oceanbase.gv$OB_PLAN_CACHE_PLAN_STAT where statement like 'insert into t1 % c3, c4 from t2 where t2.c1 = %' order by hit_count;
+-----------+-----------------------+-------------------------------------------------------------------+-------------------------------------------------------------------+
| hit_count | is_batched_multi_stmt | statement                                                         | query_sql                                                         |
+-----------+-----------------------+-------------------------------------------------------------------+-------------------------------------------------------------------+
|         0 |                     0 | insert into t1 select ?+?, ?+?, c3, c4 from t2 where t2.c1 = ?+?; | insert into t1 select 1+1, 2+2, c3, c4 from t2 where t2.c1 = 1+1; |
|         2 |                     0 | insert into t1 select ?+?, ?+?, c3, c4 from t2 where t2.c1 = ?+?; | insert into t1 select 3+3, 4+4, c3, c4 from t2 where t2.c1 = 2+2; |
|         3 |                     0 | insert into t1 select ?, ?, c3, c4 from t2 where t2.c1 = ?;       | insert into t1 select 1, 2, c3, c4 from t2 where t2.c1 = 1;       |
|         3 |                     0 | insert into t1 select ?+?, ?+?, c3, c4 from t2 where t2.c1 = ?;   | insert into t1 select 1+1, 2+2, c3, c4 from t2 where t2.c1 = 1;   |
+-----------+-----------------------+-------------------------------------------------------------------+-------------------------------------------------------------------+
affected rows: 4
drop table t1;
affected rows: 0
drop table t2;
affected rows: 0

## 2- test data type in batch 
create table t1(c1 int, c2 varchar(20), c3 text, c4 date);
affected rows: 0
create table t3(c1 int, c2 varchar(20), c3 text, c4 date);
affected rows: 0

insert into t3 values(1,'aa','1111','2020-2-2');insert into t3 values(2,'bb','2222','2020-2-3');//
affected rows: 1
affected rows: 1
insert into t3 values(3,'cc','3333','2020-2-4');insert into t3 values(4,'dd','4444','2020-2-5');//
affected rows: 1
affected rows: 1
insert into t3 values(5,'eee','5555','2020-2-6');insert into t3 values(6,'eeee','6666','2020-2-7');//
affected rows: 1
affected rows: 1
insert into t3 values(7,'fff','7777','2020-2-8');insert into t3 values(8,'ggg','8888','2020-2-9');insert into t3 values(9,'hhh','999','2020-2-10');//
affected rows: 1
affected rows: 1
affected rows: 1
commit;
affected rows: 0
select * from t3 order by c1;
+------+------+------+------------+
| c1   | c2   | c3   | c4         |
+------+------+------+------------+
|    1 | aa   | 1111 | 2020-02-02 |
|    2 | bb   | 2222 | 2020-02-03 |
|    3 | cc   | 3333 | 2020-02-04 |
|    4 | dd   | 4444 | 2020-02-05 |
|    5 | eee  | 5555 | 2020-02-06 |
|    6 | eeee | 6666 | 2020-02-07 |
|    7 | fff  | 7777 | 2020-02-08 |
|    8 | ggg  | 8888 | 2020-02-09 |
|    9 | hhh  | 999  | 2020-02-10 |
+------+------+------+------------+
affected rows: 9

## 2.1- test data type in batch 
insert into t1 select c1, c2, c3, c4 from t3 where c1 = 1;insert into t1 select c1, c2, c3, c4 from t3 where c1 = 2;insert into t1 select c1, c2, c3, c4 from t3 where c1 = 3;insert into t1 select c1, c2, c3, c4 from t3 where c1 = 4;//
affected rows: 1
affected rows: 1
affected rows: 1
affected rows: 1
insert into t1 select c1, c2, c3, c4 from t3 where c1 = 5;insert into t1 select c1, c2, c3, c4 from t3 where c1 = 6;//
affected rows: 1
affected rows: 1
insert into t1 select c1, c2, c3, c4 from t3 where c1 = 7;insert into t1 select c1, c2, c3, c4 from t3 where c1 = 8;//
affected rows: 1
affected rows: 1
commit;
affected rows: 0
select * from t1 order by c1;
+------+------+------+------------+
| c1   | c2   | c3   | c4         |
+------+------+------+------------+
|    1 | aa   | 1111 | 2020-02-02 |
|    2 | bb   | 2222 | 2020-02-03 |
|    3 | cc   | 3333 | 2020-02-04 |
|    4 | dd   | 4444 | 2020-02-05 |
|    5 | eee  | 5555 | 2020-02-06 |
|    6 | eeee | 6666 | 2020-02-07 |
|    7 | fff  | 7777 | 2020-02-08 |
|    8 | ggg  | 8888 | 2020-02-09 |
+------+------+------+------------+
affected rows: 8

select hit_count, is_batched_multi_stmt, statement, query_sql from oceanbase.gv$OB_PLAN_CACHE_PLAN_STAT where statement like 'insert into t1 select c1, c2, c3, c4 from t3 where c1 = %' order by hit_count;
+-----------+-----------------------+------------------------------------------------------------+------------------------------------------------------------+
| hit_count | is_batched_multi_stmt | statement                                                  | query_sql                                                  |
+-----------+-----------------------+------------------------------------------------------------+------------------------------------------------------------+
|         7 |                     0 | insert into t1 select c1, c2, c3, c4 from t3 where c1 = ?; | insert into t1 select c1, c2, c3, c4 from t3 where c1 = 1; |
+-----------+-----------------------+------------------------------------------------------------+------------------------------------------------------------+
affected rows: 1
delete from t1;
affected rows: 8
commit;
affected rows: 0

## 2.2- test one sql with multi_row insert 
insert into t1 select c1, c2, c3, c4 from t3 where c1 > 1 and c1 < 3;insert into t1 select c1, c2, c3, c4 from t3 where c1 > 2 and c1 < 6;insert into t1 select c1, c2, c3, c4 from t3 where c1 > 5 and c1 < 16;//
affected rows: 1
affected rows: 3
info:  Records: 3  Duplicates: 0  Warnings: 0
affected rows: 4
info: Records: 4  Duplicates: 0  Warnings: 0
commit;
affected rows: 0
select * from t1 order by c1;
+------+------+------+------------+
| c1   | c2   | c3   | c4         |
+------+------+------+------------+
|    2 | bb   | 2222 | 2020-02-03 |
|    3 | cc   | 3333 | 2020-02-04 |
|    4 | dd   | 4444 | 2020-02-05 |
|    5 | eee  | 5555 | 2020-02-06 |
|    6 | eeee | 6666 | 2020-02-07 |
|    7 | fff  | 7777 | 2020-02-08 |
|    8 | ggg  | 8888 | 2020-02-09 |
|    9 | hhh  | 999  | 2020-02-10 |
+------+------+------+------------+
affected rows: 8
delete from t1;
affected rows: 8
commit;
affected rows: 0

insert into t1 select c1, concat('11', 'dkz'), c3, c4 from t3 where c1 > 1 and c1 < 3;insert into t1 select c1, concat('22', 'dsr'), c3, c4 from t3 where c1 > 2 and c1 < 6;insert into t1 select c1, concat('33', 'djy'), c3, c4 from t3 where c1 > 5 and c1 < 16;//
affected rows: 1
affected rows: 3
info:  Records: 3  Duplicates: 0  Warnings: 0
affected rows: 4
info: Records: 4  Duplicates: 0  Warnings: 0
commit;
affected rows: 0
select * from t1 order by c1;
+------+-------+------+------------+
| c1   | c2    | c3   | c4         |
+------+-------+------+------------+
|    2 | 11dkz | 2222 | 2020-02-03 |
|    3 | 22dsr | 3333 | 2020-02-04 |
|    4 | 22dsr | 4444 | 2020-02-05 |
|    5 | 22dsr | 5555 | 2020-02-06 |
|    6 | 33djy | 6666 | 2020-02-07 |
|    7 | 33djy | 7777 | 2020-02-08 |
|    8 | 33djy | 8888 | 2020-02-09 |
|    9 | 33djy | 999  | 2020-02-10 |
+------+-------+------+------------+
affected rows: 8
delete from t1;
affected rows: 8
commit;
affected rows: 0
drop table t1;
affected rows: 0
drop table t3;
affected rows: 0

create table t1(c1 int, c2 int, c3 varchar(20), c4 int, primary key(c1, c2)) partition by hash(c1) partitions 4;
affected rows: 0
create index t1_idx_01 on t1(c4) global;
affected rows: 0
create table t2(c1 int, c2 int, c3 varchar(20), c4 int);
affected rows: 0
insert into t2 values(1,1,'1',1),(2,2,'2',2),(3,3,'3',3),(4,4,'4',4),(5,5,'5',5),(6,6,'6',6),(7,7,'7',7),(8,8,'8',8),(9,9,'9',9),(10,10,'10',10);
affected rows: 10
info: Records: 10  Duplicates: 0  Warnings: 0
insert into t1 select c1, c2, c3, c4 from t2 where c1 = 1;insert into t1 select c1, c2, c3, c4 from t2 where c1 = 2;//
affected rows: 1
affected rows: 1
insert into t1 select c1, c2, c3, c4 from t2 where c1 = 3;insert into t1 select c1, c2, c3, c4 from t2 where c1 = 4;//
affected rows: 1
affected rows: 1
insert into t1 select c1, c2, c3, c4 from t2 where c1 = 5;insert into t1 select c1, c2, c3, c4 from t2 where c1 = 6;insert into t1 select c1, c2, c3, c4 from t2 where c1 = 7;insert into t1 select c1, c2, c3, c4 from t2 where c1 = 8;//
affected rows: 1
affected rows: 1
affected rows: 1
affected rows: 1
commit;
affected rows: 0
select /*+ INDEX(t1 t1_idx_01) */ * from t1 order by c1;
+----+----+------+------+
| c1 | c2 | c3   | c4   |
+----+----+------+------+
|  1 |  1 | 1    |    1 |
|  2 |  2 | 2    |    2 |
|  3 |  3 | 3    |    3 |
|  4 |  4 | 4    |    4 |
|  5 |  5 | 5    |    5 |
|  6 |  6 | 6    |    6 |
|  7 |  7 | 7    |    7 |
|  8 |  8 | 8    |    8 |
+----+----+------+------+
affected rows: 8
drop table t1;
affected rows: 0
drop table t2;
affected rows: 0

alter system set ob_enable_batched_multi_statement=false;
affected rows: 0
alter system set _rowsets_enabled=true;
affected rows: 0

