drop table if exists t1,t2,t3,t4,t5,t6;
result_format: 4
set autocommit = false;
affected rows: 0
alter system set ob_enable_batched_multi_statement=true;
affected rows: 0

create table t1(c1 int, c2 int, c3 int, c4 int);
affected rows: 0
create table t3(c1 int, c2 int);
affected rows: 0
create table t4(c1 int, c2 int);
affected rows: 0
create table t5(c1 int, c2 int);
affected rows: 0
insert into t3 values(1,1),(2,2),(3,3),(4,4),(5,5),(6,6),(7,7),(8,8),(9,9);
affected rows: 9
info: Records: 9  Duplicates: 0  Warnings: 0
insert into t4 values(1,1),(2,2),(3,3),(4,4),(5,5),(6,6),(7,7),(8,8),(9,9);
affected rows: 9
info: Records: 9  Duplicates: 0  Warnings: 0
insert into t5 values(1,1),(2,2),(3,3),(4,4),(5,5),(6,6),(7,7),(8,8),(9,9);
affected rows: 9
info: Records: 9  Duplicates: 0  Warnings: 0
insert into t1 select * from t3, t4 where t3.c1 = t4.c1 and t3.c1 = 1;insert into t1 select * from t3, t4 where t3.c1 = t4.c1 and t3.c1 = 2;//
affected rows: 1
affected rows: 1
insert into t1 select * from t3, t4 where t3.c1 = t4.c1 and t3.c1 = 3;insert into t1 select * from t3, t4 where t3.c1 = t4.c1 and t3.c1 = 4;//
affected rows: 1
affected rows: 1
insert into t1 select * from t3, t4 where t3.c1 = t4.c1 and t3.c1 = 5;insert into t1 select * from t3, t4 where t3.c1 = t4.c1 and t3.c1 = 6;insert into t1 select * from t3, t4 where t3.c1 = t4.c1 and t3.c1 = 7;//
affected rows: 1
affected rows: 1
affected rows: 1
commit;
affected rows: 0
select * from t1;
+------+------+------+------+
| c1   | c2   | c3   | c4   |
+------+------+------+------+
|    1 |    1 |    1 |    1 |
|    2 |    2 |    2 |    2 |
|    3 |    3 |    3 |    3 |
|    4 |    4 |    4 |    4 |
|    5 |    5 |    5 |    5 |
|    6 |    6 |    6 |    6 |
|    7 |    7 |    7 |    7 |
+------+------+------+------+
affected rows: 7

select hit_count, is_batched_multi_stmt, statement, query_sql from oceanbase.gv$OB_PLAN_CACHE_PLAN_STAT where statement like 'insert into t1 % t3, t4 where t3.c1 = t4.c1 and t3.c1 = %' order by hit_count;
+-----------+-----------------------+------------------------------------------------------------------------+------------------------------------------------------------------------+
| hit_count | is_batched_multi_stmt | statement                                                              | query_sql                                                              |
+-----------+-----------------------+------------------------------------------------------------------------+------------------------------------------------------------------------+
|         6 |                     0 | insert into t1 select * from t3, t4 where t3.c1 = t4.c1 and t3.c1 = ?; | insert into t1 select * from t3, t4 where t3.c1 = t4.c1 and t3.c1 = 1; |
+-----------+-----------------------+------------------------------------------------------------------------+------------------------------------------------------------------------+
affected rows: 1
delete from t1;
affected rows: 7

insert into t1 select * from t3, t4 where t3.c1 = t4.c1 and t3.c1 > 1 and t3.c1 < 3;insert into t1 select * from t3, t4 where t3.c1 = t4.c1 and t3.c1 > 3 and t3.c1 < 6;insert into t1 select * from t3, t4 where t3.c1 = t4.c1 and t3.c1 > 6 and t3.c1 < 10;//
affected rows: 1
affected rows: 2
info:  Records: 2  Duplicates: 0  Warnings: 0
affected rows: 3
info: Records: 3  Duplicates: 0  Warnings: 0
commit;
affected rows: 0
select * from t1;
+------+------+------+------+
| c1   | c2   | c3   | c4   |
+------+------+------+------+
|    2 |    2 |    2 |    2 |
|    4 |    4 |    4 |    4 |
|    5 |    5 |    5 |    5 |
|    7 |    7 |    7 |    7 |
|    8 |    8 |    8 |    8 |
|    9 |    9 |    9 |    9 |
+------+------+------+------+
affected rows: 6
delete from t1;
affected rows: 6

insert into t1 select * from t3 left join t4 on t3.c1 = t4.c1 and t3.c1 > 1 and t3.c1 < 3;insert into t1 select * from t3 left join t4 on t3.c1 = t4.c1 and t3.c1 > 2 and t3.c1 < 6;insert into t1 select * from t3 left join t4 on t3.c1 = t4.c1 and t3.c1 > 6 and t3.c1 < 10;//
affected rows: 9
info:  Records: 9  Duplicates: 0  Warnings: 0
affected rows: 9
info:  Records: 9  Duplicates: 0  Warnings: 0
affected rows: 9
info: Records: 9  Duplicates: 0  Warnings: 0
commit;
affected rows: 0
select * from t1;
+------+------+------+------+
| c1   | c2   | c3   | c4   |
+------+------+------+------+
|    1 |    1 | NULL | NULL |
|    2 |    2 |    2 |    2 |
|    3 |    3 | NULL | NULL |
|    4 |    4 | NULL | NULL |
|    5 |    5 | NULL | NULL |
|    6 |    6 | NULL | NULL |
|    7 |    7 | NULL | NULL |
|    8 |    8 | NULL | NULL |
|    9 |    9 | NULL | NULL |
|    1 |    1 | NULL | NULL |
|    2 |    2 | NULL | NULL |
|    3 |    3 |    3 |    3 |
|    4 |    4 |    4 |    4 |
|    5 |    5 |    5 |    5 |
|    6 |    6 | NULL | NULL |
|    7 |    7 | NULL | NULL |
|    8 |    8 | NULL | NULL |
|    9 |    9 | NULL | NULL |
|    1 |    1 | NULL | NULL |
|    2 |    2 | NULL | NULL |
|    3 |    3 | NULL | NULL |
|    4 |    4 | NULL | NULL |
|    5 |    5 | NULL | NULL |
|    6 |    6 | NULL | NULL |
|    7 |    7 |    7 |    7 |
|    8 |    8 |    8 |    8 |
|    9 |    9 |    9 |    9 |
+------+------+------+------+
affected rows: 27

select hit_count, is_batched_multi_stmt, statement, query_sql from oceanbase.gv$OB_PLAN_CACHE_PLAN_STAT where statement like '% into t1 select % t3 left join t4 on t3.c1 = t4.c1 and t3.c1 %' order by hit_count;
+-----------+-----------------------+--------------------------------------------------------------------------------------------+--------------------------------------------------------------------------------------------+
| hit_count | is_batched_multi_stmt | statement                                                                                  | query_sql                                                                                  |
+-----------+-----------------------+--------------------------------------------------------------------------------------------+--------------------------------------------------------------------------------------------+
|         2 |                     0 | insert into t1 select * from t3 left join t4 on t3.c1 = t4.c1 and t3.c1 > ? and t3.c1 < ?; | insert into t1 select * from t3 left join t4 on t3.c1 = t4.c1 and t3.c1 > 1 and t3.c1 < 3; |
+-----------+-----------------------+--------------------------------------------------------------------------------------------+--------------------------------------------------------------------------------------------+
affected rows: 1
delete from t1;
affected rows: 27

insert into t1 select t3.c1, t4.c2, t5.c1,t5.c2 from t3 left join t4 on t3.c1 = t4.c1 and t4.c1 > 1 and t4.c1 < 3 inner join t5 on t5.c1 = t4.c1;insert into t1 select t3.c1, t4.c2, t5.c1,t5.c2 from t3 left join t4 on t3.c1 = t4.c1 and t4.c1 > 3 and t4.c1 < 7 inner join t5 on t5.c1 = t4.c1;//
affected rows: 1
affected rows: 3
info: Records: 3  Duplicates: 0  Warnings: 0
commit;
affected rows: 0
select * from t1;
+------+------+------+------+
| c1   | c2   | c3   | c4   |
+------+------+------+------+
|    2 |    2 |    2 |    2 |
|    4 |    4 |    4 |    4 |
|    5 |    5 |    5 |    5 |
|    6 |    6 |    6 |    6 |
+------+------+------+------+
affected rows: 4
select hit_count, is_batched_multi_stmt, statement, query_sql from oceanbase.gv$OB_PLAN_CACHE_PLAN_STAT where statement like 'insert into t1 select t3.c1, t4.c2, t5.c1,t5.c2 from t3 left join t4 on t3.c1 = t4.c1 and %' order by hit_count;
+-----------+-----------------------+---------------------------------------------------------------------------------------------------------------------------------------------------+---------------------------------------------------------------------------------------------------------------------------------------------------+
| hit_count | is_batched_multi_stmt | statement                                                                                                                                         | query_sql                                                                                                                                         |
+-----------+-----------------------+---------------------------------------------------------------------------------------------------------------------------------------------------+---------------------------------------------------------------------------------------------------------------------------------------------------+
|         1 |                     0 | insert into t1 select t3.c1, t4.c2, t5.c1,t5.c2 from t3 left join t4 on t3.c1 = t4.c1 and t4.c1 > ? and t4.c1 < ? inner join t5 on t5.c1 = t4.c1; | insert into t1 select t3.c1, t4.c2, t5.c1,t5.c2 from t3 left join t4 on t3.c1 = t4.c1 and t4.c1 > 1 and t4.c1 < 3 inner join t5 on t5.c1 = t4.c1; |
+-----------+-----------------------+---------------------------------------------------------------------------------------------------------------------------------------------------+---------------------------------------------------------------------------------------------------------------------------------------------------+
affected rows: 1

insert into t1 select 1,1, t3.c1, t3.c2 from t3 where t3.c1 in (select t4.c1 from t4 where t4.c2 > 3 and t4.c2 <6 union all select t5.c2 from t5 where t5.c1 > 2 and t5.c1 < 4);insert into t1 select 1,1, t3.c1, t3.c2 from t3 where t3.c1 in (select t4.c1 from t4 where t4.c2 > 6 and t4.c2 <10 union all select t5.c2 from t5 where t5.c1 > 0 and t5.c1 < 3);//
affected rows: 3
info:  Records: 3  Duplicates: 0  Warnings: 0
affected rows: 5
info: Records: 5  Duplicates: 0  Warnings: 0
commit;
affected rows: 0

select hit_count, is_batched_multi_stmt, statement, query_sql from oceanbase.gv$OB_PLAN_CACHE_PLAN_STAT where statement like '% into t1 select % from t3 where t3.c1 in (select t4.c1 from t4 where %' order by hit_count;
+-----------+-----------------------+----------------------------------------------------------------------------------------------------------------------------------------------------------------------------------+----------------------------------------------------------------------------------------------------------------------------------------------------------------------------------+
| hit_count | is_batched_multi_stmt | statement                                                                                                                                                                        | query_sql                                                                                                                                                                        |
+-----------+-----------------------+----------------------------------------------------------------------------------------------------------------------------------------------------------------------------------+----------------------------------------------------------------------------------------------------------------------------------------------------------------------------------+
|         1 |                     0 | insert into t1 select ?,?, t3.c1, t3.c2 from t3 where t3.c1 in (select t4.c1 from t4 where t4.c2 > ? and t4.c2 <? union all select t5.c2 from t5 where t5.c1 > ? and t5.c1 < ?); | insert into t1 select 1,1, t3.c1, t3.c2 from t3 where t3.c1 in (select t4.c1 from t4 where t4.c2 > 3 and t4.c2 <6 union all select t5.c2 from t5 where t5.c1 > 2 and t5.c1 < 4); |
+-----------+-----------------------+----------------------------------------------------------------------------------------------------------------------------------------------------------------------------------+----------------------------------------------------------------------------------------------------------------------------------------------------------------------------------+
affected rows: 1
drop table t1;
affected rows: 0
drop table t3;
affected rows: 0
drop table t4;
affected rows: 0
drop table t5;
affected rows: 0

create table t1(c1 int primary key, c2 int);
affected rows: 0
create table t2(c1 int, c2 int);
affected rows: 0
insert into t2 values(1,1),(2,2),(3,3),(4,4),(5,5),(6,6),(7,7),(3,4),(4,5);
affected rows: 9
info: Records: 9  Duplicates: 0  Warnings: 0
insert into t1 select * from t2 where t2.c1 = 1;insert into t1 select * from t2 where t2.c1 = 2;insert into t1 select * from t2 where t2.c1 = 3;insert into t1 select * from t2 where t2.c1 = 4;//
affected rows: 1
affected rows: 1
ERROR 23000: Duplicate entry '3' for key 'PRIMARY'
select * from t1;
+----+------+
| c1 | c2   |
+----+------+
|  1 |    1 |
|  2 |    2 |
+----+------+
affected rows: 2

drop table t1;
affected rows: 0
drop table t2;
affected rows: 0

alter system set _rowsets_enabled=true;
affected rows: 0
set autocommit = true;
affected rows: 0
alter system set ob_enable_batched_multi_statement=false;
affected rows: 0
