drop table if exists t1,t2,t3,t4,t5;
result_format: 4
## 测试基础能力不报错,多分区，不带全局索引
create table t1(c1 int primary key, c2 int, c3 int) partition by hash(c1) partitions 12;
affected rows: 0
replace into t1 values(1,1,1),(2,2,2),(3,3,3),(4,4,4),(5,5,5),(6,6,6),(7,7,7),(8,8,8),(9,9,9),(10,10,10),(11,11,11),(12,12,12),(13,13,13),(14,14,14),(15,15,15);
affected rows: 15
info: Records: 15  Duplicates: 0  Warnings: 0
replace into t1 values(1,1,1),(2,2,2),(3,3,3),(4,4,4),(5,5,5),(6,6,6),(7,7,7),(8,8,8),(9,9,9),(10,10,10),(11,11,11),(12,12,12),(13,13,13),(14,14,14),(15,15,15);
affected rows: 15
info: Records: 15  Duplicates: 0  Warnings: 0
replace into t1 values(1,1,1),(2,2,2),(3,3,3),(4,4,4),(5,5,5),(6,6,6),(7,7,7),(8,8,8),(9,9,9),(10,10,10),(11,11,11),(12,12,12),(13,13,13),(14,14,14),(15,15,15),(16,16,16),(17,17,17),(18,18,18),(19,19,19),(20,20,20),(21,21,21),(22,22,22),(23,23,23),(24,24,24),(25,25,25),(26,26,26),(27,27,27),(28,28,28),(29,29,29),(30,30,30);
affected rows: 30
info: Records: 30  Duplicates: 0  Warnings: 0
replace into t1 values(1,1,1),(2,2,2),(3,3,3),(4,4,4),(5,5,5),(6,6,6),(7,7,7),(8,8,8),(9,9,9),(10,10,10),(11,11,11),(12,12,12),(13,13,13),(14,14,14),(15,15,15),(16,16,16),(17,17,17),(18,18,18),(19,19,19),(20,20,20),(21,21,21),(22,22,22),(23,23,23),(24,24,24),(25,25,25),(26,26,26),(27,27,27),(28,28,28),(29,29,29),(30,30,30);
affected rows: 30
info: Records: 30  Duplicates: 0  Warnings: 0
select * from t1 order by c1;
+----+------+------+
| c1 | c2   | c3   |
+----+------+------+
|  1 |    1 |    1 |
|  2 |    2 |    2 |
|  3 |    3 |    3 |
|  4 |    4 |    4 |
|  5 |    5 |    5 |
|  6 |    6 |    6 |
|  7 |    7 |    7 |
|  8 |    8 |    8 |
|  9 |    9 |    9 |
| 10 |   10 |   10 |
| 11 |   11 |   11 |
| 12 |   12 |   12 |
| 13 |   13 |   13 |
| 14 |   14 |   14 |
| 15 |   15 |   15 |
| 16 |   16 |   16 |
| 17 |   17 |   17 |
| 18 |   18 |   18 |
| 19 |   19 |   19 |
| 20 |   20 |   20 |
| 21 |   21 |   21 |
| 22 |   22 |   22 |
| 23 |   23 |   23 |
| 24 |   24 |   24 |
| 25 |   25 |   25 |
| 26 |   26 |   26 |
| 27 |   27 |   27 |
| 28 |   28 |   28 |
| 29 |   29 |   29 |
| 30 |   30 |   30 |
+----+------+------+
affected rows: 30
delete from t1;
affected rows: 30
insert into t1 values (1,1,1),(2,2,2),(3,3,3),(4,4,4),(5,5,5),(6,6,6),(7,7,7),(8,8,8),(9,9,9),(10,10,10),(11,11,11),(12,12,12),(13,13,13),(14,14,14),(15,15,15) on duplicate key update c3 = c3 + 1;
affected rows: 15
info: Records: 15  Duplicates: 0  Warnings: 0
insert into t1 values (1,1,1),(2,2,2),(3,3,3),(4,4,4),(5,5,5),(6,6,6),(7,7,7),(8,8,8),(9,9,9),(10,10,10),(11,11,11),(12,12,12),(13,13,13),(14,14,14),(15,15,15) on duplicate key update c3 = c3 + 1;
affected rows: 30
info: Records: 15  Duplicates: 15  Warnings: 0
insert into t1 values (1,1,1),(2,2,2),(3,3,3),(4,4,4),(5,5,5),(6,6,6),(7,7,7),(8,8,8),(9,9,9),(10,10,10),(11,11,11),(12,12,12),(13,13,13),(14,14,14),(15,15,15),(16,16,16),(17,17,17),(18,18,18),(19,19,19),(20,20,20),(21,21,21),(22,22,22),(23,23,23),(24,24,24),(25,25,25),(26,26,26),(27,27,27),(28,28,28),(29,29,29),(30,30,30) on duplicate key update c3 = c3 + 1;
affected rows: 45
info: Records: 30  Duplicates: 15  Warnings: 0
insert into t1 values (1,1,1),(2,2,2),(3,3,3),(4,4,4),(5,5,5),(6,6,6),(7,7,7),(8,8,8),(9,9,9),(10,10,10),(11,11,11),(12,12,12),(13,13,13),(14,14,14),(15,15,15),(16,16,16),(17,17,17),(18,18,18),(19,19,19),(20,20,20),(21,21,21),(22,22,22),(23,23,23),(24,24,24),(25,25,25),(26,26,26),(27,27,27),(28,28,28),(29,29,29),(30,30,30) on duplicate key update c3 = c3 + 1;
affected rows: 60
info: Records: 30  Duplicates: 30  Warnings: 0
select * from t1 order by c1;
+----+------+------+
| c1 | c2   | c3   |
+----+------+------+
|  1 |    1 |    4 |
|  2 |    2 |    5 |
|  3 |    3 |    6 |
|  4 |    4 |    7 |
|  5 |    5 |    8 |
|  6 |    6 |    9 |
|  7 |    7 |   10 |
|  8 |    8 |   11 |
|  9 |    9 |   12 |
| 10 |   10 |   13 |
| 11 |   11 |   14 |
| 12 |   12 |   15 |
| 13 |   13 |   16 |
| 14 |   14 |   17 |
| 15 |   15 |   18 |
| 16 |   16 |   17 |
| 17 |   17 |   18 |
| 18 |   18 |   19 |
| 19 |   19 |   20 |
| 20 |   20 |   21 |
| 21 |   21 |   22 |
| 22 |   22 |   23 |
| 23 |   23 |   24 |
| 24 |   24 |   25 |
| 25 |   25 |   26 |
| 26 |   26 |   27 |
| 27 |   27 |   28 |
| 28 |   28 |   29 |
| 29 |   29 |   30 |
| 30 |   30 |   31 |
+----+------+------+
affected rows: 30
drop table t1;
affected rows: 0

## 测试分区表带unique全局索引
create table t1(c1 int primary key, c2 int, c3 int) partition by hash(c1) partitions 8;
affected rows: 0
create unique index t1_idx_01 on t1(c2) global;
affected rows: 0
replace into t1 values(1,1,1),(2,2,2),(3,2,3),(4,2,4),(5,5,5),(6,5,6),(7,7,7),(8,8,8),(9,9,9),(10,10,10),(11,10,11),(12,12,12),(13,13,13),(14,13,14),(15,13,15);
affected rows: 21
info: Records: 15  Duplicates: 6  Warnings: 0
replace into t1 values(1,1,1),(2,2,2),(1,1,1),(2,2,2),(3,3,3),(4,4,4),(5,5,5),(6,6,6),(5,5,5),(6,6,6),(7,7,7),(8,8,8),(9,9,9),(10,10,10),(11,11,11);
affected rows: 26
info: Records: 15  Duplicates: 11  Warnings: 0
replace into t1 values(1,1,1),(2,2,2),(3,3,3),(4,4,4),(5,5,5),(6,6,6),(7,7,7),(8,8,8),(9,9,9),(10,10,10),(11,11,11),(12,12,12),(13,13,13),(14,14,14),(15,15,15),(16,16,16),(17,17,17),(18,18,18),(19,19,19),(20,20,20),(21,21,21),(22,22,22),(23,23,23),(24,24,24),(25,25,25),(26,26,26),(27,27,27),(28,28,28),(29,29,29),(30,30,30);
affected rows: 43
info: Records: 30  Duplicates: 13  Warnings: 0
replace into t1 values(1,1,1),(2,2,2),(3,3,3),(4,4,4),(5,5,5),(6,6,6),(7,7,7),(8,8,8),(9,9,9),(10,10,10),(11,11,11),(12,12,12),(13,13,13),(14,14,14),(15,15,15),(16,16,16),(17,17,17),(18,18,18),(19,19,19),(20,20,20),(21,21,21),(22,22,22),(23,23,23),(24,24,24),(25,25,25),(26,26,26),(27,27,27),(28,28,28),(29,29,29),(30,30,30);
affected rows: 60
info: Records: 30  Duplicates: 30  Warnings: 0
select * from t1 order by c1;
+----+------+------+
| c1 | c2   | c3   |
+----+------+------+
|  1 |    1 |    1 |
|  2 |    2 |    2 |
|  3 |    3 |    3 |
|  4 |    4 |    4 |
|  5 |    5 |    5 |
|  6 |    6 |    6 |
|  7 |    7 |    7 |
|  8 |    8 |    8 |
|  9 |    9 |    9 |
| 10 |   10 |   10 |
| 11 |   11 |   11 |
| 12 |   12 |   12 |
| 13 |   13 |   13 |
| 14 |   14 |   14 |
| 15 |   15 |   15 |
| 16 |   16 |   16 |
| 17 |   17 |   17 |
| 18 |   18 |   18 |
| 19 |   19 |   19 |
| 20 |   20 |   20 |
| 21 |   21 |   21 |
| 22 |   22 |   22 |
| 23 |   23 |   23 |
| 24 |   24 |   24 |
| 25 |   25 |   25 |
| 26 |   26 |   26 |
| 27 |   27 |   27 |
| 28 |   28 |   28 |
| 29 |   29 |   29 |
| 30 |   30 |   30 |
+----+------+------+
affected rows: 30
delete from t1;
affected rows: 30
insert into t1 values (1,1,1),(2,2,2),(3,3,3),(4,4,4),(5,5,5),(6,6,6),(7,7,7),(8,8,8),(9,9,9),(10,10,10),(11,11,11),(12,12,12),(13,13,13),(14,14,14),(15,15,15) on duplicate key update c3 = c3 + 1;
affected rows: 15
info: Records: 15  Duplicates: 0  Warnings: 0
insert into t1 values (1,1,1),(2,2,2),(3,3,3),(4,4,4),(5,5,5),(6,6,6),(7,7,7),(8,8,8),(9,9,9),(10,10,10),(11,11,11),(12,12,12),(13,13,13),(14,14,14),(15,15,15) on duplicate key update c3 = c3 + 1;
affected rows: 30
info: Records: 15  Duplicates: 15  Warnings: 0
insert into t1 values (1,1,1),(2,2,2),(3,3,3),(4,4,4),(5,5,5),(6,6,6),(7,7,7),(8,8,8),(9,9,9),(10,10,10),(11,11,11),(12,12,12),(13,13,13),(14,14,14),(15,15,15),(16,16,16),(17,17,17),(18,18,18),(19,19,19),(20,20,20),(21,21,21),(22,22,22),(23,23,23),(24,24,24),(25,25,25),(26,26,26),(27,27,27),(28,28,28),(29,29,29),(30,30,30) on duplicate key update c3 = c3 + 1;
affected rows: 45
info: Records: 30  Duplicates: 15  Warnings: 0
insert into t1 values (1,1,1),(2,2,2),(3,3,3),(4,4,4),(5,5,5),(6,6,6),(7,7,7),(8,8,8),(9,9,9),(10,10,10),(11,11,11),(12,12,12),(13,13,13),(14,14,14),(15,15,15),(16,16,16),(17,17,17),(18,18,18),(19,19,19),(20,20,20),(21,21,21),(22,22,22),(23,23,23),(24,24,24),(25,25,25),(26,26,26),(27,27,27),(28,28,28),(29,29,29),(30,30,30) on duplicate key update c3 = c3 + 1;
affected rows: 60
info: Records: 30  Duplicates: 30  Warnings: 0
select * from t1 order by c1;
+----+------+------+
| c1 | c2   | c3   |
+----+------+------+
|  1 |    1 |    4 |
|  2 |    2 |    5 |
|  3 |    3 |    6 |
|  4 |    4 |    7 |
|  5 |    5 |    8 |
|  6 |    6 |    9 |
|  7 |    7 |   10 |
|  8 |    8 |   11 |
|  9 |    9 |   12 |
| 10 |   10 |   13 |
| 11 |   11 |   14 |
| 12 |   12 |   15 |
| 13 |   13 |   16 |
| 14 |   14 |   17 |
| 15 |   15 |   18 |
| 16 |   16 |   17 |
| 17 |   17 |   18 |
| 18 |   18 |   19 |
| 19 |   19 |   20 |
| 20 |   20 |   21 |
| 21 |   21 |   22 |
| 22 |   22 |   23 |
| 23 |   23 |   24 |
| 24 |   24 |   25 |
| 25 |   25 |   26 |
| 26 |   26 |   27 |
| 27 |   27 |   28 |
| 28 |   28 |   29 |
| 29 |   29 |   30 |
| 30 |   30 |   31 |
+----+------+------+
affected rows: 30
drop table t1;
affected rows: 0

create table t2(c1 int, c2 int, c3 int, c4 int, c5 int, primary key(c1, c2)) partition by hash(c1) partitions 4;
affected rows: 0
create index t2_idx_01 on t2(c3) partition by hash(c3) partitions 6 ;
affected rows: 0
create index t2_idx_02 on t2(c4) global ;
affected rows: 0
create unique index t2_idx_03 on t2(c5, c1) local ;
affected rows: 0
insert into t2 values(1,1,1,1,1),(2,2,2,2,2),(3,3,3,3,3),(4,4,4,4,4),(5,5,5,5,5),(6,6,6,6,6),(7,7,7,7,7),(8,8,8,8,8) on duplicate key update c3 = c3 +100;
affected rows: 8
info: Records: 8  Duplicates: 0  Warnings: 0
insert into t2 values(1,1,1,1,1),(2,2,2,2,2),(3,3,3,3,3),(4,4,4,4,4),(5,5,5,5,5),(6,6,6,6,6),(7,7,7,7,7),(8,8,8,8,8) on duplicate key update c3 = c3 +100;
affected rows: 16
info: Records: 8  Duplicates: 8  Warnings: 0
insert into t2 values(1,1,1,1,1),(2,2,2,2,2),(3,3,3,3,3),(4,4,4,4,4),(5,5,5,5,5),(6,6,6,6,6),(7,7,7,7,7),(8,8,8,8,8) on duplicate key update c3 = c3 +100;
affected rows: 16
info: Records: 8  Duplicates: 8  Warnings: 0
select * from t2 order by c1;
+----+----+------+------+------+
| c1 | c2 | c3   | c4   | c5   |
+----+----+------+------+------+
|  1 |  1 |  201 |    1 |    1 |
|  2 |  2 |  202 |    2 |    2 |
|  3 |  3 |  203 |    3 |    3 |
|  4 |  4 |  204 |    4 |    4 |
|  5 |  5 |  205 |    5 |    5 |
|  6 |  6 |  206 |    6 |    6 |
|  7 |  7 |  207 |    7 |    7 |
|  8 |  8 |  208 |    8 |    8 |
+----+----+------+------+------+
affected rows: 8
replace into t2 values(1,1,1,1,1),(2,2,2,2,2),(3,3,3,3,3),(4,4,4,4,4),(5,5,5,5,5),(6,6,6,6,6),(7,7,7,7,7),(8,8,8,8,8);
affected rows: 16
info: Records: 8  Duplicates: 8  Warnings: 0
select * from t2 order by c1;
+----+----+------+------+------+
| c1 | c2 | c3   | c4   | c5   |
+----+----+------+------+------+
|  1 |  1 |    1 |    1 |    1 |
|  2 |  2 |    2 |    2 |    2 |
|  3 |  3 |    3 |    3 |    3 |
|  4 |  4 |    4 |    4 |    4 |
|  5 |  5 |    5 |    5 |    5 |
|  6 |  6 |    6 |    6 |    6 |
|  7 |  7 |    7 |    7 |    7 |
|  8 |  8 |    8 |    8 |    8 |
+----+----+------+------+------+
affected rows: 8
drop table t2;
affected rows: 0

create table t5 (c1 int primary key, c2 int) partition by hash(c1) (partition `p0`, partition `p1`, partition `p2`);
affected rows: 0
create unique index t5_idx on t5(c2) global;
affected rows: 0
insert into t5 values(1, 1), (2, 2), (3, 3);
affected rows: 3
info: Records: 3  Duplicates: 0  Warnings: 0
replace into t5 values(6, 1);
affected rows: 2
replace into t5 values(9, 2);
affected rows: 2
replace into t5 values(12, 3);
affected rows: 2
select * from t5;
+----+------+
| c1 | c2   |
+----+------+
|  6 |    1 |
|  9 |    2 |
| 12 |    3 |
+----+------+
affected rows: 3
delete from t5;
affected rows: 3
insert into t5 values(1, 1), (2, 2), (3, 3);
affected rows: 3
info: Records: 3  Duplicates: 0  Warnings: 0
insert into t5 values(6, 1) on duplicate key update c1 = values(c1);
affected rows: 2
insert into t5 values(9, 2) on duplicate key update c1 = values(c1);
affected rows: 2
insert into t5 values(15, 3) on duplicate key update c1 = values(c1);
affected rows: 2
select * from t5;
+----+------+
| c1 | c2   |
+----+------+
|  6 |    1 |
|  9 |    2 |
| 15 |    3 |
+----+------+
affected rows: 3
drop table t5;
affected rows: 0

alter system set_tp tp_no = 401, error_code = 5, frequency = 0;
affected rows: 0
alter system set_tp tp_no = 402, error_code = 5, frequency = 0;
affected rows: 0
