drop table if exists t1,t2,t3,t4;
result_format: 4
create table t1(c1 int, c2 int unique, c3 int, c4 int);
affected rows: 0
insert into t1 values(1,1,1,1),(2,2,2,2),(3,3,3,3),(4,4,4,4),(5,5,5,5);
affected rows: 5
info: Records: 5  Duplicates: 0  Warnings: 0
replace into t1 values(11,1,11,11),(12,12,12,12),(13,3,13,13),(14,4,14,14),(6,6,6,6);
affected rows: 8
info: Records: 5  Duplicates: 3  Warnings: 0
select * from t1;
+------+------+------+------+
| c1   | c2   | c3   | c4   |
+------+------+------+------+
|    2 |    2 |    2 |    2 |
|    5 |    5 |    5 |    5 |
|   11 |    1 |   11 |   11 |
|   12 |   12 |   12 |   12 |
|   13 |    3 |   13 |   13 |
|   14 |    4 |   14 |   14 |
|    6 |    6 |    6 |    6 |
+------+------+------+------+
affected rows: 7
replace t1 values(11,1,111,111),(12,12,122,122),(13,3,133,133),(14,4,144,144),(166,6,166,166);
affected rows: 10
info: Records: 5  Duplicates: 5  Warnings: 0
select * from t1;
+------+------+------+------+
| c1   | c2   | c3   | c4   |
+------+------+------+------+
|    2 |    2 |    2 |    2 |
|    5 |    5 |    5 |    5 |
|   11 |    1 |  111 |  111 |
|   12 |   12 |  122 |  122 |
|   13 |    3 |  133 |  133 |
|   14 |    4 |  144 |  144 |
|  166 |    6 |  166 |  166 |
+------+------+------+------+
affected rows: 7
insert into t1 values(1,1,1,1),(2,2,2,2),(10,10,10,10),(3,3,3,3),(20,20,20,20),(4,4,4,4),(15,15,15,15),(5,5,5,5),(6,6,6,6) on duplicate key update c1 = c1 + 1, c3 = c3 + 1;
affected rows: 15
info: Records: 9  Duplicates: 6  Warnings: 0
select * from t1;
+------+------+------+------+
| c1   | c2   | c3   | c4   |
+------+------+------+------+
|    3 |    2 |    3 |    2 |
|    6 |    5 |    6 |    5 |
|   12 |    1 |  112 |  111 |
|   12 |   12 |  122 |  122 |
|   14 |    3 |  134 |  133 |
|   15 |    4 |  145 |  144 |
|  167 |    6 |  167 |  166 |
|   10 |   10 |   10 |   10 |
|   20 |   20 |   20 |   20 |
|   15 |   15 |   15 |   15 |
+------+------+------+------+
affected rows: 10
select hit_count, is_batched_multi_stmt, statement, query_sql from oceanbase.GV$OB_PLAN_CACHE_PLAN_STAT where statement like 'replace% t1 values%'order by hit_count;
+-----------+-----------------------+---------------------------------+-----------------------------------------------------------------------------------------------+
| hit_count | is_batched_multi_stmt | statement                       | query_sql                                                                                     |
+-----------+-----------------------+---------------------------------+-----------------------------------------------------------------------------------------------+
|         0 |                     1 | replace into t1 values(?,?,?,?) | replace into t1 values(11,1,11,11),(12,12,12,12),(13,3,13,13),(14,4,14,14),(6,6,6,6)          |
|         0 |                     1 | replace t1 values(?,?,?,?)      | replace t1 values(11,1,111,111),(12,12,122,122),(13,3,133,133),(14,4,144,144),(166,6,166,166) |
+-----------+-----------------------+---------------------------------+-----------------------------------------------------------------------------------------------+
affected rows: 2
select hit_count, is_batched_multi_stmt, statement, query_sql from oceanbase.GV$OB_PLAN_CACHE_PLAN_STAT where statement like 'insert% t1 values% on duplicate key %'order by hit_count;
+-----------+-----------------------+---------------------------------------------------------------------------------+-----------------------------------------------------------------------------------------------------------------------------------------------------------------------------+
| hit_count | is_batched_multi_stmt | statement                                                                       | query_sql                                                                                                                                                                   |
+-----------+-----------------------+---------------------------------------------------------------------------------+-----------------------------------------------------------------------------------------------------------------------------------------------------------------------------+
|         0 |                     1 | insert into t1 values(?,?,?,?) on duplicate key update c1 = c1 + ?, c3 = c3 + ? | insert into t1 values(1,1,1,1),(2,2,2,2),(10,10,10,10),(3,3,3,3),(20,20,20,20),(4,4,4,4),(15,15,15,15),(5,5,5,5),(6,6,6,6) on duplicate key update c1 = c1 + 1, c3 = c3 + 1 |
+-----------+-----------------------+---------------------------------------------------------------------------------+-----------------------------------------------------------------------------------------------------------------------------------------------------------------------------+
affected rows: 1
drop table t1;
affected rows: 0

create table t2(c1 varchar(10), c2 date, c3 int, c4 varchar(20), primary key(c1, c2)) partition by key(c1) partitions 4;
affected rows: 0
insert t2 values('1', '2020-01-01',1,'1-1'),('2', '2020-01-02',2,'1-2') ,('3', '2020-01-03',3,'1-3') ,('4', '2020-01-04',4,'1-4') ,('5', '2020-01-05',5,'1-5');
affected rows: 5
info: Records: 5  Duplicates: 0  Warnings: 0
replace t2 values('1', '2020-01-01',1,'11'),('2', '2020-01-02',2,'22') ,('3', '2020-01-03',3,'33') ,('4', '2020-01-04',4,'44') ,('5', '2020-01-05',5,'55');
affected rows: 10
info: Records: 5  Duplicates: 5  Warnings: 0
select * from t2 order by c1;
+----+------------+------+------+
| c1 | c2         | c3   | c4   |
+----+------------+------+------+
| 1  | 2020-01-01 |    1 | 11   |
| 2  | 2020-01-02 |    2 | 22   |
| 3  | 2020-01-03 |    3 | 33   |
| 4  | 2020-01-04 |    4 | 44   |
| 5  | 2020-01-05 |    5 | 55   |
+----+------------+------+------+
affected rows: 5
insert t2 values('1', '2020-01-01',11,'1-1'),('2', '2020-01-02',22,'1-2'),('2', '2020-01-02',23,'1-3'),('2', '2020-01-02',24,'2-3') ,('3', '2020-01-03',33,'1-3'),('33', '2020-01-13',33,'1-3') ,('4', '2020-01-04',44,'1-4') ,('5', '2020-01-05',55,'1-5') on duplicate key update c3 = values(c3) + 1, c4 = concat(c4, '-1');
affected rows: 15
info: Records: 8  Duplicates: 7  Warnings: 0
select * from t2 order by c1;
+----+------------+------+----------+
| c1 | c2         | c3   | c4       |
+----+------------+------+----------+
| 1  | 2020-01-01 |   12 | 11-1     |
| 2  | 2020-01-02 |   25 | 22-1-1-1 |
| 3  | 2020-01-03 |   34 | 33-1     |
| 33 | 2020-01-13 |   33 | 1-3      |
| 4  | 2020-01-04 |   45 | 44-1     |
| 5  | 2020-01-05 |   56 | 55-1     |
+----+------------+------+----------+
affected rows: 6

delete from t2;
affected rows: 6
create unique index t2_idx_01 on t2(c3) global;
affected rows: 0
insert t2 values('1', '2020-01-01',1,'1-1'),('2', '2020-01-02',2,'1-2') ,('3', '2020-01-03',3,'1-3') ,('4', '2020-01-04',4,'1-4') ,('5', '2020-01-05',5,'1-5');
affected rows: 5
info: Records: 5  Duplicates: 0  Warnings: 0
replace into t2 values('11', '2020-01-01',1,'1-1'),('111', '2020-01-01',1,'1+1'),('112', '2020-01-01',1,'1*1'),('113', '2020-01-01',1,'1o1'),('22', '2020-01-02',2,'1-2') ,('33', '2020-01-03',3,'1-3'),('133', '2020-01-03',13,'1-5') ,('44', '2020-01-04',4,'1-4') ,('55', '2020-01-05',5,'1-5');
affected rows: 17
info: Records: 9  Duplicates: 8  Warnings: 0
select * from t2 order by c1;
+-----+------------+------+------+
| c1  | c2         | c3   | c4   |
+-----+------------+------+------+
| 113 | 2020-01-01 |    1 | 1o1  |
| 133 | 2020-01-03 |   13 | 1-5  |
| 22  | 2020-01-02 |    2 | 1-2  |
| 33  | 2020-01-03 |    3 | 1-3  |
| 44  | 2020-01-04 |    4 | 1-4  |
| 55  | 2020-01-05 |    5 | 1-5  |
+-----+------------+------+------+
affected rows: 6
insert into t2 values('11', '2020-01-01',1,'1-1'),('111', '2020-01-01',1,'1+1'),('112', '2020-01-01',2,'1*1'),('113', '2020-01-01',3,'1o1'),('22', '2020-01-02',2,'1-2') ,('33', '2020-01-03',3,'1-3'),('133', '2020-01-03',13,'1-5') ,('44', '2020-01-04',4,'1-4') ,('55', '2020-01-05',5,'1-5') on duplicate key update c3 = c3 + 100;
affected rows: 17
info: Records: 9  Duplicates: 8  Warnings: 0
select * from t2 order by c1;
+-----+------------+------+------+
| c1  | c2         | c3   | c4   |
+-----+------------+------+------+
| 111 | 2020-01-01 |    1 | 1+1  |
| 113 | 2020-01-01 |  201 | 1o1  |
| 133 | 2020-01-03 |  113 | 1-5  |
| 22  | 2020-01-02 |  202 | 1-2  |
| 33  | 2020-01-03 |  103 | 1-3  |
| 44  | 2020-01-04 |  104 | 1-4  |
| 55  | 2020-01-05 |  105 | 1-5  |
+-----+------------+------+------+
affected rows: 7
select hit_count, is_batched_multi_stmt, statement, query_sql from oceanbase.GV$OB_PLAN_CACHE_PLAN_STAT where statement like 'replace% t2 values%'order by hit_count;
+-----------+-----------------------+----------------------------------+----------------------------------------------------------------------------------------------------------------------------------------------------------------------------------------------------------------------------------------------------------------------------------------------------+
| hit_count | is_batched_multi_stmt | statement                        | query_sql                                                                                                                                                                                                                                                                                          |
+-----------+-----------------------+----------------------------------+----------------------------------------------------------------------------------------------------------------------------------------------------------------------------------------------------------------------------------------------------------------------------------------------------+
|         0 |                     1 | replace t2 values(?, ?,?,?)      | replace t2 values('1', '2020-01-01',1,'11'),('2', '2020-01-02',2,'22') ,('3', '2020-01-03',3,'33') ,('4', '2020-01-04',4,'44') ,('5', '2020-01-05',5,'55')                                                                                                                                         |
|         0 |                     1 | replace into t2 values(?, ?,?,?) | replace into t2 values('11', '2020-01-01',1,'1-1'),('111', '2020-01-01',1,'1+1'),('112', '2020-01-01',1,'1*1'),('113', '2020-01-01',1,'1o1'),('22', '2020-01-02',2,'1-2') ,('33', '2020-01-03',3,'1-3'),('133', '2020-01-03',13,'1-5') ,('44', '2020-01-04',4,'1-4') ,('55', '2020-01-05',5,'1-5') |
+-----------+-----------------------+----------------------------------+----------------------------------------------------------------------------------------------------------------------------------------------------------------------------------------------------------------------------------------------------------------------------------------------------+
affected rows: 2
select hit_count, is_batched_multi_stmt, statement, query_sql from oceanbase.GV$OB_PLAN_CACHE_PLAN_STAT where statement like 'insert% t2 values% on duplicate key %'order by hit_count;
+-----------+-----------------------+----------------------------------------------------------------------------------------------------------------------------------------------------------------------------+-----------------------------------------------------------------------------------------------------------------------------------------------------------------------------------------------------------------------------------------------------------------------------------------------------------------------------------------+
| hit_count | is_batched_multi_stmt | statement                                                                                                                                                                  | query_sql                                                                                                                                                                                                                                                                                                                               |
+-----------+-----------------------+----------------------------------------------------------------------------------------------------------------------------------------------------------------------------+-----------------------------------------------------------------------------------------------------------------------------------------------------------------------------------------------------------------------------------------------------------------------------------------------------------------------------------------+
|         0 |                     0 | insert t2 values(?, ?,?,?),(?, ?,?,?),(?, ?,?,?),(?, ?,?,?) ,(?, ?,?,?),(?, ?,?,?) ,(?, ?,?,?) ,(?, ?,?,?) on duplicate key update c3 = values(c3) + ?, c4 = concat(c4, ?) | insert t2 values('1', '2020-01-01',11,'1-1'),('2', '2020-01-02',22,'1-2'),('2', '2020-01-02',23,'1-3'),('2', '2020-01-02',24,'2-3') ,('3', '2020-01-03',33,'1-3'),('33', '2020-01-13',33,'1-3') ,('4', '2020-01-04',44,'1-4') ,('5', '2020-01-05',55,'1-5') on duplicate key update c3 = values(c3) + 1, c4 = concat(c4, '-1')          |
|         0 |                     1 | insert into t2 values(?, ?,?,?) on duplicate key update c3 = c3 + ?                                                                                                        | insert into t2 values('11', '2020-01-01',1,'1-1'),('111', '2020-01-01',1,'1+1'),('112', '2020-01-01',2,'1*1'),('113', '2020-01-01',3,'1o1'),('22', '2020-01-02',2,'1-2') ,('33', '2020-01-03',3,'1-3'),('133', '2020-01-03',13,'1-5') ,('44', '2020-01-04',4,'1-4') ,('55', '2020-01-05',5,'1-5') on duplicate key update c3 = c3 + 100 |
+-----------+-----------------------+----------------------------------------------------------------------------------------------------------------------------------------------------------------------------+-----------------------------------------------------------------------------------------------------------------------------------------------------------------------------------------------------------------------------------------------------------------------------------------------------------------------------------------+
affected rows: 2
drop table t2;
affected rows: 0

create table t3(c1 int primary key, c2 int);
affected rows: 0
REPLACE into t3 values(1,(1)),(2,(2)),(3,(3));
affected rows: 3
info: Records: 3  Duplicates: 0  Warnings: 0
REPLACE into t3 values(1,(1)),(2,(2)),(3,(3)),(4,(4)),(4,(5)),(5,(5));
affected rows: 7
info: Records: 6  Duplicates: 1  Warnings: 0
select * from t3;
+----+------+
| c1 | c2   |
+----+------+
|  1 |    1 |
|  2 |    2 |
|  3 |    3 |
|  4 |    5 |
|  5 |    5 |
+----+------+
affected rows: 5
insert into t3 values(1,(1)),(2,(2)),(3,(3)),(4,(4)),(4,(5)) On DuplicaTe KeY UpDaTe c2  =c2 +1;
affected rows: 10
info: Records: 5  Duplicates: 5  Warnings: 0
select * from t3;
+----+------+
| c1 | c2   |
+----+------+
|  1 |    2 |
|  2 |    3 |
|  3 |    4 |
|  4 |    7 |
|  5 |    5 |
+----+------+
affected rows: 5
insert into t3 values(1,(1)),(2,(2)),(3,(3)),(4,(4)),(4,(5)) On DplicaTe KeY UpDaTe c2  =c2 +1;
ERROR 42000: You have an error in your SQL syntax; check the manual that corresponds to your OceanBase version for the right syntax to use near 'DplicaTe KeY UpDaTe c2  =c2 +1' at line 1
insert into values(1,1),(2,2),(3,3);
ERROR 42000: You have an error in your SQL syntax; check the manual that corresponds to your OceanBase version for the right syntax to use near 'values(1,1);' at line 1
insert into values(1,1),(2,2),(3,3) on duplicate key update c2 = c2 + 1;
ERROR 42000: You have an error in your SQL syntax; check the manual that corresponds to your OceanBase version for the right syntax to use near 'values(1,1) on duplicate key update c2 = c2 + 1;' at line 1
drop table t3;
affected rows: 0

create table t4(c1 int, c2 decimal(10,5), c3 int, primary key(c1, c2));
affected rows: 0
replace into t4 values(1,1.11,1),(2,2.222,2),(3,3.3,3),(4,4.4444,4);
affected rows: 4
info: Records: 4  Duplicates: 0  Warnings: 0
replace into t4 values(1,1.11,1),(2,2.22222,2),(3,3.3,3),(4,4.4444,4);
affected rows: 4
info: Records: 4  Duplicates: 0  Warnings: 0
select * from t4;
+----+---------+------+
| c1 | c2      | c3   |
+----+---------+------+
|  1 | 1.11000 |    1 |
|  2 | 2.22200 |    2 |
|  2 | 2.22222 |    2 |
|  3 | 3.30000 |    3 |
|  4 | 4.44440 |    4 |
+----+---------+------+
affected rows: 5
insert into t4 values(1,1.11,1),(3,3.3,3),(2,2.22,2),(4,4.4444,5) on duplicate key update c3 = c3 + 1;
affected rows: 7
info: Records: 4  Duplicates: 3  Warnings: 0
select * from t4;
+----+---------+------+
| c1 | c2      | c3   |
+----+---------+------+
|  1 | 1.11000 |    2 |
|  2 | 2.22000 |    2 |
|  2 | 2.22200 |    2 |
|  2 | 2.22222 |    2 |
|  3 | 3.30000 |    4 |
|  4 | 4.44440 |    5 |
+----+---------+------+
affected rows: 6
insert into t4 values(1,1.11,1),(3,3.3,3),(2,2.22,2),(4,4.4444,5) on duplicate key update c3 = c3 + 1;
affected rows: 8
info: Records: 4  Duplicates: 4  Warnings: 0
select * from t4;
+----+---------+------+
| c1 | c2      | c3   |
+----+---------+------+
|  1 | 1.11000 |    3 |
|  2 | 2.22000 |    3 |
|  2 | 2.22200 |    2 |
|  2 | 2.22222 |    2 |
|  3 | 3.30000 |    5 |
|  4 | 4.44440 |    6 |
+----+---------+------+
affected rows: 6
select hit_count, is_batched_multi_stmt, statement, query_sql from oceanbase.GV$OB_PLAN_CACHE_PLAN_STAT where statement like 'replace% t4 values%'order by hit_count;
+-----------+-----------------------+-------------------------------+---------------------------------------------------------------------+
| hit_count | is_batched_multi_stmt | statement                     | query_sql                                                           |
+-----------+-----------------------+-------------------------------+---------------------------------------------------------------------+
|         1 |                     1 | replace into t4 values(?,?,?) | replace into t4 values(1,1.11,1),(2,2.222,2),(3,3.3,3),(4,4.4444,4) |
+-----------+-----------------------+-------------------------------+---------------------------------------------------------------------+
affected rows: 1
select hit_count, is_batched_multi_stmt, statement, query_sql from oceanbase.GV$OB_PLAN_CACHE_PLAN_STAT where statement like 'insert% t4 values% on duplicate key %'order by hit_count;
+-----------+-----------------------+------------------------------------------------------------------+-------------------------------------------------------------------------------------------------------+
| hit_count | is_batched_multi_stmt | statement                                                        | query_sql                                                                                             |
+-----------+-----------------------+------------------------------------------------------------------+-------------------------------------------------------------------------------------------------------+
|         1 |                     1 | insert into t4 values(?,?,?) on duplicate key update c3 = c3 + ? | insert into t4 values(1,1.11,1),(3,3.3,3),(2,2.22,2),(4,4.4444,5) on duplicate key update c3 = c3 + 1 |
+-----------+-----------------------+------------------------------------------------------------------+-------------------------------------------------------------------------------------------------------+
affected rows: 1
drop table t4;
affected rows: 0
set global ob_plan_cache_percentage = 5;
affected rows: 0
## 默认暂时还是关闭batch优化的开关
alter system set ob_enable_batched_multi_statement=false;
affected rows: 0
