result_format: 4
drop user 'zc_subquery_mysql'@'%';
create user 'zc_subquery_mysql'@'%' IDENTIFIED BY 'zc_subquery_mysql';
grant all on *.* to 'zc_subquery_mysql'@'%' WITH GRANT OPTION;


SET SESSION sql_mode ='ALLOW_INVALID_DATES';
##游标##
drop table if EXISTS ff01;
Warnings:
Note	1051	Unknown table 'test.ff01'
CREATE TABLE ff01(id int PRIMARY KEY, a date,b datetime,c timestamp);
INSERT INTO ff01 VALUES (1,'2001-2-29','2001-2-29','2001-2-29'),
                        (2,'2002/2/30','2002/2/30','2002/2/30'),
                        (3,'2003:2:31','2003:2:31','2003:2:31'),
                        (4,'2004431','2004431','2004431'),
                        (5,2005631,2005631,2005631),
                        (6,'2007-11-31','2007-11-31','2007-11-31'),
                        (7,'1900-2-29','1900-2-29','1900-2-29');
drop PROCEDURE IF EXISTS tcur;
CREATE PROCEDURE tcur()
BEGIN
	DECLARE a1 datetime;
	DECLARE b1 date;
	DECLARE c1 timestamp;
	DECLARE cur01 CURSOR FOR SELECT a,b,c FROM ff01;
	OPEN cur01;
	FETCH cur01 INTO a1,b1,c1;
	SELECT a1,b1,c1;
	CLOSE cur01;
END;
//
CALL tcur();
+---------------------+------------+---------------------+
| a1                  | b1         | c1                  |
+---------------------+------------+---------------------+
| 2001-02-29 00:00:00 | 2001-02-29 | 0000-00-00 00:00:00 |
+---------------------+------------+---------------------+
drop PROCEDURE IF EXISTS tcur;
CREATE PROCEDURE tcur()
BEGIN
	DECLARE a1 datetime;
	DECLARE b1 date;
	DECLARE c1 timestamp;
	DECLARE done int;
	DECLARE cur01 CURSOR FOR SELECT a,b,c FROM ff01;
	DECLARE CONTINUE HANDLER FOR NOT FOUND SET done=1;
	OPEN cur01;
	posloop:LOOP
		IF done=1 THEN LEAVE posloop;
	    END IF;
		FETCH cur01 INTO a1,b1,c1;
		SELECT a1,b1,c1;
	END LOOP posloop;
	CLOSE cur01;
END;
//
CALL tcur();
+---------------------+------------+---------------------+
| a1                  | b1         | c1                  |
+---------------------+------------+---------------------+
+---------------------+------------+---------------------+
| a1                  | b1         | c1                  |
+---------------------+------------+---------------------+
+---------------------+------------+---------------------+
| a1                  | b1         | c1                  |
+---------------------+------------+---------------------+
+---------------------+------------+---------------------+
| a1                  | b1         | c1                  |
+---------------------+------------+---------------------+
+---------------------+------------+---------------------+
| a1                  | b1         | c1                  |
+---------------------+------------+---------------------+
+---------------------+------------+---------------------+
| a1                  | b1         | c1                  |
+---------------------+------------+---------------------+
+---------------------+------------+---------------------+
| a1                  | b1         | c1                  |
+---------------------+------------+---------------------+
+---------------------+------------+---------------------+
| a1                  | b1         | c1                  |
+---------------------+------------+---------------------+
| 2001-02-29 00:00:00 | 2001-02-29 | 0000-00-00 00:00:00 |
| 2002-02-30 00:00:00 | 2002-02-30 | 0000-00-00 00:00:00 |
| 2003-02-31 00:00:00 | 2003-02-31 | 0000-00-00 00:00:00 |
| 0000-00-00 00:00:00 | 0000-00-00 | 0000-00-00 00:00:00 |
| 0000-00-00 00:00:00 | 0000-00-00 | 0000-00-00 00:00:00 |
| 2007-11-31 00:00:00 | 2007-11-31 | 0000-00-00 00:00:00 |
| 1900-02-29 00:00:00 | 1900-02-29 | 0000-00-00 00:00:00 |
| 1900-02-29 00:00:00 | 1900-02-29 | 0000-00-00 00:00:00 |
+---------------------+------------+---------------------+
+---------------------+------------+---------------------+
+---------------------+------------+---------------------+
+---------------------+------------+---------------------+
+---------------------+------------+---------------------+
+---------------------+------------+---------------------+
+---------------------+------------+---------------------+
+---------------------+------------+---------------------+
drop PROCEDURE IF EXISTS tcur;
CREATE PROCEDURE tcur()
BEGIN
	DECLARE a1 datetime ;
	DECLARE b1 date ;
	DECLARE c1 timestamp ;
	DECLARE a2 varchar(10) ;
	DECLARE b2 varchar(10) ;
	DECLARE c2 varchar(10) ;
	DECLARE done int;
	DECLARE id int;
	DECLARE cur01 CURSOR FOR SELECT a1,b1,c1;
	DECLARE CONTINUE HANDLER FOR NOT FOUND SET done=1;
    SET a1 = '2010-2-29';
    SET b1 = '2011-2-30';
    SET c1 = '2012-2-31';
    SET id = 8;
	OPEN cur01;
	posloop:LOOP
		IF done=1 THEN LEAVE posloop;
	    END IF;
	   	FETCH cur01 INTO a2,b2,c2;
		SELECT a2,b2,c2;
		INSERT INTO ff01 VALUES(id,a2,b2,c2);
		SET id = id+1;
	END LOOP posloop;
	CLOSE cur01;
END;
//
CALL tcur();
+------------+------------+------------+
| a2         | b2         | c2         |
+------------+------------+------------+
+------------+------------+------------+
| a2         | b2         | c2         |
+------------+------------+------------+
| 2010-02-29 | 2011-02-30 | 0000-00-00 |
| 2010-02-29 | 2011-02-30 | 0000-00-00 |
+------------+------------+------------+
+------------+------------+------------+
##触发器##
DROP TABLE if EXISTS ff02;
CREATE table ff02(a1 date,b1 datetime,c1 timestamp);
drop TRIGGER IF EXISTS tri01;
Warnings:
Note	1360	Trigger does not exist
CREATE TRIGGER tri01 AFTER INSERT ON ff01 FOR EACH ROW
	INSERT into ff02 VALUES('1990-2-29','1991-2-30','1992-2-30');
INSERT into ff01(id) VALUES(10);
SELECT * from ff02;
+------------+---------------------+---------------------+
| a1         | b1                  | c1                  |
+------------+---------------------+---------------------+
| 1990-02-29 | 1991-02-30 00:00:00 | 0000-00-00 00:00:00 |
+------------+---------------------+---------------------+
drop TRIGGER IF EXISTS tri01;
CREATE TRIGGER tri01 BEFORE UPDATE ON ff01 FOR EACH ROW
BEGIN
	IF day(NEW.a)<=29 || day(NEW.b)<=29 THEN
	 SET NEW.a = CONCAT(YEAR(NEW.a),'-',MONTH(NEW.a),'-',31);
	 SET NEW.b = CONCAT(YEAR(NEW.b),'-',MONTH(NEW.b),'-',31);
	END IF;
END;
//
UPDATE ff01 set a = '1992.2.31' WHERE id=7;
SELECT * from ff01;
+----+------------+---------------------+---------------------+
| id | a          | b                   | c                   |
+----+------------+---------------------+---------------------+
|  1 | 2001-02-29 | 2001-02-29 00:00:00 | 0000-00-00 00:00:00 |
|  2 | 2002-02-30 | 2002-02-30 00:00:00 | 0000-00-00 00:00:00 |
|  3 | 2003-02-31 | 2003-02-31 00:00:00 | 0000-00-00 00:00:00 |
|  4 | 0000-00-00 | 0000-00-00 00:00:00 | 0000-00-00 00:00:00 |
|  5 | 0000-00-00 | 0000-00-00 00:00:00 | 0000-00-00 00:00:00 |
|  6 | 2007-11-31 | 2007-11-31 00:00:00 | 0000-00-00 00:00:00 |
|  7 | 1992-02-31 | 1900-02-31 00:00:00 | 0000-00-00 00:00:00 |
|  8 | 2010-02-29 | 2011-02-30 00:00:00 | 0000-00-00 00:00:00 |
|  9 | 2010-02-29 | 2011-02-30 00:00:00 | 0000-00-00 00:00:00 |
| 10 | NULL       | NULL                | NULL                |
+----+------------+---------------------+---------------------+
drop TRIGGER IF EXISTS tri01;
CREATE TRIGGER tri01 AFTER UPDATE ON ff01 FOR EACH ROW
BEGIN
	DECLARE a date;
	DECLARE b datetime;
	DECLARE c timestamp;
	SET a = '1990-2-29';
	SET b = '1991-2-30';
	SET c = '92.2.31';
	INSERT into ff02 VALUES(a,b,c);
END;
//
UPDATE ff01 set a = '1990.2.29' WHERE id=10;
SELECT * from ff02;
+------------+---------------------+---------------------+
| a1         | b1                  | c1                  |
+------------+---------------------+---------------------+
| 1990-02-29 | 1991-02-30 00:00:00 | 0000-00-00 00:00:00 |
| 1990-02-29 | 1991-02-30 00:00:00 | 0000-00-00 00:00:00 |
+------------+---------------------+---------------------+
drop TRIGGER IF EXISTS tri01;
CREATE TRIGGER tri01 BEFORE DELETE ON ff01 FOR EACH ROW
BEGIN
	DECLARE a date;
	DECLARE b datetime;
	DECLARE c timestamp;
	SET a = '1990-2-29';
	SET b = '1991-2-30';
	SET c = '92.2.31';
	INSERT into ff02 VALUES(a,b,c);
END;
//
DELETE from ff01 WHERE a='90.2.29';
SELECT * from ff02;
+------------+---------------------+---------------------+
| a1         | b1                  | c1                  |
+------------+---------------------+---------------------+
| 1990-02-29 | 1991-02-30 00:00:00 | 0000-00-00 00:00:00 |
| 1990-02-29 | 1991-02-30 00:00:00 | 0000-00-00 00:00:00 |
| 1990-02-29 | 1991-02-30 00:00:00 | 0000-00-00 00:00:00 |
+------------+---------------------+---------------------+
##存储过程##
drop PROCEDURE IF EXISTS pro01;
CREATE PROCEDURE pro01()
BEGIN
	DECLARE a date;
	DECLARE b datetime;
	SET a = '2001-2-29';
	SET b = '2001-2-30';
	SELECT a,b;
END;
//
CALL pro01();
+------------+---------------------+
| a          | b                   |
+------------+---------------------+
| 2001-02-29 | 2001-02-30 00:00:00 |
+------------+---------------------+
drop PROCEDURE IF EXISTS pro01;
CREATE PROCEDURE pro01(in a DATE)
BEGIN
	DECLARE b datetime;
	SET b = a;
	SELECT b;
END;
//
CALL pro01('2010-2-29');
+---------------------+
| b                   |
+---------------------+
| 2010-02-29 00:00:00 |
+---------------------+
drop PROCEDURE IF EXISTS pro01;
CREATE PROCEDURE pro01(OUT a DATE)
BEGIN
	DECLARE b datetime DEFAULT '1900-2-29';
	SET a = b;
END;
//
CALL pro01(@a);
SELECT @a;
+------------+
| @a         |
+------------+
| 1900-02-29 |
+------------+
drop PROCEDURE IF EXISTS pro01;
CREATE PROCEDURE pro01(in a date,OUT b datetime)
BEGIN
	SET b = a ;
END;
//
CALL pro01('1999-2-29',@b);
SELECT @b;
+---------------------+
| @b                  |
+---------------------+
| 1999-02-29 00:00:00 |
+---------------------+
drop TABLE if EXISTS ff01;
CREATE TABLE ff01 (a date,b datetime);
drop PROCEDURE IF EXISTS pro01;
CREATE PROCEDURE pro01(IN a varchar(20))
BEGIN
	INSERT into ff01 VALUES (a,a);
END;
//
CALL pro01('99.2.31');
SELECT * from ff01;
+------------+---------------------+
| a          | b                   |
+------------+---------------------+
| 1999-02-31 | 1999-02-31 00:00:00 |
+------------+---------------------+
drop PROCEDURE IF EXISTS pro01;
CREATE PROCEDURE pro01(in a date)
BEGIN
	DECLARE b datetime;
	IF a = '99.3.1' THEN
		set b = a+2;
	ELSEIF a = '99.2.29' THEN
		SET b = a+1;
	ELSE
		SET b = a;
	END IF;
	SELECT b;
END;
//
CALL pro01('99.2.29');
+---------------------+
| b                   |
+---------------------+
| 1999-02-30 00:00:00 |
+---------------------+
drop PROCEDURE IF EXISTS pro01;
CREATE PROCEDURE pro01(in a date)
BEGIN
	DECLARE b datetime;
	IF a = '99.3.1' THEN
		set b = a;
	ELSE
		SET b = a+1;
	END IF;
	SELECT b;
END;
//
CALL pro01('99.3.31');
+---------------------+
| b                   |
+---------------------+
| 0000-00-00 00:00:00 |
+---------------------+
CALL pro01('99.4.31');
+---------------------+
| b                   |
+---------------------+
| 0000-00-00 00:00:00 |
+---------------------+
CALL pro01('99.2.28');
+---------------------+
| b                   |
+---------------------+
| 1999-02-29 00:00:00 |
+---------------------+
drop PROCEDURE IF EXISTS pro01;
CREATE PROCEDURE pro01(in a date)
BEGIN
	IF a > '99.2.30' THEN
		UPDATE ff01 set a = a;
	ELSE
		UPDATE ff01 set a = a+1;
	END IF;
END;
//
CALL pro01('99.2.29');
SELECT * from ff01;
+------------+---------------------+
| a          | b                   |
+------------+---------------------+
| 1999-02-30 | 1999-02-31 00:00:00 |
+------------+---------------------+
CALL pro01('99.2.30');
SELECT * from ff01;
+------------+---------------------+
| a          | b                   |
+------------+---------------------+
| 1999-02-31 | 1999-02-31 00:00:00 |
+------------+---------------------+
CALL pro01('99.2.31');
SELECT * from ff01;
+------------+---------------------+
| a          | b                   |
+------------+---------------------+
| 1999-02-31 | 1999-02-31 00:00:00 |
+------------+---------------------+
##mysql显示2.29，ob显示3.2##
drop PROCEDURE IF EXISTS pro01;
CREATE PROCEDURE pro01(in a date)
BEGIN
	DECLARE b datetime;
	CASE a
	 WHEN '1990-2-29' THEN
     	SET b = a+1;
	 ELSE
	 	SET b = a ;
	END CASE;
	SELECT b;
END;
//
CALL pro01('1990-2-29');
+---------------------+
| b                   |
+---------------------+
| 1990-02-30 00:00:00 |
+---------------------+
drop PROCEDURE IF EXISTS pro01;
CREATE PROCEDURE pro01(in a date,OUT b datetime)
BEGIN
	CASE a
	 WHEN '1990-2-29' THEN
	 	SET b = a+1 ;
	 WHEN '1990-2-30' THEN
	 	SET b = a+2;
	 WHEN '1990-2-31' THEN
	 	SET b = a+3;
	 WHEN '1990-3-1' THEN
	 	SET b = a+4;
	 ELSE
	 	SET b = a ;
	END CASE;
END;
//
CALL pro01('1990-3-1',@b);
SELECT @b;
+---------------------+
| @b                  |
+---------------------+
| 1990-03-05 00:00:00 |
+---------------------+
drop PROCEDURE IF EXISTS pro01;
CREATE PROCEDURE pro01(in a date,OUT b datetime)
BEGIN
	WHILE a < '2001-2-30' DO
		SET b = a + 1;
		SET a = a + 1;
	END WHILE;
END;
//
CALL pro01('2001.2.28',@b);
SELECT @b;
+---------------------+
| @b                  |
+---------------------+
| 2001-02-30 00:00:00 |
+---------------------+
CALL pro01('2001.2.29',@b);
SELECT @b;
+---------------------+
| @b                  |
+---------------------+
| 2001-02-30 00:00:00 |
+---------------------+
##mysql显示null##
CALL pro01('2001.3.1',@b);
SELECT @b;
+------+
| @b   |
+------+
| NULL |
+------+
drop PROCEDURE IF EXISTS pro01;
CREATE PROCEDURE pro01(in a date)
BEGIN
	DECLARE b datetime;
	REPEAT
		SET b = a + 1 ;
		SET a = a + 1 ;
		until a > '2001-2-30'
	END REPEAT;
	SELECT b;
END;
//
CALL pro01('2001-2-29');
+---------------------+
| b                   |
+---------------------+
| 2001-02-31 00:00:00 |
+---------------------+
drop PROCEDURE IF EXISTS pro01;
CREATE PROCEDURE pro01(in a date)
BEGIN
	DECLARE b datetime;
	loop01:LOOP
		SET b = a + 1 ;
		SET a = a + 1 ;
		IF a > '2001-2-30' THEN
			LEAVE loop01;
		END IF;
	END LOOP;
	SELECT b;
END;
//
CALL pro01('2001-2-29');
+---------------------+
| b                   |
+---------------------+
| 2001-02-31 00:00:00 |
+---------------------+
##函数##
DROP FUNCTION IF EXISTS fun01;
CREATE FUNCTION fun01(a date) RETURNS date
BEGIN
	RETURN a + 1;
END;
//
SELECT fun01('2001-2-29');
+--------------------+
| fun01('2001-2-29') |
+--------------------+
| 2001-02-30         |
+--------------------+
DROP FUNCTION IF EXISTS fun01;
CREATE FUNCTION fun01() RETURNS date
BEGIN
	RETURN '1900.2.29';
END;
//
SELECT fun01();
+------------+
| fun01()    |
+------------+
| 1900-02-29 |
+------------+
DROP FUNCTION IF EXISTS fun01;
CREATE FUNCTION fun01() RETURNS date
BEGIN
	set @a = '1900.2-29';
	RETURN @a;
END;
//
SELECT fun01();
+------------+
| fun01()    |
+------------+
| 1900-02-29 |
+------------+
##mysql显示0000-00-00，mysql两个日期相加如果是非法日期会显示null##
DROP FUNCTION IF EXISTS fun01;
CREATE FUNCTION fun01(a date,b date) RETURNS date
BEGIN
	set @c = a + b;
	RETURN @c;
END;
//
SELECT fun01('1999.2.29','1999.2.30');
+--------------------------------+
| fun01('1999.2.29','1999.2.30') |
+--------------------------------+
| 0000-00-00                     |
+--------------------------------+
DROP FUNCTION IF EXISTS fun01;
CREATE FUNCTION fun01(a date,b date) RETURNS varchar(20)
BEGIN
	set @c = a + b;
	RETURN @c;
END;
//
SELECT fun01('1999.2.29','1999.2.30');
+--------------------------------+
| fun01('1999.2.29','1999.2.30') |
+--------------------------------+
| 39980459                       |
+--------------------------------+
drop table if EXISTS ff01;
drop user 'zc_subquery_mysql'@'%';
