purge recyclebin;
drop database IF EXISTS oblrp;
create database oblrp;
use oblrp;
set timestamp = 1600000000;
set ob_trx_timeout = 10000000000;
set ob_query_timeout = 10000000000;
SET SESSION group_concat_max_len = 100000000;
result_format: 4
drop table if exists tt1;
Warnings:
Note	1051	Unknown table 'oblrp.tt1'
create table tt1(id int ,a0 varchar(1000),a varbinary(1000),r roaringbitmap,r1 roaringbitmap);
drop view if exists vtt1;
Warnings:
Note	1051	Unknown table 'oblrp.vtt1'
create view vtt1 as select * from tt1;
insert into tt1 values(0,null,rb_build_empty(),rb_build_empty(),rb_build_varbinary(0x01060100000000000000000000003b300000010000ffff0100fffe0f00));
insert into tt1 values(1,'1',rb_from_string('1'),rb_from_string('1'),rb_build_varbinary(x'01053b3000000100000f27010000000f27'));
insert into tt1 values(2,'4294967296',rb_from_string('4294967296'),rb_from_string('4294967296'),rb_from_string('4294967296,4294967297,42949672969,4294967298,42949672961,42949672962,4294967299,4294967297,14294967296,14294967696,14295967296,5294967296,7294967296,9294967296,8294967296,42949617296,42949672916,4294967396,4294967496,
4294967595,4294967696,4294967795,4294968295,4294967995,4294977295,4294987295,4294997295,4294968295,4294969295,4295967295,4296967295,4297967295,4298967295'));
insert into tt1 values(3,'1,2,6,4,5,9',rb_from_string('1,2,6,4,5,9'),rb_from_string('1,2,6,4,5,9'),rb_from_string('1,2,3,4,5,6,7,8,9,10,11,12,13,14,15,16,17,18,19,20,21,22,23,24,25,26,27,28,29,30,31,4294967298,4294967299'));
insert into tt1 values(3,'1,2,6,4,5,9',rb_from_string('1,2,6,4,5,9'),rb_from_string('1,2,6,4,5,9'),rb_from_string('1,2,3,4,5,6,7,8,9,10,11,12,13,14,15,16,17,18,19,20,21,22,23,24,25,26,27,28,29,30,31,65537,65536'));
insert into tt1 values(4,'4294967296,4294967297,4294967298,4294967299',rb_from_string('4294967296,4294967297,4294967298,4294967299'),rb_from_string('4294967296,4294967297,4294967298,4294967299'),rb_from_string('1,2,3,4,5,6,7,8,9,10,11,12,13,14,15,16,17,18,19,20,21,22,23,24,25,26,27,28,29,30,31,65537,65536'));
insert into tt1 values(5,'1,2,3,4,5,6,7,8,9,10,11,12,13,14,15,16,17,18,19,20,21,22,23,24,25,26,27,28,29,30,31,32,33',
0x01053A3000000100000000002000100000000100020003000400050006000700080009000A000B000C000D000E000F0010001100120013001400150016001700180019001A001B001C001D001E001F0020002100,
0x01053A3000000100000000002000100000000100020003000400050006000700080009000A000B000C000D000E000F0010001100120013001400150016001700180019001A001B001C001D001E001F0020002100,rb_build_empty());
drop PROCEDURE p_test01;
CREATE  PROCEDURE p_test01()
begin
select rb_and_cardinality_agg(rb_from_string('534,73463,736463,736463'));
select rb_or_cardinality_agg(rb_from_string('534,73463,736463,736463'));
select rb_to_array(rb_from_string('534,73463,736463,736463'));
select rb_contains(rb_from_string('534,73463,736463,736463'),rb_from_string('534,73463,736463')),rb_contains(rb_from_string('534,73463,736463,736463'),1);
end;
//
call p_test01();
+-------------------------------------------------------------------+
| rb_and_cardinality_agg(rb_from_string('534,73463,736463,736463')) |
+-------------------------------------------------------------------+
+------------------------------------------------------------------+
| rb_or_cardinality_agg(rb_from_string('534,73463,736463,736463')) |
+------------------------------------------------------------------+
+--------------------------------------------------------+
| rb_to_array(rb_from_string('534,73463,736463,736463')) |
+--------------------------------------------------------+
+-------------------------------------------------------------------------------------------+----------------------------------------------------------+
| rb_contains(rb_from_string('534,73463,736463,736463'),rb_from_string('534,73463,736463')) | rb_contains(rb_from_string('534,73463,736463,736463'),1) |
+-------------------------------------------------------------------------------------------+----------------------------------------------------------+
|                                                                 3 |
|                                                                3 |
| [534,73463,736463]                                     |
|                                                                                         1 |                                                        0 |
+-------------------------------------------------------------------+
+------------------------------------------------------------------+
+--------------------------------------------------------+
+-------------------------------------------------------------------------------------------+----------------------------------------------------------+
drop PROCEDURE p_test01;
CREATE  PROCEDURE p_test01()
begin
select rb_and_cardinality_agg(r) from tt1;
select rb_or_cardinality_agg(r) from tt1;
select rb_to_array(r) from tt1;
select rb_contains(r,r),rb_contains(r,id) from tt1;
end;
//
call p_test01();
+---------------------------+
| rb_and_cardinality_agg(r) |
+---------------------------+
+--------------------------+
| rb_or_cardinality_agg(r) |
+--------------------------+
+---------------------------------------------------------------------------------------------+
| rb_to_array(r)                                                                              |
+---------------------------------------------------------------------------------------------+
+------------------+-------------------+
| rb_contains(r,r) | rb_contains(r,id) |
+------------------+-------------------+
|                         0 |
|                       37 |
| []                                                                                          |
| [1]                                                                                         |
| [4294967296]                                                                                |
| [1,2,4,5,6,9]                                                                               |
| [1,2,4,5,6,9]                                                                               |
| [4294967296,4294967297,4294967298,4294967299]                                               |
| [1,2,3,4,5,6,7,8,9,10,11,12,13,14,15,16,17,18,19,20,21,22,23,24,25,26,27,28,29,30,31,32,33] |
|                1 |                 0 |
|                1 |                 1 |
|                1 |                 0 |
|                1 |                 0 |
|                1 |                 0 |
|                1 |                 0 |
|                1 |                 1 |
+---------------------------+
+--------------------------+
+---------------------------------------------------------------------------------------------+
+------------------+-------------------+
drop PROCEDURE p_test01;
CREATE  PROCEDURE p_test01()
begin
declare a1 int;
declare a2 int;
declare a3 int;
declare a4 int;
declare a5 int;
select rb_and_cardinality_agg(rb_from_string('534,73463,736463,736463')) into a1;
select rb_or_cardinality_agg(r) into a2 from tt1 where id=1;
select rb_contains(rb_from_string('534,73463,736463,736463'), rb_from_string('534,73463,736463')),rb_contains(rb_from_string('534,73463,736463,736463'),1) into a4,a5 ;
select a1;
select a2;
select a3;
select a4;
select a5;
end;
//
call p_test01();
+------+
| a1   |
+------+
+------+
| a2   |
+------+
+------+
| a3   |
+------+
+------+
| a4   |
+------+
+------+
| a5   |
+------+
|    3 |
|    1 |
| NULL |
|    1 |
|    0 |
+------+
+------+
+------+
+------+
+------+
drop PROCEDURE p_test01;
CREATE  PROCEDURE p_test01()
begin
declare a1 int;
declare a2 int;
declare a3 int;
declare a4 int;
set a1 =(select rb_and_cardinality_agg(rb_from_string('534,73463,736463,736463')));
set a2= (select rb_or_cardinality_agg(rb_from_string('534,73463,736463,736463')));
set a3=rb_contains(rb_from_string('534,73463,736463,736463'), rb_from_string('534,73463,736463'));
set a4=rb_contains(rb_from_string('534,73463,736463,736463'),736463);
select a1;
select a2;
select a3;
select a4;
end;
//
call p_test01();
+------+
| a1   |
+------+
+------+
| a2   |
+------+
+------+
| a3   |
+------+
+------+
| a4   |
+------+
|    3 |
|    3 |
|    1 |
|    1 |
+------+
+------+
+------+
+------+
drop PROCEDURE p_test01;
CREATE  PROCEDURE p_test01()
begin
declare a1 json;
set a1 =rb_to_array(rb_from_string('364,9347'));
select a1;
end;
//
Warnings:
Warning	5002	Resolve error
call p_test01();
ERROR 22000: Invalid data type for the operation
drop PROCEDURE p_test01;
CREATE  PROCEDURE p_test01()
begin
declare a1 json;
select rb_to_array(rb_from_string('364,9347')) into a1;
select a1;
end;
//
call p_test01();
ERROR 22000: Invalid data type for the operation
drop PROCEDURE p_test01;
CREATE  PROCEDURE p_test01()
begin
if  (select rb_and_cardinality_agg(rb_from_string('534,73463,736463,736463')))=(select rb_or_cardinality_agg(rb_from_string('534,73463,736463,736463')))then
select 1;
end if;
end;
//
call p_test01();
+---+
| 1 |
+---+
| 1 |
+---+
drop PROCEDURE p_test01;
CREATE  PROCEDURE p_test01()
begin
if  rb_contains(rb_from_string('534,73463,736463,736463'),736463)=rb_contains(rb_from_string('534,73463,736463,736463'),rb_from_string('534,73463,736463,736463')) then
select 1;
end if;
end;
//
call p_test01();
+---+
| 1 |
+---+
| 1 |
+---+
drop PROCEDURE p_test01;
CREATE  PROCEDURE p_test01()
begin
if  rb_to_array(rb_from_string('534,73463,736463,736463'))=rb_to_array(rb_from_string('534,73463,736463,736463')) then
select 1;
end if;
end;
//
bug 2024121300106457444   《[obmysql_array二期]array 表达式在存储过程/触发器中，ob报4006》
call p_test01();
ERROR HY000: The object is not initialized
drop PROCEDURE p_test01;
CREATE  PROCEDURE p_test01()
begin
declare a int;
DECLARE cur1 CURSOR FOR select rb_and_cardinality_agg(r) as a from tt1;
open cur1;
  FETCH cur1 INTO a;
  select a;
  CLOSE cur1;
end;
//
call p_test01();
+------+
| a    |
+------+
|    0 |
+------+
drop PROCEDURE p_test01;
CREATE  PROCEDURE p_test01()
begin
declare a int;
DECLARE cur1 CURSOR FOR select rb_or_cardinality_agg(rb_from_string('127364,6364,6354554')) as a from tt1;
open cur1;
  FETCH cur1 INTO a;
  select a;
  CLOSE cur1;
end;
//
call p_test01();
+------+
| a    |
+------+
|    3 |
+------+
drop PROCEDURE p_test01;
CREATE  PROCEDURE p_test01()
begin
declare a int;
declare a1 int;
DECLARE cur1 CURSOR FOR select rb_contains(r,r) as a, rb_contains(r,id) as b from tt1;
open cur1;
  FETCH cur1 INTO a,a1;
  select a;
  select a1;
  CLOSE cur1;
end;
//
call p_test01();
+------+
| a    |
+------+
+------+
| a1   |
+------+
|    1 |
|    0 |
+------+
+------+
drop PROCEDURE p_test01;
CREATE  PROCEDURE p_test01()
begin
declare a varchar(200);
declare a1 int;
DECLARE cur1 CURSOR FOR select rb_to_array(rb_from_string('1,2,3')) as b;
open cur1;
  FETCH cur1 INTO a;
  select a;
  CLOSE cur1;
end;
//
call  p_test01();
ERROR 22000: Invalid data type for the operation
drop PROCEDURE p_test01;
CREATE  PROCEDURE p_test01(in i int,in i1 int,in i2 int,out i3 int,out i4 int,out i5 int)
begin
select rb_and_cardinality_agg(rb_from_string('534,73463,736463,736463')) into i3;
select rb_or_cardinality_agg(rb_from_string('534,73463,736463,736463')) into i4;
select rb_contains(rb_from_string('534,73463,736463,736463'),rb_from_string('534,73463,736463')) into i5;
select i,i1,i2,i3,i4,i4;
end;
//
call p_test01((select rb_and_cardinality_agg(rb_from_string('534,73463,736463,736463'))),(select rb_or_cardinality_agg(rb_from_string('534,73463,736463,736463'))),rb_contains(rb_from_string('534,73463,736463,736463'),3),@a,@b,@c);
+------+------+------+------+------+------+
| i    | i1   | i2   | i3   | i4   | i4   |
+------+------+------+------+------+------+
|    3 |    3 |    0 |    3 |    3 |    3 |
+------+------+------+------+------+------+
drop PROCEDURE p_test01;
CREATE  PROCEDURE p_test01(in i json)
begin
select i;
end;
//
bug 2024121300106457444   《[obmysql_array二期]array 表达式在存储过程/触发器中，ob报4006》
call p_test01(rb_to_array(rb_from_string('1,2,3')));
ERROR HY000: The object is not initialized
drop table if exists tt4;
Warnings:
Note	1051	Unknown table 'oblrp.tt4'
create table tt4(id1 int,id2 int,id3 int,id4 int,a array(int unsigned));
drop PROCEDURE p_test01;
CREATE  PROCEDURE p_test01()
begin
insert into tt4 values(1,(select rb_and_cardinality_agg(rb_from_string('534,73463,736463,736463'))),(select rb_or_cardinality_agg(rb_from_string('534,73463,736463,736463'))),
rb_contains(rb_from_string('534,73463,736463,736463'),3),rb_to_array(rb_from_string('1,2,3')));
replace into tt4 values(2,(select rb_and_cardinality_agg(rb_from_string('534,73463,736463,736463'))),(select rb_or_cardinality_agg(rb_from_string('534,73463,736463,736463'))),
rb_contains(rb_from_string('534,73463,736463,736463'),3),rb_to_array(rb_from_string('1,2,3')));
insert into tt4 values(3,(select rb_and_cardinality_agg(rb_from_string('534,73463,736463,736463'))),(select rb_or_cardinality_agg(rb_from_string('534,73463,736463,736463'))),
rb_contains(rb_from_string('534,73463,736463,736463'),3),rb_to_array(rb_from_string('1,2,3'))) ON DUPLICATE KEY UPDATE a= rb_to_array(rb_from_string('1,2'));
update tt4 set id2=(select rb_and_cardinality_agg(rb_from_string('534,73463,736463,736463,1,2,3,4'))),id3=(select rb_or_cardinality_agg(rb_from_string('534,73463,736463,736463,4,5,6'))), a=rb_to_array(rb_from_string('0'));
delete from tt4 limit 1;
select * from tt4;
end;
//
call p_test01();
+------+------+------+------+------+
| id1  | id2  | id3  | id4  | a    |
+------+------+------+------+------+
|    2 |    7 |    6 |    0 | [0]  |
|    3 |    7 |    6 |    0 | [0]  |
+------+------+------+------+------+
drop function fun_test;
create function fun_test()
returns int
begin 
declare a1 int;
select rb_and_cardinality_agg(rb_from_string('534,73463,736463,736463')) into a1;
return (select rb_and_cardinality_agg(rb_from_string('534,73463,736463,736463')));
end;
//
select fun_test();
+------------+
| fun_test() |
+------------+
|          3 |
+------------+
drop function fun_test;
create function fun_test()
returns int
begin 
declare a1 int;
select rb_or_cardinality_agg(rb_from_string('534,73463,736463,736463')) into a1;
return (select rb_or_cardinality_agg(rb_from_string('534,73463,736463,736463')));
end;
//
select fun_test();
+------------+
| fun_test() |
+------------+
|          3 |
+------------+
drop function fun_test;
create function fun_test()
returns int
begin 
declare a1 int;
select rb_contains(rb_from_string('534,73463,736463,736463'),3) into a1;
return rb_contains(rb_from_string('534,73463,736463,736463'),rb_from_string('534,73463,736463,736463'));
end;
//
select fun_test();
+------------+
| fun_test() |
+------------+
|          1 |
+------------+
drop function fun_test;
create function fun_test()
returns json
begin 
declare a1 int;
select rb_contains(rb_from_string('534,73463,736463,736463'),3) into a1;
return rb_to_array(rb_from_string('534,73463,736463,736463'));
end;
//
Warnings:
Warning	5002	Resolve error
select fun_test();
ERROR 22000: Invalid data type for the operation
drop function fun_test;
create function fun_test( i int)
returns int
begin 
declare a1 int;
select i into a1;
return i;
end;
//
select fun_test(rb_contains(rb_from_string('534,73463,736463,736463'),rb_from_string('534,73463,736463,736463')));
+------------------------------------------------------------------------------------------------------------+
| fun_test(rb_contains(rb_from_string('534,73463,736463,736463'),rb_from_string('534,73463,736463,736463'))) |
+------------------------------------------------------------------------------------------------------------+
|                                                                                                          1 |
+------------------------------------------------------------------------------------------------------------+
select fun_test(rb_contains(r,id)) from tt1;
+-----------------------------+
| fun_test(rb_contains(r,id)) |
+-----------------------------+
|                           0 |
|                           1 |
|                           0 |
|                           0 |
|                           0 |
|                           0 |
|                           1 |
+-----------------------------+
select fun_test((select rb_or_cardinality_agg(rb_from_string('534,73463,736463,736463'))));
+-------------------------------------------------------------------------------------+
| fun_test((select rb_or_cardinality_agg(rb_from_string('534,73463,736463,736463')))) |
+-------------------------------------------------------------------------------------+
|                                                                                   3 |
+-------------------------------------------------------------------------------------+
select fun_test(rb_and_cardinality_agg(r)) from tt1;
+-------------------------------------+
| fun_test(rb_and_cardinality_agg(r)) |
+-------------------------------------+
|                                   0 |
+-------------------------------------+
select fun_test(rb_to_array(r)) from tt1;
ERROR 42000: Incorrect number of arguments
select fun_test(rb_to_array(rb_from_string('1,2,3,4,5')));
ERROR 42000: Incorrect number of arguments
drop table if exists tt4;
create table tt4(id1 int,id2 int,id3 int,id4 int,a array(int unsigned));
drop function fun_test;
create function fun_test()
returns int
begin 
insert into tt4 values(1,(select rb_and_cardinality_agg(rb_from_string('534,73463,736463,736463'))),(select rb_or_cardinality_agg(rb_from_string('534,73463,736463,736463'))),
rb_contains(rb_from_string('534,73463,736463,736463'),3),rb_to_array(rb_from_string('1,2,3')));
replace into tt4 values(2,(select rb_and_cardinality_agg(rb_from_string('534,73463,736463,736463'))),(select rb_or_cardinality_agg(rb_from_string('534,73463,736463,736463'))),
rb_contains(rb_from_string('534,73463,736463,736463'),3),rb_to_array(rb_from_string('1,2,3')));
insert into tt4 values(3,(select rb_and_cardinality_agg(rb_from_string('534,73463,736463,736463'))),(select rb_or_cardinality_agg(rb_from_string('534,73463,736463,736463'))),
rb_contains(rb_from_string('534,73463,736463,736463'),3),rb_to_array(rb_from_string('1,2,3'))) ON DUPLICATE KEY UPDATE a= rb_to_array(rb_from_string('1,2'));
update tt4 set id2=(select rb_and_cardinality_agg(rb_from_string('534,73463,736463,736463,1,2,3,4'))),id3=(select rb_or_cardinality_agg(rb_from_string('534,73463,736463,736463,4,5,6'))), a=rb_to_array(rb_from_string('0'));
delete from tt4 limit 1;
return 0;
end;
//
select fun_test();
+------------+
| fun_test() |
+------------+
|          0 |
+------------+
drop function fun_test;
create function fun_test()
returns int
begin 
declare a int;
declare a1 int;
DECLARE cur1 CURSOR FOR select rb_contains(r,r) as a, rb_contains(r,id) as b from tt1;
open cur1;
  FETCH cur1 INTO a,a1;
  set a=a1+a1;
  CLOSE cur1;
return 0;
end;
//
select fun_test();
+------------+
| fun_test() |
+------------+
|          0 |
+------------+
drop function fun_test;
create function fun_test()
returns int
begin 
declare a int;
declare a1 int;
DECLARE cur1 CURSOR FOR select rb_and_cardinality_agg(r) as a, rb_or_cardinality_agg(r) as b from tt1;
open cur1;
  FETCH cur1 INTO a,a1;
  set a=a1+a1;
  CLOSE cur1;
return 0;
end;
//
select fun_test();
+------------+
| fun_test() |
+------------+
|          0 |
+------------+
drop function fun_test;
create function fun_test()
returns int
begin 
declare a int;
declare a1 int;
DECLARE cur1 CURSOR FOR select rb_to_array(r) as b from tt1;
open cur1;
  FETCH cur1 INTO a;
  set a=a1+a1;
  CLOSE cur1;
return 0;
end;
//
select fun_test();
ERROR 22000: Invalid data type for the operation
drop table if exists tt3;
Warnings:
Note	1051	Unknown table 'oblrp.tt3'
create table tt3(id1 int,id2 int,id3 int,id4 int,a array(int unsigned));
drop table if exists tt4;
create table tt4(id1 int,id2 int,id3 int,id4 int,a array(int unsigned));
drop trigger tr_test;
CREATE  trigger tr_test before insert on tt3
for each row 
begin
declare i int;
insert into tt4 values(1,(select rb_and_cardinality_agg(rb_from_string('534,73463,736463,736463'))),(select rb_or_cardinality_agg(rb_from_string('534,73463,736463,736463'))),
rb_contains(rb_from_string('534,73463,736463,736463'),3),rb_to_array(rb_from_string('1,2,3')));
replace into tt4 values(2,(select rb_and_cardinality_agg(rb_from_string('534,73463,736463,736463'))),(select rb_or_cardinality_agg(rb_from_string('534,73463,736463,736463'))),
rb_contains(rb_from_string('534,73463,736463,736463'),3),rb_to_array(rb_from_string('1,2,3')));
insert into tt4 values(3,(select rb_and_cardinality_agg(rb_from_string('534,73463,736463,736463'))),(select rb_or_cardinality_agg(rb_from_string('534,73463,736463,736463'))),
rb_contains(rb_from_string('534,73463,736463,736463'),3),rb_to_array(rb_from_string('1,2,3'))) ON DUPLICATE KEY UPDATE a= rb_to_array(rb_from_string('1,2'));
update tt4 set id2=(select rb_and_cardinality_agg(rb_from_string('534,73463,736463,736463,1,2,3,4'))),id3=(select rb_or_cardinality_agg(rb_from_string('534,73463,736463,736463,4,5,6'))), a=rb_to_array(rb_from_string('0'));
delete from tt4 limit 1;
end;
//
insert into tt3 values(1,(select rb_and_cardinality_agg(rb_from_string('534,73463,736463,736463'))),(select rb_or_cardinality_agg(rb_from_string('534,73463,736463,736463'))),
rb_contains(rb_from_string('534,73463,736463,736463'),3),rb_to_array(rb_from_string('1,2,3')));
select * from tt4;
+------+------+------+------+------+
| id1  | id2  | id3  | id4  | a    |
+------+------+------+------+------+
|    2 |    7 |    6 |    0 | [0]  |
|    3 |    7 |    6 |    0 | [0]  |
+------+------+------+------+------+
select * from tt3;
+------+------+------+------+---------+
| id1  | id2  | id3  | id4  | a       |
+------+------+------+------+---------+
|    1 |    3 |    3 |    0 | [1,2,3] |
+------+------+------+------+---------+
drop trigger tr_test;
CREATE  trigger tr_test before update on tt3
for each row 
begin
declare i int;
insert into tt4 values(1,(select rb_and_cardinality_agg(rb_from_string('534,73463,736463,736463'))),(select rb_or_cardinality_agg(rb_from_string('534,73463,736463,736463'))),
rb_contains(rb_from_string('534,73463,736463,736463'),3),rb_to_array(rb_from_string('1,2,3')));
replace into tt4 values(2,(select rb_and_cardinality_agg(rb_from_string('534,73463,736463,736463'))),(select rb_or_cardinality_agg(rb_from_string('534,73463,736463,736463'))),
rb_contains(rb_from_string('534,73463,736463,736463'),3),rb_to_array(rb_from_string('1,2,3')));
insert into tt4 values(3,(select rb_and_cardinality_agg(rb_from_string('534,73463,736463,736463'))),(select rb_or_cardinality_agg(rb_from_string('534,73463,736463,736463'))),
rb_contains(rb_from_string('534,73463,736463,736463'),3),rb_to_array(rb_from_string('1,2,3'))) ON DUPLICATE KEY UPDATE a= rb_to_array(rb_from_string('1,2'));
update tt4 set id2=(select rb_and_cardinality_agg(rb_from_string('534,73463,736463,736463,1,2,3,4'))),id3=(select rb_or_cardinality_agg(rb_from_string('534,73463,736463,736463,4,5,6'))), a=rb_to_array(rb_from_string('0'));
delete from tt4 limit 1;
end;
//
update tt3 set id2=(select rb_and_cardinality_agg(rb_from_string('534,73463,736463,736463,1'))),id3=(select rb_or_cardinality_agg(rb_from_string('736463,736463,4,5,6'))), a=rb_to_array(rb_from_string('0,6374632'));
select * from tt4;
+------+------+------+------+------+
| id1  | id2  | id3  | id4  | a    |
+------+------+------+------+------+
|    3 |    7 |    6 |    0 | [0]  |
|    1 |    7 |    6 |    0 | [0]  |
|    2 |    7 |    6 |    0 | [0]  |
|    3 |    7 |    6 |    0 | [0]  |
+------+------+------+------+------+
select * from tt3;
+------+------+------+------+-------------+
| id1  | id2  | id3  | id4  | a           |
+------+------+------+------+-------------+
|    1 |    4 |    4 |    0 | [0,6374632] |
+------+------+------+------+-------------+
drop trigger tr_test;
CREATE  trigger tr_test after delete on tt3
for each row 
begin
declare i int;
insert into tt4 values(1,(select rb_and_cardinality_agg(rb_from_string('534,73463,736463,736463'))),(select rb_or_cardinality_agg(rb_from_string('534,73463,736463,736463'))),
rb_contains(rb_from_string('534,73463,736463,736463'),3),rb_to_array(rb_from_string('1,2,3')));
replace into tt4 values(2,(select rb_and_cardinality_agg(rb_from_string('534,73463,736463,736463'))),(select rb_or_cardinality_agg(rb_from_string('534,73463,736463,736463'))),
rb_contains(rb_from_string('534,73463,736463,736463'),3),rb_to_array(rb_from_string('1,2,3')));
insert into tt4 values(3,(select rb_and_cardinality_agg(rb_from_string('534,73463,736463,736463'))),(select rb_or_cardinality_agg(rb_from_string('534,73463,736463,736463'))),
rb_contains(rb_from_string('534,73463,736463,736463'),3),rb_to_array(rb_from_string('1,2,3'))) ON DUPLICATE KEY UPDATE a= rb_to_array(rb_from_string('1,2'));
update tt4 set id2=(select rb_and_cardinality_agg(rb_from_string('534,73463,736463,736463,1,2,3,4'))),id3=(select rb_or_cardinality_agg(rb_from_string('534,73463,736463,736463,4,5,6'))), a=rb_to_array(rb_from_string('0'));
delete from tt4 limit 1;
end;
//
delete from tt3;
select * from tt4;
+------+------+------+------+------+
| id1  | id2  | id3  | id4  | a    |
+------+------+------+------+------+
|    1 |    7 |    6 |    0 | [0]  |
|    2 |    7 |    6 |    0 | [0]  |
|    3 |    7 |    6 |    0 | [0]  |
|    1 |    7 |    6 |    0 | [0]  |
|    2 |    7 |    6 |    0 | [0]  |
|    3 |    7 |    6 |    0 | [0]  |
+------+------+------+------+------+
select * from tt3;
+------+------+------+------+------+
| id1  | id2  | id3  | id4  | a    |
+------+------+------+------+------+
+------+------+------+------+------+
insert into tt3 values(4,(select rb_and_cardinality_agg(rb_from_string('534,73463,736463,736463'))),(select rb_or_cardinality_agg(rb_from_string('534,73463,736463,736463'))),
rb_contains(rb_from_string('534,73463,736463,736463'),3),rb_to_array(rb_from_string('1,2,3')));
drop trigger tr_test;
CREATE  trigger tr_test after insert on tt3
for each row 
begin
declare a int;
DECLARE cur1 CURSOR FOR select rb_to_array(r) as b from tt1;
open cur1;
  FETCH cur1 INTO a;
  set a=a;
  CLOSE cur1;
end;
//
insert into tt3 values(1,(select rb_and_cardinality_agg(rb_from_string('534,73463,736463,736463'))),(select rb_or_cardinality_agg(rb_from_string('534,73463,736463,736463'))),
rb_contains(rb_from_string('534,73463,736463,736463'),3),rb_to_array(rb_from_string('1,2,3')));
ERROR 22000: Invalid data type for the operation
drop trigger tr_test;
CREATE  trigger tr_test after update on tt3
for each row 
begin
declare a int;
declare a1 int;
DECLARE cur1 CURSOR FOR select rb_and_cardinality_agg(r) as a, rb_or_cardinality_agg(r) as b from tt1;
open cur1;
  FETCH cur1 INTO a,a1;
  set a=a1+a1;
  CLOSE cur1;
end;
//
update tt3 set id2=(select rb_and_cardinality_agg(rb_from_string('534,73463,736463,1'))),id3=(select rb_or_cardinality_agg(rb_from_string('736463,736463,4,5,6'))), a=rb_to_array(rb_from_string('0,6374632'));
drop trigger tr_test;
CREATE  trigger tr_test before delete on tt3
for each row 
begin
declare a int;
declare a1 int;
DECLARE cur1 CURSOR FOR select rb_contains(r,r) as a, rb_contains(r,id) as b from tt1;
open cur1;
  FETCH cur1 INTO a,a1;
  set a=a1+a1;
  CLOSE cur1;
end;
//
delete from tt3;
########清空回收站，删除测试数据库，表等 ##########
drop database  IF EXISTS  oblrp;
purge recyclebin;
