purge recyclebin;
drop database IF EXISTS oblrp;
create database oblrp ;
use oblrp;
set timestamp = 1600000000;
set ob_trx_timeout = 10000000000;
set ob_query_timeout = 10000000000;
SET SESSION group_concat_max_len = 100000000;
result_format: 4
drop table if exists tt1;
Warnings:
Note	1051	Unknown table 'oblrp.tt1'
create table tt1(id int ,a0 varchar(1000),a varbinary(1000),r roaringbitmap,r1 roaringbitmap);
drop view if exists vtt1;
Warnings:
Note	1051	Unknown table 'oblrp.vtt1'
create view vtt1 as select * from tt1;
insert into tt1 values(0,null,rb_build_empty(),rb_build_empty(),rb_build_varbinary(0x01060100000000000000000000003b300000010000ffff0100fffe0f00));
insert into tt1 values(1,'1',rb_from_string('1'),rb_from_string('1'),rb_build_varbinary(x'01053b3000000100000f27010000000f27'));
insert into tt1 values(2,'4294967296',rb_from_string('4294967296'),rb_from_string('4294967296'),rb_from_string('4294967296,4294967297,42949672969,4294967298,42949672961,42949672962,4294967299,4294967297,14294967296,14294967696,14295967296,5294967296,7294967296,9294967296,8294967296,42949617296,42949672916,4294967396,4294967496,
4294967595,4294967696,4294967795,4294968295,4294967995,4294977295,4294987295,4294997295,4294968295,4294969295,4295967295,4296967295,4297967295,4298967295'));
insert into tt1 values(3,'1,2,6,4,5,9',rb_from_string('1,2,6,4,5,9'),rb_from_string('1,2,6,4,5,9'),rb_from_string('1,2,3,4,5,6,7,8,9,10,11,12,13,14,15,16,17,18,19,20,21,22,23,24,25,26,27,28,29,30,31,4294967298,4294967299'));
insert into tt1 values(3,'1,2,6,4,5,9',rb_from_string('1,2,6,4,5,9'),rb_from_string('1,2,6,4,5,9'),rb_from_string('1,2,3,4,5,6,7,8,9,10,11,12,13,14,15,16,17,18,19,20,21,22,23,24,25,26,27,28,29,30,31,65537,65536'));
insert into tt1 values(4,'4294967296,4294967297,4294967298,4294967299',rb_from_string('4294967296,4294967297,4294967298,4294967299'),rb_from_string('4294967296,4294967297,4294967298,4294967299'),rb_from_string('1,2,3,4,5,6,7,8,9,10,11,12,13,14,15,16,17,18,19,20,21,22,23,24,25,26,27,28,29,30,31,65537,65536'));
insert into tt1 values(5,'1,2,3,4,5,6,7,8,9,10,11,12,13,14,15,16,17,18,19,20,21,22,23,24,25,26,27,28,29,30,31,32,33',
0x01053A3000000100000000002000100000000100020003000400050006000700080009000A000B000C000D000E000F0010001100120013001400150016001700180019001A001B001C001D001E001F0020002100,
0x01053A3000000100000000002000100000000100020003000400050006000700080009000A000B000C000D000E000F0010001100120013001400150016001700180019001A001B001C001D001E001F0020002100,rb_build_empty());
insert into tt1 values(5,'1,2,3,4,5,6,7,8,9,10,11,12,13,14,15,16,17,18,19,20,21,22,23,24,25,26,27,28,29,30,31,65537,65536',
rb_from_string('1,2,3,4,5,6,7,8,9,10,11,12,13,14,15,16,17,18,19,20,21,22,23,24,25,26,27,28,29,30,31,65537,65536'),
rb_from_string('1,2,3,4,5,6,7,8,9,10,11,12,13,14,15,16,17,18,19,20,21,22,23,24,25,26,27,28,29,30,31,65537,65536'),rb_from_string('1,2,6,4,5,9'));
insert into tt1 values(6,'1,2,3,4,5,6,7,8,9,10,11,12,13,14,15,16,17,18,19,20,21,22,23,24,25,26,27,28,29,30,31,4294967298,65536',
rb_from_string('1,2,3,4,5,6,7,8,9,10,11,12,13,14,15,16,17,18,19,20,21,22,23,24,25,26,27,28,29,30,31,4294967298,4294967299'),
rb_from_string('1,2,3,4,5,6,7,8,9,10,11,12,13,14,15,16,17,18,19,20,21,22,23,24,25,26,27,28,29,30,31,4294967298,4294967299'),rb_from_string('1,2,6,4,5,9'));
insert into tt1 values(6,'4294967296,4294967297,42949672969,4294967298,42949672961,42949672962,4294967299,4294967297,14294967296,14294967696,14295967296,5294967296,7294967296,9294967296,8294967296,42949617296,42949672916,4294967396,4294967496,
4294967595,4294967696,4294967795,4294968295,4294967995,4294977295,4294987295,4294997295,4294968295,4294969295,4295967295,4296967295,4297967295,4298967295',
rb_from_string('4294967296,4294967297,42949672969,4294967298,42949672961,42949672962,4294967299,4294967297,14294967296,14294967696,14295967296,5294967296,7294967296,9294967296,8294967296,42949617296,42949672916,4294967396,4294967496,
4294967595,4294967696,4294967795,4294968295,4294967995,4294977295,4294987295,4294997295,4294968295,4294969295,4295967295,4296967295,4297967295,4298967295'),
rb_from_string('4294967296,4294967297,42949672969,4294967298,42949672961,42949672962,4294967299,4294967297,14294967296,14294967696,14295967296,5294967296,7294967296,9294967296,8294967296,42949617296,42949672916,4294967396,4294967496,
4294967595,4294967696,4294967795,4294968295,4294967995,4294977295,4294987295,4294997295,4294968295,4294969295,4295967295,4296967295,4297967295,4298967295'),rb_from_string('4294967296'));
insert into tt1 values(7,'2542',x'01053b3000000100000f27010000000f27',rb_build_varbinary(x'01053b3000000100000f27010000000f27'),rb_from_string('4294967296'));
insert into tt1 values(8,'56214,-7854',rb_build_varbinary(0x01060100000000000000000000003b300000010000ffff0100fffe0f00),rb_build_varbinary(0x01060100000000000000000000003b300000010000ffff0100fffe0f00),rb_from_string('4294967296'));
insert into tt1 values(9,'1,23,8977,973747',0x01060300000000000000000000003b3001000100002000f36d0100010000002000607f677f010000003b30000001000002000100000002002a0000003a300000010000001df300001000000061c4
,0x01060100000000000000000000003b300000010000ffff0100fffe0f00,rb_from_string('4294967296'));
insert into tt1 values(10,null,null,null,null);
insert into tt1(id) values(11);
drop table if exists tt2;
Warnings:
Note	1051	Unknown table 'oblrp.tt2'
create table tt2(id int primary key ,a0 varchar(1000),a varbinary(1000),r roaringbitmap,r1 roaringbitmap)PARTITION BY range COLUMNS(id)(
PARTITION p0 values less than(19),
PARTITION p1 values less than(25),
PARTITION p2 values less than(30)
);
drop view if exists vtt2;
Warnings:
Note	1051	Unknown table 'oblrp.vtt2'
create view vtt2 as select * from tt2;
insert into tt2 values(0,null,rb_build_empty(),rb_build_empty(),rb_build_varbinary(0x01060100000000000000000000003b300000010000ffff0100fffe0f00));
insert into tt2 values(1,'1',rb_from_string('1'),rb_from_string('1'),rb_build_varbinary(x'01053b3000000100000f27010000000f27'));
insert into tt2 values(2,'4294967296',rb_from_string('4294967296'),rb_from_string('4294967296'),rb_from_string('4294967296,4294967297,42949672969,4294967298,42949672961,42949672962,4294967299,4294967297,14294967296,14294967696,14295967296,5294967296,7294967296,9294967296,8294967296,42949617296,42949672916,4294967396,4294967496,
4294967595,4294967696,4294967795,4294968295,4294967995,4294977295,4294987295,4294997295,4294968295,4294969295,4295967295,4296967295,4297967295,4298967295'));
insert into tt2 values(3,'1,2,6,4,5,9',rb_from_string('1,2,6,4,5,9'),rb_from_string('1,2,6,4,5,9'),rb_from_string('1,2,3,4,5,6,7,8,9,10,11,12,13,14,15,16,17,18,19,20,21,22,23,24,25,26,27,28,29,30,31,4294967298,4294967299'));
insert into tt2 values(4,'4294967296,4294967297,4294967298,4294967299',rb_from_string('4294967296,4294967297,4294967298,4294967299'),rb_from_string('4294967296,4294967297,4294967298,4294967299'),rb_from_string('1,2,3,4,5,6,7,8,9,10,11,12,13,14,15,16,17,18,19,20,21,22,23,24,25,26,27,28,29,30,31,65537,65536'));
insert into tt2 values(5,'1,2,3,4,5,6,7,8,9,10,11,12,13,14,15,16,17,18,19,20,21,22,23,24,25,26,27,28,29,30,31,32,33',
0x01053A3000000100000000002000100000000100020003000400050006000700080009000A000B000C000D000E000F0010001100120013001400150016001700180019001A001B001C001D001E001F0020002100,
0x01053A3000000100000000002000100000000100020003000400050006000700080009000A000B000C000D000E000F0010001100120013001400150016001700180019001A001B001C001D001E001F0020002100,rb_build_empty());
insert into tt2 values(6,'1,2,3,4,5,6,7,8,9,10,11,12,13,14,15,16,17,18,19,20,21,22,23,24,25,26,27,28,29,30,31,4294967298,65536',
rb_from_string('1,2,3,4,5,6,7,8,9,10,11,12,13,14,15,16,17,18,19,20,21,22,23,24,25,26,27,28,29,30,31,4294967298,4294967299'),
rb_from_string('1,2,3,4,5,6,7,8,9,10,11,12,13,14,15,16,17,18,19,20,21,22,23,24,25,26,27,28,29,30,31,4294967298,4294967299'),rb_from_string('1,2,6,4,5,9'));
insert into tt2 values(17,'2542',x'01053b3000000100000f27010000000f27',rb_build_varbinary(x'01053b3000000100000f27010000000f27'),rb_from_string('4294967296'));
insert into tt2 values(8,'56214,-7854',rb_build_varbinary(0x01060100000000000000000000003b300000010000ffff0100fffe0f00),rb_build_varbinary(0x01060100000000000000000000003b300000010000ffff0100fffe0f00),rb_from_string('4294967296'));
insert into tt2 values(29,'1,23,8977,973747',0x01060300000000000000000000003b3001000100002000f36d0100010000002000607f677f010000003b30000001000002000100000002002a0000003a300000010000001df300001000000061c4
,0x01060100000000000000000000003b300000010000ffff0100fffe0f00,rb_from_string('4294967296'));
insert into tt2 values(20,'4294967296,4294967297,42949672969,4294967298,42949672961,42949672962,4294967299,4294967297,14294967296,14294967696,14295967296,5294967296,7294967296,9294967296,8294967296,42949617296,42949672916,4294967396,4294967496,
4294967595,4294967696,4294967795,4294968295,4294967995,4294977295,4294987295,4294997295,4294968295,4294969295,4295967295,4296967295,4297967295,4298967295',
rb_from_string('4294967296,4294967297,42949672969,4294967298,42949672961,42949672962,4294967299,4294967297,14294967296,14294967696,14295967296,5294967296,7294967296,9294967296,8294967296,42949617296,42949672916,4294967396,4294967496,
4294967595,4294967696,4294967795,4294968295,4294967995,4294977295,4294987295,4294997295,4294968295,4294969295,4295967295,4296967295,4297967295,4298967295'),
rb_from_string('4294967296,4294967297,42949672969,4294967298,42949672961,42949672962,4294967299,4294967297,14294967296,14294967696,14295967296,5294967296,7294967296,9294967296,8294967296,42949617296,42949672916,4294967396,4294967496,
4294967595,4294967696,4294967795,4294968295,4294967995,4294977295,4294987295,4294997295,4294968295,4294969295,4295967295,4296967295,4297967295,4298967295'),rb_from_string('4294967296'));
insert into tt2 values(15,null,null,null,null);
insert into tt2(id) values(19);
select  rb_and_cardinality_agg(r) from tt1;
+---------------------------+
| rb_and_cardinality_agg(r) |
+---------------------------+
|                         0 |
+---------------------------+
select  rb_and_cardinality_agg(r1) from tt1;
+----------------------------+
| rb_and_cardinality_agg(r1) |
+----------------------------+
|                          0 |
+----------------------------+
select  *, rb_and_cardinality_agg(r) a,rb_and_cardinality_agg(r1) b from tt1;
+------+------+------+------+---------------------------------------------------------------------+------+------+
| id   | a0   | a    | r    | r1                                                                  | a    | b    |
+------+------+------+------+---------------------------------------------------------------------+------+------+
|    0 | NULL |     |     | ˇ˛   ˇ  ˇ  ˇ  ˇ  ˇ  ˇ  ˇ  ˇ  ˇ  	ˇ  
ˇ  ˇ  ˇ  ˇ  ˇ                    |    0 |    0 |
+------+------+------+------+---------------------------------------------------------------------+------+------+
select  rb_and_cardinality_agg(r) from vtt1;
+---------------------------+
| rb_and_cardinality_agg(r) |
+---------------------------+
|                         0 |
+---------------------------+
select  rb_and_cardinality_agg(r1) from vtt1;
+----------------------------+
| rb_and_cardinality_agg(r1) |
+----------------------------+
|                          0 |
+----------------------------+
select  *, rb_and_cardinality_agg(r),rb_and_cardinality_agg(r1) from vtt1;
+------+------+------+------+---------------------------------------------------------------------+---------------------------+----------------------------+
| id   | a0   | a    | r    | r1                                                                  | rb_and_cardinality_agg(r) | rb_and_cardinality_agg(r1) |
+------+------+------+------+---------------------------------------------------------------------+---------------------------+----------------------------+
|    0 | NULL |     |     | ˇ˛   ˇ  ˇ  ˇ  ˇ  ˇ  ˇ  ˇ  ˇ  ˇ  	ˇ  
ˇ  ˇ  ˇ  ˇ  ˇ                    |                         0 |                          0 |
+------+------+------+------+---------------------------------------------------------------------+---------------------------+----------------------------+
select  rb_and_cardinality_agg(tt2.r) ,rb_and_cardinality_agg(tt1.r1)from tt1,tt2;
+-------------------------------+--------------------------------+
| rb_and_cardinality_agg(tt2.r) | rb_and_cardinality_agg(tt1.r1) |
+-------------------------------+--------------------------------+
|                             0 |                              0 |
+-------------------------------+--------------------------------+
select  rb_and_cardinality_agg(r) from tt2;
+---------------------------+
| rb_and_cardinality_agg(r) |
+---------------------------+
|                         0 |
+---------------------------+
select  rb_and_cardinality_agg(r1) from tt2;
+----------------------------+
| rb_and_cardinality_agg(r1) |
+----------------------------+
|                          0 |
+----------------------------+
select  *, rb_and_cardinality_agg(r) a,rb_and_cardinality_agg(r1) b from tt2;
+----+------+------+------+---------------------------------------------------------------------+------+------+
| id | a0   | a    | r    | r1                                                                  | a    | b    |
+----+------+------+------+---------------------------------------------------------------------+------+------+
|  0 | NULL |     |     | ˇ˛   ˇ  ˇ  ˇ  ˇ  ˇ  ˇ  ˇ  ˇ  ˇ  	ˇ  
ˇ  ˇ  ˇ  ˇ  ˇ                    |    0 |    0 |
+----+------+------+------+---------------------------------------------------------------------+------+------+
select  rb_and_cardinality_agg(r) from vtt2;
+---------------------------+
| rb_and_cardinality_agg(r) |
+---------------------------+
|                         0 |
+---------------------------+
select  rb_and_cardinality_agg(r1) from vtt2;
+----------------------------+
| rb_and_cardinality_agg(r1) |
+----------------------------+
|                          0 |
+----------------------------+
select  *, rb_and_cardinality_agg(r),rb_and_cardinality_agg(r1) from vtt2;
+----+------+------+------+---------------------------------------------------------------------+---------------------------+----------------------------+
| id | a0   | a    | r    | r1                                                                  | rb_and_cardinality_agg(r) | rb_and_cardinality_agg(r1) |
+----+------+------+------+---------------------------------------------------------------------+---------------------------+----------------------------+
|  0 | NULL |     |     | ˇ˛   ˇ  ˇ  ˇ  ˇ  ˇ  ˇ  ˇ  ˇ  ˇ  	ˇ  
ˇ  ˇ  ˇ  ˇ  ˇ                    |                         0 |                          0 |
+----+------+------+------+---------------------------------------------------------------------+---------------------------+----------------------------+
select   rb_and_cardinality_agg(r),rb_and_cardinality_agg(r1),* from tt2;
+---------------------------+----------------------------+----+------+------+------+---------------------------------------------------------------------+
| rb_and_cardinality_agg(r) | rb_and_cardinality_agg(r1) | id | a0   | a    | r    | r1                                                                  |
+---------------------------+----------------------------+----+------+------+------+---------------------------------------------------------------------+
|                         0 |                          0 |  0 | NULL |     |     | ˇ˛   ˇ  ˇ  ˇ  ˇ  ˇ  ˇ  ˇ  ˇ  ˇ  	ˇ  
ˇ  ˇ  ˇ  ˇ  ˇ                    |
+---------------------------+----------------------------+----+------+------+------+---------------------------------------------------------------------+
select  /*+enable_parallel_dml parallel(2) */ rb_and_cardinality_agg(r) from tt1;
+---------------------------+
| rb_and_cardinality_agg(r) |
+---------------------------+
|                         0 |
+---------------------------+
select  /*+enable_parallel_dml parallel(2) */ rb_and_cardinality_agg(r) from vtt1;
+---------------------------+
| rb_and_cardinality_agg(r) |
+---------------------------+
|                         0 |
+---------------------------+
select  /*+enable_parallel_dml parallel(2) */ rb_and_cardinality_agg(r) from tt2;
+---------------------------+
| rb_and_cardinality_agg(r) |
+---------------------------+
|                         0 |
+---------------------------+
select  *,/*+enable_parallel_dml parallel(2) read_consistency(weak)*/ rb_and_cardinality_agg(r) from tt2;
+----+------+------+------+---------------------------------------------------------------------+---------------------------+
| id | a0   | a    | r    | r1                                                                  | rb_and_cardinality_agg(r) |
+----+------+------+------+---------------------------------------------------------------------+---------------------------+
|  0 | NULL |     |     | ˇ˛   ˇ  ˇ  ˇ  ˇ  ˇ  ˇ  ˇ  ˇ  ˇ  	ˇ  
ˇ  ˇ  ˇ  ˇ  ˇ                    |                         0 |
+----+------+------+------+---------------------------------------------------------------------+---------------------------+
select  /*+enable_parallel_dml parallel(2) */ rb_and_cardinality_agg(r) from vtt2;
+---------------------------+
| rb_and_cardinality_agg(r) |
+---------------------------+
|                         0 |
+---------------------------+
select rb_and_cardinality_agg(0x0100);
+--------------------------------+
| rb_and_cardinality_agg(0x0100) |
+--------------------------------+
|                              0 |
+--------------------------------+
select rb_and_cardinality_agg(0x0000);
ERROR HY000: Invalid data
select rb_and_cardinality_agg(0x0200);
ERROR HY000: Invalid data
select rb_and_cardinality_agg(0x00);
ERROR HY000: Invalid data
select rb_and_cardinality_agg(0x0101);
ERROR HY000: Invalid data
select rb_and_cardinality_agg(0x0102);
ERROR HY000: Invalid data
select rb_and_cardinality_agg(0x0103);
ERROR HY000: Invalid data
select rb_and_cardinality_agg(0x0104);
ERROR HY000: Invalid data
select rb_and_cardinality_agg(0x0105);
ERROR HY000: Invalid data
select rb_and_cardinality_agg(0x0106);
ERROR HY000: Invalid data
select rb_and_cardinality_agg(0x0107);
ERROR HY000: Invalid data
select rb_and_cardinality_agg(0x01);
ERROR HY000: Invalid data
select rb_and_cardinality_agg(rb_build_empty());
+------------------------------------------+
| rb_and_cardinality_agg(rb_build_empty()) |
+------------------------------------------+
|                                        0 |
+------------------------------------------+
select rb_and_cardinality_agg(0x010100000100);
+----------------------------------------+
| rb_and_cardinality_agg(0x010100000100) |
+----------------------------------------+
|                                      1 |
+----------------------------------------+
select rb_and_cardinality_agg(x'010000000100');
ERROR HY000: Invalid data
select rb_and_cardinality_agg(x'010200000100');
ERROR HY000: Invalid data
select rb_and_cardinality_agg(x'010300000100');
ERROR HY000: Invalid data
select rb_and_cardinality_agg(x'010400000100');
ERROR HY000: Invalid data
select rb_and_cardinality_agg(x'010500000100');
ERROR HY000: Invalid data
select rb_and_cardinality_agg(x'010600000100');
ERROR HY000: Invalid data
select rb_and_cardinality_agg(x'010700000100');
ERROR HY000: Invalid data
select rb_and_cardinality_agg(x'01010000');
ERROR HY000: Invalid data
select rb_and_cardinality_agg(rb_from_string('-2147483647'));
+-------------------------------------------------------+
| rb_and_cardinality_agg(rb_from_string('-2147483647')) |
+-------------------------------------------------------+
|                                                     1 |
+-------------------------------------------------------+
select rb_and_cardinality_agg(rb_from_string('4294967295'));
+------------------------------------------------------+
| rb_and_cardinality_agg(rb_from_string('4294967295')) |
+------------------------------------------------------+
|                                                    1 |
+------------------------------------------------------+
select rb_and_cardinality_agg(0x0102270000000A000000);
+------------------------------------------------+
| rb_and_cardinality_agg(0x0102270000000A000000) |
+------------------------------------------------+
|                                              1 |
+------------------------------------------------+
select rb_and_cardinality_agg(x'0102270000000A000000');
+-------------------------------------------------+
| rb_and_cardinality_agg(x'0102270000000A000000') |
+-------------------------------------------------+
|                                               1 |
+-------------------------------------------------+
set @a=0x0102270000000A000000;
select rb_and_cardinality_agg(@a);
+----------------------------+
| rb_and_cardinality_agg(@a) |
+----------------------------+
|                          1 |
+----------------------------+
select rb_and_cardinality_agg(x'010000000100');
ERROR HY000: Invalid data
select rb_and_cardinality_agg(x'010200000100');
ERROR HY000: Invalid data
select rb_and_cardinality_agg(x'010300000100');
ERROR HY000: Invalid data
select rb_and_cardinality_agg(x'010400000100');
ERROR HY000: Invalid data
select rb_and_cardinality_agg(x'010500000100');
ERROR HY000: Invalid data
select rb_and_cardinality_agg(x'010600000100');
ERROR HY000: Invalid data
select rb_and_cardinality_agg(x'010700000100');
ERROR HY000: Invalid data
select rb_and_cardinality_agg(x'01010000');
ERROR HY000: Invalid data
select rb_and_cardinality_agg(x'0102270000000A00000010000000000000000');
ERROR 42000: You have an error in your SQL syntax; check the manual that corresponds to your OceanBase version for the right syntax to use near 'x'0102270000000A00000010000000000000000')' at line 1
select rb_and_cardinality_agg(rb_from_string('-1'));
+----------------------------------------------+
| rb_and_cardinality_agg(rb_from_string('-1')) |
+----------------------------------------------+
|                                            1 |
+----------------------------------------------+
select rb_and_cardinality_agg(rb_from_string('4294967296'));
+------------------------------------------------------+
| rb_and_cardinality_agg(rb_from_string('4294967296')) |
+------------------------------------------------------+
|                                                    1 |
+------------------------------------------------------+
select rb_and_cardinality_agg(0x01030220804500FFFFFFFF) from tt1;
+--------------------------------------------------+
| rb_and_cardinality_agg(0x01030220804500FFFFFFFF) |
+--------------------------------------------------+
|                                                2 |
+--------------------------------------------------+
select rb_and_cardinality_agg(x'010302FFFFFFFF20804500');
+---------------------------------------------------+
| rb_and_cardinality_agg(x'010302FFFFFFFF20804500') |
+---------------------------------------------------+
|                                                 2 |
+---------------------------------------------------+
select rb_and_cardinality_agg(x'010302FFFFFFFFFFFFFFFF');
ERROR HY000: Invalid data
select rb_and_cardinality_agg(x'010002FFFFFFFF20804500');
ERROR HY000: Invalid data
select rb_and_cardinality_agg(x'010102FFFFFFFF20804500');
ERROR HY000: Invalid data
select rb_and_cardinality_agg(x'010202FFFFFFFF20804500');
ERROR HY000: Invalid data
select rb_and_cardinality_agg(x'010402FFFFFFFF20804500');
ERROR HY000: Invalid data
select rb_and_cardinality_agg(x'010502FFFFFFFF20804500');
ERROR HY000: Invalid data
select rb_and_cardinality_agg(x'010602FFFFFFFF20804500');
ERROR HY000: Invalid data
select rb_and_cardinality_agg(x'010702FFFFFFFF20804500');
ERROR HY000: Invalid data
select rb_and_cardinality_agg(x'0102FFFFFFFF20804500');
+-------------------------------------------------+
| rb_and_cardinality_agg(x'0102FFFFFFFF20804500') |
+-------------------------------------------------+
|                                               1 |
+-------------------------------------------------+
select rb_and_cardinality_agg(0x01030020804500FFFFFFFF);
ERROR HY000: Invalid data
select rb_and_cardinality_agg(0x01030320804500FFFFFFFF);
ERROR HY000: Invalid data
select rb_and_cardinality_agg(0x010320804500FFFFFFFF);
ERROR HY000: Invalid data
select rb_and_cardinality_agg(x'010302FFFFFFFF');
ERROR HY000: Invalid data
select rb_and_cardinality_agg(x'010302');
ERROR HY000: Invalid data
select rb_and_cardinality_agg(rb_from_string('1,2,3,4,5,6,7,8,9,10,11,12,13,14,15,16,17,18,19,20,21,22,23,24,25,26,27,28,29,30,31,4294967295'));
+------------------------------------------------------------------------------------------------------------------------------------------+
| rb_and_cardinality_agg(rb_from_string('1,2,3,4,5,6,7,8,9,10,11,12,13,14,15,16,17,18,19,20,21,22,23,24,25,26,27,28,29,30,31,4294967295')) |
+------------------------------------------------------------------------------------------------------------------------------------------+
|                                                                                                                                       32 |
+------------------------------------------------------------------------------------------------------------------------------------------+
select rb_and_cardinality_agg(0x0104200100000000000000020000000000000003000000000000000400000000000000050000000000000006000000000000000700000000000000080000000000000009000000000000000A000000000000000B000000000000000C000000000000000D000000000000000E000000000000000F0000000000000010000000000000001100000000000000120000000000000013000000000000001400000000000000150000000000000016000000000000001700000000000000180000000000000019000000000000001A000000000000001B000000000000001C000000000000001D000000000000001E000000000000001F000000000000000000000001000000);
+-----------------------------------------------------------------------------------------------------------------------------------------------------------------------------------------------------------------------------------------------------------------+
| rb_and_cardinality_agg(0x0104200100000000000000020000000000000003000000000000000400000000000000050000000000000006000000000000000700000000000000080000000000000009000000000000000A000000000000000B000000000000000C000000000000000D000000000000000E00000000000000 |
+-----------------------------------------------------------------------------------------------------------------------------------------------------------------------------------------------------------------------------------------------------------------+
|                                                                                                                                                                                                                                                              32 |
+-----------------------------------------------------------------------------------------------------------------------------------------------------------------------------------------------------------------------------------------------------------------+
select rb_and_cardinality_agg(x'0104200710000000000000020000000000000003000000000000000400000000000000050000000000000006000000000000000700000000000000080000000000000009000000000000000A000000000000000B000000000000000C000000000000000D000000000000000E000000000000000F0000000000000010000000000000001100000000000000120000000000000013000000000000001400000000000000150000000000000016000000000000001700000000000000180000000000000019000000000000001A000000000000001B000000000000001C000000000000001D000000000000001E000000000000001F000000000000000000000001000000');
+-----------------------------------------------------------------------------------------------------------------------------------------------------------------------------------------------------------------------------------------------------------------+
| rb_and_cardinality_agg(x'0104200710000000000000020000000000000003000000000000000400000000000000050000000000000006000000000000000700000000000000080000000000000009000000000000000A000000000000000B000000000000000C000000000000000D000000000000000E00000000000000 |
+-----------------------------------------------------------------------------------------------------------------------------------------------------------------------------------------------------------------------------------------------------------------+
|                                                                                                                                                                                                                                                              32 |
+-----------------------------------------------------------------------------------------------------------------------------------------------------------------------------------------------------------------------------------------------------------------+
select rb_and_cardinality_agg(0x0104200700000000000000020000000000000003000000000000000400000000000000050000000000000006000000000000000700000000000000080000000000000009000000000000000A000000000000000B000000000000000C000000000000000D000000000000000E000000000000000F0000000000000010000000000000001100000000000000120000000000000013000000000000001400000000000000150000000000000016000000000000001700000000000000180000000000000019000000000000001A000000000000001B000000000000001C000000000000001D000000000000001E000000000000001F000000000000000000000001000000);
ERROR HY000: Invalid data
select rb_and_cardinality_agg(0x0102200100000000000000020000000000000003000000000000000400000000000000050000000000000006000000000000000700000000000000080000000000000009000000000000000A000000000000000B000000000000000C000000000000000D000000000000000E000000000000000F0000000000000010000000000000001100000000000000120000000000000013000000000000001400000000000000150000000000000016000000000000001700000000000000180000000000000019000000000000001A000000000000001B000000000000001C000000000000001D000000000000001E000000000000001F000000000000000000000001000000);
ERROR HY000: Invalid data
select rb_and_cardinality_agg(0x0100200100000000000000020000000000000003000000000000000400000000000000050000000000000006000000000000000700000000000000080000000000000009000000000000000A000000000000000B000000000000000C000000000000000D000000000000000E000000000000000F0000000000000010000000000000001100000000000000120000000000000013000000000000001400000000000000150000000000000016000000000000001700000000000000180000000000000019000000000000001A000000000000001B000000000000001C000000000000001D000000000000001E000000000000001F000000000000000000000001000000);
ERROR HY000: Invalid data
select rb_and_cardinality_agg(0x01012200100000000000000020000000000000003000000000000000400000000000000050000000000000006000000000000000700000000000000080000000000000009000000000000000A000000000000000B000000000000000C000000000000000D000000000000000E000000000000000F0000000000000010000000000000001100000000000000120000000000000013000000000000001400000000000000150000000000000016000000000000001700000000000000180000000000000019000000000000001A000000000000001B000000000000001C000000000000001D000000000000001E000000000000001F000000000000000000000001000000);
ERROR HY000: Invalid data
select rb_and_cardinality_agg(0x0103200700000000000000020000000000000003000000000000000400000000000000050000000000000006000000000000000700000000000000080000000000000009000000000000000A000000000000000B000000000000000C000000000000000D000000000000000E000000000000000F0000000000000010000000000000001100000000000000120000000000000013000000000000001400000000000000150000000000000016000000000000001700000000000000180000000000000019000000000000001A000000000000001B000000000000001C000000000000001D000000000000001E000000000000001F000000000000000000000001000000);
ERROR HY000: Invalid data
select rb_and_cardinality_agg(0x0105200700000000000000020000000000000003000000000000000400000000000000050000000000000006000000000000000700000000000000080000000000000009000000000000000A000000000000000B000000000000000C000000000000000D000000000000000E000000000000000F0000000000000010000000000000001100000000000000120000000000000013000000000000001400000000000000150000000000000016000000000000001700000000000000180000000000000019000000000000001A000000000000001B000000000000001C000000000000001D000000000000001E000000000000001F000000000000000000000001000000);
ERROR HY000: Invalid data
select rb_and_cardinality_agg(0x0106200700000000000000020000000000000003000000000000000400000000000000050000000000000006000000000000000700000000000000080000000000000009000000000000000A000000000000000B000000000000000C000000000000000D000000000000000E000000000000000F0000000000000010000000000000001100000000000000120000000000000013000000000000001400000000000000150000000000000016000000000000001700000000000000180000000000000019000000000000001A000000000000001B000000000000001C000000000000001D000000000000001E000000000000001F000000000000000000000001000000);
ERROR HY000: Invalid data
select rb_and_cardinality_agg(0x0107200700000000000000020000000000000003000000000000000400000000000000050000000000000006000000000000000700000000000000080000000000000009000000000000000A000000000000000B000000000000000C000000000000000D000000000000000E000000000000000F0000000000000010000000000000001100000000000000120000000000000013000000000000001400000000000000150000000000000016000000000000001700000000000000180000000000000019000000000000001A000000000000001B000000000000001C000000000000001D000000000000001E000000000000001F000000000000000000000001000000);
ERROR HY000: Invalid data
select rb_and_cardinality_agg(0x01200100000000000000020000000000000003000000000000000400000000000000050000000000000006000000000000000700000000000000080000000000000009000000000000000A000000000000000B000000000000000C000000000000000D000000000000000E000000000000000F0000000000000010000000000000001100000000000000120000000000000013000000000000001400000000000000150000000000000016000000000000001700000000000000180000000000000019000000000000001A000000000000001B000000000000001C000000000000001D000000000000001E000000000000001F000000000000000000000001000000);
ERROR HY000: Invalid data
select rb_and_cardinality_agg(0x0104210100000000000000020000000000000003000000000000000400000000000000050000000000000006000000000000000700000000000000080000000000000009000000000000000A000000000000000B000000000000000C000000000000000D000000000000000E000000000000000F0000000000000010000000000000001100000000000000120000000000000013000000000000001400000000000000150000000000000016000000000000001700000000000000180000000000000019000000000000001A000000000000001B000000000000001C000000000000001D000000000000001E000000000000001F000000000000000000000001000000);
ERROR HY000: Invalid data
select rb_and_cardinality_agg(0x0104190100000000000000020000000000000003000000000000000400000000000000050000000000000006000000000000000700000000000000080000000000000009000000000000000A000000000000000B000000000000000C000000000000000D000000000000000E000000000000000F0000000000000010000000000000001100000000000000120000000000000013000000000000001400000000000000150000000000000016000000000000001700000000000000180000000000000019000000000000001A000000000000001B000000000000001C000000000000001D000000000000001E000000000000001F000000000000000000000001000000);
ERROR HY000: Invalid data
select rb_and_cardinality_agg(0x01040100000000000000020000000000000003000000000000000400000000000000050000000000000006000000000000000700000000000000080000000000000009000000000000000A000000000000000B000000000000000C000000000000000D000000000000000E000000000000000F0000000000000010000000000000001100000000000000120000000000000013000000000000001400000000000000150000000000000016000000000000001700000000000000180000000000000019000000000000001A000000000000001B000000000000001C000000000000001D000000000000001E000000000000001F000000000000000000000001000000);
ERROR HY000: Invalid data
select rb_and_cardinality_agg(0x0104200700000000000000020000000000000003000000000000000400000000000000050000000000000006000000000000000700000000000000080000000000000009000000000000000A000000000000000B000000000000000C000000000000000D000000000000000E000000000000000F0000000000000010000000000000001100000000000000120000000000000013000000000000001400000000000000150000000000000016000000000000001700000000000000180000000000000019000000000000001A000000000000001B000000000000001C000000000000001D000000000000001E000000000000001F00000000000000);
ERROR HY000: Invalid data
select rb_and_cardinality_agg(X'01053A3000000200000000001F00FFFF010018000000580000000100020003000400050006000700080009000A000B000C000D000E000F0010001100120013001400150016001700180019001A001B001C001D001E001F002000FEFFFFFF');
+-------------------------------------------------------------------------------------------------------------------------------------------------------------------------------------------------------------------------+
| rb_and_cardinality_agg(X'01053A3000000200000000001F00FFFF010018000000580000000100020003000400050006000700080009000A000B000C000D000E000F0010001100120013001400150016001700180019001A001B001C001D001E001F002000FEFFFFFF') |
+-------------------------------------------------------------------------------------------------------------------------------------------------------------------------------------------------------------------------+
|                                                                                                                                                                                                                      34 |
+-------------------------------------------------------------------------------------------------------------------------------------------------------------------------------------------------------------------------+
select rb_and_cardinality_agg(x'01053A3000000200000000001F00FFFF010018000000580000000100020003000400050007000600080009000A000B000C000D000E000F0010001100120013001400150016001700180019001A001B001C001D001E001F002000FEFFFFFF');
ERROR HY000: Invalid data
select rb_and_cardinality_agg(0x01053A3000000200000001001F00FFFF010018000000580000000100020003000400050006000700080009000A000B000C000D000E000F0010001100120013001400150016001700180019001A001B001C001D001E001F002000FEFFFFFF);
+------------------------------------------------------------------------------------------------------------------------------------------------------------------------------------------------------------------------+
| rb_and_cardinality_agg(0x01053A3000000200000001001F00FFFF010018000000580000000100020003000400050006000700080009000A000B000C000D000E000F0010001100120013001400150016001700180019001A001B001C001D001E001F002000FEFFFFFF) |
+------------------------------------------------------------------------------------------------------------------------------------------------------------------------------------------------------------------------+
|                                                                                                                                                                                                                     34 |
+------------------------------------------------------------------------------------------------------------------------------------------------------------------------------------------------------------------------+
select rb_and_cardinality_agg(x'00053A3000000200000000001F00FFFF010018000000580000000100020003000400050007000600080009000A000B000C000D000E000F0010001100120013001400150016001700180019001A001B001C001D001E001F002000FEFFFFFF');
ERROR HY000: Invalid data
select rb_and_cardinality_agg(x'02053A3000000200000000001F00FFFF010018000000580000000100020003000400050007000600080009000A000B000C000D000E000F0010001100120013001400150016001700180019001A001B001C001D001E001F002000FEFFFFFF');
ERROR HY000: Invalid data
select rb_and_cardinality_agg(x'053A3000000200000000001F00FFFF010018000000580000000100020003000400050007000600080009000A000B000C000D000E000F0010001100120013001400150016001700180019001A001B001C001D001E001F002000FEFFFFFF');
ERROR HY000: Invalid data
select rb_and_cardinality_agg(x'01003A3000000200000000001F00FFFF010018000000580000000100020003000400050007000600080009000A000B000C000D000E000F0010001100120013001400150016001700180019001A001B001C001D001E001F002000FEFFFFFF');
ERROR HY000: Invalid data
select rb_and_cardinality_agg(x'01013A3000000200000000001F00FFFF010018000000580000000100020003000400050007000600080009000A000B000C000D000E000F0010001100120013001400150016001700180019001A001B001C001D001E001F002000FEFFFFFF');
ERROR HY000: Invalid data
select rb_and_cardinality_agg(x'01023A3000000200000000001F00FFFF010018000000580000000100020003000400050007000600080009000A000B000C000D000E000F0010001100120013001400150016001700180019001A001B001C001D001E001F002000FEFFFFFF');
ERROR HY000: Invalid data
select rb_and_cardinality_agg(x'01033A3000000200000000001F00FFFF010018000000580000000100020003000400050007000600080009000A000B000C000D000E000F0010001100120013001400150016001700180019001A001B001C001D001E001F002000FEFFFFFF');
ERROR HY000: Invalid data
select rb_and_cardinality_agg(x'01043A3000000200000000001F00FFFF010018000000580000000100020003000400050007000600080009000A000B000C000D000E000F0010001100120013001400150016001700180019001A001B001C001D001E001F002000FEFFFFFF');
ERROR HY000: Invalid data
select rb_and_cardinality_agg(x'01063A3000000200000000001F00FFFF010018000000580000000100020003000400050007000600080009000A000B000C000D000E000F0010001100120013001400150016001700180019001A001B001C001D001E001F002000FEFFFFFF');
ERROR HY000: Invalid data
select rb_and_cardinality_agg(x'01073A3000000200000000001F00FFFF010018000000580000000100020003000400050007000600080009000A000B000C000D000E000F0010001100120013001400150016001700180019001A001B001C001D001E001F002000FEFFFFFF');
ERROR HY000: Invalid data
select rb_and_cardinality_agg(x'013A3000000200000000001F00FFFF010018000000580000000100020003000400050007000600080009000A000B000C000D000E000F0010001100120013001400150016001700180019001A001B001C001D001E001F002000FEFFFFFF');
ERROR HY000: Invalid data
select rb_and_cardinality_agg(0x01052A3000000200000000001F00FFFF010018000000580000000100020003000400050006000700080009000A000B000C000D000E000F0010001100120013001400150016001700180019001A001B001C001D001E001F002000FEFFFFFF);
ERROR HY000: Invalid data
select rb_and_cardinality_agg(0x01050200000000001F00FFFF010018000000580000000100020003000400050006000700080009000A000B000C000D000E000F0010001100120013001400150016001700180019001A001B001C001D001E001F002000FEFFFFFF);
ERROR HY000: Invalid data
select rb_and_cardinality_agg(x'01053A3000000200000000001F008F020000FFFF01002000000060000000620000000100020003000400050006000700080009000A000B000C000D000E000F0010001100120013001400150016001700180019001A001B001C001D001E001F002000285CFEFFFFFF');
ERROR HY000: Invalid data
select rb_and_cardinality_agg(x'01053A3000000400000000001F008F020000FFFF01002000000060000000620000000100020003000400050006000700080009000A000B000C000D000E000F0010001100120013001400150016001700180019001A001B001C001D001E001F002000285CFEFFFFFF');
ERROR HY000: Invalid data
select rb_and_cardinality_agg(x'01053A30000000001F008F020000FFFF01002000000060000000620000000100020003000400050006000700080009000A000B000C000D000E000F0010001100120013001400150016001700180019001A001B001C001D001E001F002000285CFEFFFFFF');
ERROR HY000: Invalid data
select rb_and_cardinality_agg(x'01053A3000000300000001001F008F020000FFFF01002000000060000000620000000100020003000400050006000700080009000A000B000C000D000E000F0010001100120013001400150016001700180019001A001B001C001D001E001F002000285CFEFFFFFF');
+---------------------------------------------------------------------------------------------------------------------------------------------------------------------------------------------------------------------------------------------+
| rb_and_cardinality_agg(x'01053A3000000300000001001F008F020000FFFF01002000000060000000620000000100020003000400050006000700080009000A000B000C000D000E000F0010001100120013001400150016001700180019001A001B001C001D001E001F002000285CFEFFFFFF') |
+---------------------------------------------------------------------------------------------------------------------------------------------------------------------------------------------------------------------------------------------+
|                                                                                                                                                                                                                                          35 |
+---------------------------------------------------------------------------------------------------------------------------------------------------------------------------------------------------------------------------------------------+
select rb_and_cardinality_agg(x'01053A300000030000001F008F020000FFFF01002000000060000000620000000100020003000400050006000700080009000A000B000C000D000E000F0010001100120013001400150016001700180019001A001B001C001D001E001F002000285CFEFFFFFF');
ERROR HY000: Invalid data
select rb_and_cardinality_agg(x'01053A3000000300000001001E008F020000FFFF01002000000060000000620000000100020003000400050006000700080009000A000B000C000D000E000F0010001100120013001400150016001700180019001A001B001C001D001E001F002000285CFEFFFFFF');
ERROR HY000: Invalid data
select rb_and_cardinality_agg(x'01053A30000003000000010020008F020000FFFF01002000000060000000620000000100020003000400050006000700080009000A000B000C000D000E000F0010001100120013001400150016001700180019001A001B001C001D001E001F002000285CFEFFFFFF');
ERROR HY000: Invalid data
select rb_and_cardinality_agg(x'01053A300000030000000100ffff8F020000FFFF01002000000060000000620000000100020003000400050006000700080009000A000B000C000D000E000F0010001100120013001400150016001700180019001A001B001C001D001E001F002000285CFEFFFFFF');
ERROR HY000: Invalid data
select rb_and_cardinality_agg(x'01053A3000000300000001008F020000FFFF01002000000060000000620000000100020003000400050006000700080009000A000B000C000D000E000F0010001100120013001400150016001700180019001A001B001C001D001E001F002000285CFEFFFFFF');
ERROR HY000: Invalid data
select rb_and_cardinality_agg(x'01053A3000000300000000001F008F020001FFFF01002000000060000000620000000100020003000400050006000700080009000A000B000C000D000E000F0010001100120013001400150016001700180019001A001B001C001D001E001F002000285CFEFFFFFF');
ERROR HY000: Invalid data
select rb_and_cardinality_agg(x'01053A3000000300000000001F008F020000FFFF00002000000060000000620000000100020003000400050006000700080009000A000B000C000D000E000F0010001100120013001400150016001700180019001A001B001C001D001E001F002000285CFEFFFFFF');
ERROR HY000: Invalid data
select rb_and_cardinality_agg(x'01053A3000000300000000001F008F020000FFFF00002000000060000000620000000100020003000400050006000700080009000A000B000C000D000E000F0010001100120013001400150016001700180019001A001B001C001D001E001F002000285CFEFFFFFF');
ERROR HY000: Invalid data
select rb_and_cardinality_agg(x'01053A3000000300000000001F008F020000FFFF01003000000060000000620000000100020003000400050006000700080009000A000B000C000D000E000F0010001100120013001400150016001700180019001A001B001C001D001E001F002000285CFEFFFFFF');
+---------------------------------------------------------------------------------------------------------------------------------------------------------------------------------------------------------------------------------------------+
| rb_and_cardinality_agg(x'01053A3000000300000000001F008F020000FFFF01003000000060000000620000000100020003000400050006000700080009000A000B000C000D000E000F0010001100120013001400150016001700180019001A001B001C001D001E001F002000285CFEFFFFFF') |
+---------------------------------------------------------------------------------------------------------------------------------------------------------------------------------------------------------------------------------------------+
|                                                                                                                                                                                                                                          35 |
+---------------------------------------------------------------------------------------------------------------------------------------------------------------------------------------------------------------------------------------------+
select rb_and_cardinality_agg(x'01053A3000000300000000001F008F020000FFFF01001000000060000000620000000100020003000400050006000700080009000A000B000C000D000E000F0010001100120013001400150016001700180019001A001B001C001D001E001F002000285CFEFFFFFF');
+---------------------------------------------------------------------------------------------------------------------------------------------------------------------------------------------------------------------------------------------+
| rb_and_cardinality_agg(x'01053A3000000300000000001F008F020000FFFF01001000000060000000620000000100020003000400050006000700080009000A000B000C000D000E000F0010001100120013001400150016001700180019001A001B001C001D001E001F002000285CFEFFFFFF') |
+---------------------------------------------------------------------------------------------------------------------------------------------------------------------------------------------------------------------------------------------+
|                                                                                                                                                                                                                                          35 |
+---------------------------------------------------------------------------------------------------------------------------------------------------------------------------------------------------------------------------------------------+
select rb_and_cardinality_agg(x'01053A3000000300000000001F008F020000FFFF010020000000600000000100020003000400050006000700080009000A000B000C000D000E000F0010001100120013001400150016001700180019001A001B001C001D001E001F002000285CFEFFFFFF');
ERROR HY000: Invalid data
select rb_and_cardinality_agg(x'01053A3000000300000000001F008F020000FFFF0100200000006000000062000000');
ERROR HY000: Invalid data
select rb_and_cardinality_agg(0x01053A3000000200000000001F000010010018000000580000000100020003000400050006000700080009000A000B000C000D000E000F0010001100120013001400150016001700180019001A001B001C001D001E001F002000FEFFFFFF);
+------------------------------------------------------------------------------------------------------------------------------------------------------------------------------------------------------------------------+
| rb_and_cardinality_agg(0x01053A3000000200000000001F000010010018000000580000000100020003000400050006000700080009000A000B000C000D000E000F0010001100120013001400150016001700180019001A001B001C001D001E001F002000FEFFFFFF) |
+------------------------------------------------------------------------------------------------------------------------------------------------------------------------------------------------------------------------+
|                                                                                                                                                                                                                     34 |
+------------------------------------------------------------------------------------------------------------------------------------------------------------------------------------------------------------------------+
select rb_and_cardinality_agg(x'01053b3000000100000f27010000000f27');
+---------------------------------------------------------------+
| rb_and_cardinality_agg(x'01053b3000000100000f27010000000f27') |
+---------------------------------------------------------------+
|                                                         10000 |
+---------------------------------------------------------------+
select rb_and_cardinality_agg(x'01053b3000000110000f27010000000f27');
+---------------------------------------------------------------+
| rb_and_cardinality_agg(x'01053b3000000110000f27010000000f27') |
+---------------------------------------------------------------+
|                                                         10000 |
+---------------------------------------------------------------+
select rb_and_cardinality_agg(x'01053a3000000100000f27010000000f27');
ERROR HY000: Invalid data
select rb_and_cardinality_agg(x'01053b3000010100000f27010000000f27');
ERROR HY000: Invalid data
select rb_and_cardinality_agg(x'01053b3000000000000f27010000000f27');
ERROR HY000: Invalid data
select rb_and_cardinality_agg(x'01053b3000000000000f27010000000f27');
ERROR HY000: Invalid data
select rb_and_cardinality_agg(x'01053b3000000200000f27010000000f27');
ERROR HY000: Invalid data
select rb_and_cardinality_agg(x'01053b30000000000f27010000000f27');
ERROR HY000: Invalid data
select rb_and_cardinality_agg(x'01053b3000000101000f27010000000f00');
+---------------------------------------------------------------+
| rb_and_cardinality_agg(x'01053b3000000101000f27010000000f00') |
+---------------------------------------------------------------+
|                                                            16 |
+---------------------------------------------------------------+
select rb_and_cardinality_agg(x'01053b300000010f27010000000f00');
ERROR HY000: Invalid data
select rb_and_cardinality_agg(x'00053b3000000101000f27010000000f00');
ERROR HY000: Invalid data
select rb_and_cardinality_agg(x'053b3000000101000f27010000000f00');
ERROR HY000: Invalid data
select rb_and_cardinality_agg(x'01003b3000000101000f27010000000f00');
ERROR HY000: Invalid data
select rb_and_cardinality_agg(x'01013b3000000101000f27010000000f00');
ERROR HY000: Invalid data
select rb_and_cardinality_agg(x'01023b3000000101000f27010000000f00');
ERROR HY000: Invalid data
select rb_and_cardinality_agg(x'01033b3000000101000f27010000000f00');
ERROR HY000: Invalid data
select rb_and_cardinality_agg(x'01043b3000000101000f27010000000f00');
ERROR HY000: Invalid data
select rb_and_cardinality_agg(x'01063b3000000101000f27010000000f00');
ERROR HY000: Invalid data
select rb_and_cardinality_agg(x'01073b3000000101000f27010000000f00');
ERROR HY000: Invalid data
select rb_and_cardinality_agg(x'013b3000000101000f27010000000f00');
ERROR HY000: Invalid data
select rb_and_cardinality_agg(x'01053b3000000101000f27010000000f00');
+---------------------------------------------------------------+
| rb_and_cardinality_agg(x'01053b3000000101000f27010000000f00') |
+---------------------------------------------------------------+
|                                                            16 |
+---------------------------------------------------------------+
select rb_and_cardinality_agg(x'01053b3000000101000000010000000f00');
+---------------------------------------------------------------+
| rb_and_cardinality_agg(x'01053b3000000101000000010000000f00') |
+---------------------------------------------------------------+
|                                                            16 |
+---------------------------------------------------------------+
select rb_and_cardinality_agg(x'01053b3000000101001111010000000f00');
+---------------------------------------------------------------+
| rb_and_cardinality_agg(x'01053b3000000101001111010000000f00') |
+---------------------------------------------------------------+
|                                                            16 |
+---------------------------------------------------------------+
select rb_and_cardinality_agg(x'01053b300000010100010000000f00');
ERROR HY000: Invalid data
select rb_and_cardinality_agg(x'01053b3000000101000f27000000000f00');
ERROR HY000: Invalid data
select rb_and_cardinality_agg(x'01053b3000000101000f27020000000f00');
ERROR HY000: Invalid data
select rb_and_cardinality_agg(x'01053b3000000101000f2700000f00');
ERROR HY000: Invalid data
select rb_and_cardinality_agg(x'01053b3000000101000f27010000010f00');
+---------------------------------------------------------------+
| rb_and_cardinality_agg(x'01053b3000000101000f27010000010f00') |
+---------------------------------------------------------------+
|                                                            16 |
+---------------------------------------------------------------+
select rb_and_cardinality_agg(x'01053b300000010100ffff0100ffff0f00');
ERROR HY000: Invalid data
select rb_and_cardinality_agg(x'01053b300000010000ffff0100ffff0100');
ERROR HY000: Invalid data
select rb_and_cardinality_agg(x'01053b3000000101000f2701000f00');
ERROR HY000: Invalid data
select rb_and_cardinality_agg(x'01053b3000000101000f2701000000ffff');
+---------------------------------------------------------------+
| rb_and_cardinality_agg(x'01053b3000000101000f2701000000ffff') |
+---------------------------------------------------------------+
|                                                         65536 |
+---------------------------------------------------------------+
select rb_and_cardinality_agg(x'01053b3000000101000f2701000001');
ERROR HY000: Invalid data
select rb_and_cardinality_agg(x'01053b3000000101000f27010000000f00');
+---------------------------------------------------------------+
| rb_and_cardinality_agg(x'01053b3000000101000f27010000000f00') |
+---------------------------------------------------------------+
|                                                            16 |
+---------------------------------------------------------------+
select rb_and_cardinality_agg(x'01053b300000010001ffff0100feff0000');
+---------------------------------------------------------------+
| rb_and_cardinality_agg(x'01053b300000010001ffff0100feff0000') |
+---------------------------------------------------------------+
|                                                             1 |
+---------------------------------------------------------------+
select rb_and_cardinality_agg(x'01053a30020001000002000100000099190100010001000200030098999999');
ERROR HY000: Invalid data
select rb_and_cardinality_agg(x'01053b30020001000002000100000099190100010001000200030098999999');
+-------------------------------------------------------------------------------------------+
| rb_and_cardinality_agg(x'01053b30020001000002000100000099190100010001000200030098999999') |
+-------------------------------------------------------------------------------------------+
|                                                                                         6 |
+-------------------------------------------------------------------------------------------+
select rb_and_cardinality_agg(x'01053b3000000101000f27010000000f00');
+---------------------------------------------------------------+
| rb_and_cardinality_agg(x'01053b3000000101000f27010000000f00') |
+---------------------------------------------------------------+
|                                                            16 |
+---------------------------------------------------------------+
select rb_and_cardinality_agg(0x01053b3000000101000100010000000f00);
+--------------------------------------------------------------+
| rb_and_cardinality_agg(0x01053b3000000101000100010000000f00) |
+--------------------------------------------------------------+
|                                                           16 |
+--------------------------------------------------------------+
select rb_and_cardinality_agg(x'01053b30020001000002000100000099190200010001000200030098999999');
ERROR HY000: Invalid data
select rb_and_cardinality_agg(x'01053b30020001000002000100010099190100010001000200030098999999');
ERROR HY000: Invalid data
select rb_and_cardinality_agg(x'01053b3002000100000200010000009919010001000100020003009899');
ERROR HY000: Invalid data
select rb_and_cardinality_agg(x'01053b30020001000002000100000099190100000001000200030098999999');
ERROR HY000: Invalid data
select rb_and_cardinality_agg(x'01053b30020001000002000100000099190100010001000700030098999999');
+-------------------------------------------------------------------------------------------+
| rb_and_cardinality_agg(x'01053b30020001000002000100000099190100010001000700030098999999') |
+-------------------------------------------------------------------------------------------+
|                                                                                        11 |
+-------------------------------------------------------------------------------------------+
select rb_and_cardinality_agg(x'01053b30030001000002000100000099190100010001000200030098999999');
ERROR HY000: Invalid data
select rb_and_cardinality_agg(x'01053b30010001000002000100000099190100010001000700030098999999');
ERROR HY000: Invalid data
select rb_and_cardinality_agg(x'01053b30020000000002000100000099190100010001000700030098999999');
ERROR HY000: Invalid data
select rb_and_cardinality_agg(x'01053b300200000002000100000099190100010001000700030098999999');
ERROR HY000: Invalid data
select rb_and_cardinality_agg(x'01053b30020001010002000100000099190100010001000700030098999999');
ERROR HY000: Invalid data
select rb_and_cardinality_agg(x'01053b30020001010002000100000099190100010001000700030098999999');
ERROR HY000: Invalid data
select rb_and_cardinality_agg(x'01053b30020001002002000100000099190100010001000200030098999999');
+-------------------------------------------------------------------------------------------+
| rb_and_cardinality_agg(x'01053b30020001002002000100000099190100010001000200030098999999') |
+-------------------------------------------------------------------------------------------+
|                                                                                         6 |
+-------------------------------------------------------------------------------------------+
select rb_and_cardinality_agg(x'01053b30020001000002000100000099190100010001000200030098999999');
+-------------------------------------------------------------------------------------------+
| rb_and_cardinality_agg(x'01053b30020001000002000100000099190100010001000200030098999999') |
+-------------------------------------------------------------------------------------------+
|                                                                                         6 |
+-------------------------------------------------------------------------------------------+
select rb_and_cardinality_agg(x'01053b301800fdffff010000370001000100020013000300190004000f000500140006001e000700190008000600090013000a0018000b0019000c0007000e0013000f0019001000030011000e0013001d0015001d0017001d0019001d00e803160010274c003075080060ea2700d0000000da000000de000000e4000000ee000000f8000000020100000c010000160100001c010000220100002c010000360100003c01000042010000480100004e010000540100005a01000060010000660100006c0100007a010000980100009e010000020000003100faff0500000001000100ecff1300020000001000f7ff0800020000000500f6ff0900020000000900f5ff0a00020000000d00efff1000020000000700eeff11000100000006000100ecff1300020000000800f0ff0f00020000000300eaff15000100000007000100ecff13000100e6ff19000100000003000100e9ff0e000100e2ff1d000100e0ff1d000100deff1d000100dcff1d000300000008000a000400100008000700c8000900d3000700dc000700e5001400ff0009000e010900220109000100660308000100cc062700');
+-----------------------------------------------------------------------------------------------------------------------------------------------------------------------------------------------------------------------------------------------------------------+
| rb_and_cardinality_agg(x'01053b301800fdffff010000370001000100020013000300190004000f000500140006001e000700190008000600090013000a0018000b0019000c0007000e0013000f0019001000030011000e0013001d0015001d0017001d0019001d00e803160010274c003075080060ea2700d0000000da |
+-----------------------------------------------------------------------------------------------------------------------------------------------------------------------------------------------------------------------------------------------------------------+
|                                                                                                                                                                                                                                                             618 |
+-----------------------------------------------------------------------------------------------------------------------------------------------------------------------------------------------------------------------------------------------------------------+
select rb_and_cardinality_agg(x'01060400000000000000000000003A3000000200000000001F00FFFF010018000000580000000100020003000400050006000700080009000A000B000C000D000E000F0010001100120013001400150016001700180019001A001B001C001D001E001F002000FEFFFFFF010000003A30000001000000000000001000000000000A0000003A3000000100000000000000100000000700FFFFFFFF3A30000001000000FFFF020010000000FDFFFEFFfFFF');
+-----------------------------------------------------------------------------------------------------------------------------------------------------------------------------------------------------------------------------------------------------------------+
| rb_and_cardinality_agg(x'01060400000000000000000000003A3000000200000000001F00FFFF010018000000580000000100020003000400050006000700080009000A000B000C000D000E000F0010001100120013001400150016001700180019001A001B001C001D001E001F002000FEFFFFFF010000003A30000001 |
+-----------------------------------------------------------------------------------------------------------------------------------------------------------------------------------------------------------------------------------------------------------------+
|                                                                                                                                                                                                                                                              39 |
+-----------------------------------------------------------------------------------------------------------------------------------------------------------------------------------------------------------------------------------------------------------------+
select rb_and_cardinality_agg(0x01060400000000000000000000003A3000000200000000001F00FFFF010018000000580000000100020003000400050006000700080009000A000B000C000D000E000F0010001100120013001400150016001700180019001A001B001C001D001E001F002000FEFFFFFF010000003A30000001000000000000001000000000000A0000003A3000000100000000000000100000000700FFFFFFFF3A30000001000000FFFF020010000000FDFFFEFFFFFF);
+-----------------------------------------------------------------------------------------------------------------------------------------------------------------------------------------------------------------------------------------------------------------+
| rb_and_cardinality_agg(0x01060400000000000000000000003A3000000200000000001F00FFFF010018000000580000000100020003000400050006000700080009000A000B000C000D000E000F0010001100120013001400150016001700180019001A001B001C001D001E001F002000FEFFFFFF010000003A30000001 |
+-----------------------------------------------------------------------------------------------------------------------------------------------------------------------------------------------------------------------------------------------------------------+
|                                                                                                                                                                                                                                                              39 |
+-----------------------------------------------------------------------------------------------------------------------------------------------------------------------------------------------------------------------------------------------------------------+
select rb_and_cardinality_agg(x'01060400000000000000000000003A3000000200000000001F00FFFF010018000000580000000100020003000400050006000700080009000A000B000C000D000E000F0010001100120013001400150016001700180019001A001B001C001D001E001F002000FEFFFFFF010000003A30000001000000000000001000000000000A0000003A3000000100000000000000100000000700FFFFFFFF3A30000001000000FFFF020010000000FDFFFeFFFfFF');
+-----------------------------------------------------------------------------------------------------------------------------------------------------------------------------------------------------------------------------------------------------------------+
| rb_and_cardinality_agg(x'01060400000000000000000000003A3000000200000000001F00FFFF010018000000580000000100020003000400050006000700080009000A000B000C000D000E000F0010001100120013001400150016001700180019001A001B001C001D001E001F002000FEFFFFFF010000003A30000001 |
+-----------------------------------------------------------------------------------------------------------------------------------------------------------------------------------------------------------------------------------------------------------------+
|                                                                                                                                                                                                                                                              39 |
+-----------------------------------------------------------------------------------------------------------------------------------------------------------------------------------------------------------------------------------------------------------------+
select rb_and_cardinality_agg(0x01060200000000000000000000003A3000000100000000001F00100000000100020003000400050006000700080009000A000B000C000D000E000F0010001100120013001400150016001700180019001A001B001C001D001E001F002100010000003A3000000100000000000000100000000000);
+-----------------------------------------------------------------------------------------------------------------------------------------------------------------------------------------------------------------------------------------------------------------+
| rb_and_cardinality_agg(0x01060200000000000000000000003A3000000100000000001F00100000000100020003000400050006000700080009000A000B000C000D000E000F0010001100120013001400150016001700180019001A001B001C001D001E001F002100010000003A30000001000000000000001000000000 |
+-----------------------------------------------------------------------------------------------------------------------------------------------------------------------------------------------------------------------------------------------------------------+
|                                                                                                                                                                                                                                                              33 |
+-----------------------------------------------------------------------------------------------------------------------------------------------------------------------------------------------------------------------------------------------------------------+
select rb_and_cardinality_agg(0x01060200000000000000000000003A3000000100000000001F00100000000100020003000400050006000700080009000A000B000C000D000E000F0010001100120013001400150016001700180019001A001B001C001D001E001F002100010000003A3000000100000000000000100000000000);
+-----------------------------------------------------------------------------------------------------------------------------------------------------------------------------------------------------------------------------------------------------------------+
| rb_and_cardinality_agg(0x01060200000000000000000000003A3000000100000000001F00100000000100020003000400050006000700080009000A000B000C000D000E000F0010001100120013001400150016001700180019001A001B001C001D001E001F002100010000003A30000001000000000000001000000000 |
+-----------------------------------------------------------------------------------------------------------------------------------------------------------------------------------------------------------------------------------------------------------------+
|                                                                                                                                                                                                                                                              33 |
+-----------------------------------------------------------------------------------------------------------------------------------------------------------------------------------------------------------------------------------------------------------------+
select rb_and_cardinality_agg(x'00060400000000000000000000003A3000000200000000001F00FFFF010018000000580000000100020003000400050006000700080009000A000B000C000D000E000F0010001100120013001400150016001700180019001A001B001C001D001E001F002000FEFFFFFF010000003A30000001000000000000001000000000000A0000003A3000000100000000000000100000000700FFFFFFFF3A30000001000000FFFF020010000000FDFFFFFFFEFF');
ERROR HY000: Invalid data
select rb_and_cardinality_agg(x'02060400000000000000000000003A3000000200000000001F00FFFF010018000000580000000100020003000400050006000700080009000A000B000C000D000E000F0010001100120013001400150016001700180019001A001B001C001D001E001F002000FEFFFFFF010000003A30000001000000000000001000000000000A0000003A3000000100000000000000100000000700FFFFFFFF3A30000001000000FFFF020010000000FDFFFFFFFEFF');
ERROR HY000: Invalid data
select rb_and_cardinality_agg(x'060400000000000000000000003A3000000200000000001F00FFFF010018000000580000000100020003000400050006000700080009000A000B000C000D000E000F0010001100120013001400150016001700180019001A001B001C001D001E001F002000FEFFFFFF010000003A30000001000000000000001000000000000A0000003A3000000100000000000000100000000700FFFFFFFF3A30000001000000FFFF020010000000FDFFFFFFFEFF');
ERROR HY000: Invalid data
select rb_and_cardinality_agg(x'01050400000000000000000000003A3000000200000000001F00FFFF010018000000580000000100020003000400050006000700080009000A000B000C000D000E000F0010001100120013001400150016001700180019001A001B001C001D001E001F002000FEFFFFFF010000003A30000001000000000000001000000000000A0000003A3000000100000000000000100000000700FFFFFFFF3A30000001000000FFFF020010000000FDFFFFFFFEFF');
ERROR HY000: Invalid data
select rb_and_cardinality_agg(x'01010400000000000000000000003A3000000200000000001F00FFFF010018000000580000000100020003000400050006000700080009000A000B000C000D000E000F0010001100120013001400150016001700180019001A001B001C001D001E001F002000FEFFFFFF010000003A30000001000000000000001000000000000A0000003A3000000100000000000000100000000700FFFFFFFF3A30000001000000FFFF020010000000FDFFFFFFFEFF');
ERROR HY000: Invalid data
select rb_and_cardinality_agg(x'01020400000000000000000000003A3000000200000000001F00FFFF010018000000580000000100020003000400050006000700080009000A000B000C000D000E000F0010001100120013001400150016001700180019001A001B001C001D001E001F002000FEFFFFFF010000003A30000001000000000000001000000000000A0000003A3000000100000000000000100000000700FFFFFFFF3A30000001000000FFFF020010000000FDFFFFFFFEFF');
ERROR HY000: Invalid data
select rb_and_cardinality_agg(x'01030400000000000000000000003A3000000200000000001F00FFFF010018000000580000000100020003000400050006000700080009000A000B000C000D000E000F0010001100120013001400150016001700180019001A001B001C001D001E001F002000FEFFFFFF010000003A30000001000000000000001000000000000A0000003A3000000100000000000000100000000700FFFFFFFF3A30000001000000FFFF020010000000FDFFFFFFFEFF');
ERROR HY000: Invalid data
select rb_and_cardinality_agg(x'01040400000000000000000000003A3000000200000000001F00FFFF010018000000580000000100020003000400050006000700080009000A000B000C000D000E000F0010001100120013001400150016001700180019001A001B001C001D001E001F002000FEFFFFFF010000003A30000001000000000000001000000000000A0000003A3000000100000000000000100000000700FFFFFFFF3A30000001000000FFFF020010000000FDFFFFFFFEFF');
ERROR HY000: Invalid data
select rb_and_cardinality_agg(x'01070400000000000000000000003A3000000200000000001F00FFFF010018000000580000000100020003000400050006000700080009000A000B000C000D000E000F0010001100120013001400150016001700180019001A001B001C001D001E001F002000FEFFFFFF010000003A30000001000000000000001000000000000A0000003A3000000100000000000000100000000700FFFFFFFF3A30000001000000FFFF020010000000FDFFFFFFFEFF');
ERROR HY000: Invalid data
select rb_and_cardinality_agg(x'010400000000000000000000003A3000000200000000001F00FFFF010018000000580000000100020003000400050006000700080009000A000B000C000D000E000F0010001100120013001400150016001700180019001A001B001C001D001E001F002000FEFFFFFF010000003A30000001000000000000001000000000000A0000003A3000000100000000000000100000000700FFFFFFFF3A30000001000000FFFF020010000000FDFFFFFFFEFF');
ERROR HY000: Invalid data
select rb_and_cardinality_agg(x'01060300000000000000000000003A3000000200000000001F00FFFF010018000000580000000100020003000400050006000700080009000A000B000C000D000E000F0010001100120013001400150016001700180019001A001B001C001D001E001F002000FEFFFFFF010000003A30000001000000000000001000000000000A0000003A3000000100000000000000100000000700FFFFFFFF3A30000001000000FFFF020010000000FDFFFFFFFEFF');
ERROR HY000: Invalid data
select rb_and_cardinality_agg(x'01060500000000000000000000003A3000000200000000001F00FFFF010018000000580000000100020003000400050006000700080009000A000B000C000D000E000F0010001100120013001400150016001700180019001A001B001C001D001E001F002000FEFFFFFF010000003A30000001000000000000001000000000000A0000003A3000000100000000000000100000000700FFFFFFFF3A30000001000000FFFF020010000000FDFFFFFFFEFF');
ERROR HY000: Invalid data
select rb_and_cardinality_agg(x'0106000000003A3000000200000000001F00FFFF010018000000580000000100020003000400050006000700080009000A000B000C000D000E000F0010001100120013001400150016001700180019001A001B001C001D001E001F002000FEFFFFFF010000003A30000001000000000000001000000000000A0000003A3000000100000000000000100000000700FFFFFFFF3A30000001000000FFFF020010000000FDFFFFFFFEFF');
ERROR HY000: Invalid data
select rb_and_cardinality_agg(x'01060400000000000000000000003A3000000200000000001F00FFFF010018000000580000000100020003000400050006000700080009000A000B000C000D000E000F0010001100120013001400150016001700180019001A001B001C001D001E001F002000FEFFFFFF010000003A30000001000000000000001000000000000A0000003A3000000100000000000000100000000700FFFFFFFF3A30000001000000FFFF020010000000FDFFFFFFFEFF');
ERROR HY000: Invalid data
select rb_and_cardinality_agg(x'01060400000000000000000000002A3000000200000000001F00FFFF010018000000580000000100020003000400050006000700080009000A000B000C000D000E000F0010001100120013001400150016001700180019001A001B001C001D001E001F002000FEFFFFFF010000003A30000001000000000000001000000000000A0000003A3000000100000000000000100000000700FFFFFFFF3A30000001000000FFFF020010000000FDFFFFFFFEFF');
ERROR HY000: Invalid data
select rb_and_cardinality_agg(x'01060400000000000000000000000200000000001F00FFFF010018000000580000000100020003000400050006000700080009000A000B000C000D000E000F0010001100120013001400150016001700180019001A001B001C001D001E001F002000FEFFFFFF010000003A30000001000000000000001000000000000A0000003A3000000100000000000000100000000700FFFFFFFF3A30000001000000FFFF020010000000FDFFFFFFFEFF');
ERROR HY000: Invalid data
select rb_and_cardinality_agg(x'01060400000000000000000000003A3000000100000000001F00FFFF010018000000580000000100020003000400050006000700080009000A000B000C000D000E000F0010001100120013001400150016001700180019001A001B001C001D001E001F002000FEFFFFFF010000003A30000001000000000000001000000000000A0000003A3000000100000000000000100000000700FFFFFFFF3A30000001000000FFFF020010000000FDFFFFFFFEFF');
ERROR HY000: Invalid data
select rb_and_cardinality_agg(x'01060400000000000000000000003A3000000300000000001F00FFFF010018000000580000000100020003000400050006000700080009000A000B000C000D000E000F0010001100120013001400150016001700180019001A001B001C001D001E001F002000FEFFFFFF010000003A30000001000000000000001000000000000A0000003A3000000100000000000000100000000700FFFFFFFF3A30000001000000FFFF020010000000FDFFFFFFFEFF');
ERROR HY000: Invalid data
select rb_and_cardinality_agg(x'01060400000000000000000000003A30000000001F00FFFF010018000000580000000100020003000400050006000700080009000A000B000C000D000E000F0010001100120013001400150016001700180019001A001B001C001D001E001F002000FEFFFFFF010000003A30000001000000000000001000000000000A0000003A3000000100000000000000100000000700FFFFFFFF3A30000001000000FFFF020010000000FDFFFFFFFEFF');
ERROR HY000: Invalid data
select rb_and_cardinality_agg(x'01060400000000000000000000003A3000000200000000011F00FFFF010018000000580000000100020003000400050006000700080009000A000B000C000D000E000F0010001100120013001400150016001700180019001A001B001C001D001E001F002000FEFFFFFF010000003A30000001000000000000001000000000000A0000003A3000000100000000000000100000000700FFFFFFFF3A30000001000000FFFF020010000000FDFFFefFFfFF');
+-----------------------------------------------------------------------------------------------------------------------------------------------------------------------------------------------------------------------------------------------------------------+
| rb_and_cardinality_agg(x'01060400000000000000000000003A3000000200000000011F00FFFF010018000000580000000100020003000400050006000700080009000A000B000C000D000E000F0010001100120013001400150016001700180019001A001B001C001D001E001F002000FEFFFFFF010000003A30000001 |
+-----------------------------------------------------------------------------------------------------------------------------------------------------------------------------------------------------------------------------------------------------------------+
|                                                                                                                                                                                                                                                              39 |
+-----------------------------------------------------------------------------------------------------------------------------------------------------------------------------------------------------------------------------------------------------------------+
select rb_and_cardinality_agg(x'01060400000000000000000000003A300000020000001F00FFFF010018000000580000000100020003000400050006000700080009000A000B000C000D000E000F0010001100120013001400150016001700180019001A001B001C001D001E001F002000FEFFFFFF010000003A30000001000000000000001000000000000A0000003A3000000100000000000000100000000700FFFFFFFF3A30000001000000FFFF020010000000FDFFFFFFFEFF');
ERROR HY000: Invalid data
select rb_and_cardinality_agg(x'01060400000000000000000000003A3000000200000000011e00FFFF010018000000580000000100020003000400050006000700080009000A000B000C000D000E000F0010001100120013001400150016001700180019001A001B001C001D001E001F002000FEFFFFFF010000003A30000001000000000000001000000000000A0000003A3000000100000000000000100000000700FFFFFFFF3A30000001000000FFFF020010000000FDFFFFFFFEFF');
ERROR HY000: Invalid data
select rb_and_cardinality_agg(x'01060400000000000000000000003A3000000200000000012000FFFF010018000000580000000100020003000400050006000700080009000A000B000C000D000E000F0010001100120013001400150016001700180019001A001B001C001D001E001F002000FEFFFFFF010000003A30000001000000000000001000000000000A0000003A3000000100000000000000100000000700FFFFFFFF3A30000001000000FFFF020010000000FDFFFFFFFEFF');
ERROR HY000: Invalid data
select rb_and_cardinality_agg(x'01060400000000000000000000003A300000020000000001FFFF010018000000580000000100020003000400050006000700080009000A000B000C000D000E000F0010001100120013001400150016001700180019001A001B001C001D001E001F002000FEFFFFFF010000003A30000001000000000000001000000000000A0000003A3000000100000000000000100000000700FFFFFFFF3A30000001000000FFFF020010000000FDFFFFFFFEFF');
ERROR HY000: Invalid data
select rb_and_cardinality_agg(x'01060400000000000000000000003A3000000200000000011F00FFFF011018000000580000000100020003000400050006000700080009000A000B000C000D000E000F0010001100120013001400150016001700180019001A001B001C001D001E001F002000FEFFFFFF010000003A30000001000000000000001000000000000A0000003A3000000100000000000000100000000700FFFFFFFF3A30000001000000FFFF020010000000FDFFFFFFFEFF');
ERROR HY000: Invalid data
select rb_and_cardinality_agg(x'01060400000000000000000000003A3000000200000000011F00FFFF010008000000580000000100020003000400050006000700080009000A000B000C000D000E000F0010001100120013001400150016001700180019001A001B001C001D001E001F002000FEFFFFFF010000003A30000001000000000000001000000000000A0000003A3000000100000000000000100000000700FFFFFFFF3A30000001000000FFFF020010000000FDFFFEFFFFFF');
+-----------------------------------------------------------------------------------------------------------------------------------------------------------------------------------------------------------------------------------------------------------------+
| rb_and_cardinality_agg(x'01060400000000000000000000003A3000000200000000011F00FFFF010008000000580000000100020003000400050006000700080009000A000B000C000D000E000F0010001100120013001400150016001700180019001A001B001C001D001E001F002000FEFFFFFF010000003A30000001 |
+-----------------------------------------------------------------------------------------------------------------------------------------------------------------------------------------------------------------------------------------------------------------+
|                                                                                                                                                                                                                                                              39 |
+-----------------------------------------------------------------------------------------------------------------------------------------------------------------------------------------------------------------------------------------------------------------+
select rb_and_cardinality_agg(x'01060400000000000000000000003A3000000200000000011F00FFFF010008000000590000000100020003000400050006000700080009000A000B000C000D000E000F0010001100120013001400150016001700180019001A001B001C001D001E001F002000FEFFFFFF010000003A30000001000000000000001000000000000A0000003A3000000100000000000000100000000700FFFFFFFF3A30000001000000FFFF020010000000FDFFFEFFFFFF');
+-----------------------------------------------------------------------------------------------------------------------------------------------------------------------------------------------------------------------------------------------------------------+
| rb_and_cardinality_agg(x'01060400000000000000000000003A3000000200000000011F00FFFF010008000000590000000100020003000400050006000700080009000A000B000C000D000E000F0010001100120013001400150016001700180019001A001B001C001D001E001F002000FEFFFFFF010000003A30000001 |
+-----------------------------------------------------------------------------------------------------------------------------------------------------------------------------------------------------------------------------------------------------------------+
|                                                                                                                                                                                                                                                              39 |
+-----------------------------------------------------------------------------------------------------------------------------------------------------------------------------------------------------------------------------------------------------------------+
select rb_and_cardinality_agg(x'01060400000000000000000000003A3000000200000000011F00FFFF0100180000000100020003000400050006000700080009000A000B000C000D000E000F0010001100120013001400150016001700180019001A001B001C001D001E001F002000FEFFFFFF010000003A30000001000000000000001000000000000A0000003A3000000100000000000000100000000700FFFFFFFF3A30000001000000FFFF020010000000FDFFFFFFFEFF');
ERROR HY000: Invalid data
select rb_and_cardinality_agg(x'01060400000000000000000000003A3000000200000000011F00FFFF010018000000580000000100020003000400050006000700080009000A000B000C000D000E000F0010001100120013001400150016001700180019001A001B001C001D001E001F002000FEFFFFFF010002003A30000001000000000000001000000000000A0000003A3000000100000000000000100000000700FFFFFFFF3A30000001000000FFFF020010000000FDFFFEFFFFFF');
+-----------------------------------------------------------------------------------------------------------------------------------------------------------------------------------------------------------------------------------------------------------------+
| rb_and_cardinality_agg(x'01060400000000000000000000003A3000000200000000011F00FFFF010018000000580000000100020003000400050006000700080009000A000B000C000D000E000F0010001100120013001400150016001700180019001A001B001C001D001E001F002000FEFFFFFF010002003A30000001 |
+-----------------------------------------------------------------------------------------------------------------------------------------------------------------------------------------------------------------------------------------------------------------+
|                                                                                                                                                                                                                                                              39 |
+-----------------------------------------------------------------------------------------------------------------------------------------------------------------------------------------------------------------------------------------------------------------+
select rb_and_cardinality_agg(x'01060400000000000000000000003A3000000200000000011F00FFFF010018000000580000000100020003000400050006000700090008000A000B000C000D000E000F0010001100120013001400150016001700180019001A001B001C001D001E001F002000FEFFFFFF010002003A10000001000000000000001000000000000A0000003A3000000100000000000000100000000700FFFFFFFF3A30000001000000FFFF020010000000FDFFFFFFFEFF');
ERROR HY000: Invalid data
select rb_and_cardinality_agg(x'01060400000000000000000000003A3000000200000000011F00FFFF010018000000580000000100020003000400050006000700090008000A000B000C000D000E000F0010001100120013001400150016001700180019001A001B001C001D001E001F002000FEFFFFFF010002003A30000000000000000000001000000000000A0000003A3000000100000000000000100000000700FFFFFFFF3A30000001000000FFFF020010000000FDFFFFFFFEFF');
ERROR HY000: Invalid data
select rb_and_cardinality_agg(x'01060400000000000000000000003A3000000200000000011F00FFFF010018000000580000000100020003000400050006000700080009000A000B000C000D000E000F0010001100120013001400150016001700180019001A001B001C001D001E001F002000FEFFFFFF010002003A30000002000000000000001000000000000A0000003A3000000100000000000000100000000700FFFFFFFF3A30000001000000FFFF020010000000FDFFFFFFFEFF');
ERROR HY000: Invalid data
select rb_and_cardinality_agg(x'01060400000000000000000000003A3000000200000000011F00FFFF010018000000580000000100020003000400050006000700080009000A000B000C000D000E000F0010001100120013001400150016001700180019001A001B001C001D001E001F002000FEFFFFFF010002003A30000001000000000000011000000000000A0000003A3000000100000000000000100000000700FFFFFFFF3A30000001000000FFFF020010000000FDFFFFFFFEFF');
ERROR HY000: Invalid data
select rb_and_cardinality_agg(x'01060400000000000000000000003A3000000200000000011F00FFFF010018000000580000000100020003000400050006000700080009000A000B000C000D000E000F0010001100120013001400150016001700180019001A001B001C001D001E001F002000FEFFFFFF010002003A30000001000000000000001000000000000A0000003A3000000200000000000000100000000700FFFFFFFF3A30000001000000FFFF020010000000FDFFFFFFFEFF');
ERROR HY000: Invalid data
select rb_and_cardinality_agg(x'01060400000000000000000000003A3000000200000000011F00FFFF010018000000580000000100020003000400050006000700080009000A000B000C000D000E000F0010001100120013001400150016001700180019001A001B001C001D001E001F002000FEFFFFFF010002003A30000001000000000000002000000000000A0000003A3000000100000000000000100000000700FFFFFFFF3A30000001000000FFFF020010000000FDFFFEFFFFFF');
+-----------------------------------------------------------------------------------------------------------------------------------------------------------------------------------------------------------------------------------------------------------------+
| rb_and_cardinality_agg(x'01060400000000000000000000003A3000000200000000011F00FFFF010018000000580000000100020003000400050006000700080009000A000B000C000D000E000F0010001100120013001400150016001700180019001A001B001C001D001E001F002000FEFFFFFF010002003A30000001 |
+-----------------------------------------------------------------------------------------------------------------------------------------------------------------------------------------------------------------------------------------------------------------+
|                                                                                                                                                                                                                                                              39 |
+-----------------------------------------------------------------------------------------------------------------------------------------------------------------------------------------------------------------------------------------------------------------+
select rb_and_cardinality_agg(x'01060400000000000000000000003A3000000200000000011F00FFFF010018000000580000000100020003000400050006000700080009000A000B000C000D000E000F0010001100120013001400150016001700180019001A001B001C001D001E001F002000FEFFFFFF010002003A30000001000000000000000000000000000A0000003A3000000100000000000000100000000700FFFFFFFF3A30000001000000FFFF020010000000FDFFFEFFFFFF');
+-----------------------------------------------------------------------------------------------------------------------------------------------------------------------------------------------------------------------------------------------------------------+
| rb_and_cardinality_agg(x'01060400000000000000000000003A3000000200000000011F00FFFF010018000000580000000100020003000400050006000700080009000A000B000C000D000E000F0010001100120013001400150016001700180019001A001B001C001D001E001F002000FEFFFFFF010002003A30000001 |
+-----------------------------------------------------------------------------------------------------------------------------------------------------------------------------------------------------------------------------------------------------------------+
|                                                                                                                                                                                                                                                              39 |
+-----------------------------------------------------------------------------------------------------------------------------------------------------------------------------------------------------------------------------------------------------------------+
select rb_and_cardinality_agg(x'01060400000000000000000000003A3000000200000000011F00FFFF010018000000580000000100020003000400050006000700080009000A000B000C000D000E000F0010001100120013001400150016001700180019001A001B001C001D001E001F002000FEFFFFFF010002003A30000001000000000000001000000000000A0000003A2000000100000000000000100000000700FFFFFFFF3A30000001000000FFFF020010000000FDFFFFFFFEFF');
ERROR HY000: Invalid data
select rb_and_cardinality_agg(x'01060400000000000000000000003A3000000200000000011F00FFFF010018000000580000000100020003000400050006000700080009000A000B000C000D000E000F0010001100120013001400150016001700180019001A001B001C001D001E001F002000FEFFFFFF010002003A30000001000000000000001000000000000A0000003A3000000200000000000000100000000700FFFFFFFF3A30000001000000FFFF020010000000FDFFFFFFFEFF');
ERROR HY000: Invalid data
select rb_and_cardinality_agg(x'01060400000000000000000000003A3000000200000000011F00FFFF010018000000580000000100020003000400050006000700080009000A000B000C000D000E000F0010001100120013001400150016001700180019001A001B001C001D001E001F002000FEFFFFFF010002003A30000001000000000000001000000000000A0000003A3000000100000000000001100000000700FFFFFFFF3A30000001000000FFFF020010000000FDFFFFFFFEFF');
ERROR HY000: Invalid data
select rb_and_cardinality_agg(x'01060400000000000000000000003A3000000200000000011F00FFFF010018000000580000000100020003000400050006000700080009000A000B000C000D000E000F0010001100120013001400150016001700180019001A001B001C001D001E001F002000FEFFFFFF010002003A30000001000000000000001000000000000A0000003A3000000100000000000000100000000700FFFFFFFF3A40000001000000FFFF020010000000FDFFFFFFFEFF');
ERROR HY000: Invalid data
select rb_and_cardinality_agg(x'01060400000000000000000000003A3000000200000000011F00FFFF010018000000580000000100020003000400050006000700080009000A000B000C000D000E000F0010001100120013001400150016001700180019001A001B001C001D001E001F002000FEFFFFFF010002003A30000001000000000000001000000000000A0000003A3000000100000000000000100000000700FFFFFFFF3A30000001000000FFFF010010000000FDFFFFFFFEFF');
ERROR HY000: Invalid data
select rb_and_cardinality_agg(x'01060400000000000000000000003A3000000200000000011F00FFFF010018000000580000000100020003000400050006000700080009000A000B000C000D000E000F0010001100120013001400150016001700180019001A001B001C001D001E001F002000FEFFFFFF010002003A30000001000000000000001000000000000A0000003A3000000100000000000000100000000700FFFFFFFF3A30000001000000FFFF010030000000FDFFFFFFFEFF');
ERROR HY000: Invalid data
select rb_and_cardinality_agg(x'01060400000000000000000000003A3000000200000000011F00FFFF010018000000580000000100020003000400050006000700080009000A000B000C000D000E000F0010001100120013001400150016001700180019001A001B001C001D001E001F002000FEFFFFFF010002003A30000001000000000000001000000000000A0000003A3000000100000000000000100000000700FFFFFFFF3A30000001000000FFFF020010000000FDFFFFFF');
ERROR HY000: Invalid data
select rb_and_cardinality_agg(x'01060100000000000000000000003b300000010000ffff0100fffe0f00');
+---------------------------------------------------------------------------------------+
| rb_and_cardinality_agg(x'01060100000000000000000000003b300000010000ffff0100fffe0f00') |
+---------------------------------------------------------------------------------------+
|                                                                                    16 |
+---------------------------------------------------------------------------------------+
select rb_and_cardinality_agg(x'01060100000000000000000000003b3000000100000f27010000000100');
+---------------------------------------------------------------------------------------+
| rb_and_cardinality_agg(x'01060100000000000000000000003b3000000100000f27010000000100') |
+---------------------------------------------------------------------------------------+
|                                                                                     2 |
+---------------------------------------------------------------------------------------+
select rb_and_cardinality_agg(x'01060200000000000000000000013b3000000100000f27010000000f00ffffffff3a30000001000000ffff000010000000ffff');
+-----------------------------------------------------------------------------------------------------------------------------------+
| rb_and_cardinality_agg(x'01060200000000000000000000013b3000000100000f27010000000f00ffffffff3a30000001000000ffff000010000000ffff') |
+-----------------------------------------------------------------------------------------------------------------------------------+
|                                                                                                                                17 |
+-----------------------------------------------------------------------------------------------------------------------------------+
select rb_and_cardinality_agg(x'01060200000000000000ffffffff3a30000001000000ffff000010000000ffff000000013b3000000100000f27010000000f00');
+-----------------------------------------------------------------------------------------------------------------------------------+
| rb_and_cardinality_agg(x'01060200000000000000ffffffff3a30000001000000ffff000010000000ffff000000013b3000000100000f27010000000f00') |
+-----------------------------------------------------------------------------------------------------------------------------------+
|                                                                                                                                17 |
+-----------------------------------------------------------------------------------------------------------------------------------+
select rb_and_cardinality_agg(x'01060300000000000000000000003b3000000100000f27010000000f27010000003b3000000100006300010000006300ffffffff3a30000001000000ffff000010000000ffff');
+-------------------------------------------------------------------------------------------------------------------------------------------------------------------------+
| rb_and_cardinality_agg(x'01060300000000000000000000003b3000000100000f27010000000f27010000003b3000000100006300010000006300ffffffff3a30000001000000ffff000010000000ffff') |
+-------------------------------------------------------------------------------------------------------------------------------------------------------------------------+
|                                                                                                                                                                   10101 |
+-------------------------------------------------------------------------------------------------------------------------------------------------------------------------+
select rb_and_cardinality_agg(x'01060300000000000000000000003b3000000110000f27010000000f27010000003b3000000100006300010000006300ffffffff3a30000001000000ffff000010000000ffff');
+-------------------------------------------------------------------------------------------------------------------------------------------------------------------------+
| rb_and_cardinality_agg(x'01060300000000000000000000003b3000000110000f27010000000f27010000003b3000000100006300010000006300ffffffff3a30000001000000ffff000010000000ffff') |
+-------------------------------------------------------------------------------------------------------------------------------------------------------------------------+
|                                                                                                                                                                   10101 |
+-------------------------------------------------------------------------------------------------------------------------------------------------------------------------+
select rb_and_cardinality_agg(x'01060300000000000000000000003b30000001a0000f27010000000f27010000003b3000000100006300010000006300ffffffff3a30000001000000ffff000010000000ffff');
+-------------------------------------------------------------------------------------------------------------------------------------------------------------------------+
| rb_and_cardinality_agg(x'01060300000000000000000000003b30000001a0000f27010000000f27010000003b3000000100006300010000006300ffffffff3a30000001000000ffff000010000000ffff') |
+-------------------------------------------------------------------------------------------------------------------------------------------------------------------------+
|                                                                                                                                                                   10101 |
+-------------------------------------------------------------------------------------------------------------------------------------------------------------------------+
select rb_and_cardinality_agg(x'01060300000000000000ffffffff3a30000001000000ffff000010000000ffff000000003b30000001a0000f27010000000f27010000003b3000000100006300010000006300');
+-------------------------------------------------------------------------------------------------------------------------------------------------------------------------+
| rb_and_cardinality_agg(x'01060300000000000000ffffffff3a30000001000000ffff000010000000ffff000000003b30000001a0000f27010000000f27010000003b3000000100006300010000006300') |
+-------------------------------------------------------------------------------------------------------------------------------------------------------------------------+
|                                                                                                                                                                   10101 |
+-------------------------------------------------------------------------------------------------------------------------------------------------------------------------+
select rb_and_cardinality_agg(x'00060100000000000000000000003b3000000100000f27010000000100');
ERROR HY000: Invalid data
select rb_and_cardinality_agg(x'02060100000000000000000000003b3000000100000f27010000000100');
ERROR HY000: Invalid data
select rb_and_cardinality_agg(x'01000100000000000000000000003b3000000100000f27010000000100');
ERROR HY000: Invalid data
select rb_and_cardinality_agg(x'01010100000000000000000000003b3000000100000f27010000000100');
ERROR HY000: Invalid data
select rb_and_cardinality_agg(x'01020100000000000000000000003b3000000100000f27010000000100');
ERROR HY000: Invalid data
select rb_and_cardinality_agg(x'01030100000000000000000000003b3000000100000f27010000000100');
ERROR HY000: Invalid data
select rb_and_cardinality_agg(x'01040100000000000000000000003b3000000100000f27010000000100');
ERROR HY000: Invalid data
select rb_and_cardinality_agg(x'01050100000000000000000000003b3000000100000f27010000000100');
ERROR HY000: Invalid data
select rb_and_cardinality_agg(x'01070100000000000000000000003b3000000100000f27010000000100');
ERROR HY000: Invalid data
select rb_and_cardinality_agg(x'010100000000000000000000003b3000000100000f27010000000100');
ERROR HY000: Invalid data
select rb_and_cardinality_agg(x'0100000000000000000000003b3000000100000f27010000000100');
ERROR HY000: Invalid data
select rb_and_cardinality_agg(x'01060200000000000000000000003b3000000100000f27010000000100');
ERROR HY000: Invalid data
select rb_and_cardinality_agg(x'01060000000000000000000000003b3000000100000f27010000000100');
ERROR HY000: Invalid data
select rb_and_cardinality_agg(x'01060100000000000000000000003b3000000100000f27010000000100');
+---------------------------------------------------------------------------------------+
| rb_and_cardinality_agg(x'01060100000000000000000000003b3000000100000f27010000000100') |
+---------------------------------------------------------------------------------------+
|                                                                                     2 |
+---------------------------------------------------------------------------------------+
select rb_and_cardinality_agg(x'0106000000003b3000000100000f27010000000100');
ERROR HY000: Invalid data
select rb_and_cardinality_agg(x'01060100000000000000000000103a3000000100000f27010000000100');
ERROR HY000: Invalid data
select rb_and_cardinality_agg(x'010601000000000000000000001000000100000f27010000000100');
ERROR HY000: Invalid data
select rb_and_cardinality_agg(x'01060100000000000000000000003b3001000100000f27010000000100');
ERROR HY000: Invalid data
select rb_and_cardinality_agg(x'01060100000000000000000000003b300100000f27010000000100');
ERROR HY000: Invalid data
select rb_and_cardinality_agg(x'01060100000000000000000000003b3000000200000f27010000000100');
ERROR HY000: Invalid data
select rb_and_cardinality_agg(x'01060100000000000000000000003b3000000000000f27010000000100');
ERROR HY000: Invalid data
select rb_and_cardinality_agg(x'01060100000000000000000000003b30000000000f27010000000100');
ERROR HY000: Invalid data
select rb_and_cardinality_agg(x'01060100000000000000000000003b300000010f27010000000100');
ERROR HY000: Invalid data
select rb_and_cardinality_agg(x'01060100000000000000000000003b3000000100020f27010000000100');
+---------------------------------------------------------------------------------------+
| rb_and_cardinality_agg(x'01060100000000000000000000003b3000000100020f27010000000100') |
+---------------------------------------------------------------------------------------+
|                                                                                     2 |
+---------------------------------------------------------------------------------------+
select rb_and_cardinality_agg(x'01060100000000000000000000003b3000000100020000010000000100');
+---------------------------------------------------------------------------------------+
| rb_and_cardinality_agg(x'01060100000000000000000000003b3000000100020000010000000100') |
+---------------------------------------------------------------------------------------+
|                                                                                     2 |
+---------------------------------------------------------------------------------------+
select rb_and_cardinality_agg(x'01060100000000000000000000003b3000000100020000020000000100');
ERROR HY000: Invalid data
select rb_and_cardinality_agg(x'01060100000000000000000000003b300000010002000002000000010000100100');
+-----------------------------------------------------------------------------------------------+
| rb_and_cardinality_agg(x'01060100000000000000000000003b300000010002000002000000010000100100') |
+-----------------------------------------------------------------------------------------------+
|                                                                                             4 |
+-----------------------------------------------------------------------------------------------+
select rb_and_cardinality_agg(x'01060100000000000000000000003b300000010002000003000000010000000100');
ERROR HY000: Invalid data
select rb_and_cardinality_agg(x'01060100000000000000000000003b300000010002000001000000010000000100');
ERROR HY000: Invalid data
select rb_and_cardinality_agg(x'01060100000000000000000000003b30000001000001000000010000000100');
ERROR HY000: Invalid data
select rb_and_cardinality_agg(x'01060100000000000000000000003b30000001000200000200000001000000');
ERROR HY000: Invalid data
select rb_and_cardinality_agg(x'01060100000000000000000000003b300000010002000001000000');
ERROR HY000: Invalid data
select rb_and_cardinality_agg(x'01060100000000000000000000003b30000001000200000100000001g0');
ERROR 42000: You have an error in your SQL syntax; check the manual that corresponds to your OceanBase version for the right syntax to use near ''01060100000000000000000000003b30000001000200000100000001g0')' at line 1
select rb_and_cardinality_agg(x'01060100000000000000000000003b3000000100020000010000000100 ');
ERROR 42000: You have an error in your SQL syntax; check the manual that corresponds to your OceanBase version for the right syntax to use near ''01060100000000000000000000003b3000000100020000010000000100 ')' at line 1
select rb_and_cardinality_agg(rb_from_string('1,1'));
+-----------------------------------------------+
| rb_and_cardinality_agg(rb_from_string('1,1')) |
+-----------------------------------------------+
|                                             1 |
+-----------------------------------------------+
select rb_and_cardinality_agg(rb_from_string('-2,9223372036854775808,9223372036854775809,9223372036854775810,9223372036854775811,9223372036854775812,9223372036854775813,9223372036854775814,9223372036854775815
,9223372036854775816,9223372036854775817,9223372036854775818,9223372036854775819,9223372036854775820,9223372036854775821,9223372036854775822,9223372036854775823,9223372036854775824
,9223372036854775825,9223372036854775826,9223372036854775827,9223372036854775828,9223372036854775829,9223372036854775830,9223372036854775831,9223372036854775832,9223372036854775833
,9223372036854775834,9223372036854775835,9223372036854775836,9223372036854775837,9223372036854775838,9223372036854775839,9223372036854775840,9223372036854775841
,9223372036854775842,9223372036854775843,9223372036854775844,9223372036854775845,9223372036854775846,9223372036854775847,9223372036854775848,9223372036854775849,9223372036854775850'));
+-----------------------------------------------------------------------------------------------------------------------------------------------------------------------------------------------------------------------------------------------------------------+
| rb_and_cardinality_agg(rb_from_string('-2,9223372036854775808,9223372036854775809,9223372036854775810,9223372036854775811,9223372036854775812,9223372036854775813,9223372036854775814,9223372036854775815
,9223372036854775816,9223372036854775817,922337203685 |
+-----------------------------------------------------------------------------------------------------------------------------------------------------------------------------------------------------------------------------------------------------------------+
|                                                                                                                                                                                                                                                              44 |
+-----------------------------------------------------------------------------------------------------------------------------------------------------------------------------------------------------------------------------------------------------------------+
select rb_and_cardinality_agg(rb_build(array_range(2000000)));
+--------------------------------------------------------+
| rb_and_cardinality_agg(rb_build(array_range(2000000))) |
+--------------------------------------------------------+
|                                                2000000 |
+--------------------------------------------------------+
select rb_and_cardinality_agg(null);
+------------------------------+
| rb_and_cardinality_agg(null) |
+------------------------------+
|                         NULL |
+------------------------------+
select rb_and_cardinality_agg(1);
ERROR HY000: invalid type given for an argument
select rb_and_cardinality_agg('test');
ERROR HY000: invalid type given for an argument
select rb_and_cardinality_agg(0x12232);
ERROR HY000: Invalid data
select rb_and_cardinality_agg(true);
ERROR HY000: invalid type given for an argument
select rb_and_cardinality_agg(false);
ERROR HY000: invalid type given for an argument
select rb_and_cardinality_agg(b'11');
ERROR HY000: Invalid data
select rb_and_cardinality_agg(false);
ERROR HY000: invalid type given for an argument
select rb_and_cardinality_agg([1,2,3,4]);
ERROR HY000: invalid type given for an argument
select rb_and_cardinality_agg([1,2,3,4]);
ERROR HY000: invalid type given for an argument
drop table if EXISTS tt3;
Warnings:
Note	1051	Unknown table 'oblrp.tt3'
create table tt3(id int primary key,v vector(2),s sparsevector,a array(varchar(20)));
insert into tt3 values(1,[1,2],map(1,3),['test']);
select rb_and_cardinality_agg(v) from tt3;
ERROR HY000: invalid type given for an argument
select rb_and_cardinality_agg(s) from tt3;
ERROR HY000: invalid type given for an argument
select rb_and_cardinality_agg(a) from tt3;
ERROR HY000: invalid type given for an argument
drop table if exists tt3;
create table tt3(id int, r roaringbitmap);
drop view if exists vtt3;
Warnings:
Note	1051	Unknown table 'oblrp.vtt3'
create view vtt3 as select * from tt3;
insert into tt3 values(0,rb_build_empty());
insert into tt3 values(-1,rb_build_empty());
insert into tt3 values(1,rb_from_string('4294967295'));
insert into tt3 values(2,rb_from_string('1000'));
insert into tt3 values(3,rb_from_string('4294967296'));
insert into tt3 values(4,rb_from_string('4294967297'));
insert into tt3 values(40,rb_from_string('4294967296'));
insert into tt3 values(41,rb_from_string('4294967295'));
insert into tt3 values(5,rb_from_string('4294967295,655555,1,2,3,4,6,7,8'));
insert into tt3 values(6,rb_from_string('4294967295,655555,1,2,3,4,6,7,8,4294967294'));
insert into tt3 values(7,rb_from_string('18446744073709551615,9223372036854775806,9223372036854775807,1,2,3,4,6,7,8'));
insert into tt3 values(8,rb_from_string('18446744073709551615,9223372036854775807,9223372036854775808,9223372036854775809'));
insert into tt3 values(9,rb_from_string('4294967295,655555,1,2,3,4,5,6,7,8,9,10,11,12,13,14,15,16,17,18,19,20,21,22,23,24,25,26,27,28,29,30,31,32'));
insert into tt3 values(10,rb_build(array_range(655555,655595)));
insert into tt3 values(11,rb_from_string('18446744073709551615,9223372036854775803,9223372036854775807,655556,1,2,3,4,5,6,7,8,9,10,11,12,13,14,15,16,17,18,19,20,21,22,23,24,25,26,27,28,29,30,31,32'));
insert into tt3 values(12,rb_build(array_range(4294967296,4294967396)));
insert into tt3 values(13,0x01060300000000000000000000003b3001000100002000f36d0100010000002000607f677f010000003b30000001000002000100000002002a0000003a300000010000001df300001000000061c4);
insert into tt3 values(14,0x01060300000000000000000000003b3001000100002000f36d0100010000002000607f677f010000003b30000001000002000100000002002a0000003a300000010000001df300001000000061c4);
insert into tt3 values(15,0x01053b3001000100002000f36d0100010000002000607f677f);
insert into tt3 values(16,0x01053b3001000100002000f36d0100010000002000607f677f);
insert into tt3 values(17,null);
insert into tt3(id) values(18);
insert into tt3 values(19,0x01053A3000000100000000002000100000000100020003000400050006000700080009000A000B000C000D000E000F0010001100120013001400150016001700180019001A001B001C001D001E001F0020002100);
select rb_and_cardinality_agg(tt3.r) from tt3;
+-------------------------------+
| rb_and_cardinality_agg(tt3.r) |
+-------------------------------+
|                             0 |
+-------------------------------+
select rb_and_cardinality_agg(tt3.r) from tt3 where id in (1,17);
+-------------------------------+
| rb_and_cardinality_agg(tt3.r) |
+-------------------------------+
|                             1 |
+-------------------------------+
select rb_and_cardinality_agg(tt3.r) from tt3 where id in (0,-1);
+-------------------------------+
| rb_and_cardinality_agg(tt3.r) |
+-------------------------------+
|                             0 |
+-------------------------------+
select rb_and_cardinality_agg(tt3.r) from tt3 where id in (0,1);
+-------------------------------+
| rb_and_cardinality_agg(tt3.r) |
+-------------------------------+
|                             0 |
+-------------------------------+
select rb_and_cardinality_agg(tt3.r) from tt3 where id in (1,41);
+-------------------------------+
| rb_and_cardinality_agg(tt3.r) |
+-------------------------------+
|                             1 |
+-------------------------------+
drop table if exists tt3;
create table tt3(id int, r roaringbitmap);
drop view if exists vtt3;
create view vtt3 as select * from tt3;
insert into tt3 values(0,rb_from_string('32'));
insert into tt3 values(1,rb_from_string('1,32'));
insert into tt3 values(2,rb_from_string('32'));
insert into tt3 values(2,rb_from_string('4294967295,6736467,4294967296,33,32'));
insert into tt3 values(2,rb_from_string('4294967296,6736467,3432,32,1834'));
insert into tt3 values(2,0x01053A3000000300000000001F000A000000FFFF00002000000060000000620000000100020003000400050006000700080009000A000B000C000D000E000F0010001100120013001400150016001700180019001A001B001C001D001E001F002000C300FFFF);
insert into tt3 values(0,0x01053b3001000100002000f36d0100010000002000607f677f);
select rb_and_cardinality_agg(r) from tt3;
+---------------------------+
| rb_and_cardinality_agg(r) |
+---------------------------+
|                         1 |
+---------------------------+
select rb_and_cardinality_agg(r) from vtt3;
+---------------------------+
| rb_and_cardinality_agg(r) |
+---------------------------+
|                         1 |
+---------------------------+
insert into tt3 values(0,rb_from_string('9223372036854775807'));
select rb_and_cardinality_agg(r) from tt3;
+---------------------------+
| rb_and_cardinality_agg(r) |
+---------------------------+
|                         0 |
+---------------------------+
select rb_and_cardinality_agg(r) from vtt3;
+---------------------------+
| rb_and_cardinality_agg(r) |
+---------------------------+
|                         0 |
+---------------------------+
delete from tt3;
insert into tt3 values(0,rb_from_string('1844674407'));
insert into tt3 values(1,rb_from_string('1,32,1844674407'));
insert into tt3 values(2,rb_from_string('1844674407'));
insert into tt3 values(2,rb_from_string('4294967295,6736467,4294967296,33,32,1844674407'));
insert into tt3 values(2,rb_from_string('4294967296,6736467,1844674407,3432,32,1834'));
insert into tt3 values(2,0x01053A3000000400000000001F000A000000F36D0000FFFF000028000000680000006A0000006C0000000100020003000400050006000700080009000A000B000C000D000E000F0010001100120013001400150016001700180019001A001B001C001D001E001F002000C300677FFFFF);
insert into tt3 values(0,0x01053b3001000100002000f36d0100010000002000607f677f);
select rb_and_cardinality_agg(r) from tt3;
+---------------------------+
| rb_and_cardinality_agg(r) |
+---------------------------+
|                         1 |
+---------------------------+
select rb_and_cardinality_agg(r) from vtt3;
+---------------------------+
| rb_and_cardinality_agg(r) |
+---------------------------+
|                         1 |
+---------------------------+
insert into tt3 values(0,rb_from_string('32'));
select rb_and_cardinality_agg(r) from tt3;
+---------------------------+
| rb_and_cardinality_agg(r) |
+---------------------------+
|                         0 |
+---------------------------+
select rb_and_cardinality_agg(r) from vtt3;
+---------------------------+
| rb_and_cardinality_agg(r) |
+---------------------------+
|                         0 |
+---------------------------+
delete from tt3;
insert into tt3 values(1,rb_from_string('1,32,1844674407'));
insert into tt3 values(2,rb_from_string('4294967295,6736467,4294967296,33,32,1844674407'));
insert into tt3 values(2,rb_from_string('4294967296,6736467,1844674407,3432,32,1834'));
insert into tt3 values(2,0x01053A3000000400000000001F000A000000F36D0000FFFF000028000000680000006A0000006C0000000100020003000400050006000700080009000A000B000C000D000E000F0010001100120013001400150016001700180019001A001B001C001D001E001F002000C300677FFFFF);
insert into tt3 values(0,0x01053b3001000100002000f36d0100010000002000607f677f);
insert into tt3 values(0,rb_from_string('4294967296,655555,1,2,3,4,5,6,7,8,9,10,11,12,13,14,15,16,17,18,19,20,21,22,23,24,25,26,27,28,29,30,31,32,1844674407'));
select rb_and_cardinality_agg(r) from tt3;
+---------------------------+
| rb_and_cardinality_agg(r) |
+---------------------------+
|                         2 |
+---------------------------+
select rb_and_cardinality_agg(r) from vtt3;
+---------------------------+
| rb_and_cardinality_agg(r) |
+---------------------------+
|                         2 |
+---------------------------+
insert into tt3 values(0,rb_from_string('254451,836748263'));
select rb_and_cardinality_agg(r) from tt3;
+---------------------------+
| rb_and_cardinality_agg(r) |
+---------------------------+
|                         0 |
+---------------------------+
select rb_and_cardinality_agg(r) from vtt3;
+---------------------------+
| rb_and_cardinality_agg(r) |
+---------------------------+
|                         0 |
+---------------------------+
delete from tt3;
insert into tt3 values(1,rb_from_string('1,32,1844674407,9223372036854775807,18446744073709551615'));
insert into tt3 values(2,rb_from_string('4294967295,6736467,4294967296,33,32,1844674407,9223372036854775807,18446744073709551615'));
insert into tt3 values(0,rb_from_string('4294967296,655555,1,2,3,4,5,6,7,8,9,10,11,12,13,14,15,16,17,18,19,20,21,22,23,24,25,26,27,28,29,30,31,32,1844674407,32,1844674407,9223372036854775807,18446744073709551615'));
select rb_and_cardinality_agg(r) from tt3;
+---------------------------+
| rb_and_cardinality_agg(r) |
+---------------------------+
|                         4 |
+---------------------------+
select rb_and_cardinality_agg(r) from vtt3;
+---------------------------+
| rb_and_cardinality_agg(r) |
+---------------------------+
|                         4 |
+---------------------------+
insert into tt3 values(0,rb_from_string('254451,18446744073709551615'));
select rb_and_cardinality_agg(r) from tt3;
+---------------------------+
| rb_and_cardinality_agg(r) |
+---------------------------+
|                         1 |
+---------------------------+
select rb_and_cardinality_agg(r) from vtt3;
+---------------------------+
| rb_and_cardinality_agg(r) |
+---------------------------+
|                         1 |
+---------------------------+
insert into tt3 values(0,0x01053b3001000100002000f36d0100010000002000607f677f);
insert into tt3 values(2,0x01053A3000000400000000001F000A000000F36D0000FFFF000028000000680000006A0000006C0000000100020003000400050006000700080009000A000B000C000D000E000F0010001100120013001400150016001700180019001A001B001C001D001E001F002000C300677FFFFF);
select rb_and_cardinality_agg(r) from tt3;
+---------------------------+
| rb_and_cardinality_agg(r) |
+---------------------------+
|                         0 |
+---------------------------+
select rb_and_cardinality_agg(r) from vtt3;
+---------------------------+
| rb_and_cardinality_agg(r) |
+---------------------------+
|                         0 |
+---------------------------+
truncate tt3;
insert into tt3 values(1,0x01053A3000000400000000001F000A000000F36D0000FFFF000028000000680000006A0000006C0000000100020003000400050006000700080009000A000B000C000D000E000F0010001100120013001400150016001700180019001A001B001C001D001E001F002000C300677FFFFF);
insert into tt3 values(2,0x01053A3000000400000000001F000A000000F36D0000FFFF000028000000680000006A0000006C0000000100020003000400050006000700080009000A000B000C000D000E000F0010001100120013001400150016001700180019001A001B001C001D001E001F002000C300677FFFFF);
insert into tt3 values(3,0x01053A3000000400000000001e000A000000F36D0000FFFF000028000000680000006A0000006C0000000100020003000400050006000700080009000A000B000C000D000E000F0010001100120013001400150016001700180019001A001B001C001D001E001F002000C300677F);
select rb_and_cardinality_agg(r) from tt3 where id in(1,2);
+---------------------------+
| rb_and_cardinality_agg(r) |
+---------------------------+
|                        35 |
+---------------------------+
select rb_and_cardinality_agg(r) from vtt3 where id in(3);
+---------------------------+
| rb_and_cardinality_agg(r) |
+---------------------------+
|                        34 |
+---------------------------+
select rb_and_cardinality_agg(r) from vtt3;
+---------------------------+
| rb_and_cardinality_agg(r) |
+---------------------------+
|                        31 |
+---------------------------+
insert into tt3 values(4,0x01053b3001000100002000f36d0100010000002000607f677f);
select rb_and_cardinality_agg(r) from tt3;
+---------------------------+
| rb_and_cardinality_agg(r) |
+---------------------------+
|                        31 |
+---------------------------+
insert into tt3 values(4,0x01053b3001000100002000f36d0100010000002000607f677f);
select rb_and_cardinality_agg(r) from tt3;
+---------------------------+
| rb_and_cardinality_agg(r) |
+---------------------------+
|                        31 |
+---------------------------+
insert into tt3 values(4,rb_from_string('4294967296,655555,1,2,3,4,5,6,1000,7998978,11,12,13,14,15,16,170,180,19,20,21,22,23,24,25,26,27,28,29,30,31,32,1844674407,32,1844674407,9223372036854775807,18446744073709551615'));
select rb_and_cardinality_agg(r) from tt3;
+---------------------------+
| rb_and_cardinality_agg(r) |
+---------------------------+
|                        25 |
+---------------------------+
delete from tt3;
insert into tt3 values(4,0x01053b3001000100002000f36d0100010000002000607f677f);
insert into tt3 values(4,rb_to_varbinary(rb_from_string('4294967295,655555,1,2,3,4,5,6,7,8,9,10,11,12,13,14,15,16,17,18,19,20,21,22,23,24,7877825,26,27,28,29,30,31,32,1844674407,5654,454874'),'roaring'));
select *,rb_and_cardinality_agg(r) from tt3;
+------+---------------------------------------+---------------------------+
| id   | r                                     | rb_and_cardinality_agg(r) |
+------+---------------------------------------+---------------------------+
|    4 |            ;0     Ûm      `g  |                        32 |
+------+---------------------------------------+---------------------------+
select rb_and_cardinality_agg(r) ,* from vtt3;
+---------------------------+------+---------------------------------------+
| rb_and_cardinality_agg(r) | id   | r                                     |
+---------------------------+------+---------------------------------------+
|                        32 |    4 |            ;0     Ûm      `g  |
+---------------------------+------+---------------------------------------+
insert into tt3 values(4,0x01053b3001000100002000f36d0100010002002000607e677f);
select *,rb_and_cardinality_agg(r) from tt3;
+------+---------------------------------------+---------------------------+
| id   | r                                     | rb_and_cardinality_agg(r) |
+------+---------------------------------------+---------------------------+
|    4 |            ;0     Ûm      `g  |                        31 |
+------+---------------------------------------+---------------------------+
insert into tt3 values(4,rb_from_string('4294967296,655555,1,2,3,4,1000,7998978,11,12,13,14,15,16,170,180,19,20,21,22,23,24,25,26,27,28,29,30,31,32,1844674407,32,1844674407,9223372036854775807,18446744073709551615'));
select *,rb_and_cardinality_agg(r) from tt3;
+------+---------------------------------------+---------------------------+
| id   | r                                     | rb_and_cardinality_agg(r) |
+------+---------------------------------------+---------------------------+
|    4 |            ;0     Ûm      `g  |                        23 |
+------+---------------------------------------+---------------------------+
insert into tt3 values(4,0x01053b3001000100002000f36d0100010002002000607e677f);
select *,rb_and_cardinality_agg(r) from tt3;
+------+---------------------------------------+---------------------------+
| id   | r                                     | rb_and_cardinality_agg(r) |
+------+---------------------------------------+---------------------------+
|    4 |            ;0     Ûm      `g  |                        23 |
+------+---------------------------------------+---------------------------+
insert into tt3 values(4,0x01060300000000000000ffffffff3a30000001000000ffff000010000000ffff000000003b3000000100000f27010000000f27010000003b3000000100006300010000006300);
select *,rb_and_cardinality_agg(r) from tt3;
+------+---------------------------------------+---------------------------+
| id   | r                                     | rb_and_cardinality_agg(r) |
+------+---------------------------------------+---------------------------+
|    4 |            ;0     Ûm      `g  |                        22 |
+------+---------------------------------------+---------------------------+
insert into tt3 values(4,0x01060100000000000000000000003b3000000100000f2701000e001f00);
select *,rb_and_cardinality_agg(r) from tt3;
+------+---------------------------------------+---------------------------+
| id   | r                                     | rb_and_cardinality_agg(r) |
+------+---------------------------------------+---------------------------+
|    4 |            ;0     Ûm      `g  |                        16 |
+------+---------------------------------------+---------------------------+
insert into tt3 values(4,rb_from_string(''));
select *,rb_and_cardinality_agg(r) from tt3;
+------+---------------------------------------+---------------------------+
| id   | r                                     | rb_and_cardinality_agg(r) |
+------+---------------------------------------+---------------------------+
|    4 |            ;0     Ûm      `g  |                         0 |
+------+---------------------------------------+---------------------------+
delete from tt3;
insert into tt3 values(4,rb_from_string('4294967296,655555,1,2,3,4,1000,7998978,11,12,13,14,15,16,170,180,19,20,21,22,23,24,25,26,27,28,29,30,31,32,1844674407,32,1844674407,9223372036854775807,18446744073709551615'));
select *,rb_and_cardinality_agg(r) from tt3;
+------+--------------------------------------------------------------------------------------------------------------------------------------------------------------------------------------+---------------------------+
| id   | r                                                                                                                                                                                    | rb_and_cardinality_agg(r) |
+------+--------------------------------------------------------------------------------------------------------------------------------------------------------------------------------------+---------------------------+
|    4 |            :0        
   z   Ûm  (   ^   `   b                            ™ ¥ Ë√ g   :0              ˇˇˇ:0     ˇˇ     ˇˇˇˇˇˇ:0     ˇˇ     ˇˇ                     |                        33 |
+------+--------------------------------------------------------------------------------------------------------------------------------------------------------------------------------------+---------------------------+
insert into tt3 values(4,rb_from_string('4294967296,655555,1,2,3,4,1000,7998978,11,12,13,14,15,180,19,20,21,22,23,24,25,26,27,28,29,30,31,32,1844674407,32,1844674407,18446744073709551615'));
select *,rb_and_cardinality_agg(r) from tt3;
+------+--------------------------------------------------------------------------------------------------------------------------------------------------------------------------------------+---------------------------+
| id   | r                                                                                                                                                                                    | rb_and_cardinality_agg(r) |
+------+--------------------------------------------------------------------------------------------------------------------------------------------------------------------------------------+---------------------------+
|    4 |            :0        
   z   Ûm  (   ^   `   b                            ™ ¥ Ë√ g   :0              ˇˇˇ:0     ˇˇ     ˇˇˇˇˇˇ:0     ˇˇ     ˇˇ                     |                        30 |
+------+--------------------------------------------------------------------------------------------------------------------------------------------------------------------------------------+---------------------------+
insert into tt3 values(4,0x01060300000000000000ffffffff3a30000001000000ffff000010000000ffff000000003b3000000100000f27010000000f27010000003b3000000100006300010000006300);
select *,rb_and_cardinality_agg(r) from tt3;
+------+--------------------------------------------------------------------------------------------------------------------------------------------------------------------------------------+---------------------------+
| id   | r                                                                                                                                                                                    | rb_and_cardinality_agg(r) |
+------+--------------------------------------------------------------------------------------------------------------------------------------------------------------------------------------+---------------------------+
|    4 |            :0        
   z   Ûm  (   ^   `   b                            ™ ¥ Ë√ g   :0              ˇˇˇ:0     ˇˇ     ˇˇˇˇˇˇ:0     ˇˇ     ˇˇ                     |                        27 |
+------+--------------------------------------------------------------------------------------------------------------------------------------------------------------------------------------+---------------------------+
insert into tt3 values(4,0x01060100000000000000000000003b3000000100000f2701000e001f00);
select *,rb_and_cardinality_agg(r) from tt3;
+------+--------------------------------------------------------------------------------------------------------------------------------------------------------------------------------------+---------------------------+
| id   | r                                                                                                                                                                                    | rb_and_cardinality_agg(r) |
+------+--------------------------------------------------------------------------------------------------------------------------------------------------------------------------------------+---------------------------+
|    4 |            :0        
   z   Ûm  (   ^   `   b                            ™ ¥ Ë√ g   :0              ˇˇˇ:0     ˇˇ     ˇˇˇˇˇˇ:0     ˇˇ     ˇˇ                     |                        16 |
+------+--------------------------------------------------------------------------------------------------------------------------------------------------------------------------------------+---------------------------+
insert into tt3 values(4,rb_from_string('4294967296,655555,1,2,3,4,1000,7998978,11,12,13,14,15,180,19,20,2125,26,27,28,29,30,31,32,1844674407,32,1844674407'));
select *,rb_and_cardinality_agg(r) from tt3;
+------+--------------------------------------------------------------------------------------------------------------------------------------------------------------------------------------+---------------------------+
| id   | r                                                                                                                                                                                    | rb_and_cardinality_agg(r) |
+------+--------------------------------------------------------------------------------------------------------------------------------------------------------------------------------------+---------------------------+
|    4 |            :0        
   z   Ûm  (   ^   `   b                            ™ ¥ Ë√ g   :0              ˇˇˇ:0     ˇˇ     ˇˇˇˇˇˇ:0     ˇˇ     ˇˇ                     |                        11 |
+------+--------------------------------------------------------------------------------------------------------------------------------------------------------------------------------------+---------------------------+
insert into tt3 values(4,rb_from_string('4294967296,655555,1,2,3,4,1000'));
select rb_and_cardinality_agg(r) from tt3;
+---------------------------+
| rb_and_cardinality_agg(r) |
+---------------------------+
|                         0 |
+---------------------------+
delete from tt3;
insert into tt3 values(4,0x01060300000000000000ffffffff3a30000001000000ffff000010000000ffff000000003b3000000100000f27010000000f27010000003b3000000100006300010000006300);
select rb_and_cardinality_agg(r) from tt3;
+---------------------------+
| rb_and_cardinality_agg(r) |
+---------------------------+
|                     10101 |
+---------------------------+
insert into tt3 values(4,0x01060100000000000000000000003b3000000100000f2701000e001f00);
select rb_and_cardinality_agg(r) from tt3;
+---------------------------+
| rb_and_cardinality_agg(r) |
+---------------------------+
|                        32 |
+---------------------------+
insert into tt3 values(4,0x01060100000000000000000000003b3000000100000f2701000e001f00);
select rb_and_cardinality_agg(r) from tt3;
+---------------------------+
| rb_and_cardinality_agg(r) |
+---------------------------+
|                        32 |
+---------------------------+
insert into tt3 values(4,0x01060100000000000000000000003b3000000100000f2701001f002f00);
select rb_and_cardinality_agg(r) from tt3;
+---------------------------+
| rb_and_cardinality_agg(r) |
+---------------------------+
|                        15 |
+---------------------------+
delete from tt3;
insert into tt3 values(4,rb_build(array_range(2000000)));
select rb_and_cardinality_agg(r) from vtt3;
+---------------------------+
| rb_and_cardinality_agg(r) |
+---------------------------+
|                   2000000 |
+---------------------------+
insert into tt3 values(4,rb_build(array_range(100,2000000)));
select rb_and_cardinality_agg(r) from tt3;
+---------------------------+
| rb_and_cardinality_agg(r) |
+---------------------------+
|                   1999900 |
+---------------------------+
insert into tt3 values(4,rb_build(array_range(10000,2000000,20)));
select rb_and_cardinality_agg(r) from tt3;
+---------------------------+
| rb_and_cardinality_agg(r) |
+---------------------------+
|                     99500 |
+---------------------------+
select rb_and_cardinality_agg(rb_build(array_range(2000000)));
+--------------------------------------------------------+
| rb_and_cardinality_agg(rb_build(array_range(2000000))) |
+--------------------------------------------------------+
|                                                2000000 |
+--------------------------------------------------------+
select rb_and_cardinality_agg(rb_build(array_range(2000000,4000000)));
+----------------------------------------------------------------+
| rb_and_cardinality_agg(rb_build(array_range(2000000,4000000))) |
+----------------------------------------------------------------+
|                                                        2000000 |
+----------------------------------------------------------------+
select rb_and_cardinality_agg(rb_build(array_range(0)));
+--------------------------------------------------+
| rb_and_cardinality_agg(rb_build(array_range(0))) |
+--------------------------------------------------+
|                                                0 |
+--------------------------------------------------+
drop table if exists tt3;
create table tt3(id int, r roaringbitmap)PARTITION BY HASH (id)PARTITIONS 4;
insert into tt3 values(1,rb_build(array_range(2000000)));
insert into tt3 values(1,rb_build(array_range(2000000)));
select  rb_and_cardinality_agg(r) from tt3;
+---------------------------+
| rb_and_cardinality_agg(r) |
+---------------------------+
|                   2000000 |
+---------------------------+
insert into tt3 values(1,rb_build(array_range(2000000,4000000)));
insert into tt3 values(1,rb_build(array_range(4000000,6000000)));
insert into tt3 values(1,rb_build(array_range(6000000,8000000)));
insert into tt3 values(1,rb_build(array_range(8000000,10000000)));
insert into tt3 values(1,rb_build(array_range(10000000,12000000)));
insert into tt3 values(1,rb_build(array_range(4294967296,4296967296)));
insert into tt3 values(1,null);
select  rb_and_cardinality_agg(r) from tt3;
+---------------------------+
| rb_and_cardinality_agg(r) |
+---------------------------+
|                         0 |
+---------------------------+
drop table if exists tt3;
create table tt3(id int, a roaringbitmap);
select rb_and_cardinality_agg(a) from tt3;
+---------------------------+
| rb_and_cardinality_agg(a) |
+---------------------------+
|                      NULL |
+---------------------------+
insert into tt3 values(1,null);
select rb_and_cardinality_agg(a) from tt3;
+---------------------------+
| rb_and_cardinality_agg(a) |
+---------------------------+
|                      NULL |
+---------------------------+
drop table if exists tt3;
create table tt3(id int, a int[]);
select rb_and_cardinality_agg(a) from tt3;
ERROR HY000: invalid type given for an argument
insert into tt3 values(1,[1,2,3]);
select rb_and_cardinality_agg(a) from tt3;
ERROR HY000: invalid type given for an argument
drop table if exists tt3;
create table tt3(id int, a vector(3));
select rb_and_cardinality_agg(a) from tt3;
ERROR HY000: invalid type given for an argument
insert into tt3 values(1,[1,2,3]);
select rb_and_cardinality_agg(a) from tt3;
ERROR HY000: invalid type given for an argument
drop table if exists tt3;
create table tt3(id int, a binary(6)) ;
drop view if exists vtt3;
create view vtt3 as select * from tt3;
insert into tt3 values(1,rb_from_string('1'));
select rb_and_cardinality_agg(a) from tt3;
ERROR HY000: invalid type given for an argument
select rb_and_cardinality_agg(a) from vtt3;
ERROR HY000: invalid type given for an argument
drop table if exists tt3;
create table tt3(id int, a varbinary(1000));
drop view if exists vtt3;
create view vtt3 as select * from tt3;
insert into tt3 values(0,null);
insert into tt3 values(0,rb_build_empty());
insert into tt3 values(1,rb_from_string('1'));
insert into tt3 values(2,rb_from_string('18446744073709551615'));
insert into tt3 values(3,rb_from_string('1,2,3,4,5,6,7,8,9,10,11,12,13,14,15,16,17,18,19'));
insert into tt3 values(4,rb_from_string('1,2,3,4,5,6,7,8,9,10,11,12,13,14,15,16,17,18,18446744073709551615'));
insert into tt3 values(6,rb_from_string('1,2,3,4,5,6,7,8,9,10,11,12,13,14,15,16,17,18,19,20,21,23,24,25,26,27,28,30,31,32,65536,4294967295'));
insert into tt3 values(7,rb_from_string('1,2,3,4,5,6,7,8,9,10,11,12,13,14,15,16,17,18,19,20,21,23,24,25,26,27,28,30,31,32,65536,4294967295,18446744073709551615'));
select * from tt3;
+------+-------------------------------------------------------------------------------------------------------------------------------------------------------------+
| id   | a                                                                                                                                                           |
+------+-------------------------------------------------------------------------------------------------------------------------------------------------------------+
|    0 | NULL                                                                                                                                                        |
|    0 |                                                                                                                                                            |
|    1 |                                                                                                                                                          |
|    2 | ˇˇˇˇˇˇˇˇ                                                                                                                                                          |
|    3 |                         	   
                                                                                                           |
|    4 |                                                         	       
                            ˇˇˇˇˇˇˇˇ                                            |
|    6 |                          	   
                                                                   ˇˇˇˇ                             |
|    7 |            :0           ˇˇ      \   ^           	 
                        ˇˇˇˇˇˇ:0     ˇˇ     ˇˇ                                    |
+------+-------------------------------------------------------------------------------------------------------------------------------------------------------------+
select rb_and_cardinality_agg(a) from tt3;
ERROR HY000: invalid type given for an argument
select rb_and_cardinality_agg(a) from vtt3;
ERROR HY000: invalid type given for an argument
drop table if exists tt3;
create table tt3(id int, a char(256)) CHARACTER SET binary;
drop view if exists vtt3;
create view vtt3 as select * from tt3;
insert into tt3 values(0,null);
insert into tt3 values(0,rb_build_empty());
insert into tt3 values(1,rb_from_string('1'));
insert into tt3 values(3,rb_from_string('1,2,3,4,5,6,7,8,9,10,11,12,13,14,15,16,17,18,19'));
insert into tt3 values(6,rb_from_string('1,2,3,4,5,6,7,8,9,10,11,12,13,14,15,16,17,18,19,20,21,23,24,25,26,27,28,30,31,32,33'));
insert into tt3 values(7,rb_from_string('1,2,3,4,5,6,7,8,9,10,11,12,13,14,15,16,17,18,19,20,21,23,24,25,26,27,28,30,31,32,65537'));
select rb_and_cardinality_agg(a) from tt3;
ERROR HY000: invalid type given for an argument
select rb_and_cardinality_agg(a) from vtt3;
ERROR HY000: invalid type given for an argument
drop table if exists tt3;
create table tt3(id int, a varchar(1000)) ;
drop view if exists vtt3;
create view vtt3 as select * from tt3;
insert into tt3 values(0,null);
insert into tt3 values(0,rb_build_empty());
insert into tt3 values(1,rb_from_string('1'));
insert into tt3 values(3,rb_from_string('1,2,3,4,5,6,7,8,9,10,11,12,13,14,15,16,17,18,19'));
insert into tt3 values(6,rb_from_string('1,2,3,4,5,6,7,8,9,10,11,12,13,14,15,16,17,18,19,20,21,23,24,25,26,27,28,30,31,32,33'));
insert into tt3 values(7,rb_from_string('1,2,3,4,5,6,7,8,9,10,11,12,13,14,15,16,17,18,19,20,21,23,24,25,26,27,28,30,31,32,65537'));
select rb_and_cardinality_agg(a) from tt3;
ERROR HY000: invalid type given for an argument
select rb_and_cardinality_agg(a) from vtt3;
ERROR HY000: invalid type given for an argument
drop table if exists tt3;
create table tt3(id int, a TINYBLOB) ;
drop view if exists vtt3;
create view vtt3 as select * from tt3;
insert into tt3 values(0,null);
insert into tt3 values(0,rb_build_empty());
insert into tt3 values(1,rb_from_string('1'));
insert into tt3 values(3,rb_from_string('1,2,3,4,5,6,7,8,9,10,11,12,13,14,15,16,17,18,19'));
insert into tt3 values(6,rb_from_string('1,2,3,4,5,6,7,8,9,10,11,12,13,14,15,16,17,18,19,20,21,23,24,25,26,27,28,30,31,32,33'));
insert into tt3 values(7,rb_from_string('1,2,3,4,5,6,7,8,9,10,11,12,13,14,15,16,17,18,19,20,21,23,24,25,26,27,28,30,31,32,65537'));
insert into tt3 values(7,rb_from_string('1,2,3,4,5,6,7,8,9,10,11,12,13,14,15,16,17,18,19,20,21,23,24,25,26,27,28,30,31,32,65536,4294967295,18446744073709551615'));
select rb_and_cardinality_agg(a) from tt3;
ERROR HY000: invalid type given for an argument
select rb_and_cardinality_agg(a) from vtt3;
ERROR HY000: invalid type given for an argument
drop table if exists tt3;
create table tt3(id int, a blob) ;
drop view if exists vtt3;
create view vtt3 as select * from tt3;
insert into tt3 values(0,null);
insert into tt3 values(0,rb_build_empty());
insert into tt3 values(1,rb_from_string('1'));
insert into tt3 values(3,rb_from_string('1,2,3,4,5,6,7,8,9,10,11,12,13,14,15,16,17,18,19'));
insert into tt3 values(6,rb_from_string('1,2,3,4,5,6,7,8,9,10,11,12,13,14,15,16,17,18,19,20,21,23,24,25,26,27,28,30,31,32,33'));
insert into tt3 values(7,rb_from_string('1,2,3,4,5,6,7,8,9,10,11,12,13,14,15,16,17,18,19,20,21,23,24,25,26,27,28,30,31,32,65537'));
insert into tt3 values(7,rb_from_string('1,2,3,4,5,6,7,8,9,10,11,12,13,14,15,16,17,18,19,20,21,23,24,25,26,27,28,30,31,32,65536,4294967295,18446744073709551615'));
select rb_and_cardinality_agg(a) from tt3;
ERROR HY000: invalid type given for an argument
select rb_and_cardinality_agg(a) from vtt3;
ERROR HY000: invalid type given for an argument
drop table if exists tt3;
create table tt3(id int, a MEDIUMBLOB);
drop view if exists vtt3;
create view vtt3 as select * from tt3;
insert into tt3 values(0,null);
insert into tt3 values(0,rb_build_empty());
insert into tt3 values(1,rb_from_string('1'));
insert into tt3 values(3,rb_from_string('1,2,3,4,5,6,7,8,9,10,11,12,13,14,15,16,17,18,19'));
insert into tt3 values(6,rb_from_string('1,2,3,4,5,6,7,8,9,10,11,12,13,14,15,16,17,18,19,20,21,23,24,25,26,27,28,30,31,32,33'));
insert into tt3 values(7,rb_from_string('1,2,3,4,5,6,7,8,9,10,11,12,13,14,15,16,17,18,19,20,21,23,24,25,26,27,28,30,31,32,65537'));
insert into tt3 values(7,rb_from_string('1,2,3,4,5,6,7,8,9,10,11,12,13,14,15,16,17,18,19,20,21,23,24,25,26,27,28,30,31,32,65536,4294967295,18446744073709551615'));
select rb_and_cardinality_agg(a) from tt3;
ERROR HY000: invalid type given for an argument
select rb_and_cardinality_agg(a) from vtt3;
ERROR HY000: invalid type given for an argument
drop table if exists tt3;
create table tt3(id int, a LONGBLOB);
drop view if exists vtt3;
create view vtt3 as select * from tt3;
insert into tt3 values(0,null);
insert into tt3 values(0,rb_build_empty());
insert into tt3 values(1,rb_from_string('1'));
insert into tt3 values(3,rb_from_string('1,2,3,4,5,6,7,8,9,10,11,12,13,14,15,16,17,18,19'));
insert into tt3 values(6,rb_from_string('1,2,3,4,5,6,7,8,9,10,11,12,13,14,15,16,17,18,19,20,21,23,24,25,26,27,28,30,31,32,33'));
insert into tt3 values(7,rb_from_string('1,2,3,4,5,6,7,8,9,10,11,12,13,14,15,16,17,18,19,20,21,23,24,25,26,27,28,30,31,32,65537'));
insert into tt3 values(7,rb_from_string('1,2,3,4,5,6,7,8,9,10,11,12,13,14,15,16,17,18,19,20,21,23,24,25,26,27,28,30,31,32,65536,4294967295,18446744073709551615'));
select rb_and_cardinality_agg(a) from tt3;
ERROR HY000: invalid type given for an argument
select rb_and_cardinality_agg(a) from vtt3;
ERROR HY000: invalid type given for an argument
drop table if exists tt3;
create table tt3(id int, a TINYTEXT );
drop view if exists vtt3;
create view vtt3 as select * from tt3;
insert into tt3 values(0,null);
insert into tt3 values(0,rb_build_empty());
insert into tt3 values(1,rb_from_string('1'));
insert into tt3 values(3,rb_from_string('1,2,3,4,5,6,7,8,9,10,11,12,13,14,15,16,17,18,19'));
insert into tt3 values(6,rb_from_string('1,2,3,4,5,6,7,8,9,10,11,12,13,14,15,16,17,18,19,20,21,23,24,25,26,27,28,30,31,32,33'));
insert into tt3 values(7,rb_from_string('1,2,3,4,5,6,7,8,9,10,11,12,13,14,15,16,17,18,19,20,21,23,24,25,26,27,28,30,31,32,65537'));
select rb_and_cardinality_agg(a) from tt3;
ERROR HY000: invalid type given for an argument
select rb_and_cardinality_agg(a) from vtt3;
ERROR HY000: invalid type given for an argument
drop table if exists tt3;
create table tt3(id int, a text);
drop view if exists vtt3;
create view vtt3 as select * from tt3;
insert into tt3 values(0,null);
insert into tt3 values(0,rb_build_empty());
insert into tt3 values(1,rb_from_string('1'));
insert into tt3 values(3,rb_from_string('1,2,3,4,5,6,7,8,9,10,11,12,13,14,15,16,17,18,19'));
insert into tt3 values(6,rb_from_string('1,2,3,4,5,6,7,8,9,10,11,12,13,14,15,16,17,18,19,20,21,23,24,25,26,27,28,30,31,32,33'));
insert into tt3 values(7,rb_from_string('1,2,3,4,5,6,7,8,9,10,11,12,13,14,15,16,17,18,19,20,21,23,24,25,26,27,28,30,31,32,65537'));
select rb_and_cardinality_agg(a) from tt3;
ERROR HY000: invalid type given for an argument
select rb_and_cardinality_agg(a) from vtt3;
ERROR HY000: invalid type given for an argument
drop table if exists tt3;
create table tt3(id int, a MEDIUMTEXT);
drop view if exists vtt3;
create view vtt3 as select * from tt3;
insert into tt3 values(0,null);
insert into tt3 values(0,rb_build_empty());
insert into tt3 values(1,rb_from_string('1'));
insert into tt3 values(3,rb_from_string('1,2,3,4,5,6,7,8,9,10,11,12,13,14,15,16,17,18,19'));
insert into tt3 values(6,rb_from_string('1,2,3,4,5,6,7,8,9,10,11,12,13,14,15,16,17,18,19,20,21,23,24,25,26,27,28,30,31,32,33'));
insert into tt3 values(7,rb_from_string('1,2,3,4,5,6,7,8,9,10,11,12,13,14,15,16,17,18,19,20,21,23,24,25,26,27,29,50,560,28,30,31,32,65537,4294967296'));
select * from tt3;
+------+----------------------------------------------------------------------------------------------------------------------------------+
| id   | a                                                                                                                                |
+------+----------------------------------------------------------------------------------------------------------------------------------+
|    0 | NULL                                                                                                                             |
|    0 |                                                                                                                                 |
|    1 |                                                                                                                               |
|    3 |                         	   
                                                                                |
|    6 |                         	   
                                                                !     |
|    7 |            :0               Z           	 
                       2 0    :0               |
+------+----------------------------------------------------------------------------------------------------------------------------------+
select rb_and_cardinality_agg(a) from tt3;
ERROR HY000: invalid type given for an argument
select rb_and_cardinality_agg(a) from vtt3;
ERROR HY000: invalid type given for an argument
drop table if exists tt3;
create table tt3(id int, a LONGTEXT);
drop view if exists vtt3;
create view vtt3 as select * from tt3;
insert into tt3 values(0,null);
insert into tt3 values(0,rb_build_empty());
insert into tt3 values(1,rb_from_string('1'));
insert into tt3 values(3,rb_from_string('1,2,3,4,5,6,7,8,9,10,11,12,13,14,15,16,17,18,19'));
insert into tt3 values(6,rb_from_string('1,2,3,4,5,6,7,8,9,10,11,12,13,14,15,16,17,18,19,20,21,23,24,25,26,27,28,30,31,32,33'));
insert into tt3 values(7,rb_from_string('1,2,3,4,5,6,7,8,9,10,11,12,13,14,15,16,17,18,19,20,21,23,24,25,26,27,29,50,560,28,30,31,32,65537,4294967296'));
select rb_and_cardinality_agg(a) from tt3;
ERROR HY000: invalid type given for an argument
select rb_and_cardinality_agg(a) from vtt3;
ERROR HY000: invalid type given for an argument
select rb_and_cardinality_agg(id) from tt3;
ERROR HY000: invalid type given for an argument
select rb_and_cardinality_agg(id) from vtt3;
ERROR HY000: invalid type given for an argument
drop table if exists tt3;
create table tt3(id int, a json);
insert into tt3 values(1,'"1,2,3,4"');
drop view if exists vtt3;
create view vtt3 as select * from tt3;
select rb_and_cardinality_agg(a) from tt3;
ERROR HY000: invalid type given for an argument
select rb_and_cardinality_agg(a) from vtt3;
ERROR HY000: invalid type given for an argument
drop table if exists tt3;
create table tt3(id0 BOOL,id1 BOOLEAN,id2 TINYINT,id3 SMALLINT,id4 MEDIUMINT,id5 INT,id6 INTEGER,id7 BIGINT,id8 SERIAL);
drop view if exists vtt3;
create view vtt3 as select * from tt3;
select rb_and_cardinality_agg(id0) from tt3;
ERROR HY000: invalid type given for an argument
insert into tt3 values(1,1,1,1,1,1,1,1,1);
insert into tt3 values(0,0,0,0,0,0,0,0,0);
insert into tt3 values(5,5,5,5,5,5,5,5,5);
insert into tt3 values(-6,-6,-6,-6,-6,-6,-6,-6,6);
select rb_and_cardinality_agg(id0) from tt3;
ERROR HY000: invalid type given for an argument
select rb_and_cardinality_agg(id2) from tt3;
ERROR HY000: invalid type given for an argument
select rb_and_cardinality_agg(id3) from tt3;
ERROR HY000: invalid type given for an argument
select rb_and_cardinality_agg(id5) from tt3;
ERROR HY000: invalid type given for an argument
select rb_and_cardinality_agg(id6) from tt3;
ERROR HY000: invalid type given for an argument
select rb_and_cardinality_agg(id7) from tt3;
ERROR HY000: invalid type given for an argument
select rb_and_cardinality_agg(id8) from tt3;
ERROR HY000: invalid type given for an argument
drop table if exists tt3;
create table tt3(id0 BOOL,id1 BOOLEAN,id2 TINYINT unsigned,id3 SMALLINT unsigned,id4 MEDIUMINT unsigned,id5 INT unsigned,id6 INTEGER unsigned,id7 BIGINT unsigned,id8 SERIAL);
drop view if exists vtt3;
create view vtt3 as select * from tt3;
select rb_and_cardinality_agg(id5) from tt3;
ERROR HY000: invalid type given for an argument
insert into tt3 values(1,1,1,1,1,1,1,1,1);
insert into tt3 values(0,0,0,0,0,0,0,0,0);
insert into tt3 values(5,5,5,5,5,5,5,18446744073709551615,18446744073709551615);
insert into tt3 values(6,6,6,6,6,6,6,18446744073709551614,6);
select rb_and_cardinality_agg(id0) from tt3;
ERROR HY000: invalid type given for an argument
select rb_and_cardinality_agg(id2) from tt3;
ERROR HY000: invalid type given for an argument
select rb_and_cardinality_agg(id3) from tt3;
ERROR HY000: invalid type given for an argument
select rb_and_cardinality_agg(id5) from tt3;
ERROR HY000: invalid type given for an argument
select rb_and_cardinality_agg(id6) from tt3;
ERROR HY000: invalid type given for an argument
select rb_and_cardinality_agg(id7) from tt3;
ERROR HY000: invalid type given for an argument
select rb_and_cardinality_agg(id8) from tt3;
ERROR HY000: invalid type given for an argument
drop table if exists tt3;
create table tt3(id1 float ,id2 float unsigned ,id3 double ,id4 double unsigned);
select rb_and_cardinality_agg(id1) from tt3;
ERROR HY000: invalid type given for an argument
select rb_and_cardinality_agg(id2) from tt3;
ERROR HY000: invalid type given for an argument
select rb_and_cardinality_agg(id3) from tt3;
ERROR HY000: invalid type given for an argument
select rb_and_cardinality_agg(id4) from tt3;
ERROR HY000: invalid type given for an argument
drop view if exists vtt3;
create view vtt3 as select * from tt3;
insert into tt3 values(-3.402823466E+38,3.402823466E+38,-1.7976931348623157E+308,1.7976931348623157E+308);
select rb_and_cardinality_agg(id1) from tt3;
ERROR HY000: invalid type given for an argument
select rb_and_cardinality_agg(id2) from tt3;
ERROR HY000: invalid type given for an argument
select rb_and_cardinality_agg(id3) from tt3;
ERROR HY000: invalid type given for an argument
select rb_and_cardinality_agg(id4) from tt3;
ERROR HY000: invalid type given for an argument
select cast(rb_and_cardinality_agg(r) as binary) from tt1;
+-------------------------------------------+
| cast(rb_and_cardinality_agg(r) as binary) |
+-------------------------------------------+
| 0                                         |
+-------------------------------------------+
select cast(rb_and_cardinality_agg(r) as char(1000)) from tt1;
+-----------------------------------------------+
| cast(rb_and_cardinality_agg(r) as char(1000)) |
+-----------------------------------------------+
| 0                                             |
+-----------------------------------------------+
select cast(rb_and_cardinality_agg(r) as UNSIGNED) from tt1;
+---------------------------------------------+
| cast(rb_and_cardinality_agg(r) as UNSIGNED) |
+---------------------------------------------+
|                                           0 |
+---------------------------------------------+
select cast(rb_and_cardinality_agg(r) as SIGNED) from tt1;
+-------------------------------------------+
| cast(rb_and_cardinality_agg(r) as SIGNED) |
+-------------------------------------------+
|                                         0 |
+-------------------------------------------+
select cast(rb_and_cardinality_agg(r) as date) from tt1;
+-----------------------------------------+
| cast(rb_and_cardinality_agg(r) as date) |
+-----------------------------------------+
| 0000-00-00                              |
+-----------------------------------------+
select cast(rb_and_cardinality_agg(r) as DATETIME) from tt1;
+---------------------------------------------+
| cast(rb_and_cardinality_agg(r) as DATETIME) |
+---------------------------------------------+
| 0000-00-00 00:00:00                         |
+---------------------------------------------+
select cast(rb_and_cardinality_agg(r) as TIME) from tt1;
+-----------------------------------------+
| cast(rb_and_cardinality_agg(r) as TIME) |
+-----------------------------------------+
| 00:00:00                                |
+-----------------------------------------+
select cast(rb_and_cardinality_agg(r) as FLOAT) from tt1;
+------------------------------------------+
| cast(rb_and_cardinality_agg(r) as FLOAT) |
+------------------------------------------+
|                                        0 |
+------------------------------------------+
select cast(rb_and_cardinality_agg(r) as year) from tt1;
+-----------------------------------------+
| cast(rb_and_cardinality_agg(r) as year) |
+-----------------------------------------+
|                                    0000 |
+-----------------------------------------+
select cast(rb_and_cardinality_agg(r) as DOUBLE) from tt1;
+-------------------------------------------+
| cast(rb_and_cardinality_agg(r) as DOUBLE) |
+-------------------------------------------+
|                                         0 |
+-------------------------------------------+
select cast(rb_and_cardinality_agg(r) as DECIMAL) from tt1;
+--------------------------------------------+
| cast(rb_and_cardinality_agg(r) as DECIMAL) |
+--------------------------------------------+
|                                          0 |
+--------------------------------------------+
select cast(rb_and_cardinality_agg(r) as roaringbitmap) from tt1;
ERROR 22000: Invalid data type for the operation
select cast(rb_and_cardinality_agg(r) as NUMERIC) from tt1;
+--------------------------------------------+
| cast(rb_and_cardinality_agg(r) as NUMERIC) |
+--------------------------------------------+
|                                          0 |
+--------------------------------------------+
select cast(rb_and_cardinality_agg(r) as dec) from tt1;
+----------------------------------------+
| cast(rb_and_cardinality_agg(r) as dec) |
+----------------------------------------+
|                                      0 |
+----------------------------------------+
select cast(rb_and_cardinality_agg(r) as FIXED) from tt1;
+------------------------------------------+
| cast(rb_and_cardinality_agg(r) as FIXED) |
+------------------------------------------+
|                                        0 |
+------------------------------------------+
select cast(rb_and_cardinality_agg(r) as MULTIPOINT) from tt1;
ERROR 22023: Invalid GIS data provided to function cast_as_multipoint.
drop table if exists tt3;
create table tt3(id int ,a0 varchar(1000),a varbinary(1000),r roaringbitmap,r1 roaringbitmap);
drop view if exists vtt3;
create view vtt3 as select * from tt3;
insert into tt3 values(0,null,rb_build_empty(),rb_build_empty(),rb_build_varbinary(0x01060100000000000000000000003b300000010000ffff0100fffe0f00));
insert into tt3 values(1,'1',rb_from_string('1'),rb_from_string('1'),rb_build_varbinary(x'01053b3000000100000f27010000000f27'));
insert into tt3 values(2,'4294967296',rb_from_string('4294967296'),rb_from_string('4294967296'),rb_from_string('4294967296,4294967297,42949672969,4294967298,42949672961,42949672962,4294967299,4294967297,14294967296,14294967696,14295967296,5294967296,7294967296,9294967296,8294967296,42949617296,42949672916,4294967396,4294967496,
4294967595,4294967696,4294967795,4294968295,4294967995,4294977295,4294987295,4294997295,4294968295,4294969295,4295967295,4296967295,4297967295,4298967295'));
insert into tt3 values(3,'1,2,6,4,5,9',rb_from_string('1,2,6,4,5,9'),rb_from_string('1,2,6,4,5,9'),rb_from_string('1,2,3,4,5,6,7,8,9,10,11,12,13,14,15,16,17,18,19,20,21,22,23,24,25,26,27,28,29,30,31,4294967298,4294967299'));
insert into tt3 values(3,'1,2,6,4,5,9',rb_from_string('1,2,6,4,5,9'),rb_from_string('1,2,6,4,5,9'),rb_from_string('1,2,3,4,5,6,7,8,9,10,11,12,13,14,15,16,17,18,19,20,21,22,23,24,25,26,27,28,29,30,31,65537,65536'));
insert into tt3 values(4,'4294967296,4294967297,4294967298,4294967299',rb_from_string('4294967296,4294967297,4294967298,4294967299'),rb_from_string('4294967296,4294967297,4294967298,4294967299'),rb_from_string('1,2,3,4,5,6,7,8,9,10,11,12,13,14,15,16,17,18,19,20,21,22,23,24,25,26,27,28,29,30,31,65537,65536'));
insert into tt3 values(5,'1,2,3,4,5,6,7,8,9,10,11,12,13,14,15,16,17,18,19,20,21,22,23,24,25,26,27,28,29,30,31,32,33',
rb_from_string('1,2,3,4,5,6,7,8,9,10,11,12,13,14,15,16,17,18,19,20,21,22,23,24,25,26,27,28,29,30,31,32,33'),
rb_from_string('1,2,3,4,5,6,7,8,9,10,11,12,13,14,15,16,17,18,19,20,21,22,23,24,25,26,27,28,29,30,31,32,33'),rb_build_empty());
insert into tt3 values(5,'1,2,3,4,5,6,7,8,9,10,11,12,13,14,15,16,17,18,19,20,21,22,23,24,25,26,27,28,29,30,31,65537,65536',
rb_from_string('1,2,3,4,5,6,7,8,9,10,11,12,13,14,15,16,17,18,19,20,21,22,23,24,25,26,27,28,29,30,31,65537,65536'),
rb_from_string('1,2,3,4,5,6,7,8,9,10,11,12,13,14,15,16,17,18,19,20,21,22,23,24,25,26,27,28,29,30,31,65537,65536'),rb_from_string('1,2,6,4,5,9'));
insert into tt3 values(6,'1,2,3,4,5,6,7,8,9,10,11,12,13,14,15,16,17,18,19,20,21,22,23,24,25,26,27,28,29,30,31,4294967298,65536',
rb_from_string('0,1,2,3,4,5,6,7,8,9,10,11,12,13,14,15,16,17,18,19,20,21,22,23,24,25,26,27,28,29,30,31,4294967298,4294967299'),
rb_from_string('1,2,3,4,5,6,7,8,9,10,11,12,13,14,15,16,17,18,19,20,21,22,23,24,25,26,27,28,29,30,31,4294967298,4294967299'),rb_from_string('1,2,6,4,5,9'));
insert into tt3 values(6,'4294967296,4294967297,42949672969,4294967298,42949672961,42949672962,4294967299,4294967297,14294967296,14294967696,14295967296,5294967296,7294967296,9294967296,8294967296,42949617296,42949672916,4294967396,4294967496,
4294967595,4294967696,4294967795,4294968295,4294967995,4294977295,4294987295,4294997295,4294968295,4294969295,4295967295,4296967295,4297967295,4298967295',
rb_from_string('4294967296,4294967297,42949672969,4294967298,42949672961,42949672962,4294967299,4294967297,14294967296,14294967696,14295967296,5294967296,7294967296,9294967296,8294967296,42949617296,42949672916,4294967396,4294967496,
4294967595,4294967696,4294967795,4294968295,4294967995,4294977295,4294987295,4294997295,4294968295,4294969295,4295967295,4296967295,4297967295,4298967295'),
rb_from_string('4294967296,4294967297,42949672969,4294967298,42949672961,42949672962,4294967299,4294967297,14294967296,14294967696,14295967296,5294967296,7294967296,9294967296,8294967296,42949617296,42949672916,4294967396,4294967496,
4294967595,4294967696,4294967795,4294968295,4294967995,4294977295,4294987295,4294997295,4294968295,4294969295,4295967295,4296967295,4297967295,4298967295'),rb_from_string('4294967296'));
insert into tt3 values(7,'2542',x'01053b3000000100000f27010000000f27',rb_build_varbinary(x'01053b3000000100000f27010000000f27'),rb_from_string('4294967296'));
insert into tt3 values(8,'56214,-7854',rb_build_varbinary(0x01060100000000000000000000003b300000010000ffff0100fffe0f00),rb_build_varbinary(0x01060100000000000000000000003b300000010000ffff0100fffe0f00),rb_from_string('4294967296'));
insert into tt3 values(9,'1,23,8977,973747',0x01060300000000000000000000003b3001000100002000f36d0100010000002000607f677f010000003b30000001000002000100000002002a0000003a300000010000001df300001000000061c4
,0x01060100000000000000000000003b300000010000ffff0100fffe0f00,rb_from_string('4294967296'));
insert into tt3 values(10,null,null,null,null);
insert into tt3(id) values(11);
select *,rb_and_cardinality_agg(r) from tt3 where id in(3) order by rb_and_cardinality_agg(r);
+------+-------------+-----------------------------+-----------------------------+----------------------------------------------------------------------------------------------------------------------+---------------------------+
| id   | a0          | a                           | r                           | r1                                                                                                                   | rb_and_cardinality_agg(r) |
+------+-------------+-----------------------------+-----------------------------+----------------------------------------------------------------------------------------------------------------------+---------------------------+
|    3 | 1,2,6,4,5,9 |                	    |                	    |            :0                   	 
                         :0              |                         6 |
+------+-------------+-----------------------------+-----------------------------+----------------------------------------------------------------------------------------------------------------------+---------------------------+
select *,rb_and_cardinality_agg(r),rb_and_cardinality_agg(r1) from tt3 order by rb_and_cardinality_agg(r) desc,rb_and_cardinality_agg(r1) asc;
+------+------+------+------+---------------------------------------------------------------------+---------------------------+----------------------------+
| id   | a0   | a    | r    | r1                                                                  | rb_and_cardinality_agg(r) | rb_and_cardinality_agg(r1) |
+------+------+------+------+---------------------------------------------------------------------+---------------------------+----------------------------+
|    0 | NULL |     |     | ˇ˛   ˇ  ˇ  ˇ  ˇ  ˇ  ˇ  ˇ  ˇ  ˇ  	ˇ  
ˇ  ˇ  ˇ  ˇ  ˇ                    |                         0 |                          0 |
+------+------+------+------+---------------------------------------------------------------------+---------------------------+----------------------------+
select * from tt3 order by rb_and_cardinality_agg(r);
+------+------+------+------+---------------------------------------------------------------------+
| id   | a0   | a    | r    | r1                                                                  |
+------+------+------+------+---------------------------------------------------------------------+
|    0 | NULL |     |     | ˇ˛   ˇ  ˇ  ˇ  ˇ  ˇ  ˇ  ˇ  ˇ  ˇ  	ˇ  
ˇ  ˇ  ˇ  ˇ  ˇ                    |
+------+------+------+------+---------------------------------------------------------------------+
select * from tt3 order by rb_and_cardinality_agg(rb_from_string('1,2,3,4,5'));
+------+------+------+------+---------------------------------------------------------------------+
| id   | a0   | a    | r    | r1                                                                  |
+------+------+------+------+---------------------------------------------------------------------+
|    0 | NULL |     |     | ˇ˛   ˇ  ˇ  ˇ  ˇ  ˇ  ˇ  ˇ  ˇ  ˇ  	ˇ  
ˇ  ˇ  ˇ  ˇ  ˇ                    |
+------+------+------+------+---------------------------------------------------------------------+
select *,rb_and_cardinality_agg(r),rb_and_cardinality_agg(r1) from tt3 group by id,a0;
+------+-------------------------------------------------------------------------------------------------------------------------------------------------------------------------------------------------------------------------------------------------------------------------------------------------------------------------------------------------------------------------------------+-------------------------------------------------------------------------------------------------------------------------------------------------------------------------------------------------------------------------------------------------------------+-------------------------------------------------------------------------------------------------------------------------------------------------------------------------------------------------------------------------------------------------------------+-------------------------------------------------------------------------------------------------------------------------------------------------------------------------------------------------------------------------------------------------------------+---------------------------+----------------------------+
| id   | a0                                                                                                                                                                                                                                                                                                                                                                                  | a                                                                                                                                                                                                                                                           | r                                                                                                                                                                                                                                                           | r1                                                                                                                                                                                                                                                          | rb_and_cardinality_agg(r) | rb_and_cardinality_agg(r1) |
+------+-------------------------------------------------------------------------------------------------------------------------------------------------------------------------------------------------------------------------------------------------------------------------------------------------------------------------------------------------------------------------------------+-------------------------------------------------------------------------------------------------------------------------------------------------------------------------------------------------------------------------------------------------------------+-------------------------------------------------------------------------------------------------------------------------------------------------------------------------------------------------------------------------------------------------------------+-------------------------------------------------------------------------------------------------------------------------------------------------------------------------------------------------------------------------------------------------------------+---------------------------+----------------------------+
|    0 | NULL                                                                                                                                                                                                                                                                                                                                                                                |                                                                                                                                                                                                                                                            |                                                                                                                                                                                                                                                            | ˇ˛   ˇ  ˇ  ˇ  ˇ  ˇ  ˇ  ˇ  ˇ  ˇ  	ˇ  
ˇ  ˇ  ˇ  ˇ  ˇ                                                                                                                                                                                                            |                         0 |                         16 |
|    1 | 1                                                                                                                                                                                                                                                                                                                                                                                   |                                                                                                                                                                                                                                                          |                                                                                                                                                                                                                                                          |            ;0    '   '                                                                                                                                                                                                                               |                         1 |                      10000 |
|    2 | 4294967296                                                                                                                                                                                                                                                                                                                                                                          |                                                                                                                                                                                                                                                          |                                                                                                                                                                                                                                                          | @&T    ‰T   ‘ˇˇˇ	   	   
   N     Û       ö;   ê      ^–≤   +      Ú*   '     ˇ=    œ     ø∆-    »      Ñ    êÂT   Á     ê&ˇˇ	   d      ?B           /u                        (kÓ      
      
   ª                              |                         1 |                         31 |
|    3 | 1,2,6,4,5,9                                                                                                                                                                                                                                                                                                                                                                         |                	                                                                                                                                                                                                                                    |                	                                                                                                                                                                                                                                    |            :0                   	 
                         :0                                                                                                                                                     |                         6 |                         31 |
|    4 | 4294967296,4294967297,4294967298,4294967299                                                                                                                                                                                                                                                                                                                                         |                                                                                                                                                                                                                                                   |                                                                                                                                                                                                                                                   |            :0             V           	 
                                                                                                                                                                             |                         4 |                         33 |
|    5 | 1,2,3,4,5,6,7,8,9,10,11,12,13,14,15,16,17,18,19,20,21,22,23,24,25,26,27,28,29,30,31,32,33                                                                                                                                                                                                                                                                                           |            :0                    	 
                        !                                                                                                                                                             |            :0                    	 
                        !                                                                                                                                                             |                                                                                                                                                                                                                                                            |                        33 |                          0 |
|    5 | 1,2,3,4,5,6,7,8,9,10,11,12,13,14,15,16,17,18,19,20,21,22,23,24,25,26,27,28,29,30,31,65537,65536                                                                                                                                                                                                                                                                                     |            :0             V           	 
                                                                                                                                                                             |            :0             V           	 
                                                                                                                                                                             |                	                                                                                                                                                                                                                                    |                        33 |                          6 |
|    6 | 1,2,3,4,5,6,7,8,9,10,11,12,13,14,15,16,17,18,19,20,21,22,23,24,25,26,27,28,29,30,31,4294967298,65536                                                                                                                                                                                                                                                                                |            :0                     	 
                         :0                                                                                                                                                   |            :0                   	 
                         :0                                                                                                                                                     |                	                                                                                                                                                                                                                                    |                        33 |                          6 |
|    6 | 4294967296,4294967297,42949672969,4294967298,42949672961,42949672962,4294967299,4294967297,14294967296,14294967696,14295967296,5294967296,7294967296,9294967296,8294967296,42949617296,42949672916,4294967396,4294967496,
4294967595,4294967696,4294967795,4294968295,4294967995,4294977295,4294987295,4294997295,4294968295,4294969295,4295967295,4296967295,4297967295,4298967295 | @&T    ‰T   ‘ˇˇˇ	   	   
   N     Û       ö;   ê      ^–≤   +      Ú*   '     ˇ=    œ     ø∆-    »      Ñ    êÂT   Á     ê&ˇˇ	   d      ?B           /u                        (kÓ      
      
   ª                              | @&T    ‰T   ‘ˇˇˇ	   	   
   N     Û       ö;   ê      ^–≤   +      Ú*   '     ˇ=    œ     ø∆-    »      Ñ    êÂT   Á     ê&ˇˇ	   d      ?B           /u                        (kÓ      
      
   ª                              |                                                                                                                                                                                                                                                          |                        31 |                          1 |
|    7 | 2542                                                                                                                                                                                                                                                                                                                                                                                | ;0    '   '                                                                                                                                                                                                                                           |            ;0    '   '                                                                                                                                                                                                                               |                                                                                                                                                                                                                                                          |                     10000 |                          1 |
|    8 | 56214,-7854                                                                                                                                                                                                                                                                                                                                                                         | ˇ˛   ˇ  ˇ  ˇ  ˇ  ˇ  ˇ  ˇ  ˇ  ˇ  	ˇ  
ˇ  ˇ  ˇ  ˇ  ˇ                                                                                                                                                                                                            | ˇ˛   ˇ  ˇ  ˇ  ˇ  ˇ  ˇ  ˇ  ˇ  ˇ  	ˇ  
ˇ  ˇ  ˇ  ˇ  ˇ                                                                                                                                                                                                            |                                                                                                                                                                                                                                                          |                        16 |                          1 |
|    9 | 1,23,8977,973747                                                                                                                                                                                                                                                                                                                                                                    |            ;0     Ûm      `g   ;0         *   :0     Û     aƒ                                                                                                                                                                                 | ˇ˛   ˇ  ˇ  ˇ  ˇ  ˇ  ˇ  ˇ  ˇ  ˇ  	ˇ  
ˇ  ˇ  ˇ  ˇ  ˇ                                                                                                                                                                                                            |                                                                                                                                                                                                                                                          |                        16 |                          1 |
|   10 | NULL                                                                                                                                                                                                                                                                                                                                                                                | NULL                                                                                                                                                                                                                                                        | NULL                                                                                                                                                                                                                                                        | NULL                                                                                                                                                                                                                                                        |                      NULL |                       NULL |
|   11 | NULL                                                                                                                                                                                                                                                                                                                                                                                | NULL                                                                                                                                                                                                                                                        | NULL                                                                                                                                                                                                                                                        | NULL                                                                                                                                                                                                                                                        |                      NULL |                       NULL |
+------+-------------------------------------------------------------------------------------------------------------------------------------------------------------------------------------------------------------------------------------------------------------------------------------------------------------------------------------------------------------------------------------+-------------------------------------------------------------------------------------------------------------------------------------------------------------------------------------------------------------------------------------------------------------+-------------------------------------------------------------------------------------------------------------------------------------------------------------------------------------------------------------------------------------------------------------+-------------------------------------------------------------------------------------------------------------------------------------------------------------------------------------------------------------------------------------------------------------+---------------------------+----------------------------+
select *,rb_and_cardinality_agg(r),rb_and_cardinality_agg(r1) from tt3  group by id,a0 order by rb_and_cardinality_agg(r);
+------+-------------------------------------------------------------------------------------------------------------------------------------------------------------------------------------------------------------------------------------------------------------------------------------------------------------------------------------------------------------------------------------+-------------------------------------------------------------------------------------------------------------------------------------------------------------------------------------------------------------------------------------------------------------+-------------------------------------------------------------------------------------------------------------------------------------------------------------------------------------------------------------------------------------------------------------+-------------------------------------------------------------------------------------------------------------------------------------------------------------------------------------------------------------------------------------------------------------+---------------------------+----------------------------+
| id   | a0                                                                                                                                                                                                                                                                                                                                                                                  | a                                                                                                                                                                                                                                                           | r                                                                                                                                                                                                                                                           | r1                                                                                                                                                                                                                                                          | rb_and_cardinality_agg(r) | rb_and_cardinality_agg(r1) |
+------+-------------------------------------------------------------------------------------------------------------------------------------------------------------------------------------------------------------------------------------------------------------------------------------------------------------------------------------------------------------------------------------+-------------------------------------------------------------------------------------------------------------------------------------------------------------------------------------------------------------------------------------------------------------+-------------------------------------------------------------------------------------------------------------------------------------------------------------------------------------------------------------------------------------------------------------+-------------------------------------------------------------------------------------------------------------------------------------------------------------------------------------------------------------------------------------------------------------+---------------------------+----------------------------+
|   10 | NULL                                                                                                                                                                                                                                                                                                                                                                                | NULL                                                                                                                                                                                                                                                        | NULL                                                                                                                                                                                                                                                        | NULL                                                                                                                                                                                                                                                        |                      NULL |                       NULL |
|   11 | NULL                                                                                                                                                                                                                                                                                                                                                                                | NULL                                                                                                                                                                                                                                                        | NULL                                                                                                                                                                                                                                                        | NULL                                                                                                                                                                                                                                                        |                      NULL |                       NULL |
|    0 | NULL                                                                                                                                                                                                                                                                                                                                                                                |                                                                                                                                                                                                                                                            |                                                                                                                                                                                                                                                            | ˇ˛   ˇ  ˇ  ˇ  ˇ  ˇ  ˇ  ˇ  ˇ  ˇ  	ˇ  
ˇ  ˇ  ˇ  ˇ  ˇ                                                                                                                                                                                                            |                         0 |                         16 |
|    1 | 1                                                                                                                                                                                                                                                                                                                                                                                   |                                                                                                                                                                                                                                                          |                                                                                                                                                                                                                                                          |            ;0    '   '                                                                                                                                                                                                                               |                         1 |                      10000 |
|    2 | 4294967296                                                                                                                                                                                                                                                                                                                                                                          |                                                                                                                                                                                                                                                          |                                                                                                                                                                                                                                                          | @&T    ‰T   ‘ˇˇˇ	   	   
   N     Û       ö;   ê      ^–≤   +      Ú*   '     ˇ=    œ     ø∆-    »      Ñ    êÂT   Á     ê&ˇˇ	   d      ?B           /u                        (kÓ      
      
   ª                              |                         1 |                         31 |
|    4 | 4294967296,4294967297,4294967298,4294967299                                                                                                                                                                                                                                                                                                                                         |                                                                                                                                                                                                                                                   |                                                                                                                                                                                                                                                   |            :0             V           	 
                                                                                                                                                                             |                         4 |                         33 |
|    3 | 1,2,6,4,5,9                                                                                                                                                                                                                                                                                                                                                                         |                	                                                                                                                                                                                                                                    |                	                                                                                                                                                                                                                                    |            :0                   	 
                         :0                                                                                                                                                     |                         6 |                         31 |
|    8 | 56214,-7854                                                                                                                                                                                                                                                                                                                                                                         | ˇ˛   ˇ  ˇ  ˇ  ˇ  ˇ  ˇ  ˇ  ˇ  ˇ  	ˇ  
ˇ  ˇ  ˇ  ˇ  ˇ                                                                                                                                                                                                            | ˇ˛   ˇ  ˇ  ˇ  ˇ  ˇ  ˇ  ˇ  ˇ  ˇ  	ˇ  
ˇ  ˇ  ˇ  ˇ  ˇ                                                                                                                                                                                                            |                                                                                                                                                                                                                                                          |                        16 |                          1 |
|    9 | 1,23,8977,973747                                                                                                                                                                                                                                                                                                                                                                    |            ;0     Ûm      `g   ;0         *   :0     Û     aƒ                                                                                                                                                                                 | ˇ˛   ˇ  ˇ  ˇ  ˇ  ˇ  ˇ  ˇ  ˇ  ˇ  	ˇ  
ˇ  ˇ  ˇ  ˇ  ˇ                                                                                                                                                                                                            |                                                                                                                                                                                                                                                          |                        16 |                          1 |
|    6 | 4294967296,4294967297,42949672969,4294967298,42949672961,42949672962,4294967299,4294967297,14294967296,14294967696,14295967296,5294967296,7294967296,9294967296,8294967296,42949617296,42949672916,4294967396,4294967496,
4294967595,4294967696,4294967795,4294968295,4294967995,4294977295,4294987295,4294997295,4294968295,4294969295,4295967295,4296967295,4297967295,4298967295 | @&T    ‰T   ‘ˇˇˇ	   	   
   N     Û       ö;   ê      ^–≤   +      Ú*   '     ˇ=    œ     ø∆-    »      Ñ    êÂT   Á     ê&ˇˇ	   d      ?B           /u                        (kÓ      
      
   ª                              | @&T    ‰T   ‘ˇˇˇ	   	   
   N     Û       ö;   ê      ^–≤   +      Ú*   '     ˇ=    œ     ø∆-    »      Ñ    êÂT   Á     ê&ˇˇ	   d      ?B           /u                        (kÓ      
      
   ª                              |                                                                                                                                                                                                                                                          |                        31 |                          1 |
|    5 | 1,2,3,4,5,6,7,8,9,10,11,12,13,14,15,16,17,18,19,20,21,22,23,24,25,26,27,28,29,30,31,32,33                                                                                                                                                                                                                                                                                           |            :0                    	 
                        !                                                                                                                                                             |            :0                    	 
                        !                                                                                                                                                             |                                                                                                                                                                                                                                                            |                        33 |                          0 |
|    5 | 1,2,3,4,5,6,7,8,9,10,11,12,13,14,15,16,17,18,19,20,21,22,23,24,25,26,27,28,29,30,31,65537,65536                                                                                                                                                                                                                                                                                     |            :0             V           	 
                                                                                                                                                                             |            :0             V           	 
                                                                                                                                                                             |                	                                                                                                                                                                                                                                    |                        33 |                          6 |
|    6 | 1,2,3,4,5,6,7,8,9,10,11,12,13,14,15,16,17,18,19,20,21,22,23,24,25,26,27,28,29,30,31,4294967298,65536                                                                                                                                                                                                                                                                                |            :0                     	 
                         :0                                                                                                                                                   |            :0                   	 
                         :0                                                                                                                                                     |                	                                                                                                                                                                                                                                    |                        33 |                          6 |
|    7 | 2542                                                                                                                                                                                                                                                                                                                                                                                | ;0    '   '                                                                                                                                                                                                                                           |            ;0    '   '                                                                                                                                                                                                                               |                                                                                                                                                                                                                                                          |                     10000 |                          1 |
+------+-------------------------------------------------------------------------------------------------------------------------------------------------------------------------------------------------------------------------------------------------------------------------------------------------------------------------------------------------------------------------------------+-------------------------------------------------------------------------------------------------------------------------------------------------------------------------------------------------------------------------------------------------------------+-------------------------------------------------------------------------------------------------------------------------------------------------------------------------------------------------------------------------------------------------------------+-------------------------------------------------------------------------------------------------------------------------------------------------------------------------------------------------------------------------------------------------------------+---------------------------+----------------------------+
select *,rb_and_cardinality_agg(r),rb_and_cardinality_agg(r1) from tt3 group by id,a0 having(rb_and_cardinality_agg(r))<10;
+------+---------------------------------------------+-------------------------------------+-------------------------------------+-------------------------------------------------------------------------------------------------------------------------------------------------------------------------------------------------------------------------------------------------------------+---------------------------+----------------------------+
| id   | a0                                          | a                                   | r                                   | r1                                                                                                                                                                                                                                                          | rb_and_cardinality_agg(r) | rb_and_cardinality_agg(r1) |
+------+---------------------------------------------+-------------------------------------+-------------------------------------+-------------------------------------------------------------------------------------------------------------------------------------------------------------------------------------------------------------------------------------------------------------+---------------------------+----------------------------+
|    0 | NULL                                        |                                    |                                    | ˇ˛   ˇ  ˇ  ˇ  ˇ  ˇ  ˇ  ˇ  ˇ  ˇ  	ˇ  
ˇ  ˇ  ˇ  ˇ  ˇ                                                                                                                                                                                                            |                         0 |                         16 |
|    1 | 1                                           |                                  |                                  |            ;0    '   '                                                                                                                                                                                                                               |                         1 |                      10000 |
|    2 | 4294967296                                  |                                  |                                  | @&T    ‰T   ‘ˇˇˇ	   	   
   N     Û       ö;   ê      ^–≤   +      Ú*   '     ˇ=    œ     ø∆-    »      Ñ    êÂT   Á     ê&ˇˇ	   d      ?B           /u                        (kÓ      
      
   ª                              |                         1 |                         31 |
|    3 | 1,2,6,4,5,9                                 |                	            |                	            |            :0                   	 
                         :0                                                                                                                                                     |                         6 |                         31 |
|    4 | 4294967296,4294967297,4294967298,4294967299 |                           |                           |            :0             V           	 
                                                                                                                                                                             |                         4 |                         33 |
+------+---------------------------------------------+-------------------------------------+-------------------------------------+-------------------------------------------------------------------------------------------------------------------------------------------------------------------------------------------------------------------------------------------------------------+---------------------------+----------------------------+
select rb_and_cardinality_agg(r),rb_and_cardinality_agg(r1) from tt3 group by id,a0 having(rb_and_cardinality_agg(r))<10;
+---------------------------+----------------------------+
| rb_and_cardinality_agg(r) | rb_and_cardinality_agg(r1) |
+---------------------------+----------------------------+
|                         0 |                         16 |
|                         1 |                      10000 |
|                         1 |                         31 |
|                         6 |                         31 |
|                         4 |                         33 |
+---------------------------+----------------------------+
select rb_and_cardinality_agg(r),rb_and_cardinality_agg(r1) from tt3 group by id,a0 having(rb_and_cardinality_agg(r))>10;
+---------------------------+----------------------------+
| rb_and_cardinality_agg(r) | rb_and_cardinality_agg(r1) |
+---------------------------+----------------------------+
|                        33 |                          0 |
|                        33 |                          6 |
|                        33 |                          6 |
|                        31 |                          1 |
|                     10000 |                          1 |
|                        16 |                          1 |
|                        16 |                          1 |
+---------------------------+----------------------------+
select rb_and_cardinality_agg(r),rb_and_cardinality_agg(r1) from tt3 group by id,a0 having(rb_and_cardinality_agg(r))=10;
+---------------------------+----------------------------+
| rb_and_cardinality_agg(r) | rb_and_cardinality_agg(r1) |
+---------------------------+----------------------------+
+---------------------------+----------------------------+
select r from tt3 group by id,a0 having(rb_and_cardinality_agg(r))<10;
+-------------------------------------+
| r                                   |
+-------------------------------------+
|                                    |
|                                  |
|                                  |
|                	            |
|                           |
+-------------------------------------+
select  distinct rb_and_cardinality_agg(r),rb_and_cardinality_agg(r1) from tt3;
+---------------------------+----------------------------+
| rb_and_cardinality_agg(r) | rb_and_cardinality_agg(r1) |
+---------------------------+----------------------------+
|                         0 |                          0 |
+---------------------------+----------------------------+
select *, rb_and_cardinality_agg(r),rb_and_cardinality_agg(r1) from tt3 limit 1;
+------+------+------+------+---------------------------------------------------------------------+---------------------------+----------------------------+
| id   | a0   | a    | r    | r1                                                                  | rb_and_cardinality_agg(r) | rb_and_cardinality_agg(r1) |
+------+------+------+------+---------------------------------------------------------------------+---------------------------+----------------------------+
|    0 | NULL |     |     | ˇ˛   ˇ  ˇ  ˇ  ˇ  ˇ  ˇ  ˇ  ˇ  ˇ  	ˇ  
ˇ  ˇ  ˇ  ˇ  ˇ                    |                         0 |                          0 |
+------+------+------+------+---------------------------------------------------------------------+---------------------------+----------------------------+
select  * from tt3 where rb_and_cardinality_agg(r)=rb_and_cardinality_agg(r1);
ERROR HY000: Invalid use of group function
select  * from tt3 where rb_and_cardinality_agg(r) is true;
ERROR HY000: Invalid use of group function
select  * from tt3 where 1 BETWEEN rb_and_cardinality_agg(r) AND  rb_and_cardinality_agg(r1);
ERROR HY000: Invalid use of group function
select  * from tt3 where  1 like rb_and_cardinality_agg(r1);
ERROR HY000: Invalid use of group function
select  * from tt3 where  rb_and_cardinality_agg(r) >some(select id from tt3);
ERROR HY000: Invalid use of group function
select  * from tt3 where  rb_and_cardinality_agg(r) <any(select id from tt3);
ERROR HY000: Invalid use of group function
select  * from tt3 where  rb_and_cardinality_agg(r) =all(select id from tt3);
ERROR HY000: Invalid use of group function
select * ,rb_and_cardinality_agg(r) from tt3  for update;
+------+------+------+------+---------------------------------------------------------------------+---------------------------+
| id   | a0   | a    | r    | r1                                                                  | rb_and_cardinality_agg(r) |
+------+------+------+------+---------------------------------------------------------------------+---------------------------+
|    0 | NULL |     |     | ˇ˛   ˇ  ˇ  ˇ  ˇ  ˇ  ˇ  ˇ  ˇ  ˇ  	ˇ  
ˇ  ˇ  ˇ  ˇ  ˇ                    |                         0 |
+------+------+------+------+---------------------------------------------------------------------+---------------------------+
WITH Alice_Students AS (
    select rb_and_cardinality_agg(r) a,rb_and_cardinality_agg(r1) from tt3
)
SELECT * FROM Alice_Students;
+------+----------------------------+
| a    | rb_and_cardinality_agg(r1) |
+------+----------------------------+
|    0 |                          0 |
+------+----------------------------+
select rb_and_cardinality_agg(r) a from tt1 UNION select rb_and_cardinality_agg(r) a from tt2;
+------+
| a    |
+------+
|    0 |
+------+
select rb_and_cardinality_agg(r) a from tt1 UNION ALL select rb_and_cardinality_agg(r) a from tt2;
+------+
| a    |
+------+
|    0 |
|    0 |
+------+
select rb_and_cardinality_agg(r) a from tt1 INTERSECT select rb_and_cardinality_agg(r) a from tt2;
+------+
| a    |
+------+
|    0 |
+------+
select rb_and_cardinality_agg(r) a from tt1 MINUS  select rb_and_cardinality_agg(r) a from tt2;
+------+
| a    |
+------+
+------+
select rb_and_cardinality_agg(r) a from tt1 UNION select rb_and_cardinality_agg(r) a from tt2 UNION select rb_and_cardinality_agg(r) a from tt3;
+------+
| a    |
+------+
|    0 |
+------+
select rb_and_cardinality_agg(r) a from tt1 UNION ALL select rb_and_cardinality_agg(r) a from tt2 UNION ALL select rb_and_cardinality_agg(r) a from tt3;
+------+
| a    |
+------+
|    0 |
|    0 |
|    0 |
+------+
select rb_and_cardinality_agg(r) a from tt1 INTERSECT select rb_and_cardinality_agg(r) a from tt2 INTERSECT select rb_and_cardinality_agg(r) a from tt3;
+------+
| a    |
+------+
|    0 |
+------+
select rb_and_cardinality_agg(r) a from tt1 MINUS  select rb_and_cardinality_agg(r) a from tt2 INTERSECT select rb_and_cardinality_agg(r) a from tt3;
+------+
| a    |
+------+
+------+
select * from tt1 INNER JOIN tt2 on rb_and_cardinality_agg(tt1.r)=rb_and_cardinality_agg(tt2.r);
ERROR HY000: Invalid use of group function
select *, rb_and_cardinality_agg(tt2.r) from tt1 INNER JOIN tt2 on tt1.id=tt2.id;
+------+------+------+------+---------------------------------------------------------------------+----+------+------+------+---------------------------------------------------------------------+-------------------------------+
| id   | a0   | a    | r    | r1                                                                  | id | a0   | a    | r    | r1                                                                  | rb_and_cardinality_agg(tt2.r) |
+------+------+------+------+---------------------------------------------------------------------+----+------+------+------+---------------------------------------------------------------------+-------------------------------+
|    0 | NULL |     |     | ˇ˛   ˇ  ˇ  ˇ  ˇ  ˇ  ˇ  ˇ  ˇ  ˇ  	ˇ  
ˇ  ˇ  ˇ  ˇ  ˇ                    |  0 | NULL |     |     | ˇ˛   ˇ  ˇ  ˇ  ˇ  ˇ  ˇ  ˇ  ˇ  ˇ  	ˇ  
ˇ  ˇ  ˇ  ˇ  ˇ                    |                             0 |
+------+------+------+------+---------------------------------------------------------------------+----+------+------+------+---------------------------------------------------------------------+-------------------------------+
select *, rb_and_cardinality_agg(tt2.r) from tt1 LEFT  JOIN tt2 on tt1.id=tt2.id;
+------+------+------+------+---------------------------------------------------------------------+----+------+------+------+---------------------------------------------------------------------+-------------------------------+
| id   | a0   | a    | r    | r1                                                                  | id | a0   | a    | r    | r1                                                                  | rb_and_cardinality_agg(tt2.r) |
+------+------+------+------+---------------------------------------------------------------------+----+------+------+------+---------------------------------------------------------------------+-------------------------------+
|    0 | NULL |     |     | ˇ˛   ˇ  ˇ  ˇ  ˇ  ˇ  ˇ  ˇ  ˇ  ˇ  	ˇ  
ˇ  ˇ  ˇ  ˇ  ˇ                    |  0 | NULL |     |     | ˇ˛   ˇ  ˇ  ˇ  ˇ  ˇ  ˇ  ˇ  ˇ  ˇ  	ˇ  
ˇ  ˇ  ˇ  ˇ  ˇ                    |                             0 |
+------+------+------+------+---------------------------------------------------------------------+----+------+------+------+---------------------------------------------------------------------+-------------------------------+
select *, rb_and_cardinality_agg(tt2.r) from tt1 RIGHT  JOIN	 tt2 on tt1.id=tt2.id;
+------+------+------+------+---------------------------------------------------------------------+----+------+------+------+---------------------------------------------------------------------+-------------------------------+
| id   | a0   | a    | r    | r1                                                                  | id | a0   | a    | r    | r1                                                                  | rb_and_cardinality_agg(tt2.r) |
+------+------+------+------+---------------------------------------------------------------------+----+------+------+------+---------------------------------------------------------------------+-------------------------------+
|    0 | NULL |     |     | ˇ˛   ˇ  ˇ  ˇ  ˇ  ˇ  ˇ  ˇ  ˇ  ˇ  	ˇ  
ˇ  ˇ  ˇ  ˇ  ˇ                    |  0 | NULL |     |     | ˇ˛   ˇ  ˇ  ˇ  ˇ  ˇ  ˇ  ˇ  ˇ  ˇ  	ˇ  
ˇ  ˇ  ˇ  ˇ  ˇ                    |                             0 |
+------+------+------+------+---------------------------------------------------------------------+----+------+------+------+---------------------------------------------------------------------+-------------------------------+
select *, rb_and_cardinality_agg(tt2.r) from tt1 FULL  JOIN	 tt2 on tt1.id=tt2.id;
+------+------+------+------+---------------------------------------------------------------------+----+------+------+------+---------------------------------------------------------------------+-------------------------------+
| id   | a0   | a    | r    | r1                                                                  | id | a0   | a    | r    | r1                                                                  | rb_and_cardinality_agg(tt2.r) |
+------+------+------+------+---------------------------------------------------------------------+----+------+------+------+---------------------------------------------------------------------+-------------------------------+
|    0 | NULL |     |     | ˇ˛   ˇ  ˇ  ˇ  ˇ  ˇ  ˇ  ˇ  ˇ  ˇ  	ˇ  
ˇ  ˇ  ˇ  ˇ  ˇ                    |  0 | NULL |     |     | ˇ˛   ˇ  ˇ  ˇ  ˇ  ˇ  ˇ  ˇ  ˇ  ˇ  	ˇ  
ˇ  ˇ  ˇ  ˇ  ˇ                    |                             0 |
+------+------+------+------+---------------------------------------------------------------------+----+------+------+------+---------------------------------------------------------------------+-------------------------------+
select *, rb_and_cardinality_agg(t1.r),rb_and_cardinality_agg(t2.r1) from tt3 t1,tt3 t2 where t1.id=t2.id;
+------+------+------+------+---------------------------------------------------------------------+------+------+------+------+---------------------------------------------------------------------+------------------------------+-------------------------------+
| id   | a0   | a    | r    | r1                                                                  | id   | a0   | a    | r    | r1                                                                  | rb_and_cardinality_agg(t1.r) | rb_and_cardinality_agg(t2.r1) |
+------+------+------+------+---------------------------------------------------------------------+------+------+------+------+---------------------------------------------------------------------+------------------------------+-------------------------------+
|    0 | NULL |     |     | ˇ˛   ˇ  ˇ  ˇ  ˇ  ˇ  ˇ  ˇ  ˇ  ˇ  	ˇ  
ˇ  ˇ  ˇ  ˇ  ˇ                    |    0 | NULL |     |     | ˇ˛   ˇ  ˇ  ˇ  ˇ  ˇ  ˇ  ˇ  ˇ  ˇ  	ˇ  
ˇ  ˇ  ˇ  ˇ  ˇ                    |                            0 |                             0 |
+------+------+------+------+---------------------------------------------------------------------+------+------+------+------+---------------------------------------------------------------------+------------------------------+-------------------------------+
select *, rb_and_cardinality_agg(t1.r) from tt3 t1,tt3 t2 where t1.id=t2.id UNION select *, rb_and_cardinality_agg(tt2.r) from tt1 LEFT  JOIN tt2 on tt1.id=tt2.id;
ERROR 22000: Invalid data type for the operation
select rb_and_cardinality_agg(t1.r) from tt3 t1,tt3 t2 where t1.id=t2.id UNION select  rb_and_cardinality_agg(tt2.r) from tt1 LEFT  JOIN tt2 on tt1.id=tt2.id;
+------------------------------+
| rb_and_cardinality_agg(t1.r) |
+------------------------------+
|                            0 |
+------------------------------+
select  rb_and_cardinality_agg(t1.r),* from tt3 t1,tt3 t2 where t1.id=t2.id UNION  ALL select  rb_and_cardinality_agg(tt2.r),* from tt1 LEFT  JOIN tt2 on tt1.id=tt2.id;
+------------------------------+------+------+------+------+---------------------------------------------------------------------+------+------+------+------+---------------------------------------------------------------------+
| rb_and_cardinality_agg(t1.r) | id   | a0   | a    | r    | r1                                                                  | id   | a0   | a    | r    | r1                                                                  |
+------------------------------+------+------+------+------+---------------------------------------------------------------------+------+------+------+------+---------------------------------------------------------------------+
|                            0 |    0 | NULL |     |     | ˇ˛   ˇ  ˇ  ˇ  ˇ  ˇ  ˇ  ˇ  ˇ  ˇ  	ˇ  
ˇ  ˇ  ˇ  ˇ  ˇ                    |    0 | NULL |     |     | ˇ˛   ˇ  ˇ  ˇ  ˇ  ˇ  ˇ  ˇ  ˇ  ˇ  	ˇ  
ˇ  ˇ  ˇ  ˇ  ˇ                    |
|                            0 |    0 | NULL |     |     | ˇ˛   ˇ  ˇ  ˇ  ˇ  ˇ  ˇ  ˇ  ˇ  ˇ  	ˇ  
ˇ  ˇ  ˇ  ˇ  ˇ                    |    0 | NULL |     |     | ˇ˛   ˇ  ˇ  ˇ  ˇ  ˇ  ˇ  ˇ  ˇ  ˇ  	ˇ  
ˇ  ˇ  ˇ  ˇ  ˇ                    |
+------------------------------+------+------+------+------+---------------------------------------------------------------------+------+------+------+------+---------------------------------------------------------------------+
select  rb_and_cardinality_agg(tt2.r) from tt1 RIGHT  JOIN	 tt2 on tt1.id=tt2.id INTERSECT select  rb_and_cardinality_agg(tt2.r) from tt1 FULL  JOIN	tt2 on tt1.id=tt2.id;
+-------------------------------+
| rb_and_cardinality_agg(tt2.r) |
+-------------------------------+
|                             0 |
+-------------------------------+
select  rb_and_cardinality_agg(tt2.r) from tt1 FULL  JOIN	 tt2 on tt1.id=tt2.id  MINUS select  rb_and_cardinality_agg(t1.r) from tt3 t1,tt3 t2 where t1.id=t2.id;
+-------------------------------+
| rb_and_cardinality_agg(tt2.r) |
+-------------------------------+
+-------------------------------+
select  rb_and_cardinality_agg(tt2.r) from tt1 FULL  JOIN	 tt2 on tt1.id=tt2.id  MINUS select  rb_and_cardinality_agg(tt2.r) from tt1 FULL  JOIN	 tt2 on tt1.id=tt2.id;
+-------------------------------+
| rb_and_cardinality_agg(tt2.r) |
+-------------------------------+
+-------------------------------+
select *,rb_and_cardinality_agg(t.r) from (select * from tt2) t;
+----+------+------+------+---------------------------------------------------------------------+-----------------------------+
| id | a0   | a    | r    | r1                                                                  | rb_and_cardinality_agg(t.r) |
+----+------+------+------+---------------------------------------------------------------------+-----------------------------+
|  0 | NULL |     |     | ˇ˛   ˇ  ˇ  ˇ  ˇ  ˇ  ˇ  ˇ  ˇ  ˇ  	ˇ  
ˇ  ˇ  ˇ  ˇ  ˇ                    |                           0 |
+----+------+------+------+---------------------------------------------------------------------+-----------------------------+
select t.*,rb_and_cardinality_agg(t.r) from (select * from tt2) t;
+----+------+------+------+---------------------------------------------------------------------+-----------------------------+
| id | a0   | a    | r    | r1                                                                  | rb_and_cardinality_agg(t.r) |
+----+------+------+------+---------------------------------------------------------------------+-----------------------------+
|  0 | NULL |     |     | ˇ˛   ˇ  ˇ  ˇ  ˇ  ˇ  ˇ  ˇ  ˇ  ˇ  	ˇ  
ˇ  ˇ  ˇ  ˇ  ˇ                    |                           0 |
+----+------+------+------+---------------------------------------------------------------------+-----------------------------+
select * from tt1 where exists(select rb_and_cardinality_agg(tt1.r) from tt1);
+------+-------------------------------------------------------------------------------------------------------------------------------------------------------------------------------------------------------------------------------------------------------------------------------------------------------------------------------------------------------------------------------------+-------------------------------------------------------------------------------------------------------------------------------------------------------------------------------------------------------------------------------------------------------------+-------------------------------------------------------------------------------------------------------------------------------------------------------------------------------------------------------------------------------------------------------------+-------------------------------------------------------------------------------------------------------------------------------------------------------------------------------------------------------------------------------------------------------------+
| id   | a0                                                                                                                                                                                                                                                                                                                                                                                  | a                                                                                                                                                                                                                                                           | r                                                                                                                                                                                                                                                           | r1                                                                                                                                                                                                                                                          |
+------+-------------------------------------------------------------------------------------------------------------------------------------------------------------------------------------------------------------------------------------------------------------------------------------------------------------------------------------------------------------------------------------+-------------------------------------------------------------------------------------------------------------------------------------------------------------------------------------------------------------------------------------------------------------+-------------------------------------------------------------------------------------------------------------------------------------------------------------------------------------------------------------------------------------------------------------+-------------------------------------------------------------------------------------------------------------------------------------------------------------------------------------------------------------------------------------------------------------+
|    0 | NULL                                                                                                                                                                                                                                                                                                                                                                                |                                                                                                                                                                                                                                                            |                                                                                                                                                                                                                                                            | ˇ˛   ˇ  ˇ  ˇ  ˇ  ˇ  ˇ  ˇ  ˇ  ˇ  	ˇ  
ˇ  ˇ  ˇ  ˇ  ˇ                                                                                                                                                                                                            |
|    1 | 1                                                                                                                                                                                                                                                                                                                                                                                   |                                                                                                                                                                                                                                                          |                                                                                                                                                                                                                                                          |            ;0    '   '                                                                                                                                                                                                                               |
|    2 | 4294967296                                                                                                                                                                                                                                                                                                                                                                          |                                                                                                                                                                                                                                                          |                                                                                                                                                                                                                                                          | @&T    ‰T   ‘ˇˇˇ	   	   
   N     Û       ö;   ê      ^–≤   +      Ú*   '     ˇ=    œ     ø∆-    »      Ñ    êÂT   Á     ê&ˇˇ	   d      ?B           /u                        (kÓ      
      
   ª                              |
|    3 | 1,2,6,4,5,9                                                                                                                                                                                                                                                                                                                                                                         |                	                                                                                                                                                                                                                                    |                	                                                                                                                                                                                                                                    |            :0                   	 
                         :0                                                                                                                                                     |
|    3 | 1,2,6,4,5,9                                                                                                                                                                                                                                                                                                                                                                         |                	                                                                                                                                                                                                                                    |                	                                                                                                                                                                                                                                    |            :0             V           	 
                                                                                                                                                                             |
|    4 | 4294967296,4294967297,4294967298,4294967299                                                                                                                                                                                                                                                                                                                                         |                                                                                                                                                                                                                                                   |                                                                                                                                                                                                                                                   |            :0             V           	 
                                                                                                                                                                             |
|    5 | 1,2,3,4,5,6,7,8,9,10,11,12,13,14,15,16,17,18,19,20,21,22,23,24,25,26,27,28,29,30,31,32,33                                                                                                                                                                                                                                                                                           | :0                    	 
                        !                                                                                                                                                                         |            :0                    	 
                        !                                                                                                                                                             |                                                                                                                                                                                                                                                            |
|    5 | 1,2,3,4,5,6,7,8,9,10,11,12,13,14,15,16,17,18,19,20,21,22,23,24,25,26,27,28,29,30,31,65537,65536                                                                                                                                                                                                                                                                                     |            :0             V           	 
                                                                                                                                                                             |            :0             V           	 
                                                                                                                                                                             |                	                                                                                                                                                                                                                                    |
|    6 | 1,2,3,4,5,6,7,8,9,10,11,12,13,14,15,16,17,18,19,20,21,22,23,24,25,26,27,28,29,30,31,4294967298,65536                                                                                                                                                                                                                                                                                |            :0                   	 
                         :0                                                                                                                                                     |            :0                   	 
                         :0                                                                                                                                                     |                	                                                                                                                                                                                                                                    |
|    6 | 4294967296,4294967297,42949672969,4294967298,42949672961,42949672962,4294967299,4294967297,14294967296,14294967696,14295967296,5294967296,7294967296,9294967296,8294967296,42949617296,42949672916,4294967396,4294967496,
4294967595,4294967696,4294967795,4294968295,4294967995,4294977295,4294987295,4294997295,4294968295,4294969295,4295967295,4296967295,4297967295,4298967295 | @&T    ‰T   ‘ˇˇˇ	   	   
   N     Û       ö;   ê      ^–≤   +      Ú*   '     ˇ=    œ     ø∆-    »      Ñ    êÂT   Á     ê&ˇˇ	   d      ?B           /u                        (kÓ      
      
   ª                              | @&T    ‰T   ‘ˇˇˇ	   	   
   N     Û       ö;   ê      ^–≤   +      Ú*   '     ˇ=    œ     ø∆-    »      Ñ    êÂT   Á     ê&ˇˇ	   d      ?B           /u                        (kÓ      
      
   ª                              |                                                                                                                                                                                                                                                          |
|    7 | 2542                                                                                                                                                                                                                                                                                                                                                                                | ;0    '   '                                                                                                                                                                                                                                           |            ;0    '   '                                                                                                                                                                                                                               |                                                                                                                                                                                                                                                          |
|    8 | 56214,-7854                                                                                                                                                                                                                                                                                                                                                                         | ˇ˛   ˇ  ˇ  ˇ  ˇ  ˇ  ˇ  ˇ  ˇ  ˇ  	ˇ  
ˇ  ˇ  ˇ  ˇ  ˇ                                                                                                                                                                                                            | ˇ˛   ˇ  ˇ  ˇ  ˇ  ˇ  ˇ  ˇ  ˇ  ˇ  	ˇ  
ˇ  ˇ  ˇ  ˇ  ˇ                                                                                                                                                                                                            |                                                                                                                                                                                                                                                          |
|    9 | 1,23,8977,973747                                                                                                                                                                                                                                                                                                                                                                    |            ;0     Ûm      `g   ;0         *   :0     Û     aƒ                                                                                                                                                                                 | ˇ˛   ˇ  ˇ  ˇ  ˇ  ˇ  ˇ  ˇ  ˇ  ˇ  	ˇ  
ˇ  ˇ  ˇ  ˇ  ˇ                                                                                                                                                                                                            |                                                                                                                                                                                                                                                          |
|   10 | NULL                                                                                                                                                                                                                                                                                                                                                                                | NULL                                                                                                                                                                                                                                                        | NULL                                                                                                                                                                                                                                                        | NULL                                                                                                                                                                                                                                                        |
|   11 | NULL                                                                                                                                                                                                                                                                                                                                                                                | NULL                                                                                                                                                                                                                                                        | NULL                                                                                                                                                                                                                                                        | NULL                                                                                                                                                                                                                                                        |
+------+-------------------------------------------------------------------------------------------------------------------------------------------------------------------------------------------------------------------------------------------------------------------------------------------------------------------------------------------------------------------------------------+-------------------------------------------------------------------------------------------------------------------------------------------------------------------------------------------------------------------------------------------------------------+-------------------------------------------------------------------------------------------------------------------------------------------------------------------------------------------------------------------------------------------------------------+-------------------------------------------------------------------------------------------------------------------------------------------------------------------------------------------------------------------------------------------------------------+
select +rb_and_cardinality_agg(r) from tt1;
+----------------------------+
| +rb_and_cardinality_agg(r) |
+----------------------------+
|                          0 |
+----------------------------+
select +rb_and_cardinality_agg(rb_from_string('321,2,23234,3434'));
+-------------------------------------------------------------+
| +rb_and_cardinality_agg(rb_from_string('321,2,23234,3434')) |
+-------------------------------------------------------------+
|                                                           4 |
+-------------------------------------------------------------+
select -rb_and_cardinality_agg(rb_from_string('321,2,23234,3434'));
+-------------------------------------------------------------+
| -rb_and_cardinality_agg(rb_from_string('321,2,23234,3434')) |
+-------------------------------------------------------------+
|                                                          -4 |
+-------------------------------------------------------------+
select +rb_and_cardinality_agg(r) from vtt1;
+----------------------------+
| +rb_and_cardinality_agg(r) |
+----------------------------+
|                          0 |
+----------------------------+
select -rb_and_cardinality_agg(r) from tt1;
+----------------------------+
| -rb_and_cardinality_agg(r) |
+----------------------------+
|                          0 |
+----------------------------+
select rb_and_cardinality_agg(r)+rb_and_cardinality_agg(r) from tt1;
+-----------------------------------------------------+
| rb_and_cardinality_agg(r)+rb_and_cardinality_agg(r) |
+-----------------------------------------------------+
|                                                   0 |
+-----------------------------------------------------+
select rb_and_cardinality_agg(r)+1 from tt1;
+-----------------------------+
| rb_and_cardinality_agg(r)+1 |
+-----------------------------+
|                           1 |
+-----------------------------+
select rb_and_cardinality_agg(r)+'test' from tt1;
+----------------------------------+
| rb_and_cardinality_agg(r)+'test' |
+----------------------------------+
|                                0 |
+----------------------------------+
Warnings:
Warning	1292	Truncated incorrect DOUBLE value: 'test'
select rb_and_cardinality_agg(r)+null from tt1;
+--------------------------------+
| rb_and_cardinality_agg(r)+null |
+--------------------------------+
|                           NULL |
+--------------------------------+
select rb_and_cardinality_agg(r)+false from tt1;
+---------------------------------+
| rb_and_cardinality_agg(r)+false |
+---------------------------------+
|                               0 |
+---------------------------------+
select rb_and_cardinality_agg(r)+true from tt1;
+--------------------------------+
| rb_and_cardinality_agg(r)+true |
+--------------------------------+
|                              1 |
+--------------------------------+
select rb_and_cardinality_agg(r)-rb_and_cardinality_agg(r) from tt1;
+-----------------------------------------------------+
| rb_and_cardinality_agg(r)-rb_and_cardinality_agg(r) |
+-----------------------------------------------------+
|                                                   0 |
+-----------------------------------------------------+
select rb_and_cardinality_agg(r)-0 from tt1;
+-----------------------------+
| rb_and_cardinality_agg(r)-0 |
+-----------------------------+
|                           0 |
+-----------------------------+
select rb_and_cardinality_agg(r)-'test' from tt1;
+----------------------------------+
| rb_and_cardinality_agg(r)-'test' |
+----------------------------------+
|                                0 |
+----------------------------------+
Warnings:
Warning	1292	Truncated incorrect DOUBLE value: 'test'
select rb_and_cardinality_agg(r)-null from tt1;
+--------------------------------+
| rb_and_cardinality_agg(r)-null |
+--------------------------------+
|                           NULL |
+--------------------------------+
select rb_and_cardinality_agg(r)-false from tt1;
+---------------------------------+
| rb_and_cardinality_agg(r)-false |
+---------------------------------+
|                               0 |
+---------------------------------+
select rb_and_cardinality_agg(r)-true from tt1 WHERE ID=3;
+--------------------------------+
| rb_and_cardinality_agg(r)-true |
+--------------------------------+
|                              5 |
+--------------------------------+
select rb_and_cardinality_agg(r)*rb_and_cardinality_agg(r) from tt1;
+-----------------------------------------------------+
| rb_and_cardinality_agg(r)*rb_and_cardinality_agg(r) |
+-----------------------------------------------------+
|                                                   0 |
+-----------------------------------------------------+
select rb_and_cardinality_agg(r)*1 from tt1;
+-----------------------------+
| rb_and_cardinality_agg(r)*1 |
+-----------------------------+
|                           0 |
+-----------------------------+
select rb_and_cardinality_agg(r)*'test' from tt1;
+----------------------------------+
| rb_and_cardinality_agg(r)*'test' |
+----------------------------------+
|                                0 |
+----------------------------------+
Warnings:
Warning	1292	Truncated incorrect DOUBLE value: 'test'
select rb_and_cardinality_agg(r)*null from tt1;
+--------------------------------+
| rb_and_cardinality_agg(r)*null |
+--------------------------------+
|                           NULL |
+--------------------------------+
select rb_and_cardinality_agg(r)*false from tt1;
+---------------------------------+
| rb_and_cardinality_agg(r)*false |
+---------------------------------+
|                               0 |
+---------------------------------+
select rb_and_cardinality_agg(r)*true from tt1;
+--------------------------------+
| rb_and_cardinality_agg(r)*true |
+--------------------------------+
|                              0 |
+--------------------------------+
select rb_and_cardinality_agg(r)*rb_and_cardinality_agg(r) from tt1;
+-----------------------------------------------------+
| rb_and_cardinality_agg(r)*rb_and_cardinality_agg(r) |
+-----------------------------------------------------+
|                                                   0 |
+-----------------------------------------------------+
select rb_and_cardinality_agg(r)*1 from tt1;
+-----------------------------+
| rb_and_cardinality_agg(r)*1 |
+-----------------------------+
|                           0 |
+-----------------------------+
select rb_and_cardinality_agg(r)*'test' from tt1;
+----------------------------------+
| rb_and_cardinality_agg(r)*'test' |
+----------------------------------+
|                                0 |
+----------------------------------+
Warnings:
Warning	1292	Truncated incorrect DOUBLE value: 'test'
select rb_and_cardinality_agg(r)*null from tt1;
+--------------------------------+
| rb_and_cardinality_agg(r)*null |
+--------------------------------+
|                           NULL |
+--------------------------------+
select rb_and_cardinality_agg(r)*false from tt1;
+---------------------------------+
| rb_and_cardinality_agg(r)*false |
+---------------------------------+
|                               0 |
+---------------------------------+
select rb_and_cardinality_agg(r)*true from tt1;
+--------------------------------+
| rb_and_cardinality_agg(r)*true |
+--------------------------------+
|                              0 |
+--------------------------------+
select rb_and_cardinality_agg(r)/rb_and_cardinality_agg(r) from tt1;
+-----------------------------------------------------+
| rb_and_cardinality_agg(r)/rb_and_cardinality_agg(r) |
+-----------------------------------------------------+
|                                                NULL |
+-----------------------------------------------------+
select rb_and_cardinality_agg(r)/1 from tt1;
+-----------------------------+
| rb_and_cardinality_agg(r)/1 |
+-----------------------------+
|                      0.0000 |
+-----------------------------+
select rb_and_cardinality_agg(r)/'test' from tt1;
+----------------------------------+
| rb_and_cardinality_agg(r)/'test' |
+----------------------------------+
|                             NULL |
+----------------------------------+
Warnings:
Warning	1292	Truncated incorrect DOUBLE value: 'test'
select rb_and_cardinality_agg(r)/null from tt1;
+--------------------------------+
| rb_and_cardinality_agg(r)/null |
+--------------------------------+
|                           NULL |
+--------------------------------+
select rb_and_cardinality_agg(r)/false from tt1;
+---------------------------------+
| rb_and_cardinality_agg(r)/false |
+---------------------------------+
|                            NULL |
+---------------------------------+
select rb_and_cardinality_agg(r)/true from tt1;
+--------------------------------+
| rb_and_cardinality_agg(r)/true |
+--------------------------------+
|                         0.0000 |
+--------------------------------+
select rb_and_cardinality_agg(r) div rb_and_cardinality_agg(r) from tt1;
+---------------------------------------------------------+
| rb_and_cardinality_agg(r) div rb_and_cardinality_agg(r) |
+---------------------------------------------------------+
|                                                    NULL |
+---------------------------------------------------------+
select rb_and_cardinality_agg(r) div 1 from tt1;
+---------------------------------+
| rb_and_cardinality_agg(r) div 1 |
+---------------------------------+
|                               0 |
+---------------------------------+
select rb_and_cardinality_agg(r) div 'test' from tt1;
+--------------------------------------+
| rb_and_cardinality_agg(r) div 'test' |
+--------------------------------------+
|                                 NULL |
+--------------------------------------+
Warnings:
Warning	1292	Truncated incorrect DECIMAL value: 'test'
select rb_and_cardinality_agg(r) div null from tt1;
+------------------------------------+
| rb_and_cardinality_agg(r) div null |
+------------------------------------+
|                               NULL |
+------------------------------------+
select rb_and_cardinality_agg(r) div false from tt1;
+-------------------------------------+
| rb_and_cardinality_agg(r) div false |
+-------------------------------------+
|                                NULL |
+-------------------------------------+
select rb_and_cardinality_agg(r) div true from tt1;
+------------------------------------+
| rb_and_cardinality_agg(r) div true |
+------------------------------------+
|                                  0 |
+------------------------------------+
select rb_and_cardinality_agg(r) % rb_and_cardinality_agg(r) from tt1;
+-------------------------------------------------------+
| rb_and_cardinality_agg(r) % rb_and_cardinality_agg(r) |
+-------------------------------------------------------+
|                                                  NULL |
+-------------------------------------------------------+
select rb_and_cardinality_agg(r) % 1 from tt1;
+-------------------------------+
| rb_and_cardinality_agg(r) % 1 |
+-------------------------------+
|                             0 |
+-------------------------------+
select rb_and_cardinality_agg(r) % 'test' from tt1;
+------------------------------------+
| rb_and_cardinality_agg(r) % 'test' |
+------------------------------------+
|                               NULL |
+------------------------------------+
Warnings:
Warning	1292	Truncated incorrect DOUBLE value: 'test'
select rb_and_cardinality_agg(r) % null from tt1;
+----------------------------------+
| rb_and_cardinality_agg(r) % null |
+----------------------------------+
|                             NULL |
+----------------------------------+
select rb_and_cardinality_agg(r) % false from tt1;
+-----------------------------------+
| rb_and_cardinality_agg(r) % false |
+-----------------------------------+
|                              NULL |
+-----------------------------------+
select rb_and_cardinality_agg(r) % true from tt1;
+----------------------------------+
| rb_and_cardinality_agg(r) % true |
+----------------------------------+
|                                0 |
+----------------------------------+
select rb_and_cardinality_agg(r) mod rb_and_cardinality_agg(r) from tt1;
+---------------------------------------------------------+
| rb_and_cardinality_agg(r) mod rb_and_cardinality_agg(r) |
+---------------------------------------------------------+
|                                                    NULL |
+---------------------------------------------------------+
select rb_and_cardinality_agg(r) mod 1 from tt1;
+---------------------------------+
| rb_and_cardinality_agg(r) mod 1 |
+---------------------------------+
|                               0 |
+---------------------------------+
select rb_and_cardinality_agg(r) mod 'test' from tt1;
+--------------------------------------+
| rb_and_cardinality_agg(r) mod 'test' |
+--------------------------------------+
|                                 NULL |
+--------------------------------------+
Warnings:
Warning	1292	Truncated incorrect DOUBLE value: 'test'
select rb_and_cardinality_agg(r) mod null from tt1;
+------------------------------------+
| rb_and_cardinality_agg(r) mod null |
+------------------------------------+
|                               NULL |
+------------------------------------+
select rb_and_cardinality_agg(r) mod false from tt1;
+-------------------------------------+
| rb_and_cardinality_agg(r) mod false |
+-------------------------------------+
|                                NULL |
+-------------------------------------+
select rb_and_cardinality_agg(r) mod true from tt1;
+------------------------------------+
| rb_and_cardinality_agg(r) mod true |
+------------------------------------+
|                                  0 |
+------------------------------------+
select rb_and_cardinality_agg(r) & rb_and_cardinality_agg(r1) from tt1;
+--------------------------------------------------------+
| rb_and_cardinality_agg(r) & rb_and_cardinality_agg(r1) |
+--------------------------------------------------------+
|                                                      0 |
+--------------------------------------------------------+
select rb_and_cardinality_agg(r) & 1 from tt1;
+-------------------------------+
| rb_and_cardinality_agg(r) & 1 |
+-------------------------------+
|                             0 |
+-------------------------------+
select rb_and_cardinality_agg(r) & 'test' from tt1;
+------------------------------------+
| rb_and_cardinality_agg(r) & 'test' |
+------------------------------------+
|                                  0 |
+------------------------------------+
Warnings:
Warning	1292	Truncated incorrect INTEGER value: 'test'
select rb_and_cardinality_agg(r) & null from tt1;
+----------------------------------+
| rb_and_cardinality_agg(r) & null |
+----------------------------------+
|                             NULL |
+----------------------------------+
select rb_and_cardinality_agg(r) & false from tt1;
+-----------------------------------+
| rb_and_cardinality_agg(r) & false |
+-----------------------------------+
|                                 0 |
+-----------------------------------+
select rb_and_cardinality_agg(r) & true from tt1;
+----------------------------------+
| rb_and_cardinality_agg(r) & true |
+----------------------------------+
|                                0 |
+----------------------------------+
select rb_and_cardinality_agg(r) | rb_and_cardinality_agg(r) from tt1;
+-------------------------------------------------------+
| rb_and_cardinality_agg(r) | rb_and_cardinality_agg(r) |
+-------------------------------------------------------+
|                                                     0 |
+-------------------------------------------------------+
select rb_and_cardinality_agg(r) | 1 from tt1;
+-------------------------------+
| rb_and_cardinality_agg(r) | 1 |
+-------------------------------+
|                             1 |
+-------------------------------+
select rb_and_cardinality_agg(r) | 'test' from tt1;
+------------------------------------+
| rb_and_cardinality_agg(r) | 'test' |
+------------------------------------+
|                                  0 |
+------------------------------------+
Warnings:
Warning	1292	Truncated incorrect INTEGER value: 'test'
select rb_and_cardinality_agg(r) | null from tt1;
+----------------------------------+
| rb_and_cardinality_agg(r) | null |
+----------------------------------+
|                             NULL |
+----------------------------------+
select rb_and_cardinality_agg(r) | false from tt1;
+-----------------------------------+
| rb_and_cardinality_agg(r) | false |
+-----------------------------------+
|                                 0 |
+-----------------------------------+
select rb_and_cardinality_agg(r) | true from tt1;
+----------------------------------+
| rb_and_cardinality_agg(r) | true |
+----------------------------------+
|                                1 |
+----------------------------------+
select ~rb_and_cardinality_agg(r)from tt1;
+----------------------------+
| ~rb_and_cardinality_agg(r) |
+----------------------------+
|       18446744073709551615 |
+----------------------------+
select rb_and_cardinality_agg(r) ^ rb_and_cardinality_agg(r) from tt1;
+-------------------------------------------------------+
| rb_and_cardinality_agg(r) ^ rb_and_cardinality_agg(r) |
+-------------------------------------------------------+
|                                                     0 |
+-------------------------------------------------------+
select rb_and_cardinality_agg(r) ^ 1 from tt1;
+-------------------------------+
| rb_and_cardinality_agg(r) ^ 1 |
+-------------------------------+
|                             1 |
+-------------------------------+
select rb_and_cardinality_agg(r) ^ 'test' from tt1;
+------------------------------------+
| rb_and_cardinality_agg(r) ^ 'test' |
+------------------------------------+
|                                  0 |
+------------------------------------+
Warnings:
Warning	1292	Truncated incorrect INTEGER value: 'test'
select rb_and_cardinality_agg(r) ^ null from tt1;
+----------------------------------+
| rb_and_cardinality_agg(r) ^ null |
+----------------------------------+
|                             NULL |
+----------------------------------+
select rb_and_cardinality_agg(r) ^ false from tt1;
+-----------------------------------+
| rb_and_cardinality_agg(r) ^ false |
+-----------------------------------+
|                                 0 |
+-----------------------------------+
select rb_and_cardinality_agg(r) ^ true from tt1;
+----------------------------------+
| rb_and_cardinality_agg(r) ^ true |
+----------------------------------+
|                                1 |
+----------------------------------+
select rb_and_cardinality_agg(r) << rb_and_cardinality_agg(r)  from tt1;
+--------------------------------------------------------+
| rb_and_cardinality_agg(r) << rb_and_cardinality_agg(r) |
+--------------------------------------------------------+
|                                                      0 |
+--------------------------------------------------------+
select rb_and_cardinality_agg(r) << 1 from tt1;
+--------------------------------+
| rb_and_cardinality_agg(r) << 1 |
+--------------------------------+
|                              0 |
+--------------------------------+
select rb_and_cardinality_agg(r) << 'test' from tt1;
+-------------------------------------+
| rb_and_cardinality_agg(r) << 'test' |
+-------------------------------------+
|                                   0 |
+-------------------------------------+
Warnings:
Warning	1292	Truncated incorrect INTEGER value: 'test'
select rb_and_cardinality_agg(r) << null from tt1;
+-----------------------------------+
| rb_and_cardinality_agg(r) << null |
+-----------------------------------+
|                              NULL |
+-----------------------------------+
select rb_and_cardinality_agg(r) << false from tt1;
+------------------------------------+
| rb_and_cardinality_agg(r) << false |
+------------------------------------+
|                                  0 |
+------------------------------------+
select rb_and_cardinality_agg(r) << true from tt1;
+-----------------------------------+
| rb_and_cardinality_agg(r) << true |
+-----------------------------------+
|                                 0 |
+-----------------------------------+
select rb_and_cardinality_agg(r) >> rb_build_agg(1) from tt1;
ERROR 22000: Invalid data type for the operation
select rb_and_cardinality_agg(r) >> 1 from tt1;
+--------------------------------+
| rb_and_cardinality_agg(r) >> 1 |
+--------------------------------+
|                              0 |
+--------------------------------+
select rb_and_cardinality_agg(r) >> 'test' from tt1;
+-------------------------------------+
| rb_and_cardinality_agg(r) >> 'test' |
+-------------------------------------+
|                                   0 |
+-------------------------------------+
Warnings:
Warning	1292	Truncated incorrect INTEGER value: 'test'
select rb_and_cardinality_agg(r) >> null from tt1;
+-----------------------------------+
| rb_and_cardinality_agg(r) >> null |
+-----------------------------------+
|                              NULL |
+-----------------------------------+
select rb_and_cardinality_agg(r) >> false from tt1;
+------------------------------------+
| rb_and_cardinality_agg(r) >> false |
+------------------------------------+
|                                  0 |
+------------------------------------+
select rb_and_cardinality_agg(r) >> true from tt1;
+-----------------------------------+
| rb_and_cardinality_agg(r) >> true |
+-----------------------------------+
|                                 0 |
+-----------------------------------+
select rb_and_cardinality_agg(r) is true from tt1;
+-----------------------------------+
| rb_and_cardinality_agg(r) is true |
+-----------------------------------+
|                                 0 |
+-----------------------------------+
select rb_and_cardinality_agg(r) in (rb_and_cardinality_agg(r) ) from tt1;
+-----------------------------------------------------------+
| rb_and_cardinality_agg(r) in (rb_and_cardinality_agg(r) ) |
+-----------------------------------------------------------+
|                                                         1 |
+-----------------------------------------------------------+
select rb_and_cardinality_agg(r) not in (rb_and_cardinality_agg(r) ) from tt1;
+---------------------------------------------------------------+
| rb_and_cardinality_agg(r) not in (rb_and_cardinality_agg(r) ) |
+---------------------------------------------------------------+
|                                                             0 |
+---------------------------------------------------------------+
select rb_and_cardinality_agg(r) like (rb_and_cardinality_agg(r) ) from tt1;
+-------------------------------------------------------------+
| rb_and_cardinality_agg(r) like (rb_and_cardinality_agg(r) ) |
+-------------------------------------------------------------+
|                                                           1 |
+-------------------------------------------------------------+
select rb_and_cardinality_agg(r) like 1 from tt1;
+----------------------------------+
| rb_and_cardinality_agg(r) like 1 |
+----------------------------------+
|                                0 |
+----------------------------------+
select  rb_and_cardinality_agg(r) BETWEEN rb_and_cardinality_agg(r) and rb_and_cardinality_agg(r) from tt1;
+-------------------------------------------------------------------------------------------+
| rb_and_cardinality_agg(r) BETWEEN rb_and_cardinality_agg(r) and rb_and_cardinality_agg(r) |
+-------------------------------------------------------------------------------------------+
|                                                                                         1 |
+-------------------------------------------------------------------------------------------+
select  rb_and_cardinality_agg(r) is null from tt1;
+-----------------------------------+
| rb_and_cardinality_agg(r) is null |
+-----------------------------------+
|                                 0 |
+-----------------------------------+
select  rb_and_cardinality_agg(r) is not null from tt1;
+---------------------------------------+
| rb_and_cardinality_agg(r) is not null |
+---------------------------------------+
|                                     1 |
+---------------------------------------+
select  rb_and_cardinality_agg(r) is false from tt1;
+------------------------------------+
| rb_and_cardinality_agg(r) is false |
+------------------------------------+
|                                  1 |
+------------------------------------+
select  rb_and_cardinality_agg(r) is true from tt1;
+-----------------------------------+
| rb_and_cardinality_agg(r) is true |
+-----------------------------------+
|                                 0 |
+-----------------------------------+
select not rb_and_cardinality_agg(r) from tt1;
+-------------------------------+
| not rb_and_cardinality_agg(r) |
+-------------------------------+
|                             1 |
+-------------------------------+
select  rb_and_cardinality_agg(r) and rb_and_cardinality_agg(r)  from tt1;
+---------------------------------------------------------+
| rb_and_cardinality_agg(r) and rb_and_cardinality_agg(r) |
+---------------------------------------------------------+
|                                                       0 |
+---------------------------------------------------------+
select  rb_and_cardinality_agg(r) && rb_and_cardinality_agg(r)  from tt1;
+--------------------------------------------------------+
| rb_and_cardinality_agg(r) && rb_and_cardinality_agg(r) |
+--------------------------------------------------------+
|                                                      0 |
+--------------------------------------------------------+
select  rb_and_cardinality_agg(r) or rb_and_cardinality_agg(r)  from tt1;
+--------------------------------------------------------+
| rb_and_cardinality_agg(r) or rb_and_cardinality_agg(r) |
+--------------------------------------------------------+
|                                                      0 |
+--------------------------------------------------------+
select  rb_and_cardinality_agg(r) || rb_and_cardinality_agg(r)  from tt1;
+--------------------------------------------------------+
| rb_and_cardinality_agg(r) || rb_and_cardinality_agg(r) |
+--------------------------------------------------------+
|                                                      0 |
+--------------------------------------------------------+
select  rb_and_cardinality_agg(r) || 1 from tt1;
+--------------------------------+
| rb_and_cardinality_agg(r) || 1 |
+--------------------------------+
|                              1 |
+--------------------------------+
select  rb_and_cardinality_agg(r) XOR rb_and_cardinality_agg(r)  from tt1;
+---------------------------------------------------------+
| rb_and_cardinality_agg(r) XOR rb_and_cardinality_agg(r) |
+---------------------------------------------------------+
|                                                       0 |
+---------------------------------------------------------+
select  rb_and_cardinality_agg(r) XOR 1 from tt1;
+---------------------------------+
| rb_and_cardinality_agg(r) XOR 1 |
+---------------------------------+
|                               1 |
+---------------------------------+
select  'test' XOR rb_and_cardinality_agg(r) from tt1;
+--------------------------------------+
| 'test' XOR rb_and_cardinality_agg(r) |
+--------------------------------------+
|                                    0 |
+--------------------------------------+
Warnings:
Warning	1292	Truncated incorrect DOUBLE value: 'test'
SELECT BINARY rb_and_cardinality_agg(r) = rb_and_cardinality_agg(r) from tt1;
+--------------------------------------------------------------+
| BINARY rb_and_cardinality_agg(r) = rb_and_cardinality_agg(r) |
+--------------------------------------------------------------+
|                                                            1 |
+--------------------------------------------------------------+
select CONVERT(rb_and_cardinality_agg(r) USING BINARY) from tt1;
+-------------------------------------------------+
| CONVERT(rb_and_cardinality_agg(r) USING BINARY) |
+-------------------------------------------------+
| 0                                               |
+-------------------------------------------------+
drop table if exists tt3;
create table tt3(id int primary key,b bigint unsigned ,a varchar(50),r roaringbitmap );
drop view if exists vtt3;
create view vtt3 as select * from tt3;
insert into tt3 values((select rb_and_cardinality_agg(rb_from_string('1'))),(select rb_and_cardinality_agg(rb_from_string('1'))),(select rb_and_cardinality_agg(rb_from_string('1'))),rb_from_string('1'));
insert into tt3 values((select rb_and_cardinality_agg(rb_from_string('2'))),(select rb_and_cardinality_agg(rb_from_string('1'))),(select rb_and_cardinality_agg(rb_from_string('1'))),(select rb_and_cardinality_agg(rb_from_string('1'))));
ERROR 0A000: type casting not supported
replace into tt3 values((select rb_and_cardinality_agg(rb_from_string('1'))),(select rb_and_cardinality_agg(rb_from_string('2'))),(select rb_and_cardinality_agg(rb_from_string('1'))),rb_from_string('1'));
replace into tt3 values((select rb_and_cardinality_agg(rb_from_string('1,2'))),(select rb_and_cardinality_agg(rb_from_string('2'))),(select rb_and_cardinality_agg(rb_from_string('1'))),rb_from_string('1'));
insert /*+ OPT_PARAM('enable_rich_vector_format', 'FALSE') OPT_PARAM('rowsets_enabled', 'FALSE') enable_parallel_dml parallel(2)  read_consistency(weak) */into tt3 values((select rb_and_cardinality_agg(rb_from_string('1,2,3'))),(select rb_and_cardinality_agg(rb_from_string('2'))),(select rb_and_cardinality_agg(rb_from_string('1'))),rb_from_string('1')),
((select rb_and_cardinality_agg(rb_from_string('1,2,3,5,6'))),(select rb_and_cardinality_agg(rb_from_string('2'))),(select rb_and_cardinality_agg(rb_from_string('1'))),rb_from_string('1')),
((select rb_and_cardinality_agg(rb_from_string('1,2,3,4'))),(select rb_and_cardinality_agg(rb_from_string('2'))),(select rb_and_cardinality_agg(rb_from_string('1'))),rb_from_string('1'));
replace into tt3 values((select rb_and_cardinality_agg(rb_from_string('1,2,3'))),(select rb_and_cardinality_agg(rb_from_string('2'))),(select rb_and_cardinality_agg(rb_from_string('1'))),rb_from_string('1')),
((select rb_and_cardinality_agg(rb_from_string('1,2,3,5,6'))),(select rb_and_cardinality_agg(rb_from_string('2'))),(select rb_and_cardinality_agg(rb_from_string('1'))),rb_from_string('1')),
((select rb_and_cardinality_agg(rb_from_string('1,2,3,4'))),(select rb_and_cardinality_agg(rb_from_string('2'))),(select rb_and_cardinality_agg(rb_from_string('1'))),rb_from_string('1')),
((select rb_and_cardinality_agg(rb_from_string('1,2,3,4,5,6,7,8'))),(select rb_and_cardinality_agg(rb_from_string('2'))),(select rb_and_cardinality_agg(rb_from_string('1'))),rb_from_string('1'));
insert into tt3 values((select rb_and_cardinality_agg(rb_from_string('1'))),(select rb_and_cardinality_agg(rb_from_string('1'))),(select rb_and_cardinality_agg(rb_from_string('1,3'))),rb_from_string('1,4')) 
ON DUPLICATE KEY UPDATE  b=(select rb_and_cardinality_agg(rb_from_string('1,2,3,4,5,5,6,7,8,89'))),a=(select rb_and_cardinality_agg(rb_from_string('1,2,3,4,5,5,6,7,8,89')));
select * from tt3;
+----+------+------+--------+
| id | b    | a    | r      |
+----+------+------+--------+
|  1 |    9 | 9    |     |
|  2 |    1 | 1    |     |
|  3 |    1 | 1    |     |
|  4 |    1 | 1    |     |
|  5 |    1 | 1    |     |
|  8 |    1 | 1    |     |
+----+------+------+--------+
insert into tt3 values((select rb_and_cardinality_agg(rb_from_string('1,2,3,4,5,6,7,8,9,10'))),(select rb_and_cardinality_agg(rb_from_string('1'))),(select rb_and_cardinality_agg(rb_from_string('1,3'))),rb_from_string('1,4')) 
ON DUPLICATE KEY UPDATE  b=(select rb_and_cardinality_agg(rb_from_string('1,2,3,4,5,5,6,7,8,89'))),a=(select rb_and_cardinality_agg(rb_from_string('1,2,3,4,5,5,6,7,8,89')));
update tt3 set  b=(select rb_and_cardinality_agg(rb_from_string('1,2,3,4,5,5,6,7,8,89'))) where id>2;
delete from tt3;
select * from tt3;
+----+------+------+------+
| id | b    | a    | r    |
+----+------+------+------+
+----+------+------+------+
insert into vtt3 values((select rb_and_cardinality_agg(rb_from_string('1'))),(select rb_and_cardinality_agg(rb_from_string('1'))),(select rb_and_cardinality_agg(rb_from_string('1'))),rb_from_string('1'));
insert into vtt3 values((select rb_and_cardinality_agg(rb_from_string('2'))),(select rb_and_cardinality_agg(rb_from_string('1'))),(select rb_and_cardinality_agg(rb_from_string('1'))),(select rb_and_cardinality_agg(rb_from_string('1'))));
ERROR 0A000: type casting not supported
replace into vtt3 values((select rb_and_cardinality_agg(rb_from_string('1'))),(select rb_and_cardinality_agg(rb_from_string('2'))),(select rb_and_cardinality_agg(rb_from_string('1'))),rb_from_string('1'));
replace into vtt3 values((select rb_and_cardinality_agg(rb_from_string('1,2'))),(select rb_and_cardinality_agg(rb_from_string('2'))),(select rb_and_cardinality_agg(rb_from_string('1'))),rb_from_string('1'));
insert into vtt3 values((select rb_and_cardinality_agg(rb_from_string('1,2,3'))),(select rb_and_cardinality_agg(rb_from_string('2'))),(select rb_and_cardinality_agg(rb_from_string('1'))),rb_from_string('1')),
((select rb_and_cardinality_agg(rb_from_string('1,2,3,5,6'))),(select rb_and_cardinality_agg(rb_from_string('2'))),(select rb_and_cardinality_agg(rb_from_string('1'))),rb_from_string('1')),
((select rb_and_cardinality_agg(rb_from_string('1,2,3,4'))),(select rb_and_cardinality_agg(rb_from_string('2'))),(select rb_and_cardinality_agg(rb_from_string('1'))),rb_from_string('1'));
replace into vtt3 values((select rb_and_cardinality_agg(rb_from_string('1,2,3'))),(select rb_and_cardinality_agg(rb_from_string('2'))),(select rb_and_cardinality_agg(rb_from_string('1'))),rb_from_string('1')),
((select rb_and_cardinality_agg(rb_from_string('1,2,3,5,6'))),(select rb_and_cardinality_agg(rb_from_string('2'))),(select rb_and_cardinality_agg(rb_from_string('1'))),rb_from_string('1')),
((select rb_and_cardinality_agg(rb_from_string('1,2,3,4'))),(select rb_and_cardinality_agg(rb_from_string('2'))),(select rb_and_cardinality_agg(rb_from_string('1'))),rb_from_string('1')),
((select rb_and_cardinality_agg(rb_from_string('1,2,3,4,5,6,7,8'))),(select rb_and_cardinality_agg(rb_from_string('2'))),(select rb_and_cardinality_agg(rb_from_string('1'))),rb_from_string('1'));
insert into vtt3 values((select rb_and_cardinality_agg(rb_from_string('1'))),(select rb_and_cardinality_agg(rb_from_string('1'))),(select rb_and_cardinality_agg(rb_from_string('1,3'))),rb_from_string('1,4')) 
ON DUPLICATE KEY UPDATE  b=(select rb_and_cardinality_agg(rb_from_string('1,2,3,4,5,5,6,7,8,89'))),a=(select rb_and_cardinality_agg(rb_from_string('1,2,3,4,5,5,6,7,8,89')));
insert into vtt3 values((select rb_and_cardinality_agg(rb_from_string('1,2,3,4,5,6,7,8,9,10'))),(select rb_and_cardinality_agg(rb_from_string('1'))),(select rb_and_cardinality_agg(rb_from_string('1,3'))),rb_from_string('1,4')) 
ON DUPLICATE KEY UPDATE  b=(select rb_and_cardinality_agg(rb_from_string('1,2,3,4,5,5,6,7,8,89'))),a=(select rb_and_cardinality_agg(rb_from_string('1,2,3,4,5,5,6,7,8,89')));
update vtt3 set  b=(select rb_and_cardinality_agg(rb_from_string('1,2,3,4,5,5,6,7,8,89'))) where id>2;
select * from vtt3;
+----+------+------+-------------+
| id | b    | a    | r           |
+----+------+------+-------------+
|  1 |    9 | 9    |          |
|  2 |    1 | 1    |          |
|  3 |    9 | 1    |          |
|  4 |    9 | 1    |          |
|  5 |    9 | 1    |          |
|  8 |    9 | 1    |          |
| 10 |    9 | 2    |        |
+----+------+------+-------------+
delete from vtt3;
select * from vtt3;
+----+------+------+------+
| id | b    | a    | r    |
+----+------+------+------+
+----+------+------+------+
replace into vtt3 values((select rb_and_cardinality_agg(rb_from_string('1'))),(select rb_and_cardinality_agg(rb_from_string('2'))),(select rb_and_cardinality_agg(rb_from_string('1'))),rb_from_string('1'));
replace into vtt3 values((select rb_and_cardinality_agg(rb_from_string('1,2'))),(select rb_and_cardinality_agg(rb_from_string('2'))),(select rb_and_cardinality_agg(rb_from_string('1'))),rb_from_string('1'));
insert into vtt3 values((select rb_and_cardinality_agg(rb_from_string('1,2,3'))),(select rb_and_cardinality_agg(rb_from_string('2'))),(select rb_and_cardinality_agg(rb_from_string('1'))),rb_from_string('1')),
((select rb_and_cardinality_agg(rb_from_string('1,2,3,5,6'))),(select rb_and_cardinality_agg(rb_from_string('2'))),(select rb_and_cardinality_agg(rb_from_string('1'))),rb_from_string('1')),
((select rb_and_cardinality_agg(rb_from_string('1,2,3,4'))),(select rb_and_cardinality_agg(rb_from_string('2'))),(select rb_and_cardinality_agg(rb_from_string('1'))),rb_from_string('1'));
replace into vtt3 values((select rb_and_cardinality_agg(rb_from_string('1,2,3'))),(select rb_and_cardinality_agg(rb_from_string('2'))),(select rb_and_cardinality_agg(rb_from_string('1'))),rb_from_string('1')),
((select rb_and_cardinality_agg(rb_from_string('1,2,3,5,6'))),(select rb_and_cardinality_agg(rb_from_string('2'))),(select rb_and_cardinality_agg(rb_from_string('1'))),rb_from_string('1')),
((select rb_and_cardinality_agg(rb_from_string('1,2,3,4'))),(select rb_and_cardinality_agg(rb_from_string('2'))),(select rb_and_cardinality_agg(rb_from_string('1'))),rb_from_string('1')),
((select rb_and_cardinality_agg(rb_from_string('1,2,3,4,5,6,7,8'))),(select rb_and_cardinality_agg(rb_from_string('2'))),(select rb_and_cardinality_agg(rb_from_string('1'))),rb_from_string('1'));
insert into vtt3 values((select rb_and_cardinality_agg(rb_from_string('1'))),(select rb_and_cardinality_agg(rb_from_string('1'))),(select rb_and_cardinality_agg(rb_from_string('1,3'))),rb_from_string('1,4')) 
ON DUPLICATE KEY UPDATE  b=(select rb_and_cardinality_agg(rb_from_string('1,2,3,4,5,5,6,7,8,89'))),a=(select rb_and_cardinality_agg(rb_from_string('1,2,3,4,5,5,6,7,8,89')));
insert into vtt3 values((select rb_and_cardinality_agg(rb_from_string('1,2,3,4,5,6,7,8,9,10'))),(select rb_and_cardinality_agg(rb_from_string('1'))),(select rb_and_cardinality_agg(rb_from_string('1,3'))),rb_from_string('1,4')) 
ON DUPLICATE KEY UPDATE  b=(select rb_and_cardinality_agg(rb_from_string('1,2,3,4,5,5,6,7,8,89'))),a=(select rb_and_cardinality_agg(rb_from_string('1,2,3,4,5,5,6,7,8,89')));
select * from tt3 order by id;
+----+------+------+-------------+
| id | b    | a    | r           |
+----+------+------+-------------+
|  1 |    9 | 9    |          |
|  2 |    1 | 1    |          |
|  3 |    1 | 1    |          |
|  4 |    1 | 1    |          |
|  5 |    1 | 1    |          |
|  8 |    1 | 1    |          |
| 10 |    1 | 2    |        |
+----+------+------+-------------+
drop table if exists tt4;
Warnings:
Note	1051	Unknown table 'oblrp.tt4'
create table tt4(id int primary key,b bigint unsigned );
drop view if exists vtt4;
Warnings:
Note	1051	Unknown table 'oblrp.vtt4'
create view vtt4 as select * from tt4;
insert into tt4 values(1,2);
insert into  tt4 values(2,3);
insert overwrite tt4 select rb_and_cardinality_agg(r),rb_and_cardinality_agg(r1) from tt1;
select * from tt4;
+----+------+
| id | b    |
+----+------+
|  0 |    0 |
+----+------+
insert overwrite tt4 select rb_and_cardinality_agg(r),rb_and_cardinality_agg(r1) from tt2;
select * from tt4;
+----+------+
| id | b    |
+----+------+
|  0 |    0 |
+----+------+
drop table if exists tt4;
create table tt4(id int primary key,b bigint unsigned );
drop view if exists vtt4;
create view vtt4 as select * from tt4;
insert into tt4 select rb_and_cardinality_agg(r),rb_and_cardinality_agg(r1) from tt1;
insert into tt4 select rb_and_cardinality_agg(r),rb_and_cardinality_agg(r1) from tt2 where id =3;
select * from tt4;
+----+------+
| id | b    |
+----+------+
|  0 |    0 |
|  6 |   33 |
+----+------+
truncate tt4;
insert /*+ direct(true,100,'inc') enable_parallel_dml parallel(2)*/ into tt4 select rb_and_cardinality_agg(r),rb_and_cardinality_agg(r1) from tt1;
select * from tt4;
+----+------+
| id | b    |
+----+------+
|  0 |    0 |
+----+------+
insert /*+ direct(true,100) enable_parallel_dml parallel(2) append*/ into tt4 select rb_and_cardinality_agg(r),rb_and_cardinality_agg(r1) from tt2 where id=3;
select * from tt4;
+----+------+
| id | b    |
+----+------+
|  0 |    0 |
|  6 |   33 |
+----+------+
drop table if exists tt3;
create table tt3 as select rb_and_cardinality_agg(rb_from_string('1,2,3,4,5,6,7,8,9,10,11,12,13,14,15,16,17,18,19,20,21,22,23,24,25,26,27,28,29,30,31,32,4294967295,4294967294,42949672967,4294967296,18446744073709551615,18446744073709551614,18446744073709551613')) as a;
desc tt3;
+-------+---------------------+------+-----+---------+-------+
| Field | Type                | Null | Key | Default | Extra |
+-------+---------------------+------+-----+---------+-------+
| a     | bigint(20) unsigned | YES  |     | NULL    |       |
+-------+---------------------+------+-----+---------+-------+
insert into tt3 values(18446744073709551615);
insert into tt3 values(-1);
ERROR 22003: Out of range value for column 'a' at row 1
select * from tt3;
+----------------------+
| a                    |
+----------------------+
|                   39 |
| 18446744073709551615 |
+----------------------+
delete from tt3;
drop table if exists tt3;
create table tt3 as select  /*+enable_parallel_dml parallel(2)  OPT_PARAM('enable_rich_vector_format', 'FALSE') OPT_PARAM('rowsets_enabled', 'FALSE') */ rb_and_cardinality_agg(r) a,rb_and_cardinality_agg(r1) b from tt2;
insert into tt3 values(18446744073709551615,0);
update tt3 set a=-1;
ERROR 22003: Out of range value for column 'a' at row 1
update tt3 set a=18446744073709551613;
desc tt3;
+-------+---------------------+------+-----+---------+-------+
| Field | Type                | Null | Key | Default | Extra |
+-------+---------------------+------+-----+---------+-------+
| a     | bigint(20) unsigned | YES  |     | NULL    |       |
| b     | bigint(20) unsigned | YES  |     | NULL    |       |
+-------+---------------------+------+-----+---------+-------+
select * from tt3;
+----------------------+------+
| a                    | b    |
+----------------------+------+
| 18446744073709551613 |    0 |
| 18446744073709551613 |    0 |
+----------------------+------+
drop table if exists tt3;
create table tt3 as select  rb_and_cardinality_agg(r) a,rb_and_cardinality_agg(r1) b from tt2;
insert into tt3 values(18446744073709551615,0);
update tt3 set a=-1;
ERROR 22003: Out of range value for column 'a' at row 1
update tt3 set a=18446744073709551613;
desc tt3;
+-------+---------------------+------+-----+---------+-------+
| Field | Type                | Null | Key | Default | Extra |
+-------+---------------------+------+-----+---------+-------+
| a     | bigint(20) unsigned | YES  |     | NULL    |       |
| b     | bigint(20) unsigned | YES  |     | NULL    |       |
+-------+---------------------+------+-----+---------+-------+
select * from tt3;
+----------------------+------+
| a                    | b    |
+----------------------+------+
| 18446744073709551613 |    0 |
| 18446744073709551613 |    0 |
+----------------------+------+
drop view if exists vtt3;
create view vtt3 as select  rb_and_cardinality_agg(r) a,rb_and_cardinality_agg(r1) b from tt2;
insert into vtt3 values(18446744073709551615,0);
ERROR HY000: The target table vtt3 of the INSERT is not insertable-into
desc vtt3;
+-------+---------------------+------+-----+---------+-------+
| Field | Type                | Null | Key | Default | Extra |
+-------+---------------------+------+-----+---------+-------+
| a     | bigint(20) unsigned | YES  |     | NULL    |       |
| b     | bigint(20) unsigned | YES  |     | NULL    |       |
+-------+---------------------+------+-----+---------+-------+
select * from vtt3;
+------+------+
| a    | b    |
+------+------+
|    0 |    0 |
+------+------+
drop view if exists vtt3;
create view vtt3 as select  rb_and_cardinality_agg(rb_from_string('1,2,3,4')) a;
desc vtt3;
+-------+---------------------+------+-----+---------+-------+
| Field | Type                | Null | Key | Default | Extra |
+-------+---------------------+------+-----+---------+-------+
| a     | bigint(20) unsigned | NO   |     |         |       |
+-------+---------------------+------+-----+---------+-------+
insert into vtt3 values(18446744073709551615);
ERROR HY000: The target table vtt3 of the INSERT is not insertable-into
drop table if exists tt3;
create table tt3(id int, r roaringbitmap ,id1 bigint unsigned as (rb_and_cardinality_agg(r)) STORED);
ERROR HY000: Invalid use of group function
drop table if exists tt3;
Warnings:
Note	1051	Unknown table 'oblrp.tt3'
create table tt3(id int, r roaringbitmap ,id1 bigint unsigned as (rb_and_cardinality_agg(r)) VIRTUAL);
ERROR HY000: Invalid use of group function
drop table if exists tt3;
Warnings:
Note	1051	Unknown table 'oblrp.tt3'
create table tt3(id int, r roaringbitmap );
alter table tt3 add COLUMN d1 bigint unsigned as (rb_and_cardinality_agg(r)) STORED;
ERROR HY000: Invalid use of group function
drop table if exists tt3;
create table tt3(id int, r roaringbitmap );
alter table tt3 add COLUMN d1 bigint unsigned as (rb_and_cardinality_agg(r)) VIRTUAL;
ERROR HY000: Invalid use of group function
drop table if exists tt3;
bug 2025041100108174602   „Ää„Äêobmysql_bitmap„ÄëbitmapËÅöÂêàÂáΩÊï∞ËÆæÁΩÆÊàêÈªòËÆ§ÂÄºÔºåob Êä•ÁöÑÈîôËØØÁ†ÅÂ∫îËØ•Êää5023‰øÆÊîπÊàê1111„Äã
create table tt3(id int, id1 bigint UNSIGNED DEFAULT(rb_and_cardinality_agg(rb_from_string('1,2,3'))));
ERROR S1004: Illegal type
create table tt3(id int, id1 bigint UNSIGNED);
bug 2025041100108174602   „Ää„Äêobmysql_bitmap„ÄëbitmapËÅöÂêàÂáΩÊï∞ËÆæÁΩÆÊàêÈªòËÆ§ÂÄºÔºåob Êä•ÁöÑÈîôËØØÁ†ÅÂ∫îËØ•Êää5023‰øÆÊîπÊàê1111„Äã
ALTER TABLE tt3 
MODIFY COLUMN id1 bigint UNSIGNED DEFAULT (rb_and_cardinality_agg(rb_from_string('1,2,3')));
ERROR S1004: Illegal type
bug 2025041100108174602   „Ää„Äêobmysql_bitmap„ÄëbitmapËÅöÂêàÂáΩÊï∞ËÆæÁΩÆÊàêÈªòËÆ§ÂÄºÔºåob Êä•ÁöÑÈîôËØØÁ†ÅÂ∫îËØ•Êää5023‰øÆÊîπÊàê1111„Äã
ALTER TABLE tt3
ADD COLUMN id2 bigint UNSIGNED DEFAULT (rb_and_cardinality_agg(rb_from_string('1,2,3')));
ERROR S1004: Illegal type
drop table if exists tt3;
create table tt3(id int,a varchar(50),r roaringbitmap, INDEX index_1((rb_and_cardinality_agg(r))));
ERROR HY000: Invalid use of group function
create table tt3(id int,a varchar(50),r roaringbitmap);
create index index_1 on tt3((rb_and_cardinality_agg(r)));
ERROR HY000: Invalid use of group function
alter table tt3 add index index_1 ((rb_and_cardinality_agg(r)));
ERROR HY000: Invalid use of group function
drop table if exists tt3;
create table tt3(id int ,a0 varchar(1000),a varbinary(1000),r roaringbitmap,r1 roaringbitmap) PARTITION BY range COLUMNS(id)(
PARTITION p0 values less than(19),
PARTITION p1 values less than(25),
PARTITION p2 values less than(30)
);
drop view if exists vtt3;
create view vtt3 as select * from tt3;
insert into tt3 values(0,null,rb_build_empty(),rb_build_empty(),rb_build_varbinary(0x01060100000000000000000000003b300000010000ffff0100fffe0f00));
insert into tt3 values(1,'1',rb_from_string('1'),rb_from_string('1'),rb_build_varbinary(x'01053b3000000100000f27010000000f27'));
insert into tt3 values(2,'4294967296',rb_from_string('4294967296'),rb_from_string('4294967296'),rb_from_string('4294967296,4294967297,42949672969,4294967298,42949672961,42949672962,4294967299,4294967297,14294967296,14294967696,14295967296,5294967296,7294967296,9294967296,8294967296,42949617296,42949672916,4294967396,4294967496,
4294967595,4294967696,4294967795,4294968295,4294967995,4294977295,4294987295,4294997295,4294968295,4294969295,4295967295,4296967295,4297967295,4298967295'));
insert into tt3 values(3,'1,2,6,4,5,9',rb_from_string('1,2,6,4,5,9'),rb_from_string('1,2,6,4,5,9'),rb_from_string('1,2,3,4,5,6,7,8,9,10,11,12,13,14,15,16,17,18,19,20,21,22,23,24,25,26,27,28,29,30,31,4294967298,4294967299'));
insert into tt3 values(3,'1,2,6,4,5,9',rb_from_string('1,2,6,4,5,9'),rb_from_string('1,2,6,4,5,9'),rb_from_string('1,2,3,4,5,6,7,8,9,10,11,12,13,14,15,16,17,18,19,20,21,22,23,24,25,26,27,28,29,30,31,65537,65536'));
insert into tt3 values(4,'4294967296,4294967297,4294967298,4294967299',rb_from_string('4294967296,4294967297,4294967298,4294967299'),rb_from_string('4294967296,4294967297,4294967298,4294967299'),rb_from_string('1,2,3,4,5,6,7,8,9,10,11,12,13,14,15,16,17,18,19,20,21,22,23,24,25,26,27,28,29,30,31,65537,65536'));
insert into tt3 values(5,'1,2,3,4,5,6,7,8,9,10,11,12,13,14,15,16,17,18,19,20,21,22,23,24,25,26,27,28,29,30,31,32,33',
rb_from_string('1,2,3,4,5,6,7,8,9,10,11,12,13,14,15,16,17,18,19,20,21,22,23,24,25,26,27,28,29,30,31,32,33'),
rb_from_string('1,2,3,4,5,6,7,8,9,10,11,12,13,14,15,16,17,18,19,20,21,22,23,24,25,26,27,28,29,30,31,32,33'),rb_build_empty());
insert into tt3 values(5,'1,2,3,4,5,6,7,8,9,10,11,12,13,14,15,16,17,18,19,20,21,22,23,24,25,26,27,28,29,30,31,65537,65536',
rb_from_string('1,2,3,4,5,6,7,8,9,10,11,12,13,14,15,16,17,18,19,20,21,22,23,24,25,26,27,28,29,30,31,65537,65536'),
rb_from_string('1,2,3,4,5,6,7,8,9,10,11,12,13,14,15,16,17,18,19,20,21,22,23,24,25,26,27,28,29,30,31,65537,65536'),rb_from_string('1,2,6,4,5,9'));
insert into tt3 values(6,'1,2,3,4,5,6,7,8,9,10,11,12,13,14,15,16,17,18,19,20,21,22,23,24,25,26,27,28,29,30,31,4294967298,65536',
rb_from_string('1,2,3,4,5,6,7,8,9,10,11,12,13,14,15,16,17,18,19,20,21,22,23,24,25,26,27,28,29,30,31,4294967298,4294967299'),
rb_from_string('1,2,3,4,5,6,7,8,9,10,11,12,13,14,15,16,17,18,19,20,21,22,23,24,25,26,27,28,29,30,31,4294967298,4294967299'),rb_from_string('1,2,6,4,5,9'));
insert into tt3 values(20,'4294967296,4294967297,42949672969,4294967298,42949672961,42949672962,4294967299,4294967297,14294967296,14294967696,14295967296,5294967296,7294967296,9294967296,8294967296,42949617296,42949672916,4294967396,4294967496,
4294967595,4294967696,4294967795,4294968295,4294967995,4294977295,4294987295,4294997295,4294968295,4294969295,4295967295,4296967295,4297967295,4298967295',
rb_from_string('4294967296,4294967297,42949672969,4294967298,42949672961,42949672962,4294967299,4294967297,14294967296,14294967696,14295967296,5294967296,7294967296,9294967296,8294967296,42949617296,42949672916,4294967396,4294967496,
4294967595,4294967696,4294967795,4294968295,4294967995,4294977295,4294987295,4294997295,4294968295,4294969295,4295967295,4296967295,4297967295,4298967295'),
rb_from_string('4294967296,4294967297,42949672969,4294967298,42949672961,42949672962,4294967299,4294967297,14294967296,14294967696,14295967296,5294967296,7294967296,9294967296,8294967296,42949617296,42949672916,4294967396,4294967496,
4294967595,4294967696,4294967795,4294968295,4294967995,4294977295,4294987295,4294997295,4294968295,4294969295,4295967295,4296967295,4297967295,4298967295'),rb_from_string('4294967296'));
insert into tt3 values(21,'2542',x'01053b3000000100000f27010000000f27',rb_build_varbinary(x'01053b3000000100000f27010000000f27'),rb_from_string('4294967296'));
insert into tt3 values(8,'56214,-7854',rb_build_varbinary(0x01060100000000000000000000003b300000010000ffff0100fffe0f00),rb_build_varbinary(0x01060100000000000000000000003b300000010000ffff0100fffe0f00),rb_from_string('4294967296'));
insert into tt3 values(26,'1,23,8977,973747',0x01060300000000000000000000003b3001000100002000f36d0100010000002000607f677f010000003b30000001000002000100000002002a0000003a300000010000001df300001000000061c4
,0x01060100000000000000000000003b300000010000ffff0100fffe0f00,rb_from_string('4294967296'));
insert into tt3 values(10,null,null,null,null);
insert into tt3(id) values(11);
insert into tt3 values(14,'1,2,3,4,5,6,7,8,9,10,11,12,13,14,15,16,17,18,19,20,21,22,23,24,25,26,27,28,29,30,31,32,33',
0x01053A3000000100000000002000100000000100020003000400050006000700080009000A000B000C000D000E000F0010001100120013001400150016001700180019001A001B001C001D001E001F0020002100,
0x01053A3000000100000000002000100000000100020003000400050006000700080009000A000B000C000D000E000F0010001100120013001400150016001700180019001A001B001C001D001E001F0020002100,rb_build_empty());
DROP MATERIALIZED VIEW  mv1;
create materialized view mv1  as select rb_and_cardinality_agg(r) r,rb_and_cardinality_agg(r1) r1 from tt3;
select * from mv1;
+------+------+
| r    | r1   |
+------+------+
|    0 |    0 |
+------+------+
desc mv1;
+-------+---------------------+------+-----+---------+-------+
| Field | Type                | Null | Key | Default | Extra |
+-------+---------------------+------+-----+---------+-------+
| r     | bigint(20) unsigned | YES  |     | NULL    |       |
| r1    | bigint(20) unsigned | YES  |     | NULL    |       |
+-------+---------------------+------+-----+---------+-------+
select rb_contains(rb_from_string('10049') ,r) from mv1;
+-----------------------------------------+
| rb_contains(rb_from_string('10049') ,r) |
+-----------------------------------------+
|                                       0 |
+-----------------------------------------+
select rb_contains(rb_from_string('10047,454112') ,r1) from mv1;
+-------------------------------------------------+
| rb_contains(rb_from_string('10047,454112') ,r1) |
+-------------------------------------------------+
|                                               0 |
+-------------------------------------------------+
call DBMS_MVIEW.REFRESH('mv1','A');
delete FROM TT3;
call DBMS_MVIEW.REFRESH('mv1','a');
insert into tt3 values(14,'1,2,3,4,5,6,7,8,9,10,11,12,13,14,15,16,17,18,19,20,21,22,23,24,25,26,27,28,29,30,31,32,33',
0x01053A3000000100000000002000100000000100020003000400050006000700080009000A000B000C000D000E000F0010001100120013001400150016001700180019001A001B001C001D001E001F0020002100,
rb_from_string('14294969295,24294969295'),rb_from_string('14294969295,24294969295'));
call DBMS_MVIEW.REFRESH('mv1','c');
call DBMS_MVIEW.REFRESH('mv1','A');
call DBMS_MVIEW.REFRESH('mv1','?');
select * from mv1;
+------+------+
| r    | r1   |
+------+------+
|    2 |    2 |
+------+------+
DROP MATERIALIZED VIEW LOG ON tt4;
drop table if exists tt4;
create table tt4(id int primary key ,a0 varchar(1000),a varbinary(1000),r roaringbitmap,r1 roaringbitmap);
insert into tt4 values(0,null,rb_build_empty(),rb_build_empty(),rb_build_varbinary(0x01060100000000000000000000003b300000010000ffff0100fffe0f00));
insert into tt4 values(1,'1',rb_from_string('1'),rb_from_string('1'),rb_build_varbinary(x'01053b3000000100000f27010000000f27'));
insert into tt4 values(2,'4294967296',rb_from_string('4294967296'),rb_from_string('4294967296'),rb_from_string('4294967296,4294967297,42949672969,4294967298,42949672961,42949672962,4294967299,4294967297,14294967296,14294967696,14295967296,5294967296,7294967296,9294967296,8294967296,42949617296,42949672916,4294967396,4294967496,
4294967595,4294967696,4294967795,4294968295,4294967995,4294977295,4294987295,4294997295,4294968295,4294969295,4295967295,4296967295,4297967295,4298967295'));
insert into tt4 values(3,'1,2,6,4,5,9',rb_from_string('1,2,6,4,5,9'),rb_from_string('1,2,6,4,5,9'),rb_from_string('1,2,3,4,5,6,7,8,9,10,11,12,13,14,15,16,17,18,19,20,21,22,23,24,25,26,27,28,29,30,31,4294967298,4294967299'));
insert into tt4 values(4,'4294967296,4294967297,4294967298,4294967299',rb_from_string('4294967296,4294967297,4294967298,4294967299'),rb_from_string('4294967296,4294967297,4294967298,4294967299'),rb_from_string('1,2,3,4,5,6,7,8,9,10,11,12,13,14,15,16,17,18,19,20,21,22,23,24,25,26,27,28,29,30,31,65537,65536'));
insert into tt4 values(5,'1,2,3,4,5,6,7,8,9,10,11,12,13,14,15,16,17,18,19,20,21,22,23,24,25,26,27,28,29,30,31,32,33',
rb_from_string('1,2,3,4,5,6,7,8,9,10,11,12,13,14,15,16,17,18,19,20,21,22,23,24,25,26,27,28,29,30,31,32,33'),
rb_from_string('1,2,3,4,5,6,7,8,9,10,11,12,13,14,15,16,17,18,19,20,21,22,23,24,25,26,27,28,29,30,31,32,33'),rb_build_empty());
insert into tt4 values(6,'1,2,3,4,5,6,7,8,9,10,11,12,13,14,15,16,17,18,19,20,21,22,23,24,25,26,27,28,29,30,31,4294967298,65536',
rb_from_string('1,2,3,4,5,6,7,8,9,10,11,12,13,14,15,16,17,18,19,20,21,22,23,24,25,26,27,28,29,30,31,4294967298,4294967299'),
rb_from_string('1,2,3,4,5,6,7,8,9,10,11,12,13,14,15,16,17,18,19,20,21,22,23,24,25,26,27,28,29,30,31,4294967298,4294967299'),rb_from_string('1,2,6,4,5,9'));
insert into tt4 values(17,'2542',x'01053b3000000100000f27010000000f27',rb_build_varbinary(x'01053b3000000100000f27010000000f27'),rb_from_string('4294967296'));
insert into tt4 values(8,'56214,-7854',rb_build_varbinary(0x01060100000000000000000000003b300000010000ffff0100fffe0f00),rb_build_varbinary(0x01060100000000000000000000003b300000010000ffff0100fffe0f00),rb_from_string('4294967296'));
insert into tt4 values(29,'1,23,8977,973747',0x01060300000000000000000000003b3001000100002000f36d0100010000002000607f677f010000003b30000001000002000100000002002a0000003a300000010000001df300001000000061c4
,0x01060100000000000000000000003b300000010000ffff0100fffe0f00,rb_from_string('4294967296'));
insert into tt4 values(20,'4294967296,4294967297,42949672969,4294967298,42949672961,42949672962,4294967299,4294967297,14294967296,14294967696,14295967296,5294967296,7294967296,9294967296,8294967296,42949617296,42949672916,4294967396,4294967496,
4294967595,4294967696,4294967795,4294968295,4294967995,4294977295,4294987295,4294997295,4294968295,4294969295,4295967295,4296967295,4297967295,4298967295',
rb_from_string('4294967296,4294967297,42949672969,4294967298,42949672961,42949672962,4294967299,4294967297,14294967296,14294967696,14295967296,5294967296,7294967296,9294967296,8294967296,42949617296,42949672916,4294967396,4294967496,
4294967595,4294967696,4294967795,4294968295,4294967995,4294977295,4294987295,4294997295,4294968295,4294969295,4295967295,4296967295,4297967295,4298967295'),
rb_from_string('4294967296,4294967297,42949672969,4294967298,42949672961,42949672962,4294967299,4294967297,14294967296,14294967696,14295967296,5294967296,7294967296,9294967296,8294967296,42949617296,42949672916,4294967396,4294967496,
4294967595,4294967696,4294967795,4294968295,4294967995,4294977295,4294987295,4294997295,4294968295,4294969295,4295967295,4296967295,4297967295,4298967295'),rb_from_string('4294967296'));
insert into tt4 values(15,null,null,null,null);
insert into tt4(id) values(19);
CREATE MATERIALIZED VIEW LOG ON tt4 WITH PRIMARY KEY, ROWID,SEQUENCE(a0,a,r,r1) INCLUDING NEW VALUES;
DROP MATERIALIZED VIEW  mv1;
create materialized view mv1  REFRESH FAST  as 
select rb_and_cardinality_agg(t1.r) r3,rb_and_cardinality_agg(t1.r1) r4 from tt4 t1 inner join tt4 t2 on t1.id=t2.id;
ERROR HY000: cannot fast refresh materialized view mv1: the aggregate function type is not supported yet (only count/sum/avg/stddev/variance is supported)
select rb_and_cardinality_agg(rb_build_empty());
+------------------------------------------+
| rb_and_cardinality_agg(rb_build_empty()) |
+------------------------------------------+
|                                        0 |
+------------------------------------------+
select rb_and_cardinality_agg((select rb_build_agg(-1)));
+---------------------------------------------------+
| rb_and_cardinality_agg((select rb_build_agg(-1))) |
+---------------------------------------------------+
|                                                 1 |
+---------------------------------------------------+
select rb_build_agg((select rb_and_cardinality_agg(rb_from_string('1,2,3,4'))));
+--------------------------------------------------------------------------+
| rb_build_agg((select rb_and_cardinality_agg(rb_from_string('1,2,3,4')))) |
+--------------------------------------------------------------------------+
|                                                                       |
+--------------------------------------------------------------------------+
select rb_and_cardinality_agg(rb_from_string(null));
+----------------------------------------------+
| rb_and_cardinality_agg(rb_from_string(null)) |
+----------------------------------------------+
|                                         NULL |
+----------------------------------------------+
select rb_and_cardinality_agg(rb_from_string('1'));
+---------------------------------------------+
| rb_and_cardinality_agg(rb_from_string('1')) |
+---------------------------------------------+
|                                           1 |
+---------------------------------------------+
select rb_and_cardinality_agg(rb_from_string('4294967298'));
+------------------------------------------------------+
| rb_and_cardinality_agg(rb_from_string('4294967298')) |
+------------------------------------------------------+
|                                                    1 |
+------------------------------------------------------+
select rb_and_cardinality_agg(rb_from_string('4294967295,4554784'));
+--------------------------------------------------------------+
| rb_and_cardinality_agg(rb_from_string('4294967295,4554784')) |
+--------------------------------------------------------------+
|                                                            2 |
+--------------------------------------------------------------+
select rb_and_cardinality_agg(rb_from_string('4294967296,18446744073709551615'));
+---------------------------------------------------------------------------+
| rb_and_cardinality_agg(rb_from_string('4294967296,18446744073709551615')) |
+---------------------------------------------------------------------------+
|                                                                         2 |
+---------------------------------------------------------------------------+
select rb_and_cardinality_agg(rb_from_string('1,2,3,4,5,6,7,8,9,10,11,12,13,14,15,16,17,18,19,20,21,22,23,24,25,26,27,28,29,30,31,4294967295'));
+------------------------------------------------------------------------------------------------------------------------------------------+
| rb_and_cardinality_agg(rb_from_string('1,2,3,4,5,6,7,8,9,10,11,12,13,14,15,16,17,18,19,20,21,22,23,24,25,26,27,28,29,30,31,4294967295')) |
+------------------------------------------------------------------------------------------------------------------------------------------+
|                                                                                                                                       32 |
+------------------------------------------------------------------------------------------------------------------------------------------+
select rb_and_cardinality_agg(rb_from_string('2,1,3,4,5,6,7,8,9,10,11,12,13,14,15,16,17,18,19,20,21,23,24,25,26,27,28,29,30,4294967296,18446744073709551615,4294967297'));
+--------------------------------------------------------------------------------------------------------------------------------------------------------------------+
| rb_and_cardinality_agg(rb_from_string('2,1,3,4,5,6,7,8,9,10,11,12,13,14,15,16,17,18,19,20,21,23,24,25,26,27,28,29,30,4294967296,18446744073709551615,4294967297')) |
+--------------------------------------------------------------------------------------------------------------------------------------------------------------------+
|                                                                                                                                                                 32 |
+--------------------------------------------------------------------------------------------------------------------------------------------------------------------+
select rb_and_cardinality_agg(rb_from_string('1,2,3,4,5,6,7,8,9,10,11,12,13,14,15,16,17,18,19,20,21,22,23,24,25,26,27,28,29,30,31,4294967295,888888888'));
+----------------------------------------------------------------------------------------------------------------------------------------------------+
| rb_and_cardinality_agg(rb_from_string('1,2,3,4,5,6,7,8,9,10,11,12,13,14,15,16,17,18,19,20,21,22,23,24,25,26,27,28,29,30,31,4294967295,888888888')) |
+----------------------------------------------------------------------------------------------------------------------------------------------------+
|                                                                                                                                                 33 |
+----------------------------------------------------------------------------------------------------------------------------------------------------+
select rb_and_cardinality_agg(rb_from_string('1,2,3,4,5,6,7,8,9,10,11,12,13,14,15,16,17,18,19,20,21,22,23,24,25,26,27,28,29,30,31,4294967295,1,18446744073709551615,4294967296,18446744073709551611,18446744073709551614'));
+----------------------------------------------------------------------------------------------------------------------------------------------------------------------------------------------------------------------+
| rb_and_cardinality_agg(rb_from_string('1,2,3,4,5,6,7,8,9,10,11,12,13,14,15,16,17,18,19,20,21,22,23,24,25,26,27,28,29,30,31,4294967295,1,18446744073709551615,4294967296,18446744073709551611,18446744073709551614')) |
+----------------------------------------------------------------------------------------------------------------------------------------------------------------------------------------------------------------------+
|                                                                                                                                                                                                                   36 |
+----------------------------------------------------------------------------------------------------------------------------------------------------------------------------------------------------------------------+
select rb_and_cardinality_agg(rb_from_string('-1,-2'));
+-------------------------------------------------+
| rb_and_cardinality_agg(rb_from_string('-1,-2')) |
+-------------------------------------------------+
|                                               2 |
+-------------------------------------------------+
select rb_and_cardinality_agg(rb_build_varbinary(0x0100));
+----------------------------------------------------+
| rb_and_cardinality_agg(rb_build_varbinary(0x0100)) |
+----------------------------------------------------+
|                                                  0 |
+----------------------------------------------------+
select rb_and_cardinality_agg(rb_build_varbinary(0x01020200000001000000));
+--------------------------------------------------------------------+
| rb_and_cardinality_agg(rb_build_varbinary(0x01020200000001000000)) |
+--------------------------------------------------------------------+
|                                                                  1 |
+--------------------------------------------------------------------+
select rb_and_cardinality_agg(rb_build_varbinary(rb_to_varbinary(rb_from_string('4294967295,4554784'))));
+---------------------------------------------------------------------------------------------------+
| rb_and_cardinality_agg(rb_build_varbinary(rb_to_varbinary(rb_from_string('4294967295,4554784')))) |
+---------------------------------------------------------------------------------------------------+
|                                                                                                 2 |
+---------------------------------------------------------------------------------------------------+
select rb_and_cardinality_agg(rb_build_varbinary(rb_to_varbinary(rb_from_string('4294967296,18446744073709551615,1,3,9,4521454414'))));
+---------------------------------------------------------------------------------------------------------------------------------+
| rb_and_cardinality_agg(rb_build_varbinary(rb_to_varbinary(rb_from_string('4294967296,18446744073709551615,1,3,9,4521454414')))) |
+---------------------------------------------------------------------------------------------------------------------------------+
|                                                                                                                               6 |
+---------------------------------------------------------------------------------------------------------------------------------+
select rb_and_cardinality_agg(rb_from_string('1,2,3,4,5,6,7,8,9,10,11,12,13,14,15,16,17,18,19,20,21,22,23,24,25,26,27,28,29,30,31,4294967295'));
+------------------------------------------------------------------------------------------------------------------------------------------+
| rb_and_cardinality_agg(rb_from_string('1,2,3,4,5,6,7,8,9,10,11,12,13,14,15,16,17,18,19,20,21,22,23,24,25,26,27,28,29,30,31,4294967295')) |
+------------------------------------------------------------------------------------------------------------------------------------------+
|                                                                                                                                       32 |
+------------------------------------------------------------------------------------------------------------------------------------------+
select rb_and_cardinality_agg(rb_build_varbinary(rb_to_varbinary(rb_from_string('2,1,3,4,5,6,7,8,9,10,11,12,13,14,15,16,17,18,19,20,21,23,24,25,26,27,28,29,30,4294967296,18446744073709551615,4294967297'))));
+---------------------------------------------------------------------------------------------------------------------------------------------------------------------------------------------------------+
| rb_and_cardinality_agg(rb_build_varbinary(rb_to_varbinary(rb_from_string('2,1,3,4,5,6,7,8,9,10,11,12,13,14,15,16,17,18,19,20,21,23,24,25,26,27,28,29,30,4294967296,18446744073709551615,4294967297')))) |
+---------------------------------------------------------------------------------------------------------------------------------------------------------------------------------------------------------+
|                                                                                                                                                                                                      32 |
+---------------------------------------------------------------------------------------------------------------------------------------------------------------------------------------------------------+
select rb_and_cardinality_agg(rb_build_varbinary(rb_to_varbinary(rb_from_string('1,2,3,4,5,6,7,8,9,10,11,12,13,14,15,16,17,18,19,20,21,22,23,24,25,26,27,28,29,30,31,4294967295,888888888'))));
+-----------------------------------------------------------------------------------------------------------------------------------------------------------------------------------------+
| rb_and_cardinality_agg(rb_build_varbinary(rb_to_varbinary(rb_from_string('1,2,3,4,5,6,7,8,9,10,11,12,13,14,15,16,17,18,19,20,21,22,23,24,25,26,27,28,29,30,31,4294967295,888888888')))) |
+-----------------------------------------------------------------------------------------------------------------------------------------------------------------------------------------+
|                                                                                                                                                                                      33 |
+-----------------------------------------------------------------------------------------------------------------------------------------------------------------------------------------+
select rb_and_cardinality_agg(rb_build_varbinary(rb_to_varbinary(rb_from_string('1,2,3,4,5,6,7,8,9,10,11,12,13,14,15,16,17,18,19,20,21,22,23,24,25,26,27,28,29,30,31,4294967295,1,18446744073709551615,4294967296,18446744073709551611,18446744073709551614'))));
+-----------------------------------------------------------------------------------------------------------------------------------------------------------------------------------------------------------------------------------------------------------+
| rb_and_cardinality_agg(rb_build_varbinary(rb_to_varbinary(rb_from_string('1,2,3,4,5,6,7,8,9,10,11,12,13,14,15,16,17,18,19,20,21,22,23,24,25,26,27,28,29,30,31,4294967295,1,18446744073709551615,4294967296,18446744073709551611,18446744073709551614')))) |
+-----------------------------------------------------------------------------------------------------------------------------------------------------------------------------------------------------------------------------------------------------------+
|                                                                                                                                                                                                                                                        36 |
+-----------------------------------------------------------------------------------------------------------------------------------------------------------------------------------------------------------------------------------------------------------+
select rb_and_cardinality_agg(rb_from_string(a0)) from tt1;
+--------------------------------------------+
| rb_and_cardinality_agg(rb_from_string(a0)) |
+--------------------------------------------+
|                                          0 |
+--------------------------------------------+
select rb_and_cardinality_agg(rb_build_varbinary(a)) from tt1;
+-----------------------------------------------+
| rb_and_cardinality_agg(rb_build_varbinary(a)) |
+-----------------------------------------------+
|                                             0 |
+-----------------------------------------------+
select *, rb_and_cardinality_agg(rb_from_string(a0)) from tt2;
+----+------+------+------+---------------------------------------------------------------------+--------------------------------------------+
| id | a0   | a    | r    | r1                                                                  | rb_and_cardinality_agg(rb_from_string(a0)) |
+----+------+------+------+---------------------------------------------------------------------+--------------------------------------------+
|  0 | NULL |     |     | ˇ˛   ˇ  ˇ  ˇ  ˇ  ˇ  ˇ  ˇ  ˇ  ˇ  	ˇ  
ˇ  ˇ  ˇ  ˇ  ˇ                    |                                          0 |
+----+------+------+------+---------------------------------------------------------------------+--------------------------------------------+
select *, rb_and_cardinality_agg(rb_build_varbinary(a)) from tt2;
+----+------+------+------+---------------------------------------------------------------------+-----------------------------------------------+
| id | a0   | a    | r    | r1                                                                  | rb_and_cardinality_agg(rb_build_varbinary(a)) |
+----+------+------+------+---------------------------------------------------------------------+-----------------------------------------------+
|  0 | NULL |     |     | ˇ˛   ˇ  ˇ  ˇ  ˇ  ˇ  ˇ  ˇ  ˇ  ˇ  	ˇ  
ˇ  ˇ  ˇ  ˇ  ˇ                    |                                             0 |
+----+------+------+------+---------------------------------------------------------------------+-----------------------------------------------+
select rb_and_cardinality_agg(rb_build([1,2,3,4]));
+---------------------------------------------+
| rb_and_cardinality_agg(rb_build([1,2,3,4])) |
+---------------------------------------------+
|                                           4 |
+---------------------------------------------+
select [rb_and_cardinality_agg(rb_build([1,2,3,4]))];
+-----------------------------------------------+
| [rb_and_cardinality_agg(rb_build([1,2,3,4]))] |
+-----------------------------------------------+
| [4]                                           |
+-----------------------------------------------+
select [rb_and_cardinality_agg(rb_build([1,2,3,4])),rb_and_cardinality_agg(rb_build([1,2,3,4]))];
+-------------------------------------------------------------------------------------------+
| [rb_and_cardinality_agg(rb_build([1,2,3,4])),rb_and_cardinality_agg(rb_build([1,2,3,4]))] |
+-------------------------------------------------------------------------------------------+
| [4,4]                                                                                     |
+-------------------------------------------------------------------------------------------+
select rb_and_cardinality_agg(rb_to_array(rb_from_string('1,2,3,4')));
ERROR HY000: invalid type given for an argument
select rb_to_array(rb_and_cardinality_agg(rb_from_string('1,2,3,54')));
ERROR HY000: invalid type given for an argument
select rb_and_cardinality_agg(rb_select(rb_from_string('1,2,3,4,5,6,7'),5));
+----------------------------------------------------------------------+
| rb_and_cardinality_agg(rb_select(rb_from_string('1,2,3,4,5,6,7'),5)) |
+----------------------------------------------------------------------+
|                                                                    5 |
+----------------------------------------------------------------------+
select rb_to_string(rb_select(rb_from_string('1,2,3,4,5,6,7,8,9,10,11,12,13,14,15,16,17,18,19,20,21,22,23,24,25,26,27,28,29,30,31,32,33,4294967299'),rb_and_cardinality_agg(rb_from_string('1,2,3,54')),rb_and_cardinality_agg(rb_from_string('')),true,rb_and_cardinality_agg(rb_from_string('1,2,3,54')),rb_and_cardinality_agg(rb_from_string('1,2,3,54'))));
+-----------------------------------------------------------------------------------------------------------------------------------------------------------------------------------------------------------------------------------------------------------------+
| rb_to_string(rb_select(rb_from_string('1,2,3,4,5,6,7,8,9,10,11,12,13,14,15,16,17,18,19,20,21,22,23,24,25,26,27,28,29,30,31,32,33,4294967299'),rb_and_cardinality_agg(rb_from_string('1,2,3,54')),rb_and_cardinality_agg(rb_from_string('')),true,rb_and_cardina |
+-----------------------------------------------------------------------------------------------------------------------------------------------------------------------------------------------------------------------------------------------------------------+
|                                                                                                                                                                                                                                                                 |
+-----------------------------------------------------------------------------------------------------------------------------------------------------------------------------------------------------------------------------------------------------------------+
select rb_and_cardinality_agg(rb_xor(rb_from_string('1,2,3'),rb_from_string('1,2,3')));
+---------------------------------------------------------------------------------+
| rb_and_cardinality_agg(rb_xor(rb_from_string('1,2,3'),rb_from_string('1,2,3'))) |
+---------------------------------------------------------------------------------+
|                                                                               0 |
+---------------------------------------------------------------------------------+
select rb_and_cardinality_agg(rb_and(rb_from_string('1,2,3'),rb_from_string('1,2,3')) );
+----------------------------------------------------------------------------------+
| rb_and_cardinality_agg(rb_and(rb_from_string('1,2,3'),rb_from_string('1,2,3')) ) |
+----------------------------------------------------------------------------------+
|                                                                                3 |
+----------------------------------------------------------------------------------+
select rb_and_cardinality_agg(rb_or(rb_from_string('1,2,3'),rb_from_string('1,2,3')) );
+---------------------------------------------------------------------------------+
| rb_and_cardinality_agg(rb_or(rb_from_string('1,2,3'),rb_from_string('1,2,3')) ) |
+---------------------------------------------------------------------------------+
|                                                                               3 |
+---------------------------------------------------------------------------------+
select rb_and_cardinality_agg(rb_andnot(rb_from_string('1,2,3'),rb_from_string('1,2,3')) );
+-------------------------------------------------------------------------------------+
| rb_and_cardinality_agg(rb_andnot(rb_from_string('1,2,3'),rb_from_string('1,2,3')) ) |
+-------------------------------------------------------------------------------------+
|                                                                                   0 |
+-------------------------------------------------------------------------------------+
select rb_and_cardinality_agg(rb_and_null2empty(rb_from_string('1,2,3'),rb_from_string('1,2,3')) );
+---------------------------------------------------------------------------------------------+
| rb_and_cardinality_agg(rb_and_null2empty(rb_from_string('1,2,3'),rb_from_string('1,2,3')) ) |
+---------------------------------------------------------------------------------------------+
|                                                                                           3 |
+---------------------------------------------------------------------------------------------+
select rb_and_cardinality_agg(rb_or_null2empty(rb_from_string('1,2,3'),rb_from_string('1,2,3')) );
+--------------------------------------------------------------------------------------------+
| rb_and_cardinality_agg(rb_or_null2empty(rb_from_string('1,2,3'),rb_from_string('1,2,3')) ) |
+--------------------------------------------------------------------------------------------+
|                                                                                          3 |
+--------------------------------------------------------------------------------------------+
select rb_and_cardinality_agg(rb_andnot_null2empty(rb_from_string('1,2,3'),rb_from_string('1,2,3')) );
+------------------------------------------------------------------------------------------------+
| rb_and_cardinality_agg(rb_andnot_null2empty(rb_from_string('1,2,3'),rb_from_string('1,2,3')) ) |
+------------------------------------------------------------------------------------------------+
|                                                                                              0 |
+------------------------------------------------------------------------------------------------+
select rb_and_cardinality_agg(rb_iterate(rb_from_string('1')));
ERROR 0A000: use rb_iterate as parameter of other expr not supported
select rb_iterate(rb_and_cardinality_agg(rb_from_string('1')));
ERROR HY000: Invalid use of group function
drop table if exists tt3;
create table tt3(id int ,a0 varchar(1000),a varbinary(1000),r roaringbitmap,r1 roaringbitmap) PARTITION BY range COLUMNS(id)(
PARTITION p0 values less than(19),
PARTITION p1 values less than(25),
PARTITION p2 values less than(30)
);
drop view if exists vtt3;
create view vtt3 as select * from tt3;
insert into tt3 values(0,null,rb_build_empty(),rb_build_empty(),rb_build_varbinary(0x01060100000000000000000000003b300000010000ffff0100fffe0f00));
insert into tt3 values(1,'1',rb_from_string('1'),rb_from_string('1'),rb_build_varbinary(x'01053b3000000100000f27010000000f27'));
insert into tt3 values(2,'4294967296',rb_from_string('4294967296'),rb_from_string('4294967296'),rb_from_string('4294967296,4294967297,42949672969,4294967298,42949672961,42949672962,4294967299,4294967297,14294967296,14294967696,14295967296,5294967296,7294967296,9294967296,8294967296,42949617296,42949672916,4294967396,4294967496,
4294967595,4294967696,4294967795,4294968295,4294967995,4294977295,4294987295,4294997295,4294968295,4294969295,4295967295,4296967295,4297967295,4298967295'));
insert into tt3 values(3,'1,2,6,4,5,9',rb_from_string('1,2,6,4,5,9'),rb_from_string('1,2,6,4,5,9'),rb_from_string('1,2,3,4,5,6,7,8,9,10,11,12,13,14,15,16,17,18,19,20,21,22,23,24,25,26,27,28,29,30,31,4294967298,4294967299'));
insert into tt3 values(3,'1,2,6,4,5,9',rb_from_string('1,2,6,4,5,9'),rb_from_string('1,2,6,4,5,9'),rb_from_string('1,2,3,4,5,6,7,8,9,10,11,12,13,14,15,16,17,18,19,20,21,22,23,24,25,26,27,28,29,30,31,65537,65536'));
insert into tt3 values(4,'4294967296,4294967297,4294967298,4294967299',rb_from_string('4294967296,4294967297,4294967298,4294967299'),rb_from_string('4294967296,4294967297,4294967298,4294967299'),rb_from_string('1,2,3,4,5,6,7,8,9,10,11,12,13,14,15,16,17,18,19,20,21,22,23,24,25,26,27,28,29,30,31,65537,65536'));
insert into tt3 values(5,'1,2,3,4,5,6,7,8,9,10,11,12,13,14,15,16,17,18,19,20,21,22,23,24,25,26,27,28,29,30,31,32,33',
rb_from_string('1,2,3,4,5,6,7,8,9,10,11,12,13,14,15,16,17,18,19,20,21,22,23,24,25,26,27,28,29,30,31,32,33'),
rb_from_string('1,2,3,4,5,6,7,8,9,10,11,12,13,14,15,16,17,18,19,20,21,22,23,24,25,26,27,28,29,30,31,32,33'),rb_build_empty());
insert into tt3 values(5,'1,2,3,4,5,6,7,8,9,10,11,12,13,14,15,16,17,18,19,20,21,22,23,24,25,26,27,28,29,30,31,65537,65536',
rb_from_string('1,2,3,4,5,6,7,8,9,10,11,12,13,14,15,16,17,18,19,20,21,22,23,24,25,26,27,28,29,30,31,65537,65536'),
rb_from_string('1,2,3,4,5,6,7,8,9,10,11,12,13,14,15,16,17,18,19,20,21,22,23,24,25,26,27,28,29,30,31,65537,65536'),rb_from_string('1,2,6,4,5,9'));
insert into tt3 values(6,'1,2,3,4,5,6,7,8,9,10,11,12,13,14,15,16,17,18,19,20,21,22,23,24,25,26,27,28,29,30,31,4294967298,65536',
rb_from_string('1,2,3,4,5,6,7,8,9,10,11,12,13,14,15,16,17,18,19,20,21,22,23,24,25,26,27,28,29,30,31,4294967298,4294967299'),
rb_from_string('1,2,3,4,5,6,7,8,9,10,11,12,13,14,15,16,17,18,19,20,21,22,23,24,25,26,27,28,29,30,31,4294967298,4294967299'),rb_from_string('1,2,6,4,5,9'));
insert into tt3 values(20,'4294967296,4294967297,42949672969,4294967298,42949672961,42949672962,4294967299,4294967297,14294967296,14294967696,14295967296,5294967296,7294967296,9294967296,8294967296,42949617296,42949672916,4294967396,4294967496,
4294967595,4294967696,4294967795,4294968295,4294967995,4294977295,4294987295,4294997295,4294968295,4294969295,4295967295,4296967295,4297967295,4298967295',
rb_from_string('4294967296,4294967297,42949672969,4294967298,42949672961,42949672962,4294967299,4294967297,14294967296,14294967696,14295967296,5294967296,7294967296,9294967296,8294967296,42949617296,42949672916,4294967396,4294967496,
4294967595,4294967696,4294967795,4294968295,4294967995,4294977295,4294987295,4294997295,4294968295,4294969295,4295967295,4296967295,4297967295,4298967295'),
rb_from_string('4294967296,4294967297,42949672969,4294967298,42949672961,42949672962,4294967299,4294967297,14294967296,14294967696,14295967296,5294967296,7294967296,9294967296,8294967296,42949617296,42949672916,4294967396,4294967496,
4294967595,4294967696,4294967795,4294968295,4294967995,4294977295,4294987295,4294997295,4294968295,4294969295,4295967295,4296967295,4297967295,4298967295'),rb_from_string('4294967296'));
insert into tt3 values(21,'2542',x'01053b3000000100000f27010000000f27',rb_build_varbinary(x'01053b3000000100000f27010000000f27'),rb_from_string('4294967296'));
insert into tt3 values(8,'56214,-7854',rb_build_varbinary(0x01060100000000000000000000003b300000010000ffff0100fffe0f00),rb_build_varbinary(0x01060100000000000000000000003b300000010000ffff0100fffe0f00),rb_from_string('4294967296'));
insert into tt3 values(26,'1,23,8977,973747',0x01060300000000000000000000003b3001000100002000f36d0100010000002000607f677f010000003b30000001000002000100000002002a0000003a300000010000001df300001000000061c4
,0x01060100000000000000000000003b300000010000ffff0100fffe0f00,rb_from_string('4294967296'));
insert into tt3 values(10,null,null,null,null);
insert into tt3(id) values(11);
insert into tt3 values(14,'1,2,3,4,5,6,7,8,9,10,11,12,13,14,15,16,17,18,19,20,21,22,23,24,25,26,27,28,29,30,31,32,33',
0x01053A3000000100000000002000100000000100020003000400050006000700080009000A000B000C000D000E000F0010001100120013001400150016001700180019001A001B001C001D001E001F0020002100,
0x01053A3000000100000000002000100000000100020003000400050006000700080009000A000B000C000D000E000F0010001100120013001400150016001700180019001A001B001C001D001E001F0020002100,rb_build_empty());
########Ê∏ÖÁ©∫ÂõûÊî∂Á´ôÔºåÂà†Èô§ÊµãËØïÊï∞ÊçÆÂ∫ìÔºåË°®Á≠â ##########
drop database  IF EXISTS  oblrp;
purge recyclebin;
