#Environmental cleaning
drop user longpy@'%';
create user longpy identified by 'longpy';
grant all on *.* to longpy WITH GRANT OPTION;
obmysql-trim-2
drop table trim_table;
create table trim_table(name varchar(20),sal varchar(20));
insert into trim_table values(' ku li ','20 48'),(' 科 比 ',' 59 '),(' kebi',' 60 ' ),( null , null ),( ' 0 ', ' 0 ' );
select  trim(sal) + trim(sal) from trim_table;
trim(sal) + trim(sal)
40
118
120
NULL
0
Warnings:
Warning	1292	Truncated incorrect DOUBLE value: '20 48'
Warning	1292	Truncated incorrect DOUBLE value: '20 48'
select  trim(sal) - trim(sal) from trim_table;
trim(sal) - trim(sal)
0
0
0
NULL
0
Warnings:
Warning	1292	Truncated incorrect DOUBLE value: '20 48'
Warning	1292	Truncated incorrect DOUBLE value: '20 48'
select  trim(sal) * trim(sal) from trim_table;
trim(sal) * trim(sal)
400
3481
3600
NULL
0
Warnings:
Warning	1292	Truncated incorrect DOUBLE value: '20 48'
Warning	1292	Truncated incorrect DOUBLE value: '20 48'
select  trim(sal) / trim(sal) from trim_table;
trim(sal) / trim(sal)
1
1
1
NULL
NULL
Warnings:
Warning	1292	Truncated incorrect DOUBLE value: '20 48'
Warning	1292	Truncated incorrect DOUBLE value: '20 48'
select *  from  trim_table where trim(name) = 'kebi';
name	sal
 kebi	 60 
select *  from  trim_table where trim(' 科 ' from name) = '比';
name	sal
 科 比 	 59 
select *  from  trim_table where trim(sal) > 20;
name	sal
 科 比 	 59 
 kebi	 60 
Warnings:
Warning	1292	Truncated incorrect DECIMAL value: '20 48'
select *  from  trim_table where trim(sal) >= 20;
name	sal
 ku li 	20 48
 科 比 	 59 
 kebi	 60 
Warnings:
Warning	1292	Truncated incorrect DECIMAL value: '20 48'
select *  from  trim_table where trim(sal) < 20;
name	sal
 0 	 0 
Warnings:
Warning	1292	Truncated incorrect DECIMAL value: '20 48'
select *  from  trim_table where trim(sal) <= 20;
name	sal
 ku li 	20 48
 0 	 0 
Warnings:
Warning	1292	Truncated incorrect DECIMAL value: '20 48'
select *  from  trim_table where trim(sal) <> 20;
name	sal
 科 比 	 59 
 kebi	 60 
 0 	 0 
Warnings:
Warning	1292	Truncated incorrect DECIMAL value: '20 48'
select *  from  trim_table where trim(sal) != 20;
name	sal
 科 比 	 59 
 kebi	 60 
 0 	 0 
Warnings:
Warning	1292	Truncated incorrect DECIMAL value: '20 48'
select *  from  trim_table where trim(name) = '科 比' and trim(sal) > 20;
name	sal
 科 比 	 59 
select *  from  trim_table where trim(name) = '科 比' or trim(name) = 'ku li';
name	sal
 ku li 	20 48
 科 比 	 59 
select *  from  trim_table where trim(name) = '科 比' or trim(name) = 'ku li';
name	sal
 ku li 	20 48
 科 比 	 59 
select *  from  trim_table where trim(sal) is not null and trim(sal) > 0;
name	sal
 ku li 	20 48
 科 比 	 59 
 kebi	 60 
Warnings:
Warning	1292	Truncated incorrect DECIMAL value: '20 48'
obmysql-trim-3
drop view trim_view;
drop table trim_table;
drop table rtrim_table;
drop table ltrim_table;
drop table ltrim_view_table;
create table trim_table(id int,name varchar(20),sal varchar(20));
create table rtrim_table(id int,job varchar(20),pst varchar(20));
insert into trim_table values(1,' ke bi ',' 55 00 '),(2,' 库 里   ',' 2500 '),(3,' yao m',' 3500 ');
insert into rtrim_table values(1,' lan qiu ',' s f  '),(2,' 篮 球 ',' p g '),(3,' lan qiu ',' c ');
create view trim_view as select trim(e.id) id,rtrim(e.name) name,ltrim(e.sal)sal,trim(p.job)job,ltrim(p.pst)pst from trim_table e left join rtrim_table p on e.id = p.id;
select e.name,e.sal,e.job,e.pst from (select trim(e.name)name,trim(e.sal)sal,trim(p.job)job,trim(p.pst)pst from trim_table e left join rtrim_table p on e.id = p.id) e;
name	sal	job	pst
ke bi	55 00	lan qiu	s f
库 里	2500	篮 球	p g
yao m	3500	lan qiu	c
select trim(e.name),trim(p.pst) from trim_table e inner join rtrim_table p on e.id = p.id where trim(e.sal) > 3000 order by e.id;
trim(e.name)	trim(p.pst)
yao m	c
Warnings:
Warning	1292	Truncated incorrect DECIMAL value: '55 00'
Warning	1292	Truncated incorrect DECIMAL value: '55 00'
select trim(e.name),trim(p.pst) from trim_table e right join rtrim_table p on e.id = p.id where trim(p.job) = 'lan qiu' order by e.id;
trim(e.name)	trim(p.pst)
ke bi	s f
yao m	c
select e.name,e.sal,e.job,e.pst from (select rtrim(e.name)name,rtrim(e.sal)sal,rtrim(p.job)job,rtrim(p.pst)pst from trim_table e left join rtrim_table p on e.id = p.id) e;
name	sal	job	pst
 ke bi	 55 00	 lan qiu	 s f
 库 里	 2500	 篮 球	 p g
 yao m	 3500	 lan qiu	 c
select rtrim(e.name),rtrim(p.pst) from trim_table e inner join rtrim_table p on e.id = p.id where rtrim(e.sal) > 3000 order by e.id;
rtrim(e.name)	rtrim(p.pst)
 yao m	 c
Warnings:
Warning	1292	Truncated incorrect DECIMAL value: ' 55 00'
Warning	1292	Truncated incorrect DECIMAL value: ' 55 00'
select rtrim(e.name),rtrim(p.pst) from trim_table e right join rtrim_table p on e.id = p.id where rtrim(p.job) = ' lan qiu' order by e.id;
rtrim(e.name)	rtrim(p.pst)
 ke bi	 s f
 yao m	 c
select e.name,e.sal,e.job,e.pst from (select ltrim(e.name)name,ltrim(e.sal)sal,rtrim(p.job)job,ltrim(p.pst)pst from trim_table e left join rtrim_table p on e.id = p.id) e;
name	sal	job	pst
ke bi 	55 00 	 lan qiu	s f  
库 里   	2500 	 篮 球	p g 
yao m	3500 	 lan qiu	c 
select ltrim(e.name),ltrim(p.pst) from trim_table e inner join rtrim_table p on e.id = p.id where ltrim(e.sal) > 3000 order by e.id;
ltrim(e.name)	ltrim(p.pst)
yao m	c 
Warnings:
Warning	1292	Truncated incorrect DECIMAL value: '55 00 '
Warning	1292	Truncated incorrect DECIMAL value: '55 00 '
select ltrim(e.name),ltrim(p.pst) from trim_table e right join rtrim_table p on e.id = p.id where ltrim(p.job) = 'lan qiu' order by e.id;
ltrim(e.name)	ltrim(p.pst)
ke bi 	s f  
yao m	c 
select trim(e.name),ltrim(e.sal)  from trim_table e where id in (select id from rtrim_table) and rtrim(e.name) = ' ke bi';
trim(e.name)	ltrim(e.sal)
ke bi	55 00 
select trim(leading ' ke' from e.name ),ltrim(e.sal) from trim_table e where exists(select *  from rtrim_table where rtrim(job) = ' lan qiu') order by e.id desc;
trim(leading ' ke' from e.name )	ltrim(e.sal)
 yao m	3500 
 库 里   	2500 
 bi 	55 00 
select trim(leading ' ke' from e.name ),ltrim(e.sal) from trim_table e where id =  any(select id  from rtrim_table where rtrim(job) = ' lan qiu') order by e.id desc;
trim(leading ' ke' from e.name )	ltrim(e.sal)
 yao m	3500 
 bi 	55 00 
select trim(leading ' ke' from e.name ),ltrim(e.sal) from trim_table e where id >  any(select id  from rtrim_table where rtrim(job) = ' lan qiu') order by e.id desc;
trim(leading ' ke' from e.name )	ltrim(e.sal)
 yao m	3500 
 库 里   	2500 
select trim(leading ' ke' from e.name ),ltrim(e.sal) from trim_table e where id <  any(select id  from rtrim_table where rtrim(job) = ' lan qiu') order by e.id desc;
trim(leading ' ke' from e.name )	ltrim(e.sal)
 库 里   	2500 
 bi 	55 00 
select trim(leading ' ke' from e.name ),ltrim(e.sal) from trim_table e where id =  all(select id  from rtrim_table where rtrim(job) = 'lan qiu') order by e.id desc;
trim(leading ' ke' from e.name )	ltrim(e.sal)
 yao m	3500 
 库 里   	2500 
 bi 	55 00 
select trim(leading ' ke' from e.name ),ltrim(e.sal) from trim_table e where id >  all(select id  from rtrim_table where rtrim(job) = 'lan qiu') order by e.id desc;
trim(leading ' ke' from e.name )	ltrim(e.sal)
 yao m	3500 
 库 里   	2500 
 bi 	55 00 
select trim(leading ' ke' from e.name ),ltrim(e.sal) from trim_table e where id <  all(select id  from rtrim_table where rtrim(job) = 'lan qiu') order by e.id desc;
trim(leading ' ke' from e.name )	ltrim(e.sal)
 yao m	3500 
 库 里   	2500 
 bi 	55 00 
create table ltrim_table as select * from trim_table e where trim(e.name) = 'ke bi' or ltrim(e.sal) > 2500;
select count(*) from ltrim_table;
count(*)
2
update ltrim_table set sal = ' 6000 ' where trim(name) = 'ke bi';
select sal  from ltrim_table where trim(sal) = '6000';
sal
 6000 
select e.name,e.sal from trim_table e where trim(leading 'ke' from e.name) like '%b%';
name	sal
 ke bi 	 55 00 
select trim('ke' from e.name),ltrim(e.sal) from trim_table e where rtrim(e.sal) like '%5%';
trim('ke' from e.name)	ltrim(e.sal)
 ke bi 	55 00 
 库 里   	2500 
 yao m	3500 
select max(trim(sal)),min(trim(sal)) from trim_table;
max(trim(sal))	min(trim(sal))
55 00	2500
select rtrim(e.name),e.sal from trim_table e where trim(e.sal) > 2000 order by ltrim(e.id);
rtrim(e.name)	sal
 库 里	 2500 
 yao m	 3500 
Warnings:
Warning	1292	Truncated incorrect DECIMAL value: '55 00'
select rtrim(e.name),e.sal from trim_table e where trim(' ke ' from e.name) = 'bi' order by ltrim(e.id);
rtrim(e.name)	sal
 ke bi	 55 00 
select rtrim(e.name),ltrim(e.sal) from trim_table e where rtrim(e.sal) > 2000 order by rtrim(e.sal) limit 10;
rtrim(e.name)	ltrim(e.sal)
 库 里	2500 
 yao m	3500 
Warnings:
Warning	1292	Truncated incorrect DECIMAL value: ' 55 00'
select rtrim(e.name),ltrim(e.sal) from trim_table e where rtrim(e.sal) > 2000 order by rtrim(e.sal) desc limit 10;
rtrim(e.name)	ltrim(e.sal)
 yao m	3500 
 库 里	2500 
Warnings:
Warning	1292	Truncated incorrect DECIMAL value: ' 55 00'
select e.id,max(trim(e.sal)),ltrim(e.name) from trim_table e where rtrim(e.sal) > 2000   group by e.id order by e.id;
id	max(trim(e.sal))	ltrim(e.name)
2	2500	库 里   
3	3500	yao m
Warnings:
Warning	1292	Truncated incorrect DECIMAL value: ' 55 00'
select e.id,max(trim(e.sal)),ltrim(e.name) from trim_table e where rtrim(e.sal) > 0  group by e.id having max(trim(e.sal)) > 2000 order by e.id;
id	max(trim(e.sal))	ltrim(e.name)
2	2500	库 里   
3	3500	yao m
Warnings:
Warning	1292	Truncated incorrect DECIMAL value: ' 55 00'
Warning	1292	Truncated incorrect DECIMAL value: '55 00'
select rtrim(e.name),trim(case when trim(e.sal) < 2000  then null else trim(e.sal) end) from trim_table e;
rtrim(e.name)	trim(case when trim(e.sal) < 2000  then null else trim(e.sal) end)
 ke bi	NULL
 库 里	2500
 yao m	3500
Warnings:
Warning	1292	Truncated incorrect DECIMAL value: '55 00'
select ltrim(e.name),trim(case trim(e.sal)  when 2500 then ' 1 ' when 3500 then ' 2 ' else ' 3 ' end) from trim_table e order by e.id desc;
ltrim(e.name)	trim(case trim(e.sal)  when 2500 then ' 1 ' when 3500 then ' 2 ' else ' 3 ' end)
yao m	2
库 里   	1
ke bi 	3
Warnings:
Warning	1292	Truncated incorrect DECIMAL value: '55 00'
Warning	1292	Truncated incorrect DECIMAL value: '55 00'
select ltrim(e.name),rtrim(e.sal) from trim_table e group by trim(case trim(e.sal)  when 2500 then ' 1 ' when 3500 then ' 2 ' else ' 3 ' end) order by e.id desc;
ltrim(e.name)	rtrim(e.sal)
yao m	 3500
库 里   	 2500
ke bi 	 55 00
Warnings:
Warning	1292	Truncated incorrect DECIMAL value: '55 00'
Warning	1292	Truncated incorrect DECIMAL value: '55 00'
insert into ltrim_table select *  from trim_table e where rtrim(e.name) = ' ke bi';
select count(*) from ltrim_table;
count(*)
3
insert into ltrim_table select *  from trim_table e where rtrim(e.name) = ' ke bi' order by trim(e.sal);
select count(*) from ltrim_table;
count(*)
4
insert into ltrim_table select e.id,max(ltrim(e.sal)),rtrim(e.name)  from trim_table e where rtrim(e.name) = ' ke bi' group by e.id order by trim(e.sal);
select count(*) from ltrim_table;
count(*)
5
update rtrim_table set job = 'lan qiu' where trim(job) = '篮 球';
select * from rtrim_table;
id	job	pst
1	 lan qiu 	 s f  
2	lan qiu	 p g 
3	 lan qiu 	 c 
update rtrim_table set job = '篮球' where trim(job) = 'lan qiu';
select * from rtrim_table;
id	job	pst
1	篮球	 s f  
2	篮球	 p g 
3	篮球	 c 
update rtrim_table set job = trim(pst) where id = 1;
select * from rtrim_table;
id	job	pst
1	s f	 s f  
2	篮球	 p g 
3	篮球	 c 
delete from ltrim_table where trim(' ke ' from name) = 'bi';
select count(*) from ltrim_table;
count(*)
2
obmysql-trim-7
select trim(e.name),ltrim(e.sal),rtrim(e.job),trim('s' from e.pst) from trim_view e;
trim(e.name)	ltrim(e.sal)	rtrim(e.job)	trim('s' from e.pst)
ke bi	55 00 	s f	 f  
库 里	2500 	篮球	p g 
yao m	3500 	篮球	c 
select trim(e.name),trim(p.pst) from trim_view e inner join rtrim_table p on e.id = p.id where trim(e.sal) > 3000 order by e.id;
trim(e.name)	trim(p.pst)
yao m	c
Warnings:
Warning	1292	Truncated incorrect DECIMAL value: '55 00'
Warning	1292	Truncated incorrect DECIMAL value: '55 00'
select trim(e.name),trim(p.pst) from trim_view e right join rtrim_table p on e.id = p.id where trim(p.job) = '篮球' order by e.id;
trim(e.name)	trim(p.pst)
库 里	p g
yao m	c
select e.name,e.sal,e.job,e.pst from (select rtrim(e.name)name,rtrim(e.sal)sal,rtrim(p.job)job,rtrim(p.pst)pst from trim_view e left join rtrim_table p on e.id = p.id) e;
name	sal	job	pst
 ke bi	55 00	s f	 s f
 库 里	2500	篮球	 p g
 yao m	3500	篮球	 c
select rtrim(e.name),rtrim(p.pst) from trim_view e inner join rtrim_table p on e.id = p.id where rtrim(e.sal) > 3000 order by e.id;
rtrim(e.name)	rtrim(p.pst)
 yao m	 c
Warnings:
Warning	1292	Truncated incorrect DECIMAL value: '55 00'
Warning	1292	Truncated incorrect DECIMAL value: '55 00'
select rtrim(e.name),rtrim(p.pst) from trim_view e right join rtrim_table p on e.id = p.id where rtrim(p.job) = '篮球' order by e.id;
rtrim(e.name)	rtrim(p.pst)
 库 里	 p g
 yao m	 c
select e.name,e.sal,e.job,e.pst from (select ltrim(e.name)name,ltrim(e.sal)sal,rtrim(p.job)job,ltrim(p.pst)pst from trim_view e left join rtrim_table p on e.id = p.id) e;
name	sal	job	pst
ke bi	55 00 	s f	s f  
库 里	2500 	篮球	p g 
yao m	3500 	篮球	c 
select ltrim(e.name),ltrim(p.pst) from trim_view e inner join rtrim_table p on e.id = p.id where ltrim(e.sal) > 3000 order by e.id;
ltrim(e.name)	ltrim(p.pst)
yao m	c 
Warnings:
Warning	1292	Truncated incorrect DECIMAL value: '55 00 '
Warning	1292	Truncated incorrect DECIMAL value: '55 00 '
select ltrim(e.name),ltrim(p.pst) from trim_view e right join rtrim_table p on e.id = p.id where ltrim(p.job) = '篮球' order by e.id;
ltrim(e.name)	ltrim(p.pst)
库 里	p g 
yao m	c 
select trim(e.name),ltrim(e.sal)  from trim_view e where id in (select id from rtrim_table) and rtrim(e.name) = ' ke bi';
trim(e.name)	ltrim(e.sal)
ke bi	55 00 
select trim(leading ' ke' from e.name ),ltrim(e.sal) from trim_view e where exists(select *  from rtrim_table where rtrim(job) = '篮球') order by e.id desc;
trim(leading ' ke' from e.name )	ltrim(e.sal)
 yao m	3500 
 库 里	2500 
 bi	55 00 
select trim(leading ' ke' from e.name ),ltrim(e.sal) from trim_view e where id =  any(select id  from rtrim_table where rtrim(job) = '篮球') order by e.id desc;
trim(leading ' ke' from e.name )	ltrim(e.sal)
 yao m	3500 
 库 里	2500 
select trim(leading ' ke' from e.name ),ltrim(e.sal) from trim_view e where id >  any(select id  from rtrim_table where rtrim(job) = '篮球') order by e.id desc;
trim(leading ' ke' from e.name )	ltrim(e.sal)
 yao m	3500 
select trim(leading ' ke' from e.name ),ltrim(e.sal) from trim_view e where id <  any(select id  from rtrim_table where rtrim(job) = '篮球') order by e.id desc;
trim(leading ' ke' from e.name )	ltrim(e.sal)
 库 里	2500 
 bi	55 00 
select trim(leading ' ke' from e.name ),ltrim(e.sal) from trim_view e where id =  all(select id  from rtrim_table where rtrim(job) = '篮球') order by e.id desc;
trim(leading ' ke' from e.name )	ltrim(e.sal)
select trim(leading ' ke' from e.name ),ltrim(e.sal) from trim_view e where id >  all(select id  from rtrim_table where rtrim(job) = '篮球') order by e.id desc;
trim(leading ' ke' from e.name )	ltrim(e.sal)
select trim(leading ' ke' from e.name ),ltrim(e.sal) from trim_view e where id <  all(select id  from rtrim_table where rtrim(job) = '篮球') order by e.id desc;
trim(leading ' ke' from e.name )	ltrim(e.sal)
 bi	55 00 
create table ltrim_view_table as select * from trim_view e where trim(e.name) = 'ke bi' or ltrim(e.sal) > 2500;
select count(*) from ltrim_view_table;
count(*)
2
select e.name,e.sal from trim_view e where trim(leading 'ke' from e.name) like '%b%';
name	sal
 ke bi	55 00 
select trim('ke' from e.name),ltrim(e.sal) from trim_view e where rtrim(e.sal) like '%5%';
trim('ke' from e.name)	ltrim(e.sal)
 ke bi	55 00 
 库 里	2500 
 yao m	3500 
select max(trim(sal)),min(trim(sal)) from trim_view;
max(trim(sal))	min(trim(sal))
55 00	2500
select rtrim(e.name),e.sal from trim_view e where trim(e.sal) > 2000 order by ltrim(e.id);
rtrim(e.name)	sal
 库 里	2500 
 yao m	3500 
Warnings:
Warning	1235	expr types not well deduced after transform not supported
Warning	1292	Truncated incorrect DECIMAL value: '55 00'
Warning	1292	Truncated incorrect DECIMAL value: '55 00'
select rtrim(e.name),e.sal from trim_view e where trim(' ke ' from e.name) = 'bi' order by ltrim(e.id);
rtrim(e.name)	sal
 ke bi	55 00 
Warnings:
Warning	1235	expr types not well deduced after transform not supported
select rtrim(e.name),ltrim(e.sal) from trim_view e where rtrim(e.sal) > 2000 order by rtrim(e.sal) limit 10;
rtrim(e.name)	ltrim(e.sal)
 库 里	2500 
 yao m	3500 
Warnings:
Warning	1292	Truncated incorrect DECIMAL value: '55 00'
select rtrim(e.name),ltrim(e.sal) from trim_view e where rtrim(e.sal) > 2000 order by rtrim(e.sal) desc limit 10;
rtrim(e.name)	ltrim(e.sal)
 yao m	3500 
 库 里	2500 
Warnings:
Warning	1292	Truncated incorrect DECIMAL value: '55 00'
select e.id,max(trim(e.sal)),ltrim(e.name) from trim_view e where rtrim(e.sal) > 2000   group by e.id order by e.id;
id	max(trim(e.sal))	ltrim(e.name)
2	2500	库 里
3	3500	yao m
Warnings:
Warning	1292	Truncated incorrect DECIMAL value: '55 00'
select e.id,max(trim(e.sal)),ltrim(e.name) from trim_view e where rtrim(e.sal) > 0  group by e.id having max(trim(e.sal)) > 2000 order by e.id;
id	max(trim(e.sal))	ltrim(e.name)
2	2500	库 里
3	3500	yao m
Warnings:
Warning	1292	Truncated incorrect DECIMAL value: '55 00'
Warning	1292	Truncated incorrect DECIMAL value: '55 00'
select rtrim(e.name),trim(case when trim(e.sal) < 2000  then null else trim(e.sal) end) from trim_view e;
rtrim(e.name)	trim(case when trim(e.sal) < 2000  then null else trim(e.sal) end)
 ke bi	NULL
 库 里	2500
 yao m	3500
Warnings:
Warning	1292	Truncated incorrect DECIMAL value: '55 00'
select ltrim(e.name),trim(case trim(e.sal)  when 2500 then ' 1 ' when 3500 then ' 2 ' else ' 3 ' end) from trim_view e order by e.id desc;
ltrim(e.name)	trim(case trim(e.sal)  when 2500 then ' 1 ' when 3500 then ' 2 ' else ' 3 ' end)
yao m	2
库 里	1
ke bi	3
Warnings:
Warning	1292	Truncated incorrect DECIMAL value: '55 00'
Warning	1292	Truncated incorrect DECIMAL value: '55 00'
select ltrim(e.name),rtrim(e.sal) from trim_view e group by trim(case trim(e.sal)  when 2500 then ' 1 ' when 3500 then ' 2 ' else ' 3 ' end) order by e.id desc;
ltrim(e.name)	rtrim(e.sal)
yao m	3500
库 里	2500
ke bi	55 00
Warnings:
Warning	1292	Truncated incorrect DECIMAL value: '55 00'
Warning	1292	Truncated incorrect DECIMAL value: '55 00'
drop view trim_view;
drop table trim_table;
drop table rtrim_table;
drop table ltrim_table;
drop table ltrim_view_table;
# Clean up users
drop user longpy@'%';
