create table t1(c1 int, c2 varchar(100));
select table_mode from __all_virtual_table where table_name = "t1" and tenant_id = 1;
table_mode
66048
insert into t1 values(1, 'abcdefgABCDEFG');
insert into t1 values(2, 'abcdefgABCDEFG');
insert into t1 values(3, 'abcdefgABCDEFG');
insert into t1 values(4, 'abcdefgABCDEFG');
insert into t1 values(5, 'abcdefgABCDEFG');
insert into t1 values(6, 'abcdefgABCDEFG');
insert into t1 values(7, 'abcdefgABCDEFG');
insert into t1 values(8, 'abcdefgABCDEFG');
insert into t1 values(9, 'abcdefgABCDEFG');
insert into t1 values(10, 'abcdefgABCDEFG');
insert into t1 values(11, 'abcdefgABCDEFG');
insert into t1 values(12, 'abcdefgABCDEFG');
insert into t1 values(13, 'abcdefgABCDEFG');
insert into t1 values(14, 'abcdefgABCDEFG');
insert into t1 values(15, 'abcdefgABCDEFG');
insert into t1 values(16, 'abcdefgABCDEFG');
insert into t1 values(17, 'abcdefgABCDEFG');
insert into t1 values(18, 'abcdefgABCDEFG');
insert into t1 values(19, 'abcdefgABCDEFG');
insert into t1 values(20, 'abcdefgABCDEFG');
insert into t1 values(21, 'abcdefgABCDEFG');
insert into t1 values(22, 'abcdefgABCDEFG');
insert into t1 values(23, 'abcdefgABCDEFG');
insert into t1 values(24, 'abcdefgABCDEFG');
insert into t1 values(25, 'abcdefgABCDEFG');
insert into t1 values(26, 'abcdefgABCDEFG');
insert into t1 values(27, 'abcdefgABCDEFG');
insert into t1 values(28, 'abcdefgABCDEFG');
insert into t1 values(29, 'abcdefgABCDEFG');
insert into t1 values(30, 'abcdefgABCDEFG');
alter table t1 set table_mode = 'queuing';
select table_mode from __all_virtual_table where table_name = "t1" and tenant_id = 1;
table_mode
66049
insert into t1 values(31, 'abcdefgABCDEFG');
insert into t1 values(32, 'abcdefgABCDEFG');
insert into t1 values(33, 'abcdefgABCDEFG');
insert into t1 values(34, 'abcdefgABCDEFG');
insert into t1 values(35, 'abcdefgABCDEFG');
insert into t1 values(36, 'abcdefgABCDEFG');
insert into t1 values(37, 'abcdefgABCDEFG');
insert into t1 values(38, 'abcdefgABCDEFG');
insert into t1 values(39, 'abcdefgABCDEFG');
insert into t1 values(40, 'abcdefgABCDEFG');
insert into t1 values(41, 'abcdefgABCDEFG');
insert into t1 values(42, 'abcdefgABCDEFG');
insert into t1 values(43, 'abcdefgABCDEFG');
insert into t1 values(44, 'abcdefgABCDEFG');
insert into t1 values(45, 'abcdefgABCDEFG');
insert into t1 values(46, 'abcdefgABCDEFG');
insert into t1 values(47, 'abcdefgABCDEFG');
insert into t1 values(48, 'abcdefgABCDEFG');
insert into t1 values(49, 'abcdefgABCDEFG');
insert into t1 values(50, 'abcdefgABCDEFG');
delete from t1 where c1 < 26;
select * from t1;
c1	c2
26	abcdefgABCDEFG
27	abcdefgABCDEFG
28	abcdefgABCDEFG
29	abcdefgABCDEFG
30	abcdefgABCDEFG
31	abcdefgABCDEFG
32	abcdefgABCDEFG
33	abcdefgABCDEFG
34	abcdefgABCDEFG
35	abcdefgABCDEFG
36	abcdefgABCDEFG
37	abcdefgABCDEFG
38	abcdefgABCDEFG
39	abcdefgABCDEFG
40	abcdefgABCDEFG
41	abcdefgABCDEFG
42	abcdefgABCDEFG
43	abcdefgABCDEFG
44	abcdefgABCDEFG
45	abcdefgABCDEFG
46	abcdefgABCDEFG
47	abcdefgABCDEFG
48	abcdefgABCDEFG
49	abcdefgABCDEFG
50	abcdefgABCDEFG
alter table t1 set table_mode = 'normal';
select table_mode from __all_virtual_table where table_name = "t1" and tenant_id = 1;
table_mode
66048
drop table if exists qt0;
drop table if exists qt1;
drop table if exists qt2;
drop table if exists qt3;
drop table if exists qt4;
drop table if exists qt5;
drop table if exists qt6;
drop table if exists qt7;
drop table if exists qt8;
drop table if exists qt9;
drop table if exists qt10;
create table qt0(c1 int, c2 int);
create table qt1(c1 int, c2 int) table_mode='normal';
create table qt2(c1 int, c2 int) table_mode='queuing';
create table qt3(c1 int, c2 int) table_mode='moderate';
create table qt4(c1 int, c2 int) table_mode='super';
create table qt5(c1 int, c2 int) table_mode='extreme';
create table qt6(c1 int, c2 int) table_mode='exterme';
ERROR 0A000: Table mode exterme is not supported
create table qt6(c1 int, c2 int) table_mode='xxx';
ERROR 0A000: Table mode xxx is not supported
create table qt6(c1 int, c2 int) table_mode='NoRmAL';
create table qt7(c1 int, c2 int) table_mode='QueuIng';
create table qt8(c1 int, c2 int) table_mode='MoDeRaTe';
create table qt9(c1 int, c2 int) table_mode='SuPeR';
create table qt10(c1 int, c2 int) table_mode='ExTrEmE';
select table_mode - 66048 as table_mode_flag from __all_virtual_table where table_name = "qt0" and tenant_id = 1;
table_mode_flag
0
select table_mode - 66048 as table_mode_flag from __all_virtual_table where table_name = "qt1" and tenant_id = 1;
table_mode_flag
0
select table_mode - 66048 as table_mode_flag from __all_virtual_table where table_name = "qt2" and tenant_id = 1;
table_mode_flag
1
select table_mode - 66048 as table_mode_flag from __all_virtual_table where table_name = "qt3" and tenant_id = 1;
table_mode_flag
3
select table_mode - 66048 as table_mode_flag from __all_virtual_table where table_name = "qt4" and tenant_id = 1;
table_mode_flag
4
select table_mode - 66048 as table_mode_flag from __all_virtual_table where table_name = "qt5" and tenant_id = 1;
table_mode_flag
5
select table_mode - 66048 as table_mode_flag from __all_virtual_table where table_name = "qt6" and tenant_id = 1;
table_mode_flag
0
select table_mode - 66048 as table_mode_flag from __all_virtual_table where table_name = "qt7" and tenant_id = 1;
table_mode_flag
1
select table_mode - 66048 as table_mode_flag from __all_virtual_table where table_name = "qt8" and tenant_id = 1;
table_mode_flag
3
select table_mode - 66048 as table_mode_flag from __all_virtual_table where table_name = "qt9" and tenant_id = 1;
table_mode_flag
4
select table_mode - 66048 as table_mode_flag from __all_virtual_table where table_name = "qt10" and tenant_id = 1;
table_mode_flag
5
show create table qt0;
Table	Create Table
qt0	CREATE TABLE `qt0` (
  `c1` int(11) DEFAULT NULL,
  `c2` int(11) DEFAULT NULL
) ORGANIZATION INDEX DEFAULT CHARSET = utf8mb4 COMPRESSION = 'lz4_1.0' REPLICA_NUM = 1 BLOCK_SIZE = 16384 USE_BLOOM_FILTER = FALSE ENABLE_MACRO_BLOCK_BLOOM_FILTER = FALSE TABLET_SIZE = 134217728 PCTFREE = 10
show create table qt1;
Table	Create Table
qt1	CREATE TABLE `qt1` (
  `c1` int(11) DEFAULT NULL,
  `c2` int(11) DEFAULT NULL
) ORGANIZATION INDEX DEFAULT CHARSET = utf8mb4 COMPRESSION = 'lz4_1.0' REPLICA_NUM = 1 BLOCK_SIZE = 16384 USE_BLOOM_FILTER = FALSE ENABLE_MACRO_BLOCK_BLOOM_FILTER = FALSE TABLET_SIZE = 134217728 PCTFREE = 10
show create table qt2;
Table	Create Table
qt2	CREATE TABLE `qt2` (
  `c1` int(11) DEFAULT NULL,
  `c2` int(11) DEFAULT NULL
) ORGANIZATION INDEX DEFAULT CHARSET = utf8mb4 COMPRESSION = 'lz4_1.0' REPLICA_NUM = 1 BLOCK_SIZE = 16384 USE_BLOOM_FILTER = FALSE ENABLE_MACRO_BLOCK_BLOOM_FILTER = FALSE TABLET_SIZE = 134217728 PCTFREE = 10 TABLE_MODE = 'QUEUING'
show create table qt3;
Table	Create Table
qt3	CREATE TABLE `qt3` (
  `c1` int(11) DEFAULT NULL,
  `c2` int(11) DEFAULT NULL
) ORGANIZATION INDEX DEFAULT CHARSET = utf8mb4 COMPRESSION = 'lz4_1.0' REPLICA_NUM = 1 BLOCK_SIZE = 16384 USE_BLOOM_FILTER = FALSE ENABLE_MACRO_BLOCK_BLOOM_FILTER = FALSE TABLET_SIZE = 134217728 PCTFREE = 10 TABLE_MODE = 'MODERATE'
show create table qt4;
Table	Create Table
qt4	CREATE TABLE `qt4` (
  `c1` int(11) DEFAULT NULL,
  `c2` int(11) DEFAULT NULL
) ORGANIZATION INDEX DEFAULT CHARSET = utf8mb4 COMPRESSION = 'lz4_1.0' REPLICA_NUM = 1 BLOCK_SIZE = 16384 USE_BLOOM_FILTER = FALSE ENABLE_MACRO_BLOCK_BLOOM_FILTER = FALSE TABLET_SIZE = 134217728 PCTFREE = 10 TABLE_MODE = 'SUPER'
show create table qt5;
Table	Create Table
qt5	CREATE TABLE `qt5` (
  `c1` int(11) DEFAULT NULL,
  `c2` int(11) DEFAULT NULL
) ORGANIZATION INDEX DEFAULT CHARSET = utf8mb4 COMPRESSION = 'lz4_1.0' REPLICA_NUM = 1 BLOCK_SIZE = 16384 USE_BLOOM_FILTER = FALSE ENABLE_MACRO_BLOCK_BLOOM_FILTER = FALSE TABLET_SIZE = 134217728 PCTFREE = 10 TABLE_MODE = 'EXTREME'
show create table qt6;
Table	Create Table
qt6	CREATE TABLE `qt6` (
  `c1` int(11) DEFAULT NULL,
  `c2` int(11) DEFAULT NULL
) ORGANIZATION INDEX DEFAULT CHARSET = utf8mb4 COMPRESSION = 'lz4_1.0' REPLICA_NUM = 1 BLOCK_SIZE = 16384 USE_BLOOM_FILTER = FALSE ENABLE_MACRO_BLOCK_BLOOM_FILTER = FALSE TABLET_SIZE = 134217728 PCTFREE = 10
show create table qt7;
Table	Create Table
qt7	CREATE TABLE `qt7` (
  `c1` int(11) DEFAULT NULL,
  `c2` int(11) DEFAULT NULL
) ORGANIZATION INDEX DEFAULT CHARSET = utf8mb4 COMPRESSION = 'lz4_1.0' REPLICA_NUM = 1 BLOCK_SIZE = 16384 USE_BLOOM_FILTER = FALSE ENABLE_MACRO_BLOCK_BLOOM_FILTER = FALSE TABLET_SIZE = 134217728 PCTFREE = 10 TABLE_MODE = 'QUEUING'
show create table qt8;
Table	Create Table
qt8	CREATE TABLE `qt8` (
  `c1` int(11) DEFAULT NULL,
  `c2` int(11) DEFAULT NULL
) ORGANIZATION INDEX DEFAULT CHARSET = utf8mb4 COMPRESSION = 'lz4_1.0' REPLICA_NUM = 1 BLOCK_SIZE = 16384 USE_BLOOM_FILTER = FALSE ENABLE_MACRO_BLOCK_BLOOM_FILTER = FALSE TABLET_SIZE = 134217728 PCTFREE = 10 TABLE_MODE = 'MODERATE'
show create table qt9;
Table	Create Table
qt9	CREATE TABLE `qt9` (
  `c1` int(11) DEFAULT NULL,
  `c2` int(11) DEFAULT NULL
) ORGANIZATION INDEX DEFAULT CHARSET = utf8mb4 COMPRESSION = 'lz4_1.0' REPLICA_NUM = 1 BLOCK_SIZE = 16384 USE_BLOOM_FILTER = FALSE ENABLE_MACRO_BLOCK_BLOOM_FILTER = FALSE TABLET_SIZE = 134217728 PCTFREE = 10 TABLE_MODE = 'SUPER'
show create table qt10;
Table	Create Table
qt10	CREATE TABLE `qt10` (
  `c1` int(11) DEFAULT NULL,
  `c2` int(11) DEFAULT NULL
) ORGANIZATION INDEX DEFAULT CHARSET = utf8mb4 COMPRESSION = 'lz4_1.0' REPLICA_NUM = 1 BLOCK_SIZE = 16384 USE_BLOOM_FILTER = FALSE ENABLE_MACRO_BLOCK_BLOOM_FILTER = FALSE TABLET_SIZE = 134217728 PCTFREE = 10 TABLE_MODE = 'EXTREME'
alter table qt0 set table_mode = 'extreme';
alter table qt1 set table_mode = 'super';
alter table qt2 set table_mode = 'moderate';
alter table qt3 set table_mode = 'queuing';
alter table qt4 set table_mode = 'normal';
alter table qt5 set table_mode = 'normal';
alter table qt5 set table_mode='nomral';
ERROR 0A000: Table mode nomral is not supported
alter table qt5 set table_mode='xxx';
ERROR 0A000: Table mode xxx is not supported
alter table qt6 set table_mode='QuEuING';
alter table qt7 set table_mode='ModErAtE';
alter table qt8 set table_mode='SuPeR';
alter table qt9 set table_mode='ExTREMe';
alter table qt10 set table_mode='NoRMaL';
select table_mode - 66048 as table_mode_flag from __all_virtual_table where table_name = "qt0" and tenant_id = 1;
table_mode_flag
5
select table_mode - 66048 as table_mode_flag from __all_virtual_table where table_name = "qt1" and tenant_id = 1;
table_mode_flag
4
select table_mode - 66048 as table_mode_flag from __all_virtual_table where table_name = "qt2" and tenant_id = 1;
table_mode_flag
3
select table_mode - 66048 as table_mode_flag from __all_virtual_table where table_name = "qt3" and tenant_id = 1;
table_mode_flag
1
select table_mode - 66048 as table_mode_flag from __all_virtual_table where table_name = "qt4" and tenant_id = 1;
table_mode_flag
0
select table_mode - 66048 as table_mode_flag from __all_virtual_table where table_name = "qt5" and tenant_id = 1;
table_mode_flag
0
select table_mode - 66048 as table_mode_flag from __all_virtual_table where table_name = "qt6" and tenant_id = 1;
table_mode_flag
1
select table_mode - 66048 as table_mode_flag from __all_virtual_table where table_name = "qt7" and tenant_id = 1;
table_mode_flag
3
select table_mode - 66048 as table_mode_flag from __all_virtual_table where table_name = "qt8" and tenant_id = 1;
table_mode_flag
4
select table_mode - 66048 as table_mode_flag from __all_virtual_table where table_name = "qt9" and tenant_id = 1;
table_mode_flag
5
select table_mode - 66048 as table_mode_flag from __all_virtual_table where table_name = "qt10" and tenant_id = 1;
table_mode_flag
0
show create table qt0;
Table	Create Table
qt0	CREATE TABLE `qt0` (
  `c1` int(11) DEFAULT NULL,
  `c2` int(11) DEFAULT NULL
) ORGANIZATION INDEX DEFAULT CHARSET = utf8mb4 COMPRESSION = 'lz4_1.0' REPLICA_NUM = 1 BLOCK_SIZE = 16384 USE_BLOOM_FILTER = FALSE ENABLE_MACRO_BLOCK_BLOOM_FILTER = FALSE TABLET_SIZE = 134217728 PCTFREE = 10 TABLE_MODE = 'EXTREME'
show create table qt1;
Table	Create Table
qt1	CREATE TABLE `qt1` (
  `c1` int(11) DEFAULT NULL,
  `c2` int(11) DEFAULT NULL
) ORGANIZATION INDEX DEFAULT CHARSET = utf8mb4 COMPRESSION = 'lz4_1.0' REPLICA_NUM = 1 BLOCK_SIZE = 16384 USE_BLOOM_FILTER = FALSE ENABLE_MACRO_BLOCK_BLOOM_FILTER = FALSE TABLET_SIZE = 134217728 PCTFREE = 10 TABLE_MODE = 'SUPER'
show create table qt2;
Table	Create Table
qt2	CREATE TABLE `qt2` (
  `c1` int(11) DEFAULT NULL,
  `c2` int(11) DEFAULT NULL
) ORGANIZATION INDEX DEFAULT CHARSET = utf8mb4 COMPRESSION = 'lz4_1.0' REPLICA_NUM = 1 BLOCK_SIZE = 16384 USE_BLOOM_FILTER = FALSE ENABLE_MACRO_BLOCK_BLOOM_FILTER = FALSE TABLET_SIZE = 134217728 PCTFREE = 10 TABLE_MODE = 'MODERATE'
show create table qt3;
Table	Create Table
qt3	CREATE TABLE `qt3` (
  `c1` int(11) DEFAULT NULL,
  `c2` int(11) DEFAULT NULL
) ORGANIZATION INDEX DEFAULT CHARSET = utf8mb4 COMPRESSION = 'lz4_1.0' REPLICA_NUM = 1 BLOCK_SIZE = 16384 USE_BLOOM_FILTER = FALSE ENABLE_MACRO_BLOCK_BLOOM_FILTER = FALSE TABLET_SIZE = 134217728 PCTFREE = 10 TABLE_MODE = 'QUEUING'
show create table qt4;
Table	Create Table
qt4	CREATE TABLE `qt4` (
  `c1` int(11) DEFAULT NULL,
  `c2` int(11) DEFAULT NULL
) ORGANIZATION INDEX DEFAULT CHARSET = utf8mb4 COMPRESSION = 'lz4_1.0' REPLICA_NUM = 1 BLOCK_SIZE = 16384 USE_BLOOM_FILTER = FALSE ENABLE_MACRO_BLOCK_BLOOM_FILTER = FALSE TABLET_SIZE = 134217728 PCTFREE = 10
show create table qt5;
Table	Create Table
qt5	CREATE TABLE `qt5` (
  `c1` int(11) DEFAULT NULL,
  `c2` int(11) DEFAULT NULL
) ORGANIZATION INDEX DEFAULT CHARSET = utf8mb4 COMPRESSION = 'lz4_1.0' REPLICA_NUM = 1 BLOCK_SIZE = 16384 USE_BLOOM_FILTER = FALSE ENABLE_MACRO_BLOCK_BLOOM_FILTER = FALSE TABLET_SIZE = 134217728 PCTFREE = 10
show create table qt6;
Table	Create Table
qt6	CREATE TABLE `qt6` (
  `c1` int(11) DEFAULT NULL,
  `c2` int(11) DEFAULT NULL
) ORGANIZATION INDEX DEFAULT CHARSET = utf8mb4 COMPRESSION = 'lz4_1.0' REPLICA_NUM = 1 BLOCK_SIZE = 16384 USE_BLOOM_FILTER = FALSE ENABLE_MACRO_BLOCK_BLOOM_FILTER = FALSE TABLET_SIZE = 134217728 PCTFREE = 10 TABLE_MODE = 'QUEUING'
show create table qt7;
Table	Create Table
qt7	CREATE TABLE `qt7` (
  `c1` int(11) DEFAULT NULL,
  `c2` int(11) DEFAULT NULL
) ORGANIZATION INDEX DEFAULT CHARSET = utf8mb4 COMPRESSION = 'lz4_1.0' REPLICA_NUM = 1 BLOCK_SIZE = 16384 USE_BLOOM_FILTER = FALSE ENABLE_MACRO_BLOCK_BLOOM_FILTER = FALSE TABLET_SIZE = 134217728 PCTFREE = 10 TABLE_MODE = 'MODERATE'
show create table qt8;
Table	Create Table
qt8	CREATE TABLE `qt8` (
  `c1` int(11) DEFAULT NULL,
  `c2` int(11) DEFAULT NULL
) ORGANIZATION INDEX DEFAULT CHARSET = utf8mb4 COMPRESSION = 'lz4_1.0' REPLICA_NUM = 1 BLOCK_SIZE = 16384 USE_BLOOM_FILTER = FALSE ENABLE_MACRO_BLOCK_BLOOM_FILTER = FALSE TABLET_SIZE = 134217728 PCTFREE = 10 TABLE_MODE = 'SUPER'
show create table qt9;
Table	Create Table
qt9	CREATE TABLE `qt9` (
  `c1` int(11) DEFAULT NULL,
  `c2` int(11) DEFAULT NULL
) ORGANIZATION INDEX DEFAULT CHARSET = utf8mb4 COMPRESSION = 'lz4_1.0' REPLICA_NUM = 1 BLOCK_SIZE = 16384 USE_BLOOM_FILTER = FALSE ENABLE_MACRO_BLOCK_BLOOM_FILTER = FALSE TABLET_SIZE = 134217728 PCTFREE = 10 TABLE_MODE = 'EXTREME'
show create table qt10;
Table	Create Table
qt10	CREATE TABLE `qt10` (
  `c1` int(11) DEFAULT NULL,
  `c2` int(11) DEFAULT NULL
) ORGANIZATION INDEX DEFAULT CHARSET = utf8mb4 COMPRESSION = 'lz4_1.0' REPLICA_NUM = 1 BLOCK_SIZE = 16384 USE_BLOOM_FILTER = FALSE ENABLE_MACRO_BLOCK_BLOOM_FILTER = FALSE TABLET_SIZE = 134217728 PCTFREE = 10
