ob1=OBI(cluster=1:1:1,proxy_num=1,ct_num=1,locality=SZ:SZ:SZ,version=4_3_5_1);
ob2=OBI(cluster=1:1:1,share_proxy=ob1,ct_num=1,locality=SZ:SZ:SZ,version=4_3_5_1);
ob1.reboot;
ob2.reboot;
ob1.z1.obs0.sh cd $work_dir/; ls -l {etc,etc2,etc3}/observer.conf*.bin;
ob1.z2.obs0.sh cd $work_dir/; ls -l {etc,etc2,etc3}/observer.conf*.bin;
ob1.z3.obs0.sh cd $work_dir/; ls -l {etc,etc2,etc3}/observer.conf*.bin;
ob2.z1.obs0.sh cd $work_dir/; ls -l {etc,etc2,etc3}/observer.conf*.bin;
ob2.z2.obs0.sh cd $work_dir/; ls -l {etc,etc2,etc3}/observer.conf*.bin;
ob2.z3.obs0.sh cd $work_dir/; ls -l {etc,etc2,etc3}/observer.conf*.bin;
ob1.mysql alter tenant sys set primary_zone = "z1";
ob2.mysql alter tenant sys set primary_zone = "z1";
CREATE RESOURCE UNIT unit_primary  MEMORY_SIZE = '5G',MAX_CPU = 1, MIN_CPU = 1,LOG_DISK_SIZE = '6G',MAX_IOPS = 10000, MIN_IOPS = 10000, IOPS_WEIGHT=1;
ob1.check_until_timeout select count(*) FROM oceanbase.DBA_OB_UNIT_CONFIGS WHERE NAME = "$unit1name", 1, 120;
CREATE RESOURCE POOL pool_primary UNIT= unit_primary ,UNIT_NUM=1, ZONE_LIST=('z1','z2','z3');
ob1.check_until_timeout select count(*) FROM DBA_OB_RESOURCE_POOLS WHERE NAME = "$pool1name",1, 120;
CREATE TENANT IF NOT EXISTS tenant_primary PRIMARY_ZONE='z1',RESOURCE_POOL_LIST=('pool_primary') SET OB_TCP_INVITED_NODES='%';
ob1.check_until_timeout select count(*) FROM DBA_OB_TENANTS WHERE TENANT_NAME = "$tenant_primary",1,120;
ob1.check_until_timeout  select count(*) as num from ((SELECT LS_ID FROM oceanbase.CDB_OB_LS_HISTORY WHERE TENANT_ID = $mysql_tenant_id) EXCEPT (SELECT LS_ID FROM oceanbase.CDB_OB_LS WHERE TENANT_ID = $mysql_tenant_id)),0,5;
ob1.check_until_timeout  select count(LS_ID) as num FROM oceanbase.GV\$OB_LOG_STAT WHERE ROLE = 'LEADER' and  BEGIN_LSN=0 and TENANT_ID =$mysql_tenant_id,2,5;
create user user identified by 'userpw';
GRANT SELECT ON oceanbase.* TO 'user';
CREATE RESOURCE UNIT unit_primary MAX_CPU 1, MEMORY_SIZE = '5G';
CREATE RESOURCE POOL pool_primary UNIT = 'unit_primary', UNIT_NUM = 1, ZONE_LIST = ('z1','z2','z3');
ob1.mysql alter tenant $tenant_primary set variables autocommit='on';
ob2.mysql alter tenant $tenant_standby set variables autocommit='on';
ob1.mysql alter system set balancer_idle_time='10s';
ob1.mysql alter system set merger_check_interval='10s' tenant all;
ob1.mysql alter system set ob_compaction_schedule_interval='10s' tenant all;
ob2.mysql alter system set balancer_idle_time='10s';
ob2.mysql alter system set merger_check_interval='10s' tenant all;
ob2.mysql alter system set ob_compaction_schedule_interval='10s' tenant all;
ob1.mysql set global ob_sql_audit_percentage=80;
ob2.mysql set global ob_sql_audit_percentage=80;
alter proxyconfig set server_state_refresh_interval='1s';
alter proxyconfig set server_state_refresh_interval='1s';
create database int2bigint;
create sequence int2bigint.s_mix cache 1000000 noorder;
create sequence int2bigint.s_finish cache 1000000 noorder;
create sequence int2bigint.s_finish_end cache 1000000 noorder;
create table int2bigint.t_foreign_depend (i_f_d int primary key);
create table int2bigint.t_mix (i_p int primary key, i_i int, i_g_d int, i_g_i_d int, i_f int, i_u int unsigned, i_c int, c char(20), c_g_d char(20), d decimal(10,2), d_i decimal(10,2), i_g int GENERATED ALWAYS AS (i_g_d+1) stored, i_g_i int GENERATED ALWAYS AS (i_g_i_d+1) stored, c_g char(40) GENERATED ALWAYS AS (concat(c_g_d,c_g_d)) virtual, foreign key (i_f) references int2bigint.t_foreign_depend(i_f_d), check (i_c<10000));
create table int2bigint.t_finish (i_p int primary key, i_i int, i_g_d int, i_g_i_d int, i_f int, i_u int unsigned, i_c int, c char(20), c_g_d char(20), d decimal(10,2), d_i decimal(10,2), i_g int GENERATED ALWAYS AS (i_g_d+1) stored, i_g_i int GENERATED ALWAYS AS (i_g_i_d+1) stored, c_g char(40) GENERATED ALWAYS AS (concat(c_g_d,c_g_d)) virtual, foreign key (i_f) references int2bigint.t_foreign_depend(i_f_d), check (i_c<10000));
insert into int2bigint.t_foreign_depend values (1);
create index idx_t_mix_i_i on int2bigint.t_mix(i_i);
create index idx_t_mix_d_i on int2bigint.t_mix(d_i);
create index idx_t_mix_i_g_i on int2bigint.t_mix(i_g_i);
create index idx_t_finish_i_i on int2bigint.t_finish(i_i);
create index idx_t_finish_d_i on int2bigint.t_finish(d_i);
create index idx_t_finish_i_g_i on int2bigint.t_finish(i_g_i);
insert into int2bigint.t_mix(i_p, i_i, i_g_d, i_f, i_u, i_c, c, c_g_d, d, d_i, i_g_i_d)
values (int2bigint.s_mix.nextval, int2bigint.s_mix.nextval, 1, 1, 1, 1, 'feidu', 'feidu', 11.11, 11.11, 1),
(int2bigint.s_mix.nextval, int2bigint.s_mix.nextval, 2, 1, 2, 2, 'feidu', 'feidu', 11.11, 11.11, 1),
(int2bigint.s_mix.nextval, int2bigint.s_mix.nextval, 3, 1, 3, 3, 'feidu', 'feidu', 11.11, 11.11, 1),
(int2bigint.s_mix.nextval, int2bigint.s_mix.nextval, 4, 1, 4, 4, 'feidu', 'feidu', 11.11, 11.11, 1),
(int2bigint.s_mix.nextval, int2bigint.s_mix.nextval, 5, 1, 5, 5, 'feidu', 'feidu', 11.11, 11.11, 1),
(int2bigint.s_mix.nextval, int2bigint.s_mix.nextval, 6, 1, 6, 6, 'feidu', 'feidu', 11.11, 11.11, 1),
(int2bigint.s_mix.nextval, int2bigint.s_mix.nextval, 7, 1, 7, 7, 'feidu', 'feidu', 11.11, 11.11, 1),
(int2bigint.s_mix.nextval, int2bigint.s_mix.nextval, 8, 1, 8, 8, 'feidu', 'feidu', 11.11, 11.11, 1),
(int2bigint.s_mix.nextval, int2bigint.s_mix.nextval, 9, 1, 9, 9, 'feidu', 'feidu', 11.11, 11.11, 1),
(int2bigint.s_mix.nextval, int2bigint.s_mix.nextval, 10, 1, 10, 10, 'feidu', 'feidu', 11.11, 11.11, 1);
insert into int2bigint.t_finish(i_p, i_i, i_g_d, i_f, i_u, i_c, c, c_g_d, d, d_i, i_g_i_d)
values (int2bigint.s_finish.nextval, int2bigint.s_finish.nextval, 1, 1, 1, 1, 'feidu', 'feidu', 11.11, 11.11, 1),
(int2bigint.s_finish.nextval, int2bigint.s_finish.nextval, 2, 1, 2, 2, 'feidu', 'feidu', 11.11, 11.11, 1),
(int2bigint.s_finish.nextval, int2bigint.s_finish.nextval, 3, 1, 3, 3, 'feidu', 'feidu', 11.11, 11.11, 1),
(int2bigint.s_finish.nextval, int2bigint.s_finish.nextval, 4, 1, 4, 4, 'feidu', 'feidu', 11.11, 11.11, 1),
(int2bigint.s_finish.nextval, int2bigint.s_finish.nextval, 5, 1, 5, 5, 'feidu', 'feidu', 11.11, 11.11, 1),
(int2bigint.s_finish.nextval, int2bigint.s_finish.nextval, 6, 1, 6, 6, 'feidu', 'feidu', 11.11, 11.11, 1),
(int2bigint.s_finish.nextval, int2bigint.s_finish.nextval, 7, 1, 7, 7, 'feidu', 'feidu', 11.11, 11.11, 1),
(int2bigint.s_finish.nextval, int2bigint.s_finish.nextval, 8, 1, 8, 8, 'feidu', 'feidu', 11.11, 11.11, 1),
(int2bigint.s_finish.nextval, int2bigint.s_finish.nextval, 9, 1, 9, 9, 'feidu', 'feidu', 11.11, 11.11, 1),
(int2bigint.s_finish.nextval, int2bigint.s_finish.nextval, 10, 1, 10, 10, 'feidu', 'feidu', 11.11, 11.11, 1);
use test;
create table t(c1 int, c2 int);
create table t_part(c1 int, c2 int) partition by hash(c1) partitions 8;
insert into t values(1, 1), (2, 2), (3, 3), (4, 4), (5, 5), (6, 6), (7, 7), (8, 8), (9, 9), (10, 10);
insert into t_part values(1, 1);
insert into t_part values(2, 2);
insert into t_part values(3, 3);
insert into t_part values(4, 4);
insert into t_part values(5, 5);
insert into t_part values(6, 6);
insert into t_part values(7, 7);
insert into t_part values(8, 8);
insert into t_part values(9, 9);
insert into t_part values(10, 10);
commit;
create database test1;
use test1;
create table t_cg_0(c1 int, c2 int unique, c3 text);
create table t_cg_1(c1 int, c2 int unique, c3 text);
create table t_cg_2(c1 int, c2 int unique, c3 text);
create table t_cg_3(c1 int, c2 int unique, c3 text);
create index idx0 on t_cg_0(c1);
create index idx1 on t_cg_1(c1);
create index idx2 on t_cg_2(c1);
create index idx3 on t_cg_3(c1);
create database db1;
create tablegroup tg;
create table db1.tb_normal (pk int primary key,c1 varchar(1024) default '0', c2 timestamp(6) default now(6), c3 timestamp default now(), index i1(c2), index i2(c1)) tablegroup tg;
create table db1.tb_increment (pk int primary key auto_increment,c1 int, c2 datetime(6) DEFAULT CURRENT_TIMESTAMP(6) ON UPDATE CURRENT_TIMESTAMP(6), index i1(c2)) tablegroup tg;
create table db1.tb_bigtable (c1 varchar(65536),c2 varchar(65536),c3 varchar(65536),c4 varchar(65536), pk bigint primary key auto_increment) COMPRESSION = 'none' tablegroup tg;
create table db1.global_t6(a int, b int, c int, primary key(a)) partition by hash(a) partitions 2;
create index gkey on db1.global_t6(b) global;
insert into db1.global_t6 values(1, 5, 1), (2, 4, 2), (3, 3, 3), (4, 2, 4), (5, 1, 5);
create table db1.global_t7(a int, b int, c int, primary key(a));
insert into db1.global_t7 values(1, 5, 1), (2, 4, 2), (3, 3, 3), (4, 2, 4), (5, 1, 5);
create table test.tb_table_gencol(pk1 bigint, pk2 varchar(2048),c1 varchar(65536), c2 varchar(65536),ac1 bigint auto_increment,
ts timestamp(6) DEFAULT CURRENT_TIMESTAMP(6) ON UPDATE CURRENT_TIMESTAMP(6),  gmt_create timestamp(6) default now(6), gmt_modified timestamp(6) default now(6),
gen_c1 varchar(10) GENERATED ALWAYS AS (substr(c1,1,10)) virtual,
gen_c2 varchar(10) GENERATED ALWAYS AS (substr(c2,1,10)) stored,
primary key(pk1, pk2),index i1(ts));
create table test.tablegencol(c1 bigint primary key,user_id varchar(32) NOT NULL default '' comment 'Alipay User ID', address varchar(256) NOT NULL default '' comment 'address', index(user_id,address(255)));
create table test.table_hash(c1 int primary key, c2 int) partition by hash(c1) partitions 2;
create table test.table_range(c1 int primary key, c2 int) partition by range(c1) (partition p0 values less than (100), partition p1 values less than (200), partition p2 values less than MAXVALUE);
create table test.table_hash_range (c1 int primary key, c2 int) partition by hash(c1) subpartition by range(c1) subpartition template(SUBPARTITION c0 VALUES LESS THAN(1990), SUBPARTITION c1 VALUES LESS THAN (2000), SUBPARTITION c2 VALUES LESS THAN MAXVALUE) partitions 2;
create table test.table_range_hash (c1 int primary key, c2 int) partition by range(c1) subpartition by hash(c1) subpartitions 2 (PARTITION c0 VALUES LESS THAN (1980), PARTITION c1 VALUES LESS THAN (1990), PARTITION c2 VALUES LESS THAN (1995), PARTITION c3 VALUES LESS THAN (2000), PARTITION c4 VALUES LESS THAN MAXVALUE);
create tablegroup tg_old;
create table test.table_with_tg(c1 int primary key, c2 int) tablegroup tg_old;
create table test.t_parent(c1 int, c2 int, constraint t_parent_pk primary key(c1, c2));
create table test.t_child(c1 int, c2 int, constraint t_child_fk foreign key(c2, c1) references test.t_parent(c1, c2));
create table test.t_check_1(c1 int, c2 int, constraint cst1 check(c1 = c2));
create table test.t_check_2(c1 int, c2 int, constraint cst2 check(c2 = c1));
create table test.local_var(c1 timestamp, c2_local_var date as (c1), index i1 (c2_local_var));
insert into test.local_var(c1) values('2011-01-01 00:00:00');
set @@session.ob_query_timeout = 60000000;
alter system major freeze tenant=all;
set autocommit=0;
insert into db1.tb_normal(pk,c1) values(101,'101'),(102,'102'),(103,'103'),(104,'104');
update db1.tb_normal set c1=concat(c1,'_x') where pk > 100;
delete from db1.tb_normal where pk=104;
commit;
use db1;
ob2.force_stop;
ob2.start;
ob2.check_until_timeout select count(*) from oceanbase.__all_server where (start_service_time is null  or status='INACTIVE'),0,300;
ob2.check_until_timeout select count(*) from oceanbase.__all_server a left join oceanbase.__all_virtual_server_schema_info b on a.svr_ip = b.svr_ip and a.svr_port = b.svr_port where b.svr_ip is null, 0, 120;
ob2.check_until_timeout select count(*) as cnt from oceanbase.__all_virtual_server_schema_info as a join oceanbase.__all_virtual_server_schema_info as b on a.tenant_id = b.tenant_id  where a.refreshed_schema_version != b.refreshed_schema_version or a.refreshed_schema_version % 8 != 0, 0, 180;
ob2.check_until_timeout  select count(1) as unsync_cnt from GV\$OB_LOG_STAT where in_sync = 'NO',0,600;
ob2.check_until_timeout select count(*) as cnt from oceanbase.__all_virtual_server_schema_info as a join oceanbase.__all_virtual_server_schema_info as b on a.tenant_id = b.tenant_id  where a.refreshed_schema_version != b.refreshed_schema_version, 0, 60;
ob2.upgrade_check_before;
ob2.upgrade_commond_for_server pre;
set @@session.ob_query_timeout = 60000000;
ob2.upgrade_health_checker;
ob2.mysql alter system stop zone "z3";
ob2.check_until_timeout select status from DBA_OB_ZONES where zone='z3',INACTIVE,20;
ob2.check_until_timeout select count(1) as leader_count  from CDB_OB_LS_LOCATIONS where zone='z3' and role='leader',0,20;
ob2.z3.force_stop;
ob2.check_until_timeout select count(*) from oceanbase.DBA_OB_SERVERS where zone = 'z3' and (start_service_time is null and status='INACTIVE'),1,60;
ob2.z3.upgrade;
ob2.z3.start;
ob2.check_until_timeout select count(*) from oceanbase.__all_server where zone = 'z3' and (start_service_time is null  or status='INACTIVE'),0,300;
ob1.check_until_timeout  select count(1) as unsync_cnt from GV\$OB_LOG_STAT where in_sync = 'NO',0,600;
ob2.check_until_timeout select count(*) from oceanbase.__all_server a left join oceanbase.__all_virtual_server_schema_info b on a.svr_ip = b.svr_ip and a.svr_port = b.svr_port where b.svr_ip is null, 0, 120;
ob2.check_until_timeout select count(*) as cnt from oceanbase.__all_virtual_server_schema_info as a join oceanbase.__all_virtual_server_schema_info as b on a.tenant_id = b.tenant_id  where a.refreshed_schema_version != b.refreshed_schema_version or a.refreshed_schema_version % 8 != 0, 0, 180;
ob2.upgrade_health_checker z3;
ob2.mysql alter system start zone "z3";
ob2.check_until_timeout select count(*) from __all_server where zone="z3" and build_version not like "$dest_version%",0,120;
set autocommit=0;
insert into db1.tb_normal(pk,c1) values(105,'105'),(106,'106'),(107,'107'),(108,'108');
update db1.tb_normal set c1=concat(c1,'_x') where pk > 100;
delete from db1.tb_normal where pk=104;
update db1.tb_increment set pk=pk+1 order by pk desc limit 1;
insert into db1.tb_increment(pk,c1) values (201,201),(202,202);
replace into db1.tb_increment(pk,c1) values (201,202);
delete from db1.tb_increment where pk=202;
commit;
set autocommit=1;
use db1;
ob2.mysql alter system stop zone "z2";
ob2.check_until_timeout select status from DBA_OB_ZONES where zone='z2',INACTIVE,20;
ob2.check_until_timeout select count(1) as leader_count  from CDB_OB_LS_LOCATIONS where zone='z2' and role='leader',0,20;
ob2.z2.force_stop;
ob2.check_until_timeout select count(*) from oceanbase.DBA_OB_SERVERS where zone = 'z2' and (start_service_time is null and status='INACTIVE'),1,60;
ob2.z2.upgrade;
ob2.z2.start;
ob2.check_until_timeout select count(*) from oceanbase.__all_server where zone = 'z3' and (start_service_time is null  or status='INACTIVE'),0,300;
ob2.check_until_timeout  select count(1) as unsync_cnt from GV\$OB_LOG_STAT where in_sync = 'NO',0,600;
ob2.check_until_timeout select count(*) from oceanbase.__all_server a left join oceanbase.__all_virtual_server_schema_info b on a.svr_ip = b.svr_ip and a.svr_port = b.svr_port where b.svr_ip is null, 0, 120;
ob2.check_until_timeout select count(*) as cnt from oceanbase.__all_virtual_server_schema_info as a join oceanbase.__all_virtual_server_schema_info as b on a.tenant_id = b.tenant_id  where a.refreshed_schema_version != b.refreshed_schema_version or a.refreshed_schema_version % 8 != 0, 0, 180;
ob2.upgrade_health_checker z2;
ob2.mysql alter system start zone "z2";
ob2.check_until_timeout select count(*) from __all_server where zone="z2" and build_version not like "$dest_version%",0,120;
set autocommit=0;
insert into db1.tb_normal(pk,c1) values(109,'109'),(110,'110'),(111,'111'),(112,'112');
update db1.tb_normal set c1=concat(c1,'_x') where pk > 100;
delete from db1.tb_normal where pk=109;
update db1.tb_increment set pk=pk+1 order by pk desc limit 1;
insert into db1.tb_increment(pk,c1) values (204,204),(205,205);
replace into db1.tb_increment(pk,c1) values (205,203);
delete from db1.tb_increment where pk=204;
commit;
set autocommit=1;
use db1;
ob2.mysql alter system stop zone "z1";
ob2.check_until_timeout select status from DBA_OB_ZONES where zone='z1',INACTIVE,20;
ob2.check_until_timeout select count(1) as leader_count  from CDB_OB_LS_LOCATIONS where zone='z1' and role='leader',0,20;
ob2.z1.force_stop;
ob2.check_until_timeout select count(*) from oceanbase.DBA_OB_SERVERS where zone = 'z1' and (start_service_time is null and status='INACTIVE'),1,60;
ob2.z1.upgrade;
ob2.z1.start;
ob2.check_until_timeout select count(*) from oceanbase.__all_server where zone = 'z1' and (start_service_time is null  or status='INACTIVE'),0,300;
ob2.check_until_timeout  select count(1) as unsync_cnt from GV\$OB_LOG_STAT where in_sync = 'NO',0,600;
ob2.check_until_timeout select count(*) from oceanbase.__all_server a left join oceanbase.__all_virtual_server_schema_info b on a.svr_ip = b.svr_ip and a.svr_port = b.svr_port where b.svr_ip is null, 0, 120;
ob2.check_until_timeout select count(*) as cnt from oceanbase.__all_virtual_server_schema_info as a join oceanbase.__all_virtual_server_schema_info as b on a.tenant_id = b.tenant_id  where a.refreshed_schema_version != b.refreshed_schema_version or a.refreshed_schema_version % 8 != 0, 0, 180;
ob2.upgrade_health_checker z1;
ob2.mysql alter system start zone "z1";
ob2.check_until_timeout select count(*) from __all_server where zone="z1" and build_version not like "$dest_version%",0,120;
ob2.mysql alter tenant sys set primary_zone = "z1";
ob2.upgrade_health_checker;
ob2.upgrade_commond_for_server post;
ob2.check_until_timeout select count(*) from __all_virtual_tenant_parameter_stat where name = 'compatible' and tenant_id=$standby_tenant_id and value!="$source_version",0,5;
ob1.check_until_timeout select count(*) from __all_virtual_tenant_parameter_stat where name = 'compatible' and value!="$source_version",0,5;
ALTER SYSTEM SET query_response_time_stats=true;
ob2.check_until_timeout SELECT count(*) FROM oceanbase.GV\$OB_PARAMETERS WHERE NAME LIKE "query_response_time_stats" and value!="true" and tenant_id=1,0,5;
ob2.check_until_timeout select count(*) from __all_virtual_tenant_parameter_stat where name = 'compatible' and tenant_id=$standby_tenant_id and value!="$source_version",0,2;
ob1.check_until_timeout select count(*) from __all_virtual_tenant_parameter_stat where name = 'compatible' and value!="$source_version",0,2;
ALTER SYSTEM SET query_response_time_stats=false;
ob2.check_until_timeout SELECT count(*) FROM oceanbase.GV\$OB_PARAMETERS WHERE NAME LIKE "query_response_time_stats" and value!="false"and tenant_id=1,0,5;
ob2.check_until_timeout select count(*) from __all_virtual_tenant_parameter_stat where name = 'compatible' and tenant_id=$standby_tenant_id and value!="$source_version",0,2;
ob1.check_until_timeout select count(*) from __all_virtual_tenant_parameter_stat where name = 'compatible' and value!="$source_version",0,2;
use test;
insert into t values(11, 11), (12,12), (13, 13), (14, 14), (15, 15), (16, 16), (17, 17), (18, 18), (19, 19), (20, 20);
insert into t_part values(11, 11);
insert into t_part values(12, 12);
insert into t_part values(13, 13);
insert into t_part values(14, 14);
insert into t_part values(15, 15);
insert into t_part values(16, 16);
insert into t_part values(17, 17);
insert into t_part values(18, 18);
insert into t_part values(19, 19);
insert into t_part values(20, 20);
use test;
select * from t where c1=13;
c1	c2
13	13
select * from t_part where c1=15;
c1	c2
15	15
ob1.mysql ALTER SYSTEM SWITCHOVER TO STANDBY TENANT $tenant_primary;
ob2.mysql ALTER SYSTEM SWITCHOVER TO PRIMARY TENANT $tenant_standby;
ob2.check_until_timeout select count(*) from __all_virtual_tenant_parameter_stat where name = 'compatible' and tenant_id=$standby_tenant_id and value!="$source_version",0,2;
ob1.check_until_timeout select count(*) from __all_virtual_tenant_parameter_stat where name = 'compatible' and value!="$source_version",0,2;
create user standbyuser identified by 'standby_userpw';
GRANT SELECT ON oceanbase.* TO standbyuser;
ob1.check_until_timeout SELECT SWITCHOVER_STATUS FROM DBA_OB_TENANTS WHERE TENANT_NAME= '$tenant_primary' and TENANT_ROLE="STANDBY",NORMAL,120;
ob1.check_until_timeout SELECT count(*)  FROM oceanbase.DBA_OB_TENANTS where TENANT_NAME= '$tenant_primary' and RECOVERY_UNTIL_SCN=4611686018427387903,1,120;
use test;
insert into t values(21, 21), (22,12), (23, 23), (24, 24), (25, 25), (26, 26), (27, 27), (28, 28), (29, 29), (30, 30);
insert into t_part values(21, 21);
insert into t_part values(22, 22);
insert into t_part values(23, 23);
insert into t_part values(24, 24);
insert into t_part values(25, 25);
insert into t_part values(26, 26);
insert into t_part values(27, 27);
insert into t_part values(28, 28);
insert into t_part values(29, 29);
insert into t_part values(30, 30);
use test;
select * from t where c1=23;
c1	c2
23	23
select * from t_part where c1=25;
c1	c2
25	25
ob2.mysql ALTER SYSTEM SWITCHOVER TO STANDBY TENANT $tenant_standby;
ob1.mysql ALTER SYSTEM SWITCHOVER TO PRIMARY TENANT $tenant_primary;
ob2.check_until_timeout select count(*) from __all_virtual_tenant_parameter_stat where name = 'compatible' and tenant_id=$standby_tenant_id and value!="$source_version",0,2;
ob1.check_until_timeout select count(*) from __all_virtual_tenant_parameter_stat where name = 'compatible' and value!="$source_version",0,2;
ob2.check_until_timeout SELECT SWITCHOVER_STATUS FROM DBA_OB_TENANTS WHERE TENANT_NAME= '$tenant_standby' and TENANT_ROLE="STANDBY",NORMAL,120;
ob2.check_until_timeout SELECT count(*)  FROM oceanbase.DBA_OB_TENANTS where TENANT_NAME= '$tenant_standby' and RECOVERY_UNTIL_SCN=4611686018427387903,1,120;
ob1.check_until_timeout select count(*) as cnt from oceanbase.__all_virtual_server_schema_info as a join oceanbase.__all_virtual_server_schema_info as b on a.tenant_id = b.tenant_id  where a.refreshed_schema_version != b.refreshed_schema_version, 0, 60;
ob1.upgrade_check_before;
ob1.upgrade_commond_for_server pre;
set @@session.ob_query_timeout = 60000000;
alter system stop zone 'z2';
ob1.check_until_timeout select status from DBA_OB_ZONES where zone='z2',INACTIVE,20;
ob1.check_until_timeout select count(1) as leader_count  from CDB_OB_LS_LOCATIONS where zone='z2' and role='leader',0,20;
ob1.z2.force_stop;
ob1.check_until_timeout select count(*) from oceanbase.DBA_OB_SERVERS where zone = 'z2' and (start_service_time is null and status='INACTIVE'),1,60;
ob1.z2.upgrade;
ob1.z2.nstart;
ob1.check_until_timeout select count(*) from oceanbase.__all_server where zone = 'z2' and (start_service_time is null  or status='INACTIVE'),0,300;
ob1.check_until_timeout  select count(1) as unsync_cnt from GV\$OB_LOG_STAT where in_sync = 'NO',0,600;
ob1.check_until_timeout select count(*) from oceanbase.__all_server a left join oceanbase.__all_virtual_server_schema_info b on a.svr_ip = b.svr_ip and a.svr_port = b.svr_port where b.svr_ip is null, 0, 120;
ob1.check_until_timeout select count(*) as cnt from oceanbase.__all_virtual_server_schema_info as a join oceanbase.__all_virtual_server_schema_info as b on a.tenant_id = b.tenant_id  where a.refreshed_schema_version != b.refreshed_schema_version or a.refreshed_schema_version % 8 != 0, 0, 180;
ob1.mysql alter system start zone 'z2';
use test;
select /*+ */ * from t, t_part where t.c1 = t_part.c1;
c1	c2	c1	c2
1	1	1	1
10	10	10	10
11	11	11	11
12	12	12	12
13	13	13	13
14	14	14	14
15	15	15	15
16	16	16	16
17	17	17	17
18	18	18	18
19	19	19	19
2	2	2	2
20	20	20	20
21	21	21	21
22	12	22	22
23	23	23	23
24	24	24	24
25	25	25	25
26	26	26	26
27	27	27	27
28	28	28	28
29	29	29	29
3	3	3	3
30	30	30	30
4	4	4	4
5	5	5	5
6	6	6	6
7	7	7	7
8	8	8	8
9	9	9	9
use test;
select /*+ parallel(4)*/ * from t, t_part where t.c1 = t_part.c1;
c1	c2	c1	c2
1	1	1	1
10	10	10	10
11	11	11	11
12	12	12	12
13	13	13	13
14	14	14	14
15	15	15	15
16	16	16	16
17	17	17	17
18	18	18	18
19	19	19	19
2	2	2	2
20	20	20	20
21	21	21	21
22	12	22	22
23	23	23	23
24	24	24	24
25	25	25	25
26	26	26	26
27	27	27	27
28	28	28	28
29	29	29	29
3	3	3	3
30	30	30	30
4	4	4	4
5	5	5	5
6	6	6	6
7	7	7	7
8	8	8	8
9	9	9	9
use test;
select /*+ */ * from t, t_part where t.c1 = t_part.c1;
c1	c2	c1	c2
1	1	1	1
10	10	10	10
11	11	11	11
12	12	12	12
13	13	13	13
14	14	14	14
15	15	15	15
16	16	16	16
17	17	17	17
18	18	18	18
19	19	19	19
2	2	2	2
20	20	20	20
21	21	21	21
22	12	22	22
23	23	23	23
24	24	24	24
25	25	25	25
26	26	26	26
27	27	27	27
28	28	28	28
29	29	29	29
3	3	3	3
30	30	30	30
4	4	4	4
5	5	5	5
6	6	6	6
7	7	7	7
8	8	8	8
9	9	9	9
ob1.mysql alter system stop server '$server1_ip:$server1_port';
ob1.check_until_timeout select count(*) from CDB_OB_LS_LOCATIONS where zone != 'z1' and role='leader' and tenant_id = (select tenant_id from __all_tenant where tenant_name='sys'),0,60;
set autocommit=0;
insert into db1.tb_normal(pk,c1) values(301,'301'),(302,'302'),(303,'303'),(304,'304');
update db1.tb_normal set c1=concat(c1,'_x') where pk > 100;
delete from db1.tb_normal where pk=304;
update db1.tb_increment set pk=pk+1 order by pk desc limit 1;
insert into db1.tb_increment(pk,c1) values (301,301),(302,302);
replace into db1.tb_increment(pk,c1) values (301,302);
delete from db1.tb_increment where pk=302;
commit;
set autocommit=1;
select pk,c1 from db1.tb_normal order by pk;
pk	c1
1	0
2	0
3	0
4	0
5	0
6	0
7	0
8	0
9	0
10	0
11	0
12	0
13	0
14	0
15	0
16	0
17	0
18	0
19	0
20	0
21	0
22	0
23	0
24	0
25	0
26	0
27	0
28	0
29	0
30	0
31	0
32	0
33	0
34	0
35	0
36	0
37	0
38	0
39	0
40	0
41	0
42	0
43	0
44	0
45	0
46	0
47	0
48	0
49	0
50	0
51	0
52	0
53	0
54	0
55	0
56	0
57	0
58	0
59	0
60	0
61	0
62	0
63	0
64	0
65	0
66	0
67	0
68	0
69	0
70	0
71	0
72	0
73	0
74	0
75	0
76	0
77	0
78	0
79	0
80	0
81	0
82	0
83	0
84	0
85	0
86	0
87	0
88	0
89	0
90	0
91	0
92	0
93	0
94	0
95	0
96	0
97	0
98	0
99	0
100	0
101	101_x_x_x_x
102	102_x_x_x_x
103	103_x_x_x_x
105	105_x_x_x
106	106_x_x_x
107	107_x_x_x
108	108_x_x_x
110	110_x_x
111	111_x_x
112	112_x_x
301	301_x
302	302_x
303	303_x
select pk,c1 from db1.tb_increment order by pk limit 1;
pk	c1
1	1
select a.pk,a.c1,b.c1 from db1.tb_normal a join db1.tb_increment b where a.pk=b.pk order by a.pk limit 2;
pk	c1	c1
1	0	1
2	0	2
show tables like 'tb_normal';
Tables_in_test (tb_normal)
show create table db1.tb_increment;
Table	Create Table
tb_increment	CREATE TABLE `tb_increment` (
  `pk` int(11) NOT NULL AUTO_INCREMENT,
  `c1` int(11) DEFAULT NULL,
  `c2` datetime(6) DEFAULT CURRENT_TIMESTAMP(6) ON UPDATE CURRENT_TIMESTAMP(6),
  PRIMARY KEY (`pk`),
  KEY `i1` (`c2`) BLOCK_SIZE 16384 LOCAL
) ORGANIZATION INDEX AUTO_INCREMENT = 303 AUTO_INCREMENT_MODE = 'ORDER' DEFAULT CHARSET = utf8mb4 ROW_FORMAT = DYNAMIC COMPRESSION = 'zstd_1.3.8' REPLICA_NUM = 3 BLOCK_SIZE = 16384 USE_BLOOM_FILTER = FALSE ENABLE_MACRO_BLOCK_BLOOM_FILTER = FALSE TABLET_SIZE = 134217728 PCTFREE = 0 TABLEGROUP = 'tg'
use db1;
select /*+index(global_t6 primary)*/ * from global_t6;
a	b	c
2	4	2
4	2	4
1	5	1
3	3	3
5	1	5
insert into global_t6 values(10, 100, 10);
update global_t6 set b=7 where a=1;
select /*+index(global_t6 gkey)*/ a, b from global_t6;
a	b
5	1
4	2
3	3
2	4
1	7
10	100
update global_t6 set a=100 where b=2;
update global_t6 set b=19 where b=1;
select /*+index(global_t6 gkey)*/ a, b from global_t6;
a	b
100	2
3	3
2	4
1	7
5	19
10	100
update global_t6 set c=100 where b>=10;
select /*+index(global_t6 gkey)*/ a, b from global_t6;
a	b
100	2
3	3
2	4
1	7
5	19
10	100
delete from global_t6 where a=1;
select /*+index(global_t6 gkey)*/ a, b from global_t6;
a	b
100	2
3	3
2	4
5	19
10	100
delete from global_t6 where a=2 or a=3;
select /*+index(global_t6 gkey)*/ a, b from global_t6;
a	b
100	2
5	19
10	100
delete from global_t6 where b>=100;
select /*+index(global_t6 gkey)*/ a, b from global_t6;
a	b
100	2
5	19
delete from global_t6;
select /*+index(global_t6 primary)*/ * from global_t6;
a	b	c
insert into global_t6 values(1, 1, 1), (5, 6, 2), (4, 2, 1);
select /*+index(global_t6 primary)*/ * from global_t6;
a	b	c
4	2	1
1	1	1
5	6	2
delete from global_t6 where b < 7 and b >1;
select /*+index(global_t6 gkey)*/ a, b from global_t6;
a	b
1	1
select /*+index(global_t6 primary)*/ a, b, c from global_t6;
a	b	c
1	1	1
insert into global_t6 values(2, 2, 2), (3, 3, 3), (4, 4, 4) on duplicate key update b=b+1;
select /*+index(global_t6 gkey)*/ a, b from global_t6;
a	b
1	1
2	2
3	3
4	4
select /*+index(global_t6 primary)*/ a, b, c from global_t6;
a	b	c
2	2	2
4	4	4
1	1	1
3	3	3
insert into global_t6 values(2, 2, 2), (3, 3, 3), (4, 4, 4) on duplicate key update b=b+1;
select /*+index(global_t6 gkey)*/ a, b from global_t6;
a	b
1	1
2	3
3	4
4	5
select /*+index(global_t6 primary)*/ a, b, c from global_t6;
a	b	c
2	3	2
4	5	4
1	1	1
3	4	3
replace into global_t6 values(2, 2, 2), (3, 3, 3), (4, 4, 4);
select /*+index(global_t6 gkey)*/ a, b from global_t6;
a	b
1	1
2	2
3	3
4	4
select /*+index(global_t6 primary)*/ a, b, c from global_t6;
a	b	c
2	2	2
4	4	4
1	1	1
3	3	3
use db1;
select /*+index(global_t6 primary)*/ a, b, c from global_t6;
a	b	c
2	2	2
4	4	4
1	1	1
3	3	3
ob1.mysql alter system minor freeze tenant = all;
set autocommit=0;
insert into db1.tb_normal(pk,c1) values(601,'601'),(602,'602'),(603,'603'),(604,'604');
update db1.tb_normal set c1=concat(c1,'_x') where pk > 100;
delete from db1.tb_normal where pk=604;
update db1.tb_increment set pk=pk+1 order by pk desc limit 1;
insert into db1.tb_increment(pk,c1) values (601,601),(602,602);
replace into db1.tb_increment(pk,c1) values (601,602);
delete from db1.tb_increment where pk=602;
commit;
set autocommit=1;
ob1.mysql alter system start server '$server1_ip:$server1_port';
ob1.check_until_timeout select count(*) as cnt from oceanbase.__all_virtual_server_schema_info as a join oceanbase.__all_virtual_server_schema_info as b on a.tenant_id = b.tenant_id  where a.refreshed_schema_version != b.refreshed_schema_version, 0, 60;
ob1.mysql alter system set server_permanent_offline_time = '20s';
ob1.z2.obs0.force_stop;
ob1.check_until_timeout select count(*) from __all_server where status = 'INACTIVE' and svr_ip = '$z2_ip0'and svr_port = $z2_port0, 1, 120;
ob1.check_until_timeout select count(*) from oceanbase.__all_virtual_ls_meta_table where role = 1 and member_list like '%$z2_ip0:$z2_port0%', 0, 120;
ob1.mysql alter system set server_permanent_offline_time = '3600s';
ob1.z2.obs0.nstart;
ob1.check_until_timeout select count(*) from oceanbase.__all_server where zone = 'z2' and (start_service_time <= 0 or status='INACTIVE'),0,120;
ob1.check_until_timeout select count(*) > 0 from oceanbase.__all_rootservice_event_history where event like '%finish_add%' and value6 like '%ret:0%',1,120;
ob1.check_until_timeout select count(*) from oceanbase.__all_virtual_ls_replica_task,0,120;
ob1.check_until_timeout select count(*) from oceanbase.__all_virtual_ls_meta_table where role = 1 and member_list not like '%$z2_ip0:$z2_port0%', 0, 120;
ob1.check_until_timeout  select count(1) as unsync_cnt from GV\$OB_LOG_STAT where in_sync = 'NO',0,600;
set @@session.ob_query_timeout = 60000000;
alter system stop zone 'z1';
ob1.check_until_timeout select status from DBA_OB_ZONES where zone='z1',INACTIVE,20;
ob1.check_until_timeout select count(1) as leader_count  from CDB_OB_LS_LOCATIONS where zone='z1' and role='leader',0,20;
ob1.z1.force_stop;
ob1.check_until_timeout select count(*) from oceanbase.DBA_OB_SERVERS where zone = 'z1' and (start_service_time is null and status='INACTIVE'),1,60;
ob1.z1.upgrade;
ob1.z1.nstart;
ob1.check_until_timeout select count(*) from oceanbase.__all_server where zone = 'z1' and (start_service_time is null or status='INACTIVE'),0,300;
ob1.check_until_timeout  select count(1) as unsync_cnt from GV\$OB_LOG_STAT where in_sync = 'NO',0,600;
ob1.check_until_timeout select count(*) from oceanbase.__all_server a left join oceanbase.__all_virtual_server_schema_info b on a.svr_ip = b.svr_ip and a.svr_port = b.svr_port where b.svr_ip is null, 0, 120;
ob1.check_until_timeout select count(*) as cnt from oceanbase.__all_virtual_server_schema_info as a join oceanbase.__all_virtual_server_schema_info as b on a.tenant_id = b.tenant_id  where a.refreshed_schema_version != b.refreshed_schema_version or a.refreshed_schema_version % 8 != 0, 0, 180;
ob1.mysql alter system start zone 'z1';
ob1.check_until_timeout select count(*) from CDB_OB_LS_LOCATIONS where zone != 'z1' and role='leader' and tenant_id = (select tenant_id from __all_tenant where tenant_name='sys'),0,60;
set autocommit=0;
set @@session.ob_query_timeout = 120000000;
insert into db1.tb_normal(pk,c1) values(401,'401'),(402,'402'),(403,'403'),(404,'404');
update db1.tb_normal set c1=concat(c1,'_x') where pk > 100;
delete from db1.tb_normal where pk=404;
update db1.tb_increment set pk=pk+1 order by pk desc limit 1;
insert into db1.tb_increment(pk,c1) values (401,401),(402,402);
replace into db1.tb_increment(pk,c1) values (401,402);
delete from db1.tb_increment where pk=402;
commit;
set autocommit=1;
select pk,c1 from db1.tb_normal order by pk;
pk	c1
1	0
2	0
3	0
4	0
5	0
6	0
7	0
8	0
9	0
10	0
11	0
12	0
13	0
14	0
15	0
16	0
17	0
18	0
19	0
20	0
21	0
22	0
23	0
24	0
25	0
26	0
27	0
28	0
29	0
30	0
31	0
32	0
33	0
34	0
35	0
36	0
37	0
38	0
39	0
40	0
41	0
42	0
43	0
44	0
45	0
46	0
47	0
48	0
49	0
50	0
51	0
52	0
53	0
54	0
55	0
56	0
57	0
58	0
59	0
60	0
61	0
62	0
63	0
64	0
65	0
66	0
67	0
68	0
69	0
70	0
71	0
72	0
73	0
74	0
75	0
76	0
77	0
78	0
79	0
80	0
81	0
82	0
83	0
84	0
85	0
86	0
87	0
88	0
89	0
90	0
91	0
92	0
93	0
94	0
95	0
96	0
97	0
98	0
99	0
100	0
101	101_x_x_x_x_x_x
102	102_x_x_x_x_x_x
103	103_x_x_x_x_x_x
105	105_x_x_x_x_x
106	106_x_x_x_x_x
107	107_x_x_x_x_x
108	108_x_x_x_x_x
110	110_x_x_x_x
111	111_x_x_x_x
112	112_x_x_x_x
301	301_x_x_x
302	302_x_x_x
303	303_x_x_x
401	401_x
402	402_x
403	403_x
601	601_x_x
602	602_x_x
603	603_x_x
select pk,c1 from db1.tb_increment order by pk limit 1;
pk	c1
1	1
select a.pk,a.c1,b.c1 from db1.tb_normal a join db1.tb_increment b where a.pk=b.pk order by a.pk limit 2;
pk	c1	c1
1	0	1
2	0	2
show tables like 'tb_normal';
Tables_in_db1 (tb_normal)
tb_normal
show create table db1.tb_increment;
Table	Create Table
tb_increment	CREATE TABLE `tb_increment` (
  `pk` int(11) NOT NULL AUTO_INCREMENT,
  `c1` int(11) DEFAULT NULL,
  `c2` datetime(6) DEFAULT CURRENT_TIMESTAMP(6) ON UPDATE CURRENT_TIMESTAMP(6),
  PRIMARY KEY (`pk`),
  KEY `i1` (`c2`) BLOCK_SIZE 16384 LOCAL
) ORGANIZATION INDEX AUTO_INCREMENT = 603 AUTO_INCREMENT_MODE = 'ORDER' DEFAULT CHARSET = utf8mb4 ROW_FORMAT = DYNAMIC COMPRESSION = 'zstd_1.3.8' REPLICA_NUM = 3 BLOCK_SIZE = 16384 USE_BLOOM_FILTER = FALSE ENABLE_MACRO_BLOCK_BLOOM_FILTER = FALSE TABLET_SIZE = 134217728 PCTFREE = 0 TABLEGROUP = 'tg'
select /*+index(global_t6 primary)*/ * from global_t6;
a	b	c
2	2	2
4	4	4
1	1	1
3	3	3
insert into global_t6 values(11, 100, 10);
update global_t6 set b=7 where a=1;
select /*+index(global_t6 gkey)*/ a, b from global_t6;
a	b
2	2
3	3
4	4
1	7
11	100
update global_t6 set a=100 where b=2;
update global_t6 set b=19 where b=1;
select /*+index(global_t6 gkey)*/ a, b from global_t6;
a	b
100	2
3	3
4	4
1	7
11	100
update global_t6 set c=100 where b>=10;
select /*+index(global_t6 gkey)*/ a, b from global_t6;
a	b
100	2
3	3
4	4
1	7
11	100
delete from global_t6 where a=1;
select /*+index(global_t6 gkey)*/ a, b from global_t6;
a	b
100	2
3	3
4	4
11	100
delete from global_t6 where a=2 or a=3;
select /*+index(global_t6 gkey)*/ a, b from global_t6;
a	b
100	2
4	4
11	100
delete from global_t6 where b>=100;
select /*+index(global_t6 gkey)*/ a, b from global_t6;
a	b
100	2
4	4
delete from global_t6;
select /*+index(global_t6 primary)*/ * from global_t6;
a	b	c
insert into global_t6 values(2, 1, 1), (6, 6, 2), (5, 2, 1);
select /*+index(global_t6 primary)*/ * from global_t6;
a	b	c
2	1	1
6	6	2
5	2	1
delete from global_t6 where b < 7 and b >1;
select /*+index(global_t6 gkey)*/ a, b from global_t6;
a	b
2	1
select /*+index(global_t6 primary)*/ a, b, c from global_t6;
a	b	c
2	1	1
insert into global_t6 values(20, 2, 2), (30, 3, 3), (40, 4, 4) on duplicate key update b=b+1;
select /*+index(global_t6 gkey)*/ a, b from global_t6;
a	b
2	1
20	2
30	3
40	4
select /*+index(global_t6 primary)*/ a, b, c from global_t6;
a	b	c
2	1	1
20	2	2
30	3	3
40	4	4
insert into global_t6 values(20, 2, 2), (30, 3, 3), (40, 4, 4) on duplicate key update b=b+1;
select /*+index(global_t6 gkey)*/ a, b from global_t6;
a	b
2	1
20	3
30	4
40	5
select /*+index(global_t6 primary)*/ a, b, c from global_t6;
a	b	c
2	1	1
20	3	2
30	4	3
40	5	4
replace into global_t6 values(20, 2, 2), (30, 3, 3), (40, 4, 4);
select /*+index(global_t6 gkey)*/ a, b from global_t6;
a	b
2	1
20	2
30	3
40	4
select /*+index(global_t6 primary)*/ a, b, c from global_t6;
a	b	c
2	1	1
20	2	2
30	3	3
40	4	4
use db1;
select /*+index(global_t6 primary)*/ a, b, c from global_t6;
a	b	c
2	1	1
20	2	2
30	3	3
40	4	4
ob1.mysql alter system minor freeze tenant = all;
set autocommit=0;
insert into db1.tb_normal(pk,c1) values(701,'701'),(702,'702'),(703,'703'),(704,'704');
update db1.tb_normal set c1=concat(c1,'_x') where pk > 100;
delete from db1.tb_normal where pk=704;
update db1.tb_increment set pk=pk+1 order by pk desc limit 1;
insert into db1.tb_increment(pk,c1) values (702,702),(703,703);
replace into db1.tb_increment(pk,c1) values (702,701);
delete from db1.tb_increment where pk=703;
commit;
set autocommit=1;
ob1.check_until_timeout select count(*) as cnt from oceanbase.__all_virtual_server_schema_info as a join oceanbase.__all_virtual_server_schema_info as b on a.tenant_id = b.tenant_id  where a.refreshed_schema_version != b.refreshed_schema_version, 0, 60;
ob1.check_until_timeout  select count(1) as unsync_cnt from GV\$OB_LOG_STAT where in_sync = 'NO',0,600;
set @@session.ob_query_timeout = 60000000;
alter system stop zone 'z3';
ob1.check_until_timeout select status from DBA_OB_ZONES where zone='z3',INACTIVE,20;
ob1.check_until_timeout select count(1) as leader_count  from CDB_OB_LS_LOCATIONS where zone='z3' and role='leader',0,20;
ob1.z3.force_stop;
ob1.check_until_timeout select count(*) from oceanbase.DBA_OB_SERVERS where zone = 'z3' and (start_service_time is null and status='INACTIVE'),1,60;
ob1.z3.upgrade;
ob1.z3.nstart;
ob1.check_until_timeout select count(*) from oceanbase.__all_server where zone = 'z3' and (start_service_time <= 0 or status='INACTIVE'),0,120;
ob1.check_until_timeout  select count(1) as unsync_cnt from GV\$OB_LOG_STAT where in_sync = 'NO',0,600;
ob1.check_until_timeout select count(*) from oceanbase.__all_server a left join oceanbase.__all_virtual_server_schema_info b on a.svr_ip = b.svr_ip and a.svr_port = b.svr_port where b.svr_ip is null, 0, 120;
ob1.check_until_timeout select count(*) as cnt from oceanbase.__all_virtual_server_schema_info as a join oceanbase.__all_virtual_server_schema_info as b on a.tenant_id = b.tenant_id  where a.refreshed_schema_version != b.refreshed_schema_version or a.refreshed_schema_version % 8 != 0, 0, 180;
ob1.mysql alter system start zone 'z3';
ob1.mysql alter system minor freeze tenant = all;
set autocommit=0;
insert into db1.tb_normal(pk,c1) values(801,'801'),(802,'802'),(803,'803'),(804,'804');
update db1.tb_normal set c1=concat(c1,'_x') where pk > 100;
delete from db1.tb_normal where pk=804;
update db1.tb_increment set pk=pk+1 order by pk desc limit 1;
insert into db1.tb_increment(pk,c1) values (801,801),(802,802);
replace into db1.tb_increment(pk,c1) values (801,802);
delete from db1.tb_increment where pk=802;
commit;
set autocommit=1;
ob1.z1.obs0.mysql select * from mysql.proc;
ob1.z1.obs0.mysql select * from mysql.db;
ob1.z1.obs0.mysql select * from mysql.user;
ob1.z2.obs0.mysql select * from mysql.proc;
ob1.z2.obs0.mysql select * from mysql.db;
ob1.z2.obs0.mysql select * from mysql.user;
ob1.z3.obs0.mysql select * from mysql.proc;
ob1.z3.obs0.mysql select * from mysql.db;
ob1.z3.obs0.mysql select * from mysql.user;
ob1.upgrade_commond_for_server post;
ob1.check_until_timeout select count(*) from __all_virtual_tenant_parameter_stat where name = 'compatible' and value!="$dest_version",0,5;
ob2.check_until_timeout select count(*) from __all_virtual_tenant_parameter_stat where name = 'compatible' and value!="$dest_version",0,5;
ALTER SYSTEM SET query_response_time_stats=true;
ob2.check_until_timeout SELECT count(*) FROM oceanbase.GV\$OB_PARAMETERS WHERE NAME LIKE "query_response_time_stats" and value!="true" and tenant_id=1,0,5;
ob1.check_until_timeout select count(*) from __all_virtual_tenant_parameter_stat where name = 'compatible' and value!="$dest_version",0,2;
ob2.check_until_timeout select count(*) from __all_virtual_tenant_parameter_stat where name = 'compatible' and value!="$dest_version",0,2;
ALTER SYSTEM SET query_response_time_stats=false;
ob2.check_until_timeout SELECT count(*) FROM oceanbase.GV\$OB_PARAMETERS WHERE NAME LIKE "query_response_time_stats" and value!="false"and tenant_id=1,0,5;
ob1.check_until_timeout select count(*) from __all_virtual_tenant_parameter_stat where name = 'compatible' and value!="$dest_version",0,2;
ob2.check_until_timeout select count(*) from __all_virtual_tenant_parameter_stat where name = 'compatible' and value!="$dest_version",0,2;
set @@session.ob_query_timeout = 600000000;
alter system run job 'root_inspection';
set @@session.ob_query_timeout = 10000000;
ob1.check_until_timeout select count(*) from oceanbase.__all_virtual_upgrade_inspection where info != 'succeed',0,180;
ob1.mysql_p select tenant_id, max_ls_id from oceanbase.__all_virtual_tenant_info order by tenant_id;
tenant_id	max_ls_id
1002	1001
1004	1001
ob1.mysql ALTER SYSTEM SWITCHOVER TO STANDBY TENANT $tenant_primary;
ob2.mysql ALTER SYSTEM SWITCHOVER TO PRIMARY TENANT $tenant_standby;
ob1.check_until_timeout select count(*) from __all_virtual_tenant_parameter_stat where name = 'compatible' and value!="$dest_version",0,2;
ob2.check_until_timeout select count(*) from __all_virtual_tenant_parameter_stat where name = 'compatible' and value!="$dest_version",0,2;
ob1.check_until_timeout SELECT SWITCHOVER_STATUS FROM DBA_OB_TENANTS WHERE TENANT_NAME= '$tenant_primary' and TENANT_ROLE="STANDBY",NORMAL,120;
ob1.check_until_timeout SELECT count(*)  FROM oceanbase.DBA_OB_TENANTS where TENANT_NAME= '$tenant_primary' and RECOVERY_UNTIL_SCN=4611686018427387903,1,120;
insert into db1.tb_normal (pk) values(200);
insert into db1.tb_increment (c1) values(200);
insert into db1.tb_bigtable (c1,c2,c3,c4) values(repeat('A',65536),repeat('B',65536),repeat('C',65536),repeat('D',65536));
insert into test.tb_table_gencol(pk1,pk2,c1,c2) values(200,'200',repeat('A',65536),repeat('B',65536));
insert into test.tablegencol(c1,USER_ID,ADDRESS) values(200, repeat('A',32),repeat('B',256));
insert into test.table_hash(c1, c2) values(200, 200);
insert into test.table_range(c1, c2) values(200, 200);
insert into test.table_hash_range(c1, c2) values(200, 200);
insert into test.table_range_hash(c1, c2) values(200, 200);
insert into db1.tb_normal (pk) values(201);
insert into db1.tb_increment (c1) values(201);
insert into db1.tb_bigtable (c1,c2,c3,c4) values(repeat('A',65536),repeat('B',65536),repeat('C',65536),repeat('D',65536));
insert into test.tb_table_gencol(pk1,pk2,c1,c2) values(201,'201',repeat('A',65536),repeat('B',65536));
insert into test.tablegencol(c1,USER_ID,ADDRESS) values(201, repeat('A',32),repeat('B',256));
insert into test.table_hash(c1, c2) values(201, 201);
insert into test.table_range(c1, c2) values(201, 201);
insert into test.table_hash_range(c1, c2) values(201, 201);
insert into test.table_range_hash(c1, c2) values(201, 201);
insert into db1.tb_normal (pk) values(202);
insert into db1.tb_increment (c1) values(202);
insert into db1.tb_bigtable (c1,c2,c3,c4) values(repeat('A',65536),repeat('B',65536),repeat('C',65536),repeat('D',65536));
insert into test.tb_table_gencol(pk1,pk2,c1,c2) values(202,'202',repeat('A',65536),repeat('B',65536));
insert into test.tablegencol(c1,USER_ID,ADDRESS) values(202, repeat('A',32),repeat('B',256));
insert into test.table_hash(c1, c2) values(202, 202);
insert into test.table_range(c1, c2) values(202, 202);
insert into test.table_hash_range(c1, c2) values(202, 202);
insert into test.table_range_hash(c1, c2) values(202, 202);
insert into db1.tb_normal (pk) values(203);
insert into db1.tb_increment (c1) values(203);
insert into db1.tb_bigtable (c1,c2,c3,c4) values(repeat('A',65536),repeat('B',65536),repeat('C',65536),repeat('D',65536));
insert into test.tb_table_gencol(pk1,pk2,c1,c2) values(203,'203',repeat('A',65536),repeat('B',65536));
insert into test.tablegencol(c1,USER_ID,ADDRESS) values(203, repeat('A',32),repeat('B',256));
insert into test.table_hash(c1, c2) values(203, 203);
insert into test.table_range(c1, c2) values(203, 203);
insert into test.table_hash_range(c1, c2) values(203, 203);
insert into test.table_range_hash(c1, c2) values(203, 203);
insert into db1.tb_normal (pk) values(204);
insert into db1.tb_increment (c1) values(204);
insert into db1.tb_bigtable (c1,c2,c3,c4) values(repeat('A',65536),repeat('B',65536),repeat('C',65536),repeat('D',65536));
insert into test.tb_table_gencol(pk1,pk2,c1,c2) values(204,'204',repeat('A',65536),repeat('B',65536));
insert into test.tablegencol(c1,USER_ID,ADDRESS) values(204, repeat('A',32),repeat('B',256));
insert into test.table_hash(c1, c2) values(204, 204);
insert into test.table_range(c1, c2) values(204, 204);
insert into test.table_hash_range(c1, c2) values(204, 204);
insert into test.table_range_hash(c1, c2) values(204, 204);
insert into db1.tb_normal (pk) values(205);
insert into db1.tb_increment (c1) values(205);
insert into db1.tb_bigtable (c1,c2,c3,c4) values(repeat('A',65536),repeat('B',65536),repeat('C',65536),repeat('D',65536));
insert into test.tb_table_gencol(pk1,pk2,c1,c2) values(205,'205',repeat('A',65536),repeat('B',65536));
insert into test.tablegencol(c1,USER_ID,ADDRESS) values(205, repeat('A',32),repeat('B',256));
insert into test.table_hash(c1, c2) values(205, 205);
insert into test.table_range(c1, c2) values(205, 205);
insert into test.table_hash_range(c1, c2) values(205, 205);
insert into test.table_range_hash(c1, c2) values(205, 205);
insert into db1.tb_normal (pk) values(206);
insert into db1.tb_increment (c1) values(206);
insert into db1.tb_bigtable (c1,c2,c3,c4) values(repeat('A',65536),repeat('B',65536),repeat('C',65536),repeat('D',65536));
insert into test.tb_table_gencol(pk1,pk2,c1,c2) values(206,'206',repeat('A',65536),repeat('B',65536));
insert into test.tablegencol(c1,USER_ID,ADDRESS) values(206, repeat('A',32),repeat('B',256));
insert into test.table_hash(c1, c2) values(206, 206);
insert into test.table_range(c1, c2) values(206, 206);
insert into test.table_hash_range(c1, c2) values(206, 206);
insert into test.table_range_hash(c1, c2) values(206, 206);
insert into db1.tb_normal (pk) values(207);
insert into db1.tb_increment (c1) values(207);
insert into db1.tb_bigtable (c1,c2,c3,c4) values(repeat('A',65536),repeat('B',65536),repeat('C',65536),repeat('D',65536));
insert into test.tb_table_gencol(pk1,pk2,c1,c2) values(207,'207',repeat('A',65536),repeat('B',65536));
insert into test.tablegencol(c1,USER_ID,ADDRESS) values(207, repeat('A',32),repeat('B',256));
insert into test.table_hash(c1, c2) values(207, 207);
insert into test.table_range(c1, c2) values(207, 207);
insert into test.table_hash_range(c1, c2) values(207, 207);
insert into test.table_range_hash(c1, c2) values(207, 207);
insert into db1.tb_normal (pk) values(208);
insert into db1.tb_increment (c1) values(208);
insert into db1.tb_bigtable (c1,c2,c3,c4) values(repeat('A',65536),repeat('B',65536),repeat('C',65536),repeat('D',65536));
insert into test.tb_table_gencol(pk1,pk2,c1,c2) values(208,'208',repeat('A',65536),repeat('B',65536));
insert into test.tablegencol(c1,USER_ID,ADDRESS) values(208, repeat('A',32),repeat('B',256));
insert into test.table_hash(c1, c2) values(208, 208);
insert into test.table_range(c1, c2) values(208, 208);
insert into test.table_hash_range(c1, c2) values(208, 208);
insert into test.table_range_hash(c1, c2) values(208, 208);
insert into db1.tb_normal (pk) values(209);
insert into db1.tb_increment (c1) values(209);
insert into db1.tb_bigtable (c1,c2,c3,c4) values(repeat('A',65536),repeat('B',65536),repeat('C',65536),repeat('D',65536));
insert into test.tb_table_gencol(pk1,pk2,c1,c2) values(209,'209',repeat('A',65536),repeat('B',65536));
insert into test.tablegencol(c1,USER_ID,ADDRESS) values(209, repeat('A',32),repeat('B',256));
insert into test.table_hash(c1, c2) values(209, 209);
insert into test.table_range(c1, c2) values(209, 209);
insert into test.table_hash_range(c1, c2) values(209, 209);
insert into test.table_range_hash(c1, c2) values(209, 209);
insert into db1.tb_normal (pk) values(210);
insert into db1.tb_increment (c1) values(210);
insert into db1.tb_bigtable (c1,c2,c3,c4) values(repeat('A',65536),repeat('B',65536),repeat('C',65536),repeat('D',65536));
insert into test.tb_table_gencol(pk1,pk2,c1,c2) values(210,'210',repeat('A',65536),repeat('B',65536));
insert into test.tablegencol(c1,USER_ID,ADDRESS) values(210, repeat('A',32),repeat('B',256));
insert into test.table_hash(c1, c2) values(210, 210);
insert into test.table_range(c1, c2) values(210, 210);
insert into test.table_hash_range(c1, c2) values(210, 210);
insert into test.table_range_hash(c1, c2) values(210, 210);
insert into db1.tb_normal (pk) values(211);
insert into db1.tb_increment (c1) values(211);
insert into db1.tb_bigtable (c1,c2,c3,c4) values(repeat('A',65536),repeat('B',65536),repeat('C',65536),repeat('D',65536));
insert into test.tb_table_gencol(pk1,pk2,c1,c2) values(211,'211',repeat('A',65536),repeat('B',65536));
insert into test.tablegencol(c1,USER_ID,ADDRESS) values(211, repeat('A',32),repeat('B',256));
insert into test.table_hash(c1, c2) values(211, 211);
insert into test.table_range(c1, c2) values(211, 211);
insert into test.table_hash_range(c1, c2) values(211, 211);
insert into test.table_range_hash(c1, c2) values(211, 211);
insert into db1.tb_normal (pk) values(212);
insert into db1.tb_increment (c1) values(212);
insert into db1.tb_bigtable (c1,c2,c3,c4) values(repeat('A',65536),repeat('B',65536),repeat('C',65536),repeat('D',65536));
insert into test.tb_table_gencol(pk1,pk2,c1,c2) values(212,'212',repeat('A',65536),repeat('B',65536));
insert into test.tablegencol(c1,USER_ID,ADDRESS) values(212, repeat('A',32),repeat('B',256));
insert into test.table_hash(c1, c2) values(212, 212);
insert into test.table_range(c1, c2) values(212, 212);
insert into test.table_hash_range(c1, c2) values(212, 212);
insert into test.table_range_hash(c1, c2) values(212, 212);
insert into db1.tb_normal (pk) values(213);
insert into db1.tb_increment (c1) values(213);
insert into db1.tb_bigtable (c1,c2,c3,c4) values(repeat('A',65536),repeat('B',65536),repeat('C',65536),repeat('D',65536));
insert into test.tb_table_gencol(pk1,pk2,c1,c2) values(213,'213',repeat('A',65536),repeat('B',65536));
insert into test.tablegencol(c1,USER_ID,ADDRESS) values(213, repeat('A',32),repeat('B',256));
insert into test.table_hash(c1, c2) values(213, 213);
insert into test.table_range(c1, c2) values(213, 213);
insert into test.table_hash_range(c1, c2) values(213, 213);
insert into test.table_range_hash(c1, c2) values(213, 213);
insert into db1.tb_normal (pk) values(214);
insert into db1.tb_increment (c1) values(214);
insert into db1.tb_bigtable (c1,c2,c3,c4) values(repeat('A',65536),repeat('B',65536),repeat('C',65536),repeat('D',65536));
insert into test.tb_table_gencol(pk1,pk2,c1,c2) values(214,'214',repeat('A',65536),repeat('B',65536));
insert into test.tablegencol(c1,USER_ID,ADDRESS) values(214, repeat('A',32),repeat('B',256));
insert into test.table_hash(c1, c2) values(214, 214);
insert into test.table_range(c1, c2) values(214, 214);
insert into test.table_hash_range(c1, c2) values(214, 214);
insert into test.table_range_hash(c1, c2) values(214, 214);
insert into db1.tb_normal (pk) values(215);
insert into db1.tb_increment (c1) values(215);
insert into db1.tb_bigtable (c1,c2,c3,c4) values(repeat('A',65536),repeat('B',65536),repeat('C',65536),repeat('D',65536));
insert into test.tb_table_gencol(pk1,pk2,c1,c2) values(215,'215',repeat('A',65536),repeat('B',65536));
insert into test.tablegencol(c1,USER_ID,ADDRESS) values(215, repeat('A',32),repeat('B',256));
insert into test.table_hash(c1, c2) values(215, 215);
insert into test.table_range(c1, c2) values(215, 215);
insert into test.table_hash_range(c1, c2) values(215, 215);
insert into test.table_range_hash(c1, c2) values(215, 215);
insert into db1.tb_normal (pk) values(216);
insert into db1.tb_increment (c1) values(216);
insert into db1.tb_bigtable (c1,c2,c3,c4) values(repeat('A',65536),repeat('B',65536),repeat('C',65536),repeat('D',65536));
insert into test.tb_table_gencol(pk1,pk2,c1,c2) values(216,'216',repeat('A',65536),repeat('B',65536));
insert into test.tablegencol(c1,USER_ID,ADDRESS) values(216, repeat('A',32),repeat('B',256));
insert into test.table_hash(c1, c2) values(216, 216);
insert into test.table_range(c1, c2) values(216, 216);
insert into test.table_hash_range(c1, c2) values(216, 216);
insert into test.table_range_hash(c1, c2) values(216, 216);
insert into db1.tb_normal (pk) values(217);
insert into db1.tb_increment (c1) values(217);
insert into db1.tb_bigtable (c1,c2,c3,c4) values(repeat('A',65536),repeat('B',65536),repeat('C',65536),repeat('D',65536));
insert into test.tb_table_gencol(pk1,pk2,c1,c2) values(217,'217',repeat('A',65536),repeat('B',65536));
insert into test.tablegencol(c1,USER_ID,ADDRESS) values(217, repeat('A',32),repeat('B',256));
insert into test.table_hash(c1, c2) values(217, 217);
insert into test.table_range(c1, c2) values(217, 217);
insert into test.table_hash_range(c1, c2) values(217, 217);
insert into test.table_range_hash(c1, c2) values(217, 217);
insert into db1.tb_normal (pk) values(218);
insert into db1.tb_increment (c1) values(218);
insert into db1.tb_bigtable (c1,c2,c3,c4) values(repeat('A',65536),repeat('B',65536),repeat('C',65536),repeat('D',65536));
insert into test.tb_table_gencol(pk1,pk2,c1,c2) values(218,'218',repeat('A',65536),repeat('B',65536));
insert into test.tablegencol(c1,USER_ID,ADDRESS) values(218, repeat('A',32),repeat('B',256));
insert into test.table_hash(c1, c2) values(218, 218);
insert into test.table_range(c1, c2) values(218, 218);
insert into test.table_hash_range(c1, c2) values(218, 218);
insert into test.table_range_hash(c1, c2) values(218, 218);
insert into db1.tb_normal (pk) values(219);
insert into db1.tb_increment (c1) values(219);
insert into db1.tb_bigtable (c1,c2,c3,c4) values(repeat('A',65536),repeat('B',65536),repeat('C',65536),repeat('D',65536));
insert into test.tb_table_gencol(pk1,pk2,c1,c2) values(219,'219',repeat('A',65536),repeat('B',65536));
insert into test.tablegencol(c1,USER_ID,ADDRESS) values(219, repeat('A',32),repeat('B',256));
insert into test.table_hash(c1, c2) values(219, 219);
insert into test.table_range(c1, c2) values(219, 219);
insert into test.table_hash_range(c1, c2) values(219, 219);
insert into test.table_range_hash(c1, c2) values(219, 219);
insert into db1.tb_normal (pk) values(220);
insert into db1.tb_increment (c1) values(220);
insert into db1.tb_bigtable (c1,c2,c3,c4) values(repeat('A',65536),repeat('B',65536),repeat('C',65536),repeat('D',65536));
insert into test.tb_table_gencol(pk1,pk2,c1,c2) values(220,'220',repeat('A',65536),repeat('B',65536));
insert into test.tablegencol(c1,USER_ID,ADDRESS) values(220, repeat('A',32),repeat('B',256));
insert into test.table_hash(c1, c2) values(220, 220);
insert into test.table_range(c1, c2) values(220, 220);
insert into test.table_hash_range(c1, c2) values(220, 220);
insert into test.table_range_hash(c1, c2) values(220, 220);
insert into db1.tb_normal (pk) values(221);
insert into db1.tb_increment (c1) values(221);
insert into db1.tb_bigtable (c1,c2,c3,c4) values(repeat('A',65536),repeat('B',65536),repeat('C',65536),repeat('D',65536));
insert into test.tb_table_gencol(pk1,pk2,c1,c2) values(221,'221',repeat('A',65536),repeat('B',65536));
insert into test.tablegencol(c1,USER_ID,ADDRESS) values(221, repeat('A',32),repeat('B',256));
insert into test.table_hash(c1, c2) values(221, 221);
insert into test.table_range(c1, c2) values(221, 221);
insert into test.table_hash_range(c1, c2) values(221, 221);
insert into test.table_range_hash(c1, c2) values(221, 221);
insert into db1.tb_normal (pk) values(222);
insert into db1.tb_increment (c1) values(222);
insert into db1.tb_bigtable (c1,c2,c3,c4) values(repeat('A',65536),repeat('B',65536),repeat('C',65536),repeat('D',65536));
insert into test.tb_table_gencol(pk1,pk2,c1,c2) values(222,'222',repeat('A',65536),repeat('B',65536));
insert into test.tablegencol(c1,USER_ID,ADDRESS) values(222, repeat('A',32),repeat('B',256));
insert into test.table_hash(c1, c2) values(222, 222);
insert into test.table_range(c1, c2) values(222, 222);
insert into test.table_hash_range(c1, c2) values(222, 222);
insert into test.table_range_hash(c1, c2) values(222, 222);
insert into db1.tb_normal (pk) values(223);
insert into db1.tb_increment (c1) values(223);
insert into db1.tb_bigtable (c1,c2,c3,c4) values(repeat('A',65536),repeat('B',65536),repeat('C',65536),repeat('D',65536));
insert into test.tb_table_gencol(pk1,pk2,c1,c2) values(223,'223',repeat('A',65536),repeat('B',65536));
insert into test.tablegencol(c1,USER_ID,ADDRESS) values(223, repeat('A',32),repeat('B',256));
insert into test.table_hash(c1, c2) values(223, 223);
insert into test.table_range(c1, c2) values(223, 223);
insert into test.table_hash_range(c1, c2) values(223, 223);
insert into test.table_range_hash(c1, c2) values(223, 223);
insert into db1.tb_normal (pk) values(224);
insert into db1.tb_increment (c1) values(224);
insert into db1.tb_bigtable (c1,c2,c3,c4) values(repeat('A',65536),repeat('B',65536),repeat('C',65536),repeat('D',65536));
insert into test.tb_table_gencol(pk1,pk2,c1,c2) values(224,'224',repeat('A',65536),repeat('B',65536));
insert into test.tablegencol(c1,USER_ID,ADDRESS) values(224, repeat('A',32),repeat('B',256));
insert into test.table_hash(c1, c2) values(224, 224);
insert into test.table_range(c1, c2) values(224, 224);
insert into test.table_hash_range(c1, c2) values(224, 224);
insert into test.table_range_hash(c1, c2) values(224, 224);
insert into db1.tb_normal (pk) values(225);
insert into db1.tb_increment (c1) values(225);
insert into db1.tb_bigtable (c1,c2,c3,c4) values(repeat('A',65536),repeat('B',65536),repeat('C',65536),repeat('D',65536));
insert into test.tb_table_gencol(pk1,pk2,c1,c2) values(225,'225',repeat('A',65536),repeat('B',65536));
insert into test.tablegencol(c1,USER_ID,ADDRESS) values(225, repeat('A',32),repeat('B',256));
insert into test.table_hash(c1, c2) values(225, 225);
insert into test.table_range(c1, c2) values(225, 225);
insert into test.table_hash_range(c1, c2) values(225, 225);
insert into test.table_range_hash(c1, c2) values(225, 225);
insert into db1.tb_normal (pk) values(226);
insert into db1.tb_increment (c1) values(226);
insert into db1.tb_bigtable (c1,c2,c3,c4) values(repeat('A',65536),repeat('B',65536),repeat('C',65536),repeat('D',65536));
insert into test.tb_table_gencol(pk1,pk2,c1,c2) values(226,'226',repeat('A',65536),repeat('B',65536));
insert into test.tablegencol(c1,USER_ID,ADDRESS) values(226, repeat('A',32),repeat('B',256));
insert into test.table_hash(c1, c2) values(226, 226);
insert into test.table_range(c1, c2) values(226, 226);
insert into test.table_hash_range(c1, c2) values(226, 226);
insert into test.table_range_hash(c1, c2) values(226, 226);
insert into db1.tb_normal (pk) values(227);
insert into db1.tb_increment (c1) values(227);
insert into db1.tb_bigtable (c1,c2,c3,c4) values(repeat('A',65536),repeat('B',65536),repeat('C',65536),repeat('D',65536));
insert into test.tb_table_gencol(pk1,pk2,c1,c2) values(227,'227',repeat('A',65536),repeat('B',65536));
insert into test.tablegencol(c1,USER_ID,ADDRESS) values(227, repeat('A',32),repeat('B',256));
insert into test.table_hash(c1, c2) values(227, 227);
insert into test.table_range(c1, c2) values(227, 227);
insert into test.table_hash_range(c1, c2) values(227, 227);
insert into test.table_range_hash(c1, c2) values(227, 227);
insert into db1.tb_normal (pk) values(228);
insert into db1.tb_increment (c1) values(228);
insert into db1.tb_bigtable (c1,c2,c3,c4) values(repeat('A',65536),repeat('B',65536),repeat('C',65536),repeat('D',65536));
insert into test.tb_table_gencol(pk1,pk2,c1,c2) values(228,'228',repeat('A',65536),repeat('B',65536));
insert into test.tablegencol(c1,USER_ID,ADDRESS) values(228, repeat('A',32),repeat('B',256));
insert into test.table_hash(c1, c2) values(228, 228);
insert into test.table_range(c1, c2) values(228, 228);
insert into test.table_hash_range(c1, c2) values(228, 228);
insert into test.table_range_hash(c1, c2) values(228, 228);
insert into db1.tb_normal (pk) values(229);
insert into db1.tb_increment (c1) values(229);
insert into db1.tb_bigtable (c1,c2,c3,c4) values(repeat('A',65536),repeat('B',65536),repeat('C',65536),repeat('D',65536));
insert into test.tb_table_gencol(pk1,pk2,c1,c2) values(229,'229',repeat('A',65536),repeat('B',65536));
insert into test.tablegencol(c1,USER_ID,ADDRESS) values(229, repeat('A',32),repeat('B',256));
insert into test.table_hash(c1, c2) values(229, 229);
insert into test.table_range(c1, c2) values(229, 229);
insert into test.table_hash_range(c1, c2) values(229, 229);
insert into test.table_range_hash(c1, c2) values(229, 229);
insert into db1.tb_normal (pk) values(230);
insert into db1.tb_increment (c1) values(230);
insert into db1.tb_bigtable (c1,c2,c3,c4) values(repeat('A',65536),repeat('B',65536),repeat('C',65536),repeat('D',65536));
insert into test.tb_table_gencol(pk1,pk2,c1,c2) values(230,'230',repeat('A',65536),repeat('B',65536));
insert into test.tablegencol(c1,USER_ID,ADDRESS) values(230, repeat('A',32),repeat('B',256));
insert into test.table_hash(c1, c2) values(230, 230);
insert into test.table_range(c1, c2) values(230, 230);
insert into test.table_hash_range(c1, c2) values(230, 230);
insert into test.table_range_hash(c1, c2) values(230, 230);
insert into db1.tb_normal (pk) values(231);
insert into db1.tb_increment (c1) values(231);
insert into db1.tb_bigtable (c1,c2,c3,c4) values(repeat('A',65536),repeat('B',65536),repeat('C',65536),repeat('D',65536));
insert into test.tb_table_gencol(pk1,pk2,c1,c2) values(231,'231',repeat('A',65536),repeat('B',65536));
insert into test.tablegencol(c1,USER_ID,ADDRESS) values(231, repeat('A',32),repeat('B',256));
insert into test.table_hash(c1, c2) values(231, 231);
insert into test.table_range(c1, c2) values(231, 231);
insert into test.table_hash_range(c1, c2) values(231, 231);
insert into test.table_range_hash(c1, c2) values(231, 231);
insert into db1.tb_normal (pk) values(232);
insert into db1.tb_increment (c1) values(232);
insert into db1.tb_bigtable (c1,c2,c3,c4) values(repeat('A',65536),repeat('B',65536),repeat('C',65536),repeat('D',65536));
insert into test.tb_table_gencol(pk1,pk2,c1,c2) values(232,'232',repeat('A',65536),repeat('B',65536));
insert into test.tablegencol(c1,USER_ID,ADDRESS) values(232, repeat('A',32),repeat('B',256));
insert into test.table_hash(c1, c2) values(232, 232);
insert into test.table_range(c1, c2) values(232, 232);
insert into test.table_hash_range(c1, c2) values(232, 232);
insert into test.table_range_hash(c1, c2) values(232, 232);
insert into db1.tb_normal (pk) values(233);
insert into db1.tb_increment (c1) values(233);
insert into db1.tb_bigtable (c1,c2,c3,c4) values(repeat('A',65536),repeat('B',65536),repeat('C',65536),repeat('D',65536));
insert into test.tb_table_gencol(pk1,pk2,c1,c2) values(233,'233',repeat('A',65536),repeat('B',65536));
insert into test.tablegencol(c1,USER_ID,ADDRESS) values(233, repeat('A',32),repeat('B',256));
insert into test.table_hash(c1, c2) values(233, 233);
insert into test.table_range(c1, c2) values(233, 233);
insert into test.table_hash_range(c1, c2) values(233, 233);
insert into test.table_range_hash(c1, c2) values(233, 233);
insert into db1.tb_normal (pk) values(234);
insert into db1.tb_increment (c1) values(234);
insert into db1.tb_bigtable (c1,c2,c3,c4) values(repeat('A',65536),repeat('B',65536),repeat('C',65536),repeat('D',65536));
insert into test.tb_table_gencol(pk1,pk2,c1,c2) values(234,'234',repeat('A',65536),repeat('B',65536));
insert into test.tablegencol(c1,USER_ID,ADDRESS) values(234, repeat('A',32),repeat('B',256));
insert into test.table_hash(c1, c2) values(234, 234);
insert into test.table_range(c1, c2) values(234, 234);
insert into test.table_hash_range(c1, c2) values(234, 234);
insert into test.table_range_hash(c1, c2) values(234, 234);
insert into db1.tb_normal (pk) values(235);
insert into db1.tb_increment (c1) values(235);
insert into db1.tb_bigtable (c1,c2,c3,c4) values(repeat('A',65536),repeat('B',65536),repeat('C',65536),repeat('D',65536));
insert into test.tb_table_gencol(pk1,pk2,c1,c2) values(235,'235',repeat('A',65536),repeat('B',65536));
insert into test.tablegencol(c1,USER_ID,ADDRESS) values(235, repeat('A',32),repeat('B',256));
insert into test.table_hash(c1, c2) values(235, 235);
insert into test.table_range(c1, c2) values(235, 235);
insert into test.table_hash_range(c1, c2) values(235, 235);
insert into test.table_range_hash(c1, c2) values(235, 235);
insert into db1.tb_normal (pk) values(236);
insert into db1.tb_increment (c1) values(236);
insert into db1.tb_bigtable (c1,c2,c3,c4) values(repeat('A',65536),repeat('B',65536),repeat('C',65536),repeat('D',65536));
insert into test.tb_table_gencol(pk1,pk2,c1,c2) values(236,'236',repeat('A',65536),repeat('B',65536));
insert into test.tablegencol(c1,USER_ID,ADDRESS) values(236, repeat('A',32),repeat('B',256));
insert into test.table_hash(c1, c2) values(236, 236);
insert into test.table_range(c1, c2) values(236, 236);
insert into test.table_hash_range(c1, c2) values(236, 236);
insert into test.table_range_hash(c1, c2) values(236, 236);
insert into db1.tb_normal (pk) values(237);
insert into db1.tb_increment (c1) values(237);
insert into db1.tb_bigtable (c1,c2,c3,c4) values(repeat('A',65536),repeat('B',65536),repeat('C',65536),repeat('D',65536));
insert into test.tb_table_gencol(pk1,pk2,c1,c2) values(237,'237',repeat('A',65536),repeat('B',65536));
insert into test.tablegencol(c1,USER_ID,ADDRESS) values(237, repeat('A',32),repeat('B',256));
insert into test.table_hash(c1, c2) values(237, 237);
insert into test.table_range(c1, c2) values(237, 237);
insert into test.table_hash_range(c1, c2) values(237, 237);
insert into test.table_range_hash(c1, c2) values(237, 237);
insert into db1.tb_normal (pk) values(238);
insert into db1.tb_increment (c1) values(238);
insert into db1.tb_bigtable (c1,c2,c3,c4) values(repeat('A',65536),repeat('B',65536),repeat('C',65536),repeat('D',65536));
insert into test.tb_table_gencol(pk1,pk2,c1,c2) values(238,'238',repeat('A',65536),repeat('B',65536));
insert into test.tablegencol(c1,USER_ID,ADDRESS) values(238, repeat('A',32),repeat('B',256));
insert into test.table_hash(c1, c2) values(238, 238);
insert into test.table_range(c1, c2) values(238, 238);
insert into test.table_hash_range(c1, c2) values(238, 238);
insert into test.table_range_hash(c1, c2) values(238, 238);
insert into db1.tb_normal (pk) values(239);
insert into db1.tb_increment (c1) values(239);
insert into db1.tb_bigtable (c1,c2,c3,c4) values(repeat('A',65536),repeat('B',65536),repeat('C',65536),repeat('D',65536));
insert into test.tb_table_gencol(pk1,pk2,c1,c2) values(239,'239',repeat('A',65536),repeat('B',65536));
insert into test.tablegencol(c1,USER_ID,ADDRESS) values(239, repeat('A',32),repeat('B',256));
insert into test.table_hash(c1, c2) values(239, 239);
insert into test.table_range(c1, c2) values(239, 239);
insert into test.table_hash_range(c1, c2) values(239, 239);
insert into test.table_range_hash(c1, c2) values(239, 239);
insert into db1.tb_normal (pk) values(240);
insert into db1.tb_increment (c1) values(240);
insert into db1.tb_bigtable (c1,c2,c3,c4) values(repeat('A',65536),repeat('B',65536),repeat('C',65536),repeat('D',65536));
insert into test.tb_table_gencol(pk1,pk2,c1,c2) values(240,'240',repeat('A',65536),repeat('B',65536));
insert into test.tablegencol(c1,USER_ID,ADDRESS) values(240, repeat('A',32),repeat('B',256));
insert into test.table_hash(c1, c2) values(240, 240);
insert into test.table_range(c1, c2) values(240, 240);
insert into test.table_hash_range(c1, c2) values(240, 240);
insert into test.table_range_hash(c1, c2) values(240, 240);
insert into db1.tb_normal (pk) values(241);
insert into db1.tb_increment (c1) values(241);
insert into db1.tb_bigtable (c1,c2,c3,c4) values(repeat('A',65536),repeat('B',65536),repeat('C',65536),repeat('D',65536));
insert into test.tb_table_gencol(pk1,pk2,c1,c2) values(241,'241',repeat('A',65536),repeat('B',65536));
insert into test.tablegencol(c1,USER_ID,ADDRESS) values(241, repeat('A',32),repeat('B',256));
insert into test.table_hash(c1, c2) values(241, 241);
insert into test.table_range(c1, c2) values(241, 241);
insert into test.table_hash_range(c1, c2) values(241, 241);
insert into test.table_range_hash(c1, c2) values(241, 241);
insert into db1.tb_normal (pk) values(242);
insert into db1.tb_increment (c1) values(242);
insert into db1.tb_bigtable (c1,c2,c3,c4) values(repeat('A',65536),repeat('B',65536),repeat('C',65536),repeat('D',65536));
insert into test.tb_table_gencol(pk1,pk2,c1,c2) values(242,'242',repeat('A',65536),repeat('B',65536));
insert into test.tablegencol(c1,USER_ID,ADDRESS) values(242, repeat('A',32),repeat('B',256));
insert into test.table_hash(c1, c2) values(242, 242);
insert into test.table_range(c1, c2) values(242, 242);
insert into test.table_hash_range(c1, c2) values(242, 242);
insert into test.table_range_hash(c1, c2) values(242, 242);
insert into db1.tb_normal (pk) values(243);
insert into db1.tb_increment (c1) values(243);
insert into db1.tb_bigtable (c1,c2,c3,c4) values(repeat('A',65536),repeat('B',65536),repeat('C',65536),repeat('D',65536));
insert into test.tb_table_gencol(pk1,pk2,c1,c2) values(243,'243',repeat('A',65536),repeat('B',65536));
insert into test.tablegencol(c1,USER_ID,ADDRESS) values(243, repeat('A',32),repeat('B',256));
insert into test.table_hash(c1, c2) values(243, 243);
insert into test.table_range(c1, c2) values(243, 243);
insert into test.table_hash_range(c1, c2) values(243, 243);
insert into test.table_range_hash(c1, c2) values(243, 243);
insert into db1.tb_normal (pk) values(244);
insert into db1.tb_increment (c1) values(244);
insert into db1.tb_bigtable (c1,c2,c3,c4) values(repeat('A',65536),repeat('B',65536),repeat('C',65536),repeat('D',65536));
insert into test.tb_table_gencol(pk1,pk2,c1,c2) values(244,'244',repeat('A',65536),repeat('B',65536));
insert into test.tablegencol(c1,USER_ID,ADDRESS) values(244, repeat('A',32),repeat('B',256));
insert into test.table_hash(c1, c2) values(244, 244);
insert into test.table_range(c1, c2) values(244, 244);
insert into test.table_hash_range(c1, c2) values(244, 244);
insert into test.table_range_hash(c1, c2) values(244, 244);
insert into db1.tb_normal (pk) values(245);
insert into db1.tb_increment (c1) values(245);
insert into db1.tb_bigtable (c1,c2,c3,c4) values(repeat('A',65536),repeat('B',65536),repeat('C',65536),repeat('D',65536));
insert into test.tb_table_gencol(pk1,pk2,c1,c2) values(245,'245',repeat('A',65536),repeat('B',65536));
insert into test.tablegencol(c1,USER_ID,ADDRESS) values(245, repeat('A',32),repeat('B',256));
insert into test.table_hash(c1, c2) values(245, 245);
insert into test.table_range(c1, c2) values(245, 245);
insert into test.table_hash_range(c1, c2) values(245, 245);
insert into test.table_range_hash(c1, c2) values(245, 245);
insert into db1.tb_normal (pk) values(246);
insert into db1.tb_increment (c1) values(246);
insert into db1.tb_bigtable (c1,c2,c3,c4) values(repeat('A',65536),repeat('B',65536),repeat('C',65536),repeat('D',65536));
insert into test.tb_table_gencol(pk1,pk2,c1,c2) values(246,'246',repeat('A',65536),repeat('B',65536));
insert into test.tablegencol(c1,USER_ID,ADDRESS) values(246, repeat('A',32),repeat('B',256));
insert into test.table_hash(c1, c2) values(246, 246);
insert into test.table_range(c1, c2) values(246, 246);
insert into test.table_hash_range(c1, c2) values(246, 246);
insert into test.table_range_hash(c1, c2) values(246, 246);
insert into db1.tb_normal (pk) values(247);
insert into db1.tb_increment (c1) values(247);
insert into db1.tb_bigtable (c1,c2,c3,c4) values(repeat('A',65536),repeat('B',65536),repeat('C',65536),repeat('D',65536));
insert into test.tb_table_gencol(pk1,pk2,c1,c2) values(247,'247',repeat('A',65536),repeat('B',65536));
insert into test.tablegencol(c1,USER_ID,ADDRESS) values(247, repeat('A',32),repeat('B',256));
insert into test.table_hash(c1, c2) values(247, 247);
insert into test.table_range(c1, c2) values(247, 247);
insert into test.table_hash_range(c1, c2) values(247, 247);
insert into test.table_range_hash(c1, c2) values(247, 247);
insert into db1.tb_normal (pk) values(248);
insert into db1.tb_increment (c1) values(248);
insert into db1.tb_bigtable (c1,c2,c3,c4) values(repeat('A',65536),repeat('B',65536),repeat('C',65536),repeat('D',65536));
insert into test.tb_table_gencol(pk1,pk2,c1,c2) values(248,'248',repeat('A',65536),repeat('B',65536));
insert into test.tablegencol(c1,USER_ID,ADDRESS) values(248, repeat('A',32),repeat('B',256));
insert into test.table_hash(c1, c2) values(248, 248);
insert into test.table_range(c1, c2) values(248, 248);
insert into test.table_hash_range(c1, c2) values(248, 248);
insert into test.table_range_hash(c1, c2) values(248, 248);
insert into db1.tb_normal (pk) values(249);
insert into db1.tb_increment (c1) values(249);
insert into db1.tb_bigtable (c1,c2,c3,c4) values(repeat('A',65536),repeat('B',65536),repeat('C',65536),repeat('D',65536));
insert into test.tb_table_gencol(pk1,pk2,c1,c2) values(249,'249',repeat('A',65536),repeat('B',65536));
insert into test.tablegencol(c1,USER_ID,ADDRESS) values(249, repeat('A',32),repeat('B',256));
insert into test.table_hash(c1, c2) values(249, 249);
insert into test.table_range(c1, c2) values(249, 249);
insert into test.table_hash_range(c1, c2) values(249, 249);
insert into test.table_range_hash(c1, c2) values(249, 249);
insert into db1.tb_normal (pk) values(250);
insert into db1.tb_increment (c1) values(250);
insert into db1.tb_bigtable (c1,c2,c3,c4) values(repeat('A',65536),repeat('B',65536),repeat('C',65536),repeat('D',65536));
insert into test.tb_table_gencol(pk1,pk2,c1,c2) values(250,'250',repeat('A',65536),repeat('B',65536));
insert into test.tablegencol(c1,USER_ID,ADDRESS) values(250, repeat('A',32),repeat('B',256));
insert into test.table_hash(c1, c2) values(250, 250);
insert into test.table_range(c1, c2) values(250, 250);
insert into test.table_hash_range(c1, c2) values(250, 250);
insert into test.table_range_hash(c1, c2) values(250, 250);
insert into db1.tb_normal (pk) values(251);
insert into db1.tb_increment (c1) values(251);
insert into db1.tb_bigtable (c1,c2,c3,c4) values(repeat('A',65536),repeat('B',65536),repeat('C',65536),repeat('D',65536));
insert into test.tb_table_gencol(pk1,pk2,c1,c2) values(251,'251',repeat('A',65536),repeat('B',65536));
insert into test.tablegencol(c1,USER_ID,ADDRESS) values(251, repeat('A',32),repeat('B',256));
insert into test.table_hash(c1, c2) values(251, 251);
insert into test.table_range(c1, c2) values(251, 251);
insert into test.table_hash_range(c1, c2) values(251, 251);
insert into test.table_range_hash(c1, c2) values(251, 251);
insert into db1.tb_normal (pk) values(252);
insert into db1.tb_increment (c1) values(252);
insert into db1.tb_bigtable (c1,c2,c3,c4) values(repeat('A',65536),repeat('B',65536),repeat('C',65536),repeat('D',65536));
insert into test.tb_table_gencol(pk1,pk2,c1,c2) values(252,'252',repeat('A',65536),repeat('B',65536));
insert into test.tablegencol(c1,USER_ID,ADDRESS) values(252, repeat('A',32),repeat('B',256));
insert into test.table_hash(c1, c2) values(252, 252);
insert into test.table_range(c1, c2) values(252, 252);
insert into test.table_hash_range(c1, c2) values(252, 252);
insert into test.table_range_hash(c1, c2) values(252, 252);
insert into db1.tb_normal (pk) values(253);
insert into db1.tb_increment (c1) values(253);
insert into db1.tb_bigtable (c1,c2,c3,c4) values(repeat('A',65536),repeat('B',65536),repeat('C',65536),repeat('D',65536));
insert into test.tb_table_gencol(pk1,pk2,c1,c2) values(253,'253',repeat('A',65536),repeat('B',65536));
insert into test.tablegencol(c1,USER_ID,ADDRESS) values(253, repeat('A',32),repeat('B',256));
insert into test.table_hash(c1, c2) values(253, 253);
insert into test.table_range(c1, c2) values(253, 253);
insert into test.table_hash_range(c1, c2) values(253, 253);
insert into test.table_range_hash(c1, c2) values(253, 253);
insert into db1.tb_normal (pk) values(254);
insert into db1.tb_increment (c1) values(254);
insert into db1.tb_bigtable (c1,c2,c3,c4) values(repeat('A',65536),repeat('B',65536),repeat('C',65536),repeat('D',65536));
insert into test.tb_table_gencol(pk1,pk2,c1,c2) values(254,'254',repeat('A',65536),repeat('B',65536));
insert into test.tablegencol(c1,USER_ID,ADDRESS) values(254, repeat('A',32),repeat('B',256));
insert into test.table_hash(c1, c2) values(254, 254);
insert into test.table_range(c1, c2) values(254, 254);
insert into test.table_hash_range(c1, c2) values(254, 254);
insert into test.table_range_hash(c1, c2) values(254, 254);
insert into db1.tb_normal (pk) values(255);
insert into db1.tb_increment (c1) values(255);
insert into db1.tb_bigtable (c1,c2,c3,c4) values(repeat('A',65536),repeat('B',65536),repeat('C',65536),repeat('D',65536));
insert into test.tb_table_gencol(pk1,pk2,c1,c2) values(255,'255',repeat('A',65536),repeat('B',65536));
insert into test.tablegencol(c1,USER_ID,ADDRESS) values(255, repeat('A',32),repeat('B',256));
insert into test.table_hash(c1, c2) values(255, 255);
insert into test.table_range(c1, c2) values(255, 255);
insert into test.table_hash_range(c1, c2) values(255, 255);
insert into test.table_range_hash(c1, c2) values(255, 255);
insert into db1.tb_normal (pk) values(256);
insert into db1.tb_increment (c1) values(256);
insert into db1.tb_bigtable (c1,c2,c3,c4) values(repeat('A',65536),repeat('B',65536),repeat('C',65536),repeat('D',65536));
insert into test.tb_table_gencol(pk1,pk2,c1,c2) values(256,'256',repeat('A',65536),repeat('B',65536));
insert into test.tablegencol(c1,USER_ID,ADDRESS) values(256, repeat('A',32),repeat('B',256));
insert into test.table_hash(c1, c2) values(256, 256);
insert into test.table_range(c1, c2) values(256, 256);
insert into test.table_hash_range(c1, c2) values(256, 256);
insert into test.table_range_hash(c1, c2) values(256, 256);
insert into db1.tb_normal (pk) values(257);
insert into db1.tb_increment (c1) values(257);
insert into db1.tb_bigtable (c1,c2,c3,c4) values(repeat('A',65536),repeat('B',65536),repeat('C',65536),repeat('D',65536));
insert into test.tb_table_gencol(pk1,pk2,c1,c2) values(257,'257',repeat('A',65536),repeat('B',65536));
insert into test.tablegencol(c1,USER_ID,ADDRESS) values(257, repeat('A',32),repeat('B',256));
insert into test.table_hash(c1, c2) values(257, 257);
insert into test.table_range(c1, c2) values(257, 257);
insert into test.table_hash_range(c1, c2) values(257, 257);
insert into test.table_range_hash(c1, c2) values(257, 257);
insert into db1.tb_normal (pk) values(258);
insert into db1.tb_increment (c1) values(258);
insert into db1.tb_bigtable (c1,c2,c3,c4) values(repeat('A',65536),repeat('B',65536),repeat('C',65536),repeat('D',65536));
insert into test.tb_table_gencol(pk1,pk2,c1,c2) values(258,'258',repeat('A',65536),repeat('B',65536));
insert into test.tablegencol(c1,USER_ID,ADDRESS) values(258, repeat('A',32),repeat('B',256));
insert into test.table_hash(c1, c2) values(258, 258);
insert into test.table_range(c1, c2) values(258, 258);
insert into test.table_hash_range(c1, c2) values(258, 258);
insert into test.table_range_hash(c1, c2) values(258, 258);
insert into db1.tb_normal (pk) values(259);
insert into db1.tb_increment (c1) values(259);
insert into db1.tb_bigtable (c1,c2,c3,c4) values(repeat('A',65536),repeat('B',65536),repeat('C',65536),repeat('D',65536));
insert into test.tb_table_gencol(pk1,pk2,c1,c2) values(259,'259',repeat('A',65536),repeat('B',65536));
insert into test.tablegencol(c1,USER_ID,ADDRESS) values(259, repeat('A',32),repeat('B',256));
insert into test.table_hash(c1, c2) values(259, 259);
insert into test.table_range(c1, c2) values(259, 259);
insert into test.table_hash_range(c1, c2) values(259, 259);
insert into test.table_range_hash(c1, c2) values(259, 259);
insert into db1.tb_normal (pk) values(260);
insert into db1.tb_increment (c1) values(260);
insert into db1.tb_bigtable (c1,c2,c3,c4) values(repeat('A',65536),repeat('B',65536),repeat('C',65536),repeat('D',65536));
insert into test.tb_table_gencol(pk1,pk2,c1,c2) values(260,'260',repeat('A',65536),repeat('B',65536));
insert into test.tablegencol(c1,USER_ID,ADDRESS) values(260, repeat('A',32),repeat('B',256));
insert into test.table_hash(c1, c2) values(260, 260);
insert into test.table_range(c1, c2) values(260, 260);
insert into test.table_hash_range(c1, c2) values(260, 260);
insert into test.table_range_hash(c1, c2) values(260, 260);
insert into db1.tb_normal (pk) values(261);
insert into db1.tb_increment (c1) values(261);
insert into db1.tb_bigtable (c1,c2,c3,c4) values(repeat('A',65536),repeat('B',65536),repeat('C',65536),repeat('D',65536));
insert into test.tb_table_gencol(pk1,pk2,c1,c2) values(261,'261',repeat('A',65536),repeat('B',65536));
insert into test.tablegencol(c1,USER_ID,ADDRESS) values(261, repeat('A',32),repeat('B',256));
insert into test.table_hash(c1, c2) values(261, 261);
insert into test.table_range(c1, c2) values(261, 261);
insert into test.table_hash_range(c1, c2) values(261, 261);
insert into test.table_range_hash(c1, c2) values(261, 261);
insert into db1.tb_normal (pk) values(262);
insert into db1.tb_increment (c1) values(262);
insert into db1.tb_bigtable (c1,c2,c3,c4) values(repeat('A',65536),repeat('B',65536),repeat('C',65536),repeat('D',65536));
insert into test.tb_table_gencol(pk1,pk2,c1,c2) values(262,'262',repeat('A',65536),repeat('B',65536));
insert into test.tablegencol(c1,USER_ID,ADDRESS) values(262, repeat('A',32),repeat('B',256));
insert into test.table_hash(c1, c2) values(262, 262);
insert into test.table_range(c1, c2) values(262, 262);
insert into test.table_hash_range(c1, c2) values(262, 262);
insert into test.table_range_hash(c1, c2) values(262, 262);
insert into db1.tb_normal (pk) values(263);
insert into db1.tb_increment (c1) values(263);
insert into db1.tb_bigtable (c1,c2,c3,c4) values(repeat('A',65536),repeat('B',65536),repeat('C',65536),repeat('D',65536));
insert into test.tb_table_gencol(pk1,pk2,c1,c2) values(263,'263',repeat('A',65536),repeat('B',65536));
insert into test.tablegencol(c1,USER_ID,ADDRESS) values(263, repeat('A',32),repeat('B',256));
insert into test.table_hash(c1, c2) values(263, 263);
insert into test.table_range(c1, c2) values(263, 263);
insert into test.table_hash_range(c1, c2) values(263, 263);
insert into test.table_range_hash(c1, c2) values(263, 263);
insert into db1.tb_normal (pk) values(264);
insert into db1.tb_increment (c1) values(264);
insert into db1.tb_bigtable (c1,c2,c3,c4) values(repeat('A',65536),repeat('B',65536),repeat('C',65536),repeat('D',65536));
insert into test.tb_table_gencol(pk1,pk2,c1,c2) values(264,'264',repeat('A',65536),repeat('B',65536));
insert into test.tablegencol(c1,USER_ID,ADDRESS) values(264, repeat('A',32),repeat('B',256));
insert into test.table_hash(c1, c2) values(264, 264);
insert into test.table_range(c1, c2) values(264, 264);
insert into test.table_hash_range(c1, c2) values(264, 264);
insert into test.table_range_hash(c1, c2) values(264, 264);
insert into db1.tb_normal (pk) values(265);
insert into db1.tb_increment (c1) values(265);
insert into db1.tb_bigtable (c1,c2,c3,c4) values(repeat('A',65536),repeat('B',65536),repeat('C',65536),repeat('D',65536));
insert into test.tb_table_gencol(pk1,pk2,c1,c2) values(265,'265',repeat('A',65536),repeat('B',65536));
insert into test.tablegencol(c1,USER_ID,ADDRESS) values(265, repeat('A',32),repeat('B',256));
insert into test.table_hash(c1, c2) values(265, 265);
insert into test.table_range(c1, c2) values(265, 265);
insert into test.table_hash_range(c1, c2) values(265, 265);
insert into test.table_range_hash(c1, c2) values(265, 265);
insert into db1.tb_normal (pk) values(266);
insert into db1.tb_increment (c1) values(266);
insert into db1.tb_bigtable (c1,c2,c3,c4) values(repeat('A',65536),repeat('B',65536),repeat('C',65536),repeat('D',65536));
insert into test.tb_table_gencol(pk1,pk2,c1,c2) values(266,'266',repeat('A',65536),repeat('B',65536));
insert into test.tablegencol(c1,USER_ID,ADDRESS) values(266, repeat('A',32),repeat('B',256));
insert into test.table_hash(c1, c2) values(266, 266);
insert into test.table_range(c1, c2) values(266, 266);
insert into test.table_hash_range(c1, c2) values(266, 266);
insert into test.table_range_hash(c1, c2) values(266, 266);
insert into db1.tb_normal (pk) values(267);
insert into db1.tb_increment (c1) values(267);
insert into db1.tb_bigtable (c1,c2,c3,c4) values(repeat('A',65536),repeat('B',65536),repeat('C',65536),repeat('D',65536));
insert into test.tb_table_gencol(pk1,pk2,c1,c2) values(267,'267',repeat('A',65536),repeat('B',65536));
insert into test.tablegencol(c1,USER_ID,ADDRESS) values(267, repeat('A',32),repeat('B',256));
insert into test.table_hash(c1, c2) values(267, 267);
insert into test.table_range(c1, c2) values(267, 267);
insert into test.table_hash_range(c1, c2) values(267, 267);
insert into test.table_range_hash(c1, c2) values(267, 267);
insert into db1.tb_normal (pk) values(268);
insert into db1.tb_increment (c1) values(268);
insert into db1.tb_bigtable (c1,c2,c3,c4) values(repeat('A',65536),repeat('B',65536),repeat('C',65536),repeat('D',65536));
insert into test.tb_table_gencol(pk1,pk2,c1,c2) values(268,'268',repeat('A',65536),repeat('B',65536));
insert into test.tablegencol(c1,USER_ID,ADDRESS) values(268, repeat('A',32),repeat('B',256));
insert into test.table_hash(c1, c2) values(268, 268);
insert into test.table_range(c1, c2) values(268, 268);
insert into test.table_hash_range(c1, c2) values(268, 268);
insert into test.table_range_hash(c1, c2) values(268, 268);
insert into db1.tb_normal (pk) values(269);
insert into db1.tb_increment (c1) values(269);
insert into db1.tb_bigtable (c1,c2,c3,c4) values(repeat('A',65536),repeat('B',65536),repeat('C',65536),repeat('D',65536));
insert into test.tb_table_gencol(pk1,pk2,c1,c2) values(269,'269',repeat('A',65536),repeat('B',65536));
insert into test.tablegencol(c1,USER_ID,ADDRESS) values(269, repeat('A',32),repeat('B',256));
insert into test.table_hash(c1, c2) values(269, 269);
insert into test.table_range(c1, c2) values(269, 269);
insert into test.table_hash_range(c1, c2) values(269, 269);
insert into test.table_range_hash(c1, c2) values(269, 269);
insert into db1.tb_normal (pk) values(270);
insert into db1.tb_increment (c1) values(270);
insert into db1.tb_bigtable (c1,c2,c3,c4) values(repeat('A',65536),repeat('B',65536),repeat('C',65536),repeat('D',65536));
insert into test.tb_table_gencol(pk1,pk2,c1,c2) values(270,'270',repeat('A',65536),repeat('B',65536));
insert into test.tablegencol(c1,USER_ID,ADDRESS) values(270, repeat('A',32),repeat('B',256));
insert into test.table_hash(c1, c2) values(270, 270);
insert into test.table_range(c1, c2) values(270, 270);
insert into test.table_hash_range(c1, c2) values(270, 270);
insert into test.table_range_hash(c1, c2) values(270, 270);
insert into db1.tb_normal (pk) values(271);
insert into db1.tb_increment (c1) values(271);
insert into db1.tb_bigtable (c1,c2,c3,c4) values(repeat('A',65536),repeat('B',65536),repeat('C',65536),repeat('D',65536));
insert into test.tb_table_gencol(pk1,pk2,c1,c2) values(271,'271',repeat('A',65536),repeat('B',65536));
insert into test.tablegencol(c1,USER_ID,ADDRESS) values(271, repeat('A',32),repeat('B',256));
insert into test.table_hash(c1, c2) values(271, 271);
insert into test.table_range(c1, c2) values(271, 271);
insert into test.table_hash_range(c1, c2) values(271, 271);
insert into test.table_range_hash(c1, c2) values(271, 271);
insert into db1.tb_normal (pk) values(272);
insert into db1.tb_increment (c1) values(272);
insert into db1.tb_bigtable (c1,c2,c3,c4) values(repeat('A',65536),repeat('B',65536),repeat('C',65536),repeat('D',65536));
insert into test.tb_table_gencol(pk1,pk2,c1,c2) values(272,'272',repeat('A',65536),repeat('B',65536));
insert into test.tablegencol(c1,USER_ID,ADDRESS) values(272, repeat('A',32),repeat('B',256));
insert into test.table_hash(c1, c2) values(272, 272);
insert into test.table_range(c1, c2) values(272, 272);
insert into test.table_hash_range(c1, c2) values(272, 272);
insert into test.table_range_hash(c1, c2) values(272, 272);
insert into db1.tb_normal (pk) values(273);
insert into db1.tb_increment (c1) values(273);
insert into db1.tb_bigtable (c1,c2,c3,c4) values(repeat('A',65536),repeat('B',65536),repeat('C',65536),repeat('D',65536));
insert into test.tb_table_gencol(pk1,pk2,c1,c2) values(273,'273',repeat('A',65536),repeat('B',65536));
insert into test.tablegencol(c1,USER_ID,ADDRESS) values(273, repeat('A',32),repeat('B',256));
insert into test.table_hash(c1, c2) values(273, 273);
insert into test.table_range(c1, c2) values(273, 273);
insert into test.table_hash_range(c1, c2) values(273, 273);
insert into test.table_range_hash(c1, c2) values(273, 273);
insert into db1.tb_normal (pk) values(274);
insert into db1.tb_increment (c1) values(274);
insert into db1.tb_bigtable (c1,c2,c3,c4) values(repeat('A',65536),repeat('B',65536),repeat('C',65536),repeat('D',65536));
insert into test.tb_table_gencol(pk1,pk2,c1,c2) values(274,'274',repeat('A',65536),repeat('B',65536));
insert into test.tablegencol(c1,USER_ID,ADDRESS) values(274, repeat('A',32),repeat('B',256));
insert into test.table_hash(c1, c2) values(274, 274);
insert into test.table_range(c1, c2) values(274, 274);
insert into test.table_hash_range(c1, c2) values(274, 274);
insert into test.table_range_hash(c1, c2) values(274, 274);
insert into db1.tb_normal (pk) values(275);
insert into db1.tb_increment (c1) values(275);
insert into db1.tb_bigtable (c1,c2,c3,c4) values(repeat('A',65536),repeat('B',65536),repeat('C',65536),repeat('D',65536));
insert into test.tb_table_gencol(pk1,pk2,c1,c2) values(275,'275',repeat('A',65536),repeat('B',65536));
insert into test.tablegencol(c1,USER_ID,ADDRESS) values(275, repeat('A',32),repeat('B',256));
insert into test.table_hash(c1, c2) values(275, 275);
insert into test.table_range(c1, c2) values(275, 275);
insert into test.table_hash_range(c1, c2) values(275, 275);
insert into test.table_range_hash(c1, c2) values(275, 275);
insert into db1.tb_normal (pk) values(276);
insert into db1.tb_increment (c1) values(276);
insert into db1.tb_bigtable (c1,c2,c3,c4) values(repeat('A',65536),repeat('B',65536),repeat('C',65536),repeat('D',65536));
insert into test.tb_table_gencol(pk1,pk2,c1,c2) values(276,'276',repeat('A',65536),repeat('B',65536));
insert into test.tablegencol(c1,USER_ID,ADDRESS) values(276, repeat('A',32),repeat('B',256));
insert into test.table_hash(c1, c2) values(276, 276);
insert into test.table_range(c1, c2) values(276, 276);
insert into test.table_hash_range(c1, c2) values(276, 276);
insert into test.table_range_hash(c1, c2) values(276, 276);
insert into db1.tb_normal (pk) values(277);
insert into db1.tb_increment (c1) values(277);
insert into db1.tb_bigtable (c1,c2,c3,c4) values(repeat('A',65536),repeat('B',65536),repeat('C',65536),repeat('D',65536));
insert into test.tb_table_gencol(pk1,pk2,c1,c2) values(277,'277',repeat('A',65536),repeat('B',65536));
insert into test.tablegencol(c1,USER_ID,ADDRESS) values(277, repeat('A',32),repeat('B',256));
insert into test.table_hash(c1, c2) values(277, 277);
insert into test.table_range(c1, c2) values(277, 277);
insert into test.table_hash_range(c1, c2) values(277, 277);
insert into test.table_range_hash(c1, c2) values(277, 277);
insert into db1.tb_normal (pk) values(278);
insert into db1.tb_increment (c1) values(278);
insert into db1.tb_bigtable (c1,c2,c3,c4) values(repeat('A',65536),repeat('B',65536),repeat('C',65536),repeat('D',65536));
insert into test.tb_table_gencol(pk1,pk2,c1,c2) values(278,'278',repeat('A',65536),repeat('B',65536));
insert into test.tablegencol(c1,USER_ID,ADDRESS) values(278, repeat('A',32),repeat('B',256));
insert into test.table_hash(c1, c2) values(278, 278);
insert into test.table_range(c1, c2) values(278, 278);
insert into test.table_hash_range(c1, c2) values(278, 278);
insert into test.table_range_hash(c1, c2) values(278, 278);
insert into db1.tb_normal (pk) values(279);
insert into db1.tb_increment (c1) values(279);
insert into db1.tb_bigtable (c1,c2,c3,c4) values(repeat('A',65536),repeat('B',65536),repeat('C',65536),repeat('D',65536));
insert into test.tb_table_gencol(pk1,pk2,c1,c2) values(279,'279',repeat('A',65536),repeat('B',65536));
insert into test.tablegencol(c1,USER_ID,ADDRESS) values(279, repeat('A',32),repeat('B',256));
insert into test.table_hash(c1, c2) values(279, 279);
insert into test.table_range(c1, c2) values(279, 279);
insert into test.table_hash_range(c1, c2) values(279, 279);
insert into test.table_range_hash(c1, c2) values(279, 279);
insert into db1.tb_normal (pk) values(280);
insert into db1.tb_increment (c1) values(280);
insert into db1.tb_bigtable (c1,c2,c3,c4) values(repeat('A',65536),repeat('B',65536),repeat('C',65536),repeat('D',65536));
insert into test.tb_table_gencol(pk1,pk2,c1,c2) values(280,'280',repeat('A',65536),repeat('B',65536));
insert into test.tablegencol(c1,USER_ID,ADDRESS) values(280, repeat('A',32),repeat('B',256));
insert into test.table_hash(c1, c2) values(280, 280);
insert into test.table_range(c1, c2) values(280, 280);
insert into test.table_hash_range(c1, c2) values(280, 280);
insert into test.table_range_hash(c1, c2) values(280, 280);
insert into db1.tb_normal (pk) values(281);
insert into db1.tb_increment (c1) values(281);
insert into db1.tb_bigtable (c1,c2,c3,c4) values(repeat('A',65536),repeat('B',65536),repeat('C',65536),repeat('D',65536));
insert into test.tb_table_gencol(pk1,pk2,c1,c2) values(281,'281',repeat('A',65536),repeat('B',65536));
insert into test.tablegencol(c1,USER_ID,ADDRESS) values(281, repeat('A',32),repeat('B',256));
insert into test.table_hash(c1, c2) values(281, 281);
insert into test.table_range(c1, c2) values(281, 281);
insert into test.table_hash_range(c1, c2) values(281, 281);
insert into test.table_range_hash(c1, c2) values(281, 281);
insert into db1.tb_normal (pk) values(282);
insert into db1.tb_increment (c1) values(282);
insert into db1.tb_bigtable (c1,c2,c3,c4) values(repeat('A',65536),repeat('B',65536),repeat('C',65536),repeat('D',65536));
insert into test.tb_table_gencol(pk1,pk2,c1,c2) values(282,'282',repeat('A',65536),repeat('B',65536));
insert into test.tablegencol(c1,USER_ID,ADDRESS) values(282, repeat('A',32),repeat('B',256));
insert into test.table_hash(c1, c2) values(282, 282);
insert into test.table_range(c1, c2) values(282, 282);
insert into test.table_hash_range(c1, c2) values(282, 282);
insert into test.table_range_hash(c1, c2) values(282, 282);
insert into db1.tb_normal (pk) values(283);
insert into db1.tb_increment (c1) values(283);
insert into db1.tb_bigtable (c1,c2,c3,c4) values(repeat('A',65536),repeat('B',65536),repeat('C',65536),repeat('D',65536));
insert into test.tb_table_gencol(pk1,pk2,c1,c2) values(283,'283',repeat('A',65536),repeat('B',65536));
insert into test.tablegencol(c1,USER_ID,ADDRESS) values(283, repeat('A',32),repeat('B',256));
insert into test.table_hash(c1, c2) values(283, 283);
insert into test.table_range(c1, c2) values(283, 283);
insert into test.table_hash_range(c1, c2) values(283, 283);
insert into test.table_range_hash(c1, c2) values(283, 283);
insert into db1.tb_normal (pk) values(284);
insert into db1.tb_increment (c1) values(284);
insert into db1.tb_bigtable (c1,c2,c3,c4) values(repeat('A',65536),repeat('B',65536),repeat('C',65536),repeat('D',65536));
insert into test.tb_table_gencol(pk1,pk2,c1,c2) values(284,'284',repeat('A',65536),repeat('B',65536));
insert into test.tablegencol(c1,USER_ID,ADDRESS) values(284, repeat('A',32),repeat('B',256));
insert into test.table_hash(c1, c2) values(284, 284);
insert into test.table_range(c1, c2) values(284, 284);
insert into test.table_hash_range(c1, c2) values(284, 284);
insert into test.table_range_hash(c1, c2) values(284, 284);
insert into db1.tb_normal (pk) values(285);
insert into db1.tb_increment (c1) values(285);
insert into db1.tb_bigtable (c1,c2,c3,c4) values(repeat('A',65536),repeat('B',65536),repeat('C',65536),repeat('D',65536));
insert into test.tb_table_gencol(pk1,pk2,c1,c2) values(285,'285',repeat('A',65536),repeat('B',65536));
insert into test.tablegencol(c1,USER_ID,ADDRESS) values(285, repeat('A',32),repeat('B',256));
insert into test.table_hash(c1, c2) values(285, 285);
insert into test.table_range(c1, c2) values(285, 285);
insert into test.table_hash_range(c1, c2) values(285, 285);
insert into test.table_range_hash(c1, c2) values(285, 285);
insert into db1.tb_normal (pk) values(286);
insert into db1.tb_increment (c1) values(286);
insert into db1.tb_bigtable (c1,c2,c3,c4) values(repeat('A',65536),repeat('B',65536),repeat('C',65536),repeat('D',65536));
insert into test.tb_table_gencol(pk1,pk2,c1,c2) values(286,'286',repeat('A',65536),repeat('B',65536));
insert into test.tablegencol(c1,USER_ID,ADDRESS) values(286, repeat('A',32),repeat('B',256));
insert into test.table_hash(c1, c2) values(286, 286);
insert into test.table_range(c1, c2) values(286, 286);
insert into test.table_hash_range(c1, c2) values(286, 286);
insert into test.table_range_hash(c1, c2) values(286, 286);
insert into db1.tb_normal (pk) values(287);
insert into db1.tb_increment (c1) values(287);
insert into db1.tb_bigtable (c1,c2,c3,c4) values(repeat('A',65536),repeat('B',65536),repeat('C',65536),repeat('D',65536));
insert into test.tb_table_gencol(pk1,pk2,c1,c2) values(287,'287',repeat('A',65536),repeat('B',65536));
insert into test.tablegencol(c1,USER_ID,ADDRESS) values(287, repeat('A',32),repeat('B',256));
insert into test.table_hash(c1, c2) values(287, 287);
insert into test.table_range(c1, c2) values(287, 287);
insert into test.table_hash_range(c1, c2) values(287, 287);
insert into test.table_range_hash(c1, c2) values(287, 287);
insert into db1.tb_normal (pk) values(288);
insert into db1.tb_increment (c1) values(288);
insert into db1.tb_bigtable (c1,c2,c3,c4) values(repeat('A',65536),repeat('B',65536),repeat('C',65536),repeat('D',65536));
insert into test.tb_table_gencol(pk1,pk2,c1,c2) values(288,'288',repeat('A',65536),repeat('B',65536));
insert into test.tablegencol(c1,USER_ID,ADDRESS) values(288, repeat('A',32),repeat('B',256));
insert into test.table_hash(c1, c2) values(288, 288);
insert into test.table_range(c1, c2) values(288, 288);
insert into test.table_hash_range(c1, c2) values(288, 288);
insert into test.table_range_hash(c1, c2) values(288, 288);
insert into db1.tb_normal (pk) values(289);
insert into db1.tb_increment (c1) values(289);
insert into db1.tb_bigtable (c1,c2,c3,c4) values(repeat('A',65536),repeat('B',65536),repeat('C',65536),repeat('D',65536));
insert into test.tb_table_gencol(pk1,pk2,c1,c2) values(289,'289',repeat('A',65536),repeat('B',65536));
insert into test.tablegencol(c1,USER_ID,ADDRESS) values(289, repeat('A',32),repeat('B',256));
insert into test.table_hash(c1, c2) values(289, 289);
insert into test.table_range(c1, c2) values(289, 289);
insert into test.table_hash_range(c1, c2) values(289, 289);
insert into test.table_range_hash(c1, c2) values(289, 289);
insert into db1.tb_normal (pk) values(290);
insert into db1.tb_increment (c1) values(290);
insert into db1.tb_bigtable (c1,c2,c3,c4) values(repeat('A',65536),repeat('B',65536),repeat('C',65536),repeat('D',65536));
insert into test.tb_table_gencol(pk1,pk2,c1,c2) values(290,'290',repeat('A',65536),repeat('B',65536));
insert into test.tablegencol(c1,USER_ID,ADDRESS) values(290, repeat('A',32),repeat('B',256));
insert into test.table_hash(c1, c2) values(290, 290);
insert into test.table_range(c1, c2) values(290, 290);
insert into test.table_hash_range(c1, c2) values(290, 290);
insert into test.table_range_hash(c1, c2) values(290, 290);
insert into db1.tb_normal (pk) values(291);
insert into db1.tb_increment (c1) values(291);
insert into db1.tb_bigtable (c1,c2,c3,c4) values(repeat('A',65536),repeat('B',65536),repeat('C',65536),repeat('D',65536));
insert into test.tb_table_gencol(pk1,pk2,c1,c2) values(291,'291',repeat('A',65536),repeat('B',65536));
insert into test.tablegencol(c1,USER_ID,ADDRESS) values(291, repeat('A',32),repeat('B',256));
insert into test.table_hash(c1, c2) values(291, 291);
insert into test.table_range(c1, c2) values(291, 291);
insert into test.table_hash_range(c1, c2) values(291, 291);
insert into test.table_range_hash(c1, c2) values(291, 291);
insert into db1.tb_normal (pk) values(292);
insert into db1.tb_increment (c1) values(292);
insert into db1.tb_bigtable (c1,c2,c3,c4) values(repeat('A',65536),repeat('B',65536),repeat('C',65536),repeat('D',65536));
insert into test.tb_table_gencol(pk1,pk2,c1,c2) values(292,'292',repeat('A',65536),repeat('B',65536));
insert into test.tablegencol(c1,USER_ID,ADDRESS) values(292, repeat('A',32),repeat('B',256));
insert into test.table_hash(c1, c2) values(292, 292);
insert into test.table_range(c1, c2) values(292, 292);
insert into test.table_hash_range(c1, c2) values(292, 292);
insert into test.table_range_hash(c1, c2) values(292, 292);
insert into db1.tb_normal (pk) values(293);
insert into db1.tb_increment (c1) values(293);
insert into db1.tb_bigtable (c1,c2,c3,c4) values(repeat('A',65536),repeat('B',65536),repeat('C',65536),repeat('D',65536));
insert into test.tb_table_gencol(pk1,pk2,c1,c2) values(293,'293',repeat('A',65536),repeat('B',65536));
insert into test.tablegencol(c1,USER_ID,ADDRESS) values(293, repeat('A',32),repeat('B',256));
insert into test.table_hash(c1, c2) values(293, 293);
insert into test.table_range(c1, c2) values(293, 293);
insert into test.table_hash_range(c1, c2) values(293, 293);
insert into test.table_range_hash(c1, c2) values(293, 293);
insert into db1.tb_normal (pk) values(294);
insert into db1.tb_increment (c1) values(294);
insert into db1.tb_bigtable (c1,c2,c3,c4) values(repeat('A',65536),repeat('B',65536),repeat('C',65536),repeat('D',65536));
insert into test.tb_table_gencol(pk1,pk2,c1,c2) values(294,'294',repeat('A',65536),repeat('B',65536));
insert into test.tablegencol(c1,USER_ID,ADDRESS) values(294, repeat('A',32),repeat('B',256));
insert into test.table_hash(c1, c2) values(294, 294);
insert into test.table_range(c1, c2) values(294, 294);
insert into test.table_hash_range(c1, c2) values(294, 294);
insert into test.table_range_hash(c1, c2) values(294, 294);
insert into db1.tb_normal (pk) values(295);
insert into db1.tb_increment (c1) values(295);
insert into db1.tb_bigtable (c1,c2,c3,c4) values(repeat('A',65536),repeat('B',65536),repeat('C',65536),repeat('D',65536));
insert into test.tb_table_gencol(pk1,pk2,c1,c2) values(295,'295',repeat('A',65536),repeat('B',65536));
insert into test.tablegencol(c1,USER_ID,ADDRESS) values(295, repeat('A',32),repeat('B',256));
insert into test.table_hash(c1, c2) values(295, 295);
insert into test.table_range(c1, c2) values(295, 295);
insert into test.table_hash_range(c1, c2) values(295, 295);
insert into test.table_range_hash(c1, c2) values(295, 295);
insert into db1.tb_normal (pk) values(296);
insert into db1.tb_increment (c1) values(296);
insert into db1.tb_bigtable (c1,c2,c3,c4) values(repeat('A',65536),repeat('B',65536),repeat('C',65536),repeat('D',65536));
insert into test.tb_table_gencol(pk1,pk2,c1,c2) values(296,'296',repeat('A',65536),repeat('B',65536));
insert into test.tablegencol(c1,USER_ID,ADDRESS) values(296, repeat('A',32),repeat('B',256));
insert into test.table_hash(c1, c2) values(296, 296);
insert into test.table_range(c1, c2) values(296, 296);
insert into test.table_hash_range(c1, c2) values(296, 296);
insert into test.table_range_hash(c1, c2) values(296, 296);
insert into db1.tb_normal (pk) values(297);
insert into db1.tb_increment (c1) values(297);
insert into db1.tb_bigtable (c1,c2,c3,c4) values(repeat('A',65536),repeat('B',65536),repeat('C',65536),repeat('D',65536));
insert into test.tb_table_gencol(pk1,pk2,c1,c2) values(297,'297',repeat('A',65536),repeat('B',65536));
insert into test.tablegencol(c1,USER_ID,ADDRESS) values(297, repeat('A',32),repeat('B',256));
insert into test.table_hash(c1, c2) values(297, 297);
insert into test.table_range(c1, c2) values(297, 297);
insert into test.table_hash_range(c1, c2) values(297, 297);
insert into test.table_range_hash(c1, c2) values(297, 297);
insert into db1.tb_normal (pk) values(298);
insert into db1.tb_increment (c1) values(298);
insert into db1.tb_bigtable (c1,c2,c3,c4) values(repeat('A',65536),repeat('B',65536),repeat('C',65536),repeat('D',65536));
insert into test.tb_table_gencol(pk1,pk2,c1,c2) values(298,'298',repeat('A',65536),repeat('B',65536));
insert into test.tablegencol(c1,USER_ID,ADDRESS) values(298, repeat('A',32),repeat('B',256));
insert into test.table_hash(c1, c2) values(298, 298);
insert into test.table_range(c1, c2) values(298, 298);
insert into test.table_hash_range(c1, c2) values(298, 298);
insert into test.table_range_hash(c1, c2) values(298, 298);
insert into db1.tb_normal (pk) values(299);
insert into db1.tb_increment (c1) values(299);
insert into db1.tb_bigtable (c1,c2,c3,c4) values(repeat('A',65536),repeat('B',65536),repeat('C',65536),repeat('D',65536));
insert into test.tb_table_gencol(pk1,pk2,c1,c2) values(299,'299',repeat('A',65536),repeat('B',65536));
insert into test.tablegencol(c1,USER_ID,ADDRESS) values(299, repeat('A',32),repeat('B',256));
insert into test.table_hash(c1, c2) values(299, 299);
insert into test.table_range(c1, c2) values(299, 299);
insert into test.table_hash_range(c1, c2) values(299, 299);
insert into test.table_range_hash(c1, c2) values(299, 299);
insert into db1.tb_normal (pk) values(300);
insert into db1.tb_increment (c1) values(300);
insert into db1.tb_bigtable (c1,c2,c3,c4) values(repeat('A',65536),repeat('B',65536),repeat('C',65536),repeat('D',65536));
insert into test.tb_table_gencol(pk1,pk2,c1,c2) values(300,'300',repeat('A',65536),repeat('B',65536));
insert into test.tablegencol(c1,USER_ID,ADDRESS) values(300, repeat('A',32),repeat('B',256));
insert into test.table_hash(c1, c2) values(300, 300);
insert into test.table_range(c1, c2) values(300, 300);
insert into test.table_hash_range(c1, c2) values(300, 300);
insert into test.table_range_hash(c1, c2) values(300, 300);
update db1.tb_normal set c1=1 where pk = 1;
update db1.tb_increment set c1 = 1 where pk = 1;
insert into db1.tb_bigtable (c1,c2,c3,c4) values(repeat('A',65536),repeat('B',65536),repeat('C',65536),repeat('D',65536));
replace into test.tb_table_gencol(pk1,pk2,c1,c2) values(1,'1',repeat('A',65536),repeat('B',65536));
replace into test.tablegencol(c1,USER_ID,ADDRESS) values(1, repeat('A',32),repeat('B',256));
replace into test.table_hash(c1, c2) values(1, 1);
replace into test.table_range(c1, c2) values(1, 1);
replace into test.table_hash_range(c1, c2) values(1, 1);
replace into test.table_range_hash(c1, c2) values(1, 1);
update db1.tb_normal set c1=2 where pk = 2;
update db1.tb_increment set c1 = 2 where pk = 2;
insert into db1.tb_bigtable (c1,c2,c3,c4) values(repeat('A',65536),repeat('B',65536),repeat('C',65536),repeat('D',65536));
replace into test.tb_table_gencol(pk1,pk2,c1,c2) values(2,'2',repeat('A',65536),repeat('B',65536));
replace into test.tablegencol(c1,USER_ID,ADDRESS) values(2, repeat('A',32),repeat('B',256));
replace into test.table_hash(c1, c2) values(2, 2);
replace into test.table_range(c1, c2) values(2, 2);
replace into test.table_hash_range(c1, c2) values(2, 2);
replace into test.table_range_hash(c1, c2) values(2, 2);
update db1.tb_normal set c1=3 where pk = 3;
update db1.tb_increment set c1 = 3 where pk = 3;
insert into db1.tb_bigtable (c1,c2,c3,c4) values(repeat('A',65536),repeat('B',65536),repeat('C',65536),repeat('D',65536));
replace into test.tb_table_gencol(pk1,pk2,c1,c2) values(3,'3',repeat('A',65536),repeat('B',65536));
replace into test.tablegencol(c1,USER_ID,ADDRESS) values(3, repeat('A',32),repeat('B',256));
replace into test.table_hash(c1, c2) values(3, 3);
replace into test.table_range(c1, c2) values(3, 3);
replace into test.table_hash_range(c1, c2) values(3, 3);
replace into test.table_range_hash(c1, c2) values(3, 3);
update db1.tb_normal set c1=4 where pk = 4;
update db1.tb_increment set c1 = 4 where pk = 4;
insert into db1.tb_bigtable (c1,c2,c3,c4) values(repeat('A',65536),repeat('B',65536),repeat('C',65536),repeat('D',65536));
replace into test.tb_table_gencol(pk1,pk2,c1,c2) values(4,'4',repeat('A',65536),repeat('B',65536));
replace into test.tablegencol(c1,USER_ID,ADDRESS) values(4, repeat('A',32),repeat('B',256));
replace into test.table_hash(c1, c2) values(4, 4);
replace into test.table_range(c1, c2) values(4, 4);
replace into test.table_hash_range(c1, c2) values(4, 4);
replace into test.table_range_hash(c1, c2) values(4, 4);
update db1.tb_normal set c1=5 where pk = 5;
update db1.tb_increment set c1 = 5 where pk = 5;
insert into db1.tb_bigtable (c1,c2,c3,c4) values(repeat('A',65536),repeat('B',65536),repeat('C',65536),repeat('D',65536));
replace into test.tb_table_gencol(pk1,pk2,c1,c2) values(5,'5',repeat('A',65536),repeat('B',65536));
replace into test.tablegencol(c1,USER_ID,ADDRESS) values(5, repeat('A',32),repeat('B',256));
replace into test.table_hash(c1, c2) values(5, 5);
replace into test.table_range(c1, c2) values(5, 5);
replace into test.table_hash_range(c1, c2) values(5, 5);
replace into test.table_range_hash(c1, c2) values(5, 5);
update db1.tb_normal set c1=6 where pk = 6;
update db1.tb_increment set c1 = 6 where pk = 6;
insert into db1.tb_bigtable (c1,c2,c3,c4) values(repeat('A',65536),repeat('B',65536),repeat('C',65536),repeat('D',65536));
replace into test.tb_table_gencol(pk1,pk2,c1,c2) values(6,'6',repeat('A',65536),repeat('B',65536));
replace into test.tablegencol(c1,USER_ID,ADDRESS) values(6, repeat('A',32),repeat('B',256));
replace into test.table_hash(c1, c2) values(6, 6);
replace into test.table_range(c1, c2) values(6, 6);
replace into test.table_hash_range(c1, c2) values(6, 6);
replace into test.table_range_hash(c1, c2) values(6, 6);
update db1.tb_normal set c1=7 where pk = 7;
update db1.tb_increment set c1 = 7 where pk = 7;
insert into db1.tb_bigtable (c1,c2,c3,c4) values(repeat('A',65536),repeat('B',65536),repeat('C',65536),repeat('D',65536));
replace into test.tb_table_gencol(pk1,pk2,c1,c2) values(7,'7',repeat('A',65536),repeat('B',65536));
replace into test.tablegencol(c1,USER_ID,ADDRESS) values(7, repeat('A',32),repeat('B',256));
replace into test.table_hash(c1, c2) values(7, 7);
replace into test.table_range(c1, c2) values(7, 7);
replace into test.table_hash_range(c1, c2) values(7, 7);
replace into test.table_range_hash(c1, c2) values(7, 7);
update db1.tb_normal set c1=8 where pk = 8;
update db1.tb_increment set c1 = 8 where pk = 8;
insert into db1.tb_bigtable (c1,c2,c3,c4) values(repeat('A',65536),repeat('B',65536),repeat('C',65536),repeat('D',65536));
replace into test.tb_table_gencol(pk1,pk2,c1,c2) values(8,'8',repeat('A',65536),repeat('B',65536));
replace into test.tablegencol(c1,USER_ID,ADDRESS) values(8, repeat('A',32),repeat('B',256));
replace into test.table_hash(c1, c2) values(8, 8);
replace into test.table_range(c1, c2) values(8, 8);
replace into test.table_hash_range(c1, c2) values(8, 8);
replace into test.table_range_hash(c1, c2) values(8, 8);
update db1.tb_normal set c1=9 where pk = 9;
update db1.tb_increment set c1 = 9 where pk = 9;
insert into db1.tb_bigtable (c1,c2,c3,c4) values(repeat('A',65536),repeat('B',65536),repeat('C',65536),repeat('D',65536));
replace into test.tb_table_gencol(pk1,pk2,c1,c2) values(9,'9',repeat('A',65536),repeat('B',65536));
replace into test.tablegencol(c1,USER_ID,ADDRESS) values(9, repeat('A',32),repeat('B',256));
replace into test.table_hash(c1, c2) values(9, 9);
replace into test.table_range(c1, c2) values(9, 9);
replace into test.table_hash_range(c1, c2) values(9, 9);
replace into test.table_range_hash(c1, c2) values(9, 9);
update db1.tb_normal set c1=10 where pk = 10;
update db1.tb_increment set c1 = 10 where pk = 10;
insert into db1.tb_bigtable (c1,c2,c3,c4) values(repeat('A',65536),repeat('B',65536),repeat('C',65536),repeat('D',65536));
replace into test.tb_table_gencol(pk1,pk2,c1,c2) values(10,'10',repeat('A',65536),repeat('B',65536));
replace into test.tablegencol(c1,USER_ID,ADDRESS) values(10, repeat('A',32),repeat('B',256));
replace into test.table_hash(c1, c2) values(10, 10);
replace into test.table_range(c1, c2) values(10, 10);
replace into test.table_hash_range(c1, c2) values(10, 10);
replace into test.table_range_hash(c1, c2) values(10, 10);
update db1.tb_normal set c1=11 where pk = 11;
update db1.tb_increment set c1 = 11 where pk = 11;
insert into db1.tb_bigtable (c1,c2,c3,c4) values(repeat('A',65536),repeat('B',65536),repeat('C',65536),repeat('D',65536));
replace into test.tb_table_gencol(pk1,pk2,c1,c2) values(11,'11',repeat('A',65536),repeat('B',65536));
replace into test.tablegencol(c1,USER_ID,ADDRESS) values(11, repeat('A',32),repeat('B',256));
replace into test.table_hash(c1, c2) values(11, 11);
replace into test.table_range(c1, c2) values(11, 11);
replace into test.table_hash_range(c1, c2) values(11, 11);
replace into test.table_range_hash(c1, c2) values(11, 11);
update db1.tb_normal set c1=12 where pk = 12;
update db1.tb_increment set c1 = 12 where pk = 12;
insert into db1.tb_bigtable (c1,c2,c3,c4) values(repeat('A',65536),repeat('B',65536),repeat('C',65536),repeat('D',65536));
replace into test.tb_table_gencol(pk1,pk2,c1,c2) values(12,'12',repeat('A',65536),repeat('B',65536));
replace into test.tablegencol(c1,USER_ID,ADDRESS) values(12, repeat('A',32),repeat('B',256));
replace into test.table_hash(c1, c2) values(12, 12);
replace into test.table_range(c1, c2) values(12, 12);
replace into test.table_hash_range(c1, c2) values(12, 12);
replace into test.table_range_hash(c1, c2) values(12, 12);
update db1.tb_normal set c1=13 where pk = 13;
update db1.tb_increment set c1 = 13 where pk = 13;
insert into db1.tb_bigtable (c1,c2,c3,c4) values(repeat('A',65536),repeat('B',65536),repeat('C',65536),repeat('D',65536));
replace into test.tb_table_gencol(pk1,pk2,c1,c2) values(13,'13',repeat('A',65536),repeat('B',65536));
replace into test.tablegencol(c1,USER_ID,ADDRESS) values(13, repeat('A',32),repeat('B',256));
replace into test.table_hash(c1, c2) values(13, 13);
replace into test.table_range(c1, c2) values(13, 13);
replace into test.table_hash_range(c1, c2) values(13, 13);
replace into test.table_range_hash(c1, c2) values(13, 13);
update db1.tb_normal set c1=14 where pk = 14;
update db1.tb_increment set c1 = 14 where pk = 14;
insert into db1.tb_bigtable (c1,c2,c3,c4) values(repeat('A',65536),repeat('B',65536),repeat('C',65536),repeat('D',65536));
replace into test.tb_table_gencol(pk1,pk2,c1,c2) values(14,'14',repeat('A',65536),repeat('B',65536));
replace into test.tablegencol(c1,USER_ID,ADDRESS) values(14, repeat('A',32),repeat('B',256));
replace into test.table_hash(c1, c2) values(14, 14);
replace into test.table_range(c1, c2) values(14, 14);
replace into test.table_hash_range(c1, c2) values(14, 14);
replace into test.table_range_hash(c1, c2) values(14, 14);
update db1.tb_normal set c1=15 where pk = 15;
update db1.tb_increment set c1 = 15 where pk = 15;
insert into db1.tb_bigtable (c1,c2,c3,c4) values(repeat('A',65536),repeat('B',65536),repeat('C',65536),repeat('D',65536));
replace into test.tb_table_gencol(pk1,pk2,c1,c2) values(15,'15',repeat('A',65536),repeat('B',65536));
replace into test.tablegencol(c1,USER_ID,ADDRESS) values(15, repeat('A',32),repeat('B',256));
replace into test.table_hash(c1, c2) values(15, 15);
replace into test.table_range(c1, c2) values(15, 15);
replace into test.table_hash_range(c1, c2) values(15, 15);
replace into test.table_range_hash(c1, c2) values(15, 15);
update db1.tb_normal set c1=16 where pk = 16;
update db1.tb_increment set c1 = 16 where pk = 16;
insert into db1.tb_bigtable (c1,c2,c3,c4) values(repeat('A',65536),repeat('B',65536),repeat('C',65536),repeat('D',65536));
replace into test.tb_table_gencol(pk1,pk2,c1,c2) values(16,'16',repeat('A',65536),repeat('B',65536));
replace into test.tablegencol(c1,USER_ID,ADDRESS) values(16, repeat('A',32),repeat('B',256));
replace into test.table_hash(c1, c2) values(16, 16);
replace into test.table_range(c1, c2) values(16, 16);
replace into test.table_hash_range(c1, c2) values(16, 16);
replace into test.table_range_hash(c1, c2) values(16, 16);
update db1.tb_normal set c1=17 where pk = 17;
update db1.tb_increment set c1 = 17 where pk = 17;
insert into db1.tb_bigtable (c1,c2,c3,c4) values(repeat('A',65536),repeat('B',65536),repeat('C',65536),repeat('D',65536));
replace into test.tb_table_gencol(pk1,pk2,c1,c2) values(17,'17',repeat('A',65536),repeat('B',65536));
replace into test.tablegencol(c1,USER_ID,ADDRESS) values(17, repeat('A',32),repeat('B',256));
replace into test.table_hash(c1, c2) values(17, 17);
replace into test.table_range(c1, c2) values(17, 17);
replace into test.table_hash_range(c1, c2) values(17, 17);
replace into test.table_range_hash(c1, c2) values(17, 17);
update db1.tb_normal set c1=18 where pk = 18;
update db1.tb_increment set c1 = 18 where pk = 18;
insert into db1.tb_bigtable (c1,c2,c3,c4) values(repeat('A',65536),repeat('B',65536),repeat('C',65536),repeat('D',65536));
replace into test.tb_table_gencol(pk1,pk2,c1,c2) values(18,'18',repeat('A',65536),repeat('B',65536));
replace into test.tablegencol(c1,USER_ID,ADDRESS) values(18, repeat('A',32),repeat('B',256));
replace into test.table_hash(c1, c2) values(18, 18);
replace into test.table_range(c1, c2) values(18, 18);
replace into test.table_hash_range(c1, c2) values(18, 18);
replace into test.table_range_hash(c1, c2) values(18, 18);
update db1.tb_normal set c1=19 where pk = 19;
update db1.tb_increment set c1 = 19 where pk = 19;
insert into db1.tb_bigtable (c1,c2,c3,c4) values(repeat('A',65536),repeat('B',65536),repeat('C',65536),repeat('D',65536));
replace into test.tb_table_gencol(pk1,pk2,c1,c2) values(19,'19',repeat('A',65536),repeat('B',65536));
replace into test.tablegencol(c1,USER_ID,ADDRESS) values(19, repeat('A',32),repeat('B',256));
replace into test.table_hash(c1, c2) values(19, 19);
replace into test.table_range(c1, c2) values(19, 19);
replace into test.table_hash_range(c1, c2) values(19, 19);
replace into test.table_range_hash(c1, c2) values(19, 19);
update db1.tb_normal set c1=20 where pk = 20;
update db1.tb_increment set c1 = 20 where pk = 20;
insert into db1.tb_bigtable (c1,c2,c3,c4) values(repeat('A',65536),repeat('B',65536),repeat('C',65536),repeat('D',65536));
replace into test.tb_table_gencol(pk1,pk2,c1,c2) values(20,'20',repeat('A',65536),repeat('B',65536));
replace into test.tablegencol(c1,USER_ID,ADDRESS) values(20, repeat('A',32),repeat('B',256));
replace into test.table_hash(c1, c2) values(20, 20);
replace into test.table_range(c1, c2) values(20, 20);
replace into test.table_hash_range(c1, c2) values(20, 20);
replace into test.table_range_hash(c1, c2) values(20, 20);
update db1.tb_normal set c1=21 where pk = 21;
update db1.tb_increment set c1 = 21 where pk = 21;
insert into db1.tb_bigtable (c1,c2,c3,c4) values(repeat('A',65536),repeat('B',65536),repeat('C',65536),repeat('D',65536));
replace into test.tb_table_gencol(pk1,pk2,c1,c2) values(21,'21',repeat('A',65536),repeat('B',65536));
replace into test.tablegencol(c1,USER_ID,ADDRESS) values(21, repeat('A',32),repeat('B',256));
replace into test.table_hash(c1, c2) values(21, 21);
replace into test.table_range(c1, c2) values(21, 21);
replace into test.table_hash_range(c1, c2) values(21, 21);
replace into test.table_range_hash(c1, c2) values(21, 21);
update db1.tb_normal set c1=22 where pk = 22;
update db1.tb_increment set c1 = 22 where pk = 22;
insert into db1.tb_bigtable (c1,c2,c3,c4) values(repeat('A',65536),repeat('B',65536),repeat('C',65536),repeat('D',65536));
replace into test.tb_table_gencol(pk1,pk2,c1,c2) values(22,'22',repeat('A',65536),repeat('B',65536));
replace into test.tablegencol(c1,USER_ID,ADDRESS) values(22, repeat('A',32),repeat('B',256));
replace into test.table_hash(c1, c2) values(22, 22);
replace into test.table_range(c1, c2) values(22, 22);
replace into test.table_hash_range(c1, c2) values(22, 22);
replace into test.table_range_hash(c1, c2) values(22, 22);
update db1.tb_normal set c1=23 where pk = 23;
update db1.tb_increment set c1 = 23 where pk = 23;
insert into db1.tb_bigtable (c1,c2,c3,c4) values(repeat('A',65536),repeat('B',65536),repeat('C',65536),repeat('D',65536));
replace into test.tb_table_gencol(pk1,pk2,c1,c2) values(23,'23',repeat('A',65536),repeat('B',65536));
replace into test.tablegencol(c1,USER_ID,ADDRESS) values(23, repeat('A',32),repeat('B',256));
replace into test.table_hash(c1, c2) values(23, 23);
replace into test.table_range(c1, c2) values(23, 23);
replace into test.table_hash_range(c1, c2) values(23, 23);
replace into test.table_range_hash(c1, c2) values(23, 23);
update db1.tb_normal set c1=24 where pk = 24;
update db1.tb_increment set c1 = 24 where pk = 24;
insert into db1.tb_bigtable (c1,c2,c3,c4) values(repeat('A',65536),repeat('B',65536),repeat('C',65536),repeat('D',65536));
replace into test.tb_table_gencol(pk1,pk2,c1,c2) values(24,'24',repeat('A',65536),repeat('B',65536));
replace into test.tablegencol(c1,USER_ID,ADDRESS) values(24, repeat('A',32),repeat('B',256));
replace into test.table_hash(c1, c2) values(24, 24);
replace into test.table_range(c1, c2) values(24, 24);
replace into test.table_hash_range(c1, c2) values(24, 24);
replace into test.table_range_hash(c1, c2) values(24, 24);
update db1.tb_normal set c1=25 where pk = 25;
update db1.tb_increment set c1 = 25 where pk = 25;
insert into db1.tb_bigtable (c1,c2,c3,c4) values(repeat('A',65536),repeat('B',65536),repeat('C',65536),repeat('D',65536));
replace into test.tb_table_gencol(pk1,pk2,c1,c2) values(25,'25',repeat('A',65536),repeat('B',65536));
replace into test.tablegencol(c1,USER_ID,ADDRESS) values(25, repeat('A',32),repeat('B',256));
replace into test.table_hash(c1, c2) values(25, 25);
replace into test.table_range(c1, c2) values(25, 25);
replace into test.table_hash_range(c1, c2) values(25, 25);
replace into test.table_range_hash(c1, c2) values(25, 25);
update db1.tb_normal set c1=26 where pk = 26;
update db1.tb_increment set c1 = 26 where pk = 26;
insert into db1.tb_bigtable (c1,c2,c3,c4) values(repeat('A',65536),repeat('B',65536),repeat('C',65536),repeat('D',65536));
replace into test.tb_table_gencol(pk1,pk2,c1,c2) values(26,'26',repeat('A',65536),repeat('B',65536));
replace into test.tablegencol(c1,USER_ID,ADDRESS) values(26, repeat('A',32),repeat('B',256));
replace into test.table_hash(c1, c2) values(26, 26);
replace into test.table_range(c1, c2) values(26, 26);
replace into test.table_hash_range(c1, c2) values(26, 26);
replace into test.table_range_hash(c1, c2) values(26, 26);
update db1.tb_normal set c1=27 where pk = 27;
update db1.tb_increment set c1 = 27 where pk = 27;
insert into db1.tb_bigtable (c1,c2,c3,c4) values(repeat('A',65536),repeat('B',65536),repeat('C',65536),repeat('D',65536));
replace into test.tb_table_gencol(pk1,pk2,c1,c2) values(27,'27',repeat('A',65536),repeat('B',65536));
replace into test.tablegencol(c1,USER_ID,ADDRESS) values(27, repeat('A',32),repeat('B',256));
replace into test.table_hash(c1, c2) values(27, 27);
replace into test.table_range(c1, c2) values(27, 27);
replace into test.table_hash_range(c1, c2) values(27, 27);
replace into test.table_range_hash(c1, c2) values(27, 27);
update db1.tb_normal set c1=28 where pk = 28;
update db1.tb_increment set c1 = 28 where pk = 28;
insert into db1.tb_bigtable (c1,c2,c3,c4) values(repeat('A',65536),repeat('B',65536),repeat('C',65536),repeat('D',65536));
replace into test.tb_table_gencol(pk1,pk2,c1,c2) values(28,'28',repeat('A',65536),repeat('B',65536));
replace into test.tablegencol(c1,USER_ID,ADDRESS) values(28, repeat('A',32),repeat('B',256));
replace into test.table_hash(c1, c2) values(28, 28);
replace into test.table_range(c1, c2) values(28, 28);
replace into test.table_hash_range(c1, c2) values(28, 28);
replace into test.table_range_hash(c1, c2) values(28, 28);
update db1.tb_normal set c1=29 where pk = 29;
update db1.tb_increment set c1 = 29 where pk = 29;
insert into db1.tb_bigtable (c1,c2,c3,c4) values(repeat('A',65536),repeat('B',65536),repeat('C',65536),repeat('D',65536));
replace into test.tb_table_gencol(pk1,pk2,c1,c2) values(29,'29',repeat('A',65536),repeat('B',65536));
replace into test.tablegencol(c1,USER_ID,ADDRESS) values(29, repeat('A',32),repeat('B',256));
replace into test.table_hash(c1, c2) values(29, 29);
replace into test.table_range(c1, c2) values(29, 29);
replace into test.table_hash_range(c1, c2) values(29, 29);
replace into test.table_range_hash(c1, c2) values(29, 29);
update db1.tb_normal set c1=30 where pk = 30;
update db1.tb_increment set c1 = 30 where pk = 30;
insert into db1.tb_bigtable (c1,c2,c3,c4) values(repeat('A',65536),repeat('B',65536),repeat('C',65536),repeat('D',65536));
replace into test.tb_table_gencol(pk1,pk2,c1,c2) values(30,'30',repeat('A',65536),repeat('B',65536));
replace into test.tablegencol(c1,USER_ID,ADDRESS) values(30, repeat('A',32),repeat('B',256));
replace into test.table_hash(c1, c2) values(30, 30);
replace into test.table_range(c1, c2) values(30, 30);
replace into test.table_hash_range(c1, c2) values(30, 30);
replace into test.table_range_hash(c1, c2) values(30, 30);
update db1.tb_normal set c1=31 where pk = 31;
update db1.tb_increment set c1 = 31 where pk = 31;
insert into db1.tb_bigtable (c1,c2,c3,c4) values(repeat('A',65536),repeat('B',65536),repeat('C',65536),repeat('D',65536));
replace into test.tb_table_gencol(pk1,pk2,c1,c2) values(31,'31',repeat('A',65536),repeat('B',65536));
replace into test.tablegencol(c1,USER_ID,ADDRESS) values(31, repeat('A',32),repeat('B',256));
replace into test.table_hash(c1, c2) values(31, 31);
replace into test.table_range(c1, c2) values(31, 31);
replace into test.table_hash_range(c1, c2) values(31, 31);
replace into test.table_range_hash(c1, c2) values(31, 31);
update db1.tb_normal set c1=32 where pk = 32;
update db1.tb_increment set c1 = 32 where pk = 32;
insert into db1.tb_bigtable (c1,c2,c3,c4) values(repeat('A',65536),repeat('B',65536),repeat('C',65536),repeat('D',65536));
replace into test.tb_table_gencol(pk1,pk2,c1,c2) values(32,'32',repeat('A',65536),repeat('B',65536));
replace into test.tablegencol(c1,USER_ID,ADDRESS) values(32, repeat('A',32),repeat('B',256));
replace into test.table_hash(c1, c2) values(32, 32);
replace into test.table_range(c1, c2) values(32, 32);
replace into test.table_hash_range(c1, c2) values(32, 32);
replace into test.table_range_hash(c1, c2) values(32, 32);
update db1.tb_normal set c1=33 where pk = 33;
update db1.tb_increment set c1 = 33 where pk = 33;
insert into db1.tb_bigtable (c1,c2,c3,c4) values(repeat('A',65536),repeat('B',65536),repeat('C',65536),repeat('D',65536));
replace into test.tb_table_gencol(pk1,pk2,c1,c2) values(33,'33',repeat('A',65536),repeat('B',65536));
replace into test.tablegencol(c1,USER_ID,ADDRESS) values(33, repeat('A',32),repeat('B',256));
replace into test.table_hash(c1, c2) values(33, 33);
replace into test.table_range(c1, c2) values(33, 33);
replace into test.table_hash_range(c1, c2) values(33, 33);
replace into test.table_range_hash(c1, c2) values(33, 33);
update db1.tb_normal set c1=34 where pk = 34;
update db1.tb_increment set c1 = 34 where pk = 34;
insert into db1.tb_bigtable (c1,c2,c3,c4) values(repeat('A',65536),repeat('B',65536),repeat('C',65536),repeat('D',65536));
replace into test.tb_table_gencol(pk1,pk2,c1,c2) values(34,'34',repeat('A',65536),repeat('B',65536));
replace into test.tablegencol(c1,USER_ID,ADDRESS) values(34, repeat('A',32),repeat('B',256));
replace into test.table_hash(c1, c2) values(34, 34);
replace into test.table_range(c1, c2) values(34, 34);
replace into test.table_hash_range(c1, c2) values(34, 34);
replace into test.table_range_hash(c1, c2) values(34, 34);
update db1.tb_normal set c1=35 where pk = 35;
update db1.tb_increment set c1 = 35 where pk = 35;
insert into db1.tb_bigtable (c1,c2,c3,c4) values(repeat('A',65536),repeat('B',65536),repeat('C',65536),repeat('D',65536));
replace into test.tb_table_gencol(pk1,pk2,c1,c2) values(35,'35',repeat('A',65536),repeat('B',65536));
replace into test.tablegencol(c1,USER_ID,ADDRESS) values(35, repeat('A',32),repeat('B',256));
replace into test.table_hash(c1, c2) values(35, 35);
replace into test.table_range(c1, c2) values(35, 35);
replace into test.table_hash_range(c1, c2) values(35, 35);
replace into test.table_range_hash(c1, c2) values(35, 35);
update db1.tb_normal set c1=36 where pk = 36;
update db1.tb_increment set c1 = 36 where pk = 36;
insert into db1.tb_bigtable (c1,c2,c3,c4) values(repeat('A',65536),repeat('B',65536),repeat('C',65536),repeat('D',65536));
replace into test.tb_table_gencol(pk1,pk2,c1,c2) values(36,'36',repeat('A',65536),repeat('B',65536));
replace into test.tablegencol(c1,USER_ID,ADDRESS) values(36, repeat('A',32),repeat('B',256));
replace into test.table_hash(c1, c2) values(36, 36);
replace into test.table_range(c1, c2) values(36, 36);
replace into test.table_hash_range(c1, c2) values(36, 36);
replace into test.table_range_hash(c1, c2) values(36, 36);
update db1.tb_normal set c1=37 where pk = 37;
update db1.tb_increment set c1 = 37 where pk = 37;
insert into db1.tb_bigtable (c1,c2,c3,c4) values(repeat('A',65536),repeat('B',65536),repeat('C',65536),repeat('D',65536));
replace into test.tb_table_gencol(pk1,pk2,c1,c2) values(37,'37',repeat('A',65536),repeat('B',65536));
replace into test.tablegencol(c1,USER_ID,ADDRESS) values(37, repeat('A',32),repeat('B',256));
replace into test.table_hash(c1, c2) values(37, 37);
replace into test.table_range(c1, c2) values(37, 37);
replace into test.table_hash_range(c1, c2) values(37, 37);
replace into test.table_range_hash(c1, c2) values(37, 37);
update db1.tb_normal set c1=38 where pk = 38;
update db1.tb_increment set c1 = 38 where pk = 38;
insert into db1.tb_bigtable (c1,c2,c3,c4) values(repeat('A',65536),repeat('B',65536),repeat('C',65536),repeat('D',65536));
replace into test.tb_table_gencol(pk1,pk2,c1,c2) values(38,'38',repeat('A',65536),repeat('B',65536));
replace into test.tablegencol(c1,USER_ID,ADDRESS) values(38, repeat('A',32),repeat('B',256));
replace into test.table_hash(c1, c2) values(38, 38);
replace into test.table_range(c1, c2) values(38, 38);
replace into test.table_hash_range(c1, c2) values(38, 38);
replace into test.table_range_hash(c1, c2) values(38, 38);
update db1.tb_normal set c1=39 where pk = 39;
update db1.tb_increment set c1 = 39 where pk = 39;
insert into db1.tb_bigtable (c1,c2,c3,c4) values(repeat('A',65536),repeat('B',65536),repeat('C',65536),repeat('D',65536));
replace into test.tb_table_gencol(pk1,pk2,c1,c2) values(39,'39',repeat('A',65536),repeat('B',65536));
replace into test.tablegencol(c1,USER_ID,ADDRESS) values(39, repeat('A',32),repeat('B',256));
replace into test.table_hash(c1, c2) values(39, 39);
replace into test.table_range(c1, c2) values(39, 39);
replace into test.table_hash_range(c1, c2) values(39, 39);
replace into test.table_range_hash(c1, c2) values(39, 39);
update db1.tb_normal set c1=40 where pk = 40;
update db1.tb_increment set c1 = 40 where pk = 40;
insert into db1.tb_bigtable (c1,c2,c3,c4) values(repeat('A',65536),repeat('B',65536),repeat('C',65536),repeat('D',65536));
replace into test.tb_table_gencol(pk1,pk2,c1,c2) values(40,'40',repeat('A',65536),repeat('B',65536));
replace into test.tablegencol(c1,USER_ID,ADDRESS) values(40, repeat('A',32),repeat('B',256));
replace into test.table_hash(c1, c2) values(40, 40);
replace into test.table_range(c1, c2) values(40, 40);
replace into test.table_hash_range(c1, c2) values(40, 40);
replace into test.table_range_hash(c1, c2) values(40, 40);
update db1.tb_normal set c1=41 where pk = 41;
update db1.tb_increment set c1 = 41 where pk = 41;
insert into db1.tb_bigtable (c1,c2,c3,c4) values(repeat('A',65536),repeat('B',65536),repeat('C',65536),repeat('D',65536));
replace into test.tb_table_gencol(pk1,pk2,c1,c2) values(41,'41',repeat('A',65536),repeat('B',65536));
replace into test.tablegencol(c1,USER_ID,ADDRESS) values(41, repeat('A',32),repeat('B',256));
replace into test.table_hash(c1, c2) values(41, 41);
replace into test.table_range(c1, c2) values(41, 41);
replace into test.table_hash_range(c1, c2) values(41, 41);
replace into test.table_range_hash(c1, c2) values(41, 41);
update db1.tb_normal set c1=42 where pk = 42;
update db1.tb_increment set c1 = 42 where pk = 42;
insert into db1.tb_bigtable (c1,c2,c3,c4) values(repeat('A',65536),repeat('B',65536),repeat('C',65536),repeat('D',65536));
replace into test.tb_table_gencol(pk1,pk2,c1,c2) values(42,'42',repeat('A',65536),repeat('B',65536));
replace into test.tablegencol(c1,USER_ID,ADDRESS) values(42, repeat('A',32),repeat('B',256));
replace into test.table_hash(c1, c2) values(42, 42);
replace into test.table_range(c1, c2) values(42, 42);
replace into test.table_hash_range(c1, c2) values(42, 42);
replace into test.table_range_hash(c1, c2) values(42, 42);
update db1.tb_normal set c1=43 where pk = 43;
update db1.tb_increment set c1 = 43 where pk = 43;
insert into db1.tb_bigtable (c1,c2,c3,c4) values(repeat('A',65536),repeat('B',65536),repeat('C',65536),repeat('D',65536));
replace into test.tb_table_gencol(pk1,pk2,c1,c2) values(43,'43',repeat('A',65536),repeat('B',65536));
replace into test.tablegencol(c1,USER_ID,ADDRESS) values(43, repeat('A',32),repeat('B',256));
replace into test.table_hash(c1, c2) values(43, 43);
replace into test.table_range(c1, c2) values(43, 43);
replace into test.table_hash_range(c1, c2) values(43, 43);
replace into test.table_range_hash(c1, c2) values(43, 43);
update db1.tb_normal set c1=44 where pk = 44;
update db1.tb_increment set c1 = 44 where pk = 44;
insert into db1.tb_bigtable (c1,c2,c3,c4) values(repeat('A',65536),repeat('B',65536),repeat('C',65536),repeat('D',65536));
replace into test.tb_table_gencol(pk1,pk2,c1,c2) values(44,'44',repeat('A',65536),repeat('B',65536));
replace into test.tablegencol(c1,USER_ID,ADDRESS) values(44, repeat('A',32),repeat('B',256));
replace into test.table_hash(c1, c2) values(44, 44);
replace into test.table_range(c1, c2) values(44, 44);
replace into test.table_hash_range(c1, c2) values(44, 44);
replace into test.table_range_hash(c1, c2) values(44, 44);
update db1.tb_normal set c1=45 where pk = 45;
update db1.tb_increment set c1 = 45 where pk = 45;
insert into db1.tb_bigtable (c1,c2,c3,c4) values(repeat('A',65536),repeat('B',65536),repeat('C',65536),repeat('D',65536));
replace into test.tb_table_gencol(pk1,pk2,c1,c2) values(45,'45',repeat('A',65536),repeat('B',65536));
replace into test.tablegencol(c1,USER_ID,ADDRESS) values(45, repeat('A',32),repeat('B',256));
replace into test.table_hash(c1, c2) values(45, 45);
replace into test.table_range(c1, c2) values(45, 45);
replace into test.table_hash_range(c1, c2) values(45, 45);
replace into test.table_range_hash(c1, c2) values(45, 45);
update db1.tb_normal set c1=46 where pk = 46;
update db1.tb_increment set c1 = 46 where pk = 46;
insert into db1.tb_bigtable (c1,c2,c3,c4) values(repeat('A',65536),repeat('B',65536),repeat('C',65536),repeat('D',65536));
replace into test.tb_table_gencol(pk1,pk2,c1,c2) values(46,'46',repeat('A',65536),repeat('B',65536));
replace into test.tablegencol(c1,USER_ID,ADDRESS) values(46, repeat('A',32),repeat('B',256));
replace into test.table_hash(c1, c2) values(46, 46);
replace into test.table_range(c1, c2) values(46, 46);
replace into test.table_hash_range(c1, c2) values(46, 46);
replace into test.table_range_hash(c1, c2) values(46, 46);
update db1.tb_normal set c1=47 where pk = 47;
update db1.tb_increment set c1 = 47 where pk = 47;
insert into db1.tb_bigtable (c1,c2,c3,c4) values(repeat('A',65536),repeat('B',65536),repeat('C',65536),repeat('D',65536));
replace into test.tb_table_gencol(pk1,pk2,c1,c2) values(47,'47',repeat('A',65536),repeat('B',65536));
replace into test.tablegencol(c1,USER_ID,ADDRESS) values(47, repeat('A',32),repeat('B',256));
replace into test.table_hash(c1, c2) values(47, 47);
replace into test.table_range(c1, c2) values(47, 47);
replace into test.table_hash_range(c1, c2) values(47, 47);
replace into test.table_range_hash(c1, c2) values(47, 47);
update db1.tb_normal set c1=48 where pk = 48;
update db1.tb_increment set c1 = 48 where pk = 48;
insert into db1.tb_bigtable (c1,c2,c3,c4) values(repeat('A',65536),repeat('B',65536),repeat('C',65536),repeat('D',65536));
replace into test.tb_table_gencol(pk1,pk2,c1,c2) values(48,'48',repeat('A',65536),repeat('B',65536));
replace into test.tablegencol(c1,USER_ID,ADDRESS) values(48, repeat('A',32),repeat('B',256));
replace into test.table_hash(c1, c2) values(48, 48);
replace into test.table_range(c1, c2) values(48, 48);
replace into test.table_hash_range(c1, c2) values(48, 48);
replace into test.table_range_hash(c1, c2) values(48, 48);
update db1.tb_normal set c1=49 where pk = 49;
update db1.tb_increment set c1 = 49 where pk = 49;
insert into db1.tb_bigtable (c1,c2,c3,c4) values(repeat('A',65536),repeat('B',65536),repeat('C',65536),repeat('D',65536));
replace into test.tb_table_gencol(pk1,pk2,c1,c2) values(49,'49',repeat('A',65536),repeat('B',65536));
replace into test.tablegencol(c1,USER_ID,ADDRESS) values(49, repeat('A',32),repeat('B',256));
replace into test.table_hash(c1, c2) values(49, 49);
replace into test.table_range(c1, c2) values(49, 49);
replace into test.table_hash_range(c1, c2) values(49, 49);
replace into test.table_range_hash(c1, c2) values(49, 49);
update db1.tb_normal set c1=50 where pk = 50;
update db1.tb_increment set c1 = 50 where pk = 50;
insert into db1.tb_bigtable (c1,c2,c3,c4) values(repeat('A',65536),repeat('B',65536),repeat('C',65536),repeat('D',65536));
replace into test.tb_table_gencol(pk1,pk2,c1,c2) values(50,'50',repeat('A',65536),repeat('B',65536));
replace into test.tablegencol(c1,USER_ID,ADDRESS) values(50, repeat('A',32),repeat('B',256));
replace into test.table_hash(c1, c2) values(50, 50);
replace into test.table_range(c1, c2) values(50, 50);
replace into test.table_hash_range(c1, c2) values(50, 50);
replace into test.table_range_hash(c1, c2) values(50, 50);
update db1.tb_normal set c1=51 where pk = 51;
update db1.tb_increment set c1 = 51 where pk = 51;
insert into db1.tb_bigtable (c1,c2,c3,c4) values(repeat('A',65536),repeat('B',65536),repeat('C',65536),repeat('D',65536));
replace into test.tb_table_gencol(pk1,pk2,c1,c2) values(51,'51',repeat('A',65536),repeat('B',65536));
replace into test.tablegencol(c1,USER_ID,ADDRESS) values(51, repeat('A',32),repeat('B',256));
replace into test.table_hash(c1, c2) values(51, 51);
replace into test.table_range(c1, c2) values(51, 51);
replace into test.table_hash_range(c1, c2) values(51, 51);
replace into test.table_range_hash(c1, c2) values(51, 51);
update db1.tb_normal set c1=52 where pk = 52;
update db1.tb_increment set c1 = 52 where pk = 52;
insert into db1.tb_bigtable (c1,c2,c3,c4) values(repeat('A',65536),repeat('B',65536),repeat('C',65536),repeat('D',65536));
replace into test.tb_table_gencol(pk1,pk2,c1,c2) values(52,'52',repeat('A',65536),repeat('B',65536));
replace into test.tablegencol(c1,USER_ID,ADDRESS) values(52, repeat('A',32),repeat('B',256));
replace into test.table_hash(c1, c2) values(52, 52);
replace into test.table_range(c1, c2) values(52, 52);
replace into test.table_hash_range(c1, c2) values(52, 52);
replace into test.table_range_hash(c1, c2) values(52, 52);
update db1.tb_normal set c1=53 where pk = 53;
update db1.tb_increment set c1 = 53 where pk = 53;
insert into db1.tb_bigtable (c1,c2,c3,c4) values(repeat('A',65536),repeat('B',65536),repeat('C',65536),repeat('D',65536));
replace into test.tb_table_gencol(pk1,pk2,c1,c2) values(53,'53',repeat('A',65536),repeat('B',65536));
replace into test.tablegencol(c1,USER_ID,ADDRESS) values(53, repeat('A',32),repeat('B',256));
replace into test.table_hash(c1, c2) values(53, 53);
replace into test.table_range(c1, c2) values(53, 53);
replace into test.table_hash_range(c1, c2) values(53, 53);
replace into test.table_range_hash(c1, c2) values(53, 53);
update db1.tb_normal set c1=54 where pk = 54;
update db1.tb_increment set c1 = 54 where pk = 54;
insert into db1.tb_bigtable (c1,c2,c3,c4) values(repeat('A',65536),repeat('B',65536),repeat('C',65536),repeat('D',65536));
replace into test.tb_table_gencol(pk1,pk2,c1,c2) values(54,'54',repeat('A',65536),repeat('B',65536));
replace into test.tablegencol(c1,USER_ID,ADDRESS) values(54, repeat('A',32),repeat('B',256));
replace into test.table_hash(c1, c2) values(54, 54);
replace into test.table_range(c1, c2) values(54, 54);
replace into test.table_hash_range(c1, c2) values(54, 54);
replace into test.table_range_hash(c1, c2) values(54, 54);
update db1.tb_normal set c1=55 where pk = 55;
update db1.tb_increment set c1 = 55 where pk = 55;
insert into db1.tb_bigtable (c1,c2,c3,c4) values(repeat('A',65536),repeat('B',65536),repeat('C',65536),repeat('D',65536));
replace into test.tb_table_gencol(pk1,pk2,c1,c2) values(55,'55',repeat('A',65536),repeat('B',65536));
replace into test.tablegencol(c1,USER_ID,ADDRESS) values(55, repeat('A',32),repeat('B',256));
replace into test.table_hash(c1, c2) values(55, 55);
replace into test.table_range(c1, c2) values(55, 55);
replace into test.table_hash_range(c1, c2) values(55, 55);
replace into test.table_range_hash(c1, c2) values(55, 55);
update db1.tb_normal set c1=56 where pk = 56;
update db1.tb_increment set c1 = 56 where pk = 56;
insert into db1.tb_bigtable (c1,c2,c3,c4) values(repeat('A',65536),repeat('B',65536),repeat('C',65536),repeat('D',65536));
replace into test.tb_table_gencol(pk1,pk2,c1,c2) values(56,'56',repeat('A',65536),repeat('B',65536));
replace into test.tablegencol(c1,USER_ID,ADDRESS) values(56, repeat('A',32),repeat('B',256));
replace into test.table_hash(c1, c2) values(56, 56);
replace into test.table_range(c1, c2) values(56, 56);
replace into test.table_hash_range(c1, c2) values(56, 56);
replace into test.table_range_hash(c1, c2) values(56, 56);
update db1.tb_normal set c1=57 where pk = 57;
update db1.tb_increment set c1 = 57 where pk = 57;
insert into db1.tb_bigtable (c1,c2,c3,c4) values(repeat('A',65536),repeat('B',65536),repeat('C',65536),repeat('D',65536));
replace into test.tb_table_gencol(pk1,pk2,c1,c2) values(57,'57',repeat('A',65536),repeat('B',65536));
replace into test.tablegencol(c1,USER_ID,ADDRESS) values(57, repeat('A',32),repeat('B',256));
replace into test.table_hash(c1, c2) values(57, 57);
replace into test.table_range(c1, c2) values(57, 57);
replace into test.table_hash_range(c1, c2) values(57, 57);
replace into test.table_range_hash(c1, c2) values(57, 57);
update db1.tb_normal set c1=58 where pk = 58;
update db1.tb_increment set c1 = 58 where pk = 58;
insert into db1.tb_bigtable (c1,c2,c3,c4) values(repeat('A',65536),repeat('B',65536),repeat('C',65536),repeat('D',65536));
replace into test.tb_table_gencol(pk1,pk2,c1,c2) values(58,'58',repeat('A',65536),repeat('B',65536));
replace into test.tablegencol(c1,USER_ID,ADDRESS) values(58, repeat('A',32),repeat('B',256));
replace into test.table_hash(c1, c2) values(58, 58);
replace into test.table_range(c1, c2) values(58, 58);
replace into test.table_hash_range(c1, c2) values(58, 58);
replace into test.table_range_hash(c1, c2) values(58, 58);
update db1.tb_normal set c1=59 where pk = 59;
update db1.tb_increment set c1 = 59 where pk = 59;
insert into db1.tb_bigtable (c1,c2,c3,c4) values(repeat('A',65536),repeat('B',65536),repeat('C',65536),repeat('D',65536));
replace into test.tb_table_gencol(pk1,pk2,c1,c2) values(59,'59',repeat('A',65536),repeat('B',65536));
replace into test.tablegencol(c1,USER_ID,ADDRESS) values(59, repeat('A',32),repeat('B',256));
replace into test.table_hash(c1, c2) values(59, 59);
replace into test.table_range(c1, c2) values(59, 59);
replace into test.table_hash_range(c1, c2) values(59, 59);
replace into test.table_range_hash(c1, c2) values(59, 59);
update db1.tb_normal set c1=60 where pk = 60;
update db1.tb_increment set c1 = 60 where pk = 60;
insert into db1.tb_bigtable (c1,c2,c3,c4) values(repeat('A',65536),repeat('B',65536),repeat('C',65536),repeat('D',65536));
replace into test.tb_table_gencol(pk1,pk2,c1,c2) values(60,'60',repeat('A',65536),repeat('B',65536));
replace into test.tablegencol(c1,USER_ID,ADDRESS) values(60, repeat('A',32),repeat('B',256));
replace into test.table_hash(c1, c2) values(60, 60);
replace into test.table_range(c1, c2) values(60, 60);
replace into test.table_hash_range(c1, c2) values(60, 60);
replace into test.table_range_hash(c1, c2) values(60, 60);
update db1.tb_normal set c1=61 where pk = 61;
update db1.tb_increment set c1 = 61 where pk = 61;
insert into db1.tb_bigtable (c1,c2,c3,c4) values(repeat('A',65536),repeat('B',65536),repeat('C',65536),repeat('D',65536));
replace into test.tb_table_gencol(pk1,pk2,c1,c2) values(61,'61',repeat('A',65536),repeat('B',65536));
replace into test.tablegencol(c1,USER_ID,ADDRESS) values(61, repeat('A',32),repeat('B',256));
replace into test.table_hash(c1, c2) values(61, 61);
replace into test.table_range(c1, c2) values(61, 61);
replace into test.table_hash_range(c1, c2) values(61, 61);
replace into test.table_range_hash(c1, c2) values(61, 61);
update db1.tb_normal set c1=62 where pk = 62;
update db1.tb_increment set c1 = 62 where pk = 62;
insert into db1.tb_bigtable (c1,c2,c3,c4) values(repeat('A',65536),repeat('B',65536),repeat('C',65536),repeat('D',65536));
replace into test.tb_table_gencol(pk1,pk2,c1,c2) values(62,'62',repeat('A',65536),repeat('B',65536));
replace into test.tablegencol(c1,USER_ID,ADDRESS) values(62, repeat('A',32),repeat('B',256));
replace into test.table_hash(c1, c2) values(62, 62);
replace into test.table_range(c1, c2) values(62, 62);
replace into test.table_hash_range(c1, c2) values(62, 62);
replace into test.table_range_hash(c1, c2) values(62, 62);
update db1.tb_normal set c1=63 where pk = 63;
update db1.tb_increment set c1 = 63 where pk = 63;
insert into db1.tb_bigtable (c1,c2,c3,c4) values(repeat('A',65536),repeat('B',65536),repeat('C',65536),repeat('D',65536));
replace into test.tb_table_gencol(pk1,pk2,c1,c2) values(63,'63',repeat('A',65536),repeat('B',65536));
replace into test.tablegencol(c1,USER_ID,ADDRESS) values(63, repeat('A',32),repeat('B',256));
replace into test.table_hash(c1, c2) values(63, 63);
replace into test.table_range(c1, c2) values(63, 63);
replace into test.table_hash_range(c1, c2) values(63, 63);
replace into test.table_range_hash(c1, c2) values(63, 63);
update db1.tb_normal set c1=64 where pk = 64;
update db1.tb_increment set c1 = 64 where pk = 64;
insert into db1.tb_bigtable (c1,c2,c3,c4) values(repeat('A',65536),repeat('B',65536),repeat('C',65536),repeat('D',65536));
replace into test.tb_table_gencol(pk1,pk2,c1,c2) values(64,'64',repeat('A',65536),repeat('B',65536));
replace into test.tablegencol(c1,USER_ID,ADDRESS) values(64, repeat('A',32),repeat('B',256));
replace into test.table_hash(c1, c2) values(64, 64);
replace into test.table_range(c1, c2) values(64, 64);
replace into test.table_hash_range(c1, c2) values(64, 64);
replace into test.table_range_hash(c1, c2) values(64, 64);
update db1.tb_normal set c1=65 where pk = 65;
update db1.tb_increment set c1 = 65 where pk = 65;
insert into db1.tb_bigtable (c1,c2,c3,c4) values(repeat('A',65536),repeat('B',65536),repeat('C',65536),repeat('D',65536));
replace into test.tb_table_gencol(pk1,pk2,c1,c2) values(65,'65',repeat('A',65536),repeat('B',65536));
replace into test.tablegencol(c1,USER_ID,ADDRESS) values(65, repeat('A',32),repeat('B',256));
replace into test.table_hash(c1, c2) values(65, 65);
replace into test.table_range(c1, c2) values(65, 65);
replace into test.table_hash_range(c1, c2) values(65, 65);
replace into test.table_range_hash(c1, c2) values(65, 65);
update db1.tb_normal set c1=66 where pk = 66;
update db1.tb_increment set c1 = 66 where pk = 66;
insert into db1.tb_bigtable (c1,c2,c3,c4) values(repeat('A',65536),repeat('B',65536),repeat('C',65536),repeat('D',65536));
replace into test.tb_table_gencol(pk1,pk2,c1,c2) values(66,'66',repeat('A',65536),repeat('B',65536));
replace into test.tablegencol(c1,USER_ID,ADDRESS) values(66, repeat('A',32),repeat('B',256));
replace into test.table_hash(c1, c2) values(66, 66);
replace into test.table_range(c1, c2) values(66, 66);
replace into test.table_hash_range(c1, c2) values(66, 66);
replace into test.table_range_hash(c1, c2) values(66, 66);
update db1.tb_normal set c1=67 where pk = 67;
update db1.tb_increment set c1 = 67 where pk = 67;
insert into db1.tb_bigtable (c1,c2,c3,c4) values(repeat('A',65536),repeat('B',65536),repeat('C',65536),repeat('D',65536));
replace into test.tb_table_gencol(pk1,pk2,c1,c2) values(67,'67',repeat('A',65536),repeat('B',65536));
replace into test.tablegencol(c1,USER_ID,ADDRESS) values(67, repeat('A',32),repeat('B',256));
replace into test.table_hash(c1, c2) values(67, 67);
replace into test.table_range(c1, c2) values(67, 67);
replace into test.table_hash_range(c1, c2) values(67, 67);
replace into test.table_range_hash(c1, c2) values(67, 67);
update db1.tb_normal set c1=68 where pk = 68;
update db1.tb_increment set c1 = 68 where pk = 68;
insert into db1.tb_bigtable (c1,c2,c3,c4) values(repeat('A',65536),repeat('B',65536),repeat('C',65536),repeat('D',65536));
replace into test.tb_table_gencol(pk1,pk2,c1,c2) values(68,'68',repeat('A',65536),repeat('B',65536));
replace into test.tablegencol(c1,USER_ID,ADDRESS) values(68, repeat('A',32),repeat('B',256));
replace into test.table_hash(c1, c2) values(68, 68);
replace into test.table_range(c1, c2) values(68, 68);
replace into test.table_hash_range(c1, c2) values(68, 68);
replace into test.table_range_hash(c1, c2) values(68, 68);
update db1.tb_normal set c1=69 where pk = 69;
update db1.tb_increment set c1 = 69 where pk = 69;
insert into db1.tb_bigtable (c1,c2,c3,c4) values(repeat('A',65536),repeat('B',65536),repeat('C',65536),repeat('D',65536));
replace into test.tb_table_gencol(pk1,pk2,c1,c2) values(69,'69',repeat('A',65536),repeat('B',65536));
replace into test.tablegencol(c1,USER_ID,ADDRESS) values(69, repeat('A',32),repeat('B',256));
replace into test.table_hash(c1, c2) values(69, 69);
replace into test.table_range(c1, c2) values(69, 69);
replace into test.table_hash_range(c1, c2) values(69, 69);
replace into test.table_range_hash(c1, c2) values(69, 69);
update db1.tb_normal set c1=70 where pk = 70;
update db1.tb_increment set c1 = 70 where pk = 70;
insert into db1.tb_bigtable (c1,c2,c3,c4) values(repeat('A',65536),repeat('B',65536),repeat('C',65536),repeat('D',65536));
replace into test.tb_table_gencol(pk1,pk2,c1,c2) values(70,'70',repeat('A',65536),repeat('B',65536));
replace into test.tablegencol(c1,USER_ID,ADDRESS) values(70, repeat('A',32),repeat('B',256));
replace into test.table_hash(c1, c2) values(70, 70);
replace into test.table_range(c1, c2) values(70, 70);
replace into test.table_hash_range(c1, c2) values(70, 70);
replace into test.table_range_hash(c1, c2) values(70, 70);
update db1.tb_normal set c1=71 where pk = 71;
update db1.tb_increment set c1 = 71 where pk = 71;
insert into db1.tb_bigtable (c1,c2,c3,c4) values(repeat('A',65536),repeat('B',65536),repeat('C',65536),repeat('D',65536));
replace into test.tb_table_gencol(pk1,pk2,c1,c2) values(71,'71',repeat('A',65536),repeat('B',65536));
replace into test.tablegencol(c1,USER_ID,ADDRESS) values(71, repeat('A',32),repeat('B',256));
replace into test.table_hash(c1, c2) values(71, 71);
replace into test.table_range(c1, c2) values(71, 71);
replace into test.table_hash_range(c1, c2) values(71, 71);
replace into test.table_range_hash(c1, c2) values(71, 71);
update db1.tb_normal set c1=72 where pk = 72;
update db1.tb_increment set c1 = 72 where pk = 72;
insert into db1.tb_bigtable (c1,c2,c3,c4) values(repeat('A',65536),repeat('B',65536),repeat('C',65536),repeat('D',65536));
replace into test.tb_table_gencol(pk1,pk2,c1,c2) values(72,'72',repeat('A',65536),repeat('B',65536));
replace into test.tablegencol(c1,USER_ID,ADDRESS) values(72, repeat('A',32),repeat('B',256));
replace into test.table_hash(c1, c2) values(72, 72);
replace into test.table_range(c1, c2) values(72, 72);
replace into test.table_hash_range(c1, c2) values(72, 72);
replace into test.table_range_hash(c1, c2) values(72, 72);
update db1.tb_normal set c1=73 where pk = 73;
update db1.tb_increment set c1 = 73 where pk = 73;
insert into db1.tb_bigtable (c1,c2,c3,c4) values(repeat('A',65536),repeat('B',65536),repeat('C',65536),repeat('D',65536));
replace into test.tb_table_gencol(pk1,pk2,c1,c2) values(73,'73',repeat('A',65536),repeat('B',65536));
replace into test.tablegencol(c1,USER_ID,ADDRESS) values(73, repeat('A',32),repeat('B',256));
replace into test.table_hash(c1, c2) values(73, 73);
replace into test.table_range(c1, c2) values(73, 73);
replace into test.table_hash_range(c1, c2) values(73, 73);
replace into test.table_range_hash(c1, c2) values(73, 73);
update db1.tb_normal set c1=74 where pk = 74;
update db1.tb_increment set c1 = 74 where pk = 74;
insert into db1.tb_bigtable (c1,c2,c3,c4) values(repeat('A',65536),repeat('B',65536),repeat('C',65536),repeat('D',65536));
replace into test.tb_table_gencol(pk1,pk2,c1,c2) values(74,'74',repeat('A',65536),repeat('B',65536));
replace into test.tablegencol(c1,USER_ID,ADDRESS) values(74, repeat('A',32),repeat('B',256));
replace into test.table_hash(c1, c2) values(74, 74);
replace into test.table_range(c1, c2) values(74, 74);
replace into test.table_hash_range(c1, c2) values(74, 74);
replace into test.table_range_hash(c1, c2) values(74, 74);
update db1.tb_normal set c1=75 where pk = 75;
update db1.tb_increment set c1 = 75 where pk = 75;
insert into db1.tb_bigtable (c1,c2,c3,c4) values(repeat('A',65536),repeat('B',65536),repeat('C',65536),repeat('D',65536));
replace into test.tb_table_gencol(pk1,pk2,c1,c2) values(75,'75',repeat('A',65536),repeat('B',65536));
replace into test.tablegencol(c1,USER_ID,ADDRESS) values(75, repeat('A',32),repeat('B',256));
replace into test.table_hash(c1, c2) values(75, 75);
replace into test.table_range(c1, c2) values(75, 75);
replace into test.table_hash_range(c1, c2) values(75, 75);
replace into test.table_range_hash(c1, c2) values(75, 75);
update db1.tb_normal set c1=76 where pk = 76;
update db1.tb_increment set c1 = 76 where pk = 76;
insert into db1.tb_bigtable (c1,c2,c3,c4) values(repeat('A',65536),repeat('B',65536),repeat('C',65536),repeat('D',65536));
replace into test.tb_table_gencol(pk1,pk2,c1,c2) values(76,'76',repeat('A',65536),repeat('B',65536));
replace into test.tablegencol(c1,USER_ID,ADDRESS) values(76, repeat('A',32),repeat('B',256));
replace into test.table_hash(c1, c2) values(76, 76);
replace into test.table_range(c1, c2) values(76, 76);
replace into test.table_hash_range(c1, c2) values(76, 76);
replace into test.table_range_hash(c1, c2) values(76, 76);
update db1.tb_normal set c1=77 where pk = 77;
update db1.tb_increment set c1 = 77 where pk = 77;
insert into db1.tb_bigtable (c1,c2,c3,c4) values(repeat('A',65536),repeat('B',65536),repeat('C',65536),repeat('D',65536));
replace into test.tb_table_gencol(pk1,pk2,c1,c2) values(77,'77',repeat('A',65536),repeat('B',65536));
replace into test.tablegencol(c1,USER_ID,ADDRESS) values(77, repeat('A',32),repeat('B',256));
replace into test.table_hash(c1, c2) values(77, 77);
replace into test.table_range(c1, c2) values(77, 77);
replace into test.table_hash_range(c1, c2) values(77, 77);
replace into test.table_range_hash(c1, c2) values(77, 77);
update db1.tb_normal set c1=78 where pk = 78;
update db1.tb_increment set c1 = 78 where pk = 78;
insert into db1.tb_bigtable (c1,c2,c3,c4) values(repeat('A',65536),repeat('B',65536),repeat('C',65536),repeat('D',65536));
replace into test.tb_table_gencol(pk1,pk2,c1,c2) values(78,'78',repeat('A',65536),repeat('B',65536));
replace into test.tablegencol(c1,USER_ID,ADDRESS) values(78, repeat('A',32),repeat('B',256));
replace into test.table_hash(c1, c2) values(78, 78);
replace into test.table_range(c1, c2) values(78, 78);
replace into test.table_hash_range(c1, c2) values(78, 78);
replace into test.table_range_hash(c1, c2) values(78, 78);
update db1.tb_normal set c1=79 where pk = 79;
update db1.tb_increment set c1 = 79 where pk = 79;
insert into db1.tb_bigtable (c1,c2,c3,c4) values(repeat('A',65536),repeat('B',65536),repeat('C',65536),repeat('D',65536));
replace into test.tb_table_gencol(pk1,pk2,c1,c2) values(79,'79',repeat('A',65536),repeat('B',65536));
replace into test.tablegencol(c1,USER_ID,ADDRESS) values(79, repeat('A',32),repeat('B',256));
replace into test.table_hash(c1, c2) values(79, 79);
replace into test.table_range(c1, c2) values(79, 79);
replace into test.table_hash_range(c1, c2) values(79, 79);
replace into test.table_range_hash(c1, c2) values(79, 79);
update db1.tb_normal set c1=80 where pk = 80;
update db1.tb_increment set c1 = 80 where pk = 80;
insert into db1.tb_bigtable (c1,c2,c3,c4) values(repeat('A',65536),repeat('B',65536),repeat('C',65536),repeat('D',65536));
replace into test.tb_table_gencol(pk1,pk2,c1,c2) values(80,'80',repeat('A',65536),repeat('B',65536));
replace into test.tablegencol(c1,USER_ID,ADDRESS) values(80, repeat('A',32),repeat('B',256));
replace into test.table_hash(c1, c2) values(80, 80);
replace into test.table_range(c1, c2) values(80, 80);
replace into test.table_hash_range(c1, c2) values(80, 80);
replace into test.table_range_hash(c1, c2) values(80, 80);
update db1.tb_normal set c1=81 where pk = 81;
update db1.tb_increment set c1 = 81 where pk = 81;
insert into db1.tb_bigtable (c1,c2,c3,c4) values(repeat('A',65536),repeat('B',65536),repeat('C',65536),repeat('D',65536));
replace into test.tb_table_gencol(pk1,pk2,c1,c2) values(81,'81',repeat('A',65536),repeat('B',65536));
replace into test.tablegencol(c1,USER_ID,ADDRESS) values(81, repeat('A',32),repeat('B',256));
replace into test.table_hash(c1, c2) values(81, 81);
replace into test.table_range(c1, c2) values(81, 81);
replace into test.table_hash_range(c1, c2) values(81, 81);
replace into test.table_range_hash(c1, c2) values(81, 81);
update db1.tb_normal set c1=82 where pk = 82;
update db1.tb_increment set c1 = 82 where pk = 82;
insert into db1.tb_bigtable (c1,c2,c3,c4) values(repeat('A',65536),repeat('B',65536),repeat('C',65536),repeat('D',65536));
replace into test.tb_table_gencol(pk1,pk2,c1,c2) values(82,'82',repeat('A',65536),repeat('B',65536));
replace into test.tablegencol(c1,USER_ID,ADDRESS) values(82, repeat('A',32),repeat('B',256));
replace into test.table_hash(c1, c2) values(82, 82);
replace into test.table_range(c1, c2) values(82, 82);
replace into test.table_hash_range(c1, c2) values(82, 82);
replace into test.table_range_hash(c1, c2) values(82, 82);
update db1.tb_normal set c1=83 where pk = 83;
update db1.tb_increment set c1 = 83 where pk = 83;
insert into db1.tb_bigtable (c1,c2,c3,c4) values(repeat('A',65536),repeat('B',65536),repeat('C',65536),repeat('D',65536));
replace into test.tb_table_gencol(pk1,pk2,c1,c2) values(83,'83',repeat('A',65536),repeat('B',65536));
replace into test.tablegencol(c1,USER_ID,ADDRESS) values(83, repeat('A',32),repeat('B',256));
replace into test.table_hash(c1, c2) values(83, 83);
replace into test.table_range(c1, c2) values(83, 83);
replace into test.table_hash_range(c1, c2) values(83, 83);
replace into test.table_range_hash(c1, c2) values(83, 83);
update db1.tb_normal set c1=84 where pk = 84;
update db1.tb_increment set c1 = 84 where pk = 84;
insert into db1.tb_bigtable (c1,c2,c3,c4) values(repeat('A',65536),repeat('B',65536),repeat('C',65536),repeat('D',65536));
replace into test.tb_table_gencol(pk1,pk2,c1,c2) values(84,'84',repeat('A',65536),repeat('B',65536));
replace into test.tablegencol(c1,USER_ID,ADDRESS) values(84, repeat('A',32),repeat('B',256));
replace into test.table_hash(c1, c2) values(84, 84);
replace into test.table_range(c1, c2) values(84, 84);
replace into test.table_hash_range(c1, c2) values(84, 84);
replace into test.table_range_hash(c1, c2) values(84, 84);
update db1.tb_normal set c1=85 where pk = 85;
update db1.tb_increment set c1 = 85 where pk = 85;
insert into db1.tb_bigtable (c1,c2,c3,c4) values(repeat('A',65536),repeat('B',65536),repeat('C',65536),repeat('D',65536));
replace into test.tb_table_gencol(pk1,pk2,c1,c2) values(85,'85',repeat('A',65536),repeat('B',65536));
replace into test.tablegencol(c1,USER_ID,ADDRESS) values(85, repeat('A',32),repeat('B',256));
replace into test.table_hash(c1, c2) values(85, 85);
replace into test.table_range(c1, c2) values(85, 85);
replace into test.table_hash_range(c1, c2) values(85, 85);
replace into test.table_range_hash(c1, c2) values(85, 85);
update db1.tb_normal set c1=86 where pk = 86;
update db1.tb_increment set c1 = 86 where pk = 86;
insert into db1.tb_bigtable (c1,c2,c3,c4) values(repeat('A',65536),repeat('B',65536),repeat('C',65536),repeat('D',65536));
replace into test.tb_table_gencol(pk1,pk2,c1,c2) values(86,'86',repeat('A',65536),repeat('B',65536));
replace into test.tablegencol(c1,USER_ID,ADDRESS) values(86, repeat('A',32),repeat('B',256));
replace into test.table_hash(c1, c2) values(86, 86);
replace into test.table_range(c1, c2) values(86, 86);
replace into test.table_hash_range(c1, c2) values(86, 86);
replace into test.table_range_hash(c1, c2) values(86, 86);
update db1.tb_normal set c1=87 where pk = 87;
update db1.tb_increment set c1 = 87 where pk = 87;
insert into db1.tb_bigtable (c1,c2,c3,c4) values(repeat('A',65536),repeat('B',65536),repeat('C',65536),repeat('D',65536));
replace into test.tb_table_gencol(pk1,pk2,c1,c2) values(87,'87',repeat('A',65536),repeat('B',65536));
replace into test.tablegencol(c1,USER_ID,ADDRESS) values(87, repeat('A',32),repeat('B',256));
replace into test.table_hash(c1, c2) values(87, 87);
replace into test.table_range(c1, c2) values(87, 87);
replace into test.table_hash_range(c1, c2) values(87, 87);
replace into test.table_range_hash(c1, c2) values(87, 87);
update db1.tb_normal set c1=88 where pk = 88;
update db1.tb_increment set c1 = 88 where pk = 88;
insert into db1.tb_bigtable (c1,c2,c3,c4) values(repeat('A',65536),repeat('B',65536),repeat('C',65536),repeat('D',65536));
replace into test.tb_table_gencol(pk1,pk2,c1,c2) values(88,'88',repeat('A',65536),repeat('B',65536));
replace into test.tablegencol(c1,USER_ID,ADDRESS) values(88, repeat('A',32),repeat('B',256));
replace into test.table_hash(c1, c2) values(88, 88);
replace into test.table_range(c1, c2) values(88, 88);
replace into test.table_hash_range(c1, c2) values(88, 88);
replace into test.table_range_hash(c1, c2) values(88, 88);
update db1.tb_normal set c1=89 where pk = 89;
update db1.tb_increment set c1 = 89 where pk = 89;
insert into db1.tb_bigtable (c1,c2,c3,c4) values(repeat('A',65536),repeat('B',65536),repeat('C',65536),repeat('D',65536));
replace into test.tb_table_gencol(pk1,pk2,c1,c2) values(89,'89',repeat('A',65536),repeat('B',65536));
replace into test.tablegencol(c1,USER_ID,ADDRESS) values(89, repeat('A',32),repeat('B',256));
replace into test.table_hash(c1, c2) values(89, 89);
replace into test.table_range(c1, c2) values(89, 89);
replace into test.table_hash_range(c1, c2) values(89, 89);
replace into test.table_range_hash(c1, c2) values(89, 89);
update db1.tb_normal set c1=90 where pk = 90;
update db1.tb_increment set c1 = 90 where pk = 90;
insert into db1.tb_bigtable (c1,c2,c3,c4) values(repeat('A',65536),repeat('B',65536),repeat('C',65536),repeat('D',65536));
replace into test.tb_table_gencol(pk1,pk2,c1,c2) values(90,'90',repeat('A',65536),repeat('B',65536));
replace into test.tablegencol(c1,USER_ID,ADDRESS) values(90, repeat('A',32),repeat('B',256));
replace into test.table_hash(c1, c2) values(90, 90);
replace into test.table_range(c1, c2) values(90, 90);
replace into test.table_hash_range(c1, c2) values(90, 90);
replace into test.table_range_hash(c1, c2) values(90, 90);
update db1.tb_normal set c1=91 where pk = 91;
update db1.tb_increment set c1 = 91 where pk = 91;
insert into db1.tb_bigtable (c1,c2,c3,c4) values(repeat('A',65536),repeat('B',65536),repeat('C',65536),repeat('D',65536));
replace into test.tb_table_gencol(pk1,pk2,c1,c2) values(91,'91',repeat('A',65536),repeat('B',65536));
replace into test.tablegencol(c1,USER_ID,ADDRESS) values(91, repeat('A',32),repeat('B',256));
replace into test.table_hash(c1, c2) values(91, 91);
replace into test.table_range(c1, c2) values(91, 91);
replace into test.table_hash_range(c1, c2) values(91, 91);
replace into test.table_range_hash(c1, c2) values(91, 91);
update db1.tb_normal set c1=92 where pk = 92;
update db1.tb_increment set c1 = 92 where pk = 92;
insert into db1.tb_bigtable (c1,c2,c3,c4) values(repeat('A',65536),repeat('B',65536),repeat('C',65536),repeat('D',65536));
replace into test.tb_table_gencol(pk1,pk2,c1,c2) values(92,'92',repeat('A',65536),repeat('B',65536));
replace into test.tablegencol(c1,USER_ID,ADDRESS) values(92, repeat('A',32),repeat('B',256));
replace into test.table_hash(c1, c2) values(92, 92);
replace into test.table_range(c1, c2) values(92, 92);
replace into test.table_hash_range(c1, c2) values(92, 92);
replace into test.table_range_hash(c1, c2) values(92, 92);
update db1.tb_normal set c1=93 where pk = 93;
update db1.tb_increment set c1 = 93 where pk = 93;
insert into db1.tb_bigtable (c1,c2,c3,c4) values(repeat('A',65536),repeat('B',65536),repeat('C',65536),repeat('D',65536));
replace into test.tb_table_gencol(pk1,pk2,c1,c2) values(93,'93',repeat('A',65536),repeat('B',65536));
replace into test.tablegencol(c1,USER_ID,ADDRESS) values(93, repeat('A',32),repeat('B',256));
replace into test.table_hash(c1, c2) values(93, 93);
replace into test.table_range(c1, c2) values(93, 93);
replace into test.table_hash_range(c1, c2) values(93, 93);
replace into test.table_range_hash(c1, c2) values(93, 93);
update db1.tb_normal set c1=94 where pk = 94;
update db1.tb_increment set c1 = 94 where pk = 94;
insert into db1.tb_bigtable (c1,c2,c3,c4) values(repeat('A',65536),repeat('B',65536),repeat('C',65536),repeat('D',65536));
replace into test.tb_table_gencol(pk1,pk2,c1,c2) values(94,'94',repeat('A',65536),repeat('B',65536));
replace into test.tablegencol(c1,USER_ID,ADDRESS) values(94, repeat('A',32),repeat('B',256));
replace into test.table_hash(c1, c2) values(94, 94);
replace into test.table_range(c1, c2) values(94, 94);
replace into test.table_hash_range(c1, c2) values(94, 94);
replace into test.table_range_hash(c1, c2) values(94, 94);
update db1.tb_normal set c1=95 where pk = 95;
update db1.tb_increment set c1 = 95 where pk = 95;
insert into db1.tb_bigtable (c1,c2,c3,c4) values(repeat('A',65536),repeat('B',65536),repeat('C',65536),repeat('D',65536));
replace into test.tb_table_gencol(pk1,pk2,c1,c2) values(95,'95',repeat('A',65536),repeat('B',65536));
replace into test.tablegencol(c1,USER_ID,ADDRESS) values(95, repeat('A',32),repeat('B',256));
replace into test.table_hash(c1, c2) values(95, 95);
replace into test.table_range(c1, c2) values(95, 95);
replace into test.table_hash_range(c1, c2) values(95, 95);
replace into test.table_range_hash(c1, c2) values(95, 95);
update db1.tb_normal set c1=96 where pk = 96;
update db1.tb_increment set c1 = 96 where pk = 96;
insert into db1.tb_bigtable (c1,c2,c3,c4) values(repeat('A',65536),repeat('B',65536),repeat('C',65536),repeat('D',65536));
replace into test.tb_table_gencol(pk1,pk2,c1,c2) values(96,'96',repeat('A',65536),repeat('B',65536));
replace into test.tablegencol(c1,USER_ID,ADDRESS) values(96, repeat('A',32),repeat('B',256));
replace into test.table_hash(c1, c2) values(96, 96);
replace into test.table_range(c1, c2) values(96, 96);
replace into test.table_hash_range(c1, c2) values(96, 96);
replace into test.table_range_hash(c1, c2) values(96, 96);
update db1.tb_normal set c1=97 where pk = 97;
update db1.tb_increment set c1 = 97 where pk = 97;
insert into db1.tb_bigtable (c1,c2,c3,c4) values(repeat('A',65536),repeat('B',65536),repeat('C',65536),repeat('D',65536));
replace into test.tb_table_gencol(pk1,pk2,c1,c2) values(97,'97',repeat('A',65536),repeat('B',65536));
replace into test.tablegencol(c1,USER_ID,ADDRESS) values(97, repeat('A',32),repeat('B',256));
replace into test.table_hash(c1, c2) values(97, 97);
replace into test.table_range(c1, c2) values(97, 97);
replace into test.table_hash_range(c1, c2) values(97, 97);
replace into test.table_range_hash(c1, c2) values(97, 97);
update db1.tb_normal set c1=98 where pk = 98;
update db1.tb_increment set c1 = 98 where pk = 98;
insert into db1.tb_bigtable (c1,c2,c3,c4) values(repeat('A',65536),repeat('B',65536),repeat('C',65536),repeat('D',65536));
replace into test.tb_table_gencol(pk1,pk2,c1,c2) values(98,'98',repeat('A',65536),repeat('B',65536));
replace into test.tablegencol(c1,USER_ID,ADDRESS) values(98, repeat('A',32),repeat('B',256));
replace into test.table_hash(c1, c2) values(98, 98);
replace into test.table_range(c1, c2) values(98, 98);
replace into test.table_hash_range(c1, c2) values(98, 98);
replace into test.table_range_hash(c1, c2) values(98, 98);
update db1.tb_normal set c1=99 where pk = 99;
update db1.tb_increment set c1 = 99 where pk = 99;
insert into db1.tb_bigtable (c1,c2,c3,c4) values(repeat('A',65536),repeat('B',65536),repeat('C',65536),repeat('D',65536));
replace into test.tb_table_gencol(pk1,pk2,c1,c2) values(99,'99',repeat('A',65536),repeat('B',65536));
replace into test.tablegencol(c1,USER_ID,ADDRESS) values(99, repeat('A',32),repeat('B',256));
replace into test.table_hash(c1, c2) values(99, 99);
replace into test.table_range(c1, c2) values(99, 99);
replace into test.table_hash_range(c1, c2) values(99, 99);
replace into test.table_range_hash(c1, c2) values(99, 99);
update db1.tb_normal set c1=100 where pk = 100;
update db1.tb_increment set c1 = 100 where pk = 100;
insert into db1.tb_bigtable (c1,c2,c3,c4) values(repeat('A',65536),repeat('B',65536),repeat('C',65536),repeat('D',65536));
replace into test.tb_table_gencol(pk1,pk2,c1,c2) values(100,'100',repeat('A',65536),repeat('B',65536));
replace into test.tablegencol(c1,USER_ID,ADDRESS) values(100, repeat('A',32),repeat('B',256));
replace into test.table_hash(c1, c2) values(100, 100);
replace into test.table_range(c1, c2) values(100, 100);
replace into test.table_hash_range(c1, c2) values(100, 100);
replace into test.table_range_hash(c1, c2) values(100, 100);
select pk1,pk2,gen_c1,gen_c2 from test.tb_table_gencol order by pk1,pk2 limit 10;
pk1	pk2	gen_c1	gen_c2
1	1	AAAAAAAAAA	BBBBBBBBBB
2	2	AAAAAAAAAA	BBBBBBBBBB
3	3	AAAAAAAAAA	BBBBBBBBBB
4	4	AAAAAAAAAA	BBBBBBBBBB
5	5	AAAAAAAAAA	BBBBBBBBBB
6	6	AAAAAAAAAA	BBBBBBBBBB
7	7	AAAAAAAAAA	BBBBBBBBBB
8	8	AAAAAAAAAA	BBBBBBBBBB
9	9	AAAAAAAAAA	BBBBBBBBBB
10	10	AAAAAAAAAA	BBBBBBBBBB
select * from test.table_hash where c1 = 1;
c1	c2
1	1
select * from test.table_range where c1 = 1;
c1	c2
1	1
select * from test.table_hash_range where c1 = 1;
c1	c2
1	1
select * from test.table_range_hash where c1 = 1;
c1	c2
1	1
select count(*) from test.table_hash;
count(*)
201
create table db1.t1_after(pk int primary key, c1 int);
create table db1.t2_after(pk int primary key, c1 int);
alter system minor freeze tenant = all;
alter system minor freeze tenant = all;
set @@session.ob_query_timeout = 60000000;
alter system major freeze tenant=all;
ob2.force_stop;
ob1.mysql ALTER SYSTEM ACTIVATE STANDBY TENANT $tenant_primary;
ob1.check_until_timeout select count(*) from __all_virtual_tenant_parameter_stat where name = 'compatible' and value!="$dest_version",0,2;
