obdocker=OBI(cluster=2:2:2,proxy_num=2,ct_num=1,locality=SZ:SZ:SZ,asvr_num=1,version=4_3_4_0);
obdocker.reboot;
CREATE RESOURCE UNIT unit_mysql  MEMORY_SIZE = '3G',MAX_CPU = 1, MIN_CPU = 1,LOG_DISK_SIZE = '6G',MAX_IOPS = 10000, MIN_IOPS = 10000, IOPS_WEIGHT=1;
obdocker.check_until_timeout select count(*) FROM oceanbase.DBA_OB_UNIT_CONFIGS WHERE NAME = "$unit1name", 1, 120;
CREATE RESOURCE POOL pool_mysql UNIT= unit_mysql ,UNIT_NUM=1, ZONE_LIST=('z1','z2','z3');
obdocker.check_until_timeout select count(*) FROM DBA_OB_RESOURCE_POOLS WHERE NAME = "$pool1name",1, 120;
CREATE TENANT IF NOT EXISTS tent_mysql PRIMARY_ZONE='z1',locality='F@z1,F@z2,R@z3',RESOURCE_POOL_LIST=('pool_mysql') ,enable_arbitration_service=true SET OB_TCP_INVITED_NODES='%' ;
obdocker.check_until_timeout select count(*) FROM DBA_OB_TENANTS WHERE TENANT_NAME = "$tent1name",1,120;
alter user root identified by 'tent1pw';
CREATE RESOURCE UNIT unit_oracle  MEMORY_SIZE = '3G',MAX_CPU = 1, MIN_CPU = 1,LOG_DISK_SIZE = '6G',MAX_IOPS = 10000, MIN_IOPS = 10000, IOPS_WEIGHT=1;
obdocker.check_until_timeout select count(*) FROM oceanbase.DBA_OB_UNIT_CONFIGS WHERE NAME = "$unit2name", 1, 120;
CREATE RESOURCE POOL pool_oracle UNIT= unit_oracle ,UNIT_NUM=1, ZONE_LIST=('z1','z2','z3');
obdocker.check_until_timeout select count(*) FROM DBA_OB_RESOURCE_POOLS WHERE NAME = "$pool2name",1, 120;
CREATE TENANT IF NOT EXISTS tent_oracle PRIMARY_ZONE='z1',RESOURCE_POOL_LIST=('pool_oracle') SET OB_TCP_INVITED_NODES='%',ob_compatibility_mode='oracle';
obdocker.check_until_timeout select count(*) FROM DBA_OB_TENANTS WHERE TENANT_NAME = "$tent2name",1,120;
alter user sys identified by tent2pw;
CREATE RESOURCE UNIT unit_not_minor  MEMORY_SIZE = '3G',MAX_CPU = 1, MIN_CPU = 1,LOG_DISK_SIZE = '6G',MAX_IOPS = 10000, MIN_IOPS = 10000, IOPS_WEIGHT=1;
obdocker.check_until_timeout select count(*) FROM oceanbase.DBA_OB_UNIT_CONFIGS WHERE NAME = "$unit4name", 1, 120;
CREATE RESOURCE POOL pool_not_minor UNIT= unit_not_minor ,UNIT_NUM=1, ZONE_LIST=('z1','z2','z3');
obdocker.check_until_timeout select count(*) FROM DBA_OB_RESOURCE_POOLS WHERE NAME = "$pool4name",1, 120;
CREATE TENANT IF NOT EXISTS tent_not_minor PRIMARY_ZONE='z1',RESOURCE_POOL_LIST=('pool_not_minor') SET OB_TCP_INVITED_NODES='%',ob_compatibility_mode='oracle';
obdocker.check_until_timeout select count(*) FROM DBA_OB_TENANTS WHERE TENANT_NAME = "$tent4name",1,120;
alter user sys identified by tent4pw;
drop tenant tent_not_minor;
CREATE TENANT IF NOT EXISTS tent_not_minor PRIMARY_ZONE='z1',locality='F@z1,F@z2,C@z3',RESOURCE_POOL_LIST=('pool_not_minor'),enable_arbitration_service=true SET OB_TCP_INVITED_NODES='%',ob_compatibility_mode='oracle';
obdocker.check_until_timeout select count(*) FROM DBA_OB_TENANTS WHERE TENANT_NAME = "$tent4name",1,120;
alter user sys identified by tent4pw;
obdocker.mysql ALTER SYSTEM SET ls_gc_delay_time='0s';
obdocker.mysql ALTER SYSTEM SET ls_gc_delay_time='0s' TENANT =all_meta;
obdocker.mysql ALTER SYSTEM SET ls_gc_delay_time='0s' TENANT =all_user;
obdocker.mysql alter tenant $tent1name set variables autocommit='on';
obdocker.mysql alter tenant $tent2name set variables autocommit='on';
obdocker.mysql alter tenant $tent4name set variables autocommit='on';
create database testsql;
use testsql;
create table t1(c1 int, c2 int);
create table t_part(c1 int, c2 int) partition by hash(c1) partitions 8;
insert into t1 values(1, 1), (2, 2), (3, 3), (4, 4), (5, 5), (6, 6), (7, 7), (8, 8), (9, 9), (10, 10);
insert into t_part values(1, 1);
insert into t_part values(2, 2);
insert into t_part values(3, 3);
insert into t_part values(4, 4);
insert into t_part values(5, 5);
insert into t_part values(6, 6);
insert into t_part values(7, 7);
insert into t_part values(8, 8);
insert into t_part values(9, 9);
insert into t_part values(10, 10);
update t1 set c2=22 where c1=2;
update t_part set c2=22 where c1=2;
delete from t1 where c1=9;
delete from t_part where c1=9;
create table t_test_trg_mysql(c1 int);
create trigger trg_t_test_trg_mysql before insert on t_test_trg_mysql for each row set @var_test_trg = 1;
CREATE FUNCTION my_func1 (c1 CHAR(20)) RETURNS CHAR(50) DETERMINISTIC RETURN CONCAT('Thank ',c1,'!');
SELECT my_func1('You');
my_func1('You')
Thank You!
use testsql;
CREATE TABLE tbl1_l (col1 BIGINT PRIMARY KEY, col2 VARCHAR(50)) PARTITION BY LIST (col1) (PARTITION p0 VALUES IN (1, 2, 3), PARTITION p1 VALUES IN (5, 6), PARTITION p2 VALUES IN (DEFAULT));
insert /*+ direct(true,100,'inc_replace') enable_parallel_dml parallel(2)*/ into tbl1_l select * from t1;
CREATE TABLE tbl2_l (col1 BIGINT PRIMARY KEY, col2 VARCHAR(50)) PARTITION BY LIST (col1) (PARTITION p0 VALUES IN (1, 2, 3), PARTITION p1 VALUES IN (5, 6), PARTITION p2 VALUES IN (DEFAULT));
insert /*+ direct enable_parallel_dml parallel(N) */ into tbl2_l select * from tbl1_l;
create table t1_1(c1 int, c2 int);
insert into t1_1 values(11, 1), (12, 2), (13, 3), (14, 4), (15, 5), (16, 6), (17, 7), (18, 8), (19, 9), (20, 10);
create table t1_2(c1 int, c2 int);
insert into t1_2 values(21, 1), (22, 2), (23, 3), (24, 4), (25, 5), (26, 6), (27, 7), (28, 8), (29, 9), (30, 10);
create database test_mview;
use test_mview;
create table t1(c1 int primary key, c2 int, c3 int, c4 int);
create table t1_mix(c1 int primary key, c2 int, c3 int, c4 int);
create materialized view log on t1 with primary key, sequence (c2, c3) including new values;
create materialized view mv1 refresh fast on demand as select c2 as c2, count(*) cnt, count(c3) cnt_c3, sum(c3) sum_c3 from t1 group by c2;
create materialized view mv2 as select * from t1;
create sequence s1 cache 1000000 noorder;
call dbms_mview_stats.set_mvref_stats_params('mv1', 'NONE', 31);
call dbms_mview_stats.set_mvref_stats_params('mv2', 'NONE', 31);
select OWNER,MVIEW_NAME,QUERY,REFRESH_MODE,REFRESH_METHOD,BUILD_MODE,LAST_REFRESH_DATE IS NULL,LAST_REFRESH_END_TIME IS NULL from oceanbase.DBA_MVIEWS where OWNER = 'test_mview' AND MVIEW_NAME IN ('mv1', 'mv2') ORDER BY MVIEW_NAME;
OWNER	MVIEW_NAME	QUERY	REFRESH_MODE	REFRESH_METHOD	BUILD_MODE	LAST_REFRESH_DATE IS NULL	LAST_REFRESH_END_TIME IS NULL
test_mview	mv1	select `test_mview`.`t1`.`c2` AS `c2`,count(*) AS `cnt`,count(`test_mview`.`t1`.`c3`) AS `cnt_c3`,sum(`test_mview`.`t1`.`c3`) AS `sum_c3` from `test_mview`.`t1` group by `test_mview`.`t1`.`c2`	DEMAND	FAST	IMMEDIATE	0	0
test_mview	mv2	select `test_mview`.`t1`.`c1` AS `c1`,`test_mview`.`t1`.`c2` AS `c2`,`test_mview`.`t1`.`c3` AS `c3`,`test_mview`.`t1`.`c4` AS `c4` from `test_mview`.`t1`	DEMAND	FORCE	IMMEDIATE	0	0
insert into t1 select s1.nextval, s1.nextval, s1.nextval, s1.nextval from table(generator(100000));
call dbms_mview.refresh('mv1');
call dbms_mview.refresh('mv2');
select OWNER,MVIEW_NAME,QUERY,REFRESH_MODE,REFRESH_METHOD,BUILD_MODE,LAST_REFRESH_DATE IS NULL,LAST_REFRESH_END_TIME IS NULL,TIMESTAMPDIFF(SECOND, LAST_REFRESH_DATE, LAST_REFRESH_END_TIME) < 10 from oceanbase.DBA_MVIEWS where OWNER = 'test_mview' AND MVIEW_NAME IN ('mv1', 'mv2') ORDER BY MVIEW_NAME;
OWNER	MVIEW_NAME	QUERY	REFRESH_MODE	REFRESH_METHOD	BUILD_MODE	LAST_REFRESH_DATE IS NULL	LAST_REFRESH_END_TIME IS NULL	TIMESTAMPDIFF(SECOND, LAST_REFRESH_DATE, LAST_REFRESH_END_TIME) < 10
test_mview	mv1	select `test_mview`.`t1`.`c2` AS `c2`,count(*) AS `cnt`,count(`test_mview`.`t1`.`c3`) AS `cnt_c3`,sum(`test_mview`.`t1`.`c3`) AS `sum_c3` from `test_mview`.`t1` group by `test_mview`.`t1`.`c2`	DEMAND	FAST	IMMEDIATE	0	0	1
test_mview	mv2	select `test_mview`.`t1`.`c1` AS `c1`,`test_mview`.`t1`.`c2` AS `c2`,`test_mview`.`t1`.`c3` AS `c3`,`test_mview`.`t1`.`c4` AS `c4` from `test_mview`.`t1`	DEMAND	FORCE	IMMEDIATE	0	0	1
ALTER TABLE opt_1 ADD position VARCHAR(50) AFTER col1;
ALTER TABLE opt_2 ADD position VARCHAR(50) AFTER col1;
ALTER TABLE opt_3 ADD position VARCHAR(50) AFTER col1;
ALTER TABLE opt_1 CHANGE COLUMN position position1 VARCHAR(50) AFTER col2;
ALTER TABLE opt_2 CHANGE COLUMN position position1 VARCHAR(50) AFTER col2;
ALTER TABLE opt_3 CHANGE COLUMN position position1 VARCHAR(50) AFTER col2;
ALTER TABLE opt_1 MODIFY col1 INT AUTO_INCREMENT;
ALTER TABLE opt_2 MODIFY col1 INT AUTO_INCREMENT;
ALTER TABLE opt_3 MODIFY col1 INT AUTO_INCREMENT;
ALTER TABLE opt_1 ADD position2 VARCHAR(50) AFTER col2;
ALTER TABLE opt_2 ADD position2 VARCHAR(50) AFTER col2;
ALTER TABLE opt_3 ADD position2 VARCHAR(50) AFTER col2;
ALTER TABLE opt_1 DROP COLUMN position1;
ALTER TABLE opt_2 DROP COLUMN position1;
ALTER TABLE opt_3 DROP COLUMN position1;
ALTER TABLE opt_1 ADD position1 VARCHAR(50) AFTER col1;
ALTER TABLE opt_2 ADD position1 VARCHAR(50) AFTER col1;
ALTER TABLE opt_3 ADD position1 VARCHAR(50) AFTER col1;
ALTER TABLE opt_1 DROP COLUMN position1;
ALTER TABLE opt_2 DROP COLUMN position1;
ALTER TABLE opt_3 DROP COLUMN position1;
ALTER TABLE opt_1 ADD position1 VARCHAR(50) AFTER col1;
ALTER TABLE opt_2 ADD position1 VARCHAR(50) AFTER col1;
ALTER TABLE opt_3 ADD position1 VARCHAR(50) AFTER col1;
ALTER TABLE opt_1 DROP COLUMN position1;
ALTER TABLE opt_2 DROP COLUMN position1;
ALTER TABLE opt_3 DROP COLUMN position1;
ALTER TABLE opt_1 ADD position1 VARCHAR(50) AFTER col1;
ALTER TABLE opt_2 ADD position1 VARCHAR(50) AFTER col1;
ALTER TABLE opt_3 ADD position1 VARCHAR(50) AFTER col1;
ALTER TABLE opt_1 DROP COLUMN position1;
ALTER TABLE opt_2 DROP COLUMN position1;
ALTER TABLE opt_3 DROP COLUMN position1;
ALTER TABLE opt_1 ADD position1 VARCHAR(50) AFTER col1;
ALTER TABLE opt_2 ADD position1 VARCHAR(50) AFTER col1;
ALTER TABLE opt_3 ADD position1 VARCHAR(50) AFTER col1;
ALTER TABLE opt_1 DROP COLUMN position1;
ALTER TABLE opt_2 DROP COLUMN position1;
ALTER TABLE opt_3 DROP COLUMN position1;
ALTER TABLE opt_1 ADD position1 VARCHAR(50) AFTER col1;
ALTER TABLE opt_2 ADD position1 VARCHAR(50) AFTER col1;
ALTER TABLE opt_3 ADD position1 VARCHAR(50) AFTER col1;
ALTER TABLE opt_1 DROP COLUMN position1;
ALTER TABLE opt_2 DROP COLUMN position1;
ALTER TABLE opt_3 DROP COLUMN position1;
ALTER TABLE opt_1 ADD birth_date DATE;
ALTER TABLE opt_2 ADD birth_date DATE;
ALTER TABLE opt_3 ADD birth_date DATE;
ALTER TABLE opt_1 ADD birth_date1 DATE;
ALTER TABLE opt_2 ADD birth_date1 DATE;
ALTER TABLE opt_3 ADD birth_date1 DATE;
ALTER TABLE opt_1 MODIFY birth_date1 DATE NULL;
ALTER TABLE opt_2 MODIFY birth_date1 DATE NULL;
ALTER TABLE opt_3 MODIFY birth_date1 DATE NULL;
OPTIMIZE TABLE opt_1;
OPTIMIZE TABLE opt_2;
OPTIMIZE TABLE opt_3;
CREATE TABLE MyTable (t1 int,t2 int);
ALTER TABLE MyTable ADD CONSTRAINT pk_MyTable PRIMARY KEY (column_1,column_2,column_3,column_4,column_5,column_6,column_7,column_8,column_9,column_10,column_11,column_12,column_13,column_14,column_15,column_16,column_17,column_18,column_19,column_20,column_21,column_22,column_23,column_24,column_25,column_26,column_27,column_28,column_29,column_30,column_31,column_32,column_33,column_34,column_35,column_36,column_37,column_38,column_39,column_40,column_41,column_42,column_43,column_44,column_45,column_46,column_47,column_48,column_49,column_50,column_51,column_52,column_53,column_54,column_55,column_56,column_57,column_58,column_59,column_60);
Got one of the listed errors
ALTER TABLE MyTable ADD CONSTRAINT pk_MyTable PRIMARY KEY (column_1,column_2,column_3,column_4,column_5,column_6,column_7,column_8,column_9,column_10);
Got one of the listed errors
INSERT INTO MyTable (t1,t2,column_1,column_2,column_3,column_4,column_5,column_6,column_7,column_8,column_9,column_10,column_11,column_12,column_13,column_14,column_15,column_16,column_17,column_18,column_19,column_20,column_21,column_22,column_23,column_24,column_25,column_26,column_27,column_28,column_29,column_30,column_31,column_32,column_33,column_34,column_35,column_36,column_37,column_38,column_39,column_40,column_41,column_42,column_43,column_44,column_45,column_46,column_47,column_48,column_49,column_50,column_51,column_52,column_53,column_54,column_55,column_56,column_57,column_58,column_59,column_60) values (1,2,'data1','data2','data3','data4','data5','data6','data7','data8','data9','data10','data11','data12','data13','data14','data15','data16','data17','data18','data19','data20','data21','data22','data23','data24','data25','data26','data27','data28','data29','data30','data31','data32','data33','data34','data35','data36','data37','data38','data39','data40','data41','data42','data43','data44','data45','data46','data47','data48','data49','data50','data51','data52','data53','data54','data55','data56','data57','data58','data59','data60');
create database testsvr;
use testsvr;
create table t3(c1 int,c2 varchar(65536),c3 varchar(65536),c4 varchar(65536));
update t3 set c2="cc" where c1=2;
delete from t3 where c1=9;
create table t2(c1 int, c2 int, c3 int, primary key(c1));
insert into t2 values(1, 5, 1), (2, 4, 2), (3, 3, 3), (4, 2, 4), (5, 1, 5),(6,2,6),(7,5,7),(8,2,8),(9,3,9);
update t2 set c2=22 where c1=2;
delete from t2 where c1=9;
create table t_test_trg_ora(c1 int);
CREATE OR REPLACE TRIGGER trg_t_test_trg_ora BEFORE INSERT ON t_test_trg_ora FOR EACH ROW BEGIN NULL; END;
drop table t1;
create table t1 (c1 int, c2 int, c3 int);
drop table t1_log;
create table t1_log (c1 int, c2 int, c3 int);
declare v1 varchar(20) := 'world'; begin dbms_output.put_line('hello ' || v1); end;
CREATE OR REPLACE PROCEDURE p1(p_v1 INT) IS v1 INT := 1; BEGIN INSERT INTO t1 VALUES (p_v1, v1, p_v1 + v1); COMMIT; END;
call p1(1);
begin p1(1); end;
select * from t1;
C1	C2	C3
1	1	2
1	1	2
create or replace function f1(p_v1 int) return int is begin return p_v1; end;
select * from t1 where c1 = f1(1);
C1	C2	C3
1	1	2
1	1	2
declare v1 int; begin v1 := f1(100); dbms_output.put_line('v1: ' || v1); end;
create or replace package pkg1 is v1 int; procedure p1(p_v1 int); function f1(p_v1 int) return int; end pkg1;
create or replace package body pkg1 is v2 int; procedure p1(p_v1 int) is begin v1 := p_v1; v2 := p_v1; end; function f1(p_v1 int) return int is begin v1 := p_v1; return v2; end; end;
call pkg1.p1(3);
select pkg1.f1(4) from dual;
PKG1.F1(4)
3
CREATE OR REPLACE FUNCTION println RETURN VARCHAR2 IS r VARCHAR2(32767); t INT; r1 VARCHAR2(32767);BEGIN DBMS_OUTPUT.GET_LINE(r, t); LOOP DBMS_OUTPUT.GET_LINE(r1, t); EXIT WHEN t = 1; r := r || chr(10) || '  ' || r1; END LOOP; RETURN r; END;
declare v1 int; begin insert into t1(c1) values ('aaa'); exception when others then dbms_output.put_line('exception: ' || sqlerrm); end;
select println() from dual;
PRINTLN()
NULL
declare v1 int; my_err exception; pragma exception_init(my_err, -20001); begin raise my_err; exception when my_err then dbms_output.put_line('exception: ' || sqlerrm); end;
select println() from dual;
PRINTLN()
NULL
create or replace procedure p2(a int, b in out int, c out int) is begin c := a; b := b + 1; end;
declare a int:=0; b int:=2; c int; begin p2(a,b,c); end;
create or replace trigger tri0 before insert on t1 for each row begin insert into t1_log(c1, c2, c3) values (:old.c1, :new.c2, :old.c3 + :new.c3); end;
insert into t1 values(10, 10, 10);
select * from t1;
C1	C2	C3
1	1	2
1	1	2
10	10	10
select * from t1_log;
C1	C2	C3
NULL	10	NULL
create or replace type obj_typ1 force as object(c0 int);
create or replace type obj_typ2 force as object (c0 int, constructor function obj_typ2(a1 int, a2 int) return self as result, static function f0 return int, member procedure p1);
create or replace type body obj_typ2 as constructor function obj_typ2(a1 int, a2 int) return self as result is begin c0:= a1 + a2; return; end; static function f0 return int is begin return 0; end; member procedure p1 is begin null; end; end;
declare obj obj_typ2; v1 int; begin obj := obj_typ2(1, 1); select obj_typ2.f0() into v1 from dual; obj.p1(); dbms_output.put_line('v1: ' || v1); end;
create or replace type arr_typ1 force as varray(100) of int;
create or replace type nstb_typ1 force as table of int;
drop table tt2;
create table tt2(c1 int);
declare a int; begin insert into tt2 values(0); execute immediate 'insert into tt2 values(1)'; execute immediate 'insert into tt2 values(?)' using a; end;
select * from tt2;
C1
0
1
NULL
declare cursor cur1(p_v1 int) is select c1 from tt2 where c1 = p_v1; a tt2.c1%type; begin open cur1(1); loop fetch cur1 into a; exit when cur1%notfound; end loop; close cur1; end;
declare type rec_typ1 is record(c1 int); cursor cur1(p_v1 int) return rec_typ1 is select c1 from tt2 where c1 = p_v1; rec rec_typ1; begin open cur1(1); loop fetch cur1 into rec; exit when cur1%notfound; end loop; close cur1; end;
drop table t3;
drop table t4;
create table t3 (c1 int, c2 int);
insert into t3 values(1, 1);
create table t4 (c1 int, c2 int);
insert into t4 values(1, 1);
declare pragma autonomous_transaction; begin insert into t3 values (2,2); commit; end;
insert into t4 values (2, 2);
rollback;
select * from t3;
C1	C2
1	1
2	2
select * from t4;
C1	C2
1	1
2	2
create or replace procedure p1(p_v1 int) is begin if p_v1 = 1 then dbms_output.put_line(p_v1); elsif p_v1 = 2 then dbms_output.put_line(p_v1 * p_v1); else dbms_output.put_line(p_v1 + p_v1); end if; end;
call p1(1);
select println() from dual;
PRINTLN()
NULL
call p1(2);
select println() from dual;
PRINTLN()
NULL
call p1(3);
select println() from dual;
PRINTLN()
NULL
declare v1 number := 0; begin while v1 < 3 loop v1 := v1 + 1; dbms_output.put_line(v1); goto label1; end loop; v1 := 0; <<label1>> dbms_output.put_line(v1); end;
drop table t1_1;
create table t1_1(aa varchar2(20));
insert into t1_1 values(1);
insert into t1_1 values(30);
DECLARE TYPE NumList IS VARRAY(20) OF NUMBER; depts NumList := NumList(10, 30, 70); BEGIN FORALL i IN depts.FIRST..depts.LAST DELETE FROM t1_1 WHERE aa = depts(i); END;
select * from t1_1;
AA
1
drop TYPE my_typ11 ;
CREATE TYPE my_typ11 AS OBJECT (
attr1 NUMBER,
attr2 VARCHAR2(100)
);
CREATE OR REPLACE PROCEDURE modify_my_object(p_object IN OUT NOCOPY my_typ11) IS BEGIN p_object.attr1 := p_object.attr1 + 1; p_object.attr2 := 'Modified'; END;
declare obj1 my_typ11 := my_typ11(1, '1'); begin modify_my_object(obj1); end;
drop table t1_2;
create table t1_2(aa varchar2(20));
insert into t1_2 values(1);
insert into t1_2 values(30);
DECLARE v_new_aa NUMBER := 50000; v_old_aa NUMBER; BEGIN UPDATE t1_2 SET aa = v_new_aa WHERE aa = 30 RETURNING aa INTO v_old_aa; END;
select * from t1_2;
AA
1
50000
drop TABLE employees;
CREATE TABLE employees (
employee_id NUMBER,
first_name VARCHAR2(50),
last_name VARCHAR2(50),
salary NUMBER
);
BEGIN INSERT INTO employees VALUES (1, 'John', 'Doe', 50000); INSERT INTO employees VALUES (2, 'Jane', 'Doe', 52000); INSERT INTO employees VALUES (3, 'Bill', 'Smith', 55000); COMMIT; END;
DECLARE TYPE t_employee_tab IS TABLE OF employees%ROWTYPE; v_employees t_employee_tab; BEGIN SELECT * BULK COLLECT INTO v_employees FROM employees; FOR indx IN 1..v_employees.COUNT LOOP DBMS_OUTPUT.PUT_LINE('Employee ID: ' || v_employees(indx).employee_id || ', Name: ' || v_employees(indx).first_name || ' ' || v_employees(indx).last_name || ', Salary: ' || v_employees(indx).salary); END LOOP; END;
select println() from dual;
PRINTLN()
NULL
DROP TABLE accounts;
CREATE TABLE accounts (
account_id  NUMBER(6),
balance     NUMBER (10,2)
);
set autocommit =0;
INSERT INTO accounts (account_id, balance)
VALUES (7715, 6350.00);
INSERT INTO accounts (account_id, balance)
VALUES (7720, 5100.50);
CREATE OR REPLACE PROCEDURE transfer(from_acct NUMBER, to_acct NUMBER, amount NUMBER) AUTHID CURRENT_USER AS BEGIN UPDATE accounts SET balance = balance - amount WHERE account_id = from_acct; UPDATE accounts SET balance = balance + amount WHERE account_id = to_acct; COMMIT; END;
BEGIN transfer(7715, 7720, 250);END;
SELECT * FROM accounts;
ACCOUNT_ID	BALANCE
7715	6100
7720	5350.5
drop table t1_3;
create table t1_3(aa varchar2(2));
drop table t_1;
create table t_1(aa varchar2(2000));
DECLARE emp_id NUMBER(6); emp_lastname VARCHAR2(25); emp_salary NUMBER(8,2); emp_jobid VARCHAR2(10); BEGIN insert into t1_3 values(1); insert into t1_3 values(2); insert into t1_3 values(3); insert into t1_3 values(111); EXCEPTION WHEN others THEN ROLLBACK; insert into t_1 values('Inserts were rolled back'); END;
select * from t1_3;
AA
select * from t_1;
AA
Inserts were rolled back
drop table t1_4;
create table t1_4(aa varchar2(2));
drop table t_2;
create table t_2(aa varchar2(2000));
DECLARE emp_id NUMBER(6); emp_lastname VARCHAR2(25); emp_salary NUMBER(8,2); emp_jobid VARCHAR2(10); BEGIN insert into t1_4 values(1); insert into t1_4 values(2); SAVEPOINT do_insert; insert into t1_4 values(3); insert into t1_4 values(111); EXCEPTION WHEN others THEN ROLLBACK to do_insert; insert into t_2 values('Inserts were rolled back'); END;
select * from t1_4;
AA
1
2
select * from t_2;
AA
Inserts were rolled back
create table notminor(a1 int,a2 VARCHAR2(50),a3 int,primary key(a1));
insert into notminor (a1,a2,a3) values(1,'a_1',1);
insert into notminor (a1,a2,a3) values(2,'a_2',2);
insert into notminor (a1,a2,a3) values(3,'a_3',3);
insert into notminor (a1,a2,a3) values(4,'a_4',4);
insert into notminor (a1,a2,a3) values(5,'a_5',5);
insert into notminor (a1,a2,a3) values(6,'a_6',6);
insert into notminor (a1,a2,a3) values(7,'a_7',7);
insert into notminor (a1,a2,a3) values(8,'a_8',8);
insert into notminor (a1,a2,a3) values(9,'a_9',9);
insert into notminor (a1,a2,a3) values(10,'a_10',10);
insert into notminor (a1,a2,a3) values(11,'a_11',11);
insert into notminor (a1,a2,a3) values(12,'a_12',12);
insert into notminor (a1,a2,a3) values(13,'a_13',13);
insert into notminor (a1,a2,a3) values(14,'a_14',14);
insert into notminor (a1,a2,a3) values(15,'a_15',15);
insert into notminor (a1,a2,a3) values(16,'a_16',16);
insert into notminor (a1,a2,a3) values(17,'a_17',17);
insert into notminor (a1,a2,a3) values(18,'a_18',18);
insert into notminor (a1,a2,a3) values(19,'a_19',19);
insert into notminor (a1,a2,a3) values(20,'a_20',20);
insert into notminor (a1,a2,a3) values(21,'a_21',21);
insert into notminor (a1,a2,a3) values(22,'a_22',22);
insert into notminor (a1,a2,a3) values(23,'a_23',23);
insert into notminor (a1,a2,a3) values(24,'a_24',24);
insert into notminor (a1,a2,a3) values(25,'a_25',25);
insert into notminor (a1,a2,a3) values(26,'a_26',26);
insert into notminor (a1,a2,a3) values(27,'a_27',27);
insert into notminor (a1,a2,a3) values(28,'a_28',28);
insert into notminor (a1,a2,a3) values(29,'a_29',29);
insert into notminor (a1,a2,a3) values(30,'a_30',30);
insert into notminor (a1,a2,a3) values(31,'a_31',31);
insert into notminor (a1,a2,a3) values(32,'a_32',32);
insert into notminor (a1,a2,a3) values(33,'a_33',33);
insert into notminor (a1,a2,a3) values(34,'a_34',34);
insert into notminor (a1,a2,a3) values(35,'a_35',35);
insert into notminor (a1,a2,a3) values(36,'a_36',36);
insert into notminor (a1,a2,a3) values(37,'a_37',37);
insert into notminor (a1,a2,a3) values(38,'a_38',38);
insert into notminor (a1,a2,a3) values(39,'a_39',39);
insert into notminor (a1,a2,a3) values(40,'a_40',40);
insert into notminor (a1,a2,a3) values(41,'a_41',41);
insert into notminor (a1,a2,a3) values(42,'a_42',42);
insert into notminor (a1,a2,a3) values(43,'a_43',43);
insert into notminor (a1,a2,a3) values(44,'a_44',44);
insert into notminor (a1,a2,a3) values(45,'a_45',45);
insert into notminor (a1,a2,a3) values(46,'a_46',46);
insert into notminor (a1,a2,a3) values(47,'a_47',47);
insert into notminor (a1,a2,a3) values(48,'a_48',48);
insert into notminor (a1,a2,a3) values(49,'a_49',49);
insert into notminor (a1,a2,a3) values(50,'a_50',50);
ALTER TABLE notminor ADD a4 VARCHAR2(50);
ALTER TABLE notminor  MODIFY a4 VARCHAR2(100);
ALTER TABLE notminor  DROP COLUMN a4;
insert into notminor (a1,a2,a3) values(51,'a_51',51);
insert into notminor (a1,a2,a3) values(52,'a_52',52);
insert into notminor (a1,a2,a3) values(53,'a_53',53);
insert into notminor (a1,a2,a3) values(54,'a_54',54);
insert into notminor (a1,a2,a3) values(55,'a_55',55);
insert into notminor (a1,a2,a3) values(56,'a_56',56);
insert into notminor (a1,a2,a3) values(57,'a_57',57);
insert into notminor (a1,a2,a3) values(58,'a_58',58);
insert into notminor (a1,a2,a3) values(59,'a_59',59);
insert into notminor (a1,a2,a3) values(60,'a_60',60);
insert into notminor (a1,a2,a3) values(61,'a_61',61);
insert into notminor (a1,a2,a3) values(62,'a_62',62);
insert into notminor (a1,a2,a3) values(63,'a_63',63);
insert into notminor (a1,a2,a3) values(64,'a_64',64);
insert into notminor (a1,a2,a3) values(65,'a_65',65);
insert into notminor (a1,a2,a3) values(66,'a_66',66);
insert into notminor (a1,a2,a3) values(67,'a_67',67);
insert into notminor (a1,a2,a3) values(68,'a_68',68);
insert into notminor (a1,a2,a3) values(69,'a_69',69);
insert into notminor (a1,a2,a3) values(70,'a_70',70);
obdocker.mysql alter tenant $tent4name set primary_zone="z1,z2";
obdocker.check_until_timeout select count(*) from dba_ob_tenants where TENANT_NAME="$tent4name" and PRIMARY_ZONE like "%z1,z2;%",1,120;
obdocker.check_until_timeout select count(*) from CDB_OB_TRANSFER_TASKS  where TENANT_ID = $notminor_tenant_id ,0,1200;
obdocker.check_until_timeout select STATUS from CDB_OB_TRANSFER_TASK_history where TENANT_ID = $notminor_tenant_id  order by  CREATE_TIME desc limit 1,COMPLETED,120;
obdocker.mysql alter tenant $tent4name set primary_zone="z1";
obdocker.check_until_timeout select count(*) from dba_ob_tenants where TENANT_NAME="$tent4name" and PRIMARY_ZONE like "%z1;%",1,120;
obdocker.check_until_timeout select count(*) from CDB_OB_TRANSFER_TASKS  where TENANT_ID = $notminor_tenant_id,0,1200;
obdocker.check_until_timeout select STATUS from CDB_OB_TRANSFER_TASK_history where TENANT_ID = $notminor_tenant_id  order by  CREATE_TIME desc limit 1,COMPLETED,120;
use testsvr;
create table t_part1(c1 int, c2 int) partition by hash(c1) partitions 8;
insert into t_part1 values(1, 1);
CREATE TABLEGROUP Tablegroup1;
CREATE TABLEGROUP Tablegroup2 SHARDING="PARTITION";
CREATE TABLEGROUP Tablegroup3 SHARDING="NONE";
CREATE TABLEGROUP Tablegroup1_1;
CREATE TABLEGROUP Tablegroup2_1 SHARDING="PARTITION";
CREATE TABLEGROUP Tablegroup3_1 SHARDING="NONE";
CREATE TABLEGROUP Tablegroup1_2;
CREATE TABLEGROUP Tablegroup2_2 SHARDING="PARTITION";
CREATE TABLEGROUP Tablegroup3_2 SHARDING="NONE";
ALTER TABLEGROUP Tablegroup1_2 ADD TABLE testsql.t_part;
ALTER TABLEGROUP Tablegroup2_2 ADD TABLE testsql.t_part;
ALTER TABLEGROUP Tablegroup3_2 ADD TABLE testsql.t1;
CREATE USER user1 IDENTIFIED BY password;
CREATE USER user2 IDENTIFIED BY password;
CREATE TABLEGROUP TABLEGROUP1;
CREATE TABLEGROUP TABLEGROUP2 SHARDING='PARTITION';
CREATE TABLEGROUP TABLEGROUP3 SHARDING='NONE';
CREATE TABLEGROUP TABLEGROUP1_1;
CREATE TABLEGROUP TABLEGROUP2_1 SHARDING='PARTITION';
CREATE TABLEGROUP TABLEGROUP3_1 SHARDING='NONE';
GRANT DBA TO user1;
GRANT DBA TO user2;
CREATE TABLE t1_listpart(log_id INT,log_value VARCHAR2(20)) PARTITION BY LIST(log_value) (PARTITION P01 VALUES ('A'),PARTITION P02 VALUES ('B'),PARTITION P03 VALUES ('C'));
INSERT INTO t1_listpart (log_id, log_value) VALUES (1, 'A');
INSERT INTO t1_listpart (log_id, log_value) VALUES (2, 'B');
INSERT INTO t1_listpart (log_id, log_value) VALUES (3, 'C');
CREATE TABLE t1(employee_id NUMBER PRIMARY KEY, first_name VARCHAR2(50) NOT NULL, email VARCHAR2(100) NOT NULL UNIQUE, hire_date DATE NOT NULL);
INSERT INTO t1(employee_id, first_name, email, hire_date) VALUES(1, 'John', 'john@example.com', TO_DATE('2023-04-01', 'YYYY-MM-DD'));
CREATE TABLE t2_listpart(log_id INT,log_value VARCHAR2(20)) PARTITION BY LIST(log_value) (PARTITION P01 VALUES ('A'),PARTITION P02 VALUES ('B'),PARTITION P03 VALUES ('C'));
INSERT INTO t2_listpart (log_id, log_value) VALUES (1, 'A');
INSERT INTO t2_listpart (log_id, log_value) VALUES (2, 'B');
INSERT INTO t2_listpart (log_id, log_value) VALUES (3, 'C');
CREATE TABLE t2(employee_id NUMBER PRIMARY KEY, first_name VARCHAR2(50) NOT NULL, email VARCHAR2(100) NOT NULL UNIQUE, hire_date DATE NOT NULL);
INSERT INTO t2(employee_id, first_name, email, hire_date) VALUES(1, 'John', 'john@example.com', TO_DATE('2023-04-01', 'YYYY-MM-DD'));
CREATE TABLEGROUP TABLEGROUP1_3;
CREATE TABLEGROUP TABLEGROUP2_3 SHARDING='PARTITION';
CREATE TABLEGROUP TABLEGROUP3_3 SHARDING='NONE';
ALTER TABLEGROUP TABLEGROUP1_3 ADD TABLE user1.t1_listpart;
ALTER TABLEGROUP TABLEGROUP2_3 ADD TABLE user1.t1;
ALTER TABLEGROUP TABLEGROUP3_3 ADD TABLE user1.t1;
create database collect_mview;
use collect_mview;
create table collect_info(user_id int, item_id int, primary key(user_id, item_id)) partition by hash(user_id) partitions 4;
create table collect_item(item_id int, price int, primary key(item_id)) duplicate_scope = 'cluster' duplicate_read_consistency = 'weak';
insert into collect_item values(1, 100);
insert into collect_item values(2, 200);
insert into collect_item values(3, 300);
insert into collect_info values(1, 1);
insert into collect_info values(1, 2);
insert into collect_info values(2, 1);
insert into collect_info values(2, 3);
insert into collect_info values(3, 3);
create materialized view collect_info_mv (primary key(user_id, item_id)) partition by hash(user_id) partitions 4 refresh fast enable query rewrite enable on query computation as select collect_info.user_id, collect_info.item_id, collect_item.item_id dup_item_id, collect_item.price from collect_info inner join collect_item on collect_info.item_id = collect_item.item_id;
select * from collect_info_mv;
user_id	item_id	dup_item_id	price
1	1	1	100
1	2	2	200
2	1	1	100
2	3	3	300
3	3	3	300
alter system minor freeze tenant = tent_mysql,tent_oracle;
alter system minor freeze tenant = sys;
alter system minor freeze tenant = META$1004,META$1006;
obdocker.check_until_timeout select count(*) from GV\$OB_TABLET_COMPACTION_PROGRESS,0,180;
ALTER SYSTEM MAJOR FREEZE TENANT=ALL;
obdocker.check_until_timeout select count(*) from CDB_OB_MAJOR_COMPACTION where `GLOBAL_BROADCAST_SCN`!=`LAST_SCN` or STATUS!="IDLE",0,2000;
obdocker.z1.force_stop;
obdocker.z1.start;
obdocker.check_until_timeout select count(*) from oceanbase.__all_server where (start_service_time is null  or status='INACTIVE'),0,300;
obdocker.check_until_timeout select count(*) from oceanbase.__all_server a left join oceanbase.__all_virtual_server_schema_info b on a.svr_ip = b.svr_ip and a.svr_port = b.svr_port where b.svr_ip is null, 0, 180;
obdocker.check_until_timeout select count(*) as cnt from oceanbase.__all_virtual_server_schema_info as a join oceanbase.__all_virtual_server_schema_info as b on a.tenant_id = b.tenant_id  where a.refreshed_schema_version != b.refreshed_schema_version or a.refreshed_schema_version % 8 != 0, 0, 180;
obdocker.z2.force_stop;
obdocker.z2.start;
obdocker.check_until_timeout select count(*) from oceanbase.__all_server where (start_service_time is null  or status='INACTIVE'),0,300;
obdocker.check_until_timeout select count(*) from oceanbase.__all_server a left join oceanbase.__all_virtual_server_schema_info b on a.svr_ip = b.svr_ip and a.svr_port = b.svr_port where b.svr_ip is null, 0, 180;
obdocker.check_until_timeout select count(*) as cnt from oceanbase.__all_virtual_server_schema_info as a join oceanbase.__all_virtual_server_schema_info as b on a.tenant_id = b.tenant_id  where a.refreshed_schema_version != b.refreshed_schema_version or a.refreshed_schema_version % 8 != 0, 0, 180;
obdocker.z3.force_stop;
obdocker.z3.start;
obdocker.check_until_timeout select count(*) from oceanbase.__all_server where (start_service_time is null  or status='INACTIVE'),0,300;
obdocker.check_until_timeout select count(*) from oceanbase.__all_server a left join oceanbase.__all_virtual_server_schema_info b on a.svr_ip = b.svr_ip and a.svr_port = b.svr_port where b.svr_ip is null, 0, 180;
obdocker.check_until_timeout select count(*) as cnt from oceanbase.__all_virtual_server_schema_info as a join oceanbase.__all_virtual_server_schema_info as b on a.tenant_id = b.tenant_id  where a.refreshed_schema_version != b.refreshed_schema_version or a.refreshed_schema_version % 8 != 0, 0, 180;
obdocker.check_until_timeout select SVR_PORT from DBA_OB_UNITS where zone="z2" and UNIT_ID=$z2_unitid,$z2_unitport,60;
obdocker.check_until_timeout select count(*) from  DBA_OB_UNITS where TENANT_ID =$mysql_tenant_id and ZONE="z2" and MIGRATE_FROM_SVR_IP IS NULL and MIGRATE_FROM_SVR_PORT IS NULL and MANUAL_MIGRATE IS NULL,1,120;
alter system set server_permanent_offline_time = "60s";
obdocker.check_until_timeout select distinct VALUE from  GV\$OB_PARAMETERS where name="server_permanent_offline_time",60s,10;
obdocker.check_until_timeout select count(*) from oceanbase.__all_server where (start_service_time is null  or status='INACTIVE'),0,300;
obdocker.check_until_timeout select count(*) from oceanbase.__all_server a left join oceanbase.__all_virtual_server_schema_info b on a.svr_ip = b.svr_ip and a.svr_port = b.svr_port where b.svr_ip is null, 0, 180;
obdocker.check_until_timeout select count(*) as cnt from oceanbase.__all_virtual_server_schema_info as a join oceanbase.__all_virtual_server_schema_info as b on a.tenant_id = b.tenant_id  where a.refreshed_schema_version != b.refreshed_schema_version or a.refreshed_schema_version % 8 != 0, 0, 180;
alter system set server_permanent_offline_time = "3600s";
obdocker.check_until_timeout select count(*) from __all_virtual_log_stat where paxos_member_list not like "%,%",0,600;
obdocker.check_until_timeout select count(*) from dba_ob_unit_jobs where job_status!="success",0,600;
obdocker.check_until_timeout select count(*) from dba_ob_server_jobs where job_status!="success",0,600;
obdocker.check_until_timeout select count(*) from dba_ob_unit_jobs where job_status!="success",0,600;
obdocker.check_until_timeout select count(*) from dba_ob_server_jobs where job_status!="success",0,600;
ALTER RESOURCE UNIT unit_mysql MAX_CPU 2, MEMORY_SIZE '4G',LOG_DISK_SIZE '10G';
obdocker.check_until_timeout select count(*) FROM oceanbase.DBA_OB_UNIT_CONFIGS WHERE NAME = "$unit1name" and MAX_CPU=2 and (MEMORY_SIZE/1073741824)=4, 1, 120;
ALTER RESOURCE UNIT unit_mysql MAX_CPU 1, MEMORY_SIZE '3G',LOG_DISK_SIZE '10G';
obdocker.check_until_timeout select count(*) FROM oceanbase.DBA_OB_UNIT_CONFIGS WHERE NAME = "$unit1name" and MAX_CPU=1 and (MEMORY_SIZE/1073741824)=3, 1, 120;
obdocker.check_until_timeout select count(*) from GV\$OB_UNITS where STATUS!="NORMAL" and TENANT_ID="$oracle_tenant_id",0,1500;
obdocker.check_until_timeout select count(*) from dba_ob_unit_jobs where job_status!="success",0,600;
obdocker.check_until_timeout select count(*) from GV\$OB_UNITS where STATUS!="NORMAL",0,1500;
obdocker.check_until_timeout select unit_count from DBA_OB_RESOURCE_POOLS where name="$pool2name",2,30;
obdocker.check_until_timeout select count(*) from GV\$OB_UNITS where STATUS!="NORMAL"  and TENANT_ID="$oracle_tenant_id",0,1500;
obdocker.check_until_timeout select count(*) from dba_ob_units where MIGRATE_FROM_SVR_IP IS NOT NULL,0,600;
obdocker.check_until_timeout select job_status from (select * from __all_rootservice_job order by 1  desc limit 1),SUCCESS,300;
ALTER RESOURCE TENANT tent_oracle UNIT_NUM = 1;
obdocker.check_until_timeout select count(*) from dba_ob_unit_jobs where job_status!="success",0,600;
obdocker.check_until_timeout select count(*) from GV\$OB_UNITS where STATUS!="NORMAL",0,1500;
obdocker.check_until_timeout select unit_count from DBA_OB_RESOURCE_POOLS where name="$pool2name",1,30;
obdocker.check_until_timeout select job_status from (select * from __all_rootservice_job order by 1  desc limit 1),SUCCESS,300;
obdocker.z2.force_stop;
obdocker.check_until_timeout  select count(*) from __all_virtual_log_stat where tenant_id=$mysql_tenant_id and degraded_list not like "$degrade_ip%",0,180;
obdocker.z2.nstart;
obdocker.check_until_timeout  select count(*) from __all_virtual_log_stat where tenant_id=$mysql_tenant_id and degraded_list not like "",0,180;
obdocker.check_until_timeout select count(*) from oceanbase.__all_server where (start_service_time is null  or status='INACTIVE'),0,300;
obdocker.check_until_timeout select count(*) from oceanbase.__all_server a left join oceanbase.__all_virtual_server_schema_info b on a.svr_ip = b.svr_ip and a.svr_port = b.svr_port where b.svr_ip is null, 0, 180;
obdocker.check_until_timeout select count(*) as cnt from oceanbase.__all_virtual_server_schema_info as a join oceanbase.__all_virtual_server_schema_info as b on a.tenant_id = b.tenant_id  where a.refreshed_schema_version != b.refreshed_schema_version or a.refreshed_schema_version % 8 != 0, 0, 180;
alter system minor freeze tenant = tent_mysql,tent_oracle;
alter system minor freeze tenant = sys;
alter system minor freeze tenant = META$1004,META$1006;
obdocker.check_until_timeout select count(*) from GV\$OB_TABLET_COMPACTION_PROGRESS,0,180;
obdocker.check_until_timeout select count(*) from oceanbase.__all_server where (start_service_time is null  or status='INACTIVE'),0,300;
obdocker.check_until_timeout select count(*) from oceanbase.__all_server a left join oceanbase.__all_virtual_server_schema_info b on a.svr_ip = b.svr_ip and a.svr_port = b.svr_port where b.svr_ip is null, 0, 180;
obdocker.check_until_timeout select count(*) as cnt from oceanbase.__all_virtual_server_schema_info as a join oceanbase.__all_virtual_server_schema_info as b on a.tenant_id = b.tenant_id  where a.refreshed_schema_version != b.refreshed_schema_version or a.refreshed_schema_version % 8 != 0, 0, 180;
obdocker.asvr0.force_stop;
obdocker.asvr0.upgrade;
obdocker.asvr0.nstart;
obdocker.check_until_timeout select count(*) from __all_virtual_tenant_parameter_stat where name = 'compatible' and value!="$source_version",0,1;
obdocker.asvr0.force_stop;
obdocker.asvr0.nstart;
obdocker.z2.force_stop;
obdocker.check_until_timeout  select count(*) from __all_virtual_log_stat where tenant_id=$mysql_tenant_id and degraded_list not like "$degrade_ip%",0,180;
obdocker.z2.nstart;
obdocker.check_until_timeout  select count(*) from __all_virtual_log_stat where tenant_id=$mysql_tenant_id and degraded_list not like "",0,180;
obdocker.check_until_timeout select count(*) from oceanbase.__all_server where (start_service_time is null  or status='INACTIVE'),0,300;
obdocker.check_until_timeout select count(*) from oceanbase.__all_server a left join oceanbase.__all_virtual_server_schema_info b on a.svr_ip = b.svr_ip and a.svr_port = b.svr_port where b.svr_ip is null, 0, 180;
obdocker.check_until_timeout select count(*) as cnt from oceanbase.__all_virtual_server_schema_info as a join oceanbase.__all_virtual_server_schema_info as b on a.tenant_id = b.tenant_id  where a.refreshed_schema_version != b.refreshed_schema_version or a.refreshed_schema_version % 8 != 0, 0, 180;
alter system minor freeze tenant = tent_mysql,tent_oracle;
alter system minor freeze tenant = sys;
alter system minor freeze tenant = META$1004,META$1006;
obdocker.check_until_timeout select count(*) from GV\$OB_TABLET_COMPACTION_PROGRESS,0,180;
obdocker.check_until_timeout select count(*) from oceanbase.__all_server where (start_service_time is null  or status='INACTIVE'),0,300;
obdocker.check_until_timeout select count(*) from oceanbase.__all_server a left join oceanbase.__all_virtual_server_schema_info b on a.svr_ip = b.svr_ip and a.svr_port = b.svr_port where b.svr_ip is null, 0, 180;
obdocker.check_until_timeout select count(*) as cnt from oceanbase.__all_virtual_server_schema_info as a join oceanbase.__all_virtual_server_schema_info as b on a.tenant_id = b.tenant_id  where a.refreshed_schema_version != b.refreshed_schema_version or a.refreshed_schema_version % 8 != 0, 0, 180;
use testsql;
insert into t1 values(50, 50),(60, 60) ;
insert into t_part values(50, 50);
insert into t_part values(60, 60);
update t1 set c2=1010 where c1=10;
update t_part set c2=1010 where c1=10;
delete from t1 where c1=16;
delete from t_part where c1=16;
insert into t2 values (30,6,30),(31, 5, 31), (32, 4, 32);
update t2 set c2=1515 where c1=15;
delete from t2 where c1=18;
use testsvr;
insert into t3 (c1,c2,c3,c4) values(108,"a108","b108","c108"),(109,"a109","b109","c1009");
update t3 set c2="c101" where c1=101;
delete from t3 where c1=105;
obdocker.mysql alter tenant sys set primary_zone = "$rootservice_zone";
obdocker.check_until_timeout  select zone from DBA_OB_LS_LOCATIONS where role="leader",$rootservice_zone,120;
obdocker.check_until_timeout select count(*) from DBA_OB_SERVERS where WITH_ROOTSERVER="YES" and svr_ip = "$rootservice_port",0,120;
obdocker.check_until_timeout select count(*) from oceanbase.__all_server where (start_service_time is null  or status='INACTIVE'),0,300;
obdocker.check_until_timeout select count(*) from oceanbase.__all_server a left join oceanbase.__all_virtual_server_schema_info b on a.svr_ip = b.svr_ip and a.svr_port = b.svr_port where b.svr_ip is null, 0, 180;
obdocker.check_until_timeout select count(*) as cnt from oceanbase.__all_virtual_server_schema_info as a join oceanbase.__all_virtual_server_schema_info as b on a.tenant_id = b.tenant_id  where a.refreshed_schema_version != b.refreshed_schema_version or a.refreshed_schema_version % 8 != 0, 0, 180;
obdocker.check_until_timeout select count(*) from oceanbase.__all_server where (start_service_time is null  or status='INACTIVE'),0,300;
obdocker.check_until_timeout select count(*) from oceanbase.__all_server a left join oceanbase.__all_virtual_server_schema_info b on a.svr_ip = b.svr_ip and a.svr_port = b.svr_port where b.svr_ip is null, 0, 180;
obdocker.check_until_timeout select count(*) as cnt from oceanbase.__all_virtual_server_schema_info as a join oceanbase.__all_virtual_server_schema_info as b on a.tenant_id = b.tenant_id  where a.refreshed_schema_version != b.refreshed_schema_version or a.refreshed_schema_version % 8 != 0, 0, 180;
obdocker.mysql alter system begin upgrade;
obdocker.upgrade_commond_for_server pre;
obdocker.upgrade_health_checker;
obdocker.mysql alter system stop zone "z2";
obdocker.z2.force_stop;
obdocker.z2.upgrade;
obdocker.z2.start;
obdocker.check_until_timeout select count(*) from oceanbase.__all_server where (start_service_time is null  or status='INACTIVE'),0,300;
obdocker.check_until_timeout select count(*) from oceanbase.__all_server a left join oceanbase.__all_virtual_server_schema_info b on a.svr_ip = b.svr_ip and a.svr_port = b.svr_port where b.svr_ip is null, 0, 180;
obdocker.check_until_timeout select count(*) as cnt from oceanbase.__all_virtual_server_schema_info as a join oceanbase.__all_virtual_server_schema_info as b on a.tenant_id = b.tenant_id  where a.refreshed_schema_version != b.refreshed_schema_version or a.refreshed_schema_version % 8 != 0, 0, 180;
obdocker.upgrade_health_checker z2;
obdocker.mysql alter system start zone "z2";
obdocker.check_until_timeout select count(*) from __all_server where zone="z2" and build_version not like "$dest_version%",0,120;
obdocker.check_until_timeout select count(*) from __all_virtual_tenant_parameter_stat where name = 'compatible' and value!="$source_version",0,1;
use testsql;
insert into t1 values(11, 11),(12, 12) ;
insert into t_part values(11, 11);
insert into t_part values(12, 12);
update t1 set c2=77 where c1=7;
update t_part set c2=77 where c1=7;
delete from t1 where c1=6;
delete from t_part where c1=6;
insert into t2 values (10,6,10),(11, 5, 11), (12, 4, 12);
update t2 set c2=77 where c1=7;
use testsvr;
insert into t3 (c1,c2,c3,c4) values(100,"a100","b100","c100"),(100,"a101","b101","c1001");
update t3 set c2="c10" where c1=10;
delete from t3 where c1=11;
use testsql;
insert into t1 values(13, 13),(14, 14) ;
insert into t_part values(13, 13);
insert into t_part values(14, 14);
update t1 set c2=111 where c1=11;
update t_part set c2=111 where c1=11;
delete from t1 where c1=12;
delete from t_part where c1=12;
insert into t2 values (13,6,13),(15, 5, 13), (14, 4, 14);
update t2 set c2=99 where c1=9;
delete from t2 where c1=1;
use testsvr;
insert into t3 (c1,c2,c3,c4) values(102,"a102","b102","c102"),(103,"a103","b103","c1003");
update t3 set c2="c19" where c1=19;
delete from t3 where c1=29;
use testsql;
insert /*+ direct(true,100,'inc_replace') enable_parallel_dml parallel(2)*/ into tbl1_l select * from t1_1;
delete from tbl2_l;
insert /*+ append enable_parallel_dml parallel(N) */ into tbl2_l select * from tbl1_l;
use test_mview;
select OWNER,MVIEW_NAME,QUERY,REFRESH_MODE,REFRESH_METHOD,BUILD_MODE,LAST_REFRESH_DATE IS NULL,LAST_REFRESH_END_TIME IS NULL,TIMESTAMPDIFF(SECOND, LAST_REFRESH_DATE, LAST_REFRESH_END_TIME) < 10 from oceanbase.DBA_MVIEWS where OWNER = 'test_mview' AND MVIEW_NAME IN ('mv1', 'mv2') ORDER BY MVIEW_NAME;
OWNER	MVIEW_NAME	QUERY	REFRESH_MODE	REFRESH_METHOD	BUILD_MODE	LAST_REFRESH_DATE IS NULL	LAST_REFRESH_END_TIME IS NULL	TIMESTAMPDIFF(SECOND, LAST_REFRESH_DATE, LAST_REFRESH_END_TIME) < 10
test_mview	mv1	select `test_mview`.`t1`.`c2` AS `c2`,count(*) AS `cnt`,count(`test_mview`.`t1`.`c3`) AS `cnt_c3`,sum(`test_mview`.`t1`.`c3`) AS `sum_c3` from `test_mview`.`t1` group by `test_mview`.`t1`.`c2`	DEMAND	FAST	IMMEDIATE	0	0	1
test_mview	mv2	select `test_mview`.`t1`.`c1` AS `c1`,`test_mview`.`t1`.`c2` AS `c2`,`test_mview`.`t1`.`c3` AS `c3`,`test_mview`.`t1`.`c4` AS `c4` from `test_mview`.`t1`	DEMAND	FORCE	IMMEDIATE	0	0	1
insert into t1 select s1.nextval, s1.nextval, s1.nextval, s1.nextval from table(generator(100000));
call dbms_mview.refresh('mv1');
call dbms_mview.refresh('mv2');
Got one of the listed errors
select OWNER,MVIEW_NAME,QUERY,REFRESH_MODE,REFRESH_METHOD,BUILD_MODE,LAST_REFRESH_DATE IS NULL,LAST_REFRESH_END_TIME IS NULL,TIMESTAMPDIFF(SECOND, LAST_REFRESH_DATE, LAST_REFRESH_END_TIME) < 10 from oceanbase.DBA_MVIEWS where OWNER = 'test_mview' AND MVIEW_NAME IN ('mv1', 'mv2') ORDER BY MVIEW_NAME;
OWNER	MVIEW_NAME	QUERY	REFRESH_MODE	REFRESH_METHOD	BUILD_MODE	LAST_REFRESH_DATE IS NULL	LAST_REFRESH_END_TIME IS NULL	TIMESTAMPDIFF(SECOND, LAST_REFRESH_DATE, LAST_REFRESH_END_TIME) < 10
test_mview	mv1	select `test_mview`.`t1`.`c2` AS `c2`,count(*) AS `cnt`,count(`test_mview`.`t1`.`c3`) AS `cnt_c3`,sum(`test_mview`.`t1`.`c3`) AS `sum_c3` from `test_mview`.`t1` group by `test_mview`.`t1`.`c2`	DEMAND	FAST	IMMEDIATE	0	0	1
test_mview	mv2	select `test_mview`.`t1`.`c1` AS `c1`,`test_mview`.`t1`.`c2` AS `c2`,`test_mview`.`t1`.`c3` AS `c3`,`test_mview`.`t1`.`c4` AS `c4` from `test_mview`.`t1`	DEMAND	FORCE	IMMEDIATE	0	0	1
use testsql;
use testsql;
obdocker.z1.force_stop;
obdocker.z1.start;
obdocker.check_until_timeout select count(*) from oceanbase.__all_server where (start_service_time is null  or status='INACTIVE'),0,300;
obdocker.check_until_timeout select count(*) from oceanbase.__all_server a left join oceanbase.__all_virtual_server_schema_info b on a.svr_ip = b.svr_ip and a.svr_port = b.svr_port where b.svr_ip is null, 0, 180;
obdocker.check_until_timeout select count(*) as cnt from oceanbase.__all_virtual_server_schema_info as a join oceanbase.__all_virtual_server_schema_info as b on a.tenant_id = b.tenant_id  where a.refreshed_schema_version != b.refreshed_schema_version or a.refreshed_schema_version % 8 != 0, 0, 180;
obdocker.z2.force_stop;
obdocker.z2.start;
obdocker.check_until_timeout select count(*) from oceanbase.__all_server where (start_service_time is null  or status='INACTIVE'),0,300;
obdocker.check_until_timeout select count(*) from oceanbase.__all_server a left join oceanbase.__all_virtual_server_schema_info b on a.svr_ip = b.svr_ip and a.svr_port = b.svr_port where b.svr_ip is null, 0, 180;
obdocker.check_until_timeout select count(*) as cnt from oceanbase.__all_virtual_server_schema_info as a join oceanbase.__all_virtual_server_schema_info as b on a.tenant_id = b.tenant_id  where a.refreshed_schema_version != b.refreshed_schema_version or a.refreshed_schema_version % 8 != 0, 0, 180;
obdocker.z3.force_stop;
obdocker.z3.start;
obdocker.check_until_timeout select count(*) from oceanbase.__all_server where (start_service_time is null  or status='INACTIVE'),0,300;
obdocker.check_until_timeout select count(*) from oceanbase.__all_server a left join oceanbase.__all_virtual_server_schema_info b on a.svr_ip = b.svr_ip and a.svr_port = b.svr_port where b.svr_ip is null, 0, 180;
obdocker.check_until_timeout select count(*) as cnt from oceanbase.__all_virtual_server_schema_info as a join oceanbase.__all_virtual_server_schema_info as b on a.tenant_id = b.tenant_id  where a.refreshed_schema_version != b.refreshed_schema_version or a.refreshed_schema_version % 8 != 0, 0, 180;
alter system minor freeze tenant = tent_mysql,tent_oracle;
alter system minor freeze tenant = sys;
alter system minor freeze tenant = META$1004,META$1006;
obdocker.check_until_timeout select count(*) from GV\$OB_TABLET_COMPACTION_PROGRESS,0,180;
obdocker.check_until_timeout select SVR_PORT from DBA_OB_UNITS where zone="z2" and UNIT_ID=$z2_unitid,$z2_unitport,60;
obdocker.check_until_timeout select count(*) from  DBA_OB_UNITS where TENANT_ID =$mysql_tenant_id and ZONE="z2" and MIGRATE_FROM_SVR_IP IS NULL and MIGRATE_FROM_SVR_PORT IS NULL and MANUAL_MIGRATE IS NULL,1,120;
alter system set server_permanent_offline_time = "60s";
obdocker.check_until_timeout select distinct VALUE from  GV\$OB_PARAMETERS where name="server_permanent_offline_time",60s,10;
obdocker.check_until_timeout select count(*) from oceanbase.__all_server where (start_service_time is null  or status='INACTIVE'),0,300;
obdocker.check_until_timeout select count(*) from oceanbase.__all_server a left join oceanbase.__all_virtual_server_schema_info b on a.svr_ip = b.svr_ip and a.svr_port = b.svr_port where b.svr_ip is null, 0, 180;
obdocker.check_until_timeout select count(*) as cnt from oceanbase.__all_virtual_server_schema_info as a join oceanbase.__all_virtual_server_schema_info as b on a.tenant_id = b.tenant_id  where a.refreshed_schema_version != b.refreshed_schema_version or a.refreshed_schema_version % 8 != 0, 0, 180;
alter system set server_permanent_offline_time = "3600s";
obdocker.check_until_timeout select count(*) from __all_virtual_log_stat where paxos_member_list not like "%,%",0,600;
obdocker.check_until_timeout select count(*) from dba_ob_unit_jobs where job_status!="success",0,600;
obdocker.check_until_timeout select count(*) from dba_ob_server_jobs where job_status!="success",0,600;
obdocker.check_until_timeout select count(*) from dba_ob_unit_jobs where job_status!="success",0,600;
obdocker.check_until_timeout select count(*) from dba_ob_server_jobs where job_status!="success",0,600;
ALTER RESOURCE UNIT unit_mysql MAX_CPU 2, MEMORY_SIZE '4G',LOG_DISK_SIZE '10G';
obdocker.check_until_timeout select count(*) FROM oceanbase.DBA_OB_UNIT_CONFIGS WHERE NAME = "$unit1name" and MAX_CPU=2 and (MEMORY_SIZE/1073741824)=4, 1, 120;
ALTER RESOURCE UNIT unit_mysql MAX_CPU 1, MEMORY_SIZE '3G',LOG_DISK_SIZE '10G';
obdocker.check_until_timeout select count(*) FROM oceanbase.DBA_OB_UNIT_CONFIGS WHERE NAME = "$unit1name" and MAX_CPU=1 and (MEMORY_SIZE/1073741824)=3, 1, 120;
obdocker.check_until_timeout select count(*) from GV\$OB_UNITS where STATUS!="NORMAL" and TENANT_ID="$oracle_tenant_id",0,1500;
obdocker.check_until_timeout select count(*) from dba_ob_unit_jobs where job_status!="success",0,600;
obdocker.check_until_timeout select count(*) from GV\$OB_UNITS where STATUS!="NORMAL",0,1500;
obdocker.check_until_timeout select unit_count from DBA_OB_RESOURCE_POOLS where name="$pool2name",2,30;
obdocker.check_until_timeout select count(*) from GV\$OB_UNITS where STATUS!="NORMAL"  and TENANT_ID="$oracle_tenant_id",0,1500;
obdocker.check_until_timeout select count(*) from dba_ob_units where MIGRATE_FROM_SVR_IP IS NOT NULL,0,600;
obdocker.check_until_timeout select job_status from (select * from __all_rootservice_job order by 1  desc limit 1),SUCCESS,300;
ALTER RESOURCE TENANT tent_oracle UNIT_NUM = 1;
obdocker.check_until_timeout select count(*) from dba_ob_unit_jobs where job_status!="success",0,600;
obdocker.check_until_timeout select count(*) from GV\$OB_UNITS where STATUS!="NORMAL",0,1500;
obdocker.check_until_timeout select unit_count from DBA_OB_RESOURCE_POOLS where name="$pool2name",1,30;
obdocker.check_until_timeout select job_status from (select * from __all_rootservice_job order by 1  desc limit 1),SUCCESS,300;
obdocker.z2.force_stop;
obdocker.check_until_timeout  select count(*) from __all_virtual_log_stat where tenant_id=$mysql_tenant_id and degraded_list not like "$degrade_ip%",0,180;
obdocker.z2.nstart;
obdocker.check_until_timeout  select count(*) from __all_virtual_log_stat where tenant_id=$mysql_tenant_id and degraded_list not like "",0,180;
obdocker.check_until_timeout select count(*) from oceanbase.__all_server where (start_service_time is null  or status='INACTIVE'),0,300;
obdocker.check_until_timeout select count(*) from oceanbase.__all_server a left join oceanbase.__all_virtual_server_schema_info b on a.svr_ip = b.svr_ip and a.svr_port = b.svr_port where b.svr_ip is null, 0, 180;
obdocker.check_until_timeout select count(*) as cnt from oceanbase.__all_virtual_server_schema_info as a join oceanbase.__all_virtual_server_schema_info as b on a.tenant_id = b.tenant_id  where a.refreshed_schema_version != b.refreshed_schema_version or a.refreshed_schema_version % 8 != 0, 0, 180;
alter system minor freeze tenant = tent_mysql,tent_oracle;
alter system minor freeze tenant = sys;
alter system minor freeze tenant = META$1004,META$1006;
obdocker.check_until_timeout select count(*) from GV\$OB_TABLET_COMPACTION_PROGRESS,0,180;
obdocker.mysql alter tenant sys set primary_zone = "$rootservice_zone";
obdocker.check_until_timeout  select zone from DBA_OB_LS_LOCATIONS where role="leader",$rootservice_zone,120;
obdocker.check_until_timeout select count(*) from DBA_OB_SERVERS where WITH_ROOTSERVER="YES" and svr_ip = "$rootservice_port",0,120;
obdocker.check_until_timeout select count(*) from oceanbase.__all_server where (start_service_time is null  or status='INACTIVE'),0,300;
obdocker.check_until_timeout select count(*) from oceanbase.__all_server a left join oceanbase.__all_virtual_server_schema_info b on a.svr_ip = b.svr_ip and a.svr_port = b.svr_port where b.svr_ip is null, 0, 180;
obdocker.check_until_timeout select count(*) as cnt from oceanbase.__all_virtual_server_schema_info as a join oceanbase.__all_virtual_server_schema_info as b on a.tenant_id = b.tenant_id  where a.refreshed_schema_version != b.refreshed_schema_version or a.refreshed_schema_version % 8 != 0, 0, 180;
obdocker.mysql alter system stop zone z3;
obdocker.z3.force_stop;
obdocker.z3.upgrade;
obdocker.z3.start;
obdocker.check_until_timeout select count(*) from oceanbase.__all_server where (start_service_time is null  or status='INACTIVE'),0,300;
obdocker.check_until_timeout select count(*) from oceanbase.__all_server a left join oceanbase.__all_virtual_server_schema_info b on a.svr_ip = b.svr_ip and a.svr_port = b.svr_port where b.svr_ip is null, 0, 180;
obdocker.check_until_timeout select count(*) as cnt from oceanbase.__all_virtual_server_schema_info as a join oceanbase.__all_virtual_server_schema_info as b on a.tenant_id = b.tenant_id  where a.refreshed_schema_version != b.refreshed_schema_version or a.refreshed_schema_version % 8 != 0, 0, 180;
obdocker.upgrade_health_checker z3;
obdocker.mysql alter system start zone z3;
obdocker.check_until_timeout select count(*) from __all_server where zone="z3" and build_version not like "$dest_version%",0,120;
obdocker.check_until_timeout select count(*) from __all_virtual_tenant_parameter_stat where name = 'compatible' and value!="$source_version",0,1;
ALTER SYSTEM SET query_response_time_stats=true;
obdocker.check_until_timeout SELECT count(*) FROM oceanbase.GV\$OB_PARAMETERS WHERE NAME LIKE "query_response_time_stats" and value!="true" and tenant_id=1,0,5;
obdocker.check_until_timeout select count(*) from __all_virtual_tenant_parameter_stat where name = 'compatible' and value!="$source_version",0,1;
ALTER SYSTEM SET query_response_time_stats=false;
obdocker.check_until_timeout SELECT count(*) FROM oceanbase.GV\$OB_PARAMETERS WHERE NAME LIKE "query_response_time_stats" and value!="false"and tenant_id=1,0,5;
use testsql;
insert into t1 values(15, 15),(16, 16) ;
insert into t_part values(15, 15);
insert into t_part values(16, 16);
update t1 set c2=44 where c1=4;
update t_part set c2=44 where c1=4;
delete from t1 where c1=12;
delete from t_part where c1=12;
insert into t2 values (16,6,16),(17, 5, 17), (18, 4, 18);
update t2 set c2=1010 where c1=10;
delete from t2 where c1=14;
use testsvr;
insert into t3 (c1,c2,c3,c4) values(104,"a104","b104","c104"),(105,"a105","b105","c1005");
update t3 set c2="c20" where c1=20;
delete from t3 where c1=32;
use testsql;
insert into t1 values(17, 17),(18, 18) ;
insert into t_part values(17, 17);
insert into t_part values(18, 18);
update t1 set c2=131 where c1=3;
update t_part set c2=131 where c1=3;
delete from t1 where c1=8;
delete from t_part where c1=8;
insert into t2 values (19,6,19),(20, 5, 20), (21, 4, 21);
update t2 set c2=99 where c1=9;
delete from t2 where c1=18;
alter system minor freeze tenant = tent_mysql,tent_oracle;
alter system minor freeze tenant = sys;
alter system minor freeze tenant = META$1004,META$1006;
obdocker.check_until_timeout select count(*) from GV\$OB_TABLET_COMPACTION_PROGRESS,0,180;
obdocker.z1.force_stop;
obdocker.z1.start;
obdocker.check_until_timeout select count(*) from oceanbase.__all_server where (start_service_time is null  or status='INACTIVE'),0,300;
obdocker.check_until_timeout select count(*) from oceanbase.__all_server a left join oceanbase.__all_virtual_server_schema_info b on a.svr_ip = b.svr_ip and a.svr_port = b.svr_port where b.svr_ip is null, 0, 180;
obdocker.check_until_timeout select count(*) as cnt from oceanbase.__all_virtual_server_schema_info as a join oceanbase.__all_virtual_server_schema_info as b on a.tenant_id = b.tenant_id  where a.refreshed_schema_version != b.refreshed_schema_version or a.refreshed_schema_version % 8 != 0, 0, 180;
obdocker.z2.force_stop;
obdocker.z2.start;
obdocker.check_until_timeout select count(*) from oceanbase.__all_server where (start_service_time is null  or status='INACTIVE'),0,300;
obdocker.check_until_timeout select count(*) from oceanbase.__all_server a left join oceanbase.__all_virtual_server_schema_info b on a.svr_ip = b.svr_ip and a.svr_port = b.svr_port where b.svr_ip is null, 0, 180;
obdocker.check_until_timeout select count(*) as cnt from oceanbase.__all_virtual_server_schema_info as a join oceanbase.__all_virtual_server_schema_info as b on a.tenant_id = b.tenant_id  where a.refreshed_schema_version != b.refreshed_schema_version or a.refreshed_schema_version % 8 != 0, 0, 180;
obdocker.z3.force_stop;
obdocker.z3.start;
obdocker.check_until_timeout select count(*) from oceanbase.__all_server where (start_service_time is null  or status='INACTIVE'),0,300;
obdocker.check_until_timeout select count(*) from oceanbase.__all_server a left join oceanbase.__all_virtual_server_schema_info b on a.svr_ip = b.svr_ip and a.svr_port = b.svr_port where b.svr_ip is null, 0, 180;
obdocker.check_until_timeout select count(*) as cnt from oceanbase.__all_virtual_server_schema_info as a join oceanbase.__all_virtual_server_schema_info as b on a.tenant_id = b.tenant_id  where a.refreshed_schema_version != b.refreshed_schema_version or a.refreshed_schema_version % 8 != 0, 0, 180;
obdocker.check_until_timeout select SVR_PORT from DBA_OB_UNITS where zone="z2" and UNIT_ID=$z2_unitid,$z2_unitport,60;
obdocker.check_until_timeout select count(*) from  DBA_OB_UNITS where TENANT_ID =$mysql_tenant_id and ZONE="z2" and MIGRATE_FROM_SVR_IP IS NULL and MIGRATE_FROM_SVR_PORT IS NULL and MANUAL_MIGRATE IS NULL,1,120;
alter system set server_permanent_offline_time = "60s";
obdocker.check_until_timeout select distinct VALUE from  GV\$OB_PARAMETERS where name="server_permanent_offline_time",60s,10;
obdocker.check_until_timeout select count(*) from oceanbase.__all_server where (start_service_time is null  or status='INACTIVE'),0,300;
obdocker.check_until_timeout select count(*) from oceanbase.__all_server a left join oceanbase.__all_virtual_server_schema_info b on a.svr_ip = b.svr_ip and a.svr_port = b.svr_port where b.svr_ip is null, 0, 180;
obdocker.check_until_timeout select count(*) as cnt from oceanbase.__all_virtual_server_schema_info as a join oceanbase.__all_virtual_server_schema_info as b on a.tenant_id = b.tenant_id  where a.refreshed_schema_version != b.refreshed_schema_version or a.refreshed_schema_version % 8 != 0, 0, 180;
alter system set server_permanent_offline_time = "3600s";
obdocker.check_until_timeout select count(*) from __all_virtual_log_stat where paxos_member_list not like "%,%",0,600;
obdocker.check_until_timeout select count(*) from dba_ob_unit_jobs where job_status!="success",0,600;
obdocker.check_until_timeout select count(*) from dba_ob_server_jobs where job_status!="success",0,600;
obdocker.check_until_timeout select count(*) from dba_ob_unit_jobs where job_status!="success",0,600;
obdocker.check_until_timeout select count(*) from dba_ob_server_jobs where job_status!="success",0,600;
ALTER RESOURCE UNIT unit_mysql MAX_CPU 2, MEMORY_SIZE '4G',LOG_DISK_SIZE '10G';
obdocker.check_until_timeout select count(*) FROM oceanbase.DBA_OB_UNIT_CONFIGS WHERE NAME = "$unit1name" and MAX_CPU=2 and (MEMORY_SIZE/1073741824)=4, 1, 120;
ALTER RESOURCE UNIT unit_mysql MAX_CPU 1, MEMORY_SIZE '3G',LOG_DISK_SIZE '10G';
obdocker.check_until_timeout select count(*) FROM oceanbase.DBA_OB_UNIT_CONFIGS WHERE NAME = "$unit1name" and MAX_CPU=1 and (MEMORY_SIZE/1073741824)=3, 1, 120;
obdocker.check_until_timeout select count(*) from GV\$OB_UNITS where STATUS!="NORMAL" and TENANT_ID="$oracle_tenant_id",0,1500;
obdocker.check_until_timeout select count(*) from dba_ob_unit_jobs where job_status!="success",0,600;
obdocker.check_until_timeout select count(*) from GV\$OB_UNITS where STATUS!="NORMAL",0,1500;
obdocker.check_until_timeout select unit_count from DBA_OB_RESOURCE_POOLS where name="$pool2name",2,30;
obdocker.check_until_timeout select count(*) from GV\$OB_UNITS where STATUS!="NORMAL"  and TENANT_ID="$oracle_tenant_id",0,1500;
obdocker.check_until_timeout select count(*) from dba_ob_units where MIGRATE_FROM_SVR_IP IS NOT NULL,0,600;
obdocker.check_until_timeout select job_status from (select * from __all_rootservice_job order by 1  desc limit 1),SUCCESS,300;
ALTER RESOURCE TENANT tent_oracle UNIT_NUM = 1;
obdocker.check_until_timeout select count(*) from dba_ob_unit_jobs where job_status!="success",0,600;
obdocker.check_until_timeout select count(*) from GV\$OB_UNITS where STATUS!="NORMAL",0,1500;
obdocker.check_until_timeout select unit_count from DBA_OB_RESOURCE_POOLS where name="$pool2name",1,30;
obdocker.check_until_timeout select job_status from (select * from __all_rootservice_job order by 1  desc limit 1),SUCCESS,300;
obdocker.z2.force_stop;
obdocker.check_until_timeout  select count(*) from __all_virtual_log_stat where tenant_id=$mysql_tenant_id and degraded_list not like "$degrade_ip%",0,180;
obdocker.z2.nstart;
obdocker.check_until_timeout  select count(*) from __all_virtual_log_stat where tenant_id=$mysql_tenant_id and degraded_list not like "",0,180;
obdocker.check_until_timeout select count(*) from oceanbase.__all_server where (start_service_time is null  or status='INACTIVE'),0,300;
obdocker.check_until_timeout select count(*) from oceanbase.__all_server a left join oceanbase.__all_virtual_server_schema_info b on a.svr_ip = b.svr_ip and a.svr_port = b.svr_port where b.svr_ip is null, 0, 180;
obdocker.check_until_timeout select count(*) as cnt from oceanbase.__all_virtual_server_schema_info as a join oceanbase.__all_virtual_server_schema_info as b on a.tenant_id = b.tenant_id  where a.refreshed_schema_version != b.refreshed_schema_version or a.refreshed_schema_version % 8 != 0, 0, 180;
alter system minor freeze tenant = tent_mysql,tent_oracle;
alter system minor freeze tenant = sys;
alter system minor freeze tenant = META$1004,META$1006;
obdocker.check_until_timeout select count(*) from GV\$OB_TABLET_COMPACTION_PROGRESS,0,180;
obdocker.mysql alter tenant sys set primary_zone = "$rootservice_zone";
obdocker.check_until_timeout  select zone from DBA_OB_LS_LOCATIONS where role="leader",$rootservice_zone,120;
obdocker.check_until_timeout select count(*) from DBA_OB_SERVERS where WITH_ROOTSERVER="YES" and svr_ip = "$rootservice_port",0,120;
obdocker.check_until_timeout select count(*) from oceanbase.__all_server where (start_service_time is null  or status='INACTIVE'),0,300;
obdocker.check_until_timeout select count(*) from oceanbase.__all_server a left join oceanbase.__all_virtual_server_schema_info b on a.svr_ip = b.svr_ip and a.svr_port = b.svr_port where b.svr_ip is null, 0, 180;
obdocker.check_until_timeout select count(*) as cnt from oceanbase.__all_virtual_server_schema_info as a join oceanbase.__all_virtual_server_schema_info as b on a.tenant_id = b.tenant_id  where a.refreshed_schema_version != b.refreshed_schema_version or a.refreshed_schema_version % 8 != 0, 0, 180;
obdocker.mysql alter system stop zone 'z1';
obdocker.z1.force_stop;
obdocker.z1.upgrade;
obdocker.z1.start;
obdocker.check_until_timeout select count(*) from oceanbase.__all_server where (start_service_time is null  or status='INACTIVE'),0,300;
obdocker.check_until_timeout select count(*) from oceanbase.__all_server a left join oceanbase.__all_virtual_server_schema_info b on a.svr_ip = b.svr_ip and a.svr_port = b.svr_port where b.svr_ip is null, 0, 180;
obdocker.check_until_timeout select count(*) as cnt from oceanbase.__all_virtual_server_schema_info as a join oceanbase.__all_virtual_server_schema_info as b on a.tenant_id = b.tenant_id  where a.refreshed_schema_version != b.refreshed_schema_version or a.refreshed_schema_version % 8 != 0, 0, 180;
obdocker.upgrade_health_checker z1;
obdocker.mysql alter system start zone 'z1';
obdocker.mysql alter tenant sys set primary_zone = "z1";
obdocker.check_until_timeout select count(*) from __all_virtual_tenant_parameter_stat where name = 'compatible' and value!="$source_version",0,1;
obdocker.check_until_timeout select count(*) from __all_virtual_tenant_parameter_stat where name = 'compatible' and value!="$source_version",0,1;
obdocker.upgrade_health_checker;
obdocker.upgrade_commond_for_server post;
obdocker.mysql alter system run upgrade job 'upgrade_all';
obdocker.check_until_timeout select count(1) from __All_rootservice_job where job_type='UPGRADE_ALL' and job_status='SUCCESS',$cnt1,3600;
obdocker.mysql alter system set _enable_parallel_table_creation = false tenant=all_user;
obdocker.mysql alter system set _enable_parallel_table_creation = false tenant=all_meta;
obdocker.mysql alter system set _enable_parallel_table_creation = false tenant=sys;
obdocker.mysql alter system run upgrade job 'upgrade_all';
obdocker.check_until_timeout select count(1) from __All_rootservice_job where job_type='UPGRADE_ALL' and job_status='SUCCESS',$cnt1,3600;
obdocker.mysql alter system run upgrade job 'upgrade_all';
obdocker.check_until_timeout select count(1) from __All_rootservice_job where job_type='UPGRADE_ALL' and job_status='SUCCESS',$cnt1,3600;
obdocker.mysql alter system set _enable_parallel_table_creation = true tenant=all_user;
obdocker.mysql alter system set _enable_parallel_table_creation = true tenant=all_meta;
obdocker.mysql alter system set _enable_parallel_table_creation = true tenant=sys;
obdocker.mysql alter system set server_permanent_offline_time = "$server_permanent_offline_time";
obdocker.mysql alter system set enable_rebalance = "$enable_rebalance";
obdocker.mysql alter system set enable_rereplication = "$enable_rereplication";
obdocker.check_until_timeout select count(*) from __all_virtual_tenant_parameter_stat where name = 'compatible' and value!="$dest_version",0,1;
obdocker.check_until_timeout select count(*) from __all_virtual_tenant_parameter_stat where name = 'compatible' and value!="$dest_version",0,1;
use testsql;
create table t2(c1 int, c2 int);
create table t2_part(c1 int, c2 int) partition by hash(c1) partitions 8;
insert into t2 values(1, 1), (2, 2), (3, 3), (4, 4), (5, 5), (6, 6), (7, 7), (8, 8), (9, 9), (10, 10);
insert into t2_part values(1, 1);
insert into t2_part values(2, 2);
insert into t2_part values(3, 3);
insert into t2_part values(4, 4);
insert into t2_part values(5, 5);
insert into t2_part values(6, 6);
insert into t2_part values(7, 7);
insert into t2_part values(8, 8);
insert into t2_part values(9, 9);
insert into t2_part values(10, 10);
update t2 set c2=22 where c1=2;
update t2_part set c2=22 where c1=2;
delete from t2 where c1=9;
delete from t2_part where c1=9;
insert into t_test_trg_mysql values (1);
SELECT my_func1('You');
my_func1('You')
Thank You!
create database testsql1;
use testsql1;
create table t3(c1 int, c2 int);
insert into t3 values(1, 1), (2, 2), (3, 3), (4, 4), (5, 5), (6, 6), (7, 7), (8, 8), (9, 9), (10, 10);
drop database testsql1;
call p1(1);
begin p1(1); end;
call pkg1.p1(3);
select pkg1.f1(4) from dual;
PKG1.F1(4)
3
insert into t1 values(20, 20, 20);
select * from t1;
C1	C2	C3
1	1	2
1	1	2
10	10	10
20	20	20
select * from t1_log;
C1	C2	C3
NULL	10	NULL
NULL	20	NULL
select println() from dual;
PRINTLN()
NULL
select * from tt2;
C1
0
1
NULL
insert into t3 values(2, 2);
insert into t4 values(3, 3);
insert into t4 values (2, 2);
select * from t3;
C1	C2
1	1
2	2
2	2
select * from t4;
C1	C2
1	1
2	2
3	3
2	2
call p1(1);
select println() from dual;
PRINTLN()
NULL
call p1(2);
select println() from dual;
PRINTLN()
NULL
call p1(3);
select println() from dual;
PRINTLN()
NULL
select * from t1_1;
AA
1
insert into t1_2 values(2);
insert into t1_2 values(60);
select * from t1_2;
AA
1
50000
2
60
select println() from dual;
PRINTLN()
NULL
set autocommit =0;
INSERT INTO accounts (account_id, balance)
VALUES (7765, 6350.00);
INSERT INTO accounts (account_id, balance)
VALUES (7760, 5100.50);
BEGIN transfer(7715, 7720, 250);END;
SELECT * FROM accounts;
ACCOUNT_ID	BALANCE
7715	5850
7720	5600.5
7765	6350
7760	5100.5
use testsql;
insert /*+ direct(true,100,'inc_replace') enable_parallel_dml parallel(2)*/ into tbl1_l select * from t1_2;
delete  from tbl2_l;
insert /*+ direct enable_parallel_dml parallel(N) */ into tbl2_l select * from tbl1_l;
use test_mview;
SET ob_query_timeout = 20000000000;
create table t1_after(c1 int primary key, c2 int, c3 int, c4 int);
create materialized view log on t1_after with primary key, sequence (c2, c3) including new values;
create materialized view mv1_after refresh fast on demand as select c2 as c2, count(*) cnt, count(c3) cnt_c3, sum(c3) sum_c3 from t1_after group by c2;
create materialized view mv2_after as select * from t1_after;
create sequence s1_after cache 1000000 noorder;
call dbms_mview_stats.set_mvref_stats_params('mv1_after', 'NONE', 31);
call dbms_mview_stats.set_mvref_stats_params('mv2_after', 'NONE', 31);
select OWNER,MVIEW_NAME,QUERY,REFRESH_MODE,REFRESH_METHOD,BUILD_MODE,LAST_REFRESH_DATE IS NULL,LAST_REFRESH_END_TIME IS NULL from oceanbase.DBA_MVIEWS where OWNER = 'test_mview' AND MVIEW_NAME IN ('mv1_after', 'mv2_after') ORDER BY MVIEW_NAME;
OWNER	MVIEW_NAME	QUERY	REFRESH_MODE	REFRESH_METHOD	BUILD_MODE	LAST_REFRESH_DATE IS NULL	LAST_REFRESH_END_TIME IS NULL
test_mview	mv1_after	select `test_mview`.`t1_after`.`c2` AS `c2`,count(*) AS `cnt`,count(`test_mview`.`t1_after`.`c3`) AS `cnt_c3`,sum(`test_mview`.`t1_after`.`c3`) AS `sum_c3` from `test_mview`.`t1_after` group by `test_mview`.`t1_after`.`c2`	DEMAND	FAST	IMMEDIATE	0	0
test_mview	mv2_after	select `test_mview`.`t1_after`.`c1` AS `c1`,`test_mview`.`t1_after`.`c2` AS `c2`,`test_mview`.`t1_after`.`c3` AS `c3`,`test_mview`.`t1_after`.`c4` AS `c4` from `test_mview`.`t1_after`	DEMAND	FORCE	IMMEDIATE	0	0
insert into t1_after select s1_after.nextval, s1_after.nextval, s1_after.nextval, s1_after.nextval from table(generator(100000));
call dbms_mview.refresh('mv1_after');
call dbms_mview.refresh('mv2_after');
select OWNER,MVIEW_NAME,QUERY,REFRESH_MODE,REFRESH_METHOD,BUILD_MODE,LAST_REFRESH_DATE IS NULL,LAST_REFRESH_END_TIME IS NULL,TIMESTAMPDIFF(SECOND, LAST_REFRESH_DATE, LAST_REFRESH_END_TIME) < 10 from oceanbase.DBA_MVIEWS where OWNER = 'test_mview' AND MVIEW_NAME IN ('mv1_after', 'mv2_after') ORDER BY MVIEW_NAME;
OWNER	MVIEW_NAME	QUERY	REFRESH_MODE	REFRESH_METHOD	BUILD_MODE	LAST_REFRESH_DATE IS NULL	LAST_REFRESH_END_TIME IS NULL	TIMESTAMPDIFF(SECOND, LAST_REFRESH_DATE, LAST_REFRESH_END_TIME) < 10
test_mview	mv1_after	select `test_mview`.`t1_after`.`c2` AS `c2`,count(*) AS `cnt`,count(`test_mview`.`t1_after`.`c3`) AS `cnt_c3`,sum(`test_mview`.`t1_after`.`c3`) AS `sum_c3` from `test_mview`.`t1_after` group by `test_mview`.`t1_after`.`c2`	DEMAND	FAST	IMMEDIATE	0	0	1
test_mview	mv2_after	select `test_mview`.`t1_after`.`c1` AS `c1`,`test_mview`.`t1_after`.`c2` AS `c2`,`test_mview`.`t1_after`.`c3` AS `c3`,`test_mview`.`t1_after`.`c4` AS `c4` from `test_mview`.`t1_after`	DEMAND	FORCE	IMMEDIATE	0	0	1
insert into t1 select s1.nextval, s1.nextval, s1.nextval, s1.nextval from table(generator(100000));
select OWNER,MVIEW_NAME,QUERY,REFRESH_MODE,REFRESH_METHOD,BUILD_MODE,LAST_REFRESH_DATE IS NULL,LAST_REFRESH_END_TIME IS NULL,TIMESTAMPDIFF(SECOND, LAST_REFRESH_DATE, LAST_REFRESH_END_TIME) < 10 from oceanbase.DBA_MVIEWS where OWNER = 'test_mview' AND MVIEW_NAME IN ('mv1', 'mv2') ORDER BY MVIEW_NAME;
OWNER	MVIEW_NAME	QUERY	REFRESH_MODE	REFRESH_METHOD	BUILD_MODE	LAST_REFRESH_DATE IS NULL	LAST_REFRESH_END_TIME IS NULL	TIMESTAMPDIFF(SECOND, LAST_REFRESH_DATE, LAST_REFRESH_END_TIME) < 10
test_mview	mv1	select `test_mview`.`t1`.`c2` AS `c2`,count(*) AS `cnt`,count(`test_mview`.`t1`.`c3`) AS `cnt_c3`,sum(`test_mview`.`t1`.`c3`) AS `sum_c3` from `test_mview`.`t1` group by `test_mview`.`t1`.`c2`	DEMAND	FAST	IMMEDIATE	0	0	1
test_mview	mv2	select `test_mview`.`t1`.`c1` AS `c1`,`test_mview`.`t1`.`c2` AS `c2`,`test_mview`.`t1`.`c3` AS `c3`,`test_mview`.`t1`.`c4` AS `c4` from `test_mview`.`t1`	DEMAND	FORCE	IMMEDIATE	0	0	1
use testsql;
use testsql;
create database heap_table;
use heap_table;
create table test (c1 int, c2 int, c3 varchar(10), c4 int, c5 int, primary key(c1, c2, c3)) ORGANIZATION HEAP;
alter system set _enable_parallel_table_creation = false;
create table test_not_parallel (c1 int, c2 int, c3 varchar(10), c4 int, c5 int, primary key(c1, c2, c3)) ORGANIZATION HEAP;
alter system set _enable_parallel_table_creation = true;
create table test(c1 int primary key, c2 int, primary key (c1,c2)) ORGANIZATION HEAP;
ERROR 23000: Duplicated primary key
SET _show_ddl_in_compat_mode = 1;
show create table test;
Table	Create Table
test	CREATE TABLE `test` (
  `c1` int(11) NOT NULL,
  `c2` int(11) NOT NULL,
  `c3` varchar(10) NOT NULL,
  `c4` int(11) DEFAULT NULL,
  `c5` int(11) DEFAULT NULL,
  PRIMARY KEY (`c1`, `c2`, `c3`)
) DEFAULT CHARSET = utf8mb4 ROW_FORMAT = DYNAMIC
SET _show_ddl_in_compat_mode = 0;
show create table test;
Table	Create Table
test	CREATE TABLE `test` (
  `c1` int(11) NOT NULL,
  `c2` int(11) NOT NULL,
  `c3` varchar(10) NOT NULL,
  `c4` int(11) DEFAULT NULL,
  `c5` int(11) DEFAULT NULL,
  PRIMARY KEY (`c1`, `c2`, `c3`)
) ORGANIZATION HEAP DEFAULT CHARSET = utf8mb4 ROW_FORMAT = DYNAMIC COMPRESSION = 'zstd_1.3.8' REPLICA_NUM = 2 BLOCK_SIZE = 16384 USE_BLOOM_FILTER = FALSE ENABLE_MACRO_BLOCK_BLOOM_FILTER = FALSE TABLET_SIZE = 134217728 PCTFREE = 0 WITH COLUMN GROUP(all columns, each column)
create table test_idx (c1 int, c2 int, c3 varchar(10), c4 int, c5 int, primary key(c1, c2, c3));
show create table test_idx;
Table	Create Table
test_idx	CREATE TABLE `test_idx` (
  `c1` int(11) NOT NULL,
  `c2` int(11) NOT NULL,
  `c3` varchar(10) NOT NULL,
  `c4` int(11) DEFAULT NULL,
  `c5` int(11) DEFAULT NULL,
  PRIMARY KEY (`c1`, `c2`, `c3`)
) ORGANIZATION INDEX DEFAULT CHARSET = utf8mb4 ROW_FORMAT = DYNAMIC COMPRESSION = 'zstd_1.3.8' REPLICA_NUM = 2 BLOCK_SIZE = 16384 USE_BLOOM_FILTER = FALSE ENABLE_MACRO_BLOCK_BLOOM_FILTER = FALSE TABLET_SIZE = 134217728 PCTFREE = 0 WITH COLUMN GROUP(all columns, each column)
'success! two tables have different organization'
'success!'
create table t_new(c1 int, c2 int, c3 int, primary key(c1));
insert into t_new values(1, 5, 1), (2, 4, 2), (3, 3, 3), (4, 2, 4), (5, 1, 5),(6,2,6),(7,5,7),(8,2,8),(9,3,9);
update t_new set c2=22 where c1=2;
delete from t_new where c1=9;
insert into t_test_trg_ora values (1);
use testsvr;
update t_new set c2="cc" where c1=2;
delete from t_new where c1=9;
ALTER TABLEGROUP Tablegroup1 ADD TABLE testsql.t_part;
ALTER TABLEGROUP Tablegroup1 ADD TABLE testsvr.t_part1;
ALTER TABLEGROUP Tablegroup1 ADD TABLE testsql.t1;
ERROR HY000: not all tables are non-partitioned or partitioned, add table to tablegroup not allowed
ALTER TABLEGROUP Tablegroup1_1 ADD TABLE testsvr.t3;
ALTER TABLEGROUP Tablegroup1_1 ADD TABLE testsql.t1;
ALTER TABLEGROUP Tablegroup1_1 ADD TABLE testsvr.t_part1;
ERROR HY000: not all tables are non-partitioned or partitioned, add table to tablegroup not allowed
ALTER TABLEGROUP Tablegroup2 ADD TABLE testsql.t_part;
ALTER TABLEGROUP Tablegroup2 ADD TABLE testsvr.t_part1;
ALTER TABLEGROUP Tablegroup2 ADD TABLE testsql.t1;
ERROR HY000: not all tables are non-partitioned or partitioned, add table to tablegroup not allowed
ALTER TABLEGROUP Tablegroup2_1 ADD TABLE testsvr.t3;
ALTER TABLEGROUP Tablegroup2_1 ADD TABLE testsql.t1;
ALTER TABLEGROUP Tablegroup2_1 ADD TABLE testsvr.t_part1;
ERROR HY000: not all tables are non-partitioned or partitioned, add table to tablegroup not allowed
ALTER TABLEGROUP Tablegroup3 ADD TABLE testsql.t_part;
ALTER TABLEGROUP Tablegroup3 ADD TABLE testsvr.t_part1;
ALTER TABLEGROUP Tablegroup3 ADD TABLE testsql.t1;
ALTER TABLEGROUP Tablegroup3_1 ADD TABLE testsvr.t3;
ALTER TABLEGROUP Tablegroup3_1 ADD TABLE testsql.t1;
ALTER TABLEGROUP Tablegroup3_1 ADD TABLE testsvr.t_part1;
CREATE TABLEGROUP Tablegroup1_new;
CREATE TABLEGROUP Tablegroup2_new SHARDING="PARTITION";
CREATE TABLEGROUP Tablegroup3_new SHARDING="NONE";
ALTER TABLEGROUP Tablegroup1_new ADD TABLE testsql.t_part;
ALTER TABLEGROUP Tablegroup1_new ADD TABLE testsvr.t_part1;
ALTER TABLEGROUP Tablegroup1_new ADD TABLE testsql.t1;
ERROR HY000: not all tables are non-partitioned or partitioned, add table to tablegroup not allowed
ALTER TABLEGROUP Tablegroup2_new ADD TABLE testsql.t_part;
ALTER TABLEGROUP Tablegroup2_new ADD TABLE testsvr.t_part1;
ALTER TABLEGROUP Tablegroup2_new ADD TABLE testsql.t1;
ERROR HY000: not all tables are non-partitioned or partitioned, add table to tablegroup not allowed
ALTER TABLEGROUP Tablegroup3_new ADD TABLE testsvr.t3;
ALTER TABLEGROUP Tablegroup3_new ADD TABLE testsql.t1;
ALTER TABLEGROUP Tablegroup3_new ADD TABLE testsvr.t_part1;
ALTER TABLEGROUP Tablegroup1_2 ADD TABLE testsvr.t_part1;
ALTER TABLEGROUP Tablegroup1_2 ADD TABLE testsql.t1;
ERROR HY000: not all tables are non-partitioned or partitioned, add table to tablegroup not allowed
ALTER TABLEGROUP Tablegroup2_2 ADD TABLE testsvr.t_part1;
ALTER TABLEGROUP Tablegroup2_2 ADD TABLE testsql.t1;
ERROR HY000: not all tables are non-partitioned or partitioned, add table to tablegroup not allowed
ALTER TABLEGROUP Tablegroup3_2 ADD TABLE testsql.t1;
ALTER TABLEGROUP Tablegroup3_2 ADD TABLE testsvr.t_part1;
ALTER TABLEGROUP TABLEGROUP1 ADD TABLE user1.t1_listpart;
ALTER TABLEGROUP TABLEGROUP1 ADD TABLE user2.t2_listpart;
ALTER TABLEGROUP TABLEGROUP1 ADD TABLE user1.t1;
ERROR HY000: OBE-00600: internal error code, arguments: -4179, not all tables are non-partitioned or partitioned, add table to tablegroup not allowed
ALTER TABLEGROUP TABLEGROUP1_1 ADD TABLE user1.t1;
ALTER TABLEGROUP TABLEGROUP1_1 ADD TABLE user2.t2;
ALTER TABLEGROUP TABLEGROUP1_1 ADD TABLE user2.t2_listpart;
ERROR HY000: OBE-00600: internal error code, arguments: -4179, not all tables are non-partitioned or partitioned, add table to tablegroup not allowed
ALTER TABLEGROUP TABLEGROUP2 ADD TABLE user1.t1_listpart;
ALTER TABLEGROUP TABLEGROUP2 ADD TABLE user2.t2_listpart;
ALTER TABLEGROUP TABLEGROUP2 ADD TABLE user1.t1;
ERROR HY000: OBE-00600: internal error code, arguments: -4179, not all tables are non-partitioned or partitioned, add table to tablegroup not allowed
ALTER TABLEGROUP TABLEGROUP2_1 ADD TABLE user1.t1;
ALTER TABLEGROUP TABLEGROUP2_1 ADD TABLE user2.t2;
ALTER TABLEGROUP TABLEGROUP2_1 ADD TABLE user2.t2_listpart;
ERROR HY000: OBE-00600: internal error code, arguments: -4179, not all tables are non-partitioned or partitioned, add table to tablegroup not allowed
ALTER TABLEGROUP TABLEGROUP3 ADD TABLE user1.t1_listpart;
ALTER TABLEGROUP TABLEGROUP3 ADD TABLE user2.t2_listpart;
ALTER TABLEGROUP TABLEGROUP3 ADD TABLE user1.t1;
ALTER TABLEGROUP TABLEGROUP3_1 ADD TABLE user1.t1;
ALTER TABLEGROUP TABLEGROUP3_1 ADD TABLE user2.t2;
ALTER TABLEGROUP TABLEGROUP3_1 ADD TABLE user2.t2_listpart;
CREATE TABLEGROUP TABLEGROUP1_new;
CREATE TABLEGROUP TABLEGROUP2_new SHARDING='PARTITION';
CREATE TABLEGROUP TABLEGROUP3_new SHARDING='NONE';
ALTER TABLEGROUP TABLEGROUP1_new ADD TABLE user1.t1_listpart;
ALTER TABLEGROUP TABLEGROUP1_new ADD TABLE user2.t2_listpart;
ALTER TABLEGROUP TABLEGROUP1_new ADD TABLE user1.t1;
ERROR HY000: OBE-00600: internal error code, arguments: -4179, not all tables are non-partitioned or partitioned, add table to tablegroup not allowed
ALTER TABLEGROUP TABLEGROUP2_new ADD TABLE user1.t1;
ALTER TABLEGROUP TABLEGROUP2_new ADD TABLE user2.t2;
ALTER TABLEGROUP TABLEGROUP2_new ADD TABLE user2.t2_listpart;
ERROR HY000: OBE-00600: internal error code, arguments: -4179, not all tables are non-partitioned or partitioned, add table to tablegroup not allowed
ALTER TABLEGROUP TABLEGROUP3_new ADD TABLE user1.t1_listpart;
ALTER TABLEGROUP TABLEGROUP3_new ADD TABLE user2.t2_listpart;
ALTER TABLEGROUP TABLEGROUP3_new ADD TABLE user1.t1;
use collect_mview;
insert into collect_item values(7, 100);
insert into collect_item values(8, 200);
insert into collect_item values(9, 300);
insert into collect_info values(1, 11);
insert into collect_info values(88, 7);
insert into collect_info values(3, 8);
insert into collect_info values(88, 9);
insert into collect_info values(3, 23);
select * from collect_info_mv;
user_id	item_id	dup_item_id	price
1	1	1	100
1	2	2	200
2	1	1	100
2	3	3	300
3	3	3	300
88	7	7	100
3	8	8	200
88	9	9	300
use testsql;
alter table single_cg_with_multi_columns add column group (each column) delayed;
alter table all_cg_not_overwrite_0 add column group (each column) delayed;
alter table all_cg_not_overwrite_1 add column group (each column) delayed;
alter table c2r_1 add column group (all columns);
alter table c2r_2 add column group (all columns);
alter table c2r_3 add column group (all columns);
alter table c2r_1 drop column group (each column);
alter table c2r_2 drop column group (each column);
alter table c2r_3 drop column group (each column);
alter table c2r_1 drop column group (all columns);
alter table c2r_2 drop column group (all columns);
alter table c2r_3 drop column group (all columns);
alter table c2r_1 add column group (each column) delayed;
alter table c2r_2 add column group (each column) delayed;
alter table c2r_3 add column group (each column) delayed;
alter table cr2r_1 drop column group (each column);
alter table cr2r_2 drop column group (each column);
alter table cr2r_3 drop column group (each column);
alter table cr2r_1 drop column group (all columns);
alter table cr2r_2 drop column group (all columns);
alter table cr2r_3 drop column group (all columns);
alter table cr2r_1 add column group(all columns, each column) delayed;
alter table cr2r_2 add column group(all columns, each column) delayed;
alter table cr2r_3 add column group(all columns, each column) delayed;
alter table cr2c_1 drop column group (all columns);
alter table cr2c_2 drop column group (all columns);
alter table cr2c_3 drop column group (all columns);
alter table cr2c_1 drop column group (each column);
alter table cr2c_2 drop column group (each column);
alter table cr2c_3 drop column group (each column);
alter table cr2c_1 add column group(all columns, each column) delayed;
alter table cr2c_2 add column group(all columns, each column) delayed;
alter table cr2c_3 add column group(all columns, each column) delayed;
obdocker.check_until_timeout select count(*) from dba_ob_unit_jobs where job_status!="success",0,600;
obdocker.check_until_timeout select count(*) from GV\$OB_UNITS where STATUS!="NORMAL",0,1500;
ALTER RESOURCE TENANT tent_not_minor UNIT_NUM = 2;
obdocker.check_until_timeout select count(*) from dba_ob_unit_jobs where job_status!="success",0,600;
obdocker.check_until_timeout select count(*) from GV\$OB_UNITS where STATUS!="NORMAL",0,1500;
obdocker.check_until_timeout select unit_count from DBA_OB_RESOURCE_POOLS where name="$pool4name",2,120;
ALTER RESOURCE TENANT tent_not_minor UNIT_NUM = 1;
obdocker.check_until_timeout select count(*) from dba_ob_unit_jobs where job_status!="success",0,600;
obdocker.check_until_timeout select count(*) from GV\$OB_UNITS where STATUS!="NORMAL",0,1500;
obdocker.check_until_timeout select unit_count from DBA_OB_RESOURCE_POOLS where name="$pool4name",1,120;
obdocker.z1.force_stop;
obdocker.z1.start;
obdocker.check_until_timeout select count(*) from oceanbase.__all_server where (start_service_time is null  or status='INACTIVE'),0,300;
obdocker.check_until_timeout select count(*) from oceanbase.__all_server a left join oceanbase.__all_virtual_server_schema_info b on a.svr_ip = b.svr_ip and a.svr_port = b.svr_port where b.svr_ip is null, 0, 180;
obdocker.check_until_timeout select count(*) as cnt from oceanbase.__all_virtual_server_schema_info as a join oceanbase.__all_virtual_server_schema_info as b on a.tenant_id = b.tenant_id  where a.refreshed_schema_version != b.refreshed_schema_version or a.refreshed_schema_version % 8 != 0, 0, 180;
obdocker.z2.force_stop;
obdocker.z2.start;
obdocker.check_until_timeout select count(*) from oceanbase.__all_server where (start_service_time is null  or status='INACTIVE'),0,300;
obdocker.check_until_timeout select count(*) from oceanbase.__all_server a left join oceanbase.__all_virtual_server_schema_info b on a.svr_ip = b.svr_ip and a.svr_port = b.svr_port where b.svr_ip is null, 0, 180;
obdocker.check_until_timeout select count(*) as cnt from oceanbase.__all_virtual_server_schema_info as a join oceanbase.__all_virtual_server_schema_info as b on a.tenant_id = b.tenant_id  where a.refreshed_schema_version != b.refreshed_schema_version or a.refreshed_schema_version % 8 != 0, 0, 180;
obdocker.z3.force_stop;
obdocker.z3.start;
obdocker.check_until_timeout select count(*) from oceanbase.__all_server where (start_service_time is null  or status='INACTIVE'),0,300;
obdocker.check_until_timeout select count(*) from oceanbase.__all_server a left join oceanbase.__all_virtual_server_schema_info b on a.svr_ip = b.svr_ip and a.svr_port = b.svr_port where b.svr_ip is null, 0, 180;
obdocker.check_until_timeout select count(*) as cnt from oceanbase.__all_virtual_server_schema_info as a join oceanbase.__all_virtual_server_schema_info as b on a.tenant_id = b.tenant_id  where a.refreshed_schema_version != b.refreshed_schema_version or a.refreshed_schema_version % 8 != 0, 0, 180;
alter system minor freeze tenant = all;
obdocker.check_until_timeout select count(*) from GV\$OB_TABLET_COMPACTION_PROGRESS,0,60;
ALTER SYSTEM MAJOR FREEZE TENANT =all;
obdocker.check_until_timeout select count(*) from CDB_OB_MAJOR_COMPACTION where `GLOBAL_BROADCAST_SCN`!=`LAST_SCN` or STATUS!="IDLE",0,2000;
obdocker.check_until_timeout select SVR_PORT from DBA_OB_UNITS where zone="z2" and UNIT_ID=$z2_unitid,$z2_unitport,60;
obdocker.check_until_timeout select count(*) from  DBA_OB_UNITS where TENANT_ID =$mysql_tenant_id and ZONE="z2" and MIGRATE_FROM_SVR_IP IS NULL and MIGRATE_FROM_SVR_PORT IS NULL and MANUAL_MIGRATE IS NULL,1,120;
alter system set server_permanent_offline_time = "60s";
obdocker.check_until_timeout select distinct VALUE from  GV\$OB_PARAMETERS where name="server_permanent_offline_time",60s,10;
obdocker.check_until_timeout select count(*) from oceanbase.__all_server where (start_service_time is null  or status='INACTIVE'),0,300;
obdocker.check_until_timeout select count(*) from oceanbase.__all_server a left join oceanbase.__all_virtual_server_schema_info b on a.svr_ip = b.svr_ip and a.svr_port = b.svr_port where b.svr_ip is null, 0, 180;
obdocker.check_until_timeout select count(*) as cnt from oceanbase.__all_virtual_server_schema_info as a join oceanbase.__all_virtual_server_schema_info as b on a.tenant_id = b.tenant_id  where a.refreshed_schema_version != b.refreshed_schema_version or a.refreshed_schema_version % 8 != 0, 0, 180;
alter system set server_permanent_offline_time = "3600s";
obdocker.check_until_timeout select count(*) from __all_virtual_log_stat where paxos_member_list not like "%,%",0,600;
obdocker.check_until_timeout select count(*) from dba_ob_unit_jobs where job_status!="success",0,600;
obdocker.check_until_timeout select count(*) from dba_ob_server_jobs where job_status!="success",0,600;
obdocker.check_until_timeout select count(*) from dba_ob_unit_jobs where job_status!="success",0,600;
obdocker.check_until_timeout select count(*) from dba_ob_server_jobs where job_status!="success",0,600;
ALTER RESOURCE UNIT unit_mysql MAX_CPU 2, MEMORY_SIZE '4G',LOG_DISK_SIZE '10G';
obdocker.check_until_timeout select count(*) FROM oceanbase.DBA_OB_UNIT_CONFIGS WHERE NAME = "$unit1name" and MAX_CPU=2 and (MEMORY_SIZE/1073741824)=4, 1, 120;
ALTER RESOURCE UNIT unit_mysql MAX_CPU 1, MEMORY_SIZE '3G',LOG_DISK_SIZE '10G';
obdocker.check_until_timeout select count(*) FROM oceanbase.DBA_OB_UNIT_CONFIGS WHERE NAME = "$unit1name" and MAX_CPU=1 and (MEMORY_SIZE/1073741824)=3, 1, 120;
obdocker.check_until_timeout select count(*) from GV\$OB_UNITS where STATUS!="NORMAL" and TENANT_ID="$oracle_tenant_id",0,1500;
obdocker.check_until_timeout select count(*) from dba_ob_unit_jobs where job_status!="success",0,600;
obdocker.check_until_timeout select count(*) from GV\$OB_UNITS where STATUS!="NORMAL",0,1500;
obdocker.check_until_timeout select unit_count from DBA_OB_RESOURCE_POOLS where name="$pool2name",2,30;
obdocker.check_until_timeout select count(*) from GV\$OB_UNITS where STATUS!="NORMAL"  and TENANT_ID="$oracle_tenant_id",0,1500;
obdocker.check_until_timeout select count(*) from dba_ob_units where MIGRATE_FROM_SVR_IP IS NOT NULL,0,600;
obdocker.check_until_timeout select job_status from (select * from __all_rootservice_job order by 1  desc limit 1),SUCCESS,300;
ALTER RESOURCE TENANT tent_oracle UNIT_NUM = 1;
obdocker.check_until_timeout select count(*) from dba_ob_unit_jobs where job_status!="success",0,600;
obdocker.check_until_timeout select count(*) from GV\$OB_UNITS where STATUS!="NORMAL",0,1500;
obdocker.check_until_timeout select unit_count from DBA_OB_RESOURCE_POOLS where name="$pool2name",1,30;
obdocker.check_until_timeout select job_status from (select * from __all_rootservice_job order by 1  desc limit 1),SUCCESS,300;
obdocker.z2.force_stop;
obdocker.check_until_timeout  select count(*) from __all_virtual_log_stat where tenant_id=$mysql_tenant_id and degraded_list not like "$degrade_ip%",0,180;
obdocker.z2.nstart;
obdocker.check_until_timeout  select count(*) from __all_virtual_log_stat where tenant_id=$mysql_tenant_id and degraded_list not like "",0,180;
obdocker.check_until_timeout select count(*) from oceanbase.__all_server where (start_service_time is null  or status='INACTIVE'),0,300;
obdocker.check_until_timeout select count(*) from oceanbase.__all_server a left join oceanbase.__all_virtual_server_schema_info b on a.svr_ip = b.svr_ip and a.svr_port = b.svr_port where b.svr_ip is null, 0, 180;
obdocker.check_until_timeout select count(*) as cnt from oceanbase.__all_virtual_server_schema_info as a join oceanbase.__all_virtual_server_schema_info as b on a.tenant_id = b.tenant_id  where a.refreshed_schema_version != b.refreshed_schema_version or a.refreshed_schema_version % 8 != 0, 0, 180;
alter system minor freeze tenant = tent_mysql,tent_oracle;
alter system minor freeze tenant = sys;
alter system minor freeze tenant = META$1004,META$1006;
obdocker.check_until_timeout select count(*) from GV\$OB_TABLET_COMPACTION_PROGRESS,0,180;
CREATE RESOURCE UNIT unit_new  MEMORY_SIZE = '3G',MAX_CPU = 1, MIN_CPU = 1,LOG_DISK_SIZE = '6G',MAX_IOPS = 10000, MIN_IOPS = 10000, IOPS_WEIGHT=1;
obdocker.check_until_timeout select count(*) FROM oceanbase.DBA_OB_UNIT_CONFIGS WHERE NAME = "unit_new", 1, 120;
CREATE RESOURCE POOL pool_new UNIT= 'unit_new' ,UNIT_NUM=1, ZONE_LIST=('z1','z2','z3');
obdocker.check_until_timeout select count(*) FROM DBA_OB_RESOURCE_POOLS WHERE NAME = "pool_new",1, 120;
CREATE TENANT IF NOT EXISTS tent_new PRIMARY_ZONE='z1',RESOURCE_POOL_LIST=('pool_new') SET OB_TCP_INVITED_NODES='%';
obdocker.check_until_timeout select count(*) FROM DBA_OB_TENANTS WHERE TENANT_NAME = "tent_new",1,120;
create database test_new;
create table test_new.t1_after(pk int primary key, c1 int);
create table test_new.t2_after(c1 int, c2 int) partition by hash(c1) partitions 8;
insert into test_new.t1_after (pk,c1) values (1, 1);
insert into test_new.t2_after (c1,c2) values (1, 1);
insert into test_new.t1_after (pk,c1) values (2, 2);
insert into test_new.t2_after (c1,c2) values (2, 2);
insert into test_new.t1_after (pk,c1) values (3, 3);
insert into test_new.t2_after (c1,c2) values (3, 3);
insert into test_new.t1_after (pk,c1) values (4, 4);
insert into test_new.t2_after (c1,c2) values (4, 4);
insert into test_new.t1_after (pk,c1) values (5, 5);
insert into test_new.t2_after (c1,c2) values (5, 5);
insert into test_new.t1_after (pk,c1) values (6, 6);
insert into test_new.t2_after (c1,c2) values (6, 6);
insert into test_new.t1_after (pk,c1) values (7, 7);
insert into test_new.t2_after (c1,c2) values (7, 7);
insert into test_new.t1_after (pk,c1) values (8, 8);
insert into test_new.t2_after (c1,c2) values (8, 8);
insert into test_new.t1_after (pk,c1) values (9, 9);
insert into test_new.t2_after (c1,c2) values (9, 9);
insert into test_new.t1_after (pk,c1) values (10, 10);
insert into test_new.t2_after (c1,c2) values (10, 10);
insert into test_new.t1_after (pk,c1) values (11, 11);
insert into test_new.t2_after (c1,c2) values (11, 11);
insert into test_new.t1_after (pk,c1) values (12, 12);
insert into test_new.t2_after (c1,c2) values (12, 12);
insert into test_new.t1_after (pk,c1) values (13, 13);
insert into test_new.t2_after (c1,c2) values (13, 13);
insert into test_new.t1_after (pk,c1) values (14, 14);
insert into test_new.t2_after (c1,c2) values (14, 14);
insert into test_new.t1_after (pk,c1) values (15, 15);
insert into test_new.t2_after (c1,c2) values (15, 15);
insert into test_new.t1_after (pk,c1) values (16, 16);
insert into test_new.t2_after (c1,c2) values (16, 16);
insert into test_new.t1_after (pk,c1) values (17, 17);
insert into test_new.t2_after (c1,c2) values (17, 17);
insert into test_new.t1_after (pk,c1) values (18, 18);
insert into test_new.t2_after (c1,c2) values (18, 18);
insert into test_new.t1_after (pk,c1) values (19, 19);
insert into test_new.t2_after (c1,c2) values (19, 19);
insert into test_new.t1_after (pk,c1) values (20, 20);
insert into test_new.t2_after (c1,c2) values (20, 20);
insert into test_new.t1_after (pk,c1) values (21, 21);
insert into test_new.t2_after (c1,c2) values (21, 21);
insert into test_new.t1_after (pk,c1) values (22, 22);
insert into test_new.t2_after (c1,c2) values (22, 22);
insert into test_new.t1_after (pk,c1) values (23, 23);
insert into test_new.t2_after (c1,c2) values (23, 23);
insert into test_new.t1_after (pk,c1) values (24, 24);
insert into test_new.t2_after (c1,c2) values (24, 24);
insert into test_new.t1_after (pk,c1) values (25, 25);
insert into test_new.t2_after (c1,c2) values (25, 25);
insert into test_new.t1_after (pk,c1) values (26, 26);
insert into test_new.t2_after (c1,c2) values (26, 26);
insert into test_new.t1_after (pk,c1) values (27, 27);
insert into test_new.t2_after (c1,c2) values (27, 27);
insert into test_new.t1_after (pk,c1) values (28, 28);
insert into test_new.t2_after (c1,c2) values (28, 28);
insert into test_new.t1_after (pk,c1) values (29, 29);
insert into test_new.t2_after (c1,c2) values (29, 29);
insert into test_new.t1_after (pk,c1) values (30, 30);
insert into test_new.t2_after (c1,c2) values (30, 30);
insert into test_new.t1_after (pk,c1) values (31, 31);
insert into test_new.t2_after (c1,c2) values (31, 31);
insert into test_new.t1_after (pk,c1) values (32, 32);
insert into test_new.t2_after (c1,c2) values (32, 32);
insert into test_new.t1_after (pk,c1) values (33, 33);
insert into test_new.t2_after (c1,c2) values (33, 33);
insert into test_new.t1_after (pk,c1) values (34, 34);
insert into test_new.t2_after (c1,c2) values (34, 34);
insert into test_new.t1_after (pk,c1) values (35, 35);
insert into test_new.t2_after (c1,c2) values (35, 35);
insert into test_new.t1_after (pk,c1) values (36, 36);
insert into test_new.t2_after (c1,c2) values (36, 36);
insert into test_new.t1_after (pk,c1) values (37, 37);
insert into test_new.t2_after (c1,c2) values (37, 37);
insert into test_new.t1_after (pk,c1) values (38, 38);
insert into test_new.t2_after (c1,c2) values (38, 38);
insert into test_new.t1_after (pk,c1) values (39, 39);
insert into test_new.t2_after (c1,c2) values (39, 39);
insert into test_new.t1_after (pk,c1) values (40, 40);
insert into test_new.t2_after (c1,c2) values (40, 40);
insert into test_new.t1_after (pk,c1) values (41, 41);
insert into test_new.t2_after (c1,c2) values (41, 41);
insert into test_new.t1_after (pk,c1) values (42, 42);
insert into test_new.t2_after (c1,c2) values (42, 42);
insert into test_new.t1_after (pk,c1) values (43, 43);
insert into test_new.t2_after (c1,c2) values (43, 43);
insert into test_new.t1_after (pk,c1) values (44, 44);
insert into test_new.t2_after (c1,c2) values (44, 44);
insert into test_new.t1_after (pk,c1) values (45, 45);
insert into test_new.t2_after (c1,c2) values (45, 45);
insert into test_new.t1_after (pk,c1) values (46, 46);
insert into test_new.t2_after (c1,c2) values (46, 46);
insert into test_new.t1_after (pk,c1) values (47, 47);
insert into test_new.t2_after (c1,c2) values (47, 47);
insert into test_new.t1_after (pk,c1) values (48, 48);
insert into test_new.t2_after (c1,c2) values (48, 48);
insert into test_new.t1_after (pk,c1) values (49, 49);
insert into test_new.t2_after (c1,c2) values (49, 49);
insert into test_new.t1_after (pk,c1) values (50, 50);
insert into test_new.t2_after (c1,c2) values (50, 50);
insert into test_new.t1_after (pk,c1) values (51, 51);
insert into test_new.t2_after (c1,c2) values (51, 51);
insert into test_new.t1_after (pk,c1) values (52, 52);
insert into test_new.t2_after (c1,c2) values (52, 52);
insert into test_new.t1_after (pk,c1) values (53, 53);
insert into test_new.t2_after (c1,c2) values (53, 53);
insert into test_new.t1_after (pk,c1) values (54, 54);
insert into test_new.t2_after (c1,c2) values (54, 54);
insert into test_new.t1_after (pk,c1) values (55, 55);
insert into test_new.t2_after (c1,c2) values (55, 55);
insert into test_new.t1_after (pk,c1) values (56, 56);
insert into test_new.t2_after (c1,c2) values (56, 56);
insert into test_new.t1_after (pk,c1) values (57, 57);
insert into test_new.t2_after (c1,c2) values (57, 57);
insert into test_new.t1_after (pk,c1) values (58, 58);
insert into test_new.t2_after (c1,c2) values (58, 58);
insert into test_new.t1_after (pk,c1) values (59, 59);
insert into test_new.t2_after (c1,c2) values (59, 59);
insert into test_new.t1_after (pk,c1) values (60, 60);
insert into test_new.t2_after (c1,c2) values (60, 60);
insert into test_new.t1_after (pk,c1) values (61, 61);
insert into test_new.t2_after (c1,c2) values (61, 61);
insert into test_new.t1_after (pk,c1) values (62, 62);
insert into test_new.t2_after (c1,c2) values (62, 62);
insert into test_new.t1_after (pk,c1) values (63, 63);
insert into test_new.t2_after (c1,c2) values (63, 63);
insert into test_new.t1_after (pk,c1) values (64, 64);
insert into test_new.t2_after (c1,c2) values (64, 64);
insert into test_new.t1_after (pk,c1) values (65, 65);
insert into test_new.t2_after (c1,c2) values (65, 65);
insert into test_new.t1_after (pk,c1) values (66, 66);
insert into test_new.t2_after (c1,c2) values (66, 66);
insert into test_new.t1_after (pk,c1) values (67, 67);
insert into test_new.t2_after (c1,c2) values (67, 67);
insert into test_new.t1_after (pk,c1) values (68, 68);
insert into test_new.t2_after (c1,c2) values (68, 68);
insert into test_new.t1_after (pk,c1) values (69, 69);
insert into test_new.t2_after (c1,c2) values (69, 69);
insert into test_new.t1_after (pk,c1) values (70, 70);
insert into test_new.t2_after (c1,c2) values (70, 70);
insert into test_new.t1_after (pk,c1) values (71, 71);
insert into test_new.t2_after (c1,c2) values (71, 71);
insert into test_new.t1_after (pk,c1) values (72, 72);
insert into test_new.t2_after (c1,c2) values (72, 72);
insert into test_new.t1_after (pk,c1) values (73, 73);
insert into test_new.t2_after (c1,c2) values (73, 73);
insert into test_new.t1_after (pk,c1) values (74, 74);
insert into test_new.t2_after (c1,c2) values (74, 74);
insert into test_new.t1_after (pk,c1) values (75, 75);
insert into test_new.t2_after (c1,c2) values (75, 75);
insert into test_new.t1_after (pk,c1) values (76, 76);
insert into test_new.t2_after (c1,c2) values (76, 76);
insert into test_new.t1_after (pk,c1) values (77, 77);
insert into test_new.t2_after (c1,c2) values (77, 77);
insert into test_new.t1_after (pk,c1) values (78, 78);
insert into test_new.t2_after (c1,c2) values (78, 78);
insert into test_new.t1_after (pk,c1) values (79, 79);
insert into test_new.t2_after (c1,c2) values (79, 79);
insert into test_new.t1_after (pk,c1) values (80, 80);
insert into test_new.t2_after (c1,c2) values (80, 80);
insert into test_new.t1_after (pk,c1) values (81, 81);
insert into test_new.t2_after (c1,c2) values (81, 81);
insert into test_new.t1_after (pk,c1) values (82, 82);
insert into test_new.t2_after (c1,c2) values (82, 82);
insert into test_new.t1_after (pk,c1) values (83, 83);
insert into test_new.t2_after (c1,c2) values (83, 83);
insert into test_new.t1_after (pk,c1) values (84, 84);
insert into test_new.t2_after (c1,c2) values (84, 84);
insert into test_new.t1_after (pk,c1) values (85, 85);
insert into test_new.t2_after (c1,c2) values (85, 85);
insert into test_new.t1_after (pk,c1) values (86, 86);
insert into test_new.t2_after (c1,c2) values (86, 86);
insert into test_new.t1_after (pk,c1) values (87, 87);
insert into test_new.t2_after (c1,c2) values (87, 87);
insert into test_new.t1_after (pk,c1) values (88, 88);
insert into test_new.t2_after (c1,c2) values (88, 88);
insert into test_new.t1_after (pk,c1) values (89, 89);
insert into test_new.t2_after (c1,c2) values (89, 89);
insert into test_new.t1_after (pk,c1) values (90, 90);
insert into test_new.t2_after (c1,c2) values (90, 90);
insert into test_new.t1_after (pk,c1) values (91, 91);
insert into test_new.t2_after (c1,c2) values (91, 91);
insert into test_new.t1_after (pk,c1) values (92, 92);
insert into test_new.t2_after (c1,c2) values (92, 92);
insert into test_new.t1_after (pk,c1) values (93, 93);
insert into test_new.t2_after (c1,c2) values (93, 93);
insert into test_new.t1_after (pk,c1) values (94, 94);
insert into test_new.t2_after (c1,c2) values (94, 94);
insert into test_new.t1_after (pk,c1) values (95, 95);
insert into test_new.t2_after (c1,c2) values (95, 95);
insert into test_new.t1_after (pk,c1) values (96, 96);
insert into test_new.t2_after (c1,c2) values (96, 96);
insert into test_new.t1_after (pk,c1) values (97, 97);
insert into test_new.t2_after (c1,c2) values (97, 97);
insert into test_new.t1_after (pk,c1) values (98, 98);
insert into test_new.t2_after (c1,c2) values (98, 98);
insert into test_new.t1_after (pk,c1) values (99, 99);
insert into test_new.t2_after (c1,c2) values (99, 99);
insert into test_new.t1_after (pk,c1) values (100, 100);
insert into test_new.t2_after (c1,c2) values (100, 100);
update test_new.t1_after set c1=222 where pk=11;
update test_new.t2_after set c2=111 where c1=11;
delete from test_new.t1_after where pk=12;
delete from test_new.t2_after where c1=12;
obdocker.check_until_timeout select job_status from (select * from __all_rootservice_job where job_type like "%ALTER_RESOURCE_TENANT_UNIT_NUM%" order by 1  desc limit 1),SUCCESS,300;
alter tenant tent_oracle set primary_zone=z2;
obdocker.check_until_timeout select count(*) from dba_ob_tenants where TENANT_NAME="tent_oracle" and PRIMARY_ZONE like "z2;%",1,60;
alter tenant tent_oracle set locality = "F@z1,F@z2";
obdocker.check_until_timeout select count(*) from dba_ob_tenants where TENANT_NAME="tent_oracle" and LOCALITY like "FULL{1}@z1, FULL{1}@z2",1,60;
alter tenant tent_oracle set locality = "F@z1,F@z2,C@z3";
obdocker.check_until_timeout select count(*) from dba_ob_tenants where TENANT_NAME="tent_oracle" and LOCALITY like "FULL{1}@z1, FULL{1}@z2, C%",1,60;
