ob1=OBI(cluster=1:1:1,init_unit_cpu=5,init_unit_num=1,init_unit_mem=5368709120,version=2_2_30,oblog_version=current);
ob1.proxy0.set extra_config=syslog_level=debug;
ob1.z1.obs0.set extra_config=memory_chunk_cache_size=1G;
ob1.z2.obs0.set extra_config=memory_chunk_cache_size=1G;
ob1.z3.obs0.set extra_config=memory_chunk_cache_size=1G;
ob1.reboot;
ob1.mysql alter RESOURCE UNIT proxyunit max_memory=5368709120,min_memory=5368709120;
ob1.z1.obs0.sh cd $work_dir/; ls -l {etc,etc2,etc3}/observer.conf*.bin;
ob1.z2.obs0.sh cd $work_dir/; ls -l {etc,etc2,etc3}/observer.conf*.bin;
ob1.z3.obs0.sh cd $work_dir/; ls -l {etc,etc2,etc3}/observer.conf*.bin;
ob1.mysql alter system set balancer_idle_time='10s';
ob1.mysql alter system set merger_check_interval='10s';
ob1.mysql alter system set resource_soft_limit=200;
ob1.mysql alter system set resource_hard_limit=200;
create database oblog_db;
use oblog_db;
ob1.oblog.gen_conf tb_white_list=obtest.oblog_db.*|oblog_tt*.*.*;
ob1.oblog.restart;
drop table if exists oblog_test;
create table oblog_test (pk int primary key, c1 varchar(100));
set ob_org_cluster_id=1234;
replace into oblog_test values (1, 1), (2,2), (3,3);
ob1.oblog.next_dml;
[R0] BEGIN;[R0] org_cluster_id:1234;[R1] record_type:INSERT;[R1] database_name:obtest.oblog_db;[R1] table_name:oblog_test;[R1] log_event:true;[R1] column_count:2;[R1] source_category:SRC_FULL_RECORDED;[R1] source_type:SRC_OCEANBASE_1_0;[R1] has_pk:true;[R1] pk_info:(0);[R1] pks:pk;[R1] has_uk:false;[R1] uk_info:(null);[R1] uks:(null);[R1] [C1] column_name:pk;[R1] [C1] column_type:MYSQL_TYPE_LONG;[R1] [C1] column_is_rowkey:true;[R1] [C1] column_is_signed:true;[R1] [C1] column_encoding:;[R1] [C1] column_is_not_null:true;[R1] [C1] column_value_new:[1](1);[R1] [C2] column_name:c1;[R1] [C2] column_type:MYSQL_TYPE_VAR_STRING;[R1] [C2] column_is_rowkey:false;[R1] [C2] column_is_signed:true;[R1] [C2] column_encoding:utf8mb4;[R1] [C2] column_is_not_null:false;[R1] [C2] column_value_new:[1](1);$[R2] record_type:INSERT;[R2] database_name:obtest.oblog_db;[R2] table_name:oblog_test;[R2] log_event:true;[R2] column_count:2;[R2] source_category:SRC_FULL_RECORDED;[R2] source_type:SRC_OCEANBASE_1_0;[R2] has_pk:true;[R2] pk_info:(0);[R2] pks:pk;[R2] has_uk:false;[R2] uk_info:(null);[R2] uks:(null);[R2] [C1] column_name:pk;[R2] [C1] column_type:MYSQL_TYPE_LONG;[R2] [C1] column_is_rowkey:true;[R2] [C1] column_is_signed:true;[R2] [C1] column_encoding:;[R2] [C1] column_is_not_null:true;[R2] [C1] column_value_new:[2](1);[R2] [C2] column_name:c1;[R2] [C2] column_type:MYSQL_TYPE_VAR_STRING;[R2] [C2] column_is_rowkey:false;[R2] [C2] column_is_signed:true;[R2] [C2] column_encoding:utf8mb4;[R2] [C2] column_is_not_null:false;[R2] [C2] column_value_new:[2](1);$[R3] record_type:INSERT;[R3] database_name:obtest.oblog_db;[R3] table_name:oblog_test;[R3] log_event:true;[R3] column_count:2;[R3] source_category:SRC_FULL_RECORDED;[R3] source_type:SRC_OCEANBASE_1_0;[R3] has_pk:true;[R3] pk_info:(0);[R3] pks:pk;[R3] has_uk:false;[R3] uk_info:(null);[R3] uks:(null);[R3] [C1] column_name:pk;[R3] [C1] column_type:MYSQL_TYPE_LONG;[R3] [C1] column_is_rowkey:true;[R3] [C1] column_is_signed:true;[R3] [C1] column_encoding:;[R3] [C1] column_is_not_null:true;[R3] [C1] column_value_new:[3](1);[R3] [C2] column_name:c1;[R3] [C2] column_type:MYSQL_TYPE_VAR_STRING;[R3] [C2] column_is_rowkey:false;[R3] [C2] column_is_signed:true;[R3] [C2] column_encoding:utf8mb4;[R3] [C2] column_is_not_null:false;[R3] [C2] column_value_new:[3](1);$[R4] COMMIT;
alter proxyconfig set server_state_refresh_interval='1s';
create database db1;
create tablegroup tg;
create table db1.tb_normal (pk int primary key,c1 varchar(1024) default '0', c2 timestamp(6) default now(6), c3 timestamp default now(), index i1(c2), index i2(c1)) tablegroup tg;
create table db1.tb_increment (pk int primary key auto_increment,c1 int, c2 datetime(6) DEFAULT CURRENT_TIMESTAMP(6) ON UPDATE CURRENT_TIMESTAMP(6), index i1(c2)) tablegroup tg;
create table db1.tb_bigtable (c1 varchar(65536),c2 varchar(65536),c3 varchar(65536),c4 varchar(65536), pk bigint primary key auto_increment) COMPRESSION = 'none' tablegroup tg;
create table test.tb_table_gencol(pk1 bigint, pk2 varchar(2048),c1 varchar(65536), c2 varchar(65536),ac1 bigint auto_increment,
ts timestamp(6) DEFAULT CURRENT_TIMESTAMP(6) ON UPDATE CURRENT_TIMESTAMP(6),  gmt_create timestamp(6) default now(6), gmt_modified timestamp(6) default now(6),
gen_c1 varchar(10) GENERATED ALWAYS AS (substr(c1,1,10)) virtual,
gen_c2 varchar(10) GENERATED ALWAYS AS (substr(c2,1,10)) stored,
primary key(pk1, pk2),index i1(ts));
create table test.tablegencol(c1 bigint primary key,user_id varchar(32) NOT NULL default '' comment 'Alipay User ID', address varchar(256) NOT NULL default '' comment 'address', index(user_id,address(255)));
create table test.table_hash(c1 int primary key, c2 int) partition by hash(c1) partitions 2;
create table test.table_range(c1 int primary key, c2 int) partition by range(c1) (partition p0 values less than (100), partition p1 values less than (200), partition p2 values less than MAXVALUE);
create table test.table_hash_range (c1 int primary key, c2 int) partition by hash(c1) subpartition by range(c1) subpartition template(SUBPARTITION c0 VALUES LESS THAN(1990), SUBPARTITION c1 VALUES LESS THAN (2000), SUBPARTITION c2 VALUES LESS THAN MAXVALUE) partitions 2;
create table test.table_range_hash (c1 int primary key, c2 int) partition by range(c1) subpartition by hash(c1) subpartitions 2 (PARTITION c0 VALUES LESS THAN (1980), PARTITION c1 VALUES LESS THAN (1990), PARTITION c2 VALUES LESS THAN (1995), PARTITION c3 VALUES LESS THAN (2000), PARTITION c4 VALUES LESS THAN MAXVALUE);
create tablegroup tg_old partition by hash partitions 2;
create table test.table_with_tg(c1 int primary key, c2 int) tablegroup tg_old partition by hash(c1) partitions 2;
set recyclebin = off;
create table test.tb_table_drop(a int, index jg_index(a));
drop table test.tb_table_drop;
set recyclebin = on;
create table test.tb_table_drop2(pk int primary key, c1 int, unique index i1(c1));
drop table test.tb_table_drop2;
create table test.tb_table_fulltext (id int, body varchar(10), fulltext (body));
show index from test.tb_table_fulltext;
Table	Non_unique	Key_name	Seq_in_index	Column_name	Collation	Cardinality	Sub_part	Packed	Null	Index_type	Comment	Index_comment	Visible
tb_table_fulltext	1	body	1	body	A	NULL	NULL	NULL	YES	FULLTEXT	available		YES
show create table test.tb_table_fulltext;
Table	Create Table
tb_table_fulltext	CREATE TABLE `tb_table_fulltext` (
  `id` int(11) DEFAULT NULL,
  `body` varchar(10) DEFAULT NULL, 
 FULLTEXT KEY `body` (`body`) CTXCAT(`body`) WITH PARSER 'TAOBAO_CHN' BLOCK_SIZE 16384
) DEFAULT CHARSET = utf8mb4 ROW_FORMAT = DYNAMIC COMPRESSION = 'zstd_1.0' REPLICA_NUM = 3 BLOCK_SIZE = 16384 USE_BLOOM_FILTER = FALSE TABLET_SIZE = 134217728 PCTFREE = 10
create table test.tb_simple(pk int primary key, val int, index i1(val));
ob1.mysql alter tenant sys set primary_zone='z1';
ob1.mysql alter tenant obtest set primary_zone='z2';
ob1.check_until_timeout select count(1) from __all_virtual_core_meta_table where role=1 and zone='z1',1,120;
ob1.check_until_timeout select count(1) from __all_virtual_server_stat,3,120;
ob1.mysql alter system major freeze;
ob1.check_version 2;
ob1.check_until_timeout select info from __all_zone where zone='' and name='merge_status',IDLE,30;
set autocommit=0;
insert into db1.tb_normal(pk,c1) values(101,'101'),(102,'102'),(103,'103'),(104,'104');
update db1.tb_normal set c1=concat(c1,'_x') where pk > 100;
delete from db1.tb_normal where pk=104;
commit;
insert into test.tb_simple values(1, 11);
insert into test.tb_simple values(2, 12);
insert into test.tb_simple values(3, 13);
ob1.mysql alter system minor freeze tenant = all;
insert into test.tb_simple values(4, 14);
insert into test.tb_simple values(5, 15);
insert into test.tb_simple values(6, 16);
commit;
ob1.check_until_timeout select count(1) from __all_virtual_memstore_info where is_active=0, 0, 300;
ob1.upgrade_check_before;
create resource unit oblog_box max_cpu 2, max_memory=1073741824, max_iops 10000, max_disk_size 5000000000, max_session_num 9223372036854775807, MIN_CPU=1, MIN_MEMORY=1073741824, MIN_IOPS=5000;
create resource pool oblog_pool unit = 'oblog_box', unit_num = 1;
create tenant oblog_tt_empty replica_num = 1, primary_zone='z1', resource_pool_list=('oblog_pool') set ob_tcp_invited_nodes='%';
ob1.mysql alter system begin upgrade;
ob1.upgrade_commond_for_server pre;
ob1.mysql_p select tenant_id, table_id, part_id, part_idx, high_bound_val from oceanbase.__all_part where table_id in ($sub_query) order by tenant_id, table_id, part_id, part_idx, high_bound_val;
ob1.mysql_p select tenant_id, table_id, part_id, part_idx, high_bound_val from oceanbase.__all_part_history where table_id in ($sub_query) order by tenant_id, table_id, part_id, part_idx, high_bound_val;
ob1.mysql_p select tenant_id, table_id, sub_part_id, sub_part_idx, high_bound_val from oceanbase.__all_def_sub_part where table_id in ($sub_query) order by tenant_id, table_id, sub_part_id, sub_part_idx, high_bound_val;
ob1.mysql_p select tenant_id, table_id, sub_part_id, sub_part_idx, high_bound_val from oceanbase.__all_def_sub_part_history where table_id in ($sub_query) order by tenant_id, table_id, sub_part_id, sub_part_idx, high_bound_val;
ob1.check_until_timeout select count(1) from __all_virtual_core_meta_table where role=1 and zone='z1',1,120;
ob1.check_until_timeout SELECT CAST(COUNT(*) AS SIGNED) as cnt FROM __all_virtual_clog_stat WHERE is_in_sync = 0 and is_offline=0,0,600;
set @saved_ob_query_timeout = @@session.ob_query_timeout;
set @@session.ob_query_timeout = 60000000;
alter system stop zone 'z2';
set @@session.ob_query_timeout = @saved_ob_query_timeout;
ob1.check_until_timeout select info from __all_zone where zone='z2' and name='status',INACTIVE,20;
ob1.check_until_timeout select leader_count from __all_virtual_server_stat where zone = 'z2',0,20;
ob1.z2.check_state_in_congest upgrade;
ob1.z2.stop;
ob1.check_until_timeout select count(*) from oceanbase.__all_server where zone = 'z2' and (start_service_time<=0 and status='INACTIVE'),1,60;
ob1.z2.upgrade;
ob1.z2.nstart;
ob1.check_until_timeout select count(*) from oceanbase.__all_server where zone = 'z2' and (start_service_time<=0 or status='INACTIVE'),0,60;
ob1.check_until_timeout SELECT CAST(COUNT(*) AS SIGNED) as cnt FROM __all_virtual_clog_stat WHERE is_in_sync = 0 and is_offline=0,0,600;
ob1.mysql alter system start zone 'z2';
ob1.check_until_timeout select count(1) from __all_virtual_server_stat,3,120;
ob1.z2.check_state_in_congest active;
set autocommit=0;
insert into db1.tb_normal(pk,c1) values(201,'201'),(202,'202'),(203,'203'),(204,'204');
update db1.tb_normal set c1=concat(c1,'_x') where pk > 100;
delete from db1.tb_normal where pk=204;
update db1.tb_increment set pk=pk+1 order by pk desc limit 1;
insert into db1.tb_increment(pk,c1) values (201,201),(202,202);
replace into db1.tb_increment(pk,c1) values (201,202);
delete from db1.tb_increment where pk=202;
commit;
set autocommit=1;
select pk,c1 from db1.tb_normal order by pk;
pk	c1
1	0
2	0
3	0
4	0
5	0
6	0
7	0
8	0
9	0
10	0
11	0
12	0
13	0
14	0
15	0
16	0
17	0
18	0
19	0
20	0
21	0
22	0
23	0
24	0
25	0
26	0
27	0
28	0
29	0
30	0
31	0
32	0
33	0
34	0
35	0
36	0
37	0
38	0
39	0
40	0
41	0
42	0
43	0
44	0
45	0
46	0
47	0
48	0
49	0
50	0
51	0
52	0
53	0
54	0
55	0
56	0
57	0
58	0
59	0
60	0
61	0
62	0
63	0
64	0
65	0
66	0
67	0
68	0
69	0
70	0
71	0
72	0
73	0
74	0
75	0
76	0
77	0
78	0
79	0
80	0
81	0
82	0
83	0
84	0
85	0
86	0
87	0
88	0
89	0
90	0
91	0
92	0
93	0
94	0
95	0
96	0
97	0
98	0
99	0
100	0
101	101_x_x
102	102_x_x
103	103_x_x
201	201_x
202	202_x
203	203_x
select pk,c1 from db1.tb_increment order by pk limit 1;
pk	c1
1	1
select a.pk,a.c1,b.c1 from db1.tb_normal a join db1.tb_increment b where a.pk=b.pk order by a.pk limit 2;
pk	c1	c1
1	0	1
2	0	2
show tables like 'tb_normal';
Tables_in_db1 (tb_normal)
tb_normal
show create table db1.tb_increment;
Table	Create Table
tb_increment	CREATE TABLE `tb_increment` (
  `pk` int(11) NOT NULL AUTO_INCREMENT,
  `c1` int(11) DEFAULT NULL,
  `c2` datetime(6) DEFAULT CURRENT_TIMESTAMP(6) ON UPDATE CURRENT_TIMESTAMP(6),
  PRIMARY KEY (`pk`),
  KEY `i1` (`c2`) BLOCK_SIZE 16384 GLOBAL
) AUTO_INCREMENT = 2000203 DEFAULT CHARSET = utf8mb4 ROW_FORMAT = DYNAMIC COMPRESSION = 'zstd_1.0' REPLICA_NUM = 3 BLOCK_SIZE = 16384 USE_BLOOM_FILTER = FALSE TABLET_SIZE = 134217728 PCTFREE = 10 TABLEGROUP = 'tg'
set autocommit=0;
insert into db1.tb_normal(pk,c1) values(301,'301'),(302,'302'),(303,'303'),(304,'304');
update db1.tb_normal set c1=concat(c1,'_x') where pk > 100;
delete from db1.tb_normal where pk=304;
update db1.tb_increment set pk=pk+1 order by pk desc limit 1;
insert into db1.tb_increment(pk,c1) values (301,301),(302,302);
replace into db1.tb_increment(pk,c1) values (301,302);
delete from db1.tb_increment where pk=302;
commit;
set autocommit=1;
select pk,c1 from db1.tb_normal order by pk;
pk	c1
1	0
2	0
3	0
4	0
5	0
6	0
7	0
8	0
9	0
10	0
11	0
12	0
13	0
14	0
15	0
16	0
17	0
18	0
19	0
20	0
21	0
22	0
23	0
24	0
25	0
26	0
27	0
28	0
29	0
30	0
31	0
32	0
33	0
34	0
35	0
36	0
37	0
38	0
39	0
40	0
41	0
42	0
43	0
44	0
45	0
46	0
47	0
48	0
49	0
50	0
51	0
52	0
53	0
54	0
55	0
56	0
57	0
58	0
59	0
60	0
61	0
62	0
63	0
64	0
65	0
66	0
67	0
68	0
69	0
70	0
71	0
72	0
73	0
74	0
75	0
76	0
77	0
78	0
79	0
80	0
81	0
82	0
83	0
84	0
85	0
86	0
87	0
88	0
89	0
90	0
91	0
92	0
93	0
94	0
95	0
96	0
97	0
98	0
99	0
100	0
101	101_x_x_x
102	102_x_x_x
103	103_x_x_x
201	201_x_x
202	202_x_x
203	203_x_x
301	301_x
302	302_x
303	303_x
select pk,c1 from db1.tb_increment order by pk limit 1;
pk	c1
1	1
select a.pk,a.c1,b.c1 from db1.tb_normal a join db1.tb_increment b where a.pk=b.pk order by a.pk limit 2;
pk	c1	c1
1	0	1
2	0	2
show tables like 'tb_normal';
Tables_in_db1 (tb_normal)
tb_normal
show create table db1.tb_increment;
Table	Create Table
tb_increment	CREATE TABLE `tb_increment` (
  `pk` int(11) NOT NULL AUTO_INCREMENT,
  `c1` int(11) DEFAULT NULL,
  `c2` datetime(6) DEFAULT CURRENT_TIMESTAMP(6) ON UPDATE CURRENT_TIMESTAMP(6),
  PRIMARY KEY (`pk`),
  KEY `i1` (`c2`) BLOCK_SIZE 16384 GLOBAL
) AUTO_INCREMENT = 2000203 DEFAULT CHARSET = utf8mb4 ROW_FORMAT = DYNAMIC COMPRESSION = 'zstd_1.0' REPLICA_NUM = 3 BLOCK_SIZE = 16384 USE_BLOOM_FILTER = FALSE TABLET_SIZE = 134217728 PCTFREE = 10 TABLEGROUP = 'tg'
select * from test.tb_simple;
pk	val
1	11
2	12
3	13
4	14
5	15
6	16
ob1.z1.mysql_p show global variables like 'sql_mode';
Variable_name	Value
sql_mode	STRICT_ALL_TABLES
ob1.z1.mysql_p show variables like 'sql_mode';
Variable_name	Value
sql_mode	STRICT_ALL_TABLES
ob1.z1.mysql_p show create table oceanbase.__all_table;
Table	Create Table
__all_table	CREATE TABLE `__all_table` (\n  `gmt_create` timestamp(6) NULL DEFAULT CURRENT_TIMESTAMP(6),\n  `gmt_modified` timestamp(6) NULL DEFAULT CURRENT_TIMESTAMP(6) ON UPDATE CURRENT_TIMESTAMP(6),\n  `tenant_id` bigint(20) NOT NULL,\n  `table_id` bigint(20) NOT NULL,\n  `table_name` varchar(256) NOT NULL DEFAULT '',\n  `database_id` bigint(20) NOT NULL,\n  `table_type` bigint(20) NOT NULL,\n  `load_type` bigint(20) NOT NULL,\n  `def_type` bigint(20) NOT NULL,\n  `rowkey_column_num` bigint(20) NOT NULL,\n  `index_column_num` bigint(20) NOT NULL,\n  `max_used_column_id` bigint(20) NOT NULL,\n  `replica_num` bigint(20) NOT NULL,\n  `autoinc_column_id` bigint(20) NOT NULL,\n  `auto_increment` bigint(20) unsigned DEFAULT '1',\n  `read_only` bigint(20) NOT NULL,\n  `rowkey_split_pos` bigint(20) NOT NULL,\n  `compress_func_name` varchar(128) NOT NULL,\n  `expire_condition` varchar(4096) NOT NULL,\n  `is_use_bloomfilter` bigint(20) NOT NULL,\n  `comment` varchar(4096) NOT NULL DEFAULT '',\n  `block_size` bigint(20) NOT NULL,\n  `collation_type` bigint(20) NOT NULL,\n  `data_table_id` bigint(20) DEFAULT NULL,\n  `index_status` bigint(20) NOT NULL,\n  `tablegroup_id` bigint(20) NOT NULL,\n  `progressive_merge_num` bigint(20) NOT NULL,\n  `index_type` bigint(20) NOT NULL,\n  `part_level` bigint(20) NOT NULL,\n  `part_func_type` bigint(20) NOT NULL,\n  `part_func_expr` varchar(4096) NOT NULL,\n  `part_num` bigint(20) NOT NULL,\n  `sub_part_func_type` bigint(20) NOT NULL,\n  `sub_part_func_expr` varchar(4096) NOT NULL,\n  `sub_part_num` bigint(20) NOT NULL,\n  `create_mem_version` bigint(20) NOT NULL,\n  `schema_version` bigint(20) NOT NULL,\n  `view_definition` varchar(65536) NOT NULL,\n  `view_check_option` bigint(20) NOT NULL,\n  `view_is_updatable` bigint(20) NOT NULL,\n  `zone_list` varchar(8192) NOT NULL,\n  `primary_zone` varchar(128) DEFAULT NULL,\n  `index_using_type` bigint(20) NOT NULL DEFAULT '0',\n  `parser_name` varchar(128) DEFAULT NULL,\n  `index_attributes_set` bigint(20) DEFAULT '0',\n  `locality` varchar(4096) NOT NULL DEFAULT '',\n  `tablet_size` bigint(20) NOT NULL DEFAULT '134217728',\n  `pctfree` bigint(20) NOT NULL DEFAULT '10',\n  `previous_locality` varchar(4096) NOT NULL DEFAULT '',\n  `max_used_part_id` bigint(20) NOT NULL DEFAULT '-1',\n  `partition_cnt_within_partition_table` bigint(20) NOT NULL DEFAULT '-1',\n  `partition_status` bigint(20) DEFAULT '0',\n  `partition_schema_version` bigint(20) DEFAULT '0',\n  `max_used_constraint_id` bigint(20) DEFAULT NULL,\n  `session_id` bigint(20) DEFAULT '0',\n  `pk_comment` varchar(4096) NOT NULL DEFAULT '',\n  `sess_active_time` bigint(20) DEFAULT '0',\n  `row_store_type` varchar(128) DEFAULT 'encoding_row_store',\n  `store_format` varchar(128) DEFAULT '',\n  `duplicate_scope` bigint(20) DEFAULT '0',\n  `binding` tinyint(4) DEFAULT '0',\n  `progressive_merge_round` bigint(20) DEFAULT '0',\n  `storage_format_version` bigint(20) DEFAULT '2',\n  `table_mode` bigint(20) NOT NULL DEFAULT '0',\n  `encryption` varchar(128) DEFAULT '',\n  `tablespace_id` bigint(20) NOT NULL DEFAULT '-1',\n  `drop_schema_version` bigint(20) NOT NULL DEFAULT '-1',\n  PRIMARY KEY (`tenant_id`, `table_id`)\n) DEFAULT CHARSET = utf8mb4 ROW_FORMAT = DYNAMIC COMPRESSION = 'none' REPLICA_NUM = 3 BLOCK_SIZE = 16384 USE_BLOOM_FILTER = FALSE TABLET_SIZE = 134217728 PCTFREE = 10 TABLEGROUP = 'oceanbase'\n partition by key (tenant_id) partitions 16\n
ob1.z2.mysql_p show global variables like 'sql_mode';
Variable_name	Value
sql_mode	STRICT_ALL_TABLES
ob1.z2.mysql_p show variables like 'sql_mode';
Variable_name	Value
sql_mode	STRICT_ALL_TABLES
ob1.z2.mysql_p show create table oceanbase.__all_table;
Table	Create Table
__all_table	CREATE TABLE `__all_table` (\n  `gmt_create` timestamp(6) NULL DEFAULT CURRENT_TIMESTAMP(6),\n  `gmt_modified` timestamp(6) NULL DEFAULT CURRENT_TIMESTAMP(6) ON UPDATE CURRENT_TIMESTAMP(6),\n  `tenant_id` bigint(20) NOT NULL,\n  `table_id` bigint(20) NOT NULL,\n  `table_name` varchar(256) NOT NULL DEFAULT '',\n  `database_id` bigint(20) NOT NULL,\n  `table_type` bigint(20) NOT NULL,\n  `load_type` bigint(20) NOT NULL,\n  `def_type` bigint(20) NOT NULL,\n  `rowkey_column_num` bigint(20) NOT NULL,\n  `index_column_num` bigint(20) NOT NULL,\n  `max_used_column_id` bigint(20) NOT NULL,\n  `replica_num` bigint(20) NOT NULL,\n  `autoinc_column_id` bigint(20) NOT NULL,\n  `auto_increment` bigint(20) unsigned DEFAULT '1',\n  `read_only` bigint(20) NOT NULL,\n  `rowkey_split_pos` bigint(20) NOT NULL,\n  `compress_func_name` varchar(128) NOT NULL,\n  `expire_condition` varchar(4096) NOT NULL,\n  `is_use_bloomfilter` bigint(20) NOT NULL,\n  `comment` varchar(4096) NOT NULL DEFAULT '',\n  `block_size` bigint(20) NOT NULL,\n  `collation_type` bigint(20) NOT NULL,\n  `data_table_id` bigint(20) DEFAULT NULL,\n  `index_status` bigint(20) NOT NULL,\n  `tablegroup_id` bigint(20) NOT NULL,\n  `progressive_merge_num` bigint(20) NOT NULL,\n  `index_type` bigint(20) NOT NULL,\n  `part_level` bigint(20) NOT NULL,\n  `part_func_type` bigint(20) NOT NULL,\n  `part_func_expr` varchar(4096) NOT NULL,\n  `part_num` bigint(20) NOT NULL,\n  `sub_part_func_type` bigint(20) NOT NULL,\n  `sub_part_func_expr` varchar(4096) NOT NULL,\n  `sub_part_num` bigint(20) NOT NULL,\n  `create_mem_version` bigint(20) NOT NULL,\n  `schema_version` bigint(20) NOT NULL,\n  `view_definition` varchar(65536) NOT NULL,\n  `view_check_option` bigint(20) NOT NULL,\n  `view_is_updatable` bigint(20) NOT NULL,\n  `zone_list` varchar(8192) NOT NULL,\n  `primary_zone` varchar(128) DEFAULT NULL,\n  `index_using_type` bigint(20) NOT NULL DEFAULT '0',\n  `parser_name` varchar(128) DEFAULT NULL,\n  `index_attributes_set` bigint(20) DEFAULT '0',\n  `locality` varchar(4096) NOT NULL DEFAULT '',\n  `tablet_size` bigint(20) NOT NULL DEFAULT '134217728',\n  `pctfree` bigint(20) NOT NULL DEFAULT '10',\n  `previous_locality` varchar(4096) NOT NULL DEFAULT '',\n  `max_used_part_id` bigint(20) NOT NULL DEFAULT '-1',\n  `partition_cnt_within_partition_table` bigint(20) NOT NULL DEFAULT '-1',\n  `partition_status` bigint(20) DEFAULT '0',\n  `partition_schema_version` bigint(20) DEFAULT '0',\n  `max_used_constraint_id` bigint(20) DEFAULT NULL,\n  `session_id` bigint(20) DEFAULT '0',\n  `pk_comment` varchar(4096) NOT NULL DEFAULT '',\n  `sess_active_time` bigint(20) DEFAULT '0',\n  `row_store_type` varchar(128) DEFAULT 'encoding_row_store',\n  `store_format` varchar(128) DEFAULT '',\n  `duplicate_scope` bigint(20) DEFAULT '0',\n  `binding` tinyint(4) DEFAULT '0',\n  `progressive_merge_round` bigint(20) DEFAULT '0',\n  `storage_format_version` bigint(20) DEFAULT '2',\n  `table_mode` bigint(20) NOT NULL DEFAULT '0',\n  `encryption` varchar(128) DEFAULT '',\n  `tablespace_id` bigint(20) NOT NULL DEFAULT '-1',\n  `drop_schema_version` bigint(20) NOT NULL DEFAULT '-1',\n  PRIMARY KEY (`tenant_id`, `table_id`)\n) DEFAULT CHARSET = utf8mb4 ROW_FORMAT = DYNAMIC COMPRESSION = 'none' REPLICA_NUM = 3 BLOCK_SIZE = 16384 USE_BLOOM_FILTER = FALSE TABLET_SIZE = 134217728 PCTFREE = 10 TABLEGROUP = 'oceanbase'\n partition by key (tenant_id) partitions 16\n
ob1.mysql alter system minor freeze tenant = all;
set autocommit=0;
insert into db1.tb_normal(pk,c1) values(401,'401'),(402,'402'),(403,'403'),(404,'404');
update db1.tb_normal set c1=concat(c1,'_x') where pk > 100;
delete from db1.tb_normal where pk=404;
update db1.tb_increment set pk=pk+1 order by pk desc limit 1;
insert into db1.tb_increment(pk,c1) values (401,401),(402,402);
replace into db1.tb_increment(pk,c1) values (401,402);
delete from db1.tb_increment where pk=402;
commit;
set autocommit=1;
use oblog_db;
set ob_org_cluster_id=1234;
replace into oblog_test values (1, 1), (2,2), (3,3);
ob1.oblog.next_dml;
[R0] BEGIN;[R0] org_cluster_id:1234;[R1] record_type:DELETE;[R1] database_name:obtest.oblog_db;[R1] table_name:oblog_test;[R1] log_event:true;[R1] column_count:2;[R1] source_category:SRC_FULL_RECORDED;[R1] source_type:SRC_OCEANBASE_1_0;[R1] has_pk:true;[R1] pk_info:(0);[R1] pks:pk;[R1] has_uk:false;[R1] uk_info:(null);[R1] uks:(null);[R1] [C1] column_name:pk;[R1] [C1] column_type:MYSQL_TYPE_LONG;[R1] [C1] column_is_rowkey:true;[R1] [C1] column_is_signed:true;[R1] [C1] column_encoding:;[R1] [C1] column_is_not_null:true;[R1] [C1] column_value_old:[1](1);[R1] [C2] column_name:c1;[R1] [C2] column_type:MYSQL_TYPE_VAR_STRING;[R1] [C2] column_is_rowkey:false;[R1] [C2] column_is_signed:true;[R1] [C2] column_encoding:utf8mb4;[R1] [C2] column_is_not_null:false;[R1] [C2] column_value_old:[1](1);$[R2] record_type:INSERT;[R2] database_name:obtest.oblog_db;[R2] table_name:oblog_test;[R2] log_event:true;[R2] column_count:2;[R2] source_category:SRC_FULL_RECORDED;[R2] source_type:SRC_OCEANBASE_1_0;[R2] has_pk:true;[R2] pk_info:(0);[R2] pks:pk;[R2] has_uk:false;[R2] uk_info:(null);[R2] uks:(null);[R2] [C1] column_name:pk;[R2] [C1] column_type:MYSQL_TYPE_LONG;[R2] [C1] column_is_rowkey:true;[R2] [C1] column_is_signed:true;[R2] [C1] column_encoding:;[R2] [C1] column_is_not_null:true;[R2] [C1] column_value_new:[1](1);[R2] [C2] column_name:c1;[R2] [C2] column_type:MYSQL_TYPE_VAR_STRING;[R2] [C2] column_is_rowkey:false;[R2] [C2] column_is_signed:true;[R2] [C2] column_encoding:utf8mb4;[R2] [C2] column_is_not_null:false;[R2] [C2] column_value_new:[1](1);$[R3] record_type:DELETE;[R3] database_name:obtest.oblog_db;[R3] table_name:oblog_test;[R3] log_event:true;[R3] column_count:2;[R3] source_category:SRC_FULL_RECORDED;[R3] source_type:SRC_OCEANBASE_1_0;[R3] has_pk:true;[R3] pk_info:(0);[R3] pks:pk;[R3] has_uk:false;[R3] uk_info:(null);[R3] uks:(null);[R3] [C1] column_name:pk;[R3] [C1] column_type:MYSQL_TYPE_LONG;[R3] [C1] column_is_rowkey:true;[R3] [C1] column_is_signed:true;[R3] [C1] column_encoding:;[R3] [C1] column_is_not_null:true;[R3] [C1] column_value_old:[2](1);[R3] [C2] column_name:c1;[R3] [C2] column_type:MYSQL_TYPE_VAR_STRING;[R3] [C2] column_is_rowkey:false;[R3] [C2] column_is_signed:true;[R3] [C2] column_encoding:utf8mb4;[R3] [C2] column_is_not_null:false;[R3] [C2] column_value_old:[2](1);$[R4] record_type:INSERT;[R4] database_name:obtest.oblog_db;[R4] table_name:oblog_test;[R4] log_event:true;[R4] column_count:2;[R4] source_category:SRC_FULL_RECORDED;[R4] source_type:SRC_OCEANBASE_1_0;[R4] has_pk:true;[R4] pk_info:(0);[R4] pks:pk;[R4] has_uk:false;[R4] uk_info:(null);[R4] uks:(null);[R4] [C1] column_name:pk;[R4] [C1] column_type:MYSQL_TYPE_LONG;[R4] [C1] column_is_rowkey:true;[R4] [C1] column_is_signed:true;[R4] [C1] column_encoding:;[R4] [C1] column_is_not_null:true;[R4] [C1] column_value_new:[2](1);[R4] [C2] column_name:c1;[R4] [C2] column_type:MYSQL_TYPE_VAR_STRING;[R4] [C2] column_is_rowkey:false;[R4] [C2] column_is_signed:true;[R4] [C2] column_encoding:utf8mb4;[R4] [C2] column_is_not_null:false;[R4] [C2] column_value_new:[2](1);$[R5] record_type:DELETE;[R5] database_name:obtest.oblog_db;[R5] table_name:oblog_test;[R5] log_event:true;[R5] column_count:2;[R5] source_category:SRC_FULL_RECORDED;[R5] source_type:SRC_OCEANBASE_1_0;[R5] has_pk:true;[R5] pk_info:(0);[R5] pks:pk;[R5] has_uk:false;[R5] uk_info:(null);[R5] uks:(null);[R5] [C1] column_name:pk;[R5] [C1] column_type:MYSQL_TYPE_LONG;[R5] [C1] column_is_rowkey:true;[R5] [C1] column_is_signed:true;[R5] [C1] column_encoding:;[R5] [C1] column_is_not_null:true;[R5] [C1] column_value_old:[3](1);[R5] [C2] column_name:c1;[R5] [C2] column_type:MYSQL_TYPE_VAR_STRING;[R5] [C2] column_is_rowkey:false;[R5] [C2] column_is_signed:true;[R5] [C2] column_encoding:utf8mb4;[R5] [C2] column_is_not_null:false;[R5] [C2] column_value_old:[3](1);$[R6] record_type:INSERT;[R6] database_name:obtest.oblog_db;[R6] table_name:oblog_test;[R6] log_event:true;[R6] column_count:2;[R6] source_category:SRC_FULL_RECORDED;[R6] source_type:SRC_OCEANBASE_1_0;[R6] has_pk:true;[R6] pk_info:(0);[R6] pks:pk;[R6] has_uk:false;[R6] uk_info:(null);[R6] uks:(null);[R6] [C1] column_name:pk;[R6] [C1] column_type:MYSQL_TYPE_LONG;[R6] [C1] column_is_rowkey:true;[R6] [C1] column_is_signed:true;[R6] [C1] column_encoding:;[R6] [C1] column_is_not_null:true;[R6] [C1] column_value_new:[3](1);[R6] [C2] column_name:c1;[R6] [C2] column_type:MYSQL_TYPE_VAR_STRING;[R6] [C2] column_is_rowkey:false;[R6] [C2] column_is_signed:true;[R6] [C2] column_encoding:utf8mb4;[R6] [C2] column_is_not_null:false;[R6] [C2] column_value_new:[3](1);$[R7] COMMIT;
ob1.check_until_timeout select count(1) from __all_virtual_core_meta_table where role=1 and zone='z1',1,120;
ob1.check_until_timeout select count(1) from __all_virtual_server_stat,3,120;
ob1.check_until_timeout SELECT CAST(COUNT(*) AS SIGNED) as cnt FROM __all_virtual_clog_stat WHERE is_in_sync = 0 and is_offline=0,0,600;
set @@session.ob_query_timeout = 60000000;
alter system stop zone 'z1';
ob1.check_until_timeout select info from __all_zone where zone='z1' and name='status',INACTIVE,20;
ob1.check_until_timeout select leader_count from __all_virtual_server_stat where zone = 'z1',0,20;
ob1.z1.check_state_in_congest upgrade;
ob1.z1.stop;
ob1.check_until_timeout select count(*) from oceanbase.__all_server where zone = 'z1' and (start_service_time<=0 and status='INACTIVE'),1,60;
ob1.z1.upgrade;
ob1.z1.nstart;
ob1.check_until_timeout select count(*) from oceanbase.__all_server where zone = 'z1' and (start_service_time<=0 or status='INACTIVE'),0,60;
ob1.check_until_timeout SELECT CAST(COUNT(*) AS SIGNED) as cnt FROM __all_virtual_clog_stat WHERE is_in_sync = 0 and is_offline=0,0,600;
ob1.mysql alter system start zone 'z1';
ob1.check_until_timeout select count(1) from __all_virtual_server_stat,3,120;
ob1.z1.check_state_in_congest active;
ob1.check_until_timeout select count(1) from __all_virtual_core_meta_table where role=1 and zone='z1',1,120;
ob1.mysql alter system minor freeze tenant = all;
set autocommit=0;
insert into db1.tb_normal(pk,c1) values(501,'501'),(502,'502'),(503,'503'),(504,'504');
update db1.tb_normal set c1=concat(c1,'_x') where pk > 100;
delete from db1.tb_normal where pk=504;
update db1.tb_increment set pk=pk+1 order by pk desc limit 1;
insert into db1.tb_increment(pk,c1) values (501,501),(502,502);
replace into db1.tb_increment(pk,c1) values (501,502);
delete from db1.tb_increment where pk=502;
commit;
set autocommit=1;
select pk,c1 from db1.tb_normal order by pk;
pk	c1
1	0
2	0
3	0
4	0
5	0
6	0
7	0
8	0
9	0
10	0
11	0
12	0
13	0
14	0
15	0
16	0
17	0
18	0
19	0
20	0
21	0
22	0
23	0
24	0
25	0
26	0
27	0
28	0
29	0
30	0
31	0
32	0
33	0
34	0
35	0
36	0
37	0
38	0
39	0
40	0
41	0
42	0
43	0
44	0
45	0
46	0
47	0
48	0
49	0
50	0
51	0
52	0
53	0
54	0
55	0
56	0
57	0
58	0
59	0
60	0
61	0
62	0
63	0
64	0
65	0
66	0
67	0
68	0
69	0
70	0
71	0
72	0
73	0
74	0
75	0
76	0
77	0
78	0
79	0
80	0
81	0
82	0
83	0
84	0
85	0
86	0
87	0
88	0
89	0
90	0
91	0
92	0
93	0
94	0
95	0
96	0
97	0
98	0
99	0
100	0
101	101_x_x_x_x_x
102	102_x_x_x_x_x
103	103_x_x_x_x_x
201	201_x_x_x_x
202	202_x_x_x_x
203	203_x_x_x_x
301	301_x_x_x
302	302_x_x_x
303	303_x_x_x
401	401_x_x
402	402_x_x
403	403_x_x
501	501_x
502	502_x
503	503_x
select pk,c1 from db1.tb_increment order by pk limit 1;
pk	c1
1	1
select a.pk,a.c1,b.c1 from db1.tb_normal a join db1.tb_increment b where a.pk=b.pk order by a.pk limit 2;
pk	c1	c1
1	0	1
2	0	2
show tables like 'tb_normal';
Tables_in_db1 (tb_normal)
tb_normal
show create table db1.tb_increment;
Table	Create Table
tb_increment	CREATE TABLE `tb_increment` (
  `pk` int(11) NOT NULL AUTO_INCREMENT,
  `c1` int(11) DEFAULT NULL,
  `c2` datetime(6) DEFAULT CURRENT_TIMESTAMP(6) ON UPDATE CURRENT_TIMESTAMP(6),
  PRIMARY KEY (`pk`),
  KEY `i1` (`c2`) BLOCK_SIZE 16384 GLOBAL
) AUTO_INCREMENT = 2000203 DEFAULT CHARSET = utf8mb4 ROW_FORMAT = DYNAMIC COMPRESSION = 'zstd_1.0' REPLICA_NUM = 3 BLOCK_SIZE = 16384 USE_BLOOM_FILTER = FALSE TABLET_SIZE = 134217728 PCTFREE = 10 TABLEGROUP = 'tg'
set autocommit=0;
insert into db1.tb_normal(pk,c1) values(601,'601'),(602,'602'),(603,'603'),(604,'604');
update db1.tb_normal set c1=concat(c1,'_x') where pk > 100;
delete from db1.tb_normal where pk=604;
update db1.tb_increment set pk=pk+1 order by pk desc limit 1;
insert into db1.tb_increment(pk,c1) values (601,601),(602,602);
replace into db1.tb_increment(pk,c1) values (601,602);
delete from db1.tb_increment where pk=602;
commit;
set autocommit=1;
select pk,c1 from db1.tb_normal order by pk;
pk	c1
1	0
2	0
3	0
4	0
5	0
6	0
7	0
8	0
9	0
10	0
11	0
12	0
13	0
14	0
15	0
16	0
17	0
18	0
19	0
20	0
21	0
22	0
23	0
24	0
25	0
26	0
27	0
28	0
29	0
30	0
31	0
32	0
33	0
34	0
35	0
36	0
37	0
38	0
39	0
40	0
41	0
42	0
43	0
44	0
45	0
46	0
47	0
48	0
49	0
50	0
51	0
52	0
53	0
54	0
55	0
56	0
57	0
58	0
59	0
60	0
61	0
62	0
63	0
64	0
65	0
66	0
67	0
68	0
69	0
70	0
71	0
72	0
73	0
74	0
75	0
76	0
77	0
78	0
79	0
80	0
81	0
82	0
83	0
84	0
85	0
86	0
87	0
88	0
89	0
90	0
91	0
92	0
93	0
94	0
95	0
96	0
97	0
98	0
99	0
100	0
101	101_x_x_x_x_x_x
102	102_x_x_x_x_x_x
103	103_x_x_x_x_x_x
201	201_x_x_x_x_x
202	202_x_x_x_x_x
203	203_x_x_x_x_x
301	301_x_x_x_x
302	302_x_x_x_x
303	303_x_x_x_x
401	401_x_x_x
402	402_x_x_x
403	403_x_x_x
501	501_x_x
502	502_x_x
503	503_x_x
601	601_x
602	602_x
603	603_x
select pk,c1 from db1.tb_increment order by pk limit 1;
pk	c1
1	1
select a.pk,a.c1,b.c1 from db1.tb_normal a join db1.tb_increment b where a.pk=b.pk order by a.pk limit 2;
pk	c1	c1
1	0	1
2	0	2
show tables like 'tb_normal';
Tables_in_db1 (tb_normal)
tb_normal
show create table db1.tb_increment;
Table	Create Table
tb_increment	CREATE TABLE `tb_increment` (
  `pk` int(11) NOT NULL AUTO_INCREMENT,
  `c1` int(11) DEFAULT NULL,
  `c2` datetime(6) DEFAULT CURRENT_TIMESTAMP(6) ON UPDATE CURRENT_TIMESTAMP(6),
  PRIMARY KEY (`pk`),
  KEY `i1` (`c2`) BLOCK_SIZE 16384 GLOBAL
) AUTO_INCREMENT = 2000203 DEFAULT CHARSET = utf8mb4 ROW_FORMAT = DYNAMIC COMPRESSION = 'zstd_1.0' REPLICA_NUM = 3 BLOCK_SIZE = 16384 USE_BLOOM_FILTER = FALSE TABLET_SIZE = 134217728 PCTFREE = 10 TABLEGROUP = 'tg'
ob1.z1.mysql_p show global variables like 'sql_mode';
Variable_name	Value
sql_mode	STRICT_ALL_TABLES
ob1.z1.mysql_p show variables like 'sql_mode';
Variable_name	Value
sql_mode	STRICT_ALL_TABLES
ob1.z1.mysql_p show create table oceanbase.__all_table;
Table	Create Table
__all_table	CREATE TABLE `__all_table` (\n  `gmt_create` timestamp(6) NULL DEFAULT CURRENT_TIMESTAMP(6),\n  `gmt_modified` timestamp(6) NULL DEFAULT CURRENT_TIMESTAMP(6) ON UPDATE CURRENT_TIMESTAMP(6),\n  `tenant_id` bigint(20) NOT NULL,\n  `table_id` bigint(20) NOT NULL,\n  `table_name` varchar(256) NOT NULL DEFAULT '',\n  `database_id` bigint(20) NOT NULL,\n  `table_type` bigint(20) NOT NULL,\n  `load_type` bigint(20) NOT NULL,\n  `def_type` bigint(20) NOT NULL,\n  `rowkey_column_num` bigint(20) NOT NULL,\n  `index_column_num` bigint(20) NOT NULL,\n  `max_used_column_id` bigint(20) NOT NULL,\n  `replica_num` bigint(20) NOT NULL,\n  `autoinc_column_id` bigint(20) NOT NULL,\n  `auto_increment` bigint(20) unsigned DEFAULT '1',\n  `read_only` bigint(20) NOT NULL,\n  `rowkey_split_pos` bigint(20) NOT NULL,\n  `compress_func_name` varchar(128) NOT NULL,\n  `expire_condition` varchar(4096) NOT NULL,\n  `is_use_bloomfilter` bigint(20) NOT NULL,\n  `comment` varchar(4096) NOT NULL DEFAULT '',\n  `block_size` bigint(20) NOT NULL,\n  `collation_type` bigint(20) NOT NULL,\n  `data_table_id` bigint(20) DEFAULT NULL,\n  `index_status` bigint(20) NOT NULL,\n  `tablegroup_id` bigint(20) NOT NULL,\n  `progressive_merge_num` bigint(20) NOT NULL,\n  `index_type` bigint(20) NOT NULL,\n  `part_level` bigint(20) NOT NULL,\n  `part_func_type` bigint(20) NOT NULL,\n  `part_func_expr` varchar(4096) NOT NULL,\n  `part_num` bigint(20) NOT NULL,\n  `sub_part_func_type` bigint(20) NOT NULL,\n  `sub_part_func_expr` varchar(4096) NOT NULL,\n  `sub_part_num` bigint(20) NOT NULL,\n  `create_mem_version` bigint(20) NOT NULL,\n  `schema_version` bigint(20) NOT NULL,\n  `view_definition` varchar(65536) NOT NULL,\n  `view_check_option` bigint(20) NOT NULL,\n  `view_is_updatable` bigint(20) NOT NULL,\n  `zone_list` varchar(8192) NOT NULL,\n  `primary_zone` varchar(128) DEFAULT NULL,\n  `index_using_type` bigint(20) NOT NULL DEFAULT '0',\n  `parser_name` varchar(128) DEFAULT NULL,\n  `index_attributes_set` bigint(20) DEFAULT '0',\n  `locality` varchar(4096) NOT NULL DEFAULT '',\n  `tablet_size` bigint(20) NOT NULL DEFAULT '134217728',\n  `pctfree` bigint(20) NOT NULL DEFAULT '10',\n  `previous_locality` varchar(4096) NOT NULL DEFAULT '',\n  `max_used_part_id` bigint(20) NOT NULL DEFAULT '-1',\n  `partition_cnt_within_partition_table` bigint(20) NOT NULL DEFAULT '-1',\n  `partition_status` bigint(20) DEFAULT '0',\n  `partition_schema_version` bigint(20) DEFAULT '0',\n  `max_used_constraint_id` bigint(20) DEFAULT NULL,\n  `session_id` bigint(20) DEFAULT '0',\n  `pk_comment` varchar(4096) NOT NULL DEFAULT '',\n  `sess_active_time` bigint(20) DEFAULT '0',\n  `row_store_type` varchar(128) DEFAULT 'encoding_row_store',\n  `store_format` varchar(128) DEFAULT '',\n  `duplicate_scope` bigint(20) DEFAULT '0',\n  `binding` tinyint(4) DEFAULT '0',\n  `progressive_merge_round` bigint(20) DEFAULT '0',\n  `storage_format_version` bigint(20) DEFAULT '2',\n  `table_mode` bigint(20) NOT NULL DEFAULT '0',\n  `encryption` varchar(128) DEFAULT '',\n  `tablespace_id` bigint(20) NOT NULL DEFAULT '-1',\n  `drop_schema_version` bigint(20) NOT NULL DEFAULT '-1',\n  PRIMARY KEY (`tenant_id`, `table_id`)\n) DEFAULT CHARSET = utf8mb4 ROW_FORMAT = DYNAMIC COMPRESSION = 'none' REPLICA_NUM = 3 BLOCK_SIZE = 16384 USE_BLOOM_FILTER = FALSE TABLET_SIZE = 134217728 PCTFREE = 10 TABLEGROUP = 'oceanbase'\n partition by key (tenant_id) partitions 16\n
ob1.z2.mysql_p show global variables like 'sql_mode';
Variable_name	Value
sql_mode	STRICT_ALL_TABLES
ob1.z2.mysql_p show variables like 'sql_mode';
Variable_name	Value
sql_mode	STRICT_ALL_TABLES
ob1.z2.mysql_p show create table oceanbase.__all_table;
Table	Create Table
__all_table	CREATE TABLE `__all_table` (\n  `gmt_create` timestamp(6) NULL DEFAULT CURRENT_TIMESTAMP(6),\n  `gmt_modified` timestamp(6) NULL DEFAULT CURRENT_TIMESTAMP(6) ON UPDATE CURRENT_TIMESTAMP(6),\n  `tenant_id` bigint(20) NOT NULL,\n  `table_id` bigint(20) NOT NULL,\n  `table_name` varchar(256) NOT NULL DEFAULT '',\n  `database_id` bigint(20) NOT NULL,\n  `table_type` bigint(20) NOT NULL,\n  `load_type` bigint(20) NOT NULL,\n  `def_type` bigint(20) NOT NULL,\n  `rowkey_column_num` bigint(20) NOT NULL,\n  `index_column_num` bigint(20) NOT NULL,\n  `max_used_column_id` bigint(20) NOT NULL,\n  `replica_num` bigint(20) NOT NULL,\n  `autoinc_column_id` bigint(20) NOT NULL,\n  `auto_increment` bigint(20) unsigned DEFAULT '1',\n  `read_only` bigint(20) NOT NULL,\n  `rowkey_split_pos` bigint(20) NOT NULL,\n  `compress_func_name` varchar(128) NOT NULL,\n  `expire_condition` varchar(4096) NOT NULL,\n  `is_use_bloomfilter` bigint(20) NOT NULL,\n  `comment` varchar(4096) NOT NULL DEFAULT '',\n  `block_size` bigint(20) NOT NULL,\n  `collation_type` bigint(20) NOT NULL,\n  `data_table_id` bigint(20) DEFAULT NULL,\n  `index_status` bigint(20) NOT NULL,\n  `tablegroup_id` bigint(20) NOT NULL,\n  `progressive_merge_num` bigint(20) NOT NULL,\n  `index_type` bigint(20) NOT NULL,\n  `part_level` bigint(20) NOT NULL,\n  `part_func_type` bigint(20) NOT NULL,\n  `part_func_expr` varchar(4096) NOT NULL,\n  `part_num` bigint(20) NOT NULL,\n  `sub_part_func_type` bigint(20) NOT NULL,\n  `sub_part_func_expr` varchar(4096) NOT NULL,\n  `sub_part_num` bigint(20) NOT NULL,\n  `create_mem_version` bigint(20) NOT NULL,\n  `schema_version` bigint(20) NOT NULL,\n  `view_definition` varchar(65536) NOT NULL,\n  `view_check_option` bigint(20) NOT NULL,\n  `view_is_updatable` bigint(20) NOT NULL,\n  `zone_list` varchar(8192) NOT NULL,\n  `primary_zone` varchar(128) DEFAULT NULL,\n  `index_using_type` bigint(20) NOT NULL DEFAULT '0',\n  `parser_name` varchar(128) DEFAULT NULL,\n  `index_attributes_set` bigint(20) DEFAULT '0',\n  `locality` varchar(4096) NOT NULL DEFAULT '',\n  `tablet_size` bigint(20) NOT NULL DEFAULT '134217728',\n  `pctfree` bigint(20) NOT NULL DEFAULT '10',\n  `previous_locality` varchar(4096) NOT NULL DEFAULT '',\n  `max_used_part_id` bigint(20) NOT NULL DEFAULT '-1',\n  `partition_cnt_within_partition_table` bigint(20) NOT NULL DEFAULT '-1',\n  `partition_status` bigint(20) DEFAULT '0',\n  `partition_schema_version` bigint(20) DEFAULT '0',\n  `max_used_constraint_id` bigint(20) DEFAULT NULL,\n  `session_id` bigint(20) DEFAULT '0',\n  `pk_comment` varchar(4096) NOT NULL DEFAULT '',\n  `sess_active_time` bigint(20) DEFAULT '0',\n  `row_store_type` varchar(128) DEFAULT 'encoding_row_store',\n  `store_format` varchar(128) DEFAULT '',\n  `duplicate_scope` bigint(20) DEFAULT '0',\n  `binding` tinyint(4) DEFAULT '0',\n  `progressive_merge_round` bigint(20) DEFAULT '0',\n  `storage_format_version` bigint(20) DEFAULT '2',\n  `table_mode` bigint(20) NOT NULL DEFAULT '0',\n  `encryption` varchar(128) DEFAULT '',\n  `tablespace_id` bigint(20) NOT NULL DEFAULT '-1',\n  `drop_schema_version` bigint(20) NOT NULL DEFAULT '-1',\n  PRIMARY KEY (`tenant_id`, `table_id`)\n) DEFAULT CHARSET = utf8mb4 ROW_FORMAT = DYNAMIC COMPRESSION = 'none' REPLICA_NUM = 3 BLOCK_SIZE = 16384 USE_BLOOM_FILTER = FALSE TABLET_SIZE = 134217728 PCTFREE = 10 TABLEGROUP = 'oceanbase'\n partition by key (tenant_id) partitions 16\n
ob1.mysql alter system minor freeze tenant = all;
set autocommit=0;
insert into db1.tb_normal(pk,c1) values(701,'701'),(702,'702'),(703,'703'),(704,'704');
update db1.tb_normal set c1=concat(c1,'_x') where pk > 100;
delete from db1.tb_normal where pk=704;
update db1.tb_increment set pk=pk+1 order by pk desc limit 1;
insert into db1.tb_increment(pk,c1) values (701,701),(702,702);
replace into db1.tb_increment(pk,c1) values (701,702);
delete from db1.tb_increment where pk=702;
commit;
set autocommit=1;
use oblog_db;
set ob_org_cluster_id=1234;
replace into oblog_test values (1, 1), (2,2), (3,3);
ob1.oblog.next_dml;
[R0] BEGIN;[R0] org_cluster_id:1234;[R1] record_type:DELETE;[R1] database_name:obtest.oblog_db;[R1] table_name:oblog_test;[R1] log_event:true;[R1] column_count:2;[R1] source_category:SRC_FULL_RECORDED;[R1] source_type:SRC_OCEANBASE_1_0;[R1] has_pk:true;[R1] pk_info:(0);[R1] pks:pk;[R1] has_uk:false;[R1] uk_info:(null);[R1] uks:(null);[R1] [C1] column_name:pk;[R1] [C1] column_type:MYSQL_TYPE_LONG;[R1] [C1] column_is_rowkey:true;[R1] [C1] column_is_signed:true;[R1] [C1] column_encoding:;[R1] [C1] column_is_not_null:true;[R1] [C1] column_value_old:[1](1);[R1] [C2] column_name:c1;[R1] [C2] column_type:MYSQL_TYPE_VAR_STRING;[R1] [C2] column_is_rowkey:false;[R1] [C2] column_is_signed:true;[R1] [C2] column_encoding:utf8mb4;[R1] [C2] column_is_not_null:false;[R1] [C2] column_value_old:[1](1);$[R2] record_type:INSERT;[R2] database_name:obtest.oblog_db;[R2] table_name:oblog_test;[R2] log_event:true;[R2] column_count:2;[R2] source_category:SRC_FULL_RECORDED;[R2] source_type:SRC_OCEANBASE_1_0;[R2] has_pk:true;[R2] pk_info:(0);[R2] pks:pk;[R2] has_uk:false;[R2] uk_info:(null);[R2] uks:(null);[R2] [C1] column_name:pk;[R2] [C1] column_type:MYSQL_TYPE_LONG;[R2] [C1] column_is_rowkey:true;[R2] [C1] column_is_signed:true;[R2] [C1] column_encoding:;[R2] [C1] column_is_not_null:true;[R2] [C1] column_value_new:[1](1);[R2] [C2] column_name:c1;[R2] [C2] column_type:MYSQL_TYPE_VAR_STRING;[R2] [C2] column_is_rowkey:false;[R2] [C2] column_is_signed:true;[R2] [C2] column_encoding:utf8mb4;[R2] [C2] column_is_not_null:false;[R2] [C2] column_value_new:[1](1);$[R3] record_type:DELETE;[R3] database_name:obtest.oblog_db;[R3] table_name:oblog_test;[R3] log_event:true;[R3] column_count:2;[R3] source_category:SRC_FULL_RECORDED;[R3] source_type:SRC_OCEANBASE_1_0;[R3] has_pk:true;[R3] pk_info:(0);[R3] pks:pk;[R3] has_uk:false;[R3] uk_info:(null);[R3] uks:(null);[R3] [C1] column_name:pk;[R3] [C1] column_type:MYSQL_TYPE_LONG;[R3] [C1] column_is_rowkey:true;[R3] [C1] column_is_signed:true;[R3] [C1] column_encoding:;[R3] [C1] column_is_not_null:true;[R3] [C1] column_value_old:[2](1);[R3] [C2] column_name:c1;[R3] [C2] column_type:MYSQL_TYPE_VAR_STRING;[R3] [C2] column_is_rowkey:false;[R3] [C2] column_is_signed:true;[R3] [C2] column_encoding:utf8mb4;[R3] [C2] column_is_not_null:false;[R3] [C2] column_value_old:[2](1);$[R4] record_type:INSERT;[R4] database_name:obtest.oblog_db;[R4] table_name:oblog_test;[R4] log_event:true;[R4] column_count:2;[R4] source_category:SRC_FULL_RECORDED;[R4] source_type:SRC_OCEANBASE_1_0;[R4] has_pk:true;[R4] pk_info:(0);[R4] pks:pk;[R4] has_uk:false;[R4] uk_info:(null);[R4] uks:(null);[R4] [C1] column_name:pk;[R4] [C1] column_type:MYSQL_TYPE_LONG;[R4] [C1] column_is_rowkey:true;[R4] [C1] column_is_signed:true;[R4] [C1] column_encoding:;[R4] [C1] column_is_not_null:true;[R4] [C1] column_value_new:[2](1);[R4] [C2] column_name:c1;[R4] [C2] column_type:MYSQL_TYPE_VAR_STRING;[R4] [C2] column_is_rowkey:false;[R4] [C2] column_is_signed:true;[R4] [C2] column_encoding:utf8mb4;[R4] [C2] column_is_not_null:false;[R4] [C2] column_value_new:[2](1);$[R5] record_type:DELETE;[R5] database_name:obtest.oblog_db;[R5] table_name:oblog_test;[R5] log_event:true;[R5] column_count:2;[R5] source_category:SRC_FULL_RECORDED;[R5] source_type:SRC_OCEANBASE_1_0;[R5] has_pk:true;[R5] pk_info:(0);[R5] pks:pk;[R5] has_uk:false;[R5] uk_info:(null);[R5] uks:(null);[R5] [C1] column_name:pk;[R5] [C1] column_type:MYSQL_TYPE_LONG;[R5] [C1] column_is_rowkey:true;[R5] [C1] column_is_signed:true;[R5] [C1] column_encoding:;[R5] [C1] column_is_not_null:true;[R5] [C1] column_value_old:[3](1);[R5] [C2] column_name:c1;[R5] [C2] column_type:MYSQL_TYPE_VAR_STRING;[R5] [C2] column_is_rowkey:false;[R5] [C2] column_is_signed:true;[R5] [C2] column_encoding:utf8mb4;[R5] [C2] column_is_not_null:false;[R5] [C2] column_value_old:[3](1);$[R6] record_type:INSERT;[R6] database_name:obtest.oblog_db;[R6] table_name:oblog_test;[R6] log_event:true;[R6] column_count:2;[R6] source_category:SRC_FULL_RECORDED;[R6] source_type:SRC_OCEANBASE_1_0;[R6] has_pk:true;[R6] pk_info:(0);[R6] pks:pk;[R6] has_uk:false;[R6] uk_info:(null);[R6] uks:(null);[R6] [C1] column_name:pk;[R6] [C1] column_type:MYSQL_TYPE_LONG;[R6] [C1] column_is_rowkey:true;[R6] [C1] column_is_signed:true;[R6] [C1] column_encoding:;[R6] [C1] column_is_not_null:true;[R6] [C1] column_value_new:[3](1);[R6] [C2] column_name:c1;[R6] [C2] column_type:MYSQL_TYPE_VAR_STRING;[R6] [C2] column_is_rowkey:false;[R6] [C2] column_is_signed:true;[R6] [C2] column_encoding:utf8mb4;[R6] [C2] column_is_not_null:false;[R6] [C2] column_value_new:[3](1);$[R7] COMMIT;
ob1.check_until_timeout select count(1) from __all_virtual_core_meta_table where role=1 and zone='z1',1,120;
ob1.check_until_timeout select count(1) from __all_virtual_server_stat,3,120;
ob1.check_until_timeout SELECT CAST(COUNT(*) AS SIGNED) as cnt FROM __all_virtual_clog_stat WHERE is_in_sync = 0 and is_offline=0,0,600;
set @@session.ob_query_timeout = 60000000;
alter system stop zone 'z3';
ob1.check_until_timeout select info from __all_zone where zone='z3' and name='status',INACTIVE,20;
ob1.check_until_timeout select leader_count from __all_virtual_server_stat where zone = 'z3',0,20;
ob1.z3.check_state_in_congest upgrade;
ob1.z3.stop;
ob1.check_until_timeout select count(*) from oceanbase.__all_server where zone = 'z3' and (start_service_time<=0 and status='INACTIVE'),1,60;
ob1.z3.upgrade;
ob1.z3.nstart;
ob1.check_until_timeout select count(*) from oceanbase.__all_server where zone = 'z3' and (start_service_time<=0 or status='INACTIVE'),0,60;
ob1.check_until_timeout SELECT CAST(COUNT(*) AS SIGNED) as cnt FROM __all_virtual_clog_stat WHERE is_in_sync = 0 and is_offline=0,0,600;
ob1.mysql alter system start zone 'z3';
ob1.check_until_timeout select count(1) from __all_virtual_server_stat,3,120;
ob1.z3.check_state_in_congest active;
ob1.check_until_timeout select count(1) from __all_virtual_core_meta_table where role=1 and zone='z1',1,120;
use oblog_db;
set ob_org_cluster_id=1234;
replace into oblog_test values (1, 1), (2,2), (3,3);
ob1.oblog.next_dml;
[R0] BEGIN;[R0] org_cluster_id:1234;[R1] record_type:DELETE;[R1] database_name:obtest.oblog_db;[R1] table_name:oblog_test;[R1] log_event:true;[R1] column_count:2;[R1] source_category:SRC_FULL_RECORDED;[R1] source_type:SRC_OCEANBASE_1_0;[R1] has_pk:true;[R1] pk_info:(0);[R1] pks:pk;[R1] has_uk:false;[R1] uk_info:(null);[R1] uks:(null);[R1] [C1] column_name:pk;[R1] [C1] column_type:MYSQL_TYPE_LONG;[R1] [C1] column_is_rowkey:true;[R1] [C1] column_is_signed:true;[R1] [C1] column_encoding:;[R1] [C1] column_is_not_null:true;[R1] [C1] column_value_old:[1](1);[R1] [C2] column_name:c1;[R1] [C2] column_type:MYSQL_TYPE_VAR_STRING;[R1] [C2] column_is_rowkey:false;[R1] [C2] column_is_signed:true;[R1] [C2] column_encoding:utf8mb4;[R1] [C2] column_is_not_null:false;[R1] [C2] column_value_old:[1](1);$[R2] record_type:INSERT;[R2] database_name:obtest.oblog_db;[R2] table_name:oblog_test;[R2] log_event:true;[R2] column_count:2;[R2] source_category:SRC_FULL_RECORDED;[R2] source_type:SRC_OCEANBASE_1_0;[R2] has_pk:true;[R2] pk_info:(0);[R2] pks:pk;[R2] has_uk:false;[R2] uk_info:(null);[R2] uks:(null);[R2] [C1] column_name:pk;[R2] [C1] column_type:MYSQL_TYPE_LONG;[R2] [C1] column_is_rowkey:true;[R2] [C1] column_is_signed:true;[R2] [C1] column_encoding:;[R2] [C1] column_is_not_null:true;[R2] [C1] column_value_new:[1](1);[R2] [C2] column_name:c1;[R2] [C2] column_type:MYSQL_TYPE_VAR_STRING;[R2] [C2] column_is_rowkey:false;[R2] [C2] column_is_signed:true;[R2] [C2] column_encoding:utf8mb4;[R2] [C2] column_is_not_null:false;[R2] [C2] column_value_new:[1](1);$[R3] record_type:DELETE;[R3] database_name:obtest.oblog_db;[R3] table_name:oblog_test;[R3] log_event:true;[R3] column_count:2;[R3] source_category:SRC_FULL_RECORDED;[R3] source_type:SRC_OCEANBASE_1_0;[R3] has_pk:true;[R3] pk_info:(0);[R3] pks:pk;[R3] has_uk:false;[R3] uk_info:(null);[R3] uks:(null);[R3] [C1] column_name:pk;[R3] [C1] column_type:MYSQL_TYPE_LONG;[R3] [C1] column_is_rowkey:true;[R3] [C1] column_is_signed:true;[R3] [C1] column_encoding:;[R3] [C1] column_is_not_null:true;[R3] [C1] column_value_old:[2](1);[R3] [C2] column_name:c1;[R3] [C2] column_type:MYSQL_TYPE_VAR_STRING;[R3] [C2] column_is_rowkey:false;[R3] [C2] column_is_signed:true;[R3] [C2] column_encoding:utf8mb4;[R3] [C2] column_is_not_null:false;[R3] [C2] column_value_old:[2](1);$[R4] record_type:INSERT;[R4] database_name:obtest.oblog_db;[R4] table_name:oblog_test;[R4] log_event:true;[R4] column_count:2;[R4] source_category:SRC_FULL_RECORDED;[R4] source_type:SRC_OCEANBASE_1_0;[R4] has_pk:true;[R4] pk_info:(0);[R4] pks:pk;[R4] has_uk:false;[R4] uk_info:(null);[R4] uks:(null);[R4] [C1] column_name:pk;[R4] [C1] column_type:MYSQL_TYPE_LONG;[R4] [C1] column_is_rowkey:true;[R4] [C1] column_is_signed:true;[R4] [C1] column_encoding:;[R4] [C1] column_is_not_null:true;[R4] [C1] column_value_new:[2](1);[R4] [C2] column_name:c1;[R4] [C2] column_type:MYSQL_TYPE_VAR_STRING;[R4] [C2] column_is_rowkey:false;[R4] [C2] column_is_signed:true;[R4] [C2] column_encoding:utf8mb4;[R4] [C2] column_is_not_null:false;[R4] [C2] column_value_new:[2](1);$[R5] record_type:DELETE;[R5] database_name:obtest.oblog_db;[R5] table_name:oblog_test;[R5] log_event:true;[R5] column_count:2;[R5] source_category:SRC_FULL_RECORDED;[R5] source_type:SRC_OCEANBASE_1_0;[R5] has_pk:true;[R5] pk_info:(0);[R5] pks:pk;[R5] has_uk:false;[R5] uk_info:(null);[R5] uks:(null);[R5] [C1] column_name:pk;[R5] [C1] column_type:MYSQL_TYPE_LONG;[R5] [C1] column_is_rowkey:true;[R5] [C1] column_is_signed:true;[R5] [C1] column_encoding:;[R5] [C1] column_is_not_null:true;[R5] [C1] column_value_old:[3](1);[R5] [C2] column_name:c1;[R5] [C2] column_type:MYSQL_TYPE_VAR_STRING;[R5] [C2] column_is_rowkey:false;[R5] [C2] column_is_signed:true;[R5] [C2] column_encoding:utf8mb4;[R5] [C2] column_is_not_null:false;[R5] [C2] column_value_old:[3](1);$[R6] record_type:INSERT;[R6] database_name:obtest.oblog_db;[R6] table_name:oblog_test;[R6] log_event:true;[R6] column_count:2;[R6] source_category:SRC_FULL_RECORDED;[R6] source_type:SRC_OCEANBASE_1_0;[R6] has_pk:true;[R6] pk_info:(0);[R6] pks:pk;[R6] has_uk:false;[R6] uk_info:(null);[R6] uks:(null);[R6] [C1] column_name:pk;[R6] [C1] column_type:MYSQL_TYPE_LONG;[R6] [C1] column_is_rowkey:true;[R6] [C1] column_is_signed:true;[R6] [C1] column_encoding:;[R6] [C1] column_is_not_null:true;[R6] [C1] column_value_new:[3](1);[R6] [C2] column_name:c1;[R6] [C2] column_type:MYSQL_TYPE_VAR_STRING;[R6] [C2] column_is_rowkey:false;[R6] [C2] column_is_signed:true;[R6] [C2] column_encoding:utf8mb4;[R6] [C2] column_is_not_null:false;[R6] [C2] column_value_new:[3](1);$[R7] COMMIT;
ob1.mysql alter system minor freeze tenant = all;
set autocommit=0;
insert into db1.tb_normal(pk,c1) values(801,'801'),(802,'802'),(803,'803'),(804,'804');
update db1.tb_normal set c1=concat(c1,'_x') where pk > 100;
delete from db1.tb_normal where pk=804;
update db1.tb_increment set pk=pk+1 order by pk desc limit 1;
insert into db1.tb_increment(pk,c1) values (801,801),(802,802);
replace into db1.tb_increment(pk,c1) values (801,802);
delete from db1.tb_increment where pk=802;
commit;
set autocommit=1;
set @@session.ob_query_timeout = 60000000;
alter system upgrade virtual schema;
ob1.upgrade_commond_for_server post;
ob1.mysql alter system end upgrade;
ob1.mysql alter system run job 'root_inspection';
ob1.upgrade_check_after;
desc oceanbase.__all_sequence_v2;
Field	Type	Null	Key	Default	Extra
gmt_create	timestamp(6)	YES		CURRENT_TIMESTAMP(6)	
gmt_modified	timestamp(6)	YES		CURRENT_TIMESTAMP(6)	ON UPDATE CURRENT_TIMESTAMP
sequence_key	bigint(20)	NO	PRI	NULL	
column_id	bigint(20)	NO	PRI	NULL	
tenant_id	bigint(20)	NO		NULL	
sequence_name	varchar(128)	YES		NULL	
sequence_value	bigint(20) unsigned	YES		NULL	
sync_value	bigint(20) unsigned	NO		NULL	
desc oceanbase.__all_tenant_meta_table;
Field	Type	Null	Key	Default	Extra
gmt_create	timestamp(6)	YES		CURRENT_TIMESTAMP(6)	
gmt_modified	timestamp(6)	YES		CURRENT_TIMESTAMP(6)	ON UPDATE CURRENT_TIMESTAMP
tenant_id	bigint(20)	NO	PRI	NULL	
table_id	bigint(20)	NO	PRI	NULL	
partition_id	bigint(20)	NO	PRI	NULL	
svr_ip	varchar(32)	NO	PRI	NULL	
svr_port	bigint(20)	NO	PRI	NULL	
sql_port	bigint(20)	NO		NULL	
unit_id	bigint(20)	NO		NULL	
partition_cnt	bigint(20)	NO		NULL	
zone	varchar(128)	NO		NULL	
role	bigint(20)	NO		NULL	
member_list	varchar(3520)	NO		NULL	
row_count	bigint(20)	NO		NULL	
data_size	bigint(20)	NO		NULL	
data_version	bigint(20)	NO		NULL	
data_checksum	bigint(20)	NO		NULL	
row_checksum	bigint(20)	NO		NULL	
column_checksum	varchar(8192)	NO		NULL	
is_original_leader	bigint(20)	NO		0	
is_previous_leader	bigint(20)	NO		0	
create_time	bigint(20)	NO		NULL	
rebuild	bigint(20)	NO		0	
replica_type	bigint(20)	NO		0	
required_size	bigint(20)	NO		0	
status	varchar(64)	NO		REPLICA_STATUS_NORMAL	
is_restore	bigint(20)	NO		0	
partition_checksum	bigint(20)	NO		0	
quorum	bigint(20)	NO		-1	
fail_list	varchar(1024)	NO			
recovery_timestamp	bigint(20)	NO		0	
memstore_percent	bigint(20)	NO		100	
desc oceanbase.__all_tenant_gc_partition_info;
Field	Type	Null	Key	Default	Extra
gmt_create	timestamp(6)	YES		CURRENT_TIMESTAMP(6)	
gmt_modified	timestamp(6)	YES		CURRENT_TIMESTAMP(6)	ON UPDATE CURRENT_TIMESTAMP
tenant_id	bigint(20)	NO	PRI	NULL	
table_id	bigint(20)	NO	PRI	NULL	
partition_id	bigint(20)	NO	PRI	NULL	
select count(*)>0 from oceanbase.__all_sequence_v2;
count(*)>0
1
select count(*)>0 from oceanbase.__all_tenant_meta_table;
count(*)>0
1
select count(*)>0 from oceanbase.__all_tenant_gc_partition_info;
count(*)>0
1
ob1.mysql_p select 1 from oceanbase.__all_virtual_table_history where is_deleted = 1 and data_table_id = (select distinct table_id from oceanbase.__all_virtual_table_history where table_name = 'tb_table_drop');
1
1
select pk1,pk2,gen_c1,gen_c2 from test.tb_table_gencol order by pk1,pk2 limit 10;
pk1	pk2	gen_c1	gen_c2
1	1	AAAAAAAAAA	BBBBBBBBBB
2	2	AAAAAAAAAA	BBBBBBBBBB
3	3	AAAAAAAAAA	BBBBBBBBBB
4	4	AAAAAAAAAA	BBBBBBBBBB
5	5	AAAAAAAAAA	BBBBBBBBBB
6	6	AAAAAAAAAA	BBBBBBBBBB
7	7	AAAAAAAAAA	BBBBBBBBBB
8	8	AAAAAAAAAA	BBBBBBBBBB
9	9	AAAAAAAAAA	BBBBBBBBBB
10	10	AAAAAAAAAA	BBBBBBBBBB
select * from test.table_hash where c1 = 1;
c1	c2
1	1
select * from test.table_range where c1 = 1;
c1	c2
1	1
select * from test.table_hash_range where c1 = 1;
c1	c2
1	1
select * from test.table_range_hash where c1 = 1;
c1	c2
1	1
show index from test.tb_table_fulltext;
Table	Non_unique	Key_name	Seq_in_index	Column_name	Collation	Cardinality	Sub_part	Packed	Null	Index_type	Comment	Index_comment	Visible
tb_table_fulltext	1	body	1	body	A	NULL	NULL	NULL	YES	FULLTEXT	available		YES
show create table test.tb_table_fulltext;
Table	Create Table
tb_table_fulltext	CREATE TABLE `tb_table_fulltext` (
  `id` int(11) DEFAULT NULL,
  `body` varchar(10) DEFAULT NULL, 
 FULLTEXT KEY `body` (`body`) CTXCAT(`body`) WITH PARSER 'TAOBAO_CHN' BLOCK_SIZE 16384
) DEFAULT CHARSET = utf8mb4 ROW_FORMAT = DYNAMIC COMPRESSION = 'zstd_1.0' REPLICA_NUM = 3 BLOCK_SIZE = 16384 USE_BLOOM_FILTER = FALSE TABLET_SIZE = 134217728 PCTFREE = 10
show create table test.tablegencol;
Table	Create Table
tablegencol	CREATE TABLE `tablegencol` (
  `c1` bigint(20) NOT NULL,
  `user_id` varchar(32) NOT NULL DEFAULT '' COMMENT 'Alipay User ID',
  `address` varchar(256) NOT NULL DEFAULT '' COMMENT 'address',
  PRIMARY KEY (`c1`),
  KEY `user_id` (`user_id`, `address`(255)) BLOCK_SIZE 16384 GLOBAL
) DEFAULT CHARSET = utf8mb4 ROW_FORMAT = DYNAMIC COMPRESSION = 'zstd_1.0' REPLICA_NUM = 3 BLOCK_SIZE = 16384 USE_BLOOM_FILTER = FALSE TABLET_SIZE = 134217728 PCTFREE = 10
create tablegroup tg_new partition by hash partitions 2;
alter table test.table_with_tg set tablegroup = "";
alter table test.table_with_tg set tablegroup = "tg_new";
ob1.check_until_timeout select count(1) from oceanbase.__all_virtual_table where table_name = "table_with_tg" and tablegroup_id = "$tablegroup_id", 1, 5;
select * from test.tb_simple;
pk	val
1	11
2	12
3	13
4	14
5	15
6	16
ob1.check_until_timeout SELECT CAST(COUNT(*) AS SIGNED) as cnt FROM __all_virtual_clog_stat WHERE is_in_sync = 0 and is_offline=0,0,600;
ob1.mysql alter system major freeze;
ob1.check_version 3;
ob1.check_until_timeout select info from __all_zone where zone='' and name='merge_status',IDLE,30;
set autocommit=0;
insert into db1.tb_normal(pk,c1) values(901,'901'),(902,'902'),(903,'903'),(904,'904');
update db1.tb_normal set c1=concat(c1,'_x') where pk > 100;
delete from db1.tb_normal where pk=904;
update db1.tb_increment set pk=pk+1 order by pk desc limit 1;
insert into db1.tb_increment(pk,c1) values (901,901),(902,902);
replace into db1.tb_increment(pk,c1) values (901,902);
delete from db1.tb_increment where pk=902;
commit;
set autocommit=1;
create temporary table test.tb_temp(c1 int, c2 int, c3 int);
show create table test.tb_temp;
Table	Create Table
tb_temp	CREATE TEMPORARY TABLE `tb_temp` (
  `c1` int(11) DEFAULT NULL,
  `c2` int(11) DEFAULT NULL,
  `c3` int(11) DEFAULT NULL
) DEFAULT CHARSET = utf8mb4 ROW_FORMAT = DYNAMIC COMPRESSION = 'zstd_1.0' REPLICA_NUM = 3 BLOCK_SIZE = 16384 USE_BLOOM_FILTER = FALSE TABLET_SIZE = 134217728 PCTFREE = 10
ob1.force_stop;
ob1.nstart;
ob1.check_until_timeout select count(1) from __all_virtual_core_meta_table where role=1 and zone='z1',1,600;
ob1.check_until_timeout SELECT CAST(COUNT(*) AS SIGNED) as cnt FROM __all_virtual_clog_stat WHERE is_in_sync = 0 and is_offline=0,0,600;
ob1.mysql alter system major freeze;
ob1.check_version 4;
use oblog_db;
ob1.oblog.exist;
set ob_org_cluster_id=1234;
replace into oblog_test values (1, 1), (2,2), (3,3);
ob1.oblog.next_dml;
[R0] BEGIN;[R0] org_cluster_id:1234;[R1] record_type:DELETE;[R1] database_name:obtest.oblog_db;[R1] table_name:oblog_test;[R1] log_event:true;[R1] column_count:2;[R1] source_category:SRC_FULL_RECORDED;[R1] source_type:SRC_OCEANBASE_1_0;[R1] has_pk:true;[R1] pk_info:(0);[R1] pks:pk;[R1] has_uk:false;[R1] uk_info:(null);[R1] uks:(null);[R1] [C1] column_name:pk;[R1] [C1] column_type:MYSQL_TYPE_LONG;[R1] [C1] column_is_rowkey:true;[R1] [C1] column_is_signed:true;[R1] [C1] column_encoding:;[R1] [C1] column_is_not_null:true;[R1] [C1] column_value_old:[1](1);[R1] [C2] column_name:c1;[R1] [C2] column_type:MYSQL_TYPE_VAR_STRING;[R1] [C2] column_is_rowkey:false;[R1] [C2] column_is_signed:true;[R1] [C2] column_encoding:utf8mb4;[R1] [C2] column_is_not_null:false;[R1] [C2] column_value_old:[1](1);$[R2] record_type:INSERT;[R2] database_name:obtest.oblog_db;[R2] table_name:oblog_test;[R2] log_event:true;[R2] column_count:2;[R2] source_category:SRC_FULL_RECORDED;[R2] source_type:SRC_OCEANBASE_1_0;[R2] has_pk:true;[R2] pk_info:(0);[R2] pks:pk;[R2] has_uk:false;[R2] uk_info:(null);[R2] uks:(null);[R2] [C1] column_name:pk;[R2] [C1] column_type:MYSQL_TYPE_LONG;[R2] [C1] column_is_rowkey:true;[R2] [C1] column_is_signed:true;[R2] [C1] column_encoding:;[R2] [C1] column_is_not_null:true;[R2] [C1] column_value_new:[1](1);[R2] [C2] column_name:c1;[R2] [C2] column_type:MYSQL_TYPE_VAR_STRING;[R2] [C2] column_is_rowkey:false;[R2] [C2] column_is_signed:true;[R2] [C2] column_encoding:utf8mb4;[R2] [C2] column_is_not_null:false;[R2] [C2] column_value_new:[1](1);$[R3] record_type:DELETE;[R3] database_name:obtest.oblog_db;[R3] table_name:oblog_test;[R3] log_event:true;[R3] column_count:2;[R3] source_category:SRC_FULL_RECORDED;[R3] source_type:SRC_OCEANBASE_1_0;[R3] has_pk:true;[R3] pk_info:(0);[R3] pks:pk;[R3] has_uk:false;[R3] uk_info:(null);[R3] uks:(null);[R3] [C1] column_name:pk;[R3] [C1] column_type:MYSQL_TYPE_LONG;[R3] [C1] column_is_rowkey:true;[R3] [C1] column_is_signed:true;[R3] [C1] column_encoding:;[R3] [C1] column_is_not_null:true;[R3] [C1] column_value_old:[2](1);[R3] [C2] column_name:c1;[R3] [C2] column_type:MYSQL_TYPE_VAR_STRING;[R3] [C2] column_is_rowkey:false;[R3] [C2] column_is_signed:true;[R3] [C2] column_encoding:utf8mb4;[R3] [C2] column_is_not_null:false;[R3] [C2] column_value_old:[2](1);$[R4] record_type:INSERT;[R4] database_name:obtest.oblog_db;[R4] table_name:oblog_test;[R4] log_event:true;[R4] column_count:2;[R4] source_category:SRC_FULL_RECORDED;[R4] source_type:SRC_OCEANBASE_1_0;[R4] has_pk:true;[R4] pk_info:(0);[R4] pks:pk;[R4] has_uk:false;[R4] uk_info:(null);[R4] uks:(null);[R4] [C1] column_name:pk;[R4] [C1] column_type:MYSQL_TYPE_LONG;[R4] [C1] column_is_rowkey:true;[R4] [C1] column_is_signed:true;[R4] [C1] column_encoding:;[R4] [C1] column_is_not_null:true;[R4] [C1] column_value_new:[2](1);[R4] [C2] column_name:c1;[R4] [C2] column_type:MYSQL_TYPE_VAR_STRING;[R4] [C2] column_is_rowkey:false;[R4] [C2] column_is_signed:true;[R4] [C2] column_encoding:utf8mb4;[R4] [C2] column_is_not_null:false;[R4] [C2] column_value_new:[2](1);$[R5] record_type:DELETE;[R5] database_name:obtest.oblog_db;[R5] table_name:oblog_test;[R5] log_event:true;[R5] column_count:2;[R5] source_category:SRC_FULL_RECORDED;[R5] source_type:SRC_OCEANBASE_1_0;[R5] has_pk:true;[R5] pk_info:(0);[R5] pks:pk;[R5] has_uk:false;[R5] uk_info:(null);[R5] uks:(null);[R5] [C1] column_name:pk;[R5] [C1] column_type:MYSQL_TYPE_LONG;[R5] [C1] column_is_rowkey:true;[R5] [C1] column_is_signed:true;[R5] [C1] column_encoding:;[R5] [C1] column_is_not_null:true;[R5] [C1] column_value_old:[3](1);[R5] [C2] column_name:c1;[R5] [C2] column_type:MYSQL_TYPE_VAR_STRING;[R5] [C2] column_is_rowkey:false;[R5] [C2] column_is_signed:true;[R5] [C2] column_encoding:utf8mb4;[R5] [C2] column_is_not_null:false;[R5] [C2] column_value_old:[3](1);$[R6] record_type:INSERT;[R6] database_name:obtest.oblog_db;[R6] table_name:oblog_test;[R6] log_event:true;[R6] column_count:2;[R6] source_category:SRC_FULL_RECORDED;[R6] source_type:SRC_OCEANBASE_1_0;[R6] has_pk:true;[R6] pk_info:(0);[R6] pks:pk;[R6] has_uk:false;[R6] uk_info:(null);[R6] uks:(null);[R6] [C1] column_name:pk;[R6] [C1] column_type:MYSQL_TYPE_LONG;[R6] [C1] column_is_rowkey:true;[R6] [C1] column_is_signed:true;[R6] [C1] column_encoding:;[R6] [C1] column_is_not_null:true;[R6] [C1] column_value_new:[3](1);[R6] [C2] column_name:c1;[R6] [C2] column_type:MYSQL_TYPE_VAR_STRING;[R6] [C2] column_is_rowkey:false;[R6] [C2] column_is_signed:true;[R6] [C2] column_encoding:utf8mb4;[R6] [C2] column_is_not_null:false;[R6] [C2] column_value_new:[3](1);$[R7] COMMIT;
ob1.oblog.stop;
ob1.oblog.set_start_tstamp $start_tstamp_before_upgrade;
ob1.oblog.restart;
ob1.oblog.next_dml;
[R0] BEGIN;[R0] org_cluster_id:1234;[R1] record_type:INSERT;[R1] database_name:obtest.oblog_db;[R1] table_name:oblog_test;[R1] log_event:true;[R1] column_count:2;[R1] source_category:SRC_FULL_RECORDED;[R1] source_type:SRC_OCEANBASE_1_0;[R1] has_pk:true;[R1] pk_info:(0);[R1] pks:pk;[R1] has_uk:false;[R1] uk_info:(null);[R1] uks:(null);[R1] [C1] column_name:pk;[R1] [C1] column_type:MYSQL_TYPE_LONG;[R1] [C1] column_is_rowkey:true;[R1] [C1] column_is_signed:true;[R1] [C1] column_encoding:;[R1] [C1] column_is_not_null:true;[R1] [C1] column_value_new:[1](1);[R1] [C2] column_name:c1;[R1] [C2] column_type:MYSQL_TYPE_VAR_STRING;[R1] [C2] column_is_rowkey:false;[R1] [C2] column_is_signed:true;[R1] [C2] column_encoding:utf8mb4;[R1] [C2] column_is_not_null:false;[R1] [C2] column_value_new:[1](1);$[R2] record_type:INSERT;[R2] database_name:obtest.oblog_db;[R2] table_name:oblog_test;[R2] log_event:true;[R2] column_count:2;[R2] source_category:SRC_FULL_RECORDED;[R2] source_type:SRC_OCEANBASE_1_0;[R2] has_pk:true;[R2] pk_info:(0);[R2] pks:pk;[R2] has_uk:false;[R2] uk_info:(null);[R2] uks:(null);[R2] [C1] column_name:pk;[R2] [C1] column_type:MYSQL_TYPE_LONG;[R2] [C1] column_is_rowkey:true;[R2] [C1] column_is_signed:true;[R2] [C1] column_encoding:;[R2] [C1] column_is_not_null:true;[R2] [C1] column_value_new:[2](1);[R2] [C2] column_name:c1;[R2] [C2] column_type:MYSQL_TYPE_VAR_STRING;[R2] [C2] column_is_rowkey:false;[R2] [C2] column_is_signed:true;[R2] [C2] column_encoding:utf8mb4;[R2] [C2] column_is_not_null:false;[R2] [C2] column_value_new:[2](1);$[R3] record_type:INSERT;[R3] database_name:obtest.oblog_db;[R3] table_name:oblog_test;[R3] log_event:true;[R3] column_count:2;[R3] source_category:SRC_FULL_RECORDED;[R3] source_type:SRC_OCEANBASE_1_0;[R3] has_pk:true;[R3] pk_info:(0);[R3] pks:pk;[R3] has_uk:false;[R3] uk_info:(null);[R3] uks:(null);[R3] [C1] column_name:pk;[R3] [C1] column_type:MYSQL_TYPE_LONG;[R3] [C1] column_is_rowkey:true;[R3] [C1] column_is_signed:true;[R3] [C1] column_encoding:;[R3] [C1] column_is_not_null:true;[R3] [C1] column_value_new:[3](1);[R3] [C2] column_name:c1;[R3] [C2] column_type:MYSQL_TYPE_VAR_STRING;[R3] [C2] column_is_rowkey:false;[R3] [C2] column_is_signed:true;[R3] [C2] column_encoding:utf8mb4;[R3] [C2] column_is_not_null:false;[R3] [C2] column_value_new:[3](1);$[R4] COMMIT;
ob1.oblog.next_dml;
[R0] BEGIN;[R0] org_cluster_id:1234;[R1] record_type:DELETE;[R1] database_name:obtest.oblog_db;[R1] table_name:oblog_test;[R1] log_event:true;[R1] column_count:2;[R1] source_category:SRC_FULL_RECORDED;[R1] source_type:SRC_OCEANBASE_1_0;[R1] has_pk:true;[R1] pk_info:(0);[R1] pks:pk;[R1] has_uk:false;[R1] uk_info:(null);[R1] uks:(null);[R1] [C1] column_name:pk;[R1] [C1] column_type:MYSQL_TYPE_LONG;[R1] [C1] column_is_rowkey:true;[R1] [C1] column_is_signed:true;[R1] [C1] column_encoding:;[R1] [C1] column_is_not_null:true;[R1] [C1] column_value_old:[1](1);[R1] [C2] column_name:c1;[R1] [C2] column_type:MYSQL_TYPE_VAR_STRING;[R1] [C2] column_is_rowkey:false;[R1] [C2] column_is_signed:true;[R1] [C2] column_encoding:utf8mb4;[R1] [C2] column_is_not_null:false;[R1] [C2] column_value_old:[1](1);$[R2] record_type:INSERT;[R2] database_name:obtest.oblog_db;[R2] table_name:oblog_test;[R2] log_event:true;[R2] column_count:2;[R2] source_category:SRC_FULL_RECORDED;[R2] source_type:SRC_OCEANBASE_1_0;[R2] has_pk:true;[R2] pk_info:(0);[R2] pks:pk;[R2] has_uk:false;[R2] uk_info:(null);[R2] uks:(null);[R2] [C1] column_name:pk;[R2] [C1] column_type:MYSQL_TYPE_LONG;[R2] [C1] column_is_rowkey:true;[R2] [C1] column_is_signed:true;[R2] [C1] column_encoding:;[R2] [C1] column_is_not_null:true;[R2] [C1] column_value_new:[1](1);[R2] [C2] column_name:c1;[R2] [C2] column_type:MYSQL_TYPE_VAR_STRING;[R2] [C2] column_is_rowkey:false;[R2] [C2] column_is_signed:true;[R2] [C2] column_encoding:utf8mb4;[R2] [C2] column_is_not_null:false;[R2] [C2] column_value_new:[1](1);$[R3] record_type:DELETE;[R3] database_name:obtest.oblog_db;[R3] table_name:oblog_test;[R3] log_event:true;[R3] column_count:2;[R3] source_category:SRC_FULL_RECORDED;[R3] source_type:SRC_OCEANBASE_1_0;[R3] has_pk:true;[R3] pk_info:(0);[R3] pks:pk;[R3] has_uk:false;[R3] uk_info:(null);[R3] uks:(null);[R3] [C1] column_name:pk;[R3] [C1] column_type:MYSQL_TYPE_LONG;[R3] [C1] column_is_rowkey:true;[R3] [C1] column_is_signed:true;[R3] [C1] column_encoding:;[R3] [C1] column_is_not_null:true;[R3] [C1] column_value_old:[2](1);[R3] [C2] column_name:c1;[R3] [C2] column_type:MYSQL_TYPE_VAR_STRING;[R3] [C2] column_is_rowkey:false;[R3] [C2] column_is_signed:true;[R3] [C2] column_encoding:utf8mb4;[R3] [C2] column_is_not_null:false;[R3] [C2] column_value_old:[2](1);$[R4] record_type:INSERT;[R4] database_name:obtest.oblog_db;[R4] table_name:oblog_test;[R4] log_event:true;[R4] column_count:2;[R4] source_category:SRC_FULL_RECORDED;[R4] source_type:SRC_OCEANBASE_1_0;[R4] has_pk:true;[R4] pk_info:(0);[R4] pks:pk;[R4] has_uk:false;[R4] uk_info:(null);[R4] uks:(null);[R4] [C1] column_name:pk;[R4] [C1] column_type:MYSQL_TYPE_LONG;[R4] [C1] column_is_rowkey:true;[R4] [C1] column_is_signed:true;[R4] [C1] column_encoding:;[R4] [C1] column_is_not_null:true;[R4] [C1] column_value_new:[2](1);[R4] [C2] column_name:c1;[R4] [C2] column_type:MYSQL_TYPE_VAR_STRING;[R4] [C2] column_is_rowkey:false;[R4] [C2] column_is_signed:true;[R4] [C2] column_encoding:utf8mb4;[R4] [C2] column_is_not_null:false;[R4] [C2] column_value_new:[2](1);$[R5] record_type:DELETE;[R5] database_name:obtest.oblog_db;[R5] table_name:oblog_test;[R5] log_event:true;[R5] column_count:2;[R5] source_category:SRC_FULL_RECORDED;[R5] source_type:SRC_OCEANBASE_1_0;[R5] has_pk:true;[R5] pk_info:(0);[R5] pks:pk;[R5] has_uk:false;[R5] uk_info:(null);[R5] uks:(null);[R5] [C1] column_name:pk;[R5] [C1] column_type:MYSQL_TYPE_LONG;[R5] [C1] column_is_rowkey:true;[R5] [C1] column_is_signed:true;[R5] [C1] column_encoding:;[R5] [C1] column_is_not_null:true;[R5] [C1] column_value_old:[3](1);[R5] [C2] column_name:c1;[R5] [C2] column_type:MYSQL_TYPE_VAR_STRING;[R5] [C2] column_is_rowkey:false;[R5] [C2] column_is_signed:true;[R5] [C2] column_encoding:utf8mb4;[R5] [C2] column_is_not_null:false;[R5] [C2] column_value_old:[3](1);$[R6] record_type:INSERT;[R6] database_name:obtest.oblog_db;[R6] table_name:oblog_test;[R6] log_event:true;[R6] column_count:2;[R6] source_category:SRC_FULL_RECORDED;[R6] source_type:SRC_OCEANBASE_1_0;[R6] has_pk:true;[R6] pk_info:(0);[R6] pks:pk;[R6] has_uk:false;[R6] uk_info:(null);[R6] uks:(null);[R6] [C1] column_name:pk;[R6] [C1] column_type:MYSQL_TYPE_LONG;[R6] [C1] column_is_rowkey:true;[R6] [C1] column_is_signed:true;[R6] [C1] column_encoding:;[R6] [C1] column_is_not_null:true;[R6] [C1] column_value_new:[3](1);[R6] [C2] column_name:c1;[R6] [C2] column_type:MYSQL_TYPE_VAR_STRING;[R6] [C2] column_is_rowkey:false;[R6] [C2] column_is_signed:true;[R6] [C2] column_encoding:utf8mb4;[R6] [C2] column_is_not_null:false;[R6] [C2] column_value_new:[3](1);$[R7] COMMIT;
ob1.oblog.next_dml;
[R0] BEGIN;[R0] org_cluster_id:1234;[R1] record_type:DELETE;[R1] database_name:obtest.oblog_db;[R1] table_name:oblog_test;[R1] log_event:true;[R1] column_count:2;[R1] source_category:SRC_FULL_RECORDED;[R1] source_type:SRC_OCEANBASE_1_0;[R1] has_pk:true;[R1] pk_info:(0);[R1] pks:pk;[R1] has_uk:false;[R1] uk_info:(null);[R1] uks:(null);[R1] [C1] column_name:pk;[R1] [C1] column_type:MYSQL_TYPE_LONG;[R1] [C1] column_is_rowkey:true;[R1] [C1] column_is_signed:true;[R1] [C1] column_encoding:;[R1] [C1] column_is_not_null:true;[R1] [C1] column_value_old:[1](1);[R1] [C2] column_name:c1;[R1] [C2] column_type:MYSQL_TYPE_VAR_STRING;[R1] [C2] column_is_rowkey:false;[R1] [C2] column_is_signed:true;[R1] [C2] column_encoding:utf8mb4;[R1] [C2] column_is_not_null:false;[R1] [C2] column_value_old:[1](1);$[R2] record_type:INSERT;[R2] database_name:obtest.oblog_db;[R2] table_name:oblog_test;[R2] log_event:true;[R2] column_count:2;[R2] source_category:SRC_FULL_RECORDED;[R2] source_type:SRC_OCEANBASE_1_0;[R2] has_pk:true;[R2] pk_info:(0);[R2] pks:pk;[R2] has_uk:false;[R2] uk_info:(null);[R2] uks:(null);[R2] [C1] column_name:pk;[R2] [C1] column_type:MYSQL_TYPE_LONG;[R2] [C1] column_is_rowkey:true;[R2] [C1] column_is_signed:true;[R2] [C1] column_encoding:;[R2] [C1] column_is_not_null:true;[R2] [C1] column_value_new:[1](1);[R2] [C2] column_name:c1;[R2] [C2] column_type:MYSQL_TYPE_VAR_STRING;[R2] [C2] column_is_rowkey:false;[R2] [C2] column_is_signed:true;[R2] [C2] column_encoding:utf8mb4;[R2] [C2] column_is_not_null:false;[R2] [C2] column_value_new:[1](1);$[R3] record_type:DELETE;[R3] database_name:obtest.oblog_db;[R3] table_name:oblog_test;[R3] log_event:true;[R3] column_count:2;[R3] source_category:SRC_FULL_RECORDED;[R3] source_type:SRC_OCEANBASE_1_0;[R3] has_pk:true;[R3] pk_info:(0);[R3] pks:pk;[R3] has_uk:false;[R3] uk_info:(null);[R3] uks:(null);[R3] [C1] column_name:pk;[R3] [C1] column_type:MYSQL_TYPE_LONG;[R3] [C1] column_is_rowkey:true;[R3] [C1] column_is_signed:true;[R3] [C1] column_encoding:;[R3] [C1] column_is_not_null:true;[R3] [C1] column_value_old:[2](1);[R3] [C2] column_name:c1;[R3] [C2] column_type:MYSQL_TYPE_VAR_STRING;[R3] [C2] column_is_rowkey:false;[R3] [C2] column_is_signed:true;[R3] [C2] column_encoding:utf8mb4;[R3] [C2] column_is_not_null:false;[R3] [C2] column_value_old:[2](1);$[R4] record_type:INSERT;[R4] database_name:obtest.oblog_db;[R4] table_name:oblog_test;[R4] log_event:true;[R4] column_count:2;[R4] source_category:SRC_FULL_RECORDED;[R4] source_type:SRC_OCEANBASE_1_0;[R4] has_pk:true;[R4] pk_info:(0);[R4] pks:pk;[R4] has_uk:false;[R4] uk_info:(null);[R4] uks:(null);[R4] [C1] column_name:pk;[R4] [C1] column_type:MYSQL_TYPE_LONG;[R4] [C1] column_is_rowkey:true;[R4] [C1] column_is_signed:true;[R4] [C1] column_encoding:;[R4] [C1] column_is_not_null:true;[R4] [C1] column_value_new:[2](1);[R4] [C2] column_name:c1;[R4] [C2] column_type:MYSQL_TYPE_VAR_STRING;[R4] [C2] column_is_rowkey:false;[R4] [C2] column_is_signed:true;[R4] [C2] column_encoding:utf8mb4;[R4] [C2] column_is_not_null:false;[R4] [C2] column_value_new:[2](1);$[R5] record_type:DELETE;[R5] database_name:obtest.oblog_db;[R5] table_name:oblog_test;[R5] log_event:true;[R5] column_count:2;[R5] source_category:SRC_FULL_RECORDED;[R5] source_type:SRC_OCEANBASE_1_0;[R5] has_pk:true;[R5] pk_info:(0);[R5] pks:pk;[R5] has_uk:false;[R5] uk_info:(null);[R5] uks:(null);[R5] [C1] column_name:pk;[R5] [C1] column_type:MYSQL_TYPE_LONG;[R5] [C1] column_is_rowkey:true;[R5] [C1] column_is_signed:true;[R5] [C1] column_encoding:;[R5] [C1] column_is_not_null:true;[R5] [C1] column_value_old:[3](1);[R5] [C2] column_name:c1;[R5] [C2] column_type:MYSQL_TYPE_VAR_STRING;[R5] [C2] column_is_rowkey:false;[R5] [C2] column_is_signed:true;[R5] [C2] column_encoding:utf8mb4;[R5] [C2] column_is_not_null:false;[R5] [C2] column_value_old:[3](1);$[R6] record_type:INSERT;[R6] database_name:obtest.oblog_db;[R6] table_name:oblog_test;[R6] log_event:true;[R6] column_count:2;[R6] source_category:SRC_FULL_RECORDED;[R6] source_type:SRC_OCEANBASE_1_0;[R6] has_pk:true;[R6] pk_info:(0);[R6] pks:pk;[R6] has_uk:false;[R6] uk_info:(null);[R6] uks:(null);[R6] [C1] column_name:pk;[R6] [C1] column_type:MYSQL_TYPE_LONG;[R6] [C1] column_is_rowkey:true;[R6] [C1] column_is_signed:true;[R6] [C1] column_encoding:;[R6] [C1] column_is_not_null:true;[R6] [C1] column_value_new:[3](1);[R6] [C2] column_name:c1;[R6] [C2] column_type:MYSQL_TYPE_VAR_STRING;[R6] [C2] column_is_rowkey:false;[R6] [C2] column_is_signed:true;[R6] [C2] column_encoding:utf8mb4;[R6] [C2] column_is_not_null:false;[R6] [C2] column_value_new:[3](1);$[R7] COMMIT;
ob1.oblog.next_dml;
[R0] BEGIN;[R0] org_cluster_id:1234;[R1] record_type:DELETE;[R1] database_name:obtest.oblog_db;[R1] table_name:oblog_test;[R1] log_event:true;[R1] column_count:2;[R1] source_category:SRC_FULL_RECORDED;[R1] source_type:SRC_OCEANBASE_1_0;[R1] has_pk:true;[R1] pk_info:(0);[R1] pks:pk;[R1] has_uk:false;[R1] uk_info:(null);[R1] uks:(null);[R1] [C1] column_name:pk;[R1] [C1] column_type:MYSQL_TYPE_LONG;[R1] [C1] column_is_rowkey:true;[R1] [C1] column_is_signed:true;[R1] [C1] column_encoding:;[R1] [C1] column_is_not_null:true;[R1] [C1] column_value_old:[1](1);[R1] [C2] column_name:c1;[R1] [C2] column_type:MYSQL_TYPE_VAR_STRING;[R1] [C2] column_is_rowkey:false;[R1] [C2] column_is_signed:true;[R1] [C2] column_encoding:utf8mb4;[R1] [C2] column_is_not_null:false;[R1] [C2] column_value_old:[1](1);$[R2] record_type:INSERT;[R2] database_name:obtest.oblog_db;[R2] table_name:oblog_test;[R2] log_event:true;[R2] column_count:2;[R2] source_category:SRC_FULL_RECORDED;[R2] source_type:SRC_OCEANBASE_1_0;[R2] has_pk:true;[R2] pk_info:(0);[R2] pks:pk;[R2] has_uk:false;[R2] uk_info:(null);[R2] uks:(null);[R2] [C1] column_name:pk;[R2] [C1] column_type:MYSQL_TYPE_LONG;[R2] [C1] column_is_rowkey:true;[R2] [C1] column_is_signed:true;[R2] [C1] column_encoding:;[R2] [C1] column_is_not_null:true;[R2] [C1] column_value_new:[1](1);[R2] [C2] column_name:c1;[R2] [C2] column_type:MYSQL_TYPE_VAR_STRING;[R2] [C2] column_is_rowkey:false;[R2] [C2] column_is_signed:true;[R2] [C2] column_encoding:utf8mb4;[R2] [C2] column_is_not_null:false;[R2] [C2] column_value_new:[1](1);$[R3] record_type:DELETE;[R3] database_name:obtest.oblog_db;[R3] table_name:oblog_test;[R3] log_event:true;[R3] column_count:2;[R3] source_category:SRC_FULL_RECORDED;[R3] source_type:SRC_OCEANBASE_1_0;[R3] has_pk:true;[R3] pk_info:(0);[R3] pks:pk;[R3] has_uk:false;[R3] uk_info:(null);[R3] uks:(null);[R3] [C1] column_name:pk;[R3] [C1] column_type:MYSQL_TYPE_LONG;[R3] [C1] column_is_rowkey:true;[R3] [C1] column_is_signed:true;[R3] [C1] column_encoding:;[R3] [C1] column_is_not_null:true;[R3] [C1] column_value_old:[2](1);[R3] [C2] column_name:c1;[R3] [C2] column_type:MYSQL_TYPE_VAR_STRING;[R3] [C2] column_is_rowkey:false;[R3] [C2] column_is_signed:true;[R3] [C2] column_encoding:utf8mb4;[R3] [C2] column_is_not_null:false;[R3] [C2] column_value_old:[2](1);$[R4] record_type:INSERT;[R4] database_name:obtest.oblog_db;[R4] table_name:oblog_test;[R4] log_event:true;[R4] column_count:2;[R4] source_category:SRC_FULL_RECORDED;[R4] source_type:SRC_OCEANBASE_1_0;[R4] has_pk:true;[R4] pk_info:(0);[R4] pks:pk;[R4] has_uk:false;[R4] uk_info:(null);[R4] uks:(null);[R4] [C1] column_name:pk;[R4] [C1] column_type:MYSQL_TYPE_LONG;[R4] [C1] column_is_rowkey:true;[R4] [C1] column_is_signed:true;[R4] [C1] column_encoding:;[R4] [C1] column_is_not_null:true;[R4] [C1] column_value_new:[2](1);[R4] [C2] column_name:c1;[R4] [C2] column_type:MYSQL_TYPE_VAR_STRING;[R4] [C2] column_is_rowkey:false;[R4] [C2] column_is_signed:true;[R4] [C2] column_encoding:utf8mb4;[R4] [C2] column_is_not_null:false;[R4] [C2] column_value_new:[2](1);$[R5] record_type:DELETE;[R5] database_name:obtest.oblog_db;[R5] table_name:oblog_test;[R5] log_event:true;[R5] column_count:2;[R5] source_category:SRC_FULL_RECORDED;[R5] source_type:SRC_OCEANBASE_1_0;[R5] has_pk:true;[R5] pk_info:(0);[R5] pks:pk;[R5] has_uk:false;[R5] uk_info:(null);[R5] uks:(null);[R5] [C1] column_name:pk;[R5] [C1] column_type:MYSQL_TYPE_LONG;[R5] [C1] column_is_rowkey:true;[R5] [C1] column_is_signed:true;[R5] [C1] column_encoding:;[R5] [C1] column_is_not_null:true;[R5] [C1] column_value_old:[3](1);[R5] [C2] column_name:c1;[R5] [C2] column_type:MYSQL_TYPE_VAR_STRING;[R5] [C2] column_is_rowkey:false;[R5] [C2] column_is_signed:true;[R5] [C2] column_encoding:utf8mb4;[R5] [C2] column_is_not_null:false;[R5] [C2] column_value_old:[3](1);$[R6] record_type:INSERT;[R6] database_name:obtest.oblog_db;[R6] table_name:oblog_test;[R6] log_event:true;[R6] column_count:2;[R6] source_category:SRC_FULL_RECORDED;[R6] source_type:SRC_OCEANBASE_1_0;[R6] has_pk:true;[R6] pk_info:(0);[R6] pks:pk;[R6] has_uk:false;[R6] uk_info:(null);[R6] uks:(null);[R6] [C1] column_name:pk;[R6] [C1] column_type:MYSQL_TYPE_LONG;[R6] [C1] column_is_rowkey:true;[R6] [C1] column_is_signed:true;[R6] [C1] column_encoding:;[R6] [C1] column_is_not_null:true;[R6] [C1] column_value_new:[3](1);[R6] [C2] column_name:c1;[R6] [C2] column_type:MYSQL_TYPE_VAR_STRING;[R6] [C2] column_is_rowkey:false;[R6] [C2] column_is_signed:true;[R6] [C2] column_encoding:utf8mb4;[R6] [C2] column_is_not_null:false;[R6] [C2] column_value_new:[3](1);$[R7] COMMIT;
ob1.oblog.next_dml;
[R0] BEGIN;[R0] org_cluster_id:1234;[R1] record_type:DELETE;[R1] database_name:obtest.oblog_db;[R1] table_name:oblog_test;[R1] log_event:true;[R1] column_count:2;[R1] source_category:SRC_FULL_RECORDED;[R1] source_type:SRC_OCEANBASE_1_0;[R1] has_pk:true;[R1] pk_info:(0);[R1] pks:pk;[R1] has_uk:false;[R1] uk_info:(null);[R1] uks:(null);[R1] [C1] column_name:pk;[R1] [C1] column_type:MYSQL_TYPE_LONG;[R1] [C1] column_is_rowkey:true;[R1] [C1] column_is_signed:true;[R1] [C1] column_encoding:;[R1] [C1] column_is_not_null:true;[R1] [C1] column_value_old:[1](1);[R1] [C2] column_name:c1;[R1] [C2] column_type:MYSQL_TYPE_VAR_STRING;[R1] [C2] column_is_rowkey:false;[R1] [C2] column_is_signed:true;[R1] [C2] column_encoding:utf8mb4;[R1] [C2] column_is_not_null:false;[R1] [C2] column_value_old:[1](1);$[R2] record_type:INSERT;[R2] database_name:obtest.oblog_db;[R2] table_name:oblog_test;[R2] log_event:true;[R2] column_count:2;[R2] source_category:SRC_FULL_RECORDED;[R2] source_type:SRC_OCEANBASE_1_0;[R2] has_pk:true;[R2] pk_info:(0);[R2] pks:pk;[R2] has_uk:false;[R2] uk_info:(null);[R2] uks:(null);[R2] [C1] column_name:pk;[R2] [C1] column_type:MYSQL_TYPE_LONG;[R2] [C1] column_is_rowkey:true;[R2] [C1] column_is_signed:true;[R2] [C1] column_encoding:;[R2] [C1] column_is_not_null:true;[R2] [C1] column_value_new:[1](1);[R2] [C2] column_name:c1;[R2] [C2] column_type:MYSQL_TYPE_VAR_STRING;[R2] [C2] column_is_rowkey:false;[R2] [C2] column_is_signed:true;[R2] [C2] column_encoding:utf8mb4;[R2] [C2] column_is_not_null:false;[R2] [C2] column_value_new:[1](1);$[R3] record_type:DELETE;[R3] database_name:obtest.oblog_db;[R3] table_name:oblog_test;[R3] log_event:true;[R3] column_count:2;[R3] source_category:SRC_FULL_RECORDED;[R3] source_type:SRC_OCEANBASE_1_0;[R3] has_pk:true;[R3] pk_info:(0);[R3] pks:pk;[R3] has_uk:false;[R3] uk_info:(null);[R3] uks:(null);[R3] [C1] column_name:pk;[R3] [C1] column_type:MYSQL_TYPE_LONG;[R3] [C1] column_is_rowkey:true;[R3] [C1] column_is_signed:true;[R3] [C1] column_encoding:;[R3] [C1] column_is_not_null:true;[R3] [C1] column_value_old:[2](1);[R3] [C2] column_name:c1;[R3] [C2] column_type:MYSQL_TYPE_VAR_STRING;[R3] [C2] column_is_rowkey:false;[R3] [C2] column_is_signed:true;[R3] [C2] column_encoding:utf8mb4;[R3] [C2] column_is_not_null:false;[R3] [C2] column_value_old:[2](1);$[R4] record_type:INSERT;[R4] database_name:obtest.oblog_db;[R4] table_name:oblog_test;[R4] log_event:true;[R4] column_count:2;[R4] source_category:SRC_FULL_RECORDED;[R4] source_type:SRC_OCEANBASE_1_0;[R4] has_pk:true;[R4] pk_info:(0);[R4] pks:pk;[R4] has_uk:false;[R4] uk_info:(null);[R4] uks:(null);[R4] [C1] column_name:pk;[R4] [C1] column_type:MYSQL_TYPE_LONG;[R4] [C1] column_is_rowkey:true;[R4] [C1] column_is_signed:true;[R4] [C1] column_encoding:;[R4] [C1] column_is_not_null:true;[R4] [C1] column_value_new:[2](1);[R4] [C2] column_name:c1;[R4] [C2] column_type:MYSQL_TYPE_VAR_STRING;[R4] [C2] column_is_rowkey:false;[R4] [C2] column_is_signed:true;[R4] [C2] column_encoding:utf8mb4;[R4] [C2] column_is_not_null:false;[R4] [C2] column_value_new:[2](1);$[R5] record_type:DELETE;[R5] database_name:obtest.oblog_db;[R5] table_name:oblog_test;[R5] log_event:true;[R5] column_count:2;[R5] source_category:SRC_FULL_RECORDED;[R5] source_type:SRC_OCEANBASE_1_0;[R5] has_pk:true;[R5] pk_info:(0);[R5] pks:pk;[R5] has_uk:false;[R5] uk_info:(null);[R5] uks:(null);[R5] [C1] column_name:pk;[R5] [C1] column_type:MYSQL_TYPE_LONG;[R5] [C1] column_is_rowkey:true;[R5] [C1] column_is_signed:true;[R5] [C1] column_encoding:;[R5] [C1] column_is_not_null:true;[R5] [C1] column_value_old:[3](1);[R5] [C2] column_name:c1;[R5] [C2] column_type:MYSQL_TYPE_VAR_STRING;[R5] [C2] column_is_rowkey:false;[R5] [C2] column_is_signed:true;[R5] [C2] column_encoding:utf8mb4;[R5] [C2] column_is_not_null:false;[R5] [C2] column_value_old:[3](1);$[R6] record_type:INSERT;[R6] database_name:obtest.oblog_db;[R6] table_name:oblog_test;[R6] log_event:true;[R6] column_count:2;[R6] source_category:SRC_FULL_RECORDED;[R6] source_type:SRC_OCEANBASE_1_0;[R6] has_pk:true;[R6] pk_info:(0);[R6] pks:pk;[R6] has_uk:false;[R6] uk_info:(null);[R6] uks:(null);[R6] [C1] column_name:pk;[R6] [C1] column_type:MYSQL_TYPE_LONG;[R6] [C1] column_is_rowkey:true;[R6] [C1] column_is_signed:true;[R6] [C1] column_encoding:;[R6] [C1] column_is_not_null:true;[R6] [C1] column_value_new:[3](1);[R6] [C2] column_name:c1;[R6] [C2] column_type:MYSQL_TYPE_VAR_STRING;[R6] [C2] column_is_rowkey:false;[R6] [C2] column_is_signed:true;[R6] [C2] column_encoding:utf8mb4;[R6] [C2] column_is_not_null:false;[R6] [C2] column_value_new:[3](1);$[R7] COMMIT;
ob1.oblog.stop;
drop table if exists oblog_test;
