ob1=OBI(cluster=1:1:1,init_unit_cpu=5,init_unit_num=1,init_unit_mem=5368709120,version=2_2_50,oblog_version=current);
ob2=OBI(cluster=1:1:1,init_unit_cpu=5,init_unit_num=1,init_unit_mem=5368709120,version=2_2_50,oblog_version=current,leaderob=ob1,proxy_num=0);
ob1.proxy0.set extra_config=syslog_level=debug;
ob1.z1.obs0.set extra_config=memory_chunk_cache_size=1G;
ob1.z2.obs0.set extra_config=memory_chunk_cache_size=1G;
ob1.z3.obs0.set extra_config=memory_chunk_cache_size=1G;
ob2.z1.obs0.set extra_config=memory_chunk_cache_size=1G;
ob2.z2.obs0.set extra_config=memory_chunk_cache_size=1G;
ob2.z3.obs0.set extra_config=memory_chunk_cache_size=1G;
ob1.reboot;
ob2.reboot;
ob1.mysql alter RESOURCE UNIT proxyunit max_memory=5368709120,min_memory=5368709120;
ob2.mysql alter RESOURCE UNIT __unit_config_1001  max_memory=5368709120,min_memory=5368709120;
ob1.z1.obs0.sh cd $work_dir/; ls -l {etc,etc2,etc3}/observer.conf*.bin;
ob1.z2.obs0.sh cd $work_dir/; ls -l {etc,etc2,etc3}/observer.conf*.bin;
ob1.z3.obs0.sh cd $work_dir/; ls -l {etc,etc2,etc3}/observer.conf*.bin;
ob2.z1.obs0.sh cd $work_dir/; ls -l {etc,etc2,etc3}/observer.conf*.bin;
ob2.z2.obs0.sh cd $work_dir/; ls -l {etc,etc2,etc3}/observer.conf*.bin;
ob2.z3.obs0.sh cd $work_dir/; ls -l {etc,etc2,etc3}/observer.conf*.bin;
ob1.mysql alter system set balancer_idle_time='10s';
ob1.mysql alter system set merger_check_interval='10s';
ob1.mysql alter system set resource_soft_limit=200;
ob1.mysql alter system set resource_hard_limit=200;
ob2.mysql alter system set balancer_idle_time='10s';
ob2.mysql alter system set merger_check_interval='10s';
ob2.mysql alter system set resource_soft_limit=200;
ob2.mysql alter system set resource_hard_limit=200;
create database db1;
create tablegroup tg;
create table db1.tb_normal (pk int primary key,c1 varchar(1024) default '0', c2 timestamp(6) default now(6), c3 timestamp default now(), index i1(c2), index i2(c1)) tablegroup tg;
create table db1.tb_increment (pk int primary key auto_increment,c1 int, c2 datetime(6) DEFAULT CURRENT_TIMESTAMP(6) ON UPDATE CURRENT_TIMESTAMP(6), index i1(c2)) tablegroup tg;
create table db1.tb_bigtable (c1 varchar(65536),c2 varchar(65536),c3 varchar(65536),c4 varchar(65536), pk bigint primary key auto_increment) COMPRESSION = 'none' tablegroup tg;
create table test.tb_table_gencol(pk1 bigint, pk2 varchar(2048),c1 varchar(65536), c2 varchar(65536),ac1 bigint auto_increment,
ts timestamp(6) DEFAULT CURRENT_TIMESTAMP(6) ON UPDATE CURRENT_TIMESTAMP(6),  gmt_create timestamp(6) default now(6), gmt_modified timestamp(6) default now(6),
gen_c1 varchar(10) GENERATED ALWAYS AS (substr(c1,1,10)) virtual,
gen_c2 varchar(10) GENERATED ALWAYS AS (substr(c2,1,10)) stored,
primary key(pk1, pk2),index i1(ts));
create table test.tablegencol(c1 bigint primary key,user_id varchar(32) NOT NULL default '' comment 'Alipay User ID', address varchar(256) NOT NULL default '' comment 'address', index(user_id,address(255)));
create table test.table_hash(c1 int primary key, c2 int) partition by hash(c1) partitions 2;
create table test.table_range(c1 int primary key, c2 int) partition by range(c1) (partition p0 values less than (100), partition p1 values less than (200), partition p2 values less than MAXVALUE);
create table test.table_hash_range (c1 int primary key, c2 int) partition by hash(c1) subpartition by range(c1) subpartition template(SUBPARTITION c0 VALUES LESS THAN(1990), SUBPARTITION c1 VALUES LESS THAN (2000), SUBPARTITION c2 VALUES LESS THAN MAXVALUE) partitions 2;
create table test.table_range_hash (c1 int primary key, c2 int) partition by range(c1) subpartition by hash(c1) subpartitions 2 (PARTITION c0 VALUES LESS THAN (1980), PARTITION c1 VALUES LESS THAN (1990), PARTITION c2 VALUES LESS THAN (1995), PARTITION c3 VALUES LESS THAN (2000), PARTITION c4 VALUES LESS THAN MAXVALUE);
create tablegroup tg_old partition by hash partitions 2;
create table test.table_with_tg(c1 int primary key, c2 int) tablegroup tg_old partition by hash(c1) partitions 2;
create table test.tb_table_fulltext (id int, body varchar(10), fulltext (body));
show index from test.tb_table_fulltext;
Table	Non_unique	Key_name	Seq_in_index	Column_name	Collation	Cardinality	Sub_part	Packed	Null	Index_type	Comment	Index_comment	Visible
tb_table_fulltext	1	body	1	body	A	NULL	NULL	NULL	YES	FULLTEXT	available		YES
show create table test.tb_table_fulltext;
Table	Create Table
tb_table_fulltext	CREATE TABLE `tb_table_fulltext` (
  `id` int(11) DEFAULT NULL,
  `body` varchar(10) DEFAULT NULL, 
 FULLTEXT KEY `body` (`body`) CTXCAT(`body`) WITH PARSER 'TAOBAO_CHN' BLOCK_SIZE 16384
) DEFAULT CHARSET = utf8mb4 ROW_FORMAT = DYNAMIC COMPRESSION = 'zstd_1.0' REPLICA_NUM = 3 BLOCK_SIZE = 16384 USE_BLOOM_FILTER = FALSE TABLET_SIZE = 134217728 PCTFREE = 10
ob1.mysql create resource unit box1 max_cpu 2, max_memory 5368709120, max_iops 100000, max_disk_size '5G', max_session_num 64, MIN_CPU=1, MIN_MEMORY=5368709120, MIN_IOPS=128;
ob1.mysql create resource pool pool1 unit = 'box1', unit_num = 1;
ob1.mysql create tenant oracle replica_num = 1, resource_pool_list=('pool1') set ob_tcp_invited_nodes='%', ob_compatibility_mode='oracle';
ob1.mysql alter tenant oracle set variables autocommit='on';
create user obtest IDENTIFIED BY obtest;
grant all on *.* to obtest WITH GRANT OPTION;
create table t1(pk int primary key, c1 number, c2 date default Date '2012-01-02', c3 timestamp default Timestamp '2012-12-01 01:02:03.123456789', c4 timestamp with time zone default Timestamp '2012-12-01 01:02:03.123456789 +02:00');
insert into t1 (pk, c1) values(1,1),(2,2);
delete from t1 where pk=1;
select pk, c1, to_char(c2), to_char(c3), to_char(c4) from t1;
PK	C1	TO_CHAR(C2)	TO_CHAR(C3)	TO_CHAR(C4)
2	2	02-JAN-12	01-DEC-12 01.02.03.123457 AM	01-DEC-12 01.02.03.123457 AM +02:00
create tablespace tp1;
ob1.mysql alter tenant sys set primary_zone='z1';
ob1.mysql alter tenant obtest set primary_zone='z2';
ob1.check_until_timeout select count(1) from __all_virtual_core_meta_table where role=1 and zone='z1',1,120;
ob1.check_until_timeout select count(1) from __all_virtual_server_stat,3,120;
ob1.mysql alter system major freeze;
ob1.check_version 2;
ob2.check_version 2;
ob1.check_until_timeout select info from __all_zone where zone='' and name='merge_status',IDLE,30;
ob2.check_until_timeout select info from __all_zone where zone='' and name='merge_status',IDLE,30;
set autocommit=0;
insert into db1.tb_normal(pk,c1) values(101,'101'),(102,'102'),(103,'103'),(104,'104');
update db1.tb_normal set c1=concat(c1,'_x') where pk > 100;
delete from db1.tb_normal where pk=104;
commit;
set ob_query_timeout = 60000000;
set ob_trx_timeout = 60000000;
optimize tenant all;
ob1.mysql alter system minor freeze tenant = all;
ob1.check_until_timeout select switchover_status from oceanbase.v\$ob_cluster, TO STANDBY, 1800;
ob2.mysql alter RESOURCE UNIT __unit_config_1001  max_memory=5368709120,min_memory=5368709120;
ob2.mysql alter system minor freeze tenant = all;
ob1.upgrade_check_before;
ob2.upgrade_check_before;
create resource unit oblog_box max_cpu 2, max_memory=1073741824, max_iops 10000, max_disk_size 5000000000, max_session_num 9223372036854775807, MIN_CPU=1, MIN_MEMORY=1073741824, MIN_IOPS=5000;
create resource pool oblog_pool unit = 'oblog_box', unit_num = 1;
create tenant oblog_tt_empty replica_num = 1, primary_zone='z1', resource_pool_list=('oblog_pool') set ob_tcp_invited_nodes='%';
ob1.mysql alter system begin upgrade;
ob2.mysql alter system begin upgrade;
ob1.upgrade_commond_for_server pre;
ob1.check_until_timeout select switchover_status from oceanbase.v\$ob_cluster, TO STANDBY, 1800;
ob1.check_until_timeout select count(1) from __all_virtual_core_meta_table where role=1 and zone='z1',1,120;
ob1.check_until_timeout SELECT CAST(COUNT(*) AS SIGNED) as cnt FROM __all_virtual_clog_stat WHERE is_in_sync = 0 and is_offline=0,0,600;
set @saved_ob_query_timeout = @@session.ob_query_timeout;
set @@session.ob_query_timeout = 60000000;
alter system stop zone 'z2';
set @@session.ob_query_timeout = @saved_ob_query_timeout;
ob1.check_until_timeout select info from __all_zone where zone='z2' and name='status',INACTIVE,20;
ob1.check_until_timeout select leader_count from __all_virtual_server_stat where zone = 'z2',0,20;
ob1.z2.force_stop;
ob1.check_until_timeout select count(*) from oceanbase.__all_server where zone = 'z2' and (start_service_time<=0 and status='INACTIVE'),1,60;
ob1.z2.upgrade;
ob1.z2.nstart;
ob1.check_until_timeout select count(*) from oceanbase.__all_server where zone = 'z2' and (start_service_time<=0 or status='INACTIVE'),0,60;
ob1.check_until_timeout SELECT CAST(COUNT(*) AS SIGNED) as cnt FROM __all_virtual_clog_stat WHERE is_in_sync = 0 and is_offline=0,0,600;
ob1.mysql alter system start zone 'z2';
ob1.check_until_timeout select count(1) from __all_virtual_server_stat,3,120;
set autocommit=0;
insert into tb_normal(pk,c1) values(1000,'1000'),(1000+1,'1000+1'),(1000+2,'1000+2'),(1000+3,'1000+4');
update tb_normal set c1=concat(c1,'_x') where pk > 100;
delete from tb_normal where pk=1000+4;
update tb_increment set pk=pk+1 order by pk desc limit 1;
insert into tb_increment(pk,c1) values (1000,1000),(null+1,null+2);
replace into tb_increment(pk,c1) values (1000+1,1000+2);
delete from tb_increment where pk=1000+2;
commit;
set autocommit=1;
select pk,c1 from tb_normal order by pk;
pk	c1
1	0
2	0
3	0
4	0
5	0
6	0
7	0
8	0
9	0
10	0
11	0
12	0
13	0
14	0
15	0
16	0
17	0
18	0
19	0
20	0
21	0
22	0
23	0
24	0
25	0
26	0
27	0
28	0
29	0
30	0
31	0
32	0
33	0
34	0
35	0
36	0
37	0
38	0
39	0
40	0
41	0
42	0
43	0
44	0
45	0
46	0
47	0
48	0
49	0
50	0
51	0
52	0
53	0
54	0
55	0
56	0
57	0
58	0
59	0
60	0
61	0
62	0
63	0
64	0
65	0
66	0
67	0
68	0
69	0
70	0
71	0
72	0
73	0
74	0
75	0
76	0
77	0
78	0
79	0
80	0
81	0
82	0
83	0
84	0
85	0
86	0
87	0
88	0
89	0
90	0
91	0
92	0
93	0
94	0
95	0
96	0
97	0
98	0
99	0
100	0
101	101_x_x
102	102_x_x
103	103_x_x
1000	1000_x
1001	1000+1_x
1002	1000+2_x
1003	1000+4_x
select pk,c1 from tb_increment order by pk limit 1;
pk	c1
1	1
show tables like 'tb_normal';
Tables_in_db1 (tb_normal)
tb_normal
show create table tb_increment;
Table	Create Table
tb_increment	CREATE TABLE `tb_increment` (
  `pk` int(11) NOT NULL AUTO_INCREMENT,
  `c1` int(11) DEFAULT NULL,
  `c2` datetime(6) DEFAULT CURRENT_TIMESTAMP(6) ON UPDATE CURRENT_TIMESTAMP(6),
  PRIMARY KEY (`pk`),
  KEY `i1` (`c2`) BLOCK_SIZE 16384 GLOBAL
) AUTO_INCREMENT = 2001001 DEFAULT CHARSET = utf8mb4 ROW_FORMAT = DYNAMIC COMPRESSION = 'zstd_1.0' REPLICA_NUM = 3 BLOCK_SIZE = 16384 USE_BLOOM_FILTER = FALSE TABLET_SIZE = 134217728 PCTFREE = 10 TABLEGROUP = 'tg'
insert into t1 (pk, c1) values(3,3);
update t1 set c1=0 where pk=1;
select pk, c1, to_char(c2), to_char(c3), to_char(c4) from t1;
PK	C1	TO_CHAR(C2)	TO_CHAR(C3)	TO_CHAR(C4)
2	2	02-JAN-12	01-DEC-12 01.02.03.123457 AM	01-DEC-12 01.02.03.123457 AM +02:00
3	3	02-JAN-12	01-DEC-12 01.02.03.123457 AM	01-DEC-12 01.02.03.123457 AM +02:00
select 1 from t1 where sysdate > Date '2012-12-01' and rownum < 2;
1
1
select 1 from t1 where systimestamp > Date '2012-12-01' and rownum < 2;
1
1
set autocommit=0;
insert into tb_normal(pk,c1) values(2000,'2000'),(2000+1,'2000+1'),(2000+2,'2000+2'),(2000+3,'2000+4');
update tb_normal set c1=concat(c1,'_x') where pk > 100;
delete from tb_normal where pk=2000+4;
update tb_increment set pk=pk+1 order by pk desc limit 1;
insert into tb_increment(pk,c1) values (2000,2000),(null+1,null+2);
replace into tb_increment(pk,c1) values (2000+1,2000+2);
delete from tb_increment where pk=2000+2;
commit;
set autocommit=1;
select pk,c1 from tb_normal order by pk;
pk	c1
1	0
2	0
3	0
4	0
5	0
6	0
7	0
8	0
9	0
10	0
11	0
12	0
13	0
14	0
15	0
16	0
17	0
18	0
19	0
20	0
21	0
22	0
23	0
24	0
25	0
26	0
27	0
28	0
29	0
30	0
31	0
32	0
33	0
34	0
35	0
36	0
37	0
38	0
39	0
40	0
41	0
42	0
43	0
44	0
45	0
46	0
47	0
48	0
49	0
50	0
51	0
52	0
53	0
54	0
55	0
56	0
57	0
58	0
59	0
60	0
61	0
62	0
63	0
64	0
65	0
66	0
67	0
68	0
69	0
70	0
71	0
72	0
73	0
74	0
75	0
76	0
77	0
78	0
79	0
80	0
81	0
82	0
83	0
84	0
85	0
86	0
87	0
88	0
89	0
90	0
91	0
92	0
93	0
94	0
95	0
96	0
97	0
98	0
99	0
100	0
101	101_x_x_x
102	102_x_x_x
103	103_x_x_x
1000	1000_x_x
1001	1000+1_x_x
1002	1000+2_x_x
1003	1000+4_x_x
2000	2000_x
2001	2000+1_x
2002	2000+2_x
2003	2000+4_x
select pk,c1 from tb_increment order by pk limit 1;
pk	c1
1	1
show tables like 'tb_normal';
Tables_in_db1 (tb_normal)
tb_normal
show create table tb_increment;
Table	Create Table
tb_increment	CREATE TABLE `tb_increment` (
  `pk` int(11) NOT NULL AUTO_INCREMENT,
  `c1` int(11) DEFAULT NULL,
  `c2` datetime(6) DEFAULT CURRENT_TIMESTAMP(6) ON UPDATE CURRENT_TIMESTAMP(6),
  PRIMARY KEY (`pk`),
  KEY `i1` (`c2`) BLOCK_SIZE 16384 GLOBAL
) AUTO_INCREMENT = 2001001 DEFAULT CHARSET = utf8mb4 ROW_FORMAT = DYNAMIC COMPRESSION = 'zstd_1.0' REPLICA_NUM = 3 BLOCK_SIZE = 16384 USE_BLOOM_FILTER = FALSE TABLET_SIZE = 134217728 PCTFREE = 10 TABLEGROUP = 'tg'
insert into t1 (pk, c1) values(4,4);
update t1 set c1=0 where pk=2;
select pk, c1, to_char(c2), to_char(c3), to_char(c4) from t1;
PK	C1	TO_CHAR(C2)	TO_CHAR(C3)	TO_CHAR(C4)
2	0	02-JAN-12	01-DEC-12 01.02.03.123457 AM	01-DEC-12 01.02.03.123457 AM +02:00
3	3	02-JAN-12	01-DEC-12 01.02.03.123457 AM	01-DEC-12 01.02.03.123457 AM +02:00
4	4	02-JAN-12	01-DEC-12 01.02.03.123457 AM	01-DEC-12 01.02.03.123457 AM +02:00
select 1 from t1 where sysdate > Date '2012-12-01' and rownum < 2;
1
1
select 1 from t1 where systimestamp > Date '2012-12-01' and rownum < 2;
1
1
ob1.z1.mysql_p show global variables like 'sql_mode';
Variable_name	Value
sql_mode	STRICT_ALL_TABLES
ob1.z1.mysql_p show variables like 'sql_mode';
Variable_name	Value
sql_mode	STRICT_ALL_TABLES
ob1.z1.mysql_p show create table oceanbase.__all_table;
Table	Create Table
__all_table	CREATE TABLE `__all_table` (\n  `gmt_create` timestamp(6) NULL DEFAULT CURRENT_TIMESTAMP(6),\n  `gmt_modified` timestamp(6) NULL DEFAULT CURRENT_TIMESTAMP(6) ON UPDATE CURRENT_TIMESTAMP(6),\n  `tenant_id` bigint(20) NOT NULL,\n  `table_id` bigint(20) NOT NULL,\n  `table_name` varchar(256) NOT NULL DEFAULT '',\n  `database_id` bigint(20) NOT NULL,\n  `table_type` bigint(20) NOT NULL,\n  `load_type` bigint(20) NOT NULL,\n  `def_type` bigint(20) NOT NULL,\n  `rowkey_column_num` bigint(20) NOT NULL,\n  `index_column_num` bigint(20) NOT NULL,\n  `max_used_column_id` bigint(20) NOT NULL,\n  `replica_num` bigint(20) NOT NULL,\n  `autoinc_column_id` bigint(20) NOT NULL,\n  `auto_increment` bigint(20) unsigned DEFAULT '1',\n  `read_only` bigint(20) NOT NULL,\n  `rowkey_split_pos` bigint(20) NOT NULL,\n  `compress_func_name` varchar(128) NOT NULL,\n  `expire_condition` varchar(4096) NOT NULL,\n  `is_use_bloomfilter` bigint(20) NOT NULL,\n  `comment` varchar(4096) NOT NULL DEFAULT '',\n  `block_size` bigint(20) NOT NULL,\n  `collation_type` bigint(20) NOT NULL,\n  `data_table_id` bigint(20) DEFAULT NULL,\n  `index_status` bigint(20) NOT NULL,\n  `tablegroup_id` bigint(20) NOT NULL,\n  `progressive_merge_num` bigint(20) NOT NULL,\n  `index_type` bigint(20) NOT NULL,\n  `part_level` bigint(20) NOT NULL,\n  `part_func_type` bigint(20) NOT NULL,\n  `part_func_expr` varchar(4096) NOT NULL,\n  `part_num` bigint(20) NOT NULL,\n  `sub_part_func_type` bigint(20) NOT NULL,\n  `sub_part_func_expr` varchar(4096) NOT NULL,\n  `sub_part_num` bigint(20) NOT NULL,\n  `create_mem_version` bigint(20) NOT NULL,\n  `schema_version` bigint(20) NOT NULL,\n  `view_definition` varchar(65536) NOT NULL,\n  `view_check_option` bigint(20) NOT NULL,\n  `view_is_updatable` bigint(20) NOT NULL,\n  `zone_list` varchar(8192) NOT NULL,\n  `primary_zone` varchar(128) DEFAULT NULL,\n  `index_using_type` bigint(20) NOT NULL DEFAULT '0',\n  `parser_name` varchar(128) DEFAULT NULL,\n  `index_attributes_set` bigint(20) DEFAULT '0',\n  `locality` varchar(4096) NOT NULL DEFAULT '',\n  `tablet_size` bigint(20) NOT NULL DEFAULT '134217728',\n  `pctfree` bigint(20) NOT NULL DEFAULT '10',\n  `previous_locality` varchar(4096) NOT NULL DEFAULT '',\n  `max_used_part_id` bigint(20) NOT NULL DEFAULT '-1',\n  `partition_cnt_within_partition_table` bigint(20) NOT NULL DEFAULT '-1',\n  `partition_status` bigint(20) DEFAULT '0',\n  `partition_schema_version` bigint(20) DEFAULT '0',\n  `max_used_constraint_id` bigint(20) DEFAULT NULL,\n  `session_id` bigint(20) DEFAULT '0',\n  `pk_comment` varchar(4096) NOT NULL DEFAULT '',\n  `sess_active_time` bigint(20) DEFAULT '0',\n  `row_store_type` varchar(128) DEFAULT 'encoding_row_store',\n  `store_format` varchar(128) DEFAULT '',\n  `duplicate_scope` bigint(20) DEFAULT '0',\n  `binding` tinyint(4) DEFAULT '0',\n  `progressive_merge_round` bigint(20) DEFAULT '0',\n  `storage_format_version` bigint(20) DEFAULT '2',\n  `table_mode` bigint(20) NOT NULL DEFAULT '0',\n  `encryption` varchar(128) DEFAULT '',\n  `tablespace_id` bigint(20) NOT NULL DEFAULT '-1',\n  `drop_schema_version` bigint(20) NOT NULL DEFAULT '-1',\n  PRIMARY KEY (`tenant_id`, `table_id`)\n) DEFAULT CHARSET = utf8mb4 ROW_FORMAT = DYNAMIC COMPRESSION = 'none' REPLICA_NUM = 3 BLOCK_SIZE = 16384 USE_BLOOM_FILTER = FALSE TABLET_SIZE = 134217728 PCTFREE = 10 TABLEGROUP = 'oceanbase'\n partition by key (tenant_id) partitions 16\n
ob1.z2.mysql_p show global variables like 'sql_mode';
Variable_name	Value
sql_mode	STRICT_ALL_TABLES
ob1.z2.mysql_p show variables like 'sql_mode';
Variable_name	Value
sql_mode	STRICT_ALL_TABLES
ob1.z2.mysql_p show create table oceanbase.__all_table;
Table	Create Table
__all_table	CREATE TABLE `__all_table` (\n  `gmt_create` timestamp(6) NULL DEFAULT CURRENT_TIMESTAMP(6),\n  `gmt_modified` timestamp(6) NULL DEFAULT CURRENT_TIMESTAMP(6) ON UPDATE CURRENT_TIMESTAMP(6),\n  `tenant_id` bigint(20) NOT NULL,\n  `table_id` bigint(20) NOT NULL,\n  `table_name` varchar(256) NOT NULL DEFAULT '',\n  `database_id` bigint(20) NOT NULL,\n  `table_type` bigint(20) NOT NULL,\n  `load_type` bigint(20) NOT NULL,\n  `def_type` bigint(20) NOT NULL,\n  `rowkey_column_num` bigint(20) NOT NULL,\n  `index_column_num` bigint(20) NOT NULL,\n  `max_used_column_id` bigint(20) NOT NULL,\n  `replica_num` bigint(20) NOT NULL,\n  `autoinc_column_id` bigint(20) NOT NULL,\n  `auto_increment` bigint(20) unsigned DEFAULT '1',\n  `read_only` bigint(20) NOT NULL,\n  `rowkey_split_pos` bigint(20) NOT NULL,\n  `compress_func_name` varchar(128) NOT NULL,\n  `expire_condition` varchar(4096) NOT NULL,\n  `is_use_bloomfilter` bigint(20) NOT NULL,\n  `comment` varchar(4096) NOT NULL DEFAULT '',\n  `block_size` bigint(20) NOT NULL,\n  `collation_type` bigint(20) NOT NULL,\n  `data_table_id` bigint(20) DEFAULT NULL,\n  `index_status` bigint(20) NOT NULL,\n  `tablegroup_id` bigint(20) NOT NULL,\n  `progressive_merge_num` bigint(20) NOT NULL,\n  `index_type` bigint(20) NOT NULL,\n  `part_level` bigint(20) NOT NULL,\n  `part_func_type` bigint(20) NOT NULL,\n  `part_func_expr` varchar(4096) NOT NULL,\n  `part_num` bigint(20) NOT NULL,\n  `sub_part_func_type` bigint(20) NOT NULL,\n  `sub_part_func_expr` varchar(4096) NOT NULL,\n  `sub_part_num` bigint(20) NOT NULL,\n  `create_mem_version` bigint(20) NOT NULL,\n  `schema_version` bigint(20) NOT NULL,\n  `view_definition` varchar(65536) NOT NULL,\n  `view_check_option` bigint(20) NOT NULL,\n  `view_is_updatable` bigint(20) NOT NULL,\n  `zone_list` varchar(8192) NOT NULL,\n  `primary_zone` varchar(128) DEFAULT NULL,\n  `index_using_type` bigint(20) NOT NULL DEFAULT '0',\n  `parser_name` varchar(128) DEFAULT NULL,\n  `index_attributes_set` bigint(20) DEFAULT '0',\n  `locality` varchar(4096) NOT NULL DEFAULT '',\n  `tablet_size` bigint(20) NOT NULL DEFAULT '134217728',\n  `pctfree` bigint(20) NOT NULL DEFAULT '10',\n  `previous_locality` varchar(4096) NOT NULL DEFAULT '',\n  `max_used_part_id` bigint(20) NOT NULL DEFAULT '-1',\n  `partition_cnt_within_partition_table` bigint(20) NOT NULL DEFAULT '-1',\n  `partition_status` bigint(20) DEFAULT '0',\n  `partition_schema_version` bigint(20) DEFAULT '0',\n  `max_used_constraint_id` bigint(20) DEFAULT NULL,\n  `session_id` bigint(20) DEFAULT '0',\n  `pk_comment` varchar(4096) NOT NULL DEFAULT '',\n  `sess_active_time` bigint(20) DEFAULT '0',\n  `row_store_type` varchar(128) DEFAULT 'encoding_row_store',\n  `store_format` varchar(128) DEFAULT '',\n  `duplicate_scope` bigint(20) DEFAULT '0',\n  `binding` tinyint(4) DEFAULT '0',\n  `progressive_merge_round` bigint(20) DEFAULT '0',\n  `storage_format_version` bigint(20) DEFAULT '2',\n  `table_mode` bigint(20) NOT NULL DEFAULT '0',\n  `encryption` varchar(128) DEFAULT '',\n  `tablespace_id` bigint(20) NOT NULL DEFAULT '-1',\n  `drop_schema_version` bigint(20) NOT NULL DEFAULT '-1',\n  PRIMARY KEY (`tenant_id`, `table_id`)\n) DEFAULT CHARSET = utf8mb4 ROW_FORMAT = DYNAMIC COMPRESSION = 'none' REPLICA_NUM = 3 BLOCK_SIZE = 16384 USE_BLOOM_FILTER = FALSE TABLET_SIZE = 134217728 PCTFREE = 10 TABLEGROUP = 'oceanbase'\n partition by key (tenant_id) partitions 16\n
ob1.mysql alter system minor freeze tenant = all;
set autocommit=0;
insert into tb_normal(pk,c1) values(3000,'3000'),(3000+1,'3000+1'),(3000+2,'3000+2'),(3000+3,'3000+4');
update tb_normal set c1=concat(c1,'_x') where pk > 100;
delete from tb_normal where pk=3000+4;
update tb_increment set pk=pk+1 order by pk desc limit 1;
insert into tb_increment(pk,c1) values (3000,3000),(null+1,null+2);
replace into tb_increment(pk,c1) values (3000+1,3000+2);
delete from tb_increment where pk=3000+2;
commit;
set autocommit=1;
select pk,c1 from tb_normal order by pk;
pk	c1
1	0
2	0
3	0
4	0
5	0
6	0
7	0
8	0
9	0
10	0
11	0
12	0
13	0
14	0
15	0
16	0
17	0
18	0
19	0
20	0
21	0
22	0
23	0
24	0
25	0
26	0
27	0
28	0
29	0
30	0
31	0
32	0
33	0
34	0
35	0
36	0
37	0
38	0
39	0
40	0
41	0
42	0
43	0
44	0
45	0
46	0
47	0
48	0
49	0
50	0
51	0
52	0
53	0
54	0
55	0
56	0
57	0
58	0
59	0
60	0
61	0
62	0
63	0
64	0
65	0
66	0
67	0
68	0
69	0
70	0
71	0
72	0
73	0
74	0
75	0
76	0
77	0
78	0
79	0
80	0
81	0
82	0
83	0
84	0
85	0
86	0
87	0
88	0
89	0
90	0
91	0
92	0
93	0
94	0
95	0
96	0
97	0
98	0
99	0
100	0
101	101_x_x_x_x
102	102_x_x_x_x
103	103_x_x_x_x
1000	1000_x_x_x
1001	1000+1_x_x_x
1002	1000+2_x_x_x
1003	1000+4_x_x_x
2000	2000_x_x
2001	2000+1_x_x
2002	2000+2_x_x
2003	2000+4_x_x
3000	3000_x
3001	3000+1_x
3002	3000+2_x
3003	3000+4_x
select pk,c1 from tb_increment order by pk limit 1;
pk	c1
1	1
show tables like 'tb_normal';
Tables_in_db1 (tb_normal)
tb_normal
show create table tb_increment;
Table	Create Table
tb_increment	CREATE TABLE `tb_increment` (
  `pk` int(11) NOT NULL AUTO_INCREMENT,
  `c1` int(11) DEFAULT NULL,
  `c2` datetime(6) DEFAULT CURRENT_TIMESTAMP(6) ON UPDATE CURRENT_TIMESTAMP(6),
  PRIMARY KEY (`pk`),
  KEY `i1` (`c2`) BLOCK_SIZE 16384 GLOBAL
) AUTO_INCREMENT = 2001001 DEFAULT CHARSET = utf8mb4 ROW_FORMAT = DYNAMIC COMPRESSION = 'zstd_1.0' REPLICA_NUM = 3 BLOCK_SIZE = 16384 USE_BLOOM_FILTER = FALSE TABLET_SIZE = 134217728 PCTFREE = 10 TABLEGROUP = 'tg'
ob1.check_until_timeout select switchover_status from oceanbase.v\$ob_cluster, TO STANDBY, 200;
ob1.check_until_timeout select count(1) from __all_virtual_core_meta_table where role=1 and zone='z1',1,120;
ob1.check_until_timeout select count(1) from __all_virtual_server_stat,3,120;
ob1.check_until_timeout SELECT CAST(COUNT(*) AS SIGNED) as cnt FROM __all_virtual_clog_stat WHERE is_in_sync = 0 and is_offline=0,0,600;
set @@session.ob_query_timeout = 60000000;
alter system stop zone 'z1';
ob1.check_until_timeout select info from __all_zone where zone='z1' and name='status',INACTIVE,20;
ob1.check_until_timeout select leader_count from __all_virtual_server_stat where zone = 'z1',0,20;
ob1.z1.force_stop;
ob1.check_until_timeout select count(*) from oceanbase.__all_server where zone = 'z1' and (start_service_time<=0 and status='INACTIVE'),1,60;
ob1.z1.upgrade;
ob1.z1.nstart;
ob1.check_until_timeout select count(*) from oceanbase.__all_server where zone = 'z1' and (start_service_time<=0 or status='INACTIVE'),0,60;
ob1.check_until_timeout SELECT CAST(COUNT(*) AS SIGNED) as cnt FROM __all_virtual_clog_stat WHERE is_in_sync = 0 and is_offline=0,0,600;
ob1.mysql alter system start zone 'z1';
ob1.check_until_timeout select count(1) from __all_virtual_server_stat,3,120;
ob1.check_until_timeout select count(1) from __all_virtual_core_meta_table where role=1 and zone='z1',1,120;
ob1.mysql alter system minor freeze tenant = all;
ob1.check_until_timeout select switchover_status from oceanbase.v\$ob_cluster, TO STANDBY, 200;
ob1.check_until_timeout select count(1) from __all_virtual_core_meta_table where role=1 and zone='z1',1,120;
ob1.check_until_timeout select count(1) from __all_virtual_server_stat,3,120;
ob1.check_until_timeout SELECT CAST(COUNT(*) AS SIGNED) as cnt FROM __all_virtual_clog_stat WHERE is_in_sync = 0 and is_offline=0,0,600;
set @@session.ob_query_timeout = 60000000;
alter system stop zone 'z3';
ob1.check_until_timeout select info from __all_zone where zone='z3' and name='status',INACTIVE,20;
ob1.check_until_timeout select leader_count from __all_virtual_server_stat where zone = 'z3',0,20;
ob1.z3.force_stop;
ob1.check_until_timeout select count(*) from oceanbase.__all_server where zone = 'z3' and (start_service_time<=0 and status='INACTIVE'),1,60;
ob1.z3.upgrade;
ob1.z3.nstart;
ob1.check_until_timeout select count(*) from oceanbase.__all_server where zone = 'z3' and (start_service_time<=0 or status='INACTIVE'),0,60;
ob1.check_until_timeout SELECT CAST(COUNT(*) AS SIGNED) as cnt FROM __all_virtual_clog_stat WHERE is_in_sync = 0 and is_offline=0,0,600;
ob1.mysql alter system start zone 'z3';
ob1.check_until_timeout select count(1) from __all_virtual_server_stat,3,120;
ob1.check_until_timeout select count(1) from __all_virtual_core_meta_table where role=1 and zone='z1',1,120;
ob1.mysql alter system minor freeze tenant = all;
set autocommit=0;
insert into tb_normal(pk,c1) values(4000,'4000'),(4000+1,'4000+1'),(4000+2,'4000+2'),(4000+3,'4000+4');
update tb_normal set c1=concat(c1,'_x') where pk > 100;
delete from tb_normal where pk=4000+4;
update tb_increment set pk=pk+1 order by pk desc limit 1;
insert into tb_increment(pk,c1) values (4000,4000),(null+1,null+2);
replace into tb_increment(pk,c1) values (4000+1,4000+2);
delete from tb_increment where pk=4000+2;
commit;
set autocommit=1;
select pk,c1 from tb_normal order by pk;
pk	c1
1	0
2	0
3	0
4	0
5	0
6	0
7	0
8	0
9	0
10	0
11	0
12	0
13	0
14	0
15	0
16	0
17	0
18	0
19	0
20	0
21	0
22	0
23	0
24	0
25	0
26	0
27	0
28	0
29	0
30	0
31	0
32	0
33	0
34	0
35	0
36	0
37	0
38	0
39	0
40	0
41	0
42	0
43	0
44	0
45	0
46	0
47	0
48	0
49	0
50	0
51	0
52	0
53	0
54	0
55	0
56	0
57	0
58	0
59	0
60	0
61	0
62	0
63	0
64	0
65	0
66	0
67	0
68	0
69	0
70	0
71	0
72	0
73	0
74	0
75	0
76	0
77	0
78	0
79	0
80	0
81	0
82	0
83	0
84	0
85	0
86	0
87	0
88	0
89	0
90	0
91	0
92	0
93	0
94	0
95	0
96	0
97	0
98	0
99	0
100	0
101	101_x_x_x_x_x
102	102_x_x_x_x_x
103	103_x_x_x_x_x
1000	1000_x_x_x_x
1001	1000+1_x_x_x_x
1002	1000+2_x_x_x_x
1003	1000+4_x_x_x_x
2000	2000_x_x_x
2001	2000+1_x_x_x
2002	2000+2_x_x_x
2003	2000+4_x_x_x
3000	3000_x_x
3001	3000+1_x_x
3002	3000+2_x_x
3003	3000+4_x_x
4000	4000_x
4001	4000+1_x
4002	4000+2_x
4003	4000+4_x
select pk,c1 from tb_increment order by pk limit 1;
pk	c1
1	1
show tables like 'tb_normal';
Tables_in_db1 (tb_normal)
tb_normal
show create table tb_increment;
Table	Create Table
tb_increment	CREATE TABLE `tb_increment` (
  `pk` int(11) NOT NULL AUTO_INCREMENT,
  `c1` int(11) DEFAULT NULL,
  `c2` datetime(6) DEFAULT CURRENT_TIMESTAMP(6) ON UPDATE CURRENT_TIMESTAMP(6),
  PRIMARY KEY (`pk`),
  KEY `i1` (`c2`) BLOCK_SIZE 16384 GLOBAL
) AUTO_INCREMENT = 2001001 DEFAULT CHARSET = utf8mb4 ROW_FORMAT = DYNAMIC COMPRESSION = 'zstd_1.0' REPLICA_NUM = 3 BLOCK_SIZE = 16384 USE_BLOOM_FILTER = FALSE TABLET_SIZE = 134217728 PCTFREE = 10 TABLEGROUP = 'tg'
ob1.check_until_timeout select switchover_status from oceanbase.v\$ob_cluster, TO STANDBY, 200;
ob1.check_until_timeout select switchover_status from oceanbase.v\$ob_cluster, TO STANDBY, 1800;
ob1.mysql alter system set enable_major_freeze=true;
ob1.mysql alter system major freeze;
ob1.check_version 3;
ob2.check_version 3;
ob1.check_until_timeout select switchover_status from oceanbase.v\$ob_cluster, TO STANDBY, 1800;
ob2.check_until_timeout select count(1) from __all_virtual_core_meta_table where role=1 and zone='z1',1,120;
ob2.check_until_timeout SELECT CAST(COUNT(*) AS SIGNED) as cnt FROM __all_virtual_clog_stat WHERE is_in_sync = 0 and is_offline=0,0,600;
set @saved_ob_query_timeout = @@session.ob_query_timeout;
set @@session.ob_query_timeout = 60000000;
alter system stop zone 'z2';
set @@session.ob_query_timeout = @saved_ob_query_timeout;
ob2.check_until_timeout select info from __all_zone where zone='z2' and name='status',INACTIVE,20;
ob2.check_until_timeout select leader_count from __all_virtual_server_stat where zone = 'z2',0,20;
ob2.z2.force_stop;
ob2.check_until_timeout select count(*) from oceanbase.__all_server where zone = 'z2' and (start_service_time<=0 and status='INACTIVE'),1,600;
ob2.z2.upgrade;
ob2.z2.nstart;
ob2.check_until_timeout select count(*) from oceanbase.__all_server where zone = 'z2' and (start_service_time<=0 or status='INACTIVE'),0,60;
ob2.check_until_timeout SELECT CAST(COUNT(*) AS SIGNED) as cnt FROM __all_virtual_clog_stat WHERE is_in_sync = 0 and is_offline=0,0,600;
ob2.mysql alter system start zone 'z2';
ob2.check_until_timeout select count(1) from __all_virtual_server_stat,3,120;
set autocommit=0;
insert into tb_normal(pk,c1) values(5000,'5000'),(5000+1,'5000+1'),(5000+2,'5000+2'),(5000+3,'5000+4');
update tb_normal set c1=concat(c1,'_x') where pk > 100;
delete from tb_normal where pk=5000+4;
update tb_increment set pk=pk+1 order by pk desc limit 1;
insert into tb_increment(pk,c1) values (5000,5000),(null+1,null+2);
replace into tb_increment(pk,c1) values (5000+1,5000+2);
delete from tb_increment where pk=5000+2;
commit;
set autocommit=1;
select pk,c1 from tb_normal order by pk;
pk	c1
1	0
2	0
3	0
4	0
5	0
6	0
7	0
8	0
9	0
10	0
11	0
12	0
13	0
14	0
15	0
16	0
17	0
18	0
19	0
20	0
21	0
22	0
23	0
24	0
25	0
26	0
27	0
28	0
29	0
30	0
31	0
32	0
33	0
34	0
35	0
36	0
37	0
38	0
39	0
40	0
41	0
42	0
43	0
44	0
45	0
46	0
47	0
48	0
49	0
50	0
51	0
52	0
53	0
54	0
55	0
56	0
57	0
58	0
59	0
60	0
61	0
62	0
63	0
64	0
65	0
66	0
67	0
68	0
69	0
70	0
71	0
72	0
73	0
74	0
75	0
76	0
77	0
78	0
79	0
80	0
81	0
82	0
83	0
84	0
85	0
86	0
87	0
88	0
89	0
90	0
91	0
92	0
93	0
94	0
95	0
96	0
97	0
98	0
99	0
100	0
101	101_x_x_x_x_x_x
102	102_x_x_x_x_x_x
103	103_x_x_x_x_x_x
1000	1000_x_x_x_x_x
1001	1000+1_x_x_x_x_x
1002	1000+2_x_x_x_x_x
1003	1000+4_x_x_x_x_x
2000	2000_x_x_x_x
2001	2000+1_x_x_x_x
2002	2000+2_x_x_x_x
2003	2000+4_x_x_x_x
3000	3000_x_x_x
3001	3000+1_x_x_x
3002	3000+2_x_x_x
3003	3000+4_x_x_x
4000	4000_x_x
4001	4000+1_x_x
4002	4000+2_x_x
4003	4000+4_x_x
5000	5000_x
5001	5000+1_x
5002	5000+2_x
5003	5000+4_x
select pk,c1 from tb_increment order by pk limit 1;
pk	c1
1	1
show tables like 'tb_normal';
Tables_in_db1 (tb_normal)
tb_normal
show create table tb_increment;
Table	Create Table
tb_increment	CREATE TABLE `tb_increment` (
  `pk` int(11) NOT NULL AUTO_INCREMENT,
  `c1` int(11) DEFAULT NULL,
  `c2` datetime(6) DEFAULT CURRENT_TIMESTAMP(6) ON UPDATE CURRENT_TIMESTAMP(6),
  PRIMARY KEY (`pk`),
  KEY `i1` (`c2`) BLOCK_SIZE 16384 GLOBAL
) AUTO_INCREMENT = 2001001 DEFAULT CHARSET = utf8mb4 ROW_FORMAT = DYNAMIC COMPRESSION = 'zstd_1.0' REPLICA_NUM = 3 BLOCK_SIZE = 16384 USE_BLOOM_FILTER = FALSE TABLET_SIZE = 134217728 PCTFREE = 10 TABLEGROUP = 'tg'
insert into t1 (pk, c1) values(41,41);
update t1 set c1=0 where pk=1;
select pk, c1, to_char(c2), to_char(c3), to_char(c4) from t1;
PK	C1	TO_CHAR(C2)	TO_CHAR(C3)	TO_CHAR(C4)
2	0	02-JAN-12	01-DEC-12 01.02.03.123457 AM	01-DEC-12 01.02.03.123457 AM +02:00
3	3	02-JAN-12	01-DEC-12 01.02.03.123457 AM	01-DEC-12 01.02.03.123457 AM +02:00
4	4	02-JAN-12	01-DEC-12 01.02.03.123457 AM	01-DEC-12 01.02.03.123457 AM +02:00
41	41	02-JAN-12	01-DEC-12 01.02.03.123457 AM	01-DEC-12 01.02.03.123457 AM +02:00
select 1 from t1 where sysdate > Date '2012-12-01' and rownum < 2;
1
1
select 1 from t1 where systimestamp > Date '2012-12-01' and rownum < 2;
1
1
set autocommit=0;
insert into tb_normal(pk,c1) values(6000,'6000'),(6000+1,'6000+1'),(6000+2,'6000+2'),(6000+3,'6000+4');
update tb_normal set c1=concat(c1,'_x') where pk > 100;
delete from tb_normal where pk=6000+4;
update tb_increment set pk=pk+1 order by pk desc limit 1;
insert into tb_increment(pk,c1) values (6000,6000),(null+1,null+2);
replace into tb_increment(pk,c1) values (6000+1,6000+2);
delete from tb_increment where pk=6000+2;
commit;
set autocommit=1;
select pk,c1 from tb_normal order by pk;
pk	c1
1	0
2	0
3	0
4	0
5	0
6	0
7	0
8	0
9	0
10	0
11	0
12	0
13	0
14	0
15	0
16	0
17	0
18	0
19	0
20	0
21	0
22	0
23	0
24	0
25	0
26	0
27	0
28	0
29	0
30	0
31	0
32	0
33	0
34	0
35	0
36	0
37	0
38	0
39	0
40	0
41	0
42	0
43	0
44	0
45	0
46	0
47	0
48	0
49	0
50	0
51	0
52	0
53	0
54	0
55	0
56	0
57	0
58	0
59	0
60	0
61	0
62	0
63	0
64	0
65	0
66	0
67	0
68	0
69	0
70	0
71	0
72	0
73	0
74	0
75	0
76	0
77	0
78	0
79	0
80	0
81	0
82	0
83	0
84	0
85	0
86	0
87	0
88	0
89	0
90	0
91	0
92	0
93	0
94	0
95	0
96	0
97	0
98	0
99	0
100	0
101	101_x_x_x_x_x_x_x
102	102_x_x_x_x_x_x_x
103	103_x_x_x_x_x_x_x
1000	1000_x_x_x_x_x_x
1001	1000+1_x_x_x_x_x_x
1002	1000+2_x_x_x_x_x_x
1003	1000+4_x_x_x_x_x_x
2000	2000_x_x_x_x_x
2001	2000+1_x_x_x_x_x
2002	2000+2_x_x_x_x_x
2003	2000+4_x_x_x_x_x
3000	3000_x_x_x_x
3001	3000+1_x_x_x_x
3002	3000+2_x_x_x_x
3003	3000+4_x_x_x_x
4000	4000_x_x_x
4001	4000+1_x_x_x
4002	4000+2_x_x_x
4003	4000+4_x_x_x
5000	5000_x_x
5001	5000+1_x_x
5002	5000+2_x_x
5003	5000+4_x_x
6000	6000_x
6001	6000+1_x
6002	6000+2_x
6003	6000+4_x
select pk,c1 from tb_increment order by pk limit 1;
pk	c1
1	1
show tables like 'tb_normal';
Tables_in_db1 (tb_normal)
tb_normal
show create table tb_increment;
Table	Create Table
tb_increment	CREATE TABLE `tb_increment` (
  `pk` int(11) NOT NULL AUTO_INCREMENT,
  `c1` int(11) DEFAULT NULL,
  `c2` datetime(6) DEFAULT CURRENT_TIMESTAMP(6) ON UPDATE CURRENT_TIMESTAMP(6),
  PRIMARY KEY (`pk`),
  KEY `i1` (`c2`) BLOCK_SIZE 16384 GLOBAL
) AUTO_INCREMENT = 2001001 DEFAULT CHARSET = utf8mb4 ROW_FORMAT = DYNAMIC COMPRESSION = 'zstd_1.0' REPLICA_NUM = 3 BLOCK_SIZE = 16384 USE_BLOOM_FILTER = FALSE TABLET_SIZE = 134217728 PCTFREE = 10 TABLEGROUP = 'tg'
insert into t1 (pk, c1) values(51,51);
update t1 set c1=0 where pk=2;
select pk, c1, to_char(c2), to_char(c3), to_char(c4) from t1;
PK	C1	TO_CHAR(C2)	TO_CHAR(C3)	TO_CHAR(C4)
2	0	02-JAN-12	01-DEC-12 01.02.03.123457 AM	01-DEC-12 01.02.03.123457 AM +02:00
3	3	02-JAN-12	01-DEC-12 01.02.03.123457 AM	01-DEC-12 01.02.03.123457 AM +02:00
4	4	02-JAN-12	01-DEC-12 01.02.03.123457 AM	01-DEC-12 01.02.03.123457 AM +02:00
41	41	02-JAN-12	01-DEC-12 01.02.03.123457 AM	01-DEC-12 01.02.03.123457 AM +02:00
51	51	02-JAN-12	01-DEC-12 01.02.03.123457 AM	01-DEC-12 01.02.03.123457 AM +02:00
select 1 from t1 where sysdate > Date '2012-12-01' and rownum < 2;
1
1
select 1 from t1 where systimestamp > Date '2012-12-01' and rownum < 2;
1
1
ob2.z1.mysql_p show global variables like 'sql_mode';
Variable_name	Value
sql_mode	STRICT_ALL_TABLES
ob2.z1.mysql_p show variables like 'sql_mode';
Variable_name	Value
sql_mode	STRICT_ALL_TABLES
ob2.z1.mysql_p show create table oceanbase.__all_table;
Table	Create Table
__all_table	CREATE TABLE `__all_table` (\n  `gmt_create` timestamp(6) NULL DEFAULT CURRENT_TIMESTAMP(6),\n  `gmt_modified` timestamp(6) NULL DEFAULT CURRENT_TIMESTAMP(6) ON UPDATE CURRENT_TIMESTAMP(6),\n  `tenant_id` bigint(20) NOT NULL,\n  `table_id` bigint(20) NOT NULL,\n  `table_name` varchar(256) NOT NULL DEFAULT '',\n  `database_id` bigint(20) NOT NULL,\n  `table_type` bigint(20) NOT NULL,\n  `load_type` bigint(20) NOT NULL,\n  `def_type` bigint(20) NOT NULL,\n  `rowkey_column_num` bigint(20) NOT NULL,\n  `index_column_num` bigint(20) NOT NULL,\n  `max_used_column_id` bigint(20) NOT NULL,\n  `replica_num` bigint(20) NOT NULL,\n  `autoinc_column_id` bigint(20) NOT NULL,\n  `auto_increment` bigint(20) unsigned DEFAULT '1',\n  `read_only` bigint(20) NOT NULL,\n  `rowkey_split_pos` bigint(20) NOT NULL,\n  `compress_func_name` varchar(128) NOT NULL,\n  `expire_condition` varchar(4096) NOT NULL,\n  `is_use_bloomfilter` bigint(20) NOT NULL,\n  `comment` varchar(4096) NOT NULL DEFAULT '',\n  `block_size` bigint(20) NOT NULL,\n  `collation_type` bigint(20) NOT NULL,\n  `data_table_id` bigint(20) DEFAULT NULL,\n  `index_status` bigint(20) NOT NULL,\n  `tablegroup_id` bigint(20) NOT NULL,\n  `progressive_merge_num` bigint(20) NOT NULL,\n  `index_type` bigint(20) NOT NULL,\n  `part_level` bigint(20) NOT NULL,\n  `part_func_type` bigint(20) NOT NULL,\n  `part_func_expr` varchar(4096) NOT NULL,\n  `part_num` bigint(20) NOT NULL,\n  `sub_part_func_type` bigint(20) NOT NULL,\n  `sub_part_func_expr` varchar(4096) NOT NULL,\n  `sub_part_num` bigint(20) NOT NULL,\n  `create_mem_version` bigint(20) NOT NULL,\n  `schema_version` bigint(20) NOT NULL,\n  `view_definition` varchar(65536) NOT NULL,\n  `view_check_option` bigint(20) NOT NULL,\n  `view_is_updatable` bigint(20) NOT NULL,\n  `zone_list` varchar(8192) NOT NULL,\n  `primary_zone` varchar(128) DEFAULT NULL,\n  `index_using_type` bigint(20) NOT NULL DEFAULT '0',\n  `parser_name` varchar(128) DEFAULT NULL,\n  `index_attributes_set` bigint(20) DEFAULT '0',\n  `locality` varchar(4096) NOT NULL DEFAULT '',\n  `tablet_size` bigint(20) NOT NULL DEFAULT '134217728',\n  `pctfree` bigint(20) NOT NULL DEFAULT '10',\n  `previous_locality` varchar(4096) NOT NULL DEFAULT '',\n  `max_used_part_id` bigint(20) NOT NULL DEFAULT '-1',\n  `partition_cnt_within_partition_table` bigint(20) NOT NULL DEFAULT '-1',\n  `partition_status` bigint(20) DEFAULT '0',\n  `partition_schema_version` bigint(20) DEFAULT '0',\n  `max_used_constraint_id` bigint(20) DEFAULT NULL,\n  `session_id` bigint(20) DEFAULT '0',\n  `pk_comment` varchar(4096) NOT NULL DEFAULT '',\n  `sess_active_time` bigint(20) DEFAULT '0',\n  `row_store_type` varchar(128) DEFAULT 'encoding_row_store',\n  `store_format` varchar(128) DEFAULT '',\n  `duplicate_scope` bigint(20) DEFAULT '0',\n  `binding` tinyint(4) DEFAULT '0',\n  `progressive_merge_round` bigint(20) DEFAULT '0',\n  `storage_format_version` bigint(20) DEFAULT '2',\n  `table_mode` bigint(20) NOT NULL DEFAULT '0',\n  `encryption` varchar(128) DEFAULT '',\n  `tablespace_id` bigint(20) NOT NULL DEFAULT '-1',\n  `drop_schema_version` bigint(20) NOT NULL DEFAULT '-1',\n  PRIMARY KEY (`tenant_id`, `table_id`)\n) DEFAULT CHARSET = utf8mb4 ROW_FORMAT = DYNAMIC COMPRESSION = 'none' REPLICA_NUM = 3 BLOCK_SIZE = 16384 USE_BLOOM_FILTER = FALSE TABLET_SIZE = 134217728 PCTFREE = 10 TABLEGROUP = 'oceanbase'\n partition by key (tenant_id) partitions 16\n
ob2.z2.mysql_p show global variables like 'sql_mode';
Variable_name	Value
sql_mode	STRICT_ALL_TABLES
ob2.z2.mysql_p show variables like 'sql_mode';
Variable_name	Value
sql_mode	STRICT_ALL_TABLES
ob2.z2.mysql_p show create table oceanbase.__all_table;
Table	Create Table
__all_table	CREATE TABLE `__all_table` (\n  `gmt_create` timestamp(6) NULL DEFAULT CURRENT_TIMESTAMP(6),\n  `gmt_modified` timestamp(6) NULL DEFAULT CURRENT_TIMESTAMP(6) ON UPDATE CURRENT_TIMESTAMP(6),\n  `tenant_id` bigint(20) NOT NULL,\n  `table_id` bigint(20) NOT NULL,\n  `table_name` varchar(256) NOT NULL DEFAULT '',\n  `database_id` bigint(20) NOT NULL,\n  `table_type` bigint(20) NOT NULL,\n  `load_type` bigint(20) NOT NULL,\n  `def_type` bigint(20) NOT NULL,\n  `rowkey_column_num` bigint(20) NOT NULL,\n  `index_column_num` bigint(20) NOT NULL,\n  `max_used_column_id` bigint(20) NOT NULL,\n  `replica_num` bigint(20) NOT NULL,\n  `autoinc_column_id` bigint(20) NOT NULL,\n  `auto_increment` bigint(20) unsigned DEFAULT '1',\n  `read_only` bigint(20) NOT NULL,\n  `rowkey_split_pos` bigint(20) NOT NULL,\n  `compress_func_name` varchar(128) NOT NULL,\n  `expire_condition` varchar(4096) NOT NULL,\n  `is_use_bloomfilter` bigint(20) NOT NULL,\n  `comment` varchar(4096) NOT NULL DEFAULT '',\n  `block_size` bigint(20) NOT NULL,\n  `collation_type` bigint(20) NOT NULL,\n  `data_table_id` bigint(20) DEFAULT NULL,\n  `index_status` bigint(20) NOT NULL,\n  `tablegroup_id` bigint(20) NOT NULL,\n  `progressive_merge_num` bigint(20) NOT NULL,\n  `index_type` bigint(20) NOT NULL,\n  `part_level` bigint(20) NOT NULL,\n  `part_func_type` bigint(20) NOT NULL,\n  `part_func_expr` varchar(4096) NOT NULL,\n  `part_num` bigint(20) NOT NULL,\n  `sub_part_func_type` bigint(20) NOT NULL,\n  `sub_part_func_expr` varchar(4096) NOT NULL,\n  `sub_part_num` bigint(20) NOT NULL,\n  `create_mem_version` bigint(20) NOT NULL,\n  `schema_version` bigint(20) NOT NULL,\n  `view_definition` varchar(65536) NOT NULL,\n  `view_check_option` bigint(20) NOT NULL,\n  `view_is_updatable` bigint(20) NOT NULL,\n  `zone_list` varchar(8192) NOT NULL,\n  `primary_zone` varchar(128) DEFAULT NULL,\n  `index_using_type` bigint(20) NOT NULL DEFAULT '0',\n  `parser_name` varchar(128) DEFAULT NULL,\n  `index_attributes_set` bigint(20) DEFAULT '0',\n  `locality` varchar(4096) NOT NULL DEFAULT '',\n  `tablet_size` bigint(20) NOT NULL DEFAULT '134217728',\n  `pctfree` bigint(20) NOT NULL DEFAULT '10',\n  `previous_locality` varchar(4096) NOT NULL DEFAULT '',\n  `max_used_part_id` bigint(20) NOT NULL DEFAULT '-1',\n  `partition_cnt_within_partition_table` bigint(20) NOT NULL DEFAULT '-1',\n  `partition_status` bigint(20) DEFAULT '0',\n  `partition_schema_version` bigint(20) DEFAULT '0',\n  `max_used_constraint_id` bigint(20) DEFAULT NULL,\n  `session_id` bigint(20) DEFAULT '0',\n  `pk_comment` varchar(4096) NOT NULL DEFAULT '',\n  `sess_active_time` bigint(20) DEFAULT '0',\n  `row_store_type` varchar(128) DEFAULT 'encoding_row_store',\n  `store_format` varchar(128) DEFAULT '',\n  `duplicate_scope` bigint(20) DEFAULT '0',\n  `binding` tinyint(4) DEFAULT '0',\n  `progressive_merge_round` bigint(20) DEFAULT '0',\n  `storage_format_version` bigint(20) DEFAULT '2',\n  `table_mode` bigint(20) NOT NULL DEFAULT '0',\n  `encryption` varchar(128) DEFAULT '',\n  `tablespace_id` bigint(20) NOT NULL DEFAULT '-1',\n  `drop_schema_version` bigint(20) NOT NULL DEFAULT '-1',\n  PRIMARY KEY (`tenant_id`, `table_id`)\n) DEFAULT CHARSET = utf8mb4 ROW_FORMAT = DYNAMIC COMPRESSION = 'none' REPLICA_NUM = 3 BLOCK_SIZE = 16384 USE_BLOOM_FILTER = FALSE TABLET_SIZE = 134217728 PCTFREE = 10 TABLEGROUP = 'oceanbase'\n partition by key (tenant_id) partitions 16\n
ob2.mysql alter system minor freeze tenant = all;
set autocommit=0;
insert into tb_normal(pk,c1) values(7000,'7000'),(7000+1,'7000+1'),(7000+2,'7000+2'),(7000+3,'7000+4');
update tb_normal set c1=concat(c1,'_x') where pk > 100;
delete from tb_normal where pk=7000+4;
update tb_increment set pk=pk+1 order by pk desc limit 1;
insert into tb_increment(pk,c1) values (7000,7000),(null+1,null+2);
replace into tb_increment(pk,c1) values (7000+1,7000+2);
delete from tb_increment where pk=7000+2;
commit;
set autocommit=1;
select pk,c1 from tb_normal order by pk;
pk	c1
1	0
2	0
3	0
4	0
5	0
6	0
7	0
8	0
9	0
10	0
11	0
12	0
13	0
14	0
15	0
16	0
17	0
18	0
19	0
20	0
21	0
22	0
23	0
24	0
25	0
26	0
27	0
28	0
29	0
30	0
31	0
32	0
33	0
34	0
35	0
36	0
37	0
38	0
39	0
40	0
41	0
42	0
43	0
44	0
45	0
46	0
47	0
48	0
49	0
50	0
51	0
52	0
53	0
54	0
55	0
56	0
57	0
58	0
59	0
60	0
61	0
62	0
63	0
64	0
65	0
66	0
67	0
68	0
69	0
70	0
71	0
72	0
73	0
74	0
75	0
76	0
77	0
78	0
79	0
80	0
81	0
82	0
83	0
84	0
85	0
86	0
87	0
88	0
89	0
90	0
91	0
92	0
93	0
94	0
95	0
96	0
97	0
98	0
99	0
100	0
101	101_x_x_x_x_x_x_x_x
102	102_x_x_x_x_x_x_x_x
103	103_x_x_x_x_x_x_x_x
1000	1000_x_x_x_x_x_x_x
1001	1000+1_x_x_x_x_x_x_x
1002	1000+2_x_x_x_x_x_x_x
1003	1000+4_x_x_x_x_x_x_x
2000	2000_x_x_x_x_x_x
2001	2000+1_x_x_x_x_x_x
2002	2000+2_x_x_x_x_x_x
2003	2000+4_x_x_x_x_x_x
3000	3000_x_x_x_x_x
3001	3000+1_x_x_x_x_x
3002	3000+2_x_x_x_x_x
3003	3000+4_x_x_x_x_x
4000	4000_x_x_x_x
4001	4000+1_x_x_x_x
4002	4000+2_x_x_x_x
4003	4000+4_x_x_x_x
5000	5000_x_x_x
5001	5000+1_x_x_x
5002	5000+2_x_x_x
5003	5000+4_x_x_x
6000	6000_x_x
6001	6000+1_x_x
6002	6000+2_x_x
6003	6000+4_x_x
7000	7000_x
7001	7000+1_x
7002	7000+2_x
7003	7000+4_x
select pk,c1 from tb_increment order by pk limit 1;
pk	c1
1	1
show tables like 'tb_normal';
Tables_in_db1 (tb_normal)
tb_normal
show create table tb_increment;
Table	Create Table
tb_increment	CREATE TABLE `tb_increment` (
  `pk` int(11) NOT NULL AUTO_INCREMENT,
  `c1` int(11) DEFAULT NULL,
  `c2` datetime(6) DEFAULT CURRENT_TIMESTAMP(6) ON UPDATE CURRENT_TIMESTAMP(6),
  PRIMARY KEY (`pk`),
  KEY `i1` (`c2`) BLOCK_SIZE 16384 GLOBAL
) AUTO_INCREMENT = 2001001 DEFAULT CHARSET = utf8mb4 ROW_FORMAT = DYNAMIC COMPRESSION = 'zstd_1.0' REPLICA_NUM = 3 BLOCK_SIZE = 16384 USE_BLOOM_FILTER = FALSE TABLET_SIZE = 134217728 PCTFREE = 10 TABLEGROUP = 'tg'
ob2.check_until_timeout select count(1) from __all_virtual_core_meta_table where role=1 and zone='z1',1,120;
ob2.check_until_timeout select count(1) from __all_virtual_server_stat,3,120;
ob2.check_until_timeout SELECT CAST(COUNT(*) AS SIGNED) as cnt FROM __all_virtual_clog_stat WHERE is_in_sync = 0 and is_offline=0,0,600;
set @@session.ob_query_timeout = 60000000;
alter system stop zone 'z1';
ob2.check_until_timeout select info from __all_zone where zone='z1' and name='status',INACTIVE,20;
ob2.check_until_timeout select leader_count from __all_virtual_server_stat where zone = 'z1',0,20;
ob2.z1.force_stop;
ob2.z1.upgrade;
ob2.z1.nstart;
ob2.check_until_timeout select count(*) from oceanbase.__all_server where zone = 'z1' and (start_service_time<=0 or status='INACTIVE'),0,60;
ob2.check_until_timeout SELECT CAST(COUNT(*) AS SIGNED) as cnt FROM __all_virtual_clog_stat WHERE is_in_sync = 0 and is_offline=0,0,600;
ob2.mysql alter system start zone 'z1';
ob2.check_until_timeout select count(1) from __all_virtual_server_stat,3,120;
ob2.check_until_timeout select count(1) from __all_virtual_core_meta_table where role=1 and zone='z1',1,120;
ob2.mysql alter system minor freeze tenant = all;
ob2.check_until_timeout select count(1) from __all_virtual_core_meta_table where role=1 and zone='z1',1,120;
ob2.check_until_timeout select count(1) from __all_virtual_server_stat,3,120;
ob2.check_until_timeout SELECT CAST(COUNT(*) AS SIGNED) as cnt FROM __all_virtual_clog_stat WHERE is_in_sync = 0 and is_offline=0,0,600;
set @@session.ob_query_timeout = 60000000;
alter system stop zone 'z3';
ob2.check_until_timeout select info from __all_zone where zone='z3' and name='status',INACTIVE,20;
ob2.check_until_timeout select leader_count from __all_virtual_server_stat where zone = 'z3',0,20;
ob2.z3.force_stop;
ob2.check_until_timeout select count(*) from oceanbase.__all_server where zone = 'z3' and (start_service_time<=0 and status='INACTIVE'),1,60;
ob2.z3.upgrade;
ob2.z3.nstart;
ob2.check_until_timeout select count(*) from oceanbase.__all_server where zone = 'z3' and (start_service_time<=0 or status='INACTIVE'),0,60;
ob2.check_until_timeout SELECT CAST(COUNT(*) AS SIGNED) as cnt FROM __all_virtual_clog_stat WHERE is_in_sync = 0 and is_offline=0,0,600;
ob2.mysql alter system start zone 'z3';
ob2.check_until_timeout select count(1) from __all_virtual_server_stat,3,120;
ob2.check_until_timeout select count(1) from __all_virtual_core_meta_table where role=1 and zone='z1',1,120;
ob2.mysql alter system minor freeze tenant = all;
set autocommit=0;
insert into tb_normal(pk,c1) values(8000,'8000'),(8000+1,'8000+1'),(8000+2,'8000+2'),(8000+3,'8000+4');
update tb_normal set c1=concat(c1,'_x') where pk > 100;
delete from tb_normal where pk=8000+4;
update tb_increment set pk=pk+1 order by pk desc limit 1;
insert into tb_increment(pk,c1) values (8000,8000),(null+1,null+2);
replace into tb_increment(pk,c1) values (8000+1,8000+2);
delete from tb_increment where pk=8000+2;
commit;
set autocommit=1;
select pk,c1 from tb_normal order by pk;
pk	c1
1	0
2	0
3	0
4	0
5	0
6	0
7	0
8	0
9	0
10	0
11	0
12	0
13	0
14	0
15	0
16	0
17	0
18	0
19	0
20	0
21	0
22	0
23	0
24	0
25	0
26	0
27	0
28	0
29	0
30	0
31	0
32	0
33	0
34	0
35	0
36	0
37	0
38	0
39	0
40	0
41	0
42	0
43	0
44	0
45	0
46	0
47	0
48	0
49	0
50	0
51	0
52	0
53	0
54	0
55	0
56	0
57	0
58	0
59	0
60	0
61	0
62	0
63	0
64	0
65	0
66	0
67	0
68	0
69	0
70	0
71	0
72	0
73	0
74	0
75	0
76	0
77	0
78	0
79	0
80	0
81	0
82	0
83	0
84	0
85	0
86	0
87	0
88	0
89	0
90	0
91	0
92	0
93	0
94	0
95	0
96	0
97	0
98	0
99	0
100	0
101	101_x_x_x_x_x_x_x_x_x
102	102_x_x_x_x_x_x_x_x_x
103	103_x_x_x_x_x_x_x_x_x
1000	1000_x_x_x_x_x_x_x_x
1001	1000+1_x_x_x_x_x_x_x_x
1002	1000+2_x_x_x_x_x_x_x_x
1003	1000+4_x_x_x_x_x_x_x_x
2000	2000_x_x_x_x_x_x_x
2001	2000+1_x_x_x_x_x_x_x
2002	2000+2_x_x_x_x_x_x_x
2003	2000+4_x_x_x_x_x_x_x
3000	3000_x_x_x_x_x_x
3001	3000+1_x_x_x_x_x_x
3002	3000+2_x_x_x_x_x_x
3003	3000+4_x_x_x_x_x_x
4000	4000_x_x_x_x_x
4001	4000+1_x_x_x_x_x
4002	4000+2_x_x_x_x_x
4003	4000+4_x_x_x_x_x
5000	5000_x_x_x_x
5001	5000+1_x_x_x_x
5002	5000+2_x_x_x_x
5003	5000+4_x_x_x_x
6000	6000_x_x_x
6001	6000+1_x_x_x
6002	6000+2_x_x_x
6003	6000+4_x_x_x
7000	7000_x_x
7001	7000+1_x_x
7002	7000+2_x_x
7003	7000+4_x_x
8000	8000_x
8001	8000+1_x
8002	8000+2_x
8003	8000+4_x
select pk,c1 from tb_increment order by pk limit 1;
pk	c1
1	1
show tables like 'tb_normal';
Tables_in_db1 (tb_normal)
tb_normal
show create table tb_increment;
Table	Create Table
tb_increment	CREATE TABLE `tb_increment` (
  `pk` int(11) NOT NULL AUTO_INCREMENT,
  `c1` int(11) DEFAULT NULL,
  `c2` datetime(6) DEFAULT CURRENT_TIMESTAMP(6) ON UPDATE CURRENT_TIMESTAMP(6),
  PRIMARY KEY (`pk`),
  KEY `i1` (`c2`) BLOCK_SIZE 16384 GLOBAL
) AUTO_INCREMENT = 2001001 DEFAULT CHARSET = utf8mb4 ROW_FORMAT = DYNAMIC COMPRESSION = 'zstd_1.0' REPLICA_NUM = 3 BLOCK_SIZE = 16384 USE_BLOOM_FILTER = FALSE TABLET_SIZE = 134217728 PCTFREE = 10 TABLEGROUP = 'tg'
ob1.check_until_timeout select switchover_status from oceanbase.v\$ob_cluster, TO STANDBY, 1800;
set @@session.ob_query_timeout = 60000000;
alter system upgrade virtual schema;
ob1.check_until_timeout select count(*) as cnt from oceanbase.__all_virtual_server_schema_info as a join oceanbase.__all_virtual_server_schema_info as b on a.tenant_id = b.tenant_id  where a.refreshed_schema_version != b.refreshed_schema_version, 0, 50;
select count(*) > 0 from oceanbase.__all_virtual_tenant_partition_meta_table;
count(*) > 0
1
ob1.upgrade_commond_for_server post;
ob2.mysql alter system end upgrade;
ob1.mysql alter system end upgrade;
ob1.mysql alter system run job 'root_inspection';
ob2.mysql alter system run job 'root_inspection';
ob2.upgrade_check_after;
ob1.upgrade_check_after;
select count(*) > 0 from oceanbase.__all_virtual_tenant_partition_meta_table;
count(*) > 0
1
select pk1,pk2,gen_c1,gen_c2 from test.tb_table_gencol order by pk1,pk2 limit 10;
pk1	pk2	gen_c1	gen_c2
1	1	AAAAAAAAAA	BBBBBBBBBB
2	2	AAAAAAAAAA	BBBBBBBBBB
3	3	AAAAAAAAAA	BBBBBBBBBB
4	4	AAAAAAAAAA	BBBBBBBBBB
5	5	AAAAAAAAAA	BBBBBBBBBB
6	6	AAAAAAAAAA	BBBBBBBBBB
7	7	AAAAAAAAAA	BBBBBBBBBB
8	8	AAAAAAAAAA	BBBBBBBBBB
9	9	AAAAAAAAAA	BBBBBBBBBB
10	10	AAAAAAAAAA	BBBBBBBBBB
select * from test.table_hash where c1 = 1;
c1	c2
1	1
select * from test.table_range where c1 = 1;
c1	c2
1	1
select * from test.table_hash_range where c1 = 1;
c1	c2
1	1
select * from test.table_range_hash where c1 = 1;
c1	c2
1	1
select count(*) from test.table_hash;
count(*)
100
show index from test.tb_table_fulltext;
Table	Non_unique	Key_name	Seq_in_index	Column_name	Collation	Cardinality	Sub_part	Packed	Null	Index_type	Comment	Index_comment	Visible
tb_table_fulltext	1	body	1	body	A	NULL	NULL	NULL	YES	FULLTEXT	available		YES
show create table test.tb_table_fulltext;
Table	Create Table
tb_table_fulltext	CREATE TABLE `tb_table_fulltext` (
  `id` int(11) DEFAULT NULL,
  `body` varchar(10) DEFAULT NULL, 
 FULLTEXT KEY `body` (`body`) CTXCAT(`body`) WITH PARSER 'TAOBAO_CHN' BLOCK_SIZE 16384
) DEFAULT CHARSET = utf8mb4 ROW_FORMAT = DYNAMIC COMPRESSION = 'zstd_1.0' REPLICA_NUM = 3 BLOCK_SIZE = 16384 USE_BLOOM_FILTER = FALSE TABLET_SIZE = 134217728 PCTFREE = 10
show create table test.tablegencol;
Table	Create Table
tablegencol	CREATE TABLE `tablegencol` (
  `c1` bigint(20) NOT NULL,
  `user_id` varchar(32) NOT NULL DEFAULT '' COMMENT 'Alipay User ID',
  `address` varchar(256) NOT NULL DEFAULT '' COMMENT 'address',
  PRIMARY KEY (`c1`),
  KEY `user_id` (`user_id`, `address`(255)) BLOCK_SIZE 16384 GLOBAL
) DEFAULT CHARSET = utf8mb4 ROW_FORMAT = DYNAMIC COMPRESSION = 'zstd_1.0' REPLICA_NUM = 3 BLOCK_SIZE = 16384 USE_BLOOM_FILTER = FALSE TABLET_SIZE = 134217728 PCTFREE = 10
create tablegroup tg_new partition by hash partitions 2;
alter table test.table_with_tg set tablegroup = "";
alter table test.table_with_tg set tablegroup = "tg_new";
ob1.check_until_timeout select count(1) from oceanbase.__all_virtual_table where table_name = "table_with_tg" and tablegroup_id = "$tablegroup_id", 1, 5;
ob1.check_until_timeout SELECT CAST(COUNT(*) AS SIGNED) as cnt FROM __all_virtual_clog_stat WHERE is_in_sync = 0 and is_offline=0,0,600;
insert into t1 (pk, c1) values(5,5);
update t1 set c1=0 where pk=3;
select pk, c1, to_char(c2), to_char(c3), to_char(c4) from t1;
PK	C1	TO_CHAR(C2)	TO_CHAR(C3)	TO_CHAR(C4)
2	0	02-JAN-12	01-DEC-12 01.02.03.123457 AM	01-DEC-12 01.02.03.123457 AM +02:00
3	0	02-JAN-12	01-DEC-12 01.02.03.123457 AM	01-DEC-12 01.02.03.123457 AM +02:00
4	4	02-JAN-12	01-DEC-12 01.02.03.123457 AM	01-DEC-12 01.02.03.123457 AM +02:00
5	5	02-JAN-12	01-DEC-12 01.02.03.123457 AM	01-DEC-12 01.02.03.123457 AM +02:00
41	41	02-JAN-12	01-DEC-12 01.02.03.123457 AM	01-DEC-12 01.02.03.123457 AM +02:00
51	51	02-JAN-12	01-DEC-12 01.02.03.123457 AM	01-DEC-12 01.02.03.123457 AM +02:00
ob1.mysql alter system major freeze;
ob1.check_version 4;
ob1.check_until_timeout select info from __all_zone where zone='' and name='merge_status',IDLE,30;
create table table_after_split_sys(c1 int primary key, c2 int);
insert into table_after_split_sys(c1, c2) values(1,1);
select * from table_after_split_sys;
c1	c2
1	1
create table table_after_split_mysql(c1 int primary key, c2 int);
insert into table_after_split_mysql(c1, c2) values(1,1);
select * from table_after_split_mysql;
c1	c2
1	1
grant dba to obtest;
create table table_after_split_oracle(c1 int primary key, c2 int);
insert into table_after_split_oracle(c1, c2) values(1,1);
select * from table_after_split_oracle;
C1	C2
1	1
use oceanbase;
select count(*) from __all_core_table where table_name = "__all_global_stat" and column_name = "split_schema_version_v2" and cast(column_value as signed) > 0;
count(*)
1
select tenant_id from __all_virtual_ddl_operation where operation_type = 1509 order by tenant_id;
tenant_id
1
1001
1002
1003
1004
select tenant_id from oceanbase.__all_virtual_table where table_name in ("table_after_split_sys", "table_after_split_mysql", "table_after_split_oracle") order by tenant_id;
tenant_id
1
1002
1003
select distinct(tenant_id) as tenant_id from oceanbase.__all_virtual_table_history where table_name in ("table_after_split_sys", "table_after_split_mysql", "table_after_split_oracle") order by tenant_id;
tenant_id
1
1002
1003
select count(*) as cnt from oceanbase.__all_table where table_name = "table_after_split_sys";
cnt
0
select count(*) as cnt from oceanbase.__all_table_history where table_name = "table_after_split_sys";
cnt
0
select count(*) as cnt from oceanbase.__all_table_v2 where table_name = "table_after_split_sys";
cnt
1
select if (count(*) > 0, 1, 0) as cnt from oceanbase.__all_table_v2_history where table_name = "table_after_split_sys";
cnt
1
explain select data_table_id from oceanbase.__all_table_v2_history where data_table_id = 0;
Query Plan
========================================================================
|ID|OPERATOR  |NAME                                     |EST. ROWS|COST|
------------------------------------------------------------------------
|0 |TABLE SCAN|__all_table_v2_history(idx_data_table_id)|1230     |350 |
========================================================================

Outputs & filters: 
-------------------------------------
  0 - output([__all_table_v2_history.data_table_id]), filter(nil), 
      access([__all_table_v2_history.data_table_id]), partitions(p0)

alter system change tenant obtest;
select count(*) as cnt from oceanbase.__all_table where table_name = "table_after_split_mysql";
cnt
0
select count(*) as cnt from oceanbase.__all_table_history where table_name = "table_after_split_mysql";
cnt
0
select count(*) as cnt from oceanbase.__all_table_v2 where table_name = "table_after_split_mysql";
cnt
1
select if (count(*) > 0, 1, 0) as cnt from oceanbase.__all_table_v2_history where table_name = "table_after_split_mysql";
cnt
1
explain select data_table_id from oceanbase.__all_table_v2_history where data_table_id = 0;
Query Plan
==================================================================================
|ID|OPERATOR            |NAME                                     |EST. ROWS|COST|
----------------------------------------------------------------------------------
|0 |EXCHANGE IN REMOTE  |                                         |49       |50  |
|1 | EXCHANGE OUT REMOTE|                                         |49       |47  |
|2 |  TABLE SCAN        |__all_table_v2_history(idx_data_table_id)|49       |47  |
==================================================================================

Outputs & filters: 
-------------------------------------
  0 - output([__all_table_v2_history.data_table_id]), filter(nil)
  1 - output([__all_table_v2_history.data_table_id]), filter(nil)
  2 - output([__all_table_v2_history.data_table_id]), filter(nil), 
      access([__all_table_v2_history.data_table_id]), partitions(p0)

alter system change tenant oracle;
select count(*) as cnt from oceanbase.__all_table where table_name = "table_after_split_oracle";
cnt
0
select count(*) as cnt from oceanbase.__all_table_history where table_name = "table_after_split_oracle";
cnt
0
select count(*) as cnt from oceanbase.__all_table_v2 where table_name = "table_after_split_oracle";
cnt
1
select if (count(*) > 0, 1, 0) as cnt from oceanbase.__all_table_v2_history where table_name = "table_after_split_oracle";
cnt
1
explain select data_table_id from oceanbase.__all_table_v2_history where data_table_id = 0;
Query Plan
==================================================================================
|ID|OPERATOR            |NAME                                     |EST. ROWS|COST|
----------------------------------------------------------------------------------
|0 |EXCHANGE IN REMOTE  |                                         |4        |37  |
|1 | EXCHANGE OUT REMOTE|                                         |4        |37  |
|2 |  TABLE SCAN        |__all_table_v2_history(idx_data_table_id)|4        |37  |
==================================================================================

Outputs & filters: 
-------------------------------------
  0 - output([__all_table_v2_history.data_table_id]), filter(nil)
  1 - output([__all_table_v2_history.data_table_id]), filter(nil)
  2 - output([__all_table_v2_history.data_table_id]), filter(nil), 
      access([__all_table_v2_history.data_table_id]), partitions(p0)

ob1.check_until_timeout_for_obs select switchover_status from oceanbase.v\$ob_cluster,TO STANDBY,600;
ob1.z1.obs0.mysql alter system commit to switchover to physical standby;
ob2.check_until_timeout_for_obs select switchover_status from oceanbase.v\$ob_cluster,TO PRIMARY,600;
ob2.z1.obs0.mysql alter system commit to switchover to primary;
create table t1(pk int primary key, c1 int, c2 int);
insert into t1 values(1,2,3),(4,5,6);
ob2.check_until_timeout select switchover_status from oceanbase.v\$ob_cluster, TO STANDBY, 200;
