# ----------------------------------------------------------------------
# Base test of roaringbitmap rb_contains.
# ----------------------------------------------------------------------
test: rb_contains from other exprs
select rb_contains(rb_from_string('1,2,3,4'), 1);
rb_contains(rb_from_string('1,2,3,4'), 1)
1
select rb_contains(rb_from_string('1,2,3,4'), 9223372036854775808);
rb_contains(rb_from_string('1,2,3,4'), 9223372036854775808)
0
select rb_contains(rb_from_string('1,2,3,4,9223372036854775808'), 9223372036854775808);
rb_contains(rb_from_string('1,2,3,4,9223372036854775808'), 9223372036854775808)
1
select rb_contains(rb_from_string(''), 1);
rb_contains(rb_from_string(''), 1)
0
select rb_contains(rb_from_string('1,2,3,4'), rb_from_string('1,2,3,4'));
rb_contains(rb_from_string('1,2,3,4'), rb_from_string('1,2,3,4'))
1
select rb_contains(rb_from_string('1,2,3,4'), rb_from_string('1,2,3'));
rb_contains(rb_from_string('1,2,3,4'), rb_from_string('1,2,3'))
1
select rb_contains(rb_from_string('1,2,3,4'), rb_from_string('1,2,3,4,5'));
rb_contains(rb_from_string('1,2,3,4'), rb_from_string('1,2,3,4,5'))
0
select rb_contains(rb_from_string('1,2,3,4'), rb_from_string('1,2,3,5'));
rb_contains(rb_from_string('1,2,3,4'), rb_from_string('1,2,3,5'))
0
select rb_contains(rb_from_string('1,2,3,4'), rb_from_string(''));
rb_contains(rb_from_string('1,2,3,4'), rb_from_string(''))
1
select rb_contains(rb_from_string(''), rb_from_string('1,2,3,4'));
rb_contains(rb_from_string(''), rb_from_string('1,2,3,4'))
0
select rb_contains(rb_from_string('-4294967'), -4294967);
rb_contains(rb_from_string('-4294967'), -4294967)
1
select rb_contains(rb_from_string('-4294967'), -9223372036854775808);
ERROR HY000: Size overflow
select rb_contains(rb_from_string('2147483648'), -2147483649);
ERROR HY000: Size overflow
select rb_contains(rb_from_string('2147483648'), -2147483648);
rb_contains(rb_from_string('2147483648'), -2147483648)
1
select rb_contains(rb_from_string('2147483647'), -2147483647);
rb_contains(rb_from_string('2147483647'), -2147483647)
0
select rb_contains(rb_from_string('-2147483647'), -2147483647);
rb_contains(rb_from_string('-2147483647'), -2147483647)
1
test: null/empty as param
select rb_contains(null, rb_from_string('1,2,3,4'));
rb_contains(null, rb_from_string('1,2,3,4'))
NULL
select rb_contains(null, null);
rb_contains(null, null)
NULL
select rb_contains(null, rb_from_string(''));
rb_contains(null, rb_from_string(''))
NULL
select rb_contains(rb_from_string(''), null);
rb_contains(rb_from_string(''), null)
NULL
select rb_contains(rb_from_string(''), rb_from_string(''));
rb_contains(rb_from_string(''), rb_from_string(''))
1
select rb_contains(rb_from_string(''), rb_from_string('1,2,3,4'));
rb_contains(rb_from_string(''), rb_from_string('1,2,3,4'))
0
select rb_contains(rb_from_string('1,2,3,4'), 2, 3);
ERROR 42000: Incorrect parameter count in the call to native function 'rb_contains'
select rb_contains(rb_from_string('1,2,3,4'));
ERROR 42000: Incorrect parameter count in the call to native function 'rb_contains'
select rb_contains(rb_from_string('1,2,3,4'), 2, 3, 4);
ERROR 42000: Incorrect parameter count in the call to native function 'rb_contains'
select rb_contains([1,2,3], 3);
ERROR HY000: invalid type given for an argument
select rb_contains(map(1,2,3,4), 3);
ERROR HY000: invalid type given for an argument
select rb_contains("hello world", 3);
ERROR HY000: invalid type given for an argument
select rb_contains(1, 3);
ERROR HY000: invalid type given for an argument
select rb_contains(1.2, 3);
ERROR HY000: invalid type given for an argument
select rb_contains(rb_from_string('1,2,3,4'), true);
ERROR HY000: invalid type given for an argument
select rb_contains(rb_from_string('1,2,3,4'), 1.2);
ERROR HY000: invalid type given for an argument
select rb_contains(rb_from_string('1,2,3,4'), "1");
ERROR HY000: invalid type given for an argument
select rb_contains(rb_from_string('1,2,3,4'), [1,2,3]);
ERROR HY000: invalid type given for an argument
select rb_contains(rb_from_string('1,2,3,4'), map(1,2));
ERROR HY000: invalid type given for an argument
select rb_contains([1,2,3], null);
ERROR HY000: invalid type given for an argument
select rb_contains(true, null);
ERROR HY000: invalid type given for an argument
select rb_contains(map(1,2), null);
ERROR HY000: invalid type given for an argument
select rb_contains(1.2, null);
ERROR HY000: invalid type given for an argument
select rb_contains(null, 1.2);
ERROR HY000: invalid type given for an argument
select rb_contains(null, "tengzhen.lk");
ERROR HY000: invalid type given for an argument
select rb_contains(null, [1,2,3]);
ERROR HY000: invalid type given for an argument
select rb_contains(null, map(1,2));
ERROR HY000: invalid type given for an argument
test: rb_contains from binary
select rb_contains(x'0100', 1);
rb_contains(x'0100', 1)
0
select rb_contains(x'0100', x'0100');
rb_contains(x'0100', x'0100')
1
select rb_contains(x'0200', 1);
ERROR HY000: Invalid data
select rb_contains(x'0200', x'0200');
ERROR HY000: Invalid data
select rb_contains(x'010101000000', 1);
rb_contains(x'010101000000', 1)
1
select rb_contains(x'0101FFFFFFFF', 1);
rb_contains(x'0101FFFFFFFF', 1)
0
select rb_contains(x'0101FFFFFFFF', x'01020100000001000000');
rb_contains(x'0101FFFFFFFF', x'01020100000001000000')
0
select rb_contains(x'0101FFFFFFFF', x'0102FFFFFFFFFFFFFFFF');
rb_contains(x'0101FFFFFFFF', x'0102FFFFFFFFFFFFFFFF')
0
select rb_contains(x'0101FFFFFFFF', x'01040201000000010000000100000002000000');
rb_contains(x'0101FFFFFFFF', x'01040201000000010000000100000002000000')
0
select rb_contains(x'0101FFFFFFFF', x'01053a3000000200000000000000ffff0000180000001a0000000000ffff');
rb_contains(x'0101FFFFFFFF', x'01053a3000000200000000000000ffff0000180000001a0000000000ffff')
0
select rb_contains(x'0101FFFFFFFF', x'01060200000000000000000000003a3000000100000000000000100000000000ffffffff3a30000001000000ffff000010000000ffff');
rb_contains(x'0101FFFFFFFF', x'01060200000000000000000000003a3000000100000000000000100000000000ffffffff3a30000001000000ffff000010000000ffff')
0
select rb_contains(x'0101FFFFFFFF', rb_from_string('1,2,3,4'));
rb_contains(x'0101FFFFFFFF', rb_from_string('1,2,3,4'))
0
select rb_contains(x'01010100000000000000', 1);
ERROR HY000: Invalid data
select rb_contains(x'0102FFFFFFFFFFFFFFFF', 1);
rb_contains(x'0102FFFFFFFFFFFFFFFF', 1)
0
select rb_contains(x'01020100000001000000', x'0101FFFFFFFF');
rb_contains(x'01020100000001000000', x'0101FFFFFFFF')
0
select rb_contains(x'0102FFFFFFFFFFFFFFFF', x'01020100000001000000');
rb_contains(x'0102FFFFFFFFFFFFFFFF', x'01020100000001000000')
0
select rb_contains(x'0102FFFFFFFFFFFFFFFF', x'0102FFFFFFFFFFFFFFFF');
rb_contains(x'0102FFFFFFFFFFFFFFFF', x'0102FFFFFFFFFFFFFFFF')
1
select rb_contains(x'0102FFFFFFFFFFFFFFFF', x'01040201000000010000000100000002000000');
rb_contains(x'0102FFFFFFFFFFFFFFFF', x'01040201000000010000000100000002000000')
0
select rb_contains(x'0102FFFFFFFFFFFFFFFF', x'01053a3000000200000000000000ffff0000180000001a0000000000ffff');
rb_contains(x'0102FFFFFFFFFFFFFFFF', x'01053a3000000200000000000000ffff0000180000001a0000000000ffff')
0
select rb_contains(x'0102FFFFFFFFFFFFFFFF', x'01060200000000000000000000003a3000000100000000000000100000000000ffffffff3a30000001000000ffff000010000000ffff');
rb_contains(x'0102FFFFFFFFFFFFFFFF', x'01060200000000000000000000003a3000000100000000000000100000000000ffffffff3a30000001000000ffff000010000000ffff')
0
select rb_contains(x'0102FFFFFFFFFFFFFFFF', rb_from_string('1,2,3,4'));
rb_contains(x'0102FFFFFFFFFFFFFFFF', rb_from_string('1,2,3,4'))
0
select rb_contains(x'010201000000', 1);
ERROR HY000: Invalid data
select rb_contains(x'0103', 1);
ERROR HY000: Invalid data
select rb_contains(x'010300', 1);
ERROR HY000: Invalid data
select rb_contains(x'010301', 1);
ERROR HY000: Invalid data
select rb_contains(x'01030101000000', 1);
ERROR HY000: Invalid data
select rb_contains(x'010301FFFFFFFF', 1);
ERROR HY000: Invalid data
select rb_contains(x'0103020100000002000000', x'0101FFFFFFFF');
rb_contains(x'0103020100000002000000', x'0101FFFFFFFF')
0
select rb_contains(x'0103020100000002000000', 1);
rb_contains(x'0103020100000002000000', 1)
1
select rb_contains(x'0103020100000002000000', x'0101FFFFFFFF');
rb_contains(x'0103020100000002000000', x'0101FFFFFFFF')
0
select rb_contains(x'0103020100000002000000', x'01020100000001000000');
rb_contains(x'0103020100000002000000', x'01020100000001000000')
0
select rb_contains(x'0103020100000002000000', x'01040201000000010000000100000002000000');
rb_contains(x'0103020100000002000000', x'01040201000000010000000100000002000000')
0
select rb_contains(x'0103020100000002000000', x'01053a3000000200000000000000ffff0000180000001a0000000000ffff');
rb_contains(x'0103020100000002000000', x'01053a3000000200000000000000ffff0000180000001a0000000000ffff')
0
select rb_contains(x'0103020100000002000000', x'01060200000000000000000000003a3000000100000000000000100000000000ffffffff3a30000001000000ffff000010000000ffff');
rb_contains(x'0103020100000002000000', x'01060200000000000000000000003a3000000100000000000000100000000000ffffffff3a30000001000000ffff000010000000ffff')
0
select rb_contains(x'0103020100000002000000', rb_from_string('1,2,3,4'));
rb_contains(x'0103020100000002000000', rb_from_string('1,2,3,4'))
0
select rb_contains(x'0104', 1);
ERROR HY000: Invalid data
select rb_contains(x'010400', 1);
ERROR HY000: Invalid data
select rb_contains(x'010401', 1);
ERROR HY000: Invalid data
select rb_contains(x'01040101000000', 1);
ERROR HY000: Invalid data
select rb_contains(x'0104010100000000000000', 1);
ERROR HY000: Invalid data
select rb_contains(x'0104010100000001000000', 1);
ERROR HY000: Invalid data
select rb_contains(x'010401FFFFFFFFFFFFFFFF', 1);
ERROR HY000: Invalid data
select rb_contains(x'01040201000000000000000200000000000000', 1);
rb_contains(x'01040201000000000000000200000000000000', 1)
1
select rb_contains(x'01040201000000010000000100000002000000', 1);
rb_contains(x'01040201000000010000000100000002000000', 1)
0
select rb_contains(x'01040201000000010000000100000002000000', x'0101FFFFFFFF');
rb_contains(x'01040201000000010000000100000002000000', x'0101FFFFFFFF')
0
select rb_contains(x'01040201000000010000000100000002000000', x'01020100000001000000');
rb_contains(x'01040201000000010000000100000002000000', x'01020100000001000000')
1
select rb_contains(x'01040201000000010000000100000002000000', x'0102FFFFFFFFFFFFFFFF');
rb_contains(x'01040201000000010000000100000002000000', x'0102FFFFFFFFFFFFFFFF')
0
select rb_contains(x'01040201000000010000000100000002000000', x'01040201000000010000000100000002000000');
rb_contains(x'01040201000000010000000100000002000000', x'01040201000000010000000100000002000000')
1
select rb_contains(x'01040201000000010000000100000002000000', x'01053a3000000200000000000000ffff0000180000001a0000000000ffff');
rb_contains(x'01040201000000010000000100000002000000', x'01053a3000000200000000000000ffff0000180000001a0000000000ffff')
0
select rb_contains(x'01040201000000010000000100000002000000', x'01060200000000000000000000003a3000000100000000000000100000000000ffffffff3a30000001000000ffff000010000000ffff');
rb_contains(x'01040201000000010000000100000002000000', x'01060200000000000000000000003a3000000100000000000000100000000000ffffffff3a30000001000000ffff000010000000ffff')
0
select rb_contains(x'01040201000000010000000100000002000000', rb_from_string('1,2,3,4'));
rb_contains(x'01040201000000010000000100000002000000', rb_from_string('1,2,3,4'))
0
select rb_contains(x'0105', 1);
ERROR HY000: Invalid data
select rb_contains(x'01053a30000000000000', 1);
rb_contains(x'01053a30000000000000', 1)
0
select rb_contains(x'01053a3000000100000000000000100000000100', 1);
rb_contains(x'01053a3000000100000000000000100000000100', 1)
1
select rb_contains(x'01053a30000001000000000001001000000001000200', 1);
rb_contains(x'01053a30000001000000000001001000000001000200', 1)
1
select rb_contains(x'01053a3000000100000000001f001000000000000100020003000400050006000700080009000a000b000c000d000e000f0010001100120013001400150016001700180019001a001b001c001d001e001f00', 1);
rb_contains(x'01053a3000000100000000001f001000000000000100020003000400050006000700080009000a000b000c000d000e000f0010001100120013001400150016001700180019001a001b001c001d001e001f00', 1)
1
select rb_contains(x'01053a3000000200000000000000ffff0000180000001a0000000000ffff', 1);
rb_contains(x'01053a3000000200000000000000ffff0000180000001a0000000000ffff', 1)
0
select rb_contains(x'01053a3000000100000000000000100000000100', x'0101FFFFFFFF');
rb_contains(x'01053a3000000100000000000000100000000100', x'0101FFFFFFFF')
0
select rb_contains(x'01053a3000000100000000000000100000000100', x'01020100000001000000');
rb_contains(x'01053a3000000100000000000000100000000100', x'01020100000001000000')
0
select rb_contains(x'01053a3000000100000000000000100000000100', x'0102FFFFFFFFFFFFFFFF');
rb_contains(x'01053a3000000100000000000000100000000100', x'0102FFFFFFFFFFFFFFFF')
0
select rb_contains(x'01053a3000000100000000000000100000000100', x'01040201000000010000000100000002000000');
rb_contains(x'01053a3000000100000000000000100000000100', x'01040201000000010000000100000002000000')
0
select rb_contains(x'01053a3000000100000000000000100000000100', x'01053a3000000200000000000000ffff0000180000001a0000000000ffff');
rb_contains(x'01053a3000000100000000000000100000000100', x'01053a3000000200000000000000ffff0000180000001a0000000000ffff')
0
select rb_contains(x'01053a3000000100000000000000100000000100', x'01060200000000000000000000003a3000000100000000000000100000000000ffffffff3a30000001000000ffff000010000000ffff');
rb_contains(x'01053a3000000100000000000000100000000100', x'01060200000000000000000000003a3000000100000000000000100000000000ffffffff3a30000001000000ffff000010000000ffff')
0
select rb_contains(x'01053a3000000100000000000000100000000100', rb_from_string('1,2,3,4'));
rb_contains(x'01053a3000000100000000000000100000000100', rb_from_string('1,2,3,4'))
0
select rb_contains(x'0106', 1);
ERROR HY000: Invalid data
select rb_contains(x'01060000000000000000', 1);
rb_contains(x'01060000000000000000', 1)
0
select rb_contains(x'01060100000000000000000000003a3000000100000000000000100000000100', 1);
rb_contains(x'01060100000000000000000000003a3000000100000000000000100000000100', 1)
1
select rb_contains(x'01060100000000000000010000003a3000000100000000000000100000000000', 1);
rb_contains(x'01060100000000000000010000003a3000000100000000000000100000000000', 1)
0
select rb_contains(x'01060100000000000000000000003a30000001000000000001001000000001000200', 1);
rb_contains(x'01060100000000000000000000003a30000001000000000001001000000001000200', 1)
1
select rb_contains(x'01060200000000000000000000003a3000000100000000000000100000000100010000003a3000000100000000000000100000000000', 1);
rb_contains(x'01060200000000000000000000003a3000000100000000000000100000000100010000003a3000000100000000000000100000000000', 1)
1
select rb_contains(x'01060100000000000000000000003a3000000100000000001f001000000000000100020003000400050006000700080009000a000b000c000d000e000f0010001100120013001400150016001700180019001a001b001c001d001e001f00', 1);
rb_contains(x'01060100000000000000000000003a3000000100000000001f001000000000000100020003000400050006000700080009000a000b000c000d000e000f0010001100120013001400150016001700180019001a001b001c001d001e001f00', 1)
1
select rb_contains(x'01060200000000000000000000003a30000001000000ffff000010000000ffff010000003a3000000100000000001e001000000000000100020003000400050006000700080009000a000b000c000d000e000f0010001100120013001400150016001700180019001a001b001c001d001e00', 1);
rb_contains(x'01060200000000000000000000003a30000001000000ffff000010000000ffff010000003a3000000100000000001e001000000000000100020003000400050006000700080009000a000b000c000d000e000f0010001100120013001400150016001700180019001a001b001c001d001e00', 1)
0
select rb_contains(x'01060200000000000000000000003a3000000100000000000000100000000000ffffffff3a30000001000000ffff000010000000ffff', 1);
rb_contains(x'01060200000000000000000000003a3000000100000000000000100000000000ffffffff3a30000001000000ffff000010000000ffff', 1)
0
test: rb_from_string value range
select rb_contains(rb_from_string('0'), 1);
rb_contains(rb_from_string('0'), 1)
0
select rb_contains(rb_from_string('1'), 1);
rb_contains(rb_from_string('1'), 1)
1
select rb_contains(rb_from_string('-1'), 1);
rb_contains(rb_from_string('-1'), 1)
0
select rb_contains(rb_from_string('18446744073709551615'), 1);
rb_contains(rb_from_string('18446744073709551615'), 1)
0
select rb_contains(rb_from_string('18446744073709551616'), 1);
ERROR HY000: Size overflow
select rb_contains(rb_from_string('-2147483649'), 1);
ERROR HY000: Size overflow
select rb_contains(rb_from_string('-2147483648'), 1);
rb_contains(rb_from_string('-2147483648'), 1)
0
select rb_contains(rb_from_string('9223372036854775806'), 1);
rb_contains(rb_from_string('9223372036854775806'), 1)
0
select rb_contains(rb_from_string('9223372036854775807'), 1);
rb_contains(rb_from_string('9223372036854775807'), 1)
0
select rb_contains(rb_from_string('9223372036854775808'), 1);
rb_contains(rb_from_string('9223372036854775808'), 1)
0
select rb_contains(rb_from_string('-18446744073709551615'), 1);
ERROR HY000: Size overflow
drop table if exists t1, dml_test, t2;
SET @p1 = x'0100';
SET @p2 = x'010101000000';
SET @p3 = x'010102000000';
SET @p4 = x'010303010000000200000003000000';
SET @p5 = x'010303020000000300000004000000';
SET @p6 = x'01060100000000000000000000003a30000001000000000020001000000000000100020003000400050006000700080009000a000b000c000d000e000f0010001100120013001400150016001700180019001a001b001c001d001e001f002000';
SET @p7 = x'01060100000000000000000000003a3000000100000000002000100000000a000b000c000d000e000f0010001100120013001400150016001700180019001a001b001c001d001e001f0020002100220023002400250026002700280029002a00';
CREATE TABLE t1 (k int, rb roaringbitmap);
INSERT INTO t1 VALUES
(1, NULL),
(1, @p1),
(1, @p2),
(2, @p1),
(2, @p2),
(3, @p2),
(3, @p1),
(4, @p1),
(4, @p4),
(5, @p4),
(5, @p1),
(6, @p1),
(6, @p6),
(7, @p6),
(7, @p1),
(8, @p2),
(8, @p3),
(9, @p2),
(9, @p4),
(10, @p4),
(10, @p2),
(11, @p2),
(11, @p6),
(12, @p6),
(12, @p2),
(13, @p4),
(13, @p5),
(14, @p4),
(14, @p6),
(15, @p6),
(15, @p4),
(16, @p6),
(16, @p7);
select rb_contains(rb, k) from t1;
rb_contains(rb, k)
NULL
0
1
0
0
0
0
0
0
0
0
0
1
1
0
0
0
0
0
0
0
0
1
1
0
0
0
0
1
1
0
1
1
select rb_contains(rb, 1) from t1;
rb_contains(rb, 1)
NULL
0
1
0
1
1
0
0
1
1
0
0
1
1
0
1
0
1
1
1
1
1
1
1
1
1
0
1
1
1
1
1
0
select rb_contains(rb, 9223372036854775808) from t1;
rb_contains(rb, 9223372036854775808)
NULL
0
0
0
0
0
0
0
0
0
0
0
0
0
0
0
0
0
0
0
0
0
0
0
0
0
0
0
0
0
0
0
0
select rb_contains(rb, rb_from_string('1,2')) from t1;
rb_contains(rb, rb_from_string('1,2'))
NULL
0
0
0
0
0
0
0
1
1
0
0
1
1
0
0
0
0
1
1
0
0
1
1
0
1
0
1
1
1
1
1
0
select rb_contains(rb_from_string('1,2'), rb) from t1;
rb_contains(rb_from_string('1,2'), rb)
NULL
1
1
1
1
1
1
1
0
0
1
1
0
0
1
1
1
1
0
0
1
1
0
0
1
0
0
0
0
0
0
0
0
select rb_contains([1,2,3], rb) from t1;
ERROR HY000: invalid type given for an argument
select rb_contains(rb, -18446744073709551615) from t1;
ERROR HY000: invalid type given for an argument
select /*+ OPT_PARAM('enable_rich_vector_format', 'FALSE') */  rb_contains(rb, 1) from t1;
rb_contains(rb, 1)
NULL
0
1
0
1
1
0
0
1
1
0
0
1
1
0
1
0
1
1
1
1
1
1
1
1
1
0
1
1
1
1
1
0
select /*+ OPT_PARAM('enable_rich_vector_format', 'FALSE') */  rb_contains(rb, k) from t1;
rb_contains(rb, k)
NULL
0
1
0
0
0
0
0
0
0
0
0
1
1
0
0
0
0
0
0
0
0
1
1
0
0
0
0
1
1
0
1
1
select /*+ OPT_PARAM('enable_rich_vector_format', 'FALSE') */  rb_contains(rb, 9223372036854775808) from t1;
rb_contains(rb, 9223372036854775808)
NULL
0
0
0
0
0
0
0
0
0
0
0
0
0
0
0
0
0
0
0
0
0
0
0
0
0
0
0
0
0
0
0
0
select /*+ OPT_PARAM('enable_rich_vector_format', 'FALSE') */  rb_contains(rb, rb_from_string('1,2')) from t1;
rb_contains(rb, rb_from_string('1,2'))
NULL
0
0
0
0
0
0
0
1
1
0
0
1
1
0
0
0
0
1
1
0
0
1
1
0
1
0
1
1
1
1
1
0
select /*+ OPT_PARAM('enable_rich_vector_format', 'FALSE') */  rb_contains(rb, -18446744073709551615) from t1;
ERROR HY000: invalid type given for an argument
CREATE TABLE dml_test ( 
pk bigint not null AUTO_INCREMENT,
i_1   BigInt
);
insert into dml_test(i_1)
select rb_contains(rb, k) 
from t1;
select pk, i_1 from dml_test;
pk	i_1
1	NULL
2	0
3	1
4	0
5	0
6	0
7	0
8	0
9	0
10	0
11	0
12	0
13	1
14	1
15	0
16	0
17	0
18	0
19	0
20	0
21	0
22	0
23	1
24	1
25	0
26	0
27	0
28	0
29	1
30	1
31	0
32	1
33	1
update dml_test
set i_1 = rb_contains(rb_from_string('1,2,3,4'), 1)
where i_1 =  rb_contains(rb_from_string('1,2,3,4'), rb_from_string('6,7,8'));
select * from dml_test;
pk	i_1
1	NULL
2	1
3	1
4	1
5	1
6	1
7	1
8	1
9	1
10	1
11	1
12	1
13	1
14	1
15	1
16	1
17	1
18	1
19	1
20	1
21	1
22	1
23	1
24	1
25	1
26	1
27	1
28	1
29	1
30	1
31	1
32	1
33	1
delete from dml_test
where i_1 = rb_contains(rb_from_string('1,2,3,4'), 1);
select * from dml_test;
pk	i_1
1	NULL
create table t2 (id int not null auto_increment, i_1 int, i_2 int, rb roaringbitmap);
insert into t2(i_1) values (1);
insert into t2(i_1) values (2);
insert into t2(i_1) values (3);
insert into t2(i_2) values (4);
insert into t2(i_2) values (5);
insert into t2(i_2) values (6);
select * from t2;
id	i_1	i_2	rb
1	1	NULL	NULL
2	2	NULL	NULL
3	3	NULL	NULL
4	NULL	4	NULL
5	NULL	5	NULL
6	NULL	6	NULL
select rb_contains(rb_from_string('1,2,3'), i_1) from t2;
rb_contains(rb_from_string('1,2,3'), i_1)
1
1
1
NULL
NULL
NULL
select rb_contains(rb_from_string('1,2,3'), i_2) from t2;
rb_contains(rb_from_string('1,2,3'), i_2)
NULL
NULL
NULL
0
0
0
select rb_contains(rb, i_2) from t2;
rb_contains(rb, i_2)
NULL
NULL
NULL
NULL
NULL
NULL
select /*+ OPT_PARAM('enable_rich_vector_format', 'FALSE') */ rb_contains(rb_from_string('1,2,3'), i_1) from t2;
rb_contains(rb_from_string('1,2,3'), i_1)
1
1
1
NULL
NULL
NULL
select /*+ OPT_PARAM('enable_rich_vector_format', 'FALSE') */ rb_contains(rb_from_string('1,2,3'), i_2) from t2;
rb_contains(rb_from_string('1,2,3'), i_2)
NULL
NULL
NULL
0
0
0
select /*+ OPT_PARAM('enable_rich_vector_format', 'FALSE') */ rb_contains(rb, i_2) from t2;
rb_contains(rb, i_2)
NULL
NULL
NULL
NULL
NULL
NULL
select rb_contains(rb_from_string('1,2,3,4,5,6,7,8,9,10,11,12,13,14,15,16,17,18,19,20,21,22,23,24,25,26,27,28,29,30,31,32,4294967294,4294967295,4294967296,42949672967,18446744073709551613,18446744073709551614,18446744073709551615'),18446744073709551613);
rb_contains(rb_from_string('1,2,3,4,5,6,7,8,9,10,11,12,13,14,15,16,17,18,19,20,21,22,23,24,25,26,27,28,29,30,31,32,4294967294,4294967295,4294967296,42949672967,18446744073709551613,18446744073709551614,18446744073709551615'),18446744073709551613)
1
select rb_contains(rb_from_string('1,2,3,4,5,6,7,8,9,10,11,12,13,14,15,16,17,18,19,20,21,22,23,24,25,26,27,28,29,30,31,32,4294967294,4294967295,4294967296,42949672967,18446744073709551613,18446744073709551614,18446744073709551615'),rb_from_string('4294967296,4294967295,42949672967'));
rb_contains(rb_from_string('1,2,3,4,5,6,7,8,9,10,11,12,13,14,15,16,17,18,19,20,21,22,23,24,25,26,27,28,29,30,31,32,4294967294,4294967295,4294967296,42949672967,18446744073709551613,18446744073709551614,18446744073709551615'),rb_from_string('4294967296,429
1
select rb_contains(rb_from_string('1,2,3,4,5,6,7,8,9,10,11,12,13,14,15,16,17,18,19,20,21,22,23,24,25,26,27,28,29,30,31,32,4294967294,4294967295,4294967296,42949672967,18446744073709551613,18446744073709551614,18446744073709551615'),rb_from_string('4294967296,4294967295,42949672967,18446744073709551615'));
rb_contains(rb_from_string('1,2,3,4,5,6,7,8,9,10,11,12,13,14,15,16,17,18,19,20,21,22,23,24,25,26,27,28,29,30,31,32,4294967294,4294967295,4294967296,42949672967,18446744073709551613,18446744073709551614,18446744073709551615'),rb_from_string('4294967296,429
1
select rb_contains(rb_from_string('1,2,3,4,5,6,7,8,9,10,11,12,13,14,15,16,17,18,19,20,21,22,23,24,25,26,27,28,29,30,31,32,4294967294,4294967295,4294967296,42949672967,18446744073709551613,18446744073709551614,18446744073709551615'),rb_from_string('4294967296,4294967295,42949672967,18446744073709551613,18446744073709551614,18446744073709551615'));
rb_contains(rb_from_string('1,2,3,4,5,6,7,8,9,10,11,12,13,14,15,16,17,18,19,20,21,22,23,24,25,26,27,28,29,30,31,32,4294967294,4294967295,4294967296,42949672967,18446744073709551613,18446744073709551614,18446744073709551615'),rb_from_string('4294967296,429
1
select rb_and_cardinality(rb_from_string('1,2,3,4,5,6,7,8,9,10,11,12,13,14,15,16,17,18,19,20,21,22,23,24,25,26,27,28,29,30,31,32,4294967294,4294967295,4294967296,42949672967,18446744073709551613,18446744073709551614,18446744073709551615'),rb_from_string('4294967296,4294967295,42949672967'));
rb_and_cardinality(rb_from_string('1,2,3,4,5,6,7,8,9,10,11,12,13,14,15,16,17,18,19,20,21,22,23,24,25,26,27,28,29,30,31,32,4294967294,4294967295,4294967296,42949672967,18446744073709551613,18446744073709551614,18446744073709551615'),rb_from_string('4294967
3
select rb_or_cardinality(rb_from_string('1,2,3,4,5,6,7,8,9,10,11,12,13,14,15,16,17,18,19,20,21,22,23,24,25,26,27,28,29,30,31,32,4294967294,4294967295,4294967296,42949672967,18446744073709551613,18446744073709551614,18446744073709551615'),rb_from_string('4294967296,4294967295,42949672967'));
rb_or_cardinality(rb_from_string('1,2,3,4,5,6,7,8,9,10,11,12,13,14,15,16,17,18,19,20,21,22,23,24,25,26,27,28,29,30,31,32,4294967294,4294967295,4294967296,42949672967,18446744073709551613,18446744073709551614,18446744073709551615'),rb_from_string('42949672
39
select rb_cardinality(rb_and(rb_from_string('1,2,3,4,5,6,7,8,9,10,11,12,13,14,15,16,17,18,19,20,21,22,23,24,25,26,27,28,29,30,31,32,4294967294,4294967295,4294967296,42949672967,18446744073709551613,18446744073709551614,18446744073709551615'),rb_from_string('4294967296,4294967295,42949672967')));
rb_cardinality(rb_and(rb_from_string('1,2,3,4,5,6,7,8,9,10,11,12,13,14,15,16,17,18,19,20,21,22,23,24,25,26,27,28,29,30,31,32,4294967294,4294967295,4294967296,42949672967,18446744073709551613,18446744073709551614,18446744073709551615'),rb_from_string('4294
3
select rb_cardinality(rb_or(rb_from_string('1,2,3,4,5,6,7,8,9,10,11,12,13,14,15,16,17,18,19,20,21,22,23,24,25,26,27,28,29,30,31,32,4294967294,4294967295,4294967296,42949672967,18446744073709551613,18446744073709551614,18446744073709551615'),rb_from_string('4294967296,4294967295,42949672967')));
rb_cardinality(rb_or(rb_from_string('1,2,3,4,5,6,7,8,9,10,11,12,13,14,15,16,17,18,19,20,21,22,23,24,25,26,27,28,29,30,31,32,4294967294,4294967295,4294967296,42949672967,18446744073709551613,18446744073709551614,18446744073709551615'),rb_from_string('42949
39
drop table if exists tt1;
Warnings:
Note	1051	Unknown table 'test.tt1'
create table tt1(id int ,a0 varchar(1000),a varbinary(1000),r roaringbitmap,r1 roaringbitmap);
insert into tt1 values(0,null,rb_build_empty(),rb_build_empty(),rb_build_varbinary(0x01060100000000000000000000003b300000010000ffff0100fffe0f00));
insert into tt1 values(1,'1',rb_from_string('1'),rb_from_string('1'),rb_build_varbinary(x'01053b3000000100000f27010000000f27'));
insert into tt1 values(2,'4294967296',rb_from_string('4294967296'),rb_from_string('4294967296'),rb_from_string('4294967296,4294967297,42949672969,4294967298,42949672961,42949672962,4294967299,4294967297,14294967296,14294967696,14295967296,5294967296,7294967296,9294967296,8294967296,42949617296,42949672916,4294967396,4294967496,
4294967595,4294967696,4294967795,4294968295,4294967995,4294977295,4294987295,4294997295,4294968295,4294969295,4295967295,4296967295,4297967295,4298967295'));
insert into tt1 values(3,'1,2,6,4,5,9',rb_from_string('1,2,6,4,5,9'),rb_from_string('1,2,6,4,5,9'),rb_from_string('1,2,3,4,5,6,7,8,9,10,11,12,13,14,15,16,17,18,19,20,21,22,23,24,25,26,27,28,29,30,31,4294967298,4294967299'));
insert into tt1 values(3,'1,2,6,4,5,9',rb_from_string('1,2,6,4,5,9'),rb_from_string('1,2,6,4,5,9'),rb_from_string('1,2,3,4,5,6,7,8,9,10,11,12,13,14,15,16,17,18,19,20,21,22,23,24,25,26,27,28,29,30,31,65537,65536'));
insert into tt1 values(4,'4294967296,4294967297,4294967298,4294967299',rb_from_string('4294967296,4294967297,4294967298,4294967299'),rb_from_string('4294967296,4294967297,4294967298,4294967299'),rb_from_string('1,2,3,4,5,6,7,8,9,10,11,12,13,14,15,16,17,18,19,20,21,22,23,24,25,26,27,28,29,30,31,65537,65536'));
insert into tt1 values(5,'1,2,3,4,5,6,7,8,9,10,11,12,13,14,15,16,17,18,19,20,21,22,23,24,25,26,27,28,29,30,31,32,33',
rb_from_string('1,2,3,4,5,6,7,8,9,10,11,12,13,14,15,16,17,18,19,20,21,22,23,24,25,26,27,28,29,30,31,32,33'),
rb_from_string('1,2,3,4,5,6,7,8,9,10,11,12,13,14,15,16,17,18,19,20,21,22,23,24,25,26,27,28,29,30,31,32,33'),rb_build_empty());
insert into tt1 values(5,'1,2,3,4,5,6,7,8,9,10,11,12,13,14,15,16,17,18,19,20,21,22,23,24,25,26,27,28,29,30,31,65537,65536',
rb_from_string('1,2,3,4,5,6,7,8,9,10,11,12,13,14,15,16,17,18,19,20,21,22,23,24,25,26,27,28,29,30,31,65537,65536'),
rb_from_string('1,2,3,4,5,6,7,8,9,10,11,12,13,14,15,16,17,18,19,20,21,22,23,24,25,26,27,28,29,30,31,65537,65536'),rb_from_string('1,2,6,4,5,9'));
insert into tt1 values(6,'1,2,3,4,5,6,7,8,9,10,11,12,13,14,15,16,17,18,19,20,21,22,23,24,25,26,27,28,29,30,31,4294967298,65536',
rb_from_string('1,2,3,4,5,6,7,8,9,10,11,12,13,14,15,16,17,18,19,20,21,22,23,24,25,26,27,28,29,30,31,4294967298,4294967299'),
rb_from_string('1,2,3,4,5,6,7,8,9,10,11,12,13,14,15,16,17,18,19,20,21,22,23,24,25,26,27,28,29,30,31,4294967298,4294967299'),rb_from_string('1,2,6,4,5,9'));
insert into tt1 values(6,'4294967296,4294967297,42949672969,4294967298,42949672961,42949672962,4294967299,4294967297,14294967296,14294967696,14295967296,5294967296,7294967296,9294967296,8294967296,42949617296,42949672916,4294967396,4294967496,
4294967595,4294967696,4294967795,4294968295,4294967995,4294977295,4294987295,4294997295,4294968295,4294969295,4295967295,4296967295,4297967295,4298967295',
rb_from_string('4294967296,4294967297,42949672969,4294967298,42949672961,42949672962,4294967299,4294967297,14294967296,14294967696,14295967296,5294967296,7294967296,9294967296,8294967296,42949617296,42949672916,4294967396,4294967496,
4294967595,4294967696,4294967795,4294968295,4294967995,4294977295,4294987295,4294997295,4294968295,4294969295,4295967295,4296967295,4297967295,4298967295'),
rb_from_string('4294967296,4294967297,42949672969,4294967298,42949672961,42949672962,4294967299,4294967297,14294967296,14294967696,14295967296,5294967296,7294967296,9294967296,8294967296,42949617296,42949672916,4294967396,4294967496,
4294967595,4294967696,4294967795,4294968295,4294967995,4294977295,4294987295,4294997295,4294968295,4294969295,4295967295,4296967295,4297967295,4298967295'),rb_from_string('4294967296'));
insert into tt1 values(7,'2542',x'01053b3000000100000f27010000000f27',rb_build_varbinary(x'01053b3000000100000f27010000000f27'),rb_from_string('4294967296'));
insert into tt1 values(8,'56214,-7854',rb_build_varbinary(0x01060100000000000000000000003b300000010000ffff0100fffe0f00),rb_build_varbinary(0x01060100000000000000000000003b300000010000ffff0100fffe0f00),rb_from_string('4294967296'));
insert into tt1 values(9,'1,23,8977,973747',0x01060300000000000000000000003b3001000100002000f36d0100010000002000607f677f010000003b30000001000002000100000002002a0000003a300000010000001df300001000000061c4
,0x01060100000000000000000000003b300000010000ffff0100fffe0f00,rb_from_string('4294967296'));
insert into tt1 values(10,null,null,null,null);
insert into tt1(id) values(11);
drop table if exists tt2;
Warnings:
Note	1051	Unknown table 'test.tt2'
create table tt2(id int primary key ,a0 varchar(1000),a varbinary(1000),r roaringbitmap,r1 roaringbitmap)PARTITION BY range COLUMNS(id)(
PARTITION p0 values less than(19),
PARTITION p1 values less than(25),
PARTITION p2 values less than(30)
);
insert into tt2 values(0,null,rb_build_empty(),rb_build_empty(),rb_build_varbinary(0x01060100000000000000000000003b300000010000ffff0100fffe0f00));
insert into tt2 values(1,'1',rb_from_string('1'),rb_from_string('1'),rb_build_varbinary(x'01053b3000000100000f27010000000f27'));
insert into tt2 values(2,'4294967296',rb_from_string('4294967296'),rb_from_string('4294967296'),rb_from_string('4294967296,4294967297,42949672969,4294967298,42949672961,42949672962,4294967299,4294967297,14294967296,14294967696,14295967296,5294967296,7294967296,9294967296,8294967296,42949617296,42949672916,4294967396,4294967496,
4294967595,4294967696,4294967795,4294968295,4294967995,4294977295,4294987295,4294997295,4294968295,4294969295,4295967295,4296967295,4297967295,4298967295'));
insert into tt2 values(3,'1,2,6,4,5,9',rb_from_string('1,2,6,4,5,9'),rb_from_string('1,2,6,4,5,9'),rb_from_string('1,2,3,4,5,6,7,8,9,10,11,12,13,14,15,16,17,18,19,20,21,22,23,24,25,26,27,28,29,30,31,4294967298,4294967299'));
insert into tt2 values(4,'4294967296,4294967297,4294967298,4294967299',rb_from_string('4294967296,4294967297,4294967298,4294967299'),rb_from_string('4294967296,4294967297,4294967298,4294967299'),rb_from_string('1,2,3,4,5,6,7,8,9,10,11,12,13,14,15,16,17,18,19,20,21,22,23,24,25,26,27,28,29,30,31,65537,65536'));
insert into tt2 values(5,'1,2,3,4,5,6,7,8,9,10,11,12,13,14,15,16,17,18,19,20,21,22,23,24,25,26,27,28,29,30,31,32,33',
rb_from_string('1,2,3,4,5,6,7,8,9,10,11,12,13,14,15,16,17,18,19,20,21,22,23,24,25,26,27,28,29,30,31,32,33'),
rb_from_string('1,2,3,4,5,6,7,8,9,10,11,12,13,14,15,16,17,18,19,20,21,22,23,24,25,26,27,28,29,30,31,32,33'),rb_build_empty());
insert into tt2 values(6,'1,2,3,4,5,6,7,8,9,10,11,12,13,14,15,16,17,18,19,20,21,22,23,24,25,26,27,28,29,30,31,4294967298,65536',
rb_from_string('1,2,3,4,5,6,7,8,9,10,11,12,13,14,15,16,17,18,19,20,21,22,23,24,25,26,27,28,29,30,31,4294967298,4294967299'),
rb_from_string('1,2,3,4,5,6,7,8,9,10,11,12,13,14,15,16,17,18,19,20,21,22,23,24,25,26,27,28,29,30,31,4294967298,4294967299'),rb_from_string('1,2,6,4,5,9'));
insert into tt2 values(17,'2542',x'01053b3000000100000f27010000000f27',rb_build_varbinary(x'01053b3000000100000f27010000000f27'),rb_from_string('4294967296'));
insert into tt2 values(8,'56214,-7854',rb_build_varbinary(0x01060100000000000000000000003b300000010000ffff0100fffe0f00),rb_build_varbinary(0x01060100000000000000000000003b300000010000ffff0100fffe0f00),rb_from_string('4294967296'));
insert into tt2 values(29,'1,23,8977,973747',0x01060300000000000000000000003b3001000100002000f36d0100010000002000607f677f010000003b30000001000002000100000002002a0000003a300000010000001df300001000000061c4
,0x01060100000000000000000000003b300000010000ffff0100fffe0f00,rb_from_string('4294967296'));
insert into tt2 values(20,'4294967296,4294967297,42949672969,4294967298,42949672961,42949672962,4294967299,4294967297,14294967296,14294967696,14295967296,5294967296,7294967296,9294967296,8294967296,42949617296,42949672916,4294967396,4294967496,
4294967595,4294967696,4294967795,4294968295,4294967995,4294977295,4294987295,4294997295,4294968295,4294969295,4295967295,4296967295,4297967295,4298967295',
rb_from_string('4294967296,4294967297,42949672969,4294967298,42949672961,42949672962,4294967299,4294967297,14294967296,14294967696,14295967296,5294967296,7294967296,9294967296,8294967296,42949617296,42949672916,4294967396,4294967496,
4294967595,4294967696,4294967795,4294968295,4294967995,4294977295,4294987295,4294997295,4294968295,4294969295,4295967295,4296967295,4297967295,4298967295'),
rb_from_string('4294967296,4294967297,42949672969,4294967298,42949672961,42949672962,4294967299,4294967297,14294967296,14294967696,14295967296,5294967296,7294967296,9294967296,8294967296,42949617296,42949672916,4294967396,4294967496,
4294967595,4294967696,4294967795,4294968295,4294967995,4294977295,4294987295,4294997295,4294968295,4294969295,4295967295,4296967295,4297967295,4298967295'),rb_from_string('4294967296'));
insert into tt2 values(15,null,null,null,null);
insert into tt2(id) values(19);
select rb_contains(tt1.r,tt2.r1),rb_contains(tt2.r1,tt1.r) from tt2 ,tt1;
rb_contains(tt1.r,tt2.r1)	rb_contains(tt2.r1,tt1.r)
0	1
0	1
0	1
0	1
0	1
1	1
0	1
0	1
NULL	NULL
0	1
NULL	NULL
0	1
0	1
0	0
0	1
0	0
0	1
0	1
1	0
0	1
0	0
NULL	NULL
0	0
NULL	NULL
0	0
0	0
0	0
0	0
0	1
0	0
0	0
1	0
0	0
1	1
NULL	NULL
1	1
NULL	NULL
1	1
1	1
0	0
0	1
0	0
0	1
0	1
1	0
1	1
0	0
NULL	NULL
0	0
NULL	NULL
0	0
0	0
0	0
0	1
0	0
0	1
0	1
1	0
1	1
0	0
NULL	NULL
0	0
NULL	NULL
0	0
0	0
0	0
0	0
0	1
0	0
0	0
1	0
0	0
1	0
NULL	NULL
1	0
NULL	NULL
1	0
1	0
0	0
0	1
0	0
0	0
0	0
1	0
1	0
0	0
NULL	NULL
0	0
NULL	NULL
0	0
0	0
0	0
0	0
0	0
0	0
1	1
1	0
1	0
0	0
NULL	NULL
0	0
NULL	NULL
0	0
0	0
0	0
0	0
0	0
1	1
0	0
1	0
1	0
0	0
NULL	NULL
0	0
NULL	NULL
0	0
0	0
0	0
0	0
1	1
0	0
0	0
1	0
0	0
1	0
NULL	NULL
1	0
NULL	NULL
1	0
1	0
0	0
1	1
0	0
0	0
0	0
1	0
1	0
0	0
NULL	NULL
0	0
NULL	NULL
0	0
0	0
1	1
0	0
0	0
0	0
0	0
1	0
0	0
0	0
NULL	NULL
0	0
NULL	NULL
0	0
0	0
1	1
0	0
0	0
0	0
0	0
1	0
0	0
0	0
NULL	NULL
0	0
NULL	NULL
0	0
0	0
NULL	NULL
NULL	NULL
NULL	NULL
NULL	NULL
NULL	NULL
NULL	NULL
NULL	NULL
NULL	NULL
NULL	NULL
NULL	NULL
NULL	NULL
NULL	NULL
NULL	NULL
NULL	NULL
NULL	NULL
NULL	NULL
NULL	NULL
NULL	NULL
NULL	NULL
NULL	NULL
NULL	NULL
NULL	NULL
NULL	NULL
NULL	NULL
NULL	NULL
NULL	NULL
select rb_contains(tt1.r,tt2.r) from tt2 ,tt1;
rb_contains(tt1.r,tt2.r)
1
0
0
0
0
0
0
0
NULL
0
NULL
0
0
1
1
0
0
0
0
0
0
NULL
0
NULL
0
0
1
0
1
0
0
0
0
0
NULL
0
NULL
0
0
1
1
0
1
0
0
0
0
NULL
0
NULL
0
0
1
1
0
1
0
0
0
0
NULL
0
NULL
0
0
1
0
1
0
1
0
0
0
NULL
0
NULL
0
0
1
1
0
1
0
1
0
0
NULL
0
NULL
0
0
1
1
0
1
0
0
0
0
NULL
0
NULL
0
0
1
1
0
1
0
0
1
0
NULL
0
NULL
0
0
1
0
1
0
1
0
0
0
NULL
0
NULL
1
0
1
1
0
1
0
1
0
0
NULL
1
NULL
0
0
1
0
0
0
0
0
0
1
NULL
0
NULL
0
1
1
0
0
0
0
0
0
1
NULL
0
NULL
0
1
NULL
NULL
NULL
NULL
NULL
NULL
NULL
NULL
NULL
NULL
NULL
NULL
NULL
NULL
NULL
NULL
NULL
NULL
NULL
NULL
NULL
NULL
NULL
NULL
NULL
NULL
drop table if exists t1, dml_test, t2, tt2 ,tt1;
