# ----------------------------------------------------------------------
# Base test of roaringbitmap type.
# ----------------------------------------------------------------------
drop table if exists t1;
drop table if exists tt1, tt2, tt3, tt4, tt5;
SET @p1 = x'0100';
SET @p2 = x'010101000000';
SET @p3 = x'010102000000';
SET @p4 = x'010303010000000200000003000000';
SET @p5 = x'010303020000000300000004000000';
SET @p6 = x'01060100000000000000000000003a30000001000000000020001000000000000100020003000400050006000700080009000a000b000c000d000e000f0010001100120013001400150016001700180019001a001b001c001d001e001f002000';
SET @p7 = x'01060100000000000000000000003a3000000100000000002000100000000a000b000c000d000e000f0010001100120013001400150016001700180019001a001b001c001d001e001f0020002100220023002400250026002700280029002a00';
create table t1 (id int, rb roaringbitmap);
insert into t1 values (0, NULL), (1, @p1), (2, @p2), (3, @p3), (4, @p4), (5, @p5), (6, @p6), (7, @p7);
select id, hex(rb) from t1;
id	hex(rb)
0	NULL
1	0100
2	010101000000
3	010102000000
4	010303010000000200000003000000
5	010303020000000300000004000000
6	01060100000000000000000000003A30000001000000000020001000000000000100020003000400050006000700080009000A000B000C000D000E000F0010001100120013001400150016001700180019001A001B001C001D001E001F002000
7	01060100000000000000000000003A3000000100000000002000100000000A000B000C000D000E000F0010001100120013001400150016001700180019001A001B001C001D001E001F0020002100220023002400250026002700280029002A00
select id, hex(rb) from t1 where rb = NULL;
ERROR 22000: Invalid data type for the operation
select id, hex(rb) from t1 where rb != NULL;
ERROR 22000: Invalid data type for the operation
select id, hex(rb) from t1 where rb = rb_build_empty();
ERROR 22000: Invalid data type for the operation
select id, hex(rb) from t1 where rb != rb_build_empty();
ERROR 22000: Invalid data type for the operation
select id, hex(rb) from t1 where rb = x'0100';
ERROR 22000: Invalid data type for the operation
select id, hex(rb) from t1 where rb != x'0100';
ERROR 22000: Invalid data type for the operation
select id, hex(rb) from t1 where rb = rb_build_varbinary(x'0100');
ERROR 22000: Invalid data type for the operation
select id, hex(rb) from t1 where rb = rb_build_agg(1);
ERROR HY000: Invalid use of group function
select id, hex(rb) from t1 where rb = rb_from_string('1');
ERROR 22000: Invalid data type for the operation
select id, hex(rb) from t1 where rb > NULL;
ERROR 22000: Invalid data type for the operation
select id, hex(rb) from t1 where rb < x'0100';
ERROR 22000: Invalid data type for the operation
select id, hex(rb) from t1 where rb <= rb_build_empty();
ERROR 22000: Invalid data type for the operation
select sum(rb) from t1;
ERROR HY000: Invalid argument
select min(rb) from t1;
ERROR HY000: Invalid argument
select max(rb) from t1;
ERROR HY000: Invalid argument
select avg(rb) from t1;
ERROR HY000: Invalid argument
create table tt1(id int,a varbinary(1000),r roaringbitmap);
insert into tt1 values(1,rb_from_string('1'),rb_from_string('1'));
insert into tt1 values(2,rb_build_empty(),rb_build_empty());
insert into tt1 values(3,rb_from_string('1,3'),rb_from_string('1,3'));
select id, hex(a), hex(r) from tt1 where rb_build_empty() like rb_build_empty() ;
id	hex(a)	hex(r)
1	010101000000	010101000000
2	0100	0100
3	0103020100000003000000	0103020100000003000000
select id, hex(a), hex(r) from tt1 where  rb_from_string('1,2,3,4') like rb_from_string('1,2,3,4');
id	hex(a)	hex(r)
1	010101000000	010101000000
2	0100	0100
3	0103020100000003000000	0103020100000003000000
select id, hex(a), hex(r) from tt1 where  rb_build_varbinary(0x01030401000000020000000300000004000000) like rb_build_varbinary(0x01030401000000020000000300000004000000);
id	hex(a)	hex(r)
1	010101000000	010101000000
2	0100	0100
3	0103020100000003000000	0103020100000003000000
select hex(cast(rb_build_empty() as binary));
hex(cast(rb_build_empty() as binary))
0100
select hex(cast(rb_from_string('1,2,3,4') as binary));
hex(cast(rb_from_string('1,2,3,4') as binary))
01030401000000020000000300000004000000
select hex(cast (rb_build_varbinary(0x01030401000000020000000300000004000000) as binary));
hex(cast (rb_build_varbinary(0x01030401000000020000000300000004000000) as binary))
01030401000000020000000300000004000000
select cast(rb_build_empty() as SIGNED);
ERROR 22000: Invalid data type for the operation
select cast(rb_from_string('1,2,3,4') as date);
ERROR 22000: Invalid data type for the operation
select cast (rb_build_varbinary(0x01030401000000020000000300000004000000) as DECIMAL);
ERROR 22000: Invalid data type for the operation
select cast(rb_build_empty() as MULTIPOINT);
ERROR 22000: Invalid data type for the operation
create table tt2 (id int, rb roaringbitmap);
insert into tt2 values (1, @p1), (2, @p2), (3, @p3), (4, @p4), (5, @p5), (6, @p6), (7, @p7);
select /*+ ENABLE_PARALLEL_DML parallel(1) */  id, hex(rb) from tt2;
id	hex(rb)
1	0100
2	010101000000
3	010102000000
4	010303010000000200000003000000
5	010303020000000300000004000000
6	01060100000000000000000000003A30000001000000000020001000000000000100020003000400050006000700080009000A000B000C000D000E000F0010001100120013001400150016001700180019001A001B001C001D001E001F002000
7	01060100000000000000000000003A3000000100000000002000100000000A000B000C000D000E000F0010001100120013001400150016001700180019001A001B001C001D001E001F0020002100220023002400250026002700280029002A00
select /*+ ENABLE_PARALLEL_DML parallel(2) */  id, hex(rb) from tt2;
id	hex(rb)
1	0100
2	010101000000
3	010102000000
4	010303010000000200000003000000
5	010303020000000300000004000000
6	01060100000000000000000000003A30000001000000000020001000000000000100020003000400050006000700080009000A000B000C000D000E000F0010001100120013001400150016001700180019001A001B001C001D001E001F002000
7	01060100000000000000000000003A3000000100000000002000100000000A000B000C000D000E000F0010001100120013001400150016001700180019001A001B001C001D001E001F0020002100220023002400250026002700280029002A00
select * from tt2 order by rb;
ERROR 22000: Invalid data type for the operation
select rb from tt2 order by rb;
ERROR 22000: Invalid data type for the operation
select * from tt2 group by rb;
ERROR 22000: Invalid data type for the operation
select rb from tt2 group by rb;
ERROR 22000: Invalid data type for the operation
create table tt3 (rb roaringbitmap);
insert into tt3 values (x'0100');
update tt3 set rb=x'1111';
ERROR HY000: Invalid data
update tt3 set rb='josn';
ERROR 0A000: cast string collation type not in binary to roaringbitmap not supported
update tt3 set rb=4;
ERROR 0A000: T_INT cast to T_ROARINGBITMAP not supported
select hex(cast( x'0100' as roaringbitmap));
hex(cast( x'0100' as roaringbitmap))
0100
select hex(cast( x'010101000000' as roaringbitmap));
hex(cast( x'010101000000' as roaringbitmap))
010101000000
select hex(cast( x'01020100000001000000' as roaringbitmap));
hex(cast( x'01020100000001000000' as roaringbitmap))
01020100000001000000
select hex(cast( x'0103020100000002000000' as roaringbitmap));
hex(cast( x'0103020100000002000000' as roaringbitmap))
0103020100000002000000
select hex(cast( x'01040201000000000000000200000000000000' as roaringbitmap));
hex(cast( x'01040201000000000000000200000000000000' as roaringbitmap))
0103020100000002000000
select hex(cast( x'01053a30000001000000000020001000000000000100020003000400050006000700080009000a000b000c000d000e000f0010001100120013001400150016001700180019001a001b001c001d001e001f002000' as roaringbitmap));
hex(cast( x'01053a30000001000000000020001000000000000100020003000400050006000700080009000a000b000c000d000e000f0010001100120013001400150016001700180019001a001b001c001d001e001f002000' as roaringbitmap))
01060100000000000000000000003A30000001000000000020001000000000000100020003000400050006000700080009000A000B000C000D000E000F0010001100120013001400150016001700180019001A001B001C001D001E001F002000
select hex(cast( x'01060200000000000000000000003a30000001000000ffff000010000000ffff010000003a3000000100000000001f001000000000000100020003000400050006000700080009000a000b000c000d000e000f0010001100120013001400150016001700180019001a001b001c001d001e001f00' as roaringbitmap));
hex(cast( x'01060200000000000000000000003a30000001000000ffff000010000000ffff010000003a3000000100000000001f001000000000000100020003000400050006000700080009000a000b000c000d000e000f0010001100120013001400150016001700180019001a001b001c001d001e001f00' as roarin
01060200000000000000000000003A30000001000000FFFF000010000000FFFF010000003A3000000100000000001F001000000000000100020003000400050006000700080009000A000B000C000D000E000F0010001100120013001400150016001700180019001A001B001C001D001E001F00
SELECT hex( CASE WHEN 1=1 THEN rb_build_agg(1)  ELSE rb_build_empty()  END );
hex( CASE WHEN 1=1 THEN rb_build_agg(1)  ELSE rb_build_empty()  END )
010101000000
SELECT hex( CASE WHEN 1>1 THEN rb_build_agg(1)  ELSE rb_build_empty()  END );
hex( CASE WHEN 1>1 THEN rb_build_agg(1)  ELSE rb_build_empty()  END )
0100
SELECT rb_to_string( CASE rb_build_agg(1) WHEN rb_build_agg(2) THEN rb_build_agg(2) WHEN rb_build_agg(1) THEN rb_build_agg(1) END );
ERROR 22000: Invalid data type for the operation
SELECT rb_to_string( CASE rb_build_agg(1) WHEN rb_build_agg(2) THEN rb_build_agg(2) WHEN 0x010101000000 THEN rb_build_agg(1) END );
ERROR 22000: Invalid data type for the operation
SELECT rb_to_string( CASE rb_build_agg(1) WHEN rb_build_agg(2) THEN rb_build_agg(2) WHEN 0x010101000000 THEN 1 END );
ERROR HY000: Invalid argument
SELECT CASE rb_build_agg(1) WHEN rb_build_agg(2) THEN 1 WHEN rb_build_agg(1) THEN 2 END;
ERROR 22000: Invalid data type for the operation
SELECT hex( CASE 1 WHEN 1 THEN rb_build_agg(1) WHEN 2 THEN rb_build_agg(2) END );
hex( CASE 1 WHEN 1 THEN rb_build_agg(1) WHEN 2 THEN rb_build_agg(2) END )
010101000000
SELECT hex( CASE 1 WHEN 1 THEN 0x010101000000 WHEN 2 THEN rb_build_agg(2) END );
hex( CASE 1 WHEN 1 THEN 0x010101000000 WHEN 2 THEN rb_build_agg(2) END )
010101000000
SELECT CASE rb_build_agg(1) WHEN rb_build_agg(2) THEN 1 WHEN rb_build_agg(1) THEN 2 END;
ERROR 22000: Invalid data type for the operation
select rb from tt2 where id = 1 union select rb from tt2 where id = 2;
ERROR 22000: Invalid data type for the operation
select rb from t1 union select rb from tt2;
ERROR 22000: Invalid data type for the operation
select rb from tt2 union select rb_from_string('1');
ERROR 22000: Invalid data type for the operation
select rb_build_empty() union select rb_from_string('1');
ERROR 22000: Invalid data type for the operation
select distinct rb_build_empty();
rb_build_empty()
 
create table tt4 (rb roaringbitmap);
select distinct rb from tt4;
ERROR 22000: Invalid data type for the operation
insert into tt4 values (rb_from_string('1,2'));
select distinct rb from tt4;
ERROR 22000: Invalid data type for the operation
select hex(IFNULL(null,rb_from_string('3')));
hex(IFNULL(null,rb_from_string('3')))
010103000000
select hex(IFNULL(rb_from_string('2'), rb_from_string('3')));
hex(IFNULL(rb_from_string('2'), rb_from_string('3')))
010102000000
select hex(IFNULL(x'0100', rb_from_string('3')));
ERROR 22000: Invalid data type for the operation
select hex(NULLIF(rb_build_agg(1),rb_from_string('1')));
ERROR HY000: Invalid argument
select hex(NULLIF(rb_from_string('1'),rb_from_string('3')));
ERROR HY000: Invalid argument
select hex(IF(false,rb_from_string('2'),rb_from_string('3')));
hex(IF(false,rb_from_string('2'),rb_from_string('3')))
010103000000
select hex(IF(true,rb_from_string('2'),rb_from_string('3')));
hex(IF(true,rb_from_string('2'),rb_from_string('3')))
010102000000
create table tt5 (id int primary key, rb roaringbitmap);
insert into tt5 values (1, rb_from_string('1'));
replace into tt5 values (1, rb_from_string('2'));
select id, hex(rb) from tt5;
id	hex(rb)
1	010102000000
select  rb_from_string('1,2') BETWEEN rb_from_string('1') and rb_from_string('1,2,3') from tt1;
ERROR 22000: Invalid data type for the operation
select * from tt1 where r BETWEEN r and r;
ERROR 22000: Invalid data type for the operation
select * from tt1 where r BETWEEN r and 'a';
ERROR 22000: Invalid data type for the operation
select nullif(cast(null as ROARINGBITMAP), null);
nullif(cast(null as ROARINGBITMAP), null)
NULL
drop table if exists t1;
drop table if exists tt1, tt2, tt3, tt4, tt5;
