purge recyclebin;
result_format: 4
########## 处理测试环境 ##########
drop user whh@'%';
drop database whh1;
create user whh identified by 'whh';
create database whh1;
grant all on *.* to whh with grant option;


# 修改租户级配置项,重写功能开启
alter system set enable_user_defined_rewrite_rules = 'ON';
set @@sql_mode='strict_all_tables';
purge recyclebin;
result_format: 4
>>>>>>>>>>>>>>>>>>>>>>>>>>> qr-mysql-4 测试的表对象	 <<<<<<<<<<<<<<<<<<<<<<<<<
drop table t1;
create table t1 (
  id int not null primary key,
  c1_char char(20),
  c2_vcha varchar(20),
  c3_text text,
  c4_enum enum('枚举','enum1','enum2','enum3') default null,
  c5_set1 set('集合','set1','set2','set3','set4') default null,
  index index1 (c1_char)
)charset = utf8mb4 partition by hash(id) partitions 3;
insert into t1 values(1,'char1','varchar1','text1','枚举','集合');
insert into t1 values(2,'char2','varchar2','text2','enum1','set1');
insert into t1 values(3,'char3','varchar3','text3','enum2','set2');
insert into t1 values(4,'char4','varchar4','text4','enum3','set3,set4');
drop table t2;
create table t2 (
  id int,
  c1_tint tinyint,
  c2_sint smallint,
  c3_mint mediumint,
  c4_bint bigint,
  c5_floa float,
  c6_doub double,
  c7_deci decimal,
  primary key(id,c1_tint),
  index index2 (id,c1_tint)
)partition by range (c1_tint) ( 
 partition p0 values less than (10), 
 partition p1 values less than (20), 
 partition p2 values less than maxvalue);
insert into t2 values(1,11,12,13,14,15.1,16.5,17.12);
Warnings:
Warning	1265	Data truncated for column 'c7_deci' at row 1
insert into t2 values(2,21,22,23,24,25.1,26.5,27.12);
Warnings:
Warning	1265	Data truncated for column 'c7_deci' at row 1
insert into t2 values(3,31,32,33,34,35.1,36.5,37.12);
Warnings:
Warning	1265	Data truncated for column 'c7_deci' at row 1
insert into t2 values(4,41,42,43,44,45.1,46.5,47.12);
Warnings:
Warning	1265	Data truncated for column 'c7_deci' at row 1
insert into t2 values(5,41,52,53,54,55.1,56.5,57.12);
Warnings:
Warning	1265	Data truncated for column 'c7_deci' at row 1
insert into t2 values(8,81,82,83,84,85.1,86.5,87.12);
Warnings:
Warning	1265	Data truncated for column 'c7_deci' at row 1
drop table t3;
create table t3 (
  id int not null,
  c1_year year default '2022',
  c2_time time,
  c3_date date,
  c4_dtim datetime,
  c5_tstam timestamp,
  primary key(id,c1_year,c3_date),
  unique index index3 (id,c1_year,c3_date)
)partition by list(dayofweek(c3_date))(
 partition p0 values in (1,2),
 partition p1 values in (3,4),
 partition p2 values in (5,6,7));
insert into t3 values(1,'2021','11:00:00','2021-10-01','2021-10-01 11:00:00','2021-10-01 11:00:00.123');
insert into t3 values(2,'2022','12:00:00','2022-10-02','2022-10-02 12:00:00','2022-10-02 12:00:00.123');
insert into t3 values(3,'2023','13:00:00','2023-10-03','2023-10-03 13:00:00','2023-10-03 13:00:00.123');
insert into t3 values(4,'2024','14:00:00','2024-10-03','2024-10-03 14:00:00','2024-10-04 14:00:00.123');
drop table t4;
create table t4 (
  id int not null,
  c1_tint tinyint,
  c2_vcha varchar(200),
  primary key (id,c1_tint)
)charset = utf8mb4 partition by key() partitions 3;
insert into t4 values(1,10,'查询');
insert into t4 values(2,20,'重写');
insert into t4 values(3,30,'测试');
insert into t4 values(4,40,'用例');
insert into t4 values(5,50,'mysql');
insert into t4 values(7,70,'table t4');
drop table t5;
create table t5 (
  id int not null,
  c1_tint tinyint,
  c2_vcha varchar(200),
  primary key (id,c1_tint)
)charset = utf8mb4 partition by key() partitions 3;
insert into t5 values(1,10,'查询');
insert into t5 values(2,20,'重写2');
insert into t5 values(3,30,'测试2');
insert into t5 values(5,50,'mysql');
insert into t5 values(6,60,'table t4');
drop view v1;
create view v1 as select * from t2;
#### pattern，replacement(参数标记个数，参数标记位置,语句模板)
######## 标签：qr-mysql-3-1 1、SELECT语句
## 视图
call dbms_udr.create_rule('rule0','whh1','select * from v1 where id = ?', 'select * from v1 where id > ? order by id desc','YES');
select * from v1 where id = 2;
+----+---------+---------+---------+---------+---------+---------+---------+
| id | c1_tint | c2_sint | c3_mint | c4_bint | c5_floa | c6_doub | c7_deci |
+----+---------+---------+---------+---------+---------+---------+---------+
|  8 |      81 |      82 |      83 |      84 |    85.1 |    86.5 |      87 |
|  5 |      41 |      52 |      53 |      54 |    55.1 |    56.5 |      57 |
|  4 |      41 |      42 |      43 |      44 |    45.1 |    46.5 |      47 |
|  3 |      31 |      32 |      33 |      34 |    35.1 |    36.5 |      37 |
+----+---------+---------+---------+---------+---------+---------+---------+
select * from v1 where id = 1+1;
+----+---------+---------+---------+---------+---------+---------+---------+
| id | c1_tint | c2_sint | c3_mint | c4_bint | c5_floa | c6_doub | c7_deci |
+----+---------+---------+---------+---------+---------+---------+---------+
|  2 |      21 |      22 |      23 |      24 |    25.1 |    26.5 |      27 |
+----+---------+---------+---------+---------+---------+---------+---------+
select * from v1 where id = 2 and c1_tint> 10;
+----+---------+---------+---------+---------+---------+---------+---------+
| id | c1_tint | c2_sint | c3_mint | c4_bint | c5_floa | c6_doub | c7_deci |
+----+---------+---------+---------+---------+---------+---------+---------+
|  2 |      21 |      22 |      23 |      24 |    25.1 |    26.5 |      27 |
+----+---------+---------+---------+---------+---------+---------+---------+
select * from v1 where id = 2 order by id;
+----+---------+---------+---------+---------+---------+---------+---------+
| id | c1_tint | c2_sint | c3_mint | c4_bint | c5_floa | c6_doub | c7_deci |
+----+---------+---------+---------+---------+---------+---------+---------+
|  2 |      21 |      22 |      23 |      24 |    25.1 |    26.5 |      27 |
+----+---------+---------+---------+---------+---------+---------+---------+
select id,c1_tint,c2_sint from v1 where id = 2;
+----+---------+---------+
| id | c1_tint | c2_sint |
+----+---------+---------+
|  2 |      21 |      22 |
+----+---------+---------+
call dbms_udr.remove_rule ('rule0');
call dbms_udr.create_rule('rule1','whh1','select * from v1 where c1_tint between :A and :B', 'select * from v1 where c1_tint between :A and :A+:B order by id desc','YES');
select * from v1 where c1_tint between 11 and 21;
+----+---------+---------+---------+---------+---------+---------+---------+
| id | c1_tint | c2_sint | c3_mint | c4_bint | c5_floa | c6_doub | c7_deci |
+----+---------+---------+---------+---------+---------+---------+---------+
|  3 |      31 |      32 |      33 |      34 |    35.1 |    36.5 |      37 |
|  2 |      21 |      22 |      23 |      24 |    25.1 |    26.5 |      27 |
|  1 |      11 |      12 |      13 |      14 |    15.1 |    16.5 |      17 |
+----+---------+---------+---------+---------+---------+---------+---------+
select * from v1 where c1_tint between 11 and 1+21 order by id;
+----+---------+---------+---------+---------+---------+---------+---------+
| id | c1_tint | c2_sint | c3_mint | c4_bint | c5_floa | c6_doub | c7_deci |
+----+---------+---------+---------+---------+---------+---------+---------+
|  1 |      11 |      12 |      13 |      14 |    15.1 |    16.5 |      17 |
|  2 |      21 |      22 |      23 |      24 |    25.1 |    26.5 |      27 |
+----+---------+---------+---------+---------+---------+---------+---------+
select * from v1 where c1_tint between 11 and 21 or c2_sint > 10 order by id;
+----+---------+---------+---------+---------+---------+---------+---------+
| id | c1_tint | c2_sint | c3_mint | c4_bint | c5_floa | c6_doub | c7_deci |
+----+---------+---------+---------+---------+---------+---------+---------+
|  1 |      11 |      12 |      13 |      14 |    15.1 |    16.5 |      17 |
|  2 |      21 |      22 |      23 |      24 |    25.1 |    26.5 |      27 |
|  3 |      31 |      32 |      33 |      34 |    35.1 |    36.5 |      37 |
|  4 |      41 |      42 |      43 |      44 |    45.1 |    46.5 |      47 |
|  5 |      41 |      52 |      53 |      54 |    55.1 |    56.5 |      57 |
|  8 |      81 |      82 |      83 |      84 |    85.1 |    86.5 |      87 |
+----+---------+---------+---------+---------+---------+---------+---------+
select * from v1 where c1_tint between 11 and 21 order by id;
+----+---------+---------+---------+---------+---------+---------+---------+
| id | c1_tint | c2_sint | c3_mint | c4_bint | c5_floa | c6_doub | c7_deci |
+----+---------+---------+---------+---------+---------+---------+---------+
|  1 |      11 |      12 |      13 |      14 |    15.1 |    16.5 |      17 |
|  2 |      21 |      22 |      23 |      24 |    25.1 |    26.5 |      27 |
+----+---------+---------+---------+---------+---------+---------+---------+
select id,c1_tint,c2_sint from v1 where c1_tint between 11 and 21;
+----+---------+---------+
| id | c1_tint | c2_sint |
+----+---------+---------+
|  1 |      11 |      12 |
|  2 |      21 |      22 |
+----+---------+---------+
call dbms_udr.remove_rule ('rule1');
#### SELECT ... INTO 语句
call dbms_udr.create_rule('rule2','whh1','select :A into @p from dual', 'select concat("query rewrite-",:A) into @p from dual','YES');
select 'whh1' into @p from dual;
select @p;
+--------------------+
| @p                 |
+--------------------+
| query rewrite-whh1 |
+--------------------+
select 'whh1' into @p1 from dual;
select @p1;
+------+
| @p1  |
+------+
| whh1 |
+------+
call dbms_udr.remove_rule ('rule2');
#### WHERE子句 (普通表达式)
call dbms_udr.create_rule('rule3','whh1','select * from t1 where id = ?', 'select "query rewrite",* from t1 where id >= ?  order by id desc limit 3','YES');
select * from t1 where id = 1;
+---------------+----+---------+----------+---------+---------+-----------+
| query rewrite | id | c1_char | c2_vcha  | c3_text | c4_enum | c5_set1   |
+---------------+----+---------+----------+---------+---------+-----------+
| query rewrite |  4 | char4   | varchar4 | text4   | enum3   | set3,set4 |
| query rewrite |  3 | char3   | varchar3 | text3   | enum2   | set2      |
| query rewrite |  2 | char2   | varchar2 | text2   | enum1   | set1      |
+---------------+----+---------+----------+---------+---------+-----------+
select * from t1 where id = 1+1;
+----+---------+----------+---------+---------+---------+
| id | c1_char | c2_vcha  | c3_text | c4_enum | c5_set1 |
+----+---------+----------+---------+---------+---------+
|  2 | char2   | varchar2 | text2   | enum1   | set1    |
+----+---------+----------+---------+---------+---------+
select * from t1 where id = 1 or c1_char is not NULL order by id;
+----+---------+----------+---------+---------+-----------+
| id | c1_char | c2_vcha  | c3_text | c4_enum | c5_set1   |
+----+---------+----------+---------+---------+-----------+
|  1 | char1   | varchar1 | text1   | 枚举    | 集合      |
|  2 | char2   | varchar2 | text2   | enum1   | set1      |
|  3 | char3   | varchar3 | text3   | enum2   | set2      |
|  4 | char4   | varchar4 | text4   | enum3   | set3,set4 |
+----+---------+----------+---------+---------+-----------+
select * from t1 where abs(id) = 1;
+----+---------+----------+---------+---------+---------+
| id | c1_char | c2_vcha  | c3_text | c4_enum | c5_set1 |
+----+---------+----------+---------+---------+---------+
|  1 | char1   | varchar1 | text1   | 枚举    | 集合    |
+----+---------+----------+---------+---------+---------+
select c1_char from t1 where id = 1;
+---------+
| c1_char |
+---------+
| char1   |
+---------+
call dbms_udr.remove_rule ('rule3');
call dbms_udr.create_rule('rule4','whh1','select * from t1 where id in (?)', 'select "query rewrite",* from t1 where id in (?+1) order by id desc','YES');
select * from t1 where id in (1);
+---------------+----+---------+----------+---------+---------+---------+
| query rewrite | id | c1_char | c2_vcha  | c3_text | c4_enum | c5_set1 |
+---------------+----+---------+----------+---------+---------+---------+
| query rewrite |  2 | char2   | varchar2 | text2   | enum1   | set1    |
+---------------+----+---------+----------+---------+---------+---------+
select * from t1 where id in (1+1);
+----+---------+----------+---------+---------+---------+
| id | c1_char | c2_vcha  | c3_text | c4_enum | c5_set1 |
+----+---------+----------+---------+---------+---------+
|  2 | char2   | varchar2 | text2   | enum1   | set1    |
+----+---------+----------+---------+---------+---------+
select * from t1 where id in (1,2);
+----+---------+----------+---------+---------+---------+
| id | c1_char | c2_vcha  | c3_text | c4_enum | c5_set1 |
+----+---------+----------+---------+---------+---------+
|  1 | char1   | varchar1 | text1   | 枚举    | 集合    |
|  2 | char2   | varchar2 | text2   | enum1   | set1    |
+----+---------+----------+---------+---------+---------+
select * from t1 where abs(id) in (1);
+----+---------+----------+---------+---------+---------+
| id | c1_char | c2_vcha  | c3_text | c4_enum | c5_set1 |
+----+---------+----------+---------+---------+---------+
|  1 | char1   | varchar1 | text1   | 枚举    | 集合    |
+----+---------+----------+---------+---------+---------+
select c1_char from t1 where id in (1);
+---------+
| c1_char |
+---------+
| char1   |
+---------+
call dbms_udr.remove_rule ('rule4');
call dbms_udr.create_rule('rule5','whh1','select c2_vcha from t1 where c2_vcha like ?', 'select "query rewrite",upper(c2_vcha) from t1 where c2_vcha like ? order by id desc','YES');
select c2_vcha from t1 where c2_vcha like '%var%';
+---------------+----------------+
| query rewrite | upper(c2_vcha) |
+---------------+----------------+
| query rewrite | VARCHAR4       |
| query rewrite | VARCHAR3       |
| query rewrite | VARCHAR2       |
| query rewrite | VARCHAR1       |
+---------------+----------------+
select c2_vcha from t1 where c2_vcha like '%var%' limit 1;
+----------+
| c2_vcha  |
+----------+
| varchar3 |
+----------+
select c2_vcha from t1 where left(c2_vcha,5) like '%var%' order by id;
+----------+
| c2_vcha  |
+----------+
| varchar1 |
| varchar2 |
| varchar3 |
| varchar4 |
+----------+
select c2_vcha from t1 where c2_vcha like '%var%' or id > 2 order by id;
+----------+
| c2_vcha  |
+----------+
| varchar1 |
| varchar2 |
| varchar3 |
| varchar4 |
+----------+
select * from t1 where c2_vcha like '%var%' order by id;
+----+---------+----------+---------+---------+-----------+
| id | c1_char | c2_vcha  | c3_text | c4_enum | c5_set1   |
+----+---------+----------+---------+---------+-----------+
|  1 | char1   | varchar1 | text1   | 枚举    | 集合      |
|  2 | char2   | varchar2 | text2   | enum1   | set1      |
|  3 | char3   | varchar3 | text3   | enum2   | set2      |
|  4 | char4   | varchar4 | text4   | enum3   | set3,set4 |
+----+---------+----------+---------+---------+-----------+
call dbms_udr.remove_rule ('rule5');
call dbms_udr.create_rule('rule6','whh1','select * from t1 where id > any (select ? from dual)', 'select "query rewrite",* from t1 where id > any (select ?+1 from dual) order by id desc','YES');
select * from t1 where id > any (select 1 from dual);
+---------------+----+---------+----------+---------+---------+-----------+
| query rewrite | id | c1_char | c2_vcha  | c3_text | c4_enum | c5_set1   |
+---------------+----+---------+----------+---------+---------+-----------+
| query rewrite |  4 | char4   | varchar4 | text4   | enum3   | set3,set4 |
| query rewrite |  3 | char3   | varchar3 | text3   | enum2   | set2      |
+---------------+----+---------+----------+---------+---------+-----------+
select * from t1 where id > any (select 1 from dual) order by id limit 2;
+----+---------+----------+---------+---------+---------+
| id | c1_char | c2_vcha  | c3_text | c4_enum | c5_set1 |
+----+---------+----------+---------+---------+---------+
|  2 | char2   | varchar2 | text2   | enum1   | set1    |
|  3 | char3   | varchar3 | text3   | enum2   | set2    |
+----+---------+----------+---------+---------+---------+
select * from t1 where id > any (select 1 from dual limit 1) order by id;
+----+---------+----------+---------+---------+-----------+
| id | c1_char | c2_vcha  | c3_text | c4_enum | c5_set1   |
+----+---------+----------+---------+---------+-----------+
|  2 | char2   | varchar2 | text2   | enum1   | set1      |
|  3 | char3   | varchar3 | text3   | enum2   | set2      |
|  4 | char4   | varchar4 | text4   | enum3   | set3,set4 |
+----+---------+----------+---------+---------+-----------+
select c1_char from t1 where id > any (select 1 from dual) order by id;
+---------+
| c1_char |
+---------+
| char2   |
| char3   |
| char4   |
+---------+
call dbms_udr.remove_rule ('rule6');
call dbms_udr.create_rule('rule7','whh1','select * from t1 where exists (select * from t1 where id < ?)', 'select "query rewrite",* from t1 where not exists (select * from t1 where id < ? ) order by id desc','YES');
select * from t1 where exists (select * from t1 where id < 1);
+---------------+----+---------+----------+---------+---------+-----------+
| query rewrite | id | c1_char | c2_vcha  | c3_text | c4_enum | c5_set1   |
+---------------+----+---------+----------+---------+---------+-----------+
| query rewrite |  4 | char4   | varchar4 | text4   | enum3   | set3,set4 |
| query rewrite |  3 | char3   | varchar3 | text3   | enum2   | set2      |
| query rewrite |  2 | char2   | varchar2 | text2   | enum1   | set1      |
| query rewrite |  1 | char1   | varchar1 | text1   | 枚举    | 集合      |
+---------------+----+---------+----------+---------+---------+-----------+
select * from t1 where exists (select * from t1 where id < 1-1);
+----+---------+---------+---------+---------+---------+
| id | c1_char | c2_vcha | c3_text | c4_enum | c5_set1 |
+----+---------+---------+---------+---------+---------+
+----+---------+---------+---------+---------+---------+
select * from t1 where exists (select * from t1 where id < 1 or c1_char is not null) order by id;
+----+---------+----------+---------+---------+-----------+
| id | c1_char | c2_vcha  | c3_text | c4_enum | c5_set1   |
+----+---------+----------+---------+---------+-----------+
|  1 | char1   | varchar1 | text1   | 枚举    | 集合      |
|  2 | char2   | varchar2 | text2   | enum1   | set1      |
|  3 | char3   | varchar3 | text3   | enum2   | set2      |
|  4 | char4   | varchar4 | text4   | enum3   | set3,set4 |
+----+---------+----------+---------+---------+-----------+
select * from t1 where exists (select * from t1 where id < 1) or c1_char is not null order by id;
+----+---------+----------+---------+---------+-----------+
| id | c1_char | c2_vcha  | c3_text | c4_enum | c5_set1   |
+----+---------+----------+---------+---------+-----------+
|  1 | char1   | varchar1 | text1   | 枚举    | 集合      |
|  2 | char2   | varchar2 | text2   | enum1   | set1      |
|  3 | char3   | varchar3 | text3   | enum2   | set2      |
|  4 | char4   | varchar4 | text4   | enum3   | set3,set4 |
+----+---------+----------+---------+---------+-----------+
call dbms_udr.remove_rule ('rule7');
call dbms_udr.create_rule('rule8','whh1','select * from t1 where id between :A and :B+1', 'select "query rewrite",* from t1 where id between :A and :B+2 order by id desc','YES');
select * from t1 where id between 1 and 1;
+----+---------+----------+---------+---------+---------+
| id | c1_char | c2_vcha  | c3_text | c4_enum | c5_set1 |
+----+---------+----------+---------+---------+---------+
|  1 | char1   | varchar1 | text1   | 枚举    | 集合    |
+----+---------+----------+---------+---------+---------+
select * from t1 where id between 1 and 1+1;
+---------------+----+---------+----------+---------+---------+---------+
| query rewrite | id | c1_char | c2_vcha  | c3_text | c4_enum | c5_set1 |
+---------------+----+---------+----------+---------+---------+---------+
| query rewrite |  3 | char3   | varchar3 | text3   | enum2   | set2    |
| query rewrite |  2 | char2   | varchar2 | text2   | enum1   | set1    |
| query rewrite |  1 | char1   | varchar1 | text1   | 枚举    | 集合    |
+---------------+----+---------+----------+---------+---------+---------+
select * from t1 where id between 1 and 1+1 order by id;
+----+---------+----------+---------+---------+---------+
| id | c1_char | c2_vcha  | c3_text | c4_enum | c5_set1 |
+----+---------+----------+---------+---------+---------+
|  1 | char1   | varchar1 | text1   | 枚举    | 集合    |
|  2 | char2   | varchar2 | text2   | enum1   | set1    |
+----+---------+----------+---------+---------+---------+
call dbms_udr.remove_rule ('rule8');
call dbms_udr.create_rule('rule9','whh1','select * from t2 where (c1_tint,c2_sint) in ((:A,:B))', 'select "query rewrite",* from t2 where (c1_tint,c2_sint) in ((:A,:B),(:A+10,:B+10)) order by id desc','YES');
select * from t2 where (c1_tint,c2_sint) in ((11,12));
+---------------+----+---------+---------+---------+---------+---------+---------+---------+
| query rewrite | id | c1_tint | c2_sint | c3_mint | c4_bint | c5_floa | c6_doub | c7_deci |
+---------------+----+---------+---------+---------+---------+---------+---------+---------+
| query rewrite |  2 |      21 |      22 |      23 |      24 |    25.1 |    26.5 |      27 |
| query rewrite |  1 |      11 |      12 |      13 |      14 |    15.1 |    16.5 |      17 |
+---------------+----+---------+---------+---------+---------+---------+---------+---------+
select * from t2 where (c1_tint,c2_sint) in ((11,11+1));
+----+---------+---------+---------+---------+---------+---------+---------+
| id | c1_tint | c2_sint | c3_mint | c4_bint | c5_floa | c6_doub | c7_deci |
+----+---------+---------+---------+---------+---------+---------+---------+
|  1 |      11 |      12 |      13 |      14 |    15.1 |    16.5 |      17 |
+----+---------+---------+---------+---------+---------+---------+---------+
select * from t2 where (c1_tint,c2_sint) in ((11,12)) and c1_tint is not null;
+----+---------+---------+---------+---------+---------+---------+---------+
| id | c1_tint | c2_sint | c3_mint | c4_bint | c5_floa | c6_doub | c7_deci |
+----+---------+---------+---------+---------+---------+---------+---------+
|  1 |      11 |      12 |      13 |      14 |    15.1 |    16.5 |      17 |
+----+---------+---------+---------+---------+---------+---------+---------+
select * from t2 where c1_tint is not null and (c1_tint,c2_sint) in ((11,12));
+----+---------+---------+---------+---------+---------+---------+---------+
| id | c1_tint | c2_sint | c3_mint | c4_bint | c5_floa | c6_doub | c7_deci |
+----+---------+---------+---------+---------+---------+---------+---------+
|  1 |      11 |      12 |      13 |      14 |    15.1 |    16.5 |      17 |
+----+---------+---------+---------+---------+---------+---------+---------+
call dbms_udr.remove_rule ('rule9');
# <、<=、>、>=、=、!=、<>
call dbms_udr.create_rule('rule1','whh1','select id from t2 where id < ?', 'select * from t2 where id <= ?+2 order by id desc','YES');
select id from t2 where id < 2;
+----+---------+---------+---------+---------+---------+---------+---------+
| id | c1_tint | c2_sint | c3_mint | c4_bint | c5_floa | c6_doub | c7_deci |
+----+---------+---------+---------+---------+---------+---------+---------+
|  4 |      41 |      42 |      43 |      44 |    45.1 |    46.5 |      47 |
|  3 |      31 |      32 |      33 |      34 |    35.1 |    36.5 |      37 |
|  2 |      21 |      22 |      23 |      24 |    25.1 |    26.5 |      27 |
|  1 |      11 |      12 |      13 |      14 |    15.1 |    16.5 |      17 |
+----+---------+---------+---------+---------+---------+---------+---------+
call dbms_udr.remove_rule ('rule1');
call dbms_udr.create_rule('rule2','whh1','select id from t2 where id <= ?', 'select * from t2 where id < ?-1 order by id desc','YES');
select id from t2 where id <= 3;
+----+---------+---------+---------+---------+---------+---------+---------+
| id | c1_tint | c2_sint | c3_mint | c4_bint | c5_floa | c6_doub | c7_deci |
+----+---------+---------+---------+---------+---------+---------+---------+
|  1 |      11 |      12 |      13 |      14 |    15.1 |    16.5 |      17 |
+----+---------+---------+---------+---------+---------+---------+---------+
call dbms_udr.remove_rule ('rule2');
call dbms_udr.create_rule('rule3','whh1','select id from t2 where id > :a', 'select * from t2 where id >= :a*2 order by id desc','YES');
select id from t2 where id > 2;
+----+---------+---------+---------+---------+---------+---------+---------+
| id | c1_tint | c2_sint | c3_mint | c4_bint | c5_floa | c6_doub | c7_deci |
+----+---------+---------+---------+---------+---------+---------+---------+
|  8 |      81 |      82 |      83 |      84 |    85.1 |    86.5 |      87 |
|  5 |      41 |      52 |      53 |      54 |    55.1 |    56.5 |      57 |
|  4 |      41 |      42 |      43 |      44 |    45.1 |    46.5 |      47 |
+----+---------+---------+---------+---------+---------+---------+---------+
call dbms_udr.remove_rule ('rule3');
call dbms_udr.create_rule('rule4','whh1','select id from t2 where id >= :a', 'select * from t2 where id > :a/2 order by id desc','YES');
select id from t2 where id >= 4;
+----+---------+---------+---------+---------+---------+---------+---------+
| id | c1_tint | c2_sint | c3_mint | c4_bint | c5_floa | c6_doub | c7_deci |
+----+---------+---------+---------+---------+---------+---------+---------+
|  8 |      81 |      82 |      83 |      84 |    85.1 |    86.5 |      87 |
|  5 |      41 |      52 |      53 |      54 |    55.1 |    56.5 |      57 |
|  4 |      41 |      42 |      43 |      44 |    45.1 |    46.5 |      47 |
|  3 |      31 |      32 |      33 |      34 |    35.1 |    36.5 |      37 |
+----+---------+---------+---------+---------+---------+---------+---------+
call dbms_udr.remove_rule ('rule4');
call dbms_udr.create_rule('rule5','whh1','select id from t2 where c3_mint != :a', 'select * from t2 where c3_mint != :a+10 order by id desc','YES');
select id from t2 where c3_mint != 13;
+----+---------+---------+---------+---------+---------+---------+---------+
| id | c1_tint | c2_sint | c3_mint | c4_bint | c5_floa | c6_doub | c7_deci |
+----+---------+---------+---------+---------+---------+---------+---------+
|  8 |      81 |      82 |      83 |      84 |    85.1 |    86.5 |      87 |
|  5 |      41 |      52 |      53 |      54 |    55.1 |    56.5 |      57 |
|  4 |      41 |      42 |      43 |      44 |    45.1 |    46.5 |      47 |
|  3 |      31 |      32 |      33 |      34 |    35.1 |    36.5 |      37 |
|  1 |      11 |      12 |      13 |      14 |    15.1 |    16.5 |      17 |
+----+---------+---------+---------+---------+---------+---------+---------+
select id from t2 where c3_mint != 33;
+----+---------+---------+---------+---------+---------+---------+---------+
| id | c1_tint | c2_sint | c3_mint | c4_bint | c5_floa | c6_doub | c7_deci |
+----+---------+---------+---------+---------+---------+---------+---------+
|  8 |      81 |      82 |      83 |      84 |    85.1 |    86.5 |      87 |
|  5 |      41 |      52 |      53 |      54 |    55.1 |    56.5 |      57 |
|  3 |      31 |      32 |      33 |      34 |    35.1 |    36.5 |      37 |
|  2 |      21 |      22 |      23 |      24 |    25.1 |    26.5 |      27 |
|  1 |      11 |      12 |      13 |      14 |    15.1 |    16.5 |      17 |
+----+---------+---------+---------+---------+---------+---------+---------+
call dbms_udr.remove_rule ('rule5');
call dbms_udr.create_rule('rule6','whh1','select id from t2 where id <> :a', 'select * from t2 where id <> :a+1 order by id desc','YES');
select id from t2 where id <> 1;
+----+---------+---------+---------+---------+---------+---------+---------+
| id | c1_tint | c2_sint | c3_mint | c4_bint | c5_floa | c6_doub | c7_deci |
+----+---------+---------+---------+---------+---------+---------+---------+
|  8 |      81 |      82 |      83 |      84 |    85.1 |    86.5 |      87 |
|  5 |      41 |      52 |      53 |      54 |    55.1 |    56.5 |      57 |
|  4 |      41 |      42 |      43 |      44 |    45.1 |    46.5 |      47 |
|  3 |      31 |      32 |      33 |      34 |    35.1 |    36.5 |      37 |
|  1 |      11 |      12 |      13 |      14 |    15.1 |    16.5 |      17 |
+----+---------+---------+---------+---------+---------+---------+---------+
call dbms_udr.remove_rule ('rule6');
#### GROUP BY子句，HAVING子句
call dbms_udr.create_rule('rule10','whh1','select * from t2 group by c1_tint having c1_tint > ?', 'select "query rewrite",* from t2 group by c1_tint having count(c1_tint) >= ? order by id desc','YES');
select * from t2 group by c1_tint having c1_tint > 1;
+---------------+----+---------+---------+---------+---------+---------+---------+---------+
| query rewrite | id | c1_tint | c2_sint | c3_mint | c4_bint | c5_floa | c6_doub | c7_deci |
+---------------+----+---------+---------+---------+---------+---------+---------+---------+
| query rewrite |  8 |      81 |      82 |      83 |      84 |    85.1 |    86.5 |      87 |
| query rewrite |  5 |      41 |      52 |      53 |      54 |    55.1 |    56.5 |      57 |
| query rewrite |  3 |      31 |      32 |      33 |      34 |    35.1 |    36.5 |      37 |
| query rewrite |  2 |      21 |      22 |      23 |      24 |    25.1 |    26.5 |      27 |
| query rewrite |  1 |      11 |      12 |      13 |      14 |    15.1 |    16.5 |      17 |
+---------------+----+---------+---------+---------+---------+---------+---------+---------+
select * from t2 group by c1_tint having c1_tint > 1 order by id desc;
+----+---------+---------+---------+---------+---------+---------+---------+
| id | c1_tint | c2_sint | c3_mint | c4_bint | c5_floa | c6_doub | c7_deci |
+----+---------+---------+---------+---------+---------+---------+---------+
|  8 |      81 |      82 |      83 |      84 |    85.1 |    86.5 |      87 |
|  5 |      41 |      52 |      53 |      54 |    55.1 |    56.5 |      57 |
|  3 |      31 |      32 |      33 |      34 |    35.1 |    36.5 |      37 |
|  2 |      21 |      22 |      23 |      24 |    25.1 |    26.5 |      27 |
|  1 |      11 |      12 |      13 |      14 |    15.1 |    16.5 |      17 |
+----+---------+---------+---------+---------+---------+---------+---------+
select * from t2 group by c1_tint having c1_tint > 1 and c2_sint = 22;
+----+---------+---------+---------+---------+---------+---------+---------+
| id | c1_tint | c2_sint | c3_mint | c4_bint | c5_floa | c6_doub | c7_deci |
+----+---------+---------+---------+---------+---------+---------+---------+
|  2 |      21 |      22 |      23 |      24 |    25.1 |    26.5 |      27 |
+----+---------+---------+---------+---------+---------+---------+---------+
call dbms_udr.remove_rule ('rule10');
#### LIMIT子句
call dbms_udr.create_rule('rule11','whh1','select * from t3 limit ?', 'select "query rewrite",* from t3  order by id desc limit ?','YES');
select * from t3 limit 2;
+---------------+----+---------+----------+------------+---------------------+---------------------+
| query rewrite | id | c1_year | c2_time  | c3_date    | c4_dtim             | c5_tstam            |
+---------------+----+---------+----------+------------+---------------------+---------------------+
| query rewrite |  4 |    2024 | 14:00:00 | 2024-10-03 | 2024-10-03 14:00:00 | 2024-10-04 14:00:00 |
| query rewrite |  3 |    2023 | 13:00:00 | 2023-10-03 | 2023-10-03 13:00:00 | 2023-10-03 13:00:00 |
+---------------+----+---------+----------+------------+---------------------+---------------------+
select * from t3 limit 2,1;
+----+---------+----------+------------+---------------------+---------------------+
| id | c1_year | c2_time  | c3_date    | c4_dtim             | c5_tstam            |
+----+---------+----------+------------+---------------------+---------------------+
|  2 |    2022 | 12:00:00 | 2022-10-02 | 2022-10-02 12:00:00 | 2022-10-02 12:00:00 |
+----+---------+----------+------------+---------------------+---------------------+
select * from t3 order by id desc limit 2;
+----+---------+----------+------------+---------------------+---------------------+
| id | c1_year | c2_time  | c3_date    | c4_dtim             | c5_tstam            |
+----+---------+----------+------------+---------------------+---------------------+
|  4 |    2024 | 14:00:00 | 2024-10-03 | 2024-10-03 14:00:00 | 2024-10-04 14:00:00 |
|  3 |    2023 | 13:00:00 | 2023-10-03 | 2023-10-03 13:00:00 | 2023-10-03 13:00:00 |
+----+---------+----------+------------+---------------------+---------------------+
call dbms_udr.remove_rule ('rule11');
call dbms_udr.create_rule('rule11','whh1','select * from t3 limit ?,?', 'select "query rewrite",* from t3 order by id desc limit ?,?','YES');
select * from t3 limit 1;
+----+---------+----------+------------+---------------------+---------------------+
| id | c1_year | c2_time  | c3_date    | c4_dtim             | c5_tstam            |
+----+---------+----------+------------+---------------------+---------------------+
|  1 |    2021 | 11:00:00 | 2021-10-01 | 2021-10-01 11:00:00 | 2021-10-01 11:00:00 |
+----+---------+----------+------------+---------------------+---------------------+
select * from t3 limit 1,2;
+---------------+----+---------+----------+------------+---------------------+---------------------+
| query rewrite | id | c1_year | c2_time  | c3_date    | c4_dtim             | c5_tstam            |
+---------------+----+---------+----------+------------+---------------------+---------------------+
| query rewrite |  3 |    2023 | 13:00:00 | 2023-10-03 | 2023-10-03 13:00:00 | 2023-10-03 13:00:00 |
| query rewrite |  2 |    2022 | 12:00:00 | 2022-10-02 | 2022-10-02 12:00:00 | 2022-10-02 12:00:00 |
+---------------+----+---------+----------+------------+---------------------+---------------------+
select * from t3 order by id desc limit 1,2;
+----+---------+----------+------------+---------------------+---------------------+
| id | c1_year | c2_time  | c3_date    | c4_dtim             | c5_tstam            |
+----+---------+----------+------------+---------------------+---------------------+
|  3 |    2023 | 13:00:00 | 2023-10-03 | 2023-10-03 13:00:00 | 2023-10-03 13:00:00 |
|  2 |    2022 | 12:00:00 | 2022-10-02 | 2022-10-02 12:00:00 | 2022-10-02 12:00:00 |
+----+---------+----------+------------+---------------------+---------------------+
call dbms_udr.remove_rule ('rule11');
call dbms_udr.create_rule('rule11','whh1','select * from t3 limit :A,:B', 'select "query rewrite",* from t3  order by id desc limit :B,:A','YES');
select * from t3 limit 1,2;
+---------------+----+---------+----------+------------+---------------------+---------------------+
| query rewrite | id | c1_year | c2_time  | c3_date    | c4_dtim             | c5_tstam            |
+---------------+----+---------+----------+------------+---------------------+---------------------+
| query rewrite |  2 |    2022 | 12:00:00 | 2022-10-02 | 2022-10-02 12:00:00 | 2022-10-02 12:00:00 |
+---------------+----+---------+----------+------------+---------------------+---------------------+
select * from t3 order by id limit 1,2;
+----+---------+----------+------------+---------------------+---------------------+
| id | c1_year | c2_time  | c3_date    | c4_dtim             | c5_tstam            |
+----+---------+----------+------------+---------------------+---------------------+
|  2 |    2022 | 12:00:00 | 2022-10-02 | 2022-10-02 12:00:00 | 2022-10-02 12:00:00 |
|  3 |    2023 | 13:00:00 | 2023-10-03 | 2023-10-03 13:00:00 | 2023-10-03 13:00:00 |
+----+---------+----------+------------+---------------------+---------------------+
call dbms_udr.remove_rule ('rule11');
#### JOIN 子句
call dbms_udr.create_rule('rule12','whh1','select * from t2 left join t4 on t2.id=t4.id where t2.id = ?', 'select * from t2 right join t4 on t2.id=t4.id where t4.id >= ? order by t2.id desc','YES');
select * from t2 left join t4 on t2.id=t4.id where t2.id = 2;
+----+---------+---------+---------+---------+---------+---------+---------+----+---------+----------+
| id | c1_tint | c2_sint | c3_mint | c4_bint | c5_floa | c6_doub | c7_deci | id | c1_tint | c2_vcha  |
+----+---------+---------+---------+---------+---------+---------+---------+----+---------+----------+
|  5 |      41 |      52 |      53 |      54 |    55.1 |    56.5 |      57 |  5 |      50 | mysql    |
|  4 |      41 |      42 |      43 |      44 |    45.1 |    46.5 |      47 |  4 |      40 | 用例     |
|  3 |      31 |      32 |      33 |      34 |    35.1 |    36.5 |      37 |  3 |      30 | 测试     |
|  2 |      21 |      22 |      23 |      24 |    25.1 |    26.5 |      27 |  2 |      20 | 重写     |
| NULL |    NULL |    NULL |    NULL |    NULL |    NULL |    NULL |    NULL |  7 |      70 | table t4 |
+----+---------+---------+---------+---------+---------+---------+---------+----+---------+----------+
select * from t2 left join t4 on t2.id=t4.id where t2.id = 1+1;
+----+---------+---------+---------+---------+---------+---------+---------+----+---------+---------+
| id | c1_tint | c2_sint | c3_mint | c4_bint | c5_floa | c6_doub | c7_deci | id | c1_tint | c2_vcha |
+----+---------+---------+---------+---------+---------+---------+---------+----+---------+---------+
|  2 |      21 |      22 |      23 |      24 |    25.1 |    26.5 |      27 |  2 |      20 | 重写    |
+----+---------+---------+---------+---------+---------+---------+---------+----+---------+---------+
select * from t2 left join t4 on t2.id=t4.id where t2.id = 2 order by t2.id;
+----+---------+---------+---------+---------+---------+---------+---------+----+---------+---------+
| id | c1_tint | c2_sint | c3_mint | c4_bint | c5_floa | c6_doub | c7_deci | id | c1_tint | c2_vcha |
+----+---------+---------+---------+---------+---------+---------+---------+----+---------+---------+
|  2 |      21 |      22 |      23 |      24 |    25.1 |    26.5 |      27 |  2 |      20 | 重写    |
+----+---------+---------+---------+---------+---------+---------+---------+----+---------+---------+
call dbms_udr.remove_rule ('rule12');
call dbms_udr.create_rule('rule13','whh1','select * from t2 right join t4 on t2.id=t4.id where t4.id = ?', 'select * from t2 left join t4 on t2.id=t4.id where t2.id >= ? order by t2.id desc','YES');
select * from t2 right join t4 on t2.id=t4.id where t4.id = 1;
+----+---------+---------+---------+---------+---------+---------+---------+----+---------+---------+
| id | c1_tint | c2_sint | c3_mint | c4_bint | c5_floa | c6_doub | c7_deci | id | c1_tint | c2_vcha |
+----+---------+---------+---------+---------+---------+---------+---------+----+---------+---------+
|  8 |      81 |      82 |      83 |      84 |    85.1 |    86.5 |      87 | NULL |    NULL | NULL    |
|  5 |      41 |      52 |      53 |      54 |    55.1 |    56.5 |      57 |  5 |      50 | mysql   |
|  4 |      41 |      42 |      43 |      44 |    45.1 |    46.5 |      47 |  4 |      40 | 用例    |
|  3 |      31 |      32 |      33 |      34 |    35.1 |    36.5 |      37 |  3 |      30 | 测试    |
|  2 |      21 |      22 |      23 |      24 |    25.1 |    26.5 |      27 |  2 |      20 | 重写    |
|  1 |      11 |      12 |      13 |      14 |    15.1 |    16.5 |      17 |  1 |      10 | 查询    |
+----+---------+---------+---------+---------+---------+---------+---------+----+---------+---------+
select * from t2 right join t4 on t2.id=t4.id where t4.id = 1+1;
+----+---------+---------+---------+---------+---------+---------+---------+----+---------+---------+
| id | c1_tint | c2_sint | c3_mint | c4_bint | c5_floa | c6_doub | c7_deci | id | c1_tint | c2_vcha |
+----+---------+---------+---------+---------+---------+---------+---------+----+---------+---------+
|  2 |      21 |      22 |      23 |      24 |    25.1 |    26.5 |      27 |  2 |      20 | 重写    |
+----+---------+---------+---------+---------+---------+---------+---------+----+---------+---------+
select * from t2 right join t4 on t2.id=t4.id where t4.id = 2 order by t2.id desc;
+----+---------+---------+---------+---------+---------+---------+---------+----+---------+---------+
| id | c1_tint | c2_sint | c3_mint | c4_bint | c5_floa | c6_doub | c7_deci | id | c1_tint | c2_vcha |
+----+---------+---------+---------+---------+---------+---------+---------+----+---------+---------+
|  2 |      21 |      22 |      23 |      24 |    25.1 |    26.5 |      27 |  2 |      20 | 重写    |
+----+---------+---------+---------+---------+---------+---------+---------+----+---------+---------+
select * from t2 right join t4 on t2.id=t4.id where t4.id = 2 and t2.c1_tint <> 20;
+----+---------+---------+---------+---------+---------+---------+---------+----+---------+---------+
| id | c1_tint | c2_sint | c3_mint | c4_bint | c5_floa | c6_doub | c7_deci | id | c1_tint | c2_vcha |
+----+---------+---------+---------+---------+---------+---------+---------+----+---------+---------+
|  2 |      21 |      22 |      23 |      24 |    25.1 |    26.5 |      27 |  2 |      20 | 重写    |
+----+---------+---------+---------+---------+---------+---------+---------+----+---------+---------+
call dbms_udr.remove_rule ('rule13');
call dbms_udr.create_rule('rule14','whh1','select * from t2 inner join t4 on t2.id=t4.id where t2.id = ?', 'select * from t2 inner join t4 on t2.id=t4.id where t2.id >= ?+1 order by t2.id desc','YES');
select * from t2 inner join t4 on t2.id=t4.id where t2.id = 1;
+----+---------+---------+---------+---------+---------+---------+---------+----+---------+---------+
| id | c1_tint | c2_sint | c3_mint | c4_bint | c5_floa | c6_doub | c7_deci | id | c1_tint | c2_vcha |
+----+---------+---------+---------+---------+---------+---------+---------+----+---------+---------+
|  5 |      41 |      52 |      53 |      54 |    55.1 |    56.5 |      57 |  5 |      50 | mysql   |
|  4 |      41 |      42 |      43 |      44 |    45.1 |    46.5 |      47 |  4 |      40 | 用例    |
|  3 |      31 |      32 |      33 |      34 |    35.1 |    36.5 |      37 |  3 |      30 | 测试    |
|  2 |      21 |      22 |      23 |      24 |    25.1 |    26.5 |      27 |  2 |      20 | 重写    |
+----+---------+---------+---------+---------+---------+---------+---------+----+---------+---------+
select * from t2 inner join t4 on t2.id=t4.id where t2.id = 1+1;
+----+---------+---------+---------+---------+---------+---------+---------+----+---------+---------+
| id | c1_tint | c2_sint | c3_mint | c4_bint | c5_floa | c6_doub | c7_deci | id | c1_tint | c2_vcha |
+----+---------+---------+---------+---------+---------+---------+---------+----+---------+---------+
|  2 |      21 |      22 |      23 |      24 |    25.1 |    26.5 |      27 |  2 |      20 | 重写    |
+----+---------+---------+---------+---------+---------+---------+---------+----+---------+---------+
select * from t2 inner join t4 on t2.id=t4.id where t2.id = 2 order by t2.id asc;
+----+---------+---------+---------+---------+---------+---------+---------+----+---------+---------+
| id | c1_tint | c2_sint | c3_mint | c4_bint | c5_floa | c6_doub | c7_deci | id | c1_tint | c2_vcha |
+----+---------+---------+---------+---------+---------+---------+---------+----+---------+---------+
|  2 |      21 |      22 |      23 |      24 |    25.1 |    26.5 |      27 |  2 |      20 | 重写    |
+----+---------+---------+---------+---------+---------+---------+---------+----+---------+---------+
select * from t2 inner join t4 on t2.id=t4.id where t2.id = 2 and t2.c1_tint <> 20;
+----+---------+---------+---------+---------+---------+---------+---------+----+---------+---------+
| id | c1_tint | c2_sint | c3_mint | c4_bint | c5_floa | c6_doub | c7_deci | id | c1_tint | c2_vcha |
+----+---------+---------+---------+---------+---------+---------+---------+----+---------+---------+
|  2 |      21 |      22 |      23 |      24 |    25.1 |    26.5 |      27 |  2 |      20 | 重写    |
+----+---------+---------+---------+---------+---------+---------+---------+----+---------+---------+
call dbms_udr.remove_rule ('rule14');
#### UNION 子句
call dbms_udr.create_rule('rule16','whh1','(select * from t1 where id = :A) union (select * from t3 where id = :B)', '(select * from t1 where id > :A+:B order by id desc) union (select * from t3 where id > :B order by id desc)','YES');
(select * from t1 where id = 1) union (select * from t3 where id = 1);
+----+---------+----------+------------+---------------------+---------------------+
| id | c1_char | c2_vcha  | c3_text    | c4_enum             | c5_set1             |
+----+---------+----------+------------+---------------------+---------------------+
|  4 | 2024    | 14:00:00 | 2024-10-03 | 2024-10-03 14:00:00 | 2024-10-04 14:00:00 |
|  2 | 2022    | 12:00:00 | 2022-10-02 | 2022-10-02 12:00:00 | 2022-10-02 12:00:00 |
|  3 | 2023    | 13:00:00 | 2023-10-03 | 2023-10-03 13:00:00 | 2023-10-03 13:00:00 |
|  3 | char3   | varchar3 | text3      | enum2               | set2                |
|  4 | char4   | varchar4 | text4      | enum3               | set3,set4           |
+----+---------+----------+------------+---------------------+---------------------+
(select * from t1 where id = 1) union (select * from t3 where id = 1) limit 2;
+----+---------+----------+------------+---------------------+---------------------+
| id | c1_char | c2_vcha  | c3_text    | c4_enum             | c5_set1             |
+----+---------+----------+------------+---------------------+---------------------+
|  1 | char1   | varchar1 | text1      | 枚举                | 集合                |
|  1 | 2021    | 11:00:00 | 2021-10-01 | 2021-10-01 11:00:00 | 2021-10-01 11:00:00 |
+----+---------+----------+------------+---------------------+---------------------+
call dbms_udr.remove_rule ('rule16');
#### INTERSECT 子句
call dbms_udr.create_rule('rule17','whh1','(select * from t4 where id = :A) intersect (select * from t5 where id = :B)', '(select * from t4 where id > :A) intersect (select * from t5 where id > :B+1 order by id desc)','YES');
(select * from t4 where id = 1) intersect (select * from t5 where id = 1);
+----+---------+---------+
| id | c1_tint | c2_vcha |
+----+---------+---------+
|  5 |      50 | mysql   |
+----+---------+---------+
(select * from t4 where id = 1) intersect (select * from t5 where id = 1) limit 2;
+----+---------+---------+
| id | c1_tint | c2_vcha |
+----+---------+---------+
|  1 |      10 | 查询    |
+----+---------+---------+
(select * from t4 where id = 1 limit 2) intersect (select * from t5 where id = 1 limit 2);
+----+---------+---------+
| id | c1_tint | c2_vcha |
+----+---------+---------+
|  1 |      10 | 查询    |
+----+---------+---------+
call dbms_udr.remove_rule ('rule17');
#### EXCEPT  子句
call dbms_udr.create_rule('rule18','whh1','(select * from t4 where id > :A) except (select * from t5 where id > :B)', '(select * from t4 where id > :A order by id) intersect (select * from t5 where id > :B+1 order by id)','YES');
(select * from t4 where id > 1) except (select * from t5 where id > 1);
+----+---------+---------+
| id | c1_tint | c2_vcha |
+----+---------+---------+
|  5 |      50 | mysql   |
+----+---------+---------+
(select * from t4 where id > 1) except (select * from t5 where id > 1) limit 2;
+----+---------+---------+
| id | c1_tint | c2_vcha |
+----+---------+---------+
|  2 |      20 | 重写    |
|  3 |      30 | 测试    |
+----+---------+---------+
(select * from t4 where id > 1 and id < 5) except (select * from t5 where id > 1 and id < 5);
+----+---------+---------+
| id | c1_tint | c2_vcha |
+----+---------+---------+
|  2 |      20 | 重写    |
|  3 |      30 | 测试    |
|  4 |      40 | 用例    |
+----+---------+---------+
(select * from t4 where id > 1 limit 2) except (select * from t5 where id > 1  limit 2);
+----+---------+---------+
| id | c1_tint | c2_vcha |
+----+---------+---------+
|  2 |      20 | 重写    |
|  3 |      30 | 测试    |
+----+---------+---------+
call dbms_udr.remove_rule ('rule18');
#### 带括号的查询表达式
call dbms_udr.create_rule('rule19','whh1','select * from t4 except (select * from t4 intersect select * from t5 where id > ? )', 'select * from t4 except (select * from t4 intersect select * from t5 where id > ?+1) order by id desc','YES');
select * from t4 except (select * from t4 intersect select * from t5 where id > 1);
+------+---------+----------+
| id   | c1_tint | c2_vcha  |
+------+---------+----------+
|    2 |      20 | 重写     |
|    3 |      30 | 测试     |
|    1 |      10 | 查询     |
|    4 |      40 | 用例     |
|    7 |      70 | table t4 |
+------+---------+----------+
select * from t4 except (select * from t4 intersect select * from t5 where id > 1+1);
+------+---------+----------+
| id   | c1_tint | c2_vcha  |
+------+---------+----------+
|    2 |      20 | 重写     |
|    3 |      30 | 测试     |
|    1 |      10 | 查询     |
|    4 |      40 | 用例     |
|    7 |      70 | table t4 |
+------+---------+----------+
select * from t4 except (select * from t4 intersect select * from t5 where id > 1 or c1_tint > 10);
+------+---------+----------+
| id   | c1_tint | c2_vcha  |
+------+---------+----------+
|    2 |      20 | 重写     |
|    3 |      30 | 测试     |
|    1 |      10 | 查询     |
|    4 |      40 | 用例     |
|    7 |      70 | table t4 |
+------+---------+----------+
call dbms_udr.remove_rule ('rule19');
#### SELECT 子查询
call dbms_udr.create_rule('rule20','whh1','select * from t1 where id in (select id from t2 where c1_tint > ?)', 'select "query_rewrite",* from t1 where id in (select id from t2 where c1_tint > ?+10 limit 1) order by id desc','YES');
select * from t1 where id in (select id from t2 where c1_tint > 10);
+---------------+----+---------+----------+---------+---------+---------+
| query_rewrite | id | c1_char | c2_vcha  | c3_text | c4_enum | c5_set1 |
+---------------+----+---------+----------+---------+---------+---------+
| query_rewrite |  2 | char2   | varchar2 | text2   | enum1   | set1    |
+---------------+----+---------+----------+---------+---------+---------+
select * from t1 where id in (select id from t2 where c1_tint > 10+1 limit 1);
+----+---------+----------+---------+---------+---------+
| id | c1_char | c2_vcha  | c3_text | c4_enum | c5_set1 |
+----+---------+----------+---------+---------+---------+
|  2 | char2   | varchar2 | text2   | enum1   | set1    |
+----+---------+----------+---------+---------+---------+
select * from t1 where id in (select id from t2 where c1_tint >= 10 limit 1);
+----+---------+----------+---------+---------+---------+
| id | c1_char | c2_vcha  | c3_text | c4_enum | c5_set1 |
+----+---------+----------+---------+---------+---------+
|  1 | char1   | varchar1 | text1   | 枚举    | 集合    |
+----+---------+----------+---------+---------+---------+
select * from t1 where id in (select id from t2 where c1_tint >= 10 and c2_sint > 20 limit 1);
+----+---------+----------+---------+---------+---------+
| id | c1_char | c2_vcha  | c3_text | c4_enum | c5_set1 |
+----+---------+----------+---------+---------+---------+
|  2 | char2   | varchar2 | text2   | enum1   | set1    |
+----+---------+----------+---------+---------+---------+
call dbms_udr.remove_rule ('rule20');
call dbms_udr.create_rule('rule21','whh1','select * from t1 where id = any (select id from t2 where t1.id = t2.id and t2.c1_tint > ?)', 'select "query_rewrite",* from t1 where id = any (select id from t2 where t1.id = t2.id and t2.c1_tint > ?+10) order by id desc limit 2','YES');
select * from t1 where id = any (select id from t2 where t1.id = t2.id and t2.c1_tint > 10);
+---------------+----+---------+----------+---------+---------+-----------+
| query_rewrite | id | c1_char | c2_vcha  | c3_text | c4_enum | c5_set1   |
+---------------+----+---------+----------+---------+---------+-----------+
| query_rewrite |  4 | char4   | varchar4 | text4   | enum3   | set3,set4 |
| query_rewrite |  3 | char3   | varchar3 | text3   | enum2   | set2      |
+---------------+----+---------+----------+---------+---------+-----------+
select * from t1 where id = any (select id from t2 where t1.id = t2.id and t2.c1_tint > 9-1) order by id;
+----+---------+----------+---------+---------+-----------+
| id | c1_char | c2_vcha  | c3_text | c4_enum | c5_set1   |
+----+---------+----------+---------+---------+-----------+
|  1 | char1   | varchar1 | text1   | 枚举    | 集合      |
|  2 | char2   | varchar2 | text2   | enum1   | set1      |
|  3 | char3   | varchar3 | text3   | enum2   | set2      |
|  4 | char4   | varchar4 | text4   | enum3   | set3,set4 |
+----+---------+----------+---------+---------+-----------+
select id,c1_char,c2_vcha  from t1 where id = any (select id from t2 where t1.id = t2.id and t2.c1_tint > 9);
+----+---------+----------+
| id | c1_char | c2_vcha  |
+----+---------+----------+
|  3 | char3   | varchar3 |
|  1 | char1   | varchar1 |
|  4 | char4   | varchar4 |
|  2 | char2   | varchar2 |
+----+---------+----------+
call dbms_udr.remove_rule ('rule21');
call dbms_udr.create_rule('rule22','whh1','select * from t2 where id = (select id from t4 where c1_tint > :A limit 1) and c1_tint > :B', 'select "query_rewrite",* from t2 where id > (select id from t2 where c1_tint > :A+10 limit 1) and c1_tint > :B+10 order by id desc','YES');
select * from t2 where id = (select id from t4 where c1_tint > 20 limit 1) and c1_tint > 20;
+---------------+----+---------+---------+---------+---------+---------+---------+---------+
| query_rewrite | id | c1_tint | c2_sint | c3_mint | c4_bint | c5_floa | c6_doub | c7_deci |
+---------------+----+---------+---------+---------+---------+---------+---------+---------+
| query_rewrite |  8 |      81 |      82 |      83 |      84 |    85.1 |    86.5 |      87 |
| query_rewrite |  5 |      41 |      52 |      53 |      54 |    55.1 |    56.5 |      57 |
| query_rewrite |  4 |      41 |      42 |      43 |      44 |    45.1 |    46.5 |      47 |
+---------------+----+---------+---------+---------+---------+---------+---------+---------+
select * from t2 where id = (select id from t4 where c1_tint > 19+1 limit 1) and c1_tint > 20;
+----+---------+---------+---------+---------+---------+---------+---------+
| id | c1_tint | c2_sint | c3_mint | c4_bint | c5_floa | c6_doub | c7_deci |
+----+---------+---------+---------+---------+---------+---------+---------+
|  3 |      31 |      32 |      33 |      34 |    35.1 |    36.5 |      37 |
+----+---------+---------+---------+---------+---------+---------+---------+
call dbms_udr.remove_rule ('rule22');
######## 标签：qr-mysql-3-2 2、INSERT语句
#### INSERT语句
call dbms_udr.create_rule('rule1','whh1','insert into t1 (id,c1_char,c2_vcha,c3_text) values(:A,:B,:C,:D)', 'insert into t1 (id,c1_char,c2_vcha,c3_text) values(:A + 1, concat("qr-",:B),concat("qr-",:C), concat("qr-",:D))','YES');
insert into t1 (id,c1_char,c2_vcha,c3_text) values(5,'old5','old5','old5');
insert into t1 (id,c1_char,c2_vcha,c3_text) values(6,6,6,6);
insert into t1 (id,c1_char,c2_vcha,c3_text) values(8,1+1,2+2,3+3);
insert into t1 (id,c1_char,c2_vcha,c3_text,c4_enum) values(9,'语句','字段','不同','枚举');
insert into t1 values(10,'插入','全部','字段','枚举','集合');
select * from t1 order by id;
+----+---------+----------+---------+---------+-----------+
| id | c1_char | c2_vcha  | c3_text | c4_enum | c5_set1   |
+----+---------+----------+---------+---------+-----------+
|  1 | char1   | varchar1 | text1   | 枚举    | 集合      |
|  2 | char2   | varchar2 | text2   | enum1   | set1      |
|  3 | char3   | varchar3 | text3   | enum2   | set2      |
|  4 | char4   | varchar4 | text4   | enum3   | set3,set4 |
|  6 | qr-old5 | qr-old5  | qr-old5 | NULL    | NULL      |
|  7 | qr-6    | qr-6     | qr-6    | NULL    | NULL      |
|  8 | 2       | 4        | 6       | NULL    | NULL      |
|  9 | 语句    | 字段     | 不同    | 枚举    | NULL      |
| 10 | 插入    | 全部     | 字段    | 枚举    | 集合      |
+----+---------+----------+---------+---------+-----------+
call dbms_udr.remove_rule ('rule1');
call dbms_udr.create_rule('rule2','whh1','insert into t4 values(8,?,?)', 'insert into t5 values(8,?*10,?)','YES');
insert into t4 values(8,1,'t4表');
insert into t4 values(8,2,2);
insert into t4(id,c1_tint,c2_vcha) values(8,3,3);
insert into t4(id,c1_tint) values(8,4);
select * from t4 order by id;
+----+---------+----------+
| id | c1_tint | c2_vcha  |
+----+---------+----------+
|  1 |      10 | 查询     |
|  2 |      20 | 重写     |
|  3 |      30 | 测试     |
|  4 |      40 | 用例     |
|  5 |      50 | mysql    |
|  7 |      70 | table t4 |
|  8 |       3 | 3        |
|  8 |       4 | NULL     |
+----+---------+----------+
select * from t5 order by id;
+----+---------+----------+
| id | c1_tint | c2_vcha  |
+----+---------+----------+
|  1 |      10 | 查询     |
|  2 |      20 | 重写2    |
|  3 |      30 | 测试2    |
|  5 |      50 | mysql    |
|  6 |      60 | table t4 |
|  8 |      10 | t4表     |
|  8 |      20 | 2        |
+----+---------+----------+
call dbms_udr.remove_rule ('rule2');
#### INSERT INTO... SELECT 语句
call dbms_udr.create_rule('rule3','whh1','insert into t4 select id,c1_tint,c2_sint from t2 where id = ?', 'insert into t4 select c1_tint,c2_sint,c3_mint from t2 where id =  ?/2 order by id desc','YES');
insert into t4 select id,c1_tint,c2_sint from t2 where id = 2;
insert into t4 select id,c1_tint,c2_sint from t2 where id = 8 order by id;
insert into t4(id,c1_tint,c2_vcha) select id,c1_tint,c2_sint from t2 where id = 5;
select * from t2 order by id;
+----+---------+---------+---------+---------+---------+---------+---------+
| id | c1_tint | c2_sint | c3_mint | c4_bint | c5_floa | c6_doub | c7_deci |
+----+---------+---------+---------+---------+---------+---------+---------+
|  1 |      11 |      12 |      13 |      14 |    15.1 |    16.5 |      17 |
|  2 |      21 |      22 |      23 |      24 |    25.1 |    26.5 |      27 |
|  3 |      31 |      32 |      33 |      34 |    35.1 |    36.5 |      37 |
|  4 |      41 |      42 |      43 |      44 |    45.1 |    46.5 |      47 |
|  5 |      41 |      52 |      53 |      54 |    55.1 |    56.5 |      57 |
|  8 |      81 |      82 |      83 |      84 |    85.1 |    86.5 |      87 |
+----+---------+---------+---------+---------+---------+---------+---------+
select * from t4 order by id;
+----+---------+----------+
| id | c1_tint | c2_vcha  |
+----+---------+----------+
|  1 |      10 | 查询     |
|  2 |      20 | 重写     |
|  3 |      30 | 测试     |
|  4 |      40 | 用例     |
|  5 |      41 | 52       |
|  5 |      50 | mysql    |
|  7 |      70 | table t4 |
|  8 |       3 | 3        |
|  8 |       4 | NULL     |
|  8 |      81 | 82       |
| 11 |      12 | 13       |
+----+---------+----------+
call dbms_udr.remove_rule ('rule3');
#### INSERT ... ON DUPLICATE KEY UPDATE 语句
call dbms_udr.create_rule('rule4','whh1','insert into t2(id,c1_tint,c2_sint) values(3,31,?) on duplicate key update c2_sint = c2_sint * ?', 'insert into t2(id,c1_tint,c2_sint) values(3,31,?) on duplicate key update c2_sint = c2_sint * ? *10','YES');
insert into t2(id,c1_tint,c2_sint) values(3,31,3) on duplicate key update c2_sint = c2_sint * 10;
insert into t2(id,c1_tint,c2_sint) values(3,31,4) on duplicate key update c2_sint = c2_sint * (2*2);
insert into t2 values(3,31,5,33,34,35.1,36.5,37.12) on duplicate key update c2_sint = c2_sint * 2;
Warnings:
Warning	1265	Data truncated for column 'c7_deci' at row 1
select * from t2 order by id;
+----+---------+---------+---------+---------+---------+---------+---------+
| id | c1_tint | c2_sint | c3_mint | c4_bint | c5_floa | c6_doub | c7_deci |
+----+---------+---------+---------+---------+---------+---------+---------+
|  1 |      11 |      12 |      13 |      14 |    15.1 |    16.5 |      17 |
|  2 |      21 |      22 |      23 |      24 |    25.1 |    26.5 |      27 |
|  3 |      31 |   25600 |      33 |      34 |    35.1 |    36.5 |      37 |
|  4 |      41 |      42 |      43 |      44 |    45.1 |    46.5 |      47 |
|  5 |      41 |      52 |      53 |      54 |    55.1 |    56.5 |      57 |
|  8 |      81 |      82 |      83 |      84 |    85.1 |    86.5 |      87 |
+----+---------+---------+---------+---------+---------+---------+---------+
call dbms_udr.remove_rule ('rule4');
######## 标签：qr-mysql-3-3 3、REPLACE语句
call dbms_udr.create_rule('rule5','whh1','replace into t2 (id,c1_tint,c2_sint) values(3,31,:A)', 'replace into t2 (id,c1_tint,c2_sint) values(3,31,:A%3)','YES');
replace into t2 (id,c1_tint,c2_sint) values(3,31,100);
replace into t2 (id,c1_tint,c2_sint) values(3,30+1,100*2);
replace into t2 (id,c1_tint,c2_sint,c4_bint) values(3,31,300,34);
replace into t2 values(3,31,32,400,34,35.1,36.5,37.12);
Warnings:
Warning	1265	Data truncated for column 'c7_deci' at row 1
select * from t2 order by id;
+----+---------+---------+---------+---------+---------+---------+---------+
| id | c1_tint | c2_sint | c3_mint | c4_bint | c5_floa | c6_doub | c7_deci |
+----+---------+---------+---------+---------+---------+---------+---------+
|  1 |      11 |      12 |      13 |      14 |    15.1 |    16.5 |      17 |
|  2 |      21 |      22 |      23 |      24 |    25.1 |    26.5 |      27 |
|  3 |      31 |      32 |     400 |      34 |    35.1 |    36.5 |      37 |
|  4 |      41 |      42 |      43 |      44 |    45.1 |    46.5 |      47 |
|  5 |      41 |      52 |      53 |      54 |    55.1 |    56.5 |      57 |
|  8 |      81 |      82 |      83 |      84 |    85.1 |    86.5 |      87 |
+----+---------+---------+---------+---------+---------+---------+---------+
call dbms_udr.remove_rule ('rule5');
######## 标签：qr-mysql-3-4 4、UPDATE语句
call dbms_udr.create_rule('rule6','whh1','update t4 set c1_tint = :A where id = :B ', 'update t4 set c1_tint = :A * 10,c2_vcha="query rewrite1" where id = 1+:B','YES');
update t4 set c1_tint = 10 where id = 1;
update t4 set c1_tint = 20 where id = 3 limit 1;
select * from t4 order by id;
+----+---------+----------------+
| id | c1_tint | c2_vcha        |
+----+---------+----------------+
|  1 |      10 | 查询           |
|  2 |     100 | query rewrite1 |
|  3 |      20 | 测试           |
|  4 |      40 | 用例           |
|  5 |      41 | 52             |
|  5 |      50 | mysql          |
|  7 |      70 | table t4       |
|  8 |       3 | 3              |
|  8 |       4 | NULL           |
|  8 |      81 | 82             |
| 11 |      12 | 13             |
+----+---------+----------------+
call dbms_udr.remove_rule ('rule6');
call dbms_udr.create_rule('rule6','whh1','update t4 set c1_tint = :A order by id desc limit :B', 'update t4 set c1_tint = :A + 10,c2_vcha="query rewrite2" order by id desc limit :B','YES');
update t4 set c1_tint = 11 order by id desc limit 1;
update t4 set c1_tint = 22 order by id limit 1;
select * from t4 order by id;
+----+---------+----------------+
| id | c1_tint | c2_vcha        |
+----+---------+----------------+
|  1 |      22 | 查询           |
|  2 |     100 | query rewrite1 |
|  3 |      20 | 测试           |
|  4 |      40 | 用例           |
|  5 |      41 | 52             |
|  5 |      50 | mysql          |
|  7 |      70 | table t4       |
|  8 |       3 | 3              |
|  8 |       4 | NULL           |
|  8 |      81 | 82             |
| 11 |      21 | query rewrite2 |
+----+---------+----------------+
call dbms_udr.remove_rule ('rule6');
######## 标签：qr-mysql-3-5 5、DELETE语句
call dbms_udr.create_rule('rule7','whh1','delete from t2 where id = :A', 'delete from t2 where id = :A+1','YES');
delete from t2 where id = 3;
select * from t2 order by id;
+----+---------+---------+---------+---------+---------+---------+---------+
| id | c1_tint | c2_sint | c3_mint | c4_bint | c5_floa | c6_doub | c7_deci |
+----+---------+---------+---------+---------+---------+---------+---------+
|  1 |      11 |      12 |      13 |      14 |    15.1 |    16.5 |      17 |
|  2 |      21 |      22 |      23 |      24 |    25.1 |    26.5 |      27 |
|  3 |      31 |      32 |     400 |      34 |    35.1 |    36.5 |      37 |
|  5 |      41 |      52 |      53 |      54 |    55.1 |    56.5 |      57 |
|  8 |      81 |      82 |      83 |      84 |    85.1 |    86.5 |      87 |
+----+---------+---------+---------+---------+---------+---------+---------+
call dbms_udr.remove_rule ('rule7');
call dbms_udr.create_rule('rule7','whh1','delete from t2 order by id limit :A', 'delete from t2 order by id desc limit :A','YES');
delete from t2 order by id limit 1;
select * from t2 order by id;
+----+---------+---------+---------+---------+---------+---------+---------+
| id | c1_tint | c2_sint | c3_mint | c4_bint | c5_floa | c6_doub | c7_deci |
+----+---------+---------+---------+---------+---------+---------+---------+
|  1 |      11 |      12 |      13 |      14 |    15.1 |    16.5 |      17 |
|  2 |      21 |      22 |      23 |      24 |    25.1 |    26.5 |      27 |
|  3 |      31 |      32 |     400 |      34 |    35.1 |    36.5 |      37 |
|  5 |      41 |      52 |      53 |      54 |    55.1 |    56.5 |      57 |
+----+---------+---------+---------+---------+---------+---------+---------+
call dbms_udr.remove_rule ('rule7');
######## 标签：qr-mysql-3-6 6、SET语句
#### SET语句
call dbms_udr.create_rule('rule8','whh1','set @a = ?', 'set @a = ?*100','YES');
set @a = 1;
select @a;
+------+
| @a   |
+------+
|  100 |
+------+
set @a = 1+2;
select @a;
+------+
| @a   |
+------+
|    3 |
+------+
set @a1 = 1;
select @a1;
+------+
| @a1  |
+------+
|    1 |
+------+
set @a = 3,@a2 = 4;
select @a,@a2;
+------+------+
| @a   | @a2  |
+------+------+
|    3 |    4 |
+------+------+
call dbms_udr.remove_rule ('rule8');
call dbms_udr.create_rule('rule9','whh1','set @b1 = :A,@b2 = :B', 'set @b1 = :B-(-100),@b2 = :A-(-200)','YES');
set @b1 = 1;
select @b1;
+------+
| @b1  |
+------+
|    1 |
+------+
set @b2 = 2;
select @b2;
+------+
| @b2  |
+------+
|    2 |
+------+
set @b1 = 3,@b2 = 4;
select @b1,@b2;
+------+------+
| @b1  | @b2  |
+------+------+
|  104 |  203 |
+------+------+
set @b2 = 5,@b1 = 6;
select @b2,@b1;
+------+------+
| @b2  | @b1  |
+------+------+
|    5 |    6 |
+------+------+
set @b1 = 7,@b2 = 8,@b3 = 9;
select @b1,@b2,@b3;
+------+------+------+
| @b1  | @b2  | @b3  |
+------+------+------+
|    7 |    8 |    9 |
+------+------+------+
call dbms_udr.remove_rule ('rule9');
call dbms_udr.create_rule('rule10','whh1','set @c1 = ?, @c2 = 2', 'set @c1 = ?*10, @c2 = 20','YES');
set @c1 = 1;
select @c1;
+------+
| @c1  |
+------+
|    1 |
+------+
set @c2 = 2;
select @c2;
+------+
| @c2  |
+------+
|    2 |
+------+
set @c1 = 10,@c2 = 2;
select @c1,@c2;
+------+------+
| @c1  | @c2  |
+------+------+
|   10 |    2 |
+------+------+
set @c1 = 10, @c2 = 2;
select @c1,@c2;
+------+------+
| @c1  | @c2  |
+------+------+
|  100 |   20 |
+------+------+
set @c1 = 20, @c2 = 3-1;
select @c1,@c2;
+------+------+
| @c1  | @c2  |
+------+------+
|   20 |    2 |
+------+------+
set @c1 = 20+10, @c2 = 2;
select @c1,@c2;
+------+------+
| @c1  | @c2  |
+------+------+
|   30 |    2 |
+------+------+
set @c1 = 40, @c2 = 2,@c3 = 4;
select @c1,@c2,@c3;
+------+------+------+
| @c1  | @c2  | @c3  |
+------+------+------+
|   40 |    2 |    4 |
+------+------+------+
call dbms_udr.remove_rule ('rule10');
#### pattern，replacement(语句模板-不同类型语句)
#### insert -- >  重写支持的SQL类型
call dbms_udr.create_rule('rule1','whh1','insert into t4 (id,c1_tint,c2_vcha) values(:A,:B,:C)', 'update t5 set c2_vcha = CONCAT("t4-insert: ",:A,:B,:C) where id = :A +(-10)','YES');
insert into t4 (id,c1_tint,c2_vcha) values(11,100,"insert-->update1");
insert into t4 (id,c2_vcha,c1_tint) values(12,"insert-->update2",110);
insert into t4 values(13,120,"insert-->update3");
select * from t4 order by id;
+----+---------+------------------+
| id | c1_tint | c2_vcha          |
+----+---------+------------------+
|  1 |      22 | 查询             |
|  2 |     100 | query rewrite1   |
|  3 |      20 | 测试             |
|  4 |      40 | 用例             |
|  5 |      41 | 52               |
|  5 |      50 | mysql            |
|  7 |      70 | table t4         |
|  8 |       3 | 3                |
|  8 |       4 | NULL             |
|  8 |      81 | 82               |
| 11 |      21 | query rewrite2   |
| 12 |     110 | insert-->update2 |
| 13 |     120 | insert-->update3 |
+----+---------+------------------+
select * from t5 order by id;
+----+---------+----------------------------------+
| id | c1_tint | c2_vcha                          |
+----+---------+----------------------------------+
|  1 |      10 | t4-insert: 11100insert-->update1 |
|  2 |      20 | 重写2                            |
|  3 |      30 | 测试2                            |
|  5 |      50 | mysql                            |
|  6 |      60 | table t4                         |
|  8 |      10 | t4表                             |
|  8 |      20 | 2                                |
+----+---------+----------------------------------+
call dbms_udr.remove_rule ('rule1');
call dbms_udr.create_rule('rule2','whh1','insert into t4 (id,c1_tint,c2_vcha) values(:A,:B,:C)', 'select * from t4 where id = :A and c1_tint=:B and c2_vcha=:C order by id desc','YES');
insert into t4 (id,c1_tint,c2_vcha) values(1,10,"查询");
+----+---------+---------+
| id | c1_tint | c2_vcha |
+----+---------+---------+
+----+---------+---------+
insert into t4 (id,c2_vcha,c1_tint) values(21,"重写",20);
insert into t4 values(22,30,"测试");
select * from t4 order by id;
+----+---------+------------------+
| id | c1_tint | c2_vcha          |
+----+---------+------------------+
|  1 |      22 | 查询             |
|  2 |     100 | query rewrite1   |
|  3 |      20 | 测试             |
|  4 |      40 | 用例             |
|  5 |      41 | 52               |
|  5 |      50 | mysql            |
|  7 |      70 | table t4         |
|  8 |       3 | 3                |
|  8 |       4 | NULL             |
|  8 |      81 | 82               |
| 11 |      21 | query rewrite2   |
| 12 |     110 | insert-->update2 |
| 13 |     120 | insert-->update3 |
| 21 |      20 | 重写             |
| 22 |      30 | 测试             |
+----+---------+------------------+
call dbms_udr.remove_rule ('rule2');
call dbms_udr.create_rule('rule3','whh1','insert into t4 (id,c1_tint,c2_vcha) values(:A,:B,:C)', 'insert into t5 (id,c1_tint,c2_vcha) values(:A,:B,concat("qr-",:C))','YES');
insert into t4 (id,c1_tint,c2_vcha) values(31,100,"insert-->insert1");
insert into t4 (id,c2_vcha,c1_tint) values(32,"insert-->insert2",110);
insert into t4 values(33,120,"insert-->insert3");
select * from t4 order by id;
+----+---------+------------------+
| id | c1_tint | c2_vcha          |
+----+---------+------------------+
|  1 |      22 | 查询             |
|  2 |     100 | query rewrite1   |
|  3 |      20 | 测试             |
|  4 |      40 | 用例             |
|  5 |      41 | 52               |
|  5 |      50 | mysql            |
|  7 |      70 | table t4         |
|  8 |       3 | 3                |
|  8 |       4 | NULL             |
|  8 |      81 | 82               |
| 11 |      21 | query rewrite2   |
| 12 |     110 | insert-->update2 |
| 13 |     120 | insert-->update3 |
| 21 |      20 | 重写             |
| 22 |      30 | 测试             |
| 32 |     110 | insert-->insert2 |
| 33 |     120 | insert-->insert3 |
+----+---------+------------------+
select * from t5 order by id;
+----+---------+----------------------------------+
| id | c1_tint | c2_vcha                          |
+----+---------+----------------------------------+
|  1 |      10 | t4-insert: 11100insert-->update1 |
|  2 |      20 | 重写2                            |
|  3 |      30 | 测试2                            |
|  5 |      50 | mysql                            |
|  6 |      60 | table t4                         |
|  8 |      10 | t4表                             |
|  8 |      20 | 2                                |
| 31 |     100 | qr-insert-->insert1              |
+----+---------+----------------------------------+
call dbms_udr.remove_rule ('rule3');
call dbms_udr.create_rule('rule4','whh1','insert into t4 (id,c1_tint,c2_vcha) values(:A,:B,:C)', 'delete from t5 where id = :A and c1_tint=:B and c2_vcha=concat("qr-",:C)','YES');
insert into t4 (id,c1_tint,c2_vcha) values(31,100,"insert-->insert1");
select * from t4 order by id;
+----+---------+------------------+
| id | c1_tint | c2_vcha          |
+----+---------+------------------+
|  1 |      22 | 查询             |
|  2 |     100 | query rewrite1   |
|  3 |      20 | 测试             |
|  4 |      40 | 用例             |
|  5 |      41 | 52               |
|  5 |      50 | mysql            |
|  7 |      70 | table t4         |
|  8 |       3 | 3                |
|  8 |       4 | NULL             |
|  8 |      81 | 82               |
| 11 |      21 | query rewrite2   |
| 12 |     110 | insert-->update2 |
| 13 |     120 | insert-->update3 |
| 21 |      20 | 重写             |
| 22 |      30 | 测试             |
| 32 |     110 | insert-->insert2 |
| 33 |     120 | insert-->insert3 |
+----+---------+------------------+
select * from t5 order by id;
+----+---------+----------------------------------+
| id | c1_tint | c2_vcha                          |
+----+---------+----------------------------------+
|  1 |      10 | t4-insert: 11100insert-->update1 |
|  2 |      20 | 重写2                            |
|  3 |      30 | 测试2                            |
|  5 |      50 | mysql                            |
|  6 |      60 | table t4                         |
|  8 |      10 | t4表                             |
|  8 |      20 | 2                                |
+----+---------+----------------------------------+
call dbms_udr.remove_rule ('rule4');
#### update -- >  重写支持的SQL类型
call dbms_udr.create_rule('rule5','whh1','update t2 set c2_sint = :A where id = :B', 'update t2 set c2_sint = :A/2 where id = :B','YES');
update t2 set c2_sint = 200 where id = 1;
update t2 set c2_sint = 300 where id = 2 and c1_tint = 21;
update t2 set c2_sint = 100,c1_tint=100 where id = 3;
update t2 set c2_sint = abs(-200) where id = 5;
select * from t2 order by id;
+----+---------+---------+---------+---------+---------+---------+---------+
| id | c1_tint | c2_sint | c3_mint | c4_bint | c5_floa | c6_doub | c7_deci |
+----+---------+---------+---------+---------+---------+---------+---------+
|  1 |      11 |     100 |      13 |      14 |    15.1 |    16.5 |      17 |
|  2 |      21 |     300 |      23 |      24 |    25.1 |    26.5 |      27 |
|  3 |     100 |     100 |     400 |      34 |    35.1 |    36.5 |      37 |
|  5 |      41 |     200 |      53 |      54 |    55.1 |    56.5 |      57 |
+----+---------+---------+---------+---------+---------+---------+---------+
call dbms_udr.remove_rule ('rule5');
call dbms_udr.create_rule('rule6','whh1','update t2 set c2_sint = :A where id = :B', 'select * from t2 where id = :B and c2_sint=:A order by id desc','YES');
update t2 set c2_sint = 100 where id = 1;
+----+---------+---------+---------+---------+---------+---------+---------+
| id | c1_tint | c2_sint | c3_mint | c4_bint | c5_floa | c6_doub | c7_deci |
+----+---------+---------+---------+---------+---------+---------+---------+
|  1 |      11 |     100 |      13 |      14 |    15.1 |    16.5 |      17 |
+----+---------+---------+---------+---------+---------+---------+---------+
update t2 set c2_sint = 300 where id = 2 and c1_tint = 21;
select * from t2 order by id;
+----+---------+---------+---------+---------+---------+---------+---------+
| id | c1_tint | c2_sint | c3_mint | c4_bint | c5_floa | c6_doub | c7_deci |
+----+---------+---------+---------+---------+---------+---------+---------+
|  1 |      11 |     100 |      13 |      14 |    15.1 |    16.5 |      17 |
|  2 |      21 |     300 |      23 |      24 |    25.1 |    26.5 |      27 |
|  3 |     100 |     100 |     400 |      34 |    35.1 |    36.5 |      37 |
|  5 |      41 |     200 |      53 |      54 |    55.1 |    56.5 |      57 |
+----+---------+---------+---------+---------+---------+---------+---------+
call dbms_udr.remove_rule ('rule6');
call dbms_udr.create_rule('rule7','whh1','update t2 set c2_sint = :A where id = :B', 'insert into t2(id,c1_tint,c2_sint) values(:B,:A,:A)','YES');
update t2 set c2_sint = 101 where id = 1;
select * from t2 order by id;
+----+---------+---------+---------+---------+---------+---------+---------+
| id | c1_tint | c2_sint | c3_mint | c4_bint | c5_floa | c6_doub | c7_deci |
+----+---------+---------+---------+---------+---------+---------+---------+
|  1 |      11 |     100 |      13 |      14 |    15.1 |    16.5 |      17 |
|  1 |     101 |     101 |    NULL |    NULL |    NULL |    NULL |    NULL |
|  2 |      21 |     300 |      23 |      24 |    25.1 |    26.5 |      27 |
|  3 |     100 |     100 |     400 |      34 |    35.1 |    36.5 |      37 |
|  5 |      41 |     200 |      53 |      54 |    55.1 |    56.5 |      57 |
+----+---------+---------+---------+---------+---------+---------+---------+
call dbms_udr.remove_rule ('rule7');
call dbms_udr.create_rule('rule8','whh1','update t2 set c1_tint = :A where id = :B and c2_sint = :C', 'delete from t2 where id = :B and c1_tint=:A and c2_sint = :C','YES');
update t2 set c1_tint = 100 where id = 1 and c2_sint = 101;
select * from t2 order by id;
+----+---------+---------+---------+---------+---------+---------+---------+
| id | c1_tint | c2_sint | c3_mint | c4_bint | c5_floa | c6_doub | c7_deci |
+----+---------+---------+---------+---------+---------+---------+---------+
|  1 |      11 |     100 |      13 |      14 |    15.1 |    16.5 |      17 |
|  1 |     101 |     101 |    NULL |    NULL |    NULL |    NULL |    NULL |
|  2 |      21 |     300 |      23 |      24 |    25.1 |    26.5 |      27 |
|  3 |     100 |     100 |     400 |      34 |    35.1 |    36.5 |      37 |
|  5 |      41 |     200 |      53 |      54 |    55.1 |    56.5 |      57 |
+----+---------+---------+---------+---------+---------+---------+---------+
call dbms_udr.remove_rule ('rule8');
#### select -- >  重写支持的SQL类型
call dbms_udr.create_rule('rule9','whh1','select * from t1 where id = :A', 'update t1 set c1_char = CONCAT(:A,"select-->update") where id = :A','YES');
select * from t1 where id = 1;
select * from t1 where abs(id) = 2;
+----+---------+----------+---------+---------+---------+
| id | c1_char | c2_vcha  | c3_text | c4_enum | c5_set1 |
+----+---------+----------+---------+---------+---------+
|  2 | char2   | varchar2 | text2   | enum1   | set1    |
+----+---------+----------+---------+---------+---------+
select * from t1 where id = 2+1;
+----+---------+----------+---------+---------+---------+
| id | c1_char | c2_vcha  | c3_text | c4_enum | c5_set1 |
+----+---------+----------+---------+---------+---------+
|  3 | char3   | varchar3 | text3   | enum2   | set2    |
+----+---------+----------+---------+---------+---------+
select * from t1 where id = 1 or c1_char is not null order by id;
+----+------------------+----------+---------+---------+-----------+
| id | c1_char          | c2_vcha  | c3_text | c4_enum | c5_set1   |
+----+------------------+----------+---------+---------+-----------+
|  1 | 1select-->update | varchar1 | text1   | 枚举    | 集合      |
|  2 | char2            | varchar2 | text2   | enum1   | set1      |
|  3 | char3            | varchar3 | text3   | enum2   | set2      |
|  4 | char4            | varchar4 | text4   | enum3   | set3,set4 |
|  6 | qr-old5          | qr-old5  | qr-old5 | NULL    | NULL      |
|  7 | qr-6             | qr-6     | qr-6    | NULL    | NULL      |
|  8 | 2                | 4        | 6       | NULL    | NULL      |
|  9 | 语句             | 字段     | 不同    | 枚举    | NULL      |
| 10 | 插入             | 全部     | 字段    | 枚举    | 集合      |
+----+------------------+----------+---------+---------+-----------+
select id,c1_char,c2_vcha from t1 where id = 4;
+----+---------+----------+
| id | c1_char | c2_vcha  |
+----+---------+----------+
|  4 | char4   | varchar4 |
+----+---------+----------+
select * from t1 order by id;
+----+------------------+----------+---------+---------+-----------+
| id | c1_char          | c2_vcha  | c3_text | c4_enum | c5_set1   |
+----+------------------+----------+---------+---------+-----------+
|  1 | 1select-->update | varchar1 | text1   | 枚举    | 集合      |
|  2 | char2            | varchar2 | text2   | enum1   | set1      |
|  3 | char3            | varchar3 | text3   | enum2   | set2      |
|  4 | char4            | varchar4 | text4   | enum3   | set3,set4 |
|  6 | qr-old5          | qr-old5  | qr-old5 | NULL    | NULL      |
|  7 | qr-6             | qr-6     | qr-6    | NULL    | NULL      |
|  8 | 2                | 4        | 6       | NULL    | NULL      |
|  9 | 语句             | 字段     | 不同    | 枚举    | NULL      |
| 10 | 插入             | 全部     | 字段    | 枚举    | 集合      |
+----+------------------+----------+---------+---------+-----------+
call dbms_udr.remove_rule ('rule9');
call dbms_udr.create_rule('rule10','whh1','select * from t1 where id = ?', 'select "query rewrite",id,c1_char,c2_vcha,c3_text from t1 where id = ?+1 order by id desc','YES');
select * from t1 where id = 1;
+---------------+----+---------+----------+---------+
| query rewrite | id | c1_char | c2_vcha  | c3_text |
+---------------+----+---------+----------+---------+
| query rewrite |  2 | char2   | varchar2 | text2   |
+---------------+----+---------+----------+---------+
select * from t1 where abs(id) = 2;
+----+---------+----------+---------+---------+---------+
| id | c1_char | c2_vcha  | c3_text | c4_enum | c5_set1 |
+----+---------+----------+---------+---------+---------+
|  2 | char2   | varchar2 | text2   | enum1   | set1    |
+----+---------+----------+---------+---------+---------+
select * from t1 where id = 2+1;
+----+---------+----------+---------+---------+---------+
| id | c1_char | c2_vcha  | c3_text | c4_enum | c5_set1 |
+----+---------+----------+---------+---------+---------+
|  3 | char3   | varchar3 | text3   | enum2   | set2    |
+----+---------+----------+---------+---------+---------+
select id,c1_char,c2_vcha from t1 where id = 4;
+----+---------+----------+
| id | c1_char | c2_vcha  |
+----+---------+----------+
|  4 | char4   | varchar4 |
+----+---------+----------+
select * from t1 order by id;
+----+------------------+----------+---------+---------+-----------+
| id | c1_char          | c2_vcha  | c3_text | c4_enum | c5_set1   |
+----+------------------+----------+---------+---------+-----------+
|  1 | 1select-->update | varchar1 | text1   | 枚举    | 集合      |
|  2 | char2            | varchar2 | text2   | enum1   | set1      |
|  3 | char3            | varchar3 | text3   | enum2   | set2      |
|  4 | char4            | varchar4 | text4   | enum3   | set3,set4 |
|  6 | qr-old5          | qr-old5  | qr-old5 | NULL    | NULL      |
|  7 | qr-6             | qr-6     | qr-6    | NULL    | NULL      |
|  8 | 2                | 4        | 6       | NULL    | NULL      |
|  9 | 语句             | 字段     | 不同    | 枚举    | NULL      |
| 10 | 插入             | 全部     | 字段    | 枚举    | 集合      |
+----+------------------+----------+---------+---------+-----------+
call dbms_udr.remove_rule ('rule10');
call dbms_udr.create_rule('rule11','whh1','select * from t1 where id = ?', 'insert into t1(id,c1_char) values(?+20,"select-->insert")','YES');
select * from t1 where id = 1;
select * from t1 where abs(id) = 2;
+----+---------+----------+---------+---------+---------+
| id | c1_char | c2_vcha  | c3_text | c4_enum | c5_set1 |
+----+---------+----------+---------+---------+---------+
|  2 | char2   | varchar2 | text2   | enum1   | set1    |
+----+---------+----------+---------+---------+---------+
select * from t1 where id = 2+1;
+----+---------+----------+---------+---------+---------+
| id | c1_char | c2_vcha  | c3_text | c4_enum | c5_set1 |
+----+---------+----------+---------+---------+---------+
|  3 | char3   | varchar3 | text3   | enum2   | set2    |
+----+---------+----------+---------+---------+---------+
select * from t1 order by id;
+----+------------------+----------+---------+---------+-----------+
| id | c1_char          | c2_vcha  | c3_text | c4_enum | c5_set1   |
+----+------------------+----------+---------+---------+-----------+
|  1 | 1select-->update | varchar1 | text1   | 枚举    | 集合      |
|  2 | char2            | varchar2 | text2   | enum1   | set1      |
|  3 | char3            | varchar3 | text3   | enum2   | set2      |
|  4 | char4            | varchar4 | text4   | enum3   | set3,set4 |
|  6 | qr-old5          | qr-old5  | qr-old5 | NULL    | NULL      |
|  7 | qr-6             | qr-6     | qr-6    | NULL    | NULL      |
|  8 | 2                | 4        | 6       | NULL    | NULL      |
|  9 | 语句             | 字段     | 不同    | 枚举    | NULL      |
| 10 | 插入             | 全部     | 字段    | 枚举    | 集合      |
| 21 | select-->insert  | NULL     | NULL    | NULL    | NULL      |
+----+------------------+----------+---------+---------+-----------+
call dbms_udr.remove_rule ('rule11');
call dbms_udr.create_rule('rule12','whh1','select * from t1 where id = ?', 'delete from t1 where id = ? order by id','YES');
select * from t1 where id = 8;
select * from t1 where id = abs(-9);
+----+---------+---------+---------+---------+---------+
| id | c1_char | c2_vcha | c3_text | c4_enum | c5_set1 |
+----+---------+---------+---------+---------+---------+
|  9 | 语句    | 字段    | 不同    | 枚举    | NULL    |
+----+---------+---------+---------+---------+---------+
select * from t1 where id = 2+8;
+----+---------+---------+---------+---------+---------+
| id | c1_char | c2_vcha | c3_text | c4_enum | c5_set1 |
+----+---------+---------+---------+---------+---------+
| 10 | 插入    | 全部    | 字段    | 枚举    | 集合    |
+----+---------+---------+---------+---------+---------+
select * from t1 order by id;
+----+------------------+----------+---------+---------+-----------+
| id | c1_char          | c2_vcha  | c3_text | c4_enum | c5_set1   |
+----+------------------+----------+---------+---------+-----------+
|  1 | 1select-->update | varchar1 | text1   | 枚举    | 集合      |
|  2 | char2            | varchar2 | text2   | enum1   | set1      |
|  3 | char3            | varchar3 | text3   | enum2   | set2      |
|  4 | char4            | varchar4 | text4   | enum3   | set3,set4 |
|  6 | qr-old5          | qr-old5  | qr-old5 | NULL    | NULL      |
|  7 | qr-6             | qr-6     | qr-6    | NULL    | NULL      |
|  9 | 语句             | 字段     | 不同    | 枚举    | NULL      |
| 10 | 插入             | 全部     | 字段    | 枚举    | 集合      |
| 21 | select-->insert  | NULL     | NULL    | NULL    | NULL      |
+----+------------------+----------+---------+---------+-----------+
call dbms_udr.remove_rule ('rule12');
#### delete -- >  重写支持的SQL类型
call dbms_udr.create_rule('rule13','whh1','delete from t4 where id = :A', 'update t4 set c2_vcha = null where id = :A order by id','YES');
delete from t4 where id = 21;
delete from t4 where id = 21+1;
delete from t4 where id = 32 order by id;
select * from t4 order by id;
+----+---------+------------------+
| id | c1_tint | c2_vcha          |
+----+---------+------------------+
|  1 |      22 | 查询             |
|  2 |     100 | query rewrite1   |
|  3 |      20 | 测试             |
|  4 |      40 | 用例             |
|  5 |      41 | 52               |
|  5 |      50 | mysql            |
|  7 |      70 | table t4         |
|  8 |       3 | 3                |
|  8 |       4 | NULL             |
|  8 |      81 | 82               |
| 11 |      21 | query rewrite2   |
| 12 |     110 | insert-->update2 |
| 13 |     120 | insert-->update3 |
| 21 |      20 | NULL             |
| 33 |     120 | insert-->insert3 |
+----+---------+------------------+
call dbms_udr.remove_rule ('rule13');
call dbms_udr.create_rule('rule14','whh1','delete from t4 where id = ?', 'select * from t4 where id = ? order by id','YES');
delete from t4 where id = 21;
+----+---------+---------+
| id | c1_tint | c2_vcha |
+----+---------+---------+
| 21 |      20 | NULL    |
+----+---------+---------+
delete from t4 where id = abs(-33);
select * from t4 order by id;
+----+---------+------------------+
| id | c1_tint | c2_vcha          |
+----+---------+------------------+
|  1 |      22 | 查询             |
|  2 |     100 | query rewrite1   |
|  3 |      20 | 测试             |
|  4 |      40 | 用例             |
|  5 |      41 | 52               |
|  5 |      50 | mysql            |
|  7 |      70 | table t4         |
|  8 |       3 | 3                |
|  8 |       4 | NULL             |
|  8 |      81 | 82               |
| 11 |      21 | query rewrite2   |
| 12 |     110 | insert-->update2 |
| 13 |     120 | insert-->update3 |
| 21 |      20 | NULL             |
+----+---------+------------------+
call dbms_udr.remove_rule ('rule14');
call dbms_udr.create_rule('rule15','whh1','delete from t4 where id = :A', 'insert into t4 values(:A+1,:A+0,"delete-->insert")','YES');
delete from t4 where id = 42;
delete from t4 where id = 11+1;
select * from t4 order by id;
+----+---------+------------------+
| id | c1_tint | c2_vcha          |
+----+---------+------------------+
|  1 |      22 | 查询             |
|  2 |     100 | query rewrite1   |
|  3 |      20 | 测试             |
|  4 |      40 | 用例             |
|  5 |      41 | 52               |
|  5 |      50 | mysql            |
|  7 |      70 | table t4         |
|  8 |       3 | 3                |
|  8 |       4 | NULL             |
|  8 |      81 | 82               |
| 11 |      21 | query rewrite2   |
| 13 |     120 | insert-->update3 |
| 21 |      20 | NULL             |
| 43 |      42 | delete-->insert  |
+----+---------+------------------+
call dbms_udr.remove_rule ('rule15');
call dbms_udr.create_rule('rule16','whh1','delete from t4 where id = :A', 'delete from t4 where id = :A*2','YES');
delete from t4 where id = 1;
delete from t4 where id = 20+1;
select * from t4 order by id;
+----+---------+------------------+
| id | c1_tint | c2_vcha          |
+----+---------+------------------+
|  1 |      22 | 查询             |
|  3 |      20 | 测试             |
|  4 |      40 | 用例             |
|  5 |      41 | 52               |
|  5 |      50 | mysql            |
|  7 |      70 | table t4         |
|  8 |       3 | 3                |
|  8 |       4 | NULL             |
|  8 |      81 | 82               |
| 11 |      21 | query rewrite2   |
| 13 |     120 | insert-->update3 |
| 43 |      42 | delete-->insert  |
+----+---------+------------------+
call dbms_udr.remove_rule ('rule16');
#### replace -- >  重写支持的SQL类型
call dbms_udr.create_rule('rule17','whh1','replace into t2 (id,c1_tint,c2_sint) values(2,21,:A)', 'update t2 set c3_mint = :A where id = 2','YES');
replace into t2 (id,c1_tint,c2_sint) values(2,21,100);
replace into t2 (id,c1_tint,c2_sint) values(2,30+1,100*2);
replace into t2 (id,c1_tint,c2_sint,c4_bint) values(3,31,100,34);
replace into t2 values(3,31,32,400,34,35.1,36.5,37.12);
Warnings:
Warning	1265	Data truncated for column 'c7_deci' at row 1
select * from t2 order by id;
+----+---------+---------+---------+---------+---------+---------+---------+
| id | c1_tint | c2_sint | c3_mint | c4_bint | c5_floa | c6_doub | c7_deci |
+----+---------+---------+---------+---------+---------+---------+---------+
|  1 |      11 |     100 |      13 |      14 |    15.1 |    16.5 |      17 |
|  1 |     101 |     101 |    NULL |    NULL |    NULL |    NULL |    NULL |
|  2 |      21 |     300 |     100 |      24 |    25.1 |    26.5 |      27 |
|  2 |      31 |     200 |    NULL |    NULL |    NULL |    NULL |    NULL |
|  3 |      31 |      32 |     400 |      34 |    35.1 |    36.5 |      37 |
|  3 |     100 |     100 |     400 |      34 |    35.1 |    36.5 |      37 |
|  5 |      41 |     200 |      53 |      54 |    55.1 |    56.5 |      57 |
+----+---------+---------+---------+---------+---------+---------+---------+
call dbms_udr.remove_rule ('rule17');
call dbms_udr.create_rule('rule18','whh1','replace into t2 (id,c1_tint,c2_sint) values(3,31,:A)', 'select * from t2 where id = 3 and c1_tint=31 and c2_sint=:A order by id desc','YES');
replace into t2 (id,c1_tint,c2_sint) values(3,31,32);
+----+---------+---------+---------+---------+---------+---------+---------+
| id | c1_tint | c2_sint | c3_mint | c4_bint | c5_floa | c6_doub | c7_deci |
+----+---------+---------+---------+---------+---------+---------+---------+
|  3 |      31 |      32 |     400 |      34 |    35.1 |    36.5 |      37 |
+----+---------+---------+---------+---------+---------+---------+---------+
select * from t2 order by id;
+----+---------+---------+---------+---------+---------+---------+---------+
| id | c1_tint | c2_sint | c3_mint | c4_bint | c5_floa | c6_doub | c7_deci |
+----+---------+---------+---------+---------+---------+---------+---------+
|  1 |      11 |     100 |      13 |      14 |    15.1 |    16.5 |      17 |
|  1 |     101 |     101 |    NULL |    NULL |    NULL |    NULL |    NULL |
|  2 |      21 |     300 |     100 |      24 |    25.1 |    26.5 |      27 |
|  2 |      31 |     200 |    NULL |    NULL |    NULL |    NULL |    NULL |
|  3 |      31 |      32 |     400 |      34 |    35.1 |    36.5 |      37 |
|  3 |     100 |     100 |     400 |      34 |    35.1 |    36.5 |      37 |
|  5 |      41 |     200 |      53 |      54 |    55.1 |    56.5 |      57 |
+----+---------+---------+---------+---------+---------+---------+---------+
call dbms_udr.remove_rule ('rule18');
call dbms_udr.create_rule('rule19','whh1','replace into t2 (id,c1_tint,c2_sint) values(3,31,:A)', 'insert into t2 (id,c1_tint,c2_sint) values(:A,:A,:A)','YES');
replace into t2 (id,c1_tint,c2_sint) values(3,31,10);
replace into t2 (id,c1_tint,c2_sint) values(3,30+1,11+1);
select * from t2 order by id;
+----+---------+---------+---------+---------+---------+---------+---------+
| id | c1_tint | c2_sint | c3_mint | c4_bint | c5_floa | c6_doub | c7_deci |
+----+---------+---------+---------+---------+---------+---------+---------+
|  1 |      11 |     100 |      13 |      14 |    15.1 |    16.5 |      17 |
|  1 |     101 |     101 |    NULL |    NULL |    NULL |    NULL |    NULL |
|  2 |      21 |     300 |     100 |      24 |    25.1 |    26.5 |      27 |
|  2 |      31 |     200 |    NULL |    NULL |    NULL |    NULL |    NULL |
|  3 |      31 |      12 |    NULL |    NULL |    NULL |    NULL |    NULL |
|  3 |     100 |     100 |     400 |      34 |    35.1 |    36.5 |      37 |
|  5 |      41 |     200 |      53 |      54 |    55.1 |    56.5 |      57 |
| 10 |      10 |      10 |    NULL |    NULL |    NULL |    NULL |    NULL |
+----+---------+---------+---------+---------+---------+---------+---------+
call dbms_udr.remove_rule ('rule19');
call dbms_udr.create_rule('rule20','whh1','replace into t2 (id,c1_tint,c2_sint) values(3,31,:A)', 'delete from t2 where c2_sint = :A and c1_tint=31 and id=3','YES');
replace into t2 (id,c1_tint,c2_sint) values(3,31,12);
select * from t2 order by id;
+----+---------+---------+---------+---------+---------+---------+---------+
| id | c1_tint | c2_sint | c3_mint | c4_bint | c5_floa | c6_doub | c7_deci |
+----+---------+---------+---------+---------+---------+---------+---------+
|  1 |      11 |     100 |      13 |      14 |    15.1 |    16.5 |      17 |
|  1 |     101 |     101 |    NULL |    NULL |    NULL |    NULL |    NULL |
|  2 |      21 |     300 |     100 |      24 |    25.1 |    26.5 |      27 |
|  2 |      31 |     200 |    NULL |    NULL |    NULL |    NULL |    NULL |
|  3 |     100 |     100 |     400 |      34 |    35.1 |    36.5 |      37 |
|  5 |      41 |     200 |      53 |      54 |    55.1 |    56.5 |      57 |
| 10 |      10 |      10 |    NULL |    NULL |    NULL |    NULL |    NULL |
+----+---------+---------+---------+---------+---------+---------+---------+
call dbms_udr.remove_rule ('rule20');
#### set -- >  重写支持的SQL类型
call dbms_udr.create_rule('rule21','whh1','set @p1=:A,@p2=:B,@p3=:C', 'update t4 set id = :A,c1_tint = :B,c2_vcha = :C where id = :A','YES');
set @p1=7,@p2=77,@p3='set-->update';
select * from t4 order by id;
+----+---------+------------------+
| id | c1_tint | c2_vcha          |
+----+---------+------------------+
|  1 |      22 | 查询             |
|  3 |      20 | 测试             |
|  4 |      40 | 用例             |
|  5 |      41 | 52               |
|  5 |      50 | mysql            |
|  7 |      77 | set-->update     |
|  8 |       3 | 3                |
|  8 |       4 | NULL             |
|  8 |      81 | 82               |
| 11 |      21 | query rewrite2   |
| 13 |     120 | insert-->update3 |
| 43 |      42 | delete-->insert  |
+----+---------+------------------+
call dbms_udr.remove_rule ('rule21');
call dbms_udr.create_rule('rule22','whh1','set @p1=:A,@p2=:B,@p3=:C', 'insert into t4 values(:A,:B,:C)','YES');
set @p1=10,@p2=10,@p3='set-->insert';
select * from t4 order by id;
+----+---------+------------------+
| id | c1_tint | c2_vcha          |
+----+---------+------------------+
|  1 |      22 | 查询             |
|  3 |      20 | 测试             |
|  4 |      40 | 用例             |
|  5 |      41 | 52               |
|  5 |      50 | mysql            |
|  7 |      77 | set-->update     |
|  8 |       3 | 3                |
|  8 |       4 | NULL             |
|  8 |      81 | 82               |
| 10 |      10 | set-->insert     |
| 11 |      21 | query rewrite2   |
| 13 |     120 | insert-->update3 |
| 43 |      42 | delete-->insert  |
+----+---------+------------------+
call dbms_udr.remove_rule ('rule22');
call dbms_udr.create_rule('rule23','whh1','set @p1=:A', 'select "query rewrite",* from t4 where id = :A order by id desc','YES');
set @p1=10;
+---------------+----+---------+--------------+
| query rewrite | id | c1_tint | c2_vcha      |
+---------------+----+---------+--------------+
| query rewrite | 10 |      10 | set-->insert |
+---------------+----+---------+--------------+
select * from t4 order by id;
+----+---------+------------------+
| id | c1_tint | c2_vcha          |
+----+---------+------------------+
|  1 |      22 | 查询             |
|  3 |      20 | 测试             |
|  4 |      40 | 用例             |
|  5 |      41 | 52               |
|  5 |      50 | mysql            |
|  7 |      77 | set-->update     |
|  8 |       3 | 3                |
|  8 |       4 | NULL             |
|  8 |      81 | 82               |
| 10 |      10 | set-->insert     |
| 11 |      21 | query rewrite2   |
| 13 |     120 | insert-->update3 |
| 43 |      42 | delete-->insert  |
+----+---------+------------------+
call dbms_udr.remove_rule ('rule23');
call dbms_udr.create_rule('rule24','whh1','set @p1=:A,@p2=:B,@p3=:C', 'delete from t4 where id = :A and c1_tint = :B and c2_vcha = :C','YES');
set @p1=10,@p2=10,@p3='set-->insert';
select * from t4 order by id;
+----+---------+------------------+
| id | c1_tint | c2_vcha          |
+----+---------+------------------+
|  1 |      22 | 查询             |
|  3 |      20 | 测试             |
|  4 |      40 | 用例             |
|  5 |      41 | 52               |
|  5 |      50 | mysql            |
|  7 |      77 | set-->update     |
|  8 |       3 | 3                |
|  8 |       4 | NULL             |
|  8 |      81 | 82               |
| 11 |      21 | query rewrite2   |
| 13 |     120 | insert-->update3 |
| 43 |      42 | delete-->insert  |
+----+---------+------------------+
call dbms_udr.remove_rule ('rule24');
#### enabled 
## 参数省略
call dbms_udr.create_rule(
  'rule_name1',
  'whh1',
  'select ?,? from dual', 
  'select ?+1,?+2 from dual');
select 1,2 from dual;
+-----+-----+
| ?+1 | ?+2 |
+-----+-----+
|   2 |   4 |
+-----+-----+
call dbms_udr.remove_rule ('rule_name1');
## 字符类型字面量
call dbms_udr.create_rule(
  'rule_name8',
  'whh1',
  'select ? from dual', 
  'select ? + 10 from dual',
  '1');
ERROR HY000: Invalid argument
call dbms_udr.create_rule(
  'rule_name9',
  'whh1',
  'select ? from dual', 
  'select ? + 20 from dual',
  '0');
ERROR HY000: Invalid argument
call dbms_udr.create_rule(
  'rule_name10',
  'whh1',
  'select ? from dual', 
  'select ? + 30 from dual',
  '1.5');
ERROR HY000: Invalid argument
call dbms_udr.create_rule(
  'rule_name11',
  'whh1',
  'select ? from dual', 
  'select ? + 40 from dual',
  'y');
ERROR HY000: Invalid argument
call dbms_udr.create_rule(
  'rule_name12',
  'whh1',
  'select ? from dual', 
  'select ? + 40 from dual',
  'ok');
ERROR HY000: Invalid argument
# 'YE'||'S'，'y'||'e'||'s'，'n'||'o'
call dbms_udr.create_rule(
  'rule_name19',
  'whh1',
  'select ? from dual', 
  'select ? * 4 from dual', 
  'YE'||'S');
ERROR 01000: Truncated incorrect DOUBLE value
call dbms_udr.create_rule(
  'rule_name20',
  'whh1',
  'select ? from dual', 
  'select ? * 5 from dual', 
  'y'||'e'||'s');
ERROR 01000: Truncated incorrect DOUBLE value
call dbms_udr.create_rule(
  'rule_name20',
  'whh1',
  'select ? from dual', 
  'select ? * 6 from dual', 
  'n'||'o');
ERROR 01000: Truncated incorrect DOUBLE value
# 'YES','Yes','yes','NO','No','no'
call dbms_udr.create_rule(
  'rule_name13',
  'whh1',
  'select ? from dual', 
  'select ? + 50 from dual',
  'YES');
select 1 from dual;
+--------+
| ? + 50 |
+--------+
|     51 |
+--------+
call dbms_udr.remove_rule ('rule_name13');
call dbms_udr.create_rule(
  'rule_name14',
  'whh1',
  'select ? from dual', 
  'select ? + 60 from dual',
  'Yes');
select 2 from dual;
+--------+
| ? + 60 |
+--------+
|     62 |
+--------+
call dbms_udr.remove_rule ('rule_name14');
call dbms_udr.create_rule(
  'rule_name15',
  'whh1',
  'select ? from dual', 
  'select ? + 70 from dual',
  'yes');
select 3 from dual;
+--------+
| ? + 70 |
+--------+
|     73 |
+--------+
call dbms_udr.remove_rule ('rule_name15');
call dbms_udr.create_rule(
  'rule_name16',
  'whh1',
  'select ? from dual', 
  'select ? * 2 from dual',
  'NO');
select 1 from dual;
+---+
| 1 |
+---+
| 1 |
+---+
call dbms_udr.enable_rule ('rule_name16');
select 1 from dual;
+-------+
| ? * 2 |
+-------+
|     2 |
+-------+
call dbms_udr.remove_rule ('rule_name16');
call dbms_udr.create_rule(
  'rule_name17',
  'whh1',
  'select ? from dual', 
  'select ?  * 3 from dual',
  'No');
select 2 from dual;
+---+
| 2 |
+---+
| 2 |
+---+
call dbms_udr.enable_rule ('rule_name17');
select 2 from dual;
+--------+
| ?  * 3 |
+--------+
|      6 |
+--------+
call dbms_udr.remove_rule ('rule_name17');
call dbms_udr.create_rule(
  'rule_name18',
  'whh1',
  'select ? from dual', 
  'select ? * 4 from dual',
  'no');
select 3 from dual;
+---+
| 3 |
+---+
| 3 |
+---+
call dbms_udr.enable_rule ('rule_name18');
select 3 from dual;
+-------+
| ? * 4 |
+-------+
|    12 |
+-------+
call dbms_udr.remove_rule ('rule_name18');
# 一段超长字符串字面量
call dbms_udr.create_rule(
  'rule_name18',
  'whh1',
  'select ? from dual', 
  'select ? * 4 from dual',
  rpad('yes',255,' '));
ERROR HY000: Invalid argument
call dbms_udr.create_rule(
  'rule_name18',
  'whh1',
  'select ? from dual', 
  'select ? * 4 from dual',
  rpad('yes',256,' '));
ERROR HY000: Invalid argument
call dbms_udr.create_rule(
  'rule_name18',
  'whh1',
  'select ? from dual', 
  'select ? * 4 from dual',
  rpad('yes',257,' '));
ERROR HY000: Invalid argument
# 修改租户级配置项,重写功能关闭
alter system set enable_user_defined_rewrite_rules = 'OFF';
# Clean up users
drop user whh@'%';
drop database whh1;
