drop database if exists test_set;
drop database if exists test_enum_set;
set sql_mode='';
create database test_enum_set;
use test_enum_set;
create table test_tinyint(c1 int, c2 tinyint);
create table test_smallint(c1 int, c2 smallint);
create table test_mediumint(c1 int, c2 mediumint);
create table test_int(c1 int, c2 int);
create table test_bigint(c1 int, c2 bigint);
create table test_utinyint(c1 int, c2 tinyint unsigned);
create table test_usmallint(c1 int, c2 smallint unsigned);
create table test_umediumint(c1 int, c2 mediumint unsigned);
create table test_uint(c1 int, c2 int unsigned);
create table test_ubigint(c1 int, c2 bigint unsigned);
create table test_float(c1 int, c2 float);
create table test_double(c1 int, c2 double);
create table test_ufloat(c1 int, c2 float unsigned);
create table test_udouble(c1 int, c2 double unsigned);
create table test_number(c1 int, c2 decimal);
create table test_unumber(c1 int, c2 decimal unsigned);
create table test_datetime(c1 int, c2 datetime);
create table test_timestamp(c1 int, c2 timestamp);
create table test_date(c1 int, c2 date);
create table test_time(c1 int, c2 time);
create table test_year(c1 int, c2 year);
create table test_varchar(c1 int, c2 varchar(32));
create table test_char(c1 int, c2 char(32));
create table test_bit(c1 int, c2 bit(8));
create table test_enum(c1 int, c2 enum('b', 'a', '2011-1-1 21:35:52', '8', '7'));
create table test_set(c1 int, c2 set('b', 'a', '2011-1-1 21:35:52', '8', '7'));
create table t_bit(c1 int, c2 bit(8));
select * from test_tinyint union select * from t_bit;
Catalog	Database	Table	Table_alias	Column	Column_alias	Type	Length	Max length	Is_null	Flags	Decimals	Charsetnr
def				c1	c1	3	11	0	Y	32896	0	63
def				c2	c2	253	32	0	Y	0	31	45
c1	c2
select * from test_smallint union select * from t_bit;
Catalog	Database	Table	Table_alias	Column	Column_alias	Type	Length	Max length	Is_null	Flags	Decimals	Charsetnr
def				c1	c1	3	11	0	Y	32896	0	63
def				c2	c2	253	32	0	Y	0	31	45
c1	c2
select * from test_mediumint union select * from t_bit;
Catalog	Database	Table	Table_alias	Column	Column_alias	Type	Length	Max length	Is_null	Flags	Decimals	Charsetnr
def				c1	c1	3	11	0	Y	32896	0	63
def				c2	c2	253	36	0	Y	0	31	45
c1	c2
select * from test_int union select * from t_bit;
Catalog	Database	Table	Table_alias	Column	Column_alias	Type	Length	Max length	Is_null	Flags	Decimals	Charsetnr
def				c1	c1	3	11	0	Y	32896	0	63
def				c2	c2	253	44	0	Y	0	31	45
c1	c2
select * from test_bigint union select * from t_bit;
Catalog	Database	Table	Table_alias	Column	Column_alias	Type	Length	Max length	Is_null	Flags	Decimals	Charsetnr
def				c1	c1	3	11	0	Y	32896	0	63
def				c2	c2	253	80	0	Y	0	31	45
c1	c2
select * from test_utinyint union select * from t_bit;
Catalog	Database	Table	Table_alias	Column	Column_alias	Type	Length	Max length	Is_null	Flags	Decimals	Charsetnr
def				c1	c1	3	11	0	Y	32896	0	63
def				c2	c2	253	32	0	Y	0	31	45
c1	c2
select * from test_usmallint union select * from t_bit;
Catalog	Database	Table	Table_alias	Column	Column_alias	Type	Length	Max length	Is_null	Flags	Decimals	Charsetnr
def				c1	c1	3	11	0	Y	32896	0	63
def				c2	c2	253	32	0	Y	0	31	45
c1	c2
select * from test_umediumint union select * from t_bit;
Catalog	Database	Table	Table_alias	Column	Column_alias	Type	Length	Max length	Is_null	Flags	Decimals	Charsetnr
def				c1	c1	3	11	0	Y	32896	0	63
def				c2	c2	253	32	0	Y	0	31	45
c1	c2
select * from test_uint union select * from t_bit;
Catalog	Database	Table	Table_alias	Column	Column_alias	Type	Length	Max length	Is_null	Flags	Decimals	Charsetnr
def				c1	c1	3	11	0	Y	32896	0	63
def				c2	c2	253	40	0	Y	0	31	45
c1	c2
select * from test_ubigint union select * from t_bit;
Catalog	Database	Table	Table_alias	Column	Column_alias	Type	Length	Max length	Is_null	Flags	Decimals	Charsetnr
def				c1	c1	3	11	0	Y	32896	0	63
def				c2	c2	253	80	0	Y	0	31	45
c1	c2
select * from test_float union select * from t_bit;
Catalog	Database	Table	Table_alias	Column	Column_alias	Type	Length	Max length	Is_null	Flags	Decimals	Charsetnr
def				c1	c1	3	11	0	Y	32896	0	63
def				c2	c2	253	48	0	Y	0	31	45
c1	c2
select * from test_double union select * from t_bit;
Catalog	Database	Table	Table_alias	Column	Column_alias	Type	Length	Max length	Is_null	Flags	Decimals	Charsetnr
def				c1	c1	3	11	0	Y	32896	0	63
def				c2	c2	253	92	0	Y	0	31	45
c1	c2
select * from test_ufloat union select * from t_bit;
Catalog	Database	Table	Table_alias	Column	Column_alias	Type	Length	Max length	Is_null	Flags	Decimals	Charsetnr
def				c1	c1	3	11	0	Y	32896	0	63
def				c2	c2	253	48	0	Y	0	31	45
c1	c2
select * from test_udouble union select * from t_bit;
Catalog	Database	Table	Table_alias	Column	Column_alias	Type	Length	Max length	Is_null	Flags	Decimals	Charsetnr
def				c1	c1	3	11	0	Y	32896	0	63
def				c2	c2	253	92	0	Y	0	31	45
c1	c2
select * from test_number union select * from t_bit;
Catalog	Database	Table	Table_alias	Column	Column_alias	Type	Length	Max length	Is_null	Flags	Decimals	Charsetnr
def				c1	c1	3	11	0	Y	32896	0	63
def				c2	c2	253	44	0	Y	0	31	45
c1	c2
select * from test_unumber union select * from t_bit;
Catalog	Database	Table	Table_alias	Column	Column_alias	Type	Length	Max length	Is_null	Flags	Decimals	Charsetnr
def				c1	c1	3	11	0	Y	32896	0	63
def				c2	c2	253	40	0	Y	0	31	45
c1	c2
select * from test_datetime union select * from t_bit;
Catalog	Database	Table	Table_alias	Column	Column_alias	Type	Length	Max length	Is_null	Flags	Decimals	Charsetnr
def				c1	c1	3	11	0	Y	32896	0	63
def				c2	c2	253	76	0	Y	0	31	45
c1	c2
select * from test_timestamp union select * from t_bit;
Catalog	Database	Table	Table_alias	Column	Column_alias	Type	Length	Max length	Is_null	Flags	Decimals	Charsetnr
def				c1	c1	3	11	0	Y	32896	0	63
def				c2	c2	253	76	0	Y	0	31	45
c1	c2
select * from test_date union select * from t_bit;
Catalog	Database	Table	Table_alias	Column	Column_alias	Type	Length	Max length	Is_null	Flags	Decimals	Charsetnr
def				c1	c1	3	11	0	Y	32896	0	63
def				c2	c2	253	40	0	Y	0	31	45
c1	c2
select * from test_time union select * from t_bit;
Catalog	Database	Table	Table_alias	Column	Column_alias	Type	Length	Max length	Is_null	Flags	Decimals	Charsetnr
def				c1	c1	3	11	0	Y	32896	0	63
def				c2	c2	253	40	0	Y	0	31	45
c1	c2
select * from test_year union select * from t_bit;
Catalog	Database	Table	Table_alias	Column	Column_alias	Type	Length	Max length	Is_null	Flags	Decimals	Charsetnr
def				c1	c1	3	11	0	Y	32896	0	63
def				c2	c2	253	32	0	Y	0	31	45
c1	c2
select * from test_varchar union select * from t_bit;
Catalog	Database	Table	Table_alias	Column	Column_alias	Type	Length	Max length	Is_null	Flags	Decimals	Charsetnr
def				c1	c1	3	11	0	Y	32896	0	63
def				c2	c2	253	128	0	Y	0	31	45
c1	c2
select * from test_char union select * from t_bit;
Catalog	Database	Table	Table_alias	Column	Column_alias	Type	Length	Max length	Is_null	Flags	Decimals	Charsetnr
def				c1	c1	3	11	0	Y	32896	0	63
def				c2	c2	254	128	0	Y	0	31	45
c1	c2
select * from test_bit union select * from t_bit;
Catalog	Database	Table	Table_alias	Column	Column_alias	Type	Length	Max length	Is_null	Flags	Decimals	Charsetnr
def				c1	c1	3	11	0	Y	32896	0	63
def				c2	c2	16	8	0	Y	160	0	63
c1	c2
select * from test_enum union select * from t_bit;
Catalog	Database	Table	Table_alias	Column	Column_alias	Type	Length	Max length	Is_null	Flags	Decimals	Charsetnr
def				c1	c1	3	11	0	Y	32896	0	63
def				c2	c2	253	68	0	Y	0	31	45
c1	c2
select * from test_set union select * from t_bit;
Catalog	Database	Table	Table_alias	Column	Column_alias	Type	Length	Max length	Is_null	Flags	Decimals	Charsetnr
def				c1	c1	3	11	0	Y	32896	0	63
def				c2	c2	253	100	0	Y	0	31	45
c1	c2
select 0x0101 union select c2 from test_bit;
Catalog	Database	Table	Table_alias	Column	Column_alias	Type	Length	Max length	Is_null	Flags	Decimals	Charsetnr
def				0x0101	0x0101	253	8	2	Y	128	31	63
0x0101

create table t_enum(c1 int, c2 enum('b', 'a', '2011-1-1 21:35:52', '2017', '7'));
select null from dual union select c2 from t_enum;
Catalog	Database	Table	Table_alias	Column	Column_alias	Type	Length	Max length	Is_null	Flags	Decimals	Charsetnr
def				null	null	253	68	0	Y	0	31	45
null
NULL
select * from test_tinyint union select * from t_enum;
Catalog	Database	Table	Table_alias	Column	Column_alias	Type	Length	Max length	Is_null	Flags	Decimals	Charsetnr
def				c1	c1	3	11	0	Y	32896	0	63
def				c2	c2	253	68	0	Y	0	31	45
c1	c2
select * from test_smallint union select * from t_enum;
Catalog	Database	Table	Table_alias	Column	Column_alias	Type	Length	Max length	Is_null	Flags	Decimals	Charsetnr
def				c1	c1	3	11	0	Y	32896	0	63
def				c2	c2	253	68	0	Y	0	31	45
c1	c2
select * from test_mediumint union select * from t_enum;
Catalog	Database	Table	Table_alias	Column	Column_alias	Type	Length	Max length	Is_null	Flags	Decimals	Charsetnr
def				c1	c1	3	11	0	Y	32896	0	63
def				c2	c2	253	68	0	Y	0	31	45
c1	c2
select * from test_int union select * from t_enum;
Catalog	Database	Table	Table_alias	Column	Column_alias	Type	Length	Max length	Is_null	Flags	Decimals	Charsetnr
def				c1	c1	3	11	0	Y	32896	0	63
def				c2	c2	253	68	0	Y	0	31	45
c1	c2
select * from test_bigint union select * from t_enum;
Catalog	Database	Table	Table_alias	Column	Column_alias	Type	Length	Max length	Is_null	Flags	Decimals	Charsetnr
def				c1	c1	3	11	0	Y	32896	0	63
def				c2	c2	253	80	0	Y	0	31	45
c1	c2
select * from test_utinyint union select * from t_enum;
Catalog	Database	Table	Table_alias	Column	Column_alias	Type	Length	Max length	Is_null	Flags	Decimals	Charsetnr
def				c1	c1	3	11	0	Y	32896	0	63
def				c2	c2	253	68	0	Y	0	31	45
c1	c2
select * from test_usmallint union select * from t_enum;
Catalog	Database	Table	Table_alias	Column	Column_alias	Type	Length	Max length	Is_null	Flags	Decimals	Charsetnr
def				c1	c1	3	11	0	Y	32896	0	63
def				c2	c2	253	68	0	Y	0	31	45
c1	c2
select * from test_umediumint union select * from t_enum;
Catalog	Database	Table	Table_alias	Column	Column_alias	Type	Length	Max length	Is_null	Flags	Decimals	Charsetnr
def				c1	c1	3	11	0	Y	32896	0	63
def				c2	c2	253	68	0	Y	0	31	45
c1	c2
select * from test_uint union select * from t_enum;
Catalog	Database	Table	Table_alias	Column	Column_alias	Type	Length	Max length	Is_null	Flags	Decimals	Charsetnr
def				c1	c1	3	11	0	Y	32896	0	63
def				c2	c2	253	68	0	Y	0	31	45
c1	c2
select * from test_ubigint union select * from t_enum;
Catalog	Database	Table	Table_alias	Column	Column_alias	Type	Length	Max length	Is_null	Flags	Decimals	Charsetnr
def				c1	c1	3	11	0	Y	32896	0	63
def				c2	c2	253	80	0	Y	0	31	45
c1	c2
select * from test_float union select * from t_enum;
Catalog	Database	Table	Table_alias	Column	Column_alias	Type	Length	Max length	Is_null	Flags	Decimals	Charsetnr
def				c1	c1	3	11	0	Y	32896	0	63
def				c2	c2	253	68	0	Y	0	31	45
c1	c2
select * from test_double union select * from t_enum;
Catalog	Database	Table	Table_alias	Column	Column_alias	Type	Length	Max length	Is_null	Flags	Decimals	Charsetnr
def				c1	c1	3	11	0	Y	32896	0	63
def				c2	c2	253	92	0	Y	0	31	45
c1	c2
select * from test_ufloat union select * from t_enum;
Catalog	Database	Table	Table_alias	Column	Column_alias	Type	Length	Max length	Is_null	Flags	Decimals	Charsetnr
def				c1	c1	3	11	0	Y	32896	0	63
def				c2	c2	253	68	0	Y	0	31	45
c1	c2
select * from test_udouble union select * from t_enum;
Catalog	Database	Table	Table_alias	Column	Column_alias	Type	Length	Max length	Is_null	Flags	Decimals	Charsetnr
def				c1	c1	3	11	0	Y	32896	0	63
def				c2	c2	253	92	0	Y	0	31	45
c1	c2
select * from test_number union select * from t_enum;
Catalog	Database	Table	Table_alias	Column	Column_alias	Type	Length	Max length	Is_null	Flags	Decimals	Charsetnr
def				c1	c1	3	11	0	Y	32896	0	63
def				c2	c2	253	68	0	Y	0	31	45
c1	c2
select * from test_unumber union select * from t_enum;
Catalog	Database	Table	Table_alias	Column	Column_alias	Type	Length	Max length	Is_null	Flags	Decimals	Charsetnr
def				c1	c1	3	11	0	Y	32896	0	63
def				c2	c2	253	68	0	Y	0	31	45
c1	c2
select * from test_datetime union select * from t_enum;
Catalog	Database	Table	Table_alias	Column	Column_alias	Type	Length	Max length	Is_null	Flags	Decimals	Charsetnr
def				c1	c1	3	11	0	Y	32896	0	63
def				c2	c2	253	76	0	Y	0	31	45
c1	c2
select * from test_timestamp union select * from t_enum;
Catalog	Database	Table	Table_alias	Column	Column_alias	Type	Length	Max length	Is_null	Flags	Decimals	Charsetnr
def				c1	c1	3	11	0	Y	32896	0	63
def				c2	c2	253	76	0	Y	0	31	45
c1	c2
select * from test_date union select * from t_enum;
Catalog	Database	Table	Table_alias	Column	Column_alias	Type	Length	Max length	Is_null	Flags	Decimals	Charsetnr
def				c1	c1	3	11	0	Y	32896	0	63
def				c2	c2	253	68	0	Y	0	31	45
c1	c2
select * from test_time union select * from t_enum;
Catalog	Database	Table	Table_alias	Column	Column_alias	Type	Length	Max length	Is_null	Flags	Decimals	Charsetnr
def				c1	c1	3	11	0	Y	32896	0	63
def				c2	c2	253	68	0	Y	0	31	45
c1	c2
select * from test_year union select * from t_enum;
Catalog	Database	Table	Table_alias	Column	Column_alias	Type	Length	Max length	Is_null	Flags	Decimals	Charsetnr
def				c1	c1	3	11	0	Y	32896	0	63
def				c2	c2	253	68	0	Y	0	31	45
c1	c2
select * from test_varchar union select * from t_enum;
Catalog	Database	Table	Table_alias	Column	Column_alias	Type	Length	Max length	Is_null	Flags	Decimals	Charsetnr
def				c1	c1	3	11	0	Y	32896	0	63
def				c2	c2	253	128	0	Y	0	31	45
c1	c2
select * from test_char union select * from t_enum;
Catalog	Database	Table	Table_alias	Column	Column_alias	Type	Length	Max length	Is_null	Flags	Decimals	Charsetnr
def				c1	c1	3	11	0	Y	32896	0	63
def				c2	c2	254	128	0	Y	0	31	45
c1	c2
select X'0a0a'  union select c2 from t_enum;
Catalog	Database	Table	Table_alias	Column	Column_alias	Type	Length	Max length	Is_null	Flags	Decimals	Charsetnr
def				X'0a0a'	X'0a0a'	253	68	2	Y	0	31	45
X'0a0a'



select * from test_bit union select * from t_enum;
Catalog	Database	Table	Table_alias	Column	Column_alias	Type	Length	Max length	Is_null	Flags	Decimals	Charsetnr
def				c1	c1	3	11	0	Y	32896	0	63
def				c2	c2	253	68	0	Y	0	31	45
c1	c2
select * from test_enum union select * from t_enum;
Catalog	Database	Table	Table_alias	Column	Column_alias	Type	Length	Max length	Is_null	Flags	Decimals	Charsetnr
def				c1	c1	3	11	0	Y	32896	0	63
def				c2	c2	253	68	0	Y	0	31	45
c1	c2
select * from test_set union select * from t_enum;
Catalog	Database	Table	Table_alias	Column	Column_alias	Type	Length	Max length	Is_null	Flags	Decimals	Charsetnr
def				c1	c1	3	11	0	Y	32896	0	63
def				c2	c2	253	100	0	Y	0	31	45
c1	c2
select 0x43 union select c2 from t_enum order by `0x43`;
Catalog	Database	Table	Table_alias	Column	Column_alias	Type	Length	Max length	Is_null	Flags	Decimals	Charsetnr
def				0x43	0x43	253	68	1	Y	0	31	45
0x43
C
create table t_set(c1 int, c2 enum('b', 'a', '2011-1-1 21:35:52', '8', '7'));
select null from dual union select c2 from t_set;
Catalog	Database	Table	Table_alias	Column	Column_alias	Type	Length	Max length	Is_null	Flags	Decimals	Charsetnr
def				null	null	253	68	0	Y	0	31	45
null
NULL
select * from test_tinyint union select * from t_set;
Catalog	Database	Table	Table_alias	Column	Column_alias	Type	Length	Max length	Is_null	Flags	Decimals	Charsetnr
def				c1	c1	3	11	0	Y	32896	0	63
def				c2	c2	253	68	0	Y	0	31	45
c1	c2
select * from test_smallint union select * from t_set;
Catalog	Database	Table	Table_alias	Column	Column_alias	Type	Length	Max length	Is_null	Flags	Decimals	Charsetnr
def				c1	c1	3	11	0	Y	32896	0	63
def				c2	c2	253	68	0	Y	0	31	45
c1	c2
select * from test_mediumint union select * from t_set;
Catalog	Database	Table	Table_alias	Column	Column_alias	Type	Length	Max length	Is_null	Flags	Decimals	Charsetnr
def				c1	c1	3	11	0	Y	32896	0	63
def				c2	c2	253	68	0	Y	0	31	45
c1	c2
select * from test_int union select * from t_set;
Catalog	Database	Table	Table_alias	Column	Column_alias	Type	Length	Max length	Is_null	Flags	Decimals	Charsetnr
def				c1	c1	3	11	0	Y	32896	0	63
def				c2	c2	253	68	0	Y	0	31	45
c1	c2
select * from test_bigint union select * from t_set;
Catalog	Database	Table	Table_alias	Column	Column_alias	Type	Length	Max length	Is_null	Flags	Decimals	Charsetnr
def				c1	c1	3	11	0	Y	32896	0	63
def				c2	c2	253	80	0	Y	0	31	45
c1	c2
select * from test_utinyint union select * from t_set;
Catalog	Database	Table	Table_alias	Column	Column_alias	Type	Length	Max length	Is_null	Flags	Decimals	Charsetnr
def				c1	c1	3	11	0	Y	32896	0	63
def				c2	c2	253	68	0	Y	0	31	45
c1	c2
select * from test_usmallint union select * from t_set;
Catalog	Database	Table	Table_alias	Column	Column_alias	Type	Length	Max length	Is_null	Flags	Decimals	Charsetnr
def				c1	c1	3	11	0	Y	32896	0	63
def				c2	c2	253	68	0	Y	0	31	45
c1	c2
select * from test_umediumint union select * from t_set;
Catalog	Database	Table	Table_alias	Column	Column_alias	Type	Length	Max length	Is_null	Flags	Decimals	Charsetnr
def				c1	c1	3	11	0	Y	32896	0	63
def				c2	c2	253	68	0	Y	0	31	45
c1	c2
select * from test_uint union select * from t_set;
Catalog	Database	Table	Table_alias	Column	Column_alias	Type	Length	Max length	Is_null	Flags	Decimals	Charsetnr
def				c1	c1	3	11	0	Y	32896	0	63
def				c2	c2	253	68	0	Y	0	31	45
c1	c2
select * from test_ubigint union select * from t_set;
Catalog	Database	Table	Table_alias	Column	Column_alias	Type	Length	Max length	Is_null	Flags	Decimals	Charsetnr
def				c1	c1	3	11	0	Y	32896	0	63
def				c2	c2	253	80	0	Y	0	31	45
c1	c2
select * from test_float union select * from t_set;
Catalog	Database	Table	Table_alias	Column	Column_alias	Type	Length	Max length	Is_null	Flags	Decimals	Charsetnr
def				c1	c1	3	11	0	Y	32896	0	63
def				c2	c2	253	68	0	Y	0	31	45
c1	c2
select * from test_double union select * from t_set;
Catalog	Database	Table	Table_alias	Column	Column_alias	Type	Length	Max length	Is_null	Flags	Decimals	Charsetnr
def				c1	c1	3	11	0	Y	32896	0	63
def				c2	c2	253	92	0	Y	0	31	45
c1	c2
select * from test_ufloat union select * from t_set;
Catalog	Database	Table	Table_alias	Column	Column_alias	Type	Length	Max length	Is_null	Flags	Decimals	Charsetnr
def				c1	c1	3	11	0	Y	32896	0	63
def				c2	c2	253	68	0	Y	0	31	45
c1	c2
select * from test_udouble union select * from t_set;
Catalog	Database	Table	Table_alias	Column	Column_alias	Type	Length	Max length	Is_null	Flags	Decimals	Charsetnr
def				c1	c1	3	11	0	Y	32896	0	63
def				c2	c2	253	92	0	Y	0	31	45
c1	c2
select * from test_number union select * from t_set;
Catalog	Database	Table	Table_alias	Column	Column_alias	Type	Length	Max length	Is_null	Flags	Decimals	Charsetnr
def				c1	c1	3	11	0	Y	32896	0	63
def				c2	c2	253	68	0	Y	0	31	45
c1	c2
select * from test_unumber union select * from t_set;
Catalog	Database	Table	Table_alias	Column	Column_alias	Type	Length	Max length	Is_null	Flags	Decimals	Charsetnr
def				c1	c1	3	11	0	Y	32896	0	63
def				c2	c2	253	68	0	Y	0	31	45
c1	c2
select * from test_datetime union select * from t_set;
Catalog	Database	Table	Table_alias	Column	Column_alias	Type	Length	Max length	Is_null	Flags	Decimals	Charsetnr
def				c1	c1	3	11	0	Y	32896	0	63
def				c2	c2	253	76	0	Y	0	31	45
c1	c2
select * from test_timestamp union select * from t_set;
Catalog	Database	Table	Table_alias	Column	Column_alias	Type	Length	Max length	Is_null	Flags	Decimals	Charsetnr
def				c1	c1	3	11	0	Y	32896	0	63
def				c2	c2	253	76	0	Y	0	31	45
c1	c2
select * from test_date union select * from t_set;
Catalog	Database	Table	Table_alias	Column	Column_alias	Type	Length	Max length	Is_null	Flags	Decimals	Charsetnr
def				c1	c1	3	11	0	Y	32896	0	63
def				c2	c2	253	68	0	Y	0	31	45
c1	c2
select * from test_time union select * from t_set;
Catalog	Database	Table	Table_alias	Column	Column_alias	Type	Length	Max length	Is_null	Flags	Decimals	Charsetnr
def				c1	c1	3	11	0	Y	32896	0	63
def				c2	c2	253	68	0	Y	0	31	45
c1	c2
select * from test_year union select * from t_set;
Catalog	Database	Table	Table_alias	Column	Column_alias	Type	Length	Max length	Is_null	Flags	Decimals	Charsetnr
def				c1	c1	3	11	0	Y	32896	0	63
def				c2	c2	253	68	0	Y	0	31	45
c1	c2
select * from test_varchar union select * from t_set;
Catalog	Database	Table	Table_alias	Column	Column_alias	Type	Length	Max length	Is_null	Flags	Decimals	Charsetnr
def				c1	c1	3	11	0	Y	32896	0	63
def				c2	c2	253	128	0	Y	0	31	45
c1	c2
select * from test_char union select * from t_set;
Catalog	Database	Table	Table_alias	Column	Column_alias	Type	Length	Max length	Is_null	Flags	Decimals	Charsetnr
def				c1	c1	3	11	0	Y	32896	0	63
def				c2	c2	254	128	0	Y	0	31	45
c1	c2
select 0x43 union select c2 from t_enum order by `0x43`;
Catalog	Database	Table	Table_alias	Column	Column_alias	Type	Length	Max length	Is_null	Flags	Decimals	Charsetnr
def				0x43	0x43	253	68	1	Y	0	31	45
0x43
C
select * from test_bit union select * from t_set;
Catalog	Database	Table	Table_alias	Column	Column_alias	Type	Length	Max length	Is_null	Flags	Decimals	Charsetnr
def				c1	c1	3	11	0	Y	32896	0	63
def				c2	c2	253	68	0	Y	0	31	45
c1	c2
select * from test_enum union select * from t_set;
Catalog	Database	Table	Table_alias	Column	Column_alias	Type	Length	Max length	Is_null	Flags	Decimals	Charsetnr
def				c1	c1	3	11	0	Y	32896	0	63
def				c2	c2	253	68	0	Y	0	31	45
c1	c2
select * from test_set union select * from t_set;
Catalog	Database	Table	Table_alias	Column	Column_alias	Type	Length	Max length	Is_null	Flags	Decimals	Charsetnr
def				c1	c1	3	11	0	Y	32896	0	63
def				c2	c2	253	100	0	Y	0	31	45
c1	c2
select 0x0101 union select c2 from test_set order by `0x0101`;
Catalog	Database	Table	Table_alias	Column	Column_alias	Type	Length	Max length	Is_null	Flags	Decimals	Charsetnr
def				0x0101	0x0101	253	100	2	Y	0	31	45
0x0101

drop database test_enum_set;
create database test_enum_set;
use test_enum_set;
create table test_tinyint(c1 int, c2 tinyint);
create table test_smallint(c1 int, c2 smallint);
create table test_mediumint(c1 int, c2 mediumint);
create table test_int(c1 int, c2 int);
create table test_bigint(c1 int, c2 bigint);
create table test_utinyint(c1 int, c2 tinyint unsigned);
create table test_usmallint(c1 int, c2 smallint unsigned);
create table test_umediumint(c1 int, c2 mediumint unsigned);
create table test_uint(c1 int, c2 int unsigned);
create table test_ubigint(c1 int, c2 bigint unsigned);
create table test_float(c1 int, c2 float);
create table test_double(c1 int, c2 double);
create table test_ufloat(c1 int, c2 float unsigned);
create table test_udouble(c1 int, c2 double unsigned);
create table test_number(c1 int, c2 decimal);
create table test_unumber(c1 int, c2 decimal unsigned);
create table test_datetime(c1 int, c2 datetime);
create table test_timestamp(c1 int, c2 timestamp);
create table test_date(c1 int, c2 date);
create table test_time(c1 int, c2 time);
create table test_year(c1 int, c2 year);
create table test_varchar(c1 int, c2 varchar(32));
create table test_char(c1 int, c2 char(32));
create table test_bit(c1 int, c2 bit(8));
create table test_enum(c1 int, c2 enum('a', 'b', '2011-01-01 21:35:52', '8', '7'));
create table test_set(c1 int, c2 set('a', 'b', '2011-01-01 21:35:52', '8', '7'));
create table t_enum(c1 int, c2 enum('b', 'a', '2011-01-01 21:35:52', '2002', '7'));
insert into t_enum value(1,1),(2,2),(3,3),(4,4),(5,5);
insert into test_tinyint values (1,2), (2,3);
select * from test_tinyint as t1, t_enum where t1.c2 = t_enum.c2 order by t1.c1, t_enum.c1;
c1	c2	c1	c2
1	2	2	a
2	3	3	2011-01-01 21:35:52
insert into test_smallint values (1,2), (2,3);
select * from test_smallint as t1, t_enum where t1.c2 = t_enum.c2 order by t1.c1, t_enum.c1;
c1	c2	c1	c2
1	2	2	a
2	3	3	2011-01-01 21:35:52
insert into test_mediumint values (1,2), (2,3);
select * from test_mediumint as t1, t_enum where t1.c2 = t_enum.c2 order by t1.c1, t_enum.c1;
c1	c2	c1	c2
1	2	2	a
2	3	3	2011-01-01 21:35:52
insert into test_int values (1,2), (2,3);
select * from test_int as t1, t_enum where t1.c2 = t_enum.c2 order by t1.c1, t_enum.c1;
c1	c2	c1	c2
1	2	2	a
2	3	3	2011-01-01 21:35:52
insert into test_bigint values (1,2), (2,3);
select * from test_bigint as t1, t_enum where t1.c2 = t_enum.c2 order by t1.c1, t_enum.c1;
c1	c2	c1	c2
1	2	2	a
2	3	3	2011-01-01 21:35:52
insert into test_utinyint values (1,2), (2,3);
select * from test_utinyint as t1, t_enum where t1.c2 = t_enum.c2 order by t1.c1, t_enum.c1;
c1	c2	c1	c2
1	2	2	a
2	3	3	2011-01-01 21:35:52
insert into test_usmallint values (1,2), (2,3);
select * from test_usmallint as t1, t_enum where t1.c2 = t_enum.c2 order by t1.c1, t_enum.c1;
c1	c2	c1	c2
1	2	2	a
2	3	3	2011-01-01 21:35:52
insert into test_umediumint values (1,2), (2,3);
select * from test_umediumint as t1, t_enum where t1.c2 = t_enum.c2 order by t1.c1, t_enum.c1;
c1	c2	c1	c2
1	2	2	a
2	3	3	2011-01-01 21:35:52
insert into test_uint values (1,2), (2,3);
select * from test_uint as t1, t_enum where t1.c2 = t_enum.c2 order by t1.c1, t_enum.c1;
c1	c2	c1	c2
1	2	2	a
2	3	3	2011-01-01 21:35:52
insert into test_ubigint values (1,2), (2,3);
select * from test_ubigint as t1, t_enum where t1.c2 = t_enum.c2 order by t1.c1, t_enum.c1;
c1	c2	c1	c2
1	2	2	a
2	3	3	2011-01-01 21:35:52
insert into test_float values (1,2), (2,3);
select * from test_float as t1, t_enum where t1.c2 = t_enum.c2 order by t1.c1, t_enum.c1;
c1	c2	c1	c2
1	2	2	a
2	3	3	2011-01-01 21:35:52
insert into test_double values (1,2), (2,3);
select * from test_double as t1, t_enum where t1.c2 = t_enum.c2 order by t1.c1, t_enum.c1;
c1	c2	c1	c2
1	2	2	a
2	3	3	2011-01-01 21:35:52
insert into test_ufloat values (1,2), (2,3);
select * from test_ufloat as t1, t_enum where t1.c2 = t_enum.c2 order by t1.c1, t_enum.c1;
c1	c2	c1	c2
1	2	2	a
2	3	3	2011-01-01 21:35:52
insert into test_udouble values (1,2), (2,3);
select * from test_udouble as t1, t_enum where t1.c2 = t_enum.c2 order by t1.c1, t_enum.c1;
c1	c2	c1	c2
1	2	2	a
2	3	3	2011-01-01 21:35:52
insert into test_number values (1,2), (2,3);
select * from test_number as t1, t_enum where t1.c2 = t_enum.c2 order by t1.c1, t_enum.c1;
c1	c2	c1	c2
1	2	2	a
2	3	3	2011-01-01 21:35:52
insert into test_unumber values (1,2), (2,3);
select * from test_unumber as t1, t_enum where t1.c2 = t_enum.c2 order by t1.c1, t_enum.c1;
c1	c2	c1	c2
1	2	2	a
2	3	3	2011-01-01 21:35:52
insert into test_datetime select * from t_enum;
select * from test_datetime as t1, t_enum where t1.c2 = t_enum.c2 order by t1.c1, t_enum.c1;
c1	c2	c1	c2
1	0000-00-00 00:00:00	1	b
1	0000-00-00 00:00:00	2	a
1	0000-00-00 00:00:00	4	2002
1	0000-00-00 00:00:00	5	7
2	0000-00-00 00:00:00	1	b
2	0000-00-00 00:00:00	2	a
2	0000-00-00 00:00:00	4	2002
2	0000-00-00 00:00:00	5	7
3	2011-01-01 21:35:52	3	2011-01-01 21:35:52
4	0000-00-00 00:00:00	1	b
4	0000-00-00 00:00:00	2	a
4	0000-00-00 00:00:00	4	2002
4	0000-00-00 00:00:00	5	7
5	0000-00-00 00:00:00	1	b
5	0000-00-00 00:00:00	2	a
5	0000-00-00 00:00:00	4	2002
5	0000-00-00 00:00:00	5	7
insert into test_timestamp select * from t_enum;
select * from test_timestamp as t1, t_enum where t1.c2 = t_enum.c2 order by t1.c1, t_enum.c1;
c1	c2	c1	c2
1	0000-00-00 00:00:00	1	b
1	0000-00-00 00:00:00	2	a
1	0000-00-00 00:00:00	4	2002
1	0000-00-00 00:00:00	5	7
2	0000-00-00 00:00:00	1	b
2	0000-00-00 00:00:00	2	a
2	0000-00-00 00:00:00	4	2002
2	0000-00-00 00:00:00	5	7
3	2011-01-01 21:35:52	3	2011-01-01 21:35:52
4	0000-00-00 00:00:00	1	b
4	0000-00-00 00:00:00	2	a
4	0000-00-00 00:00:00	4	2002
4	0000-00-00 00:00:00	5	7
5	0000-00-00 00:00:00	1	b
5	0000-00-00 00:00:00	2	a
5	0000-00-00 00:00:00	4	2002
5	0000-00-00 00:00:00	5	7
insert into test_date select * from t_enum;
select * from test_date as t1, t_enum where t1.c2 = t_enum.c2 order by t1.c1, t_enum.c1;
c1	c2	c1	c2
1	0000-00-00	1	b
1	0000-00-00	2	a
1	0000-00-00	4	2002
1	0000-00-00	5	7
2	0000-00-00	1	b
2	0000-00-00	2	a
2	0000-00-00	4	2002
2	0000-00-00	5	7
4	0000-00-00	1	b
4	0000-00-00	2	a
4	0000-00-00	4	2002
4	0000-00-00	5	7
5	0000-00-00	1	b
5	0000-00-00	2	a
5	0000-00-00	4	2002
5	0000-00-00	5	7
insert into test_time select * from t_enum;
select * from test_time;
c1	c2
1	00:00:00
2	00:00:00
3	21:35:52
4	00:20:02
5	00:00:07
select * from test_time as t1, t_enum where t1.c2 = t_enum.c2 order by t1.c1, t_enum.c1;
c1	c2	c1	c2
1	00:00:00	1	b
1	00:00:00	2	a
2	00:00:00	1	b
2	00:00:00	2	a
3	21:35:52	3	2011-01-01 21:35:52
4	00:20:02	4	2002
5	00:00:07	5	7
insert into test_year select * from t_enum;
select * from test_year as t1, t_enum where t1.c2 = t_enum.c2 order by t1.c1, t_enum.c1;
c1	c2	c1	c2
select c1, c2 from t_enum where c2=0x43;
c1	c2
insert into test_varchar select * from t_enum;
select * from test_varchar as t1, t_enum where t1.c2 = t_enum.c2 order by t1.c1, t_enum.c1;
c1	c2	c1	c2
1	b	1	b
2	a	2	a
3	2011-01-01 21:35:52	3	2011-01-01 21:35:52
4	2002	4	2002
5	7	5	7
insert into test_char select * from t_enum;
select * from test_char as t1, t_enum where t1.c2 = t_enum.c2 order by t1.c1, t_enum.c1;
c1	c2	c1	c2
1	b	1	b
2	a	2	a
3	2011-01-01 21:35:52	3	2011-01-01 21:35:52
4	2002	4	2002
5	7	5	7
insert into test_bit select * from t_enum;
select * from test_bit as t1, t_enum where t1.c2 = t_enum.c2 order by t1.c1, t_enum.c1;
c1	c2	c1	c2
1		1	b
2		2	a
3		3	2011-01-01 21:35:52
4		4	2002
5		5	7
insert into test_enum select * from t_enum;
select * from test_enum as t1, t_enum where t1.c2 = t_enum.c2 order by t1.c1, t_enum.c1;
c1	c2	c1	c2
1	b	1	b
2	a	2	a
3	2011-01-01 21:35:52	3	2011-01-01 21:35:52
5	7	5	7
insert into test_set select * from t_enum;
select * from test_set as t1, t_enum where t1.c2 = t_enum.c2 order by t1.c1, t_enum.c1;
c1	c2	c1	c2
1	b	1	b
2	a	2	a
3	2011-01-01 21:35:52	3	2011-01-01 21:35:52
5	7	5	7
drop table t_enum;
create table t_enum(c1 int, c2 enum('b', 'a', '2011-01-01 21:35:52', '2017', '7'));
insert into t_enum value(1,1),(2,2),(3,3),(4,4),(5,5);
insert into test_tinyint values (1,2), (2,3);
select * from test_tinyint as t1, t_enum where t1.c2 = t_enum.c2 order by t1.c1, t_enum.c1;
c1	c2	c1	c2
1	2	2	a
1	2	2	a
2	3	3	2011-01-01 21:35:52
2	3	3	2011-01-01 21:35:52
insert into test_smallint values (1,2), (2,3);
select * from test_smallint as t1, t_enum where t1.c2 = t_enum.c2 order by t1.c1, t_enum.c1;
c1	c2	c1	c2
1	2	2	a
1	2	2	a
2	3	3	2011-01-01 21:35:52
2	3	3	2011-01-01 21:35:52
insert into test_mediumint values (1,2), (2,3);
select * from test_mediumint as t1, t_enum where t1.c2 = t_enum.c2 order by t1.c1, t_enum.c1;
c1	c2	c1	c2
1	2	2	a
1	2	2	a
2	3	3	2011-01-01 21:35:52
2	3	3	2011-01-01 21:35:52
insert into test_int values (1,2), (2,3);
select * from test_int as t1, t_enum where t1.c2 = t_enum.c2 order by t1.c1, t_enum.c1;
c1	c2	c1	c2
1	2	2	a
1	2	2	a
2	3	3	2011-01-01 21:35:52
2	3	3	2011-01-01 21:35:52
insert into test_bigint values (1,2), (2,3);
select * from test_bigint as t1, t_enum where t1.c2 = t_enum.c2 order by t1.c1, t_enum.c1;
c1	c2	c1	c2
1	2	2	a
1	2	2	a
2	3	3	2011-01-01 21:35:52
2	3	3	2011-01-01 21:35:52
insert into test_utinyint values (1,2), (2,3);
select * from test_utinyint as t1, t_enum where t1.c2 = t_enum.c2 order by t1.c1, t_enum.c1;
c1	c2	c1	c2
1	2	2	a
1	2	2	a
2	3	3	2011-01-01 21:35:52
2	3	3	2011-01-01 21:35:52
insert into test_usmallint values (1,2), (2,3);
select * from test_usmallint as t1, t_enum where t1.c2 = t_enum.c2 order by t1.c1, t_enum.c1;
c1	c2	c1	c2
1	2	2	a
1	2	2	a
2	3	3	2011-01-01 21:35:52
2	3	3	2011-01-01 21:35:52
insert into test_umediumint values (1,2), (2,3);
select * from test_umediumint as t1, t_enum where t1.c2 = t_enum.c2 order by t1.c1, t_enum.c1;
c1	c2	c1	c2
1	2	2	a
1	2	2	a
2	3	3	2011-01-01 21:35:52
2	3	3	2011-01-01 21:35:52
insert into test_uint values (1,2), (2,3);
select * from test_uint as t1, t_enum where t1.c2 = t_enum.c2 order by t1.c1, t_enum.c1;
c1	c2	c1	c2
1	2	2	a
1	2	2	a
2	3	3	2011-01-01 21:35:52
2	3	3	2011-01-01 21:35:52
insert into test_ubigint values (1,2), (2,3);
select * from test_ubigint as t1, t_enum where t1.c2 = t_enum.c2 order by t1.c1, t_enum.c1;
c1	c2	c1	c2
1	2	2	a
1	2	2	a
2	3	3	2011-01-01 21:35:52
2	3	3	2011-01-01 21:35:52
insert into test_float values (1,2), (2,3);
select * from test_float as t1, t_enum where t1.c2 = t_enum.c2 order by t1.c1, t_enum.c1;
c1	c2	c1	c2
1	2	2	a
1	2	2	a
2	3	3	2011-01-01 21:35:52
2	3	3	2011-01-01 21:35:52
insert into test_double values (1,2), (2,3);
select * from test_double as t1, t_enum where t1.c2 = t_enum.c2 order by t1.c1, t_enum.c1;
c1	c2	c1	c2
1	2	2	a
1	2	2	a
2	3	3	2011-01-01 21:35:52
2	3	3	2011-01-01 21:35:52
insert into test_ufloat values (1,2), (2,3);
select * from test_ufloat as t1, t_enum where t1.c2 = t_enum.c2 order by t1.c1, t_enum.c1;
c1	c2	c1	c2
1	2	2	a
1	2	2	a
2	3	3	2011-01-01 21:35:52
2	3	3	2011-01-01 21:35:52
insert into test_udouble values (1,2), (2,3);
select * from test_udouble as t1, t_enum where t1.c2 = t_enum.c2 order by t1.c1, t_enum.c1;
c1	c2	c1	c2
1	2	2	a
1	2	2	a
2	3	3	2011-01-01 21:35:52
2	3	3	2011-01-01 21:35:52
insert into test_number values (1,2), (2,3);
select * from test_number as t1, t_enum where t1.c2 = t_enum.c2 order by t1.c1, t_enum.c1;
c1	c2	c1	c2
1	2	2	a
1	2	2	a
2	3	3	2011-01-01 21:35:52
2	3	3	2011-01-01 21:35:52
insert into test_unumber values (1,2), (2,3);
select * from test_unumber as t1, t_enum where t1.c2 = t_enum.c2 order by t1.c1, t_enum.c1;
c1	c2	c1	c2
1	2	2	a
1	2	2	a
2	3	3	2011-01-01 21:35:52
2	3	3	2011-01-01 21:35:52
insert into test_datetime select * from t_enum;
select * from test_datetime as t1, t_enum where t1.c2 = t_enum.c2 order by t1.c1, t_enum.c1;
c1	c2	c1	c2
1	0000-00-00 00:00:00	1	b
1	0000-00-00 00:00:00	1	b
1	0000-00-00 00:00:00	2	a
1	0000-00-00 00:00:00	2	a
1	0000-00-00 00:00:00	4	2017
1	0000-00-00 00:00:00	4	2017
1	0000-00-00 00:00:00	5	7
1	0000-00-00 00:00:00	5	7
2	0000-00-00 00:00:00	1	b
2	0000-00-00 00:00:00	1	b
2	0000-00-00 00:00:00	2	a
2	0000-00-00 00:00:00	2	a
2	0000-00-00 00:00:00	4	2017
2	0000-00-00 00:00:00	4	2017
2	0000-00-00 00:00:00	5	7
2	0000-00-00 00:00:00	5	7
3	2011-01-01 21:35:52	3	2011-01-01 21:35:52
3	2011-01-01 21:35:52	3	2011-01-01 21:35:52
4	0000-00-00 00:00:00	1	b
4	0000-00-00 00:00:00	1	b
4	0000-00-00 00:00:00	2	a
4	0000-00-00 00:00:00	2	a
4	0000-00-00 00:00:00	4	2017
4	0000-00-00 00:00:00	4	2017
4	0000-00-00 00:00:00	5	7
4	0000-00-00 00:00:00	5	7
5	0000-00-00 00:00:00	1	b
5	0000-00-00 00:00:00	1	b
5	0000-00-00 00:00:00	2	a
5	0000-00-00 00:00:00	2	a
5	0000-00-00 00:00:00	4	2017
5	0000-00-00 00:00:00	4	2017
5	0000-00-00 00:00:00	5	7
5	0000-00-00 00:00:00	5	7
insert into test_timestamp select * from t_enum;
select * from test_timestamp as t1, t_enum where t1.c2 = t_enum.c2 order by t1.c1, t_enum.c1;
c1	c2	c1	c2
1	0000-00-00 00:00:00	1	b
1	0000-00-00 00:00:00	1	b
1	0000-00-00 00:00:00	2	a
1	0000-00-00 00:00:00	2	a
1	0000-00-00 00:00:00	4	2017
1	0000-00-00 00:00:00	4	2017
1	0000-00-00 00:00:00	5	7
1	0000-00-00 00:00:00	5	7
2	0000-00-00 00:00:00	1	b
2	0000-00-00 00:00:00	1	b
2	0000-00-00 00:00:00	2	a
2	0000-00-00 00:00:00	2	a
2	0000-00-00 00:00:00	4	2017
2	0000-00-00 00:00:00	4	2017
2	0000-00-00 00:00:00	5	7
2	0000-00-00 00:00:00	5	7
3	2011-01-01 21:35:52	3	2011-01-01 21:35:52
3	2011-01-01 21:35:52	3	2011-01-01 21:35:52
4	0000-00-00 00:00:00	1	b
4	0000-00-00 00:00:00	1	b
4	0000-00-00 00:00:00	2	a
4	0000-00-00 00:00:00	2	a
4	0000-00-00 00:00:00	4	2017
4	0000-00-00 00:00:00	4	2017
4	0000-00-00 00:00:00	5	7
4	0000-00-00 00:00:00	5	7
5	0000-00-00 00:00:00	1	b
5	0000-00-00 00:00:00	1	b
5	0000-00-00 00:00:00	2	a
5	0000-00-00 00:00:00	2	a
5	0000-00-00 00:00:00	4	2017
5	0000-00-00 00:00:00	4	2017
5	0000-00-00 00:00:00	5	7
5	0000-00-00 00:00:00	5	7
insert into test_date select * from t_enum;
select * from test_date as t1, t_enum where t1.c2 = t_enum.c2 order by t1.c1, t_enum.c1;
c1	c2	c1	c2
1	0000-00-00	1	b
1	0000-00-00	1	b
1	0000-00-00	2	a
1	0000-00-00	2	a
1	0000-00-00	4	2017
1	0000-00-00	4	2017
1	0000-00-00	5	7
1	0000-00-00	5	7
2	0000-00-00	1	b
2	0000-00-00	1	b
2	0000-00-00	2	a
2	0000-00-00	2	a
2	0000-00-00	4	2017
2	0000-00-00	4	2017
2	0000-00-00	5	7
2	0000-00-00	5	7
4	0000-00-00	1	b
4	0000-00-00	1	b
4	0000-00-00	2	a
4	0000-00-00	2	a
4	0000-00-00	4	2017
4	0000-00-00	4	2017
4	0000-00-00	5	7
4	0000-00-00	5	7
5	0000-00-00	1	b
5	0000-00-00	1	b
5	0000-00-00	2	a
5	0000-00-00	2	a
5	0000-00-00	4	2017
5	0000-00-00	4	2017
5	0000-00-00	5	7
5	0000-00-00	5	7
insert into test_time select * from t_enum;
select * from test_time;
c1	c2
1	00:00:00
2	00:00:00
3	21:35:52
4	00:20:02
5	00:00:07
1	00:00:00
2	00:00:00
3	21:35:52
4	00:20:17
5	00:00:07
select * from test_time as t1, t_enum where t1.c2 = t_enum.c2 order by t1.c1, t_enum.c1;
c1	c2	c1	c2
1	00:00:00	1	b
1	00:00:00	1	b
1	00:00:00	2	a
1	00:00:00	2	a
2	00:00:00	1	b
2	00:00:00	1	b
2	00:00:00	2	a
2	00:00:00	2	a
3	21:35:52	3	2011-01-01 21:35:52
3	21:35:52	3	2011-01-01 21:35:52
4	00:20:17	4	2017
5	00:00:07	5	7
5	00:00:07	5	7
insert into test_year select * from t_enum;
select * from test_year as t1, t_enum where t1.c2 = t_enum.c2 order by t1.c1, t_enum.c1;
c1	c2	c1	c2
insert into test_varchar select * from t_enum;
select * from test_varchar as t1, t_enum where t1.c2 = t_enum.c2 order by t1.c1, t_enum.c1;
c1	c2	c1	c2
1	b	1	b
1	b	1	b
2	a	2	a
2	a	2	a
3	2011-01-01 21:35:52	3	2011-01-01 21:35:52
3	2011-01-01 21:35:52	3	2011-01-01 21:35:52
4	2017	4	2017
5	7	5	7
5	7	5	7
insert into test_char select * from t_enum;
select * from test_char as t1, t_enum where t1.c2 = t_enum.c2 order by t1.c1, t_enum.c1;
c1	c2	c1	c2
1	b	1	b
1	b	1	b
2	a	2	a
2	a	2	a
3	2011-01-01 21:35:52	3	2011-01-01 21:35:52
3	2011-01-01 21:35:52	3	2011-01-01 21:35:52
4	2017	4	2017
5	7	5	7
5	7	5	7
insert into test_bit select * from t_enum;
select * from test_bit as t1, t_enum where t1.c2 = t_enum.c2 order by t1.c1, t_enum.c1;
c1	c2	c1	c2
1		1	b
1		1	b
2		2	a
2		2	a
3		3	2011-01-01 21:35:52
3		3	2011-01-01 21:35:52
4		4	2017
4		4	2017
5		5	7
5		5	7
insert into test_enum select * from t_enum;
select * from test_enum as t1, t_enum where t1.c2 = t_enum.c2 order by t1.c1, t_enum.c1;
c1	c2	c1	c2
1	b	1	b
1	b	1	b
2	a	2	a
2	a	2	a
3	2011-01-01 21:35:52	3	2011-01-01 21:35:52
3	2011-01-01 21:35:52	3	2011-01-01 21:35:52
5	7	5	7
5	7	5	7
insert into test_set select * from t_enum;
select * from test_set as t1, t_enum where t1.c2 = t_enum.c2 order by t1.c1, t_enum.c1;
c1	c2	c1	c2
1	b	1	b
1	b	1	b
2	a	2	a
2	a	2	a
3	2011-01-01 21:35:52	3	2011-01-01 21:35:52
3	2011-01-01 21:35:52	3	2011-01-01 21:35:52
5	7	5	7
5	7	5	7
select null from dual union select c2 from t_enum;
null
2011-01-01 21:35:52
2017
7
NULL
a
b
select * from test_tinyint union select * from t_enum order by c1,c2;
c1	c2
1	2
1	b
2	3
2	a
3	2011-01-01 21:35:52
4	2017
5	7
select * from test_smallint union select * from t_enum order by c1,c2;
c1	c2
1	2
1	b
2	3
2	a
3	2011-01-01 21:35:52
4	2017
5	7
select * from test_mediumint union select * from t_enum order by c1,c2;
c1	c2
1	2
1	b
2	3
2	a
3	2011-01-01 21:35:52
4	2017
5	7
select * from test_int union select * from t_enum order by c1,c2;
c1	c2
1	2
1	b
2	3
2	a
3	2011-01-01 21:35:52
4	2017
5	7
select * from test_bigint union select * from t_enum order by c1,c2;
c1	c2
1	2
1	b
2	3
2	a
3	2011-01-01 21:35:52
4	2017
5	7
select * from test_utinyint union select * from t_enum order by c1,c2;
c1	c2
1	2
1	b
2	3
2	a
3	2011-01-01 21:35:52
4	2017
5	7
select * from test_usmallint union select * from t_enum order by c1,c2;
c1	c2
1	2
1	b
2	3
2	a
3	2011-01-01 21:35:52
4	2017
5	7
select * from test_umediumint union select * from t_enum order by c1,c2;
c1	c2
1	2
1	b
2	3
2	a
3	2011-01-01 21:35:52
4	2017
5	7
select * from test_uint union select * from t_enum order by c1,c2;
c1	c2
1	2
1	b
2	3
2	a
3	2011-01-01 21:35:52
4	2017
5	7
select * from test_ubigint union select * from t_enum order by c1,c2;
c1	c2
1	2
1	b
2	3
2	a
3	2011-01-01 21:35:52
4	2017
5	7
select * from test_float union select * from t_enum order by c1,c2;
c1	c2
1	2
1	b
2	3
2	a
3	2011-01-01 21:35:52
4	2017
5	7
select * from test_double union select * from t_enum order by c1,c2;
c1	c2
1	2
1	b
2	3
2	a
3	2011-01-01 21:35:52
4	2017
5	7
select * from test_ufloat union select * from t_enum order by c1,c2;
c1	c2
1	2
1	b
2	3
2	a
3	2011-01-01 21:35:52
4	2017
5	7
select * from test_udouble union select * from t_enum order by c1,c2;
c1	c2
1	2
1	b
2	3
2	a
3	2011-01-01 21:35:52
4	2017
5	7
select * from test_number union select * from t_enum order by c1,c2;
c1	c2
1	2
1	b
2	3
2	a
3	2011-01-01 21:35:52
4	2017
5	7
select * from test_unumber union select * from t_enum order by c1,c2;
c1	c2
1	2
1	b
2	3
2	a
3	2011-01-01 21:35:52
4	2017
5	7
select * from test_datetime union select * from t_enum order by c1,c2;
c1	c2
1	0000-00-00 00:00:00
1	b
2	0000-00-00 00:00:00
2	a
3	2011-01-01 21:35:52
4	0000-00-00 00:00:00
4	2017
5	0000-00-00 00:00:00
5	7
select * from test_timestamp union select * from t_enum order by c1,c2;
c1	c2
1	0000-00-00 00:00:00
1	b
2	0000-00-00 00:00:00
2	a
3	2011-01-01 21:35:52
4	0000-00-00 00:00:00
4	2017
5	0000-00-00 00:00:00
5	7
select * from test_date union select * from t_enum order by c1,c2;
c1	c2
1	0000-00-00
1	b
2	0000-00-00
2	a
3	2011-01-01
3	2011-01-01 21:35:52
4	0000-00-00
4	2017
5	0000-00-00
5	7
select * from test_time union select * from t_enum order by c1,c2;
c1	c2
1	00:00:00
1	b
2	00:00:00
2	a
3	2011-01-01 21:35:52
3	21:35:52
4	00:20:02
4	00:20:17
4	2017
5	00:00:07
5	7
select * from test_year union select * from t_enum order by c1,c2;
c1	c2
1	2001
1	b
2	2002
2	a
3	2003
3	2011-01-01 21:35:52
4	2004
4	2017
5	2005
5	7
select * from test_varchar union select * from t_enum order by c1,c2;
c1	c2
1	b
2	a
3	2011-01-01 21:35:52
4	2002
4	2017
5	7
select * from test_char union select * from t_enum order by c1,c2;
c1	c2
1	b
2	a
3	2011-01-01 21:35:52
4	2002
4	2017
5	7
select X'0a0a'  union select c2 from t_enum order by `X'0a0a'`;
X'0a0a'



2011-01-01 21:35:52
2017
7
a
b
select * from test_bit union select * from t_enum order by c1,c2;
c1	c2
1	
1	b
2	
2	a
3	
3	2011-01-01 21:35:52
4	
4	2017
5	
5	7
select * from test_enum union select * from t_enum order by c1,c2;
c1	c2
1	b
2	a
3	2011-01-01 21:35:52
4	
4	2017
5	7
select * from test_set union select * from t_enum order by c1,c2;
c1	c2
1	b
2	a
3	2011-01-01 21:35:52
4	
4	2017
5	7
select 0x43 union select c2 from t_enum order by `0x43`;
0x43
2011-01-01 21:35:52
2017
7
a
b
C
create table t_set(c1 int, c2 set('b', 'a', '2011-01-01 21:35:52', '2004', '7'));
insert into t_set value(1,1),(2,2),(3,4),(4,8),(5,16);
delete from test_tinyint;
insert into test_tinyint values (1,2), (2,3);
select * from test_tinyint as t1, t_set where t1.c2 = t_set.c2 order by t1.c1, t_set.c1;
c1	c2	c1	c2
1	2	2	a
delete from test_smallint;
insert into test_smallint values (1,2), (2,3);
select * from test_smallint as t1, t_set where t1.c2 = t_set.c2 order by t1.c1, t_set.c1;
c1	c2	c1	c2
1	2	2	a
delete from test_mediumint;
insert into test_mediumint values (1,2), (2,3);
select * from test_mediumint as t1, t_set where t1.c2 = t_set.c2 order by t1.c1, t_set.c1;
c1	c2	c1	c2
1	2	2	a
delete from test_int;
insert into test_int values (1,2), (2,3);
select * from test_int as t1, t_set where t1.c2 = t_set.c2 order by t1.c1, t_set.c1;
c1	c2	c1	c2
1	2	2	a
delete from test_bigint;
insert into test_bigint values (1,2), (2,3);
select * from test_bigint as t1, t_set where t1.c2 = t_set.c2 order by t1.c1, t_set.c1;
c1	c2	c1	c2
1	2	2	a
delete from test_utinyint;
insert into test_utinyint values (1,2), (2,3);
select * from test_utinyint as t1, t_set where t1.c2 = t_set.c2 order by t1.c1, t_set.c1;
c1	c2	c1	c2
1	2	2	a
delete from test_usmallint;
insert into test_usmallint values (1,2), (2,3);
select * from test_usmallint as t1, t_set where t1.c2 = t_set.c2 order by t1.c1, t_set.c1;
c1	c2	c1	c2
1	2	2	a
delete from test_umediumint;
insert into test_umediumint values (1,2), (2,3);
select * from test_umediumint as t1, t_set where t1.c2 = t_set.c2 order by t1.c1, t_set.c1;
c1	c2	c1	c2
1	2	2	a
delete from test_uint;
insert into test_uint values (1,2), (2,3);
select * from test_uint as t1, t_set where t1.c2 = t_set.c2 order by t1.c1, t_set.c1;
c1	c2	c1	c2
1	2	2	a
delete from test_ubigint;
insert into test_ubigint values (1,2), (2,3);
select * from test_ubigint as t1, t_set where t1.c2 = t_set.c2 order by t1.c1, t_set.c1;
c1	c2	c1	c2
1	2	2	a
delete from test_float;
insert into test_float values (1,2), (2,3);
select * from test_float as t1, t_set where t1.c2 = t_set.c2 order by t1.c1, t_set.c1;
c1	c2	c1	c2
1	2	2	a
delete from test_double;
insert into test_double values (1,2), (2,3);
select * from test_double as t1, t_set where t1.c2 = t_set.c2 order by t1.c1, t_set.c1;
c1	c2	c1	c2
1	2	2	a
delete from test_ufloat;
insert into test_ufloat values (1,2), (2,3);
select * from test_ufloat as t1, t_set where t1.c2 = t_set.c2 order by t1.c1, t_set.c1;
c1	c2	c1	c2
1	2	2	a
delete from test_udouble;
insert into test_udouble values (1,2), (2,3);
select * from test_udouble as t1, t_set where t1.c2 = t_set.c2 order by t1.c1, t_set.c1;
c1	c2	c1	c2
1	2	2	a
delete from test_number;
insert into test_number values (1,2), (2,3);
select * from test_number as t1, t_set where t1.c2 = t_set.c2 order by t1.c1, t_set.c1;
c1	c2	c1	c2
1	2	2	a
delete from test_unumber;
insert into test_unumber values (1,2), (2,3);
select * from test_unumber as t1, t_set where t1.c2 = t_set.c2 order by t1.c1, t_set.c1;
c1	c2	c1	c2
1	2	2	a
delete from test_datetime;
insert into test_datetime select * from t_set;
select * from test_datetime as t1, t_set where t1.c2 = t_set.c2 order by t1.c1, t_set.c1;
c1	c2	c1	c2
1	0000-00-00 00:00:00	1	b
1	0000-00-00 00:00:00	2	a
1	0000-00-00 00:00:00	4	2004
1	0000-00-00 00:00:00	5	7
2	0000-00-00 00:00:00	1	b
2	0000-00-00 00:00:00	2	a
2	0000-00-00 00:00:00	4	2004
2	0000-00-00 00:00:00	5	7
3	2011-01-01 21:35:52	3	2011-01-01 21:35:52
4	0000-00-00 00:00:00	1	b
4	0000-00-00 00:00:00	2	a
4	0000-00-00 00:00:00	4	2004
4	0000-00-00 00:00:00	5	7
5	0000-00-00 00:00:00	1	b
5	0000-00-00 00:00:00	2	a
5	0000-00-00 00:00:00	4	2004
5	0000-00-00 00:00:00	5	7
delete from test_timestamp;
insert into test_timestamp select * from t_set;
select * from test_timestamp as t1, t_set where t1.c2 = t_set.c2 order by t1.c1, t_set.c1;
c1	c2	c1	c2
1	0000-00-00 00:00:00	1	b
1	0000-00-00 00:00:00	2	a
1	0000-00-00 00:00:00	4	2004
1	0000-00-00 00:00:00	5	7
2	0000-00-00 00:00:00	1	b
2	0000-00-00 00:00:00	2	a
2	0000-00-00 00:00:00	4	2004
2	0000-00-00 00:00:00	5	7
3	2011-01-01 21:35:52	3	2011-01-01 21:35:52
4	0000-00-00 00:00:00	1	b
4	0000-00-00 00:00:00	2	a
4	0000-00-00 00:00:00	4	2004
4	0000-00-00 00:00:00	5	7
5	0000-00-00 00:00:00	1	b
5	0000-00-00 00:00:00	2	a
5	0000-00-00 00:00:00	4	2004
5	0000-00-00 00:00:00	5	7
delete from test_date;
insert into test_date select * from t_set;
select * from test_date as t1, t_set where t1.c2 = t_set.c2 order by t1.c1, t_set.c1;
c1	c2	c1	c2
1	0000-00-00	1	b
1	0000-00-00	2	a
1	0000-00-00	4	2004
1	0000-00-00	5	7
2	0000-00-00	1	b
2	0000-00-00	2	a
2	0000-00-00	4	2004
2	0000-00-00	5	7
4	0000-00-00	1	b
4	0000-00-00	2	a
4	0000-00-00	4	2004
4	0000-00-00	5	7
5	0000-00-00	1	b
5	0000-00-00	2	a
5	0000-00-00	4	2004
5	0000-00-00	5	7
delete from test_time;
insert into test_time select * from t_set;
select * from test_time;
c1	c2
1	00:00:00
2	00:00:00
3	21:35:52
4	00:20:04
5	00:00:07
select * from test_time as t1, t_set where t1.c2 = t_set.c2 order by t1.c1, t_set.c1;
c1	c2	c1	c2
1	00:00:00	1	b
1	00:00:00	2	a
2	00:00:00	1	b
2	00:00:00	2	a
3	21:35:52	3	2011-01-01 21:35:52
4	00:20:04	4	2004
5	00:00:07	5	7
delete from test_year;
insert into test_year select * from t_set;
select * from test_year as t1, t_set where t1.c2 = t_set.c2 order by t1.c1, t_set.c1;
c1	c2	c1	c2
select c1, c2 from t_enum where c2=0x43;
c1	c2
delete from test_varchar;
insert into test_varchar select * from t_set;
select * from test_varchar as t1, t_set where t1.c2 = t_set.c2 order by t1.c1, t_set.c1;
c1	c2	c1	c2
1	b	1	b
2	a	2	a
3	2011-01-01 21:35:52	3	2011-01-01 21:35:52
4	2004	4	2004
5	7	5	7
delete from test_char;
insert into test_char select * from t_set;
select * from test_char as t1, t_set where t1.c2 = t_set.c2 order by t1.c1, t_set.c1;
c1	c2	c1	c2
1	b	1	b
2	a	2	a
3	2011-01-01 21:35:52	3	2011-01-01 21:35:52
4	2004	4	2004
5	7	5	7
delete from test_bit;
insert into test_bit select * from t_set;
select * from test_bit as t1, t_set where t1.c2 = t_set.c2 order by t1.c1, t_set.c1;
c1	c2	c1	c2
1		1	b
2		2	a
3		3	2011-01-01 21:35:52
4		4	2004
5		5	7
delete from test_enum;
insert into test_enum select * from t_set;
select * from test_enum as t1, t_set where t1.c2 = t_set.c2 order by t1.c1, t_set.c1;
c1	c2	c1	c2
1	b	1	b
2	a	2	a
3	2011-01-01 21:35:52	3	2011-01-01 21:35:52
5	7	5	7
delete from test_set;
insert into test_set select * from t_set;
select * from test_set as t1, t_set where t1.c2 = t_set.c2 order by t1.c1, t_set.c1;
c1	c2	c1	c2
1	b	1	b
2	a	2	a
3	2011-01-01 21:35:52	3	2011-01-01 21:35:52
5	7	5	7
select null from dual union select c2 from t_set;
null
2004
2011-01-01 21:35:52
7
NULL
a
b
select * from test_tinyint union select * from t_set order by c1,c2;
c1	c2
1	2
1	b
2	3
2	a
3	2011-01-01 21:35:52
4	2004
5	7
select * from test_smallint union select * from t_set order by c1,c2;
c1	c2
1	2
1	b
2	3
2	a
3	2011-01-01 21:35:52
4	2004
5	7
select * from test_mediumint union select * from t_set order by c1,c2;
c1	c2
1	2
1	b
2	3
2	a
3	2011-01-01 21:35:52
4	2004
5	7
select * from test_int union select * from t_set order by c1,c2;
c1	c2
1	2
1	b
2	3
2	a
3	2011-01-01 21:35:52
4	2004
5	7
select * from test_bigint union select * from t_set order by c1,c2;
c1	c2
1	2
1	b
2	3
2	a
3	2011-01-01 21:35:52
4	2004
5	7
select * from test_utinyint union select * from t_set order by c1,c2;
c1	c2
1	2
1	b
2	3
2	a
3	2011-01-01 21:35:52
4	2004
5	7
select * from test_usmallint union select * from t_set order by c1,c2;
c1	c2
1	2
1	b
2	3
2	a
3	2011-01-01 21:35:52
4	2004
5	7
select * from test_umediumint union select * from t_set order by c1,c2;
c1	c2
1	2
1	b
2	3
2	a
3	2011-01-01 21:35:52
4	2004
5	7
select * from test_uint union select * from t_set order by c1,c2;
c1	c2
1	2
1	b
2	3
2	a
3	2011-01-01 21:35:52
4	2004
5	7
select * from test_ubigint union select * from t_set order by c1,c2;
c1	c2
1	2
1	b
2	3
2	a
3	2011-01-01 21:35:52
4	2004
5	7
select * from test_float union select * from t_set order by c1,c2;
c1	c2
1	2
1	b
2	3
2	a
3	2011-01-01 21:35:52
4	2004
5	7
select * from test_double union select * from t_set order by c1,c2;
c1	c2
1	2
1	b
2	3
2	a
3	2011-01-01 21:35:52
4	2004
5	7
select * from test_ufloat union select * from t_set order by c1,c2;
c1	c2
1	2
1	b
2	3
2	a
3	2011-01-01 21:35:52
4	2004
5	7
select * from test_udouble union select * from t_set order by c1,c2;
c1	c2
1	2
1	b
2	3
2	a
3	2011-01-01 21:35:52
4	2004
5	7
select * from test_number union select * from t_set order by c1,c2;
c1	c2
1	2
1	b
2	3
2	a
3	2011-01-01 21:35:52
4	2004
5	7
select * from test_unumber union select * from t_set order by c1,c2;
c1	c2
1	2
1	b
2	3
2	a
3	2011-01-01 21:35:52
4	2004
5	7
select * from test_datetime union select * from t_set order by c1,c2;
c1	c2
1	0000-00-00 00:00:00
1	b
2	0000-00-00 00:00:00
2	a
3	2011-01-01 21:35:52
4	0000-00-00 00:00:00
4	2004
5	0000-00-00 00:00:00
5	7
select * from test_timestamp union select * from t_set order by c1,c2;
c1	c2
1	0000-00-00 00:00:00
1	b
2	0000-00-00 00:00:00
2	a
3	2011-01-01 21:35:52
4	0000-00-00 00:00:00
4	2004
5	0000-00-00 00:00:00
5	7
select * from test_date union select * from t_set order by c1,c2;
c1	c2
1	0000-00-00
1	b
2	0000-00-00
2	a
3	2011-01-01
3	2011-01-01 21:35:52
4	0000-00-00
4	2004
5	0000-00-00
5	7
select * from test_time union select * from t_set order by c1,c2;
c1	c2
1	00:00:00
1	b
2	00:00:00
2	a
3	2011-01-01 21:35:52
3	21:35:52
4	00:20:04
4	2004
5	00:00:07
5	7
select * from test_year union select * from t_set order by c1,c2;
c1	c2
1	2001
1	b
2	2002
2	a
3	2004
3	2011-01-01 21:35:52
4	2004
4	2008
5	2016
5	7
select * from test_varchar union select * from t_set order by c1,c2;
c1	c2
1	b
2	a
3	2011-01-01 21:35:52
4	2004
5	7
select * from test_char union select * from t_set order by c1,c2;
c1	c2
1	b
2	a
3	2011-01-01 21:35:52
4	2004
5	7
select 0x43 union select c2 from t_set order by `0x43`;
0x43
2004
2011-01-01 21:35:52
7
a
b
C
select * from test_bit union select * from t_set order by c1,c2;
c1	c2
1	
1	b
2	
2	a
3	
3	2011-01-01 21:35:52
4	
4	2004
5	
5	7
select * from test_enum union select * from t_set order by c1,c2;
c1	c2
1	b
2	a
3	2011-01-01 21:35:52
4	
4	2004
5	7
select * from test_set union select * from t_set order by c1,c2;
c1	c2
1	b
2	a
3	2011-01-01 21:35:52
4	
4	2004
5	7
select 0x0101 union select c2 from test_set;
0x0101


2011-01-01 21:35:52
7
a
b
drop database test_enum_set;
create database test_enum_set;
use test_enum_set;
create table test_enum1(c_tinyint tinyint, c_smallint smallint, c_mint mediumint, c_int int, c_bigint bigint, c_utinyint tinyint unsigned, c_usmallint smallint  unsigned, c_umint mediumint unsigned, c_uint int unsigned, c_ubigint bigint unsigned, c_float float, c_double double, c_ufloat float unsigned, c_udouble double unsigned, c_dec decimal, c_udec decimal unsigned, c_datetime datetime, c_timestamp timestamp default '2016-01-01 00:01:02', c_date date, c_time time, c_year year, c_varchar varchar(16), c_char char(16), /* c_tinytext tinytext, c_text text, c_mtext mediumtext, c_ltext longtext,*/ c_bit bit(16), c_enum enum('a', 'b', 'c'), c_set set('a', 'b', 'c'), c_enum_t enum('a', 'b', 'c'));
insert into test_enum1 (c_enum_t) value(1);
select * from test_enum1;
c_tinyint	c_smallint	c_mint	c_int	c_bigint	c_utinyint	c_usmallint	c_umint	c_uint	c_ubigint	c_float	c_double	c_ufloat	c_udouble	c_dec	c_udec	c_datetime	c_timestamp	c_date	c_time	c_year	c_varchar	c_char	c_bit	c_enum	c_set	c_enum_t
NULL	NULL	NULL	NULL	NULL	NULL	NULL	NULL	NULL	NULL	NULL	NULL	NULL	NULL	NULL	NULL	NULL	2016-01-01 00:01:02	NULL	NULL	NULL	NULL	NULL	NULL	NULL	NULL	a
select ifnull(null, c_enum_t), 1 in (ifnull(null, c_enum_t)), 'a' in (ifnull(null, c_enum_t)), c_enum_t+1-1, c_enum_t from test_enum1;
Catalog	Database	Table	Table_alias	Column	Column_alias	Type	Length	Max length	Is_null	Flags	Decimals	Charsetnr
def				ifnull(null, c_enum_t)	ifnull(null, c_enum_t)	253	4	1	Y	0	31	45
def				1 in (ifnull(null, c_enum_t))	1 in (ifnull(null, c_enum_t))	3	1	1	Y	32896	0	63
def				'a' in (ifnull(null, c_enum_t))	'a' in (ifnull(null, c_enum_t))	3	1	1	Y	32896	0	63
def				c_enum_t+1-1	c_enum_t+1-1	5	23	1	Y	32896	31	63
def				c_enum_t	c_enum_t	253	4	1	Y	0	31	45
ifnull(null, c_enum_t)	1 in (ifnull(null, c_enum_t))	'a' in (ifnull(null, c_enum_t))	c_enum_t+1-1	c_enum_t
a	0	1	1	a
select ifnull(c_tinyint, c_enum_t), 1 in (ifnull(c_tinyint, c_enum_t)), 'a' in (ifnull(c_tinyint, c_enum_t)), c_enum_t+1-1, c_enum_t from test_enum1;
Catalog	Database	Table	Table_alias	Column	Column_alias	Type	Length	Max length	Is_null	Flags	Decimals	Charsetnr
def				ifnull(c_tinyint, c_enum_t)	ifnull(c_tinyint, c_enum_t)	253	16	1	Y	0	31	45
def				1 in (ifnull(c_tinyint, c_enum_t))	1 in (ifnull(c_tinyint, c_enum_t))	3	1	1	Y	32896	0	63
def				'a' in (ifnull(c_tinyint, c_enum_t))	'a' in (ifnull(c_tinyint, c_enum_t))	3	1	1	Y	32896	0	63
def				c_enum_t+1-1	c_enum_t+1-1	5	23	1	Y	32896	31	63
def				c_enum_t	c_enum_t	253	4	1	Y	0	31	45
ifnull(c_tinyint, c_enum_t)	1 in (ifnull(c_tinyint, c_enum_t))	'a' in (ifnull(c_tinyint, c_enum_t))	c_enum_t+1-1	c_enum_t
a	0	1	1	a
select ifnull(c_smallint, c_enum_t), 1 in (ifnull(c_smallint, c_enum_t)), 'a' in (ifnull(c_smallint, c_enum_t)), c_enum_t+1-1, c_enum_t from test_enum1;
Catalog	Database	Table	Table_alias	Column	Column_alias	Type	Length	Max length	Is_null	Flags	Decimals	Charsetnr
def				ifnull(c_smallint, c_enum_t)	ifnull(c_smallint, c_enum_t)	253	24	1	Y	0	31	45
def				1 in (ifnull(c_smallint, c_enum_t))	1 in (ifnull(c_smallint, c_enum_t))	3	1	1	Y	32896	0	63
def				'a' in (ifnull(c_smallint, c_enum_t))	'a' in (ifnull(c_smallint, c_enum_t))	3	1	1	Y	32896	0	63
def				c_enum_t+1-1	c_enum_t+1-1	5	23	1	Y	32896	31	63
def				c_enum_t	c_enum_t	253	4	1	Y	0	31	45
ifnull(c_smallint, c_enum_t)	1 in (ifnull(c_smallint, c_enum_t))	'a' in (ifnull(c_smallint, c_enum_t))	c_enum_t+1-1	c_enum_t
a	0	1	1	a
select ifnull(c_mint, c_enum_t), 1 in (ifnull(c_mint, c_enum_t)), 'a' in (ifnull(c_mint, c_enum_t)), c_enum_t+1-1, c_enum_t from test_enum1;
Catalog	Database	Table	Table_alias	Column	Column_alias	Type	Length	Max length	Is_null	Flags	Decimals	Charsetnr
def				ifnull(c_mint, c_enum_t)	ifnull(c_mint, c_enum_t)	253	36	1	Y	0	31	45
def				1 in (ifnull(c_mint, c_enum_t))	1 in (ifnull(c_mint, c_enum_t))	3	1	1	Y	32896	0	63
def				'a' in (ifnull(c_mint, c_enum_t))	'a' in (ifnull(c_mint, c_enum_t))	3	1	1	Y	32896	0	63
def				c_enum_t+1-1	c_enum_t+1-1	5	23	1	Y	32896	31	63
def				c_enum_t	c_enum_t	253	4	1	Y	0	31	45
ifnull(c_mint, c_enum_t)	1 in (ifnull(c_mint, c_enum_t))	'a' in (ifnull(c_mint, c_enum_t))	c_enum_t+1-1	c_enum_t
a	0	1	1	a
select ifnull(c_int, c_enum_t), 1 in (ifnull(c_int, c_enum_t)), 'a' in (ifnull(c_int, c_enum_t)), c_enum_t+1-1, c_enum_t from test_enum1;
Catalog	Database	Table	Table_alias	Column	Column_alias	Type	Length	Max length	Is_null	Flags	Decimals	Charsetnr
def				ifnull(c_int, c_enum_t)	ifnull(c_int, c_enum_t)	253	44	1	Y	0	31	45
def				1 in (ifnull(c_int, c_enum_t))	1 in (ifnull(c_int, c_enum_t))	3	1	1	Y	32896	0	63
def				'a' in (ifnull(c_int, c_enum_t))	'a' in (ifnull(c_int, c_enum_t))	3	1	1	Y	32896	0	63
def				c_enum_t+1-1	c_enum_t+1-1	5	23	1	Y	32896	31	63
def				c_enum_t	c_enum_t	253	4	1	Y	0	31	45
ifnull(c_int, c_enum_t)	1 in (ifnull(c_int, c_enum_t))	'a' in (ifnull(c_int, c_enum_t))	c_enum_t+1-1	c_enum_t
a	0	1	1	a
select ifnull(c_bigint, c_enum_t), 1 in (ifnull(c_bigint, c_enum_t)), 'a' in (ifnull(c_bigint, c_enum_t)), c_enum_t+1-1, c_enum_t from test_enum1;
Catalog	Database	Table	Table_alias	Column	Column_alias	Type	Length	Max length	Is_null	Flags	Decimals	Charsetnr
def				ifnull(c_bigint, c_enum_t)	ifnull(c_bigint, c_enum_t)	253	80	1	Y	0	31	45
def				1 in (ifnull(c_bigint, c_enum_t))	1 in (ifnull(c_bigint, c_enum_t))	3	1	1	Y	32896	0	63
def				'a' in (ifnull(c_bigint, c_enum_t))	'a' in (ifnull(c_bigint, c_enum_t))	3	1	1	Y	32896	0	63
def				c_enum_t+1-1	c_enum_t+1-1	5	23	1	Y	32896	31	63
def				c_enum_t	c_enum_t	253	4	1	Y	0	31	45
ifnull(c_bigint, c_enum_t)	1 in (ifnull(c_bigint, c_enum_t))	'a' in (ifnull(c_bigint, c_enum_t))	c_enum_t+1-1	c_enum_t
a	0	1	1	a
select ifnull(c_utinyint, c_enum_t), 1 in (ifnull(c_utinyint, c_enum_t)), 'a' in (ifnull(c_utinyint, c_enum_t)), c_enum_t+1-1, c_enum_t from test_enum1;
Catalog	Database	Table	Table_alias	Column	Column_alias	Type	Length	Max length	Is_null	Flags	Decimals	Charsetnr
def				ifnull(c_utinyint, c_enum_t)	ifnull(c_utinyint, c_enum_t)	253	12	1	Y	0	31	45
def				1 in (ifnull(c_utinyint, c_enum_t))	1 in (ifnull(c_utinyint, c_enum_t))	3	1	1	Y	32896	0	63
def				'a' in (ifnull(c_utinyint, c_enum_t))	'a' in (ifnull(c_utinyint, c_enum_t))	3	1	1	Y	32896	0	63
def				c_enum_t+1-1	c_enum_t+1-1	5	23	1	Y	32896	31	63
def				c_enum_t	c_enum_t	253	4	1	Y	0	31	45
ifnull(c_utinyint, c_enum_t)	1 in (ifnull(c_utinyint, c_enum_t))	'a' in (ifnull(c_utinyint, c_enum_t))	c_enum_t+1-1	c_enum_t
a	0	1	1	a
select ifnull(c_usmallint, c_enum_t), 1 in (ifnull(c_usmallint, c_enum_t)), 'a' in (ifnull(c_usmallint, c_enum_t)), c_enum_t+1-1, c_enum_t from test_enum1;
Catalog	Database	Table	Table_alias	Column	Column_alias	Type	Length	Max length	Is_null	Flags	Decimals	Charsetnr
def				ifnull(c_usmallint, c_enum_t)	ifnull(c_usmallint, c_enum_t)	253	20	1	Y	0	31	45
def				1 in (ifnull(c_usmallint, c_enum_t))	1 in (ifnull(c_usmallint, c_enum_t))	3	1	1	Y	32896	0	63
def				'a' in (ifnull(c_usmallint, c_enum_t))	'a' in (ifnull(c_usmallint, c_enum_t))	3	1	1	Y	32896	0	63
def				c_enum_t+1-1	c_enum_t+1-1	5	23	1	Y	32896	31	63
def				c_enum_t	c_enum_t	253	4	1	Y	0	31	45
ifnull(c_usmallint, c_enum_t)	1 in (ifnull(c_usmallint, c_enum_t))	'a' in (ifnull(c_usmallint, c_enum_t))	c_enum_t+1-1	c_enum_t
a	0	1	1	a
select ifnull(c_umint, c_enum_t), 1 in (ifnull(c_umint, c_enum_t)), 'a' in (ifnull(c_umint, c_enum_t)), c_enum_t+1-1, c_enum_t from test_enum1;
Catalog	Database	Table	Table_alias	Column	Column_alias	Type	Length	Max length	Is_null	Flags	Decimals	Charsetnr
def				ifnull(c_umint, c_enum_t)	ifnull(c_umint, c_enum_t)	253	32	1	Y	0	31	45
def				1 in (ifnull(c_umint, c_enum_t))	1 in (ifnull(c_umint, c_enum_t))	3	1	1	Y	32896	0	63
def				'a' in (ifnull(c_umint, c_enum_t))	'a' in (ifnull(c_umint, c_enum_t))	3	1	1	Y	32896	0	63
def				c_enum_t+1-1	c_enum_t+1-1	5	23	1	Y	32896	31	63
def				c_enum_t	c_enum_t	253	4	1	Y	0	31	45
ifnull(c_umint, c_enum_t)	1 in (ifnull(c_umint, c_enum_t))	'a' in (ifnull(c_umint, c_enum_t))	c_enum_t+1-1	c_enum_t
a	0	1	1	a
select ifnull(c_uint, c_enum_t), 1 in (ifnull(c_uint, c_enum_t)), 'a' in (ifnull(c_uint, c_enum_t)), c_enum_t+1-1, c_enum_t from test_enum1;
Catalog	Database	Table	Table_alias	Column	Column_alias	Type	Length	Max length	Is_null	Flags	Decimals	Charsetnr
def				ifnull(c_uint, c_enum_t)	ifnull(c_uint, c_enum_t)	253	40	1	Y	0	31	45
def				1 in (ifnull(c_uint, c_enum_t))	1 in (ifnull(c_uint, c_enum_t))	3	1	1	Y	32896	0	63
def				'a' in (ifnull(c_uint, c_enum_t))	'a' in (ifnull(c_uint, c_enum_t))	3	1	1	Y	32896	0	63
def				c_enum_t+1-1	c_enum_t+1-1	5	23	1	Y	32896	31	63
def				c_enum_t	c_enum_t	253	4	1	Y	0	31	45
ifnull(c_uint, c_enum_t)	1 in (ifnull(c_uint, c_enum_t))	'a' in (ifnull(c_uint, c_enum_t))	c_enum_t+1-1	c_enum_t
a	0	1	1	a
select ifnull(c_ubigint, c_enum_t), 1 in (ifnull(c_ubigint, c_enum_t)), 'a' in (ifnull(c_ubigint, c_enum_t)), c_enum_t+1-1, c_enum_t from test_enum1;
Catalog	Database	Table	Table_alias	Column	Column_alias	Type	Length	Max length	Is_null	Flags	Decimals	Charsetnr
def				ifnull(c_ubigint, c_enum_t)	ifnull(c_ubigint, c_enum_t)	253	80	1	Y	0	31	45
def				1 in (ifnull(c_ubigint, c_enum_t))	1 in (ifnull(c_ubigint, c_enum_t))	3	1	1	Y	32896	0	63
def				'a' in (ifnull(c_ubigint, c_enum_t))	'a' in (ifnull(c_ubigint, c_enum_t))	3	1	1	Y	32896	0	63
def				c_enum_t+1-1	c_enum_t+1-1	5	23	1	Y	32896	31	63
def				c_enum_t	c_enum_t	253	4	1	Y	0	31	45
ifnull(c_ubigint, c_enum_t)	1 in (ifnull(c_ubigint, c_enum_t))	'a' in (ifnull(c_ubigint, c_enum_t))	c_enum_t+1-1	c_enum_t
a	0	1	1	a
select ifnull(c_float, c_enum_t), 1 in (ifnull(c_float, c_enum_t)), 'a' in (ifnull(c_float, c_enum_t)), c_enum_t+1-1, c_enum_t from test_enum1;
Catalog	Database	Table	Table_alias	Column	Column_alias	Type	Length	Max length	Is_null	Flags	Decimals	Charsetnr
def				ifnull(c_float, c_enum_t)	ifnull(c_float, c_enum_t)	253	48	1	Y	0	31	45
def				1 in (ifnull(c_float, c_enum_t))	1 in (ifnull(c_float, c_enum_t))	3	1	1	Y	32896	0	63
def				'a' in (ifnull(c_float, c_enum_t))	'a' in (ifnull(c_float, c_enum_t))	3	1	1	Y	32896	0	63
def				c_enum_t+1-1	c_enum_t+1-1	5	23	1	Y	32896	31	63
def				c_enum_t	c_enum_t	253	4	1	Y	0	31	45
ifnull(c_float, c_enum_t)	1 in (ifnull(c_float, c_enum_t))	'a' in (ifnull(c_float, c_enum_t))	c_enum_t+1-1	c_enum_t
a	0	1	1	a
select ifnull(c_double, c_enum_t), 1 in (ifnull(c_double, c_enum_t)), 'a' in (ifnull(c_double, c_enum_t)), c_enum_t+1-1, c_enum_t from test_enum1;
Catalog	Database	Table	Table_alias	Column	Column_alias	Type	Length	Max length	Is_null	Flags	Decimals	Charsetnr
def				ifnull(c_double, c_enum_t)	ifnull(c_double, c_enum_t)	253	92	1	Y	0	31	45
def				1 in (ifnull(c_double, c_enum_t))	1 in (ifnull(c_double, c_enum_t))	3	1	1	Y	32896	0	63
def				'a' in (ifnull(c_double, c_enum_t))	'a' in (ifnull(c_double, c_enum_t))	3	1	1	Y	32896	0	63
def				c_enum_t+1-1	c_enum_t+1-1	5	23	1	Y	32896	31	63
def				c_enum_t	c_enum_t	253	4	1	Y	0	31	45
ifnull(c_double, c_enum_t)	1 in (ifnull(c_double, c_enum_t))	'a' in (ifnull(c_double, c_enum_t))	c_enum_t+1-1	c_enum_t
a	0	1	1	a
select ifnull(c_ufloat, c_enum_t), 1 in (ifnull(c_ufloat, c_enum_t)), 'a' in (ifnull(c_ufloat, c_enum_t)), c_enum_t+1-1, c_enum_t from test_enum1;
Catalog	Database	Table	Table_alias	Column	Column_alias	Type	Length	Max length	Is_null	Flags	Decimals	Charsetnr
def				ifnull(c_ufloat, c_enum_t)	ifnull(c_ufloat, c_enum_t)	253	48	1	Y	0	31	45
def				1 in (ifnull(c_ufloat, c_enum_t))	1 in (ifnull(c_ufloat, c_enum_t))	3	1	1	Y	32896	0	63
def				'a' in (ifnull(c_ufloat, c_enum_t))	'a' in (ifnull(c_ufloat, c_enum_t))	3	1	1	Y	32896	0	63
def				c_enum_t+1-1	c_enum_t+1-1	5	23	1	Y	32896	31	63
def				c_enum_t	c_enum_t	253	4	1	Y	0	31	45
ifnull(c_ufloat, c_enum_t)	1 in (ifnull(c_ufloat, c_enum_t))	'a' in (ifnull(c_ufloat, c_enum_t))	c_enum_t+1-1	c_enum_t
a	0	1	1	a
select ifnull(c_udouble, c_enum_t), 1 in (ifnull(c_udouble, c_enum_t)), 'a' in (ifnull(c_udouble, c_enum_t)), c_enum_t+1-1, c_enum_t from test_enum1;
Catalog	Database	Table	Table_alias	Column	Column_alias	Type	Length	Max length	Is_null	Flags	Decimals	Charsetnr
def				ifnull(c_udouble, c_enum_t)	ifnull(c_udouble, c_enum_t)	253	92	1	Y	0	31	45
def				1 in (ifnull(c_udouble, c_enum_t))	1 in (ifnull(c_udouble, c_enum_t))	3	1	1	Y	32896	0	63
def				'a' in (ifnull(c_udouble, c_enum_t))	'a' in (ifnull(c_udouble, c_enum_t))	3	1	1	Y	32896	0	63
def				c_enum_t+1-1	c_enum_t+1-1	5	23	1	Y	32896	31	63
def				c_enum_t	c_enum_t	253	4	1	Y	0	31	45
ifnull(c_udouble, c_enum_t)	1 in (ifnull(c_udouble, c_enum_t))	'a' in (ifnull(c_udouble, c_enum_t))	c_enum_t+1-1	c_enum_t
a	0	1	1	a
select ifnull(c_dec, c_enum_t), 1 in (ifnull(c_dec, c_enum_t)), 'a' in (ifnull(c_dec, c_enum_t)), c_enum_t+1-1, c_enum_t from test_enum1;
Catalog	Database	Table	Table_alias	Column	Column_alias	Type	Length	Max length	Is_null	Flags	Decimals	Charsetnr
def				ifnull(c_dec, c_enum_t)	ifnull(c_dec, c_enum_t)	253	44	1	Y	0	31	45
def				1 in (ifnull(c_dec, c_enum_t))	1 in (ifnull(c_dec, c_enum_t))	3	1	1	Y	32896	0	63
def				'a' in (ifnull(c_dec, c_enum_t))	'a' in (ifnull(c_dec, c_enum_t))	3	1	1	Y	32896	0	63
def				c_enum_t+1-1	c_enum_t+1-1	5	23	1	Y	32896	31	63
def				c_enum_t	c_enum_t	253	4	1	Y	0	31	45
ifnull(c_dec, c_enum_t)	1 in (ifnull(c_dec, c_enum_t))	'a' in (ifnull(c_dec, c_enum_t))	c_enum_t+1-1	c_enum_t
a	0	1	1	a
select ifnull(c_udec, c_enum_t), 1 in (ifnull(c_udec, c_enum_t)), 'a' in (ifnull(c_udec, c_enum_t)), c_enum_t+1-1, c_enum_t from test_enum1;
Catalog	Database	Table	Table_alias	Column	Column_alias	Type	Length	Max length	Is_null	Flags	Decimals	Charsetnr
def				ifnull(c_udec, c_enum_t)	ifnull(c_udec, c_enum_t)	253	40	1	Y	0	31	45
def				1 in (ifnull(c_udec, c_enum_t))	1 in (ifnull(c_udec, c_enum_t))	3	1	1	Y	32896	0	63
def				'a' in (ifnull(c_udec, c_enum_t))	'a' in (ifnull(c_udec, c_enum_t))	3	1	1	Y	32896	0	63
def				c_enum_t+1-1	c_enum_t+1-1	5	23	1	Y	32896	31	63
def				c_enum_t	c_enum_t	253	4	1	Y	0	31	45
ifnull(c_udec, c_enum_t)	1 in (ifnull(c_udec, c_enum_t))	'a' in (ifnull(c_udec, c_enum_t))	c_enum_t+1-1	c_enum_t
a	0	1	1	a
select ifnull(c_datetime, c_enum_t), 1 in (ifnull(c_datetime, c_enum_t)), 'a' in (ifnull(c_datetime, c_enum_t)), c_enum_t+1-1, c_enum_t from test_enum1;
Catalog	Database	Table	Table_alias	Column	Column_alias	Type	Length	Max length	Is_null	Flags	Decimals	Charsetnr
def				ifnull(c_datetime, c_enum_t)	ifnull(c_datetime, c_enum_t)	253	76	1	Y	0	31	45
def				1 in (ifnull(c_datetime, c_enum_t))	1 in (ifnull(c_datetime, c_enum_t))	3	1	1	Y	32896	0	63
def				'a' in (ifnull(c_datetime, c_enum_t))	'a' in (ifnull(c_datetime, c_enum_t))	3	1	1	Y	32896	0	63
def				c_enum_t+1-1	c_enum_t+1-1	5	23	1	Y	32896	31	63
def				c_enum_t	c_enum_t	253	4	1	Y	0	31	45
ifnull(c_datetime, c_enum_t)	1 in (ifnull(c_datetime, c_enum_t))	'a' in (ifnull(c_datetime, c_enum_t))	c_enum_t+1-1	c_enum_t
a	0	1	1	a
select ifnull(c_timestamp, c_enum_t), 1 in (ifnull(c_timestamp, c_enum_t)), 'a' in (ifnull(c_timestamp, c_enum_t)), c_enum_t+1-1, c_enum_t from test_enum1;
Catalog	Database	Table	Table_alias	Column	Column_alias	Type	Length	Max length	Is_null	Flags	Decimals	Charsetnr
def				ifnull(c_timestamp, c_enum_t)	ifnull(c_timestamp, c_enum_t)	253	76	19	Y	0	31	45
def				1 in (ifnull(c_timestamp, c_enum_t))	1 in (ifnull(c_timestamp, c_enum_t))	3	1	1	Y	32896	0	63
def				'a' in (ifnull(c_timestamp, c_enum_t))	'a' in (ifnull(c_timestamp, c_enum_t))	3	1	1	Y	32896	0	63
def				c_enum_t+1-1	c_enum_t+1-1	5	23	1	Y	32896	31	63
def				c_enum_t	c_enum_t	253	4	1	Y	0	31	45
ifnull(c_timestamp, c_enum_t)	1 in (ifnull(c_timestamp, c_enum_t))	'a' in (ifnull(c_timestamp, c_enum_t))	c_enum_t+1-1	c_enum_t
2016-01-01 00:01:02	0	0	1	a
select ifnull(c_date, c_enum_t), 1 in (ifnull(c_date, c_enum_t)), 'a' in (ifnull(c_date, c_enum_t)), c_enum_t+1-1, c_enum_t from test_enum1;
Catalog	Database	Table	Table_alias	Column	Column_alias	Type	Length	Max length	Is_null	Flags	Decimals	Charsetnr
def				ifnull(c_date, c_enum_t)	ifnull(c_date, c_enum_t)	253	40	1	Y	0	31	45
def				1 in (ifnull(c_date, c_enum_t))	1 in (ifnull(c_date, c_enum_t))	3	1	1	Y	32896	0	63
def				'a' in (ifnull(c_date, c_enum_t))	'a' in (ifnull(c_date, c_enum_t))	3	1	1	Y	32896	0	63
def				c_enum_t+1-1	c_enum_t+1-1	5	23	1	Y	32896	31	63
def				c_enum_t	c_enum_t	253	4	1	Y	0	31	45
ifnull(c_date, c_enum_t)	1 in (ifnull(c_date, c_enum_t))	'a' in (ifnull(c_date, c_enum_t))	c_enum_t+1-1	c_enum_t
a	0	1	1	a
select ifnull(c_time, c_enum_t), 1 in (ifnull(c_time, c_enum_t)), 'a' in (ifnull(c_time, c_enum_t)), c_enum_t+1-1, c_enum_t from test_enum1;
Catalog	Database	Table	Table_alias	Column	Column_alias	Type	Length	Max length	Is_null	Flags	Decimals	Charsetnr
def				ifnull(c_time, c_enum_t)	ifnull(c_time, c_enum_t)	253	40	1	Y	0	31	45
def				1 in (ifnull(c_time, c_enum_t))	1 in (ifnull(c_time, c_enum_t))	3	1	1	Y	32896	0	63
def				'a' in (ifnull(c_time, c_enum_t))	'a' in (ifnull(c_time, c_enum_t))	3	1	1	Y	32896	0	63
def				c_enum_t+1-1	c_enum_t+1-1	5	23	1	Y	32896	31	63
def				c_enum_t	c_enum_t	253	4	1	Y	0	31	45
ifnull(c_time, c_enum_t)	1 in (ifnull(c_time, c_enum_t))	'a' in (ifnull(c_time, c_enum_t))	c_enum_t+1-1	c_enum_t
a	0	1	1	a
select ifnull(c_year, c_enum_t), 1 in (ifnull(c_year, c_enum_t)), 'a' in (ifnull(c_year, c_enum_t)), c_enum_t+1-1, c_enum_t from test_enum1;
Catalog	Database	Table	Table_alias	Column	Column_alias	Type	Length	Max length	Is_null	Flags	Decimals	Charsetnr
def				ifnull(c_year, c_enum_t)	ifnull(c_year, c_enum_t)	253	16	1	Y	0	31	45
def				1 in (ifnull(c_year, c_enum_t))	1 in (ifnull(c_year, c_enum_t))	3	1	1	Y	32896	0	63
def				'a' in (ifnull(c_year, c_enum_t))	'a' in (ifnull(c_year, c_enum_t))	3	1	1	Y	32896	0	63
def				c_enum_t+1-1	c_enum_t+1-1	5	23	1	Y	32896	31	63
def				c_enum_t	c_enum_t	253	4	1	Y	0	31	45
ifnull(c_year, c_enum_t)	1 in (ifnull(c_year, c_enum_t))	'a' in (ifnull(c_year, c_enum_t))	c_enum_t+1-1	c_enum_t
a	0	1	1	a
select ifnull(c_varchar, c_enum_t), 1 in (ifnull(c_varchar, c_enum_t)), 'a' in (ifnull(c_varchar, c_enum_t)), c_enum_t+1-1, c_enum_t from test_enum1;
Catalog	Database	Table	Table_alias	Column	Column_alias	Type	Length	Max length	Is_null	Flags	Decimals	Charsetnr
def				ifnull(c_varchar, c_enum_t)	ifnull(c_varchar, c_enum_t)	253	64	1	Y	0	31	45
def				1 in (ifnull(c_varchar, c_enum_t))	1 in (ifnull(c_varchar, c_enum_t))	3	1	1	Y	32896	0	63
def				'a' in (ifnull(c_varchar, c_enum_t))	'a' in (ifnull(c_varchar, c_enum_t))	3	1	1	Y	32896	0	63
def				c_enum_t+1-1	c_enum_t+1-1	5	23	1	Y	32896	31	63
def				c_enum_t	c_enum_t	253	4	1	Y	0	31	45
ifnull(c_varchar, c_enum_t)	1 in (ifnull(c_varchar, c_enum_t))	'a' in (ifnull(c_varchar, c_enum_t))	c_enum_t+1-1	c_enum_t
a	0	1	1	a
select ifnull(c_char, c_enum_t), 1 in (ifnull(c_char, c_enum_t)), 'a' in (ifnull(c_char, c_enum_t)), c_enum_t+1-1, c_enum_t from test_enum1;
Catalog	Database	Table	Table_alias	Column	Column_alias	Type	Length	Max length	Is_null	Flags	Decimals	Charsetnr
def				ifnull(c_char, c_enum_t)	ifnull(c_char, c_enum_t)	253	64	1	Y	0	31	45
def				1 in (ifnull(c_char, c_enum_t))	1 in (ifnull(c_char, c_enum_t))	3	1	1	Y	32896	0	63
def				'a' in (ifnull(c_char, c_enum_t))	'a' in (ifnull(c_char, c_enum_t))	3	1	1	Y	32896	0	63
def				c_enum_t+1-1	c_enum_t+1-1	5	23	1	Y	32896	31	63
def				c_enum_t	c_enum_t	253	4	1	Y	0	31	45
ifnull(c_char, c_enum_t)	1 in (ifnull(c_char, c_enum_t))	'a' in (ifnull(c_char, c_enum_t))	c_enum_t+1-1	c_enum_t
a	0	1	1	a
select ifnull(c_bit, c_enum_t), 1 in (ifnull(c_bit, c_enum_t)), 'a' in (ifnull(c_bit, c_enum_t)), c_enum_t+1-1, c_enum_t from test_enum1;
Catalog	Database	Table	Table_alias	Column	Column_alias	Type	Length	Max length	Is_null	Flags	Decimals	Charsetnr
def				ifnull(c_bit, c_enum_t)	ifnull(c_bit, c_enum_t)	253	64	1	Y	0	31	45
def				1 in (ifnull(c_bit, c_enum_t))	1 in (ifnull(c_bit, c_enum_t))	3	1	1	Y	32896	0	63
def				'a' in (ifnull(c_bit, c_enum_t))	'a' in (ifnull(c_bit, c_enum_t))	3	1	1	Y	32896	0	63
def				c_enum_t+1-1	c_enum_t+1-1	5	23	1	Y	32896	31	63
def				c_enum_t	c_enum_t	253	4	1	Y	0	31	45
ifnull(c_bit, c_enum_t)	1 in (ifnull(c_bit, c_enum_t))	'a' in (ifnull(c_bit, c_enum_t))	c_enum_t+1-1	c_enum_t
a	0	1	1	a
select ifnull(c_enum, c_enum_t), 1 in (ifnull(c_enum, c_enum_t)), 'a' in (ifnull(c_enum, c_enum_t)), c_enum+1-1, c_enum from test_enum1;
Catalog	Database	Table	Table_alias	Column	Column_alias	Type	Length	Max length	Is_null	Flags	Decimals	Charsetnr
def				ifnull(c_enum, c_enum_t)	ifnull(c_enum, c_enum_t)	253	4	1	Y	0	31	45
def				1 in (ifnull(c_enum, c_enum_t))	1 in (ifnull(c_enum, c_enum_t))	3	1	1	Y	32896	0	63
def				'a' in (ifnull(c_enum, c_enum_t))	'a' in (ifnull(c_enum, c_enum_t))	3	1	1	Y	32896	0	63
def				c_enum+1-1	c_enum+1-1	5	23	0	Y	32896	31	63
def				c_enum	c_enum	253	4	0	Y	0	31	45
ifnull(c_enum, c_enum_t)	1 in (ifnull(c_enum, c_enum_t))	'a' in (ifnull(c_enum, c_enum_t))	c_enum+1-1	c_enum
a	0	1	NULL	NULL
select ifnull(c_set, c_enum_t), 1 in (ifnull(c_set, c_enum_t)), 'a' in (ifnull(c_set, c_enum_t)), c_enum_t+1-1, c_enum_t from test_enum1;
Catalog	Database	Table	Table_alias	Column	Column_alias	Type	Length	Max length	Is_null	Flags	Decimals	Charsetnr
def				ifnull(c_set, c_enum_t)	ifnull(c_set, c_enum_t)	253	20	1	Y	0	31	45
def				1 in (ifnull(c_set, c_enum_t))	1 in (ifnull(c_set, c_enum_t))	3	1	1	Y	32896	0	63
def				'a' in (ifnull(c_set, c_enum_t))	'a' in (ifnull(c_set, c_enum_t))	3	1	1	Y	32896	0	63
def				c_enum_t+1-1	c_enum_t+1-1	5	23	1	Y	32896	31	63
def				c_enum_t	c_enum_t	253	4	1	Y	0	31	45
ifnull(c_set, c_enum_t)	1 in (ifnull(c_set, c_enum_t))	'a' in (ifnull(c_set, c_enum_t))	c_enum_t+1-1	c_enum_t
a	0	1	1	a
delete from test_enum1 where c_enum_t='a';
insert into test_enum1 value(-1, -1, -1, -1, -1,1,1,1,1,1, 1.0,1.0, 2.0,2.0, 3.0,3.0, "2016-01-01 00:01:02", "2016-01-02 00:01:02", "1999-01-01", "02:02:02", "1901", "varchar", "aaa", /*"tinytext", "text", "mtext", "longtext",*/ 0x43, 1, 2, 3);
select ifnull(null, c_enum_t), 1 in (ifnull(null, c_enum_t)), 'a' in (ifnull(null, c_enum_t)), c_enum_t+1-1, c_enum_t from test_enum1;
ifnull(null, c_enum_t)	1 in (ifnull(null, c_enum_t))	'a' in (ifnull(null, c_enum_t))	c_enum_t+1-1	c_enum_t
c	0	0	3	c
select ifnull(c_tinyint, c_enum_t), 1 in (ifnull(c_tinyint, c_enum_t)), 'a' in (ifnull(c_tinyint, c_enum_t)), c_enum_t+1-1, c_enum_t from test_enum1;
ifnull(c_tinyint, c_enum_t)	1 in (ifnull(c_tinyint, c_enum_t))	'a' in (ifnull(c_tinyint, c_enum_t))	c_enum_t+1-1	c_enum_t
-1	0	0	3	c
select ifnull(c_smallint, c_enum_t), 1 in (ifnull(c_smallint, c_enum_t)), 'a' in (ifnull(c_smallint, c_enum_t)), c_enum_t+1-1, c_enum_t from test_enum1;
ifnull(c_smallint, c_enum_t)	1 in (ifnull(c_smallint, c_enum_t))	'a' in (ifnull(c_smallint, c_enum_t))	c_enum_t+1-1	c_enum_t
-1	0	0	3	c
select ifnull(c_mint, c_enum_t), 1 in (ifnull(c_mint, c_enum_t)), 'a' in (ifnull(c_mint, c_enum_t)), c_enum_t+1-1, c_enum_t from test_enum1;
ifnull(c_mint, c_enum_t)	1 in (ifnull(c_mint, c_enum_t))	'a' in (ifnull(c_mint, c_enum_t))	c_enum_t+1-1	c_enum_t
-1	0	0	3	c
select ifnull(c_int, c_enum_t), 1 in (ifnull(c_int, c_enum_t)), 'a' in (ifnull(c_int, c_enum_t)), c_enum_t+1-1, c_enum_t from test_enum1;
ifnull(c_int, c_enum_t)	1 in (ifnull(c_int, c_enum_t))	'a' in (ifnull(c_int, c_enum_t))	c_enum_t+1-1	c_enum_t
-1	0	0	3	c
select ifnull(c_bigint, c_enum_t), 1 in (ifnull(c_bigint, c_enum_t)), 'a' in (ifnull(c_bigint, c_enum_t)), c_enum_t+1-1, c_enum_t from test_enum1;
ifnull(c_bigint, c_enum_t)	1 in (ifnull(c_bigint, c_enum_t))	'a' in (ifnull(c_bigint, c_enum_t))	c_enum_t+1-1	c_enum_t
-1	0	0	3	c
select ifnull(c_utinyint, c_enum_t), 1 in (ifnull(c_utinyint, c_enum_t)), 'a' in (ifnull(c_utinyint, c_enum_t)), c_enum_t+1-1, c_enum_t from test_enum1;
ifnull(c_utinyint, c_enum_t)	1 in (ifnull(c_utinyint, c_enum_t))	'a' in (ifnull(c_utinyint, c_enum_t))	c_enum_t+1-1	c_enum_t
1	1	0	3	c
select ifnull(c_usmallint, c_enum_t), 1 in (ifnull(c_usmallint, c_enum_t)), 'a' in (ifnull(c_usmallint, c_enum_t)), c_enum_t+1-1, c_enum_t from test_enum1;
ifnull(c_usmallint, c_enum_t)	1 in (ifnull(c_usmallint, c_enum_t))	'a' in (ifnull(c_usmallint, c_enum_t))	c_enum_t+1-1	c_enum_t
1	1	0	3	c
select ifnull(c_umint, c_enum_t), 1 in (ifnull(c_umint, c_enum_t)), 'a' in (ifnull(c_umint, c_enum_t)), c_enum_t+1-1, c_enum_t from test_enum1;
ifnull(c_umint, c_enum_t)	1 in (ifnull(c_umint, c_enum_t))	'a' in (ifnull(c_umint, c_enum_t))	c_enum_t+1-1	c_enum_t
1	1	0	3	c
select ifnull(c_uint, c_enum_t), 1 in (ifnull(c_uint, c_enum_t)), 'a' in (ifnull(c_uint, c_enum_t)), c_enum_t+1-1, c_enum_t from test_enum1;
ifnull(c_uint, c_enum_t)	1 in (ifnull(c_uint, c_enum_t))	'a' in (ifnull(c_uint, c_enum_t))	c_enum_t+1-1	c_enum_t
1	1	0	3	c
select ifnull(c_ubigint, c_enum_t), 1 in (ifnull(c_ubigint, c_enum_t)), 'a' in (ifnull(c_ubigint, c_enum_t)), c_enum_t+1-1, c_enum_t from test_enum1;
ifnull(c_ubigint, c_enum_t)	1 in (ifnull(c_ubigint, c_enum_t))	'a' in (ifnull(c_ubigint, c_enum_t))	c_enum_t+1-1	c_enum_t
1	1	0	3	c
select ifnull(c_float, c_enum_t), 1 in (ifnull(c_float, c_enum_t)), 'a' in (ifnull(c_float, c_enum_t)), c_enum_t+1-1, c_enum_t from test_enum1;
ifnull(c_float, c_enum_t)	1 in (ifnull(c_float, c_enum_t))	'a' in (ifnull(c_float, c_enum_t))	c_enum_t+1-1	c_enum_t
1	1	0	3	c
select ifnull(c_double, c_enum_t), 1 in (ifnull(c_double, c_enum_t)), 'a' in (ifnull(c_double, c_enum_t)), c_enum_t+1-1, c_enum_t from test_enum1;
ifnull(c_double, c_enum_t)	1 in (ifnull(c_double, c_enum_t))	'a' in (ifnull(c_double, c_enum_t))	c_enum_t+1-1	c_enum_t
1	1	0	3	c
select ifnull(c_ufloat, c_enum_t), 1 in (ifnull(c_ufloat, c_enum_t)), 'a' in (ifnull(c_ufloat, c_enum_t)), c_enum_t+1-1, c_enum_t from test_enum1;
ifnull(c_ufloat, c_enum_t)	1 in (ifnull(c_ufloat, c_enum_t))	'a' in (ifnull(c_ufloat, c_enum_t))	c_enum_t+1-1	c_enum_t
2	0	0	3	c
select ifnull(c_udouble, c_enum_t), 1 in (ifnull(c_udouble, c_enum_t)), 'a' in (ifnull(c_udouble, c_enum_t)), c_enum_t+1-1, c_enum_t from test_enum1;
ifnull(c_udouble, c_enum_t)	1 in (ifnull(c_udouble, c_enum_t))	'a' in (ifnull(c_udouble, c_enum_t))	c_enum_t+1-1	c_enum_t
2	0	0	3	c
select ifnull(c_dec, c_enum_t), 1 in (ifnull(c_dec, c_enum_t)), 'a' in (ifnull(c_dec, c_enum_t)), c_enum_t+1-1, c_enum_t from test_enum1;
ifnull(c_dec, c_enum_t)	1 in (ifnull(c_dec, c_enum_t))	'a' in (ifnull(c_dec, c_enum_t))	c_enum_t+1-1	c_enum_t
3	0	0	3	c
select ifnull(c_udec, c_enum_t), 1 in (ifnull(c_udec, c_enum_t)), 'a' in (ifnull(c_udec, c_enum_t)), c_enum_t+1-1, c_enum_t from test_enum1;
ifnull(c_udec, c_enum_t)	1 in (ifnull(c_udec, c_enum_t))	'a' in (ifnull(c_udec, c_enum_t))	c_enum_t+1-1	c_enum_t
3	0	0	3	c
select ifnull(c_datetime, c_enum_t), 1 in (ifnull(c_datetime, c_enum_t)), 'a' in (ifnull(c_datetime, c_enum_t)), c_enum_t+1-1, c_enum_t from test_enum1;
ifnull(c_datetime, c_enum_t)	1 in (ifnull(c_datetime, c_enum_t))	'a' in (ifnull(c_datetime, c_enum_t))	c_enum_t+1-1	c_enum_t
2016-01-01 00:01:02	0	0	3	c
select ifnull(c_timestamp, c_enum_t), 1 in (ifnull(c_timestamp, c_enum_t)), 'a' in (ifnull(c_timestamp, c_enum_t)), c_enum_t+1-1, c_enum_t from test_enum1;
ifnull(c_timestamp, c_enum_t)	1 in (ifnull(c_timestamp, c_enum_t))	'a' in (ifnull(c_timestamp, c_enum_t))	c_enum_t+1-1	c_enum_t
2016-01-02 00:01:02	0	0	3	c
select ifnull(c_date, c_enum_t), 1 in (ifnull(c_date, c_enum_t)), 'a' in (ifnull(c_date, c_enum_t)), c_enum_t+1-1, c_enum_t from test_enum1;
ifnull(c_date, c_enum_t)	1 in (ifnull(c_date, c_enum_t))	'a' in (ifnull(c_date, c_enum_t))	c_enum_t+1-1	c_enum_t
1999-01-01	0	0	3	c
select ifnull(c_time, c_enum_t), 1 in (ifnull(c_time, c_enum_t)), 'a' in (ifnull(c_time, c_enum_t)), c_enum_t+1-1, c_enum_t from test_enum1;
ifnull(c_time, c_enum_t)	1 in (ifnull(c_time, c_enum_t))	'a' in (ifnull(c_time, c_enum_t))	c_enum_t+1-1	c_enum_t
02:02:02	0	0	3	c
select ifnull(c_year, c_enum_t), 1 in (ifnull(c_year, c_enum_t)), 'a' in (ifnull(c_year, c_enum_t)), c_enum_t+1-1, c_enum_t from test_enum1;
ifnull(c_year, c_enum_t)	1 in (ifnull(c_year, c_enum_t))	'a' in (ifnull(c_year, c_enum_t))	c_enum_t+1-1	c_enum_t
1901	0	0	3	c
select ifnull(c_varchar, c_enum_t), 1 in (ifnull(c_varchar, c_enum_t)), 'a' in (ifnull(c_varchar, c_enum_t)), c_enum_t+1-1, c_enum_t from test_enum1;
ifnull(c_varchar, c_enum_t)	1 in (ifnull(c_varchar, c_enum_t))	'a' in (ifnull(c_varchar, c_enum_t))	c_enum_t+1-1	c_enum_t
varchar	0	0	3	c
select ifnull(c_char, c_enum_t), 1 in (ifnull(c_char, c_enum_t)), 'a' in (ifnull(c_char, c_enum_t)), c_enum_t+1-1, c_enum_t from test_enum1;
ifnull(c_char, c_enum_t)	1 in (ifnull(c_char, c_enum_t))	'a' in (ifnull(c_char, c_enum_t))	c_enum_t+1-1	c_enum_t
aaa	0	0	3	c
select ifnull(c_bit, c_enum_t), 1 in (ifnull(c_bit, c_enum_t)), 'a' in (ifnull(c_bit, c_enum_t)), c_enum_t+1-1, c_enum_t from test_enum1;
ifnull(c_bit, c_enum_t)	1 in (ifnull(c_bit, c_enum_t))	'a' in (ifnull(c_bit, c_enum_t))	c_enum_t+1-1	c_enum_t
 C	0	0	3	c
select ifnull(c_enum, c_enum_t), 1 in (ifnull(c_enum, c_enum_t)), 'a' in (ifnull(c_enum, c_enum_t)), c_enum+1-1, c_enum from test_enum1;
ifnull(c_enum, c_enum_t)	1 in (ifnull(c_enum, c_enum_t))	'a' in (ifnull(c_enum, c_enum_t))	c_enum+1-1	c_enum
a	0	1	1	a
select ifnull(c_set, c_enum_t), 1 in (ifnull(c_set, c_enum_t)), 'a' in (ifnull(c_set, c_enum_t)), c_enum_t+1-1, c_enum_t from test_enum1;
ifnull(c_set, c_enum_t)	1 in (ifnull(c_set, c_enum_t))	'a' in (ifnull(c_set, c_enum_t))	c_enum_t+1-1	c_enum_t
b	0	0	3	c
select ifnull(c_enum_t, null), 1 in (ifnull(c_enum_t, null)), 'a' in (ifnull(c_enum_t, null)), c_enum_t+1-1, c_enum_t from test_enum1;
ifnull(c_enum_t, null)	1 in (ifnull(c_enum_t, null))	'a' in (ifnull(c_enum_t, null))	c_enum_t+1-1	c_enum_t
c	0	0	3	c
select ifnull(c_enum_t, c_tinyint), 1 in (ifnull(c_enum_t, c_tinyint)), 'a' in (ifnull(c_enum_t, c_tinyint)), c_enum_t+1-1, c_enum_t from test_enum1;
ifnull(c_enum_t, c_tinyint)	1 in (ifnull(c_enum_t, c_tinyint))	'a' in (ifnull(c_enum_t, c_tinyint))	c_enum_t+1-1	c_enum_t
c	0	0	3	c
select ifnull(c_enum_t, c_smallint), 1 in (ifnull(c_enum_t, c_smallint)), 'a' in (ifnull(c_enum_t, c_smallint)), c_enum_t+1-1, c_enum_t from test_enum1;
ifnull(c_enum_t, c_smallint)	1 in (ifnull(c_enum_t, c_smallint))	'a' in (ifnull(c_enum_t, c_smallint))	c_enum_t+1-1	c_enum_t
c	0	0	3	c
select ifnull(c_enum_t, c_mint), 1 in (ifnull(c_enum_t, c_mint)), 'a' in (ifnull(c_enum_t, c_mint)), c_enum_t+1-1, c_enum_t from test_enum1;
ifnull(c_enum_t, c_mint)	1 in (ifnull(c_enum_t, c_mint))	'a' in (ifnull(c_enum_t, c_mint))	c_enum_t+1-1	c_enum_t
c	0	0	3	c
select ifnull(c_enum_t, c_int), 1 in (ifnull(c_enum_t, c_int)), 'a' in (ifnull(c_enum_t, c_int)), c_enum_t+1-1, c_enum_t from test_enum1;
ifnull(c_enum_t, c_int)	1 in (ifnull(c_enum_t, c_int))	'a' in (ifnull(c_enum_t, c_int))	c_enum_t+1-1	c_enum_t
c	0	0	3	c
select ifnull(c_enum_t, c_bigint), 1 in (ifnull(c_enum_t, c_bigint)), 'a' in (ifnull(c_enum_t, c_bigint)), c_enum_t+1-1, c_enum_t from test_enum1;
ifnull(c_enum_t, c_bigint)	1 in (ifnull(c_enum_t, c_bigint))	'a' in (ifnull(c_enum_t, c_bigint))	c_enum_t+1-1	c_enum_t
c	0	0	3	c
select ifnull(c_enum_t, c_utinyint), 1 in (ifnull(c_enum_t, c_utinyint)), 'a' in (ifnull(c_enum_t, c_utinyint)), c_enum_t+1-1, c_enum_t from test_enum1;
ifnull(c_enum_t, c_utinyint)	1 in (ifnull(c_enum_t, c_utinyint))	'a' in (ifnull(c_enum_t, c_utinyint))	c_enum_t+1-1	c_enum_t
c	0	0	3	c
select ifnull(c_enum_t, c_usmallint), 1 in (ifnull(c_enum_t, c_usmallint)), 'a' in (ifnull(c_enum_t, c_usmallint)), c_enum_t+1-1, c_enum_t from test_enum1;
ifnull(c_enum_t, c_usmallint)	1 in (ifnull(c_enum_t, c_usmallint))	'a' in (ifnull(c_enum_t, c_usmallint))	c_enum_t+1-1	c_enum_t
c	0	0	3	c
select ifnull(c_enum_t, c_umint), 1 in (ifnull(c_enum_t, c_umint)), 'a' in (ifnull(c_enum_t, c_umint)), c_enum_t+1-1, c_enum_t from test_enum1;
ifnull(c_enum_t, c_umint)	1 in (ifnull(c_enum_t, c_umint))	'a' in (ifnull(c_enum_t, c_umint))	c_enum_t+1-1	c_enum_t
c	0	0	3	c
select ifnull(c_enum_t, c_uint), 1 in (ifnull(c_enum_t, c_uint)), 'a' in (ifnull(c_enum_t, c_uint)), c_enum_t+1-1, c_enum_t from test_enum1;
ifnull(c_enum_t, c_uint)	1 in (ifnull(c_enum_t, c_uint))	'a' in (ifnull(c_enum_t, c_uint))	c_enum_t+1-1	c_enum_t
c	0	0	3	c
select ifnull(c_enum_t, c_ubigint), 1 in (ifnull(c_enum_t, c_ubigint)), 'a' in (ifnull(c_enum_t, c_ubigint)), c_enum_t+1-1, c_enum_t from test_enum1;
ifnull(c_enum_t, c_ubigint)	1 in (ifnull(c_enum_t, c_ubigint))	'a' in (ifnull(c_enum_t, c_ubigint))	c_enum_t+1-1	c_enum_t
c	0	0	3	c
select ifnull(c_enum_t, c_float), 1 in (ifnull(c_enum_t, c_float)), 'a' in (ifnull(c_enum_t, c_float)), c_enum_t+1-1, c_enum_t from test_enum1;
ifnull(c_enum_t, c_float)	1 in (ifnull(c_enum_t, c_float))	'a' in (ifnull(c_enum_t, c_float))	c_enum_t+1-1	c_enum_t
c	0	0	3	c
select ifnull(c_enum_t, c_double), 1 in (ifnull(c_enum_t, c_double)), 'a' in (ifnull(c_enum_t, c_double)), c_enum_t+1-1, c_enum_t from test_enum1;
ifnull(c_enum_t, c_double)	1 in (ifnull(c_enum_t, c_double))	'a' in (ifnull(c_enum_t, c_double))	c_enum_t+1-1	c_enum_t
c	0	0	3	c
select ifnull(c_enum_t, c_ufloat), 1 in (ifnull(c_enum_t, c_ufloat)), 'a' in (ifnull(c_enum_t, c_ufloat)), c_enum_t+1-1, c_enum_t from test_enum1;
ifnull(c_enum_t, c_ufloat)	1 in (ifnull(c_enum_t, c_ufloat))	'a' in (ifnull(c_enum_t, c_ufloat))	c_enum_t+1-1	c_enum_t
c	0	0	3	c
select ifnull(c_enum_t, c_udouble), 1 in (ifnull(c_enum_t, c_udouble)), 'a' in (ifnull(c_enum_t, c_udouble)), c_enum_t+1-1, c_enum_t from test_enum1;
ifnull(c_enum_t, c_udouble)	1 in (ifnull(c_enum_t, c_udouble))	'a' in (ifnull(c_enum_t, c_udouble))	c_enum_t+1-1	c_enum_t
c	0	0	3	c
select ifnull(c_enum_t, c_dec), 1 in (ifnull(c_enum_t, c_dec)), 'a' in (ifnull(c_enum_t, c_dec)), c_enum_t+1-1, c_enum_t from test_enum1;
ifnull(c_enum_t, c_dec)	1 in (ifnull(c_enum_t, c_dec))	'a' in (ifnull(c_enum_t, c_dec))	c_enum_t+1-1	c_enum_t
c	0	0	3	c
select ifnull(c_enum_t, c_udec), 1 in (ifnull(c_enum_t, c_udec)), 'a' in (ifnull(c_enum_t, c_udec)), c_enum_t+1-1, c_enum_t from test_enum1;
ifnull(c_enum_t, c_udec)	1 in (ifnull(c_enum_t, c_udec))	'a' in (ifnull(c_enum_t, c_udec))	c_enum_t+1-1	c_enum_t
c	0	0	3	c
select ifnull(c_enum_t, c_datetime), 1 in (ifnull(c_enum_t, c_datetime)), 'a' in (ifnull(c_enum_t, c_datetime)), c_enum_t+1-1, c_enum_t from test_enum1;
ifnull(c_enum_t, c_datetime)	1 in (ifnull(c_enum_t, c_datetime))	'a' in (ifnull(c_enum_t, c_datetime))	c_enum_t+1-1	c_enum_t
c	0	0	3	c
select ifnull(c_enum_t, c_timestamp), 1 in (ifnull(c_enum_t, c_timestamp)), 'a' in (ifnull(c_enum_t, c_timestamp)), c_enum_t+1-1, c_enum_t from test_enum1;
ifnull(c_enum_t, c_timestamp)	1 in (ifnull(c_enum_t, c_timestamp))	'a' in (ifnull(c_enum_t, c_timestamp))	c_enum_t+1-1	c_enum_t
c	0	0	3	c
select ifnull(c_enum_t, c_date), 1 in (ifnull(c_enum_t, c_date)), 'a' in (ifnull(c_enum_t, c_date)), c_enum_t+1-1, c_enum_t from test_enum1;
ifnull(c_enum_t, c_date)	1 in (ifnull(c_enum_t, c_date))	'a' in (ifnull(c_enum_t, c_date))	c_enum_t+1-1	c_enum_t
c	0	0	3	c
select ifnull(c_enum_t, c_time), 1 in (ifnull(c_enum_t, c_time)), 'a' in (ifnull(c_enum_t, c_time)), c_enum_t+1-1, c_enum_t from test_enum1;
ifnull(c_enum_t, c_time)	1 in (ifnull(c_enum_t, c_time))	'a' in (ifnull(c_enum_t, c_time))	c_enum_t+1-1	c_enum_t
c	0	0	3	c
select ifnull(c_enum_t, c_year), 1 in (ifnull(c_enum_t, c_year)), 'a' in (ifnull(c_enum_t, c_year)), c_enum_t+1-1, c_enum_t from test_enum1;
ifnull(c_enum_t, c_year)	1 in (ifnull(c_enum_t, c_year))	'a' in (ifnull(c_enum_t, c_year))	c_enum_t+1-1	c_enum_t
c	0	0	3	c
select ifnull(c_enum_t, c_varchar), 1 in (ifnull(c_enum_t, c_varchar)), 'a' in (ifnull(c_enum_t, c_varchar)), c_enum_t+1-1, c_enum_t from test_enum1;
ifnull(c_enum_t, c_varchar)	1 in (ifnull(c_enum_t, c_varchar))	'a' in (ifnull(c_enum_t, c_varchar))	c_enum_t+1-1	c_enum_t
c	0	0	3	c
select ifnull(c_enum_t, c_char), 1 in (ifnull(c_enum_t, c_char)), 'a' in (ifnull(c_enum_t, c_char)), c_enum_t+1-1, c_enum_t from test_enum1;
ifnull(c_enum_t, c_char)	1 in (ifnull(c_enum_t, c_char))	'a' in (ifnull(c_enum_t, c_char))	c_enum_t+1-1	c_enum_t
c	0	0	3	c
select ifnull(c_enum_t, c_bit), 1 in (ifnull(c_enum_t, c_bit)), 'a' in (ifnull(c_enum_t, c_bit)), c_enum_t+1-1, c_enum_t from test_enum1;
ifnull(c_enum_t, c_bit)	1 in (ifnull(c_enum_t, c_bit))	'a' in (ifnull(c_enum_t, c_bit))	c_enum_t+1-1	c_enum_t
c	0	0	3	c
select ifnull(c_enum_t, c_enum), 1 in (ifnull(c_enum_t, c_enum)), 'a' in (ifnull(c_enum_t, c_enum)), c_enum+1-1, c_enum from test_enum1;
ifnull(c_enum_t, c_enum)	1 in (ifnull(c_enum_t, c_enum))	'a' in (ifnull(c_enum_t, c_enum))	c_enum+1-1	c_enum
c	0	0	1	a
select ifnull(c_enum_t, c_set), 1 in (ifnull(c_enum_t, c_set)), 'a' in (ifnull(c_enum_t, c_set)), c_enum_t+1-1, c_enum_t from test_enum1;
ifnull(c_enum_t, c_set)	1 in (ifnull(c_enum_t, c_set))	'a' in (ifnull(c_enum_t, c_set))	c_enum_t+1-1	c_enum_t
c	0	0	3	c
create table test_set1(c_tinyint tinyint, c_smallint smallint, c_mint mediumint, c_int int, c_bigint bigint, c_utinyint tinyint unsigned, c_usmallint smallint  unsigned, c_umint mediumint unsigned, c_uint int unsigned, c_ubigint bigint unsigned, c_float float, c_double double, c_ufloat float unsigned, c_udouble double unsigned, c_dec decimal, c_udec decimal unsigned, c_datetime datetime, c_timestamp timestamp default '2016-01-02 00:01:02', c_date date, c_time time, c_year year, c_varchar varchar(16), c_char char(16), /*c_tinytext tinytext, c_text text, c_mtext mediumtext, c_ltext longtext,*/ c_bit bit(16), c_enum enum('a', 'b', 'c'), c_set set('a', 'b', 'c'), c_set_t set('a', 'b', 'c'));
insert into test_set1 (c_set_t) value(1);
select * from test_set1;
c_tinyint	c_smallint	c_mint	c_int	c_bigint	c_utinyint	c_usmallint	c_umint	c_uint	c_ubigint	c_float	c_double	c_ufloat	c_udouble	c_dec	c_udec	c_datetime	c_timestamp	c_date	c_time	c_year	c_varchar	c_char	c_bit	c_enum	c_set	c_set_t
NULL	NULL	NULL	NULL	NULL	NULL	NULL	NULL	NULL	NULL	NULL	NULL	NULL	NULL	NULL	NULL	NULL	2016-01-02 00:01:02	NULL	NULL	NULL	NULL	NULL	NULL	NULL	NULL	a
select ifnull(null, c_set_t), 1 in (ifnull(null, c_set_t)), 'a' in (ifnull(null, c_set_t)), c_set_t+1-1, c_set_t from test_set1;
ifnull(null, c_set_t)	1 in (ifnull(null, c_set_t))	'a' in (ifnull(null, c_set_t))	c_set_t+1-1	c_set_t
a	0	1	1	a
select ifnull(c_tinyint, c_set_t), 1 in (ifnull(c_tinyint, c_set_t)), 'a' in (ifnull(c_tinyint, c_set_t)), c_set_t+1-1, c_set_t from test_set1;
ifnull(c_tinyint, c_set_t)	1 in (ifnull(c_tinyint, c_set_t))	'a' in (ifnull(c_tinyint, c_set_t))	c_set_t+1-1	c_set_t
a	0	1	1	a
select ifnull(c_smallint, c_set_t), 1 in (ifnull(c_smallint, c_set_t)), 'a' in (ifnull(c_smallint, c_set_t)), c_set_t+1-1, c_set_t from test_set1;
ifnull(c_smallint, c_set_t)	1 in (ifnull(c_smallint, c_set_t))	'a' in (ifnull(c_smallint, c_set_t))	c_set_t+1-1	c_set_t
a	0	1	1	a
select ifnull(c_mint, c_set_t), 1 in (ifnull(c_mint, c_set_t)), 'a' in (ifnull(c_mint, c_set_t)), c_set_t+1-1, c_set_t from test_set1;
ifnull(c_mint, c_set_t)	1 in (ifnull(c_mint, c_set_t))	'a' in (ifnull(c_mint, c_set_t))	c_set_t+1-1	c_set_t
a	0	1	1	a
select ifnull(c_int, c_set_t), 1 in (ifnull(c_int, c_set_t)), 'a' in (ifnull(c_int, c_set_t)), c_set_t+1-1, c_set_t from test_set1;
ifnull(c_int, c_set_t)	1 in (ifnull(c_int, c_set_t))	'a' in (ifnull(c_int, c_set_t))	c_set_t+1-1	c_set_t
a	0	1	1	a
select ifnull(c_bigint, c_set_t), 1 in (ifnull(c_bigint, c_set_t)), 'a' in (ifnull(c_bigint, c_set_t)), c_set_t+1-1, c_set_t from test_set1;
ifnull(c_bigint, c_set_t)	1 in (ifnull(c_bigint, c_set_t))	'a' in (ifnull(c_bigint, c_set_t))	c_set_t+1-1	c_set_t
a	0	1	1	a
select ifnull(c_utinyint, c_set_t), 1 in (ifnull(c_utinyint, c_set_t)), 'a' in (ifnull(c_utinyint, c_set_t)), c_set_t+1-1, c_set_t from test_set1;
ifnull(c_utinyint, c_set_t)	1 in (ifnull(c_utinyint, c_set_t))	'a' in (ifnull(c_utinyint, c_set_t))	c_set_t+1-1	c_set_t
a	0	1	1	a
select ifnull(c_usmallint, c_set_t), 1 in (ifnull(c_usmallint, c_set_t)), 'a' in (ifnull(c_usmallint, c_set_t)), c_set_t+1-1, c_set_t from test_set1;
ifnull(c_usmallint, c_set_t)	1 in (ifnull(c_usmallint, c_set_t))	'a' in (ifnull(c_usmallint, c_set_t))	c_set_t+1-1	c_set_t
a	0	1	1	a
select ifnull(c_umint, c_set_t), 1 in (ifnull(c_umint, c_set_t)), 'a' in (ifnull(c_umint, c_set_t)), c_set_t+1-1, c_set_t from test_set1;
ifnull(c_umint, c_set_t)	1 in (ifnull(c_umint, c_set_t))	'a' in (ifnull(c_umint, c_set_t))	c_set_t+1-1	c_set_t
a	0	1	1	a
select ifnull(c_uint, c_set_t), 1 in (ifnull(c_uint, c_set_t)), 'a' in (ifnull(c_uint, c_set_t)), c_set_t+1-1, c_set_t from test_set1;
ifnull(c_uint, c_set_t)	1 in (ifnull(c_uint, c_set_t))	'a' in (ifnull(c_uint, c_set_t))	c_set_t+1-1	c_set_t
a	0	1	1	a
select ifnull(c_ubigint, c_set_t), 1 in (ifnull(c_ubigint, c_set_t)), 'a' in (ifnull(c_ubigint, c_set_t)), c_set_t+1-1, c_set_t from test_set1;
ifnull(c_ubigint, c_set_t)	1 in (ifnull(c_ubigint, c_set_t))	'a' in (ifnull(c_ubigint, c_set_t))	c_set_t+1-1	c_set_t
a	0	1	1	a
select ifnull(c_float, c_set_t), 1 in (ifnull(c_float, c_set_t)), 'a' in (ifnull(c_float, c_set_t)), c_set_t+1-1, c_set_t from test_set1;
ifnull(c_float, c_set_t)	1 in (ifnull(c_float, c_set_t))	'a' in (ifnull(c_float, c_set_t))	c_set_t+1-1	c_set_t
a	0	1	1	a
select ifnull(c_double, c_set_t), 1 in (ifnull(c_double, c_set_t)), 'a' in (ifnull(c_double, c_set_t)), c_set_t+1-1, c_set_t from test_set1;
ifnull(c_double, c_set_t)	1 in (ifnull(c_double, c_set_t))	'a' in (ifnull(c_double, c_set_t))	c_set_t+1-1	c_set_t
a	0	1	1	a
select ifnull(c_ufloat, c_set_t), 1 in (ifnull(c_ufloat, c_set_t)), 'a' in (ifnull(c_ufloat, c_set_t)), c_set_t+1-1, c_set_t from test_set1;
ifnull(c_ufloat, c_set_t)	1 in (ifnull(c_ufloat, c_set_t))	'a' in (ifnull(c_ufloat, c_set_t))	c_set_t+1-1	c_set_t
a	0	1	1	a
select ifnull(c_udouble, c_set_t), 1 in (ifnull(c_udouble, c_set_t)), 'a' in (ifnull(c_udouble, c_set_t)), c_set_t+1-1, c_set_t from test_set1;
ifnull(c_udouble, c_set_t)	1 in (ifnull(c_udouble, c_set_t))	'a' in (ifnull(c_udouble, c_set_t))	c_set_t+1-1	c_set_t
a	0	1	1	a
select ifnull(c_dec, c_set_t), 1 in (ifnull(c_dec, c_set_t)), 'a' in (ifnull(c_dec, c_set_t)), c_set_t+1-1, c_set_t from test_set1;
ifnull(c_dec, c_set_t)	1 in (ifnull(c_dec, c_set_t))	'a' in (ifnull(c_dec, c_set_t))	c_set_t+1-1	c_set_t
a	0	1	1	a
select ifnull(c_udec, c_set_t), 1 in (ifnull(c_udec, c_set_t)), 'a' in (ifnull(c_udec, c_set_t)), c_set_t+1-1, c_set_t from test_set1;
ifnull(c_udec, c_set_t)	1 in (ifnull(c_udec, c_set_t))	'a' in (ifnull(c_udec, c_set_t))	c_set_t+1-1	c_set_t
a	0	1	1	a
select ifnull(c_datetime, c_set_t), 1 in (ifnull(c_datetime, c_set_t)), 'a' in (ifnull(c_datetime, c_set_t)), c_set_t+1-1, c_set_t from test_set1;
ifnull(c_datetime, c_set_t)	1 in (ifnull(c_datetime, c_set_t))	'a' in (ifnull(c_datetime, c_set_t))	c_set_t+1-1	c_set_t
a	0	1	1	a
select ifnull(c_timestamp, c_set_t), 1 in (ifnull(c_timestamp, c_set_t)), 'a' in (ifnull(c_timestamp, c_set_t)), c_set_t+1-1, c_set_t from test_set1;
ifnull(c_timestamp, c_set_t)	1 in (ifnull(c_timestamp, c_set_t))	'a' in (ifnull(c_timestamp, c_set_t))	c_set_t+1-1	c_set_t
2016-01-02 00:01:02	0	0	1	a
select ifnull(c_date, c_set_t), 1 in (ifnull(c_date, c_set_t)), 'a' in (ifnull(c_date, c_set_t)), c_set_t+1-1, c_set_t from test_set1;
ifnull(c_date, c_set_t)	1 in (ifnull(c_date, c_set_t))	'a' in (ifnull(c_date, c_set_t))	c_set_t+1-1	c_set_t
a	0	1	1	a
select ifnull(c_time, c_set_t), 1 in (ifnull(c_time, c_set_t)), 'a' in (ifnull(c_time, c_set_t)), c_set_t+1-1, c_set_t from test_set1;
ifnull(c_time, c_set_t)	1 in (ifnull(c_time, c_set_t))	'a' in (ifnull(c_time, c_set_t))	c_set_t+1-1	c_set_t
a	0	1	1	a
select ifnull(c_year, c_set_t), 1 in (ifnull(c_year, c_set_t)), 'a' in (ifnull(c_year, c_set_t)), c_set_t+1-1, c_set_t from test_set1;
ifnull(c_year, c_set_t)	1 in (ifnull(c_year, c_set_t))	'a' in (ifnull(c_year, c_set_t))	c_set_t+1-1	c_set_t
a	0	1	1	a
select ifnull(c_varchar, c_set_t), 1 in (ifnull(c_varchar, c_set_t)), 'a' in (ifnull(c_varchar, c_set_t)), c_set_t+1-1, c_set_t from test_set1;
ifnull(c_varchar, c_set_t)	1 in (ifnull(c_varchar, c_set_t))	'a' in (ifnull(c_varchar, c_set_t))	c_set_t+1-1	c_set_t
a	0	1	1	a
select ifnull(c_char, c_set_t), 1 in (ifnull(c_char, c_set_t)), 'a' in (ifnull(c_char, c_set_t)), c_set_t+1-1, c_set_t from test_set1;
ifnull(c_char, c_set_t)	1 in (ifnull(c_char, c_set_t))	'a' in (ifnull(c_char, c_set_t))	c_set_t+1-1	c_set_t
a	0	1	1	a
select ifnull(c_bit, c_set_t), 1 in (ifnull(c_bit, c_set_t)), 'a' in (ifnull(c_bit, c_set_t)), c_set_t+1-1, c_set_t from test_set1;
ifnull(c_bit, c_set_t)	1 in (ifnull(c_bit, c_set_t))	'a' in (ifnull(c_bit, c_set_t))	c_set_t+1-1	c_set_t
a	0	1	1	a
select ifnull(c_enum, c_set_t), 1 in (ifnull(c_enum, c_set_t)), 'a' in (ifnull(c_enum, c_set_t)), c_enum+1-1, c_enum from test_set1;
ifnull(c_enum, c_set_t)	1 in (ifnull(c_enum, c_set_t))	'a' in (ifnull(c_enum, c_set_t))	c_enum+1-1	c_enum
a	0	1	NULL	NULL
select ifnull(c_set, c_set_t), 1 in (ifnull(c_set, c_set_t)), 'a' in (ifnull(c_set, c_set_t)), c_set_t+1-1, c_set_t from test_set1;
ifnull(c_set, c_set_t)	1 in (ifnull(c_set, c_set_t))	'a' in (ifnull(c_set, c_set_t))	c_set_t+1-1	c_set_t
a	0	1	1	a
delete from test_set1 where c_set_t='a';
insert into test_set1 value(-1, -1, -1, -1, -1,1,1,1,1,1, 1.0,1.0, 2.0,2.0, 3.0,3.0, "2016-01-01 00:01:02", "2016-01-02 00:01:02", "1999-01-01", "02:02:02", "1901", "varchar", "aaa", /*"tinytext", "text", "mtext", "longtext",*/ 0x43, 1, 2, 4);
select ifnull(null, c_set_t), 1 in (ifnull(null, c_set_t)), 'a' in (ifnull(null, c_set_t)), c_set_t+1-1, c_set_t from test_set1;
ifnull(null, c_set_t)	1 in (ifnull(null, c_set_t))	'a' in (ifnull(null, c_set_t))	c_set_t+1-1	c_set_t
c	0	0	4	c
select ifnull(c_tinyint, c_set_t), 1 in (ifnull(c_tinyint, c_set_t)), 'a' in (ifnull(c_tinyint, c_set_t)), c_set_t+1-1, c_set_t from test_set1;
ifnull(c_tinyint, c_set_t)	1 in (ifnull(c_tinyint, c_set_t))	'a' in (ifnull(c_tinyint, c_set_t))	c_set_t+1-1	c_set_t
-1	0	0	4	c
select ifnull(c_smallint, c_set_t), 1 in (ifnull(c_smallint, c_set_t)), 'a' in (ifnull(c_smallint, c_set_t)), c_set_t+1-1, c_set_t from test_set1;
ifnull(c_smallint, c_set_t)	1 in (ifnull(c_smallint, c_set_t))	'a' in (ifnull(c_smallint, c_set_t))	c_set_t+1-1	c_set_t
-1	0	0	4	c
select ifnull(c_mint, c_set_t), 1 in (ifnull(c_mint, c_set_t)), 'a' in (ifnull(c_mint, c_set_t)), c_set_t+1-1, c_set_t from test_set1;
ifnull(c_mint, c_set_t)	1 in (ifnull(c_mint, c_set_t))	'a' in (ifnull(c_mint, c_set_t))	c_set_t+1-1	c_set_t
-1	0	0	4	c
select ifnull(c_int, c_set_t), 1 in (ifnull(c_int, c_set_t)), 'a' in (ifnull(c_int, c_set_t)), c_set_t+1-1, c_set_t from test_set1;
ifnull(c_int, c_set_t)	1 in (ifnull(c_int, c_set_t))	'a' in (ifnull(c_int, c_set_t))	c_set_t+1-1	c_set_t
-1	0	0	4	c
select ifnull(c_bigint, c_set_t), 1 in (ifnull(c_bigint, c_set_t)), 'a' in (ifnull(c_bigint, c_set_t)), c_set_t+1-1, c_set_t from test_set1;
ifnull(c_bigint, c_set_t)	1 in (ifnull(c_bigint, c_set_t))	'a' in (ifnull(c_bigint, c_set_t))	c_set_t+1-1	c_set_t
-1	0	0	4	c
select ifnull(c_utinyint, c_set_t), 1 in (ifnull(c_utinyint, c_set_t)), 'a' in (ifnull(c_utinyint, c_set_t)), c_set_t+1-1, c_set_t from test_set1;
ifnull(c_utinyint, c_set_t)	1 in (ifnull(c_utinyint, c_set_t))	'a' in (ifnull(c_utinyint, c_set_t))	c_set_t+1-1	c_set_t
1	1	0	4	c
select ifnull(c_usmallint, c_set_t), 1 in (ifnull(c_usmallint, c_set_t)), 'a' in (ifnull(c_usmallint, c_set_t)), c_set_t+1-1, c_set_t from test_set1;
ifnull(c_usmallint, c_set_t)	1 in (ifnull(c_usmallint, c_set_t))	'a' in (ifnull(c_usmallint, c_set_t))	c_set_t+1-1	c_set_t
1	1	0	4	c
select ifnull(c_umint, c_set_t), 1 in (ifnull(c_umint, c_set_t)), 'a' in (ifnull(c_umint, c_set_t)), c_set_t+1-1, c_set_t from test_set1;
ifnull(c_umint, c_set_t)	1 in (ifnull(c_umint, c_set_t))	'a' in (ifnull(c_umint, c_set_t))	c_set_t+1-1	c_set_t
1	1	0	4	c
select ifnull(c_uint, c_set_t), 1 in (ifnull(c_uint, c_set_t)), 'a' in (ifnull(c_uint, c_set_t)), c_set_t+1-1, c_set_t from test_set1;
ifnull(c_uint, c_set_t)	1 in (ifnull(c_uint, c_set_t))	'a' in (ifnull(c_uint, c_set_t))	c_set_t+1-1	c_set_t
1	1	0	4	c
select ifnull(c_ubigint, c_set_t), 1 in (ifnull(c_ubigint, c_set_t)), 'a' in (ifnull(c_ubigint, c_set_t)), c_set_t+1-1, c_set_t from test_set1;
ifnull(c_ubigint, c_set_t)	1 in (ifnull(c_ubigint, c_set_t))	'a' in (ifnull(c_ubigint, c_set_t))	c_set_t+1-1	c_set_t
1	1	0	4	c
select ifnull(c_float, c_set_t), 1 in (ifnull(c_float, c_set_t)), 'a' in (ifnull(c_float, c_set_t)), c_set_t+1-1, c_set_t from test_set1;
ifnull(c_float, c_set_t)	1 in (ifnull(c_float, c_set_t))	'a' in (ifnull(c_float, c_set_t))	c_set_t+1-1	c_set_t
1	1	0	4	c
select ifnull(c_double, c_set_t), 1 in (ifnull(c_double, c_set_t)), 'a' in (ifnull(c_double, c_set_t)), c_set_t+1-1, c_set_t from test_set1;
ifnull(c_double, c_set_t)	1 in (ifnull(c_double, c_set_t))	'a' in (ifnull(c_double, c_set_t))	c_set_t+1-1	c_set_t
1	1	0	4	c
select ifnull(c_ufloat, c_set_t), 1 in (ifnull(c_ufloat, c_set_t)), 'a' in (ifnull(c_ufloat, c_set_t)), c_set_t+1-1, c_set_t from test_set1;
ifnull(c_ufloat, c_set_t)	1 in (ifnull(c_ufloat, c_set_t))	'a' in (ifnull(c_ufloat, c_set_t))	c_set_t+1-1	c_set_t
2	0	0	4	c
select ifnull(c_udouble, c_set_t), 1 in (ifnull(c_udouble, c_set_t)), 'a' in (ifnull(c_udouble, c_set_t)), c_set_t+1-1, c_set_t from test_set1;
ifnull(c_udouble, c_set_t)	1 in (ifnull(c_udouble, c_set_t))	'a' in (ifnull(c_udouble, c_set_t))	c_set_t+1-1	c_set_t
2	0	0	4	c
select ifnull(c_dec, c_set_t), 1 in (ifnull(c_dec, c_set_t)), 'a' in (ifnull(c_dec, c_set_t)), c_set_t+1-1, c_set_t from test_set1;
ifnull(c_dec, c_set_t)	1 in (ifnull(c_dec, c_set_t))	'a' in (ifnull(c_dec, c_set_t))	c_set_t+1-1	c_set_t
3	0	0	4	c
select ifnull(c_udec, c_set_t), 1 in (ifnull(c_udec, c_set_t)), 'a' in (ifnull(c_udec, c_set_t)), c_set_t+1-1, c_set_t from test_set1;
ifnull(c_udec, c_set_t)	1 in (ifnull(c_udec, c_set_t))	'a' in (ifnull(c_udec, c_set_t))	c_set_t+1-1	c_set_t
3	0	0	4	c
select ifnull(c_datetime, c_set_t), 1 in (ifnull(c_datetime, c_set_t)), 'a' in (ifnull(c_datetime, c_set_t)), c_set_t+1-1, c_set_t from test_set1;
ifnull(c_datetime, c_set_t)	1 in (ifnull(c_datetime, c_set_t))	'a' in (ifnull(c_datetime, c_set_t))	c_set_t+1-1	c_set_t
2016-01-01 00:01:02	0	0	4	c
select ifnull(c_timestamp, c_set_t), 1 in (ifnull(c_timestamp, c_set_t)), 'a' in (ifnull(c_timestamp, c_set_t)), c_set_t+1-1, c_set_t from test_set1;
ifnull(c_timestamp, c_set_t)	1 in (ifnull(c_timestamp, c_set_t))	'a' in (ifnull(c_timestamp, c_set_t))	c_set_t+1-1	c_set_t
2016-01-02 00:01:02	0	0	4	c
select ifnull(c_date, c_set_t), 1 in (ifnull(c_date, c_set_t)), 'a' in (ifnull(c_date, c_set_t)), c_set_t+1-1, c_set_t from test_set1;
ifnull(c_date, c_set_t)	1 in (ifnull(c_date, c_set_t))	'a' in (ifnull(c_date, c_set_t))	c_set_t+1-1	c_set_t
1999-01-01	0	0	4	c
select ifnull(c_time, c_set_t), 1 in (ifnull(c_time, c_set_t)), 'a' in (ifnull(c_time, c_set_t)), c_set_t+1-1, c_set_t from test_set1;
ifnull(c_time, c_set_t)	1 in (ifnull(c_time, c_set_t))	'a' in (ifnull(c_time, c_set_t))	c_set_t+1-1	c_set_t
02:02:02	0	0	4	c
select ifnull(c_year, c_set_t), 1 in (ifnull(c_year, c_set_t)), 'a' in (ifnull(c_year, c_set_t)), c_set_t+1-1, c_set_t from test_set1;
ifnull(c_year, c_set_t)	1 in (ifnull(c_year, c_set_t))	'a' in (ifnull(c_year, c_set_t))	c_set_t+1-1	c_set_t
1901	0	0	4	c
select ifnull(c_varchar, c_set_t), 1 in (ifnull(c_varchar, c_set_t)), 'a' in (ifnull(c_varchar, c_set_t)), c_set_t+1-1, c_set_t from test_set1;
ifnull(c_varchar, c_set_t)	1 in (ifnull(c_varchar, c_set_t))	'a' in (ifnull(c_varchar, c_set_t))	c_set_t+1-1	c_set_t
varchar	0	0	4	c
select ifnull(c_char, c_set_t), 1 in (ifnull(c_char, c_set_t)), 'a' in (ifnull(c_char, c_set_t)), c_set_t+1-1, c_set_t from test_set1;
ifnull(c_char, c_set_t)	1 in (ifnull(c_char, c_set_t))	'a' in (ifnull(c_char, c_set_t))	c_set_t+1-1	c_set_t
aaa	0	0	4	c
select ifnull(c_bit, c_set_t), 1 in (ifnull(c_bit, c_set_t)), 'a' in (ifnull(c_bit, c_set_t)), c_set_t+1-1, c_set_t from test_set1;
ifnull(c_bit, c_set_t)	1 in (ifnull(c_bit, c_set_t))	'a' in (ifnull(c_bit, c_set_t))	c_set_t+1-1	c_set_t
 C	0	0	4	c
select ifnull(c_enum, c_set_t), 1 in (ifnull(c_enum, c_set_t)), 'a' in (ifnull(c_enum, c_set_t)), c_enum+1-1, c_enum from test_set1;
ifnull(c_enum, c_set_t)	1 in (ifnull(c_enum, c_set_t))	'a' in (ifnull(c_enum, c_set_t))	c_enum+1-1	c_enum
a	0	1	1	a
select ifnull(c_set, c_set_t), 1 in (ifnull(c_set, c_set_t)), 'a' in (ifnull(c_set, c_set_t)), c_set_t+1-1, c_set_t from test_set1;
ifnull(c_set, c_set_t)	1 in (ifnull(c_set, c_set_t))	'a' in (ifnull(c_set, c_set_t))	c_set_t+1-1	c_set_t
b	0	0	4	c
select ifnull(c_set_t, null), 1 in (ifnull(c_set_t, null)), 'a' in (ifnull(c_set_t, null)), c_set_t+1-1, c_set_t from test_set1;
ifnull(c_set_t, null)	1 in (ifnull(c_set_t, null))	'a' in (ifnull(c_set_t, null))	c_set_t+1-1	c_set_t
c	0	0	4	c
select ifnull(c_set_t, c_tinyint), 1 in (ifnull(c_set_t, c_tinyint)), 'a' in (ifnull(c_set_t, c_tinyint)), c_set_t+1-1, c_set_t from test_set1;
ifnull(c_set_t, c_tinyint)	1 in (ifnull(c_set_t, c_tinyint))	'a' in (ifnull(c_set_t, c_tinyint))	c_set_t+1-1	c_set_t
c	0	0	4	c
select ifnull(c_set_t, c_smallint), 1 in (ifnull(c_set_t, c_smallint)), 'a' in (ifnull(c_set_t, c_smallint)), c_set_t+1-1, c_set_t from test_set1;
ifnull(c_set_t, c_smallint)	1 in (ifnull(c_set_t, c_smallint))	'a' in (ifnull(c_set_t, c_smallint))	c_set_t+1-1	c_set_t
c	0	0	4	c
select ifnull(c_set_t, c_mint), 1 in (ifnull(c_set_t, c_mint)), 'a' in (ifnull(c_set_t, c_mint)), c_set_t+1-1, c_set_t from test_set1;
ifnull(c_set_t, c_mint)	1 in (ifnull(c_set_t, c_mint))	'a' in (ifnull(c_set_t, c_mint))	c_set_t+1-1	c_set_t
c	0	0	4	c
select ifnull(c_set_t, c_int), 1 in (ifnull(c_set_t, c_int)), 'a' in (ifnull(c_set_t, c_int)), c_set_t+1-1, c_set_t from test_set1;
ifnull(c_set_t, c_int)	1 in (ifnull(c_set_t, c_int))	'a' in (ifnull(c_set_t, c_int))	c_set_t+1-1	c_set_t
c	0	0	4	c
select ifnull(c_set_t, c_bigint), 1 in (ifnull(c_set_t, c_bigint)), 'a' in (ifnull(c_set_t, c_bigint)), c_set_t+1-1, c_set_t from test_set1;
ifnull(c_set_t, c_bigint)	1 in (ifnull(c_set_t, c_bigint))	'a' in (ifnull(c_set_t, c_bigint))	c_set_t+1-1	c_set_t
c	0	0	4	c
select ifnull(c_set_t, c_utinyint), 1 in (ifnull(c_set_t, c_utinyint)), 'a' in (ifnull(c_set_t, c_utinyint)), c_set_t+1-1, c_set_t from test_set1;
ifnull(c_set_t, c_utinyint)	1 in (ifnull(c_set_t, c_utinyint))	'a' in (ifnull(c_set_t, c_utinyint))	c_set_t+1-1	c_set_t
c	0	0	4	c
select ifnull(c_set_t, c_usmallint), 1 in (ifnull(c_set_t, c_usmallint)), 'a' in (ifnull(c_set_t, c_usmallint)), c_set_t+1-1, c_set_t from test_set1;
ifnull(c_set_t, c_usmallint)	1 in (ifnull(c_set_t, c_usmallint))	'a' in (ifnull(c_set_t, c_usmallint))	c_set_t+1-1	c_set_t
c	0	0	4	c
select ifnull(c_set_t, c_umint), 1 in (ifnull(c_set_t, c_umint)), 'a' in (ifnull(c_set_t, c_umint)), c_set_t+1-1, c_set_t from test_set1;
ifnull(c_set_t, c_umint)	1 in (ifnull(c_set_t, c_umint))	'a' in (ifnull(c_set_t, c_umint))	c_set_t+1-1	c_set_t
c	0	0	4	c
select ifnull(c_set_t, c_uint), 1 in (ifnull(c_set_t, c_uint)), 'a' in (ifnull(c_set_t, c_uint)), c_set_t+1-1, c_set_t from test_set1;
ifnull(c_set_t, c_uint)	1 in (ifnull(c_set_t, c_uint))	'a' in (ifnull(c_set_t, c_uint))	c_set_t+1-1	c_set_t
c	0	0	4	c
select ifnull(c_set_t, c_ubigint), 1 in (ifnull(c_set_t, c_ubigint)), 'a' in (ifnull(c_set_t, c_ubigint)), c_set_t+1-1, c_set_t from test_set1;
ifnull(c_set_t, c_ubigint)	1 in (ifnull(c_set_t, c_ubigint))	'a' in (ifnull(c_set_t, c_ubigint))	c_set_t+1-1	c_set_t
c	0	0	4	c
select ifnull(c_set_t, c_float), 1 in (ifnull(c_set_t, c_float)), 'a' in (ifnull(c_set_t, c_float)), c_set_t+1-1, c_set_t from test_set1;
ifnull(c_set_t, c_float)	1 in (ifnull(c_set_t, c_float))	'a' in (ifnull(c_set_t, c_float))	c_set_t+1-1	c_set_t
c	0	0	4	c
select ifnull(c_set_t, c_double), 1 in (ifnull(c_set_t, c_double)), 'a' in (ifnull(c_set_t, c_double)), c_set_t+1-1, c_set_t from test_set1;
ifnull(c_set_t, c_double)	1 in (ifnull(c_set_t, c_double))	'a' in (ifnull(c_set_t, c_double))	c_set_t+1-1	c_set_t
c	0	0	4	c
select ifnull(c_set_t, c_ufloat), 1 in (ifnull(c_set_t, c_ufloat)), 'a' in (ifnull(c_set_t, c_ufloat)), c_set_t+1-1, c_set_t from test_set1;
ifnull(c_set_t, c_ufloat)	1 in (ifnull(c_set_t, c_ufloat))	'a' in (ifnull(c_set_t, c_ufloat))	c_set_t+1-1	c_set_t
c	0	0	4	c
select ifnull(c_set_t, c_udouble), 1 in (ifnull(c_set_t, c_udouble)), 'a' in (ifnull(c_set_t, c_udouble)), c_set_t+1-1, c_set_t from test_set1;
ifnull(c_set_t, c_udouble)	1 in (ifnull(c_set_t, c_udouble))	'a' in (ifnull(c_set_t, c_udouble))	c_set_t+1-1	c_set_t
c	0	0	4	c
select ifnull(c_set_t, c_dec), 1 in (ifnull(c_set_t, c_dec)), 'a' in (ifnull(c_set_t, c_dec)), c_set_t+1-1, c_set_t from test_set1;
ifnull(c_set_t, c_dec)	1 in (ifnull(c_set_t, c_dec))	'a' in (ifnull(c_set_t, c_dec))	c_set_t+1-1	c_set_t
c	0	0	4	c
select ifnull(c_set_t, c_udec), 1 in (ifnull(c_set_t, c_udec)), 'a' in (ifnull(c_set_t, c_udec)), c_set_t+1-1, c_set_t from test_set1;
ifnull(c_set_t, c_udec)	1 in (ifnull(c_set_t, c_udec))	'a' in (ifnull(c_set_t, c_udec))	c_set_t+1-1	c_set_t
c	0	0	4	c
select ifnull(c_set_t, c_datetime), 1 in (ifnull(c_set_t, c_datetime)), 'a' in (ifnull(c_set_t, c_datetime)), c_set_t+1-1, c_set_t from test_set1;
ifnull(c_set_t, c_datetime)	1 in (ifnull(c_set_t, c_datetime))	'a' in (ifnull(c_set_t, c_datetime))	c_set_t+1-1	c_set_t
c	0	0	4	c
select ifnull(c_set_t, c_timestamp), 1 in (ifnull(c_set_t, c_timestamp)), 'a' in (ifnull(c_set_t, c_timestamp)), c_set_t+1-1, c_set_t from test_set1;
ifnull(c_set_t, c_timestamp)	1 in (ifnull(c_set_t, c_timestamp))	'a' in (ifnull(c_set_t, c_timestamp))	c_set_t+1-1	c_set_t
c	0	0	4	c
select ifnull(c_set_t, c_date), 1 in (ifnull(c_set_t, c_date)), 'a' in (ifnull(c_set_t, c_date)), c_set_t+1-1, c_set_t from test_set1;
ifnull(c_set_t, c_date)	1 in (ifnull(c_set_t, c_date))	'a' in (ifnull(c_set_t, c_date))	c_set_t+1-1	c_set_t
c	0	0	4	c
select ifnull(c_set_t, c_time), 1 in (ifnull(c_set_t, c_time)), 'a' in (ifnull(c_set_t, c_time)), c_set_t+1-1, c_set_t from test_set1;
ifnull(c_set_t, c_time)	1 in (ifnull(c_set_t, c_time))	'a' in (ifnull(c_set_t, c_time))	c_set_t+1-1	c_set_t
c	0	0	4	c
select ifnull(c_set_t, c_year), 1 in (ifnull(c_set_t, c_year)), 'a' in (ifnull(c_set_t, c_year)), c_set_t+1-1, c_set_t from test_set1;
ifnull(c_set_t, c_year)	1 in (ifnull(c_set_t, c_year))	'a' in (ifnull(c_set_t, c_year))	c_set_t+1-1	c_set_t
c	0	0	4	c
select ifnull(c_set_t, c_varchar), 1 in (ifnull(c_set_t, c_varchar)), 'a' in (ifnull(c_set_t, c_varchar)), c_set_t+1-1, c_set_t from test_set1;
ifnull(c_set_t, c_varchar)	1 in (ifnull(c_set_t, c_varchar))	'a' in (ifnull(c_set_t, c_varchar))	c_set_t+1-1	c_set_t
c	0	0	4	c
select ifnull(c_set_t, c_char), 1 in (ifnull(c_set_t, c_char)), 'a' in (ifnull(c_set_t, c_char)), c_set_t+1-1, c_set_t from test_set1;
ifnull(c_set_t, c_char)	1 in (ifnull(c_set_t, c_char))	'a' in (ifnull(c_set_t, c_char))	c_set_t+1-1	c_set_t
c	0	0	4	c
select ifnull(c_set_t, c_bit), 1 in (ifnull(c_set_t, c_bit)), 'a' in (ifnull(c_set_t, c_bit)), c_set_t+1-1, c_set_t from test_set1;
ifnull(c_set_t, c_bit)	1 in (ifnull(c_set_t, c_bit))	'a' in (ifnull(c_set_t, c_bit))	c_set_t+1-1	c_set_t
c	0	0	4	c
select ifnull(c_set_t, c_enum), 1 in (ifnull(c_set_t, c_enum)), 'a' in (ifnull(c_set_t, c_enum)), c_enum+1-1, c_enum from test_set1;
ifnull(c_set_t, c_enum)	1 in (ifnull(c_set_t, c_enum))	'a' in (ifnull(c_set_t, c_enum))	c_enum+1-1	c_enum
c	0	0	1	a
select ifnull(c_set_t, c_set), 1 in (ifnull(c_set_t, c_set)), 'a' in (ifnull(c_set_t, c_set)), c_set_t+1-1, c_set_t from test_set1;
ifnull(c_set_t, c_set)	1 in (ifnull(c_set_t, c_set))	'a' in (ifnull(c_set_t, c_set))	c_set_t+1-1	c_set_t
c	0	0	4	c
select c_enum_t/null, c_enum_t/c_tinyint, c_enum_t/c_smallint, c_enum_t/c_mint, c_enum_t/c_int, c_enum_t/c_bigint, c_enum_t/c_utinyint, c_enum_t/c_usmallint, c_enum_t/c_umint, c_enum_t/c_uint, c_enum_t/c_ubigint, c_enum_t/c_float, c_enum_t/c_double, c_enum_t/c_ufloat, c_enum_t/c_udouble, c_enum_t/c_dec, c_enum_t/c_udec, c_enum_t/c_datetime, c_enum_t/c_timestamp, c_enum_t/c_date , c_enum_t/c_time, c_enum_t/c_year, c_enum_t/c_varchar, c_enum_t/c_char, /*c_enum_t/c_tinytext, c_enum_t/c_text, c_enum_t/c_mtext, c_enum_t/c_ltext,*/ c_enum_t/c_bit, c_enum_t/c_enum, c_enum_t/c_set from test_enum1;
c_enum_t/null	c_enum_t/c_tinyint	c_enum_t/c_smallint	c_enum_t/c_mint	c_enum_t/c_int	c_enum_t/c_bigint	c_enum_t/c_utinyint	c_enum_t/c_usmallint	c_enum_t/c_umint	c_enum_t/c_uint	c_enum_t/c_ubigint	c_enum_t/c_float	c_enum_t/c_double	c_enum_t/c_ufloat	c_enum_t/c_udouble	c_enum_t/c_dec	c_enum_t/c_udec	c_enum_t/c_datetime	c_enum_t/c_timestamp	c_enum_t/c_date	c_enum_t/c_time	c_enum_t/c_year	c_enum_t/c_varchar	c_enum_t/c_char	c_enum_t/c_bit	c_enum_t/c_enum	c_enum_t/c_set
NULL	-3	-3	-3	-3	-3	3	3	3	3	3	3	3	1.5	1.5	1	1	0.0000000000001488087782886019	0.00000000000014880877090725144	0.000000150074279264522	0.0001485001485001485	0.0015781167806417674	NULL	NULL	0.04477611940298507	3	1.5
select c_set_t/null, c_set_t/c_tinyint, c_set_t/c_smallint, c_set_t/c_mint, c_set_t/c_int, c_set_t/c_bigint, c_set_t/c_utinyint, c_set_t/c_usmallint, c_set_t/c_umint, c_set_t/c_uint, c_set_t/c_ubigint, c_set_t/c_float, c_set_t/c_double, c_set_t/c_ufloat, c_set_t/c_udouble, c_set_t/c_dec, c_set_t/c_udec, c_set_t/c_datetime, c_set_t/c_timestamp, c_set_t/c_date , c_set_t/c_time, c_set_t/c_year, c_set_t/c_varchar, c_set_t/c_char, /*c_set_t/c_tinytext, c_set_t/c_text, c_set_t/c_mtext, c_set_t/c_ltext,*/ c_set_t/c_bit, c_set_t/c_enum, c_set_t/c_set from test_set1;
c_set_t/null	c_set_t/c_tinyint	c_set_t/c_smallint	c_set_t/c_mint	c_set_t/c_int	c_set_t/c_bigint	c_set_t/c_utinyint	c_set_t/c_usmallint	c_set_t/c_umint	c_set_t/c_uint	c_set_t/c_ubigint	c_set_t/c_float	c_set_t/c_double	c_set_t/c_ufloat	c_set_t/c_udouble	c_set_t/c_dec	c_set_t/c_udec	c_set_t/c_datetime	c_set_t/c_timestamp	c_set_t/c_date	c_set_t/c_time	c_set_t/c_year	c_set_t/c_varchar	c_set_t/c_char	c_set_t/c_bit	c_set_t/c_enum	c_set_t/c_set
NULL	-4	-4	-4	-4	-4	4	4	4	4	4	4	4	2	2	1.3333333333333333	1.3333333333333333	0.00000000000019841170438480254	0.0000000000001984116945430019	0.00000020009903901936262	0.000198000198000198	0.0021041557075223566	NULL	NULL	0.05970149253731343	4	2
select null/c_set_t, c_tinyint/c_set_t, c_smallint/c_set_t, c_mint/c_set_t, c_int/c_set_t, c_bigint/c_set_t, c_utinyint/c_set_t, c_usmallint/c_set_t, c_umint/c_set_t, c_uint/c_set_t, c_ubigint/c_set_t, c_float/c_set_t, c_double/c_set_t, c_ufloat/c_set_t, c_udouble/c_set_t, c_dec/c_set_t, c_udec/c_set_t, c_datetime/c_set_t, c_timestamp/c_set_t, c_date /c_set_t, c_time/c_set_t, c_year/c_set_t, c_varchar/c_set_t, c_char/c_set_t, /*c_tinytext/c_set_t, c_text/c_set_t, c_mtext/c_set_t, c_ltext/c_set_t,*/ c_bit/c_set_t, c_enum/c_set_t, c_set/c_set_t from test_set1;
null/c_set_t	c_tinyint/c_set_t	c_smallint/c_set_t	c_mint/c_set_t	c_int/c_set_t	c_bigint/c_set_t	c_utinyint/c_set_t	c_usmallint/c_set_t	c_umint/c_set_t	c_uint/c_set_t	c_ubigint/c_set_t	c_float/c_set_t	c_double/c_set_t	c_ufloat/c_set_t	c_udouble/c_set_t	c_dec/c_set_t	c_udec/c_set_t	c_datetime/c_set_t	c_timestamp/c_set_t	c_date /c_set_t	c_time/c_set_t	c_year/c_set_t	c_varchar/c_set_t	c_char/c_set_t	c_bit/c_set_t	c_enum/c_set_t	c_set/c_set_t
NULL	-0.25	-0.25	-0.25	-0.25	-0.25	0.25	0.25	0.25	0.25	0.25	0.25	0.25	0.5	0.5	0.75	0.75	5040025250025.5	5040025500025.5	4997525.25	5050.5	475.25	0	0	16.75	0.25	0.5
select null/c_enum_t, c_tinyint/c_enum_t, c_smallint/c_enum_t, c_mint/c_enum_t, c_int/c_enum_t, c_bigint/c_enum_t, c_utinyint/c_enum_t, c_usmallint/c_enum_t, c_umint/c_enum_t, c_uint/c_enum_t, c_ubigint/c_enum_t, c_float/c_enum_t, c_double/c_enum_t, c_ufloat/c_enum_t, c_udouble/c_enum_t, c_dec/c_enum_t, c_udec/c_enum_t, c_datetime/c_enum_t, c_timestamp/c_enum_t, c_date /c_enum_t, c_time/c_enum_t, c_year/c_enum_t, c_varchar/c_enum_t, c_char/c_enum_t, /*c_tinytext/c_enum_t, c_text/c_enum_t, c_mtext/c_enum_t, c_ltext/c_enum_t, */c_bit/c_enum_t, c_enum/c_enum_t, c_set/c_enum_t from test_enum1;
null/c_enum_t	c_tinyint/c_enum_t	c_smallint/c_enum_t	c_mint/c_enum_t	c_int/c_enum_t	c_bigint/c_enum_t	c_utinyint/c_enum_t	c_usmallint/c_enum_t	c_umint/c_enum_t	c_uint/c_enum_t	c_ubigint/c_enum_t	c_float/c_enum_t	c_double/c_enum_t	c_ufloat/c_enum_t	c_udouble/c_enum_t	c_dec/c_enum_t	c_udec/c_enum_t	c_datetime/c_enum_t	c_timestamp/c_enum_t	c_date /c_enum_t	c_time/c_enum_t	c_year/c_enum_t	c_varchar/c_enum_t	c_char/c_enum_t	c_bit/c_enum_t	c_enum/c_enum_t	c_set/c_enum_t
NULL	-0.3333333333333333	-0.3333333333333333	-0.3333333333333333	-0.3333333333333333	-0.3333333333333333	0.3333333333333333	0.3333333333333333	0.3333333333333333	0.3333333333333333	0.3333333333333333	0.3333333333333333	0.3333333333333333	0.6666666666666666	0.6666666666666666	1	1	6720033666700.667	6720034000034	6663367	6734	633.6666666666666	0	0	22.333333333333332	0.3333333333333333	0.6666666666666666
select c_enum_t+null, c_enum_t+c_tinyint, c_enum_t+c_smallint, c_enum_t+c_mint, c_enum_t+c_int, c_enum_t+c_bigint, c_enum_t+c_utinyint, c_enum_t+c_usmallint, c_enum_t+c_umint, c_enum_t+c_uint, c_enum_t+c_ubigint, c_enum_t+c_float, c_enum_t+c_double, c_enum_t+c_ufloat, c_enum_t+c_udouble, c_enum_t+c_dec, c_enum_t+c_udec, c_enum_t+c_datetime, c_enum_t+c_timestamp, c_enum_t+c_date , c_enum_t+c_time, c_enum_t+c_year, c_enum_t+c_varchar, c_enum_t+c_char, /*c_enum_t+c_tinytext, c_enum_t+c_text, c_enum_t+c_mtext, c_enum_t+c_ltext,*/ c_enum_t+c_bit, c_enum_t+c_enum, c_enum_t+c_set from test_enum1;
c_enum_t+null	c_enum_t+c_tinyint	c_enum_t+c_smallint	c_enum_t+c_mint	c_enum_t+c_int	c_enum_t+c_bigint	c_enum_t+c_utinyint	c_enum_t+c_usmallint	c_enum_t+c_umint	c_enum_t+c_uint	c_enum_t+c_ubigint	c_enum_t+c_float	c_enum_t+c_double	c_enum_t+c_ufloat	c_enum_t+c_udouble	c_enum_t+c_dec	c_enum_t+c_udec	c_enum_t+c_datetime	c_enum_t+c_timestamp	c_enum_t+c_date	c_enum_t+c_time	c_enum_t+c_year	c_enum_t+c_varchar	c_enum_t+c_char	c_enum_t+c_bit	c_enum_t+c_enum	c_enum_t+c_set
NULL	2	2	2	2	2	4	4	4	4	4	4	4	5	5	6	6	20160101000105	20160102000105	19990104	20205	1904	3	3	70	4	5
select c_set_t+null, c_set_t+c_tinyint, c_set_t+c_smallint, c_set_t+c_mint, c_set_t+c_int, c_set_t+c_bigint, c_set_t+c_utinyint, c_set_t+c_usmallint, c_set_t+c_umint, c_set_t+c_uint, c_set_t+c_ubigint, c_set_t+c_float, c_set_t+c_double, c_set_t+c_ufloat, c_set_t+c_udouble, c_set_t+c_dec, c_set_t+c_udec, c_set_t+c_datetime, c_set_t+c_timestamp, c_set_t+c_date , c_set_t+c_time, c_set_t+c_year, c_set_t+c_varchar, c_set_t+c_char, /*c_set_t+c_tinytext, c_set_t+c_text, c_set_t+c_mtext, c_set_t+c_ltext,*/ c_set_t+c_bit, c_set_t+c_enum, c_set_t+c_set from test_set1;
c_set_t+null	c_set_t+c_tinyint	c_set_t+c_smallint	c_set_t+c_mint	c_set_t+c_int	c_set_t+c_bigint	c_set_t+c_utinyint	c_set_t+c_usmallint	c_set_t+c_umint	c_set_t+c_uint	c_set_t+c_ubigint	c_set_t+c_float	c_set_t+c_double	c_set_t+c_ufloat	c_set_t+c_udouble	c_set_t+c_dec	c_set_t+c_udec	c_set_t+c_datetime	c_set_t+c_timestamp	c_set_t+c_date	c_set_t+c_time	c_set_t+c_year	c_set_t+c_varchar	c_set_t+c_char	c_set_t+c_bit	c_set_t+c_enum	c_set_t+c_set
NULL	3	3	3	3	3	5	5	5	5	5	5	5	6	6	7	7	20160101000106	20160102000106	19990105	20206	1905	4	4	71	5	6
select null+c_set_t, c_tinyint+c_set_t, c_smallint+c_set_t, c_mint+c_set_t, c_int+c_set_t, c_bigint+c_set_t, c_utinyint+c_set_t, c_usmallint+c_set_t, c_umint+c_set_t, c_uint+c_set_t, c_ubigint+c_set_t, c_float+c_set_t, c_double+c_set_t, c_ufloat+c_set_t, c_udouble+c_set_t, c_dec+c_set_t, c_udec+c_set_t, c_datetime+c_set_t, c_timestamp+c_set_t, c_date +c_set_t, c_time+c_set_t, c_year+c_set_t, c_varchar+c_set_t, c_char+c_set_t, /*c_tinytext+c_set_t, c_text+c_set_t, c_mtext+c_set_t, c_ltext+c_set_t,*/ c_bit+c_set_t, c_enum+c_set_t, c_set+c_set_t from test_set1;
null+c_set_t	c_tinyint+c_set_t	c_smallint+c_set_t	c_mint+c_set_t	c_int+c_set_t	c_bigint+c_set_t	c_utinyint+c_set_t	c_usmallint+c_set_t	c_umint+c_set_t	c_uint+c_set_t	c_ubigint+c_set_t	c_float+c_set_t	c_double+c_set_t	c_ufloat+c_set_t	c_udouble+c_set_t	c_dec+c_set_t	c_udec+c_set_t	c_datetime+c_set_t	c_timestamp+c_set_t	c_date +c_set_t	c_time+c_set_t	c_year+c_set_t	c_varchar+c_set_t	c_char+c_set_t	c_bit+c_set_t	c_enum+c_set_t	c_set+c_set_t
NULL	3	3	3	3	3	5	5	5	5	5	5	5	6	6	7	7	20160101000106	20160102000106	19990105	20206	1905	4	4	71	5	6
select null+c_enum_t, c_tinyint+c_enum_t, c_smallint+c_enum_t, c_mint+c_enum_t, c_int+c_enum_t, c_bigint+c_enum_t, c_utinyint+c_enum_t, c_usmallint+c_enum_t, c_umint+c_enum_t, c_uint+c_enum_t, c_ubigint+c_enum_t, c_float+c_enum_t, c_double+c_enum_t, c_ufloat+c_enum_t, c_udouble+c_enum_t, c_dec+c_enum_t, c_udec+c_enum_t, c_datetime+c_enum_t, c_timestamp+c_enum_t, c_date +c_enum_t, c_time+c_enum_t, c_year+c_enum_t, c_varchar+c_enum_t, c_char+c_enum_t, /*c_tinytext+c_enum_t, c_text+c_enum_t, c_mtext+c_enum_t, c_ltext+c_enum_t,*/ c_bit+c_enum_t, c_enum+c_enum_t, c_set+c_enum_t from test_enum1;
null+c_enum_t	c_tinyint+c_enum_t	c_smallint+c_enum_t	c_mint+c_enum_t	c_int+c_enum_t	c_bigint+c_enum_t	c_utinyint+c_enum_t	c_usmallint+c_enum_t	c_umint+c_enum_t	c_uint+c_enum_t	c_ubigint+c_enum_t	c_float+c_enum_t	c_double+c_enum_t	c_ufloat+c_enum_t	c_udouble+c_enum_t	c_dec+c_enum_t	c_udec+c_enum_t	c_datetime+c_enum_t	c_timestamp+c_enum_t	c_date +c_enum_t	c_time+c_enum_t	c_year+c_enum_t	c_varchar+c_enum_t	c_char+c_enum_t	c_bit+c_enum_t	c_enum+c_enum_t	c_set+c_enum_t
NULL	2	2	2	2	2	4	4	4	4	4	4	4	5	5	6	6	20160101000105	20160102000105	19990104	20205	1904	3	3	70	4	5
select c_enum_t%null, c_enum_t%c_tinyint, c_enum_t%c_smallint, c_enum_t%c_mint, c_enum_t%c_int, c_enum_t%c_bigint, c_enum_t%c_utinyint, c_enum_t%c_usmallint, c_enum_t%c_umint, c_enum_t%c_uint, c_enum_t%c_ubigint, c_enum_t%c_float, c_enum_t%c_double, c_enum_t%c_ufloat, c_enum_t%c_udouble, c_enum_t%c_dec, c_enum_t%c_udec, c_enum_t%c_datetime, c_enum_t%c_timestamp, c_enum_t%c_date , c_enum_t%c_time, c_enum_t%c_year, c_enum_t%c_varchar, c_enum_t%c_char, /*c_enum_t%c_tinytext, c_enum_t%c_text, c_enum_t%c_mtext, c_enum_t%c_ltext,*/ c_enum_t%c_bit, c_enum_t%c_enum, c_enum_t%c_set from test_enum1;
c_enum_t%null	c_enum_t%c_tinyint	c_enum_t%c_smallint	c_enum_t%c_mint	c_enum_t%c_int	c_enum_t%c_bigint	c_enum_t%c_utinyint	c_enum_t%c_usmallint	c_enum_t%c_umint	c_enum_t%c_uint	c_enum_t%c_ubigint	c_enum_t%c_float	c_enum_t%c_double	c_enum_t%c_ufloat	c_enum_t%c_udouble	c_enum_t%c_dec	c_enum_t%c_udec	c_enum_t%c_datetime	c_enum_t%c_timestamp	c_enum_t%c_date	c_enum_t%c_time	c_enum_t%c_year	c_enum_t%c_varchar	c_enum_t%c_char	c_enum_t%c_bit	c_enum_t%c_enum	c_enum_t%c_set
NULL	0	0	0	0	0	0	0	0	0	0	0	0	1	1	0	0	3	3	3	3	3	NULL	NULL	3	0	1
select c_set_t%null, c_set_t%c_tinyint, c_set_t%c_smallint, c_set_t%c_mint, c_set_t%c_int, c_set_t%c_bigint, c_set_t%c_utinyint, c_set_t%c_usmallint, c_set_t%c_umint, c_set_t%c_uint, c_set_t%c_ubigint, c_set_t%c_float, c_set_t%c_double, c_set_t%c_ufloat, c_set_t%c_udouble, c_set_t%c_dec, c_set_t%c_udec, c_set_t%c_datetime, c_set_t%c_timestamp, c_set_t%c_date , c_set_t%c_time, c_set_t%c_year, c_set_t%c_varchar, c_set_t%c_char,/* c_set_t%c_tinytext, c_set_t%c_text, c_set_t%c_mtext, c_set_t%c_ltext,*/ c_set_t%c_bit, c_set_t%c_enum, c_set_t%c_set from test_set1;
c_set_t%null	c_set_t%c_tinyint	c_set_t%c_smallint	c_set_t%c_mint	c_set_t%c_int	c_set_t%c_bigint	c_set_t%c_utinyint	c_set_t%c_usmallint	c_set_t%c_umint	c_set_t%c_uint	c_set_t%c_ubigint	c_set_t%c_float	c_set_t%c_double	c_set_t%c_ufloat	c_set_t%c_udouble	c_set_t%c_dec	c_set_t%c_udec	c_set_t%c_datetime	c_set_t%c_timestamp	c_set_t%c_date	c_set_t%c_time	c_set_t%c_year	c_set_t%c_varchar	c_set_t%c_char	c_set_t%c_bit	c_set_t%c_enum	c_set_t%c_set
NULL	0	0	0	0	0	0	0	0	0	0	0	0	0	0	1	1	4	4	4	4	4	NULL	NULL	4	0	0
select null%c_set_t, c_tinyint%c_set_t, c_smallint%c_set_t, c_mint%c_set_t, c_int%c_set_t, c_bigint%c_set_t, c_utinyint%c_set_t, c_usmallint%c_set_t, c_umint%c_set_t, c_uint%c_set_t, c_ubigint%c_set_t, c_float%c_set_t, c_double%c_set_t, c_ufloat%c_set_t, c_udouble%c_set_t, c_dec%c_set_t, c_udec%c_set_t, c_datetime%c_set_t, c_timestamp%c_set_t, c_date %c_set_t, c_time%c_set_t, c_year%c_set_t, c_varchar%c_set_t, c_char%c_set_t, /*c_tinytext%c_set_t, c_text%c_set_t, c_mtext%c_set_t, c_ltext%c_set_t,*/ c_bit%c_set_t, c_enum%c_set_t, c_set%c_set_t from test_set1;
null%c_set_t	c_tinyint%c_set_t	c_smallint%c_set_t	c_mint%c_set_t	c_int%c_set_t	c_bigint%c_set_t	c_utinyint%c_set_t	c_usmallint%c_set_t	c_umint%c_set_t	c_uint%c_set_t	c_ubigint%c_set_t	c_float%c_set_t	c_double%c_set_t	c_ufloat%c_set_t	c_udouble%c_set_t	c_dec%c_set_t	c_udec%c_set_t	c_datetime%c_set_t	c_timestamp%c_set_t	c_date %c_set_t	c_time%c_set_t	c_year%c_set_t	c_varchar%c_set_t	c_char%c_set_t	c_bit%c_set_t	c_enum%c_set_t	c_set%c_set_t
NULL	-1	-1	-1	-1	-1	1	1	1	1	1	1	1	2	2	3	3	2	2	1	2	1	0	0	3	1	2
select null%c_enum_t, c_tinyint%c_enum_t, c_smallint%c_enum_t, c_mint%c_enum_t, c_int%c_enum_t, c_bigint%c_enum_t, c_utinyint%c_enum_t, c_usmallint%c_enum_t, c_umint%c_enum_t, c_uint%c_enum_t, c_ubigint%c_enum_t, c_float%c_enum_t, c_double%c_enum_t, c_ufloat%c_enum_t, c_udouble%c_enum_t, c_dec%c_enum_t, c_udec%c_enum_t, c_datetime%c_enum_t, c_timestamp%c_enum_t, c_date %c_enum_t, c_time%c_enum_t, c_year%c_enum_t, c_varchar%c_enum_t, c_char%c_enum_t, /*c_tinytext%c_enum_t, c_text%c_enum_t, c_mtext%c_enum_t, c_ltext%c_enum_t,*/ c_bit%c_enum_t, c_enum%c_enum_t, c_set%c_enum_t from test_enum1;
null%c_enum_t	c_tinyint%c_enum_t	c_smallint%c_enum_t	c_mint%c_enum_t	c_int%c_enum_t	c_bigint%c_enum_t	c_utinyint%c_enum_t	c_usmallint%c_enum_t	c_umint%c_enum_t	c_uint%c_enum_t	c_ubigint%c_enum_t	c_float%c_enum_t	c_double%c_enum_t	c_ufloat%c_enum_t	c_udouble%c_enum_t	c_dec%c_enum_t	c_udec%c_enum_t	c_datetime%c_enum_t	c_timestamp%c_enum_t	c_date %c_enum_t	c_time%c_enum_t	c_year%c_enum_t	c_varchar%c_enum_t	c_char%c_enum_t	c_bit%c_enum_t	c_enum%c_enum_t	c_set%c_enum_t
NULL	-1	-1	-1	-1	-1	1	1	1	1	1	1	1	2	2	0	0	2	0	0	0	2	0	0	1	1	2
select abs(c_enum), abs(c_set) from test_enum1;
abs(c_enum)	abs(c_set)
1	2
select ceil(c_enum), ceil(c_set),ceil(c_bit), ceil(c_ubigint), round(c_enum), round(c_set),round(c_bit), round(c_ubigint) from test_enum1;
ceil(c_enum)	ceil(c_set)	ceil(c_bit)	ceil(c_ubigint)	round(c_enum)	round(c_set)	round(c_bit)	round(c_ubigint)
1	2	67	1	1	2	67	1
select greatest(null, c_enum_t), greatest(c_tinyint, c_enum_t), greatest(c_smallint, c_enum_t), greatest(c_mint, c_enum_t), greatest(c_int, c_enum_t), greatest(c_bigint, c_enum_t), greatest(c_utinyint, c_enum_t), greatest(c_usmallint, c_enum_t), greatest(c_umint, c_enum_t), greatest(c_uint, c_enum_t), greatest(c_ubigint, c_enum_t), greatest(c_float, c_enum_t), greatest(c_double, c_enum_t), greatest(c_ufloat, c_enum_t), greatest(c_udouble, c_enum_t), greatest(c_dec, c_enum_t), greatest(c_udec, c_enum_t), greatest(c_datetime, c_enum_t), greatest(c_timestamp, c_enum_t), greatest(c_date , c_enum_t), greatest(c_time, c_enum_t), greatest(c_year, c_enum_t), greatest(c_varchar, c_enum_t), greatest(c_char, c_enum_t), greatest(/*c_tinytext, c_enum_t), greatest(c_text, c_enum_t), greatest(c_mtext, c_enum_t), greatest(c_ltext, c_enum_t,*/ c_bit, c_enum_t), greatest(c_enum, c_enum_t), greatest(c_set, c_enum_t) from test_enum1;
Catalog	Database	Table	Table_alias	Column	Column_alias	Type	Length	Max length	Is_null	Flags	Decimals	Charsetnr
def				greatest(null, c_enum_t)	greatest(null, c_enum_t)	253	262143	0	Y	128	31	63
def				greatest(c_tinyint, c_enum_t)	greatest(c_tinyint, c_enum_t)	253	262143	1	Y	128	31	63
def				greatest(c_smallint, c_enum_t)	greatest(c_smallint, c_enum_t)	253	262143	1	Y	128	31	63
def				greatest(c_mint, c_enum_t)	greatest(c_mint, c_enum_t)	253	262143	1	Y	128	31	63
def				greatest(c_int, c_enum_t)	greatest(c_int, c_enum_t)	253	262143	1	Y	128	31	63
def				greatest(c_bigint, c_enum_t)	greatest(c_bigint, c_enum_t)	253	262143	1	Y	128	31	63
def				greatest(c_utinyint, c_enum_t)	greatest(c_utinyint, c_enum_t)	253	262143	1	Y	128	31	63
def				greatest(c_usmallint, c_enum_t)	greatest(c_usmallint, c_enum_t)	253	262143	1	Y	128	31	63
def				greatest(c_umint, c_enum_t)	greatest(c_umint, c_enum_t)	253	262143	1	Y	128	31	63
def				greatest(c_uint, c_enum_t)	greatest(c_uint, c_enum_t)	253	262143	1	Y	128	31	63
def				greatest(c_ubigint, c_enum_t)	greatest(c_ubigint, c_enum_t)	253	262143	1	Y	128	31	63
def				greatest(c_float, c_enum_t)	greatest(c_float, c_enum_t)	253	262143	1	Y	128	31	63
def				greatest(c_double, c_enum_t)	greatest(c_double, c_enum_t)	253	262143	1	Y	128	31	63
def				greatest(c_ufloat, c_enum_t)	greatest(c_ufloat, c_enum_t)	253	262143	1	Y	128	31	63
def				greatest(c_udouble, c_enum_t)	greatest(c_udouble, c_enum_t)	253	262143	1	Y	128	31	63
def				greatest(c_dec, c_enum_t)	greatest(c_dec, c_enum_t)	253	262143	1	Y	128	31	63
def				greatest(c_udec, c_enum_t)	greatest(c_udec, c_enum_t)	253	262143	1	Y	128	31	63
def				greatest(c_datetime, c_enum_t)	greatest(c_datetime, c_enum_t)	253	262143	19	Y	128	31	63
def				greatest(c_timestamp, c_enum_t)	greatest(c_timestamp, c_enum_t)	253	262143	19	Y	128	31	63
def				greatest(c_date , c_enum_t)	greatest(c_date , c_enum_t)	253	262143	19	Y	128	31	63
def				greatest(c_time, c_enum_t)	greatest(c_time, c_enum_t)	253	262143	8	Y	128	31	63
def				greatest(c_year, c_enum_t)	greatest(c_year, c_enum_t)	253	262143	4	Y	128	31	63
def				greatest(c_varchar, c_enum_t)	greatest(c_varchar, c_enum_t)	253	64	7	Y	0	31	45
def				greatest(c_char, c_enum_t)	greatest(c_char, c_enum_t)	253	64	1	Y	0	31	45
def				greatest(/*c_tinytext, c_enum_t), greatest(c_text, c_enum_t), greatest(c_mtext, c_enum_t), greatest(c_ltext, c_enum_t,*/ c_bit, c_enum_t)	greatest(/*c_tinytext, c_enum_t), greatest(c_text, c_enum_t), greatest(c_mtext, c_enum_t), greatest(c_ltext, c_enum_t,*/ c_bit, c_enum_t)	253	262143	2	Y	128	31	63
def				greatest(c_enum, c_enum_t)	greatest(c_enum, c_enum_t)	253	4	1	Y	0	31	45
def				greatest(c_set, c_enum_t)	greatest(c_set, c_enum_t)	253	20	1	Y	0	31	45
greatest(null, c_enum_t)	greatest(c_tinyint, c_enum_t)	greatest(c_smallint, c_enum_t)	greatest(c_mint, c_enum_t)	greatest(c_int, c_enum_t)	greatest(c_bigint, c_enum_t)	greatest(c_utinyint, c_enum_t)	greatest(c_usmallint, c_enum_t)	greatest(c_umint, c_enum_t)	greatest(c_uint, c_enum_t)	greatest(c_ubigint, c_enum_t)	greatest(c_float, c_enum_t)	greatest(c_double, c_enum_t)	greatest(c_ufloat, c_enum_t)	greatest(c_udouble, c_enum_t)	greatest(c_dec, c_enum_t)	greatest(c_udec, c_enum_t)	greatest(c_datetime, c_enum_t)	greatest(c_timestamp, c_enum_t)	greatest(c_date , c_enum_t)	greatest(c_time, c_enum_t)	greatest(c_year, c_enum_t)	greatest(c_varchar, c_enum_t)	greatest(c_char, c_enum_t)	greatest(/*c_tinytext, c_enum_t), greatest(c_text, c_enum_t), greatest(c_mtext, c_enum_t), greatest(c_ltext, c_enum_t,*/ c_bit, c_enum_t)	greatest(c_enum, c_enum_t)	greatest(c_set, c_enum_t)
NULL	3	3	3	3	3	3	3	3	3	3	3	3	3	3	3	3	2016-01-01 00:01:02	2016-01-02 00:01:02	1999-01-01 00:00:00	02:02:02	1901	varchar	c	67	c	c
select least(null, c_enum_t), least(c_tinyint, c_enum_t), least(c_smallint, c_enum_t), least(c_mint, c_enum_t), least(c_int, c_enum_t), least(c_bigint, c_enum_t), least(c_utinyint, c_enum_t), least(c_usmallint, c_enum_t), least(c_umint, c_enum_t), least(c_uint, c_enum_t), least(c_ubigint, c_enum_t), least(c_float, c_enum_t), least(c_double, c_enum_t), least(c_ufloat, c_enum_t), least(c_udouble, c_enum_t), least(c_dec, c_enum_t), least(c_udec, c_enum_t), least(c_datetime, c_enum_t), least(c_timestamp, c_enum_t), least(c_date , c_enum_t), least(c_time, c_enum_t), least(c_year, c_enum_t), least(c_varchar, c_enum_t), least(c_char, c_enum_t), least(/*c_tinytext, c_enum_t), least(c_text, c_enum_t), least(c_mtext, c_enum_t), least(c_ltext, c_enum_t,*/ c_bit, c_enum_t), least(c_enum, c_enum_t), least(c_set, c_enum_t) from test_enum1;
Catalog	Database	Table	Table_alias	Column	Column_alias	Type	Length	Max length	Is_null	Flags	Decimals	Charsetnr
def				least(null, c_enum_t)	least(null, c_enum_t)	253	262143	0	Y	128	31	63
def				least(c_tinyint, c_enum_t)	least(c_tinyint, c_enum_t)	253	262143	2	Y	128	31	63
def				least(c_smallint, c_enum_t)	least(c_smallint, c_enum_t)	253	262143	2	Y	128	31	63
def				least(c_mint, c_enum_t)	least(c_mint, c_enum_t)	253	262143	2	Y	128	31	63
def				least(c_int, c_enum_t)	least(c_int, c_enum_t)	253	262143	2	Y	128	31	63
def				least(c_bigint, c_enum_t)	least(c_bigint, c_enum_t)	253	262143	2	Y	128	31	63
def				least(c_utinyint, c_enum_t)	least(c_utinyint, c_enum_t)	253	262143	1	Y	128	31	63
def				least(c_usmallint, c_enum_t)	least(c_usmallint, c_enum_t)	253	262143	1	Y	128	31	63
def				least(c_umint, c_enum_t)	least(c_umint, c_enum_t)	253	262143	1	Y	128	31	63
def				least(c_uint, c_enum_t)	least(c_uint, c_enum_t)	253	262143	1	Y	128	31	63
def				least(c_ubigint, c_enum_t)	least(c_ubigint, c_enum_t)	253	262143	1	Y	128	31	63
def				least(c_float, c_enum_t)	least(c_float, c_enum_t)	253	262143	1	Y	128	31	63
def				least(c_double, c_enum_t)	least(c_double, c_enum_t)	253	262143	1	Y	128	31	63
def				least(c_ufloat, c_enum_t)	least(c_ufloat, c_enum_t)	253	262143	1	Y	128	31	63
def				least(c_udouble, c_enum_t)	least(c_udouble, c_enum_t)	253	262143	1	Y	128	31	63
def				least(c_dec, c_enum_t)	least(c_dec, c_enum_t)	253	262143	1	Y	128	31	63
def				least(c_udec, c_enum_t)	least(c_udec, c_enum_t)	253	262143	1	Y	128	31	63
def				least(c_datetime, c_enum_t)	least(c_datetime, c_enum_t)	253	262143	19	Y	128	31	63
def				least(c_timestamp, c_enum_t)	least(c_timestamp, c_enum_t)	253	262143	19	Y	128	31	63
def				least(c_date , c_enum_t)	least(c_date , c_enum_t)	253	262143	19	Y	128	31	63
def				least(c_time, c_enum_t)	least(c_time, c_enum_t)	253	262143	8	Y	128	31	63
def				least(c_year, c_enum_t)	least(c_year, c_enum_t)	253	262143	1	Y	128	31	63
def				least(c_varchar, c_enum_t)	least(c_varchar, c_enum_t)	253	64	1	Y	0	31	45
def				least(c_char, c_enum_t)	least(c_char, c_enum_t)	253	64	3	Y	0	31	45
def				least(/*c_tinytext, c_enum_t), least(c_text, c_enum_t), least(c_mtext, c_enum_t), least(c_ltext, c_enum_t,*/ c_bit, c_enum_t)	least(/*c_tinytext, c_enum_t), least(c_text, c_enum_t), least(c_mtext, c_enum_t), least(c_ltext, c_enum_t,*/ c_bit, c_enum_t)	253	262143	1	Y	128	31	63
def				least(c_enum, c_enum_t)	least(c_enum, c_enum_t)	253	4	1	Y	0	31	45
def				least(c_set, c_enum_t)	least(c_set, c_enum_t)	253	20	1	Y	0	31	45
least(null, c_enum_t)	least(c_tinyint, c_enum_t)	least(c_smallint, c_enum_t)	least(c_mint, c_enum_t)	least(c_int, c_enum_t)	least(c_bigint, c_enum_t)	least(c_utinyint, c_enum_t)	least(c_usmallint, c_enum_t)	least(c_umint, c_enum_t)	least(c_uint, c_enum_t)	least(c_ubigint, c_enum_t)	least(c_float, c_enum_t)	least(c_double, c_enum_t)	least(c_ufloat, c_enum_t)	least(c_udouble, c_enum_t)	least(c_dec, c_enum_t)	least(c_udec, c_enum_t)	least(c_datetime, c_enum_t)	least(c_timestamp, c_enum_t)	least(c_date , c_enum_t)	least(c_time, c_enum_t)	least(c_year, c_enum_t)	least(c_varchar, c_enum_t)	least(c_char, c_enum_t)	least(/*c_tinytext, c_enum_t), least(c_text, c_enum_t), least(c_mtext, c_enum_t), least(c_ltext, c_enum_t,*/ c_bit, c_enum_t)	least(c_enum, c_enum_t)	least(c_set, c_enum_t)
NULL	-1	-1	-1	-1	-1	1	1	1	1	1	1	1	2	2	3	3	0000-00-00 00:00:00	0000-00-00 00:00:00	0000-00-00 00:00:00	00:00:00	3	c	aaa	3	a	b
select greatest(null, c_set_t), greatest(c_tinyint, c_set_t), greatest(c_smallint, c_set_t), greatest(c_mint, c_set_t), greatest(c_int, c_set_t), greatest(c_bigint, c_set_t), greatest(c_utinyint, c_set_t), greatest(c_usmallint, c_set_t), greatest(c_umint, c_set_t), greatest(c_uint, c_set_t), greatest(c_ubigint, c_set_t), greatest(c_float, c_set_t), greatest(c_double, c_set_t), greatest(c_ufloat, c_set_t), greatest(c_udouble, c_set_t), greatest(c_dec, c_set_t), greatest(c_udec, c_set_t), greatest(c_datetime, c_set_t), greatest(c_timestamp, c_set_t), greatest(c_date , c_set_t), greatest(c_time, c_set_t), greatest(c_year, c_set_t), greatest(c_varchar, c_set_t), greatest(c_char, c_set_t), greatest(/*c_tinytext, c_set_t), greatest(c_text, c_set_t), greatest(c_mtext, c_set_t), greatest(c_ltext, c_set_t,*/ c_bit, c_set_t), greatest(c_enum, c_set_t), greatest(c_set, c_set_t) from test_set1;
Catalog	Database	Table	Table_alias	Column	Column_alias	Type	Length	Max length	Is_null	Flags	Decimals	Charsetnr
def				greatest(null, c_set_t)	greatest(null, c_set_t)	253	262143	0	Y	128	31	63
def				greatest(c_tinyint, c_set_t)	greatest(c_tinyint, c_set_t)	253	262143	1	Y	128	31	63
def				greatest(c_smallint, c_set_t)	greatest(c_smallint, c_set_t)	253	262143	1	Y	128	31	63
def				greatest(c_mint, c_set_t)	greatest(c_mint, c_set_t)	253	262143	1	Y	128	31	63
def				greatest(c_int, c_set_t)	greatest(c_int, c_set_t)	253	262143	1	Y	128	31	63
def				greatest(c_bigint, c_set_t)	greatest(c_bigint, c_set_t)	253	262143	1	Y	128	31	63
def				greatest(c_utinyint, c_set_t)	greatest(c_utinyint, c_set_t)	253	262143	1	Y	128	31	63
def				greatest(c_usmallint, c_set_t)	greatest(c_usmallint, c_set_t)	253	262143	1	Y	128	31	63
def				greatest(c_umint, c_set_t)	greatest(c_umint, c_set_t)	253	262143	1	Y	128	31	63
def				greatest(c_uint, c_set_t)	greatest(c_uint, c_set_t)	253	262143	1	Y	128	31	63
def				greatest(c_ubigint, c_set_t)	greatest(c_ubigint, c_set_t)	253	262143	1	Y	128	31	63
def				greatest(c_float, c_set_t)	greatest(c_float, c_set_t)	253	262143	1	Y	128	31	63
def				greatest(c_double, c_set_t)	greatest(c_double, c_set_t)	253	262143	1	Y	128	31	63
def				greatest(c_ufloat, c_set_t)	greatest(c_ufloat, c_set_t)	253	262143	1	Y	128	31	63
def				greatest(c_udouble, c_set_t)	greatest(c_udouble, c_set_t)	253	262143	1	Y	128	31	63
def				greatest(c_dec, c_set_t)	greatest(c_dec, c_set_t)	253	262143	1	Y	128	31	63
def				greatest(c_udec, c_set_t)	greatest(c_udec, c_set_t)	253	262143	1	Y	128	31	63
def				greatest(c_datetime, c_set_t)	greatest(c_datetime, c_set_t)	253	262143	19	Y	128	31	63
def				greatest(c_timestamp, c_set_t)	greatest(c_timestamp, c_set_t)	253	262143	19	Y	128	31	63
def				greatest(c_date , c_set_t)	greatest(c_date , c_set_t)	253	262143	19	Y	128	31	63
def				greatest(c_time, c_set_t)	greatest(c_time, c_set_t)	253	262143	8	Y	128	31	63
def				greatest(c_year, c_set_t)	greatest(c_year, c_set_t)	253	262143	4	Y	128	31	63
def				greatest(c_varchar, c_set_t)	greatest(c_varchar, c_set_t)	253	64	7	Y	0	31	45
def				greatest(c_char, c_set_t)	greatest(c_char, c_set_t)	253	64	1	Y	0	31	45
def				greatest(/*c_tinytext, c_set_t), greatest(c_text, c_set_t), greatest(c_mtext, c_set_t), greatest(c_ltext, c_set_t,*/ c_bit, c_set_t)	greatest(/*c_tinytext, c_set_t), greatest(c_text, c_set_t), greatest(c_mtext, c_set_t), greatest(c_ltext, c_set_t,*/ c_bit, c_set_t)	253	262143	2	Y	128	31	63
def				greatest(c_enum, c_set_t)	greatest(c_enum, c_set_t)	253	20	1	Y	0	31	45
def				greatest(c_set, c_set_t)	greatest(c_set, c_set_t)	253	20	1	Y	0	31	45
greatest(null, c_set_t)	greatest(c_tinyint, c_set_t)	greatest(c_smallint, c_set_t)	greatest(c_mint, c_set_t)	greatest(c_int, c_set_t)	greatest(c_bigint, c_set_t)	greatest(c_utinyint, c_set_t)	greatest(c_usmallint, c_set_t)	greatest(c_umint, c_set_t)	greatest(c_uint, c_set_t)	greatest(c_ubigint, c_set_t)	greatest(c_float, c_set_t)	greatest(c_double, c_set_t)	greatest(c_ufloat, c_set_t)	greatest(c_udouble, c_set_t)	greatest(c_dec, c_set_t)	greatest(c_udec, c_set_t)	greatest(c_datetime, c_set_t)	greatest(c_timestamp, c_set_t)	greatest(c_date , c_set_t)	greatest(c_time, c_set_t)	greatest(c_year, c_set_t)	greatest(c_varchar, c_set_t)	greatest(c_char, c_set_t)	greatest(/*c_tinytext, c_set_t), greatest(c_text, c_set_t), greatest(c_mtext, c_set_t), greatest(c_ltext, c_set_t,*/ c_bit, c_set_t)	greatest(c_enum, c_set_t)	greatest(c_set, c_set_t)
NULL	4	4	4	4	4	4	4	4	4	4	4	4	4	4	4	4	2016-01-01 00:01:02	2016-01-02 00:01:02	1999-01-01 00:00:00	02:02:02	1901	varchar	c	67	c	c
select least(null, c_set_t), least(c_tinyint, c_set_t), least(c_smallint, c_set_t), least(c_mint, c_set_t), least(c_int, c_set_t), least(c_bigint, c_set_t), least(c_utinyint, c_set_t), least(c_usmallint, c_set_t), least(c_umint, c_set_t), least(c_uint, c_set_t), least(c_ubigint, c_set_t), least(c_float, c_set_t), least(c_double, c_set_t), least(c_ufloat, c_set_t), least(c_udouble, c_set_t), least(c_dec, c_set_t), least(c_udec, c_set_t), least(c_datetime, c_set_t), least(c_timestamp, c_set_t), least(c_date , c_set_t), least(c_time, c_set_t), least(c_year, c_set_t), least(c_varchar, c_set_t), least(c_char, c_set_t), least(/*c_tinytext, c_set_t), least(c_text, c_set_t), least(c_mtext, c_set_t), least(c_ltext, c_set_t,*/ c_bit, c_set_t), least(c_enum, c_set_t), least(c_set, c_set_t) from test_set1;
Catalog	Database	Table	Table_alias	Column	Column_alias	Type	Length	Max length	Is_null	Flags	Decimals	Charsetnr
def				least(null, c_set_t)	least(null, c_set_t)	253	262143	0	Y	128	31	63
def				least(c_tinyint, c_set_t)	least(c_tinyint, c_set_t)	253	262143	2	Y	128	31	63
def				least(c_smallint, c_set_t)	least(c_smallint, c_set_t)	253	262143	2	Y	128	31	63
def				least(c_mint, c_set_t)	least(c_mint, c_set_t)	253	262143	2	Y	128	31	63
def				least(c_int, c_set_t)	least(c_int, c_set_t)	253	262143	2	Y	128	31	63
def				least(c_bigint, c_set_t)	least(c_bigint, c_set_t)	253	262143	2	Y	128	31	63
def				least(c_utinyint, c_set_t)	least(c_utinyint, c_set_t)	253	262143	1	Y	128	31	63
def				least(c_usmallint, c_set_t)	least(c_usmallint, c_set_t)	253	262143	1	Y	128	31	63
def				least(c_umint, c_set_t)	least(c_umint, c_set_t)	253	262143	1	Y	128	31	63
def				least(c_uint, c_set_t)	least(c_uint, c_set_t)	253	262143	1	Y	128	31	63
def				least(c_ubigint, c_set_t)	least(c_ubigint, c_set_t)	253	262143	1	Y	128	31	63
def				least(c_float, c_set_t)	least(c_float, c_set_t)	253	262143	1	Y	128	31	63
def				least(c_double, c_set_t)	least(c_double, c_set_t)	253	262143	1	Y	128	31	63
def				least(c_ufloat, c_set_t)	least(c_ufloat, c_set_t)	253	262143	1	Y	128	31	63
def				least(c_udouble, c_set_t)	least(c_udouble, c_set_t)	253	262143	1	Y	128	31	63
def				least(c_dec, c_set_t)	least(c_dec, c_set_t)	253	262143	1	Y	128	31	63
def				least(c_udec, c_set_t)	least(c_udec, c_set_t)	253	262143	1	Y	128	31	63
def				least(c_datetime, c_set_t)	least(c_datetime, c_set_t)	253	262143	19	Y	128	31	63
def				least(c_timestamp, c_set_t)	least(c_timestamp, c_set_t)	253	262143	19	Y	128	31	63
def				least(c_date , c_set_t)	least(c_date , c_set_t)	253	262143	19	Y	128	31	63
def				least(c_time, c_set_t)	least(c_time, c_set_t)	253	262143	8	Y	128	31	63
def				least(c_year, c_set_t)	least(c_year, c_set_t)	253	262143	1	Y	128	31	63
def				least(c_varchar, c_set_t)	least(c_varchar, c_set_t)	253	64	1	Y	0	31	45
def				least(c_char, c_set_t)	least(c_char, c_set_t)	253	64	3	Y	0	31	45
def				least(/*c_tinytext, c_set_t), least(c_text, c_set_t), least(c_mtext, c_set_t), least(c_ltext, c_set_t,*/ c_bit, c_set_t)	least(/*c_tinytext, c_set_t), least(c_text, c_set_t), least(c_mtext, c_set_t), least(c_ltext, c_set_t,*/ c_bit, c_set_t)	253	262143	1	Y	128	31	63
def				least(c_enum, c_set_t)	least(c_enum, c_set_t)	253	20	1	Y	0	31	45
def				least(c_set, c_set_t)	least(c_set, c_set_t)	253	20	1	Y	0	31	45
least(null, c_set_t)	least(c_tinyint, c_set_t)	least(c_smallint, c_set_t)	least(c_mint, c_set_t)	least(c_int, c_set_t)	least(c_bigint, c_set_t)	least(c_utinyint, c_set_t)	least(c_usmallint, c_set_t)	least(c_umint, c_set_t)	least(c_uint, c_set_t)	least(c_ubigint, c_set_t)	least(c_float, c_set_t)	least(c_double, c_set_t)	least(c_ufloat, c_set_t)	least(c_udouble, c_set_t)	least(c_dec, c_set_t)	least(c_udec, c_set_t)	least(c_datetime, c_set_t)	least(c_timestamp, c_set_t)	least(c_date , c_set_t)	least(c_time, c_set_t)	least(c_year, c_set_t)	least(c_varchar, c_set_t)	least(c_char, c_set_t)	least(/*c_tinytext, c_set_t), least(c_text, c_set_t), least(c_mtext, c_set_t), least(c_ltext, c_set_t,*/ c_bit, c_set_t)	least(c_enum, c_set_t)	least(c_set, c_set_t)
NULL	-1	-1	-1	-1	-1	1	1	1	1	1	1	1	2	2	3	3	0000-00-00 00:00:00	0000-00-00 00:00:00	0000-00-00 00:00:00	00:00:00	4	c	aaa	4	a	b
select greatest(null, c_enum_t), greatest(c_tinyint, c_enum_t), greatest(c_smallint, c_enum_t), greatest(c_mint, c_enum_t), greatest(c_int, c_enum_t), greatest(c_bigint, c_enum_t), greatest(c_utinyint, c_enum_t), greatest(c_usmallint, c_enum_t), greatest(c_umint, c_enum_t), greatest(c_uint, c_enum_t), greatest(c_ubigint, c_enum_t), greatest(c_float, c_enum_t), greatest(c_double, c_enum_t), greatest(c_ufloat, c_enum_t), greatest(c_udouble, c_enum_t), greatest(c_dec, c_enum_t), greatest(c_udec, c_enum_t), greatest(c_datetime, c_enum_t), greatest(c_timestamp, c_enum_t), greatest(c_date , c_enum_t), greatest(c_time, c_enum_t), greatest(c_year, c_enum_t), greatest(c_varchar, c_enum_t), greatest(c_char, c_enum_t), greatest(/*c_tinytext, c_enum_t), greatest(c_text, c_enum_t), greatest(c_mtext, c_enum_t), greatest(c_ltext, c_enum_t,*/ c_bit, c_enum_t), greatest(c_enum, c_enum_t), greatest(c_set, c_enum_t) from test_enum1;
greatest(null, c_enum_t)	greatest(c_tinyint, c_enum_t)	greatest(c_smallint, c_enum_t)	greatest(c_mint, c_enum_t)	greatest(c_int, c_enum_t)	greatest(c_bigint, c_enum_t)	greatest(c_utinyint, c_enum_t)	greatest(c_usmallint, c_enum_t)	greatest(c_umint, c_enum_t)	greatest(c_uint, c_enum_t)	greatest(c_ubigint, c_enum_t)	greatest(c_float, c_enum_t)	greatest(c_double, c_enum_t)	greatest(c_ufloat, c_enum_t)	greatest(c_udouble, c_enum_t)	greatest(c_dec, c_enum_t)	greatest(c_udec, c_enum_t)	greatest(c_datetime, c_enum_t)	greatest(c_timestamp, c_enum_t)	greatest(c_date , c_enum_t)	greatest(c_time, c_enum_t)	greatest(c_year, c_enum_t)	greatest(c_varchar, c_enum_t)	greatest(c_char, c_enum_t)	greatest(/*c_tinytext, c_enum_t), greatest(c_text, c_enum_t), greatest(c_mtext, c_enum_t), greatest(c_ltext, c_enum_t,*/ c_bit, c_enum_t)	greatest(c_enum, c_enum_t)	greatest(c_set, c_enum_t)
NULL	3	3	3	3	3	3	3	3	3	3	3	3	3	3	3	3	2016-01-01 00:01:02	2016-01-02 00:01:02	1999-01-01 00:00:00	02:02:02	1901	varchar	c	67	c	c
select least(null, c_enum_t), least(c_tinyint, c_enum_t), least(c_smallint, c_enum_t), least(c_mint, c_enum_t), least(c_int, c_enum_t), least(c_bigint, c_enum_t), least(c_utinyint, c_enum_t), least(c_usmallint, c_enum_t), least(c_umint, c_enum_t), least(c_uint, c_enum_t), least(c_ubigint, c_enum_t), least(c_float, c_enum_t), least(c_double, c_enum_t), least(c_ufloat, c_enum_t), least(c_udouble, c_enum_t), least(c_dec, c_enum_t), least(c_udec, c_enum_t), least(c_datetime, c_enum_t), least(c_timestamp, c_enum_t), least(c_date , c_enum_t), least(c_time, c_enum_t), least(c_year, c_enum_t), least(c_varchar, c_enum_t), least(c_char, c_enum_t), least(/*c_tinytext, c_enum_t), least(c_text, c_enum_t), least(c_mtext, c_enum_t), least(c_ltext, c_enum_t,*/ c_bit, c_enum_t), least(c_enum, c_enum_t), least(c_set, c_enum_t) from test_enum1;
least(null, c_enum_t)	least(c_tinyint, c_enum_t)	least(c_smallint, c_enum_t)	least(c_mint, c_enum_t)	least(c_int, c_enum_t)	least(c_bigint, c_enum_t)	least(c_utinyint, c_enum_t)	least(c_usmallint, c_enum_t)	least(c_umint, c_enum_t)	least(c_uint, c_enum_t)	least(c_ubigint, c_enum_t)	least(c_float, c_enum_t)	least(c_double, c_enum_t)	least(c_ufloat, c_enum_t)	least(c_udouble, c_enum_t)	least(c_dec, c_enum_t)	least(c_udec, c_enum_t)	least(c_datetime, c_enum_t)	least(c_timestamp, c_enum_t)	least(c_date , c_enum_t)	least(c_time, c_enum_t)	least(c_year, c_enum_t)	least(c_varchar, c_enum_t)	least(c_char, c_enum_t)	least(/*c_tinytext, c_enum_t), least(c_text, c_enum_t), least(c_mtext, c_enum_t), least(c_ltext, c_enum_t,*/ c_bit, c_enum_t)	least(c_enum, c_enum_t)	least(c_set, c_enum_t)
NULL	-1	-1	-1	-1	-1	1	1	1	1	1	1	1	2	2	3	3	0000-00-00 00:00:00	0000-00-00 00:00:00	0000-00-00 00:00:00	00:00:00	3	c	aaa	3	a	b
select greatest(null, c_set_t), greatest(c_tinyint, c_set_t), greatest(c_smallint, c_set_t), greatest(c_mint, c_set_t), greatest(c_int, c_set_t), greatest(c_bigint, c_set_t), greatest(c_utinyint, c_set_t), greatest(c_usmallint, c_set_t), greatest(c_umint, c_set_t), greatest(c_uint, c_set_t), greatest(c_ubigint, c_set_t), greatest(c_float, c_set_t), greatest(c_double, c_set_t), greatest(c_ufloat, c_set_t), greatest(c_udouble, c_set_t), greatest(c_dec, c_set_t), greatest(c_udec, c_set_t), greatest(c_datetime, c_set_t), greatest(c_timestamp, c_set_t), greatest(c_date , c_set_t), greatest(c_time, c_set_t), greatest(c_year, c_set_t), greatest(c_varchar, c_set_t), greatest(c_char, c_set_t), greatest(/*c_tinytext, c_set_t), greatest(c_text, c_set_t), greatest(c_mtext, c_set_t), greatest(c_ltext, c_set_t,*/ c_bit, c_set_t), greatest(c_enum, c_set_t), greatest(c_set, c_set_t) from test_set1;
greatest(null, c_set_t)	greatest(c_tinyint, c_set_t)	greatest(c_smallint, c_set_t)	greatest(c_mint, c_set_t)	greatest(c_int, c_set_t)	greatest(c_bigint, c_set_t)	greatest(c_utinyint, c_set_t)	greatest(c_usmallint, c_set_t)	greatest(c_umint, c_set_t)	greatest(c_uint, c_set_t)	greatest(c_ubigint, c_set_t)	greatest(c_float, c_set_t)	greatest(c_double, c_set_t)	greatest(c_ufloat, c_set_t)	greatest(c_udouble, c_set_t)	greatest(c_dec, c_set_t)	greatest(c_udec, c_set_t)	greatest(c_datetime, c_set_t)	greatest(c_timestamp, c_set_t)	greatest(c_date , c_set_t)	greatest(c_time, c_set_t)	greatest(c_year, c_set_t)	greatest(c_varchar, c_set_t)	greatest(c_char, c_set_t)	greatest(/*c_tinytext, c_set_t), greatest(c_text, c_set_t), greatest(c_mtext, c_set_t), greatest(c_ltext, c_set_t,*/ c_bit, c_set_t)	greatest(c_enum, c_set_t)	greatest(c_set, c_set_t)
NULL	4	4	4	4	4	4	4	4	4	4	4	4	4	4	4	4	2016-01-01 00:01:02	2016-01-02 00:01:02	1999-01-01 00:00:00	02:02:02	1901	varchar	c	67	c	c
select least(null, c_set_t), least(c_tinyint, c_set_t), least(c_smallint, c_set_t), least(c_mint, c_set_t), least(c_int, c_set_t), least(c_bigint, c_set_t), least(c_utinyint, c_set_t), least(c_usmallint, c_set_t), least(c_umint, c_set_t), least(c_uint, c_set_t), least(c_ubigint, c_set_t), least(c_float, c_set_t), least(c_double, c_set_t), least(c_ufloat, c_set_t), least(c_udouble, c_set_t), least(c_dec, c_set_t), least(c_udec, c_set_t), least(c_datetime, c_set_t), least(c_timestamp, c_set_t), least(c_date , c_set_t), least(c_time, c_set_t), least(c_year, c_set_t), least(c_varchar, c_set_t), least(c_char, c_set_t), least(/*c_tinytext, c_set_t), least(c_text, c_set_t), least(c_mtext, c_set_t), least(c_ltext, c_set_t,*/ c_bit, c_set_t), least(c_enum, c_set_t), least(c_set, c_set_t) from test_set1;
least(null, c_set_t)	least(c_tinyint, c_set_t)	least(c_smallint, c_set_t)	least(c_mint, c_set_t)	least(c_int, c_set_t)	least(c_bigint, c_set_t)	least(c_utinyint, c_set_t)	least(c_usmallint, c_set_t)	least(c_umint, c_set_t)	least(c_uint, c_set_t)	least(c_ubigint, c_set_t)	least(c_float, c_set_t)	least(c_double, c_set_t)	least(c_ufloat, c_set_t)	least(c_udouble, c_set_t)	least(c_dec, c_set_t)	least(c_udec, c_set_t)	least(c_datetime, c_set_t)	least(c_timestamp, c_set_t)	least(c_date , c_set_t)	least(c_time, c_set_t)	least(c_year, c_set_t)	least(c_varchar, c_set_t)	least(c_char, c_set_t)	least(/*c_tinytext, c_set_t), least(c_text, c_set_t), least(c_mtext, c_set_t), least(c_ltext, c_set_t,*/ c_bit, c_set_t)	least(c_enum, c_set_t)	least(c_set, c_set_t)
NULL	-1	-1	-1	-1	-1	1	1	1	1	1	1	1	2	2	3	3	0000-00-00 00:00:00	0000-00-00 00:00:00	0000-00-00 00:00:00	00:00:00	4	c	aaa	4	a	b
create table test_not(c1 int, c_enum enum("true", "1", "false", "0"), c_set set("true", "1", "false", "0"));
insert into test_not value (1,1,1),(2,2,2),(3,3,4),(4,4,8);
select c_enum, !c_enum, c_set, !c_set from test_not;
c_enum	!c_enum	c_set	!c_set
true	0	true	0
1	0	1	0
false	0	false	0
0	0	0	0
drop table test_not;
drop database test_enum_set;
