drop database if exists sin_test;
create database sin_test;
use sin_test;
drop table if exists w0case;
drop table if exists w1case;
# obmysql-sin 通过性测试
create table w0case(w_test varchar(100));
insert into w0case values('100');
select round(sin(w_test),5) from w0case;
round(sin(w_test),5)
-0.50637
# obmysql-sin 参数数量
select sin() from w0case;
ERROR 42000: Incorrect parameter count in the call to native function 'sin'
select round(sin(12),5) from dual;
round(sin(12),5)
-0.53657
select sin(12,1) from dual;
ERROR 42000: Incorrect parameter count in the call to native function 'sin'
drop table w0case;
# obmysql-sin char类型
create table w0case(w_test char(200));
insert into w0case values('111');
insert into w0case values('a');
insert into w0case values('a11');
insert into w0case values('33.4456456142f');
insert into w0case values('-33.445645614245d');
select round(sin(w_test),5) from w0case where w_test = '111';
round(sin(w_test),5)
-0.86455
select sin(w_test) from w0case where w_test = 'a';
sin(w_test)
0
select sin(w_test) from w0case where w_test = 'a11';
sin(w_test)
0
select sin(w_test) from w0case where w_test = '33.4456456142f';
sin(w_test)
0.8965302199437287
select sin(w_test) from w0case where w_test = '-33.445645614245d';
sin(w_test)
-0.896530219923792
drop table w0case;
# obmysql-sin varchar type
create table w0case(w_test varchar(100));
insert into w0case values('111');
insert into w0case values('33.4456456142f');
insert into w0case values('-33.445645614245d');
select round(sin(w_test),5) from w0case where w_test = '111';
round(sin(w_test),5)
-0.86455
select sin(w_test) from w0case where w_test = '33.4456456142f';
sin(w_test)
0.8965302199437287
select sin(w_test) from w0case where w_test = '-33.445645614245d';
sin(w_test)
-0.896530219923792
# obmysql date/datetime/interval type
SELECT ROUND(sin('20200601'),5) FROM dual;
ROUND(sin('20200601'),5)
-0.01619
SELECT sin('2020-06-01') FROM dual;
sin('2020-06-01')
0.04406198834392301
Warnings:
Warning	1292	Truncated incorrect DOUBLE value: '2020-06-01'
select sin('2020:06:01') from  dual;
sin('2020:06:01')
0.04406198834392301
Warnings:
Warning	1292	Truncated incorrect DOUBLE value: '2020:06:01'
select ROUND(sin('20191001030204'),5) from dual;
ROUND(sin('20191001030204'),5)
-0.11109
select sin('2020-06-01 03:02:05') from dual;
sin('2020-06-01 03:02:05')
0.04406198834392301
Warnings:
Warning	1292	Truncated incorrect DOUBLE value: '2020-06-01 03:02:05'
drop table w0case;
# obmysql number type
CREATE TABLE w0case(w_test decimal(38,10));
INSERT INTO w0case VALUES (222);
INSERT INTO w0case VALUES (33.4);
INSERT INTO w0case VALUES(335.11111);
SELECT ROUND(sin(W_TEST),5) FROM W0CASE WHERE W_TEST = 222;
ROUND(sin(W_TEST),5)
0.86895
SELECT ROUND(sin(W_TEST),5) FROM W0CASE WHERE W_TEST = 33.4;
ROUND(sin(W_TEST),5)
0.91581
SELECT ROUND(sin(W_TEST),5) FROM W0CASE WHERE W_TEST = 335.11111;
ROUND(sin(W_TEST),5)
0.86205
SELECT ROUND(sin(-1.0e-130)) FROM dual;
ROUND(sin(-1.0e-130))
-0
SELECT sin(1.0e+126) FROM dual;
sin(1.0e+126)
-0.25428200452348076
# mysql及ob在超越边界值是返回值为0
SELECT sin(-1.0e-131) FROM dual;
sin(-1.0e-131)
-1e-131
# mysql返回未0，ob返回为数值
SELECT sin(1.0e+125) FROM dual;
sin(1.0e+125)
-0.7936390149319654
DROP TABLE W0CASE;
CREATE TABLE W0CASE(w_test varchar(100));
INSERT INTO W0CASE values('12h3');
DROP TABLE W0CASE;
# obmysql blob type
CREATE TABLE W0CASE(w_test blob);
INSERT INTO W0CASE VALUES ('123');
SELECT ROUND(sin(w_test)) FROM W0CASE;
ROUND(sin(w_test))
-0
DROP TABLE W0CASE;
# obmysql 特殊符号，空格等
SELECT sin(1 23) FROM dual;
ERROR 42000: You have an error in your SQL syntax; check the manual that corresponds to your OceanBase version for the right syntax to use near '23) FROM dual' at line 1
SELECT sin(123%) FROM dual;
ERROR 42000: You have an error in your SQL syntax; check the manual that corresponds to your OceanBase version for the right syntax to use near ') FROM dual' at line 1
# obmysql 函数嵌套
SELECT ROUND(sin(45),5) FROM dual;
ROUND(sin(45),5)
0.85090
SELECT sin(sin(12)) FROM dual;
sin(sin(12))
-0.5111935401915899
SELECT sin(MOD(11,4)) FROM dual;
sin(MOD(11,4))
0.1411200080598672
SELECT sin(POWER(3,2)) FROM  dual;
sin(POWER(3,2))
0.4121184852417566
# obmysql 多级函数嵌套/被嵌套
SELECT ROUND(POWER(sin(15),2),5) FROM dual;
ROUND(POWER(sin(15),2),5)
0.42287
SELECT ROUND(sin(POWER(2,3)),5) FROM dual WHERE sin(POWER(2,3))>sin(POWER(2,4));
ROUND(sin(POWER(2,3)),5)
0.98936
SELECT ROUND(POWER(ROUND(ATAN(ROUND(sin(45),5)),5),2),5) FROM dual;
ROUND(POWER(ROUND(ATAN(ROUND(sin(45),5)),5),2),5)
0.49705
SELECT sin(ROUND(POWER(ROUND(ATAN(ROUND(sin(45),5)),5),2),5)) FROM dual;
sin(ROUND(POWER(ROUND(ATAN(ROUND(sin(45),5)),5),2),5))
0.4768345877027009
SELECT ROUND(sin(POWER(2,3)),5) FROM dual WHERE sin(45) = sin(45);
ROUND(sin(POWER(2,3)),5)
0.98936
SELECT sin(CAST('2019-05-20' AS DATE)) FROM dual;
sin(CAST('2019-05-20' AS DATE))
0.377428340759817
SELECT sin(CAST('19.2' as decimal(10,2))) FROM dual;
sin(CAST('19.2' as decimal(10,2)))
0.3433149288198954
# obmysql 基础运算
SELECT sin(235-123) FROM dual;
sin(235-123)
-0.8899956043668333
SELECT sin(12*12) FROM dual;
sin(12*12)
-0.49102159389846933
SELECT sin(12+12) FROM dual;
sin(12+12)
-0.9055783620066239
SELECT sin(12/12) FROM dual;
sin(12/12)
0.8414709848078965
SELECT sin(POWER(2,3)+POWER(2,2)) FROM dual;
sin(POWER(2,3)+POWER(2,2))
-0.5365729180004349
CREATE TABLE w0case(w_test decimal(38,10));
INSERT INTO w0case VALUES(0);
INSERT INTO w0case VALUES(1);
INSERT INTO w0case VALUES(2);
INSERT INTO w0case VALUES(3);
SELECT sin(w_test) FROM w0case WHERE w_test IS NULL;
sin(w_test)
SELECT sin(w_test) FROM w0case WHERE w_test IS NOT NULL;
sin(w_test)
0
0.8414709848078965
0.9092974268256817
0.1411200080598672
SELECT sin(w_test) FROM w0case WHERE w_test IN (0,1,2,3,4);
sin(w_test)
0
0.8414709848078965
0.9092974268256817
0.1411200080598672
SELECT sin(w_test) FROM w0case WHERE w_test NOT IN (4,5,6);
sin(w_test)
0
0.8414709848078965
0.9092974268256817
0.1411200080598672
SELECT sin(w_test) FROM w0case WHERE w_test BETWEEN 0 AND 4;
sin(w_test)
0
0.8414709848078965
0.9092974268256817
0.1411200080598672
SELECT sin(w_test) FROM w0case WHERE w_test NOT BETWEEN 4 AND 6;
sin(w_test)
0
0.8414709848078965
0.9092974268256817
0.1411200080598672
DROP TABLE W0CASE;
# obmysql sin特殊值
SELECT TAN(0 * 3.14159265359/180) FROM dual;
TAN(0 * 3.14159265359/180)
0
SELECT TAN(45 * 3.14159265359/180) FROM dual;
TAN(45 * 3.14159265359/180)
1.0000000000001035
SELECT TAN(90 * 3.14159265359/180) FROM dual;
TAN(90 * 3.14159265359/180)
-9670099380792.184
SELECT TAN(180 * 3.14159265359/180) FROM dual;
TAN(180 * 3.14159265359/180)
0.00000000000020682310711021444
SELECT TAN(270 * 3.14159265359/180) FROM dual;
TAN(270 * 3.14159265359/180)
-3227987202133.868
SELECT TAN(360 * 3.14159265359/180) FROM dual;
TAN(360 * 3.14159265359/180)
0.0000000000004136462142204289
# obmysql 静态sql
# obmysql select operation
CREATE TABLE w0case(w_test0 decimal(38,10),w_test1 varchar(11));
# 空值查询
SELECT sin(W_TEST0) FROM W0CASE;
sin(W_TEST0)
INSERT INTO w0case VALUES(0,'a');
# 单值查询
SELECT sin(w_test0) FROM w0case;
sin(w_test0)
0
INSERT INTO w0case VALUES(1,'b');
INSERT INTO w0case VALUES(2,'c');
INSERT INTO w0case VALUES(3,'d');
INSERT INTO w0case VALUES(4,'e');
INSERT INTO w0case VALUES(5,'f');
INSERT INTO w0case VALUES(15,'15');
INSERT INTO w0case VALUES(15,'15f');
# 多值查询
SELECT sin(w_test0) FROM w0case;
sin(w_test0)
0
0.8414709848078965
0.9092974268256817
0.1411200080598672
-0.7568024953079282
-0.9589242746631385
0.6502878401571168
0.6502878401571168
# group by having
SELECT sin(w_test0) FROM W0CASE GROUP BY w_test0;
sin(w_test0)
0
0.8414709848078965
0.9092974268256817
0.1411200080598672
-0.7568024953079282
-0.9589242746631385
0.6502878401571168
SELECT sin(w_test0),w_test1 FROM W0CASE GROUP BY w_test0,w_test1 HAVING w_test1 = 'c';
sin(w_test0)	w_test1
0.9092974268256817	c
SELECT sin(w_test0),w_test1 FROM W0CASE GROUP BY w_test0,w_test1 HAVING w_test1 IN ('a','b','c');
sin(w_test0)	w_test1
0	a
0.8414709848078965	b
0.9092974268256817	c
SELECT sin(w_test0),w_test1 FROM W0CASE GROUP BY w_test0,w_test1 HAVING w_test0 BETWEEN 0 AND 4;
sin(w_test0)	w_test1
0	a
0.8414709848078965	b
0.9092974268256817	c
0.1411200080598672	d
-0.7568024953079282	e
SELECT sin(w_test0),w_test1 FROM W0CASE GROUP BY w_test0,w_test1 HAVING sin(w_test0)>0;
sin(w_test0)	w_test1
0.8414709848078965	b
0.9092974268256817	c
0.1411200080598672	d
0.6502878401571168	15
0.6502878401571168	15f
SELECT sin(w_test0),sin(w_test1) FROM W0CASE GROUP BY w_test0,w_test1 HAVING sin(w_test0)>0 AND w_test1 NOT IN('a','b','c','d','e','f') ;
sin(w_test0)	sin(w_test1)
0.6502878401571168	0.6502878401571168
0.6502878401571168	0.6502878401571168
Warnings:
Warning	1292	Truncated incorrect DOUBLE value: '15f'
SELECT sin(w_test0),sin(w_test1) FROM W0CASE GROUP BY w_test0,w_test1 HAVING w_test1 NOT IN('a','b','c','d','e','f','15') ;
sin(w_test0)	sin(w_test1)
0.6502878401571168	0.6502878401571168
Warnings:
Warning	1292	Truncated incorrect DOUBLE value: '15f'
# order by 
SELECT sin(w_test0) FROM W0CASE ORDER BY w_test0;
sin(w_test0)
0
0.8414709848078965
0.9092974268256817
0.1411200080598672
-0.7568024953079282
-0.9589242746631385
0.6502878401571168
0.6502878401571168
SELECT sin(w_test0) FROM W0CASE ORDER BY w_test0 DESC;
sin(w_test0)
0.6502878401571168
0.6502878401571168
-0.9589242746631385
-0.7568024953079282
0.1411200080598672
0.9092974268256817
0.8414709848078965
0
SELECT sin(w_test0) FROM W0CASE ORDER BY w_test0 ASC;
sin(w_test0)
0
0.8414709848078965
0.9092974268256817
0.1411200080598672
-0.7568024953079282
-0.9589242746631385
0.6502878401571168
0.6502878401571168
SELECT sin(w_test0),w_test1 FROM W0CASE ORDER BY w_test1;
sin(w_test0)	w_test1
0.6502878401571168	15
0.6502878401571168	15f
0	a
0.8414709848078965	b
0.9092974268256817	c
0.1411200080598672	d
-0.7568024953079282	e
-0.9589242746631385	f
SELECT sin(w_test0),w_test1 FROM W0CASE ORDER BY w_test1 DESC;
sin(w_test0)	w_test1
-0.9589242746631385	f
-0.7568024953079282	e
0.1411200080598672	d
0.9092974268256817	c
0.8414709848078965	b
0	a
0.6502878401571168	15f
0.6502878401571168	15
SELECT sin(w_test0),w_test1 FROM W0CASE ORDER BY w_test1 ASC;
sin(w_test0)	w_test1
0.6502878401571168	15
0.6502878401571168	15f
0	a
0.8414709848078965	b
0.9092974268256817	c
0.1411200080598672	d
-0.7568024953079282	e
-0.9589242746631385	f
SELECT sin(w_test0),w_test1 FROM W0CASE GROUP BY w_test0,w_test1 HAVING sin(w_test0)>0 ORDER BY w_test0 DESC;
sin(w_test0)	w_test1
0.6502878401571168	15
0.6502878401571168	15f
0.1411200080598672	d
0.9092974268256817	c
0.8414709848078965	b
# case when
SELECT CASE w_test0 WHEN 5 THEN sin(w_test0)+100 END AS si FROM W0CASE;
si
NULL
NULL
NULL
NULL
NULL
99.04107572533687
NULL
NULL
SELECT sin(CASE WHEN w_test0<100 THEN sin(w_test0) END)+sin(45) AS si FROM W0CASE;
si
0.8509035245341184
1.5965276661996763
1.639975868107007
0.9915556013205618
0.16430326379549354
0.03232938007239916
1.4563190500822079
1.4563190500822079
SELECT sin(CASE WHEN w_test0>100 THEN sin(w_test0) ELSE 100 END)/sin(10) AS si FROM W0CASE;
si
0.9307830725207492
0.9307830725207492
0.9307830725207492
0.9307830725207492
0.9307830725207492
0.9307830725207492
0.9307830725207492
0.9307830725207492
# distinct
SELECT DISTINCT sin(w_test0),w_test1 FROM W0CASE;
sin(w_test0)	w_test1
0	a
0.8414709848078965	b
0.9092974268256817	c
0.1411200080598672	d
-0.7568024953079282	e
-0.9589242746631385	f
0.6502878401571168	15
0.6502878401571168	15f
DROP TABLE W0CASE;
# obmysql insert operation
CREATE TABLE W0CASE(w_test varchar(100));
# 插入单条语句
INSERT INTO W0CASE VALUES(DEFAULT);
INSERT INTO W0CASE SELECT sin(10) FROM dual;
INSERT INTO W0CASE SELECT sin(10)*2 FROM dual;
INSERT INTO W0CASE SELECT sin(10)/2 FROM dual;
DROP TABLE W0CASE;
# obmysql DELETE operation
CREATE TABLE w0case(w_test varchar(100));
INSERT INTO w0case VALUES ('100');
# 单行/多行
DELETE FROM W0CASE we WHERE sin(we.w_test)<sin(20) ;
# where
INSERT INTO w0case VALUES ('500');
DELETE FROM w0case WHERE sin(w_test) = (SELECT sin(w_test) FROM W0CASE WHERE w_test >ROUND(sin(W_TEST ),5) GROUP BY W_TEST HAVING ROUND(sin(W_TEST ),6 )>0 ) ;
INSERT INTO w0case VALUES ('400');
INSERT INTO w0case VALUES ('300');
DELETE FROM W0CASE WHERE sin(W_TEST) > ( SELECT * FROM ( SELECT MIN(sin(W_TEST ) ) FROM W0CASE WHERE sin(W_TEST ) < 100 ORDER BY sin(W_TEST ) ) );
INSERT INTO w0case VALUES ('200');
DELETE FROM W0CASE WHERE sin(W_TEST ) IN (SELECT sin(W_TEST ) FROM W0CASE );
INSERT INTO w0case VALUES ('800');
DELETE FROM W0CASE WHERE sin(W_TEST) = ( SELECT sin(W_TEST) FROM ( SELECT * FROM W0CASE ORDER BY sin(W_TEST ) DESC ));
DROP TABLE IF EXISTS W0CASE;
DROP TABLE IF EXISTS w1case;
Warnings:
Note	1051	Unknown table 'sin_test.w1case'
# obmysql dual operation
SELECT sin(45) * sin(45) FROM dual;
sin(45) * sin(45)
0.7240368080645851
SELECT sin(45) / sin(45) FROM dual;
sin(45) / sin(45)
1
SELECT sin(45) + sin(45) FROM dual;
sin(45) + sin(45)
1.7018070490682369
SELECT sin(45) - sin(45) FROM dual;
sin(45) - sin(45)
0
# cleanup
drop database sin_test;
