drop database  IF EXISTS  db1;
create database db1;
use db1;
SET wait_timeout=30000000;
SET ob_trx_timeout = 30000000;
SET ob_query_timeout = 30000000;
##设置相同sql_mode;
SET @@sql_mode='STRICT_TRANS_TABLES,NO_ENGINE_SUBSTITUTION,no_zero_date,no_zero_in_date,PIPES_AS_CONCAT';
##mv_name
##中文
create table t1 (c1 int primary key, c2 int);
create materialized view 中文123  as select * from t1 ;
desc 中文123;
Field	Type	Null	Key	Default	Extra
c1	int(11)	YES		NULL	
c2	int(11)	YES		NULL	
desc t1;
Field	Type	Null	Key	Default	Extra
c1	int(11)	NO	PRI	NULL	
c2	int(11)	YES		NULL	
drop table t1;
drop materialized view 中文123;
##数字
create table t1 (c1 int primary key, c2 int);
create materialized view 123  as select * from t1 ;
ERROR 42000: You have an error in your SQL syntax; check the manual that corresponds to your OceanBase version for the right syntax to use near '123  as select * from t1' at line 1
##字符
drop table t1;
create table t1 (c1 int primary key, c2 int);
create materialized view àáâãäåæçèéêëìíîïðñòóôõö  as select * from t1 ;
desc àáâãäåæçèéêëìíîïðñòóôõö;
Field	Type	Null	Key	Default	Extra
c1	int(11)	YES		NULL	
c2	int(11)	YES		NULL	
desc t1;
Field	Type	Null	Key	Default	Extra
c1	int(11)	NO	PRI	NULL	
c2	int(11)	YES		NULL	
drop materialized view àáâãäåæçèéêëìíîïðñòóôõö;
drop table t1;
create table t1 (c1 int primary key, c2 int);
create materialized view 中文ing123  as select * from t1 ;
desc 中文ing123;
Field	Type	Null	Key	Default	Extra
c1	int(11)	YES		NULL	
c2	int(11)	YES		NULL	
desc t1;
Field	Type	Null	Key	Default	Extra
c1	int(11)	NO	PRI	NULL	
c2	int(11)	YES		NULL	
drop materialized view 中文ing123;
##关键字
drop table t1;
create table t1 (c1 int primary key, c2 int);
create materialized view max  as select * from t1 ;
desc max;
Field	Type	Null	Key	Default	Extra
c1	int(11)	YES		NULL	
c2	int(11)	YES		NULL	
desc t1;
Field	Type	Null	Key	Default	Extra
c1	int(11)	NO	PRI	NULL	
c2	int(11)	YES		NULL	
drop table t1;
drop materialized view max;
##繁体字
create table t1 (c1 int primary key, c2 int);
create materialized view 蘩騠  as select * from t1 ;
desc 蘩騠;
Field	Type	Null	Key	Default	Extra
c1	int(11)	YES		NULL	
c2	int(11)	YES		NULL	
desc t1;
Field	Type	Null	Key	Default	Extra
c1	int(11)	NO	PRI	NULL	
c2	int(11)	YES		NULL	
drop table t1;
drop materialized view 蘩騠;
##已存在name
create table t1 (c1 int primary key, c2 int);
create materialized view 蘩騠  as select * from t1 ;
create materialized view 蘩騠  as select c1 from t1 ;
ERROR 42S01: Table '蘩騠' already exists
drop table t1;
drop materialized view 蘩騠;
##datatypes
##验证所有数据类型创建物化视图
CREATE TABLE my_table (
int_col INT,
bigint_col BIGINT,
mediumint_col MEDIUMINT,
smallint_col SMALLINT,
tinyint_col TINYINT,
bit_col BIT,
float_col FLOAT(6, 2),
double_col DOUBLE(6, 2),
decimal_col DECIMAL(6, 2),
char_col CHAR(10),
varchar_col VARCHAR(255),
blob_col BLOB,
text_col TEXT,
enum_col ENUM('Value1', 'Value2', 'Value3'),
set_col SET('Option1', 'Option2', 'Option3'),
date_col DATE,
datetime_col DATETIME,
timestamp_col TIMESTAMP,
time_col TIME,
year_col YEAR
);
create materialized view mv1    as select * from my_table ;
##创建存储过程插入一千条数据
CREATE PROCEDURE insert_random_data()
BEGIN
DECLARE counter INT DEFAULT 0;
WHILE counter < 10000 DO
INSERT INTO my_table (int_col, bigint_col, mediumint_col, smallint_col, tinyint_col, bit_col, float_col, double_col, decimal_col, char_col, varchar_col, blob_col, text_col, enum_col, set_col, date_col, datetime_col, timestamp_col, time_col, year_col)
VALUES (FLOOR(RAND() * 1000), FLOOR(RAND() * 10000000), FLOOR(RAND() * 5000), FLOOR(RAND() * 1000), FLOOR(RAND() * 10), FLOOR(RAND() + 0.5), RAND(), RAND(), RAND(), 'RandomChar', CONCAT('Random', FLOOR(RAND() * 1000)), 'RandomBlob', 'RandomText', ELT(FLOOR(RAND() * 3) + 1, 'Value1', 'Value2', 'Value3'), ELT(FLOOR(RAND() * 3) + 1, 'Option1', 'Option2', 'Option3'), CURDATE() - INTERVAL FLOOR(RAND() * 365) DAY, NOW() - INTERVAL FLOOR(RAND() * 365) DAY, CURRENT_TIMESTAMP, SEC_TO_TIME(FLOOR(RAND() * 86400)), YEAR(CURDATE() - INTERVAL FLOOR(RAND() * 100) YEAR));
SET counter = counter + 1;
END WHILE;
SELECT 'Random data insertion completed.' AS Result;
END //
CALL insert_random_data();
Result
Random data insertion completed.
call DBMS_MVIEW.REFRESH('mv1');
select count(*) from my_table;
count(*)
10000
select count(*) from mv1;
count(*)
10000
##int
drop  materialized view mv1;
create table t1 (c1 int primary key, c2 int);
create materialized view mv1  as select * from t1 ;
insert into t1 values(1,2);
insert into t1 values(2,null);
insert into t1 values(4,2);
update t1 set c1= 5 where c2 is null;
delete  from t1  where c2 is not null ;
call DBMS_MVIEW.REFRESH('mv1');
select * from t1 order by c1;
c1	c2
5	NULL
select * from mv1 order by c1;
c1	c2
5	NULL
##bigint
drop table t1;
drop  materialized view mv1;
create table t1 (c1 bigint primary key, c2 bigint);
create materialized view mv1  as select * from t1 ;
insert into t1 values(111111111111111,222222222);
insert into t1 values(22222222222,null);
insert into t1 values(44444444444444444,2222222222222);
update t1 set c1= 55555555555555 where c2 is null;
delete  from t1  where c2 is not null ;
call DBMS_MVIEW.REFRESH('mv1');
select * from t1 order by c1;
c1	c2
55555555555555	NULL
select * from mv1 order by c1;
c1	c2
55555555555555	NULL
##MEDIUMINT
drop table t1;
drop  materialized view mv1;
create table t1 (c1 MEDIUMINT primary key, c2 MEDIUMINT);
create materialized view mv1  as select * from t1 ;
insert into t1 values(11111,222);
insert into t1 values(222222,null);
insert into t1 values(4444,2222222);
update t1 set c1= 5555555 where c2 is null;
delete  from t1  where c2 is not null ;
call DBMS_MVIEW.REFRESH('mv1');
select * from t1 order by c1;
c1	c2
5555555	NULL
select * from mv1 order by c1;
c1	c2
5555555	NULL
##SMALLINT
drop table t1;
drop  materialized view mv1;
create table t1 (c1 SMALLINT primary key, c2 SMALLINT);
create materialized view mv1  as select * from t1 ;
insert into t1 values(111,222);
insert into t1 values(2222,null);
insert into t1 values(4444,22222);
update t1 set c1= 5555 where c2 is null;
delete  from t1  where c2 is not null ;
call DBMS_MVIEW.REFRESH('mv1');
select * from t1 order by c1;
c1	c2
5555	NULL
select * from mv1 order by c1;
c1	c2
5555	NULL
##TINYINT
drop table t1;
drop  materialized view mv1;
create table t1 (c1 TINYINT primary key, c2 TINYINT);
create materialized view mv1  as select * from t1 ;
insert into t1 values(11,22);
insert into t1 values(12,null);
insert into t1 values(14,22);
update t1 set c1= 15 where c2 is null;
delete  from t1  where c2 is not null ;
call DBMS_MVIEW.REFRESH('mv1');
select * from t1 order by c1;
c1	c2
15	NULL
select * from mv1 order by c1;
c1	c2
15	NULL
##bit
drop table t1;
drop  materialized view mv1;
create table t1 (c1 bit(64) primary key, c2 bit(64));
create materialized view mv1  as select * from t1 ;
INSERT INTO t1 (c1, c2) VALUES (b'1', b'1');
INSERT INTO t1 (c1, c2) VALUES (1111, null);
INSERT INTO t1 (c1, c2) VALUES (1246, 4444);
update t1 set c1= b'1011' where c2 is null;
delete  from t1  where c2 ='4444' ;
call DBMS_MVIEW.REFRESH('mv1');
select bin(c1),bin(c2) from t1 order by c1;
bin(c1)	bin(c2)
1	1
1011	NULL
select bin(c1),bin(c2) from mv1 order by c1;
bin(c1)	bin(c2)
1	1
1011	NULL
##Float
drop table t1;
drop  materialized view mv1;
create table t1 (c1 Float(6,2) primary key, c2 Float(6,2));
create materialized view mv1  as select * from t1 ;
insert into t1 values(1.1,2.2);
insert into t1 values(1.2,null);
insert into t1 values(1.4,2.2);
update t1 set c1=abs(-111.595) where c2 is null;
delete  from t1  where c2 is not null ;
call DBMS_MVIEW.REFRESH('mv1');
select * from t1 order by c1;
c1	c2
111.60	NULL
select * from mv1 order by c1;
c1	c2
111.60	NULL
##Double
drop table t1;
drop  materialized view mv1;
create table t1 (c1 Double(6,2)primary key, c2 Double(6,2));
create materialized view mv1  as select * from t1 ;
insert into t1 values(1.1,2.2);
insert into t1 values(1.2,null);
insert into t1 values(1.4,2.2);
update t1 set c1=abs(-111.595) where c2 is null;
delete  from t1  where c1 =1.2 ;
call DBMS_MVIEW.REFRESH('mv1');
select * from t1 order by c1;
c1	c2
1.10	2.20
1.40	2.20
111.59	NULL
select * from mv1 order by c1;
c1	c2
1.10	2.20
1.40	2.20
111.59	NULL
##Decimal
drop table t1;
drop  materialized view mv1;
create table t1 (c1 Decimal(6,2)primary key, c2 Decimal(6,2));
create materialized view mv1  as select max(c1) from t1 ;
insert into t1 values(1.21,2.2);
insert into t1 values(1.12,null);
insert into t1 values(1.42,2.2);
update t1 set c1=abs(-111.595) where c2 is null;
Warnings:
Warning	1265	Data truncated for column 'c1' at row 1
delete  from t1  where c2 =1.42 ;
call DBMS_MVIEW.REFRESH('mv1');
select * from t1 order by c1;
c1	c2
1.21	2.20
1.42	2.20
111.60	NULL
select * from mv1;
max(c1)
111.60
##char
drop table t1;
drop  materialized view mv1;
create table t1 (c1 char(20)primary key, c2 char(20));
create materialized view mv1  as select cast(c1 as char(5)) c1 from t1 ;
insert into t1 values('中文ing123','null');
insert into t1 values('蘩騠字','@!#%$');
insert into t1 values('蘩騠字ss',null);
update t1 set c2=abs(-111.595) where c2 is null;
delete  from t1  where c1 ='蘩騠字' ;
call DBMS_MVIEW.REFRESH('mv1');
ERROR 22007: Incorrect value
select * from t1 order by c1;
c1	c2
中文ing123	null
蘩騠字ss	111.595
select * from mv1;
c1
##VARCHAR
drop table t1;
drop  materialized view mv1;
create table t1 (c1 VARCHAR(20)primary key, c2 VARCHAR(20));
create materialized view mv1  as select *  from t1 ;
insert into t1 values('中文ing123','null');
insert into t1 values('蘩騠字','@!#%$');
insert into t1 values('蘩騠字ss',null);
update t1 set c2=abs(-111.595) where c2 is null;
delete  from t1  where c1 ='蘩騠字' ;
call DBMS_MVIEW.REFRESH('mv1');
select * from t1 order by c1;
c1	c2
中文ing123	null
蘩騠字ss	111.595
select * from mv1 order by c1;
c1	c2
中文ing123	null
蘩騠字ss	111.595
##BLOB
drop table t1;
drop  materialized view mv1;
create table t1 (c1 BLOB , c2 BLOB);
create materialized view mv1  as select *  from t1 ;
insert into t1 values('中文ing123','null');
insert into t1 values('蘩騠字','@!#%$');
insert into t1 values('蘩騠字ss',null);
update t1 set c2=abs(-111.595) where c2 is null;
delete  from t1  where c1 ='蘩騠字' ;
call DBMS_MVIEW.REFRESH('mv1','c');
select * from t1 order by c1;
c1	c2
中文ing123	null
蘩騠字ss	111.595
select * from mv1 order by c1;
c1	c2
中文ing123	null
蘩騠字ss	111.595
##TEXT
drop table t1;
drop  materialized view mv1;
create table t1 (c1 TEXT , c2 TEXT);
create materialized view mv1  as select *  from t1 ;
insert into t1 values('中文ing123','null');
insert into t1 values('蘩騠字','@!#%$');
insert into t1 values('蘩騠字ss',null);
update t1 set c2=abs(-111.595) where c2 is null;
delete  from t1  where c1 ='蘩騠字' ;
call DBMS_MVIEW.REFRESH('mv1');
select * from t1 order by c1;
c1	c2
中文ing123	null
蘩騠字ss	111.595
select * from mv1 order by c1;
c1	c2
中文ing123	null
蘩騠字ss	111.595
##ENUM ##修改枚举类型中不存在的数据时刷新报错；
drop table t1;
drop  materialized view mv1;
create table t1 (c1 ENUM('中文ing123','蘩騠字','蘩騠字ss'), c2 ENUM('null','@!#%$','kasdhka'));
create materialized view mv1  as select *  from t1 ;
insert into t1 values('中文ing123','null');
insert into t1 values('蘩騠字','@!#%$');
insert into t1 values('蘩騠字ss',null);
update t1 set c2='kasdhka' where c2 is null;
delete  from t1  where c1 ='蘩騠字' ;
call DBMS_MVIEW.REFRESH('mv1');
select * from t1 order by c1;
c1	c2
中文ing123	null
蘩騠字ss	kasdhka
select * from mv1 order by c1;
c1	c2
中文ing123	null
蘩騠字ss	kasdhka
##SET
drop table t1;
drop  materialized view mv1;
create table t1 (c1 SET('中文ing123','蘩騠字','蘩騠字ss'), c2 SET('null','@!#%$','kasdhka'));
create materialized view mv1  as select *  from t1 ;
insert into t1 values('中文ing123','null');
insert into t1 values('蘩騠字','@!#%$');
insert into t1 values('蘩騠字ss',null);
update t1 set c2='kasdhka' where c2 is null;
delete  from t1  where c1 ='蘩騠字' ;
call DBMS_MVIEW.REFRESH('mv1');
select * from t1 order by c1;
c1	c2
中文ing123	null
蘩騠字ss	kasdhka
select * from mv1 order by c1;
c1	c2
中文ing123	null
蘩騠字ss	kasdhka
##date
drop table t1;
drop  materialized view mv1;
create table t1 (c1 date , c2 date);
create materialized view mv1  as select *  from t1 ;
INSERT INTO t1  VALUES (null, '2022-01-01');
INSERT INTO t1  VALUES ('0000-02-28', '0000-02-01');
call DBMS_MVIEW.REFRESH('mv1');
select * from t1 order by c1;
c1	c2
0000-02-28	0000-02-01
NULL	2022-01-01
select * from mv1 order by c1;
c1	c2
0000-02-28	0000-02-01
NULL	2022-01-01
##datetime
drop table t1;
drop  materialized view mv1;
create table t1 (c1 datetime , c2 datetime);
create materialized view mv1  as select *  from t1 ;
INSERT INTO t1  VALUES (null, '2022-01-01 10:12:01');
INSERT INTO t1  VALUES ('0000-02-28 23:59:59.9', '0000-02-01 23:59:59');
call DBMS_MVIEW.REFRESH('mv1');
select * from t1 order by c1;
c1	c2
0000-03-01 00:00:00	0000-02-01 23:59:59
NULL	2022-01-01 10:12:01
select * from mv1 order by c1;
c1	c2
0000-03-01 00:00:00	0000-02-01 23:59:59
NULL	2022-01-01 10:12:01
##timestamp
drop table t1;
drop  materialized view mv1;
create table t1 (c1 timestamp , c2 timestamp);
create materialized view mv1  as select *  from t1 ;
INSERT INTO t1  VALUES (null, '2022-01-01 10:12:01.119');
INSERT INTO t1  VALUES ('0000-02-28 23:59:59.9', '0000-02-01 23:59:59.333');
INSERT INTO t1  VALUES ('0000-02-28 23:59:59.999999', null);
call DBMS_MVIEW.REFRESH('mv1');
select * from t1 order by c1;
c1	c2
0000-03-01 00:00:00	0000-02-01 23:59:59
0000-03-01 00:00:00	NULL
NULL	2022-01-01 10:12:01
select * from mv1 order by c1;
c1	c2
0000-03-01 00:00:00	0000-02-01 23:59:59
0000-03-01 00:00:00	NULL
NULL	2022-01-01 10:12:01
##time
drop table t1;
drop  materialized view mv1;
create table t1 (c1 time , c2 time);
create materialized view mv1  as select *  from t1 ;
INSERT INTO t1  VALUES (null, '10:12:01.119');
INSERT INTO t1  VALUES ('23:59:59.9', '23:59:59.333');
INSERT INTO t1  VALUES ('23:59:59.999999', null);
call DBMS_MVIEW.REFRESH('mv1');
select * from t1 order by c1;
c1	c2
24:00:00	23:59:59
24:00:00	NULL
NULL	10:12:01
select * from mv1 order by c1;
c1	c2
24:00:00	23:59:59
24:00:00	NULL
NULL	10:12:01
##year
drop table t1;
drop  materialized view mv1;
create table t1 (c1 year , c2 year);
create materialized view mv1  as select *  from t1 ;
INSERT INTO t1  VALUES (null, 2023);
INSERT INTO t1  VALUES (0000, 2155);
INSERT INTO t1  VALUES (1970, null);
call DBMS_MVIEW.REFRESH('mv1');
select * from t1 order by c1;
c1	c2
0000	2155
1970	NULL
NULL	2023
select * from mv1 order by c1;
c1	c2
0000	2155
1970	NULL
NULL	2023
##对物化视图的基表做相应的DDL操作
##创建索引
DROP TABLE t1;
DROP MATERIALIZED VIEW mv1;
CREATE TABLE t1 (
id int,
name VARCHAR(100),
age int,
email VARCHAR(100),
created_date TIMESTAMP
);
CREATE MATERIALIZED VIEW mv1  AS SELECT * FROM t1;
CREATE INDEX index_name ON mv1 (name);
show index from mv1;
Table	Non_unique	Key_name	Seq_in_index	Column_name	Collation	Cardinality	Sub_part	Packed	Null	Index_type	Comment	Index_comment	Visible	Expression
mv1	1	index_name	1	name	A	NULL	NULL	NULL	YES	BTREE	available		YES	NULL
INSERT INTO t1 (id, name, age, email, created_date) VALUES (1, 'John', 25, 'john@example.com', '1970-01-01 10:10:10');
INSERT INTO t1 (id, name, age, email, created_date) VALUES (2, 'Jane', 30, 'jane@example.com', '2023-11-10 23:59:59');
INSERT INTO t1 (id, name, age, email, created_date) VALUES (3, 'Je', 39, 'Je@example.com', null);
UPDATE t1 SET name = 'John Doe' WHERE id = 1;
DELETE FROM t1 WHERE created_date is null;
call DBMS_MVIEW.REFRESH('mv1');
select * from t1 order by id;
id	name	age	email	created_date
1	John Doe	25	john@example.com	1970-01-01 10:10:10
2	Jane	30	jane@example.com	2023-11-10 23:59:59
select * from mv1 order by id;
id	name	age	email	created_date
1	John Doe	25	john@example.com	1970-01-01 10:10:10
2	Jane	30	jane@example.com	2023-11-10 23:59:59
##增加索引
DROP TABLE t1;
DROP MATERIALIZED VIEW mv1;
CREATE TABLE t1 (
id int,
name VARCHAR(100),
age int,
email VARCHAR(100),
created_date TIMESTAMP
);
CREATE MATERIALIZED VIEW mv1  AS SELECT * FROM t1;
ALTER TABLE t1 ADD INDEX idx1(email);
INSERT INTO t1 (id, name, age, email, created_date) VALUES (1, 'John', 25, 'john@example.com', '1970-01-01 10:10:10');
INSERT INTO t1 (id, name, age, email, created_date) VALUES (2, 'Jane', 30, 'jane@example.com', '2023-11-10 23:59:59');
INSERT INTO t1 (id, name, age, email, created_date) VALUES (3, 'Je', 39, 'Je@example.com', null);
UPDATE t1 SET name = 'John Doe' WHERE id = 1;
DELETE FROM t1 WHERE created_date is null;
call DBMS_MVIEW.REFRESH('mv1');
select * from t1 order by id;
id	name	age	email	created_date
1	John Doe	25	john@example.com	1970-01-01 10:10:10
2	Jane	30	jane@example.com	2023-11-10 23:59:59
select * from mv1 order by id;
id	name	age	email	created_date
1	John Doe	25	john@example.com	1970-01-01 10:10:10
2	Jane	30	jane@example.com	2023-11-10 23:59:59
##删除索引
DROP TABLE t1;
DROP MATERIALIZED VIEW mv1;
CREATE TABLE t1 (
id int,
name VARCHAR(100),
age int,
email VARCHAR(100),
created_date TIMESTAMP,
CONSTRAINT pk_my_table PRIMARY KEY (id),
CONSTRAINT idx_name UNIQUE (name)
);
CREATE MATERIALIZED VIEW mv1  AS SELECT * FROM t1;
CREATE INDEX index_name ON mv1 (name);
show index from mv1;
Table	Non_unique	Key_name	Seq_in_index	Column_name	Collation	Cardinality	Sub_part	Packed	Null	Index_type	Comment	Index_comment	Visible	Expression
mv1	1	index_name	1	name	A	NULL	NULL	NULL	YES	BTREE	available		YES	NULL
drop index index_name on mv1;
show index from mv1;
Table	Non_unique	Key_name	Seq_in_index	Column_name	Collation	Cardinality	Sub_part	Packed	Null	Index_type	Comment	Index_comment	Visible	Expression
INSERT INTO t1 (id, name, age, email, created_date) VALUES (1, 'John', 25, 'john@example.com', '1970-01-01 10:10:10');
INSERT INTO t1 (id, name, age, email, created_date) VALUES (2, 'Jane', 30, 'jane@example.com', '2023-11-10 23:59:59');
INSERT INTO t1 (id, name, age, email, created_date) VALUES (3, 'Je', 39, 'Je@example.com', null);
UPDATE t1 SET name = 'John Doe' WHERE id = 1;
DELETE FROM t1 WHERE created_date is null;
call DBMS_MVIEW.REFRESH('mv1');
select * from t1 order by id;
id	name	age	email	created_date
1	John Doe	25	john@example.com	1970-01-01 10:10:10
2	Jane	30	jane@example.com	2023-11-10 23:59:59
select * from mv1 order by id;
id	name	age	email	created_date
1	John Doe	25	john@example.com	1970-01-01 10:10:10
2	Jane	30	jane@example.com	2023-11-10 23:59:59
##重命名索引--mysql不支持
DROP TABLE t1;
DROP MATERIALIZED VIEW mv1;
CREATE TABLE t1 (
id int,
name VARCHAR(100),
age int,
email VARCHAR(100),
created_date TIMESTAMP
);
CREATE MATERIALIZED VIEW mv1  AS SELECT * FROM t1;
CREATE INDEX idx_name ON mv1 (name);
show index from mv1;
Table	Non_unique	Key_name	Seq_in_index	Column_name	Collation	Cardinality	Sub_part	Packed	Null	Index_type	Comment	Index_comment	Visible	Expression
mv1	1	idx_name	1	name	A	NULL	NULL	NULL	YES	BTREE	available		YES	NULL
##混合索引操作
DROP TABLE t1;
DROP MATERIALIZED VIEW mv1;
CREATE TABLE t1 (
id int,
name VARCHAR(100),
age int,
email VARCHAR(100),
created_date TIMESTAMP
);
CREATE MATERIALIZED VIEW mv1  AS SELECT * FROM t1;
CREATE INDEX idx_more ON mv1 (id, name, age);
show index from mv1;
Table	Non_unique	Key_name	Seq_in_index	Column_name	Collation	Cardinality	Sub_part	Packed	Null	Index_type	Comment	Index_comment	Visible	Expression
mv1	1	idx_more	1	id	A	NULL	NULL	NULL	YES	BTREE	available		YES	NULL
mv1	1	idx_more	2	name	A	NULL	NULL	NULL	YES	BTREE	available		YES	NULL
mv1	1	idx_more	3	age	A	NULL	NULL	NULL	YES	BTREE	available		YES	NULL
INSERT INTO t1 (id, name, age, email, created_date) VALUES (1, 'John', 25, 'john@example.com', '1970-01-01 10:10:10');
INSERT INTO t1 (id, name, age, email, created_date) VALUES (2, 'Jane', 30, 'jane@example.com', '2023-11-10 23:59:59');
INSERT INTO t1 (id, name, age, email, created_date) VALUES (3, 'Je', 39, 'Je@example.com', null);
UPDATE t1 SET name = 'John Doe' WHERE id = 1;
DELETE FROM t1 WHERE created_date is null;
call DBMS_MVIEW.REFRESH('mv1');
select * from t1 order by id;
id	name	age	email	created_date
1	John Doe	25	john@example.com	1970-01-01 10:10:10
2	Jane	30	jane@example.com	2023-11-10 23:59:59
select * from mv1 order by id;
id	name	age	email	created_date
1	John Doe	25	john@example.com	1970-01-01 10:10:10
2	Jane	30	jane@example.com	2023-11-10 23:59:59
##函数索引
DROP TABLE t1;
DROP MATERIALIZED VIEW mv1;
CREATE TABLE t1 (
id int,
name VARCHAR(100),
age int,
email VARCHAR(100),
created_date TIMESTAMP
);
CREATE MATERIALIZED VIEW mv1  AS SELECT * FROM t1;
CREATE INDEX idx_more ON mv1 ((upper(name)));
ERROR 0A000: use functional index on materialized view not supported
INSERT INTO t1 (id, name, age, email, created_date) VALUES (1, 'John', 25, 'john@example.com', '1970-01-01 10:10:10');
INSERT INTO t1 (id, name, age, email, created_date) VALUES (2, 'Jane', 30, 'jane@example.com', '2023-11-10 23:59:59');
INSERT INTO t1 (id, name, age, email, created_date) VALUES (3, 'Je', 39, 'Je@example.com', null);
INSERT INTO t1 (id, name, email, created_date) VALUES (3, 'Je', 'Je@example.com', '2025-10-11 10:11:11');
UPDATE t1 SET name = 'John Doe' WHERE id = 1;
DELETE FROM t1 WHERE created_date is null;
call DBMS_MVIEW.REFRESH('mv1');
select * from t1 order by id;
id	name	age	email	created_date
1	John Doe	25	john@example.com	1970-01-01 10:10:10
2	Jane	30	jane@example.com	2023-11-10 23:59:59
3	Je	NULL	Je@example.com	2025-10-11 10:11:11
select * from mv1 order by id;
id	name	age	email	created_date
1	John Doe	25	john@example.com	1970-01-01 10:10:10
2	Jane	30	jane@example.com	2023-11-10 23:59:59
3	Je	NULL	Je@example.com	2025-10-11 10:11:11
##列操作
##末尾增加列
DROP TABLE t1;
DROP MATERIALIZED VIEW mv1;
CREATE TABLE t1 (c1 int,c2 int);
CREATE MATERIALIZED VIEW mv1  AS SELECT c1,c2 FROM t1;
alter table t1 add c3 int;
CALL DBMS_MVIEW.REFRESH('mv1');
insert into t1 values(1,null,2);
insert into t1 values(null,2,3);
CALL DBMS_MVIEW.REFRESH('mv1');
update t1 set c1=99 where c3=3;
CALL DBMS_MVIEW.REFRESH('mv1');
select * from t1 order by c1;
c1	c2	c3
1	NULL	2
99	2	3
select * from mv1 order by c1;
c1	c2
1	NULL
99	2
##添加虚拟列
DROP TABLE t1;
DROP MATERIALIZED VIEW mv1;
CREATE TABLE t1 (c1 int,c2 int,c3 DECIMAL(4,2) AS (c1 * 0.1 * c2) VIRTUAL);
CREATE MATERIALIZED VIEW mv1  AS SELECT c1,c2,c3 FROM t1;
insert into t1(c1,c2) values(1,null);
insert into t1(c1,c2) values(null,2);
insert into t1(c1,c2) values(0,2);
CALL DBMS_MVIEW.REFRESH('mv1');
insert into t1(c1,c2) values(3,2);
CALL DBMS_MVIEW.REFRESH('mv1');
select * from t1 order by c1;
c1	c2	c3
0	2	0.00
1	NULL	NULL
3	2	0.60
NULL	2	NULL
select * from mv1 order by c1;
c1	c2	c3
0	2	0.00
1	NULL	NULL
3	2	0.60
NULL	2	NULL
##删除虚拟列
DROP TABLE t1;
DROP MATERIALIZED VIEW mv1;
CREATE TABLE t1 (c1 int,c2 int,c3 DECIMAL(4,2) AS (c1 * 0.1 * c2) VIRTUAL);
CREATE MATERIALIZED VIEW mv1  AS SELECT c1,c2,c3 FROM t1;
insert into t1(c1,c2) values(3,2);
CALL DBMS_MVIEW.REFRESH('mv1');
ALTER TABLE t1 drop column c3;
CALL DBMS_MVIEW.REFRESH('mv1');
ERROR 42S22: Unknown column 'db1.t1.c3' in 'field list'
insert into t1(c1,c2) values(1,null);
select * from t1 order by c1;
c1	c2
1	NULL
3	2
select * from mv1 order by c1;
c1	c2	c3
3	2	0.60
##修改列为null
DROP TABLE t1;
DROP MATERIALIZED VIEW mv1;
CREATE TABLE t1 (c1 int,c2 int);
CREATE MATERIALIZED VIEW mv1  AS SELECT c1,c2 FROM t1;
ALTER TABLE t1 MODIFY c1 int DEFAULT null;
insert into t1(c1,c2) values(1,null);
insert into t1(c1,c2) values(null,2);
insert into t1(c1,c2) values(0,2);
CALL DBMS_MVIEW.REFRESH('mv1');
select * from t1 order by c1;
c1	c2
0	2
1	NULL
NULL	2
select * from mv1 order by c1;
c1	c2
0	2
1	NULL
NULL	2
##设置默认值
DROP TABLE t1;
DROP MATERIALIZED VIEW mv1;
CREATE TABLE t1 (c1 int,c2 int);
insert into t1(c2) values(1);
CREATE MATERIALIZED VIEW mv1  AS SELECT c1,c2 FROM t1;
ALTER TABLE t1 MODIFY c1 int DEFAULT 10;
insert into t1(c2) values(3);
insert into t1(c2) values(null);
update t1 set c1 =999 where c2=1;
delete from t1 where c2 is null;
CALL DBMS_MVIEW.REFRESH('mv1');
select * from t1 order by c1;
c1	c2
10	3
999	1
select * from mv1 order by c1;
c1	c2
10	3
999	1
##修改列默认值
DROP TABLE t1;
DROP MATERIALIZED VIEW mv1;
CREATE TABLE t1 (c1 int DEFAULT 10,c2 int);
insert into t1(c2) values(1);
CREATE MATERIALIZED VIEW mv1  AS SELECT c1,c2 FROM t1;
ALTER TABLE t1 MODIFY c1 int DEFAULT 20;
insert into t1(c2) values(3);
insert into t1(c2) values(null);
update t1 set c1 =999 where c2=3;
insert into t1(c2) values(1);
CALL DBMS_MVIEW.REFRESH('mv1');
select * from t1 order by c1;
c1	c2
10	1
20	1
20	NULL
999	3
select * from mv1 order by c1;
c1	c2
10	1
20	1
20	NULL
999	3
##修改自增列值
DROP TABLE t1;
DROP MATERIALIZED VIEW mv1;
CREATE TABLE t1 (c1 int AUTO_INCREMENT PRIMARY KEY,c2 int);
CREATE MATERIALIZED VIEW mv1  AS SELECT c1,c2 FROM t1;
insert into t1(c2) values(3);
insert into t1(c2) values(null);
insert into t1(c2) values(0);
insert into t1(c2) values(99999);
insert into t1(c2) values(1);
update t1 set c1 =-99999999 where c2=3;
delete from t1 where c2 is null;
CALL DBMS_MVIEW.REFRESH('mv1');
select * from t1 order by c1;
c1	c2
-99999999	3
3	0
4	99999
5	1
select * from mv1 order by c1;
c1	c2
-99999999	3
3	0
4	99999
5	1
##重命名列 --不支持
DROP TABLE t1;
DROP MATERIALIZED VIEW mv1;
CREATE TABLE t1 (c1 int DEFAULT 10,c2 int);
CREATE MATERIALIZED VIEW mv1  AS SELECT * FROM t1;
ALTER TABLE t1 CHANGE COLUMN c1 cc1 int;
insert into t1 values(1,2);
insert into t1 values(null,2);
insert into t1(cc1) values(2);
CALL DBMS_MVIEW.REFRESH('mv1','c');
ERROR 42S22: Unknown column 'db1.t1.c1' in 'field list'
select * from t1 order by cc1;
cc1	c2
1	2
2	NULL
NULL	2
select * from mv1 order by c1;
c1	c2
##增加列类型长度或精度
DROP TABLE t1;
DROP MATERIALIZED VIEW mv1;
CREATE TABLE t1 (c1 int DEFAULT 10,c2 varchar(10));
CREATE MATERIALIZED VIEW mv1  AS SELECT c1,c2 FROM t1;
ALTER TABLE t1 MODIFY COLUMN c1 int(20);
insert into t1 values(1,2);
insert into t1 values(null,2);
insert into t1 values(2,9);
CALL DBMS_MVIEW.REFRESH('mv1','c');
select * from t1 order by c1;
c1	c2
1	2
2	9
NULL	2
select * from mv1 order by c1;
c1	c2
1	2
2	9
NULL	2
ALTER TABLE t1 MODIFY COLUMN c2 varchar(20);
CALL DBMS_MVIEW.REFRESH('mv1','c');
ERROR 0A000: refresh mv after column types change is not supported
##增加外键约束
DROP TABLE t1;
DROP MATERIALIZED VIEW mv1;
CREATE TABLE t1 (c1 int primary key,c2 int);
CREATE MATERIALIZED VIEW mv1  AS SELECT c1,c2 FROM t1;
alter table t1 add constraint fk_c2 foreign key(c2) references t1(c1);
insert into t1 values(10,10);
insert into t1 values(1,10);
insert into t1 values(2,null);
delete from t1 where c1 =1;
CALL DBMS_MVIEW.REFRESH('mv1');
select * from t1 order by c1;
c1	c2
10	10
2	NULL
select * from mv1 order by c1;
c1	c2
10	10
2	NULL
##删除外键约束
DROP TABLE t1;
DROP MATERIALIZED VIEW mv1;
CREATE TABLE t1 (c1 int primary key,c2 int,constraint fk_c2 foreign key(c2) references t1(c1));
CREATE MATERIALIZED VIEW mv1  AS SELECT c1,c2 FROM t1;
insert into t1 values(10,10);
insert into t1 values(1,10);
insert into t1 values(2,null);
delete from t1 where c2 is null;
CALL DBMS_MVIEW.REFRESH('mv1');
select * from t1 order by c1;
c1	c2
1	10
10	10
select * from mv1 order by c1;
c1	c2
1	10
10	10
alter table  t1 drop constraint fk_c2;
insert into t1 values(12,10);
delete from t1 where c2 = 10 limit 2;
CALL DBMS_MVIEW.REFRESH('mv1');
select * from t1 order by c1;
c1	c2
12	10
select * from mv1 order by c1;
c1	c2
12	10
##重命名表
DROP TABLE t1;
DROP MATERIALIZED VIEW mv1;
CREATE TABLE t1 (c1 int DEFAULT 10,c2 int);
CREATE MATERIALIZED VIEW mv1  AS SELECT c1,c2 FROM t1 t_t1;
alter table t1 rename to t_t1;
insert into t_t1 values(10,10);
insert into t_t1 values(1,10);
insert into t_t1 values(2,null);
delete from t_t1 where c2 is null;
CALL DBMS_MVIEW.REFRESH('mv1');
ERROR 42S02: Table 'db1.t1' doesn't exist
select * from t_t1 order by c1;
c1	c2
1	10
10	10
select * from mv1 order by c1;
c1	c2
##创建全量mv和增量mv后基表创建索引刷新会报错;
drop materialized view mv1;
create table t1 (c1 int primary key,c2 int );
insert into t1 select 999,999 from dual;
insert into t1 select 888,999 from dual;
create materialized view mv1 refresh complete on demand   as  select count(*) as cnt,c1 as c1 from t1 group by c1;
CALL DBMS_MVIEW.REFRESH('mv1','c');
select * from mv1 order by c1 ;
cnt	c1
1	888
1	999
create materialized view log on t1 parallel 9 with PRIMARY KEY,rowid,sequence(c2) including new values;
create materialized view mv2 refresh fast on demand   as  select count(*) as cnt,c1 as c1 from t1 group by c1;
CREATE INDEX idx_c2 ON t1 (c2);
CALL DBMS_MVIEW.REFRESH('mv2','f');
DROP MATERIALIZED VIEW LOG ON  t1;
select * from mv2 order by c1 ;
cnt	c1
1	888
1	999
select * from t1 order by c1 ;
c1	c2
888	999
999	999
##结合start with next
##后接null报错1210
drop materialized view mv1;
drop table t1;
create table t1 (c1 int ,c2 int);
create materialized view mv1  refresh complete  start with null next null as select c1,c2 from t1 ;
ERROR HY000: Incorrect arguments to datetime expression
##设置过短的时间
drop table t1;
create table t1 (c1 number ,c2 number);
create materialized view mv1  refresh complete  start with sysdate() + interval 1 second next sysdate() + interval 1 second  as select c1,c2 from t1 ;
insert into t1 values(10,10);
select * from t1;
c1	c2
10	10
select * from mv1;
c1	c2
drop materialized view mv1;
##next设置为错误值
drop table t1;
create table t1 (c1 number ,c2 number);
create materialized view mv1  refresh complete  start with sysdate() + interval 1 second next null as select c1,c2 from t1 ;
ERROR HY000: Incorrect arguments to datetime expression
create materialized view mv1  refresh complete  start with sysdate() + interval 1 second next '中文' as select c1,c2 from t1 ;
ERROR HY000: Incorrect arguments to datetime expression
##只使用start with
drop table t1;
create table t1 (c1 number ,c2 number);
create materialized view mv1  refresh complete  start with sysdate() + interval 1 second  as select c1,c2 from t1 ;
##start with +中文
drop materialized view mv1;
drop table t1;
create table t1 (c1 number ,c2 number);
create materialized view mv1  refresh complete  start with '中文'  as select c1,c2 from t1 ;
ERROR HY000: Incorrect arguments to datetime expression
##start with +数字
drop table t1;
create table t1 (c1 number ,c2 number);
create materialized view mv1  refresh complete  start with 24  as select c1,c2 from t1 ;
ERROR HY000: Incorrect arguments to datetime expression
##start with +字母
drop table t1;
create table t1 (c1 number ,c2 number);
create materialized view mv1  refresh complete  start with 'abc'  as select c1,c2 from t1 ;
ERROR HY000: Incorrect arguments to datetime expression
##start with +null
drop table t1;
create table t1 (c1 number ,c2 number);
create materialized view mv1  refresh complete  start with null  as select c1,c2 from t1 ;
ERROR HY000: Incorrect arguments to datetime expression
##start with +''
drop table t1;
create table t1 (c1 number ,c2 number);
create materialized view mv1  refresh complete  start with ''  as select c1,c2 from t1 ;
ERROR HY000: Incorrect arguments to datetime expression
##设置并行度
drop table t1;
create table t1 (c1 int ,c2 int);
create materialized view mv1 parallel 6 refresh complete  on demand  as select c1,c2 from t1 ;
##OB不支持修改
ALTER MATERIALIZED VIEW mv1 PARALLEL 2 ;
##全量刷新
drop materialized view mv1;
drop table t1;
create table t1 (c1 number ,c2 number);
create materialized view mv1  refresh complete on demand  as select c1,c2 from t1 ;
CREATE PROCEDURE insert_data()
BEGIN
DECLARE i INT DEFAULT 1;
WHILE i <= 10000 DO
INSERT INTO t1 (c1, c2) VALUES (i, i);
SET i = i + 1;
END WHILE;
SELECT 'Data inserted successfully.';
END 
//
CALL insert_data();
Data inserted successfully.
Data inserted successfully.
CALL DBMS_MVIEW.REFRESH('mv1','c');
select count(*) from t1;
count(*)
10000
select count(*) from mv1;
count(*)
10000
##增量刷新
SET @@sql_mode='';
drop materialized view mv1;
drop table t1;
create table t1 (c1 number,c2 number);
create materialized view log on t1 with rowid, sequence (c2) including new values ;
create materialized view mv1  REFRESH FAST ON demand  as select c2 as c2,count(*) e from t1 group by c2 ;
insert into t1 values(10,10);
insert into t1 values(1,10);
update t1 set c1 = '' where c1 = 1;
delete from t1 where c1 = '';
CALL DBMS_MVIEW.REFRESH('mv1','f');
select * from t1 order by c1;
c1	c2
10	10
select * from mv1 order by c2;
c2	e
10	1
select * from mlog$_t1 order by SEQUENCE$$;
c2	SEQUENCE$$	DMLTYPE$$	OLD_NEW$$	M_ROW$$
##基表dml操作对物化视图日志的影响
DROP MATERIALIZED VIEW LOG ON  t1;
drop table t1;
create table t1 (c1 int primary key,c2 int);
create materialized view log on t1 ;
insert into t1 select 999,999 from dual;
insert into t1 select 888,999 from dual;
update t1 set c2 = 1 where c1 = 999;
delete from t1 where c2 =888;
select * from mlog$_t1 order by SEQUENCE$$;
c1	SEQUENCE$$	DMLTYPE$$	OLD_NEW$$
888	2	I	N
999	1	I	N
select * from t1 order by c1;
c1	c2
888	999
999	1
SET @@sql_mode='STRICT_TRANS_TABLES,NO_ENGINE_SUBSTITUTION,no_zero_date,no_zero_in_date,PIPES_AS_CONCAT';
##基表创建索引
CREATE INDEX index_name ON t1(c2);
ALTER TABLE t1 RENAME INDEX index_name TO new_index_name;
##修改列名 --不支持
ALTER TABLE t1 RENAME COLUMN c1 TO new_c1;
ERROR 0A000: modify column to table with materialized view log is not supported
##hash分区表指定物化视图为hash分区方式
SET @@sql_mode='';
DROP MATERIALIZED VIEW LOG ON  t1;
drop table t1;
drop materialized view mv1;
create table t1 (c1 int primary key, c2 int) partition by hash(c1) partitions 5;
create materialized view log on t1 ;
create materialized view mv1(c1, c2) partition by hash(c1) partitions 2 as select * from t1;
insert into t1 select 999,999 from dual;
insert into t1 select 888,999 from dual;
update t1 set c2 = '' where c1 = 999;
delete from t1 where c2 =888;
select * from mlog$_t1 order by SEQUENCE$$;
c1	SEQUENCE$$	DMLTYPE$$	OLD_NEW$$
888	1	I	N
999	1	I	N
CALL DBMS_MVIEW.REFRESH('mv1','c');
select * from t1 order by c1;
c1	c2
888	999
999	0
select * from mv1 order by c1;
c1	c2
888	999
999	0
##hash分区表指定物化视图为range分区方式
DROP MATERIALIZED VIEW LOG ON  t1;
drop table t1;
drop materialized view mv1;
create table t1 (c1 int primary key, c2 int) partition by hash(c1) partitions 5;
create materialized view log on t1 ;
create materialized view mv1(c1, c2) partition by range(c1) (PARTITION partition_1 VALUES LESS THAN (2), PARTITION partition_2 VALUES LESS THAN (4)) as select * from t1;
insert into t1 select 999,999 from dual;
insert into t1 select 888,999 from dual;
update t1 set c2 = '' where c1 = 999;
delete from t1 where c2 =888;
select * from mlog$_t1 order by SEQUENCE$$;
c1	SEQUENCE$$	DMLTYPE$$	OLD_NEW$$
888	1	I	N
999	1	I	N
CALL DBMS_MVIEW.REFRESH('mv1','c');
ERROR HY000: Table has no partition for value
select * from t1 order by c1;
c1	c2
888	999
999	0
select * from mv1 order by c1;
c1	c2
DROP MATERIALIZED VIEW LOG ON  t1;
drop table t1;
drop materialized view mv1;
create table t1 (c1 int primary key, c2 int) partition by hash(c1) partitions 5;
create materialized view log on t1 ;
create materialized view mv1(c1, c2) partition by range(c1) (PARTITION partition_1 VALUES LESS THAN (889), PARTITION partition_2 VALUES LESS THAN (1000)) as select * from t1;
insert into t1 select 999,999 from dual;
insert into t1 select 888,999 from dual;
update t1 set c2 = '' where c1 = 999;
delete from t1 where c2 =888;
select * from mlog$_t1 order by SEQUENCE$$;
c1	SEQUENCE$$	DMLTYPE$$	OLD_NEW$$
888	1	I	N
999	1	I	N
CALL DBMS_MVIEW.REFRESH('mv1','c');
select * from t1 order by c1;
c1	c2
888	999
999	0
select * from mv1 order by c1;
c1	c2
888	999
999	0
##hash分区表指定物化视图为list分区方式
DROP MATERIALIZED VIEW LOG ON  t1;
drop table t1;
drop materialized view mv1;
create table t1 (c1 int primary key, c2 int) partition by hash(c1) partitions 5;
create materialized view log on t1 ;
create materialized view mv1(c1, c2) partition by list(c1) (PARTITION partition_1 VALUES in(1,888,999),PARTITION partition_2 VALUES in(2,null)) as select * from t1;
insert into t1 select 999,999 from dual;
insert into t1 select 888,999 from dual;
update t1 set c2 = '' where c1 = 999;
delete from t1 where c2 =888;
select * from mlog$_t1 order by SEQUENCE$$;
c1	SEQUENCE$$	DMLTYPE$$	OLD_NEW$$
888	1	I	N
999	1	I	N
CALL DBMS_MVIEW.REFRESH('mv1','c');
select * from t1 order by c1;
c1	c2
888	999
999	0
select * from mv1 order by c1;
c1	c2
888	999
999	0
##修改时区
set time_zone='+09:00';
DROP MATERIALIZED VIEW LOG ON  t1;
drop materialized view mv1;
drop table t1;
create table t1 (c1 number ,c2 number);
insert into t1 values(30,10);
create materialized view mv1  refresh complete start with sysdate() + interval 1 second  as select c1,c2 from t1 ;
select * from t1 order by c1;
c1	c2
30	10
select * from mv1 order by c1;
c1	c2
30	10
drop table t1;
drop materialized view mv1;
create table t1 (c1 int, c2 int);
create materialized view log on t1 with rowid,sequence(c1,c2) including new values;
create materialized view mv1(c1, c2) partition by hash(c1) partitions 2 as select * from t1;
insert into t1 select 999,999 from dual;
insert into t1 select 888,999 from dual;
update t1 set c2 = '' where c1 = 999;
delete from t1 where c2 =888;
select * from mlog$_t1 order by SEQUENCE$$;
c1	c2	SEQUENCE$$	DMLTYPE$$	OLD_NEW$$	M_ROW$$
888	999	2	I	N	2
999	0	4	U	N	1
999	999	1	I	N	1
999	999	3	U	O	1
########清空回收站，删除测试数据库，表等 ##########
drop database  IF EXISTS db1;
