drop database  IF EXISTS  ljh;
create database ljh;
use ljh;
SET wait_timeout=30000000;
SET ob_trx_timeout = 30000000;
SET ob_query_timeout = 30000000;
##存储过程中对基表执行dml操作验证物化视图数据
##无参存储过程
CREATE TABLE t1 (c1 int primary key,c2 int, c3 int);
create materialized view log on t1 parallel 9 with rowid, sequence (c2,c3) including new values;
create materialized view mv1 refresh fast on demand as select c2 as c2, count(*) cnt, count(c2) cnt_c2, sum(c2) sum_c3 ,avg(c2) avg_c3 from t1 group by c2;
CREATE  PROCEDURE p1() 
BEGIN
insert into t1 values(1,3,4);
call DBMS_MVIEW.REFRESH('mv1','f');
END;
/
call p1();
select * from t1;
c1	c2	c3
1	3	4
select * from mv1;
c2	cnt	cnt_c2	sum_c3	avg_c3
3	1	1	3	3.0000
select * from mlog$_t1;
c1	c2	c3	SEQUENCE$$	DMLTYPE$$	OLD_NEW$$
DROP MATERIALIZED VIEW LOG ON t1;
DROP TABLE t1;
DROP MATERIALIZED VIEW mv1;
DROP PROCEDURE if exists p1;
CREATE TABLE t1 (c1 int primary key,c2 int, c3 int);
create materialized view mv1 refresh complete on demand as select c2 as c2, count(*) cnt, count(c2) cnt_c2, sum(c2) sum_c3 ,avg(c2) avg_c3 from t1 group by c2;
CREATE  PROCEDURE p1() 
BEGIN
insert into t1 values(1,3,4);
call DBMS_MVIEW.REFRESH('mv1','c');
END;
/
call p1();
select * from t1;
c1	c2	c3
1	3	4
select * from mv1;
c2	cnt	cnt_c2	sum_c3	avg_c3
3	1	1	3	3.0000
##in参数
DROP TABLE t1;
DROP MATERIALIZED VIEW mv1;
DROP PROCEDURE if exists p1;
CREATE TABLE t1 (c1 number(10) ,c2 number(10), c3 number);
create materialized view log on t1 parallel 9 with rowid, sequence (c1,c2,c3) including new values;
create materialized view mv1 refresh fast on demand as select c2 as c2, count(*) cnt, count(c2) cnt_c2, sum(c2) sum_c3 ,avg(c2) avg_c3 from t1 group by c2;
insert into t1 values(1,3,4);
CREATE  PROCEDURE p1(IN a int,IN b int)
BEGIN
UPDATE t1 SET c1 = a WHERE c2 = b;
call DBMS_MVIEW.REFRESH('mv1','f');
END;
/
call p1(3,3);
select * from t1;
c1	c2	c3
3	3	4
select * from mv1;
c2	cnt	cnt_c2	sum_c3	avg_c3
3	1	1	3	3.0000
select * from mlog$_t1;
c1	c2	c3	SEQUENCE$$	DMLTYPE$$	OLD_NEW$$	M_ROW$$
DROP MATERIALIZED VIEW LOG ON t1;
DROP TABLE t1;
DROP MATERIALIZED VIEW mv1;
DROP PROCEDURE if exists p1;
CREATE TABLE t1 (c1 number(10) primary key,c2 number(10), c3 number);
create materialized view mv1 refresh complete on demand as select c2 as c2, count(*) cnt, count(c2) cnt_c2, sum(c2) sum_c3 ,avg(c2) avg_c3 from t1 group by c2;
insert into t1 values(1,3,4);
CREATE  PROCEDURE p1(IN a int,IN b int)
BEGIN
UPDATE t1 SET c1 = a WHERE c2 = b;
call DBMS_MVIEW.REFRESH('mv1','c');
END;
/
call p1(3,3);
call p1(3,3);
select * from t1;
c1	c2	c3
3	3	4
select * from mv1;
c2	cnt	cnt_c2	sum_c3	avg_c3
3	1	1	3	3.0000
##out参数
DROP TABLE t1;
DROP MATERIALIZED VIEW mv1;
DROP PROCEDURE if exists p1;
CREATE TABLE t1 (c1 int ,c2 int, c3 int,c4 varchar(20));
create materialized view log on t1 parallel 9 with rowid, sequence (c1,c2,c3,c4) including new values;
create materialized view mv1 refresh fast on demand as select  c4 as c4 ,count(*) cnt, count(c4) cnt_c4 from t1 group by c4;
CREATE  PROCEDURE p1 (OUT mv1 VARCHAR(20))
BEGIN
insert into t1 values(1,2,3,@mv1);
call DBMS_MVIEW.REFRESH('mv1','f');
END;
/
set @mv1 = upper('Hello, World!');
call p1(@mv1);
select * from t1;
c1	c2	c3	c4
1	2	3	HELLO, WORLD!
select * from mv1;
c4	cnt	cnt_c4
HELLO, WORLD!	1	1
select * from mlog$_t1;
c1	c2	c3	c4	SEQUENCE$$	DMLTYPE$$	OLD_NEW$$	M_ROW$$
DROP MATERIALIZED VIEW LOG ON t1;
DROP TABLE t1;
DROP MATERIALIZED VIEW mv1;
DROP PROCEDURE if exists p1;
CREATE TABLE t1 (c1 int ,c2 int, c3 int,c4 varchar(20));
create materialized view mv1 refresh complete on demand as select  c4 as c4 ,count(*) cnt, count(c4) cnt_c4 from t1 group by c4;
CREATE  PROCEDURE p1 (OUT mv1 VARCHAR(20))
BEGIN
set @mv1 = upper('Hello, World!');
insert into t1 values(1,2,3,@mv1);
call DBMS_MVIEW.REFRESH('mv1','c');
END;
/
call p1(@mv1);
select * from t1;
c1	c2	c3	c4
1	2	3	HELLO, WORLD!
select * from mv1;
c4	cnt	cnt_c4
HELLO, WORLD!	1	1
##in out参数
DROP TABLE t1;
DROP MATERIALIZED VIEW mv1;
DROP PROCEDURE if exists p1;
CREATE TABLE t1 (c1 int primary key,c2 int, c3 int,c4 varchar(20));
create materialized view log on t1 parallel 9 with rowid, sequence (c2,c3,c4) including new values;
create materialized view mv1 refresh fast on demand as select  c4 as c4 ,count(*) cnt, count(c4) cnt_c4 from t1 group by c4;
insert into t1 values(8,null,3,'中文ing');
insert into t1 values(0,0,3,'abs22');
insert into t1 values(1,1,3,'abs22');
insert into t1 values(3,2,3,'abs22');
CREATE PROCEDURE p1(IN a varchar(20), INOUT b int)
BEGIN
UPDATE t1 SET c4 = a WHERE c2 = b;
call DBMS_MVIEW.REFRESH('mv1','f');
SET b = b * 2;
END;
/
SET @c1 = '先帝创业未半而中道崩殂,今天下三分';
SET @c2 = 2;
CALL p1(@c1, @c2);
select * from t1 order by c1;
c1	c2	c3	c4
0	0	3	abs22
1	1	3	abs22
3	2	3	先帝创业未半而中道崩殂,今天下三分
8	NULL	3	中文ing
select * from mv1 order by c4;
c4	cnt	cnt_c4
abs22	2	2
中文ing	1	1
先帝创业未半而中道崩殂,今天下三分	1	1
DROP MATERIALIZED VIEW LOG ON t1;
DROP TABLE t1;
DROP MATERIALIZED VIEW mv1;
DROP PROCEDURE if exists p1;
CREATE TABLE t1 (c1 int primary key,c2 int, c3 int,c4 varchar(20));
create materialized view mv1 refresh complete on demand as select  c4 as c4 ,count(*) cnt, count(c4) cnt_c4 from t1 group by c4;
insert into t1 values(8,null,3,'中文ing');
insert into t1 values(0,0,3,'abs22');
insert into t1 values(1,1,3,'abs22');
insert into t1 values(3,2,3,'abs22');
CREATE PROCEDURE p1(IN a varchar(20), INOUT b int)
BEGIN
UPDATE t1 SET c4 = a WHERE c2 = b;
call DBMS_MVIEW.REFRESH('mv1','c');
SET b = b * 2;
END;
/
SET @c1 = '先帝创业未半而中道崩殂,今天下三分';
SET @c2 = 2;
CALL p1(@c1, @c2);
select * from t1 order by c1;
c1	c2	c3	c4
0	0	3	abs22
1	1	3	abs22
3	2	3	先帝创业未半而中道崩殂,今天下三分
8	NULL	3	中文ing
select * from mv1 order by c4;
c4	cnt	cnt_c4
abs22	2	2
中文ing	1	1
先帝创业未半而中道崩殂,今天下三分	1	1
##自定义函数
DROP TABLE t1;
DROP MATERIALIZED VIEW mv1;
DROP function if exists f1;
CREATE TABLE t1 (c1 int primary key,c2 int, c3 int,c4 varchar(20));
create materialized view log on t1 parallel 9 with rowid, sequence (c2,c3,c4) including new values;
create materialized view mv1 refresh fast on demand as select  c4 as c4 ,count(*) cnt, count(c4) cnt_c4 from t1 group by c4;
insert into t1 values(8,null,3,'中文ing');
insert into t1 values(0,0,3,'abs22');
insert into t1 values(1,1,3,'abs22');
insert into t1 values(3,2,3,'abs22');
CREATE FUNCTION f1()
RETURNS INT
BEGIN
DECLARE record_count INT;
SELECT COUNT(*) INTO record_count FROM t1;
RETURN record_count;
END;
/
call DBMS_MVIEW.REFRESH('mv1','f');
select f1() from dual;
f1()
4
select * from t1 order by c1;
c1	c2	c3	c4
0	0	3	abs22
1	1	3	abs22
3	2	3	abs22
8	NULL	3	中文ing
select * from mv1 order by cnt;
c4	cnt	cnt_c4
中文ing	1	1
abs22	3	3
##触发器中使用
DROP MATERIALIZED VIEW LOG ON t1;
DROP TABLE t1;
DROP MATERIALIZED VIEW mv1;
DROP trigger if exists tr1;
Warnings:
Note	1360	Trigger does not exist
CREATE TABLE t1 (c1 int primary key,c2 int, c3 int,c4 varchar(20));
create materialized view log on t1 parallel 9 with rowid, sequence (c2,c3) including new values;
create materialized view mv1 refresh fast on demand as select c2 as c2, count(*) cnt, count(c2) cnt_c2, sum(c2) sum_c3 ,avg(c2) avg_c3 from t1 group by c2;
insert into t1 values(8,null,3,'中文ing');
insert into t1 values(0,0,3,'abs22');
insert into t1 values(1,1,3,'abs22');
insert into t1 values(3,2,3,'abs22');
##不支持在mv创建触发器
CREATE  TRIGGER tr1
AFTER INSERT ON mv1
FOR EACH ROW
BEGIN
insert into t1 values(1,3,4);
END;
/
ERROR 0A000: simple dml trigger isn't used on user table not supported
call DBMS_MVIEW.REFRESH('mv1', 'f');
##insert触发器
DROP MATERIALIZED VIEW LOG ON t1;
DROP TABLE t1;
DROP MATERIALIZED VIEW mv1;
CREATE TABLE t1 (c1 int ,c2 int, c3 int);
CREATE TABLE t2 (c1 int ,c2 int, c3 int);
create materialized view log on t1 parallel 9 with rowid, sequence (c2,c3) including new values;
create materialized view mv1 refresh fast on demand as select c2 as c2, count(*) cnt, count(c2) cnt_c2, sum(c2) sum_c3 ,avg(c2) avg_c3 from t1 group by c2;
insert into t1 values(2,2,4);
CREATE TRIGGER tr1
AFTER INSERT ON t2
FOR EACH ROW
BEGIN
insert into t1 values(1,3,4);
END;
/
insert into t2 values(2,3,4);
call DBMS_MVIEW.REFRESH('mv1', 'f');
select * from t1 order by c1;
c1	c2	c3
1	3	4
2	2	4
select * from t2;
c1	c2	c3
2	3	4
select * from mv1 order by c2;
c2	cnt	cnt_c2	sum_c3	avg_c3
2	1	1	2	2.0000
3	1	1	3	3.0000
##update触发器
DROP MATERIALIZED VIEW LOG ON t1;
DROP TABLE t1;
DROP TABLE t2;
DROP MATERIALIZED VIEW mv1;
CREATE TABLE t1 (c1 number(10) ,c2 number(10), c3 number);
CREATE TABLE t2 (c1 number(10) ,c2 number(10), c3 number);
create materialized view log on t1 parallel 9 with rowid, sequence (c2,c3) including new values;
create materialized view mv1 refresh fast on demand as select c2 as c2, count(*) cnt, count(c2) cnt_c2, sum(c2) sum_c3 ,avg(c2) avg_c3 from t1 group by c2;
insert into t2 values(2,2,4);
CREATE  TRIGGER tr1
AFTER update ON t2
FOR EACH ROW
BEGIN
insert into t1 values(1,3,4);
END;
/
update t2 set c2=1 where c3 =4;
call DBMS_MVIEW.REFRESH('mv1', 'f');
select * from t1;
c1	c2	c3
1	3	4
select * from t2;
c1	c2	c3
2	1	4
select * from mv1;
c2	cnt	cnt_c2	sum_c3	avg_c3
3	1	1	3	3.0000
##delete触发器
DROP MATERIALIZED VIEW LOG ON t1;
DROP TABLE t1;
DROP TABLE t2;
DROP MATERIALIZED VIEW mv1;
CREATE TABLE t1 (c1 number(10) ,c2 number(10), c3 number);
CREATE TABLE t2 (c1 number(10) ,c2 number(10), c3 number);
create materialized view log on t1 parallel 9 with rowid, sequence (c2,c3) including new values;
create materialized view mv1 refresh fast on demand as select c2 as c2, count(*) cnt, count(c2) cnt_c2, sum(c2) sum_c3 ,avg(c2) avg_c3 from t1 group by c2;
insert into t2 values(2,2,4);
insert into t2 values(null,2,4);
CREATE  TRIGGER tr1
AFTER delete ON t2
FOR EACH ROW
BEGIN
insert into t1 values(1,3,4);
END;
/
delete from t2 where c1 is null;
call DBMS_MVIEW.REFRESH('mv1', 'f');
select * from t1;
c1	c2	c3
1	3	4
select * from t2;
c1	c2	c3
2	2	4
select * from mv1;
c2	cnt	cnt_c2	sum_c3	avg_c3
3	1	1	3	3.0000
########清空回收站，删除测试数据库，表等 ##########
drop database  IF EXISTS ljh;
