drop database  IF EXISTS  ljh;
create database ljh;
use ljh;
SET wait_timeout=30000000;
SET ob_trx_timeout = 30000000;
SET ob_query_timeout = 30000000;
##设置相同sql_mode;
SET @@sql_mode='';
##hash分区
CREATE TABLE t1(id INT,name VARCHAR(50),age INT,salary DECIMAL(10,2),is_active TINYINT)PARTITION BY HASH(id) PARTITIONS 20;
create materialized view log on t1 with (id,name,age,salary,is_active);
create materialized view mv2 refresh fast on demand   as  select count(*) as cnt,name as name from t1 group by name;
INSERT INTO t1 (id, name, age, salary, is_active) VALUES
(1, 'John', 25, 5000.00, 1),
(2, 'Alice', 30, 6000.00, 0),
(3, 'Bob', 35, 7000.00, 1),
(4, 'Sarah', 28, 5500.00, 1),
(5, 'Mike', 32, 8000.00, 0);
CALL DBMS_MVIEW.REFRESH('mv2','c');
CALL DBMS_MVIEW.REFRESH('mv2','f');
select * from mv2 order by name;
cnt	name
1	Alice
1	Bob
1	John
1	Mike
1	Sarah
##创建索引
CREATE INDEX idx_cnt  ON mv2 (cnt);
CREATE INDEX idx_name ON mv2 (name);
INSERT INTO t1  VALUES (6, null, 25, 5000.00, 1);
CALL DBMS_MVIEW.REFRESH('mv2','f');
select * from mv2 order by name;
cnt	name
1	NULL
1	Alice
1	Bob
1	John
1	Mike
1	Sarah
##创建复制表
create table tt1 select * from t1;
create materialized view log on tt1 with (id,name,age,salary,is_active);
create materialized view mv3 refresh fast on demand   as  select count(*) as cnt,name as name from tt1 group by name;
CALL DBMS_MVIEW.REFRESH('mv3','f');
select * from mv3 order by name;
cnt	name
1	NULL
1	Alice
1	Bob
1	John
1	Mike
1	Sarah
##直接增量刷新结果不符合预期；
DROP MATERIALIZED VIEW LOG ON t1;
DROP MATERIALIZED VIEW LOG ON tt1;
drop table t1;
drop table tt1;
drop materialized view mv2;
drop materialized view mv3;
CREATE TABLE t1(id INT,name VARCHAR(50),age INT,salary DECIMAL(10,2),is_active TINYINT)PARTITION BY HASH(id) PARTITIONS 20;
create materialized view log on t1 with (id,name,age,salary,is_active);
create materialized view mv2 refresh fast on demand   as  select count(*) as cnt,name as name from t1 group by name;
INSERT INTO t1 (id, name, age, salary, is_active) VALUES
(1, 'John', 25, 5000.00, 1),
(2, 'Alice', 30, 6000.00, 0),
(3, 'Bob', 35, 7000.00, 1),
(4, 'Sarah', 28, 5500.00, 1),
(5, 'Mike', 32, 8000.00, 0);
CALL DBMS_MVIEW.REFRESH('mv2','f');
select * from mv2 order by name;
cnt	name
1	Alice
1	Bob
1	John
1	Mike
1	Sarah
##全量刷新
DROP MATERIALIZED VIEW LOG ON t1;
drop table t1;
drop materialized view mv2;
CREATE TABLE t1(id INT,name VARCHAR(50),age INT,salary DECIMAL(10,2),is_active TINYINT)PARTITION BY HASH(id) PARTITIONS 20;
create materialized view mv2 refresh complete on demand   as  select count(*) as cnt,name as name from t1 group by name;
INSERT INTO t1 (id, name, age, salary, is_active) VALUES
(1, 'John', 25, 5000.00, 1),
(2, 'Alice', 30, 6000.00, 0),
(3, 'Bob', 35, 7000.00, 1),
(4, 'Sarah', 28, 5500.00, 1),
(5, 'Mike', 32, 8000.00, 0);
CALL DBMS_MVIEW.REFRESH('mv2','c');
select * from mv2 order by name;
cnt	name
1	Alice
1	Bob
1	John
1	Mike
1	Sarah
##同时指定分区和并行度有语法错误；
drop table t1;
drop materialized view mv2;
CREATE TABLE t1(id INT,name VARCHAR(50),age INT,salary DECIMAL(10,2),is_active TINYINT)PARTITION BY HASH(id) PARTITIONS 20;
create materialized view log on t1 with (id,name,age,salary,is_active);
create materialized view mv2 refresh fast on demand   as  select count(*) as cnt,name as name from t1 group by name;
create materialized view mv1 partition by hash(c1) partitions 10 parallel 9 refresh fast on demand as select c1 as c1, count(*) cnt from t1 group by c1;
ERROR 42000: You have an error in your SQL syntax; check the manual that corresponds to your OceanBase version for the right syntax to use near 'parallel 9 refresh fast on demand as select c1 as c1, count(*) cnt from t1 group' at line 1
##list分区
##直接增量刷新结果不符合预期
DROP MATERIALIZED VIEW LOG ON t1;
drop table t1;
drop materialized view mv2;
CREATE TABLE t1 (
id INT,
name VARCHAR(50),
age INT,
salary DECIMAL(10,2),
is_active TINYINT
)
PARTITION BY LIST (id) (
PARTITION p1 VALUES IN (1, 2),
PARTITION p2 VALUES IN (3, 4),
PARTITION p3 VALUES IN (5, 6),
PARTITION p4 VALUES IN (7, 8),
PARTITION p5 VALUES IN (9, 10)
);
create materialized view log on t1 with (id,name,age,salary,is_active);
create materialized view mv2 refresh fast on demand   as  select count(*) as cnt,name as name from t1 group by name;
INSERT INTO t1 (id, name, age, salary, is_active)
VALUES
(1, 'John', 25, 5000.00, 1),
(3, 'Alice', 30, 6000.00, 0),
(5, 'Bob', 35, 7000.00, 1),
(7, 'Sarah', 28, 5500.00, 1),
(9, 'Mike', 32, 8000.00, 0);
CALL DBMS_MVIEW.REFRESH('mv2','f');
select * from mv2 order by name;
cnt	name
1	Alice
1	Bob
1	John
1	Mike
1	Sarah
select * from t1 order by name;
id	name	age	salary	is_active
3	Alice	30	6000.00	0
5	Bob	35	7000.00	1
1	John	25	5000.00	1
9	Mike	32	8000.00	0
7	Sarah	28	5500.00	1
##创建索引
DROP MATERIALIZED VIEW LOG ON t1;
drop table t1;
drop materialized view mv2;
CREATE TABLE t1 (
id INT,
name VARCHAR(50),
age INT,
salary DECIMAL(10,2),
is_active TINYINT
)
PARTITION BY LIST (id) (
PARTITION p1 VALUES IN (1, 2),
PARTITION p2 VALUES IN (3, 4),
PARTITION p3 VALUES IN (5, 6),
PARTITION p4 VALUES IN (7, 8),
PARTITION p5 VALUES IN (9, 10)
);
create materialized view log on t1 with (id,name,age,salary,is_active);
create materialized view mv2 refresh fast on demand   as  select count(*) as cnt,name as name from t1 group by name;
INSERT INTO t1 (id, name, age, salary, is_active)
VALUES
(1, 'John', 25, 5000.00, 1),
(3, 'Alice', 30, 6000.00, 0),
(5, 'Bob', 35, 7000.00, 1),
(7, 'Sarah', 28, 5500.00, 1),
(9, 'Mike', 32, 8000.00, 0);
CALL DBMS_MVIEW.REFRESH('mv2','c');
CALL DBMS_MVIEW.REFRESH('mv2','f');
select * from mv2 order by name;
cnt	name
1	Alice
1	Bob
1	John
1	Mike
1	Sarah
select * from t1 order by name;
id	name	age	salary	is_active
3	Alice	30	6000.00	0
5	Bob	35	7000.00	1
1	John	25	5000.00	1
9	Mike	32	8000.00	0
7	Sarah	28	5500.00	1
CREATE INDEX idx_cnt  ON mv2 (cnt);
CREATE INDEX idx_name ON mv2 (name);
INSERT INTO t1  VALUES (6, null, 25, 5000.00, 1);
CALL DBMS_MVIEW.REFRESH('mv2','f');
select * from mv2 order by name;
cnt	name
1	NULL
1	Alice
1	Bob
1	John
1	Mike
1	Sarah
select * from t1 order by name;
id	name	age	salary	is_active
6	NULL	25	5000.00	1
3	Alice	30	6000.00	0
5	Bob	35	7000.00	1
1	John	25	5000.00	1
9	Mike	32	8000.00	0
7	Sarah	28	5500.00	1
##创建复制表
create table tt1 select * from t1;
create materialized view log on tt1 with (id,name,age,salary,is_active);
create materialized view mv3 refresh fast on demand   as  select count(*) as cnt,name as name from tt1 group by name;
CALL DBMS_MVIEW.REFRESH('mv3','f');
select * from mv3 order by name;
cnt	name
1	NULL
1	Alice
1	Bob
1	John
1	Mike
1	Sarah
##全量刷新
DROP MATERIALIZED VIEW LOG ON t1;
drop table t1;
drop materialized view mv2;
CREATE TABLE t1 (
id INT,
name VARCHAR(50),
age INT,
salary DECIMAL(10,2),
is_active TINYINT
)
PARTITION BY LIST (id) (
PARTITION p1 VALUES IN (1, 2),
PARTITION p2 VALUES IN (3, 4),
PARTITION p3 VALUES IN (5, 6),
PARTITION p4 VALUES IN (7, 8),
PARTITION p5 VALUES IN (9, 10)
);
create materialized view mv2 refresh complete on demand   as  select count(*) as cnt,name as name from t1 group by name;
INSERT INTO t1 (id, name, age, salary, is_active)
VALUES
(1, 'John', 25, 5000.00, 1),
(3, 'Alice', 30, 6000.00, 0),
(5, 'Bob', 35, 7000.00, 1),
(7, 'Sarah', 28, 5500.00, 1),
(9, 'Mike', 32, 8000.00, 0);
CALL DBMS_MVIEW.REFRESH('mv2','c');
select * from mv2 order by name;
cnt	name
1	Alice
1	Bob
1	John
1	Mike
1	Sarah
select * from t1 order by name;
id	name	age	salary	is_active
3	Alice	30	6000.00	0
5	Bob	35	7000.00	1
1	John	25	5000.00	1
9	Mike	32	8000.00	0
7	Sarah	28	5500.00	1
##range分区
##直接增量更新结果不符合预期
drop table t1;
drop materialized view mv2;
CREATE TABLE t1 (
id INT,
name VARCHAR(50),
age INT,
salary DECIMAL(10,2),
is_active TINYINT
)
PARTITION BY RANGE (age) (
PARTITION p1 VALUES LESS THAN (30),
PARTITION p2 VALUES LESS THAN (40),
PARTITION p3 VALUES LESS THAN (50),
PARTITION p4 VALUES LESS THAN MAXVALUE
);
create materialized view log on t1 with (id,name,age,salary,is_active);
create materialized view mv2 refresh fast on demand   as  select count(*) as cnt,name as name from t1 group by name;
INSERT INTO t1 (id, name, age, salary, is_active)
VALUES
(1, 'John', 25, 5000.00, 1),
(3, 'Alice', 30, 6000.00, 0),
(5, 'Bob', 35, 7000.00, 1),
(7, 'Sarah', 28, 5500.00, 1),
(9, 'Mike', 32, 8000.00, 0);
CALL DBMS_MVIEW.REFRESH('mv2','f');
select * from mv2 order by name;
cnt	name
1	Alice
1	Bob
1	John
1	Mike
1	Sarah
select * from t1 order by name;
id	name	age	salary	is_active
3	Alice	30	6000.00	0
5	Bob	35	7000.00	1
1	John	25	5000.00	1
9	Mike	32	8000.00	0
7	Sarah	28	5500.00	1
##创建索引
DROP MATERIALIZED VIEW LOG ON t1;
drop table t1;
drop materialized view mv2;
CREATE TABLE t1 (
id INT,
name VARCHAR(50),
age INT,
salary DECIMAL(10,2),
is_active TINYINT
)
PARTITION BY RANGE (age) (
PARTITION p1 VALUES LESS THAN (30),
PARTITION p2 VALUES LESS THAN (40),
PARTITION p3 VALUES LESS THAN (50),
PARTITION p4 VALUES LESS THAN MAXVALUE
);
create materialized view log on t1 with (id,name,age,salary,is_active);
create materialized view mv2 refresh fast on demand   as  select count(*) as cnt,name as name from t1 group by name;
INSERT INTO t1 (id, name, age, salary, is_active)
VALUES
(1, 'John', 25, 5000.00, 1),
(3, 'Alice', 30, 6000.00, 0),
(5, 'Bob', 35, 7000.00, 1),
(7, 'Sarah', 28, 5500.00, 1),
(9, 'Mike', 32, 8000.00, 0);
CALL DBMS_MVIEW.REFRESH('mv2','f');
select * from mv2 order by name;
cnt	name
1	Alice
1	Bob
1	John
1	Mike
1	Sarah
select * from t1 order by name;
id	name	age	salary	is_active
3	Alice	30	6000.00	0
5	Bob	35	7000.00	1
1	John	25	5000.00	1
9	Mike	32	8000.00	0
7	Sarah	28	5500.00	1
CREATE INDEX idx_cnt  ON mv2 (cnt);
CREATE INDEX idx_name ON mv2 (name);
INSERT INTO t1  VALUES (6, null, 25, 5000.00, 1);
CALL DBMS_MVIEW.REFRESH('mv2','f');
select * from mv2 order by name;
cnt	name
1	NULL
1	Alice
1	Bob
1	John
1	Mike
1	Sarah
select * from t1 order by name;
id	name	age	salary	is_active
6	NULL	25	5000.00	1
3	Alice	30	6000.00	0
5	Bob	35	7000.00	1
1	John	25	5000.00	1
9	Mike	32	8000.00	0
7	Sarah	28	5500.00	1
##创建复制表
DROP MATERIALIZED VIEW LOG ON tt1;
drop table tt1;
drop materialized view mv3;
create table tt1 select * from t1;
create materialized view log on tt1 with (id,name,age,salary,is_active);
create materialized view mv3 refresh fast on demand   as  select count(*) as cnt,name as name from tt1 group by name;
CALL DBMS_MVIEW.REFRESH('mv3','f');
select * from mv3 order by name;
cnt	name
1	NULL
1	Alice
1	Bob
1	John
1	Mike
1	Sarah
DROP MATERIALIZED VIEW LOG ON tt1;
drop table tt1;
drop materialized view mv3;
##全量刷新
DROP MATERIALIZED VIEW LOG ON t1;
drop table t1;
drop materialized view mv2;
CREATE TABLE t1 (
id INT,
name VARCHAR(50),
age INT,
salary DECIMAL(10,2),
is_active TINYINT
)
PARTITION BY RANGE (age) (
PARTITION p1 VALUES LESS THAN (30),
PARTITION p2 VALUES LESS THAN (40),
PARTITION p3 VALUES LESS THAN (50),
PARTITION p4 VALUES LESS THAN MAXVALUE
);
create materialized view mv2 refresh complete on demand   as  select count(*) as cnt,name as name from t1 group by name;
INSERT INTO t1 (id, name, age, salary, is_active)
VALUES
(1, 'John', 25, 5000.00, 1),
(3, 'Alice', 30, 6000.00, 0),
(5, 'Bob', 35, 7000.00, 1),
(7, 'Sarah', 28, 5500.00, 1),
(9, 'Mike', 32, 8000.00, 0);
CALL DBMS_MVIEW.REFRESH('mv2','c');
select * from mv2 order by name;
cnt	name
1	Alice
1	Bob
1	John
1	Mike
1	Sarah
select * from t1 order by name;
id	name	age	salary	is_active
3	Alice	30	6000.00	0
5	Bob	35	7000.00	1
1	John	25	5000.00	1
9	Mike	32	8000.00	0
7	Sarah	28	5500.00	1
##子分区
drop table t1;
drop materialized view mv2;
CREATE TABLE t1 (
id INT,
name VARCHAR(50),
age INT,
gender ENUM('Male', 'Female'),
salary DECIMAL(10,2),
is_active TINYINT
)
PARTITION BY RANGE (age)
SUBPARTITION BY HASH(age)
SUBPARTITIONS 2 (
PARTITION p1 VALUES LESS THAN (30) (
SUBPARTITION s1,
SUBPARTITION s2
),
PARTITION p2 VALUES LESS THAN (40) (
SUBPARTITION s3,
SUBPARTITION s4
),
PARTITION p3 VALUES LESS THAN MAXVALUE (
SUBPARTITION s5,
SUBPARTITION s6
)
);
create materialized view log on t1 with (id,name,age,gender,salary,is_active);
INSERT INTO t1 (id, name, age, gender, salary, is_active) VALUES
(1, 'John', 25, 'Male', 5000.00, 1),
(2, 'Alice', 35, 'Female', 6000.00, 0),
(3, 'Bob', 45, 'Male', 7000.00, 1),
(4, 'Sarah', 28, 'Female', 5500.00, 1),
(5, 'Mike', 32, 'Male', 8000.00, 0);
##全量更新
create materialized view mv1 refresh complete on demand   as  select count(*) as cnt,name as name from t1 group by name;
CALL DBMS_MVIEW.REFRESH('mv1','c');
select * from t1 order by id ;
id	name	age	gender	salary	is_active
1	John	25	Male	5000.00	1
2	Alice	35	Female	6000.00	0
3	Bob	45	Male	7000.00	1
4	Sarah	28	Female	5500.00	1
5	Mike	32	Male	8000.00	0
select * from mv1 order by name ;
cnt	name
1	Alice
1	Bob
1	John
1	Mike
1	Sarah
##增量更新
drop materialized view mv1;
create materialized view mv2 refresh fast on demand   as  select count(*) as cnt,name as name from t1 group by name;
CALL DBMS_MVIEW.REFRESH('mv2','f');
select * from mv2 order by name ;
cnt	name
1	Alice
1	Bob
1	John
1	Mike
1	Sarah
##创建索引
CREATE INDEX idx_age_salary ON t1 (age, salary);
INSERT INTO t1 (id, name, age, gender, salary, is_active) VALUES(100, 'null', 25, 'Male', 6000.00, 1);
CALL DBMS_MVIEW.REFRESH('mv2','f');
select * from mv2 order by name ;
cnt	name
1	Alice
1	Bob
1	John
1	Mike
1	null
1	Sarah
select * from t1 order by id ;
id	name	age	gender	salary	is_active
1	John	25	Male	5000.00	1
2	Alice	35	Female	6000.00	0
3	Bob	45	Male	7000.00	1
4	Sarah	28	Female	5500.00	1
5	Mike	32	Male	8000.00	0
100	null	25	Male	6000.00	1
drop index  idx_age_salary on t1;
##dml验证
DROP MATERIALIZED VIEW LOG ON t1;
drop table t1;
drop materialized view mv2;
CREATE TABLE t1 (
id INT,
name VARCHAR(50),
age INT,
gender ENUM('Male', 'Female'),
salary DECIMAL(10,2),
is_active TINYINT
)
PARTITION BY RANGE (age)
SUBPARTITION BY HASH(age)
SUBPARTITIONS 2 (
PARTITION p1 VALUES LESS THAN (30) (
SUBPARTITION s1,
SUBPARTITION s2
),
PARTITION p2 VALUES LESS THAN (40) (
SUBPARTITION s3,
SUBPARTITION s4
),
PARTITION p3 VALUES LESS THAN MAXVALUE (
SUBPARTITION s5,
SUBPARTITION s6
)
);
create materialized view log on t1 with (id,name,age,gender,salary,is_active);
INSERT INTO t1 (id, name, age, gender, salary, is_active) VALUES
(1, 'John', 25, 'Male', 5000.00, 1),
(2, 'Alice', 35, 'Female', 6000.00, 0),
(3, 'Bob', 45, 'Male', 7000.00, 1),
(4, 'Sarah', 28, 'Female', 5500.00, 1),
(5, 'Mike', 32, 'Male', 8000.00, 0);
update t1 set gender='Male' where salary > 7000;
delete from t1 where id is null;
create materialized view mv1 refresh fast on demand   as  select count(*) as cnt,gender as gender from t1 group by gender;
CALL DBMS_MVIEW.REFRESH('mv1','f');
select * from mv1 order by gender ;
cnt	gender
3	Male
2	Female
select * from t1 order by id ;
id	name	age	gender	salary	is_active
1	John	25	Male	5000.00	1
2	Alice	35	Female	6000.00	0
3	Bob	45	Male	7000.00	1
4	Sarah	28	Female	5500.00	1
5	Mike	32	Male	8000.00	0
DROP MATERIALIZED VIEW LOG ON t1;
drop table t1;
drop materialized view mv1;
CREATE TABLE t1 (
id INT,
name VARCHAR(50),
age INT,
gender ENUM('Male', 'Female'),
salary DECIMAL(10,2),
is_active TINYINT
)
PARTITION BY RANGE (age)
SUBPARTITION BY HASH(age)
SUBPARTITIONS 2 (
PARTITION p1 VALUES LESS THAN (30) (
SUBPARTITION s1,
SUBPARTITION s2
),
PARTITION p2 VALUES LESS THAN (40) (
SUBPARTITION s3,
SUBPARTITION s4
),
PARTITION p3 VALUES LESS THAN MAXVALUE (
SUBPARTITION s5,
SUBPARTITION s6
)
);
INSERT INTO t1 (id, name, age, gender, salary, is_active) VALUES
(1, 'John', 25, 'Male', 5000.00, 1),
(2, 'Alice', 35, 'Female', 6000.00, 0),
(3, 'Bob', 45, 'Male', 7000.00, 1),
(4, 'Sarah', 28, 'Female', 5500.00, 1),
(5, 'Mike', 32, 'Male', 8000.00, 0);
update t1 set gender='Male' where salary > 7000;
delete from t1 where id is null;
create materialized view mv1 refresh complete on demand   as  select count(*) as cnt,gender as gender from t1 group by gender;
CALL DBMS_MVIEW.REFRESH('mv1','c');
select * from mv1 order by gender ;
cnt	gender
3	Male
2	Female
select * from t1 order by id ;
id	name	age	gender	salary	is_active
1	John	25	Male	5000.00	1
2	Alice	35	Female	6000.00	0
3	Bob	45	Male	7000.00	1
4	Sarah	28	Female	5500.00	1
5	Mike	32	Male	8000.00	0
########清空回收站，删除测试数据库，表等 ##########
drop database  IF EXISTS ljh;
