purge recyclebin;
CREATE DATABASE IF NOT EXISTS trigger_test;
USE trigger_test;
#mysql_trigger_ddl
#mysql_trigger_ddl-1
#mysql_trigger_ddl-1-1/mysql_trigger_ddl-1-3/mysql_trigger_ddl-1-4
#mysql_trigger_ddl-2
#mysql_trigger_ddl-2-1/mysql_trigger_ddl-2-2/mysql_trigger_ddl-2-3
#创建不同类型的分区表，使用不同约束索引条件，然后再创建不同触发类型的trigger，最后对表执行DDL操作后触发trigger
#RANGE分区
DROP TABLE IF EXISTS t2;
CREATE TABLE t2(c0 INT,
c1 VARCHAR(10),
c2 SET('a','b','c','d','e','f','g'),
c3 FLOAT,
c4 DATE)
PARTITION BY RANGE(c0)
(PARTITION p1 VALUES LESS THAN(0),
PARTITION p2 VALUES LESS THAN(50),
PARTITION p3 VALUES LESS THAN(100),
PARTITION p4 VALUES LESS THAN(MAXVALUE)
);
INSERT INTO t2 VALUES(0,'AA','a',0.123,'2000-01-01'),
(1,'BB','a',2.123,'2001-11-11'),
(3,'CC','b',3.123,'2002-02-01'),
(4,'DD','b',4.123,'2003-03-11'),
(5,'EE','c',5.123,'2004-04-01'),
(6,'FF','c',6.123,'2005-05-11');
DROP TABLE IF EXISTS t1;
CREATE TABLE t1(c0 SMALLINT ZEROFILL,
c1 CHAR(10),
c2 ENUM('a','b','c','d','e','f','g') NOT NULL DEFAULT 'a',
c3 DOUBLE,
c4 TIME,
CONSTRAINT uni_key UNIQUE KEY(c0,c2))
PARTITION BY RANGE(c0)
(PARTITION r1 VALUES LESS THAN(100),
PARTITION r2 VALUES LESS THAN(200),
PARTITION r3 VALUES LESS THAN(300),
PARTITION r4 VALUES LESS THAN(MAXVALUE)
);
INSERT INTO t1 VALUES(0,'AAA','a',10.123,'20:01:01'),
(1,'BBB','b',12.123,'21:11:11'),
(2,'CCC','c',13.123,'22:22:01'),
(3,'DDD','c',14.123,'23:33:11'),
(4,'EEE','c',15.123,'19:44:01'),
(5,'FFF','d',16.123,'18:55:11'),
(6,'EEE','d',16.123,'17:05:17');
CREATE INDEX ind_1 ON t1(c3,c4);
CREATE INDEX ind_2 ON t1(c3);
DROP TRIGGER IF EXISTS trg_insert;
CREATE TRIGGER trg_insert AFTER INSERT ON t2
FOR EACH ROW
BEGIN
DECLARE c INT;
SELECT MAX(c0) INTO c FROM t1;
IF NEW.c0 = c THEN
DELETE FROM t1 WHERE c0 = NEW.c0;
ELSE
INSERT INTO t1 VALUES(NEW.c0,CONCAT(NEW.c1,NEW.c1),NEW.c2,NEW.c3+NEW.c0,TIME(NEW.c4));
END IF;
END;
//
DROP TRIGGER IF EXISTS trg_update;//
CREATE TRIGGER trg_update AFTER UPDATE ON t1
FOR EACH ROW
BEGIN
UPDATE t2 SET c0=NEW.c0,c1=CONCAT(NEW.c1,NEW.c1) WHERE c0=OLD.c0;
END
//
DROP TRIGGER IF EXISTS trg_delete;//
CREATE TRIGGER trg_delete AFTER DELETE ON t2
FOR EACH ROW
BEGIN
DELETE FROM t1 WHERE c0=OLD.c0+1;
END;
//
alter system set _enable_drop_and_add_index = true;
ALTER TABLE t1 DROP INDEX ind_1,ADD INDEX ind1(c1),RENAME INDEX ind_2 TO ind2;
alter system set _enable_drop_and_add_index = false;
SHOW CREATE TABLE t1;
Table	Create Table
t1	CREATE TABLE `t1` (
  `c0` smallint(5) unsigned zerofill DEFAULT NULL,
  `c1` char(10) DEFAULT NULL,
  `c2` enum('a','b','c','d','e','f','g') NOT NULL DEFAULT 'a',
  `c3` double DEFAULT NULL,
  `c4` time DEFAULT NULL,
  UNIQUE KEY `uni_key` (`c0`, `c2`) BLOCK_SIZE 16384 LOCAL,
  KEY `ind2` (`c3`) BLOCK_SIZE 16384 LOCAL,
  KEY `ind1` (`c1`) BLOCK_SIZE 16384 LOCAL
) ORGANIZATION INDEX DEFAULT CHARSET = utf8mb4 ROW_FORMAT = DYNAMIC COMPRESSION = 'zstd_1.3.8' REPLICA_NUM = 1 BLOCK_SIZE = 16384 USE_BLOOM_FILTER = FALSE ENABLE_MACRO_BLOCK_BLOOM_FILTER = FALSE TABLET_SIZE = 134217728 PCTFREE = 0
 partition by range(c0)
(partition `r1` values less than (100),
partition `r2` values less than (200),
partition `r3` values less than (300),
partition `r4` values less than (MAXVALUE))
SELECT /*+INDEX(ind1)*/ * FROM t1 WHERE c1='AAA';
c0	c1	c2	c3	c4
00000	AAA	a	10.123	20:01:01
#此处执行OB报错，待开发修复后执行，问题链接：
UPDATE t1 SET c0=16,c1='H',c2='a',c3='17.789',c4='06:00:00' WHERE c0=6;
SELECT * FROM t2 WHERE c0=16;
c0	c1	c2	c3	c4
16	HH	c	6.123	2005-05-11
SELECT * FROM t1 WHERE c0=16;
c0	c1	c2	c3	c4
00016	H	a	17.789	06:00:00
DELETE FROM t2 WHERE c0=1;
SELECT * FROM t2 WHERE c0=1;
c0	c1	c2	c3	c4
SELECT * FROM t1 WHERE c0=2;
c0	c1	c2	c3	c4
alter system set _enable_drop_and_add_index = true;
ALTER TABLE t1 ADD CONSTRAINT unk UNIQUE KEY(c0),DROP INDEX uni_key;
alter system set _enable_drop_and_add_index = false;
SHOW CREATE TABLE t1;
Table	Create Table
t1	CREATE TABLE `t1` (
  `c0` smallint(5) unsigned zerofill DEFAULT NULL,
  `c1` char(10) DEFAULT NULL,
  `c2` enum('a','b','c','d','e','f','g') NOT NULL DEFAULT 'a',
  `c3` double DEFAULT NULL,
  `c4` time DEFAULT NULL,
  UNIQUE KEY `unk` (`c0`) BLOCK_SIZE 16384 LOCAL,
  KEY `ind2` (`c3`) BLOCK_SIZE 16384 LOCAL,
  KEY `ind1` (`c1`) BLOCK_SIZE 16384 LOCAL
) ORGANIZATION INDEX DEFAULT CHARSET = utf8mb4 ROW_FORMAT = DYNAMIC COMPRESSION = 'zstd_1.3.8' REPLICA_NUM = 1 BLOCK_SIZE = 16384 USE_BLOOM_FILTER = FALSE ENABLE_MACRO_BLOCK_BLOOM_FILTER = FALSE TABLET_SIZE = 134217728 PCTFREE = 0
 partition by range(c0)
(partition `r1` values less than (100),
partition `r2` values less than (200),
partition `r3` values less than (300),
partition `r4` values less than (MAXVALUE))
#问题同上
UPDATE t1 SET c0=2,c1='A',c2='b',c3='11.189',c4='22:02:20' WHERE c0=3;
SELECT * FROM t2 WHERE c0=2;
c0	c1	c2	c3	c4
2	AA	b	3.123	2002-02-01
SELECT * FROM t1 WHERE c0=2;
c0	c1	c2	c3	c4
00002	A	b	11.189	22:02:20
DELETE FROM t2 WHERE c0=4;
SELECT * FROM t2 WHERE c0=4;
c0	c1	c2	c3	c4
SELECT * FROM t1 WHERE c0=5;
c0	c1	c2	c3	c4
ALTER TABLE t1 SET PARALLEL=10,BLOCK_SIZE=20480,AUTO_INCREMENT=100;
SHOW CREATE TABLE t1;
Table	Create Table
t1	CREATE TABLE `t1` (
  `c0` smallint(5) unsigned zerofill DEFAULT NULL,
  `c1` char(10) DEFAULT NULL,
  `c2` enum('a','b','c','d','e','f','g') NOT NULL DEFAULT 'a',
  `c3` double DEFAULT NULL,
  `c4` time DEFAULT NULL,
  UNIQUE KEY `unk` (`c0`) BLOCK_SIZE 20480 LOCAL,
  KEY `ind2` (`c3`) BLOCK_SIZE 20480 LOCAL,
  KEY `ind1` (`c1`) BLOCK_SIZE 20480 LOCAL
) ORGANIZATION INDEX DEFAULT CHARSET = utf8mb4 ROW_FORMAT = DYNAMIC COMPRESSION = 'zstd_1.3.8' REPLICA_NUM = 1 BLOCK_SIZE = 20480 USE_BLOOM_FILTER = FALSE ENABLE_MACRO_BLOCK_BLOOM_FILTER = FALSE TABLET_SIZE = 134217728 PCTFREE = 0 PARALLEL 10
 partition by range(c0)
(partition `r1` values less than (100),
partition `r2` values less than (200),
partition `r3` values less than (300),
partition `r4` values less than (MAXVALUE))
#问题同上，修改后执行sql
UPDATE t1 SET c0=3,c1='CCC',c2='d',c3='13.139',c4='23:33:30' WHERE c0=4;
SELECT * FROM t2 WHERE c0=3;
c0	c1	c2	c3	c4
SELECT * FROM t1 WHERE c0=3;
c0	c1	c2	c3	c4
00003	CCC	d	13.139	23:33:30
DELETE FROM t2 WHERE c0=2;
SELECT * FROM t2 WHERE c0=2;
c0	c1	c2	c3	c4
SELECT * FROM t1 WHERE c0=3;
c0	c1	c2	c3	c4
SET sql_mode='NO_AUTO_VALUE_ON_ZERO';
DROP TABLE IF EXISTS t2;
CREATE TABLE t2(c0 INT,
c1 VARCHAR(10),
c2 SET('a','b','c','d','e','f','g'),
c3 FLOAT,
c4 DATE)
PARTITION BY RANGE(c0)
(PARTITION p1 VALUES LESS THAN(0),
PARTITION p2 VALUES LESS THAN(50),
PARTITION p3 VALUES LESS THAN(100),
PARTITION p4 VALUES LESS THAN(MAXVALUE)
);
INSERT INTO t2 VALUES(0,'AA','a',0.123,'2000-01-01'),
(1,'BB','a',2.123,'2001-11-11'),
(3,'CC','b',3.123,'2002-02-01'),
(4,'DD','b',4.123,'2003-03-11'),
(5,'EE','c',5.123,'2004-04-01'),
(6,'FF','c',6.123,'2005-05-11');
DROP TABLE IF EXISTS t1;
CREATE TABLE t1(c0 SMALLINT ZEROFILL,
c1 CHAR(10),
c2 ENUM('a','b','c','d','e','f','g') NOT NULL DEFAULT 'a',
c3 DOUBLE,
c4 TIME,
CONSTRAINT uni_key UNIQUE KEY(c0))
PARTITION BY RANGE(c0)
(PARTITION r1 VALUES LESS THAN(100),
PARTITION r2 VALUES LESS THAN(200),
PARTITION r3 VALUES LESS THAN(300),
PARTITION r4 VALUES LESS THAN(MAXVALUE)
);
INSERT INTO t1 VALUES(0,'AAA','a',10.123,'20:01:01'),
(1,'BBB','b',12.123,'21:11:11'),
(2,'CCC','c',13.123,'22:22:01'),
(3,'DDD','c',14.123,'23:33:11'),
(4,'EEE','c',15.123,'19:44:01'),
(5,'FFF','d',16.123,'18:55:11'),
(6,'EEE','d',16.123,'17:05:17');
CREATE INDEX ind_1 ON t1(c3,c4);
CREATE INDEX ind_2 ON t1(c3);
DROP TRIGGER IF EXISTS trg_insert;
CREATE TRIGGER trg_insert AFTER INSERT ON t2
FOR EACH ROW
BEGIN
DECLARE c INT;
SELECT MAX(c0) INTO c FROM t1;
IF NEW.c0 = c THEN
DELETE FROM t1 WHERE c0 = NEW.c0;
ELSE
INSERT INTO t1 VALUES(NEW.c0,CONCAT(NEW.c1,NEW.c1),LOWER(NEW.c1),2*NEW.c0,'00:00:00');
END IF;
END;
//
DROP TRIGGER IF EXISTS trg_update;//
CREATE TRIGGER trg_update AFTER UPDATE ON t1
FOR EACH ROW
BEGIN
UPDATE t2 SET c0=NEW.c0,c1=NEW.c1 WHERE c0=OLD.c0;
END
//
DROP TRIGGER IF EXISTS trg_delete;//
CREATE TRIGGER trg_delete AFTER DELETE ON t2
FOR EACH ROW
BEGIN
DELETE FROM t1 WHERE c0=OLD.c0+1;
END;
//
#暂不支持，待支持后执行sql
DROP TABLE IF EXISTS t2;
CREATE TABLE t2(c0 SMALLINT ZEROFILL,c1 VARCHAR(10),CONSTRAINT fk_c0_c0 FOREIGN KEY(c0) REFERENCES t1(c0));
INSERT INTO t2 VALUES(2,'b'),(3,'b'),(4,'c'),(5,'c');
ALTER TABLE t1 DROP INDEX uni_key,ADD CONSTRAINT uni UNIQUE KEY(c0,c2);
ERROR HY000: Dropping and adding indexes at the same time is a high-risk operation, which is not supported
SHOW CREATE TABLE t1;
Table	Create Table
t1	CREATE TABLE `t1` (
  `c0` smallint(5) unsigned zerofill DEFAULT NULL,
  `c1` char(10) DEFAULT NULL,
  `c2` enum('a','b','c','d','e','f','g') NOT NULL DEFAULT 'a',
  `c3` double DEFAULT NULL,
  `c4` time DEFAULT NULL,
  UNIQUE KEY `uni_key` (`c0`) BLOCK_SIZE 16384 LOCAL,
  KEY `ind_1` (`c3`, `c4`) BLOCK_SIZE 16384 LOCAL,
  KEY `ind_2` (`c3`) BLOCK_SIZE 16384 LOCAL
) ORGANIZATION INDEX DEFAULT CHARSET = utf8mb4 ROW_FORMAT = DYNAMIC COMPRESSION = 'zstd_1.3.8' REPLICA_NUM = 1 BLOCK_SIZE = 16384 USE_BLOOM_FILTER = FALSE ENABLE_MACRO_BLOCK_BLOOM_FILTER = FALSE TABLET_SIZE = 134217728 PCTFREE = 0
 partition by range(c0)
(partition `r1` values less than (100),
partition `r2` values less than (200),
partition `r3` values less than (300),
partition `r4` values less than (MAXVALUE))
CREATE TRIGGER trg_insert AFTER INSERT ON t2
FOR EACH ROW
BEGIN
DECLARE c INT;
SELECT MAX(c0) INTO c FROM t1;
IF NEW.c0 = c THEN
DELETE FROM t1 WHERE c0 = NEW.c0;
ELSE
INSERT INTO t1 VALUES(NEW.c0,CONCAT(NEW.c1,NEW.c1),LOWER(NEW.c1),2*NEW.c0,'00:00:00');
END IF;
END;
//
CREATE TRIGGER trg_delete AFTER DELETE ON t2
FOR EACH ROW
BEGIN
DELETE FROM t1 WHERE c0=OLD.c0+1;
END;
//
ALTER TABLE t2 DROP FOREIGN KEY fk_c0_c0,ADD CONSTRAINT fk_c1_c2 FOREIGN KEY(c1) REFERENCES t1(c2);
ERROR HY000: Cannot add foreign key constraint
SHOW CREATE TABLE t2;
Table	Create Table
t2	CREATE TABLE `t2` (
  `c0` smallint(5) unsigned zerofill DEFAULT NULL,
  `c1` varchar(10) DEFAULT NULL,
  CONSTRAINT `fk_c0_c0` FOREIGN KEY (`c0`) REFERENCES `trigger_test`.`t1`(`c0`) ON UPDATE RESTRICT ON DELETE RESTRICT 
) ORGANIZATION INDEX DEFAULT CHARSET = utf8mb4 ROW_FORMAT = DYNAMIC COMPRESSION = 'zstd_1.3.8' REPLICA_NUM = 1 BLOCK_SIZE = 16384 USE_BLOOM_FILTER = FALSE ENABLE_MACRO_BLOCK_BLOOM_FILTER = FALSE TABLET_SIZE = 134217728 PCTFREE = 0
DROP TABLE IF EXISTS test1;
ALTER TABLE t1 RENAME test1;
SHOW TABLES;
Tables_in_trigger_test
t2
test1
SELECT test1.c0,test1.c1 FROM test1 ORDER BY 1;
c0	c1
00000	AAA
00001	BBB
00002	CCC
00003	DDD
00004	EEE
00005	FFF
00006	EEE
INSERT INTO t2 VALUES(0,'a');
ERROR 42S02: Table 'trigger_test.t1' doesn't exist
UPDATE test1 SET c0=20,c1='b' WHERE c0=3;
ERROR 23000: Cannot delete or update a parent row: a foreign key constraint fails
DELETE FROM t2 WHERE c0=3;
ERROR 42S02: Table 'trigger_test.t1' doesn't exist
#LIST分区
SET sql_mode='STRICT_TRANS_TABLES,STRICT_ALL_TABLES,NO_AUTO_VALUE_ON_ZERO';
DROP TABLE IF EXISTS t2;
CREATE TABLE t2(c0 INT,
c1 VARCHAR(10),
c2 SET('a','b','c','d','e','f','g'),
c3 FLOAT,
c4 DATE)
PARTITION BY LIST(c0)
(PARTITION p1 VALUES IN(0,1,2,3,4,5,6,7,8,9,10),
PARTITION p2 VALUES IN(11,12,13,14,15,16,17,18,19,20),
PARTITION p3 VALUES IN(21,22,23,24,25,26,27,28,29,30),
PARTITION p4 VALUES IN(31,32,33,34,35,36,37,38,39,40)
);
INSERT INTO t2 VALUES(0,'AA','a','0.123','2000-01-01'),
(1,'BB','a','2.123','2001-11-11'),
(3,'CC','b','3.123','2002-02-01'),
(4,'DD','b','4.123','2003-03-11'),
(5,'EE','c','5.123','2004-04-01'),
(6,'FF','c','6.123','2005-05-11');
DROP TABLE IF EXISTS t1;
CREATE TABLE t1(c0 SMALLINT ZEROFILL PRIMARY KEY,
c1 CHAR(10),
c2 ENUM('a','b','c','d','e','f','g') NOT NULL DEFAULT 'a',
c3 DOUBLE,
c4 TIME,
CONSTRAINT uni_key UNIQUE KEY(c0,c2))
PARTITION BY LIST(c0)
(PARTITION r1 VALUES IN(0,1,2,3,4,5,6,7,8,9,10),
PARTITION r2 VALUES IN(11,12,13,14,15,16,17,18,19,20),
PARTITION r3 VALUES IN(21,22,23,24,25,26,27,28,29,30),
PARTITION r4 VALUES IN(31,32,33,34,35,36,37,38,39,40)
);
INSERT INTO t1 VALUES(0,'AAA','a','10.123','20:01:01'),
(1,'BBB','b','12.123','21:11:11'),
(3,'CCC','c','13.123','22:22:01'),
(4,'DDD','c','14.123','23:33:11'),
(5,'EEE','c','15.123','19:44:01'),
(6,'FFF','d','16.123','18:55:11');
CREATE INDEX ind_1 ON t1(c3,c4);
CREATE INDEX ind_2 ON t1(c3);
DROP TRIGGER IF EXISTS trg_insert;
CREATE TRIGGER trg_insert AFTER INSERT ON t2
FOR EACH ROW
BEGIN
DECLARE c INT;
SELECT MAX(c0) INTO c FROM t1;
IF NEW.c0 = c THEN
DELETE FROM t1 WHERE c0 = NEW.c0;
ELSE
INSERT INTO t1 VALUES(NEW.c0,CONCAT(NEW.c1,NEW.c1),NEW.c2,NEW.c3+NEW.c0,TIME(NEW.c4));
END IF;
END;
//
DROP TRIGGER IF EXISTS trg_update;//
CREATE TRIGGER trg_update AFTER UPDATE ON t1
FOR EACH ROW
BEGIN
UPDATE t2 SET c0=NEW.c0,c1=CONCAT(NEW.c1,NEW.c1) WHERE c0=OLD.c0;
END
//
DROP TRIGGER IF EXISTS trg_delete;//
CREATE TRIGGER trg_delete AFTER DELETE ON t2
FOR EACH ROW
BEGIN
DELETE FROM t1 WHERE c0=OLD.c0+1;
END;
//
alter system set _enable_drop_and_add_index = true;
ALTER TABLE t1 DROP INDEX ind_1,ADD INDEX ind1(c1),RENAME INDEX ind_2 TO ind2;
alter system set _enable_drop_and_add_index = false;
SHOW CREATE TABLE t1;
Table	Create Table
t1	CREATE TABLE `t1` (
  `c0` smallint(5) unsigned zerofill NOT NULL,
  `c1` char(10) DEFAULT NULL,
  `c2` enum('a','b','c','d','e','f','g') NOT NULL DEFAULT 'a',
  `c3` double DEFAULT NULL,
  `c4` time DEFAULT NULL,
  PRIMARY KEY (`c0`),
  UNIQUE KEY `uni_key` (`c0`, `c2`) BLOCK_SIZE 16384 LOCAL,
  KEY `ind2` (`c3`) BLOCK_SIZE 16384 LOCAL,
  KEY `ind1` (`c1`) BLOCK_SIZE 16384 LOCAL
) ORGANIZATION INDEX DEFAULT CHARSET = utf8mb4 ROW_FORMAT = DYNAMIC COMPRESSION = 'zstd_1.3.8' REPLICA_NUM = 1 BLOCK_SIZE = 16384 USE_BLOOM_FILTER = FALSE ENABLE_MACRO_BLOCK_BLOOM_FILTER = FALSE TABLET_SIZE = 134217728 PCTFREE = 0
 partition by list(c0)
(partition `r1` values in (0,1,2,3,4,5,6,7,8,9,10),
partition `r2` values in (11,12,13,14,15,16,17,18,19,20),
partition `r3` values in (21,22,23,24,25,26,27,28,29,30),
partition `r4` values in (31,32,33,34,35,36,37,38,39,40))
SELECT /*+INDEX(ind1)*/ * FROM t1 WHERE c1='AAA';
c0	c1	c2	c3	c4
00000	AAA	a	10.123	20:01:01
#此处执行OB报错，待开发修复后执行，问题链接：
UPDATE t1 SET c0=16,c1='H',c2='a',c3='17.789',c4='06:00:00' WHERE c0=6;
SELECT * FROM t2 WHERE c0=16;
c0	c1	c2	c3	c4
16	HH	c	6.123	2005-05-11
SELECT * FROM t1 WHERE c0=16;
c0	c1	c2	c3	c4
00016	H	a	17.789	06:00:00
DELETE FROM t2 WHERE c0=1;
SELECT * FROM t2 WHERE c0=1;
c0	c1	c2	c3	c4
SELECT * FROM t1 WHERE c0=2;
c0	c1	c2	c3	c4
alter system set _enable_drop_and_add_index = true;
ALTER TABLE t1 ADD CONSTRAINT unk UNIQUE KEY(c0),DROP INDEX uni_key;
alter system set _enable_drop_and_add_index = false;
SHOW CREATE TABLE t1;
Table	Create Table
t1	CREATE TABLE `t1` (
  `c0` smallint(5) unsigned zerofill NOT NULL,
  `c1` char(10) DEFAULT NULL,
  `c2` enum('a','b','c','d','e','f','g') NOT NULL DEFAULT 'a',
  `c3` double DEFAULT NULL,
  `c4` time DEFAULT NULL,
  PRIMARY KEY (`c0`),
  UNIQUE KEY `unk` (`c0`) BLOCK_SIZE 16384 LOCAL,
  KEY `ind2` (`c3`) BLOCK_SIZE 16384 LOCAL,
  KEY `ind1` (`c1`) BLOCK_SIZE 16384 LOCAL
) ORGANIZATION INDEX DEFAULT CHARSET = utf8mb4 ROW_FORMAT = DYNAMIC COMPRESSION = 'zstd_1.3.8' REPLICA_NUM = 1 BLOCK_SIZE = 16384 USE_BLOOM_FILTER = FALSE ENABLE_MACRO_BLOCK_BLOOM_FILTER = FALSE TABLET_SIZE = 134217728 PCTFREE = 0
 partition by list(c0)
(partition `r1` values in (0,1,2,3,4,5,6,7,8,9,10),
partition `r2` values in (11,12,13,14,15,16,17,18,19,20),
partition `r3` values in (21,22,23,24,25,26,27,28,29,30),
partition `r4` values in (31,32,33,34,35,36,37,38,39,40))
#问题同上
UPDATE t1 SET c0=2,c1='A',c2='b',c3='11.189',c4='22:02:20' WHERE c0=3;
SELECT * FROM t2 WHERE c0=2;
c0	c1	c2	c3	c4
2	AA	b	3.123	2002-02-01
SELECT * FROM t1 WHERE c0=2;
c0	c1	c2	c3	c4
00002	A	b	11.189	22:02:20
DELETE FROM t2 WHERE c0=4;
SELECT * FROM t2 WHERE c0=4;
c0	c1	c2	c3	c4
SELECT * FROM t1 WHERE c0=5;
c0	c1	c2	c3	c4
ALTER TABLE t1 SET PARALLEL=10,BLOCK_SIZE=20480,AUTO_INCREMENT=100;
SHOW CREATE TABLE t1;
Table	Create Table
t1	CREATE TABLE `t1` (
  `c0` smallint(5) unsigned zerofill NOT NULL,
  `c1` char(10) DEFAULT NULL,
  `c2` enum('a','b','c','d','e','f','g') NOT NULL DEFAULT 'a',
  `c3` double DEFAULT NULL,
  `c4` time DEFAULT NULL,
  PRIMARY KEY (`c0`),
  UNIQUE KEY `unk` (`c0`) BLOCK_SIZE 20480 LOCAL,
  KEY `ind2` (`c3`) BLOCK_SIZE 20480 LOCAL,
  KEY `ind1` (`c1`) BLOCK_SIZE 20480 LOCAL
) ORGANIZATION INDEX DEFAULT CHARSET = utf8mb4 ROW_FORMAT = DYNAMIC COMPRESSION = 'zstd_1.3.8' REPLICA_NUM = 1 BLOCK_SIZE = 20480 USE_BLOOM_FILTER = FALSE ENABLE_MACRO_BLOCK_BLOOM_FILTER = FALSE TABLET_SIZE = 134217728 PCTFREE = 0 PARALLEL 10
 partition by list(c0)
(partition `r1` values in (0,1,2,3,4,5,6,7,8,9,10),
partition `r2` values in (11,12,13,14,15,16,17,18,19,20),
partition `r3` values in (21,22,23,24,25,26,27,28,29,30),
partition `r4` values in (31,32,33,34,35,36,37,38,39,40))
#问题同上，修改后执行sql
UPDATE t1 SET c0=3,c1='CCC',c2='d',c3='13.139',c4='23:33:30' WHERE c0=4;
SELECT * FROM t2 WHERE c0=3;
c0	c1	c2	c3	c4
SELECT * FROM t1 WHERE c0=3;
c0	c1	c2	c3	c4
00003	CCC	d	13.139	23:33:30
DELETE FROM t2 WHERE c0=2;
SELECT * FROM t2 WHERE c0=2;
c0	c1	c2	c3	c4
SELECT * FROM t1 WHERE c0=3;
c0	c1	c2	c3	c4
SET sql_mode='NO_AUTO_VALUE_ON_ZERO';
DROP TABLE IF EXISTS t2;
CREATE TABLE t2(c0 INT,
c1 VARCHAR(10),
c2 SET('a','b','c','d','e','f','g'),
c3 FLOAT,
c4 DATE)
PARTITION BY LIST(c0)
(PARTITION p1 VALUES IN(0,1,2,3,4,5,6,7,8,9,10),
PARTITION p2 VALUES IN(11,12,13,14,15,16,17,18,19,20),
PARTITION p3 VALUES IN(21,22,23,24,25,26,27,28,29,30),
PARTITION p4 VALUES IN(31,32,33,34,35,36,37,38,39,40)
);
INSERT INTO t2 VALUES(0,'AA','a','0.123','2000-01-01'),
(1,'BB','a','2.123','2001-11-11'),
(3,'CC','b','3.123','2002-02-01'),
(4,'DD','b','4.123','2003-03-11'),
(5,'EE','c','5.123','2004-04-01'),
(6,'FF','c','6.123','2005-05-11');
DROP TABLE IF EXISTS t1;
CREATE TABLE t1(c0 SMALLINT ZEROFILL PRIMARY KEY,
c1 CHAR(10),
c2 ENUM('a','b','c','d','e','f','g') NOT NULL DEFAULT 'a',
c3 DOUBLE,
c4 TIME,
CONSTRAINT uni_key UNIQUE KEY(c0,c2))
PARTITION BY LIST(c0)
(PARTITION r1 VALUES IN(0,1,2,3,4,5,6,7,8,9,10),
PARTITION r2 VALUES IN(11,12,13,14,15,16,17,18,19,20),
PARTITION r3 VALUES IN(21,22,23,24,25,26,27,28,29,30),
PARTITION r4 VALUES IN(31,32,33,34,35,36,37,38,39,40)
);
INSERT INTO t1 VALUES(0,'AAA','a','10.123','20:01:01'),
(1,'BBB','b','12.123','21:11:11'),
(3,'CCC','c','13.123','22:22:01'),
(4,'DDD','c','14.123','23:33:11'),
(5,'EEE','c','15.123','19:44:01'),
(6,'FFF','d','16.123','18:55:11');
DROP TRIGGER IF EXISTS trg_insert;
CREATE TRIGGER trg_insert AFTER INSERT ON t2
FOR EACH ROW
BEGIN
DECLARE c INT;
SELECT MAX(c0) INTO c FROM t1;
IF NEW.c0 = c THEN
DELETE FROM t1 WHERE c0 = NEW.c0;
ELSE
INSERT INTO t1 VALUES(NEW.c0,CONCAT(NEW.c1,NEW.c1),LOWER(NEW.c1),2*NEW.c0,'00:00:00');
END IF;
END;
//
DROP TRIGGER IF EXISTS trg_update;//
CREATE TRIGGER trg_update AFTER UPDATE ON t1
FOR EACH ROW
BEGIN
UPDATE t2 SET c0=NEW.c0,c1=NEW.c1 WHERE c0=OLD.c0;
END
//
DROP TRIGGER IF EXISTS trg_delete;//
CREATE TRIGGER trg_delete AFTER DELETE ON t2
FOR EACH ROW
BEGIN
DELETE FROM t1 WHERE c0=OLD.c0+1;
END;
//
#暂不支持，待支持后执行sql
DROP TABLE IF EXISTS t2;
CREATE TABLE t2(c0 SMALLINT ZEROFILL,c1 VARCHAR(10),CONSTRAINT fk_c0_c0 FOREIGN KEY(c0) REFERENCES t1(c0));
INSERT INTO t2 VALUES(0,'b'),(3,'b'),(4,'c'),(5,'c');
alter system set _enable_drop_and_add_index = true;
ALTER TABLE t1 DROP INDEX uni_key,ADD CONSTRAINT uni UNIQUE KEY(c0,c2);
alter system set _enable_drop_and_add_index = false;
SHOW CREATE TABLE t1;
Table	Create Table
t1	CREATE TABLE `t1` (
  `c0` smallint(5) unsigned zerofill NOT NULL,
  `c1` char(10) DEFAULT NULL,
  `c2` enum('a','b','c','d','e','f','g') NOT NULL DEFAULT 'a',
  `c3` double DEFAULT NULL,
  `c4` time DEFAULT NULL,
  PRIMARY KEY (`c0`),
  UNIQUE KEY `uni` (`c0`, `c2`) BLOCK_SIZE 16384 LOCAL
) ORGANIZATION INDEX DEFAULT CHARSET = utf8mb4 ROW_FORMAT = DYNAMIC COMPRESSION = 'zstd_1.3.8' REPLICA_NUM = 1 BLOCK_SIZE = 16384 USE_BLOOM_FILTER = FALSE ENABLE_MACRO_BLOCK_BLOOM_FILTER = FALSE TABLET_SIZE = 134217728 PCTFREE = 0
 partition by list(c0)
(partition `r1` values in (0,1,2,3,4,5,6,7,8,9,10),
partition `r2` values in (11,12,13,14,15,16,17,18,19,20),
partition `r3` values in (21,22,23,24,25,26,27,28,29,30),
partition `r4` values in (31,32,33,34,35,36,37,38,39,40))
CREATE TRIGGER trg_insert AFTER INSERT ON t2
FOR EACH ROW
BEGIN
DECLARE c INT;
SELECT MAX(c0) INTO c FROM t1;
IF NEW.c0 = c THEN
DELETE FROM t1 WHERE c0 = NEW.c0;
ELSE
INSERT INTO t1 VALUES(NEW.c0,CONCAT(NEW.c1,NEW.c1),LOWER(NEW.c1),2*NEW.c0,'00:00:00');
END IF;
END;
//
CREATE TRIGGER trg_delete AFTER DELETE ON t2
FOR EACH ROW
BEGIN
DELETE FROM t1 WHERE c0=OLD.c0+1;
END;
//
ALTER TABLE t2 DROP FOREIGN KEY fk_c0_c0,ADD CONSTRAINT fk_c1_c2 FOREIGN KEY(c1) REFERENCES t1(c2);
ERROR HY000: Cannot add foreign key constraint
SHOW CREATE TABLE t2;
Table	Create Table
t2	CREATE TABLE `t2` (
  `c0` smallint(5) unsigned zerofill DEFAULT NULL,
  `c1` varchar(10) DEFAULT NULL,
  CONSTRAINT `fk_c0_c0` FOREIGN KEY (`c0`) REFERENCES `trigger_test`.`t1`(`c0`) ON UPDATE RESTRICT ON DELETE RESTRICT 
) ORGANIZATION INDEX DEFAULT CHARSET = utf8mb4 ROW_FORMAT = DYNAMIC COMPRESSION = 'zstd_1.3.8' REPLICA_NUM = 1 BLOCK_SIZE = 16384 USE_BLOOM_FILTER = FALSE ENABLE_MACRO_BLOCK_BLOOM_FILTER = FALSE TABLET_SIZE = 134217728 PCTFREE = 0
DROP TABLE IF EXISTS test1;
ALTER TABLE t1 RENAME test1;
SHOW TABLES;
Tables_in_trigger_test
t2
test1
SELECT test1.c0,test1.c1 FROM test1 ORDER BY 1;
c0	c1
00000	AAA
00001	BBB
00003	CCC
00004	DDD
00005	EEE
00006	FFF
INSERT INTO t2 VALUES(0,'a');
ERROR 42S02: Table 'trigger_test.t1' doesn't exist
UPDATE test1 SET c0=20,c1='b' WHERE c0=3;
ERROR 23000: Cannot delete or update a parent row: a foreign key constraint fails
DELETE FROM t2 WHERE c0=3;
ERROR 42S02: Table 'trigger_test.t1' doesn't exist
DROP TABLE IF EXISTS t2;
CREATE TABLE t2(c0 INT,
c1 VARCHAR(10),
c2 SET('a','b','c','d','e','f','g'),
c3 FLOAT,
c4 DATE)
PARTITION BY LIST(c0)
(PARTITION p1 VALUES IN(0,1,2,3,4,5,6,7,8,9,10),
PARTITION p2 VALUES IN(11,12,13,14,15,16,17,18,19,20),
PARTITION p3 VALUES IN(21,22,23,24,25,26,27,28,29,30),
PARTITION p4 VALUES IN(31,32,33,34,35,36,37,38,39,40)
);
INSERT INTO t2 VALUES(0,'AA','a','0.123','2000-01-01'),
(1,'BB','a','2.123','2001-11-11'),
(3,'CC','b','3.123','2002-02-01'),
(4,'DD','b','4.123','2003-03-11'),
(5,'EE','c','5.123','2004-04-01'),
(6,'FF','c','6.123','2005-05-11');
DROP TABLE IF EXISTS t1;
CREATE TABLE t1(c0 SMALLINT ZEROFILL PRIMARY KEY,
c1 CHAR(10),
c2 ENUM('a','b','c','d','e','f','g') NOT NULL DEFAULT 'a',
c3 DOUBLE,
c4 TIME,
CONSTRAINT uni_key UNIQUE KEY(c0,c2))
PARTITION BY LIST(c0)
(PARTITION r1 VALUES IN(0,1,2,3,4,5,6,7,8,9,10),
PARTITION r2 VALUES IN(11,12,13,14,15,16,17,18,19,20),
PARTITION r3 VALUES IN(21,22,23,24,25,26,27,28,29,30),
PARTITION r4 VALUES IN(31,32,33,34,35,36,37,38,39,40)
);
INSERT INTO t1 VALUES(0,'AAA','a','10.123','20:01:01'),
(1,'BBB','b','12.123','21:11:11'),
(3,'CCC','c','13.123','22:22:01'),
(4,'DDD','c','14.123','23:33:11'),
(5,'EEE','c','15.123','19:44:01'),
(6,'FFF','d','16.123','18:55:11');
CREATE INDEX ind_1 ON t1(c3,c4);
CREATE INDEX ind_2 ON t1(c3);
DROP TRIGGER IF EXISTS trg_insert;
CREATE TRIGGER trg_insert AFTER INSERT ON t2
FOR EACH ROW
BEGIN
DECLARE c INT;
SELECT MAX(c0) INTO c FROM t1;
IF NEW.c0 = c THEN
DELETE FROM t1 WHERE c0 = NEW.c0;
ELSE
INSERT INTO t1 VALUES(NEW.c0,CONCAT(NEW.c1,NEW.c1),NEW.c2,NEW.c3+NEW.c0,TIME(NEW.c4));
END IF;
END;
//
DROP TRIGGER IF EXISTS trg_update;//
CREATE TRIGGER trg_update AFTER UPDATE ON t1
FOR EACH ROW
BEGIN
UPDATE t2 SET c0=NEW.c0,c1=CONCAT(NEW.c1,NEW.c1) WHERE c0=OLD.c0;
END
//
DROP TRIGGER IF EXISTS trg_delete;//
CREATE TRIGGER trg_delete AFTER DELETE ON t2
FOR EACH ROW
BEGIN
DELETE FROM t1 WHERE c0=OLD.c0+1;
END;
//
ALTER TABLE t1 TRUNCATE PARTITION r2;
ALTER TABLE t1 ADD PARTITION (PARTITION r5 VALUES IN (41,42,43,44,45,46,47,48,49,50));
ALTER TABLE t1  DROP PARTITION r4;
SHOW CREATE TABLE t1;
Table	Create Table
t1	CREATE TABLE `t1` (
  `c0` smallint(5) unsigned zerofill NOT NULL,
  `c1` char(10) DEFAULT NULL,
  `c2` enum('a','b','c','d','e','f','g') NOT NULL DEFAULT 'a',
  `c3` double DEFAULT NULL,
  `c4` time DEFAULT NULL,
  PRIMARY KEY (`c0`),
  UNIQUE KEY `uni_key` (`c0`, `c2`) BLOCK_SIZE 16384 LOCAL,
  KEY `ind_1` (`c3`, `c4`) BLOCK_SIZE 16384 LOCAL,
  KEY `ind_2` (`c3`) BLOCK_SIZE 16384 LOCAL
) ORGANIZATION INDEX DEFAULT CHARSET = utf8mb4 ROW_FORMAT = DYNAMIC COMPRESSION = 'zstd_1.3.8' REPLICA_NUM = 1 BLOCK_SIZE = 16384 USE_BLOOM_FILTER = FALSE ENABLE_MACRO_BLOCK_BLOOM_FILTER = FALSE TABLET_SIZE = 134217728 PCTFREE = 0
 partition by list(c0)
(partition `r1` values in (0,1,2,3,4,5,6,7,8,9,10),
partition `r2` values in (11,12,13,14,15,16,17,18,19,20),
partition `r3` values in (21,22,23,24,25,26,27,28,29,30),
partition `r5` values in (41,42,43,44,45,46,47,48,49,50))
ALTER TABLE t2 TRUNCATE PARTITION p4;
ALTER TABLE t2 ADD PARTITION (PARTITION p5 VALUES IN (41,42,43,44,45,46,47,48,49,50));
ALTER TABLE t2  DROP PARTITION p3;
SHOW CREATE TABLE t2;
Table	Create Table
t2	CREATE TABLE `t2` (
  `c0` int(11) DEFAULT NULL,
  `c1` varchar(10) DEFAULT NULL,
  `c2` set('a','b','c','d','e','f','g') DEFAULT NULL,
  `c3` float DEFAULT NULL,
  `c4` date DEFAULT NULL
) ORGANIZATION INDEX DEFAULT CHARSET = utf8mb4 ROW_FORMAT = DYNAMIC COMPRESSION = 'zstd_1.3.8' REPLICA_NUM = 1 BLOCK_SIZE = 16384 USE_BLOOM_FILTER = FALSE ENABLE_MACRO_BLOCK_BLOOM_FILTER = FALSE TABLET_SIZE = 134217728 PCTFREE = 0
 partition by list(c0)
(partition `p1` values in (0,1,2,3,4,5,6,7,8,9,10),
partition `p2` values in (11,12,13,14,15,16,17,18,19,20),
partition `p4` values in (31,32,33,34,35,36,37,38,39,40),
partition `p5` values in (41,42,43,44,45,46,47,48,49,50))
INSERT INTO t2 VALUES(22,'WW','g','22.123','2022-03-13');
ERROR HY000: Table has no partition for value
SELECT * FROM t2 ORDER BY 1;
c0	c1	c2	c3	c4
0	AA	a	0.123	2000-01-01
1	BB	a	2.123	2001-11-11
3	CC	b	3.123	2002-02-01
4	DD	b	4.123	2003-03-11
5	EE	c	5.123	2004-04-01
6	FF	c	6.123	2005-05-11
SELECT * FROM t1 ORDER BY 1;
c0	c1	c2	c3	c4
00000	AAA	a	10.123	20:01:01
00001	BBB	b	12.123	21:11:11
00003	CCC	c	13.123	22:22:01
00004	DDD	c	14.123	23:33:11
00005	EEE	c	15.123	19:44:01
00006	FFF	d	16.123	18:55:11
UPDATE t1 SET c0=23,c1='A' WHERE c0=0;
ERROR HY000: Table has no partition for value
SELECT * FROM t2 ORDER BY 1;
c0	c1	c2	c3	c4
0	AA	a	0.123	2000-01-01
1	BB	a	2.123	2001-11-11
3	CC	b	3.123	2002-02-01
4	DD	b	4.123	2003-03-11
5	EE	c	5.123	2004-04-01
6	FF	c	6.123	2005-05-11
SELECT * FROM t1 ORDER BY 1;
c0	c1	c2	c3	c4
00000	AAA	a	10.123	20:01:01
00001	BBB	b	12.123	21:11:11
00003	CCC	c	13.123	22:22:01
00004	DDD	c	14.123	23:33:11
00005	EEE	c	15.123	19:44:01
00006	FFF	d	16.123	18:55:11
UPDATE t1 SET c0=32,c1='A' WHERE c0=0;
ERROR HY000: Table has no partition for value
SELECT * FROM t2 ORDER BY 1;
c0	c1	c2	c3	c4
0	AA	a	0.123	2000-01-01
1	BB	a	2.123	2001-11-11
3	CC	b	3.123	2002-02-01
4	DD	b	4.123	2003-03-11
5	EE	c	5.123	2004-04-01
6	FF	c	6.123	2005-05-11
SELECT * FROM t1 ORDER BY 1;
c0	c1	c2	c3	c4
00000	AAA	a	10.123	20:01:01
00001	BBB	b	12.123	21:11:11
00003	CCC	c	13.123	22:22:01
00004	DDD	c	14.123	23:33:11
00005	EEE	c	15.123	19:44:01
00006	FFF	d	16.123	18:55:11
UPDATE t1 SET c0=41,c1='A' WHERE c0=0;
SELECT * FROM t2 ORDER BY 1;
c0	c1	c2	c3	c4
1	BB	a	2.123	2001-11-11
3	CC	b	3.123	2002-02-01
4	DD	b	4.123	2003-03-11
5	EE	c	5.123	2004-04-01
6	FF	c	6.123	2005-05-11
41	AA	a	0.123	2000-01-01
SELECT * FROM t1 ORDER BY 1;
c0	c1	c2	c3	c4
00001	BBB	b	12.123	21:11:11
00003	CCC	c	13.123	22:22:01
00004	DDD	c	14.123	23:33:11
00005	EEE	c	15.123	19:44:01
00006	FFF	d	16.123	18:55:11
00041	A	a	10.123	20:01:01
DELETE FROM t2 WHERE c0 IN(1,3,5);
SELECT * FROM t2 ORDER BY 1;
c0	c1	c2	c3	c4
4	DD	b	4.123	2003-03-11
6	FF	c	6.123	2005-05-11
41	AA	a	0.123	2000-01-01
SELECT * FROM t1 ORDER BY 1;
c0	c1	c2	c3	c4
00001	BBB	b	12.123	21:11:11
00003	CCC	c	13.123	22:22:01
00005	EEE	c	15.123	19:44:01
00041	A	a	10.123	20:01:01
#创建不同类型的分区表，使用不同约束索引条件，然后再创建不同触发类型的trigger，最后对表中的列执行DDL操作后触发trigger
#RANGE分区
SET sql_mode='STRICT_TRANS_TABLES,STRICT_ALL_TABLES,NO_AUTO_VALUE_ON_ZERO';
DROP TABLE IF EXISTS t2;
CREATE TABLE t2(c0 INT,
c1 VARCHAR(10),
c2 SET('a','b','c','d','e','f','g'),
c3 FLOAT,
c4 DATE,
c5 YEAR DEFAULT '2000',
c6 TEXT ,
c7 VARBINARY(10) DEFAULT 'TEST')
PARTITION BY RANGE(c0)
(PARTITION p1 VALUES LESS THAN(0),
PARTITION p2 VALUES LESS THAN(50),
PARTITION p3 VALUES LESS THAN(100),
PARTITION p4 VALUES LESS THAN(MAXVALUE)
);
INSERT INTO t2 VALUES(0,'AA','a',0.123,'2000-01-01','2000','TEST1','TEST1'),
(1,'BB','a',2.123,'2001-11-11','2001','TEST2','TEST2'),
(3,'CC','b',3.123,'2002-02-01','2002','TEST3','TEST3'),
(4,'DD','b',4.123,'2003-03-11','2003','TEST4','TEST4'),
(5,'EE','c',5.123,'2004-04-01','2004','TEST5','TEST5'),
(6,'FF','c',6.123,'2005-05-11','2005','TEST6','TEST6');
DROP TABLE IF EXISTS t1;
CREATE TABLE t1(c0 SMALLINT ZEROFILL,
c1 CHAR(10),
c2 ENUM('a','b','c','d','e','f','g') NOT NULL DEFAULT 'a',
c3 DOUBLE,
c4 TIME,
c5 INT DEFAULT 0,
c6 BLOB,
c7 BINARY(10) DEFAULT 'test',
CONSTRAINT uni_key UNIQUE KEY(c0,c2))
PARTITION BY RANGE(c0)
(PARTITION r1 VALUES LESS THAN(100),
PARTITION r2 VALUES LESS THAN(200),
PARTITION r3 VALUES LESS THAN(300),
PARTITION r4 VALUES LESS THAN(MAXVALUE)
);
INSERT INTO t1 VALUES(0,'AAA','a',10.123,'20:01:01',2000,'TEST1','TEST1'),
(1,'BBB','b',12.123,'21:11:11',2001,'TEST2','TEST2'),
(2,'CCC','c',13.123,'22:22:01',2002,'TEST3','TEST3'),
(3,'DDD','c',14.123,'23:33:11',2003,'TEST4','TEST4'),
(4,'EEE','c',15.123,'19:44:01',2004,'TEST5','TEST5'),
(5,'FFF','d',16.123,'18:55:11',2005,'TEST6','TEST6'),
(6,'EEE','d',16.123,'17:05:17',2006,'TEST7','TEST7');
CREATE INDEX ind_2 ON t1(c3);
DROP TRIGGER IF EXISTS trg_insert;
CREATE TRIGGER trg_insert AFTER INSERT ON t2
FOR EACH ROW
BEGIN
DECLARE c INT;
SELECT MAX(c0) INTO c FROM t1;
IF NEW.c0 = c THEN
DELETE FROM t1 WHERE c0 = NEW.c0;
ELSE
INSERT INTO t1(c0,c1,c2,c3,c4) VALUES(NEW.c0,CONCAT(NEW.c1,NEW.c1),NEW.c2,NEW.c3+NEW.c0,TIME(NEW.c4));
END IF;
END;
//
DROP TRIGGER IF EXISTS trg_update;//
CREATE TRIGGER trg_update AFTER UPDATE ON t1
FOR EACH ROW
BEGIN
UPDATE t2 SET c0=NEW.c0,c1=CONCAT(NEW.c1,NEW.c1) WHERE c0=OLD.c0;
END
//
DROP TRIGGER IF EXISTS trg_delete;//
CREATE TRIGGER trg_delete AFTER DELETE ON t2
FOR EACH ROW
BEGIN
DELETE FROM t1 WHERE c0=OLD.c0+1;
END;
//
#添加列、删除列、修改列
#暂不支持，待支持后执行sql
#LIST分区
DROP TABLE IF EXISTS t2;
CREATE TABLE t2(c0 INT,
c1 VARCHAR(10),
c2 SET('a','b','c','d','e','f','g'),
c3 FLOAT,
c4 DATE,
c5 DOUBLE,
c6 TEXT)
PARTITION BY LIST(c0)
(PARTITION p1 VALUES IN(0,1,2,3,4,5,6,7,8,9,10),
PARTITION p2 VALUES IN(11,12,13,14,15,16,17,18,19,20),
PARTITION p3 VALUES IN(21,22,23,24,25,26,27,28,29,30),
PARTITION p4 VALUES IN(31,32,33,34,35,36,37,38,39,40)
);
INSERT INTO t2 VALUES(0,'AA','a','0.123','2000-01-01',0,'TEST1'),
(1,'BB','a','2.123','2001-11-11',1,'TEST1'),
(3,'CC','b','3.123','2002-02-01',2,'TEST2'),
(4,'DD','b','4.123','2003-03-11',3,'TEST2'),
(5,'EE','c','5.123','2004-04-01',4,'TEST3'),
(6,'FF','c','6.123','2005-05-11',5,'TEST3');
DROP TABLE IF EXISTS t1;
CREATE TABLE t1(c0 SMALLINT ZEROFILL PRIMARY KEY,
c1 CHAR(10),
c2 ENUM('a','b','c','d','e','f','g') NOT NULL DEFAULT 'a',
c3 DOUBLE,
c4 TIME,
c5 TINYINT,
c6 BLOB,
CONSTRAINT uni_key UNIQUE KEY(c0,c2))
PARTITION BY LIST(c0)
(PARTITION r1 VALUES IN(0,1,2,3,4,5,6,7,8,9,10),
PARTITION r2 VALUES IN(11,12,13,14,15,16,17,18,19,20),
PARTITION r3 VALUES IN(21,22,23,24,25,26,27,28,29,30),
PARTITION r4 VALUES IN(31,32,33,34,35,36,37,38,39,40)
);
INSERT INTO t1 VALUES(0,'AAA','a','10.123','20:01:01',0,'TEST1'),
(1,'BBB','b','12.123','21:11:11',1,'TEST2'),
(3,'CCC','c','13.123','22:22:01',2,'TEST3'),
(4,'DDD','c','14.123','23:33:11',3,'TEST4'),
(5,'EEE','c','15.123','19:44:01',4,'TEST5'),
(6,'FFF','d','16.123','18:55:11',5,'TEST6');
CREATE INDEX ind_1 ON t1(c3,c4);
DROP TRIGGER IF EXISTS trg_insert;
CREATE TRIGGER trg_insert AFTER INSERT ON t2
FOR EACH ROW
BEGIN
DECLARE c INT;
SELECT MAX(c0) INTO c FROM t1;
IF NEW.c0 = c THEN
DELETE FROM t1 WHERE c0 = NEW.c0;
ELSE
INSERT INTO t1(c0,c1,c2,c3,c4) VALUES(NEW.c0,CONCAT(NEW.c1,NEW.c1),NEW.c2,NEW.c3+NEW.c0,TIME(NEW.c4));
END IF;
END;
//
DROP TRIGGER IF EXISTS trg_update;//
CREATE TRIGGER trg_update AFTER UPDATE ON t1
FOR EACH ROW
BEGIN
UPDATE t2 SET c0=NEW.c0,c1=CONCAT(NEW.c1,NEW.c1) WHERE c0=OLD.c0;
END
//
DROP TRIGGER IF EXISTS trg_delete;//
CREATE TRIGGER trg_delete AFTER DELETE ON t2
FOR EACH ROW
BEGIN
DELETE FROM t1 WHERE c0=OLD.c0+1;
END;
//
#添加列、删除列、修改列
#暂不支持，待支持后执行sql
DROP TABLE IF EXISTS t2;
DROP TABLE IF EXISTS t1;
#########Empty recycle bin, delete test database, tables, etc##########
purge recyclebin;
