result_format: 4
alter system set _rowsets_enabled=true tenant=sys;
alter system set _rowsets_enabled=true tenant=all_user;
alter system set _rowsets_enabled=true tenant=all_meta;


drop table dlt1;
drop table dlt2;
drop table dlt3;
drop table dlt4;
drop table dlt6;
create table dlt1 (a int primary key, b varchar(10), x varchar(10));
create table dlt2 (c int primary key, d char(10), y char(10));
create table dlt3 (e int            , f char(10), z char(10));
create table dlt4 (id int primary key, p_id int, name varchar2(50), alias varchar2(50), c_id int);
create table dlt6 (id int primary key, p_id int, name nvarchar2(50), alias nvarchar2(50), c_id int);
insert into dlt1 values (1, '123', 'abc');
insert into dlt1 values (2, '234', 'bcd');
insert into dlt1 values (3, '345', 'cde');
insert into dlt1 values (4, '456', 'def');
insert into dlt1 values (100, '000', 'xxx');
insert into dlt1 values (101, '111', 'yyy');
insert into dlt1 values (102, '222', 'zzz');
insert into dlt2 values (1, '123', 'abc');
insert into dlt2 values (2, '234', 'bcd');
insert into dlt2 values (3, '345', 'cde');
insert into dlt2 values (4, '456', 'def');
insert into dlt3 values (100, '000', 'xxx');
insert into dlt3 values (101, '111', 'yyy');
insert into dlt3 values (102, '222', 'zzz');
insert into dlt4 values (1001, null, 'zhangsan', 'zs', 101);
insert into dlt4 values (1002, 1001, 'lisi', 'ls', 101);
insert into dlt4 values (1003, 1001, 'wangwu', 'ww', 102);
insert into dlt4 values (1004, 1002, 'zhaoliu', 'zl', 102);
insert into dlt4 values (1005, 1002, 'zhangsi', 'zs', 103);
insert into dlt4 values (1006, 1002, 'liwu', 'lw', 103);
insert into dlt4 values (1007, 1003, 'wangliu', 'wl', 103);
insert into dlt6 select * from dlt4;
commit;



drop table dlt5;
drop table dlt7;
create table dlt5 as select * from dlt1;

create table dlt7 (id int primary key, p_id int, name nvarchar2(50), alias varchar2(50), c_id int);
insert into dlt7 select * from dlt6;
commit;

explain_protocol: 0
select a - 3, concat(b, concat('-', x)) from dlt1;
+------+-------------------------+
| A-3  | CONCAT(B,CONCAT('-',X)) |
+------+-------------------------+
|   -2 | 123-abc                 |
|   -1 | 234-bcd                 |
|    0 | 345-cde                 |
|    1 | 456-def                 |
|   97 | 000-xxx                 |
|   98 | 111-yyy                 |
|   99 | 222-zzz                 |
+------+-------------------------+
select a + 10, concat(b, concat('-', x)) from dlt1;
+------+-------------------------+
| A+10 | CONCAT(B,CONCAT('-',X)) |
+------+-------------------------+
|   11 | 123-abc                 |
|   12 | 234-bcd                 |
|   13 | 345-cde                 |
|   14 | 456-def                 |
|  110 | 000-xxx                 |
|  111 | 111-yyy                 |
|  112 | 222-zzz                 |
+------+-------------------------+

select mod(a, 3), count(x) from dlt1 group by mod(a, 3);
+----------+----------+
| MOD(A,3) | COUNT(X) |
+----------+----------+
|        1 |        3 |
|        2 |        2 |
|        0 |        2 |
+----------+----------+
select mod(a, 3), count(x) from dlt1 group by mod(a, 3) having count(x) < 3;
+----------+----------+
| MOD(A,3) | COUNT(X) |
+----------+----------+
|        2 |        2 |
|        0 |        2 |
+----------+----------+

select mod(a, 3) as ma3, x from dlt1 order by 1, 2;
+------+------+
| MA3  | X    |
+------+------+
|    0 | cde  |
|    0 | zzz  |
|    1 | abc  |
|    1 | def  |
|    1 | xxx  |
|    2 | bcd  |
|    2 | yyy  |
+------+------+

select a - 3 as a3, x from dlt1 union select c * 2, y from dlt2;
+------+------------+
| A3   | X          |
+------+------------+
|   -2 | abc        |
|   -1 | bcd        |
|    0 | cde        |
|    1 | def        |
|   97 | xxx        |
|   98 | yyy        |
|   99 | zzz        |
|    2 | abc        |
|    4 | bcd        |
|    6 | cde        |
|    8 | def        |
+------+------------+
## gbk/utf8 + utf16
select name from dlt4 union select name from dlt6;
ERROR HY000: character set mismatch
## gbk/utf8 + utf16
select name from dlt4 union select name from dlt7;
ERROR HY000: character set mismatch
## utf16 + utf16
select name from dlt6 union select name from dlt7;
+----------+
| NAME     |
+----------+
| zhangsan |
| lisi     |
| wangwu   |
| zhaoliu  |
| zhangsi  |
| liwu     |
| wangliu  |
+----------+
## gbk/utf8 + utf16
select alias from dlt4 union select alias from dlt6;
ERROR HY000: character set mismatch
## gbk/utf8 + utf8
select alias from dlt4 union select alias from dlt7;
+-------+
| ALIAS |
+-------+
| zs    |
| ls    |
| ww    |
| zl    |
| lw    |
| wl    |
+-------+
## utf8 + utf16
select alias from dlt6 union select alias from dlt7;
ERROR HY000: character set mismatch

select dlt1.a - 3, dlt2.y from dlt1 dlt1 join dlt2 dlt2 on dlt1.a = dlt2.c where dlt1.a < 2 + 8 and dlt2.d > '100';
+----------+------------+
| DLT1.A-3 | Y          |
+----------+------------+
|       -2 | abc        |
|       -1 | bcd        |
|        0 | cde        |
|        1 | def        |
+----------+------------+
select dlt1.a - 3, dlt2.y from dlt1 dlt1 left join dlt2 dlt2 on dlt1.a = dlt2.c where dlt1.b > '000';
+----------+------------+
| DLT1.A-3 | Y          |
+----------+------------+
|       -2 | abc        |
|       -1 | bcd        |
|        0 | cde        |
|        1 | def        |
|       98 | NULL       |
|       99 | NULL       |
+----------+------------+
select dlt1.a - 3, dlt2.y from dlt1 dlt1 left join dlt2 dlt2 on dlt1.a = dlt2.c where dlt1.b > '000' and dlt2.d > '100';
+----------+------------+
| DLT1.A-3 | Y          |
+----------+------------+
|       -2 | abc        |
|       -1 | bcd        |
|        0 | cde        |
|        1 | def        |
+----------+------------+
select /*+use_nl(dlt1, dlt2)*/ dlt1.b, dlt2.y from dlt1 dlt1 join dlt2 dlt2 on dlt1.a + 1 = dlt2.c where dlt1.a = 1 + 2 and dlt2.d > '100';
+------+------------+
| B    | Y          |
+------+------------+
| 345  | def        |
+------+------------+
select /*+use_nl(dlt1, dlt2)*/ dlt1.b, dlt2.y from dlt5 dlt1 join dlt2 dlt2 on dlt1.a + 1 = dlt2.c where dlt1.a = 1 + 2 and dlt2.d > '100';
+------+------------+
| B    | Y          |
+------+------------+
| 345  | def        |
+------+------------+

select dlt3.a, dlt4.a, dlt4.b, dlt4.x from (select a from dlt1 minus select c a from dlt2 minus select 1 a from dual) dlt3, dlt1 dlt4 where dlt3.a = dlt4.a;
+------+------+------+------+
| A    | A    | B    | X    |
+------+------+------+------+
|  100 |  100 | 000  | xxx  |
|  101 |  101 | 111  | yyy  |
|  102 |  102 | 222  | zzz  |
+------+------+------+------+

select a - 3, x from dlt1 union select c * 2, y from dlt2 order by 1;
+------+------------+
| A-3  | X          |
+------+------------+
|   -2 | abc        |
|   -1 | bcd        |
|    0 | cde        |
|    1 | def        |
|    2 | abc        |
|    4 | bcd        |
|    6 | cde        |
|    8 | def        |
|   97 | xxx        |
|   98 | yyy        |
|   99 | zzz        |
+------+------------+

with a as (select distinct n.y, m.x from dlt1 m join dlt2 n on m.a = n.c), b as (select t.x from (select n.y, m.x from dlt1 m, dlt2 n) t)
select a.y, a.x, b.x from a, b where trim(a.x) = trim(b.x)
order by 1, 2;
+------------+------+------+
| Y          | X    | X    |
+------------+------+------+
| abc        | abc  | abc  |
| abc        | abc  | abc  |
| abc        | abc  | abc  |
| abc        | abc  | abc  |
| bcd        | bcd  | bcd  |
| bcd        | bcd  | bcd  |
| bcd        | bcd  | bcd  |
| bcd        | bcd  | bcd  |
| cde        | cde  | cde  |
| cde        | cde  | cde  |
| cde        | cde  | cde  |
| cde        | cde  | cde  |
| def        | def  | def  |
| def        | def  | def  |
| def        | def  | def  |
| def        | def  | def  |
+------------+------+------+

select (a + 1) * (a - 1) a2 from (select a, x from dlt1 union select c, y from dlt2) tt;
+-------+
| A2    |
+-------+
|     0 |
|     0 |
|     3 |
|     3 |
|     8 |
|     8 |
|    15 |
|    15 |
|  9999 |
| 10200 |
| 10403 |
+-------+
select /*+no_rewrite*/ * from (select a + b ab, x from dlt1 where a > 100) v where x > '1' order by x;
+------+------+
| AB   | X    |
+------+------+
|  212 | yyy  |
|  324 | zzz  |
+------+------+
select * from dlt1 where b between (select min(b) from dlt1) and (select min(b) from dlt1);
+------+------+------+
| A    | B    | X    |
+------+------+------+
|  100 | 000  | xxx  |
+------+------+------+
select ln((select count(a) from dlt1)) from dual;
+------------------------------------------+
| LN((SELECTCOUNT(A)FROMDLT1))             |
+------------------------------------------+
| 1.94591014905531330510535274344317972964 |
+------------------------------------------+
select ln((select count(a) from dlt1)) from dlt2 where rownum < 3;
+------------------------------------------+
| LN((SELECTCOUNT(A)FROMDLT1))             |
+------------------------------------------+
| 1.94591014905531330510535274344317972964 |
| 1.94591014905531330510535274344317972964 |
+------------------------------------------+

select * from dlt5 where a = (select a from dlt1 where x = dlt5.x);
+------+------+------+
| A    | B    | X    |
+------+------+------+
|    1 | 123  | abc  |
|    2 | 234  | bcd  |
|    3 | 345  | cde  |
|    4 | 456  | def  |
|  100 | 000  | xxx  |
|  101 | 111  | yyy  |
|  102 | 222  | zzz  |
+------+------+------+
select * from dlt5 where a = (select a from dlt1 where rownum = 1);
+------+------+------+
| A    | B    | X    |
+------+------+------+
|    1 | 123  | abc  |
+------+------+------+

select a, x from dlt1 dlt1 where a < 100 and rownum < 3;
+------+------+
| A    | X    |
+------+------+
|    1 | abc  |
|    2 | bcd  |
+------+------+
##bug:
##select a, x from dlt1 dlt1 where a < 100 and rownum < 3 order by a desc;
select distinct mod(a, 3) from dlt1 where a < 110 - 8;
+----------+
| MOD(A,3) |
+----------+
|        1 |
|        2 |
|        0 |
+----------+
select distinct mod(a, 3), count(distinct x) from dlt1 where a < 110 - 8 group by mod(a, 3) having count(x) > 0 order by 1;
+----------+------------------+
| MOD(A,3) | COUNT(DISTINCTX) |
+----------+------------------+
|        0 |                1 |
|        1 |                3 |
|        2 |                2 |
+----------+------------------+

select e * 2, concat(f, z) from dlt3;
+------+----------------------+
| E*2  | CONCAT(F,Z)          |
+------+----------------------+
|  200 | 000       xxx        |
|  202 | 111       yyy        |
|  204 | 222       zzz        |
+------+----------------------+
select * from dlt3;
+------+------------+------------+
| E    | F          | Z          |
+------+------------+------------+
|  100 | 000        | xxx        |
|  101 | 111        | yyy        |
|  102 | 222        | zzz        |
+------+------------+------------+

select x from dlt1 where a  = any(0, 1, 2);
+------+
| X    |
+------+
| abc  |
| bcd  |
+------+
select x from dlt1 where a != any(0, 1, 2);
+------+
| X    |
+------+
| abc  |
| bcd  |
| cde  |
| def  |
| xxx  |
| yyy  |
| zzz  |
+------+
select x from dlt1 where a  > any(0, 1, 2);
+------+
| X    |
+------+
| abc  |
| bcd  |
| cde  |
| def  |
| xxx  |
| yyy  |
| zzz  |
+------+
select x from dlt1 where a  < any(0, 1, 2);
+------+
| X    |
+------+
| abc  |
+------+
select x from dlt1 where a  = all(0, 1, 2);
+------+
| X    |
+------+
+------+
select x from dlt1 where a != all(0, 1, 2);
+------+
| X    |
+------+
| cde  |
| def  |
| xxx  |
| yyy  |
| zzz  |
+------+
select x from dlt1 where a  > all(0, 1, 2);
+------+
| X    |
+------+
| cde  |
| def  |
| xxx  |
| yyy  |
| zzz  |
+------+
select x from dlt1 where a  < all(0, 1, 2);
+------+
| X    |
+------+
+------+

select x from dlt1 where x like 'a%';
+------+
| X    |
+------+
| abc  |
+------+
select x from dlt1 where x not like 'a%';
+------+
| X    |
+------+
| bcd  |
| cde  |
| def  |
| xxx  |
| yyy  |
| zzz  |
+------+

select id, p_id, connect_by_root(name) as rname, sys_connect_by_path(name, '-') as pname from dlt4 where id < 1006 start with p_id is null connect by prior id = p_id order by id;
+------+------+----------+------------------------+
| ID   | P_ID | RNAME    | PNAME                  |
+------+------+----------+------------------------+
| 1001 | NULL | zhangsan | -zhangsan              |
| 1002 | 1001 | zhangsan | -zhangsan-lisi         |
| 1003 | 1001 | zhangsan | -zhangsan-wangwu       |
| 1004 | 1002 | zhangsan | -zhangsan-lisi-zhaoliu |
| 1005 | 1002 | zhangsan | -zhangsan-lisi-zhangsi |
+------+------+----------+------------------------+
select id, p_id, connect_by_root(name) as rname, sys_connect_by_path(name, '-') as pname from dlt4 where id < 1006 start with p_id is null connect by prior id = p_id order by id;
+------+------+----------+------------------------+
| ID   | P_ID | RNAME    | PNAME                  |
+------+------+----------+------------------------+
| 1001 | NULL | zhangsan | -zhangsan              |
| 1002 | 1001 | zhangsan | -zhangsan-lisi         |
| 1003 | 1001 | zhangsan | -zhangsan-wangwu       |
| 1004 | 1002 | zhangsan | -zhangsan-lisi-zhaoliu |
| 1005 | 1002 | zhangsan | -zhangsan-lisi-zhangsi |
+------+------+----------+------------------------+

select x from dlt1 where a = 0 + 0 + 1;
+------+
| X    |
+------+
| abc  |
+------+
select x from dlt1 where a = 0 + 1 + 2;
+------+
| X    |
+------+
| cde  |
+------+
select x from dlt1 where a = 1 + 2 + 3;
+------+
| X    |
+------+
+------+

select dlt1.x from dlt1;
+------+
| X    |
+------+
| abc  |
| bcd  |
| cde  |
| def  |
| xxx  |
| yyy  |
| zzz  |
+------+
select * from dlt1, dlt2 where dlt1.a = dlt2.c;
+------+------+------+------+------------+------------+
| A    | B    | X    | C    | D          | Y          |
+------+------+------+------+------------+------------+
|    1 | 123  | abc  |    1 | 123        | abc        |
|    2 | 234  | bcd  |    2 | 234        | bcd        |
|    3 | 345  | cde  |    3 | 345        | cde        |
|    4 | 456  | def  |    4 | 456        | def        |
+------+------+------+------+------------+------------+
select * from dlt1 where dlt1.a = 1;
+------+------+------+
| A    | B    | X    |
+------+------+------+
|    1 | 123  | abc  |
+------+------+------+

explain_protocol: 0
drop table dlt4_dup;
create table dlt4_dup as
  select dlt3.a c1, dlt4.a c2, dlt4.b c3, dlt4.x c4 from (select a from dlt1 minus select c a from dlt2 minus select 1 a from dual) dlt3, dlt1 dlt4 where dlt3.a = dlt4.a;
select c1, c2, c3, c4 from dlt4_dup;
+------+------+------+------+
| C1   | C2   | C3   | C4   |
+------+------+------+------+
|  100 |  100 | 000  | xxx  |
|  101 |  101 | 111  | yyy  |
|  102 |  102 | 222  | zzz  |
+------+------+------+------+
delete from dlt4_dup;
insert into dlt4_dup
  select dlt3.a c1, dlt4.a c2, dlt4.b c3, dlt4.x c4 from (select a from dlt1 minus select c a from dlt2 minus select 1 a from dual) dlt3, dlt1 dlt4 where dlt3.a = dlt4.a;
select c1, c2, c3, c4 from dlt4_dup;
+------+------+------+------+
| C1   | C2   | C3   | C4   |
+------+------+------+------+
|  100 |  100 | 000  | xxx  |
|  101 |  101 | 111  | yyy  |
|  102 |  102 | 222  | zzz  |
+------+------+------+------+
drop table dlt4_dup;

drop table dlt5;
drop table dlt7;



drop table dlt1;
drop table dlt2;
drop table dlt3;
drop table dlt4;
drop table dlt6;
#### owner: zuojiao.hzj
#### owner group: sql2
#### description: dblink
result_format: 4
alter system set _rowsets_enabled=true tenant=sys;
alter system set _rowsets_enabled=true tenant=all_user;
alter system set _rowsets_enabled=true tenant=all_meta;


drop table dlt5;
create table dlt5 (
  bf1 binary_float,
  bd1 binary_double,
  n1  int,
  n2  number,
  n3  number(10, -2),
  n4  number(20),
  f1  float,
  v1  varchar2(100),
  c1  char(20),
  r1  raw(100),
  nv1 nvarchar2(100),
  nc1 nchar(20),
  l1  blob,
  l2  clob,
  d1  date,
  tz1 timestamp(1) with time zone,
  tz2 timestamp(2) with local time zone,
  t3  timestamp(3),
  i1  interval year(4) to month,
  i2  interval day(5) to second(6),
  ur urowid
);
set nls_date_format = 'YYYY-MM-DD HH24:MI:SS';
set nls_timestamp_format = 'YYYY-MM-DD HH24:MI:SS.FF';
set nls_timestamp_tz_format = 'YYYY-MM-DD HH24:MI:SS.FF TZR TZD';
insert into dlt5 values (1, 2, 3, 4, 5, 6, 7, '阿里巴巴v1', '支付宝c1', '7231', '阿里巴巴nv1', '支付宝nc1', '6c31', 'l2', '2020-07-28', '2020-07-28 12:34:56', '2020-07-28 12:34:56', '2020-07-28 12:34:56', '1-1', '1 12:34:56', 'gAADFAsAAAAAAQ==');
insert into dlt5 values (1, 2, 3, 4, 5, 6, 7, '阿里巴巴v1', '支付宝c1', '7231', '阿里巴巴nv1', '支付宝nc1', '6c31', 'l2', '2020-07-28', '2020-07-28 12:34:56', '2020-07-28 12:34:56', '2020-07-28 12:34:56', '1-1', '1 12:34:56', 'gAADFAsAAAAAAQ==');
commit;

select concat(concat(concat(v1, nv1), concat(c1, nc1)), 'XXYYZZ') from dlt5;
+--------------------------------------------------------------------------------------+
| CONCAT(CONCAT(CONCAT(V1,NV1),CONCAT(C1,NC1)),'XXYYZZ')                               |
+--------------------------------------------------------------------------------------+
| 阿里巴巴v1阿里巴巴nv1支付宝c1            支付宝nc1              XXYYZZ               |
| 阿里巴巴v1阿里巴巴nv1支付宝c1            支付宝nc1              XXYYZZ               |
+--------------------------------------------------------------------------------------+
select length(v1), length(nv1), length(c1), length(nc1) from dlt5;
+------------+-------------+------------+-------------+
| LENGTH(V1) | LENGTH(NV1) | LENGTH(C1) | LENGTH(NC1) |
+------------+-------------+------------+-------------+
|          6 |           7 |         17 |          20 |
|          6 |           7 |         17 |          20 |
+------------+-------------+------------+-------------+
select lengthb(v1), lengthb(nv1), lengthb(c1), lengthb(nc1) from dlt5;
+-------------+--------------+-------------+--------------+
| LENGTHB(V1) | LENGTHB(NV1) | LENGTHB(C1) | LENGTHB(NC1) |
+-------------+--------------+-------------+--------------+
|          10 |           14 |          20 |           40 |
|          10 |           14 |          20 |           40 |
+-------------+--------------+-------------+--------------+



set @saved_nls_date_format = @@nls_date_format;
set @saved_nls_timestamp_format = @@nls_timestamp_format;
set @saved_nls_timestamp_tz_format = @@nls_timestamp_tz_format;
set nls_date_format = 'MM-DD-YYYY HH24:MI:SS';
set nls_timestamp_format = 'MM-DD-YYYY HH24:MI:SS.FF';
set nls_timestamp_tz_format = 'MM-DD-YYYY HH24:MI:SS.FF TZR TZD';

explain_protocol: 0
select bf1 from dlt5;
+----------+
| BF1      |
+----------+
| 1.0E+000 |
| 1.0E+000 |
+----------+
select bd1 from dlt5;
+----------+
| BD1      |
+----------+
| 2.0E+000 |
| 2.0E+000 |
+----------+
select n1  from dlt5;
+------+
| N1   |
+------+
|    3 |
|    3 |
+------+
select n2  from dlt5;
+------+
| N2   |
+------+
|    4 |
|    4 |
+------+
select n3  from dlt5;
+------+
| N3   |
+------+
|    0 |
|    0 |
+------+
select n4  from dlt5;
+------+
| N4   |
+------+
|    6 |
|    6 |
+------+
select f1  from dlt5;
+------+
| F1   |
+------+
|    7 |
|    7 |
+------+
select v1  from dlt5;
+----------------+
| V1             |
+----------------+
| 阿里巴巴v1     |
| 阿里巴巴v1     |
+----------------+
select c1  from dlt5;
+-------------------------+
| C1                      |
+-------------------------+
| 支付宝c1                |
| 支付宝c1                |
+-------------------------+
select r1  from dlt5;
+------+
| R1   |
+------+
| 7231 |
| 7231 |
+------+
select nv1 from dlt5;
+-----------------+
| NV1             |
+-----------------+
| 阿里巴巴nv1     |
| 阿里巴巴nv1     |
+-----------------+
select nc1 from dlt5;
+----------------------------+
| NC1                        |
+----------------------------+
| 支付宝nc1                  |
| 支付宝nc1                  |
+----------------------------+
select d1  from dlt5;
+---------------------+
| D1                  |
+---------------------+
| 07-28-2020 00:00:00 |
| 07-28-2020 00:00:00 |
+---------------------+
select tz1 from dlt5;
+-------------------------------+
| TZ1                           |
+-------------------------------+
| 07-28-2020 12:34:56.0 +08:00  |
| 07-28-2020 12:34:56.0 +08:00  |
+-------------------------------+
select tz2 from dlt5;
+------------------------+
| TZ2                    |
+------------------------+
| 07-28-2020 12:34:56.00 |
| 07-28-2020 12:34:56.00 |
+------------------------+
select t3  from dlt5;
+-------------------------+
| T3                      |
+-------------------------+
| 07-28-2020 12:34:56.000 |
| 07-28-2020 12:34:56.000 |
+-------------------------+
select i1  from dlt5;
+----------+
| I1       |
+----------+
| +0001-01 |
| +0001-01 |
+----------+
select i2  from dlt5;
+------------------------+
| I2                     |
+------------------------+
| +00001 12:34:56.000000 |
| +00001 12:34:56.000000 |
+------------------------+
select ur  from dlt5;
+------------------+
| UR               |
+------------------+
| gAADFAsAAAAAAQ== |
| gAADFAsAAAAAAQ== |
+------------------+

select (bf1 + bd1 + n1 + n2) * (n3 + n4) / f1 from dlt5;
+----------------------------+
| (BF1+BD1+N1+N2)*(N3+N4)/F1 |
+----------------------------+
|    8.5714285714285712E+000 |
|    8.5714285714285712E+000 |
+----------------------------+

select concat(concat(concat(v1, nv1), concat(c1, nc1)), 'XXYYZZ') from dlt5;
+--------------------------------------------------------------------------------------+
| CONCAT(CONCAT(CONCAT(V1,NV1),CONCAT(C1,NC1)),'XXYYZZ')                               |
+--------------------------------------------------------------------------------------+
| 阿里巴巴v1阿里巴巴nv1支付宝c1            支付宝nc1              XXYYZZ               |
| 阿里巴巴v1阿里巴巴nv1支付宝c1            支付宝nc1              XXYYZZ               |
+--------------------------------------------------------------------------------------+
select length(v1), length(nv1), length(c1), length(nc1) from dlt5;
+------------+-------------+------------+-------------+
| LENGTH(V1) | LENGTH(NV1) | LENGTH(C1) | LENGTH(NC1) |
+------------+-------------+------------+-------------+
|          6 |           7 |         17 |          20 |
|          6 |           7 |         17 |          20 |
+------------+-------------+------------+-------------+
select lengthb(v1), lengthb(nv1), lengthb(c1), lengthb(nc1) from dlt5;
+-------------+--------------+-------------+--------------+
| LENGTHB(V1) | LENGTHB(NV1) | LENGTHB(C1) | LENGTHB(NC1) |
+-------------+--------------+-------------+--------------+
|          10 |           14 |          20 |           40 |
|          10 |           14 |          20 |           40 |
+-------------+--------------+-------------+--------------+

explain_protocol: 0

set nls_date_format = @saved_nls_date_format;
set nls_timestamp_format = @saved_nls_timestamp_format;
set nls_timestamp_tz_format = @saved_nls_timestamp_tz_format;


drop table dlt5;

