ob1=OBI(cluster=1:1:1, proxy_num=0);
ob2=OBI(cluster=1, proxy_num=0);
ob1.z1.obs0.set extra_config = "cache_wash_threshold='1G',_ob_minor_merge_schedule_interval='3s'";
ob1.z2.obs0.set extra_config = "cache_wash_threshold='1G',_ob_minor_merge_schedule_interval='3s'";
ob1.z3.obs0.set extra_config = "cache_wash_threshold='1G',_ob_minor_merge_schedule_interval='3s'";
ob2.z1.obs0.set extra_config = "cache_wash_threshold='1G',_ob_minor_merge_schedule_interval='3s'";
ob1.force_stop;
ob1.clean_backup_dest;
ob1.reboot;
ob1.mysql alter resource unit sys_unit_config memory_size='2G';
use oceanbase;
ob1.mysql alter system set _backup_idle_time = '10s';
ob1.mysql alter system set _advance_checkpoint_timeout = '5m';
ob1.mysql alter system set merger_check_interval = '10s';
ob1.mysql alter system set enable_async_syslog=false;
ob1.mysql CREATE TENANT $backup_oracle_tenant RESOURCE_POOL_LIST = ('small_pool'), primary_zone = "z1" set ob_tcp_invited_nodes='%', ob_compatibility_mode='oracle';
set global wait_timeout = 288000;
alter system change tenant tenant_id = 1001;
update __all_log_archive_dest_parameter set value='2m' where dest_no=0 and name='piece_switch_interval';
set global wait_timeout = 288000;
create user test IDENTIFIED BY "test";
grant all on *.* to test WITH GRANT OPTION;
grant dba to test;
create table pt (c1 int, c2 int, c3 blob) partition by range(c1) (partition M1  VALUES LESS THAN (5), partition M2 VALUES LESS THAN (10), partition M3 VALUES LESS THAN (20));
insert into pt(c1, c2) values(1,1);
insert into pt(c1, c2) values(2,2);
insert into pt(c1, c2) values(3,3);
insert into pt(c1, c2) values(4,4);
insert into pt(c1, c2) values(5,5);
insert into pt(c1, c2) values(6,6);
insert into pt(c1, c2) values(7,7);
insert into pt(c1, c2) values(8,8);
insert into pt(c1, c2) values(9,9);
insert into pt(c1, c2) values(10,10);
insert into pt(c1, c2) values(11,11);
insert into pt(c1, c2) values(12,12);
insert into pt(c1, c2) values(13,13);
insert into pt(c1, c2) values(14,14);
insert into pt(c1, c2) values(15,15);
create index pt_local_idx on pt(c1, c2) local;
create index pt_global_idx on pt(c2) global;
select * from pt order by c1;
C1	C2	C3
1	1	NULL
2	2	NULL
3	3	NULL
4	4	NULL
5	5	NULL
6	6	NULL
7	7	NULL
8	8	NULL
9	9	NULL
10	10	NULL
11	11	NULL
12	12	NULL
13	13	NULL
14	14	NULL
15	15	NULL
create table nt (c1 int, c2 int, c3 blob);
insert into nt(c1, c2) values(21,21);
insert into nt(c1, c2) values(22,22);
insert into nt(c1, c2) values(23,23);
insert into nt(c1, c2) values(24,24);
insert into nt(c1, c2) values(25,25);
insert into nt(c1, c2) values(26,26);
insert into nt(c1, c2) values(27,27);
insert into nt(c1, c2) values(28,28);
insert into nt(c1, c2) values(29,29);
insert into nt(c1, c2) values(30,30);
insert into nt(c1, c2) values(31,31);
insert into nt(c1, c2) values(32,32);
insert into nt(c1, c2) values(33,33);
insert into nt(c1, c2) values(34,34);
insert into nt(c1, c2) values(35,35);
create index nt_local_idx on nt(c1, c2);
select * from nt order by c1;
C1	C2	C3
21	21	NULL
22	22	NULL
23	23	NULL
24	24	NULL
25	25	NULL
26	26	NULL
27	27	NULL
28	28	NULL
29	29	NULL
30	30	NULL
31	31	NULL
32	32	NULL
33	33	NULL
34	34	NULL
35	35	NULL
ALTER TABLE pt ADD PARTITION  M4 VALUES LESS THAN(40);
select * from pt order by c1;
C1	C2	C3
1	1	NULL
2	2	NULL
3	3	NULL
4	4	NULL
5	5	NULL
6	6	NULL
7	7	NULL
8	8	NULL
9	9	NULL
10	10	NULL
11	11	NULL
12	12	NULL
13	13	NULL
14	14	NULL
15	15	NULL
select * from nt order by c1;
C1	C2	C3
21	21	NULL
22	22	NULL
23	23	NULL
24	24	NULL
25	25	NULL
26	26	NULL
27	27	NULL
28	28	NULL
29	29	NULL
30	30	NULL
31	31	NULL
32	32	NULL
33	33	NULL
34	34	NULL
35	35	NULL
alter table pt exchange partition M4 with table nt including indexes without validation;
select * from pt order by c1;
C1	C2	C3
1	1	NULL
2	2	NULL
3	3	NULL
4	4	NULL
5	5	NULL
6	6	NULL
7	7	NULL
8	8	NULL
9	9	NULL
10	10	NULL
11	11	NULL
12	12	NULL
13	13	NULL
14	14	NULL
15	15	NULL
21	21	NULL
22	22	NULL
23	23	NULL
24	24	NULL
25	25	NULL
26	26	NULL
27	27	NULL
28	28	NULL
29	29	NULL
30	30	NULL
31	31	NULL
32	32	NULL
33	33	NULL
34	34	NULL
35	35	NULL
select * from nt order by c1;
C1	C2	C3
ob1.mysql alter system archivelog;
ob1.check_until_timeout select status from oceanbase.CDB_OB_ARCHIVELOG where tenant_id=$backup_oracle_tenant_id, DOING, 600;
ob1.check_until_timeout select min(start_scn)=$round_start_scn from oceanbase.CDB_OB_ARCHIVELOG_PIECE_FILES where tenant_id=$backup_oracle_tenant_id, 1, 1;
ob1.mysql alter system major freeze tenant = '$backup_oracle_tenant';
ob1.check_until_timeout select (frozen_scn - last_scn) as result from oceanbase.CDB_OB_MAJOR_COMPACTION where tenant_id=$backup_oracle_tenant_id, 0, 600;
check major sstable status for 'pt' in tenant 'backup_oracle_tenant' in observer 1
count(1)
0
TABLE_TYPE
check major sstable status for 'nt' in tenant 'backup_oracle_tenant' in observer 1
count(1)
1
TABLE_TYPE
MAJOR
ob1.check_until_timeout select status from oceanbase.CDB_OB_ARCHIVELOG_PIECE_FILES where tenant_id=$backup_oracle_tenant_id and piece_id=1, FROZEN, 600;
ob1.mysql alter system set ha_low_thread_score = 3 tenant $backup_oracle_tenant;
ob1.mysql alter system backup database;
ob1.check_until_timeout select count(*) c from __all_backup_job_history where tenant_id = 1, 1, 600;
ob1.check_until_timeout select result from oceanbase.CDB_OB_BACKUP_JOB_HISTORY where tenant_id = $backup_oracle_tenant_id, 0, 10;
ob1.check_until_timeout select result from oceanbase.CDB_OB_BACKUP_TASK_HISTORY where tenant_id = $backup_oracle_tenant_id, 0, 10;
ob1.check_until_timeout select count(*) as cnt from oceanbase.__all_virtual_dag where dag_type like '%BACKUP%', 0, 60;
use oceanbase;
ob1.check_until_timeout select floor(checkpoint_scn / 1000) > '$restore_checkpoint1' from CDB_OB_ARCHIVELOG, 1, 600;
ob1.check_until_timeout select floor(checkpoint_scn / 1000) > '$restore_checkpoint2' from CDB_OB_ARCHIVELOG, 1, 600;
ob1.mysql alter system noarchivelog tenant=all;
ob1.check_until_timeout select status from oceanbase.CDB_OB_ARCHIVELOG_SUMMARY where tenant_id=$backup_oracle_tenant_id, STOP, 600;
ob1.check_until_timeout select count(*)=0 from oceanbase.CDB_OB_ARCHIVELOG_PIECE_FILES where tenant_id=$backup_oracle_tenant_id and status!='FROZEN', 1, 60;
ob1.mysql alter tenant $backup_oracle_tenant rename global_name to $backup_oracle_tenant_new;
ob1.mysql alter system archivelog;
ob1.check_until_timeout select status from oceanbase.CDB_OB_ARCHIVELOG where tenant_id=$backup_oracle_tenant_id, DOING, 600;
ob1.mysql alter system noarchivelog tenant=all;
ob1.check_until_timeout select status from oceanbase.CDB_OB_ARCHIVELOG_SUMMARY where tenant_id=$backup_oracle_tenant_id, STOP, 600;
ob2.reboot;
ob2.mysql alter system set debug_sync_timeout = '1000s';
ob2.mysql set ob_global_debug_sync = 'BEFORE_WAIT_RESTORE_TENANT_FINISH wait_for signal';
ob2.mysql alter resource unit sys_unit_config memory_size='2G';
ob2.mysql alter system set enable_async_syslog=false;
ob2.mysql alter system restore $restore_oracle_tenant from '$restore_path' until time='$restore_checkpoint' with 'pool_list=small_pool_2&primary_zone=z1&concurrency=50';
ob2.check_until_timeout select count(*) > 0 as has_cnt from oceanbase.__all_tenant where tenant_name='$restore_oracle_tenant', 1, 600;
ob2.check_until_timeout select count(*) > 0 as has_cnt from oceanbase.CDB_OB_LS_LOCATIONS where tenant_id = $restore_oracle_tenant_id, 1, 600;
ob2.check_until_timeout select count(*) > 0 as has_cnt from oceanbase.CDB_OB_LS_LOCATIONS where tenant_id = $restore_oracle_tenant_id - 1, 1, 600;
ob2.check_until_timeout select count(*) > 0 as has_cnt from oceanbase.CDB_OB_MAJOR_COMPACTION where tenant_id = $restore_oracle_tenant_id, 1, 600;
ob2.check_until_timeout select count(*) > 0 as has_cnt from oceanbase.CDB_OB_MAJOR_COMPACTION where tenant_id = $restore_oracle_tenant_id - 1, 1, 600;
ob2.mysql_p select status from oceanbase.__all_tenant;
status
NORMAL
NORMAL
RESTORE
ob2.mysql set ob_global_debug_sync = 'now signal signal';
ob2.check_until_timeout SELECT status FROM __all_tenant WHERE tenant_id = 1001, NORMAL, 200;
ob2.mysql alter system set ha_high_thread_score = 100 tenant = $restore_oracle_tenant;
ob2.mysql alter system set ha_mid_thread_score = 100 tenant = $restore_oracle_tenant;
ob2.mysql alter system set ha_low_thread_score = 100 tenant = $restore_oracle_tenant;
ob2.check_until_timeout select count(*) from __all_virtual_ls_meta_table where tenant_id = 1002 and restore_status = 0, 2, 600;
ob2.check_until_timeout select status FROM __all_tenant WHERE tenant_id = 1002, NORMAL, 200;
ob2.check_until_timeout select count(*) FROM __all_restore_job, 0, 200;
ob2.check_until_timeout select count(*) from oceanbase.CDB_OB_MAJOR_COMPACTION where tenant_id = $tenant_id and last_scn = 1, 0, 200;
check major sstable status for 'pt' in tenant 'restore_oracle_tenant' in observer 2
count(1)
0
TABLE_TYPE
check major sstable status for 'nt' in tenant 'restore_oracle_tenant' in observer 2
count(1)
1
TABLE_TYPE
MAJOR
alter system change tenant tenant_id = 1001;
select tenant_role from __all_tenant_info where tenant_id = 1002;
tenant_role
STANDBY
ALTER SYSTEM ACTIVATE STANDBY;
ERROR HY000: Incorrect arguments to tenant name, should specify tenant name
set ob_query_timeout  = 10000000;
ALTER SYSTEM ACTIVATE STANDBY TENANT restore_oracle_tenant;
alter system change tenant tenant_id = 1001;
select tenant_role from __all_tenant_info where tenant_id = 1002;
tenant_role
PRIMARY
select * from pt order by c1;
C1	C2	C3
1	1	NULL
2	2	NULL
3	3	NULL
4	4	NULL
5	5	NULL
6	6	NULL
7	7	NULL
8	8	NULL
9	9	NULL
10	10	NULL
11	11	NULL
12	12	NULL
13	13	NULL
14	14	NULL
15	15	NULL
21	21	NULL
22	22	NULL
23	23	NULL
24	24	NULL
25	25	NULL
26	26	NULL
27	27	NULL
28	28	NULL
29	29	NULL
30	30	NULL
31	31	NULL
32	32	NULL
33	33	NULL
34	34	NULL
35	35	NULL
select * from nt order by c1;
C1	C2	C3
insert into pt(c1, c2) values(36,36);
insert into pt(c1, c2) values(37,37);
insert into pt(c1, c2) values(38,38);
insert into pt(c1, c2) values(39,39);
select * from pt order by c1;
C1	C2	C3
1	1	NULL
2	2	NULL
3	3	NULL
4	4	NULL
5	5	NULL
6	6	NULL
7	7	NULL
8	8	NULL
9	9	NULL
10	10	NULL
11	11	NULL
12	12	NULL
13	13	NULL
14	14	NULL
15	15	NULL
21	21	NULL
22	22	NULL
23	23	NULL
24	24	NULL
25	25	NULL
26	26	NULL
27	27	NULL
28	28	NULL
29	29	NULL
30	30	NULL
31	31	NULL
32	32	NULL
33	33	NULL
34	34	NULL
35	35	NULL
36	36	NULL
37	37	NULL
38	38	NULL
39	39	NULL
insert into nt(c1, c2) values(1,1);
insert into nt(c1, c2) values(2,2);
insert into nt(c1, c2) values(3,3);
insert into nt(c1, c2) values(4,4);
insert into nt(c1, c2) values(5,5);
insert into nt(c1, c2) values(6,6);
insert into nt(c1, c2) values(7,7);
insert into nt(c1, c2) values(8,8);
insert into nt(c1, c2) values(9,9);
insert into nt(c1, c2) values(10,10);
select * from nt order by c1;
C1	C2	C3
1	1	NULL
2	2	NULL
3	3	NULL
4	4	NULL
5	5	NULL
6	6	NULL
7	7	NULL
8	8	NULL
9	9	NULL
10	10	NULL
update pt set c2 = -10 where c1 = 10;
update pt set c2 = -11 where c1 = 11;
update pt set c2 = -12 where c1 = 12;
select * from pt order by c1;
C1	C2	C3
1	1	NULL
2	2	NULL
3	3	NULL
4	4	NULL
5	5	NULL
6	6	NULL
7	7	NULL
8	8	NULL
9	9	NULL
10	-10	NULL
11	-11	NULL
12	-12	NULL
13	13	NULL
14	14	NULL
15	15	NULL
21	21	NULL
22	22	NULL
23	23	NULL
24	24	NULL
25	25	NULL
26	26	NULL
27	27	NULL
28	28	NULL
29	29	NULL
30	30	NULL
31	31	NULL
32	32	NULL
33	33	NULL
34	34	NULL
35	35	NULL
36	36	NULL
37	37	NULL
38	38	NULL
39	39	NULL
update nt set c2 = -1 where c1 = 1;
update nt set c2 = -2 where c1 = 2;
update nt set c2 = -3 where c1 = 3;
select * from nt order by c1;
C1	C2	C3
1	-1	NULL
2	-2	NULL
3	-3	NULL
4	4	NULL
5	5	NULL
6	6	NULL
7	7	NULL
8	8	NULL
9	9	NULL
10	10	NULL
delete from pt where c1 > 10;
select * from pt order by c1;
C1	C2	C3
1	1	NULL
2	2	NULL
3	3	NULL
4	4	NULL
5	5	NULL
6	6	NULL
7	7	NULL
8	8	NULL
9	9	NULL
10	-10	NULL
delete from nt where c1 > 5;
select * from nt order by c1;
C1	C2	C3
1	-1	NULL
2	-2	NULL
3	-3	NULL
4	4	NULL
5	5	NULL
alter table pt exchange partition M1 with table nt including indexes without validation;
select * from pt order by c1;
C1	C2	C3
1	-1	NULL
2	-2	NULL
3	-3	NULL
4	4	NULL
5	5	NULL
5	5	NULL
6	6	NULL
7	7	NULL
8	8	NULL
9	9	NULL
10	-10	NULL
select * from nt order by c1;
C1	C2	C3
1	1	NULL
2	2	NULL
3	3	NULL
4	4	NULL
alter system change tenant tenant_id = 1001;
update __all_log_archive_dest_parameter set value='2m' where dest_no=0 and name='piece_switch_interval';
alter system archivelog;
ob2.check_until_timeout select status from oceanbase.CDB_OB_ARCHIVELOG where tenant_id=$restore_oracle_tenant_id, DOING, 600;
ob2.mysql_p select count(*) from oceanbase.__all_virtual_ls where tenant_id = $restore_oracle_tenant_id and ls_id = $ls_id1 and create_scn = $create_scn1;
count(*)
1
ob2.mysql alter system restore $fo_oracle_tenant from '$restore_path' until time='$restore_checkpoint' with 'pool_list=small_pool_0&primary_zone=z1';
ob2.check_until_timeout SELECT status FROM __all_tenant WHERE tenant_id = 1003, NORMAL, 200;
ob2.mysql alter system set ha_high_thread_score = 100 tenant = $fo_oracle_tenant;
ob2.mysql alter system set ha_mid_thread_score = 100 tenant = $fo_oracle_tenant;
ob2.mysql alter system set ha_low_thread_score = 100 tenant = $fo_oracle_tenant;
ob2.check_until_timeout select count(*) from __all_virtual_ls_meta_table where tenant_id = 1004 and restore_status = 0, 2, 600;
ob2.check_until_timeout select status FROM __all_tenant WHERE tenant_id = 1004, NORMAL, 200;
ob2.check_until_timeout select count(*) FROM __all_restore_job, 0, 200;
select tenant_role from __all_virtual_tenant_info where tenant_id = 1004;
tenant_role
STANDBY
select TENANT_ID, TENANT_NAME, TENANT_TYPE, COMPATIBILITY_MODE, STATUS, IN_RECYCLEBIN, LOCKED, TENANT_ROLE, SWITCHOVER_STATUS, LOG_MODE from DBA_OB_TENANTS order by TENANT_ID;
TENANT_ID	TENANT_NAME	TENANT_TYPE	COMPATIBILITY_MODE	STATUS	IN_RECYCLEBIN	LOCKED	TENANT_ROLE	SWITCHOVER_STATUS	LOG_MODE
1	sys	SYS	MYSQL	NORMAL	NO	NO	PRIMARY	NORMAL	NOARCHIVELOG
1001	META$1002	META	MYSQL	NORMAL	NO	NO	PRIMARY	NORMAL	NOARCHIVELOG
1002	restore_oracle_tenant	USER	ORACLE	NORMAL	NO	NO	PRIMARY	NORMAL	ARCHIVELOG
1003	META$1004	META	MYSQL	NORMAL	NO	NO	PRIMARY	NORMAL	NOARCHIVELOG
1004	fo_oracle_tenant	USER	ORACLE	NORMAL	NO	NO	STANDBY	NORMAL	NOARCHIVELOG
ob2.check_until_timeout select count(*) from DBA_OB_TENANTS where SYNC_SCN >= REPLAYABLE_SCN and REPLAYABLE_SCN>=READABLE_SCN and RECOVERY_UNTIL_SCN !=0 and TENANT_TYPE = "USER", 2, 10;
ob2.check_until_timeout select count(*) from DBA_OB_TENANTS where SYNC_SCN is NULL and REPLAYABLE_SCN is NULL and READABLE_SCN is NULL and RECOVERY_UNTIL_SCN  is NULL and TENANT_TYPE in ("SYS", "META"), 3, 10;
ALTER SYSTEM ACTIVATE STANDBY TENANT fo_oracle_tenant;
ERROR HY000: OBE-00600: internal error code, arguments: -4002, Incorrect arguments to tenant name, please don't specify tenant name
select TENANT_ID, TENANT_NAME, TENANT_TYPE, COMPATIBILITY_MODE, STATUS, IN_RECYCLEBIN, LOCKED, TENANT_ROLE, SWITCHOVER_STATUS, LOG_MODE from DBA_OB_TENANTS order by TENANT_ID;
TENANT_ID	TENANT_NAME	TENANT_TYPE	COMPATIBILITY_MODE	STATUS	IN_RECYCLEBIN	LOCKED	TENANT_ROLE	SWITCHOVER_STATUS	LOG_MODE
1004	fo_oracle_tenant	USER	ORACLE	NORMAL	NO	NO	STANDBY	NORMAL	NOARCHIVELOG
select count(*) from DBA_OB_TENANTS where SYNC_SCN >= REPLAYABLE_SCN and REPLAYABLE_SCN>=READABLE_SCN and RECOVERY_UNTIL_SCN !=0 and TENANT_TYPE = 'USER';
COUNT(*)
1
set ob_query_timeout  = 10000000;
ALTER SYSTEM ACTIVATE STANDBY;
alter system change tenant tenant_id = 1003;
select tenant_role from __all_tenant_info where tenant_id = 1004;
tenant_role
PRIMARY
select * from pt order by c1;
C1	C2	C3
1	1	NULL
2	2	NULL
3	3	NULL
4	4	NULL
5	5	NULL
6	6	NULL
7	7	NULL
8	8	NULL
9	9	NULL
10	10	NULL
11	11	NULL
12	12	NULL
13	13	NULL
14	14	NULL
15	15	NULL
21	21	NULL
22	22	NULL
23	23	NULL
24	24	NULL
25	25	NULL
26	26	NULL
27	27	NULL
28	28	NULL
29	29	NULL
30	30	NULL
31	31	NULL
32	32	NULL
33	33	NULL
34	34	NULL
35	35	NULL
select * from nt order by c1;
C1	C2	C3
ob2.check_until_timeout select count(*) from oceanbase.CDB_OB_MAJOR_COMPACTION where tenant_id = $tenant_id and last_scn = 1, 0, 200;
check major sstable status for 'pt' in tenant 'fo_oracle_tenant' in observer 2
count(1)
0
TABLE_TYPE
check major sstable status for 'nt' in tenant 'fo_oracle_tenant' in observer 2
count(1)
1
TABLE_TYPE
MAJOR
