ob1=OBI(cluster=1,proxy_num=0,init_unit_cpu=0);
ob1.reboot;
create table l (lk1 int, lk2 int, lk3 int , lv1 int, lv2 varchar(512), primary key(lk1, lk2, lk3)) compression = 'none' partition by key (lk1) partitions 2;
create table r (rk int, rv1 int, rv2 varchar(512), primary key(rk)) locality = 'F@z1, R{all_server}@z1';
create materialized view mv as select lk1, lk2, lk3, lv1, lv2, rk, rv1, rv2 from l, r where lk2 = rk order by lk1, lv1;
alter system major freeze;
ob1.check_version 2;
ob1.check_until_timeout select index_status from oceanbase.__all_virtual_table where tenant_id=1 and table_name = 'mv', 2, 20;
update r set rv1 = 2 where rk = 2;
alter system major freeze;
ob1.check_version 3;
ob1.mysql_p select "$mb_before" = "$mb_after" as macro_block_equal;
macro_block_equal
0
ob1.mysql_p select "$mb_before_first" = "$mb_after_first" as first_macro_block_equal;
first_macro_block_equal
1
select * from mv where lk1 = 1 and lk2 = 1 and lk3 = 0;
lk1	lv1	lk2	lk3	rk	lv2	rv1	rv2
select * from mv where lk1 = 1 and lk2 = 2;
lk1	lv1	lk2	lk3	rk	lv2	rv1	rv2
1	1000	2	100000	2	aaaaaaaaaaaaaaaaaaaaaaaaaaaaaaaaaaaaaaaaaaaaaaaaaaaaaaaaaaaaaaaaaaaaaaaaaaaaaaaaaaaaaaaaaaaaaaaaaaaaaaaaaaaaaaaaaaaaaaaaaaaaaaaaaaaaaaaaaaaaaaaaaaaaaaaaaaaaaaaaaaaaaaaaaaaaaaaaaaaaaaaaaaaaaaaaa	2	a
insert into r values(1, 1, 'a');
alter system major freeze;
ob1.check_version 4;
ob1.mysql_p select "$mb_after" = "$mb_after4" as macro_block_equal;
macro_block_equal
0
select * from mv where lk1 = 1 and lk2 = 1 and lk3 = 0;
lk1	lv1	lk2	lk3	rk	lv2	rv1	rv2
1	0	1	0	1	aaaaaaaaaaaaaaaaaaaaaaaaaaaaaaaaaaaaaaaaaaaaaaaaaaaaaaaaaaaaaaaaaaaaaaaaaaaaaaaaaaaaaaaaaaaaaaaaaaaaaaaaaaaaaaaaaaaaaaaaaaaaaaaaaaaaaaaaaaaaaaaaaaaaaaaaaaaaaaaaaaaaaaaaaaaaaaaaaaaaaaaaaaaaaaaaa	1	a
select * from mv where lk1 = 1 and lk2 = 2;
lk1	lv1	lk2	lk3	rk	lv2	rv1	rv2
1	1000	2	100000	2	aaaaaaaaaaaaaaaaaaaaaaaaaaaaaaaaaaaaaaaaaaaaaaaaaaaaaaaaaaaaaaaaaaaaaaaaaaaaaaaaaaaaaaaaaaaaaaaaaaaaaaaaaaaaaaaaaaaaaaaaaaaaaaaaaaaaaaaaaaaaaaaaaaaaaaaaaaaaaaaaaaaaaaaaaaaaaaaaaaaaaaaaaaaaaaaaa	2	a
update l set lv1 = 10 where lk1 = 1 and lk2 = 1 and lk3 = 0;
alter system major freeze;
ob1.check_version 5;
ob1.mysql_p select "$mb_after_first4" = "$mb_after_first5" as first_macro_block_equal;
first_macro_block_equal
0
ob1.mysql_p select "$mb_after_second4" = "$mb_after_second5" as second_macro_block_equal;
second_macro_block_equal
1
select * from mv where lk1 = 1 and lk2 = 1 and lk3 = 0;
lk1	lv1	lk2	lk3	rk	lv2	rv1	rv2
1	10	1	0	1	aaaaaaaaaaaaaaaaaaaaaaaaaaaaaaaaaaaaaaaaaaaaaaaaaaaaaaaaaaaaaaaaaaaaaaaaaaaaaaaaaaaaaaaaaaaaaaaaaaaaaaaaaaaaaaaaaaaaaaaaaaaaaaaaaaaaaaaaaaaaaaaaaaaaaaaaaaaaaaaaaaaaaaaaaaaaaaaaaaaaaaaaaaaaaaaaa	1	a
select * from mv where lk1 = 1 and lk2 = 2;
lk1	lv1	lk2	lk3	rk	lv2	rv1	rv2
1	1000	2	100000	2	aaaaaaaaaaaaaaaaaaaaaaaaaaaaaaaaaaaaaaaaaaaaaaaaaaaaaaaaaaaaaaaaaaaaaaaaaaaaaaaaaaaaaaaaaaaaaaaaaaaaaaaaaaaaaaaaaaaaaaaaaaaaaaaaaaaaaaaaaaaaaaaaaaaaaaaaaaaaaaaaaaaaaaaaaaaaaaaaaaaaaaaaaaaaaaaaa	2	a
