ob1=OBI(cluster=1,proxy_num=0,init_unit_cpu=2, init_unit_num=1);
ob1.reboot;
ob1.source include/merge.inc;
ob1.mysql alter system set enable_async_syslog=false;
ob1.mysql alter system set minor_compact_trigger = 1;
use test;
create table t0(a int, b int default 1, index i1(b)) table_mode='queuing';
create table t1(a int);
insert into t0(a) values(1);
insert into t1(a) values(1);
show create table t0;
Table	Create Table
t0	CREATE TABLE `t0` (
  `a` int(11) DEFAULT NULL,
  `b` int(11) DEFAULT '1',
  KEY `i1` (`b`) BLOCK_SIZE 16384
) DEFAULT CHARSET = utf8mb4 ROW_FORMAT = DYNAMIC COMPRESSION = 'zstd_1.0' REPLICA_NUM = 1 BLOCK_SIZE = 16384 USE_BLOOM_FILTER = FALSE TABLET_SIZE = 134217728 PCTFREE = 0 TABLE_MODE = 'QUEUING'
show create table t1;
Table	Create Table
t1	CREATE TABLE `t1` (
  `a` int(11) DEFAULT NULL
) DEFAULT CHARSET = utf8mb4 ROW_FORMAT = DYNAMIC COMPRESSION = 'zstd_1.0' REPLICA_NUM = 1 BLOCK_SIZE = 16384 USE_BLOOM_FILTER = FALSE TABLET_SIZE = 134217728 PCTFREE = 0
ob1.mysql_p select table_name, table_mode from oceanbase.__all_virtual_table where table_name in ('t0', 't1');
table_name	table_mode
t0	1
t1	0
ob1.mysql alter system minor freeze tenant = sys;
ob1.mysql alter system minor freeze tenant = all_user;
ob1.mysql alter system minor freeze tenant = all_meta;
ob1.check_until_timeout select count(*) from oceanbase.__all_virtual_table_mgr where table_id=$tid_0 and index_id=$tid_0 and table_type=0 and is_active=0, 0, 120;
ob1.check_until_timeout select count(*) from oceanbase.__all_virtual_table_mgr where svr_ip='$svr_ip' and svr_port='$svr_port' and table_id=$tid_0 and index_id=$tid_0 and table_type=8, 1, 120;
ob1.check_until_timeout select count(*) from oceanbase.__all_virtual_table_mgr where svr_ip='$svr_ip' and svr_port='$svr_port' and table_id=$tid_1 and table_type=7, 1, 30;
select * from t0;
a	b
1	1
select * from t1;
a
1
insert into t0(a) values(2);
insert into t1(a) values(2);
ob1.mysql alter system minor freeze tenant = sys;
ob1.mysql alter system minor freeze tenant = all_user;
ob1.mysql alter system minor freeze tenant = all_meta;
ob1.check_until_timeout select count(*) from oceanbase.__all_virtual_table_mgr where table_id=$tid_0 and index_id=$tid_0 and table_type=0 and is_active=0, 0, 120;
ob1.check_until_timeout select count(*) from oceanbase.__all_virtual_table_mgr where svr_ip='$svr_ip' and svr_port='$svr_port' and table_id=$tid_0 and index_id=$tid_0 and table_type=8, 1, 120;
ob1.check_until_timeout select count(*) from oceanbase.__all_virtual_table_mgr where svr_ip='$svr_ip' and svr_port='$svr_port' and table_id=$tid_1 and table_type=7, 1, 120;
ob1.mysql alter system major freeze;
ob1.check_until_timeout select value from __all_zone where zone='' and name='last_merged_version', 2,3600;
ob1.check_until_timeout select count(*) from oceanbase.__all_virtual_table_mgr where table_id=$tid_0 and index_id=$tid_0 and table_type=0 and is_active=0, 0, 120;
ob1.check_until_timeout select count(*) from oceanbase.__all_virtual_table_mgr where svr_ip='$svr_ip' and svr_port='$svr_port' and table_id=$tid_0 and index_id=$tid_0 and table_type=8, 0, 120;
ob1.check_until_timeout select count(*) from oceanbase.__all_virtual_table_mgr where svr_ip='$svr_ip' and svr_port='$svr_port' and table_id=$tid_1 and table_type=7, 0, 120;
select * from t0;
a	b
1	1
2	1
select * from t1;
a
1
2
insert into t0(a) values(3);
insert into t1(a) values(3);
update t0 set a=-1 where a=1;
alter table t0 table_mode='normal';
alter table t1 table_mode='queuing';
ob1.mysql_p select table_name, table_mode from oceanbase.__all_virtual_table where table_name in ('t0', 't1');
table_name	table_mode
t0	0
t1	1
ob1.mysql alter system minor freeze tenant = sys;
ob1.mysql alter system minor freeze tenant = all_user;
ob1.mysql alter system minor freeze tenant = all_meta;
ob1.check_until_timeout select count(*) from oceanbase.__all_virtual_table_mgr where table_id=$tid_0 and index_id=$tid_0 and table_type=0 and is_active=0, 0, 120;
ob1.check_until_timeout select count(*) from oceanbase.__all_virtual_table_mgr where svr_ip='$svr_ip' and svr_port='$svr_port' and table_id=$tid_1 and table_type=7, 1, 120;
ob1.check_until_timeout select count(*) from oceanbase.__all_virtual_table_mgr where svr_ip='$svr_ip' and svr_port='$svr_port' and table_id=$tid_0 and index_id=$tid_0 and table_type=8, 1, 120;
ob1.check_until_timeout select count(*) from oceanbase.__all_virtual_table_mgr where svr_ip='$svr_ip' and svr_port='$svr_port' and table_id=$tid_0 and index_id=$tid_0 and table_type=7, 0, 120;
ob1.z1.obs0.stop;
ob1.z1.obs0.nstart -m physical_flashback -f $flashback_scn;
ob1.z1.obs0.nstart;
ob1.check_until_timeout select status from oceanbase.__all_server where zone='z1', active, 60;
use test;
select * from t0;
a	b
1	1
2	1
select * from t1;
a
1
2
