ob1=OBI(cluster=1:1:1,proxy_num=0,init_unit_cpu=2, init_unit_num=1);
ob1.reboot;
ob1.source include/merge.inc;
ob1.mysql alter system set enable_async_syslog=false;
ob1.mysql alter system set minor_compact_trigger = 1;
use test;
create table t0(a int, b int default 1, index i1(b)) table_mode='queuing';
insert into t0(a) values(1);
create index i2 on t0(b);
show create table t0;
Table	Create Table
t0	CREATE TABLE `t0` (
  `a` int(11) DEFAULT NULL,
  `b` int(11) DEFAULT '1',
  KEY `i1` (`b`) BLOCK_SIZE 16384 GLOBAL,
  KEY `i2` (`b`) BLOCK_SIZE 16384 GLOBAL
) DEFAULT CHARSET = utf8mb4 ROW_FORMAT = DYNAMIC COMPRESSION = 'zstd_1.3.8' REPLICA_NUM = 3 BLOCK_SIZE = 16384 USE_BLOOM_FILTER = FALSE TABLET_SIZE = 134217728 PCTFREE = 0 TABLE_MODE = 'QUEUING'
ob1.mysql alter system suspend merge;
ob1.mysql alter system major freeze;
ob1.check_until_timeout select count(*) from oceanbase.__all_virtual_table_mgr where table_id=$tid_0 and index_id=$tid_0 and table_type=0 and is_active=0, 0, 120;
select * from t0;
a	b
1	1
delete from t0 where a = 1;
insert into t0(a) values(2);
ob1.mysql alter system minor freeze tenant = sys;
ob1.mysql alter system minor freeze tenant = all_user;
ob1.mysql alter system minor freeze tenant = all_meta;
ob1.check_until_timeout select count(*) from oceanbase.__all_virtual_table_mgr where table_id=$tid_0 and index_id=$tid_0 and table_type=0 and is_active=0, 0, 120;
insert into t0(a) values(3);
ob1.mysql alter system minor freeze tenant = sys;
ob1.mysql alter system minor freeze tenant = all_user;
ob1.mysql alter system minor freeze tenant = all_meta;
ob1.check_until_timeout select count(*) from oceanbase.__all_virtual_table_mgr where table_id=$tid_0 and index_id=$tid_0 and table_type=0 and is_active=0, 0, 120;
ob1.mysql alter system set minor_compact_trigger = 1;
ob1.check_until_timeout select count(*) from oceanbase.__all_virtual_table_mgr where svr_ip='$svr_ip' and svr_port='$svr_port' and table_id=$tid_0 and table_type=14, 3, 120;
select * from t0;
a	b
2	1
3	1
