drop table if exists branch_sp_tbl_src;
drop table if exists branch_sp_tbl_dest;
drop table if exists branch_sp_tbl_tmp;
create table branch_sp_tbl_src(id int primary key, v int) partition by key(id) partitions 4;
create table branch_sp_tbl_tmp like branch_sp_tbl_src;
create table branch_sp_tbl_dest like branch_sp_tbl_src;
insert 65536 rows into src table
insert into branch_sp_tbl_src values(1,1);
0
insert/*+enable_parallel_dml parallel(100) query_timeout(1000000000)*/ into branch_sp_tbl_src
select (select count(1) from branch_sp_tbl_src) + id, v from branch_sp_tbl_src;
1
insert/*+enable_parallel_dml parallel(100) query_timeout(1000000000)*/ into branch_sp_tbl_src
select (select count(1) from branch_sp_tbl_src) + id, v from branch_sp_tbl_src;
2
insert/*+enable_parallel_dml parallel(100) query_timeout(1000000000)*/ into branch_sp_tbl_src
select (select count(1) from branch_sp_tbl_src) + id, v from branch_sp_tbl_src;
3
insert/*+enable_parallel_dml parallel(100) query_timeout(1000000000)*/ into branch_sp_tbl_src
select (select count(1) from branch_sp_tbl_src) + id, v from branch_sp_tbl_src;
4
insert/*+enable_parallel_dml parallel(100) query_timeout(1000000000)*/ into branch_sp_tbl_src
select (select count(1) from branch_sp_tbl_src) + id, v from branch_sp_tbl_src;
5
insert/*+enable_parallel_dml parallel(100) query_timeout(1000000000)*/ into branch_sp_tbl_src
select (select count(1) from branch_sp_tbl_src) + id, v from branch_sp_tbl_src;
6
insert/*+enable_parallel_dml parallel(100) query_timeout(1000000000)*/ into branch_sp_tbl_src
select (select count(1) from branch_sp_tbl_src) + id, v from branch_sp_tbl_src;
7
insert/*+enable_parallel_dml parallel(100) query_timeout(1000000000)*/ into branch_sp_tbl_src
select (select count(1) from branch_sp_tbl_src) + id, v from branch_sp_tbl_src;
8
insert/*+enable_parallel_dml parallel(100) query_timeout(1000000000)*/ into branch_sp_tbl_src
select (select count(1) from branch_sp_tbl_src) + id, v from branch_sp_tbl_src;
9
insert/*+enable_parallel_dml parallel(100) query_timeout(1000000000)*/ into branch_sp_tbl_src
select (select count(1) from branch_sp_tbl_src) + id, v from branch_sp_tbl_src;
10
insert/*+enable_parallel_dml parallel(100) query_timeout(1000000000)*/ into branch_sp_tbl_src
select (select count(1) from branch_sp_tbl_src) + id, v from branch_sp_tbl_src;
11
insert/*+enable_parallel_dml parallel(100) query_timeout(1000000000)*/ into branch_sp_tbl_src
select (select count(1) from branch_sp_tbl_src) + id, v from branch_sp_tbl_src;
12
insert/*+enable_parallel_dml parallel(100) query_timeout(1000000000)*/ into branch_sp_tbl_src
select (select count(1) from branch_sp_tbl_src) + id, v from branch_sp_tbl_src;
13
insert/*+enable_parallel_dml parallel(100) query_timeout(1000000000)*/ into branch_sp_tbl_src
select (select count(1) from branch_sp_tbl_src) + id, v from branch_sp_tbl_src;
select count(1) as 'rows in src table:' from branch_sp_tbl_src;
rows in src table:
16384
insert src table rows into dest table
insert/*+enable_parallel_dml parallel(100) query_timeout(1000000000)*/ into branch_sp_tbl_dest
select id, v from branch_sp_tbl_src;
select count(1) as 'rows in dest table:' from branch_sp_tbl_dest;
rows in dest table:
16384
delete some rows from dest table
delete from branch_sp_tbl_dest where id % 7 = 0;
run insert on duplicate
explain basic insert/*+enable_parallel_dml parallel(100) query_timeout(1000000000)*/ into branch_sp_tbl_dest
select id, v from branch_sp_tbl_src on duplicate key update v = v + 1;
Query Plan
================================================
|ID|OPERATOR                 |NAME             |
------------------------------------------------
|0 |PX COORDINATOR           |                 |
|1 |└─EXCHANGE OUT DISTR     |:EX10000         |
|2 |  └─PX PARTITION ITERATOR|                 |
|3 |    └─INSERT_UP          |                 |
|4 |      └─SUBPLAN SCAN     |ANONYMOUS_VIEW1  |
|5 |        └─TABLE FULL SCAN|branch_sp_tbl_src|
================================================
Outputs & filters:
-------------------------------------
  0 - output(nil), filter(nil), rowset=256
  1 - output(nil), filter(nil), rowset=256
      dop=100
  2 - output(nil), filter(nil), rowset=256
      partition wise, force partition granule
  3 - output(nil), filter(nil)
      columns([{branch_sp_tbl_dest: ({branch_sp_tbl_dest: (branch_sp_tbl_dest.id, branch_sp_tbl_dest.v)})}]), partitions(p[0-3]), 
      column_values([column_conv(INT,PS:(11,0),NOT NULL,ANONYMOUS_VIEW1.id)], [column_conv(INT,PS:(11,0),NULL,ANONYMOUS_VIEW1.v)]),
      update([branch_sp_tbl_dest.v=column_conv(INT,PS:(11,0),NULL,cast(branch_sp_tbl_dest.v + 1, INT(-1, 0)))])
  4 - output([ANONYMOUS_VIEW1.id], [ANONYMOUS_VIEW1.v]), filter(nil), rowset=256
      access([ANONYMOUS_VIEW1.id], [ANONYMOUS_VIEW1.v])
  5 - output([branch_sp_tbl_src.id], [branch_sp_tbl_src.v]), filter(nil), rowset=256
      access([branch_sp_tbl_src.id], [branch_sp_tbl_src.v]), partitions(p[0-3])
      is_index_back=false, is_global_index=false, 
      range_key([branch_sp_tbl_src.id]), range(MIN ; MAX)always true
insert/*+parallel(100) query_timeout(1000000000)*/ into branch_sp_tbl_dest
select id, v from branch_sp_tbl_src on duplicate key update v = v + 1;
select count(1) as 'rows in dest table after insert-on-duplicate:' from branch_sp_tbl_dest;
rows in dest table after insert-on-duplicate:
16384
delete some rows from dest table
delete from branch_sp_tbl_dest where id % 19 = 0;
delete from branch_sp_tbl_dest where id % 23 = 0;
delete from branch_sp_tbl_dest where id % 71 = 0;
delete from branch_sp_tbl_dest where id % 113 = 0;
run replace into
explain basic replace/*+parallel(100) query_timeout(1000000000)*/ into branch_sp_tbl_dest
select id, v from branch_sp_tbl_src;
Query Plan
================================================
|ID|OPERATOR                 |NAME             |
------------------------------------------------
|0 |PX COORDINATOR           |                 |
|1 |└─EXCHANGE OUT DISTR     |:EX10000         |
|2 |  └─PX PARTITION ITERATOR|                 |
|3 |    └─REPLACE            |                 |
|4 |      └─SUBPLAN SCAN     |ANONYMOUS_VIEW1  |
|5 |        └─TABLE FULL SCAN|branch_sp_tbl_src|
================================================
Outputs & filters:
-------------------------------------
  0 - output(nil), filter(nil), rowset=256
  1 - output(nil), filter(nil), rowset=256
      dop=100
  2 - output(nil), filter(nil), rowset=256
      partition wise, force partition granule
  3 - output(nil), filter(nil)
      columns([{branch_sp_tbl_dest: ({branch_sp_tbl_dest: (branch_sp_tbl_dest.id, branch_sp_tbl_dest.v)})}]), partitions(p[0-3]), 
      column_values([column_conv(INT,PS:(11,0),NOT NULL,ANONYMOUS_VIEW1.id)], [column_conv(INT,PS:(11,0),NULL,ANONYMOUS_VIEW1.v)])
  4 - output([ANONYMOUS_VIEW1.id], [ANONYMOUS_VIEW1.v]), filter(nil), rowset=256
      access([ANONYMOUS_VIEW1.id], [ANONYMOUS_VIEW1.v])
  5 - output([branch_sp_tbl_src.id], [branch_sp_tbl_src.v]), filter(nil), rowset=256
      access([branch_sp_tbl_src.id], [branch_sp_tbl_src.v]), partitions(p[0-3])
      is_index_back=false, is_global_index=false, 
      range_key([branch_sp_tbl_src.id]), range(MIN ; MAX)always true
replace/*+parallel(100) query_timeout(1000000000)*/ into branch_sp_tbl_dest
select id, v from branch_sp_tbl_src;
select count(1) as 'rows in dest table after replace:' from branch_sp_tbl_dest;
rows in dest table after replace:
16384
