create table t1(pk int primary key, a int, b int, c varchar(1024));
create index i1 on t1(b) storing(c);
set autocommit=0;
insert into t1 values(1,1,1,'a');
commit;
insert into t1 values(1, 3, 5,7) on duplicate key update b = pk + b;
set autocommit=0;
insert into t1 values(2,1,1,'a');
commit;
insert into t1 values(2,1,1,'a') on duplicate key update b = pk + b;
select pk, b, c from t1 where b>0 and b<10 order by pk;
pk	b	c
1	1	a
2	3	a
select pk, a, b from t1 where pk>0 and pk<10 order by pk;
pk	a	b
1	1	1
2	1	3
select * from t1 where b>0 and b<10 order by pk;
pk	a	b	c
1	1	1	a
2	1	3	a
select pk, b, c from t1 where b>0 and b<10 order by pk;
pk	b	c
1	2	a
2	1	a
select pk, a, b from t1 where pk>0 and pk<10  order by pk;
pk	a	b
1	1	2
2	1	1
select * from t1 where b>0 and b<10 order by pk;
pk	a	b	c
1	1	2	a
2	1	1	a
commit;
select pk, b, c from t1 where b>0 and b<10 order by pk;
pk	b	c
1	2	a
2	1	a
select pk, a, b from t1 where pk>0 and pk<10 order by pk;
pk	a	b
1	1	2
2	1	1
select * from t1 where b>0 and b<10 order by pk;
pk	a	b	c
1	1	2	a
2	1	1	a
commit;
select pk, b, c from t1 where b>0 and b<10 order by pk;
pk	b	c
1	2	a
2	3	a
select pk, a, b from t1 where pk>0 and pk<10 order by pk;
pk	a	b
1	1	2
2	1	3
select * from t1 where b>0 and b<10 order by pk;
pk	a	b	c
1	1	2	a
2	1	3	a
commit;
select pk, b, c from t1 where b>0 and b<10 order by pk;
pk	b	c
1	2	a
2	3	a
select pk, a, b from t1 where pk>0 and pk<10 order by pk;
pk	a	b
1	1	2
2	1	3
select * from t1 where b>0 and b<10 order by pk;
pk	a	b	c
1	1	2	a
2	1	3	a
commit;
set autocommit=0;
insert into t1 values(3,1,1,'a');
commit;
insert into t1 values(3,1,1,'a') on duplicate key update b = pk + b;
set autocommit=0;
insert into t1 values(4,1,1,'a');
commit;
insert into t1 values(4,1,1,'a') on duplicate key update b = pk + b;
delete from t1 where pk=3;
Got one of the listed errors
update t1 set b=4 where pk=3;
Got one of the listed errors
insert into t1 values(3,1,1,'a') on duplicate key update b = b-pk;
Got one of the listed errors
insert into t1 values(3,1,1,'c') on duplicate key update b = pk + b;
Got one of the listed errors
insert into t1 values(5,1,1,'a');
select pk, b, c from t1 where b>0 and b<10 order by pk;
pk	b	c
1	2	a
2	3	a
3	1	a
4	5	a
5	1	a
select pk, a, b from t1 where pk>0 and pk<10 order by pk;
pk	a	b
1	1	2
2	1	3
3	1	1
4	1	5
5	1	1
select * from t1 where b>0 and b<10 order by pk;
pk	a	b	c
1	1	2	a
2	1	3	a
3	1	1	a
4	1	5	a
5	1	1	a
select pk, b, c from t1 where b>0 and b<10 order by pk;
pk	b	c
1	2	a
2	3	a
3	4	a
4	1	a
select pk, a, b from t1 where pk>0 and pk<10 order by pk;
pk	a	b
1	1	2
2	1	3
3	1	4
4	1	1
select * from t1 where b>0 and b<10 order by pk;
pk	a	b	c
1	1	2	a
2	1	3	a
3	1	4	a
4	1	1	a
commit;
select pk, b, c from t1 where b>0 and b<10 order by pk;
pk	b	c
1	2	a
2	3	a
3	4	a
4	1	a
select pk, a, b from t1 where pk>0 and pk<10 order by pk;
pk	a	b
1	1	2
2	1	3
3	1	4
4	1	1
select * from t1 where b>0 and b<10 order by pk;
pk	a	b	c
1	1	2	a
2	1	3	a
3	1	4	a
4	1	1	a
commit;
select pk, b, c from t1 where b>0 and b<10 order by pk;
pk	b	c
1	2	a
2	3	a
3	4	a
4	5	a
5	1	a
select pk, a, b from t1 where pk>0 and pk<10 order by pk;
pk	a	b
1	1	2
2	1	3
3	1	4
4	1	5
5	1	1
select * from t1 where b>0 and b<10 order by pk;
pk	a	b	c
1	1	2	a
2	1	3	a
3	1	4	a
4	1	5	a
5	1	1	a
commit;
select pk, b, c from t1 where b>0 and b<10 order by pk;
pk	b	c
1	2	a
2	3	a
3	4	a
4	5	a
5	1	a
select pk, a, b from t1 where pk>0 and pk<10 order by pk;
pk	a	b
1	1	2
2	1	3
3	1	4
4	1	5
5	1	1
select * from t1 where b>0 and b<10 order by pk;
pk	a	b	c
1	1	2	a
2	1	3	a
3	1	4	a
4	1	5	a
5	1	1	a
commit;
set autocommit=0;
insert into t1 values(6,1,1,'a'),(7,1,1,'a'),(8,1,1,'a');
commit;
insert into t1 values(6,1,1,'a') on duplicate key update b = b-pk;
set autocommit=0;
insert into t1 values(7,2,2,'b') on duplicate key update b = b-pk;
insert into t1 values(8,2,2,'b') on duplicate key update b = b-pk;
delete from t1 where pk = 8;
update t1 set b = b-pk where pk=7;
select pk, b, c from t1 where b>0 and b<10 order by pk;
pk	b	c
1	2	a
2	3	a
3	4	a
4	5	a
5	1	a
6	1	a
select pk, a, b from t1 where pk>0 and pk<10 order by pk;
pk	a	b
1	1	2
2	1	3
3	1	4
4	1	5
5	1	1
6	1	1
7	1	-13
select * from t1 where b>0 and b<10 order by pk;
pk	a	b	c
1	1	2	a
2	1	3	a
3	1	4	a
4	1	5	a
5	1	1	a
6	1	1	a
select pk, b, c from t1 where b>0 and b<10 order by pk;
pk	b	c
1	2	a
2	3	a
3	4	a
4	5	a
5	1	a
7	1	a
8	1	a
select pk, a, b from t1 where pk>0 and pk<10 order by pk;
pk	a	b
1	1	2
2	1	3
3	1	4
4	1	5
5	1	1
6	1	-5
7	1	1
8	1	1
select * from t1 where b>0 and b<10 order by pk;
pk	a	b	c
1	1	2	a
2	1	3	a
3	1	4	a
4	1	5	a
5	1	1	a
7	1	1	a
8	1	1	a
commit;
select pk, b, c from t1 where b>0 and b<10 order by pk;
pk	b	c
1	2	a
2	3	a
3	4	a
4	5	a
5	1	a
7	1	a
8	1	a
select pk, a, b from t1 where pk>0 and pk<10 order by pk;
pk	a	b
1	1	2
2	1	3
3	1	4
4	1	5
5	1	1
6	1	-5
7	1	1
8	1	1
select * from t1 where b>0 and b<10 order by pk;
pk	a	b	c
1	1	2	a
2	1	3	a
3	1	4	a
4	1	5	a
5	1	1	a
7	1	1	a
8	1	1	a
commit;
select pk, b, c from t1 where b>0 and b<10 order by pk;
pk	b	c
1	2	a
2	3	a
3	4	a
4	5	a
5	1	a
select pk, a, b from t1 where pk>0 and pk<10 order by pk;
pk	a	b
1	1	2
2	1	3
3	1	4
4	1	5
5	1	1
6	1	-5
7	1	-13
select * from t1 where b>0 and b<10 order by pk;
pk	a	b	c
1	1	2	a
2	1	3	a
3	1	4	a
4	1	5	a
5	1	1	a
commit;
select pk, b, c from t1 where b>0 and b<10 order by pk;
pk	b	c
1	2	a
2	3	a
3	4	a
4	5	a
5	1	a
select pk, a, b from t1 where pk>0 and pk<10 order by pk;
pk	a	b
1	1	2
2	1	3
3	1	4
4	1	5
5	1	1
6	1	-5
7	1	-13
select * from t1 where b>0 and b<10 order by pk;
pk	a	b	c
1	1	2	a
2	1	3	a
3	1	4	a
4	1	5	a
5	1	1	a
commit;
set autocommit=0;
insert into t1 values(10,1,1,'a');
commit;
insert into t1 values(10,1,1,'a') on duplicate key update b = b-pk;
set autocommit=0;
insert into t1 values(11,1,1,'a');
commit;
insert into t1 values(11,1,1,'a') on duplicate key update b = b-pk;
select pk, b, c from t1 where b>0 and b<10 order by pk;
pk	b	c
1	2	a
2	3	a
3	4	a
4	5	a
5	1	a
10	1	a
select pk, a, b from t1 where pk>0 and pk<20 order by pk;
pk	a	b
1	1	2
2	1	3
3	1	4
4	1	5
5	1	1
6	1	-5
7	1	-13
10	1	1
11	1	-10
select * from t1 where b>0 and b<10 order by pk;
pk	a	b	c
1	1	2	a
2	1	3	a
3	1	4	a
4	1	5	a
5	1	1	a
10	1	1	a
select pk, b, c from t1 where b>0 and b<10 order by pk;
pk	b	c
1	2	a
2	3	a
3	4	a
4	5	a
5	1	a
11	1	a
select pk, a, b from t1 where pk>0 and pk<10 order by pk;
pk	a	b
1	1	2
2	1	3
3	1	4
4	1	5
5	1	1
6	1	-5
7	1	-13
select * from t1 where b>0 and b<10 order by pk;
pk	a	b	c
1	1	2	a
2	1	3	a
3	1	4	a
4	1	5	a
5	1	1	a
11	1	1	a
commit;
select pk, b, c from t1 where b>0 and b<10 order by pk;
pk	b	c
1	2	a
2	3	a
3	4	a
4	5	a
5	1	a
11	1	a
select pk, a, b from t1 where pk>0 and pk<20 order by pk;
pk	a	b
1	1	2
2	1	3
3	1	4
4	1	5
5	1	1
6	1	-5
7	1	-13
10	1	-9
11	1	1
select * from t1 where b>0 and b<10 order by pk;
pk	a	b	c
1	1	2	a
2	1	3	a
3	1	4	a
4	1	5	a
5	1	1	a
11	1	1	a
commit;
select pk, b, c from t1 where b>0 and b<10 order by pk;
pk	b	c
1	2	a
2	3	a
3	4	a
4	5	a
5	1	a
select pk, a, b from t1 where pk>0 and pk<20 order by pk;
pk	a	b
1	1	2
2	1	3
3	1	4
4	1	5
5	1	1
6	1	-5
7	1	-13
10	1	-9
11	1	-10
select * from t1 where b>0 and b<10 order by pk;
pk	a	b	c
1	1	2	a
2	1	3	a
3	1	4	a
4	1	5	a
5	1	1	a
rollback;
select pk, b, c from t1 where b>0 and b<10 order by pk;
pk	b	c
1	2	a
2	3	a
3	4	a
4	5	a
5	1	a
11	1	a
select pk, a, b from t1 where pk>0 and pk<20 order by pk;
pk	a	b
1	1	2
2	1	3
3	1	4
4	1	5
5	1	1
6	1	-5
7	1	-13
10	1	-9
11	1	1
select * from t1 where b>0 and b<10 order by pk;
pk	a	b	c
1	1	2	a
2	1	3	a
3	1	4	a
4	1	5	a
5	1	1	a
11	1	1	a
commit;
drop table t1;
