drop table if exists t1;
create table t1(pk int primary key, c1 int);
create index idx on t1(c1);
insert into t1 values(6,6),(7,7),(8,8);
set autocommit=0;
set autocommit=0;
update t1 set pk=9 where pk=6;
update t1 set pk=10 where pk=6;
Got one of the listed errors
commit;
commit;
select * from t1;
pk	c1
7	7
8	8
9	6
update t1 set c1='9' where pk='9';
update t1 set c1='10' where pk='9';
Got one of the listed errors
commit;
commit;
select * from t1;
pk	c1
7	7
8	8
9	9
update t1 set c1='9' where c1='7';
update t1 set c1='10' where c1='7';
commit;
commit;
select * from t1;
pk	c1
7	9
8	8
9	9
update t1 set pk='19' where c1='8';
update t1 set pk='10' where pk='8';
Got one of the listed errors
update t1 set pk='10' where pk='8';
commit;
commit;
select * from t1;
pk	c1
7	9
9	9
19	8
