use test;
drop table if exists readonly_trans_test;
create table readonly_trans_test(id1 int, id2 int);
desc readonly_trans_test;
Field	Type	Null	Key	Default	Extra
id1	int(11)	YES		NULL	
id2	int(11)	YES		NULL	
insert into readonly_trans_test values(1, 1);
insert into readonly_trans_test values(1, 2);
insert into readonly_trans_test values(1, 3);
select count(1)=3 from readonly_trans_test;
count(1)=3
1
set autocommit=0;
set @@session.tx_read_only=1;
begin;
select * from readonly_trans_test;
id1	id2
1	1
1	2
1	3
select * from readonly_trans_test;
id1	id2
1	1
1	2
1	3
select * from readonly_trans_test;
id1	id2
1	1
1	2
1	3
update readonly_trans_test set id1=0 where id2=2;
ERROR 25006: Cannot execute statement in a READ ONLY transaction.
commit;
set autocommit=1;
set @@session.tx_read_only=0;
select * from readonly_trans_test;
id1	id2
1	1
1	2
1	3
drop table if exists readonly_trans_test;
