set session autocommit = 0;
set session ob_trx_timeout = 500000000;
use test;
drop table if exists sp_test1;
create table sp_test1(a int, b int);
begin;
rollback to sp1;
ERROR 42000: savepoint does not exist
insert into sp_test1 values(1, 1);
rollback to sp2;
ERROR 42000: savepoint does not exist
commit;
drop table if exists sp_test1;
create table sp_test1(a int, b int);
savepoint sp1;
insert into sp_test1 values(1, 1);
insert into sp_test1 values(2, 2);
rollback to sp1;
select * from sp_test1;
a	b
commit;
drop table if exists sp_test1;
create table sp_test1(a int, b int);
begin;
savepoint s1;
savepoint s2;
savepoint s3;
insert into sp_test1 values (1, 1);
select * from sp_test1;
a	b
1	1
release savepoint s2;
rollback to s3;
ERROR 42000: savepoint does not exist
rollback to s2;
ERROR 42000: savepoint does not exist
select * from sp_test1;
a	b
1	1
commit;
test autocommit=0 with savepoint release
set autocommit=0;
savepoint s1;
release savepoint s1;
rollback to s1;
ERROR 42000: savepoint does not exist
commit;
release savepoint s1;
ERROR 42000: savepoint does not exist
begin;
select 1;
1
1
savepoint sp1;
rollback to sp1;
commit;
drop table if exists sp_test1;
drop table if exists sp_test2;
create table sp_test1(a int, b int);
create table sp_test2(a int);
begin;
savepoint sp1;
insert into sp_test1 values(1,1);
savepoint sp2;
insert into sp_test2 values(1);
savepoint sp3;
insert into sp_test1 values (2,2);
insert into sp_test2 values (2);
select * from sp_test1;
a	b
1	1
2	2
select * from sp_test2;
a
1
2
rollback to sp3;
select * from sp_test1;
a	b
1	1
select * from sp_test2;
a
1
commit;
begin;
savepoint aaaaaaaaaaaaaaaaaaaaaaaaaaaaaaaaaaaaaaaaaaaaaaaaaaaaaaaaaaaaaaaaaaaaaaaaaaaaaaaaaaaaaaaaaaaaaaaaaaaaaaaaaaaaaaaaaaaaaaaaaaaaaaaaaaaaaaaaaaaaaaaaaaaaaaaaaaaaaaaaaaaaaaaaaaaaaaaaaaaaaaaaaaaaaaaaaaaaaaaaaaaaaaaaaaaaaaaaaaaaaaaaaaaaaaaaaaaaaaaaaaaaaaaaaaaaaaaaaaaaaaaaaaaaaaaaaaaaaaaaaaaaaaaaaaaaaaaaaaaaaaaaaaaaaaaaaaaaaaaaaaaaaaaaaaaaaaaaaaaaaaaaaaaaaaaaaaaaaaaaaaaaaaaaaaaaaaaaaaaaaaaaaaaaaaaaaaaaaaaaaaaaaaaaaaaaaaaaaaaaaaaaaaaaaaaaaaaaaaaaaaaaaaaaaaaaaaaaaaaaaaaaaaaaaaaaaaaaaaaaaaaaaaaaaaaaaaaaaaaaaaaaaaaaaaaaaaaaaaaaaaaaaaaaaaaaaaaaaaaaaaaaaaaaaaaaaaaaaaaaaaaaaaaaaaaaaaaaaaaaaaaaaaaaaaaaaaaaaaaaaaaaaaaaaaaaaaaaaaaaaaaaaaaaaaaaaaaaaaaaaaaaaaaaaaaaaaaaaaaaaaaaaaaaaaaaaaaaaaaaaaaaaaaaaaaaaaaaaaaaaaaaaaaaaaaaaaaaaaaaaaaaaaaaaaaaaaaaaaaaaaaaaaaaaaaaaaaaaaaaaaaaaaaaaaaaaaaaaaaaaaaaaaaaaaaaaaaaaaaaaaaaaaaaaaaaaaaaaaaaaaaaaaaaaaaaaaaaaaaaaaaaaaaaaaaaaaaaaaaaaaaaaaaaaaaaaaaaaaaaaaaaaaaaaaaaaaaaaaaaaaaaaaaaaaaaaaaaaaaaaaaaaaaaaaaaaaaaaaaaaaaaaaaaaaaaaaaaaaaaaaaaaaaaaaaaaaaaaaaaaaaaaaaaaaaaaaaaaaaaaaaaaaaaaaaaaaaaaaaaaaaaaaaaaaaaaaaaaaaaaaaaaaaaaaaaaaaaaaaaaaaaaaaaaaaaaaaaaaaaaaaaaaaaaaaaaaaaaaaaaaaaaaaaaaaaaaaaaaaaaaaaaaaaaaaaaaaaaaaaaaaaaaaaaaaaaaaaaaaaaaaaaaaaaaaaaaaaaaaa;
ERROR 42000: Identifier name is too long
rollback to aaaaaaaaaaaaaaaaaaaaaaaaaaaaaaaaaaaaaaaaaaaaaaaaaaaaaaaaaaaaaaaaaaaaaaaaaaaaaaaaaaaaaaaaaaaaaaaaaaaaaaaaaaaaaaaaaaaaaaaaaaaaaaaaaaaaaaaaaaaaaaaaaaaaaaaaaaaaaaaaaaaaaaaaaaaaaaaaaaaaaaaaaaaaaaaaaaaaaaaaaaaaaaaaaaaaaaaaaaaaaaaaaaaaaaaaaaaaaaaaaaaaaaaaaaaaaaaaaaaaaaaaaaaaaaaaaaaaaaaaaaaaaaaaaaaaaaaaaaaaaaaaaaaaaaaaaaaaaaaaaaaaaaaaaaaaaaaaaaaaaaaaaaaaaaaaaaaaaaaaaaaaaaaaaaaaaaaaaaaaaaaaaaaaaaaaaaaaaaaaaaaaaaaaaaaaaaaaaaaaaaaaaaaaaaaaaaaaaaaaaaaaaaaaaaaaaaaaaaaaaaaaaaaaaaaaaaaaaaaaaaaaaaaaaaaaaaaaaaaaaaaaaaaaaaaaaaaaaaaaaaaaaaaaaaaaaaaaaaaaaaaaaaaaaaaaaaaaaaaaaaaaaaaaaaaaaaaaaaaaaaaaaaaaaaaaaaaaaaaaaaaaaaaaaaaaaaaaaaaaaaaaaaaaaaaaaaaaaaaaaaaaaaaaaaaaaaaaaaaaaaaaaaaaaaaaaaaaaaaaaaaaaaaaaaaaaaaaaaaaaaaaaaaaaaaaaaaaaaaaaaaaaaaaaaaaaaaaaaaaaaaaaaaaaaaaaaaaaaaaaaaaaaaaaaaaaaaaaaaaaaaaaaaaaaaaaaaaaaaaaaaaaaaaaaaaaaaaaaaaaaaaaaaaaaaaaaaaaaaaaaaaaaaaaaaaaaaaaaaaaaaaaaaaaaaaaaaaaaaaaaaaaaaaaaaaaaaaaaaaaaaaaaaaaaaaaaaaaaaaaaaaaaaaaaaaaaaaaaaaaaaaaaaaaaaaaaaaaaaaaaaaaaaaaaaaaaaaaaaaaaaaaaaaaaaaaaaaaaaaaaaaaaaaaaaaaaaaaaaaaaaaaaaaaaaaaaaaaaaaaaaaaaaaaaaaaaaaaaaaaaaaaaaaaaaaaaaaaaaaaaaaaaaaaaaaaaaaaaaaaaaaaaaaaaaaaaaaaaaaaaaaaaaaaaaaaaaaaaaaaaaaaaaaaaaaaaaaaaaaaaaaaaaaaaaaaaaaaaaa;
ERROR 42000: savepoint does not exist
commit;
drop table if exists sp_test1;
create table sp_test1(a int, b int);
begin;
savepoint sp1;
insert into sp_test1 values(1, 1);
insert into sp_test1 values(2, 2);
rollback to sp1;
select * from sp_test1;
a	b
commit;
drop table if exists sp_test1;
create table sp_test1(a int, b int);
begin;
insert into sp_test1 values(1, 1);
savepoint sp1;
insert into sp_test1 values(2, 2);
savepoint sp1;
insert into sp_test1 values(3, 3);
rollback to sp1;
select * from sp_test1;
a	b
1	1
2	2
commit;
drop table if exists sp_test1;
create table sp_test1(a int, b int);
begin;
insert into sp_test1 values(1, 1);
savepoint sp1;
insert into sp_test1 values(2, 2);
savepoint sp2;
insert into sp_test1 values(3, 3);
savepoint sp3;
insert into sp_test1 values(4, 4);
rollback to sp2;
select * from sp_test1;
a	b
1	1
2	2
rollback to sp3;
ERROR 42000: savepoint does not exist
select * from sp_test1;
a	b
1	1
2	2
commit;
drop table if exists sp_test1;
create table sp_test1(a int, b int);
begin;
release savepoint sp1;
ERROR 42000: savepoint does not exist
insert into sp_test1 values(1, 1);
release savepoint sp2;
ERROR 42000: savepoint does not exist
select * from sp_test1;
a	b
1	1
commit;
drop table if exists sp_test1;
create table sp_test1(a int, b int);
begin;
insert into sp_test1 values(1, 1);
savepoint sp1;
insert into sp_test1 values(2, 2);
rollback to sp1;
insert into sp_test1 values(3, 3);
rollback to sp1;
select * from sp_test1;
a	b
1	1
release savepoint sp1;
insert into sp_test1 values(4, 4);
rollback to sp1;
ERROR 42000: savepoint does not exist
select * from sp_test1;
a	b
1	1
4	4
commit;
drop table if exists sp_test1;
create table sp_test1(a int, b int);
drop table if exists sp_test2;
create table sp_test2(a int, b int);
begin;
insert into sp_test1 values(1, 1);
update sp_test1 set b = 2 where a = 1;
savepoint sp1;
insert into sp_test1 values(2, 2);
select * from sp_test1;
a	b
1	2
2	2
rollback to sp1;
select * from sp_test1;
a	b
1	2
commit;
begin;
insert into sp_test2 values(1, 1);
savepoint sp2;
insert into sp_test2 values(2, 2);
release savepoint sp2;
rollback to sp2;
ERROR 42000: savepoint does not exist
savepoint sp3;
update sp_test2 set b = 2 where a = 1;
select * from sp_test2;
a	b
1	2
2	2
rollback to sp3;
select * from sp_test2;
a	b
1	1
2	2
commit;
begin;
select * from sp_test1;
a	b
1	2
select * from sp_test2;
a	b
1	1
2	2
commit;
drop table if exists sp_test1;
create table sp_test1(a int, b int);
drop table if exists sp_test2;
create table sp_test2(a int, b int);
begin;
insert into sp_test1 values(1, 1);
insert into sp_test2 values(1, 1);
savepoint sp4;
update sp_test1 set b = 2 where a = 1;
update sp_test2 set b = 2 where a = 1;
select * from sp_test1;
a	b
1	2
select * from sp_test2;
a	b
1	2
rollback to sp4;
select * from sp_test1;
a	b
1	1
select * from sp_test2;
a	b
1	1
commit;
begin;
insert into sp_test1 values(1, 1);
insert into sp_test2 values(1, 1);
savepoint sp5;
savepoint sp6;
update sp_test1 set b = 2 where a = 1;
update sp_test2 set b = 2 where a = 1;
select * from sp_test1;
a	b
1	2
1	2
select * from sp_test2;
a	b
1	2
1	2
release savepoint sp5;
rollback to sp5;
ERROR 42000: savepoint does not exist
rollback to sp6;
ERROR 42000: savepoint does not exist
select * from sp_test1;
a	b
1	2
1	2
select * from sp_test2;
a	b
1	2
1	2
commit;
begin;
select * from sp_test1;
a	b
1	2
1	2
select * from sp_test2;
a	b
1	2
1	2
commit;
drop table if exists sp_test1;
create table sp_test1(a int, b int);
drop table if exists sp_test2;
create table sp_test2(a int, b int, primary key(a));
begin;
insert into sp_test1 values(1, 1);
insert into sp_test2 values(1, 1);
savepoint sp7;
update sp_test1 set b = 2 where a = 1;
update sp_test2 set b = 2 where a = 1;
select * from sp_test1;
a	b
1	2
select * from sp_test2;
a	b
1	2
rollback to sp7;
select * from sp_test1;
a	b
1	1
select * from sp_test2;
a	b
1	1
insert into sp_test2 values(1, 1);
ERROR 23000: Duplicate entry '1' for key 'PRIMARY'
select * from sp_test1;
a	b
1	1
select * from sp_test2;
a	b
1	1
commit;
drop table if exists sp_test1;
create table sp_test1(a int, b int);
set autocommit=0;
rollback;
savepoint sp7;
insert into sp_test1 values(1, 1);
savepoint sp8;
insert into sp_test1 values(2, 2);
select * from sp_test1;
a	b
1	1
2	2
rollback to sp8;
select * from sp_test1;
a	b
1	1
rollback to sp7;
select * from sp_test1;
a	b
commit;
rollback to sp7;
ERROR 42000: savepoint does not exist
release savepoint sp8;
ERROR 42000: savepoint does not exist
release savepoint sp7;
ERROR 42000: savepoint does not exist
set autocommit=1;
drop table if exists sp_test1, sp_test2;
