#Environmental cleaning
DROP USER wmj456@'%';
DROP DATABASE obwmjtest;
CREATE DATABASE obwmjtest;
CREATE USER wmj456 IDENTIFIED BY 'wmj456';
GRANT ALL ON *.* TO wmj456 WITH GRANT OPTION;
SET sql_mode = 'ANSI_QUOTES';
DROP TABLE t1;
DROP TABLE t2;
DROP TABLE "t2'";
DROP TABLEGROUP "tgp";
DROP DATABASE `test_ac"`;
DROP DATABASE "test_ac";
DROP USER wmj789@'%';
# ANSI_QUOTES 1-1
# 创建不同格式表名
CREATE TABLE `t1` (`id` int, `consumer` char(20) DEFAULT NULL, `brand` varchar(20) DEFAULT NULL, `sal` int DEFAULT NULL);
INSERT INTO `t1` VALUES(1,'书局','apple',5000);
INSERT INTO `t1` VALUES(2,'微山','xiaomi',-4000);
SELECT * FROM `t1`;
id	consumer	brand	sal
1	书局	apple	5000
2	微山	xiaomi	-4000
DROP TABLE `t1`;
CREATE TABLE "t2" (a int, b char(20), c varchar(20));
INSERT INTO "t2" VALUES (1,'尔康','vivo');
SELECT * FROM "t2" ;
a	b	c
1	尔康	vivo
DROP TABLE "t2";
CREATE TABLE "t2'" (a int, b char(20), c varchar(20));
INSERT INTO "t2'" VALUES (1,'尔康','vivo');
INSERT INTO `t2'` VALUES (2,'微山','oneplus');
SELECT * FROM `t2'` ;
a	b	c
1	尔康	vivo
2	微山	oneplus
DROP TABLE "t2'";
CREATE TABLE "t2'" (a int, b char(20), c varchar(20));
INSERT INTO `t2'` VALUES (1,'微山','oneplus');
SELECT * FROM "t2'" ;
a	b	c
1	微山	oneplus
DROP TABLE `t2'`;
CREATE DATABASE `test_ac"`;
DROP DATABASE `test_ac"`;
CREATE DATABASE "test_ac";
DROP DATABASE "test_ac";
CREATE TABLE `obwmjtest`."t2'" (a int, b char(20), c varchar(20));
INSERT INTO `obwmjtest`."t2'" VALUES (1,'尔康','vivo');
INSERT INTO `obwmjtest`.`t2'` VALUES (2,'微星','oneplus');
SELECT * FROM `obwmjtest`.`t2'` ;
a	b	c
1	尔康	vivo
2	微星	oneplus
DROP TABLE `obwmjtest`."t2'";
CREATE TABLE "obwmjtest"."t2" (a int, b char(20), c varchar(20)) ;
INSERT INTO "obwmjtest"."t2" VALUES (1,'尔康','vivo') ;
INSERT INTO "obwmjtest"."t2" VALUES (2,'微星','oneplus') ;
SELECT * FROM "obwmjtest"."t2" ;
a	b	c
1	尔康	vivo
2	微星	oneplus
DROP TABLE "obwmjtest"."t2" ;
CREATE TABLE `count`(a int, b char(20), c varchar(20)) ;
INSERT INTO `count` VALUES (1,'尔康','vivo') ;
INSERT INTO "count" VALUES (2,'微星','oneplus') ;
SELECT * FROM count ;
a	b	c
1	尔康	vivo
2	微星	oneplus
SELECT * FROM `count` ;
a	b	c
1	尔康	vivo
2	微星	oneplus
SELECT * FROM "count" ;
a	b	c
1	尔康	vivo
2	微星	oneplus
DROP TABLE count ;
# 正常报错
CREATE TABLE `t1` (
`t1_id` int(11) NOT NULL,
`first_name` varchar(50) DEFAULT NULL,
`last_name` varchar(50) DEFAULT NULL,
`sex` varchar(20) DEFAULT NULL
) DEFAULT CHARSET = `utf8` ROW_FORMAT = default COMPRESSION = "snappy_1.0";
CREATE TABLE `t1` (
`t1_id` int(11) NOT NULL,
`first_name` varchar(50) DEFAULT NULL,
`last_name` varchar(50) DEFAULT NULL,
`sex` varchar(20) DEFAULT NULL
) DEFAULT CHARSET = "gb18030" ROW_FORMAT = default COMPRESSION = 'snappy_1.0';
INSERT INTO T1 VALUES (1,'张','三','男');
INSERT INTO T1 VALUES (2,'李','四','男');
SELECT * FROM "T1";
t1_id	first_name	last_name	sex
1	张	三	男
2	李	四	男
DROP TABLE "T1";
# ANSI_QUOTES 1-2
# 创建不同格式列名
# tab.col
CREATE TABLE t1(`a` int, `b` char(20), `c` varchar(20)) ;
INSERT INTO `t1`("a",`b`) VALUES (1,'尔康') ;
INSERT INTO "t1"(`b`,"c") VALUES (2,'微星') ;
SELECT * FROM "t1" ;
a	b	c
1	尔康	NULL
NULL	2	微星
SELECT * FROM `t1` ;
a	b	c
1	尔康	NULL
NULL	2	微星
DROP TABLE "t1" ;
# select db.tab.col - 1
CREATE TABLE t1(`a` int, `b` char(20), `c` varchar(20)) ;
INSERT INTO `t1`(t1."a",`b`) VALUES (1,'尔康') ;
INSERT INTO `t1`(t1."a","t1".`b`) VALUES (1,'微星') ;
SELECT `t1`.`a`, `t1`."a", "t1"."b", "t1".`b` FROM "t1" ;
a	a	b	b
1	1	尔康	尔康
1	1	微星	微星
SELECT `obwmjtest`.`t1`.`a`, `obwmjtest`.`t1`."a" FROM `t1`;
a	a
1	1
1	1
SELECT "obwmjtest"."t1"."b", "obwmjtest"."t1".`b` FROM "t1" ;
b	b
尔康	尔康
微星	微星
SELECT "obwmjtest".t1."b" FROM `t1` ;
b
尔康
微星
DROP TABLE `obwmjtest`.t1;
# create db.tab.col - 2
CREATE TABLE t1(`a` int, `b` char(20), `c` varchar(20)) ;
INSERT INTO `t1`(`obwmjtest`.t1."a", "obwmjtest"."t1".`b`) VALUES (1,'尔康') ;
INSERT INTO `t1`("obwmjtest".`t1`."a", `obwmjtest`."t1".`b`) VALUES (1,'微星') ;
SELECT `t1`.`a`, `t1`."a", "t1"."b", "t1".`b` FROM "t1" ;
a	a	b	b
1	1	尔康	尔康
1	1	微星	微星
DROP TABLE `obwmjtest`.t1;
# create tab - 3
CREATE TABLE "t1" (  
"id" BIGINT UNSIGNED  PRIMARY KEY AUTO_INCREMENT,  
"brand" VARCHAR(255) NOT NULL,  
`color` ENUM('RED','GREEN','BLUE')
);
INSERT INTO "t1" VALUES(1, 'vivo', 'RED');
ALTER TABLE "t1" MODIFY COLUMN "color" set ('ddd') ;
ALTER TABLE "t1" MODIFY COLUMN "color" set ('aaa','ddd','eee') ;
INSERT INTO t1 VALUES(2,  'OPPO', 'aaa,ddd,eee');
ALTER TABLE "T1" ADD COLUMN COM varchar(255) not null;
UPDATE "T1" SET "BRAND"='APPLE' WHERE "ID"=2;
DROP TABLE T1;
CREATE TABLE t1 (a INT, b SET('abc', '中国人民'));
INSERT INTO t1 VALUES(1,  'abc');
INSERT INTO t1 VALUES(2,  '中国人民');
INSERT INTO t1 VALUES(3,  'abc,中国人民');
ALTER TABLE "t1" MODIFY COLUMN "b" set ('ddd') ;
ALTER TABLE "t1" MODIFY COLUMN "b" set ('aaa','ddd','eee') ;
UPDATE "T1" SET "b"='abc' WHERE "a"=2;
DROP TABLE T1;
# 列名同函数名
CREATE TABLE t1(count int, `b` char(20), `c` varchar(20)) ;
INSERT INTO `t1`(t1."COUNT",`b`) VALUES (1,'尔康') ;
INSERT INTO "t1"(`COUNT`,"c") VALUES (2,'微星') ;
SELECT COUNT FROM T1;
COUNT
1
2
SELECT `COUNT` FROM T1;
COUNT
1
2
SELECT "COUNT" FROM T1;
COUNT
1
2
DROP TABLE T1;
# ANSI_QUOTES 1-3
# 修改约束名
CREATE TABLE t1(a int, b char(20), c varchar(20)) ;
INSERT INTO "t1" VALUES (1,'尔康','vivo');
ALTER TABLE `t1` ADD CONSTRAINT `aa_aa` UNIQUE KEY (`a`);
ALTER TABLE "t1" ADD CONSTRAINT "bb_bb" PRIMARY KEY ("b");
SELECT * FROM T1;
a	b	c
1	尔康	vivo
DROP TABLE T1;
# 修改约束名
CREATE TABLE t1(a int, b char(20), c varchar(20)) ;
INSERT INTO "t1" VALUES (1,'尔康','vivo');
ALTER TABLE `t1` ADD CONSTRAINT `aa_aa` UNIQUE KEY (`a`);
ALTER TABLE "t1" RENAME INDEX "aa_aa" TO `aa_a2`;
ALTER TABLE "t1" RENAME INDEX `aa_a2` TO "aa_a3";
ALTER TABLE "t1" RENAME INDEX "aa_a3" TO "aa_a4";
ALTER TABLE `t1` DROP KEY "aa_a4";
SELECT * FROM T1;
a	b	c
1	尔康	vivo
DROP TABLE T1;
# 修改约束名
CREATE TABLE t1(a int, b char(20), c varchar(20)) ;
INSERT INTO "t1" VALUES (1,'尔康','vivo');
ALTER TABLE "t1" ADD COLUMN `d` varchar(25) not null;
ALTER TABLE `t1` ADD COLUMN "e" varchar(25) not null;
ALTER TABLE "t1" ADD COLUMN "f" varchar(25) not null AFTER "d";
ALTER TABLE "t1" MODIFY COLUMN "f" varchar(25) NOT NULL ;
SELECT * FROM T1;
a	b	c	d	f	e
1	尔康	vivo			
DROP TABLE T1;
# 修改相同约束名，正常报错
CREATE TABLE t1(a int, b char(20), c varchar(20)) ;
INSERT INTO "t1" VALUES (1,'尔康','vivo');
ALTER TABLE `t1` ADD CONSTRAINT `aa_aa` UNIQUE KEY (`b`);
ALTER TABLE `t1` ADD CONSTRAINT "aa_aa" UNIQUE KEY ("a");
ALTER TABLE `t1` ADD CONSTRAINT "aa_aa" UNIQUE KEY (`a`);
ALTER TABLE `t1` ADD CONSTRAINT `aa_aa` UNIQUE KEY ("a");
DROP TABLE T1;
# ANSI_QUOTES 1-4
# 表组名
CREATE tablegroup "tgp";
CREATE TABLE t1 (a int, b varchar(20)) tablegroup "tgp";
INSERT INTO t1 VALUES(1, "张三");
INSERT INTO t1 VALUES(2, '李四');
INSERT INTO t1 VALUES(3, '王五');
DROP TABLE t1;
DROP TABLEGROUP "tgp";
CREATE tablegroup "tgp" PARTITION BY hash partitions 2 ;
Warnings:
Warning	1235	create tablegroup with partition not supported
CREATE TABLE T1(
t1_id INT NOT NULL,
first_name VARCHAR(50),
last_name VARCHAR(50),
sex VARCHAR(20)
) tablegroup "tgp" partition by hash (ABS(t1_id))
(
partition part_1,
partition part_2
);
INSERT INTO T1 VALUES (1,'张','三','男');
INSERT INTO T1 VALUES (2,'李','四',"男");
INSERT INTO T1 VALUES (3,'ve2l2i22t','id','女');
INSERT INTO T1 VALUES (4,'dolor','ut','男');
DROP TABLE t1;
DROP TABLEGROUP "tgp";
CREATE tablegroup `tgp` PARTITION BY hash partitions 2 ;
Warnings:
Warning	1235	create tablegroup with partition not supported
CREATE TABLE T1(
`t1_id` INT NOT NULL,
"first_name" VARCHAR(50),
`last_name` VARCHAR(50),
sex VARCHAR(20)
) tablegroup `tgp` partition by hash (ABS("t1_id"))
(
partition part_1,
partition part_2
);
INSERT INTO T1 VALUES (1,'张','三','男');
INSERT INTO T1 VALUES (2,'李','四',"男");
INSERT INTO T1 VALUES (3,'ve2l2i22t','id','女');
SELECT * FROM T1 PARTITION ("part_2");
t1_id	first_name	last_name	sex
1	张	三	男
3	ve2l2i22t	id	女
SELECT * FROM "T1" PARTITION ("part_2");
t1_id	first_name	last_name	sex
1	张	三	男
3	ve2l2i22t	id	女
SELECT * FROM `T1` PARTITION (`part_2`);
t1_id	first_name	last_name	sex
1	张	三	男
3	ve2l2i22t	id	女
DROP TABLE t1;
DROP TABLEGROUP "tgp";
CREATE tablegroup `tgp` PARTITION BY hash partitions 2 ;
Warnings:
Warning	1235	create tablegroup with partition not supported
CREATE TABLE T1(
`t1_id` INT NOT NULL,
"first_name" VARCHAR(50),
`last_name` VARCHAR(50),
sex VARCHAR(20)
) tablegroup `tgp` partition by hash (ABS("t1_id"))
(
partition "part_1",
partition `part_2`
);
INSERT INTO T1 VALUES (1,'张','三','男');
INSERT INTO T1 VALUES (2,'李','四','男');
SELECT * FROM T1 PARTITION ("part_2");
t1_id	first_name	last_name	sex
1	张	三	男
SELECT * FROM "T1" PARTITION ("part_1");
t1_id	first_name	last_name	sex
2	李	四	男
SELECT * FROM `T1` PARTITION (`part_2`);
t1_id	first_name	last_name	sex
1	张	三	男
DROP TABLE t1;
DROP TABLEGROUP "tgp";
SET @v1 = b'1000001';
SET @v2 = b'1000001'+0;
SET @v3 = CAST(b'1000001' AS UNSIGNED);
SELECT @"v1", @"v2", @"v3";
@"v1"	@"v2"	@"v3"
A	65	65
# ANSI_QUOTES 1-5
# 分区表，正常报错
CREATE TABLE T1(
a bigint,
b varchar(30),
c timestamp
)PARTITION BY RANGE(a)
(
PARTITION id_part1 values less than (3),
PARTITION id_part2 values less than (8),
PARTITION id_part3 values less than (MAXVALUE)
);
INSERT INTO t1 VALUES ("1", CAST(makedate(2012,10) AS UNSIGNED INTEGER), '2013-05-22 18:32:37.000');
INSERT INTO t1 VALUES (2, "null" , '1992-01-02 23:51:32.000');
INSERT INTO t1 VALUES (3, null , "1992-01-02 23:51:32.000");
DROP TABLE t1;
# 分区表，正常报错
CREATE TABLE T1(
a bigint,
b varchar(30),
c timestamp
)PARTITION BY RANGE("a")
(
PARTITION "id_part1" values less than ("3"),
PARTITION id_part2 values less than ('8'),
PARTITION id_part3 values less than (MAXVALUE)
);
# 分区表，正常插入数据
CREATE TABLE T1(
a bigint,
b varchar(30),
c timestamp
)PARTITION BY RANGE("a")
(
PARTITION "id_part1" values less than (3),
PARTITION id_part2 values less than (8),
PARTITION id_part3 values less than (MAXVALUE)
);
INSERT INTO t1 VALUES (1, date(makedate('1980',10)), '1980-12-03 01:08:01.000');
SELECT * FROM T1;
a	b	c
1	1980-01-10	1980-12-03 01:08:01
DROP TABLE t1;
# 分区表，正常报错
CREATE TABLE "T1"(
"a" bigint,
`b` datetime
)partition by range columns("b") subpartition by hash("a") subpartitions 2
( 
partition "part_1" values less than ('2016-09-01'),
partition `part_2` values less than ("2020-09-01"),
partition "part_3" values less than ('2021-09-01')
);
# 分区表，函数不支持 "
CREATE TABLE "T1"(
"a" bigint,
`b` datetime
)partition by range columns("b") subpartition by hash("a") subpartitions 2
( 
partition "part_1" values less than ('2016-09-01'),
partition `part_2` values less than ('2020-09-01'),
partition "part_3" values less than ('2021-09-01')
);
INSERT INTO t1 VALUES(LENGTH(makedate("1995",10)),'1995-12-02 22:30:27');
DROP TABLE t1;
# ANSI_QUOTES 1-6
# 外键表
CREATE TABLE t1 (a int unique, b varchar(20), c int);
CREATE TABLE t2 (ID INT NOT NULL,NAME VARCHAR(20), AGE INT);
ALTER TABLE `t2` ADD CONSTRAINT "fk_user_id" FOREIGN KEY ("id") REFERENCES t1("a");
INSERT INTO t1 VALUES(1, '张三', 2);
INSERT INTO t2 VALUES (1,'T2B',20);
INSERT INTO t1 VALUES(2, "李四", 1);
ALTER TABLE t2 DROP FOREIGN KEY "fk_user_id";
DROP TABLE T2;
DROP TABLE T1;
CREATE TABLE t2 ("ID" INT UNIQUE NOT NULL, "NAME" VARCHAR(20), "AGE" INT);
ALTER TABLE t2 ADD FOREIGN KEY ("AGE") REFERENCES t2("ID") ;
INSERT INTO t2 VALUES (1,'T2B',null);
INSERT INTO t2 VALUES (2,'T2C',1);
INSERT INTO t2 VALUES (3,"T2D",2);
DROP TABLE T2;
# ANSI_QUOTES 1-7
# 别名
CREATE TABLE t1 (a int unique, b varchar(20), c int comment 'xxxx');
DROP TABLE T1;
CREATE TABLE "t1" (a INT, "b" VARCHAR(50)) comment='xxxx' ;
SELECT * FROM .t1;
a	b
DROP TABLE T1;
CREATE TABLE t2 ("ID" INT UNIQUE NOT NULL, "NAME" VARCHAR(20), "AGE" INT);
INSERT INTO t2 VALUES (1,'T2B',null);
INSERT INTO t2 VALUES (2,'T2C',1);
SELECT ID AS "T2_ID", NAME AS `T2_NAME` FROM T2;
T2_ID	T2_NAME
1	T2B
2	T2C
SELECT ID AS "T2_ID", NAME AS `T2_NAME` FROM "T2";
T2_ID	T2_NAME
1	T2B
2	T2C
SELECT ID AS "T2_ID", NAME AS `T2_NAME` FROM `T2`;
T2_ID	T2_NAME
1	T2B
2	T2C
SELECT "TT2".ID AS "T2_ID", "T_T2".NAME AS `T2_NAME` FROM `T2` AS "TT2" LEFT JOIN "T2" AS "T_T2" ON "TT2".`ID`="T_T2"."AGE";
T2_ID	T2_NAME
1	T2C
2	NULL
DROP TABLE T2;
# ANSI_QUOTES 1-8
# 用户名
CREATE USER `wmj789` IDENTIFIED BY 'wmj789';
DROP USER "wmj789"@"%" ;
CREATE USER "wmj789" IDENTIFIED BY 'wmj789';
DROP USER `wmj789`@'%' ;
CREATE USER "wmj789" IDENTIFIED BY 'wmj789';
DROP USER "wmj789"@'%' ;
CREATE USER "wmj789" IDENTIFIED BY 'wmj789';
DROP USER "wmj789"@`%` ;
# ANSI_QUOTES 1-9
# 索引名
CREATE TABLE T1(
t1_id INT NOT NULL,
first_name VARCHAR(50),
last_name VARCHAR(50),
sex VARCHAR(20)
);
INSERT INTO T1 VALUES (1,'张','三','男');
INSERT INTO T1 VALUES (2,'李','四','男');
CREATE INDEX "T1_t_01" ON "obwmjtest"."T1"("t1_id",`sex`);
DROP INDEX "T1_t_01" ON T1;
CREATE INDEX "T1_t_01" ON `obwmjtest`."t1"("t1_id","sex");
DROP INDEX "T1_t_01" ON "obwmjtest"."T1";
DROP TABLE "T1";
# PRIMARY KEY
CREATE TABLE T1(
t1_id INT NOT NULL,
first_name VARCHAR(50),
last_name VARCHAR(50),
sex VARCHAR(20)
);
INSERT INTO T1 VALUES (1,'张','三','男');
INSERT INTO T1 VALUES (2,'李','四','男');
ALTER TABLE T1 ADD PRIMARY KEY ( "t1_id" );
DROP TABLE "T1";
UNIQUE KEY
CREATE TABLE T1(
t1_id INT NOT NULL,
first_name VARCHAR(50),
last_name VARCHAR(50),
sex VARCHAR(20)
);
INSERT INTO T1 VALUES (1,'张','三','男');
INSERT INTO T1 VALUES (2,'李','四','男');
CREATE UNIQUE INDEX "IDX_T1" ON T1("t1_id");
DROP INDEX "IDX_T1" ON `obwmjtest`."T1";
DROP TABLE "T1";
# ANSI_QUOTES 1-10
# 视图
CREATE TABLE t2 ("ID" INT UNIQUE NOT NULL, "NAME" VARCHAR(20), "AGE" INT);
INSERT INTO t2 VALUES (1,'T2B',18);
INSERT INTO t2 VALUES (2,'T2C',20);
CREATE VIEW "T2_VIEW" AS SELECT * FROM "T2";
SELECT "ID" FROM "T2_VIEW" WHERE "T2_VIEW"."NAME" = 'T2C';
ID
2
SELECT "ID" FROM "T2_VIEW" WHERE "T2_VIEW"."NAME" = "T2C";
DROP TABLE T2;
DROP VIEW T2_VIEW;
# 其他场景
CREATE TABLE t1(a int, b char(20), c varchar(20)) ;
INSERT INTO "t1" VALUES (1,'尔康','vivo');
DESC "t1";
Field	Type	Null	Key	Default	Extra
a	int(11)	YES		NULL	
b	char(20)	YES		NULL	
c	varchar(20)	YES		NULL	
DESC `t1`;
Field	Type	Null	Key	Default	Extra
a	int(11)	YES		NULL	
b	char(20)	YES		NULL	
c	varchar(20)	YES		NULL	
DESC `obwmjtest`."t1";
Field	Type	Null	Key	Default	Extra
a	int(11)	YES		NULL	
b	char(20)	YES		NULL	
c	varchar(20)	YES		NULL	
DESC "obwmjtest"."t1";
Field	Type	Null	Key	Default	Extra
a	int(11)	YES		NULL	
b	char(20)	YES		NULL	
c	varchar(20)	YES		NULL	
# 对字符串使用双引号，不支持
CREATE TABLE "obwmjtest"."t2" (a int, b char(20), c varchar(20));
INSERT INTO "t2" VALUES (1,"尔康",'vivo');
DROP TABLE "obwmjtest"."t2";
# 设置其他模式，SET 未生效
SET sql_mode = "NO_BACKSLASH_ESCAPES";
SET sql_mode = 'ANSI_QUOTES';
SET sql_mode = 'NO_BACKSLASH_ESCAPES';
SET sql_mode = 'ANSI_QUOTES';
SET sql_mode = `NO_BACKSLASH_ESCAPES`;
SET sql_mode = 'ANSI_QUOTES';
SELECT @@SQL_MODE;
@@SQL_MODE
ANSI_QUOTES
# Clean up users
DROP DATABASE  obwmjtest;
DROP USER wmj456@'%' ;
