#Environmental cleaning
DROP USER wmj456@'%';
DROP DATABASE obwmjtest;
CREATE DATABASE obwmjtest;
CREATE USER wmj456 IDENTIFIED BY 'wmj456';
GRANT ALL ON *.* TO wmj456 WITH GRANT OPTION;
SET sql_mode = 'NO_BACKSLASH_ESCAPES';
DROP TABLE t1;
DROP TABLE t2;
DROP FUNCTION f_test;
DROP PROCEDURE p_test;
# NO_BACKSLASH-4
CREATE TABLE t1 (
id int NOT NULL,
consumer char(20) DEFAULT NULL,
price varchar(20) DEFAULT NULL,
sal int DEFAULT NULL,
`datetime1` DATE,
`datetime2` bigint
);
INSERT INTO t1 VALUES(1,'书局','7000',5000,'2020-09-22',20200923121200);
INSERT INTO t1 VALUES(2,'微山','3000',-4000,'2020-09-21',20200921101159);
INSERT INTO t1 VALUES(3,'深咖','5000',0,'2020-08-21',20190821101159);
INSERT INTO t1 VALUES(4,'流苏','0',NULL,'2020-02-29',20200228101159);
INSERT INTO t1 VALUES(5,'玻璃','3200',6000,'2020-02-29',20200228101159);
INSERT INTO t1 VALUES(6,'\n',NULL,8000,'2020-02-29',20200228101159);
INSERT INTO t1 VALUES(7,'\t','VIVO',3500,'2020-02-29',20200228101159);
# 定义一个无参的函数
CREATE FUNCTION f_test()
returns varchar(200)
begin
declare a varchar(200);
SELECT sign('\t') FROM t1 as e WHERE sign(sal)=0 INTO a;
return a;
END;
//
SELECT f_test();
f_test()
0
Warnings:
Warning	1292	Truncated incorrect DOUBLE value: '\t'
DROP FUNCTION f_test;
CREATE FUNCTION f_test()
returns varchar(200)
begin
declare a varchar(200);
SELECT CONCAT('\N\n\t','\0','\\') FROM DUAL INTO a;
return a;
END;
//
SELECT f_test();
f_test()
\N\n\t\0\\
DROP FUNCTION f_test;
# 定义一个有参的函数
CREATE FUNCTION f_test(samplename varchar(200))
returns varchar(200)
begin
declare a varchar(200);
SELECT CONCAT(samplename) FROM DUAL INTO a;
return a;
END;
//
SELECT f_test('\n');
f_test('\n')
\n
SELECT f_test('\t\n');
f_test('\t\n')
\t\n
DROP FUNCTION f_test;
# 定义函数用while循环
CREATE FUNCTION f_test(samplename varchar(200), samplename1 varchar(200))
returns varchar(200)
begin
declare a varchar(200);
declare b varchar(200);
declare i int default 0;
SELECT sign(sal) FROM t1 e WHERE sign(e.sal) = samplename into a;
SELECT sign(sal) FROM t1 e WHERE sign(e.sal) = samplename1 into b;
WHILE i <= 1 do
INSERT INTO t1 VALUES(0,a,'\n',7000,'2020-12-31 10:11:59',20190821101159);
INSERT INTO t1 VALUES(0,b,'\t',90000,'2020-12-30 10:11:59',20200228101159);
set i := i + 1;
END WHILE;
return a+b;
END;
//
SELECT f_test(0,-1) FROM dual;
f_test(0,-1)
-1
SELECT f_test(0,-1) FROM dual;
f_test(0,-1)
-1
DELETE FROM t1 WHERE price LIKE '\t' escape ' ';
DELETE FROM t1 WHERE price LIKE '\n' escape ' ';
DROP FUNCTION f_test;
# REPEAT 循环
CREATE  FUNCTION f_test(samplename varchar(200),samplename1 varchar(200))
returns  varchar(200)
BEGIN
declare a varchar(200);
declare b varchar(200);
declare i int default 0;
SELECT sign(sal) FROM t1 e WHERE sign(e.sal) = samplename into a;
SELECT sign(sal) FROM t1 e WHERE sign(e.sal) = samplename1 into b;
REPEAT
INSERT INTO t1 VALUES(0,a,'repeat插入\n数据',7000,'2020-08-21 10:11:59',20190821101159);
INSERT INTO t1 VALUES(0,b,'repeat插入\t数据',90000,'2020-02-29 10:11:59',20200228101159);
set i := i + 1;
until i  >= 1
END REPEAT;
return a+b;
END;
//
SELECT COUNT(*) FROM t1;
COUNT(*)
7
SELECT f_test(0,-1) FROM dual;
f_test(0,-1)
-1
SELECT COUNT(*) FROM t1;
COUNT(*)
9
DELETE FROM t1 WHERE price LIKE '%插入%';
DROP FUNCTION f_test;
# loop 标签
CREATE FUNCTION f_test(samplename varchar(200),samplename1 varchar(200))
returns varchar(200)
BEGIN
declare a varchar(200);
declare b varchar(200);
declare i int default 0;
SELECT sign(sal) FROM t1 e WHERE sign(e.sal) = samplename into a;
SELECT sign(sal) FROM t1 e WHERE sign(e.sal) = samplename1 into b;
lp1:loop
set i := i + 1;
INSERT INTO t1 VALUES(0,a,'\n',7000,'2020-08-21 10:11:59',20190821101159);
INSERT INTO t1 VALUES(0,b,'\t',90000,'2020-02-29 10:11:59',20200228101159);
if i > 1 then leave lp1;
end if;
end Loop lp1;
return a+b;
END;
//
SELECT COUNT(*) FROM t1;
COUNT(*)
7
SELECT f_test(0,-1) FROM dual;
f_test(0,-1)
-1
SELECT COUNT(*) FROM t1;
COUNT(*)
11
DELETE FROM t1 WHERE price IN ('\n','\t');
DROP FUNCTION f_test;
# 存储过程
CREATE PROCEDURE p_test()
begin
declare a varchar(200);
declare b varchar(200);
declare i int default 0;
SELECT sign(sal) FROM t1 e WHERE sign(e.sal) = 0 into a;
SELECT sign(sal) FROM t1 e WHERE sign(e.sal) = -1 into b;
WHILE i <= 1 do
INSERT INTO t1 VALUES(0,a,concat('\n',i,'次'),7000,'2020-08-21 10:11:59',20190821101159);
INSERT INTO t1 VALUES(0,b,concat('\t',i,'次'),90000,'2020-02-29 10:11:59',20200228101159);
set i := i + 1;
END while;
END;
//
SELECT COUNT(*) FROM t1;
COUNT(*)
7
CALL p_test();
SELECT COUNT(*) FROM t1;
COUNT(*)
11
SELECT * FROM t1;
id	consumer	price	sal	datetime1	datetime2
1	书局	7000	5000	2020-09-22	20200923121200
2	微山	3000	-4000	2020-09-21	20200921101159
3	深咖	5000	0	2020-08-21	20190821101159
4	流苏	0	NULL	2020-02-29	20200228101159
5	玻璃	3200	6000	2020-02-29	20200228101159
6	\n	NULL	8000	2020-02-29	20200228101159
7	\t	VIVO	3500	2020-02-29	20200228101159
0	0	\n0次	7000	2020-08-21	20190821101159
0	-1	\t0次	90000	2020-02-29	20200228101159
0	0	\n1次	7000	2020-08-21	20190821101159
0	-1	\t1次	90000	2020-02-29	20200228101159
DELETE FROM t1 WHERE price LIKE '\t%' escape ' ';
DELETE FROM t1 WHERE price LIKE '\n%' escape ' ';
DROP PROCEDURE p_test;
# Clean up users
DROP DATABASE  obwmjtest;
DROP USER wmj456@'%' ;
