#Environmental cleaning
DROP USER wmj456@'%';
DROP DATABASE obwmjtest;
CREATE DATABASE obwmjtest;
CREATE USER wmj456 IDENTIFIED BY 'wmj456';
GRANT ALL ON *.* TO wmj456 WITH GRANT OPTION;
SET sql_mode = 'NO_BACKSLASH_ESCAPES';
DROP TABLE t1;
DROP TABLE t2;
DROP TABLE `t\n1\t`;
DROP TABLE `t1\n2_3`;
DROP VIEW T1_VIEW;
DROP DATABASE `ob\nwb_test`;
# NO_BACKSLASH-1-1
# 普通表
CREATE TABLE t1 (A INT, B VARCHAR(50));
INSERT INTO t1 VALUES(1,  'abc\def');
INSERT INTO t1 VALUES(2,  '中国\人民');
INSERT INTO t1 VALUES(3,  'hig\多多');
INSERT INTO t1 VALUES(4,  'klm \ \ ');
INSERT INTO t1 VALUES(5,  'xiaofeng\n\t');
INSERT INTO t1 VALUES(6,  '\0');
INSERT INTO t1 VALUES(7,  '\x32');
INSERT INTO t1 VALUES(8,  '$$\#_#\ ');
INSERT INTO t1 VALUES(9,  ' \\ \\ 济公');
INSERT INTO t1 VALUES(10, ' \v ');
INSERT INTO t1 VALUES(11, ' \\" ');
INSERT INTO t1 VALUES(12, '\332');
INSERT INTO t1 VALUES(13, '\t');
INSERT INTO t1 VALUES(14, '\r\f');
INSERT INTO t1 VALUES(15, ' \b ');
INSERT INTO t1 VALUES(16, ' \\b ');
SELECT * FROM T1;
A	B
1	abc\def
2	中国\人民
3	hig\多多
4	klm \ \ 
5	xiaofeng\n\t
6	\0
7	\x32
8	$$\#_#\ 
9	 \\ \\ 济公
10	 \v 
11	 \\" 
12	\332
13	\t
14	\r\f
15	 \b 
16	 \\b 
DROP TABLE t1;
# 普通表
CREATE TABLE t1 (A INT, B VARCHAR(50));
INSERT INTO t1(b) VALUES('abc\def');
INSERT INTO t1(b) VALUES('中国\人民');
INSERT INTO t1(b) VALUES('hig\多多');
INSERT INTO t1(b) VALUES('klm \ \ ');
INSERT INTO t1(b) VALUES('xiaofeng\n\t');
INSERT INTO t1(b) VALUES('\0');
INSERT INTO t1(b) VALUES('\x32');
INSERT INTO t1(b) VALUES('$$\#_#\ ');
INSERT INTO t1(b) VALUES(' \\ \\ 济公');
INSERT INTO t1(b) VALUES(' \v ');
INSERT INTO t1(b) VALUES(' \\" ');
INSERT INTO t1(b) VALUES('\332');
INSERT INTO t1(b) VALUES('\t');
INSERT INTO t1(b) VALUES('\r\f');
INSERT INTO t1(b) VALUES(' \b ');
INSERT INTO t1(b) VALUES(' \\b ');
SELECT * FROM T1;
A	B
NULL	abc\def
NULL	中国\人民
NULL	hig\多多
NULL	klm \ \ 
NULL	xiaofeng\n\t
NULL	\0
NULL	\x32
NULL	$$\#_#\ 
NULL	 \\ \\ 济公
NULL	 \v 
NULL	 \\" 
NULL	\332
NULL	\t
NULL	\r\f
NULL	 \b 
NULL	 \\b 
DROP TABLE t1;
# 普通表
CREATE TABLE t2 (A INT, B VARCHAR(50));
INSERT INTO t2 VALUES(1,  'abc\def');
INSERT INTO t2 VALUES(2,  '中国\人民');
INSERT INTO t2 VALUES(3,  'hig\多多');
INSERT INTO t2 VALUES(4,  'klm \ \ ');
CREATE TABLE t1 (A INT, B VARCHAR(50));
INSERT INTO t1 SELECT * FROM t2 ;
SELECT * FROM T1;
A	B
1	abc\def
2	中国\人民
3	hig\多多
4	klm \ \ 
DROP TABLE t1;
DROP TABLE t2;
# 普通表
# bug: 36538654
CREATE TABLE t1 (a INT, b ENUM('abc\def', '中国\人民', '\n', 'klm \ \ ', '\0'));
INSERT INTO t1 VALUES(1,  'abc\def');
INSERT INTO t1 VALUES(2,  '中国\人民');
INSERT INTO t1 VALUES(3,  '\n');
INSERT INTO t1 VALUES(4,  'klm \ \ ');
INSERT INTO t1 VALUES(5,  '\0');
SELECT * FROM T1;
a	b
1	abc\def
2	中国\人民
3	\n
4	klm \ \
5	\0
DROP TABLE T1;
# 普通表
CREATE TABLE t1 (a INT, b SET('abc\def', '中国\人民', '\n', 'klm \ \ ', '\0'));
INSERT INTO t1 VALUES(1,  'abc\def');
INSERT INTO t1 VALUES(2,  '中国\人民');
INSERT INTO t1 VALUES(3,  '\n,klm \ \,中国\人民');
INSERT INTO t1 VALUES(4,  'abc\def,klm \ \ ');
INSERT INTO t1 VALUES(5,  '\0');
INSERT INTO t1 VALUES(6,  '中国\人民 \0 \n');
SELECT * FROM T1;
a	b
1	abc\def
2	中国\人民
3	中国\人民,\n,klm \ \
4	abc\def,klm \ \
5	\0
6	
DROP TABLE T1;
# LIST 分区
CREATE TABLE t1(a INT , b VARCHAR(50)) PARTITION BY LIST columns(b)(
PARTITION p0 VALUES IN ('abc\def','中国\人民'),
PARTITION p1 VALUES IN ('hig\多多','klm \ \ '),
PARTITION p2 VALUES IN ('xiaofeng\n\t','\0')
);
INSERT INTO t1 VALUES(1,  'abc\def');
INSERT INTO t1 VALUES(2,  '中国\人民');
INSERT INTO t1 VALUES(3,  'hig\多多');
INSERT INTO t1 VALUES(4,  'klm \ \ ');
INSERT INTO t1 VALUES(5,  'xiaofeng\n\t');
INSERT INTO t1 VALUES(6,  '\0');
SELECT * FROM T1;
a	b
1	abc\def
2	中国\人民
3	hig\多多
4	klm \ \ 
5	xiaofeng\n\t
6	\0
DROP TABLE t1;
# KEY 分区
CREATE TABLE t1(
a INT , 
b VARCHAR(50) UNIQUE KEY NOT NULL
) PARTITION BY KEY(B) PARTITIONS 5;
INSERT INTO t1 VALUES(1,  'abc\def');
INSERT INTO t1 VALUES(2,  '中国\人民');
INSERT INTO t1 VALUES(3,  'hig\多多');
INSERT INTO t1 VALUES(4,  'klm \ \ ');
INSERT INTO t1 VALUES(5,  'xiaofeng\n\t');
INSERT INTO t1 VALUES(6,  '\0');
SELECT * FROM T1;
a	b
1	abc\def
2	中国\人民
3	hig\多多
4	klm \ \ 
5	xiaofeng\n\t
6	\0
DROP TABLE t1;
# LIST-KEY 分区
CREATE TABLE t1(
a INT , 
b VARCHAR(50) PRIMARY KEY
) PARTITION BY LIST columns(b) SUBPARTITION BY KEY(B) SUBPARTITIONS 2(
PARTITION p0 VALUES IN ('abc\def','中国\人民'),
PARTITION p1 VALUES IN ('hig\多多','klm \ \ '),
PARTITION p2 VALUES IN ('xiaofeng\n\t','\0')
);
INSERT INTO t1 VALUES(1,  'abc\def');
INSERT INTO t1 VALUES(2,  '中国\人民');
INSERT INTO t1 VALUES(3,  'hig\多多');
INSERT INTO t1 VALUES(4,  'klm \ \ ');
INSERT INTO t1 VALUES(5,  'xiaofeng\n\t');
INSERT INTO t1 VALUES(6,  '\0');
SELECT * FROM T1;
a	b
2	中国\人民
1	abc\def
3	hig\多多
4	klm \ \ 
5	xiaofeng\n\t
6	\0
DROP TABLE t1;
# duplicate key 
# bug: 36538912
CREATE TABLE t1 (A INT, B VARCHAR(50) UNIQUE);
INSERT INTO t1 VALUES(1,  'abc\def');
INSERT INTO t1 VALUES(2,  '中国\人民');
INSERT INTO t1 VALUES(3,  'hig\多多');
INSERT INTO t1 VALUES(4,  'klm \ \ ');
INSERT INTO t1 VALUES(5,  'abc\def') ON DUPLICATE KEY UPDATE B=CONCAT(B,'\n');
INSERT INTO t1 VALUES(6,  'abc\def') ON DUPLICATE KEY UPDATE B=CONCAT('\n','\t');
INSERT INTO t1 VALUES(7,  'abc\def') ON DUPLICATE KEY UPDATE B=CONCAT('\n','\t');
SELECT * FROM t1;
A	B
1	abc\def\n
2	中国\人民
3	hig\多多
4	klm \ \ 
6	\n\t
DROP TABLE t1;
# 视图
CREATE TABLE t1 (A INT, B VARCHAR(50));
INSERT INTO t1 VALUES(1,  'abc\def');
INSERT INTO t1 VALUES(2,  '中国\人民');
INSERT INTO t1 VALUES(3,  '\n,klm \ \,中国\人民');
INSERT INTO t1 VALUES(4,  'abc\def,klm \ \ ');
INSERT INTO t1 VALUES(5,  '\0');
INSERT INTO t1 VALUES(6,  '中国\人民 \0 \n');
CREATE VIEW t1_view AS SELECT *  FROM t1;
INSERT INTO t1_view VALUES (7, '\t');
INSERT INTO t1_view VALUES (8, '\n');
UPDATE t1_view SET B = '\n\t' WHERE A=7;
UPDATE t1_view SET B = '\n\n' WHERE A=8;
SELECT * FROM t1_view;
A	B
1	abc\def
2	中国\人民
3	\n,klm \ \,中国\人民
4	abc\def,klm \ \ 
5	\0
6	中国\人民 \0 \n
7	\n\t
8	\n\n
DROP TABLE t1;
DROP VIEW  t1_view;
# 需要用到本地文件, 注释用例
# SQLMODE-2
# 创建数据库
CREATE DATABASE `ob\nwb_test`;
USE `ob\nwb_test`;
USE `obwb_test`;
USE `obwmjtest`;
DROP DATABASE `ob\nwb_test`;
# 创建普通表
CREATE TABLE `t1\n2_3` (A INT, B VARCHAR(50));
INSERT INTO `t1\n2_3` VALUES(1,  'abc\def');
INSERT INTO `t1\n2_3` VALUES(2,  '中国\人民');
INSERT INTO `t1\n2_3` VALUES(3,  'hig\多多');
INSERT INTO `t1\n2_3` VALUES(4,  'klm \ \ ');
SELECT * FROM `t1\n2_3`;
A	B
1	abc\def
2	中国\人民
3	hig\多多
4	klm \ \ 
DROP TABLE `t1\n2_3`;
CREATE TABLE `t1\n2_3`(`A\n_B` INT, `B\t_C` VARCHAR(50));
INSERT INTO `t1\n2_3` VALUES(1,  'abc\def');
INSERT INTO `t1\n2_3`(`A\n_B`) VALUES(2);
INSERT INTO `t1\n2_3`(`A\n_b`) VALUES(3);
INSERT INTO `t1\n2_3` VALUES(4,  'klm \ \ ');
SELECT * FROM `t1\n2_3`;
A\n_B	B\t_C
1	abc\def
2	NULL
3	NULL
4	klm \ \ 
DROP TABLE `t1\n2_3`;
# 创建外键表
CREATE TABLE t2 (C INT, D VARCHAR(50) PRIMARY KEY);
INSERT INTO t2 VALUES(1,  'abc\def');
INSERT INTO t2 VALUES(2,  '中国\人民');
INSERT INTO t2 VALUES(3,  'hig\多多');
CREATE TABLE t1 (A INT, B VARCHAR(50) PRIMARY KEY, FOREIGN KEY (b) REFERENCES t2(d) ON UPDATE CASCADE);
INSERT INTO t1 VALUES(1,  'abc\def');
INSERT INTO t1 VALUES(2,  '中国\人民');
INSERT INTO t1 VALUES(3,  'hig\多多');
DROP TABLE t1;
DROP TABLE t2;
# 创建分区表
CREATE TABLE `t\n1\t`(
a INT , 
b VARCHAR(50) PRIMARY KEY
) PARTITION BY LIST columns(b) SUBPARTITION BY KEY(B) SUBPARTITIONS 2(
PARTITION p0 VALUES IN ('abc\def','中国\人民'),
PARTITION p1 VALUES IN ('hig\多多','klm \ \ '),
PARTITION p2 VALUES IN ('xiaofeng\n\t','\0')
);
INSERT INTO `t\n1\t` VALUES(1,  'abc\def');
INSERT INTO `t\n1\t` VALUES(2,  '中国\人民');
INSERT INTO `t\n1\t` VALUES(3,  'hig\多多');
INSERT INTO `t\n1\t` VALUES(4,  'klm \ \ ');
DROP TABLE `t\n1\t`;
CREATE TABLE t1(
`a\n\t_1` INT , 
`b\n\t_2` VARCHAR(50) PRIMARY KEY
) PARTITION BY LIST columns(`b\n\t_2`) SUBPARTITION BY KEY(`b\n\t_2`) SUBPARTITIONS 2(
PARTITION p0 VALUES IN ('abc\def','中国\人民'),
PARTITION p1 VALUES IN ('hig\多多','klm \ \ '),
PARTITION p2 VALUES IN ('xiaofeng\n\t','\0')
);
INSERT INTO t1 VALUES(1,  'abc\def');
INSERT INTO t1 VALUES(2,  '中国\人民');
INSERT INTO t1 VALUES(3,  'hig\多多');
SELECT * FROM t1;
a\n\t_1	b\n\t_2
2	中国\人民
1	abc\def
3	hig\多多
DROP TABLE t1;
CREATE TABLE t1(
a INT, 
b VARCHAR(50) PRIMARY KEY
) PARTITION BY LIST columns(b) SUBPARTITION BY KEY(b) SUBPARTITIONS 2(
PARTITION `p\n0` VALUES IN ('abc\def','中国\人民'),
PARTITION `p\n1` VALUES IN ('hig\多多','klm \ \ '),
PARTITION `p\n2` VALUES IN ('xiaofeng\n\t','\0')
);
INSERT INTO t1 VALUES(1,  'abc\def');
INSERT INTO t1 VALUES(2,  '中国\人民');
INSERT INTO t1 VALUES(3,  'hig\多多');
SELECT * FROM t1;
a	b
2	中国\人民
1	abc\def
3	hig\多多
DROP TABLE t1;
# CONSTRAINT
CREATE TABLE t1(
a INT, 
b VARCHAR(50),
CONSTRAINT `uniq_\t\n_key` UNIQUE KEY (b)
);
INSERT INTO t1 VALUES(1,  'abc\def');
INSERT INTO t1 VALUES(2,  '中国\人民');
SELECT * FROM t1;
a	b
1	abc\def
2	中国\人民
DROP TABLE t1;
# 表 / 字段 Comment
CREATE TABLE t1(
a INT, 
b VARCHAR(50) comment '\n 段描述 \t' 
);
INSERT INTO t1 VALUES(1,  'abc\def');
INSERT INTO t1 VALUES(2,  '中国\人民');
SELECT * FROM t1;
a	b
1	abc\def
2	中国\人民
DROP TABLE t1;
CREATE TABLE t1(
a INT, 
b VARCHAR(50)  
) comment='\n 表描述 \t' ;
INSERT INTO t1 VALUES(1,  'abc\def');
INSERT INTO t1 VALUES(2,  '中国\人民');
SELECT * FROM t1;
a	b
1	abc\def
2	中国\人民
DROP TABLE t1;
# 多列普通索引
CREATE TABLE T1(
t1_id INT NOT NULL,
first_name VARCHAR(50),
last_name VARCHAR(50),
sex VARCHAR(20)
);
INSERT INTO T1 VALUES (1,'张','三','男');
INSERT INTO T1 VALUES (2,'李','四','男');
INSERT INTO T1 VALUES (3,NULL,'id','女');
INSERT INTO T1 VALUES (4,'dolor','ut','男');
INSERT INTO T1 VALUES (5,'sed','dolore ','女');
INSERT INTO T1 VALUES (6,'eiusmod','enim','男');
CREATE INDEX `T1_\t_01` ON T1(t1_id,sex);
DROP INDEX `T1_\t_01` ON T1;
DROP TABLE T1;
# 主键索引
CREATE TABLE T1(
t1_id INT NOT NULL,
first_name VARCHAR(50),
last_name VARCHAR(50),
sex VARCHAR(20)
);
INSERT INTO T1 VALUES (1,'张','三','男');
INSERT INTO T1 VALUES (2,'李','四','男');
INSERT INTO T1 VALUES (3,NULL,'id','女');
INSERT INTO T1 VALUES (4,'dolor','ut','男');
INSERT INTO T1 VALUES (5,'sed','dolore ','女');
INSERT INTO T1 VALUES (6,'eiusmod','enim','男');
ALTER TABLE T1 ADD PRIMARY KEY ( t1_id );
DROP TABLE T1;
# 唯一索引
CREATE TABLE T1(
t1_id INT NOT NULL,
first_name VARCHAR(50),
last_name VARCHAR(50),
sex VARCHAR(20)
);
INSERT INTO T1 VALUES (1,'张','三','男');
INSERT INTO T1 VALUES (2,'李','四','男');
INSERT INTO T1 VALUES (3,NULL,'id','女');
INSERT INTO T1 VALUES (4,'dolor','ut','男');
INSERT INTO T1 VALUES (5,'sed','dolore ','女');
INSERT INTO T1 VALUES (6,'eiusmod','enim','男');
CREATE UNIQUE INDEX `T1_\t_01` ON T1(t1_id);
DROP INDEX `T1_\t_01` ON T1;
DROP TABLE T1;
# 全文索引 ob 不支持
CREATE TABLE T1(
t1_id INT NOT NULL,
first_name VARCHAR(200),
last_name VARCHAR(200)
);
INSERT INTO t1 VALUES 
(1,'\t\n\b\\lamco laboris nisi ut aliquip ex ea commodo consequat. Duis aute irure dolor in reprehenderit in voluptate velit ess','nisi ut aliquip ex ea commodo consequat. Duis ');
INSERT INTO t1 VALUES 
(2,'ipsum dolor sit amet, consectetur adipiscing elit, sed do eiusmod tempor incididunt ut labore et dolore magna aliqua. Ut enim ad minim veniam, quis nostrud exercitation ullamco lab','Ut enim ad minim veniam, quis nostrud exercitation ullamco laboris nisi ut aliquip ex ea commodo consequat. Duis aute irure dolor in reprehenderit in ');
INSERT INTO t1 VALUES (3,'    laborum.dfadsfasdflufffuufufxxxxfflxofnfnf,difxooff','velit esse cillum dolore eu fugiat nulla pariatur. Excepteur sint occaecat cupidatat non proident, sunt in culpa qui officia deserunt mollit anim id est laborum.df');
INSERT INTO t1 VALUES (4,'_\t\\sunt in culpa qui officia deserunt mollit anim id est laborum.dfadsfasdflufffuufufxxxxfflxofnfnf,difxooffjjjdia,j,Lorem ipsum dolor sit amet, consectetur adipiscing','occaecat cupidatat non proident, sunt in culpa qui officia deserunt mollit anim id est laborum.dfadsfasdflufffuufufxxxxfflxofnfnf,difxooffjjjdia,j,Lorem ipsum dolor sit amet, consectetur adipisci');
INSERT INTO t1 VALUES (5,'ullamco laboris nisi ut aliquip ex ea commodo consequat. Duis aute irure dolor in reprehenderit in voluptate velit','ipsum dolor sit amet, consectetur adipiscing elit, sed do ');
INSERT INTO t1 VALUES (6,'in reprehenderit in voluptate velit esse cillum dolore eu fugiat nulla pariatur. Excep','commodo consequat. Duis aute irure dolor in reprehenderit in voluptate velit esse cillum dolore eu fugiat nulla p');
DROP TABLE T1;
# 分区普通索引
CREATE TABLE t1(a INT , b VARCHAR(50)) PARTITION BY LIST columns(b)(
PARTITION p0 VALUES IN ('abc\def','中国\人民'),
PARTITION p1 VALUES IN ('hig\多多','klm \ \ '),
PARTITION p2 VALUES IN ('xiaofeng\n\t','\0')
);
INSERT INTO t1 VALUES(1,  'abc\def');
INSERT INTO t1 VALUES(2,  '中国\人民');
INSERT INTO t1 VALUES(3,  'hig\多多');
INSERT INTO t1 VALUES(4,  'klm \ \ ');
INSERT INTO t1 VALUES(5,  'xiaofeng\n\t');
INSERT INTO t1 VALUES(6,  '\0');
CREATE INDEX `T1_\n\t_01` ON t1(b);
DROP INDEX `T1_\n\t_01` ON T1;
DROP TABLE t1;
# NO_BACKSLASH-3
# 普通生成列表
CREATE TABLE t1 (
a INT AUTO_INCREMENT PRIMARY KEY,
b VARCHAR(50),
c VARCHAR(100) GENERATED ALWAYS AS (b)
);
INSERT INTO t1(a,b) VALUES(1, '\n');
INSERT INTO t1(a,b) VALUES(2, '\t');
INSERT INTO t1(a,b) VALUES(3, '\0');
INSERT INTO t1(a,b) VALUES(4, '\t\t');
INSERT INTO t1(a,b) VALUES(5, '\\');
INSERT INTO t1(a,b) VALUES(6, '中国\人民');
SELECT * FROM t1;
a	b	c
1	\n	\n
2	\t	\t
3	\0	\0
4	\t\t	\t\t
5	\\	\\
6	中国\人民	中国\人民
DROP TABLE t1;
# CONCAT 生成列表
CREATE TABLE t1 (
a INT AUTO_INCREMENT PRIMARY KEY,
b VARCHAR(50),
c VARCHAR(100) GENERATED ALWAYS AS (CONCAT(b,'\n'))
);
INSERT INTO t1(a,b) VALUES(1, '\n');
INSERT INTO t1(a,b) VALUES(2, '\t');
INSERT INTO t1(a,b) VALUES(3, '\0');
INSERT INTO t1(a,b) VALUES(4, '\t\t');
INSERT INTO t1(a,b) VALUES(5, '\\');
INSERT INTO t1(a,b) VALUES(6, '中国\人民');
SELECT * FROM t1;
a	b	c
1	\n	\n\\n
2	\t	\t\\n
3	\0	\0\\n
4	\t\t	\t\t\\n
5	\\	\\\\n
6	中国\人民	中国\人民\\n
DROP TABLE t1;
# CASE WHEN 生成列表
CREATE TABLE T1 (
a INT AUTO_INCREMENT PRIMARY KEY,
c_time varchar(50),
d_time varchar(50) GENERATED ALWAYS AS (CASE WHEN timestamp(c_time) > "2021-07-06" THEN "\n\n" WHEN timestamp(c_time) <= "2021-07-06" then '\t\t\t rr' end)
);
INSERT INTO T1(A,C_TIME) VALUES(1,'2020-02-29 10:11:59');
INSERT INTO T1(A,C_TIME) VALUES(2,'09:10:05');
INSERT INTO T1(A,C_TIME) VALUES(3,NULL);
INSERT INTO T1(A,C_TIME) VALUES(4,'2022\08\24 21:10:45');
INSERT INTO T1(A,C_TIME) VALUES(5,'2022\08\24 21:10:45');
INSERT INTO T1(A,C_TIME) VALUES(6,'2022-02-28 10:11:59');
INSERT INTO T1(A,C_TIME) VALUES(7,'2022-02-28 10:11:59');
INSERT INTO T1(A,C_TIME) VALUES(8,'2022-02-29 10:11:59');
INSERT INTO T1(A,C_TIME) VALUES(9,' ');
SELECT * FROM T1;
a	c_time	d_time
1	2020-02-29 10:11:59	\\t\\t\\t rr
2	09:10:05	\\t\\t\\t rr
3	NULL	NULL
4	2022\08\24 21:10:45	\\n\\n
5	2022\08\24 21:10:45	\\n\\n
6	2022-02-28 10:11:59	\\n\\n
7	2022-02-28 10:11:59	\\n\\n
8	2022-02-29 10:11:59	NULL
9	 	NULL
DROP TABLE T1;
# 目前暂不支持生成列转义,以下为部分测试场景
# SUBSTR 生成列表
# UPPER 生成列表
# LOWER 生成列表
# Clean up users
DROP DATABASE  obwmjtest;
DROP USER wmj456@'%' ;
