#Environmental cleaning
DROP USER wmj456@'%';
DROP DATABASE obwmjtest;
CREATE DATABASE obwmjtest;
CREATE USER wmj456 IDENTIFIED BY 'wmj456';
GRANT ALL ON *.* TO wmj456 WITH GRANT OPTION;
SET sql_mode = 'NO_BACKSLASH_ESCAPES';
DROP TABLE t2;
DROP TABLE t1;
DROP TABLE `t\n1\t`;
DROP TABLE `t1\n2_3`;
DROP VIEW T1_VIEW;
DROP DATABASE `ob\nwb_test`;
# NOBACKSLASH_ESCAPE-5
# 唯一约束 + no_backslash_escape + comment
CREATE TABLE t1(
a INT, 
b VARCHAR(50),
CONSTRAINT /*! uniq\nkey */ UNIQUE KEY (b)
);
INSERT INTO t1 VALUES(1,  'abc\def');
INSERT INTO t1 VALUES(2,  '中国\人民');
SELECT * FROM t1;
a	b
1	abc\def
2	中国\人民
DROP TABLE t1;
# 默认约束
CREATE TABLE t1(
a INT, 
b VARCHAR(50),
c CHAR(3) DEFAULT '\\n'
);
INSERT INTO t1(a,b) VALUES(1,  'abc\def');
INSERT INTO t1(a,b) VALUES(2,  '中国\人民');
SELECT * FROM t1;
a	b	c
1	abc\def	\\n
2	中国\人民	\\n
DROP TABLE t1;
CREATE TABLE t1(
a INT, 
b VARCHAR(50),
c CHAR(3) DEFAULT '\n'
);
INSERT INTO t1(a,b) VALUES(1,  'abc\def');
INSERT INTO t1(a,b) VALUES(2,  '中国\人民');
SELECT * FROM t1;
a	b	c
1	abc\def	\n
2	中国\人民	\n
DROP TABLE t1;
# 外键约束
CREATE TABLE t1 (a int unique, b varchar(20), c int);
CREATE TABLE t2 (ID INT NOT NULL, NAME VARCHAR(20), AGE INT);
ALTER TABLE t2 ADD CONSTRAINT `fk\nid` FOREIGN KEY (id) REFERENCES t1(a) ON UPDATE CASCADE;
INSERT INTO t1 VALUES(1, '张三', 2);
INSERT INTO t2 VALUES (1,'T2B',20);
UPDATE T1 SET A='\1';
DROP TABLE T2;
DROP TABLE T1;
CREATE TABLE t1 (A int , B varchar(20) unique, C int);
CREATE TABLE t2 (ID INT , NAME VARCHAR(20), AGE INT);
ALTER TABLE t2 ADD CONSTRAINT fk_b FOREIGN KEY (name) REFERENCES t1(b) ON UPDATE CASCADE;
INSERT INTO t1 VALUES(1, '张三', 2);
INSERT INTO t2 VALUES(1,'张三',20);
UPDATE T1 SET B='\n';
DROP TABLE T2;
DROP TABLE T1;
CREATE TABLE t1 (A INT, B VARCHAR(20) UNIQUE , C int);
CREATE TABLE t2 (ID INT, NAME VARCHAR(20) NOT NULL DEFAULT 'XX', AGE INT );
ALTER TABLE t2 ADD CONSTRAINT fk_b FOREIGN KEY (NAME) REFERENCES t1(B) ON UPDATE RESTRICT;
INSERT INTO t1 VALUES(1, '张三', 2);
INSERT INTO t2 VALUES(1,'张三',20);
UPDATE T1 SET B='\n';
DROP TABLE T2;
DROP TABLE T1;
# NO_BACKSLASH_ESCAPES-6
# 不同数据类型
CREATE TABLE T1(A INT);
INSERT INTO T1 VALUES('\1');
INSERT INTO T1 VALUES('\211');
SELECT * FROM T1;
A
0
0
DROP TABLE T1;
CREATE TABLE T1(A float, B double);
INSERT INTO T1 VALUES('\1','\1.11');
Warnings:
Warning	1292	Truncated incorrect DOUBLE value: '\1'
Warning	1292	Truncated incorrect DOUBLE value: '\1.11'
INSERT INTO T1 VALUES('\22.22','\0.555');
Warnings:
Warning	1292	Truncated incorrect DOUBLE value: '\22.22'
Warning	1292	Truncated incorrect DOUBLE value: '\0.555'
SELECT * FROM T1;
A	B
0	0
0	0
DROP TABLE T1;
CREATE TABLE T1(A char(20), B varchar(20), C tinytext);
INSERT INTO T1 VALUES('\n','\t','\v' );
INSERT INTO T1 VALUES('\n','\t','\r' );
SELECT * FROM T1;
A	B	C
\n	\t	\v
\n	\t	\r
DROP TABLE T1;
CREATE TABLE T1(b3 text(20), b4 mediumtext, b5 mediumtext);
INSERT INTO T1 VALUES('\n','\t','\v' );
INSERT INTO T1 VALUES('\n','\t','\r' );
SELECT * FROM T1;
b3	b4	b5
\n	\t	\v
\n	\t	\r
DROP TABLE T1;
CREATE TABLE T1(c date,c1 time);
INSERT INTO T1 VALUES('\2020-01-12','23:59:59');
INSERT INTO T1 VALUES('\2019-02-23','\21:01:01');
SELECT * FROM T1;
c	c1
0000-00-00	23:59:59
0000-00-00	00:00:00
DROP TABLE T1;
CREATE TABLE T1(c2 datetime,c3 timestamp);
INSERT INTO T1 VALUES('\2020-01-23 21:29:31','2020-01-13 21:29:31');
INSERT INTO T1 VALUES('2020-01-23 21:29:31','\2020-01-13 21:29:31');
SELECT * FROM T1;
c2	c3
0000-00-00 00:00:00	2020-01-13 21:29:31
2020-01-23 21:29:31	0000-00-00 00:00:00
DROP TABLE T1;
CREATE TABLE T1(c2 blob(20),c3 LONGBLOB);
INSERT INTO T1 VALUES('\n','\t');
INSERT INTO T1 VALUES('\n','\t');
SELECT * FROM T1;
c2	c3
\n	\t
\n	\t
DROP TABLE T1;
# 不同参数类型
SELECT CONCAT(1.145, '\n') FROM DUAL;
CONCAT(1.145, '\n')
1.145\n
SELECT CONCAT(-10000, '\n') FROM DUAL;
CONCAT(-10000, '\n')
-10000\n
SELECT CONCAT(-1.175494351E-38, '\n') FROM DUAL;
CONCAT(-1.175494351E-38, '\n')
-1.175494351e-38\n
SELECT CONCAT(-1.7976931348623157E+308, '\n') FROM DUAL;
CONCAT(-1.7976931348623157E+308, '\n')
-1.7976931348623157e308\n
SELECT CONCAT('00:00:00', '\n') FROM DUAL;
CONCAT('00:00:00', '\n')
00:00:00\n
SELECT CONCAT("2020 NULL wmj456", '\n') FROM DUAL;
CONCAT("2020 NULL wmj456", '\n')
2020 NULL wmj456\n
SELECT CONCAT("2020 NULL wmj456", '\"') FROM DUAL;
CONCAT("2020 NULL wmj456", '\"')
2020 NULL wmj456\"
SELECT CONCAT('∑ΤΥΦΧΨΩ', '\n') FROM DUAL;
CONCAT('∑ΤΥΦΧΨΩ', '\n')
∑ΤΥΦΧΨΩ\n
# 事务SAVAPOINT
CREATE TABLE t1 (
id int NOT NULL,
consumer char(20) DEFAULT NULL,
price varchar(20) DEFAULT NULL,
sal int DEFAULT NULL,
datetime1 DATE,
datetime2 bigint
);
INSERT INTO t1 VALUES(1,'书局','7000',5000,'2020-09-22',20200923121200);
INSERT INTO t1 VALUES(7,'合金','VIVO',3500,'2020-02-29',20200228101159);
SET ob_trx_timeout = 10000000000;
SET ob_query_timeout = 10000000000;
SET ob_trx_idle_timeout = 1200000000;
SET autocommit = FALSE;
START TRANSACTION;
UPDATE t1 SET consumer='钢铁之躯' WHERE id=7;
SAVEPOINT `save\n`;
UPDATE t1 SET consumer='钢铁之躯2' WHERE id=7;
SAVEPOINT save2;
ROLLBACK TO `save\n`;
COMMIT;
SELECT * FROM T1;
id	consumer	price	sal	datetime1	datetime2
1	书局	7000	5000	2020-09-22	20200923121200
7	钢铁之躯	VIVO	3500	2020-02-29	20200228101159
SET autocommit = TRUE;
DROP TABLE T1;
# TABLEGROUP
CREATE tablegroup tgp;
CREATE TABLE t1 (a int, b varchar(20)) tablegroup tgp;
INSERT INTO t1 VALUES(1, '\n');
INSERT INTO t1 VALUES(2, '\t');
SELECT * FROM T1;
a	b
1	\n
2	\t
DROP TABLE t1;
DROP TABLEGROUP tgp;
# DML 操作补充用例
# SELECT / UPDATE / DELETE
CREATE TABLE t1 (A INT, B VARCHAR(50));
INSERT INTO t1 VALUES(1,  'abc\def');
INSERT INTO t1 VALUES(2,  '中国\人民');
INSERT INTO t1 VALUES(3,  'hig\多多');
INSERT INTO t1 VALUES(4,  'klm \ \ ');
INSERT INTO t1 VALUES(5,  'xiaofeng\n\t');
INSERT INTO t1 VALUES(6,  '\0');
INSERT INTO t1 VALUES(7,  '\x32');
INSERT INTO t1 VALUES(8,  '$$\#_#\ ');
INSERT INTO t1 VALUES(9,  ' \\ \\ 济公');
INSERT INTO t1 VALUES(10, ' \v ');
INSERT INTO t1 VALUES(11, ' \\" ');
INSERT INTO t1 VALUES(12, '\332');
INSERT INTO t1 VALUES(13, '\t');
INSERT INTO t1 VALUES(14, '\r\f');
INSERT INTO t1 VALUES(15, ' \b ');
INSERT INTO t1 VALUES(16, ' \\b ');
CREATE TABLE t2 (A INT, B VARCHAR(50));
INSERT INTO t2 VALUES(1,  'hig\多多');
INSERT INTO t2 VALUES(2,  '中国\人民');
INSERT INTO t2 VALUES(3,  '$$\#_#\ ');
INSERT INTO t2 VALUES(4,  ' \\ \\ 济公');
SELECT t1.b FROM t1 ORDER BY T1.A;
b
abc\def
中国\人民
hig\多多
klm \ \ 
xiaofeng\n\t
\0
\x32
$$\#_#\ 
 \\ \\ 济公
 \v 
 \\" 
\332
\t
\r\f
 \b 
 \\b 
SELECT aa.b FROM t1 as aa ORDER BY aa.a;
b
abc\def
中国\人民
hig\多多
klm \ \ 
xiaofeng\n\t
\0
\x32
$$\#_#\ 
 \\ \\ 济公
 \v 
 \\" 
\332
\t
\r\f
 \b 
 \\b 
SELECT t1.b FROM t1 WHERE t1.b='\0' ORDER BY T1.A;
b
\0
SELECT * FROM t1 e LEFT JOIN t2 p ON e.b = p.b ORDER BY e.a DESC;
A	B	A	B
16	 \\b 	NULL	NULL
15	 \b 	NULL	NULL
14	\r\f	NULL	NULL
13	\t	NULL	NULL
12	\332	NULL	NULL
11	 \\" 	NULL	NULL
10	 \v 	NULL	NULL
9	 \\ \\ 济公	4	 \\ \\ 济公
8	$$\#_#\ 	3	$$\#_#\ 
7	\x32	NULL	NULL
6	\0	NULL	NULL
5	xiaofeng\n\t	NULL	NULL
4	klm \ \ 	NULL	NULL
3	hig\多多	1	hig\多多
2	中国\人民	2	中国\人民
1	abc\def	NULL	NULL
SELECT * FROM t1 e RIGHT JOIN t2 p ON e.b = p.b ORDER BY e.a;
A	B	A	B
2	中国\人民	2	中国\人民
3	hig\多多	1	hig\多多
8	$$\#_#\ 	3	$$\#_#\ 
9	 \\ \\ 济公	4	 \\ \\ 济公
SELECT * FROM t1 e INNER JOIN t2 p ON e.b = p.b ORDER BY e.a;
A	B	A	B
2	中国\人民	2	中国\人民
3	hig\多多	1	hig\多多
8	$$\#_#\ 	3	$$\#_#\ 
9	 \\ \\ 济公	4	 \\ \\ 济公
SELECT * FROM (SELECT '\n' a FROM dual ) tt where tt.a = '\n';
a
\n
SELECT '\0' IS NOT NULL FROM DUAL ;
'\0' IS NOT NULL
1
SELECT '\t' IS NOT NULL FROM DUAL ;
'\t' IS NOT NULL
1
SELECT '\0' = 0 FROM DUAL ;
'\0' = 0
1
Warnings:
Warning	1292	Truncated incorrect DECIMAL value: '\0'
SELECT *  FROM t1 e WHERE e.b = ANY (SELECT p.b FROM t2 p ) ORDER BY e.a;
A	B
2	中国\人民
3	hig\多多
8	$$\#_#\ 
9	 \\ \\ 济公
SELECT *  FROM t1 e WHERE e.b < ANY (SELECT p.b FROM t2 p ) ORDER BY e.a;
A	B
1	abc\def
3	hig\多多
4	klm \ \ 
5	xiaofeng\n\t
6	\0
7	\x32
8	$$\#_#\ 
9	 \\ \\ 济公
10	 \v 
11	 \\" 
12	\332
13	\t
14	\r\f
15	 \b 
16	 \\b 
SELECT *  FROM t1 e WHERE e.b > ANY (SELECT p.b FROM t2 p ) ORDER BY e.a;
A	B
1	abc\def
2	中国\人民
3	hig\多多
4	klm \ \ 
5	xiaofeng\n\t
6	\0
7	\x32
8	$$\#_#\ 
11	 \\" 
12	\332
13	\t
14	\r\f
16	 \\b 
UPDATE t2 SET B = '\n' WHERE t2.B = ' \\ \\ 济公';
SELECT * FROM t2 ORDER BY T2.A;
A	B
1	hig\多多
2	中国\人民
3	$$\#_#\ 
4	\n
UPDATE t2 SET B = ' \\ \\ 济公' WHERE B = '\n';
SELECT * FROM t2 ORDER BY T2.A;
A	B
1	hig\多多
2	中国\人民
3	$$\#_#\ 
4	 \\ \\ 济公
UPDATE t2 SET B = (SELECT b FROM t1 WHERE b = '\r\f' ) WHERE a = 1 ;
SELECT * FROM t2 ORDER BY T2.A;
A	B
1	\r\f
2	中国\人民
3	$$\#_#\ 
4	 \\ \\ 济公
UPDATE t2, (SELECT * FROM t1) AS tb1 SET t2.a=tb1.a WHERE t2.b=tb1.b;
SELECT * FROM t2 ORDER BY T2.A;
A	B
2	中国\人民
8	$$\#_#\ 
9	 \\ \\ 济公
14	\r\f
SELECT *  FROM t1 e WHERE e.b < ALL (SELECT p.b FROM t2 p ) ORDER BY e.a;
A	B
10	 \v 
15	 \b 
SELECT *  FROM t1 e WHERE e.b > ALL (SELECT p.b FROM t2 p ) ORDER BY e.a;
A	B
SELECT *  FROM t1 e WHERE e.b = ALL (SELECT p.b FROM t2 p WHERE p.b='中国\人民') ORDER BY e.a;
A	B
2	中国\人民
SELECT * FROM t1 e WHERE EXISTS (SELECT p.b FROM t2 p ) ORDER BY e.a;
A	B
1	abc\def
2	中国\人民
3	hig\多多
4	klm \ \ 
5	xiaofeng\n\t
6	\0
7	\x32
8	$$\#_#\ 
9	 \\ \\ 济公
10	 \v 
11	 \\" 
12	\332
13	\t
14	\r\f
15	 \b 
16	 \\b 
SELECT e.b  FROM t1 e WHERE NOT EXISTS (SELECT p.a,p.b FROM t2 p WHERE p.b=' \\ \\ 济公' ) ORDER BY e.a;
b
SELECT e.a, e.b, SUM(e.a+p.a) FROM t1 e ,t2 p WHERE e.a=p.a GROUP BY e.b ORDER BY e.a;
a	b	SUM(e.a+p.a)
2	中国\人民	4
8	$$\#_#\ 	16
9	 \\ \\ 济公	18
14	\r\f	28
SELECT e.a, e.b tt, SUM(e.a+p.a) FROM t1 e ,t2 p WHERE e.a!=p.a GROUP BY tt HAVING tt = '$$\#_#\ ' ORDER BY e.a;
a	tt	SUM(e.a+p.a)
8	$$\#_#\ 	49
DROP TABLE t1;
DROP TABLE t2;
# Clean up users
DROP DATABASE  obwmjtest;
DROP USER wmj456@'%' ;
