purge recyclebin;
drop database IF EXISTS obljh;
create database obljh ;
use obljh;
set timestamp = 1600000000;
set ob_trx_timeout = 10000000000;
set ob_query_timeout = 10000000000;
alter system set ob_vector_memory_limit_percentage =44;
## update
drop table if exists t1;
CREATE TABLE t1 (c1 int primary key, c2 vector(3),c3 vector(3) ,c4 vector(3),
VECTOR INDEX vector_idx(c2) 
WITH (distance=l2,  type=ivf_pq, m=1));
insert into t1 values(1,'[1,1,2]','[2,2,3]','[1,3,2]');
insert into t1 values(2,'[1,0,3]','[1,0,3]','[2,3,2]');
insert into t1 values(3,'[-1,2,2]','[-3,2,3]','[4,3,3]');
insert into t1 values(4,'[-1,-2,-2]','[-4,2,3]',null);
insert into t1 values(5,'[-1,-3,-2]',null,'[2,3,1]');
replace /*+log_level(DEBUG) no_rewrite */into t1 select * from t1 order by l2_distance(c3, [0.712338,0.603321,0.133444]) APPROXIMATE limit 100;
update t1 set c1 = 10 where c1 =5;
update t1 set c2 = (select [1,2,3] from dual  order by l2_distance([1,2,3], [0.712338,0.603321,0.133444]) limit 1);
select * from t1 order by l2_distance(c2, [0.712338,0.603321,0.133444]) APPROXIMATE limit 1;
c1	c2	c3	c4
1	[1,2,3]	[2,2,3]	[1,3,2]
##where子句
drop table if exists t1;
CREATE TABLE t1 (c1 int primary key, c2 vector(3),c3 vector(3) ,c4 vector(3),
VECTOR INDEX vector_idx(c2) 
WITH (distance=l2, lib=vsag, type=hnsw, m=10, ef_construction=100, ef_search=40));
insert into t1 values(1,'[1,1,2]','[2,2,3]','[1,3,2]');
insert into t1 values(2,'[1,0,3]','[1,0,3]','[2,3,2]');
insert into t1 values(3,'[-1,2,2]','[-3,2,3]','[4,3,3]');
insert into t1 values(4,'[-1,-2,-2]','[-4,2,3]',null);
insert into t1 values(5,'[-1,-3,-2]',null,'[2,3,1]');
update /*+log_level(DEBUG) no_rewrite */t1 set c2 ='[1,2,3]' where c1 =1 order by l2_distance(c2, [0.712338,0.603321,0.133444]) APPROXIMATE limit 1;
ERROR 42000: You have an error in your SQL syntax; check the manual that corresponds to your OceanBase version for the right syntax to use near 'APPROXIMATE limit 1' at line 1
update /*+log_level(DEBUG) no_rewrite */t1 set c2 ='[1,2,3]' where c1 =1 order by l2_distance(c2, [0.712338,0.603321,0.133444])  limit 1;
update t1 set c2 ='[1,2,3]' where c1 > (select c1 from t1 where c1 > 2 order by l2_distance(c2, [0.712338,0.603321,0.133444]) APPROXIMATE limit 1);
update t1 set c2 ='[2,2,3]' where c1 > (select c1 from t1 where c4 is not null order by l2_distance(c2, [0.712338,0.603321,0.133444]) APPROXIMATE limit 1);
update t1 set c4 =(select /*+ ENABLE_PARALLEL_DML parallel(256) */c4 from t1 where c4 is not null order by l2_distance(c2, [0.712338,0.603321,0.133444]) APPROXIMATE limit 1) where c1 =5;
update t1 set c4 =(select /*+log_level(DEBUG) no_rewrite */c4 from t1 where c4 is not null order by l2_distance(c2, [0.712338,0.603321,0.133444]) APPROXIMATE limit 1) where c1 =2;
select * from t1 order by l2_distance(c2, [0.712338,0.603321,0.133444]) APPROXIMATE limit 10;
c1	c2	c3	c4
3	[-1,2,2]	[-3,2,3]	[4,3,3]
2	[1,0,3]	[1,0,3]	[4,3,3]
1	[1,2,3]	[2,2,3]	[1,3,2]
4	[2,2,3]	[-4,2,3]	NULL
5	[2,2,3]	NULL	[4,3,3]
## update join(子查询/多表更新)
drop table if exists t1;
CREATE TABLE t1 (c1 int primary key, c2 vector(3),c3 vector(3) ,c4 vector(3),
VECTOR INDEX vector_idx(c2) 
WITH (distance=l2, lib=vsag, type=hnsw, m=10, ef_construction=100, ef_search=40));
insert into t1 values(1,'[1,1,2]','[2,2,3]','[1,3,2]');
insert into t1 values(2,'[1,0,3]','[1,0,3]','[2,3,2]');
insert into t1 values(3,'[-1,2,2]','[-3,2,3]','[4,3,3]');
insert into t1 values(4,'[-1,-2,-2]','[-4,2,3]',null);
insert into t1 values(5,'[-1,-3,-2]',null,'[2,3,1]');
drop table if exists t2;
CREATE TABLE t2 (a1 int , a2 vector(3),a3 vector(3) ,a4 vector(3));
insert into t2 select c1,c2,c3,c4 from t1;
select /*+NO_USE_HASH_SET(@"SET$1")*/* from t1 union  select * from t2;
ERROR 22000: Invalid data type for the operation
update t1 set c2 =[1,2,4] where c1 in (select l2_distance(c3,c3) from t1 inner join t2 on c2=a2);
update t1 join (t2) on c2 =a2 set c2 =[1,2,4] where a3 is null;
update t1 set c1 = l2_distance([1,2,4],[1,3,5]) where c1 in (select l2_distance(c3,c3) from t1 inner join t2 on c2=a2);
update t1 join t2 on c2 =a2 set c1 = l2_distance([1,2,4],[1,3,5]) where a3 is null;
##update with limit + order by 
drop table if exists t1;
CREATE TABLE t1 (c1 int primary key, c2 vector(3),c3 vector(3) ,c4 vector(3),
VECTOR INDEX vector_idx(c2) 
WITH (distance=l2, lib=vsag, type=hnsw, m=10, ef_construction=100, ef_search=40));
insert into t1 values(1,'[1,1,2]','[2,2,3]','[1,3,2]');
insert into t1 values(2,'[1,0,3]','[1,0,3]','[2,3,2]');
insert into t1 values(3,'[-1,2,2]','[-3,2,3]','[4,3,3]');
insert into t1 values(4,'[-1,-2,-2]','[-4,2,3]',null);
insert into t1 values(5,'[-1,-3,-2]',null,'[2,3,1]');
drop table if exists t2;
CREATE TABLE t2 (a1 int , a2 vector(3),a3 vector(3) ,a4 vector(3));
insert into t2 select c1,c2,c3,c4 from t1;
update t1 set c1 = l2_distance([10,2,4],[1,3,5]) where c3 is null;
update t1 set c1 = l2_distance([1,2,4],[1,50,5]) where c1> 1 order by c1 limit 1;
select * from t1 order by 1,2;
c1	c2	c3	c4
1	[1,1,2]	[2,2,3]	[1,3,2]
3	[-1,2,2]	[-3,2,3]	[4,3,3]
4	[-1,-2,-2]	[-4,2,3]	NULL
9	[-1,-3,-2]	NULL	[2,3,1]
48	[1,0,3]	[1,0,3]	[2,3,2]
update t1 join t2 on c2 =a2 set c1 = l2_distance([-100,2,4],[1,3,5])  where a2 = [1,1,2];
update t1 join t2 on c2 =a2 set c1 = l2_distance([null,1,4],[1,3,5])  where a2 = [1,1,2];
ERROR 42000: Null value
select * from t1 order by l2_distance(c2,c3);
c1	c2	c3	c4
9	[-1,-3,-2]	NULL	[2,3,1]
48	[1,0,3]	[1,0,3]	[2,3,2]
101	[1,1,2]	[2,2,3]	[1,3,2]
3	[-1,2,2]	[-3,2,3]	[4,3,3]
4	[-1,-2,-2]	[-4,2,3]	NULL
select * from t1 order by l2_distance(c2,c3),l2_distance(c3,c4),l2_distance(c2,c4) ;
c1	c2	c3	c4
9	[-1,-3,-2]	NULL	[2,3,1]
48	[1,0,3]	[1,0,3]	[2,3,2]
101	[1,1,2]	[2,2,3]	[1,3,2]
3	[-1,2,2]	[-3,2,3]	[4,3,3]
4	[-1,-2,-2]	[-4,2,3]	NULL
##with as update
drop table if exists t1;
CREATE TABLE t1 (c1 int primary key, c2 vector(3),c3 vector(3) ,c4 vector(3),
VECTOR INDEX vector_idx(c2) 
WITH (distance=l2, lib=vsag, type=hnsw, m=10, ef_construction=100, ef_search=40));
insert into t1 values(1,'[1,1,2]','[2,2,3]','[1,3,2]');
insert into t1 values(2,'[1,0,3]','[1,0,3]','[2,3,2]');
insert into t1 values(3,'[-1,2,2]','[-3,2,3]','[4,3,3]');
insert into t1 values(4,'[-1,-2,-2]','[-4,2,3]',null);
insert into t1 values(5,'[-1,-3,-2]',null,'[2,3,1]');
update t1 set c1 = 10 where c3 =[2,2,3];
drop table if exists t2;
CREATE TABLE t2 (a1 int primary key , a2 vector(3),a3 vector(3) ,a4 vector(3),
VECTOR INDEX vector_idx(a2) 
WITH (distance=l2, lib=vsag, type=hnsw, m=10, ef_construction=100, ef_search=40));
insert into t2 select c1,c2,c3,c4 from t1;
with cte as (select l2_distance(c2,c3) from t1 order by c1 )
update t2 set a1 = l2_distance([1,2,3],[2,2,3]) where a3 is null ;
select * from t2 order by a1;
a1	a2	a3	a4
1	[-1,-3,-2]	NULL	[2,3,1]
2	[1,0,3]	[1,0,3]	[2,3,2]
3	[-1,2,2]	[-3,2,3]	[4,3,3]
4	[-1,-2,-2]	[-4,2,3]	NULL
10	[1,1,2]	[2,2,3]	[1,3,2]
##insert/replace
drop table if exists t1;
CREATE TABLE t1 (c1 int primary key, c2 vector(3),c3 vector(3) ,c4 vector(3),
VECTOR INDEX vector_idx(c3) 
WITH (distance=l2, lib=vsag, type=hnsw, m=10, ef_construction=100, ef_search=40));
insert into t1(c1) values(l2_distance([1,2,3],[1,2,4]));
insert into t1(c1) values(l2_distance([1,2,3],[1,2,5]));
insert into t1(c1) values(l2_distance([1,2,3],[1,2,6]));
insert into t1(c1) values(l2_distance([1,2,3],[1,2,7]));
insert into t1(c1) values(l2_distance([1,2,3],[1,2,3]));
insert into t1(c1,c2,c3,c4) values(l2_distance([1,2,3],[1,2,8]),[1,1,2],[2,3,4],[2,3,4]);
insert into t1(c1,c2,c3,c4) values(l2_distance([1,2,3],[1,2,9]),[1,1,2],[2,3,4],null);
replace into t1(c1,c2,c3,c4) values(l2_distance([1,2,3],[1,2,100]),[-1,-3,-2],[2,3,1],[2,3,1]);
replace into t1(c1,c2,c3,c4) values(l2_distance([1,2,3],[1,2,100]),[-1,-3,-2],null,[2,3,1]);
replace into t1(c1,c2,c3,c4) values(-1,[-1,-3,-2],null,[2,3,1]);
##导致core 已修复
replace into t1(c1,c2,c3,c4) values(l2_distance([1,2,3],[1,2,100]),[-1,-3,-2],null,[2,3,1]);
select l2_distance(c2,c3) from t1 where c3 is not null order by c1 ;
l2_distance(c2,c3)
3
3
##插入不同的数据类型到vector
drop table if exists t1;
CREATE TABLE t1 (c1 int primary key, c2 vector(3),c3 vector(3) ,c4 vector(3),
VECTOR INDEX vector_idx(c3)
WITH (distance=l2, lib=vsag, type=hnsw, m=10, ef_construction=100, ef_search=40));
drop table if exists t2;
CREATE TABLE t2 (a1 int primary key, a2 VARCHAR(30), a3 VARCHAR(30), a4 VARCHAR(30));
insert into t2 values(1,'999','999','999');
insert into t2 values(2,'中文','@！#￥','中文123abc');
replace into t1 select a1,a2,a3,a4 from t2;
ERROR HY000: Invalid argument
insert into t1 select a1,a2,a3,a4 from t2;
ERROR HY000: Invalid argument
insert into t1 select a1,a2,a3,a4 from t2;
ERROR HY000: Invalid argument
drop table if exists t1;
CREATE TABLE t1 (c1 int primary key, c2 vector(3),c3 vector(3) ,c4 vector(3),c5 vector(3),c6 vector(3),
VECTOR INDEX vector_idx(c3)
WITH (distance=l2, lib=vsag, type=hnsw, m=10, ef_construction=100, ef_search=40));
drop table if exists t2;
CREATE TABLE t2 (c1 int PRIMARY KEY, c2 TINYBLOB,c3 BLOB,c4 MEDIUMBLOB,c5 LONGBLOB,c6 TEXT);
INSERT INTO t2 (c1, c2, c3, c4, c5, c6) VALUES (1, '2023-04-01', '12:34:56', '2023-04-01 12:34:56', '2023-04-01 12:34:56', 2023);
insert into t1 select c1,c2,c3,c4,c5,c6 from t2;
ERROR HY000: Invalid argument
replace into t1 select c1,c2,c3,c4,c5,c6 from t2;
ERROR HY000: Invalid argument
replace into t1 select c1,c2,c3,c4,c5,c6 from t2;
ERROR HY000: Invalid argument
drop table if exists t1;
CREATE TABLE t1 (c1 int primary key, c2 vector(3),c3 vector(3) ,c4 vector(3),
VECTOR INDEX vector_idx(c3) 
WITH (distance=l2, lib=vsag, type=hnsw, m=10, ef_construction=100, ef_search=40));
drop table if exists t2;
CREATE TABLE t2 (c1 int primary key, c2 VARCHAR(30), c3 VARCHAR(30), c4 VARCHAR(30));
insert into t2 values(1,'999','999','999');
insert into t2 values(2,'中文','@！#￥','中文123abc');
insert into t1 select c1,c2,c3,c4 from t2;
ERROR HY000: Invalid argument
replace into t1 select c1,c2,c3,c4 from t2;
ERROR HY000: Invalid argument
drop table if exists t2;
CREATE TABLE t2 (c1 int primary key, c2 DECIMAL(10,2), c3 FLOAT(10,2), c4 double);
insert into t2 values(1,11.21,22.1566,33.1235);
insert into t1 select c1,c2,c3,c4 from t2;
ERROR 22000: Invalid data type for the operation
insert into t1 values(1,2,2,3);
ERROR 0A000: type casting not supported
replace into t1 values(2,2,2,3);
ERROR 0A000: type casting not supported
drop table if exists t1;
CREATE TABLE t1 (c1 int primary key, c2 vector(3),c3 vector(3) ,c4 vector(3),c5 vector(3),c6 vector(3),
VECTOR INDEX vector_idx(c3) 
WITH (distance=l2, lib=vsag, type=hnsw, m=10, ef_construction=100, ef_search=40));
drop table if exists t2;
CREATE TABLE t2 (c1 int PRIMARY KEY, c2 DATE,c3 TIME,c4 DATETIME(6),c5 TIMESTAMP,c6 YEAR);
INSERT INTO t2 (c1, c2, c3, c4, c5, c6) VALUES (1, '2023-04-01', '12:34:56', '2023-04-01 12:34:56', '2023-04-01 12:34:56', 2023);
insert into t1 select c1,c2,c3,c4,c5,c6 from t2;
ERROR 22000: Invalid data type for the operation
insert into t1 select c1,c4,c5,c6 from t2;
ERROR 21S01: Column count doesn't match value count at row 1
insert into t1 values(1, '2023-04-01', '12:34:56', '2023-04-01 12:34:56', '2023-04-01 12:34:56', 2023);
ERROR HY000: Invalid argument
drop table if exists t1;
CREATE TABLE t1 (c1 int primary key, c2 vector(3),c3 vector(3) ,c4 vector(3),c5 vector(3),c6 vector(3),
VECTOR INDEX vector_idx(c3) 
WITH (distance=l2, lib=vsag, type=hnsw, m=10, ef_construction=100, ef_search=40));
drop table if exists t2;
CREATE TABLE t2 (c1 int PRIMARY KEY, c2 TINYBLOB,c3 BLOB,c4 MEDIUMBLOB,c5 LONGBLOB,c6 TEXT);
INSERT INTO t2 (c1, c2, c3, c4, c5, c6) VALUES (1, '2023-04-01', '12:34:56', '2023-04-01 12:34:56', '2023-04-01 12:34:56', 2023);
insert into t1 select c1,c2,c3,c4,c5,c6 from t2;
ERROR HY000: Invalid argument
replace into t1 select c1,c2,c3,c4,c5,c6 from t2;
ERROR HY000: Invalid argument
insert into t1 values(1, '2023-04-01', '12:34:56', '2023-04-01 12:34:56', '2023-04-01 12:34:56', 2023);
ERROR HY000: Invalid argument
drop table if exists t1;
CREATE TABLE t1 (c1 int primary key, c2 vector(3));
replace into t1(c1,c2) values(10,'[-1,-3,-2]');
replace into t1(c1,c2) values(10,'[-1,-3,-2]');
drop table if exists t1;
CREATE TABLE t1 (c1 int AUTO_INCREMENT primary key , c2 vector(3),c3 vector(3) ,c4 BLOB,
VECTOR INDEX vector_idx(c3) 
WITH (distance=l2, lib=vsag, type=hnsw, m=10, ef_construction=100, ef_search=40));
insert into t1(c3) values(l2_distance(null,null));
ERROR 0A000: type casting not supported
insert into t1(c4) values(l2_distance(null,null));
insert into t1(c1) values(l2_distance(null,null));
insert into t1(c3) values(l2_distance([1,2,4],[1,2,4]));
ERROR 0A000: type casting not supported
insert into t1(c4) values(l2_distance(null,null));
insert into t1(c3) values([l2_distance([1.5,2.5,-1.5],[-1.5,1.5,0]),l2_distance([1,2,-4],[1,-2,4]),l2_distance([1,-2,4],[-1,2,4])]);
insert into t1(c3) values([l2_distance([1.5,2.5,-1.5],[-1.5,1.5]),l2_distance([1,2,-4],[1,-2,4]),l2_distance([1,-2,4],[-1,2,4])]);
ERROR 22000: Invalid dimension for vector.
select l2_distance(c3,c4) from t1 order by c1;
l2_distance(c3,c4)
NULL
NULL
NULL
NULL
drop table if exists t1;
CREATE TABLE t1 (c1 int AUTO_INCREMENT primary key , c2 vector(3),c3 vector(3) ,c4 BLOB,
VECTOR INDEX vector_idx(c3) 
WITH (distance=l2, lib=vsag, type=hnsw, m=10, ef_construction=100, ef_search=40));
insert into t1(c3) values(l2_distance(null,null));
ERROR 0A000: type casting not supported
insert into t1(c4) values(l2_distance(null,null));
insert into t1(c1) values(l2_distance(null,null));
insert into t1(c3) values(l2_distance([1,2,4],[1,2,4]));
ERROR 0A000: type casting not supported
insert into t1(c4) values(l2_distance(null,null));
insert into t1(c3) values([l2_distance([1.5,2.5,-1.5],[-1.5,1.5,0]),l2_distance([1,2,-4],[1,-2,4]),l2_distance([1,-2,4],[-1,2,4])]);
insert into t1(c3) values([l2_distance([1.5,2.5,-1.5],[-1.5,1.5]),l2_distance([1,2,-4],[1,-2,4]),l2_distance([1,-2,4],[-1,2,4])]);
ERROR 22000: Invalid dimension for vector.
select l2_distance(c3,c4) from t1 order by c1;
l2_distance(c3,c4)
NULL
NULL
NULL
NULL
drop table if exists t1;
CREATE TABLE t1 (c1 int AUTO_INCREMENT primary key , c2 vector(3),c3 vector(3) ,c4 BLOB,
VECTOR INDEX vector_idx(c3) 
WITH (distance=inner_product, lib=vsag, type=hnsw, m=10, ef_construction=100, ef_search=40));
insert into t1(c3) values(l2_distance(null,null));
ERROR 0A000: type casting not supported
insert into t1(c4) values(l2_distance(null,null));
insert into t1(c1) values(l2_distance(null,null));
insert into t1(c3) values(l2_distance([1,2,4],[1,2,4]));
ERROR 0A000: type casting not supported
insert into t1(c4) values(l2_distance(null,null));
insert into t1(c3) values([l2_distance([1.5,2.5,-1.5],[-1.5,1.5,0]),l2_distance([1,2,-4],[1,-2,4]),l2_distance([1,-2,4],[-1,2,4])]);
insert into t1(c3) values([l2_distance([1.5,2.5,-1.5],[-1.5,1.5]),l2_distance([1,2,-4],[1,-2,4]),l2_distance([1,-2,4],[-1,2,4])]);
ERROR 22000: Invalid dimension for vector.
select l2_distance(c3,c4) from t1 order by c1;
l2_distance(c3,c4)
NULL
NULL
NULL
NULL
drop table if exists t1;
CREATE TABLE t1 (c1 int AUTO_INCREMENT primary key , c2 vector(3),c3 vector(3) ,c4 BLOB,
VECTOR INDEX vector_idx(c3) 
WITH (distance=l2, lib=vsag, type=hnsw, m=10, ef_construction=100, ef_search=40));
insert into t1(c1) values(l2_distance([1.5+1,2.5-1,-1.5*2],[-1.5 % 1,1.5+0,1%1]));
insert into t1(c1) values(l2_distance([2.5+1,2.5-1,-1.5*2],[-1000.5 % 1,1.5+1,1%1]));
insert into t1(c1) values(l2_distance([1.5+1,2.5-1,-1.5*2],[-1.5 % 1,1.5+1,1%1])+l2_distance([1.5+1,2.5-1,-1.5*2],[-1.5 % 1,1.5+0,1%1]));
insert into t1(c1) values(l2_distance([1.5+1,2.5-1,-1.5*2],[-1.5 % 1,1.5+1,1%1])+l2_distance([1.5+1,2.5-1,-1.5*2],[-1.5 % 1,1.5+0,1%1])+l2_distance([1.5+1,2.5-1,-1.5*2],[-1.5 % 1,1.5+0,1%1])+l2_distance([1.5+1,2.5-1,-1.5*2],[-1.5 % 1,1.5+0,1%1])+l2_distance([1.5+1,2.5-1,-1.5*2],[-1.5 % 1,1.5+0,1%1])+l2_distance([1.5+1,2.5-1,-1.5*2],[-1.5 % 1,1.5+0,1%1])+l2_distance([1.5+1,2.5-1,-1.5*2],[-1.5 % 1,1.5+0,1%1]));
insert into t1(c1) values(l2_distance([1.5+1,2.5-1,-1.5*2],[-1.5 % 1,1.5+1,1%1])-l2_distance([1.5+1,2.5-1,-1.5*2],[-1.5 % 1,1.5+0,1%1])+l2_distance([1.5+1,2.5-1,-1.5*2],[-1.5 % 1,1.5+0,1%1])*l2_distance([1.5+1,2.5-1,-1.5*2],[-1.5 % 1,1.5+0,1%1])+l2_distance([1.5+1,2.5-1,-1.5*2],[-1.5 % 1,1.5+0,1%1])+l2_distance([1.5+1,2.5-1,-1.5*2],[-1.5 % 1,1.5+0,1%1])+l2_distance([1.5+1,2.5-1,-1.5*2],[-1.5 % 1,1.5+0,1%1]));
insert into t1(c2) select [2,3,4] from dual;
insert into t1(c3) select [3,3,4] from dual;
insert into t1(c3) select [l2_distance([1.5+1,2.5-1,-1.5*2],[-1.5 % 1,1.5+1,1%1]),l2_distance([1.5+1,2.5-1,-1.5*2],[-1.5 % 1,1.5+1,1%1]),l2_distance([1.5+1,2.5-1,-1.5*2],[-1.5 % 1,1.5+1,1%1])] from dual;
insert into t1(c4) select l2_distance([1.5+1,2.5-1,-1.5*2],[-1.5 % 1,1.5+1,1%1]) from dual;
select l2_distance(c3,[2,3,5]) from t1 order by c1 limit 6,2;
l2_distance(c3,[2,3,5])
1.4142135623730951
2.7967878349228767
select l2_distance(c3,[-2,3,-5]) from t1 order by c1 limit 6,2;
l2_distance(c3,[-2,3,-5])
10.295630140987
11.39610448600853
drop table if exists t1;
CREATE TABLE t1 (c1 int AUTO_INCREMENT primary key , c2 vector(3),c3 vector(3) ,c4 BLOB,
VECTOR INDEX vector_idx(c3) 
WITH (distance=l2, lib=vsag, type=hnsw, m=10, ef_construction=100, ef_search=40));
drop table if exists t2;
CREATE TABLE t2 (a1 int AUTO_INCREMENT primary key , a2 vector(3),a3 vector(3) ,a4 BLOB,
VECTOR INDEX vector_idx(a3) 
WITH (distance=l2, lib=vsag, type=hnsw, m=10, ef_construction=100, ef_search=40));
insert into t1(c1,c2) values(l2_distance([1.5+1,2.5-1,-1.5*2],[-1.5 % 1,1.5+0,1%1]),[l2_distance([-1.5+1,2.5-1,-1.5*2],[-1.5 % 1,1.5+1.5,1%1]),l2_distance([1.5+1,2.5-1,-1.5*2],[-1.5 % 1,1.5+1,1%1]),l2_distance([1.5+1,2.5-1,-1.5*2],[-1.5 % 1,1.5+1,1%1])]);
insert into t2(a1,a2) values(l2_distance([1.5+1,2.5-1,-1.5*2],[-1.5 % 1,1.5+0,1%1]),[l2_distance([-1.5+1,2.5-1,-1.5*2],[-1.5 % 1,1.5+1,1%1.5]),l2_distance([1.5+1,2.5-1,-1.5*2],[-1.5 % 1,1.5+1,1%1]),l2_distance([1.5+1,2.5-1,-1.5*2],[-1.5 % 1,1.5+1,1%1])]);
insert into t1(c2,c3) values([l2_distance([1.5+1,2.5-1,-1.5*2],[-1.5 % 1,1.5+1,1%1]),l2_distance([-1.5+1,2.5-1,-1.5*2],[-1.5 % 1,1.5+1.5,1%1]),l2_distance([1.5+1,2.5-1,-1.5*2],[-1.5 % 1,1.5+1,1%1])],[l2_distance([1.5+1,2.5-1,-1.5*2],[-1.5 % 1,1.5+1,1%1]),l2_distance([1.5+1,2.5-1,-1.5*2],[-1.5 % 1,1.5+1,1%1]),l2_distance([1.5+1,2.5-1,-1.5*2],[-1.5 % 1,1.5+1,1%1])]);
insert into t1(c3,c4) values([l2_distance([1.5+1,2.5-1,-1.5*2],[-1.5 % 1,1.5+1,1%1]),l2_distance([-1.5+1,2.5-1,-1.5*2],[-1.5 % 1,1.5+1.5,1%1]),l2_distance([1.5+1,2.5-1,-1.5*2],[-1.5 % 1,1.5+1,1%1])],l2_distance([1.5+1,2.5-1,-1.5*2],[-1.5 % 1,1.5+1,1%1]));
insert into t2(a3,a4) values([l2_distance([1.5+1,2.5-1,-1.5*2],[-1.5 % 1,1.5+1,1%1]),l2_distance([-1.5+1,2.5-1,-1.5*2],[-1.5 % 1,1.5+1.5,1%1]),l2_distance([1.5+1,2.5-1,-1.5*2],[-1.5 % 1,1.5+1,1%1])],l2_distance([1.5+1,2.5-1,-1.5*2],[-1.5 % 1,1.5+1,1%1]));
insert into t1(c1,c2,c3,c4) values(10,[l2_distance([1.5+1,2.5-1,-1.5*2],[-1.5 % 1,1.5+1,1%1]),l2_distance([-1.5+1,2.5-1,-1.5*2],[-1.5 % 1,1.5+1.5,1%1]),l2_distance([1.5+1,2.5-1,-1.5*2],[-1.5 % 1,1.5+1,1%1])],[l2_distance([1.5+1,2.5-1,-1.5*2],[-1.5 % 1,1.5+1,1%1]),l2_distance([-1.5+1,2.5-1,-1.5*2],[-1.5 % 1,1.5+1.5,1%1]),l2_distance([1.5+1,2.5-1,-1.5*2],[-1.5 % 1,1.5+1,1%1])],l2_distance([1.5+1,2.5-1,-1.5*2],[-1.5 % 1,1.5+1,1%1]));
select c1,c2,a1,a2,l2_distance(c2,a3),l2_distance(c3,c3) from t1,t2 where c4=a4;
c1	c2	a1	a2	l2_distance(c2,a3)	l2_distance(c3,c3)
6	NULL	5	NULL	NULL	0
10	[4.3589,3.3541,4.3589]	5	NULL	0	0
drop table if exists t1;
CREATE TABLE t1 (c1 int AUTO_INCREMENT primary key , c2 vector(3),c3 vector(3) ,c4 BLOB,
VECTOR INDEX vector_idx(c3) 
WITH (distance=l2, lib=vsag, type=hnsw, m=10, ef_construction=100, ef_search=40));
INSERT IGNORE t1(c1) values (l2_distance([1,2],[2,-1]));
INSERT IGNORE t1(c1) values (l2_distance([1,2],[2,-1]));
INSERT IGNORE t1(c2) values ([l2_distance([1,2],[2,-1]),l2_distance([-1,2],[2,-1]),l2_distance([-1,2],[-2,-1])]);
INSERT IGNORE t1 values (10,[1,2,3],[2,-1,-1.5],l2_distance([-1,2],[2,-1]));
select c1,c2,l2_distance(c2,[2,3,-1.5]),l2_distance(c2,c3) from t1 order by c1;
c1	c2	l2_distance(c2,[2,3,-1.5])	l2_distance(c2,c3)
3	NULL	NULL	NULL
4	[3.16228,4.24264,3.16228]	4.963051298054183	NULL
10	[1,2,3]	4.716990566028302	5.5
select c1,c2,l2_distance(c2,[2,3,-1.5]),l2_distance(c2,c3) from t1 order by l2_distance(c2,[2,3,-1.5]);
c1	c2	l2_distance(c2,[2,3,-1.5])	l2_distance(c2,c3)
3	NULL	NULL	NULL
10	[1,2,3]	4.716990566028302	5.5
4	[3.16228,4.24264,3.16228]	4.963051298054183	NULL
select c1,c2,l2_distance(c2,[2,3,-1.5]),l2_distance(c2,c3) from t1 order by l2_distance([1],[1]);
c1	c2	l2_distance(c2,[2,3,-1.5])	l2_distance(c2,c3)
3	NULL	NULL	NULL
4	[3.16228,4.24264,3.16228]	4.963051298054183	NULL
10	[1,2,3]	4.716990566028302	5.5
drop table if exists t1;
CREATE TABLE t1 (c1 int AUTO_INCREMENT primary key , c2 vector(3),c3 vector(3) ,c4 BLOB,
VECTOR INDEX vector_idx(c3) 
WITH (distance=l2, lib=vsag, type=hnsw, m=10, ef_construction=100, ef_search=40));
insert into t1(c1) values(l2_distance([1],[3]))ON DUPLICATE KEY UPDATE c1='[1,1,3]';
insert into t1(c2,c3,c4) values([l2_distance([1.5+1,2.5-1,-1.5*2],[-1.5 % 1,1.5+1,1%1]),l2_distance([-1.5+1,2.5-1,-1.5*2],[-1.5 % 1,1.5+1.5,1%1]),l2_distance([1.5+1,2.5-1,-1.5*2],[-1.5 % 1,1.5+1,1%1])],'[1,0,3]','[2,3,2]') ON DUPLICATE KEY UPDATE c2='[1,1,3]';
insert into t1(c2,c3,c4) values('[1,2,3]','[1,3,3]','[2,1,2]') ON DUPLICATE KEY UPDATE c2='[1,null,3]';
insert into t1(c2,c3,c4) values('[1,6,3]','[1,4,3]','[2,3,2]') ON DUPLICATE KEY UPDATE c2='[1,1,3]';
select * from t1 order by c1;
c1	c2	c3	c4
2	NULL	NULL	NULL
3	[4.3589,3.3541,4.3589]	[1,0,3]	[2,3,2]
4	[1,2,3]	[1,3,3]	[2,1,2]
5	[1,6,3]	[1,4,3]	[2,3,2]
drop table if exists t1;
CREATE TABLE t1 (c1 int AUTO_INCREMENT primary key , c2 vector(3),c3 vector(3) ,c4 BLOB,
VECTOR INDEX vector_idx(c3) 
WITH (distance=l2, lib=vsag, type=hnsw, m=10, ef_construction=100, ef_search=40));
INSERT INTO T1 (C1,C2)VALUES (l2_distance([1],[2]), [1,2,3]), (l2_distance([2],[4]), [1,2,3]), (l2_distance([3],[46]), [1,2,3]);
INSERT INTO T1 (C3,C4)VALUES ([1,2,3], l2_distance([1],[2])),([2,3,-1],l2_distance([2],[2])),([2.23,4.23,1.323],l2_distance([3],[46]));
SELECT * FROM T1 order by c1,c4;
c1	c2	c3	c4
1	[1,2,3]	NULL	NULL
2	[1,2,3]	NULL	NULL
43	[1,2,3]	NULL	NULL
44	NULL	[1,2,3]	1
45	NULL	[2,3,-1]	0
46	NULL	[2.23,4.23,1.323]	43
drop table if exists t1;
CREATE TABLE t1 (c1 int primary key, c2 vector(3),c3 vector(3) ,c4 vector(3),
VECTOR INDEX vector_idx(c2) 
WITH (distance=l2, lib=vsag, type=hnsw, m=10, ef_construction=100, ef_search=40));
insert into t1 values(1,'[1,1,2]','[2,2,3]','[1,3,2]');
insert into t1 values(2,'[1,0,3]','[1,0,3]','[2,3,2]');
insert into t1 values(3,'[-1,2,2]','[-3,2,3]','[4,3,3]');
insert into t1 values(4,'[-1,-2,-2]','[-4,2,3]',null);
insert into t1 values(5,'[-1,-3,-2]',null,'[2,3,1]');
update t1 set c1 = 10 where c3 =[2,2,3];
drop table if exists t2;
CREATE TABLE t2 (a1 int primary key , a2 vector(3),a3 vector(3) ,a4 vector(3),
VECTOR INDEX vector_idx(a2) 
WITH (distance=l2, lib=vsag, type=hnsw, m=10, ef_construction=100, ef_search=40));
insert into t2 select c1,c2,c3,c4 from t1;
INSERT INTO t1 (c1, c2) VALUES (5,'[-1,-3,-2]') ON t2 (a1) DO UPDATE SET a2 = [2,3,1];
ERROR 42000: You have an error in your SQL syntax; check the manual that corresponds to your OceanBase version for the right syntax to use near 't2 (a1) DO UPDATE SET a2 = [2,3,1]' at line 1
drop table if exists t1;
CREATE TABLE t1 (c1 int primary key, c2 vector(3),c3 vector(3) ,c4 vector(3),
VECTOR INDEX vector_idx(c3) 
WITH (distance=l2, lib=vsag, type=hnsw, m=10, ef_construction=100, ef_search=40));
insert into t1(c1) values(l2_distance([1,2,3],[1,2,4]));
replace into t1(c1,c2,c3,c4) values(l2_distance([1,2,3],[1,2,100]),[-1,-3,-2],[2,3,1],[2,3,1]);
replace into t1(c1,c2,c3,c4) values(l2_distance([1,2,3],[1,2,100]),[-1,-3,-2],null,[2,3,1]);
replace into t1(c1,c2,c3,c4) values(-1,[-1,-3,-2],null,[2,3,1]);
replace into t1(c1,c2,c3,c4) values(l2_distance([1,2,3,1,1,1,1,1,1,1,2,3,1,1,1,1,1,1,1,2,3,1,1,1,1,1,1,1,2,3,1,1,1,1,1,1,1,2,3,1,1,1,1,1,1,1,2,3,1,1,1,1,1,1,1,2,3,1,1,1,1,1,1,1,2,3,1,1,1,1,1,1,1,2,3,1,1,1,1,1,1,1,2,3,1,1,1,1,1,1,1,2,3,1,1,1,1,1,1,1,2,3,1,1,1,1,1,1],[1,2,3,1,1,1,1,1,1,1,2,3,1,1,1,1,1,1,1,2,3,1,1,1,1,1,1,1,2,3,1,1,1,1,1,1,1,2,3,1,1,1,1,1,1,1,2,3,1,1,1,1,1,1,1,2,3,1,1,1,1,1,1,1,2,3,1,1,1,1,1,1,1,2,3,1,1,1,1,1,1,1,2,3,1,1,1,1,1,1,1,2,3,1,1,1,1,1,1,1,2,3,10.20,1,1,1,1,1]),[1,2,3],null,[2,3,1]);
replace into t1(c1,c2,c3,c4) values(l2_distance([1,2,3],[1,2,100]),[-1,-3,-2],null,[2,3,1]);
##旁路导入
drop table if exists t1;
drop view if exists v1;
CREATE TABLE t1 (c1 int , c2 VARCHAR(30),c3 vector(3) ,c4 vector(3));
insert into t1(c1,c2,c3,c4) values(1,'[1,1,2]','[2,2,3]','[1,3,2]');
insert into t1(c1,c2,c3,c4) values(2,'[1,0,3]','[1,0,3]','[2,3,2]');
insert into t1(c1,c2,c3,c4) values(3,'[-1,2,2]','[-3,2,3]','[4,3,3]');
insert into t1(c1,c2,c3,c4) values(4,'[-1,-2,-2]','[-4,2,3]',null);
insert into t1(c1,c2,c3,c4) values(5,'[-1,-3,-2]',null,'[2,3,1]');
create view v1 as select * from t1;
insert /*+ direct(true,100) enable_parallel_dml parallel(2)*/ into v1 select c1,c2,c3,c4 from t1;
insert  into t1 select c1,c2,c3,c4 from t1;
insert /*+ direct(true,100) enable_parallel_dml parallel(2) append*/ into t1 select c1,c2,c3,c4 from t1;
insert /*+ direct(true,100) enable_parallel_dml parallel(2) append*/ into t1 select c1,c2,c3,c4 from t1;
drop table if exists t1;
create table t1(c1 int, c2 vector(3)) partition by hash(c1);
insert into t1 values(1,'[1,1,3]');
insert /*+ direct(true,100) enable_parallel_dml parallel(2) append*/ into t1 select c1,c2 from t1;
insert /*+ direct(true,100) enable_parallel_dml parallel(2) append*/ into t1 select c1,c2 from t1;
insert /*+ direct(true,100) enable_parallel_dml parallel(2) append*/ into t1 select c1,c2+c2 from t1;
insert /*+ direct(true,100) enable_parallel_dml parallel(2) append*/ into t1 select c1,c2+c2 from t1;
insert /*+ direct(true,100) enable_parallel_dml parallel(2) append*/ into t1 select c1,c2+c2+c2 from t1;
select count(l2_distance(c2,[1,2,3])) from t1 order by c1;
count(l2_distance(c2,[1,2,3]))
32
drop table if exists t1;
drop view if exists v1;
CREATE TABLE t1 (c1 int , c2 VARCHAR(30),c3 vector(3) ,c4 vector(3),
VECTOR INDEX vector_idx(c3) 
WITH (distance=l2, lib=vsag, type=hnsw, m=10, ef_construction=100, ef_search=40));
insert into t1(c1,c2,c3,c4) values(1,'[1,1,2]','[2,2,3]','[1,3,2]');
insert into t1(c1,c2,c3,c4) values(2,'[1,0,3]','[1,0,3]','[2,3,2]');
insert into t1(c1,c2,c3,c4) values(3,'[-1,2,2]','[-3,2,3]','[4,3,3]');
insert into t1(c1,c2,c3,c4) values(4,'[-1,-2,-2]','[-4,2,3]',null);
insert into t1(c1,c2,c3,c4) values(5,'[-1,-3,-2]',null,'[2,3,1]');
insert  into t1 select c1,c2,c3,c4 from t1;
drop table if exists t1;
CREATE TABLE t1 (c1 int , c2 VARCHAR(30),c3 vector(3) ,c4 vector(2000),
VECTOR INDEX vector_idx(c3) 
WITH (distance=l2, lib=vsag, type=hnsw, m=10, ef_construction=100, ef_search=40));
CREATE VECTOR INDEX vector_idx_c4  ON t1 (c4)  WITH (distance=l2, lib=vsag, type=hnsw, m=10, ef_construction=100, ef_search=40);
drop table if exists t1;
drop view if exists v1;
CREATE TABLE t1 (c1 int , c2 VARCHAR(30),c3 vector(3) ,c4 vector(3),
VECTOR INDEX vector_idx(c3) 
WITH (distance=l2, lib=vsag, type=hnsw, m=10, ef_construction=100, ef_search=40));
insert into t1(c1,c2,c3,c4) values(1,'[1,1,2]','[2,2,3]','[1,3,2]');
insert into t1(c1,c2,c3,c4) values(2,'[1,0,3]','[1,0,3]','[2,3,2]');
insert into t1(c1,c2,c3,c4) values(3,'[-1,2,2]','[-3,2,3]','[4,3,3]');
insert into t1(c1,c2,c3,c4) values(4,'[-1,-2,-2]','[-4,2,3]',null);
insert into t1(c1,c2,c3,c4) values(5,'[-1,-3,-2]',null,'[2,3,1]');
create view v1 as select * from t1;
insert /*+ direct(true,100) enable_parallel_dml parallel(2)*/ into v1 select c1,c2,c3,c4 from t1;
insert  into t1 select c1,c2,c3,c4 from t1;
insert /*+ direct(true,100) enable_parallel_dml parallel(2) append*/ into t1 select c1,c2,c3,c4 from t1;
insert /*+ direct(true,100) enable_parallel_dml parallel(2) append*/ into t1 select c1,c2,c3,c4 from t1;
drop table if exists t1;
CREATE TABLE t1 (c1 int primary key, c2 varchar(30),c3 vector(3) ,c4 vector(3),c5 vector(3) as (c2 * c3),
VECTOR INDEX vector_idx(c3)
WITH (distance=l2, lib=vsag, type=hnsw, m=10, ef_construction=100, ef_search=40))PARTITION BY KEY(c1) PARTITIONS 4;
insert into t1(c1,c2,c3,c4) values(1,'[1,1,2]','[2,2,3]','[1,3,2]');
insert into t1(c1,c2,c3,c4) values(2,'[1,0,3]','[1,0,3]','[2,3,2]');
insert into t1(c1,c2,c3,c4) values(3,'[-1,2,2]','[-3,2,3]','[4,3,3]');
insert into t1(c1,c2,c3,c4) values(4,'[-1,-2,-2]','[-4,2,3]',null);
insert into t1(c1,c2,c3,c4) values(5,'[-1,-3,-2]',null,'[2,3,1]');
drop table if exists t2;
CREATE TABLE t2 (a1 int primary key , a2 vector(3),a3 vector(3) ,a4 vector(3),a5 vector(3) as (a2 * a3),
VECTOR INDEX vector_idx(a2) 
WITH (distance=l2, lib=vsag, type=hnsw, m=10, ef_construction=100, ef_search=40));
replace into t2(a1,a2,a3,a4) select c1,c2,c3,c4 from t1;
drop view if exists v1;
create view v1 as select a2 from t1 a ,t2 b where a.c5=b.a5 order by l2_distance(a2,[1,1,8]) approximate limit 1;
select * from v1;
a2
[1,0,3]
##delete
drop table if exists t1;
CREATE TABLE t1 (c1 int primary key, c2 vector(3),c3 vector(3) ,c4 vector(3));
insert into t1(c1,c2,c3,c4) values(1,'[1,1,2]','[2,2,3]','[1,3,2]');
insert into t1(c1,c2,c3,c4) values(2,'[1,0,3]','[1,0,3]','[2,3,2]');
insert into t1(c1,c2,c3,c4) values(3,'[-1,2,2]','[-3,2,3]','[4,3,3]');
insert into t1(c1,c2,c3,c4) values(4,'[-1,-2,-2]','[-4,2,3]',null);
insert into t1(c1,c2,c3,c4) values(5,'[-1,-3,-2]',null,'[2,3,1]');
drop table if exists t2;
CREATE TABLE t2 (a1 int primary key , a2 vector(3),a3 vector(3) ,a4 vector(3),
VECTOR INDEX vector_idx(a2) 
WITH (distance=l2, lib=vsag, type=hnsw, m=10, ef_construction=100, ef_search=40));
insert into t2 select c1,c2,c3,c4 from t1;
delete from t1 where c3 = [1,0,3];
delete from t1 where c1 =l2_distance([-1],[4]);
delete from t1 where c1 =l2_distance([-1],[2]) and c2 = [-1,2,2];
delete from t1 where c2 =[1,1,1]+[-2,-3,-3];
select * from t1;
c1	c2	c3	c4
1	[1,1,2]	[2,2,3]	[1,3,2]
drop table if exists t1;
CREATE TABLE t1 (c1 int primary key, c2 vector(3),c3 vector(3) ,c4 vector(3));
insert into t1(c1,c2,c3,c4) values(1,'[1,1,2]','[2,2,3]','[1,3,2]');
insert into t1(c1,c2,c3,c4) values(2,'[1,0,3]','[1,0,3]','[2,3,2]');
insert into t1(c1,c2,c3,c4) values(3,'[-1,2,2]','[-3,2,3]','[4,3,3]');
insert into t1(c1,c2,c3,c4) values(4,'[-1,-2,-2]','[-4,2,3]',null);
insert into t1(c1,c2,c3,c4) values(5,'[-1,-3,-2]',null,'[2,3,1]');
drop table if exists t2;
CREATE TABLE t2 (a1 int primary key , a2 vector(3),a3 vector(3) ,a4 vector(3),
VECTOR INDEX vector_idx(a2) 
WITH (distance=l2, lib=vsag, type=hnsw, m=10, ef_construction=100, ef_search=40));
insert into t2 select c1,c2,c3,c4 from t1;
drop table if exists t1;
CREATE TABLE t1 (c1 int primary key, c2 vector(3),c3 vector(3) ,c4 vector(3));
insert into t1(c1,c2,c3,c4) values(1,'[1,1,2]','[2,2,3]','[1,3,2]');
insert into t1(c1,c2,c3,c4) values(2,'[1,0,3]','[1,0,3]','[2,3,2]');
insert into t1(c1,c2,c3,c4) values(3,'[-1,2,2]','[-3,2,3]','[4,3,3]');
insert into t1(c1,c2,c3,c4) values(4,'[-1,-2,-2]','[-4,2,3]',null);
insert into t1(c1,c2,c3,c4) values(5,'[-1,-3,-2]',null,'[2,3,1]');
drop table if exists t2;
CREATE TABLE t2 (a1 int primary key , a2 vector(3),a3 vector(3) ,a4 vector(3),
VECTOR INDEX vector_idx(a2) 
WITH (distance=l2, lib=vsag, type=hnsw, m=10, ef_construction=100, ef_search=40));
insert into t2 select c1,c2,c3,c4 from t1;
select * from t1 inner join t2 on c2+c3+c4=a2+a3+a4 order by c1,c2,c3;
c1	c2	c3	c4	a1	a2	a3	a4
1	[1,1,2]	[2,2,3]	[1,3,2]	1	[1,1,2]	[2,2,3]	[1,3,2]
2	[1,0,3]	[1,0,3]	[2,3,2]	2	[1,0,3]	[1,0,3]	[2,3,2]
3	[-1,2,2]	[-3,2,3]	[4,3,3]	3	[-1,2,2]	[-3,2,3]	[4,3,3]
DELETE t1 FROM t1 INNER JOIN  t2 ON c3=c2 where a1 =3 or c4 is null;
DELETE t1 FROM t1 INNER JOIN  t2 ON l2_distance(c2,c3)=l2_distance(a3,a4) where a1 =3 or c4 is null;
drop table if exists t1;
CREATE TABLE t1 (c1 int primary key, c2 vector(3),c3 vector(3) ,c4 vector(3));
insert into t1(c1,c2,c3,c4) values(1,'[1,1,2]','[2,2,3]','[1,3,2]');
insert into t1(c1,c2,c3,c4) values(2,'[1,0,3]','[1,0,3]','[2,3,2]');
insert into t1(c1,c2,c3,c4) values(3,'[-1,2,2]','[-3,2,3]','[4,3,3]');
insert into t1(c1,c2,c3,c4) values(4,'[-1,-2,-2]','[-4,2,3]',null);
insert into t1(c1,c2,c3,c4) values(5,'[-1,-3,-2]',null,'[2,3,1]');
drop table if exists t2;
CREATE TABLE t2 (a1 int primary key , a2 vector(3),a3 vector(3) ,a4 vector(3),
VECTOR INDEX vector_idx(a2) 
WITH (distance=l2, lib=vsag, type=hnsw, m=10, ef_construction=100, ef_search=40));
insert into t2 select c1,c2,c3,c4 from t1 where c3 is not null and c4 is not null;
DELETE FROM  t1 USING  t2 WHERE l2_distance(c2,c3)=l2_distance(a3,a4) AND c1 =1;
ERROR 42S02: Unknown table 't1' in MULTI DELETE
drop table if exists t1;
CREATE TABLE t1 (c1 int primary key, c2 vector(3),c3 vector(3) ,c4 vector(3));
insert into t1(c1,c2,c3,c4) values(1,'[1,1,2]','[2,2,3]','[1,3,2]');
insert into t1(c1,c2,c3,c4) values(2,'[1,0,3]','[1,0,3]','[2,3,2]');
insert into t1(c1,c2,c3,c4) values(3,'[-1,2,2]','[-3,2,3]','[4,3,3]');
insert into t1(c1,c2,c3,c4) values(4,'[-1,-2,-2]','[-4,2,3]',null);
insert into t1(c1,c2,c3,c4) values(5,'[-1,-3,-2]',null,'[2,3,1]');
delete from t1 where c1 > l2_distance(c2,c3) order by c1 limit 1;
delete from t1 where c1 > l2_distance(c2,c3) order by c2 limit 100;
ERROR 22000: Invalid data type for the operation
delete from t1 where c1 > 0 order by l2_distance(c2,c3) limit 1;
select * from t1 order by c1;
c1	c2	c3	c4
1	[1,1,2]	[2,2,3]	[1,3,2]
3	[-1,2,2]	[-3,2,3]	[4,3,3]
4	[-1,-2,-2]	[-4,2,3]	NULL
drop table if exists t1;
CREATE TABLE t1 (c1 int primary key, c2 vector(3),c3 vector(3) ,c4 vector(3));
insert into t1(c1,c2,c3,c4) values(1,'[1,1,2]','[2,2,3]','[1,3,2]');
insert into t1(c1,c2,c3,c4) values(2,'[1,0,3]','[1,0,3]','[2,3,2]');
insert into t1(c1,c2,c3,c4) values(3,'[-1,2,2]','[-3,2,3]','[4,3,3]');
insert into t1(c1,c2,c3,c4) values(4,'[-1,-2,-2]','[-4,2,3]',null);
insert into t1(c1,c2,c3,c4) values(5,'[-1,-3,-2]',null,'[2,3,1]');
drop table if exists t2;
CREATE TABLE t2 (a1 int primary key , a2 vector(3),a3 vector(3) ,a4 vector(3),
VECTOR INDEX vector_idx(a2) 
WITH (distance=l2, lib=vsag, type=hnsw, m=64, ef_construction=100, ef_search=40));
insert into t2 select c1,c2,c3,c4 from t1 where c3 is not null and c4 is not null;
ALTER TABLE t2 ADD CONSTRAINT fk_a1 FOREIGN KEY (a1) REFERENCES t1(c1) ;
delete from t1 where c2 =[1,1,2];
ERROR 23000: Cannot delete or update a parent row: a foreign key constraint fails
delete from t1 where c1 =l2_distance([1],[3]);
ERROR 23000: Cannot delete or update a parent row: a foreign key constraint fails
insert into t1(c1,c2,c3,c4) values(6,'[1,1,2]','[2,2,3]','[1,3,2]');
update t1 set c1=10 where c4 is null;
drop table if exists t2;
drop table if exists t1;
CREATE TABLE t1 (c1 int primary key, c2 vector(3),c3 vector(3) ,c4 vector(3));
insert into t1(c1,c2,c3,c4) values(1,'[1,1,2]','[2,2,3]','[1,3,2]');
insert into t1(c1,c2,c3,c4) values(2,'[1,0,3]','[1,0,3]','[2,3,2]');
insert into t1(c1,c2,c3,c4) values(3,'[-1,2,2]','[-3,2,3]','[4,3,3]');
insert into t1(c1,c2,c3,c4) values(4,'[-1,-2,-2]','[-4,2,3]',null);
insert into t1(c1,c2,c3,c4) values(5,'[-1,-3,-2]',null,'[2,3,1]');
CREATE TABLE t2 (a1 int primary key , a2 vector(3),a3 vector(3) ,a4 vector(3),
VECTOR INDEX vector_idx(a2) 
WITH (distance=l2, lib=vsag, type=hnsw, m=10, ef_construction=100, ef_search=40));
insert into t2 select c1,c2,c3,c4 from t1 where c3 is not null and c4 is not null;
ALTER TABLE t2 ADD CONSTRAINT fk_a1 FOREIGN KEY (a1) REFERENCES t1(c1) ON DELETE CASCADE ON UPDATE CASCADE;
delete from t1 where c2 =[1,1,2];
delete from t1 where c1 =l2_distance([1],[3]);
insert into t1(c1,c2,c3,c4) values(6,'[1,1,2]','[2,2,3]','[1,3,2]');
update t1 set c1=10 where c4 is null;
TRUNCATE TABLE t2;
drop table if exists t2;
drop table if exists t1;
########清空回收站，删除测试数据库，表等 ##########
drop database  IF EXISTS  obljh;
alter system set ob_vector_memory_limit_percentage =0;
