result_format: 3
drop table  t0;
drop table  t1;
drop table  t2;
drop table  t3;
drop table  t4;
create table t0(a int primary key, b int, c int, d int);
create table t1(a int primary key, b int, c int, d int);
create table t2(a int primary key, b int, c int, d int) partition by hash(a) partitions 2;
create table t3(a int, b int, c int, d int, primary key(a,b)) partition by hash(a) subpartition by range (b) 
subpartition template (
subpartition pa values less than (4),  
subpartition pb values less than (10)) partitions 2;
create table t4 (c1 varchar2(20));
alter system change tenant tenant_id = 1002;
delete from oceanbase.__all_table_stat;
delete from oceanbase.__all_column_stat;
delete from oceanbase.__all_histogram_stat;
alter system change tenant tenant_id = 1;
analyze table t0 compute statistics for all columns;
alter system change tenant oracle;
select object_type, row_cnt from oceanbase.__all_table_stat order by 1, 2;
+-------------+---------+
| object_type | row_cnt |
+-------------+---------+
|           1 |      10 |
+-------------+---------+
select column_id, object_type, min_value, max_value, distinct_cnt, sample_size, density, bucket_cnt, histogram_type from oceanbase.__all_column_stat order by 1, 2,3,4;
+-----------+-------------+-----------+-----------+--------------+-------------+---------+------------+----------------+
| column_id | object_type | min_value | max_value | distinct_cnt | sample_size | density | bucket_cnt | histogram_type |
+-----------+-------------+-----------+-----------+--------------+-------------+---------+------------+----------------+
|        16 |           1 | 0         | 9         |           10 |          10 |    0.05 |         10 |              1 |
|        17 |           1 | 0         | 9         |           10 |          10 |    0.05 |         10 |              1 |
|        18 |           1 | 0         | 9         |           10 |          10 |    0.05 |         10 |              1 |
|        19 |           1 | 0         | 9         |           10 |          10 |    0.05 |         10 |              1 |
+-----------+-------------+-----------+-----------+--------------+-------------+---------+------------+----------------+
select column_id, endpoint_num, object_type, endpoint_value, b_endpoint_value, endpoint_repeat_cnt from oceanbase.__all_histogram_stat order by 1, 2,3,4;
+-----------+--------------+-------------+----------------+--------------------------+---------------------+
| column_id | endpoint_num | object_type | endpoint_value | b_endpoint_value         | endpoint_repeat_cnt |
+-----------+--------------+-------------+----------------+--------------------------+---------------------+
|        16 |            1 |           1 | 0              | 0F053F0080000000         |                   1 |
|        16 |            2 |           1 | 1              | 0F053F00C000000101000000 |                   1 |
|        16 |            3 |           1 | 2              | 0F053F00C000000102000000 |                   1 |
|        16 |            4 |           1 | 3              | 0F053F00C000000103000000 |                   1 |
|        16 |            5 |           1 | 4              | 0F053F00C000000104000000 |                   1 |
|        16 |            6 |           1 | 5              | 0F053F00C000000105000000 |                   1 |
|        16 |            7 |           1 | 6              | 0F053F00C000000106000000 |                   1 |
|        16 |            8 |           1 | 7              | 0F053F00C000000107000000 |                   1 |
|        16 |            9 |           1 | 8              | 0F053F00C000000108000000 |                   1 |
|        16 |           10 |           1 | 9              | 0F053F00C000000109000000 |                   1 |
|        17 |            1 |           1 | 0              | 0F053F0080000000         |                   1 |
|        17 |            2 |           1 | 1              | 0F053F00C000000101000000 |                   1 |
|        17 |            3 |           1 | 2              | 0F053F00C000000102000000 |                   1 |
|        17 |            4 |           1 | 3              | 0F053F00C000000103000000 |                   1 |
|        17 |            5 |           1 | 4              | 0F053F00C000000104000000 |                   1 |
|        17 |            6 |           1 | 5              | 0F053F00C000000105000000 |                   1 |
|        17 |            7 |           1 | 6              | 0F053F00C000000106000000 |                   1 |
|        17 |            8 |           1 | 7              | 0F053F00C000000107000000 |                   1 |
|        17 |            9 |           1 | 8              | 0F053F00C000000108000000 |                   1 |
|        17 |           10 |           1 | 9              | 0F053F00C000000109000000 |                   1 |
|        18 |            1 |           1 | 0              | 0F053F0080000000         |                   1 |
|        18 |            2 |           1 | 1              | 0F053F00C000000101000000 |                   1 |
|        18 |            3 |           1 | 2              | 0F053F00C000000102000000 |                   1 |
|        18 |            4 |           1 | 3              | 0F053F00C000000103000000 |                   1 |
|        18 |            5 |           1 | 4              | 0F053F00C000000104000000 |                   1 |
|        18 |            6 |           1 | 5              | 0F053F00C000000105000000 |                   1 |
|        18 |            7 |           1 | 6              | 0F053F00C000000106000000 |                   1 |
|        18 |            8 |           1 | 7              | 0F053F00C000000107000000 |                   1 |
|        18 |            9 |           1 | 8              | 0F053F00C000000108000000 |                   1 |
|        18 |           10 |           1 | 9              | 0F053F00C000000109000000 |                   1 |
|        19 |            1 |           1 | 0              | 0F053F0080000000         |                   1 |
|        19 |            2 |           1 | 1              | 0F053F00C000000101000000 |                   1 |
|        19 |            3 |           1 | 2              | 0F053F00C000000102000000 |                   1 |
|        19 |            4 |           1 | 3              | 0F053F00C000000103000000 |                   1 |
|        19 |            5 |           1 | 4              | 0F053F00C000000104000000 |                   1 |
|        19 |            6 |           1 | 5              | 0F053F00C000000105000000 |                   1 |
|        19 |            7 |           1 | 6              | 0F053F00C000000106000000 |                   1 |
|        19 |            8 |           1 | 7              | 0F053F00C000000107000000 |                   1 |
|        19 |            9 |           1 | 8              | 0F053F00C000000108000000 |                   1 |
|        19 |           10 |           1 | 9              | 0F053F00C000000109000000 |                   1 |
+-----------+--------------+-------------+----------------+--------------------------+---------------------+
delete from oceanbase.__all_table_stat;
delete from oceanbase.__all_column_stat;
delete from oceanbase.__all_histogram_stat;
analyze table t0 compute statistics for all columns size 5;
select object_type, row_cnt from oceanbase.__all_table_stat order by 1, 2;
+-------------+---------+
| object_type | row_cnt |
+-------------+---------+
|           1 |      10 |
+-------------+---------+
select column_id, object_type, min_value, max_value, distinct_cnt, sample_size, density, bucket_cnt, histogram_type from oceanbase.__all_column_stat order by 1, 2,3,4;
+-----------+-------------+-----------+-----------+--------------+-------------+---------+------------+----------------+
| column_id | object_type | min_value | max_value | distinct_cnt | sample_size | density | bucket_cnt | histogram_type |
+-----------+-------------+-----------+-----------+--------------+-------------+---------+------------+----------------+
|        16 |           1 | 0         | 9         |           10 |          10 |     0.1 |          5 |              4 |
|        17 |           1 | 0         | 9         |           10 |          10 |     0.1 |          5 |              4 |
|        18 |           1 | 0         | 9         |           10 |          10 |     0.1 |          5 |              4 |
|        19 |           1 | 0         | 9         |           10 |          10 |     0.1 |          5 |              4 |
+-----------+-------------+-----------+-----------+--------------+-------------+---------+------------+----------------+
select column_id, endpoint_num, object_type, endpoint_value, b_endpoint_value, endpoint_repeat_cnt from oceanbase.__all_histogram_stat order by 1, 2,3,4;
+-----------+--------------+-------------+----------------+--------------------------+---------------------+
| column_id | endpoint_num | object_type | endpoint_value | b_endpoint_value         | endpoint_repeat_cnt |
+-----------+--------------+-------------+----------------+--------------------------+---------------------+
|        16 |            1 |           1 | 0              | 0F053F0080000000         |                   1 |
|        16 |            4 |           1 | 3              | 0F053F00C000000103000000 |                   1 |
|        16 |            7 |           1 | 6              | 0F053F00C000000106000000 |                   1 |
|        16 |            9 |           1 | 8              | 0F053F00C000000108000000 |                   1 |
|        16 |           10 |           1 | 9              | 0F053F00C000000109000000 |                   1 |
|        17 |            1 |           1 | 0              | 0F053F0080000000         |                   1 |
|        17 |            4 |           1 | 3              | 0F053F00C000000103000000 |                   1 |
|        17 |            7 |           1 | 6              | 0F053F00C000000106000000 |                   1 |
|        17 |            9 |           1 | 8              | 0F053F00C000000108000000 |                   1 |
|        17 |           10 |           1 | 9              | 0F053F00C000000109000000 |                   1 |
|        18 |            1 |           1 | 0              | 0F053F0080000000         |                   1 |
|        18 |            4 |           1 | 3              | 0F053F00C000000103000000 |                   1 |
|        18 |            7 |           1 | 6              | 0F053F00C000000106000000 |                   1 |
|        18 |            9 |           1 | 8              | 0F053F00C000000108000000 |                   1 |
|        18 |           10 |           1 | 9              | 0F053F00C000000109000000 |                   1 |
|        19 |            1 |           1 | 0              | 0F053F0080000000         |                   1 |
|        19 |            4 |           1 | 3              | 0F053F00C000000103000000 |                   1 |
|        19 |            7 |           1 | 6              | 0F053F00C000000106000000 |                   1 |
|        19 |            9 |           1 | 8              | 0F053F00C000000108000000 |                   1 |
|        19 |           10 |           1 | 9              | 0F053F00C000000109000000 |                   1 |
+-----------+--------------+-------------+----------------+--------------------------+---------------------+
delete from oceanbase.__all_table_stat;
delete from oceanbase.__all_column_stat;
delete from oceanbase.__all_histogram_stat;
analyze table t0 compute statistics for all indexed columns;
select object_type, row_cnt from oceanbase.__all_table_stat order by 1, 2;
+-------------+---------+
| object_type | row_cnt |
+-------------+---------+
|           1 |      10 |
+-------------+---------+
select column_id, object_type, min_value, max_value, distinct_cnt, sample_size, density, bucket_cnt, histogram_type from oceanbase.__all_column_stat order by 1, 2,3,4;
+-----------+-------------+-----------+-----------+--------------+-------------+---------+------------+----------------+
| column_id | object_type | min_value | max_value | distinct_cnt | sample_size | density | bucket_cnt | histogram_type |
+-----------+-------------+-----------+-----------+--------------+-------------+---------+------------+----------------+
|        16 |           1 | 0         | 9         |           10 |          10 |    0.05 |         10 |              1 |
+-----------+-------------+-----------+-----------+--------------+-------------+---------+------------+----------------+
select column_id, endpoint_num, object_type, endpoint_value, b_endpoint_value, endpoint_repeat_cnt from oceanbase.__all_histogram_stat order by 1, 2,3,4;
+-----------+--------------+-------------+----------------+--------------------------+---------------------+
| column_id | endpoint_num | object_type | endpoint_value | b_endpoint_value         | endpoint_repeat_cnt |
+-----------+--------------+-------------+----------------+--------------------------+---------------------+
|        16 |            1 |           1 | 0              | 0F053F0080000000         |                   1 |
|        16 |            2 |           1 | 1              | 0F053F00C000000101000000 |                   1 |
|        16 |            3 |           1 | 2              | 0F053F00C000000102000000 |                   1 |
|        16 |            4 |           1 | 3              | 0F053F00C000000103000000 |                   1 |
|        16 |            5 |           1 | 4              | 0F053F00C000000104000000 |                   1 |
|        16 |            6 |           1 | 5              | 0F053F00C000000105000000 |                   1 |
|        16 |            7 |           1 | 6              | 0F053F00C000000106000000 |                   1 |
|        16 |            8 |           1 | 7              | 0F053F00C000000107000000 |                   1 |
|        16 |            9 |           1 | 8              | 0F053F00C000000108000000 |                   1 |
|        16 |           10 |           1 | 9              | 0F053F00C000000109000000 |                   1 |
+-----------+--------------+-------------+----------------+--------------------------+---------------------+
delete from oceanbase.__all_table_stat;
delete from oceanbase.__all_column_stat;
delete from oceanbase.__all_histogram_stat;
analyze table t0 compute statistics for all indexed columns size 5;
select object_type, row_cnt from oceanbase.__all_table_stat order by 1, 2;
+-------------+---------+
| object_type | row_cnt |
+-------------+---------+
|           1 |      10 |
+-------------+---------+
select column_id, object_type, min_value, max_value, distinct_cnt, sample_size, density, bucket_cnt, histogram_type from oceanbase.__all_column_stat order by 1, 2,3,4;
+-----------+-------------+-----------+-----------+--------------+-------------+---------+------------+----------------+
| column_id | object_type | min_value | max_value | distinct_cnt | sample_size | density | bucket_cnt | histogram_type |
+-----------+-------------+-----------+-----------+--------------+-------------+---------+------------+----------------+
|        16 |           1 | 0         | 9         |           10 |          10 |     0.1 |          5 |              4 |
+-----------+-------------+-----------+-----------+--------------+-------------+---------+------------+----------------+
select column_id, endpoint_num, object_type, endpoint_value, b_endpoint_value, endpoint_repeat_cnt from oceanbase.__all_histogram_stat order by 1, 2,3,4;
+-----------+--------------+-------------+----------------+--------------------------+---------------------+
| column_id | endpoint_num | object_type | endpoint_value | b_endpoint_value         | endpoint_repeat_cnt |
+-----------+--------------+-------------+----------------+--------------------------+---------------------+
|        16 |            1 |           1 | 0              | 0F053F0080000000         |                   1 |
|        16 |            4 |           1 | 3              | 0F053F00C000000103000000 |                   1 |
|        16 |            7 |           1 | 6              | 0F053F00C000000106000000 |                   1 |
|        16 |            9 |           1 | 8              | 0F053F00C000000108000000 |                   1 |
|        16 |           10 |           1 | 9              | 0F053F00C000000109000000 |                   1 |
+-----------+--------------+-------------+----------------+--------------------------+---------------------+
delete from oceanbase.__all_table_stat;
delete from oceanbase.__all_column_stat;
delete from oceanbase.__all_histogram_stat;
analyze table t0 compute statistics for columns size 5 a, b, c;
select object_type, row_cnt from oceanbase.__all_table_stat order by 1, 2;
+-------------+---------+
| object_type | row_cnt |
+-------------+---------+
|           1 |      10 |
+-------------+---------+
select column_id, object_type, min_value, max_value, distinct_cnt, sample_size, density, bucket_cnt, histogram_type from oceanbase.__all_column_stat order by 1, 2,3,4;
+-----------+-------------+-----------+-----------+--------------+-------------+---------+------------+----------------+
| column_id | object_type | min_value | max_value | distinct_cnt | sample_size | density | bucket_cnt | histogram_type |
+-----------+-------------+-----------+-----------+--------------+-------------+---------+------------+----------------+
|        16 |           1 | 0         | 9         |           10 |          10 |     0.1 |          5 |              4 |
|        17 |           1 | 0         | 9         |           10 |          10 |     0.1 |          5 |              4 |
|        18 |           1 | 0         | 9         |           10 |          10 |     0.1 |          5 |              4 |
+-----------+-------------+-----------+-----------+--------------+-------------+---------+------------+----------------+
select column_id, endpoint_num, object_type, endpoint_value, b_endpoint_value, endpoint_repeat_cnt from oceanbase.__all_histogram_stat order by 1, 2,3,4;
+-----------+--------------+-------------+----------------+--------------------------+---------------------+
| column_id | endpoint_num | object_type | endpoint_value | b_endpoint_value         | endpoint_repeat_cnt |
+-----------+--------------+-------------+----------------+--------------------------+---------------------+
|        16 |            1 |           1 | 0              | 0F053F0080000000         |                   1 |
|        16 |            4 |           1 | 3              | 0F053F00C000000103000000 |                   1 |
|        16 |            7 |           1 | 6              | 0F053F00C000000106000000 |                   1 |
|        16 |            9 |           1 | 8              | 0F053F00C000000108000000 |                   1 |
|        16 |           10 |           1 | 9              | 0F053F00C000000109000000 |                   1 |
|        17 |            1 |           1 | 0              | 0F053F0080000000         |                   1 |
|        17 |            4 |           1 | 3              | 0F053F00C000000103000000 |                   1 |
|        17 |            7 |           1 | 6              | 0F053F00C000000106000000 |                   1 |
|        17 |            9 |           1 | 8              | 0F053F00C000000108000000 |                   1 |
|        17 |           10 |           1 | 9              | 0F053F00C000000109000000 |                   1 |
|        18 |            1 |           1 | 0              | 0F053F0080000000         |                   1 |
|        18 |            4 |           1 | 3              | 0F053F00C000000103000000 |                   1 |
|        18 |            7 |           1 | 6              | 0F053F00C000000106000000 |                   1 |
|        18 |            9 |           1 | 8              | 0F053F00C000000108000000 |                   1 |
|        18 |           10 |           1 | 9              | 0F053F00C000000109000000 |                   1 |
+-----------+--------------+-------------+----------------+--------------------------+---------------------+
delete from oceanbase.__all_table_stat;
delete from oceanbase.__all_column_stat;
delete from oceanbase.__all_histogram_stat;
analyze table t0 compute statistics for columns a size 5, b size 10, c;
select object_type, row_cnt from oceanbase.__all_table_stat order by 1, 2;
+-------------+---------+
| object_type | row_cnt |
+-------------+---------+
|           1 |      10 |
+-------------+---------+
select column_id, object_type, min_value, max_value, distinct_cnt, sample_size, density, bucket_cnt, histogram_type from oceanbase.__all_column_stat order by 1, 2,3,4;
+-----------+-------------+-----------+-----------+--------------+-------------+---------+------------+----------------+
| column_id | object_type | min_value | max_value | distinct_cnt | sample_size | density | bucket_cnt | histogram_type |
+-----------+-------------+-----------+-----------+--------------+-------------+---------+------------+----------------+
|        16 |           1 | 0         | 9         |           10 |          10 |     0.1 |          5 |              4 |
|        17 |           1 | 0         | 9         |           10 |          10 |    0.05 |         10 |              1 |
|        18 |           1 | 0         | 9         |           10 |          10 |    0.05 |         10 |              1 |
+-----------+-------------+-----------+-----------+--------------+-------------+---------+------------+----------------+
select column_id, endpoint_num, object_type, endpoint_value, b_endpoint_value, endpoint_repeat_cnt from oceanbase.__all_histogram_stat order by 1, 2,3,4;
+-----------+--------------+-------------+----------------+--------------------------+---------------------+
| column_id | endpoint_num | object_type | endpoint_value | b_endpoint_value         | endpoint_repeat_cnt |
+-----------+--------------+-------------+----------------+--------------------------+---------------------+
|        16 |            1 |           1 | 0              | 0F053F0080000000         |                   1 |
|        16 |            4 |           1 | 3              | 0F053F00C000000103000000 |                   1 |
|        16 |            7 |           1 | 6              | 0F053F00C000000106000000 |                   1 |
|        16 |            9 |           1 | 8              | 0F053F00C000000108000000 |                   1 |
|        16 |           10 |           1 | 9              | 0F053F00C000000109000000 |                   1 |
|        17 |            1 |           1 | 0              | 0F053F0080000000         |                   1 |
|        17 |            2 |           1 | 1              | 0F053F00C000000101000000 |                   1 |
|        17 |            3 |           1 | 2              | 0F053F00C000000102000000 |                   1 |
|        17 |            4 |           1 | 3              | 0F053F00C000000103000000 |                   1 |
|        17 |            5 |           1 | 4              | 0F053F00C000000104000000 |                   1 |
|        17 |            6 |           1 | 5              | 0F053F00C000000105000000 |                   1 |
|        17 |            7 |           1 | 6              | 0F053F00C000000106000000 |                   1 |
|        17 |            8 |           1 | 7              | 0F053F00C000000107000000 |                   1 |
|        17 |            9 |           1 | 8              | 0F053F00C000000108000000 |                   1 |
|        17 |           10 |           1 | 9              | 0F053F00C000000109000000 |                   1 |
|        18 |            1 |           1 | 0              | 0F053F0080000000         |                   1 |
|        18 |            2 |           1 | 1              | 0F053F00C000000101000000 |                   1 |
|        18 |            3 |           1 | 2              | 0F053F00C000000102000000 |                   1 |
|        18 |            4 |           1 | 3              | 0F053F00C000000103000000 |                   1 |
|        18 |            5 |           1 | 4              | 0F053F00C000000104000000 |                   1 |
|        18 |            6 |           1 | 5              | 0F053F00C000000105000000 |                   1 |
|        18 |            7 |           1 | 6              | 0F053F00C000000106000000 |                   1 |
|        18 |            8 |           1 | 7              | 0F053F00C000000107000000 |                   1 |
|        18 |            9 |           1 | 8              | 0F053F00C000000108000000 |                   1 |
|        18 |           10 |           1 | 9              | 0F053F00C000000109000000 |                   1 |
+-----------+--------------+-------------+----------------+--------------------------+---------------------+
delete from oceanbase.__all_table_stat;
delete from oceanbase.__all_column_stat;
delete from oceanbase.__all_histogram_stat;
analyze table t0 compute statistics for all indexed columns;
select object_type, row_cnt from oceanbase.__all_table_stat order by 1, 2;
+-------------+---------+
| object_type | row_cnt |
+-------------+---------+
|           1 |      10 |
+-------------+---------+
select column_id, object_type, min_value, max_value, distinct_cnt, sample_size, density, bucket_cnt, histogram_type from oceanbase.__all_column_stat order by 1, 2,3,4;
+-----------+-------------+-----------+-----------+--------------+-------------+---------+------------+----------------+
| column_id | object_type | min_value | max_value | distinct_cnt | sample_size | density | bucket_cnt | histogram_type |
+-----------+-------------+-----------+-----------+--------------+-------------+---------+------------+----------------+
|        16 |           1 | 0         | 9         |           10 |          10 |    0.05 |         10 |              1 |
+-----------+-------------+-----------+-----------+--------------+-------------+---------+------------+----------------+
select column_id, endpoint_num, object_type, endpoint_value, b_endpoint_value, endpoint_repeat_cnt from oceanbase.__all_histogram_stat order by 1, 2,3,4;
+-----------+--------------+-------------+----------------+--------------------------+---------------------+
| column_id | endpoint_num | object_type | endpoint_value | b_endpoint_value         | endpoint_repeat_cnt |
+-----------+--------------+-------------+----------------+--------------------------+---------------------+
|        16 |            1 |           1 | 0              | 0F053F0080000000         |                   1 |
|        16 |            2 |           1 | 1              | 0F053F00C000000101000000 |                   1 |
|        16 |            3 |           1 | 2              | 0F053F00C000000102000000 |                   1 |
|        16 |            4 |           1 | 3              | 0F053F00C000000103000000 |                   1 |
|        16 |            5 |           1 | 4              | 0F053F00C000000104000000 |                   1 |
|        16 |            6 |           1 | 5              | 0F053F00C000000105000000 |                   1 |
|        16 |            7 |           1 | 6              | 0F053F00C000000106000000 |                   1 |
|        16 |            8 |           1 | 7              | 0F053F00C000000107000000 |                   1 |
|        16 |            9 |           1 | 8              | 0F053F00C000000108000000 |                   1 |
|        16 |           10 |           1 | 9              | 0F053F00C000000109000000 |                   1 |
+-----------+--------------+-------------+----------------+--------------------------+---------------------+
delete from oceanbase.__all_table_stat;
delete from oceanbase.__all_column_stat;
delete from oceanbase.__all_histogram_stat;
analyze table t0 compute statistics for all columns;
analyze table t0 compute statistics for all columns size 5;
select object_type, row_cnt from oceanbase.__all_table_stat order by 1, 2;
+-------------+---------+
| object_type | row_cnt |
+-------------+---------+
|           1 |      10 |
+-------------+---------+
select column_id, object_type, min_value, max_value, distinct_cnt, sample_size, density, bucket_cnt, histogram_type from oceanbase.__all_column_stat order by 1, 2,3,4;
+-----------+-------------+-----------+-----------+--------------+-------------+---------+------------+----------------+
| column_id | object_type | min_value | max_value | distinct_cnt | sample_size | density | bucket_cnt | histogram_type |
+-----------+-------------+-----------+-----------+--------------+-------------+---------+------------+----------------+
|        16 |           1 | 0         | 9         |           10 |          10 |     0.1 |          5 |              4 |
|        17 |           1 | 0         | 9         |           10 |          10 |     0.1 |          5 |              4 |
|        18 |           1 | 0         | 9         |           10 |          10 |     0.1 |          5 |              4 |
|        19 |           1 | 0         | 9         |           10 |          10 |     0.1 |          5 |              4 |
+-----------+-------------+-----------+-----------+--------------+-------------+---------+------------+----------------+
select column_id, endpoint_num, object_type, endpoint_value, b_endpoint_value, endpoint_repeat_cnt from oceanbase.__all_histogram_stat order by 1, 2,3,4;
+-----------+--------------+-------------+----------------+--------------------------+---------------------+
| column_id | endpoint_num | object_type | endpoint_value | b_endpoint_value         | endpoint_repeat_cnt |
+-----------+--------------+-------------+----------------+--------------------------+---------------------+
|        16 |            1 |           1 | 0              | 0F053F0080000000         |                   1 |
|        16 |            4 |           1 | 3              | 0F053F00C000000103000000 |                   1 |
|        16 |            7 |           1 | 6              | 0F053F00C000000106000000 |                   1 |
|        16 |            9 |           1 | 8              | 0F053F00C000000108000000 |                   1 |
|        16 |           10 |           1 | 9              | 0F053F00C000000109000000 |                   1 |
|        17 |            1 |           1 | 0              | 0F053F0080000000         |                   1 |
|        17 |            4 |           1 | 3              | 0F053F00C000000103000000 |                   1 |
|        17 |            7 |           1 | 6              | 0F053F00C000000106000000 |                   1 |
|        17 |            9 |           1 | 8              | 0F053F00C000000108000000 |                   1 |
|        17 |           10 |           1 | 9              | 0F053F00C000000109000000 |                   1 |
|        18 |            1 |           1 | 0              | 0F053F0080000000         |                   1 |
|        18 |            4 |           1 | 3              | 0F053F00C000000103000000 |                   1 |
|        18 |            7 |           1 | 6              | 0F053F00C000000106000000 |                   1 |
|        18 |            9 |           1 | 8              | 0F053F00C000000108000000 |                   1 |
|        18 |           10 |           1 | 9              | 0F053F00C000000109000000 |                   1 |
|        19 |            1 |           1 | 0              | 0F053F0080000000         |                   1 |
|        19 |            4 |           1 | 3              | 0F053F00C000000103000000 |                   1 |
|        19 |            7 |           1 | 6              | 0F053F00C000000106000000 |                   1 |
|        19 |            9 |           1 | 8              | 0F053F00C000000108000000 |                   1 |
|        19 |           10 |           1 | 9              | 0F053F00C000000109000000 |                   1 |
+-----------+--------------+-------------+----------------+--------------------------+---------------------+
delete from oceanbase.__all_table_stat;
delete from oceanbase.__all_column_stat;
delete from oceanbase.__all_histogram_stat;
analyze table t0 estimate statistics for all columns sample 100 rows;
select object_type, row_cnt from oceanbase.__all_table_stat order by 1, 2;
+-------------+---------+
| object_type | row_cnt |
+-------------+---------+
|           1 |      10 |
+-------------+---------+
select column_id, object_type, min_value, max_value, distinct_cnt, sample_size, density, bucket_cnt, histogram_type from oceanbase.__all_column_stat order by 1, 2,3,4;
+-----------+-------------+-----------+-----------+--------------+-------------+---------+------------+----------------+
| column_id | object_type | min_value | max_value | distinct_cnt | sample_size | density | bucket_cnt | histogram_type |
+-----------+-------------+-----------+-----------+--------------+-------------+---------+------------+----------------+
|        16 |           1 | 0         | 9         |           10 |          10 |    0.05 |         10 |              1 |
|        17 |           1 | 0         | 9         |           10 |          10 |    0.05 |         10 |              1 |
|        18 |           1 | 0         | 9         |           10 |          10 |    0.05 |         10 |              1 |
|        19 |           1 | 0         | 9         |           10 |          10 |    0.05 |         10 |              1 |
+-----------+-------------+-----------+-----------+--------------+-------------+---------+------------+----------------+
select column_id, endpoint_num, object_type, endpoint_value, b_endpoint_value, endpoint_repeat_cnt from oceanbase.__all_histogram_stat order by 1, 2,3,4;
+-----------+--------------+-------------+----------------+--------------------------+---------------------+
| column_id | endpoint_num | object_type | endpoint_value | b_endpoint_value         | endpoint_repeat_cnt |
+-----------+--------------+-------------+----------------+--------------------------+---------------------+
|        16 |            1 |           1 | 0              | 0F053F0080000000         |                   1 |
|        16 |            2 |           1 | 1              | 0F053F00C000000101000000 |                   1 |
|        16 |            3 |           1 | 2              | 0F053F00C000000102000000 |                   1 |
|        16 |            4 |           1 | 3              | 0F053F00C000000103000000 |                   1 |
|        16 |            5 |           1 | 4              | 0F053F00C000000104000000 |                   1 |
|        16 |            6 |           1 | 5              | 0F053F00C000000105000000 |                   1 |
|        16 |            7 |           1 | 6              | 0F053F00C000000106000000 |                   1 |
|        16 |            8 |           1 | 7              | 0F053F00C000000107000000 |                   1 |
|        16 |            9 |           1 | 8              | 0F053F00C000000108000000 |                   1 |
|        16 |           10 |           1 | 9              | 0F053F00C000000109000000 |                   1 |
|        17 |            1 |           1 | 0              | 0F053F0080000000         |                   1 |
|        17 |            2 |           1 | 1              | 0F053F00C000000101000000 |                   1 |
|        17 |            3 |           1 | 2              | 0F053F00C000000102000000 |                   1 |
|        17 |            4 |           1 | 3              | 0F053F00C000000103000000 |                   1 |
|        17 |            5 |           1 | 4              | 0F053F00C000000104000000 |                   1 |
|        17 |            6 |           1 | 5              | 0F053F00C000000105000000 |                   1 |
|        17 |            7 |           1 | 6              | 0F053F00C000000106000000 |                   1 |
|        17 |            8 |           1 | 7              | 0F053F00C000000107000000 |                   1 |
|        17 |            9 |           1 | 8              | 0F053F00C000000108000000 |                   1 |
|        17 |           10 |           1 | 9              | 0F053F00C000000109000000 |                   1 |
|        18 |            1 |           1 | 0              | 0F053F0080000000         |                   1 |
|        18 |            2 |           1 | 1              | 0F053F00C000000101000000 |                   1 |
|        18 |            3 |           1 | 2              | 0F053F00C000000102000000 |                   1 |
|        18 |            4 |           1 | 3              | 0F053F00C000000103000000 |                   1 |
|        18 |            5 |           1 | 4              | 0F053F00C000000104000000 |                   1 |
|        18 |            6 |           1 | 5              | 0F053F00C000000105000000 |                   1 |
|        18 |            7 |           1 | 6              | 0F053F00C000000106000000 |                   1 |
|        18 |            8 |           1 | 7              | 0F053F00C000000107000000 |                   1 |
|        18 |            9 |           1 | 8              | 0F053F00C000000108000000 |                   1 |
|        18 |           10 |           1 | 9              | 0F053F00C000000109000000 |                   1 |
|        19 |            1 |           1 | 0              | 0F053F0080000000         |                   1 |
|        19 |            2 |           1 | 1              | 0F053F00C000000101000000 |                   1 |
|        19 |            3 |           1 | 2              | 0F053F00C000000102000000 |                   1 |
|        19 |            4 |           1 | 3              | 0F053F00C000000103000000 |                   1 |
|        19 |            5 |           1 | 4              | 0F053F00C000000104000000 |                   1 |
|        19 |            6 |           1 | 5              | 0F053F00C000000105000000 |                   1 |
|        19 |            7 |           1 | 6              | 0F053F00C000000106000000 |                   1 |
|        19 |            8 |           1 | 7              | 0F053F00C000000107000000 |                   1 |
|        19 |            9 |           1 | 8              | 0F053F00C000000108000000 |                   1 |
|        19 |           10 |           1 | 9              | 0F053F00C000000109000000 |                   1 |
+-----------+--------------+-------------+----------------+--------------------------+---------------------+
delete from oceanbase.__all_table_stat;
delete from oceanbase.__all_column_stat;
delete from oceanbase.__all_histogram_stat;
analyze table t0 estimate statistics for all columns size 5 sample 100 rows;
select object_type, row_cnt from oceanbase.__all_table_stat order by 1, 2;
+-------------+---------+
| object_type | row_cnt |
+-------------+---------+
|           1 |      10 |
+-------------+---------+
select column_id, object_type, min_value, max_value, distinct_cnt, sample_size, density, bucket_cnt, histogram_type from oceanbase.__all_column_stat order by 1, 2,3,4;
+-----------+-------------+-----------+-----------+--------------+-------------+---------+------------+----------------+
| column_id | object_type | min_value | max_value | distinct_cnt | sample_size | density | bucket_cnt | histogram_type |
+-----------+-------------+-----------+-----------+--------------+-------------+---------+------------+----------------+
|        16 |           1 | 0         | 9         |           10 |          10 |     0.1 |          5 |              4 |
|        17 |           1 | 0         | 9         |           10 |          10 |     0.1 |          5 |              4 |
|        18 |           1 | 0         | 9         |           10 |          10 |     0.1 |          5 |              4 |
|        19 |           1 | 0         | 9         |           10 |          10 |     0.1 |          5 |              4 |
+-----------+-------------+-----------+-----------+--------------+-------------+---------+------------+----------------+
select column_id, endpoint_num, object_type, endpoint_value, b_endpoint_value, endpoint_repeat_cnt from oceanbase.__all_histogram_stat order by 1, 2,3,4;
+-----------+--------------+-------------+----------------+--------------------------+---------------------+
| column_id | endpoint_num | object_type | endpoint_value | b_endpoint_value         | endpoint_repeat_cnt |
+-----------+--------------+-------------+----------------+--------------------------+---------------------+
|        16 |            1 |           1 | 0              | 0F053F0080000000         |                   1 |
|        16 |            4 |           1 | 3              | 0F053F00C000000103000000 |                   1 |
|        16 |            7 |           1 | 6              | 0F053F00C000000106000000 |                   1 |
|        16 |            9 |           1 | 8              | 0F053F00C000000108000000 |                   1 |
|        16 |           10 |           1 | 9              | 0F053F00C000000109000000 |                   1 |
|        17 |            1 |           1 | 0              | 0F053F0080000000         |                   1 |
|        17 |            4 |           1 | 3              | 0F053F00C000000103000000 |                   1 |
|        17 |            7 |           1 | 6              | 0F053F00C000000106000000 |                   1 |
|        17 |            9 |           1 | 8              | 0F053F00C000000108000000 |                   1 |
|        17 |           10 |           1 | 9              | 0F053F00C000000109000000 |                   1 |
|        18 |            1 |           1 | 0              | 0F053F0080000000         |                   1 |
|        18 |            4 |           1 | 3              | 0F053F00C000000103000000 |                   1 |
|        18 |            7 |           1 | 6              | 0F053F00C000000106000000 |                   1 |
|        18 |            9 |           1 | 8              | 0F053F00C000000108000000 |                   1 |
|        18 |           10 |           1 | 9              | 0F053F00C000000109000000 |                   1 |
|        19 |            1 |           1 | 0              | 0F053F0080000000         |                   1 |
|        19 |            4 |           1 | 3              | 0F053F00C000000103000000 |                   1 |
|        19 |            7 |           1 | 6              | 0F053F00C000000106000000 |                   1 |
|        19 |            9 |           1 | 8              | 0F053F00C000000108000000 |                   1 |
|        19 |           10 |           1 | 9              | 0F053F00C000000109000000 |                   1 |
+-----------+--------------+-------------+----------------+--------------------------+---------------------+
delete from oceanbase.__all_table_stat;
delete from oceanbase.__all_column_stat;
delete from oceanbase.__all_histogram_stat;
analyze table t0 estimate statistics for all indexed columns sample 100 rows;
select object_type, row_cnt from oceanbase.__all_table_stat order by 1, 2;
+-------------+---------+
| object_type | row_cnt |
+-------------+---------+
|           1 |      10 |
+-------------+---------+
select column_id, object_type, min_value, max_value, distinct_cnt, sample_size, density, bucket_cnt, histogram_type from oceanbase.__all_column_stat order by 1, 2,3,4;
+-----------+-------------+-----------+-----------+--------------+-------------+---------+------------+----------------+
| column_id | object_type | min_value | max_value | distinct_cnt | sample_size | density | bucket_cnt | histogram_type |
+-----------+-------------+-----------+-----------+--------------+-------------+---------+------------+----------------+
|        16 |           1 | 0         | 9         |           10 |          10 |    0.05 |         10 |              1 |
+-----------+-------------+-----------+-----------+--------------+-------------+---------+------------+----------------+
select column_id, endpoint_num, object_type, endpoint_value, b_endpoint_value, endpoint_repeat_cnt from oceanbase.__all_histogram_stat order by 1, 2,3,4;
+-----------+--------------+-------------+----------------+--------------------------+---------------------+
| column_id | endpoint_num | object_type | endpoint_value | b_endpoint_value         | endpoint_repeat_cnt |
+-----------+--------------+-------------+----------------+--------------------------+---------------------+
|        16 |            1 |           1 | 0              | 0F053F0080000000         |                   1 |
|        16 |            2 |           1 | 1              | 0F053F00C000000101000000 |                   1 |
|        16 |            3 |           1 | 2              | 0F053F00C000000102000000 |                   1 |
|        16 |            4 |           1 | 3              | 0F053F00C000000103000000 |                   1 |
|        16 |            5 |           1 | 4              | 0F053F00C000000104000000 |                   1 |
|        16 |            6 |           1 | 5              | 0F053F00C000000105000000 |                   1 |
|        16 |            7 |           1 | 6              | 0F053F00C000000106000000 |                   1 |
|        16 |            8 |           1 | 7              | 0F053F00C000000107000000 |                   1 |
|        16 |            9 |           1 | 8              | 0F053F00C000000108000000 |                   1 |
|        16 |           10 |           1 | 9              | 0F053F00C000000109000000 |                   1 |
+-----------+--------------+-------------+----------------+--------------------------+---------------------+
delete from oceanbase.__all_table_stat;
delete from oceanbase.__all_column_stat;
delete from oceanbase.__all_histogram_stat;
analyze table t0 estimate statistics for all indexed columns size 5 sample 100 rows;
select object_type, row_cnt from oceanbase.__all_table_stat order by 1, 2;
+-------------+---------+
| object_type | row_cnt |
+-------------+---------+
|           1 |      10 |
+-------------+---------+
select column_id, object_type, min_value, max_value, distinct_cnt, sample_size, density, bucket_cnt, histogram_type from oceanbase.__all_column_stat order by 1, 2,3,4;
+-----------+-------------+-----------+-----------+--------------+-------------+---------+------------+----------------+
| column_id | object_type | min_value | max_value | distinct_cnt | sample_size | density | bucket_cnt | histogram_type |
+-----------+-------------+-----------+-----------+--------------+-------------+---------+------------+----------------+
|        16 |           1 | 0         | 9         |           10 |          10 |     0.1 |          5 |              4 |
+-----------+-------------+-----------+-----------+--------------+-------------+---------+------------+----------------+
select column_id, endpoint_num, object_type, endpoint_value, b_endpoint_value, endpoint_repeat_cnt from oceanbase.__all_histogram_stat order by 1, 2,3,4;
+-----------+--------------+-------------+----------------+--------------------------+---------------------+
| column_id | endpoint_num | object_type | endpoint_value | b_endpoint_value         | endpoint_repeat_cnt |
+-----------+--------------+-------------+----------------+--------------------------+---------------------+
|        16 |            1 |           1 | 0              | 0F053F0080000000         |                   1 |
|        16 |            4 |           1 | 3              | 0F053F00C000000103000000 |                   1 |
|        16 |            7 |           1 | 6              | 0F053F00C000000106000000 |                   1 |
|        16 |            9 |           1 | 8              | 0F053F00C000000108000000 |                   1 |
|        16 |           10 |           1 | 9              | 0F053F00C000000109000000 |                   1 |
+-----------+--------------+-------------+----------------+--------------------------+---------------------+
delete from oceanbase.__all_table_stat;
delete from oceanbase.__all_column_stat;
delete from oceanbase.__all_histogram_stat;
analyze table t0 estimate statistics for columns size 5 a, b, c sample 100 rows;
select object_type, row_cnt from oceanbase.__all_table_stat order by 1, 2;
+-------------+---------+
| object_type | row_cnt |
+-------------+---------+
|           1 |      10 |
+-------------+---------+
select column_id, object_type, min_value, max_value, distinct_cnt, sample_size, density, bucket_cnt, histogram_type from oceanbase.__all_column_stat order by 1, 2,3,4;
+-----------+-------------+-----------+-----------+--------------+-------------+---------+------------+----------------+
| column_id | object_type | min_value | max_value | distinct_cnt | sample_size | density | bucket_cnt | histogram_type |
+-----------+-------------+-----------+-----------+--------------+-------------+---------+------------+----------------+
|        16 |           1 | 0         | 9         |           10 |          10 |     0.1 |          5 |              4 |
|        17 |           1 | 0         | 9         |           10 |          10 |     0.1 |          5 |              4 |
|        18 |           1 | 0         | 9         |           10 |          10 |     0.1 |          5 |              4 |
+-----------+-------------+-----------+-----------+--------------+-------------+---------+------------+----------------+
select column_id, endpoint_num, object_type, endpoint_value, b_endpoint_value, endpoint_repeat_cnt from oceanbase.__all_histogram_stat order by 1, 2,3,4;
+-----------+--------------+-------------+----------------+--------------------------+---------------------+
| column_id | endpoint_num | object_type | endpoint_value | b_endpoint_value         | endpoint_repeat_cnt |
+-----------+--------------+-------------+----------------+--------------------------+---------------------+
|        16 |            1 |           1 | 0              | 0F053F0080000000         |                   1 |
|        16 |            4 |           1 | 3              | 0F053F00C000000103000000 |                   1 |
|        16 |            7 |           1 | 6              | 0F053F00C000000106000000 |                   1 |
|        16 |            9 |           1 | 8              | 0F053F00C000000108000000 |                   1 |
|        16 |           10 |           1 | 9              | 0F053F00C000000109000000 |                   1 |
|        17 |            1 |           1 | 0              | 0F053F0080000000         |                   1 |
|        17 |            4 |           1 | 3              | 0F053F00C000000103000000 |                   1 |
|        17 |            7 |           1 | 6              | 0F053F00C000000106000000 |                   1 |
|        17 |            9 |           1 | 8              | 0F053F00C000000108000000 |                   1 |
|        17 |           10 |           1 | 9              | 0F053F00C000000109000000 |                   1 |
|        18 |            1 |           1 | 0              | 0F053F0080000000         |                   1 |
|        18 |            4 |           1 | 3              | 0F053F00C000000103000000 |                   1 |
|        18 |            7 |           1 | 6              | 0F053F00C000000106000000 |                   1 |
|        18 |            9 |           1 | 8              | 0F053F00C000000108000000 |                   1 |
|        18 |           10 |           1 | 9              | 0F053F00C000000109000000 |                   1 |
+-----------+--------------+-------------+----------------+--------------------------+---------------------+
delete from oceanbase.__all_table_stat;
delete from oceanbase.__all_column_stat;
delete from oceanbase.__all_histogram_stat;
analyze table t0 estimate statistics for columns a size 5, b size 10, c sample 100 rows;
select object_type, row_cnt from oceanbase.__all_table_stat order by 1, 2;
+-------------+---------+
| object_type | row_cnt |
+-------------+---------+
|           1 |      10 |
+-------------+---------+
select column_id, object_type, min_value, max_value, distinct_cnt, sample_size, density, bucket_cnt, histogram_type from oceanbase.__all_column_stat order by 1, 2,3,4;
+-----------+-------------+-----------+-----------+--------------+-------------+---------+------------+----------------+
| column_id | object_type | min_value | max_value | distinct_cnt | sample_size | density | bucket_cnt | histogram_type |
+-----------+-------------+-----------+-----------+--------------+-------------+---------+------------+----------------+
|        16 |           1 | 0         | 9         |           10 |          10 |     0.1 |          5 |              4 |
|        17 |           1 | 0         | 9         |           10 |          10 |    0.05 |         10 |              1 |
|        18 |           1 | 0         | 9         |           10 |          10 |    0.05 |         10 |              1 |
+-----------+-------------+-----------+-----------+--------------+-------------+---------+------------+----------------+
select column_id, endpoint_num, object_type, endpoint_value, b_endpoint_value, endpoint_repeat_cnt from oceanbase.__all_histogram_stat order by 1, 2,3,4;
+-----------+--------------+-------------+----------------+--------------------------+---------------------+
| column_id | endpoint_num | object_type | endpoint_value | b_endpoint_value         | endpoint_repeat_cnt |
+-----------+--------------+-------------+----------------+--------------------------+---------------------+
|        16 |            1 |           1 | 0              | 0F053F0080000000         |                   1 |
|        16 |            4 |           1 | 3              | 0F053F00C000000103000000 |                   1 |
|        16 |            7 |           1 | 6              | 0F053F00C000000106000000 |                   1 |
|        16 |            9 |           1 | 8              | 0F053F00C000000108000000 |                   1 |
|        16 |           10 |           1 | 9              | 0F053F00C000000109000000 |                   1 |
|        17 |            1 |           1 | 0              | 0F053F0080000000         |                   1 |
|        17 |            2 |           1 | 1              | 0F053F00C000000101000000 |                   1 |
|        17 |            3 |           1 | 2              | 0F053F00C000000102000000 |                   1 |
|        17 |            4 |           1 | 3              | 0F053F00C000000103000000 |                   1 |
|        17 |            5 |           1 | 4              | 0F053F00C000000104000000 |                   1 |
|        17 |            6 |           1 | 5              | 0F053F00C000000105000000 |                   1 |
|        17 |            7 |           1 | 6              | 0F053F00C000000106000000 |                   1 |
|        17 |            8 |           1 | 7              | 0F053F00C000000107000000 |                   1 |
|        17 |            9 |           1 | 8              | 0F053F00C000000108000000 |                   1 |
|        17 |           10 |           1 | 9              | 0F053F00C000000109000000 |                   1 |
|        18 |            1 |           1 | 0              | 0F053F0080000000         |                   1 |
|        18 |            2 |           1 | 1              | 0F053F00C000000101000000 |                   1 |
|        18 |            3 |           1 | 2              | 0F053F00C000000102000000 |                   1 |
|        18 |            4 |           1 | 3              | 0F053F00C000000103000000 |                   1 |
|        18 |            5 |           1 | 4              | 0F053F00C000000104000000 |                   1 |
|        18 |            6 |           1 | 5              | 0F053F00C000000105000000 |                   1 |
|        18 |            7 |           1 | 6              | 0F053F00C000000106000000 |                   1 |
|        18 |            8 |           1 | 7              | 0F053F00C000000107000000 |                   1 |
|        18 |            9 |           1 | 8              | 0F053F00C000000108000000 |                   1 |
|        18 |           10 |           1 | 9              | 0F053F00C000000109000000 |                   1 |
+-----------+--------------+-------------+----------------+--------------------------+---------------------+
delete from oceanbase.__all_table_stat;
delete from oceanbase.__all_column_stat;
delete from oceanbase.__all_histogram_stat;
analyze table t0 estimate statistics for all indexed columns sample 100 rows;
select object_type, row_cnt from oceanbase.__all_table_stat order by 1, 2;
+-------------+---------+
| object_type | row_cnt |
+-------------+---------+
|           1 |      10 |
+-------------+---------+
select column_id, object_type, min_value, max_value, distinct_cnt, sample_size, density, bucket_cnt, histogram_type from oceanbase.__all_column_stat order by 1, 2,3,4;
+-----------+-------------+-----------+-----------+--------------+-------------+---------+------------+----------------+
| column_id | object_type | min_value | max_value | distinct_cnt | sample_size | density | bucket_cnt | histogram_type |
+-----------+-------------+-----------+-----------+--------------+-------------+---------+------------+----------------+
|        16 |           1 | 0         | 9         |           10 |          10 |    0.05 |         10 |              1 |
+-----------+-------------+-----------+-----------+--------------+-------------+---------+------------+----------------+
select column_id, endpoint_num, object_type, endpoint_value, b_endpoint_value, endpoint_repeat_cnt from oceanbase.__all_histogram_stat order by 1, 2,3,4;
+-----------+--------------+-------------+----------------+--------------------------+---------------------+
| column_id | endpoint_num | object_type | endpoint_value | b_endpoint_value         | endpoint_repeat_cnt |
+-----------+--------------+-------------+----------------+--------------------------+---------------------+
|        16 |            1 |           1 | 0              | 0F053F0080000000         |                   1 |
|        16 |            2 |           1 | 1              | 0F053F00C000000101000000 |                   1 |
|        16 |            3 |           1 | 2              | 0F053F00C000000102000000 |                   1 |
|        16 |            4 |           1 | 3              | 0F053F00C000000103000000 |                   1 |
|        16 |            5 |           1 | 4              | 0F053F00C000000104000000 |                   1 |
|        16 |            6 |           1 | 5              | 0F053F00C000000105000000 |                   1 |
|        16 |            7 |           1 | 6              | 0F053F00C000000106000000 |                   1 |
|        16 |            8 |           1 | 7              | 0F053F00C000000107000000 |                   1 |
|        16 |            9 |           1 | 8              | 0F053F00C000000108000000 |                   1 |
|        16 |           10 |           1 | 9              | 0F053F00C000000109000000 |                   1 |
+-----------+--------------+-------------+----------------+--------------------------+---------------------+
delete from oceanbase.__all_table_stat;
delete from oceanbase.__all_column_stat;
delete from oceanbase.__all_histogram_stat;
analyze table t0 estimate statistics for all columns sample 100 rows;
analyze table t0 estimate statistics for all columns size 5 sample 100 rows;
select object_type, row_cnt from oceanbase.__all_table_stat order by 1, 2;
+-------------+---------+
| object_type | row_cnt |
+-------------+---------+
|           1 |      10 |
+-------------+---------+
select column_id, object_type, min_value, max_value, distinct_cnt, sample_size, density, bucket_cnt, histogram_type from oceanbase.__all_column_stat order by 1, 2,3,4;
+-----------+-------------+-----------+-----------+--------------+-------------+---------+------------+----------------+
| column_id | object_type | min_value | max_value | distinct_cnt | sample_size | density | bucket_cnt | histogram_type |
+-----------+-------------+-----------+-----------+--------------+-------------+---------+------------+----------------+
|        16 |           1 | 0         | 9         |           10 |          10 |     0.1 |          5 |              4 |
|        17 |           1 | 0         | 9         |           10 |          10 |     0.1 |          5 |              4 |
|        18 |           1 | 0         | 9         |           10 |          10 |     0.1 |          5 |              4 |
|        19 |           1 | 0         | 9         |           10 |          10 |     0.1 |          5 |              4 |
+-----------+-------------+-----------+-----------+--------------+-------------+---------+------------+----------------+
select column_id, endpoint_num, object_type, endpoint_value, b_endpoint_value, endpoint_repeat_cnt from oceanbase.__all_histogram_stat order by 1, 2,3,4;
+-----------+--------------+-------------+----------------+--------------------------+---------------------+
| column_id | endpoint_num | object_type | endpoint_value | b_endpoint_value         | endpoint_repeat_cnt |
+-----------+--------------+-------------+----------------+--------------------------+---------------------+
|        16 |            1 |           1 | 0              | 0F053F0080000000         |                   1 |
|        16 |            4 |           1 | 3              | 0F053F00C000000103000000 |                   1 |
|        16 |            7 |           1 | 6              | 0F053F00C000000106000000 |                   1 |
|        16 |            9 |           1 | 8              | 0F053F00C000000108000000 |                   1 |
|        16 |           10 |           1 | 9              | 0F053F00C000000109000000 |                   1 |
|        17 |            1 |           1 | 0              | 0F053F0080000000         |                   1 |
|        17 |            4 |           1 | 3              | 0F053F00C000000103000000 |                   1 |
|        17 |            7 |           1 | 6              | 0F053F00C000000106000000 |                   1 |
|        17 |            9 |           1 | 8              | 0F053F00C000000108000000 |                   1 |
|        17 |           10 |           1 | 9              | 0F053F00C000000109000000 |                   1 |
|        18 |            1 |           1 | 0              | 0F053F0080000000         |                   1 |
|        18 |            4 |           1 | 3              | 0F053F00C000000103000000 |                   1 |
|        18 |            7 |           1 | 6              | 0F053F00C000000106000000 |                   1 |
|        18 |            9 |           1 | 8              | 0F053F00C000000108000000 |                   1 |
|        18 |           10 |           1 | 9              | 0F053F00C000000109000000 |                   1 |
|        19 |            1 |           1 | 0              | 0F053F0080000000         |                   1 |
|        19 |            4 |           1 | 3              | 0F053F00C000000103000000 |                   1 |
|        19 |            7 |           1 | 6              | 0F053F00C000000106000000 |                   1 |
|        19 |            9 |           1 | 8              | 0F053F00C000000108000000 |                   1 |
|        19 |           10 |           1 | 9              | 0F053F00C000000109000000 |                   1 |
+-----------+--------------+-------------+----------------+--------------------------+---------------------+
delete from oceanbase.__all_table_stat;
delete from oceanbase.__all_column_stat;
delete from oceanbase.__all_histogram_stat;
analyze table t1 compute statistics for all columns size 30;
select object_type, row_cnt from oceanbase.__all_table_stat order by 1, 2;
+-------------+---------+
| object_type | row_cnt |
+-------------+---------+
|           1 |    1000 |
+-------------+---------+
select column_id, object_type, min_value, max_value, distinct_cnt, sample_size, density, bucket_cnt, histogram_type from oceanbase.__all_column_stat order by 1, 2,3,4;
+-----------+-------------+-----------+-----------+--------------+-------------+-----------------------+------------+----------------+
| column_id | object_type | min_value | max_value | distinct_cnt | sample_size | density               | bucket_cnt | histogram_type |
+-----------+-------------+-----------+-----------+--------------+-------------+-----------------------+------------+----------------+
|        16 |           1 | 0         | 999       |         1031 |        1000 | 0.0009699321047526673 |         30 |              4 |
|        17 |           1 | 0         | 9         |           10 |        1000 |                0.0005 |         10 |              1 |
|        18 |           1 | 0         | 19        |           20 |        1000 |                0.0005 |         20 |              1 |
|        19 |           1 | 0         | 39        |           40 |        1000 |                 0.025 |         29 |              4 |
+-----------+-------------+-----------+-----------+--------------+-------------+-----------------------+------------+----------------+
select column_id, endpoint_num, object_type, endpoint_value, b_endpoint_value, endpoint_repeat_cnt from oceanbase.__all_histogram_stat order by 1, 2,3,4;
+-----------+--------------+-------------+----------------+--------------------------+---------------------+
| column_id | endpoint_num | object_type | endpoint_value | b_endpoint_value         | endpoint_repeat_cnt |
+-----------+--------------+-------------+----------------+--------------------------+---------------------+
|        16 |            1 |           1 | 0              | 0F053F0080000000         |                   1 |
|        16 |           36 |           1 | 35             | 0F053F00C000000123000000 |                   1 |
|        16 |           71 |           1 | 70             | 0F053F00C000000146000000 |                   1 |
|        16 |          106 |           1 | 105            | 0F053F00C000000169000000 |                   1 |
|        16 |          141 |           1 | 140            | 0F053F00C00000018C000000 |                   1 |
|        16 |          176 |           1 | 175            | 0F053F00C0000001AF000000 |                   1 |
|        16 |          211 |           1 | 210            | 0F053F00C0000001D2000000 |                   1 |
|        16 |          246 |           1 | 245            | 0F053F00C0000001F5000000 |                   1 |
|        16 |          281 |           1 | 280            | 0F053F00C000000118010000 |                   1 |
|        16 |          316 |           1 | 315            | 0F053F00C00000013B010000 |                   1 |
|        16 |          351 |           1 | 350            | 0F053F00C00000015E010000 |                   1 |
|        16 |          386 |           1 | 385            | 0F053F00C000000181010000 |                   1 |
|        16 |          421 |           1 | 420            | 0F053F00C0000001A4010000 |                   1 |
|        16 |          456 |           1 | 455            | 0F053F00C0000001C7010000 |                   1 |
|        16 |          491 |           1 | 490            | 0F053F00C0000001EA010000 |                   1 |
|        16 |          525 |           1 | 524            | 0F053F00C00000010C020000 |                   1 |
|        16 |          559 |           1 | 558            | 0F053F00C00000012E020000 |                   1 |
|        16 |          593 |           1 | 592            | 0F053F00C000000150020000 |                   1 |
|        16 |          627 |           1 | 626            | 0F053F00C000000172020000 |                   1 |
|        16 |          661 |           1 | 660            | 0F053F00C000000194020000 |                   1 |
|        16 |          695 |           1 | 694            | 0F053F00C0000001B6020000 |                   1 |
|        16 |          729 |           1 | 728            | 0F053F00C0000001D8020000 |                   1 |
|        16 |          763 |           1 | 762            | 0F053F00C0000001FA020000 |                   1 |
|        16 |          797 |           1 | 796            | 0F053F00C00000011C030000 |                   1 |
|        16 |          831 |           1 | 830            | 0F053F00C00000013E030000 |                   1 |
|        16 |          865 |           1 | 864            | 0F053F00C000000160030000 |                   1 |
|        16 |          899 |           1 | 898            | 0F053F00C000000182030000 |                   1 |
|        16 |          933 |           1 | 932            | 0F053F00C0000001A4030000 |                   1 |
|        16 |          967 |           1 | 966            | 0F053F00C0000001C6030000 |                   1 |
|        16 |         1000 |           1 | 999            | 0F053F00C0000001E7030000 |                   1 |
|        17 |          100 |           1 | 0              | 0F053F0080000000         |                 100 |
|        17 |          200 |           1 | 1              | 0F053F00C000000101000000 |                 100 |
|        17 |          300 |           1 | 2              | 0F053F00C000000102000000 |                 100 |
|        17 |          400 |           1 | 3              | 0F053F00C000000103000000 |                 100 |
|        17 |          500 |           1 | 4              | 0F053F00C000000104000000 |                 100 |
|        17 |          600 |           1 | 5              | 0F053F00C000000105000000 |                 100 |
|        17 |          700 |           1 | 6              | 0F053F00C000000106000000 |                 100 |
|        17 |          800 |           1 | 7              | 0F053F00C000000107000000 |                 100 |
|        17 |          900 |           1 | 8              | 0F053F00C000000108000000 |                 100 |
|        17 |         1000 |           1 | 9              | 0F053F00C000000109000000 |                 100 |
|        18 |           50 |           1 | 0              | 0F053F0080000000         |                  50 |
|        18 |          100 |           1 | 1              | 0F053F00C000000101000000 |                  50 |
|        18 |          150 |           1 | 2              | 0F053F00C000000102000000 |                  50 |
|        18 |          200 |           1 | 3              | 0F053F00C000000103000000 |                  50 |
|        18 |          250 |           1 | 4              | 0F053F00C000000104000000 |                  50 |
|        18 |          300 |           1 | 5              | 0F053F00C000000105000000 |                  50 |
|        18 |          350 |           1 | 6              | 0F053F00C000000106000000 |                  50 |
|        18 |          400 |           1 | 7              | 0F053F00C000000107000000 |                  50 |
|        18 |          450 |           1 | 8              | 0F053F00C000000108000000 |                  50 |
|        18 |          500 |           1 | 9              | 0F053F00C000000109000000 |                  50 |
|        18 |          550 |           1 | 10             | 0F053F00C00000010A000000 |                  50 |
|        18 |          600 |           1 | 11             | 0F053F00C00000010B000000 |                  50 |
|        18 |          650 |           1 | 12             | 0F053F00C00000010C000000 |                  50 |
|        18 |          700 |           1 | 13             | 0F053F00C00000010D000000 |                  50 |
|        18 |          750 |           1 | 14             | 0F053F00C00000010E000000 |                  50 |
|        18 |          800 |           1 | 15             | 0F053F00C00000010F000000 |                  50 |
|        18 |          850 |           1 | 16             | 0F053F00C000000110000000 |                  50 |
|        18 |          900 |           1 | 17             | 0F053F00C000000111000000 |                  50 |
|        18 |          950 |           1 | 18             | 0F053F00C000000112000000 |                  50 |
|        18 |         1000 |           1 | 19             | 0F053F00C000000113000000 |                  50 |
|        19 |           25 |           1 | 0              | 0F053F0080000000         |                  25 |
|        19 |           75 |           1 | 2              | 0F053F00C000000102000000 |                  25 |
|        19 |          125 |           1 | 4              | 0F053F00C000000104000000 |                  25 |
|        19 |          175 |           1 | 6              | 0F053F00C000000106000000 |                  25 |
|        19 |          225 |           1 | 8              | 0F053F00C000000108000000 |                  25 |
|        19 |          275 |           1 | 10             | 0F053F00C00000010A000000 |                  25 |
|        19 |          325 |           1 | 12             | 0F053F00C00000010C000000 |                  25 |
|        19 |          375 |           1 | 14             | 0F053F00C00000010E000000 |                  25 |
|        19 |          425 |           1 | 16             | 0F053F00C000000110000000 |                  25 |
|        19 |          475 |           1 | 18             | 0F053F00C000000112000000 |                  25 |
|        19 |          525 |           1 | 20             | 0F053F00C000000114000000 |                  25 |
|        19 |          575 |           1 | 22             | 0F053F00C000000116000000 |                  25 |
|        19 |          600 |           1 | 23             | 0F053F00C000000117000000 |                  25 |
|        19 |          625 |           1 | 24             | 0F053F00C000000118000000 |                  25 |
|        19 |          650 |           1 | 25             | 0F053F00C000000119000000 |                  25 |
|        19 |          675 |           1 | 26             | 0F053F00C00000011A000000 |                  25 |
|        19 |          700 |           1 | 27             | 0F053F00C00000011B000000 |                  25 |
|        19 |          725 |           1 | 28             | 0F053F00C00000011C000000 |                  25 |
|        19 |          750 |           1 | 29             | 0F053F00C00000011D000000 |                  25 |
|        19 |          775 |           1 | 30             | 0F053F00C00000011E000000 |                  25 |
|        19 |          800 |           1 | 31             | 0F053F00C00000011F000000 |                  25 |
|        19 |          825 |           1 | 32             | 0F053F00C000000120000000 |                  25 |
|        19 |          850 |           1 | 33             | 0F053F00C000000121000000 |                  25 |
|        19 |          875 |           1 | 34             | 0F053F00C000000122000000 |                  25 |
|        19 |          900 |           1 | 35             | 0F053F00C000000123000000 |                  25 |
|        19 |          925 |           1 | 36             | 0F053F00C000000124000000 |                  25 |
|        19 |          950 |           1 | 37             | 0F053F00C000000125000000 |                  25 |
|        19 |          975 |           1 | 38             | 0F053F00C000000126000000 |                  25 |
|        19 |         1000 |           1 | 39             | 0F053F00C000000127000000 |                  25 |
+-----------+--------------+-------------+----------------+--------------------------+---------------------+
delete from oceanbase.__all_table_stat;
delete from oceanbase.__all_column_stat;
delete from oceanbase.__all_histogram_stat;
analyze table t2 compute statistics for all columns size 30;
select object_type, row_cnt from oceanbase.__all_table_stat order by 1, 2;
+-------------+---------+
| object_type | row_cnt |
+-------------+---------+
|           1 |    1000 |
|           2 |     498 |
|           2 |     502 |
+-------------+---------+
select column_id, object_type, min_value, max_value, distinct_cnt, sample_size, density, bucket_cnt, histogram_type from oceanbase.__all_column_stat order by 1, 2,3,4;
+-----------+-------------+-----------+-----------+--------------+-------------+-----------------------+------------+----------------+
| column_id | object_type | min_value | max_value | distinct_cnt | sample_size | density               | bucket_cnt | histogram_type |
+-----------+-------------+-----------+-----------+--------------+-------------+-----------------------+------------+----------------+
|        16 |           1 | 0         | 999       |         1031 |        1000 | 0.0009699321047526673 |         30 |              4 |
|        16 |           2 | 0         | 998       |          517 |         498 | 0.0019342359767891683 |         30 |              4 |
|        16 |           2 | 2         | 999       |          512 |         502 |           0.001953125 |         30 |              4 |
|        17 |           1 | 0         | 9         |           10 |        1000 |                0.0005 |         10 |              1 |
|        17 |           2 | 0         | 9         |           10 |         498 |  0.001004016064257028 |         10 |              1 |
|        17 |           2 | 0         | 9         |           10 |         502 |   0.00099601593625498 |         10 |              1 |
|        18 |           1 | 0         | 19        |           20 |        1000 |                0.0005 |         20 |              1 |
|        18 |           2 | 0         | 19        |           20 |         498 |  0.001004016064257028 |         20 |              1 |
|        18 |           2 | 0         | 19        |           20 |         502 |   0.00099601593625498 |         20 |              1 |
|        19 |           1 | 0         | 39        |           40 |        1000 |                 0.025 |         29 |              4 |
|        19 |           2 | 0         | 39        |           40 |         498 |  0.024519129148171635 |         28 |              4 |
|        19 |           2 | 0         | 39        |           40 |         502 |   0.02417357596640465 |         27 |              4 |
+-----------+-------------+-----------+-----------+--------------+-------------+-----------------------+------------+----------------+
select column_id, endpoint_num, object_type, endpoint_value, b_endpoint_value, endpoint_repeat_cnt from oceanbase.__all_histogram_stat order by 1, 2,3,4;
+-----------+--------------+-------------+----------------+--------------------------+---------------------+
| column_id | endpoint_num | object_type | endpoint_value | b_endpoint_value         | endpoint_repeat_cnt |
+-----------+--------------+-------------+----------------+--------------------------+---------------------+
|        16 |            1 |           1 | 0              | 0F053F0080000000         |                   1 |
|        16 |            1 |           2 | 0              | 0F053F0080000000         |                   1 |
|        16 |            1 |           2 | 2              | 0F053F00C000000102000000 |                   1 |
|        16 |           19 |           2 | 34             | 0F053F00C000000122000000 |                   1 |
|        16 |           19 |           2 | 42             | 0F053F00C00000012A000000 |                   1 |
|        16 |           36 |           1 | 35             | 0F053F00C000000123000000 |                   1 |
|        16 |           37 |           2 | 72             | 0F053F00C000000148000000 |                   1 |
|        16 |           37 |           2 | 75             | 0F053F00C00000014B000000 |                   1 |
|        16 |           55 |           2 | 100            | 0F053F00C000000164000000 |                   1 |
|        16 |           55 |           2 | 116            | 0F053F00C000000174000000 |                   1 |
|        16 |           71 |           1 | 70             | 0F053F00C000000146000000 |                   1 |
|        16 |           73 |           2 | 136            | 0F053F00C000000188000000 |                   1 |
|        16 |           73 |           2 | 159            | 0F053F00C00000019F000000 |                   1 |
|        16 |           91 |           2 | 164            | 0F053F00C0000001A4000000 |                   1 |
|        16 |           91 |           2 | 195            | 0F053F00C0000001C3000000 |                   1 |
|        16 |          106 |           1 | 105            | 0F053F00C000000169000000 |                   1 |
|        16 |          108 |           2 | 202            | 0F053F00C0000001CA000000 |                   1 |
|        16 |          109 |           2 | 231            | 0F053F00C0000001E7000000 |                   1 |
|        16 |          125 |           2 | 233            | 0F053F00C0000001E9000000 |                   1 |
|        16 |          127 |           2 | 262            | 0F053F00C000000106010000 |                   1 |
|        16 |          141 |           1 | 140            | 0F053F00C00000018C000000 |                   1 |
|        16 |          142 |           2 | 273            | 0F053F00C000000111010000 |                   1 |
|        16 |          145 |           2 | 298            | 0F053F00C00000012A010000 |                   1 |
|        16 |          159 |           2 | 310            | 0F053F00C000000136010000 |                   1 |
|        16 |          163 |           2 | 329            | 0F053F00C000000149010000 |                   1 |
|        16 |          176 |           1 | 175            | 0F053F00C0000001AF000000 |                   1 |
|        16 |          176 |           2 | 351            | 0F053F00C00000015F010000 |                   1 |
|        16 |          180 |           2 | 363            | 0F053F00C00000016B010000 |                   1 |
|        16 |          193 |           2 | 384            | 0F053F00C000000180010000 |                   1 |
|        16 |          197 |           2 | 394            | 0F053F00C00000018A010000 |                   1 |
|        16 |          210 |           2 | 425            | 0F053F00C0000001A9010000 |                   1 |
|        16 |          211 |           1 | 210            | 0F053F00C0000001D2000000 |                   1 |
|        16 |          214 |           2 | 420            | 0F053F00C0000001A4010000 |                   1 |
|        16 |          227 |           2 | 452            | 0F053F00C0000001C4010000 |                   1 |
|        16 |          231 |           2 | 464            | 0F053F00C0000001D0010000 |                   1 |
|        16 |          244 |           2 | 484            | 0F053F00C0000001E4010000 |                   1 |
|        16 |          246 |           1 | 245            | 0F053F00C0000001F5000000 |                   1 |
|        16 |          248 |           2 | 496            | 0F053F00C0000001F0010000 |                   1 |
|        16 |          261 |           2 | 519            | 0F053F00C000000107020000 |                   1 |
|        16 |          265 |           2 | 533            | 0F053F00C000000115020000 |                   1 |
|        16 |          278 |           2 | 553            | 0F053F00C000000129020000 |                   1 |
|        16 |          281 |           1 | 280            | 0F053F00C000000118010000 |                   1 |
|        16 |          282 |           2 | 566            | 0F053F00C000000136020000 |                   1 |
|        16 |          295 |           2 | 584            | 0F053F00C000000148020000 |                   1 |
|        16 |          299 |           2 | 597            | 0F053F00C000000155020000 |                   1 |
|        16 |          312 |           2 | 620            | 0F053F00C00000016C020000 |                   1 |
|        16 |          316 |           1 | 315            | 0F053F00C00000013B010000 |                   1 |
|        16 |          316 |           2 | 633            | 0F053F00C000000179020000 |                   1 |
|        16 |          329 |           2 | 649            | 0F053F00C000000189020000 |                   1 |
|        16 |          333 |           2 | 673            | 0F053F00C0000001A1020000 |                   1 |
|        16 |          346 |           2 | 691            | 0F053F00C0000001B3020000 |                   1 |
|        16 |          350 |           2 | 697            | 0F053F00C0000001B9020000 |                   1 |
|        16 |          351 |           1 | 350            | 0F053F00C00000015E010000 |                   1 |
|        16 |          363 |           2 | 727            | 0F053F00C0000001D7020000 |                   1 |
|        16 |          367 |           2 | 737            | 0F053F00C0000001E1020000 |                   1 |
|        16 |          380 |           2 | 753            | 0F053F00C0000001F1020000 |                   1 |
|        16 |          384 |           2 | 772            | 0F053F00C000000104030000 |                   1 |
|        16 |          386 |           1 | 385            | 0F053F00C000000181010000 |                   1 |
|        16 |          397 |           2 | 790            | 0F053F00C000000116030000 |                   1 |
|        16 |          401 |           2 | 798            | 0F053F00C00000011E030000 |                   1 |
|        16 |          414 |           2 | 838            | 0F053F00C000000146030000 |                   1 |
|        16 |          418 |           2 | 828            | 0F053F00C00000013C030000 |                   1 |
|        16 |          421 |           1 | 420            | 0F053F00C0000001A4010000 |                   1 |
|        16 |          431 |           2 | 861            | 0F053F00C00000015D030000 |                   1 |
|        16 |          435 |           2 | 867            | 0F053F00C000000163030000 |                   1 |
|        16 |          448 |           2 | 898            | 0F053F00C000000182030000 |                   1 |
|        16 |          452 |           2 | 899            | 0F053F00C000000183030000 |                   1 |
|        16 |          456 |           1 | 455            | 0F053F00C0000001C7010000 |                   1 |
|        16 |          465 |           2 | 941            | 0F053F00C0000001AD030000 |                   1 |
|        16 |          469 |           2 | 929            | 0F053F00C0000001A1030000 |                   1 |
|        16 |          482 |           2 | 971            | 0F053F00C0000001CB030000 |                   1 |
|        16 |          486 |           2 | 962            | 0F053F00C0000001C2030000 |                   1 |
|        16 |          491 |           1 | 490            | 0F053F00C0000001EA010000 |                   1 |
|        16 |          498 |           2 | 998            | 0F053F00C0000001E6030000 |                   1 |
|        16 |          502 |           2 | 999            | 0F053F00C0000001E7030000 |                   1 |
|        16 |          525 |           1 | 524            | 0F053F00C00000010C020000 |                   1 |
|        16 |          559 |           1 | 558            | 0F053F00C00000012E020000 |                   1 |
|        16 |          593 |           1 | 592            | 0F053F00C000000150020000 |                   1 |
|        16 |          627 |           1 | 626            | 0F053F00C000000172020000 |                   1 |
|        16 |          661 |           1 | 660            | 0F053F00C000000194020000 |                   1 |
|        16 |          695 |           1 | 694            | 0F053F00C0000001B6020000 |                   1 |
|        16 |          729 |           1 | 728            | 0F053F00C0000001D8020000 |                   1 |
|        16 |          763 |           1 | 762            | 0F053F00C0000001FA020000 |                   1 |
|        16 |          797 |           1 | 796            | 0F053F00C00000011C030000 |                   1 |
|        16 |          831 |           1 | 830            | 0F053F00C00000013E030000 |                   1 |
|        16 |          865 |           1 | 864            | 0F053F00C000000160030000 |                   1 |
|        16 |          899 |           1 | 898            | 0F053F00C000000182030000 |                   1 |
|        16 |          933 |           1 | 932            | 0F053F00C0000001A4030000 |                   1 |
|        16 |          967 |           1 | 966            | 0F053F00C0000001C6030000 |                   1 |
|        16 |         1000 |           1 | 999            | 0F053F00C0000001E7030000 |                   1 |
|        17 |           47 |           2 | 0              | 0F053F0080000000         |                  47 |
|        17 |           53 |           2 | 0              | 0F053F0080000000         |                  53 |
|        17 |           93 |           2 | 1              | 0F053F00C000000101000000 |                  46 |
|        17 |          100 |           1 | 0              | 0F053F0080000000         |                 100 |
|        17 |          107 |           2 | 1              | 0F053F00C000000101000000 |                  54 |
|        17 |          141 |           2 | 2              | 0F053F00C000000102000000 |                  48 |
|        17 |          159 |           2 | 2              | 0F053F00C000000102000000 |                  52 |
|        17 |          199 |           2 | 3              | 0F053F00C000000103000000 |                  40 |
|        17 |          200 |           1 | 1              | 0F053F00C000000101000000 |                 100 |
|        17 |          201 |           2 | 3              | 0F053F00C000000103000000 |                  60 |
|        17 |          245 |           2 | 4              | 0F053F00C000000104000000 |                  44 |
|        17 |          255 |           2 | 4              | 0F053F00C000000104000000 |                  56 |
|        17 |          294 |           2 | 5              | 0F053F00C000000105000000 |                  49 |
|        17 |          300 |           1 | 2              | 0F053F00C000000102000000 |                 100 |
|        17 |          306 |           2 | 5              | 0F053F00C000000105000000 |                  51 |
|        17 |          343 |           2 | 6              | 0F053F00C000000106000000 |                  49 |
|        17 |          357 |           2 | 6              | 0F053F00C000000106000000 |                  51 |
|        17 |          398 |           2 | 7              | 0F053F00C000000107000000 |                  55 |
|        17 |          400 |           1 | 3              | 0F053F00C000000103000000 |                 100 |
|        17 |          402 |           2 | 7              | 0F053F00C000000107000000 |                  45 |
|        17 |          445 |           2 | 8              | 0F053F00C000000108000000 |                  43 |
|        17 |          455 |           2 | 8              | 0F053F00C000000108000000 |                  57 |
|        17 |          498 |           2 | 9              | 0F053F00C000000109000000 |                  53 |
|        17 |          500 |           1 | 4              | 0F053F00C000000104000000 |                 100 |
|        17 |          502 |           2 | 9              | 0F053F00C000000109000000 |                  47 |
|        17 |          600 |           1 | 5              | 0F053F00C000000105000000 |                 100 |
|        17 |          700 |           1 | 6              | 0F053F00C000000106000000 |                 100 |
|        17 |          800 |           1 | 7              | 0F053F00C000000107000000 |                 100 |
|        17 |          900 |           1 | 8              | 0F053F00C000000108000000 |                 100 |
|        17 |         1000 |           1 | 9              | 0F053F00C000000109000000 |                 100 |
|        18 |           23 |           2 | 0              | 0F053F0080000000         |                  23 |
|        18 |           27 |           2 | 0              | 0F053F0080000000         |                  27 |
|        18 |           49 |           2 | 1              | 0F053F00C000000101000000 |                  22 |
|        18 |           50 |           1 | 0              | 0F053F0080000000         |                  50 |
|        18 |           51 |           2 | 1              | 0F053F00C000000101000000 |                  28 |
|        18 |           74 |           2 | 2              | 0F053F00C000000102000000 |                  25 |
|        18 |           76 |           2 | 2              | 0F053F00C000000102000000 |                  25 |
|        18 |           93 |           2 | 3              | 0F053F00C000000103000000 |                  19 |
|        18 |          100 |           1 | 1              | 0F053F00C000000101000000 |                  50 |
|        18 |          107 |           2 | 3              | 0F053F00C000000103000000 |                  31 |
|        18 |          122 |           2 | 4              | 0F053F00C000000104000000 |                  29 |
|        18 |          128 |           2 | 4              | 0F053F00C000000104000000 |                  21 |
|        18 |          145 |           2 | 5              | 0F053F00C000000105000000 |                  23 |
|        18 |          150 |           1 | 2              | 0F053F00C000000102000000 |                  50 |
|        18 |          155 |           2 | 5              | 0F053F00C000000105000000 |                  27 |
|        18 |          170 |           2 | 6              | 0F053F00C000000106000000 |                  25 |
|        18 |          180 |           2 | 6              | 0F053F00C000000106000000 |                  25 |
|        18 |          196 |           2 | 7              | 0F053F00C000000107000000 |                  26 |
|        18 |          200 |           1 | 3              | 0F053F00C000000103000000 |                  50 |
|        18 |          204 |           2 | 7              | 0F053F00C000000107000000 |                  24 |
|        18 |          218 |           2 | 8              | 0F053F00C000000108000000 |                  22 |
|        18 |          232 |           2 | 8              | 0F053F00C000000108000000 |                  28 |
|        18 |          244 |           2 | 9              | 0F053F00C000000109000000 |                  26 |
|        18 |          250 |           1 | 4              | 0F053F00C000000104000000 |                  50 |
|        18 |          256 |           2 | 9              | 0F053F00C000000109000000 |                  24 |
|        18 |          270 |           2 | 10             | 0F053F00C00000010A000000 |                  26 |
|        18 |          280 |           2 | 10             | 0F053F00C00000010A000000 |                  24 |
|        18 |          298 |           2 | 11             | 0F053F00C00000010B000000 |                  18 |
|        18 |          300 |           1 | 5              | 0F053F00C000000105000000 |                  50 |
|        18 |          302 |           2 | 11             | 0F053F00C00000010B000000 |                  32 |
|        18 |          321 |           2 | 12             | 0F053F00C00000010C000000 |                  23 |
|        18 |          329 |           2 | 12             | 0F053F00C00000010C000000 |                  27 |
|        18 |          350 |           1 | 6              | 0F053F00C000000106000000 |                  50 |
|        18 |          350 |           2 | 13             | 0F053F00C00000010D000000 |                  21 |
|        18 |          350 |           2 | 13             | 0F053F00C00000010D000000 |                  29 |
|        18 |          373 |           2 | 14             | 0F053F00C00000010E000000 |                  23 |
|        18 |          377 |           2 | 14             | 0F053F00C00000010E000000 |                  27 |
|        18 |          395 |           2 | 15             | 0F053F00C00000010F000000 |                  22 |
|        18 |          400 |           1 | 7              | 0F053F00C000000107000000 |                  50 |
|        18 |          405 |           2 | 15             | 0F053F00C00000010F000000 |                  28 |
|        18 |          419 |           2 | 16             | 0F053F00C000000110000000 |                  24 |
|        18 |          431 |           2 | 16             | 0F053F00C000000110000000 |                  26 |
|        18 |          450 |           1 | 8              | 0F053F00C000000108000000 |                  50 |
|        18 |          450 |           2 | 17             | 0F053F00C000000111000000 |                  19 |
|        18 |          450 |           2 | 17             | 0F053F00C000000111000000 |                  31 |
|        18 |          471 |           2 | 18             | 0F053F00C000000112000000 |                  21 |
|        18 |          479 |           2 | 18             | 0F053F00C000000112000000 |                  29 |
|        18 |          498 |           2 | 19             | 0F053F00C000000113000000 |                  27 |
|        18 |          500 |           1 | 9              | 0F053F00C000000109000000 |                  50 |
|        18 |          502 |           2 | 19             | 0F053F00C000000113000000 |                  23 |
|        18 |          550 |           1 | 10             | 0F053F00C00000010A000000 |                  50 |
|        18 |          600 |           1 | 11             | 0F053F00C00000010B000000 |                  50 |
|        18 |          650 |           1 | 12             | 0F053F00C00000010C000000 |                  50 |
|        18 |          700 |           1 | 13             | 0F053F00C00000010D000000 |                  50 |
|        18 |          750 |           1 | 14             | 0F053F00C00000010E000000 |                  50 |
|        18 |          800 |           1 | 15             | 0F053F00C00000010F000000 |                  50 |
|        18 |          850 |           1 | 16             | 0F053F00C000000110000000 |                  50 |
|        18 |          900 |           1 | 17             | 0F053F00C000000111000000 |                  50 |
|        18 |          950 |           1 | 18             | 0F053F00C000000112000000 |                  50 |
|        18 |         1000 |           1 | 19             | 0F053F00C000000113000000 |                  50 |
|        19 |           12 |           2 | 0              | 0F053F0080000000         |                  12 |
|        19 |           13 |           2 | 0              | 0F053F0080000000         |                  13 |
|        19 |           25 |           1 | 0              | 0F053F0080000000         |                  25 |
|        19 |           37 |           2 | 2              | 0F053F00C000000102000000 |                  14 |
|        19 |           38 |           2 | 2              | 0F053F00C000000102000000 |                  11 |
|        19 |           55 |           2 | 3              | 0F053F00C000000103000000 |                  17 |
|        19 |           59 |           2 | 4              | 0F053F00C000000104000000 |                  14 |
|        19 |           75 |           1 | 2              | 0F053F00C000000102000000 |                  25 |
|        19 |           79 |           2 | 5              | 0F053F00C000000105000000 |                  13 |
|        19 |           84 |           2 | 6              | 0F053F00C000000106000000 |                  13 |
|        19 |          101 |           2 | 7              | 0F053F00C000000107000000 |                  10 |
|        19 |          108 |           2 | 8              | 0F053F00C000000108000000 |                   9 |
|        19 |          117 |           2 | 8              | 0F053F00C000000108000000 |                  16 |
|        19 |          125 |           1 | 4              | 0F053F00C000000104000000 |                  25 |
|        19 |          133 |           2 | 10             | 0F053F00C00000010A000000 |                  10 |
|        19 |          142 |           2 | 10             | 0F053F00C00000010A000000 |                  15 |
|        19 |          150 |           2 | 11             | 0F053F00C00000010B000000 |                  17 |
|        19 |          161 |           2 | 12             | 0F053F00C00000010C000000 |                  11 |
|        19 |          172 |           2 | 13             | 0F053F00C00000010D000000 |                   8 |
|        19 |          175 |           1 | 6              | 0F053F00C000000106000000 |                  25 |
|        19 |          178 |           2 | 13             | 0F053F00C00000010D000000 |                  17 |
|        19 |          187 |           2 | 14             | 0F053F00C00000010E000000 |                  15 |
|        19 |          202 |           2 | 15             | 0F053F00C00000010F000000 |                  14 |
|        19 |          213 |           2 | 16             | 0F053F00C000000110000000 |                  15 |
|        19 |          225 |           1 | 8              | 0F053F00C000000108000000 |                  25 |
|        19 |          230 |           2 | 18             | 0F053F00C000000112000000 |                  11 |
|        19 |          231 |           2 | 17             | 0F053F00C000000111000000 |                  19 |
|        19 |          245 |           2 | 19             | 0F053F00C000000113000000 |                  15 |
|        19 |          255 |           2 | 19             | 0F053F00C000000113000000 |                  10 |
|        19 |          260 |           2 | 20             | 0F053F00C000000114000000 |                  15 |
|        19 |          275 |           1 | 10             | 0F053F00C00000010A000000 |                  25 |
|        19 |          279 |           2 | 21             | 0F053F00C000000115000000 |                  14 |
|        19 |          282 |           2 | 22             | 0F053F00C000000116000000 |                  11 |
|        19 |          293 |           2 | 22             | 0F053F00C000000116000000 |                  14 |
|        19 |          307 |           2 | 23             | 0F053F00C000000117000000 |                  14 |
|        19 |          308 |           2 | 24             | 0F053F00C000000118000000 |                  15 |
|        19 |          325 |           1 | 12             | 0F053F00C00000010C000000 |                  25 |
|        19 |          331 |           2 | 25             | 0F053F00C000000119000000 |                  14 |
|        19 |          331 |           2 | 26             | 0F053F00C00000011A000000 |                  12 |
|        19 |          344 |           2 | 26             | 0F053F00C00000011A000000 |                  13 |
|        19 |          355 |           2 | 28             | 0F053F00C00000011C000000 |                  13 |
|        19 |          358 |           2 | 27             | 0F053F00C00000011B000000 |                  14 |
|        19 |          366 |           2 | 29             | 0F053F00C00000011D000000 |                  11 |
|        19 |          375 |           1 | 14             | 0F053F00C00000010E000000 |                  25 |
|        19 |          382 |           2 | 30             | 0F053F00C00000011E000000 |                  16 |
|        19 |          384 |           2 | 29             | 0F053F00C00000011D000000 |                  14 |
|        19 |          397 |           2 | 31             | 0F053F00C00000011F000000 |                  15 |
|        19 |          403 |           2 | 31             | 0F053F00C00000011F000000 |                  10 |
|        19 |          410 |           2 | 32             | 0F053F00C000000120000000 |                  13 |
|        19 |          415 |           2 | 32             | 0F053F00C000000120000000 |                  12 |
|        19 |          423 |           2 | 33             | 0F053F00C000000121000000 |                  13 |
|        19 |          425 |           1 | 16             | 0F053F00C000000110000000 |                  25 |
|        19 |          427 |           2 | 33             | 0F053F00C000000121000000 |                  12 |
|        19 |          435 |           2 | 34             | 0F053F00C000000122000000 |                  12 |
|        19 |          440 |           2 | 34             | 0F053F00C000000122000000 |                  13 |
|        19 |          452 |           2 | 35             | 0F053F00C000000123000000 |                  17 |
|        19 |          462 |           2 | 36             | 0F053F00C000000124000000 |                  14 |
|        19 |          463 |           2 | 36             | 0F053F00C000000124000000 |                  11 |
|        19 |          474 |           2 | 37             | 0F053F00C000000125000000 |                  12 |
|        19 |          475 |           1 | 18             | 0F053F00C000000112000000 |                  25 |
|        19 |          476 |           2 | 37             | 0F053F00C000000125000000 |                  13 |
|        19 |          486 |           2 | 38             | 0F053F00C000000126000000 |                  10 |
|        19 |          489 |           2 | 38             | 0F053F00C000000126000000 |                  15 |
|        19 |          498 |           2 | 39             | 0F053F00C000000127000000 |                  12 |
|        19 |          502 |           2 | 39             | 0F053F00C000000127000000 |                  13 |
|        19 |          525 |           1 | 20             | 0F053F00C000000114000000 |                  25 |
|        19 |          575 |           1 | 22             | 0F053F00C000000116000000 |                  25 |
|        19 |          600 |           1 | 23             | 0F053F00C000000117000000 |                  25 |
|        19 |          625 |           1 | 24             | 0F053F00C000000118000000 |                  25 |
|        19 |          650 |           1 | 25             | 0F053F00C000000119000000 |                  25 |
|        19 |          675 |           1 | 26             | 0F053F00C00000011A000000 |                  25 |
|        19 |          700 |           1 | 27             | 0F053F00C00000011B000000 |                  25 |
|        19 |          725 |           1 | 28             | 0F053F00C00000011C000000 |                  25 |
|        19 |          750 |           1 | 29             | 0F053F00C00000011D000000 |                  25 |
|        19 |          775 |           1 | 30             | 0F053F00C00000011E000000 |                  25 |
|        19 |          800 |           1 | 31             | 0F053F00C00000011F000000 |                  25 |
|        19 |          825 |           1 | 32             | 0F053F00C000000120000000 |                  25 |
|        19 |          850 |           1 | 33             | 0F053F00C000000121000000 |                  25 |
|        19 |          875 |           1 | 34             | 0F053F00C000000122000000 |                  25 |
|        19 |          900 |           1 | 35             | 0F053F00C000000123000000 |                  25 |
|        19 |          925 |           1 | 36             | 0F053F00C000000124000000 |                  25 |
|        19 |          950 |           1 | 37             | 0F053F00C000000125000000 |                  25 |
|        19 |          975 |           1 | 38             | 0F053F00C000000126000000 |                  25 |
|        19 |         1000 |           1 | 39             | 0F053F00C000000127000000 |                  25 |
+-----------+--------------+-------------+----------------+--------------------------+---------------------+
delete from oceanbase.__all_table_stat;
delete from oceanbase.__all_column_stat;
delete from oceanbase.__all_histogram_stat;
analyze table t2 partition(p0) compute statistics for all columns size 30;
select object_type, row_cnt from oceanbase.__all_table_stat order by 1, 2;
+-------------+---------+
| object_type | row_cnt |
+-------------+---------+
|           2 |     502 |
+-------------+---------+
select column_id, object_type, min_value, max_value, distinct_cnt, sample_size, density, bucket_cnt, histogram_type from oceanbase.__all_column_stat order by 1, 2,3,4;
+-----------+-------------+-----------+-----------+--------------+-------------+---------------------+------------+----------------+
| column_id | object_type | min_value | max_value | distinct_cnt | sample_size | density             | bucket_cnt | histogram_type |
+-----------+-------------+-----------+-----------+--------------+-------------+---------------------+------------+----------------+
|        16 |           2 | 2         | 999       |          512 |         502 |         0.001953125 |         30 |              4 |
|        17 |           2 | 0         | 9         |           10 |         502 | 0.00099601593625498 |         10 |              1 |
|        18 |           2 | 0         | 19        |           20 |         502 | 0.00099601593625498 |         20 |              1 |
|        19 |           2 | 0         | 39        |           40 |         502 | 0.02417357596640465 |         27 |              4 |
+-----------+-------------+-----------+-----------+--------------+-------------+---------------------+------------+----------------+
select column_id, endpoint_num, object_type, endpoint_value, b_endpoint_value, endpoint_repeat_cnt from oceanbase.__all_histogram_stat order by 1, 2,3,4;
+-----------+--------------+-------------+----------------+--------------------------+---------------------+
| column_id | endpoint_num | object_type | endpoint_value | b_endpoint_value         | endpoint_repeat_cnt |
+-----------+--------------+-------------+----------------+--------------------------+---------------------+
|        16 |            1 |           2 | 2              | 0F053F00C000000102000000 |                   1 |
|        16 |           19 |           2 | 42             | 0F053F00C00000012A000000 |                   1 |
|        16 |           37 |           2 | 75             | 0F053F00C00000014B000000 |                   1 |
|        16 |           55 |           2 | 116            | 0F053F00C000000174000000 |                   1 |
|        16 |           73 |           2 | 159            | 0F053F00C00000019F000000 |                   1 |
|        16 |           91 |           2 | 195            | 0F053F00C0000001C3000000 |                   1 |
|        16 |          109 |           2 | 231            | 0F053F00C0000001E7000000 |                   1 |
|        16 |          127 |           2 | 262            | 0F053F00C000000106010000 |                   1 |
|        16 |          145 |           2 | 298            | 0F053F00C00000012A010000 |                   1 |
|        16 |          163 |           2 | 329            | 0F053F00C000000149010000 |                   1 |
|        16 |          180 |           2 | 363            | 0F053F00C00000016B010000 |                   1 |
|        16 |          197 |           2 | 394            | 0F053F00C00000018A010000 |                   1 |
|        16 |          214 |           2 | 420            | 0F053F00C0000001A4010000 |                   1 |
|        16 |          231 |           2 | 464            | 0F053F00C0000001D0010000 |                   1 |
|        16 |          248 |           2 | 496            | 0F053F00C0000001F0010000 |                   1 |
|        16 |          265 |           2 | 533            | 0F053F00C000000115020000 |                   1 |
|        16 |          282 |           2 | 566            | 0F053F00C000000136020000 |                   1 |
|        16 |          299 |           2 | 597            | 0F053F00C000000155020000 |                   1 |
|        16 |          316 |           2 | 633            | 0F053F00C000000179020000 |                   1 |
|        16 |          333 |           2 | 673            | 0F053F00C0000001A1020000 |                   1 |
|        16 |          350 |           2 | 697            | 0F053F00C0000001B9020000 |                   1 |
|        16 |          367 |           2 | 737            | 0F053F00C0000001E1020000 |                   1 |
|        16 |          384 |           2 | 772            | 0F053F00C000000104030000 |                   1 |
|        16 |          401 |           2 | 798            | 0F053F00C00000011E030000 |                   1 |
|        16 |          418 |           2 | 828            | 0F053F00C00000013C030000 |                   1 |
|        16 |          435 |           2 | 867            | 0F053F00C000000163030000 |                   1 |
|        16 |          452 |           2 | 899            | 0F053F00C000000183030000 |                   1 |
|        16 |          469 |           2 | 929            | 0F053F00C0000001A1030000 |                   1 |
|        16 |          486 |           2 | 962            | 0F053F00C0000001C2030000 |                   1 |
|        16 |          502 |           2 | 999            | 0F053F00C0000001E7030000 |                   1 |
|        17 |           47 |           2 | 0              | 0F053F0080000000         |                  47 |
|        17 |           93 |           2 | 1              | 0F053F00C000000101000000 |                  46 |
|        17 |          141 |           2 | 2              | 0F053F00C000000102000000 |                  48 |
|        17 |          201 |           2 | 3              | 0F053F00C000000103000000 |                  60 |
|        17 |          245 |           2 | 4              | 0F053F00C000000104000000 |                  44 |
|        17 |          294 |           2 | 5              | 0F053F00C000000105000000 |                  49 |
|        17 |          343 |           2 | 6              | 0F053F00C000000106000000 |                  49 |
|        17 |          398 |           2 | 7              | 0F053F00C000000107000000 |                  55 |
|        17 |          455 |           2 | 8              | 0F053F00C000000108000000 |                  57 |
|        17 |          502 |           2 | 9              | 0F053F00C000000109000000 |                  47 |
|        18 |           23 |           2 | 0              | 0F053F0080000000         |                  23 |
|        18 |           51 |           2 | 1              | 0F053F00C000000101000000 |                  28 |
|        18 |           76 |           2 | 2              | 0F053F00C000000102000000 |                  25 |
|        18 |          107 |           2 | 3              | 0F053F00C000000103000000 |                  31 |
|        18 |          128 |           2 | 4              | 0F053F00C000000104000000 |                  21 |
|        18 |          155 |           2 | 5              | 0F053F00C000000105000000 |                  27 |
|        18 |          180 |           2 | 6              | 0F053F00C000000106000000 |                  25 |
|        18 |          204 |           2 | 7              | 0F053F00C000000107000000 |                  24 |
|        18 |          232 |           2 | 8              | 0F053F00C000000108000000 |                  28 |
|        18 |          256 |           2 | 9              | 0F053F00C000000109000000 |                  24 |
|        18 |          280 |           2 | 10             | 0F053F00C00000010A000000 |                  24 |
|        18 |          298 |           2 | 11             | 0F053F00C00000010B000000 |                  18 |
|        18 |          321 |           2 | 12             | 0F053F00C00000010C000000 |                  23 |
|        18 |          350 |           2 | 13             | 0F053F00C00000010D000000 |                  29 |
|        18 |          373 |           2 | 14             | 0F053F00C00000010E000000 |                  23 |
|        18 |          395 |           2 | 15             | 0F053F00C00000010F000000 |                  22 |
|        18 |          419 |           2 | 16             | 0F053F00C000000110000000 |                  24 |
|        18 |          450 |           2 | 17             | 0F053F00C000000111000000 |                  31 |
|        18 |          479 |           2 | 18             | 0F053F00C000000112000000 |                  29 |
|        18 |          502 |           2 | 19             | 0F053F00C000000113000000 |                  23 |
|        19 |           13 |           2 | 0              | 0F053F0080000000         |                  13 |
|        19 |           38 |           2 | 2              | 0F053F00C000000102000000 |                  11 |
|        19 |           55 |           2 | 3              | 0F053F00C000000103000000 |                  17 |
|        19 |           79 |           2 | 5              | 0F053F00C000000105000000 |                  13 |
|        19 |          101 |           2 | 7              | 0F053F00C000000107000000 |                  10 |
|        19 |          117 |           2 | 8              | 0F053F00C000000108000000 |                  16 |
|        19 |          142 |           2 | 10             | 0F053F00C00000010A000000 |                  15 |
|        19 |          161 |           2 | 12             | 0F053F00C00000010C000000 |                  11 |
|        19 |          178 |           2 | 13             | 0F053F00C00000010D000000 |                  17 |
|        19 |          202 |           2 | 15             | 0F053F00C00000010F000000 |                  14 |
|        19 |          231 |           2 | 17             | 0F053F00C000000111000000 |                  19 |
|        19 |          255 |           2 | 19             | 0F053F00C000000113000000 |                  10 |
|        19 |          279 |           2 | 21             | 0F053F00C000000115000000 |                  14 |
|        19 |          293 |           2 | 22             | 0F053F00C000000116000000 |                  14 |
|        19 |          307 |           2 | 23             | 0F053F00C000000117000000 |                  14 |
|        19 |          331 |           2 | 25             | 0F053F00C000000119000000 |                  14 |
|        19 |          344 |           2 | 26             | 0F053F00C00000011A000000 |                  13 |
|        19 |          358 |           2 | 27             | 0F053F00C00000011B000000 |                  14 |
|        19 |          384 |           2 | 29             | 0F053F00C00000011D000000 |                  14 |
|        19 |          403 |           2 | 31             | 0F053F00C00000011F000000 |                  10 |
|        19 |          415 |           2 | 32             | 0F053F00C000000120000000 |                  12 |
|        19 |          427 |           2 | 33             | 0F053F00C000000121000000 |                  12 |
|        19 |          440 |           2 | 34             | 0F053F00C000000122000000 |                  13 |
|        19 |          462 |           2 | 36             | 0F053F00C000000124000000 |                  14 |
|        19 |          474 |           2 | 37             | 0F053F00C000000125000000 |                  12 |
|        19 |          489 |           2 | 38             | 0F053F00C000000126000000 |                  15 |
|        19 |          502 |           2 | 39             | 0F053F00C000000127000000 |                  13 |
+-----------+--------------+-------------+----------------+--------------------------+---------------------+
delete from oceanbase.__all_table_stat;
delete from oceanbase.__all_column_stat;
delete from oceanbase.__all_histogram_stat;
analyze table t3 compute statistics for all columns size 30;
select object_type, row_cnt from oceanbase.__all_table_stat order by 1, 2;
+-------------+---------+
| object_type | row_cnt |
+-------------+---------+
|           1 |    1000 |
|           2 |     498 |
|           2 |     502 |
|           3 |     199 |
|           3 |     201 |
|           3 |     299 |
|           3 |     301 |
+-------------+---------+
select column_id, object_type, min_value, max_value, distinct_cnt, sample_size, density, bucket_cnt, histogram_type from oceanbase.__all_column_stat order by 1, 2,3,4;
+-----------+-------------+-----------+-----------+--------------+-------------+-----------------------+------------+----------------+
| column_id | object_type | min_value | max_value | distinct_cnt | sample_size | density               | bucket_cnt | histogram_type |
+-----------+-------------+-----------+-----------+--------------+-------------+-----------------------+------------+----------------+
|        16 |           1 | 0         | 999       |         1031 |        1000 | 0.0009699321047526673 |         30 |              4 |
|        16 |           2 | 0         | 998       |          517 |         498 | 0.0019342359767891683 |         30 |              4 |
|        16 |           2 | 2         | 999       |          512 |         502 |           0.001953125 |         30 |              4 |
|        16 |           3 | 0         | 993       |          202 |         199 | 0.0049504950495049506 |         30 |              4 |
|        16 |           3 | 2         | 992       |          201 |         201 |  0.004975124378109453 |         30 |              4 |
|        16 |           3 | 4         | 998       |          305 |         299 |  0.003278688524590164 |         30 |              4 |
|        16 |           3 | 5         | 999       |          303 |         301 | 0.0033003300330033004 |         30 |              4 |
|        17 |           1 | 0         | 9         |           10 |        1000 |                0.0005 |         10 |              1 |
|        17 |           2 | 0         | 9         |           10 |         498 |  0.001004016064257028 |         10 |              1 |
|        17 |           2 | 0         | 9         |           10 |         502 |   0.00099601593625498 |         10 |              1 |
|        17 |           3 | 0         | 3         |            4 |         199 |  0.002512562814070352 |          4 |              1 |
|        17 |           3 | 0         | 3         |            4 |         201 | 0.0024875621890547263 |          4 |              1 |
|        17 |           3 | 4         | 9         |            6 |         299 | 0.0016722408026755853 |          6 |              1 |
|        17 |           3 | 4         | 9         |            6 |         301 | 0.0016611295681063123 |          6 |              1 |
|        18 |           1 | 0         | 19        |           20 |        1000 |                0.0005 |         20 |              1 |
|        18 |           2 | 0         | 19        |           20 |         498 |  0.001004016064257028 |         20 |              1 |
|        18 |           2 | 0         | 19        |           20 |         502 |   0.00099601593625498 |         20 |              1 |
|        18 |           3 | 0         | 13        |            8 |         199 |  0.002512562814070352 |          8 |              1 |
|        18 |           3 | 0         | 13        |            8 |         201 | 0.0024875621890547263 |          8 |              1 |
|        18 |           3 | 4         | 19        |           12 |         299 | 0.0016722408026755853 |         12 |              1 |
|        18 |           3 | 4         | 19        |           12 |         301 | 0.0016611295681063123 |         12 |              1 |
|        19 |           1 | 0         | 39        |           40 |        1000 |                 0.025 |         29 |              4 |
|        19 |           2 | 0         | 39        |           40 |         498 |  0.024519129148171635 |         28 |              4 |
|        19 |           2 | 0         | 39        |           40 |         502 |   0.02417357596640465 |         27 |              4 |
|        19 |           3 | 0         | 33        |           16 |         199 |  0.002512562814070352 |         16 |              1 |
|        19 |           3 | 0         | 33        |           16 |         201 | 0.0024875621890547263 |         16 |              1 |
|        19 |           3 | 4         | 39        |           24 |         299 | 0.0016722408026755853 |         24 |              1 |
|        19 |           3 | 4         | 39        |           24 |         301 | 0.0016611295681063123 |         24 |              1 |
+-----------+-------------+-----------+-----------+--------------+-------------+-----------------------+------------+----------------+
select column_id, endpoint_num, object_type, endpoint_value, b_endpoint_value, endpoint_repeat_cnt from oceanbase.__all_histogram_stat order by 1, 2,3,4;
+-----------+--------------+-------------+----------------+--------------------------+---------------------+
| column_id | endpoint_num | object_type | endpoint_value | b_endpoint_value         | endpoint_repeat_cnt |
+-----------+--------------+-------------+----------------+--------------------------+---------------------+
|        16 |            1 |           1 | 0              | 0F053F0080000000         |                   1 |
|        16 |            1 |           2 | 0              | 0F053F0080000000         |                   1 |
|        16 |            1 |           2 | 2              | 0F053F00C000000102000000 |                   1 |
|        16 |            1 |           3 | 0              | 0F053F0080000000         |                   1 |
|        16 |            1 |           3 | 2              | 0F053F00C000000102000000 |                   1 |
|        16 |            1 |           3 | 4              | 0F053F00C000000104000000 |                   1 |
|        16 |            1 |           3 | 5              | 0F053F00C000000105000000 |                   1 |
|        16 |            8 |           3 | 32             | 0F053F00C000000120000000 |                   1 |
|        16 |            8 |           3 | 33             | 0F053F00C000000121000000 |                   1 |
|        16 |           12 |           3 | 35             | 0F053F00C000000123000000 |                   1 |
|        16 |           12 |           3 | 46             | 0F053F00C00000012E000000 |                   1 |
|        16 |           15 |           3 | 61             | 0F053F00C00000013D000000 |                   1 |
|        16 |           15 |           3 | 73             | 0F053F00C000000149000000 |                   1 |
|        16 |           19 |           2 | 34             | 0F053F00C000000122000000 |                   1 |
|        16 |           19 |           2 | 42             | 0F053F00C00000012A000000 |                   1 |
|        16 |           22 |           3 | 100            | 0F053F00C000000164000000 |                   1 |
|        16 |           22 |           3 | 112            | 0F053F00C000000170000000 |                   1 |
|        16 |           23 |           3 | 67             | 0F053F00C000000143000000 |                   1 |
|        16 |           23 |           3 | 79             | 0F053F00C00000014F000000 |                   1 |
|        16 |           29 |           3 | 131            | 0F053F00C000000183000000 |                   1 |
|        16 |           29 |           3 | 153            | 0F053F00C000000199000000 |                   1 |
|        16 |           34 |           3 | 106            | 0F053F00C00000016A000000 |                   1 |
|        16 |           34 |           3 | 119            | 0F053F00C000000177000000 |                   1 |
|        16 |           36 |           1 | 35             | 0F053F00C000000123000000 |                   1 |
|        16 |           36 |           3 | 161            | 0F053F00C0000001A1000000 |                   1 |
|        16 |           36 |           3 | 191            | 0F053F00C0000001BF000000 |                   1 |
|        16 |           37 |           2 | 72             | 0F053F00C000000148000000 |                   1 |
|        16 |           37 |           2 | 75             | 0F053F00C00000014B000000 |                   1 |
|        16 |           43 |           3 | 192            | 0F053F00C0000001C0000000 |                   1 |
|        16 |           43 |           3 | 213            | 0F053F00C0000001D5000000 |                   1 |
|        16 |           45 |           3 | 139            | 0F053F00C00000018B000000 |                   1 |
|        16 |           45 |           3 | 166            | 0F053F00C0000001A6000000 |                   1 |
|        16 |           50 |           3 | 233            | 0F053F00C0000001E9000000 |                   1 |
|        16 |           50 |           3 | 251            | 0F053F00C0000001FB000000 |                   1 |
|        16 |           55 |           2 | 100            | 0F053F00C000000164000000 |                   1 |
|        16 |           55 |           2 | 116            | 0F053F00C000000174000000 |                   1 |
|        16 |           56 |           3 | 174            | 0F053F00C0000001AE000000 |                   1 |
|        16 |           56 |           3 | 198            | 0F053F00C0000001C6000000 |                   1 |
|        16 |           57 |           3 | 280            | 0F053F00C000000118010000 |                   1 |
|        16 |           57 |           3 | 283            | 0F053F00C00000011B010000 |                   1 |
|        16 |           64 |           3 | 312            | 0F053F00C000000138010000 |                   1 |
|        16 |           64 |           3 | 313            | 0F053F00C000000139010000 |                   1 |
|        16 |           67 |           3 | 214            | 0F053F00C0000001D6000000 |                   1 |
|        16 |           67 |           3 | 246            | 0F053F00C0000001F6000000 |                   1 |
|        16 |           71 |           1 | 70             | 0F053F00C000000146000000 |                   1 |
|        16 |           71 |           3 | 350            | 0F053F00C00000015E010000 |                   1 |
|        16 |           71 |           3 | 351            | 0F053F00C00000015F010000 |                   1 |
|        16 |           73 |           2 | 136            | 0F053F00C000000188000000 |                   1 |
|        16 |           73 |           2 | 159            | 0F053F00C00000019F000000 |                   1 |
|        16 |           78 |           3 | 236            | 0F053F00C0000001EC000000 |                   1 |
|        16 |           78 |           3 | 276            | 0F053F00C000000114010000 |                   1 |
|        16 |           78 |           3 | 372            | 0F053F00C000000174010000 |                   1 |
|        16 |           78 |           3 | 383            | 0F053F00C00000017F010000 |                   1 |
|        16 |           85 |           3 | 420            | 0F053F00C0000001A4010000 |                   1 |
|        16 |           85 |           3 | 421            | 0F053F00C0000001A5010000 |                   1 |
|        16 |           89 |           3 | 284            | 0F053F00C00000011C010000 |                   1 |
|        16 |           89 |           3 | 308            | 0F053F00C000000134010000 |                   1 |
|        16 |           91 |           2 | 164            | 0F053F00C0000001A4000000 |                   1 |
|        16 |           91 |           2 | 195            | 0F053F00C0000001C3000000 |                   1 |
|        16 |           92 |           3 | 450            | 0F053F00C0000001C2010000 |                   1 |
|        16 |           92 |           3 | 462            | 0F053F00C0000001CE010000 |                   1 |
|        16 |           99 |           3 | 473            | 0F053F00C0000001D9010000 |                   1 |
|        16 |           99 |           3 | 502            | 0F053F00C0000001F6010000 |                   1 |
|        16 |          100 |           3 | 327            | 0F053F00C000000147010000 |                   1 |
|        16 |          100 |           3 | 338            | 0F053F00C000000152010000 |                   1 |
|        16 |          106 |           1 | 105            | 0F053F00C000000169000000 |                   1 |
|        16 |          106 |           3 | 511            | 0F053F00C0000001FF010000 |                   1 |
|        16 |          106 |           3 | 532            | 0F053F00C000000114020000 |                   1 |
|        16 |          108 |           2 | 202            | 0F053F00C0000001CA000000 |                   1 |
|        16 |          109 |           2 | 231            | 0F053F00C0000001E7000000 |                   1 |
|        16 |          110 |           3 | 367            | 0F053F00C00000016F010000 |                   1 |
|        16 |          111 |           3 | 368            | 0F053F00C000000170010000 |                   1 |
|        16 |          113 |           3 | 542            | 0F053F00C00000011E020000 |                   1 |
|        16 |          113 |           3 | 572            | 0F053F00C00000013C020000 |                   1 |
|        16 |          120 |           3 | 407            | 0F053F00C000000197010000 |                   1 |
|        16 |          120 |           3 | 583            | 0F053F00C000000147020000 |                   1 |
|        16 |          120 |           3 | 603            | 0F053F00C00000015B020000 |                   1 |
|        16 |          122 |           3 | 399            | 0F053F00C00000018F010000 |                   1 |
|        16 |          125 |           2 | 233            | 0F053F00C0000001E9000000 |                   1 |
|        16 |          127 |           2 | 262            | 0F053F00C000000106010000 |                   1 |
|        16 |          127 |           3 | 630            | 0F053F00C000000176020000 |                   1 |
|        16 |          127 |           3 | 632            | 0F053F00C000000178020000 |                   1 |
|        16 |          130 |           3 | 435            | 0F053F00C0000001B3010000 |                   1 |
|        16 |          132 |           3 | 444            | 0F053F00C0000001BC010000 |                   1 |
|        16 |          134 |           3 | 662            | 0F053F00C000000196020000 |                   1 |
|        16 |          134 |           3 | 663            | 0F053F00C000000197020000 |                   1 |
|        16 |          140 |           3 | 458            | 0F053F00C0000001CA010000 |                   1 |
|        16 |          141 |           1 | 140            | 0F053F00C00000018C000000 |                   1 |
|        16 |          141 |           3 | 700            | 0F053F00C0000001BC020000 |                   1 |
|        16 |          141 |           3 | 710            | 0F053F00C0000001C6020000 |                   1 |
|        16 |          142 |           2 | 273            | 0F053F00C000000111010000 |                   1 |
|        16 |          142 |           3 | 486            | 0F053F00C0000001E6010000 |                   1 |
|        16 |          145 |           2 | 298            | 0F053F00C00000012A010000 |                   1 |
|        16 |          148 |           3 | 730            | 0F053F00C0000001DA020000 |                   1 |
|        16 |          148 |           3 | 742            | 0F053F00C0000001E6020000 |                   1 |
|        16 |          150 |           3 | 487            | 0F053F00C0000001E7010000 |                   1 |
|        16 |          152 |           3 | 516            | 0F053F00C000000104020000 |                   1 |
|        16 |          155 |           3 | 752            | 0F053F00C0000001F0020000 |                   1 |
|        16 |          155 |           3 | 781            | 0F053F00C00000010D030000 |                   1 |
|        16 |          159 |           2 | 310            | 0F053F00C000000136010000 |                   1 |
|        16 |          160 |           3 | 519            | 0F053F00C000000107020000 |                   1 |
|        16 |          162 |           3 | 557            | 0F053F00C00000012D020000 |                   1 |
|        16 |          162 |           3 | 792            | 0F053F00C000000118030000 |                   1 |
|        16 |          162 |           3 | 810            | 0F053F00C00000012A030000 |                   1 |
|        16 |          163 |           2 | 329            | 0F053F00C000000149010000 |                   1 |
|        16 |          169 |           3 | 840            | 0F053F00C000000148030000 |                   1 |
|        16 |          169 |           3 | 842            | 0F053F00C00000014A030000 |                   1 |
|        16 |          170 |           3 | 554            | 0F053F00C00000012A020000 |                   1 |
|        16 |          172 |           3 | 587            | 0F053F00C00000014B020000 |                   1 |
|        16 |          176 |           1 | 175            | 0F053F00C0000001AF000000 |                   1 |
|        16 |          176 |           2 | 351            | 0F053F00C00000015F010000 |                   1 |
|        16 |          176 |           3 | 872            | 0F053F00C000000168030000 |                   1 |
|        16 |          176 |           3 | 881            | 0F053F00C000000171030000 |                   1 |
|        16 |          180 |           2 | 363            | 0F053F00C00000016B010000 |                   1 |
|        16 |          180 |           3 | 585            | 0F053F00C000000149020000 |                   1 |
|        16 |          182 |           3 | 608            | 0F053F00C000000160020000 |                   1 |
|        16 |          182 |           3 | 910            | 0F053F00C00000018E030000 |                   1 |
|        16 |          183 |           3 | 902            | 0F053F00C000000186030000 |                   1 |
|        16 |          188 |           3 | 940            | 0F053F00C0000001AC030000 |                   1 |
|        16 |          190 |           3 | 629            | 0F053F00C000000175020000 |                   1 |
|        16 |          190 |           3 | 942            | 0F053F00C0000001AE030000 |                   1 |
|        16 |          192 |           3 | 654            | 0F053F00C00000018E020000 |                   1 |
|        16 |          193 |           2 | 384            | 0F053F00C000000180010000 |                   1 |
|        16 |          194 |           3 | 971            | 0F053F00C0000001CB030000 |                   1 |
|        16 |          196 |           3 | 963            | 0F053F00C0000001C3030000 |                   1 |
|        16 |          197 |           2 | 394            | 0F053F00C00000018A010000 |                   1 |
|        16 |          199 |           3 | 993            | 0F053F00C0000001E1030000 |                   1 |
|        16 |          200 |           3 | 655            | 0F053F00C00000018F020000 |                   1 |
|        16 |          201 |           3 | 992            | 0F053F00C0000001E0030000 |                   1 |
|        16 |          202 |           3 | 679            | 0F053F00C0000001A7020000 |                   1 |
|        16 |          210 |           2 | 425            | 0F053F00C0000001A9010000 |                   1 |
|        16 |          210 |           3 | 706            | 0F053F00C0000001C2020000 |                   1 |
|        16 |          211 |           1 | 210            | 0F053F00C0000001D2000000 |                   1 |
|        16 |          212 |           3 | 704            | 0F053F00C0000001C0020000 |                   1 |
|        16 |          214 |           2 | 420            | 0F053F00C0000001A4010000 |                   1 |
|        16 |          220 |           3 | 736            | 0F053F00C0000001E0020000 |                   1 |
|        16 |          222 |           3 | 737            | 0F053F00C0000001E1020000 |                   1 |
|        16 |          227 |           2 | 452            | 0F053F00C0000001C4010000 |                   1 |
|        16 |          230 |           3 | 767            | 0F053F00C0000001FF020000 |                   1 |
|        16 |          231 |           2 | 464            | 0F053F00C0000001D0010000 |                   1 |
|        16 |          232 |           3 | 775            | 0F053F00C000000107030000 |                   1 |
|        16 |          240 |           3 | 814            | 0F053F00C00000012E030000 |                   1 |
|        16 |          242 |           3 | 797            | 0F053F00C00000011D030000 |                   1 |
|        16 |          244 |           2 | 484            | 0F053F00C0000001E4010000 |                   1 |
|        16 |          246 |           1 | 245            | 0F053F00C0000001F5000000 |                   1 |
|        16 |          248 |           2 | 496            | 0F053F00C0000001F0010000 |                   1 |
|        16 |          250 |           3 | 847            | 0F053F00C00000014F030000 |                   1 |
|        16 |          252 |           3 | 827            | 0F053F00C00000013B030000 |                   1 |
|        16 |          260 |           3 | 874            | 0F053F00C00000016A030000 |                   1 |
|        16 |          261 |           2 | 519            | 0F053F00C000000107020000 |                   1 |
|        16 |          262 |           3 | 867            | 0F053F00C000000163030000 |                   1 |
|        16 |          265 |           2 | 533            | 0F053F00C000000115020000 |                   1 |
|        16 |          270 |           3 | 909            | 0F053F00C00000018D030000 |                   1 |
|        16 |          272 |           3 | 899            | 0F053F00C000000183030000 |                   1 |
|        16 |          278 |           2 | 553            | 0F053F00C000000129020000 |                   1 |
|        16 |          280 |           3 | 948            | 0F053F00C0000001B4030000 |                   1 |
|        16 |          281 |           1 | 280            | 0F053F00C000000118010000 |                   1 |
|        16 |          282 |           2 | 566            | 0F053F00C000000136020000 |                   1 |
|        16 |          282 |           3 | 928            | 0F053F00C0000001A0030000 |                   1 |
|        16 |          290 |           3 | 979            | 0F053F00C0000001D3030000 |                   1 |
|        16 |          292 |           3 | 964            | 0F053F00C0000001C4030000 |                   1 |
|        16 |          295 |           2 | 584            | 0F053F00C000000148020000 |                   1 |
|        16 |          299 |           2 | 597            | 0F053F00C000000155020000 |                   1 |
|        16 |          299 |           3 | 998            | 0F053F00C0000001E6030000 |                   1 |
|        16 |          301 |           3 | 999            | 0F053F00C0000001E7030000 |                   1 |
|        16 |          312 |           2 | 620            | 0F053F00C00000016C020000 |                   1 |
|        16 |          316 |           1 | 315            | 0F053F00C00000013B010000 |                   1 |
|        16 |          316 |           2 | 633            | 0F053F00C000000179020000 |                   1 |
|        16 |          329 |           2 | 649            | 0F053F00C000000189020000 |                   1 |
|        16 |          333 |           2 | 673            | 0F053F00C0000001A1020000 |                   1 |
|        16 |          346 |           2 | 691            | 0F053F00C0000001B3020000 |                   1 |
|        16 |          350 |           2 | 697            | 0F053F00C0000001B9020000 |                   1 |
|        16 |          351 |           1 | 350            | 0F053F00C00000015E010000 |                   1 |
|        16 |          363 |           2 | 727            | 0F053F00C0000001D7020000 |                   1 |
|        16 |          367 |           2 | 737            | 0F053F00C0000001E1020000 |                   1 |
|        16 |          380 |           2 | 753            | 0F053F00C0000001F1020000 |                   1 |
|        16 |          384 |           2 | 772            | 0F053F00C000000104030000 |                   1 |
|        16 |          386 |           1 | 385            | 0F053F00C000000181010000 |                   1 |
|        16 |          397 |           2 | 790            | 0F053F00C000000116030000 |                   1 |
|        16 |          401 |           2 | 798            | 0F053F00C00000011E030000 |                   1 |
|        16 |          414 |           2 | 838            | 0F053F00C000000146030000 |                   1 |
|        16 |          418 |           2 | 828            | 0F053F00C00000013C030000 |                   1 |
|        16 |          421 |           1 | 420            | 0F053F00C0000001A4010000 |                   1 |
|        16 |          431 |           2 | 861            | 0F053F00C00000015D030000 |                   1 |
|        16 |          435 |           2 | 867            | 0F053F00C000000163030000 |                   1 |
|        16 |          448 |           2 | 898            | 0F053F00C000000182030000 |                   1 |
|        16 |          452 |           2 | 899            | 0F053F00C000000183030000 |                   1 |
|        16 |          456 |           1 | 455            | 0F053F00C0000001C7010000 |                   1 |
|        16 |          465 |           2 | 941            | 0F053F00C0000001AD030000 |                   1 |
|        16 |          469 |           2 | 929            | 0F053F00C0000001A1030000 |                   1 |
|        16 |          482 |           2 | 971            | 0F053F00C0000001CB030000 |                   1 |
|        16 |          486 |           2 | 962            | 0F053F00C0000001C2030000 |                   1 |
|        16 |          491 |           1 | 490            | 0F053F00C0000001EA010000 |                   1 |
|        16 |          498 |           2 | 998            | 0F053F00C0000001E6030000 |                   1 |
|        16 |          502 |           2 | 999            | 0F053F00C0000001E7030000 |                   1 |
|        16 |          525 |           1 | 524            | 0F053F00C00000010C020000 |                   1 |
|        16 |          559 |           1 | 558            | 0F053F00C00000012E020000 |                   1 |
|        16 |          593 |           1 | 592            | 0F053F00C000000150020000 |                   1 |
|        16 |          627 |           1 | 626            | 0F053F00C000000172020000 |                   1 |
|        16 |          661 |           1 | 660            | 0F053F00C000000194020000 |                   1 |
|        16 |          695 |           1 | 694            | 0F053F00C0000001B6020000 |                   1 |
|        16 |          729 |           1 | 728            | 0F053F00C0000001D8020000 |                   1 |
|        16 |          763 |           1 | 762            | 0F053F00C0000001FA020000 |                   1 |
|        16 |          797 |           1 | 796            | 0F053F00C00000011C030000 |                   1 |
|        16 |          831 |           1 | 830            | 0F053F00C00000013E030000 |                   1 |
|        16 |          865 |           1 | 864            | 0F053F00C000000160030000 |                   1 |
|        16 |          899 |           1 | 898            | 0F053F00C000000182030000 |                   1 |
|        16 |          933 |           1 | 932            | 0F053F00C0000001A4030000 |                   1 |
|        16 |          967 |           1 | 966            | 0F053F00C0000001C6030000 |                   1 |
|        16 |         1000 |           1 | 999            | 0F053F00C0000001E7030000 |                   1 |
|        17 |           44 |           3 | 4              | 0F053F00C000000104000000 |                  44 |
|        17 |           47 |           2 | 0              | 0F053F0080000000         |                  47 |
|        17 |           47 |           3 | 0              | 0F053F0080000000         |                  47 |
|        17 |           53 |           2 | 0              | 0F053F0080000000         |                  53 |
|        17 |           53 |           3 | 0              | 0F053F0080000000         |                  53 |
|        17 |           56 |           3 | 4              | 0F053F00C000000104000000 |                  56 |
|        17 |           93 |           2 | 1              | 0F053F00C000000101000000 |                  46 |
|        17 |           93 |           3 | 1              | 0F053F00C000000101000000 |                  46 |
|        17 |           93 |           3 | 5              | 0F053F00C000000105000000 |                  49 |
|        17 |          100 |           1 | 0              | 0F053F0080000000         |                 100 |
|        17 |          107 |           2 | 1              | 0F053F00C000000101000000 |                  54 |
|        17 |          107 |           3 | 1              | 0F053F00C000000101000000 |                  54 |
|        17 |          107 |           3 | 5              | 0F053F00C000000105000000 |                  51 |
|        17 |          141 |           2 | 2              | 0F053F00C000000102000000 |                  48 |
|        17 |          141 |           3 | 2              | 0F053F00C000000102000000 |                  48 |
|        17 |          142 |           3 | 6              | 0F053F00C000000106000000 |                  49 |
|        17 |          158 |           3 | 6              | 0F053F00C000000106000000 |                  51 |
|        17 |          159 |           2 | 2              | 0F053F00C000000102000000 |                  52 |
|        17 |          159 |           3 | 2              | 0F053F00C000000102000000 |                  52 |
|        17 |          197 |           3 | 7              | 0F053F00C000000107000000 |                  55 |
|        17 |          199 |           2 | 3              | 0F053F00C000000103000000 |                  40 |
|        17 |          199 |           3 | 3              | 0F053F00C000000103000000 |                  40 |
|        17 |          200 |           1 | 1              | 0F053F00C000000101000000 |                 100 |
|        17 |          201 |           2 | 3              | 0F053F00C000000103000000 |                  60 |
|        17 |          201 |           3 | 3              | 0F053F00C000000103000000 |                  60 |
|        17 |          203 |           3 | 7              | 0F053F00C000000107000000 |                  45 |
|        17 |          245 |           2 | 4              | 0F053F00C000000104000000 |                  44 |
|        17 |          246 |           3 | 8              | 0F053F00C000000108000000 |                  43 |
|        17 |          254 |           3 | 8              | 0F053F00C000000108000000 |                  57 |
|        17 |          255 |           2 | 4              | 0F053F00C000000104000000 |                  56 |
|        17 |          294 |           2 | 5              | 0F053F00C000000105000000 |                  49 |
|        17 |          299 |           3 | 9              | 0F053F00C000000109000000 |                  53 |
|        17 |          300 |           1 | 2              | 0F053F00C000000102000000 |                 100 |
|        17 |          301 |           3 | 9              | 0F053F00C000000109000000 |                  47 |
|        17 |          306 |           2 | 5              | 0F053F00C000000105000000 |                  51 |
|        17 |          343 |           2 | 6              | 0F053F00C000000106000000 |                  49 |
|        17 |          357 |           2 | 6              | 0F053F00C000000106000000 |                  51 |
|        17 |          398 |           2 | 7              | 0F053F00C000000107000000 |                  55 |
|        17 |          400 |           1 | 3              | 0F053F00C000000103000000 |                 100 |
|        17 |          402 |           2 | 7              | 0F053F00C000000107000000 |                  45 |
|        17 |          445 |           2 | 8              | 0F053F00C000000108000000 |                  43 |
|        17 |          455 |           2 | 8              | 0F053F00C000000108000000 |                  57 |
|        17 |          498 |           2 | 9              | 0F053F00C000000109000000 |                  53 |
|        17 |          500 |           1 | 4              | 0F053F00C000000104000000 |                 100 |
|        17 |          502 |           2 | 9              | 0F053F00C000000109000000 |                  47 |
|        17 |          600 |           1 | 5              | 0F053F00C000000105000000 |                 100 |
|        17 |          700 |           1 | 6              | 0F053F00C000000106000000 |                 100 |
|        17 |          800 |           1 | 7              | 0F053F00C000000107000000 |                 100 |
|        17 |          900 |           1 | 8              | 0F053F00C000000108000000 |                 100 |
|        17 |         1000 |           1 | 9              | 0F053F00C000000109000000 |                 100 |
|        18 |           21 |           3 | 4              | 0F053F00C000000104000000 |                  21 |
|        18 |           23 |           2 | 0              | 0F053F0080000000         |                  23 |
|        18 |           23 |           3 | 0              | 0F053F0080000000         |                  23 |
|        18 |           27 |           2 | 0              | 0F053F0080000000         |                  27 |
|        18 |           27 |           3 | 0              | 0F053F0080000000         |                  27 |
|        18 |           29 |           3 | 4              | 0F053F00C000000104000000 |                  29 |
|        18 |           48 |           3 | 5              | 0F053F00C000000105000000 |                  27 |
|        18 |           49 |           2 | 1              | 0F053F00C000000101000000 |                  22 |
|        18 |           49 |           3 | 1              | 0F053F00C000000101000000 |                  22 |
|        18 |           50 |           1 | 0              | 0F053F0080000000         |                  50 |
|        18 |           51 |           2 | 1              | 0F053F00C000000101000000 |                  28 |
|        18 |           51 |           3 | 1              | 0F053F00C000000101000000 |                  28 |
|        18 |           52 |           3 | 5              | 0F053F00C000000105000000 |                  23 |
|        18 |           73 |           3 | 6              | 0F053F00C000000106000000 |                  25 |
|        18 |           74 |           2 | 2              | 0F053F00C000000102000000 |                  25 |
|        18 |           74 |           3 | 2              | 0F053F00C000000102000000 |                  25 |
|        18 |           76 |           2 | 2              | 0F053F00C000000102000000 |                  25 |
|        18 |           76 |           3 | 2              | 0F053F00C000000102000000 |                  25 |
|        18 |           77 |           3 | 6              | 0F053F00C000000106000000 |                  25 |
|        18 |           93 |           2 | 3              | 0F053F00C000000103000000 |                  19 |
|        18 |           93 |           3 | 3              | 0F053F00C000000103000000 |                  19 |
|        18 |           97 |           3 | 7              | 0F053F00C000000107000000 |                  24 |
|        18 |          100 |           1 | 1              | 0F053F00C000000101000000 |                  50 |
|        18 |          103 |           3 | 7              | 0F053F00C000000107000000 |                  26 |
|        18 |          107 |           2 | 3              | 0F053F00C000000103000000 |                  31 |
|        18 |          107 |           3 | 3              | 0F053F00C000000103000000 |                  31 |
|        18 |          119 |           3 | 10             | 0F053F00C00000010A000000 |                  26 |
|        18 |          122 |           2 | 4              | 0F053F00C000000104000000 |                  29 |
|        18 |          125 |           3 | 8              | 0F053F00C000000108000000 |                  22 |
|        18 |          125 |           3 | 8              | 0F053F00C000000108000000 |                  28 |
|        18 |          128 |           2 | 4              | 0F053F00C000000104000000 |                  21 |
|        18 |          131 |           3 | 10             | 0F053F00C00000010A000000 |                  24 |
|        18 |          145 |           2 | 5              | 0F053F00C000000105000000 |                  23 |
|        18 |          149 |           3 | 11             | 0F053F00C00000010B000000 |                  18 |
|        18 |          149 |           3 | 9              | 0F053F00C000000109000000 |                  24 |
|        18 |          150 |           1 | 2              | 0F053F00C000000102000000 |                  50 |
|        18 |          151 |           3 | 11             | 0F053F00C00000010B000000 |                  32 |
|        18 |          151 |           3 | 9              | 0F053F00C000000109000000 |                  26 |
|        18 |          155 |           2 | 5              | 0F053F00C000000105000000 |                  27 |
|        18 |          170 |           2 | 6              | 0F053F00C000000106000000 |                  25 |
|        18 |          172 |           3 | 12             | 0F053F00C00000010C000000 |                  23 |
|        18 |          172 |           3 | 14             | 0F053F00C00000010E000000 |                  23 |
|        18 |          178 |           3 | 12             | 0F053F00C00000010C000000 |                  27 |
|        18 |          178 |           3 | 14             | 0F053F00C00000010E000000 |                  27 |
|        18 |          180 |           2 | 6              | 0F053F00C000000106000000 |                  25 |
|        18 |          194 |           3 | 15             | 0F053F00C00000010F000000 |                  22 |
|        18 |          196 |           2 | 7              | 0F053F00C000000107000000 |                  26 |
|        18 |          199 |           3 | 13             | 0F053F00C00000010D000000 |                  21 |
|        18 |          200 |           1 | 3              | 0F053F00C000000103000000 |                  50 |
|        18 |          201 |           3 | 13             | 0F053F00C00000010D000000 |                  29 |
|        18 |          204 |           2 | 7              | 0F053F00C000000107000000 |                  24 |
|        18 |          206 |           3 | 15             | 0F053F00C00000010F000000 |                  28 |
|        18 |          218 |           2 | 8              | 0F053F00C000000108000000 |                  22 |
|        18 |          218 |           3 | 16             | 0F053F00C000000110000000 |                  24 |
|        18 |          232 |           2 | 8              | 0F053F00C000000108000000 |                  28 |
|        18 |          232 |           3 | 16             | 0F053F00C000000110000000 |                  26 |
|        18 |          244 |           2 | 9              | 0F053F00C000000109000000 |                  26 |
|        18 |          249 |           3 | 17             | 0F053F00C000000111000000 |                  31 |
|        18 |          250 |           1 | 4              | 0F053F00C000000104000000 |                  50 |
|        18 |          251 |           3 | 17             | 0F053F00C000000111000000 |                  19 |
|        18 |          256 |           2 | 9              | 0F053F00C000000109000000 |                  24 |
|        18 |          270 |           2 | 10             | 0F053F00C00000010A000000 |                  26 |
|        18 |          272 |           3 | 18             | 0F053F00C000000112000000 |                  21 |
|        18 |          278 |           3 | 18             | 0F053F00C000000112000000 |                  29 |
|        18 |          280 |           2 | 10             | 0F053F00C00000010A000000 |                  24 |
|        18 |          298 |           2 | 11             | 0F053F00C00000010B000000 |                  18 |
|        18 |          299 |           3 | 19             | 0F053F00C000000113000000 |                  27 |
|        18 |          300 |           1 | 5              | 0F053F00C000000105000000 |                  50 |
|        18 |          301 |           3 | 19             | 0F053F00C000000113000000 |                  23 |
|        18 |          302 |           2 | 11             | 0F053F00C00000010B000000 |                  32 |
|        18 |          321 |           2 | 12             | 0F053F00C00000010C000000 |                  23 |
|        18 |          329 |           2 | 12             | 0F053F00C00000010C000000 |                  27 |
|        18 |          350 |           1 | 6              | 0F053F00C000000106000000 |                  50 |
|        18 |          350 |           2 | 13             | 0F053F00C00000010D000000 |                  21 |
|        18 |          350 |           2 | 13             | 0F053F00C00000010D000000 |                  29 |
|        18 |          373 |           2 | 14             | 0F053F00C00000010E000000 |                  23 |
|        18 |          377 |           2 | 14             | 0F053F00C00000010E000000 |                  27 |
|        18 |          395 |           2 | 15             | 0F053F00C00000010F000000 |                  22 |
|        18 |          400 |           1 | 7              | 0F053F00C000000107000000 |                  50 |
|        18 |          405 |           2 | 15             | 0F053F00C00000010F000000 |                  28 |
|        18 |          419 |           2 | 16             | 0F053F00C000000110000000 |                  24 |
|        18 |          431 |           2 | 16             | 0F053F00C000000110000000 |                  26 |
|        18 |          450 |           1 | 8              | 0F053F00C000000108000000 |                  50 |
|        18 |          450 |           2 | 17             | 0F053F00C000000111000000 |                  19 |
|        18 |          450 |           2 | 17             | 0F053F00C000000111000000 |                  31 |
|        18 |          471 |           2 | 18             | 0F053F00C000000112000000 |                  21 |
|        18 |          479 |           2 | 18             | 0F053F00C000000112000000 |                  29 |
|        18 |          498 |           2 | 19             | 0F053F00C000000113000000 |                  27 |
|        18 |          500 |           1 | 9              | 0F053F00C000000109000000 |                  50 |
|        18 |          502 |           2 | 19             | 0F053F00C000000113000000 |                  23 |
|        18 |          550 |           1 | 10             | 0F053F00C00000010A000000 |                  50 |
|        18 |          600 |           1 | 11             | 0F053F00C00000010B000000 |                  50 |
|        18 |          650 |           1 | 12             | 0F053F00C00000010C000000 |                  50 |
|        18 |          700 |           1 | 13             | 0F053F00C00000010D000000 |                  50 |
|        18 |          750 |           1 | 14             | 0F053F00C00000010E000000 |                  50 |
|        18 |          800 |           1 | 15             | 0F053F00C00000010F000000 |                  50 |
|        18 |          850 |           1 | 16             | 0F053F00C000000110000000 |                  50 |
|        18 |          900 |           1 | 17             | 0F053F00C000000111000000 |                  50 |
|        18 |          950 |           1 | 18             | 0F053F00C000000112000000 |                  50 |
|        18 |         1000 |           1 | 19             | 0F053F00C000000113000000 |                  50 |
|        19 |           11 |           3 | 4              | 0F053F00C000000104000000 |                  11 |
|        19 |           12 |           2 | 0              | 0F053F0080000000         |                  12 |
|        19 |           12 |           3 | 0              | 0F053F0080000000         |                  12 |
|        19 |           13 |           2 | 0              | 0F053F0080000000         |                  13 |
|        19 |           13 |           3 | 0              | 0F053F0080000000         |                  13 |
|        19 |           14 |           3 | 4              | 0F053F00C000000104000000 |                  14 |
|        19 |           23 |           3 | 1              | 0F053F00C000000101000000 |                  11 |
|        19 |           24 |           3 | 5              | 0F053F00C000000105000000 |                  13 |
|        19 |           25 |           1 | 0              | 0F053F0080000000         |                  25 |
|        19 |           26 |           3 | 5              | 0F053F00C000000105000000 |                  12 |
|        19 |           27 |           3 | 1              | 0F053F00C000000101000000 |                  14 |
|        19 |           36 |           3 | 6              | 0F053F00C000000106000000 |                  12 |
|        19 |           37 |           2 | 2              | 0F053F00C000000102000000 |                  14 |
|        19 |           37 |           3 | 2              | 0F053F00C000000102000000 |                  14 |
|        19 |           38 |           2 | 2              | 0F053F00C000000102000000 |                  11 |
|        19 |           38 |           3 | 2              | 0F053F00C000000102000000 |                  11 |
|        19 |           39 |           3 | 6              | 0F053F00C000000106000000 |                  13 |
|        19 |           45 |           3 | 3              | 0F053F00C000000103000000 |                   8 |
|        19 |           46 |           3 | 7              | 0F053F00C000000107000000 |                  10 |
|        19 |           54 |           3 | 7              | 0F053F00C000000107000000 |                  15 |
|        19 |           55 |           2 | 3              | 0F053F00C000000103000000 |                  17 |
|        19 |           55 |           3 | 10             | 0F053F00C00000010A000000 |                  10 |
|        19 |           55 |           3 | 3              | 0F053F00C000000103000000 |                  17 |
|        19 |           59 |           2 | 4              | 0F053F00C000000104000000 |                  14 |
|        19 |           62 |           3 | 8              | 0F053F00C000000108000000 |                  16 |
|        19 |           63 |           3 | 8              | 0F053F00C000000108000000 |                   9 |
|        19 |           70 |           3 | 10             | 0F053F00C00000010A000000 |                  15 |
|        19 |           72 |           3 | 11             | 0F053F00C00000010B000000 |                  17 |
|        19 |           72 |           3 | 9              | 0F053F00C000000109000000 |                  10 |
|        19 |           75 |           1 | 2              | 0F053F00C000000102000000 |                  25 |
|        19 |           78 |           3 | 11             | 0F053F00C00000010B000000 |                   8 |
|        19 |           78 |           3 | 9              | 0F053F00C000000109000000 |                  15 |
|        19 |           79 |           2 | 5              | 0F053F00C000000105000000 |                  13 |
|        19 |           82 |           3 | 14             | 0F053F00C00000010E000000 |                  10 |
|        19 |           84 |           2 | 6              | 0F053F00C000000106000000 |                  13 |
|        19 |           86 |           3 | 12             | 0F053F00C00000010C000000 |                  14 |
|        19 |           89 |           3 | 12             | 0F053F00C00000010C000000 |                  11 |
|        19 |           93 |           3 | 14             | 0F053F00C00000010E000000 |                  15 |
|        19 |           94 |           3 | 13             | 0F053F00C00000010D000000 |                   8 |
|        19 |           96 |           3 | 15             | 0F053F00C00000010F000000 |                  14 |
|        19 |          101 |           2 | 7              | 0F053F00C000000107000000 |                  10 |
|        19 |          104 |           3 | 15             | 0F053F00C00000010F000000 |                  11 |
|        19 |          106 |           3 | 13             | 0F053F00C00000010D000000 |                  17 |
|        19 |          106 |           3 | 16             | 0F053F00C000000110000000 |                  10 |
|        19 |          108 |           2 | 8              | 0F053F00C000000108000000 |                   9 |
|        19 |          109 |           3 | 20             | 0F053F00C000000114000000 |                  15 |
|        19 |          116 |           3 | 20             | 0F053F00C000000114000000 |                  10 |
|        19 |          117 |           2 | 8              | 0F053F00C000000108000000 |                  16 |
|        19 |          119 |           3 | 16             | 0F053F00C000000110000000 |                  15 |
|        19 |          120 |           3 | 21             | 0F053F00C000000115000000 |                  11 |
|        19 |          125 |           1 | 4              | 0F053F00C000000104000000 |                  25 |
|        19 |          125 |           3 | 17             | 0F053F00C000000111000000 |                   6 |
|        19 |          125 |           3 | 17             | 0F053F00C000000111000000 |                  19 |
|        19 |          130 |           3 | 21             | 0F053F00C000000115000000 |                  14 |
|        19 |          131 |           3 | 22             | 0F053F00C000000116000000 |                  11 |
|        19 |          133 |           2 | 10             | 0F053F00C00000010A000000 |                  10 |
|        19 |          136 |           3 | 18             | 0F053F00C000000112000000 |                  11 |
|        19 |          139 |           3 | 18             | 0F053F00C000000112000000 |                  14 |
|        19 |          142 |           2 | 10             | 0F053F00C00000010A000000 |                  15 |
|        19 |          142 |           3 | 23             | 0F053F00C000000117000000 |                  11 |
|        19 |          144 |           3 | 22             | 0F053F00C000000116000000 |                  14 |
|        19 |          149 |           3 | 19             | 0F053F00C000000113000000 |                  10 |
|        19 |          150 |           2 | 11             | 0F053F00C00000010B000000 |                  17 |
|        19 |          151 |           3 | 19             | 0F053F00C000000113000000 |                  15 |
|        19 |          158 |           3 | 23             | 0F053F00C000000117000000 |                  14 |
|        19 |          158 |           3 | 30             | 0F053F00C00000011E000000 |                  16 |
|        19 |          159 |           3 | 24             | 0F053F00C000000118000000 |                  10 |
|        19 |          161 |           2 | 12             | 0F053F00C00000010C000000 |                  11 |
|        19 |          166 |           3 | 24             | 0F053F00C000000118000000 |                  15 |
|        19 |          167 |           3 | 30             | 0F053F00C00000011E000000 |                   9 |
|        19 |          172 |           2 | 13             | 0F053F00C00000010D000000 |                   8 |
|        19 |          173 |           3 | 25             | 0F053F00C000000119000000 |                  14 |
|        19 |          173 |           3 | 31             | 0F053F00C00000011F000000 |                  15 |
|        19 |          175 |           1 | 6              | 0F053F00C000000106000000 |                  25 |
|        19 |          177 |           3 | 25             | 0F053F00C000000119000000 |                  11 |
|        19 |          177 |           3 | 31             | 0F053F00C00000011F000000 |                  10 |
|        19 |          178 |           2 | 13             | 0F053F00C00000010D000000 |                  17 |
|        19 |          186 |           3 | 26             | 0F053F00C00000011A000000 |                  13 |
|        19 |          186 |           3 | 32             | 0F053F00C000000120000000 |                  13 |
|        19 |          187 |           2 | 14             | 0F053F00C00000010E000000 |                  15 |
|        19 |          189 |           3 | 26             | 0F053F00C00000011A000000 |                  12 |
|        19 |          189 |           3 | 32             | 0F053F00C000000120000000 |                  12 |
|        19 |          199 |           3 | 33             | 0F053F00C000000121000000 |                  13 |
|        19 |          200 |           3 | 27             | 0F053F00C00000011B000000 |                  11 |
|        19 |          200 |           3 | 27             | 0F053F00C00000011B000000 |                  14 |
|        19 |          201 |           3 | 33             | 0F053F00C000000121000000 |                  12 |
|        19 |          202 |           2 | 15             | 0F053F00C00000010F000000 |                  14 |
|        19 |          212 |           3 | 28             | 0F053F00C00000011C000000 |                  12 |
|        19 |          213 |           2 | 16             | 0F053F00C000000110000000 |                  15 |
|        19 |          213 |           3 | 28             | 0F053F00C00000011C000000 |                  13 |
|        19 |          224 |           3 | 29             | 0F053F00C00000011D000000 |                  11 |
|        19 |          225 |           1 | 8              | 0F053F00C000000108000000 |                  25 |
|        19 |          226 |           3 | 29             | 0F053F00C00000011D000000 |                  14 |
|        19 |          230 |           2 | 18             | 0F053F00C000000112000000 |                  11 |
|        19 |          231 |           2 | 17             | 0F053F00C000000111000000 |                  19 |
|        19 |          236 |           3 | 34             | 0F053F00C000000122000000 |                  12 |
|        19 |          239 |           3 | 34             | 0F053F00C000000122000000 |                  13 |
|        19 |          245 |           2 | 19             | 0F053F00C000000113000000 |                  15 |
|        19 |          247 |           3 | 35             | 0F053F00C000000123000000 |                   8 |
|        19 |          253 |           3 | 35             | 0F053F00C000000123000000 |                  17 |
|        19 |          255 |           2 | 19             | 0F053F00C000000113000000 |                  10 |
|        19 |          260 |           2 | 20             | 0F053F00C000000114000000 |                  15 |
|        19 |          261 |           3 | 36             | 0F053F00C000000124000000 |                  14 |
|        19 |          264 |           3 | 36             | 0F053F00C000000124000000 |                  11 |
|        19 |          273 |           3 | 37             | 0F053F00C000000125000000 |                  12 |
|        19 |          275 |           1 | 10             | 0F053F00C00000010A000000 |                  25 |
|        19 |          277 |           3 | 37             | 0F053F00C000000125000000 |                  13 |
|        19 |          279 |           2 | 21             | 0F053F00C000000115000000 |                  14 |
|        19 |          282 |           2 | 22             | 0F053F00C000000116000000 |                  11 |
|        19 |          287 |           3 | 38             | 0F053F00C000000126000000 |                  10 |
|        19 |          288 |           3 | 38             | 0F053F00C000000126000000 |                  15 |
|        19 |          293 |           2 | 22             | 0F053F00C000000116000000 |                  14 |
|        19 |          299 |           3 | 39             | 0F053F00C000000127000000 |                  12 |
|        19 |          301 |           3 | 39             | 0F053F00C000000127000000 |                  13 |
|        19 |          307 |           2 | 23             | 0F053F00C000000117000000 |                  14 |
|        19 |          308 |           2 | 24             | 0F053F00C000000118000000 |                  15 |
|        19 |          325 |           1 | 12             | 0F053F00C00000010C000000 |                  25 |
|        19 |          331 |           2 | 25             | 0F053F00C000000119000000 |                  14 |
|        19 |          331 |           2 | 26             | 0F053F00C00000011A000000 |                  12 |
|        19 |          344 |           2 | 26             | 0F053F00C00000011A000000 |                  13 |
|        19 |          355 |           2 | 28             | 0F053F00C00000011C000000 |                  13 |
|        19 |          358 |           2 | 27             | 0F053F00C00000011B000000 |                  14 |
|        19 |          366 |           2 | 29             | 0F053F00C00000011D000000 |                  11 |
|        19 |          375 |           1 | 14             | 0F053F00C00000010E000000 |                  25 |
|        19 |          382 |           2 | 30             | 0F053F00C00000011E000000 |                  16 |
|        19 |          384 |           2 | 29             | 0F053F00C00000011D000000 |                  14 |
|        19 |          397 |           2 | 31             | 0F053F00C00000011F000000 |                  15 |
|        19 |          403 |           2 | 31             | 0F053F00C00000011F000000 |                  10 |
|        19 |          410 |           2 | 32             | 0F053F00C000000120000000 |                  13 |
|        19 |          415 |           2 | 32             | 0F053F00C000000120000000 |                  12 |
|        19 |          423 |           2 | 33             | 0F053F00C000000121000000 |                  13 |
|        19 |          425 |           1 | 16             | 0F053F00C000000110000000 |                  25 |
|        19 |          427 |           2 | 33             | 0F053F00C000000121000000 |                  12 |
|        19 |          435 |           2 | 34             | 0F053F00C000000122000000 |                  12 |
|        19 |          440 |           2 | 34             | 0F053F00C000000122000000 |                  13 |
|        19 |          452 |           2 | 35             | 0F053F00C000000123000000 |                  17 |
|        19 |          462 |           2 | 36             | 0F053F00C000000124000000 |                  14 |
|        19 |          463 |           2 | 36             | 0F053F00C000000124000000 |                  11 |
|        19 |          474 |           2 | 37             | 0F053F00C000000125000000 |                  12 |
|        19 |          475 |           1 | 18             | 0F053F00C000000112000000 |                  25 |
|        19 |          476 |           2 | 37             | 0F053F00C000000125000000 |                  13 |
|        19 |          486 |           2 | 38             | 0F053F00C000000126000000 |                  10 |
|        19 |          489 |           2 | 38             | 0F053F00C000000126000000 |                  15 |
|        19 |          498 |           2 | 39             | 0F053F00C000000127000000 |                  12 |
|        19 |          502 |           2 | 39             | 0F053F00C000000127000000 |                  13 |
|        19 |          525 |           1 | 20             | 0F053F00C000000114000000 |                  25 |
|        19 |          575 |           1 | 22             | 0F053F00C000000116000000 |                  25 |
|        19 |          600 |           1 | 23             | 0F053F00C000000117000000 |                  25 |
|        19 |          625 |           1 | 24             | 0F053F00C000000118000000 |                  25 |
|        19 |          650 |           1 | 25             | 0F053F00C000000119000000 |                  25 |
|        19 |          675 |           1 | 26             | 0F053F00C00000011A000000 |                  25 |
|        19 |          700 |           1 | 27             | 0F053F00C00000011B000000 |                  25 |
|        19 |          725 |           1 | 28             | 0F053F00C00000011C000000 |                  25 |
|        19 |          750 |           1 | 29             | 0F053F00C00000011D000000 |                  25 |
|        19 |          775 |           1 | 30             | 0F053F00C00000011E000000 |                  25 |
|        19 |          800 |           1 | 31             | 0F053F00C00000011F000000 |                  25 |
|        19 |          825 |           1 | 32             | 0F053F00C000000120000000 |                  25 |
|        19 |          850 |           1 | 33             | 0F053F00C000000121000000 |                  25 |
|        19 |          875 |           1 | 34             | 0F053F00C000000122000000 |                  25 |
|        19 |          900 |           1 | 35             | 0F053F00C000000123000000 |                  25 |
|        19 |          925 |           1 | 36             | 0F053F00C000000124000000 |                  25 |
|        19 |          950 |           1 | 37             | 0F053F00C000000125000000 |                  25 |
|        19 |          975 |           1 | 38             | 0F053F00C000000126000000 |                  25 |
|        19 |         1000 |           1 | 39             | 0F053F00C000000127000000 |                  25 |
+-----------+--------------+-------------+----------------+--------------------------+---------------------+
delete from oceanbase.__all_table_stat;
delete from oceanbase.__all_column_stat;
delete from oceanbase.__all_histogram_stat;
analyze table t3 partition(p0spa) compute statistics for all columns size 30;
select object_type, row_cnt from oceanbase.__all_table_stat order by 1, 2;
+-------------+---------+
| object_type | row_cnt |
+-------------+---------+
|           3 |     201 |
+-------------+---------+
select column_id, object_type, min_value, max_value, distinct_cnt, sample_size, density, bucket_cnt, histogram_type from oceanbase.__all_column_stat order by 1, 2,3,4;
+-----------+-------------+-----------+-----------+--------------+-------------+-----------------------+------------+----------------+
| column_id | object_type | min_value | max_value | distinct_cnt | sample_size | density               | bucket_cnt | histogram_type |
+-----------+-------------+-----------+-----------+--------------+-------------+-----------------------+------------+----------------+
|        16 |           3 | 2         | 992       |          201 |         201 |  0.004975124378109453 |         30 |              4 |
|        17 |           3 | 0         | 3         |            4 |         201 | 0.0024875621890547263 |          4 |              1 |
|        18 |           3 | 0         | 13        |            8 |         201 | 0.0024875621890547263 |          8 |              1 |
|        19 |           3 | 0         | 33        |           16 |         201 | 0.0024875621890547263 |         16 |              1 |
+-----------+-------------+-----------+-----------+--------------+-------------+-----------------------+------------+----------------+
select column_id, endpoint_num, object_type, endpoint_value, b_endpoint_value, endpoint_repeat_cnt from oceanbase.__all_histogram_stat order by 1, 2,3,4;
+-----------+--------------+-------------+----------------+--------------------------+---------------------+
| column_id | endpoint_num | object_type | endpoint_value | b_endpoint_value         | endpoint_repeat_cnt |
+-----------+--------------+-------------+----------------+--------------------------+---------------------+
|        16 |            1 |           3 | 2              | 0F053F00C000000102000000 |                   1 |
|        16 |            8 |           3 | 33             | 0F053F00C000000121000000 |                   1 |
|        16 |           15 |           3 | 61             | 0F053F00C00000013D000000 |                   1 |
|        16 |           22 |           3 | 112            | 0F053F00C000000170000000 |                   1 |
|        16 |           29 |           3 | 153            | 0F053F00C000000199000000 |                   1 |
|        16 |           36 |           3 | 191            | 0F053F00C0000001BF000000 |                   1 |
|        16 |           43 |           3 | 213            | 0F053F00C0000001D5000000 |                   1 |
|        16 |           50 |           3 | 251            | 0F053F00C0000001FB000000 |                   1 |
|        16 |           57 |           3 | 280            | 0F053F00C000000118010000 |                   1 |
|        16 |           64 |           3 | 312            | 0F053F00C000000138010000 |                   1 |
|        16 |           71 |           3 | 350            | 0F053F00C00000015E010000 |                   1 |
|        16 |           78 |           3 | 383            | 0F053F00C00000017F010000 |                   1 |
|        16 |           85 |           3 | 420            | 0F053F00C0000001A4010000 |                   1 |
|        16 |           92 |           3 | 450            | 0F053F00C0000001C2010000 |                   1 |
|        16 |           99 |           3 | 473            | 0F053F00C0000001D9010000 |                   1 |
|        16 |          106 |           3 | 511            | 0F053F00C0000001FF010000 |                   1 |
|        16 |          113 |           3 | 542            | 0F053F00C00000011E020000 |                   1 |
|        16 |          120 |           3 | 583            | 0F053F00C000000147020000 |                   1 |
|        16 |          127 |           3 | 632            | 0F053F00C000000178020000 |                   1 |
|        16 |          134 |           3 | 662            | 0F053F00C000000196020000 |                   1 |
|        16 |          141 |           3 | 710            | 0F053F00C0000001C6020000 |                   1 |
|        16 |          148 |           3 | 742            | 0F053F00C0000001E6020000 |                   1 |
|        16 |          155 |           3 | 781            | 0F053F00C00000010D030000 |                   1 |
|        16 |          162 |           3 | 810            | 0F053F00C00000012A030000 |                   1 |
|        16 |          169 |           3 | 840            | 0F053F00C000000148030000 |                   1 |
|        16 |          176 |           3 | 881            | 0F053F00C000000171030000 |                   1 |
|        16 |          183 |           3 | 902            | 0F053F00C000000186030000 |                   1 |
|        16 |          190 |           3 | 942            | 0F053F00C0000001AE030000 |                   1 |
|        16 |          196 |           3 | 963            | 0F053F00C0000001C3030000 |                   1 |
|        16 |          201 |           3 | 992            | 0F053F00C0000001E0030000 |                   1 |
|        17 |           47 |           3 | 0              | 0F053F0080000000         |                  47 |
|        17 |           93 |           3 | 1              | 0F053F00C000000101000000 |                  46 |
|        17 |          141 |           3 | 2              | 0F053F00C000000102000000 |                  48 |
|        17 |          201 |           3 | 3              | 0F053F00C000000103000000 |                  60 |
|        18 |           23 |           3 | 0              | 0F053F0080000000         |                  23 |
|        18 |           51 |           3 | 1              | 0F053F00C000000101000000 |                  28 |
|        18 |           76 |           3 | 2              | 0F053F00C000000102000000 |                  25 |
|        18 |          107 |           3 | 3              | 0F053F00C000000103000000 |                  31 |
|        18 |          131 |           3 | 10             | 0F053F00C00000010A000000 |                  24 |
|        18 |          149 |           3 | 11             | 0F053F00C00000010B000000 |                  18 |
|        18 |          172 |           3 | 12             | 0F053F00C00000010C000000 |                  23 |
|        18 |          201 |           3 | 13             | 0F053F00C00000010D000000 |                  29 |
|        19 |           13 |           3 | 0              | 0F053F0080000000         |                  13 |
|        19 |           27 |           3 | 1              | 0F053F00C000000101000000 |                  14 |
|        19 |           38 |           3 | 2              | 0F053F00C000000102000000 |                  11 |
|        19 |           55 |           3 | 3              | 0F053F00C000000103000000 |                  17 |
|        19 |           70 |           3 | 10             | 0F053F00C00000010A000000 |                  15 |
|        19 |           78 |           3 | 11             | 0F053F00C00000010B000000 |                   8 |
|        19 |           89 |           3 | 12             | 0F053F00C00000010C000000 |                  11 |
|        19 |          106 |           3 | 13             | 0F053F00C00000010D000000 |                  17 |
|        19 |          116 |           3 | 20             | 0F053F00C000000114000000 |                  10 |
|        19 |          130 |           3 | 21             | 0F053F00C000000115000000 |                  14 |
|        19 |          144 |           3 | 22             | 0F053F00C000000116000000 |                  14 |
|        19 |          158 |           3 | 23             | 0F053F00C000000117000000 |                  14 |
|        19 |          167 |           3 | 30             | 0F053F00C00000011E000000 |                   9 |
|        19 |          177 |           3 | 31             | 0F053F00C00000011F000000 |                  10 |
|        19 |          189 |           3 | 32             | 0F053F00C000000120000000 |                  12 |
|        19 |          201 |           3 | 33             | 0F053F00C000000121000000 |                  12 |
+-----------+--------------+-------------+----------------+--------------------------+---------------------+
delete from oceanbase.__all_table_stat;
delete from oceanbase.__all_column_stat;
delete from oceanbase.__all_histogram_stat;
analyze table t4 compute statistics for all columns;
select * from t4 where c1 = '123';
+------+
| C1   |
+------+
+------+
select object_type, row_cnt from oceanbase.__all_table_stat order by 1, 2;
+-------------+---------+
| object_type | row_cnt |
+-------------+---------+
|           1 |       2 |
+-------------+---------+
select column_id, object_type, min_value, max_value, distinct_cnt, sample_size, density, bucket_cnt, histogram_type from oceanbase.__all_column_stat order by 1, 2,3,4;
+-----------+-------------+-----------+-----------+--------------+-------------+---------+------------+----------------+
| column_id | object_type | min_value | max_value | distinct_cnt | sample_size | density | bucket_cnt | histogram_type |
+-----------+-------------+-----------+-----------+--------------+-------------+---------+------------+----------------+
|        16 |           1 | '100'     | '200'     |            2 |           2 |    0.25 |          2 |              1 |
+-----------+-------------+-----------+-----------+--------------+-------------+---------+------------+----------------+
select column_id, endpoint_num, object_type, endpoint_value, b_endpoint_value, endpoint_repeat_cnt from oceanbase.__all_histogram_stat order by 1, 2,3,4;
+-----------+--------------+-------------+----------------+--------------------+---------------------+
| column_id | endpoint_num | object_type | endpoint_value | b_endpoint_value   | endpoint_repeat_cnt |
+-----------+--------------+-------------+----------------+--------------------+---------------------+
|        16 |            1 |           1 | '100'          | 16022EFF0331303000 |                   1 |
|        16 |            2 |           1 | '200'          | 16022EFF0332303000 |                   1 |
+-----------+--------------+-------------+----------------+--------------------+---------------------+
delete from oceanbase.__all_table_stat;
delete from oceanbase.__all_column_stat;
delete from oceanbase.__all_histogram_stat;
analyze table t1 compute statistics for all columns;
analyze table t2 compute statistics for all columns;
analyze table t3 compute statistics for all columns;
select  object_type, row_cnt, avg_row_len from oceanbase.__all_table_stat order by table_id, 1, 2;
+-------------+---------+-------------+
| object_type | row_cnt | avg_row_len |
+-------------+---------+-------------+
|           1 |    1000 |          80 |
|           1 |    1000 |          80 |
|           2 |     498 |          80 |
|           2 |     502 |          80 |
|           1 |    1000 |          79 |
|           2 |     498 |          79 |
|           2 |     502 |          79 |
|           3 |     199 |          78 |
|           3 |     201 |          79 |
|           3 |     299 |          80 |
|           3 |     301 |          80 |
+-------------+---------+-------------+
delete from oceanbase.__all_table_stat;
delete from oceanbase.__all_column_stat;
delete from oceanbase.__all_histogram_stat;
drop table  t0;
drop table  t1;
drop table  t2;
drop table  t3;
drop table  t4;
