drop table t1;
drop table t_part;
drop table t_subpart;
drop view index_stats_view;
drop table t2;
create table t1 (c1 int, c2 int, c3 int);
create index idx1_t1 on t1(c2);
create table t_part (c1 int primary key, c2 int, c3 int) partition by hash(c1) partitions 4;
create index idx1_part on t_part(c2);
create table t_subpart (c1 int, c2 int, c3 int) partition by hash(c1)
subpartition by hash(c2)
subpartition template
(
subpartition p0,
subpartition p1,
subpartition p2
)
partitions 3;
create index idx1_subpart on t_subpart(c2) local;
create table t2(c1 int, c2 int, c3 int);
result_format: 4
##desc gv$dml_stats, dba_tab_modifications;
desc gv$dml_stats;
+----------+--------------+------+-----+---------+-------+
| FIELD    | TYPE         | NULL | KEY | DEFAULT | EXTRA |
+----------+--------------+------+-----+---------+-------+
| SVR_IP   | VARCHAR2(46) | NO   | NULL | NULL    | NULL  |
| SVR_PORT | NUMBER       | NO   | NULL | NULL    | NULL  |
| INST_ID  | NUMBER       | NO   | NULL | NULL    | NULL  |
| OBJN     | NUMBER       | NO   | NULL | NULL    | NULL  |
| INS      | NUMBER       | NO   | NULL | NULL    | NULL  |
| UPD      | NUMBER       | NO   | NULL | NULL    | NULL  |
| DEL      | NUMBER       | NO   | NULL | NULL    | NULL  |
| DROPSEG  | NUMBER       | NO   | NULL | NULL    | NULL  |
| CURROWS  | NUMBER       | NO   | NULL | NULL    | NULL  |
| PAROBJN  | NUMBER       | NO   | NULL | NULL    | NULL  |
| LASTUSED | NUMBER       | NO   | NULL | NULL    | NULL  |
| FLAGS    | NUMBER       | NO   | NULL | NULL    | NULL  |
| CON_ID   | NUMBER       | NO   | NULL | NULL    | NULL  |
+----------+--------------+------+-----+---------+-------+

desc dba_tab_modifications;
+-------------------+---------------+------+-----+---------+-------+
| FIELD             | TYPE          | NULL | KEY | DEFAULT | EXTRA |
+-------------------+---------------+------+-----+---------+-------+
| TABLE_OWNER       | VARCHAR2(128) | YES  | NULL | NULL    | NULL  |
| TABLE_NAME        | VARCHAR2(128) | YES  | NULL | NULL    | NULL  |
| PARTITION_NAME    | VARCHAR2(128) | YES  | NULL | NULL    | NULL  |
| SUBPARTITION_NAME | VARCHAR2(128) | YES  | NULL | NULL    | NULL  |
| INSERTS           | NUMBER        | NO   | NULL | NULL    | NULL  |
| UPDATES           | NUMBER        | NO   | NULL | NULL    | NULL  |
| DELETES           | NUMBER        | NO   | NULL | NULL    | NULL  |
| TIMESTAMP         | DATE          | NO   | NULL | NULL    | NULL  |
| TRUNCATED         | VARCHAR2(3)   | NO   | NULL | NULL    | NULL  |
| DROP_SEGMENTS     | NUMBER        | NO   | NULL | NULL    | NULL  |
+-------------------+---------------+------+-----+---------+-------+

##test insert count stats
insert into t1 select level,level,level from dual connect by level<=100;
insert into t_part select level,level,level from dual connect by level<=1000;
insert into t_subpart select level,level,level from dual connect by level<=10000;
insert into t2 select level+500,level+3500,level+30500 from dual connect by level<=1000;
alter system minor freeze tenant = sys;
alter system minor freeze tenant = all_user;
alter system minor freeze tenant = all_meta;
select TABLE_OWNER,TABLE_NAME,PARTITION_NAME,SUBPARTITION_NAME,INSERTS,UPDATES,DELETES from dba_tab_modifications where TABLE_OWNER='TEST' and table_name in ('T1','T_PART','T_SUBPART');
+-------------+------------+----------------+-------------------+---------+---------+---------+
| TABLE_OWNER | TABLE_NAME | PARTITION_NAME | SUBPARTITION_NAME | INSERTS | UPDATES | DELETES |
+-------------+------------+----------------+-------------------+---------+---------+---------+
| TEST        | T1         | NULL           | NULL              |     100 |       0 |       0 |
| TEST        | T_PART     | P0             | NULL              |     251 |       0 |       0 |
| TEST        | T_PART     | P1             | NULL              |     246 |       0 |       0 |
| TEST        | T_PART     | P2             | NULL              |     252 |       0 |       0 |
| TEST        | T_PART     | P3             | NULL              |     251 |       0 |       0 |
| TEST        | T_SUBPART  | NULL           | P0SP0             |    2530 |       0 |       0 |
| TEST        | T_SUBPART  | NULL           | P1SP1             |    4966 |       0 |       0 |
| TEST        | T_SUBPART  | NULL           | P2SP2             |    2504 |       0 |       0 |
+-------------+------------+----------------+-------------------+---------+---------+---------+

insert into t1 select level+100,level+100,level+100 from dual connect by level<=100;
insert into t_part select level+1000,level+1000,level+1000 from dual connect by level<=1000;
insert into t_subpart select level+10000,level+10000,level+10000 from dual connect by level<=10000;
alter system minor freeze tenant = sys;
alter system minor freeze tenant = all_user;
alter system minor freeze tenant = all_meta;
select TABLE_OWNER,TABLE_NAME,PARTITION_NAME,SUBPARTITION_NAME,INSERTS,UPDATES,DELETES from dba_tab_modifications where TABLE_OWNER='TEST' and table_name in ('T1','T_PART','T_SUBPART');
+-------------+------------+----------------+-------------------+---------+---------+---------+
| TABLE_OWNER | TABLE_NAME | PARTITION_NAME | SUBPARTITION_NAME | INSERTS | UPDATES | DELETES |
+-------------+------------+----------------+-------------------+---------+---------+---------+
| TEST        | T1         | NULL           | NULL              |     200 |       0 |       0 |
| TEST        | T_PART     | P0             | NULL              |     513 |       0 |       0 |
| TEST        | T_PART     | P1             | NULL              |     510 |       0 |       0 |
| TEST        | T_PART     | P2             | NULL              |     497 |       0 |       0 |
| TEST        | T_PART     | P3             | NULL              |     480 |       0 |       0 |
| TEST        | T_SUBPART  | NULL           | P0SP0             |    5024 |       0 |       0 |
| TEST        | T_SUBPART  | NULL           | P1SP1             |   10000 |       0 |       0 |
| TEST        | T_SUBPART  | NULL           | P2SP2             |    4976 |       0 |       0 |
+-------------+------------+----------------+-------------------+---------+---------+---------+

call dbms_stats.FLUSH_DATABASE_MONITORING_INFO();

select TABLE_OWNER,TABLE_NAME,PARTITION_NAME,SUBPARTITION_NAME,INSERTS,UPDATES,DELETES from dba_tab_modifications where TABLE_OWNER='TEST' and table_name in ('T1','T_PART','T_SUBPART');
+-------------+------------+----------------+-------------------+---------+---------+---------+
| TABLE_OWNER | TABLE_NAME | PARTITION_NAME | SUBPARTITION_NAME | INSERTS | UPDATES | DELETES |
+-------------+------------+----------------+-------------------+---------+---------+---------+
| TEST        | T1         | NULL           | NULL              |     200 |       0 |       0 |
| TEST        | T_PART     | P0             | NULL              |     513 |       0 |       0 |
| TEST        | T_PART     | P1             | NULL              |     510 |       0 |       0 |
| TEST        | T_PART     | P2             | NULL              |     497 |       0 |       0 |
| TEST        | T_PART     | P3             | NULL              |     480 |       0 |       0 |
| TEST        | T_SUBPART  | NULL           | P0SP0             |    5024 |       0 |       0 |
| TEST        | T_SUBPART  | NULL           | P1SP1             |   10000 |       0 |       0 |
| TEST        | T_SUBPART  | NULL           | P2SP2             |    4976 |       0 |       0 |
+-------------+------------+----------------+-------------------+---------+---------+---------+

insert into t1 select level+200,level+200,level+200 from dual connect by level<=100;
insert into t_part select level+2000,level+2000,level+2000 from dual connect by level<=1000;
insert into t_subpart select level+20000,level+20000,level+20000 from dual connect by level<=10000;
alter system minor freeze tenant = sys;
alter system minor freeze tenant = all_user;
alter system minor freeze tenant = all_meta;
select TABLE_OWNER,TABLE_NAME,PARTITION_NAME,SUBPARTITION_NAME,INSERTS,UPDATES,DELETES from dba_tab_modifications where TABLE_OWNER='TEST' and table_name in ('T1','T_PART','T_SUBPART');
+-------------+------------+----------------+-------------------+---------+---------+---------+
| TABLE_OWNER | TABLE_NAME | PARTITION_NAME | SUBPARTITION_NAME | INSERTS | UPDATES | DELETES |
+-------------+------------+----------------+-------------------+---------+---------+---------+
| TEST        | T1         | NULL           | NULL              |     300 |       0 |       0 |
| TEST        | T_PART     | P0             | NULL              |     766 |       0 |       0 |
| TEST        | T_PART     | P1             | NULL              |     757 |       0 |       0 |
| TEST        | T_PART     | P2             | NULL              |     763 |       0 |       0 |
| TEST        | T_PART     | P3             | NULL              |     714 |       0 |       0 |
| TEST        | T_SUBPART  | NULL           | P0SP0             |    7541 |       0 |       0 |
| TEST        | T_SUBPART  | NULL           | P1SP1             |   15030 |       0 |       0 |
| TEST        | T_SUBPART  | NULL           | P2SP2             |    7429 |       0 |       0 |
+-------------+------------+----------------+-------------------+---------+---------+---------+

call dbms_stats.FLUSH_DATABASE_MONITORING_INFO();

select TABLE_OWNER,TABLE_NAME,PARTITION_NAME,SUBPARTITION_NAME,INSERTS,UPDATES,DELETES from dba_tab_modifications where TABLE_OWNER='TEST' and table_name in ('T1','T_PART','T_SUBPART');
+-------------+------------+----------------+-------------------+---------+---------+---------+
| TABLE_OWNER | TABLE_NAME | PARTITION_NAME | SUBPARTITION_NAME | INSERTS | UPDATES | DELETES |
+-------------+------------+----------------+-------------------+---------+---------+---------+
| TEST        | T1         | NULL           | NULL              |     300 |       0 |       0 |
| TEST        | T_PART     | P0             | NULL              |     766 |       0 |       0 |
| TEST        | T_PART     | P1             | NULL              |     757 |       0 |       0 |
| TEST        | T_PART     | P2             | NULL              |     763 |       0 |       0 |
| TEST        | T_PART     | P3             | NULL              |     714 |       0 |       0 |
| TEST        | T_SUBPART  | NULL           | P0SP0             |    7541 |       0 |       0 |
| TEST        | T_SUBPART  | NULL           | P1SP1             |   15030 |       0 |       0 |
| TEST        | T_SUBPART  | NULL           | P2SP2             |    7429 |       0 |       0 |
+-------------+------------+----------------+-------------------+---------+---------+---------+

##insert all
insert all into t1 values(cc+300,cc+300,cc+300) into t_part values(cc+3000,cc+3000,cc+3000) into t_subpart values(cc+30000,cc+30000,cc+30000) select level as cc from dual connect by level<=1000;
alter system minor freeze tenant = sys;
alter system minor freeze tenant = all_user;
alter system minor freeze tenant = all_meta;
select TABLE_OWNER,TABLE_NAME,PARTITION_NAME,SUBPARTITION_NAME,INSERTS,UPDATES,DELETES from dba_tab_modifications where TABLE_OWNER='TEST' and table_name in ('T1','T_PART','T_SUBPART');
+-------------+------------+----------------+-------------------+---------+---------+---------+
| TABLE_OWNER | TABLE_NAME | PARTITION_NAME | SUBPARTITION_NAME | INSERTS | UPDATES | DELETES |
+-------------+------------+----------------+-------------------+---------+---------+---------+
| TEST        | T1         | NULL           | NULL              |    1300 |       0 |       0 |
| TEST        | T_PART     | P0             | NULL              |    1013 |       0 |       0 |
| TEST        | T_PART     | P1             | NULL              |    1005 |       0 |       0 |
| TEST        | T_PART     | P2             | NULL              |    1014 |       0 |       0 |
| TEST        | T_PART     | P3             | NULL              |     968 |       0 |       0 |
| TEST        | T_SUBPART  | NULL           | P0SP0             |    7808 |       0 |       0 |
| TEST        | T_SUBPART  | NULL           | P1SP1             |   15529 |       0 |       0 |
| TEST        | T_SUBPART  | NULL           | P2SP2             |    7663 |       0 |       0 |
+-------------+------------+----------------+-------------------+---------+---------+---------+

call dbms_stats.FLUSH_DATABASE_MONITORING_INFO();

select TABLE_OWNER,TABLE_NAME,PARTITION_NAME,SUBPARTITION_NAME,INSERTS,UPDATES,DELETES from dba_tab_modifications where TABLE_OWNER='TEST' and table_name in ('T1','T_PART','T_SUBPART');
+-------------+------------+----------------+-------------------+---------+---------+---------+
| TABLE_OWNER | TABLE_NAME | PARTITION_NAME | SUBPARTITION_NAME | INSERTS | UPDATES | DELETES |
+-------------+------------+----------------+-------------------+---------+---------+---------+
| TEST        | T1         | NULL           | NULL              |    1300 |       0 |       0 |
| TEST        | T_PART     | P0             | NULL              |    1013 |       0 |       0 |
| TEST        | T_PART     | P1             | NULL              |    1005 |       0 |       0 |
| TEST        | T_PART     | P2             | NULL              |    1014 |       0 |       0 |
| TEST        | T_PART     | P3             | NULL              |     968 |       0 |       0 |
| TEST        | T_SUBPART  | NULL           | P0SP0             |    7808 |       0 |       0 |
| TEST        | T_SUBPART  | NULL           | P1SP1             |   15529 |       0 |       0 |
| TEST        | T_SUBPART  | NULL           | P2SP2             |    7663 |       0 |       0 |
+-------------+------------+----------------+-------------------+---------+---------+---------+

##test update count stats
update t1 set c1 = 10000 where c1 <= 100;
update t_part set c3 = 100000 where c1 <= 1000;
update t_subpart set c3 = 1000000 where c1 <= 10000;
alter system minor freeze tenant = sys;
alter system minor freeze tenant = all_user;
alter system minor freeze tenant = all_meta;
select TABLE_OWNER,TABLE_NAME,PARTITION_NAME,SUBPARTITION_NAME,INSERTS,UPDATES,DELETES from dba_tab_modifications where TABLE_OWNER='TEST' and table_name in ('T1','T_PART','T_SUBPART');
+-------------+------------+----------------+-------------------+---------+---------+---------+
| TABLE_OWNER | TABLE_NAME | PARTITION_NAME | SUBPARTITION_NAME | INSERTS | UPDATES | DELETES |
+-------------+------------+----------------+-------------------+---------+---------+---------+
| TEST        | T1         | NULL           | NULL              |    1300 |     100 |       0 |
| TEST        | T_PART     | P0             | NULL              |    1013 |     251 |       0 |
| TEST        | T_PART     | P1             | NULL              |    1005 |     246 |       0 |
| TEST        | T_PART     | P2             | NULL              |    1014 |     252 |       0 |
| TEST        | T_PART     | P3             | NULL              |     968 |     251 |       0 |
| TEST        | T_SUBPART  | NULL           | P0SP0             |    7808 |    2530 |       0 |
| TEST        | T_SUBPART  | NULL           | P1SP1             |   15529 |    4966 |       0 |
| TEST        | T_SUBPART  | NULL           | P2SP2             |    7663 |    2504 |       0 |
+-------------+------------+----------------+-------------------+---------+---------+---------+

call dbms_stats.FLUSH_DATABASE_MONITORING_INFO();

select TABLE_OWNER,TABLE_NAME,PARTITION_NAME,SUBPARTITION_NAME,INSERTS,UPDATES,DELETES from dba_tab_modifications where TABLE_OWNER='TEST' and table_name in ('T1','T_PART','T_SUBPART');
+-------------+------------+----------------+-------------------+---------+---------+---------+
| TABLE_OWNER | TABLE_NAME | PARTITION_NAME | SUBPARTITION_NAME | INSERTS | UPDATES | DELETES |
+-------------+------------+----------------+-------------------+---------+---------+---------+
| TEST        | T1         | NULL           | NULL              |    1300 |     100 |       0 |
| TEST        | T_PART     | P0             | NULL              |    1013 |     251 |       0 |
| TEST        | T_PART     | P1             | NULL              |    1005 |     246 |       0 |
| TEST        | T_PART     | P2             | NULL              |    1014 |     252 |       0 |
| TEST        | T_PART     | P3             | NULL              |     968 |     251 |       0 |
| TEST        | T_SUBPART  | NULL           | P0SP0             |    7808 |    2530 |       0 |
| TEST        | T_SUBPART  | NULL           | P1SP1             |   15529 |    4966 |       0 |
| TEST        | T_SUBPART  | NULL           | P2SP2             |    7663 |    2504 |       0 |
+-------------+------------+----------------+-------------------+---------+---------+---------+

update t1 set c1 = 10000 where c1 > 100 and c1 <= 200;
update t_part set c3 = 100000 where c1 > 1000 and c1 <= 2000;
update t_subpart set c3 = 1000000 where c1 > 10000 and c1 <= 20000;
alter system minor freeze tenant = sys;
alter system minor freeze tenant = all_user;
alter system minor freeze tenant = all_meta;
select TABLE_OWNER,TABLE_NAME,PARTITION_NAME,SUBPARTITION_NAME,INSERTS,UPDATES,DELETES from dba_tab_modifications where TABLE_OWNER='TEST' and table_name in ('T1','T_PART','T_SUBPART');
+-------------+------------+----------------+-------------------+---------+---------+---------+
| TABLE_OWNER | TABLE_NAME | PARTITION_NAME | SUBPARTITION_NAME | INSERTS | UPDATES | DELETES |
+-------------+------------+----------------+-------------------+---------+---------+---------+
| TEST        | T1         | NULL           | NULL              |    1300 |     200 |       0 |
| TEST        | T_PART     | P0             | NULL              |    1013 |     513 |       0 |
| TEST        | T_PART     | P1             | NULL              |    1005 |     510 |       0 |
| TEST        | T_PART     | P2             | NULL              |    1014 |     497 |       0 |
| TEST        | T_PART     | P3             | NULL              |     968 |     480 |       0 |
| TEST        | T_SUBPART  | NULL           | P0SP0             |    7808 |    5024 |       0 |
| TEST        | T_SUBPART  | NULL           | P1SP1             |   15529 |   10000 |       0 |
| TEST        | T_SUBPART  | NULL           | P2SP2             |    7663 |    4976 |       0 |
+-------------+------------+----------------+-------------------+---------+---------+---------+

call dbms_stats.FLUSH_DATABASE_MONITORING_INFO();

select TABLE_OWNER,TABLE_NAME,PARTITION_NAME,SUBPARTITION_NAME,INSERTS,UPDATES,DELETES from dba_tab_modifications where TABLE_OWNER='TEST' and table_name in ('T1','T_PART','T_SUBPART');
+-------------+------------+----------------+-------------------+---------+---------+---------+
| TABLE_OWNER | TABLE_NAME | PARTITION_NAME | SUBPARTITION_NAME | INSERTS | UPDATES | DELETES |
+-------------+------------+----------------+-------------------+---------+---------+---------+
| TEST        | T1         | NULL           | NULL              |    1300 |     200 |       0 |
| TEST        | T_PART     | P0             | NULL              |    1013 |     513 |       0 |
| TEST        | T_PART     | P1             | NULL              |    1005 |     510 |       0 |
| TEST        | T_PART     | P2             | NULL              |    1014 |     497 |       0 |
| TEST        | T_PART     | P3             | NULL              |     968 |     480 |       0 |
| TEST        | T_SUBPART  | NULL           | P0SP0             |    7808 |    5024 |       0 |
| TEST        | T_SUBPART  | NULL           | P1SP1             |   15529 |   10000 |       0 |
| TEST        | T_SUBPART  | NULL           | P2SP2             |    7663 |    4976 |       0 |
+-------------+------------+----------------+-------------------+---------+---------+---------+

##test delete count stats
delete from t1 where c2 <= 100;
delete from t_part where c2 <= 1000;
delete from t_subpart where c2 <= 10000;
alter system minor freeze tenant = sys;
alter system minor freeze tenant = all_user;
alter system minor freeze tenant = all_meta;
select TABLE_OWNER,TABLE_NAME,PARTITION_NAME,SUBPARTITION_NAME,INSERTS,UPDATES,DELETES from dba_tab_modifications where TABLE_OWNER='TEST' and table_name in ('T1','T_PART','T_SUBPART');
+-------------+------------+----------------+-------------------+---------+---------+---------+
| TABLE_OWNER | TABLE_NAME | PARTITION_NAME | SUBPARTITION_NAME | INSERTS | UPDATES | DELETES |
+-------------+------------+----------------+-------------------+---------+---------+---------+
| TEST        | T1         | NULL           | NULL              |    1300 |     200 |     100 |
| TEST        | T_PART     | P0             | NULL              |    1013 |     513 |     251 |
| TEST        | T_PART     | P1             | NULL              |    1005 |     510 |     246 |
| TEST        | T_PART     | P2             | NULL              |    1014 |     497 |     252 |
| TEST        | T_PART     | P3             | NULL              |     968 |     480 |     251 |
| TEST        | T_SUBPART  | NULL           | P0SP0             |    7808 |    5024 |    2530 |
| TEST        | T_SUBPART  | NULL           | P1SP1             |   15529 |   10000 |    4966 |
| TEST        | T_SUBPART  | NULL           | P2SP2             |    7663 |    4976 |    2504 |
+-------------+------------+----------------+-------------------+---------+---------+---------+

call dbms_stats.FLUSH_DATABASE_MONITORING_INFO();

select TABLE_OWNER,TABLE_NAME,PARTITION_NAME,SUBPARTITION_NAME,INSERTS,UPDATES,DELETES from dba_tab_modifications where TABLE_OWNER='TEST' and table_name in ('T1','T_PART','T_SUBPART');
+-------------+------------+----------------+-------------------+---------+---------+---------+
| TABLE_OWNER | TABLE_NAME | PARTITION_NAME | SUBPARTITION_NAME | INSERTS | UPDATES | DELETES |
+-------------+------------+----------------+-------------------+---------+---------+---------+
| TEST        | T1         | NULL           | NULL              |    1300 |     200 |     100 |
| TEST        | T_PART     | P0             | NULL              |    1013 |     513 |     251 |
| TEST        | T_PART     | P1             | NULL              |    1005 |     510 |     246 |
| TEST        | T_PART     | P2             | NULL              |    1014 |     497 |     252 |
| TEST        | T_PART     | P3             | NULL              |     968 |     480 |     251 |
| TEST        | T_SUBPART  | NULL           | P0SP0             |    7808 |    5024 |    2530 |
| TEST        | T_SUBPART  | NULL           | P1SP1             |   15529 |   10000 |    4966 |
| TEST        | T_SUBPART  | NULL           | P2SP2             |    7663 |    4976 |    2504 |
+-------------+------------+----------------+-------------------+---------+---------+---------+

delete from t1 where c2 > 100 and c2 <= 200;
delete from t_part where c2 > 1000 and c2 <= 2000;
delete from t_subpart where c2 > 10000 and c2 <= 20000;
alter system minor freeze tenant = sys;
alter system minor freeze tenant = all_user;
alter system minor freeze tenant = all_meta;
select TABLE_OWNER,TABLE_NAME,PARTITION_NAME,SUBPARTITION_NAME,INSERTS,UPDATES,DELETES from dba_tab_modifications where TABLE_OWNER='TEST' and table_name in ('T1','T_PART','T_SUBPART');
+-------------+------------+----------------+-------------------+---------+---------+---------+
| TABLE_OWNER | TABLE_NAME | PARTITION_NAME | SUBPARTITION_NAME | INSERTS | UPDATES | DELETES |
+-------------+------------+----------------+-------------------+---------+---------+---------+
| TEST        | T1         | NULL           | NULL              |    1300 |     200 |     200 |
| TEST        | T_PART     | P0             | NULL              |    1013 |     513 |     513 |
| TEST        | T_PART     | P1             | NULL              |    1005 |     510 |     510 |
| TEST        | T_PART     | P2             | NULL              |    1014 |     497 |     497 |
| TEST        | T_PART     | P3             | NULL              |     968 |     480 |     480 |
| TEST        | T_SUBPART  | NULL           | P0SP0             |    7808 |    5024 |    5024 |
| TEST        | T_SUBPART  | NULL           | P1SP1             |   15529 |   10000 |   10000 |
| TEST        | T_SUBPART  | NULL           | P2SP2             |    7663 |    4976 |    4976 |
+-------------+------------+----------------+-------------------+---------+---------+---------+

call dbms_stats.FLUSH_DATABASE_MONITORING_INFO();

select TABLE_OWNER,TABLE_NAME,PARTITION_NAME,SUBPARTITION_NAME,INSERTS,UPDATES,DELETES from dba_tab_modifications where TABLE_OWNER='TEST' and table_name in ('T1','T_PART','T_SUBPART');
+-------------+------------+----------------+-------------------+---------+---------+---------+
| TABLE_OWNER | TABLE_NAME | PARTITION_NAME | SUBPARTITION_NAME | INSERTS | UPDATES | DELETES |
+-------------+------------+----------------+-------------------+---------+---------+---------+
| TEST        | T1         | NULL           | NULL              |    1300 |     200 |     200 |
| TEST        | T_PART     | P0             | NULL              |    1013 |     513 |     513 |
| TEST        | T_PART     | P1             | NULL              |    1005 |     510 |     510 |
| TEST        | T_PART     | P2             | NULL              |    1014 |     497 |     497 |
| TEST        | T_PART     | P3             | NULL              |     968 |     480 |     480 |
| TEST        | T_SUBPART  | NULL           | P0SP0             |    7808 |    5024 |    5024 |
| TEST        | T_SUBPART  | NULL           | P1SP1             |   15529 |   10000 |   10000 |
| TEST        | T_SUBPART  | NULL           | P2SP2             |    7663 |    4976 |    4976 |
+-------------+------------+----------------+-------------------+---------+---------+---------+

##test ins/upd/del count stats
merge INTO t1 master USING t2 slave ON (master.c1=slave.c1) WHEN matched THEN UPDATE SET master.c2=slave.c2 delete where master.c1 > 900 when not matched then insert (c1,c2,c3) values (slave.c1,slave.c2,slave.c3);
merge INTO t_part master USING t2 slave ON (master.c1=slave.c2) WHEN matched THEN UPDATE SET master.c3=slave.c3 delete where master.c1 > 3750 when not matched then insert (c1,c2,c3) values (slave.c1,slave.c2,slave.c3);
merge INTO t_subpart master USING t2 slave ON (master.c1=slave.c3) WHEN matched THEN UPDATE SET master.c3=slave.c3 delete where master.c1 > 30750 when not matched then insert (c1,c2,c3) values (slave.c1,slave.c2,slave.c3);
alter system minor freeze tenant = sys;
alter system minor freeze tenant = all_user;
alter system minor freeze tenant = all_meta;
select TABLE_OWNER,TABLE_NAME,PARTITION_NAME,SUBPARTITION_NAME,INSERTS,UPDATES,DELETES from dba_tab_modifications where TABLE_OWNER='TEST' and table_name in ('T1','T_PART','T_SUBPART');
+-------------+------------+----------------+-------------------+---------+---------+---------+
| TABLE_OWNER | TABLE_NAME | PARTITION_NAME | SUBPARTITION_NAME | INSERTS | UPDATES | DELETES |
+-------------+------------+----------------+-------------------+---------+---------+---------+
| TEST        | T1         | NULL           | NULL              |    1500 |     600 |     600 |
| TEST        | T_PART     | P0             | NULL              |    1153 |     573 |     569 |
| TEST        | T_PART     | P1             | NULL              |    1134 |     582 |     569 |
| TEST        | T_PART     | P2             | NULL              |    1133 |     562 |     572 |
| TEST        | T_PART     | P3             | NULL              |    1080 |     533 |     540 |
| TEST        | T_SUBPART  | NULL           | P0SP0             |    7845 |    5099 |    5108 |
| TEST        | T_SUBPART  | NULL           | P0SP1             |      62 |       0 |       0 |
| TEST        | T_SUBPART  | NULL           | P0SP2             |      41 |       0 |       0 |
| TEST        | T_SUBPART  | NULL           | P1SP0             |      60 |       0 |       0 |
| TEST        | T_SUBPART  | NULL           | P1SP1             |   15660 |   10123 |   10108 |
| TEST        | T_SUBPART  | NULL           | P1SP2             |      50 |       0 |       0 |
| TEST        | T_SUBPART  | NULL           | P2SP0             |      32 |       0 |       0 |
| TEST        | T_SUBPART  | NULL           | P2SP1             |      54 |       0 |       0 |
| TEST        | T_SUBPART  | NULL           | P2SP2             |    7696 |    5028 |    5034 |
+-------------+------------+----------------+-------------------+---------+---------+---------+

call dbms_stats.FLUSH_DATABASE_MONITORING_INFO();

select TABLE_OWNER,TABLE_NAME,PARTITION_NAME,SUBPARTITION_NAME,INSERTS,UPDATES,DELETES from dba_tab_modifications where TABLE_OWNER='TEST' and table_name in ('T1','T_PART','T_SUBPART');
+-------------+------------+----------------+-------------------+---------+---------+---------+
| TABLE_OWNER | TABLE_NAME | PARTITION_NAME | SUBPARTITION_NAME | INSERTS | UPDATES | DELETES |
+-------------+------------+----------------+-------------------+---------+---------+---------+
| TEST        | T1         | NULL           | NULL              |    1500 |     600 |     600 |
| TEST        | T_PART     | P0             | NULL              |    1153 |     573 |     569 |
| TEST        | T_PART     | P1             | NULL              |    1134 |     582 |     569 |
| TEST        | T_PART     | P2             | NULL              |    1133 |     562 |     572 |
| TEST        | T_PART     | P3             | NULL              |    1080 |     533 |     540 |
| TEST        | T_SUBPART  | NULL           | P0SP0             |    7845 |    5099 |    5108 |
| TEST        | T_SUBPART  | NULL           | P0SP1             |      62 |       0 |       0 |
| TEST        | T_SUBPART  | NULL           | P0SP2             |      41 |       0 |       0 |
| TEST        | T_SUBPART  | NULL           | P1SP0             |      60 |       0 |       0 |
| TEST        | T_SUBPART  | NULL           | P1SP1             |   15660 |   10123 |   10108 |
| TEST        | T_SUBPART  | NULL           | P1SP2             |      50 |       0 |       0 |
| TEST        | T_SUBPART  | NULL           | P2SP0             |      32 |       0 |       0 |
| TEST        | T_SUBPART  | NULL           | P2SP1             |      54 |       0 |       0 |
| TEST        | T_SUBPART  | NULL           | P2SP2             |    7696 |    5028 |    5034 |
+-------------+------------+----------------+-------------------+---------+---------+---------+

merge INTO t1 master USING t2 slave ON (master.c1=slave.c1) WHEN matched THEN UPDATE SET master.c2=slave.c2 delete where master.c1 < 900 when not matched then insert (c1,c2,c3) values (slave.c1,slave.c2,slave.c3);
merge INTO t_part master USING t2 slave ON (master.c1=slave.c2) WHEN matched THEN UPDATE SET master.c3=slave.c3 delete where master.c1 < 3750 when not matched then insert (c1,c2,c3) values (slave.c1+100000,slave.c2+100000,slave.c3+100000);
merge INTO t_subpart master USING t2 slave ON (master.c1=slave.c3) WHEN matched THEN UPDATE SET master.c3=slave.c3 delete where master.c1 < 30750 when not matched then insert (c1,c2,c3) values (slave.c1,slave.c2,slave.c3);
alter system minor freeze tenant = sys;
alter system minor freeze tenant = all_user;
alter system minor freeze tenant = all_meta;
select TABLE_OWNER,TABLE_NAME,PARTITION_NAME,SUBPARTITION_NAME,INSERTS,UPDATES,DELETES from dba_tab_modifications where TABLE_OWNER='TEST' and table_name in ('T1','T_PART','T_SUBPART');
+-------------+------------+----------------+-------------------+---------+---------+---------+
| TABLE_OWNER | TABLE_NAME | PARTITION_NAME | SUBPARTITION_NAME | INSERTS | UPDATES | DELETES |
+-------------+------------+----------------+-------------------+---------+---------+---------+
| TEST        | T1         | NULL           | NULL              |    1900 |     801 |     999 |
| TEST        | T_PART     | P0             | NULL              |    1342 |     573 |     629 |
| TEST        | T_PART     | P1             | NULL              |    1326 |     583 |     640 |
| TEST        | T_PART     | P2             | NULL              |    1330 |     562 |     637 |
| TEST        | T_PART     | P3             | NULL              |    1252 |     533 |     593 |
| TEST        | T_SUBPART  | NULL           | P0SP0             |    7895 |    5099 |    5183 |
| TEST        | T_SUBPART  | NULL           | P0SP1             |     155 |       0 |       0 |
| TEST        | T_SUBPART  | NULL           | P0SP2             |     103 |       0 |       0 |
| TEST        | T_SUBPART  | NULL           | P1SP0             |     153 |       0 |       0 |
| TEST        | T_SUBPART  | NULL           | P1SP1             |   15845 |   10124 |   10230 |
| TEST        | T_SUBPART  | NULL           | P1SP2             |     134 |       0 |       0 |
| TEST        | T_SUBPART  | NULL           | P2SP0             |      74 |       0 |       0 |
| TEST        | T_SUBPART  | NULL           | P2SP1             |     142 |       0 |       0 |
| TEST        | T_SUBPART  | NULL           | P2SP2             |    7749 |    5028 |    5086 |
+-------------+------------+----------------+-------------------+---------+---------+---------+

call dbms_stats.FLUSH_DATABASE_MONITORING_INFO();

select TABLE_OWNER,TABLE_NAME,PARTITION_NAME,SUBPARTITION_NAME,INSERTS,UPDATES,DELETES from dba_tab_modifications where TABLE_OWNER='TEST' and table_name in ('T1','T_PART','T_SUBPART');
+-------------+------------+----------------+-------------------+---------+---------+---------+
| TABLE_OWNER | TABLE_NAME | PARTITION_NAME | SUBPARTITION_NAME | INSERTS | UPDATES | DELETES |
+-------------+------------+----------------+-------------------+---------+---------+---------+
| TEST        | T1         | NULL           | NULL              |    1900 |     801 |     999 |
| TEST        | T_PART     | P0             | NULL              |    1342 |     573 |     629 |
| TEST        | T_PART     | P1             | NULL              |    1326 |     583 |     640 |
| TEST        | T_PART     | P2             | NULL              |    1330 |     562 |     637 |
| TEST        | T_PART     | P3             | NULL              |    1252 |     533 |     593 |
| TEST        | T_SUBPART  | NULL           | P0SP0             |    7895 |    5099 |    5183 |
| TEST        | T_SUBPART  | NULL           | P0SP1             |     155 |       0 |       0 |
| TEST        | T_SUBPART  | NULL           | P0SP2             |     103 |       0 |       0 |
| TEST        | T_SUBPART  | NULL           | P1SP0             |     153 |       0 |       0 |
| TEST        | T_SUBPART  | NULL           | P1SP1             |   15845 |   10124 |   10230 |
| TEST        | T_SUBPART  | NULL           | P1SP2             |     134 |       0 |       0 |
| TEST        | T_SUBPART  | NULL           | P2SP0             |      74 |       0 |       0 |
| TEST        | T_SUBPART  | NULL           | P2SP1             |     142 |       0 |       0 |
| TEST        | T_SUBPART  | NULL           | P2SP2             |    7749 |    5028 |    5086 |
+-------------+------------+----------------+-------------------+---------+---------+---------+

drop table t1;
drop table t2;
drop table t_part;
drop table t_subpart;

##test gather table stats consider the stats whether is expired.
##build new tenant.


## 功能: 获取指定租户的ip&port
## 用法:
## 模板:




call dbms_stats.gather_table_stats('SYS','ALL_VIRTUAL_CORE_ALL_TABLE');
call dbms_stats.gather_table_stats('SYS','ALL_VIRTUAL_CORE_COLUMN_TABLE');

drop table t1;
drop table t_part;
drop table t_subpart;
drop view index_stats_view;
create table t1 (c1 int, c2 int, c3 int);
create index idx1_t1 on t1(c2);

create table t_part (c1 int primary key, c2 int, c3 int) partition by hash(c1) partitions 4;
create index idx1_part on t_part(c2);

create table t_subpart (c1 int, c2 int, c3 int) partition by hash(c1)
subpartition by range(c2)
subpartition template
(
  subpartition p0 values less than (3000),
  subpartition p1 values less than (6000),
  subpartition p2 values less than (MAXVALUE)
)
partitions 3;
create index idx1_subpart on t_subpart(c2) local;

insert into t1 select level,level,level from dual connect by level<=100;
insert into t_part select level,level,level from dual connect by level<=1000;
insert into t_subpart select level,level,level from dual connect by level<=10000;
alter system minor freeze tenant = sys;
alter system minor freeze tenant = all_user;
alter system minor freeze tenant = all_meta;
select TABLE_OWNER,TABLE_NAME,PARTITION_NAME,SUBPARTITION_NAME,INSERTS,UPDATES,DELETES from dba_tab_modifications where TABLE_OWNER='USTAT' and table_name in ('T1','T_PART','T_SUBPART');
+-------------+------------+----------------+-------------------+---------+---------+---------+
| TABLE_OWNER | TABLE_NAME | PARTITION_NAME | SUBPARTITION_NAME | INSERTS | UPDATES | DELETES |
+-------------+------------+----------------+-------------------+---------+---------+---------+
| USTAT       | T1         | NULL           | NULL              |     100 |       0 |       0 |
| USTAT       | T_PART     | P0             | NULL              |     251 |       0 |       0 |
| USTAT       | T_PART     | P1             | NULL              |     246 |       0 |       0 |
| USTAT       | T_PART     | P2             | NULL              |     252 |       0 |       0 |
| USTAT       | T_PART     | P3             | NULL              |     251 |       0 |       0 |
| USTAT       | T_SUBPART  | NULL           | P0SP0             |     766 |       0 |       0 |
| USTAT       | T_SUBPART  | NULL           | P0SP1             |     744 |       0 |       0 |
| USTAT       | T_SUBPART  | NULL           | P0SP2             |    1020 |       0 |       0 |
| USTAT       | T_SUBPART  | NULL           | P1SP0             |    1470 |       0 |       0 |
| USTAT       | T_SUBPART  | NULL           | P1SP1             |    1509 |       0 |       0 |
| USTAT       | T_SUBPART  | NULL           | P1SP2             |    1987 |       0 |       0 |
| USTAT       | T_SUBPART  | NULL           | P2SP0             |     763 |       0 |       0 |
| USTAT       | T_SUBPART  | NULL           | P2SP1             |     747 |       0 |       0 |
| USTAT       | T_SUBPART  | NULL           | P2SP2             |     994 |       0 |       0 |
+-------------+------------+----------------+-------------------+---------+---------+---------+

result_format: 4
call dbms_stats.GATHER_DATABASE_STATS_JOB_PROC();
select TABLE_NAME, partition_name, subpartition_name, OBJECT_TYPE, NUM_ROWS, AVG_ROW_LEN, SAMPLE_SIZE from DBA_TAB_STATISTICS where table_name in ('T1','T_PART','T_SUBPART') and OWNER = 'USTAT';
+------------+----------------+-------------------+--------------+----------+-------------+-------------+
| TABLE_NAME | PARTITION_NAME | SUBPARTITION_NAME | OBJECT_TYPE  | NUM_ROWS | AVG_ROW_LEN | SAMPLE_SIZE |
+------------+----------------+-------------------+--------------+----------+-------------+-------------+
| T1         | NULL           | NULL              | TABLE        |      100 |          60 |         100 |
| T_PART     | NULL           | NULL              | TABLE        |     1000 |          60 |        1000 |
| T_PART     | P0             | NULL              | PARTITION    |      251 |          60 |         251 |
| T_PART     | P1             | NULL              | PARTITION    |      246 |          60 |         246 |
| T_PART     | P2             | NULL              | PARTITION    |      252 |          60 |         252 |
| T_PART     | P3             | NULL              | PARTITION    |      251 |          60 |         251 |
| T_SUBPART  | NULL           | NULL              | TABLE        |    10000 |          60 |       10000 |
| T_SUBPART  | P0             | NULL              | PARTITION    |     2530 |          60 |        2530 |
| T_SUBPART  | P0             | P0SP0             | SUBPARTITION |      766 |          60 |         766 |
| T_SUBPART  | P0             | P0SP1             | SUBPARTITION |      744 |          60 |         744 |
| T_SUBPART  | P0             | P0SP2             | SUBPARTITION |     1020 |          60 |        1020 |
| T_SUBPART  | P1             | NULL              | PARTITION    |     4966 |          60 |        4966 |
| T_SUBPART  | P1             | P1SP0             | SUBPARTITION |     1470 |          60 |        1470 |
| T_SUBPART  | P1             | P1SP1             | SUBPARTITION |     1509 |          60 |        1509 |
| T_SUBPART  | P1             | P1SP2             | SUBPARTITION |     1987 |          60 |        1987 |
| T_SUBPART  | P2             | NULL              | PARTITION    |     2504 |          60 |        2504 |
| T_SUBPART  | P2             | P2SP0             | SUBPARTITION |      763 |          60 |         763 |
| T_SUBPART  | P2             | P2SP1             | SUBPARTITION |      747 |          60 |         747 |
| T_SUBPART  | P2             | P2SP2             | SUBPARTITION |      994 |          60 |         994 |
+------------+----------------+-------------------+--------------+----------+-------------+-------------+
select TABLE_NAME, COLUMN_NAME, NUM_DISTINCT, LOW_VALUE, HIGH_VALUE, DENSITY, NUM_NULLS, NUM_BUCKETS, SAMPLE_SIZE, AVG_COL_LEN, HISTOGRAM from DBA_TAB_COL_STATISTICS where table_name in ('T1','T_PART','T_SUBPART') and OWNER = 'USTAT';
+------------+-------------+--------------+-----------+------------+----------------------+-----------+-------------+-------------+-------------+-----------+
| TABLE_NAME | COLUMN_NAME | NUM_DISTINCT | LOW_VALUE | HIGH_VALUE | DENSITY              | NUM_NULLS | NUM_BUCKETS | SAMPLE_SIZE | AVG_COL_LEN | HISTOGRAM |
+------------+-------------+--------------+-----------+------------+----------------------+-----------+-------------+-------------+-------------+-----------+
| T1         | C1          |          101 | 1         | 100        |                    0 |         0 |           0 |         100 |          20 | NULL      |
| T1         | C2          |          101 | 1         | 100        | .0050000000000000001 |         0 |         100 |         100 |          20 | FREQUENCY |
| T1         | C3          |          101 | 1         | 100        |                    0 |         0 |           0 |         100 |          20 | NULL      |
| T_PART     | C1          |         1031 | 1         | 1000       |                    0 |         0 |           0 |        1000 |          20 | NULL      |
| T_PART     | C2          |         1031 | 1         | 1000       |                   -1 |         0 |           0 |          -1 |          20 | NULL      |
| T_PART     | C3          |         1031 | 1         | 1000       |                    0 |         0 |           0 |        1000 |          20 | NULL      |
| T_SUBPART  | C1          |        10191 | 1         | 10000      |                    0 |         0 |           0 |       10000 |          20 | NULL      |
| T_SUBPART  | C2          |        10191 | 1         | 10000      |                    0 |         0 |           0 |       10000 |          20 | NULL      |
| T_SUBPART  | C3          |        10191 | 1         | 10000      |                    0 |         0 |           0 |       10000 |          20 | NULL      |
+------------+-------------+--------------+-----------+------------+----------------------+-----------+-------------+-------------+-------------+-----------+
select TABLE_NAME, partition_name, COLUMN_NAME, NUM_DISTINCT, LOW_VALUE, HIGH_VALUE, DENSITY, NUM_NULLS, NUM_BUCKETS, SAMPLE_SIZE, AVG_COL_LEN, HISTOGRAM from DBA_PART_COL_STATISTICS where table_name in ('T_PART','T_SUBPART') and OWNER = 'USTAT';
+------------+----------------+-------------+--------------+-----------+------------+----------------------+-----------+-------------+-------------+-------------+-----------+
| TABLE_NAME | PARTITION_NAME | COLUMN_NAME | NUM_DISTINCT | LOW_VALUE | HIGH_VALUE | DENSITY              | NUM_NULLS | NUM_BUCKETS | SAMPLE_SIZE | AVG_COL_LEN | HISTOGRAM |
+------------+----------------+-------------+--------------+-----------+------------+----------------------+-----------+-------------+-------------+-------------+-----------+
| T_PART     | P0             | C1          |          250 | 2         | 1000       |                    0 |         0 |           0 |         251 |          20 | NULL      |
| T_PART     | P0             | C2          |          250 | 2         | 1000       | .0019920318725099601 |         0 |         251 |         251 |          20 | FREQUENCY |
| T_PART     | P0             | C3          |          250 | 2         | 1000       |                    0 |         0 |           0 |         251 |          20 | NULL      |
| T_PART     | P1             | C1          |          254 | 1         | 998        |                    0 |         0 |           0 |         246 |          20 | NULL      |
| T_PART     | P1             | C2          |          254 | 1         | 998        | .0020325203252032522 |         0 |         246 |         246 |          20 | FREQUENCY |
| T_PART     | P1             | C3          |          254 | 1         | 998        |                    0 |         0 |           0 |         246 |          20 | NULL      |
| T_PART     | P2             | C1          |          251 | 3         | 992        |                    0 |         0 |           0 |         252 |          20 | NULL      |
| T_PART     | P2             | C2          |          251 | 3         | 992        |  .001984126984126984 |         0 |         252 |         252 |          20 | FREQUENCY |
| T_PART     | P2             | C3          |          251 | 3         | 992        |                    0 |         0 |           0 |         252 |          20 | NULL      |
| T_PART     | P3             | C1          |          257 | 6         | 996        |                    0 |         0 |           0 |         251 |          20 | NULL      |
| T_PART     | P3             | C2          |          257 | 6         | 996        | .0019920318725099601 |         0 |         251 |         251 |          20 | FREQUENCY |
| T_PART     | P3             | C3          |          257 | 6         | 996        |                    0 |         0 |           0 |         251 |          20 | NULL      |
| T_SUBPART  | P0             | C1          |         2646 | 2         | 9998       |                    0 |         0 |           0 |        2530 |          20 | NULL      |
| T_SUBPART  | P0             | C2          |         2646 | 2         | 9998       |                   -1 |         0 |           0 |          -1 |          20 | NULL      |
| T_SUBPART  | P0             | C3          |         2646 | 2         | 9998       |                    0 |         0 |           0 |        2530 |          20 | NULL      |
| T_SUBPART  | P1             | C1          |         4986 | 1         | 10000      |                    0 |         0 |           0 |        4966 |          20 | NULL      |
| T_SUBPART  | P1             | C2          |         4986 | 1         | 10000      |                   -1 |         0 |           0 |          -1 |          20 | NULL      |
| T_SUBPART  | P1             | C3          |         4986 | 1         | 10000      |                    0 |         0 |           0 |        4966 |          20 | NULL      |
| T_SUBPART  | P2             | C1          |         2658 | 3         | 9995       |                    0 |         0 |           0 |        2504 |          20 | NULL      |
| T_SUBPART  | P2             | C2          |         2658 | 3         | 9995       |                   -1 |         0 |           0 |          -1 |          20 | NULL      |
| T_SUBPART  | P2             | C3          |         2658 | 3         | 9995       |                    0 |         0 |           0 |        2504 |          20 | NULL      |
+------------+----------------+-------------+--------------+-----------+------------+----------------------+-----------+-------------+-------------+-------------+-----------+
SELECT table_name, subpartition_name, column_name, num_distinct, low_value, high_value, density, num_nulls, num_buckets, sample_size, avg_col_len, histogram FROM DBA_SUBPART_COL_STATISTICS WHERE table_name = 'T_SUBPART' and owner='USTAT';
+------------+-------------------+-------------+--------------+-----------+------------+---------+-----------+-------------+-------------+-------------+-----------+
| TABLE_NAME | SUBPARTITION_NAME | COLUMN_NAME | NUM_DISTINCT | LOW_VALUE | HIGH_VALUE | DENSITY | NUM_NULLS | NUM_BUCKETS | SAMPLE_SIZE | AVG_COL_LEN | HISTOGRAM |
+------------+-------------------+-------------+--------------+-----------+------------+---------+-----------+-------------+-------------+-------------+-----------+
| T_SUBPART  | P0SP0             | C1          |          763 | 2         | 2990       |       0 |         0 |           0 |         766 |          20 | NULL      |
| T_SUBPART  | P0SP0             | C2          |          763 | 2         | 2990       |       0 |         0 |           0 |         766 |          20 | NULL      |
| T_SUBPART  | P0SP0             | C3          |          763 | 2         | 2990       |       0 |         0 |           0 |         766 |          20 | NULL      |
| T_SUBPART  | P0SP1             | C1          |          717 | 3004      | 5996       |       0 |         0 |           0 |         744 |          20 | NULL      |
| T_SUBPART  | P0SP1             | C2          |          717 | 3004      | 5996       |       0 |         0 |           0 |         744 |          20 | NULL      |
| T_SUBPART  | P0SP1             | C3          |          717 | 3004      | 5996       |       0 |         0 |           0 |         744 |          20 | NULL      |
| T_SUBPART  | P0SP2             | C1          |         1042 | 6003      | 9998       |       0 |         0 |           0 |        1020 |          20 | NULL      |
| T_SUBPART  | P0SP2             | C2          |         1042 | 6003      | 9998       |       0 |         0 |           0 |        1020 |          20 | NULL      |
| T_SUBPART  | P0SP2             | C3          |         1042 | 6003      | 9998       |       0 |         0 |           0 |        1020 |          20 | NULL      |
| T_SUBPART  | P1SP0             | C1          |         1485 | 1         | 2998       |       0 |         0 |           0 |        1470 |          20 | NULL      |
| T_SUBPART  | P1SP0             | C2          |         1485 | 1         | 2998       |       0 |         0 |           0 |        1470 |          20 | NULL      |
| T_SUBPART  | P1SP0             | C3          |         1485 | 1         | 2998       |       0 |         0 |           0 |        1470 |          20 | NULL      |
| T_SUBPART  | P1SP1             | C1          |         1538 | 3000      | 5999       |       0 |         0 |           0 |        1509 |          20 | NULL      |
| T_SUBPART  | P1SP1             | C2          |         1538 | 3000      | 5999       |       0 |         0 |           0 |        1509 |          20 | NULL      |
| T_SUBPART  | P1SP1             | C3          |         1538 | 3000      | 5999       |       0 |         0 |           0 |        1509 |          20 | NULL      |
| T_SUBPART  | P1SP2             | C1          |         1973 | 6000      | 10000      |       0 |         0 |           0 |        1987 |          20 | NULL      |
| T_SUBPART  | P1SP2             | C2          |         1973 | 6000      | 10000      |       0 |         0 |           0 |        1987 |          20 | NULL      |
| T_SUBPART  | P1SP2             | C3          |         1973 | 6000      | 10000      |       0 |         0 |           0 |        1987 |          20 | NULL      |
| T_SUBPART  | P2SP0             | C1          |          746 | 3         | 2999       |       0 |         0 |           0 |         763 |          20 | NULL      |
| T_SUBPART  | P2SP0             | C2          |          746 | 3         | 2999       |       0 |         0 |           0 |         763 |          20 | NULL      |
| T_SUBPART  | P2SP0             | C3          |          746 | 3         | 2999       |       0 |         0 |           0 |         763 |          20 | NULL      |
| T_SUBPART  | P2SP1             | C1          |          732 | 3001      | 5994       |       0 |         0 |           0 |         747 |          20 | NULL      |
| T_SUBPART  | P2SP1             | C2          |          732 | 3001      | 5994       |       0 |         0 |           0 |         747 |          20 | NULL      |
| T_SUBPART  | P2SP1             | C3          |          732 | 3001      | 5994       |       0 |         0 |           0 |         747 |          20 | NULL      |
| T_SUBPART  | P2SP2             | C1          |         1015 | 6001      | 9995       |       0 |         0 |           0 |         994 |          20 | NULL      |
| T_SUBPART  | P2SP2             | C2          |         1015 | 6001      | 9995       |       0 |         0 |           0 |         994 |          20 | NULL      |
| T_SUBPART  | P2SP2             | C3          |         1015 | 6001      | 9995       |       0 |         0 |           0 |         994 |          20 | NULL      |
+------------+-------------------+-------------+--------------+-----------+------------+---------+-----------+-------------+-------------+-------------+-----------+

##not arrive stale percent(default value:10)
delete from t1 where c1 >=95;
delete from t_part partition(p0) where c1 >=963;
delete from t_part partition(p1) where c1 >=970;
delete from t_subpart subpartition(p0sp0) where c1 >=2800;
delete from t_subpart subpartition(p1sp0) where c1 >=2813;
delete from t_subpart subpartition(p1sp1) where c1 >=5806;
alter system minor freeze tenant = sys;
alter system minor freeze tenant = all_user;
alter system minor freeze tenant = all_meta;
call dbms_stats.GATHER_DATABASE_STATS_JOB_PROC();
##expected no regather table stat and the stat isn't change.
select TABLE_NAME, partition_name, subpartition_name, OBJECT_TYPE, NUM_ROWS, AVG_ROW_LEN, SAMPLE_SIZE from DBA_TAB_STATISTICS where table_name in ('T1','T_PART','T_SUBPART') and OWNER = 'USTAT';
+------------+----------------+-------------------+--------------+----------+-------------+-------------+
| TABLE_NAME | PARTITION_NAME | SUBPARTITION_NAME | OBJECT_TYPE  | NUM_ROWS | AVG_ROW_LEN | SAMPLE_SIZE |
+------------+----------------+-------------------+--------------+----------+-------------+-------------+
| T1         | NULL           | NULL              | TABLE        |      100 |          60 |         100 |
| T_PART     | NULL           | NULL              | TABLE        |     1000 |          60 |        1000 |
| T_PART     | P0             | NULL              | PARTITION    |      251 |          60 |         251 |
| T_PART     | P1             | NULL              | PARTITION    |      246 |          60 |         246 |
| T_PART     | P2             | NULL              | PARTITION    |      252 |          60 |         252 |
| T_PART     | P3             | NULL              | PARTITION    |      251 |          60 |         251 |
| T_SUBPART  | NULL           | NULL              | TABLE        |    10000 |          60 |       10000 |
| T_SUBPART  | P0             | NULL              | PARTITION    |     2530 |          60 |        2530 |
| T_SUBPART  | P0             | P0SP0             | SUBPARTITION |      766 |          60 |         766 |
| T_SUBPART  | P0             | P0SP1             | SUBPARTITION |      744 |          60 |         744 |
| T_SUBPART  | P0             | P0SP2             | SUBPARTITION |     1020 |          60 |        1020 |
| T_SUBPART  | P1             | NULL              | PARTITION    |     4966 |          60 |        4966 |
| T_SUBPART  | P1             | P1SP0             | SUBPARTITION |     1470 |          60 |        1470 |
| T_SUBPART  | P1             | P1SP1             | SUBPARTITION |     1509 |          60 |        1509 |
| T_SUBPART  | P1             | P1SP2             | SUBPARTITION |     1987 |          60 |        1987 |
| T_SUBPART  | P2             | NULL              | PARTITION    |     2504 |          60 |        2504 |
| T_SUBPART  | P2             | P2SP0             | SUBPARTITION |      763 |          60 |         763 |
| T_SUBPART  | P2             | P2SP1             | SUBPARTITION |      747 |          60 |         747 |
| T_SUBPART  | P2             | P2SP2             | SUBPARTITION |      994 |          60 |         994 |
+------------+----------------+-------------------+--------------+----------+-------------+-------------+
select TABLE_NAME, COLUMN_NAME, NUM_DISTINCT, LOW_VALUE, HIGH_VALUE, DENSITY, NUM_NULLS, NUM_BUCKETS, SAMPLE_SIZE, AVG_COL_LEN, HISTOGRAM from DBA_TAB_COL_STATISTICS where table_name in ('T1','T_PART','T_SUBPART') and OWNER = 'USTAT';
+------------+-------------+--------------+-----------+------------+----------------------+-----------+-------------+-------------+-------------+-----------+
| TABLE_NAME | COLUMN_NAME | NUM_DISTINCT | LOW_VALUE | HIGH_VALUE | DENSITY              | NUM_NULLS | NUM_BUCKETS | SAMPLE_SIZE | AVG_COL_LEN | HISTOGRAM |
+------------+-------------+--------------+-----------+------------+----------------------+-----------+-------------+-------------+-------------+-----------+
| T1         | C1          |          101 | 1         | 100        |                    0 |         0 |           0 |         100 |          20 | NULL      |
| T1         | C2          |          101 | 1         | 100        | .0050000000000000001 |         0 |         100 |         100 |          20 | FREQUENCY |
| T1         | C3          |          101 | 1         | 100        |                    0 |         0 |           0 |         100 |          20 | NULL      |
| T_PART     | C1          |         1031 | 1         | 1000       |                    0 |         0 |           0 |        1000 |          20 | NULL      |
| T_PART     | C2          |         1031 | 1         | 1000       |                   -1 |         0 |           0 |          -1 |          20 | NULL      |
| T_PART     | C3          |         1031 | 1         | 1000       |                    0 |         0 |           0 |        1000 |          20 | NULL      |
| T_SUBPART  | C1          |        10191 | 1         | 10000      |                    0 |         0 |           0 |       10000 |          20 | NULL      |
| T_SUBPART  | C2          |        10191 | 1         | 10000      |                    0 |         0 |           0 |       10000 |          20 | NULL      |
| T_SUBPART  | C3          |        10191 | 1         | 10000      |                    0 |         0 |           0 |       10000 |          20 | NULL      |
+------------+-------------+--------------+-----------+------------+----------------------+-----------+-------------+-------------+-------------+-----------+
select TABLE_NAME, partition_name, COLUMN_NAME, NUM_DISTINCT, LOW_VALUE, HIGH_VALUE, DENSITY, NUM_NULLS, NUM_BUCKETS, SAMPLE_SIZE, AVG_COL_LEN, HISTOGRAM from DBA_PART_COL_STATISTICS where table_name in ('T_PART','T_SUBPART') and OWNER = 'USTAT';
+------------+----------------+-------------+--------------+-----------+------------+----------------------+-----------+-------------+-------------+-------------+-----------+
| TABLE_NAME | PARTITION_NAME | COLUMN_NAME | NUM_DISTINCT | LOW_VALUE | HIGH_VALUE | DENSITY              | NUM_NULLS | NUM_BUCKETS | SAMPLE_SIZE | AVG_COL_LEN | HISTOGRAM |
+------------+----------------+-------------+--------------+-----------+------------+----------------------+-----------+-------------+-------------+-------------+-----------+
| T_PART     | P0             | C1          |          250 | 2         | 1000       |                    0 |         0 |           0 |         251 |          20 | NULL      |
| T_PART     | P0             | C2          |          250 | 2         | 1000       | .0019920318725099601 |         0 |         251 |         251 |          20 | FREQUENCY |
| T_PART     | P0             | C3          |          250 | 2         | 1000       |                    0 |         0 |           0 |         251 |          20 | NULL      |
| T_PART     | P1             | C1          |          254 | 1         | 998        |                    0 |         0 |           0 |         246 |          20 | NULL      |
| T_PART     | P1             | C2          |          254 | 1         | 998        | .0020325203252032522 |         0 |         246 |         246 |          20 | FREQUENCY |
| T_PART     | P1             | C3          |          254 | 1         | 998        |                    0 |         0 |           0 |         246 |          20 | NULL      |
| T_PART     | P2             | C1          |          251 | 3         | 992        |                    0 |         0 |           0 |         252 |          20 | NULL      |
| T_PART     | P2             | C2          |          251 | 3         | 992        |  .001984126984126984 |         0 |         252 |         252 |          20 | FREQUENCY |
| T_PART     | P2             | C3          |          251 | 3         | 992        |                    0 |         0 |           0 |         252 |          20 | NULL      |
| T_PART     | P3             | C1          |          257 | 6         | 996        |                    0 |         0 |           0 |         251 |          20 | NULL      |
| T_PART     | P3             | C2          |          257 | 6         | 996        | .0019920318725099601 |         0 |         251 |         251 |          20 | FREQUENCY |
| T_PART     | P3             | C3          |          257 | 6         | 996        |                    0 |         0 |           0 |         251 |          20 | NULL      |
| T_SUBPART  | P0             | C1          |         2646 | 2         | 9998       |                    0 |         0 |           0 |        2530 |          20 | NULL      |
| T_SUBPART  | P0             | C2          |         2646 | 2         | 9998       |                   -1 |         0 |           0 |          -1 |          20 | NULL      |
| T_SUBPART  | P0             | C3          |         2646 | 2         | 9998       |                    0 |         0 |           0 |        2530 |          20 | NULL      |
| T_SUBPART  | P1             | C1          |         4986 | 1         | 10000      |                    0 |         0 |           0 |        4966 |          20 | NULL      |
| T_SUBPART  | P1             | C2          |         4986 | 1         | 10000      |                   -1 |         0 |           0 |          -1 |          20 | NULL      |
| T_SUBPART  | P1             | C3          |         4986 | 1         | 10000      |                    0 |         0 |           0 |        4966 |          20 | NULL      |
| T_SUBPART  | P2             | C1          |         2658 | 3         | 9995       |                    0 |         0 |           0 |        2504 |          20 | NULL      |
| T_SUBPART  | P2             | C2          |         2658 | 3         | 9995       |                   -1 |         0 |           0 |          -1 |          20 | NULL      |
| T_SUBPART  | P2             | C3          |         2658 | 3         | 9995       |                    0 |         0 |           0 |        2504 |          20 | NULL      |
+------------+----------------+-------------+--------------+-----------+------------+----------------------+-----------+-------------+-------------+-------------+-----------+
SELECT table_name, subpartition_name, column_name, num_distinct, low_value, high_value, density, num_nulls, num_buckets, sample_size, avg_col_len, histogram FROM DBA_SUBPART_COL_STATISTICS WHERE table_name = 'T_SUBPART' and owner='USTAT';
+------------+-------------------+-------------+--------------+-----------+------------+---------+-----------+-------------+-------------+-------------+-----------+
| TABLE_NAME | SUBPARTITION_NAME | COLUMN_NAME | NUM_DISTINCT | LOW_VALUE | HIGH_VALUE | DENSITY | NUM_NULLS | NUM_BUCKETS | SAMPLE_SIZE | AVG_COL_LEN | HISTOGRAM |
+------------+-------------------+-------------+--------------+-----------+------------+---------+-----------+-------------+-------------+-------------+-----------+
| T_SUBPART  | P0SP0             | C1          |          763 | 2         | 2990       |       0 |         0 |           0 |         766 |          20 | NULL      |
| T_SUBPART  | P0SP0             | C2          |          763 | 2         | 2990       |       0 |         0 |           0 |         766 |          20 | NULL      |
| T_SUBPART  | P0SP0             | C3          |          763 | 2         | 2990       |       0 |         0 |           0 |         766 |          20 | NULL      |
| T_SUBPART  | P0SP1             | C1          |          717 | 3004      | 5996       |       0 |         0 |           0 |         744 |          20 | NULL      |
| T_SUBPART  | P0SP1             | C2          |          717 | 3004      | 5996       |       0 |         0 |           0 |         744 |          20 | NULL      |
| T_SUBPART  | P0SP1             | C3          |          717 | 3004      | 5996       |       0 |         0 |           0 |         744 |          20 | NULL      |
| T_SUBPART  | P0SP2             | C1          |         1042 | 6003      | 9998       |       0 |         0 |           0 |        1020 |          20 | NULL      |
| T_SUBPART  | P0SP2             | C2          |         1042 | 6003      | 9998       |       0 |         0 |           0 |        1020 |          20 | NULL      |
| T_SUBPART  | P0SP2             | C3          |         1042 | 6003      | 9998       |       0 |         0 |           0 |        1020 |          20 | NULL      |
| T_SUBPART  | P1SP0             | C1          |         1485 | 1         | 2998       |       0 |         0 |           0 |        1470 |          20 | NULL      |
| T_SUBPART  | P1SP0             | C2          |         1485 | 1         | 2998       |       0 |         0 |           0 |        1470 |          20 | NULL      |
| T_SUBPART  | P1SP0             | C3          |         1485 | 1         | 2998       |       0 |         0 |           0 |        1470 |          20 | NULL      |
| T_SUBPART  | P1SP1             | C1          |         1538 | 3000      | 5999       |       0 |         0 |           0 |        1509 |          20 | NULL      |
| T_SUBPART  | P1SP1             | C2          |         1538 | 3000      | 5999       |       0 |         0 |           0 |        1509 |          20 | NULL      |
| T_SUBPART  | P1SP1             | C3          |         1538 | 3000      | 5999       |       0 |         0 |           0 |        1509 |          20 | NULL      |
| T_SUBPART  | P1SP2             | C1          |         1973 | 6000      | 10000      |       0 |         0 |           0 |        1987 |          20 | NULL      |
| T_SUBPART  | P1SP2             | C2          |         1973 | 6000      | 10000      |       0 |         0 |           0 |        1987 |          20 | NULL      |
| T_SUBPART  | P1SP2             | C3          |         1973 | 6000      | 10000      |       0 |         0 |           0 |        1987 |          20 | NULL      |
| T_SUBPART  | P2SP0             | C1          |          746 | 3         | 2999       |       0 |         0 |           0 |         763 |          20 | NULL      |
| T_SUBPART  | P2SP0             | C2          |          746 | 3         | 2999       |       0 |         0 |           0 |         763 |          20 | NULL      |
| T_SUBPART  | P2SP0             | C3          |          746 | 3         | 2999       |       0 |         0 |           0 |         763 |          20 | NULL      |
| T_SUBPART  | P2SP1             | C1          |          732 | 3001      | 5994       |       0 |         0 |           0 |         747 |          20 | NULL      |
| T_SUBPART  | P2SP1             | C2          |          732 | 3001      | 5994       |       0 |         0 |           0 |         747 |          20 | NULL      |
| T_SUBPART  | P2SP1             | C3          |          732 | 3001      | 5994       |       0 |         0 |           0 |         747 |          20 | NULL      |
| T_SUBPART  | P2SP2             | C1          |         1015 | 6001      | 9995       |       0 |         0 |           0 |         994 |          20 | NULL      |
| T_SUBPART  | P2SP2             | C2          |         1015 | 6001      | 9995       |       0 |         0 |           0 |         994 |          20 | NULL      |
| T_SUBPART  | P2SP2             | C3          |         1015 | 6001      | 9995       |       0 |         0 |           0 |         994 |          20 | NULL      |
+------------+-------------------+-------------+--------------+-----------+------------+---------+-----------+-------------+-------------+-------------+-----------+

##more than stale percent(default value:10)
update t1 set c1 = 10000 where c1 >=89;
update t_part partition(p0) set c3 = 10000 where c1 >=800;
update t_subpart subpartition(p0sp0) set c3 = 10000 where c1 >=2428;
delete from t_subpart subpartition(p1sp0) where c1 >=2363;
delete from t_subpart subpartition(p1sp1) where c1 >=5411;
delete from t_subpart subpartition(p2sp0) where c1 <=183;
alter system minor freeze tenant = sys;
alter system minor freeze tenant = all_user;
alter system minor freeze tenant = all_meta;
call dbms_stats.GATHER_DATABASE_STATS_JOB_PROC();
##expected regather table stat and the stat is changed.
select TABLE_NAME, partition_name, subpartition_name, OBJECT_TYPE, NUM_ROWS, AVG_ROW_LEN, SAMPLE_SIZE from DBA_TAB_STATISTICS where table_name in ('T1','T_PART','T_SUBPART') and OWNER = 'USTAT';
+------------+----------------+-------------------+--------------+----------+-------------+-------------+
| TABLE_NAME | PARTITION_NAME | SUBPARTITION_NAME | OBJECT_TYPE  | NUM_ROWS | AVG_ROW_LEN | SAMPLE_SIZE |
+------------+----------------+-------------------+--------------+----------+-------------+-------------+
| T1         | NULL           | NULL              | TABLE        |       94 |          60 |          94 |
| T_PART     | NULL           | NULL              | TABLE        |      990 |          60 |         990 |
| T_PART     | P0             | NULL              | PARTITION    |      241 |          60 |         241 |
| T_PART     | P1             | NULL              | PARTITION    |      246 |          60 |         246 |
| T_PART     | P2             | NULL              | PARTITION    |      252 |          60 |         252 |
| T_PART     | P3             | NULL              | PARTITION    |      251 |          60 |         251 |
| T_SUBPART  | NULL           | NULL              | TABLE        |     9400 |          60 |        9400 |
| T_SUBPART  | P0             | NULL              | PARTITION    |     2530 |          60 |        2530 |
| T_SUBPART  | P0             | P0SP0             | SUBPARTITION |      726 |          60 |         726 |
| T_SUBPART  | P0             | P0SP1             | SUBPARTITION |      744 |          60 |         744 |
| T_SUBPART  | P0             | P0SP2             | SUBPARTITION |     1020 |          60 |        1020 |
| T_SUBPART  | P1             | NULL              | PARTITION    |     4366 |          60 |        4366 |
| T_SUBPART  | P1             | P1SP0             | SUBPARTITION |     1170 |          60 |        1170 |
| T_SUBPART  | P1             | P1SP1             | SUBPARTITION |     1209 |          60 |        1209 |
| T_SUBPART  | P1             | P1SP2             | SUBPARTITION |     1987 |          60 |        1987 |
| T_SUBPART  | P2             | NULL              | PARTITION    |     2504 |          60 |        2504 |
| T_SUBPART  | P2             | P2SP0             | SUBPARTITION |      763 |          60 |         763 |
| T_SUBPART  | P2             | P2SP1             | SUBPARTITION |      747 |          60 |         747 |
| T_SUBPART  | P2             | P2SP2             | SUBPARTITION |      994 |          60 |         994 |
+------------+----------------+-------------------+--------------+----------+-------------+-------------+
select TABLE_NAME, COLUMN_NAME, NUM_DISTINCT, LOW_VALUE, HIGH_VALUE, DENSITY, NUM_NULLS, NUM_BUCKETS, SAMPLE_SIZE, AVG_COL_LEN, HISTOGRAM from DBA_TAB_COL_STATISTICS where table_name in ('T1','T_PART','T_SUBPART') and OWNER = 'USTAT';
+------------+-------------+--------------+-----------+------------+----------------------+-----------+-------------+-------------+-------------+-----------+
| TABLE_NAME | COLUMN_NAME | NUM_DISTINCT | LOW_VALUE | HIGH_VALUE | DENSITY              | NUM_NULLS | NUM_BUCKETS | SAMPLE_SIZE | AVG_COL_LEN | HISTOGRAM |
+------------+-------------+--------------+-----------+------------+----------------------+-----------+-------------+-------------+-------------+-----------+
| T1         | C1          |           92 | 1         | 10000      | .0053191489361702126 |         0 |          89 |          94 |          20 | FREQUENCY |
| T1         | C2          |           95 | 1         | 94         | .0053191489361702126 |         0 |          94 |          94 |          20 | FREQUENCY |
| T1         | C3          |           95 | 1         | 94         |                    0 |         0 |           0 |          94 |          20 | NULL      |
| T_PART     | C1          |         1020 | 1         | 998        |                   -1 |         0 |           0 |          -1 |          20 | NULL      |
| T_PART     | C2          |         1020 | 1         | 998        |                   -1 |         0 |           0 |          -1 |          20 | NULL      |
| T_PART     | C3          |          970 | 1         | 10000      |                    0 |         0 |           0 |         990 |          20 | NULL      |
| T_SUBPART  | C1          |         9681 | 1         | 10000      |                    0 |         0 |           0 |        9400 |          20 | NULL      |
| T_SUBPART  | C2          |         9681 | 1         | 10000      |                    0 |         0 |           0 |        9400 |          20 | NULL      |
| T_SUBPART  | C3          |         9681 | 1         | 10000      |                    0 |         0 |           0 |        9400 |          20 | NULL      |
+------------+-------------+--------------+-----------+------------+----------------------+-----------+-------------+-------------+-------------+-----------+
select TABLE_NAME, partition_name, COLUMN_NAME, NUM_DISTINCT, LOW_VALUE, HIGH_VALUE, DENSITY, NUM_NULLS, NUM_BUCKETS, SAMPLE_SIZE, AVG_COL_LEN, HISTOGRAM from DBA_PART_COL_STATISTICS where table_name in ('T_PART','T_SUBPART') and OWNER = 'USTAT';
+------------+----------------+-------------+--------------+-----------+------------+----------------------+-----------+-------------+-------------+-------------+-----------+
| TABLE_NAME | PARTITION_NAME | COLUMN_NAME | NUM_DISTINCT | LOW_VALUE | HIGH_VALUE | DENSITY              | NUM_NULLS | NUM_BUCKETS | SAMPLE_SIZE | AVG_COL_LEN | HISTOGRAM |
+------------+----------------+-------------+--------------+-----------+------------+----------------------+-----------+-------------+-------------+-------------+-----------+
| T_PART     | P0             | C1          |          242 | 2         | 957        | .0020746887966804979 |         0 |         241 |         241 |          20 | FREQUENCY |
| T_PART     | P0             | C2          |          242 | 2         | 957        | .0020746887966804979 |         0 |         241 |         241 |          20 | FREQUENCY |
| T_PART     | P0             | C3          |          197 | 2         | 10000      |                    0 |         0 |           0 |         241 |          20 | NULL      |
| T_PART     | P1             | C1          |          254 | 1         | 998        |                    0 |         0 |           0 |         246 |          20 | NULL      |
| T_PART     | P1             | C2          |          254 | 1         | 998        | .0020325203252032522 |         0 |         246 |         246 |          20 | FREQUENCY |
| T_PART     | P1             | C3          |          254 | 1         | 998        |                    0 |         0 |           0 |         246 |          20 | NULL      |
| T_PART     | P2             | C1          |          251 | 3         | 992        |                    0 |         0 |           0 |         252 |          20 | NULL      |
| T_PART     | P2             | C2          |          251 | 3         | 992        |  .001984126984126984 |         0 |         252 |         252 |          20 | FREQUENCY |
| T_PART     | P2             | C3          |          251 | 3         | 992        |                    0 |         0 |           0 |         252 |          20 | NULL      |
| T_PART     | P3             | C1          |          257 | 6         | 996        |                    0 |         0 |           0 |         251 |          20 | NULL      |
| T_PART     | P3             | C2          |          257 | 6         | 996        | .0019920318725099601 |         0 |         251 |         251 |          20 | FREQUENCY |
| T_PART     | P3             | C3          |          257 | 6         | 996        |                    0 |         0 |           0 |         251 |          20 | NULL      |
| T_SUBPART  | P0             | C1          |         2646 | 2         | 9998       |                    0 |         0 |           0 |        2530 |          20 | NULL      |
| T_SUBPART  | P0             | C2          |         2646 | 2         | 9998       |                   -1 |         0 |           0 |          -1 |          20 | NULL      |
| T_SUBPART  | P0             | C3          |         2646 | 2         | 9998       |                    0 |         0 |           0 |        2530 |          20 | NULL      |
| T_SUBPART  | P1             | C1          |         4448 | 1         | 10000      |                   -1 |         0 |           0 |          -1 |          20 | NULL      |
| T_SUBPART  | P1             | C2          |         4448 | 1         | 10000      |                   -1 |         0 |           0 |          -1 |          20 | NULL      |
| T_SUBPART  | P1             | C3          |         4448 | 1         | 10000      |                    0 |         0 |           0 |        4366 |          20 | NULL      |
| T_SUBPART  | P2             | C1          |         2658 | 3         | 9995       |                    0 |         0 |           0 |        2504 |          20 | NULL      |
| T_SUBPART  | P2             | C2          |         2658 | 3         | 9995       |                   -1 |         0 |           0 |          -1 |          20 | NULL      |
| T_SUBPART  | P2             | C3          |         2658 | 3         | 9995       |                    0 |         0 |           0 |        2504 |          20 | NULL      |
+------------+----------------+-------------+--------------+-----------+------------+----------------------+-----------+-------------+-------------+-------------+-----------+
SELECT table_name, subpartition_name, column_name, num_distinct, low_value, high_value, density, num_nulls, num_buckets, sample_size, avg_col_len, histogram FROM DBA_SUBPART_COL_STATISTICS WHERE table_name = 'T_SUBPART' and owner='USTAT';
+------------+-------------------+-------------+--------------+-----------+------------+---------+-----------+-------------+-------------+-------------+-----------+
| TABLE_NAME | SUBPARTITION_NAME | COLUMN_NAME | NUM_DISTINCT | LOW_VALUE | HIGH_VALUE | DENSITY | NUM_NULLS | NUM_BUCKETS | SAMPLE_SIZE | AVG_COL_LEN | HISTOGRAM |
+------------+-------------------+-------------+--------------+-----------+------------+---------+-----------+-------------+-------------+-------------+-----------+
| T_SUBPART  | P0SP0             | C1          |          717 | 2         | 2799       |       0 |         0 |           0 |         726 |          20 | NULL      |
| T_SUBPART  | P0SP0             | C2          |          717 | 2         | 2799       |       0 |         0 |           0 |         726 |          20 | NULL      |
| T_SUBPART  | P0SP0             | C3          |          623 | 2         | 10000      |       0 |         0 |           0 |         726 |          20 | NULL      |
| T_SUBPART  | P0SP1             | C1          |          717 | 3004      | 5996       |       0 |         0 |           0 |         744 |          20 | NULL      |
| T_SUBPART  | P0SP1             | C2          |          717 | 3004      | 5996       |       0 |         0 |           0 |         744 |          20 | NULL      |
| T_SUBPART  | P0SP1             | C3          |          717 | 3004      | 5996       |       0 |         0 |           0 |         744 |          20 | NULL      |
| T_SUBPART  | P0SP2             | C1          |         1042 | 6003      | 9998       |       0 |         0 |           0 |        1020 |          20 | NULL      |
| T_SUBPART  | P0SP2             | C2          |         1042 | 6003      | 9998       |       0 |         0 |           0 |        1020 |          20 | NULL      |
| T_SUBPART  | P0SP2             | C3          |         1042 | 6003      | 9998       |       0 |         0 |           0 |        1020 |          20 | NULL      |
| T_SUBPART  | P1SP0             | C1          |         1191 | 1         | 2359       |       0 |         0 |           0 |        1170 |          20 | NULL      |
| T_SUBPART  | P1SP0             | C2          |         1191 | 1         | 2359       |       0 |         0 |           0 |        1170 |          20 | NULL      |
| T_SUBPART  | P1SP0             | C3          |         1191 | 1         | 2359       |       0 |         0 |           0 |        1170 |          20 | NULL      |
| T_SUBPART  | P1SP1             | C1          |         1233 | 3000      | 5409       |       0 |         0 |           0 |        1209 |          20 | NULL      |
| T_SUBPART  | P1SP1             | C2          |         1233 | 3000      | 5409       |       0 |         0 |           0 |        1209 |          20 | NULL      |
| T_SUBPART  | P1SP1             | C3          |         1233 | 3000      | 5409       |       0 |         0 |           0 |        1209 |          20 | NULL      |
| T_SUBPART  | P1SP2             | C1          |         1973 | 6000      | 10000      |       0 |         0 |           0 |        1987 |          20 | NULL      |
| T_SUBPART  | P1SP2             | C2          |         1973 | 6000      | 10000      |       0 |         0 |           0 |        1987 |          20 | NULL      |
| T_SUBPART  | P1SP2             | C3          |         1973 | 6000      | 10000      |       0 |         0 |           0 |        1987 |          20 | NULL      |
| T_SUBPART  | P2SP0             | C1          |          746 | 3         | 2999       |       0 |         0 |           0 |         763 |          20 | NULL      |
| T_SUBPART  | P2SP0             | C2          |          746 | 3         | 2999       |       0 |         0 |           0 |         763 |          20 | NULL      |
| T_SUBPART  | P2SP0             | C3          |          746 | 3         | 2999       |       0 |         0 |           0 |         763 |          20 | NULL      |
| T_SUBPART  | P2SP1             | C1          |          732 | 3001      | 5994       |       0 |         0 |           0 |         747 |          20 | NULL      |
| T_SUBPART  | P2SP1             | C2          |          732 | 3001      | 5994       |       0 |         0 |           0 |         747 |          20 | NULL      |
| T_SUBPART  | P2SP1             | C3          |          732 | 3001      | 5994       |       0 |         0 |           0 |         747 |          20 | NULL      |
| T_SUBPART  | P2SP2             | C1          |         1015 | 6001      | 9995       |       0 |         0 |           0 |         994 |          20 | NULL      |
| T_SUBPART  | P2SP2             | C2          |         1015 | 6001      | 9995       |       0 |         0 |           0 |         994 |          20 | NULL      |
| T_SUBPART  | P2SP2             | C3          |         1015 | 6001      | 9995       |       0 |         0 |           0 |         994 |          20 | NULL      |
+------------+-------------------+-------------+--------------+-----------+------------+---------+-----------+-------------+-------------+-------------+-----------+
select OWNER, TABLE_NAME, STATUS, PROPERTIES from sys.dba_ob_table_opt_stat_gather_history where table_name in ('T1', 'T_PART', 'T_SUBPART') and owner = 'USTAT' and TASK_ID is not null order by START_TIME desc fetch next 3 rows only;
+-------+------------+---------+---------------------------------------------------------------------------------------------------------------------------------------------------------------+
| OWNER | TABLE_NAME | STATUS  | PROPERTIES                                                                                                                                                    |
+-------+------------+---------+---------------------------------------------------------------------------------------------------------------------------------------------------------------+
| USTAT | T1         | SUCCESS | GRANULARITY:AUTO;METHOD_OPT:FOR ALL COLUMNS SIZE AUTO;DEGREE:1;ESTIMATE_PERCENT:100.000000;BLOCK_SAMPLE:0;STALE_PERCENT:0.120000;HIST_EST_PERCENT:100.000000  |
| USTAT | T_PART     | SUCCESS | GRANULARITY:AUTO;METHOD_OPT:FOR ALL COLUMNS SIZE AUTO;DEGREE:1;ESTIMATE_PERCENT:100.000000;BLOCK_SAMPLE:0;STALE_PERCENT:-1.000000;HIST_EST_PERCENT:100.000000 |
| USTAT | T_SUBPART  | SUCCESS | GRANULARITY:AUTO;METHOD_OPT:FOR ALL COLUMNS SIZE AUTO;DEGREE:1;ESTIMATE_PERCENT:100.000000;BLOCK_SAMPLE:0;STALE_PERCENT:-1.000000;HIST_EST_PERCENT:100.000000 |
+-------+------------+---------+---------------------------------------------------------------------------------------------------------------------------------------------------------------+

call dbms_stats.alter_stats_history_retention(0);
select count(*) from sys.DBA_OB_TASK_OPT_STAT_GATHER_HISTORY;
+----------+
| COUNT(*) |
+----------+
|        0 |
+----------+
select count(*) from sys.DBA_OB_TABLE_OPT_STAT_GATHER_HISTORY where TASK_ID IS NOT NULL;
+----------+
| COUNT(*) |
+----------+
|        0 |
+----------+

drop table t1;
drop table t_part;
drop table t_subpart;

create table t_part (c1 int, c2 int, c3 int) partition by hash(c1) partitions 4;


call dbms_stats.GATHER_DATABASE_STATS_JOB_PROC();
select TABLE_NAME,PARTITION_NAME,NUM_ROWS from sys.dba_tab_statistics where table_name='T_PART' and OWNER = 'USTAT';
+------------+----------------+----------+
| TABLE_NAME | PARTITION_NAME | NUM_ROWS |
+------------+----------------+----------+
| T_PART     | NULL           |        0 |
| T_PART     | P0             |        0 |
| T_PART     | P1             |        0 |
| T_PART     | P2             |        0 |
| T_PART     | P3             |        0 |
+------------+----------------+----------+

insert into t_part select level, level, level from dual connect by level <= 40000;
alter system minor freeze tenant = sys;
alter system minor freeze tenant = all_user;
alter system minor freeze tenant = all_meta;
call dbms_stats.set_table_prefs('USTAT', 'T_PART', 'GRANULARITY', 'GLOBAL');
call dbms_stats.GATHER_DATABASE_STATS_JOB_PROC();
select TABLE_NAME,PARTITION_NAME,NUM_ROWS from sys.dba_tab_statistics where table_name='T_PART' and OWNER = 'USTAT';
+------------+----------------+----------+
| TABLE_NAME | PARTITION_NAME | NUM_ROWS |
+------------+----------------+----------+
| T_PART     | NULL           |    40000 |
| T_PART     | P0             |        0 |
| T_PART     | P1             |        0 |
| T_PART     | P2             |        0 |
| T_PART     | P3             |        0 |
+------------+----------------+----------+
select LAST_INSERTS, LAST_UPDATES, LAST_DELETES, INSERTS, UPDATES, DELETES from sys.all_virtual_monitor_modified_real_agent where table_id = $T_PART_TABLE_ID;
+--------------+--------------+--------------+---------+---------+---------+
| LAST_INSERTS | LAST_UPDATES | LAST_DELETES | INSERTS | UPDATES | DELETES |
+--------------+--------------+--------------+---------+---------+---------+
|         9917 |            0 |            0 |    9917 |       0 |       0 |
|         9919 |            0 |            0 |    9919 |       0 |       0 |
|        10070 |            0 |            0 |   10070 |       0 |       0 |
|        10094 |            0 |            0 |   10094 |       0 |       0 |
+--------------+--------------+--------------+---------+---------+---------+
select TABLE_NAME,PROPERTIES from sys.dba_ob_table_opt_stat_gather_history where table_name='T_PART' and OWNER = 'USTAT';
+------------+-----------------------------------------------------------------------------------------------------------------------------------------------------------------+
| TABLE_NAME | PROPERTIES                                                                                                                                                      |
+------------+-----------------------------------------------------------------------------------------------------------------------------------------------------------------+
| T_PART     | GRANULARITY:AUTO;METHOD_OPT:FOR ALL COLUMNS SIZE AUTO;DEGREE:1;ESTIMATE_PERCENT:100.000000;BLOCK_SAMPLE:0;STALE_PERCENT:-1.000000;HIST_EST_PERCENT:100.000000   |
| T_PART     | GRANULARITY:GLOBAL;METHOD_OPT:FOR ALL COLUMNS SIZE AUTO;DEGREE:1;ESTIMATE_PERCENT:100.000000;BLOCK_SAMPLE:0;STALE_PERCENT:-1.000000;HIST_EST_PERCENT:100.000000 |
+------------+-----------------------------------------------------------------------------------------------------------------------------------------------------------------+

call dbms_stats.GATHER_DATABASE_STATS_JOB_PROC();
select TABLE_NAME,PROPERTIES from sys.dba_ob_table_opt_stat_gather_history where table_name='T_PART' and OWNER = 'USTAT';
+------------+-----------------------------------------------------------------------------------------------------------------------------------------------------------------+
| TABLE_NAME | PROPERTIES                                                                                                                                                      |
+------------+-----------------------------------------------------------------------------------------------------------------------------------------------------------------+
| T_PART     | GRANULARITY:AUTO;METHOD_OPT:FOR ALL COLUMNS SIZE AUTO;DEGREE:1;ESTIMATE_PERCENT:100.000000;BLOCK_SAMPLE:0;STALE_PERCENT:-1.000000;HIST_EST_PERCENT:100.000000   |
| T_PART     | GRANULARITY:GLOBAL;METHOD_OPT:FOR ALL COLUMNS SIZE AUTO;DEGREE:1;ESTIMATE_PERCENT:100.000000;BLOCK_SAMPLE:0;STALE_PERCENT:-1.000000;HIST_EST_PERCENT:100.000000 |
+------------+-----------------------------------------------------------------------------------------------------------------------------------------------------------------+

call dbms_stats.delete_table_stats('USTAT','T_PART');

call dbms_stats.GATHER_DATABASE_STATS_JOB_PROC();
select TABLE_NAME,PROPERTIES from sys.dba_ob_table_opt_stat_gather_history where table_name='T_PART' and OWNER = 'USTAT';
+------------+-----------------------------------------------------------------------------------------------------------------------------------------------------------------+
| TABLE_NAME | PROPERTIES                                                                                                                                                      |
+------------+-----------------------------------------------------------------------------------------------------------------------------------------------------------------+
| T_PART     | GRANULARITY:AUTO;METHOD_OPT:FOR ALL COLUMNS SIZE AUTO;DEGREE:1;ESTIMATE_PERCENT:100.000000;BLOCK_SAMPLE:0;STALE_PERCENT:-1.000000;HIST_EST_PERCENT:100.000000   |
| T_PART     | GRANULARITY:GLOBAL;METHOD_OPT:FOR ALL COLUMNS SIZE AUTO;DEGREE:1;ESTIMATE_PERCENT:100.000000;BLOCK_SAMPLE:0;STALE_PERCENT:-1.000000;HIST_EST_PERCENT:100.000000 |
| T_PART     | GRANULARITY:GLOBAL;METHOD_OPT:FOR ALL COLUMNS SIZE AUTO;DEGREE:1;ESTIMATE_PERCENT:100.000000;BLOCK_SAMPLE:0;STALE_PERCENT:-1.000000;HIST_EST_PERCENT:100.000000 |
+------------+-----------------------------------------------------------------------------------------------------------------------------------------------------------------+

insert into t_part partition(p0) select 999, 999, 999 from dual connect by level <= 2000;
alter system minor freeze tenant = sys;
alter system minor freeze tenant = all_user;
alter system minor freeze tenant = all_meta;
call dbms_stats.GATHER_DATABASE_STATS_JOB_PROC();
select TABLE_NAME,PROPERTIES from sys.dba_ob_table_opt_stat_gather_history where table_name='T_PART' and OWNER = 'USTAT';
+------------+-----------------------------------------------------------------------------------------------------------------------------------------------------------------+
| TABLE_NAME | PROPERTIES                                                                                                                                                      |
+------------+-----------------------------------------------------------------------------------------------------------------------------------------------------------------+
| T_PART     | GRANULARITY:AUTO;METHOD_OPT:FOR ALL COLUMNS SIZE AUTO;DEGREE:1;ESTIMATE_PERCENT:100.000000;BLOCK_SAMPLE:0;STALE_PERCENT:-1.000000;HIST_EST_PERCENT:100.000000   |
| T_PART     | GRANULARITY:GLOBAL;METHOD_OPT:FOR ALL COLUMNS SIZE AUTO;DEGREE:1;ESTIMATE_PERCENT:100.000000;BLOCK_SAMPLE:0;STALE_PERCENT:-1.000000;HIST_EST_PERCENT:100.000000 |
| T_PART     | GRANULARITY:GLOBAL;METHOD_OPT:FOR ALL COLUMNS SIZE AUTO;DEGREE:1;ESTIMATE_PERCENT:100.000000;BLOCK_SAMPLE:0;STALE_PERCENT:-1.000000;HIST_EST_PERCENT:100.000000 |
+------------+-----------------------------------------------------------------------------------------------------------------------------------------------------------------+

call dbms_stats.delete_table_prefs('USTAT', 'T_PART', 'GRANULARITY');

call dbms_stats.GATHER_DATABASE_STATS_JOB_PROC();
select TABLE_NAME,PARTITION_NAME,NUM_ROWS from sys.dba_tab_statistics where table_name='T_PART' and OWNER = 'USTAT';
+------------+----------------+----------+
| TABLE_NAME | PARTITION_NAME | NUM_ROWS |
+------------+----------------+----------+
| T_PART     | NULL           |    42000 |
| T_PART     | P0             |    12070 |
| T_PART     | P1             |     9919 |
| T_PART     | P2             |     9917 |
| T_PART     | P3             |    10094 |
+------------+----------------+----------+
select TABLE_NAME,PROPERTIES from sys.dba_ob_table_opt_stat_gather_history where table_name='T_PART' and OWNER = 'USTAT';
+------------+-----------------------------------------------------------------------------------------------------------------------------------------------------------------+
| TABLE_NAME | PROPERTIES                                                                                                                                                      |
+------------+-----------------------------------------------------------------------------------------------------------------------------------------------------------------+
| T_PART     | GRANULARITY:AUTO;METHOD_OPT:FOR ALL COLUMNS SIZE AUTO;DEGREE:1;ESTIMATE_PERCENT:100.000000;BLOCK_SAMPLE:0;STALE_PERCENT:-1.000000;HIST_EST_PERCENT:100.000000   |
| T_PART     | GRANULARITY:AUTO;METHOD_OPT:FOR ALL COLUMNS SIZE AUTO;DEGREE:1;ESTIMATE_PERCENT:100.000000;BLOCK_SAMPLE:0;STALE_PERCENT:-1.000000;HIST_EST_PERCENT:100.000000   |
| T_PART     | GRANULARITY:GLOBAL;METHOD_OPT:FOR ALL COLUMNS SIZE AUTO;DEGREE:1;ESTIMATE_PERCENT:100.000000;BLOCK_SAMPLE:0;STALE_PERCENT:-1.000000;HIST_EST_PERCENT:100.000000 |
| T_PART     | GRANULARITY:GLOBAL;METHOD_OPT:FOR ALL COLUMNS SIZE AUTO;DEGREE:1;ESTIMATE_PERCENT:100.000000;BLOCK_SAMPLE:0;STALE_PERCENT:-1.000000;HIST_EST_PERCENT:100.000000 |
+------------+-----------------------------------------------------------------------------------------------------------------------------------------------------------------+

call dbms_stats.delete_table_stats('USTAT','T_PART');
call dbms_stats.set_table_prefs('USTAT', 'T_PART', 'BLOCK_SAMPLE', 'TRUE');
call dbms_stats.set_table_prefs('USTAT', 'T_PART', 'ESTIMATE_PERCENT', '50');

call dbms_stats.GATHER_DATABASE_STATS_JOB_PROC();
select TABLE_NAME,PROPERTIES from sys.dba_ob_table_opt_stat_gather_history where table_name='T_PART' and OWNER = 'USTAT';
+------------+-----------------------------------------------------------------------------------------------------------------------------------------------------------------+
| TABLE_NAME | PROPERTIES                                                                                                                                                      |
+------------+-----------------------------------------------------------------------------------------------------------------------------------------------------------------+
| T_PART     | GRANULARITY:AUTO;METHOD_OPT:FOR ALL COLUMNS SIZE AUTO;DEGREE:1;ESTIMATE_PERCENT:100.000000;BLOCK_SAMPLE:0;STALE_PERCENT:-1.000000;HIST_EST_PERCENT:100.000000   |
| T_PART     | GRANULARITY:AUTO;METHOD_OPT:FOR ALL COLUMNS SIZE AUTO;DEGREE:1;ESTIMATE_PERCENT:100.000000;BLOCK_SAMPLE:0;STALE_PERCENT:-1.000000;HIST_EST_PERCENT:100.000000   |
| T_PART     | GRANULARITY:AUTO;METHOD_OPT:FOR ALL COLUMNS SIZE AUTO;DEGREE:1;ESTIMATE_PERCENT:50.000000;BLOCK_SAMPLE:1;STALE_PERCENT:-1.000000;HIST_EST_PERCENT:100.000000    |
| T_PART     | GRANULARITY:GLOBAL;METHOD_OPT:FOR ALL COLUMNS SIZE AUTO;DEGREE:1;ESTIMATE_PERCENT:100.000000;BLOCK_SAMPLE:0;STALE_PERCENT:-1.000000;HIST_EST_PERCENT:100.000000 |
| T_PART     | GRANULARITY:GLOBAL;METHOD_OPT:FOR ALL COLUMNS SIZE AUTO;DEGREE:1;ESTIMATE_PERCENT:100.000000;BLOCK_SAMPLE:0;STALE_PERCENT:-1.000000;HIST_EST_PERCENT:100.000000 |
+------------+-----------------------------------------------------------------------------------------------------------------------------------------------------------------+

drop table t_part;

##drop tenant
