# ----------------------------------------------------------------------
# Test Lob DDL in mysql mode
# ----------------------------------------------------------------------
create table t1 (c1 text);
show create table t1;
Table	Create Table
t1	CREATE TABLE `t1` (
  `c1` text DEFAULT NULL
) ORGANIZATION INDEX DEFAULT CHARSET = utf8mb4 ROW_FORMAT = DYNAMIC COMPRESSION = 'zstd_1.3.8' REPLICA_NUM = 1 BLOCK_SIZE = 16384 USE_BLOOM_FILTER = FALSE ENABLE_MACRO_BLOCK_BLOOM_FILTER = FALSE TABLET_SIZE = 134217728 PCTFREE = 0
drop table t1;
create table t1 (c1 text) DEFAULT_LOB_INROW_THRESHOLD=4444;
show create table t1;
Table	Create Table
t1	CREATE TABLE `t1` (
  `c1` text DEFAULT NULL
) ORGANIZATION INDEX DEFAULT CHARSET = utf8mb4 ROW_FORMAT = DYNAMIC COMPRESSION = 'zstd_1.3.8' REPLICA_NUM = 1 BLOCK_SIZE = 16384 USE_BLOOM_FILTER = FALSE ENABLE_MACRO_BLOCK_BLOOM_FILTER = FALSE TABLET_SIZE = 134217728 PCTFREE = 0 LOB_INROW_THRESHOLD=4444
drop table t1;
create table t1 (c1 text) DEFAULT_LOB_INROW_THRESHOLD=4444;
show create table t1;
Table	Create Table
t1	CREATE TABLE `t1` (
  `c1` text DEFAULT NULL
) ORGANIZATION INDEX DEFAULT CHARSET = utf8mb4 ROW_FORMAT = DYNAMIC COMPRESSION = 'zstd_1.3.8' REPLICA_NUM = 1 BLOCK_SIZE = 16384 USE_BLOOM_FILTER = FALSE ENABLE_MACRO_BLOCK_BLOOM_FILTER = FALSE TABLET_SIZE = 134217728 PCTFREE = 0 LOB_INROW_THRESHOLD=4444
alter table t1 add column (c2 text);
show create table t1;
Table	Create Table
t1	CREATE TABLE `t1` (
  `c1` text DEFAULT NULL,
  `c2` text DEFAULT NULL
) ORGANIZATION INDEX DEFAULT CHARSET = utf8mb4 ROW_FORMAT = DYNAMIC COMPRESSION = 'zstd_1.3.8' REPLICA_NUM = 1 BLOCK_SIZE = 16384 USE_BLOOM_FILTER = FALSE ENABLE_MACRO_BLOCK_BLOOM_FILTER = FALSE TABLET_SIZE = 134217728 PCTFREE = 0 LOB_INROW_THRESHOLD=4444
alter table t1 set DEFAULT_LOB_INROW_THRESHOLD = 5555;
show create table t1;
Table	Create Table
t1	CREATE TABLE `t1` (
  `c1` text DEFAULT NULL,
  `c2` text DEFAULT NULL
) ORGANIZATION INDEX DEFAULT CHARSET = utf8mb4 ROW_FORMAT = DYNAMIC COMPRESSION = 'zstd_1.3.8' REPLICA_NUM = 1 BLOCK_SIZE = 16384 USE_BLOOM_FILTER = FALSE ENABLE_MACRO_BLOCK_BLOOM_FILTER = FALSE TABLET_SIZE = 134217728 PCTFREE = 0 LOB_INROW_THRESHOLD=5555
drop table t1;
create table t1 (c1 text, c2 text) DEFAULT_LOB_INROW_THRESHOLD=4444;
show create table t1;
Table	Create Table
t1	CREATE TABLE `t1` (
  `c1` text DEFAULT NULL,
  `c2` text DEFAULT NULL
) ORGANIZATION INDEX DEFAULT CHARSET = utf8mb4 ROW_FORMAT = DYNAMIC COMPRESSION = 'zstd_1.3.8' REPLICA_NUM = 1 BLOCK_SIZE = 16384 USE_BLOOM_FILTER = FALSE ENABLE_MACRO_BLOCK_BLOOM_FILTER = FALSE TABLET_SIZE = 134217728 PCTFREE = 0 LOB_INROW_THRESHOLD=4444
drop table t1;
create table t1 (c1 text, c2 text) LOB_INROW_THRESHOLD=4444;
show create table t1;
Table	Create Table
t1	CREATE TABLE `t1` (
  `c1` text DEFAULT NULL,
  `c2` text DEFAULT NULL
) ORGANIZATION INDEX DEFAULT CHARSET = utf8mb4 ROW_FORMAT = DYNAMIC COMPRESSION = 'zstd_1.3.8' REPLICA_NUM = 1 BLOCK_SIZE = 16384 USE_BLOOM_FILTER = FALSE ENABLE_MACRO_BLOCK_BLOOM_FILTER = FALSE TABLET_SIZE = 134217728 PCTFREE = 0 LOB_INROW_THRESHOLD=4444
drop table t1;
set ob_default_lob_inrow_threshold=6666;
create table t1 (c1 text);
show create table t1;
Table	Create Table
t1	CREATE TABLE `t1` (
  `c1` text DEFAULT NULL
) ORGANIZATION INDEX DEFAULT CHARSET = utf8mb4 ROW_FORMAT = DYNAMIC COMPRESSION = 'zstd_1.3.8' REPLICA_NUM = 1 BLOCK_SIZE = 16384 USE_BLOOM_FILTER = FALSE ENABLE_MACRO_BLOCK_BLOOM_FILTER = FALSE TABLET_SIZE = 134217728 PCTFREE = 0 LOB_INROW_THRESHOLD=6666
drop table t1;
create table t1(pk int primary key, c2 varchar(100), j text) DEFAULT_LOB_INROW_THRESHOLD=10000;
insert into t1 values(1, '2222', repeat('x', 8127));
select pk, md5(j) as md5 from t1;
pk	md5
1	6adf06e8c88dd93a4a7e204977d51287
alter table t1 drop column c2;
select pk, md5(j) as md5 from t1;
pk	md5
1	6adf06e8c88dd93a4a7e204977d51287
drop table t1;
create table t1(pk int primary key, c1 mediumtext, c2 longtext, c3 longtext);
alter table t1 set lob_inrow_threshold = 786433;
ERROR HY000: Incorrect arguments to lob inrow threshold, should be [0, 786432]
alter table t1 set lob_inrow_threshold = 786432;
ERROR HY000: Data too long(2359296>1572864) for column 'c3'
drop table t1;
create table t1(pk int primary key, c1 longtext);
insert into t1 values(1, repeat('1', 786432));
update t1 set c1 = repeat('2', 786432);
drop table t1;
set ob_default_lob_inrow_threshold=786433;
ERROR HY000: Incorrect arguments to lob inrow threshold, should be [0, 786432]
create table lob_t1(pk int primary key, c1 longtext) lob_inrow_threshold = 4097;
insert into lob_t1 values(1, repeat('1', 786432));
select lob_inrow_threshold from oceanbase.__all_table where table_name='lob_t1';
lob_inrow_threshold
4097
alter table lob_t1 set lob_inrow_threshold = 1026;
select lob_inrow_threshold from oceanbase.__all_table where table_name='lob_t1';
lob_inrow_threshold
1026
run offline ddl
alter table lob_t1 set lob_inrow_threshold = 1027;
select lob_inrow_threshold from oceanbase.__all_table where table_name='lob_t1';
lob_inrow_threshold
1027
run online ddl
drop table lob_t1;
create table t1(c1 longtext, c2 longtext) lob_inrow_threshold=786432;
insert into t1 values(repeat('1', 786432), repeat('2', 786432));
select md5(c1), md5(c2) from t1;
md5(c1)	md5(c2)
a5386a55e2680c0c7e381c96e13c0f5a	d8b81fd9bd5be1c8c78f5467a5b3a010
alter table t1 set lob_inrow_threshold=393216;
alter table t1 add c3 longtext;
select md5(c1), md5(c2), md5(c3) from t1;
md5(c1)	md5(c2)	md5(c3)
a5386a55e2680c0c7e381c96e13c0f5a	d8b81fd9bd5be1c8c78f5467a5b3a010	NULL
update t1 set c3 = repeat('2', 386432);
select md5(c1), md5(c2), md5(c3) from t1;
md5(c1)	md5(c2)	md5(c3)
a5386a55e2680c0c7e381c96e13c0f5a	d8b81fd9bd5be1c8c78f5467a5b3a010	ed3805aaa970c50a0cd953e668f62b94
alter table t1 add c4 longtext;
select md5(c1), md5(c2), md5(c3), md5(c4) from t1;
md5(c1)	md5(c2)	md5(c3)	md5(c4)
a5386a55e2680c0c7e381c96e13c0f5a	d8b81fd9bd5be1c8c78f5467a5b3a010	ed3805aaa970c50a0cd953e668f62b94	NULL
update t1 set c4 = repeat('2', 386432);
select md5(c1), md5(c2), md5(c3), md5(c4) from t1;
md5(c1)	md5(c2)	md5(c3)	md5(c4)
a5386a55e2680c0c7e381c96e13c0f5a	d8b81fd9bd5be1c8c78f5467a5b3a010	ed3805aaa970c50a0cd953e668f62b94	ed3805aaa970c50a0cd953e668f62b94
delete from t1;
drop table t1;
create table t1 (pk int primary key, c1 longtext);
drop table t1;
drop table if exists lob_t1;
create table lob_t1 (pk int primary key, c1 longtext) partition by hash(pk) partitions 4;
drop table lob_t1;
create table lob_t1( c0 int, c1 varchar(65535), c2 varchar(65535), c3 varchar(65535), c4 varchar(65535), c5 varchar(65535), c6 varchar(65407));
alter table lob_t1 add c7 longtext;
ERROR 42000: Row size too large
alter table lob_t1 add c7 longtext, modify column c3 varchar(65535) after c4;
ERROR HY000: Data too long(1578994>1572864) for column 'c7'
drop table lob_t1;
create table lob_t1( c0 int, c1 varchar(65535), c2 varchar(65535), c3 varchar(65535), c4 varchar(65535), c5 varchar(65535), c6 varchar(65407), c7 longtext);
ERROR 42000: Row size too large
