insert into opm_t_group_inventory_plan values(repeat('1', 150)  , NULL , NULL , NULL , NULL , NULL , NULL , NULL , NULL , NULL , NULL , NULL , NULL , NULL , NULL , NULL , NULL , NULL , NULL , NULL , NULL , NULL , NULL , NULL , NULL , NULL , NULL , NULL , NULL , NULL , NULL , NULL , NULL , NULL , NULL , NULL , NULL , NULL , NULL , NULL , NULL , NULL , NULL , NULL , NULL , NULL , NULL , NULL , NULL , NULL , NULL , NULL , NULL , NULL , NULL , NULL , NULL , NULL , NULL , NULL , NULL , NULL , NULL , NULL , NULL , NULL , NULL , NULL , NULL , NULL , NULL , NULL , NULL , NULL , NULL , NULL , NULL , NULL , NULL , NULL , NULL , NULL , NULL , NULL , NULL , NULL , NULL , NULL , NULL , NULL , NULL , NULL , NULL , NULL , NULL , NULL , NULL , NULL , NULL , NULL , NULL , NULL , NULL , NULL , NULL , NULL , NULL , NULL , NULL , NULL , NULL , NULL , NULL , NULL , NULL , NULL , NULL , NULL , NULL , NULL , NULL , NULL , NULL , NULL , NULL , NULL , NULL , NULL , NULL , NULL , NULL , NULL , NULL , NULL , NULL , NULL , NULL , NULL , NULL , NULL , NULL , NULL , NULL , NULL , NULL , NULL , NULL , NULL , NULL , NULL , NULL , NULL , NULL , NULL , NULL , NULL , NULL , NULL , NULL , NULL , NULL , NULL , NULL , NULL , NULL , NULL , NULL , NULL , NULL , NULL , NULL , NULL , NULL , NULL , NULL , NULL , NULL , NULL , NULL , NULL , NULL , NULL , NULL , NULL , NULL , NULL , NULL , NULL , NULL , NULL , NULL , NULL , NULL , NULL , NULL , NULL , NULL , NULL , NULL , NULL , NULL , NULL , NULL , NULL , NULL , NULL , NULL , NULL , NULL , NULL , NULL , NULL , NULL , NULL , NULL , NULL , NULL , NULL , NULL , NULL , NULL , NULL , NULL , NULL , NULL , NULL , NULL , NULL , NULL , NULL , NULL , NULL , NULL , NULL , NULL , NULL , NULL , NULL , NULL , NULL , NULL , NULL , NULL , NULL , NULL , NULL , NULL , NULL , NULL , NULL , NULL , NULL , NULL , NULL , NULL , NULL , NULL , NULL , NULL , NULL , NULL , NULL , NULL , NULL , NULL , NULL , NULL , NULL , NULL , NULL , NULL , NULL , NULL , NULL , NULL , NULL , NULL , NULL , NULL , NULL , NULL , NULL , NULL , NULL , NULL , NULL , NULL , NULL , NULL , NULL , NULL , NULL , NULL , NULL , NULL , NULL , NULL , NULL , NULL , NULL , NULL , NULL , NULL , NULL , NULL , NULL , NULL , NULL , NULL , NULL , NULL , NULL , NULL , NULL , NULL , NULL , NULL , NULL , NULL , NULL , NULL , NULL , NULL , NULL , NULL , NULL , NULL , NULL , NULL , NULL , NULL , NULL , NULL , NULL , NULL , NULL , NULL , NULL , NULL , NULL , NULL , NULL , NULL , NULL , NULL , NULL , NULL , NULL , NULL , NULL , NULL , NULL , NULL , NULL , NULL , NULL , NULL , NULL , NULL , NULL , NULL , NULL , NULL , NULL , NULL , NULL , NULL , NULL , NULL , NULL , NULL , NULL , NULL , NULL , NULL , NULL , NULL , NULL , NULL , NULL , NULL , NULL , NULL , NULL , NULL , NULL , NULL , NULL , NULL , NULL , NULL , NULL , NULL , NULL , NULL , NULL , NULL , NULL , NULL , NULL , NULL , NULL , NULL , NULL , NULL , NULL , NULL , NULL , NULL , NULL , NULL , NULL , NULL , NULL , NULL , NULL , NULL , NULL , NULL , NULL , NULL , NULL , NULL , NULL , NULL , NULL , NULL , NULL , NULL , NULL , NULL , NULL , NULL , NULL , NULL , NULL , NULL , NULL , NULL , NULL , NULL , NULL , NULL , NULL , NULL , NULL , NULL , NULL , repeat('1', 10000) , repeat('1', 10000) , repeat('1', 10000) , repeat('1', 10000) , repeat('1', 10000) , repeat('1', 10000) , repeat('1', 10000) , repeat('1', 10000) , repeat('1', 10000) , repeat('1', 10000) , repeat('1', 10000) , repeat('1', 10000) , repeat('1', 10000) , repeat('1', 10000) , repeat('1', 10000) , repeat('1', 10000) , repeat('1', 10000) , repeat('1', 10000) , repeat('1', 10000) , repeat('1', 10000) , repeat('1', 10000) , repeat('1', 10000) , repeat('1', 10000) , repeat('1', 10000) , repeat('1', 10000) , repeat('1', 10000) , repeat('1', 10000) , repeat('1', 10000) , repeat('1', 10000) , repeat('1', 10000) , repeat('1', 10000) , repeat('1', 10000) , repeat('1', 10000) , repeat('1', 10000) , repeat('1', 10000) , repeat('1', 10000) , repeat('1', 10000) , repeat('1', 10000) , repeat('1', 10000) , repeat('1', 10000) , repeat('1', 10000) , repeat('1', 10000) , repeat('1', 10000) , repeat('1', 10000) , repeat('1', 10000) , repeat('1', 10000) , repeat('1', 10000) , repeat('1', 10000) , repeat('1', 10000) , repeat('1', 10000) , repeat('1', 10000) , repeat('1', 10000) , repeat('1', 10000) , repeat('1', 10000) , repeat('1', 10000) , repeat('1', 10000) , repeat('1', 10000) , repeat('1', 10000) , repeat('1', 10000) , repeat('1', 10000) , repeat('1', 10000) , repeat('1', 10000) , repeat('1', 10000) , repeat('1', 10000) , repeat('1', 10000) , repeat('1', 10000) , repeat('1', 10000) , repeat('1', 10000) , repeat('1', 10000) , repeat('1', 10000) , repeat('1', 10000) , repeat('1', 10000) , repeat('1', 10000) , repeat('1', 10000) , repeat('1', 10000) , repeat('1', 10000) , repeat('1', 10000) , repeat('1', 10000) , repeat('1', 10000) , repeat('1', 10000) , repeat('1', 10000) , repeat('1', 10000) , repeat('1', 10000) , repeat('1', 10000) , repeat('1', 10000) , repeat('1', 10000) , repeat('1', 10000) , repeat('1', 10000) , repeat('1', 10000) , repeat('1', 10000) , repeat('1', 10000) , repeat('1', 10000) , repeat('1', 10000) , repeat('1', 10000) , repeat('1', 10000) , repeat('1', 10000) , repeat('1', 10000) , repeat('1', 10000) , repeat('1', 10000) , repeat('1', 10000) , repeat('1', 10000) , repeat('1', 10000) , repeat('1', 10000) , repeat('1', 10000) , repeat('1', 10000) , repeat('1', 10000) , repeat('1', 10000) , repeat('1', 10000) , repeat('1', 10000) , repeat('1', 10000) , repeat('1', 10000) , repeat('1', 10000) , repeat('1', 10000) , repeat('1', 10000) , repeat('1', 10000) , repeat('1', 10000) , repeat('1', 10000) , repeat('1', 10000) , repeat('1', 10000) , repeat('1', 10000) , repeat('1', 10000) , repeat('1', 10000) , repeat('1', 10000) , repeat('1', 10000) , repeat('1', 10000) , repeat('1', 10000) , repeat('1', 10000) , repeat('1', 10000) , repeat('1', 10000) , repeat('1', 10000) , repeat('1', 10000) , repeat('1', 10000) , repeat('1', 10000) , repeat('1', 10000) , repeat('1', 10000) , repeat('1', 10000) , repeat('1', 10000) , repeat('1', 10000) , repeat('1', 10000) , repeat('1', 10000) , repeat('1', 10000) , repeat('1', 10000) , repeat('1', 10000) , repeat('1', 10000) , repeat('1', 10000) , repeat('1', 10000) , repeat('1', 10000) , repeat('1', 10000) , repeat('1', 10000) , repeat('1', 10000) , repeat('1', 10000) , repeat('1', 10000) , repeat('1', 10000) , repeat('1', 10000) , repeat('1', 10000) , repeat('1', 10000) , repeat('1', 10000) , repeat('1', 10000) , repeat('1', 10000) , repeat('1', 10000) , repeat('1', 10000) , repeat('1', 10000) , repeat('1', 10000) , repeat('1', 10000) , repeat('1', 10000) , repeat('1', 10000) , repeat('1', 10000) , repeat('1', 10000) , repeat('1', 10000) , repeat('1', 10000) , repeat('1', 10000) , repeat('1', 10000) , repeat('1', 10000) , repeat('1', 10000) , repeat('1', 10000) , repeat('1', 10000) , repeat('1', 10000) , repeat('1', 10000) , repeat('1', 10000) , repeat('1', 10000) , repeat('1', 10000) , repeat('1', 10000) , repeat('1', 10000) , repeat('1', 10000) , repeat('1', 10000) , repeat('1', 10000) , repeat('1', 10000) , repeat('1', 10000) , repeat('1', 10000) , repeat('1', 10000) , repeat('1', 10000) , repeat('1', 10000) , repeat('1', 10000) , repeat('1', 10000) , repeat('1', 10000) , repeat('1', 10000) , repeat('1', 10000) , repeat('1', 10000) , repeat('1', 10000) , repeat('1', 10000) , repeat('1', 10000) , repeat('1', 10000) , repeat('1', 10000) , repeat('1', 10000) , repeat('1', 10000) , repeat('1', 10000) , repeat('1', 10000) , repeat('1', 10000) , repeat('1', 10000) , repeat('1', 10000) , repeat('1', 10000) , repeat('1', 10000) , repeat('1', 10000) , repeat('1', 10000) , repeat('1', 10000) , repeat('1', 10000) , repeat('1', 10000) , repeat('1', 10000) , repeat('1', 10000) , repeat('1', 10000) , repeat('1', 10000) , repeat('1', 10000) , repeat('1', 10000) , repeat('1', 10000) , repeat('1', 10000) , repeat('1', 10000) , repeat('1', 10000) , repeat('1', 10000) , repeat('1', 10000) , repeat('1', 10000) , repeat('1', 10000) , repeat('1', 10000) , repeat('1', 10000) , repeat('1', 10000) , repeat('1', 10000) , repeat('1', 10000) , repeat('1', 10000) , repeat('1', 10000) , repeat('1', 10000) , repeat('1', 10000) , repeat('1', 10000) , repeat('1', 10000) , repeat('1', 10000) , repeat('1', 10000) , repeat('1', 10000) , repeat('1', 10000) , repeat('1', 10000) , repeat('1', 10000) , repeat('1', 10000) , repeat('1', 10000) , repeat('1', 10000) , repeat('1', 10000) , repeat('1', 10000) , repeat('1', 10000) , repeat('1', 10000) , repeat('1', 10000) , repeat('1', 10000) , repeat('1', 10000) , repeat('1', 10000) , repeat('1', 10000) , repeat('1', 10000) , repeat('1', 10000) , repeat('1', 10000) , repeat('1', 10000) , repeat('1', 10000) , repeat('1', 10000) , repeat('1', 10000) , repeat('1', 10000) , repeat('1', 10000) , repeat('1', 10000) , repeat('1', 10000) , repeat('1', 10000) , repeat('1', 10000) , repeat('1', 10000) , repeat('1', 10000) , repeat('1', 10000) , repeat('1', 10000) , repeat('1', 10000) , repeat('1', 10000) , repeat('1', 10000) , repeat('1', 10000) , repeat('1', 10000) , repeat('1', 10000) , repeat('1', 10000) , repeat('1', 10000) , repeat('1', 10000) , repeat('1', 10000) , repeat('1', 10000) , repeat('1', 10000) , repeat('1', 10000) , repeat('1', 10000) , repeat('1', 10000) , repeat('1', 10000) , repeat('1', 10000) , repeat('1', 10000) , repeat('1', 10000) , repeat('1', 10000) , repeat('1', 10000) , repeat('1', 10000) , repeat('1', 10000) , repeat('1', 10000) , repeat('1', 10000) , repeat('1', 10000) , repeat('1', 10000) , repeat('1', 10000) , repeat('1', 10000) , repeat('1', 10000) , repeat('1', 10000) , repeat('1', 10000) , repeat('1', 10000) , repeat('1', 10000) , repeat('1', 10000) , repeat('1', 10000) , repeat('1', 10000) , repeat('1', 10000) , repeat('1', 10000) , repeat('1', 10000) , repeat('1', 10000) , repeat('1', 10000) , repeat('1', 10000) , repeat('1', 10000) , repeat('1', 10000) , repeat('1', 10000) , repeat('1', 10000) , repeat('1', 10000) , repeat('1', 10000) , repeat('1', 10000) , repeat('1', 10000));
select md5(FMA_AFI_FOURTH_SALE_NUMBER), md5(FMA_AFI_FIRST_SALE_AMOUNT) from opm_t_group_inventory_plan;
md5(FMA_AFI_FOURTH_SALE_NUMBER)	md5(FMA_AFI_FIRST_SALE_AMOUNT)
b223cca8b360eae4e49568512e2de29f	b223cca8b360eae4e49568512e2de29f
alter table opm_t_group_inventory_plan add c1_text text;
alter table opm_t_group_inventory_plan add c2_text text;
alter table opm_t_group_inventory_plan add c3_text text;
update opm_t_group_inventory_plan set c1_text = repeat('1', 100), c2_text = repeat('2', 3000), c3_text = repeat('3', 5000);
select md5(c1_text), md5(c2_text), md5(c3_text) from opm_t_group_inventory_plan;
md5(c1_text)	md5(c2_text)	md5(c3_text)
283260c404749b6abe47ea9c0be54c4c	7e7f65f6ae1f3c25e7ad3df9f7311577	0e65ddd9ddc049cfae4d203d84f95a03
delete from opm_t_group_inventory_plan;
