result_format: 4
// in mysql mode, select lob column,
// access expr no need to change
drop table if exists t1;
create table t1(c1 blob);
insert into t1 values('DJA');
select * from t1;
+------+
| c1   |
+------+
| DJA  |
+------+
explain select * from t1;
Query Plan
===============================================
|ID|OPERATOR       |NAME|EST.ROWS|EST.TIME(us)|
-----------------------------------------------
|0 |TABLE FULL SCAN|t1  |1       |9           |
===============================================
Outputs & filters:
-------------------------------------
  0 - output([t1.c1]), filter(nil), rowset=16
      access([t1.c1]), partitions(p0)
      is_index_back=false, is_global_index=false, 
      range_key([t1.__pk_increment]), range(MIN ; MAX)always true
select unhex(c1) from t1;
+-----------+
| unhex(c1) |
+-----------+
| NULL      |
+-----------+

select * from t1;
+------+
| c1   |
+------+
| DJA  |
+------+

drop table t1;

drop table if exists t7;
CREATE TABLE t7(a TEXT, UNIQUE (a(1)));
INSERT INTO t7 VALUES('b');
INSERT INTO t7 VALUES('c');
INSERT INTO t7 VALUES('d');
SELECT 'b' IN (SELECT * FROM t7);
+---------------------------+
| 'b' IN (SELECT * FROM t7) |
+---------------------------+
|                         1 |
+---------------------------+

drop table t7;

drop table if exists obbigpartition;
drop table if exists trade_base;
CREATE TABLE `obbigpartition` (
  `pk` bigint(20) NOT NULL AUTO_INCREMENT,
  `c1_blob` blob DEFAULT NULL,
  `c2_text` text DEFAULT NULL,
  `c3_longblob` longblob DEFAULT NULL,
  `c4_longtext` longtext DEFAULT NULL,
  `c1_md5` varchar(1024) DEFAULT NULL,
  `c2_md5` varchar(1024) DEFAULT NULL,
  `c3_md5` varchar(1024) DEFAULT NULL,
  `c4_md5` varchar(1024) DEFAULT NULL,
  `gmt_create` timestamp(6) NULL DEFAULT CURRENT_TIMESTAMP(6),
  `gmt_modified` timestamp(6) NULL DEFAULT CURRENT_TIMESTAMP(6) ON UPDATE CURRENT_TIMESTAMP(6),
  PRIMARY KEY (`pk`)
) AUTO_INCREMENT = 12000001 AUTO_INCREMENT_MODE = 'ORDER' DEFAULT CHARSET = utf8mb4 ROW_FORMAT = DYNAMIC COMPRESSION = 'zstd_1.3.8' REPLICA_NUM = 1 BLOCK_SIZE = 16384 USE_BLOOM_FILTER = FALSE TABLET_SIZE = 134217728 PCTFREE = 0;

CREATE TABLE `trade_base` (
  `trade_no` varchar(64) NOT NULL,
  `tnt_inst_id` varchar(32) NOT NULL,
  `out_trade_no` varchar(64) NOT NULL,
  `memo` varchar(500) DEFAULT NULL,
  `partner_id` varchar(32) DEFAULT NULL,
  `trans_amount` bigint(20) DEFAULT NULL,
  `partition_id` varchar(2) GENERATED ALWAYS AS (substr(`trade_no`,15,2)) VIRTUAL,
  `gmt_create` datetime(6) DEFAULT CURRENT_TIMESTAMP(6),
  `gmt_modified` datetime(6) DEFAULT CURRENT_TIMESTAMP(6),
  PRIMARY KEY (`trade_no`, `tnt_inst_id`),
  UNIQUE KEY `out_trade_no` (`out_trade_no`, `tnt_inst_id`, `partner_id`, `partition_id`) BLOCK_SIZE 16384 LOCAL
) DEFAULT CHARSET = utf8mb4 ROW_FORMAT = DYNAMIC COMPRESSION = 'zstd_1.3.8' REPLICA_NUM = 1 BLOCK_SIZE = 16384 USE_BLOOM_FILTER = FALSE TABLET_SIZE = 134217728 PCTFREE = 0
 partition by list columns(partition_id)
(partition p0 values in ('00'),
partition p1 values in ('01'),
partition p2 values in ('02'),
partition p3 values in ('03'),
partition p4 values in ('04'),
partition p5 values in ('05'),
partition p6 values in ('06'),
partition p7 values in ('07'),
partition p8 values in ('08'),
partition p9 values in ('09'),
partition p10 values in ('10'),
partition p11 values in ('11'),
partition p12 values in ('12'),
partition p13 values in ('13'),
partition p14 values in ('14'),
partition p15 values in ('15'),
partition p16 values in ('16'),
partition p17 values in ('17'),
partition p18 values in ('18'),
partition p19 values in ('19'),
partition p20 values in ('20'),
partition p21 values in ('21'),
partition p22 values in ('22'),
partition p23 values in ('23'),
partition p24 values in ('24'),
partition p25 values in ('25'),
partition p26 values in ('26'),
partition p27 values in ('27'),
partition p28 values in ('28'),
partition p29 values in ('29'),
partition p30 values in ('30'),
partition p31 values in ('31'),
partition p32 values in ('32'),
partition p33 values in ('33'),
partition p34 values in ('34'),
partition p35 values in ('35'),
partition p36 values in ('36'),
partition p37 values in ('37'),
partition p38 values in ('38'),
partition p39 values in ('39'),
partition p40 values in ('40'),
partition p41 values in ('41'),
partition p42 values in ('42'),
partition p43 values in ('43'),
partition p44 values in ('44'),
partition p45 values in ('45'),
partition p46 values in ('46'),
partition p47 values in ('47'),
partition p48 values in ('48'),
partition p49 values in ('49'),
partition p50 values in ('50'),
partition p51 values in ('51'),
partition p52 values in ('52'),
partition p53 values in ('53'),
partition p54 values in ('54'),
partition p55 values in ('55'),
partition p56 values in ('56'),
partition p57 values in ('57'),
partition p58 values in ('58'),
partition p59 values in ('59'),
partition p60 values in ('60'),
partition p61 values in ('61'),
partition p62 values in ('62'),
partition p63 values in ('63'),
partition p64 values in ('64'),
partition p65 values in ('65'),
partition p66 values in ('66'),
partition p67 values in ('67'),
partition p68 values in ('68'),
partition p69 values in ('69'),
partition p70 values in ('70'),
partition p71 values in ('71'),
partition p72 values in ('72'),
partition p73 values in ('73'),
partition p74 values in ('74'),
partition p75 values in ('75'),
partition p76 values in ('76'),
partition p77 values in ('77'),
partition p78 values in ('78'),
partition p79 values in ('79'),
partition p80 values in ('80'),
partition p81 values in ('81'),
partition p82 values in ('82'),
partition p83 values in ('83'),
partition p84 values in ('84'),
partition p85 values in ('85'),
partition p86 values in ('86'),
partition p87 values in ('87'),
partition p88 values in ('88'),
partition p89 values in ('89'),
partition p90 values in ('90'),
partition p91 values in ('91'),
partition p92 values in ('92'),
partition p93 values in ('93'),
partition p94 values in ('94'),
partition p95 values in ('95'),
partition p96 values in ('96'),
partition p97 values in ('97'),
partition p98 values in ('98'),
partition p99 values in ('99'));

insert into obbigpartition (c1_blob,c2_text,c3_longblob,c4_longtext,c1_md5,c2_md5,c3_md5,c4_md5) values(
repeat(md5(rand()),2000),
repeat(md5(rand()),2000),
repeat(md5(rand()),3000),
repeat(md5(rand()),3000),
md5(c1_blob),
md5(c2_text),
md5(c3_longblob),
md5(c4_longtext)
);

insert into trade_base (trade_no,tnt_inst_id,out_trade_no,memo,partner_id,trans_amount) values ('da3788ccdb54cc737ca1d4ce1f5c24b2',1,'',1,1,1);

select   ref_0.c3_longblob as c0,  ref_0.c3_md5 as c1,  ref_0.c4_md5 as c3 from  obbigpartition as ref_0 where EXISTS ( select distinct  ref_4.trans_amount as c0,  ref_4.memo as c1 from  trade_base as ref_4 where ref_4.trade_no in ( ref_0.c2_md5,  ref_0.c4_longtext,  ref_0.c4_md5,  ref_0.c4_md5) limit 1);
+------+------+------+
| c0   | c1   | c3   |
+------+------+------+
+------+------+------+

drop table trade_base;
drop table obbigpartition;

drop table if exists t1;
create table t1(
c1 tinyint(3) unsigned NOT NULL,
c2 double NOT NULL DEFAULT '4222.682974508274',
PRIMARY KEY (c1));

insert into t1 (c1) values (1);
insert into t1 values (2, 12313.123213);
insert into t1 values (3, 8989.172397);

alter table t1 add column c3 json not null;

select c3, max(c2) from t1;
+------+--------------+
| c3   | max(c2)      |
+------+--------------+
| null | 12313.123213 |
+------+--------------+

drop table t1;

drop database if exists db1;
drop database if exists db2;
create database db1;
create database db2;
create table db1.t1(c1 text);
insert into db1.t1 values(repeat('a', 6000));
rename table db1.t1 to db2.t1;
drop database db1;
purge recyclebin;
select substr(c1, 1, 10) from db2.t1;
+-------------------+
| substr(c1, 1, 10) |
+-------------------+
| aaaaaaaaaa        |
+-------------------+
drop database db2;

##bugfix #update/delete old row reread
SET sql_mode='';
DROP TABLE IF EXISTS Z0CASE;
CREATE TABLE Z0CASE(Z0_TEST0 TINYBLOB, Z0_TEST1 BLOB,Z0_TEST2 MEDIUMBLOB,Z0_TEST3 LONGBLOB);
INSERT INTO  Z0CASE (z0_test0,z0_test1,Z0_TEST2)VALUES('abc ABC','abc ABC','abc ABC');
INSERT INTO  Z0CASE (z0_test0,z0_test1,Z0_TEST2)VALUES('中文字符@!#$%^','中文字符@!#$%^','中文字符@!#$%^');
INSERT INTO  Z0CASE (z0_test0,z0_test1,Z0_TEST2)VALUES('2011-11-11 11:11:11','2011-11-11 11:11:11',20);
INSERT INTO  Z0CASE (z0_test0,z0_test1,Z0_TEST2)VALUES(NULL,NULL,0);
SELECT * FROM Z0CASE ORDER BY Z0_TEST2;
+---------------------+---------------------+--------------------+----------+
| Z0_TEST0            | Z0_TEST1            | Z0_TEST2           | Z0_TEST3 |
+---------------------+---------------------+--------------------+----------+
| NULL                | NULL                | 0                  | NULL     |
| 2011-11-11 11:11:11 | 2011-11-11 11:11:11 | 20                 | NULL     |
| abc ABC             | abc ABC             | abc ABC            | NULL     |
| 中文字符@!#$%^      | 中文字符@!#$%^      | 中文字符@!#$%^     | NULL     |
+---------------------+---------------------+--------------------+----------+




SELECT table_id,table_name FROM oceanbase.__all_virtual_table WHERE table_name='Z0CASE';




ALTER TABLE Z0CASE MODIFY COLUMN z0_test0 MEDIUMBLOB;
SELECT Z0_TEST0 FROM Z0CASE ORDER BY Z0_TEST2;
+---------------------+
| Z0_TEST0            |
+---------------------+
| NULL                |
| 2011-11-11 11:11:11 |
| abc ABC             |
| 中文字符@!#$%^      |
+---------------------+
DESC Z0CASE;
+----------+------------+------+-----+---------+-------+
| Field    | Type       | Null | Key | Default | Extra |
+----------+------------+------+-----+---------+-------+
| z0_test0 | mediumblob | YES  |     | NULL    |       |
| Z0_TEST1 | blob       | YES  |     | NULL    |       |
| Z0_TEST2 | mediumblob | YES  |     | NULL    |       |
| Z0_TEST3 | longblob   | YES  |     | NULL    |       |
+----------+------------+------+-----+---------+-------+




SELECT table_id,table_name FROM oceanbase.__all_virtual_table WHERE table_name='Z0CASE';



INSERT INTO  Z0CASE (z0_test0,z0_test1,Z0_TEST2)VALUES('abcabc ABCabc ABCabc ABCabc ABC ABC','abc ABC','abc ABC');
INSERT INTO  Z0CASE (z0_test0,z0_test1,Z0_TEST2)VALUES(213456789078995113365842566663,NULL,0);
SELECT Z0_TEST0 FROM Z0CASE ORDER BY Z0_TEST2;
+-------------------------------------+
| Z0_TEST0                            |
+-------------------------------------+
| NULL                                |
| 213456789078995113365842566663      |
| 2011-11-11 11:11:11                 |
| abc ABC                             |
| abcabc ABCabc ABCabc ABCabc ABC ABC |
| 中文字符@!#$%^                      |
+-------------------------------------+
UPDATE Z0CASE SET z0_test0='QWERERTERYRTFDD!@#$%^&*%add发;;]   /.//?测试数据' WHERE z0_test1='abc ABC';
UPDATE Z0CASE SET z0_test0=1233665548899+3332248696232 WHERE z0_test2=0;
Warnings:
Warning	1292	Truncated incorrect DECIMAL value: 'abc ABC'
Warning	1292	Truncated incorrect DECIMAL value: '中文字符@!#$%^'
Warning	1292	Truncated incorrect DECIMAL value: 'abc ABC'
SELECT Z0_TEST0 FROM Z0CASE ORDER BY Z0_TEST2;
+---------------------+
| Z0_TEST0            |
+---------------------+
| 4565914245131       |
| 4565914245131       |
| 2011-11-11 11:11:11 |
| 4565914245131       |
| 4565914245131       |
| 4565914245131       |
+---------------------+
DELETE FROM Z0CASE WHERE z0_test0=213456789078995113365842566663;
Warnings:
Warning	1292	Truncated incorrect DECIMAL value: '2011-11-11 11:11:11'
DELETE FROM Z0CASE WHERE z0_test0='213456789078995113365842566663';
SELECT * FROM Z0CASE ORDER BY Z0_TEST2;
+---------------------+---------------------+--------------------+----------+
| z0_test0            | Z0_TEST1            | Z0_TEST2           | Z0_TEST3 |
+---------------------+---------------------+--------------------+----------+
| 4565914245131       | NULL                | 0                  | NULL     |
| 4565914245131       | NULL                | 0                  | NULL     |
| 2011-11-11 11:11:11 | 2011-11-11 11:11:11 | 20                 | NULL     |
| 4565914245131       | abc ABC             | abc ABC            | NULL     |
| 4565914245131       | abc ABC             | abc ABC            | NULL     |
| 4565914245131       | 中文字符@!#$%^      | 中文字符@!#$%^     | NULL     |
+---------------------+---------------------+--------------------+----------+
DROP TABLE Z0CASE;
SET sql_mode='STRICT_TRANS_TABLES,STRICT_ALL_TABLES';

create table lhdt1(c1 longtext);
INSERT INTO lhdt1 VALUES (repeat('a', 2*1024*1024));
select length(REPLACE(c1, 'a', 'bb')) from lhdt1;
+--------------------------------+
| length(REPLACE(c1, 'a', 'bb')) |
+--------------------------------+
|                        4194304 |
+--------------------------------+
drop table lhdt1;

DROP TABLE IF EXISTS t2;
create table t2(pk int primary key, j blob);
insert into t2 values(1, '{"K":1}');
insert into t2 values(2, '{"K":2}');
insert into t2 values(3, '{"K":3}');
insert into t2 values(4, '{"K":4}');
insert into t2 values(5, '{"K":5}');
insert into t2 values(6, '{"K":6}');

select pk from t2 where  nullif(j, '{"K":6}') is null;
+----+
| pk |
+----+
|  6 |
+----+

drop table t2;

set ob_default_lob_inrow_threshold=0;
DROP TABLE IF EXISTS tbl_38;
CREATE TABLE `tbl_38` (   `col_160` set('Alice','Bob','Charlie','David') NOT NULL,   `col_161` text NOT NULL,   `col_163` tinyint(1) NOT NULL,   `col_164` set('Alice','Bob','Charlie','David') NOT NULL DEFAULT 'Alice',   PRIMARY KEY (`col_160`, `col_163`),   UNIQUE KEY `idx_42` (`col_164`, `col_163`, `col_160`) BLOCK_SIZE 16384 GLOBAL,   KEY `idx_41` (`col_164`, `col_163`, `col_160`) BLOCK_SIZE 16384 LOCAL,   KEY `idx_43` (`col_160`) BLOCK_SIZE 16384 GLOBAL ) DEFAULT CHARSET = utf8mb4 ROW_FORMAT = CONDENSED COMPRESSION = 'snappy_1.0' REPLICA_NUM = 3 BLOCK_SIZE = 16384 USE_BLOOM_FILTER = FALSE TABLET_SIZE = 134217728 PCTFREE = 0 LOB_INROW_THRESHOLD=0;
insert ignore into tbl_38  values ( 'Bob', '$_HAMfA95', 0, 'Bob');
insert ignore into tbl_38  values ( 'Bob','uyKfM$AVZ',0,'Alice' ), ( 'Bob','D%5~yS)SnQd-pQVg2',0,'Alice' ) on duplicate key update  col_163 = 0, col_161 = 'cL!_4weJgoMESZnhm@', col_160 = 'Bob', col_164 = 'Alice';
select * from tbl_38;
+---------+--------------------+---------+---------+
| col_160 | col_161            | col_163 | col_164 |
+---------+--------------------+---------+---------+
| Bob     | cL!_4weJgoMESZnhm@ |       0 | Alice   |
+---------+--------------------+---------+---------+
drop table tbl_38;

DROP TABLE IF EXISTS t0;
CREATE TABLE IF NOT EXISTS t0(c0 TINYTEXT  , c1 DOUBLE(19, 17) ZEROFILL , c2 TINYINT(219)   UNIQUE KEY, c3 LONGTEXT );
REPLACE INTO t0(c0, c1, c2, c3) VALUES ROW("_7[LaN\\O]7i}K'9", 93.55431863822935, -8, 'on');
INSERT INTO t0(c1, c2) VALUES ROW(7, -8) ON DUPLICATE KEY UPDATE c2=-6;
select * from t0;
+-----------------+----------------------+------+------+
| c0              | c1                   | c2   | c3   |
+-----------------+----------------------+------+------+
| _7[LaN\O]7i}K'9 | 93.55431863822935000 |   -6 | on   |
+-----------------+----------------------+------+------+
UPDATE t0 SET c3='';
select * from t0;
+-----------------+----------------------+------+------+
| c0              | c1                   | c2   | c3   |
+-----------------+----------------------+------+------+
| _7[LaN\O]7i}K'9 | 93.55431863822935000 |   -6 |      |
+-----------------+----------------------+------+------+
drop table t0;
set ob_default_lob_inrow_threshold=4096;

create table t0(pk int primary key, c1 text, c2 varchar(100)) lob_inrow_threshold=0;
insert into t0 values (1,'v0', 'v0');
select pk, md5(c1), md5(c2) from t0;
+----+----------------------------------+----------------------------------+
| pk | md5(c1)                          | md5(c2)                          |
+----+----------------------------------+----------------------------------+
|  1 | 9abcde3c584628a02620bf796dee1204 | 9abcde3c584628a02620bf796dee1204 |
+----+----------------------------------+----------------------------------+
insert ignore into t0 values (1,'v222', 'v222'), (1,'v333333', 'v333333') on duplicate key update c1 = md5(c1), c2 = md5(c2);
select pk, md5(c1), md5(c2) from t0;
+----+----------------------------------+----------------------------------+
| pk | md5(c1)                          | md5(c2)                          |
+----+----------------------------------+----------------------------------+
|  1 | f9d89d486928a666e31b2b112969959e | f9d89d486928a666e31b2b112969959e |
+----+----------------------------------+----------------------------------+
insert ignore into t0 values (1,'v11', 'v11') on duplicate key update c1 = md5(c1), c2 = md5(c2);
select pk, md5(c1), md5(c2) from t0;
+----+----------------------------------+----------------------------------+
| pk | md5(c1)                          | md5(c2)                          |
+----+----------------------------------+----------------------------------+
|  1 | f28197c8faedc8a26f608df633bb5b30 | f28197c8faedc8a26f608df633bb5b30 |
+----+----------------------------------+----------------------------------+
insert ignore into t0 values (1,'v222', 'v222'), (1,'v333333', 'v333333') on duplicate key update c1 = concat('xxxx', 'yyyyy'), c2 = concat('xxxx', 'yyyyy');
select pk, md5(c1), md5(c2) from t0;
+----+----------------------------------+----------------------------------+
| pk | md5(c1)                          | md5(c2)                          |
+----+----------------------------------+----------------------------------+
|  1 | 4f83b42dc48b3e0c9c9215d88a12505d | 4f83b42dc48b3e0c9c9215d88a12505d |
+----+----------------------------------+----------------------------------+
insert ignore into t0 values (1,'v222', 'v222'), (1,'v333333', 'v333333') on duplicate key update c1 = concat(c1, 'yyyyy'), c2 = concat(c2, 'yyyyy');
select pk, md5(c1), md5(c2) from t0;
+----+----------------------------------+----------------------------------+
| pk | md5(c1)                          | md5(c2)                          |
+----+----------------------------------+----------------------------------+
|  1 | 8392e790ccf4ac91502913a02d19dbe7 | 8392e790ccf4ac91502913a02d19dbe7 |
+----+----------------------------------+----------------------------------+
delete from t0;
drop table t0;

create table t0(c1 tinyblob, c2 blob);
insert into t0 values('', '');
insert into t0 values('123', '123');
insert into t0 values(null, null);
select to_base64(c1), to_base64(c2) from t0;
+---------------+---------------+
| to_base64(c1) | to_base64(c2) |
+---------------+---------------+
|               |               |
| MTIz          | MTIz          |
| NULL          | NULL          |
+---------------+---------------+
select /*+ opt_param('rowsets_enabled', 'false') */ to_base64(c1), to_base64(c2) from t0;
+---------------+---------------+
| to_base64(c1) | to_base64(c2) |
+---------------+---------------+
|               |               |
| MTIz          | MTIz          |
| NULL          | NULL          |
+---------------+---------------+
drop table t0;

