drop table if exists t1;
create table t1(a int primary key, b tinyblob, c text, d mediumblob, e longtext);
insert into t1 values(1, 'b', 'c', 'd', 'e');
insert into t1 values(2, 'bb', 'cc', 'dd', 'ee');
insert into t1 values(3, '', '', '', '');
insert into t1 values(4, null, null, null, null);
select * from t1 order by a;
a	b	c	d	e
1	b	c	d	e
2	bb	cc	dd	ee
3				
4	NULL	NULL	NULL	NULL
insert into t1 values(5, repeat('~', 255), repeat('~', 65535), repeat('~', 16777215), repeat('~', 12582912));
select a, length(b), length(c), length(d), length(e) from t1  order by a;
a	length(b)	length(c)	length(d)	length(e)
1	1	1	1	1
2	2	2	2	2
3	0	0	0	0
4	NULL	NULL	NULL	NULL
5	255	65535	16777215	12582912
insert into t1 values(6, repeat('~', 257), repeat('~', 65536), repeat('~', 2621440), repeat('~', 524288));
ERROR 22001: Data too long for column 'b' at row 1
insert into t1 values(6, repeat('~', 256), repeat('~', 65537), repeat('~', 2621440), repeat('~', 524288));
ERROR 22001: Data too long for column 'b' at row 1
insert into t1 values(6, repeat('~', 256), repeat('~', 65536), repeat('~', 16777217), repeat('~', 524288));
ERROR 22001: Data too long for column 'b' at row 1
insert into t1 values(6, repeat('~', 256), repeat('~', 65536), repeat('~', 16777216), repeat('~', 50331649));
ERROR 22001: Data too long for column 'b' at row 1
drop table t1;
drop table if exists t1;
create table t1(a int primary key, b tinyblob, c text, d mediumblob, e longtext);
insert into t1 values(1, 'b', 'c', 'd', 'e');
insert into t1 values(2, 'bb', 'cc', 'dd', 'ee');
select a, length(b), length(c), length(d), length(e) from t1 order by a;
a	length(b)	length(c)	length(d)	length(e)
1	1	1	401	1
2	2	402	2	402
select a, length(b), length(c), length(d), length(e) from t1 order by a;
a	length(b)	length(c)	length(d)	length(e)
1	1	1	801	1
2	2	802	2	802
drop table t1;
drop table if exists t1;
create table t1(a int primary key, b tinyblob, c text, d mediumblob, e longtext);
insert into t1 values(1, repeat('~', 255), repeat('~', 65535), repeat('~', 16777215), repeat('~', 16777216));
insert into t1 values(2, repeat('~', 255), repeat('~', 65535), repeat('~', 16777215), repeat('~', 16777216));
insert into t1 values(3, repeat('~', 255), repeat('~', 65535), repeat('~', 16777215), repeat('~', 16777216));
insert into t1 values(4, repeat('~', 255), repeat('~', 65535), repeat('~', 16777215), repeat('~', 16777216));
select a, length(b), length(c), substr(c, 100, 3), length(d), substr(d, 1000000, 10), length(e), substr(e, 10000000, 5) from t1 order by a;
a	length(b)	length(c)	substr(c, 100, 3)	length(d)	substr(d, 1000000, 10)	length(e)	substr(e, 10000000, 5)
1	255	65535	~~~	16777215	~~~~~~~~~~	16777216	~~~~~
2	255	65535	~~~	16777215	~~~~~~~~~~	16777216	~~~~~
3	255	65535	~~~	16777215	~~~~~~~~~~	16777216	~~~~~
4	255	65535	~~~	16777215	~~~~~~~~~~	16777216	~~~~~
update t1 set b = substr(b, 1, length(b) / 2) where a = 1;
update t1 set c = substr(c, 1, length(c) / 2) where a = 2;
update t1 set d = substr(d, 1, length(d) / 2) where a = 3;
update t1 set e = substr(e, 1, length(e) / 2) where a = 4;
select a, length(b), length(c), length(d), length(e) from t1 order by a;
a	length(b)	length(c)	length(d)	length(e)
1	128	65535	16777215	16777216
2	255	32768	16777215	16777216
3	255	65535	8388608	16777216
4	255	65535	16777215	8388608
update t1 set b = substr(b, 1, length(b) / 2) where a = 1;
update t1 set c = substr(c, 1, length(c) / 2) where a = 2;
update t1 set d = substr(d, 1, length(d) / 2) where a = 3;
update t1 set e = substr(e, 1, length(e) / 2) where a = 4;
select a, length(b), length(c), length(d), length(e) from t1 order by a;
a	length(b)	length(c)	length(d)	length(e)
1	64	65535	16777215	16777216
2	255	16384	16777215	16777216
3	255	65535	4194304	16777216
4	255	65535	16777215	4194304
alter system minor freeze tenant = sys;
alter system minor freeze tenant = all_user;
alter system minor freeze tenant = all_meta;
drop table t1;
drop table if exists t1;
create table t1(a int primary key, b tinyblob, c text, d mediumblob, e longtext);
insert into t1 values(1, 'b', 'c', 'd', 'e');
insert into t1 values(2, 'bb', 'cc', 'dd', 'ee');
insert into t1 values(3, '', '', '', '');
insert into t1 values(4, null, null, null, null);
insert into t1 values(5, repeat('~', 10), repeat('~', 10), repeat('~', 16777215), repeat('~', 16777215));
select a, b, c, length(d), substr(d, 1000000, 10), length(e), substr(e, 10000000, 5) from t1 order by a;
a	b	c	length(d)	substr(d, 1000000, 10)	length(e)	substr(e, 10000000, 5)
1	b	c	1		1	
2	bb	cc	2		2	
3			0		0	
4	NULL	NULL	NULL	NULL	NULL	NULL
5	~~~~~~~~~~	~~~~~~~~~~	16777215	~~~~~~~~~~	16777215	~~~~~
delete from t1 where b is null;
select a, b, c, length(d), substr(d, 1000000, 10), length(e), substr(e, 10000000, 5) from t1 order by a;
a	b	c	length(d)	substr(d, 1000000, 10)	length(e)	substr(e, 10000000, 5)
1	b	c	1		1	
2	bb	cc	2		2	
3			0		0	
5	~~~~~~~~~~	~~~~~~~~~~	16777215	~~~~~~~~~~	16777215	~~~~~
delete from t1 where c like '%cc%';
select a, b, c, length(d), substr(d, 1000000, 10), length(e), substr(e, 10000000, 5) from t1 order by a;
a	b	c	length(d)	substr(d, 1000000, 10)	length(e)	substr(e, 10000000, 5)
1	b	c	1		1	
3			0		0	
5	~~~~~~~~~~	~~~~~~~~~~	16777215	~~~~~~~~~~	16777215	~~~~~
delete from t1 where length(d) = 0;
select a, b, c, length(d), substr(d, 1000000, 10), length(e), substr(e, 10000000, 5) from t1 order by a;
a	b	c	length(d)	substr(d, 1000000, 10)	length(e)	substr(e, 10000000, 5)
1	b	c	1		1	
5	~~~~~~~~~~	~~~~~~~~~~	16777215	~~~~~~~~~~	16777215	~~~~~
delete from t1 where e < 'z';
select a, b, c, length(d), substr(d, 1000000, 10), length(e), substr(e, 10000000, 5) from t1 order by a;
a	b	c	length(d)	substr(d, 1000000, 10)	length(e)	substr(e, 10000000, 5)
5	~~~~~~~~~~	~~~~~~~~~~	16777215	~~~~~~~~~~	16777215	~~~~~
drop table t1;
drop table if exists t1,t2,t3,t4;
create table t1(a int primary key, b tinytext, c text, d mediumtext, e longtext);
create table t2(a int primary key, b tinyblob, c blob, d mediumblob, e longblob);
select a, length(b), length(c), length(d), length(e) from t1 order by a;
a	length(b)	length(c)	length(d)	length(e)
1	255	255	255	255
select a, length(b), length(c), length(d), length(e) from t2 order by a;
a	length(b)	length(c)	length(d)	length(e)
1	255	255	255	255
select a, length(b), length(c), length(d), length(e) from t1 order by a;
a	length(b)	length(c)	length(d)	length(e)
1	255	255	255	255
2	255	65535	65535	65535
select a, length(b), length(c), length(d), length(e) from t2 order by a;
a	length(b)	length(c)	length(d)	length(e)
1	255	255	255	255
2	255	65535	65535	65535
select a, length(b), length(c), length(d), length(e) from t1 order by a;
a	length(b)	length(c)	length(d)	length(e)
1	255	255	255	255
2	255	65535	65535	65535
3	255	65535	2097152	2097152
select a, length(b), length(c), length(d), length(e) from t2 order by a;
a	length(b)	length(c)	length(d)	length(e)
1	255	255	255	255
2	255	65535	65535	65535
3	255	65535	2097152	2097152
select a, length(b), length(c), length(d), length(e) from t1 order by a;
a	length(b)	length(c)	length(d)	length(e)
1	255	255	255	255
2	255	65535	65535	65535
3	255	65535	2097152	2097152
4	255	65535	2097152	8388608
select a, length(b), length(c), length(d), length(e) from t2 order by a;
a	length(b)	length(c)	length(d)	length(e)
1	255	255	255	255
2	255	65535	65535	65535
3	255	65535	2097152	2097152
4	255	65535	2097152	8388608
create table t3(b tinytext, c text, d mediumtext, e longtext);
create table t4(b tinyblob, c blob, d mediumblob, e longblob);
insert into t3 select * from t3;
insert into t4 select * from t4;
select  count(1) from t3;
count(1)
2
select  count(1) from t4;
count(1)
2
insert into t3 select * from t3;
insert into t4 select * from t4;
select  count(1) from t3;
count(1)
4
select  count(1) from t4;
count(1)
4
drop table t1,t2,t3,t4;
drop table if exists t1;
create table t1(c1 MEDIUMTEXT NOT NULL);
insert ignore into t1 values(NULL);
Warnings:
Warning	1048	Column 'c1' cannot be null
select * from t1;
c1

set sql_mode='';
CREATE TABLE IF NOT EXISTS lob_test (c2 TEXT NOT NULL);
insert into lob_test values(repeat('1', 10000));
select md5(c2) from lob_test;
md5(c2)
b223cca8b360eae4e49568512e2de29f
UPDATE lob_test SET c2 = DEFAULT;
select md5(c2) from lob_test;
md5(c2)
d41d8cd98f00b204e9800998ecf8427e
drop table lob_test;
set sql_mode=default;
drop table if exists t1;
drop table if exists t2;
create table t1 (c1 text);
insert into t1 select randstr(20000, random()) c1 from table(generator(100));
create table t2 (c1 text);
insert/*+enable_parallel_dml parallel(4) */ into t2 select /*+ opt_param('rowsets_enabled', 'false') */ c1 from t1;
drop table t1;
drop table t2;
create table t1(c1 tinytext CHARSET gbk);
create table t2(c1 varchar(100));
insert into t1 values('1');
select * from t1;
c1
1
insert t2 select c1 from t1;
select * from t2;
c1
1
drop table t1;
drop table t2;
CREATE TABLE t1 (c1 decimal(29,5) PRIMARY KEY, c2 blob) LOB_INROW_THRESHOLD=0;
insert into t1 values (1, '');
select * from t1;
c1	c2
1.00000	
update t1 set c1 = 2, c2 = 'abc1' , c2 = 'xyzzz';
select * from t1;
c1	c2
2.00000	xyzzz
drop table t1;
SET NAMES latin1 COLLATE latin1_swedish_ci;
create table t1 select 2 as a, concat(repeat('MySQL', 100 * 1024),  ';') as b;
select a, length(b), md5(b) from t1;
a	length(b)	md5(b)
2	512001	1378e6a3023d0497379e60bb72f50ec9
drop table t1;
SET NAMES utf8mb4;
