drop database if exists database1;
create database database1;
use database1;
alter database database1 CHARACTER SET UTF8;
alter database database1 collate utf8mb4_general_ci;
alter database database1 CHARACTER SET UTF8 collate utf8mb4_general_ci;
drop table if exists pt;
drop table if exists nt;
create table pt (c1 int, c2 int);
create table nt (c1 int, c2 int);
alter table pt exchange partition M1 with table nt WITHOUT VALIDATION;
ERROR HY000: Partition management on a not partitioned table is not possible
drop table pt;
drop table nt;
create table pt (c1 int, c2 int) partition by range(c1) (partition M1  VALUES LESS THAN (5), partition M2 VALUES LESS THAN (10), partition M3 VALUES LESS THAN (1000));
create table nt (c1 int, c2 int);
alter table pt exchange partition M1 with table nt WITHOUT VALIDATION;
drop table pt;
drop table nt;
create table pt (c1 int, c2 int) partition by range(c1) (partition M1  VALUES LESS THAN (5), partition M2 VALUES LESS THAN (10), partition M3 VALUES LESS THAN (1000));
create table nt (c1 int, c2 int);
alter table pt exchange partition M1 with table nt WITH VALIDATION;
ERROR 42000: You have an error in your SQL syntax; check the manual that corresponds to your OceanBase version for the right syntax to use near 'WITH VALIDATION' at line 1
drop table pt;
drop table nt;
drop table if exists test1;
CREATE TABLE test1(c1 int primary key, c2 varchar(30))PARTITION BY RANGE (c1)(
PARTITION c1_15 VALUES LESS THAN (15),
PARTITION c1_35 VALUES LESS THAN (35),
PARTITION c1_50 VALUES LESS THAN (50));
insert into test1(c1) values(1);
insert into test1(c1) values(2);
insert into test1(c1) values(36);
insert into test1(c1) values(38);
insert into test1(c1) values(40);
insert into test1(c1) values(45);
select * from test1;
c1	c2
1	NULL
2	NULL
36	NULL
38	NULL
40	NULL
45	NULL
drop table if exists test2;
Warnings:
Note	1051	Unknown table 'database1.test2'
CREATE TABLE test2(
c1 int primary key,
c2 varchar(30));
insert into test2(c1) values(40),(60);
select * from test2;
c1	c2
40	NULL
60	NULL
ALTER TABLE test1 EXCHANGE PARTITION c1_35 WITH TABLE test2 WITHOUT VALIDATION;
select * from test1 partition(c1_35);
c1	c2
40	NULL
60	NULL
ALTER TABLE test1 EXCHANGE PARTITION c1_35 WITH TABLE test2 INCLUDING INDEXES WITHOUT VALIDATION;
ERROR 42000: You have an error in your SQL syntax; check the manual that corresponds to your OceanBase version for the right syntax to use near 'INCLUDING INDEXES WITHOUT VALIDATION' at line 1
ALTER TABLE test1 EXCHANGE PARTITION c1_35 WITH TABLE test2;
ERROR 42000: You have an error in your SQL syntax; check the manual that corresponds to your OceanBase version for the right syntax to use near 'test2' at line 1
ALTER TABLE test1 EXCHANGE PARTITION c1_35 WITH TABLE test2 UPDATE INDEXES;
ERROR 42000: You have an error in your SQL syntax; check the manual that corresponds to your OceanBase version for the right syntax to use near 'UPDATE INDEXES' at line 1
ALTER TABLE test1 EXCHANGE PARTITION c1_35 WITH TABLE test2 UPDATE GLOBAL INDEXES;
ERROR 42000: You have an error in your SQL syntax; check the manual that corresponds to your OceanBase version for the right syntax to use near 'UPDATE GLOBAL INDEXES' at line 1
ALTER TABLE test1 EXCHANGE PARTITION c1_35 WITH TABLE test2 WITH VALIDATION;
ERROR 42000: You have an error in your SQL syntax; check the manual that corresponds to your OceanBase version for the right syntax to use near 'WITH VALIDATION' at line 1
create table pt (c1 int, c2 int) partition by range(c1) (partition M1  VALUES LESS THAN (5), partition M2 VALUES LESS THAN (10), partition M3 VALUES LESS THAN (1000));
create table nt (c1 int, c2 int);
alter table pt exchange partition M111 with table nt WITHOUT VALIDATION;
ERROR HY000: Unknown partition
alter table pt exchange partition M1 with table nt WITHOUT VALIDATION;
drop table pt;
drop table nt;
CREATE TABLE pt(c1 INT,c2 INT) PARTITION BY RANGE(c1) 
SUBPARTITION BY RANGE(c1)
SUBPARTITION TEMPLATE
(SUBPARTITION mp1 VALUES LESS THAN(100),
SUBPARTITION mp2 VALUES LESS THAN(200),
SUBPARTITION mp3 VALUES LESS THAN(300)
)
(PARTITION p0 VALUES LESS THAN(2020),
PARTITION p1 VALUES LESS THAN(2021),
PARTITION p2 VALUES LESS THAN(2022)
);
CREATE TABLE nt(c1 INT,c2 INT);
alter table pt exchange partition M1 with table nt WITHOUT VALIDATION;
Got one of the listed errors
alter table pt exchange partition p0smp1 with table nt WITHOUT VALIDATION;
drop table pt;
drop table nt;
CREATE TABLE pt(c1 INT,c2 INT) PARTITION BY RANGE(c1)
SUBPARTITION BY RANGE(c1)
SUBPARTITION TEMPLATE
(SUBPARTITION mp1 VALUES LESS THAN(100),
SUBPARTITION mp2 VALUES LESS THAN(200),
SUBPARTITION mp3 VALUES LESS THAN(300)
)
(PARTITION p0 VALUES LESS THAN(2020),
PARTITION p1 VALUES LESS THAN(2021),
PARTITION p2 VALUES LESS THAN(2022)
);
CREATE TABLE nt(c1 INT,c2 INT);
alter table pt exchange partition p0 with table nt WITHOUT VALIDATION;
ERROR HY000: Subpartitioned table, use subpartition instead of partition
drop table pt;
drop table nt;
CREATE TABLE pt (c1 BIGINT PRIMARY KEY,c2 VARCHAR(50))
PARTITION BY LIST(c1) 
(PARTITION p0 VALUES IN (1, 2, 3),
PARTITION p1 VALUES IN (5, 6),
PARTITION p2 VALUES IN (DEFAULT)
);
CREATE TABLE nt (c1 BIGINT PRIMARY KEY,c2 VARCHAR(50));
alter table pt exchange partition p0 with table nt WITHOUT VALIDATION;
ERROR 0A000: Exchange partition except range/range columns not supported
drop table pt;
drop table nt;
CREATE TABLE pt(c1 INT,c2 INT) 
PARTITION BY LIST COLUMNS(c1)
SUBPARTITION BY LIST COLUMNS(c2)
SUBPARTITION TEMPLATE 
(SUBPARTITION mp0 VALUES IN(2),
SUBPARTITION mp1 VALUES IN(5),
SUBPARTITION mp2 VALUES IN(8)
)
(PARTITION p0 VALUES IN(1,3),
PARTITION p1 VALUES IN(4,6),
PARTITION p2 VALUES IN(7,9)
);
CREATE TABLE nt(c1 INT,c2 INT);
alter table pt exchange partition p0smp0 with table nt WITHOUT VALIDATION;
ERROR 0A000: Exchange partition except range/range columns not supported
drop table pt;
drop table nt;
create table pt (c1 int not null auto_increment primary key, c2 int) partition by range(c1)(partition M1  VALUES LESS THAN (5), partition M2 VALUES LESS THAN (10), partition M3 VALUES LESS THAN (1000));
create table nt (c1 int not null auto_increment primary key, c2 int);
alter table pt exchange partition M1 with table nt WITHOUT VALIDATION;
ERROR 0A000: exchanging partition tables have autoincrement column not supported
drop table pt;
drop table nt;
create table pt (c1 int unique, c2 int) partition by range(c1) (partition M1  VALUES LESS THAN (5), partition M2 VALUES LESS THAN (10), partition M3 VALUES LESS THAN (1000));
create table nt (c1 int unique, c2 int);
insert into pt(c1, c2) values(1,1);
insert into pt(c1, c2) values(2,2);
insert into pt(c1, c2) values(3,3);
insert into pt(c1, c2) values(4,4);
insert into pt(c1, c2) values(5,5);
insert into pt(c1, c2) values(6,6);
insert into pt(c1, c2) values(7,7);
insert into pt(c1, c2) values(8,8);
insert into pt(c1, c2) values(9,9);
insert into pt(c1, c2) values(10,10);
insert into pt(c1, c2) values(11,11);
insert into pt(c1, c2) values(12,12);
insert into pt(c1, c2) values(13,13);
insert into pt(c1, c2) values(14,14);
insert into pt(c1, c2) values(15,15);
insert into nt(c1, c2) values(1,1);
insert into nt(c1, c2) values(2,2);
insert into nt(c1, c2) values(3,3);
insert into nt(c1, c2) values(4,4);
insert into nt(c1, c2) values(5,5);
select * from pt order by c1;
c1	c2
1	1
2	2
3	3
4	4
5	5
6	6
7	7
8	8
9	9
10	10
11	11
12	12
13	13
14	14
15	15
select * from nt order by c1;
c1	c2
1	1
2	2
3	3
4	4
5	5
alter table pt exchange partition M2 with table nt WITHOUT VALIDATION;
select * from pt order by c1;
c1	c2
1	1
1	1
2	2
2	2
3	3
3	3
4	4
4	4
5	5
10	10
11	11
12	12
13	13
14	14
15	15
select * from nt order by c1;
c1	c2
5	5
6	6
7	7
8	8
9	9
drop table pt;
drop table nt;
drop table if exists pt;
drop table if exists nt;
create table pt (c1 int, c2 int, c3 blob) partition by range(c1) (partition M1  VALUES LESS THAN (5), partition M2 VALUES LESS THAN (10), partition M3 VALUES LESS THAN (20));
insert into pt(c1, c2) values(1,1);
insert into pt(c1, c2) values(2,2);
insert into pt(c1, c2) values(3,3);
insert into pt(c1, c2) values(4,4);
insert into pt(c1, c2) values(5,5);
insert into pt(c1, c2) values(6,6);
insert into pt(c1, c2) values(7,7);
insert into pt(c1, c2) values(8,8);
insert into pt(c1, c2) values(9,9);
insert into pt(c1, c2) values(10,10);
insert into pt(c1, c2) values(11,11);
insert into pt(c1, c2) values(12,12);
insert into pt(c1, c2) values(13,13);
insert into pt(c1, c2) values(14,14);
insert into pt(c1, c2) values(15,15);
create index local_idx on pt(c1, c2);
create index pt_global_idx on pt(c2) global;
select * from pt order by c1;
c1	c2	c3
1	1	NULL
2	2	NULL
3	3	NULL
4	4	NULL
5	5	NULL
6	6	NULL
7	7	NULL
8	8	NULL
9	9	NULL
10	10	NULL
11	11	NULL
12	12	NULL
13	13	NULL
14	14	NULL
15	15	NULL
create table nt (c1 int, c2 int, c3 blob);
insert into nt(c1, c2) values(21,21);
insert into nt(c1, c2) values(22,22);
insert into nt(c1, c2) values(23,23);
insert into nt(c1, c2) values(24,24);
insert into nt(c1, c2) values(25,25);
insert into nt(c1, c2) values(26,26);
insert into nt(c1, c2) values(27,27);
insert into nt(c1, c2) values(28,28);
insert into nt(c1, c2) values(29,29);
insert into nt(c1, c2) values(30,30);
insert into nt(c1, c2) values(31,31);
insert into nt(c1, c2) values(32,32);
insert into nt(c1, c2) values(33,33);
insert into nt(c1, c2) values(34,34);
insert into nt(c1, c2) values(35,35);
create index local_idx on nt(c1, c2);
select * from nt;
c1	c2	c3
21	21	NULL
22	22	NULL
23	23	NULL
24	24	NULL
25	25	NULL
26	26	NULL
27	27	NULL
28	28	NULL
29	29	NULL
30	30	NULL
31	31	NULL
32	32	NULL
33	33	NULL
34	34	NULL
35	35	NULL
ALTER TABLE pt ADD PARTITION (PARTITION M4 VALUES LESS THAN(40));
select * from pt order by c1;
c1	c2	c3
1	1	NULL
2	2	NULL
3	3	NULL
4	4	NULL
5	5	NULL
6	6	NULL
7	7	NULL
8	8	NULL
9	9	NULL
10	10	NULL
11	11	NULL
12	12	NULL
13	13	NULL
14	14	NULL
15	15	NULL
select * from nt order by c1;
c1	c2	c3
21	21	NULL
22	22	NULL
23	23	NULL
24	24	NULL
25	25	NULL
26	26	NULL
27	27	NULL
28	28	NULL
29	29	NULL
30	30	NULL
31	31	NULL
32	32	NULL
33	33	NULL
34	34	NULL
35	35	NULL
alter table pt exchange partition M4 with table nt WITHOUT VALIDATION;
select * from pt order by c1;
c1	c2	c3
1	1	NULL
2	2	NULL
3	3	NULL
4	4	NULL
5	5	NULL
6	6	NULL
7	7	NULL
8	8	NULL
9	9	NULL
10	10	NULL
11	11	NULL
12	12	NULL
13	13	NULL
14	14	NULL
15	15	NULL
21	21	NULL
22	22	NULL
23	23	NULL
24	24	NULL
25	25	NULL
26	26	NULL
27	27	NULL
28	28	NULL
29	29	NULL
30	30	NULL
31	31	NULL
32	32	NULL
33	33	NULL
34	34	NULL
35	35	NULL
select * from nt order by c1;
c1	c2	c3
insert into pt(c1, c2) values(36,36);
insert into pt(c1, c2) values(37,37);
insert into pt(c1, c2) values(38,38);
insert into pt(c1, c2) values(39,39);
select * from pt order by c1;
c1	c2	c3
1	1	NULL
2	2	NULL
3	3	NULL
4	4	NULL
5	5	NULL
6	6	NULL
7	7	NULL
8	8	NULL
9	9	NULL
10	10	NULL
11	11	NULL
12	12	NULL
13	13	NULL
14	14	NULL
15	15	NULL
21	21	NULL
22	22	NULL
23	23	NULL
24	24	NULL
25	25	NULL
26	26	NULL
27	27	NULL
28	28	NULL
29	29	NULL
30	30	NULL
31	31	NULL
32	32	NULL
33	33	NULL
34	34	NULL
35	35	NULL
36	36	NULL
37	37	NULL
38	38	NULL
39	39	NULL
insert into nt(c1, c2) values(1,1);
insert into nt(c1, c2) values(2,2);
insert into nt(c1, c2) values(3,3);
insert into nt(c1, c2) values(4,4);
insert into nt(c1, c2) values(5,5);
insert into nt(c1, c2) values(6,6);
insert into nt(c1, c2) values(7,7);
insert into nt(c1, c2) values(8,8);
insert into nt(c1, c2) values(9,9);
insert into nt(c1, c2) values(10,10);
select * from nt order by c1;
c1	c2	c3
1	1	NULL
2	2	NULL
3	3	NULL
4	4	NULL
5	5	NULL
6	6	NULL
7	7	NULL
8	8	NULL
9	9	NULL
10	10	NULL
update pt set c2 = -10 where c1 = 10;
update pt set c2 = -11 where c1 = 11;
update pt set c2 = -12 where c1 = 12;
select * from pt order by c1;
c1	c2	c3
1	1	NULL
2	2	NULL
3	3	NULL
4	4	NULL
5	5	NULL
6	6	NULL
7	7	NULL
8	8	NULL
9	9	NULL
10	-10	NULL
11	-11	NULL
12	-12	NULL
13	13	NULL
14	14	NULL
15	15	NULL
21	21	NULL
22	22	NULL
23	23	NULL
24	24	NULL
25	25	NULL
26	26	NULL
27	27	NULL
28	28	NULL
29	29	NULL
30	30	NULL
31	31	NULL
32	32	NULL
33	33	NULL
34	34	NULL
35	35	NULL
36	36	NULL
37	37	NULL
38	38	NULL
39	39	NULL
update nt set c2 = -1 where c1 = 1;
update nt set c2 = -2 where c1 = 2;
update nt set c2 = -3 where c1 = 3;
select * from nt order by c1;
c1	c2	c3
1	-1	NULL
2	-2	NULL
3	-3	NULL
4	4	NULL
5	5	NULL
6	6	NULL
7	7	NULL
8	8	NULL
9	9	NULL
10	10	NULL
delete from pt where c1 > 10;
select * from pt order by c1;
c1	c2	c3
1	1	NULL
2	2	NULL
3	3	NULL
4	4	NULL
5	5	NULL
6	6	NULL
7	7	NULL
8	8	NULL
9	9	NULL
10	-10	NULL
delete from nt where c1 > 5;
select * from nt order by c1;
c1	c2	c3
1	-1	NULL
2	-2	NULL
3	-3	NULL
4	4	NULL
5	5	NULL
alter table pt exchange partition M1 with table nt WITHOUT VALIDATION;
select * from pt order by c1;
c1	c2	c3
1	-1	NULL
2	-2	NULL
3	-3	NULL
4	4	NULL
5	5	NULL
5	5	NULL
6	6	NULL
7	7	NULL
8	8	NULL
9	9	NULL
10	-10	NULL
select * from nt order by c1;
c1	c2	c3
1	1	NULL
2	2	NULL
3	3	NULL
4	4	NULL
drop table if exists pt;
drop table if exists nt;
drop table if exists pt;
drop table if exists nt;
CREATE TABLE pt(c1 INT,c2 INT)
PARTITION BY RANGE(c1)
SUBPARTITION BY RANGE(c2)
(PARTITION p0 VALUES LESS THAN(100)
(SUBPARTITION sp0 VALUES LESS THAN(2020),
SUBPARTITION sp1 VALUES LESS THAN(2120)
),
PARTITION p1 VALUES LESS THAN(200)
(SUBPARTITION sp2 VALUES LESS THAN(2320),
SUBPARTITION sp3 VALUES LESS THAN(2420),
SUBPARTITION sp4 VALUES LESS THAN(2520)
)
);
insert into pt(c1, c2) values(1,2011);
insert into pt(c1, c2) values(2,2012);
insert into pt(c1, c2) values(3,2013);
insert into pt(c1, c2) values(4,2014);
insert into pt(c1, c2) values(5,2015);
insert into pt(c1, c2) values(6,2016);
insert into pt(c1, c2) values(7,2017);
insert into pt(c1, c2) values(8,2018);
insert into pt(c1, c2) values(9,2019);
insert into pt(c1, c2) values(10,2020);
insert into pt(c1, c2) values(11,2021);
insert into pt(c1, c2) values(12,2022);
insert into pt(c1, c2) values(13,2023);
insert into pt(c1, c2) values(14,2024);
insert into pt(c1, c2) values(15,2025);
create index local_idx on pt(c1, c2);
create index pt_global_idx on pt(c2) global;
select * from pt order by c1;
c1	c2
1	2011
2	2012
3	2013
4	2014
5	2015
6	2016
7	2017
8	2018
9	2019
10	2020
11	2021
12	2022
13	2023
14	2024
15	2025
CREATE TABLE nt(c1 INT,c2 INT);
insert into nt(c1, c2) values(121,2421);
insert into nt(c1, c2) values(122,2422);
insert into nt(c1, c2) values(123,2423);
insert into nt(c1, c2) values(124,2424);
insert into nt(c1, c2) values(125,2425);
insert into nt(c1, c2) values(126,2426);
insert into nt(c1, c2) values(127,2427);
insert into nt(c1, c2) values(128,2428);
create index local_idx on nt(c1, c2);
select * from nt order by c1;
c1	c2
121	2421
122	2422
123	2423
124	2424
125	2425
126	2426
127	2427
128	2428
alter table pt exchange partition sp4 with table nt WITHOUT VALIDATION;
select * from pt order by c1;
c1	c2
1	2011
2	2012
3	2013
4	2014
5	2015
6	2016
7	2017
8	2018
9	2019
10	2020
11	2021
12	2022
13	2023
14	2024
15	2025
121	2421
122	2422
123	2423
124	2424
125	2425
126	2426
127	2427
128	2428
select * from nt order by c1;
c1	c2
drop table if exists pt;
drop table if exists nt;
drop database if exists database2;
create database database2;
use database2;
alter database database2 CHARACTER SET UTF8;
alter database database2 collate utf8mb4_general_ci;
alter database database2 CHARACTER SET UTF8 collate utf8mb4_general_ci;
create table nt (c1 int not null auto_increment primary key, c2 int);
use database1;
create table pt (c1 int not null auto_increment primary key, c2 int) partition by range(c1)(partition M1  VALUES LESS THAN (5), partition M2 VALUES LESS THAN (10), partition M3 VALUES LESS THAN (1000));
alter table pt exchange partition M1 with table database2.nt WITHOUT VALIDATION;
ERROR 0A000: exchanging partition tables have autoincrement column not supported
drop table pt;
drop table if exists pt;
drop table if exists nt;
CREATE TABLE pt (c1 int,update_time int NOT NULL DEFAULT 1 ) partition by range(c1) (partition M1  VALUES LESS THAN (5), partition M2 VALUES LESS THAN (10), partition M3 VALUES LESS THAN (1000));
CREATE TABLE nt(c1 int, update_time int NOT NULL DEFAULT 1 );
INSERT INTO nt (c1) VALUES (1);
INSERT INTO pt (c1) VALUES (1);
INSERT INTO nt (c1) VALUES (2);
INSERT INTO pt (c1) VALUES (2);
INSERT INTO nt (c1) VALUES (3);
INSERT INTO pt (c1) VALUES (3);
INSERT INTO nt (c1) VALUES (4);
INSERT INTO pt (c1) VALUES (4);
INSERT INTO nt (c1) VALUES (5);
INSERT INTO pt (c1) VALUES (5);
select * from pt order by c1;
c1	update_time
1	1
2	1
3	1
4	1
5	1
select * from nt order by c1;
c1	update_time
1	1
2	1
3	1
4	1
5	1
alter table pt exchange partition M1 with table nt WITHOUT VALIDATION;
CREATE PROCEDURE pro()
BEGIN
INSERT INTO nt (c1) VALUES (100);
INSERT INTO pt (c1) VALUES (100);
END ;
/
call pro();
select * from nt order by c1;
c1	update_time
1	1
2	1
3	1
4	1
100	1
select * from pt order by c1;
c1	update_time
1	1
2	1
3	1
4	1
5	1
5	1
100	1
drop table pt;
drop table nt;
drop table if exists pt;
drop table if exists nt;
create table pt(
pid  int primary key,
pname varchar(30)
) partition by range(pid)(
partition M1 values less than(1000) ,
partition M2 values less than(2000) ,
partition M3 values less than(maxvalue)
);
insert into pt (pid, pname) values (1, '瑶瑶');
insert into pt (pid, pname) values (1500, '倩倩');
insert into pt (pid, pname) values (1400, '倩倩');
insert into pt (pid, pname) values (3000, '小花');
create table nt(
pid  int primary key,
pname varchar(30)
);
insert into nt (pid, pname) values (100, '张三');
insert into nt (pid, pname) values (101, '李四');
insert into nt (pid, pname) values (102, '王五');
select * from pt order by pid;
pid	pname
1	瑶瑶
1400	倩倩
1500	倩倩
3000	小花
select * from nt order by pid;
pid	pname
100	张三
101	李四
102	王五
alter table pt exchange partition M2 with table nt WITHOUT VALIDATION;
select * from pt order by pid;
pid	pname
1	瑶瑶
100	张三
101	李四
102	王五
3000	小花
select * from nt order by pid;
pid	pname
1400	倩倩
1500	倩倩
drop table if exists t2;
drop function  IF EXISTS n_1;
create table t2(id int ,s1 int, s2 int);
create function n_1() returns int deterministic
begin
insert into t2 values(1,0,1);
return 1500;
end/
select n_1() from pt partition (M2) where pid <n_1();
n_1()
1500
1500
1500
drop table if exists test;
drop table if exists pt;
CREATE TABLE test (user_id INT, user_num DECIMAL(10,2));
create table pt (user_id INT, user_num DECIMAL(10,2)) partition by range(user_id)(partition M1  VALUES LESS THAN (5), partition M2 VALUES LESS THAN (10), partition M3 VALUES LESS THAN (1000));
CREATE TRIGGER test_trg BEFORE UPDATE ON test
FOR EACH ROW
BEGIN
IF NEW.user_num < 1 THEN
SET NEW.user_num  = 1;
ELSEIF NEW.user_num > 45 THEN
SET NEW.user_num= 45;
END IF;
END; 
/
alter table pt exchange partition M1 with table test WITHOUT VALIDATION;
drop table test;
drop table if exists t1;
drop table if exists t2;
drop table if exists nt;
drop table if exists pt;
CREATE TABLE t1 (id INT,  name VARCHAR(20));
INSERT INTO t1 VALUES (1, 'name1');
CREATE TABLE t2 (id INT, age INT);
INSERT INTO t2 VALUES (1, 23);
CREATE VIEW nt AS SELECT name, age FROM t1, t2 WHERE t1.id = t2.id;
create table pt (name VARCHAR(20), age INT) partition by range(age)(partition M1  VALUES LESS THAN (5), partition M2 VALUES LESS THAN (10), partition M3 VALUES LESS THAN (1000));
alter table pt exchange partition M1 with table nt WITHOUT VALIDATION;
ERROR 0A000: alter table type not supported
drop table t1;
drop table t2;
drop view nt;
drop table pt;
create table pt (c1 int, c2 int, primary key(c1)) partition by range(c1)(partition M1  VALUES LESS THAN (5), partition M2 VALUES LESS THAN (10), partition M3 VALUES LESS THAN (1000));
create table nt (c1 int, c2 int, primary key(c1, c2));
alter table pt exchange partition M1 with table nt WITHOUT VALIDATION;
ERROR HY000: Tables have different definitions
drop table pt;
drop table nt;
create table pt (c1 int, c2 int) partition by range(c1)(partition M1  VALUES LESS THAN (5), partition M2 VALUES LESS THAN (10), partition M3 VALUES LESS THAN (1000));
create table nt (c1 int, c2 int);
create index idx on nt(c2);
alter table pt exchange partition M1 with table nt WITHOUT VALIDATION;
ERROR HY000: Tables have different definitions
drop table pt;
drop table nt;
create table pt (c1 int auto_increment, c2 int) partition by range(c1)(partition M1  VALUES LESS THAN (5), partition M2 VALUES LESS THAN (10), partition M3 VALUES LESS THAN (1000));
create table nt (c1 int, c2 int);
alter table pt exchange partition M1 with table nt WITHOUT VALIDATION;
ERROR 0A000: exchanging partition tables have autoincrement column not supported
drop table pt;
drop table nt;
drop table if exists pt_auto_test1;
Warnings:
Note	1051	Unknown table 'database1.pt_auto_test1'
CREATE TABLE pt_auto_test1 (c1 INT PRIMARY KEY auto_increment, c2 int) PARTITION BY RANGE(c1) (
PARTITION p1 VALUES LESS THAN (10),
PARTITION p2 VALUES LESS THAN (20),
PARTITION p3 VALUES LESS THAN (30));
drop table if exists nt_auto_test1;
Warnings:
Note	1051	Unknown table 'database1.nt_auto_test1'
CREATE TABLE nt_auto_test1 (c1 INT primary KEY auto_increment, c2 int);
ALTER TABLE pt_auto_test1 EXCHANGE PARTITION p2 WITH TABLE nt_auto_test1 WITHOUT VALIDATION;
ERROR 0A000: exchanging partition tables have autoincrement column not supported
create table pt (c1 int, c2 int) partition by range(c1)(partition M1  VALUES LESS THAN (5), partition M2 VALUES LESS THAN (10), partition M3 VALUES LESS THAN (1000));
create table nt (c1 int, c2 int);
ALTER TABLE nt set READ ONLY;
alter table pt exchange partition M1 with table nt WITHOUT VALIDATION;
ERROR HY000: Tables have different definitions
drop table pt;
drop table nt;
drop table if exists pt_compressed;
Warnings:
Note	1051	Unknown table 'database1.pt_compressed'
CREATE TABLE pt_compressed(c1 int primary key, c2 varchar(30))row_format=compressed PARTITION BY RANGE (c1)(
PARTITION c1_15 VALUES LESS THAN (15),
PARTITION c1_35 VALUES LESS THAN (35),
PARTITION c1_50 VALUES LESS THAN (50));
insert into pt_compressed(c1) values(20),(29),(35),(40),(15),(18);
drop table if exists nt_compressed;
Warnings:
Note	1051	Unknown table 'database1.nt_compressed'
CREATE TABLE nt_compressed(
c1 int primary key,
c2 varchar(30))row_format=compressed;
insert into nt_compressed values(200,'AA'),(90,null),(32,'SE'),(15,'GG');
select * from pt_compressed;
c1	c2
15	NULL
18	NULL
20	NULL
29	NULL
35	NULL
40	NULL
select * from nt_compressed;
c1	c2
15	GG
32	SE
90	NULL
200	AA
ALTER TABLE pt_compressed EXCHANGE PARTITION c1_35 WITH TABLE nt_compressed WITHOUT VALIDATION;
select * from pt_compressed;
c1	c2
15	GG
32	SE
90	NULL
200	AA
35	NULL
40	NULL
select * from pt_compressed partition(c1_35);
c1	c2
15	GG
32	SE
90	NULL
200	AA
select * from nt_compressed;
c1	c2
15	NULL
18	NULL
20	NULL
29	NULL
drop table if exists pt_redundant;
Warnings:
Note	1051	Unknown table 'database1.pt_redundant'
CREATE TABLE pt_redundant(c1 int primary key, c2 varchar(30))row_format=redundant PARTITION BY RANGE (c1) (
PARTITION c1_15 VALUES LESS THAN (15),
PARTITION c1_35 VALUES LESS THAN (35),
PARTITION c1_50 VALUES LESS THAN (50));
insert into pt_redundant(c1) values(20),(29),(35),(40),(15),(18);
drop table if exists nt_redundant;
Warnings:
Note	1051	Unknown table 'database1.nt_redundant'
CREATE TABLE nt_redundant(c1 int primary key, c2 varchar(30))row_format=redundant;
insert into nt_redundant values(200,'AA'),(90,null),(32,'SE'),(15,'GG');
select * from pt_redundant;
c1	c2
15	NULL
18	NULL
20	NULL
29	NULL
35	NULL
40	NULL
select * from nt_redundant;
c1	c2
15	GG
32	SE
90	NULL
200	AA
ALTER TABLE pt_redundant EXCHANGE PARTITION c1_35 WITH TABLE nt_redundant WITHOUT VALIDATION;
select * from pt_redundant;
c1	c2
15	GG
32	SE
90	NULL
200	AA
35	NULL
40	NULL
select * from pt_redundant partition(c1_35);
c1	c2
15	GG
32	SE
90	NULL
200	AA
select * from nt_redundant;
c1	c2
15	NULL
18	NULL
20	NULL
29	NULL
ALTER TABLE nt_redundant EXCHANGE PARTITION c1_35 WITH TABLE nt_redundant WITHOUT VALIDATION;
ERROR HY000: Partition management on a not partitioned table is not possible
ALTER TABLE pt_redundant EXCHANGE PARTITION c1_35 WITH TABLE pt_redundant WITHOUT VALIDATION;
ERROR 42000: Not unique table/alias: 'pt_redundant'
ALTER TABLE nt_redundant EXCHANGE PARTITION c1_35 WITH TABLE pt_redundant WITHOUT VALIDATION;
ERROR HY000: Partition management on a not partitioned table is not possible
ALTER TABLE pt_compressed EXCHANGE PARTITION c1_35 WITH TABLE pt_redundant WITHOUT VALIDATION;
ERROR 0A000: Exchange partition except composite-partitioned and partitioned table is not supported
ALTER TABLE nt_compressed EXCHANGE PARTITION c1_35 WITH TABLE nt_redundant WITHOUT VALIDATION;
ERROR HY000: Partition management on a not partitioned table is not possible
ALTER TABLE pt_compressed EXCHANGE PARTITION c1_35 WITH TABLE nt_redundant WITHOUT VALIDATION;
ERROR HY000: Non matching attribute 'ROW_FORMAT' between partition and table
drop table if exists pt_compact;
Warnings:
Note	1051	Unknown table 'database1.pt_compact'
CREATE TABLE pt_compact(c1 int primary key, c2 varchar(30))row_format=compact PARTITION BY RANGE (c1) (
PARTITION c1_15 VALUES LESS THAN (15),
PARTITION c1_35 VALUES LESS THAN (35),
PARTITION c1_50 VALUES LESS THAN (50));
insert into pt_compact(c1) values(14),(15),(16),(34),(35),(36),(49);
drop table if exists nt_compact;
Warnings:
Note	1051	Unknown table 'database1.nt_compact'
CREATE TABLE nt_compact(c1 int primary key, c2 varchar(30))row_format=compact;
insert into nt_compact values(0,'AA'),(-20,null),(33333333,'SE'),(15,'GG');
select * from pt_compact;
c1	c2
14	NULL
15	NULL
16	NULL
34	NULL
35	NULL
36	NULL
49	NULL
select * from nt_compact;
c1	c2
-20	NULL
0	AA
15	GG
33333333	SE
ALTER TABLE pt_compact EXCHANGE PARTITION c1_35 WITH TABLE nt_compact WITHOUT VALIDATION;
select * from pt_compact;
c1	c2
14	NULL
-20	NULL
0	AA
15	GG
33333333	SE
35	NULL
36	NULL
49	NULL
select * from pt_compact partition(c1_35);
c1	c2
-20	NULL
0	AA
15	GG
33333333	SE
select * from nt_compact;
c1	c2
15	NULL
16	NULL
34	NULL
drop table if exists pt_dynamic;
Warnings:
Note	1051	Unknown table 'database1.pt_dynamic'
CREATE TABLE pt_dynamic(c1 int primary key,c2 varchar(30))row_format=dynamic PARTITION BY RANGE (c1)(
PARTITION c1_15 VALUES LESS THAN (15),
PARTITION c1_35 VALUES LESS THAN (35),
PARTITION c1_50 VALUES LESS THAN (50));
insert into pt_dynamic(c1) values(10),(20),(30),(23),(40),(33);
drop table if exists nt_dynamic;
Warnings:
Note	1051	Unknown table 'database1.nt_dynamic'
CREATE TABLE nt_dynamic(c1 int primary key,c2 varchar(30))row_format=dynamic;
insert into nt_dynamic values(-50,'AA'),(80,null),(1,'null'),(15,'GG');
select * from pt_dynamic;
c1	c2
10	NULL
20	NULL
23	NULL
30	NULL
33	NULL
40	NULL
select * from nt_dynamic;
c1	c2
-50	AA
1	null
15	GG
80	NULL
ALTER TABLE pt_dynamic EXCHANGE PARTITION c1_35 WITH TABLE nt_dynamic WITHOUT VALIDATION;
select * from pt_dynamic;
c1	c2
10	NULL
-50	AA
1	null
15	GG
80	NULL
40	NULL
select * from pt_dynamic partition(c1_35);
c1	c2
-50	AA
1	null
15	GG
80	NULL
select * from nt_dynamic;
c1	c2
20	NULL
23	NULL
30	NULL
33	NULL
drop table if exists pt_default;
Warnings:
Note	1051	Unknown table 'database1.pt_default'
CREATE TABLE pt_default(c1 int primary key,c2 varchar(30))row_format=default PARTITION BY RANGE (c1)(
PARTITION c1_15 VALUES LESS THAN (15),
PARTITION c1_35 VALUES LESS THAN (35),
PARTITION c1_50 VALUES LESS THAN (50));
insert into pt_default(c1) values(20),(29),(35),(40),(15),(18);
drop table if exists nt_default;
Warnings:
Note	1051	Unknown table 'database1.nt_default'
CREATE TABLE nt_default(
c1 int primary key,
c2 varchar(30)
)row_format=default;
insert into nt_default values(200,'AA'),(90,null),(32,'SE'),(15,'GG');
select * from pt_default;
c1	c2
15	NULL
18	NULL
20	NULL
29	NULL
35	NULL
40	NULL
select * from nt_default;
c1	c2
15	GG
32	SE
90	NULL
200	AA
ALTER TABLE pt_default EXCHANGE PARTITION c1_35 WITH TABLE nt_default WITHOUT VALIDATION;
select * from pt_default;
c1	c2
15	GG
32	SE
90	NULL
200	AA
35	NULL
40	NULL
select * from pt_default partition(c1_35);
c1	c2
15	GG
32	SE
90	NULL
200	AA
select * from nt_default;
c1	c2
15	NULL
18	NULL
20	NULL
29	NULL
select * from pt_dynamic partition(c1_35);
c1	c2
-50	AA
1	null
15	GG
80	NULL
select * from nt_default;
c1	c2
15	NULL
18	NULL
20	NULL
29	NULL
ALTER TABLE pt_dynamic EXCHANGE PARTITION c1_35 WITH TABLE nt_default WITHOUT VALIDATION;
select * from pt_dynamic partition(c1_35);
c1	c2
15	NULL
18	NULL
20	NULL
29	NULL
select * from nt_default;
c1	c2
-50	AA
1	null
15	GG
80	NULL
drop table if exists pt_compressed_lz4;
Warnings:
Note	1051	Unknown table 'database1.pt_compressed_lz4'
CREATE TABLE pt_compressed_lz4(c1 int primary key,c2 varchar(30)) ROW_FORMAT=COMPRESSED COMPRESSION='lz4_1.0' PARTITION BY RANGE (c1) (
PARTITION c1_15 VALUES LESS THAN (15),
PARTITION c1_35 VALUES LESS THAN (35),
PARTITION c1_50 VALUES LESS THAN (50));
insert into pt_compressed_lz4(c1) values(20),(29),(35),(40),(15),(18);
drop table if exists nt_compressed_lz4;
Warnings:
Note	1051	Unknown table 'database1.nt_compressed_lz4'
CREATE TABLE nt_compressed_lz4(c1 int primary key, c2 varchar(30))row_format=compressed COMPRESSION='lz4_1.0';
insert into nt_compressed_lz4 values(200,'AA'),(90,null),(32,'SE'),(15,'GG');
select * from pt_compressed_lz4;
c1	c2
15	NULL
18	NULL
20	NULL
29	NULL
35	NULL
40	NULL
select * from nt_compressed_lz4;
c1	c2
15	GG
32	SE
90	NULL
200	AA
ALTER TABLE pt_compressed_lz4 EXCHANGE PARTITION c1_35 WITH TABLE nt_compressed_lz4 WITHOUT VALIDATION;
select * from pt_compressed_lz4;
c1	c2
15	GG
32	SE
90	NULL
200	AA
35	NULL
40	NULL
select * from pt_compressed_lz4 partition(c1_35);
c1	c2
15	GG
32	SE
90	NULL
200	AA
select * from nt_compressed_lz4;
c1	c2
15	NULL
18	NULL
20	NULL
29	NULL
drop table if exists pt_redundant_snappy_1;
Warnings:
Note	1051	Unknown table 'database1.pt_redundant_snappy_1'
CREATE TABLE pt_redundant_snappy_1(c1 int primary key,c2 varchar(30))row_format=redundant compression='snappy_1.0' PARTITION BY RANGE (c1) (PARTITION c1_15 VALUES LESS THAN (15),
PARTITION c1_35 VALUES LESS THAN (35),
PARTITION c1_50 VALUES LESS THAN (50));
insert into pt_redundant_snappy_1(c1) values(20),(29),(35),(40),(15),(18);
drop table if exists nt_redundant_snappy_1;
Warnings:
Note	1051	Unknown table 'database1.nt_redundant_snappy_1'
CREATE TABLE nt_redundant_snappy_1(
c1 int primary key,
c2 varchar(30)
)row_format=redundant compression='snappy_1.0';
insert into nt_redundant_snappy_1 values(200,'AA'),(90,null),(32,'SE'),(15,'GG');
select * from pt_redundant_snappy_1;
c1	c2
15	NULL
18	NULL
20	NULL
29	NULL
35	NULL
40	NULL
select * from nt_redundant_snappy_1;
c1	c2
15	GG
32	SE
90	NULL
200	AA
ALTER TABLE pt_redundant_snappy_1 EXCHANGE PARTITION c1_35 WITH TABLE nt_redundant_snappy_1 WITHOUT VALIDATION;
select * from pt_redundant_snappy_1;
c1	c2
15	GG
32	SE
90	NULL
200	AA
35	NULL
40	NULL
select * from pt_redundant_snappy_1 partition(c1_35);
c1	c2
15	GG
32	SE
90	NULL
200	AA
select * from nt_redundant_snappy_1;
c1	c2
15	NULL
18	NULL
20	NULL
29	NULL
ALTER TABLE nt_redundant_snappy_1 EXCHANGE PARTITION c1_35 WITH TABLE nt_redundant_snappy_1 WITHOUT VALIDATION;
ERROR HY000: Partition management on a not partitioned table is not possible
ALTER TABLE pt_redundant_snappy_1 EXCHANGE PARTITION c1_35 WITH TABLE pt_redundant_snappy_1 WITHOUT VALIDATION;
ERROR 42000: Not unique table/alias: 'pt_redundant_snappy_1'
ALTER TABLE nt_redundant_snappy_1 EXCHANGE PARTITION c1_35 WITH TABLE pt_redundant_snappy_1 WITHOUT VALIDATION;
ERROR HY000: Partition management on a not partitioned table is not possible
ALTER TABLE pt_compressed_lz4 EXCHANGE PARTITION c1_35 WITH TABLE pt_redundant_snappy_1 WITHOUT VALIDATION;
ERROR 0A000: Exchange partition except composite-partitioned and partitioned table is not supported
ALTER TABLE nt_compressed_lz4 EXCHANGE PARTITION c1_35 WITH TABLE nt_redundant_snappy_1 WITHOUT VALIDATION;
ERROR HY000: Partition management on a not partitioned table is not possible
ALTER TABLE pt_compressed_lz4 EXCHANGE PARTITION c1_35 WITH TABLE nt_redundant_snappy_1 WITHOUT VALIDATION;
ERROR HY000: Non matching attribute 'ROW_FORMAT' between partition and table
drop table if exists pt_compact_zlib;
Warnings:
Note	1051	Unknown table 'database1.pt_compact_zlib'
CREATE TABLE pt_compact_zlib(c1 int primary key, c2 varchar(30))row_format=compact compression='zlib_1.0' PARTITION BY RANGE (c1) (
PARTITION c1_15 VALUES LESS THAN (15),
PARTITION c1_35 VALUES LESS THAN (35),
PARTITION c1_50 VALUES LESS THAN (50));
ERROR 0A000: zlib compressor not supported
drop table if exists pt_dynamic_zstd_1;
Warnings:
Note	1051	Unknown table 'database1.pt_dynamic_zstd_1'
CREATE TABLE pt_dynamic_zstd_1(c1 int primary key, c2 varchar(30))row_format=dynamic compression='zstd_1.0' PARTITION BY RANGE (c1) (PARTITION c1_15 VALUES LESS THAN (15),
PARTITION c1_35 VALUES LESS THAN (35),
PARTITION c1_50 VALUES LESS THAN (50));
insert into pt_dynamic_zstd_1(c1) values(10),(20),(30),(23),(40),(33);
drop table if exists nt_dynamic_zstd_1;
Warnings:
Note	1051	Unknown table 'database1.nt_dynamic_zstd_1'
CREATE TABLE nt_dynamic_zstd_1(c1 int primary key, c2 varchar(30))row_format=dynamic compression='zstd_1.0';
insert into nt_dynamic_zstd_1 values(-50,'AA'),(80,null),(1,'null'),(15,'GG');
select * from pt_dynamic_zstd_1;
c1	c2
10	NULL
20	NULL
23	NULL
30	NULL
33	NULL
40	NULL
select * from nt_dynamic_zstd_1;
c1	c2
-50	AA
1	null
15	GG
80	NULL
ALTER TABLE pt_dynamic EXCHANGE PARTITION c1_35 WITH TABLE nt_dynamic WITHOUT VALIDATION;
select * from pt_dynamic_zstd_1;
c1	c2
10	NULL
20	NULL
23	NULL
30	NULL
33	NULL
40	NULL
select * from pt_dynamic_zstd_1 partition(c1_35);
c1	c2
20	NULL
23	NULL
30	NULL
33	NULL
select * from nt_dynamic_zstd_1;
c1	c2
-50	AA
1	null
15	GG
80	NULL
drop table if exists pt_default_zstd;
Warnings:
Note	1051	Unknown table 'database1.pt_default_zstd'
CREATE TABLE pt_default_zstd(c1 int primary key, c2 varchar(30))row_format=default compression='zstd_1.3.8' PARTITION BY RANGE (c1) (PARTITION c1_15 VALUES LESS THAN (15),
PARTITION c1_35 VALUES LESS THAN (35),
PARTITION c1_50 VALUES LESS THAN (50));
insert into pt_default_zstd(c1) values(20),(29),(35),(40),(15),(18);
drop table if exists nt_default_zstd;
Warnings:
Note	1051	Unknown table 'database1.nt_default_zstd'
CREATE TABLE nt_default_zstd(
c1 int primary key,
c2 varchar(30)
)row_format=default compression='zstd_1.3.8';
insert into nt_default_zstd values(200,'AA'),(90,null),(32,'SE'),(15,'GG');
select * from pt_default_zstd;
c1	c2
15	NULL
18	NULL
20	NULL
29	NULL
35	NULL
40	NULL
select * from nt_default_zstd;
c1	c2
15	GG
32	SE
90	NULL
200	AA
ALTER TABLE pt_default_zstd EXCHANGE PARTITION c1_35 WITH TABLE nt_default WITHOUT VALIDATION;
select * from pt_default_zstd;
c1	c2
-50	AA
1	null
15	GG
80	NULL
35	NULL
40	NULL
select * from pt_default_zstd partition(c1_35);
c1	c2
-50	AA
1	null
15	GG
80	NULL
select * from nt_default_zstd;
c1	c2
15	GG
32	SE
90	NULL
200	AA
select * from pt_dynamic_zstd_1 partition(c1_35);
c1	c2
20	NULL
23	NULL
30	NULL
33	NULL
select * from nt_default_zstd;
c1	c2
15	GG
32	SE
90	NULL
200	AA
ALTER TABLE pt_dynamic_zstd_1 EXCHANGE PARTITION c1_35 WITH TABLE nt_default_zstd WITHOUT VALIDATION;
ERROR HY000: Non matching attribute 'ROW_FORMAT' between partition and table
drop table if exists pt_default_zstd_1;
Warnings:
Note	1051	Unknown table 'database1.pt_default_zstd_1'
CREATE TABLE pt_default_zstd_1(c1 int primary key,c2 varchar(30))row_format=default compression='zstd_1.0' PARTITION BY RANGE (c1) (PARTITION c1_15 VALUES LESS THAN (15),
PARTITION c1_35 VALUES LESS THAN (35),
PARTITION c1_50 VALUES LESS THAN (50));
insert into pt_default_zstd_1(c1) values(20),(29),(35),(40),(15),(18);
ALTER TABLE pt_default_zstd_1 EXCHANGE PARTITION c1_35 WITH TABLE nt_default_zstd WITHOUT VALIDATION;
ERROR HY000: Non matching attribute 'ROW_FORMAT' between partition and table
drop table if exists test3;
Warnings:
Note	1051	Unknown table 'database1.test3'
CREATE TABLE test3(c1 int primary key,c2 varchar(30));
ALTER TABLE pt_default_zstd_1 EXCHANGE PARTITION c1_35 WITH TABLE test3 WITHOUT VALIDATION;
ERROR HY000: Non matching attribute 'ROW_FORMAT' between partition and table
drop table if exists pt;
drop table if exists nt;
create table pt (c1 int, c2 int) partition by range(c1) (partition M1  VALUES LESS THAN (5), partition M2 VALUES LESS THAN (10), partition M3 VALUES LESS THAN (1000));
create table nt (c1 int, c2 int);
ALTER TABLE pt BLOCK_SIZE = 2048;
ALTER TABLE nt BLOCK_SIZE = 1024;
alter table pt exchange partition M1 with table nt WITHOUT VALIDATION;
ERROR HY000: Tables have different definitions
drop table pt;
drop table nt;
create table pt (c1 int, c2 int) partition by range(c1) (partition M1  VALUES LESS THAN (5), partition M2 VALUES LESS THAN (10), partition M3 VALUES LESS THAN (1000));
create table nt (c1 int, c2 int);
ALTER TABLE pt CHARACTER SET = utf8mb4 COLLATE = utf8mb4_bin;
ALTER TABLE nt CHARACTER SET = utf8mb4 COLLATE = utf8mb4_general_ci;
alter table pt exchange partition M1 with table nt WITHOUT VALIDATION;
ERROR HY000: Tables have different definitions
drop table pt;
drop table nt;
drop tablegroup if exists myTableGroup1;
drop tablegroup if exists myTableGroup2;
CREATE TABLEGROUP myTableGroup1;
CREATE TABLEGROUP myTableGroup2;
create table pt (c1 int, c2 int) TABLEGROUP = myTableGroup1 partition by range(c1) (partition M1  VALUES LESS THAN (5), partition M2 VALUES LESS THAN (10), partition M3 VALUES LESS THAN (1000));
create table nt (c1 int, c2 int) TABLEGROUP = myTableGroup2;
alter table pt exchange partition M1 with table nt WITHOUT VALIDATION;
ERROR HY000: Tables have different definitions
drop table pt;
drop table nt;
create table pt (c1 int, c2 int) partition by range(c1) (partition M1  VALUES LESS THAN (5), partition M2 VALUES LESS THAN (10), partition M3 VALUES LESS THAN (1000));
create table nt (c1 int, c2 int) ;
alter table pt exchange partition M1 with table nt WITHOUT VALIDATION;
drop table pt;
drop table nt;
create table pt(c1 int, c2 char(10)) partition by range(c1) (partition M1 values less than(10), partition M2 values less than(100));
create table nt(c1 int, C2 char(10));
alter table pt exchange partition M1 with table nt without validation;
drop table nt;
create table nt(c2 char(10), c1 int, c3 int);
alter table pt exchange partition M1 with table nt without validation;
ERROR HY000: Tables have different definitions
drop table nt;
create table nt(c1 int, c2 int, c3 int);
alter table pt exchange partition M1 with table nt without validation;
ERROR HY000: Tables have different definitions
drop table nt;
create table nt(c1 int, c22 char(10), c33 int);
alter table pt exchange partition M1 with table nt without validation;
ERROR HY000: Tables have different definitions
drop table nt;
create table nt(c1 int, c2 char(10), c3 int);
alter table pt exchange partition M1 with table nt without validation;
ERROR HY000: Tables have different definitions
drop table pt;
drop table nt;
drop table if exists test1;
CREATE TABLE test1(c1 int primary key, c2 varchar(30))PARTITION BY RANGE (c1)(PARTITION p1 VALUES LESS THAN (20),PARTITION p2 VALUES LESS THAN (40),PARTITION p3 VALUES LESS THAN (60));
insert into test1(c1) values(19),(20),(22),(36),(40),(59);
drop table if exists test2;
CREATE TABLE test2(cl1 int primary key, c2 varchar(30));
insert into test2 values(-80,'ADX'),(9999,'CD'),(0,'ZXV');
ALTER TABLE test1 EXCHANGE PARTITION p2 WITH TABLE test2 WITHOUT VALIDATION;
ERROR HY000: Tables have different definitions
drop table if exists test3;
CREATE TABLE test3(C1 int primary key, c2 varchar(30));
insert into test3 values(666,'ADX'),(9999,'CD'),(0123,'ZXV');
ALTER TABLE test1 EXCHANGE PARTITION p2 WITH TABLE test3 WITHOUT VALIDATION;
select * from test1;
c1	c2
19	NULL
123	ZXV
666	ADX
9999	CD
40	NULL
59	NULL
select * from test1 partition(p2);
c1	c2
123	ZXV
666	ADX
9999	CD
select * from test3;
C1	c2
20	NULL
22	NULL
36	NULL
create table pt(c1 int, c2 char(10), c3 int, c4 int generated always as(c1+1) virtual) partition by range(c1)(partition M1 values less than(10), partition M2 values less than(100));
create table nt(c1 int, c2 char(10), c3 int, c5 int generated always as(c1+1) virtual);
alter table pt exchange partition M1 with table nt without validation;
ERROR HY000: Tables have different definitions
drop table nt;
create table nt(c1 int, c2 char(10), c3 int, c4 int generated always as(c2+1) virtual);
alter table pt exchange partition M1 with table nt without validation;
drop table pt;
drop table nt;
create table pt(c1 int, c2 char(10), c3 int, c4 int generated always as(c1+1) stored)partition by range(c1)(partition M1 values less than(10), partition M2 values less than(100));
create table nt(c1 int, c2 char(10), c3 int, c4 int generated always as(c2+1) stored);
alter table pt exchange partition M1 with table nt without validation;
ERROR 0A000: exchanging partition tables define different default values in alter table add column ddl operation not supported
drop table nt;
create table nt(c1 int, c2 char(10), c3 int, c4 int generated always as(c1+1) stored);
alter table pt exchange partition M1 with table nt without validation;
drop table pt;
drop table nt;
create table pt(c1 int, c2 char(10), c3 int, c4 int generated always as(c1+1) virtual)partition by range(c1)(partition M1 values less than(10), partition M2 values less than(100));
create table nt(c1 int, c2 char(10), c3 int, c4 int generated always as(c1+1) stored);
alter table pt exchange partition M1 with table nt without validation;
ERROR HY000: 'Exchanging partitions for non-generated columns' is not supported for generated columns.
drop table pt;
drop table nt;
drop table if exists tbl_126;
drop table if exists sqlgen16___tbl_126;
CREATE TABLE `tbl_126` (
`col_1` char(161) NOT NULL,
`col_2` json DEFAULT NULL,
`col_3` set('Alice','Bob','Charlie','David') DEFAULT 'David',
`col_4` mediumint(9) NOT NULL,
`col_5` bigint(20) unsigned DEFAULT '5473944502633417925',
`col_6` binary(41) NOT NULL,
`col_7` mediumint(8) unsigned NOT NULL,
`col_8` decimal(21,8) DEFAULT NULL,
`col_9` timestamp NULL DEFAULT NULL,
`col_10` bit(49) NOT NULL,
`col_11` binary(2) NOT NULL DEFAULT '1',
`col_12` mediumint(9) DEFAULT '-5946566',
`col_13` json DEFAULT NULL,
`col_14` double DEFAULT '7201.736070383351',
`col_15` tinyint(1) DEFAULT NULL,
`col_16` char(159) NOT NULL,
`col_17` tinyint(1) DEFAULT '0',
`col_18` json NOT NULL,
`col_19` smallint(5) unsigned NOT NULL DEFAULT '30685',
`col_20` bigint(20) DEFAULT '-5220816398549008957',
`col_21` bigint(20) NOT NULL DEFAULT '2534161884816127430',
`col_22` enum('Alice','Bob','Charlie','David') NOT NULL,
`col_23` mediumint(9) NOT NULL DEFAULT '8186578',
`col_24` enum('Alice','Bob','Charlie','David') NOT NULL,
`col_25` varchar(17) NOT NULL DEFAULT 'K',
`col_26` enum('Alice','Bob','Charlie','David') DEFAULT NULL,
`col_27` tinyint(1) DEFAULT NULL,
`col_28` tinyblob NOT NULL,
`col_29` json NOT NULL,
`col_30` bit(33) NOT NULL DEFAULT b'111110001010010011010001110001111',
`col_31` text DEFAULT NULL,
`col_32` enum('Alice','Bob','Charlie','David') NOT NULL DEFAULT 'Alice',
`col_33` mediumint(8) unsigned NOT NULL,
`col_34` smallint(6) DEFAULT '-12239',
`col_35` binary(181) NOT NULL DEFAULT 'w7+5VMO_@Mn',
`col_36` varchar(292) NOT NULL,
`col_37` text DEFAULT NULL,
`col_38` text DEFAULT NULL,
`col_39` mediumint(8) unsigned DEFAULT NULL,
`col_40` enum('Alice','Bob','Charlie','David') NOT NULL,
`col_41` enum('Alice','Bob','Charlie','David') NOT NULL,
`col_42` char(53) NOT NULL DEFAULT 'IRAx$2)Off~!1',
`col_43` int(10) unsigned NOT NULL,
`col_44` int(11) DEFAULT '-1854090074',
`col_45` set('Alice','Bob','Charlie','David') NOT NULL DEFAULT 'Alice',
`col_46` decimal(42,8) DEFAULT NULL,
`col_47` year(4) DEFAULT '2014',
`col_48` int(10) unsigned NOT NULL,
`col_49` mediumint(8) unsigned DEFAULT '13406915',
`col_50` tinyint(1) NOT NULL,
`col_51` mediumint(9) DEFAULT NULL,
`col_52` date NOT NULL DEFAULT '1988-12-05',
`col_53` bigint(20) unsigned DEFAULT '3452646005347633783',
`col_54` set('Alice','Bob','Charlie','David') NOT NULL,
`col_55` set('Alice','Bob','Charlie','David') NOT NULL DEFAULT 'David',
`col_56` char(31) DEFAULT 'B#vCb(@*e0U~!',
`col_57` bigint(20) unsigned DEFAULT '3112266565014869440',
`col_58` decimal(9,1) NOT NULL DEFAULT '43243.5',
`col_59` bigint(20) NOT NULL DEFAULT '-1530731628519263630',
`col_60` double DEFAULT NULL,
`col_61` tinyint(3) unsigned DEFAULT NULL,
`col_62` decimal(51,9) NOT NULL DEFAULT '3852.130000000',
`col_63` bigint(20) unsigned DEFAULT '6824005745367928529',
`col_64` datetime NOT NULL,
`col_65` timestamp NOT NULL,
`col_66` bit(19) DEFAULT b'11011010011101110',
`col_67` char(174) NOT NULL,
`col_68` int(11) NOT NULL DEFAULT '520350710',
`col_69` bit(38) NOT NULL,
`col_70` enum('Alice','Bob','Charlie','David') DEFAULT NULL,
`col_71` blob DEFAULT NULL,
`col_72` smallint(5) unsigned NOT NULL,
`col_73` varchar(117) NOT NULL DEFAULT 'M*',
`col_74` json DEFAULT NULL,
`col_75` decimal(18,13) NOT NULL DEFAULT '0.2610000000000',
`col_76` text NOT NULL,
`col_77` tinyblob DEFAULT NULL,
`col_78` varchar(377) DEFAULT '7z%h@~b',
`col_79` bigint(20) unsigned DEFAULT '597748745758023378',
`col_80` json NOT NULL,
`col_81` bigint(20) unsigned NOT NULL,
`col_82` set('Alice','Bob','Charlie','David') NOT NULL,
`col_83` float DEFAULT NULL,
`col_84` int(10) unsigned NOT NULL DEFAULT '770922364',
`col_85` bigint(20) DEFAULT NULL,
`col_86` double DEFAULT NULL,
`col_87` mediumint(9) DEFAULT NULL,
`col_88` blob NOT NULL,
`col_89` char(68) NOT NULL DEFAULT 'i5嚜~蛳T)伵!EOTn盁蛥',
`col_90` int(10) unsigned DEFAULT '2300012867',
`col_91` smallint(5) unsigned DEFAULT NULL,
`col_92` text NOT NULL,
`col_93` tinyint(3) unsigned DEFAULT '105',
`col_94` bit(34) NOT NULL,
`col_95` tinyint(1) NOT NULL DEFAULT '0',
`col_96` float NOT NULL,
`col_97` varbinary(75) DEFAULT NULL,
`col_98` double NOT NULL DEFAULT '5346.735596988907',
`col_99` json DEFAULT NULL,
`col_100` set('Alice','Bob','Charlie','David') NOT NULL,
`col_101` bigint(20) unsigned NOT NULL,
`col_102` varchar(52) NOT NULL DEFAULT 'uV7zJXLr1Vh',
`col_103` tinyint(3) unsigned NOT NULL,
`col_104` tinyblob DEFAULT NULL,
`col_105` text DEFAULT NULL,
`col_106` varchar(48) DEFAULT '%J-',
`col_107` varbinary(394) DEFAULT NULL,
`col_108` tinyblob DEFAULT NULL,
`col_109` text NOT NULL,
`col_110` smallint(6) NOT NULL,
`col_111` tinyint(4) NOT NULL DEFAULT '100',
`col_112` datetime DEFAULT '2027-03-19 00:00:00',
`col_113` decimal(16,4) DEFAULT '28713.2100',
`col_114` varchar(16) DEFAULT '-qhDAPb4~Zjh2V',
`col_115` bit(9) DEFAULT NULL,
`col_116` bit(30) NOT NULL DEFAULT b'10000110011000011010101110010',
`col_117` bigint(20) DEFAULT NULL,
`col_118` text NOT NULL,
`col_119` float NOT NULL,
`col_120` smallint(5) unsigned NOT NULL,
`col_121` char(188) NOT NULL DEFAULT '3ubGu',
`col_122` json NOT NULL,
`col_123` smallint(6) DEFAULT NULL,
`col_124` decimal(25,19) NOT NULL,
`col_125` int(10) unsigned DEFAULT '4053241877',
`col_126` json DEFAULT NULL,
`col_127` mediumint(8) unsigned NOT NULL,
`col_128` bit(33) DEFAULT NULL,
`col_129` tinyint(4) NOT NULL,
`col_130` int(11) DEFAULT NULL,
`col_131` text DEFAULT NULL,
`col_132` blob NOT NULL,
`col_133` bigint(20) NOT NULL DEFAULT '289925369490965359',
`col_134` int(11) NOT NULL,
`col_135` tinyblob NOT NULL,
`col_136` json NOT NULL,
`col_137` tinyint(3) unsigned DEFAULT NULL,
`col_138` int(11) NOT NULL DEFAULT '-780486988',
`col_139` decimal(32,24) DEFAULT NULL,
`col_140` year(4) NOT NULL DEFAULT '1985',
`col_141` enum('Alice','Bob','Charlie','David') NOT NULL,
`col_142` char(41) NOT NULL DEFAULT 'eJfa^tE!By',
`col_143` float NOT NULL DEFAULT '2144.18',
`col_144` datetime DEFAULT NULL,
`col_145` text NOT NULL,
`col_146` set('Alice','Bob','Charlie','David') DEFAULT NULL,
`col_147` enum('Alice','Bob','Charlie','David') DEFAULT 'David',
`col_148` tinyint(1) NOT NULL DEFAULT '0',
`col_149` int(10) unsigned NOT NULL,
`col_150` float DEFAULT NULL,
`col_151` text NOT NULL,
`col_152` char(19) NOT NULL,
`col_153` decimal(18,14) DEFAULT NULL,
`col_154` tinyint(1) NOT NULL,
`col_155` bigint(20) DEFAULT NULL,
`col_156` decimal(41,7) DEFAULT NULL,
`col_157` int(10) unsigned NOT NULL DEFAULT '3950781440',
`col_158` datetime NOT NULL,
`col_159` enum('Alice','Bob','Charlie','David') NOT NULL DEFAULT 'Charlie',
`col_160` bit(13) NOT NULL DEFAULT b'10010110101',
`col_161` tinyblob NOT NULL,
`col_162` text NOT NULL,
`col_163` tinyint(3) unsigned NOT NULL DEFAULT '196',
`col_164` char(17) DEFAULT 'ya',
`col_165` bit(16) NOT NULL DEFAULT b'101000110010110',
`col_166` bit(42) NOT NULL,
`col_167` set('Alice','Bob','Charlie','David') DEFAULT 'Bob',
`col_168` varchar(61) NOT NULL DEFAULT 'T!q2m)_@UT9l',
`col_169` enum('Alice','Bob','Charlie','David') DEFAULT 'Alice',
`col_170` mediumint(9) NOT NULL,
`col_171` binary(165) DEFAULT NULL,
`col_172` decimal(43,21) DEFAULT NULL,
`col_173` set('Alice','Bob','Charlie','David') DEFAULT NULL,
`col_174` bit(55) NOT NULL DEFAULT b'101101001111001110010100000010101011011010101110001101',
`col_175` json NOT NULL,
`col_176` bit(6) NOT NULL,
`col_177` set('Alice','Bob','Charlie','David') NOT NULL,
`col_178` text NOT NULL,
`col_179` json DEFAULT NULL,
`col_180` bit(8) NOT NULL,
`col_181` varchar(481) NOT NULL,
`col_182` json NOT NULL,
`col_183` text DEFAULT NULL,
`col_184` double DEFAULT NULL,
`col_185` bit(1) DEFAULT NULL,
`col_186` tinytext NOT NULL,
`col_187` varchar(138) NOT NULL DEFAULT '_QD',
`col_188` json NOT NULL,
`col_189` tinyint(1) NOT NULL DEFAULT '1',
`col_190` json DEFAULT NULL,
`col_191` decimal(45,27) NOT NULL,
`col_192` datetime NOT NULL,
`col_193` varchar(89) DEFAULT '8',
`col_194` text NOT NULL,
`col_195` double DEFAULT '6552.853347952523',
`col_196` bigint(20) unsigned NOT NULL DEFAULT '8598904886106320335',
`col_197` mediumint(8) unsigned NOT NULL,
`col_198` tinyint(3) unsigned DEFAULT '39',
`col_199` text DEFAULT NULL,
`col_200` int(11) DEFAULT NULL,
`col_201` json DEFAULT NULL,
`col_202` char(224) NOT NULL,
`col_203` varchar(203) DEFAULT NULL,
`col_204` json DEFAULT NULL,
`col_205` enum('Alice','Bob','Charlie','David') DEFAULT 'Alice',
`col_206` json DEFAULT NULL,
`col_207` bit(22) NOT NULL,
`col_208` bigint(20) unsigned NOT NULL DEFAULT '1046492688713494035',
`col_209` json NOT NULL,
`col_210` varbinary(358) NOT NULL DEFAULT 'm&T',
`col_211` json DEFAULT NULL,
`col_212` json DEFAULT NULL,
`col_213` year(4) NOT NULL,
`col_214` json DEFAULT NULL,
`col_215` varchar(115) DEFAULT '9=Bvap',
`col_216` datetime DEFAULT NULL,
`col_217` double NOT NULL DEFAULT '7412.592358442774',
`col_218` int(11) DEFAULT NULL,
`col_219` bigint(20) NOT NULL DEFAULT '-214261647573527794',
`col_220` float DEFAULT NULL,
`col_221` tinyint(1) DEFAULT NULL,
`col_222` varchar(325) NOT NULL DEFAULT 'it6iPo',
`col_223` tinyint(3) unsigned DEFAULT NULL,
`col_224` bit(32) DEFAULT b'10110010011111001000011011100111',
`col_225` int(10) unsigned NOT NULL DEFAULT '3718572728',
`col_226` date DEFAULT '1978-04-23',
`col_227` bit(1) NOT NULL,
`col_228` json DEFAULT NULL,
`col_229` smallint(5) unsigned DEFAULT NULL,
`col_230` enum('Alice','Bob','Charlie','David') DEFAULT 'Charlie',
`col_231` bit(21) DEFAULT NULL,
`col_232` set('Alice','Bob','Charlie','David') DEFAULT 'David',
`col_233` int(10) unsigned NOT NULL,
`col_234` bit(13) DEFAULT b'11000011101',
`col_235` tinyint(1) NOT NULL,
`col_236` json NOT NULL,
`col_237` tinyint(1) NOT NULL DEFAULT '1',
`col_238` set('Alice','Bob','Charlie','David') DEFAULT 'Alice',
`col_239` datetime NOT NULL,
`col_240` bigint(20) unsigned DEFAULT '7224449210967093094',
`col_241` datetime NOT NULL DEFAULT '2020-10-02 00:00:00',
`col_242` char(157) DEFAULT 'mj',
`col_243` char(76) NOT NULL,
`col_244` smallint(5) unsigned NOT NULL DEFAULT '24120',
`col_245` set('Alice','Bob','Charlie','David') DEFAULT 'Alice',
`col_246` varchar(442) NOT NULL,
`col_247` bigint(20) NOT NULL DEFAULT '-5233035258930370669',
`col_248` datetime NOT NULL,
`col_249` int(11) DEFAULT NULL,
`col_250` char(103) NOT NULL,
`col_251` json NOT NULL,
`col_252` varchar(10) DEFAULT NULL,
`col_253` text NOT NULL,
`col_254` tinytext DEFAULT NULL,
`col_255` enum('Alice','Bob','Charlie','David') DEFAULT NULL,
`col_256` json DEFAULT NULL,
`col_257` tinyblob DEFAULT NULL,
`col_258` int(10) unsigned DEFAULT '410407630',
`col_259` smallint(6) DEFAULT '-7517',
`col_260` datetime DEFAULT NULL,
`col_261` char(233) NOT NULL,
`col_262` bit(38) DEFAULT b'11101110111001101010010010001111110011',
`col_263` varchar(36) DEFAULT 'aTwa1Jp5g@',
`col_264` datetime NOT NULL,
`col_265` set('Alice','Bob','Charlie','David') DEFAULT 'David',
`col_266` json NOT NULL,
`col_267` int(10) unsigned NOT NULL,
`col_268` double DEFAULT '3247.269570006326',
`col_269` date NOT NULL,
`col_270` text NOT NULL,
`col_271` text NOT NULL,
`col_272` bigint(20) unsigned NOT NULL DEFAULT '8023918036131253430',
`col_273` tinyint(1) NOT NULL,
`col_274` set('Alice','Bob','Charlie','David') NOT NULL,
`col_275` int(11) NOT NULL,
`col_276` json DEFAULT NULL,
`col_277` text NOT NULL,
`col_278` varbinary(326) NOT NULL DEFAULT 'j&kTL8FEEvbb0(y~J9M',
`col_279` enum('Alice','Bob','Charlie','David') NOT NULL DEFAULT 'David',
`col_280` char(249) DEFAULT '尮稖2',
`col_281` bit(42) NOT NULL,
`col_282` json DEFAULT NULL,
`col_283` json NOT NULL,
`col_284` json NOT NULL,
`col_285` tinytext NOT NULL,
`col_286` tinyint(4) DEFAULT '-95',
`col_287` varbinary(482) DEFAULT NULL,
`col_288` double NOT NULL,
`col_289` char(3) NOT NULL DEFAULT '',
`col_290` varchar(61) NOT NULL,
`col_291` mediumint(9) NOT NULL,
PRIMARY KEY (`col_208`, `col_140`, `col_121`),
UNIQUE KEY `idx_3` (`col_208`, `col_97`(1)) BLOCK_SIZE 16384 GLOBAL,
KEY `idx_2` (`col_20`) BLOCK_SIZE 16384 GLOBAL,
KEY `idx_4` (`col_8`, `col_195`, `col_43`, `col_67`(3)) BLOCK_SIZE 16384 GLOBAL
) DEFAULT CHARSET = utf8mb4 ROW_FORMAT = DYNAMIC COMPRESSION = 'lz4_1.0' REPLICA_NUM = 3 BLOCK_SIZE = 16384 USE_BLOOM_FILTER = FALSE TABLET_SIZE = 134217728 PCTFREE = 0
partition by range(col_208)
(partition `p0` values less than (3027820682432853889),
partition `p1` values less than (4008978094364082969),
partition `p2` values less than (5296140123882957211),
partition `p3` values less than (5665442349985889652),
partition `p4` values less than (8355989428717066658)) WITH COLUMN GROUP(each column);
CREATE TABLE `sqlgen16___tbl_126` (
`col_1` char(161) NOT NULL,
`col_2` json DEFAULT NULL,
`col_3` set('Alice','Bob','Charlie','David') DEFAULT 'David',
`col_4` mediumint(9) NOT NULL,
`col_5` bigint(20) unsigned DEFAULT '5473944502633417925',
`col_6` binary(41) NOT NULL,
`col_7` mediumint(8) unsigned NOT NULL,
`col_8` decimal(21,8) DEFAULT NULL,
`col_9` timestamp NULL DEFAULT NULL,
`col_10` bit(49) NOT NULL,
`col_11` binary(2) NOT NULL DEFAULT '1',
`col_12` mediumint(9) DEFAULT '-5946566',
`col_13` json DEFAULT NULL,
`col_14` double DEFAULT '7201.736070383351',
`col_15` tinyint(1) DEFAULT NULL,
`col_16` char(159) NOT NULL,
`col_17` tinyint(1) DEFAULT '0',
`col_18` json NOT NULL,
`col_19` smallint(5) unsigned NOT NULL DEFAULT '30685',
`col_20` bigint(20) DEFAULT '-5220816398549008957',
`col_21` bigint(20) NOT NULL DEFAULT '2534161884816127430',
`col_22` enum('Alice','Bob','Charlie','David') NOT NULL,
`col_23` mediumint(9) NOT NULL DEFAULT '8186578',
`col_24` enum('Alice','Bob','Charlie','David') NOT NULL,
`col_25` varchar(17) NOT NULL DEFAULT 'K',
`col_26` enum('Alice','Bob','Charlie','David') DEFAULT NULL,
`col_27` tinyint(1) DEFAULT NULL,
`col_28` tinyblob NOT NULL,
`col_29` json NOT NULL,
`col_30` bit(33) NOT NULL DEFAULT b'111110001010010011010001110001111',
`col_31` text DEFAULT NULL,
`col_32` enum('Alice','Bob','Charlie','David') NOT NULL DEFAULT 'Alice',
`col_33` mediumint(8) unsigned NOT NULL,
`col_34` smallint(6) DEFAULT '-12239',
`col_35` binary(181) NOT NULL DEFAULT 'w7+5VMO_@Mn',
`col_36` varchar(292) NOT NULL,
`col_37` text DEFAULT NULL,
`col_38` text DEFAULT NULL,
`col_39` mediumint(8) unsigned DEFAULT NULL,
`col_40` enum('Alice','Bob','Charlie','David') NOT NULL,
`col_41` enum('Alice','Bob','Charlie','David') NOT NULL,
`col_42` char(53) NOT NULL DEFAULT 'IRAx$2)Off~!1',
`col_43` int(10) unsigned NOT NULL,
`col_44` int(11) DEFAULT '-1854090074',
`col_45` set('Alice','Bob','Charlie','David') NOT NULL DEFAULT 'Alice',
`col_46` decimal(42,8) DEFAULT NULL,
`col_47` year(4) DEFAULT '2014',
`col_48` int(10) unsigned NOT NULL,
`col_49` mediumint(8) unsigned DEFAULT '13406915',
`col_50` tinyint(1) NOT NULL,
`col_51` mediumint(9) DEFAULT NULL,
`col_52` date NOT NULL DEFAULT '1988-12-05',
`col_53` bigint(20) unsigned DEFAULT '3452646005347633783',
`col_54` set('Alice','Bob','Charlie','David') NOT NULL,
`col_55` set('Alice','Bob','Charlie','David') NOT NULL DEFAULT 'David',
`col_56` char(31) DEFAULT 'B#vCb(@*e0U~!',
`col_57` bigint(20) unsigned DEFAULT '3112266565014869440',
`col_58` decimal(9,1) NOT NULL DEFAULT '43243.5',
`col_59` bigint(20) NOT NULL DEFAULT '-1530731628519263630',
`col_60` double DEFAULT NULL,
`col_61` tinyint(3) unsigned DEFAULT NULL,
`col_62` decimal(51,9) NOT NULL DEFAULT '3852.130000000',
`col_63` bigint(20) unsigned DEFAULT '6824005745367928529',
`col_64` datetime NOT NULL,
`col_65` timestamp NOT NULL,
`col_66` bit(19) DEFAULT b'11011010011101110',
`col_67` char(174) NOT NULL,
`col_68` int(11) NOT NULL DEFAULT '520350710',
`col_69` bit(38) NOT NULL,
`col_70` enum('Alice','Bob','Charlie','David') DEFAULT NULL,
`col_71` blob DEFAULT NULL,
`col_72` smallint(5) unsigned NOT NULL,
`col_73` varchar(117) NOT NULL DEFAULT 'M*',
`col_74` json DEFAULT NULL,
`col_75` decimal(18,13) NOT NULL DEFAULT '0.2610000000000',
`col_76` text NOT NULL,
`col_77` tinyblob DEFAULT NULL,
`col_78` varchar(377) DEFAULT '7z%h@~b',
`col_79` bigint(20) unsigned DEFAULT '597748745758023378',
`col_80` json NOT NULL,
`col_81` bigint(20) unsigned NOT NULL,
`col_82` set('Alice','Bob','Charlie','David') NOT NULL,
`col_83` float DEFAULT NULL,
`col_84` int(10) unsigned NOT NULL DEFAULT '770922364',
`col_85` bigint(20) DEFAULT NULL,
`col_86` double DEFAULT NULL,
`col_87` mediumint(9) DEFAULT NULL,
`col_88` blob NOT NULL,
`col_89` char(68) NOT NULL DEFAULT 'i5嚜~蛳T)伵!EOTn盁蛥',
`col_90` int(10) unsigned DEFAULT '2300012867',
`col_91` smallint(5) unsigned DEFAULT NULL,
`col_92` text NOT NULL,
`col_93` tinyint(3) unsigned DEFAULT '105',
`col_94` bit(34) NOT NULL,
`col_95` tinyint(1) NOT NULL DEFAULT '0',
`col_96` float NOT NULL,
`col_97` varbinary(75) DEFAULT NULL,
`col_98` double NOT NULL DEFAULT '5346.735596988907',
`col_99` json DEFAULT NULL,
`col_100` set('Alice','Bob','Charlie','David') NOT NULL,
`col_101` bigint(20) unsigned NOT NULL,
`col_102` varchar(52) NOT NULL DEFAULT 'uV7zJXLr1Vh',
`col_103` tinyint(3) unsigned NOT NULL,
`col_104` tinyblob DEFAULT NULL,
`col_105` text DEFAULT NULL,
`col_106` varchar(48) DEFAULT '%J-',
`col_107` varbinary(394) DEFAULT NULL,
`col_108` tinyblob DEFAULT NULL,
`col_109` text NOT NULL,
`col_110` smallint(6) NOT NULL,
`col_111` tinyint(4) NOT NULL DEFAULT '100',
`col_112` datetime DEFAULT '2027-03-19 00:00:00',
`col_113` decimal(16,4) DEFAULT '28713.2100',
`col_114` varchar(16) DEFAULT '-qhDAPb4~Zjh2V',
`col_115` bit(9) DEFAULT NULL,
`col_116` bit(30) NOT NULL DEFAULT b'10000110011000011010101110010',
`col_117` bigint(20) DEFAULT NULL,
`col_118` text NOT NULL,
`col_119` float NOT NULL,
`col_120` smallint(5) unsigned NOT NULL,
`col_121` char(188) NOT NULL DEFAULT '3ubGu',
`col_122` json NOT NULL,
`col_123` smallint(6) DEFAULT NULL,
`col_124` decimal(25,19) NOT NULL,
`col_125` int(10) unsigned DEFAULT '4053241877',
`col_126` json DEFAULT NULL,
`col_127` mediumint(8) unsigned NOT NULL,
`col_128` bit(33) DEFAULT NULL,
`col_129` tinyint(4) NOT NULL,
`col_130` int(11) DEFAULT NULL,
`col_131` text DEFAULT NULL,
`col_132` blob NOT NULL,
`col_133` bigint(20) NOT NULL DEFAULT '289925369490965359',
`col_134` int(11) NOT NULL,
`col_135` tinyblob NOT NULL,
`col_136` json NOT NULL,
`col_137` tinyint(3) unsigned DEFAULT NULL,
`col_138` int(11) NOT NULL DEFAULT '-780486988',
`col_139` decimal(32,24) DEFAULT NULL,
`col_140` year(4) NOT NULL DEFAULT '1985',
`col_141` enum('Alice','Bob','Charlie','David') NOT NULL,
`col_142` char(41) NOT NULL DEFAULT 'eJfa^tE!By',
`col_143` float NOT NULL DEFAULT '2144.18',
`col_144` datetime DEFAULT NULL,
`col_145` text NOT NULL,
`col_146` set('Alice','Bob','Charlie','David') DEFAULT NULL,
`col_147` enum('Alice','Bob','Charlie','David') DEFAULT 'David',
`col_148` tinyint(1) NOT NULL DEFAULT '0',
`col_149` int(10) unsigned NOT NULL,
`col_150` float DEFAULT NULL,
`col_151` text NOT NULL,
`col_152` char(19) NOT NULL,
`col_153` decimal(18,14) DEFAULT NULL,
`col_154` tinyint(1) NOT NULL,
`col_155` bigint(20) DEFAULT NULL,
`col_156` decimal(41,7) DEFAULT NULL,
`col_157` int(10) unsigned NOT NULL DEFAULT '3950781440',
`col_158` datetime NOT NULL,
`col_159` enum('Alice','Bob','Charlie','David') NOT NULL DEFAULT 'Charlie',
`col_160` bit(13) NOT NULL DEFAULT b'10010110101',
`col_161` tinyblob NOT NULL,
`col_162` text NOT NULL,
`col_163` tinyint(3) unsigned NOT NULL DEFAULT '196',
`col_164` char(17) DEFAULT 'ya',
`col_165` bit(16) NOT NULL DEFAULT b'101000110010110',
`col_166` bit(42) NOT NULL,
`col_167` set('Alice','Bob','Charlie','David') DEFAULT 'Bob',
`col_168` varchar(61) NOT NULL DEFAULT 'T!q2m)_@UT9l',
`col_169` enum('Alice','Bob','Charlie','David') DEFAULT 'Alice',
`col_170` mediumint(9) NOT NULL,
`col_171` binary(165) DEFAULT NULL,
`col_172` decimal(43,21) DEFAULT NULL,
`col_173` set('Alice','Bob','Charlie','David') DEFAULT NULL,
`col_174` bit(55) NOT NULL DEFAULT b'101101001111001110010100000010101011011010101110001101',
`col_175` json NOT NULL,
`col_176` bit(6) NOT NULL,
`col_177` set('Alice','Bob','Charlie','David') NOT NULL,
`col_178` text NOT NULL,
`col_179` json DEFAULT NULL,
`col_180` bit(8) NOT NULL,
`col_181` varchar(481) NOT NULL,
`col_182` json NOT NULL,
`col_183` text DEFAULT NULL,
`col_184` double DEFAULT NULL,
`col_185` bit(1) DEFAULT NULL,
`col_186` tinytext NOT NULL,
`col_187` varchar(138) NOT NULL DEFAULT '_QD',
`col_188` json NOT NULL,
`col_189` tinyint(1) NOT NULL DEFAULT '1',
`col_190` json DEFAULT NULL,
`col_191` decimal(45,27) NOT NULL,
`col_192` datetime NOT NULL,
`col_193` varchar(89) DEFAULT '8',
`col_194` text NOT NULL,
`col_195` double DEFAULT '6552.853347952523',
`col_196` bigint(20) unsigned NOT NULL DEFAULT '8598904886106320335',
`col_197` mediumint(8) unsigned NOT NULL,
`col_198` tinyint(3) unsigned DEFAULT '39',
`col_199` text DEFAULT NULL,
`col_200` int(11) DEFAULT NULL,
`col_201` json DEFAULT NULL,
`col_202` char(224) NOT NULL,
`col_203` varchar(203) DEFAULT NULL,
`col_204` json DEFAULT NULL,
`col_205` enum('Alice','Bob','Charlie','David') DEFAULT 'Alice',
`col_206` json DEFAULT NULL,
`col_207` bit(22) NOT NULL,
`col_208` bigint(20) unsigned NOT NULL DEFAULT '1046492688713494035',
`col_209` json NOT NULL,
`col_210` varbinary(358) NOT NULL DEFAULT 'm&T',
`col_211` json DEFAULT NULL,
`col_212` json DEFAULT NULL,
`col_213` year(4) NOT NULL,
`col_214` json DEFAULT NULL,
`col_215` varchar(115) DEFAULT '9=Bvap',
`col_216` datetime DEFAULT NULL,
`col_217` double NOT NULL DEFAULT '7412.592358442774',
`col_218` int(11) DEFAULT NULL,
`col_219` bigint(20) NOT NULL DEFAULT '-214261647573527794',
`col_220` float DEFAULT NULL,
`col_221` tinyint(1) DEFAULT NULL,
`col_222` varchar(325) NOT NULL DEFAULT 'it6iPo',
`col_223` tinyint(3) unsigned DEFAULT NULL,
`col_224` bit(32) DEFAULT b'10110010011111001000011011100111',
`col_225` int(10) unsigned NOT NULL DEFAULT '3718572728',
`col_226` date DEFAULT '1978-04-23',
`col_227` bit(1) NOT NULL,
`col_228` json DEFAULT NULL,
`col_229` smallint(5) unsigned DEFAULT NULL,
`col_230` enum('Alice','Bob','Charlie','David') DEFAULT 'Charlie',
`col_231` bit(21) DEFAULT NULL,
`col_232` set('Alice','Bob','Charlie','David') DEFAULT 'David',
`col_233` int(10) unsigned NOT NULL,
`col_234` bit(13) DEFAULT b'11000011101',
`col_235` tinyint(1) NOT NULL,
`col_236` json NOT NULL,
`col_237` tinyint(1) NOT NULL DEFAULT '1',
`col_238` set('Alice','Bob','Charlie','David') DEFAULT 'Alice',
`col_239` datetime NOT NULL,
`col_240` bigint(20) unsigned DEFAULT '7224449210967093094',
`col_241` datetime NOT NULL DEFAULT '2020-10-02 00:00:00',
`col_242` char(157) DEFAULT 'mj',
`col_243` char(76) NOT NULL,
`col_244` smallint(5) unsigned NOT NULL DEFAULT '24120',
`col_245` set('Alice','Bob','Charlie','David') DEFAULT 'Alice',
`col_246` varchar(442) NOT NULL,
`col_247` bigint(20) NOT NULL DEFAULT '-5233035258930370669',
`col_248` datetime NOT NULL,
`col_249` int(11) DEFAULT NULL,
`col_250` char(103) NOT NULL,
`col_251` json NOT NULL,
`col_252` varchar(10) DEFAULT NULL,
`col_253` text NOT NULL,
`col_254` tinytext DEFAULT NULL,
`col_255` enum('Alice','Bob','Charlie','David') DEFAULT NULL,
`col_256` json DEFAULT NULL,
`col_257` tinyblob DEFAULT NULL,
`col_258` int(10) unsigned DEFAULT '410407630',
`col_259` smallint(6) DEFAULT '-7517',
`col_260` datetime DEFAULT NULL,
`col_261` char(233) NOT NULL,
`col_262` bit(38) DEFAULT b'11101110111001101010010010001111110011',
`col_263` varchar(36) DEFAULT 'aTwa1Jp5g@',
`col_264` datetime NOT NULL,
`col_265` set('Alice','Bob','Charlie','David') DEFAULT 'David',
`col_266` json NOT NULL,
`col_267` int(10) unsigned NOT NULL,
`col_268` double DEFAULT '3247.269570006326',
`col_269` date NOT NULL,
`col_270` text NOT NULL,
`col_271` text NOT NULL,
`col_272` bigint(20) unsigned NOT NULL DEFAULT '8023918036131253430',
`col_273` tinyint(1) NOT NULL,
`col_274` set('Alice','Bob','Charlie','David') NOT NULL,
`col_275` int(11) NOT NULL,
`col_276` json DEFAULT NULL,
`col_277` text NOT NULL,
`col_278` varbinary(326) NOT NULL DEFAULT 'j&kTL8FEEvbb0(y~J9M',
`col_279` enum('Alice','Bob','Charlie','David') NOT NULL DEFAULT 'David',
`col_280` char(249) DEFAULT '尮稖2',
`col_281` bit(42) NOT NULL,
`col_282` json DEFAULT NULL,
`col_283` json NOT NULL,
`col_284` json NOT NULL,
`col_285` tinytext NOT NULL,
`col_286` tinyint(4) DEFAULT '-95',
`col_287` varbinary(482) DEFAULT NULL,
`col_288` double NOT NULL,
`col_289` char(3) NOT NULL DEFAULT '',
`col_290` varchar(61) NOT NULL,
`col_291` mediumint(9) NOT NULL,
PRIMARY KEY (`col_208`, `col_140`, `col_121`)
) DEFAULT CHARSET = utf8mb4 ROW_FORMAT = DYNAMIC COMPRESSION = 'lz4_1.0' REPLICA_NUM = 3 BLOCK_SIZE = 16384 USE_BLOOM_FILTER = FALSE TABLET_SIZE = 134217728 PCTFREE = 0 WITH COLUMN GROUP(each column);
ALTER /*+parallel(8)*/ TABLE tbl_126 EXCHANGE PARTITION p0 WITH TABLE sqlgen16___tbl_126 WITHOUT VALIDATION ;
drop table tbl_126;
drop table sqlgen16___tbl_126;
create table pt(c1 int, c2 char(10), c3 int, c4 int generated always as(c1+1) virtual)partition by range(c1)(partition M1 values less than(10), partition M2 values less than(100));
create table nt(c1 int, c2 char(10), c3 int, c4 int generated always as(c1+1) stored);
alter table pt exchange partition M1 with table nt without validation;
ERROR HY000: 'Exchanging partitions for non-generated columns' is not supported for generated columns.
drop table pt;
drop table nt;
create table pt(c1 int, c2 char(10), c3 int, c4 int generated always as(c1+1) stored)partition by range(c1)(partition M1 values less than(10), partition M2 values less than(100));
create table nt(c1 int, c2 char(10), c3 int, c4 int generated always as(c1+1) stored);
alter table pt exchange partition M1 with table nt without validation;
drop table pt;
drop table nt;
create table pt(c1 int, c2 char(10), c3 int, c4 int generated always as(c1+1) virtual)partition by range(c1)(partition M1 values less than(10), partition M2 values less than(100));
create table nt(c1 int, c2 char(10), c3 int, c4 int generated always as(c1+1) virtual);
alter table pt exchange partition M1 with table nt without validation;
drop table pt;
drop table nt;
create table pt(c1 int, c2 char(10), c3 int, c4 int)partition by range(c1)(partition M1 values less than(10), partition M2 values less than(100));
create table nt(c1 int, c2 char(10), c3 int, c4 int);
alter table pt exchange partition M1 with table nt without validation;
drop table pt;
drop table nt;
create table pt (c1 int, c2 int, primary key (c1)) partition by range(c1) (partition M1  VALUES LESS THAN (5), partition M2 VALUES LESS THAN (10), partition M3 VALUES LESS THAN (1000));
create table nt (c1 int, c2 int);
alter table pt exchange partition M1 with table nt WITHOUT VALIDATION;
ERROR HY000: Tables have different definitions
drop table pt;
drop table nt;
create table pt(c1 int, c2 char(10), primary key(c1,c2)) partition by range(c1) (partition M1 values less than(10), partition M2 values less than(100));
create table nt(c1 int, C2 char(10), primary key(c1));
alter table pt exchange partition M1 with table nt without validation;
ERROR HY000: Tables have different definitions
drop table pt;
drop table nt;
create table pt (c1 int, c2 char(20)) partition by range(c1) (partition M1  VALUES LESS THAN (5), partition M2 VALUES LESS THAN (10), partition M3 VALUES LESS THAN (1000));
create table nt (c1 int, c2 char(10));
alter table pt exchange partition M1 with table nt WITHOUT VALIDATION;
ERROR HY000: Tables have different definitions
drop table pt;
drop table nt;
drop table if exists pt_decimal_test1;
Warnings:
Note	1051	Unknown table 'database1.pt_decimal_test1'
CREATE TABLE pt_decimal_test1 (c1 INT PRIMARY KEY , c2 decimal(10,5))PARTITION BY RANGE(c1) (
PARTITION p1 VALUES LESS THAN (10),
PARTITION p2 VALUES LESS THAN (20),
PARTITION p3 VALUES LESS THAN (30));
drop table if exists nt_decimal_test1;
Warnings:
Note	1051	Unknown table 'database1.nt_decimal_test1'
CREATE TABLE nt_decimal_test1 (c1 INT primary KEY, c2 decimal(10,5));
ALTER TABLE pt_decimal_test1 EXCHANGE PARTITION p2 WITH TABLE nt_decimal_test1 WITHOUT VALIDATION;
drop table if exists nt_decimal_test1;
CREATE TABLE nt_decimal_test1 (c1 INT primary KEY, c2 decimal(10,3));
ALTER TABLE pt_decimal_test1 EXCHANGE PARTITION p2 WITH TABLE nt_decimal_test1 WITHOUT VALIDATION;
ERROR HY000: Tables have different definitions
drop table pt_decimal_test1;
drop table nt_decimal_test1;
create table pt (c1 int, c2 TIMESTAMP(3)) partition by range(c1) (partition M1  VALUES LESS THAN (5), partition M2 VALUES LESS THAN (10), partition M3 VALUES LESS THAN (1000));
create table nt (c1 int, c2 TIMESTAMP(2));
alter table pt exchange partition M1 with table nt WITHOUT VALIDATION;
ERROR HY000: Tables have different definitions
drop table nt;
create table nt (c1 int, c2 TIMESTAMP(3));
alter table pt exchange partition M1 with table nt WITHOUT VALIDATION;
drop table pt;
drop table nt;
create table pt (c1 int, c2 int not null) partition by range(c1) (partition M1  VALUES LESS THAN (5), partition M2 VALUES LESS THAN (10), partition M3 VALUES LESS THAN (1000));
create table nt (c1 int, c2 int);
alter table pt exchange partition M1 with table nt WITHOUT VALIDATION;
ERROR HY000: Tables have different definitions
drop table nt;
create table nt (c1 int, c2 int not null);
alter table pt exchange partition M1 with table nt WITHOUT VALIDATION;
drop table pt;
drop table nt;
create table pt (c1 int, update_time TIMESTAMP NOT NULL DEFAULT CURRENT_TIMESTAMP ON UPDATE CURRENT_TIMESTAMP) partition by range(c1) (partition M1  VALUES LESS THAN (5), partition M2 VALUES LESS THAN (10), partition M3 VALUES LESS THAN (1000));
create table nt (c1 int, update_time TIMESTAMP NOT NULL DEFAULT CURRENT_TIMESTAMP);
alter table pt exchange partition M1 with table nt WITHOUT VALIDATION;
ERROR HY000: Tables have different definitions
drop table nt;
create table nt (c1 int, update_time TIMESTAMP NOT NULL DEFAULT CURRENT_TIMESTAMP ON UPDATE CURRENT_TIMESTAMP);
alter table pt exchange partition M1 with table nt WITHOUT VALIDATION;
drop table pt;
drop table nt;
create table pt (c1 int not null auto_increment, c2 int, c3 blob) partition by range(c1)(partition M1  VALUES LESS THAN (5), partition M2 VALUES LESS THAN (10), partition M3 VALUES LESS THAN (1000));
create table nt (c1 int not null, c2 int, c3 blob);
alter table pt exchange partition M1 with table nt WITHOUT VALIDATION;
ERROR 0A000: exchanging partition tables have autoincrement column not supported
drop table nt;
create table nt (c1 int not null auto_increment, c2 int, c3 blob);
alter table pt exchange partition M1 with table nt WITHOUT VALIDATION;
ERROR 0A000: exchanging partition tables have autoincrement column not supported
drop table pt;
drop table nt;
create table pt(c1 int auto_increment primary key, c2 int) partition by range(c1)(partition M1 values less than(10), partition M2 values less than(100));
insert into pt (c1, c2) values(3, 3), (4, 4);
insert into pt (c1, c2) values(30, 30), (31, 31);
create table nt(c1 int auto_increment primary key, c2 int);
insert into nt (c2)values(1), (2);
select * from pt;
c1	c2
3	3
4	4
30	30
31	31
select * from nt;
c1	c2
1	1
2	2
alter table pt exchange partition M2 with table nt without validation;
ERROR 0A000: exchanging partition tables have autoincrement column not supported
drop table pt;
drop table nt;
create table pt (c1 int not null auto_increment, c2 int) partition by range(c1)(partition M1  VALUES LESS THAN (5), partition M2 VALUES LESS THAN (10), partition M3 VALUES LESS THAN (1000));
create table nt (c1 int not null auto_increment, c2 int);
insert into pt values(null, 1);
insert into pt values(null, 1);
insert into pt values(null, 1);
insert into pt values(null, 1);
insert into pt values(null, 1);
insert into pt values(null, 1);
insert into nt values(8,8);
alter table pt exchange partition M2 with table nt WITHOUT VALIDATION;
ERROR 0A000: exchanging partition tables have autoincrement column not supported
drop table pt;
drop table nt;
drop table if exists bmsql_history;
drop table if exists test___bmsql_history;
CREATE TABLE `bmsql_history` (
`hist_id` int(11) NOT NULL AUTO_INCREMENT,
`h_c_id` int(11) DEFAULT NULL,
`h_c_d_id` int(11) DEFAULT NULL,
`h_c_w_id` int(11) DEFAULT NULL,
`h_d_id` int(11) DEFAULT NULL,
`h_w_id` int(11) DEFAULT NULL,
`h_date` timestamp NULL DEFAULT NULL,
`h_amount` decimal(6,2) DEFAULT NULL,
`h_data` varchar(24) DEFAULT NULL
) AUTO_INCREMENT = 4000001 AUTO_INCREMENT_MODE = 'ORDER' DEFAULT CHARSET = utf8mb4 ROW_FORMAT = DYNAMIC COMPRESSION = 'lz4_1.0' REPLICA_NUM = 1 BLOCK_SIZE = 16384 USE_BLOOM_FILTER = FALSE TABLET_SIZE = 134217728 PCTFREE = 0
partition by hash(h_w_id) subpartition by range columns(hist_id) subpartition template (
subpartition `aa1` values less than (12194065),
subpartition `aa2` values less than (21716549),
subpartition `aa3` values less than (28658569),
subpartition `aa4` values less than (32119390),
subpartition `aa5` values less than (32237798),
subpartition `aa6` values less than (33334427),
subpartition `aa7` values less than (40376825),
subpartition `aa8` values less than (42581270),
subpartition `aa9` values less than (51335044),
subpartition `aa10` values less than (MAXVALUE))
(partition `M1`,
partition `M2`,
partition `M3`) WITH COLUMN GROUP(each column);
CREATE TABLE `test___bmsql_history` (
`hist_id` int(11) NOT NULL AUTO_INCREMENT,
`h_c_id` int(11) DEFAULT NULL,
`h_c_d_id` int(11) DEFAULT NULL,
`h_c_w_id` int(11) DEFAULT NULL,
`h_d_id` int(11) DEFAULT NULL,
`h_w_id` int(11) DEFAULT NULL,
`h_date` timestamp NULL DEFAULT NULL,
`h_amount` decimal(6,2) DEFAULT NULL,
`h_data` varchar(24) DEFAULT NULL
) AUTO_INCREMENT = 2376001 AUTO_INCREMENT_MODE = 'ORDER' DEFAULT CHARSET = utf8mb4 ROW_FORMAT = DYNAMIC COMPRESSION = 'lz4_1.0' REPLICA_NUM = 1 BLOCK_SIZE = 16384 USE_BLOOM_FILTER = FALSE TABLET_SIZE = 134217728 PCTFREE = 0 WITH COLUMN GROUP(each column);
ALTER TABLE bmsql_history EXCHANGE PARTITION M1saa5 WITH TABLE test___bmsql_history WITHOUT VALIDATION;
ERROR 0A000: exchanging partition tables have autoincrement column not supported
drop table if exists bmsql_history;
drop table if exists test___bmsql_history;
CREATE TABLE pt_default_test1 (c1 INT PRIMARY KEY, c2 int DEFAULT 2) PARTITION BY RANGE(c1) (
PARTITION p1 VALUES LESS THAN (10),
PARTITION p2 VALUES LESS THAN (20),
PARTITION p3 VALUES LESS THAN (30));
drop table if exists nt_default_test1;
Warnings:
Note	1051	Unknown table 'database1.nt_default_test1'
CREATE TABLE nt_default_test1 (c1 INT primary KEY, c2 int DEFAULT 2);
ALTER TABLE pt_default_test1 EXCHANGE PARTITION p2 WITH TABLE nt_default_test1 WITHOUT VALIDATION;
drop table nt_default_test1;
CREATE TABLE nt_default_test1 (c1 INT primary KEY,c2 int DEFAULT 3);
ALTER TABLE pt_default_test1 EXCHANGE PARTITION p2 WITH TABLE nt_default_test1 WITHOUT VALIDATION;
ERROR HY000: Tables have different definitions
drop table pt_default_test1;
drop table nt_default_test1;
create table pt (c1 int not null primary key, c2 int, c3 blob) partition by range(c1)(partition M1  VALUES LESS THAN (5), partition M2 VALUES LESS THAN (10), partition M3 VALUES LESS THAN (1000));
create table nt (c1 int not null primary key, c2 int, c3 int);
alter table pt exchange partition M1 with table nt WITHOUT VALIDATION;
ERROR HY000: Tables have different definitions
drop table nt;
create table nt (c1 int not null primary key, c2 int, c3 blob);
alter table pt exchange partition M1 with table nt WITHOUT VALIDATION;
drop table if exists pt;
drop table if exists nt;
create table pt (c1 int not null primary key, c2 int, c3 blob, hobbies SET('reading', 'music', 'sports', 'travel', 'food')) partition by range(c1)(partition M1  VALUES LESS THAN (5), partition M2 VALUES LESS THAN (10), partition M3 VALUES LESS THAN (1000));
create table nt (c1 int not null primary key, c2 int, c3 blob, hobbies SET('reading', 'music', 'sports', 'food', 'travel'));
alter table pt exchange partition M1 with table nt WITHOUT VALIDATION;
ERROR HY000: Tables have different definitions
drop table pt;
drop table nt;
create table pt (c1 int not null primary key, c2 int, c3 blob, hobbies SET('reading', 'music', 'sports', 'travel', 'food')) partition by range(c1)(partition M1  VALUES LESS THAN (5), partition M2 VALUES LESS THAN (10), partition M3 VALUES LESS THAN (1000));
create table nt (c1 int not null primary key, c2 int, c3 blob, hobbies SET('reading', 'music', 'sports', 'travel'));
alter table pt exchange partition M1 with table nt WITHOUT VALIDATION;
ERROR HY000: Tables have different definitions
drop table if exists nt;
create table nt (c1 int not null primary key, c2 int, c3 blob, hobbies SET('reading', 'music', 'sports', 'travel', 'food'));
alter table pt exchange partition M1 with table nt WITHOUT VALIDATION;
drop table if exists pt;
drop table if exists nt;
create table pt (c1 int not null primary key, c2 int, c3 blob, priority ENUM('Low', 'Medium', 'High') NOT NULL) partition by range(c1)(partition M1  VALUES LESS THAN (5), partition M2 VALUES LESS THAN (10), partition M3 VALUES LESS THAN (1000));
create table nt (c1 int not null primary key, c2 int, c3 blob, priority ENUM('Low', 'High', 'Medium') NOT NULL);
alter table pt exchange partition M1 with table nt WITHOUT VALIDATION;
ERROR HY000: Tables have different definitions
drop table if exists nt;
create table nt (c1 int not null primary key, c2 int, c3 blob, priority ENUM('Low', 'Medium') NOT NULL);
alter table pt exchange partition M1 with table nt WITHOUT VALIDATION;
ERROR HY000: Tables have different definitions
drop table nt;
create table nt (c1 int not null primary key, c2 int, c3 blob, priority ENUM('Low', 'Medium', 'High') NOT NULL);
alter table pt exchange partition M1 with table nt WITHOUT VALIDATION;
drop table pt;
drop table nt;
drop table if exists pt_decimal_test1;
Warnings:
Note	1051	Unknown table 'database1.pt_decimal_test1'
CREATE TABLE pt_decimal_test1 (c1 INT PRIMARY KEY, c2 decimal(10,5), c3 float NOT null, c4 double DEFAULT 3.1415926) PARTITION BY RANGE(c1) (
PARTITION p1 VALUES LESS THAN (10),
PARTITION p2 VALUES LESS THAN (20),
PARTITION p3 VALUES LESS THAN (30));
drop table if exists nt_decimal_test1;
Warnings:
Note	1051	Unknown table 'database1.nt_decimal_test1'
CREATE TABLE nt_decimal_test1 (
c1 INT primary KEY,
c2 decimal(10,5),
c3 float NOT null,
c4 double DEFAULT 3.14159);
ALTER TABLE pt_decimal_test1 EXCHANGE PARTITION p2 WITH TABLE nt_decimal_test1 WITHOUT VALIDATION;
ERROR HY000: Tables have different definitions
drop table if exists pt_date_test1;
Warnings:
Note	1051	Unknown table 'database1.pt_date_test1'
CREATE TABLE pt_date_test1 (c1 INT PRIMARY KEY , c2 datetime, c3 YEAR, c4 timestamp, c5 time) PARTITION BY RANGE(c1) (
PARTITION p1 VALUES LESS THAN (10),
PARTITION p2 VALUES LESS THAN (20),
PARTITION p3 VALUES LESS THAN (30));
drop table if exists nt_date_test1;
Warnings:
Note	1051	Unknown table 'database1.nt_date_test1'
CREATE TABLE nt_date_test1 (
c1 INT PRIMARY KEY ,
c2 datetime,
c3 YEAR,
c4 timestamp,
c5 time
);
ALTER TABLE pt_date_test1 EXCHANGE PARTITION p2 WITH TABLE nt_date_test1 WITHOUT VALIDATION;
drop table if exists pt_varchar_test1;
Warnings:
Note	1051	Unknown table 'database1.pt_varchar_test1'
CREATE TABLE pt_varchar_test1 (c1 INT PRIMARY KEY, c2 varchar(30), c3 char(30)) PARTITION BY RANGE(c1) (
PARTITION p1 VALUES LESS THAN (10),
PARTITION p2 VALUES LESS THAN (20),
PARTITION p3 VALUES LESS THAN (30));
drop table if exists nt_varchar_test1;
Warnings:
Note	1051	Unknown table 'database1.nt_varchar_test1'
CREATE TABLE nt_varchar_test1 (
c1 INT primary KEY,
c2 varchar(30),
c3 char(30));
ALTER TABLE pt_varchar_test1 EXCHANGE PARTITION p2 WITH TABLE nt_varchar_test1 WITHOUT VALIDATION;
drop table if exists nt_varchar_test1;
CREATE TABLE nt_varchar_test1 (
c1 INT primary KEY,
c2 varchar(35),
c3 char(36));
ALTER TABLE pt_varchar_test1 EXCHANGE PARTITION p2 WITH TABLE nt_varchar_test1 WITHOUT VALIDATION;
ERROR HY000: Tables have different definitions
drop table if exists pt_bit_test1;
Warnings:
Note	1051	Unknown table 'database1.pt_bit_test1'
CREATE TABLE pt_bit_test1 (c1 INT PRIMARY KEY , c2 bit) PARTITION BY RANGE(c1) (
PARTITION p1 VALUES LESS THAN (10),
PARTITION p2 VALUES LESS THAN (20),
PARTITION p3 VALUES LESS THAN (30));
drop table if exists nt_bit_test1;
Warnings:
Note	1051	Unknown table 'database1.nt_bit_test1'
CREATE TABLE nt_bit_test1 (
c1 INT primary KEY,
c2 bit(1)
);
ALTER TABLE pt_bit_test1 EXCHANGE PARTITION p2 WITH TABLE nt_bit_test1 WITHOUT VALIDATION;
drop table if exists nt_bit_test1;
CREATE TABLE nt_bit_test1 (
c1 INT primary KEY,
c2 bit(20)
);
ALTER TABLE pt_bit_test1 EXCHANGE PARTITION p2 WITH TABLE nt_bit_test1 WITHOUT VALIDATION;
ERROR HY000: Tables have different definitions
create table pt(c1 int, c2 char(10)) partition by range(c1)(partition M1 values less than(10), partition M2 values less than(100));
create table nt(c1 int, c2 char(10));
create unique index idx on pt(c1, c2);
create unique index idx2 on nt(c1, c2);
insert into pt values(1, 1);
insert into nt values(2, 2);
select * from pt order by c1;
c1	c2
1	1
select * from nt order by c1;
c1	c2
2	2
alter table pt exchange partition M1 with table nt without validation;
ERROR HY000: Tables have different definitions
alter table nt drop index idx2;
create unique index idx on nt(c1, c2);
alter table pt exchange partition M1 with table nt without validation;
select * from pt order by c1;
c1	c2
2	2
select * from nt order by c1;
c1	c2
1	1
drop table pt;
drop table nt;
create table pt(c1 int, c2 char(10)) partition by range(c1)(partition M1 values less than(10), partition M2 values less than(100));
create table nt(c1 int, c2 char(10));
create unique index idx on pt(c1, c2);
create index idx on nt(c1, c2);
alter table pt exchange partition M1 with table nt without validation;
ERROR HY000: Tables have different definitions
drop table pt;
drop table nt;
create table pt(c1 int, c2 char(10)) partition by range(c1)(partition M1 values less than(10), partition M2 values less than(100));
create table nt(c1 int, c2 char(10));
create index idx on pt(c1, c2);
create index idx on nt(c1);
alter table pt exchange partition M1 with table nt without validation;
ERROR HY000: Tables have different definitions
drop table pt;
drop table nt;
create table pt(c1 int, c2 char(10)) partition by range(c1)(partition M1 values less than(10), partition M2 values less than(100));
create table nt(c1 int, c2 char(10));
create index idx on pt(c1, c2) global;
create index idx1 on pt(c1);
create index idx1 on nt(c1);
alter table pt exchange partition M1 with table nt without validation;
drop table pt;
drop table nt;
create table pt(c1 int, c2 char(10)) partition by range(c1)(partition M1 values less than(10), partition M2 values less than(100));
create table nt(c1 int, c2 char(10));
create index idx on pt(c1, c2) global;
create index idx on nt(c1, c2) global;
alter table pt exchange partition M1 with table nt without validation;
ERROR HY000: Tables have different definitions
drop table pt;
drop table nt;
drop table if exists pt_index_test1;
Warnings:
Note	1051	Unknown table 'database1.pt_index_test1'
CREATE TABLE pt_index_test1 (c1 INT NOT NULL,c2 VARCHAR(50) NOT NULL,PRIMARY KEY (c1))
PARTITION BY RANGE(c1) (
PARTITION p1 VALUES LESS THAN (10),
PARTITION p2 VALUES LESS THAN (20),
PARTITION p3 VALUES LESS THAN (30));
drop table if exists nt_index_test1;
Warnings:
Note	1051	Unknown table 'database1.nt_index_test1'
CREATE TABLE nt_index_test1 (c1 INT primary key NOT NULL,c2 VARCHAR(50) NOT NULL);
CREATE INDEX index_nt_c1 ON nt_index_test1 (c1);
ALTER TABLE pt_index_test1 EXCHANGE PARTITION p2 WITH TABLE nt_index_test1 WITHOUT VALIDATION;
ERROR HY000: Tables have different definitions
CREATE INDEX index_pt_c1 ON pt_index_test1 (c1);
ALTER TABLE pt_index_test1 EXCHANGE PARTITION p2 WITH TABLE nt_index_test1 WITHOUT VALIDATION;
ERROR HY000: Tables have different definitions
drop index index_pt_c1 on pt_index_test1;
CREATE INDEX index_nt_c1 ON pt_index_test1 (c1);
ALTER TABLE pt_index_test1 EXCHANGE PARTITION p2 WITH TABLE nt_index_test1 WITHOUT VALIDATION;
CREATE UNIQUE INDEX idx_uq_nt_c1 ON nt_index_test1 (c1);
ALTER TABLE pt_index_test1 EXCHANGE PARTITION p2 WITH TABLE nt_index_test1 WITHOUT VALIDATION;
ERROR HY000: Tables have different definitions
CREATE UNIQUE INDEX idx_uq_pt_c1 ON pt_index_test1 (c1);
ALTER TABLE pt_index_test1 EXCHANGE PARTITION p2 WITH TABLE nt_index_test1 WITHOUT VALIDATION;
ERROR HY000: Tables have different definitions
drop index idx_uq_pt_c1 on pt_index_test1;
CREATE UNIQUE INDEX idx_uq_nt_c1 ON pt_index_test1 (c1);
ALTER TABLE pt_index_test1 EXCHANGE PARTITION p2 WITH TABLE nt_index_test1 WITHOUT VALIDATION;
create table pt(c1 int primary key, c2 char(10), c3 int, unique(c1, c3)) partition by range(c1)(partition M1 values less than(60), partition M2 values less than(100));
create table nt(c1 int primary key, c2 char(10), c3 int, unique(c1, c3));
insert into pt values(50, 50, 50);
insert into nt values(60, 60, 60);
select * from pt order by c1;
c1	c2	c3
50	50	50
select * from nt order by c1;
c1	c2	c3
60	60	60
alter table pt exchange partition M1 with table nt without validation;
select * from pt order by c1;
c1	c2	c3
60	60	60
select * from nt order by c1;
c1	c2	c3
50	50	50
drop table pt;
drop table nt;
create table pt(c1 int primary key, c2 char(10), c3 int, unique(c1)) partition by range(c1)(partition M1 values less than(60), partition M2 values less than(100));
create table nt(c1 int primary key, c2 char(10), c3 int, unique(c1, c3));
alter table pt exchange partition M1 with table nt without validation;
ERROR HY000: Tables have different definitions
drop table pt;
drop table nt;
create table pt(c1 int primary key, c2 char(10), c3 int, unique(c1, c3)) partition by range(c1)(partition M1 values less than(60), partition M2 values less than(100));
create table nt(c1 int primary key, c2 char(10), c3 int, unique(c3));
alter table pt exchange partition M1 with table nt without validation;
ERROR HY000: Tables have different definitions
drop table pt;
drop table nt;
create table pt(c1 int, c2 char(10), c3 int not null) partition by range(c1)(partition M1 values less than(10), partition M2 values less than(100));
create table nt(c1 int, c2 char(10) not null, c3 int);
alter table pt exchange partition M2 with table nt without validation;
ERROR HY000: Tables have different definitions
drop table pt;
drop table nt;
create table pt(c1 int, c2 char(10), c3 int not null) partition by range(c1)(partition M1 values less than(10), partition M2 values less than(100));
create table nt(c1 int, c2 char(10), c3 int);
alter table pt exchange partition M2 with table nt without validation;
ERROR HY000: Tables have different definitions
drop table pt;
create table pt(c1 int, c2 char(10) not null, c3 int) partition by range(c1)(partition M1 values less than(10), partition M2 values less than(100));
alter table pt exchange partition M2 with table nt without validation;
ERROR HY000: Tables have different definitions
drop table pt;
drop table nt;
create table pt(c1 int, c2 char(10), c3 int default null) partition by range(c1)(partition M1 values less than(10), partition M2 values less than(100));
create table nt(c1 int, c2 char(10), c3 int default null);
alter table pt exchange partition M2 with table nt without validation;
alter table nt modify c3 int not null;
alter table pt exchange partition M2 with table nt without validation;
ERROR HY000: Tables have different definitions
drop table pt;
drop table nt;
create table pt(c1 int, c2 char(10), c3 int, check(c1=50)) partition by range(c1)(partition M1 values less than(10), partition M2 values less than(100));
create table nt(c1 int, c2 char(10), c3 int, check(c2=c3));
alter table pt exchange partition M1 with table nt without validation;
ERROR HY000: Tables have different definitions
drop table nt;
create table nt(c1 int, c2 char(10), c3 int, check(c1=50));
insert into pt values(50, 50, 50);
insert into nt values(50, 50, 50);
select * from pt order by c1;
c1	c2	c3
50	50	50
select * from nt order by c1;
c1	c2	c3
50	50	50
alter table pt exchange partition M1 with table nt without validation;
select * from pt order by c1;
c1	c2	c3
50	50	50
50	50	50
select * from nt order by c1;
c1	c2	c3
drop table pt;
drop table nt;
create table nt(c1 int primary key, c2 int);
create table t0(c1 int primary key, c2 int);
create table pt(c1 int primary key, c2 int, constraint foreign key (c2) references t0(c1)) partition by range(c1) (partition M1 values less than(10), partition M2 values less than(100));
alter table pt exchange partition M1 with table nt without validation;
ERROR 0A000: exchanging partition tables have foreign key are not supported
drop table nt;
drop table pt;
drop table t0;
create table pt(c1 int primary key, c2 int) partition by range(c1) (partition M1 values less than(10), partition M2 values less than(100));
create table nt(c1 int primary key, c2 int);
create table t0(c1 int, c2 int, foreign key (c1) references pt(c1));
alter table pt exchange partition M1 with table nt without validation;
ERROR 0A000: exchanging partition tables have foreign key are not supported
drop table t0;
drop table pt;
drop table nt;
create table t0(c1 int primary key, c2 int);
create table nt(c1 int primary key, c2 int, constraint foreign key (c2) references t0(c1));
create table pt(c1 int primary key, c2 int) partition by range(c1) (partition M1 values less than(10), partition M2 values less than(100));
alter table pt exchange partition M1 with table nt without validation;
ERROR 0A000: exchanging partition tables have foreign key are not supported
drop table nt;
drop table t0;
drop table pt;
create table pt(c1 int primary key, c2 int) partition by range(c1) (partition M1 values less than(10), partition M2 values less than(100));
create table nt(c1 int primary key, c2 int);
create table t0(c1 int, c2 int, foreign key (c1) references nt(c1));
alter table pt exchange partition M1 with table nt without validation;
ERROR 0A000: exchanging partition tables have foreign key are not supported
drop table t0;
drop table pt;
drop table nt;
create table pt(c1 int primary key, c2 int) partition by range(c1) (partition M1 values less than(10), partition M2 values less than(100));
create table nt(c1 int primary key, c2 int);
create table t0(c1 int, c2 int, foreign key (c1) references nt(c1));
create table t1(c1 int, c2 int, foreign key (c1) references pt(c1));
alter table pt exchange partition M1 with table nt without validation;
ERROR 0A000: exchanging partition tables have foreign key are not supported
drop table t0;
drop table t1;
drop table pt;
drop table nt;
use database1;
set ob_query_timeout = 100000000000000;
create table pt (c1 bigint primary key, c2 bigint, c3 blob) partition by range(c1) (partition M1  VALUES LESS THAN (50000));
create table nt (c1 bigint primary key, c2 bigint, c3 blob);
insert into pt(c1, c2) values(1,1);
insert into pt(c1, c2) values(2,2);
insert into pt(c1, c2) values(3,3);
insert into pt(c1, c2) values(4,4);
insert into pt(c1, c2) values(5,5);
insert into pt(c1, c2) values(6,6);
insert into pt(c1, c2) values(7,7);
insert into pt(c1, c2) values(8,8);
insert into pt(c1, c2) values(9,9);
insert into pt(c1, c2) values(10,10);
insert into pt(c1, c2) values(11,11);
insert into pt(c1, c2) values(12,12);
insert into pt(c1, c2) values(13,13);
insert into pt(c1, c2) values(14,14);
insert into pt(c1, c2) values(15,15);
insert into nt(c1, c2) values(21,21);
insert into nt(c1, c2) values(22,22);
insert into nt(c1, c2) values(23,23);
insert into nt(c1, c2) values(24,24);
insert into nt(c1, c2) values(25,25);
insert into nt(c1, c2) values(26,26);
insert into nt(c1, c2) values(27,27);
insert into nt(c1, c2) values(28,28);
insert into nt(c1, c2) values(29,29);
insert into nt(c1, c2) values(30,30);
insert into nt(c1, c2) values(31,31);
insert into nt(c1, c2) values(32,32);
insert into nt(c1, c2) values(33,33);
insert into nt(c1, c2) values(34,34);
insert into nt(c1, c2) values(35,35);
create index idx on pt(c1,c2);
create index idx on nt(c1,c2);
select count(*) from pt;
count(*)
15
select count(*) from nt;
count(*)
15
alter table pt exchange partition M1 with table nt without validation;
alter table nt drop column c2;
truncate table nt;
alter system minor freeze;
ALTER SYSTEM MAJOR FREEZE;
use database1;
select count(*) from pt;
count(*)
15
select count(*) from nt;
count(*)
0
drop table if exists pt;
drop table if exists nt;
alter system set debug_sync_timeout = '60s';
set ob_global_debug_sync = 'reset';
use database1;
create table pt (c1 bigint primary key , c2 bigint, c3 blob) partition by range(c1) (partition M1  VALUES LESS THAN (500000), partition M2 VALUES LESS THAN (1000000), partition M3 VALUES LESS THAN (20000000));
create table nt (c1 bigint primary key , c2 bigint, c3 blob);
set ob_global_debug_sync = 'reset';
set ob_global_debug_sync='BEFORE_ALTER_TABLE_EXCHANGE_PARTITION wait_for continue_signal';
use database1;
alter table pt exchange partition M3 with table nt without validation;
use database1;
alter table pt drop column c3;
set ob_global_debug_sync = 'reset';
set ob_global_debug_sync = 'now signal continue_signal';
drop table if exists pt;
drop table if exists nt;
create table pt (c1 int, c2 int, c3 blob) partition by range(c1) (partition M1  VALUES LESS THAN (5), partition M2 VALUES LESS THAN (10), partition M3 VALUES LESS THAN (20));
insert into pt(c1, c2) values(1,1);
insert into pt(c1, c2) values(2,2);
insert into pt(c1, c2) values(3,3);
insert into pt(c1, c2) values(4,4);
insert into pt(c1, c2) values(5,5);
insert into pt(c1, c2) values(6,6);
insert into pt(c1, c2) values(7,7);
insert into pt(c1, c2) values(8,8);
insert into pt(c1, c2) values(9,9);
insert into pt(c1, c2) values(10,10);
insert into pt(c1, c2) values(11,11);
insert into pt(c1, c2) values(12,12);
insert into pt(c1, c2) values(13,13);
insert into pt(c1, c2) values(14,14);
insert into pt(c1, c2) values(15,15);
create index local_idx on pt(c1, c2);
create index pt_global_idx on pt(c2) global;
create table nt (c1 int, c2 int, c3 blob);
insert into nt(c1, c2) values(21,21);
insert into nt(c1, c2) values(22,22);
insert into nt(c1, c2) values(23,23);
insert into nt(c1, c2) values(24,24);
insert into nt(c1, c2) values(25,25);
insert into nt(c1, c2) values(26,26);
insert into nt(c1, c2) values(27,27);
insert into nt(c1, c2) values(28,28);
insert into nt(c1, c2) values(29,29);
insert into nt(c1, c2) values(30,30);
insert into nt(c1, c2) values(31,31);
insert into nt(c1, c2) values(32,32);
insert into nt(c1, c2) values(33,33);
insert into nt(c1, c2) values(34,34);
insert into nt(c1, c2) values(35,35);
create index local_idx on nt(c1, c2);
alter table pt exchange partition M1 with table nt WITHOUT VALIDATION;
create table copy_pt as select c1,c2,c3 from pt;
create table copy_nt as select c1,c2,c3 from nt;
select * from copy_pt order by c1;
c1	c2	c3
5	5	NULL
6	6	NULL
7	7	NULL
8	8	NULL
9	9	NULL
10	10	NULL
11	11	NULL
12	12	NULL
13	13	NULL
14	14	NULL
15	15	NULL
21	21	NULL
22	22	NULL
23	23	NULL
24	24	NULL
25	25	NULL
26	26	NULL
27	27	NULL
28	28	NULL
29	29	NULL
30	30	NULL
31	31	NULL
32	32	NULL
33	33	NULL
34	34	NULL
35	35	NULL
select * from copy_nt order by c1;
c1	c2	c3
1	1	NULL
2	2	NULL
3	3	NULL
4	4	NULL
drop table copy_pt;
drop table copy_nt;
drop table pt;
drop table nt;
alter system set debug_sync_timeout = '60s';
set ob_global_debug_sync = 'reset';
use database1;
drop table if exists pt;
drop table if exists nt;
create table pt (c1 int, c2 int not null default 100, c3 blob, c4 int, CONSTRAINT check_pt check(c2 > 0)) partition by range(c1) (partition M1  VALUES LESS THAN (5), partition M2 VALUES LESS THAN (10), partition M3 VALUES LESS THAN (20));
insert into pt(c1, c2) values(1,1);
insert into pt(c1, c2) values(2,2);
insert into pt(c1, c2) values(3,3);
insert into pt(c1, c2) values(4,4);
insert into pt(c1, c2) values(5,5);
insert into pt(c1, c2) values(6,6);
insert into pt(c1, c2) values(7,7);
insert into pt(c1, c2) values(8,8);
insert into pt(c1, c2) values(9,9);
create index pt_global_idx on pt(c2) global;
create index local_idx on pt(c2) local;
create table nt (c1 int, c2 int not null default 100, c3 blob, c4 int, CONSTRAINT check_nt check(c2 > 0));
insert into nt(c1, c2) values(30,30);
insert into nt(c1, c2) values(31,31);
insert into nt(c1, c2) values(32,32);
insert into nt(c1, c2) values(33,33);
insert into nt(c1, c2) values(34,34);
insert into nt(c1, c2) values(35,35);
create index local_idx on nt(c2);
set ob_global_debug_sync = 'reset';
set ob_global_debug_sync='BEFORE_ALTER_TABLE_EXCHANGE_PARTITION wait_for continue_signal';
use database1;
alter table pt exchange partition M1 with table nt without validation;
use database1;
select * from pt order by c1;
c1	c2	c3	c4
1	1	NULL	NULL
2	2	NULL	NULL
3	3	NULL	NULL
4	4	NULL	NULL
5	5	NULL	NULL
6	6	NULL	NULL
7	7	NULL	NULL
8	8	NULL	NULL
9	9	NULL	NULL
select * from nt order by c1;
c1	c2	c3	c4
30	30	NULL	NULL
31	31	NULL	NULL
32	32	NULL	NULL
33	33	NULL	NULL
34	34	NULL	NULL
35	35	NULL	NULL
ALTER TABLE nt DROP CONSTRAINT check_nt;
use database1;
select * from pt order by c1;
c1	c2	c3	c4
1	1	NULL	NULL
2	2	NULL	NULL
3	3	NULL	NULL
4	4	NULL	NULL
5	5	NULL	NULL
6	6	NULL	NULL
7	7	NULL	NULL
8	8	NULL	NULL
9	9	NULL	NULL
select * from nt order by c1;
c1	c2	c3	c4
30	30	NULL	NULL
31	31	NULL	NULL
32	32	NULL	NULL
33	33	NULL	NULL
34	34	NULL	NULL
35	35	NULL	NULL
ALTER TABLE pt DROP index pt_global_idx;
use database1;
select * from pt order by c1;
c1	c2	c3	c4
1	1	NULL	NULL
2	2	NULL	NULL
3	3	NULL	NULL
4	4	NULL	NULL
5	5	NULL	NULL
6	6	NULL	NULL
7	7	NULL	NULL
8	8	NULL	NULL
9	9	NULL	NULL
select * from nt order by c1;
c1	c2	c3	c4
30	30	NULL	NULL
31	31	NULL	NULL
32	32	NULL	NULL
33	33	NULL	NULL
34	34	NULL	NULL
35	35	NULL	NULL
ALTER TABLE nt DROP column c3;
set ob_global_debug_sync = 'reset';
set ob_global_debug_sync = 'now signal continue_signal';
alter system set debug_sync_timeout = '60s';
set ob_global_debug_sync = 'reset';
use database1;
drop table if exists pt;
drop table if exists nt;
create table pt (c1 int, c2 int not null default 100, c3 blob, c4 int, CONSTRAINT check_pt check(c2 > 0)) partition by range(c1) (partition M1  VALUES LESS THAN (5), partition M2 VALUES LESS THAN (10), partition M3 VALUES LESS THAN (20));
insert into pt(c1, c2) values(1,1);
insert into pt(c1, c2) values(2,2);
insert into pt(c1, c2) values(3,3);
insert into pt(c1, c2) values(4,4);
insert into pt(c1, c2) values(5,5);
insert into pt(c1, c2) values(5,5);
insert into pt(c1, c2) values(6,6);
insert into pt(c1, c2) values(7,7);
insert into pt(c1, c2) values(8,8);
insert into pt(c1, c2) values(9,9);
create index pt_global_idx on pt(c2) global;
create index local_idx on pt(c2) local;
create table nt (c1 int, c2 int not null default 100, c3 blob, c4 int, CONSTRAINT check_nt check(c2 > 0));
insert into nt(c1, c2) values(30,30);
insert into nt(c1, c2) values(31,31);
insert into nt(c1, c2) values(32,32);
insert into nt(c1, c2) values(33,33);
insert into nt(c1, c2) values(34,34);
insert into nt(c1, c2) values(35,35);
create index local_idx on nt(c2);
set ob_global_debug_sync = 'reset';
set ob_global_debug_sync='BEFORE_ALTER_TABLE_EXCHANGE_PARTITION wait_for continue_signal';
use database1;
alter table pt exchange partition M1 with table nt without validation;
use database1;
select * from pt partition(M2) order by c1;
c1	c2	c3	c4
5	5	NULL	NULL
5	5	NULL	NULL
6	6	NULL	NULL
7	7	NULL	NULL
8	8	NULL	NULL
9	9	NULL	NULL
update pt set c2 = 777 where c1 = 7;
update pt set c2 = 888 where c1 = 8;
update pt set c2 = 999 where c1 = 9;
delete from pt where c1 = 5;
delete from pt where c1 = 6;
insert into pt (c1,c2) values(10,10);
insert into pt (c1,c2) values(11,11);
insert into pt (c1,c2) values(12,12);
insert into pt (c1,c2) values(13,13);
select * from pt partition(M2) order by c1;
c1	c2	c3	c4
7	777	NULL	NULL
8	888	NULL	NULL
9	999	NULL	NULL
use database1;
select * from pt partition(M1) order by c1;
use database1;
update pt set c2 = 444 where c1 = 4;
use database1;
delete from pt where c1 = 1;
use database1;
update nt set c2 = 3222 where c1 = 32;
set ob_global_debug_sync = 'reset';
set ob_global_debug_sync = 'now signal continue_signal';
c1	c2	c3	c4
1	1	NULL	NULL
2	2	NULL	NULL
3	3	NULL	NULL
4	4	NULL	NULL
use database1;
select * from pt order by c1;
c1	c2	c3	c4
7	777	NULL	NULL
8	888	NULL	NULL
9	999	NULL	NULL
10	10	NULL	NULL
11	11	NULL	NULL
12	12	NULL	NULL
13	13	NULL	NULL
30	30	NULL	NULL
31	31	NULL	NULL
32	3222	NULL	NULL
33	33	NULL	NULL
34	34	NULL	NULL
35	35	NULL	NULL
select * from nt order by c1;
c1	c2	c3	c4
2	2	NULL	NULL
3	3	NULL	NULL
4	444	NULL	NULL
use database1;
drop table if exists pt;
drop table if exists nt;
set ob_query_timeout = 100000000000000;
create table pt (c1 bigint primary key, c2 bigint, c3 blob) partition by range(c1) (partition M1  VALUES LESS THAN (50000), partition M2 VALUES LESS THAN (100000), partition M3 VALUES LESS THAN (200000));
create table nt (c1 bigint primary key, c2 bigint, c3 blob);
ALTER TABLE nt ADD COLUMN GROUP(each column);
alter table pt exchange partition M3 with table nt without validation;
ERROR HY000: Non matching attribute 'COLUMN_STORAGE_FORMAT' between partition and table
ALTER TABLE pt ADD COLUMN GROUP(each column);
alter table pt exchange partition M3 with table nt without validation;
ALTER TABLE nt drop COLUMN GROUP(each column);
alter table pt exchange partition M3 with table nt without validation;
ERROR HY000: Non matching attribute 'COLUMN_STORAGE_FORMAT' between partition and table
ALTER TABLE pt drop COLUMN GROUP(each column);
alter table pt exchange partition M3 with table nt without validation;
ALTER TABLE nt ADD COLUMN GROUP(all columns, each column);
alter table pt exchange partition M3 with table nt without validation;
ERROR HY000: Non matching attribute 'COLUMN_STORAGE_FORMAT' between partition and table
ALTER TABLE pt ADD COLUMN GROUP(all columns, each column);
alter table pt exchange partition M3 with table nt without validation;
ALTER TABLE nt drop COLUMN GROUP(each column);
alter table pt exchange partition M3 with table nt without validation;
ERROR HY000: Non matching attribute 'COLUMN_STORAGE_FORMAT' between partition and table
ALTER TABLE pt drop COLUMN GROUP(each column);
alter table pt exchange partition M3 with table nt without validation;
drop table pt;
drop table nt;
create table pt (c1 bigint primary key, c2 bigint, c3 blob) partition by range(c1) (partition M1  VALUES LESS THAN (50000), partition M2 VALUES LESS THAN (100000), partition M3 VALUES LESS THAN (200000));
create table nt (c1 bigint primary key, c2 bigint, c3 blob);
alter table pt add column group (each column);
alter table nt add column group (each column);
alter table pt add column group (all columns);
alter table nt add column group (all columns);
alter table pt exchange partition M3 with table nt without validation;
drop table pt;
drop table nt;
create table pt (c1 bigint primary key, c2 bigint, c3 blob) partition by range(c1) (partition M1  VALUES LESS THAN (50000), partition M2 VALUES LESS THAN (100000), partition M3 VALUES LESS THAN (200000));
create table nt (c1 bigint primary key, c2 bigint, c3 blob);
alter table pt add column group (each column);
alter table nt add column group (each column);
alter table pt add column group (all columns);
alter table nt add column group (all columns);
alter table nt drop column group (all columns);
alter table nt add column group (all columns);
alter table pt exchange partition M3 with table nt without validation;
drop table pt;
drop table nt;
create table pt (c1 bigint primary key, c2 bigint, c3 blob) partition by range(c1) (partition M1  VALUES LESS THAN (50000), partition M2 VALUES LESS THAN (100000), partition M3 VALUES LESS THAN (200000));
create table nt (c1 bigint primary key, c2 bigint, c3 blob);
alter table pt add column group (each column);
alter table pt add column group (all columns);
alter table nt add column group (all columns);
alter table nt add column group (each column);
alter table pt exchange partition M3 with table nt without validation;
drop table pt;
drop table nt;
create table pt (c1 int, c2 int) partition by range(c1) (partition M1  VALUES LESS THAN (5), partition M2 VALUES LESS THAN (10), partition M3 VALUES LESS THAN (1000));
create table nt (c1 int, c2 int) WITH COLUMN GROUP(all columns, each column);
alter table pt add COLUMN GROUP(all columns, each column);
alter table pt exchange partition M3 with table nt without validation;
alter table nt drop COLUMN GROUP(all columns, each column);
alter table pt exchange partition M3 with table nt without validation;
ERROR HY000: Non matching attribute 'COLUMN_STORAGE_FORMAT' between partition and table
alter table nt add COLUMN GROUP(all columns, each column);
alter table pt exchange partition M3 with table nt without validation;
alter table pt drop COLUMN GROUP(all columns, each column);
alter table pt exchange partition M3 with table nt without validation;
ERROR HY000: Non matching attribute 'COLUMN_STORAGE_FORMAT' between partition and table
alter table pt add COLUMN GROUP(all columns, each column);
alter table pt exchange partition M3 with table nt without validation;
alter table pt drop COLUMN GROUP(all columns);
alter table pt exchange partition M3 with table nt without validation;
ERROR HY000: Non matching attribute 'COLUMN_STORAGE_FORMAT' between partition and table
alter table pt add COLUMN GROUP(all columns);
alter table pt exchange partition M3 with table nt without validation;
drop table pt;
drop table nt;
create table pt (c1 int, c2 int) partition by range(c1) (partition M1  VALUES LESS THAN (5), partition M2 VALUES LESS THAN (10), partition M3 VALUES LESS THAN (1000));
create table nt (c1 int, c2 int) WITH COLUMN GROUP(all columns, each column);
alter table pt add COLUMN GROUP(all columns, each column);
alter table pt exchange partition M3 with table nt without validation;
alter table pt drop COLUMN GROUP(each column);
alter table pt add COLUMN GROUP(each column);
alter table pt exchange partition M3 with table nt without validation;
alter table pt drop COLUMN GROUP(all columns);
alter table pt add COLUMN GROUP(all columns);
alter table pt exchange partition M3 with table nt without validation;
drop table pt;
drop table nt;
create table pt (c1 int, c2 int) partition by range(c1) (partition M1  VALUES LESS THAN (5), partition M2 VALUES LESS THAN (10), partition M3 VALUES LESS THAN (1000));
create table nt (c1 int, c2 int);
alter table pt exchange partition M3 with table nt without validation;
alter table pt add COLUMN GROUP(each column);
alter table nt add COLUMN GROUP(each column);
alter table pt exchange partition M3 with table nt without validation;
alter table pt add COLUMN GROUP(all columns);
alter table nt add COLUMN GROUP(all columns);
alter table pt exchange partition M3 with table nt without validation;
alter table nt drop COLUMN GROUP(all columns);
alter table pt drop COLUMN GROUP(all columns);
alter table pt exchange partition M3 with table nt without validation;
alter table pt add COLUMN GROUP(all columns);
alter table nt add COLUMN GROUP(all columns);
alter table pt exchange partition M3 with table nt without validation;
alter table nt drop COLUMN GROUP(each column);
alter table pt drop COLUMN GROUP(each column);
alter table pt exchange partition M3 with table nt without validation;
alter table nt add COLUMN GROUP(each column);
alter table pt add COLUMN GROUP(each column);
alter table pt exchange partition M3 with table nt without validation;
drop table pt;
drop table nt;
drop table if exists pt;
drop table if exists nt;
create table pt(c1 int, c2 char(10), primary key(c1,c2)) partition by range(c1) (partition M1 values less than(10), partition M2 values less than(100));
create table nt(c1 int, c2 char(10), primary key(c1,c2));
create index pt_index on pt(c2(5));
create index pt_index on nt(c2(5));
alter table pt exchange partition M1 with table nt without validation;
alter table pt drop index pt_index;
create index pt_index on pt(c2(5));
alter table pt exchange partition M1 with table nt without validation;
drop table pt;
drop table nt;
# 一级分区表与一级分区表交换，不支持
drop table if exists t1;
drop table if exists t2;
create table t1 (c1 int primary key, c2 int)
partition by hash(c1) partitions 5;
create table t2 (c1 int primary key, c2 int)
partition by hash(c1) partitions 5;
alter table t1 exchange partition p3 with table t2 WITHOUT VALIDATION;
ERROR 0A000: Exchange partition except composite-partitioned and partitioned table is not supported
drop table t1;
drop table t2;
# 二级分区表与二级分区表交换，不支持
drop table if exists t1;
drop table if exists t2;
create table t1 (c1 int primary key, c2 int)
partition by range(c1)
subpartition by hash(c1) subpartitions 5
(
partition p0 values less than (10),
partition p1 values less than (20),
partition p2 values less than (30),
Partition p3 values less than (MAXVALUE)
);
create table t2 (c1 int primary key, c2 int)
partition by range(c1)
subpartition by hash(c1) subpartitions 5
(
partition p0 values less than (10),
partition p1 values less than (20),
partition p2 values less than (30),
Partition p3 values less than (MAXVALUE)
);
alter table t1 exchange partition p1 with table t2 WITHOUT VALIDATION;
ERROR 0A000: Exchange partition except composite-partitioned and partitioned table is not supported
alter table t1 exchange partition p1sp3 with table t2 WITHOUT VALIDATION;
ERROR 0A000: Exchange partition except composite-partitioned and partitioned table is not supported
drop table t1;
drop table t2;
# 二级分区表与一级分区表交换，其中二级分区表的一级分区为hash分区，不支持
drop table if exists t1;
drop table if exists t2;
create table t1 (c1 int primary key, c2 int)
partition by hash(c1) partitions 10
subpartition by hash(c1) subpartitions 5;
create table t2 (c1 int primary key, c2 int)
partition by hash(c1) partitions 5;
alter table t1 exchange partition p1 with table t2 WITHOUT VALIDATION;
ERROR 0A000: Exchange partition except range(columns) and list(columns) is not supported
alter table t1 exchange partition p1sp3 with table t2 WITHOUT VALIDATION;
ERROR 0A000: Exchange partition except range(columns) and list(columns) is not supported
drop table t1;
drop table t2;
# 二级分区表与一级分区表之间交换
drop table if exists t1;
drop table if exists t2;
create table t1 (c1 int primary key, c2 int)
partition by range(c1)
subpartition by hash(c1) subpartitions 5
(
partition p0 values less than (10),
partition p1 values less than (20),
partition p2 values less than (30),
Partition p3 values less than (MAXVALUE)
);
create table t2 (c1 int primary key, c2 int)
partition by hash(c1) partitions 5;
insert into t1 values (11, 30), (14, 40), (26, 150), (29, 160);
insert into t2 values (12, 20), (16, 110), (17, 170), (19, 120);
select * from t1 partition(p0);
c1	c2
select * from t1 partition(p1);
c1	c2
11	30
14	40
select * from t1 partition(p2);
c1	c2
26	150
29	160
select * from t1 partition(p3);
c1	c2
#一级分区表与二级分区表交换，不支持
alter table t2 exchange partition p1 with table t1 WITHOUT VALIDATION;
ERROR 0A000: Exchange partition except composite-partitioned and partitioned table is not supported
#二级分区表与一级分区表交换，成功
alter table t1 exchange partition p1 with table t2 WITHOUT VALIDATION;
select * from t1 partition(p0);
c1	c2
select * from t1 partition(p1);
c1	c2
16	110
12	20
17	170
19	120
select * from t1 partition(p2);
c1	c2
26	150
29	160
select * from t1 partition(p3);
c1	c2
drop table t1;
drop table t2;
# 二级分区表与一级分区表之间交换，带索引
drop table if exists t1;
drop table if exists t2;
create table t1 (c1 int primary key, c2 int)
partition by range(c1)
subpartition by hash(c1) subpartitions 5
(
partition p0 values less than (10),
partition p1 values less than (20),
partition p2 values less than (30),
Partition p3 values less than (MAXVALUE)
);
create table t2 (c1 int primary key, c2 int)
partition by hash(c1) partitions 5;
create index k1 on t1(c1, c2) local;
create index k1 on t2(c1, c2) local;
insert into t1 values (11, 30), (14, 40), (26, 150), (29, 160);
insert into t2 values (12, 20), (16, 110), (17, 170), (19, 120);
select * from t1 partition(p0);
c1	c2
select * from t1 partition(p1);
c1	c2
11	30
14	40
select * from t1 partition(p2);
c1	c2
26	150
29	160
select * from t1 partition(p3);
c1	c2
set ob_enable_index_direct_select=1;
c1	c2
11	30
14	40
26	150
29	160
c1	c2
16	110
12	20
17	170
19	120
alter table t1 exchange partition p1 with table t2 WITHOUT VALIDATION;
select * from t1 partition(p0);
c1	c2
select * from t1 partition(p1);
c1	c2
16	110
12	20
17	170
19	120
select * from t1 partition(p2);
c1	c2
26	150
29	160
select * from t1 partition(p3);
c1	c2
c1	c2
16	110
12	20
17	170
19	120
26	150
29	160
c1	c2
11	30
14	40
drop table t1;
drop table t2;
# 二级分区表与一级分区表之间交换，带lob列
drop table if exists t1;
drop table if exists t2;
create table t1 (c1 int primary key, c2 int, c3 text)
partition by range(c1)
subpartition by hash(c1) subpartitions 5
(
partition p0 values less than (10),
partition p1 values less than (20),
partition p2 values less than (30),
Partition p3 values less than (MAXVALUE)
);
create table t2 (c1 int primary key, c2 int, c3 text)
partition by hash(c1) partitions 5;
insert into t1 values (11, 30, repeat('1', 5000)), (14, 40, repeat('1', 3000)), (26, 150, repeat('1', 4000)), (29, 160, repeat('1', 1000));
insert into t2 values (12, 20, repeat('2', 3000)), (16, 110, repeat('2', 4000)), (17, 170, repeat('2', 5000)), (19, 120, repeat('2', 6000));
select * from t1 partition(p0);
c1	c2	c3
select * from t1 partition(p1);
c1	c2	c3
11	30	11111111111111111111111111111111111111111111111111111111111111111111111111111111111111111111111111111111111111111111111111111111111111111111111111111111111111111111111111111111111111111111111111111111111111111111111111111111111111111111111111111111111111111111111111111111111111111111111111111111111111111111111111111111111111111111111111111111111111111111111111111111111111111111111111111111111111111111111111111111111111111111111111111111111111111111111111111111111111111111111111111111111111111111111111111111111111111111111111111111111111111111111111111111111111111111111111111111111111111111111111111111111111111111111111111111111111111111111111111111111111111111111111111111111111111111111111111111111111111111111111111111111111111111111111111111111111111111111111111111111111111111111111111111111111111111111111111111111111111111111111111111111111111111111111111111111111111111111111111111111111111111111111111111111111111111111111111111111111111111111111111111111111111111111111111111111111111111111111111111111111111111111111111111111111111111111111111111111111111111111111111111111111111111111111111111111111111111111111111111111111111111111111111111111111111111111111111111111111111111111111111111111111111111111111111111111111111111111111111111111111111111111111111111111111111111111111111111111111111111111111111111111111111111111111111111111111111111111111111111111111111111111111111111111111111111111111111111111111111111111111111111111111111111111111111111111111111111111111111111111111111111111111111111111111111111111111111111111111111111111111111111111111111111111111111111111111111111111111111111111111111111111111111111111111111111111111111111111111111111111111111111111111111111111111111111111111111111111111111111111111111111111111111111111111111111111111111111111111111111111111111111111111111111111111111111111111111111111111111111111111111111111111111111111111111111111111111111111111111111111111111111111111111111111111111111111111111111111111111111111111111111111111111111111111111111111111111111111111111111111111111111111111111111111111111111111111111111111111111111111111111111111111111111111111111111111111111111111111111111111111111111111111111111111111111111111111111111111111111111111111111111111111111111111111111111111111111111111111111111111111111111111111111111111111111111111111111111111111111111111111111111111111111111111111111111111111111111111111111111111111111111111111111111111111111111111111111111111111111111111111111111111111111111111111111111111111111111111111111111111111111111111111111111111111111111111111111111111111111111111111111111111111111111111111111111111111111111111111111111111111111111111111111111111111111111111111111111111111111111111111111111111111111111111111111111111111111111111111111111111111111111111111111111111111111111111111111111111111111111111111111111111111111111111111111111111111111111111111111111111111111111111111111111111111111111111111111111111111111111111111111111111111111111111111111111111111111111111111111111111111111111111111111111111111111111111111111111111111111111111111111111111111111111111111111111111111111111111111111111111111111111111111111111111111111111111111111111111111111111111111111111111111111111111111111111111111111111111111111111111111111111111111111111111111111111111111111111111111111111111111111111111111111111111111111111111111111111111111111111111111111111111111111111111111111111111111111111111111111111111111111111111111111111111111111111111111111111111111111111111111111111111111111111111111111111111111111111111111111111111111111111111111111111111111111111111111111111111111111111111111111111111111111111111111111111111111111111111111111111111111111111111111111111111111111111111111111111111111111111111111111111111111111111111111111111111111111111111111111111111111111111111111111111111111111111111111111111111111111111111111111111111111111111111111111111111111111111111111111111111111111111111111111111111111111111111111111111111111111111111111111111111111111111111111111111111111111111111111111111111111111111111111111111111111111111111111111111111111111111111111111111111111111111111111111111111111111111111111111111111111111111111111111111111111111111111111111111111111111111111111111111111111111111111111111111111111111111111111111111111111111111111111111111111111111111111111111111111111111111111111111111111111111111111111111111111111111111111111111111111111111111111111111111111111111111111111111111111111111111111111111111111111111111111111111111111111111111111111111111111111111111111111111111111111111111111111111111111111111111111111111111111111111111111111111111111111111111111111111111111111111111111111111111111111111111111111111111111111111111111111111111111111111111111111111111111111111111111111111111111111111111111111111111111111111111111111111111111111111111111111111111111111111111111111111111111111111111111111111111111111111111111111111111111111111111111111111111111111111111111111111111111111111111111111111111111111111111111111111111111111111111111111111111
14	40	111111111111111111111111111111111111111111111111111111111111111111111111111111111111111111111111111111111111111111111111111111111111111111111111111111111111111111111111111111111111111111111111111111111111111111111111111111111111111111111111111111111111111111111111111111111111111111111111111111111111111111111111111111111111111111111111111111111111111111111111111111111111111111111111111111111111111111111111111111111111111111111111111111111111111111111111111111111111111111111111111111111111111111111111111111111111111111111111111111111111111111111111111111111111111111111111111111111111111111111111111111111111111111111111111111111111111111111111111111111111111111111111111111111111111111111111111111111111111111111111111111111111111111111111111111111111111111111111111111111111111111111111111111111111111111111111111111111111111111111111111111111111111111111111111111111111111111111111111111111111111111111111111111111111111111111111111111111111111111111111111111111111111111111111111111111111111111111111111111111111111111111111111111111111111111111111111111111111111111111111111111111111111111111111111111111111111111111111111111111111111111111111111111111111111111111111111111111111111111111111111111111111111111111111111111111111111111111111111111111111111111111111111111111111111111111111111111111111111111111111111111111111111111111111111111111111111111111111111111111111111111111111111111111111111111111111111111111111111111111111111111111111111111111111111111111111111111111111111111111111111111111111111111111111111111111111111111111111111111111111111111111111111111111111111111111111111111111111111111111111111111111111111111111111111111111111111111111111111111111111111111111111111111111111111111111111111111111111111111111111111111111111111111111111111111111111111111111111111111111111111111111111111111111111111111111111111111111111111111111111111111111111111111111111111111111111111111111111111111111111111111111111111111111111111111111111111111111111111111111111111111111111111111111111111111111111111111111111111111111111111111111111111111111111111111111111111111111111111111111111111111111111111111111111111111111111111111111111111111111111111111111111111111111111111111111111111111111111111111111111111111111111111111111111111111111111111111111111111111111111111111111111111111111111111111111111111111111111111111111111111111111111111111111111111111111111111111111111111111111111111111111111111111111111111111111111111111111111111111111111111111111111111111111111111111111111111111111111111111111111111111111111111111111111111111111111111111111111111111111111111111111111111111111111111111111111111111111111111111111111111111111111111111111111111111111111111111111111111111111111111111111111111111111111111111111111111111111111111111111111111111111111111111111111111111111111111111111111111111111111111111111111111111111111111111111111111111111111111111111111111111111111111111111111111111111111111111111111111111111111111111111111111111111111111111111111111111111111111111111111
select * from t1 partition(p2);
c1	c2	c3
26	150	1111111111111111111111111111111111111111111111111111111111111111111111111111111111111111111111111111111111111111111111111111111111111111111111111111111111111111111111111111111111111111111111111111111111111111111111111111111111111111111111111111111111111111111111111111111111111111111111111111111111111111111111111111111111111111111111111111111111111111111111111111111111111111111111111111111111111111111111111111111111111111111111111111111111111111111111111111111111111111111111111111111111111111111111111111111111111111111111111111111111111111111111111111111111111111111111111111111111111111111111111111111111111111111111111111111111111111111111111111111111111111111111111111111111111111111111111111111111111111111111111111111111111111111111111111111111111111111111111111111111111111111111111111111111111111111111111111111111111111111111111111111111111111111111111111111111111111111111111111111111111111111111111111111111111111111111111111111111111111111111111111111111111111111111111111111111111111111111111111111111111111111111111111111111111111111111111111111111111111111111111111111111111111111111111111111111111111111111111111111111111111111111111111111111111111111111111111111111111111111111111111111111111111111111111111111111111111111111111111111111111111111111111111111111111111111111111111111111111111111111111111111111111111111111111111111111111111111111111111111111111111111111111111111111111111111111111111111111111111111111111111111111111111111111111111111111111111111111111111111111111111111111111111111111111111111111111111111111111111111111111111111111111111111111111111111111111111111111111111111111111111111111111111111111111111111111111111111111111111111111111111111111111111111111111111111111111111111111111111111111111111111111111111111111111111111111111111111111111111111111111111111111111111111111111111111111111111111111111111111111111111111111111111111111111111111111111111111111111111111111111111111111111111111111111111111111111111111111111111111111111111111111111111111111111111111111111111111111111111111111111111111111111111111111111111111111111111111111111111111111111111111111111111111111111111111111111111111111111111111111111111111111111111111111111111111111111111111111111111111111111111111111111111111111111111111111111111111111111111111111111111111111111111111111111111111111111111111111111111111111111111111111111111111111111111111111111111111111111111111111111111111111111111111111111111111111111111111111111111111111111111111111111111111111111111111111111111111111111111111111111111111111111111111111111111111111111111111111111111111111111111111111111111111111111111111111111111111111111111111111111111111111111111111111111111111111111111111111111111111111111111111111111111111111111111111111111111111111111111111111111111111111111111111111111111111111111111111111111111111111111111111111111111111111111111111111111111111111111111111111111111111111111111111111111111111111111111111111111111111111111111111111111111111111111111111111111111111111111111111111111111111111111111111111111111111111111111111111111111111111111111111111111111111111111111111111111111111111111111111111111111111111111111111111111111111111111111111111111111111111111111111111111111111111111111111111111111111111111111111111111111111111111111111111111111111111111111111111111111111111111111111111111111111111111111111111111111111111111111111111111111111111111111111111111111111111111111111111111111111111111111111111111111111111111111111111111111111111111111111111111111111111111111111111111111111111111111111111111111111111111111111111111111111111111111111111111111111111111111111111111111111111111111111111111111111111111111111111111111111111111111111111111111111111111111111111111111111111111111111111111111111111111111111111111111111111111111111111111111111111111111111111111111111111111111111111111111111111111111111111111111111111111111111111111111111111111111111111111111111111111111111111111111111111111111111111111111111111111111111111111111111111111111111111111111111111111111
29	160	1111111111111111111111111111111111111111111111111111111111111111111111111111111111111111111111111111111111111111111111111111111111111111111111111111111111111111111111111111111111111111111111111111111111111111111111111111111111111111111111111111111111111111111111111111111111111111111111111111111111111111111111111111111111111111111111111111111111111111111111111111111111111111111111111111111111111111111111111111111111111111111111111111111111111111111111111111111111111111111111111111111111111111111111111111111111111111111111111111111111111111111111111111111111111111111111111111111111111111111111111111111111111111111111111111111111111111111111111111111111111111111111111111111111111111111111111111111111111111111111111111111111111111111111111111111111111111111111111111111111111111111111111111111111111111111111111111111111111111111111111111111111111111111111111111111111111111111111111111111111111111111111111111111111111111111111111111111111111111111111111111111111111111111111111111111111111111
select * from t1 partition(p3);
c1	c2	c3
alter table t1 exchange partition p1 with table t2 WITHOUT VALIDATION;
select * from t1 partition(p0);
c1	c2	c3
select * from t1 partition(p1);
c1	c2	c3
16	110	2222222222222222222222222222222222222222222222222222222222222222222222222222222222222222222222222222222222222222222222222222222222222222222222222222222222222222222222222222222222222222222222222222222222222222222222222222222222222222222222222222222222222222222222222222222222222222222222222222222222222222222222222222222222222222222222222222222222222222222222222222222222222222222222222222222222222222222222222222222222222222222222222222222222222222222222222222222222222222222222222222222222222222222222222222222222222222222222222222222222222222222222222222222222222222222222222222222222222222222222222222222222222222222222222222222222222222222222222222222222222222222222222222222222222222222222222222222222222222222222222222222222222222222222222222222222222222222222222222222222222222222222222222222222222222222222222222222222222222222222222222222222222222222222222222222222222222222222222222222222222222222222222222222222222222222222222222222222222222222222222222222222222222222222222222222222222222222222222222222222222222222222222222222222222222222222222222222222222222222222222222222222222222222222222222222222222222222222222222222222222222222222222222222222222222222222222222222222222222222222222222222222222222222222222222222222222222222222222222222222222222222222222222222222222222222222222222222222222222222222222222222222222222222222222222222222222222222222222222222222222222222222222222222222222222222222222222222222222222222222222222222222222222222222222222222222222222222222222222222222222222222222222222222222222222222222222222222222222222222222222222222222222222222222222222222222222222222222222222222222222222222222222222222222222222222222222222222222222222222222222222222222222222222222222222222222222222222222222222222222222222222222222222222222222222222222222222222222222222222222222222222222222222222222222222222222222222222222222222222222222222222222222222222222222222222222222222222222222222222222222222222222222222222222222222222222222222222222222222222222222222222222222222222222222222222222222222222222222222222222222222222222222222222222222222222222222222222222222222222222222222222222222222222222222222222222222222222222222222222222222222222222222222222222222222222222222222222222222222222222222222222222222222222222222222222222222222222222222222222222222222222222222222222222222222222222222222222222222222222222222222222222222222222222222222222222222222222222222222222222222222222222222222222222222222222222222222222222222222222222222222222222222222222222222222222222222222222222222222222222222222222222222222222222222222222222222222222222222222222222222222222222222222222222222222222222222222222222222222222222222222222222222222222222222222222222222222222222222222222222222222222222222222222222222222222222222222222222222222222222222222222222222222222222222222222222222222222222222222222222222222222222222222222222222222222222222222222222222222222222222222222222222222222222222222222222222222222222222222222222222222222222222222222222222222222222222222222222222222222222222222222222222222222222222222222222222222222222222222222222222222222222222222222222222222222222222222222222222222222222222222222222222222222222222222222222222222222222222222222222222222222222222222222222222222222222222222222222222222222222222222222222222222222222222222222222222222222222222222222222222222222222222222222222222222222222222222222222222222222222222222222222222222222222222222222222222222222222222222222222222222222222222222222222222222222222222222222222222222222222222222222222222222222222222222222222222222222222222222222222222222222222222222222222222222222222222222222222222222222222222222222222222222222222222222222222222222222222222222222222222222222222222222222222222222222222222222222222222222222222222222222222222222222222222222222222222222222222222222222222222222222222222222222222222222222222222222222222222222222222222222222222222222222222222222222222222222222222222222222222222222222222222222222222222222222222222222222222222222222222222222222222222222222222222222222222222222
12	20	222222222222222222222222222222222222222222222222222222222222222222222222222222222222222222222222222222222222222222222222222222222222222222222222222222222222222222222222222222222222222222222222222222222222222222222222222222222222222222222222222222222222222222222222222222222222222222222222222222222222222222222222222222222222222222222222222222222222222222222222222222222222222222222222222222222222222222222222222222222222222222222222222222222222222222222222222222222222222222222222222222222222222222222222222222222222222222222222222222222222222222222222222222222222222222222222222222222222222222222222222222222222222222222222222222222222222222222222222222222222222222222222222222222222222222222222222222222222222222222222222222222222222222222222222222222222222222222222222222222222222222222222222222222222222222222222222222222222222222222222222222222222222222222222222222222222222222222222222222222222222222222222222222222222222222222222222222222222222222222222222222222222222222222222222222222222222222222222222222222222222222222222222222222222222222222222222222222222222222222222222222222222222222222222222222222222222222222222222222222222222222222222222222222222222222222222222222222222222222222222222222222222222222222222222222222222222222222222222222222222222222222222222222222222222222222222222222222222222222222222222222222222222222222222222222222222222222222222222222222222222222222222222222222222222222222222222222222222222222222222222222222222222222222222222222222222222222222222222222222222222222222222222222222222222222222222222222222222222222222222222222222222222222222222222222222222222222222222222222222222222222222222222222222222222222222222222222222222222222222222222222222222222222222222222222222222222222222222222222222222222222222222222222222222222222222222222222222222222222222222222222222222222222222222222222222222222222222222222222222222222222222222222222222222222222222222222222222222222222222222222222222222222222222222222222222222222222222222222222222222222222222222222222222222222222222222222222222222222222222222222222222222222222222222222222222222222222222222222222222222222222222222222222222222222222222222222222222222222222222222222222222222222222222222222222222222222222222222222222222222222222222222222222222222222222222222222222222222222222222222222222222222222222222222222222222222222222222222222222222222222222222222222222222222222222222222222222222222222222222222222222222222222222222222222222222222222222222222222222222222222222222222222222222222222222222222222222222222222222222222222222222222222222222222222222222222222222222222222222222222222222222222222222222222222222222222222222222222222222222222222222222222222222222222222222222222222222222222222222222222222222222222222222222222222222222222222222222222222222222222222222222222222222222222222222222222222222222222222222222222222222222222222222222222222222222222222222222222222222222222222222222222222222222222222222222222222222222222222222222222222222222222222222222222222222222222222222222222222222222222
17	170	22222222222222222222222222222222222222222222222222222222222222222222222222222222222222222222222222222222222222222222222222222222222222222222222222222222222222222222222222222222222222222222222222222222222222222222222222222222222222222222222222222222222222222222222222222222222222222222222222222222222222222222222222222222222222222222222222222222222222222222222222222222222222222222222222222222222222222222222222222222222222222222222222222222222222222222222222222222222222222222222222222222222222222222222222222222222222222222222222222222222222222222222222222222222222222222222222222222222222222222222222222222222222222222222222222222222222222222222222222222222222222222222222222222222222222222222222222222222222222222222222222222222222222222222222222222222222222222222222222222222222222222222222222222222222222222222222222222222222222222222222222222222222222222222222222222222222222222222222222222222222222222222222222222222222222222222222222222222222222222222222222222222222222222222222222222222222222222222222222222222222222222222222222222222222222222222222222222222222222222222222222222222222222222222222222222222222222222222222222222222222222222222222222222222222222222222222222222222222222222222222222222222222222222222222222222222222222222222222222222222222222222222222222222222222222222222222222222222222222222222222222222222222222222222222222222222222222222222222222222222222222222222222222222222222222222222222222222222222222222222222222222222222222222222222222222222222222222222222222222222222222222222222222222222222222222222222222222222222222222222222222222222222222222222222222222222222222222222222222222222222222222222222222222222222222222222222222222222222222222222222222222222222222222222222222222222222222222222222222222222222222222222222222222222222222222222222222222222222222222222222222222222222222222222222222222222222222222222222222222222222222222222222222222222222222222222222222222222222222222222222222222222222222222222222222222222222222222222222222222222222222222222222222222222222222222222222222222222222222222222222222222222222222222222222222222222222222222222222222222222222222222222222222222222222222222222222222222222222222222222222222222222222222222222222222222222222222222222222222222222222222222222222222222222222222222222222222222222222222222222222222222222222222222222222222222222222222222222222222222222222222222222222222222222222222222222222222222222222222222222222222222222222222222222222222222222222222222222222222222222222222222222222222222222222222222222222222222222222222222222222222222222222222222222222222222222222222222222222222222222222222222222222222222222222222222222222222222222222222222222222222222222222222222222222222222222222222222222222222222222222222222222222222222222222222222222222222222222222222222222222222222222222222222222222222222222222222222222222222222222222222222222222222222222222222222222222222222222222222222222222222222222222222222222222222222222222222222222222222222222222222222222222222222222222222222222222222222222222222222222222222222222222222222222222222222222222222222222222222222222222222222222222222222222222222222222222222222222222222222222222222222222222222222222222222222222222222222222222222222222222222222222222222222222222222222222222222222222222222222222222222222222222222222222222222222222222222222222222222222222222222222222222222222222222222222222222222222222222222222222222222222222222222222222222222222222222222222222222222222222222222222222222222222222222222222222222222222222222222222222222222222222222222222222222222222222222222222222222222222222222222222222222222222222222222222222222222222222222222222222222222222222222222222222222222222222222222222222222222222222222222222222222222222222222222222222222222222222222222222222222222222222222222222222222222222222222222222222222222222222222222222222222222222222222222222222222222222222222222222222222222222222222222222222222222222222222222222222222222222222222222222222222222222222222222222222222222222222222222222222222222222222222222222222222222222222222222222222222222222222222222222222222222222222222222222222222222222222222222222222222222222222222222222222222222222222222222222222222222222222222222222222222222222222222222222222222222222222222222222222222222222222222222222222222222222222222222222222222222222222222222222222222222222222222222222222222222222222222222222222222222222222222222222222222222222222222222222222222222222222222222222222222222222222222222222222222222222222222222222222222222222222222222222222222222222222222222222222222222222222222222222222222222222222222222222222222222222222222222222222222222222222222222222222222222222222222222222222222222222222222222222222222222222222222222222222222222222222222222222222222222222222222222222222222222222222222222222222222222222222222222222222222222222222222222222222222222222222222222222222222222222222222222222222222222222222222222222222222222222222222222222222222222222222222222222222222222222222222222222222222222222222222222222222222222222222222222222222222222222222222222222222222222222
19	120	222222222222222222222222222222222222222222222222222222222222222222222222222222222222222222222222222222222222222222222222222222222222222222222222222222222222222222222222222222222222222222222222222222222222222222222222222222222222222222222222222222222222222222222222222222222222222222222222222222222222222222222222222222222222222222222222222222222222222222222222222222222222222222222222222222222222222222222222222222222222222222222222222222222222222222222222222222222222222222222222222222222222222222222222222222222222222222222222222222222222222222222222222222222222222222222222222222222222222222222222222222222222222222222222222222222222222222222222222222222222222222222222222222222222222222222222222222222222222222222222222222222222222222222222222222222222222222222222222222222222222222222222222222222222222222222222222222222222222222222222222222222222222222222222222222222222222222222222222222222222222222222222222222222222222222222222222222222222222222222222222222222222222222222222222222222222222222222222222222222222222222222222222222222222222222222222222222222222222222222222222222222222222222222222222222222222222222222222222222222222222222222222222222222222222222222222222222222222222222222222222222222222222222222222222222222222222222222222222222222222222222222222222222222222222222222222222222222222222222222222222222222222222222222222222222222222222222222222222222222222222222222222222222222222222222222222222222222222222222222222222222222222222222222222222222222222222222222222222222222222222222222222222222222222222222222222222222222222222222222222222222222222222222222222222222222222222222222222222222222222222222222222222222222222222222222222222222222222222222222222222222222222222222222222222222222222222222222222222222222222222222222222222222222222222222222222222222222222222222222222222222222222222222222222222222222222222222222222222222222222222222222222222222222222222222222222222222222222222222222222222222222222222222222222222222222222222222222222222222222222222222222222222222222222222222222222222222222222222222222222222222222222222222222222222222222222222222222222222222222222222222222222222222222222222222222222222222222222222222222222222222222222222222222222222222222222222222222222222222222222222222222222222222222222222222222222222222222222222222222222222222222222222222222222222222222222222222222222222222222222222222222222222222222222222222222222222222222222222222222222222222222222222222222222222222222222222222222222222222222222222222222222222222222222222222222222222222222222222222222222222222222222222222222222222222222222222222222222222222222222222222222222222222222222222222222222222222222222222222222222222222222222222222222222222222222222222222222222222222222222222222222222222222222222222222222222222222222222222222222222222222222222222222222222222222222222222222222222222222222222222222222222222222222222222222222222222222222222222222222222222222222222222222222222222222222222222222222222222222222222222222222222222222222222222222222222222222222222222222222222222222222222222222222222222222222222222222222222222222222222222222222222222222222222222222222222222222222222222222222222222222222222222222222222222222222222222222222222222222222222222222222222222222222222222222222222222222222222222222222222222222222222222222222222222222222222222222222222222222222222222222222222222222222222222222222222222222222222222222222222222222222222222222222222222222222222222222222222222222222222222222222222222222222222222222222222222222222222222222222222222222222222222222222222222222222222222222222222222222222222222222222222222222222222222222222222222222222222222222222222222222222222222222222222222222222222222222222222222222222222222222222222222222222222222222222222222222222222222222222222222222222222222222222222222222222222222222222222222222222222222222222222222222222222222222222222222222222222222222222222222222222222222222222222222222222222222222222222222222222222222222222222222222222222222222222222222222222222222222222222222222222222222222222222222222222222222222222222222222222222222222222222222222222222222222222222222222222222222222222222222222222222222222222222222222222222222222222222222222222222222222222222222222222222222222222222222222222222222222222222222222222222222222222222222222222222222222222222222222222222222222222222222222222222222222222222222222222222222222222222222222222222222222222222222222222222222222222222222222222222222222222222222222222222222222222222222222222222222222222222222222222222222222222222222222222222222222222222222222222222222222222222222222222222222222222222222222222222222222222222222222222222222222222222222222222222222222222222222222222222222222222222222222222222222222222222222222222222222222222222222222222222222222222222222222222222222222222222222222222222222222222222222222222222222222222222222222222222222222222222222222222222222222222222222222222222222222222222222222222222222222222222222222222222222222222222222222222222222222222222222222222222222222222222222222222222222222222222222222222222222222222222222222222222222222222222222222222222222222222222222222222222222222222222222222222222222222222222222222222222222222222222222222222222222222222222222222222222222222222222222222222222222222222222222222222222222222222222222222222222222222222222222222222222222222222222222222222222222222222222222222222222222222222222222222222222222222222222222222222222222222222222222222222222222222222222222222222222222222222222222222222222222222222222222222222222222222222222222222222222222222222222222222222222222222222222222222222222222222222222222222222222222222222222222222222222222222222222222222222222222222222222222222222222222222222222222222222222222222222222222222222222222222222222222222222222222222222222222222222222222222222222222222222222222222222222222222222222222222222222222222222222222222222222222222222222222222222222222222222222222222222222222222222222222222222222222222222222222222222222222222222222222222222222222222222222222222222222222222222222222222222222222222222222222222222222222222222222222222222222
select * from t1 partition(p2);
c1	c2	c3
26	150	1111111111111111111111111111111111111111111111111111111111111111111111111111111111111111111111111111111111111111111111111111111111111111111111111111111111111111111111111111111111111111111111111111111111111111111111111111111111111111111111111111111111111111111111111111111111111111111111111111111111111111111111111111111111111111111111111111111111111111111111111111111111111111111111111111111111111111111111111111111111111111111111111111111111111111111111111111111111111111111111111111111111111111111111111111111111111111111111111111111111111111111111111111111111111111111111111111111111111111111111111111111111111111111111111111111111111111111111111111111111111111111111111111111111111111111111111111111111111111111111111111111111111111111111111111111111111111111111111111111111111111111111111111111111111111111111111111111111111111111111111111111111111111111111111111111111111111111111111111111111111111111111111111111111111111111111111111111111111111111111111111111111111111111111111111111111111111111111111111111111111111111111111111111111111111111111111111111111111111111111111111111111111111111111111111111111111111111111111111111111111111111111111111111111111111111111111111111111111111111111111111111111111111111111111111111111111111111111111111111111111111111111111111111111111111111111111111111111111111111111111111111111111111111111111111111111111111111111111111111111111111111111111111111111111111111111111111111111111111111111111111111111111111111111111111111111111111111111111111111111111111111111111111111111111111111111111111111111111111111111111111111111111111111111111111111111111111111111111111111111111111111111111111111111111111111111111111111111111111111111111111111111111111111111111111111111111111111111111111111111111111111111111111111111111111111111111111111111111111111111111111111111111111111111111111111111111111111111111111111111111111111111111111111111111111111111111111111111111111111111111111111111111111111111111111111111111111111111111111111111111111111111111111111111111111111111111111111111111111111111111111111111111111111111111111111111111111111111111111111111111111111111111111111111111111111111111111111111111111111111111111111111111111111111111111111111111111111111111111111111111111111111111111111111111111111111111111111111111111111111111111111111111111111111111111111111111111111111111111111111111111111111111111111111111111111111111111111111111111111111111111111111111111111111111111111111111111111111111111111111111111111111111111111111111111111111111111111111111111111111111111111111111111111111111111111111111111111111111111111111111111111111111111111111111111111111111111111111111111111111111111111111111111111111111111111111111111111111111111111111111111111111111111111111111111111111111111111111111111111111111111111111111111111111111111111111111111111111111111111111111111111111111111111111111111111111111111111111111111111111111111111111111111111111111111111111111111111111111111111111111111111111111111111111111111111111111111111111111111111111111111111111111111111111111111111111111111111111111111111111111111111111111111111111111111111111111111111111111111111111111111111111111111111111111111111111111111111111111111111111111111111111111111111111111111111111111111111111111111111111111111111111111111111111111111111111111111111111111111111111111111111111111111111111111111111111111111111111111111111111111111111111111111111111111111111111111111111111111111111111111111111111111111111111111111111111111111111111111111111111111111111111111111111111111111111111111111111111111111111111111111111111111111111111111111111111111111111111111111111111111111111111111111111111111111111111111111111111111111111111111111111111111111111111111111111111111111111111111111111111111111111111111111111111111111111111111111111111111111111111111111111111111111111111111111111111111111111111111111111111111111111111111111111111111111111111111111111111111111111111111111111111111111111111111111111111111111111111111111111111111111111111111111111111111111111111111111
29	160	1111111111111111111111111111111111111111111111111111111111111111111111111111111111111111111111111111111111111111111111111111111111111111111111111111111111111111111111111111111111111111111111111111111111111111111111111111111111111111111111111111111111111111111111111111111111111111111111111111111111111111111111111111111111111111111111111111111111111111111111111111111111111111111111111111111111111111111111111111111111111111111111111111111111111111111111111111111111111111111111111111111111111111111111111111111111111111111111111111111111111111111111111111111111111111111111111111111111111111111111111111111111111111111111111111111111111111111111111111111111111111111111111111111111111111111111111111111111111111111111111111111111111111111111111111111111111111111111111111111111111111111111111111111111111111111111111111111111111111111111111111111111111111111111111111111111111111111111111111111111111111111111111111111111111111111111111111111111111111111111111111111111111111111111111111111111111111
select * from t1 partition(p3);
c1	c2	c3
drop table t1;
drop table t2;
# 二级分区表与一级分区表之间交换，分区键不同
drop table if exists t1;
drop table if exists t2;
create table t1 (c1 int, c2 varchar(50), c3 int)
partition by range (c1)
subpartition by key (c3) subpartitions 2
(
partition p0 values less than (100000),
partition p1 values less than (MAXVALUE)
);
create table t2 (c1 int, c2 varchar(50), c3 int)
partition by key (c1) partitions 2;
insert into t2 values(1,'part1', 2), (90009,'part2', 4);
alter table t1 exchange partition p0 with table t2 without validation;
ERROR 0A000: Exchange partition between tables with different partition keys is not supported
drop table t1;
drop table t2;
# 二级分区表与一级分区表之间交换，list分区值不同
drop table if exists t1;
drop table if exists t2;
create table t1 (col1 int, col2 varchar(50), col3 int)
partition by list (col1)
subpartition by list (col3) (
partition p0 values in (100, 200) (
subpartition sp0 values in (1, 2, 3),
subpartition sp1 values in (4, 5, 6)
),
partition p1 values in (300, 400) (
subpartition sp2 values in (7, 8, 9),
subpartition sp3 values in (10, 11, 12)
)
);
create table t2 (col1 int, col2 varchar(50), col3 int)
partition by list (col3)
(
partition p0 values in (1,2,3),
partition p1 values in (4,5,13)
);
insert into t2 values (100, 'list partition', 13);
alter table t1 exchange partition p0 with table t2 without validation;
ERROR 0A000: Exchange partition between tables with different partition bounds is not supported
drop table t1;
drop table t2;
#二级分区表与一级分区表之间交换，range分区范围不同
drop table if exists t1;
drop table if exists t2;
create table t1 (col1 int, col2 varchar(50), col3 int)
partition by list (col1)
subpartition by range (col3) (
partition p0 values in (100, 200) (
subpartition sp0 values less than (10),
subpartition sp1 values less than (20)
),
partition p1 values in (300, 400) (
subpartition sp2 values less than (30),
subpartition sp3 values less than (40)
)
);
create table t2 (col1 int, col2 varchar(50), col3 int)
partition by range (col3)
(
partition sp0 values less than (10),
partition sp1 values less than (30)
);
insert into t2 values(100, 'range partition', 23);
alter table t1 exchange partition p0 with table t2 without validation;
ERROR 0A000: Exchange partition between tables with different partition bounds is not supported
drop table t1;
drop table t2;
