# ----------------------------------------------------------------------
# Test of GEOMETRY 3D.
# ----------------------------------------------------------------------
SELECT ST_ASText(ST_GeomFromText('POINT Z (0 0 0)'));
ST_ASText(ST_GeomFromText('POINT Z (0 0 0)'))
POINT Z (0 0 0)
SELECT ST_ASText(ST_GeomFromText('POINT Z (-1234 +5678 +91011)'));
ST_ASText(ST_GeomFromText('POINT Z (-1234 +5678 +91011)'))
POINT Z (-1234 5678 91011)
SELECT ST_ASText(ST_GeomFromText('POINT Z (25.416666666666668 25.416666666666668 26.6666666666666)'));
ST_ASText(ST_GeomFromText('POINT Z (25.416666666666668 25.416666666666668 26.6666666666666)'))
POINT Z (25.416666666666668 25.416666666666668 26.6666666666666)
SELECT ST_ASText(ST_GeomFromText('POINT Z (1e8 -23e4 +2e8)'));
ST_ASText(ST_GeomFromText('POINT Z (1e8 -23e4 +2e8)'))
POINT Z (100000000 -230000 200000000)
SELECT ST_ASText(ST_GeomFromText('LINESTRING Z(0 0 0,10 10 10)'));
ST_ASText(ST_GeomFromText('LINESTRING Z(0 0 0,10 10 10)'))
LINESTRING Z (0 0 0,10 10 10)
SELECT ST_ASText(ST_GeomFromText('LINESTRING Z(0 0 10,-4 8 -3, 2000 2000 1000)'));
ST_ASText(ST_GeomFromText('LINESTRING Z(0 0 10,-4 8 -3, 2000 2000 1000)'))
LINESTRING Z (0 0 10,-4 8 -3,2000 2000 1000)
SELECT ST_ASText(ST_GeomFromText('Polygon Z((0 0 0, 0 8 1, 8 8 2, 8 10 3, -10 10 4, -10 0 5, 0 0 0))'));
ST_ASText(ST_GeomFromText('Polygon Z((0 0 0, 0 8 1, 8 8 2, 8 10 3, -10 10 4, -10 0 5, 0 0 0))'))
POLYGON Z ((0 0 0,0 8 1,8 8 2,8 10 3,-10 10 4,-10 0 5,0 0 0))
SELECT ST_ASText(ST_GeomFromText('MULTIPOINT Z(1 1 1, 11 11 12, 11 21 13, 21 21 14)'));
ST_ASText(ST_GeomFromText('MULTIPOINT Z(1 1 1, 11 11 12, 11 21 13, 21 21 14)'))
MULTIPOINT Z ((1 1 1),(11 11 12),(11 21 13),(21 21 14))
SELECT ST_ASText(ST_GeomFromText('MULTIPOINT Z((0 0 1),(10 10 2),(10 20 3),(20 20 4))'));
ST_ASText(ST_GeomFromText('MULTIPOINT Z((0 0 1),(10 10 2),(10 20 3),(20 20 4))'))
MULTIPOINT Z ((0 0 1),(10 10 2),(10 20 3),(20 20 4))
SELECT ST_ASText(ST_GeomFromText('MULTILINESTRING Z((10 48 23,10 21 12,10 0 34),(16 0 12,16 23 23,16 48 32))'));
ST_ASText(ST_GeomFromText('MULTILINESTRING Z((10 48 23,10 21 12,10 0 34),(16 0 12,16 23 23,16 48 32))'))
MULTILINESTRING Z ((10 48 23,10 21 12,10 0 34),(16 0 12,16 23 23,16 48 32))
SELECT ST_ASText(ST_GeomFromText('MULTIPOLYGON Z(((28 26 1,28 0 2,84 0 3,84 42 4,28 26 1),(52 18 34,66 23 54,73 9 67,48 6 65,52 18 34)),((59 18 11,67 18 34,67 13 23,59 13 56,59 18 11)))'));
ST_ASText(ST_GeomFromText('MULTIPOLYGON Z(((28 26 1,28 0 2,84 0 3,84 42 4,28 26 1),(52 18 34,66 23 54,73 9 67,48 6 65,52 18 34)),((59 18 11,67 18 34,67 13 23,59 13 56,59 18 11)))'))
MULTIPOLYGON Z (((28 26 1,28 0 2,84 0 3,84 42 4,28 26 1),(52 18 34,66 23 54,73 9 67,48 6 65,52 18 34)),((59 18 11,67 18 34,67 13 23,59 13 56,59 18 11)))
SELECT ST_ASText(ST_GeomFromText('GEOMETRYCOLLECTION Z EMPTY'));
ST_ASText(ST_GeomFromText('GEOMETRYCOLLECTION Z EMPTY'))
GEOMETRYCOLLECTION Z EMPTY
SELECT ST_ASText(ST_GeomFromText('GEOMETRYCOLLECTION Z ()'));
ST_ASText(ST_GeomFromText('GEOMETRYCOLLECTION Z ()'))
GEOMETRYCOLLECTION Z EMPTY
SELECT ST_ASText(ST_GeomFromText('GEOMETRYCOLLECTION Z (Point(9 9 9),LINESTRING(1 5 1,0 0 2),POLYGON((2 2 2,2 8 1,8 8 3,8 2 4,2 2 2)))'));
ST_ASText(ST_GeomFromText('GEOMETRYCOLLECTION Z (Point(9 9 9),LINESTRING(1 5 1,0 0 2),POLYGON((2 2 2,2 8 1,8 8 3,8 2 4,2 2 2)))'))
GEOMETRYCOLLECTION Z (POINT Z (9 9 9),LINESTRING Z (1 5 1,0 0 2),POLYGON Z ((2 2 2,2 8 1,8 8 3,8 2 4,2 2 2)))
SELECT ST_ASText(ST_GeomFromText('GEOMETRYCOLLECTION Z(GEOMETRYCOLLECTION(),GEOMETRYCOLLECTION EMPTY, GEOMETRYCOLLECTION(POINT(1 1 3)), MULTILINESTRING((10 48 3,10 21 3,10 0 1),(16 0 3,16 23 4,16 48 5)), MULTIPOLYGON(((28 26 23,28 0 1,84 0 2,84 42 4,28 26 23),(52 18 13,66 23 25,73 9 12,48 6 34,52 18 13)),((59 18 1,67 18 12,67 13 23,59 13 45,59 18 1))), MULTIPOINT((0 0 1),(10 10 3),(10 20 4),(20 20 5)), MULTIPOINT(1 1 1, 11 11 11, 11 21 22, 21 21 23), GEOMETRYCOLLECTION(LINESTRING(1 1 1,2 2 3)), GEOMETRYCOLLECTION(POLYGON((0 0 1,50 45 23,40 50 34,0 0 1)),LINESTRING(-10 -10 1,0 0 2),LINESTRING(46.666666666666664 46.666666666666664 46.666666666666664,200 200 12,199 201 23,45.333333333333336 47.333333333333336 47.333333333333336),LINESTRING(8 10 1,-11 -9 -3)))'));
ST_ASText(ST_GeomFromText('GEOMETRYCOLLECTION Z(GEOMETRYCOLLECTION(),GEOMETRYCOLLECTION EMPTY, GEOMETRYCOLLECTION(POINT(1 1 3)), MULTILINESTRING((10 48 3,10 21 3,10 0 1),(16 0 3,16 23 4,16 48 5)), MULTIPOLYGON(((28 26 23,28 0 1,84 0 2,84 42 4,28 26 23),(5
GEOMETRYCOLLECTION Z (GEOMETRYCOLLECTION Z EMPTY,GEOMETRYCOLLECTION Z EMPTY,GEOMETRYCOLLECTION Z (POINT Z (1 1 3)),MULTILINESTRING Z ((10 48 3,10 21 3,10 0 1),(16 0 3,16 23 4,16 48 5)),MULTIPOLYGON Z (((28 26 23,28 0 1,84 0 2,84 42 4,28 26 23),(52 18 13,66 23 25,73 9 12,48 6 34,52 18 13)),((59 18 1,67 18 12,67 13 23,59 13 45,59 18 1))),MULTIPOINT Z ((0 0 1),(10 10 3),(10 20 4),(20 20 5)),MULTIPOINT Z ((1 1 1),(11 11 11),(11 21 22),(21 21 23)),GEOMETRYCOLLECTION Z (LINESTRING Z (1 1 1,2 2 3)),GEOMETRYCOLLECTION Z (POLYGON Z ((0 0 1,50 45 23,40 50 34,0 0 1)),LINESTRING Z (-10 -10 1,0 0 2),LINESTRING Z (46.666666666666664 46.666666666666664 46.666666666666664,200 200 12,199 201 23,45.333333333333336 47.333333333333336 47.333333333333336),LINESTRING Z (8 10 1,-11 -9 -3)))
bugfix: 53548581
select _ST_ASEWKT(_ST_GeogFromText('point(181 91 183)'));
_ST_ASEWKT(_ST_GeogFromText('point(181 91 183)'))
SRID=4326;POINT Z (-179 89 183)
SELECT _ST_ASEWKT(_ST_GEOGRAPHYFROMTEXT('SRID=4326;point(300 300 500)'));
_ST_ASEWKT(_ST_GEOGRAPHYFROMTEXT('SRID=4326;point(300 300 500)'))
SRID=4326;POINT Z (-60 -60 500)
SELECT _ST_ASEWKT(_ST_GeogFromText('POINT Z (0 0 0)'));
_ST_ASEWKT(_ST_GeogFromText('POINT Z (0 0 0)'))
SRID=4326;POINT Z (0 0 0)
SELECT _ST_ASEWKT(_ST_GeogFromText('POINT Z (-1234 +5678 +91011)'));
_ST_ASEWKT(_ST_GeogFromText('POINT Z (-1234 +5678 +91011)'))
SRID=4326;POINT Z (-154 -82 91011)
SELECT _ST_ASEWKT(_ST_GeogFromText('POINT Z (25.416666666666668 25.416666666666668 26.6666666666666)'));
_ST_ASEWKT(_ST_GeogFromText('POINT Z (25.416666666666668 25.416666666666668 26.6666666666666)'))
SRID=4326;POINT Z (25.416666666666668 25.416666666666668 26.6666666666666)
SELECT _ST_ASEWKT(_ST_GeogFromText('POINT Z (1e8 -23e4 +2e8)'));
_ST_ASEWKT(_ST_GeogFromText('POINT Z (1e8 -23e4 +2e8)'))
SRID=4326;POINT Z (-80 40 200000000)
SELECT _ST_ASEWKT(_st_geographyfromtext('POINT Z (0 0 0)'));
_ST_ASEWKT(_st_geographyfromtext('POINT Z (0 0 0)'))
SRID=4326;POINT Z (0 0 0)
SELECT _ST_ASEWKT(_st_geographyfromtext('POINT Z (-1234 +5678 +91011)'));
_ST_ASEWKT(_st_geographyfromtext('POINT Z (-1234 +5678 +91011)'))
SRID=4326;POINT Z (-154 -82 91011)
SELECT _ST_ASEWKT(_st_geographyfromtext('POINT Z (25.416666666666668 25.416666666666668 26.6666666666666)'));
_ST_ASEWKT(_st_geographyfromtext('POINT Z (25.416666666666668 25.416666666666668 26.6666666666666)'))
SRID=4326;POINT Z (25.416666666666668 25.416666666666668 26.6666666666666)
SELECT _ST_ASEWKT(_st_geographyfromtext('POINT Z (1e8 -23e4 +2e8)'));
_ST_ASEWKT(_st_geographyfromtext('POINT Z (1e8 -23e4 +2e8)'))
SRID=4326;POINT Z (-80 40 200000000)
SELECT _ST_ASEWKT(_ST_GeogFromText('LINESTRING Z(0 0 0,10 10 10)'));
_ST_ASEWKT(_ST_GeogFromText('LINESTRING Z(0 0 0,10 10 10)'))
SRID=4326;LINESTRING Z (0 0 0,10 10 10)
SELECT _ST_ASEWKT(_ST_GeogFromText('LINESTRING Z(0 0 10,-4 8 -3, 2000 2000 1000)'));
_ST_ASEWKT(_ST_GeogFromText('LINESTRING Z(0 0 10,-4 8 -3, 2000 2000 1000)'))
SRID=4326;LINESTRING Z (0 0 10,-4 8 -3,-160 -20 1000)
SELECT _ST_ASEWKT(_st_geographyfromtext('LINESTRING Z(0 0 0,10 10 10)'));
_ST_ASEWKT(_st_geographyfromtext('LINESTRING Z(0 0 0,10 10 10)'))
SRID=4326;LINESTRING Z (0 0 0,10 10 10)
SELECT _ST_ASEWKT(_st_geographyfromtext('LINESTRING Z(0 0 10,-4 8 -3, 2000 2000 1000)'));
_ST_ASEWKT(_st_geographyfromtext('LINESTRING Z(0 0 10,-4 8 -3, 2000 2000 1000)'))
SRID=4326;LINESTRING Z (0 0 10,-4 8 -3,-160 -20 1000)
SELECT _ST_ASEWKT(_ST_GeogFromText('Polygon Z((0 0 0, 0 8 1, 8 8 2, 8 10 3, -10 10 4, -10 0 5, 0 0 0))'));
_ST_ASEWKT(_ST_GeogFromText('Polygon Z((0 0 0, 0 8 1, 8 8 2, 8 10 3, -10 10 4, -10 0 5, 0 0 0))'))
SRID=4326;POLYGON Z ((0 0 0,0 8 1,8 8 2,8 10 3,-10 10 4,-10 0 5,0 0 0))
SELECT _ST_ASEWKT(_st_geographyfromtext('Polygon Z((0 0 0, 0 8 1, 8 8 2, 8 10 3, -10 10 4, -10 0 5, 0 0 0))'));
_ST_ASEWKT(_st_geographyfromtext('Polygon Z((0 0 0, 0 8 1, 8 8 2, 8 10 3, -10 10 4, -10 0 5, 0 0 0))'))
SRID=4326;POLYGON Z ((0 0 0,0 8 1,8 8 2,8 10 3,-10 10 4,-10 0 5,0 0 0))
SELECT _ST_ASEWKT(_ST_GeogFromText('MULTIPOINT Z(1 1 1, 11 11 12, 11 21 13, 21 21 14)'));
_ST_ASEWKT(_ST_GeogFromText('MULTIPOINT Z(1 1 1, 11 11 12, 11 21 13, 21 21 14)'))
SRID=4326;MULTIPOINT Z ((1 1 1),(11 11 12),(11 21 13),(21 21 14))
SELECT _ST_ASEWKT(_ST_GeogFromText('MULTIPOINT Z((0 0 1),(10 10 2),(10 20 3),(20 20 4))'));
_ST_ASEWKT(_ST_GeogFromText('MULTIPOINT Z((0 0 1),(10 10 2),(10 20 3),(20 20 4))'))
SRID=4326;MULTIPOINT Z ((0 0 1),(10 10 2),(10 20 3),(20 20 4))
SELECT _ST_ASEWKT(_st_geographyfromtext('MULTIPOINT Z(1 1 1, 11 11 12, 11 21 13, 21 21 14)'));
_ST_ASEWKT(_st_geographyfromtext('MULTIPOINT Z(1 1 1, 11 11 12, 11 21 13, 21 21 14)'))
SRID=4326;MULTIPOINT Z ((1 1 1),(11 11 12),(11 21 13),(21 21 14))
SELECT _ST_ASEWKT(_st_geographyfromtext('MULTIPOINT Z((0 0 1),(10 10 2),(10 20 3),(20 20 4))'));
_ST_ASEWKT(_st_geographyfromtext('MULTIPOINT Z((0 0 1),(10 10 2),(10 20 3),(20 20 4))'))
SRID=4326;MULTIPOINT Z ((0 0 1),(10 10 2),(10 20 3),(20 20 4))
SELECT _ST_ASEWKT(_ST_GeogFromText('MULTILINESTRING Z((10 48 23,10 21 12,10 0 34),(16 0 12,16 23 23,16 48 32))'));
_ST_ASEWKT(_ST_GeogFromText('MULTILINESTRING Z((10 48 23,10 21 12,10 0 34),(16 0 12,16 23 23,16 48 32))'))
SRID=4326;MULTILINESTRING Z ((10 48 23,10 21 12,10 0 34),(16 0 12,16 23 23,16 48 32))
SELECT _ST_ASEWKT(_st_geographyfromtext('MULTILINESTRING Z((10 48 23,10 21 12,10 0 34),(16 0 12,16 23 23,16 48 32))'));
_ST_ASEWKT(_st_geographyfromtext('MULTILINESTRING Z((10 48 23,10 21 12,10 0 34),(16 0 12,16 23 23,16 48 32))'))
SRID=4326;MULTILINESTRING Z ((10 48 23,10 21 12,10 0 34),(16 0 12,16 23 23,16 48 32))
SELECT _ST_ASEWKT(_ST_GeogFromText('MULTILINESTRING Z((10 48 23,10 21 12,10 0 34),(16 0 12,16 23 23,16 48 32))'));
_ST_ASEWKT(_ST_GeogFromText('MULTILINESTRING Z((10 48 23,10 21 12,10 0 34),(16 0 12,16 23 23,16 48 32))'))
SRID=4326;MULTILINESTRING Z ((10 48 23,10 21 12,10 0 34),(16 0 12,16 23 23,16 48 32))
SELECT _ST_ASEWKT(_st_geographyfromtext('MULTILINESTRING Z((10 48 23,10 21 12,10 0 34),(16 0 12,16 23 23,16 48 32))'));
_ST_ASEWKT(_st_geographyfromtext('MULTILINESTRING Z((10 48 23,10 21 12,10 0 34),(16 0 12,16 23 23,16 48 32))'))
SRID=4326;MULTILINESTRING Z ((10 48 23,10 21 12,10 0 34),(16 0 12,16 23 23,16 48 32))
SELECT _ST_ASEWKT(_ST_GeogFromText('GEOMETRYCOLLECTION Z EMPTY'));
_ST_ASEWKT(_ST_GeogFromText('GEOMETRYCOLLECTION Z EMPTY'))
SRID=4326;GEOMETRYCOLLECTION Z EMPTY
SELECT _ST_ASEWKT(_ST_GeogFromText('GEOMETRYCOLLECTION Z ()'));
_ST_ASEWKT(_ST_GeogFromText('GEOMETRYCOLLECTION Z ()'))
SRID=4326;GEOMETRYCOLLECTION Z EMPTY
SELECT _ST_ASEWKT(_ST_GeogFromText('GEOMETRYCOLLECTION Z (Point(9 9 9),LINESTRING(1 5 1,0 0 2),POLYGON((2 2 2,2 8 1,8 8 3,8 2 4,2 2 2)))'));
_ST_ASEWKT(_ST_GeogFromText('GEOMETRYCOLLECTION Z (Point(9 9 9),LINESTRING(1 5 1,0 0 2),POLYGON((2 2 2,2 8 1,8 8 3,8 2 4,2 2 2)))'))
SRID=4326;GEOMETRYCOLLECTION Z (POINT Z (9 9 9),LINESTRING Z (1 5 1,0 0 2),POLYGON Z ((2 2 2,2 8 1,8 8 3,8 2 4,2 2 2)))
SELECT _ST_ASEWKT(_ST_GeogFromText('GEOMETRYCOLLECTION Z(GEOMETRYCOLLECTION(),GEOMETRYCOLLECTION EMPTY, GEOMETRYCOLLECTION(POINT(1 1 3)), MULTILINESTRING((10 48 3,10 21 3,10 0 1),(16 0 3,16 23 4,16 48 5)), MULTIPOLYGON(((28 26 23,28 0 1,84 0 2,84 42 4,28 26 23),(52 18 13,66 23 25,73 9 12,48 6 34,52 18 13)),((59 18 1,67 18 12,67 13 23,59 13 45,59 18 1))), MULTIPOINT((0 0 1),(10 10 3),(10 20 4),(20 20 5)), MULTIPOINT(1 1 1, 11 11 11, 11 21 22, 21 21 23), GEOMETRYCOLLECTION(LINESTRING(1 1 1,2 2 3)), GEOMETRYCOLLECTION(POLYGON((0 0 1,50 45 23,40 50 34,0 0 1)),LINESTRING(-10 -10 1,0 0 2),LINESTRING(46.666666666666664 46.666666666666664 46.666666666666664,200 200 12,199 201 23,45.333333333333336 47.333333333333336 47.333333333333336),LINESTRING(8 10 1,-11 -9 -3)))'));
_ST_ASEWKT(_ST_GeogFromText('GEOMETRYCOLLECTION Z(GEOMETRYCOLLECTION(),GEOMETRYCOLLECTION EMPTY, GEOMETRYCOLLECTION(POINT(1 1 3)), MULTILINESTRING((10 48 3,10 21 3,10 0 1),(16 0 3,16 23 4,16 48 5)), MULTIPOLYGON(((28 26 23,28 0 1,84 0 2,84 42 4,28 26 23),
SRID=4326;GEOMETRYCOLLECTION Z (GEOMETRYCOLLECTION Z EMPTY,GEOMETRYCOLLECTION Z EMPTY,GEOMETRYCOLLECTION Z (POINT Z (1 1 3)),MULTILINESTRING Z ((10 48 3,10 21 3,10 0 1),(16 0 3,16 23 4,16 48 5)),MULTIPOLYGON Z (((28 26 23,28 0 1,84 0 2,84 42 4,28 26 23),(52 18 13,66 23 25,73 9 12,48 6 34,52 18 13)),((59 18 1,67 18 12,67 13 23,59 13 45,59 18 1))),MULTIPOINT Z ((0 0 1),(10 10 3),(10 20 4),(20 20 5)),MULTIPOINT Z ((1 1 1),(11 11 11),(11 21 22),(21 21 23)),GEOMETRYCOLLECTION Z (LINESTRING Z (1 1 1,2 2 3)),GEOMETRYCOLLECTION Z (POLYGON Z ((0 0 1,50 45 23,40 50 34,0 0 1)),LINESTRING Z (-10 -10 1,0 0 2),LINESTRING Z (46.666666666666664 46.666666666666664 46.666666666666664,-160 -20 12,-161 -21 23,45.333333333333336 47.333333333333336 47.333333333333336),LINESTRING Z (8 10 1,-11 -9 -3)))
SELECT _ST_ASEWKT(_st_geographyfromtext('GEOMETRYCOLLECTION Z EMPTY'));
_ST_ASEWKT(_st_geographyfromtext('GEOMETRYCOLLECTION Z EMPTY'))
SRID=4326;GEOMETRYCOLLECTION Z EMPTY
SELECT _ST_ASEWKT(_st_geographyfromtext('GEOMETRYCOLLECTION Z ()'));
_ST_ASEWKT(_st_geographyfromtext('GEOMETRYCOLLECTION Z ()'))
SRID=4326;GEOMETRYCOLLECTION Z EMPTY
SELECT _ST_ASEWKT(_st_geographyfromtext('GEOMETRYCOLLECTION Z (Point(9 9 9),LINESTRING(1 5 1,0 0 2),POLYGON((2 2 2,2 8 1,8 8 3,8 2 4,2 2 2)))'));
_ST_ASEWKT(_st_geographyfromtext('GEOMETRYCOLLECTION Z (Point(9 9 9),LINESTRING(1 5 1,0 0 2),POLYGON((2 2 2,2 8 1,8 8 3,8 2 4,2 2 2)))'))
SRID=4326;GEOMETRYCOLLECTION Z (POINT Z (9 9 9),LINESTRING Z (1 5 1,0 0 2),POLYGON Z ((2 2 2,2 8 1,8 8 3,8 2 4,2 2 2)))
SELECT _ST_ASEWKT(_st_geographyfromtext('GEOMETRYCOLLECTION Z(GEOMETRYCOLLECTION(),GEOMETRYCOLLECTION EMPTY, GEOMETRYCOLLECTION(POINT(1 1 3)), MULTILINESTRING((10 48 3,10 21 3,10 0 1),(16 0 3,16 23 4,16 48 5)), MULTIPOLYGON(((28 26 23,28 0 1,84 0 2,84 42 4,28 26 23),(52 18 13,66 23 25,73 9 12,48 6 34,52 18 13)),((59 18 1,67 18 12,67 13 23,59 13 45,59 18 1))), MULTIPOINT((0 0 1),(10 10 3),(10 20 4),(20 20 5)), MULTIPOINT(1 1 1, 11 11 11, 11 21 22, 21 21 23), GEOMETRYCOLLECTION(LINESTRING(1 1 1,2 2 3)), GEOMETRYCOLLECTION(POLYGON((0 0 1,50 45 23,40 50 34,0 0 1)),LINESTRING(-10 -10 1,0 0 2),LINESTRING(46.666666666666664 46.666666666666664 46.666666666666664,200 200 12,199 201 23,45.333333333333336 47.333333333333336 47.333333333333336),LINESTRING(8 10 1,-11 -9 -3)))'));
_ST_ASEWKT(_st_geographyfromtext('GEOMETRYCOLLECTION Z(GEOMETRYCOLLECTION(),GEOMETRYCOLLECTION EMPTY, GEOMETRYCOLLECTION(POINT(1 1 3)), MULTILINESTRING((10 48 3,10 21 3,10 0 1),(16 0 3,16 23 4,16 48 5)), MULTIPOLYGON(((28 26 23,28 0 1,84 0 2,84 42 4,28 26
SRID=4326;GEOMETRYCOLLECTION Z (GEOMETRYCOLLECTION Z EMPTY,GEOMETRYCOLLECTION Z EMPTY,GEOMETRYCOLLECTION Z (POINT Z (1 1 3)),MULTILINESTRING Z ((10 48 3,10 21 3,10 0 1),(16 0 3,16 23 4,16 48 5)),MULTIPOLYGON Z (((28 26 23,28 0 1,84 0 2,84 42 4,28 26 23),(52 18 13,66 23 25,73 9 12,48 6 34,52 18 13)),((59 18 1,67 18 12,67 13 23,59 13 45,59 18 1))),MULTIPOINT Z ((0 0 1),(10 10 3),(10 20 4),(20 20 5)),MULTIPOINT Z ((1 1 1),(11 11 11),(11 21 22),(21 21 23)),GEOMETRYCOLLECTION Z (LINESTRING Z (1 1 1,2 2 3)),GEOMETRYCOLLECTION Z (POLYGON Z ((0 0 1,50 45 23,40 50 34,0 0 1)),LINESTRING Z (-10 -10 1,0 0 2),LINESTRING Z (46.666666666666664 46.666666666666664 46.666666666666664,-160 -20 12,-161 -21 23,45.333333333333336 47.333333333333336 47.333333333333336),LINESTRING Z (8 10 1,-11 -9 -3)))
drop table if exists geo_3d;
CREATE TABLE geo_3d (
id INT PRIMARY KEY AUTO_INCREMENT,
type_name TEXT,
geo_value GEOMETRY
);
INSERT INTO geo_3d (type_name,geo_value) VALUES
('POINTZ', ST_GeomFromText('POINT Z (0 0 0)')),
('POINTZ', ST_GeomFromText('POINT Z (-1234 +5678 +91011)')),
('POINTZ', ST_GeomFromText('POINT Z (25.416666666666668 25.416666666666668 26.6666666666666)')),
('POINTZ', ST_GeomFromText('POINT Z (1e8 -23e4 +2e8)')),
('LINESTRINGZ', ST_GeomFromText('LINESTRING Z(0 0 0,10 10 10)')),
('LINESTRINGZ', ST_GeomFromText('LINESTRING Z(0 0 10,-4 8 -3, 2000 2000 1000)')),
('POLYGONZ', ST_GeomFromText('Polygon Z((0 0 0, 0 8 1, 8 8 2, 8 10 3, -10 10 4, -10 0 5, 0 0 0))')),
('MULTIPOINTZ', ST_GeomFromText('MULTIPOINT Z(1 1 1, 11 11 12, 11 21 13, 21 21 14)')),
('MULTILINESTRINGZ', ST_GeomFromText('MULTILINESTRING Z((10 48 23,10 21 12,10 0 34),(16 0 12,16 23 23,16 48 32))')),
('MULTIPOLYGONZ', ST_GeomFromText('MULTIPOLYGON Z(((28 26 1,28 0 2,84 0 3,84 42 4,28 26 1),(52 18 34,66 23 54,73 9 67,48 6 65,52 18 34)),((59 18 11,67 18 34,67 13 23,59 13 56,59 18 11)))')),
('GEOMETRYCOLLECTIONZ', ST_GeomFromText('GEOMETRYCOLLECTION Z(GEOMETRYCOLLECTION(),GEOMETRYCOLLECTION EMPTY, GEOMETRYCOLLECTION(POINT(1 1 3)), MULTILINESTRING((10 48 3,10 21 3,10 0 1),(16 0 3,16 23 4,16 48 5)), MULTIPOLYGON(((28 26 23,28 0 1,84 0 2,84 42 4,28 26 23),(52 18 13,66 23 25,73 9 12,48 6 34,52 18 13)),((59 18 1,67 18 12,67 13 23,59 13 45,59 18 1))), MULTIPOINT((0 0 1),(10 10 3),(10 20 4),(20 20 5)), MULTIPOINT(1 1 1, 11 11 11, 11 21 22, 21 21 23), GEOMETRYCOLLECTION(LINESTRING(1 1 1,2 2 3)), GEOMETRYCOLLECTION(POLYGON((0 0 1,50 45 23,40 50 34,0 0 1)),LINESTRING(-10 -10 1,0 0 2),LINESTRING(46.666666666666664 46.666666666666664 46.666666666666664,200 200 12,199 201 23,45.333333333333336 47.333333333333336 47.333333333333336),LINESTRING(8 10 1,-11 -9 -3)))'));
SELECT type_name,ST_ASText(geo_value), ST_ASWKT(geo_value), _ST_ASEWKT(geo_value) FROM geo_3d ORDER BY id;
type_name	ST_ASText(geo_value)	ST_ASWKT(geo_value)	_ST_ASEWKT(geo_value)
POINTZ	POINT Z (0 0 0)	POINT Z (0 0 0)	POINT Z (0 0 0)
POINTZ	POINT Z (-1234 5678 91011)	POINT Z (-1234 5678 91011)	POINT Z (-1234 5678 91011)
POINTZ	POINT Z (25.416666666666668 25.416666666666668 26.6666666666666)	POINT Z (25.416666666666668 25.416666666666668 26.6666666666666)	POINT Z (25.416666666666668 25.416666666666668 26.6666666666666)
POINTZ	POINT Z (100000000 -230000 200000000)	POINT Z (100000000 -230000 200000000)	POINT Z (100000000 -230000 200000000)
LINESTRINGZ	LINESTRING Z (0 0 0,10 10 10)	LINESTRING Z (0 0 0,10 10 10)	LINESTRING Z (0 0 0,10 10 10)
LINESTRINGZ	LINESTRING Z (0 0 10,-4 8 -3,2000 2000 1000)	LINESTRING Z (0 0 10,-4 8 -3,2000 2000 1000)	LINESTRING Z (0 0 10,-4 8 -3,2000 2000 1000)
POLYGONZ	POLYGON Z ((0 0 0,0 8 1,8 8 2,8 10 3,-10 10 4,-10 0 5,0 0 0))	POLYGON Z ((0 0 0,0 8 1,8 8 2,8 10 3,-10 10 4,-10 0 5,0 0 0))	POLYGON Z ((0 0 0,0 8 1,8 8 2,8 10 3,-10 10 4,-10 0 5,0 0 0))
MULTIPOINTZ	MULTIPOINT Z ((1 1 1),(11 11 12),(11 21 13),(21 21 14))	MULTIPOINT Z ((1 1 1),(11 11 12),(11 21 13),(21 21 14))	MULTIPOINT Z ((1 1 1),(11 11 12),(11 21 13),(21 21 14))
MULTILINESTRINGZ	MULTILINESTRING Z ((10 48 23,10 21 12,10 0 34),(16 0 12,16 23 23,16 48 32))	MULTILINESTRING Z ((10 48 23,10 21 12,10 0 34),(16 0 12,16 23 23,16 48 32))	MULTILINESTRING Z ((10 48 23,10 21 12,10 0 34),(16 0 12,16 23 23,16 48 32))
MULTIPOLYGONZ	MULTIPOLYGON Z (((28 26 1,28 0 2,84 0 3,84 42 4,28 26 1),(52 18 34,66 23 54,73 9 67,48 6 65,52 18 34)),((59 18 11,67 18 34,67 13 23,59 13 56,59 18 11)))	MULTIPOLYGON Z (((28 26 1,28 0 2,84 0 3,84 42 4,28 26 1),(52 18 34,66 23 54,73 9 67,48 6 65,52 18 34)),((59 18 11,67 18 34,67 13 23,59 13 56,59 18 11)))	MULTIPOLYGON Z (((28 26 1,28 0 2,84 0 3,84 42 4,28 26 1),(52 18 34,66 23 54,73 9 67,48 6 65,52 18 34)),((59 18 11,67 18 34,67 13 23,59 13 56,59 18 11)))
GEOMETRYCOLLECTIONZ	GEOMETRYCOLLECTION Z (GEOMETRYCOLLECTION Z EMPTY,GEOMETRYCOLLECTION Z EMPTY,GEOMETRYCOLLECTION Z (POINT Z (1 1 3)),MULTILINESTRING Z ((10 48 3,10 21 3,10 0 1),(16 0 3,16 23 4,16 48 5)),MULTIPOLYGON Z (((28 26 23,28 0 1,84 0 2,84 42 4,28 26 23),(52 18 13,66 23 25,73 9 12,48 6 34,52 18 13)),((59 18 1,67 18 12,67 13 23,59 13 45,59 18 1))),MULTIPOINT Z ((0 0 1),(10 10 3),(10 20 4),(20 20 5)),MULTIPOINT Z ((1 1 1),(11 11 11),(11 21 22),(21 21 23)),GEOMETRYCOLLECTION Z (LINESTRING Z (1 1 1,2 2 3)),GEOMETRYCOLLECTION Z (POLYGON Z ((0 0 1,50 45 23,40 50 34,0 0 1)),LINESTRING Z (-10 -10 1,0 0 2),LINESTRING Z (46.666666666666664 46.666666666666664 46.666666666666664,200 200 12,199 201 23,45.333333333333336 47.333333333333336 47.333333333333336),LINESTRING Z (8 10 1,-11 -9 -3)))	GEOMETRYCOLLECTION Z (GEOMETRYCOLLECTION Z EMPTY,GEOMETRYCOLLECTION Z EMPTY,GEOMETRYCOLLECTION Z (POINT Z (1 1 3)),MULTILINESTRING Z ((10 48 3,10 21 3,10 0 1),(16 0 3,16 23 4,16 48 5)),MULTIPOLYGON Z (((28 26 23,28 0 1,84 0 2,84 42 4,28 26 23),(52 18 13,66 23 25,73 9 12,48 6 34,52 18 13)),((59 18 1,67 18 12,67 13 23,59 13 45,59 18 1))),MULTIPOINT Z ((0 0 1),(10 10 3),(10 20 4),(20 20 5)),MULTIPOINT Z ((1 1 1),(11 11 11),(11 21 22),(21 21 23)),GEOMETRYCOLLECTION Z (LINESTRING Z (1 1 1,2 2 3)),GEOMETRYCOLLECTION Z (POLYGON Z ((0 0 1,50 45 23,40 50 34,0 0 1)),LINESTRING Z (-10 -10 1,0 0 2),LINESTRING Z (46.666666666666664 46.666666666666664 46.666666666666664,200 200 12,199 201 23,45.333333333333336 47.333333333333336 47.333333333333336),LINESTRING Z (8 10 1,-11 -9 -3)))	GEOMETRYCOLLECTION Z (GEOMETRYCOLLECTION Z EMPTY,GEOMETRYCOLLECTION Z EMPTY,GEOMETRYCOLLECTION Z (POINT Z (1 1 3)),MULTILINESTRING Z ((10 48 3,10 21 3,10 0 1),(16 0 3,16 23 4,16 48 5)),MULTIPOLYGON Z (((28 26 23,28 0 1,84 0 2,84 42 4,28 26 23),(52 18 13,66 23 25,73 9 12,48 6 34,52 18 13)),((59 18 1,67 18 12,67 13 23,59 13 45,59 18 1))),MULTIPOINT Z ((0 0 1),(10 10 3),(10 20 4),(20 20 5)),MULTIPOINT Z ((1 1 1),(11 11 11),(11 21 22),(21 21 23)),GEOMETRYCOLLECTION Z (LINESTRING Z (1 1 1,2 2 3)),GEOMETRYCOLLECTION Z (POLYGON Z ((0 0 1,50 45 23,40 50 34,0 0 1)),LINESTRING Z (-10 -10 1,0 0 2),LINESTRING Z (46.666666666666664 46.666666666666664 46.666666666666664,200 200 12,199 201 23,45.333333333333336 47.333333333333336 47.333333333333336),LINESTRING Z (8 10 1,-11 -9 -3)))
UPDATE geo_3d SET geo_value = ST_GeomFromText('POINT Z (0 0 0)') WHERE type_name='POINTZ';
UPDATE geo_3d SET geo_value = ST_GeomFromText('LINESTRING Z(0 0 1,10 10 10)') WHERE type_name='LINESTRINGZ';
UPDATE geo_3d SET geo_value = ST_GeomFromText('Polygon Z((0 0 0, 0 8 1, 8 8 2, 8 10 3, -10 10 4, -10 0 5, 0 0 0))') WHERE type_name='POLYGONZ';
UPDATE geo_3d SET geo_value = ST_GeomFromText('MULTIPOINT Z(1 1 1, 11 11 12)') WHERE type_name='MULTIPOINTZ';
UPDATE geo_3d SET geo_value = ST_GeomFromText('MULTILINESTRING Z((10 48 23,10 21 12,10 0 34))') WHERE type_name='MULTILINESTRINGZ';
UPDATE geo_3d SET geo_value = ST_GeomFromText('MULTIPOLYGON Z(((28 26 1,28 0 2,84 0 3,84 42 4,28 26 1)))') WHERE type_name='MULTIPOLYGONZ';
UPDATE geo_3d SET geo_value = ST_GeomFromText('GEOMETRYCOLLECTION Z(GEOMETRYCOLLECTION())') WHERE type_name='GEOMETRYCOLLECTIONZ';
SELECT type_name,ST_ASText(geo_value), ST_ASWKT(geo_value), _ST_ASEWKT(geo_value) FROM geo_3d ORDER BY id;
type_name	ST_ASText(geo_value)	ST_ASWKT(geo_value)	_ST_ASEWKT(geo_value)
POINTZ	POINT Z (0 0 0)	POINT Z (0 0 0)	POINT Z (0 0 0)
POINTZ	POINT Z (0 0 0)	POINT Z (0 0 0)	POINT Z (0 0 0)
POINTZ	POINT Z (0 0 0)	POINT Z (0 0 0)	POINT Z (0 0 0)
POINTZ	POINT Z (0 0 0)	POINT Z (0 0 0)	POINT Z (0 0 0)
LINESTRINGZ	LINESTRING Z (0 0 1,10 10 10)	LINESTRING Z (0 0 1,10 10 10)	LINESTRING Z (0 0 1,10 10 10)
LINESTRINGZ	LINESTRING Z (0 0 1,10 10 10)	LINESTRING Z (0 0 1,10 10 10)	LINESTRING Z (0 0 1,10 10 10)
POLYGONZ	POLYGON Z ((0 0 0,0 8 1,8 8 2,8 10 3,-10 10 4,-10 0 5,0 0 0))	POLYGON Z ((0 0 0,0 8 1,8 8 2,8 10 3,-10 10 4,-10 0 5,0 0 0))	POLYGON Z ((0 0 0,0 8 1,8 8 2,8 10 3,-10 10 4,-10 0 5,0 0 0))
MULTIPOINTZ	MULTIPOINT Z ((1 1 1),(11 11 12))	MULTIPOINT Z ((1 1 1),(11 11 12))	MULTIPOINT Z ((1 1 1),(11 11 12))
MULTILINESTRINGZ	MULTILINESTRING Z ((10 48 23,10 21 12,10 0 34))	MULTILINESTRING Z ((10 48 23,10 21 12,10 0 34))	MULTILINESTRING Z ((10 48 23,10 21 12,10 0 34))
MULTIPOLYGONZ	MULTIPOLYGON Z (((28 26 1,28 0 2,84 0 3,84 42 4,28 26 1)))	MULTIPOLYGON Z (((28 26 1,28 0 2,84 0 3,84 42 4,28 26 1)))	MULTIPOLYGON Z (((28 26 1,28 0 2,84 0 3,84 42 4,28 26 1)))
GEOMETRYCOLLECTIONZ	GEOMETRYCOLLECTION Z (GEOMETRYCOLLECTION Z EMPTY)	GEOMETRYCOLLECTION Z (GEOMETRYCOLLECTION Z EMPTY)	GEOMETRYCOLLECTION Z (GEOMETRYCOLLECTION Z EMPTY)
DELETE FROM geo_3d;
INSERT INTO geo_3d (type_name,geo_value) VALUES
('POINTZ', ST_GeometryFromText('POINT Z (0 0 0)')),
('POINTZ', ST_GeometryFromText('POINT Z (-1234 +5678 +91011)')),
('POINTZ', ST_GeometryFromText('POINT Z (25.416666666666668 25.416666666666668 26.6666666666666)')),
('POINTZ', ST_GeometryFromText('POINT Z (1e8 -23e4 +2e8)')),
('LINESTRINGZ', ST_GeometryFromText('LINESTRING Z(0 0 0,10 10 10)')),
('LINESTRINGZ', ST_GeometryFromText('LINESTRING Z(0 0 10,-4 8 -3, 2000 2000 1000)')),
('POLYGONZ', ST_GeometryFromText('Polygon Z((0 0 0, 0 8 1, 8 8 2, 8 10 3, -10 10 4, -10 0 5, 0 0 0))')),
('MULTIPOINTZ', ST_GeometryFromText('MULTIPOINT Z(1 1 1, 11 11 12, 11 21 13, 21 21 14)')),
('MULTILINESTRINGZ', ST_GeometryFromText('MULTILINESTRING Z((10 48 23,10 21 12,10 0 34),(16 0 12,16 23 23,16 48 32))')),
('MULTIPOLYGONZ', ST_GeometryFromText('MULTIPOLYGON Z(((28 26 1,28 0 2,84 0 3,84 42 4,28 26 1),(52 18 34,66 23 54,73 9 67,48 6 65,52 18 34)),((59 18 11,67 18 34,67 13 23,59 13 56,59 18 11)))')),
('GEOMETRYCOLLECTIONZ', ST_GeometryFromText('GEOMETRYCOLLECTION Z(GEOMETRYCOLLECTION(),GEOMETRYCOLLECTION EMPTY, GEOMETRYCOLLECTION(POINT(1 1 3)), MULTILINESTRING((10 48 3,10 21 3,10 0 1),(16 0 3,16 23 4,16 48 5)), MULTIPOLYGON(((28 26 23,28 0 1,84 0 2,84 42 4,28 26 23),(52 18 13,66 23 25,73 9 12,48 6 34,52 18 13)),((59 18 1,67 18 12,67 13 23,59 13 45,59 18 1))), MULTIPOINT((0 0 1),(10 10 3),(10 20 4),(20 20 5)), MULTIPOINT(1 1 1, 11 11 11, 11 21 22, 21 21 23), GEOMETRYCOLLECTION(LINESTRING(1 1 1,2 2 3)), GEOMETRYCOLLECTION(POLYGON((0 0 1,50 45 23,40 50 34,0 0 1)),LINESTRING(-10 -10 1,0 0 2),LINESTRING(46.666666666666664 46.666666666666664 46.666666666666664,200 200 12,199 201 23,45.333333333333336 47.333333333333336 47.333333333333336),LINESTRING(8 10 1,-11 -9 -3)))'));
SELECT type_name,ST_ASText(geo_value), ST_ASWKT(geo_value), _ST_ASEWKT(geo_value) FROM geo_3d ORDER BY id;
type_name	ST_ASText(geo_value)	ST_ASWKT(geo_value)	_ST_ASEWKT(geo_value)
POINTZ	POINT Z (0 0 0)	POINT Z (0 0 0)	POINT Z (0 0 0)
POINTZ	POINT Z (-1234 5678 91011)	POINT Z (-1234 5678 91011)	POINT Z (-1234 5678 91011)
POINTZ	POINT Z (25.416666666666668 25.416666666666668 26.6666666666666)	POINT Z (25.416666666666668 25.416666666666668 26.6666666666666)	POINT Z (25.416666666666668 25.416666666666668 26.6666666666666)
POINTZ	POINT Z (100000000 -230000 200000000)	POINT Z (100000000 -230000 200000000)	POINT Z (100000000 -230000 200000000)
LINESTRINGZ	LINESTRING Z (0 0 0,10 10 10)	LINESTRING Z (0 0 0,10 10 10)	LINESTRING Z (0 0 0,10 10 10)
LINESTRINGZ	LINESTRING Z (0 0 10,-4 8 -3,2000 2000 1000)	LINESTRING Z (0 0 10,-4 8 -3,2000 2000 1000)	LINESTRING Z (0 0 10,-4 8 -3,2000 2000 1000)
POLYGONZ	POLYGON Z ((0 0 0,0 8 1,8 8 2,8 10 3,-10 10 4,-10 0 5,0 0 0))	POLYGON Z ((0 0 0,0 8 1,8 8 2,8 10 3,-10 10 4,-10 0 5,0 0 0))	POLYGON Z ((0 0 0,0 8 1,8 8 2,8 10 3,-10 10 4,-10 0 5,0 0 0))
MULTIPOINTZ	MULTIPOINT Z ((1 1 1),(11 11 12),(11 21 13),(21 21 14))	MULTIPOINT Z ((1 1 1),(11 11 12),(11 21 13),(21 21 14))	MULTIPOINT Z ((1 1 1),(11 11 12),(11 21 13),(21 21 14))
MULTILINESTRINGZ	MULTILINESTRING Z ((10 48 23,10 21 12,10 0 34),(16 0 12,16 23 23,16 48 32))	MULTILINESTRING Z ((10 48 23,10 21 12,10 0 34),(16 0 12,16 23 23,16 48 32))	MULTILINESTRING Z ((10 48 23,10 21 12,10 0 34),(16 0 12,16 23 23,16 48 32))
MULTIPOLYGONZ	MULTIPOLYGON Z (((28 26 1,28 0 2,84 0 3,84 42 4,28 26 1),(52 18 34,66 23 54,73 9 67,48 6 65,52 18 34)),((59 18 11,67 18 34,67 13 23,59 13 56,59 18 11)))	MULTIPOLYGON Z (((28 26 1,28 0 2,84 0 3,84 42 4,28 26 1),(52 18 34,66 23 54,73 9 67,48 6 65,52 18 34)),((59 18 11,67 18 34,67 13 23,59 13 56,59 18 11)))	MULTIPOLYGON Z (((28 26 1,28 0 2,84 0 3,84 42 4,28 26 1),(52 18 34,66 23 54,73 9 67,48 6 65,52 18 34)),((59 18 11,67 18 34,67 13 23,59 13 56,59 18 11)))
GEOMETRYCOLLECTIONZ	GEOMETRYCOLLECTION Z (GEOMETRYCOLLECTION Z EMPTY,GEOMETRYCOLLECTION Z EMPTY,GEOMETRYCOLLECTION Z (POINT Z (1 1 3)),MULTILINESTRING Z ((10 48 3,10 21 3,10 0 1),(16 0 3,16 23 4,16 48 5)),MULTIPOLYGON Z (((28 26 23,28 0 1,84 0 2,84 42 4,28 26 23),(52 18 13,66 23 25,73 9 12,48 6 34,52 18 13)),((59 18 1,67 18 12,67 13 23,59 13 45,59 18 1))),MULTIPOINT Z ((0 0 1),(10 10 3),(10 20 4),(20 20 5)),MULTIPOINT Z ((1 1 1),(11 11 11),(11 21 22),(21 21 23)),GEOMETRYCOLLECTION Z (LINESTRING Z (1 1 1,2 2 3)),GEOMETRYCOLLECTION Z (POLYGON Z ((0 0 1,50 45 23,40 50 34,0 0 1)),LINESTRING Z (-10 -10 1,0 0 2),LINESTRING Z (46.666666666666664 46.666666666666664 46.666666666666664,200 200 12,199 201 23,45.333333333333336 47.333333333333336 47.333333333333336),LINESTRING Z (8 10 1,-11 -9 -3)))	GEOMETRYCOLLECTION Z (GEOMETRYCOLLECTION Z EMPTY,GEOMETRYCOLLECTION Z EMPTY,GEOMETRYCOLLECTION Z (POINT Z (1 1 3)),MULTILINESTRING Z ((10 48 3,10 21 3,10 0 1),(16 0 3,16 23 4,16 48 5)),MULTIPOLYGON Z (((28 26 23,28 0 1,84 0 2,84 42 4,28 26 23),(52 18 13,66 23 25,73 9 12,48 6 34,52 18 13)),((59 18 1,67 18 12,67 13 23,59 13 45,59 18 1))),MULTIPOINT Z ((0 0 1),(10 10 3),(10 20 4),(20 20 5)),MULTIPOINT Z ((1 1 1),(11 11 11),(11 21 22),(21 21 23)),GEOMETRYCOLLECTION Z (LINESTRING Z (1 1 1,2 2 3)),GEOMETRYCOLLECTION Z (POLYGON Z ((0 0 1,50 45 23,40 50 34,0 0 1)),LINESTRING Z (-10 -10 1,0 0 2),LINESTRING Z (46.666666666666664 46.666666666666664 46.666666666666664,200 200 12,199 201 23,45.333333333333336 47.333333333333336 47.333333333333336),LINESTRING Z (8 10 1,-11 -9 -3)))	GEOMETRYCOLLECTION Z (GEOMETRYCOLLECTION Z EMPTY,GEOMETRYCOLLECTION Z EMPTY,GEOMETRYCOLLECTION Z (POINT Z (1 1 3)),MULTILINESTRING Z ((10 48 3,10 21 3,10 0 1),(16 0 3,16 23 4,16 48 5)),MULTIPOLYGON Z (((28 26 23,28 0 1,84 0 2,84 42 4,28 26 23),(52 18 13,66 23 25,73 9 12,48 6 34,52 18 13)),((59 18 1,67 18 12,67 13 23,59 13 45,59 18 1))),MULTIPOINT Z ((0 0 1),(10 10 3),(10 20 4),(20 20 5)),MULTIPOINT Z ((1 1 1),(11 11 11),(11 21 22),(21 21 23)),GEOMETRYCOLLECTION Z (LINESTRING Z (1 1 1,2 2 3)),GEOMETRYCOLLECTION Z (POLYGON Z ((0 0 1,50 45 23,40 50 34,0 0 1)),LINESTRING Z (-10 -10 1,0 0 2),LINESTRING Z (46.666666666666664 46.666666666666664 46.666666666666664,200 200 12,199 201 23,45.333333333333336 47.333333333333336 47.333333333333336),LINESTRING Z (8 10 1,-11 -9 -3)))
DELETE FROM geo_3d;
INSERT INTO geo_3d (type_name,geo_value) VALUES
('POINTZ', _ST_GeomFromEWKT('POINT Z (0 0 0)')),
('POINTZ', _ST_GeomFromEWKT('POINT Z (-1234 +5678 +91011)')),
('POINTZ', _ST_GeomFromEWKT('POINT Z (25.416666666666668 25.416666666666668 26.6666666666666)')),
('POINTZ', _ST_GeomFromEWKT('POINT Z (1e8 -23e4 +2e8)')),
('LINESTRINGZ', _ST_GeomFromEWKT('LINESTRING Z(0 0 0,10 10 10)')),
('LINESTRINGZ', _ST_GeomFromEWKT('LINESTRING Z(0 0 10,-4 8 -3, 2000 2000 1000)')),
('POLYGONZ', _ST_GeomFromEWKT('Polygon Z((0 0 0, 0 8 1, 8 8 2, 8 10 3, -10 10 4, -10 0 5, 0 0 0))')),
('MULTIPOINTZ', _ST_GeomFromEWKT('MULTIPOINT Z(1 1 1, 11 11 12, 11 21 13, 21 21 14)')),
('MULTILINESTRINGZ', _ST_GeomFromEWKT('MULTILINESTRING Z((10 48 23,10 21 12,10 0 34),(16 0 12,16 23 23,16 48 32))')),
('MULTIPOLYGONZ', _ST_GeomFromEWKT('MULTIPOLYGON Z(((28 26 1,28 0 2,84 0 3,84 42 4,28 26 1),(52 18 34,66 23 54,73 9 67,48 6 65,52 18 34)),((59 18 11,67 18 34,67 13 23,59 13 56,59 18 11)))')),
('GEOMETRYCOLLECTIONZ', _ST_GeomFromEWKT('GEOMETRYCOLLECTION Z(GEOMETRYCOLLECTION(),GEOMETRYCOLLECTION EMPTY, GEOMETRYCOLLECTION(POINT(1 1 3)), MULTILINESTRING((10 48 3,10 21 3,10 0 1),(16 0 3,16 23 4,16 48 5)), MULTIPOLYGON(((28 26 23,28 0 1,84 0 2,84 42 4,28 26 23),(52 18 13,66 23 25,73 9 12,48 6 34,52 18 13)),((59 18 1,67 18 12,67 13 23,59 13 45,59 18 1))), MULTIPOINT((0 0 1),(10 10 3),(10 20 4),(20 20 5)), MULTIPOINT(1 1 1, 11 11 11, 11 21 22, 21 21 23), GEOMETRYCOLLECTION(LINESTRING(1 1 1,2 2 3)), GEOMETRYCOLLECTION(POLYGON((0 0 1,50 45 23,40 50 34,0 0 1)),LINESTRING(-10 -10 1,0 0 2),LINESTRING(46.666666666666664 46.666666666666664 46.666666666666664,200 200 12,199 201 23,45.333333333333336 47.333333333333336 47.333333333333336),LINESTRING(8 10 1,-11 -9 -3)))'));
INSERT INTO geo_3d (type_name,geo_value) VALUES 
('POINTZ', _ST_GeomFromEWKT('SRID=6207;POINT(25.416666666666668 -25.416666666666668 25.416666666666668)')),
('LINESTRINGZ', _ST_GeomFromEWKT('SRID=6207;LINESTRING(0 0 1,10 10 12)')),
('PolygonZ', _ST_GeomFromEWKT('SRID=6207;Polygon((0 0 0, 0 8 1, 8 -8 12, 8 10 3, -10 10 -12, -10 0 12, 0 0 0))')),
('MULTIPOINTZ', _ST_GeomFromEWKT('SRID=6207;MULTIPOINT((0 0 1),(10 -10 23),(10 20 12),(20 20 12))')),
('MULTILINESTRINGZ', _ST_GeomFromEWKT('SRID=6207;MULTILINESTRING((10 48 12,10 21 23,10 0 11),(16 0 12,16 23 23,16 48 12))')),
('MULTIPOLYGONZ', _ST_GeomFromEWKT('SRID=6207;MULTIPOLYGON(((28 26 11,28 0 23,84 0 23,84 42 45,28 26 11),(52 18 1,66 23 23,73 9 44,48 6 23,52 18 1)),((59 18 -1,67 18 33,67 13 45,59 13 23,59 18 -1)))')),
('GEOMETRYCOLLECTIONZ', _ST_GeomFromEWKT('SRID=6207;GEOMETRYCOLLECTION EMPTY')),
('GEOMETRYCOLLECTIONZ', _ST_GeomFromEWKT('SRID=6207;GEOMETRYCOLLECTION ()')),
('GEOMETRYCOLLECTIONZ', _ST_GeomFromEWKT('SRID=6207;GEOMETRYCOLLECTION Z(GEOMETRYCOLLECTION(),GEOMETRYCOLLECTION EMPTY, GEOMETRYCOLLECTION(POINT(1 1 3)), MULTILINESTRING((10 48 3,10 21 3,10 0 1),(16 0 3,16 23 4,16 48 5)), MULTIPOLYGON(((28 26 23,28 0 1,84 0 2,84 42 4,28 26 23),(52 18 13,66 23 25,73 9 12,48 6 34,52 18 13)),((59 18 1,67 18 12,67 13 23,59 13 45,59 18 1))), MULTIPOINT((0 0 1),(10 10 3),(10 20 4),(20 20 5)), MULTIPOINT(1 1 1, 11 11 11, 11 21 22, 21 21 23), GEOMETRYCOLLECTION(LINESTRING(1 1 1,2 2 3)), GEOMETRYCOLLECTION(POLYGON((0 0 1,50 45 23,40 50 34,0 0 1)),LINESTRING(-10 -10 1,0 0 2),LINESTRING(46.666666666666664 46.666666666666664 46.666666666666664,20 20 12,19 20 23,45.333333333333336 47.333333333333336 47.333333333333336),LINESTRING(8 10 1,-11 -9 -3)))'));
SELECT type_name,ST_ASText(geo_value), ST_ASWKT(geo_value), _ST_ASEWKT(geo_value) FROM geo_3d ORDER BY id;
type_name	ST_ASText(geo_value)	ST_ASWKT(geo_value)	_ST_ASEWKT(geo_value)
POINTZ	POINT Z (0 0 0)	POINT Z (0 0 0)	POINT Z (0 0 0)
POINTZ	POINT Z (-1234 5678 91011)	POINT Z (-1234 5678 91011)	POINT Z (-1234 5678 91011)
POINTZ	POINT Z (25.416666666666668 25.416666666666668 26.6666666666666)	POINT Z (25.416666666666668 25.416666666666668 26.6666666666666)	POINT Z (25.416666666666668 25.416666666666668 26.6666666666666)
POINTZ	POINT Z (100000000 -230000 200000000)	POINT Z (100000000 -230000 200000000)	POINT Z (100000000 -230000 200000000)
LINESTRINGZ	LINESTRING Z (0 0 0,10 10 10)	LINESTRING Z (0 0 0,10 10 10)	LINESTRING Z (0 0 0,10 10 10)
LINESTRINGZ	LINESTRING Z (0 0 10,-4 8 -3,2000 2000 1000)	LINESTRING Z (0 0 10,-4 8 -3,2000 2000 1000)	LINESTRING Z (0 0 10,-4 8 -3,2000 2000 1000)
POLYGONZ	POLYGON Z ((0 0 0,0 8 1,8 8 2,8 10 3,-10 10 4,-10 0 5,0 0 0))	POLYGON Z ((0 0 0,0 8 1,8 8 2,8 10 3,-10 10 4,-10 0 5,0 0 0))	POLYGON Z ((0 0 0,0 8 1,8 8 2,8 10 3,-10 10 4,-10 0 5,0 0 0))
MULTIPOINTZ	MULTIPOINT Z ((1 1 1),(11 11 12),(11 21 13),(21 21 14))	MULTIPOINT Z ((1 1 1),(11 11 12),(11 21 13),(21 21 14))	MULTIPOINT Z ((1 1 1),(11 11 12),(11 21 13),(21 21 14))
MULTILINESTRINGZ	MULTILINESTRING Z ((10 48 23,10 21 12,10 0 34),(16 0 12,16 23 23,16 48 32))	MULTILINESTRING Z ((10 48 23,10 21 12,10 0 34),(16 0 12,16 23 23,16 48 32))	MULTILINESTRING Z ((10 48 23,10 21 12,10 0 34),(16 0 12,16 23 23,16 48 32))
MULTIPOLYGONZ	MULTIPOLYGON Z (((28 26 1,28 0 2,84 0 3,84 42 4,28 26 1),(52 18 34,66 23 54,73 9 67,48 6 65,52 18 34)),((59 18 11,67 18 34,67 13 23,59 13 56,59 18 11)))	MULTIPOLYGON Z (((28 26 1,28 0 2,84 0 3,84 42 4,28 26 1),(52 18 34,66 23 54,73 9 67,48 6 65,52 18 34)),((59 18 11,67 18 34,67 13 23,59 13 56,59 18 11)))	MULTIPOLYGON Z (((28 26 1,28 0 2,84 0 3,84 42 4,28 26 1),(52 18 34,66 23 54,73 9 67,48 6 65,52 18 34)),((59 18 11,67 18 34,67 13 23,59 13 56,59 18 11)))
GEOMETRYCOLLECTIONZ	GEOMETRYCOLLECTION Z (GEOMETRYCOLLECTION Z EMPTY,GEOMETRYCOLLECTION Z EMPTY,GEOMETRYCOLLECTION Z (POINT Z (1 1 3)),MULTILINESTRING Z ((10 48 3,10 21 3,10 0 1),(16 0 3,16 23 4,16 48 5)),MULTIPOLYGON Z (((28 26 23,28 0 1,84 0 2,84 42 4,28 26 23),(52 18 13,66 23 25,73 9 12,48 6 34,52 18 13)),((59 18 1,67 18 12,67 13 23,59 13 45,59 18 1))),MULTIPOINT Z ((0 0 1),(10 10 3),(10 20 4),(20 20 5)),MULTIPOINT Z ((1 1 1),(11 11 11),(11 21 22),(21 21 23)),GEOMETRYCOLLECTION Z (LINESTRING Z (1 1 1,2 2 3)),GEOMETRYCOLLECTION Z (POLYGON Z ((0 0 1,50 45 23,40 50 34,0 0 1)),LINESTRING Z (-10 -10 1,0 0 2),LINESTRING Z (46.666666666666664 46.666666666666664 46.666666666666664,200 200 12,199 201 23,45.333333333333336 47.333333333333336 47.333333333333336),LINESTRING Z (8 10 1,-11 -9 -3)))	GEOMETRYCOLLECTION Z (GEOMETRYCOLLECTION Z EMPTY,GEOMETRYCOLLECTION Z EMPTY,GEOMETRYCOLLECTION Z (POINT Z (1 1 3)),MULTILINESTRING Z ((10 48 3,10 21 3,10 0 1),(16 0 3,16 23 4,16 48 5)),MULTIPOLYGON Z (((28 26 23,28 0 1,84 0 2,84 42 4,28 26 23),(52 18 13,66 23 25,73 9 12,48 6 34,52 18 13)),((59 18 1,67 18 12,67 13 23,59 13 45,59 18 1))),MULTIPOINT Z ((0 0 1),(10 10 3),(10 20 4),(20 20 5)),MULTIPOINT Z ((1 1 1),(11 11 11),(11 21 22),(21 21 23)),GEOMETRYCOLLECTION Z (LINESTRING Z (1 1 1,2 2 3)),GEOMETRYCOLLECTION Z (POLYGON Z ((0 0 1,50 45 23,40 50 34,0 0 1)),LINESTRING Z (-10 -10 1,0 0 2),LINESTRING Z (46.666666666666664 46.666666666666664 46.666666666666664,200 200 12,199 201 23,45.333333333333336 47.333333333333336 47.333333333333336),LINESTRING Z (8 10 1,-11 -9 -3)))	GEOMETRYCOLLECTION Z (GEOMETRYCOLLECTION Z EMPTY,GEOMETRYCOLLECTION Z EMPTY,GEOMETRYCOLLECTION Z (POINT Z (1 1 3)),MULTILINESTRING Z ((10 48 3,10 21 3,10 0 1),(16 0 3,16 23 4,16 48 5)),MULTIPOLYGON Z (((28 26 23,28 0 1,84 0 2,84 42 4,28 26 23),(52 18 13,66 23 25,73 9 12,48 6 34,52 18 13)),((59 18 1,67 18 12,67 13 23,59 13 45,59 18 1))),MULTIPOINT Z ((0 0 1),(10 10 3),(10 20 4),(20 20 5)),MULTIPOINT Z ((1 1 1),(11 11 11),(11 21 22),(21 21 23)),GEOMETRYCOLLECTION Z (LINESTRING Z (1 1 1,2 2 3)),GEOMETRYCOLLECTION Z (POLYGON Z ((0 0 1,50 45 23,40 50 34,0 0 1)),LINESTRING Z (-10 -10 1,0 0 2),LINESTRING Z (46.666666666666664 46.666666666666664 46.666666666666664,200 200 12,199 201 23,45.333333333333336 47.333333333333336 47.333333333333336),LINESTRING Z (8 10 1,-11 -9 -3)))
POINTZ	POINT Z (-25.416666666666668 25.416666666666668 25.416666666666668)	POINT Z (-25.416666666666668 25.416666666666668 25.416666666666668)	SRID=6207;POINT Z (25.416666666666668 -25.416666666666668 25.416666666666668)
LINESTRINGZ	LINESTRING Z (0 0 1,10 10 12)	LINESTRING Z (0 0 1,10 10 12)	SRID=6207;LINESTRING Z (0 0 1,10 10 12)
PolygonZ	POLYGON Z ((0 0 0,8 0 1,-8 8 12,10 8 3,10 -10 -12,0 -10 12,0 0 0))	POLYGON Z ((0 0 0,8 0 1,-8 8 12,10 8 3,10 -10 -12,0 -10 12,0 0 0))	SRID=6207;POLYGON Z ((0 0 0,0 8 1,8 -8 12,8 10 3,-10 10 -12,-10 0 12,0 0 0))
MULTIPOINTZ	MULTIPOINT Z ((0 0 1),(-10 10 23),(20 10 12),(20 20 12))	MULTIPOINT Z ((0 0 1),(-10 10 23),(20 10 12),(20 20 12))	SRID=6207;MULTIPOINT Z ((0 0 1),(10 -10 23),(10 20 12),(20 20 12))
MULTILINESTRINGZ	MULTILINESTRING Z ((48 10 12,21 10 23,0 10 11),(0 16 12,23 16 23,48 16 12))	MULTILINESTRING Z ((48 10 12,21 10 23,0 10 11),(0 16 12,23 16 23,48 16 12))	SRID=6207;MULTILINESTRING Z ((10 48 12,10 21 23,10 0 11),(16 0 12,16 23 23,16 48 12))
MULTIPOLYGONZ	MULTIPOLYGON Z (((26 28 11,0 28 23,0 84 23,42 84 45,26 28 11),(18 52 1,23 66 23,9 73 44,6 48 23,18 52 1)),((18 59 -1,18 67 33,13 67 45,13 59 23,18 59 -1)))	MULTIPOLYGON Z (((26 28 11,0 28 23,0 84 23,42 84 45,26 28 11),(18 52 1,23 66 23,9 73 44,6 48 23,18 52 1)),((18 59 -1,18 67 33,13 67 45,13 59 23,18 59 -1)))	SRID=6207;MULTIPOLYGON Z (((28 26 11,28 0 23,84 0 23,84 42 45,28 26 11),(52 18 1,66 23 23,73 9 44,48 6 23,52 18 1)),((59 18 -1,67 18 33,67 13 45,59 13 23,59 18 -1)))
GEOMETRYCOLLECTIONZ	GEOMETRYCOLLECTION EMPTY	GEOMETRYCOLLECTION EMPTY	SRID=6207;GEOMETRYCOLLECTION EMPTY
GEOMETRYCOLLECTIONZ	GEOMETRYCOLLECTION EMPTY	GEOMETRYCOLLECTION EMPTY	SRID=6207;GEOMETRYCOLLECTION EMPTY
GEOMETRYCOLLECTIONZ	GEOMETRYCOLLECTION Z (GEOMETRYCOLLECTION Z EMPTY,GEOMETRYCOLLECTION Z EMPTY,GEOMETRYCOLLECTION Z (POINT Z (1 1 3)),MULTILINESTRING Z ((48 10 3,21 10 3,0 10 1),(0 16 3,23 16 4,48 16 5)),MULTIPOLYGON Z (((26 28 23,0 28 1,0 84 2,42 84 4,26 28 23),(18 52 13,23 66 25,9 73 12,6 48 34,18 52 13)),((18 59 1,18 67 12,13 67 23,13 59 45,18 59 1))),MULTIPOINT Z ((0 0 1),(10 10 3),(20 10 4),(20 20 5)),MULTIPOINT Z ((1 1 1),(11 11 11),(21 11 22),(21 21 23)),GEOMETRYCOLLECTION Z (LINESTRING Z (1 1 1,2 2 3)),GEOMETRYCOLLECTION Z (POLYGON Z ((0 0 1,45 50 23,50 40 34,0 0 1)),LINESTRING Z (-10 -10 1,0 0 2),LINESTRING Z (46.666666666666664 46.666666666666664 46.666666666666664,20 20 12,20 19 23,47.333333333333336 45.333333333333336 47.333333333333336),LINESTRING Z (10 8 1,-9 -11 -3)))	GEOMETRYCOLLECTION Z (GEOMETRYCOLLECTION Z EMPTY,GEOMETRYCOLLECTION Z EMPTY,GEOMETRYCOLLECTION Z (POINT Z (1 1 3)),MULTILINESTRING Z ((48 10 3,21 10 3,0 10 1),(0 16 3,23 16 4,48 16 5)),MULTIPOLYGON Z (((26 28 23,0 28 1,0 84 2,42 84 4,26 28 23),(18 52 13,23 66 25,9 73 12,6 48 34,18 52 13)),((18 59 1,18 67 12,13 67 23,13 59 45,18 59 1))),MULTIPOINT Z ((0 0 1),(10 10 3),(20 10 4),(20 20 5)),MULTIPOINT Z ((1 1 1),(11 11 11),(21 11 22),(21 21 23)),GEOMETRYCOLLECTION Z (LINESTRING Z (1 1 1,2 2 3)),GEOMETRYCOLLECTION Z (POLYGON Z ((0 0 1,45 50 23,50 40 34,0 0 1)),LINESTRING Z (-10 -10 1,0 0 2),LINESTRING Z (46.666666666666664 46.666666666666664 46.666666666666664,20 20 12,20 19 23,47.333333333333336 45.333333333333336 47.333333333333336),LINESTRING Z (10 8 1,-9 -11 -3)))	SRID=6207;GEOMETRYCOLLECTION Z (GEOMETRYCOLLECTION Z EMPTY,GEOMETRYCOLLECTION Z EMPTY,GEOMETRYCOLLECTION Z (POINT Z (1 1 3)),MULTILINESTRING Z ((10 48 3,10 21 3,10 0 1),(16 0 3,16 23 4,16 48 5)),MULTIPOLYGON Z (((28 26 23,28 0 1,84 0 2,84 42 4,28 26 23),(52 18 13,66 23 25,73 9 12,48 6 34,52 18 13)),((59 18 1,67 18 12,67 13 23,59 13 45,59 18 1))),MULTIPOINT Z ((0 0 1),(10 10 3),(10 20 4),(20 20 5)),MULTIPOINT Z ((1 1 1),(11 11 11),(11 21 22),(21 21 23)),GEOMETRYCOLLECTION Z (LINESTRING Z (1 1 1,2 2 3)),GEOMETRYCOLLECTION Z (POLYGON Z ((0 0 1,50 45 23,40 50 34,0 0 1)),LINESTRING Z (-10 -10 1,0 0 2),LINESTRING Z (46.666666666666664 46.666666666666664 46.666666666666664,20 20 12,19 20 23,45.333333333333336 47.333333333333336 47.333333333333336),LINESTRING Z (8 10 1,-11 -9 -3)))
DELETE FROM geo_3d;
DROP table geo_3d;
SET @wkb_pt = ST_GeomFromText('POINT Z(0 1 1)');
SET @wkb_ln = ST_GeomFromText('LINESTRING Z(0 1 1,2 3 3,4 5 3,6 7 9,8 9 10,10 11 12)');
SET @wkb_py = ST_GeomFromText('POLYGON Z((0 0 1,0 10 12,10 10 11,10 0 34,0 0 1),(4 4 1,4 6 3,6 6 5,6 4 6,4 4 1))');
SET @wkb_mpt = ST_GeomFromText('MULTIPOINT Z(0 1 2,2 3 4,4 5 5,6 7 1)');
SET @wkb_mln = ST_GeomFromText('MULTILINESTRING Z((0 1 2,2 3 3,4 5 4),(6 7 1,8 9 2,10 11 3))');
SET @wkb_mpy = ST_GeomFromText('MULTIPOLYGON Z(((0 1 1,0 10 2,10 11 3,10 0 3,0 1 1),(4 5 1,4 6 3,6 7 2,6 4 3,4 5 1)),'
                                                     '((10 11 1,10 12 2,12 13 4,12 10 5,10 11 1)))');
SET @wkb_gc = ST_GeomFromText('GEOMETRYCOLLECTION Z('
                                'POINT Z(0 1 1),'
                                'LINESTRING Z(0 1 1,10 11 2),'
                                'POLYGON Z((0 0 2,0 10 1,10 10 2,10 0 3, 0 0 2)),'
                                'MULTIPOINT Z(0 1 1,2 3 3,4 5 4,6 7 5,8 9 1,10 11 4),'
                                'MULTILINESTRING Z((0 1 12,10 11 23),(0 10 12,10 0 32)),'
                                'MULTIPOLYGON Z(((0 1 1,0 5 3,5 6 2,5 0 3,0 1 1)),((5 4 1,5 10 3,10 11 21,10 5 23,5 4 1))))');
SELECT ST_AsText(ST_GeomFromWKB(st_aswkb(@wkb_pt)));
ST_AsText(ST_GeomFromWKB(st_aswkb(@wkb_pt)))
POINT Z (0 1 1)
SELECT ST_AsText(ST_GeomFromWKB(st_aswkb(@wkb_ln)));
ST_AsText(ST_GeomFromWKB(st_aswkb(@wkb_ln)))
LINESTRING Z (0 1 1,2 3 3,4 5 3,6 7 9,8 9 10,10 11 12)
SELECT ST_AsText(ST_GeomFromWKB(st_aswkb(@wkb_py)));
ST_AsText(ST_GeomFromWKB(st_aswkb(@wkb_py)))
POLYGON Z ((0 0 1,0 10 12,10 10 11,10 0 34,0 0 1),(4 4 1,4 6 3,6 6 5,6 4 6,4 4 1))
SELECT ST_AsText(ST_GeomFromWKB(st_aswkb(@wkb_mpt)));
ST_AsText(ST_GeomFromWKB(st_aswkb(@wkb_mpt)))
MULTIPOINT Z ((0 1 2),(2 3 4),(4 5 5),(6 7 1))
SELECT ST_AsText(ST_GeomFromWKB(st_aswkb(@wkb_mln)));
ST_AsText(ST_GeomFromWKB(st_aswkb(@wkb_mln)))
MULTILINESTRING Z ((0 1 2,2 3 3,4 5 4),(6 7 1,8 9 2,10 11 3))
SELECT ST_AsText(ST_GeomFromWKB(st_aswkb(@wkb_mpy)));
ST_AsText(ST_GeomFromWKB(st_aswkb(@wkb_mpy)))
MULTIPOLYGON Z (((0 1 1,0 10 2,10 11 3,10 0 3,0 1 1),(4 5 1,4 6 3,6 7 2,6 4 3,4 5 1)),((10 11 1,10 12 2,12 13 4,12 10 5,10 11 1)))
SELECT ST_AsText(ST_GeomFromWKB(st_aswkb(@wkb_gc)));
ST_AsText(ST_GeomFromWKB(st_aswkb(@wkb_gc)))
GEOMETRYCOLLECTION Z (POINT Z (0 1 1),LINESTRING Z (0 1 1,10 11 2),POLYGON Z ((0 0 2,0 10 1,10 10 2,10 0 3,0 0 2)),MULTIPOINT Z ((0 1 1),(2 3 3),(4 5 4),(6 7 5),(8 9 1),(10 11 4)),MULTILINESTRING Z ((0 1 12,10 11 23),(0 10 12,10 0 32)),MULTIPOLYGON Z (((0 1 1,0 5 3,5 6 2,5 0 3,0 1 1)),((5 4 1,5 10 3,10 11 21,10 5 23,5 4 1))))
SELECT ST_AsText(ST_GeometryFromWKB(ST_AsBinary(@wkb_pt)));
ST_AsText(ST_GeometryFromWKB(ST_AsBinary(@wkb_pt)))
POINT Z (0 1 1)
SELECT ST_AsText(ST_GeometryFromWKB(ST_AsBinary(@wkb_ln)));
ST_AsText(ST_GeometryFromWKB(ST_AsBinary(@wkb_ln)))
LINESTRING Z (0 1 1,2 3 3,4 5 3,6 7 9,8 9 10,10 11 12)
SELECT ST_AsText(ST_GeometryFromWKB(ST_AsBinary(@wkb_py)));
ST_AsText(ST_GeometryFromWKB(ST_AsBinary(@wkb_py)))
POLYGON Z ((0 0 1,0 10 12,10 10 11,10 0 34,0 0 1),(4 4 1,4 6 3,6 6 5,6 4 6,4 4 1))
SELECT ST_AsText(ST_GeometryFromWKB(ST_AsBinary(@wkb_mpt)));
ST_AsText(ST_GeometryFromWKB(ST_AsBinary(@wkb_mpt)))
MULTIPOINT Z ((0 1 2),(2 3 4),(4 5 5),(6 7 1))
SELECT ST_AsText(ST_GeometryFromWKB(ST_AsBinary(@wkb_mln)));
ST_AsText(ST_GeometryFromWKB(ST_AsBinary(@wkb_mln)))
MULTILINESTRING Z ((0 1 2,2 3 3,4 5 4),(6 7 1,8 9 2,10 11 3))
SELECT ST_AsText(ST_GeometryFromWKB(ST_AsBinary(@wkb_mpy)));
ST_AsText(ST_GeometryFromWKB(ST_AsBinary(@wkb_mpy)))
MULTIPOLYGON Z (((0 1 1,0 10 2,10 11 3,10 0 3,0 1 1),(4 5 1,4 6 3,6 7 2,6 4 3,4 5 1)),((10 11 1,10 12 2,12 13 4,12 10 5,10 11 1)))
SELECT ST_AsText(ST_GeometryFromWKB(ST_AsBinary(@wkb_gc)));
ST_AsText(ST_GeometryFromWKB(ST_AsBinary(@wkb_gc)))
GEOMETRYCOLLECTION Z (POINT Z (0 1 1),LINESTRING Z (0 1 1,10 11 2),POLYGON Z ((0 0 2,0 10 1,10 10 2,10 0 3,0 0 2)),MULTIPOINT Z ((0 1 1),(2 3 3),(4 5 4),(6 7 5),(8 9 1),(10 11 4)),MULTILINESTRING Z ((0 1 12,10 11 23),(0 10 12,10 0 32)),MULTIPOLYGON Z (((0 1 1,0 5 3,5 6 2,5 0 3,0 1 1)),((5 4 1,5 10 3,10 11 21,10 5 23,5 4 1))))
SELECT ST_ASTEXT(_st_GeomFromEWKB(_ST_ASEWKB(@wkb_pt)));
ST_ASTEXT(_st_GeomFromEWKB(_ST_ASEWKB(@wkb_pt)))
POINT Z (0 1 1)
SELECT ST_ASTEXT(_st_GeomFromEWKB(_ST_ASEWKB(@wkb_ln)));
ST_ASTEXT(_st_GeomFromEWKB(_ST_ASEWKB(@wkb_ln)))
LINESTRING Z (0 1 1,2 3 3,4 5 3,6 7 9,8 9 10,10 11 12)
SELECT ST_ASTEXT(_st_GeomFromEWKB(_ST_ASEWKB(@wkb_py)));
ST_ASTEXT(_st_GeomFromEWKB(_ST_ASEWKB(@wkb_py)))
POLYGON Z ((0 0 1,0 10 12,10 10 11,10 0 34,0 0 1),(4 4 1,4 6 3,6 6 5,6 4 6,4 4 1))
SELECT ST_ASTEXT(_st_GeomFromEWKB(_ST_ASEWKB(@wkb_mpt)));
ST_ASTEXT(_st_GeomFromEWKB(_ST_ASEWKB(@wkb_mpt)))
MULTIPOINT Z ((0 1 2),(2 3 4),(4 5 5),(6 7 1))
SELECT ST_ASTEXT(_st_GeomFromEWKB(_ST_ASEWKB(@wkb_mln)));
ST_ASTEXT(_st_GeomFromEWKB(_ST_ASEWKB(@wkb_mln)))
MULTILINESTRING Z ((0 1 2,2 3 3,4 5 4),(6 7 1,8 9 2,10 11 3))
SELECT ST_ASTEXT(_st_GeomFromEWKB(_ST_ASEWKB(@wkb_mpy)));
ST_ASTEXT(_st_GeomFromEWKB(_ST_ASEWKB(@wkb_mpy)))
MULTIPOLYGON Z (((0 1 1,0 10 2,10 11 3,10 0 3,0 1 1),(4 5 1,4 6 3,6 7 2,6 4 3,4 5 1)),((10 11 1,10 12 2,12 13 4,12 10 5,10 11 1)))
SELECT ST_ASTEXT(_st_GeomFromEWKB(_ST_ASEWKB(@wkb_gc)));
ST_ASTEXT(_st_GeomFromEWKB(_ST_ASEWKB(@wkb_gc)))
GEOMETRYCOLLECTION Z (POINT Z (0 1 1),LINESTRING Z (0 1 1,10 11 2),POLYGON Z ((0 0 2,0 10 1,10 10 2,10 0 3,0 0 2)),MULTIPOINT Z ((0 1 1),(2 3 3),(4 5 4),(6 7 5),(8 9 1),(10 11 4)),MULTILINESTRING Z ((0 1 12,10 11 23),(0 10 12,10 0 32)),MULTIPOLYGON Z (((0 1 1,0 5 3,5 6 2,5 0 3,0 1 1)),((5 4 1,5 10 3,10 11 21,10 5 23,5 4 1))))
###################################
# ST_DISTANCE(g1,g2)
###################################
SELECT ST_DISTANCE(ST_GEOMFROMTEXT('POINT(0 0 0)'),ST_GEOMFROMTEXT('POINT(3 4 5)'));
ST_DISTANCE(ST_GEOMFROMTEXT('POINT(0 0 0)'),ST_GEOMFROMTEXT('POINT(3 4 5)'))
5
SELECT ST_DISTANCE(ST_GEOMFROMTEXT('POINT(0 0 1)'),ST_GEOMFROMTEXT('MULTIPOINT(3 4 5, 6 8 10)'));
ST_DISTANCE(ST_GEOMFROMTEXT('POINT(0 0 1)'),ST_GEOMFROMTEXT('MULTIPOINT(3 4 5, 6 8 10)'))
5
SELECT ST_DISTANCE(ST_GEOMFROMTEXT('POINT(0 0 0)'),ST_GEOMFROMTEXT('LINESTRING(10 10 1,10 0 2)'));
ST_DISTANCE(ST_GEOMFROMTEXT('POINT(0 0 0)'),ST_GEOMFROMTEXT('LINESTRING(10 10 1,10 0 2)'))
10
SELECT ST_DISTANCE(ST_GEOMFROMTEXT('POINT(0 0 10)'),ST_GEOMFROMTEXT('MULTILINESTRING((10 10 1,1 0 2))'));
ST_DISTANCE(ST_GEOMFROMTEXT('POINT(0 0 10)'),ST_GEOMFROMTEXT('MULTILINESTRING((10 10 1,1 0 2))'))
1
SELECT ST_DISTANCE(ST_GEOMFROMTEXT('POINT(5 5 5)'),ST_GEOMFROMTEXT('POLYGON((0 0 1,0 10 2,10 10 10,10 0 3,0 0 1))'));
ST_DISTANCE(ST_GEOMFROMTEXT('POINT(5 5 5)'),ST_GEOMFROMTEXT('POLYGON((0 0 1,0 10 2,10 10 10,10 0 3,0 0 1))'))
0
SELECT ST_DISTANCE(ST_GEOMFROMTEXT('POINT(1 1 1)'),ST_GEOMFROMTEXT('MULTIPOLYGON(((0 0 1,0 10 2,10 10 10,10 0 3,0 0 1)))'));
ST_DISTANCE(ST_GEOMFROMTEXT('POINT(1 1 1)'),ST_GEOMFROMTEXT('MULTIPOLYGON(((0 0 1,0 10 2,10 10 10,10 0 3,0 0 1)))'))
0
SELECT ST_DISTANCE(ST_GEOMFROMTEXT('POINT(5 5 1)'),ST_GEOMFROMTEXT('GEOMETRYCOLLECTION(GEOMETRYCOLLECTION(POINT(5 5 10)))'));
ST_DISTANCE(ST_GEOMFROMTEXT('POINT(5 5 1)'),ST_GEOMFROMTEXT('GEOMETRYCOLLECTION(GEOMETRYCOLLECTION(POINT(5 5 10)))'))
0
SELECT ST_DISTANCE(ST_GEOMFROMTEXT('MULTIPOINT(0 0 1,9 0 1)'),ST_GEOMFROMTEXT('POINT(5 0 2)'));
ST_DISTANCE(ST_GEOMFROMTEXT('MULTIPOINT(0 0 1,9 0 1)'),ST_GEOMFROMTEXT('POINT(5 0 2)'))
4
SELECT ST_DISTANCE(ST_GEOMFROMTEXT('MULTIPOINT(0 0 3,5 0 2,10 0 2)'),ST_GEOMFROMTEXT('MULTIPOINT(10 2 0)'));
ST_DISTANCE(ST_GEOMFROMTEXT('MULTIPOINT(0 0 3,5 0 2,10 0 2)'),ST_GEOMFROMTEXT('MULTIPOINT(10 2 0)'))
2
SELECT ST_DISTANCE(ST_GEOMFROMTEXT('MULTIPOINT(0 0 5,5 0 4,10 0 3)'),ST_GEOMFROMTEXT('LINESTRING(2 2 2,8 2 10)'));
ST_DISTANCE(ST_GEOMFROMTEXT('MULTIPOINT(0 0 5,5 0 4,10 0 3)'),ST_GEOMFROMTEXT('LINESTRING(2 2 2,8 2 10)'))
2
SELECT ST_DISTANCE(ST_GEOMFROMTEXT('MULTIPOINT(0 0 5,5 0 4,10 0 3)'),ST_GEOMFROMTEXT('MULTILINESTRING((2 2 1,5 0 2),(1 1 3,10 10 4))'));
ST_DISTANCE(ST_GEOMFROMTEXT('MULTIPOINT(0 0 5,5 0 4,10 0 3)'),ST_GEOMFROMTEXT('MULTILINESTRING((2 2 1,5 0 2),(1 1 3,10 10 4))'))
0
SELECT ST_DISTANCE(ST_GEOMFROMTEXT('MULTIPOINT(0 0 5,5 0 4,10 0 3)'),ST_GEOMFROMTEXT('MULTIPOLYGON(((0 0 2,0 4 3,4 4 4,0 0 2)),((0 5 1,0 10 2,10 5 3,0 5 1)))'));
ST_DISTANCE(ST_GEOMFROMTEXT('MULTIPOINT(0 0 5,5 0 4,10 0 3)'),ST_GEOMFROMTEXT('MULTIPOLYGON(((0 0 2,0 4 3,4 4 4,0 0 2)),((0 5 1,0 10 2,10 5 3,0 5 1)))'))
0
SELECT ST_DISTANCE(ST_GEOMFROMTEXT('MULTIPOINT(0 0 5,5 0 4,10 0 3)'),ST_GEOMFROMTEXT('GEOMETRYCOLLECTION(GEOMETRYCOLLECTION(POINT(5 5 5)))'));
ST_DISTANCE(ST_GEOMFROMTEXT('MULTIPOINT(0 0 5,5 0 4,10 0 3)'),ST_GEOMFROMTEXT('GEOMETRYCOLLECTION(GEOMETRYCOLLECTION(POINT(5 5 5)))'))
5
###################################
# ST_DISTANCE_SPHERE(g1,g2)
###################################
SELECT ST_DISTANCE_SPHERE(ST_GEOMFROMTEXT('POINT(0 0 0)'),ST_GEOMFROMTEXT('POINT(3 4 5)'));
ST_DISTANCE_SPHERE(ST_GEOMFROMTEXT('POINT(0 0 0)'),ST_GEOMFROMTEXT('POINT(3 4 5)'))
555810.7203217451
SELECT ST_DISTANCE_SPHERE(ST_GEOMFROMTEXT('POINT(0 0 1)'),ST_GEOMFROMTEXT('MULTIPOINT(3 4 5, 6 8 10)'));
ST_DISTANCE_SPHERE(ST_GEOMFROMTEXT('POINT(0 0 1)'),ST_GEOMFROMTEXT('MULTIPOINT(3 4 5, 6 8 10)'))
555810.7203217451
SELECT ST_DISTANCE_SPHERE(ST_GEOMFROMTEXT('POINT(0 0 0)'),ST_GEOMFROMTEXT('LINESTRING(10 10 1,10 0 2)'));
ERROR 22S00: It has not been implemented for Cartesian spatial reference systems.
SELECT ST_DISTANCE_SPHERE(ST_GEOMFROMTEXT('POINT(0 0 10)'),ST_GEOMFROMTEXT('MULTILINESTRING((10 10 1,1 0 2))'));
ERROR 22S00: It has not been implemented for Cartesian spatial reference systems.
SELECT ST_DISTANCE_SPHERE(ST_GEOMFROMTEXT('POINT(5 5 5)'),ST_GEOMFROMTEXT('POLYGON((0 0 1,0 10 2,10 10 10,10 0 3,0 0 1))'));
ERROR 22S00: It has not been implemented for Cartesian spatial reference systems.
SELECT ST_DISTANCE_SPHERE(ST_GEOMFROMTEXT('POINT(1 1 1)'),ST_GEOMFROMTEXT('MULTIPOLYGON(((0 0 1,0 10 2,10 10 10,10 0 3,0 0 1)))'));
ERROR 22S00: It has not been implemented for Cartesian spatial reference systems.
SELECT ST_DISTANCE_SPHERE(ST_GEOMFROMTEXT('POINT(5 5 1)'),ST_GEOMFROMTEXT('GEOMETRYCOLLECTION(GEOMETRYCOLLECTION(POINT(5 5 10)))'));
ERROR 22S00: It has not been implemented for Cartesian spatial reference systems.
SELECT ST_DISTANCE_SPHERE(ST_GEOMFROMTEXT('MULTIPOINT(0 0 1,9 0 1)'),ST_GEOMFROMTEXT('POINT(5 0 2)'));
ST_DISTANCE_SPHERE(ST_GEOMFROMTEXT('MULTIPOINT(0 0 1,9 0 1)'),ST_GEOMFROMTEXT('POINT(5 0 2)'))
444778.7291938538
SELECT ST_DISTANCE_SPHERE(ST_GEOMFROMTEXT('MULTIPOINT(0 0 3,5 0 2,10 0 2)'),ST_GEOMFROMTEXT('MULTIPOINT(10 2 0)'));
ST_DISTANCE_SPHERE(ST_GEOMFROMTEXT('MULTIPOINT(0 0 3,5 0 2,10 0 2)'),ST_GEOMFROMTEXT('MULTIPOINT(10 2 0)'))
222389.3645969269
SELECT ST_DISTANCE_SPHERE(ST_GEOMFROMTEXT('MULTIPOINT(0 0 5,5 0 4,10 0 3)'),ST_GEOMFROMTEXT('LINESTRING(2 2 2,8 2 10)'));
ERROR 22S00: It has not been implemented for Cartesian spatial reference systems.
SELECT ST_DISTANCE_SPHERE(ST_GEOMFROMTEXT('MULTIPOINT(0 0 5,5 0 4,10 0 3)'),ST_GEOMFROMTEXT('MULTILINESTRING((2 2 1,5 0 2),(1 1 3,10 10 4))'));
ERROR 22S00: It has not been implemented for Cartesian spatial reference systems.
SELECT ST_DISTANCE_SPHERE(ST_GEOMFROMTEXT('MULTIPOINT(0 0 5,5 0 4,10 0 3)'),ST_GEOMFROMTEXT('MULTIPOLYGON(((0 0 2,0 4 3,4 4 4,0 0 2)),((0 5 1,0 10 2,10 5 3,0 5 1)))'));
ERROR 22S00: It has not been implemented for Cartesian spatial reference systems.
SELECT ST_DISTANCE_SPHERE(ST_GEOMFROMTEXT('MULTIPOINT(0 0 5,5 0 4,10 0 3)'),ST_GEOMFROMTEXT('GEOMETRYCOLLECTION(GEOMETRYCOLLECTION(POINT(5 5 5)))'));
ERROR 22S00: It has not been implemented for Cartesian spatial reference systems.
###################################
# ST_INTERSECTS(g1, g2)
###################################
select ST_INTERSECTS(ST_GeomFromText('GEOMETRYCOLLECTION(Point(1 2 3),LINESTRING(1 2 2, 3 4 1),POLYGON((2 2 1,2 8 5,8 8 7,8 2 4,2 2 1)))'), ST_GeomFromText('LINESTRING(1 2 3, 3 4 5)'));
ST_INTERSECTS(ST_GeomFromText('GEOMETRYCOLLECTION(Point(1 2 3),LINESTRING(1 2 2, 3 4 1),POLYGON((2 2 1,2 8 5,8 8 7,8 2 4,2 2 1)))'), ST_GeomFromText('LINESTRING(1 2 3, 3 4 5)'))
1
select ST_INTERSECTS(ST_GeomFromText('GEOMETRYCOLLECTION(Point(1 2 3),LINESTRING(1 3 2, 3 4 1),POLYGON((2 2 1,2 8 5,8 8 7,8 2 4,2 2 1)))'), ST_GeomFromText('LINESTRING(1 2 3, 3 4 5)'));
ST_INTERSECTS(ST_GeomFromText('GEOMETRYCOLLECTION(Point(1 2 3),LINESTRING(1 3 2, 3 4 1),POLYGON((2 2 1,2 8 5,8 8 7,8 2 4,2 2 1)))'), ST_GeomFromText('LINESTRING(1 2 3, 3 4 5)'))
1
select ST_INTERSECTS(ST_GeomFromText('LINESTRING(1 2 2, 3 4 1)'), ST_GeomFromText('GEOMETRYCOLLECTION(Point(1 2 1),LINESTRING(1 2 1, 3 4 2),POLYGON((2 2 1,2 8 5,8 8 7,8 2 4,2 2 1)))'));
ST_INTERSECTS(ST_GeomFromText('LINESTRING(1 2 2, 3 4 1)'), ST_GeomFromText('GEOMETRYCOLLECTION(Point(1 2 1),LINESTRING(1 2 1, 3 4 2),POLYGON((2 2 1,2 8 5,8 8 7,8 2 4,2 2 1)))'))
1
select ST_INTERSECTS(ST_GeomFromText('LINESTRING(1 2 2, 3 4 1)'), ST_GeomFromText('LINESTRING(1 2 2, 3 4 1)'));
ST_INTERSECTS(ST_GeomFromText('LINESTRING(1 2 2, 3 4 1)'), ST_GeomFromText('LINESTRING(1 2 2, 3 4 1)'))
1
select ST_INTERSECTS(ST_GeomFromText('LINESTRING(1 2 2, 4 8 1)'), ST_GeomFromText('LINESTRING(1 2 2, 2 4 1)'));
ST_INTERSECTS(ST_GeomFromText('LINESTRING(1 2 2, 4 8 1)'), ST_GeomFromText('LINESTRING(1 2 2, 2 4 1)'))
1
select ST_INTERSECTS(ST_GeomFromText('LINESTRING(1 2 2, 4 8 1)'), ST_GeomFromText('LINESTRING(1 2 2, 3 4 1)'));
ST_INTERSECTS(ST_GeomFromText('LINESTRING(1 2 2, 4 8 1)'), ST_GeomFromText('LINESTRING(1 2 2, 3 4 1)'))
1
select ST_INTERSECTS(ST_GeomFromText('POLYGON((0 0 1, 10 0 2, 10 10 3, 0 10 2, 0 0 1))'), ST_GeomFromText('LINESTRING(1 2 2, 4 8 1)'));
ST_INTERSECTS(ST_GeomFromText('POLYGON((0 0 1, 10 0 2, 10 10 3, 0 10 2, 0 0 1))'), ST_GeomFromText('LINESTRING(1 2 2, 4 8 1)'))
1
select ST_INTERSECTS(ST_GeomFromText('POLYGON((0 0 1, 10 0 2, 10 10 3, 0 10 2, 0 0 1))'), ST_GeomFromText('LINESTRING(1 2 1, 6 12 2)'));
ST_INTERSECTS(ST_GeomFromText('POLYGON((0 0 1, 10 0 2, 10 10 3, 0 10 2, 0 0 1))'), ST_GeomFromText('LINESTRING(1 2 1, 6 12 2)'))
1
select ST_INTERSECTS(ST_GeomFromText('MULTIPOINT(1 2 2, 3 4 1)'), ST_GeomFromText('MULTIPOINT(1 2 2, 3 4 1)'));
ST_INTERSECTS(ST_GeomFromText('MULTIPOINT(1 2 2, 3 4 1)'), ST_GeomFromText('MULTIPOINT(1 2 2, 3 4 1)'))
1
###################################
# ST_Covers(g1, g2)
###################################
select _st_covers(ST_GeomFromText('GEOMETRYCOLLECTION(Point(1 2 3),LINESTRING(1 2 2, 3 4 1),POLYGON((2 2 1,2 8 5,8 8 7,8 2 4,2 2 1)))'), ST_GeomFromText('LINESTRING(1 2 3, 3 4 5)'));
_st_covers(ST_GeomFromText('GEOMETRYCOLLECTION(Point(1 2 3),LINESTRING(1 2 2, 3 4 1),POLYGON((2 2 1,2 8 5,8 8 7,8 2 4,2 2 1)))'), ST_GeomFromText('LINESTRING(1 2 3, 3 4 5)'))
1
select _st_covers(ST_GeomFromText('GEOMETRYCOLLECTION(Point(1 2 3),LINESTRING(1 3 2, 3 4 1),POLYGON((2 2 1,2 8 5,8 8 7,8 2 4,2 2 1)))'), ST_GeomFromText('LINESTRING(1 2 3, 3 4 5)'));
_st_covers(ST_GeomFromText('GEOMETRYCOLLECTION(Point(1 2 3),LINESTRING(1 3 2, 3 4 1),POLYGON((2 2 1,2 8 5,8 8 7,8 2 4,2 2 1)))'), ST_GeomFromText('LINESTRING(1 2 3, 3 4 5)'))
0
select _st_covers(ST_GeomFromText('LINESTRING(1 2 2, 3 4 1)'), ST_GeomFromText('GEOMETRYCOLLECTION(Point(1 2 1),LINESTRING(1 2 1, 3 4 2),POLYGON((2 2 1,2 8 5,8 8 7,8 2 4,2 2 1)))'));
_st_covers(ST_GeomFromText('LINESTRING(1 2 2, 3 4 1)'), ST_GeomFromText('GEOMETRYCOLLECTION(Point(1 2 1),LINESTRING(1 2 1, 3 4 2),POLYGON((2 2 1,2 8 5,8 8 7,8 2 4,2 2 1)))'))
0
select _st_covers(ST_GeomFromText('LINESTRING(1 2 2, 3 4 1)'), ST_GeomFromText('LINESTRING(1 2 2, 3 4 1)'));
_st_covers(ST_GeomFromText('LINESTRING(1 2 2, 3 4 1)'), ST_GeomFromText('LINESTRING(1 2 2, 3 4 1)'))
1
select _st_covers(ST_GeomFromText('LINESTRING(1 2 2, 4 8 1)'), ST_GeomFromText('LINESTRING(1 2 2, 2 4 1)'));
_st_covers(ST_GeomFromText('LINESTRING(1 2 2, 4 8 1)'), ST_GeomFromText('LINESTRING(1 2 2, 2 4 1)'))
1
select _st_covers(ST_GeomFromText('LINESTRING(1 2 2, 4 8 1)'), ST_GeomFromText('LINESTRING(1 2 2, 3 4 1)'));
_st_covers(ST_GeomFromText('LINESTRING(1 2 2, 4 8 1)'), ST_GeomFromText('LINESTRING(1 2 2, 3 4 1)'))
0
select _st_covers(ST_GeomFromText('POLYGON((0 0 1, 10 0 2, 10 10 3, 0 10 2, 0 0 1))'), ST_GeomFromText('LINESTRING(1 2 2, 4 8 1)'));
_st_covers(ST_GeomFromText('POLYGON((0 0 1, 10 0 2, 10 10 3, 0 10 2, 0 0 1))'), ST_GeomFromText('LINESTRING(1 2 2, 4 8 1)'))
1
select _st_covers(ST_GeomFromText('POLYGON((0 0 1, 10 0 2, 10 10 3, 0 10 2, 0 0 1))'), ST_GeomFromText('LINESTRING(1 2 1, 6 12 2)'));
_st_covers(ST_GeomFromText('POLYGON((0 0 1, 10 0 2, 10 10 3, 0 10 2, 0 0 1))'), ST_GeomFromText('LINESTRING(1 2 1, 6 12 2)'))
0
select _st_covers(ST_GeomFromText('MULTIPOINT(1 2 2, 3 4 1)'), ST_GeomFromText('MULTIPOINT(1 2 2, 3 4 1)'));
_st_covers(ST_GeomFromText('MULTIPOINT(1 2 2, 3 4 1)'), ST_GeomFromText('MULTIPOINT(1 2 2, 3 4 1)'))
1
###################################
# ST_Contains(g1, g2)
###################################
select ST_Contains(ST_GeomFromText('GEOMETRYCOLLECTION(Point(1 2 3),LINESTRING(1 2 2, 3 4 1),POLYGON((2 2 1,2 8 5,8 8 7,8 2 4,2 2 1)))'), ST_GeomFromText('LINESTRING(1 2 3, 3 4 5)'));
ST_Contains(ST_GeomFromText('GEOMETRYCOLLECTION(Point(1 2 3),LINESTRING(1 2 2, 3 4 1),POLYGON((2 2 1,2 8 5,8 8 7,8 2 4,2 2 1)))'), ST_GeomFromText('LINESTRING(1 2 3, 3 4 5)'))
1
select ST_Contains(ST_GeomFromText('GEOMETRYCOLLECTION(Point(1 2 3),LINESTRING(1 3 2, 3 4 1),POLYGON((2 2 1,2 8 5,8 8 7,8 2 4,2 2 1)))'), ST_GeomFromText('LINESTRING(1 2 3, 3 4 5)'));
ST_Contains(ST_GeomFromText('GEOMETRYCOLLECTION(Point(1 2 3),LINESTRING(1 3 2, 3 4 1),POLYGON((2 2 1,2 8 5,8 8 7,8 2 4,2 2 1)))'), ST_GeomFromText('LINESTRING(1 2 3, 3 4 5)'))
0
select ST_Contains(ST_GeomFromText('LINESTRING(1 2 2, 3 4 1)'), ST_GeomFromText('GEOMETRYCOLLECTION(Point(1 2 1),LINESTRING(1 2 1, 3 4 2),POLYGON((2 2 1,2 8 5,8 8 7,8 2 4,2 2 1)))'));
ST_Contains(ST_GeomFromText('LINESTRING(1 2 2, 3 4 1)'), ST_GeomFromText('GEOMETRYCOLLECTION(Point(1 2 1),LINESTRING(1 2 1, 3 4 2),POLYGON((2 2 1,2 8 5,8 8 7,8 2 4,2 2 1)))'))
0
select ST_Contains(ST_GeomFromText('LINESTRING(1 2 2, 3 4 1)'), ST_GeomFromText('LINESTRING(1 2 2, 3 4 1)'));
ST_Contains(ST_GeomFromText('LINESTRING(1 2 2, 3 4 1)'), ST_GeomFromText('LINESTRING(1 2 2, 3 4 1)'))
1
select ST_Contains(ST_GeomFromText('LINESTRING(1 2 2, 4 8 1)'), ST_GeomFromText('LINESTRING(1 2 2, 2 4 1)'));
ST_Contains(ST_GeomFromText('LINESTRING(1 2 2, 4 8 1)'), ST_GeomFromText('LINESTRING(1 2 2, 2 4 1)'))
1
select ST_Contains(ST_GeomFromText('LINESTRING(1 2 2, 4 8 1)'), ST_GeomFromText('LINESTRING(1 2 2, 3 4 1)'));
ST_Contains(ST_GeomFromText('LINESTRING(1 2 2, 4 8 1)'), ST_GeomFromText('LINESTRING(1 2 2, 3 4 1)'))
0
select ST_Contains(ST_GeomFromText('POLYGON((0 0 1, 10 0 2, 10 10 3, 0 10 2, 0 0 1))'), ST_GeomFromText('LINESTRING(1 2 2, 4 8 1)'));
ST_Contains(ST_GeomFromText('POLYGON((0 0 1, 10 0 2, 10 10 3, 0 10 2, 0 0 1))'), ST_GeomFromText('LINESTRING(1 2 2, 4 8 1)'))
1
select ST_Contains(ST_GeomFromText('POLYGON((0 0 1, 10 0 2, 10 10 3, 0 10 2, 0 0 1))'), ST_GeomFromText('LINESTRING(1 2 1, 6 12 2)'));
ST_Contains(ST_GeomFromText('POLYGON((0 0 1, 10 0 2, 10 10 3, 0 10 2, 0 0 1))'), ST_GeomFromText('LINESTRING(1 2 1, 6 12 2)'))
0
select ST_Contains(ST_GeomFromText('MULTIPOINT(1 2 2, 3 4 1)'), ST_GeomFromText('MULTIPOINT(1 2 2, 3 4 1)'));
ST_Contains(ST_GeomFromText('MULTIPOINT(1 2 2, 3 4 1)'), ST_GeomFromText('MULTIPOINT(1 2 2, 3 4 1)'))
1
###################################
# ST_Within(g1, g2)
###################################
select ST_Within(ST_GeomFromText('GEOMETRYCOLLECTION(Point(1 2 3),LINESTRING(1 2 2, 3 4 1),POLYGON((2 2 1,2 8 5,8 8 7,8 2 4,2 2 1)))'), ST_GeomFromText('LINESTRING(1 2 3, 3 4 5)'));
ST_Within(ST_GeomFromText('GEOMETRYCOLLECTION(Point(1 2 3),LINESTRING(1 2 2, 3 4 1),POLYGON((2 2 1,2 8 5,8 8 7,8 2 4,2 2 1)))'), ST_GeomFromText('LINESTRING(1 2 3, 3 4 5)'))
0
select ST_Within(ST_GeomFromText('GEOMETRYCOLLECTION(Point(1 2 3),LINESTRING(1 3 2, 3 4 1),POLYGON((2 2 1,2 8 5,8 8 7,8 2 4,2 2 1)))'), ST_GeomFromText('LINESTRING(1 2 3, 3 4 5)'));
ST_Within(ST_GeomFromText('GEOMETRYCOLLECTION(Point(1 2 3),LINESTRING(1 3 2, 3 4 1),POLYGON((2 2 1,2 8 5,8 8 7,8 2 4,2 2 1)))'), ST_GeomFromText('LINESTRING(1 2 3, 3 4 5)'))
0
select ST_Within(ST_GeomFromText('LINESTRING(1 2 2, 3 4 1)'), ST_GeomFromText('GEOMETRYCOLLECTION(Point(1 2 1),LINESTRING(1 2 1, 3 4 2),POLYGON((2 2 1,2 8 5,8 8 7,8 2 4,2 2 1)))'));
ST_Within(ST_GeomFromText('LINESTRING(1 2 2, 3 4 1)'), ST_GeomFromText('GEOMETRYCOLLECTION(Point(1 2 1),LINESTRING(1 2 1, 3 4 2),POLYGON((2 2 1,2 8 5,8 8 7,8 2 4,2 2 1)))'))
1
select ST_Within(ST_GeomFromText('LINESTRING(1 2 2, 3 4 1)'), ST_GeomFromText('LINESTRING(1 2 2, 3 4 1)'));
ST_Within(ST_GeomFromText('LINESTRING(1 2 2, 3 4 1)'), ST_GeomFromText('LINESTRING(1 2 2, 3 4 1)'))
1
select ST_Within(ST_GeomFromText('LINESTRING(1 2 2, 4 8 1)'), ST_GeomFromText('LINESTRING(1 2 2, 2 4 1)'));
ST_Within(ST_GeomFromText('LINESTRING(1 2 2, 4 8 1)'), ST_GeomFromText('LINESTRING(1 2 2, 2 4 1)'))
0
select ST_Within(ST_GeomFromText('LINESTRING(1 2 2, 4 8 1)'), ST_GeomFromText('LINESTRING(1 2 2, 3 4 1)'));
ST_Within(ST_GeomFromText('LINESTRING(1 2 2, 4 8 1)'), ST_GeomFromText('LINESTRING(1 2 2, 3 4 1)'))
0
select ST_Within(ST_GeomFromText('POLYGON((0 0 1, 10 0 2, 10 10 3, 0 10 2, 0 0 1))'), ST_GeomFromText('LINESTRING(1 2 2, 4 8 1)'));
ST_Within(ST_GeomFromText('POLYGON((0 0 1, 10 0 2, 10 10 3, 0 10 2, 0 0 1))'), ST_GeomFromText('LINESTRING(1 2 2, 4 8 1)'))
0
select ST_Within(ST_GeomFromText('POLYGON((0 0 1, 10 0 2, 10 10 3, 0 10 2, 0 0 1))'), ST_GeomFromText('LINESTRING(1 2 1, 6 12 2)'));
ST_Within(ST_GeomFromText('POLYGON((0 0 1, 10 0 2, 10 10 3, 0 10 2, 0 0 1))'), ST_GeomFromText('LINESTRING(1 2 1, 6 12 2)'))
0
select ST_Within(ST_GeomFromText('MULTIPOINT(1 2 2, 3 4 1)'), ST_GeomFromText('MULTIPOINT(1 2 2, 3 4 1)'));
ST_Within(ST_GeomFromText('MULTIPOINT(1 2 2, 3 4 1)'), ST_GeomFromText('MULTIPOINT(1 2 2, 3 4 1)'))
1
###################################
# ST_Buffer(g1, g2)
###################################
SELECT ST_ASTEXT(ST_BUFFER(ST_GEOMFROMTEXT('POINT(0 0 0)'), 2));
ST_ASTEXT(ST_BUFFER(ST_GEOMFROMTEXT('POINT(0 0 0)'), 2))
POLYGON((2 0,1.9616 0.3902,1.8478 0.7654,1.6629 1.1111,1.4142 1.4142,1.1111 1.6629,0.7654 1.8478,0.3902 1.9616,0 2,-0.3902 1.9616,-0.7654 1.8478,-1.1111 1.6629,-1.4142 1.4142,-1.6629 1.1111,-1.8478 0.7654,-1.9616 0.3902,-2 0,-1.9616 -0.3902,-1.8478 -0.7654,-1.6629 -1.1111,-1.4142 -1.4142,-1.1111 -1.6629,-0.7654 -1.8478,-0.3902 -1.9616,0 -2,0.3902 -1.9616,0.7654 -1.8478,1.1111 -1.6629,1.4142 -1.4142,1.6629 -1.1111,1.8478 -0.7654,1.9616 -0.3902,2 0))
SELECT ST_ASTEXT(ST_BUFFER(ST_GEOMFROMTEXT('MULTIPOINT(0 0 0,0 5 1)'), 5));
ST_ASTEXT(ST_BUFFER(ST_GEOMFROMTEXT('MULTIPOINT(0 0 0,0 5 1)'), 5))
POLYGON((-4.3059 2.5,-4.6194 1.9134,-4.9039 0.9755,-5 0,-4.9039 -0.9755,-4.6194 -1.9134,-4.1573 -2.7779,-3.5355 -3.5355,-2.7779 -4.1573,-1.9134 -4.6194,-0.9755 -4.9039,0 -5,0.9755 -4.9039,1.9134 -4.6194,2.7779 -4.1573,3.5355 -3.5355,4.1573 -2.7779,4.6194 -1.9134,4.9039 -0.9755,5 0,4.9039 0.9755,4.6194 1.9134,4.3059 2.5,4.6194 3.0866,4.9039 4.0245,5 5,4.9039 5.9755,4.6194 6.9134,4.1573 7.7779,3.5355 8.5355,2.7779 9.1573,1.9134 9.6194,0.9755 9.9039,0 10,-0.9755 9.9039,-1.9134 9.6194,-2.7779 9.1573,-3.5355 8.5355,-4.1573 7.7779,-4.6194 6.9134,-4.9039 5.9755,-5 5,-4.9039 4.0245,-4.6194 3.0866,-4.3059 2.5))
SELECT ST_ASTEXT(ST_BUFFER(ST_GEOMFROMTEXT('LINESTRING(10 10 2,10 15 3)'), 10));
ST_ASTEXT(ST_BUFFER(ST_GEOMFROMTEXT('LINESTRING(10 10 2,10 15 3)'), 10))
POLYGON((0 10,0.1921 8.0491,0.7612 6.1732,1.6853 4.4443,2.9289 2.9289,4.4443 1.6853,6.1732 0.7612,8.0491 0.1921,10 0,11.9509 0.1921,13.8268 0.7612,15.5557 1.6853,17.0711 2.9289,18.3147 4.4443,19.2388 6.1732,19.8079 8.0491,20 10,20 15,20 15,19.8079 16.9509,19.2388 18.8268,18.3147 20.5557,17.0711 22.0711,15.5557 23.3147,13.8268 24.2388,11.9509 24.8079,10 25,8.0491 24.8079,6.1732 24.2388,4.4443 23.3147,2.9289 22.0711,1.6853 20.5557,0.7612 18.8268,0.1921 16.9509,0 15,0 10))
SELECT ST_ASTEXT(ST_BUFFER(ST_GEOMFROMTEXT('MULTILINESTRING((0 0 1,-0 0 2),(0 0 2,0 -0 1))'), 10));
ST_ASTEXT(ST_BUFFER(ST_GEOMFROMTEXT('MULTILINESTRING((0 0 1,-0 0 2),(0 0 2,0 -0 1))'), 10))
POLYGON((9.8079 -1.9509,10 0,9.8079 1.9509,9.2388 3.8268,8.3147 5.5557,7.0711 7.0711,5.5557 8.3147,3.8268 9.2388,1.9509 9.8079,0 10,-1.9509 9.8079,-3.8268 9.2388,-5.5557 8.3147,-7.0711 7.0711,-8.3147 5.5557,-9.2388 3.8268,-9.8079 1.9509,-10 0,-9.8079 -1.9509,-9.2388 -3.8268,-8.3147 -5.5557,-7.0711 -7.0711,-5.5557 -8.3147,-3.8268 -9.2388,-1.9509 -9.8079,0 -10,1.9509 -9.8079,3.8268 -9.2388,5.5557 -8.3147,7.0711 -7.0711,8.3147 -5.5557,9.2388 -3.8268,9.8079 -1.9509))
SELECT ST_ASTEXT(ST_BUFFER(ST_GEOMFROMTEXT('POLYGON((3 3 1,5 5 3,7 3 4,3 3 1))'), 1));
ST_ASTEXT(ST_BUFFER(ST_GEOMFROMTEXT('POLYGON((3 3 1,5 5 3,7 3 4,3 3 1))'), 1))
POLYGON((2.2929 3.7071,2.1685 3.5556,2.0761 3.3827,2.0192 3.1951,2 3,2.0192 2.8049,2.0761 2.6173,2.1685 2.4444,2.2929 2.2929,2.4444 2.1685,2.6173 2.0761,2.8049 2.0192,3 2,7 2,7.1951 2.0192,7.3827 2.0761,7.5556 2.1685,7.7071 2.2929,7.8315 2.4444,7.9239 2.6173,7.9808 2.8049,8 3,7.9808 3.1951,7.9239 3.3827,7.8315 3.5556,7.7071 3.7071,5.7071 5.7071,5.5556 5.8315,5.3827 5.9239,5.1951 5.9808,5 6,4.8049 5.9808,4.6173 5.9239,4.4444 5.8315,4.2929 5.7071,2.2929 3.7071))
SELECT ST_ASTEXT(ST_BUFFER(ST_GEOMFROMTEXT('MULTIPOLYGON(((0 0 1,0 10 2,10 10 3,0 0 1)),((10 10 1,10 15 2,15 15 3,10 10 1)))'), 20));
ST_ASTEXT(ST_BUFFER(ST_GEOMFROMTEXT('MULTIPOLYGON(((0 0 1,0 10 2,10 10 3,0 0 1)),((10 10 1,10 15 2,15 15 3,10 10 1)))'), 20))
POLYGON((-3.5192 29.6534,-3.9018 29.6157,-7.6537 28.4776,-11.1114 26.6294,-14.1421 24.1421,-16.6294 21.1114,-18.4776 17.6537,-19.6157 13.9018,-20 10,-20 0,-19.6157 -3.9018,-18.4776 -7.6537,-16.6294 -11.1114,-14.1421 -14.1421,-11.1114 -16.6294,-7.6537 -18.4776,-3.9018 -19.6157,0 -20,3.9018 -19.6157,7.6537 -18.4776,11.1114 -16.6294,14.1421 -14.1421,24.1421 -4.1421,29.1421 0.8579,31.6294 3.8886,33.4776 7.3463,34.6157 11.0982,35 15,34.6157 18.9018,33.4776 22.6537,31.6294 26.1114,29.1421 29.1421,26.1114 31.6294,22.6537 33.4776,18.9018 34.6157,15 35,10 35,6.0982 34.6157,2.3463 33.4776,-1.1114 31.6294,-3.5192 29.6534))
SELECT ST_ASTEXT(ST_BUFFER(ST_GEOMFROMTEXT('GEOMETRYCOLLECTION(LINESTRING(1 1 1,2 2 2),'
                                                              'MULTILINESTRING((0 0 2,0 10 3),(10 10 1,10 15 4)))'), 50));
ST_ASTEXT(ST_BUFFER(ST_GEOMFROMTEXT('GEOMETRYCOLLECTION(LINESTRING(1 1 1,2 2 2),'
                                                              'MULTILINESTRING((0 0 2,0 10 3),(10 10 1,10 15 4)))'), 50))
POLYGON((35.8061 -34.8061,36.3553 -34.3553,37.3553 -33.3553,40.9614 -28.9614,45.3553 -25.3553,51.5735 -17.7785,56.194 -9.1342,59.0393 0.2455,60 10,60 15,59.0393 24.7545,56.194 34.1342,51.5735 42.7785,45.3553 50.3553,37.7785 56.5735,29.1342 61.194,19.7545 64.0393,10 65,0.2455 64.0393,-9.1342 61.194,-17.6412 56.6469,-19.1342 56.194,-27.7785 51.5735,-35.3553 45.3553,-41.5735 37.7785,-46.194 29.1342,-49.0393 19.7545,-50 10,-50 0,-49.0393 -9.7545,-46.194 -19.1342,-41.5735 -27.7785,-35.3553 -35.3553,-27.7785 -41.5735,-19.1342 -46.194,-9.7545 -49.0393,0 -50,9.7545 -49.0393,19.1342 -46.194,27.7785 -41.5735,35.3553 -35.3553,35.8061 -34.8061))
###################################
# _ST_Buffer(g1, g2)
###################################
SELECT ST_ASTEXT(_ST_BUFFER(ST_GEOMFROMTEXT('POINT(0 0 0)'), 2));
ST_ASTEXT(_ST_BUFFER(ST_GEOMFROMTEXT('POINT(0 0 0)'), 2))
POLYGON((2 0,1.9616 0.3902,1.8478 0.7654,1.6629 1.1111,1.4142 1.4142,1.1111 1.6629,0.7654 1.8478,0.3902 1.9616,0 2,-0.3902 1.9616,-0.7654 1.8478,-1.1111 1.6629,-1.4142 1.4142,-1.6629 1.1111,-1.8478 0.7654,-1.9616 0.3902,-2 0,-1.9616 -0.3902,-1.8478 -0.7654,-1.6629 -1.1111,-1.4142 -1.4142,-1.1111 -1.6629,-0.7654 -1.8478,-0.3902 -1.9616,0 -2,0.3902 -1.9616,0.7654 -1.8478,1.1111 -1.6629,1.4142 -1.4142,1.6629 -1.1111,1.8478 -0.7654,1.9616 -0.3902,2 0))
SELECT ST_ASTEXT(_ST_BUFFER(ST_GEOMFROMTEXT('MULTIPOINT(0 0 0,0 5 1)'), 5));
ST_ASTEXT(_ST_BUFFER(ST_GEOMFROMTEXT('MULTIPOINT(0 0 0,0 5 1)'), 5))
POLYGON((-4.3059 2.5,-4.6194 1.9134,-4.9039 0.9755,-5 0,-4.9039 -0.9755,-4.6194 -1.9134,-4.1573 -2.7779,-3.5355 -3.5355,-2.7779 -4.1573,-1.9134 -4.6194,-0.9755 -4.9039,0 -5,0.9755 -4.9039,1.9134 -4.6194,2.7779 -4.1573,3.5355 -3.5355,4.1573 -2.7779,4.6194 -1.9134,4.9039 -0.9755,5 0,4.9039 0.9755,4.6194 1.9134,4.3059 2.5,4.6194 3.0866,4.9039 4.0245,5 5,4.9039 5.9755,4.6194 6.9134,4.1573 7.7779,3.5355 8.5355,2.7779 9.1573,1.9134 9.6194,0.9755 9.9039,0 10,-0.9755 9.9039,-1.9134 9.6194,-2.7779 9.1573,-3.5355 8.5355,-4.1573 7.7779,-4.6194 6.9134,-4.9039 5.9755,-5 5,-4.9039 4.0245,-4.6194 3.0866,-4.3059 2.5))
SELECT ST_ASTEXT(_ST_BUFFER(ST_GEOMFROMTEXT('LINESTRING(10 10 2,10 15 3)'), 10));
ST_ASTEXT(_ST_BUFFER(ST_GEOMFROMTEXT('LINESTRING(10 10 2,10 15 3)'), 10))
POLYGON((0 10,0.1921 8.0491,0.7612 6.1732,1.6853 4.4443,2.9289 2.9289,4.4443 1.6853,6.1732 0.7612,8.0491 0.1921,10 0,11.9509 0.1921,13.8268 0.7612,15.5557 1.6853,17.0711 2.9289,18.3147 4.4443,19.2388 6.1732,19.8079 8.0491,20 10,20 15,20 15,19.8079 16.9509,19.2388 18.8268,18.3147 20.5557,17.0711 22.0711,15.5557 23.3147,13.8268 24.2388,11.9509 24.8079,10 25,8.0491 24.8079,6.1732 24.2388,4.4443 23.3147,2.9289 22.0711,1.6853 20.5557,0.7612 18.8268,0.1921 16.9509,0 15,0 10))
SELECT ST_ASTEXT(_ST_BUFFER(ST_GEOMFROMTEXT('MULTILINESTRING((0 0 1,-0 0 2),(0 0 2,0 -0 1))'), 10));
ST_ASTEXT(_ST_BUFFER(ST_GEOMFROMTEXT('MULTILINESTRING((0 0 1,-0 0 2),(0 0 2,0 -0 1))'), 10))
POLYGON((9.8079 -1.9509,10 0,9.8079 1.9509,9.2388 3.8268,8.3147 5.5557,7.0711 7.0711,5.5557 8.3147,3.8268 9.2388,1.9509 9.8079,0 10,-1.9509 9.8079,-3.8268 9.2388,-5.5557 8.3147,-7.0711 7.0711,-8.3147 5.5557,-9.2388 3.8268,-9.8079 1.9509,-10 0,-9.8079 -1.9509,-9.2388 -3.8268,-8.3147 -5.5557,-7.0711 -7.0711,-5.5557 -8.3147,-3.8268 -9.2388,-1.9509 -9.8079,0 -10,1.9509 -9.8079,3.8268 -9.2388,5.5557 -8.3147,7.0711 -7.0711,8.3147 -5.5557,9.2388 -3.8268,9.8079 -1.9509))
SELECT ST_ASTEXT(_ST_BUFFER(ST_GEOMFROMTEXT('POLYGON((3 3 1,5 5 3,7 3 4,3 3 1))'), 1));
ST_ASTEXT(_ST_BUFFER(ST_GEOMFROMTEXT('POLYGON((3 3 1,5 5 3,7 3 4,3 3 1))'), 1))
POLYGON((2.2929 3.7071,2.1685 3.5556,2.0761 3.3827,2.0192 3.1951,2 3,2.0192 2.8049,2.0761 2.6173,2.1685 2.4444,2.2929 2.2929,2.4444 2.1685,2.6173 2.0761,2.8049 2.0192,3 2,7 2,7.1951 2.0192,7.3827 2.0761,7.5556 2.1685,7.7071 2.2929,7.8315 2.4444,7.9239 2.6173,7.9808 2.8049,8 3,7.9808 3.1951,7.9239 3.3827,7.8315 3.5556,7.7071 3.7071,5.7071 5.7071,5.5556 5.8315,5.3827 5.9239,5.1951 5.9808,5 6,4.8049 5.9808,4.6173 5.9239,4.4444 5.8315,4.2929 5.7071,2.2929 3.7071))
SELECT ST_ASTEXT(_ST_BUFFER(ST_GEOMFROMTEXT('MULTIPOLYGON(((0 0 1,0 10 2,10 10 3,0 0 1)),((10 10 1,10 15 2,15 15 3,10 10 1)))'), 20));
ST_ASTEXT(_ST_BUFFER(ST_GEOMFROMTEXT('MULTIPOLYGON(((0 0 1,0 10 2,10 10 3,0 0 1)),((10 10 1,10 15 2,15 15 3,10 10 1)))'), 20))
POLYGON((-3.5192 29.6534,-3.9018 29.6157,-7.6537 28.4776,-11.1114 26.6294,-14.1421 24.1421,-16.6294 21.1114,-18.4776 17.6537,-19.6157 13.9018,-20 10,-20 0,-19.6157 -3.9018,-18.4776 -7.6537,-16.6294 -11.1114,-14.1421 -14.1421,-11.1114 -16.6294,-7.6537 -18.4776,-3.9018 -19.6157,0 -20,3.9018 -19.6157,7.6537 -18.4776,11.1114 -16.6294,14.1421 -14.1421,24.1421 -4.1421,29.1421 0.8579,31.6294 3.8886,33.4776 7.3463,34.6157 11.0982,35 15,34.6157 18.9018,33.4776 22.6537,31.6294 26.1114,29.1421 29.1421,26.1114 31.6294,22.6537 33.4776,18.9018 34.6157,15 35,10 35,6.0982 34.6157,2.3463 33.4776,-1.1114 31.6294,-3.5192 29.6534))
SELECT ST_ASTEXT(_ST_BUFFER(ST_GEOMFROMTEXT('GEOMETRYCOLLECTION(LINESTRING(1 1 1,2 2 2),'
                                                              'MULTILINESTRING((0 0 2,0 10 3),(10 10 1,10 15 4)))'), 50));
ST_ASTEXT(_ST_BUFFER(ST_GEOMFROMTEXT('GEOMETRYCOLLECTION(LINESTRING(1 1 1,2 2 2),'
                                                              'MULTILINESTRING((0 0 2,0 10 3),(10 10 1,10 15 4)))'), 50))
POLYGON((35.8061 -34.8061,36.3553 -34.3553,37.3553 -33.3553,40.9614 -28.9614,45.3553 -25.3553,51.5735 -17.7785,56.194 -9.1342,59.0393 0.2455,60 10,60 15,59.0393 24.7545,56.194 34.1342,51.5735 42.7785,45.3553 50.3553,37.7785 56.5735,29.1342 61.194,19.7545 64.0393,10 65,0.2455 64.0393,-9.1342 61.194,-17.6412 56.6469,-19.1342 56.194,-27.7785 51.5735,-35.3553 45.3553,-41.5735 37.7785,-46.194 29.1342,-49.0393 19.7545,-50 10,-50 0,-49.0393 -9.7545,-46.194 -19.1342,-41.5735 -27.7785,-35.3553 -35.3553,-27.7785 -41.5735,-19.1342 -46.194,-9.7545 -49.0393,0 -50,9.7545 -49.0393,19.1342 -46.194,27.7785 -41.5735,35.3553 -35.3553,35.8061 -34.8061))
###################################
# ST_IsValid(g)
###################################
SELECT ST_ISVALID(ST_GEOMFROMTEXT('POINTZ(2.34 -2.34 1)'));
ST_ISVALID(ST_GEOMFROMTEXT('POINTZ(2.34 -2.34 1)'))
1
SELECT ST_ISVALID(ST_GEOMFROMTEXT('MULTIPOINT(0 0 1,0 0 1,0 0 2,0 0 3)'));
ST_ISVALID(ST_GEOMFROMTEXT('MULTIPOINT(0 0 1,0 0 1,0 0 2,0 0 3)'))
1
SELECT ST_ISVALID(ST_GEOMFROMTEXT('LINESTRING(0 0 1,-0.00 0 2,0.0 0 3)'));
ST_ISVALID(ST_GEOMFROMTEXT('LINESTRING(0 0 1,-0.00 0 2,0.0 0 3)'))
0
SELECT ST_ISVALID(ST_GEOMFROMTEXT('LINESTRING(0 0 2,0 5 3,5 5 1,5 0 2,0 0 4)'));
ST_ISVALID(ST_GEOMFROMTEXT('LINESTRING(0 0 2,0 5 3,5 5 1,5 0 2,0 0 4)'))
1
SELECT ST_ISVALID(ST_GEOMFROMTEXT('MULTILINESTRING((0 10 1,10 0 2),(10 0 3,0 0 4),(0 0 5,10 10 2))'));
ST_ISVALID(ST_GEOMFROMTEXT('MULTILINESTRING((0 10 1,10 0 2),(10 0 3,0 0 4),(0 0 5,10 10 2))'))
1
SELECT ST_ISVALID(ST_GEOMFROMTEXT('POLYGON((0 0 1,0 10 2,10 10 3,10 0 4,0 0 5,0 0 1))'));
ST_ISVALID(ST_GEOMFROMTEXT('POLYGON((0 0 1,0 10 2,10 10 3,10 0 4,0 0 5,0 0 1))'))
1
SELECT ST_ISVALID(ST_GEOMFROMTEXT('POLYGON((0 0 1,0 10 2,10 10 3,10 0 4,0 0 5,0 0 1),(0 0 1,0 10 2,10 10 4,10 0 5,0 0 1))'));
ST_ISVALID(ST_GEOMFROMTEXT('POLYGON((0 0 1,0 10 2,10 10 3,10 0 4,0 0 5,0 0 1),(0 0 1,0 10 2,10 10 4,10 0 5,0 0 1))'))
0
SELECT ST_ISVALID(ST_GEOMFROMTEXT('MULTIPOLYGON(((1 1 2, 1 1 3, 1 1 4, 1 1 5, 1 1 2)))'));
ST_ISVALID(ST_GEOMFROMTEXT('MULTIPOLYGON(((1 1 2, 1 1 3, 1 1 4, 1 1 5, 1 1 2)))'))
0
SELECT ST_ISVALID(ST_GEOMFROMTEXT('MULTIPOLYGON(((0 0 1,0 10 2,10 10 3,0 0 1)),((10 10 2,10 15 4,15 15 3,10 10 2)))'));
ST_ISVALID(ST_GEOMFROMTEXT('MULTIPOLYGON(((0 0 1,0 10 2,10 10 3,0 0 1)),((10 10 2,10 15 4,15 15 3,10 10 2)))'))
1
SELECT ST_ISVALID(ST_GEOMFROMTEXT('GEOMETRYCOLLECTION Z(POLYGON Z((0 0 1,1 1 2,2 2 3,0 0 1)),GEOMETRYCOLLECTION Z EMPTY)'));
ST_ISVALID(ST_GEOMFROMTEXT('GEOMETRYCOLLECTION Z(POLYGON Z((0 0 1,1 1 2,2 2 3,0 0 1)),GEOMETRYCOLLECTION Z EMPTY)'))
0
SELECT ST_ISVALID(ST_GEOMFROMTEXT('GEOMETRYCOLLECTION(LINESTRING(1 1 1,2 2 2,3 3 3),'
                                                      'MULTILINESTRING((0 0 1,0 10 2,10 10 3,10 0 4),(10 10 1,10 15 2,15 15 4,10 10 1)))'));
ST_ISVALID(ST_GEOMFROMTEXT('GEOMETRYCOLLECTION(LINESTRING(1 1 1,2 2 2,3 3 3),'
                                                      'MULTILINESTRING((0 0 1,0 10 2,10 10 3,10 0 4),(10 10 1,10 15 2,15 15 4,10 10 1)))'))
1
###################################
# ST_TRANSFORM(g)
###################################
SELECT ST_ASTEXT(ST_TRANSFORM(ST_GEOMFROMTEXT('POINT(0 0 1)', 4326), 3819));
ST_ASTEXT(ST_TRANSFORM(ST_GEOMFROMTEXT('POINT(0 0 1)', 4326), 3819))
POINT(-0.005483 -0.00133)
SELECT ST_ASTEXT(ST_TRANSFORM(ST_GEOMFROMTEXT('LINESTRING(0 0 2, 1 1 3)', 4326), 3819));
ST_ASTEXT(ST_TRANSFORM(ST_GEOMFROMTEXT('LINESTRING(0 0 2, 1 1 3)', 4326), 3819))
LINESTRING(-0.005483 -0.00133,0.994571 0.998783)
SELECT ST_ASTEXT(ST_TRANSFORM(ST_GEOMFROMTEXT('POLYGON((0 0 1, 0 1 3, 1 1 2, 0 0 1))', 4326), 3819));
ST_ASTEXT(ST_TRANSFORM(ST_GEOMFROMTEXT('POLYGON((0 0 1, 0 1 3, 1 1 2, 0 0 1))', 4326), 3819))
POLYGON((-0.005483 -0.00133,-0.005503 0.998763,0.994571 0.998783,-0.005483 -0.00133))
SELECT ST_ASTEXT(ST_TRANSFORM(ST_GEOMFROMTEXT('GEOMETRYCOLLECTION(POINT(0 0 3))', 4326), 3819));
ST_ASTEXT(ST_TRANSFORM(ST_GEOMFROMTEXT('GEOMETRYCOLLECTION(POINT(0 0 3))', 4326), 3819))
GEOMETRYCOLLECTION(POINT(-0.005483 -0.00133))
SELECT ST_ASTEXT(ST_TRANSFORM(ST_GEOMFROMTEXT('MULTIPOINT((0 0 1))', 4326), 3819));
ST_ASTEXT(ST_TRANSFORM(ST_GEOMFROMTEXT('MULTIPOINT((0 0 1))', 4326), 3819))
MULTIPOINT((-0.005483 -0.00133))
SELECT ST_ASTEXT(ST_TRANSFORM(ST_GEOMFROMTEXT('MULTILINESTRING((0 0 1, 1 1 2))', 4326), 3819));
ST_ASTEXT(ST_TRANSFORM(ST_GEOMFROMTEXT('MULTILINESTRING((0 0 1, 1 1 2))', 4326), 3819))
MULTILINESTRING((-0.005483 -0.00133,0.994571 0.998783))
SELECT ST_ASTEXT(ST_TRANSFORM(ST_GEOMFROMTEXT('MULTIPOLYGON(((0 0 3, 0 1 1, 1 1 2, 0 0 3)))', 4326), 3819));
ST_ASTEXT(ST_TRANSFORM(ST_GEOMFROMTEXT('MULTIPOLYGON(((0 0 3, 0 1 1, 1 1 2, 0 0 3)))', 4326), 3819))
MULTIPOLYGON(((-0.005483 -0.00133,-0.005503 0.998763,0.994571 0.998783,-0.005483 -0.00133)))
###################################
# _st_dwithin
###################################
select 'dwithin_pt_pt_1', _st_dwithin(ST_GeomFromText('POINT(0 0 1)', 4326), ST_GeomFromText('POINT(1 1 2)', 4326), 300000);
dwithin_pt_pt_1	_st_dwithin(ST_GeomFromText('POINT(0 0 1)', 4326), ST_GeomFromText('POINT(1 1 2)', 4326), 300000)
dwithin_pt_pt_1	1
select 'dwithin_pt_pt_2', _st_dwithin(ST_GeomFromText('POINT(0 0 1)', 4326), ST_GeomFromText('POINT(1 1 2)', 4326), 10);
dwithin_pt_pt_2	_st_dwithin(ST_GeomFromText('POINT(0 0 1)', 4326), ST_GeomFromText('POINT(1 1 2)', 4326), 10)
dwithin_pt_pt_2	0
select 'dwithin_pt_line_1', _st_dwithin(ST_GeomFromText('POINT(0 0 1)', 4326), ST_GeomFromText('LINESTRING(1 1 1, 2 2 3)', 4326), 300000);
dwithin_pt_line_1	_st_dwithin(ST_GeomFromText('POINT(0 0 1)', 4326), ST_GeomFromText('LINESTRING(1 1 1, 2 2 3)', 4326), 300000)
dwithin_pt_line_1	1
select 'dwithin_line_pt_1', _st_dwithin(ST_GeomFromText('LINESTRING(1 1 2, 2 2 3)', 4326), ST_GeomFromText('POINT(0 0 1)', 4326), 300000);
dwithin_line_pt_1	_st_dwithin(ST_GeomFromText('LINESTRING(1 1 2, 2 2 3)', 4326), ST_GeomFromText('POINT(0 0 1)', 4326), 300000)
dwithin_line_pt_1	1
select 'dwithin_pt_poly_1', _st_dwithin(ST_GeomFromText('POINT(0 0 1)', 4326), ST_GeomFromText('POLYGON((1 1 2, 2 2 2, 3 0 3, 1 1 2))', 4326), 300000);
dwithin_pt_poly_1	_st_dwithin(ST_GeomFromText('POINT(0 0 1)', 4326), ST_GeomFromText('POLYGON((1 1 2, 2 2 2, 3 0 3, 1 1 2))', 4326), 300000)
dwithin_pt_poly_1	1
select 'dwithin_poly_pt_1', _st_dwithin(ST_GeomFromText('POLYGON((1 1 1, 2 2 3, 3 0 1, 1 1 1))', 4326), ST_GeomFromText('POINT(0 0 1)', 4326), 300000);
dwithin_poly_pt_1	_st_dwithin(ST_GeomFromText('POLYGON((1 1 1, 2 2 3, 3 0 1, 1 1 1))', 4326), ST_GeomFromText('POINT(0 0 1)', 4326), 300000)
dwithin_poly_pt_1	1
select 'dwithin_poly_pt_2', _st_dwithin(ST_GeomFromText('POLYGON((0 0 1, 10 0 2, 10 10 3, 0 10 4, 0 0 1))', 4326), ST_GeomFromText('POINT(5 10.01 3)', 4326), 1000);
dwithin_poly_pt_2	_st_dwithin(ST_GeomFromText('POLYGON((0 0 1, 10 0 2, 10 10 3, 0 10 4, 0 0 1))', 4326), ST_GeomFromText('POINT(5 10.01 3)', 4326), 1000)
dwithin_poly_pt_2	0
select 'dwithin_poly_pt_3', _st_dwithin(ST_GeomFromText('POLYGON((0 0 1, 10 0 2, 10 10 3, 0 10 4, 0 0 1))', 4326), ST_GeomFromText('POINT(5 10.01 3)', 4326), 3000);
dwithin_poly_pt_3	_st_dwithin(ST_GeomFromText('POLYGON((0 0 1, 10 0 2, 10 10 3, 0 10 4, 0 0 1))', 4326), ST_GeomFromText('POINT(5 10.01 3)', 4326), 3000)
dwithin_poly_pt_3	1
select 'dwithin_line_poly_1', _st_dwithin(ST_GeomFromText('LINESTRING(-1 -1 1, 0 0 2)', 4326), ST_GeomFromText('POLYGON((1 1 2, 2 2 2, 3 0 3, 1 1 2))', 4326), 300000);
dwithin_line_poly_1	_st_dwithin(ST_GeomFromText('LINESTRING(-1 -1 1, 0 0 2)', 4326), ST_GeomFromText('POLYGON((1 1 2, 2 2 2, 3 0 3, 1 1 2))', 4326), 300000)
dwithin_line_poly_1	1
select 'dwithin_poly_line_1', _st_dwithin(ST_GeomFromText('POLYGON((1 1 1, 2 2 3, 3 0 1, 1 1 1))', 4326), ST_GeomFromText('LINESTRING(-1 -1 2, 0 0 1)', 4326), 300000);
dwithin_poly_line_1	_st_dwithin(ST_GeomFromText('POLYGON((1 1 1, 2 2 3, 3 0 1, 1 1 1))', 4326), ST_GeomFromText('LINESTRING(-1 -1 2, 0 0 1)', 4326), 300000)
dwithin_poly_line_1	1
select 'dwithin_poly_poly_1', _st_dwithin(ST_GeomFromText('POLYGON((0 0 1, -2 -2 3, -3 0 2, 0 0 1))', 4326), ST_GeomFromText('POLYGON((1 1 1, 2 2 2, 3 0 1, 1 1 1))', 4326), 10);
dwithin_poly_poly_1	_st_dwithin(ST_GeomFromText('POLYGON((0 0 1, -2 -2 3, -3 0 2, 0 0 1))', 4326), ST_GeomFromText('POLYGON((1 1 1, 2 2 2, 3 0 1, 1 1 1))', 4326), 10)
dwithin_poly_poly_1	0
select 'dwithin_poly_poly_2', _st_dwithin(ST_GeomFromText('POLYGON((0 0 1, -2 -2 3, -3 0 2, 0 0 1))', 4326), ST_GeomFromText('POLYGON((1 1 1, 2 2 2, 3 0 1, 1 1 1))', 4326), 300000);
dwithin_poly_poly_2	_st_dwithin(ST_GeomFromText('POLYGON((0 0 1, -2 -2 3, -3 0 2, 0 0 1))', 4326), ST_GeomFromText('POLYGON((1 1 1, 2 2 2, 3 0 1, 1 1 1))', 4326), 300000)
dwithin_poly_poly_2	1
select 'dwithin_poly_poly_2', _st_dwithin(ST_GeomFromText('POLYGON((1 1 1, -2 -2 2, -3 0 2, 1 1 1))', 4326), ST_GeomFromText('POLYGON((1 1 1, 2 2 2, 3 0 1, 1 1 1))', 4326), 300000);
dwithin_poly_poly_2	_st_dwithin(ST_GeomFromText('POLYGON((1 1 1, -2 -2 2, -3 0 2, 1 1 1))', 4326), ST_GeomFromText('POLYGON((1 1 1, 2 2 2, 3 0 1, 1 1 1))', 4326), 300000)
dwithin_poly_poly_2	1
###################################
# st_area
###################################
SELECT ROUND(ST_AREA(ST_GEOMFROMTEXT('POLYGON((0 0 1, 1 0 2, 1 1 3, 0 0 1))', 0)), 2) AS area;
area
0.50
SELECT ROUND(ST_AREA(ST_GEOMFROMTEXT('MULTIPOLYGON(((0 0 1, 1 0 2, 1 1 3, 0 0 1)))', 0)), 2) AS area;
area
0.50
###################################
# spatial index
###################################
drop table tt1;
create table tt1(id int , g geometry not null srid 0);
CREATE SPATIAL INDEX g_idx ON tt1(g);
insert into tt1 values(1,ST_GeomFromText('point(10 20)'));
insert into tt1 values(2,ST_GeomFromText('point(10 20 5)'));
insert into tt1 values(3,ST_GeomFromText('POLYGON((0 0,10 0,10 10,0 10,0 0))'));
insert into tt1 values(4,ST_GeomFromText('POLYGON((0 0 1,10 0 2,10 10 2,0 10 3,0 0 1))'));
insert into tt1 values(5,ST_GeomFromText('LINESTRING(10 10, 20 20)',0));
insert into tt1 values(6,ST_GeomFromText('LINESTRING(10 10 2, 20 20 3)',0));
select id ,st_astext(g) from tt1 where ST_Intersects(ST_GeomFromText('point(10 20)'),g);
id	st_astext(g)
1	POINT(10 20)
2	POINT Z (10 20 5)
select id ,/*+INDEX(tt1 g_idx)*/ st_astext(g) from tt1 where ST_Intersects(ST_GeomFromText('point(10 20)'),g);
id	st_astext(g)
1	POINT(10 20)
2	POINT Z (10 20 5)
select id ,st_astext(g) from tt1 where ST_Intersects(ST_GeomFromText('point(2 1)'),g);
id	st_astext(g)
3	POLYGON((0 0,10 0,10 10,0 10,0 0))
4	POLYGON Z ((0 0 1,10 0 2,10 10 2,0 10 3,0 0 1))
select id ,/*+INDEX(tt1 g_idx)*/ st_astext(g) from tt1 where ST_Intersects(ST_GeomFromText('point(2 1)'),g);
id	st_astext(g)
3	POLYGON((0 0,10 0,10 10,0 10,0 0))
4	POLYGON Z ((0 0 1,10 0 2,10 10 2,0 10 3,0 0 1))
select id ,st_astext(g) from tt1 where ST_Intersects(ST_GeomFromText('point(10 20 5)'),g);
id	st_astext(g)
1	POINT(10 20)
2	POINT Z (10 20 5)
select id ,/*+INDEX(tt1 g_idx)*/ st_astext(g) from tt1 where ST_Intersects(ST_GeomFromText('point(10 20)'),g);
id	st_astext(g)
1	POINT(10 20)
2	POINT Z (10 20 5)
select id ,st_astext(g) from tt1 where ST_Intersects(ST_GeomFromText('point(2 1 2)'),g);
id	st_astext(g)
3	POLYGON((0 0,10 0,10 10,0 10,0 0))
4	POLYGON Z ((0 0 1,10 0 2,10 10 2,0 10 3,0 0 1))
select id ,/*+INDEX(tt1 g_idx)*/ st_astext(g) from tt1 where ST_Intersects(ST_GeomFromText('point(2 1)'),g);
id	st_astext(g)
3	POLYGON((0 0,10 0,10 10,0 10,0 0))
4	POLYGON Z ((0 0 1,10 0 2,10 10 2,0 10 3,0 0 1))
select id ,/*+INDEX(tt1 g_idx)*/ st_astext(g) from tt1 where ST_Intersects(ST_GeomFromText('linestring(10 20, 20 10)'),g);
id	st_astext(g)
1	POINT(10 20)
2	POINT Z (10 20 5)
5	LINESTRING(10 10,20 20)
6	LINESTRING Z (10 10 2,20 20 3)
select id ,/*+INDEX(tt1 g_idx)*/ st_astext(g) from tt1 where ST_Intersects(ST_GeomFromText('linestring(10 20 2, 20 10 3)'),g);
id	st_astext(g)
1	POINT(10 20)
2	POINT Z (10 20 5)
5	LINESTRING(10 10,20 20)
6	LINESTRING Z (10 10 2,20 20 3)
DROP INDEX g_idx ON tt1;
drop table tt1;
select point(1,1,1);
ERROR 42000: You have an error in your SQL syntax; check the manual that corresponds to your OceanBase version for the right syntax to use near ',1)' at line 1
select linestring(@wkb_ln);
ERROR HY000: Incorrect arguments to linestring
select polygon(@wkb_py);
ERROR HY000: Incorrect arguments to polygon
select geometrycollection(@wkb_ln);
ERROR HY000: Incorrect arguments to geometrycollection
select geometrycollection(@wkb_mpy);
ERROR HY000: Incorrect arguments to geometrycollection
select geometrycollection(@wkb_gc);
ERROR HY000: Incorrect arguments to geometrycollection
SELECT ST_SRID(ST_GEOMFROMTEXT('POINT(0 0 0)'));
ERROR 22023: Invalid GIS data provided to function st_srid.
SELECT _ST_SETSRID(ST_GEOMFROMTEXT('POINT(0 0 0)'), 4326);
ERROR 22023: Invalid GIS data provided to function _st_setsrid.
SELECT ST_X(ST_GEOMFROMTEXT('POINT(0 0 0)'));
ERROR 22023: Invalid GIS data provided to function st_x.
SELECT ST_Y(ST_GEOMFROMTEXT('POINT(0 0 0)'));
ERROR 22023: Invalid GIS data provided to function st_y.
SELECT ST_LATITUDE(ST_GEOMFROMTEXT('POINT(0 0 0)', 4326), 1);
ERROR 22023: Invalid GIS data provided to function st_latitude.
SELECT ST_LONGITUDE(ST_GEOMFROMTEXT('POINT(0 0 0)', 4326), 1);
ERROR 22023: Invalid GIS data provided to function st_longitude.
###################################
# ST_Equals(g1, g2)
###################################
select ST_Equals(ST_GeomFromText('GEOMETRYCOLLECTION(Point(1 2 3),LINESTRING(1 2 2, 3 4 1),POLYGON((2 2 1,2 8 5,8 8 7,8 2 4,2 2 1)))'), ST_GeomFromText('LINESTRING(1 2 3, 3 4 5)'));
ST_Equals(ST_GeomFromText('GEOMETRYCOLLECTION(Point(1 2 3),LINESTRING(1 2 2, 3 4 1),POLYGON((2 2 1,2 8 5,8 8 7,8 2 4,2 2 1)))'), ST_GeomFromText('LINESTRING(1 2 3, 3 4 5)'))
0
select ST_Equals(ST_GeomFromText('GEOMETRYCOLLECTION(Point(1 2 3),LINESTRING(1 3 2, 3 4 1),POLYGON((2 2 1,2 8 5,8 8 7,8 2 4,2 2 1)))'), ST_GeomFromText('LINESTRING(1 2 3, 3 4 5)'));
ST_Equals(ST_GeomFromText('GEOMETRYCOLLECTION(Point(1 2 3),LINESTRING(1 3 2, 3 4 1),POLYGON((2 2 1,2 8 5,8 8 7,8 2 4,2 2 1)))'), ST_GeomFromText('LINESTRING(1 2 3, 3 4 5)'))
0
select ST_Equals(ST_GeomFromText('LINESTRING(1 2 2, 3 4 1)'), ST_GeomFromText('GEOMETRYCOLLECTION(Point(1 2 1),LINESTRING(1 2 1, 3 4 2),POLYGON((2 2 1,2 8 5,8 8 7,8 2 4,2 2 1)))'));
ST_Equals(ST_GeomFromText('LINESTRING(1 2 2, 3 4 1)'), ST_GeomFromText('GEOMETRYCOLLECTION(Point(1 2 1),LINESTRING(1 2 1, 3 4 2),POLYGON((2 2 1,2 8 5,8 8 7,8 2 4,2 2 1)))'))
0
select ST_Equals(ST_GeomFromText('LINESTRING(1 2 2, 3 4 1)'), ST_GeomFromText('LINESTRING(1 2 2, 3 4 1)'));
ST_Equals(ST_GeomFromText('LINESTRING(1 2 2, 3 4 1)'), ST_GeomFromText('LINESTRING(1 2 2, 3 4 1)'))
1
select ST_Equals(ST_GeomFromText('LINESTRING(1 2 2, 4 8 1)'), ST_GeomFromText('LINESTRING(1 2 2, 2 4 1)'));
ST_Equals(ST_GeomFromText('LINESTRING(1 2 2, 4 8 1)'), ST_GeomFromText('LINESTRING(1 2 2, 2 4 1)'))
0
select ST_Equals(ST_GeomFromText('LINESTRING(1 2 2, 4 8 1)'), ST_GeomFromText('LINESTRING(1 2 2, 3 4 1)'));
ST_Equals(ST_GeomFromText('LINESTRING(1 2 2, 4 8 1)'), ST_GeomFromText('LINESTRING(1 2 2, 3 4 1)'))
0
select ST_Equals(ST_GeomFromText('POLYGON((0 0 1, 10 0 2, 10 10 3, 0 10 2, 0 0 1))'), ST_GeomFromText('LINESTRING(1 2 2, 4 8 1)'));
ST_Equals(ST_GeomFromText('POLYGON((0 0 1, 10 0 2, 10 10 3, 0 10 2, 0 0 1))'), ST_GeomFromText('LINESTRING(1 2 2, 4 8 1)'))
0
select ST_Equals(ST_GeomFromText('POLYGON((0 0 1, 10 0 2, 10 10 3, 0 10 2, 0 0 1))'), ST_GeomFromText('LINESTRING(1 2 1, 6 12 2)'));
ST_Equals(ST_GeomFromText('POLYGON((0 0 1, 10 0 2, 10 10 3, 0 10 2, 0 0 1))'), ST_GeomFromText('LINESTRING(1 2 1, 6 12 2)'))
0
select ST_Equals(ST_GeomFromText('MULTIPOINT(1 2 2, 3 4 1)'), ST_GeomFromText('MULTIPOINT(1 2 2, 3 4 1)'));
ST_Equals(ST_GeomFromText('MULTIPOINT(1 2 2, 3 4 1)'), ST_GeomFromText('MULTIPOINT(1 2 2, 3 4 1)'))
1
###################################
# _ST_Touches(g1, g2)
###################################
select _ST_Touches(ST_GeomFromText('GEOMETRYCOLLECTION(Point(1 2 3),LINESTRING(1 2 2, 3 4 1),POLYGON((2 2 1,2 8 5,8 8 7,8 2 4,2 2 1)))'), ST_GeomFromText('LINESTRING(1 2 3, 3 4 5)'));
_ST_Touches(ST_GeomFromText('GEOMETRYCOLLECTION(Point(1 2 3),LINESTRING(1 2 2, 3 4 1),POLYGON((2 2 1,2 8 5,8 8 7,8 2 4,2 2 1)))'), ST_GeomFromText('LINESTRING(1 2 3, 3 4 5)'))
0
select _ST_Touches(ST_GeomFromText('GEOMETRYCOLLECTION(Point(1 2 3),LINESTRING(1 3 2, 3 4 1),POLYGON((2 2 1,2 8 5,8 8 7,8 2 4,2 2 1)))'), ST_GeomFromText('LINESTRING(1 2 3, 3 4 5)'));
_ST_Touches(ST_GeomFromText('GEOMETRYCOLLECTION(Point(1 2 3),LINESTRING(1 3 2, 3 4 1),POLYGON((2 2 1,2 8 5,8 8 7,8 2 4,2 2 1)))'), ST_GeomFromText('LINESTRING(1 2 3, 3 4 5)'))
0
select _ST_Touches(ST_GeomFromText('LINESTRING(1 2 2, 3 4 1)'), ST_GeomFromText('GEOMETRYCOLLECTION(Point(1 2 1),LINESTRING(1 2 1, 3 4 2),POLYGON((2 2 1,2 8 5,8 8 7,8 2 4,2 2 1)))'));
_ST_Touches(ST_GeomFromText('LINESTRING(1 2 2, 3 4 1)'), ST_GeomFromText('GEOMETRYCOLLECTION(Point(1 2 1),LINESTRING(1 2 1, 3 4 2),POLYGON((2 2 1,2 8 5,8 8 7,8 2 4,2 2 1)))'))
0
select _ST_Touches(ST_GeomFromText('LINESTRING(1 2 2, 3 4 1)'), ST_GeomFromText('LINESTRING(1 2 2, 3 4 1)'));
_ST_Touches(ST_GeomFromText('LINESTRING(1 2 2, 3 4 1)'), ST_GeomFromText('LINESTRING(1 2 2, 3 4 1)'))
0
select _ST_Touches(ST_GeomFromText('LINESTRING(1 2 2, 4 8 1)'), ST_GeomFromText('LINESTRING(1 2 2, 2 4 1)'));
_ST_Touches(ST_GeomFromText('LINESTRING(1 2 2, 4 8 1)'), ST_GeomFromText('LINESTRING(1 2 2, 2 4 1)'))
0
select _ST_Touches(ST_GeomFromText('LINESTRING(1 2 2, 4 8 1)'), ST_GeomFromText('LINESTRING(1 2 2, 3 4 1)'));
_ST_Touches(ST_GeomFromText('LINESTRING(1 2 2, 4 8 1)'), ST_GeomFromText('LINESTRING(1 2 2, 3 4 1)'))
1
select _ST_Touches(ST_GeomFromText('POLYGON((0 0 1, 10 0 2, 10 10 3, 0 10 2, 0 0 1))'), ST_GeomFromText('LINESTRING(1 2 2, 4 8 1)'));
_ST_Touches(ST_GeomFromText('POLYGON((0 0 1, 10 0 2, 10 10 3, 0 10 2, 0 0 1))'), ST_GeomFromText('LINESTRING(1 2 2, 4 8 1)'))
0
select _ST_Touches(ST_GeomFromText('POLYGON((0 0 1, 10 0 2, 10 10 3, 0 10 2, 0 0 1))'), ST_GeomFromText('LINESTRING(1 2 1, 6 12 2)'));
_ST_Touches(ST_GeomFromText('POLYGON((0 0 1, 10 0 2, 10 10 3, 0 10 2, 0 0 1))'), ST_GeomFromText('LINESTRING(1 2 1, 6 12 2)'))
0
select _ST_Touches(ST_GeomFromText('MULTIPOINT(1 2 2, 3 4 1)'), ST_GeomFromText('MULTIPOINT(1 2 2, 3 4 1)'));
_ST_Touches(ST_GeomFromText('MULTIPOINT(1 2 2, 3 4 1)'), ST_GeomFromText('MULTIPOINT(1 2 2, 3 4 1)'))
0
###################################
# _ST_NumInteriorRings(g1)
###################################
select _ST_NumInteriorRings(ST_GeomFromText('POLYGON((2 2 1,2 8 5,8 8 7,8 2 4,2 2 1))'));
_ST_NumInteriorRings(ST_GeomFromText('POLYGON((2 2 1,2 8 5,8 8 7,8 2 4,2 2 1))'))
0
select _ST_NumInteriorRings(ST_GeomFromText('POLYGON((2 2 1,2 8 5,8 8 7,8 2 4,2 2 1), (2 2 1,2 8 5,8 8 7,8 2 4,2 2 1))'));
_ST_NumInteriorRings(ST_GeomFromText('POLYGON((2 2 1,2 8 5,8 8 7,8 2 4,2 2 1), (2 2 1,2 8 5,8 8 7,8 2 4,2 2 1))'))
1
select _ST_NumInteriorRings(ST_GeomFromText('Polygon Z((0 0 0, 0 8 1, 8 8 2, 8 10 3, -10 10 4, -10 0 5, 0 0 0))'));
_ST_NumInteriorRings(ST_GeomFromText('Polygon Z((0 0 0, 0 8 1, 8 8 2, 8 10 3, -10 10 4, -10 0 5, 0 0 0))'))
0
select _ST_NumInteriorRings(ST_GeomFromText('Polygon Z((0 0 0, 0 8 1, 8 8 2, 8 10 3, -10 10 4, -10 0 5, 0 0 0), (0 0 0, 0 8 1, 8 8 2, 8 10 3, -10 10 4, -10 0 5, 0 0 0))'));
_ST_NumInteriorRings(ST_GeomFromText('Polygon Z((0 0 0, 0 8 1, 8 8 2, 8 10 3, -10 10 4, -10 0 5, 0 0 0), (0 0 0, 0 8 1, 8 8 2, 8 10 3, -10 10 4, -10 0 5, 0 0 0))'))
1
select _ST_NumInteriorRings(ST_GeomFromText('GEOMETRYCOLLECTION(POLYGON((2 2 1,2 8 5,8 8 7,8 2 4,2 2 1)))'));
_ST_NumInteriorRings(ST_GeomFromText('GEOMETRYCOLLECTION(POLYGON((2 2 1,2 8 5,8 8 7,8 2 4,2 2 1)))'))
NULL
select _ST_NumInteriorRings(ST_GeomFromText('MULTIPOLYGON Z(((28 26 1,28 0 2,84 0 3,84 42 4,28 26 1),(52 18 34,66 23 54,73 9 67,48 6 65,52 18 34)),((59 18 11,67 18 34,67 13 23,59 13 56,59 18 11)))'));
_ST_NumInteriorRings(ST_GeomFromText('MULTIPOLYGON Z(((28 26 1,28 0 2,84 0 3,84 42 4,28 26 1),(52 18 34,66 23 54,73 9 67,48 6 65,52 18 34)),((59 18 11,67 18 34,67 13 23,59 13 56,59 18 11)))'))
NULL
###################################
# _ST_IsCollection(g1)
###################################
SELECT _ST_IsCollection(ST_GeomFromText('POINT Z (1e8 -23e4 +2e8)'));
_ST_IsCollection(ST_GeomFromText('POINT Z (1e8 -23e4 +2e8)'))
0
SELECT _ST_IsCollection(ST_GeomFromText('LINESTRING Z(0 0 0,10 10 10)'));
_ST_IsCollection(ST_GeomFromText('LINESTRING Z(0 0 0,10 10 10)'))
0
SELECT _ST_IsCollection(ST_GeomFromText('LINESTRING Z(0 0 10,-4 8 -3, 2000 2000 1000)'));
_ST_IsCollection(ST_GeomFromText('LINESTRING Z(0 0 10,-4 8 -3, 2000 2000 1000)'))
0
SELECT _ST_IsCollection(ST_GeomFromText('Polygon Z((0 0 0, 0 8 1, 8 8 2, 8 10 3, -10 10 4, -10 0 5, 0 0 0))'));
_ST_IsCollection(ST_GeomFromText('Polygon Z((0 0 0, 0 8 1, 8 8 2, 8 10 3, -10 10 4, -10 0 5, 0 0 0))'))
0
SELECT _ST_IsCollection(ST_GeomFromText('MULTIPOINT Z(1 1 1, 11 11 12, 11 21 13, 21 21 14)'));
_ST_IsCollection(ST_GeomFromText('MULTIPOINT Z(1 1 1, 11 11 12, 11 21 13, 21 21 14)'))
1
SELECT _ST_IsCollection(ST_GeomFromText('MULTIPOINT Z((0 0 1),(10 10 2),(10 20 3),(20 20 4))'));
_ST_IsCollection(ST_GeomFromText('MULTIPOINT Z((0 0 1),(10 10 2),(10 20 3),(20 20 4))'))
1
SELECT _ST_IsCollection(ST_GeomFromText('MULTILINESTRING Z((10 48 23,10 21 12,10 0 34),(16 0 12,16 23 23,16 48 32))'));
_ST_IsCollection(ST_GeomFromText('MULTILINESTRING Z((10 48 23,10 21 12,10 0 34),(16 0 12,16 23 23,16 48 32))'))
1
SELECT _ST_IsCollection(ST_GeomFromText('MULTIPOLYGON Z(((28 26 1,28 0 2,84 0 3,84 42 4,28 26 1),(52 18 34,66 23 54,73 9 67,48 6 65,52 18 34)),((59 18 11,67 18 34,67 13 23,59 13 56,59 18 11)))'));
_ST_IsCollection(ST_GeomFromText('MULTIPOLYGON Z(((28 26 1,28 0 2,84 0 3,84 42 4,28 26 1),(52 18 34,66 23 54,73 9 67,48 6 65,52 18 34)),((59 18 11,67 18 34,67 13 23,59 13 56,59 18 11)))'))
1
SELECT _ST_IsCollection(ST_GeomFromText('GEOMETRYCOLLECTION Z EMPTY'));
_ST_IsCollection(ST_GeomFromText('GEOMETRYCOLLECTION Z EMPTY'))
1
SELECT _ST_IsCollection(ST_GeomFromText('GEOMETRYCOLLECTION Z ()'));
_ST_IsCollection(ST_GeomFromText('GEOMETRYCOLLECTION Z ()'))
1
SELECT _ST_IsCollection(ST_GeomFromText('GEOMETRYCOLLECTION Z (Point(9 9 9),LINESTRING(1 5 1,0 0 2),POLYGON((2 2 2,2 8 1,8 8 3,8 2 4,2 2 2)))'));
_ST_IsCollection(ST_GeomFromText('GEOMETRYCOLLECTION Z (Point(9 9 9),LINESTRING(1 5 1,0 0 2),POLYGON((2 2 2,2 8 1,8 8 3,8 2 4,2 2 2)))'))
1
SELECT _ST_IsCollection(ST_GeomFromText('GEOMETRYCOLLECTION Z(GEOMETRYCOLLECTION(),GEOMETRYCOLLECTION EMPTY, GEOMETRYCOLLECTION(POINT(1 1 3)), MULTILINESTRING((10 48 3,10 21 3,10 0 1),(16 0 3,16 23 4,16 48 5)), MULTIPOLYGON(((28 26 23,28 0 1,84 0 2,84 42 4,28 26 23),(52 18 13,66 23 25,73 9 12,48 6 34,52 18 13)),((59 18 1,67 18 12,67 13 23,59 13 45,59 18 1))), MULTIPOINT((0 0 1),(10 10 3),(10 20 4),(20 20 5)), MULTIPOINT(1 1 1, 11 11 11, 11 21 22, 21 21 23), GEOMETRYCOLLECTION(LINESTRING(1 1 1,2 2 3)), GEOMETRYCOLLECTION(POLYGON((0 0 1,50 45 23,40 50 34,0 0 1)),LINESTRING(-10 -10 1,0 0 2),LINESTRING(46.666666666666664 46.666666666666664 46.666666666666664,200 200 12,199 201 23,45.333333333333336 47.333333333333336 47.333333333333336),LINESTRING(8 10 1,-11 -9 -3)))'));
_ST_IsCollection(ST_GeomFromText('GEOMETRYCOLLECTION Z(GEOMETRYCOLLECTION(),GEOMETRYCOLLECTION EMPTY, GEOMETRYCOLLECTION(POINT(1 1 3)), MULTILINESTRING((10 48 3,10 21 3,10 0 1),(16 0 3,16 23 4,16 48 5)), MULTIPOLYGON(((28 26 23,28 0 1,84 0 2,84 42 4,28 26
1
###################################
# ST_AsText(ST_Difference(g1, g2)
###################################
select ST_AsText(ST_Difference(ST_GeomFromText('GEOMETRYCOLLECTION(Point(1 2 3),LINESTRING(1 2 2, 3 4 1),POLYGON((2 2 1,2 8 5,8 8 7,8 2 4,2 2 1)))'), ST_GeomFromText('LINESTRING(1 2 3, 3 4 5)')));
ST_AsText(ST_Difference(ST_GeomFromText('GEOMETRYCOLLECTION(Point(1 2 3),LINESTRING(1 2 2, 3 4 1),POLYGON((2 2 1,2 8 5,8 8 7,8 2 4,2 2 1)))'), ST_GeomFromText('LINESTRING(1 2 3, 3 4 5)')))
POLYGON Z ((2 2 2,8 2 4,8 8 7,2 8 5,2 2 2))
select ST_AsText(ST_Difference(ST_GeomFromText('GEOMETRYCOLLECTION(Point(1 2 3),LINESTRING(1 3 2, 3 4 1),POLYGON((2 2 1,2 8 5,8 8 7,8 2 4,2 2 1)))'), ST_GeomFromText('LINESTRING(1 2 3, 3 4 5)')));
ST_AsText(ST_Difference(ST_GeomFromText('GEOMETRYCOLLECTION(Point(1 2 3),LINESTRING(1 3 2, 3 4 1),POLYGON((2 2 1,2 8 5,8 8 7,8 2 4,2 2 1)))'), ST_GeomFromText('LINESTRING(1 2 3, 3 4 5)')))
GEOMETRYCOLLECTION Z (POLYGON Z ((2 2 2,8 2 4,8 8 7,2 8 5,2 2 2)),LINESTRING Z (1 3 2,2 3.5 2))
select ST_AsText(ST_Difference(ST_GeomFromText('LINESTRING(1 2 2, 3 4 1)'), ST_GeomFromText('GEOMETRYCOLLECTION(Point(1 2 1),LINESTRING(1 2 1, 3 4 2),POLYGON((2 2 1,2 8 5,8 8 7,8 2 4,2 2 1)))')));
ST_AsText(ST_Difference(ST_GeomFromText('LINESTRING(1 2 2, 3 4 1)'), ST_GeomFromText('GEOMETRYCOLLECTION(Point(1 2 1),LINESTRING(1 2 1, 3 4 2),POLYGON((2 2 1,2 8 5,8 8 7,8 2 4,2 2 1)))')))
GEOMETRYCOLLECTION Z EMPTY
select ST_AsText(ST_Difference(ST_GeomFromText('LINESTRING(1 2 2, 3 4 1)'), ST_GeomFromText('LINESTRING(1 2 2, 3 4 1)')));
ST_AsText(ST_Difference(ST_GeomFromText('LINESTRING(1 2 2, 3 4 1)'), ST_GeomFromText('LINESTRING(1 2 2, 3 4 1)')))
GEOMETRYCOLLECTION Z EMPTY
select ST_AsText(ST_Difference(ST_GeomFromText('LINESTRING(1 2 2, 4 8 1)'), ST_GeomFromText('LINESTRING(1 2 2, 2 4 1)')));
ST_AsText(ST_Difference(ST_GeomFromText('LINESTRING(1 2 2, 4 8 1)'), ST_GeomFromText('LINESTRING(1 2 2, 2 4 1)')))
LINESTRING Z (2 4 1,4 8 1)
select ST_AsText(ST_Difference(ST_GeomFromText('LINESTRING(1 2 2, 4 8 1)'), ST_GeomFromText('LINESTRING(1 2 2, 3 4 1)')));
ST_AsText(ST_Difference(ST_GeomFromText('LINESTRING(1 2 2, 4 8 1)'), ST_GeomFromText('LINESTRING(1 2 2, 3 4 1)')))
LINESTRING Z (1 2 2,4 8 1)
select ST_AsText(ST_Difference(ST_GeomFromText('POLYGON((0 0 1, 10 0 2, 10 10 3, 0 10 2, 0 0 1))'), ST_GeomFromText('LINESTRING(1 2 2, 4 8 1)')));
ST_AsText(ST_Difference(ST_GeomFromText('POLYGON((0 0 1, 10 0 2, 10 10 3, 0 10 2, 0 0 1))'), ST_GeomFromText('LINESTRING(1 2 2, 4 8 1)')))
POLYGON Z ((0 0 1.3333333333333333,10 0 2,10 10 3,0 10 2,0 0 1.3333333333333333))
select ST_AsText(ST_Difference(ST_GeomFromText('POLYGON((0 0 1, 10 0 2, 10 10 3, 0 10 2, 0 0 1))'), ST_GeomFromText('LINESTRING(1 2 1, 6 12 2)')));
ST_AsText(ST_Difference(ST_GeomFromText('POLYGON((0 0 1, 10 0 2, 10 10 3, 0 10 2, 0 0 1))'), ST_GeomFromText('LINESTRING(1 2 1, 6 12 2)')))
POLYGON Z ((0 0 1,10 0 2,10 10 3,0 10 2,0 0 1))
select ST_AsText(ST_Difference(ST_GeomFromText('MULTIPOINT(1 2 2, 3 4 1)'), ST_GeomFromText('MULTIPOINT(1 2 2, 3 4 1)')));
ST_AsText(ST_Difference(ST_GeomFromText('MULTIPOINT(1 2 2, 3 4 1)'), ST_GeomFromText('MULTIPOINT(1 2 2, 3 4 1)')))
GEOMETRYCOLLECTION Z EMPTY
bugfix: 53518491
SELECT ST_ASTEXT(ST_GEOMFROMTEXT(CONCAT('MULTIPOINT(','-913.3616294416527 154.1696418163881 21313',',','-253.82976890677605 0 -258.6737392372953',')'))) t;
t
MULTIPOINT Z ((-913.3616294416527 154.1696418163881 21313),(-253.82976890677605 0 -258.6737392372953))
bugfix: 54150857
###################################
# st_crosses(g1, g2)
###################################
select st_crosses(ST_GeomFromText('GEOMETRYCOLLECTION(Point(1 2 3),LINESTRING(1 2 2, 3 4 1),POLYGON((2 2 1,2 8 5,8 8 7,8 2 4,2 2 1)))'), ST_GeomFromText('LINESTRING(1 2 3, 3 4 5)'));
st_crosses(ST_GeomFromText('GEOMETRYCOLLECTION(Point(1 2 3),LINESTRING(1 2 2, 3 4 1),POLYGON((2 2 1,2 8 5,8 8 7,8 2 4,2 2 1)))'), ST_GeomFromText('LINESTRING(1 2 3, 3 4 5)'))
NULL
select st_crosses(ST_GeomFromText('GEOMETRYCOLLECTION(Point(1 2 3),LINESTRING(1 3 2, 3 4 1),POLYGON((2 2 1,2 8 5,8 8 7,8 2 4,2 2 1)))'), ST_GeomFromText('LINESTRING(1 2 3, 3 4 5)'));
st_crosses(ST_GeomFromText('GEOMETRYCOLLECTION(Point(1 2 3),LINESTRING(1 3 2, 3 4 1),POLYGON((2 2 1,2 8 5,8 8 7,8 2 4,2 2 1)))'), ST_GeomFromText('LINESTRING(1 2 3, 3 4 5)'))
NULL
select st_crosses(ST_GeomFromText('LINESTRING(1 2 2, 3 4 1)'), ST_GeomFromText('GEOMETRYCOLLECTION(Point(1 2 1),LINESTRING(1 2 1, 3 4 2),POLYGON((2 2 1,2 8 5,8 8 7,8 2 4,2 2 1)))'));
st_crosses(ST_GeomFromText('LINESTRING(1 2 2, 3 4 1)'), ST_GeomFromText('GEOMETRYCOLLECTION(Point(1 2 1),LINESTRING(1 2 1, 3 4 2),POLYGON((2 2 1,2 8 5,8 8 7,8 2 4,2 2 1)))'))
0
select st_crosses(ST_GeomFromText('LINESTRING(1 2 2, 3 4 1)'), ST_GeomFromText('LINESTRING(1 2 2, 3 4 1)'));
st_crosses(ST_GeomFromText('LINESTRING(1 2 2, 3 4 1)'), ST_GeomFromText('LINESTRING(1 2 2, 3 4 1)'))
0
select st_crosses(ST_GeomFromText('LINESTRING(1 2 2, 4 8 1)'), ST_GeomFromText('LINESTRING(1 2 2, 2 4 1)'));
st_crosses(ST_GeomFromText('LINESTRING(1 2 2, 4 8 1)'), ST_GeomFromText('LINESTRING(1 2 2, 2 4 1)'))
0
select st_crosses(ST_GeomFromText('LINESTRING(1 2 2, 4 8 1)'), ST_GeomFromText('LINESTRING(1 2 2, 3 4 1)'));
st_crosses(ST_GeomFromText('LINESTRING(1 2 2, 4 8 1)'), ST_GeomFromText('LINESTRING(1 2 2, 3 4 1)'))
0
select st_crosses(ST_GeomFromText('POLYGON((0 0 1, 10 0 2, 10 10 3, 0 10 2, 0 0 1))'), ST_GeomFromText('LINESTRING(1 2 2, 4 8 1)'));
st_crosses(ST_GeomFromText('POLYGON((0 0 1, 10 0 2, 10 10 3, 0 10 2, 0 0 1))'), ST_GeomFromText('LINESTRING(1 2 2, 4 8 1)'))
NULL
select st_crosses(ST_GeomFromText('POLYGON((0 0 1, 10 0 2, 10 10 3, 0 10 2, 0 0 1))'), ST_GeomFromText('LINESTRING(1 2 1, 6 12 2)'));
st_crosses(ST_GeomFromText('POLYGON((0 0 1, 10 0 2, 10 10 3, 0 10 2, 0 0 1))'), ST_GeomFromText('LINESTRING(1 2 1, 6 12 2)'))
NULL
select st_crosses(ST_GeomFromText('MULTIPOINT(1 2 2, 3 4 1)'), ST_GeomFromText('MULTIPOINT(1 2 2, 3 4 1)'));
st_crosses(ST_GeomFromText('MULTIPOINT(1 2 2, 3 4 1)'), ST_GeomFromText('MULTIPOINT(1 2 2, 3 4 1)'))
NULL
###################################
# st_overlaps(g1, g2)
###################################
select st_overlaps(ST_GeomFromText('GEOMETRYCOLLECTION(Point(1 2 3),LINESTRING(1 2 2, 3 4 1),POLYGON((2 2 1,2 8 5,8 8 7,8 2 4,2 2 1)))'), ST_GeomFromText('LINESTRING(1 2 3, 3 4 5)'));
st_overlaps(ST_GeomFromText('GEOMETRYCOLLECTION(Point(1 2 3),LINESTRING(1 2 2, 3 4 1),POLYGON((2 2 1,2 8 5,8 8 7,8 2 4,2 2 1)))'), ST_GeomFromText('LINESTRING(1 2 3, 3 4 5)'))
NULL
select st_overlaps(ST_GeomFromText('GEOMETRYCOLLECTION(Point(1 2 3),LINESTRING(1 3 2, 3 4 1),POLYGON((2 2 1,2 8 5,8 8 7,8 2 4,2 2 1)))'), ST_GeomFromText('LINESTRING(1 2 3, 3 4 5)'));
st_overlaps(ST_GeomFromText('GEOMETRYCOLLECTION(Point(1 2 3),LINESTRING(1 3 2, 3 4 1),POLYGON((2 2 1,2 8 5,8 8 7,8 2 4,2 2 1)))'), ST_GeomFromText('LINESTRING(1 2 3, 3 4 5)'))
NULL
select st_overlaps(ST_GeomFromText('LINESTRING(1 2 2, 3 4 1)'), ST_GeomFromText('GEOMETRYCOLLECTION(Point(1 2 1),LINESTRING(1 2 1, 3 4 2),POLYGON((2 2 1,2 8 5,8 8 7,8 2 4,2 2 1)))'));
st_overlaps(ST_GeomFromText('LINESTRING(1 2 2, 3 4 1)'), ST_GeomFromText('GEOMETRYCOLLECTION(Point(1 2 1),LINESTRING(1 2 1, 3 4 2),POLYGON((2 2 1,2 8 5,8 8 7,8 2 4,2 2 1)))'))
NULL
select st_overlaps(ST_GeomFromText('LINESTRING(1 2 2, 3 4 1)'), ST_GeomFromText('LINESTRING(1 2 2, 3 4 1)'));
st_overlaps(ST_GeomFromText('LINESTRING(1 2 2, 3 4 1)'), ST_GeomFromText('LINESTRING(1 2 2, 3 4 1)'))
0
select st_overlaps(ST_GeomFromText('LINESTRING(1 2 2, 4 8 1)'), ST_GeomFromText('LINESTRING(1 2 2, 2 4 1)'));
st_overlaps(ST_GeomFromText('LINESTRING(1 2 2, 4 8 1)'), ST_GeomFromText('LINESTRING(1 2 2, 2 4 1)'))
0
select st_overlaps(ST_GeomFromText('LINESTRING(1 2 2, 4 8 1)'), ST_GeomFromText('LINESTRING(1 2 2, 3 4 1)'));
st_overlaps(ST_GeomFromText('LINESTRING(1 2 2, 4 8 1)'), ST_GeomFromText('LINESTRING(1 2 2, 3 4 1)'))
0
select st_overlaps(ST_GeomFromText('POLYGON((0 0 1, 10 0 2, 10 10 3, 0 10 2, 0 0 1))'), ST_GeomFromText('LINESTRING(1 2 2, 4 8 1)'));
st_overlaps(ST_GeomFromText('POLYGON((0 0 1, 10 0 2, 10 10 3, 0 10 2, 0 0 1))'), ST_GeomFromText('LINESTRING(1 2 2, 4 8 1)'))
NULL
select st_overlaps(ST_GeomFromText('POLYGON((0 0 1, 10 0 2, 10 10 3, 0 10 2, 0 0 1))'), ST_GeomFromText('LINESTRING(1 2 1, 6 12 2)'));
st_overlaps(ST_GeomFromText('POLYGON((0 0 1, 10 0 2, 10 10 3, 0 10 2, 0 0 1))'), ST_GeomFromText('LINESTRING(1 2 1, 6 12 2)'))
NULL
select st_overlaps(ST_GeomFromText('MULTIPOINT(1 2 2, 3 4 1)'), ST_GeomFromText('MULTIPOINT(1 2 2, 3 4 1)'));
st_overlaps(ST_GeomFromText('MULTIPOINT(1 2 2, 3 4 1)'), ST_GeomFromText('MULTIPOINT(1 2 2, 3 4 1)'))
0
SELECT _ST_ASEWKT(x'0000000001E9030000000000000000F03F00000000000000400000000000000840')RE1;
RE1
POINT Z (1 2 3)
