drop table if exists test, all_type_tt, tt2;
create table test(geo geometry);
insert into test values(st_geomfromtext('point(2 3)'));
insert into test values(st_geomfromtext('LINESTRING(130 150,220 150,220 240)'));
insert into test values(st_geomfromtext('POLYGON((40 60,160 60,160 180,40 180,40 60))'));
insert into test values(ST_GeomFromText('MULTIPOINT(80 260,140 260,180 260)'));
insert into test values(ST_GeomFromText('MULTILINESTRING((20 110,200 110),(60 180,60 110,160 110,110 110))'));
insert into test values(ST_GeomFromText('MULTIPOLYGON(((80 40,120 40,120 80,80 80,80 40)),((120 80,160 80,160 120,120 120,120 80)),((80 120,120 120,120 160,80 160,80 120)),((40 80,80 80,80 120,40 120,40 80)))'));
select hex(_ST_AsMVT(test.*)) from test;
hex(_ST_AsMVT(test.*))
1A9C010A0764656661756C7412071801220309040612101802220C098402AC0212B4010000B40112121803220E0950781AF0010000F001EF01000F120D1801220919A001880478005000121A180222160928DC010AE802000997028C011A008B01C80100630012321803222E09A001501A500000504F000F0950001A500000504F000F094F001A500000504F000F094F9F011A500000504F000F2880207802
drop table test;
SELECT 'TG1', hex(_ST_AsMVT(q)) FROM (SELECT 1 AS c1, ST_GeomFromText('POINT(25 17)')AS geom) AS q;
ERROR 42000: You have an error in your SQL syntax; check the manual that corresponds to your OceanBase version for the right syntax to use
SELECT 'TG1', hex(_ST_AsMVT(q.*)) FROM (SELECT 1 AS c1, ST_GeomFromText('POINT(25 17)')AS geom) AS q;
TG1	hex(_ST_AsMVT(q.*))
TG1	1A230A0764656661756C74120B12020000180122030932221A026331220228012880207802
SELECT 'TG2', hex(_ST_AsMVT(q.*, 'test', 4096, 'geom')) FROM (SELECT 1 AS c1, ST_GeomFromText('MULTIPOINT(25 17, 26 18)') AS geom) AS q;
TG2	hex(_ST_AsMVT(q.*, 'test', 4096, 'geom'))
TG2	1A220A0474657374120D120200001801220511322202021A026331220228012880207802
SELECT 'TG3', hex(_ST_AsMVT(q.*, 'test', 4096, 'geom')) FROM (SELECT 1 AS c1, ST_GeomFromText('LINESTRING(0 0, 1000 1000)') AS geom) AS q;
TG3	hex(_ST_AsMVT(q.*, 'test', 4096, 'geom'))
TG3	1A250A0474657374121012020000180222080900000AD00FD00F1A026331220228012880207802
SELECT 'TG4', hex(_ST_AsMVT(q.*, 'test', 4096, 'geom')) FROM (SELECT 1 AS c1, ST_GeomFromText('LINESTRING(0 0, 500 500, 1000 1000)') AS geom) AS q;
TG4	hex(_ST_AsMVT(q.*, 'test', 4096, 'geom'))
TG4	1A290A04746573741214120200001802220C09000012E807E807E807E8071A026331220228012880207802
SELECT 'TG5', hex(_ST_AsMVT(q.*, 'test', 4096, 'geom')) FROM (SELECT 1 AS c1, ST_GeomFromText('MULTILINESTRING((1 1, 501 501, 1001 1001),(2 2, 502 502, 1002 1002))') AS geom) AS q;
TG5	hex(_ST_AsMVT(q.*, 'test', 4096, 'geom'))
TG5	1A370A04746573741222120200001802221A09020212E807E807E807E80709CD0FCD0F12E807E807E807E8071A026331220228012880207802
SELECT 'TG6', hex(_ST_AsMVT(q.*, 'test', 4096, 'geom')) FROM (SELECT 1 AS c1,
ST_GeomFromText('POLYGON ((45 45, 15 40, 10 20, 35 10, 45 45), (35 35, 30 20, 20 30, 35 35))') AS geom) AS q;
TG6	hex(_ST_AsMVT(q.*, 'test', 4096, 'geom'))
TG6	1A310A0474657374121C1202000018032214095A5A1A3B09092732130F09003212091D13140F1A026331220228012880207802
SELECT 'TG7', hex(_ST_AsMVT(q.*, 'test', 4096, 'geom')) FROM (SELECT 1 AS c1,
ST_GeomFromText('MULTIPOLYGON(((20 35, 10 30, 10 10, 30 5, 45 20, 20 35), (20 25, 30 20, 20 15, 20 25)), ((20 45, 45 30, 40 40, 20 45)))') AS geom) AS q;
TG7	hex(_ST_AsMVT(q.*, 'test', 4096, 'geom'))
TG7	1A3C0A04746573741227120200001803221F092846221309002728091E1E0F09310A12140913090F09003C12321D09140F1A026331220228012880207802
SELECT 'TG8', hex(_ST_AsMVT(q.*, 'test', 4096, 'geom')) FROM (SELECT 1 AS c1,
ST_GeomFromText('POINT(25 17)') AS geom) AS q;
TG8	hex(_ST_AsMVT(q.*, 'test', 4096, 'geom'))
TG8	1A200A0474657374120B12020000180122030932221A026331220228012880207802
SELECT 'TG9', hex(_ST_AsMVT(q.*, 'test', 4096, 'geom')) FROM (SELECT 1 AS c1,
ST_GeomFromText('MULTIPOINT(25 17, -26 -18)') AS geom) AS q;
TG9	hex(_ST_AsMVT(q.*, 'test', 4096, 'geom'))
TG9	1A220A0474657374120D120200001801220511322265451A026331220228012880207802
SELECT 'TA1', hex(_ST_AsMVT(q.*, 'test', 4096, 'geom')) FROM (SELECT 1 AS c1, 'abcd' AS c2,
ST_GeomFromText('POINT(25 17)') AS geom) AS q;
TA1	hex(_ST_AsMVT(q.*, 'test', 4096, 'geom'))
TA1	1A2E0A0474657374120D120400000101180122030932221A0263311A0263322202280122060A04616263642880207802
SELECT 'TA2', hex(_ST_AsMVT(q.*, 'test', 4096, 'geom')) FROM (SELECT 1.1 AS c1,
ST_GeomFromText('POINT(25 17)') AS geom) AS q;
TA2	hex(_ST_AsMVT(q.*, 'test', 4096, 'geom'))
TA2	1A230A0474657374120B12020000180122030932221A02633122050A03312E312880207802
SELECT 'TA3', hex(_ST_AsMVT(q.*, 'test',  4096, 'geom')) FROM (SELECT NULL AS c1,
ST_GeomFromText('POINT(25 17)') AS geom) AS q;
TA3	hex(_ST_AsMVT(q.*, 'test',  4096, 'geom'))
TA3	1A180A04746573741207180122030932221A0263312880207802
SELECT 'TA4', hex(_ST_AsMVT(q.*, 'test', 4096, 'geom')) FROM (SELECT 1 AS c1,
ST_GeomFromText('POINT(25 17)') AS geom
UNION
SELECT 2 AS c1, ST_GeomFromText('POINT(25 17)') AS geom ORDER BY c1) AS q;
TA4	hex(_ST_AsMVT(q.*, 'test', 4096, 'geom'))
TA4	1A310A0474657374120B1202000018012203093222120B12020001180122030932221A02633122022801220228022880207802
SELECT 'TA5', hex(_ST_AsMVT(q.*, 'test', 4096, 'geom')) FROM (SELECT
ST_GeomFromText('POINT(25 17)') AS geom, 1 AS c1, 'abcd' AS c2) AS q;
TA5	hex(_ST_AsMVT(q.*, 'test', 4096, 'geom'))
TA5	1A2E0A0474657374120D120400000101180122030932221A0263311A0263322202280122060A04616263642880207802
SELECT 'TA6', hex(_ST_AsMVT(q.*, 'test', 4096, 'geom')) FROM (SELECT 1 AS c1, -1 AS c2,
ST_GeomFromText('POINT(25 17)') AS geom) AS q;
TA6	hex(_ST_AsMVT(q.*, 'test', 4096, 'geom'))
TA6	1A2A0A0474657374120D120400000101180122030932221A0263311A02633222022801220230012880207802
SELECT 'TA7', hex(_ST_AsMVT(q.*, 'test', 4096, 'geom')) FROM (SELECT 'test' AS c1, 1 AS c2,
ST_GeomFromText('POINT(25 17)') AS geom
UNION
SELECT 'test' AS c1, 2 AS c2, ST_GeomFromText('POINT(26 18)') AS geom
UNION
SELECT 'othertest' AS c1, 3 AS c2, ST_GeomFromText('POINT(26 18)') AS geom ORDER BY c2) AS q;
TA7	hex(_ST_AsMVT(q.*, 'test', 4096, 'geom'))
TA7	1A610A0474657374120D12040000010118012203093222120D12040000010218012203093424120D120400030104180122030934241A0263311A02633222060A04746573742202280122022802220B0A096F7468657274657374220228032880207802
SELECT 'TA8', hex(_ST_AsMVT(q.*, 'test', 4096, 'geom')) FROM (
SELECT cast(1 as signed) AS c1, 1 AS c2, ST_GeomFromText('POINT(25 17)') AS geom
UNION
SELECT cast(1 as signed) AS c1, 2 AS c2, ST_GeomFromText('POINT(26 18)') AS geom
UNION
SELECT cast(2 as signed) AS c1, 3 AS c2, ST_GeomFromText('POINT(26 18)') AS geom ORDER BY c2) AS q;
TA8	hex(_ST_AsMVT(q.*, 'test', 4096, 'geom'))
TA8	1A4C0A0474657374120D12040000010018012203093222120D12040000010118012203093424120D120400010102180122030934241A0263311A0263322202280122022802220228032880207802
SELECT 'TA9', hex(_ST_AsMVT(q.*))
FROM (
SELECT 1 AS c1, -1 AS c2,
ST_GeomFromText('POINT(25 17)') AS geom
) AS q;
TA9	hex(_ST_AsMVT(q.*))
TA9	1A2D0A0764656661756C74120D120400000101180122030932221A0263311A02633222022801220230012880207802
SELECT 'TA9', length(_ST_AsMVT(q.*))
FROM (
SELECT 1 AS c1, -1 AS c2,
ST_GeomFromText('POINT(25 17)') AS geom
) AS q;
TA9	length(_ST_AsMVT(q.*))
TA9	47
SELECT 'TA10', hex(_ST_AsMVT(q.*, 'test', 4096, 'geom')) FROM (
SELECT 'AbcDfg' AS cstring,
'Lorem ipsum dolor sit amet, consectetur adipiscing elit. Phasellus sed nulla augue. Pellentesque ut vulputate ex. Nunc et odio placerat, lacinia lectus sed, fermentum sapien. Sed massa velit, ullamcorper et est quis, congue rhoncus orci. Suspendisse in ante varius, convallis enim ut, fermentum amet.' as ctext,
ST_GeomFromText('POINT(25 17)') AS geom
) AS q;
TA10	hex(_ST_AsMVT(q.*, 'test', 4096, 'geom'))
TA10	1AE6020A0474657374120D120400000101180122030932221A0763737472696E671A05637465787422080A0641626344666722AF020AAC024C6F72656D20697073756D20646F6C6F722073697420616D65742C20636F6E73656374657475722061646970697363696E6720656C69742E2050686173656C6C757320736564206E756C6C612061756775652E2050656C6C656E7465737175652075742076756C7075746174652065782E204E756E63206574206F64696F20706C6163657261742C206C6163696E6961206C6563747573207365642C206665726D656E74756D2073617069656E2E20536564206D617373612076656C69742C20756C6C616D636F727065722065742065737420717569732C20636F6E6775652072686F6E637573206F7263692E2053757370656E646973736520696E20616E7465207661726975732C20636F6E76616C6C697320656E696D2075742C206665726D656E74756D20616D65742E2880207802
SELECT 'TA11', hex(_ST_AsMVT(q.*, 'test', 4096, 'geom')) FROM (
SELECT 1 AS c1, cast(NULL as double) AS c2, ST_GeomFromText('POINT(25 17)') AS geom
UNION
SELECT NULL AS c1, 2.0 AS c2, ST_GeomFromText('POINT(26 18)') AS geom order by c1
) AS q;
TA11	hex(_ST_AsMVT(q.*, 'test', 4096, 'geom'))
TA11	1A3C0A0474657374120B1202010018012203093424120B12020001180122030932221A0263311A0263322209190000000000000040220228012880207802
SELECT 'TA12', hex(_ST_AsMVT(q.*, 'test', 4096, 'geom')) FROM (
SELECT 1 AS c1, cast(NULL as double) AS c2, ST_GeomFromText('POINT(25 17)') AS geom
UNION
SELECT 5 AS c1, 2.0 AS c2, null AS geom
) AS q;
TA12	hex(_ST_AsMVT(q.*, 'test', 4096, 'geom'))
TA12	1A240A0474657374120B12020000180122030932221A0263311A026332220228012880207802
SELECT 'TA13', hex(_ST_AsMVT(q.*, 'test', 4096, 'geom')) FROM
(
SELECT ST_GeomFromText('POINT(25 17)') as geom,
st_geomfromtext('LINESTRING(130 150,220 150,220 240)') as other_geom 
) AS q;
TA13	hex(_ST_AsMVT(q.*, 'test', 4096, 'geom'))
TA13	1AA2010A0474657374120B12020000180122030932221A0A6F746865725F67656F6D227C0A7A30303030303030303031303230303030303030333030303030303030303030303030303034303630343030303030303030303030433036323430303030303030303030303830364234303030303030303030303043303632343030303030303030303030383036423430303030303030303030303030364534302880207802
SELECT 'TA13', hex(_ST_AsMVT(q.*, 'test', 4096, 'other_geom')) FROM
(
SELECT ST_GeomFromText('POINT(25 17)') as geom,
st_geomfromtext('LINESTRING(130 150,220 150,220 240)') as other_geom 
) AS q;
TA13	hex(_ST_AsMVT(q.*, 'test', 4096, 'other_geom'))
TA13	1A5D0A04746573741214120200001802220C098402AC0212B4010000B4011A0467656F6D22340A3230303030303030303031303130303030303030303030303030303030303033393430303030303030303030303030333134302880207802
SELECT 'D1', hex(_ST_AsMVT(q.*, 'test', 4096, 'geom')) FROM (SELECT 1 AS c1, 'abcd' AS c2,
ST_GeomFromText('POINT(25 17)') AS geom) AS q;
D1	hex(_ST_AsMVT(q.*, 'test', 4096, 'geom'))
D1	1A2E0A0474657374120D120400000101180122030932221A0263311A0263322202280122060A04616263642880207802
SELECT 'D2', hex(_ST_AsMVT(q.*, 'test', 4096)) FROM (SELECT 1 AS c1, 'abcd' AS c2,
ST_GeomFromText('POINT(25 17)') AS geom) AS q;
D2	hex(_ST_AsMVT(q.*, 'test', 4096))
D2	1A2E0A0474657374120D120400000101180122030932221A0263311A0263322202280122060A04616263642880207802
SELECT 'D3', hex(_ST_AsMVT(q.*, 'test')) FROM (SELECT 1 AS c1, 'abcd' AS c2,
ST_GeomFromText('POINT(25 17)') AS geom) AS q;
D3	hex(_ST_AsMVT(q.*, 'test'))
D3	1A2E0A0474657374120D120400000101180122030932221A0263311A0263322202280122060A04616263642880207802
SELECT 'D4', hex(_ST_AsMVT(q.*)) FROM (SELECT 1 AS c1, 'abcd' AS c2,
ST_GeomFromText('POINT(25 17)') AS geom) AS q;
D4	hex(_ST_AsMVT(q.*))
D4	1A310A0764656661756C74120D120400000101180122030932221A0263311A0263322202280122060A04616263642880207802
SELECT 'J1', hex(_ST_AsMVT(q.*, 'test', 4096, 'geom')) FROM (SELECT '{"c1":1,"c2":"abcd", "c3":true, "c4":3.14}' as json,
ST_GeomFromText('POINT(25 17)') AS geom) AS q;
J1	hex(_ST_AsMVT(q.*, 'test', 4096, 'geom'))
J1	1A4C0A0474657374120B12020000180122030932221A046A736F6E222C0A2A7B226331223A312C226332223A2261626364222C20226333223A747275652C20226334223A332E31347D2880207802
SELECT 'J2', hex(_ST_AsMVT(q.*, 'test', 4096, 'geom')) FROM (SELECT cast('{"c1":1,"c2":"abcd", "c3":true, "c4":3.14}' as json) as jsonb,
ST_GeomFromText('POINT(25 17)') AS geom) AS q;
J2	hex(_ST_AsMVT(q.*, 'test', 4096, 'geom'))
J2	1A490A0474657374121112080000010102020303180122030932221A0263311A0263321A0263331A0263342202280122060A0461626364220238012209191F85EB51B81E09402880207802
SELECT 'J3', hex(_ST_AsMVT(q.*, 'test', 4096, 'geom')) FROM (
SELECT cast('{"c1":"abcd", "c2":"abcd"}' as json) as jsonb,
ST_GeomFromText('POINT(25 17)') AS geom
UNION ALL
SELECT cast('{"c3":"abasdadcd", "c1":5}' as json) as jsonb,
ST_GeomFromText('POINT(25 17)') AS geom
) AS q;
J3	hex(_ST_AsMVT(q.*, 'test', 4096, 'geom'))
J3	1A4E0A0474657374120D12040000010018012203093222120D120400010202180122030932221A0263311A0263321A02633322060A046162636422022805220B0A096162617364616463642880207802
SELECT 'J4', hex(_ST_AsMVT(q.*, 'test', 4096, 'geom')) FROM (
SELECT cast(1.25 as double) AS c1,
ST_GeomFromText('POINT (0 0)') AS geom,
cast('{"test":1.75}' as json) as properties
) AS q;
J4	hex(_ST_AsMVT(q.*, 'test', 4096, 'geom'))
J4	1A3A0A0474657374120D120400000101180122030900001A0263311A0474657374220919000000000000F43F220919000000000000FC3F2880207802
SELECT 'J5', hex(_ST_AsMVT(q.*, 'test', 4096, 'geom')) FROM (
SELECT cast(1.75 as double) AS c1,
ST_GeomFromText('POINT (0 0)') AS geom,
cast('{"test":1.75}' as json) as properties
) AS q;
J5	hex(_ST_AsMVT(q.*, 'test', 4096, 'geom'))
J5	1A2F0A0474657374120D120400000100180122030900001A0263311A0474657374220919000000000000FC3F2880207802
SELECT 'J6', hex(_ST_AsMVT(q.*, 'test', 4096, 'geom')) FROM (SELECT cast('{"c1":1,"c2":"abcd", "c3":true, "c4":3.14, "c5": "2000-06-24 20:27:45.013867"}' as json) as jsonb,
ST_GeomFromText('POINT(25 17)') AS geom) AS q;
J6	hex(_ST_AsMVT(q.*, 'test', 4096, 'geom'))
J6	1A6D0A04746573741213120A00000101020203030404180122030932221A0263311A0263321A0263331A0263341A0263352202280122060A0461626364220238012209191F85EB51B81E0940221C0A1A323030302D30362D32342032303A32373A34352E3031333836372880207802
SELECT 'J7', hex(_ST_AsMVT(q.*, 'test', 4096, 'geom')) FROM (SELECT cast('{"c1":1,"c2":"abcd", "c3":true, "c4":3.14, "c5": {"d1": 2}}' as json) as jsonb,
ST_GeomFromText('POINT(25 17)') AS geom) AS q;
J7	hex(_ST_AsMVT(q.*, 'test', 4096, 'geom'))
J7	1A4D0A0474657374121112080000010102020303180122030932221A0263311A0263321A0263331A0263341A0263352202280122060A0461626364220238012209191F85EB51B81E09402880207802
SELECT 'J8', hex(_ST_AsMVT(q.*, 'test', 4096, 'geom')) FROM (SELECT cast('[1,2,3]' as json) as jsonb,
ST_GeomFromText('POINT(25 17)') AS geom) AS q;
J8	hex(_ST_AsMVT(q.*, 'test', 4096, 'geom'))
J8	1A140A04746573741207180122030932222880207802
create table all_type_tt(c1 smallint, c2 int, c3 bigint, c4 bool, c5 float, c6 decimal(10, 5),
c7 date, c8 time, c9 timestamp, c10 char, c11 varchar(10), c12 text, c13 json, c14 geometry);
insert into all_type_tt values(8, 16, 4294967298, true, 3.14, 3.14158268877888, '2017-08-21', '11:00:00', '2015-06-25 15:18:00',
'm', 'mvt_test', 'it is text', '{"key1": "value1", "key2": "value2"}', st_geomfromtext('point(2 3)'));
Warnings:
Warning	1265	Data truncated for column 'c6' at row 1
insert into all_type_tt values(9, 26, 4294967298, false, 3.14, 5.444444, '2022-08-21', '20:00:00', '2023-06-25 15:18:00',
'g', 'mvt_test', 'it is text2', '{"key3": "value3", "key4": "value4"}', st_geomfromtext('LINESTRING(0 0, 500 500, 1000 1000)'));
Warnings:
Warning	1265	Data truncated for column 'c6' at row 1
select hex(_ST_AsMVT(all_type_tt.*)) from all_type_tt;
hex(_ST_AsMVT(all_type_tt.*))
1AAA030A0764656661756C741225121C00000101020203030404050506060707080809090A0A0B0B0C0C0D0D18012203090406122E121C000E010F020203100404051106120713081409150A0A0B160E170F181802220C09000012E807E807E807E8071A0263311A0263321A0263331A0263341A0263351A0263361A0263371A0263381A0263391A036331301A036331311A036331321A046B6579311A046B6579321A046B6579331A046B6579342202280822022810220628828080801022023801220515C3F5484022090A07332E3134313538220C0A0A323031372D30382D3231220A0A0831313A30303A303022150A13323031352D30362D32352030373A31383A303022030A016D220A0A086D76745F74657374220C0A0A6974206973207465787422080A0676616C75653122080A0676616C756532220228092202281A2202380022090A07352E3434343434220C0A0A323032322D30382D3231220A0A0832303A30303A303022150A13323032332D30362D32352030373A31383A303022030A0167220D0A0B697420697320746578743222080A0676616C75653322080A0676616C7565342880207802
drop table all_type_tt;
drop view if exists vtt2, vtt3;
drop table if exists tt3;
create table tt2(id int, g GEOMETRY ,a varchar(100));
insert into tt2 values(1,ST_GeomFromText('POINT(15 20)'),'test1');
create table tt3 as select _ST_AsMVT(tt2.*) a from tt2;
select hex(a) from tt3;
hex(a)
1A310A0764656661756C74120D12040000010118012203091E281A0269641A01612202280122070A0574657374312880207802
desc tt3;
Field	Type	Null	Key	Default	Extra
a	longblob	YES		NULL	
create view vtt3 as select _ST_AsMVT(tt2.*) a from tt2;
select hex(a) from vtt3;
hex(a)
1A310A0764656661756C74120D12040000010118012203091E281A0269641A01612202280122070A0574657374312880207802
desc vtt3;
Field	Type	Null	Key	Default	Extra
a	longblob	YES		NULL	
drop table tt3;
drop view vtt3;
drop table tt2;
create table tt2(id int, g GEOMETRY , g1 GEOMETRY, a varchar(100));
insert into tt2 values(1,ST_GeomFromText('POINT(15 20)'),ST_GeomFromText('POINT(30 100)'),'test1');
select hex(_ST_AsMVT(tt2.*,'uyuyuyuyuiuyyuyuyutest',4096,'g1')) from tt2;
hex(_ST_AsMVT(tt2.*,'uyuyuyuyuiuyyuyuyutest',4096,'g1'))
1A7C0A16757975797579757975697579797579757975746573741210120600000101020218012204093CC8011A0269641A01671A01612202280122340A32303030303030303030313031303030303030303030303030303030303030324534303030303030303030303030303334343022070A0574657374312880207802
select _ST_AsMVT(tt2.*,'uyuyuyuyuiuyyuyuyutest',4096,'g','a') from tt2;
ERROR HY000: identity column must be a numeric type
drop table tt2;
create table tt2(g GEOMETRY,b BIGINT);
insert into tt2 values(ST_GeomFromText('POINT(-15 -20)'),0);
select hex(_ST_AsMVT(tt2.*,'test',4096,'g','b')) from tt2;
hex(_ST_AsMVT(tt2.*,'test',4096,'g','b'))
1A160A04746573741209080018012203091D272880207802
select _ST_AsMVT(tt2.*,'uyuyuyuyuiuyyuyuyutest',4096,'g','d') from tt2;
ERROR HY000: identity column must be a numeric type
drop table tt2;
create table tt2(id int, g GEOMETRY , g1 GEOMETRY, a varchar(100));
insert into tt2 values(-1,ST_GeomFromText('POINT(15 20)'),ST_GeomFromText('POINT(30 100)'),'test1');
select hex(_ST_AsMVT(tt2.*,'test',4096,'g','id')) from tt2;
hex(_ST_AsMVT(tt2.*,'test',4096,'g','id'))
1A600A0474657374120D12040000010118012203091E281A0267311A016122340A32303030303030303030313031303030303030303030303030303030303030334534303030303030303030303030303539343022070A0574657374312880207802
truncate table tt2;
insert into tt2 values(1,ST_GeomFromText('POINT(15 20)'),ST_GeomFromText('POINT(30 100)'),'test1');
select hex(_ST_AsMVT(tt2.*,'test',4096,'g','id')) from tt2;
hex(_ST_AsMVT(tt2.*,'test',4096,'g','id'))
1A620A0474657374120F080112040000010118012203091E281A0267311A016122340A32303030303030303030313031303030303030303030303030303030303030334534303030303030303030303030303539343022070A0574657374312880207802
truncate table tt2;
insert into tt2(g,g1,a) values(ST_GeomFromText('POINT(15 20)'),ST_GeomFromText('POINT(30 100)'),'test1');
select hex(_ST_AsMVT(tt2.*,'test',4096,'g','id')) from tt2;
hex(_ST_AsMVT(tt2.*,'test',4096,'g','id'))
1A600A0474657374120D12040000010118012203091E281A0267311A016122340A32303030303030303030313031303030303030303030303030303030303030334534303030303030303030303030303539343022070A0574657374312880207802
drop table tt2;
create table tt2(id int, g GEOMETRY, d geometry);
insert into tt2 values(8,ST_GeomFromText('POINT(15 20 15)'), ST_GeomFromText('LINESTRING(0 0 0, 10 10 11, 20 25 -20, 50 60 -60)'));
select hex(_ST_AsMVT(tt2.*, 'test', 4096, 'g')) from tt2;
hex(_ST_AsMVT(tt2.*, 'test', 4096, 'g'))
1A85020A0474657374120D12040000010118012203091E281A0269641A01642202280822DD010ADA0130303030303030303031454130333030303030343030303030303030303030303030303030303030303030303030303030303030303030303030303030303030303030303030303030303030303030303030303030303234343030303030303030303030303032343430303030303030303030303030323634303030303030303030303030303334343030303030303030303030303033393430303030303030303030303030333443303030303030303030303030303439343030303030303030303030303034453430303030303030303030303030344543302880207802
select hex(_ST_AsMVT(tt2.*, 'test', 4096, 'd')) from tt2;
hex(_ST_AsMVT(tt2.*, 'test', 4096, 'd'))
1A720A047465737412141204000001011802220A0900001A1414141E3C461A0269641A01672202280822440A423030303030303030303145393033303030303030303030303030303030303245343030303030303030303030303033343430303030303030303030303030324534302880207802
drop table tt2;
create table tt2(id int, g GEOMETRY , g1 GEOMETRY, a varchar(100));
insert into tt2 values(1,ST_GeomFromText('POINT(15 20)'),ST_GeomFromText('POINT(30 100)'),'test1');
select hex(_ST_AsMVT(tt2.*,'uyuyuyuyuiuyyuyuyutest',1)) from tt2;
hex(_ST_AsMVT(tt2.*,'uyuyuyuyuiuyyuyuyutest',1))
1A7B0A1675797579757975797569757979757975797574657374120F120600000101020218012203091E281A0269641A0267311A01612202280122340A32303030303030303030313031303030303030303030303030303030303030334534303030303030303030303030303539343022070A05746573743128017802
drop table tt2;
create table tt2(id int, g GEOMETRY ,a varchar(100));
insert into tt2 values(1,ST_GeomFromText('POINT(15 20)'),'test1');
create view vtt2 as select * from tt2;
select hex(_ST_AsMVT(tt2.*,a)) from tt2;
hex(_ST_AsMVT(tt2.*,a))
1A2F0A057465737431120D12040000010118012203091E281A0269641A01612202280122070A0574657374312880207802
select hex(_ST_AsMVT(tt2.*,null)) from tt2;
hex(_ST_AsMVT(tt2.*,null))
1A310A0764656661756C74120D12040000010118012203091E281A0269641A01612202280122070A0574657374312880207802
select hex(_ST_AsMVT(tt2.*,a,id)) from tt2;
hex(_ST_AsMVT(tt2.*,a,id))
1A2E0A057465737431120D12040000010118012203091E281A0269641A01612202280122070A05746573743128017802
select hex(_ST_AsMVT(tt2.*,a,id,'g')) from tt2;
hex(_ST_AsMVT(tt2.*,a,id,'g'))
1A2E0A057465737431120D12040000010118012203091E281A0269641A01612202280122070A05746573743128017802
select hex(_ST_AsMVT(tt2.*,a,id,'g','id')) from tt2;
hex(_ST_AsMVT(tt2.*,a,id,'g','id'))
1A260A057465737431120D08011202000018012203091E281A016122070A05746573743128017802
select hex(_ST_AsMVT(tt2.*,tt2.a)) from tt2;
hex(_ST_AsMVT(tt2.*,tt2.a))
1A2F0A057465737431120D12040000010118012203091E281A0269641A01612202280122070A0574657374312880207802
select hex(_ST_AsMVT(t.*,t.a)) from tt2 t;
hex(_ST_AsMVT(t.*,t.a))
1A2F0A057465737431120D12040000010118012203091E281A0269641A01612202280122070A0574657374312880207802
select hex(_ST_AsMVT(tt2.*,'test',tt2.id)) from tt2;
hex(_ST_AsMVT(tt2.*,'test',tt2.id))
1A2D0A0474657374120D12040000010118012203091E281A0269641A01612202280122070A05746573743128017802
select hex(_ST_AsMVT(vtt2.*,vtt2.a)) from vtt2;
hex(_ST_AsMVT(vtt2.*,vtt2.a))
1A2F0A057465737431120D12040000010118012203091E281A0269641A01612202280122070A0574657374312880207802
select hex(_ST_AsMVT(t.*,t.a)) from vtt2 t;
hex(_ST_AsMVT(t.*,t.a))
1A2F0A057465737431120D12040000010118012203091E281A0269641A01612202280122070A0574657374312880207802
select _ST_AsMVT(tt2.*,'uyuyuyuyuiuyyuyuyutest',4096,'g','g') from tt2;
ERROR HY000: identity column must be a numeric type
drop table tt2;
create table tt2(g GEOMETRY,b ENUM('1','2'), c SET('1','2'));
insert into tt2 values(ST_GeomFromText('LINESTRING(0 0, 10 10, 20 25, 50 60)'),1, 2);
select hex(_ST_AsMVT(tt2.*)) from tt2;
hex(_ST_AsMVT(tt2.*))
1A1E0A0764656661756C74120E1802220A0900001A1414141E3C462880207802
drop table tt2;
drop view if exists vtt3;
drop table if exists tt3;
create table tt2(id int, g GEOMETRY ,a varchar(100));
insert into tt2 values(1,ST_GeomFromText('POINT(15 20)'),'test1');
select _ST_AsMVT(tt2.*,'uyuyuyuyuiuyyuyuyutest',4096,'id') from tt2;
ERROR HY000: Calling geometry function with unsupported types of arguments.
select _ST_AsMVT(tt2.*,'uyuyuyuyuiuyyuyuyutest',4096,'') from tt2;
ERROR 42S22: Unknown column
select _ST_AsMVT(tt2.*,'uyuyuyuyuiuyyuyuyutest',4096,'b') from tt2;
ERROR HY000: Calling geometry function with unsupported types of arguments.
create table tt3 as select _ST_AsMVT(tt2.*) a from tt2;
insert into tt3 values((select _ST_AsMVT(tt2.*) from tt2));
replace into tt3 values((select _ST_AsMVT(tt2.*) from tt2));
update tt3 set a =(select _ST_AsMVT(tt2.*) from tt2);
select hex(a) from tt3;
hex(a)
1A310A0764656661756C74120D12040000010118012203091E281A0269641A01612202280122070A0574657374312880207802
1A310A0764656661756C74120D12040000010118012203091E281A0269641A01612202280122070A0574657374312880207802
1A310A0764656661756C74120D12040000010118012203091E281A0269641A01612202280122070A0574657374312880207802
create view vtt3 as select _ST_AsMVT(tt2.*) a from tt2;
select hex(a) from vtt3;
hex(a)
1A310A0764656661756C74120D12040000010118012203091E281A0269641A01612202280122070A0574657374312880207802
update vtt3 set a =(select _ST_AsMVT(tt2.*) from tt2);
ERROR HY000: The target table vtt3 of the UPDATE is not updatable
truncate table tt2;
insert into tt2 values(7,ST_GeomFromText('GEOMETRYCOLLECTION(POINT(11 10), POINT(30 -30), LINESTRING(-15 15, -20 20))'), 'test');
select _ST_AsMVT(tt2.*) from tt2;
ERROR 22S01: GEOMETRYCOLLECTION value is a geometry of unexpected type GEOMETRYCOLLECTION in _st_asmvt.
drop table tt2;
drop table tt3;
drop view vtt3;
create table tt2(g GEOMETRY);
insert into tt2 values(ST_GeomFromText('POINT(15 20)'));
select hex(_ST_AsMVT(tt2.*,'test',2147483647)) from tt2;
hex(_ST_AsMVT(tt2.*,'test',2147483647))
1A170A0474657374120718012203091E2828FFFFFFFF077802
select hex(_ST_AsMVT(tt2.*,'test',2147483648)) from tt2;
ERROR HY000: invalid input value
select hex(_ST_AsMVT(tt2.*,'test',-2147483648)) from tt2;
hex(_ST_AsMVT(tt2.*,'test',-2147483648))
1A170A0474657374120718012203091E282880808080087802
select hex(_ST_AsMVT(tt2.*,'test',-2147483649)) from tt2;
ERROR HY000: invalid input value
drop table tt2;
create table tt2(id int, g GEOMETRY , g1 GEOMETRY, a varchar(100));
insert into tt2 values(1,ST_GeomFromText('POINT(15 20)'),ST_GeomFromText('POINT(30 100)'),'test1');
select _ST_AsMVT(tt2.*,'uyuyuyuyuiuyyuyuyutest',4096,'id') from tt2;
ERROR HY000: Calling geometry function with unsupported types of arguments.
select _ST_AsMVT(tt2.*,'uyuyuyuyuiuyyuyuyutest',4096,'a') from tt2;
ERROR HY000: Calling geometry function with unsupported types of arguments.
select _ST_AsMVT(tt2.*,'uyuyuyuyuiuyyuyuyutest',4096,'') from tt2;
ERROR 42S22: Unknown column
select _ST_AsMVT(tt2.*,'uyuyuyuyuiuyyuyuyutest',4096,'b') from tt2;
ERROR HY000: Calling geometry function with unsupported types of arguments.
select _ST_AsMVT(tt2.*,'test',4096,'g','') from tt2;
ERROR 42000: Incorrect column name
drop table tt2;
create table tt2(id int, g GEOMETRY ,a text);
insert into tt2 values(1,ST_GeomFromText('POINT(15 20)'),'test');
select hex(_ST_AsMVT(tt2.*,a)) from tt2;
hex(_ST_AsMVT(tt2.*,a))
1A2D0A0474657374120D12040000010118012203091E281A0269641A01612202280122060A04746573742880207802
select hex(_ST_AsMVT(tt2.*,g)) from tt2;
hex(_ST_AsMVT(tt2.*,g))
1A5B0A323030303030303030303130313030303030303030303030303030303030303245343030303030303030303030303033343430120D12040000010118012203091E281A0269641A01612202280122060A04746573742880207802
select hex(_ST_AsMVT(tt2.*,'uyuyuyuyuiuyyuyuyutest','4545')) from tt2;
hex(_ST_AsMVT(tt2.*,'uyuyuyuyuiuyyuyuyutest','4545'))
1A3F0A1675797579757975797569757979757975797574657374120D12040000010118012203091E281A0269641A01612202280122060A047465737428C1237802
drop table tt2;
drop view if exists vtest1;
drop table if exists test1;
create table test1(id int,g GEOMETRY,g1 longblob);
insert into test1 values(1,ST_GeomFromText('LINESTRING(0 0, 10 10, 20 25, 50 60)'),'test');
create view vtest1 as select * from test1;
insert into test1(id,g1) values(2,(select _ST_AsMVT(test1.*) from test1));
insert into vtest1(id,g1) values(2,(select _ST_AsMVT(vtest1.*) from vtest1));
replace into test1(id,g1) values(2,(select _ST_AsMVT(test1.*) from test1));
replace into vtest1(id,g1) values(2,(select _ST_AsMVT(vtest1.*) from vtest1));
update test1 set g1=(select _ST_AsMVT(test1.*, 'test') from test1);
update vtest1 set g1=(select _ST_AsMVT(vtest1.*,'1') from vtest1);
drop table test1;
drop view vtest1;
