result_format: 4
drop table if exists xxx_fence;
CREATE TABLE xxx_fence (
    id BIGINT NOT NULL AUTO_INCREMENT,
    fence POLYGON NOT NULL,
    geojson TEXT GENERATED ALWAYS AS (ST_AsGeoJSON(fence)) VIRTUAL,
    PRIMARY KEY (id)
);

INSERT INTO xxx_fence (fence)
VALUES 
(ST_GeomFromText('POLYGON((0 0, 1 0, 1 1, 0 1, 0 0))'));

INSERT INTO xxx_fence (fence)
VALUES 
(ST_GeomFromText('POLYGON((1 1, 2 1, 2 2, 1 2, 1 1))'));

SELECT id, ST_AsText(fence) AS wkt, geojson FROM xxx_fence;
+----+--------------------------------+----------------------------------------------------------------------------------------------------+
| id | wkt                            | geojson                                                                                            |
+----+--------------------------------+----------------------------------------------------------------------------------------------------+
|  1 | POLYGON((0 0,1 0,1 1,0 1,0 0)) | {"type": "Polygon", "coordinates": [[[0.0, 0.0], [1.0, 0.0], [1.0, 1.0], [0.0, 1.0], [0.0, 0.0]]]} |
|  2 | POLYGON((1 1,2 1,2 2,1 2,1 1)) | {"type": "Polygon", "coordinates": [[[1.0, 1.0], [2.0, 1.0], [2.0, 2.0], [1.0, 2.0], [1.0, 1.0]]]} |
+----+--------------------------------+----------------------------------------------------------------------------------------------------+

UPDATE xxx_fence
SET fence = ST_GeomFromText('POLYGON((2 2, 3 2, 3 3, 2 3, 2 2))')
WHERE id = 1;

SELECT id, ST_AsText(fence) AS wkt, geojson FROM xxx_fence WHERE id = 1;
+----+--------------------------------+----------------------------------------------------------------------------------------------------+
| id | wkt                            | geojson                                                                                            |
+----+--------------------------------+----------------------------------------------------------------------------------------------------+
|  1 | POLYGON((2 2,3 2,3 3,2 3,2 2)) | {"type": "Polygon", "coordinates": [[[2.0, 2.0], [3.0, 2.0], [3.0, 3.0], [2.0, 3.0], [2.0, 2.0]]]} |
+----+--------------------------------+----------------------------------------------------------------------------------------------------+

drop table xxx_fence;
