SET sql_mode='';

DROP TABLE IF EXISTS Z0CASE;
分区表
CREATE TABLE Z0CASE (Z0_TEST0 TINYINT,Z0_TEST1 TINYINT)
PARTITION BY RANGE (Z0_TEST0)
( PARTITION part_1 VALUES LESS THAN (20 ),
PARTITION part_2 VALUES LESS THAN (100 ),
PARTITION part_3 VALUES LESS THAN ( MAXVALUE ));
INSERT INTO  Z0CASE (Z0_TEST0,Z0_TEST1)VALUES('1','111');
INSERT INTO  Z0CASE (Z0_TEST0,Z0_TEST1)VALUES('2','2');
INSERT INTO  Z0CASE (Z0_TEST0,Z0_TEST1)VALUES('30','30');
INSERT INTO  Z0CASE (Z0_TEST0,Z0_TEST1)VALUES('111','121');
SELECT * FROM Z0CASE ORDER BY Z0_TEST1;
Z0_TEST0	Z0_TEST1
2	2
30	30
1	111
111	121
SELECT table_id,table_name FROM oceanbase.__all_virtual_table WHERE table_name='Z0CASE';
ALTER TABLE Z0CASE MODIFY COLUMN Z0_TEST0 TINYINT;
SELECT * FROM Z0CASE ORDER BY Z0_TEST1;
Z0_TEST0	Z0_TEST1
2	2
30	30
1	111
111	121
DESC Z0CASE;
Field	Type	Null	Key	Default	Extra
Z0_TEST0	tinyint(4)	YES		NULL	
Z0_TEST1	tinyint(4)	YES		NULL	
ALTER TABLE Z0CASE MODIFY COLUMN Z0_TEST0 INT;
SELECT * FROM Z0CASE ORDER BY Z0_TEST1;
Z0_TEST0	Z0_TEST1
2	2
30	30
1	111
111	121
DESC Z0CASE;
Field	Type	Null	Key	Default	Extra
Z0_TEST0	int(11)	YES		NULL	
Z0_TEST1	tinyint(4)	YES		NULL	
SELECT table_id,table_name FROM oceanbase.__all_virtual_table WHERE table_name='Z0CASE';
ALTER TABLE Z0CASE MODIFY COLUMN Z0_TEST0 mediumINT;
SELECT * FROM Z0CASE ORDER BY Z0_TEST1;
Z0_TEST0	Z0_TEST1
2	2
30	30
1	111
111	121
DESC Z0CASE;
Field	Type	Null	Key	Default	Extra
Z0_TEST0	mediumint(9)	YES		NULL	
Z0_TEST1	tinyint(4)	YES		NULL	
SELECT table_id,table_name FROM oceanbase.__all_virtual_table WHERE table_name='Z0CASE';
DROP TABLE Z0CASE;
CREATE TABLE Z0CASE (Z0_TEST0 BIGINT,Z0_TEST1 BIGINT)
PARTITION BY RANGE (Z0_TEST0)
( PARTITION part_1 VALUES LESS THAN (20 ),
PARTITION part_2 VALUES LESS THAN (100 ),
PARTITION part_3 VALUES LESS THAN ( MAXVALUE ));
INSERT INTO  Z0CASE (Z0_TEST0,Z0_TEST1)VALUES('1','111');
INSERT INTO  Z0CASE (Z0_TEST0,Z0_TEST1)VALUES('2','2');
INSERT INTO  Z0CASE (Z0_TEST0,Z0_TEST1)VALUES('30','30');
INSERT INTO  Z0CASE (Z0_TEST0,Z0_TEST1)VALUES('111','121');
SELECT * FROM Z0CASE ORDER BY Z0_TEST1;
Z0_TEST0	Z0_TEST1
2	2
30	30
1	111
111	121
SELECT table_id,table_name FROM oceanbase.__all_virtual_table WHERE table_name='Z0CASE';
ALTER TABLE Z0CASE MODIFY COLUMN Z0_TEST0 TINYINT;
SELECT * FROM Z0CASE ORDER BY Z0_TEST1;
Z0_TEST0	Z0_TEST1
2	2
30	30
1	111
111	121
DESC Z0CASE;
Field	Type	Null	Key	Default	Extra
Z0_TEST0	tinyint(4)	YES		NULL	
Z0_TEST1	bigint(20)	YES		NULL	
SELECT table_id,table_name FROM oceanbase.__all_virtual_table WHERE table_name='Z0CASE';
DROP TABLE Z0CASE;
CREATE TABLE Z0CASE (Z0_TEST0 BIGINT,Z0_TEST1 BIGINT)
PARTITION BY RANGE (Z0_TEST0)
( PARTITION part_1 VALUES LESS THAN (20 ),
PARTITION part_2 VALUES LESS THAN (100 ),
PARTITION part_3 VALUES LESS THAN ( MAXVALUE ));
INSERT INTO  Z0CASE (Z0_TEST0,Z0_TEST1)VALUES('1','111');
INSERT INTO  Z0CASE (Z0_TEST0,Z0_TEST1)VALUES('2','2');
INSERT INTO  Z0CASE (Z0_TEST0,Z0_TEST1)VALUES('30','30');
INSERT INTO  Z0CASE (Z0_TEST0,Z0_TEST1)VALUES('111','121');
SELECT * FROM Z0CASE ORDER BY Z0_TEST1;
Z0_TEST0	Z0_TEST1
2	2
30	30
1	111
111	121
SELECT table_id,table_name FROM oceanbase.__all_virtual_table WHERE table_name='Z0CASE';
ALTER TABLE Z0CASE MODIFY COLUMN Z0_TEST0 INT;
SELECT * FROM Z0CASE ORDER BY Z0_TEST1;
Z0_TEST0	Z0_TEST1
2	2
30	30
1	111
111	121
DESC Z0CASE;
Field	Type	Null	Key	Default	Extra
Z0_TEST0	int(11)	YES		NULL	
Z0_TEST1	bigint(20)	YES		NULL	
SELECT table_id,table_name FROM oceanbase.__all_virtual_table WHERE table_name='Z0CASE';
DROP TABLE Z0CASE;
CREATE TABLE Z0CASE (Z0_TEST0 BIGINT,Z0_TEST1 BIGINT)
PARTITION BY RANGE (Z0_TEST0)
( PARTITION part_1 VALUES LESS THAN (20 ),
PARTITION part_2 VALUES LESS THAN (100 ),
PARTITION part_3 VALUES LESS THAN ( MAXVALUE ));
INSERT INTO  Z0CASE (Z0_TEST0,Z0_TEST1)VALUES('1','111');
INSERT INTO  Z0CASE (Z0_TEST0,Z0_TEST1)VALUES('2','2');
INSERT INTO  Z0CASE (Z0_TEST0,Z0_TEST1)VALUES('30','30');
INSERT INTO  Z0CASE (Z0_TEST0,Z0_TEST1)VALUES('111','121');
SELECT * FROM Z0CASE ORDER BY Z0_TEST1;
Z0_TEST0	Z0_TEST1
2	2
30	30
1	111
111	121
SELECT table_id,table_name FROM oceanbase.__all_virtual_table WHERE table_name='Z0CASE';
ALTER TABLE Z0CASE MODIFY COLUMN Z0_TEST0 mediumINT;
SELECT * FROM Z0CASE ORDER BY Z0_TEST1;
Z0_TEST0	Z0_TEST1
2	2
30	30
1	111
111	121
DESC Z0CASE;
Field	Type	Null	Key	Default	Extra
Z0_TEST0	mediumint(9)	YES		NULL	
Z0_TEST1	bigint(20)	YES		NULL	
SELECT table_id,table_name FROM oceanbase.__all_virtual_table WHERE table_name='Z0CASE';
DROP TABLE Z0CASE;
CREATE TABLE Z0CASE (Z0_TEST0 INT,Z0_TEST1 INT)
PARTITION BY RANGE (Z0_TEST0)
( PARTITION part_1 VALUES LESS THAN (20 ),
PARTITION part_2 VALUES LESS THAN (100 ),
PARTITION part_3 VALUES LESS THAN (MAXVALUE));
INSERT INTO  Z0CASE (Z0_TEST0,Z0_TEST1)VALUES('1','111');
INSERT INTO  Z0CASE (Z0_TEST0,Z0_TEST1)VALUES('2','2');
INSERT INTO  Z0CASE (Z0_TEST0,Z0_TEST1)VALUES('30','30');
INSERT INTO  Z0CASE (Z0_TEST0,Z0_TEST1)VALUES('111','121');
SELECT * FROM Z0CASE ORDER BY Z0_TEST1;
Z0_TEST0	Z0_TEST1
2	2
30	30
1	111
111	121
SELECT table_id,table_name FROM oceanbase.__all_virtual_table WHERE table_name='Z0CASE';
ALTER TABLE Z0CASE MODIFY COLUMN Z0_TEST0 FLOAT(10,0);
ERROR HY000: Field 'Z0_TEST0' is of a not allowed type for this type of partitioning
ALTER TABLE Z0CASE MODIFY COLUMN Z0_TEST0 FLOAT(2,0);
ERROR HY000: Field 'Z0_TEST0' is of a not allowed type for this type of partitioning
ALTER TABLE Z0CASE MODIFY COLUMN Z0_TEST0 DECIMAL(10,3);
ERROR HY000: Field 'Z0_TEST0' is of a not allowed type for this type of partitioning
ALTER TABLE Z0CASE MODIFY COLUMN Z0_TEST0 float(25);
ERROR HY000: Field 'Z0_TEST0' is of a not allowed type for this type of partitioning
ALTER TABLE Z0CASE MODIFY COLUMN Z0_TEST0 blob;
ERROR HY000: Field 'Z0_TEST0' is of a not allowed type for this type of partitioning
ALTER TABLE Z0CASE MODIFY COLUMN Z0_TEST0 text;
ERROR HY000: Field 'Z0_TEST0' is of a not allowed type for this type of partitioning
ALTER TABLE Z0CASE MODIFY COLUMN Z0_TEST0 date;
ERROR HY000: Field 'Z0_TEST0' is of a not allowed type for this type of partitioning
删除分区,数据也自动删除
ALTER TABLE Z0CASE DROP PARTITION part_1 ;
ALTER TABLE Z0CASE DROP PARTITION part_2 ;
SELECT * FROM Z0CASE ORDER BY Z0_TEST1;
Z0_TEST0	Z0_TEST1
111	121
SELECT PARTITION_NAME,TABLE_ROWS,PARTITION_DESCRIPTION FROM INFORMATION_SCHEMA.PARTITIONS WHERE TABLE_SCHEMA=SCHEMA() AND TABLE_NAME = 'Z0CASE' ORDER BY PARTITION_NAME;
PARTITION_NAME	TABLE_ROWS	PARTITION_DESCRIPTION
part_3	NULL	MAXVALUE
只删除数据
ALTER TABLE Z0CASE TRUNCATE PARTITION part_3 ;
SELECT * FROM Z0CASE ORDER BY Z0_TEST1;
Z0_TEST0	Z0_TEST1
SELECT PARTITION_NAME,TABLE_ROWS,PARTITION_DESCRIPTION FROM INFORMATION_SCHEMA.PARTITIONS WHERE TABLE_SCHEMA=SCHEMA() AND TABLE_NAME = 'Z0CASE' ORDER BY PARTITION_NAME;
PARTITION_NAME	TABLE_ROWS	PARTITION_DESCRIPTION
part_3	NULL	MAXVALUE
LIST PARTITION
DROP TABLE Z0CASE;
CREATE TABLE Z0CASE (Z0_TEST0 CHAR(100),Z0_TEST1 CHAR(100))
PARTITION BY LIST columns(Z0_TEST0)
( PARTITION part_1 VALUES IN ('abc','123'),
PARTITION part_2 VALUES IN ('cba','321'));
INSERT INTO  Z0CASE (Z0_TEST0,Z0_TEST1)VALUES('abc','111');
INSERT INTO  Z0CASE (Z0_TEST0,Z0_TEST1)VALUES('cba','2');
INSERT INTO  Z0CASE (Z0_TEST0,Z0_TEST1)VALUES('123','30');
INSERT INTO  Z0CASE (Z0_TEST0,Z0_TEST1)VALUES('321','121');
SELECT * FROM Z0CASE ORDER BY Z0_TEST0;
Z0_TEST0	Z0_TEST1
123	30
321	121
abc	111
cba	2
SELECT table_id,table_name FROM oceanbase.__all_virtual_table WHERE table_name='Z0CASE';
DROP TABLE Z0CASE;
CREATE TABLE Z0CASE (Z0_TEST0 INT , Z0_TEST1 INT,
CONSTRAINT cst check (Z0_TEST0=Z0_TEST1))
PARTITION BY RANGE (Z0_TEST0)
( PARTITION part_1 VALUES LESS THAN (20 ),
PARTITION part_2 VALUES LESS THAN (100 ),
PARTITION part_3 VALUES LESS THAN ( MAXVALUE ));
INSERT INTO  Z0CASE (Z0_TEST0,Z0_TEST1)VALUES('1','111');
ERROR HY000: check constraint violated
INSERT INTO  Z0CASE (Z0_TEST0,Z0_TEST1)VALUES('2','2');
INSERT INTO  Z0CASE (Z0_TEST0,Z0_TEST1)VALUES('30','30');
INSERT INTO  Z0CASE (Z0_TEST0,Z0_TEST1)VALUES('111','111');
SELECT * FROM Z0CASE ORDER BY Z0_TEST0;
Z0_TEST0	Z0_TEST1
2	2
30	30
111	111
SELECT table_id,table_name FROM oceanbase.__all_virtual_table WHERE table_name='Z0CASE';
ALTER TABLE Z0CASE MODIFY COLUMN Z0_TEST0 INT;
SELECT * FROM Z0CASE ORDER BY Z0_TEST0;
Z0_TEST0	Z0_TEST1
2	2
30	30
111	111
SELECT table_id,table_name FROM oceanbase.__all_virtual_table WHERE table_name='Z0CASE';
ALTER TABLE Z0CASE MODIFY COLUMN Z0_TEST0 FLOAT;
ERROR HY000: Field 'Z0_TEST0' is of a not allowed type for this type of partitioning
ALTER TABLE Z0CASE MODIFY COLUMN Z0_TEST0 VARCHAR(99);
ERROR HY000: Field 'Z0_TEST0' is of a not allowed type for this type of partitioning
删除分区,数据也自动删除
ALTER TABLE Z0CASE DROP PARTITION part_1;
ALTER TABLE Z0CASE DROP PARTITION part_2;
ALTER TABLE Z0CASE DROP PARTITION part_3;
ERROR HY000: Cannot remove all partitions, use DROP TABLE instead
SELECT * FROM Z0CASE ORDER BY Z0_TEST0;
Z0_TEST0	Z0_TEST1
111	111
SELECT PARTITION_NAME,TABLE_ROWS,PARTITION_DESCRIPTION FROM INFORMATION_SCHEMA.PARTITIONS WHERE TABLE_SCHEMA=SCHEMA() AND TABLE_NAME = 'Z0CASE' ORDER BY PARTITION_NAME;
PARTITION_NAME	TABLE_ROWS	PARTITION_DESCRIPTION
part_3	NULL	MAXVALUE
只删除数据
ALTER TABLE Z0CASE TRUNCATE PARTITION part_3;
SELECT * FROM Z0CASE ORDER BY Z0_TEST0;
Z0_TEST0	Z0_TEST1
SELECT PARTITION_NAME,TABLE_ROWS,PARTITION_DESCRIPTION FROM INFORMATION_SCHEMA.PARTITIONS WHERE TABLE_SCHEMA=SCHEMA() AND TABLE_NAME = 'Z0CASE' ORDER BY PARTITION_NAME;
PARTITION_NAME	TABLE_ROWS	PARTITION_DESCRIPTION
part_3	NULL	MAXVALUE
ALTER TABLE Z0CASE TRUNCATE PARTITION part_1;
ERROR HY000: Error in list of partitions to DROP
ALTER TABLE Z0CASE TRUNCATE PARTITION part_2;
ERROR HY000: Error in list of partitions to DROP
SELECT * FROM Z0CASE ORDER BY Z0_TEST0;
Z0_TEST0	Z0_TEST1
SELECT PARTITION_NAME,TABLE_ROWS,PARTITION_DESCRIPTION FROM INFORMATION_SCHEMA.PARTITIONS WHERE TABLE_SCHEMA=SCHEMA() AND TABLE_NAME = 'Z0CASE' ORDER BY PARTITION_NAME;
PARTITION_NAME	TABLE_ROWS	PARTITION_DESCRIPTION
part_3	NULL	MAXVALUE
HASH PARTITION
DROP TABLE Z0CASE;
CREATE TABLE Z0CASE (Z0_TEST0 INT,Z0_TEST1 INT)
PARTITION BY HASH (Z0_TEST0)
( PARTITION part_1,
PARTITION part_2);
INSERT INTO Z0CASE (Z0_TEST0,Z0_TEST1)VALUES(1111,'111');
INSERT INTO Z0CASE (Z0_TEST0,Z0_TEST1)VALUES('20111111','111');
INSERT INTO Z0CASE (Z0_TEST0,Z0_TEST1)VALUES('20111114','2');
INSERT INTO Z0CASE (Z0_TEST0,Z0_TEST1)VALUES('111111','30');
INSERT INTO Z0CASE (Z0_TEST0,Z0_TEST1)VALUES('20111113.111111','111');
SELECT * FROM Z0CASE ORDER BY Z0_TEST0;
Z0_TEST0	Z0_TEST1
1111	111
111111	30
20111111	111
20111113	111
20111114	2
SELECT table_id,table_name FROM oceanbase.__all_virtual_table WHERE table_name='Z0CASE';
ALTER TABLE Z0CASE MODIFY COLUMN Z0_TEST0 datetime;
ERROR HY000: Field 'Z0_TEST0' is of a not allowed type for this type of partitioning
ALTER TABLE Z0CASE MODIFY COLUMN Z0_TEST0 date;
ERROR HY000: Field 'Z0_TEST0' is of a not allowed type for this type of partitioning
ALTER TABLE Z0CASE MODIFY COLUMN Z0_TEST0 time;
ERROR HY000: Field 'Z0_TEST0' is of a not allowed type for this type of partitioning
ALTER TABLE Z0CASE MODIFY COLUMN Z0_TEST0 timestamp;
ERROR HY000: Field 'Z0_TEST0' is of a not allowed type for this type of partitioning
ALTER TABLE Z0CASE MODIFY COLUMN Z0_TEST0 VARCHAR(111);
ERROR HY000: Field 'Z0_TEST0' is of a not allowed type for this type of partitioning
ALTER TABLE Z0CASE MODIFY COLUMN Z0_TEST0 VARCHAR(99);
ERROR HY000: Field 'Z0_TEST0' is of a not allowed type for this type of partitioning
ALTER TABLE Z0CASE MODIFY COLUMN Z0_TEST0 CHAR(100);
ERROR HY000: Field 'Z0_TEST0' is of a not allowed type for this type of partitioning
ALTER TABLE Z0CASE MODIFY COLUMN Z0_TEST0 CHAR(101);
ERROR HY000: Field 'Z0_TEST0' is of a not allowed type for this type of partitioning
KEY PARTITION
DROP TABLE Z0CASE;
CREATE TABLE Z0CASE (Z0_TEST0 CHAR(100) ,Z0_TEST1 float)
PARTITION BY KEY(Z0_TEST0) PARTITIONS 3;
INSERT INTO  Z0CASE (Z0_TEST0,Z0_TEST1)VALUES('1','111');
INSERT INTO  Z0CASE (Z0_TEST0,Z0_TEST1)VALUES('2','2');
INSERT INTO  Z0CASE (Z0_TEST0,Z0_TEST1)VALUES('30','30');
INSERT INTO  Z0CASE (Z0_TEST0,Z0_TEST1)VALUES('111','121');
SELECT * FROM Z0CASE ORDER BY Z0_TEST1;
Z0_TEST0	Z0_TEST1
2	2
30	30
1	111
111	121
SELECT table_id,table_name FROM oceanbase.__all_virtual_table WHERE table_name='Z0CASE';
ALTER TABLE Z0CASE MODIFY COLUMN Z0_TEST0 CHAR(100);
SELECT * FROM Z0CASE ORDER BY Z0_TEST1;
Z0_TEST0	Z0_TEST1
2	2
30	30
1	111
111	121
SELECT table_id,table_name FROM oceanbase.__all_virtual_table WHERE table_name='Z0CASE';
ALTER TABLE Z0CASE MODIFY COLUMN Z0_TEST0 CHAR(99);
DESC Z0CASE;
Field	Type	Null	Key	Default	Extra
Z0_TEST0	char(99)	YES		NULL	
Z0_TEST1	float	YES		NULL	
SELECT * FROM Z0CASE ORDER BY Z0_TEST1;
Z0_TEST0	Z0_TEST1
2	2
30	30
1	111
111	121
SELECT table_id,table_name FROM oceanbase.__all_virtual_table WHERE table_name='Z0CASE';
ALTER TABLE Z0CASE MODIFY COLUMN Z0_TEST0 VARCHAR(111);
DESC Z0CASE;
Field	Type	Null	Key	Default	Extra
Z0_TEST0	varchar(111)	YES		NULL	
Z0_TEST1	float	YES		NULL	
SELECT * FROM Z0CASE ORDER BY Z0_TEST1;
Z0_TEST0	Z0_TEST1
2	2
30	30
1	111
111	121
SELECT table_id,table_name FROM oceanbase.__all_virtual_table WHERE table_name='Z0CASE';
ALTER TABLE Z0CASE MODIFY COLUMN Z0_TEST0 VARCHAR(99);
DESC Z0CASE;
Field	Type	Null	Key	Default	Extra
Z0_TEST0	varchar(99)	YES		NULL	
Z0_TEST1	float	YES		NULL	
SELECT * FROM Z0CASE ORDER BY Z0_TEST1;
Z0_TEST0	Z0_TEST1
2	2
30	30
1	111
111	121
SELECT table_id,table_name FROM oceanbase.__all_virtual_table WHERE table_name='Z0CASE';
ALTER TABLE Z0CASE MODIFY COLUMN Z0_TEST0 text;
ERROR HY000: Field 'Z0_TEST0' is of a not allowed type for this type of partitioning
ALTER TABLE Z0CASE MODIFY COLUMN Z0_TEST0 blob;
ERROR HY000: Field 'Z0_TEST0' is of a not allowed type for this type of partitioning
ALTER TABLE Z0CASE MODIFY COLUMN Z0_TEST0 set('1','2','30','111');
DESC Z0CASE;
Field	Type	Null	Key	Default	Extra
Z0_TEST0	set('1','2','30','111')	YES		NULL	
Z0_TEST1	float	YES		NULL	
SELECT * FROM Z0CASE ORDER BY Z0_TEST1;
Z0_TEST0	Z0_TEST1
2	2
30	30
1	111
111	121
SELECT table_id,table_name FROM oceanbase.__all_virtual_table WHERE table_name='Z0CASE';
DROP TABLE Z0CASE;
CREATE TABLE Z0CASE (Z0_TEST0 CHAR(100) ,Z0_TEST1 float)
PARTITION BY KEY(Z0_TEST0) PARTITIONS 3;
INSERT INTO  Z0CASE (Z0_TEST0,Z0_TEST1)VALUES('1','111');
INSERT INTO  Z0CASE (Z0_TEST0,Z0_TEST1)VALUES('2','2');
INSERT INTO  Z0CASE (Z0_TEST0,Z0_TEST1)VALUES('30','30');
INSERT INTO  Z0CASE (Z0_TEST0,Z0_TEST1)VALUES('111','121');
SELECT * FROM Z0CASE ORDER BY Z0_TEST1;
Z0_TEST0	Z0_TEST1
2	2
30	30
1	111
111	121
SELECT table_id,table_name FROM oceanbase.__all_virtual_table WHERE table_name='Z0CASE';
ALTER TABLE Z0CASE MODIFY COLUMN Z0_TEST0 mediumINT;
DESC Z0CASE;
Field	Type	Null	Key	Default	Extra
Z0_TEST0	mediumint(9)	YES		NULL	
Z0_TEST1	float	YES		NULL	
SELECT * FROM Z0CASE ORDER BY Z0_TEST1;
Z0_TEST0	Z0_TEST1
2	2
30	30
1	111
111	121
SELECT table_id,table_name FROM oceanbase.__all_virtual_table WHERE table_name='Z0CASE';
DROP TABLE Z0CASE;
CREATE TABLE Z0CASE (Z0_TEST0 CHAR(100) ,Z0_TEST1 float)
PARTITION BY KEY(Z0_TEST0) PARTITIONS 3;
INSERT INTO  Z0CASE (Z0_TEST0,Z0_TEST1)VALUES('1','111');
INSERT INTO  Z0CASE (Z0_TEST0,Z0_TEST1)VALUES('2','2');
INSERT INTO  Z0CASE (Z0_TEST0,Z0_TEST1)VALUES('30','30');
INSERT INTO  Z0CASE (Z0_TEST0,Z0_TEST1)VALUES('111','121');
SELECT * FROM Z0CASE ORDER BY Z0_TEST1;
Z0_TEST0	Z0_TEST1
2	2
30	30
1	111
111	121
SELECT table_id,table_name FROM oceanbase.__all_virtual_table WHERE table_name='Z0CASE';
ALTER TABLE Z0CASE MODIFY COLUMN Z0_TEST0 BIGINT;
DESC Z0CASE;
Field	Type	Null	Key	Default	Extra
Z0_TEST0	bigint(20)	YES		NULL	
Z0_TEST1	float	YES		NULL	
SELECT * FROM Z0CASE ORDER BY Z0_TEST1;
Z0_TEST0	Z0_TEST1
2	2
30	30
1	111
111	121
SELECT table_id,table_name FROM oceanbase.__all_virtual_table WHERE table_name='Z0CASE';
DROP TABLE Z0CASE;
CREATE TABLE Z0CASE (Z0_TEST0 CHAR(100) ,Z0_TEST1 float)
PARTITION BY KEY(Z0_TEST0) PARTITIONS 3;
INSERT INTO  Z0CASE (Z0_TEST0,Z0_TEST1)VALUES('1','111');
INSERT INTO  Z0CASE (Z0_TEST0,Z0_TEST1)VALUES('2','2');
INSERT INTO  Z0CASE (Z0_TEST0,Z0_TEST1)VALUES('30','30');
INSERT INTO  Z0CASE (Z0_TEST0,Z0_TEST1)VALUES('111','121');
SELECT * FROM Z0CASE ORDER BY Z0_TEST1;
Z0_TEST0	Z0_TEST1
2	2
30	30
1	111
111	121
SELECT table_id,table_name FROM oceanbase.__all_virtual_table WHERE table_name='Z0CASE';
ALTER TABLE Z0CASE MODIFY COLUMN Z0_TEST0 TINYINT;
DESC Z0CASE;
Field	Type	Null	Key	Default	Extra
Z0_TEST0	tinyint(4)	YES		NULL	
Z0_TEST1	float	YES		NULL	
SELECT * FROM Z0CASE ORDER BY Z0_TEST1;
Z0_TEST0	Z0_TEST1
2	2
30	30
1	111
111	121
SELECT table_id,table_name FROM oceanbase.__all_virtual_table WHERE table_name='Z0CASE';
ALTER TABLE Z0CASE MODIFY COLUMN Z0_TEST0  date;
DESC Z0CASE;
Field	Type	Null	Key	Default	Extra
Z0_TEST0	date	YES		NULL	
Z0_TEST1	float	YES		NULL	
SELECT * FROM Z0CASE ORDER BY Z0_TEST1;
Z0_TEST0	Z0_TEST1
0000-00-00	2
0000-00-00	30
0000-00-00	111
2000-01-11	121
SELECT table_id,table_name FROM oceanbase.__all_virtual_table WHERE table_name='Z0CASE';
删除分区
ALTER TABLE Z0CASE DROP PARTITION part_1;
ERROR 0A000: Drop hash partition not supported
ALTER TABLE Z0CASE DROP PARTITION part_2;
ERROR 0A000: Drop hash partition not supported
ALTER TABLE Z0CASE DROP PARTITION part_3;
ERROR 0A000: Drop hash partition not supported
只删除数据
ALTER TABLE Z0CASE TRUNCATE PARTITION part_1;
ERROR 0A000: Drop hash partition not supported
PARTITION option
RANGE PARTITION
DROP TABLE Z0CASE;
CREATE TABLE Z0CASE (Z0_TEST0 TINYINT,Z0_TEST1 TINYINT)
PARTITION BY RANGE (Z0_TEST0)
( PARTITION part_1 VALUES LESS THAN (20 ),
PARTITION part_2 VALUES LESS THAN (100 ),
PARTITION part_3 VALUES LESS THAN (MAXVALUE));
INSERT INTO  Z0CASE (Z0_TEST0,Z0_TEST1)VALUES('1','111');
INSERT INTO  Z0CASE (Z0_TEST0,Z0_TEST1)VALUES('2','2');
INSERT INTO  Z0CASE (Z0_TEST0,Z0_TEST1)VALUES('30','30');
INSERT INTO  Z0CASE (Z0_TEST0,Z0_TEST1)VALUES('111','121');
SELECT * FROM Z0CASE ORDER BY Z0_TEST1;
Z0_TEST0	Z0_TEST1
2	2
30	30
1	111
111	121
SELECT table_id,table_name FROM oceanbase.__all_virtual_table WHERE table_name='Z0CASE';
ALTER TABLE Z0CASE PARTITION BY RANGE(Z0_TEST0)   
( PARTITION p1 VALUES LESS THAN (1),
PARTITION p2 VALUES LESS THAN (5),
PARTITION p3 VALUES LESS THAN MAXVALUE);
SELECT PARTITION_NAME,TABLE_ROWS,PARTITION_DESCRIPTION FROM INFORMATION_SCHEMA.PARTITIONS WHERE TABLE_SCHEMA=SCHEMA() AND TABLE_NAME = 'Z0CASE' ORDER BY PARTITION_NAME;
PARTITION_NAME	TABLE_ROWS	PARTITION_DESCRIPTION
p1	NULL	1
p2	NULL	5
p3	NULL	MAXVALUE
SELECT table_id,table_name FROM oceanbase.__all_virtual_table WHERE table_name='Z0CASE';
INSERT INTO  Z0CASE (Z0_TEST0,Z0_TEST1)VALUES('0','31');
SELECT * FROM Z0CASE ORDER BY Z0_TEST1;
Z0_TEST0	Z0_TEST1
2	2
30	30
0	31
1	111
111	121
INSERT INTO  Z0CASE (Z0_TEST0,Z0_TEST1)VALUES('4','41');
SELECT * FROM Z0CASE ORDER BY Z0_TEST1;
Z0_TEST0	Z0_TEST1
2	2
30	30
0	31
4	41
1	111
111	121
INSERT INTO  Z0CASE (Z0_TEST0,Z0_TEST1)VALUES('128','51');
SELECT * FROM Z0CASE ORDER BY Z0_TEST1;
Z0_TEST0	Z0_TEST1
2	2
30	30
0	31
4	41
127	51
1	111
111	121
INSERT INTO  Z0CASE (Z0_TEST0,Z0_TEST1)VALUES('127','61');
SELECT * FROM Z0CASE ORDER BY Z0_TEST1;
Z0_TEST0	Z0_TEST1
2	2
30	30
0	31
4	41
127	51
127	61
1	111
111	121
SELECT PARTITION_NAME,TABLE_ROWS,PARTITION_DESCRIPTION FROM INFORMATION_SCHEMA.PARTITIONS WHERE TABLE_SCHEMA=SCHEMA() AND TABLE_NAME = 'Z0CASE' ORDER BY PARTITION_NAME;
PARTITION_NAME	TABLE_ROWS	PARTITION_DESCRIPTION
p1	NULL	1
p2	NULL	5
p3	NULL	MAXVALUE
UPDATE Z0CASE SET Z0_TEST0='0' WHERE Z0_TEST1='2';
SELECT * FROM Z0CASE ORDER BY Z0_TEST1;
Z0_TEST0	Z0_TEST1
0	2
30	30
0	31
4	41
127	51
127	61
1	111
111	121
UPDATE Z0CASE SET Z0_TEST0='128' WHERE Z0_TEST1='30';
SELECT * FROM Z0CASE ORDER BY Z0_TEST1;
Z0_TEST0	Z0_TEST1
0	2
127	30
0	31
4	41
127	51
127	61
1	111
111	121
SELECT PARTITION_NAME,TABLE_ROWS,PARTITION_DESCRIPTION FROM INFORMATION_SCHEMA.PARTITIONS WHERE TABLE_SCHEMA=SCHEMA() AND TABLE_NAME = 'Z0CASE' ORDER BY PARTITION_NAME;
PARTITION_NAME	TABLE_ROWS	PARTITION_DESCRIPTION
p1	NULL	1
p2	NULL	5
p3	NULL	MAXVALUE
DELETE FROM Z0CASE WHERE Z0_TEST0='127';
DELETE FROM Z0CASE WHERE Z0_TEST1=111;
SELECT * FROM Z0CASE ORDER BY Z0_TEST1;
Z0_TEST0	Z0_TEST1
0	2
0	31
4	41
111	121
SELECT PARTITION_NAME,TABLE_ROWS,PARTITION_DESCRIPTION FROM INFORMATION_SCHEMA.PARTITIONS WHERE TABLE_SCHEMA=SCHEMA() AND TABLE_NAME = 'Z0CASE' ORDER BY PARTITION_NAME;
PARTITION_NAME	TABLE_ROWS	PARTITION_DESCRIPTION
p1	NULL	1
p2	NULL	5
p3	NULL	MAXVALUE
ALTER TABLE Z0CASE PARTITION BY HASH(Z0_TEST0)(PARTITION part_1, PARTITION part_2);
SELECT * FROM Z0CASE ORDER BY Z0_TEST1;
Z0_TEST0	Z0_TEST1
0	2
0	31
4	41
111	121
SELECT table_id,table_name FROM oceanbase.__all_virtual_table WHERE table_name='Z0CASE';
INSERT INTO  Z0CASE (Z0_TEST0,Z0_TEST1)VALUES('0','1');
SELECT * FROM Z0CASE ORDER BY Z0_TEST1;
Z0_TEST0	Z0_TEST1
0	1
0	2
0	31
4	41
111	121
INSERT INTO  Z0CASE (Z0_TEST0,Z0_TEST1)VALUES('4','3');
SELECT * FROM Z0CASE ORDER BY Z0_TEST1;
Z0_TEST0	Z0_TEST1
0	1
0	2
4	3
0	31
4	41
111	121
INSERT INTO  Z0CASE (Z0_TEST0,Z0_TEST1)VALUES('128','81');
INSERT INTO  Z0CASE (Z0_TEST0,Z0_TEST1)VALUES('127','82');
SELECT * FROM Z0CASE ORDER BY Z0_TEST1;
Z0_TEST0	Z0_TEST1
0	1
0	2
4	3
0	31
4	41
127	81
127	82
111	121
SELECT PARTITION_NAME,TABLE_ROWS,PARTITION_DESCRIPTION FROM INFORMATION_SCHEMA.PARTITIONS WHERE TABLE_SCHEMA=SCHEMA() AND TABLE_NAME = 'Z0CASE' ORDER BY PARTITION_NAME;
PARTITION_NAME	TABLE_ROWS	PARTITION_DESCRIPTION
part_1	NULL	NULL
part_2	NULL	NULL
UPDATE Z0CASE SET Z0_TEST0='0' WHERE Z0_TEST1='3';
SELECT * FROM Z0CASE ORDER BY Z0_TEST1;
Z0_TEST0	Z0_TEST1
0	1
0	2
0	3
0	31
4	41
127	81
127	82
111	121
UPDATE Z0CASE SET Z0_TEST0='128' WHERE Z0_TEST1='3';
SELECT * FROM Z0CASE ORDER BY Z0_TEST1;
Z0_TEST0	Z0_TEST1
0	1
0	2
127	3
0	31
4	41
127	81
127	82
111	121
SELECT PARTITION_NAME,TABLE_ROWS,PARTITION_DESCRIPTION FROM INFORMATION_SCHEMA.PARTITIONS WHERE TABLE_SCHEMA=SCHEMA() AND TABLE_NAME = 'Z0CASE' ORDER BY PARTITION_NAME;
PARTITION_NAME	TABLE_ROWS	PARTITION_DESCRIPTION
part_1	NULL	NULL
part_2	NULL	NULL
DELETE FROM Z0CASE WHERE Z0_TEST0='127';
DELETE FROM Z0CASE WHERE Z0_TEST1='3';
SELECT * FROM Z0CASE ORDER BY Z0_TEST1;
Z0_TEST0	Z0_TEST1
0	1
0	2
0	31
4	41
111	121
SELECT PARTITION_NAME,TABLE_ROWS,PARTITION_DESCRIPTION FROM INFORMATION_SCHEMA.PARTITIONS WHERE TABLE_SCHEMA=SCHEMA() AND TABLE_NAME = 'Z0CASE' ORDER BY PARTITION_NAME;
PARTITION_NAME	TABLE_ROWS	PARTITION_DESCRIPTION
part_1	NULL	NULL
part_2	NULL	NULL
ALTER TABLE Z0CASE PARTITION BY LIST (Z0_TEST0)
( PARTITION part_1 VALUES IN ( '1', '3', '5', '7' ),
PARTITION part_2 VALUES IN ( '2', '4', '6', '8' ),
PARTITION part_default VALUES IN ( default ));
ERROR HY000: VALUES value for partition 'part_1' must have type INT
非分区表 --> 分区表
INT
DROP TABLE Z0CASE;
CREATE TABLE Z0CASE (Z0_TEST0 INT,Z0_TEST1 VARCHAR(100));
INSERT INTO  Z0CASE (Z0_TEST0,Z0_TEST1)VALUES('1','111');
INSERT INTO  Z0CASE (Z0_TEST0,Z0_TEST1)VALUES('2','2');
INSERT INTO  Z0CASE (Z0_TEST0,Z0_TEST1)VALUES('30','30');
INSERT INTO  Z0CASE (Z0_TEST0,Z0_TEST1)VALUES('111','110');
SELECT * FROM Z0CASE ORDER BY Z0_TEST0;
Z0_TEST0	Z0_TEST1
1	111
2	2
30	30
111	110
SELECT table_id,table_name FROM oceanbase.__all_virtual_table WHERE table_name='Z0CASE';
ALTER TABLE Z0CASE PARTITION BY RANGE (Z0_TEST0)
( PARTITION part_1 VALUES LESS THAN (20 ),
PARTITION part_2 VALUES LESS THAN (100 ),
PARTITION part_3 VALUES LESS THAN (MAXVALUE));
SELECT PARTITION_NAME,TABLE_ROWS,PARTITION_DESCRIPTION FROM INFORMATION_SCHEMA.PARTITIONS WHERE TABLE_SCHEMA=SCHEMA() AND TABLE_NAME = 'Z0CASE' ORDER BY PARTITION_NAME;
PARTITION_NAME	TABLE_ROWS	PARTITION_DESCRIPTION
part_1	NULL	20
part_2	NULL	100
part_3	NULL	MAXVALUE
SELECT table_id,table_name FROM oceanbase.__all_virtual_table WHERE table_name='Z0CASE';
DROP TABLE Z0CASE;
CREATE TABLE Z0CASE (Z0_TEST0 INT,Z0_TEST1 VARCHAR(100));
INSERT INTO  Z0CASE (Z0_TEST0,Z0_TEST1)VALUES('1','111');
INSERT INTO  Z0CASE (Z0_TEST0,Z0_TEST1)VALUES('2','2');
INSERT INTO  Z0CASE (Z0_TEST0,Z0_TEST1)VALUES('30','30');
INSERT INTO  Z0CASE (Z0_TEST0,Z0_TEST1)VALUES('111','110');
SELECT * FROM Z0CASE ORDER BY Z0_TEST0;
Z0_TEST0	Z0_TEST1
1	111
2	2
30	30
111	110
SELECT table_id,table_name FROM oceanbase.__all_virtual_table WHERE table_name='Z0CASE';
ALTER TABLE Z0CASE PARTITION BY HASH(Z0_TEST0)   
(PARTITION part_1,PARTITION part_2);
SELECT PARTITION_NAME,TABLE_ROWS,PARTITION_DESCRIPTION FROM INFORMATION_SCHEMA.PARTITIONS WHERE TABLE_SCHEMA=SCHEMA() AND TABLE_NAME = 'Z0CASE' ORDER BY PARTITION_NAME;
PARTITION_NAME	TABLE_ROWS	PARTITION_DESCRIPTION
part_1	NULL	NULL
part_2	NULL	NULL
SELECT table_id,table_name FROM oceanbase.__all_virtual_table WHERE table_name='Z0CASE';
DROP TABLE Z0CASE;
CREATE TABLE Z0CASE (Z0_TEST0 INT,Z0_TEST1 VARCHAR(100));
INSERT INTO  Z0CASE (Z0_TEST0,Z0_TEST1)VALUES('1','111');
INSERT INTO  Z0CASE (Z0_TEST0,Z0_TEST1)VALUES('2','2');
INSERT INTO  Z0CASE (Z0_TEST0,Z0_TEST1)VALUES('30','30');
INSERT INTO  Z0CASE (Z0_TEST0,Z0_TEST1)VALUES('111','110');
SELECT * FROM Z0CASE ORDER BY Z0_TEST0;
Z0_TEST0	Z0_TEST1
1	111
2	2
30	30
111	110
SELECT table_id,table_name FROM oceanbase.__all_virtual_table WHERE table_name='Z0CASE';
下方的default为Oracle中的一种分区语法，MySQL不支持此语法，OB的MySQL模式支持
ALTER TABLE Z0CASE
PARTITION BY LIST (Z0_TEST0)
( PARTITION part_1 VALUES IN ( 1 ,30),
PARTITION part_2 VALUES IN ( 2 ),
PARTITION part_default VALUES IN (default));
SELECT PARTITION_NAME,TABLE_ROWS,PARTITION_DESCRIPTION FROM INFORMATION_SCHEMA.PARTITIONS WHERE TABLE_SCHEMA=SCHEMA() AND TABLE_NAME = 'Z0CASE' ORDER BY PARTITION_NAME;
PARTITION_NAME	TABLE_ROWS	PARTITION_DESCRIPTION
part_1	NULL	1,30
part_2	NULL	2
part_default	NULL	DEFAULT
SELECT table_id,table_name FROM oceanbase.__all_virtual_table WHERE table_name='Z0CASE';
INSERT INTO  Z0CASE (Z0_TEST0,Z0_TEST1)VALUES('0','1');
INSERT INTO  Z0CASE (Z0_TEST0,Z0_TEST1)VALUES('1','112');
INSERT INTO  Z0CASE (Z0_TEST0,Z0_TEST1)VALUES('2','113');
SELECT * FROM Z0CASE ORDER BY Z0_TEST0;
Z0_TEST0	Z0_TEST1
0	1
1	111
1	112
2	2
2	113
30	30
111	110
SELECT PARTITION_NAME,TABLE_ROWS,PARTITION_DESCRIPTION FROM INFORMATION_SCHEMA.PARTITIONS WHERE TABLE_SCHEMA=SCHEMA() AND TABLE_NAME = 'Z0CASE' ORDER BY PARTITION_NAME;
PARTITION_NAME	TABLE_ROWS	PARTITION_DESCRIPTION
part_1	NULL	1,30
part_2	NULL	2
part_default	NULL	DEFAULT
UPDATE Z0CASE SET Z0_TEST0='20' WHERE Z0_TEST1='111';
UPDATE Z0CASE SET Z0_TEST0='300' WHERE Z0_TEST1='1';
SELECT * FROM Z0CASE ORDER BY Z0_TEST0;
Z0_TEST0	Z0_TEST1
1	112
2	2
2	113
20	111
30	30
111	110
300	1
SELECT PARTITION_NAME,TABLE_ROWS,PARTITION_DESCRIPTION FROM INFORMATION_SCHEMA.PARTITIONS WHERE TABLE_SCHEMA=SCHEMA() AND TABLE_NAME = 'Z0CASE' ORDER BY PARTITION_NAME;
PARTITION_NAME	TABLE_ROWS	PARTITION_DESCRIPTION
part_1	NULL	1,30
part_2	NULL	2
part_default	NULL	DEFAULT
DELETE FROM Z0CASE WHERE Z0_TEST0='300';
DELETE FROM Z0CASE WHERE Z0_TEST0='2';
SELECT * FROM Z0CASE ORDER BY Z0_TEST0;
Z0_TEST0	Z0_TEST1
1	112
20	111
30	30
111	110
SELECT PARTITION_NAME,TABLE_ROWS,PARTITION_DESCRIPTION FROM INFORMATION_SCHEMA.PARTITIONS WHERE TABLE_SCHEMA=SCHEMA() AND TABLE_NAME = 'Z0CASE' ORDER BY PARTITION_NAME;
PARTITION_NAME	TABLE_ROWS	PARTITION_DESCRIPTION
part_1	NULL	1,30
part_2	NULL	2
part_default	NULL	DEFAULT
DROP TABLE Z0CASE;
CREATE TABLE Z0CASE (Z0_TEST0 INT,Z0_TEST1 VARCHAR(100));
INSERT INTO  Z0CASE (Z0_TEST0,Z0_TEST1)VALUES('1','111');
INSERT INTO  Z0CASE (Z0_TEST0,Z0_TEST1)VALUES('2','2');
INSERT INTO  Z0CASE (Z0_TEST0,Z0_TEST1)VALUES('30','30');
INSERT INTO  Z0CASE (Z0_TEST0,Z0_TEST1)VALUES('111','113');
SELECT * FROM Z0CASE ORDER BY Z0_TEST0;
Z0_TEST0	Z0_TEST1
1	111
2	2
30	30
111	113
SELECT table_id,table_name FROM oceanbase.__all_virtual_table WHERE table_name='Z0CASE';
ALTER TABLE Z0CASE
PARTITION BY HASH(Z0_TEST0) SUBPARTITION BY RANGE(Z0_TEST0) SUBPARTITION template
( SUBPARTITION sp0 VALUES LESS THAN(100),
SUBPARTITION sp1 VALUES LESS THAN(200),
SUBPARTITION sp2 VALUES LESS THAN(MAXVALUE) ) PARTITIONS 2;
SELECT PARTITION_NAME,TABLE_ROWS,PARTITION_DESCRIPTION FROM INFORMATION_SCHEMA.PARTITIONS WHERE TABLE_SCHEMA=SCHEMA() AND TABLE_NAME = 'Z0CASE' ORDER BY PARTITION_NAME;
PARTITION_NAME	TABLE_ROWS	PARTITION_DESCRIPTION
p0	NULL	NULL
p0	NULL	NULL
p0	NULL	NULL
p1	NULL	NULL
p1	NULL	NULL
p1	NULL	NULL
SELECT table_id,table_name FROM oceanbase.__all_virtual_table WHERE table_name='Z0CASE';
CHAR
DROP TABLE Z0CASE;
CREATE TABLE Z0CASE (Z0_TEST0 CHAR(100),Z0_TEST1 VARCHAR(100));
INSERT INTO  Z0CASE (Z0_TEST0,Z0_TEST1)VALUES('1','111');
INSERT INTO  Z0CASE (Z0_TEST0,Z0_TEST1)VALUES('2','2');
INSERT INTO  Z0CASE (Z0_TEST0,Z0_TEST1)VALUES('30','30');
INSERT INTO  Z0CASE (Z0_TEST0,Z0_TEST1)VALUES('111','131');
SELECT * FROM Z0CASE;
SELECT table_id,table_name FROM oceanbase.__all_virtual_table WHERE table_name='Z0CASE';
ALTER TABLE Z0CASE PARTITION BY RANGE (Z0_TEST0)
( PARTITION part_1 VALUES LESS THAN (20 ),
PARTITION part_2 VALUES LESS THAN (100 ),
PARTITION part_3 VALUES LESS THAN (MAXVALUE));
ERROR HY000: Field 'Z0_TEST0' is of a not allowed type for this type of partitioning
INSERT INTO  Z0CASE (Z0_TEST0,Z0_TEST1)VALUES(null,null);
SELECT * FROM Z0CASE;
ALTER TABLE Z0CASE PARTITION BY KEY(Z0_TEST0) PARTITIONS 3;
SELECT PARTITION_NAME,TABLE_ROWS,PARTITION_DESCRIPTION FROM INFORMATION_SCHEMA.PARTITIONS WHERE TABLE_SCHEMA=SCHEMA() AND TABLE_NAME = 'Z0CASE' ORDER BY PARTITION_NAME;
PARTITION_NAME	TABLE_ROWS	PARTITION_DESCRIPTION
p0	NULL	NULL
p1	NULL	NULL
p2	NULL	NULL
SELECT table_id,table_name FROM oceanbase.__all_virtual_table WHERE table_name='Z0CASE';
INSERT INTO  Z0CASE (Z0_TEST0,Z0_TEST1)VALUES('0','1');
INSERT INTO  Z0CASE (Z0_TEST0,Z0_TEST1)VALUES('4','3');
INSERT INTO  Z0CASE (Z0_TEST0,Z0_TEST1)VALUES('127','20');
SELECT * FROM Z0CASE;
SELECT PARTITION_NAME,TABLE_ROWS,PARTITION_DESCRIPTION FROM INFORMATION_SCHEMA.PARTITIONS WHERE TABLE_SCHEMA=SCHEMA() AND TABLE_NAME = 'Z0CASE' ORDER BY PARTITION_NAME;
PARTITION_NAME	TABLE_ROWS	PARTITION_DESCRIPTION
p0	NULL	NULL
p1	NULL	NULL
p2	NULL	NULL
UPDATE Z0CASE SET Z0_TEST0='0' WHERE Z0_TEST1='2';
UPDATE Z0CASE SET Z0_TEST0='120' WHERE Z0_TEST1='3';
SELECT * FROM Z0CASE;
SELECT PARTITION_NAME,TABLE_ROWS,PARTITION_DESCRIPTION FROM INFORMATION_SCHEMA.PARTITIONS WHERE TABLE_SCHEMA=SCHEMA() AND TABLE_NAME = 'Z0CASE' ORDER BY PARTITION_NAME;
PARTITION_NAME	TABLE_ROWS	PARTITION_DESCRIPTION
p0	NULL	NULL
p1	NULL	NULL
p2	NULL	NULL
DELETE FROM Z0CASE WHERE Z0_TEST0='120';
DELETE FROM Z0CASE WHERE Z0_TEST1='30';
SELECT * FROM Z0CASE;
SELECT PARTITION_NAME,TABLE_ROWS,PARTITION_DESCRIPTION FROM INFORMATION_SCHEMA.PARTITIONS WHERE TABLE_SCHEMA=SCHEMA() AND TABLE_NAME = 'Z0CASE' ORDER BY PARTITION_NAME;
PARTITION_NAME	TABLE_ROWS	PARTITION_DESCRIPTION
p0	NULL	NULL
p1	NULL	NULL
p2	NULL	NULL
DROP TABLE Z0CASE;
CREATE TABLE Z0CASE (Z0_TEST0 CHAR(100),Z0_TEST1 VARCHAR(100));
INSERT INTO  Z0CASE (Z0_TEST0,Z0_TEST1)VALUES('1','111');
INSERT INTO  Z0CASE (Z0_TEST0,Z0_TEST1)VALUES('1','2');
INSERT INTO  Z0CASE (Z0_TEST0,Z0_TEST1)VALUES('30','30');
INSERT INTO  Z0CASE (Z0_TEST0,Z0_TEST1)VALUES('111','111');
INSERT INTO  Z0CASE (Z0_TEST0,Z0_TEST1)VALUES(null,null);
SELECT * FROM Z0CASE;
SELECT table_id,table_name FROM oceanbase.__all_virtual_table WHERE table_name='Z0CASE';
ALTER TABLE Z0CASE PARTITION BY HASH(Z0_TEST0)   
(PARTITION part_1, PARTITION part_2);
ERROR HY000: Field 'Z0_TEST0' is of a not allowed type for this type of partitioning
ALTER TABLE Z0CASE PARTITION BY KEY(Z0_TEST0) PARTITIONS 3;
SELECT PARTITION_NAME,TABLE_ROWS,PARTITION_DESCRIPTION FROM INFORMATION_SCHEMA.PARTITIONS WHERE TABLE_SCHEMA=SCHEMA() AND TABLE_NAME = 'Z0CASE' ORDER BY PARTITION_NAME;
PARTITION_NAME	TABLE_ROWS	PARTITION_DESCRIPTION
p0	NULL	NULL
p1	NULL	NULL
p2	NULL	NULL
SELECT table_id,table_name FROM oceanbase.__all_virtual_table WHERE table_name='Z0CASE';
DROP TABLE Z0CASE;
CREATE TABLE Z0CASE (Z0_TEST0 CHAR(10),Z0_TEST1 VARCHAR(100));
INSERT INTO  Z0CASE (Z0_TEST0,Z0_TEST1)VALUES('bca','111');
INSERT INTO  Z0CASE (Z0_TEST0,Z0_TEST1)VALUES('abc','2');
INSERT INTO  Z0CASE (Z0_TEST0,Z0_TEST1)VALUES('ABC','30');
INSERT INTO  Z0CASE (Z0_TEST0,Z0_TEST1)VALUES('cba','111');
ALTER TABLE Z0CASE PARTITION BY LIST (Z0_TEST0)
( PARTITION part_1 VALUES IN ('abc', 'ABC'),
PARTITION part_2 VALUES IN ('cba', 'bca'));
ERROR HY000: Field 'Z0_TEST0' is of a not allowed type for this type of partitioning
SELECT * FROM Z0CASE;
DROP TABLE Z0CASE;
CREATE TABLE Z0CASE (Z0_TEST0 CHAR(100),Z0_TEST1 VARCHAR(100));
INSERT INTO  Z0CASE (Z0_TEST0,Z0_TEST1)VALUES('1','111');
INSERT INTO  Z0CASE (Z0_TEST0,Z0_TEST1)VALUES('2','2');
INSERT INTO  Z0CASE (Z0_TEST0,Z0_TEST1)VALUES('30','30');
INSERT INTO  Z0CASE (Z0_TEST0,Z0_TEST1)VALUES('111','111');
SELECT * FROM Z0CASE;
SELECT table_id,table_name FROM oceanbase.__all_virtual_table WHERE table_name='Z0CASE';
ALTER TABLE Z0CASE
PARTITION BY KEY(Z0_TEST0) SUBPARTITION BY KEY(Z0_TEST0)  PARTITIONS 2;
SELECT PARTITION_NAME,TABLE_ROWS,PARTITION_DESCRIPTION FROM INFORMATION_SCHEMA.PARTITIONS WHERE TABLE_SCHEMA=SCHEMA() AND TABLE_NAME = 'Z0CASE' ORDER BY PARTITION_NAME;
PARTITION_NAME	TABLE_ROWS	PARTITION_DESCRIPTION
p0	NULL	NULL
p1	NULL	NULL
SELECT table_id,table_name FROM oceanbase.__all_virtual_table WHERE table_name='Z0CASE';
VARCHAR
DROP TABLE Z0CASE;
CREATE TABLE Z0CASE (Z0_TEST0 VARCHAR(100),Z0_TEST1 VARCHAR(100));
INSERT INTO  Z0CASE (Z0_TEST0,Z0_TEST1)VALUES('1','111');
INSERT INTO  Z0CASE (Z0_TEST0,Z0_TEST1)VALUES('2','2');
INSERT INTO  Z0CASE (Z0_TEST0,Z0_TEST1)VALUES('30','30');
INSERT INTO  Z0CASE (Z0_TEST0,Z0_TEST1)VALUES('111','111');
SELECT table_id,table_name FROM oceanbase.__all_virtual_table WHERE table_name='Z0CASE';
ALTER TABLE Z0CASE PARTITION BY RANGE (Z0_TEST0)
( PARTITION part_1 VALUES LESS THAN (20 ),
PARTITION part_2 VALUES LESS THAN (100 ),
PARTITION part_3 VALUES LESS THAN ( MAXVALUE ));
ERROR HY000: Field 'Z0_TEST0' is of a not allowed type for this type of partitioning
SELECT * FROM Z0CASE;
INSERT INTO  Z0CASE (Z0_TEST0,Z0_TEST1)VALUES(null,null);
SELECT * FROM Z0CASE;
ALTER TABLE Z0CASE PARTITION BY KEY(Z0_TEST0) PARTITIONS 3;
SELECT PARTITION_NAME,TABLE_ROWS,PARTITION_DESCRIPTION FROM INFORMATION_SCHEMA.PARTITIONS WHERE TABLE_SCHEMA=SCHEMA() AND TABLE_NAME = 'Z0CASE' ORDER BY PARTITION_NAME;
PARTITION_NAME	TABLE_ROWS	PARTITION_DESCRIPTION
p0	NULL	NULL
p1	NULL	NULL
p2	NULL	NULL
SELECT * FROM Z0CASE;
SELECT table_id,table_name FROM oceanbase.__all_virtual_table WHERE table_name='Z0CASE';
DROP TABLE Z0CASE;
CREATE TABLE Z0CASE (Z0_TEST0 VARCHAR(100),Z0_TEST1 VARCHAR(100));
INSERT INTO  Z0CASE (Z0_TEST0,Z0_TEST1)VALUES('1','111');
INSERT INTO  Z0CASE (Z0_TEST0,Z0_TEST1)VALUES('1','2');
INSERT INTO  Z0CASE (Z0_TEST0,Z0_TEST1)VALUES('30','30');
INSERT INTO  Z0CASE (Z0_TEST0,Z0_TEST1)VALUES('111','111');
INSERT INTO  Z0CASE (Z0_TEST0,Z0_TEST1)VALUES(null,null);
SELECT PARTITION_NAME,TABLE_ROWS,PARTITION_DESCRIPTION FROM INFORMATION_SCHEMA.PARTITIONS WHERE TABLE_SCHEMA=SCHEMA() AND TABLE_NAME = 'Z0CASE' ORDER BY PARTITION_NAME;
PARTITION_NAME	TABLE_ROWS	PARTITION_DESCRIPTION
NULL	NULL	NULL
SELECT table_id,table_name FROM oceanbase.__all_virtual_table WHERE table_name='Z0CASE';
ALTER TABLE Z0CASE PARTITION BY HASH(Z0_TEST0)   
(PARTITION part_1,PARTITION part_2);
ERROR HY000: Field 'Z0_TEST0' is of a not allowed type for this type of partitioning
SELECT * FROM Z0CASE;
ALTER TABLE Z0CASE PARTITION BY KEY(Z0_TEST0) PARTITIONS 3;
SELECT PARTITION_NAME,TABLE_ROWS,PARTITION_DESCRIPTION FROM INFORMATION_SCHEMA.PARTITIONS WHERE TABLE_SCHEMA=SCHEMA() AND TABLE_NAME = 'Z0CASE' ORDER BY PARTITION_NAME;
PARTITION_NAME	TABLE_ROWS	PARTITION_DESCRIPTION
p0	NULL	NULL
p1	NULL	NULL
p2	NULL	NULL
SELECT table_id,table_name FROM oceanbase.__all_virtual_table WHERE table_name='Z0CASE';
DROP TABLE Z0CASE;
CREATE TABLE Z0CASE (Z0_TEST0 VARCHAR(10),Z0_TEST1 VARCHAR(100));
INSERT INTO  Z0CASE (Z0_TEST0,Z0_TEST1)VALUES('bca','111');
INSERT INTO  Z0CASE (Z0_TEST0,Z0_TEST1)VALUES('abc','2');
INSERT INTO  Z0CASE (Z0_TEST0,Z0_TEST1)VALUES('ABC','30');
INSERT INTO  Z0CASE (Z0_TEST0,Z0_TEST1)VALUES('cba','111');
ALTER TABLE Z0CASE PARTITION BY LIST (Z0_TEST0)
( PARTITION part_1 VALUES IN ( 'abc', 'ABC' ),
PARTITION part_2 VALUES IN ( 'cba', 'bca' ));
ERROR HY000: Field 'Z0_TEST0' is of a not allowed type for this type of partitioning
SELECT * FROM Z0CASE;
DROP TABLE Z0CASE;
CREATE TABLE Z0CASE (Z0_TEST0 VARCHAR(10),Z0_TEST1 VARCHAR(100));
INSERT INTO  Z0CASE (Z0_TEST0,Z0_TEST1)VALUES('1','111');
INSERT INTO  Z0CASE (Z0_TEST0,Z0_TEST1)VALUES('2','2');
INSERT INTO  Z0CASE (Z0_TEST0,Z0_TEST1)VALUES('30','30');
INSERT INTO  Z0CASE (Z0_TEST0,Z0_TEST1)VALUES('111','111');
SELECT * FROM Z0CASE;
SELECT PARTITION_NAME,TABLE_ROWS,PARTITION_DESCRIPTION FROM INFORMATION_SCHEMA.PARTITIONS WHERE TABLE_SCHEMA=SCHEMA() AND TABLE_NAME = 'Z0CASE' ORDER BY PARTITION_NAME;
PARTITION_NAME	TABLE_ROWS	PARTITION_DESCRIPTION
NULL	NULL	NULL
SELECT table_id,table_name FROM oceanbase.__all_virtual_table WHERE table_name='Z0CASE';
ALTER TABLE Z0CASE
PARTITION BY KEY(Z0_TEST0) SUBPARTITION BY KEY(Z0_TEST0)  PARTITIONS 2;
SELECT PARTITION_NAME,TABLE_ROWS,PARTITION_DESCRIPTION FROM INFORMATION_SCHEMA.PARTITIONS WHERE TABLE_SCHEMA=SCHEMA() AND TABLE_NAME = 'Z0CASE' ORDER BY PARTITION_NAME;
PARTITION_NAME	TABLE_ROWS	PARTITION_DESCRIPTION
p0	NULL	NULL
p1	NULL	NULL
SELECT table_id,table_name FROM oceanbase.__all_virtual_table WHERE table_name='Z0CASE';
BLOB
DROP TABLE Z0CASE;
CREATE TABLE Z0CASE (Z0_TEST0 TINYBLOB,Z0_TEST1 BLOB);
INSERT INTO  Z0CASE (Z0_TEST0,Z0_TEST1)VALUES('1','111');
INSERT INTO  Z0CASE (Z0_TEST0,Z0_TEST1)VALUES('2','2');
INSERT INTO  Z0CASE (Z0_TEST0,Z0_TEST1)VALUES('30','30');
INSERT INTO  Z0CASE (Z0_TEST0,Z0_TEST1)VALUES('111','121');
ALTER TABLE Z0CASE PARTITION BY RANGE (Z0_TEST0)
( PARTITION part_1 VALUES LESS THAN (20 ),
PARTITION part_2 VALUES LESS THAN (100 ),
PARTITION part_3 VALUES LESS THAN ( MAXVALUE ));
ERROR HY000: Field 'Z0_TEST0' is of a not allowed type for this type of partitioning
SELECT * FROM Z0CASE ORDER BY Z0_TEST1;
Z0_TEST0	Z0_TEST1
1	111
111	121
2	2
30	30
INSERT INTO  Z0CASE (Z0_TEST0,Z0_TEST1)VALUES(null,null);
ALTER TABLE Z0CASE PARTITION BY KEY(Z0_TEST0) PARTITIONS 3;
ERROR HY000: Field 'Z0_TEST0' is of a not allowed type for this type of partitioning
UPDATE Z0CASE SET Z0_TEST0='1' WHERE Z0_TEST1='2';
ALTER TABLE Z0CASE PARTITION BY HASH(Z0_TEST0)   
(PARTITION part_1,
PARTITION part_2);
ERROR HY000: Field 'Z0_TEST0' is of a not allowed type for this type of partitioning
DROP TABLE Z0CASE;
CREATE TABLE Z0CASE (Z0_TEST0 TINYBLOB,Z0_TEST1 BLOB);
INSERT INTO  Z0CASE (Z0_TEST0,Z0_TEST1)VALUES('bca','111');
INSERT INTO  Z0CASE (Z0_TEST0,Z0_TEST1)VALUES('abc','2');
INSERT INTO  Z0CASE (Z0_TEST0,Z0_TEST1)VALUES('ABC','30');
INSERT INTO  Z0CASE (Z0_TEST0,Z0_TEST1)VALUES('cba','121');
ALTER TABLE Z0CASE PARTITION BY LIST (Z0_TEST0)
( PARTITION part_1 VALUES IN ( 'abc', 'ABC' ),
PARTITION part_2 VALUES IN ( 'cba', 'bca' ));
ERROR HY000: Field 'Z0_TEST0' is of a not allowed type for this type of partitioning
SELECT * FROM Z0CASE ORDER BY Z0_TEST1;
Z0_TEST0	Z0_TEST1
bca	111
cba	121
abc	2
ABC	30
DROP TABLE Z0CASE;
CREATE TABLE Z0CASE (Z0_TEST0 TINYBLOB,Z0_TEST1 BLOB);
INSERT INTO  Z0CASE (Z0_TEST0,Z0_TEST1)VALUES('1','111');
INSERT INTO  Z0CASE (Z0_TEST0,Z0_TEST1)VALUES('2','2');
INSERT INTO  Z0CASE (Z0_TEST0,Z0_TEST1)VALUES('30','30');
INSERT INTO  Z0CASE (Z0_TEST0,Z0_TEST1)VALUES('111','121');
ALTER TABLE Z0CASE PARTITION BY KEY(Z0_TEST0) SUBPARTITION BY KEY(Z0_TEST0)  PARTITIONS 2;
ERROR HY000: Field 'Z0_TEST0' is of a not allowed type for this type of partitioning
SELECT * FROM Z0CASE ORDER BY Z0_TEST1;
Z0_TEST0	Z0_TEST1
1	111
111	121
2	2
30	30
DROP TABLE Z0CASE;
SET sql_mode='STRICT_TRANS_TABLES,STRICT_ALL_TABLES';
