SET sql_mode='';

DROP TABLE IF EXISTS Z0CASE;
直接索引
char --> char/varchar
CREATE TABLE Z0CASE(Z0_TEST0 CHAR(100), Z0_TEST1 varchar(50),Z0_TEST2 int) ;
INSERT INTO  Z0CASE (z0_test0,z0_test1,Z0_TEST2)values('abc ABC','abc ABC',1);
INSERT INTO  Z0CASE (z0_test0,z0_test1,Z0_TEST2)values('中文字符@!#$%^','中文字符@!#$%^',1);
INSERT INTO  Z0CASE (z0_test0,z0_test1,Z0_TEST2)values(NULL,NULL,0);
INSERT INTO  Z0CASE (z0_test0,z0_test1,Z0_TEST2)values(111,111,11);
INSERT INTO  Z0CASE (z0_test0,z0_test1,Z0_TEST2)values('1111.1111','1111.1111',100);
INSERT INTO  Z0CASE (z0_test0,z0_test1,Z0_TEST2)values('2011-11-11 11:11:11','2011-11-11 11:11:11',20);
INSERT INTO  Z0CASE (z0_test0,z0_test1,Z0_TEST2)values(20111111,20111111,1);
INSERT INTO  Z0CASE (z0_test0,z0_test1,Z0_TEST2)values(NULL,NULL,0);
INSERT INTO  Z0CASE (z0_test0,z0_test1,Z0_TEST2)values('','',10);
INSERT INTO  Z0CASE (z0_test0,z0_test1,Z0_TEST2)values('    ',' ',20);
SELECT * FROM Z0CASE ORDER BY Z0_TEST0;
Z0_TEST0	Z0_TEST1	Z0_TEST2
NULL	NULL	0
NULL	NULL	0
		10
	 	20
111	111	11
1111.1111	1111.1111	100
2011-11-11 11:11:11	2011-11-11 11:11:11	20
20111111	20111111	1
abc ABC	abc ABC	1
中文字符@!#$%^	中文字符@!#$%^	1
ALTER TABLE `Z0CASE` ADD INDEX z0_index ( `Z0_TEST0` ) STORING(Z0_TEST1) with column group(all columns, each column);
SELECT table_id,table_name FROM oceanbase.__all_virtual_table WHERE table_name='Z0CASE';
ALTER TABLE Z0CASE modify COLUMN  z0_test0 char(100);
SELECT Z0_TEST0 FROM Z0CASE ORDER BY Z0_TEST0;
Z0_TEST0
NULL
NULL


111
1111.1111
2011-11-11 11:11:11
20111111
abc ABC
中文字符@!#$%^
DESC Z0CASE;
Field	Type	Null	Key	Default	Extra
z0_test0	char(100)	YES	MUL	NULL	
Z0_TEST1	varchar(50)	YES		NULL	
Z0_TEST2	int(11)	YES		NULL	
SELECT table_id,table_name FROM oceanbase.__all_virtual_table WHERE table_name='Z0CASE';
ALTER TABLE Z0CASE modify COLUMN  z0_test0 char(99);
SELECT Z0_TEST0 FROM Z0CASE ORDER BY Z0_TEST0;
Z0_TEST0
NULL
NULL


111
1111.1111
2011-11-11 11:11:11
20111111
abc ABC
中文字符@!#$%^
DESC Z0CASE;
Field	Type	Null	Key	Default	Extra
z0_test0	char(99)	YES	MUL	NULL	
Z0_TEST1	varchar(50)	YES		NULL	
Z0_TEST2	int(11)	YES		NULL	
SELECT table_id,table_name FROM oceanbase.__all_virtual_table WHERE table_name='Z0CASE';
ALTER TABLE Z0CASE modify COLUMN  z0_test0 varchar(99);
SELECT Z0_TEST0 FROM Z0CASE ORDER BY Z0_TEST0;
Z0_TEST0
NULL
NULL


111
1111.1111
2011-11-11 11:11:11
20111111
abc ABC
中文字符@!#$%^
DESC Z0CASE;
Field	Type	Null	Key	Default	Extra
z0_test0	varchar(99)	YES	MUL	NULL	
Z0_TEST1	varchar(50)	YES		NULL	
Z0_TEST2	int(11)	YES		NULL	
SELECT table_id,table_name FROM oceanbase.__all_virtual_table WHERE table_name='Z0CASE';
ALTER TABLE Z0CASE modify COLUMN  z0_test0 varchar(99);
SELECT Z0_TEST0 FROM Z0CASE ORDER BY Z0_TEST0;
Z0_TEST0
NULL
NULL


111
1111.1111
2011-11-11 11:11:11
20111111
abc ABC
中文字符@!#$%^
DESC Z0CASE;
Field	Type	Null	Key	Default	Extra
z0_test0	varchar(99)	YES	MUL	NULL	
Z0_TEST1	varchar(50)	YES		NULL	
Z0_TEST2	int(11)	YES		NULL	
SELECT table_id,table_name FROM oceanbase.__all_virtual_table WHERE table_name='Z0CASE';
char --> set
DROP TABLE Z0CASE;
CREATE TABLE Z0CASE(Z0_TEST0 CHAR(100), Z0_TEST1 varchar(50),Z0_TEST2 int) ;
INSERT INTO  Z0CASE (z0_test0,z0_test1,Z0_TEST2)values('abc ABC','abc ABC',1);
INSERT INTO  Z0CASE (z0_test0,z0_test1,Z0_TEST2)values('123','中文字符@!#$%^',1);
INSERT INTO  Z0CASE (z0_test0,z0_test1,Z0_TEST2)values(NULL,NULL,0);
INSERT INTO  Z0CASE (z0_test0,z0_test1,Z0_TEST2)values('','',10);
INSERT INTO  Z0CASE (z0_test0,z0_test1,Z0_TEST2)values('    ',' ',20);
SELECT * FROM Z0CASE ORDER BY Z0_TEST0;
Z0_TEST0	Z0_TEST1	Z0_TEST2
NULL	NULL	0
		10
	 	20
123	中文字符@!#$%^	1
abc ABC	abc ABC	1
ALTER TABLE `Z0CASE` ADD INDEX z0_index ( `Z0_TEST0` ) STORING(Z0_TEST1) with column group(all columns, each column);
SELECT table_id,table_name FROM oceanbase.__all_virtual_table WHERE table_name='Z0CASE';
ALTER TABLE Z0CASE modify COLUMN  z0_test0 set('abc ABC','123','');
SELECT Z0_TEST0 FROM Z0CASE ORDER BY Z0_TEST0;
Z0_TEST0
NULL


abc ABC
123
DESC Z0CASE;
Field	Type	Null	Key	Default	Extra
z0_test0	set('abc ABC','123','')	YES	MUL	NULL	
Z0_TEST1	varchar(50)	YES		NULL	
Z0_TEST2	int(11)	YES		NULL	
SELECT table_id,table_name FROM oceanbase.__all_virtual_table WHERE table_name='Z0CASE';
INSERT INTO  Z0CASE (z0_test0,z0_test1,Z0_TEST2)values('','aa',1);
SELECT * FROM Z0CASE ORDER BY Z0_TEST0;
z0_test0	Z0_TEST1	Z0_TEST2
NULL	NULL	0
		10
	 	20
	aa	1
abc ABC	abc ABC	1
123	中文字符@!#$%^	1
INSERT INTO  Z0CASE (z0_test0,z0_test1,Z0_TEST2)values('abc ','aa',1);
SELECT * FROM Z0CASE ORDER BY Z0_TEST0;
z0_test0	Z0_TEST1	Z0_TEST2
NULL	NULL	0
		10
	 	20
	aa	1
	aa	1
abc ABC	abc ABC	1
123	中文字符@!#$%^	1
INSERT INTO  Z0CASE (z0_test0,z0_test1,Z0_TEST2)values(' ABC','aa',1);
SELECT * FROM Z0CASE ORDER BY Z0_TEST0;
z0_test0	Z0_TEST1	Z0_TEST2
NULL	NULL	0
		10
	 	20
	aa	1
	aa	1
	aa	1
abc ABC	abc ABC	1
123	中文字符@!#$%^	1
INSERT INTO  Z0CASE (z0_test0,z0_test1,Z0_TEST2)values('abc abc','aa',1);
SELECT * FROM Z0CASE ORDER BY Z0_TEST0;
z0_test0	Z0_TEST1	Z0_TEST2
NULL	NULL	0
		10
	 	20
	aa	1
	aa	1
	aa	1
abc ABC	abc ABC	1
abc ABC	aa	1
123	中文字符@!#$%^	1
INSERT INTO  Z0CASE (z0_test0,z0_test1,Z0_TEST2)values('ABC ABC','aa',1);
SELECT * FROM Z0CASE ORDER BY Z0_TEST0;
z0_test0	Z0_TEST1	Z0_TEST2
NULL	NULL	0
		10
	 	20
	aa	1
	aa	1
	aa	1
abc ABC	abc ABC	1
abc ABC	aa	1
abc ABC	aa	1
123	中文字符@!#$%^	1
INSERT INTO  Z0CASE (z0_test0,z0_test1,Z0_TEST2)values(null,'aa',1);
SELECT * FROM Z0CASE ORDER BY Z0_TEST0;
z0_test0	Z0_TEST1	Z0_TEST2
NULL	NULL	0
NULL	aa	1
		10
	 	20
	aa	1
	aa	1
	aa	1
abc ABC	abc ABC	1
abc ABC	aa	1
abc ABC	aa	1
123	中文字符@!#$%^	1
INSERT INTO  Z0CASE (z0_test0,z0_test1,Z0_TEST2)values(123,'BB',1);
SELECT * FROM Z0CASE ORDER BY Z0_TEST0;
z0_test0	Z0_TEST1	Z0_TEST2
NULL	NULL	0
NULL	aa	1
		10
	 	20
	aa	1
	aa	1
	aa	1
abc ABC	abc ABC	1
abc ABC	aa	1
abc ABC	aa	1
123	中文字符@!#$%^	1
abc ABC,123	BB	1
INSERT INTO  Z0CASE (z0_test0,z0_test1,Z0_TEST2)values(12 3,'aa',1);
ERROR 42000: You have an error in your SQL syntax; check the manual that corresponds to your OceanBase version for the right syntax to use near '3,'aa',1)' at line 1
INSERT INTO  Z0CASE (z0_test0,z0_test1,Z0_TEST2)values('123     ','BB',1);
SELECT * FROM Z0CASE ORDER BY Z0_TEST0;
z0_test0	Z0_TEST1	Z0_TEST2
NULL	NULL	0
NULL	aa	1
		10
	 	20
	aa	1
	aa	1
	aa	1
abc ABC	abc ABC	1
abc ABC	aa	1
abc ABC	aa	1
123	中文字符@!#$%^	1
123	BB	1
abc ABC,123	BB	1
INSERT INTO  Z0CASE (z0_test0,z0_test1,Z0_TEST2)values('12 3','BB',1);
SELECT * FROM Z0CASE ORDER BY Z0_TEST0;
z0_test0	Z0_TEST1	Z0_TEST2
NULL	NULL	0
NULL	aa	1
		10
	 	20
	aa	1
	aa	1
	aa	1
	BB	1
abc ABC	abc ABC	1
abc ABC	aa	1
abc ABC	aa	1
123	中文字符@!#$%^	1
123	BB	1
abc ABC,123	BB	1
UPDATE Z0CASE SET z0_test0='' WHERE z0_test2=0;
SELECT * FROM Z0CASE WHERE z0_test2=0 ORDER BY Z0_TEST0;
z0_test0	Z0_TEST1	Z0_TEST2
	NULL	0
UPDATE Z0CASE SET z0_test0='abc ' WHERE z0_test2=0;
SELECT * FROM Z0CASE WHERE z0_test2=0 ORDER BY Z0_TEST0;
z0_test0	Z0_TEST1	Z0_TEST2
	NULL	0
UPDATE Z0CASE SET z0_test0=' ABC ' WHERE z0_test2=0;
SELECT * FROM Z0CASE WHERE z0_test2=0 ORDER BY Z0_TEST0;
z0_test0	Z0_TEST1	Z0_TEST2
	NULL	0
UPDATE Z0CASE SET z0_test0='abc abc' WHERE z0_test2=0;
SELECT * FROM Z0CASE WHERE z0_test2=0 ORDER BY Z0_TEST0;
z0_test0	Z0_TEST1	Z0_TEST2
abc ABC	NULL	0
UPDATE Z0CASE SET z0_test0='ABC ABC' WHERE z0_test2=0;
SELECT * FROM Z0CASE WHERE z0_test2=0 ORDER BY Z0_TEST0;
z0_test0	Z0_TEST1	Z0_TEST2
abc ABC	NULL	0
UPDATE Z0CASE SET z0_test0=NULL WHERE z0_test2=0;
SELECT * FROM Z0CASE WHERE z0_test2=0 ORDER BY Z0_TEST0;
z0_test0	Z0_TEST1	Z0_TEST2
NULL	NULL	0
UPDATE Z0CASE SET z0_test0='12 3' WHERE z0_test2=0;
SELECT * FROM Z0CASE WHERE z0_test2=0 ORDER BY Z0_TEST0;
z0_test0	Z0_TEST1	Z0_TEST2
	NULL	0
UPDATE Z0CASE SET z0_test0='123     ' WHERE z0_test2=0;
SELECT * FROM Z0CASE WHERE z0_test2=0 ORDER BY Z0_TEST0;
z0_test0	Z0_TEST1	Z0_TEST2
123	NULL	0
DELETE FROM Z0CASE WHERE z0_test0='12 3';
SELECT * FROM Z0CASE ORDER BY Z0_TEST0;
z0_test0	Z0_TEST1	Z0_TEST2
NULL	aa	1
		10
	 	20
	aa	1
	aa	1
	aa	1
	BB	1
abc ABC	abc ABC	1
abc ABC	aa	1
abc ABC	aa	1
123	中文字符@!#$%^	1
123	NULL	0
123	BB	1
abc ABC,123	BB	1
DELETE FROM Z0CASE WHERE z0_test0='123     ';
DELETE FROM Z0CASE WHERE z0_test0='123';
SELECT * FROM Z0CASE ORDER BY Z0_TEST0;
z0_test0	Z0_TEST1	Z0_TEST2
NULL	aa	1
		10
	 	20
	aa	1
	aa	1
	aa	1
	BB	1
abc ABC	abc ABC	1
abc ABC	aa	1
abc ABC	aa	1
abc ABC,123	BB	1
DELETE FROM Z0CASE WHERE z0_test0='abc abc';
SELECT * FROM Z0CASE ORDER BY Z0_TEST0;
z0_test0	Z0_TEST1	Z0_TEST2
NULL	aa	1
		10
	 	20
	aa	1
	aa	1
	aa	1
	BB	1
abc ABC,123	BB	1
DELETE FROM Z0CASE WHERE z0_test0  IS NULL;
SELECT * FROM Z0CASE ORDER BY Z0_TEST0;
z0_test0	Z0_TEST1	Z0_TEST2
		10
	 	20
	aa	1
	aa	1
	aa	1
	BB	1
abc ABC,123	BB	1
char --> LONGBLOB/tinytext
DROP TABLE Z0CASE;
CREATE TABLE Z0CASE(Z0_TEST0 CHAR(100), Z0_TEST1 varchar(50),Z0_TEST2 int) ;
INSERT INTO  Z0CASE (z0_test0,z0_test1,Z0_TEST2)values('abc ABC','abc ABC',1);
INSERT INTO  Z0CASE (z0_test0,z0_test1,Z0_TEST2)values('123','中文字符@!#$%^',1);
INSERT INTO  Z0CASE (z0_test0,z0_test1,Z0_TEST2)values(NULL,NULL,0);
INSERT INTO  Z0CASE (z0_test0,z0_test1,Z0_TEST2)values('','',10);
INSERT INTO  Z0CASE (z0_test0,z0_test1,Z0_TEST2)values('    ',' ',20);
SELECT * FROM Z0CASE ORDER BY Z0_TEST0;
Z0_TEST0	Z0_TEST1	Z0_TEST2
NULL	NULL	0
		10
	 	20
123	中文字符@!#$%^	1
abc ABC	abc ABC	1
ALTER TABLE `Z0CASE` ADD INDEX z0_index ( `Z0_TEST0` ) STORING(Z0_TEST1) with column group(all columns, each column);
SELECT table_id,table_name FROM oceanbase.__all_virtual_table WHERE table_name='Z0CASE';
ALTER TABLE Z0CASE modify COLUMN  z0_test0 LONGBLOB;
ERROR 42000: The used storage engine can't index column 'z0_test0'
ALTER TABLE Z0CASE modify COLUMN  z0_test0 tinytext;
ERROR 42000: The used storage engine can't index column 'z0_test0'
char --> BIGINT
DROP TABLE Z0CASE;
CREATE TABLE Z0CASE(Z0_TEST0 CHAR(100), Z0_TEST1 varchar(50),Z0_TEST2 int) ;
INSERT INTO  Z0CASE (z0_test0,z0_test1,Z0_TEST2)values('11111.11111','abc ABC',1);
INSERT INTO  Z0CASE (z0_test0,z0_test1,Z0_TEST2)values('123','中文字符@!#$%^',1);
INSERT INTO  Z0CASE (z0_test0,z0_test1,Z0_TEST2)values(NULL,NULL,0);
INSERT INTO  Z0CASE (z0_test0,z0_test1,Z0_TEST2)values('000.0000',' ',20);
SELECT * FROM Z0CASE ORDER BY Z0_TEST0;
Z0_TEST0	Z0_TEST1	Z0_TEST2
NULL	NULL	0
000.0000	 	20
11111.11111	abc ABC	1
123	中文字符@!#$%^	1
ALTER TABLE `Z0CASE` ADD INDEX z0_index ( `Z0_TEST0` ) STORING(Z0_TEST1) with column group(all columns, each column);
SELECT table_id,table_name FROM oceanbase.__all_virtual_table WHERE table_name='Z0CASE';
ALTER TABLE Z0CASE modify COLUMN  z0_test0 BIGINT;
SELECT Z0_TEST0 FROM Z0CASE ORDER BY Z0_TEST0;
Z0_TEST0
NULL
0
123
11111
DESC Z0CASE;
Field	Type	Null	Key	Default	Extra
z0_test0	bigint(20)	YES	MUL	NULL	
Z0_TEST1	varchar(50)	YES		NULL	
Z0_TEST2	int(11)	YES		NULL	
SELECT table_id,table_name FROM oceanbase.__all_virtual_table WHERE table_name='Z0CASE';
char --> float
DROP TABLE Z0CASE;
CREATE TABLE Z0CASE(Z0_TEST0 CHAR(100), Z0_TEST1 varchar(50),Z0_TEST2 int) ;
INSERT INTO  Z0CASE (z0_test0,z0_test1,Z0_TEST2)values('11111.11111','abc ABC',1);
INSERT INTO  Z0CASE (z0_test0,z0_test1,Z0_TEST2)values('123','中文字符@!#$%^',1);
INSERT INTO  Z0CASE (z0_test0,z0_test1,Z0_TEST2)values(NULL,NULL,0);
INSERT INTO  Z0CASE (z0_test0,z0_test1,Z0_TEST2)values('000.0000',' ',20);
SELECT * FROM Z0CASE ORDER BY Z0_TEST0;
Z0_TEST0	Z0_TEST1	Z0_TEST2
NULL	NULL	0
000.0000	 	20
11111.11111	abc ABC	1
123	中文字符@!#$%^	1
ALTER TABLE `Z0CASE` ADD INDEX z0_index ( `Z0_TEST0` ) STORING(Z0_TEST1) with column group(all columns, each column);
SELECT table_id,table_name FROM oceanbase.__all_virtual_table WHERE table_name='Z0CASE';
ALTER TABLE Z0CASE modify COLUMN  z0_test0 float(24);
SELECT Z0_TEST0 FROM Z0CASE ORDER BY Z0_TEST0;
Z0_TEST0
NULL
0
123
11111.1
DESC Z0CASE;
Field	Type	Null	Key	Default	Extra
z0_test0	float	YES	MUL	NULL	
Z0_TEST1	varchar(50)	YES		NULL	
Z0_TEST2	int(11)	YES		NULL	
SELECT table_id,table_name FROM oceanbase.__all_virtual_table WHERE table_name='Z0CASE';
char --> date
DROP TABLE Z0CASE;
CREATE TABLE Z0CASE(Z0_TEST0 CHAR(100), Z0_TEST1 varchar(50),Z0_TEST2 int) ;
INSERT INTO  Z0CASE (z0_test0,z0_test1,Z0_TEST2)values('11111','abc ABC',1);
INSERT INTO  Z0CASE (z0_test0,z0_test1,Z0_TEST2)values('20111111','中文字符@!#$%^',1);
INSERT INTO  Z0CASE (z0_test0,z0_test1,Z0_TEST2)values(NULL,NULL,0);
INSERT INTO  Z0CASE (z0_test0,z0_test1,Z0_TEST2)values('000.0000',' ',20);
SELECT * FROM Z0CASE ORDER BY Z0_TEST0;
Z0_TEST0	Z0_TEST1	Z0_TEST2
NULL	NULL	0
000.0000	 	20
11111	abc ABC	1
20111111	中文字符@!#$%^	1
ALTER TABLE `Z0CASE` ADD INDEX z0_index ( `Z0_TEST0` ) STORING(Z0_TEST1) with column group(all columns, each column);
SELECT table_id,table_name FROM oceanbase.__all_virtual_table WHERE table_name='Z0CASE';
ALTER TABLE Z0CASE modify COLUMN  z0_test0 date;
SELECT Z0_TEST0 FROM Z0CASE ORDER BY Z0_TEST0;
Z0_TEST0
NULL
0000-00-00
2011-11-01
2011-11-11
DESC Z0CASE;
Field	Type	Null	Key	Default	Extra
z0_test0	date	YES	MUL	NULL	
Z0_TEST1	varchar(50)	YES		NULL	
Z0_TEST2	int(11)	YES		NULL	
SELECT table_id,table_name FROM oceanbase.__all_virtual_table WHERE table_name='Z0CASE';
varchar -->char
DROP TABLE Z0CASE;
CREATE TABLE Z0CASE(Z0_TEST0 varchar(100)) ;
INSERT INTO  Z0CASE (z0_test0)values('abc ABC');
INSERT INTO  Z0CASE (z0_test0)values('123');
INSERT INTO  Z0CASE (z0_test0)values(NULL);
INSERT INTO  Z0CASE (z0_test0)values('');
INSERT INTO  Z0CASE (z0_test0)values('    ');
SELECT * FROM Z0CASE ORDER BY Z0_TEST0;
Z0_TEST0
NULL

    
123
abc ABC
ALTER TABLE `Z0CASE` ADD INDEX z0_index ( `Z0_TEST0` ) with column group(all columns, each column);
SELECT table_id,table_name FROM oceanbase.__all_virtual_table WHERE table_name='Z0CASE';
ALTER TABLE Z0CASE modify COLUMN  z0_test0 char(100);
SELECT Z0_TEST0 FROM Z0CASE ORDER BY Z0_TEST0;
Z0_TEST0
NULL


123
abc ABC
DESC Z0CASE;
Field	Type	Null	Key	Default	Extra
z0_test0	char(100)	YES	MUL	NULL	
SELECT table_id,table_name FROM oceanbase.__all_virtual_table WHERE table_name='Z0CASE';
ALTER TABLE Z0CASE modify COLUMN  z0_test0 char(99);
SELECT Z0_TEST0 FROM Z0CASE ORDER BY Z0_TEST0;
Z0_TEST0
NULL


123
abc ABC
DESC Z0CASE;
Field	Type	Null	Key	Default	Extra
z0_test0	char(99)	YES	MUL	NULL	
SELECT table_id,table_name FROM oceanbase.__all_virtual_table WHERE table_name='Z0CASE';
varchar -->varchar
DROP TABLE Z0CASE;
CREATE TABLE Z0CASE(Z0_TEST0 varchar(100)) ;
INSERT INTO  Z0CASE (z0_test0)values('abc ABC');
INSERT INTO  Z0CASE (z0_test0)values('123');
INSERT INTO  Z0CASE (z0_test0)values(NULL);
INSERT INTO  Z0CASE (z0_test0)values('');
INSERT INTO  Z0CASE (z0_test0)values('    ');
SELECT * FROM Z0CASE ORDER BY Z0_TEST0;
Z0_TEST0
NULL

    
123
abc ABC
ALTER TABLE `Z0CASE` ADD INDEX z0_index ( `Z0_TEST0` ) with column group(all columns, each column);
SELECT table_id,table_name FROM oceanbase.__all_virtual_table WHERE table_name='Z0CASE';
ALTER TABLE Z0CASE modify COLUMN  z0_test0 varchar(99);
SELECT Z0_TEST0 FROM Z0CASE ORDER BY Z0_TEST0;
Z0_TEST0
NULL

    
123
abc ABC
DESC Z0CASE;
Field	Type	Null	Key	Default	Extra
z0_test0	varchar(99)	YES	MUL	NULL	
SELECT table_id,table_name FROM oceanbase.__all_virtual_table WHERE table_name='Z0CASE';
varchar -->set
DROP TABLE Z0CASE;
CREATE TABLE Z0CASE(Z0_TEST0 varchar(100)) ;
INSERT INTO  Z0CASE (z0_test0)values('abc ABC');
INSERT INTO  Z0CASE (z0_test0)values('123');
INSERT INTO  Z0CASE (z0_test0)values(NULL);
INSERT INTO  Z0CASE (z0_test0)values('');
INSERT INTO  Z0CASE (z0_test0)values('    ');
SELECT * FROM Z0CASE ORDER BY Z0_TEST0;
Z0_TEST0
NULL

    
123
abc ABC
ALTER TABLE `Z0CASE` ADD INDEX z0_index ( `Z0_TEST0` ) with column group(all columns, each column);
SELECT table_id,table_name FROM oceanbase.__all_virtual_table WHERE table_name='Z0CASE';
ALTER TABLE Z0CASE modify COLUMN  z0_test0 set('abc ABC','123','');
SELECT Z0_TEST0 FROM Z0CASE ORDER BY Z0_TEST0;
Z0_TEST0
NULL

abc ABC
123

DESC Z0CASE;
Field	Type	Null	Key	Default	Extra
z0_test0	set('abc ABC','123','')	YES	MUL	NULL	
SELECT table_id,table_name FROM oceanbase.__all_virtual_table WHERE table_name='Z0CASE';
varchar -->tinytext
DROP TABLE Z0CASE;
CREATE TABLE Z0CASE(Z0_TEST0 varchar(100)) ;
INSERT INTO  Z0CASE (z0_test0)values('abc ABC');
INSERT INTO  Z0CASE (z0_test0)values('123');
INSERT INTO  Z0CASE (z0_test0)values(NULL);
INSERT INTO  Z0CASE (z0_test0)values('');
INSERT INTO  Z0CASE (z0_test0)values('    ');
SELECT * FROM Z0CASE ORDER BY Z0_TEST0;
Z0_TEST0
NULL

    
123
abc ABC
ALTER TABLE `Z0CASE` ADD INDEX z0_index ( `Z0_TEST0` ) with column group(all columns, each column);
SELECT table_id,table_name FROM oceanbase.__all_virtual_table WHERE table_name='Z0CASE';
ALTER TABLE Z0CASE modify COLUMN  z0_test0 tinytext;
ERROR 42000: The used storage engine can't index column 'z0_test0'
varchar -->float
DROP TABLE Z0CASE;
CREATE TABLE Z0CASE(Z0_TEST0 varchar(100)) ;
INSERT INTO  Z0CASE (z0_test0)values('111.111');
INSERT INTO  Z0CASE (z0_test0)values('123');
INSERT INTO  Z0CASE (z0_test0)values(NULL);
SELECT * FROM Z0CASE ORDER BY Z0_TEST0;
Z0_TEST0
NULL
111.111
123
ALTER TABLE `Z0CASE` ADD INDEX z0_index ( `Z0_TEST0` ) with column group(all columns, each column);
SELECT table_id,table_name FROM oceanbase.__all_virtual_table WHERE table_name='Z0CASE';
ALTER TABLE Z0CASE modify COLUMN  z0_test0 float(25);
SELECT Z0_TEST0 FROM Z0CASE ORDER BY Z0_TEST0;
Z0_TEST0
NULL
111.111
123
DESC Z0CASE;
Field	Type	Null	Key	Default	Extra
z0_test0	double	YES	MUL	NULL	
SELECT table_id,table_name FROM oceanbase.__all_virtual_table WHERE table_name='Z0CASE';
set -->char/varchar
DROP TABLE Z0CASE;
CREATE TABLE Z0CASE(Z0_TEST0 set('abc ABC','123','')) ;
INSERT INTO  Z0CASE (z0_test0)values('abc ABC');
INSERT INTO  Z0CASE (z0_test0)values('123');
INSERT INTO  Z0CASE (z0_test0)values(NULL);
INSERT INTO  Z0CASE (z0_test0)values('');
INSERT INTO  Z0CASE (z0_test0)values('    ');
SELECT * FROM Z0CASE ORDER BY Z0_TEST0;
Z0_TEST0
NULL

abc ABC
123

ALTER TABLE `Z0CASE` ADD INDEX z0_index ( `Z0_TEST0` ) with column group(all columns, each column);
SELECT table_id,table_name FROM oceanbase.__all_virtual_table WHERE table_name='Z0CASE';
ALTER TABLE Z0CASE modify COLUMN  z0_test0 char(100);
SELECT Z0_TEST0 FROM Z0CASE ORDER BY Z0_TEST0;
Z0_TEST0
NULL


123
abc ABC
DESC Z0CASE;
Field	Type	Null	Key	Default	Extra
z0_test0	char(100)	YES	MUL	NULL	
SELECT table_id,table_name FROM oceanbase.__all_virtual_table WHERE table_name='Z0CASE';
DROP TABLE Z0CASE;
CREATE TABLE Z0CASE(Z0_TEST0 set('abc ABC','123','')) ;
INSERT INTO  Z0CASE (z0_test0)values('abc ABC');
INSERT INTO  Z0CASE (z0_test0)values('123');
INSERT INTO  Z0CASE (z0_test0)values(NULL);
INSERT INTO  Z0CASE (z0_test0)values('');
INSERT INTO  Z0CASE (z0_test0)values('    ');
SELECT * FROM Z0CASE ORDER BY Z0_TEST0;
Z0_TEST0
NULL

abc ABC
123

ALTER TABLE `Z0CASE` ADD INDEX z0_index ( `Z0_TEST0` ) with column group(all columns, each column);
SELECT table_id,table_name FROM oceanbase.__all_virtual_table WHERE table_name='Z0CASE';
ALTER TABLE Z0CASE modify COLUMN  z0_test0 varchar(100);
SELECT Z0_TEST0 FROM Z0CASE ORDER BY Z0_TEST0;
Z0_TEST0
NULL


123
abc ABC
DESC Z0CASE;
Field	Type	Null	Key	Default	Extra
z0_test0	varchar(100)	YES	MUL	NULL	
SELECT table_id,table_name FROM oceanbase.__all_virtual_table WHERE table_name='Z0CASE';
set --> float
DROP TABLE Z0CASE;
CREATE TABLE Z0CASE(Z0_TEST0 set('abc ABC','123','')) ;
INSERT INTO  Z0CASE (z0_test0)values('123');
SELECT * FROM Z0CASE ORDER BY Z0_TEST0;
Z0_TEST0
123
ALTER TABLE `Z0CASE` ADD INDEX z0_index ( `Z0_TEST0` ) with column group(all columns, each column);
SELECT table_id,table_name FROM oceanbase.__all_virtual_table WHERE table_name='Z0CASE';
ALTER TABLE Z0CASE modify COLUMN  z0_test0 float(25);
SELECT Z0_TEST0 FROM Z0CASE ORDER BY Z0_TEST0;
Z0_TEST0
2
DESC Z0CASE;
Field	Type	Null	Key	Default	Extra
z0_test0	double	YES	MUL	NULL	
SELECT table_id,table_name FROM oceanbase.__all_virtual_table WHERE table_name='Z0CASE';
TINYINT/ SMALLINT/ MEDIUMINT	/ INT/ BIGINT
DROP TABLE Z0CASE;
CREATE TABLE Z0CASE(Z0_TEST0 tinyint,Z0_TEST1 int,Z0_TEST2 mediumint,z0_test3 bigint) ;
INSERT INTO  Z0CASE (z0_test0,z0_test1,Z0_TEST2,z0_test3)values(111,111,111,111);
INSERT INTO  Z0CASE (z0_test0,z0_test1,Z0_TEST2,z0_test3)values('0','0','0','0');
INSERT INTO  Z0CASE (z0_test0,z0_test1,Z0_TEST2,z0_test3)values(NULL,NULL,null,NULL);
INSERT INTO  Z0CASE (z0_test0,z0_test1,Z0_TEST2,z0_test3)values(2.222,222.222,222.222,222.222);
SELECT * FROM Z0CASE ORDER BY Z0_TEST0;
Z0_TEST0	Z0_TEST1	Z0_TEST2	z0_test3
NULL	NULL	NULL	NULL
0	0	0	0
2	222	222	222
111	111	111	111
ALTER TABLE `Z0CASE` ADD INDEX z0_index ( `Z0_TEST0` ) with column group(all columns, each column);
SELECT table_id,table_name FROM oceanbase.__all_virtual_table WHERE table_name='Z0CASE';
ALTER TABLE Z0CASE modify COLUMN  z0_test0 tinyint;
SELECT Z0_TEST0 FROM Z0CASE ORDER BY Z0_TEST0;
Z0_TEST0
NULL
0
2
111
DESC Z0CASE;
Field	Type	Null	Key	Default	Extra
z0_test0	tinyint(4)	YES	MUL	NULL	
Z0_TEST1	int(11)	YES		NULL	
Z0_TEST2	mediumint(9)	YES		NULL	
z0_test3	bigint(20)	YES		NULL	
SELECT table_id,table_name FROM oceanbase.__all_virtual_table WHERE table_name='Z0CASE';
ALTER TABLE Z0CASE modify COLUMN  z0_test0 int;
SELECT Z0_TEST0 FROM Z0CASE ORDER BY Z0_TEST0;
Z0_TEST0
NULL
0
2
111
DESC Z0CASE;
Field	Type	Null	Key	Default	Extra
z0_test0	int(11)	YES	MUL	NULL	
Z0_TEST1	int(11)	YES		NULL	
Z0_TEST2	mediumint(9)	YES		NULL	
z0_test3	bigint(20)	YES		NULL	
SELECT table_id,table_name FROM oceanbase.__all_virtual_table WHERE table_name='Z0CASE';
ALTER TABLE Z0CASE modify COLUMN  z0_test0 mediumint;
SELECT Z0_TEST0 FROM Z0CASE ORDER BY Z0_TEST0;
Z0_TEST0
NULL
0
2
111
DESC Z0CASE;
Field	Type	Null	Key	Default	Extra
z0_test0	mediumint(9)	YES	MUL	NULL	
Z0_TEST1	int(11)	YES		NULL	
Z0_TEST2	mediumint(9)	YES		NULL	
z0_test3	bigint(20)	YES		NULL	
SELECT table_id,table_name FROM oceanbase.__all_virtual_table WHERE table_name='Z0CASE';
ALTER TABLE Z0CASE modify COLUMN  z0_test0 bigint;
SELECT Z0_TEST0 FROM Z0CASE ORDER BY Z0_TEST0;
Z0_TEST0
NULL
0
2
111
DESC Z0CASE;
Field	Type	Null	Key	Default	Extra
z0_test0	bigint(20)	YES	MUL	NULL	
Z0_TEST1	int(11)	YES		NULL	
Z0_TEST2	mediumint(9)	YES		NULL	
z0_test3	bigint(20)	YES		NULL	
SELECT table_id,table_name FROM oceanbase.__all_virtual_table WHERE table_name='Z0CASE';
ALTER TABLE Z0CASE modify COLUMN  z0_test0 float(10);
SELECT Z0_TEST0 FROM Z0CASE ORDER BY Z0_TEST0;
Z0_TEST0
NULL
0
2
111
DESC Z0CASE;
Field	Type	Null	Key	Default	Extra
z0_test0	float	YES	MUL	NULL	
Z0_TEST1	int(11)	YES		NULL	
Z0_TEST2	mediumint(9)	YES		NULL	
z0_test3	bigint(20)	YES		NULL	
SELECT table_id,table_name FROM oceanbase.__all_virtual_table WHERE table_name='Z0CASE';
date-->datetime/char
DROP TABLE Z0CASE;
CREATE TABLE Z0CASE(Z0_TEST0 date) ;
INSERT INTO  Z0CASE (z0_test0)values('2011-11-11 11:11:11');
SELECT * FROM Z0CASE ORDER BY Z0_TEST0;
Z0_TEST0
2011-11-11
ALTER TABLE `Z0CASE` ADD INDEX z0_index ( `Z0_TEST0` ) with column group(all columns, each column);
SELECT table_id,table_name FROM oceanbase.__all_virtual_table WHERE table_name='Z0CASE';
ALTER TABLE Z0CASE modify COLUMN  z0_test0 datetime;
SELECT Z0_TEST0 FROM Z0CASE ORDER BY Z0_TEST0;
Z0_TEST0
2011-11-11 00:00:00
DESC Z0CASE;
Field	Type	Null	Key	Default	Extra
z0_test0	datetime	YES	MUL	NULL	
SELECT table_id,table_name FROM oceanbase.__all_virtual_table WHERE table_name='Z0CASE';
INSERT INTO  Z0CASE (z0_test0)values('2021-11-11 11:11:11');
SELECT * FROM Z0CASE ORDER BY Z0_TEST0;
z0_test0
2011-11-11 00:00:00
2021-11-11 11:11:11
INSERT INTO  Z0CASE (z0_test0)values('2021-12-12 11:11:12.5678');
SELECT * FROM Z0CASE ORDER BY Z0_TEST0;
z0_test0
2011-11-11 00:00:00
2021-11-11 11:11:11
2021-12-12 11:11:13
INSERT INTO  Z0CASE (z0_test0)values('2021-11-21');
SELECT * FROM Z0CASE ORDER BY Z0_TEST0;
z0_test0
2011-11-11 00:00:00
2021-11-11 11:11:11
2021-11-21 00:00:00
2021-12-12 11:11:13
INSERT INTO  Z0CASE (z0_test0)values('2021');
SELECT * FROM Z0CASE ORDER BY Z0_TEST0;
z0_test0
0000-00-00 00:00:00
2011-11-11 00:00:00
2021-11-11 11:11:11
2021-11-21 00:00:00
2021-12-12 11:11:13
INSERT INTO  Z0CASE (z0_test0)values('20210121000000');
SELECT * FROM Z0CASE ORDER BY Z0_TEST0;
z0_test0
0000-00-00 00:00:00
2011-11-11 00:00:00
2021-01-21 00:00:00
2021-11-11 11:11:11
2021-11-21 00:00:00
2021-12-12 11:11:13
INSERT INTO  Z0CASE (z0_test0)values(20210121111214);
SELECT * FROM Z0CASE ORDER BY Z0_TEST0;
z0_test0
0000-00-00 00:00:00
2011-11-11 00:00:00
2021-01-21 00:00:00
2021-01-21 11:12:14
2021-11-11 11:11:11
2021-11-21 00:00:00
2021-12-12 11:11:13
UPDATE Z0CASE SET z0_test0='2021-01-31'  WHERE z0_test0='2021-01-21 00:00:00';
SELECT * FROM Z0CASE ORDER BY Z0_TEST0;
z0_test0
0000-00-00 00:00:00
2011-11-11 00:00:00
2021-01-21 11:12:14
2021-01-31 00:00:00
2021-11-11 11:11:11
2021-11-21 00:00:00
2021-12-12 11:11:13
UPDATE Z0CASE SET z0_test0='2021'  WHERE z0_test0='2021-01-31 00:00:00';
SELECT * FROM Z0CASE ORDER BY Z0_TEST0;
z0_test0
0000-00-00 00:00:00
0000-00-00 00:00:00
2011-11-11 00:00:00
2021-01-21 11:12:14
2021-11-11 11:11:11
2021-11-21 00:00:00
2021-12-12 11:11:13
UPDATE Z0CASE SET z0_test0='2018-10-31 12:11:01'  WHERE z0_test0='2021-01-31 00:00:00';
SELECT * FROM Z0CASE ORDER BY Z0_TEST0;
z0_test0
0000-00-00 00:00:00
0000-00-00 00:00:00
2011-11-11 00:00:00
2021-01-21 11:12:14
2021-11-11 11:11:11
2021-11-21 00:00:00
2021-12-12 11:11:13
UPDATE Z0CASE SET z0_test0='2018-11-11 12:11:11.576899'  WHERE z0_test0='2018-10-31 12:11:01';
SELECT * FROM Z0CASE ORDER BY Z0_TEST0;
z0_test0
0000-00-00 00:00:00
0000-00-00 00:00:00
2011-11-11 00:00:00
2021-01-21 11:12:14
2021-11-11 11:11:11
2021-11-21 00:00:00
2021-12-12 11:11:13
UPDATE Z0CASE SET z0_test0='20180101010101'  WHERE z0_test0='2021-12-12 11:11:13';
SELECT * FROM Z0CASE ORDER BY Z0_TEST0;
z0_test0
0000-00-00 00:00:00
0000-00-00 00:00:00
2011-11-11 00:00:00
2018-01-01 01:01:01
2021-01-21 11:12:14
2021-11-11 11:11:11
2021-11-21 00:00:00
DELETE FROM Z0CASE WHERE z0_test0='2011-11-11';
SELECT * FROM Z0CASE ORDER BY Z0_TEST0;
z0_test0
0000-00-00 00:00:00
0000-00-00 00:00:00
2018-01-01 01:01:01
2021-01-21 11:12:14
2021-11-11 11:11:11
2021-11-21 00:00:00
DELETE FROM Z0CASE WHERE z0_test0='2018-01-01 01:01:01';
SELECT * FROM Z0CASE ORDER BY Z0_TEST0;
z0_test0
0000-00-00 00:00:00
0000-00-00 00:00:00
2021-01-21 11:12:14
2021-11-11 11:11:11
2021-11-21 00:00:00
DELETE FROM Z0CASE WHERE z0_test0='2018';
DELETE FROM Z0CASE WHERE z0_test0='20181111121112';
SELECT * FROM Z0CASE ORDER BY Z0_TEST0;
z0_test0
2021-01-21 11:12:14
2021-11-11 11:11:11
2021-11-21 00:00:00
ALTER TABLE Z0CASE modify COLUMN  z0_test0 char(100);
SELECT Z0_TEST0 FROM Z0CASE ORDER BY Z0_TEST0;
Z0_TEST0
2021-01-21 11:12:14
2021-11-11 11:11:11
2021-11-21 00:00:00
DESC Z0CASE;
Field	Type	Null	Key	Default	Extra
z0_test0	char(100)	YES	MUL	NULL	
SELECT table_id,table_name FROM oceanbase.__all_virtual_table WHERE table_name='Z0CASE';
唯一索引
char --> char/varchar
DROP TABLE Z0CASE;
CREATE TABLE Z0CASE(Z0_TEST0 char(100)) ;
INSERT INTO  Z0CASE (z0_test0)values('1111.111');
INSERT INTO  Z0CASE (z0_test0)values('1111.111111');
SELECT * FROM Z0CASE ORDER BY Z0_TEST0;
Z0_TEST0
1111.111
1111.111111
ALTER TABLE `Z0CASE` ADD unique INDEX z0_index ( `Z0_TEST0` ) with column group(all columns, each column);
SELECT table_id,table_name FROM oceanbase.__all_virtual_table WHERE table_name='Z0CASE';
ALTER TABLE Z0CASE modify COLUMN  z0_test0 char(99);
SELECT Z0_TEST0 FROM Z0CASE ORDER BY Z0_TEST0;
Z0_TEST0
1111.111
1111.111111
DESC Z0CASE;
Field	Type	Null	Key	Default	Extra
z0_test0	char(99)	YES	UNI	NULL	
SELECT table_id,table_name FROM oceanbase.__all_virtual_table WHERE table_name='Z0CASE';
ALTER TABLE Z0CASE modify COLUMN  z0_test0 varchar(99);
SELECT Z0_TEST0 FROM Z0CASE ORDER BY Z0_TEST0;
Z0_TEST0
1111.111
1111.111111
DESC Z0CASE;
Field	Type	Null	Key	Default	Extra
z0_test0	varchar(99)	YES	UNI	NULL	
SELECT table_id,table_name FROM oceanbase.__all_virtual_table WHERE table_name='Z0CASE';
char --> text/set
DROP TABLE Z0CASE;
CREATE TABLE Z0CASE(Z0_TEST0 char(100)) ;
INSERT INTO  Z0CASE (z0_test0)values('1111.111');
INSERT INTO  Z0CASE (z0_test0)values('1111.111111');
SELECT * FROM Z0CASE ORDER BY Z0_TEST0;
Z0_TEST0
1111.111
1111.111111
ALTER TABLE `Z0CASE` ADD unique INDEX z0_index ( `Z0_TEST0` ) with column group(all columns, each column);
SELECT table_id,table_name FROM oceanbase.__all_virtual_table WHERE table_name='Z0CASE';
ALTER TABLE Z0CASE modify COLUMN  z0_test0 text;
ERROR 42000: The used storage engine can't index column 'z0_test0'
ALTER TABLE Z0CASE modify COLUMN  z0_test0 set('1111.111','1111.111111');
SELECT Z0_TEST0 FROM Z0CASE ORDER BY Z0_TEST0;
Z0_TEST0
1111.111
1111.111111
DESC Z0CASE;
Field	Type	Null	Key	Default	Extra
z0_test0	set('1111.111','1111.111111')	YES	UNI	NULL	
SELECT table_id,table_name FROM oceanbase.__all_virtual_table WHERE table_name='Z0CASE';
char--> datetime
DROP TABLE Z0CASE;
CREATE TABLE Z0CASE(Z0_TEST0 char(100)) ;
INSERT INTO  Z0CASE (z0_test0)values('2011-11-11 11:11:11');
INSERT INTO  Z0CASE (z0_test0)values('2011-11-11');
INSERT INTO  Z0CASE (z0_test0)values('20111111');
SELECT * FROM Z0CASE ORDER BY Z0_TEST0;
Z0_TEST0
2011-11-11
2011-11-11 11:11:11
20111111
ALTER TABLE `Z0CASE` ADD unique INDEX z0_index ( `Z0_TEST0` ) with column group(all columns, each column);
SELECT table_id,table_name FROM oceanbase.__all_virtual_table WHERE table_name='Z0CASE';
ALTER TABLE Z0CASE modify COLUMN  z0_test0 datetime;
ERROR 23000: Duplicated primary key
DROP TABLE Z0CASE;
CREATE TABLE Z0CASE(Z0_TEST0 char(100)) ;
INSERT INTO  Z0CASE (z0_test0)values('2011-11-11 11:11:11');
INSERT INTO  Z0CASE (z0_test0)values('2011-11-11');
INSERT INTO  Z0CASE (z0_test0)values('20121111');
SELECT * FROM Z0CASE ORDER BY Z0_TEST0;
Z0_TEST0
2011-11-11
2011-11-11 11:11:11
20121111
ALTER TABLE `Z0CASE` ADD unique INDEX z0_index ( `Z0_TEST0` ) with column group(all columns, each column);
SELECT table_id,table_name FROM oceanbase.__all_virtual_table WHERE table_name='Z0CASE';
ALTER TABLE Z0CASE modify COLUMN  z0_test0 datetime;
SELECT Z0_TEST0 FROM Z0CASE ORDER BY Z0_TEST0;
Z0_TEST0
2011-11-11 00:00:00
2011-11-11 11:11:11
2012-11-11 00:00:00
DESC Z0CASE;
Field	Type	Null	Key	Default	Extra
z0_test0	datetime	YES	UNI	NULL	
SELECT table_id,table_name FROM oceanbase.__all_virtual_table WHERE table_name='Z0CASE';
varchar--> int
DROP TABLE Z0CASE;
CREATE TABLE Z0CASE(Z0_TEST0 varchar(100)) ;
INSERT INTO  Z0CASE (z0_test0)values('1111.111');
INSERT INTO  Z0CASE (z0_test0)values('1111.111111');
SELECT * FROM Z0CASE ORDER BY Z0_TEST0;
Z0_TEST0
1111.111
1111.111111
ALTER TABLE `Z0CASE` ADD unique INDEX z0_index ( `Z0_TEST0` ) with column group(all columns, each column);
SELECT table_id,table_name FROM oceanbase.__all_virtual_table WHERE table_name='Z0CASE';
ALTER TABLE Z0CASE modify COLUMN  z0_test0 int;
ERROR 23000: Duplicated primary key
DROP TABLE Z0CASE;
CREATE TABLE Z0CASE(Z0_TEST0 varchar(100)) ;
INSERT INTO  Z0CASE (z0_test0)values('1111.111');
INSERT INTO  Z0CASE (z0_test0)values('1112.111111');
SELECT * FROM Z0CASE ORDER BY Z0_TEST0;
Z0_TEST0
1111.111
1112.111111
ALTER TABLE `Z0CASE` ADD unique INDEX z0_index ( `Z0_TEST0` ) with column group(all columns, each column);
SELECT table_id,table_name FROM oceanbase.__all_virtual_table WHERE table_name='Z0CASE';
ALTER TABLE Z0CASE modify COLUMN  z0_test0 int;
SELECT Z0_TEST0 FROM Z0CASE ORDER BY Z0_TEST0;
Z0_TEST0
1111
1112
DESC Z0CASE;
Field	Type	Null	Key	Default	Extra
z0_test0	int(11)	YES	UNI	NULL	
SELECT table_id,table_name FROM oceanbase.__all_virtual_table WHERE table_name='Z0CASE';
联合索引
char-->char/varchar
DROP TABLE Z0CASE;
CREATE TABLE Z0CASE(Z0_TEST0 char(100),Z0_TEST1 char(100)) ;
INSERT INTO  Z0CASE (z0_test0,Z0_TEST1)values('1111.111','1111.111');
INSERT INTO  Z0CASE (z0_test0,Z0_TEST1)values('1111.111111','1111.111111');
SELECT * FROM Z0CASE ORDER BY Z0_TEST0;
Z0_TEST0	Z0_TEST1
1111.111	1111.111
1111.111111	1111.111111
ALTER TABLE `Z0CASE` ADD  INDEX z0_index ( Z0_TEST1, Z0_TEST0) with column group(all columns, each column);
SELECT table_id,table_name FROM oceanbase.__all_virtual_table WHERE table_name='Z0CASE';
ALTER TABLE Z0CASE modify COLUMN  z0_test0 char(99);
SELECT Z0_TEST0 FROM Z0CASE ORDER BY Z0_TEST0;
Z0_TEST0
1111.111
1111.111111
DESC Z0CASE;
Field	Type	Null	Key	Default	Extra
z0_test0	char(99)	YES		NULL	
Z0_TEST1	char(100)	YES	MUL	NULL	
SELECT table_id,table_name FROM oceanbase.__all_virtual_table WHERE table_name='Z0CASE';
ALTER TABLE Z0CASE modify COLUMN  z0_test0  varchar(99);
SELECT Z0_TEST0 FROM Z0CASE ORDER BY Z0_TEST0;
Z0_TEST0
1111.111
1111.111111
DESC Z0CASE;
Field	Type	Null	Key	Default	Extra
z0_test0	varchar(99)	YES		NULL	
Z0_TEST1	char(100)	YES	MUL	NULL	
SELECT table_id,table_name FROM oceanbase.__all_virtual_table WHERE table_name='Z0CASE';
char-->INT
DROP TABLE Z0CASE;
CREATE TABLE Z0CASE(Z0_TEST0 char(100),Z0_TEST1 char(100)) ;
INSERT INTO  Z0CASE (z0_test0,Z0_TEST1)values('1111.111','1111.111');
INSERT INTO  Z0CASE (z0_test0,Z0_TEST1)values('1111.111111','1111.111111');
SELECT * FROM Z0CASE ORDER BY Z0_TEST0;
Z0_TEST0	Z0_TEST1
1111.111	1111.111
1111.111111	1111.111111
ALTER TABLE `Z0CASE` ADD  INDEX z0_index ( `Z0_TEST0`, Z0_TEST1) with column group(all columns, each column);
SELECT table_id,table_name FROM oceanbase.__all_virtual_table WHERE table_name='Z0CASE';
ALTER TABLE Z0CASE modify COLUMN  z0_test0 INT;
SELECT Z0_TEST0 FROM Z0CASE ORDER BY Z0_TEST0;
Z0_TEST0
1111
1111
DESC Z0CASE;
Field	Type	Null	Key	Default	Extra
z0_test0	int(11)	YES	MUL	NULL	
Z0_TEST1	char(100)	YES		NULL	
SELECT table_id,table_name FROM oceanbase.__all_virtual_table WHERE table_name='Z0CASE';
char-->TEXT/DATE
DROP TABLE Z0CASE;
CREATE TABLE Z0CASE(Z0_TEST0 char(100),Z0_TEST1 char(100)) ;
INSERT INTO  Z0CASE (z0_test0,Z0_TEST1)values('1111.111','1111.111');
INSERT INTO  Z0CASE (z0_test0,Z0_TEST1)values('1111.111111','1111.111111');
SELECT * FROM Z0CASE ORDER BY Z0_TEST0;
Z0_TEST0	Z0_TEST1
1111.111	1111.111
1111.111111	1111.111111
ALTER TABLE `Z0CASE` ADD  INDEX z0_index ( `Z0_TEST0`, Z0_TEST1) with column group(all columns, each column);
SELECT table_id,table_name FROM oceanbase.__all_virtual_table WHERE table_name='Z0CASE';
ALTER TABLE Z0CASE modify COLUMN  z0_test0 TEXT;
ERROR 42000: The used storage engine can't index column 'z0_test0'
ALTER TABLE Z0CASE modify COLUMN  z0_test0 DATE;
SELECT Z0_TEST0 FROM Z0CASE ORDER BY Z0_TEST0;
Z0_TEST0
1111-11-01
1111-11-11
DESC Z0CASE;
Field	Type	Null	Key	Default	Extra
z0_test0	date	YES	MUL	NULL	
Z0_TEST1	char(100)	YES		NULL	
SELECT table_id,table_name FROM oceanbase.__all_virtual_table WHERE table_name='Z0CASE';
DROP TABLE Z0CASE;
SET sql_mode='STRICT_TRANS_TABLES,STRICT_ALL_TABLES';
