SET sql_mode='';

DROP TABLE IF EXISTS Z0CASE;
DROP TABLE IF EXISTS Z1CASE;
二进制 --> 字符型
CREATE TABLE Z0CASE(Z0_TEST0 BIT(40)) with column group (all columns, each column);
INSERT INTO Z0CASE VALUES(b'0101010101010101010111011101010101010101');
SELECT BIN(Z0_TEST0) FROM Z0CASE;
BIN(Z0_TEST0)
101010101010101010111011101010101010101
ALTER TABLE Z0CASE MODIFY column z0_test0 CHAR(12);
SELECT * FROM Z0CASE;
z0_test0
366504432981
DESC Z0CASE;
Field	Type	Null	Key	Default	Extra
z0_test0	char(12)	YES		NULL	
SELECT table_id,table_name FROM oceanbase.__all_virtual_table WHERE table_name='Z0CASE';
DROP TABLE Z0CASE;
CREATE TABLE Z0CASE(Z0_TEST0 BIT(40)) with column group (all columns, each column);
INSERT INTO Z0CASE VALUES(b'0101010101010101010111011101010101010101');
SELECT BIN(Z0_TEST0) FROM Z0CASE;
BIN(Z0_TEST0)
101010101010101010111011101010101010101
ALTER TABLE Z0CASE MODIFY column z0_test0 VARCHAR(12);
SELECT * FROM Z0CASE;
z0_test0
366504432981
DESC Z0CASE;
Field	Type	Null	Key	Default	Extra
z0_test0	varchar(12)	YES		NULL	
SELECT table_id,table_name FROM oceanbase.__all_virtual_table WHERE table_name='Z0CASE';
DROP TABLE Z0CASE;
CREATE TABLE Z0CASE(Z0_TEST0 BIT(10)) with column group (all columns, each column);
INSERT INTO Z0CASE VALUES(b'0101010101');
SELECT BIN(Z0_TEST0) FROM Z0CASE;
BIN(Z0_TEST0)
101010101
SELECT table_id,table_name FROM oceanbase.__all_virtual_table WHERE table_name='Z0CASE';
ALTER TABLE Z0CASE MODIFY column z0_test0 TEXT;
SELECT * FROM Z0CASE;
z0_test0
341
DESC Z0CASE;
Field	Type	Null	Key	Default	Extra
z0_test0	text	YES		NULL	
SELECT table_id,table_name FROM oceanbase.__all_virtual_table WHERE table_name='Z0CASE';
DROP TABLE Z0CASE;
CREATE TABLE Z0CASE(Z0_TEST0 BIT(10)) with column group (all columns, each column);
INSERT INTO Z0CASE VALUES(b'0101010101');
SELECT BIN(Z0_TEST0) FROM Z0CASE;
BIN(Z0_TEST0)
101010101
SELECT table_id,table_name FROM oceanbase.__all_virtual_table WHERE table_name='Z0CASE';
ALTER TABLE Z0CASE MODIFY column z0_test0 BLOB;
SELECT * FROM Z0CASE;
z0_test0
341
DESC Z0CASE;
Field	Type	Null	Key	Default	Extra
z0_test0	blob	YES		NULL	
SELECT table_id,table_name FROM oceanbase.__all_virtual_table WHERE table_name='Z0CASE';
DROP TABLE Z0CASE;
CREATE TABLE Z0CASE(Z0_TEST0 BIT(10)) with column group (all columns, each column);
INSERT INTO Z0CASE VALUES(b'0101010101');
SELECT BIN(Z0_TEST0) FROM Z0CASE;
BIN(Z0_TEST0)
101010101
SELECT table_id,table_name FROM oceanbase.__all_virtual_table WHERE table_name='Z0CASE';
ALTER TABLE Z0CASE MODIFY column z0_test0 SET('341');
SELECT * FROM Z0CASE;
z0_test0
341
DESC Z0CASE;
Field	Type	Null	Key	Default	Extra
z0_test0	set('341')	YES		NULL	
SELECT table_id,table_name FROM oceanbase.__all_virtual_table WHERE table_name='Z0CASE';
DROP TABLE Z0CASE;
CREATE TABLE Z0CASE(Z0_TEST0 BIT(10)) with column group (all columns, each column);
INSERT INTO Z0CASE VALUES(b'0101010101');
SELECT BIN(Z0_TEST0) FROM Z0CASE;
BIN(Z0_TEST0)
101010101
SELECT table_id,table_name FROM oceanbase.__all_virtual_table WHERE table_name='Z0CASE';
ALTER TABLE Z0CASE MODIFY column z0_test0 ENUM('341');
SELECT * FROM Z0CASE;
z0_test0

DESC Z0CASE;
Field	Type	Null	Key	Default	Extra
z0_test0	enum('341')	YES		NULL	
SELECT table_id,table_name FROM oceanbase.__all_virtual_table WHERE table_name='Z0CASE';
二进制 --> 时间类型
DROP TABLE Z0CASE;
CREATE TABLE Z0CASE(Z0_TEST0 BIT(25)) with column group (all columns, each column);
INSERT INTO Z0CASE VALUES(b'1001101000011111010010001');
SELECT BIN(Z0_TEST0) FROM Z0CASE;
BIN(Z0_TEST0)
1001101000011111010010001
SELECT table_id,table_name FROM oceanbase.__all_virtual_table WHERE table_name='Z0CASE';
ALTER TABLE Z0CASE MODIFY column z0_test0 DATE;
SELECT * FROM Z0CASE;
z0_test0
2020-11-05
DESC Z0CASE;
Field	Type	Null	Key	Default	Extra
z0_test0	date	YES		NULL	
SELECT table_id,table_name FROM oceanbase.__all_virtual_table WHERE table_name='Z0CASE';
DROP TABLE Z0CASE;
CREATE TABLE Z0CASE(Z0_TEST0 BIT(25)) with column group (all columns, each column);
INSERT INTO Z0CASE VALUES(b'1001101000011111010010001');
SELECT BIN(Z0_TEST0) FROM Z0CASE;
BIN(Z0_TEST0)
1001101000011111010010001
SELECT table_id,table_name FROM oceanbase.__all_virtual_table WHERE table_name='Z0CASE';
ALTER TABLE Z0CASE MODIFY column z0_test0 DATETIME;
SELECT * FROM Z0CASE;
z0_test0
2020-11-05 00:00:00
DESC Z0CASE;
Field	Type	Null	Key	Default	Extra
z0_test0	datetime	YES		NULL	
SELECT table_id,table_name FROM oceanbase.__all_virtual_table WHERE table_name='Z0CASE';
DROP TABLE Z0CASE;
CREATE TABLE Z0CASE(Z0_TEST0 BIT(25)) with column group (all columns, each column);
INSERT INTO Z0CASE VALUES(b'1001101000011111010010001');
SELECT BIN(Z0_TEST0) FROM Z0CASE;
BIN(Z0_TEST0)
1001101000011111010010001
SELECT table_id,table_name FROM oceanbase.__all_virtual_table WHERE table_name='Z0CASE';
ALTER TABLE Z0CASE MODIFY column z0_test0 YEAR;
SELECT * FROM Z0CASE;
z0_test0
0000
DESC Z0CASE;
Field	Type	Null	Key	Default	Extra
z0_test0	year(4)	YES		NULL	
SELECT table_id,table_name FROM oceanbase.__all_virtual_table WHERE table_name='Z0CASE';
DROP TABLE Z0CASE;
CREATE TABLE Z0CASE(Z0_TEST0 BIT(17)) with column group (all columns, each column);
INSERT INTO Z0CASE VALUES(b'11101100101111100');
SELECT BIN(Z0_TEST0) FROM Z0CASE;
BIN(Z0_TEST0)
11101100101111100
SELECT table_id,table_name FROM oceanbase.__all_virtual_table WHERE table_name='Z0CASE';
ALTER TABLE Z0CASE MODIFY column z0_test0 TIME;
SELECT * FROM Z0CASE;
z0_test0
12:12:12
DESC Z0CASE;
Field	Type	Null	Key	Default	Extra
z0_test0	time	YES		NULL	
SELECT table_id,table_name FROM oceanbase.__all_virtual_table WHERE table_name='Z0CASE';
DROP TABLE Z0CASE;
CREATE TABLE Z0CASE(Z0_TEST0 BIT(25)) with column group (all columns, each column);
INSERT INTO Z0CASE VALUES(b'1001101000011111010010001');
SELECT BIN(Z0_TEST0) FROM Z0CASE;
BIN(Z0_TEST0)
1001101000011111010010001
SELECT table_id,table_name FROM oceanbase.__all_virtual_table WHERE table_name='Z0CASE';
ALTER TABLE Z0CASE MODIFY column z0_test0 TIMESTAMP;
SELECT * FROM Z0CASE;
z0_test0
2020-11-05 00:00:00
DESC Z0CASE;
Field	Type	Null	Key	Default	Extra
z0_test0	timestamp	YES		NULL	
SELECT table_id,table_name FROM oceanbase.__all_virtual_table WHERE table_name='Z0CASE';
BIT类型加约束 --> primary key
DROP TABLE Z0CASE;
CREATE TABLE Z0CASE(Z0_TEST0 BIT(25) PRIMARY KEY,Z0_TEST1 BIT(10)) with column group (all columns, each column);
INSERT INTO Z0CASE VALUES(b'1001101000011111010010001',b'0101100110');
SELECT BIN(Z0_TEST0),BIN(Z0_TEST1) FROM Z0CASE;
BIN(Z0_TEST0)	BIN(Z0_TEST1)
1001101000011111010010001	101100110
SELECT table_id,table_name FROM oceanbase.__all_virtual_table WHERE table_name='Z0CASE';
ALTER TABLE Z0CASE MODIFY column z0_test0 BIT(26);
SELECT BIN(Z0_TEST0) FROM Z0CASE;
BIN(Z0_TEST0)
1001101000011111010010001
DESC Z0CASE;
Field	Type	Null	Key	Default	Extra
z0_test0	bit(26)	NO	PRI	NULL	
Z0_TEST1	bit(10)	YES		NULL	
SELECT table_id,table_name FROM oceanbase.__all_virtual_table WHERE table_name='Z0CASE';
INSERT INTO Z0CASE VALUES(b'1001101000011111010010001',b'0101100');
ERROR 23000: Duplicate entry '20201105' for key 'PRIMARY'
INSERT INTO Z0CASE VALUES(b'10011010000111110100100010',b'0101100');
SELECT BIN(Z0_TEST0),BIN(Z0_TEST1) FROM Z0CASE;
BIN(Z0_TEST0)	BIN(Z0_TEST1)
1001101000011111010010001	101100110
10011010000111110100100010	101100
INSERT INTO Z0CASE VALUES(b'100110100001111101001000101',b'0101100');
SELECT BIN(Z0_TEST0),BIN(Z0_TEST1) FROM Z0CASE;
BIN(Z0_TEST0)	BIN(Z0_TEST1)
1001101000011111010010001	101100110
10011010000111110100100010	101100
11111111111111111111111111	101100
UPDATE Z0CASE SET Z0_TEST0=b'10011010000111110100100010' WHERE Z0_TEST1=b'0101100110';
ERROR 23000: Duplicate entry '40402210' for key 'PRIMARY'
UPDATE Z0CASE SET Z0_TEST0=b'01011010000111110100100011' WHERE Z0_TEST1=b'0101100110';
SELECT BIN(Z0_TEST0),BIN(Z0_TEST1) FROM Z0CASE;
BIN(Z0_TEST0)	BIN(Z0_TEST1)
1011010000111110100100011	101100110
10011010000111110100100010	101100
11111111111111111111111111	101100
UPDATE Z0CASE SET Z0_TEST0=b'101011010000111110100100011' WHERE Z0_TEST1=b'0101100110';
ERROR 23000: Duplicate entry '67108863' for key 'PRIMARY'
DELETE FROM Z0CASE WHERE Z0_TEST0=b'10011010000111110100100010';
ALTER TABLE Z0CASE MODIFY column z0_test0 BIT(25);
SELECT BIN(Z0_TEST0) FROM Z0CASE;
BIN(Z0_TEST0)
1011010000111110100100011
1111111111111111111111111
DESC Z0CASE;
Field	Type	Null	Key	Default	Extra
z0_test0	bit(25)	NO	PRI	NULL	
Z0_TEST1	bit(10)	YES		NULL	
SELECT table_id,table_name FROM oceanbase.__all_virtual_table WHERE table_name='Z0CASE';
ALTER TABLE Z0CASE MODIFY column z0_test0 INT;
SELECT Z0_TEST0 FROM Z0CASE;
Z0_TEST0
23624995
33554431
DESC Z0CASE;
Field	Type	Null	Key	Default	Extra
z0_test0	int(11)	NO	PRI	NULL	
Z0_TEST1	bit(10)	YES		NULL	
SELECT table_id,table_name FROM oceanbase.__all_virtual_table WHERE table_name='Z0CASE';
DROP TABLE Z0CASE;
CREATE TABLE Z0CASE(Z0_TEST0 BIT(5) PRIMARY KEY,Z0_TEST1 BIT(10)) with column group (all columns, each column);
INSERT INTO Z0CASE VALUES(b'10011',b'0101100110');
SELECT BIN(Z0_TEST0),BIN(Z0_TEST1) FROM Z0CASE;
BIN(Z0_TEST0)	BIN(Z0_TEST1)
10011	101100110
SELECT table_id,table_name FROM oceanbase.__all_virtual_table WHERE table_name='Z0CASE';
ALTER TABLE Z0CASE MODIFY column z0_test0 TINYINT;
SELECT Z0_TEST0,BIN(Z0_TEST1) FROM Z0CASE;
Z0_TEST0	BIN(Z0_TEST1)
19	101100110
DESC Z0CASE;
Field	Type	Null	Key	Default	Extra
z0_test0	tinyint(4)	NO	PRI	NULL	
Z0_TEST1	bit(10)	YES		NULL	
SELECT table_id,table_name FROM oceanbase.__all_virtual_table WHERE table_name='Z0CASE';
DROP TABLE Z0CASE;
CREATE TABLE Z0CASE(Z0_TEST0 BIT(15) PRIMARY KEY,Z0_TEST1 BIT(10)) with column group (all columns, each column);
INSERT INTO Z0CASE VALUES(b'010110011010110',b'0101100110');
SELECT BIN(Z0_TEST0),BIN(Z0_TEST1) FROM Z0CASE;
BIN(Z0_TEST0)	BIN(Z0_TEST1)
10110011010110	101100110
SELECT table_id,table_name FROM oceanbase.__all_virtual_table WHERE table_name='Z0CASE';
ALTER TABLE Z0CASE MODIFY column z0_test0 MEDIUMINT;
SELECT Z0_TEST0,BIN(Z0_TEST1) FROM Z0CASE;
Z0_TEST0	BIN(Z0_TEST1)
11478	101100110
DESC Z0CASE;
Field	Type	Null	Key	Default	Extra
z0_test0	mediumint(9)	NO	PRI	NULL	
Z0_TEST1	bit(10)	YES		NULL	
SELECT table_id,table_name FROM oceanbase.__all_virtual_table WHERE table_name='Z0CASE';
DROP TABLE Z0CASE;
CREATE TABLE Z0CASE(Z0_TEST0 BIT(15) PRIMARY KEY,Z0_TEST1 BIT(10)) with column group (all columns, each column);
INSERT INTO Z0CASE VALUES(b'010110011010110',b'0101100110');
SELECT BIN(Z0_TEST0),BIN(Z0_TEST1) FROM Z0CASE;
BIN(Z0_TEST0)	BIN(Z0_TEST1)
10110011010110	101100110
SELECT table_id,table_name FROM oceanbase.__all_virtual_table WHERE table_name='Z0CASE';
ALTER TABLE Z0CASE MODIFY column z0_test0 SMALLINT;
SELECT Z0_TEST0,BIN(Z0_TEST1) FROM Z0CASE;
Z0_TEST0	BIN(Z0_TEST1)
11478	101100110
DESC Z0CASE;
Field	Type	Null	Key	Default	Extra
z0_test0	smallint(6)	NO	PRI	NULL	
Z0_TEST1	bit(10)	YES		NULL	
SELECT table_id,table_name FROM oceanbase.__all_virtual_table WHERE table_name='Z0CASE';
DROP TABLE Z0CASE;
CREATE TABLE Z0CASE(Z0_TEST0 BIT(15) PRIMARY KEY,Z0_TEST1 BIT(10)) with column group (all columns, each column);
INSERT INTO Z0CASE VALUES(b'010110011010110',b'0101100110');
SELECT BIN(Z0_TEST0),BIN(Z0_TEST1) FROM Z0CASE;
BIN(Z0_TEST0)	BIN(Z0_TEST1)
10110011010110	101100110
SELECT table_id,table_name FROM oceanbase.__all_virtual_table WHERE table_name='Z0CASE';
ALTER TABLE Z0CASE MODIFY column z0_test0 FLOAT(7,2);
SELECT Z0_TEST0,BIN(Z0_TEST1) FROM Z0CASE;
Z0_TEST0	BIN(Z0_TEST1)
11478.00	101100110
DESC Z0CASE;
Field	Type	Null	Key	Default	Extra
z0_test0	float(7,2)	NO	PRI	NULL	
Z0_TEST1	bit(10)	YES		NULL	
SELECT table_id,table_name FROM oceanbase.__all_virtual_table WHERE table_name='Z0CASE';
DROP TABLE Z0CASE;
CREATE TABLE Z0CASE(Z0_TEST0 BIT(15) PRIMARY KEY,Z0_TEST1 BIT(10)) with column group (all columns, each column);
INSERT INTO Z0CASE VALUES(b'010110011010110',b'0101100110');
SELECT BIN(Z0_TEST0),BIN(Z0_TEST1) FROM Z0CASE;
BIN(Z0_TEST0)	BIN(Z0_TEST1)
10110011010110	101100110
SELECT table_id,table_name FROM oceanbase.__all_virtual_table WHERE table_name='Z0CASE';
ALTER TABLE Z0CASE MODIFY column z0_test0 DOUBLE(7,2);
SELECT Z0_TEST0,BIN(Z0_TEST1) FROM Z0CASE;
Z0_TEST0	BIN(Z0_TEST1)
11478.00	101100110
DESC Z0CASE;
Field	Type	Null	Key	Default	Extra
z0_test0	double(7,2)	NO	PRI	NULL	
Z0_TEST1	bit(10)	YES		NULL	
SELECT table_id,table_name FROM oceanbase.__all_virtual_table WHERE table_name='Z0CASE';
DROP TABLE Z0CASE;
CREATE TABLE Z0CASE(Z0_TEST0 BIT(15) PRIMARY KEY,Z0_TEST1 BIT(10)) with column group (all columns, each column);
INSERT INTO Z0CASE VALUES(b'010110011010110',b'0101100110');
SELECT BIN(Z0_TEST0),BIN(Z0_TEST1) FROM Z0CASE;
BIN(Z0_TEST0)	BIN(Z0_TEST1)
10110011010110	101100110
SELECT table_id,table_name FROM oceanbase.__all_virtual_table WHERE table_name='Z0CASE';
ALTER TABLE Z0CASE MODIFY column z0_test0 DECIMAL(7,2);
SELECT Z0_TEST0,BIN(Z0_TEST1) FROM Z0CASE;
Z0_TEST0	BIN(Z0_TEST1)
11478.00	101100110
DESC Z0CASE;
Field	Type	Null	Key	Default	Extra
z0_test0	decimal(7,2)	NO	PRI	NULL	
Z0_TEST1	bit(10)	YES		NULL	
SELECT table_id,table_name FROM oceanbase.__all_virtual_table WHERE table_name='Z0CASE';
DROP TABLE Z0CASE;
CREATE TABLE Z0CASE(Z0_TEST0 BIT(15) PRIMARY KEY,Z0_TEST1 BIT(10)) with column group (all columns, each column);
INSERT INTO Z0CASE VALUES(b'010110011010110',b'0101100110');
SELECT BIN(Z0_TEST0),BIN(Z0_TEST1) FROM Z0CASE;
BIN(Z0_TEST0)	BIN(Z0_TEST1)
10110011010110	101100110
SELECT table_id,table_name FROM oceanbase.__all_virtual_table WHERE table_name='Z0CASE';
ALTER TABLE Z0CASE MODIFY column z0_test0 CHAR(5);
SELECT Z0_TEST0,BIN(Z0_TEST1) FROM Z0CASE;
Z0_TEST0	BIN(Z0_TEST1)
11478	101100110
DESC Z0CASE;
Field	Type	Null	Key	Default	Extra
z0_test0	char(5)	NO	PRI	NULL	
Z0_TEST1	bit(10)	YES		NULL	
SELECT table_id,table_name FROM oceanbase.__all_virtual_table WHERE table_name='Z0CASE';
DROP TABLE Z0CASE;
CREATE TABLE Z0CASE(Z0_TEST0 BIT(15) PRIMARY KEY,Z0_TEST1 BIT(10)) with column group (all columns, each column);
INSERT INTO Z0CASE VALUES(b'010110011010110',b'0101100110');
SELECT BIN(Z0_TEST0),BIN(Z0_TEST1) FROM Z0CASE;
BIN(Z0_TEST0)	BIN(Z0_TEST1)
10110011010110	101100110
SELECT table_id,table_name FROM oceanbase.__all_virtual_table WHERE table_name='Z0CASE';
ALTER TABLE Z0CASE MODIFY column z0_test0 VARCHAR(5);
SELECT Z0_TEST0,BIN(Z0_TEST1) FROM Z0CASE;
Z0_TEST0	BIN(Z0_TEST1)
11478	101100110
DESC Z0CASE;
Field	Type	Null	Key	Default	Extra
z0_test0	varchar(5)	NO	PRI	NULL	
Z0_TEST1	bit(10)	YES		NULL	
SELECT table_id,table_name FROM oceanbase.__all_virtual_table WHERE table_name='Z0CASE';
DROP TABLE Z0CASE;
CREATE TABLE Z0CASE(Z0_TEST0 BIT(15) PRIMARY KEY,Z0_TEST1 BIT(10)) with column group (all columns, each column);
INSERT INTO Z0CASE VALUES(b'010110011010110',b'0101100110');
SELECT BIN(Z0_TEST0),BIN(Z0_TEST1) FROM Z0CASE;
BIN(Z0_TEST0)	BIN(Z0_TEST1)
10110011010110	101100110
SELECT table_id,table_name FROM oceanbase.__all_virtual_table WHERE table_name='Z0CASE';
ALTER TABLE Z0CASE MODIFY column z0_test0 BINARY(5);
SELECT hex(z0_test0) FROM Z0CASE;
hex(z0_test0)
3131343738
SELECT Z0_TEST0,BIN(Z0_TEST1) FROM Z0CASE;
Z0_TEST0	BIN(Z0_TEST1)
11478	101100110
SELECT table_id,table_name FROM oceanbase.__all_virtual_table WHERE table_name='Z0CASE';
DROP TABLE Z0CASE;
CREATE TABLE Z0CASE(Z0_TEST0 BIT(15) PRIMARY KEY,Z0_TEST1 BIT(10)) with column group (all columns, each column);
INSERT INTO Z0CASE VALUES(b'010110011010110',b'0101100110');
SELECT BIN(Z0_TEST0),BIN(Z0_TEST1) FROM Z0CASE;
BIN(Z0_TEST0)	BIN(Z0_TEST1)
10110011010110	101100110
SELECT table_id,table_name FROM oceanbase.__all_virtual_table WHERE table_name='Z0CASE';
ALTER TABLE Z0CASE MODIFY column z0_test0 VARBINARY(5);
SELECT Z0_TEST0,BIN(Z0_TEST1) FROM Z0CASE;
Z0_TEST0	BIN(Z0_TEST1)
11478	101100110
DESC Z0CASE;
Field	Type	Null	Key	Default	Extra
z0_test0	varbinary(5)	NO	PRI	NULL	
Z0_TEST1	bit(10)	YES		NULL	
SELECT table_id,table_name FROM oceanbase.__all_virtual_table WHERE table_name='Z0CASE';
DROP TABLE Z0CASE;
CREATE TABLE Z0CASE(Z0_TEST0 BIT(15) PRIMARY KEY,Z0_TEST1 BIT(10)) with column group (all columns, each column);
INSERT INTO Z0CASE VALUES(b'010110011010110',b'0101100110');
SELECT BIN(Z0_TEST0),BIN(Z0_TEST1) FROM Z0CASE;
BIN(Z0_TEST0)	BIN(Z0_TEST1)
10110011010110	101100110
SELECT table_id,table_name FROM oceanbase.__all_virtual_table WHERE table_name='Z0CASE';
ALTER TABLE Z0CASE MODIFY column z0_test0 TEXT;
ERROR 42000: The used storage engine can't index column 'z0_test0'
ALTER TABLE Z0CASE MODIFY column z0_test0 BLOB;
ERROR 42000: The used storage engine can't index column 'z0_test0'
DROP TABLE Z0CASE;
CREATE TABLE Z0CASE(Z0_TEST0 BIT(25) PRIMARY KEY,Z0_TEST1 BIT(10)) with column group (all columns, each column);
INSERT INTO Z0CASE VALUES(b'1001101000011111010010001',b'0101100110');
SELECT BIN(Z0_TEST0),BIN(Z0_TEST1) FROM Z0CASE;
BIN(Z0_TEST0)	BIN(Z0_TEST1)
1001101000011111010010001	101100110
SELECT table_id,table_name FROM oceanbase.__all_virtual_table WHERE table_name='Z0CASE';
ALTER TABLE Z0CASE MODIFY column z0_test0 DATE;
SELECT Z0_TEST0,BIN(Z0_TEST1) FROM Z0CASE;
Z0_TEST0	BIN(Z0_TEST1)
2020-11-05	101100110
DESC Z0CASE;
Field	Type	Null	Key	Default	Extra
z0_test0	date	NO	PRI	NULL	
Z0_TEST1	bit(10)	YES		NULL	
SELECT table_id,table_name FROM oceanbase.__all_virtual_table WHERE table_name='Z0CASE';
DROP TABLE Z0CASE;
CREATE TABLE Z0CASE(Z0_TEST0 BIT(25) PRIMARY KEY,Z0_TEST1 BIT(10)) with column group (all columns, each column);
INSERT INTO Z0CASE VALUES(b'1001101000011111010010001',b'0101100110');
SELECT BIN(Z0_TEST0),BIN(Z0_TEST1) FROM Z0CASE;
BIN(Z0_TEST0)	BIN(Z0_TEST1)
1001101000011111010010001	101100110
SELECT table_id,table_name FROM oceanbase.__all_virtual_table WHERE table_name='Z0CASE';
ALTER TABLE Z0CASE MODIFY column z0_test0 DATETIME;
SELECT Z0_TEST0,BIN(Z0_TEST1) FROM Z0CASE;
Z0_TEST0	BIN(Z0_TEST1)
2020-11-05 00:00:00	101100110
DESC Z0CASE;
Field	Type	Null	Key	Default	Extra
z0_test0	datetime	NO	PRI	NULL	
Z0_TEST1	bit(10)	YES		NULL	
SELECT table_id,table_name FROM oceanbase.__all_virtual_table WHERE table_name='Z0CASE';
DROP TABLE Z0CASE;
CREATE TABLE Z0CASE(Z0_TEST0 BIT(25) PRIMARY KEY,Z0_TEST1 BIT(10)) with column group (all columns, each column);
INSERT INTO Z0CASE VALUES(b'1001101000011111010010001',b'0101100110');
SELECT BIN(Z0_TEST0),BIN(Z0_TEST1) FROM Z0CASE;
BIN(Z0_TEST0)	BIN(Z0_TEST1)
1001101000011111010010001	101100110
SELECT table_id,table_name FROM oceanbase.__all_virtual_table WHERE table_name='Z0CASE';
ALTER TABLE Z0CASE MODIFY column z0_test0 TIMESTAMP;
SELECT Z0_TEST0,BIN(Z0_TEST1) FROM Z0CASE;
Z0_TEST0	BIN(Z0_TEST1)
2020-11-05 00:00:00	101100110
DESC Z0CASE;
Field	Type	Null	Key	Default	Extra
z0_test0	timestamp	NO	PRI	NULL	
Z0_TEST1	bit(10)	YES		NULL	
SELECT table_id,table_name FROM oceanbase.__all_virtual_table WHERE table_name='Z0CASE';
DROP TABLE Z0CASE;
CREATE TABLE Z0CASE(Z0_TEST0 BIT(25) PRIMARY KEY,Z0_TEST1 BIT(10)) with column group (all columns, each column);
INSERT INTO Z0CASE VALUES(b'1001101000011111010010001',b'0101100110');
SELECT BIN(Z0_TEST0),BIN(Z0_TEST1) FROM Z0CASE;
BIN(Z0_TEST0)	BIN(Z0_TEST1)
1001101000011111010010001	101100110
SELECT table_id,table_name FROM oceanbase.__all_virtual_table WHERE table_name='Z0CASE';
ALTER TABLE Z0CASE MODIFY column z0_test0 YEAR;
SELECT Z0_TEST0,BIN(Z0_TEST1) FROM Z0CASE;
Z0_TEST0	BIN(Z0_TEST1)
0000	101100110
DESC Z0CASE;
Field	Type	Null	Key	Default	Extra
z0_test0	year(4)	NO	PRI	NULL	
Z0_TEST1	bit(10)	YES		NULL	
SELECT table_id,table_name FROM oceanbase.__all_virtual_table WHERE table_name='Z0CASE';
DROP TABLE Z0CASE;
CREATE TABLE Z0CASE(Z0_TEST0 BIT(17) PRIMARY KEY,Z0_TEST1 BIT(10)) with column group (all columns, each column);
INSERT INTO Z0CASE VALUES(b'11101100101111100',b'0101100110');
SELECT BIN(Z0_TEST0),BIN(Z0_TEST1) FROM Z0CASE;
BIN(Z0_TEST0)	BIN(Z0_TEST1)
11101100101111100	101100110
SELECT table_id,table_name FROM oceanbase.__all_virtual_table WHERE table_name='Z0CASE';
ALTER TABLE Z0CASE MODIFY column z0_test0 TIME;
SELECT Z0_TEST0,BIN(Z0_TEST1) FROM Z0CASE;
Z0_TEST0	BIN(Z0_TEST1)
12:12:12	101100110
DESC Z0CASE;
Field	Type	Null	Key	Default	Extra
z0_test0	time	NO	PRI	NULL	
Z0_TEST1	bit(10)	YES		NULL	
SELECT table_id,table_name FROM oceanbase.__all_virtual_table WHERE table_name='Z0CASE';
BIT类型加约束 --> FOREIGN KEY
DROP TABLE Z0CASE;
CREATE TABLE Z1CASE(Z0_TEST2 BIT(25) PRIMARY KEY,Z0_TEST3 BIT(10)) with column group (all columns, each column);
CREATE TABLE Z0CASE(Z0_TEST0 BIT(25) ,Z0_TEST1 BIT(10),
CONSTRAINT fk_test0_test2 FOREIGN KEY(Z0_TEST0) REFERENCES Z1CASE(Z0_TEST2)) with column group (all columns, each column);
INSERT INTO Z1CASE VALUES(0,b'1101100110');
INSERT INTO Z1CASE VALUES(b'1101101000011111010010011',b'1101100110');
INSERT INTO Z0CASE VALUES(0,b'1011001010');
INSERT INTO Z0CASE VALUES(b'1101101000011111010010011',b'01100110');
SELECT BIN(Z0_TEST2),BIN(Z0_TEST3) FROM Z1CASE;
BIN(Z0_TEST2)	BIN(Z0_TEST3)
0	1101100110
1101101000011111010010011	1101100110
SELECT BIN(Z0_TEST0),BIN(Z0_TEST1) FROM Z0CASE;
BIN(Z0_TEST0)	BIN(Z0_TEST1)
0	1011001010
1101101000011111010010011	1100110
ALTER TABLE Z0CASE MODIFY column z0_test0 BIT(26);
ERROR 0A000: Alter the precision of foreign key columns,column type BIT not supported
ALTER TABLE Z0CASE MODIFY column z0_test0 BIT(24);
ERROR 0A000: Alter the precision of foreign key columns,column type BIT not supported
ALTER TABLE Z0CASE MODIFY column z0_test0 BIT(25);
SELECT BIN(Z0_TEST0) FROM Z0CASE;
BIN(Z0_TEST0)
0
1101101000011111010010011
ALTER TABLE Z0CASE MODIFY column z0_test0 INT;
ERROR HY000: 'z0_test0': used in a foreign key constraint
ALTER TABLE Z0CASE MODIFY column z0_test0 MEDIUMINT;
ERROR HY000: 'z0_test0': used in a foreign key constraint
ALTER TABLE Z0CASE MODIFY column z0_test0 SMALLINT;
ERROR HY000: 'z0_test0': used in a foreign key constraint
ALTER TABLE Z0CASE MODIFY column z0_test0 TINYINT;
ERROR HY000: 'z0_test0': used in a foreign key constraint
ALTER TABLE Z0CASE MODIFY column z0_test0 FLOAT(20,2);
ERROR HY000: 'z0_test0': used in a foreign key constraint
ALTER TABLE Z0CASE MODIFY column z0_test0 DOUBLE(20,2);
ERROR HY000: 'z0_test0': used in a foreign key constraint
ALTER TABLE Z0CASE MODIFY column z0_test0 DECIMAL(20,2);
ERROR HY000: 'z0_test0': used in a foreign key constraint
ALTER TABLE Z0CASE MODIFY column z0_test0 CHAR(18);
ERROR HY000: 'z0_test0': used in a foreign key constraint
ALTER TABLE Z0CASE MODIFY column z0_test0 VARCHAR(18);
ERROR HY000: 'z0_test0': used in a foreign key constraint
ALTER TABLE Z0CASE MODIFY column z0_test0 BINARY(18);
ERROR HY000: 'z0_test0': used in a foreign key constraint
ALTER TABLE Z0CASE MODIFY column z0_test0 VARBINARY(18);
ERROR HY000: 'z0_test0': used in a foreign key constraint
ALTER TABLE Z0CASE MODIFY column z0_test0 TEXT;
ERROR HY000: 'z0_test0': used in a foreign key constraint
ALTER TABLE Z0CASE MODIFY column z0_test0 BLOB;
ERROR HY000: 'z0_test0': used in a foreign key constraint
ALTER TABLE Z0CASE MODIFY column z0_test0 TIME;
ERROR HY000: 'z0_test0': used in a foreign key constraint
ALTER TABLE Z0CASE MODIFY column z0_test0 DATE;
ERROR HY000: 'z0_test0': used in a foreign key constraint
ALTER TABLE Z0CASE MODIFY column z0_test0 DATETIME;
ERROR HY000: 'z0_test0': used in a foreign key constraint
ALTER TABLE Z0CASE MODIFY column z0_test0 YEAR;
ERROR HY000: 'z0_test0': used in a foreign key constraint
ALTER TABLE Z0CASE MODIFY column z0_test0 TIMESTAMP;
ERROR HY000: 'z0_test0': used in a foreign key constraint
BIT类型加约束 --> NOT NULL
DROP TABLE Z0CASE;
DROP TABLE Z1CASE;
CREATE TABLE Z0CASE(Z0_TEST0 BIT(25) NOT NULL,Z0_TEST1 BIT(10)) with column group (all columns, each column);
INSERT INTO Z0CASE VALUES(0,b'1011001010');
INSERT INTO Z0CASE VALUES(b'1101101000011111010010011',b'01100110');
SELECT BIN(Z0_TEST0),BIN(Z0_TEST1) FROM Z0CASE;
BIN(Z0_TEST0)	BIN(Z0_TEST1)
0	1011001010
1101101000011111010010011	1100110
SELECT table_id,table_name FROM oceanbase.__all_virtual_table WHERE table_name='Z0CASE';
ALTER TABLE Z0CASE MODIFY column z0_test0 BIT(26);
SELECT BIN(Z0_TEST0),BIN(Z0_TEST1) FROM Z0CASE;
BIN(Z0_TEST0)	BIN(Z0_TEST1)
0	1011001010
1101101000011111010010011	1100110
DESC Z0CASE;
Field	Type	Null	Key	Default	Extra
z0_test0	bit(26)	YES		NULL	
Z0_TEST1	bit(10)	YES		NULL	
SELECT table_id,table_name FROM oceanbase.__all_virtual_table WHERE table_name='Z0CASE';
ALTER TABLE Z0CASE MODIFY column z0_test0 BIT(25);
SELECT BIN(Z0_TEST0),BIN(Z0_TEST1) FROM Z0CASE;
BIN(Z0_TEST0)	BIN(Z0_TEST1)
0	1011001010
1101101000011111010010011	1100110
DESC Z0CASE;
Field	Type	Null	Key	Default	Extra
z0_test0	bit(25)	YES		NULL	
Z0_TEST1	bit(10)	YES		NULL	
SELECT table_id,table_name FROM oceanbase.__all_virtual_table WHERE table_name='Z0CASE';
ALTER TABLE Z0CASE MODIFY column z0_test0 INT;
SELECT Z0_TEST0,BIN(Z0_TEST1) FROM Z0CASE;
Z0_TEST0	BIN(Z0_TEST1)
0	1011001010
28589715	1100110
DESC Z0CASE;
Field	Type	Null	Key	Default	Extra
z0_test0	int(11)	YES		NULL	
Z0_TEST1	bit(10)	YES		NULL	
SELECT table_id,table_name FROM oceanbase.__all_virtual_table WHERE table_name='Z0CASE';
DROP TABLE Z0CASE;
CREATE TABLE Z0CASE(Z0_TEST0 BIT(10) NOT NULL,Z0_TEST1 BIT(10)) with column group (all columns, each column);
INSERT INTO Z0CASE VALUES(0,b'1011001010');
INSERT INTO Z0CASE VALUES(b'1101101000',b'01100110');
SELECT BIN(Z0_TEST0),BIN(Z0_TEST1) FROM Z0CASE;
BIN(Z0_TEST0)	BIN(Z0_TEST1)
0	1011001010
1101101000	1100110
SELECT table_id,table_name FROM oceanbase.__all_virtual_table WHERE table_name='Z0CASE';
ALTER TABLE Z0CASE MODIFY column z0_test0 MEDIUMINT;
SELECT Z0_TEST0,BIN(Z0_TEST1) FROM Z0CASE;
Z0_TEST0	BIN(Z0_TEST1)
0	1011001010
872	1100110
DESC Z0CASE;
Field	Type	Null	Key	Default	Extra
z0_test0	mediumint(9)	YES		NULL	
Z0_TEST1	bit(10)	YES		NULL	
SELECT table_id,table_name FROM oceanbase.__all_virtual_table WHERE table_name='Z0CASE';
DROP TABLE Z0CASE;
CREATE TABLE Z0CASE(Z0_TEST0 BIT(10) NOT NULL,Z0_TEST1 BIT(10)) with column group (all columns, each column);
INSERT INTO Z0CASE VALUES(0,b'1011001010');
INSERT INTO Z0CASE VALUES(b'1101101000',b'01100110');
SELECT BIN(Z0_TEST0),BIN(Z0_TEST1) FROM Z0CASE;
BIN(Z0_TEST0)	BIN(Z0_TEST1)
0	1011001010
1101101000	1100110
SELECT table_id,table_name FROM oceanbase.__all_virtual_table WHERE table_name='Z0CASE';
ALTER TABLE Z0CASE MODIFY column z0_test0 SMALLINT;
SELECT Z0_TEST0,BIN(Z0_TEST1) FROM Z0CASE;
Z0_TEST0	BIN(Z0_TEST1)
0	1011001010
872	1100110
DESC Z0CASE;
Field	Type	Null	Key	Default	Extra
z0_test0	smallint(6)	YES		NULL	
Z0_TEST1	bit(10)	YES		NULL	
SELECT table_id,table_name FROM oceanbase.__all_virtual_table WHERE table_name='Z0CASE';
DROP TABLE Z0CASE;
CREATE TABLE Z0CASE(Z0_TEST0 BIT(10) NOT NULL,Z0_TEST1 BIT(10)) with column group (all columns, each column);
INSERT INTO Z0CASE VALUES(0,b'1011001010');
INSERT INTO Z0CASE VALUES(b'110110',b'01100110');
SELECT BIN(Z0_TEST0),BIN(Z0_TEST1) FROM Z0CASE;
BIN(Z0_TEST0)	BIN(Z0_TEST1)
0	1011001010
110110	1100110
SELECT table_id,table_name FROM oceanbase.__all_virtual_table WHERE table_name='Z0CASE';
ALTER TABLE Z0CASE MODIFY column z0_test0 TINYINT;
SELECT Z0_TEST0,BIN(Z0_TEST1) FROM Z0CASE;
Z0_TEST0	BIN(Z0_TEST1)
0	1011001010
54	1100110
DESC Z0CASE;
Field	Type	Null	Key	Default	Extra
z0_test0	tinyint(4)	YES		NULL	
Z0_TEST1	bit(10)	YES		NULL	
SELECT table_id,table_name FROM oceanbase.__all_virtual_table WHERE table_name='Z0CASE';
DROP TABLE Z0CASE;
CREATE TABLE Z0CASE(Z0_TEST0 BIT(10) NOT NULL,Z0_TEST1 BIT(10)) with column group (all columns, each column);
INSERT INTO Z0CASE VALUES(0,b'1011001010');
INSERT INTO Z0CASE VALUES(b'110110',b'01100110');
SELECT BIN(Z0_TEST0),BIN(Z0_TEST1) FROM Z0CASE;
BIN(Z0_TEST0)	BIN(Z0_TEST1)
0	1011001010
110110	1100110
SELECT table_id,table_name FROM oceanbase.__all_virtual_table WHERE table_name='Z0CASE';
ALTER TABLE Z0CASE MODIFY column z0_test0 FLOAT(20,2);
SELECT Z0_TEST0,BIN(Z0_TEST1) FROM Z0CASE;
Z0_TEST0	BIN(Z0_TEST1)
0.00	1011001010
54.00	1100110
DESC Z0CASE;
Field	Type	Null	Key	Default	Extra
z0_test0	float(20,2)	YES		NULL	
Z0_TEST1	bit(10)	YES		NULL	
SELECT table_id,table_name FROM oceanbase.__all_virtual_table WHERE table_name='Z0CASE';
DROP TABLE Z0CASE;
CREATE TABLE Z0CASE(Z0_TEST0 BIT(10) NOT NULL,Z0_TEST1 BIT(10)) with column group (all columns, each column);
INSERT INTO Z0CASE VALUES(0,b'1011001010');
INSERT INTO Z0CASE VALUES(b'110110',b'01100110');
SELECT BIN(Z0_TEST0),BIN(Z0_TEST1) FROM Z0CASE;
BIN(Z0_TEST0)	BIN(Z0_TEST1)
0	1011001010
110110	1100110
SELECT table_id,table_name FROM oceanbase.__all_virtual_table WHERE table_name='Z0CASE';
ALTER TABLE Z0CASE MODIFY column z0_test0 DOUBLE(20,2);
SELECT Z0_TEST0,BIN(Z0_TEST1) FROM Z0CASE;
Z0_TEST0	BIN(Z0_TEST1)
0.00	1011001010
54.00	1100110
DESC Z0CASE;
Field	Type	Null	Key	Default	Extra
z0_test0	double(20,2)	YES		NULL	
Z0_TEST1	bit(10)	YES		NULL	
SELECT table_id,table_name FROM oceanbase.__all_virtual_table WHERE table_name='Z0CASE';
DROP TABLE Z0CASE;
CREATE TABLE Z0CASE(Z0_TEST0 BIT(10) NOT NULL,Z0_TEST1 BIT(10)) with column group (all columns, each column);
INSERT INTO Z0CASE VALUES(0,b'1011001010');
INSERT INTO Z0CASE VALUES(b'110110',b'01100110');
SELECT BIN(Z0_TEST0),BIN(Z0_TEST1) FROM Z0CASE;
BIN(Z0_TEST0)	BIN(Z0_TEST1)
0	1011001010
110110	1100110
SELECT table_id,table_name FROM oceanbase.__all_virtual_table WHERE table_name='Z0CASE';
ALTER TABLE Z0CASE MODIFY column z0_test0 DECIMAL(20,2);
SELECT Z0_TEST0,BIN(Z0_TEST1) FROM Z0CASE;
Z0_TEST0	BIN(Z0_TEST1)
0.00	1011001010
54.00	1100110
DESC Z0CASE;
Field	Type	Null	Key	Default	Extra
z0_test0	decimal(20,2)	YES		NULL	
Z0_TEST1	bit(10)	YES		NULL	
SELECT table_id,table_name FROM oceanbase.__all_virtual_table WHERE table_name='Z0CASE';
DROP TABLE Z0CASE;
CREATE TABLE Z0CASE(Z0_TEST0 BIT(10) NOT NULL,Z0_TEST1 BIT(10)) with column group (all columns, each column);
INSERT INTO Z0CASE VALUES(0,b'1011001010');
INSERT INTO Z0CASE VALUES(b'110110',b'01100110');
SELECT BIN(Z0_TEST0),BIN(Z0_TEST1) FROM Z0CASE;
BIN(Z0_TEST0)	BIN(Z0_TEST1)
0	1011001010
110110	1100110
SELECT table_id,table_name FROM oceanbase.__all_virtual_table WHERE table_name='Z0CASE';
ALTER TABLE Z0CASE MODIFY column z0_test0 CHAR(18);
SELECT Z0_TEST0,BIN(Z0_TEST1) FROM Z0CASE;
Z0_TEST0	BIN(Z0_TEST1)
0	1011001010
54	1100110
DESC Z0CASE;
Field	Type	Null	Key	Default	Extra
z0_test0	char(18)	YES		NULL	
Z0_TEST1	bit(10)	YES		NULL	
SELECT table_id,table_name FROM oceanbase.__all_virtual_table WHERE table_name='Z0CASE';
DROP TABLE Z0CASE;
CREATE TABLE Z0CASE(Z0_TEST0 BIT(10) NOT NULL,Z0_TEST1 BIT(10)) with column group (all columns, each column);
INSERT INTO Z0CASE VALUES(0,b'1011001010');
INSERT INTO Z0CASE VALUES(b'110110',b'01100110');
SELECT BIN(Z0_TEST0),BIN(Z0_TEST1) FROM Z0CASE;
BIN(Z0_TEST0)	BIN(Z0_TEST1)
0	1011001010
110110	1100110
SELECT table_id,table_name FROM oceanbase.__all_virtual_table WHERE table_name='Z0CASE';
ALTER TABLE Z0CASE MODIFY column z0_test0 VARCHAR(18);
SELECT Z0_TEST0,BIN(Z0_TEST1) FROM Z0CASE;
Z0_TEST0	BIN(Z0_TEST1)
0	1011001010
54	1100110
DESC Z0CASE;
Field	Type	Null	Key	Default	Extra
z0_test0	varchar(18)	YES		NULL	
Z0_TEST1	bit(10)	YES		NULL	
SELECT table_id,table_name FROM oceanbase.__all_virtual_table WHERE table_name='Z0CASE';
DROP TABLE Z0CASE;
CREATE TABLE Z0CASE(Z0_TEST0 BIT(10) NOT NULL,Z0_TEST1 BIT(10)) with column group (all columns, each column);
INSERT INTO Z0CASE VALUES(0,b'1011001010');
INSERT INTO Z0CASE VALUES(b'110110',b'01100110');
SELECT BIN(Z0_TEST0),BIN(Z0_TEST1) FROM Z0CASE;
BIN(Z0_TEST0)	BIN(Z0_TEST1)
0	1011001010
110110	1100110
SELECT table_id,table_name FROM oceanbase.__all_virtual_table WHERE table_name='Z0CASE';
ALTER TABLE Z0CASE MODIFY column z0_test0 BINARY(18);
SELECT Z0_TEST0,BIN(Z0_TEST1) FROM Z0CASE;
Z0_TEST0	BIN(Z0_TEST1)
0                 	1011001010
54                	1100110
DESC Z0CASE;
Field	Type	Null	Key	Default	Extra
z0_test0	binary(18)	YES		NULL	
Z0_TEST1	bit(10)	YES		NULL	
SELECT table_id,table_name FROM oceanbase.__all_virtual_table WHERE table_name='Z0CASE';
DROP TABLE Z0CASE;
CREATE TABLE Z0CASE(Z0_TEST0 BIT(10) NOT NULL,Z0_TEST1 BIT(10)) with column group (all columns, each column);
INSERT INTO Z0CASE VALUES(0,b'1011001010');
INSERT INTO Z0CASE VALUES(b'110110',b'01100110');
SELECT BIN(Z0_TEST0),BIN(Z0_TEST1) FROM Z0CASE;
BIN(Z0_TEST0)	BIN(Z0_TEST1)
0	1011001010
110110	1100110
SELECT table_id,table_name FROM oceanbase.__all_virtual_table WHERE table_name='Z0CASE';
ALTER TABLE Z0CASE MODIFY column z0_test0 VARBINARY(18);
SELECT Z0_TEST0,BIN(Z0_TEST1) FROM Z0CASE;
Z0_TEST0	BIN(Z0_TEST1)
0	1011001010
54	1100110
DESC Z0CASE;
Field	Type	Null	Key	Default	Extra
z0_test0	varbinary(18)	YES		NULL	
Z0_TEST1	bit(10)	YES		NULL	
SELECT table_id,table_name FROM oceanbase.__all_virtual_table WHERE table_name='Z0CASE';
DROP TABLE Z0CASE;
CREATE TABLE Z0CASE(Z0_TEST0 BIT(10) NOT NULL,Z0_TEST1 BIT(10)) with column group (all columns, each column);
INSERT INTO Z0CASE VALUES(0,b'1011001010');
INSERT INTO Z0CASE VALUES(b'110110',b'01100110');
SELECT BIN(Z0_TEST0),BIN(Z0_TEST1) FROM Z0CASE;
BIN(Z0_TEST0)	BIN(Z0_TEST1)
0	1011001010
110110	1100110
SELECT table_id,table_name FROM oceanbase.__all_virtual_table WHERE table_name='Z0CASE';
ALTER TABLE Z0CASE MODIFY column z0_test0 TEXT;
SELECT Z0_TEST0,BIN(Z0_TEST1) FROM Z0CASE;
Z0_TEST0	BIN(Z0_TEST1)
0	1011001010
54	1100110
DESC Z0CASE;
Field	Type	Null	Key	Default	Extra
z0_test0	text	YES		NULL	
Z0_TEST1	bit(10)	YES		NULL	
SELECT table_id,table_name FROM oceanbase.__all_virtual_table WHERE table_name='Z0CASE';
DROP TABLE Z0CASE;
CREATE TABLE Z0CASE(Z0_TEST0 BIT(10) NOT NULL,Z0_TEST1 BIT(10)) with column group (all columns, each column);
INSERT INTO Z0CASE VALUES(0,b'1011001010');
INSERT INTO Z0CASE VALUES(b'110110',b'01100110');
SELECT BIN(Z0_TEST0),BIN(Z0_TEST1) FROM Z0CASE;
BIN(Z0_TEST0)	BIN(Z0_TEST1)
0	1011001010
110110	1100110
SELECT table_id,table_name FROM oceanbase.__all_virtual_table WHERE table_name='Z0CASE';
ALTER TABLE Z0CASE MODIFY column z0_test0 BLOB;
SELECT Z0_TEST0,BIN(Z0_TEST1) FROM Z0CASE;
Z0_TEST0	BIN(Z0_TEST1)
0	1011001010
54	1100110
DESC Z0CASE;
Field	Type	Null	Key	Default	Extra
z0_test0	blob	YES		NULL	
Z0_TEST1	bit(10)	YES		NULL	
SELECT table_id,table_name FROM oceanbase.__all_virtual_table WHERE table_name='Z0CASE';
DROP TABLE Z0CASE;
CREATE TABLE Z0CASE(Z0_TEST0 BIT(25) NOT NULL,Z0_TEST1 BIT(10)) with column group (all columns, each column);
INSERT INTO Z0CASE VALUES(b'1001101000011111010011000',b'0101100110');
SELECT BIN(Z0_TEST0),BIN(Z0_TEST1) FROM Z0CASE;
BIN(Z0_TEST0)	BIN(Z0_TEST1)
1001101000011111010011000	101100110
SELECT table_id,table_name FROM oceanbase.__all_virtual_table WHERE table_name='Z0CASE';
ALTER TABLE Z0CASE MODIFY column z0_test0 DATE;
SELECT Z0_TEST0,BIN(Z0_TEST1) FROM Z0CASE;
Z0_TEST0	BIN(Z0_TEST1)
2020-11-12	101100110
DESC Z0CASE;
Field	Type	Null	Key	Default	Extra
z0_test0	date	YES		NULL	
Z0_TEST1	bit(10)	YES		NULL	
SELECT table_id,table_name FROM oceanbase.__all_virtual_table WHERE table_name='Z0CASE';
DROP TABLE Z0CASE;
CREATE TABLE Z0CASE(Z0_TEST0 BIT(25) NOT NULL,Z0_TEST1 BIT(10)) with column group (all columns, each column);
INSERT INTO Z0CASE VALUES(b'1001101000011111010011000',b'0101100110');
SELECT BIN(Z0_TEST0),BIN(Z0_TEST1) FROM Z0CASE;
BIN(Z0_TEST0)	BIN(Z0_TEST1)
1001101000011111010011000	101100110
SELECT table_id,table_name FROM oceanbase.__all_virtual_table WHERE table_name='Z0CASE';
ALTER TABLE Z0CASE MODIFY column z0_test0 DATETIME;
SELECT Z0_TEST0,BIN(Z0_TEST1) FROM Z0CASE;
Z0_TEST0	BIN(Z0_TEST1)
2020-11-12 00:00:00	101100110
DESC Z0CASE;
Field	Type	Null	Key	Default	Extra
z0_test0	datetime	YES		NULL	
Z0_TEST1	bit(10)	YES		NULL	
SELECT table_id,table_name FROM oceanbase.__all_virtual_table WHERE table_name='Z0CASE';
DROP TABLE Z0CASE;
CREATE TABLE Z0CASE(Z0_TEST0 BIT(25) NOT NULL,Z0_TEST1 BIT(10)) with column group (all columns, each column);
INSERT INTO Z0CASE VALUES(b'1001101000011111010011000',b'0101100110');
SELECT BIN(Z0_TEST0),BIN(Z0_TEST1) FROM Z0CASE;
BIN(Z0_TEST0)	BIN(Z0_TEST1)
1001101000011111010011000	101100110
SELECT table_id,table_name FROM oceanbase.__all_virtual_table WHERE table_name='Z0CASE';
ALTER TABLE Z0CASE MODIFY column z0_test0 TIMESTAMP;
SELECT Z0_TEST0,BIN(Z0_TEST1) FROM Z0CASE;
Z0_TEST0	BIN(Z0_TEST1)
2020-11-12 00:00:00	101100110
DESC Z0CASE;
Field	Type	Null	Key	Default	Extra
z0_test0	timestamp	YES		NULL	
Z0_TEST1	bit(10)	YES		NULL	
SELECT table_id,table_name FROM oceanbase.__all_virtual_table WHERE table_name='Z0CASE';
DROP TABLE Z0CASE;
CREATE TABLE Z0CASE(Z0_TEST0 BIT(11) NOT NULL,Z0_TEST1 BIT(10)) with column group (all columns, each column);
INSERT INTO Z0CASE VALUES(b'11111100101',b'0101100110');
SELECT BIN(Z0_TEST0),BIN(Z0_TEST1) FROM Z0CASE;
BIN(Z0_TEST0)	BIN(Z0_TEST1)
11111100101	101100110
SELECT table_id,table_name FROM oceanbase.__all_virtual_table WHERE table_name='Z0CASE';
ALTER TABLE Z0CASE MODIFY column z0_test0 YEAR;
SELECT Z0_TEST0,BIN(Z0_TEST1) FROM Z0CASE;
Z0_TEST0	BIN(Z0_TEST1)
2021	101100110
DESC Z0CASE;
Field	Type	Null	Key	Default	Extra
z0_test0	year(4)	YES		NULL	
Z0_TEST1	bit(10)	YES		NULL	
SELECT table_id,table_name FROM oceanbase.__all_virtual_table WHERE table_name='Z0CASE';
DROP TABLE Z0CASE;
CREATE TABLE Z0CASE(Z0_TEST0 BIT(17) NOT NULL,Z0_TEST1 BIT(10)) with column group (all columns, each column);
INSERT INTO Z0CASE VALUES(b'11101110100010111',b'0101100110');
SELECT BIN(Z0_TEST0),BIN(Z0_TEST1) FROM Z0CASE;
BIN(Z0_TEST0)	BIN(Z0_TEST1)
11101110100010111	101100110
SELECT table_id,table_name FROM oceanbase.__all_virtual_table WHERE table_name='Z0CASE';
ALTER TABLE Z0CASE MODIFY column z0_test0 TIME;
SELECT Z0_TEST0,BIN(Z0_TEST1) FROM Z0CASE;
Z0_TEST0	BIN(Z0_TEST1)
12:21:35	101100110
DESC Z0CASE;
Field	Type	Null	Key	Default	Extra
z0_test0	time	YES		NULL	
Z0_TEST1	bit(10)	YES		NULL	
SELECT table_id,table_name FROM oceanbase.__all_virtual_table WHERE table_name='Z0CASE';
BIT类型加约束 --> CHECK
DROP TABLE Z0CASE;
CREATE TABLE Z0CASE(Z0_TEST0 BIT(25),Z0_TEST1 BIT(25),
CONSTRAINT cst check (Z0_TEST0=Z0_TEST1)) with column group (all columns, each column);
INSERT INTO Z0CASE VALUES(0,0);
INSERT INTO Z0CASE VALUES(b'1101101000011111010010011',b'1101101000011111010010011');
SELECT BIN(Z0_TEST0),BIN(Z0_TEST1) FROM Z0CASE;
BIN(Z0_TEST0)	BIN(Z0_TEST1)
0	0
1101101000011111010010011	1101101000011111010010011
SELECT table_id,table_name FROM oceanbase.__all_virtual_table WHERE table_name='Z0CASE';
ALTER TABLE Z0CASE MODIFY column z0_test0 BIT(26);
ERROR 0A000: Alter column with check constraint not supported
ALTER TABLE Z0CASE MODIFY column z0_test0 BIT(24);
ERROR 0A000: Alter column with check constraint not supported
ALTER TABLE Z0CASE MODIFY column z0_test0 BIT(25);
SELECT BIN(Z0_TEST0) FROM Z0CASE;
BIN(Z0_TEST0)
0
1101101000011111010010011
SELECT table_id,table_name FROM oceanbase.__all_virtual_table WHERE table_name='Z0CASE';
ALTER TABLE Z0CASE MODIFY column z0_test0 INT;
ERROR 0A000: Alter column with check constraint not supported
ALTER TABLE Z0CASE MODIFY column z0_test0 MEDIUMINT;
ERROR 0A000: Alter column with check constraint not supported
ALTER TABLE Z0CASE MODIFY column z0_test0 SMALLINT;
ERROR 0A000: Alter column with check constraint not supported
ALTER TABLE Z0CASE MODIFY column z0_test0 TINYINT;
ERROR 0A000: Alter column with check constraint not supported
ALTER TABLE Z0CASE MODIFY column z0_test0 FLOAT(20,2);
ERROR 0A000: Alter column with check constraint not supported
ALTER TABLE Z0CASE MODIFY column z0_test0 DOUBLE(20,2);
ERROR 0A000: Alter column with check constraint not supported
ALTER TABLE Z0CASE MODIFY column z0_test0 DECIMAL(20,2);
ERROR 0A000: Alter column with check constraint not supported
ALTER TABLE Z0CASE MODIFY column z0_test0 CHAR(18);
ERROR 0A000: Alter column with check constraint not supported
ALTER TABLE Z0CASE MODIFY column z0_test0 VARCHAR(18);
ERROR 0A000: Alter column with check constraint not supported
ALTER TABLE Z0CASE MODIFY column z0_test0 BINARY(18);
ERROR 0A000: Alter column with check constraint not supported
ALTER TABLE Z0CASE MODIFY column z0_test0 VARBINARY(18);
ERROR 0A000: Alter column with check constraint not supported
ALTER TABLE Z0CASE MODIFY column z0_test0 TEXT;
ERROR 0A000: Alter column with check constraint not supported
ALTER TABLE Z0CASE MODIFY column z0_test0 BLOB;
ERROR 0A000: Alter column with check constraint not supported
ALTER TABLE Z0CASE MODIFY column z0_test0 DATE;
ERROR 0A000: Alter column with check constraint not supported
ALTER TABLE Z0CASE MODIFY column z0_test0 DATETIME;
ERROR 0A000: Alter column with check constraint not supported
ALTER TABLE Z0CASE MODIFY column z0_test0 TIMESTAMP;
ERROR 0A000: Alter column with check constraint not supported
ALTER TABLE Z0CASE MODIFY column z0_test0 YEAR;
ERROR 0A000: Alter column with check constraint not supported
ALTER TABLE Z0CASE MODIFY column z0_test0 TIME;
ERROR 0A000: Alter column with check constraint not supported
unique
DROP TABLE Z0CASE;
CREATE TABLE Z0CASE(Z0_TEST0 BIT(25) UNIQUE,Z0_TEST1 BIT(25)) with column group (all columns, each column);
INSERT INTO Z0CASE VALUES(0,b'11011010000');
INSERT INTO Z0CASE VALUES(b'1101101000011111010010011',b'110110100001111101');
SELECT BIN(Z0_TEST0),BIN(Z0_TEST1) FROM Z0CASE;
BIN(Z0_TEST0)	BIN(Z0_TEST1)
0	11011010000
1101101000011111010010011	110110100001111101
SELECT table_id,table_name FROM oceanbase.__all_virtual_table WHERE table_name='Z0CASE';
ALTER TABLE Z0CASE MODIFY column z0_test0 BIT(26);
SELECT BIN(Z0_TEST0),BIN(Z0_TEST1) FROM Z0CASE;
BIN(Z0_TEST0)	BIN(Z0_TEST1)
0	11011010000
1101101000011111010010011	110110100001111101
SELECT table_id,table_name FROM oceanbase.__all_virtual_table WHERE table_name='Z0CASE';
ALTER TABLE Z0CASE MODIFY column z0_test0 BIT(25);
SELECT BIN(Z0_TEST0),BIN(Z0_TEST1) FROM Z0CASE;
BIN(Z0_TEST0)	BIN(Z0_TEST1)
0	11011010000
1101101000011111010010011	110110100001111101
DESC Z0CASE;
Field	Type	Null	Key	Default	Extra
z0_test0	bit(25)	YES	UNI	NULL	
Z0_TEST1	bit(25)	YES		NULL	
SELECT table_id,table_name FROM oceanbase.__all_virtual_table WHERE table_name='Z0CASE';
ALTER TABLE Z0CASE MODIFY column z0_test0 INT;
SELECT Z0_TEST0 FROM Z0CASE;
Z0_TEST0
0
28589715
DESC Z0CASE;
Field	Type	Null	Key	Default	Extra
z0_test0	int(11)	YES	UNI	NULL	
Z0_TEST1	bit(25)	YES		NULL	
SELECT table_id,table_name FROM oceanbase.__all_virtual_table WHERE table_name='Z0CASE';
DROP TABLE Z0CASE;
CREATE TABLE Z0CASE(Z0_TEST0 BIT(25) UNIQUE,Z0_TEST1 BIT(25)) with column group (all columns, each column);
INSERT INTO Z0CASE VALUES(0,b'11011010000');
INSERT INTO Z0CASE VALUES(b'11011010011',b'110110100001111101');
SELECT BIN(Z0_TEST0),BIN(Z0_TEST1) FROM Z0CASE;
BIN(Z0_TEST0)	BIN(Z0_TEST1)
0	11011010000
11011010011	110110100001111101
SELECT table_id,table_name FROM oceanbase.__all_virtual_table WHERE table_name='Z0CASE';
ALTER TABLE Z0CASE MODIFY column z0_test0 MEDIUMINT;
SELECT Z0_TEST0 FROM Z0CASE;
Z0_TEST0
0
1747
DESC Z0CASE;
Field	Type	Null	Key	Default	Extra
z0_test0	mediumint(9)	YES	UNI	NULL	
Z0_TEST1	bit(25)	YES		NULL	
SELECT table_id,table_name FROM oceanbase.__all_virtual_table WHERE table_name='Z0CASE';
DROP TABLE Z0CASE;
CREATE TABLE Z0CASE(Z0_TEST0 BIT(25) UNIQUE,Z0_TEST1 BIT(25)) with column group (all columns, each column);
INSERT INTO Z0CASE VALUES(0,b'11011010000');
INSERT INTO Z0CASE VALUES(b'11011010011',b'110110100001111101');
SELECT BIN(Z0_TEST0),BIN(Z0_TEST1) FROM Z0CASE;
BIN(Z0_TEST0)	BIN(Z0_TEST1)
0	11011010000
11011010011	110110100001111101
SELECT table_id,table_name FROM oceanbase.__all_virtual_table WHERE table_name='Z0CASE';
ALTER TABLE Z0CASE MODIFY column z0_test0 SMALLINT;
SELECT Z0_TEST0 FROM Z0CASE;
Z0_TEST0
0
1747
DESC Z0CASE;
Field	Type	Null	Key	Default	Extra
z0_test0	smallint(6)	YES	UNI	NULL	
Z0_TEST1	bit(25)	YES		NULL	
SELECT table_id,table_name FROM oceanbase.__all_virtual_table WHERE table_name='Z0CASE';
DROP TABLE Z0CASE;
CREATE TABLE Z0CASE(Z0_TEST0 BIT(25) UNIQUE,Z0_TEST1 BIT(25)) with column group (all columns, each column);
INSERT INTO Z0CASE VALUES(0,b'11011010000');
INSERT INTO Z0CASE VALUES(b'11010101',b'110110100001111101');
SELECT BIN(Z0_TEST0),BIN(Z0_TEST1) FROM Z0CASE;
BIN(Z0_TEST0)	BIN(Z0_TEST1)
0	11011010000
11010101	110110100001111101
SELECT table_id,table_name FROM oceanbase.__all_virtual_table WHERE table_name='Z0CASE';
ALTER TABLE Z0CASE MODIFY column z0_test0 TINYINT;
SELECT Z0_TEST0 FROM Z0CASE;
Z0_TEST0
0
127
DESC Z0CASE;
Field	Type	Null	Key	Default	Extra
z0_test0	tinyint(4)	YES	UNI	NULL	
Z0_TEST1	bit(25)	YES		NULL	
SELECT table_id,table_name FROM oceanbase.__all_virtual_table WHERE table_name='Z0CASE';
DROP TABLE Z0CASE;
CREATE TABLE Z0CASE(Z0_TEST0 BIT(25) UNIQUE,Z0_TEST1 BIT(25)) with column group (all columns, each column);
INSERT INTO Z0CASE VALUES(0,b'11011010000');
INSERT INTO Z0CASE VALUES(b'11010101',b'110110100001111101');
SELECT BIN(Z0_TEST0),BIN(Z0_TEST1) FROM Z0CASE;
BIN(Z0_TEST0)	BIN(Z0_TEST1)
0	11011010000
11010101	110110100001111101
SELECT table_id,table_name FROM oceanbase.__all_virtual_table WHERE table_name='Z0CASE';
ALTER TABLE Z0CASE MODIFY column z0_test0 FLOAT(20,2);
SELECT Z0_TEST0 FROM Z0CASE;
Z0_TEST0
0.00
213.00
DESC Z0CASE;
Field	Type	Null	Key	Default	Extra
z0_test0	float(20,2)	YES	UNI	NULL	
Z0_TEST1	bit(25)	YES		NULL	
SELECT table_id,table_name FROM oceanbase.__all_virtual_table WHERE table_name='Z0CASE';
DROP TABLE Z0CASE;
CREATE TABLE Z0CASE(Z0_TEST0 BIT(25) UNIQUE,Z0_TEST1 BIT(25)) with column group (all columns, each column);
INSERT INTO Z0CASE VALUES(0,b'11011010000');
INSERT INTO Z0CASE VALUES(b'11010101',b'110110100001111101');
SELECT BIN(Z0_TEST0),BIN(Z0_TEST1) FROM Z0CASE;
BIN(Z0_TEST0)	BIN(Z0_TEST1)
0	11011010000
11010101	110110100001111101
SELECT table_id,table_name FROM oceanbase.__all_virtual_table WHERE table_name='Z0CASE';
ALTER TABLE Z0CASE MODIFY column z0_test0 DOUBLE(20,2);
SELECT Z0_TEST0 FROM Z0CASE;
Z0_TEST0
0.00
213.00
DESC Z0CASE;
Field	Type	Null	Key	Default	Extra
z0_test0	double(20,2)	YES	UNI	NULL	
Z0_TEST1	bit(25)	YES		NULL	
SELECT table_id,table_name FROM oceanbase.__all_virtual_table WHERE table_name='Z0CASE';
DROP TABLE Z0CASE;
CREATE TABLE Z0CASE(Z0_TEST0 BIT(25) UNIQUE,Z0_TEST1 BIT(25)) with column group (all columns, each column);
INSERT INTO Z0CASE VALUES(0,b'11011010000');
INSERT INTO Z0CASE VALUES(b'11010101',b'110110100001111101');
SELECT BIN(Z0_TEST0),BIN(Z0_TEST1) FROM Z0CASE;
BIN(Z0_TEST0)	BIN(Z0_TEST1)
0	11011010000
11010101	110110100001111101
SELECT table_id,table_name FROM oceanbase.__all_virtual_table WHERE table_name='Z0CASE';
ALTER TABLE Z0CASE MODIFY column z0_test0 DECIMAL(20,2);
SELECT Z0_TEST0 FROM Z0CASE;
Z0_TEST0
0.00
213.00
DESC Z0CASE;
Field	Type	Null	Key	Default	Extra
z0_test0	decimal(20,2)	YES	UNI	NULL	
Z0_TEST1	bit(25)	YES		NULL	
SELECT table_id,table_name FROM oceanbase.__all_virtual_table WHERE table_name='Z0CASE';
DROP TABLE Z0CASE;
CREATE TABLE Z0CASE(Z0_TEST0 BIT(25) UNIQUE,Z0_TEST1 BIT(25)) with column group (all columns, each column);
INSERT INTO Z0CASE VALUES(0,b'11011010000');
INSERT INTO Z0CASE VALUES(b'11010101',b'110110100001111101');
SELECT BIN(Z0_TEST0),BIN(Z0_TEST1) FROM Z0CASE;
BIN(Z0_TEST0)	BIN(Z0_TEST1)
0	11011010000
11010101	110110100001111101
SELECT table_id,table_name FROM oceanbase.__all_virtual_table WHERE table_name='Z0CASE';
ALTER TABLE Z0CASE MODIFY column z0_test0 CHAR(18);
SELECT Z0_TEST0 FROM Z0CASE;
Z0_TEST0
0
213
DESC Z0CASE;
Field	Type	Null	Key	Default	Extra
z0_test0	char(18)	YES	UNI	NULL	
Z0_TEST1	bit(25)	YES		NULL	
SELECT table_id,table_name FROM oceanbase.__all_virtual_table WHERE table_name='Z0CASE';
DROP TABLE Z0CASE;
CREATE TABLE Z0CASE(Z0_TEST0 BIT(25) UNIQUE,Z0_TEST1 BIT(25)) with column group (all columns, each column);
INSERT INTO Z0CASE VALUES(0,b'11011010000');
INSERT INTO Z0CASE VALUES(b'11010101',b'110110100001111101');
SELECT BIN(Z0_TEST0),BIN(Z0_TEST1) FROM Z0CASE;
BIN(Z0_TEST0)	BIN(Z0_TEST1)
0	11011010000
11010101	110110100001111101
SELECT table_id,table_name FROM oceanbase.__all_virtual_table WHERE table_name='Z0CASE';
ALTER TABLE Z0CASE MODIFY column z0_test0 VARCHAR(18);
SELECT Z0_TEST0 FROM Z0CASE;
Z0_TEST0
0
213
DESC Z0CASE;
Field	Type	Null	Key	Default	Extra
z0_test0	varchar(18)	YES	UNI	NULL	
Z0_TEST1	bit(25)	YES		NULL	
SELECT table_id,table_name FROM oceanbase.__all_virtual_table WHERE table_name='Z0CASE';
DROP TABLE Z0CASE;
CREATE TABLE Z0CASE(Z0_TEST0 BIT(25) UNIQUE,Z0_TEST1 BIT(25)) with column group (all columns, each column);
INSERT INTO Z0CASE VALUES(0,b'11011010000');
INSERT INTO Z0CASE VALUES(b'11010101',b'110110100001111101');
SELECT BIN(Z0_TEST0),BIN(Z0_TEST1) FROM Z0CASE;
BIN(Z0_TEST0)	BIN(Z0_TEST1)
0	11011010000
11010101	110110100001111101
SELECT table_id,table_name FROM oceanbase.__all_virtual_table WHERE table_name='Z0CASE';
ALTER TABLE Z0CASE MODIFY column z0_test0 BINARY(18);
SELECT Z0_TEST0 FROM Z0CASE;
Z0_TEST0
0                 
213               
DESC Z0CASE;
Field	Type	Null	Key	Default	Extra
z0_test0	binary(18)	YES	UNI	NULL	
Z0_TEST1	bit(25)	YES		NULL	
SELECT table_id,table_name FROM oceanbase.__all_virtual_table WHERE table_name='Z0CASE';
DROP TABLE Z0CASE;
CREATE TABLE Z0CASE(Z0_TEST0 BIT(25) UNIQUE,Z0_TEST1 BIT(25)) with column group (all columns, each column);
INSERT INTO Z0CASE VALUES(0,b'11011010000');
INSERT INTO Z0CASE VALUES(b'11010101',b'110110100001111101');
SELECT BIN(Z0_TEST0),BIN(Z0_TEST1) FROM Z0CASE;
BIN(Z0_TEST0)	BIN(Z0_TEST1)
0	11011010000
11010101	110110100001111101
SELECT table_id,table_name FROM oceanbase.__all_virtual_table WHERE table_name='Z0CASE';
ALTER TABLE Z0CASE MODIFY column z0_test0 VARBINARY(18);
SELECT Z0_TEST0 FROM Z0CASE;
Z0_TEST0
0
213
DESC Z0CASE;
Field	Type	Null	Key	Default	Extra
z0_test0	varbinary(18)	YES	UNI	NULL	
Z0_TEST1	bit(25)	YES		NULL	
SELECT table_id,table_name FROM oceanbase.__all_virtual_table WHERE table_name='Z0CASE';
DROP TABLE Z0CASE;
CREATE TABLE Z0CASE(Z0_TEST0 BIT(25) UNIQUE,Z0_TEST1 BIT(25)) with column group (all columns, each column);
INSERT INTO Z0CASE VALUES(0,b'11011010000');
INSERT INTO Z0CASE VALUES(b'11010101',b'110110100001111101');
SELECT BIN(Z0_TEST0),BIN(Z0_TEST1) FROM Z0CASE;
BIN(Z0_TEST0)	BIN(Z0_TEST1)
0	11011010000
11010101	110110100001111101
SELECT table_id,table_name FROM oceanbase.__all_virtual_table WHERE table_name='Z0CASE';
ALTER TABLE Z0CASE MODIFY column z0_test0 TEXT;
ERROR 42000: The used storage engine can't index column 'z0_test0'
ALTER TABLE Z0CASE MODIFY column z0_test0 BLOB;
ERROR 42000: The used storage engine can't index column 'z0_test0'
DROP TABLE Z0CASE;
CREATE TABLE Z0CASE(Z0_TEST0 BIT(25) UNIQUE,Z0_TEST1 BIT(25)) with column group (all columns, each column);
INSERT INTO Z0CASE VALUES(b'1001101000110010101000011',b'110110100001111101');
SELECT BIN(Z0_TEST0),BIN(Z0_TEST1) FROM Z0CASE;
BIN(Z0_TEST0)	BIN(Z0_TEST1)
1001101000110010101000011	110110100001111101
SELECT table_id,table_name FROM oceanbase.__all_virtual_table WHERE table_name='Z0CASE';
ALTER TABLE Z0CASE MODIFY column z0_test0 DATE;
SELECT Z0_TEST0 FROM Z0CASE;
Z0_TEST0
2021-10-11
DESC Z0CASE;
Field	Type	Null	Key	Default	Extra
z0_test0	date	YES	UNI	NULL	
Z0_TEST1	bit(25)	YES		NULL	
SELECT table_id,table_name FROM oceanbase.__all_virtual_table WHERE table_name='Z0CASE';
DROP TABLE Z0CASE;
CREATE TABLE Z0CASE(Z0_TEST0 BIT(25) UNIQUE,Z0_TEST1 BIT(25)) with column group (all columns, each column);
INSERT INTO Z0CASE VALUES(b'1001101000110010101000011',b'110110100001111101');
SELECT BIN(Z0_TEST0),BIN(Z0_TEST1) FROM Z0CASE;
BIN(Z0_TEST0)	BIN(Z0_TEST1)
1001101000110010101000011	110110100001111101
SELECT table_id,table_name FROM oceanbase.__all_virtual_table WHERE table_name='Z0CASE';
ALTER TABLE Z0CASE MODIFY column z0_test0 DATETIME;
SELECT Z0_TEST0 FROM Z0CASE;
Z0_TEST0
2021-10-11 00:00:00
DESC Z0CASE;
Field	Type	Null	Key	Default	Extra
z0_test0	datetime	YES	UNI	NULL	
Z0_TEST1	bit(25)	YES		NULL	
SELECT table_id,table_name FROM oceanbase.__all_virtual_table WHERE table_name='Z0CASE';
DROP TABLE Z0CASE;
CREATE TABLE Z0CASE(Z0_TEST0 BIT(25) UNIQUE,Z0_TEST1 BIT(25)) with column group (all columns, each column);
INSERT INTO Z0CASE VALUES(b'1001101000110010101000011',b'110110100001111101');
SELECT BIN(Z0_TEST0),BIN(Z0_TEST1) FROM Z0CASE;
BIN(Z0_TEST0)	BIN(Z0_TEST1)
1001101000110010101000011	110110100001111101
SELECT table_id,table_name FROM oceanbase.__all_virtual_table WHERE table_name='Z0CASE';
ALTER TABLE Z0CASE MODIFY column z0_test0 TIMESTAMP;
SELECT Z0_TEST0 FROM Z0CASE;
Z0_TEST0
2021-10-11 00:00:00
DESC Z0CASE;
Field	Type	Null	Key	Default	Extra
z0_test0	timestamp	YES	UNI	NULL	
Z0_TEST1	bit(25)	YES		NULL	
SELECT table_id,table_name FROM oceanbase.__all_virtual_table WHERE table_name='Z0CASE';
DROP TABLE Z0CASE;
CREATE TABLE Z0CASE(Z0_TEST0 BIT(15) UNIQUE,Z0_TEST1 BIT(25)) with column group (all columns, each column);
INSERT INTO Z0CASE VALUES(b'000011111100101',b'110110100001111101');
SELECT BIN(Z0_TEST0),BIN(Z0_TEST1) FROM Z0CASE;
BIN(Z0_TEST0)	BIN(Z0_TEST1)
11111100101	110110100001111101
SELECT table_id,table_name FROM oceanbase.__all_virtual_table WHERE table_name='Z0CASE';
ALTER TABLE Z0CASE MODIFY column z0_test0 YEAR;
SELECT Z0_TEST0 FROM Z0CASE;
Z0_TEST0
2021
DESC Z0CASE;
Field	Type	Null	Key	Default	Extra
z0_test0	year(4)	YES	UNI	NULL	
Z0_TEST1	bit(25)	YES		NULL	
SELECT table_id,table_name FROM oceanbase.__all_virtual_table WHERE table_name='Z0CASE';
DROP TABLE Z0CASE;
CREATE TABLE Z0CASE(Z0_TEST0 BIT(20) UNIQUE,Z0_TEST1 BIT(25)) with column group (all columns, each column);
INSERT INTO Z0CASE VALUES(b'00011101100111100010',b'110110100001111101');
SELECT BIN(Z0_TEST0),BIN(Z0_TEST1) FROM Z0CASE;
BIN(Z0_TEST0)	BIN(Z0_TEST1)
11101100111100010	110110100001111101
SELECT table_id,table_name FROM oceanbase.__all_virtual_table WHERE table_name='Z0CASE';
ALTER TABLE Z0CASE MODIFY column z0_test0 TIME;
SELECT Z0_TEST0 FROM Z0CASE;
Z0_TEST0
12:13:14
DESC Z0CASE;
Field	Type	Null	Key	Default	Extra
z0_test0	time	YES	UNI	NULL	
Z0_TEST1	bit(25)	YES		NULL	
SELECT table_id,table_name FROM oceanbase.__all_virtual_table WHERE table_name='Z0CASE';
DROP TABLE Z0CASE;
SET sql_mode='STRICT_TRANS_TABLES,STRICT_ALL_TABLES';
