SET sql_mode='';

DROP TABLE IF EXISTS Z0CASE;
CHAR
CREATE TABLE Z0CASE(Z0_TEST0 CHAR(100), Z0_TEST1 VARCHAR(50),Z0_TEST2 INT) with column group (all columns, each column);
INSERT INTO  Z0CASE (z0_test0,z0_test1,Z0_TEST2)VALUES('abc ABC','abc ABC',1);
INSERT INTO  Z0CASE (z0_test0,z0_test1,Z0_TEST2)VALUES('中文字符@!#$%^','中文字符@!#$%^',2);
INSERT INTO  Z0CASE (z0_test0,z0_test1,Z0_TEST2)VALUES(NULL,NULL,0);
INSERT INTO  Z0CASE (z0_test0,z0_test1,Z0_TEST2)VALUES(111,111,11);
INSERT INTO  Z0CASE (z0_test0,z0_test1,Z0_TEST2)VALUES('1111.1111','1111.1111',100);
INSERT INTO  Z0CASE (z0_test0,z0_test1,Z0_TEST2)VALUES('2011-11-11 11:11:11','2011-11-11 11:11:11',120);
INSERT INTO  Z0CASE (z0_test0,z0_test1,Z0_TEST2)VALUES(20111111,20111111,3);
INSERT INTO  Z0CASE (z0_test0,z0_test1,Z0_TEST2)VALUES(NULL,NULL,4);
INSERT INTO  Z0CASE (z0_test0,z0_test1,Z0_TEST2)VALUES('','',10);
INSERT INTO  Z0CASE (z0_test0,z0_test1,Z0_TEST2)VALUES('    ',' ',20);
SELECT * FROM Z0CASE ORDER BY Z0_TEST2;
Z0_TEST0	Z0_TEST1	Z0_TEST2
NULL	NULL	0
abc ABC	abc ABC	1
中文字符@!#$%^	中文字符@!#$%^	2
20111111	20111111	3
NULL	NULL	4
		10
111	111	11
	 	20
1111.1111	1111.1111	100
2011-11-11 11:11:11	2011-11-11 11:11:11	120
SELECT table_id,table_name FROM oceanbase.__all_virtual_table WHERE table_name='Z0CASE';
CHAR --> CHAR
ALTER TABLE Z0CASE MODIFY COLUMN  z0_test0 CHAR(100);
DESC Z0CASE;
Field	Type	Null	Key	Default	Extra
z0_test0	char(100)	YES		NULL	
Z0_TEST1	varchar(50)	YES		NULL	
Z0_TEST2	int(11)	YES		NULL	
SELECT * FROM Z0CASE ORDER BY Z0_TEST2;
z0_test0	Z0_TEST1	Z0_TEST2
NULL	NULL	0
abc ABC	abc ABC	1
中文字符@!#$%^	中文字符@!#$%^	2
20111111	20111111	3
NULL	NULL	4
		10
111	111	11
	 	20
1111.1111	1111.1111	100
2011-11-11 11:11:11	2011-11-11 11:11:11	120
SELECT table_id,table_name FROM oceanbase.__all_virtual_table WHERE table_name='Z0CASE';
ALTER TABLE Z0CASE MODIFY COLUMN  z0_test0 CHAR(101);
DESC Z0CASE;
Field	Type	Null	Key	Default	Extra
z0_test0	char(101)	YES		NULL	
Z0_TEST1	varchar(50)	YES		NULL	
Z0_TEST2	int(11)	YES		NULL	
SELECT * FROM Z0CASE ORDER BY Z0_TEST2;
z0_test0	Z0_TEST1	Z0_TEST2
NULL	NULL	0
abc ABC	abc ABC	1
中文字符@!#$%^	中文字符@!#$%^	2
20111111	20111111	3
NULL	NULL	4
		10
111	111	11
	 	20
1111.1111	1111.1111	100
2011-11-11 11:11:11	2011-11-11 11:11:11	120
SELECT table_id,table_name FROM oceanbase.__all_virtual_table WHERE table_name='Z0CASE';
ALTER TABLE Z0CASE MODIFY COLUMN  z0_test0 CHAR(99);
DESC Z0CASE;
Field	Type	Null	Key	Default	Extra
z0_test0	char(99)	YES		NULL	
Z0_TEST1	varchar(50)	YES		NULL	
Z0_TEST2	int(11)	YES		NULL	
SELECT * FROM Z0CASE ORDER BY Z0_TEST2;
z0_test0	Z0_TEST1	Z0_TEST2
NULL	NULL	0
abc ABC	abc ABC	1
中文字符@!#$%^	中文字符@!#$%^	2
20111111	20111111	3
NULL	NULL	4
		10
111	111	11
	 	20
1111.1111	1111.1111	100
2011-11-11 11:11:11	2011-11-11 11:11:11	120
SELECT table_id,table_name FROM oceanbase.__all_virtual_table WHERE table_name='Z0CASE';
ALTER TABLE Z0CASE MODIFY COLUMN  z0_test0 CHAR(0);
DESC Z0CASE;
Field	Type	Null	Key	Default	Extra
z0_test0	char(0)	YES		NULL	
Z0_TEST1	varchar(50)	YES		NULL	
Z0_TEST2	int(11)	YES		NULL	
SELECT * FROM Z0CASE ORDER BY Z0_TEST2;
z0_test0	Z0_TEST1	Z0_TEST2
NULL	NULL	0
	abc ABC	1
	中文字符@!#$%^	2
	20111111	3
NULL	NULL	4
		10
	111	11
	 	20
	1111.1111	100
	2011-11-11 11:11:11	120
SELECT table_id,table_name FROM oceanbase.__all_virtual_table WHERE table_name='Z0CASE';
DELETE FROM Z0CASE where 1=1;
ALTER TABLE Z0CASE MODIFY COLUMN  z0_test0 CHAR(3) DEFAULT '123';
DESC Z0CASE;
Field	Type	Null	Key	Default	Extra
z0_test0	char(3)	YES		123	
Z0_TEST1	varchar(50)	YES		NULL	
Z0_TEST2	int(11)	YES		NULL	
SELECT table_id,table_name FROM oceanbase.__all_virtual_table WHERE table_name='Z0CASE';
ALTER TABLE Z0CASE MODIFY COLUMN  z0_test0 CHAR(2) DEFAULT '123';
ERROR 42000: Invalid default value for 'z0_test0'
ALTER TABLE Z0CASE MODIFY COLUMN  z0_test0 CHAR(0) DEFAULT '  ';
DESC Z0CASE;
Field	Type	Null	Key	Default	Extra
z0_test0	char(0)	YES			
Z0_TEST1	varchar(50)	YES		NULL	
Z0_TEST2	int(11)	YES		NULL	
SELECT table_id,table_name FROM oceanbase.__all_virtual_table WHERE table_name='Z0CASE';
CHAR --> VARCHAR
ALTER TABLE Z0CASE MODIFY COLUMN  z0_test0 VARCHAR(99);
DESC Z0CASE;
Field	Type	Null	Key	Default	Extra
z0_test0	varchar(99)	YES		NULL	
Z0_TEST1	varchar(50)	YES		NULL	
Z0_TEST2	int(11)	YES		NULL	
SELECT table_id,table_name FROM oceanbase.__all_virtual_table WHERE table_name='Z0CASE';
ALTER TABLE Z0CASE MODIFY COLUMN z0_test0 VARCHAR(100) DEFAULT NULL;
DESC Z0CASE;
Field	Type	Null	Key	Default	Extra
z0_test0	varchar(100)	YES		NULL	
Z0_TEST1	varchar(50)	YES		NULL	
Z0_TEST2	int(11)	YES		NULL	
SELECT table_id,table_name FROM oceanbase.__all_virtual_table WHERE table_name='Z0CASE';
ALTER TABLE Z0CASE MODIFY COLUMN z0_test0 VARCHAR(101) DEFAULT NULL;
DESC Z0CASE;
Field	Type	Null	Key	Default	Extra
z0_test0	varchar(101)	YES		NULL	
Z0_TEST1	varchar(50)	YES		NULL	
Z0_TEST2	int(11)	YES		NULL	
SELECT table_id,table_name FROM oceanbase.__all_virtual_table WHERE table_name='Z0CASE';
ALTER TABLE Z0CASE MODIFY COLUMN z0_test0 VARCHAR(100) DEFAULT NULL;
DESC Z0CASE;
Field	Type	Null	Key	Default	Extra
z0_test0	varchar(100)	YES		NULL	
Z0_TEST1	varchar(50)	YES		NULL	
Z0_TEST2	int(11)	YES		NULL	
SELECT table_id,table_name FROM oceanbase.__all_virtual_table WHERE table_name='Z0CASE';
ALTER TABLE Z0CASE MODIFY COLUMN z0_test1 VARCHAR(100) DEFAULT NULL;
DESC Z0CASE;
Field	Type	Null	Key	Default	Extra
z0_test0	varchar(100)	YES		NULL	
z0_test1	varchar(100)	YES		NULL	
Z0_TEST2	int(11)	YES		NULL	
SELECT table_id,table_name FROM oceanbase.__all_virtual_table WHERE table_name='Z0CASE';
CHAR --> BLOB,此处BLOB和TEXT的长度为虚构的，其实不起任何作用，故BLOB和TEXT后面数字改变不会重写数据。
DROP TABLE Z0CASE;
CREATE TABLE Z0CASE(Z0_TEST0 CHAR(100), Z0_TEST1 VARCHAR(50),Z0_TEST2 INT) with column group (all columns, each column);
INSERT INTO  Z0CASE (z0_test0,z0_test1,Z0_TEST2)VALUES('abc ABC','abc ABC',12);
INSERT INTO  Z0CASE (z0_test0,z0_test1,Z0_TEST2)VALUES('中文字符@!#$%^','中文字符@!#$%^',13);
INSERT INTO  Z0CASE (z0_test0,z0_test1,Z0_TEST2)VALUES(NULL,NULL,40);
INSERT INTO  Z0CASE (z0_test0,z0_test1,Z0_TEST2)VALUES(111,111,11);
INSERT INTO  Z0CASE (z0_test0,z0_test1,Z0_TEST2)VALUES('1111.1111','1111.1111',100);
INSERT INTO  Z0CASE (z0_test0,z0_test1,Z0_TEST2)VALUES('2011-11-11 11:11:11','2011-11-11 11:11:11',120);
INSERT INTO  Z0CASE (z0_test0,z0_test1,Z0_TEST2)VALUES(20111111,20111111,1);
INSERT INTO  Z0CASE (z0_test0,z0_test1,Z0_TEST2)VALUES(NULL,NULL,0);
INSERT INTO  Z0CASE (z0_test0,z0_test1,Z0_TEST2)VALUES('','',10);
INSERT INTO  Z0CASE (z0_test0,z0_test1,Z0_TEST2)VALUES('    ',' ',20);
SELECT * FROM Z0CASE ORDER BY Z0_TEST2;
Z0_TEST0	Z0_TEST1	Z0_TEST2
NULL	NULL	0
20111111	20111111	1
		10
111	111	11
abc ABC	abc ABC	12
中文字符@!#$%^	中文字符@!#$%^	13
	 	20
NULL	NULL	40
1111.1111	1111.1111	100
2011-11-11 11:11:11	2011-11-11 11:11:11	120
SELECT table_id,table_name FROM oceanbase.__all_virtual_table WHERE table_name='Z0CASE';
ALTER TABLE Z0CASE MODIFY COLUMN z0_test0 BLOB(100);
SELECT Z0_TEST0 FROM Z0CASE ORDER BY Z0_TEST2;
Z0_TEST0
NULL
20111111

111
abc ABC
中文字符@!#$%^

NULL
1111.1111
2011-11-11 11:11:11
DESC Z0CASE;
Field	Type	Null	Key	Default	Extra
z0_test0	tinyblob	YES		NULL	
Z0_TEST1	varchar(50)	YES		NULL	
Z0_TEST2	int(11)	YES		NULL	
SELECT table_id,table_name FROM oceanbase.__all_virtual_table WHERE table_name='Z0CASE';
ALTER TABLE Z0CASE MODIFY COLUMN z0_test0 BLOB(101);
DESC Z0CASE;
Field	Type	Null	Key	Default	Extra
z0_test0	tinyblob	YES		NULL	
Z0_TEST1	varchar(50)	YES		NULL	
Z0_TEST2	int(11)	YES		NULL	
SELECT table_id,table_name FROM oceanbase.__all_virtual_table WHERE table_name='Z0CASE';
ALTER TABLE Z0CASE MODIFY COLUMN z0_test0 BLOB(99);
DESC Z0CASE;
Field	Type	Null	Key	Default	Extra
z0_test0	tinyblob	YES		NULL	
Z0_TEST1	varchar(50)	YES		NULL	
Z0_TEST2	int(11)	YES		NULL	
SELECT table_id,table_name FROM oceanbase.__all_virtual_table WHERE table_name='Z0CASE';
CHAR --> TEXT
DROP TABLE Z0CASE;
CREATE TABLE Z0CASE(Z0_TEST0 CHAR(100), Z0_TEST1 VARCHAR(50),Z0_TEST2 INT) with column group (all columns, each column);
INSERT INTO  Z0CASE (z0_test0,z0_test1,Z0_TEST2)VALUES('abc ABC','abc ABC',19);
INSERT INTO  Z0CASE (z0_test0,z0_test1,Z0_TEST2)VALUES('中文字符@!#$%^','中文字符@!#$%^',18);
INSERT INTO  Z0CASE (z0_test0,z0_test1,Z0_TEST2)VALUES(NULL,NULL,70);
INSERT INTO  Z0CASE (z0_test0,z0_test1,Z0_TEST2)VALUES(111,111,11);
INSERT INTO  Z0CASE (z0_test0,z0_test1,Z0_TEST2)VALUES('1111.1111','1111.1111',100);
INSERT INTO  Z0CASE (z0_test0,z0_test1,Z0_TEST2)VALUES('2011-11-11 11:11:11','2011-11-11 11:11:11',620);
INSERT INTO  Z0CASE (z0_test0,z0_test1,Z0_TEST2)VALUES(20111111,20111111,1);
INSERT INTO  Z0CASE (z0_test0,z0_test1,Z0_TEST2)VALUES(NULL,NULL,0);
INSERT INTO  Z0CASE (z0_test0,z0_test1,Z0_TEST2)VALUES('','',10);
INSERT INTO  Z0CASE (z0_test0,z0_test1,Z0_TEST2)VALUES('    ',' ',20);
SELECT * FROM Z0CASE ORDER BY Z0_TEST2;
Z0_TEST0	Z0_TEST1	Z0_TEST2
NULL	NULL	0
20111111	20111111	1
		10
111	111	11
中文字符@!#$%^	中文字符@!#$%^	18
abc ABC	abc ABC	19
	 	20
NULL	NULL	70
1111.1111	1111.1111	100
2011-11-11 11:11:11	2011-11-11 11:11:11	620
SELECT table_id,table_name FROM oceanbase.__all_virtual_table WHERE table_name='Z0CASE';
ALTER TABLE Z0CASE MODIFY COLUMN z0_test0 TEXT(100);
SELECT Z0_TEST0 FROM Z0CASE ORDER BY Z0_TEST2;
Z0_TEST0
NULL
20111111

111
中文字符@!#$%^
abc ABC

NULL
1111.1111
2011-11-11 11:11:11
DESC Z0CASE;
Field	Type	Null	Key	Default	Extra
z0_test0	text	YES		NULL	
Z0_TEST1	varchar(50)	YES		NULL	
Z0_TEST2	int(11)	YES		NULL	
SELECT table_id,table_name FROM oceanbase.__all_virtual_table WHERE table_name='Z0CASE';
ALTER TABLE Z0CASE MODIFY COLUMN z0_test0 TEXT(101);
DESC Z0CASE;
Field	Type	Null	Key	Default	Extra
z0_test0	text	YES		NULL	
Z0_TEST1	varchar(50)	YES		NULL	
Z0_TEST2	int(11)	YES		NULL	
SELECT table_id,table_name FROM oceanbase.__all_virtual_table WHERE table_name='Z0CASE';
ALTER TABLE Z0CASE MODIFY COLUMN z0_test0 TEXT(99);
DESC Z0CASE;
Field	Type	Null	Key	Default	Extra
z0_test0	text	YES		NULL	
Z0_TEST1	varchar(50)	YES		NULL	
Z0_TEST2	int(11)	YES		NULL	
SELECT table_id,table_name FROM oceanbase.__all_virtual_table WHERE table_name='Z0CASE';
CHAR --> SET
DROP TABLE Z0CASE;
CREATE TABLE Z0CASE(Z0_TEST0 CHAR(100), Z0_TEST1 VARCHAR(50),Z0_TEST2 INT) with column group (all columns, each column);
INSERT INTO  Z0CASE (z0_test0,z0_test1,Z0_TEST2)VALUES('abc ABC','abc ABC',1);
INSERT INTO  Z0CASE (z0_test0,z0_test1,Z0_TEST2)VALUES('中文字符@!#$%^','中文字符@!#$%^',2);
SELECT * FROM Z0CASE ORDER BY Z0_TEST2;
Z0_TEST0	Z0_TEST1	Z0_TEST2
abc ABC	abc ABC	1
中文字符@!#$%^	中文字符@!#$%^	2
SELECT table_id,table_name FROM oceanbase.__all_virtual_table WHERE table_name='Z0CASE';
ALTER TABLE Z0CASE MODIFY COLUMN z0_test0 SET('ABC','中文字符@!#$%^');
SELECT * FROM Z0CASE ORDER BY Z0_TEST2;
z0_test0	Z0_TEST1	Z0_TEST2
	abc ABC	1
中文字符@!#$%^	中文字符@!#$%^	2
DESC Z0CASE;
Field	Type	Null	Key	Default	Extra
z0_test0	set('ABC','中文字符@!#$%^')	YES		NULL	
Z0_TEST1	varchar(50)	YES		NULL	
Z0_TEST2	int(11)	YES		NULL	
SELECT table_id,table_name FROM oceanbase.__all_virtual_table WHERE table_name='Z0CASE';
ALTER TABLE Z0CASE MODIFY COLUMN z0_test0 SET('abc ABC','中文字符@!#$%^');
SELECT * FROM Z0CASE ORDER BY Z0_TEST2;
z0_test0	Z0_TEST1	Z0_TEST2
	abc ABC	1
中文字符@!#$%^	中文字符@!#$%^	2
DESC Z0CASE;
Field	Type	Null	Key	Default	Extra
z0_test0	set('abc ABC','中文字符@!#$%^')	YES		NULL	
Z0_TEST1	varchar(50)	YES		NULL	
Z0_TEST2	int(11)	YES		NULL	
SELECT table_id,table_name FROM oceanbase.__all_virtual_table WHERE table_name='Z0CASE';
CHAR --> ENUM
DROP TABLE Z0CASE;
CREATE TABLE Z0CASE(Z0_TEST0 CHAR(100), Z0_TEST1 VARCHAR(50),Z0_TEST2 INT) with column group (all columns, each column);
INSERT INTO  Z0CASE (z0_test0,z0_test1,Z0_TEST2)VALUES('abc ABC','abc ABC',1);
INSERT INTO  Z0CASE (z0_test0,z0_test1,Z0_TEST2)VALUES('中文字符@!#$%^','中文字符@!#$%^',2);
SELECT * FROM Z0CASE ORDER BY Z0_TEST2;
Z0_TEST0	Z0_TEST1	Z0_TEST2
abc ABC	abc ABC	1
中文字符@!#$%^	中文字符@!#$%^	2
SELECT table_id,table_name FROM oceanbase.__all_virtual_table WHERE table_name='Z0CASE';
ALTER TABLE Z0CASE MODIFY COLUMN z0_test0 ENUM('ABC','中文字符@!#$%^') DEFAULT 'abc ABC';
ERROR 42000: Invalid default value for 'z0_test0'
ALTER TABLE Z0CASE MODIFY COLUMN z0_test0 ENUM('abc ABC','中文字符@!#$%^') DEFAULT 'abc ABC';
SELECT * FROM Z0CASE ORDER BY Z0_TEST2;
z0_test0	Z0_TEST1	Z0_TEST2
abc ABC	abc ABC	1
中文字符@!#$%^	中文字符@!#$%^	2
DESC Z0CASE;
Field	Type	Null	Key	Default	Extra
z0_test0	enum('abc ABC','中文字符@!#$%^')	YES		abc ABC	
Z0_TEST1	varchar(50)	YES		NULL	
Z0_TEST2	int(11)	YES		NULL	
SELECT table_id,table_name FROM oceanbase.__all_virtual_table WHERE table_name='Z0CASE';
DROP TABLE Z0CASE;
CREATE TABLE Z0CASE(Z0_TEST0 CHAR(100), Z0_TEST1 VARCHAR(50),Z0_TEST2 INT) with column group (all columns, each column);
INSERT INTO  Z0CASE (z0_test0,z0_test1,Z0_TEST2)VALUES(NULL,NULL,0);
INSERT INTO  Z0CASE (z0_test0,z0_test1,Z0_TEST2)VALUES(111,111,11);
INSERT INTO  Z0CASE (z0_test0,z0_test1,Z0_TEST2)VALUES('1111.1111','1111.1111',100);
INSERT INTO  Z0CASE (z0_test0,z0_test1,Z0_TEST2)VALUES('2011-11-11 11:11:11','2011-11-11 11:11:11',20);
INSERT INTO  Z0CASE (z0_test0,z0_test1,Z0_TEST2)VALUES(20111111,20111111,12);
INSERT INTO  Z0CASE (z0_test0,z0_test1,Z0_TEST2)VALUES(NULL,NULL,1);
INSERT INTO  Z0CASE (z0_test0,z0_test1,Z0_TEST2)VALUES(' ','',10);
SELECT * FROM Z0CASE ORDER BY Z0_TEST2;
Z0_TEST0	Z0_TEST1	Z0_TEST2
NULL	NULL	0
NULL	NULL	1
		10
111	111	11
20111111	20111111	12
2011-11-11 11:11:11	2011-11-11 11:11:11	20
1111.1111	1111.1111	100
SELECT table_id,table_name FROM oceanbase.__all_virtual_table WHERE table_name='Z0CASE';
ALTER TABLE Z0CASE MODIFY COLUMN z0_test0 ENUM('abc ABC','中文字符@!#$%^') DEFAULT 'abc ABC';
SELECT * FROM Z0CASE ORDER BY Z0_TEST2;
z0_test0	Z0_TEST1	Z0_TEST2
NULL	NULL	0
NULL	NULL	1
		10
	111	11
	20111111	12
	2011-11-11 11:11:11	20
	1111.1111	100
DESC Z0CASE;
Field	Type	Null	Key	Default	Extra
z0_test0	enum('abc ABC','中文字符@!#$%^')	YES		abc ABC	
Z0_TEST1	varchar(50)	YES		NULL	
Z0_TEST2	int(11)	YES		NULL	
SELECT table_id,table_name FROM oceanbase.__all_virtual_table WHERE table_name='Z0CASE';
CHAR --> INT,此处，INT类型后面的数字指的不是整数的长度，INT类型长度固定的。数字代表是的是：如果整数长度小于数字，则会把整数左边自动补上O，使之长度和数字一致，如果超长，则整数正常储存显示。
DROP TABLE Z0CASE;
CREATE TABLE Z0CASE(Z0_TEST0 CHAR(100), Z0_TEST1 VARCHAR(50),Z0_TEST2 INT) with column group (all columns, each column);
INSERT INTO  Z0CASE (z0_test0,z0_test1,Z0_TEST2)VALUES(NULL,NULL,0);
INSERT INTO  Z0CASE (z0_test0,z0_test1,Z0_TEST2)VALUES(111,111,111);
INSERT INTO  Z0CASE (z0_test0,z0_test1,Z0_TEST2)VALUES(111.1111,111,11);
INSERT INTO  Z0CASE (z0_test0,z0_test1,Z0_TEST2)VALUES(NULL,NULL,10);
SELECT * FROM Z0CASE ORDER BY Z0_TEST2;
Z0_TEST0	Z0_TEST1	Z0_TEST2
NULL	NULL	0
NULL	NULL	10
111.1111	111	11
111	111	111
SELECT table_id,table_name FROM oceanbase.__all_virtual_table WHERE table_name='Z0CASE';
ALTER TABLE Z0CASE MODIFY COLUMN z0_test0 INT(0);
SELECT * FROM Z0CASE ORDER BY Z0_TEST2;
z0_test0	Z0_TEST1	Z0_TEST2
NULL	NULL	0
NULL	NULL	10
111	111	11
111	111	111
DESC Z0CASE;
Field	Type	Null	Key	Default	Extra
z0_test0	int(11)	YES		NULL	
Z0_TEST1	varchar(50)	YES		NULL	
Z0_TEST2	int(11)	YES		NULL	
SELECT table_id,table_name FROM oceanbase.__all_virtual_table WHERE table_name='Z0CASE';
ALTER TABLE Z0CASE MODIFY COLUMN z0_test0 INT(1);
DESC Z0CASE;
Field	Type	Null	Key	Default	Extra
z0_test0	int(1)	YES		NULL	
Z0_TEST1	varchar(50)	YES		NULL	
Z0_TEST2	int(11)	YES		NULL	
SELECT table_id,table_name FROM oceanbase.__all_virtual_table WHERE table_name='Z0CASE';
DROP TABLE Z0CASE;
CREATE TABLE Z0CASE(Z0_TEST0 CHAR(100), Z0_TEST1 VARCHAR(50),Z0_TEST2 INT) with column group (all columns, each column);
INSERT INTO  Z0CASE (z0_test0,z0_test1,Z0_TEST2)VALUES('1111.1111','1111.1111',100);
INSERT INTO  Z0CASE (z0_test0,z0_test1,Z0_TEST2)VALUES('2011-11-11 11:11:11','2011-11-11 11:11:11',20);
INSERT INTO  Z0CASE (z0_test0,z0_test1,Z0_TEST2)VALUES(20111111,20111111,1);
INSERT INTO  Z0CASE (z0_test0,z0_test1,Z0_TEST2)VALUES(NULL,NULL,0);
INSERT INTO  Z0CASE (z0_test0,z0_test1,Z0_TEST2)VALUES('21132','',10);
ALTER TABLE Z0CASE MODIFY COLUMN z0_test0 INT(0);
SELECT * FROM Z0CASE ORDER BY Z0_TEST2;
z0_test0	Z0_TEST1	Z0_TEST2
NULL	NULL	0
20111111	20111111	1
21132		10
2011	2011-11-11 11:11:11	20
1111	1111.1111	100
DESC Z0CASE;
Field	Type	Null	Key	Default	Extra
z0_test0	int(11)	YES		NULL	
Z0_TEST1	varchar(50)	YES		NULL	
Z0_TEST2	int(11)	YES		NULL	
SELECT table_id,table_name FROM oceanbase.__all_virtual_table WHERE table_name='Z0CASE';
CHAR --> FLOAT
DROP TABLE Z0CASE;
CREATE TABLE Z0CASE(Z0_TEST0 CHAR(100), Z0_TEST1 VARCHAR(50),Z0_TEST2 INT) with column group (all columns, each column);
INSERT INTO  Z0CASE (z0_test0,z0_test1,Z0_TEST2)VALUES(NULL,NULL,0);
INSERT INTO  Z0CASE (z0_test0,z0_test1,Z0_TEST2)VALUES(111,111,111);
INSERT INTO  Z0CASE (z0_test0,z0_test1,Z0_TEST2)VALUES(111.1111,111,11);
INSERT INTO  Z0CASE (z0_test0,z0_test1,Z0_TEST2)VALUES(NULL,NULL,10);
SELECT * FROM Z0CASE ORDER BY Z0_TEST2;
Z0_TEST0	Z0_TEST1	Z0_TEST2
NULL	NULL	0
NULL	NULL	10
111.1111	111	11
111	111	111
SELECT table_id,table_name FROM oceanbase.__all_virtual_table WHERE table_name='Z0CASE';
ALTER TABLE Z0CASE MODIFY COLUMN z0_test0 FLOAT(7,0);
SELECT * FROM Z0CASE ORDER BY Z0_TEST2;
z0_test0	Z0_TEST1	Z0_TEST2
NULL	NULL	0
NULL	NULL	10
111	111	11
111	111	111
DESC Z0CASE;
Field	Type	Null	Key	Default	Extra
z0_test0	float(7,0)	YES		NULL	
Z0_TEST1	varchar(50)	YES		NULL	
Z0_TEST2	int(11)	YES		NULL	
SELECT table_id,table_name FROM oceanbase.__all_virtual_table WHERE table_name='Z0CASE';
ALTER TABLE Z0CASE MODIFY COLUMN z0_test0 FLOAT(1);
SELECT * FROM Z0CASE ORDER BY Z0_TEST2;
z0_test0	Z0_TEST1	Z0_TEST2
NULL	NULL	0
NULL	NULL	10
111	111	11
111	111	111
DESC Z0CASE;
Field	Type	Null	Key	Default	Extra
z0_test0	float	YES		NULL	
Z0_TEST1	varchar(50)	YES		NULL	
Z0_TEST2	int(11)	YES		NULL	
SELECT table_id,table_name FROM oceanbase.__all_virtual_table WHERE table_name='Z0CASE';
DROP TABLE Z0CASE;
CREATE TABLE Z0CASE(Z0_TEST0 CHAR(100), Z0_TEST1 VARCHAR(50),Z0_TEST2 INT) with column group (all columns, each column);
INSERT INTO  Z0CASE (z0_test0,z0_test1,Z0_TEST2)VALUES('1111.1111','1111.1111',100);
INSERT INTO  Z0CASE (z0_test0,z0_test1,Z0_TEST2)VALUES('2011-11-11 11:11:11','2011-11-11 11:11:11',20);
INSERT INTO  Z0CASE (z0_test0,z0_test1,Z0_TEST2)VALUES(20111111,20111111,1);
INSERT INTO  Z0CASE (z0_test0,z0_test1,Z0_TEST2)VALUES(NULL,NULL,0);
INSERT INTO  Z0CASE (z0_test0,z0_test1,Z0_TEST2)VALUES('21132','',10);
ALTER TABLE Z0CASE MODIFY COLUMN z0_test0 FLOAT(7,0);
SELECT * FROM Z0CASE ORDER BY Z0_TEST2;
z0_test0	Z0_TEST1	Z0_TEST2
NULL	NULL	0
9999999	20111111	1
21132		10
2011	2011-11-11 11:11:11	20
1111	1111.1111	100
DESC Z0CASE;
Field	Type	Null	Key	Default	Extra
z0_test0	float(7,0)	YES		NULL	
Z0_TEST1	varchar(50)	YES		NULL	
Z0_TEST2	int(11)	YES		NULL	
SELECT table_id,table_name FROM oceanbase.__all_virtual_table WHERE table_name='Z0CASE';
CHAR --> DATE
DROP TABLE Z0CASE;
CREATE TABLE Z0CASE(Z0_TEST0 CHAR(100), Z0_TEST1 VARCHAR(50),Z0_TEST2 INT) with column group (all columns, each column);
INSERT INTO  Z0CASE (z0_test0,z0_test1,Z0_TEST2)VALUES('1111.1111','1111.1111',100);
INSERT INTO  Z0CASE (z0_test0,z0_test1,Z0_TEST2)VALUES('2011-11-11 11:11:11','2011-11-11 11:11:11',20);
INSERT INTO  Z0CASE (z0_test0,z0_test1,Z0_TEST2)VALUES(20111111,20111111,1);
INSERT INTO  Z0CASE (z0_test0,z0_test1,Z0_TEST2)VALUES(NULL,NULL,0);
SELECT * FROM Z0CASE ORDER BY Z0_TEST2;
Z0_TEST0	Z0_TEST1	Z0_TEST2
NULL	NULL	0
20111111	20111111	1
2011-11-11 11:11:11	2011-11-11 11:11:11	20
1111.1111	1111.1111	100
SELECT table_id,table_name FROM oceanbase.__all_virtual_table WHERE table_name='Z0CASE';
ALTER TABLE Z0CASE MODIFY COLUMN z0_test0 DATE;
SELECT * FROM Z0CASE ORDER BY Z0_TEST2;
z0_test0	Z0_TEST1	Z0_TEST2
NULL	NULL	0
2011-11-11	20111111	1
2011-11-11	2011-11-11 11:11:11	20
1111-11-11	1111.1111	100
DESC Z0CASE;
Field	Type	Null	Key	Default	Extra
z0_test0	date	YES		NULL	
Z0_TEST1	varchar(50)	YES		NULL	
Z0_TEST2	int(11)	YES		NULL	
SELECT table_id,table_name FROM oceanbase.__all_virtual_table WHERE table_name='Z0CASE';
DROP TABLE Z0CASE;
CREATE TABLE Z0CASE(Z0_TEST0 CHAR(100), Z0_TEST1 VARCHAR(50),Z0_TEST2 INT) with column group (all columns, each column);
INSERT INTO  Z0CASE (z0_test0,z0_test1,Z0_TEST2)VALUES('abc ABC','abc ABC',1);
INSERT INTO  Z0CASE (z0_test0,z0_test1,Z0_TEST2)VALUES('中文字符@!#$%^','中文字符@!#$%^',2);
INSERT INTO  Z0CASE (z0_test0,z0_test1,Z0_TEST2)VALUES(NULL,NULL,220);
INSERT INTO  Z0CASE (z0_test0,z0_test1,Z0_TEST2)VALUES(111,111,11);
INSERT INTO  Z0CASE (z0_test0,z0_test1,Z0_TEST2)VALUES('1111.1111','1111.1111',100);
INSERT INTO  Z0CASE (z0_test0,z0_test1,Z0_TEST2)VALUES('2011-11-11 11:11:11','2011-11-11 11:11:11',20);
INSERT INTO  Z0CASE (z0_test0,z0_test1,Z0_TEST2)VALUES(20111111,20111111,3);
INSERT INTO  Z0CASE (z0_test0,z0_test1,Z0_TEST2)VALUES(NULL,NULL,0);
INSERT INTO  Z0CASE (z0_test0,z0_test1,Z0_TEST2)VALUES(' ','',10);
ALTER TABLE Z0CASE MODIFY COLUMN z0_test0 DATE;
SELECT * FROM Z0CASE ORDER BY Z0_TEST2;
z0_test0	Z0_TEST1	Z0_TEST2
NULL	NULL	0
0000-00-00	abc ABC	1
0000-00-00	中文字符@!#$%^	2
2011-11-11	20111111	3
0000-00-00		10
0000-00-00	111	11
2011-11-11	2011-11-11 11:11:11	20
1111-11-11	1111.1111	100
NULL	NULL	220
DESC Z0CASE;
Field	Type	Null	Key	Default	Extra
z0_test0	date	YES		NULL	
Z0_TEST1	varchar(50)	YES		NULL	
Z0_TEST2	int(11)	YES		NULL	
SELECT table_id,table_name FROM oceanbase.__all_virtual_table WHERE table_name='Z0CASE';
ALTER TABLE Z0CASE modify( z0_test0 DATE);
ERROR 42000: You have an error in your SQL syntax; check the manual that corresponds to your OceanBase version for the right syntax to use near '( z0_test0 DATE)' at line 1
VARCHAR --> VARCHAR
DROP TABLE Z0CASE;
CREATE TABLE Z0CASE(Z0_TEST0 VARCHAR(100), Z0_TEST1 VARCHAR(50),Z0_TEST2 INT) with column group (all columns, each column);
INSERT INTO  Z0CASE (z0_test0,z0_test1,Z0_TEST2)VALUES('abc ABC','abc ABC',1);
INSERT INTO  Z0CASE (z0_test0,z0_test1,Z0_TEST2)VALUES('中文字符@!#$%^','中文字符@!#$%^',11);
INSERT INTO  Z0CASE (z0_test0,z0_test1,Z0_TEST2)VALUES(NULL,NULL,10);
INSERT INTO  Z0CASE (z0_test0,z0_test1,Z0_TEST2)VALUES(111,111,11);
INSERT INTO  Z0CASE (z0_test0,z0_test1,Z0_TEST2)VALUES('1111.1111','1111.1111',100);
INSERT INTO  Z0CASE (z0_test0,z0_test1,Z0_TEST2)VALUES('2011-11-11 11:11:11','2011-11-11 11:11:11',20);
INSERT INTO  Z0CASE (z0_test0,z0_test1,Z0_TEST2)VALUES(20111111,20111111,12);
INSERT INTO  Z0CASE (z0_test0,z0_test1,Z0_TEST2)VALUES(NULL,NULL,0);
INSERT INTO  Z0CASE (z0_test0,z0_test1,Z0_TEST2)VALUES(' ','',110);
SELECT * FROM Z0CASE ORDER BY Z0_TEST2;
Z0_TEST0	Z0_TEST1	Z0_TEST2
NULL	NULL	0
abc ABC	abc ABC	1
NULL	NULL	10
中文字符@!#$%^	中文字符@!#$%^	11
111	111	11
20111111	20111111	12
2011-11-11 11:11:11	2011-11-11 11:11:11	20
1111.1111	1111.1111	100
 		110
SELECT table_id,table_name FROM oceanbase.__all_virtual_table WHERE table_name='Z0CASE';
VARCHAR --> VARCHAR
ALTER TABLE Z0CASE MODIFY COLUMN z0_test0 VARCHAR(101) DEFAULT 123;
SELECT Z0_TEST0 FROM Z0CASE ORDER BY Z0_TEST2;
Z0_TEST0
NULL
abc ABC
NULL
中文字符@!#$%^
111
20111111
2011-11-11 11:11:11
1111.1111
 
DESC Z0CASE;
Field	Type	Null	Key	Default	Extra
z0_test0	varchar(101)	YES		123	
Z0_TEST1	varchar(50)	YES		NULL	
Z0_TEST2	int(11)	YES		NULL	
SELECT table_id,table_name FROM oceanbase.__all_virtual_table WHERE table_name='Z0CASE';
ALTER TABLE Z0CASE MODIFY COLUMN z0_test0 VARCHAR(100);
SELECT Z0_TEST0 FROM Z0CASE ORDER BY Z0_TEST2;
Z0_TEST0
NULL
abc ABC
NULL
中文字符@!#$%^
111
20111111
2011-11-11 11:11:11
1111.1111
 
DESC Z0CASE;
Field	Type	Null	Key	Default	Extra
z0_test0	varchar(100)	YES		NULL	
Z0_TEST1	varchar(50)	YES		NULL	
Z0_TEST2	int(11)	YES		NULL	
SELECT table_id,table_name FROM oceanbase.__all_virtual_table WHERE table_name='Z0CASE';
ALTER TABLE Z0CASE MODIFY COLUMN z0_test0 VARCHAR(101);
DESC Z0CASE;
Field	Type	Null	Key	Default	Extra
z0_test0	varchar(101)	YES		NULL	
Z0_TEST1	varchar(50)	YES		NULL	
Z0_TEST2	int(11)	YES		NULL	
SELECT table_id,table_name FROM oceanbase.__all_virtual_table WHERE table_name='Z0CASE';
VARCHAR --> CHAR
DROP TABLE Z0CASE;
CREATE TABLE Z0CASE(Z0_TEST0 VARCHAR(100), Z0_TEST1 VARCHAR(50),Z0_TEST2 INT) with column group (all columns, each column);
INSERT INTO  Z0CASE (z0_test0,z0_test1,Z0_TEST2)VALUES('abc ABC','abc ABC',10);
INSERT INTO  Z0CASE (z0_test0,z0_test1,Z0_TEST2)VALUES('中文字符@!#$%^','中文字符@!#$%^',12);
INSERT INTO  Z0CASE (z0_test0,z0_test1,Z0_TEST2)VALUES(NULL,NULL,220);
INSERT INTO  Z0CASE (z0_test0,z0_test1,Z0_TEST2)VALUES(111,111,11);
INSERT INTO  Z0CASE (z0_test0,z0_test1,Z0_TEST2)VALUES('1111.1111','1111.1111',100);
INSERT INTO  Z0CASE (z0_test0,z0_test1,Z0_TEST2)VALUES('2011-11-11 11:11:11','2011-11-11 11:11:11',20);
INSERT INTO  Z0CASE (z0_test0,z0_test1,Z0_TEST2)VALUES(20111111,20111111,1);
INSERT INTO  Z0CASE (z0_test0,z0_test1,Z0_TEST2)VALUES(NULL,NULL,40);
INSERT INTO  Z0CASE (z0_test0,z0_test1,Z0_TEST2)VALUES(' ','',120);
SELECT * FROM Z0CASE ORDER BY Z0_TEST2;
Z0_TEST0	Z0_TEST1	Z0_TEST2
20111111	20111111	1
abc ABC	abc ABC	10
111	111	11
中文字符@!#$%^	中文字符@!#$%^	12
2011-11-11 11:11:11	2011-11-11 11:11:11	20
NULL	NULL	40
1111.1111	1111.1111	100
 		120
NULL	NULL	220
SELECT table_id,table_name FROM oceanbase.__all_virtual_table WHERE table_name='Z0CASE';
ALTER TABLE Z0CASE MODIFY COLUMN z0_test0 CHAR(101) DEFAULT 123;
DESC Z0CASE;
Field	Type	Null	Key	Default	Extra
z0_test0	char(101)	YES		123	
Z0_TEST1	varchar(50)	YES		NULL	
Z0_TEST2	int(11)	YES		NULL	
SELECT table_id,table_name FROM oceanbase.__all_virtual_table WHERE table_name='Z0CASE';
ALTER TABLE Z0CASE MODIFY COLUMN z0_test0 CHAR(99);
SELECT Z0_TEST0 FROM Z0CASE ORDER BY Z0_TEST2;
Z0_TEST0
20111111
abc ABC
111
中文字符@!#$%^
2011-11-11 11:11:11
NULL
1111.1111

NULL
DESC Z0CASE;
Field	Type	Null	Key	Default	Extra
z0_test0	char(99)	YES		NULL	
Z0_TEST1	varchar(50)	YES		NULL	
Z0_TEST2	int(11)	YES		NULL	
SELECT table_id,table_name FROM oceanbase.__all_virtual_table WHERE table_name='Z0CASE';
ALTER TABLE Z0CASE MODIFY COLUMN z0_test0 CHAR(100);
DESC Z0CASE;
Field	Type	Null	Key	Default	Extra
z0_test0	char(100)	YES		NULL	
Z0_TEST1	varchar(50)	YES		NULL	
Z0_TEST2	int(11)	YES		NULL	
SELECT table_id,table_name FROM oceanbase.__all_virtual_table WHERE table_name='Z0CASE';
VARCHAR --> BLOB
DROP TABLE Z0CASE;
CREATE TABLE Z0CASE(Z0_TEST0 VARCHAR(100), Z0_TEST1 VARCHAR(50),Z0_TEST2 INT) with column group (all columns, each column);
INSERT INTO  Z0CASE (z0_test0,z0_test1,Z0_TEST2)VALUES('abc ABC','abc ABC',11);
INSERT INTO  Z0CASE (z0_test0,z0_test1,Z0_TEST2)VALUES('中文字符@!#$%^','中文字符@!#$%^',12);
INSERT INTO  Z0CASE (z0_test0,z0_test1,Z0_TEST2)VALUES(NULL,NULL,30);
INSERT INTO  Z0CASE (z0_test0,z0_test1,Z0_TEST2)VALUES(111,111,114);
INSERT INTO  Z0CASE (z0_test0,z0_test1,Z0_TEST2)VALUES('1111.1111','1111.1111',100);
INSERT INTO  Z0CASE (z0_test0,z0_test1,Z0_TEST2)VALUES('2011-11-11 11:11:11','2011-11-11 11:11:11',20);
INSERT INTO  Z0CASE (z0_test0,z0_test1,Z0_TEST2)VALUES(20111111,20111111,1);
INSERT INTO  Z0CASE (z0_test0,z0_test1,Z0_TEST2)VALUES(NULL,NULL,0);
INSERT INTO  Z0CASE (z0_test0,z0_test1,Z0_TEST2)VALUES(' ','',10);
SELECT * FROM Z0CASE ORDER BY Z0_TEST2;
Z0_TEST0	Z0_TEST1	Z0_TEST2
NULL	NULL	0
20111111	20111111	1
 		10
abc ABC	abc ABC	11
中文字符@!#$%^	中文字符@!#$%^	12
2011-11-11 11:11:11	2011-11-11 11:11:11	20
NULL	NULL	30
1111.1111	1111.1111	100
111	111	114
SELECT table_id,table_name FROM oceanbase.__all_virtual_table WHERE table_name='Z0CASE';
ALTER TABLE Z0CASE MODIFY COLUMN z0_test0 BLOB(101) ;
SELECT Z0_TEST0 FROM Z0CASE ORDER BY Z0_TEST2;
Z0_TEST0
NULL
20111111
 
abc ABC
中文字符@!#$%^
2011-11-11 11:11:11
NULL
1111.1111
111
DESC Z0CASE;
Field	Type	Null	Key	Default	Extra
z0_test0	tinyblob	YES		NULL	
Z0_TEST1	varchar(50)	YES		NULL	
Z0_TEST2	int(11)	YES		NULL	
SELECT table_id,table_name FROM oceanbase.__all_virtual_table WHERE table_name='Z0CASE';
DROP TABLE Z0CASE;
CREATE TABLE Z0CASE(Z0_TEST0 VARCHAR(100), Z0_TEST1 VARCHAR(50),Z0_TEST2 INT) with column group (all columns, each column);
INSERT INTO  Z0CASE (z0_test0,z0_test1,Z0_TEST2)VALUES('abc ABC','abc ABC',11);
INSERT INTO  Z0CASE (z0_test0,z0_test1,Z0_TEST2)VALUES('中文字符@!#$%^','中文字符@!#$%^',21);
INSERT INTO  Z0CASE (z0_test0,z0_test1,Z0_TEST2)VALUES(NULL,NULL,30);
INSERT INTO  Z0CASE (z0_test0,z0_test1,Z0_TEST2)VALUES(111,111,141);
INSERT INTO  Z0CASE (z0_test0,z0_test1,Z0_TEST2)VALUES('1111.1111','1111.1111',100);
INSERT INTO  Z0CASE (z0_test0,z0_test1,Z0_TEST2)VALUES('2011-11-11 11:11:11','2011-11-11 11:11:11',20);
INSERT INTO  Z0CASE (z0_test0,z0_test1,Z0_TEST2)VALUES(20111111,20111111,1);
INSERT INTO  Z0CASE (z0_test0,z0_test1,Z0_TEST2)VALUES(NULL,NULL,0);
INSERT INTO  Z0CASE (z0_test0,z0_test1,Z0_TEST2)VALUES(' ','',10);
SELECT * FROM Z0CASE ORDER BY Z0_TEST2;
Z0_TEST0	Z0_TEST1	Z0_TEST2
NULL	NULL	0
20111111	20111111	1
 		10
abc ABC	abc ABC	11
2011-11-11 11:11:11	2011-11-11 11:11:11	20
中文字符@!#$%^	中文字符@!#$%^	21
NULL	NULL	30
1111.1111	1111.1111	100
111	111	141
SELECT table_id,table_name FROM oceanbase.__all_virtual_table WHERE table_name='Z0CASE';
ALTER TABLE Z0CASE MODIFY COLUMN z0_test0 BLOB(100);
SELECT Z0_TEST0 FROM Z0CASE ORDER BY Z0_TEST2;
Z0_TEST0
NULL
20111111
 
abc ABC
2011-11-11 11:11:11
中文字符@!#$%^
NULL
1111.1111
111
DESC Z0CASE;
Field	Type	Null	Key	Default	Extra
z0_test0	tinyblob	YES		NULL	
Z0_TEST1	varchar(50)	YES		NULL	
Z0_TEST2	int(11)	YES		NULL	
SELECT table_id,table_name FROM oceanbase.__all_virtual_table WHERE table_name='Z0CASE';
DROP TABLE Z0CASE;
CREATE TABLE Z0CASE(Z0_TEST0 VARCHAR(100), Z0_TEST1 VARCHAR(50),Z0_TEST2 INT) with column group (all columns, each column);
INSERT INTO  Z0CASE (z0_test0,z0_test1,Z0_TEST2)VALUES('abc ABC','abc ABC',21);
INSERT INTO  Z0CASE (z0_test0,z0_test1,Z0_TEST2)VALUES('中文字符@!#$%^','中文字符@!#$%^',1);
INSERT INTO  Z0CASE (z0_test0,z0_test1,Z0_TEST2)VALUES(NULL,NULL,30);
INSERT INTO  Z0CASE (z0_test0,z0_test1,Z0_TEST2)VALUES(111,111,11);
INSERT INTO  Z0CASE (z0_test0,z0_test1,Z0_TEST2)VALUES('1111.1111','1111.1111',100);
INSERT INTO  Z0CASE (z0_test0,z0_test1,Z0_TEST2)VALUES('2011-11-11 11:11:11','2011-11-11 11:11:11',20);
INSERT INTO  Z0CASE (z0_test0,z0_test1,Z0_TEST2)VALUES(20111111,20111111,41);
INSERT INTO  Z0CASE (z0_test0,z0_test1,Z0_TEST2)VALUES(NULL,NULL,0);
INSERT INTO  Z0CASE (z0_test0,z0_test1,Z0_TEST2)VALUES(' ','',10);
SELECT * FROM Z0CASE ORDER BY Z0_TEST2;
Z0_TEST0	Z0_TEST1	Z0_TEST2
NULL	NULL	0
中文字符@!#$%^	中文字符@!#$%^	1
 		10
111	111	11
2011-11-11 11:11:11	2011-11-11 11:11:11	20
abc ABC	abc ABC	21
NULL	NULL	30
20111111	20111111	41
1111.1111	1111.1111	100
SELECT table_id,table_name FROM oceanbase.__all_virtual_table WHERE table_name='Z0CASE';
ALTER TABLE Z0CASE MODIFY COLUMN z0_test0 BLOB(99);
SELECT Z0_TEST0 FROM Z0CASE ORDER BY Z0_TEST2;
Z0_TEST0
NULL
中文字符@!#$%^
 
111
2011-11-11 11:11:11
abc ABC
NULL
20111111
1111.1111
DESC Z0CASE;
Field	Type	Null	Key	Default	Extra
z0_test0	tinyblob	YES		NULL	
Z0_TEST1	varchar(50)	YES		NULL	
Z0_TEST2	int(11)	YES		NULL	
SELECT table_id,table_name FROM oceanbase.__all_virtual_table WHERE table_name='Z0CASE';
VARCHAR --> TEXT
DROP TABLE Z0CASE;
CREATE TABLE Z0CASE(Z0_TEST0 VARCHAR(100), Z0_TEST1 VARCHAR(50),Z0_TEST2 INT) with column group (all columns, each column);
INSERT INTO  Z0CASE (z0_test0,z0_test1,Z0_TEST2)VALUES('abc ABC','abc ABC',14);
INSERT INTO  Z0CASE (z0_test0,z0_test1,Z0_TEST2)VALUES('中文字符@!#$%^','中文字符@!#$%^',1);
INSERT INTO  Z0CASE (z0_test0,z0_test1,Z0_TEST2)VALUES(NULL,NULL,0);
INSERT INTO  Z0CASE (z0_test0,z0_test1,Z0_TEST2)VALUES(111,111,11);
INSERT INTO  Z0CASE (z0_test0,z0_test1,Z0_TEST2)VALUES('1111.1111','1111.1111',100);
INSERT INTO  Z0CASE (z0_test0,z0_test1,Z0_TEST2)VALUES('2011-11-11 11:11:11','2011-11-11 11:11:11',20);
INSERT INTO  Z0CASE (z0_test0,z0_test1,Z0_TEST2)VALUES(20111111,20111111,13);
INSERT INTO  Z0CASE (z0_test0,z0_test1,Z0_TEST2)VALUES(NULL,NULL,210);
INSERT INTO  Z0CASE (z0_test0,z0_test1,Z0_TEST2)VALUES(' ','',10);
SELECT * FROM Z0CASE ORDER BY Z0_TEST2;
Z0_TEST0	Z0_TEST1	Z0_TEST2
NULL	NULL	0
中文字符@!#$%^	中文字符@!#$%^	1
 		10
111	111	11
20111111	20111111	13
abc ABC	abc ABC	14
2011-11-11 11:11:11	2011-11-11 11:11:11	20
1111.1111	1111.1111	100
NULL	NULL	210
SELECT table_id,table_name FROM oceanbase.__all_virtual_table WHERE table_name='Z0CASE';
ALTER TABLE Z0CASE MODIFY COLUMN z0_test0 TEXT(101) ;
SELECT Z0_TEST0 FROM Z0CASE ORDER BY Z0_TEST2;
Z0_TEST0
NULL
中文字符@!#$%^
 
111
20111111
abc ABC
2011-11-11 11:11:11
1111.1111
NULL
DESC Z0CASE;
Field	Type	Null	Key	Default	Extra
z0_test0	text	YES		NULL	
Z0_TEST1	varchar(50)	YES		NULL	
Z0_TEST2	int(11)	YES		NULL	
SELECT table_id,table_name FROM oceanbase.__all_virtual_table WHERE table_name='Z0CASE';
DROP TABLE Z0CASE;
CREATE TABLE Z0CASE(Z0_TEST0 VARCHAR(100), Z0_TEST1 VARCHAR(50),Z0_TEST2 INT) with column group (all columns, each column);
INSERT INTO  Z0CASE (z0_test0,z0_test1,Z0_TEST2)VALUES('abc ABC','abc ABC',1);
INSERT INTO  Z0CASE (z0_test0,z0_test1,Z0_TEST2)VALUES('中文字符@!#$%^','中文字符@!#$%^',51);
INSERT INTO  Z0CASE (z0_test0,z0_test1,Z0_TEST2)VALUES(NULL,NULL,0);
INSERT INTO  Z0CASE (z0_test0,z0_test1,Z0_TEST2)VALUES(111,111,11);
INSERT INTO  Z0CASE (z0_test0,z0_test1,Z0_TEST2)VALUES('1111.1111','1111.1111',100);
INSERT INTO  Z0CASE (z0_test0,z0_test1,Z0_TEST2)VALUES('2011-11-11 11:11:11','2011-11-11 11:11:11',20);
INSERT INTO  Z0CASE (z0_test0,z0_test1,Z0_TEST2)VALUES(20111111,20111111,61);
INSERT INTO  Z0CASE (z0_test0,z0_test1,Z0_TEST2)VALUES(NULL,NULL,80);
INSERT INTO  Z0CASE (z0_test0,z0_test1,Z0_TEST2)VALUES(' ','',190);
SELECT * FROM Z0CASE ORDER BY Z0_TEST2;
Z0_TEST0	Z0_TEST1	Z0_TEST2
NULL	NULL	0
abc ABC	abc ABC	1
111	111	11
2011-11-11 11:11:11	2011-11-11 11:11:11	20
中文字符@!#$%^	中文字符@!#$%^	51
20111111	20111111	61
NULL	NULL	80
1111.1111	1111.1111	100
 		190
SELECT table_id,table_name FROM oceanbase.__all_virtual_table WHERE table_name='Z0CASE';
ALTER TABLE Z0CASE MODIFY COLUMN z0_test0 TEXT(100);
SELECT Z0_TEST0 FROM Z0CASE ORDER BY Z0_TEST2;
Z0_TEST0
NULL
abc ABC
111
2011-11-11 11:11:11
中文字符@!#$%^
20111111
NULL
1111.1111
 
DESC Z0CASE;
Field	Type	Null	Key	Default	Extra
z0_test0	text	YES		NULL	
Z0_TEST1	varchar(50)	YES		NULL	
Z0_TEST2	int(11)	YES		NULL	
SELECT table_id,table_name FROM oceanbase.__all_virtual_table WHERE table_name='Z0CASE';
DROP TABLE Z0CASE;
CREATE TABLE Z0CASE(Z0_TEST0 VARCHAR(100), Z0_TEST1 VARCHAR(50),Z0_TEST2 INT) with column group (all columns, each column);
INSERT INTO  Z0CASE (z0_test0,z0_test1,Z0_TEST2)VALUES('abc ABC','abc ABC',12);
INSERT INTO  Z0CASE (z0_test0,z0_test1,Z0_TEST2)VALUES('中文字符@!#$%^','中文字符@!#$%^',1);
INSERT INTO  Z0CASE (z0_test0,z0_test1,Z0_TEST2)VALUES(NULL,NULL,0);
INSERT INTO  Z0CASE (z0_test0,z0_test1,Z0_TEST2)VALUES(111,111,11);
INSERT INTO  Z0CASE (z0_test0,z0_test1,Z0_TEST2)VALUES('1111.1111','1111.1111',100);
INSERT INTO  Z0CASE (z0_test0,z0_test1,Z0_TEST2)VALUES('2011-11-11 11:11:11','2011-11-11 11:11:11',20);
INSERT INTO  Z0CASE (z0_test0,z0_test1,Z0_TEST2)VALUES(20111111,20111111,13);
INSERT INTO  Z0CASE (z0_test0,z0_test1,Z0_TEST2)VALUES(NULL,NULL,40);
INSERT INTO  Z0CASE (z0_test0,z0_test1,Z0_TEST2)VALUES(' ','',10);
SELECT * FROM Z0CASE ORDER BY Z0_TEST2;
Z0_TEST0	Z0_TEST1	Z0_TEST2
NULL	NULL	0
中文字符@!#$%^	中文字符@!#$%^	1
 		10
111	111	11
abc ABC	abc ABC	12
20111111	20111111	13
2011-11-11 11:11:11	2011-11-11 11:11:11	20
NULL	NULL	40
1111.1111	1111.1111	100
SELECT table_id,table_name FROM oceanbase.__all_virtual_table WHERE table_name='Z0CASE';
ALTER TABLE Z0CASE MODIFY COLUMN z0_test0 TEXT(99);
SELECT Z0_TEST0 FROM Z0CASE ORDER BY Z0_TEST2;
Z0_TEST0
NULL
中文字符@!#$%^
 
111
abc ABC
20111111
2011-11-11 11:11:11
NULL
1111.1111
DESC Z0CASE;
Field	Type	Null	Key	Default	Extra
z0_test0	text	YES		NULL	
Z0_TEST1	varchar(50)	YES		NULL	
Z0_TEST2	int(11)	YES		NULL	
SELECT table_id,table_name FROM oceanbase.__all_virtual_table WHERE table_name='Z0CASE';
VARCHAR --> BLOB 
DROP TABLE Z0CASE;
CREATE TABLE Z0CASE(Z0_TEST0 VARCHAR(100), Z0_TEST1 VARCHAR(50),Z0_TEST2 INT) with column group (all columns, each column);
INSERT INTO  Z0CASE (z0_test0,z0_test1,Z0_TEST2)VALUES('abc ABC','abc ABC',1);
INSERT INTO  Z0CASE (z0_test0,z0_test1,Z0_TEST2)VALUES('中文字符@!#$%^','中文字符@!#$%^',61);
INSERT INTO  Z0CASE (z0_test0,z0_test1,Z0_TEST2)VALUES(NULL,NULL,0);
INSERT INTO  Z0CASE (z0_test0,z0_test1,Z0_TEST2)VALUES(111,111,11);
INSERT INTO  Z0CASE (z0_test0,z0_test1,Z0_TEST2)VALUES('1111.1111','1111.1111',100);
INSERT INTO  Z0CASE (z0_test0,z0_test1,Z0_TEST2)VALUES('2011-11-11 11:11:11','2011-11-11 11:11:11',20);
INSERT INTO  Z0CASE (z0_test0,z0_test1,Z0_TEST2)VALUES(20111111,20111111,71);
INSERT INTO  Z0CASE (z0_test0,z0_test1,Z0_TEST2)VALUES(NULL,NULL,709);
INSERT INTO  Z0CASE (z0_test0,z0_test1,Z0_TEST2)VALUES(' ','',110);
SELECT * FROM Z0CASE ORDER BY Z0_TEST2;
Z0_TEST0	Z0_TEST1	Z0_TEST2
NULL	NULL	0
abc ABC	abc ABC	1
111	111	11
2011-11-11 11:11:11	2011-11-11 11:11:11	20
中文字符@!#$%^	中文字符@!#$%^	61
20111111	20111111	71
1111.1111	1111.1111	100
 		110
NULL	NULL	709
SELECT table_id,table_name FROM oceanbase.__all_virtual_table WHERE table_name='Z0CASE';
ALTER TABLE Z0CASE modify COLUMN z0_test0 BLOB;
SELECT Z0_TEST0 FROM Z0CASE ORDER BY Z0_TEST2;
Z0_TEST0
NULL
abc ABC
111
2011-11-11 11:11:11
中文字符@!#$%^
20111111
1111.1111
 
NULL
DESC Z0CASE;
Field	Type	Null	Key	Default	Extra
z0_test0	blob	YES		NULL	
Z0_TEST1	varchar(50)	YES		NULL	
Z0_TEST2	int(11)	YES		NULL	
SELECT table_id,table_name FROM oceanbase.__all_virtual_table WHERE table_name='Z0CASE';
VARCHAR --> SET 
DROP TABLE Z0CASE;
CREATE TABLE Z0CASE(Z0_TEST0 VARCHAR(100), Z0_TEST1 VARCHAR(50),Z0_TEST2 INT) with column group (all columns, each column);
INSERT INTO  Z0CASE (z0_test0,z0_test1,Z0_TEST2)VALUES('abc ABC','abc ABC',1);
INSERT INTO  Z0CASE (z0_test0,z0_test1,Z0_TEST2)VALUES('中文字符@!#$%^','中文字符@!#$%^',2);
INSERT INTO  Z0CASE (z0_test0,z0_test1,Z0_TEST2)VALUES(NULL,NULL,0);
SELECT * FROM Z0CASE ORDER BY Z0_TEST2;
Z0_TEST0	Z0_TEST1	Z0_TEST2
NULL	NULL	0
abc ABC	abc ABC	1
中文字符@!#$%^	中文字符@!#$%^	2
SELECT table_id,table_name FROM oceanbase.__all_virtual_table WHERE table_name='Z0CASE';
ALTER TABLE Z0CASE MODIFY COLUMN z0_test0 SET('abc ABC','中文字符@!#$%^') ;
SELECT Z0_TEST0 FROM Z0CASE ORDER BY Z0_TEST2;
Z0_TEST0
NULL
abc ABC
中文字符@!#$%^
DESC Z0CASE;
Field	Type	Null	Key	Default	Extra
z0_test0	set('abc ABC','中文字符@!#$%^')	YES		NULL	
Z0_TEST1	varchar(50)	YES		NULL	
Z0_TEST2	int(11)	YES		NULL	
SELECT table_id,table_name FROM oceanbase.__all_virtual_table WHERE table_name='Z0CASE';
DROP TABLE Z0CASE;
CREATE TABLE Z0CASE(Z0_TEST0 VARCHAR(100), Z0_TEST1 VARCHAR(50),Z0_TEST2 INT) with column group (all columns, each column);
INSERT INTO  Z0CASE (z0_test0,z0_test1,Z0_TEST2)VALUES(111,111,11);
INSERT INTO  Z0CASE (z0_test0,z0_test1,Z0_TEST2)VALUES('1111.1111','1111.1111',100);
INSERT INTO  Z0CASE (z0_test0,z0_test1,Z0_TEST2)VALUES('2011-11-11 11:11:11','2011-11-11 11:11:11',20);
INSERT INTO  Z0CASE (z0_test0,z0_test1,Z0_TEST2)VALUES(20111111,20111111,1);
INSERT INTO  Z0CASE (z0_test0,z0_test1,Z0_TEST2)VALUES(NULL,NULL,0);
INSERT INTO  Z0CASE (z0_test0,z0_test1,Z0_TEST2)VALUES(' ','',10);
ALTER TABLE Z0CASE MODIFY COLUMN z0_test0 SET('abc ABC','中文字符@!#$%^',' ') ;
SELECT Z0_TEST0 FROM Z0CASE ORDER BY Z0_TEST2;
Z0_TEST0
NULL





DESC Z0CASE;
Field	Type	Null	Key	Default	Extra
z0_test0	set('abc ABC','中文字符@!#$%^','')	YES		NULL	
Z0_TEST1	varchar(50)	YES		NULL	
Z0_TEST2	int(11)	YES		NULL	
SELECT table_id,table_name FROM oceanbase.__all_virtual_table WHERE table_name='Z0CASE';
VARCHAR --> ENUM 
DROP TABLE Z0CASE;
CREATE TABLE Z0CASE(Z0_TEST0 VARCHAR(100), Z0_TEST1 VARCHAR(50),Z0_TEST2 INT) with column group (all columns, each column);
INSERT INTO  Z0CASE (z0_test0,z0_test1,Z0_TEST2)VALUES('abc ABC','abc ABC',1);
INSERT INTO  Z0CASE (z0_test0,z0_test1,Z0_TEST2)VALUES('中文字符@!#$%^','中文字符@!#$%^',2);
INSERT INTO  Z0CASE (z0_test0,z0_test1,Z0_TEST2)VALUES(NULL,NULL,0);
SELECT * FROM Z0CASE ORDER BY Z0_TEST2;
Z0_TEST0	Z0_TEST1	Z0_TEST2
NULL	NULL	0
abc ABC	abc ABC	1
中文字符@!#$%^	中文字符@!#$%^	2
SELECT table_id,table_name FROM oceanbase.__all_virtual_table WHERE table_name='Z0CASE';
ALTER TABLE Z0CASE MODIFY COLUMN z0_test0 ENUM('abc ABC','中文字符@!#$%^') ;
SELECT Z0_TEST0 FROM Z0CASE ORDER BY Z0_TEST2;
Z0_TEST0
NULL
abc ABC
中文字符@!#$%^
DESC Z0CASE;
Field	Type	Null	Key	Default	Extra
z0_test0	enum('abc ABC','中文字符@!#$%^')	YES		NULL	
Z0_TEST1	varchar(50)	YES		NULL	
Z0_TEST2	int(11)	YES		NULL	
SELECT table_id,table_name FROM oceanbase.__all_virtual_table WHERE table_name='Z0CASE';
DROP TABLE Z0CASE;
CREATE TABLE Z0CASE(Z0_TEST0 VARCHAR(100), Z0_TEST1 VARCHAR(50),Z0_TEST2 INT) with column group (all columns, each column);
INSERT INTO  Z0CASE (z0_test0,z0_test1,Z0_TEST2)VALUES(111,111,11);
INSERT INTO  Z0CASE (z0_test0,z0_test1,Z0_TEST2)VALUES('1111.1111','1111.1111',100);
INSERT INTO  Z0CASE (z0_test0,z0_test1,Z0_TEST2)VALUES('2011-11-11 11:11:11','2011-11-11 11:11:11',20);
INSERT INTO  Z0CASE (z0_test0,z0_test1,Z0_TEST2)VALUES(20111111,20111111,1);
INSERT INTO  Z0CASE (z0_test0,z0_test1,Z0_TEST2)VALUES(NULL,NULL,0);
INSERT INTO  Z0CASE (z0_test0,z0_test1,Z0_TEST2)VALUES(' ','',10);
ALTER TABLE Z0CASE MODIFY COLUMN z0_test0 ENUM('abc ABC','中文字符@!#$%^',' ') ;
SELECT Z0_TEST0 FROM Z0CASE ORDER BY Z0_TEST2;
Z0_TEST0
NULL





DESC Z0CASE;
Field	Type	Null	Key	Default	Extra
z0_test0	enum('abc ABC','中文字符@!#$%^','')	YES		NULL	
Z0_TEST1	varchar(50)	YES		NULL	
Z0_TEST2	int(11)	YES		NULL	
SELECT table_id,table_name FROM oceanbase.__all_virtual_table WHERE table_name='Z0CASE';
VARCHAR --> DECIMAL
DROP TABLE Z0CASE;
CREATE TABLE Z0CASE(Z0_TEST0 VARCHAR(100), Z0_TEST1 VARCHAR(50),Z0_TEST2 INT) with column group (all columns, each column);
INSERT INTO  Z0CASE (z0_test0,z0_test1,Z0_TEST2)VALUES(111,111,11);
INSERT INTO  Z0CASE (z0_test0,z0_test1,Z0_TEST2)VALUES('1111.1111','1111.1111',100);
INSERT INTO  Z0CASE (z0_test0,z0_test1,Z0_TEST2)VALUES(NULL,NULL,0);
SELECT * FROM Z0CASE ORDER BY Z0_TEST2;
Z0_TEST0	Z0_TEST1	Z0_TEST2
NULL	NULL	0
111	111	11
1111.1111	1111.1111	100
SELECT table_id,table_name FROM oceanbase.__all_virtual_table WHERE table_name='Z0CASE';
ALTER TABLE Z0CASE MODIFY COLUMN z0_test0 DECIMAL(6,2) ;
SELECT Z0_TEST0 FROM Z0CASE ORDER BY Z0_TEST2;
Z0_TEST0
NULL
111.00
1111.11
DESC Z0CASE;
Field	Type	Null	Key	Default	Extra
z0_test0	decimal(6,2)	YES		NULL	
Z0_TEST1	varchar(50)	YES		NULL	
Z0_TEST2	int(11)	YES		NULL	
SELECT table_id,table_name FROM oceanbase.__all_virtual_table WHERE table_name='Z0CASE';
DROP TABLE Z0CASE;
CREATE TABLE Z0CASE(Z0_TEST0 VARCHAR(100), Z0_TEST1 VARCHAR(50),Z0_TEST2 INT) with column group (all columns, each column);
INSERT INTO  Z0CASE (z0_test0,z0_test1,Z0_TEST2)VALUES(0.00,111,11);
INSERT INTO  Z0CASE (z0_test0,z0_test1,Z0_TEST2)VALUES('1111.1111','1111.1111',100);
INSERT INTO  Z0CASE (z0_test0,z0_test1,Z0_TEST2)VALUES('中文字符@!#$%^','中文字符@!#$%^',1);
INSERT INTO  Z0CASE (z0_test0,z0_test1,Z0_TEST2)VALUES('2011-11-11 11:11:11','2011-11-11 11:11:11',20);
ALTER TABLE Z0CASE MODIFY COLUMN z0_test0 DECIMAL(10,2) ;
SELECT Z0_TEST0 FROM Z0CASE ORDER BY Z0_TEST2;
Z0_TEST0
0.00
0.00
2011.00
1111.11
DESC Z0CASE;
Field	Type	Null	Key	Default	Extra
z0_test0	decimal(10,2)	YES		NULL	
Z0_TEST1	varchar(50)	YES		NULL	
Z0_TEST2	int(11)	YES		NULL	
SELECT table_id,table_name FROM oceanbase.__all_virtual_table WHERE table_name='Z0CASE';
VARCHAR --> DATE
DROP TABLE Z0CASE;
CREATE TABLE Z0CASE(Z0_TEST0 VARCHAR(100), Z0_TEST1 VARCHAR(50),Z0_TEST2 INT) with column group (all columns, each column);
INSERT INTO  Z0CASE (z0_test0,z0_test1,Z0_TEST2)VALUES('2011-11-11 11:11:11','2011-11-11 11:11:11',20);
INSERT INTO  Z0CASE (z0_test0,z0_test1,Z0_TEST2)VALUES('1111.1111','1111.1111',100);
INSERT INTO  Z0CASE (z0_test0,z0_test1,Z0_TEST2)VALUES(NULL,NULL,0);
SELECT * FROM Z0CASE ORDER BY Z0_TEST2;
Z0_TEST0	Z0_TEST1	Z0_TEST2
NULL	NULL	0
2011-11-11 11:11:11	2011-11-11 11:11:11	20
1111.1111	1111.1111	100
SELECT table_id,table_name FROM oceanbase.__all_virtual_table WHERE table_name='Z0CASE';
ALTER TABLE Z0CASE MODIFY COLUMN z0_test0 DATE ;
SELECT Z0_TEST0 FROM Z0CASE ORDER BY Z0_TEST2;
Z0_TEST0
NULL
2011-11-11
1111-11-11
DESC Z0CASE;
Field	Type	Null	Key	Default	Extra
z0_test0	date	YES		NULL	
Z0_TEST1	varchar(50)	YES		NULL	
Z0_TEST2	int(11)	YES		NULL	
SELECT table_id,table_name FROM oceanbase.__all_virtual_table WHERE table_name='Z0CASE';
DROP TABLE Z0CASE;
CREATE TABLE Z0CASE(Z0_TEST0 VARCHAR(100), Z0_TEST1 VARCHAR(50),Z0_TEST2 INT) with column group (all columns, each column);
INSERT INTO  Z0CASE (z0_test0,z0_test1,Z0_TEST2)VALUES(0.00,111,11);
INSERT INTO  Z0CASE (z0_test0,z0_test1,Z0_TEST2)VALUES('1111.1111','1111.1111',100);
INSERT INTO  Z0CASE (z0_test0,z0_test1,Z0_TEST2)VALUES('中文字符@!#$%^','中文字符@!#$%^',1);
INSERT INTO  Z0CASE (z0_test0,z0_test1,Z0_TEST2)VALUES('2011-11-11 11:11:11','2011-11-11 11:11:11',20);
ALTER TABLE Z0CASE MODIFY COLUMN z0_test0 DATE ;
SELECT Z0_TEST0 FROM Z0CASE ORDER BY Z0_TEST2;
Z0_TEST0
0000-00-00
0000-00-00
2011-11-11
1111-11-11
DESC Z0CASE;
Field	Type	Null	Key	Default	Extra
z0_test0	date	YES		NULL	
Z0_TEST1	varchar(50)	YES		NULL	
Z0_TEST2	int(11)	YES		NULL	
SELECT table_id,table_name FROM oceanbase.__all_virtual_table WHERE table_name='Z0CASE';
VARCHAR --> YEAR
DROP TABLE Z0CASE;
CREATE TABLE Z0CASE(Z0_TEST0 VARCHAR(100), Z0_TEST1 VARCHAR(50),Z0_TEST2 INT) with column group (all columns, each column);
INSERT INTO  Z0CASE (z0_test0,z0_test1,Z0_TEST2)VALUES('11.00','1111.1111',10);
INSERT INTO  Z0CASE (z0_test0,z0_test1,Z0_TEST2)VALUES('0.0','1111.1111',100);
INSERT INTO  Z0CASE (z0_test0,z0_test1,Z0_TEST2)VALUES(NULL,NULL,0);
SELECT * FROM Z0CASE;
Z0_TEST0	Z0_TEST1	Z0_TEST2
11.00	1111.1111	10
0.0	1111.1111	100
NULL	NULL	0
SELECT table_id,table_name FROM oceanbase.__all_virtual_table WHERE table_name='Z0CASE';
ALTER TABLE Z0CASE MODIFY COLUMN z0_test0 YEAR ;
SELECT Z0_TEST0 FROM Z0CASE ORDER BY Z0_TEST2;
DESC Z0CASE;
Field	Type	Null	Key	Default	Extra
z0_test0	year(4)	YES		NULL	
Z0_TEST1	varchar(50)	YES		NULL	
Z0_TEST2	int(11)	YES		NULL	
SELECT table_id,table_name FROM oceanbase.__all_virtual_table WHERE table_name='Z0CASE';
DROP TABLE Z0CASE;
CREATE TABLE Z0CASE(Z0_TEST0 VARCHAR(100), Z0_TEST1 VARCHAR(50),Z0_TEST2 INT) with column group (all columns, each column);
INSERT INTO  Z0CASE (z0_test0,z0_test1,Z0_TEST2)VALUES(0.00,111,11);
INSERT INTO  Z0CASE (z0_test0,z0_test1,Z0_TEST2)VALUES('1111.1111','1111.1111',100);
INSERT INTO  Z0CASE (z0_test0,z0_test1,Z0_TEST2)VALUES('2011-11-11 11:11:11','2011-11-11 11:11:11',20);
ALTER TABLE Z0CASE MODIFY COLUMN z0_test0 YEAR ;
SELECT Z0_TEST0 FROM Z0CASE ORDER BY Z0_TEST2;
DESC Z0CASE;
Field	Type	Null	Key	Default	Extra
z0_test0	year(4)	YES		NULL	
Z0_TEST1	varchar(50)	YES		NULL	
Z0_TEST2	int(11)	YES		NULL	
SELECT table_id,table_name FROM oceanbase.__all_virtual_table WHERE table_name='Z0CASE';
BLOB
DROP TABLE Z0CASE;
CREATE TABLE Z0CASE(Z0_TEST0 TINYBLOB,Z0_TEST1 BLOB,Z0_TEST2 MEDIUMBLOB,Z0_TEST3 LONGBLOB) with column group (all columns, each column);
INSERT INTO  Z0CASE (z0_test0,z0_test1,Z0_TEST2)VALUES('abc ABC','abc ABC','abc ABC');
INSERT INTO  Z0CASE (z0_test0,z0_test1,Z0_TEST2)VALUES('中文字符@!#$%^','中文字符@!#$%^','中文字符@!#$%^');
INSERT INTO  Z0CASE (z0_test0,z0_test1,Z0_TEST2)VALUES('2011-11-11 11:11:11','2011-11-11 11:11:11',20);
INSERT INTO  Z0CASE (z0_test0,z0_test1,Z0_TEST2)VALUES(NULL,NULL,0);
SELECT * FROM Z0CASE ORDER BY Z0_TEST2;
Z0_TEST0	Z0_TEST1	Z0_TEST2	Z0_TEST3
NULL	NULL	0	NULL
2011-11-11 11:11:11	2011-11-11 11:11:11	20	NULL
abc ABC	abc ABC	abc ABC	NULL
中文字符@!#$%^	中文字符@!#$%^	中文字符@!#$%^	NULL
SELECT table_id,table_name FROM oceanbase.__all_virtual_table WHERE table_name='Z0CASE';
ALTER TABLE Z0CASE MODIFY COLUMN z0_test0 TINYBLOB ;
DESC Z0CASE;
Field	Type	Null	Key	Default	Extra
z0_test0	tinyblob	YES		NULL	
Z0_TEST1	blob	YES		NULL	
Z0_TEST2	mediumblob	YES		NULL	
Z0_TEST3	longblob	YES		NULL	
SELECT table_id,table_name FROM oceanbase.__all_virtual_table WHERE table_name='Z0CASE';
DROP TABLE Z0CASE;
CREATE TABLE Z0CASE(Z0_TEST0 TINYBLOB, Z0_TEST1 BLOB,Z0_TEST2 MEDIUMBLOB,Z0_TEST3 LONGBLOB) with column group (all columns, each column);
INSERT INTO  Z0CASE (z0_test0,z0_test1,Z0_TEST2)VALUES('abc ABC','abc ABC','abc ABC');
INSERT INTO  Z0CASE (z0_test0,z0_test1,Z0_TEST2)VALUES('中文字符@!#$%^','中文字符@!#$%^','中文字符@!#$%^');
INSERT INTO  Z0CASE (z0_test0,z0_test1,Z0_TEST2)VALUES('2011-11-11 11:11:11','2011-11-11 11:11:11',20);
INSERT INTO  Z0CASE (z0_test0,z0_test1,Z0_TEST2)VALUES(NULL,NULL,0);
SELECT * FROM Z0CASE ORDER BY Z0_TEST2;
Z0_TEST0	Z0_TEST1	Z0_TEST2	Z0_TEST3
NULL	NULL	0	NULL
2011-11-11 11:11:11	2011-11-11 11:11:11	20	NULL
abc ABC	abc ABC	abc ABC	NULL
中文字符@!#$%^	中文字符@!#$%^	中文字符@!#$%^	NULL
SELECT table_id,table_name FROM oceanbase.__all_virtual_table WHERE table_name='Z0CASE';
ALTER TABLE Z0CASE MODIFY COLUMN z0_test0 BLOB ;
SELECT Z0_TEST0 FROM Z0CASE ORDER BY Z0_TEST2;
Z0_TEST0
NULL
2011-11-11 11:11:11
abc ABC
中文字符@!#$%^
DESC Z0CASE;
Field	Type	Null	Key	Default	Extra
z0_test0	blob	YES		NULL	
Z0_TEST1	blob	YES		NULL	
Z0_TEST2	mediumblob	YES		NULL	
Z0_TEST3	longblob	YES		NULL	
SELECT table_id,table_name FROM oceanbase.__all_virtual_table WHERE table_name='Z0CASE';
ALTER TABLE Z0CASE MODIFY COLUMN z0_test1 BLOB;
SELECT Z0_TEST0 FROM Z0CASE ORDER BY Z0_TEST2;
Z0_TEST0
NULL
2011-11-11 11:11:11
abc ABC
中文字符@!#$%^
DESC Z0CASE;
Field	Type	Null	Key	Default	Extra
z0_test0	blob	YES		NULL	
z0_test1	blob	YES		NULL	
Z0_TEST2	mediumblob	YES		NULL	
Z0_TEST3	longblob	YES		NULL	
SELECT table_id,table_name FROM oceanbase.__all_virtual_table WHERE table_name='Z0CASE';
DROP TABLE Z0CASE;
CREATE TABLE Z0CASE(Z0_TEST0 TINYBLOB, Z0_TEST1 BLOB,Z0_TEST2 MEDIUMBLOB,Z0_TEST3 LONGBLOB) with column group (all columns, each column);
INSERT INTO  Z0CASE (z0_test0,z0_test1,Z0_TEST2)VALUES('abc ABC','abc ABC','abc ABC');
INSERT INTO  Z0CASE (z0_test0,z0_test1,Z0_TEST2)VALUES('中文字符@!#$%^','中文字符@!#$%^','中文字符@!#$%^');
INSERT INTO  Z0CASE (z0_test0,z0_test1,Z0_TEST2)VALUES('2011-11-11 11:11:11','2011-11-11 11:11:11',20);
INSERT INTO  Z0CASE (z0_test0,z0_test1,Z0_TEST2)VALUES(NULL,NULL,0);
SELECT * FROM Z0CASE ORDER BY Z0_TEST2;
Z0_TEST0	Z0_TEST1	Z0_TEST2	Z0_TEST3
NULL	NULL	0	NULL
2011-11-11 11:11:11	2011-11-11 11:11:11	20	NULL
abc ABC	abc ABC	abc ABC	NULL
中文字符@!#$%^	中文字符@!#$%^	中文字符@!#$%^	NULL
SELECT table_id,table_name FROM oceanbase.__all_virtual_table WHERE table_name='Z0CASE';
ALTER TABLE Z0CASE MODIFY COLUMN z0_test0 MEDIUMBLOB;
SELECT Z0_TEST0 FROM Z0CASE ORDER BY Z0_TEST2;
Z0_TEST0
NULL
2011-11-11 11:11:11
abc ABC
中文字符@!#$%^
DESC Z0CASE;
Field	Type	Null	Key	Default	Extra
z0_test0	mediumblob	YES		NULL	
Z0_TEST1	blob	YES		NULL	
Z0_TEST2	mediumblob	YES		NULL	
Z0_TEST3	longblob	YES		NULL	
SELECT table_id,table_name FROM oceanbase.__all_virtual_table WHERE table_name='Z0CASE';
INSERT INTO  Z0CASE (z0_test0,z0_test1,Z0_TEST2)VALUES('abcabc ABCabc ABCabc ABCabc ABC ABC','abc ABC','abc ABC');
INSERT INTO  Z0CASE (z0_test0,z0_test1,Z0_TEST2)VALUES(213456789078995113365842566663,NULL,0);
SELECT Z0_TEST0 FROM Z0CASE ORDER BY Z0_TEST2;
Z0_TEST0
NULL
213456789078995113365842566663
2011-11-11 11:11:11
abc ABC
abcabc ABCabc ABCabc ABCabc ABC ABC
中文字符@!#$%^
UPDATE Z0CASE SET z0_test0='QWERERTERYRTFDD!@#$%^&*%add发;;]   /.//?测试数据' WHERE z0_test1='abc ABC';
UPDATE Z0CASE SET z0_test0=1233665548899+3332248696232 WHERE z0_test2=0;
Warnings:
Warning	1292	Truncated incorrect DECIMAL value: 'abc ABC'
Warning	1292	Truncated incorrect DECIMAL value: '中文字符@!#$%^'
Warning	1292	Truncated incorrect DECIMAL value: 'abc ABC'
SELECT Z0_TEST0 FROM Z0CASE ORDER BY Z0_TEST2;
Z0_TEST0
4565914245131
4565914245131
2011-11-11 11:11:11
4565914245131
4565914245131
4565914245131
DELETE FROM Z0CASE WHERE z0_test0=213456789078995113365842566663;
Warnings:
Warning	1292	Truncated incorrect DECIMAL value: '2011-11-11 11:11:11'
DELETE FROM Z0CASE WHERE z0_test0='213456789078995113365842566663';
SELECT * FROM Z0CASE ORDER BY Z0_TEST2;
z0_test0	Z0_TEST1	Z0_TEST2	Z0_TEST3
4565914245131	NULL	0	NULL
4565914245131	NULL	0	NULL
2011-11-11 11:11:11	2011-11-11 11:11:11	20	NULL
4565914245131	abc ABC	abc ABC	NULL
4565914245131	abc ABC	abc ABC	NULL
4565914245131	中文字符@!#$%^	中文字符@!#$%^	NULL
ALTER TABLE Z0CASE MODIFY COLUMN Z0_TEST2 MEDIUMBLOB;
SELECT Z0_TEST2 FROM Z0CASE ORDER BY Z0_TEST2;
Z0_TEST2
0
0
20
abc ABC
abc ABC
中文字符@!#$%^
DESC Z0CASE;
Field	Type	Null	Key	Default	Extra
z0_test0	mediumblob	YES		NULL	
Z0_TEST1	blob	YES		NULL	
Z0_TEST2	mediumblob	YES		NULL	
Z0_TEST3	longblob	YES		NULL	
SELECT table_id,table_name FROM oceanbase.__all_virtual_table WHERE table_name='Z0CASE';
DROP TABLE Z0CASE;
CREATE TABLE Z0CASE(Z0_TEST0 TINYBLOB, Z0_TEST1 BLOB,Z0_TEST2 MEDIUMBLOB,Z0_TEST3 LONGBLOB) with column group (all columns, each column);
INSERT INTO  Z0CASE (z0_test0,z0_test1,Z0_TEST2)VALUES('abc ABC','abc ABC','abc ABC');
INSERT INTO  Z0CASE (z0_test0,z0_test1,Z0_TEST2)VALUES('中文字符@!#$%^','中文字符@!#$%^','中文字符@!#$%^');
INSERT INTO  Z0CASE (z0_test0,z0_test1,Z0_TEST2)VALUES('2011-11-11 11:11:11','2011-11-11 11:11:11',20);
INSERT INTO  Z0CASE (z0_test0,z0_test1,Z0_TEST2)VALUES(NULL,NULL,0);
SELECT * FROM Z0CASE ORDER BY Z0_TEST2;
Z0_TEST0	Z0_TEST1	Z0_TEST2	Z0_TEST3
NULL	NULL	0	NULL
2011-11-11 11:11:11	2011-11-11 11:11:11	20	NULL
abc ABC	abc ABC	abc ABC	NULL
中文字符@!#$%^	中文字符@!#$%^	中文字符@!#$%^	NULL
SELECT table_id,table_name FROM oceanbase.__all_virtual_table WHERE table_name='Z0CASE';
ALTER TABLE Z0CASE MODIFY COLUMN z0_test0 LONGBLOB;
SELECT Z0_TEST0 FROM Z0CASE ORDER BY Z0_TEST2;
Z0_TEST0
NULL
2011-11-11 11:11:11
abc ABC
中文字符@!#$%^
DESC Z0CASE;
Field	Type	Null	Key	Default	Extra
z0_test0	longblob	YES		NULL	
Z0_TEST1	blob	YES		NULL	
Z0_TEST2	mediumblob	YES		NULL	
Z0_TEST3	longblob	YES		NULL	
SELECT table_id,table_name FROM oceanbase.__all_virtual_table WHERE table_name='Z0CASE';
INSERT INTO  Z0CASE (z0_test0,z0_test1,Z0_TEST2)VALUES('abcabc ABCabc ABCabc ABCabc ABC ABC','abc ABC','abc ABC');
INSERT INTO  Z0CASE (z0_test0,z0_test1,Z0_TEST2)VALUES(213456789078995113365842566663,NULL,0);
SELECT * FROM Z0CASE ORDER BY Z0_TEST2;
z0_test0	Z0_TEST1	Z0_TEST2	Z0_TEST3
NULL	NULL	0	NULL
213456789078995113365842566663	NULL	0	NULL
2011-11-11 11:11:11	2011-11-11 11:11:11	20	NULL
abc ABC	abc ABC	abc ABC	NULL
abcabc ABCabc ABCabc ABCabc ABC ABC	abc ABC	abc ABC	NULL
中文字符@!#$%^	中文字符@!#$%^	中文字符@!#$%^	NULL
UPDATE Z0CASE SET z0_test0='QWERERTERYRTFDD!@#$%^&*%add发;;]   /.//?测试数据' WHERE z0_test1='abc ABC';
UPDATE Z0CASE SET z0_test0=1233665548899+3332248696232 WHERE z0_test2=0;
Warnings:
Warning	1292	Truncated incorrect DECIMAL value: 'abc ABC'
Warning	1292	Truncated incorrect DECIMAL value: '中文字符@!#$%^'
Warning	1292	Truncated incorrect DECIMAL value: 'abc ABC'
SELECT * FROM Z0CASE ORDER BY Z0_TEST2;
z0_test0	Z0_TEST1	Z0_TEST2	Z0_TEST3
4565914245131	NULL	0	NULL
4565914245131	NULL	0	NULL
2011-11-11 11:11:11	2011-11-11 11:11:11	20	NULL
4565914245131	abc ABC	abc ABC	NULL
4565914245131	abc ABC	abc ABC	NULL
4565914245131	中文字符@!#$%^	中文字符@!#$%^	NULL
DELETE FROM Z0CASE WHERE z0_test0=213456789078995113365842566663;
Warnings:
Warning	1292	Truncated incorrect DECIMAL value: '2011-11-11 11:11:11'
DELETE FROM Z0CASE WHERE z0_test0='213456789078995113365842566663';
SELECT * FROM Z0CASE ORDER BY Z0_TEST2;
z0_test0	Z0_TEST1	Z0_TEST2	Z0_TEST3
4565914245131	NULL	0	NULL
4565914245131	NULL	0	NULL
2011-11-11 11:11:11	2011-11-11 11:11:11	20	NULL
4565914245131	abc ABC	abc ABC	NULL
4565914245131	abc ABC	abc ABC	NULL
4565914245131	中文字符@!#$%^	中文字符@!#$%^	NULL
ALTER TABLE Z0CASE MODIFY COLUMN Z0_TEST3 LONGBLOB;
DESC Z0CASE;
Field	Type	Null	Key	Default	Extra
z0_test0	longblob	YES		NULL	
Z0_TEST1	blob	YES		NULL	
Z0_TEST2	mediumblob	YES		NULL	
Z0_TEST3	longblob	YES		NULL	
SELECT table_id,table_name FROM oceanbase.__all_virtual_table WHERE table_name='Z0CASE';
其他字符类型
DROP TABLE Z0CASE;
CREATE TABLE Z0CASE(Z0_TEST0 TINYBLOB, Z0_TEST1 BLOB,Z0_TEST2 MEDIUMBLOB) with column group (all columns, each column);
INSERT INTO  Z0CASE (z0_test0,z0_test1,Z0_TEST2)VALUES('abc ABC','abc ABC','abc ABC');
INSERT INTO  Z0CASE (z0_test0,z0_test1,Z0_TEST2)VALUES('中文字符@!#$%^','中文字符@!#$%^','中文字符@!#$%^');
INSERT INTO  Z0CASE (z0_test0,z0_test1,Z0_TEST2)VALUES('2011-11-11 11:11:11','2011-11-11 11:11:11',20);
INSERT INTO  Z0CASE (z0_test0,z0_test1,Z0_TEST2)VALUES(NULL,NULL,0);
SELECT * FROM Z0CASE ORDER BY Z0_TEST2;
Z0_TEST0	Z0_TEST1	Z0_TEST2
NULL	NULL	0
2011-11-11 11:11:11	2011-11-11 11:11:11	20
abc ABC	abc ABC	abc ABC
中文字符@!#$%^	中文字符@!#$%^	中文字符@!#$%^
SELECT table_id,table_name FROM oceanbase.__all_virtual_table WHERE table_name='Z0CASE';
DROP TABLE Z0CASE;
CREATE TABLE Z0CASE(Z0_TEST0 TINYBLOB, Z0_TEST1 BLOB,Z0_TEST2 MEDIUMBLOB) with column group (all columns, each column);
INSERT INTO  Z0CASE (z0_test0,z0_test1,Z0_TEST2)VALUES('111','111','111');
INSERT INTO  Z0CASE (z0_test0,z0_test1,Z0_TEST2)VALUES('111.111','111.111','111.111');
INSERT INTO  Z0CASE (z0_test0,z0_test1,Z0_TEST2)VALUES('0.000','0.000','0.000');
INSERT INTO  Z0CASE (z0_test0,z0_test1,Z0_TEST2)VALUES(NULL,NULL,0);
SELECT * FROM Z0CASE ORDER BY Z0_TEST2;
Z0_TEST0	Z0_TEST1	Z0_TEST2
NULL	NULL	0
0.000	0.000	0.000
111	111	111
111.111	111.111	111.111
SELECT table_id,table_name FROM oceanbase.__all_virtual_table WHERE table_name='Z0CASE';
DROP TABLE Z0CASE;
CREATE TABLE Z0CASE(Z0_TEST0 TINYBLOB, Z0_TEST1 BLOB,Z0_TEST2 MEDIUMBLOB,Z0_TEST3 LONGBLOB) with column group (all columns, each column);
INSERT INTO  Z0CASE (z0_test0,z0_test1,Z0_TEST2,Z0_TEST3)VALUES('11:11:11 ','11:11:11 ','11:11:11 ','11:11:11 ');
INSERT INTO  Z0CASE (z0_test0,z0_test1,Z0_TEST2,Z0_TEST3)VALUES('2011-11-11 ','2011-11-11 ','2011-11-11 ','2011-11-11 11:11:11');
INSERT INTO  Z0CASE (z0_test0,z0_test1,Z0_TEST2,Z0_TEST3)VALUES('2011-11-11 11:11:11','2011-11-11 11:11:11','2011-11-11 11:11:11','2011-11-11 11:11:11');
INSERT INTO  Z0CASE (z0_test0,z0_test1,Z0_TEST2,Z0_TEST3)VALUES(NULL,NULL,NULL,NULL);
SELECT * FROM Z0CASE ORDER BY Z0_TEST2;
Z0_TEST0	Z0_TEST1	Z0_TEST2	Z0_TEST3
NULL	NULL	NULL	NULL
11:11:11 	11:11:11 	11:11:11 	11:11:11 
2011-11-11 	2011-11-11 	2011-11-11 	2011-11-11 11:11:11
2011-11-11 11:11:11	2011-11-11 11:11:11	2011-11-11 11:11:11	2011-11-11 11:11:11
SELECT table_id,table_name FROM oceanbase.__all_virtual_table WHERE table_name='Z0CASE';
TEXT
DROP TABLE Z0CASE;
CREATE TABLE Z0CASE(Z0_TEST0 TINYTEXT, Z0_TEST1 text,Z0_TEST2 MEDIUMTEXT,Z0_TEST3 LONGTEXT) with column group (all columns, each column);
INSERT INTO  Z0CASE (z0_test0,z0_test1,Z0_TEST2,Z0_TEST3)VALUES('11:11:11 ','11:11:11 ','11:11:11 ','11:11:11 ');
INSERT INTO  Z0CASE (z0_test0,z0_test1,Z0_TEST2,Z0_TEST3)VALUES('2011-11-11 ','2011-11-11 ','2011-11-11 ','2011-11-11 ');
INSERT INTO  Z0CASE (z0_test0,z0_test1,Z0_TEST2,Z0_TEST3)VALUES('2011-11-11 11:11:11','2011-11-11 11:11:11','2011-11-11 11:11:11','2011-11-11 11:11:11');
INSERT INTO  Z0CASE (z0_test0,z0_test1,Z0_TEST2,Z0_TEST3)VALUES(NULL,NULL,NULL,NULL);
SELECT * FROM Z0CASE ORDER BY Z0_TEST2;
Z0_TEST0	Z0_TEST1	Z0_TEST2	Z0_TEST3
NULL	NULL	NULL	NULL
11:11:11 	11:11:11 	11:11:11 	11:11:11 
2011-11-11 	2011-11-11 	2011-11-11 	2011-11-11 
2011-11-11 11:11:11	2011-11-11 11:11:11	2011-11-11 11:11:11	2011-11-11 11:11:11
SELECT table_id,table_name FROM oceanbase.__all_virtual_table WHERE table_name='Z0CASE';
TINYTEXT -->TINYTEXT
ALTER TABLE Z0CASE MODIFY COLUMN z0_test0 TINYTEXT;
SELECT Z0_TEST0 FROM Z0CASE ORDER BY Z0_TEST2;
Z0_TEST0
NULL
11:11:11 
2011-11-11 
2011-11-11 11:11:11
DESC Z0CASE;
Field	Type	Null	Key	Default	Extra
z0_test0	tinytext	YES		NULL	
Z0_TEST1	text	YES		NULL	
Z0_TEST2	mediumtext	YES		NULL	
Z0_TEST3	longtext	YES		NULL	
SELECT table_id,table_name FROM oceanbase.__all_virtual_table WHERE table_name='Z0CASE';
INSERT INTO  Z0CASE (z0_test0,z0_test1,Z0_TEST2,Z0_TEST3)VALUES('11:11:11 11:11:1111:11:1111:11:1111:11:11','11:11:11 ','11:11:11 ','11:11:11 ');
INSERT INTO  Z0CASE (z0_test0,z0_test1,Z0_TEST2,Z0_TEST3)VALUES(12345678963258741201236548789652,'11:11:11 ','11:11:11 ','11:11:11 ');
INSERT INTO  Z0CASE (z0_test0,z0_test1,Z0_TEST2,Z0_TEST3)VALUES('测试数据+——）（*&……%￥#@！123456789【】、；。/，《》？：Lasdasassffafsads','11:11:11 ','11:11:11 ','11:11:11 ');
SELECT * FROM Z0CASE ORDER BY Z0_TEST2;
z0_test0	Z0_TEST1	Z0_TEST2	Z0_TEST3
NULL	NULL	NULL	NULL
11:11:11 	11:11:11 	11:11:11 	11:11:11 
11:11:11 11:11:1111:11:1111:11:1111:11:11	11:11:11 	11:11:11 	11:11:11 
12345678963258741201236548789652	11:11:11 	11:11:11 	11:11:11 
测试数据+——）（*&……%￥#@！123456789【】、；。/，《》？：Lasdasassffafsads	11:11:11 	11:11:11 	11:11:11 
2011-11-11 	2011-11-11 	2011-11-11 	2011-11-11 
2011-11-11 11:11:11	2011-11-11 11:11:11	2011-11-11 11:11:11	2011-11-11 11:11:11
UPDATE Z0CASE SET z0_test0=1234322312122 WHERE z0_test1='2011-11-11 ';
UPDATE Z0CASE SET z0_test0='@$%*&$#@12334556   4DFDDddfgdsfgjhrsdd[];/.,\\//' WHERE z0_test0=1234322312122;
Warnings:
Warning	1292	Truncated incorrect DECIMAL value: '11:11:11 '
Warning	1292	Truncated incorrect DECIMAL value: '2011-11-11 11:11:11'
Warning	1292	Truncated incorrect DECIMAL value: '11:11:11 11:11:1111:11:1111:11:1111:11:11'
Warning	1292	Truncated incorrect DECIMAL value: '测试数据+——）（*&……%￥#@！123456789【】、；。/，《》？：Lasdasassffafsads'
UPDATE Z0CASE SET z0_test0='@$%*&$#@12334556   4DFDDddfgdsfgjhrsdd[];/.,\\//' WHERE z0_test0='1234322312122';
SELECT * FROM Z0CASE ORDER BY Z0_TEST2;
z0_test0	Z0_TEST1	Z0_TEST2	Z0_TEST3
NULL	NULL	NULL	NULL
11:11:11 	11:11:11 	11:11:11 	11:11:11 
11:11:11 11:11:1111:11:1111:11:1111:11:11	11:11:11 	11:11:11 	11:11:11 
12345678963258741201236548789652	11:11:11 	11:11:11 	11:11:11 
测试数据+——）（*&……%￥#@！123456789【】、；。/，《》？：Lasdasassffafsads	11:11:11 	11:11:11 	11:11:11 
@$%*&$#@12334556   4DFDDddfgdsfgjhrsdd[];/.,\//	2011-11-11 	2011-11-11 	2011-11-11 
2011-11-11 11:11:11	2011-11-11 11:11:11	2011-11-11 11:11:11	2011-11-11 11:11:11
DELETE FROM Z0CASE WHERE z0_test0=12345678963258741201236548789652;
Warnings:
Warning	1292	Truncated incorrect DECIMAL value: '11:11:11 '
Warning	1292	Truncated incorrect DECIMAL value: '@$%*&$#@12334556   4DFDDddfgdsfgjhrsdd[];/.,\//'
Warning	1292	Truncated incorrect DECIMAL value: '2011-11-11 11:11:11'
Warning	1292	Truncated incorrect DECIMAL value: '11:11:11 11:11:1111:11:1111:11:1111:11:11'
Warning	1292	Truncated incorrect DECIMAL value: '测试数据+——）（*&……%￥#@！123456789【】、；。/，《》？：Lasdasassffafsads'
DELETE FROM Z0CASE WHERE z0_test0='12345678963258741201236548789652';
DELETE FROM Z0CASE WHERE z0_test0='@$%*&$#@12334556   4DFDDddfgdsfgjhrsdd[];/.,\\//';
SELECT * FROM Z0CASE ORDER BY Z0_TEST2;
z0_test0	Z0_TEST1	Z0_TEST2	Z0_TEST3
NULL	NULL	NULL	NULL
11:11:11 	11:11:11 	11:11:11 	11:11:11 
11:11:11 11:11:1111:11:1111:11:1111:11:11	11:11:11 	11:11:11 	11:11:11 
测试数据+——）（*&……%￥#@！123456789【】、；。/，《》？：Lasdasassffafsads	11:11:11 	11:11:11 	11:11:11 
2011-11-11 11:11:11	2011-11-11 11:11:11	2011-11-11 11:11:11	2011-11-11 11:11:11
text -->text
DROP TABLE Z0CASE;
CREATE TABLE Z0CASE(Z0_TEST0 TINYTEXT, Z0_TEST1 text,Z0_TEST2 MEDIUMTEXT,Z0_TEST3 LONGTEXT) with column group (all columns, each column);
INSERT INTO  Z0CASE (z0_test0,z0_test1,Z0_TEST2,Z0_TEST3)VALUES('11:11:11 ','11:11:11 ','11:11:11 ','11:11:11 ');
INSERT INTO  Z0CASE (z0_test0,z0_test1,Z0_TEST2,Z0_TEST3)VALUES('2011-11-11 ','2011-11-11 ','2011-11-11 ','2011-11-11 ');
INSERT INTO  Z0CASE (z0_test0,z0_test1,Z0_TEST2,Z0_TEST3)VALUES('2011-11-11 11:11:11','2011-11-11 11:11:11','2011-11-11 11:11:11','2011-11-11 11:11:11');
INSERT INTO  Z0CASE (z0_test0,z0_test1,Z0_TEST2,Z0_TEST3)VALUES(NULL,NULL,NULL,NULL);
SELECT * FROM Z0CASE ORDER BY Z0_TEST2;
Z0_TEST0	Z0_TEST1	Z0_TEST2	Z0_TEST3
NULL	NULL	NULL	NULL
11:11:11 	11:11:11 	11:11:11 	11:11:11 
2011-11-11 	2011-11-11 	2011-11-11 	2011-11-11 
2011-11-11 11:11:11	2011-11-11 11:11:11	2011-11-11 11:11:11	2011-11-11 11:11:11
SELECT table_id,table_name FROM oceanbase.__all_virtual_table WHERE table_name='Z0CASE';
ALTER TABLE Z0CASE MODIFY COLUMN z0_test0 text;
SELECT Z0_TEST0 FROM Z0CASE ORDER BY Z0_TEST2;
Z0_TEST0
NULL
11:11:11 
2011-11-11 
2011-11-11 11:11:11
DESC Z0CASE;
Field	Type	Null	Key	Default	Extra
z0_test0	text	YES		NULL	
Z0_TEST1	text	YES		NULL	
Z0_TEST2	mediumtext	YES		NULL	
Z0_TEST3	longtext	YES		NULL	
SELECT table_id,table_name FROM oceanbase.__all_virtual_table WHERE table_name='Z0CASE';
ALTER TABLE Z0CASE MODIFY COLUMN z0_test1 text;
SELECT Z0_TEST1 FROM Z0CASE ORDER BY Z0_TEST2;
Z0_TEST1
NULL
11:11:11 
2011-11-11 
2011-11-11 11:11:11
DESC Z0CASE;
Field	Type	Null	Key	Default	Extra
z0_test0	text	YES		NULL	
z0_test1	text	YES		NULL	
Z0_TEST2	mediumtext	YES		NULL	
Z0_TEST3	longtext	YES		NULL	
SELECT table_id,table_name FROM oceanbase.__all_virtual_table WHERE table_name='Z0CASE';
MEDIUMTEXT -->MEDIUMTEXT
DROP TABLE Z0CASE;
CREATE TABLE Z0CASE(Z0_TEST0 TINYTEXT, Z0_TEST1 text,Z0_TEST2 MEDIUMTEXT,Z0_TEST3 LONGTEXT) with column group (all columns, each column);
INSERT INTO  Z0CASE (z0_test0,z0_test1,Z0_TEST2,Z0_TEST3)VALUES('11:11:11 ','11:11:11 ','11:11:11 ','11:11:11 ');
INSERT INTO  Z0CASE (z0_test0,z0_test1,Z0_TEST2,Z0_TEST3)VALUES('2011-11-11 ','2011-11-11 ','2011-11-11 ','2011-11-11 ');
INSERT INTO  Z0CASE (z0_test0,z0_test1,Z0_TEST2,Z0_TEST3)VALUES('2011-11-11 11:11:11','2011-11-11 11:11:11','2011-11-11 11:11:11','2011-11-11 11:11:11');
INSERT INTO  Z0CASE (z0_test0,z0_test1,Z0_TEST2,Z0_TEST3)VALUES(NULL,NULL,NULL,NULL);
SELECT * FROM Z0CASE ORDER BY Z0_TEST2;
Z0_TEST0	Z0_TEST1	Z0_TEST2	Z0_TEST3
NULL	NULL	NULL	NULL
11:11:11 	11:11:11 	11:11:11 	11:11:11 
2011-11-11 	2011-11-11 	2011-11-11 	2011-11-11 
2011-11-11 11:11:11	2011-11-11 11:11:11	2011-11-11 11:11:11	2011-11-11 11:11:11
SELECT table_id,table_name FROM oceanbase.__all_virtual_table WHERE table_name='Z0CASE';
ALTER TABLE Z0CASE MODIFY COLUMN z0_test0 MEDIUMTEXT;
SELECT Z0_TEST0 FROM Z0CASE ORDER BY Z0_TEST2;
Z0_TEST0
NULL
11:11:11 
2011-11-11 
2011-11-11 11:11:11
DESC Z0CASE;
Field	Type	Null	Key	Default	Extra
z0_test0	mediumtext	YES		NULL	
Z0_TEST1	text	YES		NULL	
Z0_TEST2	mediumtext	YES		NULL	
Z0_TEST3	longtext	YES		NULL	
SELECT table_id,table_name FROM oceanbase.__all_virtual_table WHERE table_name='Z0CASE';
INSERT INTO  Z0CASE (z0_test0,z0_test1,Z0_TEST2,Z0_TEST3)VALUES('11:11:11 11:11:1111:11:1111:11:1111:11:11','11:11:11 ','11:11:11 ','11:11:11 ');
INSERT INTO  Z0CASE (z0_test0,z0_test1,Z0_TEST2,Z0_TEST3)VALUES(12345678963258741201236548789652,'11:11:11 ','11:11:11 ','11:11:11 ');
INSERT INTO  Z0CASE (z0_test0,z0_test1,Z0_TEST2,Z0_TEST3)VALUES('测试数据+——）（*&……%￥#@！123456789【】、；。/，《》？：Lasdasassffafsads','11:11:11 ','11:11:11 ','11:11:11 ');
SELECT * FROM Z0CASE ORDER BY Z0_TEST2;
z0_test0	Z0_TEST1	Z0_TEST2	Z0_TEST3
NULL	NULL	NULL	NULL
11:11:11 	11:11:11 	11:11:11 	11:11:11 
11:11:11 11:11:1111:11:1111:11:1111:11:11	11:11:11 	11:11:11 	11:11:11 
12345678963258741201236548789652	11:11:11 	11:11:11 	11:11:11 
测试数据+——）（*&……%￥#@！123456789【】、；。/，《》？：Lasdasassffafsads	11:11:11 	11:11:11 	11:11:11 
2011-11-11 	2011-11-11 	2011-11-11 	2011-11-11 
2011-11-11 11:11:11	2011-11-11 11:11:11	2011-11-11 11:11:11	2011-11-11 11:11:11
UPDATE Z0CASE SET z0_test0=1234322312122 WHERE z0_test1='2011-11-11 ';
UPDATE Z0CASE SET z0_test0='@$%*&$#@12334556   4DFDDddfgdsfgjhrsdd[];/.,\\//' WHERE z0_test0=1234322312122;
Warnings:
Warning	1292	Truncated incorrect DECIMAL value: '11:11:11 '
Warning	1292	Truncated incorrect DECIMAL value: '2011-11-11 11:11:11'
Warning	1292	Truncated incorrect DECIMAL value: '11:11:11 11:11:1111:11:1111:11:1111:11:11'
Warning	1292	Truncated incorrect DECIMAL value: '测试数据+——）（*&……%￥#@！123456789【】、；。/，《》？：Lasdasassffafsads'
UPDATE Z0CASE SET z0_test0='@$%*&$#@12334556   4DFDDddfgdsfgjhrsdd[];/.,\\//' WHERE z0_test0='1234322312122';
SELECT * FROM Z0CASE ORDER BY Z0_TEST2;
z0_test0	Z0_TEST1	Z0_TEST2	Z0_TEST3
NULL	NULL	NULL	NULL
11:11:11 	11:11:11 	11:11:11 	11:11:11 
11:11:11 11:11:1111:11:1111:11:1111:11:11	11:11:11 	11:11:11 	11:11:11 
12345678963258741201236548789652	11:11:11 	11:11:11 	11:11:11 
测试数据+——）（*&……%￥#@！123456789【】、；。/，《》？：Lasdasassffafsads	11:11:11 	11:11:11 	11:11:11 
@$%*&$#@12334556   4DFDDddfgdsfgjhrsdd[];/.,\//	2011-11-11 	2011-11-11 	2011-11-11 
2011-11-11 11:11:11	2011-11-11 11:11:11	2011-11-11 11:11:11	2011-11-11 11:11:11
DELETE FROM Z0CASE WHERE z0_test0=12345678963258741201236548789652;
Warnings:
Warning	1292	Truncated incorrect DECIMAL value: '11:11:11 '
Warning	1292	Truncated incorrect DECIMAL value: '@$%*&$#@12334556   4DFDDddfgdsfgjhrsdd[];/.,\//'
Warning	1292	Truncated incorrect DECIMAL value: '2011-11-11 11:11:11'
Warning	1292	Truncated incorrect DECIMAL value: '11:11:11 11:11:1111:11:1111:11:1111:11:11'
Warning	1292	Truncated incorrect DECIMAL value: '测试数据+——）（*&……%￥#@！123456789【】、；。/，《》？：Lasdasassffafsads'
DELETE FROM Z0CASE WHERE z0_test0='12345678963258741201236548789652';
DELETE FROM Z0CASE WHERE z0_test0='@$%*&$#@12334556   4DFDDddfgdsfgjhrsdd[];/.,\\//';
SELECT * FROM Z0CASE ORDER BY Z0_TEST2;
z0_test0	Z0_TEST1	Z0_TEST2	Z0_TEST3
NULL	NULL	NULL	NULL
11:11:11 	11:11:11 	11:11:11 	11:11:11 
11:11:11 11:11:1111:11:1111:11:1111:11:11	11:11:11 	11:11:11 	11:11:11 
测试数据+——）（*&……%￥#@！123456789【】、；。/，《》？：Lasdasassffafsads	11:11:11 	11:11:11 	11:11:11 
2011-11-11 11:11:11	2011-11-11 11:11:11	2011-11-11 11:11:11	2011-11-11 11:11:11
ALTER TABLE Z0CASE MODIFY COLUMN Z0_TEST2 MEDIUMTEXT;
SELECT Z0_TEST2 FROM Z0CASE ORDER BY Z0_TEST2;
Z0_TEST2
NULL
11:11:11 
11:11:11 
11:11:11 
2011-11-11 11:11:11
DESC Z0CASE;
Field	Type	Null	Key	Default	Extra
z0_test0	mediumtext	YES		NULL	
Z0_TEST1	text	YES		NULL	
Z0_TEST2	mediumtext	YES		NULL	
Z0_TEST3	longtext	YES		NULL	
SELECT table_id,table_name FROM oceanbase.__all_virtual_table WHERE table_name='Z0CASE';
LONGTEXT -->LONGTEXT
DROP TABLE Z0CASE;
CREATE TABLE Z0CASE(Z0_TEST0 TINYTEXT, Z0_TEST1 text,Z0_TEST2 MEDIUMTEXT,Z0_TEST3 LONGTEXT) with column group (all columns, each column);
INSERT INTO  Z0CASE (z0_test0,z0_test1,Z0_TEST2,Z0_TEST3)VALUES('11:11:11 ','11:11:11 ','11:11:11 ','11:11:11 ');
INSERT INTO  Z0CASE (z0_test0,z0_test1,Z0_TEST2,Z0_TEST3)VALUES('2011-11-11 ','2011-11-11 ','2011-11-11 ','2011-11-11 ');
INSERT INTO  Z0CASE (z0_test0,z0_test1,Z0_TEST2,Z0_TEST3)VALUES('2011-11-11 11:11:11','2011-11-11 11:11:11','2011-11-11 11:11:11','2011-11-11 11:11:11');
INSERT INTO  Z0CASE (z0_test0,z0_test1,Z0_TEST2,Z0_TEST3)VALUES(NULL,NULL,NULL,NULL);
SELECT * FROM Z0CASE ORDER BY Z0_TEST2;
Z0_TEST0	Z0_TEST1	Z0_TEST2	Z0_TEST3
NULL	NULL	NULL	NULL
11:11:11 	11:11:11 	11:11:11 	11:11:11 
2011-11-11 	2011-11-11 	2011-11-11 	2011-11-11 
2011-11-11 11:11:11	2011-11-11 11:11:11	2011-11-11 11:11:11	2011-11-11 11:11:11
SELECT table_id,table_name FROM oceanbase.__all_virtual_table WHERE table_name='Z0CASE';
ALTER TABLE Z0CASE MODIFY COLUMN z0_test0 LONGTEXT;
SELECT Z0_TEST0 FROM Z0CASE ORDER BY Z0_TEST2;
Z0_TEST0
NULL
11:11:11 
2011-11-11 
2011-11-11 11:11:11
DESC Z0CASE;
Field	Type	Null	Key	Default	Extra
z0_test0	longtext	YES		NULL	
Z0_TEST1	text	YES		NULL	
Z0_TEST2	mediumtext	YES		NULL	
Z0_TEST3	longtext	YES		NULL	
SELECT table_id,table_name FROM oceanbase.__all_virtual_table WHERE table_name='Z0CASE';
INSERT INTO  Z0CASE (z0_test0,z0_test1,Z0_TEST2,Z0_TEST3)VALUES('11:11:11 11:11:1111:11:1111:11:1111:11:11','11:11:11 ','11:11:11 ','11:11:11 ');
INSERT INTO  Z0CASE (z0_test0,z0_test1,Z0_TEST2,Z0_TEST3)VALUES(12345678963258741201236548789652,'11:11:11 ','11:11:11 ','11:11:11 ');
INSERT INTO  Z0CASE (z0_test0,z0_test1,Z0_TEST2,Z0_TEST3)VALUES('测试数据+——）（*&……%￥#@！123456789【】、；。/，《》？：Lasdasassffafsads','11:11:11 ','11:11:11 ','11:11:11 ');
SELECT * FROM Z0CASE ORDER BY Z0_TEST2;
z0_test0	Z0_TEST1	Z0_TEST2	Z0_TEST3
NULL	NULL	NULL	NULL
11:11:11 	11:11:11 	11:11:11 	11:11:11 
11:11:11 11:11:1111:11:1111:11:1111:11:11	11:11:11 	11:11:11 	11:11:11 
12345678963258741201236548789652	11:11:11 	11:11:11 	11:11:11 
测试数据+——）（*&……%￥#@！123456789【】、；。/，《》？：Lasdasassffafsads	11:11:11 	11:11:11 	11:11:11 
2011-11-11 	2011-11-11 	2011-11-11 	2011-11-11 
2011-11-11 11:11:11	2011-11-11 11:11:11	2011-11-11 11:11:11	2011-11-11 11:11:11
UPDATE Z0CASE SET z0_test0=1234322312122 WHERE z0_test1='2011-11-11 ';
UPDATE Z0CASE SET z0_test0='@$%*&$#@12334556   4DFDDddfgdsfgjhrsdd[];/.,\\//' WHERE z0_test0=1234322312122;
Warnings:
Warning	1292	Truncated incorrect DECIMAL value: '11:11:11 '
Warning	1292	Truncated incorrect DECIMAL value: '2011-11-11 11:11:11'
Warning	1292	Truncated incorrect DECIMAL value: '11:11:11 11:11:1111:11:1111:11:1111:11:11'
Warning	1292	Truncated incorrect DECIMAL value: '测试数据+——）（*&……%￥#@！123456789【】、；。/，《》？：Lasdasassffafsads'
UPDATE Z0CASE SET z0_test0='@$%*&$#@12334556   4DFDDddfgdsfgjhrsdd[];/.,\\//' WHERE z0_test0='1234322312122';
SELECT * FROM Z0CASE ORDER BY Z0_TEST2;
z0_test0	Z0_TEST1	Z0_TEST2	Z0_TEST3
NULL	NULL	NULL	NULL
11:11:11 	11:11:11 	11:11:11 	11:11:11 
11:11:11 11:11:1111:11:1111:11:1111:11:11	11:11:11 	11:11:11 	11:11:11 
12345678963258741201236548789652	11:11:11 	11:11:11 	11:11:11 
测试数据+——）（*&……%￥#@！123456789【】、；。/，《》？：Lasdasassffafsads	11:11:11 	11:11:11 	11:11:11 
@$%*&$#@12334556   4DFDDddfgdsfgjhrsdd[];/.,\//	2011-11-11 	2011-11-11 	2011-11-11 
2011-11-11 11:11:11	2011-11-11 11:11:11	2011-11-11 11:11:11	2011-11-11 11:11:11
DELETE FROM Z0CASE WHERE z0_test0=12345678963258741201236548789652;
Warnings:
Warning	1292	Truncated incorrect DECIMAL value: '11:11:11 '
Warning	1292	Truncated incorrect DECIMAL value: '@$%*&$#@12334556   4DFDDddfgdsfgjhrsdd[];/.,\//'
Warning	1292	Truncated incorrect DECIMAL value: '2011-11-11 11:11:11'
Warning	1292	Truncated incorrect DECIMAL value: '11:11:11 11:11:1111:11:1111:11:1111:11:11'
Warning	1292	Truncated incorrect DECIMAL value: '测试数据+——）（*&……%￥#@！123456789【】、；。/，《》？：Lasdasassffafsads'
DELETE FROM Z0CASE WHERE z0_test0='12345678963258741201236548789652';
DELETE FROM Z0CASE WHERE z0_test0='@$%*&$#@12334556   4DFDDddfgdsfgjhrsdd[];/.,\\//';
SELECT * FROM Z0CASE ORDER BY Z0_TEST2;
z0_test0	Z0_TEST1	Z0_TEST2	Z0_TEST3
NULL	NULL	NULL	NULL
11:11:11 	11:11:11 	11:11:11 	11:11:11 
11:11:11 11:11:1111:11:1111:11:1111:11:11	11:11:11 	11:11:11 	11:11:11 
测试数据+——）（*&……%￥#@！123456789【】、；。/，《》？：Lasdasassffafsads	11:11:11 	11:11:11 	11:11:11 
2011-11-11 11:11:11	2011-11-11 11:11:11	2011-11-11 11:11:11	2011-11-11 11:11:11
ALTER TABLE Z0CASE MODIFY COLUMN Z0_TEST3 LONGTEXT;
SELECT Z0_TEST3 FROM Z0CASE ORDER BY Z0_TEST2;
Z0_TEST3
NULL
11:11:11 
11:11:11 
11:11:11 
2011-11-11 11:11:11
DESC Z0CASE;
Field	Type	Null	Key	Default	Extra
z0_test0	longtext	YES		NULL	
Z0_TEST1	text	YES		NULL	
Z0_TEST2	mediumtext	YES		NULL	
Z0_TEST3	longtext	YES		NULL	
SELECT table_id,table_name FROM oceanbase.__all_virtual_table WHERE table_name='Z0CASE';
其他字符类型
DROP TABLE Z0CASE;
CREATE TABLE Z0CASE(Z0_TEST0 TINYTEXT, Z0_TEST1 text,Z0_TEST2 MEDIUMTEXT,Z0_TEST3 LONGTEXT) with column group (all columns, each column);
INSERT INTO  Z0CASE (z0_test0,z0_test1,Z0_TEST2,Z0_TEST3)VALUES('11111111111','111','111','111');
INSERT INTO  Z0CASE (z0_test0,z0_test1,Z0_TEST2,Z0_TEST3)VALUES('111.111','111.111','111.111','111.111');
INSERT INTO  Z0CASE (z0_test0,z0_test1,Z0_TEST2,Z0_TEST3)VALUES('0.000','0.000','0.000','0.000');
INSERT INTO  Z0CASE (z0_test0,z0_test1,Z0_TEST2,Z0_TEST3)VALUES(NULL,NULL,0,null);
SELECT * FROM Z0CASE ORDER BY Z0_TEST2;
Z0_TEST0	Z0_TEST1	Z0_TEST2	Z0_TEST3
NULL	NULL	0	NULL
0.000	0.000	0.000	0.000
11111111111	111	111	111
111.111	111.111	111.111	111.111
SELECT table_id,table_name FROM oceanbase.__all_virtual_table WHERE table_name='Z0CASE';
DROP TABLE Z0CASE;
CREATE TABLE Z0CASE(Z0_TEST0 TINYTEXT, Z0_TEST1 text,Z0_TEST2 MEDIUMTEXT,Z0_TEST3 LONGTEXT) with column group (all columns, each column);
INSERT INTO  Z0CASE (z0_test0,z0_test1,Z0_TEST2,Z0_TEST3)VALUES('11:11:11 ','11:11:11 ','11:11:11 ','11:11:11 ');
INSERT INTO  Z0CASE (z0_test0,z0_test1,Z0_TEST2,Z0_TEST3)VALUES('2011-11-11 ','2011-11-11 ','2011-11-11 ','2011-11-11 11:11:11');
INSERT INTO  Z0CASE (z0_test0,z0_test1,Z0_TEST2,Z0_TEST3)VALUES('2011-11-11 11:11:11','2011-11-11 11:11:11','2011-11-11 11:11:11','2011-11-11 11:11:11');
INSERT INTO  Z0CASE (z0_test0,z0_test1,Z0_TEST2,Z0_TEST3)VALUES(NULL,NULL,NULL,NULL);
SELECT * FROM Z0CASE ORDER BY Z0_TEST2;
Z0_TEST0	Z0_TEST1	Z0_TEST2	Z0_TEST3
NULL	NULL	NULL	NULL
11:11:11 	11:11:11 	11:11:11 	11:11:11 
2011-11-11 	2011-11-11 	2011-11-11 	2011-11-11 11:11:11
2011-11-11 11:11:11	2011-11-11 11:11:11	2011-11-11 11:11:11	2011-11-11 11:11:11
SELECT table_id,table_name FROM oceanbase.__all_virtual_table WHERE table_name='Z0CASE';
SET/ENUM
DROP TABLE Z0CASE;
CREATE TABLE Z0CASE(Z0_TEST0 SET('','ABC','12321','0'), Z0_TEST1 ENUM('','ABC','12321','0')) with column group (all columns, each column);
INSERT INTO  Z0CASE (z0_test0,z0_test1)VALUES('','');
INSERT INTO  Z0CASE (z0_test0,z0_test1)VALUES('ABC','ABC');
INSERT INTO  Z0CASE (z0_test0,z0_test1)VALUES('12321','12321');
INSERT INTO  Z0CASE (z0_test0,z0_test1)VALUES('0','0');
INSERT INTO  Z0CASE (z0_test0,z0_test1)VALUES(NULL,NULL);
SELECT * FROM Z0CASE ORDER BY Z0_TEST1;
Z0_TEST0	Z0_TEST1
NULL	NULL
	
ABC	ABC
12321	12321
0	0
SELECT table_id,table_name FROM oceanbase.__all_virtual_table WHERE table_name='Z0CASE';
ALTER TABLE Z0CASE MODIFY COLUMN Z0_TEST1 ENUM ('','ABC','12321','0','123','123213213') ;
SELECT Z0_TEST1 FROM Z0CASE ORDER BY Z0_TEST1;
Z0_TEST1
NULL

ABC
12321
0
DESC Z0CASE;
Field	Type	Null	Key	Default	Extra
Z0_TEST0	set('','ABC','12321','0')	YES		NULL	
Z0_TEST1	enum('','ABC','12321','0','123','123213213')	YES		NULL	
SELECT table_id,table_name FROM oceanbase.__all_virtual_table WHERE table_name='Z0CASE';
ALTER TABLE Z0CASE MODIFY COLUMN Z0_TEST0 SET ('','ABC','12321','0') ;
SELECT Z0_TEST0 FROM Z0CASE ORDER BY Z0_TEST1;
Z0_TEST0
NULL

ABC
12321
0
DESC Z0CASE;
Field	Type	Null	Key	Default	Extra
Z0_TEST0	set('','ABC','12321','0')	YES		NULL	
Z0_TEST1	enum('','ABC','12321','0','123','123213213')	YES		NULL	
SELECT table_id,table_name FROM oceanbase.__all_virtual_table WHERE table_name='Z0CASE';
ALTER TABLE Z0CASE MODIFY COLUMN Z0_TEST0 ENUM ('','ABC','12321','0') ;
SELECT Z0_TEST0 FROM Z0CASE ORDER BY Z0_TEST1;
Z0_TEST0
NULL

ABC
12321
0
DESC Z0CASE;
Field	Type	Null	Key	Default	Extra
Z0_TEST0	enum('','ABC','12321','0')	YES		NULL	
Z0_TEST1	enum('','ABC','12321','0','123','123213213')	YES		NULL	
SELECT table_id,table_name FROM oceanbase.__all_virtual_table WHERE table_name='Z0CASE';
ALTER TABLE Z0CASE MODIFY COLUMN Z0_TEST0 SET ('','ABC','12321','0','123') ;
SELECT Z0_TEST0 FROM Z0CASE ORDER BY Z0_TEST1;
Z0_TEST0
NULL

ABC
12321
0
DESC Z0CASE;
Field	Type	Null	Key	Default	Extra
Z0_TEST0	set('','ABC','12321','0','123')	YES		NULL	
Z0_TEST1	enum('','ABC','12321','0','123','123213213')	YES		NULL	
SELECT table_id,table_name FROM oceanbase.__all_virtual_table WHERE table_name='Z0CASE';
ALTER TABLE Z0CASE MODIFY COLUMN Z0_TEST1 ENUM ('','ABC','12321','0');
SELECT Z0_TEST1 FROM Z0CASE ORDER BY Z0_TEST1;
Z0_TEST1
NULL

ABC
12321
0
DESC Z0CASE;
Field	Type	Null	Key	Default	Extra
Z0_TEST0	set('','ABC','12321','0','123')	YES		NULL	
Z0_TEST1	enum('','ABC','12321','0')	YES		NULL	
SELECT table_id,table_name FROM oceanbase.__all_virtual_table WHERE table_name='Z0CASE';
ALTER TABLE Z0CASE MODIFY COLUMN Z0_TEST1 SET ('','ABC','12321','0');
SELECT Z0_TEST1 FROM Z0CASE ORDER BY Z0_TEST1;
Z0_TEST1
NULL

ABC
12321
0
DESC Z0CASE;
Field	Type	Null	Key	Default	Extra
Z0_TEST0	set('','ABC','12321','0','123')	YES		NULL	
Z0_TEST1	set('','ABC','12321','0')	YES		NULL	
SELECT table_id,table_name FROM oceanbase.__all_virtual_table WHERE table_name='Z0CASE';
ALTER TABLE Z0CASE MODIFY COLUMN Z0_TEST1 ENUM ('','ABC','12321','0','123');
SELECT Z0_TEST1 FROM Z0CASE ORDER BY Z0_TEST1;
Z0_TEST1
NULL

ABC
12321
0
DESC Z0CASE;
Field	Type	Null	Key	Default	Extra
Z0_TEST0	set('','ABC','12321','0','123')	YES		NULL	
Z0_TEST1	enum('','ABC','12321','0','123')	YES		NULL	
SELECT table_id,table_name FROM oceanbase.__all_virtual_table WHERE table_name='Z0CASE';
SET/ENUM --> CHAR/VARCHAR
DROP TABLE Z0CASE;
CREATE TABLE Z0CASE(Z0_TEST0 SET('','ABC','12321','0'), Z0_TEST1 ENUM('','ABC','12321','0')) with column group (all columns, each column);
INSERT INTO  Z0CASE (z0_test0,z0_test1)VALUES('','');
INSERT INTO  Z0CASE (z0_test0,z0_test1)VALUES('ABC','ABC');
INSERT INTO  Z0CASE (z0_test0,z0_test1)VALUES('12321','12321');
INSERT INTO  Z0CASE (z0_test0,z0_test1)VALUES('0','0');
INSERT INTO  Z0CASE (z0_test0,z0_test1)VALUES(NULL,NULL);
SELECT * FROM Z0CASE ORDER BY Z0_TEST1;
Z0_TEST0	Z0_TEST1
NULL	NULL
	
ABC	ABC
12321	12321
0	0
SELECT table_id,table_name FROM oceanbase.__all_virtual_table WHERE table_name='Z0CASE';
ALTER TABLE Z0CASE MODIFY COLUMN z0_test0 CHAR(100) ;
SELECT Z0_TEST0 FROM Z0CASE ORDER BY Z0_TEST1;
Z0_TEST0
NULL

ABC
12321
0
DESC Z0CASE;
Field	Type	Null	Key	Default	Extra
z0_test0	char(100)	YES		NULL	
Z0_TEST1	enum('','ABC','12321','0')	YES		NULL	
SELECT table_id,table_name FROM oceanbase.__all_virtual_table WHERE table_name='Z0CASE';
ALTER TABLE Z0CASE MODIFY COLUMN Z0_TEST1 CHAR(100) ;
SELECT Z0_TEST1 FROM Z0CASE ORDER BY Z0_TEST1;
Z0_TEST1
NULL

0
12321
ABC
DESC Z0CASE;
Field	Type	Null	Key	Default	Extra
z0_test0	char(100)	YES		NULL	
Z0_TEST1	char(100)	YES		NULL	
SELECT table_id,table_name FROM oceanbase.__all_virtual_table WHERE table_name='Z0CASE';
DROP TABLE Z0CASE;
CREATE TABLE Z0CASE(Z0_TEST0 SET('','ABC','12321','0'), Z0_TEST1 ENUM('','ABC','12321','0')) with column group (all columns, each column);
INSERT INTO  Z0CASE (z0_test0,z0_test1)VALUES('','');
INSERT INTO  Z0CASE (z0_test0,z0_test1)VALUES('ABC','ABC');
INSERT INTO  Z0CASE (z0_test0,z0_test1)VALUES('12321','12321');
INSERT INTO  Z0CASE (z0_test0,z0_test1)VALUES('0','0');
INSERT INTO  Z0CASE (z0_test0,z0_test1)VALUES(NULL,NULL);
SELECT * FROM Z0CASE ORDER BY Z0_TEST1;
Z0_TEST0	Z0_TEST1
NULL	NULL
	
ABC	ABC
12321	12321
0	0
SELECT table_id,table_name FROM oceanbase.__all_virtual_table WHERE table_name='Z0CASE';
ALTER TABLE Z0CASE MODIFY COLUMN z0_test0 VARCHAR(100) ;
SELECT Z0_TEST0 FROM Z0CASE ORDER BY Z0_TEST1;
Z0_TEST0
NULL

ABC
12321
0
DESC Z0CASE;
Field	Type	Null	Key	Default	Extra
z0_test0	varchar(100)	YES		NULL	
Z0_TEST1	enum('','ABC','12321','0')	YES		NULL	
SELECT table_id,table_name FROM oceanbase.__all_virtual_table WHERE table_name='Z0CASE';
ALTER TABLE Z0CASE MODIFY COLUMN Z0_TEST1 VARCHAR(100) ;
SELECT Z0_TEST1 FROM Z0CASE ORDER BY Z0_TEST1;
Z0_TEST1
NULL

0
12321
ABC
DESC Z0CASE;
Field	Type	Null	Key	Default	Extra
z0_test0	varchar(100)	YES		NULL	
Z0_TEST1	varchar(100)	YES		NULL	
SELECT table_id,table_name FROM oceanbase.__all_virtual_table WHERE table_name='Z0CASE';
DROP TABLE Z0CASE;
CREATE TABLE Z0CASE(Z0_TEST0 SET('','ABC','12321','0'), Z0_TEST1 ENUM('','ABC','12321','0')) with column group (all columns, each column);
INSERT INTO  Z0CASE (z0_test0,z0_test1)VALUES('','');
INSERT INTO  Z0CASE (z0_test0,z0_test1)VALUES('ABC','ABC');
INSERT INTO  Z0CASE (z0_test0,z0_test1)VALUES('12321','12321');
INSERT INTO  Z0CASE (z0_test0,z0_test1)VALUES('0','0');
INSERT INTO  Z0CASE (z0_test0,z0_test1)VALUES(NULL,NULL);
SELECT * FROM Z0CASE ORDER BY Z0_TEST1;
Z0_TEST0	Z0_TEST1
NULL	NULL
	
ABC	ABC
12321	12321
0	0
SELECT table_id,table_name FROM oceanbase.__all_virtual_table WHERE table_name='Z0CASE';
ALTER TABLE Z0CASE MODIFY COLUMN z0_test0 BLOB;
SELECT Z0_TEST0 FROM Z0CASE ORDER BY Z0_TEST1;
Z0_TEST0
NULL

ABC
12321
0
DESC Z0CASE;
Field	Type	Null	Key	Default	Extra
z0_test0	blob	YES		NULL	
Z0_TEST1	enum('','ABC','12321','0')	YES		NULL	
SELECT table_id,table_name FROM oceanbase.__all_virtual_table WHERE table_name='Z0CASE';
DROP TABLE Z0CASE;
CREATE TABLE Z0CASE(Z0_TEST0 SET('','ABC','12321','0'), Z0_TEST1 ENUM('','ABC','12321','0')) with column group (all columns, each column);
INSERT INTO  Z0CASE (z0_test0,z0_test1)VALUES('','');
INSERT INTO  Z0CASE (z0_test0,z0_test1)VALUES('ABC','ABC');
INSERT INTO  Z0CASE (z0_test0,z0_test1)VALUES('12321','12321');
INSERT INTO  Z0CASE (z0_test0,z0_test1)VALUES('0','0');
INSERT INTO  Z0CASE (z0_test0,z0_test1)VALUES(NULL,NULL);
SELECT * FROM Z0CASE ORDER BY Z0_TEST1;
Z0_TEST0	Z0_TEST1
NULL	NULL
	
ABC	ABC
12321	12321
0	0
SELECT table_id,table_name FROM oceanbase.__all_virtual_table WHERE table_name='Z0CASE';
ALTER TABLE Z0CASE MODIFY COLUMN z0_test0 text;
SELECT Z0_TEST0 FROM Z0CASE ORDER BY Z0_TEST1;
Z0_TEST0
NULL

ABC
12321
0
DESC Z0CASE;
Field	Type	Null	Key	Default	Extra
z0_test0	text	YES		NULL	
Z0_TEST1	enum('','ABC','12321','0')	YES		NULL	
SELECT table_id,table_name FROM oceanbase.__all_virtual_table WHERE table_name='Z0CASE';
SET/ENUM --> INT/FLOAT
DROP TABLE Z0CASE;
CREATE TABLE Z0CASE(Z0_TEST0 SET('','ABC','12321','0'), Z0_TEST1 ENUM('','ABC','12321','0')) with column group (all columns, each column);
INSERT INTO  Z0CASE (z0_test0,z0_test1)VALUES('','');
INSERT INTO  Z0CASE (z0_test0,z0_test1)VALUES('ABC','ABC');
INSERT INTO  Z0CASE (z0_test0,z0_test1)VALUES('12321','12321');
INSERT INTO  Z0CASE (z0_test0,z0_test1)VALUES('0','0');
INSERT INTO  Z0CASE (z0_test0,z0_test1)VALUES(NULL,NULL);
SELECT * FROM Z0CASE ORDER BY Z0_TEST1;
Z0_TEST0	Z0_TEST1
NULL	NULL
	
ABC	ABC
12321	12321
0	0
SELECT table_id,table_name FROM oceanbase.__all_virtual_table WHERE table_name='Z0CASE';
ALTER TABLE Z0CASE MODIFY COLUMN z0_test0 INT;
SELECT Z0_TEST0 FROM Z0CASE ORDER BY Z0_TEST1;
Z0_TEST0
NULL
0
2
4
8
DESC Z0CASE;
Field	Type	Null	Key	Default	Extra
z0_test0	int(11)	YES		NULL	
Z0_TEST1	enum('','ABC','12321','0')	YES		NULL	
SELECT table_id,table_name FROM oceanbase.__all_virtual_table WHERE table_name='Z0CASE';
ALTER TABLE Z0CASE MODIFY COLUMN Z0_TEST1 INT;
SELECT Z0_TEST1 FROM Z0CASE ORDER BY Z0_TEST1;
Z0_TEST1
NULL
1
2
3
4
DESC Z0CASE;
Field	Type	Null	Key	Default	Extra
z0_test0	int(11)	YES		NULL	
Z0_TEST1	int(11)	YES		NULL	
SELECT table_id,table_name FROM oceanbase.__all_virtual_table WHERE table_name='Z0CASE';
DROP TABLE Z0CASE;
CREATE TABLE Z0CASE(Z0_TEST0 SET('','ABC','12321','0'), Z0_TEST1 ENUM('','ABC','12321','0')) with column group (all columns, each column);
INSERT INTO  Z0CASE (z0_test0,z0_test1)VALUES('','');
INSERT INTO  Z0CASE (z0_test0,z0_test1)VALUES('ABC','ABC');
INSERT INTO  Z0CASE (z0_test0,z0_test1)VALUES('12321','12321');
INSERT INTO  Z0CASE (z0_test0,z0_test1)VALUES('0','0');
INSERT INTO  Z0CASE (z0_test0,z0_test1)VALUES(NULL,NULL);
SELECT * FROM Z0CASE ORDER BY Z0_TEST1;
Z0_TEST0	Z0_TEST1
NULL	NULL
	
ABC	ABC
12321	12321
0	0
SELECT table_id,table_name FROM oceanbase.__all_virtual_table WHERE table_name='Z0CASE';
ALTER TABLE Z0CASE MODIFY COLUMN z0_test0 FLOAT;
SELECT * FROM Z0CASE ORDER BY Z0_TEST1;
z0_test0	Z0_TEST1
NULL	NULL
0	
2	ABC
4	12321
8	0
DESC Z0CASE;
Field	Type	Null	Key	Default	Extra
z0_test0	float	YES		NULL	
Z0_TEST1	enum('','ABC','12321','0')	YES		NULL	
SELECT table_id,table_name FROM oceanbase.__all_virtual_table WHERE table_name='Z0CASE';
ALTER TABLE Z0CASE MODIFY COLUMN Z0_TEST1 FLOAT;
SELECT * FROM Z0CASE ORDER BY Z0_TEST1;
z0_test0	Z0_TEST1
NULL	NULL
0	1
2	2
4	3
8	4
DESC Z0CASE;
Field	Type	Null	Key	Default	Extra
z0_test0	float	YES		NULL	
Z0_TEST1	float	YES		NULL	
SELECT table_id,table_name FROM oceanbase.__all_virtual_table WHERE table_name='Z0CASE';
DROP TABLE Z0CASE;
CREATE TABLE Z0CASE(Z0_TEST0 SET('2011-11-11 11:11:11','11:11:11','12321','0','2011-11-21 11:11:11'), Z0_TEST1 ENUM('2011-11-11 11:11:11','11:11:11','12321','0','2011-11-21 11:11:11')) with column group (all columns, each column);
INSERT INTO  Z0CASE (z0_test0,z0_test1)VALUES('11:11:11 ','11:11:11 ');
INSERT INTO  Z0CASE (z0_test0,z0_test1)VALUES('2011-11-21 11:11:11','2011-11-21 11:11:11');
INSERT INTO  Z0CASE (z0_test0,z0_test1)VALUES('2011-11-11 11:11:11','2011-11-11 11:11:11');
INSERT INTO  Z0CASE (z0_test0,z0_test1)VALUES(NULL,NULL);
SELECT * FROM Z0CASE ORDER BY Z0_TEST1;
Z0_TEST0	Z0_TEST1
NULL	NULL
2011-11-11 11:11:11	2011-11-11 11:11:11
11:11:11	11:11:11
2011-11-21 11:11:11	2011-11-21 11:11:11
SELECT table_id,table_name FROM oceanbase.__all_virtual_table WHERE table_name='Z0CASE';
ALTER TABLE Z0CASE MODIFY COLUMN z0_test0 DATE ;
SELECT * FROM Z0CASE ORDER BY Z0_TEST1;
z0_test0	Z0_TEST1
NULL	NULL
2011-11-11	2011-11-11 11:11:11
2011-11-11	11:11:11
2011-11-21	2011-11-21 11:11:11
DESC Z0CASE;
Field	Type	Null	Key	Default	Extra
z0_test0	date	YES		NULL	
Z0_TEST1	enum('2011-11-11 11:11:11','11:11:11','12321','0','2011-11-21 11:11:11')	YES		NULL	
SELECT table_id,table_name FROM oceanbase.__all_virtual_table WHERE table_name='Z0CASE';
ALTER TABLE Z0CASE MODIFY COLUMN Z0_TEST1 DATE ;
DESC Z0CASE;
Field	Type	Null	Key	Default	Extra
z0_test0	date	YES		NULL	
Z0_TEST1	date	YES		NULL	
SELECT table_id,table_name FROM oceanbase.__all_virtual_table WHERE table_name='Z0CASE';
DROP TABLE Z0CASE;
CREATE TABLE Z0CASE(Z0_TEST0 SET('2011-11-11 11:11:11','11:11:11','12321','0','2011-11-11'), Z0_TEST1 ENUM('2011-11-11 11:11:11','11:11:11','12321','0','2011-11-11')) with column group (all columns, each column);
INSERT INTO  Z0CASE (z0_test0,z0_test1)VALUES('11:11:11 ','11:11:11 ');
INSERT INTO  Z0CASE (z0_test0,z0_test1)VALUES('2011-11-11 ','2011-11-11 ');
INSERT INTO  Z0CASE (z0_test0,z0_test1)VALUES('2011-11-11 11:11:11','2011-11-11 11:11:11');
INSERT INTO  Z0CASE (z0_test0,z0_test1)VALUES(NULL,NULL);
SELECT * FROM Z0CASE ORDER BY Z0_TEST1;
Z0_TEST0	Z0_TEST1
NULL	NULL
2011-11-11 11:11:11	2011-11-11 11:11:11
11:11:11	11:11:11
2011-11-11	2011-11-11
SELECT table_id,table_name FROM oceanbase.__all_virtual_table WHERE table_name='Z0CASE';
ALTER TABLE Z0CASE MODIFY COLUMN z0_test1 DATETIME;
SELECT * FROM Z0CASE ORDER BY Z0_TEST1;
Z0_TEST0	z0_test1
NULL	NULL
11:11:11	2011-11-11 00:00:00
2011-11-11	2011-11-11 00:00:00
2011-11-11 11:11:11	2011-11-11 11:11:11
DESC Z0CASE;
Field	Type	Null	Key	Default	Extra
Z0_TEST0	set('2011-11-11 11:11:11','11:11:11','12321','0','2011-11-11')	YES		NULL	
z0_test1	datetime	YES		NULL	
SELECT table_id,table_name FROM oceanbase.__all_virtual_table WHERE table_name='Z0CASE';
ALTER TABLE Z0CASE MODIFY COLUMN Z0_TEST0 TIMESTAMP ;
SELECT * FROM Z0CASE ORDER BY Z0_TEST1;
Z0_TEST0	z0_test1
NULL	NULL
2011-11-11 00:00:00	2011-11-11 00:00:00
2011-11-11 00:00:00	2011-11-11 00:00:00
2011-11-11 11:11:11	2011-11-11 11:11:11
DESC Z0CASE;
Field	Type	Null	Key	Default	Extra
Z0_TEST0	timestamp	YES		NULL	
z0_test1	datetime	YES		NULL	
SELECT table_id,table_name FROM oceanbase.__all_virtual_table WHERE table_name='Z0CASE';
DROP TABLE Z0CASE;
CREATE TABLE Z0CASE(Z0_TEST0 SET('2011-11-11 11:11:11','11:11:11','12321','0','2011-11-11'), Z0_TEST1 ENUM('2011-11-11 11:11:11','11:11:11','12321','0','2011-11-11')) with column group (all columns, each column);
INSERT INTO  Z0CASE (z0_test0,z0_test1)VALUES('11:11:11 ','11:11:11 ');
INSERT INTO  Z0CASE (z0_test0,z0_test1)VALUES('2011-11-11 ','2011-11-11 ');
INSERT INTO  Z0CASE (z0_test0,z0_test1)VALUES('2011-11-11 11:11:11','2011-11-11 11:11:11');
INSERT INTO  Z0CASE (z0_test0,z0_test1)VALUES(NULL,NULL);
SELECT * FROM Z0CASE ORDER BY Z0_TEST1;
Z0_TEST0	Z0_TEST1
NULL	NULL
2011-11-11 11:11:11	2011-11-11 11:11:11
11:11:11	11:11:11
2011-11-11	2011-11-11
SELECT table_id,table_name FROM oceanbase.__all_virtual_table WHERE table_name='Z0CASE';
ALTER TABLE Z0CASE MODIFY COLUMN z0_test0 TIME;
SELECT * FROM Z0CASE ORDER BY Z0_TEST1;
z0_test0	Z0_TEST1
NULL	NULL
11:11:11	2011-11-11 11:11:11
11:11:11	11:11:11
00:20:11	2011-11-11
DESC Z0CASE;
Field	Type	Null	Key	Default	Extra
z0_test0	time	YES		NULL	
Z0_TEST1	enum('2011-11-11 11:11:11','11:11:11','12321','0','2011-11-11')	YES		NULL	
SELECT table_id,table_name FROM oceanbase.__all_virtual_table WHERE table_name='Z0CASE';
DROP TABLE Z0CASE;
SET sql_mode='STRICT_TRANS_TABLES,STRICT_ALL_TABLES';
