SET sql_mode='';

DROP TABLE IF EXISTS Z0CASE;
text
CREATE TABLE Z0CASE (Z0_TEST0 TINYTEXT,Z0_TEST1 text) with column group (all columns, each column);
INSERT INTO  Z0CASE (Z0_TEST0,Z0_TEST1)VALUES('1','111');
INSERT INTO  Z0CASE (Z0_TEST0,Z0_TEST1)VALUES('2','2');
INSERT INTO  Z0CASE (Z0_TEST0,Z0_TEST1)VALUES('30','30');
INSERT INTO  Z0CASE (Z0_TEST0,Z0_TEST1)VALUES('111','121');
ALTER TABLE Z0CASE PARTITION BY RANGE (Z0_TEST0)
( PARTITION part_1 VALUES LESS THAN (20 ),
PARTITION part_2 VALUES LESS THAN (100 ),
PARTITION part_3 VALUES LESS THAN ( MAXVALUE ));
ERROR HY000: Field 'Z0_TEST0' is of a not allowed type for this type of partitioning
UPDATE Z0CASE SET Z0_TEST0='1' WHERE Z0_TEST1='2';
INSERT INTO  Z0CASE (Z0_TEST0,Z0_TEST1)VALUES(null,null);
ALTER TABLE Z0CASE PARTITION BY KEY(Z0_TEST0) PARTITIONS 3;
ERROR HY000: Field 'Z0_TEST0' is of a not allowed type for this type of partitioning
ALTER TABLE Z0CASE PARTITION BY HASH(Z0_TEST0)   
(PARTITION part_1,PARTITION part_2);
ERROR HY000: Field 'Z0_TEST0' is of a not allowed type for this type of partitioning
DROP TABLE Z0CASE;
CREATE TABLE Z0CASE (Z0_TEST0 TINYTEXT,Z0_TEST1 text) with column group (all columns, each column);
INSERT INTO  Z0CASE (Z0_TEST0,Z0_TEST1)VALUES('bca','111');
INSERT INTO  Z0CASE (Z0_TEST0,Z0_TEST1)VALUES('abc','2');
INSERT INTO  Z0CASE (Z0_TEST0,Z0_TEST1)VALUES('ABC','30');
INSERT INTO  Z0CASE (Z0_TEST0,Z0_TEST1)VALUES('cba','111');
ALTER TABLE Z0CASE PARTITION BY LIST (Z0_TEST0)
( PARTITION part_1 VALUES IN ( 'abc', 'ABC' ),
PARTITION part_2 VALUES IN ( 'cba', 'bca' ));
ERROR HY000: Field 'Z0_TEST0' is of a not allowed type for this type of partitioning
DROP TABLE Z0CASE;
CREATE TABLE Z0CASE (Z0_TEST0 TINYTEXT,Z0_TEST1 text) with column group (all columns, each column);
INSERT INTO  Z0CASE (Z0_TEST0,Z0_TEST1)VALUES('1','111');
INSERT INTO  Z0CASE (Z0_TEST0,Z0_TEST1)VALUES('2','2');
INSERT INTO  Z0CASE (Z0_TEST0,Z0_TEST1)VALUES('30','30');
INSERT INTO  Z0CASE (Z0_TEST0,Z0_TEST1)VALUES('111','121');
ALTER TABLE Z0CASE
PARTITION BY KEY(Z0_TEST0) SUBPARTITION BY KEY(Z0_TEST0)  PARTITIONS 2;
ERROR HY000: Field 'Z0_TEST0' is of a not allowed type for this type of partitioning
set
DROP TABLE Z0CASE;
CREATE TABLE Z0CASE (Z0_TEST0 set('1','2','30','111'),Z0_TEST1 enum('1','2','30','111')) with column group (all columns, each column);
INSERT INTO  Z0CASE (Z0_TEST0,Z0_TEST1)VALUES('1','111');
INSERT INTO  Z0CASE (Z0_TEST0,Z0_TEST1)VALUES('2','2');
INSERT INTO  Z0CASE (Z0_TEST0,Z0_TEST1)VALUES('30','30');
INSERT INTO  Z0CASE (Z0_TEST0,Z0_TEST1)VALUES('111','121');
SELECT table_id,table_name FROM oceanbase.__all_virtual_table WHERE table_name='Z0CASE';
ALTER TABLE Z0CASE PARTITION BY RANGE (Z0_TEST0)
( PARTITION part_1 VALUES LESS THAN (20 ),
PARTITION part_2 VALUES LESS THAN (100 ),
PARTITION part_3 VALUES LESS THAN ( MAXVALUE ));
ERROR HY000: Field 'Z0_TEST0' is of a not allowed type for this type of partitioning
ALTER TABLE Z0CASE PARTITION BY KEY(Z0_TEST0) PARTITIONS 3;
SELECT PARTITION_NAME,TABLE_ROWS,PARTITION_DESCRIPTION FROM INFORMATION_SCHEMA.PARTITIONS WHERE TABLE_SCHEMA=SCHEMA() AND TABLE_NAME = 'Z0CASE' ORDER BY PARTITION_NAME;
PARTITION_NAME	TABLE_ROWS	PARTITION_DESCRIPTION
p0	NULL	NULL
p1	NULL	NULL
p2	NULL	NULL
SELECT table_id,table_name FROM oceanbase.__all_virtual_table WHERE table_name='Z0CASE';
DROP TABLE Z0CASE;
CREATE TABLE Z0CASE (Z0_TEST0 set('1','2','30','111'),Z0_TEST1 enum('1','2','30','111')) with column group (all columns, each column);
INSERT INTO  Z0CASE (Z0_TEST0,Z0_TEST1)VALUES('1','111');
INSERT INTO  Z0CASE (Z0_TEST0,Z0_TEST1)VALUES('2','2');
INSERT INTO  Z0CASE (Z0_TEST0,Z0_TEST1)VALUES('30','30');
INSERT INTO  Z0CASE (Z0_TEST0,Z0_TEST1)VALUES('111','111');
ALTER TABLE Z0CASE PARTITION BY HASH(Z0_TEST0)   
(PARTITION part_1,  PARTITION part_2);
ERROR HY000: Field 'Z0_TEST0' is of a not allowed type for this type of partitioning
ALTER TABLE Z0CASE PARTITION BY LIST (Z0_TEST0)
( PARTITION part_1 VALUES IN ( 'abc', 'ABC' ),
PARTITION part_2 VALUES IN ( 'cba', 'bca' ));
ERROR HY000: Field 'Z0_TEST0' is of a not allowed type for this type of partitioning
ALTER TABLE Z0CASE PARTITION BY LIST(Z0_TEST0)
SUBPARTITION BY RANGE(Z0_TEST0) SUBPARTITION template
(SUBPARTITION sp0 VALUES LESS THAN(100),
SUBPARTITION sp1 VALUES LESS THAN(200),
SUBPARTITION sp2 VALUES LESS THAN(MAXVALUE) )
(PARTITION part_1 VALUES IN ( 1, 2 ),
PARTITION part_2 VALUES IN ( 3, 4 ));
ERROR HY000: Field 'Z0_TEST0' is of a not allowed type for this type of partitioning
FLOAT
DROP TABLE Z0CASE;
CREATE TABLE Z0CASE (Z0_TEST0 FLOAT(10,0),Z0_TEST1 BIGINT) with column group (all columns, each column);
INSERT INTO  Z0CASE (Z0_TEST0,Z0_TEST1)VALUES('-1.00','-111');
INSERT INTO  Z0CASE (Z0_TEST0,Z0_TEST1)VALUES('1.00','111');
INSERT INTO  Z0CASE (Z0_TEST0,Z0_TEST1)VALUES('2.22','2');
INSERT INTO  Z0CASE (Z0_TEST0,Z0_TEST1)VALUES('30','30');
INSERT INTO  Z0CASE (Z0_TEST0,Z0_TEST1)VALUES('111','111');
SELECT table_id,table_name FROM oceanbase.__all_virtual_table WHERE table_name='Z0CASE';
ALTER TABLE Z0CASE PARTITION BY RANGE (Z0_TEST0)
( PARTITION part_1 VALUES LESS THAN (20 ),
PARTITION part_2 VALUES LESS THAN (100 ),
PARTITION part_3 VALUES LESS THAN (MAXVALUE));
ERROR HY000: Field 'Z0_TEST0' is of a not allowed type for this type of partitioning
ALTER TABLE Z0CASE PARTITION BY KEY(Z0_TEST0) PARTITIONS 3;
SELECT PARTITION_NAME,TABLE_ROWS,PARTITION_DESCRIPTION FROM INFORMATION_SCHEMA.PARTITIONS WHERE TABLE_SCHEMA=SCHEMA() AND TABLE_NAME = 'Z0CASE' ORDER BY PARTITION_NAME;
PARTITION_NAME	TABLE_ROWS	PARTITION_DESCRIPTION
p0	NULL	NULL
p1	NULL	NULL
p2	NULL	NULL
SELECT table_id,table_name FROM oceanbase.__all_virtual_table WHERE table_name='Z0CASE';
DROP TABLE Z0CASE;
CREATE TABLE Z0CASE (Z0_TEST0 FLOAT(10,0),Z0_TEST1 BIGINT) with column group (all columns, each column);
INSERT INTO  Z0CASE (Z0_TEST0,Z0_TEST1)VALUES('-1.00','-111');
INSERT INTO  Z0CASE (Z0_TEST0,Z0_TEST1)VALUES('1.00','111');
INSERT INTO  Z0CASE (Z0_TEST0,Z0_TEST1)VALUES('2.22','2');
INSERT INTO  Z0CASE (Z0_TEST0,Z0_TEST1)VALUES('30','30');
INSERT INTO  Z0CASE (Z0_TEST0,Z0_TEST1)VALUES('111','111');
SELECT table_id,table_name FROM oceanbase.__all_virtual_table WHERE table_name='Z0CASE';
ALTER TABLE Z0CASE PARTITION BY HASH(Z0_TEST0)  (PARTITION part_1,  PARTITION part_2);
ERROR HY000: Field 'Z0_TEST0' is of a not allowed type for this type of partitioning
ALTER TABLE Z0CASE PARTITION BY LIST (Z0_TEST0)
( PARTITION part_1 VALUES IN ( 'abc', 'ABC' ),
PARTITION part_2 VALUES IN ( 'cba', 'bca' ));
ERROR HY000: Field 'Z0_TEST0' is of a not allowed type for this type of partitioning
ALTER TABLE Z0CASE PARTITION BY LIST(Z0_TEST0)
SUBPARTITION BY RANGE(Z0_TEST0) SUBPARTITION template
(SUBPARTITION sp0 VALUES LESS THAN(100),
SUBPARTITION sp1 VALUES LESS THAN(200),
SUBPARTITION sp2 VALUES LESS THAN(MAXVALUE) )
(PARTITION part_1 VALUES IN ( 1, 2 ),
PARTITION part_2 VALUES IN ( 3, 4 ));
ERROR HY000: Field 'Z0_TEST0' is of a not allowed type for this type of partitioning
ALTER TABLE Z0CASE
PARTITION BY KEY(Z0_TEST0) SUBPARTITION BY KEY(Z0_TEST0)  PARTITIONS 2;
SELECT PARTITION_NAME,TABLE_ROWS,PARTITION_DESCRIPTION FROM INFORMATION_SCHEMA.PARTITIONS WHERE TABLE_SCHEMA=SCHEMA() AND TABLE_NAME = 'Z0CASE' ORDER BY PARTITION_NAME;
PARTITION_NAME	TABLE_ROWS	PARTITION_DESCRIPTION
p0	NULL	NULL
p1	NULL	NULL
SELECT table_id,table_name FROM oceanbase.__all_virtual_table WHERE table_name='Z0CASE';
ALTER TABLE Z0CASE PARTITION BY LIST(Z0_TEST0)
SUBPARTITION BY RANGE(Z0_TEST0) SUBPARTITION template
(SUBPARTITION sp0 VALUES LESS THAN(100),
SUBPARTITION sp1 VALUES LESS THAN(200),
SUBPARTITION sp2 VALUES LESS THAN(MAXVALUE) ) (
PARTITION part_1 VALUES IN ( 1, 2 ),
PARTITION part_2 VALUES IN ( 3, 4 ));
ERROR HY000: Field 'Z0_TEST0' is of a not allowed type for this type of partitioning
DATE
DROP TABLE Z0CASE;
CREATE TABLE Z0CASE (Z0_TEST0 DATE,Z0_TEST1 BIGINT) with column group (all columns, each column);
INSERT INTO  Z0CASE (Z0_TEST0,Z0_TEST1)VALUES('2011-11-11 11:11:11','111');
INSERT INTO  Z0CASE (Z0_TEST0,Z0_TEST1)VALUES('2012-12-11 11:11:11','111');
SELECT table_id,table_name FROM oceanbase.__all_virtual_table WHERE table_name='Z0CASE';
ALTER TABLE Z0CASE PARTITION BY RANGE (Z0_TEST0)
(PARTITION part_1 VALUES LESS THAN (20 ),
PARTITION part_2 VALUES LESS THAN (100 ),
PARTITION part_3 VALUES LESS THAN ( MAXVALUE ));
ERROR HY000: Field 'Z0_TEST0' is of a not allowed type for this type of partitioning
ALTER TABLE Z0CASE PARTITION BY KEY(Z0_TEST0) PARTITIONS 3;
SELECT PARTITION_NAME,TABLE_ROWS,PARTITION_DESCRIPTION FROM INFORMATION_SCHEMA.PARTITIONS WHERE TABLE_SCHEMA=SCHEMA() AND TABLE_NAME = 'Z0CASE' ORDER BY PARTITION_NAME;
PARTITION_NAME	TABLE_ROWS	PARTITION_DESCRIPTION
p0	NULL	NULL
p1	NULL	NULL
p2	NULL	NULL
SELECT table_id,table_name FROM oceanbase.__all_virtual_table WHERE table_name='Z0CASE';
DROP TABLE Z0CASE;
CREATE TABLE Z0CASE (Z0_TEST0 DATE,Z0_TEST1 BIGINT) with column group (all columns, each column);
INSERT INTO  Z0CASE (Z0_TEST0,Z0_TEST1)VALUES('2011-11-11 11:11:11','111');
INSERT INTO  Z0CASE (Z0_TEST0,Z0_TEST1)VALUES('2012-12-11 11:11:11','111');
ALTER TABLE Z0CASE PARTITION BY HASH(Z0_TEST0)  (PARTITION part_1,  PARTITION part_2);
ERROR HY000: Field 'Z0_TEST0' is of a not allowed type for this type of partitioning
ALTER TABLE Z0CASE PARTITION BY LIST (Z0_TEST0)
(PARTITION part_1 VALUES IN ( 'abc', 'ABC' ),
PARTITION part_2 VALUES IN ( 'cba', 'bca' ));
ERROR HY000: Field 'Z0_TEST0' is of a not allowed type for this type of partitioning
ALTER TABLE Z0CASE PARTITION BY LIST(Z0_TEST0)
SUBPARTITION BY RANGE(Z0_TEST0) SUBPARTITION template
(SUBPARTITION sp0 VALUES LESS THAN(100),
SUBPARTITION sp1 VALUES LESS THAN(200),
SUBPARTITION sp2 VALUES LESS THAN(MAXVALUE) )
(PARTITION part_1 VALUES IN ( 1, 2 ),
PARTITION part_2 VALUES IN ( 3, 4 ));
ERROR HY000: Field 'Z0_TEST0' is of a not allowed type for this type of partitioning
bit
DROP TABLE Z0CASE;
CREATE TABLE Z0CASE (Z0_TEST0 bit(64) not null  ,Z0_TEST1 INT) with column group (all columns, each column);
SELECT table_id,table_name FROM oceanbase.__all_virtual_table WHERE table_name='Z0CASE';
ALTER TABLE Z0CASE PARTITION BY RANGE (Z0_TEST0)
(PARTITION part_1 VALUES LESS THAN (0),
PARTITION part_2 VALUES LESS THAN (1),
PARTITION part_3 VALUES LESS THAN ( 2 ));
SELECT PARTITION_NAME,TABLE_ROWS,PARTITION_DESCRIPTION FROM INFORMATION_SCHEMA.PARTITIONS WHERE TABLE_SCHEMA=SCHEMA() AND TABLE_NAME = 'Z0CASE' ORDER BY PARTITION_NAME;
PARTITION_NAME	TABLE_ROWS	PARTITION_DESCRIPTION
part_1	NULL	b'0'
part_2	NULL	b'1'
part_3	NULL	b'10'
SELECT table_id,table_name FROM oceanbase.__all_virtual_table WHERE table_name='Z0CASE';
DROP TABLE Z0CASE;
CREATE TABLE Z0CASE (Z0_TEST0 bit(3) not null  ,Z0_TEST1 INT) with column group (all columns, each column);
INSERT INTO  Z0CASE (Z0_TEST0,Z0_TEST1)VALUES(1,'111');
SELECT table_id,table_name FROM oceanbase.__all_virtual_table WHERE table_name='Z0CASE';
ALTER TABLE Z0CASE PARTITION BY LIST (Z0_TEST0)
(PARTITION part_1 VALUES IN ( 001),
PARTITION part_2 VALUES IN (0));
SELECT PARTITION_NAME,TABLE_ROWS,PARTITION_DESCRIPTION FROM INFORMATION_SCHEMA.PARTITIONS WHERE TABLE_SCHEMA=SCHEMA() AND TABLE_NAME = 'Z0CASE' ORDER BY PARTITION_NAME;
PARTITION_NAME	TABLE_ROWS	PARTITION_DESCRIPTION
part_1	NULL	b'1'
part_2	NULL	b'0'
SELECT table_id,table_name FROM oceanbase.__all_virtual_table WHERE table_name='Z0CASE';
DROP TABLE Z0CASE;
CREATE TABLE Z0CASE (Z0_TEST0 bit(1) not null  ,Z0_TEST1 INT) with column group (all columns, each column);
INSERT INTO  Z0CASE (Z0_TEST0,Z0_TEST1)VALUES(1,'111');
SELECT table_id,table_name FROM oceanbase.__all_virtual_table WHERE table_name='Z0CASE';
ALTER TABLE Z0CASE PARTITION BY HASH(Z0_TEST0)  (PARTITION part_1,  PARTITION part_2);
SELECT PARTITION_NAME,TABLE_ROWS,PARTITION_DESCRIPTION FROM INFORMATION_SCHEMA.PARTITIONS WHERE TABLE_SCHEMA=SCHEMA() AND TABLE_NAME = 'Z0CASE' ORDER BY PARTITION_NAME;
PARTITION_NAME	TABLE_ROWS	PARTITION_DESCRIPTION
part_1	NULL	NULL
part_2	NULL	NULL
SELECT table_id,table_name FROM oceanbase.__all_virtual_table WHERE table_name='Z0CASE';
DROP TABLE Z0CASE;
CREATE TABLE Z0CASE (Z0_TEST0 bit(2),Z0_TEST1 INT) with column group (all columns, each column);
INSERT INTO  Z0CASE (Z0_TEST0,Z0_TEST1)VALUES(1,'111');
INSERT INTO  Z0CASE (Z0_TEST0,Z0_TEST1)VALUES(2,'111');
INSERT INTO  Z0CASE (Z0_TEST0,Z0_TEST1)VALUES(02,'111');
SELECT table_id,table_name FROM oceanbase.__all_virtual_table WHERE table_name='Z0CASE';
ALTER TABLE Z0CASE PARTITION BY KEY(Z0_TEST0)  (PARTITION part_1,  PARTITION part_2);
SELECT PARTITION_NAME,TABLE_ROWS,PARTITION_DESCRIPTION FROM INFORMATION_SCHEMA.PARTITIONS WHERE TABLE_SCHEMA=SCHEMA() AND TABLE_NAME = 'Z0CASE' ORDER BY PARTITION_NAME;
PARTITION_NAME	TABLE_ROWS	PARTITION_DESCRIPTION
part_1	NULL	NULL
part_2	NULL	NULL
SELECT table_id,table_name FROM oceanbase.__all_virtual_table WHERE table_name='Z0CASE';
生成列
DROP TABLE Z0CASE;
CREATE TABLE Z0CASE (Z0_TEST0 INT,Z0_TEST1 INT ,Z0_TEST2  INT as ( Z0_TEST0+Z0_TEST1 ))  with column group (all columns, each column);
INSERT INTO  Z0CASE (Z0_TEST0,Z0_TEST1)VALUES(1111,'111');
SELECT table_id,table_name FROM oceanbase.__all_virtual_table WHERE table_name='Z0CASE';
ALTER TABLE Z0CASE MODIFY COLUMN Z0_TEST0 CHAR(100);
DESC Z0CASE;
Field	Type	Null	Key	Default	Extra
Z0_TEST0	char(100)	YES		NULL	
Z0_TEST1	int(11)	YES		NULL	
Z0_TEST2	int(11)	YES		(`Z0_TEST0` + `Z0_TEST1`)	VIRTUAL GENERATED
SELECT * FROM Z0CASE;
Z0_TEST0	Z0_TEST1	Z0_TEST2
1111	111	1222
SELECT table_id,table_name FROM oceanbase.__all_virtual_table WHERE table_name='Z0CASE';
RANGE --> RANGE
DROP TABLE Z0CASE;
CREATE TABLE Z0CASE (Z0_TEST0 INT,Z0_TEST1 BIGINT )PARTITION BY RANGE (Z0_TEST0)
(PARTITION part_1 VALUES LESS THAN (20 ),
PARTITION part_2 VALUES LESS THAN (100 ),
PARTITION part_3 VALUES LESS THAN ( MAXVALUE )) with column group (all columns, each column);
INSERT INTO  Z0CASE (Z0_TEST0,Z0_TEST1)VALUES('-1.00','-111');
INSERT INTO  Z0CASE (Z0_TEST0,Z0_TEST1)VALUES('1.00','111');
INSERT INTO  Z0CASE (Z0_TEST0,Z0_TEST1)VALUES('2.22','2');
INSERT INTO  Z0CASE (Z0_TEST0,Z0_TEST1)VALUES('30','30');
INSERT INTO  Z0CASE (Z0_TEST0,Z0_TEST1)VALUES('111','111');
SELECT table_id,table_name FROM oceanbase.__all_virtual_table WHERE table_name='Z0CASE';
ALTER TABLE Z0CASE PARTITION BY RANGE (Z0_TEST0)
(PARTITION part_1 VALUES LESS THAN (190 ),
PARTITION part_2 VALUES LESS THAN (10 ));
ERROR HY000: VALUES LESS THAN value must be strictly increasing for each partition
ALTER TABLE Z0CASE PARTITION BY RANGE (Z0_TEST0)
(PARTITION part_1 VALUES LESS THAN (0 ),
PARTITION part_2 VALUES LESS THAN (0 ));
ERROR HY000: VALUES LESS THAN value must be strictly increasing for each partition
ALTER TABLE Z0CASE PARTITION BY RANGE (Z0_TEST0)
(PARTITION part_1 VALUES LESS THAN (0 ),
PARTITION part_2 VALUES LESS THAN (100 ));
ERROR HY000: Table has no partition for value
RANGE --> LIST
INT
ALTER TABLE Z0CASE PARTITION BY LIST (Z0_TEST0)
(PARTITION part_1 VALUES IN ( 1,3 ),
PARTITION part_2 VALUES IN ( 2, 4));
ERROR HY000: Table has no partition for value
ALTER TABLE Z0CASE PARTITION BY RANGE (Z0_TEST0)
(PARTITION part_1 VALUES LESS THAN (0 ),
PARTITION part_2 VALUES LESS THAN (999));
SELECT PARTITION_NAME,TABLE_ROWS,PARTITION_DESCRIPTION FROM INFORMATION_SCHEMA.PARTITIONS WHERE TABLE_SCHEMA=SCHEMA() AND TABLE_NAME = 'Z0CASE' ORDER BY PARTITION_NAME;
PARTITION_NAME	TABLE_ROWS	PARTITION_DESCRIPTION
part_1	NULL	0
part_2	NULL	999
SELECT table_id,table_name FROM oceanbase.__all_virtual_table WHERE table_name='Z0CASE';
RANGE --> KEY
DROP TABLE Z0CASE;
CREATE TABLE Z0CASE (Z0_TEST0 INT,Z0_TEST1 BIGINT )PARTITION BY RANGE (Z0_TEST0)
( PARTITION part_1 VALUES LESS THAN (20 ),
PARTITION part_2 VALUES LESS THAN (100 ),
PARTITION part_3 VALUES LESS THAN ( MAXVALUE )) with column group (all columns, each column);
INSERT INTO  Z0CASE (Z0_TEST0,Z0_TEST1)VALUES('-1.00','-111');
INSERT INTO  Z0CASE (Z0_TEST0,Z0_TEST1)VALUES('1.00','111');
INSERT INTO  Z0CASE (Z0_TEST0,Z0_TEST1)VALUES('2.22','2');
INSERT INTO  Z0CASE (Z0_TEST0,Z0_TEST1)VALUES('30','30');
INSERT INTO  Z0CASE (Z0_TEST0,Z0_TEST1)VALUES('111','111');
SELECT table_id,table_name FROM oceanbase.__all_virtual_table WHERE table_name='Z0CASE';
ALTER TABLE Z0CASE PARTITION BY KEY(Z0_TEST0) PARTITIONS 0;
ERROR HY000: Number of partitions = 0 is not an allowed value
ALTER TABLE Z0CASE PARTITION BY KEY(Z0_TEST0) PARTITIONS 1;
SELECT PARTITION_NAME,TABLE_ROWS,PARTITION_DESCRIPTION FROM INFORMATION_SCHEMA.PARTITIONS WHERE TABLE_SCHEMA=SCHEMA() AND TABLE_NAME = 'Z0CASE' ORDER BY PARTITION_NAME;
PARTITION_NAME	TABLE_ROWS	PARTITION_DESCRIPTION
p0	NULL	NULL
SELECT table_id,table_name FROM oceanbase.__all_virtual_table WHERE table_name='Z0CASE';
ALTER TABLE Z0CASE PARTITION BY KEY(Z0_TEST0) PARTITIONS 3;
SELECT PARTITION_NAME,TABLE_ROWS,PARTITION_DESCRIPTION FROM INFORMATION_SCHEMA.PARTITIONS WHERE TABLE_SCHEMA=SCHEMA() AND TABLE_NAME = 'Z0CASE' ORDER BY PARTITION_NAME;
PARTITION_NAME	TABLE_ROWS	PARTITION_DESCRIPTION
p0	NULL	NULL
p1	NULL	NULL
p2	NULL	NULL
SELECT table_id,table_name FROM oceanbase.__all_virtual_table WHERE table_name='Z0CASE';
RANGE --> HASH
DROP TABLE Z0CASE;
CREATE TABLE Z0CASE (Z0_TEST0 INT,Z0_TEST1 BIGINT )PARTITION BY RANGE (Z0_TEST0)
( PARTITION part_1 VALUES LESS THAN (20 ),
PARTITION part_2 VALUES LESS THAN (100 ),
PARTITION part_3 VALUES LESS THAN ( MAXVALUE ) ) with column group (all columns, each column);
INSERT INTO  Z0CASE (Z0_TEST0,Z0_TEST1)VALUES('-1.00','-111');
INSERT INTO  Z0CASE (Z0_TEST0,Z0_TEST1)VALUES('1.00','111');
INSERT INTO  Z0CASE (Z0_TEST0,Z0_TEST1)VALUES('2.22','2');
INSERT INTO  Z0CASE (Z0_TEST0,Z0_TEST1)VALUES('30','30');
INSERT INTO  Z0CASE (Z0_TEST0,Z0_TEST1)VALUES('111','111');
SELECT table_id,table_name FROM oceanbase.__all_virtual_table WHERE table_name='Z0CASE';
ALTER TABLE Z0CASE PARTITION BY HASH(Z0_TEST0)  (PARTITION part1,  PARTITION part2);
SELECT PARTITION_NAME,TABLE_ROWS,PARTITION_DESCRIPTION FROM INFORMATION_SCHEMA.PARTITIONS WHERE TABLE_SCHEMA=SCHEMA() AND TABLE_NAME = 'Z0CASE' ORDER BY PARTITION_NAME;
PARTITION_NAME	TABLE_ROWS	PARTITION_DESCRIPTION
part1	NULL	NULL
part2	NULL	NULL
SELECT table_id,table_name FROM oceanbase.__all_virtual_table WHERE table_name='Z0CASE';
RANGE --> SUBPARTITION
DROP TABLE Z0CASE;
CREATE TABLE Z0CASE (Z0_TEST0 INT,Z0_TEST1 BIGINT )PARTITION BY RANGE (Z0_TEST0)
( PARTITION part_1 VALUES LESS THAN (20 ),
PARTITION part_2 VALUES LESS THAN (100 ),
PARTITION part_3 VALUES LESS THAN ( MAXVALUE ) ) with column group (all columns, each column);
INSERT INTO  Z0CASE (Z0_TEST0,Z0_TEST1)VALUES('-1.00','-111');
INSERT INTO  Z0CASE (Z0_TEST0,Z0_TEST1)VALUES('1.00','111');
INSERT INTO  Z0CASE (Z0_TEST0,Z0_TEST1)VALUES('2.22','2');
INSERT INTO  Z0CASE (Z0_TEST0,Z0_TEST1)VALUES('30','30');
INSERT INTO  Z0CASE (Z0_TEST0,Z0_TEST1)VALUES('111','111');
SELECT table_id,table_name FROM oceanbase.__all_virtual_table WHERE table_name='Z0CASE';
ALTER TABLE Z0CASE  PARTITION BY LIST(Z0_TEST0)
SUBPARTITION BY RANGE(Z0_TEST0) SUBPARTITION template
( SUBPARTITION sp0 VALUES LESS THAN(10),
SUBPARTITION sp1 VALUES LESS THAN(20),
SUBPARTITION sp2 VALUES LESS THAN(100) )
( PARTITION part_1 VALUES IN (-1, 1,2 ),
PARTITION part_2 VALUES IN ( 30, 111 ));
ERROR HY000: Table has no partition for value
ALTER TABLE Z0CASE  PARTITION BY LIST(Z0_TEST0) 
SUBPARTITION BY RANGE(Z0_TEST0) SUBPARTITION template
( SUBPARTITION sp0 VALUES LESS THAN(10),
SUBPARTITION sp1 VALUES LESS THAN(20),
SUBPARTITION sp2 VALUES LESS THAN(MAXVALUE) )
( PARTITION part1 VALUES IN (-1, 1,2 ),
PARTITION part2 VALUES IN ( 30, 111 ) );
SELECT PARTITION_NAME,TABLE_ROWS,PARTITION_DESCRIPTION FROM INFORMATION_SCHEMA.PARTITIONS WHERE TABLE_SCHEMA=SCHEMA() AND TABLE_NAME = 'Z0CASE' ORDER BY PARTITION_NAME;
PARTITION_NAME	TABLE_ROWS	PARTITION_DESCRIPTION
part1	NULL	-1,1,2
part1	NULL	-1,1,2
part1	NULL	-1,1,2
part2	NULL	30,111
part2	NULL	30,111
part2	NULL	30,111
SELECT table_id,table_name FROM oceanbase.__all_virtual_table WHERE table_name='Z0CASE';
INSERT INTO  Z0CASE (Z0_TEST0,Z0_TEST1)VALUES('3','-111');
ERROR HY000: Table has no partition for value
INSERT INTO  Z0CASE (Z0_TEST0,Z0_TEST1)VALUES('31','-111');
ERROR HY000: Table has no partition for value
INSERT INTO  Z0CASE (Z0_TEST0,Z0_TEST1)VALUES('1.00','323');
SELECT * FROM Z0CASE ORDER BY Z0_TEST1;
Z0_TEST0	Z0_TEST1
-1	-111
2	2
30	30
1	111
111	111
1	323
SELECT PARTITION_NAME,TABLE_ROWS,PARTITION_DESCRIPTION FROM INFORMATION_SCHEMA.PARTITIONS WHERE TABLE_SCHEMA=SCHEMA() AND TABLE_NAME = 'Z0CASE' ORDER BY PARTITION_NAME;
PARTITION_NAME	TABLE_ROWS	PARTITION_DESCRIPTION
part1	NULL	-1,1,2
part1	NULL	-1,1,2
part1	NULL	-1,1,2
part2	NULL	30,111
part2	NULL	30,111
part2	NULL	30,111
UPDATE Z0CASE SET Z0_TEST0='0' WHERE Z0_TEST1='111';
ERROR HY000: Table has no partition for value
UPDATE Z0CASE SET Z0_TEST0='100' WHERE Z0_TEST1='111';
ERROR HY000: Table has no partition for value
UPDATE Z0CASE SET Z0_TEST0='30' WHERE Z0_TEST1='111';
UPDATE Z0CASE SET Z0_TEST0=2 WHERE Z0_TEST0=1;
SELECT * FROM Z0CASE ORDER BY Z0_TEST1;
Z0_TEST0	Z0_TEST1
-1	-111
2	2
30	30
30	111
30	111
2	323
SELECT PARTITION_NAME,TABLE_ROWS,PARTITION_DESCRIPTION FROM INFORMATION_SCHEMA.PARTITIONS WHERE TABLE_SCHEMA=SCHEMA() AND TABLE_NAME = 'Z0CASE' ORDER BY PARTITION_NAME;
PARTITION_NAME	TABLE_ROWS	PARTITION_DESCRIPTION
part1	NULL	-1,1,2
part1	NULL	-1,1,2
part1	NULL	-1,1,2
part2	NULL	30,111
part2	NULL	30,111
part2	NULL	30,111
DELETE FROM Z0CASE WHERE Z0_TEST1='111';
DELETE FROM Z0CASE WHERE Z0_TEST0=2;
SELECT * FROM Z0CASE ORDER BY Z0_TEST1;
Z0_TEST0	Z0_TEST1
-1	-111
30	30
SELECT PARTITION_NAME,TABLE_ROWS,PARTITION_DESCRIPTION FROM INFORMATION_SCHEMA.PARTITIONS WHERE TABLE_SCHEMA=SCHEMA() AND TABLE_NAME = 'Z0CASE' ORDER BY PARTITION_NAME;
PARTITION_NAME	TABLE_ROWS	PARTITION_DESCRIPTION
part1	NULL	-1,1,2
part1	NULL	-1,1,2
part1	NULL	-1,1,2
part2	NULL	30,111
part2	NULL	30,111
part2	NULL	30,111
LIST --> RANGE
DROP TABLE Z0CASE;
CREATE TABLE Z0CASE (Z0_TEST0 INT,Z0_TEST1 BIGINT )PARTITION BY LIST (Z0_TEST0)
( PARTITION part_1 VALUES IN ( 1, 2 ),
PARTITION part_2 VALUES IN ( 30, 111 ) ) with column group (all columns, each column);
INSERT INTO  Z0CASE (Z0_TEST0,Z0_TEST1)VALUES('1.00','111');
INSERT INTO  Z0CASE (Z0_TEST0,Z0_TEST1)VALUES('2.22','2');
INSERT INTO  Z0CASE (Z0_TEST0,Z0_TEST1)VALUES('30','30');
INSERT INTO  Z0CASE (Z0_TEST0,Z0_TEST1)VALUES('111','111');
SELECT table_id,table_name FROM oceanbase.__all_virtual_table WHERE table_name='Z0CASE';
ALTER TABLE Z0CASE
PARTITION BY RANGE (Z0_TEST0)
( PARTITION part_1 VALUES LESS THAN (20 ),
PARTITION part_2 VALUES LESS THAN (100 ),
PARTITION part_3 VALUES LESS THAN ( MAXVALUE ) );
SELECT PARTITION_NAME,TABLE_ROWS,PARTITION_DESCRIPTION FROM INFORMATION_SCHEMA.PARTITIONS WHERE TABLE_SCHEMA=SCHEMA() AND TABLE_NAME = 'Z0CASE' ORDER BY PARTITION_NAME;
PARTITION_NAME	TABLE_ROWS	PARTITION_DESCRIPTION
part_1	NULL	20
part_2	NULL	100
part_3	NULL	MAXVALUE
SELECT table_id,table_name FROM oceanbase.__all_virtual_table WHERE table_name='Z0CASE';
DROP TABLE Z0CASE;
CREATE TABLE Z0CASE (Z0_TEST0 INT,Z0_TEST1 BIGINT )PARTITION BY LIST (Z0_TEST0)
( PARTITION part_1 VALUES IN ( 1, 2 ),
PARTITION part_2 VALUES IN ( 30, 111 ) ) with column group (all columns, each column);
SELECT table_id,table_name FROM oceanbase.__all_virtual_table WHERE table_name='Z0CASE';
ALTER TABLE Z0CASE
PARTITION BY LIST (Z0_TEST0)
( PARTITION part_1 VALUES IN ( 1, 2 ),
PARTITION part_2 VALUES IN ( 30, 111 ),
PARTITION part_3 VALUES IN ( 111, 123 ) );
ERROR HY000: Multiple definition of same constant in list partitioning
ALTER TABLE Z0CASE PARTITION BY HASH(Z0_TEST0)  (PARTITION part_1,  PARTITION part_2);
SELECT PARTITION_NAME,TABLE_ROWS,PARTITION_DESCRIPTION FROM INFORMATION_SCHEMA.PARTITIONS WHERE TABLE_SCHEMA=SCHEMA() AND TABLE_NAME = 'Z0CASE' ORDER BY PARTITION_NAME;
PARTITION_NAME	TABLE_ROWS	PARTITION_DESCRIPTION
part_1	NULL	NULL
part_2	NULL	NULL
SELECT table_id,table_name FROM oceanbase.__all_virtual_table WHERE table_name='Z0CASE';
HASH --> RANGE
DROP TABLE Z0CASE;
CREATE TABLE Z0CASE (Z0_TEST0 INT,Z0_TEST1 BIGINT )PARTITION BY HASH(Z0_TEST0)
(PARTITION part_1,
PARTITION part_2) with column group (all columns, each column);
INSERT INTO  Z0CASE (Z0_TEST0,Z0_TEST1)VALUES('-1.00','-111');
INSERT INTO  Z0CASE (Z0_TEST0,Z0_TEST1)VALUES('1.00','111');
INSERT INTO  Z0CASE (Z0_TEST0,Z0_TEST1)VALUES('2.22','2');
INSERT INTO  Z0CASE (Z0_TEST0,Z0_TEST1)VALUES('30','30');
INSERT INTO  Z0CASE (Z0_TEST0,Z0_TEST1)VALUES('111','111');
SELECT table_id,table_name FROM oceanbase.__all_virtual_table WHERE table_name='Z0CASE';
ALTER TABLE Z0CASE  PARTITION BY RANGE (Z0_TEST0)
( PARTITION part_1 VALUES LESS THAN (20 ),
PARTITION part_2 VALUES LESS THAN (100 ),
PARTITION part_3 VALUES LESS THAN ( MAXVALUE ) );
SELECT PARTITION_NAME,TABLE_ROWS,PARTITION_DESCRIPTION FROM INFORMATION_SCHEMA.PARTITIONS WHERE TABLE_SCHEMA=SCHEMA() AND TABLE_NAME = 'Z0CASE' ORDER BY PARTITION_NAME;
PARTITION_NAME	TABLE_ROWS	PARTITION_DESCRIPTION
part_1	NULL	20
part_2	NULL	100
part_3	NULL	MAXVALUE
SELECT table_id,table_name FROM oceanbase.__all_virtual_table WHERE table_name='Z0CASE';
DROP TABLE Z0CASE;
CREATE TABLE Z0CASE (Z0_TEST0 INT,Z0_TEST1 BIGINT )PARTITION BY HASH(Z0_TEST0)
(PARTITION part_1,
PARTITION part_2) with column group (all columns, each column);
INSERT INTO  Z0CASE (Z0_TEST0,Z0_TEST1)VALUES('-1.00','-111');
INSERT INTO  Z0CASE (Z0_TEST0,Z0_TEST1)VALUES('1.00','111');
INSERT INTO  Z0CASE (Z0_TEST0,Z0_TEST1)VALUES('2.22','2');
INSERT INTO  Z0CASE (Z0_TEST0,Z0_TEST1)VALUES('30','30');
INSERT INTO  Z0CASE (Z0_TEST0,Z0_TEST1)VALUES('111','111');
SELECT table_id,table_name FROM oceanbase.__all_virtual_table WHERE table_name='Z0CASE';
ALTER TABLE Z0CASE
PARTITION BY LIST (Z0_TEST0)
( PARTITION part_1 VALUES IN ( 1, 2 ),
PARTITION part_2 VALUES IN ( 30, 111 ),
PARTITION part_3 VALUES IN ( 111, 123 ) );
ERROR HY000: Multiple definition of same constant in list partitioning
ALTER TABLE Z0CASE PARTITION BY HASH(Z0_TEST0) (PARTITION part1);
SELECT PARTITION_NAME,TABLE_ROWS,PARTITION_DESCRIPTION FROM INFORMATION_SCHEMA.PARTITIONS WHERE TABLE_SCHEMA=SCHEMA() AND TABLE_NAME = 'Z0CASE' ORDER BY PARTITION_NAME;
PARTITION_NAME	TABLE_ROWS	PARTITION_DESCRIPTION
part1	NULL	NULL
SELECT table_id,table_name FROM oceanbase.__all_virtual_table WHERE table_name='Z0CASE';
ALTER TABLE Z0CASE PARTITION BY KEY(Z0_TEST0) (PARTITION part1);
SELECT PARTITION_NAME,TABLE_ROWS,PARTITION_DESCRIPTION FROM INFORMATION_SCHEMA.PARTITIONS WHERE TABLE_SCHEMA=SCHEMA() AND TABLE_NAME = 'Z0CASE' ORDER BY PARTITION_NAME;
PARTITION_NAME	TABLE_ROWS	PARTITION_DESCRIPTION
part1	NULL	NULL
SELECT table_id,table_name FROM oceanbase.__all_virtual_table WHERE table_name='Z0CASE';
HASH --> KEY --> RANGE
DROP TABLE Z0CASE;
CREATE TABLE Z0CASE (Z0_TEST0 INT,Z0_TEST1 BIGINT )
PARTITION BY HASH(Z0_TEST0)
(PARTITION part_1,
PARTITION part_2) with column group (all columns, each column);
INSERT INTO  Z0CASE (Z0_TEST0,Z0_TEST1)VALUES('-1.00','-111');
INSERT INTO  Z0CASE (Z0_TEST0,Z0_TEST1)VALUES('1.00','111');
INSERT INTO  Z0CASE (Z0_TEST0,Z0_TEST1)VALUES('2.22','2');
INSERT INTO  Z0CASE (Z0_TEST0,Z0_TEST1)VALUES('30','30');
INSERT INTO  Z0CASE (Z0_TEST0,Z0_TEST1)VALUES('111','111');
SELECT table_id,table_name FROM oceanbase.__all_virtual_table WHERE table_name='Z0CASE';
ALTER TABLE Z0CASE PARTITION BY KEY(Z0_TEST0)  (PARTITION part1);
SELECT PARTITION_NAME,TABLE_ROWS,PARTITION_DESCRIPTION FROM INFORMATION_SCHEMA.PARTITIONS WHERE TABLE_SCHEMA=SCHEMA() AND TABLE_NAME = 'Z0CASE' ORDER BY PARTITION_NAME;
PARTITION_NAME	TABLE_ROWS	PARTITION_DESCRIPTION
part1	NULL	NULL
SELECT table_id,table_name FROM oceanbase.__all_virtual_table WHERE table_name='Z0CASE';
ALTER TABLE Z0CASE  PARTITION BY RANGE (Z0_TEST0)
( PARTITION part_1 VALUES LESS THAN (20 ),
PARTITION part_2 VALUES LESS THAN (100 ),
PARTITION part_3 VALUES LESS THAN ( MAXVALUE ) );
SELECT PARTITION_NAME,TABLE_ROWS,PARTITION_DESCRIPTION FROM INFORMATION_SCHEMA.PARTITIONS WHERE TABLE_SCHEMA=SCHEMA() AND TABLE_NAME = 'Z0CASE' ORDER BY PARTITION_NAME;
PARTITION_NAME	TABLE_ROWS	PARTITION_DESCRIPTION
part_1	NULL	20
part_2	NULL	100
part_3	NULL	MAXVALUE
SELECT table_id,table_name FROM oceanbase.__all_virtual_table WHERE table_name='Z0CASE';
INT
KEY --> RANGE
DROP TABLE Z0CASE;
CREATE TABLE Z0CASE (Z0_TEST0 INT,Z0_TEST1 BIGINT )
PARTITION BY KEY(Z0_TEST0)
(PARTITION part_1,PARTITION part_2) with column group (all columns, each column);
INSERT INTO  Z0CASE (Z0_TEST0,Z0_TEST1)VALUES('-1.00','-111');
INSERT INTO  Z0CASE (Z0_TEST0,Z0_TEST1)VALUES('1.00','111');
INSERT INTO  Z0CASE (Z0_TEST0,Z0_TEST1)VALUES('2.22','2');
INSERT INTO  Z0CASE (Z0_TEST0,Z0_TEST1)VALUES('30','30');
INSERT INTO  Z0CASE (Z0_TEST0,Z0_TEST1)VALUES('111','111');
SELECT table_id,table_name FROM oceanbase.__all_virtual_table WHERE table_name='Z0CASE';
ALTER TABLE Z0CASE PARTITION BY KEY(Z0_TEST0)  (PARTITION part_1);
SELECT PARTITION_NAME,TABLE_ROWS,PARTITION_DESCRIPTION FROM INFORMATION_SCHEMA.PARTITIONS WHERE TABLE_SCHEMA=SCHEMA() AND TABLE_NAME = 'Z0CASE' ORDER BY PARTITION_NAME;
PARTITION_NAME	TABLE_ROWS	PARTITION_DESCRIPTION
part_1	NULL	NULL
SELECT table_id,table_name FROM oceanbase.__all_virtual_table WHERE table_name='Z0CASE';
ALTER TABLE Z0CASE  PARTITION BY RANGE (Z0_TEST0)
( PARTITION part_1 VALUES LESS THAN (20 ),
PARTITION part_2 VALUES LESS THAN (100 ),
PARTITION part_3 VALUES LESS THAN ( MAXVALUE ) );
SELECT PARTITION_NAME,TABLE_ROWS,PARTITION_DESCRIPTION FROM INFORMATION_SCHEMA.PARTITIONS WHERE TABLE_SCHEMA=SCHEMA() AND TABLE_NAME = 'Z0CASE' ORDER BY PARTITION_NAME;
PARTITION_NAME	TABLE_ROWS	PARTITION_DESCRIPTION
part_1	NULL	20
part_2	NULL	100
part_3	NULL	MAXVALUE
SELECT table_id,table_name FROM oceanbase.__all_virtual_table WHERE table_name='Z0CASE';
DROP TABLE Z0CASE;
CREATE TABLE Z0CASE (Z0_TEST0 INT,Z0_TEST1 BIGINT )
PARTITION BY KEY(Z0_TEST0)
(PARTITION part_1,
PARTITION part_2) with column group (all columns, each column);
INSERT INTO  Z0CASE (Z0_TEST0,Z0_TEST1)VALUES('-1.00','-111');
INSERT INTO  Z0CASE (Z0_TEST0,Z0_TEST1)VALUES('1.00','111');
INSERT INTO  Z0CASE (Z0_TEST0,Z0_TEST1)VALUES('2.22','2');
INSERT INTO  Z0CASE (Z0_TEST0,Z0_TEST1)VALUES('30','30');
INSERT INTO  Z0CASE (Z0_TEST0,Z0_TEST1)VALUES('111','111');
SELECT table_id,table_name FROM oceanbase.__all_virtual_table WHERE table_name='Z0CASE';
ALTER TABLE Z0CASE PARTITION BY HASH(Z0_TEST0)  (PARTITION part_1,  PARTITION part_2);
SELECT PARTITION_NAME,TABLE_ROWS,PARTITION_DESCRIPTION FROM INFORMATION_SCHEMA.PARTITIONS WHERE TABLE_SCHEMA=SCHEMA() AND TABLE_NAME = 'Z0CASE' ORDER BY PARTITION_NAME;
PARTITION_NAME	TABLE_ROWS	PARTITION_DESCRIPTION
part_1	NULL	NULL
part_2	NULL	NULL
SELECT table_id,table_name FROM oceanbase.__all_virtual_table WHERE table_name='Z0CASE';
CHAR
KEY --> RANGE
DROP TABLE Z0CASE;
CREATE TABLE Z0CASE (Z0_TEST0 CHAR(100),Z0_TEST1 BIGINT )
PARTITION BY KEY(Z0_TEST0)
(PARTITION part_1,
PARTITION part_2) with column group (all columns, each column);
INSERT INTO  Z0CASE (Z0_TEST0,Z0_TEST1)VALUES('-1.00','-111');
INSERT INTO  Z0CASE (Z0_TEST0,Z0_TEST1)VALUES('1.00','111');
INSERT INTO  Z0CASE (Z0_TEST0,Z0_TEST1)VALUES('2.22','2');
INSERT INTO  Z0CASE (Z0_TEST0,Z0_TEST1)VALUES('30','30');
INSERT INTO  Z0CASE (Z0_TEST0,Z0_TEST1)VALUES('111','111');
SELECT table_id,table_name FROM oceanbase.__all_virtual_table WHERE table_name='Z0CASE';
ALTER TABLE Z0CASE PARTITION BY KEY(Z0_TEST0)  (PARTITION part1);
SELECT PARTITION_NAME,TABLE_ROWS,PARTITION_DESCRIPTION FROM INFORMATION_SCHEMA.PARTITIONS WHERE TABLE_SCHEMA=SCHEMA() AND TABLE_NAME = 'Z0CASE' ORDER BY PARTITION_NAME;
PARTITION_NAME	TABLE_ROWS	PARTITION_DESCRIPTION
part1	NULL	NULL
SELECT table_id,table_name FROM oceanbase.__all_virtual_table WHERE table_name='Z0CASE';
ALTER TABLE Z0CASE  PARTITION BY RANGE (Z0_TEST0)
( PARTITION part_1 VALUES LESS THAN (20 ),
PARTITION part_2 VALUES LESS THAN (100 ),
PARTITION part_3 VALUES LESS THAN ( MAXVALUE ));
ERROR HY000: Field 'Z0_TEST0' is of a not allowed type for this type of partitioning
DROP TABLE Z0CASE;
CREATE TABLE Z0CASE (Z0_TEST0 CHAR(100),Z0_TEST1 BIGINT )
PARTITION BY KEY(Z0_TEST0)
(PARTITION part_1,  PARTITION part_2) with column group (all columns, each column);
INSERT INTO  Z0CASE (Z0_TEST0,Z0_TEST1)VALUES('-1.00','-111');
INSERT INTO  Z0CASE (Z0_TEST0,Z0_TEST1)VALUES('1.00','111');
INSERT INTO  Z0CASE (Z0_TEST0,Z0_TEST1)VALUES('2.22','2');
INSERT INTO  Z0CASE (Z0_TEST0,Z0_TEST1)VALUES('30','30');
INSERT INTO  Z0CASE (Z0_TEST0,Z0_TEST1)VALUES('111','111');
ALTER TABLE Z0CASE PARTITION BY HASH(Z0_TEST0)  (PARTITION part_1,  PARTITION part_2);
ERROR HY000: Field 'Z0_TEST0' is of a not allowed type for this type of partitioning
DROP TABLE Z0CASE;
CREATE TABLE Z0CASE (Z0_TEST0 INT,Z0_TEST1 BIGINT )PARTITION BY LIST (Z0_TEST0)
( PARTITION part_1 VALUES IN ( 1, 2 ),
PARTITION part_2 VALUES IN ( 30, 111 )) with column group (all columns, each column);
SELECT table_id,table_name FROM oceanbase.__all_virtual_table WHERE table_name='Z0CASE';
ALTER TABLE Z0CASE PARTITION BY LIST(Z0_TEST0)
SUBPARTITION BY RANGE(Z0_TEST0) SUBPARTITION template
( SUBPARTITION sp0 VALUES LESS THAN(100),
SUBPARTITION sp1 VALUES LESS THAN(200),
SUBPARTITION sp2 VALUES LESS THAN(MAXVALUE) )
(
PARTITION part_1 VALUES IN ( 1, 2 ),
PARTITION part_2 VALUES IN ( 3, 4 ));
SELECT PARTITION_NAME,TABLE_ROWS,PARTITION_DESCRIPTION FROM INFORMATION_SCHEMA.PARTITIONS WHERE TABLE_SCHEMA=SCHEMA() AND TABLE_NAME = 'Z0CASE' ORDER BY PARTITION_NAME;
PARTITION_NAME	TABLE_ROWS	PARTITION_DESCRIPTION
part_1	NULL	1,2
part_1	NULL	1,2
part_1	NULL	1,2
part_2	NULL	3,4
part_2	NULL	3,4
part_2	NULL	3,4
SELECT table_id,table_name FROM oceanbase.__all_virtual_table WHERE table_name='Z0CASE';
一级分区-->二级分区
DROP TABLE Z0CASE;
CREATE TABLE Z0CASE (Z0_TEST0 INT,Z0_TEST1 BIGINT )PARTITION BY RANGE (Z0_TEST0)
( PARTITION part_1 VALUES LESS THAN (20 ),
PARTITION part_2 VALUES LESS THAN (100 ),
PARTITION part_3 VALUES LESS THAN ( MAXVALUE )) with column group (all columns, each column);
INSERT INTO  Z0CASE (Z0_TEST0,Z0_TEST1)VALUES('-1.00','-111');
INSERT INTO  Z0CASE (Z0_TEST0,Z0_TEST1)VALUES('1.00','111');
INSERT INTO  Z0CASE (Z0_TEST0,Z0_TEST1)VALUES('2.22','2');
INSERT INTO  Z0CASE (Z0_TEST0,Z0_TEST1)VALUES('30','30');
INSERT INTO  Z0CASE (Z0_TEST0,Z0_TEST1)VALUES('4','111');
SELECT table_id,table_name FROM oceanbase.__all_virtual_table WHERE table_name='Z0CASE';
ALTER TABLE Z0CASE PARTITION BY LIST(Z0_TEST0)
SUBPARTITION BY RANGE(Z0_TEST0) SUBPARTITION template
(SUBPARTITION sp0 VALUES LESS THAN(100),
SUBPARTITION sp1 VALUES LESS THAN(200),
SUBPARTITION sp2 VALUES LESS THAN(MAXVALUE) )
(PARTITION part_1 VALUES IN ( 1, 2 ,-1),
PARTITION part_2 VALUES IN ( 30, 4 ));
SELECT PARTITION_NAME,TABLE_ROWS,PARTITION_DESCRIPTION FROM INFORMATION_SCHEMA.PARTITIONS WHERE TABLE_SCHEMA=SCHEMA() AND TABLE_NAME = 'Z0CASE' ORDER BY PARTITION_NAME;
PARTITION_NAME	TABLE_ROWS	PARTITION_DESCRIPTION
part_1	NULL	-1,1,2
part_1	NULL	-1,1,2
part_1	NULL	-1,1,2
part_2	NULL	4,30
part_2	NULL	4,30
part_2	NULL	4,30
SELECT table_id,table_name FROM oceanbase.__all_virtual_table WHERE table_name='Z0CASE';
DROP TABLE Z0CASE;
CREATE TABLE Z0CASE (Z0_TEST0 INT,Z0_TEST1 BIGINT )PARTITION BY RANGE (Z0_TEST0)
( PARTITION part_1 VALUES LESS THAN (20 ),
PARTITION part_2 VALUES LESS THAN (100 ),
PARTITION part_3 VALUES LESS THAN ( MAXVALUE )) with column group (all columns, each column);
INSERT INTO  Z0CASE (Z0_TEST0,Z0_TEST1)VALUES('-1.00','-111');
INSERT INTO  Z0CASE (Z0_TEST0,Z0_TEST1)VALUES('1.00','111');
INSERT INTO  Z0CASE (Z0_TEST0,Z0_TEST1)VALUES('2.22','2');
INSERT INTO  Z0CASE (Z0_TEST0,Z0_TEST1)VALUES('30','30');
INSERT INTO  Z0CASE (Z0_TEST0,Z0_TEST1)VALUES('4','111');
SELECT table_id,table_name FROM oceanbase.__all_virtual_table WHERE table_name='Z0CASE';
ALTER TABLE Z0CASE PARTITION BY LIST(Z0_TEST0)
SUBPARTITION BY HASH(Z0_TEST0) SUBPARTITION template
(SUBPARTITION part_1,
SUBPARTITION part_2)
(PARTITION part_1 VALUES IN ( 1, 2 ,-1),
PARTITION part_2 VALUES IN ( 30, 4 ));
SELECT PARTITION_NAME,TABLE_ROWS,PARTITION_DESCRIPTION FROM INFORMATION_SCHEMA.PARTITIONS WHERE TABLE_SCHEMA=SCHEMA() AND TABLE_NAME = 'Z0CASE' ORDER BY PARTITION_NAME;
PARTITION_NAME	TABLE_ROWS	PARTITION_DESCRIPTION
part_1	NULL	-1,1,2
part_1	NULL	-1,1,2
part_2	NULL	4,30
part_2	NULL	4,30
SELECT table_id,table_name FROM oceanbase.__all_virtual_table WHERE table_name='Z0CASE';
DROP TABLE Z0CASE;
CREATE TABLE Z0CASE (Z0_TEST0 INT,Z0_TEST1 BIGINT )PARTITION BY RANGE (Z0_TEST0)
( PARTITION part_1 VALUES LESS THAN (20 ),
PARTITION part_2 VALUES LESS THAN (100 ),
PARTITION part_3 VALUES LESS THAN ( MAXVALUE )) with column group (all columns, each column);
INSERT INTO  Z0CASE (Z0_TEST0,Z0_TEST1)VALUES('-1.00','-111');
INSERT INTO  Z0CASE (Z0_TEST0,Z0_TEST1)VALUES('1.00','111');
INSERT INTO  Z0CASE (Z0_TEST0,Z0_TEST1)VALUES('2.22','2');
INSERT INTO  Z0CASE (Z0_TEST0,Z0_TEST1)VALUES('30','30');
INSERT INTO  Z0CASE (Z0_TEST0,Z0_TEST1)VALUES('4','111');
SELECT table_id,table_name FROM oceanbase.__all_virtual_table WHERE table_name='Z0CASE';
ALTER TABLE Z0CASE
PARTITION BY RANGE(Z0_TEST0)
SUBPARTITION BY HASH(Z0_TEST0) SUBPARTITION template (SUBPARTITION part_1,  SUBPARTITION part_2)
( PARTITION part_1 VALUES LESS THAN (-1 ),
PARTITION part_2 VALUES LESS THAN (10 ),
PARTITION part_3 VALUES LESS THAN ( 100 ));
SELECT PARTITION_NAME,TABLE_ROWS,PARTITION_DESCRIPTION FROM INFORMATION_SCHEMA.PARTITIONS WHERE TABLE_SCHEMA=SCHEMA() AND TABLE_NAME = 'Z0CASE' ORDER BY PARTITION_NAME;
PARTITION_NAME	TABLE_ROWS	PARTITION_DESCRIPTION
part_1	NULL	-1
part_1	NULL	-1
part_2	NULL	10
part_2	NULL	10
part_3	NULL	100
part_3	NULL	100
SELECT table_id,table_name FROM oceanbase.__all_virtual_table WHERE table_name='Z0CASE';
LIST --> 二级分区
DROP TABLE Z0CASE;
CREATE TABLE Z0CASE (Z0_TEST0 INT,Z0_TEST1 BIGINT )PARTITION BY LIST (Z0_TEST0)
( PARTITION part_1 VALUES IN ( 1, 2 ,-1),
PARTITION part_2 VALUES IN ( 30, 111 )) with column group (all columns, each column);
INSERT INTO  Z0CASE (Z0_TEST0,Z0_TEST1)VALUES('-1.00','-111');
INSERT INTO  Z0CASE (Z0_TEST0,Z0_TEST1)VALUES('1.00','111');
INSERT INTO  Z0CASE (Z0_TEST0,Z0_TEST1)VALUES('2.22','2');
INSERT INTO  Z0CASE (Z0_TEST0,Z0_TEST1)VALUES('30','30');
INSERT INTO  Z0CASE (Z0_TEST0,Z0_TEST1)VALUES('111','111');
SELECT table_id,table_name FROM oceanbase.__all_virtual_table WHERE table_name='Z0CASE';
ALTER TABLE Z0CASE PARTITION BY LIST(Z0_TEST0)
SUBPARTITION BY RANGE(Z0_TEST0) SUBPARTITION template
( SUBPARTITION sp0 VALUES LESS THAN(10),
SUBPARTITION sp1 VALUES LESS THAN(100),
SUBPARTITION sp2 VALUES LESS THAN(112) )
( PARTITION part_1 VALUES IN ( 1, 2 ,-1),
PARTITION part_2 VALUES IN ( 30, 4,111 ));
SELECT PARTITION_NAME,TABLE_ROWS,PARTITION_DESCRIPTION FROM INFORMATION_SCHEMA.PARTITIONS WHERE TABLE_SCHEMA=SCHEMA() AND TABLE_NAME = 'Z0CASE' ORDER BY PARTITION_NAME;
PARTITION_NAME	TABLE_ROWS	PARTITION_DESCRIPTION
part_1	NULL	-1,1,2
part_1	NULL	-1,1,2
part_1	NULL	-1,1,2
part_2	NULL	4,30,111
part_2	NULL	4,30,111
part_2	NULL	4,30,111
SELECT table_id,table_name FROM oceanbase.__all_virtual_table WHERE table_name='Z0CASE';
DROP TABLE Z0CASE;
CREATE TABLE Z0CASE (Z0_TEST0 INT,Z0_TEST1 BIGINT )PARTITION BY LIST (Z0_TEST0)
( PARTITION part_1 VALUES IN ( 1, 2 ,-1),
PARTITION part_2 VALUES IN ( 30, 111 )) with column group (all columns, each column);
INSERT INTO  Z0CASE (Z0_TEST0,Z0_TEST1)VALUES('-1.00','-111');
INSERT INTO  Z0CASE (Z0_TEST0,Z0_TEST1)VALUES('1.00','111');
INSERT INTO  Z0CASE (Z0_TEST0,Z0_TEST1)VALUES('2.22','2');
INSERT INTO  Z0CASE (Z0_TEST0,Z0_TEST1)VALUES('30','30');
INSERT INTO  Z0CASE (Z0_TEST0,Z0_TEST1)VALUES('111','111');
SELECT table_id,table_name FROM oceanbase.__all_virtual_table WHERE table_name='Z0CASE';
ALTER TABLE Z0CASE PARTITION BY LIST(Z0_TEST0)
SUBPARTITION BY HASH(Z0_TEST0) SUBPARTITION template (SUBPARTITION part_1,  SUBPARTITION part_2)
(PARTITION part_1 VALUES IN ( 1, 2 ,-1,0,1+1+1),
PARTITION part_2 VALUES IN ( 30, 111 ));
SELECT PARTITION_NAME,TABLE_ROWS,PARTITION_DESCRIPTION FROM INFORMATION_SCHEMA.PARTITIONS WHERE TABLE_SCHEMA=SCHEMA() AND TABLE_NAME = 'Z0CASE' ORDER BY PARTITION_NAME;
PARTITION_NAME	TABLE_ROWS	PARTITION_DESCRIPTION
part_1	NULL	-1,0,1,2,3
part_1	NULL	-1,0,1,2,3
part_2	NULL	30,111
part_2	NULL	30,111
SELECT table_id,table_name FROM oceanbase.__all_virtual_table WHERE table_name='Z0CASE';
KEY -->二级分区
DROP TABLE Z0CASE;
CREATE TABLE Z0CASE (Z0_TEST0 CHAR(100),Z0_TEST1 BIGINT )PARTITION BY KEY (Z0_TEST0)PARTITIONS 3 with column group (all columns, each column);
INSERT INTO  Z0CASE (Z0_TEST0,Z0_TEST1)VALUES('-1.00','-111');
INSERT INTO  Z0CASE (Z0_TEST0,Z0_TEST1)VALUES('1.00','111');
INSERT INTO  Z0CASE (Z0_TEST0,Z0_TEST1)VALUES('2.22','2');
INSERT INTO  Z0CASE (Z0_TEST0,Z0_TEST1)VALUES('30','30');
INSERT INTO  Z0CASE (Z0_TEST0,Z0_TEST1)VALUES('111','111');
ALTER TABLE Z0CASE PARTITION BY LIST(Z0_TEST0)
SUBPARTITION BY RANGE(Z0_TEST0) SUBPARTITION template
( SUBPARTITION sp0 VALUES LESS THAN(10),
SUBPARTITION sp1 VALUES LESS THAN(100),
SUBPARTITION sp2 VALUES LESS THAN(112) )
(PARTITION part_1 VALUES IN ( 1, 2 ,-1),
PARTITION part_2 VALUES IN ( 30, 4,111 ));
ERROR HY000: Field 'Z0_TEST0' is of a not allowed type for this type of partitioning
ALTER TABLE Z0CASE PARTITION BY LIST(Z0_TEST0)
SUBPARTITION BY HASH(Z0_TEST0) SUBPARTITION template
(SUBPARTITION part_1,  SUBPARTITION part_2)
(PARTITION part_1 VALUES IN ( 1, 2 ,-1,0,1+1+1),
PARTITION part_2 VALUES IN ( 30, 111 ));
ERROR HY000: Field 'Z0_TEST0' is of a not allowed type for this type of partitioning
ALTER TABLE Z0CASE PARTITION BY RANGE(Z0_TEST0)
SUBPARTITION BY HASH(Z0_TEST0) SUBPARTITION template
(SUBPARTITION part_1,  SUBPARTITION part_2)
(PARTITION part_1 VALUES LESS THAN (-1 ),
PARTITION part_2 VALUES LESS THAN (10 ),
PARTITION part_3 VALUES LESS THAN ( 100 ));
ERROR HY000: Field 'Z0_TEST0' is of a not allowed type for this type of partitioning
DROP TABLE Z0CASE;
CREATE TABLE Z0CASE (Z0_TEST0 CHAR(100),Z0_TEST1 BIGINT )PARTITION BY KEY(Z0_TEST0)  (PARTITION part_1,  PARTITION part_2) with column group (all columns, each column);
INSERT INTO  Z0CASE (Z0_TEST0,Z0_TEST1)VALUES('-1.00','-111');
INSERT INTO  Z0CASE (Z0_TEST0,Z0_TEST1)VALUES('1.00','111');
INSERT INTO  Z0CASE (Z0_TEST0,Z0_TEST1)VALUES('2.22','2');
INSERT INTO  Z0CASE (Z0_TEST0,Z0_TEST1)VALUES('30','30');
INSERT INTO  Z0CASE (Z0_TEST0,Z0_TEST1)VALUES('111','111');
ALTER TABLE Z0CASE PARTITION BY HASH(Z0_TEST0)  (PARTITION part_1,  PARTITION part_2);
ERROR HY000: Field 'Z0_TEST0' is of a not allowed type for this type of partitioning
DROP TABLE Z0CASE;
CREATE TABLE Z0CASE (Z0_TEST0 INT,Z0_TEST1 BIGINT )PARTITION BY LIST (Z0_TEST0)
(PARTITION part_1 VALUES IN ( 1, 2 ),
PARTITION part_2 VALUES IN ( 30, 111 )) with column group (all columns, each column);
INSERT INTO  Z0CASE (Z0_TEST0,Z0_TEST1)VALUES('1.00','111');
INSERT INTO  Z0CASE (Z0_TEST0,Z0_TEST1)VALUES('2.22','2');
INSERT INTO  Z0CASE (Z0_TEST0,Z0_TEST1)VALUES('30','30');
INSERT INTO  Z0CASE (Z0_TEST0,Z0_TEST1)VALUES('111','111');
SELECT table_id,table_name FROM oceanbase.__all_virtual_table WHERE table_name='Z0CASE';
ALTER TABLE Z0CASE PARTITION BY HASH(Z0_TEST0)  (PARTITION part_1,  PARTITION part_2);
SELECT PARTITION_NAME,TABLE_ROWS,PARTITION_DESCRIPTION FROM INFORMATION_SCHEMA.PARTITIONS WHERE TABLE_SCHEMA=SCHEMA() AND TABLE_NAME = 'Z0CASE' ORDER BY PARTITION_NAME;
PARTITION_NAME	TABLE_ROWS	PARTITION_DESCRIPTION
part_1	NULL	NULL
part_2	NULL	NULL
SELECT table_id,table_name FROM oceanbase.__all_virtual_table WHERE table_name='Z0CASE';
ALTER TABLE Z0CASE
PARTITION BY RANGE (Z0_TEST0)
( PARTITION part_1 VALUES LESS THAN (20 ),
PARTITION part_2 VALUES LESS THAN (100 ),
PARTITION part_3 VALUES LESS THAN ( MAXVALUE ));
SELECT PARTITION_NAME,TABLE_ROWS,PARTITION_DESCRIPTION FROM INFORMATION_SCHEMA.PARTITIONS WHERE TABLE_SCHEMA=SCHEMA() AND TABLE_NAME = 'Z0CASE' ORDER BY PARTITION_NAME;
PARTITION_NAME	TABLE_ROWS	PARTITION_DESCRIPTION
part_1	NULL	20
part_2	NULL	100
part_3	NULL	MAXVALUE
SELECT table_id,table_name FROM oceanbase.__all_virtual_table WHERE table_name='Z0CASE';
DROP TABLE Z0CASE;
CREATE TABLE Z0CASE (Z0_TEST0 INT,Z0_TEST1 BIGINT )PARTITION BY LIST (Z0_TEST0)
( PARTITION part_1 VALUES IN ( 1, 2 ),
PARTITION part_2 VALUES IN ( 30, 111 )) with column group (all columns, each column);
SELECT table_id,table_name FROM oceanbase.__all_virtual_table WHERE table_name='Z0CASE';
ALTER TABLE Z0CASE PARTITION BY LIST (Z0_TEST0)
( PARTITION part_1 VALUES IN ( 1, 2 ),
PARTITION part_2 VALUES IN ( 30, 111 ),
PARTITION part_3 VALUES IN ( -1, 123 ));
SELECT PARTITION_NAME,TABLE_ROWS,PARTITION_DESCRIPTION FROM INFORMATION_SCHEMA.PARTITIONS WHERE TABLE_SCHEMA=SCHEMA() AND TABLE_NAME = 'Z0CASE' ORDER BY PARTITION_NAME;
PARTITION_NAME	TABLE_ROWS	PARTITION_DESCRIPTION
part_1	NULL	1,2
part_2	NULL	30,111
part_3	NULL	-1,123
SELECT table_id,table_name FROM oceanbase.__all_virtual_table WHERE table_name='Z0CASE';
ALTER TABLE Z0CASE PARTITION BY KEY(Z0_TEST0) PARTITIONS 3;
SELECT PARTITION_NAME,TABLE_ROWS,PARTITION_DESCRIPTION FROM INFORMATION_SCHEMA.PARTITIONS WHERE TABLE_SCHEMA=SCHEMA() AND TABLE_NAME = 'Z0CASE' ORDER BY PARTITION_NAME;
PARTITION_NAME	TABLE_ROWS	PARTITION_DESCRIPTION
p0	NULL	NULL
p1	NULL	NULL
p2	NULL	NULL
SELECT table_id,table_name FROM oceanbase.__all_virtual_table WHERE table_name='Z0CASE';
ALTER TABLE Z0CASE PARTITION BY LIST (Z0_TEST0)
( PARTITION part_1 VALUES IN ( 1,3 ),
PARTITION part_2 VALUES IN ( 2, 4));
SELECT PARTITION_NAME,TABLE_ROWS,PARTITION_DESCRIPTION FROM INFORMATION_SCHEMA.PARTITIONS WHERE TABLE_SCHEMA=SCHEMA() AND TABLE_NAME = 'Z0CASE' ORDER BY PARTITION_NAME;
PARTITION_NAME	TABLE_ROWS	PARTITION_DESCRIPTION
part_1	NULL	1,3
part_2	NULL	2,4
SELECT table_id,table_name FROM oceanbase.__all_virtual_table WHERE table_name='Z0CASE';
DROP TABLE Z0CASE;
CREATE TABLE Z0CASE (Z0_TEST0 DATE,Z0_TEST1 BIGINT) with column group (all columns, each column);
INSERT INTO  Z0CASE (Z0_TEST0,Z0_TEST1)VALUES('2011-11-11 11:11:11','111');
INSERT INTO  Z0CASE (Z0_TEST0,Z0_TEST1)VALUES('2012-12-11 11:11:11','111');
SELECT table_id,table_name FROM oceanbase.__all_virtual_table WHERE table_name='Z0CASE';
ALTER TABLE Z0CASE PARTITION BY KEY(Z0_TEST0) PARTITIONS 3;
SELECT PARTITION_NAME,TABLE_ROWS,PARTITION_DESCRIPTION FROM INFORMATION_SCHEMA.PARTITIONS WHERE TABLE_SCHEMA=SCHEMA() AND TABLE_NAME = 'Z0CASE' ORDER BY PARTITION_NAME;
PARTITION_NAME	TABLE_ROWS	PARTITION_DESCRIPTION
p0	NULL	NULL
p1	NULL	NULL
p2	NULL	NULL
SELECT table_id,table_name FROM oceanbase.__all_virtual_table WHERE table_name='Z0CASE';
DROP TABLE Z0CASE;
CREATE TABLE Z0CASE (Z0_TEST0 DATE,Z0_TEST1 BIGINT) with column group (all columns, each column);
INSERT INTO  Z0CASE (Z0_TEST0,Z0_TEST1)VALUES('2011-11-11 11:11:11','111');
INSERT INTO  Z0CASE (Z0_TEST0,Z0_TEST1)VALUES('2012-12-11 11:11:11','111');
ALTER TABLE Z0CASE PARTITION BY HASH(Z0_TEST0)  (PARTITION part_1,  PARTITION part_2);
ERROR HY000: Field 'Z0_TEST0' is of a not allowed type for this type of partitioning
ALTER TABLE Z0CASE PARTITION BY LIST (Z0_TEST0)
( PARTITION part_1 VALUES IN ( 'abc', 'ABC' ),
PARTITION part_2 VALUES IN ( 'cba', 'bca' ));
ERROR HY000: Field 'Z0_TEST0' is of a not allowed type for this type of partitioning
二级分区 -->二级分区
DROP TABLE Z0CASE;
CREATE TABLE Z0CASE (Z0_TEST0 INT,Z0_TEST1 BIGINT ) with column group (all columns, each column);
INSERT INTO  Z0CASE (Z0_TEST0,Z0_TEST1)VALUES('-1.00','-111');
INSERT INTO  Z0CASE (Z0_TEST0,Z0_TEST1)VALUES('1.00','111');
INSERT INTO  Z0CASE (Z0_TEST0,Z0_TEST1)VALUES('2.22','2');
INSERT INTO  Z0CASE (Z0_TEST0,Z0_TEST1)VALUES('30','30');
INSERT INTO  Z0CASE (Z0_TEST0,Z0_TEST1)VALUES('111','111');
SELECT table_id,table_name FROM oceanbase.__all_virtual_table WHERE table_name='Z0CASE';
ALTER TABLE Z0CASE PARTITION BY LIST(Z0_TEST0)
SUBPARTITION BY RANGE(Z0_TEST0) SUBPARTITION template
(SUBPARTITION sp0 VALUES LESS THAN(10),
SUBPARTITION sp1 VALUES LESS THAN(100),
SUBPARTITION sp2 VALUES LESS THAN(112) )
(PARTITION part_1 VALUES IN ( 1, 2 ,-1),
PARTITION part_2 VALUES IN ( 30, 4,111 ));
SELECT PARTITION_NAME,TABLE_ROWS,PARTITION_DESCRIPTION FROM INFORMATION_SCHEMA.PARTITIONS WHERE TABLE_SCHEMA=SCHEMA() AND TABLE_NAME = 'Z0CASE' ORDER BY PARTITION_NAME;
PARTITION_NAME	TABLE_ROWS	PARTITION_DESCRIPTION
part_1	NULL	-1,1,2
part_1	NULL	-1,1,2
part_1	NULL	-1,1,2
part_2	NULL	4,30,111
part_2	NULL	4,30,111
part_2	NULL	4,30,111
SELECT table_id,table_name FROM oceanbase.__all_virtual_table WHERE table_name='Z0CASE';
ALTER TABLE Z0CASE
PARTITION BY LIST(Z0_TEST0)
SUBPARTITION BY LIST(Z0_TEST0)SUBPARTITION template
(SUBPARTITION part_3 VALUES IN ( 1, 2,-1 ),
SUBPARTITION part_4 VALUES IN ( 30, 4,111 ))
(PARTITION part_1 VALUES IN ( 1, 2,-1 ),
PARTITION part_2 VALUES IN ( 30, 4,111 ));
SELECT PARTITION_NAME,TABLE_ROWS,PARTITION_DESCRIPTION FROM INFORMATION_SCHEMA.PARTITIONS WHERE TABLE_SCHEMA=SCHEMA() AND TABLE_NAME = 'Z0CASE' ORDER BY PARTITION_NAME;
PARTITION_NAME	TABLE_ROWS	PARTITION_DESCRIPTION
part_1	NULL	-1,1,2
part_1	NULL	-1,1,2
part_2	NULL	4,30,111
part_2	NULL	4,30,111
SELECT table_id,table_name FROM oceanbase.__all_virtual_table WHERE table_name='Z0CASE';
DROP TABLE Z0CASE;
CREATE TABLE Z0CASE (Z0_TEST0 INT,Z0_TEST1 BIGINT )PARTITION BY KEY (Z0_TEST0)PARTITIONS 3 with column group (all columns, each column);
INSERT INTO  Z0CASE (Z0_TEST0,Z0_TEST1)VALUES('-1.00','-111');
INSERT INTO  Z0CASE (Z0_TEST0,Z0_TEST1)VALUES('1.00','111');
INSERT INTO  Z0CASE (Z0_TEST0,Z0_TEST1)VALUES('2.22','2');
INSERT INTO  Z0CASE (Z0_TEST0,Z0_TEST1)VALUES('30','30');
INSERT INTO  Z0CASE (Z0_TEST0,Z0_TEST1)VALUES('111','111');
SELECT table_id,table_name FROM oceanbase.__all_virtual_table WHERE table_name='Z0CASE';
ALTER TABLE Z0CASE PARTITION BY LIST(Z0_TEST0)
SUBPARTITION BY HASH(Z0_TEST0) SUBPARTITION template
(SUBPARTITION part_1,  SUBPARTITION part_2)
(PARTITION part_1 VALUES IN ( 1, 2 ,-1,0,1+1+1),
PARTITION part_2 VALUES IN ( 30, 111 ));
SELECT PARTITION_NAME,TABLE_ROWS,PARTITION_DESCRIPTION FROM INFORMATION_SCHEMA.PARTITIONS WHERE TABLE_SCHEMA=SCHEMA() AND TABLE_NAME = 'Z0CASE' ORDER BY PARTITION_NAME;
PARTITION_NAME	TABLE_ROWS	PARTITION_DESCRIPTION
part_1	NULL	-1,0,1,2,3
part_1	NULL	-1,0,1,2,3
part_2	NULL	30,111
part_2	NULL	30,111
SELECT table_id,table_name FROM oceanbase.__all_virtual_table WHERE table_name='Z0CASE';
ALTER TABLE Z0CASE PARTITION BY RANGE(Z0_TEST0)
SUBPARTITION BY HASH(Z0_TEST0) SUBPARTITION template
(SUBPARTITION part_1,  SUBPARTITION part_2)
(PARTITION part_1 VALUES LESS THAN (-1 ),
PARTITION part_2 VALUES LESS THAN (10 ),
PARTITION part_3 VALUES LESS THAN ( MAXVALUE ));
SELECT PARTITION_NAME,TABLE_ROWS,PARTITION_DESCRIPTION FROM INFORMATION_SCHEMA.PARTITIONS WHERE TABLE_SCHEMA=SCHEMA() AND TABLE_NAME = 'Z0CASE' ORDER BY PARTITION_NAME;
PARTITION_NAME	TABLE_ROWS	PARTITION_DESCRIPTION
part_1	NULL	-1
part_1	NULL	-1
part_2	NULL	10
part_2	NULL	10
part_3	NULL	MAXVALUE
part_3	NULL	MAXVALUE
SELECT table_id,table_name FROM oceanbase.__all_virtual_table WHERE table_name='Z0CASE';
二级分区-->一级分区
DROP TABLE Z0CASE;
CREATE TABLE Z0CASE (Z0_TEST0 INT,Z0_TEST1 BIGINT ) with column group (all columns, each column);
INSERT INTO  Z0CASE (Z0_TEST0,Z0_TEST1)VALUES('-1.00','-111');
INSERT INTO  Z0CASE (Z0_TEST0,Z0_TEST1)VALUES('1.00','111');
INSERT INTO  Z0CASE (Z0_TEST0,Z0_TEST1)VALUES('2.22','2');
INSERT INTO  Z0CASE (Z0_TEST0,Z0_TEST1)VALUES('30','30');
INSERT INTO  Z0CASE (Z0_TEST0,Z0_TEST1)VALUES('111','111');
SELECT table_id,table_name FROM oceanbase.__all_virtual_table WHERE table_name='Z0CASE';
ALTER TABLE Z0CASE PARTITION BY LIST(Z0_TEST0)
SUBPARTITION BY RANGE(Z0_TEST0) SUBPARTITION template
(SUBPARTITION sp0 VALUES LESS THAN(10),
SUBPARTITION sp1 VALUES LESS THAN(100),
SUBPARTITION sp2 VALUES LESS THAN(112) )
(PARTITION part_1 VALUES IN ( 1, 2 ,-1),
PARTITION part_2 VALUES IN ( 30, 4,111 ));
SELECT PARTITION_NAME,TABLE_ROWS,PARTITION_DESCRIPTION FROM INFORMATION_SCHEMA.PARTITIONS WHERE TABLE_SCHEMA=SCHEMA() AND TABLE_NAME = 'Z0CASE' ORDER BY PARTITION_NAME;
PARTITION_NAME	TABLE_ROWS	PARTITION_DESCRIPTION
part_1	NULL	-1,1,2
part_1	NULL	-1,1,2
part_1	NULL	-1,1,2
part_2	NULL	4,30,111
part_2	NULL	4,30,111
part_2	NULL	4,30,111
SELECT table_id,table_name FROM oceanbase.__all_virtual_table WHERE table_name='Z0CASE';
ALTER TABLE Z0CASE PARTITION BY HASH(Z0_TEST0)  (PARTITION part_1,  PARTITION part_2);
SELECT PARTITION_NAME,TABLE_ROWS,PARTITION_DESCRIPTION FROM INFORMATION_SCHEMA.PARTITIONS WHERE TABLE_SCHEMA=SCHEMA() AND TABLE_NAME = 'Z0CASE' ORDER BY PARTITION_NAME;
PARTITION_NAME	TABLE_ROWS	PARTITION_DESCRIPTION
part_1	NULL	NULL
part_2	NULL	NULL
SELECT table_id,table_name FROM oceanbase.__all_virtual_table WHERE table_name='Z0CASE';
DROP TABLE Z0CASE;
CREATE TABLE Z0CASE (Z0_TEST0 INT,Z0_TEST1 BIGINT ) with column group (all columns, each column);
INSERT INTO  Z0CASE (Z0_TEST0,Z0_TEST1)VALUES('-1.00','-111');
INSERT INTO  Z0CASE (Z0_TEST0,Z0_TEST1)VALUES('1.00','1.00');
INSERT INTO  Z0CASE (Z0_TEST0,Z0_TEST1)VALUES('2.22','2');
INSERT INTO  Z0CASE (Z0_TEST0,Z0_TEST1)VALUES('30','30');
INSERT INTO  Z0CASE (Z0_TEST0,Z0_TEST1)VALUES('111','111');
SELECT table_id,table_name FROM oceanbase.__all_virtual_table WHERE table_name='Z0CASE';
ALTER TABLE Z0CASE PARTITION BY LIST(Z0_TEST0)
SUBPARTITION BY RANGE(Z0_TEST0) SUBPARTITION template
(SUBPARTITION sp0 VALUES LESS THAN(10),
SUBPARTITION sp1 VALUES LESS THAN(100),
SUBPARTITION sp2 VALUES LESS THAN(112) )
( PARTITION part_1 VALUES IN ( 1, 2 ,-1),
PARTITION part_2 VALUES IN ( 30, 4,111 ));
SELECT PARTITION_NAME,TABLE_ROWS,PARTITION_DESCRIPTION FROM INFORMATION_SCHEMA.PARTITIONS WHERE TABLE_SCHEMA=SCHEMA() AND TABLE_NAME = 'Z0CASE' ORDER BY PARTITION_NAME;
PARTITION_NAME	TABLE_ROWS	PARTITION_DESCRIPTION
part_1	NULL	-1,1,2
part_1	NULL	-1,1,2
part_1	NULL	-1,1,2
part_2	NULL	4,30,111
part_2	NULL	4,30,111
part_2	NULL	4,30,111
SELECT table_id,table_name FROM oceanbase.__all_virtual_table WHERE table_name='Z0CASE';
ALTER TABLE Z0CASE PARTITION BY LIST(Z0_TEST0 - Z0_TEST1)
( PARTITION part_1 VALUES IN ( 1, 2 ,-1),
PARTITION part_2 VALUES IN ( 110, 4 ,111),
PARTITION part_3 VALUES IN ( -110,22,0));
SELECT PARTITION_NAME,TABLE_ROWS,PARTITION_DESCRIPTION FROM INFORMATION_SCHEMA.PARTITIONS WHERE TABLE_SCHEMA=SCHEMA() AND TABLE_NAME = 'Z0CASE' ORDER BY PARTITION_NAME;
PARTITION_NAME	TABLE_ROWS	PARTITION_DESCRIPTION
part_1	NULL	-1,1,2
part_2	NULL	4,110,111
part_3	NULL	-110,0,22
SELECT table_id,table_name FROM oceanbase.__all_virtual_table WHERE table_name='Z0CASE';
DROP TABLE Z0CASE;
CREATE TABLE Z0CASE (Z0_TEST0 INT,Z0_TEST1 BIGINT ) with column group (all columns, each column);
INSERT INTO  Z0CASE (Z0_TEST0,Z0_TEST1)VALUES('-1.00','-111');
INSERT INTO  Z0CASE (Z0_TEST0,Z0_TEST1)VALUES('1.00','111');
INSERT INTO  Z0CASE (Z0_TEST0,Z0_TEST1)VALUES('2.22','2');
INSERT INTO  Z0CASE (Z0_TEST0,Z0_TEST1)VALUES('30','30');
INSERT INTO  Z0CASE (Z0_TEST0,Z0_TEST1)VALUES('111','111');
SELECT table_id,table_name FROM oceanbase.__all_virtual_table WHERE table_name='Z0CASE';
ALTER TABLE Z0CASE PARTITION BY LIST(Z0_TEST0)
SUBPARTITION BY HASH(Z0_TEST0) SUBPARTITION template
(SUBPARTITION part_1,
SUBPARTITION part_2)
(PARTITION part_1 VALUES IN ( 1, 2 ,-1,0),
PARTITION part_2 VALUES IN ( 30, 111 ));
SELECT PARTITION_NAME,TABLE_ROWS,PARTITION_DESCRIPTION FROM INFORMATION_SCHEMA.PARTITIONS WHERE TABLE_SCHEMA=SCHEMA() AND TABLE_NAME = 'Z0CASE' ORDER BY PARTITION_NAME;
PARTITION_NAME	TABLE_ROWS	PARTITION_DESCRIPTION
part_1	NULL	-1,0,1,2
part_1	NULL	-1,0,1,2
part_2	NULL	30,111
part_2	NULL	30,111
SELECT table_id,table_name FROM oceanbase.__all_virtual_table WHERE table_name='Z0CASE';
ALTER TABLE Z0CASE PARTITION BY KEY(Z0_TEST0)  (PARTITION part_1,  PARTITION part_2);
SELECT PARTITION_NAME,TABLE_ROWS,PARTITION_DESCRIPTION FROM INFORMATION_SCHEMA.PARTITIONS WHERE TABLE_SCHEMA=SCHEMA() AND TABLE_NAME = 'Z0CASE' ORDER BY PARTITION_NAME;
PARTITION_NAME	TABLE_ROWS	PARTITION_DESCRIPTION
part_1	NULL	NULL
part_2	NULL	NULL
SELECT table_id,table_name FROM oceanbase.__all_virtual_table WHERE table_name='Z0CASE';
DROP TABLE Z0CASE;
CREATE TABLE Z0CASE (Z0_TEST0 INT,Z0_TEST1 BIGINT ) with column group (all columns, each column);
INSERT INTO  Z0CASE (Z0_TEST0,Z0_TEST1)VALUES('-1.00','-111');
INSERT INTO  Z0CASE (Z0_TEST0,Z0_TEST1)VALUES('1.00','111');
INSERT INTO  Z0CASE (Z0_TEST0,Z0_TEST1)VALUES('2.22','2');
INSERT INTO  Z0CASE (Z0_TEST0,Z0_TEST1)VALUES('30','30');
INSERT INTO  Z0CASE (Z0_TEST0,Z0_TEST1)VALUES('111','111');
SELECT table_id,table_name FROM oceanbase.__all_virtual_table WHERE table_name='Z0CASE';
ALTER TABLE Z0CASE PARTITION BY LIST(Z0_TEST0)
SUBPARTITION BY HASH(Z0_TEST0) SUBPARTITION template (SUBPARTITION part_1,  SUBPARTITION part_2)
(PARTITION part_1 VALUES IN ( 1, 2 ,-1,0),
PARTITION part_2 VALUES IN ( 30, 111 ));
SELECT PARTITION_NAME,TABLE_ROWS,PARTITION_DESCRIPTION FROM INFORMATION_SCHEMA.PARTITIONS WHERE TABLE_SCHEMA=SCHEMA() AND TABLE_NAME = 'Z0CASE' ORDER BY PARTITION_NAME;
PARTITION_NAME	TABLE_ROWS	PARTITION_DESCRIPTION
part_1	NULL	-1,0,1,2
part_1	NULL	-1,0,1,2
part_2	NULL	30,111
part_2	NULL	30,111
SELECT table_id,table_name FROM oceanbase.__all_virtual_table WHERE table_name='Z0CASE';
ALTER TABLE Z0CASE PARTITION BY RANGE(Z0_TEST0)
( PARTITION part_1 VALUES LESS THAN (-1 ),
PARTITION part_2 VALUES LESS THAN (10 ),
PARTITION part_3 VALUES LESS THAN ( MAXVALUE ));
SELECT PARTITION_NAME,TABLE_ROWS,PARTITION_DESCRIPTION FROM INFORMATION_SCHEMA.PARTITIONS WHERE TABLE_SCHEMA=SCHEMA() AND TABLE_NAME = 'Z0CASE' ORDER BY PARTITION_NAME;
PARTITION_NAME	TABLE_ROWS	PARTITION_DESCRIPTION
part_1	NULL	-1
part_2	NULL	10
part_3	NULL	MAXVALUE
SELECT table_id,table_name FROM oceanbase.__all_virtual_table WHERE table_name='Z0CASE';
DROP TABLE Z0CASE;
SET sql_mode='STRICT_TRANS_TABLES,STRICT_ALL_TABLES';
