result_format: 4
drop user 'zc_gis_mysql'@'%';
create user 'zc_gis_mysql'@'%' IDENTIFIED BY 'zc_gis_mysql';
grant all on *.* to 'zc_gis_mysql'@'%' WITH GRANT OPTION;
####添加srs#####




######################事务####################
#####单分区事务######
DROP TABLE IF EXISTS T_GEO_SW;
create table T_GEO_SW (gid int auto_increment primary key, geo geometry SRID 4326,geo_c GEOMETRYCOLLECTION SRID 26918,poi point,LIN linestring ,pol polygon ,M_POI MULTIPOINT,M_LIN MULTILINESTRING,M_POL MULTIPOLYGON);
BEGIN;
INSERT INTO T_GEO_SW(GEO,GEO_C,POI,LIN,POL,M_POI,M_LIN,M_POL) VALUES (ST_GEOMFROMTEXT('POLYGON((0 0,1 1,1 0,0 1,0 0))',4326),ST_GEOMFROMTEXT('GEOMETRYCOLLECTION empty',26918),ST_GEOMFROMTEXT('POINT(1E-16 1E-15)'),ST_GEOMFROMTEXT('linestring(1 1,1 1)'),ST_GEOMFROMTEXT('polygon((1 1,1 1,1 1,1 1))'),ST_GEOMFROMTEXT('MULTIPOINT (1 1, 2 2, 3 3)'),ST_GEOMFROMTEXT('MULTILINESTRING((10 10, 20 20), (15 15, 30 15))'),ST_GEOMFROMTEXT('MULTIPOLYGON(((1 1,1 1,1 1,1 1)),((1 1,1 1,1 1,1 1)))'));
SELECT ST_ASTEXT(GEO),ST_ASTEXT(GEO_C),ST_ASTEXT(POI),ST_ASTEXT(LIN),ST_ASTEXT(POL),ST_ASTEXT(M_POI),ST_ASTEXT(M_LIN),ST_ASTEXT(M_POL) FROM T_GEO_SW;
+--------------------------------+--------------------------+--------------------------------+---------------------+----------------------------+-------------------------------+----------------------------------------------+-------------------------------------------------------+
| ST_ASTEXT(GEO)                 | ST_ASTEXT(GEO_C)         | ST_ASTEXT(POI)                 | ST_ASTEXT(LIN)      | ST_ASTEXT(POL)             | ST_ASTEXT(M_POI)              | ST_ASTEXT(M_LIN)                             | ST_ASTEXT(M_POL)                                      |
+--------------------------------+--------------------------+--------------------------------+---------------------+----------------------------+-------------------------------+----------------------------------------------+-------------------------------------------------------+
| POLYGON((0 0,1 1,1 0,0 1,0 0)) | GEOMETRYCOLLECTION EMPTY | POINT(1e-16 0.000000000000001) | LINESTRING(1 1,1 1) | POLYGON((1 1,1 1,1 1,1 1)) | MULTIPOINT((1 1),(2 2),(3 3)) | MULTILINESTRING((10 10,20 20),(15 15,30 15)) | MULTIPOLYGON(((1 1,1 1,1 1,1 1)),((1 1,1 1,1 1,1 1))) |
+--------------------------------+--------------------------+--------------------------------+---------------------+----------------------------+-------------------------------+----------------------------------------------+-------------------------------------------------------+
ROLLBACK;
SELECT ST_ASTEXT(GEO),ST_ASTEXT(GEO_C),ST_ASTEXT(POI),ST_ASTEXT(LIN),ST_ASTEXT(POL),ST_ASTEXT(M_POI),ST_ASTEXT(M_LIN),ST_ASTEXT(M_POL) FROM T_GEO_SW;
+----------------+------------------+----------------+----------------+----------------+------------------+------------------+------------------+
| ST_ASTEXT(GEO) | ST_ASTEXT(GEO_C) | ST_ASTEXT(POI) | ST_ASTEXT(LIN) | ST_ASTEXT(POL) | ST_ASTEXT(M_POI) | ST_ASTEXT(M_LIN) | ST_ASTEXT(M_POL) |
+----------------+------------------+----------------+----------------+----------------+------------------+------------------+------------------+
+----------------+------------------+----------------+----------------+----------------+------------------+------------------+------------------+
BEGIN;
INSERT INTO T_GEO_SW(GEO,GEO_C,POI,LIN,POL,M_POI,M_LIN,M_POL) VALUES (ST_GEOMFROMTEXT('POLYGON((0 0,1 1,1 0,0 1,0 0))',4326),ST_GEOMFROMTEXT('GEOMETRYCOLLECTION empty',26918),ST_GEOMFROMTEXT('POINT(1E-16 1E-15)'),ST_GEOMFROMTEXT('linestring(1 1,1 1)'),ST_GEOMFROMTEXT('polygon((1 1,1 1,1 1,1 1))'),ST_GEOMFROMTEXT('MULTIPOINT (1 1, 2 2, 3 3)'),ST_GEOMFROMTEXT('MULTILINESTRING((10 10, 20 20), (15 15, 30 15))'),ST_GEOMFROMTEXT('MULTIPOLYGON(((1 1,1 1,1 1,1 1)),((1 1,1 1,1 1,1 1)))'));
SELECT ST_ASTEXT(GEO),ST_ASTEXT(GEO_C),ST_ASTEXT(POI),ST_ASTEXT(LIN),ST_ASTEXT(POL),ST_ASTEXT(M_POI),ST_ASTEXT(M_LIN),ST_ASTEXT(M_POL) FROM T_GEO_SW;
+--------------------------------+--------------------------+--------------------------------+---------------------+----------------------------+-------------------------------+----------------------------------------------+-------------------------------------------------------+
| ST_ASTEXT(GEO)                 | ST_ASTEXT(GEO_C)         | ST_ASTEXT(POI)                 | ST_ASTEXT(LIN)      | ST_ASTEXT(POL)             | ST_ASTEXT(M_POI)              | ST_ASTEXT(M_LIN)                             | ST_ASTEXT(M_POL)                                      |
+--------------------------------+--------------------------+--------------------------------+---------------------+----------------------------+-------------------------------+----------------------------------------------+-------------------------------------------------------+
| POLYGON((0 0,1 1,1 0,0 1,0 0)) | GEOMETRYCOLLECTION EMPTY | POINT(1e-16 0.000000000000001) | LINESTRING(1 1,1 1) | POLYGON((1 1,1 1,1 1,1 1)) | MULTIPOINT((1 1),(2 2),(3 3)) | MULTILINESTRING((10 10,20 20),(15 15,30 15)) | MULTIPOLYGON(((1 1,1 1,1 1,1 1)),((1 1,1 1,1 1,1 1))) |
+--------------------------------+--------------------------+--------------------------------+---------------------+----------------------------+-------------------------------+----------------------------------------------+-------------------------------------------------------+
COMMIT;
SELECT ST_ASTEXT(GEO),ST_ASTEXT(GEO_C),ST_ASTEXT(POI),ST_ASTEXT(LIN),ST_ASTEXT(POL),ST_ASTEXT(M_POI),ST_ASTEXT(M_LIN),ST_ASTEXT(M_POL) FROM T_GEO_SW;
+--------------------------------+--------------------------+--------------------------------+---------------------+----------------------------+-------------------------------+----------------------------------------------+-------------------------------------------------------+
| ST_ASTEXT(GEO)                 | ST_ASTEXT(GEO_C)         | ST_ASTEXT(POI)                 | ST_ASTEXT(LIN)      | ST_ASTEXT(POL)             | ST_ASTEXT(M_POI)              | ST_ASTEXT(M_LIN)                             | ST_ASTEXT(M_POL)                                      |
+--------------------------------+--------------------------+--------------------------------+---------------------+----------------------------+-------------------------------+----------------------------------------------+-------------------------------------------------------+
| POLYGON((0 0,1 1,1 0,0 1,0 0)) | GEOMETRYCOLLECTION EMPTY | POINT(1e-16 0.000000000000001) | LINESTRING(1 1,1 1) | POLYGON((1 1,1 1,1 1,1 1)) | MULTIPOINT((1 1),(2 2),(3 3)) | MULTILINESTRING((10 10,20 20),(15 15,30 15)) | MULTIPOLYGON(((1 1,1 1,1 1,1 1)),((1 1,1 1,1 1,1 1))) |
+--------------------------------+--------------------------+--------------------------------+---------------------+----------------------------+-------------------------------+----------------------------------------------+-------------------------------------------------------+
BEGIN;
UPDATE T_GEO_SW SET GEO=ST_GEOMFROMTEXT('POINT(1 1)',4326),GEO_C=ST_GEOMFROMTEXT('GEOMETRYCOLLECTION empty',26918),POI=ST_GEOMFROMTEXT('point(1e-17 -1e-17)'),LIN=ST_GEOMFROMTEXT('linestring(0 0,1 1,1 0,0 0)'),POL=ST_GEOMFROMTEXT('POLYGON((1 1,1 1,1 1,1 1),(0 0,0 0,0 0,0 0))'),M_POI=ST_GEOMFROMTEXT('MULTIPOINT (3 3, 2 2, 1 1)'),M_LIN=ST_GEOMFROMTEXT('MULTILINESTRING((66 66, 66 66), (66 66, 66 66))'),M_POL=ST_GEOMFROMTEXT('MULTIPOLYGON(((108.8448587 34.2715468, 108.7816873 34.0818121, 109.1009774 34.0795373, 109.0961709 34.2704119, 108.8448587 34.2715468)),((108.9166131 34.2701282, 108.7892404 34.1880934, 108.9385858 34.142926, 108.9166131 34.2701282)))') WHERE GEO=(ST_GEOMFROMTEXT('POLYGON((0 0,1 1,1 0,0 1,0 0))',4326));
SELECT ST_ASTEXT(GEO),ST_ASTEXT(GEO_C),ST_ASTEXT(POI),ST_ASTEXT(LIN),ST_ASTEXT(POL),ST_ASTEXT(M_POI),ST_ASTEXT(M_LIN),ST_ASTEXT(M_POL) FROM T_GEO_SW;
+----------------+--------------------------+---------------------+-----------------------------+----------------------------------------------+-------------------------------+----------------------------------------------+-------------------------------------------------------------------------------------------------------------------------------------------------------------------------------------------------------------------------------------+
| ST_ASTEXT(GEO) | ST_ASTEXT(GEO_C)         | ST_ASTEXT(POI)      | ST_ASTEXT(LIN)              | ST_ASTEXT(POL)                               | ST_ASTEXT(M_POI)              | ST_ASTEXT(M_LIN)                             | ST_ASTEXT(M_POL)                                                                                                                                                                                                                    |
+----------------+--------------------------+---------------------+-----------------------------+----------------------------------------------+-------------------------------+----------------------------------------------+-------------------------------------------------------------------------------------------------------------------------------------------------------------------------------------------------------------------------------------+
| POINT(1 1)     | GEOMETRYCOLLECTION EMPTY | POINT(1e-17 -1e-17) | LINESTRING(0 0,1 1,1 0,0 0) | POLYGON((1 1,1 1,1 1,1 1),(0 0,0 0,0 0,0 0)) | MULTIPOINT((3 3),(2 2),(1 1)) | MULTILINESTRING((66 66,66 66),(66 66,66 66)) | MULTIPOLYGON(((108.8448587 34.2715468,108.7816873 34.0818121,109.1009774 34.0795373,109.0961709 34.2704119,108.8448587 34.2715468)),((108.9166131 34.2701282,108.7892404 34.1880934,108.9385858 34.142926,108.9166131 34.2701282))) |
+----------------+--------------------------+---------------------+-----------------------------+----------------------------------------------+-------------------------------+----------------------------------------------+-------------------------------------------------------------------------------------------------------------------------------------------------------------------------------------------------------------------------------------+
ROLLBACK;
SELECT ST_ASTEXT(GEO),ST_ASTEXT(GEO_C),ST_ASTEXT(POI),ST_ASTEXT(LIN),ST_ASTEXT(POL),ST_ASTEXT(M_POI),ST_ASTEXT(M_LIN),ST_ASTEXT(M_POL) FROM T_GEO_SW;
+--------------------------------+--------------------------+--------------------------------+---------------------+----------------------------+-------------------------------+----------------------------------------------+-------------------------------------------------------+
| ST_ASTEXT(GEO)                 | ST_ASTEXT(GEO_C)         | ST_ASTEXT(POI)                 | ST_ASTEXT(LIN)      | ST_ASTEXT(POL)             | ST_ASTEXT(M_POI)              | ST_ASTEXT(M_LIN)                             | ST_ASTEXT(M_POL)                                      |
+--------------------------------+--------------------------+--------------------------------+---------------------+----------------------------+-------------------------------+----------------------------------------------+-------------------------------------------------------+
| POLYGON((0 0,1 1,1 0,0 1,0 0)) | GEOMETRYCOLLECTION EMPTY | POINT(1e-16 0.000000000000001) | LINESTRING(1 1,1 1) | POLYGON((1 1,1 1,1 1,1 1)) | MULTIPOINT((1 1),(2 2),(3 3)) | MULTILINESTRING((10 10,20 20),(15 15,30 15)) | MULTIPOLYGON(((1 1,1 1,1 1,1 1)),((1 1,1 1,1 1,1 1))) |
+--------------------------------+--------------------------+--------------------------------+---------------------+----------------------------+-------------------------------+----------------------------------------------+-------------------------------------------------------+
BEGIN;
UPDATE T_GEO_SW SET GEO=ST_GEOMFROMTEXT('POINT(1 1)',4326),GEO_C=ST_GEOMFROMTEXT('GEOMETRYCOLLECTION empty',26918),POI=ST_GEOMFROMTEXT('point(1e-17 -1e-17)'),LIN=ST_GEOMFROMTEXT('linestring(0 0,1 1,1 0,0 0)'),POL=ST_GEOMFROMTEXT('POLYGON((1 1,1 1,1 1,1 1),(0 0,0 0,0 0,0 0))'),M_POI=ST_GEOMFROMTEXT('MULTIPOINT (3 3, 2 2, 1 1)'),M_LIN=ST_GEOMFROMTEXT('MULTILINESTRING((66 66, 66 66), (66 66, 66 66))'),M_POL=ST_GEOMFROMTEXT('MULTIPOLYGON(((108.8448587 34.2715468, 108.7816873 34.0818121, 109.1009774 34.0795373, 109.0961709 34.2704119, 108.8448587 34.2715468)),((108.9166131 34.2701282, 108.7892404 34.1880934, 108.9385858 34.142926, 108.9166131 34.2701282)))') WHERE GEO=(ST_GEOMFROMTEXT('POLYGON((0 0,1 1,1 0,0 1,0 0))',4326));
SELECT ST_ASTEXT(GEO),ST_ASTEXT(GEO_C),ST_ASTEXT(POI),ST_ASTEXT(LIN),ST_ASTEXT(POL),ST_ASTEXT(M_POI),ST_ASTEXT(M_LIN),ST_ASTEXT(M_POL) FROM T_GEO_SW;
+----------------+--------------------------+---------------------+-----------------------------+----------------------------------------------+-------------------------------+----------------------------------------------+-------------------------------------------------------------------------------------------------------------------------------------------------------------------------------------------------------------------------------------+
| ST_ASTEXT(GEO) | ST_ASTEXT(GEO_C)         | ST_ASTEXT(POI)      | ST_ASTEXT(LIN)              | ST_ASTEXT(POL)                               | ST_ASTEXT(M_POI)              | ST_ASTEXT(M_LIN)                             | ST_ASTEXT(M_POL)                                                                                                                                                                                                                    |
+----------------+--------------------------+---------------------+-----------------------------+----------------------------------------------+-------------------------------+----------------------------------------------+-------------------------------------------------------------------------------------------------------------------------------------------------------------------------------------------------------------------------------------+
| POINT(1 1)     | GEOMETRYCOLLECTION EMPTY | POINT(1e-17 -1e-17) | LINESTRING(0 0,1 1,1 0,0 0) | POLYGON((1 1,1 1,1 1,1 1),(0 0,0 0,0 0,0 0)) | MULTIPOINT((3 3),(2 2),(1 1)) | MULTILINESTRING((66 66,66 66),(66 66,66 66)) | MULTIPOLYGON(((108.8448587 34.2715468,108.7816873 34.0818121,109.1009774 34.0795373,109.0961709 34.2704119,108.8448587 34.2715468)),((108.9166131 34.2701282,108.7892404 34.1880934,108.9385858 34.142926,108.9166131 34.2701282))) |
+----------------+--------------------------+---------------------+-----------------------------+----------------------------------------------+-------------------------------+----------------------------------------------+-------------------------------------------------------------------------------------------------------------------------------------------------------------------------------------------------------------------------------------+
COMMIT;
SELECT ST_ASTEXT(GEO),ST_ASTEXT(GEO_C),ST_ASTEXT(POI),ST_ASTEXT(LIN),ST_ASTEXT(POL),ST_ASTEXT(M_POI),ST_ASTEXT(M_LIN),ST_ASTEXT(M_POL) FROM T_GEO_SW;
+----------------+--------------------------+---------------------+-----------------------------+----------------------------------------------+-------------------------------+----------------------------------------------+-------------------------------------------------------------------------------------------------------------------------------------------------------------------------------------------------------------------------------------+
| ST_ASTEXT(GEO) | ST_ASTEXT(GEO_C)         | ST_ASTEXT(POI)      | ST_ASTEXT(LIN)              | ST_ASTEXT(POL)                               | ST_ASTEXT(M_POI)              | ST_ASTEXT(M_LIN)                             | ST_ASTEXT(M_POL)                                                                                                                                                                                                                    |
+----------------+--------------------------+---------------------+-----------------------------+----------------------------------------------+-------------------------------+----------------------------------------------+-------------------------------------------------------------------------------------------------------------------------------------------------------------------------------------------------------------------------------------+
| POINT(1 1)     | GEOMETRYCOLLECTION EMPTY | POINT(1e-17 -1e-17) | LINESTRING(0 0,1 1,1 0,0 0) | POLYGON((1 1,1 1,1 1,1 1),(0 0,0 0,0 0,0 0)) | MULTIPOINT((3 3),(2 2),(1 1)) | MULTILINESTRING((66 66,66 66),(66 66,66 66)) | MULTIPOLYGON(((108.8448587 34.2715468,108.7816873 34.0818121,109.1009774 34.0795373,109.0961709 34.2704119,108.8448587 34.2715468)),((108.9166131 34.2701282,108.7892404 34.1880934,108.9385858 34.142926,108.9166131 34.2701282))) |
+----------------+--------------------------+---------------------+-----------------------------+----------------------------------------------+-------------------------------+----------------------------------------------+-------------------------------------------------------------------------------------------------------------------------------------------------------------------------------------------------------------------------------------+
BEGIN;
DELETE FROM T_GEO_SW WHERE GEO=ST_GEOMFROMTEXT('POINT(1 1)',4326);
ROLLBACK;
SELECT ST_ASTEXT(GEO),ST_ASTEXT(GEO_C),ST_ASTEXT(POI),ST_ASTEXT(LIN),ST_ASTEXT(POL),ST_ASTEXT(M_POI),ST_ASTEXT(M_LIN),ST_ASTEXT(M_POL) FROM T_GEO_SW;
+----------------+--------------------------+---------------------+-----------------------------+----------------------------------------------+-------------------------------+----------------------------------------------+-------------------------------------------------------------------------------------------------------------------------------------------------------------------------------------------------------------------------------------+
| ST_ASTEXT(GEO) | ST_ASTEXT(GEO_C)         | ST_ASTEXT(POI)      | ST_ASTEXT(LIN)              | ST_ASTEXT(POL)                               | ST_ASTEXT(M_POI)              | ST_ASTEXT(M_LIN)                             | ST_ASTEXT(M_POL)                                                                                                                                                                                                                    |
+----------------+--------------------------+---------------------+-----------------------------+----------------------------------------------+-------------------------------+----------------------------------------------+-------------------------------------------------------------------------------------------------------------------------------------------------------------------------------------------------------------------------------------+
| POINT(1 1)     | GEOMETRYCOLLECTION EMPTY | POINT(1e-17 -1e-17) | LINESTRING(0 0,1 1,1 0,0 0) | POLYGON((1 1,1 1,1 1,1 1),(0 0,0 0,0 0,0 0)) | MULTIPOINT((3 3),(2 2),(1 1)) | MULTILINESTRING((66 66,66 66),(66 66,66 66)) | MULTIPOLYGON(((108.8448587 34.2715468,108.7816873 34.0818121,109.1009774 34.0795373,109.0961709 34.2704119,108.8448587 34.2715468)),((108.9166131 34.2701282,108.7892404 34.1880934,108.9385858 34.142926,108.9166131 34.2701282))) |
+----------------+--------------------------+---------------------+-----------------------------+----------------------------------------------+-------------------------------+----------------------------------------------+-------------------------------------------------------------------------------------------------------------------------------------------------------------------------------------------------------------------------------------+
BEGIN;
DELETE FROM T_GEO_SW WHERE GEO=ST_GEOMFROMTEXT('POINT(1 1)',4326);
COMMIT;
SELECT ST_ASTEXT(GEO),ST_ASTEXT(GEO_C),ST_ASTEXT(POI),ST_ASTEXT(LIN),ST_ASTEXT(POL),ST_ASTEXT(M_POI),ST_ASTEXT(M_LIN),ST_ASTEXT(M_POL) FROM T_GEO_SW;
+----------------+------------------+----------------+----------------+----------------+------------------+------------------+------------------+
| ST_ASTEXT(GEO) | ST_ASTEXT(GEO_C) | ST_ASTEXT(POI) | ST_ASTEXT(LIN) | ST_ASTEXT(POL) | ST_ASTEXT(M_POI) | ST_ASTEXT(M_LIN) | ST_ASTEXT(M_POL) |
+----------------+------------------+----------------+----------------+----------------+------------------+------------------+------------------+
+----------------+------------------+----------------+----------------+----------------+------------------+------------------+------------------+
########SAVEPOINT########
BEGIN;
SAVEPOINT A;
INSERT INTO T_GEO_SW(GEO,GEO_C,POI,LIN,POL,M_POI,M_LIN,M_POL) VALUES (ST_GEOMFROMTEXT('POLYGON((0 0,1 1,1 0,0 1,0 0))',4326),ST_GEOMFROMTEXT('GEOMETRYCOLLECTION empty',26918),ST_GEOMFROMTEXT('POINT(1E-16 1E-15)'),ST_GEOMFROMTEXT('linestring(1 1,1 1)'),ST_GEOMFROMTEXT('polygon((1 1,1 1,1 1,1 1))'),ST_GEOMFROMTEXT('MULTIPOINT (1 1, 2 2, 3 3)'),ST_GEOMFROMTEXT('MULTILINESTRING((10 10, 20 20), (15 15, 30 15))'),ST_GEOMFROMTEXT('MULTIPOLYGON(((1 1,1 1,1 1,1 1)),((1 1,1 1,1 1,1 1)))'));
SAVEPOINT B;
UPDATE T_GEO_SW SET GEO=ST_GEOMFROMTEXT('POINT(1 1)',4326),GEO_C=ST_GEOMFROMTEXT('GEOMETRYCOLLECTION empty',26918),POI=ST_GEOMFROMTEXT('point(1e-17 -1e-17)'),LIN=ST_GEOMFROMTEXT('linestring(0 0,1 1,1 0,0 0)'),POL=ST_GEOMFROMTEXT('POLYGON((1 1,1 1,1 1,1 1),(0 0,0 0,0 0,0 0))'),M_POI=ST_GEOMFROMTEXT('MULTIPOINT (3 3, 2 2, 1 1)'),M_LIN=ST_GEOMFROMTEXT('MULTILINESTRING((66 66, 66 66), (66 66, 66 66))'),M_POL=ST_GEOMFROMTEXT('MULTIPOLYGON(((108.8448587 34.2715468, 108.7816873 34.0818121, 109.1009774 34.0795373, 109.0961709 34.2704119, 108.8448587 34.2715468)),((108.9166131 34.2701282, 108.7892404 34.1880934, 108.9385858 34.142926, 108.9166131 34.2701282)))') WHERE GEO=(ST_GEOMFROMTEXT('POLYGON((0 0,1 1,1 0,0 1,0 0))',4326));
SAVEPOINT C;
DELETE FROM T_GEO_SW WHERE GEO=ST_GEOMFROMTEXT('POINT(1 1)',4326);
SELECT ST_ASTEXT(GEO),ST_ASTEXT(GEO_C),ST_ASTEXT(POI),ST_ASTEXT(LIN),ST_ASTEXT(POL),ST_ASTEXT(M_POI),ST_ASTEXT(M_LIN),ST_ASTEXT(M_POL) FROM T_GEO_SW;
+----------------+------------------+----------------+----------------+----------------+------------------+------------------+------------------+
| ST_ASTEXT(GEO) | ST_ASTEXT(GEO_C) | ST_ASTEXT(POI) | ST_ASTEXT(LIN) | ST_ASTEXT(POL) | ST_ASTEXT(M_POI) | ST_ASTEXT(M_LIN) | ST_ASTEXT(M_POL) |
+----------------+------------------+----------------+----------------+----------------+------------------+------------------+------------------+
+----------------+------------------+----------------+----------------+----------------+------------------+------------------+------------------+
ROLLBACK TO B;
SELECT ST_ASTEXT(GEO),ST_ASTEXT(GEO_C),ST_ASTEXT(POI),ST_ASTEXT(LIN),ST_ASTEXT(POL),ST_ASTEXT(M_POI),ST_ASTEXT(M_LIN),ST_ASTEXT(M_POL) FROM T_GEO_SW;
+--------------------------------+--------------------------+--------------------------------+---------------------+----------------------------+-------------------------------+----------------------------------------------+-------------------------------------------------------+
| ST_ASTEXT(GEO)                 | ST_ASTEXT(GEO_C)         | ST_ASTEXT(POI)                 | ST_ASTEXT(LIN)      | ST_ASTEXT(POL)             | ST_ASTEXT(M_POI)              | ST_ASTEXT(M_LIN)                             | ST_ASTEXT(M_POL)                                      |
+--------------------------------+--------------------------+--------------------------------+---------------------+----------------------------+-------------------------------+----------------------------------------------+-------------------------------------------------------+
| POLYGON((0 0,1 1,1 0,0 1,0 0)) | GEOMETRYCOLLECTION EMPTY | POINT(1e-16 0.000000000000001) | LINESTRING(1 1,1 1) | POLYGON((1 1,1 1,1 1,1 1)) | MULTIPOINT((1 1),(2 2),(3 3)) | MULTILINESTRING((10 10,20 20),(15 15,30 15)) | MULTIPOLYGON(((1 1,1 1,1 1,1 1)),((1 1,1 1,1 1,1 1))) |
+--------------------------------+--------------------------+--------------------------------+---------------------+----------------------------+-------------------------------+----------------------------------------------+-------------------------------------------------------+
ROLLBACK TO A;
SELECT ST_ASTEXT(GEO),ST_ASTEXT(GEO_C),ST_ASTEXT(POI),ST_ASTEXT(LIN),ST_ASTEXT(POL),ST_ASTEXT(M_POI),ST_ASTEXT(M_LIN),ST_ASTEXT(M_POL) FROM T_GEO_SW;
+----------------+------------------+----------------+----------------+----------------+------------------+------------------+------------------+
| ST_ASTEXT(GEO) | ST_ASTEXT(GEO_C) | ST_ASTEXT(POI) | ST_ASTEXT(LIN) | ST_ASTEXT(POL) | ST_ASTEXT(M_POI) | ST_ASTEXT(M_LIN) | ST_ASTEXT(M_POL) |
+----------------+------------------+----------------+----------------+----------------+------------------+------------------+------------------+
+----------------+------------------+----------------+----------------+----------------+------------------+------------------+------------------+
COMMIT;
SELECT ST_ASTEXT(GEO),ST_ASTEXT(GEO_C),ST_ASTEXT(POI),ST_ASTEXT(LIN),ST_ASTEXT(POL),ST_ASTEXT(M_POI),ST_ASTEXT(M_LIN),ST_ASTEXT(M_POL) FROM T_GEO_SW;
+----------------+------------------+----------------+----------------+----------------+------------------+------------------+------------------+
| ST_ASTEXT(GEO) | ST_ASTEXT(GEO_C) | ST_ASTEXT(POI) | ST_ASTEXT(LIN) | ST_ASTEXT(POL) | ST_ASTEXT(M_POI) | ST_ASTEXT(M_LIN) | ST_ASTEXT(M_POL) |
+----------------+------------------+----------------+----------------+----------------+------------------+------------------+------------------+
+----------------+------------------+----------------+----------------+----------------+------------------+------------------+------------------+
############单机多分区############
DROP TABLE IF EXISTS T_GEO_SW;
create table T_GEO_SW (gid int primary key, geo geometry SRID 4326,geo_c GEOMETRYCOLLECTION SRID 26918,poi point,LIN linestring ,pol polygon ,M_POI MULTIPOINT,M_LIN MULTILINESTRING,M_POL MULTIPOLYGON)  PARTITION BY RANGE (GID) (PARTITION P1 VALUES LESS THAN (3),PARTITION P2 VALUES LESS THAN (6),PARTITION P3 VALUES LESS THAN MAXVALUE);
DROP PROCEDURE IF EXISTS PRO_INSERT;
CREATE PROCEDURE PRO_INSERT()
BEGIN
	INSERT INTO T_GEO_SW(GID,GEO,GEO_C,POI,LIN,POL,M_POI,M_LIN,M_POL) VALUES(1,
	ST_GEOMFROMTEXT('POLYGON((0 0,1 1,1 0,0 1,0 0))',4326),
	ST_GEOMFROMTEXT('GEOMETRYCOLLECTION empty',26918),
	ST_GEOMFROMTEXT('POINT(1E-16 1E-15)'),
	ST_GEOMFROMTEXT('linestring(1 1,1 1)'),
	ST_GEOMFROMTEXT('polygon((1 1,1 1,1 1,1 1))'),
	ST_GEOMFROMTEXT('MULTIPOINT (1 1, 2 2, 3 3)'),
	ST_GEOMFROMTEXT('MULTILINESTRING((10 10, 20 20), (15 15, 30 15))'),
	ST_GEOMFROMTEXT('MULTIPOLYGON(((1 1,1 1,1 1,1 1)),((1 1,1 1,1 1,1 1)))'));

	INSERT INTO T_GEO_SW(GID,GEO) VALUES(2,ST_GEOMFROMTEXT('MULTIPOINT (1 2, 2 1, 0 0)',4326));

	INSERT INTO T_GEO_SW(GID,GEO_C) VALUES(3,ST_GEOMFROMTEXT('GEOMETRYCOLLECTION(POINT(10 10), POINT(30 30), LINESTRING(15 15, 20 20))',26918));

	INSERT INTO T_GEO_SW(GID,POI) VALUES(4,ST_GEOMFROMTEXT('POINT(11 11)'));

	INSERT INTO T_GEO_SW(GID,LIN) VALUES(5,ST_GEOMFROMTEXT('linestring(-31.519125652386037 -72.76387666779343,75.01356355093947 8.71197128921537)'));

	INSERT INTO T_GEO_SW(GID,POL) VALUES(6,ST_GEOMFROMTEXT('polygon((108.8448587 34.2715468, 108.7816873 34.0818121, 109.1009774 34.0795373, 109.0961709 34.2704119, 108.8448587 34.2715468),(108.9166131 34.2701282, 108.7892404 34.1880934, 108.9385858 34.142926, 108.9166131 34.2701282))'));

	INSERT INTO T_GEO_SW(GID,M_POI) VALUES(7,ST_GEOMFROMTEXT('MULTIPOINT ((0 0),(1 1))'));

	INSERT INTO T_GEO_SW(GID,M_LIN) VALUES(8,ST_GEOMFROMTEXT('MULTILINESTRING((0 0,1 1,0 0),(0 0,1 1,0 0))'));

	INSERT INTO T_GEO_SW(GID,M_POL) VALUES(9,ST_GEOMFROMTEXT('MULTIPOLYGON(((108.8448587 34.2715468, 108.7816873 34.0818121, 109.1009774 34.0795373, 109.0961709 34.2704119, 108.8448587 34.2715468)),((108.9166131 34.2701282, 108.7892404 34.1880934, 108.9385858 34.142926, 108.9166131 34.2701282)))'));
END;
//
BEGIN;
CALL PRO_INSERT();
##HAVE##
##GEO,ALL##
SELECT ST_ASTEXT(GEO),ST_ASTEXT(GEO_C),ST_ASTEXT(POI),ST_ASTEXT(LIN),ST_ASTEXT(POL),ST_ASTEXT(M_POI),ST_ASTEXT(M_LIN),ST_ASTEXT(M_POL) FROM T_GEO_SW PARTITION(P1);
+--------------------------------+--------------------------+--------------------------------+---------------------+----------------------------+-------------------------------+----------------------------------------------+-------------------------------------------------------+
| ST_ASTEXT(GEO)                 | ST_ASTEXT(GEO_C)         | ST_ASTEXT(POI)                 | ST_ASTEXT(LIN)      | ST_ASTEXT(POL)             | ST_ASTEXT(M_POI)              | ST_ASTEXT(M_LIN)                             | ST_ASTEXT(M_POL)                                      |
+--------------------------------+--------------------------+--------------------------------+---------------------+----------------------------+-------------------------------+----------------------------------------------+-------------------------------------------------------+
| POLYGON((0 0,1 1,1 0,0 1,0 0)) | GEOMETRYCOLLECTION EMPTY | POINT(1e-16 0.000000000000001) | LINESTRING(1 1,1 1) | POLYGON((1 1,1 1,1 1,1 1)) | MULTIPOINT((1 1),(2 2),(3 3)) | MULTILINESTRING((10 10,20 20),(15 15,30 15)) | MULTIPOLYGON(((1 1,1 1,1 1,1 1)),((1 1,1 1,1 1,1 1))) |
| MULTIPOINT((1 2),(2 1),(0 0))  | NULL                     | NULL                           | NULL                | NULL                       | NULL                          | NULL                                         | NULL                                                  |
+--------------------------------+--------------------------+--------------------------------+---------------------+----------------------------+-------------------------------+----------------------------------------------+-------------------------------------------------------+
##GEO_C,POI,LIN##
SELECT ST_ASTEXT(GEO),ST_ASTEXT(GEO_C),ST_ASTEXT(POI),ST_ASTEXT(LIN),ST_ASTEXT(POL),ST_ASTEXT(M_POI),ST_ASTEXT(M_LIN),ST_ASTEXT(M_POL) FROM T_GEO_SW PARTITION(P2);
+----------------+-----------------------------------------------------------------------+----------------+---------------------------------------------------------------------------------------+----------------+------------------+------------------+------------------+
| ST_ASTEXT(GEO) | ST_ASTEXT(GEO_C)                                                      | ST_ASTEXT(POI) | ST_ASTEXT(LIN)                                                                        | ST_ASTEXT(POL) | ST_ASTEXT(M_POI) | ST_ASTEXT(M_LIN) | ST_ASTEXT(M_POL) |
+----------------+-----------------------------------------------------------------------+----------------+---------------------------------------------------------------------------------------+----------------+------------------+------------------+------------------+
| NULL           | GEOMETRYCOLLECTION(POINT(10 10),POINT(30 30),LINESTRING(15 15,20 20)) | NULL           | NULL                                                                                  | NULL           | NULL             | NULL             | NULL             |
| NULL           | NULL                                                                  | POINT(11 11)   | NULL                                                                                  | NULL           | NULL             | NULL             | NULL             |
| NULL           | NULL                                                                  | NULL           | LINESTRING(-31.519125652386037 -72.76387666779343,75.01356355093947 8.71197128921537) | NULL           | NULL             | NULL             | NULL             |
+----------------+-----------------------------------------------------------------------+----------------+---------------------------------------------------------------------------------------+----------------+------------------+------------------+------------------+
##POL,MULTI##
SELECT ST_ASTEXT(GEO),ST_ASTEXT(GEO_C),ST_ASTEXT(POI),ST_ASTEXT(LIN),ST_ASTEXT(POL),ST_ASTEXT(M_POI),ST_ASTEXT(M_LIN),ST_ASTEXT(M_POL) FROM T_GEO_SW PARTITION(P3);
+----------------+------------------+----------------+----------------+----------------------------------------------------------------------------------------------------------------------------------------------------------------------------------------------------------------------------+-------------------------+----------------------------------------------+-------------------------------------------------------------------------------------------------------------------------------------------------------------------------------------------------------------------------------------+
| ST_ASTEXT(GEO) | ST_ASTEXT(GEO_C) | ST_ASTEXT(POI) | ST_ASTEXT(LIN) | ST_ASTEXT(POL)                                                                                                                                                                                                             | ST_ASTEXT(M_POI)        | ST_ASTEXT(M_LIN)                             | ST_ASTEXT(M_POL)                                                                                                                                                                                                                    |
+----------------+------------------+----------------+----------------+----------------------------------------------------------------------------------------------------------------------------------------------------------------------------------------------------------------------------+-------------------------+----------------------------------------------+-------------------------------------------------------------------------------------------------------------------------------------------------------------------------------------------------------------------------------------+
| NULL           | NULL             | NULL           | NULL           | POLYGON((108.8448587 34.2715468,108.7816873 34.0818121,109.1009774 34.0795373,109.0961709 34.2704119,108.8448587 34.2715468),(108.9166131 34.2701282,108.7892404 34.1880934,108.9385858 34.142926,108.9166131 34.2701282)) | NULL                    | NULL                                         | NULL                                                                                                                                                                                                                                |
| NULL           | NULL             | NULL           | NULL           | NULL                                                                                                                                                                                                                       | MULTIPOINT((0 0),(1 1)) | NULL                                         | NULL                                                                                                                                                                                                                                |
| NULL           | NULL             | NULL           | NULL           | NULL                                                                                                                                                                                                                       | NULL                    | MULTILINESTRING((0 0,1 1,0 0),(0 0,1 1,0 0)) | NULL                                                                                                                                                                                                                                |
| NULL           | NULL             | NULL           | NULL           | NULL                                                                                                                                                                                                                       | NULL                    | NULL                                         | MULTIPOLYGON(((108.8448587 34.2715468,108.7816873 34.0818121,109.1009774 34.0795373,109.0961709 34.2704119,108.8448587 34.2715468)),((108.9166131 34.2701282,108.7892404 34.1880934,108.9385858 34.142926,108.9166131 34.2701282))) |
+----------------+------------------+----------------+----------------+----------------------------------------------------------------------------------------------------------------------------------------------------------------------------------------------------------------------------+-------------------------+----------------------------------------------+-------------------------------------------------------------------------------------------------------------------------------------------------------------------------------------------------------------------------------------+
ROLLBACK;
##NONE##
SELECT ST_ASTEXT(GEO),ST_ASTEXT(GEO_C),ST_ASTEXT(POI),ST_ASTEXT(LIN),ST_ASTEXT(POL),ST_ASTEXT(M_POI),ST_ASTEXT(M_LIN),ST_ASTEXT(M_POL) FROM T_GEO_SW PARTITION(P1);
+----------------+------------------+----------------+----------------+----------------+------------------+------------------+------------------+
| ST_ASTEXT(GEO) | ST_ASTEXT(GEO_C) | ST_ASTEXT(POI) | ST_ASTEXT(LIN) | ST_ASTEXT(POL) | ST_ASTEXT(M_POI) | ST_ASTEXT(M_LIN) | ST_ASTEXT(M_POL) |
+----------------+------------------+----------------+----------------+----------------+------------------+------------------+------------------+
+----------------+------------------+----------------+----------------+----------------+------------------+------------------+------------------+
SELECT ST_ASTEXT(GEO),ST_ASTEXT(GEO_C),ST_ASTEXT(POI),ST_ASTEXT(LIN),ST_ASTEXT(POL),ST_ASTEXT(M_POI),ST_ASTEXT(M_LIN),ST_ASTEXT(M_POL) FROM T_GEO_SW PARTITION(P2);
+----------------+------------------+----------------+----------------+----------------+------------------+------------------+------------------+
| ST_ASTEXT(GEO) | ST_ASTEXT(GEO_C) | ST_ASTEXT(POI) | ST_ASTEXT(LIN) | ST_ASTEXT(POL) | ST_ASTEXT(M_POI) | ST_ASTEXT(M_LIN) | ST_ASTEXT(M_POL) |
+----------------+------------------+----------------+----------------+----------------+------------------+------------------+------------------+
+----------------+------------------+----------------+----------------+----------------+------------------+------------------+------------------+
SELECT ST_ASTEXT(GEO),ST_ASTEXT(GEO_C),ST_ASTEXT(POI),ST_ASTEXT(LIN),ST_ASTEXT(POL),ST_ASTEXT(M_POI),ST_ASTEXT(M_LIN),ST_ASTEXT(M_POL) FROM T_GEO_SW PARTITION(P3);
+----------------+------------------+----------------+----------------+----------------+------------------+------------------+------------------+
| ST_ASTEXT(GEO) | ST_ASTEXT(GEO_C) | ST_ASTEXT(POI) | ST_ASTEXT(LIN) | ST_ASTEXT(POL) | ST_ASTEXT(M_POI) | ST_ASTEXT(M_LIN) | ST_ASTEXT(M_POL) |
+----------------+------------------+----------------+----------------+----------------+------------------+------------------+------------------+
+----------------+------------------+----------------+----------------+----------------+------------------+------------------+------------------+
COMMIT;
BEGIN;
CALL PRO_INSERT();
COMMIT;
SELECT GID,ST_ASTEXT(GEO),ST_ASTEXT(GEO_C),ST_ASTEXT(POI),ST_ASTEXT(LIN),ST_ASTEXT(POL),ST_ASTEXT(M_POI),ST_ASTEXT(M_LIN),ST_ASTEXT(M_POL) FROM T_GEO_SW order by GID asc;
+-----+--------------------------------+-----------------------------------------------------------------------+--------------------------------+---------------------------------------------------------------------------------------+----------------------------------------------------------------------------------------------------------------------------------------------------------------------------------------------------------------------------+-------------------------------+----------------------------------------------+-------------------------------------------------------------------------------------------------------------------------------------------------------------------------------------------------------------------------------------+
| GID | ST_ASTEXT(GEO)                 | ST_ASTEXT(GEO_C)                                                      | ST_ASTEXT(POI)                 | ST_ASTEXT(LIN)                                                                        | ST_ASTEXT(POL)                                                                                                                                                                                                             | ST_ASTEXT(M_POI)              | ST_ASTEXT(M_LIN)                             | ST_ASTEXT(M_POL)                                                                                                                                                                                                                    |
+-----+--------------------------------+-----------------------------------------------------------------------+--------------------------------+---------------------------------------------------------------------------------------+----------------------------------------------------------------------------------------------------------------------------------------------------------------------------------------------------------------------------+-------------------------------+----------------------------------------------+-------------------------------------------------------------------------------------------------------------------------------------------------------------------------------------------------------------------------------------+
|   1 | POLYGON((0 0,1 1,1 0,0 1,0 0)) | GEOMETRYCOLLECTION EMPTY                                              | POINT(1e-16 0.000000000000001) | LINESTRING(1 1,1 1)                                                                   | POLYGON((1 1,1 1,1 1,1 1))                                                                                                                                                                                                 | MULTIPOINT((1 1),(2 2),(3 3)) | MULTILINESTRING((10 10,20 20),(15 15,30 15)) | MULTIPOLYGON(((1 1,1 1,1 1,1 1)),((1 1,1 1,1 1,1 1)))                                                                                                                                                                               |
|   2 | MULTIPOINT((1 2),(2 1),(0 0))  | NULL                                                                  | NULL                           | NULL                                                                                  | NULL                                                                                                                                                                                                                       | NULL                          | NULL                                         | NULL                                                                                                                                                                                                                                |
|   3 | NULL                           | GEOMETRYCOLLECTION(POINT(10 10),POINT(30 30),LINESTRING(15 15,20 20)) | NULL                           | NULL                                                                                  | NULL                                                                                                                                                                                                                       | NULL                          | NULL                                         | NULL                                                                                                                                                                                                                                |
|   4 | NULL                           | NULL                                                                  | POINT(11 11)                   | NULL                                                                                  | NULL                                                                                                                                                                                                                       | NULL                          | NULL                                         | NULL                                                                                                                                                                                                                                |
|   5 | NULL                           | NULL                                                                  | NULL                           | LINESTRING(-31.519125652386037 -72.76387666779343,75.01356355093947 8.71197128921537) | NULL                                                                                                                                                                                                                       | NULL                          | NULL                                         | NULL                                                                                                                                                                                                                                |
|   6 | NULL                           | NULL                                                                  | NULL                           | NULL                                                                                  | POLYGON((108.8448587 34.2715468,108.7816873 34.0818121,109.1009774 34.0795373,109.0961709 34.2704119,108.8448587 34.2715468),(108.9166131 34.2701282,108.7892404 34.1880934,108.9385858 34.142926,108.9166131 34.2701282)) | NULL                          | NULL                                         | NULL                                                                                                                                                                                                                                |
|   7 | NULL                           | NULL                                                                  | NULL                           | NULL                                                                                  | NULL                                                                                                                                                                                                                       | MULTIPOINT((0 0),(1 1))       | NULL                                         | NULL                                                                                                                                                                                                                                |
|   8 | NULL                           | NULL                                                                  | NULL                           | NULL                                                                                  | NULL                                                                                                                                                                                                                       | NULL                          | MULTILINESTRING((0 0,1 1,0 0),(0 0,1 1,0 0)) | NULL                                                                                                                                                                                                                                |
|   9 | NULL                           | NULL                                                                  | NULL                           | NULL                                                                                  | NULL                                                                                                                                                                                                                       | NULL                          | NULL                                         | MULTIPOLYGON(((108.8448587 34.2715468,108.7816873 34.0818121,109.1009774 34.0795373,109.0961709 34.2704119,108.8448587 34.2715468)),((108.9166131 34.2701282,108.7892404 34.1880934,108.9385858 34.142926,108.9166131 34.2701282))) |
+-----+--------------------------------+-----------------------------------------------------------------------+--------------------------------+---------------------------------------------------------------------------------------+----------------------------------------------------------------------------------------------------------------------------------------------------------------------------------------------------------------------------+-------------------------------+----------------------------------------------+-------------------------------------------------------------------------------------------------------------------------------------------------------------------------------------------------------------------------------------+
BEGIN;
UPDATE T_GEO_SW SET GEO=ST_GEOMFROMTEXT('POINT(1 1)',4326),GEO_C=ST_GEOMFROMTEXT('GEOMETRYCOLLECTION empty',26918),POI=ST_GEOMFROMTEXT('point(1e-17 -1e-17)'),LIN=ST_GEOMFROMTEXT('linestring(0 0,1 1,1 0,0 0)'),POL=ST_GEOMFROMTEXT('POLYGON((1 1,1 1,1 1,1 1),(0 0,0 0,0 0,0 0))'),M_POI=ST_GEOMFROMTEXT('MULTIPOINT (3 3, 2 2, 1 1)'),M_LIN=ST_GEOMFROMTEXT('MULTILINESTRING((66 66, 66 66), (66 66, 66 66))'),M_POL=ST_GEOMFROMTEXT('MULTIPOLYGON(((108.8448587 34.2715468, 108.7816873 34.0818121, 109.1009774 34.0795373, 109.0961709 34.2704119, 108.8448587 34.2715468)),((108.9166131 34.2701282, 108.7892404 34.1880934, 108.9385858 34.142926, 108.9166131 34.2701282)))') WHERE GEO=(ST_GEOMFROMTEXT('POLYGON((0 0,1 1,1 0,0 1,0 0))',4326));
SELECT ST_ASTEXT(GEO),ST_ASTEXT(GEO_C),ST_ASTEXT(POI),ST_ASTEXT(LIN),ST_ASTEXT(POL),ST_ASTEXT(M_POI),ST_ASTEXT(M_LIN),ST_ASTEXT(M_POL) FROM T_GEO_SW PARTITION(P1);
+-------------------------------+--------------------------+---------------------+-----------------------------+----------------------------------------------+-------------------------------+----------------------------------------------+-------------------------------------------------------------------------------------------------------------------------------------------------------------------------------------------------------------------------------------+
| ST_ASTEXT(GEO)                | ST_ASTEXT(GEO_C)         | ST_ASTEXT(POI)      | ST_ASTEXT(LIN)              | ST_ASTEXT(POL)                               | ST_ASTEXT(M_POI)              | ST_ASTEXT(M_LIN)                             | ST_ASTEXT(M_POL)                                                                                                                                                                                                                    |
+-------------------------------+--------------------------+---------------------+-----------------------------+----------------------------------------------+-------------------------------+----------------------------------------------+-------------------------------------------------------------------------------------------------------------------------------------------------------------------------------------------------------------------------------------+
| POINT(1 1)                    | GEOMETRYCOLLECTION EMPTY | POINT(1e-17 -1e-17) | LINESTRING(0 0,1 1,1 0,0 0) | POLYGON((1 1,1 1,1 1,1 1),(0 0,0 0,0 0,0 0)) | MULTIPOINT((3 3),(2 2),(1 1)) | MULTILINESTRING((66 66,66 66),(66 66,66 66)) | MULTIPOLYGON(((108.8448587 34.2715468,108.7816873 34.0818121,109.1009774 34.0795373,109.0961709 34.2704119,108.8448587 34.2715468)),((108.9166131 34.2701282,108.7892404 34.1880934,108.9385858 34.142926,108.9166131 34.2701282))) |
| MULTIPOINT((1 2),(2 1),(0 0)) | NULL                     | NULL                | NULL                        | NULL                                         | NULL                          | NULL                                         | NULL                                                                                                                                                                                                                                |
+-------------------------------+--------------------------+---------------------+-----------------------------+----------------------------------------------+-------------------------------+----------------------------------------------+-------------------------------------------------------------------------------------------------------------------------------------------------------------------------------------------------------------------------------------+
SELECT ST_ASTEXT(GEO),ST_ASTEXT(GEO_C),ST_ASTEXT(POI),ST_ASTEXT(LIN),ST_ASTEXT(POL),ST_ASTEXT(M_POI),ST_ASTEXT(M_LIN),ST_ASTEXT(M_POL) FROM T_GEO_SW PARTITION(P2);
+----------------+-----------------------------------------------------------------------+----------------+---------------------------------------------------------------------------------------+----------------+------------------+------------------+------------------+
| ST_ASTEXT(GEO) | ST_ASTEXT(GEO_C)                                                      | ST_ASTEXT(POI) | ST_ASTEXT(LIN)                                                                        | ST_ASTEXT(POL) | ST_ASTEXT(M_POI) | ST_ASTEXT(M_LIN) | ST_ASTEXT(M_POL) |
+----------------+-----------------------------------------------------------------------+----------------+---------------------------------------------------------------------------------------+----------------+------------------+------------------+------------------+
| NULL           | GEOMETRYCOLLECTION(POINT(10 10),POINT(30 30),LINESTRING(15 15,20 20)) | NULL           | NULL                                                                                  | NULL           | NULL             | NULL             | NULL             |
| NULL           | NULL                                                                  | POINT(11 11)   | NULL                                                                                  | NULL           | NULL             | NULL             | NULL             |
| NULL           | NULL                                                                  | NULL           | LINESTRING(-31.519125652386037 -72.76387666779343,75.01356355093947 8.71197128921537) | NULL           | NULL             | NULL             | NULL             |
+----------------+-----------------------------------------------------------------------+----------------+---------------------------------------------------------------------------------------+----------------+------------------+------------------+------------------+
SELECT ST_ASTEXT(GEO),ST_ASTEXT(GEO_C),ST_ASTEXT(POI),ST_ASTEXT(LIN),ST_ASTEXT(POL),ST_ASTEXT(M_POI),ST_ASTEXT(M_LIN),ST_ASTEXT(M_POL) FROM T_GEO_SW PARTITION(P3);
+----------------+------------------+----------------+----------------+----------------------------------------------------------------------------------------------------------------------------------------------------------------------------------------------------------------------------+-------------------------+----------------------------------------------+-------------------------------------------------------------------------------------------------------------------------------------------------------------------------------------------------------------------------------------+
| ST_ASTEXT(GEO) | ST_ASTEXT(GEO_C) | ST_ASTEXT(POI) | ST_ASTEXT(LIN) | ST_ASTEXT(POL)                                                                                                                                                                                                             | ST_ASTEXT(M_POI)        | ST_ASTEXT(M_LIN)                             | ST_ASTEXT(M_POL)                                                                                                                                                                                                                    |
+----------------+------------------+----------------+----------------+----------------------------------------------------------------------------------------------------------------------------------------------------------------------------------------------------------------------------+-------------------------+----------------------------------------------+-------------------------------------------------------------------------------------------------------------------------------------------------------------------------------------------------------------------------------------+
| NULL           | NULL             | NULL           | NULL           | POLYGON((108.8448587 34.2715468,108.7816873 34.0818121,109.1009774 34.0795373,109.0961709 34.2704119,108.8448587 34.2715468),(108.9166131 34.2701282,108.7892404 34.1880934,108.9385858 34.142926,108.9166131 34.2701282)) | NULL                    | NULL                                         | NULL                                                                                                                                                                                                                                |
| NULL           | NULL             | NULL           | NULL           | NULL                                                                                                                                                                                                                       | MULTIPOINT((0 0),(1 1)) | NULL                                         | NULL                                                                                                                                                                                                                                |
| NULL           | NULL             | NULL           | NULL           | NULL                                                                                                                                                                                                                       | NULL                    | MULTILINESTRING((0 0,1 1,0 0),(0 0,1 1,0 0)) | NULL                                                                                                                                                                                                                                |
| NULL           | NULL             | NULL           | NULL           | NULL                                                                                                                                                                                                                       | NULL                    | NULL                                         | MULTIPOLYGON(((108.8448587 34.2715468,108.7816873 34.0818121,109.1009774 34.0795373,109.0961709 34.2704119,108.8448587 34.2715468)),((108.9166131 34.2701282,108.7892404 34.1880934,108.9385858 34.142926,108.9166131 34.2701282))) |
+----------------+------------------+----------------+----------------+----------------------------------------------------------------------------------------------------------------------------------------------------------------------------------------------------------------------------+-------------------------+----------------------------------------------+-------------------------------------------------------------------------------------------------------------------------------------------------------------------------------------------------------------------------------------+
ROLLBACK ;
SELECT ST_ASTEXT(GEO),ST_ASTEXT(GEO_C),ST_ASTEXT(POI),ST_ASTEXT(LIN),ST_ASTEXT(POL),ST_ASTEXT(M_POI),ST_ASTEXT(M_LIN),ST_ASTEXT(M_POL) FROM T_GEO_SW PARTITION(P1);
+--------------------------------+--------------------------+--------------------------------+---------------------+----------------------------+-------------------------------+----------------------------------------------+-------------------------------------------------------+
| ST_ASTEXT(GEO)                 | ST_ASTEXT(GEO_C)         | ST_ASTEXT(POI)                 | ST_ASTEXT(LIN)      | ST_ASTEXT(POL)             | ST_ASTEXT(M_POI)              | ST_ASTEXT(M_LIN)                             | ST_ASTEXT(M_POL)                                      |
+--------------------------------+--------------------------+--------------------------------+---------------------+----------------------------+-------------------------------+----------------------------------------------+-------------------------------------------------------+
| POLYGON((0 0,1 1,1 0,0 1,0 0)) | GEOMETRYCOLLECTION EMPTY | POINT(1e-16 0.000000000000001) | LINESTRING(1 1,1 1) | POLYGON((1 1,1 1,1 1,1 1)) | MULTIPOINT((1 1),(2 2),(3 3)) | MULTILINESTRING((10 10,20 20),(15 15,30 15)) | MULTIPOLYGON(((1 1,1 1,1 1,1 1)),((1 1,1 1,1 1,1 1))) |
| MULTIPOINT((1 2),(2 1),(0 0))  | NULL                     | NULL                           | NULL                | NULL                       | NULL                          | NULL                                         | NULL                                                  |
+--------------------------------+--------------------------+--------------------------------+---------------------+----------------------------+-------------------------------+----------------------------------------------+-------------------------------------------------------+
SELECT ST_ASTEXT(GEO),ST_ASTEXT(GEO_C),ST_ASTEXT(POI),ST_ASTEXT(LIN),ST_ASTEXT(POL),ST_ASTEXT(M_POI),ST_ASTEXT(M_LIN),ST_ASTEXT(M_POL) FROM T_GEO_SW PARTITION(P2);
+----------------+-----------------------------------------------------------------------+----------------+---------------------------------------------------------------------------------------+----------------+------------------+------------------+------------------+
| ST_ASTEXT(GEO) | ST_ASTEXT(GEO_C)                                                      | ST_ASTEXT(POI) | ST_ASTEXT(LIN)                                                                        | ST_ASTEXT(POL) | ST_ASTEXT(M_POI) | ST_ASTEXT(M_LIN) | ST_ASTEXT(M_POL) |
+----------------+-----------------------------------------------------------------------+----------------+---------------------------------------------------------------------------------------+----------------+------------------+------------------+------------------+
| NULL           | GEOMETRYCOLLECTION(POINT(10 10),POINT(30 30),LINESTRING(15 15,20 20)) | NULL           | NULL                                                                                  | NULL           | NULL             | NULL             | NULL             |
| NULL           | NULL                                                                  | POINT(11 11)   | NULL                                                                                  | NULL           | NULL             | NULL             | NULL             |
| NULL           | NULL                                                                  | NULL           | LINESTRING(-31.519125652386037 -72.76387666779343,75.01356355093947 8.71197128921537) | NULL           | NULL             | NULL             | NULL             |
+----------------+-----------------------------------------------------------------------+----------------+---------------------------------------------------------------------------------------+----------------+------------------+------------------+------------------+
SELECT ST_ASTEXT(GEO),ST_ASTEXT(GEO_C),ST_ASTEXT(POI),ST_ASTEXT(LIN),ST_ASTEXT(POL),ST_ASTEXT(M_POI),ST_ASTEXT(M_LIN),ST_ASTEXT(M_POL) FROM T_GEO_SW PARTITION(P3);
+----------------+------------------+----------------+----------------+----------------------------------------------------------------------------------------------------------------------------------------------------------------------------------------------------------------------------+-------------------------+----------------------------------------------+-------------------------------------------------------------------------------------------------------------------------------------------------------------------------------------------------------------------------------------+
| ST_ASTEXT(GEO) | ST_ASTEXT(GEO_C) | ST_ASTEXT(POI) | ST_ASTEXT(LIN) | ST_ASTEXT(POL)                                                                                                                                                                                                             | ST_ASTEXT(M_POI)        | ST_ASTEXT(M_LIN)                             | ST_ASTEXT(M_POL)                                                                                                                                                                                                                    |
+----------------+------------------+----------------+----------------+----------------------------------------------------------------------------------------------------------------------------------------------------------------------------------------------------------------------------+-------------------------+----------------------------------------------+-------------------------------------------------------------------------------------------------------------------------------------------------------------------------------------------------------------------------------------+
| NULL           | NULL             | NULL           | NULL           | POLYGON((108.8448587 34.2715468,108.7816873 34.0818121,109.1009774 34.0795373,109.0961709 34.2704119,108.8448587 34.2715468),(108.9166131 34.2701282,108.7892404 34.1880934,108.9385858 34.142926,108.9166131 34.2701282)) | NULL                    | NULL                                         | NULL                                                                                                                                                                                                                                |
| NULL           | NULL             | NULL           | NULL           | NULL                                                                                                                                                                                                                       | MULTIPOINT((0 0),(1 1)) | NULL                                         | NULL                                                                                                                                                                                                                                |
| NULL           | NULL             | NULL           | NULL           | NULL                                                                                                                                                                                                                       | NULL                    | MULTILINESTRING((0 0,1 1,0 0),(0 0,1 1,0 0)) | NULL                                                                                                                                                                                                                                |
| NULL           | NULL             | NULL           | NULL           | NULL                                                                                                                                                                                                                       | NULL                    | NULL                                         | MULTIPOLYGON(((108.8448587 34.2715468,108.7816873 34.0818121,109.1009774 34.0795373,109.0961709 34.2704119,108.8448587 34.2715468)),((108.9166131 34.2701282,108.7892404 34.1880934,108.9385858 34.142926,108.9166131 34.2701282))) |
+----------------+------------------+----------------+----------------+----------------------------------------------------------------------------------------------------------------------------------------------------------------------------------------------------------------------------+-------------------------+----------------------------------------------+-------------------------------------------------------------------------------------------------------------------------------------------------------------------------------------------------------------------------------------+
COMMIT;
BEGIN;
DELETE FROM T_GEO_SW;
COMMIT;
SELECT GID,ST_ASTEXT(GEO),ST_ASTEXT(GEO_C),ST_ASTEXT(POI),ST_ASTEXT(LIN),ST_ASTEXT(POL),ST_ASTEXT(M_POI),ST_ASTEXT(M_LIN),ST_ASTEXT(M_POL) FROM T_GEO_SW order by GID asc;
+-----+----------------+------------------+----------------+----------------+----------------+------------------+------------------+------------------+
| GID | ST_ASTEXT(GEO) | ST_ASTEXT(GEO_C) | ST_ASTEXT(POI) | ST_ASTEXT(LIN) | ST_ASTEXT(POL) | ST_ASTEXT(M_POI) | ST_ASTEXT(M_LIN) | ST_ASTEXT(M_POL) |
+-----+----------------+------------------+----------------+----------------+----------------+------------------+------------------+------------------+
+-----+----------------+------------------+----------------+----------------+----------------+------------------+------------------+------------------+
#####SAVEPOINT########
BEGIN;
SAVEPOINT A;
CALL PRO_INSERT();
SAVEPOINT B;
UPDATE T_GEO_SW SET GEO=ST_GEOMFROMTEXT('POINT(1 1)',4326),GEO_C=ST_GEOMFROMTEXT('GEOMETRYCOLLECTION empty',26918),POI=ST_GEOMFROMTEXT('point(1e-17 -1e-17)'),LIN=ST_GEOMFROMTEXT('linestring(0 0,1 1,1 0,0 0)'),POL=ST_GEOMFROMTEXT('POLYGON((1 1,1 1,1 1,1 1),(0 0,0 0,0 0,0 0))'),M_POI=ST_GEOMFROMTEXT('MULTIPOINT (3 3, 2 2, 1 1)'),M_LIN=ST_GEOMFROMTEXT('MULTILINESTRING((66 66, 66 66), (66 66, 66 66))'),M_POL=ST_GEOMFROMTEXT('MULTIPOLYGON(((108.8448587 34.2715468, 108.7816873 34.0818121, 109.1009774 34.0795373, 109.0961709 34.2704119, 108.8448587 34.2715468)),((108.9166131 34.2701282, 108.7892404 34.1880934, 108.9385858 34.142926, 108.9166131 34.2701282)))') WHERE GEO=(ST_GEOMFROMTEXT('POLYGON((0 0,1 1,1 0,0 1,0 0))',4326));
SAVEPOINT C;
DELETE FROM T_GEO_SW PARTITION(P1);
SELECT GID,ST_ASTEXT(GEO),ST_ASTEXT(GEO_C),ST_ASTEXT(POI),ST_ASTEXT(LIN),ST_ASTEXT(POL),ST_ASTEXT(M_POI),ST_ASTEXT(M_LIN),ST_ASTEXT(M_POL) FROM T_GEO_SW PARTITION(P1);
+-----+----------------+------------------+----------------+----------------+----------------+------------------+------------------+------------------+
| GID | ST_ASTEXT(GEO) | ST_ASTEXT(GEO_C) | ST_ASTEXT(POI) | ST_ASTEXT(LIN) | ST_ASTEXT(POL) | ST_ASTEXT(M_POI) | ST_ASTEXT(M_LIN) | ST_ASTEXT(M_POL) |
+-----+----------------+------------------+----------------+----------------+----------------+------------------+------------------+------------------+
+-----+----------------+------------------+----------------+----------------+----------------+------------------+------------------+------------------+
SELECT GID,ST_ASTEXT(GEO),ST_ASTEXT(GEO_C),ST_ASTEXT(POI),ST_ASTEXT(LIN),ST_ASTEXT(POL),ST_ASTEXT(M_POI),ST_ASTEXT(M_LIN),ST_ASTEXT(M_POL) FROM T_GEO_SW PARTITION(P2);
+-----+----------------+-----------------------------------------------------------------------+----------------+---------------------------------------------------------------------------------------+----------------+------------------+------------------+------------------+
| GID | ST_ASTEXT(GEO) | ST_ASTEXT(GEO_C)                                                      | ST_ASTEXT(POI) | ST_ASTEXT(LIN)                                                                        | ST_ASTEXT(POL) | ST_ASTEXT(M_POI) | ST_ASTEXT(M_LIN) | ST_ASTEXT(M_POL) |
+-----+----------------+-----------------------------------------------------------------------+----------------+---------------------------------------------------------------------------------------+----------------+------------------+------------------+------------------+
|   3 | NULL           | GEOMETRYCOLLECTION(POINT(10 10),POINT(30 30),LINESTRING(15 15,20 20)) | NULL           | NULL                                                                                  | NULL           | NULL             | NULL             | NULL             |
|   4 | NULL           | NULL                                                                  | POINT(11 11)   | NULL                                                                                  | NULL           | NULL             | NULL             | NULL             |
|   5 | NULL           | NULL                                                                  | NULL           | LINESTRING(-31.519125652386037 -72.76387666779343,75.01356355093947 8.71197128921537) | NULL           | NULL             | NULL             | NULL             |
+-----+----------------+-----------------------------------------------------------------------+----------------+---------------------------------------------------------------------------------------+----------------+------------------+------------------+------------------+
SELECT GID,ST_ASTEXT(GEO),ST_ASTEXT(GEO_C),ST_ASTEXT(POI),ST_ASTEXT(LIN),ST_ASTEXT(POL),ST_ASTEXT(M_POI),ST_ASTEXT(M_LIN),ST_ASTEXT(M_POL) FROM T_GEO_SW PARTITION(P3);
+-----+----------------+------------------+----------------+----------------+----------------------------------------------------------------------------------------------------------------------------------------------------------------------------------------------------------------------------+-------------------------+----------------------------------------------+-------------------------------------------------------------------------------------------------------------------------------------------------------------------------------------------------------------------------------------+
| GID | ST_ASTEXT(GEO) | ST_ASTEXT(GEO_C) | ST_ASTEXT(POI) | ST_ASTEXT(LIN) | ST_ASTEXT(POL)                                                                                                                                                                                                             | ST_ASTEXT(M_POI)        | ST_ASTEXT(M_LIN)                             | ST_ASTEXT(M_POL)                                                                                                                                                                                                                    |
+-----+----------------+------------------+----------------+----------------+----------------------------------------------------------------------------------------------------------------------------------------------------------------------------------------------------------------------------+-------------------------+----------------------------------------------+-------------------------------------------------------------------------------------------------------------------------------------------------------------------------------------------------------------------------------------+
|   6 | NULL           | NULL             | NULL           | NULL           | POLYGON((108.8448587 34.2715468,108.7816873 34.0818121,109.1009774 34.0795373,109.0961709 34.2704119,108.8448587 34.2715468),(108.9166131 34.2701282,108.7892404 34.1880934,108.9385858 34.142926,108.9166131 34.2701282)) | NULL                    | NULL                                         | NULL                                                                                                                                                                                                                                |
|   7 | NULL           | NULL             | NULL           | NULL           | NULL                                                                                                                                                                                                                       | MULTIPOINT((0 0),(1 1)) | NULL                                         | NULL                                                                                                                                                                                                                                |
|   8 | NULL           | NULL             | NULL           | NULL           | NULL                                                                                                                                                                                                                       | NULL                    | MULTILINESTRING((0 0,1 1,0 0),(0 0,1 1,0 0)) | NULL                                                                                                                                                                                                                                |
|   9 | NULL           | NULL             | NULL           | NULL           | NULL                                                                                                                                                                                                                       | NULL                    | NULL                                         | MULTIPOLYGON(((108.8448587 34.2715468,108.7816873 34.0818121,109.1009774 34.0795373,109.0961709 34.2704119,108.8448587 34.2715468)),((108.9166131 34.2701282,108.7892404 34.1880934,108.9385858 34.142926,108.9166131 34.2701282))) |
+-----+----------------+------------------+----------------+----------------+----------------------------------------------------------------------------------------------------------------------------------------------------------------------------------------------------------------------------+-------------------------+----------------------------------------------+-------------------------------------------------------------------------------------------------------------------------------------------------------------------------------------------------------------------------------------+
ROLLBACK TO C;
SELECT GID,ST_ASTEXT(GEO),ST_ASTEXT(GEO_C),ST_ASTEXT(POI),ST_ASTEXT(LIN),ST_ASTEXT(POL),ST_ASTEXT(M_POI),ST_ASTEXT(M_LIN),ST_ASTEXT(M_POL) FROM T_GEO_SW PARTITION(P1);
+-----+-------------------------------+--------------------------+---------------------+-----------------------------+----------------------------------------------+-------------------------------+----------------------------------------------+-------------------------------------------------------------------------------------------------------------------------------------------------------------------------------------------------------------------------------------+
| GID | ST_ASTEXT(GEO)                | ST_ASTEXT(GEO_C)         | ST_ASTEXT(POI)      | ST_ASTEXT(LIN)              | ST_ASTEXT(POL)                               | ST_ASTEXT(M_POI)              | ST_ASTEXT(M_LIN)                             | ST_ASTEXT(M_POL)                                                                                                                                                                                                                    |
+-----+-------------------------------+--------------------------+---------------------+-----------------------------+----------------------------------------------+-------------------------------+----------------------------------------------+-------------------------------------------------------------------------------------------------------------------------------------------------------------------------------------------------------------------------------------+
|   1 | POINT(1 1)                    | GEOMETRYCOLLECTION EMPTY | POINT(1e-17 -1e-17) | LINESTRING(0 0,1 1,1 0,0 0) | POLYGON((1 1,1 1,1 1,1 1),(0 0,0 0,0 0,0 0)) | MULTIPOINT((3 3),(2 2),(1 1)) | MULTILINESTRING((66 66,66 66),(66 66,66 66)) | MULTIPOLYGON(((108.8448587 34.2715468,108.7816873 34.0818121,109.1009774 34.0795373,109.0961709 34.2704119,108.8448587 34.2715468)),((108.9166131 34.2701282,108.7892404 34.1880934,108.9385858 34.142926,108.9166131 34.2701282))) |
|   2 | MULTIPOINT((1 2),(2 1),(0 0)) | NULL                     | NULL                | NULL                        | NULL                                         | NULL                          | NULL                                         | NULL                                                                                                                                                                                                                                |
+-----+-------------------------------+--------------------------+---------------------+-----------------------------+----------------------------------------------+-------------------------------+----------------------------------------------+-------------------------------------------------------------------------------------------------------------------------------------------------------------------------------------------------------------------------------------+
SELECT GID,ST_ASTEXT(GEO),ST_ASTEXT(GEO_C),ST_ASTEXT(POI),ST_ASTEXT(LIN),ST_ASTEXT(POL),ST_ASTEXT(M_POI),ST_ASTEXT(M_LIN),ST_ASTEXT(M_POL) FROM T_GEO_SW PARTITION(P2);
+-----+----------------+-----------------------------------------------------------------------+----------------+---------------------------------------------------------------------------------------+----------------+------------------+------------------+------------------+
| GID | ST_ASTEXT(GEO) | ST_ASTEXT(GEO_C)                                                      | ST_ASTEXT(POI) | ST_ASTEXT(LIN)                                                                        | ST_ASTEXT(POL) | ST_ASTEXT(M_POI) | ST_ASTEXT(M_LIN) | ST_ASTEXT(M_POL) |
+-----+----------------+-----------------------------------------------------------------------+----------------+---------------------------------------------------------------------------------------+----------------+------------------+------------------+------------------+
|   3 | NULL           | GEOMETRYCOLLECTION(POINT(10 10),POINT(30 30),LINESTRING(15 15,20 20)) | NULL           | NULL                                                                                  | NULL           | NULL             | NULL             | NULL             |
|   4 | NULL           | NULL                                                                  | POINT(11 11)   | NULL                                                                                  | NULL           | NULL             | NULL             | NULL             |
|   5 | NULL           | NULL                                                                  | NULL           | LINESTRING(-31.519125652386037 -72.76387666779343,75.01356355093947 8.71197128921537) | NULL           | NULL             | NULL             | NULL             |
+-----+----------------+-----------------------------------------------------------------------+----------------+---------------------------------------------------------------------------------------+----------------+------------------+------------------+------------------+
SELECT GID,ST_ASTEXT(GEO),ST_ASTEXT(GEO_C),ST_ASTEXT(POI),ST_ASTEXT(LIN),ST_ASTEXT(POL),ST_ASTEXT(M_POI),ST_ASTEXT(M_LIN),ST_ASTEXT(M_POL) FROM T_GEO_SW PARTITION(P3);
+-----+----------------+------------------+----------------+----------------+----------------------------------------------------------------------------------------------------------------------------------------------------------------------------------------------------------------------------+-------------------------+----------------------------------------------+-------------------------------------------------------------------------------------------------------------------------------------------------------------------------------------------------------------------------------------+
| GID | ST_ASTEXT(GEO) | ST_ASTEXT(GEO_C) | ST_ASTEXT(POI) | ST_ASTEXT(LIN) | ST_ASTEXT(POL)                                                                                                                                                                                                             | ST_ASTEXT(M_POI)        | ST_ASTEXT(M_LIN)                             | ST_ASTEXT(M_POL)                                                                                                                                                                                                                    |
+-----+----------------+------------------+----------------+----------------+----------------------------------------------------------------------------------------------------------------------------------------------------------------------------------------------------------------------------+-------------------------+----------------------------------------------+-------------------------------------------------------------------------------------------------------------------------------------------------------------------------------------------------------------------------------------+
|   6 | NULL           | NULL             | NULL           | NULL           | POLYGON((108.8448587 34.2715468,108.7816873 34.0818121,109.1009774 34.0795373,109.0961709 34.2704119,108.8448587 34.2715468),(108.9166131 34.2701282,108.7892404 34.1880934,108.9385858 34.142926,108.9166131 34.2701282)) | NULL                    | NULL                                         | NULL                                                                                                                                                                                                                                |
|   7 | NULL           | NULL             | NULL           | NULL           | NULL                                                                                                                                                                                                                       | MULTIPOINT((0 0),(1 1)) | NULL                                         | NULL                                                                                                                                                                                                                                |
|   8 | NULL           | NULL             | NULL           | NULL           | NULL                                                                                                                                                                                                                       | NULL                    | MULTILINESTRING((0 0,1 1,0 0),(0 0,1 1,0 0)) | NULL                                                                                                                                                                                                                                |
|   9 | NULL           | NULL             | NULL           | NULL           | NULL                                                                                                                                                                                                                       | NULL                    | NULL                                         | MULTIPOLYGON(((108.8448587 34.2715468,108.7816873 34.0818121,109.1009774 34.0795373,109.0961709 34.2704119,108.8448587 34.2715468)),((108.9166131 34.2701282,108.7892404 34.1880934,108.9385858 34.142926,108.9166131 34.2701282))) |
+-----+----------------+------------------+----------------+----------------+----------------------------------------------------------------------------------------------------------------------------------------------------------------------------------------------------------------------------+-------------------------+----------------------------------------------+-------------------------------------------------------------------------------------------------------------------------------------------------------------------------------------------------------------------------------------+
ROLLBACK TO B;
SELECT GID,ST_ASTEXT(GEO),ST_ASTEXT(GEO_C),ST_ASTEXT(POI),ST_ASTEXT(LIN),ST_ASTEXT(POL),ST_ASTEXT(M_POI),ST_ASTEXT(M_LIN),ST_ASTEXT(M_POL) FROM T_GEO_SW PARTITION(P1);
+-----+--------------------------------+--------------------------+--------------------------------+---------------------+----------------------------+-------------------------------+----------------------------------------------+-------------------------------------------------------+
| GID | ST_ASTEXT(GEO)                 | ST_ASTEXT(GEO_C)         | ST_ASTEXT(POI)                 | ST_ASTEXT(LIN)      | ST_ASTEXT(POL)             | ST_ASTEXT(M_POI)              | ST_ASTEXT(M_LIN)                             | ST_ASTEXT(M_POL)                                      |
+-----+--------------------------------+--------------------------+--------------------------------+---------------------+----------------------------+-------------------------------+----------------------------------------------+-------------------------------------------------------+
|   1 | POLYGON((0 0,1 1,1 0,0 1,0 0)) | GEOMETRYCOLLECTION EMPTY | POINT(1e-16 0.000000000000001) | LINESTRING(1 1,1 1) | POLYGON((1 1,1 1,1 1,1 1)) | MULTIPOINT((1 1),(2 2),(3 3)) | MULTILINESTRING((10 10,20 20),(15 15,30 15)) | MULTIPOLYGON(((1 1,1 1,1 1,1 1)),((1 1,1 1,1 1,1 1))) |
|   2 | MULTIPOINT((1 2),(2 1),(0 0))  | NULL                     | NULL                           | NULL                | NULL                       | NULL                          | NULL                                         | NULL                                                  |
+-----+--------------------------------+--------------------------+--------------------------------+---------------------+----------------------------+-------------------------------+----------------------------------------------+-------------------------------------------------------+
SELECT GID,ST_ASTEXT(GEO),ST_ASTEXT(GEO_C),ST_ASTEXT(POI),ST_ASTEXT(LIN),ST_ASTEXT(POL),ST_ASTEXT(M_POI),ST_ASTEXT(M_LIN),ST_ASTEXT(M_POL) FROM T_GEO_SW PARTITION(P2);
+-----+----------------+-----------------------------------------------------------------------+----------------+---------------------------------------------------------------------------------------+----------------+------------------+------------------+------------------+
| GID | ST_ASTEXT(GEO) | ST_ASTEXT(GEO_C)                                                      | ST_ASTEXT(POI) | ST_ASTEXT(LIN)                                                                        | ST_ASTEXT(POL) | ST_ASTEXT(M_POI) | ST_ASTEXT(M_LIN) | ST_ASTEXT(M_POL) |
+-----+----------------+-----------------------------------------------------------------------+----------------+---------------------------------------------------------------------------------------+----------------+------------------+------------------+------------------+
|   3 | NULL           | GEOMETRYCOLLECTION(POINT(10 10),POINT(30 30),LINESTRING(15 15,20 20)) | NULL           | NULL                                                                                  | NULL           | NULL             | NULL             | NULL             |
|   4 | NULL           | NULL                                                                  | POINT(11 11)   | NULL                                                                                  | NULL           | NULL             | NULL             | NULL             |
|   5 | NULL           | NULL                                                                  | NULL           | LINESTRING(-31.519125652386037 -72.76387666779343,75.01356355093947 8.71197128921537) | NULL           | NULL             | NULL             | NULL             |
+-----+----------------+-----------------------------------------------------------------------+----------------+---------------------------------------------------------------------------------------+----------------+------------------+------------------+------------------+
SELECT GID,ST_ASTEXT(GEO),ST_ASTEXT(GEO_C),ST_ASTEXT(POI),ST_ASTEXT(LIN),ST_ASTEXT(POL),ST_ASTEXT(M_POI),ST_ASTEXT(M_LIN),ST_ASTEXT(M_POL) FROM T_GEO_SW PARTITION(P3);
+-----+----------------+------------------+----------------+----------------+----------------------------------------------------------------------------------------------------------------------------------------------------------------------------------------------------------------------------+-------------------------+----------------------------------------------+-------------------------------------------------------------------------------------------------------------------------------------------------------------------------------------------------------------------------------------+
| GID | ST_ASTEXT(GEO) | ST_ASTEXT(GEO_C) | ST_ASTEXT(POI) | ST_ASTEXT(LIN) | ST_ASTEXT(POL)                                                                                                                                                                                                             | ST_ASTEXT(M_POI)        | ST_ASTEXT(M_LIN)                             | ST_ASTEXT(M_POL)                                                                                                                                                                                                                    |
+-----+----------------+------------------+----------------+----------------+----------------------------------------------------------------------------------------------------------------------------------------------------------------------------------------------------------------------------+-------------------------+----------------------------------------------+-------------------------------------------------------------------------------------------------------------------------------------------------------------------------------------------------------------------------------------+
|   6 | NULL           | NULL             | NULL           | NULL           | POLYGON((108.8448587 34.2715468,108.7816873 34.0818121,109.1009774 34.0795373,109.0961709 34.2704119,108.8448587 34.2715468),(108.9166131 34.2701282,108.7892404 34.1880934,108.9385858 34.142926,108.9166131 34.2701282)) | NULL                    | NULL                                         | NULL                                                                                                                                                                                                                                |
|   7 | NULL           | NULL             | NULL           | NULL           | NULL                                                                                                                                                                                                                       | MULTIPOINT((0 0),(1 1)) | NULL                                         | NULL                                                                                                                                                                                                                                |
|   8 | NULL           | NULL             | NULL           | NULL           | NULL                                                                                                                                                                                                                       | NULL                    | MULTILINESTRING((0 0,1 1,0 0),(0 0,1 1,0 0)) | NULL                                                                                                                                                                                                                                |
|   9 | NULL           | NULL             | NULL           | NULL           | NULL                                                                                                                                                                                                                       | NULL                    | NULL                                         | MULTIPOLYGON(((108.8448587 34.2715468,108.7816873 34.0818121,109.1009774 34.0795373,109.0961709 34.2704119,108.8448587 34.2715468)),((108.9166131 34.2701282,108.7892404 34.1880934,108.9385858 34.142926,108.9166131 34.2701282))) |
+-----+----------------+------------------+----------------+----------------+----------------------------------------------------------------------------------------------------------------------------------------------------------------------------------------------------------------------------+-------------------------+----------------------------------------------+-------------------------------------------------------------------------------------------------------------------------------------------------------------------------------------------------------------------------------------+
ROLLBACK TO A;
SELECT GID,ST_ASTEXT(GEO),ST_ASTEXT(GEO_C),ST_ASTEXT(POI),ST_ASTEXT(LIN),ST_ASTEXT(POL),ST_ASTEXT(M_POI),ST_ASTEXT(M_LIN),ST_ASTEXT(M_POL) FROM T_GEO_SW PARTITION(P1);
+-----+----------------+------------------+----------------+----------------+----------------+------------------+------------------+------------------+
| GID | ST_ASTEXT(GEO) | ST_ASTEXT(GEO_C) | ST_ASTEXT(POI) | ST_ASTEXT(LIN) | ST_ASTEXT(POL) | ST_ASTEXT(M_POI) | ST_ASTEXT(M_LIN) | ST_ASTEXT(M_POL) |
+-----+----------------+------------------+----------------+----------------+----------------+------------------+------------------+------------------+
+-----+----------------+------------------+----------------+----------------+----------------+------------------+------------------+------------------+
SELECT GID,ST_ASTEXT(GEO),ST_ASTEXT(GEO_C),ST_ASTEXT(POI),ST_ASTEXT(LIN),ST_ASTEXT(POL),ST_ASTEXT(M_POI),ST_ASTEXT(M_LIN),ST_ASTEXT(M_POL) FROM T_GEO_SW PARTITION(P2);
+-----+----------------+------------------+----------------+----------------+----------------+------------------+------------------+------------------+
| GID | ST_ASTEXT(GEO) | ST_ASTEXT(GEO_C) | ST_ASTEXT(POI) | ST_ASTEXT(LIN) | ST_ASTEXT(POL) | ST_ASTEXT(M_POI) | ST_ASTEXT(M_LIN) | ST_ASTEXT(M_POL) |
+-----+----------------+------------------+----------------+----------------+----------------+------------------+------------------+------------------+
+-----+----------------+------------------+----------------+----------------+----------------+------------------+------------------+------------------+
SELECT GID,ST_ASTEXT(GEO),ST_ASTEXT(GEO_C),ST_ASTEXT(POI),ST_ASTEXT(LIN),ST_ASTEXT(POL),ST_ASTEXT(M_POI),ST_ASTEXT(M_LIN),ST_ASTEXT(M_POL) FROM T_GEO_SW PARTITION(P3);
+-----+----------------+------------------+----------------+----------------+----------------+------------------+------------------+------------------+
| GID | ST_ASTEXT(GEO) | ST_ASTEXT(GEO_C) | ST_ASTEXT(POI) | ST_ASTEXT(LIN) | ST_ASTEXT(POL) | ST_ASTEXT(M_POI) | ST_ASTEXT(M_LIN) | ST_ASTEXT(M_POL) |
+-----+----------------+------------------+----------------+----------------+----------------+------------------+------------------+------------------+
+-----+----------------+------------------+----------------+----------------+----------------+------------------+------------------+------------------+
COMMIT;
DROP TABLE IF EXISTS T_GEO_SW;
create table T_GEO_SW (gid int primary key, geo geometry SRID 4326,geo_c GEOMETRYCOLLECTION SRID 26918,poi point,LIN linestring ,pol polygon ,M_POI MULTIPOINT,M_LIN MULTILINESTRING,M_POL MULTIPOLYGON)  PARTITION BY RANGE (GID) (PARTITION P1 VALUES LESS THAN (3),PARTITION P2 VALUES LESS THAN (6),PARTITION P3 VALUES LESS THAN MAXVALUE);
CALL PRO_INSERT();
BEGIN;
SAVEPOINT A;
UPDATE T_GEO_SW SET GEO=ST_GEOMFROMTEXT('MULTIPOINT (1 2, 2 1, 0 0)',4326) WHERE GID=2;
SAVEPOINT B;
UPDATE T_GEO_SW SET GEO_C = st_geomfromtext('GEOMETRYCOLLECTION(point(180 90))',26918) WHERE GID=3;
SAVEPOINT C;
UPDATE T_GEO_SW SET POI=sT_GEOmfromtext('point(1e-15 -1e-15)') WHERE GID=4;
SAVEPOINT D;
UPDATE T_GEO_SW SET LIN=sT_GEOmfromtext('linestring(1 1,1 1)') WHERE GID=5;
SAVEPOINT E;
UPDATE T_GEO_SW SET POL=ST_GEOMFROMTEXT('polygon((1 1,1 1,1 1,1 1),(1 1,1 1,1 1,1 1))') WHERE GID=6;
SAVEPOINT F;
UPDATE T_GEO_SW SET M_POI=sT_GEOmfromtext('MULTIPOINT (1 1, 2 2, 3 3)') WHERE GID = 7;
SAVEPOINT G;
UPDATE T_GEO_SW SET M_LIN=ST_GEOMFROMTEXT('MULTILINESTRING((10 10, 20 20), (15 15, 30 15))') WHERE GID = 8;
SAVEPOINT H;
UPDATE T_GEO_SW SET M_POL=ST_GEOMFROMTEXT('MULTIPOLYGON(((1 1,1 1,1 1,1 1)),((1 1,1 1,1 1,1 1)))') WHERE GID =9;
SAVEPOINT I;
##MULTILINESTRING((10 10, 20 20), (15 15, 30 15))##
ROLLBACK TO H;
SELECT ST_ASTEXT(M_LIN) FROM T_GEO_SW PARTITION(P3);
+----------------------------------------------+
| ST_ASTEXT(M_LIN)                             |
+----------------------------------------------+
| NULL                                         |
| NULL                                         |
| MULTILINESTRING((10 10,20 20),(15 15,30 15)) |
| NULL                                         |
+----------------------------------------------+
##polygon((1 1,1 1,1 1,1 1),(1 1,1 1,1 1,1 1))##
ROLLBACK TO F;
SELECT ST_ASTEXT(POL) FROM T_GEO_SW PARTITION(P3);
+----------------------------------------------+
| ST_ASTEXT(POL)                               |
+----------------------------------------------+
| POLYGON((1 1,1 1,1 1,1 1),(1 1,1 1,1 1,1 1)) |
| NULL                                         |
| NULL                                         |
| NULL                                         |
+----------------------------------------------+
##point(1e-15 -1e-15)##
ROLLBACK TO D;
SELECT ST_ASTEXT(POI) FROM T_GEO_SW PARTITION(P2);
+---------------------------------------------+
| ST_ASTEXT(POI)                              |
+---------------------------------------------+
| NULL                                        |
| POINT(0.000000000000001 -0.000000000000001) |
| NULL                                        |
+---------------------------------------------+
##MULTIPOINT (1 2, 2 1, 0 0)##
ROLLBACK TO B;
SELECT ST_ASTEXT(GEO) FROM T_GEO_SW PARTITION(P1);
+--------------------------------+
| ST_ASTEXT(GEO)                 |
+--------------------------------+
| POLYGON((0 0,1 1,1 0,0 1,0 0)) |
| MULTIPOINT((1 2),(2 1),(0 0))  |
+--------------------------------+
ROLLBACK TO A ;
SELECT GID,ST_ASTEXT(GEO),ST_ASTEXT(GEO_C),ST_ASTEXT(POI),ST_ASTEXT(LIN),ST_ASTEXT(POL),ST_ASTEXT(M_POI),ST_ASTEXT(M_LIN),ST_ASTEXT(M_POL) FROM T_GEO_SW PARTITION(P1);
+-----+--------------------------------+--------------------------+--------------------------------+---------------------+----------------------------+-------------------------------+----------------------------------------------+-------------------------------------------------------+
| GID | ST_ASTEXT(GEO)                 | ST_ASTEXT(GEO_C)         | ST_ASTEXT(POI)                 | ST_ASTEXT(LIN)      | ST_ASTEXT(POL)             | ST_ASTEXT(M_POI)              | ST_ASTEXT(M_LIN)                             | ST_ASTEXT(M_POL)                                      |
+-----+--------------------------------+--------------------------+--------------------------------+---------------------+----------------------------+-------------------------------+----------------------------------------------+-------------------------------------------------------+
|   1 | POLYGON((0 0,1 1,1 0,0 1,0 0)) | GEOMETRYCOLLECTION EMPTY | POINT(1e-16 0.000000000000001) | LINESTRING(1 1,1 1) | POLYGON((1 1,1 1,1 1,1 1)) | MULTIPOINT((1 1),(2 2),(3 3)) | MULTILINESTRING((10 10,20 20),(15 15,30 15)) | MULTIPOLYGON(((1 1,1 1,1 1,1 1)),((1 1,1 1,1 1,1 1))) |
|   2 | MULTIPOINT((1 2),(2 1),(0 0))  | NULL                     | NULL                           | NULL                | NULL                       | NULL                          | NULL                                         | NULL                                                  |
+-----+--------------------------------+--------------------------+--------------------------------+---------------------+----------------------------+-------------------------------+----------------------------------------------+-------------------------------------------------------+
SELECT GID,ST_ASTEXT(GEO),ST_ASTEXT(GEO_C),ST_ASTEXT(POI),ST_ASTEXT(LIN),ST_ASTEXT(POL),ST_ASTEXT(M_POI),ST_ASTEXT(M_LIN),ST_ASTEXT(M_POL) FROM T_GEO_SW PARTITION(P2);
+-----+----------------+-----------------------------------------------------------------------+----------------+---------------------------------------------------------------------------------------+----------------+------------------+------------------+------------------+
| GID | ST_ASTEXT(GEO) | ST_ASTEXT(GEO_C)                                                      | ST_ASTEXT(POI) | ST_ASTEXT(LIN)                                                                        | ST_ASTEXT(POL) | ST_ASTEXT(M_POI) | ST_ASTEXT(M_LIN) | ST_ASTEXT(M_POL) |
+-----+----------------+-----------------------------------------------------------------------+----------------+---------------------------------------------------------------------------------------+----------------+------------------+------------------+------------------+
|   3 | NULL           | GEOMETRYCOLLECTION(POINT(10 10),POINT(30 30),LINESTRING(15 15,20 20)) | NULL           | NULL                                                                                  | NULL           | NULL             | NULL             | NULL             |
|   4 | NULL           | NULL                                                                  | POINT(11 11)   | NULL                                                                                  | NULL           | NULL             | NULL             | NULL             |
|   5 | NULL           | NULL                                                                  | NULL           | LINESTRING(-31.519125652386037 -72.76387666779343,75.01356355093947 8.71197128921537) | NULL           | NULL             | NULL             | NULL             |
+-----+----------------+-----------------------------------------------------------------------+----------------+---------------------------------------------------------------------------------------+----------------+------------------+------------------+------------------+
SELECT GID,ST_ASTEXT(GEO),ST_ASTEXT(GEO_C),ST_ASTEXT(POI),ST_ASTEXT(LIN),ST_ASTEXT(POL),ST_ASTEXT(M_POI),ST_ASTEXT(M_LIN),ST_ASTEXT(M_POL) FROM T_GEO_SW PARTITION(P3);
+-----+----------------+------------------+----------------+----------------+----------------------------------------------------------------------------------------------------------------------------------------------------------------------------------------------------------------------------+-------------------------+----------------------------------------------+-------------------------------------------------------------------------------------------------------------------------------------------------------------------------------------------------------------------------------------+
| GID | ST_ASTEXT(GEO) | ST_ASTEXT(GEO_C) | ST_ASTEXT(POI) | ST_ASTEXT(LIN) | ST_ASTEXT(POL)                                                                                                                                                                                                             | ST_ASTEXT(M_POI)        | ST_ASTEXT(M_LIN)                             | ST_ASTEXT(M_POL)                                                                                                                                                                                                                    |
+-----+----------------+------------------+----------------+----------------+----------------------------------------------------------------------------------------------------------------------------------------------------------------------------------------------------------------------------+-------------------------+----------------------------------------------+-------------------------------------------------------------------------------------------------------------------------------------------------------------------------------------------------------------------------------------+
|   6 | NULL           | NULL             | NULL           | NULL           | POLYGON((108.8448587 34.2715468,108.7816873 34.0818121,109.1009774 34.0795373,109.0961709 34.2704119,108.8448587 34.2715468),(108.9166131 34.2701282,108.7892404 34.1880934,108.9385858 34.142926,108.9166131 34.2701282)) | NULL                    | NULL                                         | NULL                                                                                                                                                                                                                                |
|   7 | NULL           | NULL             | NULL           | NULL           | NULL                                                                                                                                                                                                                       | MULTIPOINT((0 0),(1 1)) | NULL                                         | NULL                                                                                                                                                                                                                                |
|   8 | NULL           | NULL             | NULL           | NULL           | NULL                                                                                                                                                                                                                       | NULL                    | MULTILINESTRING((0 0,1 1,0 0),(0 0,1 1,0 0)) | NULL                                                                                                                                                                                                                                |
|   9 | NULL           | NULL             | NULL           | NULL           | NULL                                                                                                                                                                                                                       | NULL                    | NULL                                         | MULTIPOLYGON(((108.8448587 34.2715468,108.7816873 34.0818121,109.1009774 34.0795373,109.0961709 34.2704119,108.8448587 34.2715468)),((108.9166131 34.2701282,108.7892404 34.1880934,108.9385858 34.142926,108.9166131 34.2701282))) |
+-----+----------------+------------------+----------------+----------------+----------------------------------------------------------------------------------------------------------------------------------------------------------------------------------------------------------------------------+-------------------------+----------------------------------------------+-------------------------------------------------------------------------------------------------------------------------------------------------------------------------------------------------------------------------------------+
DELETE FROM T_GEO_SW;
COMMIT;
DROP TABLE IF EXISTS T_GEO_SW;
DROP TABLE IF EXISTS FF01;
CREATE TABLE FF01 (A INT);
BEGIN;
SAVEPOINT A1;
INSERT INTO FF01 VALUES (1);
SAVEPOINT B1;
UPDATE FF01 SET A=2;
SAVEPOINT C1;
DELETE FROM FF01;
SELECT * FROM FF01;
+------+
| A    |
+------+
+------+
ROLLBACK TO B1;
SELECT * FROM FF01;
+------+
| A    |
+------+
|    1 |
+------+
ROLLBACK TO C1;
ERROR 42000: savepoint does not exist
SELECT * FROM FF01;
+------+
| A    |
+------+
|    1 |
+------+
ROLLBACK TO A1;
SELECT * FROM FF01;
+------+
| A    |
+------+
+------+
DROP TABLE IF EXISTS FF01;
drop user 'zc_gis_mysql'@'%';
