result_format: 4
drop user 'zc_gis_mysql'@'%';
create user 'zc_gis_mysql'@'%' IDENTIFIED BY 'zc_gis_mysql';
grant all on *.* to 'zc_gis_mysql'@'%' WITH GRANT OPTION;
####添加srs#####




drop table if exists T_GEO;
drop view if exists V_T_GEO;
####################update###################
create table T_GEO (gid int auto_increment primary key, geo geometry ,geo_c GEOMETRYCOLLECTION,poi point,lin linestring ,pol polygon,M_POI MULTIPOINT,M_LIN MULTILINESTRING ,M_POL MULTIPOLYGON );
create view V_T_GEO AS SELECT * FROM T_GEO;
INSERT INTO T_GEO VALUES (1,NULL,NULL,NULL,NULL,NULL,NULL,NULL,NULL);
UPDATE T_GEO SET GEO=ST_GEOMFROMTEXT('POINT(1 1)');
SELECT ST_ASTEXT(GEO),ST_ASTEXT(GEO_C),ST_ASTEXT(POI),ST_ASTEXT(M_POI),ST_ASTEXT(LIN),ST_ASTEXT(M_LIN),ST_ASTEXT(POL),ST_ASTEXT(M_POL) FROM T_GEO;
+----------------+------------------+----------------+------------------+----------------+------------------+----------------+------------------+
| ST_ASTEXT(GEO) | ST_ASTEXT(GEO_C) | ST_ASTEXT(POI) | ST_ASTEXT(M_POI) | ST_ASTEXT(LIN) | ST_ASTEXT(M_LIN) | ST_ASTEXT(POL) | ST_ASTEXT(M_POL) |
+----------------+------------------+----------------+------------------+----------------+------------------+----------------+------------------+
| POINT(1 1)     | NULL             | NULL           | NULL             | NULL           | NULL             | NULL           | NULL             |
+----------------+------------------+----------------+------------------+----------------+------------------+----------------+------------------+
################geometry#################
UPDATE T_GEO SET GEO=ST_GEOMFROMTEXT(NULL);
SELECT ST_ASTEXT(GEO) FROM T_GEO;
+----------------+
| ST_ASTEXT(GEO) |
+----------------+
| NULL           |
+----------------+
##null##
UPDATE T_GEO SET GEO=sT_GEOmfromtext('point(1 1)',null);
SELECT ST_ASTEXT(GEO) FROM T_GEO;
+----------------+
| ST_ASTEXT(GEO) |
+----------------+
| NULL           |
+----------------+
UPDATE T_GEO SET GEO=sT_GEOmfromtext('point(1 1)',null,null);
SELECT ST_ASTEXT(GEO) FROM T_GEO;
+----------------+
| ST_ASTEXT(GEO) |
+----------------+
| NULL           |
+----------------+
UPDATE T_GEO SET GEO='';
ERROR 22003: Cannot get geometry object from data you send to the GEOMETRY field.
SELECT ST_ASTEXT(GEO) FROM T_GEO;
+----------------+
| ST_ASTEXT(GEO) |
+----------------+
| NULL           |
+----------------+
UPDATE T_GEO SET GEO=null;
SELECT ST_ASTEXT(GEO) FROM T_GEO;
+----------------+
| ST_ASTEXT(GEO) |
+----------------+
| NULL           |
+----------------+
##varchar,int##
UPDATE T_GEO SET GEO='point(1 1)';
ERROR 22003: Cannot get geometry object from data you send to the GEOMETRY field.
SELECT ST_ASTEXT(GEO) FROM T_GEO;
+----------------+
| ST_ASTEXT(GEO) |
+----------------+
| NULL           |
+----------------+
UPDATE T_GEO SET GEO=0;
ERROR 22003: Cannot get geometry object from data you send to the GEOMETRY field.
SELECT ST_ASTEXT(GEO) FROM T_GEO;
+----------------+
| ST_ASTEXT(GEO) |
+----------------+
| NULL           |
+----------------+
##point##
UPDATE T_GEO SET GEO=sT_GEOmfromtext('point(1234567898765432123456789 -12345678998765432123456789)');
SELECT ST_ASTEXT(GEO) FROM T_GEO;
+-----------------------------------------------------+
| ST_ASTEXT(GEO)                                      |
+-----------------------------------------------------+
| POINT(1.2345678987654322e24 -1.2345678998765433e25) |
+-----------------------------------------------------+
UPDATE T_GEO SET GEO=sT_GEOmfromtext('point(1e-16 -1e-16)');
SELECT ST_ASTEXT(GEO) FROM T_GEO;
+---------------------+
| ST_ASTEXT(GEO)      |
+---------------------+
| POINT(1e-16 -1e-16) |
+---------------------+
UPDATE T_GEO SET GEO=sT_GEOmfromtext('point(1e-15 -1e-15)');
SELECT ST_ASTEXT(GEO) FROM T_GEO;
+---------------------------------------------+
| ST_ASTEXT(GEO)                              |
+---------------------------------------------+
| POINT(0.000000000000001 -0.000000000000001) |
+---------------------------------------------+
UPDATE T_GEO SET GEO=sT_GEOmfromtext('point(1e-17 -1e-17)');
SELECT ST_ASTEXT(GEO) FROM T_GEO;
+---------------------+
| ST_ASTEXT(GEO)      |
+---------------------+
| POINT(1e-17 -1e-17) |
+---------------------+
##MULTIPOINT##
UPDATE T_GEO SET GEO=sT_GEOmfromtext('MULTIPOINT (1 1, 2 2, 3 3)');
SELECT ST_ASTEXT(GEO) FROM T_GEO;
+-------------------------------+
| ST_ASTEXT(GEO)                |
+-------------------------------+
| MULTIPOINT((1 1),(2 2),(3 3)) |
+-------------------------------+
UPDATE T_GEO SET GEO=sT_GEOmfromtext('linestring(1 1,1 1)');
SELECT ST_ASTEXT(GEO) FROM T_GEO;
+---------------------+
| ST_ASTEXT(GEO)      |
+---------------------+
| LINESTRING(1 1,1 1) |
+---------------------+
UPDATE T_GEO SET GEO=sT_GEOmfromtext('linestring(0 0,1 1,1 0,0 1)');
SELECT ST_ASTEXT(GEO) FROM T_GEO;
+-----------------------------+
| ST_ASTEXT(GEO)              |
+-----------------------------+
| LINESTRING(0 0,1 1,1 0,0 1) |
+-----------------------------+
UPDATE T_GEO SET GEO=sT_GEOmfromtext('linestring(0 0,1 1,1 0,0 0)');
SELECT ST_ASTEXT(GEO) FROM T_GEO;
+-----------------------------+
| ST_ASTEXT(GEO)              |
+-----------------------------+
| LINESTRING(0 0,1 1,1 0,0 0) |
+-----------------------------+
set @a = sT_GEOmfromtext('linestring(-14.771826959265866 -56.43907781890718,32.16954139509198 -68.80151707515907)');
UPDATE T_GEO SET GEO=@a;
SELECT ST_ASTEXT(GEO) FROM T_GEO;
+-----------------------------------------------------------------------------------------+
| ST_ASTEXT(GEO)                                                                          |
+-----------------------------------------------------------------------------------------+
| LINESTRING(-14.771826959265866 -56.43907781890718,32.16954139509198 -68.80151707515907) |
+-----------------------------------------------------------------------------------------+
UPDATE T_GEO SET GEO=ST_GEOMFROMTEXT('MULTILINESTRING((10 10, 20 20), (15 15, 30 15))');
SELECT ST_ASTEXT(GEO) FROM T_GEO;
+----------------------------------------------+
| ST_ASTEXT(GEO)                               |
+----------------------------------------------+
| MULTILINESTRING((10 10,20 20),(15 15,30 15)) |
+----------------------------------------------+
UPDATE T_GEO SET GEO=ST_GEOMFROMTEXT('polygon((1 1,1 1,1 1,1 1))');
SELECT ST_ASTEXT(GEO) FROM T_GEO;
+----------------------------+
| ST_ASTEXT(GEO)             |
+----------------------------+
| POLYGON((1 1,1 1,1 1,1 1)) |
+----------------------------+
UPDATE T_GEO SET GEO=ST_GEOMFROMTEXT('POLYGON((1 1,1 1,1 1,1 1),(0 0,0 0,0 0,0 0))');
SELECT ST_ASTEXT(GEO) FROM T_GEO;
+----------------------------------------------+
| ST_ASTEXT(GEO)                               |
+----------------------------------------------+
| POLYGON((1 1,1 1,1 1,1 1),(0 0,0 0,0 0,0 0)) |
+----------------------------------------------+
UPDATE T_GEO SET GEO=ST_GEOMFROMTEXT('polygon((1 1,1 1,1 1,1 1),(1 1,1 1,1 1,1 1))');
SELECT ST_ASTEXT(GEO) FROM T_GEO;
+----------------------------------------------+
| ST_ASTEXT(GEO)                               |
+----------------------------------------------+
| POLYGON((1 1,1 1,1 1,1 1),(1 1,1 1,1 1,1 1)) |
+----------------------------------------------+
UPDATE T_GEO SET GEO=ST_GEOMFROMTEXT('polygon((108.8448587 34.2715468, 108.7816873 34.0818121, 109.1009774 34.0795373, 109.0961709 34.2704119, 108.8448587 34.2715468),(108.9166131 34.2701282, 108.7892404 34.1880934, 108.9385858 34.142926, 108.9166131 34.2701282))');
SELECT ST_ASTEXT(GEO) FROM T_GEO;
+----------------------------------------------------------------------------------------------------------------------------------------------------------------------------------------------------------------------------+
| ST_ASTEXT(GEO)                                                                                                                                                                                                             |
+----------------------------------------------------------------------------------------------------------------------------------------------------------------------------------------------------------------------------+
| POLYGON((108.8448587 34.2715468,108.7816873 34.0818121,109.1009774 34.0795373,109.0961709 34.2704119,108.8448587 34.2715468),(108.9166131 34.2701282,108.7892404 34.1880934,108.9385858 34.142926,108.9166131 34.2701282)) |
+----------------------------------------------------------------------------------------------------------------------------------------------------------------------------------------------------------------------------+
UPDATE T_GEO SET GEO=ST_GEOMFROMTEXT('polygon((0 0,1 1,1 0,0 1,0 0))');
SELECT ST_ASTEXT(GEO) FROM T_GEO;
+--------------------------------+
| ST_ASTEXT(GEO)                 |
+--------------------------------+
| POLYGON((0 0,1 1,1 0,0 1,0 0)) |
+--------------------------------+
UPDATE T_GEO SET GEO=ST_GEOMFROMTEXT('polygon((108.7185159 34.3118245, 108.6841836 34.0789686, 108.9801278 34.0596297, 109.1325631 34.1710519, 109.138743 34.2800578, 108.7782541 34.3407446, 108.7185159 34.3118245),(108.7624612 34.2953754, 108.7432351 34.1432101, 108.8064065 34.0897737, 108.9039102 34.0766936, 109.0487924 34.1432101, 109.0975442 34.206835, 108.9396158 34.2914044, 108.7624612 34.2953754),(108.7913003 34.273249, 108.7679544 34.1670751, 108.7858072 34.1164961, 108.824946 34.1005774, 108.9087167 34.1000088, 109.0007272 34.1420735, 109.0542856 34.1920692, 108.9389291 34.2704119, 108.7913003 34.273249),(108.8599649 34.1971807, 108.879191 34.1494611, 108.9368692 34.1665069, 108.9018503 34.2102421, 108.8599649 34.1971807))');
SELECT ST_ASTEXT(GEO) FROM T_GEO;
+-------------------------------------------------------------------------------------------------------------------------------------------------------------------------------------------------------------------------------------------------------------------------------------------------------------------------------------------------------------------------------------------------------------------------------------------------------------------------------------------------------------------------------------------------------------------------------------------------------------------------------------------------------------------------------------------------------+
| ST_ASTEXT(GEO)                                                                                                                                                                                                                                                                                                                                                                                                                                                                                                                                                                                                                                                                                        |
+-------------------------------------------------------------------------------------------------------------------------------------------------------------------------------------------------------------------------------------------------------------------------------------------------------------------------------------------------------------------------------------------------------------------------------------------------------------------------------------------------------------------------------------------------------------------------------------------------------------------------------------------------------------------------------------------------------+
| POLYGON((108.7185159 34.3118245,108.6841836 34.0789686,108.9801278 34.0596297,109.1325631 34.1710519,109.138743 34.2800578,108.7782541 34.3407446,108.7185159 34.3118245),(108.7624612 34.2953754,108.7432351 34.1432101,108.8064065 34.0897737,108.9039102 34.0766936,109.0487924 34.1432101,109.0975442 34.206835,108.9396158 34.2914044,108.7624612 34.2953754),(108.7913003 34.273249,108.7679544 34.1670751,108.7858072 34.1164961,108.824946 34.1005774,108.9087167 34.1000088,109.0007272 34.1420735,109.0542856 34.1920692,108.9389291 34.2704119,108.7913003 34.273249),(108.8599649 34.1971807,108.879191 34.1494611,108.9368692 34.1665069,108.9018503 34.2102421,108.8599649 34.1971807)) |
+-------------------------------------------------------------------------------------------------------------------------------------------------------------------------------------------------------------------------------------------------------------------------------------------------------------------------------------------------------------------------------------------------------------------------------------------------------------------------------------------------------------------------------------------------------------------------------------------------------------------------------------------------------------------------------------------------------+
UPDATE T_GEO SET GEO=ST_GEOMFROMTEXT('polygon((108.8283792 34.2647373, 108.8163629 34.1545752, 108.9571252 34.1841173, 108.8283792 34.2647373),(108.8455453 34.2207466, 108.8304391 34.1736083, 108.8778177 34.1807092, 108.8455453 34.2207466),(108.8630548 34.2116617, 108.8506952 34.1940571, 108.9032235 34.1926372, 108.8630548 34.2116617))');
SELECT ST_ASTEXT(GEO) FROM T_GEO;
+----------------------------------------------------------------------------------------------------------------------------------------------------------------------------------------------------------------------------------------------------------------------------------------------------+
| ST_ASTEXT(GEO)                                                                                                                                                                                                                                                                                     |
+----------------------------------------------------------------------------------------------------------------------------------------------------------------------------------------------------------------------------------------------------------------------------------------------------+
| POLYGON((108.8283792 34.2647373,108.8163629 34.1545752,108.9571252 34.1841173,108.8283792 34.2647373),(108.8455453 34.2207466,108.8304391 34.1736083,108.8778177 34.1807092,108.8455453 34.2207466),(108.8630548 34.2116617,108.8506952 34.1940571,108.9032235 34.1926372,108.8630548 34.2116617)) |
+----------------------------------------------------------------------------------------------------------------------------------------------------------------------------------------------------------------------------------------------------------------------------------------------------+
UPDATE T_GEO SET GEO=ST_GEOMFROMTEXT('MULTIPOLYGON(((1 1,1 1,1 1,1 1)),((1 1,1 1,1 1,1 1)))');
SELECT ST_ASTEXT(GEO) FROM T_GEO;
+-------------------------------------------------------+
| ST_ASTEXT(GEO)                                        |
+-------------------------------------------------------+
| MULTIPOLYGON(((1 1,1 1,1 1,1 1)),((1 1,1 1,1 1,1 1))) |
+-------------------------------------------------------+
UPDATE T_GEO SET GEO=ST_GEOMFROMTEXT('MULTIPOLYGON(((108.8448587 34.2715468, 108.7816873 34.0818121, 109.1009774 34.0795373, 109.0961709 34.2704119, 108.8448587 34.2715468)),((108.9166131 34.2701282, 108.7892404 34.1880934, 108.9385858 34.142926, 108.9166131 34.2701282)))');
SELECT ST_ASTEXT(GEO) FROM T_GEO;
+-------------------------------------------------------------------------------------------------------------------------------------------------------------------------------------------------------------------------------------+
| ST_ASTEXT(GEO)                                                                                                                                                                                                                      |
+-------------------------------------------------------------------------------------------------------------------------------------------------------------------------------------------------------------------------------------+
| MULTIPOLYGON(((108.8448587 34.2715468,108.7816873 34.0818121,109.1009774 34.0795373,109.0961709 34.2704119,108.8448587 34.2715468)),((108.9166131 34.2701282,108.7892404 34.1880934,108.9385858 34.142926,108.9166131 34.2701282))) |
+-------------------------------------------------------------------------------------------------------------------------------------------------------------------------------------------------------------------------------------+
UPDATE T_GEO SET GEO=ST_GEOMFROMTEXT('MULTIPOLYGON(((108.8448587 34.2715468, 108.7816873 34.0818121, 109.1009774 34.0795373, 109.0961709 34.2704119, 108.8448587 34.2715468)),((108.9166131 34.2701282, 108.7892404 34.1880934, 108.9385858 34.142926, 108.9166131 34.2701282)))');
SELECT ST_ASTEXT(GEO) FROM T_GEO;
+-------------------------------------------------------------------------------------------------------------------------------------------------------------------------------------------------------------------------------------+
| ST_ASTEXT(GEO)                                                                                                                                                                                                                      |
+-------------------------------------------------------------------------------------------------------------------------------------------------------------------------------------------------------------------------------------+
| MULTIPOLYGON(((108.8448587 34.2715468,108.7816873 34.0818121,109.1009774 34.0795373,109.0961709 34.2704119,108.8448587 34.2715468)),((108.9166131 34.2701282,108.7892404 34.1880934,108.9385858 34.142926,108.9166131 34.2701282))) |
+-------------------------------------------------------------------------------------------------------------------------------------------------------------------------------------------------------------------------------------+
UPDATE T_GEO SET GEO=ST_GEOMFROMTEXT('GEOMETRYCOLLECTION(POINT(10 10), POINT(30 30), LINESTRING(15 15, 20 20))');
SELECT ST_ASTEXT(GEO) FROM T_GEO;
+-----------------------------------------------------------------------+
| ST_ASTEXT(GEO)                                                        |
+-----------------------------------------------------------------------+
| GEOMETRYCOLLECTION(POINT(10 10),POINT(30 30),LINESTRING(15 15,20 20)) |
+-----------------------------------------------------------------------+
UPDATE T_GEO SET GEO=ST_GEOMFROMTEXT('GEOMETRYCOLLECTION()');
SELECT ST_ASTEXT(GEO) FROM T_GEO;
+--------------------------+
| ST_ASTEXT(GEO)           |
+--------------------------+
| GEOMETRYCOLLECTION EMPTY |
+--------------------------+
UPDATE T_GEO SET GEO=ST_GEOMFROMTEXT('GEOMETRYCOLLECTION empty');
SELECT ST_ASTEXT(GEO) FROM T_GEO;
+--------------------------+
| ST_ASTEXT(GEO)           |
+--------------------------+
| GEOMETRYCOLLECTION EMPTY |
+--------------------------+
UPDATE T_GEO SET GEO=ST_GEOMFROMTEXT('GEOMETRYCOLLECTION(())');
ERROR 22023: Invalid GIS data provided to function st_geomfromtext.
SELECT ST_ASTEXT(GEO) FROM T_GEO;
+--------------------------+
| ST_ASTEXT(GEO)           |
+--------------------------+
| GEOMETRYCOLLECTION EMPTY |
+--------------------------+
UPDATE T_GEO SET GEO=ST_GEOMFROMTEXT('GEOMETRYCOLLECTION(point(0 0))');
SELECT ST_ASTEXT(GEO) FROM T_GEO;
+--------------------------------+
| ST_ASTEXT(GEO)                 |
+--------------------------------+
| GEOMETRYCOLLECTION(POINT(0 0)) |
+--------------------------------+
UPDATE T_GEO SET GEO=st_geomfromtext('GEOMETRYCOLLECTION(point(0 0),linestring(0 0,0 0),polygon((0 0,0 0,0 0,0 0)),MULTIPOINT(0 0,0 0),MULTILINESTRING((0 0,0 0)),MULTIPOLYGON(((0 0,0 0,0 0,0 0))))');
SELECT ST_ASTEXT(GEO) FROM T_GEO;
+--------------------------------------------------------------------------------------------------------------------------------------------------------------------+
| ST_ASTEXT(GEO)                                                                                                                                                     |
+--------------------------------------------------------------------------------------------------------------------------------------------------------------------+
| GEOMETRYCOLLECTION(POINT(0 0),LINESTRING(0 0,0 0),POLYGON((0 0,0 0,0 0,0 0)),MULTIPOINT((0 0),(0 0)),MULTILINESTRING((0 0,0 0)),MULTIPOLYGON(((0 0,0 0,0 0,0 0)))) |
+--------------------------------------------------------------------------------------------------------------------------------------------------------------------+
UPDATE T_GEO SET GEO=ST_GEOMFROMTEXT('MULTIPOINT (1 2, 2 1, 0 0)',4326);
SELECT HEX(GEO) FROM T_GEO;
+----------------------------------------------------------------------------------------------------------------------------------------------------------+
| HEX(GEO)                                                                                                                                                 |
+----------------------------------------------------------------------------------------------------------------------------------------------------------+
| E610000001040000000300000001010000000000000000000040000000000000F03F0101000000000000000000F03F0000000000000040010100000000000000000000000000000000000000 |
+----------------------------------------------------------------------------------------------------------------------------------------------------------+
UPDATE T_GEO SET GEO=ST_GEOMFROMTEXT('MULTIPOINT (1 2, 2 1, 0 0)',3395);
SELECT HEX(GEO) FROM T_GEO;
+----------------------------------------------------------------------------------------------------------------------------------------------------------+
| HEX(GEO)                                                                                                                                                 |
+----------------------------------------------------------------------------------------------------------------------------------------------------------+
| 430D00000104000000030000000101000000000000000000F03F000000000000004001010000000000000000000040000000000000F03F010100000000000000000000000000000000000000 |
+----------------------------------------------------------------------------------------------------------------------------------------------------------+
UPDATE T_GEO SET GEO=ST_GEOMFROMTEXT('MULTIPOINT (1 2, 2 1, 0 0)',26918);
SELECT HEX(GEO) FROM T_GEO;
+----------------------------------------------------------------------------------------------------------------------------------------------------------+
| HEX(GEO)                                                                                                                                                 |
+----------------------------------------------------------------------------------------------------------------------------------------------------------+
| 266900000104000000030000000101000000000000000000F03F000000000000004001010000000000000000000040000000000000F03F010100000000000000000000000000000000000000 |
+----------------------------------------------------------------------------------------------------------------------------------------------------------+
UPDATE T_GEO SET GEO=ST_GEOMFROMTEXT(CONCAT('GEOMETRYCOLLECTION(',CONCAT('LINESTRING(','1796.813742519489 -5625.890596437841',',','-92968.23503214995 -68734.35580112855',')'),')'),4269);
ERROR 22S02: Longitude -5625.890596 is out of range in function st_geomfromtext. It must be within (-180.000000, 180.000000].
SELECT HEX(GEO) FROM T_GEO;
+----------------------------------------------------------------------------------------------------------------------------------------------------------+
| HEX(GEO)                                                                                                                                                 |
+----------------------------------------------------------------------------------------------------------------------------------------------------------+
| 266900000104000000030000000101000000000000000000F03F000000000000004001010000000000000000000040000000000000F03F010100000000000000000000000000000000000000 |
+----------------------------------------------------------------------------------------------------------------------------------------------------------+
UPDATE T_GEO SET GEO=ST_GEOMFROMWKB(x'010700000000000000');
SELECT HEX(GEO) FROM T_GEO;
+----------------------------+
| HEX(GEO)                   |
+----------------------------+
| 00000000010700000000000000 |
+----------------------------+
UPDATE T_GEO SET GEO=ST_GEOMFROMWKB(x'010300000002000000050000006E8F392A12365B40AFAAA80BC2224140B54C2B2A07325B4063F5A2D1780A4140A6A8E96976465B40F4273B472E0A4140EC94FDA927465B4080796DDB9C2241406E8F392A12365B40AFAAA80BC22241400400000074E5FDC9A93A5B401A5D948F93224140A5AB2AEA82325B40F6CBCC71131841405CDF2CCA113C5B40C2DF2F664B12414074E5FDC9A93A5B401A5D948F93224140');
SELECT HEX(GEO) FROM T_GEO;
+--------------------------------------------------------------------------------------------------------------------------------------------------------------------------------------------------------------------------------------------------------------------------------------------------------------------------------------------+
| HEX(GEO)                                                                                                                                                                                                                                                                                                                                   |
+--------------------------------------------------------------------------------------------------------------------------------------------------------------------------------------------------------------------------------------------------------------------------------------------------------------------------------------------+
| 00000000010300000002000000050000006E8F392A12365B40AFAAA80BC2224140B54C2B2A07325B4063F5A2D1780A4140A6A8E96976465B40F4273B472E0A4140EC94FDA927465B4080796DDB9C2241406E8F392A12365B40AFAAA80BC22241400400000074E5FDC9A93A5B401A5D948F93224140A5AB2AEA82325B40F6CBCC71131841405CDF2CCA113C5B40C2DF2F664B12414074E5FDC9A93A5B401A5D948F93224140 |
+--------------------------------------------------------------------------------------------------------------------------------------------------------------------------------------------------------------------------------------------------------------------------------------------------------------------------------------------+
UPDATE T_GEO SET GEO=ST_GEOMFROMTEXT('MULTIPOINT (1 2, 2 1, 0 0)',4326) where gid=1;
SELECT ST_ASTEXT(GEO) FROM T_GEO;
+-------------------------------+
| ST_ASTEXT(GEO)                |
+-------------------------------+
| MULTIPOINT((1 2),(2 1),(0 0)) |
+-------------------------------+
UPDATE T_GEO SET GEO=ST_GEOMFROMTEXT('MULTIPOINT (2 2, 2 2, 2 2)',4326) where GEO=ST_GEOMFROMTEXT('MULTIPOINT (1 2, 2 1, 0 0)',4326);
SELECT ST_ASTEXT(GEO) FROM T_GEO;
+-------------------------------+
| ST_ASTEXT(GEO)                |
+-------------------------------+
| MULTIPOINT((2 2),(2 2),(2 2)) |
+-------------------------------+
UPDATE T_GEO SET GEO=ST_GEOMFROMTEXT('MULTIPOINT (1 1, 1 1, 1 1)',4326) where GEO=ST_GEOMFROMTEXT('MULTIPOINT (2 2, 2 2, 2 2)');
SELECT ST_ASTEXT(GEO) FROM T_GEO;
+-------------------------------+
| ST_ASTEXT(GEO)                |
+-------------------------------+
| MULTIPOINT((2 2),(2 2),(2 2)) |
+-------------------------------+
UPDATE T_GEO SET GEO=ST_GEOMFROMTEXT('MULTIPOINT (1 1, 1 1, 1 1)',4326) where GEO=ST_GEOMFROMTEXT('MULTIPOINT (2 2, 2 2, 2 2)',4326,'axis-order=LONG-LAT');
SELECT ST_ASTEXT(GEO) FROM T_GEO;
+-------------------------------+
| ST_ASTEXT(GEO)                |
+-------------------------------+
| MULTIPOINT((1 1),(1 1),(1 1)) |
+-------------------------------+
UPDATE T_GEO SET GEO=ST_GEOMFROMTEXT('MULTIPOINT (1 2, 1 2, 1 2)',4326) where GEO=ST_GEOMFROMTEXT('MULTIPOINT (1 1, 1 1, 1 1)',4326);
SELECT ST_ASTEXT(GEO) FROM T_GEO;
+-------------------------------+
| ST_ASTEXT(GEO)                |
+-------------------------------+
| MULTIPOINT((1 2),(1 2),(1 2)) |
+-------------------------------+
UPDATE T_GEO SET GEO=ST_GEOMFROMTEXT('MULTIPOINT (2 1, 2 1, 2 1)',4326) where GEO=ST_GEOMFROMTEXT('MULTIPOINT (1 2, 1 2, 1 2)',4326,'axis-order=LONG-LAT');
SELECT ST_ASTEXT(GEO) FROM T_GEO;
+-------------------------------+
| ST_ASTEXT(GEO)                |
+-------------------------------+
| MULTIPOINT((1 2),(1 2),(1 2)) |
+-------------------------------+
INSERT INTO T_GEO(GEO) VALUES (NULL);
UPDATE T_GEO SET GEO=ST_GEOMFROMTEXT('MULTIPOINT (2 1, 2 1, 2 1)',4326) where GEO = '';
SELECT ST_ASTEXT(GEO) FROM T_GEO;
+-------------------------------+
| ST_ASTEXT(GEO)                |
+-------------------------------+
| MULTIPOINT((1 2),(1 2),(1 2)) |
| NULL                          |
+-------------------------------+
UPDATE T_GEO SET GEO=ST_GEOMFROMTEXT('MULTIPOINT (2 1, 2 1, 2 1)',4326) where GEO IS NULL ORDER BY GEO LIMIT 1 ;
SELECT ST_ASTEXT(GEO) FROM T_GEO WHERE GEO= ST_GEOMFROMTEXT('MULTIPOINT (2 1, 2 1, 2 1)',4326);
+-------------------------------+
| ST_ASTEXT(GEO)                |
+-------------------------------+
| MULTIPOINT((2 1),(2 1),(2 1)) |
+-------------------------------+
DELETE FROM T_GEO;
####################GEOMETRYCOLLECTION####################
INSERT INTO T_GEO VALUES (1,NULL,NULL,NULL,NULL,NULL,NULL,NULL,NULL);
UPDATE T_GEO SET GEO_C = st_geomfromtext('GEOMETRYCOLLECTION(point(180 90))');
SELECT ST_ASTEXT(GEO_C) FROM T_GEO;
+-----------------------------------+
| ST_ASTEXT(GEO_C)                  |
+-----------------------------------+
| GEOMETRYCOLLECTION(POINT(180 90)) |
+-----------------------------------+
UPDATE T_GEO SET GEO_C = st_geomfromtext('MULTIPOLYGON(((108.8448587 34.2715468, 108.7816873 34.0818121, 109.1009774 34.0795373, 109.0961709 34.2704119, 108.8448587 34.2715468)),((108.9166131 34.2701282, 108.7892404 34.1880934, 108.9385858 34.142926, 108.9166131 34.2701282)))');
SELECT ST_ASTEXT(GEO_C) FROM T_GEO;
+-------------------------------------------------------------------------------------------------------------------------------------------------------------------------------------------------------------------------------------+
| ST_ASTEXT(GEO_C)                                                                                                                                                                                                                    |
+-------------------------------------------------------------------------------------------------------------------------------------------------------------------------------------------------------------------------------------+
| MULTIPOLYGON(((108.8448587 34.2715468,108.7816873 34.0818121,109.1009774 34.0795373,109.0961709 34.2704119,108.8448587 34.2715468)),((108.9166131 34.2701282,108.7892404 34.1880934,108.9385858 34.142926,108.9166131 34.2701282))) |
+-------------------------------------------------------------------------------------------------------------------------------------------------------------------------------------------------------------------------------------+
UPDATE T_GEO SET GEO_C = st_geomfromtext('MULTIPOINT(180 90)');
SELECT ST_ASTEXT(GEO_C) FROM T_GEO;
+----------------------+
| ST_ASTEXT(GEO_C)     |
+----------------------+
| MULTIPOINT((180 90)) |
+----------------------+
UPDATE T_GEO SET GEO_C = st_geomfromtext('MULTILINESTRING((0 0,0 0))');
SELECT ST_ASTEXT(GEO_C) FROM T_GEO;
+----------------------------+
| ST_ASTEXT(GEO_C)           |
+----------------------------+
| MULTILINESTRING((0 0,0 0)) |
+----------------------------+
UPDATE T_GEO SET GEO_C = st_geomfromtext('MULTIPOLYGON(((1 1,1 1,1 1,1 1)),((1 1,1 1,1 1,1 1)))');
SELECT ST_ASTEXT(GEO_C) FROM T_GEO;
+-------------------------------------------------------+
| ST_ASTEXT(GEO_C)                                      |
+-------------------------------------------------------+
| MULTIPOLYGON(((1 1,1 1,1 1,1 1)),((1 1,1 1,1 1,1 1))) |
+-------------------------------------------------------+
UPDATE T_GEO SET GEO_C = st_geomfromtext('GEOMETRYCOLLECTION(point(0 0),linestring(0 0,0 0),polygon((0 0,0 0,0 0,0 0)),MULTIPOINT(0 0,0 0),MULTILINESTRING((0 0,0 0)),MULTIPOLYGON(((0 0,0 0,0 0,0 0))))');
SELECT ST_ASTEXT(GEO_C) FROM T_GEO;
+--------------------------------------------------------------------------------------------------------------------------------------------------------------------+
| ST_ASTEXT(GEO_C)                                                                                                                                                   |
+--------------------------------------------------------------------------------------------------------------------------------------------------------------------+
| GEOMETRYCOLLECTION(POINT(0 0),LINESTRING(0 0,0 0),POLYGON((0 0,0 0,0 0,0 0)),MULTIPOINT((0 0),(0 0)),MULTILINESTRING((0 0,0 0)),MULTIPOLYGON(((0 0,0 0,0 0,0 0)))) |
+--------------------------------------------------------------------------------------------------------------------------------------------------------------------+
UPDATE T_GEO SET GEO_C = st_geomfromtext('point(180 90)');
ERROR 22003: Cannot get geometry object from data you send to the GEOMETRY field.
SELECT ST_ASTEXT(GEO_C) FROM T_GEO;
+--------------------------------------------------------------------------------------------------------------------------------------------------------------------+
| ST_ASTEXT(GEO_C)                                                                                                                                                   |
+--------------------------------------------------------------------------------------------------------------------------------------------------------------------+
| GEOMETRYCOLLECTION(POINT(0 0),LINESTRING(0 0,0 0),POLYGON((0 0,0 0,0 0,0 0)),MULTIPOINT((0 0),(0 0)),MULTILINESTRING((0 0,0 0)),MULTIPOLYGON(((0 0,0 0,0 0,0 0)))) |
+--------------------------------------------------------------------------------------------------------------------------------------------------------------------+
UPDATE T_GEO SET GEO_C = st_geomfromtext('linestring(1 1,1 1)');
ERROR 22003: Cannot get geometry object from data you send to the GEOMETRY field.
SELECT ST_ASTEXT(GEO_C) FROM T_GEO;
+--------------------------------------------------------------------------------------------------------------------------------------------------------------------+
| ST_ASTEXT(GEO_C)                                                                                                                                                   |
+--------------------------------------------------------------------------------------------------------------------------------------------------------------------+
| GEOMETRYCOLLECTION(POINT(0 0),LINESTRING(0 0,0 0),POLYGON((0 0,0 0,0 0,0 0)),MULTIPOINT((0 0),(0 0)),MULTILINESTRING((0 0,0 0)),MULTIPOLYGON(((0 0,0 0,0 0,0 0)))) |
+--------------------------------------------------------------------------------------------------------------------------------------------------------------------+
UPDATE T_GEO SET GEO_C = st_geomfromtext('polygon((1 1,1 1,1 1,1 1))');
ERROR 22003: Cannot get geometry object from data you send to the GEOMETRY field.
SELECT ST_ASTEXT(GEO_C) FROM T_GEO;
+--------------------------------------------------------------------------------------------------------------------------------------------------------------------+
| ST_ASTEXT(GEO_C)                                                                                                                                                   |
+--------------------------------------------------------------------------------------------------------------------------------------------------------------------+
| GEOMETRYCOLLECTION(POINT(0 0),LINESTRING(0 0,0 0),POLYGON((0 0,0 0,0 0,0 0)),MULTIPOINT((0 0),(0 0)),MULTILINESTRING((0 0,0 0)),MULTIPOLYGON(((0 0,0 0,0 0,0 0)))) |
+--------------------------------------------------------------------------------------------------------------------------------------------------------------------+
UPDATE T_GEO SET GEO_C = (null);
SELECT ST_ASTEXT(GEO_C) FROM T_GEO;
+------------------+
| ST_ASTEXT(GEO_C) |
+------------------+
| NULL             |
+------------------+
UPDATE T_GEO SET GEO_C = (st_geomfromtext(null));
SELECT ST_ASTEXT(GEO_C) FROM T_GEO;
+------------------+
| ST_ASTEXT(GEO_C) |
+------------------+
| NULL             |
+------------------+
UPDATE T_GEO SET GEO_C =(st_geomfromtext('point(180 90)',null));
SELECT ST_ASTEXT(GEO_C) FROM T_GEO;
+------------------+
| ST_ASTEXT(GEO_C) |
+------------------+
| NULL             |
+------------------+
UPDATE T_GEO SET GEO_C =(st_geomfromtext('point(180 90)',null,null));
SELECT ST_ASTEXT(GEO_C) FROM T_GEO;
+------------------+
| ST_ASTEXT(GEO_C) |
+------------------+
| NULL             |
+------------------+
UPDATE T_GEO SET GEO_C = (st_geomfromtext('GEOMETRYCOLLECTION()'));
SELECT ST_ASTEXT(GEO_C) FROM T_GEO;
+--------------------------+
| ST_ASTEXT(GEO_C)         |
+--------------------------+
| GEOMETRYCOLLECTION EMPTY |
+--------------------------+
UPDATE T_GEO SET GEO_C = (st_geomfromtext('GEOMETRYCOLLECTION empty'));
SELECT ST_ASTEXT(GEO_C) FROM T_GEO;
+--------------------------+
| ST_ASTEXT(GEO_C)         |
+--------------------------+
| GEOMETRYCOLLECTION EMPTY |
+--------------------------+
UPDATE T_GEO SET GEO_C = (st_geomfromtext('MULTIPOINT(180 90)',4326));
ERROR 22S03: Latitude 180.000000 is out of range in function st_geomfromtext. It must be within [-90.000000, 90.000000].
SELECT ST_ASTEXT(GEO_C) FROM T_GEO;
+--------------------------+
| ST_ASTEXT(GEO_C)         |
+--------------------------+
| GEOMETRYCOLLECTION EMPTY |
+--------------------------+
UPDATE T_GEO SET GEO_C = (st_geomfromtext('MULTIPOINT(180 90)',4326,'axis-order=long-lat'));
SELECT ST_ASTEXT(GEO_C) FROM T_GEO;
+----------------------+
| ST_ASTEXT(GEO_C)     |
+----------------------+
| MULTIPOINT((90 180)) |
+----------------------+
UPDATE T_GEO SET GEO_C = (st_geomfromtext('MULTIPOINT(80 90)',4326,'axis-order=lat-long'));
SELECT ST_ASTEXT(GEO_C) FROM T_GEO;
+---------------------+
| ST_ASTEXT(GEO_C)    |
+---------------------+
| MULTIPOINT((80 90)) |
+---------------------+
UPDATE T_GEO SET GEO_C = (ST_GEOMFROMWKB(X'01070000000200000001040000000200000001010000000000000000000000000000000000F0BF0101000000000000000000F0BF00000000000000000104000000010000000101000000000000000000F0BF0000000000000000')) ;
SELECT ST_ASTEXT(GEO_C) FROM T_GEO;
+------------------------------------------------------------------+
| ST_ASTEXT(GEO_C)                                                 |
+------------------------------------------------------------------+
| GEOMETRYCOLLECTION(MULTIPOINT((0 -1),(-1 0)),MULTIPOINT((-1 0))) |
+------------------------------------------------------------------+
UPDATE T_GEO SET GEO_C = (ST_GEOMFROMWKB(X'01060000000200000001030000000200000004000000000000000000000000000000000000000000000000000000000000000000F03F000000000000F03F00000000000000000000000000000000000000000000000004000000295C8FC2F528BC3F295C8FC2F528BC3FB81E85EB51B8BE3FB81E85EB51B8BE3FA4703D0AD7A3C03FA4703D0AD7A3C03F295C8FC2F528BC3F295C8FC2F528BC3F01030000000200000004000000000000000000000000000000000000000000000000000000000000000000F03F000000000000F03F0000000000000000000000000000000000000000000000000400000000000000000000000000000000000000000000000000F03F000000000000F03F000000000000F03F000000000000000000000000000000000000000000000000')) ;
SELECT ST_ASTEXT(GEO_C) FROM T_GEO;
+-------------------------------------------------------------------------------------------------------------------+
| ST_ASTEXT(GEO_C)                                                                                                  |
+-------------------------------------------------------------------------------------------------------------------+
| MULTIPOLYGON(((0 0,0 1,1 0,0 0),(0.11 0.11,0.12 0.12,0.13 0.13,0.11 0.11)),((0 0,0 1,1 0,0 0),(0 0,1 1,1 0,0 0))) |
+-------------------------------------------------------------------------------------------------------------------+
UPDATE T_GEO SET GEO_C = (ST_GEOMFROMWKB(X'0104000000030000000101000000000000000000F03F000000000000F03F010100000000000000000000400000000000000040010100000000000000000008400000000000000840')) ;
SELECT ST_ASTEXT(GEO_C) FROM T_GEO;
+-------------------------------+
| ST_ASTEXT(GEO_C)              |
+-------------------------------+
| MULTIPOINT((1 1),(2 2),(3 3)) |
+-------------------------------+
UPDATE T_GEO SET GEO_C = (ST_GEOMETRYFROMWKB(X'0104000000030000000101000000000000000000F03F000000000000F03F010100000000000000000000400000000000000040010100000000000000000008400000000000000840')) ;
SELECT ST_ASTEXT(GEO_C) FROM T_GEO;
+-------------------------------+
| ST_ASTEXT(GEO_C)              |
+-------------------------------+
| MULTIPOINT((1 1),(2 2),(3 3)) |
+-------------------------------+
UPDATE T_GEO SET GEO_C = (ST_GEOMETRYFROMWKB(X'010700000000000000')) ;
SELECT ST_ASTEXT(GEO_C) FROM T_GEO;
+--------------------------+
| ST_ASTEXT(GEO_C)         |
+--------------------------+
| GEOMETRYCOLLECTION EMPTY |
+--------------------------+
UPDATE T_GEO SET GEO_C=ST_GEOMFROMTEXT('MULTIPOINT (1 2, 2 1, 0 0)',4326) where gid=1;
SELECT ST_ASTEXT(GEO_C) FROM T_GEO WHERE GID=1;
+-------------------------------+
| ST_ASTEXT(GEO_C)              |
+-------------------------------+
| MULTIPOINT((1 2),(2 1),(0 0)) |
+-------------------------------+
UPDATE T_GEO SET GEO_C=ST_GEOMFROMTEXT('MULTIPOINT (2 2, 2 2, 2 2)',4326) where GEO_C=ST_GEOMFROMTEXT('MULTIPOINT (1 2, 2 1, 0 0)',4326);
SELECT ST_ASTEXT(GEO_C) FROM T_GEO WHERE GEO_C=ST_GEOMFROMTEXT('MULTIPOINT (2 2, 2 2, 2 2)',4326);
+-------------------------------+
| ST_ASTEXT(GEO_C)              |
+-------------------------------+
| MULTIPOINT((2 2),(2 2),(2 2)) |
+-------------------------------+
UPDATE T_GEO SET GEO_C=ST_GEOMFROMTEXT('MULTIPOINT (1 1, 1 1, 1 1)',4326) where GEO_C=ST_GEOMFROMTEXT('MULTIPOINT (2 2, 2 2, 2 2)');
SELECT ST_ASTEXT(GEO_C) FROM T_GEO;
+-------------------------------+
| ST_ASTEXT(GEO_C)              |
+-------------------------------+
| MULTIPOINT((2 2),(2 2),(2 2)) |
+-------------------------------+
UPDATE T_GEO SET GEO_C=ST_GEOMFROMTEXT('MULTIPOINT (1 1, 1 1, 1 1)',4326) where GEO_C=ST_GEOMFROMTEXT('MULTIPOINT (2 2, 2 2, 2 2)',4326,'axis-order=LONG-LAT');
SELECT ST_ASTEXT(GEO_C) FROM T_GEO;
+-------------------------------+
| ST_ASTEXT(GEO_C)              |
+-------------------------------+
| MULTIPOINT((1 1),(1 1),(1 1)) |
+-------------------------------+
UPDATE T_GEO SET GEO_C=ST_GEOMFROMTEXT('MULTIPOINT (1 2, 1 2, 1 2)',4326) where GEO_C=ST_GEOMFROMTEXT('MULTIPOINT (1 1, 1 1, 1 1)',4326);
SELECT ST_ASTEXT(GEO_C) FROM T_GEO;
+-------------------------------+
| ST_ASTEXT(GEO_C)              |
+-------------------------------+
| MULTIPOINT((1 2),(1 2),(1 2)) |
+-------------------------------+
UPDATE T_GEO SET GEO_C=ST_GEOMFROMTEXT('MULTIPOINT (2 1, 2 1, 2 1)',4326) where GEO_C=ST_GEOMFROMTEXT('MULTIPOINT (1 2, 1 2, 1 2)',4326,'axis-order=LONG-LAT');
SELECT ST_ASTEXT(GEO_C) FROM T_GEO;
+-------------------------------+
| ST_ASTEXT(GEO_C)              |
+-------------------------------+
| MULTIPOINT((1 2),(1 2),(1 2)) |
+-------------------------------+
INSERT INTO T_GEO(GEO_C) VALUES (NULL);
UPDATE T_GEO SET GEO_C=ST_GEOMFROMTEXT('MULTIPOINT (2 1, 2 1, 2 1)',4326) where GEO_C = '';
SELECT ST_ASTEXT(GEO_C) FROM T_GEO;
+-------------------------------+
| ST_ASTEXT(GEO_C)              |
+-------------------------------+
| MULTIPOINT((1 2),(1 2),(1 2)) |
| NULL                          |
+-------------------------------+
UPDATE T_GEO SET GEO_C=ST_GEOMFROMTEXT('MULTIPOINT (2 1, 2 1, 2 1)',4326) where GEO_C IS NULL ORDER BY GEO LIMIT 1 ;
SELECT GID,ST_ASTEXT(GEO_C) FROM T_GEO WHERE GEO_C= ST_GEOMFROMTEXT('MULTIPOINT (2 1, 2 1, 2 1)',4326);
+-----+-------------------------------+
| GID | ST_ASTEXT(GEO_C)              |
+-----+-------------------------------+
|   3 | MULTIPOINT((2 1),(2 1),(2 1)) |
+-----+-------------------------------+
INSERT INTO T_GEO(GEO_C) VALUES (ST_GEOMFROMTEXT('MULTIPOINT (1 2, 1 2, 1 2)'));
UPDATE T_GEO SET GEO_C=ST_GEOMFROMTEXT('MULTIPOINT (3 1, 3 1, 3 1)',4326) where GEO_C=ST_GEOMETRYFROMWKB(X'0104000000030000000101000000000000000000F03F00000000000000400101000000000000000000F03F00000000000000400101000000000000000000F03F0000000000000040') ORDER BY GEO LIMIT 1 ;
SELECT ST_ASTEXT(GEO_C) FROM T_GEO ;
+-------------------------------+
| ST_ASTEXT(GEO_C)              |
+-------------------------------+
| MULTIPOINT((1 2),(1 2),(1 2)) |
| MULTIPOINT((2 1),(2 1),(2 1)) |
| MULTIPOINT((3 1),(3 1),(3 1)) |
+-------------------------------+
DELETE FROM T_GEO;
##############POI,M_POI,LIN,M_LIN,POL,M_POL############
INSERT INTO T_GEO(poi,M_POI,LIN,M_LIN,POL,M_POL) VALUES (null,NULL,NULL,NULL,NULL,NULL);
UPDATE T_GEO SET POI=ST_GEOMFROMTEXT(NULL),M_POI=ST_GEOMFROMTEXT(NULL),LIN=ST_GEOMFROMTEXT(NULL),M_LIN=ST_GEOMFROMTEXT(NULL),POL=ST_GEOMFROMTEXT(NULL),M_POL=ST_GEOMFROMTEXT(NULL);
SELECT ST_ASTEXT(POI),ST_ASTEXT(M_POI),ST_ASTEXT(LIN),ST_ASTEXT(M_LIN),ST_ASTEXT(POL),ST_ASTEXT(M_POL) FROM T_GEO;
+----------------+------------------+----------------+------------------+----------------+------------------+
| ST_ASTEXT(POI) | ST_ASTEXT(M_POI) | ST_ASTEXT(LIN) | ST_ASTEXT(M_LIN) | ST_ASTEXT(POL) | ST_ASTEXT(M_POL) |
+----------------+------------------+----------------+------------------+----------------+------------------+
| NULL           | NULL             | NULL           | NULL             | NULL           | NULL             |
+----------------+------------------+----------------+------------------+----------------+------------------+
UPDATE T_GEO SET POI=(st_geomfromtext('GEOMETRYCOLLECTION EMPTY'));
ERROR 22003: Cannot get geometry object from data you send to the GEOMETRY field.
UPDATE T_GEO SET M_POI=(st_geomfromtext('GEOMETRYCOLLECTION EMPTY'));
ERROR 22003: Cannot get geometry object from data you send to the GEOMETRY field.
UPDATE T_GEO SET LIN=(st_geomfromtext('GEOMETRYCOLLECTION EMPTY'));
ERROR 22003: Cannot get geometry object from data you send to the GEOMETRY field.
UPDATE T_GEO SET M_LIN=(st_geomfromtext('GEOMETRYCOLLECTION EMPTY'));
ERROR 22003: Cannot get geometry object from data you send to the GEOMETRY field.
UPDATE T_GEO SET POL=(st_geomfromtext('GEOMETRYCOLLECTION EMPTY'));
ERROR 22003: Cannot get geometry object from data you send to the GEOMETRY field.
UPDATE T_GEO SET M_POL=(st_geomfromtext('GEOMETRYCOLLECTION EMPTY'));
ERROR 22003: Cannot get geometry object from data you send to the GEOMETRY field.
UPDATE T_GEO SET POI=(st_geomfromtext('MULTIPOINT (1 1, 2 2, 3 3)'));
ERROR 22003: Cannot get geometry object from data you send to the GEOMETRY field.
UPDATE T_GEO SET POI=(st_geomfromtext('linestring(1 1,1 1)'));
ERROR 22003: Cannot get geometry object from data you send to the GEOMETRY field.
UPDATE T_GEO SET POI=(st_geomfromtext('MULTILINESTRING((10 10, 20 20), (15 15, 30 15))'));
ERROR 22003: Cannot get geometry object from data you send to the GEOMETRY field.
UPDATE T_GEO SET POI=(st_geomfromtext('polygon((1 1,1 1,1 1,1 1))'));
ERROR 22003: Cannot get geometry object from data you send to the GEOMETRY field.
UPDATE T_GEO SET POI=(st_geomfromtext('MULTIPOLYGON(((1 1,1 1,1 1,1 1)),((1 1,1 1,1 1,1 1)))'));
ERROR 22003: Cannot get geometry object from data you send to the GEOMETRY field.
UPDATE T_GEO SET M_POI=(st_geomfromtext('point(180 -180)'));
ERROR 22003: Cannot get geometry object from data you send to the GEOMETRY field.
UPDATE T_GEO SET M_POI=(st_geomfromtext('linestring(1 1,1 1)'));
ERROR 22003: Cannot get geometry object from data you send to the GEOMETRY field.
UPDATE T_GEO SET M_POI=(st_geomfromtext('MULTILINESTRING((10 10, 20 20), (15 15, 30 15))'));
ERROR 22003: Cannot get geometry object from data you send to the GEOMETRY field.
UPDATE T_GEO SET M_POI=(st_geomfromtext('polygon((1 1,1 1,1 1,1 1))'));
ERROR 22003: Cannot get geometry object from data you send to the GEOMETRY field.
UPDATE T_GEO SET M_POI=(st_geomfromtext('MULTIPOLYGON(((1 1,1 1,1 1,1 1)),((1 1,1 1,1 1,1 1)))'));
ERROR 22003: Cannot get geometry object from data you send to the GEOMETRY field.
UPDATE T_GEO SET M_POI=(st_geomfromtext('GEOMETRYCOLLECTION(POINT(10 10), POINT(30 30))'));
ERROR 22003: Cannot get geometry object from data you send to the GEOMETRY field.
UPDATE T_GEO SET LIN=(st_geomfromtext('point(180 -180)'));
ERROR 22003: Cannot get geometry object from data you send to the GEOMETRY field.
UPDATE T_GEO SET LIN=(st_geomfromtext('MULTIPOINT (1 1, 2 2, 3 3)'));
ERROR 22003: Cannot get geometry object from data you send to the GEOMETRY field.
UPDATE T_GEO SET LIN=(st_geomfromtext('MULTILINESTRING((10 10, 20 20), (15 15, 30 15))'));
ERROR 22003: Cannot get geometry object from data you send to the GEOMETRY field.
UPDATE T_GEO SET LIN=(st_geomfromtext('polygon((1 1,1 1,1 1,1 1))'));
ERROR 22003: Cannot get geometry object from data you send to the GEOMETRY field.
UPDATE T_GEO SET LIN=(st_geomfromtext('MULTIPOLYGON(((1 1,1 1,1 1,1 1)),((1 1,1 1,1 1,1 1)))'));
ERROR 22003: Cannot get geometry object from data you send to the GEOMETRY field.
UPDATE T_GEO SET M_LIN=(st_geomfromtext('point(180 -180)'));
ERROR 22003: Cannot get geometry object from data you send to the GEOMETRY field.
UPDATE T_GEO SET M_LIN=(st_geomfromtext('MULTIPOINT (1 1, 2 2, 3 3)'));
ERROR 22003: Cannot get geometry object from data you send to the GEOMETRY field.
UPDATE T_GEO SET M_LIN=(st_geomfromtext('linestring(1 1,1 1)'));
ERROR 22003: Cannot get geometry object from data you send to the GEOMETRY field.
UPDATE T_GEO SET M_LIN=(st_geomfromtext('polygon((1 1,1 1,1 1,1 1))'));
ERROR 22003: Cannot get geometry object from data you send to the GEOMETRY field.
UPDATE T_GEO SET M_LIN=(st_geomfromtext('MULTIPOLYGON(((1 1,1 1,1 1,1 1)),((1 1,1 1,1 1,1 1)))'));
ERROR 22003: Cannot get geometry object from data you send to the GEOMETRY field.
UPDATE T_GEO SET POL=(st_geomfromtext('point(180 -180)'));
ERROR 22003: Cannot get geometry object from data you send to the GEOMETRY field.
UPDATE T_GEO SET POL=(st_geomfromtext('MULTIPOINT (1 1, 2 2, 3 3)'));
ERROR 22003: Cannot get geometry object from data you send to the GEOMETRY field.
UPDATE T_GEO SET POL=(st_geomfromtext('linestring(1 1,1 1)'));
ERROR 22003: Cannot get geometry object from data you send to the GEOMETRY field.
UPDATE T_GEO SET POL=(st_geomfromtext('MULTILINESTRING((10 10, 20 20), (15 15, 30 15))'));
ERROR 22003: Cannot get geometry object from data you send to the GEOMETRY field.
UPDATE T_GEO SET POL=(st_geomfromtext('MULTIPOLYGON(((1 1,1 1,1 1,1 1)),((1 1,1 1,1 1,1 1)))'));
ERROR 22003: Cannot get geometry object from data you send to the GEOMETRY field.
UPDATE T_GEO SET M_POL=(st_geomfromtext('point(180 -180)'));
ERROR 22003: Cannot get geometry object from data you send to the GEOMETRY field.
UPDATE T_GEO SET M_POL=(st_geomfromtext('MULTIPOINT (1 1, 2 2, 3 3)'));
ERROR 22003: Cannot get geometry object from data you send to the GEOMETRY field.
UPDATE T_GEO SET M_POL=(st_geomfromtext('linestring(1 1,1 1)'));
ERROR 22003: Cannot get geometry object from data you send to the GEOMETRY field.
UPDATE T_GEO SET M_POL=(st_geomfromtext('MULTILINESTRING((10 10, 20 20), (15 15, 30 15))'));
ERROR 22003: Cannot get geometry object from data you send to the GEOMETRY field.
UPDATE T_GEO SET M_POL=(st_geomfromtext('polygon((1 1,1 1,1 1,1 1))'));
ERROR 22003: Cannot get geometry object from data you send to the GEOMETRY field.
UPDATE T_GEO SET POI=ST_GEOMFROMTEXT(CONCAT('POINT(','1e-16 1e-16',')'),0,'axis-order=srid-defined'),M_POI=ST_GEOMFROMTEXT(CONCAT('MULTIPOINT(','2 2',')'),4326,NULL),LIN=ST_GEOMFROMTEXT(CONCAT('LINESTRING(','-48357.57927018633 43540.5814967723',',','-2057.8252218124508 -5980.149997060238',',','1e-15 1e-15',',','-421.0284002202159 119.03658635503689',')'),3395,'axis-order=lat-long'),M_LIN=ST_GEOMFROMTEXT(CONCAT('MULTILINESTRING(',CONCAT('(','1 2',',','1 0',',','1796.813742519489 -5625.890596437841',',','668.0694770528178 -232.7649236132885',')'),',',CONCAT('(','-537.4528627587551 -378.5985437586205',',','527.050859903703 -155.90278593360551',')'),')'),NULL,'axis-order=long-lat'),POL=ST_GEOMFROMTEXT('POLYGON((0 18640956.411258712,19102427.276775245 25305352.105271727,19679991.65063813 8223634.6452743495,41396328.4672789 -11927305.114682678,58356723.05457695 -78201636.59178922,-12082356.046457496 -23781955.162716646,-20405722.611202523 15080280.222545808,-13854752.859030265 22353875.632208023,0 18640956.411258712))',26918,'axis-order=srid-defined'),M_POL=ST_GEOMFROMTEXT(CONCAT('MULTIPOLYGON(',SUBSTRING('POLYGON((1e-16 1e-16,1e-15 1e-15,1e-14 1e-14,1e-17 1e-17,1e-16 1e-16))',8),',',SUBSTRING('POLYGON((0 8239957.714402309,388488.89820658613 -108216.66174708401,5997448.474278114 -6856929.402862601,5971512.938490311 -7236159.803958585,-5988253.046446193 -6790986.639156384,-5169269.666311893 -1560255.7016074874,-9717448.312906547 -976928.7239688709,-5784094.855505731 507386.16432881926,-4771724.315781364 3985052.657764614,0 8239957.714402309))',8),',',SUBSTRING('POLYGON((387.28033477051713 248.66984325272472,105.20438337133277 -27.525375017126805,-270.0331544580052 -724.4465755354305,-223.03864176342444 -225.43800247764153,-723.6349219960895 320.8725171629145,-71.9375373898553 214.68437907015678,387.28033477051713 248.66984325272472))',8),')'),26918,'axis-order=long-lat');
SELECT ST_ASTEXT(POI),ST_ASTEXT(M_POI),ST_ASTEXT(LIN),ST_ASTEXT(M_LIN),ST_ASTEXT(POL),ST_ASTEXT(M_POL) FROM T_GEO;
+--------------------+------------------+------------------------------------------------------------------------------------------------------------------------------------------------------------------+------------------+---------------------------------------------------------------------------------------------------------------------------------------------------------------------------------------------------------------------------------------------------------------------------------------------------------------------------------+-----------------------------------------------------------------------------------------------------------------------------------------------------------------------------------------------------------------------------------------------------------------------------------------------------------------------------------------------------------------------------------------------------------------------------------------------------------------------------------------------------------------------------------------------------------------------------------------------------------------------------------------------------------------------------------------------------------------------------------------------------------------------+
| ST_ASTEXT(POI)     | ST_ASTEXT(M_POI) | ST_ASTEXT(LIN)                                                                                                                                                   | ST_ASTEXT(M_LIN) | ST_ASTEXT(POL)                                                                                                                                                                                                                                                                                                                  | ST_ASTEXT(M_POL)                                                                                                                                                                                                                                                                                                                                                                                                                                                                                                                                                                                                                                                                                                                                                      |
+--------------------+------------------+------------------------------------------------------------------------------------------------------------------------------------------------------------------+------------------+---------------------------------------------------------------------------------------------------------------------------------------------------------------------------------------------------------------------------------------------------------------------------------------------------------------------------------+-----------------------------------------------------------------------------------------------------------------------------------------------------------------------------------------------------------------------------------------------------------------------------------------------------------------------------------------------------------------------------------------------------------------------------------------------------------------------------------------------------------------------------------------------------------------------------------------------------------------------------------------------------------------------------------------------------------------------------------------------------------------------+
| POINT(1e-16 1e-16) | NULL             | LINESTRING(-48357.57927018633 43540.5814967723,-2057.8252218124508 -5980.149997060238,0.000000000000001 0.000000000000001,-421.0284002202159 119.03658635503689) | NULL             | POLYGON((0 18640956.411258712,19102427.276775245 25305352.105271727,19679991.65063813 8223634.6452743495,41396328.4672789 -11927305.114682678,58356723.05457695 -78201636.59178922,-12082356.046457496 -23781955.162716646,-20405722.611202523 15080280.222545808,-13854752.859030265 22353875.632208023,0 18640956.411258712)) | MULTIPOLYGON(((1e-16 1e-16,0.000000000000001 0.000000000000001,0.00000000000001 0.00000000000001,1e-17 1e-17,1e-16 1e-16)),((0 8239957.714402309,388488.89820658613 -108216.66174708401,5997448.474278114 -6856929.402862601,5971512.938490311 -7236159.803958585,-5988253.046446193 -6790986.639156384,-5169269.666311893 -1560255.7016074874,-9717448.312906547 -976928.7239688709,-5784094.855505731 507386.16432881926,-4771724.315781364 3985052.657764614,0 8239957.714402309)),((387.28033477051713 248.66984325272472,105.20438337133277 -27.525375017126805,-270.0331544580052 -724.4465755354305,-223.03864176342444 -225.43800247764153,-723.6349219960895 320.8725171629145,-71.9375373898553 214.68437907015678,387.28033477051713 248.66984325272472))) |
+--------------------+------------------+------------------------------------------------------------------------------------------------------------------------------------------------------------------+------------------+---------------------------------------------------------------------------------------------------------------------------------------------------------------------------------------------------------------------------------------------------------------------------------------------------------------------------------+-----------------------------------------------------------------------------------------------------------------------------------------------------------------------------------------------------------------------------------------------------------------------------------------------------------------------------------------------------------------------------------------------------------------------------------------------------------------------------------------------------------------------------------------------------------------------------------------------------------------------------------------------------------------------------------------------------------------------------------------------------------------------+
UPDATE T_GEO SET POI=ST_GEOMFROMWKB(X'010100000012123132132123131545642315421542'),M_POI=ST_GEOMFROMWKB(X'0104000000020000000101000000E8BA85778DBA6FC07263CBA2C72A70C00101000000FC69C4EEEEC4EBC05A102F1A6E8CF640'),LIN=ST_GEOMFROMWKB(X'010200000002000000FCD18BA5A82CED3FF88E6676F1CF11409F627BD51CB70E40C860D2B5BC4C1340'),M_LIN=ST_GEOMFROMWKB(X'0105000000010000000102000000020000000000000000000000000000000000000000000000000000000000000000000000'),POL=ST_GEOMFROMWKB(X'01030000000200000004000000000000000000000000000000000000000000000000000000000000000000F03F000000000000F03F0000000000000000000000000000000000000000000000000400000000000000000000000000000000000000000000000000000000000000000000400000000000000040000000000000000000000000000000000000000000000000'),M_POL=ST_GEOMFROMWKB(X'01060000000200000001030000000200000004000000000000000000000000000000000000000000000000000000000000000000F03F000000000000F03F00000000000000000000000000000000000000000000000004000000295C8FC2F528BC3F295C8FC2F528BC3FB81E85EB51B8BE3FB81E85EB51B8BE3FA4703D0AD7A3C03FA4703D0AD7A3C03F295C8FC2F528BC3F295C8FC2F528BC3F01030000000200000004000000000000000000000000000000000000000000000000000000000000000000F03F000000000000F03F0000000000000000000000000000000000000000000000000400000000000000000000000000000000000000000000000000F03F000000000000F03F000000000000F03F000000000000000000000000000000000000000000000000');
SELECT ST_ASTEXT(POI),ST_ASTEXT(M_POI),ST_ASTEXT(LIN),ST_ASTEXT(M_LIN),ST_ASTEXT(POL),ST_ASTEXT(M_POL) FROM T_GEO;
+---------------------------------------------------+---------------------------------------------------------------------------------------------+-------------------------------------------------------------------------------------+----------------------------+----------------------------------------------+-------------------------------------------------------------------------------------------------------------------+
| ST_ASTEXT(POI)                                    | ST_ASTEXT(M_POI)                                                                            | ST_ASTEXT(LIN)                                                                      | ST_ASTEXT(M_LIN)           | ST_ASTEXT(POL)                               | ST_ASTEXT(M_POL)                                                                                                  |
+---------------------------------------------------+---------------------------------------------------------------------------------------------+-------------------------------------------------------------------------------------+----------------------------+----------------------------------------------+-------------------------------------------------------------------------------------------------------------------+
| POINT(1.7340831370586944e-216 22825748697.067463) | MULTIPOINT((-253.82976890677605 -258.6737392372953),(-56871.46664639187 92358.88139253986)) | LINESTRING(0.911701510746354 4.453069543847725,3.839410465076369 4.824938622441728) | MULTILINESTRING((0 0,0 0)) | POLYGON((0 0,0 1,1 0,0 0),(0 0,0 2,2 0,0 0)) | MULTIPOLYGON(((0 0,0 1,1 0,0 0),(0.11 0.11,0.12 0.12,0.13 0.13,0.11 0.11)),((0 0,0 1,1 0,0 0),(0 0,1 1,1 0,0 0))) |
+---------------------------------------------------+---------------------------------------------------------------------------------------------+-------------------------------------------------------------------------------------+----------------------------+----------------------------------------------+-------------------------------------------------------------------------------------------------------------------+
##############VIEW##############
######update#####
drop table if exists T_GEO;
drop view if exists V_T_GEO;
create table T_GEO (gid int auto_increment primary key, geo geometry ,geo_c GEOMETRYCOLLECTION,poi point,lin linestring ,pol polygon,M_POI MULTIPOINT,M_LIN MULTILINESTRING ,M_POL MULTIPOLYGON );
create view V_T_GEO AS SELECT * FROM T_GEO;
INSERT INTO V_T_GEO VALUES (1,NULL,NULL,NULL,NULL,NULL,NULL,NULL,NULL);
UPDATE V_T_GEO SET GEO=ST_GEOmfromtext('POINT(1 1)');
SELECT ST_ASTEXT(GEO),ST_ASTEXT(GEO_C),ST_ASTEXT(POI),ST_ASTEXT(M_POI),ST_ASTEXT(LIN),ST_ASTEXT(M_LIN),ST_ASTEXT(POL),ST_ASTEXT(M_POL) FROM V_T_GEO;
+----------------+------------------+----------------+------------------+----------------+------------------+----------------+------------------+
| ST_ASTEXT(GEO) | ST_ASTEXT(GEO_C) | ST_ASTEXT(POI) | ST_ASTEXT(M_POI) | ST_ASTEXT(LIN) | ST_ASTEXT(M_LIN) | ST_ASTEXT(POL) | ST_ASTEXT(M_POL) |
+----------------+------------------+----------------+------------------+----------------+------------------+----------------+------------------+
| POINT(1 1)     | NULL             | NULL           | NULL             | NULL           | NULL             | NULL           | NULL             |
+----------------+------------------+----------------+------------------+----------------+------------------+----------------+------------------+
################geometry#################
UPDATE V_T_GEO SET GEO=ST_GEOmfromtext(NULL);
SELECT ST_ASTEXT(GEO) FROM V_T_GEO;
+----------------+
| ST_ASTEXT(GEO) |
+----------------+
| NULL           |
+----------------+
##null##
UPDATE V_T_GEO SET GEO=ST_GEOmfromtext('point(1 1)',null);
SELECT ST_ASTEXT(GEO) FROM V_T_GEO;
+----------------+
| ST_ASTEXT(GEO) |
+----------------+
| NULL           |
+----------------+
UPDATE V_T_GEO SET GEO=ST_GEOmfromtext('point(1 1)',null,null);
SELECT ST_ASTEXT(GEO) FROM V_T_GEO;
+----------------+
| ST_ASTEXT(GEO) |
+----------------+
| NULL           |
+----------------+
UPDATE V_T_GEO SET GEO='';
ERROR 22003: Cannot get geometry object from data you send to the GEOMETRY field.
SELECT ST_ASTEXT(GEO) FROM V_T_GEO;
+----------------+
| ST_ASTEXT(GEO) |
+----------------+
| NULL           |
+----------------+
UPDATE V_T_GEO SET GEO=null;
SELECT ST_ASTEXT(GEO) FROM V_T_GEO;
+----------------+
| ST_ASTEXT(GEO) |
+----------------+
| NULL           |
+----------------+
##varchar,int##
UPDATE V_T_GEO SET GEO='point(1 1)';
ERROR 22003: Cannot get geometry object from data you send to the GEOMETRY field.
SELECT ST_ASTEXT(GEO) FROM V_T_GEO;
+----------------+
| ST_ASTEXT(GEO) |
+----------------+
| NULL           |
+----------------+
UPDATE V_T_GEO SET GEO=0;
ERROR 22003: Cannot get geometry object from data you send to the GEOMETRY field.
SELECT ST_ASTEXT(GEO) FROM V_T_GEO;
+----------------+
| ST_ASTEXT(GEO) |
+----------------+
| NULL           |
+----------------+
##point##
UPDATE V_T_GEO SET GEO=ST_GEOmfromtext('point(1234567898765432123456789 -12345678998765432123456789)');
SELECT ST_ASTEXT(GEO) FROM V_T_GEO;
+-----------------------------------------------------+
| ST_ASTEXT(GEO)                                      |
+-----------------------------------------------------+
| POINT(1.2345678987654322e24 -1.2345678998765433e25) |
+-----------------------------------------------------+
UPDATE V_T_GEO SET GEO=ST_GEOmfromtext('point(1e-16 -1e-16)');
SELECT ST_ASTEXT(GEO) FROM V_T_GEO;
+---------------------+
| ST_ASTEXT(GEO)      |
+---------------------+
| POINT(1e-16 -1e-16) |
+---------------------+
UPDATE V_T_GEO SET GEO=ST_GEOmfromtext('point(1e-15 -1e-15)');
SELECT ST_ASTEXT(GEO) FROM V_T_GEO;
+---------------------------------------------+
| ST_ASTEXT(GEO)                              |
+---------------------------------------------+
| POINT(0.000000000000001 -0.000000000000001) |
+---------------------------------------------+
UPDATE V_T_GEO SET GEO=ST_GEOmfromtext('point(1e-17 -1e-17)');
SELECT ST_ASTEXT(GEO) FROM V_T_GEO;
+---------------------+
| ST_ASTEXT(GEO)      |
+---------------------+
| POINT(1e-17 -1e-17) |
+---------------------+
##MULTIPOINT##
UPDATE V_T_GEO SET GEO=ST_GEOmfromtext('MULTIPOINT (1 1, 2 2, 3 3)');
SELECT ST_ASTEXT(GEO) FROM V_T_GEO;
+-------------------------------+
| ST_ASTEXT(GEO)                |
+-------------------------------+
| MULTIPOINT((1 1),(2 2),(3 3)) |
+-------------------------------+
UPDATE V_T_GEO SET GEO=ST_GEOmfromtext('linestring(1 1,1 1)');
SELECT ST_ASTEXT(GEO) FROM V_T_GEO;
+---------------------+
| ST_ASTEXT(GEO)      |
+---------------------+
| LINESTRING(1 1,1 1) |
+---------------------+
UPDATE V_T_GEO SET GEO=ST_GEOmfromtext('linestring(0 0,1 1,1 0,0 1)');
SELECT ST_ASTEXT(GEO) FROM V_T_GEO;
+-----------------------------+
| ST_ASTEXT(GEO)              |
+-----------------------------+
| LINESTRING(0 0,1 1,1 0,0 1) |
+-----------------------------+
UPDATE V_T_GEO SET GEO=ST_GEOmfromtext('linestring(0 0,1 1,1 0,0 0)');
SELECT ST_ASTEXT(GEO) FROM V_T_GEO;
+-----------------------------+
| ST_ASTEXT(GEO)              |
+-----------------------------+
| LINESTRING(0 0,1 1,1 0,0 0) |
+-----------------------------+
set @a = ST_GEOmfromtext('linestring(-14.771826959265866 -56.43907781890718,32.16954139509198 -68.80151707515907)');
UPDATE V_T_GEO SET GEO=@a;
SELECT ST_ASTEXT(GEO) FROM V_T_GEO;
+-----------------------------------------------------------------------------------------+
| ST_ASTEXT(GEO)                                                                          |
+-----------------------------------------------------------------------------------------+
| LINESTRING(-14.771826959265866 -56.43907781890718,32.16954139509198 -68.80151707515907) |
+-----------------------------------------------------------------------------------------+
UPDATE V_T_GEO SET GEO=ST_GEOmfromtext('MULTILINESTRING((10 10, 20 20), (15 15, 30 15))');
SELECT ST_ASTEXT(GEO) FROM V_T_GEO;
+----------------------------------------------+
| ST_ASTEXT(GEO)                               |
+----------------------------------------------+
| MULTILINESTRING((10 10,20 20),(15 15,30 15)) |
+----------------------------------------------+
UPDATE V_T_GEO SET GEO=ST_GEOmfromtext('polygon((1 1,1 1,1 1,1 1))');
SELECT ST_ASTEXT(GEO) FROM V_T_GEO;
+----------------------------+
| ST_ASTEXT(GEO)             |
+----------------------------+
| POLYGON((1 1,1 1,1 1,1 1)) |
+----------------------------+
UPDATE V_T_GEO SET GEO=ST_GEOmfromtext('POLYGON((1 1,1 1,1 1,1 1),(0 0,0 0,0 0,0 0))');
SELECT ST_ASTEXT(GEO) FROM V_T_GEO;
+----------------------------------------------+
| ST_ASTEXT(GEO)                               |
+----------------------------------------------+
| POLYGON((1 1,1 1,1 1,1 1),(0 0,0 0,0 0,0 0)) |
+----------------------------------------------+
UPDATE V_T_GEO SET GEO=ST_GEOmfromtext('polygon((1 1,1 1,1 1,1 1),(1 1,1 1,1 1,1 1))');
SELECT ST_ASTEXT(GEO) FROM V_T_GEO;
+----------------------------------------------+
| ST_ASTEXT(GEO)                               |
+----------------------------------------------+
| POLYGON((1 1,1 1,1 1,1 1),(1 1,1 1,1 1,1 1)) |
+----------------------------------------------+
UPDATE V_T_GEO SET GEO=ST_GEOmfromtext('polygon((108.8448587 34.2715468, 108.7816873 34.0818121, 109.1009774 34.0795373, 109.0961709 34.2704119, 108.8448587 34.2715468),(108.9166131 34.2701282, 108.7892404 34.1880934, 108.9385858 34.142926, 108.9166131 34.2701282))');
SELECT ST_ASTEXT(GEO) FROM V_T_GEO;
+----------------------------------------------------------------------------------------------------------------------------------------------------------------------------------------------------------------------------+
| ST_ASTEXT(GEO)                                                                                                                                                                                                             |
+----------------------------------------------------------------------------------------------------------------------------------------------------------------------------------------------------------------------------+
| POLYGON((108.8448587 34.2715468,108.7816873 34.0818121,109.1009774 34.0795373,109.0961709 34.2704119,108.8448587 34.2715468),(108.9166131 34.2701282,108.7892404 34.1880934,108.9385858 34.142926,108.9166131 34.2701282)) |
+----------------------------------------------------------------------------------------------------------------------------------------------------------------------------------------------------------------------------+
UPDATE V_T_GEO SET GEO=ST_GEOmfromtext('polygon((0 0,1 1,1 0,0 1,0 0))');
SELECT ST_ASTEXT(GEO) FROM V_T_GEO;
+--------------------------------+
| ST_ASTEXT(GEO)                 |
+--------------------------------+
| POLYGON((0 0,1 1,1 0,0 1,0 0)) |
+--------------------------------+
UPDATE V_T_GEO SET GEO=ST_GEOmfromtext('polygon((108.7185159 34.3118245, 108.6841836 34.0789686, 108.9801278 34.0596297, 109.1325631 34.1710519, 109.138743 34.2800578, 108.7782541 34.3407446, 108.7185159 34.3118245),(108.7624612 34.2953754, 108.7432351 34.1432101, 108.8064065 34.0897737, 108.9039102 34.0766936, 109.0487924 34.1432101, 109.0975442 34.206835, 108.9396158 34.2914044, 108.7624612 34.2953754),(108.7913003 34.273249, 108.7679544 34.1670751, 108.7858072 34.1164961, 108.824946 34.1005774, 108.9087167 34.1000088, 109.0007272 34.1420735, 109.0542856 34.1920692, 108.9389291 34.2704119, 108.7913003 34.273249),(108.8599649 34.1971807, 108.879191 34.1494611, 108.9368692 34.1665069, 108.9018503 34.2102421, 108.8599649 34.1971807))');
SELECT ST_ASTEXT(GEO) FROM V_T_GEO;
+-------------------------------------------------------------------------------------------------------------------------------------------------------------------------------------------------------------------------------------------------------------------------------------------------------------------------------------------------------------------------------------------------------------------------------------------------------------------------------------------------------------------------------------------------------------------------------------------------------------------------------------------------------------------------------------------------------+
| ST_ASTEXT(GEO)                                                                                                                                                                                                                                                                                                                                                                                                                                                                                                                                                                                                                                                                                        |
+-------------------------------------------------------------------------------------------------------------------------------------------------------------------------------------------------------------------------------------------------------------------------------------------------------------------------------------------------------------------------------------------------------------------------------------------------------------------------------------------------------------------------------------------------------------------------------------------------------------------------------------------------------------------------------------------------------+
| POLYGON((108.7185159 34.3118245,108.6841836 34.0789686,108.9801278 34.0596297,109.1325631 34.1710519,109.138743 34.2800578,108.7782541 34.3407446,108.7185159 34.3118245),(108.7624612 34.2953754,108.7432351 34.1432101,108.8064065 34.0897737,108.9039102 34.0766936,109.0487924 34.1432101,109.0975442 34.206835,108.9396158 34.2914044,108.7624612 34.2953754),(108.7913003 34.273249,108.7679544 34.1670751,108.7858072 34.1164961,108.824946 34.1005774,108.9087167 34.1000088,109.0007272 34.1420735,109.0542856 34.1920692,108.9389291 34.2704119,108.7913003 34.273249),(108.8599649 34.1971807,108.879191 34.1494611,108.9368692 34.1665069,108.9018503 34.2102421,108.8599649 34.1971807)) |
+-------------------------------------------------------------------------------------------------------------------------------------------------------------------------------------------------------------------------------------------------------------------------------------------------------------------------------------------------------------------------------------------------------------------------------------------------------------------------------------------------------------------------------------------------------------------------------------------------------------------------------------------------------------------------------------------------------+
UPDATE V_T_GEO SET GEO=ST_GEOmfromtext('polygon((108.8283792 34.2647373, 108.8163629 34.1545752, 108.9571252 34.1841173, 108.8283792 34.2647373),(108.8455453 34.2207466, 108.8304391 34.1736083, 108.8778177 34.1807092, 108.8455453 34.2207466),(108.8630548 34.2116617, 108.8506952 34.1940571, 108.9032235 34.1926372, 108.8630548 34.2116617))');
SELECT ST_ASTEXT(GEO) FROM V_T_GEO;
+----------------------------------------------------------------------------------------------------------------------------------------------------------------------------------------------------------------------------------------------------------------------------------------------------+
| ST_ASTEXT(GEO)                                                                                                                                                                                                                                                                                     |
+----------------------------------------------------------------------------------------------------------------------------------------------------------------------------------------------------------------------------------------------------------------------------------------------------+
| POLYGON((108.8283792 34.2647373,108.8163629 34.1545752,108.9571252 34.1841173,108.8283792 34.2647373),(108.8455453 34.2207466,108.8304391 34.1736083,108.8778177 34.1807092,108.8455453 34.2207466),(108.8630548 34.2116617,108.8506952 34.1940571,108.9032235 34.1926372,108.8630548 34.2116617)) |
+----------------------------------------------------------------------------------------------------------------------------------------------------------------------------------------------------------------------------------------------------------------------------------------------------+
UPDATE V_T_GEO SET GEO=ST_GEOmfromtext('MULTIPOLYGON(((1 1,1 1,1 1,1 1)),((1 1,1 1,1 1,1 1)))');
SELECT ST_ASTEXT(GEO) FROM V_T_GEO;
+-------------------------------------------------------+
| ST_ASTEXT(GEO)                                        |
+-------------------------------------------------------+
| MULTIPOLYGON(((1 1,1 1,1 1,1 1)),((1 1,1 1,1 1,1 1))) |
+-------------------------------------------------------+
UPDATE V_T_GEO SET GEO=ST_GEOmfromtext('MULTIPOLYGON(((108.8448587 34.2715468, 108.7816873 34.0818121, 109.1009774 34.0795373, 109.0961709 34.2704119, 108.8448587 34.2715468)),((108.9166131 34.2701282, 108.7892404 34.1880934, 108.9385858 34.142926, 108.9166131 34.2701282)))');
SELECT ST_ASTEXT(GEO) FROM V_T_GEO;
+-------------------------------------------------------------------------------------------------------------------------------------------------------------------------------------------------------------------------------------+
| ST_ASTEXT(GEO)                                                                                                                                                                                                                      |
+-------------------------------------------------------------------------------------------------------------------------------------------------------------------------------------------------------------------------------------+
| MULTIPOLYGON(((108.8448587 34.2715468,108.7816873 34.0818121,109.1009774 34.0795373,109.0961709 34.2704119,108.8448587 34.2715468)),((108.9166131 34.2701282,108.7892404 34.1880934,108.9385858 34.142926,108.9166131 34.2701282))) |
+-------------------------------------------------------------------------------------------------------------------------------------------------------------------------------------------------------------------------------------+
UPDATE V_T_GEO SET GEO=ST_GEOmfromtext('MULTIPOLYGON(((108.8448587 34.2715468, 108.7816873 34.0818121, 109.1009774 34.0795373, 109.0961709 34.2704119, 108.8448587 34.2715468)),((108.9166131 34.2701282, 108.7892404 34.1880934, 108.9385858 34.142926, 108.9166131 34.2701282)))');
SELECT ST_ASTEXT(GEO) FROM V_T_GEO;
+-------------------------------------------------------------------------------------------------------------------------------------------------------------------------------------------------------------------------------------+
| ST_ASTEXT(GEO)                                                                                                                                                                                                                      |
+-------------------------------------------------------------------------------------------------------------------------------------------------------------------------------------------------------------------------------------+
| MULTIPOLYGON(((108.8448587 34.2715468,108.7816873 34.0818121,109.1009774 34.0795373,109.0961709 34.2704119,108.8448587 34.2715468)),((108.9166131 34.2701282,108.7892404 34.1880934,108.9385858 34.142926,108.9166131 34.2701282))) |
+-------------------------------------------------------------------------------------------------------------------------------------------------------------------------------------------------------------------------------------+
UPDATE V_T_GEO SET GEO=ST_GEOmfromtext('GEOMETRYCOLLECTION(POINT(10 10), POINT(30 30), LINESTRING(15 15, 20 20))');
SELECT ST_ASTEXT(GEO) FROM V_T_GEO;
+-----------------------------------------------------------------------+
| ST_ASTEXT(GEO)                                                        |
+-----------------------------------------------------------------------+
| GEOMETRYCOLLECTION(POINT(10 10),POINT(30 30),LINESTRING(15 15,20 20)) |
+-----------------------------------------------------------------------+
UPDATE V_T_GEO SET GEO=ST_GEOmfromtext('GEOMETRYCOLLECTION()');
SELECT ST_ASTEXT(GEO) FROM V_T_GEO;
+--------------------------+
| ST_ASTEXT(GEO)           |
+--------------------------+
| GEOMETRYCOLLECTION EMPTY |
+--------------------------+
UPDATE V_T_GEO SET GEO=ST_GEOmfromtext('GEOMETRYCOLLECTION empty');
SELECT ST_ASTEXT(GEO) FROM V_T_GEO;
+--------------------------+
| ST_ASTEXT(GEO)           |
+--------------------------+
| GEOMETRYCOLLECTION EMPTY |
+--------------------------+
UPDATE V_T_GEO SET GEO=ST_GEOmfromtext('GEOMETRYCOLLECTION(())');
ERROR 22023: Invalid GIS data provided to function st_geomfromtext.
SELECT ST_ASTEXT(GEO) FROM V_T_GEO;
+--------------------------+
| ST_ASTEXT(GEO)           |
+--------------------------+
| GEOMETRYCOLLECTION EMPTY |
+--------------------------+
UPDATE V_T_GEO SET GEO=ST_GEOmfromtext('GEOMETRYCOLLECTION(point(0 0))');
SELECT ST_ASTEXT(GEO) FROM V_T_GEO;
+--------------------------------+
| ST_ASTEXT(GEO)                 |
+--------------------------------+
| GEOMETRYCOLLECTION(POINT(0 0)) |
+--------------------------------+
UPDATE V_T_GEO SET GEO=ST_GEOmfromtext('GEOMETRYCOLLECTION(point(0 0),linestring(0 0,0 0),polygon((0 0,0 0,0 0,0 0)),MULTIPOINT(0 0,0 0),MULTILINESTRING((0 0,0 0)),MULTIPOLYGON(((0 0,0 0,0 0,0 0))))');
SELECT ST_ASTEXT(GEO) FROM V_T_GEO;
+--------------------------------------------------------------------------------------------------------------------------------------------------------------------+
| ST_ASTEXT(GEO)                                                                                                                                                     |
+--------------------------------------------------------------------------------------------------------------------------------------------------------------------+
| GEOMETRYCOLLECTION(POINT(0 0),LINESTRING(0 0,0 0),POLYGON((0 0,0 0,0 0,0 0)),MULTIPOINT((0 0),(0 0)),MULTILINESTRING((0 0,0 0)),MULTIPOLYGON(((0 0,0 0,0 0,0 0)))) |
+--------------------------------------------------------------------------------------------------------------------------------------------------------------------+
UPDATE V_T_GEO SET GEO=ST_GEOmfromtext('MULTIPOINT (1 2, 2 1, 0 0)',4326);
SELECT HEX(GEO) FROM V_T_GEO;
+----------------------------------------------------------------------------------------------------------------------------------------------------------+
| HEX(GEO)                                                                                                                                                 |
+----------------------------------------------------------------------------------------------------------------------------------------------------------+
| E610000001040000000300000001010000000000000000000040000000000000F03F0101000000000000000000F03F0000000000000040010100000000000000000000000000000000000000 |
+----------------------------------------------------------------------------------------------------------------------------------------------------------+
UPDATE V_T_GEO SET GEO=ST_GEOmfromtext('MULTIPOINT (1 2, 2 1, 0 0)',3395);
SELECT HEX(GEO) FROM V_T_GEO;
+----------------------------------------------------------------------------------------------------------------------------------------------------------+
| HEX(GEO)                                                                                                                                                 |
+----------------------------------------------------------------------------------------------------------------------------------------------------------+
| 430D00000104000000030000000101000000000000000000F03F000000000000004001010000000000000000000040000000000000F03F010100000000000000000000000000000000000000 |
+----------------------------------------------------------------------------------------------------------------------------------------------------------+
UPDATE V_T_GEO SET GEO=ST_GEOmfromtext('MULTIPOINT (1 2, 2 1, 0 0)',26918);
SELECT HEX(GEO) FROM V_T_GEO;
+----------------------------------------------------------------------------------------------------------------------------------------------------------+
| HEX(GEO)                                                                                                                                                 |
+----------------------------------------------------------------------------------------------------------------------------------------------------------+
| 266900000104000000030000000101000000000000000000F03F000000000000004001010000000000000000000040000000000000F03F010100000000000000000000000000000000000000 |
+----------------------------------------------------------------------------------------------------------------------------------------------------------+
UPDATE V_T_GEO SET GEO=ST_GEOmfromtext(CONCAT('GEOMETRYCOLLECTION(',CONCAT('LINESTRING(','1796.813742519489 -5625.890596437841',',','-92968.23503214995 -68734.35580112855',')'),')'),4269);
ERROR 22S02: Longitude -5625.890596 is out of range in function st_geomfromtext. It must be within (-180.000000, 180.000000].
SELECT HEX(GEO) FROM V_T_GEO;
+----------------------------------------------------------------------------------------------------------------------------------------------------------+
| HEX(GEO)                                                                                                                                                 |
+----------------------------------------------------------------------------------------------------------------------------------------------------------+
| 266900000104000000030000000101000000000000000000F03F000000000000004001010000000000000000000040000000000000F03F010100000000000000000000000000000000000000 |
+----------------------------------------------------------------------------------------------------------------------------------------------------------+
UPDATE V_T_GEO SET GEO=ST_GEOMFROMWKB(x'010700000000000000');
SELECT HEX(GEO) FROM V_T_GEO;
+----------------------------+
| HEX(GEO)                   |
+----------------------------+
| 00000000010700000000000000 |
+----------------------------+
UPDATE V_T_GEO SET GEO=ST_GEOMFROMWKB(x'010300000002000000050000006E8F392A12365B40AFAAA80BC2224140B54C2B2A07325B4063F5A2D1780A4140A6A8E96976465B40F4273B472E0A4140EC94FDA927465B4080796DDB9C2241406E8F392A12365B40AFAAA80BC22241400400000074E5FDC9A93A5B401A5D948F93224140A5AB2AEA82325B40F6CBCC71131841405CDF2CCA113C5B40C2DF2F664B12414074E5FDC9A93A5B401A5D948F93224140');
SELECT HEX(GEO) FROM V_T_GEO;
+--------------------------------------------------------------------------------------------------------------------------------------------------------------------------------------------------------------------------------------------------------------------------------------------------------------------------------------------+
| HEX(GEO)                                                                                                                                                                                                                                                                                                                                   |
+--------------------------------------------------------------------------------------------------------------------------------------------------------------------------------------------------------------------------------------------------------------------------------------------------------------------------------------------+
| 00000000010300000002000000050000006E8F392A12365B40AFAAA80BC2224140B54C2B2A07325B4063F5A2D1780A4140A6A8E96976465B40F4273B472E0A4140EC94FDA927465B4080796DDB9C2241406E8F392A12365B40AFAAA80BC22241400400000074E5FDC9A93A5B401A5D948F93224140A5AB2AEA82325B40F6CBCC71131841405CDF2CCA113C5B40C2DF2F664B12414074E5FDC9A93A5B401A5D948F93224140 |
+--------------------------------------------------------------------------------------------------------------------------------------------------------------------------------------------------------------------------------------------------------------------------------------------------------------------------------------------+
UPDATE V_T_GEO SET GEO=ST_GEOmfromtext('MULTIPOINT (1 2, 2 1, 0 0)',4326) where gid=1;
SELECT ST_ASTEXT(GEO) FROM V_T_GEO;
+-------------------------------+
| ST_ASTEXT(GEO)                |
+-------------------------------+
| MULTIPOINT((1 2),(2 1),(0 0)) |
+-------------------------------+
UPDATE V_T_GEO SET GEO=ST_GEOmfromtext('MULTIPOINT (2 2, 2 2, 2 2)',4326) where GEO=ST_GEOmfromtext('MULTIPOINT (1 2, 2 1, 0 0)',4326);
SELECT ST_ASTEXT(GEO) FROM V_T_GEO;
+-------------------------------+
| ST_ASTEXT(GEO)                |
+-------------------------------+
| MULTIPOINT((2 2),(2 2),(2 2)) |
+-------------------------------+
UPDATE V_T_GEO SET GEO=ST_GEOmfromtext('MULTIPOINT (1 1, 1 1, 1 1)',4326) where GEO=ST_GEOmfromtext('MULTIPOINT (2 2, 2 2, 2 2)');
SELECT ST_ASTEXT(GEO) FROM V_T_GEO;
+-------------------------------+
| ST_ASTEXT(GEO)                |
+-------------------------------+
| MULTIPOINT((2 2),(2 2),(2 2)) |
+-------------------------------+
UPDATE V_T_GEO SET GEO=ST_GEOmfromtext('MULTIPOINT (1 1, 1 1, 1 1)',4326) where GEO=ST_GEOmfromtext('MULTIPOINT (2 2, 2 2, 2 2)',4326,'axis-order=LONG-LAT');
SELECT ST_ASTEXT(GEO) FROM V_T_GEO;
+-------------------------------+
| ST_ASTEXT(GEO)                |
+-------------------------------+
| MULTIPOINT((1 1),(1 1),(1 1)) |
+-------------------------------+
UPDATE V_T_GEO SET GEO=ST_GEOmfromtext('MULTIPOINT (1 2, 1 2, 1 2)',4326) where GEO=ST_GEOmfromtext('MULTIPOINT (1 1, 1 1, 1 1)',4326);
SELECT ST_ASTEXT(GEO) FROM V_T_GEO;
+-------------------------------+
| ST_ASTEXT(GEO)                |
+-------------------------------+
| MULTIPOINT((1 2),(1 2),(1 2)) |
+-------------------------------+
UPDATE V_T_GEO SET GEO=ST_GEOmfromtext('MULTIPOINT (2 1, 2 1, 2 1)',4326) where GEO=ST_GEOmfromtext('MULTIPOINT (1 2, 1 2, 1 2)',4326,'axis-order=LONG-LAT');
SELECT ST_ASTEXT(GEO) FROM V_T_GEO;
+-------------------------------+
| ST_ASTEXT(GEO)                |
+-------------------------------+
| MULTIPOINT((1 2),(1 2),(1 2)) |
+-------------------------------+
INSERT INTO V_T_GEO(GEO) VALUES (NULL);
UPDATE V_T_GEO SET GEO=ST_GEOmfromtext('MULTIPOINT (2 1, 2 1, 2 1)',4326) where GEO = '';
SELECT ST_ASTEXT(GEO) FROM V_T_GEO;
+-------------------------------+
| ST_ASTEXT(GEO)                |
+-------------------------------+
| MULTIPOINT((1 2),(1 2),(1 2)) |
| NULL                          |
+-------------------------------+
UPDATE V_T_GEO SET GEO=ST_GEOmfromtext('MULTIPOINT (2 1, 2 1, 2 1)',4326) where GEO IS NULL ORDER BY GEO LIMIT 1 ;
SELECT ST_ASTEXT(GEO) FROM V_T_GEO WHERE GEO= ST_GEOmfromtext('MULTIPOINT (2 1, 2 1, 2 1)',4326);
+-------------------------------+
| ST_ASTEXT(GEO)                |
+-------------------------------+
| MULTIPOINT((2 1),(2 1),(2 1)) |
+-------------------------------+
DELETE FROM V_T_GEO;
####################GEOMETRYCOLLECTION####################
INSERT INTO V_T_GEO VALUES (1,NULL,NULL,NULL,NULL,NULL,NULL,NULL,NULL);
UPDATE V_T_GEO SET GEO_C = ST_GEOmfromtext('GEOMETRYCOLLECTION(point(180 90))');
SELECT ST_ASTEXT(GEO_C) FROM V_T_GEO;
+-----------------------------------+
| ST_ASTEXT(GEO_C)                  |
+-----------------------------------+
| GEOMETRYCOLLECTION(POINT(180 90)) |
+-----------------------------------+
UPDATE V_T_GEO SET GEO_C = ST_GEOmfromtext('MULTIPOLYGON(((108.8448587 34.2715468, 108.7816873 34.0818121, 109.1009774 34.0795373, 109.0961709 34.2704119, 108.8448587 34.2715468)),((108.9166131 34.2701282, 108.7892404 34.1880934, 108.9385858 34.142926, 108.9166131 34.2701282)))');
SELECT ST_ASTEXT(GEO_C) FROM V_T_GEO;
+-------------------------------------------------------------------------------------------------------------------------------------------------------------------------------------------------------------------------------------+
| ST_ASTEXT(GEO_C)                                                                                                                                                                                                                    |
+-------------------------------------------------------------------------------------------------------------------------------------------------------------------------------------------------------------------------------------+
| MULTIPOLYGON(((108.8448587 34.2715468,108.7816873 34.0818121,109.1009774 34.0795373,109.0961709 34.2704119,108.8448587 34.2715468)),((108.9166131 34.2701282,108.7892404 34.1880934,108.9385858 34.142926,108.9166131 34.2701282))) |
+-------------------------------------------------------------------------------------------------------------------------------------------------------------------------------------------------------------------------------------+
UPDATE V_T_GEO SET GEO_C = ST_GEOmfromtext('MULTIPOINT(180 90)');
SELECT ST_ASTEXT(GEO_C) FROM V_T_GEO;
+----------------------+
| ST_ASTEXT(GEO_C)     |
+----------------------+
| MULTIPOINT((180 90)) |
+----------------------+
UPDATE V_T_GEO SET GEO_C = ST_GEOmfromtext('MULTILINESTRING((0 0,0 0))');
SELECT ST_ASTEXT(GEO_C) FROM V_T_GEO;
+----------------------------+
| ST_ASTEXT(GEO_C)           |
+----------------------------+
| MULTILINESTRING((0 0,0 0)) |
+----------------------------+
UPDATE V_T_GEO SET GEO_C = ST_GEOmfromtext('MULTIPOLYGON(((1 1,1 1,1 1,1 1)),((1 1,1 1,1 1,1 1)))');
SELECT ST_ASTEXT(GEO_C) FROM V_T_GEO;
+-------------------------------------------------------+
| ST_ASTEXT(GEO_C)                                      |
+-------------------------------------------------------+
| MULTIPOLYGON(((1 1,1 1,1 1,1 1)),((1 1,1 1,1 1,1 1))) |
+-------------------------------------------------------+
UPDATE V_T_GEO SET GEO_C = ST_GEOmfromtext('GEOMETRYCOLLECTION(point(0 0),linestring(0 0,0 0),polygon((0 0,0 0,0 0,0 0)),MULTIPOINT(0 0,0 0),MULTILINESTRING((0 0,0 0)),MULTIPOLYGON(((0 0,0 0,0 0,0 0))))');
SELECT ST_ASTEXT(GEO_C) FROM V_T_GEO;
+--------------------------------------------------------------------------------------------------------------------------------------------------------------------+
| ST_ASTEXT(GEO_C)                                                                                                                                                   |
+--------------------------------------------------------------------------------------------------------------------------------------------------------------------+
| GEOMETRYCOLLECTION(POINT(0 0),LINESTRING(0 0,0 0),POLYGON((0 0,0 0,0 0,0 0)),MULTIPOINT((0 0),(0 0)),MULTILINESTRING((0 0,0 0)),MULTIPOLYGON(((0 0,0 0,0 0,0 0)))) |
+--------------------------------------------------------------------------------------------------------------------------------------------------------------------+
UPDATE V_T_GEO SET GEO_C = ST_GEOmfromtext('point(180 90)');
ERROR 22003: Cannot get geometry object from data you send to the GEOMETRY field.
SELECT ST_ASTEXT(GEO_C) FROM V_T_GEO;
+--------------------------------------------------------------------------------------------------------------------------------------------------------------------+
| ST_ASTEXT(GEO_C)                                                                                                                                                   |
+--------------------------------------------------------------------------------------------------------------------------------------------------------------------+
| GEOMETRYCOLLECTION(POINT(0 0),LINESTRING(0 0,0 0),POLYGON((0 0,0 0,0 0,0 0)),MULTIPOINT((0 0),(0 0)),MULTILINESTRING((0 0,0 0)),MULTIPOLYGON(((0 0,0 0,0 0,0 0)))) |
+--------------------------------------------------------------------------------------------------------------------------------------------------------------------+
UPDATE V_T_GEO SET GEO_C = ST_GEOmfromtext('linestring(1 1,1 1)');
ERROR 22003: Cannot get geometry object from data you send to the GEOMETRY field.
SELECT ST_ASTEXT(GEO_C) FROM V_T_GEO;
+--------------------------------------------------------------------------------------------------------------------------------------------------------------------+
| ST_ASTEXT(GEO_C)                                                                                                                                                   |
+--------------------------------------------------------------------------------------------------------------------------------------------------------------------+
| GEOMETRYCOLLECTION(POINT(0 0),LINESTRING(0 0,0 0),POLYGON((0 0,0 0,0 0,0 0)),MULTIPOINT((0 0),(0 0)),MULTILINESTRING((0 0,0 0)),MULTIPOLYGON(((0 0,0 0,0 0,0 0)))) |
+--------------------------------------------------------------------------------------------------------------------------------------------------------------------+
UPDATE V_T_GEO SET GEO_C = ST_GEOmfromtext('polygon((1 1,1 1,1 1,1 1))');
ERROR 22003: Cannot get geometry object from data you send to the GEOMETRY field.
SELECT ST_ASTEXT(GEO_C) FROM V_T_GEO;
+--------------------------------------------------------------------------------------------------------------------------------------------------------------------+
| ST_ASTEXT(GEO_C)                                                                                                                                                   |
+--------------------------------------------------------------------------------------------------------------------------------------------------------------------+
| GEOMETRYCOLLECTION(POINT(0 0),LINESTRING(0 0,0 0),POLYGON((0 0,0 0,0 0,0 0)),MULTIPOINT((0 0),(0 0)),MULTILINESTRING((0 0,0 0)),MULTIPOLYGON(((0 0,0 0,0 0,0 0)))) |
+--------------------------------------------------------------------------------------------------------------------------------------------------------------------+
UPDATE V_T_GEO SET GEO_C = (null);
SELECT ST_ASTEXT(GEO_C) FROM V_T_GEO;
+------------------+
| ST_ASTEXT(GEO_C) |
+------------------+
| NULL             |
+------------------+
UPDATE V_T_GEO SET GEO_C = (ST_GEOmfromtext(null));
SELECT ST_ASTEXT(GEO_C) FROM V_T_GEO;
+------------------+
| ST_ASTEXT(GEO_C) |
+------------------+
| NULL             |
+------------------+
UPDATE V_T_GEO SET GEO_C =(ST_GEOmfromtext('point(180 90)',null));
SELECT ST_ASTEXT(GEO_C) FROM V_T_GEO;
+------------------+
| ST_ASTEXT(GEO_C) |
+------------------+
| NULL             |
+------------------+
UPDATE V_T_GEO SET GEO_C =(ST_GEOmfromtext('point(180 90)',null,null));
SELECT ST_ASTEXT(GEO_C) FROM V_T_GEO;
+------------------+
| ST_ASTEXT(GEO_C) |
+------------------+
| NULL             |
+------------------+
UPDATE V_T_GEO SET GEO_C = (ST_GEOmfromtext('GEOMETRYCOLLECTION()'));
SELECT ST_ASTEXT(GEO_C) FROM V_T_GEO;
+--------------------------+
| ST_ASTEXT(GEO_C)         |
+--------------------------+
| GEOMETRYCOLLECTION EMPTY |
+--------------------------+
UPDATE V_T_GEO SET GEO_C = (ST_GEOmfromtext('GEOMETRYCOLLECTION empty'));
SELECT ST_ASTEXT(GEO_C) FROM V_T_GEO;
+--------------------------+
| ST_ASTEXT(GEO_C)         |
+--------------------------+
| GEOMETRYCOLLECTION EMPTY |
+--------------------------+
UPDATE V_T_GEO SET GEO_C = (ST_GEOmfromtext('MULTIPOINT(180 90)',4326));
ERROR 22S03: Latitude 180.000000 is out of range in function st_geomfromtext. It must be within [-90.000000, 90.000000].
SELECT ST_ASTEXT(GEO_C) FROM V_T_GEO;
+--------------------------+
| ST_ASTEXT(GEO_C)         |
+--------------------------+
| GEOMETRYCOLLECTION EMPTY |
+--------------------------+
UPDATE V_T_GEO SET GEO_C = (ST_GEOmfromtext('MULTIPOINT(180 90)',4326,'axis-order=long-lat'));
SELECT ST_ASTEXT(GEO_C) FROM V_T_GEO;
+----------------------+
| ST_ASTEXT(GEO_C)     |
+----------------------+
| MULTIPOINT((90 180)) |
+----------------------+
UPDATE V_T_GEO SET GEO_C = (ST_GEOmfromtext('MULTIPOINT(80 90)',4326,'axis-order=lat-long'));
SELECT ST_ASTEXT(GEO_C) FROM V_T_GEO;
+---------------------+
| ST_ASTEXT(GEO_C)    |
+---------------------+
| MULTIPOINT((80 90)) |
+---------------------+
UPDATE V_T_GEO SET GEO_C = (ST_GEOMFROMWKB(X'01070000000200000001040000000200000001010000000000000000000000000000000000F0BF0101000000000000000000F0BF00000000000000000104000000010000000101000000000000000000F0BF0000000000000000')) ;
SELECT ST_ASTEXT(GEO_C) FROM V_T_GEO;
+------------------------------------------------------------------+
| ST_ASTEXT(GEO_C)                                                 |
+------------------------------------------------------------------+
| GEOMETRYCOLLECTION(MULTIPOINT((0 -1),(-1 0)),MULTIPOINT((-1 0))) |
+------------------------------------------------------------------+
UPDATE V_T_GEO SET GEO_C = (ST_GEOMFROMWKB(X'01060000000200000001030000000200000004000000000000000000000000000000000000000000000000000000000000000000F03F000000000000F03F00000000000000000000000000000000000000000000000004000000295C8FC2F528BC3F295C8FC2F528BC3FB81E85EB51B8BE3FB81E85EB51B8BE3FA4703D0AD7A3C03FA4703D0AD7A3C03F295C8FC2F528BC3F295C8FC2F528BC3F01030000000200000004000000000000000000000000000000000000000000000000000000000000000000F03F000000000000F03F0000000000000000000000000000000000000000000000000400000000000000000000000000000000000000000000000000F03F000000000000F03F000000000000F03F000000000000000000000000000000000000000000000000')) ;
SELECT ST_ASTEXT(GEO_C) FROM V_T_GEO;
+-------------------------------------------------------------------------------------------------------------------+
| ST_ASTEXT(GEO_C)                                                                                                  |
+-------------------------------------------------------------------------------------------------------------------+
| MULTIPOLYGON(((0 0,0 1,1 0,0 0),(0.11 0.11,0.12 0.12,0.13 0.13,0.11 0.11)),((0 0,0 1,1 0,0 0),(0 0,1 1,1 0,0 0))) |
+-------------------------------------------------------------------------------------------------------------------+
UPDATE V_T_GEO SET GEO_C = (ST_GEOMFROMWKB(X'0104000000030000000101000000000000000000F03F000000000000F03F010100000000000000000000400000000000000040010100000000000000000008400000000000000840')) ;
SELECT ST_ASTEXT(GEO_C) FROM V_T_GEO;
+-------------------------------+
| ST_ASTEXT(GEO_C)              |
+-------------------------------+
| MULTIPOINT((1 1),(2 2),(3 3)) |
+-------------------------------+
UPDATE V_T_GEO SET GEO_C = (ST_GEOMETRYFROMWKB(X'0104000000030000000101000000000000000000F03F000000000000F03F010100000000000000000000400000000000000040010100000000000000000008400000000000000840')) ;
SELECT ST_ASTEXT(GEO_C) FROM V_T_GEO;
+-------------------------------+
| ST_ASTEXT(GEO_C)              |
+-------------------------------+
| MULTIPOINT((1 1),(2 2),(3 3)) |
+-------------------------------+
UPDATE V_T_GEO SET GEO_C = (ST_GEOMETRYFROMWKB(X'010700000000000000')) ;
SELECT ST_ASTEXT(GEO_C) FROM V_T_GEO;
+--------------------------+
| ST_ASTEXT(GEO_C)         |
+--------------------------+
| GEOMETRYCOLLECTION EMPTY |
+--------------------------+
UPDATE V_T_GEO SET GEO_C=ST_GEOmfromtext('MULTIPOINT (1 2, 2 1, 0 0)',4326) where gid=1;
SELECT ST_ASTEXT(GEO_C) FROM V_T_GEO WHERE GID=1;
+-------------------------------+
| ST_ASTEXT(GEO_C)              |
+-------------------------------+
| MULTIPOINT((1 2),(2 1),(0 0)) |
+-------------------------------+
UPDATE V_T_GEO SET GEO_C=ST_GEOmfromtext('MULTIPOINT (2 2, 2 2, 2 2)',4326) where GEO_C=ST_GEOmfromtext('MULTIPOINT (1 2, 2 1, 0 0)',4326);
SELECT ST_ASTEXT(GEO_C) FROM V_T_GEO WHERE GEO_C=ST_GEOmfromtext('MULTIPOINT (2 2, 2 2, 2 2)',4326);
+-------------------------------+
| ST_ASTEXT(GEO_C)              |
+-------------------------------+
| MULTIPOINT((2 2),(2 2),(2 2)) |
+-------------------------------+
UPDATE V_T_GEO SET GEO_C=ST_GEOmfromtext('MULTIPOINT (1 1, 1 1, 1 1)',4326) where GEO_C=ST_GEOmfromtext('MULTIPOINT (2 2, 2 2, 2 2)');
SELECT ST_ASTEXT(GEO_C) FROM V_T_GEO;
+-------------------------------+
| ST_ASTEXT(GEO_C)              |
+-------------------------------+
| MULTIPOINT((2 2),(2 2),(2 2)) |
+-------------------------------+
UPDATE V_T_GEO SET GEO_C=ST_GEOmfromtext('MULTIPOINT (1 1, 1 1, 1 1)',4326) where GEO_C=ST_GEOmfromtext('MULTIPOINT (2 2, 2 2, 2 2)',4326,'axis-order=LONG-LAT');
SELECT ST_ASTEXT(GEO_C) FROM V_T_GEO;
+-------------------------------+
| ST_ASTEXT(GEO_C)              |
+-------------------------------+
| MULTIPOINT((1 1),(1 1),(1 1)) |
+-------------------------------+
UPDATE V_T_GEO SET GEO_C=ST_GEOmfromtext('MULTIPOINT (1 2, 1 2, 1 2)',4326) where GEO_C=ST_GEOmfromtext('MULTIPOINT (1 1, 1 1, 1 1)',4326);
SELECT ST_ASTEXT(GEO_C) FROM V_T_GEO;
+-------------------------------+
| ST_ASTEXT(GEO_C)              |
+-------------------------------+
| MULTIPOINT((1 2),(1 2),(1 2)) |
+-------------------------------+
UPDATE V_T_GEO SET GEO_C=ST_GEOmfromtext('MULTIPOINT (2 1, 2 1, 2 1)',4326) where GEO_C=ST_GEOmfromtext('MULTIPOINT (1 2, 1 2, 1 2)',4326,'axis-order=LONG-LAT');
SELECT ST_ASTEXT(GEO_C) FROM V_T_GEO;
+-------------------------------+
| ST_ASTEXT(GEO_C)              |
+-------------------------------+
| MULTIPOINT((1 2),(1 2),(1 2)) |
+-------------------------------+
INSERT INTO V_T_GEO(GEO_C) VALUES (NULL);
UPDATE V_T_GEO SET GEO_C=ST_GEOmfromtext('MULTIPOINT (2 1, 2 1, 2 1)',4326) where GEO_C = '';
SELECT ST_ASTEXT(GEO_C) FROM V_T_GEO;
+-------------------------------+
| ST_ASTEXT(GEO_C)              |
+-------------------------------+
| MULTIPOINT((1 2),(1 2),(1 2)) |
| NULL                          |
+-------------------------------+
UPDATE V_T_GEO SET GEO_C=ST_GEOmfromtext('MULTIPOINT (2 1, 2 1, 2 1)',4326) where GEO_C IS NULL ORDER BY GEO LIMIT 1 ;
SELECT GID,ST_ASTEXT(GEO_C) FROM V_T_GEO WHERE GEO_C= ST_GEOmfromtext('MULTIPOINT (2 1, 2 1, 2 1)',4326);
+-----+-------------------------------+
| GID | ST_ASTEXT(GEO_C)              |
+-----+-------------------------------+
|   3 | MULTIPOINT((2 1),(2 1),(2 1)) |
+-----+-------------------------------+
INSERT INTO V_T_GEO(GEO_C) VALUES (ST_GEOmfromtext('MULTIPOINT (1 2, 1 2, 1 2)'));
UPDATE V_T_GEO SET GEO_C=ST_GEOmfromtext('MULTIPOINT (3 1, 3 1, 3 1)',4326) where GEO_C=ST_GEOMETRYFROMWKB(X'0104000000030000000101000000000000000000F03F00000000000000400101000000000000000000F03F00000000000000400101000000000000000000F03F0000000000000040') ORDER BY GEO LIMIT 1 ;
SELECT ST_ASTEXT(GEO_C) FROM V_T_GEO ;
+-------------------------------+
| ST_ASTEXT(GEO_C)              |
+-------------------------------+
| MULTIPOINT((1 2),(1 2),(1 2)) |
| MULTIPOINT((2 1),(2 1),(2 1)) |
| MULTIPOINT((3 1),(3 1),(3 1)) |
+-------------------------------+
DELETE FROM V_T_GEO;
##############POI,M_POI,LIN,M_LIN,POL,M_POL############
INSERT INTO V_T_GEO(poi,M_POI,LIN,M_LIN,POL,M_POL) VALUES (null,NULL,NULL,NULL,NULL,NULL);
UPDATE V_T_GEO SET POI=ST_GEOmfromtext(NULL),M_POI=ST_GEOmfromtext(NULL),LIN=ST_GEOmfromtext(NULL),M_LIN=ST_GEOmfromtext(NULL),POL=ST_GEOmfromtext(NULL),M_POL=ST_GEOmfromtext(NULL);
SELECT ST_ASTEXT(POI),ST_ASTEXT(M_POI),ST_ASTEXT(LIN),ST_ASTEXT(M_LIN),ST_ASTEXT(POL),ST_ASTEXT(M_POL) FROM V_T_GEO;
+----------------+------------------+----------------+------------------+----------------+------------------+
| ST_ASTEXT(POI) | ST_ASTEXT(M_POI) | ST_ASTEXT(LIN) | ST_ASTEXT(M_LIN) | ST_ASTEXT(POL) | ST_ASTEXT(M_POL) |
+----------------+------------------+----------------+------------------+----------------+------------------+
| NULL           | NULL             | NULL           | NULL             | NULL           | NULL             |
+----------------+------------------+----------------+------------------+----------------+------------------+
UPDATE V_T_GEO SET POI=(ST_GEOmfromtext('GEOMETRYCOLLECTION EMPTY'));
ERROR 22003: Cannot get geometry object from data you send to the GEOMETRY field.
UPDATE V_T_GEO SET M_POI=(ST_GEOmfromtext('GEOMETRYCOLLECTION EMPTY'));
ERROR 22003: Cannot get geometry object from data you send to the GEOMETRY field.
UPDATE V_T_GEO SET LIN=(ST_GEOmfromtext('GEOMETRYCOLLECTION EMPTY'));
ERROR 22003: Cannot get geometry object from data you send to the GEOMETRY field.
UPDATE V_T_GEO SET M_LIN=(ST_GEOmfromtext('GEOMETRYCOLLECTION EMPTY'));
ERROR 22003: Cannot get geometry object from data you send to the GEOMETRY field.
UPDATE V_T_GEO SET POL=(ST_GEOmfromtext('GEOMETRYCOLLECTION EMPTY'));
ERROR 22003: Cannot get geometry object from data you send to the GEOMETRY field.
UPDATE V_T_GEO SET M_POL=(ST_GEOmfromtext('GEOMETRYCOLLECTION EMPTY'));
ERROR 22003: Cannot get geometry object from data you send to the GEOMETRY field.
UPDATE V_T_GEO SET POI=(ST_GEOmfromtext('MULTIPOINT (1 1, 2 2, 3 3)'));
ERROR 22003: Cannot get geometry object from data you send to the GEOMETRY field.
UPDATE V_T_GEO SET POI=(ST_GEOmfromtext('linestring(1 1,1 1)'));
ERROR 22003: Cannot get geometry object from data you send to the GEOMETRY field.
UPDATE V_T_GEO SET POI=(ST_GEOmfromtext('MULTILINESTRING((10 10, 20 20), (15 15, 30 15))'));
ERROR 22003: Cannot get geometry object from data you send to the GEOMETRY field.
UPDATE V_T_GEO SET POI=(ST_GEOmfromtext('polygon((1 1,1 1,1 1,1 1))'));
ERROR 22003: Cannot get geometry object from data you send to the GEOMETRY field.
UPDATE V_T_GEO SET POI=(ST_GEOmfromtext('MULTIPOLYGON(((1 1,1 1,1 1,1 1)),((1 1,1 1,1 1,1 1)))'));
ERROR 22003: Cannot get geometry object from data you send to the GEOMETRY field.
UPDATE V_T_GEO SET M_POI=(ST_GEOmfromtext('point(180 -180)'));
ERROR 22003: Cannot get geometry object from data you send to the GEOMETRY field.
UPDATE V_T_GEO SET M_POI=(ST_GEOmfromtext('linestring(1 1,1 1)'));
ERROR 22003: Cannot get geometry object from data you send to the GEOMETRY field.
UPDATE V_T_GEO SET M_POI=(ST_GEOmfromtext('MULTILINESTRING((10 10, 20 20), (15 15, 30 15))'));
ERROR 22003: Cannot get geometry object from data you send to the GEOMETRY field.
UPDATE V_T_GEO SET M_POI=(ST_GEOmfromtext('polygon((1 1,1 1,1 1,1 1))'));
ERROR 22003: Cannot get geometry object from data you send to the GEOMETRY field.
UPDATE V_T_GEO SET M_POI=(ST_GEOmfromtext('MULTIPOLYGON(((1 1,1 1,1 1,1 1)),((1 1,1 1,1 1,1 1)))'));
ERROR 22003: Cannot get geometry object from data you send to the GEOMETRY field.
UPDATE V_T_GEO SET M_POI=(ST_GEOmfromtext('GEOMETRYCOLLECTION(POINT(10 10), POINT(30 30))'));
ERROR 22003: Cannot get geometry object from data you send to the GEOMETRY field.
UPDATE V_T_GEO SET LIN=(ST_GEOmfromtext('point(180 -180)'));
ERROR 22003: Cannot get geometry object from data you send to the GEOMETRY field.
UPDATE V_T_GEO SET LIN=(ST_GEOmfromtext('MULTIPOINT (1 1, 2 2, 3 3)'));
ERROR 22003: Cannot get geometry object from data you send to the GEOMETRY field.
UPDATE V_T_GEO SET LIN=(ST_GEOmfromtext('MULTILINESTRING((10 10, 20 20), (15 15, 30 15))'));
ERROR 22003: Cannot get geometry object from data you send to the GEOMETRY field.
UPDATE V_T_GEO SET LIN=(ST_GEOmfromtext('polygon((1 1,1 1,1 1,1 1))'));
ERROR 22003: Cannot get geometry object from data you send to the GEOMETRY field.
UPDATE V_T_GEO SET LIN=(ST_GEOmfromtext('MULTIPOLYGON(((1 1,1 1,1 1,1 1)),((1 1,1 1,1 1,1 1)))'));
ERROR 22003: Cannot get geometry object from data you send to the GEOMETRY field.
UPDATE V_T_GEO SET M_LIN=(ST_GEOmfromtext('point(180 -180)'));
ERROR 22003: Cannot get geometry object from data you send to the GEOMETRY field.
UPDATE V_T_GEO SET M_LIN=(ST_GEOmfromtext('MULTIPOINT (1 1, 2 2, 3 3)'));
ERROR 22003: Cannot get geometry object from data you send to the GEOMETRY field.
UPDATE V_T_GEO SET M_LIN=(ST_GEOmfromtext('linestring(1 1,1 1)'));
ERROR 22003: Cannot get geometry object from data you send to the GEOMETRY field.
UPDATE V_T_GEO SET M_LIN=(ST_GEOmfromtext('polygon((1 1,1 1,1 1,1 1))'));
ERROR 22003: Cannot get geometry object from data you send to the GEOMETRY field.
UPDATE V_T_GEO SET M_LIN=(ST_GEOmfromtext('MULTIPOLYGON(((1 1,1 1,1 1,1 1)),((1 1,1 1,1 1,1 1)))'));
ERROR 22003: Cannot get geometry object from data you send to the GEOMETRY field.
UPDATE V_T_GEO SET POL=(ST_GEOmfromtext('point(180 -180)'));
ERROR 22003: Cannot get geometry object from data you send to the GEOMETRY field.
UPDATE V_T_GEO SET POL=(ST_GEOmfromtext('MULTIPOINT (1 1, 2 2, 3 3)'));
ERROR 22003: Cannot get geometry object from data you send to the GEOMETRY field.
UPDATE V_T_GEO SET POL=(ST_GEOmfromtext('linestring(1 1,1 1)'));
ERROR 22003: Cannot get geometry object from data you send to the GEOMETRY field.
UPDATE V_T_GEO SET POL=(ST_GEOmfromtext('MULTILINESTRING((10 10, 20 20), (15 15, 30 15))'));
ERROR 22003: Cannot get geometry object from data you send to the GEOMETRY field.
UPDATE V_T_GEO SET POL=(ST_GEOmfromtext('MULTIPOLYGON(((1 1,1 1,1 1,1 1)),((1 1,1 1,1 1,1 1)))'));
ERROR 22003: Cannot get geometry object from data you send to the GEOMETRY field.
UPDATE V_T_GEO SET M_POL=(ST_GEOmfromtext('point(180 -180)'));
ERROR 22003: Cannot get geometry object from data you send to the GEOMETRY field.
UPDATE V_T_GEO SET M_POL=(ST_GEOmfromtext('MULTIPOINT (1 1, 2 2, 3 3)'));
ERROR 22003: Cannot get geometry object from data you send to the GEOMETRY field.
UPDATE V_T_GEO SET M_POL=(ST_GEOmfromtext('linestring(1 1,1 1)'));
ERROR 22003: Cannot get geometry object from data you send to the GEOMETRY field.
UPDATE V_T_GEO SET M_POL=(ST_GEOmfromtext('MULTILINESTRING((10 10, 20 20), (15 15, 30 15))'));
ERROR 22003: Cannot get geometry object from data you send to the GEOMETRY field.
UPDATE V_T_GEO SET M_POL=(ST_GEOmfromtext('polygon((1 1,1 1,1 1,1 1))'));
ERROR 22003: Cannot get geometry object from data you send to the GEOMETRY field.
UPDATE V_T_GEO SET POI=ST_GEOmfromtext(CONCAT('POINT(','1e-16 1e-16',')'),0,'axis-order=srid-defined'),M_POI=ST_GEOmfromtext(CONCAT('MULTIPOINT(','2 2',')'),4326,NULL),LIN=ST_GEOmfromtext(CONCAT('LINESTRING(','-48357.57927018633 43540.5814967723',',','-2057.8252218124508 -5980.149997060238',',','1e-15 1e-15',',','-421.0284002202159 119.03658635503689',')'),3395,'axis-order=lat-long'),M_LIN=ST_GEOmfromtext(CONCAT('MULTILINESTRING(',CONCAT('(','1 2',',','1 0',',','1796.813742519489 -5625.890596437841',',','668.0694770528178 -232.7649236132885',')'),',',CONCAT('(','-537.4528627587551 -378.5985437586205',',','527.050859903703 -155.90278593360551',')'),')'),NULL,'axis-order=long-lat'),POL=ST_GEOmfromtext('POLYGON((0 18640956.411258712,19102427.276775245 25305352.105271727,19679991.65063813 8223634.6452743495,41396328.4672789 -11927305.114682678,58356723.05457695 -78201636.59178922,-12082356.046457496 -23781955.162716646,-20405722.611202523 15080280.222545808,-13854752.859030265 22353875.632208023,0 18640956.411258712))',26918,'axis-order=srid-defined'),M_POL=ST_GEOmfromtext(CONCAT('MULTIPOLYGON(',SUBSTRING('POLYGON((1e-16 1e-16,1e-15 1e-15,1e-14 1e-14,1e-17 1e-17,1e-16 1e-16))',8),',',SUBSTRING('POLYGON((0 8239957.714402309,388488.89820658613 -108216.66174708401,5997448.474278114 -6856929.402862601,5971512.938490311 -7236159.803958585,-5988253.046446193 -6790986.639156384,-5169269.666311893 -1560255.7016074874,-9717448.312906547 -976928.7239688709,-5784094.855505731 507386.16432881926,-4771724.315781364 3985052.657764614,0 8239957.714402309))',8),',',SUBSTRING('POLYGON((387.28033477051713 248.66984325272472,105.20438337133277 -27.525375017126805,-270.0331544580052 -724.4465755354305,-223.03864176342444 -225.43800247764153,-723.6349219960895 320.8725171629145,-71.9375373898553 214.68437907015678,387.28033477051713 248.66984325272472))',8),')'),26918,'axis-order=long-lat');
SELECT ST_ASTEXT(POI),ST_ASTEXT(M_POI),ST_ASTEXT(LIN),ST_ASTEXT(M_LIN),ST_ASTEXT(POL),ST_ASTEXT(M_POL) FROM V_T_GEO;
+--------------------+------------------+------------------------------------------------------------------------------------------------------------------------------------------------------------------+------------------+---------------------------------------------------------------------------------------------------------------------------------------------------------------------------------------------------------------------------------------------------------------------------------------------------------------------------------+-----------------------------------------------------------------------------------------------------------------------------------------------------------------------------------------------------------------------------------------------------------------------------------------------------------------------------------------------------------------------------------------------------------------------------------------------------------------------------------------------------------------------------------------------------------------------------------------------------------------------------------------------------------------------------------------------------------------------------------------------------------------------+
| ST_ASTEXT(POI)     | ST_ASTEXT(M_POI) | ST_ASTEXT(LIN)                                                                                                                                                   | ST_ASTEXT(M_LIN) | ST_ASTEXT(POL)                                                                                                                                                                                                                                                                                                                  | ST_ASTEXT(M_POL)                                                                                                                                                                                                                                                                                                                                                                                                                                                                                                                                                                                                                                                                                                                                                      |
+--------------------+------------------+------------------------------------------------------------------------------------------------------------------------------------------------------------------+------------------+---------------------------------------------------------------------------------------------------------------------------------------------------------------------------------------------------------------------------------------------------------------------------------------------------------------------------------+-----------------------------------------------------------------------------------------------------------------------------------------------------------------------------------------------------------------------------------------------------------------------------------------------------------------------------------------------------------------------------------------------------------------------------------------------------------------------------------------------------------------------------------------------------------------------------------------------------------------------------------------------------------------------------------------------------------------------------------------------------------------------+
| POINT(1e-16 1e-16) | NULL             | LINESTRING(-48357.57927018633 43540.5814967723,-2057.8252218124508 -5980.149997060238,0.000000000000001 0.000000000000001,-421.0284002202159 119.03658635503689) | NULL             | POLYGON((0 18640956.411258712,19102427.276775245 25305352.105271727,19679991.65063813 8223634.6452743495,41396328.4672789 -11927305.114682678,58356723.05457695 -78201636.59178922,-12082356.046457496 -23781955.162716646,-20405722.611202523 15080280.222545808,-13854752.859030265 22353875.632208023,0 18640956.411258712)) | MULTIPOLYGON(((1e-16 1e-16,0.000000000000001 0.000000000000001,0.00000000000001 0.00000000000001,1e-17 1e-17,1e-16 1e-16)),((0 8239957.714402309,388488.89820658613 -108216.66174708401,5997448.474278114 -6856929.402862601,5971512.938490311 -7236159.803958585,-5988253.046446193 -6790986.639156384,-5169269.666311893 -1560255.7016074874,-9717448.312906547 -976928.7239688709,-5784094.855505731 507386.16432881926,-4771724.315781364 3985052.657764614,0 8239957.714402309)),((387.28033477051713 248.66984325272472,105.20438337133277 -27.525375017126805,-270.0331544580052 -724.4465755354305,-223.03864176342444 -225.43800247764153,-723.6349219960895 320.8725171629145,-71.9375373898553 214.68437907015678,387.28033477051713 248.66984325272472))) |
+--------------------+------------------+------------------------------------------------------------------------------------------------------------------------------------------------------------------+------------------+---------------------------------------------------------------------------------------------------------------------------------------------------------------------------------------------------------------------------------------------------------------------------------------------------------------------------------+-----------------------------------------------------------------------------------------------------------------------------------------------------------------------------------------------------------------------------------------------------------------------------------------------------------------------------------------------------------------------------------------------------------------------------------------------------------------------------------------------------------------------------------------------------------------------------------------------------------------------------------------------------------------------------------------------------------------------------------------------------------------------+
UPDATE V_T_GEO SET POI=ST_GEOMFROMWKB(X'010100000012123132132123131545642315421542'),M_POI=ST_GEOMFROMWKB(X'0104000000020000000101000000E8BA85778DBA6FC07263CBA2C72A70C00101000000FC69C4EEEEC4EBC05A102F1A6E8CF640'),LIN=ST_GEOMFROMWKB(X'010200000002000000FCD18BA5A82CED3FF88E6676F1CF11409F627BD51CB70E40C860D2B5BC4C1340'),M_LIN=ST_GEOMFROMWKB(X'0105000000010000000102000000020000000000000000000000000000000000000000000000000000000000000000000000'),POL=ST_GEOMFROMWKB(X'01030000000200000004000000000000000000000000000000000000000000000000000000000000000000F03F000000000000F03F0000000000000000000000000000000000000000000000000400000000000000000000000000000000000000000000000000000000000000000000400000000000000040000000000000000000000000000000000000000000000000'),M_POL=ST_GEOMFROMWKB(X'01060000000200000001030000000200000004000000000000000000000000000000000000000000000000000000000000000000F03F000000000000F03F00000000000000000000000000000000000000000000000004000000295C8FC2F528BC3F295C8FC2F528BC3FB81E85EB51B8BE3FB81E85EB51B8BE3FA4703D0AD7A3C03FA4703D0AD7A3C03F295C8FC2F528BC3F295C8FC2F528BC3F01030000000200000004000000000000000000000000000000000000000000000000000000000000000000F03F000000000000F03F0000000000000000000000000000000000000000000000000400000000000000000000000000000000000000000000000000F03F000000000000F03F000000000000F03F000000000000000000000000000000000000000000000000');
SELECT ST_ASTEXT(POI),ST_ASTEXT(M_POI),ST_ASTEXT(LIN),ST_ASTEXT(M_LIN),ST_ASTEXT(POL),ST_ASTEXT(M_POL) FROM V_T_GEO;
+---------------------------------------------------+---------------------------------------------------------------------------------------------+-------------------------------------------------------------------------------------+----------------------------+----------------------------------------------+-------------------------------------------------------------------------------------------------------------------+
| ST_ASTEXT(POI)                                    | ST_ASTEXT(M_POI)                                                                            | ST_ASTEXT(LIN)                                                                      | ST_ASTEXT(M_LIN)           | ST_ASTEXT(POL)                               | ST_ASTEXT(M_POL)                                                                                                  |
+---------------------------------------------------+---------------------------------------------------------------------------------------------+-------------------------------------------------------------------------------------+----------------------------+----------------------------------------------+-------------------------------------------------------------------------------------------------------------------+
| POINT(1.7340831370586944e-216 22825748697.067463) | MULTIPOINT((-253.82976890677605 -258.6737392372953),(-56871.46664639187 92358.88139253986)) | LINESTRING(0.911701510746354 4.453069543847725,3.839410465076369 4.824938622441728) | MULTILINESTRING((0 0,0 0)) | POLYGON((0 0,0 1,1 0,0 0),(0 0,0 2,2 0,0 0)) | MULTIPOLYGON(((0 0,0 1,1 0,0 0),(0.11 0.11,0.12 0.12,0.13 0.13,0.11 0.11)),((0 0,0 1,1 0,0 0),(0 0,1 1,1 0,0 0))) |
+---------------------------------------------------+---------------------------------------------------------------------------------------------+-------------------------------------------------------------------------------------+----------------------------+----------------------------------------------+-------------------------------------------------------------------------------------------------------------------+
############srid############
drop table if exists T_GEO;
drop view if exists V_T_GEO;
create table T_GEO (gid int auto_increment primary key, geo geometry srid 0,GEO_C GEOMETRYCOLLECTION SRID 4326,poi point SRID 4269,lin linestring SRID 26918,pol polygon SRID 3395,M_POI MULTIPOINT SRID 31287,M_LIN MULTILINESTRING SRID 4326,M_POL MULTIPOLYGON SRID 4269);
create view V_T_GEO AS SELECT * FROM T_GEO;
INSERT INTO T_GEO(GEO,GEO_C,POI,LIN,POL,M_POI,M_LIN,M_POL) VALUES (st_geomfromtext('point(90 90)',0),st_geomfromtext('GEOMETRYCOLLECTION EMPTY ',4326),st_geomfromtext('point(90 90)',4269),st_geomfromtext('linestring(1 1,1 1)',26918),st_geomfromtext('polygon((1 1,1 1,1 1,1 1))',3395),st_geomfromtext('MULTIPOINT (1 1, 2 2, 3 3)',31287),st_geomfromtext('MULTILINESTRING((10 10, 20 20), (15 15, 30 15))',4326),st_geomfromtext('MULTIPOLYGON(((1 1,1 1,1 1,1 1)),((1 1,1 1,1 1,1 1)))',4269));
select ST_ASTEXT(POI),ST_ASTEXT(LIN),ST_ASTEXT(POL),ST_ASTEXT(M_POI),ST_ASTEXT(M_LIN),ST_ASTEXT(M_POL),ST_ASTEXT(GEO),ST_ASTEXT(GEO_C) from T_GEO;
+----------------+---------------------+----------------------------+-------------------------------+----------------------------------------------+-------------------------------------------------------+----------------+--------------------------+
| ST_ASTEXT(POI) | ST_ASTEXT(LIN)      | ST_ASTEXT(POL)             | ST_ASTEXT(M_POI)              | ST_ASTEXT(M_LIN)                             | ST_ASTEXT(M_POL)                                      | ST_ASTEXT(GEO) | ST_ASTEXT(GEO_C)         |
+----------------+---------------------+----------------------------+-------------------------------+----------------------------------------------+-------------------------------------------------------+----------------+--------------------------+
| POINT(90 90)   | LINESTRING(1 1,1 1) | POLYGON((1 1,1 1,1 1,1 1)) | MULTIPOINT((1 1),(2 2),(3 3)) | MULTILINESTRING((10 10,20 20),(15 15,30 15)) | MULTIPOLYGON(((1 1,1 1,1 1,1 1)),((1 1,1 1,1 1,1 1))) | POINT(90 90)   | GEOMETRYCOLLECTION EMPTY |
+----------------+---------------------+----------------------------+-------------------------------+----------------------------------------------+-------------------------------------------------------+----------------+--------------------------+
##相同的srid##
UPDATE T_GEO SET GEO=st_geomfromtext('point(80 80)');
UPDATE T_GEO SET GEO_C=ST_GEOmfromtext('GEOMETRYCOLLECTION(point(0 0),linestring(0 0,0 0),polygon((0 0,0 0,0 0,0 0)),MULTIPOINT(0 0,0 0),MULTILINESTRING((0 0,0 0)),MULTIPOLYGON(((0 0,0 0,0 0,0 0))))',4326);
UPDATE T_GEO SET POI=st_geomfromtext('point(60 60)',4269);
UPDATE T_GEO SET LIN=st_geomfromtext('linestring(1 2,1 2)',26918);
UPDATE T_GEO SET POL=st_geomfromtext('polygon((1 2,1 2,1 2,1 2))',3395);
UPDATE T_GEO SET M_POI=st_geomfromtext('MULTIPOINT (3 3, 2 2, 1 1)',31287);
UPDATE T_GEO SET M_LIN=st_geomfromtext('MULTILINESTRING((1 1, 2 2), (5 5, 3 5))',4326);
UPDATE T_GEO SET M_POL=st_geomfromtext('MULTIPOLYGON(((2 2,2 2,2 2,2 2)),((2 2,2 2,2 2,2 2)))',4269);
select ST_ASTEXT(POI),ST_ASTEXT(LIN),ST_ASTEXT(POL),ST_ASTEXT(M_POI),ST_ASTEXT(M_LIN),ST_ASTEXT(M_POL),ST_ASTEXT(GEO),ST_ASTEXT(GEO_C) from T_GEO;
+----------------+---------------------+----------------------------+-------------------------------+--------------------------------------+-------------------------------------------------------+----------------+--------------------------------------------------------------------------------------------------------------------------------------------------------------------+
| ST_ASTEXT(POI) | ST_ASTEXT(LIN)      | ST_ASTEXT(POL)             | ST_ASTEXT(M_POI)              | ST_ASTEXT(M_LIN)                     | ST_ASTEXT(M_POL)                                      | ST_ASTEXT(GEO) | ST_ASTEXT(GEO_C)                                                                                                                                                   |
+----------------+---------------------+----------------------------+-------------------------------+--------------------------------------+-------------------------------------------------------+----------------+--------------------------------------------------------------------------------------------------------------------------------------------------------------------+
| POINT(60 60)   | LINESTRING(1 2,1 2) | POLYGON((1 2,1 2,1 2,1 2)) | MULTIPOINT((3 3),(2 2),(1 1)) | MULTILINESTRING((1 1,2 2),(5 5,3 5)) | MULTIPOLYGON(((2 2,2 2,2 2,2 2)),((2 2,2 2,2 2,2 2))) | POINT(80 80)   | GEOMETRYCOLLECTION(POINT(0 0),LINESTRING(0 0,0 0),POLYGON((0 0,0 0,0 0,0 0)),MULTIPOINT((0 0),(0 0)),MULTILINESTRING((0 0,0 0)),MULTIPOLYGON(((0 0,0 0,0 0,0 0)))) |
+----------------+---------------------+----------------------------+-------------------------------+--------------------------------------+-------------------------------------------------------+----------------+--------------------------------------------------------------------------------------------------------------------------------------------------------------------+
UPDATE V_T_GEO SET GEO=st_geomfromtext('point(80 80)');
UPDATE V_T_GEO SET GEO_C=ST_GEOmfromtext('GEOMETRYCOLLECTION(point(0 0),linestring(0 0,0 0),polygon((0 0,0 0,0 0,0 0)),MULTIPOINT(0 0,0 0),MULTILINESTRING((0 0,0 0)),MULTIPOLYGON(((0 0,0 0,0 0,0 0))))',4326);
UPDATE V_T_GEO SET POI=st_geomfromtext('point(60 60)',4269);
UPDATE V_T_GEO SET LIN=st_geomfromtext('linestring(1 2,1 2)',26918);
UPDATE V_T_GEO SET POL=st_geomfromtext('polygon((1 2,1 2,1 2,1 2))',3395);
UPDATE V_T_GEO SET M_POI=st_geomfromtext('MULTIPOINT (3 3, 2 2, 1 1)',31287);
UPDATE V_T_GEO SET M_LIN=st_geomfromtext('MULTILINESTRING((1 1, 2 2), (5 5, 3 5))',4326);
UPDATE V_T_GEO SET M_POL=st_geomfromtext('MULTIPOLYGON(((2 2,2 2,2 2,2 2)),((2 2,2 2,2 2,2 2)))',4269);
##不同的srid##
UPDATE T_GEO SET GEO=st_geomfromtext('point(90 90)',4326);
ERROR HY000: The SRID of the geometry does not match the SRID of the column. The SRID of the geometry is 4326, but the SRID of the column is 0. Consider changing the SRID of the geometry or the SRID property of the column.
UPDATE T_GEO SET GEO_C=st_geomfromtext('GEOMETRYCOLLECTION EMPTY ');
ERROR HY000: The SRID of the geometry does not match the SRID of the column. The SRID of the geometry is 0, but the SRID of the column is 4326. Consider changing the SRID of the geometry or the SRID property of the column.
UPDATE T_GEO SET POI=st_geomfromtext('point(90 90)');
ERROR HY000: The SRID of the geometry does not match the SRID of the column. The SRID of the geometry is 0, but the SRID of the column is 4269. Consider changing the SRID of the geometry or the SRID property of the column.
UPDATE T_GEO SET LIN=st_geomfromtext('linestring(1 1,1 1)',4269);
ERROR HY000: The SRID of the geometry does not match the SRID of the column. The SRID of the geometry is 4269, but the SRID of the column is 26918. Consider changing the SRID of the geometry or the SRID property of the column.
UPDATE T_GEO SET POL=st_geomfromtext('polygon((1 1,1 1,1 1,1 1))',31287);
ERROR HY000: The SRID of the geometry does not match the SRID of the column. The SRID of the geometry is 31287, but the SRID of the column is 3395. Consider changing the SRID of the geometry or the SRID property of the column.
UPDATE T_GEO SET M_POI=st_geomfromtext('MULTIPOINT (1 1, 2 2, 3 3)',3395);
ERROR HY000: The SRID of the geometry does not match the SRID of the column. The SRID of the geometry is 3395, but the SRID of the column is 31287. Consider changing the SRID of the geometry or the SRID property of the column.
UPDATE T_GEO SET M_LIN=st_geomfromtext('MULTILINESTRING((10 10, 20 20), (15 15, 30 15))',4269);
ERROR HY000: The SRID of the geometry does not match the SRID of the column. The SRID of the geometry is 4269, but the SRID of the column is 4326. Consider changing the SRID of the geometry or the SRID property of the column.
UPDATE T_GEO SET M_POL=st_geomfromtext('MULTIPOLYGON(((1 1,1 1,1 1,1 1)),((1 1,1 1,1 1,1 1)))',4326);
ERROR HY000: The SRID of the geometry does not match the SRID of the column. The SRID of the geometry is 4326, but the SRID of the column is 4269. Consider changing the SRID of the geometry or the SRID property of the column.
select ST_ASTEXT(POI),ST_ASTEXT(LIN),ST_ASTEXT(POL),ST_ASTEXT(M_POI),ST_ASTEXT(M_LIN),ST_ASTEXT(M_POL),ST_ASTEXT(GEO),ST_ASTEXT(GEO_C) from T_GEO;
+----------------+---------------------+----------------------------+-------------------------------+--------------------------------------+-------------------------------------------------------+----------------+--------------------------------------------------------------------------------------------------------------------------------------------------------------------+
| ST_ASTEXT(POI) | ST_ASTEXT(LIN)      | ST_ASTEXT(POL)             | ST_ASTEXT(M_POI)              | ST_ASTEXT(M_LIN)                     | ST_ASTEXT(M_POL)                                      | ST_ASTEXT(GEO) | ST_ASTEXT(GEO_C)                                                                                                                                                   |
+----------------+---------------------+----------------------------+-------------------------------+--------------------------------------+-------------------------------------------------------+----------------+--------------------------------------------------------------------------------------------------------------------------------------------------------------------+
| POINT(60 60)   | LINESTRING(1 2,1 2) | POLYGON((1 2,1 2,1 2,1 2)) | MULTIPOINT((3 3),(2 2),(1 1)) | MULTILINESTRING((1 1,2 2),(5 5,3 5)) | MULTIPOLYGON(((2 2,2 2,2 2,2 2)),((2 2,2 2,2 2,2 2))) | POINT(80 80)   | GEOMETRYCOLLECTION(POINT(0 0),LINESTRING(0 0,0 0),POLYGON((0 0,0 0,0 0,0 0)),MULTIPOINT((0 0),(0 0)),MULTILINESTRING((0 0,0 0)),MULTIPOLYGON(((0 0,0 0,0 0,0 0)))) |
+----------------+---------------------+----------------------------+-------------------------------+--------------------------------------+-------------------------------------------------------+----------------+--------------------------------------------------------------------------------------------------------------------------------------------------------------------+
UPDATE V_T_GEO SET GEO=st_geomfromtext('point(90 90)',4326);
ERROR HY000: The SRID of the geometry does not match the SRID of the column. The SRID of the geometry is 4326, but the SRID of the column is 0. Consider changing the SRID of the geometry or the SRID property of the column.
UPDATE V_T_GEO SET GEO_C=st_geomfromtext('GEOMETRYCOLLECTION EMPTY ');
ERROR HY000: The SRID of the geometry does not match the SRID of the column. The SRID of the geometry is 0, but the SRID of the column is 4326. Consider changing the SRID of the geometry or the SRID property of the column.
UPDATE V_T_GEO SET POI=st_geomfromtext('point(90 90)');
ERROR HY000: The SRID of the geometry does not match the SRID of the column. The SRID of the geometry is 0, but the SRID of the column is 4269. Consider changing the SRID of the geometry or the SRID property of the column.
UPDATE V_T_GEO SET LIN=st_geomfromtext('linestring(1 1,1 1)',4269);
ERROR HY000: The SRID of the geometry does not match the SRID of the column. The SRID of the geometry is 4269, but the SRID of the column is 26918. Consider changing the SRID of the geometry or the SRID property of the column.
UPDATE V_T_GEO SET POL=st_geomfromtext('polygon((1 1,1 1,1 1,1 1))',31287);
ERROR HY000: The SRID of the geometry does not match the SRID of the column. The SRID of the geometry is 31287, but the SRID of the column is 3395. Consider changing the SRID of the geometry or the SRID property of the column.
UPDATE V_T_GEO SET M_POI=st_geomfromtext('MULTIPOINT (1 1, 2 2, 3 3)',3395);
ERROR HY000: The SRID of the geometry does not match the SRID of the column. The SRID of the geometry is 3395, but the SRID of the column is 31287. Consider changing the SRID of the geometry or the SRID property of the column.
UPDATE V_T_GEO SET M_LIN=st_geomfromtext('MULTILINESTRING((10 10, 20 20), (15 15, 30 15))',4269);
ERROR HY000: The SRID of the geometry does not match the SRID of the column. The SRID of the geometry is 4269, but the SRID of the column is 4326. Consider changing the SRID of the geometry or the SRID property of the column.
UPDATE V_T_GEO SET M_POL=st_geomfromtext('MULTIPOLYGON(((1 1,1 1,1 1,1 1)),((1 1,1 1,1 1,1 1)))',4326);
ERROR HY000: The SRID of the geometry does not match the SRID of the column. The SRID of the geometry is 4326, but the SRID of the column is 4269. Consider changing the SRID of the geometry or the SRID property of the column.
select _ST_ASEWKT(POI),_ST_ASEWKT(LIN),_ST_ASEWKT(POL),_ST_ASEWKT(M_POI),_ST_ASEWKT(M_LIN),_ST_ASEWKT(M_POL),_ST_ASEWKT(GEO),_ST_ASEWKT(GEO_C) from V_T_GEO;
+------------------------+--------------------------------+--------------------------------------+------------------------------------------+------------------------------------------------+-----------------------------------------------------------------+-----------------+------------------------------------------------------------------------------------------------------------------------------------------------------------------------------+
| _ST_ASEWKT(POI)        | _ST_ASEWKT(LIN)                | _ST_ASEWKT(POL)                      | _ST_ASEWKT(M_POI)                        | _ST_ASEWKT(M_LIN)                              | _ST_ASEWKT(M_POL)                                               | _ST_ASEWKT(GEO) | _ST_ASEWKT(GEO_C)                                                                                                                                                            |
+------------------------+--------------------------------+--------------------------------------+------------------------------------------+------------------------------------------------+-----------------------------------------------------------------+-----------------+------------------------------------------------------------------------------------------------------------------------------------------------------------------------------+
| SRID=4269;POINT(60 60) | SRID=26918;LINESTRING(1 2,1 2) | SRID=3395;POLYGON((1 2,1 2,1 2,1 2)) | SRID=31287;MULTIPOINT((3 3),(2 2),(1 1)) | SRID=4326;MULTILINESTRING((1 1,2 2),(5 5,5 3)) | SRID=4269;MULTIPOLYGON(((2 2,2 2,2 2,2 2)),((2 2,2 2,2 2,2 2))) | POINT(80 80)    | SRID=4326;GEOMETRYCOLLECTION(POINT(0 0),LINESTRING(0 0,0 0),POLYGON((0 0,0 0,0 0,0 0)),MULTIPOINT((0 0),(0 0)),MULTILINESTRING((0 0,0 0)),MULTIPOLYGON(((0 0,0 0,0 0,0 0)))) |
+------------------------+--------------------------------+--------------------------------------+------------------------------------------+------------------------------------------------+-----------------------------------------------------------------+-----------------+------------------------------------------------------------------------------------------------------------------------------------------------------------------------------+
UPDATE V_T_GEO SET GEO=NULL,GEO_C=NULL,POI=NULL,LIN=NULL,POL=NULL,M_POI=NULL,M_LIN=NULL,M_POL=NULL;
select ST_ASTEXT(POI),ST_ASTEXT(LIN),ST_ASTEXT(POL),ST_ASTEXT(M_POI),ST_ASTEXT(M_LIN),ST_ASTEXT(M_POL),ST_ASTEXT(GEO),ST_ASTEXT(GEO_C) from T_GEO;
+----------------+----------------+----------------+------------------+------------------+------------------+----------------+------------------+
| ST_ASTEXT(POI) | ST_ASTEXT(LIN) | ST_ASTEXT(POL) | ST_ASTEXT(M_POI) | ST_ASTEXT(M_LIN) | ST_ASTEXT(M_POL) | ST_ASTEXT(GEO) | ST_ASTEXT(GEO_C) |
+----------------+----------------+----------------+------------------+------------------+------------------+----------------+------------------+
| NULL           | NULL           | NULL           | NULL             | NULL             | NULL             | NULL           | NULL             |
+----------------+----------------+----------------+------------------+------------------+------------------+----------------+------------------+
##notnull##
drop table if exists T_GEO;
create table T_GEO (gid int auto_increment primary key, geo geometry not null srid 4326);
drop view if exists V_T_GEO;
create view V_T_GEO AS SELECT * FROM T_GEO;
REPLACE into T_GEO(geo) VALUES(ST_GEOMETRYFROMWKB(X'010700000000000000',4326));
UPDATE T_GEO SET GEO= NULL;
ERROR 23000: Column 'geo' cannot be null
UPDATE V_T_GEO SET GEO= NULL;
ERROR 23000: Column 'geo' cannot be null
UPDATE T_GEO SET GEO=st_geomfromtext('polygon((1 1,1 1,1 1,1 1))',NULL);
ERROR 23000: Column 'geo' cannot be null
UPDATE T_GEO SET GEO=st_geomfromtext('polygon((1 1,1 1,1 1,1 1))',4326,NULL);
ERROR 23000: Column 'geo' cannot be null
select ST_ASTEXT(GEO) from T_GEO;
+--------------------------+
| ST_ASTEXT(GEO)           |
+--------------------------+
| GEOMETRYCOLLECTION EMPTY |
+--------------------------+
drop table if exists T_GEO;
drop view if exists V_T_GEO;
drop user 'zc_gis_mysql'@'%';
