purge recyclebin;
drop database IF EXISTS oblrp;
create database oblrp;
use oblrp;
set timestamp = 1600000000;
set ob_trx_timeout = 10000000000;
set ob_query_timeout = 10000000000;
result_format: 4
索引
drop table tt1;
create table tt1(id int, spatial index(id));
ERROR 42000: A SPATIAL index may only contain a geometrical type column.
create table tt1(id int not null srid 4236);
ERROR HY000: Incorrect usage of srid.
create table tt1(a varchar(20), spatial index(a));
ERROR 42000: A SPATIAL index may only contain a geometrical type column.
create table tt1(a varchar(20) not null srid 4236);
ERROR HY000: Incorrect usage of srid.
create table tt1(d date, spatial index(d));
ERROR 42000: A SPATIAL index may only contain a geometrical type column.
create table tt1(d date not null srid 4236);
ERROR HY000: Incorrect usage of srid.
create table tt1(b blob, spatial index(b));
ERROR 42000: The used storage engine can't index column 'b'
create table tt1(b blob not null srid 26918);
ERROR HY000: Incorrect usage of srid.
create table tt1(t text, spatial index(t));
ERROR 42000: The used storage engine can't index column 't'
create table tt1(t text not null srid 26918);
ERROR HY000: Incorrect usage of srid.
create table tt1(e enum('1','2'), spatial index(e));
ERROR 42000: A SPATIAL index may only contain a geometrical type column.
create table tt1(e enum('1','2') srid 26918);
ERROR HY000: Incorrect usage of srid.
create table tt1(e set('1','2'), spatial index(e));
ERROR 42000: A SPATIAL index may only contain a geometrical type column.
create table tt1(e set('1','2') srid 26918);
ERROR HY000: Incorrect usage of srid.
create table tt1(e json, spatial index(e));
ERROR 42000: A SPATIAL index may only contain a geometrical type column.
create table tt1(e json srid 26918);
ERROR HY000: Incorrect usage of srid.
create table tt1(id int not null, g geometry not null srid 26918,spatial index(g,id));
ERROR 42000: Too many key parts specified; max 64 parts allowed
create table tt1(id int not null, p point,g geometry not null srid 26918,spatial index(g,p));
ERROR 42000: Too many key parts specified; max 64 parts allowed
create table tt1(id int , g geometry, spatial index(g));
ERROR 42000: All parts of a SPATIAL index must be NOT NULL.
create table tt1(id int , g geometry not null, spatial index(g));
insert into tt1 values(1,ST_GeomFromText('point(10 20)',4236));
insert into tt1 values(2,st_geomfromwkb(x'01020000000200000000000000000059400000000000005e4000000000000059400000000000006e40',0));
insert into tt1 values(3,ST_GeomFromText('POLYGON((0 0,10 0,10 10,0 10,0 0),(5 5,7 5,7 7,5.5265257 7, 5 5))',26918));
insert into tt1 values(4,st_geomfromwkb(x'01040000000300000001010000000000000000000000000000000000000001010000000000000000003440000000000000344001010000000000000000004E400000000000004E40',4236));
insert into tt1 values(6,st_geometryfromwkb(x'01060000000200000001030000000100000005000000000000000000000000000000000000000000000000002440000000000000000000000000000024400000000000002440000000000000000000000000000024400000000000000000000000000000000001030000000100000005000000000000000000144000000000000014400000000000001C4000000000000014400000000000001C400000000000001C4000000000000014400000000000001C4000000000000014400000000000001440'));
insert into tt1 values(7,ST_GeomFromText('GEOMETRYCOLLECTION(POINT(10 5), LINESTRING(15 15, 20 20),POLYGON((1 0,10 0,10 10,1 0)),MULTIPOINT(0 0, 20 20),
MULTILINESTRING((5 10, 5 20), (15 10, 30 15)),MULTIPOLYGON(((1 0,10 0,10 10,0 10,1 0)),((6 5,7 5,7 7,5 7, 6 5))))',26918));
insert into tt1 values(5,ST_GeomFromText('MULTILINESTRING((10 10, 20 20), (15 15, 30 15))',0));
SHOW INDEX FROM tt1;
Table	Non_unique	Key_name	Seq_in_index	Column_name	Collation	Cardinality	Sub_part	Packed	Null	Index_type	Comment	Index_comment	Visible	Expression
tt1	1	g	1	g	A	NULL	NULL	NULL		SPATIAL	available		YES	NULL
select id ,st_astext(g) from tt1 where ST_Intersects(g,g);
+------+------------------------------------------------------------------------------------------------------------------------------------------------------------------------------------------------------------------------------+
| id   | st_astext(g)                                                                                                                                                                                                                 |
+------+------------------------------------------------------------------------------------------------------------------------------------------------------------------------------------------------------------------------------+
|    1 | POINT(10 20)                                                                                                                                                                                                                 |
|    2 | LINESTRING(100 120,100 240)                                                                                                                                                                                                  |
|    3 | POLYGON((0 0,10 0,10 10,0 10,0 0),(5 5,7 5,7 7,5.5265257 7,5 5))                                                                                                                                                             |
|    4 | MULTIPOINT((0 0),(20 20),(60 60))                                                                                                                                                                                            |
|    6 | MULTIPOLYGON(((0 0,10 0,10 10,0 10,0 0)),((5 5,7 5,7 7,5 7,5 5)))                                                                                                                                                            |
|    7 | GEOMETRYCOLLECTION(POINT(10 5),LINESTRING(15 15,20 20),POLYGON((1 0,10 0,10 10,1 0)),MULTIPOINT((0 0),(20 20)),MULTILINESTRING((5 10,5 20),(15 10,30 15)),MULTIPOLYGON(((1 0,10 0,10 10,0 10,1 0)),((6 5,7 5,7 7,5 7,6 5)))) |
|    5 | MULTILINESTRING((10 10,20 20),(15 15,30 15))                                                                                                                                                                                 |
+------+------------------------------------------------------------------------------------------------------------------------------------------------------------------------------------------------------------------------------+
select id ,st_astext(g) from tt1 where ST_Intersects(g,g) in(1);
+------+------------------------------------------------------------------------------------------------------------------------------------------------------------------------------------------------------------------------------+
| id   | st_astext(g)                                                                                                                                                                                                                 |
+------+------------------------------------------------------------------------------------------------------------------------------------------------------------------------------------------------------------------------------+
|    1 | POINT(10 20)                                                                                                                                                                                                                 |
|    2 | LINESTRING(100 120,100 240)                                                                                                                                                                                                  |
|    3 | POLYGON((0 0,10 0,10 10,0 10,0 0),(5 5,7 5,7 7,5.5265257 7,5 5))                                                                                                                                                             |
|    4 | MULTIPOINT((0 0),(20 20),(60 60))                                                                                                                                                                                            |
|    6 | MULTIPOLYGON(((0 0,10 0,10 10,0 10,0 0)),((5 5,7 5,7 7,5 7,5 5)))                                                                                                                                                            |
|    7 | GEOMETRYCOLLECTION(POINT(10 5),LINESTRING(15 15,20 20),POLYGON((1 0,10 0,10 10,1 0)),MULTIPOINT((0 0),(20 20)),MULTILINESTRING((5 10,5 20),(15 10,30 15)),MULTIPOLYGON(((1 0,10 0,10 10,0 10,1 0)),((6 5,7 5,7 7,5 7,6 5)))) |
|    5 | MULTILINESTRING((10 10,20 20),(15 15,30 15))                                                                                                                                                                                 |
+------+------------------------------------------------------------------------------------------------------------------------------------------------------------------------------------------------------------------------------+
select id ,st_astext(g) from tt1 where ST_Intersects(g,g) not in(1);
+------+--------------+
| id   | st_astext(g) |
+------+--------------+
+------+--------------+
select id ,st_astext(g) from tt1 where ST_Intersects(g,g) =1;
+------+------------------------------------------------------------------------------------------------------------------------------------------------------------------------------------------------------------------------------+
| id   | st_astext(g)                                                                                                                                                                                                                 |
+------+------------------------------------------------------------------------------------------------------------------------------------------------------------------------------------------------------------------------------+
|    1 | POINT(10 20)                                                                                                                                                                                                                 |
|    2 | LINESTRING(100 120,100 240)                                                                                                                                                                                                  |
|    3 | POLYGON((0 0,10 0,10 10,0 10,0 0),(5 5,7 5,7 7,5.5265257 7,5 5))                                                                                                                                                             |
|    4 | MULTIPOINT((0 0),(20 20),(60 60))                                                                                                                                                                                            |
|    6 | MULTIPOLYGON(((0 0,10 0,10 10,0 10,0 0)),((5 5,7 5,7 7,5 7,5 5)))                                                                                                                                                            |
|    7 | GEOMETRYCOLLECTION(POINT(10 5),LINESTRING(15 15,20 20),POLYGON((1 0,10 0,10 10,1 0)),MULTIPOINT((0 0),(20 20)),MULTILINESTRING((5 10,5 20),(15 10,30 15)),MULTIPOLYGON(((1 0,10 0,10 10,0 10,1 0)),((6 5,7 5,7 7,5 7,6 5)))) |
|    5 | MULTILINESTRING((10 10,20 20),(15 15,30 15))                                                                                                                                                                                 |
+------+------------------------------------------------------------------------------------------------------------------------------------------------------------------------------------------------------------------------------+
select id ,st_astext(g) from tt1 where ST_Intersects(g,g) !=1;
+------+--------------+
| id   | st_astext(g) |
+------+--------------+
+------+--------------+
select id ,st_astext(g) from tt1 where ST_Intersects(g,g) >1;
+------+--------------+
| id   | st_astext(g) |
+------+--------------+
+------+--------------+
select id ,st_astext(g) from tt1 where ST_Intersects(g,g) <=1;
+------+------------------------------------------------------------------------------------------------------------------------------------------------------------------------------------------------------------------------------+
| id   | st_astext(g)                                                                                                                                                                                                                 |
+------+------------------------------------------------------------------------------------------------------------------------------------------------------------------------------------------------------------------------------+
|    1 | POINT(10 20)                                                                                                                                                                                                                 |
|    2 | LINESTRING(100 120,100 240)                                                                                                                                                                                                  |
|    3 | POLYGON((0 0,10 0,10 10,0 10,0 0),(5 5,7 5,7 7,5.5265257 7,5 5))                                                                                                                                                             |
|    4 | MULTIPOINT((0 0),(20 20),(60 60))                                                                                                                                                                                            |
|    6 | MULTIPOLYGON(((0 0,10 0,10 10,0 10,0 0)),((5 5,7 5,7 7,5 7,5 5)))                                                                                                                                                            |
|    7 | GEOMETRYCOLLECTION(POINT(10 5),LINESTRING(15 15,20 20),POLYGON((1 0,10 0,10 10,1 0)),MULTIPOINT((0 0),(20 20)),MULTILINESTRING((5 10,5 20),(15 10,30 15)),MULTIPOLYGON(((1 0,10 0,10 10,0 10,1 0)),((6 5,7 5,7 7,5 7,6 5)))) |
|    5 | MULTILINESTRING((10 10,20 20),(15 15,30 15))                                                                                                                                                                                 |
+------+------------------------------------------------------------------------------------------------------------------------------------------------------------------------------------------------------------------------------+
select id ,st_astext(g) from tt1 where ST_Intersects(g,null);
+------+--------------+
| id   | st_astext(g) |
+------+--------------+
+------+--------------+
##explain select id ,st_astext(g) from tt1 where ST_Intersects(g,g);
select id ,st_astext(g) from tt1 where _st_covers(g,g) in (1,2);
+------+------------------------------------------------------------------------------------------------------------------------------------------------------------------------------------------------------------------------------+
| id   | st_astext(g)                                                                                                                                                                                                                 |
+------+------------------------------------------------------------------------------------------------------------------------------------------------------------------------------------------------------------------------------+
|    1 | POINT(10 20)                                                                                                                                                                                                                 |
|    2 | LINESTRING(100 120,100 240)                                                                                                                                                                                                  |
|    3 | POLYGON((0 0,10 0,10 10,0 10,0 0),(5 5,7 5,7 7,5.5265257 7,5 5))                                                                                                                                                             |
|    4 | MULTIPOINT((0 0),(20 20),(60 60))                                                                                                                                                                                            |
|    6 | MULTIPOLYGON(((0 0,10 0,10 10,0 10,0 0)),((5 5,7 5,7 7,5 7,5 5)))                                                                                                                                                            |
|    7 | GEOMETRYCOLLECTION(POINT(10 5),LINESTRING(15 15,20 20),POLYGON((1 0,10 0,10 10,1 0)),MULTIPOINT((0 0),(20 20)),MULTILINESTRING((5 10,5 20),(15 10,30 15)),MULTIPOLYGON(((1 0,10 0,10 10,0 10,1 0)),((6 5,7 5,7 7,5 7,6 5)))) |
|    5 | MULTILINESTRING((10 10,20 20),(15 15,30 15))                                                                                                                                                                                 |
+------+------------------------------------------------------------------------------------------------------------------------------------------------------------------------------------------------------------------------------+
select id ,st_astext(g) from tt1 where _st_covers(g,g) not in(1,3);
+------+--------------+
| id   | st_astext(g) |
+------+--------------+
+------+--------------+
select id ,st_astext(g) from tt1 where _st_covers(g,g)=1;
+------+------------------------------------------------------------------------------------------------------------------------------------------------------------------------------------------------------------------------------+
| id   | st_astext(g)                                                                                                                                                                                                                 |
+------+------------------------------------------------------------------------------------------------------------------------------------------------------------------------------------------------------------------------------+
|    1 | POINT(10 20)                                                                                                                                                                                                                 |
|    2 | LINESTRING(100 120,100 240)                                                                                                                                                                                                  |
|    3 | POLYGON((0 0,10 0,10 10,0 10,0 0),(5 5,7 5,7 7,5.5265257 7,5 5))                                                                                                                                                             |
|    4 | MULTIPOINT((0 0),(20 20),(60 60))                                                                                                                                                                                            |
|    6 | MULTIPOLYGON(((0 0,10 0,10 10,0 10,0 0)),((5 5,7 5,7 7,5 7,5 5)))                                                                                                                                                            |
|    7 | GEOMETRYCOLLECTION(POINT(10 5),LINESTRING(15 15,20 20),POLYGON((1 0,10 0,10 10,1 0)),MULTIPOINT((0 0),(20 20)),MULTILINESTRING((5 10,5 20),(15 10,30 15)),MULTIPOLYGON(((1 0,10 0,10 10,0 10,1 0)),((6 5,7 5,7 7,5 7,6 5)))) |
|    5 | MULTILINESTRING((10 10,20 20),(15 15,30 15))                                                                                                                                                                                 |
+------+------------------------------------------------------------------------------------------------------------------------------------------------------------------------------------------------------------------------------+
select id ,st_astext(g) from tt1 where _st_covers(g,g)!=1;
+------+--------------+
| id   | st_astext(g) |
+------+--------------+
+------+--------------+
select id ,st_astext(g) from tt1 where _st_covers(g,g)>1;
+------+--------------+
| id   | st_astext(g) |
+------+--------------+
+------+--------------+
select id ,st_astext(g) from tt1 where _st_covers(g,g)<=1;
+------+------------------------------------------------------------------------------------------------------------------------------------------------------------------------------------------------------------------------------+
| id   | st_astext(g)                                                                                                                                                                                                                 |
+------+------------------------------------------------------------------------------------------------------------------------------------------------------------------------------------------------------------------------------+
|    1 | POINT(10 20)                                                                                                                                                                                                                 |
|    2 | LINESTRING(100 120,100 240)                                                                                                                                                                                                  |
|    3 | POLYGON((0 0,10 0,10 10,0 10,0 0),(5 5,7 5,7 7,5.5265257 7,5 5))                                                                                                                                                             |
|    4 | MULTIPOINT((0 0),(20 20),(60 60))                                                                                                                                                                                            |
|    6 | MULTIPOLYGON(((0 0,10 0,10 10,0 10,0 0)),((5 5,7 5,7 7,5 7,5 5)))                                                                                                                                                            |
|    7 | GEOMETRYCOLLECTION(POINT(10 5),LINESTRING(15 15,20 20),POLYGON((1 0,10 0,10 10,1 0)),MULTIPOINT((0 0),(20 20)),MULTILINESTRING((5 10,5 20),(15 10,30 15)),MULTIPOLYGON(((1 0,10 0,10 10,0 10,1 0)),((6 5,7 5,7 7,5 7,6 5)))) |
|    5 | MULTILINESTRING((10 10,20 20),(15 15,30 15))                                                                                                                                                                                 |
+------+------------------------------------------------------------------------------------------------------------------------------------------------------------------------------------------------------------------------------+
select id ,st_astext(g) from tt1 where g !=st_geomfromwkb(x'01040000000300000001010000000000000000000000000000000000000001010000000000000000003440000000000000344001010000000000000000004E400000000000004E40',4236);
+------+------------------------------------------------------------------------------------------------------------------------------------------------------------------------------------------------------------------------------+
| id   | st_astext(g)                                                                                                                                                                                                                 |
+------+------------------------------------------------------------------------------------------------------------------------------------------------------------------------------------------------------------------------------+
|    1 | POINT(10 20)                                                                                                                                                                                                                 |
|    2 | LINESTRING(100 120,100 240)                                                                                                                                                                                                  |
|    3 | POLYGON((0 0,10 0,10 10,0 10,0 0),(5 5,7 5,7 7,5.5265257 7,5 5))                                                                                                                                                             |
|    6 | MULTIPOLYGON(((0 0,10 0,10 10,0 10,0 0)),((5 5,7 5,7 7,5 7,5 5)))                                                                                                                                                            |
|    7 | GEOMETRYCOLLECTION(POINT(10 5),LINESTRING(15 15,20 20),POLYGON((1 0,10 0,10 10,1 0)),MULTIPOINT((0 0),(20 20)),MULTILINESTRING((5 10,5 20),(15 10,30 15)),MULTIPOLYGON(((1 0,10 0,10 10,0 10,1 0)),((6 5,7 5,7 7,5 7,6 5)))) |
|    5 | MULTILINESTRING((10 10,20 20),(15 15,30 15))                                                                                                                                                                                 |
+------+------------------------------------------------------------------------------------------------------------------------------------------------------------------------------------------------------------------------------+
##explain select id ,st_astext(g) from tt1 where _st_covers(g,g);
drop table tt1;
create table tt1(id int , g geometry srid 0, spatial index(g));
ERROR 42000: All parts of a SPATIAL index must be NOT NULL.
create table tt1(id int , g geometry not null srid 0, spatial index(g));
insert into tt1 values(1,ST_GeomFromText('point(10 20)'));
insert into tt1 values(2,st_geomfromwkb(x'01020000000200000000000000000059400000000000005e4000000000000059400000000000006e40',0));
insert into tt1 values(3,ST_GeomFromText('POLYGON((0 0,10 0,10 10,0 10,0 0),(5 5,7 5,7 7,5.5265257 7, 5 5))'));
insert into tt1 values(4,st_geomfromwkb(x'01040000000300000001010000000000000000000000000000000000000001010000000000000000003440000000000000344001010000000000000000004E400000000000004E40',0));
insert into tt1 values(6,st_geometryfromwkb(x'01060000000200000001030000000100000005000000000000000000000000000000000000000000000000002440000000000000000000000000000024400000000000002440000000000000000000000000000024400000000000000000000000000000000001030000000100000005000000000000000000144000000000000014400000000000001C4000000000000014400000000000001C400000000000001C4000000000000014400000000000001C4000000000000014400000000000001440'));
insert into tt1 values(7,ST_GeomFromText('GEOMETRYCOLLECTION(POINT(10 5), LINESTRING(15 15, 20 20),POLYGON((1 0,10 0,10 10,1 0)),MULTIPOINT(0 0, 20 20),
MULTILINESTRING((5 10, 5 20), (15 10, 30 15)),MULTIPOLYGON(((1 0,10 0,10 10,0 10,1 0)),((6 5,7 5,7 7,5 7, 6 5))))'));
insert into tt1 values(5,ST_GeomFromText('MULTILINESTRING((10 10, 20 20), (15 15, 30 15))',0));
SHOW INDEX FROM tt1;
Table	Non_unique	Key_name	Seq_in_index	Column_name	Collation	Cardinality	Sub_part	Packed	Null	Index_type	Comment	Index_comment	Visible	Expression
tt1	1	g	1	g	A	NULL	NULL	NULL		SPATIAL	available		YES	NULL
select id ,st_astext(g) from tt1 where ST_Intersects(g,ST_GeomFromText('MULTILINESTRING((10 10, 20 20), (15 15, 30 15))',26918));
ERROR HY000: The SRID of the geometry does not match the SRID of the column. The SRID of the geometry is 26918, but the SRID of the column is 0. Consider changing the SRID of the geometry or the SRID property of the column.
select id ,st_astext(g) from tt1 where ST_Intersects(g,st_geomfromwkb(x'01020000000200000000000000000059400000000000005e4000000000000059400000000000006e40',0));
+------+-----------------------------+
| id   | st_astext(g)                |
+------+-----------------------------+
|    2 | LINESTRING(100 120,100 240) |
+------+-----------------------------+
select id ,st_astext(g) from tt1 where ST_Intersects(g,ST_GeomFromText('MULTILINESTRING((10 10, 20 20), (15 15, 30 15))'));
+------+------------------------------------------------------------------------------------------------------------------------------------------------------------------------------------------------------------------------------+
| id   | st_astext(g)                                                                                                                                                                                                                 |
+------+------------------------------------------------------------------------------------------------------------------------------------------------------------------------------------------------------------------------------+
|    3 | POLYGON((0 0,10 0,10 10,0 10,0 0),(5 5,7 5,7 7,5.5265257 7,5 5))                                                                                                                                                             |
|    4 | MULTIPOINT((0 0),(20 20),(60 60))                                                                                                                                                                                            |
|    6 | MULTIPOLYGON(((0 0,10 0,10 10,0 10,0 0)),((5 5,7 5,7 7,5 7,5 5)))                                                                                                                                                            |
|    7 | GEOMETRYCOLLECTION(POINT(10 5),LINESTRING(15 15,20 20),POLYGON((1 0,10 0,10 10,1 0)),MULTIPOINT((0 0),(20 20)),MULTILINESTRING((5 10,5 20),(15 10,30 15)),MULTIPOLYGON(((1 0,10 0,10 10,0 10,1 0)),((6 5,7 5,7 7,5 7,6 5)))) |
|    5 | MULTILINESTRING((10 10,20 20),(15 15,30 15))                                                                                                                                                                                 |
+------+------------------------------------------------------------------------------------------------------------------------------------------------------------------------------------------------------------------------------+
select id ,st_astext(g) from tt1 where ST_Intersects(st_geomfromwkb(x'01020000000200000000000000000059400000000000005e4000000000000059400000000000006e40',26918),g);
ERROR HY000: The SRID of the geometry does not match the SRID of the column. The SRID of the geometry is 26918, but the SRID of the column is 0. Consider changing the SRID of the geometry or the SRID property of the column.
select id ,st_astext(g) from tt1 where ST_Intersects(st_geomfromwkb(x'01020000000200000000000000000059400000000000005e4000000000000059400000000000006e40',0),g);
+------+-----------------------------+
| id   | st_astext(g)                |
+------+-----------------------------+
|    2 | LINESTRING(100 120,100 240) |
+------+-----------------------------+
select id ,st_astext(g) from tt1 where ST_Intersects(g,st_geomfromwkb(x'01020000000200000000000000000059400000000000005e4000000000000059400000000000006e40',0))=1;
+------+-----------------------------+
| id   | st_astext(g)                |
+------+-----------------------------+
|    2 | LINESTRING(100 120,100 240) |
+------+-----------------------------+
select id ,st_astext(g) from tt1 where ST_Intersects(ST_GeomFromText('point(10 20)'),g);
+------+--------------+
| id   | st_astext(g) |
+------+--------------+
|    1 | POINT(10 20) |
+------+--------------+
select id ,st_astext(g) from tt1 where ST_Intersects(ST_GeomFromText('point(1 20)'),g);
+------+--------------+
| id   | st_astext(g) |
+------+--------------+
+------+--------------+
select id ,st_astext(g) from tt1 where ST_Intersects(g,g) in(1);
+------+------------------------------------------------------------------------------------------------------------------------------------------------------------------------------------------------------------------------------+
| id   | st_astext(g)                                                                                                                                                                                                                 |
+------+------------------------------------------------------------------------------------------------------------------------------------------------------------------------------------------------------------------------------+
|    1 | POINT(10 20)                                                                                                                                                                                                                 |
|    2 | LINESTRING(100 120,100 240)                                                                                                                                                                                                  |
|    3 | POLYGON((0 0,10 0,10 10,0 10,0 0),(5 5,7 5,7 7,5.5265257 7,5 5))                                                                                                                                                             |
|    4 | MULTIPOINT((0 0),(20 20),(60 60))                                                                                                                                                                                            |
|    6 | MULTIPOLYGON(((0 0,10 0,10 10,0 10,0 0)),((5 5,7 5,7 7,5 7,5 5)))                                                                                                                                                            |
|    7 | GEOMETRYCOLLECTION(POINT(10 5),LINESTRING(15 15,20 20),POLYGON((1 0,10 0,10 10,1 0)),MULTIPOINT((0 0),(20 20)),MULTILINESTRING((5 10,5 20),(15 10,30 15)),MULTIPOLYGON(((1 0,10 0,10 10,0 10,1 0)),((6 5,7 5,7 7,5 7,6 5)))) |
|    5 | MULTILINESTRING((10 10,20 20),(15 15,30 15))                                                                                                                                                                                 |
+------+------------------------------------------------------------------------------------------------------------------------------------------------------------------------------------------------------------------------------+
select id ,st_astext(g) from tt1 where ST_Intersects(g,g) not in(1);
+------+--------------+
| id   | st_astext(g) |
+------+--------------+
+------+--------------+
select id ,st_astext(g) from tt1 where ST_Intersects(g,g) =1;
+------+------------------------------------------------------------------------------------------------------------------------------------------------------------------------------------------------------------------------------+
| id   | st_astext(g)                                                                                                                                                                                                                 |
+------+------------------------------------------------------------------------------------------------------------------------------------------------------------------------------------------------------------------------------+
|    1 | POINT(10 20)                                                                                                                                                                                                                 |
|    2 | LINESTRING(100 120,100 240)                                                                                                                                                                                                  |
|    3 | POLYGON((0 0,10 0,10 10,0 10,0 0),(5 5,7 5,7 7,5.5265257 7,5 5))                                                                                                                                                             |
|    4 | MULTIPOINT((0 0),(20 20),(60 60))                                                                                                                                                                                            |
|    6 | MULTIPOLYGON(((0 0,10 0,10 10,0 10,0 0)),((5 5,7 5,7 7,5 7,5 5)))                                                                                                                                                            |
|    7 | GEOMETRYCOLLECTION(POINT(10 5),LINESTRING(15 15,20 20),POLYGON((1 0,10 0,10 10,1 0)),MULTIPOINT((0 0),(20 20)),MULTILINESTRING((5 10,5 20),(15 10,30 15)),MULTIPOLYGON(((1 0,10 0,10 10,0 10,1 0)),((6 5,7 5,7 7,5 7,6 5)))) |
|    5 | MULTILINESTRING((10 10,20 20),(15 15,30 15))                                                                                                                                                                                 |
+------+------------------------------------------------------------------------------------------------------------------------------------------------------------------------------------------------------------------------------+
select id ,st_astext(g) from tt1 where ST_Intersects(g,g) !=1;
+------+--------------+
| id   | st_astext(g) |
+------+--------------+
+------+--------------+
select id ,st_astext(g) from tt1 where ST_Intersects(g,g) >1;
+------+--------------+
| id   | st_astext(g) |
+------+--------------+
+------+--------------+
select id ,st_astext(g) from tt1 where ST_Intersects(g,g) <=1;
+------+------------------------------------------------------------------------------------------------------------------------------------------------------------------------------------------------------------------------------+
| id   | st_astext(g)                                                                                                                                                                                                                 |
+------+------------------------------------------------------------------------------------------------------------------------------------------------------------------------------------------------------------------------------+
|    1 | POINT(10 20)                                                                                                                                                                                                                 |
|    2 | LINESTRING(100 120,100 240)                                                                                                                                                                                                  |
|    3 | POLYGON((0 0,10 0,10 10,0 10,0 0),(5 5,7 5,7 7,5.5265257 7,5 5))                                                                                                                                                             |
|    4 | MULTIPOINT((0 0),(20 20),(60 60))                                                                                                                                                                                            |
|    6 | MULTIPOLYGON(((0 0,10 0,10 10,0 10,0 0)),((5 5,7 5,7 7,5 7,5 5)))                                                                                                                                                            |
|    7 | GEOMETRYCOLLECTION(POINT(10 5),LINESTRING(15 15,20 20),POLYGON((1 0,10 0,10 10,1 0)),MULTIPOINT((0 0),(20 20)),MULTILINESTRING((5 10,5 20),(15 10,30 15)),MULTIPOLYGON(((1 0,10 0,10 10,0 10,1 0)),((6 5,7 5,7 7,5 7,6 5)))) |
|    5 | MULTILINESTRING((10 10,20 20),(15 15,30 15))                                                                                                                                                                                 |
+------+------------------------------------------------------------------------------------------------------------------------------------------------------------------------------------------------------------------------------+
select id ,st_astext(g) from tt1 where g=ST_GeomFromText('point(10 20)',4236);
+------+--------------+
| id   | st_astext(g) |
+------+--------------+
+------+--------------+
select id ,st_astext(g) from tt1 where _st_covers(g,g);
+------+------------------------------------------------------------------------------------------------------------------------------------------------------------------------------------------------------------------------------+
| id   | st_astext(g)                                                                                                                                                                                                                 |
+------+------------------------------------------------------------------------------------------------------------------------------------------------------------------------------------------------------------------------------+
|    1 | POINT(10 20)                                                                                                                                                                                                                 |
|    2 | LINESTRING(100 120,100 240)                                                                                                                                                                                                  |
|    3 | POLYGON((0 0,10 0,10 10,0 10,0 0),(5 5,7 5,7 7,5.5265257 7,5 5))                                                                                                                                                             |
|    4 | MULTIPOINT((0 0),(20 20),(60 60))                                                                                                                                                                                            |
|    6 | MULTIPOLYGON(((0 0,10 0,10 10,0 10,0 0)),((5 5,7 5,7 7,5 7,5 5)))                                                                                                                                                            |
|    7 | GEOMETRYCOLLECTION(POINT(10 5),LINESTRING(15 15,20 20),POLYGON((1 0,10 0,10 10,1 0)),MULTIPOINT((0 0),(20 20)),MULTILINESTRING((5 10,5 20),(15 10,30 15)),MULTIPOLYGON(((1 0,10 0,10 10,0 10,1 0)),((6 5,7 5,7 7,5 7,6 5)))) |
|    5 | MULTILINESTRING((10 10,20 20),(15 15,30 15))                                                                                                                                                                                 |
+------+------------------------------------------------------------------------------------------------------------------------------------------------------------------------------------------------------------------------------+
select id ,st_astext(g) from tt1 where _st_covers(g,g) in (1,2);
+------+------------------------------------------------------------------------------------------------------------------------------------------------------------------------------------------------------------------------------+
| id   | st_astext(g)                                                                                                                                                                                                                 |
+------+------------------------------------------------------------------------------------------------------------------------------------------------------------------------------------------------------------------------------+
|    1 | POINT(10 20)                                                                                                                                                                                                                 |
|    2 | LINESTRING(100 120,100 240)                                                                                                                                                                                                  |
|    3 | POLYGON((0 0,10 0,10 10,0 10,0 0),(5 5,7 5,7 7,5.5265257 7,5 5))                                                                                                                                                             |
|    4 | MULTIPOINT((0 0),(20 20),(60 60))                                                                                                                                                                                            |
|    6 | MULTIPOLYGON(((0 0,10 0,10 10,0 10,0 0)),((5 5,7 5,7 7,5 7,5 5)))                                                                                                                                                            |
|    7 | GEOMETRYCOLLECTION(POINT(10 5),LINESTRING(15 15,20 20),POLYGON((1 0,10 0,10 10,1 0)),MULTIPOINT((0 0),(20 20)),MULTILINESTRING((5 10,5 20),(15 10,30 15)),MULTIPOLYGON(((1 0,10 0,10 10,0 10,1 0)),((6 5,7 5,7 7,5 7,6 5)))) |
|    5 | MULTILINESTRING((10 10,20 20),(15 15,30 15))                                                                                                                                                                                 |
+------+------------------------------------------------------------------------------------------------------------------------------------------------------------------------------------------------------------------------------+
select id ,st_astext(g) from tt1 where _st_covers(g,g) not in(1,3);
+------+--------------+
| id   | st_astext(g) |
+------+--------------+
+------+--------------+
select id ,st_astext(g) from tt1 where _st_covers(g,g)=1;
+------+------------------------------------------------------------------------------------------------------------------------------------------------------------------------------------------------------------------------------+
| id   | st_astext(g)                                                                                                                                                                                                                 |
+------+------------------------------------------------------------------------------------------------------------------------------------------------------------------------------------------------------------------------------+
|    1 | POINT(10 20)                                                                                                                                                                                                                 |
|    2 | LINESTRING(100 120,100 240)                                                                                                                                                                                                  |
|    3 | POLYGON((0 0,10 0,10 10,0 10,0 0),(5 5,7 5,7 7,5.5265257 7,5 5))                                                                                                                                                             |
|    4 | MULTIPOINT((0 0),(20 20),(60 60))                                                                                                                                                                                            |
|    6 | MULTIPOLYGON(((0 0,10 0,10 10,0 10,0 0)),((5 5,7 5,7 7,5 7,5 5)))                                                                                                                                                            |
|    7 | GEOMETRYCOLLECTION(POINT(10 5),LINESTRING(15 15,20 20),POLYGON((1 0,10 0,10 10,1 0)),MULTIPOINT((0 0),(20 20)),MULTILINESTRING((5 10,5 20),(15 10,30 15)),MULTIPOLYGON(((1 0,10 0,10 10,0 10,1 0)),((6 5,7 5,7 7,5 7,6 5)))) |
|    5 | MULTILINESTRING((10 10,20 20),(15 15,30 15))                                                                                                                                                                                 |
+------+------------------------------------------------------------------------------------------------------------------------------------------------------------------------------------------------------------------------------+
select id ,st_astext(g) from tt1 where _st_covers(g,g)!=1;
+------+--------------+
| id   | st_astext(g) |
+------+--------------+
+------+--------------+
select id ,st_astext(g) from tt1 where _st_covers(g,g)>1;
+------+--------------+
| id   | st_astext(g) |
+------+--------------+
+------+--------------+
select id ,st_astext(g) from tt1 where _st_covers(g,g)<=1;
+------+------------------------------------------------------------------------------------------------------------------------------------------------------------------------------------------------------------------------------+
| id   | st_astext(g)                                                                                                                                                                                                                 |
+------+------------------------------------------------------------------------------------------------------------------------------------------------------------------------------------------------------------------------------+
|    1 | POINT(10 20)                                                                                                                                                                                                                 |
|    2 | LINESTRING(100 120,100 240)                                                                                                                                                                                                  |
|    3 | POLYGON((0 0,10 0,10 10,0 10,0 0),(5 5,7 5,7 7,5.5265257 7,5 5))                                                                                                                                                             |
|    4 | MULTIPOINT((0 0),(20 20),(60 60))                                                                                                                                                                                            |
|    6 | MULTIPOLYGON(((0 0,10 0,10 10,0 10,0 0)),((5 5,7 5,7 7,5 7,5 5)))                                                                                                                                                            |
|    7 | GEOMETRYCOLLECTION(POINT(10 5),LINESTRING(15 15,20 20),POLYGON((1 0,10 0,10 10,1 0)),MULTIPOINT((0 0),(20 20)),MULTILINESTRING((5 10,5 20),(15 10,30 15)),MULTIPOLYGON(((1 0,10 0,10 10,0 10,1 0)),((6 5,7 5,7 7,5 7,6 5)))) |
|    5 | MULTILINESTRING((10 10,20 20),(15 15,30 15))                                                                                                                                                                                 |
+------+------------------------------------------------------------------------------------------------------------------------------------------------------------------------------------------------------------------------------+
select id ,st_astext(g) from tt1 where _st_covers(g,ST_GeomFromText('GEOMETRYCOLLECTION(POINT(10 5), LINESTRING(15 15, 20 20),POLYGON((1 0,10 0,10 10,1 0)),MULTIPOINT(0 0, 20 20),
MULTILINESTRING((5 10, 5 20), (15 10, 30 15)),MULTIPOLYGON(((1 0,10 0,10 10,0 10,1 0)),((6 5,7 5,7 7,5 7, 6 5))))',4236));
ERROR HY000: The SRID of the geometry does not match the SRID of the column. The SRID of the geometry is 4236, but the SRID of the column is 0. Consider changing the SRID of the geometry or the SRID property of the column.
select id ,st_astext(g) from tt1 where _st_covers(g,ST_GeomFromText('GEOMETRYCOLLECTION(POINT(10 5), LINESTRING(15 15, 20 20),POLYGON((1 0,10 0,10 10,1 0)),MULTIPOINT(0 0, 20 20),
MULTILINESTRING((5 10, 5 20), (15 10, 30 15)),MULTIPOLYGON(((1 0,10 0,10 10,0 10,1 0)),((6 5,7 5,7 7,5 7, 6 5))))',0));
+------+------------------------------------------------------------------------------------------------------------------------------------------------------------------------------------------------------------------------------+
| id   | st_astext(g)                                                                                                                                                                                                                 |
+------+------------------------------------------------------------------------------------------------------------------------------------------------------------------------------------------------------------------------------+
|    7 | GEOMETRYCOLLECTION(POINT(10 5),LINESTRING(15 15,20 20),POLYGON((1 0,10 0,10 10,1 0)),MULTIPOINT((0 0),(20 20)),MULTILINESTRING((5 10,5 20),(15 10,30 15)),MULTIPOLYGON(((1 0,10 0,10 10,0 10,1 0)),((6 5,7 5,7 7,5 7,6 5)))) |
+------+------------------------------------------------------------------------------------------------------------------------------------------------------------------------------------------------------------------------------+
select id ,st_astext(g) from tt1 where _st_covers(st_geometryfromwkb(x'01060000000200000001030000000100000005000000000000000000000000000000000000000000000000002440000000000000000000000000000024400000000000002440000000000000000000000000000024400000000000000000000000000000000001030000000100000005000000000000000000144000000000000014400000000000001C4000000000000014400000000000001C400000000000001C4000000000000014400000000000001C4000000000000014400000000000001440'),g)=1;
+------+-------------------------------------------------------------------+
| id   | st_astext(g)                                                      |
+------+-------------------------------------------------------------------+
|    6 | MULTIPOLYGON(((0 0,10 0,10 10,0 10,0 0)),((5 5,7 5,7 7,5 7,5 5))) |
+------+-------------------------------------------------------------------+
select id ,st_astext(g) from tt1 where _st_covers(st_geometryfromwkb(x'01060000000200000001030000000100000005000000000000000000000000000000000000000000000000002440000000000000000000000000000024400000000000002440000000000000000000000000000024400000000000000000000000000000000001030000000100000005000000000000000000144000000000000014400000000000001C4000000000000014400000000000001C400000000000001C4000000000000014400000000000001C4000000000000014400000000000001440',4236),g)=1;
ERROR HY000: Binary geometry function _st_covers given two geometries of different srids: 4236 and 0, which should have been identical.
select id ,st_astext(g) from tt1 where ST_Intersects(st_geometryfromwkb(x'01060000000200000001030000000100000005000000000000000000000000000000000000000000000000002440000000000000000000000000000024400000000000002440000000000000000000000000000024400000000000000000000000000000000001030000000100000005000000000000000000144000000000000014400000000000001C4000000000000014400000000000001C400000000000001C4000000000000014400000000000001C4000000000000014400000000000001440',4236),g)=1;
ERROR HY000: Binary geometry function given two geometries of different srids.
select id ,st_astext(g) from tt1 where g !=st_geomfromwkb(x'01040000000300000001010000000000000000000000000000000000000001010000000000000000003440000000000000344001010000000000000000004E400000000000004E40',4236);
+------+------------------------------------------------------------------------------------------------------------------------------------------------------------------------------------------------------------------------------+
| id   | st_astext(g)                                                                                                                                                                                                                 |
+------+------------------------------------------------------------------------------------------------------------------------------------------------------------------------------------------------------------------------------+
|    1 | POINT(10 20)                                                                                                                                                                                                                 |
|    2 | LINESTRING(100 120,100 240)                                                                                                                                                                                                  |
|    3 | POLYGON((0 0,10 0,10 10,0 10,0 0),(5 5,7 5,7 7,5.5265257 7,5 5))                                                                                                                                                             |
|    4 | MULTIPOINT((0 0),(20 20),(60 60))                                                                                                                                                                                            |
|    6 | MULTIPOLYGON(((0 0,10 0,10 10,0 10,0 0)),((5 5,7 5,7 7,5 7,5 5)))                                                                                                                                                            |
|    7 | GEOMETRYCOLLECTION(POINT(10 5),LINESTRING(15 15,20 20),POLYGON((1 0,10 0,10 10,1 0)),MULTIPOINT((0 0),(20 20)),MULTILINESTRING((5 10,5 20),(15 10,30 15)),MULTIPOLYGON(((1 0,10 0,10 10,0 10,1 0)),((6 5,7 5,7 7,5 7,6 5)))) |
|    5 | MULTILINESTRING((10 10,20 20),(15 15,30 15))                                                                                                                                                                                 |
+------+------------------------------------------------------------------------------------------------------------------------------------------------------------------------------------------------------------------------------+
drop table tt1;
create table tt1(id int , g geometry not null srid 4236 , spatial index(g) local);
insert into tt1 values(1,ST_GeomFromText('point(10 20)',4236));
insert into tt1 values(2,ST_GeomFromText('MULTILINESTRING((0 0, 20 20), (15 15, 30 15))',4236));
insert into tt1 values(3,ST_GeomFromText('POLYGON((0 0,10 0,10 10,0 10,0 0),(5 5,7 5,7 7,7 7, 5 5))',4236));
insert into tt1 values(4,ST_GeomFromText('MULTIPOINT((50 90),(90 90),(50 60))',4236));
insert into tt1 values(6,st_geometryfromwkb(x'01060000000200000001030000000100000005000000000000000000000000000000000000000000000000002440000000000000000000000000000024400000000000002440000000000000000000000000000024400000000000000000000000000000000001030000000100000005000000000000000000144000000000000014400000000000001C4000000000000014400000000000001C400000000000001C4000000000000014400000000000001C4000000000000014400000000000001440',4236));
insert into tt1 values(5,ST_GeomFromText('MULTILINESTRING((10 10, 20 20), (15 15, 30 15))',4236));
select id ,hex(g) from tt1;
+------+----------------------------------------------------------------------------------------------------------------------------------------------------------------------------------------------------------------------------------------------------------------------------------------------------------------------------------------------------------------------------------------------------------------+
| id   | hex(g)                                                                                                                                                                                                                                                                                                                                                                                                         |
+------+----------------------------------------------------------------------------------------------------------------------------------------------------------------------------------------------------------------------------------------------------------------------------------------------------------------------------------------------------------------------------------------------------------------+
|    1 | 8C100000010100000000000000000034400000000000002440                                                                                                                                                                                                                                                                                                                                                             |
|    2 | 8C10000001050000000200000001020000000200000000000000000000000000000000000000000000000000344000000000000034400102000000020000000000000000002E400000000000002E400000000000002E400000000000003E40                                                                                                                                                                                                                 |
|    3 | 8C100000010300000002000000050000000000000000000000000000000000000000000000000000000000000000002440000000000000244000000000000024400000000000002440000000000000000000000000000000000000000000000000050000000000000000001440000000000000144000000000000014400000000000001C400000000000001C400000000000001C400000000000001C400000000000001C4000000000000014400000000000001440                                     |
|    4 | 8C10000001040000000300000001010000000000000000805640000000000000494001010000000000000000805640000000000080564001010000000000000000004E400000000000004940                                                                                                                                                                                                                                                       |
|    6 | 8C100000010600000002000000010300000001000000050000000000000000000000000000000000000000000000000000000000000000002440000000000000244000000000000024400000000000002440000000000000000000000000000000000000000000000000010300000001000000050000000000000000001440000000000000144000000000000014400000000000001C400000000000001C400000000000001C400000000000001C40000000000000144000000000000014400000000000001440 |
|    5 | 8C10000001050000000200000001020000000200000000000000000024400000000000002440000000000000344000000000000034400102000000020000000000000000002E400000000000002E400000000000002E400000000000003E40                                                                                                                                                                                                                 |
+------+----------------------------------------------------------------------------------------------------------------------------------------------------------------------------------------------------------------------------------------------------------------------------------------------------------------------------------------------------------------------------------------------------------------+
SHOW INDEX FROM tt1;
Table	Non_unique	Key_name	Seq_in_index	Column_name	Collation	Cardinality	Sub_part	Packed	Null	Index_type	Comment	Index_comment	Visible	Expression
tt1	1	g	1	g	A	NULL	NULL	NULL		SPATIAL	available		YES	NULL
show create table tt1;
Table	Create Table
tt1	CREATE TABLE `tt1` (
  `id` int(11) DEFAULT NULL,
  `g` geometry NOT NULL /*!80003 SRID 4236 */,
  SPATIAL KEY `g` (`g`) BLOCK_SIZE 16384 LOCAL
) ORGANIZATION INDEX DEFAULT CHARSET = utf8mb4 ROW_FORMAT = DYNAMIC COMPRESSION = 'zstd_1.3.8' REPLICA_NUM = 1 BLOCK_SIZE = 16384 USE_BLOOM_FILTER = FALSE ENABLE_MACRO_BLOCK_BLOOM_FILTER = FALSE TABLET_SIZE = 134217728 PCTFREE = 0
select _st_covers(g,g) from tt1;
+-----------------+
| _st_covers(g,g) |
+-----------------+
|               1 |
|               1 |
|               1 |
|               1 |
|               1 |
|               1 |
+-----------------+
select id ,st_astext(g) from tt1 where ST_Intersects(g,ST_GeomFromText('MULTILINESTRING((10 10, 20 20), (15 15, 30 15))',4236));
+------+-------------------------------------------------------------------+
| id   | st_astext(g)                                                      |
+------+-------------------------------------------------------------------+
|    2 | MULTILINESTRING((0 0,20 20),(15 15,30 15))                        |
|    3 | POLYGON((0 0,10 0,10 10,0 10,0 0),(5 5,7 5,7 7,7 7,5 5))          |
|    6 | MULTIPOLYGON(((0 0,10 0,10 10,0 10,0 0)),((5 5,7 5,7 7,5 7,5 5))) |
|    5 | MULTILINESTRING((10 10,20 20),(15 15,30 15))                      |
+------+-------------------------------------------------------------------+
select id ,st_astext(g) from tt1 where ST_Intersects(g,g);
+------+-------------------------------------------------------------------+
| id   | st_astext(g)                                                      |
+------+-------------------------------------------------------------------+
|    1 | POINT(10 20)                                                      |
|    2 | MULTILINESTRING((0 0,20 20),(15 15,30 15))                        |
|    3 | POLYGON((0 0,10 0,10 10,0 10,0 0),(5 5,7 5,7 7,7 7,5 5))          |
|    4 | MULTIPOINT((50 90),(90 90),(50 60))                               |
|    6 | MULTIPOLYGON(((0 0,10 0,10 10,0 10,0 0)),((5 5,7 5,7 7,5 7,5 5))) |
|    5 | MULTILINESTRING((10 10,20 20),(15 15,30 15))                      |
+------+-------------------------------------------------------------------+
select id ,st_astext(g) from tt1 where ST_Intersects(g,ST_GeomFromText('MULTILINESTRING((10 10, 20 20), (15 15, 30 15))',4236));
+------+-------------------------------------------------------------------+
| id   | st_astext(g)                                                      |
+------+-------------------------------------------------------------------+
|    2 | MULTILINESTRING((0 0,20 20),(15 15,30 15))                        |
|    3 | POLYGON((0 0,10 0,10 10,0 10,0 0),(5 5,7 5,7 7,7 7,5 5))          |
|    6 | MULTIPOLYGON(((0 0,10 0,10 10,0 10,0 0)),((5 5,7 5,7 7,5 7,5 5))) |
|    5 | MULTILINESTRING((10 10,20 20),(15 15,30 15))                      |
+------+-------------------------------------------------------------------+
select id ,st_astext(g) from tt1 where ST_Intersects(ST_GeomFromText('point(10 20)',4236),g);
+------+--------------+
| id   | st_astext(g) |
+------+--------------+
|    1 | POINT(10 20) |
+------+--------------+
select id ,st_astext(g) from tt1 where ST_Intersects(g,ST_GeomFromText('point(10 20)',4236));
+------+--------------+
| id   | st_astext(g) |
+------+--------------+
|    1 | POINT(10 20) |
+------+--------------+
select id ,st_astext(g) from tt1 where ST_Intersects(g,g) in(1);
+------+-------------------------------------------------------------------+
| id   | st_astext(g)                                                      |
+------+-------------------------------------------------------------------+
|    1 | POINT(10 20)                                                      |
|    2 | MULTILINESTRING((0 0,20 20),(15 15,30 15))                        |
|    3 | POLYGON((0 0,10 0,10 10,0 10,0 0),(5 5,7 5,7 7,7 7,5 5))          |
|    4 | MULTIPOINT((50 90),(90 90),(50 60))                               |
|    6 | MULTIPOLYGON(((0 0,10 0,10 10,0 10,0 0)),((5 5,7 5,7 7,5 7,5 5))) |
|    5 | MULTILINESTRING((10 10,20 20),(15 15,30 15))                      |
+------+-------------------------------------------------------------------+
select id ,st_astext(g) from tt1 where ST_Intersects(g,g) not in(1);
+------+--------------+
| id   | st_astext(g) |
+------+--------------+
+------+--------------+
select id ,st_astext(g) from tt1 where ST_Intersects(g,g) =1;
+------+-------------------------------------------------------------------+
| id   | st_astext(g)                                                      |
+------+-------------------------------------------------------------------+
|    1 | POINT(10 20)                                                      |
|    2 | MULTILINESTRING((0 0,20 20),(15 15,30 15))                        |
|    3 | POLYGON((0 0,10 0,10 10,0 10,0 0),(5 5,7 5,7 7,7 7,5 5))          |
|    4 | MULTIPOINT((50 90),(90 90),(50 60))                               |
|    6 | MULTIPOLYGON(((0 0,10 0,10 10,0 10,0 0)),((5 5,7 5,7 7,5 7,5 5))) |
|    5 | MULTILINESTRING((10 10,20 20),(15 15,30 15))                      |
+------+-------------------------------------------------------------------+
select id ,st_astext(g) from tt1 where ST_Intersects(g,g) !=1;
+------+--------------+
| id   | st_astext(g) |
+------+--------------+
+------+--------------+
select id ,st_astext(g) from tt1 where ST_Intersects(g,g) >1;
+------+--------------+
| id   | st_astext(g) |
+------+--------------+
+------+--------------+
select id ,st_astext(g) from tt1 where ST_Intersects(g,g) <=1;
+------+-------------------------------------------------------------------+
| id   | st_astext(g)                                                      |
+------+-------------------------------------------------------------------+
|    1 | POINT(10 20)                                                      |
|    2 | MULTILINESTRING((0 0,20 20),(15 15,30 15))                        |
|    3 | POLYGON((0 0,10 0,10 10,0 10,0 0),(5 5,7 5,7 7,7 7,5 5))          |
|    4 | MULTIPOINT((50 90),(90 90),(50 60))                               |
|    6 | MULTIPOLYGON(((0 0,10 0,10 10,0 10,0 0)),((5 5,7 5,7 7,5 7,5 5))) |
|    5 | MULTILINESTRING((10 10,20 20),(15 15,30 15))                      |
+------+-------------------------------------------------------------------+
select id ,st_astext(g) from tt1 where g=ST_GeomFromText('point(10 20)',4236);
+------+--------------+
| id   | st_astext(g) |
+------+--------------+
|    1 | POINT(10 20) |
+------+--------------+
select id ,st_astext(g) from tt1 where ST_Intersects(g,g);
+------+-------------------------------------------------------------------+
| id   | st_astext(g)                                                      |
+------+-------------------------------------------------------------------+
|    1 | POINT(10 20)                                                      |
|    2 | MULTILINESTRING((0 0,20 20),(15 15,30 15))                        |
|    3 | POLYGON((0 0,10 0,10 10,0 10,0 0),(5 5,7 5,7 7,7 7,5 5))          |
|    4 | MULTIPOINT((50 90),(90 90),(50 60))                               |
|    6 | MULTIPOLYGON(((0 0,10 0,10 10,0 10,0 0)),((5 5,7 5,7 7,5 7,5 5))) |
|    5 | MULTILINESTRING((10 10,20 20),(15 15,30 15))                      |
+------+-------------------------------------------------------------------+
bug 41604040
select id ,st_astext(g) from tt1 where _st_covers(g,g);
+------+-------------------------------------------------------------------+
| id   | st_astext(g)                                                      |
+------+-------------------------------------------------------------------+
|    1 | POINT(10 20)                                                      |
|    2 | MULTILINESTRING((0 0,20 20),(15 15,30 15))                        |
|    3 | POLYGON((0 0,10 0,10 10,0 10,0 0),(5 5,7 5,7 7,7 7,5 5))          |
|    4 | MULTIPOINT((50 90),(90 90),(50 60))                               |
|    6 | MULTIPOLYGON(((0 0,10 0,10 10,0 10,0 0)),((5 5,7 5,7 7,5 7,5 5))) |
|    5 | MULTILINESTRING((10 10,20 20),(15 15,30 15))                      |
+------+-------------------------------------------------------------------+
select id ,st_astext(g) from tt1 where _st_covers(g,g) in (1,2);
+------+-------------------------------------------------------------------+
| id   | st_astext(g)                                                      |
+------+-------------------------------------------------------------------+
|    1 | POINT(10 20)                                                      |
|    2 | MULTILINESTRING((0 0,20 20),(15 15,30 15))                        |
|    3 | POLYGON((0 0,10 0,10 10,0 10,0 0),(5 5,7 5,7 7,7 7,5 5))          |
|    4 | MULTIPOINT((50 90),(90 90),(50 60))                               |
|    6 | MULTIPOLYGON(((0 0,10 0,10 10,0 10,0 0)),((5 5,7 5,7 7,5 7,5 5))) |
|    5 | MULTILINESTRING((10 10,20 20),(15 15,30 15))                      |
+------+-------------------------------------------------------------------+
select id ,st_astext(g) from tt1 where _st_covers(g,g) not in (1,3);
+------+--------------+
| id   | st_astext(g) |
+------+--------------+
+------+--------------+
select id ,st_astext(g) from tt1 where _st_covers(g,g)=1;
+------+-------------------------------------------------------------------+
| id   | st_astext(g)                                                      |
+------+-------------------------------------------------------------------+
|    1 | POINT(10 20)                                                      |
|    2 | MULTILINESTRING((0 0,20 20),(15 15,30 15))                        |
|    3 | POLYGON((0 0,10 0,10 10,0 10,0 0),(5 5,7 5,7 7,7 7,5 5))          |
|    4 | MULTIPOINT((50 90),(90 90),(50 60))                               |
|    6 | MULTIPOLYGON(((0 0,10 0,10 10,0 10,0 0)),((5 5,7 5,7 7,5 7,5 5))) |
|    5 | MULTILINESTRING((10 10,20 20),(15 15,30 15))                      |
+------+-------------------------------------------------------------------+
select id ,st_astext(g) from tt1 where _st_covers(g,g)!=1;
+------+--------------+
| id   | st_astext(g) |
+------+--------------+
+------+--------------+
select id ,st_astext(g) from tt1 where _st_covers(g,g)>1;
+------+--------------+
| id   | st_astext(g) |
+------+--------------+
+------+--------------+
select id ,st_astext(g) from tt1 where _st_covers(g,g)<=1;
+------+-------------------------------------------------------------------+
| id   | st_astext(g)                                                      |
+------+-------------------------------------------------------------------+
|    1 | POINT(10 20)                                                      |
|    2 | MULTILINESTRING((0 0,20 20),(15 15,30 15))                        |
|    3 | POLYGON((0 0,10 0,10 10,0 10,0 0),(5 5,7 5,7 7,7 7,5 5))          |
|    4 | MULTIPOINT((50 90),(90 90),(50 60))                               |
|    6 | MULTIPOLYGON(((0 0,10 0,10 10,0 10,0 0)),((5 5,7 5,7 7,5 7,5 5))) |
|    5 | MULTILINESTRING((10 10,20 20),(15 15,30 15))                      |
+------+-------------------------------------------------------------------+
select id ,st_astext(g) from tt1 where _st_covers(g,ST_GeomFromText('GEOMETRYCOLLECTION(POINT(10 5), LINESTRING(15 15, 20 20),POLYGON((1 0,10 0,10 10,1 0)),MULTIPOINT(0 0, 20 20),
MULTILINESTRING((5 10, 5 20), (15 10, 30 15)),MULTIPOLYGON(((1 0,10 0,10 10,0 10,1 0)),((6 5,7 5,7 7,5 7, 6 5))))',4236));
+------+--------------+
| id   | st_astext(g) |
+------+--------------+
+------+--------------+
select id ,st_astext(g) from tt1 where _st_covers(st_geometryfromwkb(x'01060000000200000001030000000100000005000000000000000000000000000000000000000000000000002440000000000000000000000000000024400000000000002440000000000000000000000000000024400000000000000000000000000000000001030000000100000005000000000000000000144000000000000014400000000000001C4000000000000014400000000000001C400000000000001C4000000000000014400000000000001C4000000000000014400000000000001440',4236),g)=1;
+------+-------------------------------------------------------------------+
| id   | st_astext(g)                                                      |
+------+-------------------------------------------------------------------+
|    6 | MULTIPOLYGON(((0 0,10 0,10 10,0 10,0 0)),((5 5,7 5,7 7,5 7,5 5))) |
+------+-------------------------------------------------------------------+
select id ,st_astext(g) from tt1 where g !=st_geomfromwkb(x'01040000000300000001010000000000000000000000000000000000000001010000000000000000003440000000000000344001010000000000000000004E400000000000004E40',4236);
+------+-------------------------------------------------------------------+
| id   | st_astext(g)                                                      |
+------+-------------------------------------------------------------------+
|    1 | POINT(10 20)                                                      |
|    2 | MULTILINESTRING((0 0,20 20),(15 15,30 15))                        |
|    3 | POLYGON((0 0,10 0,10 10,0 10,0 0),(5 5,7 5,7 7,7 7,5 5))          |
|    4 | MULTIPOINT((50 90),(90 90),(50 60))                               |
|    6 | MULTIPOLYGON(((0 0,10 0,10 10,0 10,0 0)),((5 5,7 5,7 7,5 7,5 5))) |
|    5 | MULTILINESTRING((10 10,20 20),(15 15,30 15))                      |
+------+-------------------------------------------------------------------+
drop table tt1;
create table tt1(id int , g geometry not null srid 26918 , spatial index(g));
insert into tt1 values(1,ST_GeomFromText('POINT(15 20)',26918));
insert into tt1 values(2,ST_GeomFromText('LINESTRING(0 0, 10 10, 20 25, 50 60)',26918));
insert into tt1 values(3,ST_GeomFromText('POLYGON((0 1,10 0,9 10,0 10,0 1),(5 5,7 5,8 7,5 7, 5 5))',26918));
insert into tt1 values(4,ST_GeomFromText('MULTIPOINT(0 1, -20 25, 60 -60)',26918));
insert into tt1 values(5,ST_GeomFromText('MULTILINESTRING((11 10, 20 -20), (-15 20, 30 15))',26918));
insert into tt1 values(6,ST_GeomFromText('MULTIPOLYGON(((0 0,10 0,10 11,0 10,0 0)),((-5 -6,7 5,7 7,5 7, -5 -6)))',26918));
insert into tt1 values(7,ST_GeomFromText('GEOMETRYCOLLECTION(POINT(11 10), POINT(30 -30), LINESTRING(-15 15, -20 20))',26918));
drop table tt3;
create table tt3(id int , p geometry not null srid 26918 , spatial index(p));
insert into tt3 values(1,ST_GeomFromText('POINT(15 20)',26918));
insert into tt3 values(2,ST_GeomFromText('LINESTRING(0 0, 10 10, 20 25, 50 60)',26918));
insert into tt3 values(3,ST_GeomFromText('POLYGON((0 1,10 0,9 10,0 10,0 1),(5 5,7 5,8 7,5 7, 5 5))',26918));
insert into tt3 values(4,ST_GeomFromText('MULTIPOINT(0 1, -20 25, 60 -60)',26918));
insert into tt3 values(5,ST_GeomFromText('MULTILINESTRING((11 10, 20 -20), (-15 20, 30 15))',26918));
insert into tt3 values(6,ST_GeomFromText('MULTIPOLYGON(((0 0,10 0,10 11,0 10,0 0)),((-5 -6,7 5,7 7,5 7, -5 -6)))',26918));
insert into tt3 values(7,ST_GeomFromText('GEOMETRYCOLLECTION(POINT(11 10), POINT(30 -30), LINESTRING(-15 15, -20 20))',26918));
drop table tt2;
create table tt2(id int , g geometry not null srid 26918);
insert into tt2 values(1,ST_GeomFromText('POINT(15 20)',26918));
insert into tt2 values(2,ST_GeomFromText('LINESTRING(0 0, 10 10, 20 25, 50 60)',26918));
insert into tt2 values(3,ST_GeomFromText('POLYGON((0 1,10 0,9 10,0 10,0 1),(5 5,7 5,8 7,5 7, 5 5))',26918));
insert into tt2 values(4,ST_GeomFromText('MULTIPOINT(0 1, -20 25, 60 -60)',26918));
insert into tt2 values(5,ST_GeomFromText('MULTILINESTRING((11 10, 20 -20), (-15 20, 30 15))',26918));
insert into tt2 values(6,ST_GeomFromText('MULTIPOLYGON(((0 0,10 0,10 11,0 10,0 0)),((-5 -6,7 5,7 7,5 7, -5 -6)))',26918));
insert into tt2 values(7,ST_GeomFromText('GEOMETRYCOLLECTION(POINT(11 10), POINT(30 -30), LINESTRING(-15 15, -20 20))',26918));
select id ,st_astext(g) from tt1 where ST_Intersects(g,ST_GeomFromText('MULTILINESTRING((10 10, 20 20), (15 15, 30 15))',26918));
+------+-----------------------------------------------------------------------+
| id   | st_astext(g)                                                          |
+------+-----------------------------------------------------------------------+
|    2 | LINESTRING(0 0,10 10,20 25,50 60)                                     |
|    5 | MULTILINESTRING((11 10,20 -20),(-15 20,30 15))                        |
|    6 | MULTIPOLYGON(((0 0,10 0,10 11,0 10,0 0)),((-5 -6,7 5,7 7,5 7,-5 -6))) |
+------+-----------------------------------------------------------------------+
select id ,st_astext(g) from tt1 where ST_Intersects(ST_GeomFromText('MULTILINESTRING((10 11, 20 21), (15 15, 30 14))',26918),g);
+------+-----------------------------------------------------------------------+
| id   | st_astext(g)                                                          |
+------+-----------------------------------------------------------------------+
|    2 | LINESTRING(0 0,10 10,20 25,50 60)                                     |
|    5 | MULTILINESTRING((11 10,20 -20),(-15 20,30 15))                        |
|    6 | MULTIPOLYGON(((0 0,10 0,10 11,0 10,0 0)),((-5 -6,7 5,7 7,5 7,-5 -6))) |
+------+-----------------------------------------------------------------------+
select id ,st_astext(g) from tt1 where ST_Intersects(g,g);
+------+--------------------------------------------------------------------------+
| id   | st_astext(g)                                                             |
+------+--------------------------------------------------------------------------+
|    1 | POINT(15 20)                                                             |
|    2 | LINESTRING(0 0,10 10,20 25,50 60)                                        |
|    3 | POLYGON((0 1,10 0,9 10,0 10,0 1),(5 5,7 5,8 7,5 7,5 5))                  |
|    4 | MULTIPOINT((0 1),(-20 25),(60 -60))                                      |
|    5 | MULTILINESTRING((11 10,20 -20),(-15 20,30 15))                           |
|    6 | MULTIPOLYGON(((0 0,10 0,10 11,0 10,0 0)),((-5 -6,7 5,7 7,5 7,-5 -6)))    |
|    7 | GEOMETRYCOLLECTION(POINT(11 10),POINT(30 -30),LINESTRING(-15 15,-20 20)) |
+------+--------------------------------------------------------------------------+
select id ,st_astext(g) from tt1 where ST_Intersects(g,g)>=0;
+------+--------------------------------------------------------------------------+
| id   | st_astext(g)                                                             |
+------+--------------------------------------------------------------------------+
|    1 | POINT(15 20)                                                             |
|    2 | LINESTRING(0 0,10 10,20 25,50 60)                                        |
|    3 | POLYGON((0 1,10 0,9 10,0 10,0 1),(5 5,7 5,8 7,5 7,5 5))                  |
|    4 | MULTIPOINT((0 1),(-20 25),(60 -60))                                      |
|    5 | MULTILINESTRING((11 10,20 -20),(-15 20,30 15))                           |
|    6 | MULTIPOLYGON(((0 0,10 0,10 11,0 10,0 0)),((-5 -6,7 5,7 7,5 7,-5 -6)))    |
|    7 | GEOMETRYCOLLECTION(POINT(11 10),POINT(30 -30),LINESTRING(-15 15,-20 20)) |
+------+--------------------------------------------------------------------------+
bug 43082117
select id ,st_astext(g) from tt1 where _st_covers(g,ST_GeomFromText('MULTILINESTRING((10 10, 20 20), (15 15, 30 15))',26918));
+------+--------------+
| id   | st_astext(g) |
+------+--------------+
+------+--------------+
select id ,st_astext(g) from tt1 where _st_covers(ST_GeomFromText('MULTILINESTRING((10 11, 20 21), (15 15, 30 14))',26918),g);
+------+--------------+
| id   | st_astext(g) |
+------+--------------+
+------+--------------+
select id ,st_astext(g) from tt1 where ST_Intersects(g,ST_GeomFromText('POINT(15 20)',26918));
+------+--------------+
| id   | st_astext(g) |
+------+--------------+
|    1 | POINT(15 20) |
+------+--------------+
select id ,st_astext(g) from tt1 where _st_covers(g,g);
+------+--------------------------------------------------------------------------+
| id   | st_astext(g)                                                             |
+------+--------------------------------------------------------------------------+
|    1 | POINT(15 20)                                                             |
|    2 | LINESTRING(0 0,10 10,20 25,50 60)                                        |
|    3 | POLYGON((0 1,10 0,9 10,0 10,0 1),(5 5,7 5,8 7,5 7,5 5))                  |
|    4 | MULTIPOINT((0 1),(-20 25),(60 -60))                                      |
|    5 | MULTILINESTRING((11 10,20 -20),(-15 20,30 15))                           |
|    7 | GEOMETRYCOLLECTION(POINT(11 10),POINT(30 -30),LINESTRING(-15 15,-20 20)) |
+------+--------------------------------------------------------------------------+
select id ,st_astext(g) from tt1 where g=ST_GeomFromText('GEOMETRYCOLLECTION(POINT(11 10), POINT(30 -30), LINESTRING(-15 15, -20 20))',26918);
+------+--------------------------------------------------------------------------+
| id   | st_astext(g)                                                             |
+------+--------------------------------------------------------------------------+
|    7 | GEOMETRYCOLLECTION(POINT(11 10),POINT(30 -30),LINESTRING(-15 15,-20 20)) |
+------+--------------------------------------------------------------------------+
select id ,st_astext(g) from tt1 where g!=ST_GeomFromText('LINESTRING(0 0, 10 10, 20 25, 50 60)',26918);
+------+--------------------------------------------------------------------------+
| id   | st_astext(g)                                                             |
+------+--------------------------------------------------------------------------+
|    1 | POINT(15 20)                                                             |
|    3 | POLYGON((0 1,10 0,9 10,0 10,0 1),(5 5,7 5,8 7,5 7,5 5))                  |
|    4 | MULTIPOINT((0 1),(-20 25),(60 -60))                                      |
|    5 | MULTILINESTRING((11 10,20 -20),(-15 20,30 15))                           |
|    6 | MULTIPOLYGON(((0 0,10 0,10 11,0 10,0 0)),((-5 -6,7 5,7 7,5 7,-5 -6)))    |
|    7 | GEOMETRYCOLLECTION(POINT(11 10),POINT(30 -30),LINESTRING(-15 15,-20 20)) |
+------+--------------------------------------------------------------------------+
drop table tt1;
create table tt1(id int , g geometry not null srid 1000 , spatial index(g));
ERROR SR001: There's no spatial reference system with SRID 1000.
create table tt1(id int , g geometry not null srid 0 ,p point not null srid 0 , index(g,p));
ERROR 42000: Too many key parts specified; max 64 parts allowed
create table tt1(id int , g geometry not null srid 26918 ,  index(g));
insert into tt1 values(2,ST_GeomFromText('LINESTRING(0 0, 10 10, 20 25, 50 60)',26918));
insert into tt1 values(1,ST_GeomFromText('POINT(15 20)',26918));
insert into tt1 values(4,ST_GeomFromText('MULTIPOINT(0 1, -20 25, 60 -60)',26918));
insert into tt1 values(4,ST_GeomFromText('MULTIPOINT(0 1, -20 25, 60 -60)',26918));
insert into tt1 values(4,ST_GeomFromText('MULTIPOINT(0 1, -20 25, 60 -60)',26918));
select id ,st_astext(g) from tt1 where ST_Intersects(g,g);
+------+-------------------------------------+
| id   | st_astext(g)                        |
+------+-------------------------------------+
|    2 | LINESTRING(0 0,10 10,20 25,50 60)   |
|    1 | POINT(15 20)                        |
|    4 | MULTIPOINT((0 1),(-20 25),(60 -60)) |
|    4 | MULTIPOINT((0 1),(-20 25),(60 -60)) |
|    4 | MULTIPOINT((0 1),(-20 25),(60 -60)) |
+------+-------------------------------------+
select id ,st_astext(g) from tt1 where _st_covers(g,g);
+------+-------------------------------------+
| id   | st_astext(g)                        |
+------+-------------------------------------+
|    2 | LINESTRING(0 0,10 10,20 25,50 60)   |
|    1 | POINT(15 20)                        |
|    4 | MULTIPOINT((0 1),(-20 25),(60 -60)) |
|    4 | MULTIPOINT((0 1),(-20 25),(60 -60)) |
|    4 | MULTIPOINT((0 1),(-20 25),(60 -60)) |
+------+-------------------------------------+
select id ,st_astext(g) from tt1 where g=ST_GeomFromText('GEOMETRYCOLLECTION(POINT(11 10), POINT(30 -30), LINESTRING(-15 15, -20 20))',26918);
+------+--------------+
| id   | st_astext(g) |
+------+--------------+
+------+--------------+
select id ,st_astext(g) from tt1 where g!=ST_GeomFromText('LINESTRING(0 0, 10 10, 20 25, 50 60)',26918);
+------+-------------------------------------+
| id   | st_astext(g)                        |
+------+-------------------------------------+
|    1 | POINT(15 20)                        |
|    4 | MULTIPOINT((0 1),(-20 25),(60 -60)) |
|    4 | MULTIPOINT((0 1),(-20 25),(60 -60)) |
|    4 | MULTIPOINT((0 1),(-20 25),(60 -60)) |
+------+-------------------------------------+
update tt1 set g=ST_GeomFromText('LINESTRING(0 0, 10 10, 20 25, 50 60)',26918) where g =ST_GeomFromText('POINT(15 20)',26918);
delete from tt1 where g=ST_GeomFromText('MULTIPOINT(0 1, -20 25, 60 -60)',26918);
drop table tt1;
create table tt1(id int , g geometry not null srid 4236 ,  index(g) local);
insert into tt1 values(2,ST_GeomFromText('LINESTRING(0 0, 10 10, 20 25, 50 60)',4236));
insert into tt1 values(1,ST_GeomFromText('POINT(15 20)',4236));
insert into tt1 values(4,ST_GeomFromText('MULTIPOINT(0 1, -20 25, 60 -60)',4236));
select id ,st_astext(g) from tt1 where ST_Intersects(g,g);
+------+-------------------------------------+
| id   | st_astext(g)                        |
+------+-------------------------------------+
|    2 | LINESTRING(0 0,10 10,20 25,50 60)   |
|    1 | POINT(15 20)                        |
|    4 | MULTIPOINT((0 1),(-20 25),(60 -60)) |
+------+-------------------------------------+
select id ,st_astext(g) from tt1 where _st_covers(g,g);
+------+-------------------------------------+
| id   | st_astext(g)                        |
+------+-------------------------------------+
|    2 | LINESTRING(0 0,10 10,20 25,50 60)   |
|    1 | POINT(15 20)                        |
|    4 | MULTIPOINT((0 1),(-20 25),(60 -60)) |
+------+-------------------------------------+
select id ,st_astext(g) from tt1 where g=ST_GeomFromText('GEOMETRYCOLLECTION(POINT(11 10), POINT(30 -30), LINESTRING(-15 15, -20 20))',4236);
+------+--------------+
| id   | st_astext(g) |
+------+--------------+
+------+--------------+
select id ,st_astext(g) from tt1 where g!=ST_GeomFromText('LINESTRING(0 0, 10 10, 20 25, 50 60)',4236);
+------+-------------------------------------+
| id   | st_astext(g)                        |
+------+-------------------------------------+
|    1 | POINT(15 20)                        |
|    4 | MULTIPOINT((0 1),(-20 25),(60 -60)) |
+------+-------------------------------------+
update tt1 set g=ST_GeomFromText('LINESTRING(0 0, 10 10, 20 25, 50 60)',4236) where g =ST_GeomFromText('POINT(15 20)',4236);
delete from tt1 where g=ST_GeomFromText('MULTIPOINT(0 1, -20 25, 60 -60)',4236);
SHOW INDEX FROM tt1;
Table	Non_unique	Key_name	Seq_in_index	Column_name	Collation	Cardinality	Sub_part	Packed	Null	Index_type	Comment	Index_comment	Visible	Expression
tt1	1	g	1	g	A	NULL	NULL	NULL		SPATIAL	available		YES	NULL
show create table tt1;
Table	Create Table
tt1	CREATE TABLE `tt1` (
  `id` int(11) DEFAULT NULL,
  `g` geometry NOT NULL /*!80003 SRID 4236 */,
  SPATIAL KEY `g` (`g`) BLOCK_SIZE 16384 LOCAL
) ORGANIZATION INDEX DEFAULT CHARSET = utf8mb4 ROW_FORMAT = DYNAMIC COMPRESSION = 'zstd_1.3.8' REPLICA_NUM = 1 BLOCK_SIZE = 16384 USE_BLOOM_FILTER = FALSE ENABLE_MACRO_BLOCK_BLOOM_FILTER = FALSE TABLET_SIZE = 134217728 PCTFREE = 0
drop table tt1;
create table tt1(id int , g geometry not null srid 4236 , spatial index(g));
select id ,st_astext(g) from tt1 where ST_Intersects(g,g);
+------+--------------+
| id   | st_astext(g) |
+------+--------------+
+------+--------------+
select id ,st_astext(g) from tt1 where _st_covers(g,g);
+------+--------------+
| id   | st_astext(g) |
+------+--------------+
+------+--------------+
select id ,st_astext(g) from tt1 where g=ST_GeomFromText('GEOMETRYCOLLECTION(POINT(11 10), POINT(30 -30), LINESTRING(-15 15, -20 20))',4236);
+------+--------------+
| id   | st_astext(g) |
+------+--------------+
+------+--------------+
select id ,st_astext(g) from tt1 where g!=ST_GeomFromText('LINESTRING(0 0, 10 10, 20 25, 50 60)',4236);
+------+--------------+
| id   | st_astext(g) |
+------+--------------+
+------+--------------+
update tt1 set g=ST_GeomFromText('LINESTRING(0 0, 10 10, 20 25, 50 60)',4236) where g =ST_GeomFromText('POINT(15 20)',4236);
delete from tt1 where g=ST_GeomFromText('MULTIPOINT(0 1, -20 25, 60 -60)',4236);
SHOW INDEX FROM tt1;
Table	Non_unique	Key_name	Seq_in_index	Column_name	Collation	Cardinality	Sub_part	Packed	Null	Index_type	Comment	Index_comment	Visible	Expression
tt1	1	g	1	g	A	NULL	NULL	NULL		SPATIAL	available		YES	NULL
drop table tt1;
create table tt1(id int , g geometry not null srid 26918 , unique index(g));
ERROR HY000: Spatial indexes can't be primary or unique indexes.
drop table tt1;
create table tt1(id int , g geometry not null srid 1000 , spatial index(g));
ERROR SR001: There's no spatial reference system with SRID 1000.
drop table tt1;
CREATE TABLE tt1 (g GEOMETRY);
CREATE INDEX idx ON tt1(g);
ERROR 42000: All parts of a SPATIAL index must be NOT NULL.
drop table tt1;
CREATE TABLE tt1 (id int ,g GEOMETRY not null);
CREATE INDEX idx ON tt1(g);
select id ,st_astext(g) from tt1 where ST_Intersects(g,g);
+------+--------------+
| id   | st_astext(g) |
+------+--------------+
+------+--------------+
select id ,st_astext(g) from tt1 where _st_covers(g,g);
+------+--------------+
| id   | st_astext(g) |
+------+--------------+
+------+--------------+
select id ,st_astext(g) from tt1 where g=ST_GeomFromText('GEOMETRYCOLLECTION(POINT(11 10), POINT(30 -30), LINESTRING(-15 15, -20 20))');
+------+--------------+
| id   | st_astext(g) |
+------+--------------+
+------+--------------+
select id ,st_astext(g) from tt1 where g!=ST_GeomFromText('LINESTRING(0 0, 10 10, 20 25, 50 60)');
+------+--------------+
| id   | st_astext(g) |
+------+--------------+
+------+--------------+
update tt1 set g=ST_GeomFromText('LINESTRING(0 0, 10 10, 20 25, 50 60)',4236) where g =ST_GeomFromText('POINT(15 20)');
delete from tt1 where g=ST_GeomFromText('MULTIPOINT(0 1, -20 25, 60 -60)');
SHOW INDEX FROM tt1;
Table	Non_unique	Key_name	Seq_in_index	Column_name	Collation	Cardinality	Sub_part	Packed	Null	Index_type	Comment	Index_comment	Visible	Expression
tt1	1	idx	1	g	A	NULL	NULL	NULL		SPATIAL	available		YES	NULL
drop table tt1;
CREATE TABLE tt1 (id int ,g GEOMETRY not null srid 4236);
CREATE spatial INDEX idx ON tt1(g) local;
select id ,st_astext(g) from tt1 where ST_Intersects(g,g);
+------+--------------+
| id   | st_astext(g) |
+------+--------------+
+------+--------------+
select id ,st_astext(g) from tt1 where _st_covers(g,g);
+------+--------------+
| id   | st_astext(g) |
+------+--------------+
+------+--------------+
select id ,st_astext(g) from tt1 where g=ST_GeomFromText('GEOMETRYCOLLECTION(POINT(11 10), POINT(30 -30), LINESTRING(-15 15, -20 20))',4236);
+------+--------------+
| id   | st_astext(g) |
+------+--------------+
+------+--------------+
select id ,st_astext(g) from tt1 where g!=ST_GeomFromText('LINESTRING(0 0, 10 10, 20 25, 50 60)',4236);
+------+--------------+
| id   | st_astext(g) |
+------+--------------+
+------+--------------+
update tt1 set g=ST_GeomFromText('LINESTRING(0 0, 10 10, 20 25, 50 60)',4236) where g =ST_GeomFromText('POINT(15 20)',4236);
delete from tt1 where g=ST_GeomFromText('MULTIPOINT(0 1, -20 25, 60 -60)',4236);
SHOW INDEX FROM tt1;
Table	Non_unique	Key_name	Seq_in_index	Column_name	Collation	Cardinality	Sub_part	Packed	Null	Index_type	Comment	Index_comment	Visible	Expression
tt1	1	idx	1	g	A	NULL	NULL	NULL		SPATIAL	available		YES	NULL
DROP INDEX idx ON tt1;
drop table tt1;
CREATE TABLE tt1 (id int ,g GEOMETRY  srid 26918);
ALTER TABLE tt1 ADD  INDEX idx(g) GLOBAL;
ERROR 42000: All parts of a SPATIAL index must be NOT NULL.
drop table tt1;
CREATE TABLE tt1 (id int ,g GEOMETRY not null srid 26918);
ALTER TABLE tt1 ADD  INDEX idx(g) GLOBAL;
SHOW INDEX FROM tt1;
Table	Non_unique	Key_name	Seq_in_index	Column_name	Collation	Cardinality	Sub_part	Packed	Null	Index_type	Comment	Index_comment	Visible	Expression
tt1	1	idx	1	g	A	NULL	NULL	NULL		SPATIAL	available		YES	NULL
show create table tt1;
Table	Create Table
tt1	CREATE TABLE `tt1` (
  `id` int(11) DEFAULT NULL,
  `g` geometry NOT NULL /*!80003 SRID 26918 */,
  SPATIAL KEY `idx` (`g`) BLOCK_SIZE 16384 GLOBAL
) ORGANIZATION INDEX DEFAULT CHARSET = utf8mb4 ROW_FORMAT = DYNAMIC COMPRESSION = 'zstd_1.3.8' REPLICA_NUM = 1 BLOCK_SIZE = 16384 USE_BLOOM_FILTER = FALSE ENABLE_MACRO_BLOCK_BLOOM_FILTER = FALSE TABLET_SIZE = 134217728 PCTFREE = 0
insert into tt1 values(2,ST_GeomFromText('LINESTRING(0 0, 10 10, 20 25, 50 60)',26918));
insert into tt1 values(1,ST_GeomFromText('POINT(15 20)',26918));
insert into tt1 values(4,ST_GeomFromText('MULTIPOINT(0 1, -20 25, 60 -60)',26918));
select id ,st_astext(g) from tt1 where ST_Intersects(g,g);
+------+-------------------------------------+
| id   | st_astext(g)                        |
+------+-------------------------------------+
|    2 | LINESTRING(0 0,10 10,20 25,50 60)   |
|    1 | POINT(15 20)                        |
|    4 | MULTIPOINT((0 1),(-20 25),(60 -60)) |
+------+-------------------------------------+
select id ,st_astext(g) from tt1 where _st_covers(g,g);
+------+-------------------------------------+
| id   | st_astext(g)                        |
+------+-------------------------------------+
|    2 | LINESTRING(0 0,10 10,20 25,50 60)   |
|    1 | POINT(15 20)                        |
|    4 | MULTIPOINT((0 1),(-20 25),(60 -60)) |
+------+-------------------------------------+
select id ,st_astext(g) from tt1 where g=ST_GeomFromText('GEOMETRYCOLLECTION(POINT(11 10), POINT(30 -30), LINESTRING(-15 15, -20 20))',26918);
+------+--------------+
| id   | st_astext(g) |
+------+--------------+
+------+--------------+
select id ,st_astext(g) from tt1 where g!=ST_GeomFromText('LINESTRING(0 0, 10 10, 20 25, 50 60)',26918);
+------+-------------------------------------+
| id   | st_astext(g)                        |
+------+-------------------------------------+
|    1 | POINT(15 20)                        |
|    4 | MULTIPOINT((0 1),(-20 25),(60 -60)) |
+------+-------------------------------------+
update tt1 set g=ST_GeomFromText('LINESTRING(0 0, 10 10, 20 25, 50 60)',26918) where g =ST_GeomFromText('POINT(15 20)',26918);
delete from tt1 where g=ST_GeomFromText('MULTIPOINT(0 1, -20 25, 60 -60)',26918);
DROP INDEX idx ON tt1;
SHOW INDEX FROM tt1;
Table	Non_unique	Key_name	Seq_in_index	Column_name	Collation	Cardinality	Sub_part	Packed	Null	Index_type	Comment	Index_comment	Visible	Expression
show create table tt1;
Table	Create Table
tt1	CREATE TABLE `tt1` (
  `id` int(11) DEFAULT NULL,
  `g` geometry NOT NULL /*!80003 SRID 26918 */
) ORGANIZATION INDEX DEFAULT CHARSET = utf8mb4 ROW_FORMAT = DYNAMIC COMPRESSION = 'zstd_1.3.8' REPLICA_NUM = 1 BLOCK_SIZE = 16384 USE_BLOOM_FILTER = FALSE ENABLE_MACRO_BLOCK_BLOOM_FILTER = FALSE TABLET_SIZE = 134217728 PCTFREE = 0
drop table tt2;
create table tt2(id int, g GEOMETRY not null srid 4236,index(g));
insert into tt2 values(2,ST_GeomFromText('LINESTRING(0 0, 10 10, 20 25, 50 60)',4236));
insert into tt2 values(1,ST_GeomFromText('POINT(15 20)',4236));
insert into tt2 values(4,ST_GeomFromText('MULTIPOINT(0 1, -20 25, 60 -60)',4236));
drop table tt1;
CREATE TABLE tt1 (id int ,g GEOMETRY not null srid 4236);
ALTER TABLE tt1 ADD spatial INDEX idx(g) local;
SHOW INDEX FROM tt1;
Table	Non_unique	Key_name	Seq_in_index	Column_name	Collation	Cardinality	Sub_part	Packed	Null	Index_type	Comment	Index_comment	Visible	Expression
tt1	1	idx	1	g	A	NULL	NULL	NULL		SPATIAL	available		YES	NULL
show create table tt1;
Table	Create Table
tt1	CREATE TABLE `tt1` (
  `id` int(11) DEFAULT NULL,
  `g` geometry NOT NULL /*!80003 SRID 4236 */,
  SPATIAL KEY `idx` (`g`) BLOCK_SIZE 16384 LOCAL
) ORGANIZATION INDEX DEFAULT CHARSET = utf8mb4 ROW_FORMAT = DYNAMIC COMPRESSION = 'zstd_1.3.8' REPLICA_NUM = 1 BLOCK_SIZE = 16384 USE_BLOOM_FILTER = FALSE ENABLE_MACRO_BLOCK_BLOOM_FILTER = FALSE TABLET_SIZE = 134217728 PCTFREE = 0
insert into tt1 values(2,ST_GeomFromText('LINESTRING(0 0, 10 10, 20 25, 50 60)',4236));
insert into tt1 values(1,ST_GeomFromText('POINT(15 20)',4236));
insert into tt1 values(4,ST_GeomFromText('MULTIPOINT(0 1, -20 25, 60 -60)',4236));
select id ,st_astext(g) from tt1 where ST_Intersects(g,g);
+------+-------------------------------------+
| id   | st_astext(g)                        |
+------+-------------------------------------+
|    2 | LINESTRING(0 0,10 10,20 25,50 60)   |
|    1 | POINT(15 20)                        |
|    4 | MULTIPOINT((0 1),(-20 25),(60 -60)) |
+------+-------------------------------------+
select id ,st_astext(g) from tt1 where _st_covers(g,g);
+------+-------------------------------------+
| id   | st_astext(g)                        |
+------+-------------------------------------+
|    2 | LINESTRING(0 0,10 10,20 25,50 60)   |
|    1 | POINT(15 20)                        |
|    4 | MULTIPOINT((0 1),(-20 25),(60 -60)) |
+------+-------------------------------------+
select id ,st_astext(g) from tt1 where g=ST_GeomFromText('GEOMETRYCOLLECTION(POINT(11 10), POINT(30 -30), LINESTRING(-15 15, -20 20))',4236);
+------+--------------+
| id   | st_astext(g) |
+------+--------------+
+------+--------------+
update tt1 set g=ST_GeomFromText('LINESTRING(0 0, 10 10, 20 25, 50 60)',26918) where g =ST_GeomFromText('POINT(15 20)',4236);
ERROR HY000: The SRID of the geometry does not match the SRID of the column. The SRID of the geometry is 26918, but the SRID of the column is 4236. Consider changing the SRID of the geometry or the SRID property of the column.
select id ,st_astext(g) from tt1 where g!=ST_GeomFromText('LINESTRING(0 0, 10 10, 20 25, 50 60)',4236);
+------+-------------------------------------+
| id   | st_astext(g)                        |
+------+-------------------------------------+
|    1 | POINT(15 20)                        |
|    4 | MULTIPOINT((0 1),(-20 25),(60 -60)) |
+------+-------------------------------------+
update tt1 set g=ST_GeomFromText('LINESTRING(0 0, 10 10, 20 25, 50 60)',4236) where g =ST_GeomFromText('POINT(15 20)',4236);
delete from tt1 where g=ST_GeomFromText('MULTIPOINT(0 1, -20 25, 60 -60)',4236);
应该不会走索引
DROP INDEX idx ON tt1;
SHOW INDEX FROM tt1;
Table	Non_unique	Key_name	Seq_in_index	Column_name	Collation	Cardinality	Sub_part	Packed	Null	Index_type	Comment	Index_comment	Visible	Expression
show create table tt1;
Table	Create Table
tt1	CREATE TABLE `tt1` (
  `id` int(11) DEFAULT NULL,
  `g` geometry NOT NULL /*!80003 SRID 4236 */
) ORGANIZATION INDEX DEFAULT CHARSET = utf8mb4 ROW_FORMAT = DYNAMIC COMPRESSION = 'zstd_1.3.8' REPLICA_NUM = 1 BLOCK_SIZE = 16384 USE_BLOOM_FILTER = FALSE ENABLE_MACRO_BLOCK_BLOOM_FILTER = FALSE TABLET_SIZE = 134217728 PCTFREE = 0
drop table tt1;
CREATE TABLE tt1 (id int ,g GEOMETRY not null );
ALTER TABLE tt1 ADD spatial INDEX idx(g);
SHOW INDEX FROM tt1;
Table	Non_unique	Key_name	Seq_in_index	Column_name	Collation	Cardinality	Sub_part	Packed	Null	Index_type	Comment	Index_comment	Visible	Expression
tt1	1	idx	1	g	A	NULL	NULL	NULL		SPATIAL	available		YES	NULL
show create table tt1;
Table	Create Table
tt1	CREATE TABLE `tt1` (
  `id` int(11) DEFAULT NULL,
  `g` geometry NOT NULL,
  SPATIAL KEY `idx` (`g`) BLOCK_SIZE 16384 LOCAL
) ORGANIZATION INDEX DEFAULT CHARSET = utf8mb4 ROW_FORMAT = DYNAMIC COMPRESSION = 'zstd_1.3.8' REPLICA_NUM = 1 BLOCK_SIZE = 16384 USE_BLOOM_FILTER = FALSE ENABLE_MACRO_BLOCK_BLOOM_FILTER = FALSE TABLET_SIZE = 134217728 PCTFREE = 0
insert into tt1 values(2,ST_GeomFromText('LINESTRING(0 0, 10 10, 20 25, 50 60)',4236));
select ST_Intersects(id,g) from tt1;
ERROR 22023: Invalid GIS data provided to function st_intersects.
##explain extended select id ,st_astext(g) from tt1 where ST_Intersects(g,ST_GeomFromText('LINESTRING(0 0, 10 10, 20 25, 50 60)',4236));
##explain extended select id ,st_astext(g) from tt1 where ST_Intersects(ST_GeomFromText('LINESTRING(0 0, 10 10, 20 25, 50 60)',4236),g);
##explain extended select id ,st_astext(g) from tt1 where _st_covers(ST_GeomFromText('LINESTRING(0 0, 10 10, 20 25, 50 60)',4236),g);
##explain extended select id ,st_astext(g) from tt1 where _st_covers(g,ST_GeomFromText('LINESTRING(0 0, 10 10, 20 25, 50 60)',4236));
DROP INDEX idx ON tt1;
drop table tt1;
create table tt1(id int, p point,spatial index(p));
ERROR 42000: All parts of a SPATIAL index must be NOT NULL.
create table tt1(id int, p point);
ALTER TABLE tt1 ADD  INDEX idx(p);
ERROR 42000: All parts of a SPATIAL index must be NOT NULL.
ALTER TABLE tt1 ADD spatial INDEX idx(p);
ERROR 42000: All parts of a SPATIAL index must be NOT NULL.
drop table tt2;
create table tt2(id int, g GEOMETRY);
insert into tt2 values(1,ST_GeomFromText('POINT(15 20)',4236));
insert into tt2 values(2,ST_GeomFromText('LINESTRING(0 0, 10 10, 20 25, 50 60)',0));
insert into tt2 values(3,ST_GeomFromText('POLYGON((0 1,10 0,9 10,0 10,0 1),(5 5,7 5,8 7,5 7, 5 5))',4236));
insert into tt2 values(4,ST_GeomFromText('MULTIPOINT(0 1, -20 25, 60 -60)',26918));
insert into tt2 values(5,ST_GeomFromText('MULTILINESTRING((11 10, 20 -20), (-15 20, 30 15))',26918));
insert into tt2 values(6,ST_GeomFromText('MULTIPOLYGON(((0 0,10 0,10 11,0 10,0 0)),((-5 -6,7 5,7 7,5 7, -5 -6)))',0));
insert into tt2 values(7,ST_GeomFromText('GEOMETRYCOLLECTION(POINT(11 10), POINT(30 -30), LINESTRING(-15 15, -20 20))',4236));
drop table tt1;
create table tt1(id int, g GEOMETRY, p point not null, spatial index(p));
SHOW INDEX FROM tt1;
Table	Non_unique	Key_name	Seq_in_index	Column_name	Collation	Cardinality	Sub_part	Packed	Null	Index_type	Comment	Index_comment	Visible	Expression
tt1	1	p	1	p	A	NULL	NULL	NULL		SPATIAL	available		YES	NULL
insert into tt1 values(1,ST_GeomFromText('POINT(15 20)'),ST_GeomFromText('POINT(15 20)'));
insert into tt1 values(2,ST_GeomFromText('LINESTRING(0 0, 10 10, 20 25, 50 60)'),ST_GeomFromText('POINT(-15 20)'));
insert into tt1 values(3,ST_GeomFromText('POLYGON((0 1,10 0,9 10,0 10,0 1),(5 5,7 5,8 7,5 7, 5 5))'),ST_GeomFromText('POINT(30 20)'));
insert into tt1 values(4,ST_GeomFromText('MULTIPOINT(0 1, -20 25, 60 -60)'),ST_GeomFromText('POINT(15 20)'));
insert into tt1 values(5,ST_GeomFromText('MULTILINESTRING((11 10, 20 -20), (-15 20, 30 15))'),ST_GeomFromText('POINT(15 20)'));
insert into tt1 values(6,ST_GeomFromText('MULTIPOLYGON(((0 0,10 0,10 11,0 10,0 0)),((-5 -6,7 5,7 7,5 7, -5 -6)))'),ST_GeomFromText('POINT(-15 -20)'));
insert into tt1 values(7,ST_GeomFromText('GEOMETRYCOLLECTION(POINT(11 10), POINT(30 -30), LINESTRING(-15 15, -20 20))'),ST_GeomFromText('POINT(15 20)'));
select id ,st_astext(p) from tt1 where ST_Intersects(ST_GeomFromText('POINT(15 20)'),p);
+------+--------------+
| id   | st_astext(p) |
+------+--------------+
|    1 | POINT(15 20) |
|    4 | POINT(15 20) |
|    5 | POINT(15 20) |
|    7 | POINT(15 20) |
+------+--------------+
select id ,st_astext(p) from tt1 where ST_Intersects(p,ST_GeomFromText('POINT(15 20)'));
+------+--------------+
| id   | st_astext(p) |
+------+--------------+
|    1 | POINT(15 20) |
|    4 | POINT(15 20) |
|    5 | POINT(15 20) |
|    7 | POINT(15 20) |
+------+--------------+
select id ,st_astext(p) from tt1 where _st_covers(ST_GeomFromText('POINT(15 20)'),p);
+------+--------------+
| id   | st_astext(p) |
+------+--------------+
|    1 | POINT(15 20) |
|    4 | POINT(15 20) |
|    5 | POINT(15 20) |
|    7 | POINT(15 20) |
+------+--------------+
select id ,st_astext(p) from tt1 where _st_covers(p,ST_GeomFromText('POINT(15 20)'));
+------+--------------+
| id   | st_astext(p) |
+------+--------------+
|    1 | POINT(15 20) |
|    4 | POINT(15 20) |
|    5 | POINT(15 20) |
|    7 | POINT(15 20) |
+------+--------------+
drop table tt1;
create table tt1(id int, g GEOMETRY, p point not null srid 4236, spatial index(p));
SHOW INDEX FROM tt1;
Table	Non_unique	Key_name	Seq_in_index	Column_name	Collation	Cardinality	Sub_part	Packed	Null	Index_type	Comment	Index_comment	Visible	Expression
tt1	1	p	1	p	A	NULL	NULL	NULL		SPATIAL	available		YES	NULL
show create table tt1;
Table	Create Table
tt1	CREATE TABLE `tt1` (
  `id` int(11) DEFAULT NULL,
  `g` geometry DEFAULT NULL,
  `p` point NOT NULL /*!80003 SRID 4236 */,
  SPATIAL KEY `p` (`p`) BLOCK_SIZE 16384 LOCAL
) ORGANIZATION INDEX DEFAULT CHARSET = utf8mb4 ROW_FORMAT = DYNAMIC COMPRESSION = 'zstd_1.3.8' REPLICA_NUM = 1 BLOCK_SIZE = 16384 USE_BLOOM_FILTER = FALSE ENABLE_MACRO_BLOCK_BLOOM_FILTER = FALSE TABLET_SIZE = 134217728 PCTFREE = 0
insert into tt1 values(1,ST_GeomFromText('POINT(15 20)',4236),ST_GeomFromText('POINT(15 20)',4236));
insert into tt1 values(2,ST_GeomFromText('LINESTRING(0 0, 10 10, 20 25, 50 60)',4236),ST_GeomFromText('POINT(-15 20)',4236));
insert into tt1 values(3,ST_GeomFromText('POLYGON((0 1,10 0,9 10,0 10,0 1),(5 5,7 5,8 7,5 7, 5 5))',4236),ST_GeomFromText('POINT(30 20)',4236));
insert into tt1 values(4,ST_GeomFromText('MULTIPOINT(0 1, -20 25, 60 -60)'),ST_GeomFromText('POINT(15 20)',4236));
insert into tt1 values(5,ST_GeomFromText('MULTILINESTRING((11 10, 20 -20), (-15 20, 30 15))',4236),ST_GeomFromText('POINT(15 20)',4236));
insert into tt1 values(6,ST_GeomFromText('MULTIPOLYGON(((0 0,10 0,10 11,0 10,0 0)),((-5 -6,7 5,7 7,5 7, -5 -6)))',4236),ST_GeomFromText('POINT(-15 -20)',4236));
insert into tt1 values(7,ST_GeomFromText('GEOMETRYCOLLECTION(POINT(11 10), POINT(30 -30), LINESTRING(-15 15, -20 20))',4236),ST_GeomFromText('POINT(15 20)',4236));
select id ,st_astext(p) from tt1 where ST_Intersects(ST_GeomFromText('POINT(15 20)',4236),p);
+------+--------------+
| id   | st_astext(p) |
+------+--------------+
|    1 | POINT(15 20) |
|    4 | POINT(15 20) |
|    5 | POINT(15 20) |
|    7 | POINT(15 20) |
+------+--------------+
select id ,st_astext(p) from tt1 where ST_Intersects(p,ST_GeomFromText('POINT(15 20)',4236));
+------+--------------+
| id   | st_astext(p) |
+------+--------------+
|    1 | POINT(15 20) |
|    4 | POINT(15 20) |
|    5 | POINT(15 20) |
|    7 | POINT(15 20) |
+------+--------------+
select id ,st_astext(p) from tt1 where _st_covers(ST_GeomFromText('POINT(15 20)',4236),p);
+------+--------------+
| id   | st_astext(p) |
+------+--------------+
|    1 | POINT(15 20) |
|    4 | POINT(15 20) |
|    5 | POINT(15 20) |
|    7 | POINT(15 20) |
+------+--------------+
select id ,st_astext(p) from tt1 where _st_covers(p,ST_GeomFromText('POINT(15 20)',4236));
+------+--------------+
| id   | st_astext(p) |
+------+--------------+
|    1 | POINT(15 20) |
|    4 | POINT(15 20) |
|    5 | POINT(15 20) |
|    7 | POINT(15 20) |
+------+--------------+
drop table tt1;
create table tt1(id int, g GEOMETRY, p point not null srid 0);
CREATE  INDEX idx ON tt1(p) LOCAL;
SHOW INDEX FROM tt1;
Table	Non_unique	Key_name	Seq_in_index	Column_name	Collation	Cardinality	Sub_part	Packed	Null	Index_type	Comment	Index_comment	Visible	Expression
tt1	1	idx	1	p	A	NULL	NULL	NULL		SPATIAL	available		YES	NULL
show create table tt1;
Table	Create Table
tt1	CREATE TABLE `tt1` (
  `id` int(11) DEFAULT NULL,
  `g` geometry DEFAULT NULL,
  `p` point NOT NULL /*!80003 SRID 0 */,
  SPATIAL KEY `idx` (`p`) BLOCK_SIZE 16384 LOCAL
) ORGANIZATION INDEX DEFAULT CHARSET = utf8mb4 ROW_FORMAT = DYNAMIC COMPRESSION = 'zstd_1.3.8' REPLICA_NUM = 1 BLOCK_SIZE = 16384 USE_BLOOM_FILTER = FALSE ENABLE_MACRO_BLOCK_BLOOM_FILTER = FALSE TABLET_SIZE = 134217728 PCTFREE = 0
insert into tt1 values(1,ST_GeomFromText('POINT(15 20)'),ST_GeomFromText('POINT(15 20)'));
insert into tt1 values(2,ST_GeomFromText('LINESTRING(0 0, 10 10, 20 25, 50 60)'),ST_GeomFromText('POINT(-15 20)',0));
insert into tt1 values(3,ST_GeomFromText('POLYGON((0 1,10 0,9 10,0 10,0 1),(5 5,7 5,8 7,5 7, 5 5))',0),ST_GeomFromText('POINT(30 20)'));
insert into tt1 values(4,ST_GeomFromText('MULTIPOINT(0 1, -20 25, 60 -60)'),ST_GeomFromText('POINT(15 20)',0));
insert into tt1 values(5,ST_GeomFromText('MULTILINESTRING((11 10, 20 -20), (-15 20, 30 15))',4236),ST_GeomFromText('POINT(15 20)',0));
insert into tt1 values(6,ST_GeomFromText('MULTIPOLYGON(((0 0,10 0,10 11,0 10,0 0)),((-5 -6,7 5,7 7,5 7, -5 -6)))',4236),ST_GeomFromText('POINT(-15 -20)'));
insert into tt1 values(7,ST_GeomFromText('GEOMETRYCOLLECTION(POINT(11 10), POINT(30 -30), LINESTRING(-15 15, -20 20))',4236),ST_GeomFromText('POINT(15 20)'));
select id ,st_astext(p) from tt1 where ST_Intersects(ST_GeomFromText('POINT(15 20)'),p);
+------+--------------+
| id   | st_astext(p) |
+------+--------------+
|    1 | POINT(15 20) |
|    4 | POINT(15 20) |
|    5 | POINT(15 20) |
|    7 | POINT(15 20) |
+------+--------------+
select id ,st_astext(p) from tt1 where ST_Intersects(p,ST_GeomFromText('POINT(15 20)',0));
+------+--------------+
| id   | st_astext(p) |
+------+--------------+
|    1 | POINT(15 20) |
|    4 | POINT(15 20) |
|    5 | POINT(15 20) |
|    7 | POINT(15 20) |
+------+--------------+
select id ,st_astext(p) from tt1 where _st_covers(ST_GeomFromText('POINT(15 20)'),p);
+------+--------------+
| id   | st_astext(p) |
+------+--------------+
|    1 | POINT(15 20) |
|    4 | POINT(15 20) |
|    5 | POINT(15 20) |
|    7 | POINT(15 20) |
+------+--------------+
select id ,st_astext(p) from tt1 where _st_covers(p,ST_GeomFromText('POINT(15 20)',0));
+------+--------------+
| id   | st_astext(p) |
+------+--------------+
|    1 | POINT(15 20) |
|    4 | POINT(15 20) |
|    5 | POINT(15 20) |
|    7 | POINT(15 20) |
+------+--------------+
select id ,st_astext(p) from tt1 where _st_covers(p,(select g from tt2 where id=2));
+------+--------------+
| id   | st_astext(p) |
+------+--------------+
+------+--------------+
drop table tt1;
create table tt1(id int, g GEOMETRY, p point not null srid 26918);
ALTER TABLE tt1 ADD SPATIAL INDEX idx(p) GLOBAL;
SHOW INDEX FROM tt1;
Table	Non_unique	Key_name	Seq_in_index	Column_name	Collation	Cardinality	Sub_part	Packed	Null	Index_type	Comment	Index_comment	Visible	Expression
tt1	1	idx	1	p	A	NULL	NULL	NULL		SPATIAL	available		YES	NULL
show create table tt1;
Table	Create Table
tt1	CREATE TABLE `tt1` (
  `id` int(11) DEFAULT NULL,
  `g` geometry DEFAULT NULL,
  `p` point NOT NULL /*!80003 SRID 26918 */,
  SPATIAL KEY `idx` (`p`) BLOCK_SIZE 16384 GLOBAL
) ORGANIZATION INDEX DEFAULT CHARSET = utf8mb4 ROW_FORMAT = DYNAMIC COMPRESSION = 'zstd_1.3.8' REPLICA_NUM = 1 BLOCK_SIZE = 16384 USE_BLOOM_FILTER = FALSE ENABLE_MACRO_BLOCK_BLOOM_FILTER = FALSE TABLET_SIZE = 134217728 PCTFREE = 0
select id ,st_astext(p) from tt1 where ST_Intersects(ST_GeomFromText('POINT(15 20)',26918),p);
+------+--------------+
| id   | st_astext(p) |
+------+--------------+
+------+--------------+
select id ,st_astext(p) from tt1 where ST_Intersects(p,ST_GeomFromText('POINT(15 20)',26918));
+------+--------------+
| id   | st_astext(p) |
+------+--------------+
+------+--------------+
select id ,st_astext(p) from tt1 where _st_covers(ST_GeomFromText('POINT(15 20)',26918),p);
+------+--------------+
| id   | st_astext(p) |
+------+--------------+
+------+--------------+
bug 43082117
select id ,st_astext(p) from tt1 where _st_covers(p,ST_GeomFromText('POINT(15 20)',26918));
+------+--------------+
| id   | st_astext(p) |
+------+--------------+
+------+--------------+
DROP INDEX idx ON tt1;
空间类型LINESTRING
drop table tt1;
create table tt1(id int, p LINESTRING,spatial index(p));
ERROR 42000: All parts of a SPATIAL index must be NOT NULL.
create table tt1(id int, p LINESTRING);
ALTER TABLE tt1 ADD  INDEX idx(p);
ERROR 42000: All parts of a SPATIAL index must be NOT NULL.
ALTER TABLE tt1 ADD spatial INDEX idx(p);
ERROR 42000: All parts of a SPATIAL index must be NOT NULL.
drop table tt2;
create table tt2(id int, g GEOMETRY);
insert into tt2 values(1,ST_GeomFromText('POINT(15 20)',4236));
insert into tt2 values(2,ST_GeomFromText('LINESTRING(0 0, 10 10, 20 25, 50 60)',0));
insert into tt2 values(3,ST_GeomFromText('POLYGON((0 1,10 0,9 10,0 10,0 1),(5 5,7 5,8 7,5 7, 5 5))',4236));
insert into tt2 values(4,ST_GeomFromText('MULTIPOINT(0 1, -20 25, 60 -60)',26918));
insert into tt2 values(5,ST_GeomFromText('MULTILINESTRING((11 10, 20 -20), (-15 20, 30 15))',26918));
insert into tt2 values(6,ST_GeomFromText('MULTIPOLYGON(((0 0,10 0,10 11,0 10,0 0)),((-5 -6,7 5,7 7,5 7, -5 -6)))',0));
insert into tt2 values(7,ST_GeomFromText('GEOMETRYCOLLECTION(POINT(11 10), POINT(30 -30), LINESTRING(-15 15, -20 20))',4236));
drop table tt1;
create table tt1(id int, g GEOMETRY, p LINESTRING not null, spatial index(p));
SHOW INDEX FROM tt1;
Table	Non_unique	Key_name	Seq_in_index	Column_name	Collation	Cardinality	Sub_part	Packed	Null	Index_type	Comment	Index_comment	Visible	Expression
tt1	1	p	1	p	A	NULL	NULL	NULL		SPATIAL	available		YES	NULL
insert into tt1 values(1,ST_GeomFromText('POINT(15 20)'),ST_GeomFromText('LINESTRING(0 0, 10 10, 20 25, 50 60)',0));
insert into tt1 values(2,ST_GeomFromText('LINESTRING(0 0, 10 10, 20 25, 50 60)'),ST_GeomFromText('LINESTRING(0 0, 10 10, 20 25, 50 60)'));
insert into tt1 values(3,ST_GeomFromText('POLYGON((0 1,10 0,9 10,0 10,0 1),(5 5,7 5,8 7,5 7, 5 5))'),ST_GeomFromText('LINESTRING(0 0, 10 10, 20 25, 50 60)',0));
insert into tt1 values(4,ST_GeomFromText('MULTIPOINT(0 1, -20 25, 60 -60)'),ST_GeomFromText('LINESTRING(0 0, 10 10, 20 25, 50 60)',0));
insert into tt1 values(5,ST_GeomFromText('MULTILINESTRING((11 10, 20 -20), (-15 20, 30 15))'),ST_GeomFromText('LINESTRING(0 0, 10 10, 20 25, 50 60)',0));
insert into tt1 values(6,ST_GeomFromText('MULTIPOLYGON(((0 0,10 0,10 11,0 10,0 0)),((-5 -6,7 5,7 7,5 7, -5 -6)))'),ST_GeomFromText('LINESTRING(0 0, 10 10, 20 25, 50 60)',0));
insert into tt1 values(7,ST_GeomFromText('GEOMETRYCOLLECTION(POINT(11 10), POINT(30 -30), LINESTRING(-15 15, -20 20))'),ST_GeomFromText('LINESTRING(0 0, 10 10, 20 25, 50 60)',0));
select id ,st_astext(p) from tt1 where ST_Intersects(ST_GeomFromText('LINESTRING(0 0, 10 10, 20 25, 50 60)',0),p);
+------+-----------------------------------+
| id   | st_astext(p)                      |
+------+-----------------------------------+
|    1 | LINESTRING(0 0,10 10,20 25,50 60) |
|    2 | LINESTRING(0 0,10 10,20 25,50 60) |
|    3 | LINESTRING(0 0,10 10,20 25,50 60) |
|    4 | LINESTRING(0 0,10 10,20 25,50 60) |
|    5 | LINESTRING(0 0,10 10,20 25,50 60) |
|    6 | LINESTRING(0 0,10 10,20 25,50 60) |
|    7 | LINESTRING(0 0,10 10,20 25,50 60) |
+------+-----------------------------------+
select id ,st_astext(p) from tt1 where ST_Intersects(p,ST_GeomFromText('LINESTRING(0 0, 10 10, 20 25, 50 60)',0));
+------+-----------------------------------+
| id   | st_astext(p)                      |
+------+-----------------------------------+
|    1 | LINESTRING(0 0,10 10,20 25,50 60) |
|    2 | LINESTRING(0 0,10 10,20 25,50 60) |
|    3 | LINESTRING(0 0,10 10,20 25,50 60) |
|    4 | LINESTRING(0 0,10 10,20 25,50 60) |
|    5 | LINESTRING(0 0,10 10,20 25,50 60) |
|    6 | LINESTRING(0 0,10 10,20 25,50 60) |
|    7 | LINESTRING(0 0,10 10,20 25,50 60) |
+------+-----------------------------------+
select id ,st_astext(p) from tt1 where _st_covers(ST_GeomFromText('LINESTRING(0 0, 10 10, 20 25, 50 60)',0),p);
+------+-----------------------------------+
| id   | st_astext(p)                      |
+------+-----------------------------------+
|    1 | LINESTRING(0 0,10 10,20 25,50 60) |
|    2 | LINESTRING(0 0,10 10,20 25,50 60) |
|    3 | LINESTRING(0 0,10 10,20 25,50 60) |
|    4 | LINESTRING(0 0,10 10,20 25,50 60) |
|    5 | LINESTRING(0 0,10 10,20 25,50 60) |
|    6 | LINESTRING(0 0,10 10,20 25,50 60) |
|    7 | LINESTRING(0 0,10 10,20 25,50 60) |
+------+-----------------------------------+
select id ,st_astext(p) from tt1 where _st_covers(p,ST_GeomFromText('LINESTRING(0 0, 10 10, 20 25, 50 60)',0));
+------+-----------------------------------+
| id   | st_astext(p)                      |
+------+-----------------------------------+
|    1 | LINESTRING(0 0,10 10,20 25,50 60) |
|    2 | LINESTRING(0 0,10 10,20 25,50 60) |
|    3 | LINESTRING(0 0,10 10,20 25,50 60) |
|    4 | LINESTRING(0 0,10 10,20 25,50 60) |
|    5 | LINESTRING(0 0,10 10,20 25,50 60) |
|    6 | LINESTRING(0 0,10 10,20 25,50 60) |
|    7 | LINESTRING(0 0,10 10,20 25,50 60) |
+------+-----------------------------------+
##explain extended select id ,st_astext(p) from tt1 where ST_Intersects(p,ST_GeomFromText('LINESTRING(0 0, 10 10, 20 25, 50 60)',0));
##explain extended select id ,st_astext(p) from tt1 where _st_covers(ST_GeomFromText('LINESTRING(0 0, 10 10, 20 25, 50 60)',0),p));
##explain extended update tt1 set p=ST_GeomFromText('POINT(15 20)') where ST_Intersects(ST_GeomFromText('LINESTRING(0 0, 10 10, 20 25, 50 60)',0),p);
##explain extended delete from tt1 where p=ST_GeomFromText('POINT(15 20)')  where _st_covers(p,ST_GeomFromText('LINESTRING(0 0, 10 10, 20 25, 50 60)',0));
drop table tt1;
create table tt1(id int, g GEOMETRY, p LINESTRING not null srid 4236,  index(p) GLOBAL);
SHOW INDEX FROM tt1;
Table	Non_unique	Key_name	Seq_in_index	Column_name	Collation	Cardinality	Sub_part	Packed	Null	Index_type	Comment	Index_comment	Visible	Expression
tt1	1	p	1	p	A	NULL	NULL	NULL		SPATIAL	available		YES	NULL
show create table tt1;
Table	Create Table
tt1	CREATE TABLE `tt1` (
  `id` int(11) DEFAULT NULL,
  `g` geometry DEFAULT NULL,
  `p` linestring NOT NULL /*!80003 SRID 4236 */,
  SPATIAL KEY `p` (`p`) BLOCK_SIZE 16384 GLOBAL
) ORGANIZATION INDEX DEFAULT CHARSET = utf8mb4 ROW_FORMAT = DYNAMIC COMPRESSION = 'zstd_1.3.8' REPLICA_NUM = 1 BLOCK_SIZE = 16384 USE_BLOOM_FILTER = FALSE ENABLE_MACRO_BLOCK_BLOOM_FILTER = FALSE TABLET_SIZE = 134217728 PCTFREE = 0
insert into tt1 values(1,ST_GeomFromText('POINT(15 20)',4236),ST_GeomFromText('LINESTRING(0 0, 10 10, 20 25, 50 60)',4236));
insert into tt1 values(2,ST_GeomFromText('LINESTRING(0 0, 10 10, 20 25, 50 60)',4236),ST_GeomFromText('LINESTRING(0 0, 10 10, 20 25, 50 60)',4236));
insert into tt1 values(3,ST_GeomFromText('POLYGON((0 1,10 0,9 10,0 10,0 1),(5 5,7 5,8 7,5 7, 5 5))',4236),ST_GeomFromText('LINESTRING(0 0, 10 10, 20 25, 50 60)',4236));
insert into tt1 values(4,ST_GeomFromText('MULTIPOINT(0 1, -20 25, 60 -60)'),ST_GeomFromText('LINESTRING(0 0, 10 10, 20 25, 50 60)',4236));
insert into tt1 values(5,ST_GeomFromText('MULTILINESTRING((11 10, 20 -20), (-15 20, 30 15))',4236),ST_GeomFromText('LINESTRING(0 0, 10 10, 20 25, 50 60)',4236));
insert into tt1 values(6,ST_GeomFromText('MULTIPOLYGON(((0 0,10 0,10 11,0 10,0 0)),((-5 -6,7 5,7 7,5 7, -5 -6)))',4236),ST_GeomFromText('LINESTRING(0 0, 10 10, 20 25, 50 60)',4236));
insert into tt1 values(7,ST_GeomFromText('GEOMETRYCOLLECTION(POINT(11 10), POINT(30 -30), LINESTRING(-15 15, -20 20))',4236),ST_GeomFromText('LINESTRING(0 0, 10 10, 20 25, 50 60)',4236));
bug41645879
select id ,st_astext(p) from tt1 where ST_Intersects(ST_GeomFromText('LINESTRING(0 0, 10 10, 20 25, 50 60)',4236),p);
+------+-----------------------------------+
| id   | st_astext(p)                      |
+------+-----------------------------------+
|    1 | LINESTRING(0 0,10 10,20 25,50 60) |
|    2 | LINESTRING(0 0,10 10,20 25,50 60) |
|    3 | LINESTRING(0 0,10 10,20 25,50 60) |
|    4 | LINESTRING(0 0,10 10,20 25,50 60) |
|    5 | LINESTRING(0 0,10 10,20 25,50 60) |
|    6 | LINESTRING(0 0,10 10,20 25,50 60) |
|    7 | LINESTRING(0 0,10 10,20 25,50 60) |
+------+-----------------------------------+
bug41645879
select id ,st_astext(p) from tt1 where ST_Intersects(p,ST_GeomFromText('LINESTRING(0 0, 10 10, 20 25, 50 60)',4236));
+------+-----------------------------------+
| id   | st_astext(p)                      |
+------+-----------------------------------+
|    1 | LINESTRING(0 0,10 10,20 25,50 60) |
|    2 | LINESTRING(0 0,10 10,20 25,50 60) |
|    3 | LINESTRING(0 0,10 10,20 25,50 60) |
|    4 | LINESTRING(0 0,10 10,20 25,50 60) |
|    5 | LINESTRING(0 0,10 10,20 25,50 60) |
|    6 | LINESTRING(0 0,10 10,20 25,50 60) |
|    7 | LINESTRING(0 0,10 10,20 25,50 60) |
+------+-----------------------------------+
bug41645879
select id ,st_astext(p) from tt1 where _st_covers(ST_GeomFromText('LINESTRING(0 0, 10 10, 20 25, 50 60)',4236),p);
+------+-----------------------------------+
| id   | st_astext(p)                      |
+------+-----------------------------------+
|    1 | LINESTRING(0 0,10 10,20 25,50 60) |
|    2 | LINESTRING(0 0,10 10,20 25,50 60) |
|    3 | LINESTRING(0 0,10 10,20 25,50 60) |
|    4 | LINESTRING(0 0,10 10,20 25,50 60) |
|    5 | LINESTRING(0 0,10 10,20 25,50 60) |
|    6 | LINESTRING(0 0,10 10,20 25,50 60) |
|    7 | LINESTRING(0 0,10 10,20 25,50 60) |
+------+-----------------------------------+
bug41645879
select id ,st_astext(p) from tt1 where _st_covers(p,ST_GeomFromText('LINESTRING(0 0, 10 10, 20 25, 50 60)',4236));
+------+-----------------------------------+
| id   | st_astext(p)                      |
+------+-----------------------------------+
|    1 | LINESTRING(0 0,10 10,20 25,50 60) |
|    2 | LINESTRING(0 0,10 10,20 25,50 60) |
|    3 | LINESTRING(0 0,10 10,20 25,50 60) |
|    4 | LINESTRING(0 0,10 10,20 25,50 60) |
|    5 | LINESTRING(0 0,10 10,20 25,50 60) |
|    6 | LINESTRING(0 0,10 10,20 25,50 60) |
|    7 | LINESTRING(0 0,10 10,20 25,50 60) |
+------+-----------------------------------+
drop table tt1;
create table tt1(id int, g GEOMETRY, p LINESTRING not null srid 0);
CREATE spatial INDEX idx ON tt1(p) LOCAL;
SHOW INDEX FROM tt1;
Table	Non_unique	Key_name	Seq_in_index	Column_name	Collation	Cardinality	Sub_part	Packed	Null	Index_type	Comment	Index_comment	Visible	Expression
tt1	1	idx	1	p	A	NULL	NULL	NULL		SPATIAL	available		YES	NULL
show create table tt1;
Table	Create Table
tt1	CREATE TABLE `tt1` (
  `id` int(11) DEFAULT NULL,
  `g` geometry DEFAULT NULL,
  `p` linestring NOT NULL /*!80003 SRID 0 */,
  SPATIAL KEY `idx` (`p`) BLOCK_SIZE 16384 LOCAL
) ORGANIZATION INDEX DEFAULT CHARSET = utf8mb4 ROW_FORMAT = DYNAMIC COMPRESSION = 'zstd_1.3.8' REPLICA_NUM = 1 BLOCK_SIZE = 16384 USE_BLOOM_FILTER = FALSE ENABLE_MACRO_BLOCK_BLOOM_FILTER = FALSE TABLET_SIZE = 134217728 PCTFREE = 0
insert into tt1 values(1,ST_GeomFromText('POINT(15 20)',4236),ST_GeomFromText('LINESTRING(0 0, 10 10, 20 25, 50 60)',0));
insert into tt1 values(2,ST_GeomFromText('LINESTRING(0 0, 10 10, 20 25, 50 60)',4236),ST_GeomFromText('LINESTRING(0 0, 10 10, 20 25, 50 60)'));
insert into tt1 values(3,ST_GeomFromText('POLYGON((0 1,10 0,9 10,0 10,0 1),(5 5,7 5,8 7,5 7, 5 5))',4236),ST_GeomFromText('LINESTRING(0 0, 10 10, 20 25, 50 60)'));
insert into tt1 values(4,ST_GeomFromText('MULTIPOINT(0 1, -20 25, 60 -60)'),ST_GeomFromText('LINESTRING(0 0, 10 10, 20 25, 50 60)',0));
insert into tt1 values(5,ST_GeomFromText('MULTILINESTRING((11 10, 20 -20), (-15 20, 30 15))',4236),ST_GeomFromText('LINESTRING(0 0, 10 10, 20 25, 50 60)',0));
insert into tt1 values(6,ST_GeomFromText('MULTIPOLYGON(((0 0,10 0,10 11,0 10,0 0)),((-5 -6,7 5,7 7,5 7, -5 -6)))',4236),ST_GeomFromText('LINESTRING(0 0, 10 10, 20 25, 50 60)'));
insert into tt1 values(7,ST_GeomFromText('GEOMETRYCOLLECTION(POINT(11 10), POINT(30 -30), LINESTRING(-15 15, -20 20))',4236),ST_GeomFromText('LINESTRING(0 0, 10 10, 20 25, 50 60)'));
bug 41645879
select id ,st_astext(p) from tt1 where ST_Intersects(ST_GeomFromText('LINESTRING(0 0, 10 10, 20 25, 50 60)',0),p);
+------+-----------------------------------+
| id   | st_astext(p)                      |
+------+-----------------------------------+
|    1 | LINESTRING(0 0,10 10,20 25,50 60) |
|    2 | LINESTRING(0 0,10 10,20 25,50 60) |
|    3 | LINESTRING(0 0,10 10,20 25,50 60) |
|    4 | LINESTRING(0 0,10 10,20 25,50 60) |
|    5 | LINESTRING(0 0,10 10,20 25,50 60) |
|    6 | LINESTRING(0 0,10 10,20 25,50 60) |
|    7 | LINESTRING(0 0,10 10,20 25,50 60) |
+------+-----------------------------------+
bug 41645879
select id ,st_astext(p) from tt1 where ST_Intersects(p,ST_GeomFromText('LINESTRING(0 0, 10 10, 20 25, 50 60)'));
+------+-----------------------------------+
| id   | st_astext(p)                      |
+------+-----------------------------------+
|    1 | LINESTRING(0 0,10 10,20 25,50 60) |
|    2 | LINESTRING(0 0,10 10,20 25,50 60) |
|    3 | LINESTRING(0 0,10 10,20 25,50 60) |
|    4 | LINESTRING(0 0,10 10,20 25,50 60) |
|    5 | LINESTRING(0 0,10 10,20 25,50 60) |
|    6 | LINESTRING(0 0,10 10,20 25,50 60) |
|    7 | LINESTRING(0 0,10 10,20 25,50 60) |
+------+-----------------------------------+
bug 41645879
select id ,st_astext(p) from tt1 where _st_covers(ST_GeomFromText('LINESTRING(0 0, 10 10, 20 25, 50 60)'),p);
+------+-----------------------------------+
| id   | st_astext(p)                      |
+------+-----------------------------------+
|    1 | LINESTRING(0 0,10 10,20 25,50 60) |
|    2 | LINESTRING(0 0,10 10,20 25,50 60) |
|    3 | LINESTRING(0 0,10 10,20 25,50 60) |
|    4 | LINESTRING(0 0,10 10,20 25,50 60) |
|    5 | LINESTRING(0 0,10 10,20 25,50 60) |
|    6 | LINESTRING(0 0,10 10,20 25,50 60) |
|    7 | LINESTRING(0 0,10 10,20 25,50 60) |
+------+-----------------------------------+
bug 41645879
select id ,st_astext(p) from tt1 where _st_covers(p,ST_GeomFromText('LINESTRING(0 0, 10 10, 20 25, 50 60)',0));
+------+-----------------------------------+
| id   | st_astext(p)                      |
+------+-----------------------------------+
|    1 | LINESTRING(0 0,10 10,20 25,50 60) |
|    2 | LINESTRING(0 0,10 10,20 25,50 60) |
|    3 | LINESTRING(0 0,10 10,20 25,50 60) |
|    4 | LINESTRING(0 0,10 10,20 25,50 60) |
|    5 | LINESTRING(0 0,10 10,20 25,50 60) |
|    6 | LINESTRING(0 0,10 10,20 25,50 60) |
|    7 | LINESTRING(0 0,10 10,20 25,50 60) |
+------+-----------------------------------+
drop table tt1;
create table tt1(id int, g GEOMETRY, p LINESTRING not null srid 26918);
ALTER TABLE tt1 ADD SPATIAL INDEX idx(p) ;
SHOW INDEX FROM tt1;
Table	Non_unique	Key_name	Seq_in_index	Column_name	Collation	Cardinality	Sub_part	Packed	Null	Index_type	Comment	Index_comment	Visible	Expression
tt1	1	idx	1	p	A	NULL	NULL	NULL		SPATIAL	available		YES	NULL
show create table tt1;
Table	Create Table
tt1	CREATE TABLE `tt1` (
  `id` int(11) DEFAULT NULL,
  `g` geometry DEFAULT NULL,
  `p` linestring NOT NULL /*!80003 SRID 26918 */,
  SPATIAL KEY `idx` (`p`) BLOCK_SIZE 16384 LOCAL
) ORGANIZATION INDEX DEFAULT CHARSET = utf8mb4 ROW_FORMAT = DYNAMIC COMPRESSION = 'zstd_1.3.8' REPLICA_NUM = 1 BLOCK_SIZE = 16384 USE_BLOOM_FILTER = FALSE ENABLE_MACRO_BLOCK_BLOOM_FILTER = FALSE TABLET_SIZE = 134217728 PCTFREE = 0
select id ,st_astext(p) from tt1 where ST_Intersects(ST_GeomFromText('LINESTRING(0 0, 10 10, 20 25, 50 60)',26918),p);
+------+--------------+
| id   | st_astext(p) |
+------+--------------+
+------+--------------+
select id ,st_astext(p) from tt1 where ST_Intersects(p,ST_GeomFromText('LINESTRING(0 0, 10 10, 20 25, 50 60)',26918));
+------+--------------+
| id   | st_astext(p) |
+------+--------------+
+------+--------------+
select id ,st_astext(p) from tt1 where _st_covers(ST_GeomFromText('LINESTRING(0 0, 10 10, 20 25, 50 60)',26918),p);
+------+--------------+
| id   | st_astext(p) |
+------+--------------+
+------+--------------+
bug 43082117
select id ,st_astext(p) from tt1 where _st_covers(p,ST_GeomFromText('LINESTRING(0 0, 10 10, 20 25, 50 60)',26918));
+------+--------------+
| id   | st_astext(p) |
+------+--------------+
+------+--------------+
DROP INDEX idx ON tt1;
空间类型POLYGON
drop table tt1;
create table tt1(id int, p POLYGON,spatial index(p));
ERROR 42000: All parts of a SPATIAL index must be NOT NULL.
create table tt1(id int, p POLYGON);
ALTER TABLE tt1 ADD  INDEX idx(p);
ERROR 42000: All parts of a SPATIAL index must be NOT NULL.
ALTER TABLE tt1 ADD spatial INDEX idx(p);
ERROR 42000: All parts of a SPATIAL index must be NOT NULL.
drop table tt2;
create table tt2(id int, g GEOMETRY);
insert into tt2 values(1,ST_GeomFromText('POINT(15 20)',4236));
insert into tt2 values(2,ST_GeomFromText('LINESTRING(0 0, 10 10, 20 25, 50 60)',0));
insert into tt2 values(3,ST_GeomFromText('POLYGON((0 1,10 0,9 10,0 10,0 1),(5 5,7 5,8 7,5 7, 5 5))',4236));
insert into tt2 values(4,ST_GeomFromText('MULTIPOINT(0 1, -20 25, 60 -60)',26918));
insert into tt2 values(5,ST_GeomFromText('MULTILINESTRING((11 10, 20 -20), (-15 20, 30 15))',26918));
insert into tt2 values(6,ST_GeomFromText('MULTIPOLYGON(((0 0,10 0,10 11,0 10,0 0)),((-5 -6,7 5,7 7,5 7, -5 -6)))',0));
insert into tt2 values(7,ST_GeomFromText('GEOMETRYCOLLECTION(POINT(11 10), POINT(30 -30), LINESTRING(-15 15, -20 20))',4236));
drop table tt1;
create table tt1(id int, g GEOMETRY, p POLYGON not null, spatial index(p));
SHOW INDEX FROM tt1;
Table	Non_unique	Key_name	Seq_in_index	Column_name	Collation	Cardinality	Sub_part	Packed	Null	Index_type	Comment	Index_comment	Visible	Expression
tt1	1	p	1	p	A	NULL	NULL	NULL		SPATIAL	available		YES	NULL
insert into tt1 values(1,ST_GeomFromText('POINT(15 20)'),ST_GeomFromText('POLYGON((0 1,10 0,9 10,0 10,0 1),(5 5,7 5,8 7,5 7, 5 5))',0));
insert into tt1 values(2,ST_GeomFromText('LINESTRING(0 0, 10 10, 20 25, 50 60)'),ST_GeomFromText('POLYGON((0 1,10 0,9 10,0 10,0 1),(5 5,7 5,8 7,5 7, 5 5))'));
insert into tt1 values(3,ST_GeomFromText('POLYGON((0 1,10 0,9 10,0 10,0 1),(5 5,7 5,8 7,5 7, 5 5))'),ST_GeomFromText('POLYGON((0 1,10 0,9 10,0 10,0 1),(5 5,7 5,8 7,5 7, 5 5))',0));
insert into tt1 values(4,ST_GeomFromText('MULTIPOINT(0 1, -20 25, 60 -60)'),ST_GeomFromText('POLYGON((0 1,10 0,9 10,0 10,0 1),(5 5,7 5,8 7,5 7, 5 5))',0));
insert into tt1 values(5,ST_GeomFromText('MULTILINESTRING((11 10, 20 -20), (-15 20, 30 15))'),ST_GeomFromText('POLYGON((0 1,10 0,9 10,0 10,0 1),(5 5,7 5,8 7,5 7, 5 5))',0));
insert into tt1 values(6,ST_GeomFromText('MULTIPOLYGON(((0 0,10 0,10 11,0 10,0 0)),((-5 -6,7 5,7 7,5 7, -5 -6)))'),ST_GeomFromText('POLYGON((0 1,10 0,9 10,0 10,0 1),(5 5,7 5,8 7,5 7, 5 5))',0));
insert into tt1 values(7,ST_GeomFromText('GEOMETRYCOLLECTION(POINT(11 10), POINT(30 -30), LINESTRING(-15 15, -20 20))'),ST_GeomFromText('POLYGON((0 1,10 0,9 10,0 10,0 1),(5 5,7 5,8 7,5 7, 5 5))',0));
select id ,st_astext(p) from tt1 where ST_Intersects(ST_GeomFromText('POLYGON((0 1,10 0,9 10,0 10,0 1),(5 5,7 5,8 7,5 7, 5 5))',0),p);
+------+---------------------------------------------------------+
| id   | st_astext(p)                                            |
+------+---------------------------------------------------------+
|    1 | POLYGON((0 1,10 0,9 10,0 10,0 1),(5 5,7 5,8 7,5 7,5 5)) |
|    2 | POLYGON((0 1,10 0,9 10,0 10,0 1),(5 5,7 5,8 7,5 7,5 5)) |
|    3 | POLYGON((0 1,10 0,9 10,0 10,0 1),(5 5,7 5,8 7,5 7,5 5)) |
|    4 | POLYGON((0 1,10 0,9 10,0 10,0 1),(5 5,7 5,8 7,5 7,5 5)) |
|    5 | POLYGON((0 1,10 0,9 10,0 10,0 1),(5 5,7 5,8 7,5 7,5 5)) |
|    6 | POLYGON((0 1,10 0,9 10,0 10,0 1),(5 5,7 5,8 7,5 7,5 5)) |
|    7 | POLYGON((0 1,10 0,9 10,0 10,0 1),(5 5,7 5,8 7,5 7,5 5)) |
+------+---------------------------------------------------------+
select id ,st_astext(p) from tt1 where ST_Intersects(p,ST_GeomFromText('POLYGON((0 1,10 0,9 10,0 10,0 1),(5 5,7 5,8 7,5 7, 5 5))',0));
+------+---------------------------------------------------------+
| id   | st_astext(p)                                            |
+------+---------------------------------------------------------+
|    1 | POLYGON((0 1,10 0,9 10,0 10,0 1),(5 5,7 5,8 7,5 7,5 5)) |
|    2 | POLYGON((0 1,10 0,9 10,0 10,0 1),(5 5,7 5,8 7,5 7,5 5)) |
|    3 | POLYGON((0 1,10 0,9 10,0 10,0 1),(5 5,7 5,8 7,5 7,5 5)) |
|    4 | POLYGON((0 1,10 0,9 10,0 10,0 1),(5 5,7 5,8 7,5 7,5 5)) |
|    5 | POLYGON((0 1,10 0,9 10,0 10,0 1),(5 5,7 5,8 7,5 7,5 5)) |
|    6 | POLYGON((0 1,10 0,9 10,0 10,0 1),(5 5,7 5,8 7,5 7,5 5)) |
|    7 | POLYGON((0 1,10 0,9 10,0 10,0 1),(5 5,7 5,8 7,5 7,5 5)) |
+------+---------------------------------------------------------+
select id ,st_astext(p) from tt1 where _st_covers(ST_GeomFromText('POLYGON((0 1,10 0,9 10,0 10,0 1),(5 5,7 5,8 7,5 7, 5 5))',0),p);
+------+---------------------------------------------------------+
| id   | st_astext(p)                                            |
+------+---------------------------------------------------------+
|    1 | POLYGON((0 1,10 0,9 10,0 10,0 1),(5 5,7 5,8 7,5 7,5 5)) |
|    2 | POLYGON((0 1,10 0,9 10,0 10,0 1),(5 5,7 5,8 7,5 7,5 5)) |
|    3 | POLYGON((0 1,10 0,9 10,0 10,0 1),(5 5,7 5,8 7,5 7,5 5)) |
|    4 | POLYGON((0 1,10 0,9 10,0 10,0 1),(5 5,7 5,8 7,5 7,5 5)) |
|    5 | POLYGON((0 1,10 0,9 10,0 10,0 1),(5 5,7 5,8 7,5 7,5 5)) |
|    6 | POLYGON((0 1,10 0,9 10,0 10,0 1),(5 5,7 5,8 7,5 7,5 5)) |
|    7 | POLYGON((0 1,10 0,9 10,0 10,0 1),(5 5,7 5,8 7,5 7,5 5)) |
+------+---------------------------------------------------------+
select id ,st_astext(p) from tt1 where _st_covers(p,ST_GeomFromText('POLYGON((0 1,10 0,9 10,0 10,0 1),(5 5,7 5,8 7,5 7, 5 5))',0));
+------+---------------------------------------------------------+
| id   | st_astext(p)                                            |
+------+---------------------------------------------------------+
|    1 | POLYGON((0 1,10 0,9 10,0 10,0 1),(5 5,7 5,8 7,5 7,5 5)) |
|    2 | POLYGON((0 1,10 0,9 10,0 10,0 1),(5 5,7 5,8 7,5 7,5 5)) |
|    3 | POLYGON((0 1,10 0,9 10,0 10,0 1),(5 5,7 5,8 7,5 7,5 5)) |
|    4 | POLYGON((0 1,10 0,9 10,0 10,0 1),(5 5,7 5,8 7,5 7,5 5)) |
|    5 | POLYGON((0 1,10 0,9 10,0 10,0 1),(5 5,7 5,8 7,5 7,5 5)) |
|    6 | POLYGON((0 1,10 0,9 10,0 10,0 1),(5 5,7 5,8 7,5 7,5 5)) |
|    7 | POLYGON((0 1,10 0,9 10,0 10,0 1),(5 5,7 5,8 7,5 7,5 5)) |
+------+---------------------------------------------------------+
##explain extended select id ,st_astext(p) from tt1 where ST_Intersects(p,ST_GeomFromText('POLYGON((0 1,10 0,9 10,0 10,0 1),(5 5,7 5,8 7,5 7, 5 5))',0));
##explain extended select id ,st_astext(p) from tt1 where _st_covers(ST_GeomFromText('POLYGON((0 1,10 0,9 10,0 10,0 1),(5 5,7 5,8 7,5 7, 5 5))',0),p);
##explain extended update tt1 set p=POLYGON((0 1,10 0,9 10,0 10,0 1),(5 5,7 5,8 7,5 7, 5 5))') where ST_Intersects(ST_GeomFromText('POLYGON((0 1,10 0,9 10,0 10,0 1),(5 5,7 5,8 7,5 7, 5 5))',0),p);
##explain extended delete from tt1 where p=ST_GeomFromText('POLYGON((0 1,10 0,9 10,0 10,0 1),(5 5,7 5,8 7,5 7, 5 5))')  where _st_covers(p,ST_GeomFromText('POLYGON((0 1,10 0,9 10,0 10,0 1),(5 5,7 5,8 7,5 7, 5 5))',0));
drop table tt1;
create table tt1(id int, g GEOMETRY, p POLYGON not null srid 4236,  index(p) GLOBAL);
SHOW INDEX FROM tt1;
Table	Non_unique	Key_name	Seq_in_index	Column_name	Collation	Cardinality	Sub_part	Packed	Null	Index_type	Comment	Index_comment	Visible	Expression
tt1	1	p	1	p	A	NULL	NULL	NULL		SPATIAL	available		YES	NULL
show create table tt1;
Table	Create Table
tt1	CREATE TABLE `tt1` (
  `id` int(11) DEFAULT NULL,
  `g` geometry DEFAULT NULL,
  `p` polygon NOT NULL /*!80003 SRID 4236 */,
  SPATIAL KEY `p` (`p`) BLOCK_SIZE 16384 GLOBAL
) ORGANIZATION INDEX DEFAULT CHARSET = utf8mb4 ROW_FORMAT = DYNAMIC COMPRESSION = 'zstd_1.3.8' REPLICA_NUM = 1 BLOCK_SIZE = 16384 USE_BLOOM_FILTER = FALSE ENABLE_MACRO_BLOCK_BLOOM_FILTER = FALSE TABLET_SIZE = 134217728 PCTFREE = 0
insert into tt1 values(1,ST_GeomFromText('POINT(15 20)',4236),ST_GeomFromText('POLYGON((0 1,10 0,9 10,0 10,0 1),(5 5,7 5,8 7,5 7, 5 5))',4236));
insert into tt1 values(2,ST_GeomFromText('LINESTRING(0 0, 10 10, 20 25, 50 60)',4236),ST_GeomFromText('POLYGON((0 1,10 0,9 10,0 10,0 1),(5 5,7 5,8 7,5 7, 5 5))',4236));
insert into tt1 values(3,ST_GeomFromText('POLYGON((0 1,10 0,9 10,0 10,0 1),(5 5,7 5,8 7,5 7, 5 5))',4236),ST_GeomFromText('POLYGON((0 1,10 0,9 10,0 10,0 1),(5 5,7 5,8 7,5 7, 5 5))',4236));
insert into tt1 values(4,ST_GeomFromText('MULTIPOINT(0 1, -20 25, 60 -60)'),ST_GeomFromText('POLYGON((0 1,10 0,9 10,0 10,0 1),(5 5,7 5,8 7,5 7, 5 5))',4236));
insert into tt1 values(5,ST_GeomFromText('MULTILINESTRING((11 10, 20 -20), (-15 20, 30 15))',4236),ST_GeomFromText('POLYGON((0 1,10 0,9 10,0 10,0 1),(5 5,7 5,8 7,5 7, 5 5))',4236));
insert into tt1 values(6,ST_GeomFromText('MULTIPOLYGON(((0 0,10 0,10 11,0 10,0 0)),((-5 -6,7 5,7 7,5 7, -5 -6)))',4236),ST_GeomFromText('POLYGON((0 1,10 0,9 10,0 10,0 1),(5 5,7 5,8 7,5 7, 5 5))',4236));
insert into tt1 values(7,ST_GeomFromText('GEOMETRYCOLLECTION(POINT(11 10), POINT(30 -30), LINESTRING(-15 15, -20 20))',4236),ST_GeomFromText('POLYGON((0 1,10 0,9 10,0 10,0 1),(5 5,7 5,8 7,5 7, 5 5))',4236));
bug41645879
select id ,st_astext(p) from tt1 where ST_Intersects(ST_GeomFromText('POLYGON((0 1,10 0,9 10,0 10,0 1),(5 5,7 5,8 7,5 7, 5 5))',4236),p);
+------+---------------------------------------------------------+
| id   | st_astext(p)                                            |
+------+---------------------------------------------------------+
|    1 | POLYGON((0 1,10 0,9 10,0 10,0 1),(5 5,7 5,8 7,5 7,5 5)) |
|    2 | POLYGON((0 1,10 0,9 10,0 10,0 1),(5 5,7 5,8 7,5 7,5 5)) |
|    3 | POLYGON((0 1,10 0,9 10,0 10,0 1),(5 5,7 5,8 7,5 7,5 5)) |
|    4 | POLYGON((0 1,10 0,9 10,0 10,0 1),(5 5,7 5,8 7,5 7,5 5)) |
|    5 | POLYGON((0 1,10 0,9 10,0 10,0 1),(5 5,7 5,8 7,5 7,5 5)) |
|    6 | POLYGON((0 1,10 0,9 10,0 10,0 1),(5 5,7 5,8 7,5 7,5 5)) |
|    7 | POLYGON((0 1,10 0,9 10,0 10,0 1),(5 5,7 5,8 7,5 7,5 5)) |
+------+---------------------------------------------------------+
bug41645879
select id ,st_astext(p) from tt1 where ST_Intersects(p,ST_GeomFromText('POLYGON((0 1,10 0,9 10,0 10,0 1),(5 5,7 5,8 7,5 7, 5 5))',4236));
+------+---------------------------------------------------------+
| id   | st_astext(p)                                            |
+------+---------------------------------------------------------+
|    1 | POLYGON((0 1,10 0,9 10,0 10,0 1),(5 5,7 5,8 7,5 7,5 5)) |
|    2 | POLYGON((0 1,10 0,9 10,0 10,0 1),(5 5,7 5,8 7,5 7,5 5)) |
|    3 | POLYGON((0 1,10 0,9 10,0 10,0 1),(5 5,7 5,8 7,5 7,5 5)) |
|    4 | POLYGON((0 1,10 0,9 10,0 10,0 1),(5 5,7 5,8 7,5 7,5 5)) |
|    5 | POLYGON((0 1,10 0,9 10,0 10,0 1),(5 5,7 5,8 7,5 7,5 5)) |
|    6 | POLYGON((0 1,10 0,9 10,0 10,0 1),(5 5,7 5,8 7,5 7,5 5)) |
|    7 | POLYGON((0 1,10 0,9 10,0 10,0 1),(5 5,7 5,8 7,5 7,5 5)) |
+------+---------------------------------------------------------+
bug41645879
select id ,st_astext(p) from tt1 where _st_covers(ST_GeomFromText('POLYGON((0 1,10 0,9 10,0 10,0 1),(5 5,7 5,8 7,5 7, 5 5))',4236),p);
+------+---------------------------------------------------------+
| id   | st_astext(p)                                            |
+------+---------------------------------------------------------+
|    1 | POLYGON((0 1,10 0,9 10,0 10,0 1),(5 5,7 5,8 7,5 7,5 5)) |
|    2 | POLYGON((0 1,10 0,9 10,0 10,0 1),(5 5,7 5,8 7,5 7,5 5)) |
|    3 | POLYGON((0 1,10 0,9 10,0 10,0 1),(5 5,7 5,8 7,5 7,5 5)) |
|    4 | POLYGON((0 1,10 0,9 10,0 10,0 1),(5 5,7 5,8 7,5 7,5 5)) |
|    5 | POLYGON((0 1,10 0,9 10,0 10,0 1),(5 5,7 5,8 7,5 7,5 5)) |
|    6 | POLYGON((0 1,10 0,9 10,0 10,0 1),(5 5,7 5,8 7,5 7,5 5)) |
|    7 | POLYGON((0 1,10 0,9 10,0 10,0 1),(5 5,7 5,8 7,5 7,5 5)) |
+------+---------------------------------------------------------+
bug41645879
select id ,st_astext(p) from tt1 where _st_covers(p,ST_GeomFromText('POLYGON((0 1,10 0,9 10,0 10,0 1),(5 5,7 5,8 7,5 7, 5 5))',4236));
+------+---------------------------------------------------------+
| id   | st_astext(p)                                            |
+------+---------------------------------------------------------+
|    1 | POLYGON((0 1,10 0,9 10,0 10,0 1),(5 5,7 5,8 7,5 7,5 5)) |
|    2 | POLYGON((0 1,10 0,9 10,0 10,0 1),(5 5,7 5,8 7,5 7,5 5)) |
|    3 | POLYGON((0 1,10 0,9 10,0 10,0 1),(5 5,7 5,8 7,5 7,5 5)) |
|    4 | POLYGON((0 1,10 0,9 10,0 10,0 1),(5 5,7 5,8 7,5 7,5 5)) |
|    5 | POLYGON((0 1,10 0,9 10,0 10,0 1),(5 5,7 5,8 7,5 7,5 5)) |
|    6 | POLYGON((0 1,10 0,9 10,0 10,0 1),(5 5,7 5,8 7,5 7,5 5)) |
|    7 | POLYGON((0 1,10 0,9 10,0 10,0 1),(5 5,7 5,8 7,5 7,5 5)) |
+------+---------------------------------------------------------+
drop table tt1;
create table tt1(id int, g GEOMETRY, p POLYGON not null srid 0);
CREATE spatial INDEX idx ON tt1(p) LOCAL;
SHOW INDEX FROM tt1;
Table	Non_unique	Key_name	Seq_in_index	Column_name	Collation	Cardinality	Sub_part	Packed	Null	Index_type	Comment	Index_comment	Visible	Expression
tt1	1	idx	1	p	A	NULL	NULL	NULL		SPATIAL	available		YES	NULL
show create table tt1;
Table	Create Table
tt1	CREATE TABLE `tt1` (
  `id` int(11) DEFAULT NULL,
  `g` geometry DEFAULT NULL,
  `p` polygon NOT NULL /*!80003 SRID 0 */,
  SPATIAL KEY `idx` (`p`) BLOCK_SIZE 16384 LOCAL
) ORGANIZATION INDEX DEFAULT CHARSET = utf8mb4 ROW_FORMAT = DYNAMIC COMPRESSION = 'zstd_1.3.8' REPLICA_NUM = 1 BLOCK_SIZE = 16384 USE_BLOOM_FILTER = FALSE ENABLE_MACRO_BLOCK_BLOOM_FILTER = FALSE TABLET_SIZE = 134217728 PCTFREE = 0
insert into tt1 values(1,ST_GeomFromText('POINT(15 20)',4236),ST_GeomFromText('POLYGON((0 1,10 0,9 10,0 10,0 1),(5 5,7 5,8 7,5 7, 5 5))',0));
insert into tt1 values(2,ST_GeomFromText('LINESTRING(0 0, 10 10, 20 25, 50 60)',4236),ST_GeomFromText('POLYGON((0 1,10 0,9 10,0 10,0 1),(5 5,7 5,8 7,5 7, 5 5))'));
insert into tt1 values(3,ST_GeomFromText('POLYGON((0 1,10 0,9 10,0 10,0 1),(5 5,7 5,8 7,5 7, 5 5))',4236),ST_GeomFromText('POLYGON((0 1,10 0,9 10,0 10,0 1),(5 5,7 5,8 7,5 7, 5 5))'));
insert into tt1 values(4,ST_GeomFromText('MULTIPOINT(0 1, -20 25, 60 -60)'),ST_GeomFromText('POLYGON((0 1,10 0,9 10,0 10,0 1),(5 5,7 5,8 7,5 7, 5 5))',0));
insert into tt1 values(5,ST_GeomFromText('MULTILINESTRING((11 10, 20 -20), (-15 20, 30 15))',4236),ST_GeomFromText('POLYGON((0 1,10 0,9 10,0 10,0 1),(5 5,7 5,8 7,5 7, 5 5))',0));
insert into tt1 values(6,ST_GeomFromText('MULTIPOLYGON(((0 0,10 0,10 11,0 10,0 0)),((-5 -6,7 5,7 7,5 7, -5 -6)))',4236),ST_GeomFromText('POLYGON((0 1,10 0,9 10,0 10,0 1),(5 5,7 5,8 7,5 7, 5 5))'));
insert into tt1 values(7,ST_GeomFromText('GEOMETRYCOLLECTION(POINT(11 10), POINT(30 -30), LINESTRING(-15 15, -20 20))',4236),ST_GeomFromText('POLYGON((0 1,10 0,9 10,0 10,0 1),(5 5,7 5,8 7,5 7, 5 5))'));
drop table tt1;
create table tt1(id int, g GEOMETRY, p POLYGON not null srid 26918);
ALTER TABLE tt1 ADD SPATIAL INDEX idx(p) ;
SHOW INDEX FROM tt1;
Table	Non_unique	Key_name	Seq_in_index	Column_name	Collation	Cardinality	Sub_part	Packed	Null	Index_type	Comment	Index_comment	Visible	Expression
tt1	1	idx	1	p	A	NULL	NULL	NULL		SPATIAL	available		YES	NULL
show create table tt1;
Table	Create Table
tt1	CREATE TABLE `tt1` (
  `id` int(11) DEFAULT NULL,
  `g` geometry DEFAULT NULL,
  `p` polygon NOT NULL /*!80003 SRID 26918 */,
  SPATIAL KEY `idx` (`p`) BLOCK_SIZE 16384 LOCAL
) ORGANIZATION INDEX DEFAULT CHARSET = utf8mb4 ROW_FORMAT = DYNAMIC COMPRESSION = 'zstd_1.3.8' REPLICA_NUM = 1 BLOCK_SIZE = 16384 USE_BLOOM_FILTER = FALSE ENABLE_MACRO_BLOCK_BLOOM_FILTER = FALSE TABLET_SIZE = 134217728 PCTFREE = 0
select id ,st_astext(p) from tt1 where ST_Intersects(ST_GeomFromText('POLYGON((0 1,10 0,9 10,0 10,0 1),(5 5,7 5,8 7,5 7, 5 5))',26918),p);
+------+--------------+
| id   | st_astext(p) |
+------+--------------+
+------+--------------+
select id ,st_astext(p) from tt1 where ST_Intersects(p,ST_GeomFromText('POLYGON((0 1,10 0,9 10,0 10,0 1),(5 5,7 5,8 7,5 7, 5 5))',26918));
+------+--------------+
| id   | st_astext(p) |
+------+--------------+
+------+--------------+
select id ,st_astext(p) from tt1 where _st_covers(ST_GeomFromText('POLYGON((0 1,10 0,9 10,0 10,0 1),(5 5,7 5,8 7,5 7, 5 5))',26918),p);
+------+--------------+
| id   | st_astext(p) |
+------+--------------+
+------+--------------+
bug 43082117
select id ,st_astext(p) from tt1 where _st_covers(p,ST_GeomFromText('POLYGON((0 1,10 0,9 10,0 10,0 1),(5 5,7 5,8 7,5 7, 5 5))',26918));
+------+--------------+
| id   | st_astext(p) |
+------+--------------+
+------+--------------+
bug 43082117
select id ,st_astext(p) from tt1 where st_contains(p,ST_GeomFromText('POLYGON((0 1,10 0,9 10,0 10,0 1),(5 5,7 5,8 7,5 7, 5 5))',26918));
+------+--------------+
| id   | st_astext(p) |
+------+--------------+
+------+--------------+
select id ,st_astext(p) from tt1 where st_contains(ST_GeomFromText('POLYGON((0 1,10 0,9 10,0 10,0 1),(5 5,7 5,8 7,5 7, 5 5))',26918),p);
+------+--------------+
| id   | st_astext(p) |
+------+--------------+
+------+--------------+
select id ,st_astext(p) from tt1 where _st_dwithin(p,ST_GeomFromText('POLYGON((0 1,10 0,9 10,0 10,0 1),(5 5,7 5,8 7,5 7, 5 5))',26918),10);
+------+--------------+
| id   | st_astext(p) |
+------+--------------+
+------+--------------+
select id ,st_astext(p) from tt1 where _st_dwithin(ST_GeomFromText('POLYGON((0 1,10 0,9 10,0 10,0 1),(5 5,7 5,8 7,5 7, 5 5))',26918),p,10);
+------+--------------+
| id   | st_astext(p) |
+------+--------------+
+------+--------------+
DROP INDEX idx ON tt1;
空间类型MULTIPOINT
drop table tt1;
create table tt1(id int, g GEOMETRY, p MULTIPOINT not null, spatial index(p));
SHOW INDEX FROM tt1;
Table	Non_unique	Key_name	Seq_in_index	Column_name	Collation	Cardinality	Sub_part	Packed	Null	Index_type	Comment	Index_comment	Visible	Expression
tt1	1	p	1	p	A	NULL	NULL	NULL		SPATIAL	available		YES	NULL
insert into tt1 values(1,ST_GeomFromText('POINT(15 20)'),ST_GeomFromText('MULTIPOINT(0 1, -20 25, 60 -60)',0));
insert into tt1 values(2,ST_GeomFromText('LINESTRING(0 0, 10 10, 20 25, 50 60)'),ST_GeomFromText('MULTIPOINT(0 1, -20 25, 60 -60)'));
insert into tt1 values(3,ST_GeomFromText('POLYGON((0 1,10 0,9 10,0 10,0 1),(5 5,7 5,8 7,5 7, 5 5))'),ST_GeomFromText('MULTIPOINT(0 1, -20 25, 60 -60)',0));
insert into tt1 values(4,ST_GeomFromText('MULTIPOINT(0 1, -20 25, 60 -60)'),ST_GeomFromText('MULTIPOINT(0 1, -20 25, 60 -60)',0));
insert into tt1 values(5,ST_GeomFromText('MULTILINESTRING((11 10, 20 -20), (-15 20, 30 15))'),ST_GeomFromText('MULTIPOINT(0 1, -20 25, 60 -60)',0));
insert into tt1 values(6,ST_GeomFromText('MULTIPOLYGON(((0 0,10 0,10 11,0 10,0 0)),((-5 -6,7 5,7 7,5 7, -5 -6)))'),ST_GeomFromText('MULTIPOINT(0 1, -20 25, 60 -60)',0));
insert into tt1 values(7,ST_GeomFromText('GEOMETRYCOLLECTION(POINT(11 10), POINT(30 -30), LINESTRING(-15 15, -20 20))'),ST_GeomFromText('MULTIPOINT(0 1, -20 25, 60 -60)',0));
select id ,st_astext(p) from tt1 where ST_Intersects(ST_GeomFromText('MULTIPOINT(0 1, -20 25, 60 -60)',0),p);
+------+-------------------------------------+
| id   | st_astext(p)                        |
+------+-------------------------------------+
|    1 | MULTIPOINT((0 1),(-20 25),(60 -60)) |
|    2 | MULTIPOINT((0 1),(-20 25),(60 -60)) |
|    3 | MULTIPOINT((0 1),(-20 25),(60 -60)) |
|    4 | MULTIPOINT((0 1),(-20 25),(60 -60)) |
|    5 | MULTIPOINT((0 1),(-20 25),(60 -60)) |
|    6 | MULTIPOINT((0 1),(-20 25),(60 -60)) |
|    7 | MULTIPOINT((0 1),(-20 25),(60 -60)) |
+------+-------------------------------------+
select id ,st_astext(p) from tt1 where ST_Intersects(p,ST_GeomFromText('MULTIPOINT(0 1, -20 25, 60 -60)',0));
+------+-------------------------------------+
| id   | st_astext(p)                        |
+------+-------------------------------------+
|    1 | MULTIPOINT((0 1),(-20 25),(60 -60)) |
|    2 | MULTIPOINT((0 1),(-20 25),(60 -60)) |
|    3 | MULTIPOINT((0 1),(-20 25),(60 -60)) |
|    4 | MULTIPOINT((0 1),(-20 25),(60 -60)) |
|    5 | MULTIPOINT((0 1),(-20 25),(60 -60)) |
|    6 | MULTIPOINT((0 1),(-20 25),(60 -60)) |
|    7 | MULTIPOINT((0 1),(-20 25),(60 -60)) |
+------+-------------------------------------+
select id ,st_astext(p) from tt1 where _st_covers(ST_GeomFromText('MULTIPOINT(0 1, -20 25, 60 -60)',0),p);
+------+-------------------------------------+
| id   | st_astext(p)                        |
+------+-------------------------------------+
|    1 | MULTIPOINT((0 1),(-20 25),(60 -60)) |
|    2 | MULTIPOINT((0 1),(-20 25),(60 -60)) |
|    3 | MULTIPOINT((0 1),(-20 25),(60 -60)) |
|    4 | MULTIPOINT((0 1),(-20 25),(60 -60)) |
|    5 | MULTIPOINT((0 1),(-20 25),(60 -60)) |
|    6 | MULTIPOINT((0 1),(-20 25),(60 -60)) |
|    7 | MULTIPOINT((0 1),(-20 25),(60 -60)) |
+------+-------------------------------------+
select id ,st_astext(p) from tt1 where _st_covers(p,ST_GeomFromText('MULTIPOINT(0 1, -20 25, 60 -60)',0));
+------+-------------------------------------+
| id   | st_astext(p)                        |
+------+-------------------------------------+
|    1 | MULTIPOINT((0 1),(-20 25),(60 -60)) |
|    2 | MULTIPOINT((0 1),(-20 25),(60 -60)) |
|    3 | MULTIPOINT((0 1),(-20 25),(60 -60)) |
|    4 | MULTIPOINT((0 1),(-20 25),(60 -60)) |
|    5 | MULTIPOINT((0 1),(-20 25),(60 -60)) |
|    6 | MULTIPOINT((0 1),(-20 25),(60 -60)) |
|    7 | MULTIPOINT((0 1),(-20 25),(60 -60)) |
+------+-------------------------------------+
##explain extended select id ,st_astext(p) from tt1 where ST_Intersects(p,ST_GeomFromText('MULTIPOINT(0 1, -20 25, 60 -60)',0));
drop table tt1;
create table tt1(id int, g GEOMETRY, p MULTIPOINT not null srid 4236,  index(p) GLOBAL);
SHOW INDEX FROM tt1;
Table	Non_unique	Key_name	Seq_in_index	Column_name	Collation	Cardinality	Sub_part	Packed	Null	Index_type	Comment	Index_comment	Visible	Expression
tt1	1	p	1	p	A	NULL	NULL	NULL		SPATIAL	available		YES	NULL
show create table tt1;
Table	Create Table
tt1	CREATE TABLE `tt1` (
  `id` int(11) DEFAULT NULL,
  `g` geometry DEFAULT NULL,
  `p` multipoint NOT NULL /*!80003 SRID 4236 */,
  SPATIAL KEY `p` (`p`) BLOCK_SIZE 16384 GLOBAL
) ORGANIZATION INDEX DEFAULT CHARSET = utf8mb4 ROW_FORMAT = DYNAMIC COMPRESSION = 'zstd_1.3.8' REPLICA_NUM = 1 BLOCK_SIZE = 16384 USE_BLOOM_FILTER = FALSE ENABLE_MACRO_BLOCK_BLOOM_FILTER = FALSE TABLET_SIZE = 134217728 PCTFREE = 0
insert into tt1 values(1,ST_GeomFromText('POINT(15 20)',4236),ST_GeomFromText('MULTIPOINT(0 1, -20 25, 60 -60)',4236));
insert into tt1 values(2,ST_GeomFromText('LINESTRING(0 0, 10 10, 20 25, 50 60)',4236),ST_GeomFromText('MULTIPOINT(0 1, -20 25, 60 -60)',4236));
insert into tt1 values(3,ST_GeomFromText('POLYGON((0 1,10 0,9 10,0 10,0 1),(5 5,7 5,8 7,5 7, 5 5))',4236),ST_GeomFromText('MULTIPOINT(0 1, -20 25, 60 -60)',4236));
insert into tt1 values(4,ST_GeomFromText('MULTIPOINT(0 1, -20 25, 60 -60)'),ST_GeomFromText('MULTIPOINT(0 1, -20 25, 60 -60)',4236));
insert into tt1 values(5,ST_GeomFromText('MULTILINESTRING((11 10, 20 -20), (-15 20, 30 15))',4236),ST_GeomFromText('MULTIPOINT(0 1, -20 25, 60 -60)',4236));
insert into tt1 values(6,ST_GeomFromText('MULTIPOLYGON(((0 0,10 0,10 11,0 10,0 0)),((-5 -6,7 5,7 7,5 7, -5 -6)))',4236),ST_GeomFromText('MULTIPOINT(0 1, -20 25, 60 -60)',4236));
insert into tt1 values(7,ST_GeomFromText('GEOMETRYCOLLECTION(POINT(11 10), POINT(30 -30), LINESTRING(-15 15, -20 20))',4236),ST_GeomFromText('MULTIPOINT(0 1, -20 25, 60 -60)',4236));
bug 41645879
select id ,st_astext(p) from tt1 where ST_Intersects(ST_GeomFromText('MULTIPOINT(0 1, -20 25, 60 -60)',4236),p);
+------+-------------------------------------+
| id   | st_astext(p)                        |
+------+-------------------------------------+
|    1 | MULTIPOINT((0 1),(-20 25),(60 -60)) |
|    2 | MULTIPOINT((0 1),(-20 25),(60 -60)) |
|    3 | MULTIPOINT((0 1),(-20 25),(60 -60)) |
|    4 | MULTIPOINT((0 1),(-20 25),(60 -60)) |
|    5 | MULTIPOINT((0 1),(-20 25),(60 -60)) |
|    6 | MULTIPOINT((0 1),(-20 25),(60 -60)) |
|    7 | MULTIPOINT((0 1),(-20 25),(60 -60)) |
+------+-------------------------------------+
drop table tt1;
create table tt1(id int, g GEOMETRY, p MULTIPOINT not null srid 0);
CREATE spatial INDEX idx ON tt1(p) LOCAL;
SHOW INDEX FROM tt1;
Table	Non_unique	Key_name	Seq_in_index	Column_name	Collation	Cardinality	Sub_part	Packed	Null	Index_type	Comment	Index_comment	Visible	Expression
tt1	1	idx	1	p	A	NULL	NULL	NULL		SPATIAL	available		YES	NULL
show create table tt1;
Table	Create Table
tt1	CREATE TABLE `tt1` (
  `id` int(11) DEFAULT NULL,
  `g` geometry DEFAULT NULL,
  `p` multipoint NOT NULL /*!80003 SRID 0 */,
  SPATIAL KEY `idx` (`p`) BLOCK_SIZE 16384 LOCAL
) ORGANIZATION INDEX DEFAULT CHARSET = utf8mb4 ROW_FORMAT = DYNAMIC COMPRESSION = 'zstd_1.3.8' REPLICA_NUM = 1 BLOCK_SIZE = 16384 USE_BLOOM_FILTER = FALSE ENABLE_MACRO_BLOCK_BLOOM_FILTER = FALSE TABLET_SIZE = 134217728 PCTFREE = 0
insert into tt1 values(1,ST_GeomFromText('POINT(15 20)',4236),ST_GeomFromText('MULTIPOINT(0 1, -20 25, 60 -60)',0));
insert into tt1 values(2,ST_GeomFromText('LINESTRING(0 0, 10 10, 20 25, 50 60)',4236),ST_GeomFromText('MULTIPOINT(0 1, -20 25, 60 -60)'));
insert into tt1 values(3,ST_GeomFromText('POLYGON((0 1,10 0,9 10,0 10,0 1),(5 5,7 5,8 7,5 7, 5 5))',4236),ST_GeomFromText('MULTIPOINT(0 1, -20 25, 60 -60)'));
insert into tt1 values(4,ST_GeomFromText('MULTIPOINT(0 1, -20 25, 60 -60)'),ST_GeomFromText('MULTIPOINT(0 1, -20 25, 60 -60)',0));
insert into tt1 values(5,ST_GeomFromText('MULTILINESTRING((11 10, 20 -20), (-15 20, 30 15))',4236),ST_GeomFromText('MULTIPOINT(0 1, -20 25, 60 -60)',0));
insert into tt1 values(6,ST_GeomFromText('MULTIPOLYGON(((0 0,10 0,10 11,0 10,0 0)),((-5 -6,7 5,7 7,5 7, -5 -6)))',4236),ST_GeomFromText('MULTIPOINT(0 1, -20 25, 60 -60)'));
insert into tt1 values(7,ST_GeomFromText('GEOMETRYCOLLECTION(POINT(11 10), POINT(30 -30), LINESTRING(-15 15, -20 20))',4236),ST_GeomFromText('MULTIPOINT(0 1, -20 25, 60 -60)'));
drop table tt1;
create table tt1(id int, g GEOMETRY, p MULTIPOINT not null srid 26918);
ALTER TABLE tt1 ADD SPATIAL INDEX idx(p) ;
SHOW INDEX FROM tt1;
Table	Non_unique	Key_name	Seq_in_index	Column_name	Collation	Cardinality	Sub_part	Packed	Null	Index_type	Comment	Index_comment	Visible	Expression
tt1	1	idx	1	p	A	NULL	NULL	NULL		SPATIAL	available		YES	NULL
show create table tt1;
Table	Create Table
tt1	CREATE TABLE `tt1` (
  `id` int(11) DEFAULT NULL,
  `g` geometry DEFAULT NULL,
  `p` multipoint NOT NULL /*!80003 SRID 26918 */,
  SPATIAL KEY `idx` (`p`) BLOCK_SIZE 16384 LOCAL
) ORGANIZATION INDEX DEFAULT CHARSET = utf8mb4 ROW_FORMAT = DYNAMIC COMPRESSION = 'zstd_1.3.8' REPLICA_NUM = 1 BLOCK_SIZE = 16384 USE_BLOOM_FILTER = FALSE ENABLE_MACRO_BLOCK_BLOOM_FILTER = FALSE TABLET_SIZE = 134217728 PCTFREE = 0
select id ,st_astext(p) from tt1 where ST_Intersects(ST_GeomFromText('MULTIPOINT(0 1, -20 25, 60 -60)',26918),p);
+------+--------------+
| id   | st_astext(p) |
+------+--------------+
+------+--------------+
select id ,st_astext(p) from tt1 where ST_Intersects(p,ST_GeomFromText('MULTIPOINT(0 1, -20 25, 60 -60)',26918));
+------+--------------+
| id   | st_astext(p) |
+------+--------------+
+------+--------------+
select id ,st_astext(p) from tt1 where _st_covers(ST_GeomFromText('MULTIPOINT(0 1, -20 25, 60 -60)',26918),p);
+------+--------------+
| id   | st_astext(p) |
+------+--------------+
+------+--------------+
bug 43082117
select id ,st_astext(p) from tt1 where _st_covers(p,ST_GeomFromText('MULTIPOINT(0 1, -20 25, 60 -60)',26918));
+------+--------------+
| id   | st_astext(p) |
+------+--------------+
+------+--------------+
DROP INDEX idx ON tt1;
空间类型MULTILINESTRING
drop table tt1;
create table tt1(id int, g GEOMETRY, p MULTILINESTRING not null, spatial index(p));
SHOW INDEX FROM tt1;
Table	Non_unique	Key_name	Seq_in_index	Column_name	Collation	Cardinality	Sub_part	Packed	Null	Index_type	Comment	Index_comment	Visible	Expression
tt1	1	p	1	p	A	NULL	NULL	NULL		SPATIAL	available		YES	NULL
insert into tt1 values(1,ST_GeomFromText('POINT(15 20)'),ST_GeomFromText('MULTILINESTRING((11 10, 20 -20), (-15 20, 30 15))',0));
insert into tt1 values(2,ST_GeomFromText('LINESTRING(0 0, 10 10, 20 25, 50 60)'),ST_GeomFromText('MULTILINESTRING((11 10, 20 -20), (-15 20, 30 15))'));
insert into tt1 values(3,ST_GeomFromText('POLYGON((0 1,10 0,9 10,0 10,0 1),(5 5,7 5,8 7,5 7, 5 5))'),ST_GeomFromText('MULTILINESTRING((11 10, 20 -20), (-15 20, 30 15))',0));
insert into tt1 values(4,ST_GeomFromText('MULTIPOINT(0 1, -20 25, 60 -60)'),ST_GeomFromText('MULTILINESTRING((11 10, 20 -20), (-15 20, 30 15))',0));
insert into tt1 values(5,ST_GeomFromText('MULTILINESTRING((11 10, 20 -20), (-15 20, 30 15))'),ST_GeomFromText('MULTILINESTRING((11 10, 20 -20), (-15 20, 30 15))',0));
insert into tt1 values(6,ST_GeomFromText('MULTIPOLYGON(((0 0,10 0,10 11,0 10,0 0)),((-5 -6,7 5,7 7,5 7, -5 -6)))'),ST_GeomFromText('MULTILINESTRING((11 10, 20 -20), (-15 20, 30 15))',0));
insert into tt1 values(7,ST_GeomFromText('GEOMETRYCOLLECTION(POINT(11 10), POINT(30 -30), LINESTRING(-15 15, -20 20))'),ST_GeomFromText('MULTILINESTRING((11 10, 20 -20), (-15 20, 30 15))',0));
select id ,st_astext(p) from tt1 where ST_Intersects(ST_GeomFromText('MULTILINESTRING((11 10, 20 -20), (-15 20, 30 15))',0),p);
+------+------------------------------------------------+
| id   | st_astext(p)                                   |
+------+------------------------------------------------+
|    1 | MULTILINESTRING((11 10,20 -20),(-15 20,30 15)) |
|    2 | MULTILINESTRING((11 10,20 -20),(-15 20,30 15)) |
|    3 | MULTILINESTRING((11 10,20 -20),(-15 20,30 15)) |
|    4 | MULTILINESTRING((11 10,20 -20),(-15 20,30 15)) |
|    5 | MULTILINESTRING((11 10,20 -20),(-15 20,30 15)) |
|    6 | MULTILINESTRING((11 10,20 -20),(-15 20,30 15)) |
|    7 | MULTILINESTRING((11 10,20 -20),(-15 20,30 15)) |
+------+------------------------------------------------+
select id ,st_astext(p) from tt1 where ST_Intersects(p,ST_GeomFromText('MULTILINESTRING((11 10, 20 -20), (-15 20, 30 15))',0));
+------+------------------------------------------------+
| id   | st_astext(p)                                   |
+------+------------------------------------------------+
|    1 | MULTILINESTRING((11 10,20 -20),(-15 20,30 15)) |
|    2 | MULTILINESTRING((11 10,20 -20),(-15 20,30 15)) |
|    3 | MULTILINESTRING((11 10,20 -20),(-15 20,30 15)) |
|    4 | MULTILINESTRING((11 10,20 -20),(-15 20,30 15)) |
|    5 | MULTILINESTRING((11 10,20 -20),(-15 20,30 15)) |
|    6 | MULTILINESTRING((11 10,20 -20),(-15 20,30 15)) |
|    7 | MULTILINESTRING((11 10,20 -20),(-15 20,30 15)) |
+------+------------------------------------------------+
select id ,st_astext(p) from tt1 where _st_covers(ST_GeomFromText('MULTILINESTRING((11 10, 20 -20), (-15 20, 30 15))',0),p);
+------+------------------------------------------------+
| id   | st_astext(p)                                   |
+------+------------------------------------------------+
|    1 | MULTILINESTRING((11 10,20 -20),(-15 20,30 15)) |
|    2 | MULTILINESTRING((11 10,20 -20),(-15 20,30 15)) |
|    3 | MULTILINESTRING((11 10,20 -20),(-15 20,30 15)) |
|    4 | MULTILINESTRING((11 10,20 -20),(-15 20,30 15)) |
|    5 | MULTILINESTRING((11 10,20 -20),(-15 20,30 15)) |
|    6 | MULTILINESTRING((11 10,20 -20),(-15 20,30 15)) |
|    7 | MULTILINESTRING((11 10,20 -20),(-15 20,30 15)) |
+------+------------------------------------------------+
select id ,st_astext(p) from tt1 where _st_covers(p,ST_GeomFromText('MULTILINESTRING((11 10, 20 -20), (-15 20, 30 15))',0));
+------+------------------------------------------------+
| id   | st_astext(p)                                   |
+------+------------------------------------------------+
|    1 | MULTILINESTRING((11 10,20 -20),(-15 20,30 15)) |
|    2 | MULTILINESTRING((11 10,20 -20),(-15 20,30 15)) |
|    3 | MULTILINESTRING((11 10,20 -20),(-15 20,30 15)) |
|    4 | MULTILINESTRING((11 10,20 -20),(-15 20,30 15)) |
|    5 | MULTILINESTRING((11 10,20 -20),(-15 20,30 15)) |
|    6 | MULTILINESTRING((11 10,20 -20),(-15 20,30 15)) |
|    7 | MULTILINESTRING((11 10,20 -20),(-15 20,30 15)) |
+------+------------------------------------------------+
##explain extended select id ,st_astext(p) from tt1 where ST_Intersects(p,ST_GeomFromText('MULTILINESTRING((11 10, 20 -20), (-15 20, 30 15))',0));
drop table tt1;
create table tt1(id int, g GEOMETRY, p MULTILINESTRING not null srid 4236,  index(p) GLOBAL);
SHOW INDEX FROM tt1;
Table	Non_unique	Key_name	Seq_in_index	Column_name	Collation	Cardinality	Sub_part	Packed	Null	Index_type	Comment	Index_comment	Visible	Expression
tt1	1	p	1	p	A	NULL	NULL	NULL		SPATIAL	available		YES	NULL
show create table tt1;
Table	Create Table
tt1	CREATE TABLE `tt1` (
  `id` int(11) DEFAULT NULL,
  `g` geometry DEFAULT NULL,
  `p` multilinestring NOT NULL /*!80003 SRID 4236 */,
  SPATIAL KEY `p` (`p`) BLOCK_SIZE 16384 GLOBAL
) ORGANIZATION INDEX DEFAULT CHARSET = utf8mb4 ROW_FORMAT = DYNAMIC COMPRESSION = 'zstd_1.3.8' REPLICA_NUM = 1 BLOCK_SIZE = 16384 USE_BLOOM_FILTER = FALSE ENABLE_MACRO_BLOCK_BLOOM_FILTER = FALSE TABLET_SIZE = 134217728 PCTFREE = 0
insert into tt1 values(1,ST_GeomFromText('POINT(15 20)',4236),ST_GeomFromText('MULTILINESTRING((11 10, 20 -20), (-15 20, 30 15))',4236));
insert into tt1 values(2,ST_GeomFromText('LINESTRING(0 0, 10 10, 20 25, 50 60)',4236),ST_GeomFromText('MULTILINESTRING((11 10, 20 -20), (-15 20, 30 15))',4236));
insert into tt1 values(3,ST_GeomFromText('POLYGON((0 1,10 0,9 10,0 10,0 1),(5 5,7 5,8 7,5 7, 5 5))',4236),ST_GeomFromText('MULTILINESTRING((11 10, 20 -20), (-15 20, 30 15))',4236));
insert into tt1 values(4,ST_GeomFromText('MULTIPOINT(0 1, -20 25, 60 -60)'),ST_GeomFromText('MULTILINESTRING((11 10, 20 -20), (-15 20, 30 15))',4236));
insert into tt1 values(5,ST_GeomFromText('MULTILINESTRING((11 10, 20 -20), (-15 20, 30 15))',4236),ST_GeomFromText('MULTILINESTRING((11 10, 20 -20), (-15 20, 30 15))',4236));
insert into tt1 values(6,ST_GeomFromText('MULTIPOLYGON(((0 0,10 0,10 11,0 10,0 0)),((-5 -6,7 5,7 7,5 7, -5 -6)))',4236),ST_GeomFromText('MULTILINESTRING((11 10, 20 -20), (-15 20, 30 15))',4236));
insert into tt1 values(7,ST_GeomFromText('GEOMETRYCOLLECTION(POINT(11 10), POINT(30 -30), LINESTRING(-15 15, -20 20))',4236),ST_GeomFromText('MULTILINESTRING((11 10, 20 -20), (-15 20, 30 15))',4236));
bug41645879
select id ,st_astext(p) from tt1 where ST_Intersects(ST_GeomFromText('MULTILINESTRING((11 10, 20 -20), (-15 20, 30 15))',4236),p);
+------+------------------------------------------------+
| id   | st_astext(p)                                   |
+------+------------------------------------------------+
|    1 | MULTILINESTRING((11 10,20 -20),(-15 20,30 15)) |
|    2 | MULTILINESTRING((11 10,20 -20),(-15 20,30 15)) |
|    3 | MULTILINESTRING((11 10,20 -20),(-15 20,30 15)) |
|    4 | MULTILINESTRING((11 10,20 -20),(-15 20,30 15)) |
|    5 | MULTILINESTRING((11 10,20 -20),(-15 20,30 15)) |
|    6 | MULTILINESTRING((11 10,20 -20),(-15 20,30 15)) |
|    7 | MULTILINESTRING((11 10,20 -20),(-15 20,30 15)) |
+------+------------------------------------------------+
drop table tt1;
create table tt1(id int, g GEOMETRY, p MULTILINESTRING not null srid 0);
CREATE spatial INDEX idx ON tt1(p) LOCAL;
SHOW INDEX FROM tt1;
Table	Non_unique	Key_name	Seq_in_index	Column_name	Collation	Cardinality	Sub_part	Packed	Null	Index_type	Comment	Index_comment	Visible	Expression
tt1	1	idx	1	p	A	NULL	NULL	NULL		SPATIAL	available		YES	NULL
show create table tt1;
Table	Create Table
tt1	CREATE TABLE `tt1` (
  `id` int(11) DEFAULT NULL,
  `g` geometry DEFAULT NULL,
  `p` multilinestring NOT NULL /*!80003 SRID 0 */,
  SPATIAL KEY `idx` (`p`) BLOCK_SIZE 16384 LOCAL
) ORGANIZATION INDEX DEFAULT CHARSET = utf8mb4 ROW_FORMAT = DYNAMIC COMPRESSION = 'zstd_1.3.8' REPLICA_NUM = 1 BLOCK_SIZE = 16384 USE_BLOOM_FILTER = FALSE ENABLE_MACRO_BLOCK_BLOOM_FILTER = FALSE TABLET_SIZE = 134217728 PCTFREE = 0
insert into tt1 values(1,ST_GeomFromText('POINT(15 20)',4236),ST_GeomFromText('MULTILINESTRING((11 10, 20 -20), (-15 20, 30 15))'));
drop table tt1;
create table tt1(id int, g GEOMETRY, p MULTILINESTRING not null srid 26918);
ALTER TABLE tt1 ADD SPATIAL INDEX idx(p) ;
SHOW INDEX FROM tt1;
Table	Non_unique	Key_name	Seq_in_index	Column_name	Collation	Cardinality	Sub_part	Packed	Null	Index_type	Comment	Index_comment	Visible	Expression
tt1	1	idx	1	p	A	NULL	NULL	NULL		SPATIAL	available		YES	NULL
show create table tt1;
Table	Create Table
tt1	CREATE TABLE `tt1` (
  `id` int(11) DEFAULT NULL,
  `g` geometry DEFAULT NULL,
  `p` multilinestring NOT NULL /*!80003 SRID 26918 */,
  SPATIAL KEY `idx` (`p`) BLOCK_SIZE 16384 LOCAL
) ORGANIZATION INDEX DEFAULT CHARSET = utf8mb4 ROW_FORMAT = DYNAMIC COMPRESSION = 'zstd_1.3.8' REPLICA_NUM = 1 BLOCK_SIZE = 16384 USE_BLOOM_FILTER = FALSE ENABLE_MACRO_BLOCK_BLOOM_FILTER = FALSE TABLET_SIZE = 134217728 PCTFREE = 0
insert into tt1 values(1,ST_GeomFromText('POINT(15 20)',4236),ST_GeomFromText('MULTILINESTRING((11 10, 20 -20), (-15 20, 30 15))',26918));
insert into tt1 values(2,ST_GeomFromText('LINESTRING(0 0, 10 10, 20 25, 50 60)',4236),ST_GeomFromText('MULTILINESTRING((11 10, 20 -20),(-15 20, 30 15))',26918));
insert into tt1 values(3,ST_GeomFromText('POLYGON((0 1,10 0,9 10,0 10,0 1),(5 5,7 5,8 7,5 7, 5 5))',4236),ST_GeomFromText('MULTILINESTRING((11 10, 20 -20), (-15 20, 30 15))',26918));
insert into tt1 values(4,ST_GeomFromText('MULTIPOINT(0 1, -20 25, 60 -60)'),ST_GeomFromText('MULTILINESTRING((11 10, 20 -20), (-15 20, 30 15))',26918));
insert into tt1 values(5,ST_GeomFromText('MULTILINESTRING((11 10, 20 -20), (-15 20, 30 15))',4236),ST_GeomFromText('MULTILINESTRING((11 10, 20 -20), (-15 20, 30 15))',26918));
insert into tt1 values(6,ST_GeomFromText('MULTIPOLYGON(((0 0,10 0,10 11,0 10,0 0)),((-5 -6,7 5,7 7,5 7, -5 -6)))',4236),ST_GeomFromText('MULTILINESTRING((11 10, 20 -20), (-15 20, 30 15))',26918));
insert into tt1 values(7,ST_GeomFromText('GEOMETRYCOLLECTION(POINT(11 10), POINT(30 -30), LINESTRING(-15 15, -20 20))',4236),ST_GeomFromText('MULTILINESTRING((11 10, 20 -20), (-15 20, 30 15))',26918));
select id ,st_astext(p) from tt1 where ST_Intersects(ST_GeomFromText('MULTILINESTRING((11 10, 20 -20), (-15 20, 30 15))',26918),p);
+------+------------------------------------------------+
| id   | st_astext(p)                                   |
+------+------------------------------------------------+
|    1 | MULTILINESTRING((11 10,20 -20),(-15 20,30 15)) |
|    2 | MULTILINESTRING((11 10,20 -20),(-15 20,30 15)) |
|    3 | MULTILINESTRING((11 10,20 -20),(-15 20,30 15)) |
|    4 | MULTILINESTRING((11 10,20 -20),(-15 20,30 15)) |
|    5 | MULTILINESTRING((11 10,20 -20),(-15 20,30 15)) |
|    6 | MULTILINESTRING((11 10,20 -20),(-15 20,30 15)) |
|    7 | MULTILINESTRING((11 10,20 -20),(-15 20,30 15)) |
+------+------------------------------------------------+
select id ,st_astext(p) from tt1 where ST_Intersects(p,ST_GeomFromText('MULTILINESTRING((11 10, 20 -20), (-15 20, 30 15))',26918));
+------+------------------------------------------------+
| id   | st_astext(p)                                   |
+------+------------------------------------------------+
|    1 | MULTILINESTRING((11 10,20 -20),(-15 20,30 15)) |
|    2 | MULTILINESTRING((11 10,20 -20),(-15 20,30 15)) |
|    3 | MULTILINESTRING((11 10,20 -20),(-15 20,30 15)) |
|    4 | MULTILINESTRING((11 10,20 -20),(-15 20,30 15)) |
|    5 | MULTILINESTRING((11 10,20 -20),(-15 20,30 15)) |
|    6 | MULTILINESTRING((11 10,20 -20),(-15 20,30 15)) |
|    7 | MULTILINESTRING((11 10,20 -20),(-15 20,30 15)) |
+------+------------------------------------------------+
select id ,st_astext(p) from tt1 where _st_covers(ST_GeomFromText('MULTILINESTRING((11 10, 20 -20), (-15 20, 30 15))',26918),p);
+------+------------------------------------------------+
| id   | st_astext(p)                                   |
+------+------------------------------------------------+
|    1 | MULTILINESTRING((11 10,20 -20),(-15 20,30 15)) |
|    2 | MULTILINESTRING((11 10,20 -20),(-15 20,30 15)) |
|    3 | MULTILINESTRING((11 10,20 -20),(-15 20,30 15)) |
|    4 | MULTILINESTRING((11 10,20 -20),(-15 20,30 15)) |
|    5 | MULTILINESTRING((11 10,20 -20),(-15 20,30 15)) |
|    6 | MULTILINESTRING((11 10,20 -20),(-15 20,30 15)) |
|    7 | MULTILINESTRING((11 10,20 -20),(-15 20,30 15)) |
+------+------------------------------------------------+
bug 43082117
select id ,st_astext(p) from tt1 where _st_covers(p,ST_GeomFromText('MULTILINESTRING((11 10, 20 -20), (-15 20, 30 15))',26918));
+------+------------------------------------------------+
| id   | st_astext(p)                                   |
+------+------------------------------------------------+
|    1 | MULTILINESTRING((11 10,20 -20),(-15 20,30 15)) |
|    2 | MULTILINESTRING((11 10,20 -20),(-15 20,30 15)) |
|    3 | MULTILINESTRING((11 10,20 -20),(-15 20,30 15)) |
|    4 | MULTILINESTRING((11 10,20 -20),(-15 20,30 15)) |
|    5 | MULTILINESTRING((11 10,20 -20),(-15 20,30 15)) |
|    6 | MULTILINESTRING((11 10,20 -20),(-15 20,30 15)) |
|    7 | MULTILINESTRING((11 10,20 -20),(-15 20,30 15)) |
+------+------------------------------------------------+
DROP INDEX idx ON tt1;
空间类型MULTIPOLYGON
drop table tt1;
create table tt1(id int, g GEOMETRY, p MULTIPOLYGON not null, spatial index(p));
SHOW INDEX FROM tt1;
Table	Non_unique	Key_name	Seq_in_index	Column_name	Collation	Cardinality	Sub_part	Packed	Null	Index_type	Comment	Index_comment	Visible	Expression
tt1	1	p	1	p	A	NULL	NULL	NULL		SPATIAL	available		YES	NULL
insert into tt1 values(1,ST_GeomFromText('POINT(15 20)'),ST_GeomFromText('MULTIPOLYGON(((0 0,12 0,10 11,0 10,0 0)),((-5 -6,7 5,7 7,5 7, -5 -6)))',0));
insert into tt1 values(2,ST_GeomFromText('LINESTRING(0 0, 10 10, 20 25, 50 60)'),ST_GeomFromText('MULTIPOLYGON(((0 0,12 0,10 11,0 10,0 0)),((-5 -6,7 5,7 7,5 7, -5 -6)))'));
insert into tt1 values(3,ST_GeomFromText('POLYGON((0 1,10 0,9 10,0 10,0 1),(5 5,7 5,8 7,5 7, 5 5))'),ST_GeomFromText('MULTIPOLYGON(((0 0,12 0,10 11,0 10,0 0)),((-5 -6,7 5,7 7,5 7, -5 -6)))',0));
insert into tt1 values(4,ST_GeomFromText('MULTIPOINT(0 1, -20 25, 60 -60)'),ST_GeomFromText('MULTIPOLYGON(((0 0,12 0,10 11,0 10,0 0)),((-5 -6,7 5,7 7,5 7, -5 -6)))',0));
insert into tt1 values(5,ST_GeomFromText('MULTILINESTRING((11 10, 20 -20), (-15 20, 30 15))'),ST_GeomFromText('MULTIPOLYGON(((0 0,12 0,10 11,0 10,0 0)),((-5 -6,7 5,7 7,5 7, -5 -6)))',0));
insert into tt1 values(6,ST_GeomFromText('MULTIPOLYGON(((0 0,10 0,10 11,0 10,0 0)),((-5 -6,7 5,7 7,5 7, -5 -6)))'),ST_GeomFromText('MULTIPOLYGON(((0 0,12 0,10 11,0 10,0 0)),((-5 -6,7 5,7 7,5 7, -5 -6)))',0));
insert into tt1 values(7,ST_GeomFromText('GEOMETRYCOLLECTION(POINT(11 10), POINT(30 -30), LINESTRING(-15 15, -20 20))'),ST_GeomFromText('MULTIPOLYGON(((0 0,12 0,10 11,0 10,0 0)),((-5 -6,7 5,7 7,5 7, -5 -6)))',0));
select id ,st_astext(p) from tt1 where ST_Intersects(ST_GeomFromText('MULTIPOLYGON(((0 0,12 0,10 11,0 10,0 0)),((-5 -6,7 5,7 7,5 7, -5 -6)))',0),p);
+------+-----------------------------------------------------------------------+
| id   | st_astext(p)                                                          |
+------+-----------------------------------------------------------------------+
|    1 | MULTIPOLYGON(((0 0,12 0,10 11,0 10,0 0)),((-5 -6,7 5,7 7,5 7,-5 -6))) |
|    2 | MULTIPOLYGON(((0 0,12 0,10 11,0 10,0 0)),((-5 -6,7 5,7 7,5 7,-5 -6))) |
|    3 | MULTIPOLYGON(((0 0,12 0,10 11,0 10,0 0)),((-5 -6,7 5,7 7,5 7,-5 -6))) |
|    4 | MULTIPOLYGON(((0 0,12 0,10 11,0 10,0 0)),((-5 -6,7 5,7 7,5 7,-5 -6))) |
|    5 | MULTIPOLYGON(((0 0,12 0,10 11,0 10,0 0)),((-5 -6,7 5,7 7,5 7,-5 -6))) |
|    6 | MULTIPOLYGON(((0 0,12 0,10 11,0 10,0 0)),((-5 -6,7 5,7 7,5 7,-5 -6))) |
|    7 | MULTIPOLYGON(((0 0,12 0,10 11,0 10,0 0)),((-5 -6,7 5,7 7,5 7,-5 -6))) |
+------+-----------------------------------------------------------------------+
select id ,st_astext(p) from tt1 where ST_Intersects(p,ST_GeomFromText('MULTIPOLYGON(((0 0,12 0,10 11,0 10,0 0)),((-5 -6,7 5,7 7,5 7, -5 -6)))',0));
+------+-----------------------------------------------------------------------+
| id   | st_astext(p)                                                          |
+------+-----------------------------------------------------------------------+
|    1 | MULTIPOLYGON(((0 0,12 0,10 11,0 10,0 0)),((-5 -6,7 5,7 7,5 7,-5 -6))) |
|    2 | MULTIPOLYGON(((0 0,12 0,10 11,0 10,0 0)),((-5 -6,7 5,7 7,5 7,-5 -6))) |
|    3 | MULTIPOLYGON(((0 0,12 0,10 11,0 10,0 0)),((-5 -6,7 5,7 7,5 7,-5 -6))) |
|    4 | MULTIPOLYGON(((0 0,12 0,10 11,0 10,0 0)),((-5 -6,7 5,7 7,5 7,-5 -6))) |
|    5 | MULTIPOLYGON(((0 0,12 0,10 11,0 10,0 0)),((-5 -6,7 5,7 7,5 7,-5 -6))) |
|    6 | MULTIPOLYGON(((0 0,12 0,10 11,0 10,0 0)),((-5 -6,7 5,7 7,5 7,-5 -6))) |
|    7 | MULTIPOLYGON(((0 0,12 0,10 11,0 10,0 0)),((-5 -6,7 5,7 7,5 7,-5 -6))) |
+------+-----------------------------------------------------------------------+
select id ,st_astext(p) from tt1 where _st_covers(ST_GeomFromText('MULTIPOLYGON(((0 0,12 0,10 11,0 10,0 0)),((-5 -6,7 5,7 7,5 7, -5 -6)))',0),p);
+------+--------------+
| id   | st_astext(p) |
+------+--------------+
+------+--------------+
select id ,st_astext(p) from tt1 where _st_covers(p,ST_GeomFromText('MULTIPOLYGON(((0 0,12 0,10 11,0 10,0 0)),((-5 -6,7 5,7 7,5 7, -5 -6)))',0));
+------+--------------+
| id   | st_astext(p) |
+------+--------------+
+------+--------------+
##explain extended select id ,st_astext(p) from tt1 where ST_Intersects(p,ST_GeomFromText('MULTIPOLYGON(((0 0,12 0,10 11,0 10,0 0)),((-5 -6,7 5,7 7,5 7, -5 -6)))',0));
drop table tt1;
create table tt1(id int, g GEOMETRY, p MULTIPOLYGON not null srid 4236,  index(p) GLOBAL);
SHOW INDEX FROM tt1;
Table	Non_unique	Key_name	Seq_in_index	Column_name	Collation	Cardinality	Sub_part	Packed	Null	Index_type	Comment	Index_comment	Visible	Expression
tt1	1	p	1	p	A	NULL	NULL	NULL		SPATIAL	available		YES	NULL
show create table tt1;
Table	Create Table
tt1	CREATE TABLE `tt1` (
  `id` int(11) DEFAULT NULL,
  `g` geometry DEFAULT NULL,
  `p` multipolygon NOT NULL /*!80003 SRID 4236 */,
  SPATIAL KEY `p` (`p`) BLOCK_SIZE 16384 GLOBAL
) ORGANIZATION INDEX DEFAULT CHARSET = utf8mb4 ROW_FORMAT = DYNAMIC COMPRESSION = 'zstd_1.3.8' REPLICA_NUM = 1 BLOCK_SIZE = 16384 USE_BLOOM_FILTER = FALSE ENABLE_MACRO_BLOCK_BLOOM_FILTER = FALSE TABLET_SIZE = 134217728 PCTFREE = 0
insert into tt1 values(1,ST_GeomFromText('POINT(15 20)',4236),ST_GeomFromText('MULTIPOLYGON(((0 0,12 0,10 11,0 10,0 0)),((-5 -6,7 5,7 7,5 7, -5 -6)))',4236));
insert into tt1 values(2,ST_GeomFromText('LINESTRING(0 0, 10 10, 20 25, 50 60)',4236),ST_GeomFromText('MULTIPOLYGON(((0 0,12 0,10 11,0 10,0 0)),((-5 -6,7 5,7 7,5 7, -5 -6)))',4236));
insert into tt1 values(3,ST_GeomFromText('POLYGON((0 1,10 0,9 10,0 10,0 1),(5 5,7 5,8 7,5 7, 5 5))',4236),ST_GeomFromText('MULTIPOLYGON(((0 0,12 0,10 11,0 10,0 0)),((-5 -6,7 5,7 7,5 7, -5 -6)))',4236));
insert into tt1 values(4,ST_GeomFromText('MULTIPOINT(0 1, -20 25, 60 -60)'),ST_GeomFromText('MULTIPOLYGON(((0 0,12 0,10 11,0 10,0 0)),((-5 -6,7 5,7 7,5 7, -5 -6)))',4236));
insert into tt1 values(5,ST_GeomFromText('MULTILINESTRING((11 10, 20 -20), (-15 20, 30 15))',4236),ST_GeomFromText('MULTIPOLYGON(((0 0,12 0,10 11,0 10,0 0)),((-5 -6,7 5,7 7,5 7, -5 -6)))',4236));
insert into tt1 values(6,ST_GeomFromText('MULTIPOLYGON(((0 0,12 0,10 11,0 10,0 0)),((-5 -6,7 5,7 7,5 7, -5 -6)))',4236),ST_GeomFromText('MULTIPOLYGON(((0 0,12 0,10 11,0 10,0 0)),((-5 -6,7 5,7 7,5 7, -5 -6)))',4236));
insert into tt1 values(7,ST_GeomFromText('GEOMETRYCOLLECTION(POINT(11 10), POINT(30 -30), LINESTRING(-15 15, -20 20))',4236),ST_GeomFromText('MULTIPOLYGON(((0 0,12 0,10 11,0 10,0 0)),((-5 -6,7 5,7 7,5 7, -5 -6)))',4236));
bug41645879
select id ,st_astext(p) from tt1 where ST_Intersects(ST_GeomFromText('MULTIPOLYGON(((0 0,12 0,10 11,0 10,0 0)),((-5 -6,7 5,7 7,5 7, -5 -6)))',4236),p);
+------+-----------------------------------------------------------------------+
| id   | st_astext(p)                                                          |
+------+-----------------------------------------------------------------------+
|    1 | MULTIPOLYGON(((0 0,12 0,10 11,0 10,0 0)),((-5 -6,7 5,7 7,5 7,-5 -6))) |
|    2 | MULTIPOLYGON(((0 0,12 0,10 11,0 10,0 0)),((-5 -6,7 5,7 7,5 7,-5 -6))) |
|    3 | MULTIPOLYGON(((0 0,12 0,10 11,0 10,0 0)),((-5 -6,7 5,7 7,5 7,-5 -6))) |
|    4 | MULTIPOLYGON(((0 0,12 0,10 11,0 10,0 0)),((-5 -6,7 5,7 7,5 7,-5 -6))) |
|    5 | MULTIPOLYGON(((0 0,12 0,10 11,0 10,0 0)),((-5 -6,7 5,7 7,5 7,-5 -6))) |
|    6 | MULTIPOLYGON(((0 0,12 0,10 11,0 10,0 0)),((-5 -6,7 5,7 7,5 7,-5 -6))) |
|    7 | MULTIPOLYGON(((0 0,12 0,10 11,0 10,0 0)),((-5 -6,7 5,7 7,5 7,-5 -6))) |
+------+-----------------------------------------------------------------------+
select id ,st_astext(p) from tt1 where st_contains(p,ST_GeomFromText('MULTIPOLYGON(((0 0,12 0,10 11,0 10,0 0)),((-5 -6,7 5,7 7,5 7, -5 -6)))',4236));
+------+--------------+
| id   | st_astext(p) |
+------+--------------+
+------+--------------+
select id ,st_astext(p) from tt1 where st_contains((select g from tt2 where id=3),p);
+------+--------------+
| id   | st_astext(p) |
+------+--------------+
+------+--------------+
select id ,st_astext(p) from tt1 where _st_dwithin(ST_GeomFromText('MULTIPOLYGON(((0 0,12 0,10 11,0 10,0 0)),((-5 -6,7 5,7 7,5 7, -5 -6)))',4236),p,0);
+------+-----------------------------------------------------------------------+
| id   | st_astext(p)                                                          |
+------+-----------------------------------------------------------------------+
|    1 | MULTIPOLYGON(((0 0,12 0,10 11,0 10,0 0)),((-5 -6,7 5,7 7,5 7,-5 -6))) |
|    2 | MULTIPOLYGON(((0 0,12 0,10 11,0 10,0 0)),((-5 -6,7 5,7 7,5 7,-5 -6))) |
|    3 | MULTIPOLYGON(((0 0,12 0,10 11,0 10,0 0)),((-5 -6,7 5,7 7,5 7,-5 -6))) |
|    4 | MULTIPOLYGON(((0 0,12 0,10 11,0 10,0 0)),((-5 -6,7 5,7 7,5 7,-5 -6))) |
|    5 | MULTIPOLYGON(((0 0,12 0,10 11,0 10,0 0)),((-5 -6,7 5,7 7,5 7,-5 -6))) |
|    6 | MULTIPOLYGON(((0 0,12 0,10 11,0 10,0 0)),((-5 -6,7 5,7 7,5 7,-5 -6))) |
|    7 | MULTIPOLYGON(((0 0,12 0,10 11,0 10,0 0)),((-5 -6,7 5,7 7,5 7,-5 -6))) |
+------+-----------------------------------------------------------------------+
select id ,st_astext(p) from tt1 where _st_dwithin(p,(select g from tt2 where id=3),10);
+------+-----------------------------------------------------------------------+
| id   | st_astext(p)                                                          |
+------+-----------------------------------------------------------------------+
|    1 | MULTIPOLYGON(((0 0,12 0,10 11,0 10,0 0)),((-5 -6,7 5,7 7,5 7,-5 -6))) |
|    2 | MULTIPOLYGON(((0 0,12 0,10 11,0 10,0 0)),((-5 -6,7 5,7 7,5 7,-5 -6))) |
|    3 | MULTIPOLYGON(((0 0,12 0,10 11,0 10,0 0)),((-5 -6,7 5,7 7,5 7,-5 -6))) |
|    4 | MULTIPOLYGON(((0 0,12 0,10 11,0 10,0 0)),((-5 -6,7 5,7 7,5 7,-5 -6))) |
|    5 | MULTIPOLYGON(((0 0,12 0,10 11,0 10,0 0)),((-5 -6,7 5,7 7,5 7,-5 -6))) |
|    6 | MULTIPOLYGON(((0 0,12 0,10 11,0 10,0 0)),((-5 -6,7 5,7 7,5 7,-5 -6))) |
|    7 | MULTIPOLYGON(((0 0,12 0,10 11,0 10,0 0)),((-5 -6,7 5,7 7,5 7,-5 -6))) |
+------+-----------------------------------------------------------------------+
drop table tt1;
create table tt1(id int, g GEOMETRY, p MULTIPOLYGON not null srid 0);
CREATE spatial INDEX idx ON tt1(p) LOCAL;
SHOW INDEX FROM tt1;
Table	Non_unique	Key_name	Seq_in_index	Column_name	Collation	Cardinality	Sub_part	Packed	Null	Index_type	Comment	Index_comment	Visible	Expression
tt1	1	idx	1	p	A	NULL	NULL	NULL		SPATIAL	available		YES	NULL
show create table tt1;
Table	Create Table
tt1	CREATE TABLE `tt1` (
  `id` int(11) DEFAULT NULL,
  `g` geometry DEFAULT NULL,
  `p` multipolygon NOT NULL /*!80003 SRID 0 */,
  SPATIAL KEY `idx` (`p`) BLOCK_SIZE 16384 LOCAL
) ORGANIZATION INDEX DEFAULT CHARSET = utf8mb4 ROW_FORMAT = DYNAMIC COMPRESSION = 'zstd_1.3.8' REPLICA_NUM = 1 BLOCK_SIZE = 16384 USE_BLOOM_FILTER = FALSE ENABLE_MACRO_BLOCK_BLOOM_FILTER = FALSE TABLET_SIZE = 134217728 PCTFREE = 0
insert into tt1 values(1,ST_GeomFromText('POINT(15 20)',4236),ST_GeomFromText('MULTIPOLYGON(((0 0,12 0,10 11,0 10,0 0)),((-5 -6,7 5,7 7,5 7, -5 -6)))'));
drop table tt1;
create table tt1(id int, g GEOMETRY, p MULTIPOLYGON not null srid 26918);
ALTER TABLE tt1 ADD SPATIAL INDEX idx(p) ;
SHOW INDEX FROM tt1;
Table	Non_unique	Key_name	Seq_in_index	Column_name	Collation	Cardinality	Sub_part	Packed	Null	Index_type	Comment	Index_comment	Visible	Expression
tt1	1	idx	1	p	A	NULL	NULL	NULL		SPATIAL	available		YES	NULL
show create table tt1;
Table	Create Table
tt1	CREATE TABLE `tt1` (
  `id` int(11) DEFAULT NULL,
  `g` geometry DEFAULT NULL,
  `p` multipolygon NOT NULL /*!80003 SRID 26918 */,
  SPATIAL KEY `idx` (`p`) BLOCK_SIZE 16384 LOCAL
) ORGANIZATION INDEX DEFAULT CHARSET = utf8mb4 ROW_FORMAT = DYNAMIC COMPRESSION = 'zstd_1.3.8' REPLICA_NUM = 1 BLOCK_SIZE = 16384 USE_BLOOM_FILTER = FALSE ENABLE_MACRO_BLOCK_BLOOM_FILTER = FALSE TABLET_SIZE = 134217728 PCTFREE = 0
insert into tt1 values(1,ST_GeomFromText('POINT(15 20)',4236),ST_GeomFromText('MULTIPOLYGON(((0 0,12 0,10 11,0 10,0 0)),((-5 -6,7 5,7 7,5 7, -5 -6)))',26918));
insert into tt1 values(2,ST_GeomFromText('LINESTRING(0 0, 10 10, 20 25, 50 60)',4236),ST_GeomFromText('MULTIPOLYGON(((0 0,12 0,10 11,0 10,0 0)),((-5 -6,7 5,7 7,5 7, -5 -6)))',26918));
insert into tt1 values(3,ST_GeomFromText('POLYGON((0 1,10 0,9 10,0 10,0 1),(5 5,7 5,8 7,5 7, 5 5))',4236),ST_GeomFromText('MULTIPOLYGON(((0 0,12 0,10 11,0 10,0 0)),((-5 -6,7 5,7 7,5 7, -5 -6)))',26918));
insert into tt1 values(4,ST_GeomFromText('MULTIPOINT(0 1, -20 25, 60 -60)'),ST_GeomFromText('MULTIPOLYGON(((0 0,12 0,10 11,0 10,0 0)),((-5 -6,7 5,7 7,5 7, -5 -6)))',26918));
insert into tt1 values(5,ST_GeomFromText('MULTILINESTRING((11 10, 20 -20), (-15 20, 30 15))',4236),ST_GeomFromText('MULTIPOLYGON(((0 0,12 0,10 11,0 10,0 0)),((-5 -6,7 5,7 7,5 7, -5 -6)))',26918));
insert into tt1 values(6,ST_GeomFromText('MULTIPOLYGON(((0 0,10 0,10 11,0 10,0 0)),((-5 -6,7 5,7 7,5 7, -5 -6)))',4236),ST_GeomFromText('MULTIPOLYGON(((0 0,12 0,10 11,0 10,0 0)),((-5 -6,7 5,7 7,5 7, -5 -6)))',26918));
insert into tt1 values(7,ST_GeomFromText('GEOMETRYCOLLECTION(POINT(11 10), POINT(30 -30), LINESTRING(-15 15, -20 20))',4236),ST_GeomFromText('MULTIPOLYGON(((0 0,12 0,10 11,0 10,0 0)),((-5 -6,7 5,7 7,5 7, -5 -6)))',26918));
select id ,st_astext(p) from tt1 where ST_Intersects(ST_GeomFromText('MULTIPOLYGON(((0 0,12 0,10 11,0 10,0 0)),((-5 -6,7 5,7 7,5 7, -5 -6)))',26918),p);
+------+-----------------------------------------------------------------------+
| id   | st_astext(p)                                                          |
+------+-----------------------------------------------------------------------+
|    1 | MULTIPOLYGON(((0 0,12 0,10 11,0 10,0 0)),((-5 -6,7 5,7 7,5 7,-5 -6))) |
|    2 | MULTIPOLYGON(((0 0,12 0,10 11,0 10,0 0)),((-5 -6,7 5,7 7,5 7,-5 -6))) |
|    3 | MULTIPOLYGON(((0 0,12 0,10 11,0 10,0 0)),((-5 -6,7 5,7 7,5 7,-5 -6))) |
|    4 | MULTIPOLYGON(((0 0,12 0,10 11,0 10,0 0)),((-5 -6,7 5,7 7,5 7,-5 -6))) |
|    5 | MULTIPOLYGON(((0 0,12 0,10 11,0 10,0 0)),((-5 -6,7 5,7 7,5 7,-5 -6))) |
|    6 | MULTIPOLYGON(((0 0,12 0,10 11,0 10,0 0)),((-5 -6,7 5,7 7,5 7,-5 -6))) |
|    7 | MULTIPOLYGON(((0 0,12 0,10 11,0 10,0 0)),((-5 -6,7 5,7 7,5 7,-5 -6))) |
+------+-----------------------------------------------------------------------+
select id ,st_astext(p) from tt1 where ST_Intersects(p,ST_GeomFromText('MULTIPOLYGON(((0 0,12 0,10 11,0 10,0 0)),((-5 -6,7 5,7 7,5 7, -5 -6)))',26918));
+------+-----------------------------------------------------------------------+
| id   | st_astext(p)                                                          |
+------+-----------------------------------------------------------------------+
|    1 | MULTIPOLYGON(((0 0,12 0,10 11,0 10,0 0)),((-5 -6,7 5,7 7,5 7,-5 -6))) |
|    2 | MULTIPOLYGON(((0 0,12 0,10 11,0 10,0 0)),((-5 -6,7 5,7 7,5 7,-5 -6))) |
|    3 | MULTIPOLYGON(((0 0,12 0,10 11,0 10,0 0)),((-5 -6,7 5,7 7,5 7,-5 -6))) |
|    4 | MULTIPOLYGON(((0 0,12 0,10 11,0 10,0 0)),((-5 -6,7 5,7 7,5 7,-5 -6))) |
|    5 | MULTIPOLYGON(((0 0,12 0,10 11,0 10,0 0)),((-5 -6,7 5,7 7,5 7,-5 -6))) |
|    6 | MULTIPOLYGON(((0 0,12 0,10 11,0 10,0 0)),((-5 -6,7 5,7 7,5 7,-5 -6))) |
|    7 | MULTIPOLYGON(((0 0,12 0,10 11,0 10,0 0)),((-5 -6,7 5,7 7,5 7,-5 -6))) |
+------+-----------------------------------------------------------------------+
select id ,st_astext(p) from tt1 where _st_covers(ST_GeomFromText('MULTIPOLYGON(((0 0,12 0,10 11,0 10,0 0)),((-5 -6,7 5,7 7,5 7, -5 -6)))',26918),p);
+------+--------------+
| id   | st_astext(p) |
+------+--------------+
+------+--------------+
bug 43082117
select id ,st_astext(p) from tt1 where _st_covers(p,ST_GeomFromText('MULTIPOLYGON(((0 0,12 0,10 11,0 10,0 0)),((-5 -6,7 5,7 7,5 7, -5 -6)))',26918));
+------+--------------+
| id   | st_astext(p) |
+------+--------------+
+------+--------------+
DROP INDEX idx ON tt1;
drop table tt2;
create table tt2(id int ,g GEOMETRY);
insert into tt2 values(2,ST_GeomFromText('LINESTRING(0 0, 10 10, 20 25, 50 60)',0));
insert into tt2 values(3,ST_GeomFromText('POLYGON((0 1,10 0,9 10,0 10,0 1),(5 5,7 5,8 7,5 7, 5 5))',4236));
insert into tt2 values(4,ST_GeomFromText('MULTIPOINT(0 1, -20 25, 60 -60)',26918));
insert into tt2 values(5,ST_GeomFromText('MULTILINESTRING((11 10, 20 -20), (-15 20, 30 15))',26918));
insert into tt2 values(6,ST_GeomFromText('MULTIPOLYGON(((0 0,10 0,10 11,0 10,0 0)),((-5 -6,7 5,7 7,5 7, -5 -6)))',0));
insert into tt2 values(7,ST_GeomFromText('GEOMETRYCOLLECTION(POINT(11 10), POINT(30 -30), LINESTRING(-15 15, -20 20))',4236));
drop table tt1;
create table tt1(id int, g GEOMETRY, p GEOMETRYCOLLECTION not null, spatial index(p));
SHOW INDEX FROM tt1;
Table	Non_unique	Key_name	Seq_in_index	Column_name	Collation	Cardinality	Sub_part	Packed	Null	Index_type	Comment	Index_comment	Visible	Expression
tt1	1	p	1	p	A	NULL	NULL	NULL		SPATIAL	available		YES	NULL
insert into tt1 values(1,ST_GeomFromText('POINT(15 20)'),ST_GeomFromText('MULTIPOLYGON(((0 0,12 0,10 11,0 10,0 0)),((-5 -6,7 5,7 7,5 7, -5 -6)))',0));
insert into tt1 values(2,ST_GeomFromText('LINESTRING(0 0, 10 10, 20 25, 50 60)'),ST_GeomFromText('MULTILINESTRING((11 10, 20 -20), (-15 20, 30 15))'));
insert into tt1 values(3,ST_GeomFromText('POLYGON((0 1,10 0,9 10,0 10,0 1),(5 5,7 5,8 7,5 7, 5 5))'),ST_GeomFromText('GEOMETRYCOLLECTION(POINT(11 10), POINT(30 -30), LINESTRING(-15 15, -20 20))',0));
insert into tt1 values(4,ST_GeomFromText('MULTIPOINT(0 1, -20 25, 60 -60)'),ST_GeomFromText('GEOMETRYCOLLECTION(POINT(11 10), POINT(30 -30), LINESTRING(-15 15, -20 20))',0));
insert into tt1 values(5,ST_GeomFromText('MULTILINESTRING((11 10, 20 -20), (-15 20, 30 15))'),ST_GeomFromText('GEOMETRYCOLLECTION(POINT(11 10), POINT(30 -30), LINESTRING(-15 15, -20 20))',0));
insert into tt1 values(6,ST_GeomFromText('MULTIPOLYGON(((0 0,10 0,10 11,0 10,0 0)),((-5 -6,7 5,7 7,5 7, -5 -6)))'),ST_GeomFromText('GEOMETRYCOLLECTION(POINT(11 10), POINT(30 -30), LINESTRING(-15 15, -20 20))',0));
insert into tt1 values(7,ST_GeomFromText('GEOMETRYCOLLECTION(POINT(11 10), POINT(30 -30), LINESTRING(-15 15, -20 20))'),ST_GeomFromText('GEOMETRYCOLLECTION(POINT(11 10), POINT(30 -30), LINESTRING(-15 15, -20 20))',0));
select id ,st_astext(p) from tt1 where ST_Intersects(ST_GeomFromText('MULTIPOLYGON(((0 0,12 0,10 11,0 10,0 0)),((-5 -6,7 5,7 7,5 7, -5 -6)))',0),p);
+------+-----------------------------------------------------------------------+
| id   | st_astext(p)                                                          |
+------+-----------------------------------------------------------------------+
|    1 | MULTIPOLYGON(((0 0,12 0,10 11,0 10,0 0)),((-5 -6,7 5,7 7,5 7,-5 -6))) |
+------+-----------------------------------------------------------------------+
select id ,st_astext(p) from tt1 where ST_Intersects(p,ST_GeomFromText('GEOMETRYCOLLECTION(POINT(11 10), POINT(30 -30), LINESTRING(-15 15, -20 20))',0));
+------+--------------------------------------------------------------------------+
| id   | st_astext(p)                                                             |
+------+--------------------------------------------------------------------------+
|    2 | MULTILINESTRING((11 10,20 -20),(-15 20,30 15))                           |
|    3 | GEOMETRYCOLLECTION(POINT(11 10),POINT(30 -30),LINESTRING(-15 15,-20 20)) |
|    4 | GEOMETRYCOLLECTION(POINT(11 10),POINT(30 -30),LINESTRING(-15 15,-20 20)) |
|    5 | GEOMETRYCOLLECTION(POINT(11 10),POINT(30 -30),LINESTRING(-15 15,-20 20)) |
|    6 | GEOMETRYCOLLECTION(POINT(11 10),POINT(30 -30),LINESTRING(-15 15,-20 20)) |
|    7 | GEOMETRYCOLLECTION(POINT(11 10),POINT(30 -30),LINESTRING(-15 15,-20 20)) |
+------+--------------------------------------------------------------------------+
select id ,st_astext(p) from tt1 where _st_covers(ST_GeomFromText('MULTIPOLYGON(((0 0,12 0,10 11,0 10,0 0)),((-5 -6,7 5,7 7,5 7, -5 -6)))',0),p);
+------+--------------+
| id   | st_astext(p) |
+------+--------------+
+------+--------------+
select id ,st_astext(p) from tt1 where _st_covers(p,ST_GeomFromText('GEOMETRYCOLLECTION(POINT(11 10), POINT(30 -30), LINESTRING(-15 15, -20 20))',0));
+------+--------------------------------------------------------------------------+
| id   | st_astext(p)                                                             |
+------+--------------------------------------------------------------------------+
|    3 | GEOMETRYCOLLECTION(POINT(11 10),POINT(30 -30),LINESTRING(-15 15,-20 20)) |
|    4 | GEOMETRYCOLLECTION(POINT(11 10),POINT(30 -30),LINESTRING(-15 15,-20 20)) |
|    5 | GEOMETRYCOLLECTION(POINT(11 10),POINT(30 -30),LINESTRING(-15 15,-20 20)) |
|    6 | GEOMETRYCOLLECTION(POINT(11 10),POINT(30 -30),LINESTRING(-15 15,-20 20)) |
|    7 | GEOMETRYCOLLECTION(POINT(11 10),POINT(30 -30),LINESTRING(-15 15,-20 20)) |
+------+--------------------------------------------------------------------------+
##explain extended select id ,st_astext(p) from tt1 where ST_Intersects(p,ST_GeomFromText('GEOMETRYCOLLECTION(POINT(11 10), POINT(30 -30), LINESTRING(-15 15, -20 20))',0));
drop table tt1;
create table tt1(id int, g GEOMETRY, p GEOMETRYCOLLECTION not null srid 4236,  index(p) GLOBAL);
SHOW INDEX FROM tt1;
Table	Non_unique	Key_name	Seq_in_index	Column_name	Collation	Cardinality	Sub_part	Packed	Null	Index_type	Comment	Index_comment	Visible	Expression
tt1	1	p	1	p	A	NULL	NULL	NULL		SPATIAL	available		YES	NULL
show create table tt1;
Table	Create Table
tt1	CREATE TABLE `tt1` (
  `id` int(11) DEFAULT NULL,
  `g` geometry DEFAULT NULL,
  `p` geomcollection NOT NULL /*!80003 SRID 4236 */,
  SPATIAL KEY `p` (`p`) BLOCK_SIZE 16384 GLOBAL
) ORGANIZATION INDEX DEFAULT CHARSET = utf8mb4 ROW_FORMAT = DYNAMIC COMPRESSION = 'zstd_1.3.8' REPLICA_NUM = 1 BLOCK_SIZE = 16384 USE_BLOOM_FILTER = FALSE ENABLE_MACRO_BLOCK_BLOOM_FILTER = FALSE TABLET_SIZE = 134217728 PCTFREE = 0
insert into tt1 values(1,ST_GeomFromText('POINT(15 20)',4236),ST_GeomFromText('GEOMETRYCOLLECTION(POINT(11 10), POINT(30 -30), LINESTRING(-15 15, -20 20))',4236));
insert into tt1 values(2,ST_GeomFromText('LINESTRING(0 0, 10 10, 20 25, 50 60)',4236),ST_GeomFromText('MULTIPOLYGON(((0 0,12 0,10 11,0 10,0 0)),((-5 -6,7 5,7 7,5 7, -5 -6)))',4236));
insert into tt1 values(3,ST_GeomFromText('POLYGON((0 1,10 0,9 10,0 10,0 1),(5 5,7 5,8 7,5 7, 5 5))',4236),ST_GeomFromText('GEOMETRYCOLLECTION(POINT(11 10), POINT(30 -30), LINESTRING(-15 15, -20 20))',4236));
insert into tt1 values(4,ST_GeomFromText('MULTIPOINT(0 1, -20 25, 60 -60)'),ST_GeomFromText('MULTIPOLYGON(((0 0,12 0,10 11,0 10,0 0)),((-5 -6,7 5,7 7,5 7, -5 -6)))',4236));
insert into tt1 values(5,ST_GeomFromText('MULTILINESTRING((11 10, 20 -20), (-15 20, 30 15))',4236),ST_GeomFromText('GEOMETRYCOLLECTION(POINT(11 10), POINT(30 -30), LINESTRING(-15 15, -20 20))',4236));
insert into tt1 values(6,ST_GeomFromText('MULTIPOLYGON(((0 0,12 0,10 11,0 10,0 0)),((-5 -6,7 5,7 7,5 7, -5 -6)))',4236),ST_GeomFromText('MULTIPOLYGON(((0 0,12 0,10 11,0 10,0 0)),((-5 -6,7 5,7 7,5 7, -5 -6)))',4236));
insert into tt1 values(7,ST_GeomFromText('GEOMETRYCOLLECTION(POINT(11 10), POINT(30 -30), LINESTRING(-15 15, -20 20))',4236),ST_GeomFromText('MULTILINESTRING((11 10, 20 -20), (-15 20, 30 15))',4236));
bug41645879
select id ,st_astext(p) from tt1 where ST_Intersects(ST_GeomFromText('GEOMETRYCOLLECTION(POINT(11 10), POINT(30 -30), LINESTRING(-15 15, -20 20))',4236),p);
+------+--------------------------------------------------------------------------+
| id   | st_astext(p)                                                             |
+------+--------------------------------------------------------------------------+
|    1 | GEOMETRYCOLLECTION(POINT(11 10),POINT(30 -30),LINESTRING(-15 15,-20 20)) |
|    3 | GEOMETRYCOLLECTION(POINT(11 10),POINT(30 -30),LINESTRING(-15 15,-20 20)) |
|    5 | GEOMETRYCOLLECTION(POINT(11 10),POINT(30 -30),LINESTRING(-15 15,-20 20)) |
|    7 | MULTILINESTRING((11 10,20 -20),(-15 20,30 15))                           |
+------+--------------------------------------------------------------------------+
drop table tt1;
create table tt1(id int, g GEOMETRY, p GEOMETRYCOLLECTION not null srid 0);
CREATE spatial INDEX idx ON tt1(p) LOCAL;
SHOW INDEX FROM tt1;
Table	Non_unique	Key_name	Seq_in_index	Column_name	Collation	Cardinality	Sub_part	Packed	Null	Index_type	Comment	Index_comment	Visible	Expression
tt1	1	idx	1	p	A	NULL	NULL	NULL		SPATIAL	available		YES	NULL
show create table tt1;
Table	Create Table
tt1	CREATE TABLE `tt1` (
  `id` int(11) DEFAULT NULL,
  `g` geometry DEFAULT NULL,
  `p` geomcollection NOT NULL /*!80003 SRID 0 */,
  SPATIAL KEY `idx` (`p`) BLOCK_SIZE 16384 LOCAL
) ORGANIZATION INDEX DEFAULT CHARSET = utf8mb4 ROW_FORMAT = DYNAMIC COMPRESSION = 'zstd_1.3.8' REPLICA_NUM = 1 BLOCK_SIZE = 16384 USE_BLOOM_FILTER = FALSE ENABLE_MACRO_BLOCK_BLOOM_FILTER = FALSE TABLET_SIZE = 134217728 PCTFREE = 0
bug  41666229
insert into tt1 values(1,ST_GeomFromText('POINT(15 20)',4236),ST_GeomFromText('GEOMETRYCOLLECTION(POINT(11 10), POINT(30 -30), LINESTRING(-15 15, -20 20))'));
bug 41652667
drop table tt1;
create table tt1(id int, g GEOMETRY, p GEOMETRYCOLLECTION not null srid 26918);
ALTER TABLE tt1 ADD SPATIAL INDEX idx(p) ;
SHOW INDEX FROM tt1;
Table	Non_unique	Key_name	Seq_in_index	Column_name	Collation	Cardinality	Sub_part	Packed	Null	Index_type	Comment	Index_comment	Visible	Expression
tt1	1	idx	1	p	A	NULL	NULL	NULL		SPATIAL	available		YES	NULL
show create table tt1;
Table	Create Table
tt1	CREATE TABLE `tt1` (
  `id` int(11) DEFAULT NULL,
  `g` geometry DEFAULT NULL,
  `p` geomcollection NOT NULL /*!80003 SRID 26918 */,
  SPATIAL KEY `idx` (`p`) BLOCK_SIZE 16384 LOCAL
) ORGANIZATION INDEX DEFAULT CHARSET = utf8mb4 ROW_FORMAT = DYNAMIC COMPRESSION = 'zstd_1.3.8' REPLICA_NUM = 1 BLOCK_SIZE = 16384 USE_BLOOM_FILTER = FALSE ENABLE_MACRO_BLOCK_BLOOM_FILTER = FALSE TABLET_SIZE = 134217728 PCTFREE = 0
insert into tt1 values(1,ST_GeomFromText('POINT(15 20)',4236),ST_GeomFromText('GEOMETRYCOLLECTION(POINT(11 10), POINT(30 -30), LINESTRING(-15 15, -20 20))',26918));
insert into tt1 values(2,ST_GeomFromText('LINESTRING(0 0, 10 10, 20 25, 50 60)',4236),ST_GeomFromText('MULTIPOLYGON(((0 0,12 0,10 11,0 10,0 0)),((-5 -6,7 5,7 7,5 7, -5 -6)))',26918));
insert into tt1 values(3,ST_GeomFromText('POLYGON((0 1,10 0,9 10,0 10,0 1),(5 5,7 5,8 7,5 7, 5 5))',4236),ST_GeomFromText('GEOMETRYCOLLECTION(POINT(11 10), POINT(30 -30), LINESTRING(-15 15, -20 20))',26918));
insert into tt1 values(4,ST_GeomFromText('MULTIPOINT(0 1, -20 25, 60 -60)'),ST_GeomFromText('MULTIPOLYGON(((0 0,12 0,10 11,0 10,0 0)),((-5 -6,7 5,7 7,5 7, -5 -6)))',26918));
insert into tt1 values(5,ST_GeomFromText('MULTILINESTRING((11 10, 20 -20), (-15 20, 30 15))',4236),ST_GeomFromText('GEOMETRYCOLLECTION(POINT(11 10), POINT(30 -30), LINESTRING(-15 15, -20 20))',26918));
insert into tt1 values(6,ST_GeomFromText('MULTIPOLYGON(((0 0,10 0,10 11,0 10,0 0)),((-5 -6,7 5,7 7,5 7, -5 -6)))',4236),ST_GeomFromText('MULTIPOLYGON(((0 0,10 0,10 11,0 10,0 0)),((-5 -6,7 5,7 7,5 7, -5 -6)))',26918));
insert into tt1 values(7,ST_GeomFromText('GEOMETRYCOLLECTION(POINT(11 10), POINT(30 -30), LINESTRING(-15 15, -20 20))',4236),ST_GeomFromText('MULTIPOINT(0 1, -20 25, 60 -60)',26918));
select id ,st_astext(p) from tt1 where ST_Intersects(ST_GeomFromText('GEOMETRYCOLLECTION(POINT(11 10), POINT(30 -30), LINESTRING(-15 15, -20 20))',26918),p);
+------+--------------------------------------------------------------------------+
| id   | st_astext(p)                                                             |
+------+--------------------------------------------------------------------------+
|    1 | GEOMETRYCOLLECTION(POINT(11 10),POINT(30 -30),LINESTRING(-15 15,-20 20)) |
|    3 | GEOMETRYCOLLECTION(POINT(11 10),POINT(30 -30),LINESTRING(-15 15,-20 20)) |
|    5 | GEOMETRYCOLLECTION(POINT(11 10),POINT(30 -30),LINESTRING(-15 15,-20 20)) |
+------+--------------------------------------------------------------------------+
select id ,st_astext(p) from tt1 where ST_Intersects(p,ST_GeomFromText('MULTIPOINT(0 1, -20 25, 60 -60)',26918));
+------+-----------------------------------------------------------------------+
| id   | st_astext(p)                                                          |
+------+-----------------------------------------------------------------------+
|    2 | MULTIPOLYGON(((0 0,12 0,10 11,0 10,0 0)),((-5 -6,7 5,7 7,5 7,-5 -6))) |
|    4 | MULTIPOLYGON(((0 0,12 0,10 11,0 10,0 0)),((-5 -6,7 5,7 7,5 7,-5 -6))) |
|    6 | MULTIPOLYGON(((0 0,10 0,10 11,0 10,0 0)),((-5 -6,7 5,7 7,5 7,-5 -6))) |
|    7 | MULTIPOINT((0 1),(-20 25),(60 -60))                                   |
+------+-----------------------------------------------------------------------+
select id ,st_astext(p) from tt1 where _st_covers(ST_GeomFromText('MULTIPOLYGON(((0 0,12 0,10 11,0 10,0 0)),((-5 -6,7 5,7 7,5 7, -5 -6)))',26918),p);
+------+--------------+
| id   | st_astext(p) |
+------+--------------+
+------+--------------+
bug 43082117
select id ,st_astext(p) from tt1 where _st_covers(p,ST_GeomFromText('GEOMETRYCOLLECTION(POINT(11 10), POINT(30 -30), LINESTRING(-15 15, -20 20))',26918));
+------+--------------------------------------------------------------------------+
| id   | st_astext(p)                                                             |
+------+--------------------------------------------------------------------------+
|    1 | GEOMETRYCOLLECTION(POINT(11 10),POINT(30 -30),LINESTRING(-15 15,-20 20)) |
|    3 | GEOMETRYCOLLECTION(POINT(11 10),POINT(30 -30),LINESTRING(-15 15,-20 20)) |
|    5 | GEOMETRYCOLLECTION(POINT(11 10),POINT(30 -30),LINESTRING(-15 15,-20 20)) |
+------+--------------------------------------------------------------------------+
select tt1.id ,st_astext(p) from tt1,tt2 where ST_Intersects(tt2.g,p);
ERROR HY000: The SRID of the geometry does not match the SRID of the column. The SRID of the geometry is 0, but the SRID of the column is 26918. Consider changing the SRID of the geometry or the SRID property of the column.
DROP INDEX idx ON tt1;
drop table tt1;
create table tt1(id int , g geometry not null srid 4236 , spatial index(g));
insert into tt1 values(1,ST_GeomFromText('POINT(15 20)',4236));
select id ,st_astext(g) from tt1 where ST_Intersects(ST_GeomFromText('point(10 20)',426),g);
ERROR SR001: There's no spatial reference system with SRID 426.
select id ,st_astext(g) from tt1 where ST_Intersects(g,ST_GeomFromText('point(10 20)',426));
ERROR SR001: There's no spatial reference system with SRID 426.
drop table tt1;
create table tt1(id int , g point not null srid 26918, spatial index(g));
insert into tt1 values(1,ST_GeomFromText('POINT(15 20)',26918));
select id ,st_astext(g) from tt1 where ST_Intersects(ST_GeomFromText('point(10 20)',426),g);
ERROR SR001: There's no spatial reference system with SRID 426.
select id ,st_astext(g) from tt1 where ST_Intersects(g,ST_GeomFromText('point(10 20)',426));
ERROR SR001: There's no spatial reference system with SRID 426.
drop table tt1;
create table tt1(id int , g point not null srid 0, spatial index(g));
insert into tt1 values(1,ST_GeomFromText('POINT(15 20)',0));
select id ,st_astext(g) from tt1 where ST_Intersects(g,ST_GeomFromText('point(10 20)',426));
ERROR SR001: There's no spatial reference system with SRID 426.
select id ,st_astext(g) from tt1 where ST_Intersects(ST_GeomFromText('point(10 20)',426),g);
ERROR SR001: There's no spatial reference system with SRID 426.
drop table tt1;
create table tt1(id int , g point not null, spatial index(g));
select id ,st_astext(g) from tt1 where ST_Intersects(ST_GeomFromText('point(10 20)',426),g);
+------+--------------+
| id   | st_astext(g) |
+------+--------------+
+------+--------------+
select id ,st_astext(g) from tt1 where ST_Intersects(g,ST_GeomFromText('point(10 20)',426));
+------+--------------+
| id   | st_astext(g) |
+------+--------------+
+------+--------------+
insert into tt1 values(1,ST_GeomFromText('POINT(15 20)'));
select id ,st_astext(g) from tt1 where ST_Intersects(g,ST_GeomFromText('point(10 20)',426));
ERROR SR001: There's no spatial reference system with SRID 426.
select id ,st_astext(g) from tt1 where ST_Intersects(ST_GeomFromText('point(10 20)',426),g);
ERROR SR001: There's no spatial reference system with SRID 426.
drop database  IF EXISTS  oblrp1;
########清空回收站，删除测试数据库，表等 ##########
drop database  IF EXISTS  oblrp;
purge recyclebin;
