# 环境清理
purge recyclebin;
result_format: 4


# oracle_genrate-1-1 系统租户下修改配置 _rowsets_max_rows = 1
alter system set _rowsets_enabled = true tenant sys;
alter system set _rowsets_enabled = true tenant all_user;
alter system set _rowsets_enabled = true tenant all_meta;
alter system set _rowsets_max_rows = 1 tenant sys;
alter system set _rowsets_max_rows = 1 tenant all_user;
alter system set _rowsets_max_rows = 1 tenant all_meta;
alter system flush plan cache global;
# 环境清理
purge recyclebin;
result_format: 4
drop user whh@'%';
drop database if exists whh ;
create user whh identified by 'whh';
create database whh ;
grant all on *.* to whh WITH GRANT OPTION;


#############################################################################################
############ mysql_genrate-1-2 作为分区键
### key分区
drop table virtual_table;
create table virtual_table(
z0_col0 int, 
z0_col1 int,
z0_col2 int as(z0_col0+z0_col1)) 
partition by key(z0_col2) partitions 2;
insert into virtual_table (z0_col0,z0_col1) values (0,0),(NULL,NULL),(1.111,222),(10,10);
select z0_col0,z0_col1,z0_col2 from virtual_table partition(p0) order by z0_col2;
+---------+---------+---------+
| z0_col0 | z0_col1 | z0_col2 |
+---------+---------+---------+
|      10 |      10 |      20 |
|       1 |     222 |     223 |
+---------+---------+---------+
select z0_col0,z0_col1,z0_col2 from virtual_table partition(p1) order by z0_col2;
+---------+---------+---------+
| z0_col0 | z0_col1 | z0_col2 |
+---------+---------+---------+
|    NULL |    NULL |    NULL |
|       0 |       0 |       0 |
+---------+---------+---------+
explain select z0_col0,z0_col1,z0_col2 from virtual_table where z0_col2 = 0 order by z0_col2;
Query Plan
========================================================
|ID|OPERATOR       |NAME         |EST.ROWS|EST.TIME(us)|
--------------------------------------------------------
|0 |TABLE FULL SCAN|virtual_table|1       |3           |
========================================================
Outputs & filters:
-------------------------------------
  0 - output([virtual_table.z0_col0], [virtual_table.z0_col1], [column_conv(INT,PS:(11,0),NULL,cast(virtual_table.z0_col0 + virtual_table.z0_col1, INT(-1,
       0)))]), filter([column_conv(INT,PS:(11,0),NULL,cast(virtual_table.z0_col0 + virtual_table.z0_col1, INT(-1, 0))) = 0])
      access([virtual_table.z0_col0], [virtual_table.z0_col1]), partitions(p1)
      is_index_back=false, is_global_index=false, filter_before_indexback[false], 
      range_key([virtual_table.__pk_increment]), range(MIN ; MAX)always true
explain select z0_col0,z0_col1,z0_col2 from virtual_table where z0_col0+z0_col1 = 0 order by z0_col2;
Query Plan
====================================================================
|ID|OPERATOR                   |NAME         |EST.ROWS|EST.TIME(us)|
--------------------------------------------------------------------
|0 |PX COORDINATOR MERGE SORT  |             |1       |7           |
|1 |└─EXCHANGE OUT DISTR       |:EX10000     |1       |6           |
|2 |  └─SORT                   |             |1       |5           |
|3 |    └─PX PARTITION ITERATOR|             |1       |5           |
|4 |      └─TABLE FULL SCAN    |virtual_table|1       |5           |
====================================================================
Outputs & filters:
-------------------------------------
  0 - output([INTERNAL_FUNCTION(virtual_table.z0_col0, virtual_table.z0_col1, column_conv(INT,PS:(11,0),NULL,cast(virtual_table.z0_col0 + virtual_table.z0_col1,
       INT(-1, 0))))]), filter(nil)
      sort_keys([column_conv(INT,PS:(11,0),NULL,cast(virtual_table.z0_col0 + virtual_table.z0_col1, INT(-1, 0))), ASC])
  1 - output([column_conv(INT,PS:(11,0),NULL,cast(virtual_table.z0_col0 + virtual_table.z0_col1, INT(-1, 0)))], [INTERNAL_FUNCTION(virtual_table.z0_col0,
       virtual_table.z0_col1, column_conv(INT,PS:(11,0),NULL,cast(virtual_table.z0_col0 + virtual_table.z0_col1, INT(-1, 0))))]), filter(nil)
      dop=1
  2 - output([column_conv(INT,PS:(11,0),NULL,cast(virtual_table.z0_col0 + virtual_table.z0_col1, INT(-1, 0)))], [virtual_table.z0_col0], [virtual_table.z0_col1]), filter(nil)
      sort_keys([column_conv(INT,PS:(11,0),NULL,cast(virtual_table.z0_col0 + virtual_table.z0_col1, INT(-1, 0))), ASC])
  3 - output([virtual_table.z0_col0], [virtual_table.z0_col1], [column_conv(INT,PS:(11,0),NULL,cast(virtual_table.z0_col0 + virtual_table.z0_col1, INT(-1,
       0)))]), filter(nil)
      force partition granule
  4 - output([virtual_table.z0_col0], [virtual_table.z0_col1], [column_conv(INT,PS:(11,0),NULL,cast(virtual_table.z0_col0 + virtual_table.z0_col1, INT(-1,
       0)))]), filter([virtual_table.z0_col0 + virtual_table.z0_col1 = 0])
      access([virtual_table.z0_col0], [virtual_table.z0_col1]), partitions(p[0-1])
      is_index_back=false, is_global_index=false, filter_before_indexback[false], 
      range_key([virtual_table.__pk_increment]), range(MIN ; MAX)always true
drop table stored_table;
create table stored_table(
z0_col0 int, 
z0_col1 int,
z0_col2 int as(z0_col0+z0_col1) stored) 
partition by key(z0_col2) partitions 3;
insert into stored_table (z0_col0,z0_col1) values (0,0),(NULL,NULL),(1.111,222),(10,10);
select z0_col0,z0_col1,z0_col2 from stored_table partition(p0) order by z0_col2;
+---------+---------+---------+
| z0_col0 | z0_col1 | z0_col2 |
+---------+---------+---------+
|      10 |      10 |      20 |
+---------+---------+---------+
select z0_col0,z0_col1,z0_col2 from stored_table partition(p1) order by z0_col2;
+---------+---------+---------+
| z0_col0 | z0_col1 | z0_col2 |
+---------+---------+---------+
|       1 |     222 |     223 |
+---------+---------+---------+
select z0_col0,z0_col1,z0_col2 from stored_table partition(p2) order by z0_col2;
+---------+---------+---------+
| z0_col0 | z0_col1 | z0_col2 |
+---------+---------+---------+
|    NULL |    NULL |    NULL |
|       0 |       0 |       0 |
+---------+---------+---------+
explain select z0_col0,z0_col1,z0_col2 from stored_table where z0_col2 = 0 order by z0_col2;
Query Plan
=======================================================
|ID|OPERATOR       |NAME        |EST.ROWS|EST.TIME(us)|
-------------------------------------------------------
|0 |TABLE FULL SCAN|stored_table|1       |3           |
=======================================================
Outputs & filters:
-------------------------------------
  0 - output([stored_table.z0_col0], [stored_table.z0_col1], [stored_table.z0_col2]), filter([stored_table.z0_col2 = 0])
      access([stored_table.z0_col0], [stored_table.z0_col1], [stored_table.z0_col2]), partitions(p2)
      is_index_back=false, is_global_index=false, filter_before_indexback[false], 
      range_key([stored_table.__pk_increment]), range(MIN ; MAX)always true
explain select z0_col0,z0_col1,z0_col2 from stored_table where z0_col0+z0_col1 = 0 order by z0_col2;
Query Plan
===================================================================
|ID|OPERATOR                   |NAME        |EST.ROWS|EST.TIME(us)|
-------------------------------------------------------------------
|0 |PX COORDINATOR MERGE SORT  |            |1       |9           |
|1 |└─EXCHANGE OUT DISTR       |:EX10000    |1       |8           |
|2 |  └─SORT                   |            |1       |7           |
|3 |    └─PX PARTITION ITERATOR|            |1       |7           |
|4 |      └─TABLE FULL SCAN    |stored_table|1       |7           |
===================================================================
Outputs & filters:
-------------------------------------
  0 - output([INTERNAL_FUNCTION(stored_table.z0_col0, stored_table.z0_col1, stored_table.z0_col2)]), filter(nil)
      sort_keys([stored_table.z0_col2, ASC])
  1 - output([stored_table.z0_col2], [INTERNAL_FUNCTION(stored_table.z0_col0, stored_table.z0_col1, stored_table.z0_col2)]), filter(nil)
      dop=1
  2 - output([stored_table.z0_col2], [stored_table.z0_col0], [stored_table.z0_col1]), filter(nil)
      sort_keys([stored_table.z0_col2, ASC])
  3 - output([stored_table.z0_col0], [stored_table.z0_col1], [stored_table.z0_col2]), filter(nil)
      force partition granule
  4 - output([stored_table.z0_col0], [stored_table.z0_col1], [stored_table.z0_col2]), filter([stored_table.z0_col0 + stored_table.z0_col1 = 0])
      access([stored_table.z0_col0], [stored_table.z0_col1], [stored_table.z0_col2]), partitions(p[0-2])
      is_index_back=false, is_global_index=false, filter_before_indexback[false], 
      range_key([stored_table.__pk_increment]), range(MIN ; MAX)always true
### COLUMNS分区
drop table virtual_table;
create table virtual_table(
z0_col0 int, 
z0_col1 int,
z0_col2 int as (abs(z0_col0-z0_col1)))
partition by range columns(z0_col2) (
partition p0 values less than (10),
partition p1 values less than (20),
partition p2 values less than maxvalue);
insert into virtual_table (z0_col0,z0_col1) values (0,0),(NULL,NULL),(5,25),(20,30),(100,10);
select z0_col0,z0_col1,z0_col2 from virtual_table partition(p0) order by z0_col2;
+---------+---------+---------+
| z0_col0 | z0_col1 | z0_col2 |
+---------+---------+---------+
|    NULL |    NULL |    NULL |
|       0 |       0 |       0 |
+---------+---------+---------+
select z0_col0,z0_col1,z0_col2 from virtual_table partition(p1) order by z0_col2;
+---------+---------+---------+
| z0_col0 | z0_col1 | z0_col2 |
+---------+---------+---------+
|      20 |      30 |      10 |
+---------+---------+---------+
select z0_col0,z0_col1,z0_col2 from virtual_table partition(p2) order by z0_col2;
+---------+---------+---------+
| z0_col0 | z0_col1 | z0_col2 |
+---------+---------+---------+
|       5 |      25 |      20 |
|     100 |      10 |      90 |
+---------+---------+---------+
explain select z0_col0,z0_col1,z0_col2 from virtual_table where z0_col2 = 0 order by z0_col2;
Query Plan
========================================================
|ID|OPERATOR       |NAME         |EST.ROWS|EST.TIME(us)|
--------------------------------------------------------
|0 |TABLE FULL SCAN|virtual_table|1       |3           |
========================================================
Outputs & filters:
-------------------------------------
  0 - output([virtual_table.z0_col0], [virtual_table.z0_col1], [column_conv(INT,PS:(11,0),NULL,cast(abs(virtual_table.z0_col0 - virtual_table.z0_col1), 
      INT(-1, 0)))]), filter([column_conv(INT,PS:(11,0),NULL,cast(abs(virtual_table.z0_col0 - virtual_table.z0_col1), INT(-1, 0))) = 0])
      access([virtual_table.z0_col0], [virtual_table.z0_col1]), partitions(p0)
      is_index_back=false, is_global_index=false, filter_before_indexback[false], 
      range_key([virtual_table.__pk_increment]), range(MIN ; MAX)always true
explain select z0_col0,z0_col1,z0_col2 from virtual_table where abs(z0_col0-z0_col1) = 0 order by z0_col2;
Query Plan
====================================================================
|ID|OPERATOR                   |NAME         |EST.ROWS|EST.TIME(us)|
--------------------------------------------------------------------
|0 |PX COORDINATOR MERGE SORT  |             |1       |9           |
|1 |└─EXCHANGE OUT DISTR       |:EX10000     |1       |8           |
|2 |  └─SORT                   |             |1       |7           |
|3 |    └─PX PARTITION ITERATOR|             |1       |7           |
|4 |      └─TABLE FULL SCAN    |virtual_table|1       |7           |
====================================================================
Outputs & filters:
-------------------------------------
  0 - output([INTERNAL_FUNCTION(virtual_table.z0_col0, virtual_table.z0_col1, column_conv(INT,PS:(11,0),NULL,cast(abs(virtual_table.z0_col0 - virtual_table.z0_col1),
       INT(-1, 0))))]), filter(nil)
      sort_keys([column_conv(INT,PS:(11,0),NULL,cast(abs(virtual_table.z0_col0 - virtual_table.z0_col1), INT(-1, 0))), ASC])
  1 - output([column_conv(INT,PS:(11,0),NULL,cast(abs(virtual_table.z0_col0 - virtual_table.z0_col1), INT(-1, 0)))], [INTERNAL_FUNCTION(virtual_table.z0_col0,
       virtual_table.z0_col1, column_conv(INT,PS:(11,0),NULL,cast(abs(virtual_table.z0_col0 - virtual_table.z0_col1), INT(-1, 0))))]), filter(nil)
      dop=1
  2 - output([column_conv(INT,PS:(11,0),NULL,cast(abs(virtual_table.z0_col0 - virtual_table.z0_col1), INT(-1, 0)))], [virtual_table.z0_col0], [virtual_table.z0_col1]), filter(nil)
      sort_keys([column_conv(INT,PS:(11,0),NULL,cast(abs(virtual_table.z0_col0 - virtual_table.z0_col1), INT(-1, 0))), ASC])
  3 - output([virtual_table.z0_col0], [virtual_table.z0_col1], [column_conv(INT,PS:(11,0),NULL,cast(abs(virtual_table.z0_col0 - virtual_table.z0_col1), 
      INT(-1, 0)))]), filter(nil)
      force partition granule
  4 - output([virtual_table.z0_col0], [virtual_table.z0_col1], [column_conv(INT,PS:(11,0),NULL,cast(abs(virtual_table.z0_col0 - virtual_table.z0_col1), 
      INT(-1, 0)))]), filter([abs(virtual_table.z0_col0 - virtual_table.z0_col1) = 0])
      access([virtual_table.z0_col0], [virtual_table.z0_col1]), partitions(p[0-2])
      is_index_back=false, is_global_index=false, filter_before_indexback[false], 
      range_key([virtual_table.__pk_increment]), range(MIN ; MAX)always true
drop table stored_table;
create table stored_table(
z0_col0 int,
z0_col1 int,
z0_col2 int as (abs(z0_col0-z0_col1)) stored)
partition by range columns(z0_col2) (
partition p0 values less than (10),
partition p1 values less than (20),
partition p2 values less than maxvalue);
insert into stored_table (z0_col0,z0_col1) values (0,0),(NULL,NULL),(5,25),(20,30),(100,10);
select z0_col0,z0_col1,z0_col2 from stored_table partition(p0) order by z0_col2;
+---------+---------+---------+
| z0_col0 | z0_col1 | z0_col2 |
+---------+---------+---------+
|    NULL |    NULL |    NULL |
|       0 |       0 |       0 |
+---------+---------+---------+
select z0_col0,z0_col1,z0_col2 from stored_table partition(p1) order by z0_col2;
+---------+---------+---------+
| z0_col0 | z0_col1 | z0_col2 |
+---------+---------+---------+
|      20 |      30 |      10 |
+---------+---------+---------+
select z0_col0,z0_col1,z0_col2 from stored_table partition(p2) order by z0_col2;
+---------+---------+---------+
| z0_col0 | z0_col1 | z0_col2 |
+---------+---------+---------+
|       5 |      25 |      20 |
|     100 |      10 |      90 |
+---------+---------+---------+
explain select z0_col0,z0_col1,z0_col2 from stored_table where z0_col2 = 0 order by z0_col2;
Query Plan
=======================================================
|ID|OPERATOR       |NAME        |EST.ROWS|EST.TIME(us)|
-------------------------------------------------------
|0 |TABLE FULL SCAN|stored_table|1       |3           |
=======================================================
Outputs & filters:
-------------------------------------
  0 - output([stored_table.z0_col0], [stored_table.z0_col1], [stored_table.z0_col2]), filter([stored_table.z0_col2 = 0])
      access([stored_table.z0_col0], [stored_table.z0_col1], [stored_table.z0_col2]), partitions(p0)
      is_index_back=false, is_global_index=false, filter_before_indexback[false], 
      range_key([stored_table.__pk_increment]), range(MIN ; MAX)always true
explain select z0_col0,z0_col1,z0_col2 from stored_table where abs(z0_col0-z0_col1) = 0 order by z0_col2;
Query Plan
===================================================================
|ID|OPERATOR                   |NAME        |EST.ROWS|EST.TIME(us)|
-------------------------------------------------------------------
|0 |PX COORDINATOR MERGE SORT  |            |1       |9           |
|1 |└─EXCHANGE OUT DISTR       |:EX10000    |1       |8           |
|2 |  └─SORT                   |            |1       |7           |
|3 |    └─PX PARTITION ITERATOR|            |1       |7           |
|4 |      └─TABLE FULL SCAN    |stored_table|1       |7           |
===================================================================
Outputs & filters:
-------------------------------------
  0 - output([INTERNAL_FUNCTION(stored_table.z0_col0, stored_table.z0_col1, stored_table.z0_col2)]), filter(nil)
      sort_keys([stored_table.z0_col2, ASC])
  1 - output([stored_table.z0_col2], [INTERNAL_FUNCTION(stored_table.z0_col0, stored_table.z0_col1, stored_table.z0_col2)]), filter(nil)
      dop=1
  2 - output([stored_table.z0_col2], [stored_table.z0_col0], [stored_table.z0_col1]), filter(nil)
      sort_keys([stored_table.z0_col2, ASC])
  3 - output([stored_table.z0_col0], [stored_table.z0_col1], [stored_table.z0_col2]), filter(nil)
      force partition granule
  4 - output([stored_table.z0_col0], [stored_table.z0_col1], [stored_table.z0_col2]), filter([abs(stored_table.z0_col0 - stored_table.z0_col1) = 0])
      access([stored_table.z0_col0], [stored_table.z0_col1], [stored_table.z0_col2]), partitions(p[0-2])
      is_index_back=false, is_global_index=false, filter_before_indexback[false], 
      range_key([stored_table.__pk_increment]), range(MIN ; MAX)always true
### 视图
# 单基表 含有虚拟列(VIRTUAL)的表
drop table virtual_table;
create table virtual_table(
z0_col0 char(100), 
z0_col1 varchar(100),
z0_col2 varchar(100) as (concat(z0_col0,z0_col1)) virtual);
insert into virtual_table (z0_col0,z0_col1) values (0,0),(NULL,NULL),('2022-06-21','ten'),(100,10.00);
select z0_col0,z0_col1,z0_col2 from virtual_table order by z0_col2;
+------------+---------+---------------+
| z0_col0    | z0_col1 | z0_col2       |
+------------+---------+---------------+
| NULL       | NULL    | NULL          |
| 0          | 0       | 00            |
| 100        | 10.00   | 10010.00      |
| 2022-06-21 | ten     | 2022-06-21ten |
+------------+---------+---------------+
drop view view1;
create view view1 as select z0_col0,z0_col1,z0_col2 from virtual_table where length(z0_col2)>1 order by 1;
select * from view1 order by 1;
+------------+---------+---------------+
| z0_col0    | z0_col1 | z0_col2       |
+------------+---------+---------------+
| 0          | 0       | 00            |
| 100        | 10.00   | 10010.00      |
| 2022-06-21 | ten     | 2022-06-21ten |
+------------+---------+---------------+
insert into view1 (z0_col0,z0_col1) values ('view-','-insert');
select * from view1 order by 1;
+------------+---------+---------------+
| z0_col0    | z0_col1 | z0_col2       |
+------------+---------+---------------+
| 0          | 0       | 00            |
| 100        | 10.00   | 10010.00      |
| 2022-06-21 | ten     | 2022-06-21ten |
| view-      | -insert | view--insert  |
+------------+---------+---------------+
update  view1 set z0_col2=0 where 1=1;
ERROR HY000: The value specified for generated column 'z0_col2' in table 'view1' is not allowed
# 单基表 含有生成列(STORED)的表
drop table stored_table;
create table stored_table (
z0_col0 char(100), 
z0_col1 varchar(100),
z0_col2 varchar(100) as (concat(z0_col0,z0_col1)) stored);
insert into stored_table (z0_col0,z0_col1) values (0,0),(NULL,NULL),('2022-06-21','ten'),(100,10.00);
select z0_col0,z0_col1,z0_col2 from stored_table order by z0_col2;
+------------+---------+---------------+
| z0_col0    | z0_col1 | z0_col2       |
+------------+---------+---------------+
| NULL       | NULL    | NULL          |
| 0          | 0       | 00            |
| 100        | 10.00   | 10010.00      |
| 2022-06-21 | ten     | 2022-06-21ten |
+------------+---------+---------------+
drop view view1;
create view view1 as select z0_col0,z0_col1,z0_col2 from stored_table where length(z0_col2)>1 order by 1;
select * from view1 order by z0_col2;
+------------+---------+---------------+
| z0_col0    | z0_col1 | z0_col2       |
+------------+---------+---------------+
| 0          | 0       | 00            |
| 100        | 10.00   | 10010.00      |
| 2022-06-21 | ten     | 2022-06-21ten |
+------------+---------+---------------+
insert into view1 (z0_col0,z0_col1) values ('view-','-insert');
select * from view1 order by z0_col2;
+------------+---------+---------------+
| z0_col0    | z0_col1 | z0_col2       |
+------------+---------+---------------+
| 0          | 0       | 00            |
| 100        | 10.00   | 10010.00      |
| 2022-06-21 | ten     | 2022-06-21ten |
| view-      | -insert | view--insert  |
+------------+---------+---------------+
update  view1 set z0_col2=0 where 1=1;
ERROR HY000: The value specified for generated column 'z0_col2' in table 'view1' is not allowed
# 单基表 普通的表，后追加生成列(VIRTUAL/STORED)
drop table stored_table;
create table stored_table (
z0_col0 char(100), 
z0_col1 varchar(100));
alter table stored_table add z0_col2 varchar(100) as (concat(z0_col0,z0_col1)) virtual;
alter table stored_table add z0_col3 varchar(100) as (lower(concat(z0_col0,z0_col1))) stored;
insert into stored_table (z0_col0,z0_col1) values (0,0),(NULL,NULL),('2022-06-21','ten'),('WANGHUANHUAN ','CHINA');
select z0_col0,z0_col1,z0_col2,z0_col3 from stored_table order by z0_col1;
+--------------+---------+-------------------+-------------------+
| z0_col0      | z0_col1 | z0_col2           | z0_col3           |
+--------------+---------+-------------------+-------------------+
| NULL         | NULL    | NULL              | NULL              |
| 0            | 0       | 00                | 00                |
| WANGHUANHUAN | CHINA   | WANGHUANHUANCHINA | wanghuanhuanchina |
| 2022-06-21   | ten     | 2022-06-21ten     | 2022-06-21ten     |
+--------------+---------+-------------------+-------------------+
drop view view1;
create view view1 as select * from stored_table;
select * from view1 order by z0_col2;
+--------------+---------+-------------------+-------------------+
| z0_col0      | z0_col1 | z0_col2           | z0_col3           |
+--------------+---------+-------------------+-------------------+
| NULL         | NULL    | NULL              | NULL              |
| 0            | 0       | 00                | 00                |
| 2022-06-21   | ten     | 2022-06-21ten     | 2022-06-21ten     |
| WANGHUANHUAN | CHINA   | WANGHUANHUANCHINA | wanghuanhuanchina |
+--------------+---------+-------------------+-------------------+
update  view1 set z0_col2=0 where 1=1;
ERROR HY000: The value specified for generated column 'z0_col2' in table 'view1' is not allowed
# 单基表 两个含有虚拟列(VIRTUAL)的表
drop table virtual_table1;
create  table virtual_table1 (
id int,
z0_col0 char(100), 
z0_col1 varchar(100),
z0_col2 varchar(100) as (concat(z0_col0,z0_col1)) virtual);
insert into virtual_table1 (id,z0_col0,z0_col1) values (0,0,0),(1,NULL,NULL),(2,'virtual_table1','one'),(3,100,10.00);
select id,z0_col0,z0_col1,z0_col2 from virtual_table1 order by z0_col2;
+------+----------------+---------+-------------------+
| id   | z0_col0        | z0_col1 | z0_col2           |
+------+----------------+---------+-------------------+
|    1 | NULL           | NULL    | NULL              |
|    0 | 0              | 0       | 00                |
|    3 | 100            | 10.00   | 10010.00          |
|    2 | virtual_table1 | one     | virtual_table1one |
+------+----------------+---------+-------------------+
drop table virtual_table2;
create  table virtual_table2 (
id int,
z1_col0 char(100), 
z1_col1 varchar(100),
z1_col2 varchar(100) as (concat(z1_col0,z1_col1)) virtual);
insert into virtual_table2 (id,z1_col0,z1_col1) values (0,0,0),(1,NULL,NULL),(2,'virtual_table2','two'),(3,200,20.00);
select id,z1_col0,z1_col1,z1_col2 from virtual_table2 order by z1_col2;
+------+----------------+---------+-------------------+
| id   | z1_col0        | z1_col1 | z1_col2           |
+------+----------------+---------+-------------------+
|    1 | NULL           | NULL    | NULL              |
|    0 | 0              | 0       | 00                |
|    3 | 200            | 20.00   | 20020.00          |
|    2 | virtual_table2 | two     | virtual_table2two |
+------+----------------+---------+-------------------+
drop view view1;
create view view1 as select t1.z0_col0,t1.z0_col1,t1.z0_col2,t2.z1_col0,t2.z1_col1,t2.z1_col2 from virtual_table1 t1 inner join virtual_table2 t2 on t1.id=t2.id order by 1;
select * from view1 order by 1;
+----------------+---------+-------------------+----------------+---------+-------------------+
| z0_col0        | z0_col1 | z0_col2           | z1_col0        | z1_col1 | z1_col2           |
+----------------+---------+-------------------+----------------+---------+-------------------+
| NULL           | NULL    | NULL              | NULL           | NULL    | NULL              |
| 0              | 0       | 00                | 0              | 0       | 00                |
| 100            | 10.00   | 10010.00          | 200            | 20.00   | 20020.00          |
| virtual_table1 | one     | virtual_table1one | virtual_table2 | two     | virtual_table2two |
+----------------+---------+-------------------+----------------+---------+-------------------+
insert into view1 (z0_col0,z0_col1,z1_col0,z1_col1) values ('view-','-insert1','view-','-insert2');
ERROR HY000: Can not modify more than one base table through a join view 'whh.view1'
# 单基表 两个含有生成列(STORED)的表
drop table stored_table1;
create  table stored_table1 (
id int,
z0_col0 char(100), 
z0_col1 varchar(100),
z0_col2 varchar(100) as (concat(z0_col0,z0_col1)) stored);
insert into stored_table1 (id,z0_col0,z0_col1) values (0,0,0),(1,NULL,NULL),(2,'stored_table1','one'),(3,100,10.00);
select id,z0_col0,z0_col1,z0_col2 from stored_table1 order by z0_col2;
+------+---------------+---------+------------------+
| id   | z0_col0       | z0_col1 | z0_col2          |
+------+---------------+---------+------------------+
|    1 | NULL          | NULL    | NULL             |
|    0 | 0             | 0       | 00               |
|    3 | 100           | 10.00   | 10010.00         |
|    2 | stored_table1 | one     | stored_table1one |
+------+---------------+---------+------------------+
drop table stored_table2;
create  table stored_table2 (
id int,
z1_col0 char(100), 
z1_col1 varchar(100),
z1_col2 varchar(100) as (concat(z1_col0,z1_col1)) stored);
insert into stored_table2 (id,z1_col0,z1_col1) values (0,0,0),(1,NULL,NULL),(2,'stored_table2','two'),(3,200,20.00);
select id,z1_col0,z1_col1,z1_col2 from stored_table2 order by z1_col2;
+------+---------------+---------+------------------+
| id   | z1_col0       | z1_col1 | z1_col2          |
+------+---------------+---------+------------------+
|    1 | NULL          | NULL    | NULL             |
|    0 | 0             | 0       | 00               |
|    3 | 200           | 20.00   | 20020.00         |
|    2 | stored_table2 | two     | stored_table2two |
+------+---------------+---------+------------------+
drop view view1;
create view view1 as select t1.z0_col0,t1.z0_col1,t1.z0_col2,t2.z1_col0,t2.z1_col1,t2.z1_col2 from stored_table1 t1 inner join stored_table2 t2 on t1.id=t2.id order by 1;
select * from view1 order by z0_col2;
+---------------+---------+------------------+---------------+---------+------------------+
| z0_col0       | z0_col1 | z0_col2          | z1_col0       | z1_col1 | z1_col2          |
+---------------+---------+------------------+---------------+---------+------------------+
| NULL          | NULL    | NULL             | NULL          | NULL    | NULL             |
| 0             | 0       | 00               | 0             | 0       | 00               |
| 100           | 10.00   | 10010.00         | 200           | 20.00   | 20020.00         |
| stored_table1 | one     | stored_table1one | stored_table2 | two     | stored_table2two |
+---------------+---------+------------------+---------------+---------+------------------+
insert into view1 (z0_col0,z0_col1,z1_col0,z1_col1) values ('view-','-insert1','view-','-insert2');
ERROR HY000: Can not modify more than one base table through a join view 'whh.view1'
# 单基表 一个含有虚拟列(VIRTUAL)的表，一个含有生成列(STORED)的表
drop table virtual_table1;
create  table virtual_table1 (
id int,
z0_col0 char(100), 
z0_col1 varchar(100),
z0_col2 varchar(100) as (concat(z0_col0,z0_col1)) virtual);
insert into virtual_table1 (id,z0_col0,z0_col1) values (0,0,0),(1,NULL,NULL),(2,'virtual_table1','one'),(3,100,10.00);
select id,z0_col0,z0_col1,z0_col2 from virtual_table1 order by z0_col2;
+------+----------------+---------+-------------------+
| id   | z0_col0        | z0_col1 | z0_col2           |
+------+----------------+---------+-------------------+
|    1 | NULL           | NULL    | NULL              |
|    0 | 0              | 0       | 00                |
|    3 | 100            | 10.00   | 10010.00          |
|    2 | virtual_table1 | one     | virtual_table1one |
+------+----------------+---------+-------------------+
drop table stored_table2;
create  table stored_table2 (
id int,
z1_col0 char(100), 
z1_col1 varchar(100),
z1_col2 varchar(100) as (concat(z1_col0,z1_col1)) stored);
insert into stored_table2 (id,z1_col0,z1_col1) values (0,0,0),(1,NULL,NULL),(2,'stored_table2','two'),(3,200,20.00);
select id,z1_col0,z1_col1,z1_col2 from stored_table2 order by z1_col2;
+------+---------------+---------+------------------+
| id   | z1_col0       | z1_col1 | z1_col2          |
+------+---------------+---------+------------------+
|    1 | NULL          | NULL    | NULL             |
|    0 | 0             | 0       | 00               |
|    3 | 200           | 20.00   | 20020.00         |
|    2 | stored_table2 | two     | stored_table2two |
+------+---------------+---------+------------------+
drop view view1;
create view view1 as select t1.z0_col0,t1.z0_col1,t1.z0_col2,t2.z1_col0,t2.z1_col1,t2.z1_col2 from virtual_table1 t1 inner join stored_table2 t2 on t1.id=t2.id order by 1;
select * from view1 order by z0_col2;
+----------------+---------+-------------------+---------------+---------+------------------+
| z0_col0        | z0_col1 | z0_col2           | z1_col0       | z1_col1 | z1_col2          |
+----------------+---------+-------------------+---------------+---------+------------------+
| NULL           | NULL    | NULL              | NULL          | NULL    | NULL             |
| 0              | 0       | 00                | 0             | 0       | 00               |
| 100            | 10.00   | 10010.00          | 200           | 20.00   | 20020.00         |
| virtual_table1 | one     | virtual_table1one | stored_table2 | two     | stored_table2two |
+----------------+---------+-------------------+---------------+---------+------------------+
insert into view1 (z0_col0,z0_col1,z1_col0,z1_col1) values ('view-','-insert1','view-','-insert2');
ERROR HY000: Can not modify more than one base table through a join view 'whh.view1'
### ALTER TABLE 语句
# RENAME 重命名表
drop table test_table;
create table test_table(
z0_col0 float, 
z0_col1 float,
z0_col2 float as(z0_col0+z0_col1) virtual,
z0_col3 float as(floor(z0_col0+z0_col1)) stored
);
insert into test_table (z0_col0,z0_col1) values (0,0),(NULL,NULL),(1.111,22.2),(10.5,10.9),(-100.5,20.9);
select z0_col0,z0_col1,z0_col2,abs(z0_col3) from test_table order by z0_col2;
+---------+---------+---------+--------------+
| z0_col0 | z0_col1 | z0_col2 | abs(z0_col3) |
+---------+---------+---------+--------------+
|    NULL |    NULL |    NULL |         NULL |
|  -100.5 |    20.9 |   -79.6 |           80 |
|       0 |       0 |       0 |            0 |
|    10.5 |    10.9 |    21.4 |           21 |
|   1.111 |    22.2 |  23.311 |           23 |
+---------+---------+---------+--------------+
select max(z0_col2),min(z0_col3) from test_table order by z0_col2;
+--------------+--------------+
| max(z0_col2) | min(z0_col3) |
+--------------+--------------+
|       23.311 |          -80 |
+--------------+--------------+
drop table new_test_table;
alter table test_table rename to new_test_table;
insert into new_test_table (z0_col0,z0_col1) values (100,200);
select z0_col0,z0_col1,z0_col2,abs(z0_col3) from new_test_table order by z0_col2;
+---------+---------+---------+--------------+
| z0_col0 | z0_col1 | z0_col2 | abs(z0_col3) |
+---------+---------+---------+--------------+
|    NULL |    NULL |    NULL |         NULL |
|  -100.5 |    20.9 |   -79.6 |           80 |
|       0 |       0 |       0 |            0 |
|    10.5 |    10.9 |    21.4 |           21 |
|   1.111 |    22.2 |  23.311 |           23 |
|     100 |     200 |     300 |          300 |
+---------+---------+---------+--------------+
# RENAME COLUMN 重命名生成列 ob不支持重命名列名，报ERROR 1064.
drop table test_table1;
create table test_table1(
z0_col0 int,
z0_col1 int,
z0_col2 int as(abs(z0_col0)) virtual,
z0_col3 int as(power(z0_col1,2)) stored
);
insert into test_table1 (z0_col0,z0_col1) values (0,10),(-20,20),(3.50,30);
select * from test_table1 order by z0_col2;
+---------+---------+---------+---------+
| z0_col0 | z0_col1 | z0_col2 | z0_col3 |
+---------+---------+---------+---------+
|       0 |      10 |       0 |     100 |
|       4 |      30 |       4 |     900 |
|     -20 |      20 |      20 |     400 |
+---------+---------+---------+---------+
alter table test_table1 rename column z0_col2 to new_z0_col2;
alter table test_table1 rename column z0_col3 to new_z0_col3;
insert into new_test_table (z0_col0,z0_col1) values (5.5,10.6);
select z0_col0,z0_col1,z0_col2,abs(z0_col3) from new_test_table order by z0_col2;
+---------+---------+---------+--------------+
| z0_col0 | z0_col1 | z0_col2 | abs(z0_col3) |
+---------+---------+---------+--------------+
|    NULL |    NULL |    NULL |         NULL |
|  -100.5 |    20.9 |   -79.6 |           80 |
|       0 |       0 |       0 |            0 |
|     5.5 |    10.6 |    16.1 |           16 |
|    10.5 |    10.9 |    21.4 |           21 |
|   1.111 |    22.2 |  23.311 |           23 |
|     100 |     200 |     300 |          300 |
+---------+---------+---------+--------------+
# RENAME COLUMN 重命名生成列引用的普通列
alter table test_table1 rename column z0_col0 to new_z0_col0;
ERROR HY000: Column 'z0_col0' has a generated column dependency
insert into new_test_table (z0_col0,z0_col1) values (-40,5);
select z0_col0,z0_col1,z0_col2,abs(z0_col3) from new_test_table order by z0_col2;
+---------+---------+---------+--------------+
| z0_col0 | z0_col1 | z0_col2 | abs(z0_col3) |
+---------+---------+---------+--------------+
|    NULL |    NULL |    NULL |         NULL |
|  -100.5 |    20.9 |   -79.6 |           80 |
|     -40 |       5 |     -35 |           35 |
|       0 |       0 |       0 |            0 |
|     5.5 |    10.6 |    16.1 |           16 |
|    10.5 |    10.9 |    21.4 |           21 |
|   1.111 |    22.2 |  23.311 |           23 |
|     100 |     200 |     300 |          300 |
+---------+---------+---------+--------------+
# MODIFY 修改生成列 虚拟生成列-》存储生成列
drop table test_table;
create table test_table(
z0_col0 float, 
z0_col1 float,
z0_col2 float as(z0_col0/z0_col1) virtual
);
insert into test_table (z0_col0,z0_col1) values (0,0),(NULL,NULL),(1.111,22.2),(10.5,10.9),(-100.5,20.9);
select z0_col0,z0_col1,z0_col2 from test_table order by z0_col2;
+---------+---------+----------+
| z0_col0 | z0_col1 | z0_col2  |
+---------+---------+----------+
|       0 |       0 |     NULL |
|    NULL |    NULL |     NULL |
|  -100.5 |    20.9 | -4.80861 |
|   1.111 |    22.2 | 0.050045 |
|    10.5 |    10.9 | 0.963303 |
+---------+---------+----------+
alter table test_table modify z0_col2 float as(z0_col0/z0_col1) stored;
Got one of the listed errors
# MODIFY 修改生成列 虚拟生成列-》普通列
drop table test_table;
create table test_table(
z0_col0 float, 
z0_col1 float,
z0_col2 float as(z0_col0/z0_col1) virtual
);
insert into test_table (z0_col0,z0_col1) values (0,0),(NULL,NULL),(1.111,22.2),(10.5,10.9),(-100.5,20.9);
select z0_col0,z0_col1,z0_col2 from test_table order by z0_col2;
+---------+---------+----------+
| z0_col0 | z0_col1 | z0_col2  |
+---------+---------+----------+
|       0 |       0 |     NULL |
|    NULL |    NULL |     NULL |
|  -100.5 |    20.9 | -4.80861 |
|   1.111 |    22.2 | 0.050045 |
|    10.5 |    10.9 | 0.963303 |
+---------+---------+----------+
alter table test_table modify z0_col2 float;
Got one of the listed errors
# MODIFY 修改生成列 存储生成列-》虚拟生成列
drop table test_table;
create table test_table(
z0_col0 float, 
z0_col1 float,
z0_col2 float as(z0_col0/z0_col1) stored
);
insert into test_table (z0_col0,z0_col1) values (0,0),(NULL,NULL),(1.111,22.2),(10.5,10.9),(-100.5,20.9);
select z0_col0,z0_col1,z0_col2 from test_table order by z0_col2;
+---------+---------+----------+
| z0_col0 | z0_col1 | z0_col2  |
+---------+---------+----------+
|       0 |       0 |     NULL |
|    NULL |    NULL |     NULL |
|  -100.5 |    20.9 | -4.80861 |
|   1.111 |    22.2 | 0.050045 |
|    10.5 |    10.9 | 0.963303 |
+---------+---------+----------+
alter table test_table modify z0_col2 float as(z0_col0/z0_col1) virtual;
Got one of the listed errors
show create table test_table;
Table	Create Table
test_table	CREATE TABLE `test_table` (
  `z0_col0` float DEFAULT NULL,
  `z0_col1` float DEFAULT NULL,
  `z0_col2` float GENERATED ALWAYS AS ((`z0_col0` / `z0_col1`)) STORED
) ORGANIZATION INDEX DEFAULT CHARSET = utf8mb4 ROW_FORMAT = DYNAMIC COMPRESSION = 'zstd_1.3.8' REPLICA_NUM = 1 BLOCK_SIZE = 16384 USE_BLOOM_FILTER = FALSE ENABLE_MACRO_BLOCK_BLOOM_FILTER = FALSE TABLET_SIZE = 134217728 PCTFREE = 0
# MODIFY 修改生成列 存储生成列-》普通列
# bug1:【Generated Columns】OB Mysql模式，将存储生成列更改为普通列,mysql成功，ob失败。
drop table test_table;
create table test_table(
z0_col0 float, 
z0_col1 float,
z0_col2 float as(z0_col0/z0_col1) stored
);
insert into test_table (z0_col0,z0_col1) values (0,0),(NULL,NULL),(1.111,22.2),(10.5,10.9),(-100.5,20.9);
select z0_col0,z0_col1,z0_col2 from test_table order by z0_col2;
+---------+---------+----------+
| z0_col0 | z0_col1 | z0_col2  |
+---------+---------+----------+
|       0 |       0 |     NULL |
|    NULL |    NULL |     NULL |
|  -100.5 |    20.9 | -4.80861 |
|   1.111 |    22.2 | 0.050045 |
|    10.5 |    10.9 | 0.963303 |
+---------+---------+----------+
alter table test_table modify z0_col2 float;
Got one of the listed errors
select z0_col0,z0_col1,z0_col2 from test_table order by z0_col2;
+---------+---------+----------+
| z0_col0 | z0_col1 | z0_col2  |
+---------+---------+----------+
|       0 |       0 |     NULL |
|    NULL |    NULL |     NULL |
|  -100.5 |    20.9 | -4.80861 |
|   1.111 |    22.2 | 0.050045 |
|    10.5 |    10.9 | 0.963303 |
+---------+---------+----------+
show create table test_table;
Table	Create Table
test_table	CREATE TABLE `test_table` (
  `z0_col0` float DEFAULT NULL,
  `z0_col1` float DEFAULT NULL,
  `z0_col2` float GENERATED ALWAYS AS ((`z0_col0` / `z0_col1`)) STORED
) ORGANIZATION INDEX DEFAULT CHARSET = utf8mb4 ROW_FORMAT = DYNAMIC COMPRESSION = 'zstd_1.3.8' REPLICA_NUM = 1 BLOCK_SIZE = 16384 USE_BLOOM_FILTER = FALSE ENABLE_MACRO_BLOCK_BLOOM_FILTER = FALSE TABLET_SIZE = 134217728 PCTFREE = 0
# MODIFY 修改生成列 普通列-》虚拟生成列
drop table test_table;
create table test_table(
z0_col0 float, 
z0_col1 float,
z0_col2 float
);
insert into test_table (z0_col0,z0_col1) values (0,0),(NULL,NULL),(1.111,22.2),(10.5,10.9),(-100.5,20.9);
select z0_col0,z0_col1,z0_col2 from test_table order by z0_col2;
+---------+---------+---------+
| z0_col0 | z0_col1 | z0_col2 |
+---------+---------+---------+
|       0 |       0 |    NULL |
|    NULL |    NULL |    NULL |
|   1.111 |    22.2 |    NULL |
|    10.5 |    10.9 |    NULL |
|  -100.5 |    20.9 |    NULL |
+---------+---------+---------+
alter table test_table modify z0_col2 float as(z0_col0/z0_col1) virtual;
Got one of the listed errors
select z0_col0,z0_col1,z0_col2 from test_table order by z0_col2;
+---------+---------+---------+
| z0_col0 | z0_col1 | z0_col2 |
+---------+---------+---------+
|       0 |       0 |    NULL |
|    NULL |    NULL |    NULL |
|   1.111 |    22.2 |    NULL |
|    10.5 |    10.9 |    NULL |
|  -100.5 |    20.9 |    NULL |
+---------+---------+---------+
show create table test_table;
Table	Create Table
test_table	CREATE TABLE `test_table` (
  `z0_col0` float DEFAULT NULL,
  `z0_col1` float DEFAULT NULL,
  `z0_col2` float DEFAULT NULL
) ORGANIZATION INDEX DEFAULT CHARSET = utf8mb4 ROW_FORMAT = DYNAMIC COMPRESSION = 'zstd_1.3.8' REPLICA_NUM = 1 BLOCK_SIZE = 16384 USE_BLOOM_FILTER = FALSE ENABLE_MACRO_BLOCK_BLOOM_FILTER = FALSE TABLET_SIZE = 134217728 PCTFREE = 0
# MODIFY 修改生成列 普通列-》存储生成列
# bug2:【Generated Columns】OB Mysql模式，将普通列更改为存储生成列,mysql成功，ob失败。
drop table test_table;
create table test_table(
z0_col0 float, 
z0_col1 float,
z0_col2 float
);
insert into test_table (z0_col0,z0_col1) values (0,0),(NULL,NULL),(1.111,22.2),(10.5,10.9),(-100.5,20.9);
select z0_col0,z0_col1,z0_col2 from test_table order by z0_col2;
+---------+---------+---------+
| z0_col0 | z0_col1 | z0_col2 |
+---------+---------+---------+
|       0 |       0 |    NULL |
|    NULL |    NULL |    NULL |
|   1.111 |    22.2 |    NULL |
|    10.5 |    10.9 |    NULL |
|  -100.5 |    20.9 |    NULL |
+---------+---------+---------+
alter table test_table modify z0_col2 float as(z0_col0/z0_col1) stored;
Got one of the listed errors
insert into test_table (z0_col0,z0_col1) values (10,40);
select z0_col0,z0_col1,z0_col2 from test_table order by z0_col2;
+---------+---------+---------+
| z0_col0 | z0_col1 | z0_col2 |
+---------+---------+---------+
|       0 |       0 |    NULL |
|    NULL |    NULL |    NULL |
|   1.111 |    22.2 |    NULL |
|    10.5 |    10.9 |    NULL |
|  -100.5 |    20.9 |    NULL |
|      10 |      40 |    NULL |
+---------+---------+---------+
show create table test_table;
Table	Create Table
test_table	CREATE TABLE `test_table` (
  `z0_col0` float DEFAULT NULL,
  `z0_col1` float DEFAULT NULL,
  `z0_col2` float DEFAULT NULL
) ORGANIZATION INDEX DEFAULT CHARSET = utf8mb4 ROW_FORMAT = DYNAMIC COMPRESSION = 'zstd_1.3.8' REPLICA_NUM = 1 BLOCK_SIZE = 16384 USE_BLOOM_FILTER = FALSE ENABLE_MACRO_BLOCK_BLOOM_FILTER = FALSE TABLET_SIZE = 134217728 PCTFREE = 0
# MODIFY 修改生成列的数据类型
# bug3:【Generated Columns】OB Mysql模式，修改生成列的数据类型（modify/change）,mysql成功，ob失败。
drop table test_table1;
create table test_table1(
z0_col0 float,
z0_col1 float,
z0_col2 int as(floor(z0_col0)) virtual,
z0_col3 int as(ceiling(z0_col1)) stored
);
insert into test_table1 (z0_col0,z0_col1) values (1.2,1.8),(2.4,2.6),(3.5,3.3);
select * from test_table1 order by z0_col2;
+---------+---------+---------+---------+
| z0_col0 | z0_col1 | z0_col2 | z0_col3 |
+---------+---------+---------+---------+
|     1.2 |     1.8 |       1 |       2 |
|     2.4 |     2.6 |       2 |       3 |
|     3.5 |     3.3 |       3 |       4 |
+---------+---------+---------+---------+
alter table test_table1 modify z0_col2 double as(floor(z0_col0)) virtual;
alter table test_table1 modify z0_col3 double as(ceiling(z0_col0)) stored;
Got one of the listed errors
insert into test_table1 (z0_col0,z0_col1) values (5.123,5.678);
select * from test_table1 order by z0_col2;
+---------+---------+---------+---------+
| z0_col0 | z0_col1 | z0_col2 | z0_col3 |
+---------+---------+---------+---------+
|     1.2 |     1.8 |       1 |       2 |
|     2.4 |     2.6 |       2 |       3 |
|     3.5 |     3.3 |       3 |       4 |
|   5.123 |   5.678 |       5 |       6 |
+---------+---------+---------+---------+
# MODIFY 修改生成列引用的普通列
alter table test_table1 modify z0_col0 double;
alter table test_table1 modify z0_col1 double;
insert into test_table1 (z0_col0,z0_col1) values (4.123,4.678);
select * from test_table1 order by z0_col2;
+--------------------+--------------------+---------+---------+
| z0_col0            | z0_col1            | z0_col2 | z0_col3 |
+--------------------+--------------------+---------+---------+
| 1.2000000476837158 | 1.7999999523162842 |       1 |       2 |
| 2.4000000953674316 | 2.5999999046325684 |       2 |       3 |
|                3.5 |  3.299999952316284 |       3 |       4 |
|              4.123 |              4.678 |       4 |       5 |
|  5.123000144958496 |  5.677999973297119 |       5 |       6 |
+--------------------+--------------------+---------+---------+
# CHANGE 修改生成列
# bug3:【Generated Columns】OB Mysql模式，修改生成列的数据类型（modify/change）,mysql成功，ob失败。
drop table test_table1;
create table test_table1(
z0_col0 char(200),
z0_col1 char(200),
z0_col2 char(200) as(upper(z0_col0)) virtual,
z0_col3 char(200) as(concat(z0_col0,z0_col1)) stored
);
insert into test_table1 (z0_col0,z0_col1) values ('mysql 8.0 ',' one'),('oracle 11g ',' two'),('oceanbase 4.0 ',' three');
select * from test_table1 order by z0_col2;
+---------------+---------+---------------+---------------------+
| z0_col0       | z0_col1 | z0_col2       | z0_col3             |
+---------------+---------+---------------+---------------------+
| mysql 8.0     |  one    | MYSQL 8.0     | mysql 8.0 one       |
| oceanbase 4.0 |  three  | OCEANBASE 4.0 | oceanbase 4.0 three |
| oracle 11g    |  two    | ORACLE 11G    | oracle 11g two      |
+---------------+---------+---------------+---------------------+
alter table test_table1 change z0_col2 z0_col22 varchar(200) as(upper(z0_col0)) virtual;
alter table test_table1 change z0_col3 z0_col33 varchar(200) as(concat(z0_col0,z0_col1)) stored;
insert into test_table1 (z0_col0,z0_col1) values (5,5);
select * from test_table1 order by z0_col22;
+---------------+---------+---------------+---------------------+
| z0_col0       | z0_col1 | z0_col22      | z0_col33            |
+---------------+---------+---------------+---------------------+
| 5             | 5       | 5             | 55                  |
| mysql 8.0     |  one    | MYSQL 8.0     | mysql 8.0 one       |
| oceanbase 4.0 |  three  | OCEANBASE 4.0 | oceanbase 4.0 three |
| oracle 11g    |  two    | ORACLE 11G    | oracle 11g two      |
+---------------+---------+---------------+---------------------+
show create table test_table1;
Table	Create Table
test_table1	CREATE TABLE `test_table1` (
  `z0_col0` char(200) DEFAULT NULL,
  `z0_col1` char(200) DEFAULT NULL,
  `z0_col22` varchar(200) GENERATED ALWAYS AS (upper(`z0_col0`)) VIRTUAL,
  `z0_col33` varchar(200) GENERATED ALWAYS AS (concat(`z0_col0`,`z0_col1`)) STORED
) ORGANIZATION INDEX DEFAULT CHARSET = utf8mb4 ROW_FORMAT = DYNAMIC COMPRESSION = 'zstd_1.3.8' REPLICA_NUM = 1 BLOCK_SIZE = 16384 USE_BLOOM_FILTER = FALSE ENABLE_MACRO_BLOCK_BLOOM_FILTER = FALSE TABLET_SIZE = 134217728 PCTFREE = 0
# CHANGE 修改生成列引用的普通列
# bug4:【Generated Columns】OB Mysql模式，修改生成列引用的普通列（change）,mysql失败，ob成功。
drop table test_table1;
create table test_table1(
z0_col0 char(200),
z0_col1 char(200),
z0_col2 char(200) as(upper(z0_col0)) virtual,
z0_col3 char(200) as(concat(z0_col0,z0_col1)) stored
);
insert into test_table1 (z0_col0,z0_col1) values ('mysql 8.0 ',' one'),('oracle 11g ',' two'),('oceanbase 4.0 ',' three');
select * from test_table1 order by z0_col2;
+---------------+---------+---------------+---------------------+
| z0_col0       | z0_col1 | z0_col2       | z0_col3             |
+---------------+---------+---------------+---------------------+
| mysql 8.0     |  one    | MYSQL 8.0     | mysql 8.0 one       |
| oceanbase 4.0 |  three  | OCEANBASE 4.0 | oceanbase 4.0 three |
| oracle 11g    |  two    | ORACLE 11G    | oracle 11g two      |
+---------------+---------+---------------+---------------------+
alter table test_table1 change z0_col0 z0_col00 varchar(200);
alter table test_table1 change z0_col1 z0_col11 varchar(200);
insert into test_table1 (z0_col00,z0_col11) values ('pl/sql ',' add');
select * from test_table1 order by z0_col2;
+---------------+----------+---------------+---------------------+
| z0_col00      | z0_col11 | z0_col2       | z0_col3             |
+---------------+----------+---------------+---------------------+
| mysql 8.0     |  one     | MYSQL 8.0     | mysql 8.0 one       |
| oceanbase 4.0 |  three   | OCEANBASE 4.0 | oceanbase 4.0 three |
| oracle 11g    |  two     | ORACLE 11G    | oracle 11g two      |
| pl/sql        |  add     | PL/SQL        | pl/sql  add         |
+---------------+----------+---------------+---------------------+
show create table test_table1;
Table	Create Table
test_table1	CREATE TABLE `test_table1` (
  `z0_col00` varchar(200) DEFAULT NULL,
  `z0_col11` varchar(200) DEFAULT NULL,
  `z0_col2` char(200) GENERATED ALWAYS AS (upper(`z0_col00`)) VIRTUAL,
  `z0_col3` char(200) GENERATED ALWAYS AS (concat(`z0_col00`,`z0_col11`)) STORED
) ORGANIZATION INDEX DEFAULT CHARSET = utf8mb4 ROW_FORMAT = DYNAMIC COMPRESSION = 'zstd_1.3.8' REPLICA_NUM = 1 BLOCK_SIZE = 16384 USE_BLOOM_FILTER = FALSE ENABLE_MACRO_BLOCK_BLOOM_FILTER = FALSE TABLET_SIZE = 134217728 PCTFREE = 0
# DROP 删除生成列
drop table test_table1;
create table test_table1(
z0_col0 char(200),
z0_col1 char(200),
z0_col2 char(200) as(upper(z0_col0)) virtual,
z0_col3 char(200) as(concat(z0_col0,z0_col1)) stored
);
insert into test_table1 (z0_col0,z0_col1) values ('mysql 8.0 ',' one'),('oracle 11g ',' two'),('oceanbase 4.0 ',' three');
select * from test_table1 order by z0_col2;
+---------------+---------+---------------+---------------------+
| z0_col0       | z0_col1 | z0_col2       | z0_col3             |
+---------------+---------+---------------+---------------------+
| mysql 8.0     |  one    | MYSQL 8.0     | mysql 8.0 one       |
| oceanbase 4.0 |  three  | OCEANBASE 4.0 | oceanbase 4.0 three |
| oracle 11g    |  two    | ORACLE 11G    | oracle 11g two      |
+---------------+---------+---------------+---------------------+
alter table test_table1 drop z0_col2;
alter table test_table1 drop z0_col3;
insert into test_table1 (z0_col0,z0_col1) values ('pl/sql ',' add');
select * from test_table1 order by z0_col0;
+---------------+---------+
| z0_col0       | z0_col1 |
+---------------+---------+
| mysql 8.0     |  one    |
| oceanbase 4.0 |  three  |
| oracle 11g    |  two    |
| pl/sql        |  add    |
+---------------+---------+
show create table test_table1;
Table	Create Table
test_table1	CREATE TABLE `test_table1` (
  `z0_col0` char(200) DEFAULT NULL,
  `z0_col1` char(200) DEFAULT NULL
) ORGANIZATION INDEX DEFAULT CHARSET = utf8mb4 ROW_FORMAT = DYNAMIC COMPRESSION = 'zstd_1.3.8' REPLICA_NUM = 1 BLOCK_SIZE = 16384 USE_BLOOM_FILTER = FALSE ENABLE_MACRO_BLOCK_BLOOM_FILTER = FALSE TABLET_SIZE = 134217728 PCTFREE = 0
# DROP 删除生成列引用的普通列
drop table test_table1;
create table test_table1(
z0_col0 char(200),
z0_col1 char(200),
z0_col2 char(200) as(upper(z0_col0)) virtual,
z0_col3 char(200) as(concat(z0_col0,z0_col1)) stored
);
insert into test_table1 (z0_col0,z0_col1) values ('mysql 8.0 ',' one'),('oracle 11g ',' two'),('oceanbase 4.0 ',' three');
select * from test_table1 order by z0_col2;
+---------------+---------+---------------+---------------------+
| z0_col0       | z0_col1 | z0_col2       | z0_col3             |
+---------------+---------+---------------+---------------------+
| mysql 8.0     |  one    | MYSQL 8.0     | mysql 8.0 one       |
| oceanbase 4.0 |  three  | OCEANBASE 4.0 | oceanbase 4.0 three |
| oracle 11g    |  two    | ORACLE 11G    | oracle 11g two      |
+---------------+---------+---------------+---------------------+
alter table test_table1 drop z0_col0;
ERROR HY000: Column 'z0_col0' has a generated column dependency
alter table test_table1 drop z0_col1;
ERROR HY000: Column 'z0_col1' has a generated column dependency
insert into test_table1 (z0_col0,z0_col1) values ('pl/sql ',' add');
select * from test_table1 order by z0_col0;
+---------------+---------+---------------+---------------------+
| z0_col0       | z0_col1 | z0_col2       | z0_col3             |
+---------------+---------+---------------+---------------------+
| mysql 8.0     |  one    | MYSQL 8.0     | mysql 8.0 one       |
| oceanbase 4.0 |  three  | OCEANBASE 4.0 | oceanbase 4.0 three |
| oracle 11g    |  two    | ORACLE 11G    | oracle 11g two      |
| pl/sql        |  add    | PL/SQL        | pl/sql add          |
+---------------+---------+---------------+---------------------+
show create table test_table1;
Table	Create Table
test_table1	CREATE TABLE `test_table1` (
  `z0_col0` char(200) DEFAULT NULL,
  `z0_col1` char(200) DEFAULT NULL,
  `z0_col2` char(200) GENERATED ALWAYS AS (upper(`z0_col0`)) VIRTUAL,
  `z0_col3` char(200) GENERATED ALWAYS AS (concat(`z0_col0`,`z0_col1`)) STORED
) ORGANIZATION INDEX DEFAULT CHARSET = utf8mb4 ROW_FORMAT = DYNAMIC COMPRESSION = 'zstd_1.3.8' REPLICA_NUM = 1 BLOCK_SIZE = 16384 USE_BLOOM_FILTER = FALSE ENABLE_MACRO_BLOCK_BLOOM_FILTER = FALSE TABLET_SIZE = 134217728 PCTFREE = 0
############ mysql_genrate-1-4 DML
### SELECT 语句
# LIMIT 子句
drop table test_table;
create table test_table(
z0_col0 float, 
z0_col1 float,
z0_col2 float as(z0_col0+z0_col1) virtual,
z0_col3 float as(z0_col0*z0_col1) stored
);
insert into test_table (z0_col0,z0_col1) values (0,0),(NULL,NULL),(2,9),(10,15),(-100,20);
select z0_col0,z0_col1,z0_col2,z0_col3 from test_table order by z0_col2 limit z0_col2;
ERROR 42000: You have an error in your SQL syntax; check the manual that corresponds to your OceanBase version for the right syntax to use near 'z0_col2' at line 1
select z0_col0,z0_col1,z0_col2,z0_col3 from test_table order by z0_col2 limit z0_col3;
ERROR 42000: You have an error in your SQL syntax; check the manual that corresponds to your OceanBase version for the right syntax to use near 'z0_col3' at line 1
select z0_col0,z0_col1,z0_col2,z0_col3 from test_table order by z0_col2 limit 5;
+---------+---------+---------+---------+
| z0_col0 | z0_col1 | z0_col2 | z0_col3 |
+---------+---------+---------+---------+
|    NULL |    NULL |    NULL |    NULL |
|    -100 |      20 |     -80 |   -2000 |
|       0 |       0 |       0 |       0 |
|       2 |       9 |      11 |      18 |
|      10 |      15 |      25 |     150 |
+---------+---------+---------+---------+
select z0_col0,z0_col1,abs(z0_col2),z0_col3 from test_table order by z0_col2 limit 5;
+---------+---------+--------------+---------+
| z0_col0 | z0_col1 | abs(z0_col2) | z0_col3 |
+---------+---------+--------------+---------+
|    NULL |    NULL |         NULL |    NULL |
|    -100 |      20 |           80 |   -2000 |
|       0 |       0 |            0 |       0 |
|       2 |       9 |           11 |      18 |
|      10 |      15 |           25 |     150 |
+---------+---------+--------------+---------+
# SELECT ... INTO 语句
drop table test_table;
create table test_table(
z0_col0 float, 
z0_col1 float,
z0_col2 float as(z0_col0+z0_col1) virtual,
z0_col3 float as(z0_col0*z0_col1) stored
);
insert into test_table (z0_col0,z0_col1) values (0,0),(NULL,NULL),(2,9),(10,15),(-100,20);
select z0_col2,z0_col3 into @p1,@p2 from test_table where abs(z0_col2) > 50 and z0_col3 != 0 order by z0_col2;
select @p1,@p2;
+------+-------+
| @p1  | @p2   |
+------+-------+
|  -80 | -2000 |
+------+-------+
# select 生成列间运算 from table;
drop table test_table;
create table test_table(
z0_col0 float, 
z0_col1 float,
z0_col2 float as(z0_col0+z0_col1) virtual,
z0_col3 float as(z0_col0*z0_col1) stored
);
select avg(z0_col2),sum(z0_col3) from test_table;
+--------------+--------------+
| avg(z0_col2) | sum(z0_col3) |
+--------------+--------------+
|         NULL |         NULL |
+--------------+--------------+
insert into test_table (z0_col0,z0_col1) values (0,0),(NULL,NULL),(2,9),(10,15),(-100,20);
select z0_col0,z0_col1,z0_col2+2*9-1/2,z0_col3+2*9-1/2 from test_table order by z0_col2;
+---------+---------+-----------------+-----------------+
| z0_col0 | z0_col1 | z0_col2+2*9-1/2 | z0_col3+2*9-1/2 |
+---------+---------+-----------------+-----------------+
|    NULL |    NULL |            NULL |            NULL |
|    -100 |      20 |           -62.5 |         -1982.5 |
|       0 |       0 |            17.5 |            17.5 |
|       2 |       9 |            28.5 |            35.5 |
|      10 |      15 |            42.5 |           167.5 |
+---------+---------+-----------------+-----------------+
select z0_col0,z0_col1,z0_col2,z0_col3 from test_table order by z0_col2;
+---------+---------+---------+---------+
| z0_col0 | z0_col1 | z0_col2 | z0_col3 |
+---------+---------+---------+---------+
|    NULL |    NULL |    NULL |    NULL |
|    -100 |      20 |     -80 |   -2000 |
|       0 |       0 |       0 |       0 |
|       2 |       9 |      11 |      18 |
|      10 |      15 |      25 |     150 |
+---------+---------+---------+---------+
select z0_col0,z0_col1,z0_col2+z0_col3 from test_table order by z0_col2;
+---------+---------+-----------------+
| z0_col0 | z0_col1 | z0_col2+z0_col3 |
+---------+---------+-----------------+
|    NULL |    NULL |            NULL |
|    -100 |      20 |           -2080 |
|       0 |       0 |               0 |
|       2 |       9 |              29 |
|      10 |      15 |             175 |
+---------+---------+-----------------+
select z0_col0,z0_col1+z0_col2,z0_col3 from test_table order by z0_col2;
+---------+-----------------+---------+
| z0_col0 | z0_col1+z0_col2 | z0_col3 |
+---------+-----------------+---------+
|    NULL |            NULL |    NULL |
|    -100 |             -60 |   -2000 |
|       0 |               0 |       0 |
|       2 |              20 |      18 |
|      10 |              40 |     150 |
+---------+-----------------+---------+
select avg(z0_col2),sum(z0_col3) from test_table where z0_col2 > 0 order by z0_col2;
+--------------+--------------+
| avg(z0_col2) | sum(z0_col3) |
+--------------+--------------+
|           18 |          168 |
+--------------+--------------+
select z0_col2 > z0_col3 from test_table order by z0_col2;
+-------------------+
| z0_col2 > z0_col3 |
+-------------------+
|              NULL |
|                 1 |
|                 0 |
|                 0 |
|                 0 |
+-------------------+
select z0_col2 and z0_col3 from test_table order by z0_col2;
+---------------------+
| z0_col2 and z0_col3 |
+---------------------+
|                NULL |
|                   1 |
|                   0 |
|                   1 |
|                   1 |
+---------------------+
# 子查询 作为标量操作数的子查询
drop table test_table1;
create table test_table1(
z0_col0 double, 
z0_col1 double,
z0_col2 double as(z0_col0+z0_col1) virtual,
z0_col3 double as(z0_col0*z0_col1) stored
);
select (select z0_col2 from test_table1);
+-----------------------------------+
| (select z0_col2 from test_table1) |
+-----------------------------------+
|                              NULL |
+-----------------------------------+
insert into test_table1 (z0_col0,z0_col1) values (0,0),(NULL,NULL),(2.5,9.9),(-10,15),(1.0E+10,2.0E+10);
select z0_col0,z0_col1,z0_col2,z0_col3 from test_table1 order by z0_col2;
+-------------+-------------+-------------+---------+
| z0_col0     | z0_col1     | z0_col2     | z0_col3 |
+-------------+-------------+-------------+---------+
|        NULL |        NULL |        NULL |    NULL |
|           0 |           0 |           0 |       0 |
|         -10 |          15 |           5 |    -150 |
|         2.5 |         9.9 |        12.4 |   24.75 |
| 10000000000 | 20000000000 | 30000000000 |    2e20 |
+-------------+-------------+-------------+---------+
drop table test_table2;
create table test_table2(
z0_col0 char(200), 
z0_col1 char(200), 
z0_col2 char(200) as(concat(z0_col0,z0_col1)) virtual,
z0_col3 char(200) as(upper(concat(z0_col0,z0_col1))) stored
);
select (select z0_col2 from test_table2);
+-----------------------------------+
| (select z0_col2 from test_table2) |
+-----------------------------------+
| NULL                              |
+-----------------------------------+
insert into test_table2 (z0_col0,z0_col1) values (0,0),(NULL,NULL),(2022,0621),('2022-06-21 ',' 14:30:00'),('welloe come to ',' beijing');
select z0_col0,z0_col1,z0_col2,z0_col3 from test_table2 order by z0_col2;
+----------------+-----------+------------------------+------------------------+
| z0_col0        | z0_col1   | z0_col2                | z0_col3                |
+----------------+-----------+------------------------+------------------------+
| NULL           | NULL      | NULL                   | NULL                   |
| 0              | 0         | 00                     | 00                     |
| 2022-06-21     |  14:30:00 | 2022-06-21 14:30:00    | 2022-06-21 14:30:00    |
| 2022           | 621       | 2022621                | 2022621                |
| welloe come to |  beijing  | welloe come to beijing | WELLOE COME TO BEIJING |
+----------------+-----------+------------------------+------------------------+
select (select z0_col2 from test_table1 where z0_col2 > 20 order by 1);
+-----------------------------------------------------------------+
| (select z0_col2 from test_table1 where z0_col2 > 20 order by 1) |
+-----------------------------------------------------------------+
|                                                     30000000000 |
+-----------------------------------------------------------------+
select (select z0_col3 from test_table1 where z0_col3 between 20 and 30 order by 1);
+------------------------------------------------------------------------------+
| (select z0_col3 from test_table1 where z0_col3 between 20 and 30 order by 1) |
+------------------------------------------------------------------------------+
|                                                                        24.75 |
+------------------------------------------------------------------------------+
select (select z0_col2 from test_table2 where z0_col2 like '%to%' order by 1);
+------------------------------------------------------------------------+
| (select z0_col2 from test_table2 where z0_col2 like '%to%' order by 1) |
+------------------------------------------------------------------------+
| welloe come to beijing                                                 |
+------------------------------------------------------------------------+
select (select z0_col3 from test_table2 where z0_col3 like '%TO%' order by 1);
+------------------------------------------------------------------------+
| (select z0_col3 from test_table2 where z0_col3 like '%TO%' order by 1) |
+------------------------------------------------------------------------+
| WELLOE COME TO BEIJING                                                 |
+------------------------------------------------------------------------+
select (select z0_col2 from test_table1 where z0_col2 > 20) from test_table2 order by z0_col2;
+------------------------------------------------------+
| (select z0_col2 from test_table1 where z0_col2 > 20) |
+------------------------------------------------------+
|                                          30000000000 |
|                                          30000000000 |
|                                          30000000000 |
|                                          30000000000 |
|                                          30000000000 |
+------------------------------------------------------+
select lower((select z0_col3 from test_table2 where z0_col3 like '%TO%')) from test_table1 order by z0_col2;
+--------------------------------------------------------------------+
| lower((select z0_col3 from test_table2 where z0_col3 like '%TO%')) |
+--------------------------------------------------------------------+
| welloe come to beijing                                             |
| welloe come to beijing                                             |
| welloe come to beijing                                             |
| welloe come to beijing                                             |
| welloe come to beijing                                             |
+--------------------------------------------------------------------+
# 子查询 使用子查询进行比较
drop table test_table1;
create table test_table1(
z0_col0 int, 
z0_col1 int,
z0_col2 int as(z0_col0+z0_col1) virtual,
z0_col3 int as(z0_col0-z0_col1) stored
);
insert into test_table1 (z0_col0,z0_col1) values (0,0),(NULL,NULL),(1,1),(1,2),(42.5,9.9),(-10,15),(2.0E+2,1.0E+2);
select z0_col0,z0_col1,z0_col2,z0_col3 from test_table1 order by z0_col2;
+---------+---------+---------+---------+
| z0_col0 | z0_col1 | z0_col2 | z0_col3 |
+---------+---------+---------+---------+
|    NULL |    NULL |    NULL |    NULL |
|       0 |       0 |       0 |       0 |
|       1 |       1 |       2 |       0 |
|       1 |       2 |       3 |      -1 |
|     -10 |      15 |       5 |     -25 |
|      43 |      10 |      53 |      33 |
|     200 |     100 |     300 |     100 |
+---------+---------+---------+---------+
drop table test_table2;
create table test_table2(
z0_col0 int, 
z0_col1 int,
z0_col2 int as(z0_col0*z0_col1) virtual,
z0_col3 int as(z0_col0/z0_col1) stored
);
insert into test_table2 (z0_col0,z0_col1) values (0,0),(0,0),(1,1),(NULL,NULL),(29.5,9.9),(-10,15),(2.0E+2,1.0E+2);
select z0_col0,z0_col1,z0_col2,z0_col3 from test_table2 order by z0_col2;
+---------+---------+---------+---------+
| z0_col0 | z0_col1 | z0_col2 | z0_col3 |
+---------+---------+---------+---------+
|    NULL |    NULL |    NULL |    NULL |
|     -10 |      15 |    -150 |      -1 |
|       0 |       0 |       0 |    NULL |
|       0 |       0 |       0 |    NULL |
|       1 |       1 |       1 |       1 |
|      30 |      10 |     300 |       3 |
|     200 |     100 |   20000 |       2 |
+---------+---------+---------+---------+
select * from test_table1 where z0_col2 < (select max(z0_col2) from test_table2 where z0_col3 > 2) order by 1;
+---------+---------+---------+---------+
| z0_col0 | z0_col1 | z0_col2 | z0_col3 |
+---------+---------+---------+---------+
|     -10 |      15 |       5 |     -25 |
|       0 |       0 |       0 |       0 |
|       1 |       1 |       2 |       0 |
|       1 |       2 |       3 |      -1 |
|      43 |      10 |      53 |      33 |
+---------+---------+---------+---------+
select * from test_table1 where z0_col2 >= (select max(z0_col2) from test_table2 where z0_col3 > 2) order by 1;
+---------+---------+---------+---------+
| z0_col0 | z0_col1 | z0_col2 | z0_col3 |
+---------+---------+---------+---------+
|     200 |     100 |     300 |     100 |
+---------+---------+---------+---------+
select * from test_table2 where z0_col1 = (select max(z0_col3) from test_table1) order by 1;
+---------+---------+---------+---------+
| z0_col0 | z0_col1 | z0_col2 | z0_col3 |
+---------+---------+---------+---------+
|     200 |     100 |   20000 |       2 |
+---------+---------+---------+---------+
select * from test_table2 where z0_col1 != (select min(z0_col3) from test_table1) order by 1;
+---------+---------+---------+---------+
| z0_col0 | z0_col1 | z0_col2 | z0_col3 |
+---------+---------+---------+---------+
|     -10 |      15 |    -150 |      -1 |
|       0 |       0 |       0 |    NULL |
|       0 |       0 |       0 |    NULL |
|       1 |       1 |       1 |       1 |
|      30 |      10 |     300 |       3 |
|     200 |     100 |   20000 |       2 |
+---------+---------+---------+---------+
select * from test_table1 where 2 = (select count(*) from test_table2 where test_table2.z0_col0 = test_table1.z0_col0) order by 1;
+---------+---------+---------+---------+
| z0_col0 | z0_col1 | z0_col2 | z0_col3 |
+---------+---------+---------+---------+
|       0 |       0 |       0 |       0 |
+---------+---------+---------+---------+
# 带有 ANY、IN 或 SOME 的子查询
select * from test_table1 where z0_col2 > any (select z0_col3 from test_table2 where z0_col2 > 0) order by 1;
+---------+---------+---------+---------+
| z0_col0 | z0_col1 | z0_col2 | z0_col3 |
+---------+---------+---------+---------+
|     -10 |      15 |       5 |     -25 |
|       1 |       1 |       2 |       0 |
|       1 |       2 |       3 |      -1 |
|      43 |      10 |      53 |      33 |
|     200 |     100 |     300 |     100 |
+---------+---------+---------+---------+
select * from test_table1 where z0_col2 = any (select z0_col3 from test_table2 where z0_col2 > 0) order by 1;
+---------+---------+---------+---------+
| z0_col0 | z0_col1 | z0_col2 | z0_col3 |
+---------+---------+---------+---------+
|       1 |       1 |       2 |       0 |
|       1 |       2 |       3 |      -1 |
+---------+---------+---------+---------+
select * from test_table1 where z0_col2 < any (select z0_col3 from test_table2 where z0_col2 > 0) order by 1;
+---------+---------+---------+---------+
| z0_col0 | z0_col1 | z0_col2 | z0_col3 |
+---------+---------+---------+---------+
|       0 |       0 |       0 |       0 |
|       1 |       1 |       2 |       0 |
+---------+---------+---------+---------+
select * from test_table1 where z0_col2 != any (select z0_col3 from test_table2 where z0_col2 > 0) order by 1;
+---------+---------+---------+---------+
| z0_col0 | z0_col1 | z0_col2 | z0_col3 |
+---------+---------+---------+---------+
|     -10 |      15 |       5 |     -25 |
|       0 |       0 |       0 |       0 |
|       1 |       1 |       2 |       0 |
|       1 |       2 |       3 |      -1 |
|      43 |      10 |      53 |      33 |
|     200 |     100 |     300 |     100 |
+---------+---------+---------+---------+
select * from test_table1 where z0_col2 <> any (select z0_col3 from test_table2 where z0_col2 > 0) order by 1;
+---------+---------+---------+---------+
| z0_col0 | z0_col1 | z0_col2 | z0_col3 |
+---------+---------+---------+---------+
|     -10 |      15 |       5 |     -25 |
|       0 |       0 |       0 |       0 |
|       1 |       1 |       2 |       0 |
|       1 |       2 |       3 |      -1 |
|      43 |      10 |      53 |      33 |
|     200 |     100 |     300 |     100 |
+---------+---------+---------+---------+
select max(z0_col2) from test_table1 where z0_col2 in (select z0_col3 from test_table2 where z0_col2 > 0) order by 1;
+--------------+
| max(z0_col2) |
+--------------+
|            3 |
+--------------+
select * from test_table1 where z0_col3 >= some (select z0_col3 from test_table2 where z0_col3 > 0) order by 1;
+---------+---------+---------+---------+
| z0_col0 | z0_col1 | z0_col2 | z0_col3 |
+---------+---------+---------+---------+
|      43 |      10 |      53 |      33 |
|     200 |     100 |     300 |     100 |
+---------+---------+---------+---------+
select * from test_table1 where z0_col3 = some (select z0_col3 from test_table2 where z0_col3 > 0) order by 1;
+---------+---------+---------+---------+
| z0_col0 | z0_col1 | z0_col2 | z0_col3 |
+---------+---------+---------+---------+
+---------+---------+---------+---------+
select * from test_table1 where z0_col3 <= some (select z0_col3 from test_table2 where z0_col3 > 0) order by 1;
+---------+---------+---------+---------+
| z0_col0 | z0_col1 | z0_col2 | z0_col3 |
+---------+---------+---------+---------+
|     -10 |      15 |       5 |     -25 |
|       0 |       0 |       0 |       0 |
|       1 |       1 |       2 |       0 |
|       1 |       2 |       3 |      -1 |
+---------+---------+---------+---------+
select * from test_table1 where z0_col3 != some (select z0_col3 from test_table2 where z0_col3 > 0) order by 1;
+---------+---------+---------+---------+
| z0_col0 | z0_col1 | z0_col2 | z0_col3 |
+---------+---------+---------+---------+
|     -10 |      15 |       5 |     -25 |
|       0 |       0 |       0 |       0 |
|       1 |       1 |       2 |       0 |
|       1 |       2 |       3 |      -1 |
|      43 |      10 |      53 |      33 |
|     200 |     100 |     300 |     100 |
+---------+---------+---------+---------+
# ALL 子查询
select z0_col0,z0_col1,abs(z0_col2),abs(z0_col3) from test_table1 where z0_col2 >= all (select z0_col3 from test_table2 where z0_col2 <> 0);
+---------+---------+--------------+--------------+
| z0_col0 | z0_col1 | abs(z0_col2) | abs(z0_col3) |
+---------+---------+--------------+--------------+
|       1 |       2 |            3 |            1 |
|      43 |      10 |           53 |           33 |
|     -10 |      15 |            5 |           25 |
|     200 |     100 |          300 |          100 |
+---------+---------+--------------+--------------+
select z0_col0,z0_col1,max(z0_col2),max(z0_col3) from test_table1 where z0_col2 = all (select z0_col3 from test_table2 where z0_col2 <> 0);
+---------+---------+--------------+--------------+
| z0_col0 | z0_col1 | max(z0_col2) | max(z0_col3) |
+---------+---------+--------------+--------------+
|    NULL |    NULL |         NULL |         NULL |
+---------+---------+--------------+--------------+
select z0_col0,z0_col1,min(z0_col2),min(z0_col3) from test_table1 where z0_col2 <= all (select z0_col3 from test_table2 where z0_col2 <> 0);
+---------+---------+--------------+--------------+
| z0_col0 | z0_col1 | min(z0_col2) | min(z0_col3) |
+---------+---------+--------------+--------------+
|    NULL |    NULL |         NULL |         NULL |
+---------+---------+--------------+--------------+
select z0_col0,z0_col1,avg(z0_col2),avg(z0_col3) from test_table1 where z0_col2 <> all (select z0_col3 from test_table2 where z0_col2 <> 0);
+---------+---------+--------------+--------------+
| z0_col0 | z0_col1 | avg(z0_col2) | avg(z0_col3) |
+---------+---------+--------------+--------------+
|       0 |       0 |      89.5000 |      27.0000 |
+---------+---------+--------------+--------------+
# 行子查询
select * from test_table1 where (z0_col2,z0_col3) = (select z0_col2, z0_col3 from test_table2 where z0_col2 is null) order by 1;
+---------+---------+---------+---------+
| z0_col0 | z0_col1 | z0_col2 | z0_col3 |
+---------+---------+---------+---------+
+---------+---------+---------+---------+
select * from test_table2 where row(z0_col2,z0_col3) = (select z0_col0, z0_col1 from test_table1 where z0_col2 = 2) order by 1;
+---------+---------+---------+---------+
| z0_col0 | z0_col1 | z0_col2 | z0_col3 |
+---------+---------+---------+---------+
|       1 |       1 |       1 |       1 |
+---------+---------+---------+---------+
# 具有 EXISTS 或 NOT EXISTS 的子查询
select z0_col2,z0_col3 from test_table1 where exists (select * from test_table2 where z0_col3 is not null) order by 1;
+---------+---------+
| z0_col2 | z0_col3 |
+---------+---------+
|    NULL |    NULL |
|       0 |       0 |
|       2 |       0 |
|       3 |      -1 |
|       5 |     -25 |
|      53 |      33 |
|     300 |     100 |
+---------+---------+
select z0_col2,z0_col3 from test_table1 where not exists (select * from test_table2 where z0_col3 > 10) order by 1;
+---------+---------+
| z0_col2 | z0_col3 |
+---------+---------+
|    NULL |    NULL |
|       0 |       0 |
|       2 |       0 |
|       3 |      -1 |
|       5 |     -25 |
|      53 |      33 |
|     300 |     100 |
+---------+---------+
select count(z0_col2),max(z0_col3) from test_table1 where exists (select * from test_table2 where z0_col3 is not null) order by 1;
+----------------+--------------+
| count(z0_col2) | max(z0_col3) |
+----------------+--------------+
|              6 |          100 |
+----------------+--------------+
select distinct z0_col2,z0_col3 from test_table1 where not exists (select * from test_table2 where z0_col3 > 10) order by 1;
+---------+---------+
| z0_col2 | z0_col3 |
+---------+---------+
|    NULL |    NULL |
|       0 |       0 |
|       2 |       0 |
|       3 |      -1 |
|       5 |     -25 |
|      53 |      33 |
|     300 |     100 |
+---------+---------+
# 相关子查询
select * from test_table1 t1 where z0_col2 = any (select z0_col2 from test_table2 t2 where t2.z0_col0 = t1.z0_col0 ) order by 1;
+---------+---------+---------+---------+
| z0_col0 | z0_col1 | z0_col2 | z0_col3 |
+---------+---------+---------+---------+
|       0 |       0 |       0 |       0 |
+---------+---------+---------+---------+
select * from test_table1 t1 where (select z0_col2 from test_table2 t2 where t2.z0_col1 = t1.z0_col1 and t2.z0_col3 = 3 ) > 0 order by 1;
+---------+---------+---------+---------+
| z0_col0 | z0_col1 | z0_col2 | z0_col3 |
+---------+---------+---------+---------+
|      43 |      10 |      53 |      33 |
+---------+---------+---------+---------+
# 派生表
select avg(sum_column1) from (select sum(z0_col2) as sum_column1 from test_table1 group by z0_col3) as t1;
+------------------+
| avg(sum_column1) |
+------------------+
|          72.6000 |
+------------------+
select avg(sum_column1) from (select sum(z0_col3) as sum_column1 from test_table2 group by z0_col2) as t1;
+------------------+
| avg(sum_column1) |
+------------------+
|           1.2500 |
+------------------+
###  INSERT 语句
drop table test_table1;
create table test_table1(
z0_col0 int primary key,
z0_col1 int,
z0_col2 int as(z0_col0+z0_col1) virtual,
z0_col3 int as(mod(z0_col0,z0_col1)) stored,
txt char(200) default 'test_table1'
);
insert into test_table1 (z0_col0,z0_col1) values (0,0),(1,NULL),(2,1),(3,5),(4,9.9),(5,2),(2.0E+2,1.0E+2);
select z0_col0,z0_col1,z0_col2 col_add,z0_col3 col_mod,txt from test_table1 order by z0_col2;
+---------+---------+---------+---------+-------------+
| z0_col0 | z0_col1 | col_add | col_mod | txt         |
+---------+---------+---------+---------+-------------+
|       1 |    NULL |    NULL |    NULL | test_table1 |
|       0 |       0 |       0 |    NULL | test_table1 |
|       2 |       1 |       3 |       0 | test_table1 |
|       5 |       2 |       7 |       1 | test_table1 |
|       3 |       5 |       8 |       3 | test_table1 |
|       4 |      10 |      14 |       4 | test_table1 |
|     200 |     100 |     300 |       0 | test_table1 |
+---------+---------+---------+---------+-------------+
insert into test_table1 (z0_col0,z0_col1) values (5,5) on duplicate key update z0_col0=z0_col0+3,z0_col2=1;
ERROR HY000: The value specified for generated column 'z0_col2' in table 'test_table1' is not allowed
insert into test_table1 (z0_col0,z0_col1) values (5,5) on duplicate key update z0_col0=z0_col0+3,txt = 'on duplicate key update';
select z0_col0,z0_col1,z0_col2 col_add,z0_col3 col_mod,txt from test_table1 order by z0_col2;
+---------+---------+---------+---------+-------------------------+
| z0_col0 | z0_col1 | col_add | col_mod | txt                     |
+---------+---------+---------+---------+-------------------------+
|       1 |    NULL |    NULL |    NULL | test_table1             |
|       0 |       0 |       0 |    NULL | test_table1             |
|       2 |       1 |       3 |       0 | test_table1             |
|       3 |       5 |       8 |       3 | test_table1             |
|       8 |       2 |      10 |       0 | on duplicate key update |
|       4 |      10 |      14 |       4 | test_table1             |
|     200 |     100 |     300 |       0 | test_table1             |
+---------+---------+---------+---------+-------------------------+
###  UPDATE  语句
update test_table1 set z0_col1 = 10, txt = '1 update z0_col1' where z0_col2 > 100;
select z0_col0,z0_col1,z0_col2 col_add,z0_col3 col_mod,txt from test_table1 order by z0_col2;
+---------+---------+---------+---------+-------------------------+
| z0_col0 | z0_col1 | col_add | col_mod | txt                     |
+---------+---------+---------+---------+-------------------------+
|       1 |    NULL |    NULL |    NULL | test_table1             |
|       0 |       0 |       0 |    NULL | test_table1             |
|       2 |       1 |       3 |       0 | test_table1             |
|       3 |       5 |       8 |       3 | test_table1             |
|       8 |       2 |      10 |       0 | on duplicate key update |
|       4 |      10 |      14 |       4 | test_table1             |
|     200 |      10 |     210 |       0 | 1 update z0_col1        |
+---------+---------+---------+---------+-------------------------+
update test_table1 set z0_col0 = 41, txt = '2 update z0_col0' where z0_col3 = 4 order by z0_col3 limit 1;
select z0_col0,z0_col1,z0_col2 col_add,z0_col3 col_mod,txt from test_table1 order by z0_col2;
+---------+---------+---------+---------+-------------------------+
| z0_col0 | z0_col1 | col_add | col_mod | txt                     |
+---------+---------+---------+---------+-------------------------+
|       1 |    NULL |    NULL |    NULL | test_table1             |
|       0 |       0 |       0 |    NULL | test_table1             |
|       2 |       1 |       3 |       0 | test_table1             |
|       3 |       5 |       8 |       3 | test_table1             |
|       8 |       2 |      10 |       0 | on duplicate key update |
|      41 |      10 |      51 |       1 | 2 update z0_col0        |
|     200 |      10 |     210 |       0 | 1 update z0_col1        |
+---------+---------+---------+---------+-------------------------+
update test_table1 set z0_col0 = 4, txt = '3 update z0_col0' where abs(z0_col2) = 3 order by z0_col3 limit 1;
select z0_col0,z0_col1,z0_col2 col_add,z0_col3 col_mod,txt from test_table1 order by z0_col2;
+---------+---------+---------+---------+-------------------------+
| z0_col0 | z0_col1 | col_add | col_mod | txt                     |
+---------+---------+---------+---------+-------------------------+
|       1 |    NULL |    NULL |    NULL | test_table1             |
|       0 |       0 |       0 |    NULL | test_table1             |
|       4 |       1 |       5 |       0 | 3 update z0_col0        |
|       3 |       5 |       8 |       3 | test_table1             |
|       8 |       2 |      10 |       0 | on duplicate key update |
|      41 |      10 |      51 |       1 | 2 update z0_col0        |
|     200 |      10 |     210 |       0 | 1 update z0_col1        |
+---------+---------+---------+---------+-------------------------+
update test_table1 set z0_col1 = 200 where z0_col2 > 10 order by z0_col3 limit z0_col3;
ERROR 42000: You have an error in your SQL syntax; check the manual that corresponds to your OceanBase version for the right syntax to use near 'z0_col3' at line 1
select z0_col0,z0_col1,z0_col2 col_add,z0_col3 col_mod,txt from test_table1 order by z0_col2;
+---------+---------+---------+---------+-------------------------+
| z0_col0 | z0_col1 | col_add | col_mod | txt                     |
+---------+---------+---------+---------+-------------------------+
|       1 |    NULL |    NULL |    NULL | test_table1             |
|       0 |       0 |       0 |    NULL | test_table1             |
|       4 |       1 |       5 |       0 | 3 update z0_col0        |
|       3 |       5 |       8 |       3 | test_table1             |
|       8 |       2 |      10 |       0 | on duplicate key update |
|      41 |      10 |      51 |       1 | 2 update z0_col0        |
|     200 |      10 |     210 |       0 | 1 update z0_col1        |
+---------+---------+---------+---------+-------------------------+
update test_table1 set z0_col2 = 20 where z0_col3 = 4 order by z0_col3 limit 1;
ERROR HY000: The value specified for generated column 'z0_col2' in table 'test_table1' is not allowed
select z0_col0,z0_col1,z0_col2 col_add,z0_col3 col_mod,txt from test_table1 order by z0_col2;
+---------+---------+---------+---------+-------------------------+
| z0_col0 | z0_col1 | col_add | col_mod | txt                     |
+---------+---------+---------+---------+-------------------------+
|       1 |    NULL |    NULL |    NULL | test_table1             |
|       0 |       0 |       0 |    NULL | test_table1             |
|       4 |       1 |       5 |       0 | 3 update z0_col0        |
|       3 |       5 |       8 |       3 | test_table1             |
|       8 |       2 |      10 |       0 | on duplicate key update |
|      41 |      10 |      51 |       1 | 2 update z0_col0        |
|     200 |      10 |     210 |       0 | 1 update z0_col1        |
+---------+---------+---------+---------+-------------------------+
###  REPLACE  语句
select z0_col0,z0_col1,z0_col2 col_add,z0_col3 col_mod,txt from test_table1 order by z0_col2;
+---------+---------+---------+---------+-------------------------+
| z0_col0 | z0_col1 | col_add | col_mod | txt                     |
+---------+---------+---------+---------+-------------------------+
|       1 |    NULL |    NULL |    NULL | test_table1             |
|       0 |       0 |       0 |    NULL | test_table1             |
|       4 |       1 |       5 |       0 | 3 update z0_col0        |
|       3 |       5 |       8 |       3 | test_table1             |
|       8 |       2 |      10 |       0 | on duplicate key update |
|      41 |      10 |      51 |       1 | 2 update z0_col0        |
|     200 |      10 |     210 |       0 | 1 update z0_col1        |
+---------+---------+---------+---------+-------------------------+
replace into test_table1 (z0_col0,z0_col1,txt) values (200,21,'1 replace test_table1');
select z0_col0,z0_col1,z0_col2 col_add,z0_col3 col_mod,txt from test_table1 order by z0_col2;
+---------+---------+---------+---------+-------------------------+
| z0_col0 | z0_col1 | col_add | col_mod | txt                     |
+---------+---------+---------+---------+-------------------------+
|       1 |    NULL |    NULL |    NULL | test_table1             |
|       0 |       0 |       0 |    NULL | test_table1             |
|       4 |       1 |       5 |       0 | 3 update z0_col0        |
|       3 |       5 |       8 |       3 | test_table1             |
|       8 |       2 |      10 |       0 | on duplicate key update |
|      41 |      10 |      51 |       1 | 2 update z0_col0        |
|     200 |      21 |     221 |      11 | 1 replace test_table1   |
+---------+---------+---------+---------+-------------------------+
replace into test_table1 values (3,20,30,10,'2 replace test_table1');
ERROR HY000: The value specified for generated column 'z0_col2' in table 'test_table1' is not allowed
###  TRUNCATE TABLE语句
drop table test_table1;
create table test_table1(
z0_col0 int primary key,
z0_col1 int,
z0_col2 int as(z0_col0+z0_col1) virtual,
z0_col3 int as(z0_col0*z0_col1) stored,
txt char(200) default 'test_table1'
);
insert into test_table1 (z0_col0,z0_col1) values (0,0),(1,NULL),(2,1),(3,5);
select z0_col0,z0_col1,z0_col2 col_vir,z0_col3 col_sto,txt from test_table1 order by z0_col2;
+---------+---------+---------+---------+-------------+
| z0_col0 | z0_col1 | col_vir | col_sto | txt         |
+---------+---------+---------+---------+-------------+
|       1 |    NULL |    NULL |    NULL | test_table1 |
|       0 |       0 |       0 |       0 | test_table1 |
|       2 |       1 |       3 |       2 | test_table1 |
|       3 |       5 |       8 |      15 | test_table1 |
+---------+---------+---------+---------+-------------+
truncate table test_table1;
insert into test_table1 (z0_col0,z0_col1) values (10,10),(20,10),(30,50);
select z0_col0,z0_col1,z0_col2 col_add,z0_col3 col_mod,txt from test_table1 order by z0_col2;
+---------+---------+---------+---------+-------------+
| z0_col0 | z0_col1 | col_add | col_mod | txt         |
+---------+---------+---------+---------+-------------+
|      10 |      10 |      20 |     100 | test_table1 |
|      20 |      10 |      30 |     200 | test_table1 |
|      30 |      50 |      80 |    1500 | test_table1 |
+---------+---------+---------+---------+-------------+
desc test_table1;
+---------+-----------+------+-----+-------------------------+-------------------+
| Field   | Type      | Null | Key | Default                 | Extra             |
+---------+-----------+------+-----+-------------------------+-------------------+
| z0_col0 | int(11)   | NO   | PRI | NULL                    |                   |
| z0_col1 | int(11)   | YES  |     | NULL                    |                   |
| z0_col2 | int(11)   | YES  |     | (`z0_col0` + `z0_col1`) | VIRTUAL GENERATED |
| z0_col3 | int(11)   | YES  |     | (`z0_col0` * `z0_col1`) | STORED GENERATED  |
| txt     | char(200) | YES  |     | test_table1             |                   |
+---------+-----------+------+-----+-------------------------+-------------------+
############ mysql_genrate-1-5 PL/SQL
### 函数
drop table test_table1;
create table test_table1(
z0_col0 int primary key,
z0_col1 int,
z0_col2 int as(z0_col0+z0_col1) virtual,
z0_col3 int as(z0_col0*z0_col1) stored
);
insert into test_table1 (z0_col0,z0_col1) values (0,0),(1,1),(2,2),(3,3);
select z0_col0,z0_col1,z0_col2 col_vir,z0_col3 col_sto from test_table1 order by z0_col2;
+---------+---------+---------+---------+
| z0_col0 | z0_col1 | col_vir | col_sto |
+---------+---------+---------+---------+
|       0 |       0 |       0 |       0 |
|       1 |       1 |       2 |       1 |
|       2 |       2 |       4 |       4 |
|       3 |       3 |       6 |       9 |
+---------+---------+---------+---------+
drop table test_table2;
create table test_table2(
z0_col0 int primary key,
z0_col1 int,
z0_col2 int as(z0_col0+z0_col1) virtual,
z0_col3 int as(z0_col0*z0_col1) stored
);
insert into test_table2 (z0_col0,z0_col1) values (10,0),(11,1),(12,2),(13,3);
select z0_col0,z0_col1,z0_col2 col_vir,z0_col3 col_sto from test_table2 order by z0_col2;
+---------+---------+---------+---------+
| z0_col0 | z0_col1 | col_vir | col_sto |
+---------+---------+---------+---------+
|      10 |       0 |      10 |       0 |
|      11 |       1 |      12 |      11 |
|      12 |       2 |      14 |      24 |
|      13 |       3 |      16 |      39 |
+---------+---------+---------+---------+
# 生成列作为函数参数
drop function fun1;//
create function fun1(num2 int,num3 int) returns varchar(100)
begin  
  insert into test_table1 (z0_col0,z0_col1) values (num2,num3); 
  delete from test_table1 where z0_col2 = 0; 
  update test_table1 set z0_col0 = 9 where z0_col2 = 2;
  return 'fun1 ok';
end;
//
select fun1(z0_col2,z0_col3) from test_table2 where z0_col2 < 14 order by z0_col2;//
+-----------------------+
| fun1(z0_col2,z0_col3) |
+-----------------------+
| fun1 ok               |
| fun1 ok               |
+-----------------------+
select z0_col0,z0_col1,z0_col2 col_vir,z0_col3 col_sto from test_table1 order by z0_col2;//
+---------+---------+---------+---------+
| z0_col0 | z0_col1 | col_vir | col_sto |
+---------+---------+---------+---------+
|       2 |       2 |       4 |       4 |
|       3 |       3 |       6 |       9 |
|       9 |       1 |      10 |       9 |
|      10 |       0 |      10 |       0 |
|      12 |      11 |      23 |     132 |
+---------+---------+---------+---------+
# 虚拟列表达式是自定义函数
drop function fun1;//
create function fun1() returns int
begin
  return 10;
end;
//
drop table test_table222;//
create table test_table222(
z0_col0 int primary key,
z0_col1 int,
z0_col2 int as(fun1()) virtual,
z0_col3 int as(fun1()) stored
);//
ERROR 42S22: Unknown column '' in 'generated column function'
### 存储过程
DROP PROCEDURE IF EXISTS pro1;//
CREATE PROCEDURE pro1(in num1 int,in num2 int)
BEGIN
  alter table test_table2 add z0_col4 varchar(100) as (concat(z0_col0,z0_col1)) virtual;
  alter table test_table2 add z0_col5 varchar(100) as (z0_col0) stored;
  insert into test_table2 (z0_col0,z0_col1) values (num1,num2),(num1+1,num2+1); 
  delete from test_table2 where z0_col2 = num1+num2; 
  update test_table2 set z0_col1 = 0 where z0_col3 = 36;
END;
//
call pro1(5,5);//
select * from test_table2 order by z0_col2;//
+---------+---------+---------+---------+---------+---------+
| z0_col0 | z0_col1 | z0_col2 | z0_col3 | z0_col4 | z0_col5 |
+---------+---------+---------+---------+---------+---------+
|       6 |       0 |       6 |       0 | 60      | 6       |
|      11 |       1 |      12 |      11 | 111     | 11      |
|      12 |       2 |      14 |      24 | 122     | 12      |
|      13 |       3 |      16 |      39 | 133     | 13      |
+---------+---------+---------+---------+---------+---------+
desc test_table2;//
+---------+--------------+------+-----+-----------------------------+-------------------+
| Field   | Type         | Null | Key | Default                     | Extra             |
+---------+--------------+------+-----+-----------------------------+-------------------+
| z0_col0 | int(11)      | NO   | PRI | NULL                        |                   |
| z0_col1 | int(11)      | YES  |     | NULL                        |                   |
| z0_col2 | int(11)      | YES  |     | (`z0_col0` + `z0_col1`)     | VIRTUAL GENERATED |
| z0_col3 | int(11)      | YES  |     | (`z0_col0` * `z0_col1`)     | STORED GENERATED  |
| z0_col4 | varchar(100) | YES  |     | concat(`z0_col0`,`z0_col1`) | VIRTUAL GENERATED |
| z0_col5 | varchar(100) | YES  |     | `z0_col0`                   | STORED GENERATED  |
+---------+--------------+------+-----+-----------------------------+-------------------+
############ mysql_genrate-1-6 其他场景
### 生成列：常量
# null
drop table test_table1;
create table test_table1(
z0_col0 int,
z0_col1 int,
z0_col2 int as (null) virtual,
z0_col3 int as (null) stored
);
insert into test_table1 (z0_col0,z0_col1) values (1,1),(2,2);
select z0_col0,z0_col1,z0_col2 col_vir,z0_col3 col_sto from test_table1 order by z0_col2;
+---------+---------+---------+---------+
| z0_col0 | z0_col1 | col_vir | col_sto |
+---------+---------+---------+---------+
|       1 |       1 |    NULL |    NULL |
|       2 |       2 |    NULL |    NULL |
+---------+---------+---------+---------+
select max(z0_col2),min(z0_col3) from test_table1 order by z0_col2;
+--------------+--------------+
| max(z0_col2) | min(z0_col3) |
+--------------+--------------+
|         NULL |         NULL |
+--------------+--------------+
# ''/' '
drop table test_table1;
create table test_table1(
z0_col0 int,
z0_col1 int,
z0_col2 char(200) as ('') virtual,
z0_col3 char(200) as (' ') stored
);
insert into test_table1 (z0_col0,z0_col1) values (1,1),(2,2);
select z0_col0,z0_col1,z0_col2 col_vir,z0_col3 col_sto from test_table1 order by z0_col2;
+---------+---------+---------+---------+
| z0_col0 | z0_col1 | col_vir | col_sto |
+---------+---------+---------+---------+
|       1 |       1 |         |         |
|       2 |       2 |         |         |
+---------+---------+---------+---------+
select max(z0_col2),min(z0_col3) from test_table1 order by z0_col2;
+--------------+--------------+
| max(z0_col2) | min(z0_col3) |
+--------------+--------------+
|              |              |
+--------------+--------------+
# 0，小数，负数，日期
drop table test_table1;
create table test_table1(
z0_col0 int,
z0_col1 int,
z0_col2 int as (0) virtual,
z0_col3 int as (3.1415926) stored,
z0_col4 int as (-100) virtual,
z0_col5 date as ('2020/06/22') stored
);
select * from test_table1 order by z0_col2;
+---------+---------+---------+---------+---------+---------+
| z0_col0 | z0_col1 | z0_col2 | z0_col3 | z0_col4 | z0_col5 |
+---------+---------+---------+---------+---------+---------+
+---------+---------+---------+---------+---------+---------+
insert into test_table1 (z0_col0,z0_col1) values (1,1),(2,2);
select * from test_table1 order by z0_col2;
+---------+---------+---------+---------+---------+------------+
| z0_col0 | z0_col1 | z0_col2 | z0_col3 | z0_col4 | z0_col5    |
+---------+---------+---------+---------+---------+------------+
|       1 |       1 |       0 |       3 |    -100 | 2020-06-22 |
|       2 |       2 |       0 |       3 |    -100 | 2020-06-22 |
+---------+---------+---------+---------+---------+------------+
select max(z0_col2),min(z0_col3) from test_table1 order by z0_col2;
+--------------+--------------+
| max(z0_col2) | min(z0_col3) |
+--------------+--------------+
|            0 |            3 |
+--------------+--------------+
# 特殊字符 ' ！@#￥%……&*（）-+'
drop table test_table1;
create table test_table1(
z0_col0 int,
z0_col1 int,
z0_col2 char(200) as (' ！@#￥%……&*（）-+') virtual,
z0_col3 char(200) as (',./?;:|[]{}~$%^&') stored
);
select * from test_table1 order by z0_col2;
+---------+---------+---------+---------+
| z0_col0 | z0_col1 | z0_col2 | z0_col3 |
+---------+---------+---------+---------+
+---------+---------+---------+---------+
insert into test_table1 (z0_col0,z0_col1) values (1,1),(2,2);
select * from test_table1 order by z0_col2;
+---------+---------+----------------------------+------------------+
| z0_col0 | z0_col1 | z0_col2                    | z0_col3          |
+---------+---------+----------------------------+------------------+
|       1 |       1 |  ！@#￥%……&*（）-+         | ,./?;:|[]{}~$%^& |
|       2 |       2 |  ！@#￥%……&*（）-+         | ,./?;:|[]{}~$%^& |
+---------+---------+----------------------------+------------------+
select max(z0_col2),min(z0_col3) from test_table1 order by z0_col2;
+----------------------------+------------------+
| max(z0_col2)               | min(z0_col3)     |
+----------------------------+------------------+
|  ！@#￥%……&*（）-+         | ,./?;:|[]{}~$%^& |
+----------------------------+------------------+
# 汉字，换行,\n,\t,\r
drop table test_table1;
create table test_table1(
z0_col0 int,
z0_col1 int,
z0_col2 char(200) as ('虚拟列') virtual,
z0_col3 char(200) as ('生成列') stored,
z0_col4 char(200) as ('虚拟列\n\t\r转换符') virtual,
z0_col5 char(200) as ('生成列\n\t\r转换符') stored,
z0_col6 char(200) as ('虚拟列
第二行') virtual,
z0_col7 char(200) as ('生成列
第二行') stored
);
select * from test_table1 order by z0_col2;
+---------+---------+---------+---------+---------+---------+---------+---------+
| z0_col0 | z0_col1 | z0_col2 | z0_col3 | z0_col4 | z0_col5 | z0_col6 | z0_col7 |
+---------+---------+---------+---------+---------+---------+---------+---------+
+---------+---------+---------+---------+---------+---------+---------+---------+
insert into test_table1 (z0_col0,z0_col1) values (1,1),(2,2);
select * from test_table1 order by z0_col2;
+---------+---------+-----------+-----------+-----------------------+-----------------------+---------------------+---------------------+
| z0_col0 | z0_col1 | z0_col2   | z0_col3   | z0_col4               | z0_col5               | z0_col6             | z0_col7             |
+---------+---------+-----------+-----------+-----------------------+-----------------------+---------------------+---------------------+
|       1 |       1 | 虚拟列    | 生成列    | 虚拟列
	转换符       | 生成列
	转换符       | 虚拟列
第二行       | 生成列
第二行       |
|       2 |       2 | 虚拟列    | 生成列    | 虚拟列
	转换符       | 生成列
	转换符       | 虚拟列
第二行       | 生成列
第二行       |
+---------+---------+-----------+-----------+-----------------------+-----------------------+---------------------+---------------------+
select max(z0_col2),min(z0_col3) from test_table1 order by z0_col2;
+--------------+--------------+
| max(z0_col2) | min(z0_col3) |
+--------------+--------------+
| 虚拟列       | 生成列       |
+--------------+--------------+
### 生成列：生成列上加默认值
drop table test_table1;
create table test_table1(
id int,
z0_col0 int,
z0_col1 int,
z0_col2 int as(z0_col0/z0_col1) virtual default '0',
z0_col3 int as(z0_col1*z0_col1) stored  default '0'
);
ERROR 42000: You have an error in your SQL syntax; check the manual that corresponds to your OceanBase version for the right syntax to use near 'default '0',
z0_col3 int as(z0_col1*z0_col1) stored  default '0'
)' at line 5
### 生成列：生成列引用生成列     ob不兼容MySQL
drop table test_table1;
create table test_table1(
z0_col0 int,
z0_col1 int,
z0_col2 int as(z0_col1) virtual,
z0_col3 int as(z0_col2) virtual
);
ERROR HY000: 'Defining a generated column on generated column(s)' is not supported for generated columns.
insert into test_table1 (z0_col0,z0_col1) values (10,10),(20,20),(30,30);
ERROR 42S02: Table 'whh.test_table1' doesn't exist
select * from test_table1 order by z0_col2;
ERROR 42S02: Table 'whh.test_table1' doesn't exist
### 表达式：生成列表达式 column / 0
drop table test_table1;
create table test_table1(
id int,
z0_col0 char(200) default '1',
z0_col1 char(200) default '2',
z0_col2 int as(z0_col0/0) virtual,
z0_col3 int as(z0_col1) stored
);
insert into test_table1 (id) values (1);
select z0_col0,z0_col1,z0_col2 col_vir,z0_col3 col_sto from test_table1 order by z0_col2;
+---------+---------+---------+---------+
| z0_col0 | z0_col1 | col_vir | col_sto |
+---------+---------+---------+---------+
| 1       | 2       |    NULL |       2 |
+---------+---------+---------+---------+
select max(z0_col2),min(z0_col3) from test_table1 order by z0_col2;
+--------------+--------------+
| max(z0_col2) | min(z0_col3) |
+--------------+--------------+
|         NULL |            2 |
+--------------+--------------+
### 表达式：生成列引用的普通列使用默认值
drop table test_table1;
create table test_table1(
id int,
z0_col0 int default 30,
z0_col1 int default 5,
z0_col2 int as(z0_col0/z0_col1) virtual,
z0_col3 int as(z0_col1*z0_col1) stored
);
insert into test_table1 (id) values (1);
select z0_col0,z0_col1,z0_col2 col_vir,z0_col3 col_sto from test_table1 order by z0_col2;
+---------+---------+---------+---------+
| z0_col0 | z0_col1 | col_vir | col_sto |
+---------+---------+---------+---------+
|      30 |       5 |       6 |      25 |
+---------+---------+---------+---------+
select max(z0_col2),min(z0_col3) from test_table1 order by z0_col2;
+--------------+--------------+
| max(z0_col2) | min(z0_col3) |
+--------------+--------------+
|            6 |           25 |
+--------------+--------------+
### 事务：向表中插入/删除数据，添加生成列等，再回滚
SET @@AUTOCOMMIT=0;
drop table test_table1;
create table test_table1(
z0_col0 int,
z0_col1 int,
z0_col2 int as(z0_col0/z0_col1) virtual,
z0_col3 int as(z0_col1*z0_col1) stored
);
insert into test_table1 (z0_col0,z0_col1) values (10,10),(20,20),(30,30);
select * from test_table1 order by z0_col2;
+---------+---------+---------+---------+
| z0_col0 | z0_col1 | z0_col2 | z0_col3 |
+---------+---------+---------+---------+
|      10 |      10 |       1 |     100 |
|      20 |      20 |       1 |     400 |
|      30 |      30 |       1 |     900 |
+---------+---------+---------+---------+
# 插入数据再回滚
start transaction;
insert into test_table1 (z0_col0,z0_col1) values (40,40);
select * from test_table1 order by z0_col2;
+---------+---------+---------+---------+
| z0_col0 | z0_col1 | z0_col2 | z0_col3 |
+---------+---------+---------+---------+
|      10 |      10 |       1 |     100 |
|      20 |      20 |       1 |     400 |
|      30 |      30 |       1 |     900 |
|      40 |      40 |       1 |    1600 |
+---------+---------+---------+---------+
rollback;
select z0_col0,z0_col1,z0_col2 col_vir,z0_col3 col_sto from test_table1 order by z0_col2;
+---------+---------+---------+---------+
| z0_col0 | z0_col1 | col_vir | col_sto |
+---------+---------+---------+---------+
|      10 |      10 |       1 |     100 |
|      20 |      20 |       1 |     400 |
|      30 |      30 |       1 |     900 |
+---------+---------+---------+---------+
select max(z0_col2),min(z0_col3) from test_table1 order by z0_col2;
+--------------+--------------+
| max(z0_col2) | min(z0_col3) |
+--------------+--------------+
|            1 |          100 |
+--------------+--------------+
# 删除数据再回滚
start transaction;
delete from test_table1 where z0_col3 = 900;
select * from test_table1 order by z0_col2;
+---------+---------+---------+---------+
| z0_col0 | z0_col1 | z0_col2 | z0_col3 |
+---------+---------+---------+---------+
|      10 |      10 |       1 |     100 |
|      20 |      20 |       1 |     400 |
+---------+---------+---------+---------+
rollback;
select z0_col0,z0_col1,z0_col2 col_vir,z0_col3 col_sto from test_table1 order by z0_col2;
+---------+---------+---------+---------+
| z0_col0 | z0_col1 | col_vir | col_sto |
+---------+---------+---------+---------+
|      10 |      10 |       1 |     100 |
|      20 |      20 |       1 |     400 |
|      30 |      30 |       1 |     900 |
+---------+---------+---------+---------+
select max(z0_col2),min(z0_col3) from test_table1 order by z0_col2;
+--------------+--------------+
| max(z0_col2) | min(z0_col3) |
+--------------+--------------+
|            1 |          100 |
+--------------+--------------+
# 添加生成列再回滚
start transaction;
alter table test_table1 add z0_col4 varchar(100) as (concat(z0_col0,z0_col1)) virtual;
select * from test_table1 order by z0_col2;
+---------+---------+---------+---------+---------+
| z0_col0 | z0_col1 | z0_col2 | z0_col3 | z0_col4 |
+---------+---------+---------+---------+---------+
|      10 |      10 |       1 |     100 | 1010    |
|      20 |      20 |       1 |     400 | 2020    |
|      30 |      30 |       1 |     900 | 3030    |
+---------+---------+---------+---------+---------+
rollback;
select z0_col0,z0_col1,z0_col2 col_vir,z0_col3 col_sto from test_table1 order by z0_col2;
+---------+---------+---------+---------+
| z0_col0 | z0_col1 | col_vir | col_sto |
+---------+---------+---------+---------+
|      10 |      10 |       1 |     100 |
|      20 |      20 |       1 |     400 |
|      30 |      30 |       1 |     900 |
+---------+---------+---------+---------+
select max(z0_col2),min(z0_col3) from test_table1 order by z0_col2;
+--------------+--------------+
| max(z0_col2) | min(z0_col3) |
+--------------+--------------+
|            1 |          100 |
+--------------+--------------+
SET @@AUTOCOMMIT=1;
### 一个表中含有多个虚拟列/存储列(6,7,8...)
drop table test_table1;
create table test_table1(
z0_col0 int,
z0_col1 int,
z0_col2 int as(z0_col0*1) virtual,
z0_col3 int as(z0_col0*2) virtual,
z0_col4 int as(z0_col0*3) virtual,
z0_col5 int as(z0_col0*4) virtual,
z0_col6 int as(z0_col0*5) virtual,
z0_col7 int as(z0_col0*6) virtual,
z0_col10 int as(z0_col1*1) stored,
z0_col11 int as(z0_col1*2) stored,
z0_col12 int as(z0_col1*3) stored,
z0_col13 int as(z0_col1*4) stored,
z0_col14 int as(z0_col1*5) stored,
z0_col15 int as(z0_col1*6) stored
);
insert into test_table1 (z0_col0,z0_col1) values (10,10),(20,20),(30,30);
select * from test_table1 order by z0_col2;
+---------+---------+---------+---------+---------+---------+---------+---------+----------+----------+----------+----------+----------+----------+
| z0_col0 | z0_col1 | z0_col2 | z0_col3 | z0_col4 | z0_col5 | z0_col6 | z0_col7 | z0_col10 | z0_col11 | z0_col12 | z0_col13 | z0_col14 | z0_col15 |
+---------+---------+---------+---------+---------+---------+---------+---------+----------+----------+----------+----------+----------+----------+
|      10 |      10 |      10 |      20 |      30 |      40 |      50 |      60 |       10 |       20 |       30 |       40 |       50 |       60 |
|      20 |      20 |      20 |      40 |      60 |      80 |     100 |     120 |       20 |       40 |       60 |       80 |      100 |      120 |
|      30 |      30 |      30 |      60 |      90 |     120 |     150 |     180 |       30 |       60 |       90 |      120 |      150 |      180 |
+---------+---------+---------+---------+---------+---------+---------+---------+----------+----------+----------+----------+----------+----------+
alter table test_table1 add z0_col8 int as (z0_col0*7) virtual;
alter table test_table1 add z0_col9 int as (z0_col0*8) virtual;
alter table test_table1 add z0_col16 int as (z0_col1*7) stored;
alter table test_table1 add z0_col17 int as (z0_col1*8) stored;
insert into test_table1 (z0_col0,z0_col1) values (10,10),(20,20),(30,30);
select * from test_table1 order by z0_col2;
+---------+---------+---------+---------+---------+---------+---------+---------+----------+----------+----------+----------+----------+----------+---------+---------+----------+----------+
| z0_col0 | z0_col1 | z0_col2 | z0_col3 | z0_col4 | z0_col5 | z0_col6 | z0_col7 | z0_col10 | z0_col11 | z0_col12 | z0_col13 | z0_col14 | z0_col15 | z0_col8 | z0_col9 | z0_col16 | z0_col17 |
+---------+---------+---------+---------+---------+---------+---------+---------+----------+----------+----------+----------+----------+----------+---------+---------+----------+----------+
|      10 |      10 |      10 |      20 |      30 |      40 |      50 |      60 |       10 |       20 |       30 |       40 |       50 |       60 |      70 |      80 |       70 |       80 |
|      10 |      10 |      10 |      20 |      30 |      40 |      50 |      60 |       10 |       20 |       30 |       40 |       50 |       60 |      70 |      80 |       70 |       80 |
|      20 |      20 |      20 |      40 |      60 |      80 |     100 |     120 |       20 |       40 |       60 |       80 |      100 |      120 |     140 |     160 |      140 |      160 |
|      20 |      20 |      20 |      40 |      60 |      80 |     100 |     120 |       20 |       40 |       60 |       80 |      100 |      120 |     140 |     160 |      140 |      160 |
|      30 |      30 |      30 |      60 |      90 |     120 |     150 |     180 |       30 |       60 |       90 |      120 |      150 |      180 |     210 |     240 |      210 |      240 |
|      30 |      30 |      30 |      60 |      90 |     120 |     150 |     180 |       30 |       60 |       90 |      120 |      150 |      180 |     210 |     240 |      210 |      240 |
+---------+---------+---------+---------+---------+---------+---------+---------+----------+----------+----------+----------+----------+----------+---------+---------+----------+----------+
desc test_table1;
+----------+---------+------+-----+-----------------+-------------------+
| Field    | Type    | Null | Key | Default         | Extra             |
+----------+---------+------+-----+-----------------+-------------------+
| z0_col0  | int(11) | YES  |     | NULL            |                   |
| z0_col1  | int(11) | YES  |     | NULL            |                   |
| z0_col2  | int(11) | YES  |     | (`z0_col0` * 1) | VIRTUAL GENERATED |
| z0_col3  | int(11) | YES  |     | (`z0_col0` * 2) | VIRTUAL GENERATED |
| z0_col4  | int(11) | YES  |     | (`z0_col0` * 3) | VIRTUAL GENERATED |
| z0_col5  | int(11) | YES  |     | (`z0_col0` * 4) | VIRTUAL GENERATED |
| z0_col6  | int(11) | YES  |     | (`z0_col0` * 5) | VIRTUAL GENERATED |
| z0_col7  | int(11) | YES  |     | (`z0_col0` * 6) | VIRTUAL GENERATED |
| z0_col10 | int(11) | YES  |     | (`z0_col1` * 1) | STORED GENERATED  |
| z0_col11 | int(11) | YES  |     | (`z0_col1` * 2) | STORED GENERATED  |
| z0_col12 | int(11) | YES  |     | (`z0_col1` * 3) | STORED GENERATED  |
| z0_col13 | int(11) | YES  |     | (`z0_col1` * 4) | STORED GENERATED  |
| z0_col14 | int(11) | YES  |     | (`z0_col1` * 5) | STORED GENERATED  |
| z0_col15 | int(11) | YES  |     | (`z0_col1` * 6) | STORED GENERATED  |
| z0_col8  | int(11) | YES  |     | (`z0_col0` * 7) | VIRTUAL GENERATED |
| z0_col9  | int(11) | YES  |     | (`z0_col0` * 8) | VIRTUAL GENERATED |
| z0_col16 | int(11) | YES  |     | (`z0_col1` * 7) | STORED GENERATED  |
| z0_col17 | int(11) | YES  |     | (`z0_col1` * 8) | STORED GENERATED  |
+----------+---------+------+-----+-----------------+-------------------+
drop user whh@'%';
drop database IF EXISTS whh ;
PURGE RECYCLEBIN;
# oracle_genrate-1-1 系统租户下修改配置 _rowsets_max_rows = 2
alter system set _rowsets_enabled = true tenant sys;
alter system set _rowsets_enabled = true tenant all_user;
alter system set _rowsets_enabled = true tenant all_meta;
alter system set _rowsets_max_rows = 2 tenant sys;
alter system set _rowsets_max_rows = 2 tenant all_user;
alter system set _rowsets_max_rows = 2 tenant all_meta;
alter system flush plan cache global;
# 环境清理
purge recyclebin;
result_format: 4
drop user whh@'%';
drop database if exists whh ;
create user whh identified by 'whh';
create database whh ;
grant all on *.* to whh WITH GRANT OPTION;


#############################################################################################
############ mysql_genrate-1-2 作为分区键
### key分区
drop table virtual_table;
create table virtual_table(
z0_col0 int, 
z0_col1 int,
z0_col2 int as(z0_col0+z0_col1)) 
partition by key(z0_col2) partitions 2;
insert into virtual_table (z0_col0,z0_col1) values (0,0),(NULL,NULL),(1.111,222),(10,10);
select z0_col0,z0_col1,z0_col2 from virtual_table partition(p0) order by z0_col2;
+---------+---------+---------+
| z0_col0 | z0_col1 | z0_col2 |
+---------+---------+---------+
|      10 |      10 |      20 |
|       1 |     222 |     223 |
+---------+---------+---------+
select z0_col0,z0_col1,z0_col2 from virtual_table partition(p1) order by z0_col2;
+---------+---------+---------+
| z0_col0 | z0_col1 | z0_col2 |
+---------+---------+---------+
|    NULL |    NULL |    NULL |
|       0 |       0 |       0 |
+---------+---------+---------+
explain select z0_col0,z0_col1,z0_col2 from virtual_table where z0_col2 = 0 order by z0_col2;
Query Plan
========================================================
|ID|OPERATOR       |NAME         |EST.ROWS|EST.TIME(us)|
--------------------------------------------------------
|0 |TABLE FULL SCAN|virtual_table|1       |3           |
========================================================
Outputs & filters:
-------------------------------------
  0 - output([virtual_table.z0_col0], [virtual_table.z0_col1], [column_conv(INT,PS:(11,0),NULL,cast(virtual_table.z0_col0 + virtual_table.z0_col1, INT(-1,
       0)))]), filter([column_conv(INT,PS:(11,0),NULL,cast(virtual_table.z0_col0 + virtual_table.z0_col1, INT(-1, 0))) = 0]), rowset=2
      access([virtual_table.z0_col0], [virtual_table.z0_col1]), partitions(p1)
      is_index_back=false, is_global_index=false, filter_before_indexback[false], 
      range_key([virtual_table.__pk_increment]), range(MIN ; MAX)always true
explain select z0_col0,z0_col1,z0_col2 from virtual_table where z0_col0+z0_col1 = 0 order by z0_col2;
Query Plan
====================================================================
|ID|OPERATOR                   |NAME         |EST.ROWS|EST.TIME(us)|
--------------------------------------------------------------------
|0 |PX COORDINATOR MERGE SORT  |             |1       |7           |
|1 |└─EXCHANGE OUT DISTR       |:EX10000     |1       |6           |
|2 |  └─SORT                   |             |1       |5           |
|3 |    └─PX PARTITION ITERATOR|             |1       |5           |
|4 |      └─TABLE FULL SCAN    |virtual_table|1       |5           |
====================================================================
Outputs & filters:
-------------------------------------
  0 - output([INTERNAL_FUNCTION(virtual_table.z0_col0, virtual_table.z0_col1, column_conv(INT,PS:(11,0),NULL,cast(virtual_table.z0_col0 + virtual_table.z0_col1,
       INT(-1, 0))))]), filter(nil), rowset=2
      sort_keys([column_conv(INT,PS:(11,0),NULL,cast(virtual_table.z0_col0 + virtual_table.z0_col1, INT(-1, 0))), ASC])
  1 - output([column_conv(INT,PS:(11,0),NULL,cast(virtual_table.z0_col0 + virtual_table.z0_col1, INT(-1, 0)))], [INTERNAL_FUNCTION(virtual_table.z0_col0,
       virtual_table.z0_col1, column_conv(INT,PS:(11,0),NULL,cast(virtual_table.z0_col0 + virtual_table.z0_col1, INT(-1, 0))))]), filter(nil), rowset=2
      dop=1
  2 - output([column_conv(INT,PS:(11,0),NULL,cast(virtual_table.z0_col0 + virtual_table.z0_col1, INT(-1, 0)))], [virtual_table.z0_col0], [virtual_table.z0_col1]), filter(nil), rowset=2
      sort_keys([column_conv(INT,PS:(11,0),NULL,cast(virtual_table.z0_col0 + virtual_table.z0_col1, INT(-1, 0))), ASC])
  3 - output([virtual_table.z0_col0], [virtual_table.z0_col1], [column_conv(INT,PS:(11,0),NULL,cast(virtual_table.z0_col0 + virtual_table.z0_col1, INT(-1,
       0)))]), filter(nil), rowset=2
      force partition granule
  4 - output([virtual_table.z0_col0], [virtual_table.z0_col1], [column_conv(INT,PS:(11,0),NULL,cast(virtual_table.z0_col0 + virtual_table.z0_col1, INT(-1,
       0)))]), filter([virtual_table.z0_col0 + virtual_table.z0_col1 = 0]), rowset=2
      access([virtual_table.z0_col0], [virtual_table.z0_col1]), partitions(p[0-1])
      is_index_back=false, is_global_index=false, filter_before_indexback[false], 
      range_key([virtual_table.__pk_increment]), range(MIN ; MAX)always true
drop table stored_table;
create table stored_table(
z0_col0 int, 
z0_col1 int,
z0_col2 int as(z0_col0+z0_col1) stored) 
partition by key(z0_col2) partitions 3;
insert into stored_table (z0_col0,z0_col1) values (0,0),(NULL,NULL),(1.111,222),(10,10);
select z0_col0,z0_col1,z0_col2 from stored_table partition(p0) order by z0_col2;
+---------+---------+---------+
| z0_col0 | z0_col1 | z0_col2 |
+---------+---------+---------+
|      10 |      10 |      20 |
+---------+---------+---------+
select z0_col0,z0_col1,z0_col2 from stored_table partition(p1) order by z0_col2;
+---------+---------+---------+
| z0_col0 | z0_col1 | z0_col2 |
+---------+---------+---------+
|       1 |     222 |     223 |
+---------+---------+---------+
select z0_col0,z0_col1,z0_col2 from stored_table partition(p2) order by z0_col2;
+---------+---------+---------+
| z0_col0 | z0_col1 | z0_col2 |
+---------+---------+---------+
|    NULL |    NULL |    NULL |
|       0 |       0 |       0 |
+---------+---------+---------+
explain select z0_col0,z0_col1,z0_col2 from stored_table where z0_col2 = 0 order by z0_col2;
Query Plan
=======================================================
|ID|OPERATOR       |NAME        |EST.ROWS|EST.TIME(us)|
-------------------------------------------------------
|0 |TABLE FULL SCAN|stored_table|1       |3           |
=======================================================
Outputs & filters:
-------------------------------------
  0 - output([stored_table.z0_col0], [stored_table.z0_col1], [stored_table.z0_col2]), filter([stored_table.z0_col2 = 0]), rowset=2
      access([stored_table.z0_col0], [stored_table.z0_col1], [stored_table.z0_col2]), partitions(p2)
      is_index_back=false, is_global_index=false, filter_before_indexback[false], 
      range_key([stored_table.__pk_increment]), range(MIN ; MAX)always true
explain select z0_col0,z0_col1,z0_col2 from stored_table where z0_col0+z0_col1 = 0 order by z0_col2;
Query Plan
===================================================================
|ID|OPERATOR                   |NAME        |EST.ROWS|EST.TIME(us)|
-------------------------------------------------------------------
|0 |PX COORDINATOR MERGE SORT  |            |1       |9           |
|1 |└─EXCHANGE OUT DISTR       |:EX10000    |1       |8           |
|2 |  └─SORT                   |            |1       |7           |
|3 |    └─PX PARTITION ITERATOR|            |1       |7           |
|4 |      └─TABLE FULL SCAN    |stored_table|1       |7           |
===================================================================
Outputs & filters:
-------------------------------------
  0 - output([INTERNAL_FUNCTION(stored_table.z0_col0, stored_table.z0_col1, stored_table.z0_col2)]), filter(nil), rowset=2
      sort_keys([stored_table.z0_col2, ASC])
  1 - output([stored_table.z0_col2], [INTERNAL_FUNCTION(stored_table.z0_col0, stored_table.z0_col1, stored_table.z0_col2)]), filter(nil), rowset=2
      dop=1
  2 - output([stored_table.z0_col2], [stored_table.z0_col0], [stored_table.z0_col1]), filter(nil), rowset=2
      sort_keys([stored_table.z0_col2, ASC])
  3 - output([stored_table.z0_col0], [stored_table.z0_col1], [stored_table.z0_col2]), filter(nil), rowset=2
      force partition granule
  4 - output([stored_table.z0_col0], [stored_table.z0_col1], [stored_table.z0_col2]), filter([stored_table.z0_col0 + stored_table.z0_col1 = 0]), rowset=2
      access([stored_table.z0_col0], [stored_table.z0_col1], [stored_table.z0_col2]), partitions(p[0-2])
      is_index_back=false, is_global_index=false, filter_before_indexback[false], 
      range_key([stored_table.__pk_increment]), range(MIN ; MAX)always true
### COLUMNS分区
drop table virtual_table;
create table virtual_table(
z0_col0 int, 
z0_col1 int,
z0_col2 int as (abs(z0_col0-z0_col1)))
partition by range columns(z0_col2) (
partition p0 values less than (10),
partition p1 values less than (20),
partition p2 values less than maxvalue);
insert into virtual_table (z0_col0,z0_col1) values (0,0),(NULL,NULL),(5,25),(20,30),(100,10);
select z0_col0,z0_col1,z0_col2 from virtual_table partition(p0) order by z0_col2;
+---------+---------+---------+
| z0_col0 | z0_col1 | z0_col2 |
+---------+---------+---------+
|    NULL |    NULL |    NULL |
|       0 |       0 |       0 |
+---------+---------+---------+
select z0_col0,z0_col1,z0_col2 from virtual_table partition(p1) order by z0_col2;
+---------+---------+---------+
| z0_col0 | z0_col1 | z0_col2 |
+---------+---------+---------+
|      20 |      30 |      10 |
+---------+---------+---------+
select z0_col0,z0_col1,z0_col2 from virtual_table partition(p2) order by z0_col2;
+---------+---------+---------+
| z0_col0 | z0_col1 | z0_col2 |
+---------+---------+---------+
|       5 |      25 |      20 |
|     100 |      10 |      90 |
+---------+---------+---------+
explain select z0_col0,z0_col1,z0_col2 from virtual_table where z0_col2 = 0 order by z0_col2;
Query Plan
========================================================
|ID|OPERATOR       |NAME         |EST.ROWS|EST.TIME(us)|
--------------------------------------------------------
|0 |TABLE FULL SCAN|virtual_table|1       |3           |
========================================================
Outputs & filters:
-------------------------------------
  0 - output([virtual_table.z0_col0], [virtual_table.z0_col1], [column_conv(INT,PS:(11,0),NULL,cast(abs(virtual_table.z0_col0 - virtual_table.z0_col1), 
      INT(-1, 0)))]), filter([column_conv(INT,PS:(11,0),NULL,cast(abs(virtual_table.z0_col0 - virtual_table.z0_col1), INT(-1, 0))) = 0]), rowset=2
      access([virtual_table.z0_col0], [virtual_table.z0_col1]), partitions(p0)
      is_index_back=false, is_global_index=false, filter_before_indexback[false], 
      range_key([virtual_table.__pk_increment]), range(MIN ; MAX)always true
explain select z0_col0,z0_col1,z0_col2 from virtual_table where abs(z0_col0-z0_col1) = 0 order by z0_col2;
Query Plan
====================================================================
|ID|OPERATOR                   |NAME         |EST.ROWS|EST.TIME(us)|
--------------------------------------------------------------------
|0 |PX COORDINATOR MERGE SORT  |             |1       |9           |
|1 |└─EXCHANGE OUT DISTR       |:EX10000     |1       |8           |
|2 |  └─SORT                   |             |1       |7           |
|3 |    └─PX PARTITION ITERATOR|             |1       |7           |
|4 |      └─TABLE FULL SCAN    |virtual_table|1       |7           |
====================================================================
Outputs & filters:
-------------------------------------
  0 - output([INTERNAL_FUNCTION(virtual_table.z0_col0, virtual_table.z0_col1, column_conv(INT,PS:(11,0),NULL,cast(abs(virtual_table.z0_col0 - virtual_table.z0_col1),
       INT(-1, 0))))]), filter(nil), rowset=2
      sort_keys([column_conv(INT,PS:(11,0),NULL,cast(abs(virtual_table.z0_col0 - virtual_table.z0_col1), INT(-1, 0))), ASC])
  1 - output([column_conv(INT,PS:(11,0),NULL,cast(abs(virtual_table.z0_col0 - virtual_table.z0_col1), INT(-1, 0)))], [INTERNAL_FUNCTION(virtual_table.z0_col0,
       virtual_table.z0_col1, column_conv(INT,PS:(11,0),NULL,cast(abs(virtual_table.z0_col0 - virtual_table.z0_col1), INT(-1, 0))))]), filter(nil), rowset=2
      dop=1
  2 - output([column_conv(INT,PS:(11,0),NULL,cast(abs(virtual_table.z0_col0 - virtual_table.z0_col1), INT(-1, 0)))], [virtual_table.z0_col0], [virtual_table.z0_col1]), filter(nil), rowset=2
      sort_keys([column_conv(INT,PS:(11,0),NULL,cast(abs(virtual_table.z0_col0 - virtual_table.z0_col1), INT(-1, 0))), ASC])
  3 - output([virtual_table.z0_col0], [virtual_table.z0_col1], [column_conv(INT,PS:(11,0),NULL,cast(abs(virtual_table.z0_col0 - virtual_table.z0_col1), 
      INT(-1, 0)))]), filter(nil), rowset=2
      force partition granule
  4 - output([virtual_table.z0_col0], [virtual_table.z0_col1], [column_conv(INT,PS:(11,0),NULL,cast(abs(virtual_table.z0_col0 - virtual_table.z0_col1), 
      INT(-1, 0)))]), filter([abs(virtual_table.z0_col0 - virtual_table.z0_col1) = 0]), rowset=2
      access([virtual_table.z0_col0], [virtual_table.z0_col1]), partitions(p[0-2])
      is_index_back=false, is_global_index=false, filter_before_indexback[false], 
      range_key([virtual_table.__pk_increment]), range(MIN ; MAX)always true
drop table stored_table;
create table stored_table(
z0_col0 int,
z0_col1 int,
z0_col2 int as (abs(z0_col0-z0_col1)) stored)
partition by range columns(z0_col2) (
partition p0 values less than (10),
partition p1 values less than (20),
partition p2 values less than maxvalue);
insert into stored_table (z0_col0,z0_col1) values (0,0),(NULL,NULL),(5,25),(20,30),(100,10);
select z0_col0,z0_col1,z0_col2 from stored_table partition(p0) order by z0_col2;
+---------+---------+---------+
| z0_col0 | z0_col1 | z0_col2 |
+---------+---------+---------+
|    NULL |    NULL |    NULL |
|       0 |       0 |       0 |
+---------+---------+---------+
select z0_col0,z0_col1,z0_col2 from stored_table partition(p1) order by z0_col2;
+---------+---------+---------+
| z0_col0 | z0_col1 | z0_col2 |
+---------+---------+---------+
|      20 |      30 |      10 |
+---------+---------+---------+
select z0_col0,z0_col1,z0_col2 from stored_table partition(p2) order by z0_col2;
+---------+---------+---------+
| z0_col0 | z0_col1 | z0_col2 |
+---------+---------+---------+
|       5 |      25 |      20 |
|     100 |      10 |      90 |
+---------+---------+---------+
explain select z0_col0,z0_col1,z0_col2 from stored_table where z0_col2 = 0 order by z0_col2;
Query Plan
=======================================================
|ID|OPERATOR       |NAME        |EST.ROWS|EST.TIME(us)|
-------------------------------------------------------
|0 |TABLE FULL SCAN|stored_table|1       |3           |
=======================================================
Outputs & filters:
-------------------------------------
  0 - output([stored_table.z0_col0], [stored_table.z0_col1], [stored_table.z0_col2]), filter([stored_table.z0_col2 = 0]), rowset=2
      access([stored_table.z0_col0], [stored_table.z0_col1], [stored_table.z0_col2]), partitions(p0)
      is_index_back=false, is_global_index=false, filter_before_indexback[false], 
      range_key([stored_table.__pk_increment]), range(MIN ; MAX)always true
explain select z0_col0,z0_col1,z0_col2 from stored_table where abs(z0_col0-z0_col1) = 0 order by z0_col2;
Query Plan
===================================================================
|ID|OPERATOR                   |NAME        |EST.ROWS|EST.TIME(us)|
-------------------------------------------------------------------
|0 |PX COORDINATOR MERGE SORT  |            |1       |9           |
|1 |└─EXCHANGE OUT DISTR       |:EX10000    |1       |8           |
|2 |  └─SORT                   |            |1       |7           |
|3 |    └─PX PARTITION ITERATOR|            |1       |7           |
|4 |      └─TABLE FULL SCAN    |stored_table|1       |7           |
===================================================================
Outputs & filters:
-------------------------------------
  0 - output([INTERNAL_FUNCTION(stored_table.z0_col0, stored_table.z0_col1, stored_table.z0_col2)]), filter(nil), rowset=2
      sort_keys([stored_table.z0_col2, ASC])
  1 - output([stored_table.z0_col2], [INTERNAL_FUNCTION(stored_table.z0_col0, stored_table.z0_col1, stored_table.z0_col2)]), filter(nil), rowset=2
      dop=1
  2 - output([stored_table.z0_col2], [stored_table.z0_col0], [stored_table.z0_col1]), filter(nil), rowset=2
      sort_keys([stored_table.z0_col2, ASC])
  3 - output([stored_table.z0_col0], [stored_table.z0_col1], [stored_table.z0_col2]), filter(nil), rowset=2
      force partition granule
  4 - output([stored_table.z0_col0], [stored_table.z0_col1], [stored_table.z0_col2]), filter([abs(stored_table.z0_col0 - stored_table.z0_col1) = 0]), rowset=2
      access([stored_table.z0_col0], [stored_table.z0_col1], [stored_table.z0_col2]), partitions(p[0-2])
      is_index_back=false, is_global_index=false, filter_before_indexback[false], 
      range_key([stored_table.__pk_increment]), range(MIN ; MAX)always true
### 视图
# 单基表 含有虚拟列(VIRTUAL)的表
drop table virtual_table;
create table virtual_table(
z0_col0 char(100), 
z0_col1 varchar(100),
z0_col2 varchar(100) as (concat(z0_col0,z0_col1)) virtual);
insert into virtual_table (z0_col0,z0_col1) values (0,0),(NULL,NULL),('2022-06-21','ten'),(100,10.00);
select z0_col0,z0_col1,z0_col2 from virtual_table order by z0_col2;
+------------+---------+---------------+
| z0_col0    | z0_col1 | z0_col2       |
+------------+---------+---------------+
| NULL       | NULL    | NULL          |
| 0          | 0       | 00            |
| 100        | 10.00   | 10010.00      |
| 2022-06-21 | ten     | 2022-06-21ten |
+------------+---------+---------------+
drop view view1;
create view view1 as select z0_col0,z0_col1,z0_col2 from virtual_table where length(z0_col2)>1 order by 1;
select * from view1 order by 1;
+------------+---------+---------------+
| z0_col0    | z0_col1 | z0_col2       |
+------------+---------+---------------+
| 0          | 0       | 00            |
| 100        | 10.00   | 10010.00      |
| 2022-06-21 | ten     | 2022-06-21ten |
+------------+---------+---------------+
insert into view1 (z0_col0,z0_col1) values ('view-','-insert');
select * from view1 order by 1;
+------------+---------+---------------+
| z0_col0    | z0_col1 | z0_col2       |
+------------+---------+---------------+
| 0          | 0       | 00            |
| 100        | 10.00   | 10010.00      |
| 2022-06-21 | ten     | 2022-06-21ten |
| view-      | -insert | view--insert  |
+------------+---------+---------------+
update  view1 set z0_col2=0 where 1=1;
ERROR HY000: The value specified for generated column 'z0_col2' in table 'view1' is not allowed
# 单基表 含有生成列(STORED)的表
drop table stored_table;
create table stored_table (
z0_col0 char(100), 
z0_col1 varchar(100),
z0_col2 varchar(100) as (concat(z0_col0,z0_col1)) stored);
insert into stored_table (z0_col0,z0_col1) values (0,0),(NULL,NULL),('2022-06-21','ten'),(100,10.00);
select z0_col0,z0_col1,z0_col2 from stored_table order by z0_col2;
+------------+---------+---------------+
| z0_col0    | z0_col1 | z0_col2       |
+------------+---------+---------------+
| NULL       | NULL    | NULL          |
| 0          | 0       | 00            |
| 100        | 10.00   | 10010.00      |
| 2022-06-21 | ten     | 2022-06-21ten |
+------------+---------+---------------+
drop view view1;
create view view1 as select z0_col0,z0_col1,z0_col2 from stored_table where length(z0_col2)>1 order by 1;
select * from view1 order by z0_col2;
+------------+---------+---------------+
| z0_col0    | z0_col1 | z0_col2       |
+------------+---------+---------------+
| 0          | 0       | 00            |
| 100        | 10.00   | 10010.00      |
| 2022-06-21 | ten     | 2022-06-21ten |
+------------+---------+---------------+
insert into view1 (z0_col0,z0_col1) values ('view-','-insert');
select * from view1 order by z0_col2;
+------------+---------+---------------+
| z0_col0    | z0_col1 | z0_col2       |
+------------+---------+---------------+
| 0          | 0       | 00            |
| 100        | 10.00   | 10010.00      |
| 2022-06-21 | ten     | 2022-06-21ten |
| view-      | -insert | view--insert  |
+------------+---------+---------------+
update  view1 set z0_col2=0 where 1=1;
ERROR HY000: The value specified for generated column 'z0_col2' in table 'view1' is not allowed
# 单基表 普通的表，后追加生成列(VIRTUAL/STORED)
drop table stored_table;
create table stored_table (
z0_col0 char(100), 
z0_col1 varchar(100));
alter table stored_table add z0_col2 varchar(100) as (concat(z0_col0,z0_col1)) virtual;
alter table stored_table add z0_col3 varchar(100) as (lower(concat(z0_col0,z0_col1))) stored;
insert into stored_table (z0_col0,z0_col1) values (0,0),(NULL,NULL),('2022-06-21','ten'),('WANGHUANHUAN ','CHINA');
select z0_col0,z0_col1,z0_col2,z0_col3 from stored_table order by z0_col1;
+--------------+---------+-------------------+-------------------+
| z0_col0      | z0_col1 | z0_col2           | z0_col3           |
+--------------+---------+-------------------+-------------------+
| NULL         | NULL    | NULL              | NULL              |
| 0            | 0       | 00                | 00                |
| WANGHUANHUAN | CHINA   | WANGHUANHUANCHINA | wanghuanhuanchina |
| 2022-06-21   | ten     | 2022-06-21ten     | 2022-06-21ten     |
+--------------+---------+-------------------+-------------------+
drop view view1;
create view view1 as select * from stored_table;
select * from view1 order by z0_col2;
+--------------+---------+-------------------+-------------------+
| z0_col0      | z0_col1 | z0_col2           | z0_col3           |
+--------------+---------+-------------------+-------------------+
| NULL         | NULL    | NULL              | NULL              |
| 0            | 0       | 00                | 00                |
| 2022-06-21   | ten     | 2022-06-21ten     | 2022-06-21ten     |
| WANGHUANHUAN | CHINA   | WANGHUANHUANCHINA | wanghuanhuanchina |
+--------------+---------+-------------------+-------------------+
update  view1 set z0_col2=0 where 1=1;
ERROR HY000: The value specified for generated column 'z0_col2' in table 'view1' is not allowed
# 单基表 两个含有虚拟列(VIRTUAL)的表
drop table virtual_table1;
create  table virtual_table1 (
id int,
z0_col0 char(100), 
z0_col1 varchar(100),
z0_col2 varchar(100) as (concat(z0_col0,z0_col1)) virtual);
insert into virtual_table1 (id,z0_col0,z0_col1) values (0,0,0),(1,NULL,NULL),(2,'virtual_table1','one'),(3,100,10.00);
select id,z0_col0,z0_col1,z0_col2 from virtual_table1 order by z0_col2;
+------+----------------+---------+-------------------+
| id   | z0_col0        | z0_col1 | z0_col2           |
+------+----------------+---------+-------------------+
|    1 | NULL           | NULL    | NULL              |
|    0 | 0              | 0       | 00                |
|    3 | 100            | 10.00   | 10010.00          |
|    2 | virtual_table1 | one     | virtual_table1one |
+------+----------------+---------+-------------------+
drop table virtual_table2;
create  table virtual_table2 (
id int,
z1_col0 char(100), 
z1_col1 varchar(100),
z1_col2 varchar(100) as (concat(z1_col0,z1_col1)) virtual);
insert into virtual_table2 (id,z1_col0,z1_col1) values (0,0,0),(1,NULL,NULL),(2,'virtual_table2','two'),(3,200,20.00);
select id,z1_col0,z1_col1,z1_col2 from virtual_table2 order by z1_col2;
+------+----------------+---------+-------------------+
| id   | z1_col0        | z1_col1 | z1_col2           |
+------+----------------+---------+-------------------+
|    1 | NULL           | NULL    | NULL              |
|    0 | 0              | 0       | 00                |
|    3 | 200            | 20.00   | 20020.00          |
|    2 | virtual_table2 | two     | virtual_table2two |
+------+----------------+---------+-------------------+
drop view view1;
create view view1 as select t1.z0_col0,t1.z0_col1,t1.z0_col2,t2.z1_col0,t2.z1_col1,t2.z1_col2 from virtual_table1 t1 inner join virtual_table2 t2 on t1.id=t2.id order by 1;
select * from view1 order by 1;
+----------------+---------+-------------------+----------------+---------+-------------------+
| z0_col0        | z0_col1 | z0_col2           | z1_col0        | z1_col1 | z1_col2           |
+----------------+---------+-------------------+----------------+---------+-------------------+
| NULL           | NULL    | NULL              | NULL           | NULL    | NULL              |
| 0              | 0       | 00                | 0              | 0       | 00                |
| 100            | 10.00   | 10010.00          | 200            | 20.00   | 20020.00          |
| virtual_table1 | one     | virtual_table1one | virtual_table2 | two     | virtual_table2two |
+----------------+---------+-------------------+----------------+---------+-------------------+
insert into view1 (z0_col0,z0_col1,z1_col0,z1_col1) values ('view-','-insert1','view-','-insert2');
ERROR HY000: Can not modify more than one base table through a join view 'whh.view1'
# 单基表 两个含有生成列(STORED)的表
drop table stored_table1;
create  table stored_table1 (
id int,
z0_col0 char(100), 
z0_col1 varchar(100),
z0_col2 varchar(100) as (concat(z0_col0,z0_col1)) stored);
insert into stored_table1 (id,z0_col0,z0_col1) values (0,0,0),(1,NULL,NULL),(2,'stored_table1','one'),(3,100,10.00);
select id,z0_col0,z0_col1,z0_col2 from stored_table1 order by z0_col2;
+------+---------------+---------+------------------+
| id   | z0_col0       | z0_col1 | z0_col2          |
+------+---------------+---------+------------------+
|    1 | NULL          | NULL    | NULL             |
|    0 | 0             | 0       | 00               |
|    3 | 100           | 10.00   | 10010.00         |
|    2 | stored_table1 | one     | stored_table1one |
+------+---------------+---------+------------------+
drop table stored_table2;
create  table stored_table2 (
id int,
z1_col0 char(100), 
z1_col1 varchar(100),
z1_col2 varchar(100) as (concat(z1_col0,z1_col1)) stored);
insert into stored_table2 (id,z1_col0,z1_col1) values (0,0,0),(1,NULL,NULL),(2,'stored_table2','two'),(3,200,20.00);
select id,z1_col0,z1_col1,z1_col2 from stored_table2 order by z1_col2;
+------+---------------+---------+------------------+
| id   | z1_col0       | z1_col1 | z1_col2          |
+------+---------------+---------+------------------+
|    1 | NULL          | NULL    | NULL             |
|    0 | 0             | 0       | 00               |
|    3 | 200           | 20.00   | 20020.00         |
|    2 | stored_table2 | two     | stored_table2two |
+------+---------------+---------+------------------+
drop view view1;
create view view1 as select t1.z0_col0,t1.z0_col1,t1.z0_col2,t2.z1_col0,t2.z1_col1,t2.z1_col2 from stored_table1 t1 inner join stored_table2 t2 on t1.id=t2.id order by 1;
select * from view1 order by z0_col2;
+---------------+---------+------------------+---------------+---------+------------------+
| z0_col0       | z0_col1 | z0_col2          | z1_col0       | z1_col1 | z1_col2          |
+---------------+---------+------------------+---------------+---------+------------------+
| NULL          | NULL    | NULL             | NULL          | NULL    | NULL             |
| 0             | 0       | 00               | 0             | 0       | 00               |
| 100           | 10.00   | 10010.00         | 200           | 20.00   | 20020.00         |
| stored_table1 | one     | stored_table1one | stored_table2 | two     | stored_table2two |
+---------------+---------+------------------+---------------+---------+------------------+
insert into view1 (z0_col0,z0_col1,z1_col0,z1_col1) values ('view-','-insert1','view-','-insert2');
ERROR HY000: Can not modify more than one base table through a join view 'whh.view1'
# 单基表 一个含有虚拟列(VIRTUAL)的表，一个含有生成列(STORED)的表
drop table virtual_table1;
create  table virtual_table1 (
id int,
z0_col0 char(100), 
z0_col1 varchar(100),
z0_col2 varchar(100) as (concat(z0_col0,z0_col1)) virtual);
insert into virtual_table1 (id,z0_col0,z0_col1) values (0,0,0),(1,NULL,NULL),(2,'virtual_table1','one'),(3,100,10.00);
select id,z0_col0,z0_col1,z0_col2 from virtual_table1 order by z0_col2;
+------+----------------+---------+-------------------+
| id   | z0_col0        | z0_col1 | z0_col2           |
+------+----------------+---------+-------------------+
|    1 | NULL           | NULL    | NULL              |
|    0 | 0              | 0       | 00                |
|    3 | 100            | 10.00   | 10010.00          |
|    2 | virtual_table1 | one     | virtual_table1one |
+------+----------------+---------+-------------------+
drop table stored_table2;
create  table stored_table2 (
id int,
z1_col0 char(100), 
z1_col1 varchar(100),
z1_col2 varchar(100) as (concat(z1_col0,z1_col1)) stored);
insert into stored_table2 (id,z1_col0,z1_col1) values (0,0,0),(1,NULL,NULL),(2,'stored_table2','two'),(3,200,20.00);
select id,z1_col0,z1_col1,z1_col2 from stored_table2 order by z1_col2;
+------+---------------+---------+------------------+
| id   | z1_col0       | z1_col1 | z1_col2          |
+------+---------------+---------+------------------+
|    1 | NULL          | NULL    | NULL             |
|    0 | 0             | 0       | 00               |
|    3 | 200           | 20.00   | 20020.00         |
|    2 | stored_table2 | two     | stored_table2two |
+------+---------------+---------+------------------+
drop view view1;
create view view1 as select t1.z0_col0,t1.z0_col1,t1.z0_col2,t2.z1_col0,t2.z1_col1,t2.z1_col2 from virtual_table1 t1 inner join stored_table2 t2 on t1.id=t2.id order by 1;
select * from view1 order by z0_col2;
+----------------+---------+-------------------+---------------+---------+------------------+
| z0_col0        | z0_col1 | z0_col2           | z1_col0       | z1_col1 | z1_col2          |
+----------------+---------+-------------------+---------------+---------+------------------+
| NULL           | NULL    | NULL              | NULL          | NULL    | NULL             |
| 0              | 0       | 00                | 0             | 0       | 00               |
| 100            | 10.00   | 10010.00          | 200           | 20.00   | 20020.00         |
| virtual_table1 | one     | virtual_table1one | stored_table2 | two     | stored_table2two |
+----------------+---------+-------------------+---------------+---------+------------------+
insert into view1 (z0_col0,z0_col1,z1_col0,z1_col1) values ('view-','-insert1','view-','-insert2');
ERROR HY000: Can not modify more than one base table through a join view 'whh.view1'
### ALTER TABLE 语句
# RENAME 重命名表
drop table test_table;
create table test_table(
z0_col0 float, 
z0_col1 float,
z0_col2 float as(z0_col0+z0_col1) virtual,
z0_col3 float as(floor(z0_col0+z0_col1)) stored
);
insert into test_table (z0_col0,z0_col1) values (0,0),(NULL,NULL),(1.111,22.2),(10.5,10.9),(-100.5,20.9);
select z0_col0,z0_col1,z0_col2,abs(z0_col3) from test_table order by z0_col2;
+---------+---------+---------+--------------+
| z0_col0 | z0_col1 | z0_col2 | abs(z0_col3) |
+---------+---------+---------+--------------+
|    NULL |    NULL |    NULL |         NULL |
|  -100.5 |    20.9 |   -79.6 |           80 |
|       0 |       0 |       0 |            0 |
|    10.5 |    10.9 |    21.4 |           21 |
|   1.111 |    22.2 |  23.311 |           23 |
+---------+---------+---------+--------------+
select max(z0_col2),min(z0_col3) from test_table order by z0_col2;
+--------------+--------------+
| max(z0_col2) | min(z0_col3) |
+--------------+--------------+
|       23.311 |          -80 |
+--------------+--------------+
drop table new_test_table;
alter table test_table rename to new_test_table;
insert into new_test_table (z0_col0,z0_col1) values (100,200);
select z0_col0,z0_col1,z0_col2,abs(z0_col3) from new_test_table order by z0_col2;
+---------+---------+---------+--------------+
| z0_col0 | z0_col1 | z0_col2 | abs(z0_col3) |
+---------+---------+---------+--------------+
|    NULL |    NULL |    NULL |         NULL |
|  -100.5 |    20.9 |   -79.6 |           80 |
|       0 |       0 |       0 |            0 |
|    10.5 |    10.9 |    21.4 |           21 |
|   1.111 |    22.2 |  23.311 |           23 |
|     100 |     200 |     300 |          300 |
+---------+---------+---------+--------------+
# RENAME COLUMN 重命名生成列 ob不支持重命名列名，报ERROR 1064.
drop table test_table1;
create table test_table1(
z0_col0 int,
z0_col1 int,
z0_col2 int as(abs(z0_col0)) virtual,
z0_col3 int as(power(z0_col1,2)) stored
);
insert into test_table1 (z0_col0,z0_col1) values (0,10),(-20,20),(3.50,30);
select * from test_table1 order by z0_col2;
+---------+---------+---------+---------+
| z0_col0 | z0_col1 | z0_col2 | z0_col3 |
+---------+---------+---------+---------+
|       0 |      10 |       0 |     100 |
|       4 |      30 |       4 |     900 |
|     -20 |      20 |      20 |     400 |
+---------+---------+---------+---------+
alter table test_table1 rename column z0_col2 to new_z0_col2;
alter table test_table1 rename column z0_col3 to new_z0_col3;
insert into new_test_table (z0_col0,z0_col1) values (5.5,10.6);
select z0_col0,z0_col1,z0_col2,abs(z0_col3) from new_test_table order by z0_col2;
+---------+---------+---------+--------------+
| z0_col0 | z0_col1 | z0_col2 | abs(z0_col3) |
+---------+---------+---------+--------------+
|    NULL |    NULL |    NULL |         NULL |
|  -100.5 |    20.9 |   -79.6 |           80 |
|       0 |       0 |       0 |            0 |
|     5.5 |    10.6 |    16.1 |           16 |
|    10.5 |    10.9 |    21.4 |           21 |
|   1.111 |    22.2 |  23.311 |           23 |
|     100 |     200 |     300 |          300 |
+---------+---------+---------+--------------+
# RENAME COLUMN 重命名生成列引用的普通列
alter table test_table1 rename column z0_col0 to new_z0_col0;
ERROR HY000: Column 'z0_col0' has a generated column dependency
insert into new_test_table (z0_col0,z0_col1) values (-40,5);
select z0_col0,z0_col1,z0_col2,abs(z0_col3) from new_test_table order by z0_col2;
+---------+---------+---------+--------------+
| z0_col0 | z0_col1 | z0_col2 | abs(z0_col3) |
+---------+---------+---------+--------------+
|    NULL |    NULL |    NULL |         NULL |
|  -100.5 |    20.9 |   -79.6 |           80 |
|     -40 |       5 |     -35 |           35 |
|       0 |       0 |       0 |            0 |
|     5.5 |    10.6 |    16.1 |           16 |
|    10.5 |    10.9 |    21.4 |           21 |
|   1.111 |    22.2 |  23.311 |           23 |
|     100 |     200 |     300 |          300 |
+---------+---------+---------+--------------+
# MODIFY 修改生成列 虚拟生成列-》存储生成列
drop table test_table;
create table test_table(
z0_col0 float, 
z0_col1 float,
z0_col2 float as(z0_col0/z0_col1) virtual
);
insert into test_table (z0_col0,z0_col1) values (0,0),(NULL,NULL),(1.111,22.2),(10.5,10.9),(-100.5,20.9);
select z0_col0,z0_col1,z0_col2 from test_table order by z0_col2;
+---------+---------+----------+
| z0_col0 | z0_col1 | z0_col2  |
+---------+---------+----------+
|       0 |       0 |     NULL |
|    NULL |    NULL |     NULL |
|  -100.5 |    20.9 | -4.80861 |
|   1.111 |    22.2 | 0.050045 |
|    10.5 |    10.9 | 0.963303 |
+---------+---------+----------+
alter table test_table modify z0_col2 float as(z0_col0/z0_col1) stored;
Got one of the listed errors
# MODIFY 修改生成列 虚拟生成列-》普通列
drop table test_table;
create table test_table(
z0_col0 float, 
z0_col1 float,
z0_col2 float as(z0_col0/z0_col1) virtual
);
insert into test_table (z0_col0,z0_col1) values (0,0),(NULL,NULL),(1.111,22.2),(10.5,10.9),(-100.5,20.9);
select z0_col0,z0_col1,z0_col2 from test_table order by z0_col2;
+---------+---------+----------+
| z0_col0 | z0_col1 | z0_col2  |
+---------+---------+----------+
|       0 |       0 |     NULL |
|    NULL |    NULL |     NULL |
|  -100.5 |    20.9 | -4.80861 |
|   1.111 |    22.2 | 0.050045 |
|    10.5 |    10.9 | 0.963303 |
+---------+---------+----------+
alter table test_table modify z0_col2 float;
Got one of the listed errors
# MODIFY 修改生成列 存储生成列-》虚拟生成列
drop table test_table;
create table test_table(
z0_col0 float, 
z0_col1 float,
z0_col2 float as(z0_col0/z0_col1) stored
);
insert into test_table (z0_col0,z0_col1) values (0,0),(NULL,NULL),(1.111,22.2),(10.5,10.9),(-100.5,20.9);
select z0_col0,z0_col1,z0_col2 from test_table order by z0_col2;
+---------+---------+----------+
| z0_col0 | z0_col1 | z0_col2  |
+---------+---------+----------+
|       0 |       0 |     NULL |
|    NULL |    NULL |     NULL |
|  -100.5 |    20.9 | -4.80861 |
|   1.111 |    22.2 | 0.050045 |
|    10.5 |    10.9 | 0.963303 |
+---------+---------+----------+
alter table test_table modify z0_col2 float as(z0_col0/z0_col1) virtual;
Got one of the listed errors
show create table test_table;
Table	Create Table
test_table	CREATE TABLE `test_table` (
  `z0_col0` float DEFAULT NULL,
  `z0_col1` float DEFAULT NULL,
  `z0_col2` float GENERATED ALWAYS AS ((`z0_col0` / `z0_col1`)) STORED
) ORGANIZATION INDEX DEFAULT CHARSET = utf8mb4 ROW_FORMAT = DYNAMIC COMPRESSION = 'zstd_1.3.8' REPLICA_NUM = 1 BLOCK_SIZE = 16384 USE_BLOOM_FILTER = FALSE ENABLE_MACRO_BLOCK_BLOOM_FILTER = FALSE TABLET_SIZE = 134217728 PCTFREE = 0
# MODIFY 修改生成列 存储生成列-》普通列
# bug1:【Generated Columns】OB Mysql模式，将存储生成列更改为普通列,mysql成功，ob失败。
drop table test_table;
create table test_table(
z0_col0 float, 
z0_col1 float,
z0_col2 float as(z0_col0/z0_col1) stored
);
insert into test_table (z0_col0,z0_col1) values (0,0),(NULL,NULL),(1.111,22.2),(10.5,10.9),(-100.5,20.9);
select z0_col0,z0_col1,z0_col2 from test_table order by z0_col2;
+---------+---------+----------+
| z0_col0 | z0_col1 | z0_col2  |
+---------+---------+----------+
|       0 |       0 |     NULL |
|    NULL |    NULL |     NULL |
|  -100.5 |    20.9 | -4.80861 |
|   1.111 |    22.2 | 0.050045 |
|    10.5 |    10.9 | 0.963303 |
+---------+---------+----------+
alter table test_table modify z0_col2 float;
Got one of the listed errors
select z0_col0,z0_col1,z0_col2 from test_table order by z0_col2;
+---------+---------+----------+
| z0_col0 | z0_col1 | z0_col2  |
+---------+---------+----------+
|       0 |       0 |     NULL |
|    NULL |    NULL |     NULL |
|  -100.5 |    20.9 | -4.80861 |
|   1.111 |    22.2 | 0.050045 |
|    10.5 |    10.9 | 0.963303 |
+---------+---------+----------+
show create table test_table;
Table	Create Table
test_table	CREATE TABLE `test_table` (
  `z0_col0` float DEFAULT NULL,
  `z0_col1` float DEFAULT NULL,
  `z0_col2` float GENERATED ALWAYS AS ((`z0_col0` / `z0_col1`)) STORED
) ORGANIZATION INDEX DEFAULT CHARSET = utf8mb4 ROW_FORMAT = DYNAMIC COMPRESSION = 'zstd_1.3.8' REPLICA_NUM = 1 BLOCK_SIZE = 16384 USE_BLOOM_FILTER = FALSE ENABLE_MACRO_BLOCK_BLOOM_FILTER = FALSE TABLET_SIZE = 134217728 PCTFREE = 0
# MODIFY 修改生成列 普通列-》虚拟生成列
drop table test_table;
create table test_table(
z0_col0 float, 
z0_col1 float,
z0_col2 float
);
insert into test_table (z0_col0,z0_col1) values (0,0),(NULL,NULL),(1.111,22.2),(10.5,10.9),(-100.5,20.9);
select z0_col0,z0_col1,z0_col2 from test_table order by z0_col2;
+---------+---------+---------+
| z0_col0 | z0_col1 | z0_col2 |
+---------+---------+---------+
|       0 |       0 |    NULL |
|    NULL |    NULL |    NULL |
|   1.111 |    22.2 |    NULL |
|    10.5 |    10.9 |    NULL |
|  -100.5 |    20.9 |    NULL |
+---------+---------+---------+
alter table test_table modify z0_col2 float as(z0_col0/z0_col1) virtual;
Got one of the listed errors
select z0_col0,z0_col1,z0_col2 from test_table order by z0_col2;
+---------+---------+---------+
| z0_col0 | z0_col1 | z0_col2 |
+---------+---------+---------+
|       0 |       0 |    NULL |
|    NULL |    NULL |    NULL |
|   1.111 |    22.2 |    NULL |
|    10.5 |    10.9 |    NULL |
|  -100.5 |    20.9 |    NULL |
+---------+---------+---------+
show create table test_table;
Table	Create Table
test_table	CREATE TABLE `test_table` (
  `z0_col0` float DEFAULT NULL,
  `z0_col1` float DEFAULT NULL,
  `z0_col2` float DEFAULT NULL
) ORGANIZATION INDEX DEFAULT CHARSET = utf8mb4 ROW_FORMAT = DYNAMIC COMPRESSION = 'zstd_1.3.8' REPLICA_NUM = 1 BLOCK_SIZE = 16384 USE_BLOOM_FILTER = FALSE ENABLE_MACRO_BLOCK_BLOOM_FILTER = FALSE TABLET_SIZE = 134217728 PCTFREE = 0
# MODIFY 修改生成列 普通列-》存储生成列
# bug2:【Generated Columns】OB Mysql模式，将普通列更改为存储生成列,mysql成功，ob失败。
drop table test_table;
create table test_table(
z0_col0 float, 
z0_col1 float,
z0_col2 float
);
insert into test_table (z0_col0,z0_col1) values (0,0),(NULL,NULL),(1.111,22.2),(10.5,10.9),(-100.5,20.9);
select z0_col0,z0_col1,z0_col2 from test_table order by z0_col2;
+---------+---------+---------+
| z0_col0 | z0_col1 | z0_col2 |
+---------+---------+---------+
|       0 |       0 |    NULL |
|    NULL |    NULL |    NULL |
|   1.111 |    22.2 |    NULL |
|    10.5 |    10.9 |    NULL |
|  -100.5 |    20.9 |    NULL |
+---------+---------+---------+
alter table test_table modify z0_col2 float as(z0_col0/z0_col1) stored;
Got one of the listed errors
insert into test_table (z0_col0,z0_col1) values (10,40);
select z0_col0,z0_col1,z0_col2 from test_table order by z0_col2;
+---------+---------+---------+
| z0_col0 | z0_col1 | z0_col2 |
+---------+---------+---------+
|       0 |       0 |    NULL |
|    NULL |    NULL |    NULL |
|   1.111 |    22.2 |    NULL |
|    10.5 |    10.9 |    NULL |
|  -100.5 |    20.9 |    NULL |
|      10 |      40 |    NULL |
+---------+---------+---------+
show create table test_table;
Table	Create Table
test_table	CREATE TABLE `test_table` (
  `z0_col0` float DEFAULT NULL,
  `z0_col1` float DEFAULT NULL,
  `z0_col2` float DEFAULT NULL
) ORGANIZATION INDEX DEFAULT CHARSET = utf8mb4 ROW_FORMAT = DYNAMIC COMPRESSION = 'zstd_1.3.8' REPLICA_NUM = 1 BLOCK_SIZE = 16384 USE_BLOOM_FILTER = FALSE ENABLE_MACRO_BLOCK_BLOOM_FILTER = FALSE TABLET_SIZE = 134217728 PCTFREE = 0
# MODIFY 修改生成列的数据类型
# bug3:【Generated Columns】OB Mysql模式，修改生成列的数据类型（modify/change）,mysql成功，ob失败。
drop table test_table1;
create table test_table1(
z0_col0 float,
z0_col1 float,
z0_col2 int as(floor(z0_col0)) virtual,
z0_col3 int as(ceiling(z0_col1)) stored
);
insert into test_table1 (z0_col0,z0_col1) values (1.2,1.8),(2.4,2.6),(3.5,3.3);
select * from test_table1 order by z0_col2;
+---------+---------+---------+---------+
| z0_col0 | z0_col1 | z0_col2 | z0_col3 |
+---------+---------+---------+---------+
|     1.2 |     1.8 |       1 |       2 |
|     2.4 |     2.6 |       2 |       3 |
|     3.5 |     3.3 |       3 |       4 |
+---------+---------+---------+---------+
alter table test_table1 modify z0_col2 double as(floor(z0_col0)) virtual;
alter table test_table1 modify z0_col3 double as(ceiling(z0_col0)) stored;
Got one of the listed errors
insert into test_table1 (z0_col0,z0_col1) values (5.123,5.678);
select * from test_table1 order by z0_col2;
+---------+---------+---------+---------+
| z0_col0 | z0_col1 | z0_col2 | z0_col3 |
+---------+---------+---------+---------+
|     1.2 |     1.8 |       1 |       2 |
|     2.4 |     2.6 |       2 |       3 |
|     3.5 |     3.3 |       3 |       4 |
|   5.123 |   5.678 |       5 |       6 |
+---------+---------+---------+---------+
# MODIFY 修改生成列引用的普通列
alter table test_table1 modify z0_col0 double;
alter table test_table1 modify z0_col1 double;
insert into test_table1 (z0_col0,z0_col1) values (4.123,4.678);
select * from test_table1 order by z0_col2;
+--------------------+--------------------+---------+---------+
| z0_col0            | z0_col1            | z0_col2 | z0_col3 |
+--------------------+--------------------+---------+---------+
| 1.2000000476837158 | 1.7999999523162842 |       1 |       2 |
| 2.4000000953674316 | 2.5999999046325684 |       2 |       3 |
|                3.5 |  3.299999952316284 |       3 |       4 |
|              4.123 |              4.678 |       4 |       5 |
|  5.123000144958496 |  5.677999973297119 |       5 |       6 |
+--------------------+--------------------+---------+---------+
# CHANGE 修改生成列
# bug3:【Generated Columns】OB Mysql模式，修改生成列的数据类型（modify/change）,mysql成功，ob失败。
drop table test_table1;
create table test_table1(
z0_col0 char(200),
z0_col1 char(200),
z0_col2 char(200) as(upper(z0_col0)) virtual,
z0_col3 char(200) as(concat(z0_col0,z0_col1)) stored
);
insert into test_table1 (z0_col0,z0_col1) values ('mysql 8.0 ',' one'),('oracle 11g ',' two'),('oceanbase 4.0 ',' three');
select * from test_table1 order by z0_col2;
+---------------+---------+---------------+---------------------+
| z0_col0       | z0_col1 | z0_col2       | z0_col3             |
+---------------+---------+---------------+---------------------+
| mysql 8.0     |  one    | MYSQL 8.0     | mysql 8.0 one       |
| oceanbase 4.0 |  three  | OCEANBASE 4.0 | oceanbase 4.0 three |
| oracle 11g    |  two    | ORACLE 11G    | oracle 11g two      |
+---------------+---------+---------------+---------------------+
alter table test_table1 change z0_col2 z0_col22 varchar(200) as(upper(z0_col0)) virtual;
alter table test_table1 change z0_col3 z0_col33 varchar(200) as(concat(z0_col0,z0_col1)) stored;
insert into test_table1 (z0_col0,z0_col1) values (5,5);
select * from test_table1 order by z0_col22;
+---------------+---------+---------------+---------------------+
| z0_col0       | z0_col1 | z0_col22      | z0_col33            |
+---------------+---------+---------------+---------------------+
| 5             | 5       | 5             | 55                  |
| mysql 8.0     |  one    | MYSQL 8.0     | mysql 8.0 one       |
| oceanbase 4.0 |  three  | OCEANBASE 4.0 | oceanbase 4.0 three |
| oracle 11g    |  two    | ORACLE 11G    | oracle 11g two      |
+---------------+---------+---------------+---------------------+
show create table test_table1;
Table	Create Table
test_table1	CREATE TABLE `test_table1` (
  `z0_col0` char(200) DEFAULT NULL,
  `z0_col1` char(200) DEFAULT NULL,
  `z0_col22` varchar(200) GENERATED ALWAYS AS (upper(`z0_col0`)) VIRTUAL,
  `z0_col33` varchar(200) GENERATED ALWAYS AS (concat(`z0_col0`,`z0_col1`)) STORED
) ORGANIZATION INDEX DEFAULT CHARSET = utf8mb4 ROW_FORMAT = DYNAMIC COMPRESSION = 'zstd_1.3.8' REPLICA_NUM = 1 BLOCK_SIZE = 16384 USE_BLOOM_FILTER = FALSE ENABLE_MACRO_BLOCK_BLOOM_FILTER = FALSE TABLET_SIZE = 134217728 PCTFREE = 0
# CHANGE 修改生成列引用的普通列
# bug4:【Generated Columns】OB Mysql模式，修改生成列引用的普通列（change）,mysql失败，ob成功。
drop table test_table1;
create table test_table1(
z0_col0 char(200),
z0_col1 char(200),
z0_col2 char(200) as(upper(z0_col0)) virtual,
z0_col3 char(200) as(concat(z0_col0,z0_col1)) stored
);
insert into test_table1 (z0_col0,z0_col1) values ('mysql 8.0 ',' one'),('oracle 11g ',' two'),('oceanbase 4.0 ',' three');
select * from test_table1 order by z0_col2;
+---------------+---------+---------------+---------------------+
| z0_col0       | z0_col1 | z0_col2       | z0_col3             |
+---------------+---------+---------------+---------------------+
| mysql 8.0     |  one    | MYSQL 8.0     | mysql 8.0 one       |
| oceanbase 4.0 |  three  | OCEANBASE 4.0 | oceanbase 4.0 three |
| oracle 11g    |  two    | ORACLE 11G    | oracle 11g two      |
+---------------+---------+---------------+---------------------+
alter table test_table1 change z0_col0 z0_col00 varchar(200);
alter table test_table1 change z0_col1 z0_col11 varchar(200);
insert into test_table1 (z0_col00,z0_col11) values ('pl/sql ',' add');
select * from test_table1 order by z0_col2;
+---------------+----------+---------------+---------------------+
| z0_col00      | z0_col11 | z0_col2       | z0_col3             |
+---------------+----------+---------------+---------------------+
| mysql 8.0     |  one     | MYSQL 8.0     | mysql 8.0 one       |
| oceanbase 4.0 |  three   | OCEANBASE 4.0 | oceanbase 4.0 three |
| oracle 11g    |  two     | ORACLE 11G    | oracle 11g two      |
| pl/sql        |  add     | PL/SQL        | pl/sql  add         |
+---------------+----------+---------------+---------------------+
show create table test_table1;
Table	Create Table
test_table1	CREATE TABLE `test_table1` (
  `z0_col00` varchar(200) DEFAULT NULL,
  `z0_col11` varchar(200) DEFAULT NULL,
  `z0_col2` char(200) GENERATED ALWAYS AS (upper(`z0_col00`)) VIRTUAL,
  `z0_col3` char(200) GENERATED ALWAYS AS (concat(`z0_col00`,`z0_col11`)) STORED
) ORGANIZATION INDEX DEFAULT CHARSET = utf8mb4 ROW_FORMAT = DYNAMIC COMPRESSION = 'zstd_1.3.8' REPLICA_NUM = 1 BLOCK_SIZE = 16384 USE_BLOOM_FILTER = FALSE ENABLE_MACRO_BLOCK_BLOOM_FILTER = FALSE TABLET_SIZE = 134217728 PCTFREE = 0
# DROP 删除生成列
drop table test_table1;
create table test_table1(
z0_col0 char(200),
z0_col1 char(200),
z0_col2 char(200) as(upper(z0_col0)) virtual,
z0_col3 char(200) as(concat(z0_col0,z0_col1)) stored
);
insert into test_table1 (z0_col0,z0_col1) values ('mysql 8.0 ',' one'),('oracle 11g ',' two'),('oceanbase 4.0 ',' three');
select * from test_table1 order by z0_col2;
+---------------+---------+---------------+---------------------+
| z0_col0       | z0_col1 | z0_col2       | z0_col3             |
+---------------+---------+---------------+---------------------+
| mysql 8.0     |  one    | MYSQL 8.0     | mysql 8.0 one       |
| oceanbase 4.0 |  three  | OCEANBASE 4.0 | oceanbase 4.0 three |
| oracle 11g    |  two    | ORACLE 11G    | oracle 11g two      |
+---------------+---------+---------------+---------------------+
alter table test_table1 drop z0_col2;
alter table test_table1 drop z0_col3;
insert into test_table1 (z0_col0,z0_col1) values ('pl/sql ',' add');
select * from test_table1 order by z0_col0;
+---------------+---------+
| z0_col0       | z0_col1 |
+---------------+---------+
| mysql 8.0     |  one    |
| oceanbase 4.0 |  three  |
| oracle 11g    |  two    |
| pl/sql        |  add    |
+---------------+---------+
show create table test_table1;
Table	Create Table
test_table1	CREATE TABLE `test_table1` (
  `z0_col0` char(200) DEFAULT NULL,
  `z0_col1` char(200) DEFAULT NULL
) ORGANIZATION INDEX DEFAULT CHARSET = utf8mb4 ROW_FORMAT = DYNAMIC COMPRESSION = 'zstd_1.3.8' REPLICA_NUM = 1 BLOCK_SIZE = 16384 USE_BLOOM_FILTER = FALSE ENABLE_MACRO_BLOCK_BLOOM_FILTER = FALSE TABLET_SIZE = 134217728 PCTFREE = 0
# DROP 删除生成列引用的普通列
drop table test_table1;
create table test_table1(
z0_col0 char(200),
z0_col1 char(200),
z0_col2 char(200) as(upper(z0_col0)) virtual,
z0_col3 char(200) as(concat(z0_col0,z0_col1)) stored
);
insert into test_table1 (z0_col0,z0_col1) values ('mysql 8.0 ',' one'),('oracle 11g ',' two'),('oceanbase 4.0 ',' three');
select * from test_table1 order by z0_col2;
+---------------+---------+---------------+---------------------+
| z0_col0       | z0_col1 | z0_col2       | z0_col3             |
+---------------+---------+---------------+---------------------+
| mysql 8.0     |  one    | MYSQL 8.0     | mysql 8.0 one       |
| oceanbase 4.0 |  three  | OCEANBASE 4.0 | oceanbase 4.0 three |
| oracle 11g    |  two    | ORACLE 11G    | oracle 11g two      |
+---------------+---------+---------------+---------------------+
alter table test_table1 drop z0_col0;
ERROR HY000: Column 'z0_col0' has a generated column dependency
alter table test_table1 drop z0_col1;
ERROR HY000: Column 'z0_col1' has a generated column dependency
insert into test_table1 (z0_col0,z0_col1) values ('pl/sql ',' add');
select * from test_table1 order by z0_col0;
+---------------+---------+---------------+---------------------+
| z0_col0       | z0_col1 | z0_col2       | z0_col3             |
+---------------+---------+---------------+---------------------+
| mysql 8.0     |  one    | MYSQL 8.0     | mysql 8.0 one       |
| oceanbase 4.0 |  three  | OCEANBASE 4.0 | oceanbase 4.0 three |
| oracle 11g    |  two    | ORACLE 11G    | oracle 11g two      |
| pl/sql        |  add    | PL/SQL        | pl/sql add          |
+---------------+---------+---------------+---------------------+
show create table test_table1;
Table	Create Table
test_table1	CREATE TABLE `test_table1` (
  `z0_col0` char(200) DEFAULT NULL,
  `z0_col1` char(200) DEFAULT NULL,
  `z0_col2` char(200) GENERATED ALWAYS AS (upper(`z0_col0`)) VIRTUAL,
  `z0_col3` char(200) GENERATED ALWAYS AS (concat(`z0_col0`,`z0_col1`)) STORED
) ORGANIZATION INDEX DEFAULT CHARSET = utf8mb4 ROW_FORMAT = DYNAMIC COMPRESSION = 'zstd_1.3.8' REPLICA_NUM = 1 BLOCK_SIZE = 16384 USE_BLOOM_FILTER = FALSE ENABLE_MACRO_BLOCK_BLOOM_FILTER = FALSE TABLET_SIZE = 134217728 PCTFREE = 0
############ mysql_genrate-1-4 DML
### SELECT 语句
# LIMIT 子句
drop table test_table;
create table test_table(
z0_col0 float, 
z0_col1 float,
z0_col2 float as(z0_col0+z0_col1) virtual,
z0_col3 float as(z0_col0*z0_col1) stored
);
insert into test_table (z0_col0,z0_col1) values (0,0),(NULL,NULL),(2,9),(10,15),(-100,20);
select z0_col0,z0_col1,z0_col2,z0_col3 from test_table order by z0_col2 limit z0_col2;
ERROR 42000: You have an error in your SQL syntax; check the manual that corresponds to your OceanBase version for the right syntax to use near 'z0_col2' at line 1
select z0_col0,z0_col1,z0_col2,z0_col3 from test_table order by z0_col2 limit z0_col3;
ERROR 42000: You have an error in your SQL syntax; check the manual that corresponds to your OceanBase version for the right syntax to use near 'z0_col3' at line 1
select z0_col0,z0_col1,z0_col2,z0_col3 from test_table order by z0_col2 limit 5;
+---------+---------+---------+---------+
| z0_col0 | z0_col1 | z0_col2 | z0_col3 |
+---------+---------+---------+---------+
|    NULL |    NULL |    NULL |    NULL |
|    -100 |      20 |     -80 |   -2000 |
|       0 |       0 |       0 |       0 |
|       2 |       9 |      11 |      18 |
|      10 |      15 |      25 |     150 |
+---------+---------+---------+---------+
select z0_col0,z0_col1,abs(z0_col2),z0_col3 from test_table order by z0_col2 limit 5;
+---------+---------+--------------+---------+
| z0_col0 | z0_col1 | abs(z0_col2) | z0_col3 |
+---------+---------+--------------+---------+
|    NULL |    NULL |         NULL |    NULL |
|    -100 |      20 |           80 |   -2000 |
|       0 |       0 |            0 |       0 |
|       2 |       9 |           11 |      18 |
|      10 |      15 |           25 |     150 |
+---------+---------+--------------+---------+
# SELECT ... INTO 语句
drop table test_table;
create table test_table(
z0_col0 float, 
z0_col1 float,
z0_col2 float as(z0_col0+z0_col1) virtual,
z0_col3 float as(z0_col0*z0_col1) stored
);
insert into test_table (z0_col0,z0_col1) values (0,0),(NULL,NULL),(2,9),(10,15),(-100,20);
select z0_col2,z0_col3 into @p1,@p2 from test_table where abs(z0_col2) > 50 and z0_col3 != 0 order by z0_col2;
select @p1,@p2;
+------+-------+
| @p1  | @p2   |
+------+-------+
|  -80 | -2000 |
+------+-------+
# select 生成列间运算 from table;
drop table test_table;
create table test_table(
z0_col0 float, 
z0_col1 float,
z0_col2 float as(z0_col0+z0_col1) virtual,
z0_col3 float as(z0_col0*z0_col1) stored
);
select avg(z0_col2),sum(z0_col3) from test_table;
+--------------+--------------+
| avg(z0_col2) | sum(z0_col3) |
+--------------+--------------+
|         NULL |         NULL |
+--------------+--------------+
insert into test_table (z0_col0,z0_col1) values (0,0),(NULL,NULL),(2,9),(10,15),(-100,20);
select z0_col0,z0_col1,z0_col2+2*9-1/2,z0_col3+2*9-1/2 from test_table order by z0_col2;
+---------+---------+-----------------+-----------------+
| z0_col0 | z0_col1 | z0_col2+2*9-1/2 | z0_col3+2*9-1/2 |
+---------+---------+-----------------+-----------------+
|    NULL |    NULL |            NULL |            NULL |
|    -100 |      20 |           -62.5 |         -1982.5 |
|       0 |       0 |            17.5 |            17.5 |
|       2 |       9 |            28.5 |            35.5 |
|      10 |      15 |            42.5 |           167.5 |
+---------+---------+-----------------+-----------------+
select z0_col0,z0_col1,z0_col2,z0_col3 from test_table order by z0_col2;
+---------+---------+---------+---------+
| z0_col0 | z0_col1 | z0_col2 | z0_col3 |
+---------+---------+---------+---------+
|    NULL |    NULL |    NULL |    NULL |
|    -100 |      20 |     -80 |   -2000 |
|       0 |       0 |       0 |       0 |
|       2 |       9 |      11 |      18 |
|      10 |      15 |      25 |     150 |
+---------+---------+---------+---------+
select z0_col0,z0_col1,z0_col2+z0_col3 from test_table order by z0_col2;
+---------+---------+-----------------+
| z0_col0 | z0_col1 | z0_col2+z0_col3 |
+---------+---------+-----------------+
|    NULL |    NULL |            NULL |
|    -100 |      20 |           -2080 |
|       0 |       0 |               0 |
|       2 |       9 |              29 |
|      10 |      15 |             175 |
+---------+---------+-----------------+
select z0_col0,z0_col1+z0_col2,z0_col3 from test_table order by z0_col2;
+---------+-----------------+---------+
| z0_col0 | z0_col1+z0_col2 | z0_col3 |
+---------+-----------------+---------+
|    NULL |            NULL |    NULL |
|    -100 |             -60 |   -2000 |
|       0 |               0 |       0 |
|       2 |              20 |      18 |
|      10 |              40 |     150 |
+---------+-----------------+---------+
select avg(z0_col2),sum(z0_col3) from test_table where z0_col2 > 0 order by z0_col2;
+--------------+--------------+
| avg(z0_col2) | sum(z0_col3) |
+--------------+--------------+
|           18 |          168 |
+--------------+--------------+
select z0_col2 > z0_col3 from test_table order by z0_col2;
+-------------------+
| z0_col2 > z0_col3 |
+-------------------+
|              NULL |
|                 1 |
|                 0 |
|                 0 |
|                 0 |
+-------------------+
select z0_col2 and z0_col3 from test_table order by z0_col2;
+---------------------+
| z0_col2 and z0_col3 |
+---------------------+
|                NULL |
|                   1 |
|                   0 |
|                   1 |
|                   1 |
+---------------------+
# 子查询 作为标量操作数的子查询
drop table test_table1;
create table test_table1(
z0_col0 double, 
z0_col1 double,
z0_col2 double as(z0_col0+z0_col1) virtual,
z0_col3 double as(z0_col0*z0_col1) stored
);
select (select z0_col2 from test_table1);
+-----------------------------------+
| (select z0_col2 from test_table1) |
+-----------------------------------+
|                              NULL |
+-----------------------------------+
insert into test_table1 (z0_col0,z0_col1) values (0,0),(NULL,NULL),(2.5,9.9),(-10,15),(1.0E+10,2.0E+10);
select z0_col0,z0_col1,z0_col2,z0_col3 from test_table1 order by z0_col2;
+-------------+-------------+-------------+---------+
| z0_col0     | z0_col1     | z0_col2     | z0_col3 |
+-------------+-------------+-------------+---------+
|        NULL |        NULL |        NULL |    NULL |
|           0 |           0 |           0 |       0 |
|         -10 |          15 |           5 |    -150 |
|         2.5 |         9.9 |        12.4 |   24.75 |
| 10000000000 | 20000000000 | 30000000000 |    2e20 |
+-------------+-------------+-------------+---------+
drop table test_table2;
create table test_table2(
z0_col0 char(200), 
z0_col1 char(200), 
z0_col2 char(200) as(concat(z0_col0,z0_col1)) virtual,
z0_col3 char(200) as(upper(concat(z0_col0,z0_col1))) stored
);
select (select z0_col2 from test_table2);
+-----------------------------------+
| (select z0_col2 from test_table2) |
+-----------------------------------+
| NULL                              |
+-----------------------------------+
insert into test_table2 (z0_col0,z0_col1) values (0,0),(NULL,NULL),(2022,0621),('2022-06-21 ',' 14:30:00'),('welloe come to ',' beijing');
select z0_col0,z0_col1,z0_col2,z0_col3 from test_table2 order by z0_col2;
+----------------+-----------+------------------------+------------------------+
| z0_col0        | z0_col1   | z0_col2                | z0_col3                |
+----------------+-----------+------------------------+------------------------+
| NULL           | NULL      | NULL                   | NULL                   |
| 0              | 0         | 00                     | 00                     |
| 2022-06-21     |  14:30:00 | 2022-06-21 14:30:00    | 2022-06-21 14:30:00    |
| 2022           | 621       | 2022621                | 2022621                |
| welloe come to |  beijing  | welloe come to beijing | WELLOE COME TO BEIJING |
+----------------+-----------+------------------------+------------------------+
select (select z0_col2 from test_table1 where z0_col2 > 20 order by 1);
+-----------------------------------------------------------------+
| (select z0_col2 from test_table1 where z0_col2 > 20 order by 1) |
+-----------------------------------------------------------------+
|                                                     30000000000 |
+-----------------------------------------------------------------+
select (select z0_col3 from test_table1 where z0_col3 between 20 and 30 order by 1);
+------------------------------------------------------------------------------+
| (select z0_col3 from test_table1 where z0_col3 between 20 and 30 order by 1) |
+------------------------------------------------------------------------------+
|                                                                        24.75 |
+------------------------------------------------------------------------------+
select (select z0_col2 from test_table2 where z0_col2 like '%to%' order by 1);
+------------------------------------------------------------------------+
| (select z0_col2 from test_table2 where z0_col2 like '%to%' order by 1) |
+------------------------------------------------------------------------+
| welloe come to beijing                                                 |
+------------------------------------------------------------------------+
select (select z0_col3 from test_table2 where z0_col3 like '%TO%' order by 1);
+------------------------------------------------------------------------+
| (select z0_col3 from test_table2 where z0_col3 like '%TO%' order by 1) |
+------------------------------------------------------------------------+
| WELLOE COME TO BEIJING                                                 |
+------------------------------------------------------------------------+
select (select z0_col2 from test_table1 where z0_col2 > 20) from test_table2 order by z0_col2;
+------------------------------------------------------+
| (select z0_col2 from test_table1 where z0_col2 > 20) |
+------------------------------------------------------+
|                                          30000000000 |
|                                          30000000000 |
|                                          30000000000 |
|                                          30000000000 |
|                                          30000000000 |
+------------------------------------------------------+
select lower((select z0_col3 from test_table2 where z0_col3 like '%TO%')) from test_table1 order by z0_col2;
+--------------------------------------------------------------------+
| lower((select z0_col3 from test_table2 where z0_col3 like '%TO%')) |
+--------------------------------------------------------------------+
| welloe come to beijing                                             |
| welloe come to beijing                                             |
| welloe come to beijing                                             |
| welloe come to beijing                                             |
| welloe come to beijing                                             |
+--------------------------------------------------------------------+
# 子查询 使用子查询进行比较
drop table test_table1;
create table test_table1(
z0_col0 int, 
z0_col1 int,
z0_col2 int as(z0_col0+z0_col1) virtual,
z0_col3 int as(z0_col0-z0_col1) stored
);
insert into test_table1 (z0_col0,z0_col1) values (0,0),(NULL,NULL),(1,1),(1,2),(42.5,9.9),(-10,15),(2.0E+2,1.0E+2);
select z0_col0,z0_col1,z0_col2,z0_col3 from test_table1 order by z0_col2;
+---------+---------+---------+---------+
| z0_col0 | z0_col1 | z0_col2 | z0_col3 |
+---------+---------+---------+---------+
|    NULL |    NULL |    NULL |    NULL |
|       0 |       0 |       0 |       0 |
|       1 |       1 |       2 |       0 |
|       1 |       2 |       3 |      -1 |
|     -10 |      15 |       5 |     -25 |
|      43 |      10 |      53 |      33 |
|     200 |     100 |     300 |     100 |
+---------+---------+---------+---------+
drop table test_table2;
create table test_table2(
z0_col0 int, 
z0_col1 int,
z0_col2 int as(z0_col0*z0_col1) virtual,
z0_col3 int as(z0_col0/z0_col1) stored
);
insert into test_table2 (z0_col0,z0_col1) values (0,0),(0,0),(1,1),(NULL,NULL),(29.5,9.9),(-10,15),(2.0E+2,1.0E+2);
select z0_col0,z0_col1,z0_col2,z0_col3 from test_table2 order by z0_col2;
+---------+---------+---------+---------+
| z0_col0 | z0_col1 | z0_col2 | z0_col3 |
+---------+---------+---------+---------+
|    NULL |    NULL |    NULL |    NULL |
|     -10 |      15 |    -150 |      -1 |
|       0 |       0 |       0 |    NULL |
|       0 |       0 |       0 |    NULL |
|       1 |       1 |       1 |       1 |
|      30 |      10 |     300 |       3 |
|     200 |     100 |   20000 |       2 |
+---------+---------+---------+---------+
select * from test_table1 where z0_col2 < (select max(z0_col2) from test_table2 where z0_col3 > 2) order by 1;
+---------+---------+---------+---------+
| z0_col0 | z0_col1 | z0_col2 | z0_col3 |
+---------+---------+---------+---------+
|     -10 |      15 |       5 |     -25 |
|       0 |       0 |       0 |       0 |
|       1 |       1 |       2 |       0 |
|       1 |       2 |       3 |      -1 |
|      43 |      10 |      53 |      33 |
+---------+---------+---------+---------+
select * from test_table1 where z0_col2 >= (select max(z0_col2) from test_table2 where z0_col3 > 2) order by 1;
+---------+---------+---------+---------+
| z0_col0 | z0_col1 | z0_col2 | z0_col3 |
+---------+---------+---------+---------+
|     200 |     100 |     300 |     100 |
+---------+---------+---------+---------+
select * from test_table2 where z0_col1 = (select max(z0_col3) from test_table1) order by 1;
+---------+---------+---------+---------+
| z0_col0 | z0_col1 | z0_col2 | z0_col3 |
+---------+---------+---------+---------+
|     200 |     100 |   20000 |       2 |
+---------+---------+---------+---------+
select * from test_table2 where z0_col1 != (select min(z0_col3) from test_table1) order by 1;
+---------+---------+---------+---------+
| z0_col0 | z0_col1 | z0_col2 | z0_col3 |
+---------+---------+---------+---------+
|     -10 |      15 |    -150 |      -1 |
|       0 |       0 |       0 |    NULL |
|       0 |       0 |       0 |    NULL |
|       1 |       1 |       1 |       1 |
|      30 |      10 |     300 |       3 |
|     200 |     100 |   20000 |       2 |
+---------+---------+---------+---------+
select * from test_table1 where 2 = (select count(*) from test_table2 where test_table2.z0_col0 = test_table1.z0_col0) order by 1;
+---------+---------+---------+---------+
| z0_col0 | z0_col1 | z0_col2 | z0_col3 |
+---------+---------+---------+---------+
|       0 |       0 |       0 |       0 |
+---------+---------+---------+---------+
# 带有 ANY、IN 或 SOME 的子查询
select * from test_table1 where z0_col2 > any (select z0_col3 from test_table2 where z0_col2 > 0) order by 1;
+---------+---------+---------+---------+
| z0_col0 | z0_col1 | z0_col2 | z0_col3 |
+---------+---------+---------+---------+
|     -10 |      15 |       5 |     -25 |
|       1 |       1 |       2 |       0 |
|       1 |       2 |       3 |      -1 |
|      43 |      10 |      53 |      33 |
|     200 |     100 |     300 |     100 |
+---------+---------+---------+---------+
select * from test_table1 where z0_col2 = any (select z0_col3 from test_table2 where z0_col2 > 0) order by 1;
+---------+---------+---------+---------+
| z0_col0 | z0_col1 | z0_col2 | z0_col3 |
+---------+---------+---------+---------+
|       1 |       1 |       2 |       0 |
|       1 |       2 |       3 |      -1 |
+---------+---------+---------+---------+
select * from test_table1 where z0_col2 < any (select z0_col3 from test_table2 where z0_col2 > 0) order by 1;
+---------+---------+---------+---------+
| z0_col0 | z0_col1 | z0_col2 | z0_col3 |
+---------+---------+---------+---------+
|       0 |       0 |       0 |       0 |
|       1 |       1 |       2 |       0 |
+---------+---------+---------+---------+
select * from test_table1 where z0_col2 != any (select z0_col3 from test_table2 where z0_col2 > 0) order by 1;
+---------+---------+---------+---------+
| z0_col0 | z0_col1 | z0_col2 | z0_col3 |
+---------+---------+---------+---------+
|     -10 |      15 |       5 |     -25 |
|       0 |       0 |       0 |       0 |
|       1 |       1 |       2 |       0 |
|       1 |       2 |       3 |      -1 |
|      43 |      10 |      53 |      33 |
|     200 |     100 |     300 |     100 |
+---------+---------+---------+---------+
select * from test_table1 where z0_col2 <> any (select z0_col3 from test_table2 where z0_col2 > 0) order by 1;
+---------+---------+---------+---------+
| z0_col0 | z0_col1 | z0_col2 | z0_col3 |
+---------+---------+---------+---------+
|     -10 |      15 |       5 |     -25 |
|       0 |       0 |       0 |       0 |
|       1 |       1 |       2 |       0 |
|       1 |       2 |       3 |      -1 |
|      43 |      10 |      53 |      33 |
|     200 |     100 |     300 |     100 |
+---------+---------+---------+---------+
select max(z0_col2) from test_table1 where z0_col2 in (select z0_col3 from test_table2 where z0_col2 > 0) order by 1;
+--------------+
| max(z0_col2) |
+--------------+
|            3 |
+--------------+
select * from test_table1 where z0_col3 >= some (select z0_col3 from test_table2 where z0_col3 > 0) order by 1;
+---------+---------+---------+---------+
| z0_col0 | z0_col1 | z0_col2 | z0_col3 |
+---------+---------+---------+---------+
|      43 |      10 |      53 |      33 |
|     200 |     100 |     300 |     100 |
+---------+---------+---------+---------+
select * from test_table1 where z0_col3 = some (select z0_col3 from test_table2 where z0_col3 > 0) order by 1;
+---------+---------+---------+---------+
| z0_col0 | z0_col1 | z0_col2 | z0_col3 |
+---------+---------+---------+---------+
+---------+---------+---------+---------+
select * from test_table1 where z0_col3 <= some (select z0_col3 from test_table2 where z0_col3 > 0) order by 1;
+---------+---------+---------+---------+
| z0_col0 | z0_col1 | z0_col2 | z0_col3 |
+---------+---------+---------+---------+
|     -10 |      15 |       5 |     -25 |
|       0 |       0 |       0 |       0 |
|       1 |       1 |       2 |       0 |
|       1 |       2 |       3 |      -1 |
+---------+---------+---------+---------+
select * from test_table1 where z0_col3 != some (select z0_col3 from test_table2 where z0_col3 > 0) order by 1;
+---------+---------+---------+---------+
| z0_col0 | z0_col1 | z0_col2 | z0_col3 |
+---------+---------+---------+---------+
|     -10 |      15 |       5 |     -25 |
|       0 |       0 |       0 |       0 |
|       1 |       1 |       2 |       0 |
|       1 |       2 |       3 |      -1 |
|      43 |      10 |      53 |      33 |
|     200 |     100 |     300 |     100 |
+---------+---------+---------+---------+
# ALL 子查询
select z0_col0,z0_col1,abs(z0_col2),abs(z0_col3) from test_table1 where z0_col2 >= all (select z0_col3 from test_table2 where z0_col2 <> 0);
+---------+---------+--------------+--------------+
| z0_col0 | z0_col1 | abs(z0_col2) | abs(z0_col3) |
+---------+---------+--------------+--------------+
|       1 |       2 |            3 |            1 |
|      43 |      10 |           53 |           33 |
|     -10 |      15 |            5 |           25 |
|     200 |     100 |          300 |          100 |
+---------+---------+--------------+--------------+
select z0_col0,z0_col1,max(z0_col2),max(z0_col3) from test_table1 where z0_col2 = all (select z0_col3 from test_table2 where z0_col2 <> 0);
+---------+---------+--------------+--------------+
| z0_col0 | z0_col1 | max(z0_col2) | max(z0_col3) |
+---------+---------+--------------+--------------+
|    NULL |    NULL |         NULL |         NULL |
+---------+---------+--------------+--------------+
select z0_col0,z0_col1,min(z0_col2),min(z0_col3) from test_table1 where z0_col2 <= all (select z0_col3 from test_table2 where z0_col2 <> 0);
+---------+---------+--------------+--------------+
| z0_col0 | z0_col1 | min(z0_col2) | min(z0_col3) |
+---------+---------+--------------+--------------+
|    NULL |    NULL |         NULL |         NULL |
+---------+---------+--------------+--------------+
select z0_col0,z0_col1,avg(z0_col2),avg(z0_col3) from test_table1 where z0_col2 <> all (select z0_col3 from test_table2 where z0_col2 <> 0);
+---------+---------+--------------+--------------+
| z0_col0 | z0_col1 | avg(z0_col2) | avg(z0_col3) |
+---------+---------+--------------+--------------+
|       0 |       0 |      89.5000 |      27.0000 |
+---------+---------+--------------+--------------+
# 行子查询
select * from test_table1 where (z0_col2,z0_col3) = (select z0_col2, z0_col3 from test_table2 where z0_col2 is null) order by 1;
+---------+---------+---------+---------+
| z0_col0 | z0_col1 | z0_col2 | z0_col3 |
+---------+---------+---------+---------+
+---------+---------+---------+---------+
select * from test_table2 where row(z0_col2,z0_col3) = (select z0_col0, z0_col1 from test_table1 where z0_col2 = 2) order by 1;
+---------+---------+---------+---------+
| z0_col0 | z0_col1 | z0_col2 | z0_col3 |
+---------+---------+---------+---------+
|       1 |       1 |       1 |       1 |
+---------+---------+---------+---------+
# 具有 EXISTS 或 NOT EXISTS 的子查询
select z0_col2,z0_col3 from test_table1 where exists (select * from test_table2 where z0_col3 is not null) order by 1;
+---------+---------+
| z0_col2 | z0_col3 |
+---------+---------+
|    NULL |    NULL |
|       0 |       0 |
|       2 |       0 |
|       3 |      -1 |
|       5 |     -25 |
|      53 |      33 |
|     300 |     100 |
+---------+---------+
select z0_col2,z0_col3 from test_table1 where not exists (select * from test_table2 where z0_col3 > 10) order by 1;
+---------+---------+
| z0_col2 | z0_col3 |
+---------+---------+
|    NULL |    NULL |
|       0 |       0 |
|       2 |       0 |
|       3 |      -1 |
|       5 |     -25 |
|      53 |      33 |
|     300 |     100 |
+---------+---------+
select count(z0_col2),max(z0_col3) from test_table1 where exists (select * from test_table2 where z0_col3 is not null) order by 1;
+----------------+--------------+
| count(z0_col2) | max(z0_col3) |
+----------------+--------------+
|              6 |          100 |
+----------------+--------------+
select distinct z0_col2,z0_col3 from test_table1 where not exists (select * from test_table2 where z0_col3 > 10) order by 1;
+---------+---------+
| z0_col2 | z0_col3 |
+---------+---------+
|    NULL |    NULL |
|       0 |       0 |
|       2 |       0 |
|       3 |      -1 |
|       5 |     -25 |
|      53 |      33 |
|     300 |     100 |
+---------+---------+
# 相关子查询
select * from test_table1 t1 where z0_col2 = any (select z0_col2 from test_table2 t2 where t2.z0_col0 = t1.z0_col0 ) order by 1;
+---------+---------+---------+---------+
| z0_col0 | z0_col1 | z0_col2 | z0_col3 |
+---------+---------+---------+---------+
|       0 |       0 |       0 |       0 |
+---------+---------+---------+---------+
select * from test_table1 t1 where (select z0_col2 from test_table2 t2 where t2.z0_col1 = t1.z0_col1 and t2.z0_col3 = 3 ) > 0 order by 1;
+---------+---------+---------+---------+
| z0_col0 | z0_col1 | z0_col2 | z0_col3 |
+---------+---------+---------+---------+
|      43 |      10 |      53 |      33 |
+---------+---------+---------+---------+
# 派生表
select avg(sum_column1) from (select sum(z0_col2) as sum_column1 from test_table1 group by z0_col3) as t1;
+------------------+
| avg(sum_column1) |
+------------------+
|          72.6000 |
+------------------+
select avg(sum_column1) from (select sum(z0_col3) as sum_column1 from test_table2 group by z0_col2) as t1;
+------------------+
| avg(sum_column1) |
+------------------+
|           1.2500 |
+------------------+
###  INSERT 语句
drop table test_table1;
create table test_table1(
z0_col0 int primary key,
z0_col1 int,
z0_col2 int as(z0_col0+z0_col1) virtual,
z0_col3 int as(mod(z0_col0,z0_col1)) stored,
txt char(200) default 'test_table1'
);
insert into test_table1 (z0_col0,z0_col1) values (0,0),(1,NULL),(2,1),(3,5),(4,9.9),(5,2),(2.0E+2,1.0E+2);
select z0_col0,z0_col1,z0_col2 col_add,z0_col3 col_mod,txt from test_table1 order by z0_col2;
+---------+---------+---------+---------+-------------+
| z0_col0 | z0_col1 | col_add | col_mod | txt         |
+---------+---------+---------+---------+-------------+
|       1 |    NULL |    NULL |    NULL | test_table1 |
|       0 |       0 |       0 |    NULL | test_table1 |
|       2 |       1 |       3 |       0 | test_table1 |
|       5 |       2 |       7 |       1 | test_table1 |
|       3 |       5 |       8 |       3 | test_table1 |
|       4 |      10 |      14 |       4 | test_table1 |
|     200 |     100 |     300 |       0 | test_table1 |
+---------+---------+---------+---------+-------------+
insert into test_table1 (z0_col0,z0_col1) values (5,5) on duplicate key update z0_col0=z0_col0+3,z0_col2=1;
ERROR HY000: The value specified for generated column 'z0_col2' in table 'test_table1' is not allowed
insert into test_table1 (z0_col0,z0_col1) values (5,5) on duplicate key update z0_col0=z0_col0+3,txt = 'on duplicate key update';
select z0_col0,z0_col1,z0_col2 col_add,z0_col3 col_mod,txt from test_table1 order by z0_col2;
+---------+---------+---------+---------+-------------------------+
| z0_col0 | z0_col1 | col_add | col_mod | txt                     |
+---------+---------+---------+---------+-------------------------+
|       1 |    NULL |    NULL |    NULL | test_table1             |
|       0 |       0 |       0 |    NULL | test_table1             |
|       2 |       1 |       3 |       0 | test_table1             |
|       3 |       5 |       8 |       3 | test_table1             |
|       8 |       2 |      10 |       0 | on duplicate key update |
|       4 |      10 |      14 |       4 | test_table1             |
|     200 |     100 |     300 |       0 | test_table1             |
+---------+---------+---------+---------+-------------------------+
###  UPDATE  语句
update test_table1 set z0_col1 = 10, txt = '1 update z0_col1' where z0_col2 > 100;
select z0_col0,z0_col1,z0_col2 col_add,z0_col3 col_mod,txt from test_table1 order by z0_col2;
+---------+---------+---------+---------+-------------------------+
| z0_col0 | z0_col1 | col_add | col_mod | txt                     |
+---------+---------+---------+---------+-------------------------+
|       1 |    NULL |    NULL |    NULL | test_table1             |
|       0 |       0 |       0 |    NULL | test_table1             |
|       2 |       1 |       3 |       0 | test_table1             |
|       3 |       5 |       8 |       3 | test_table1             |
|       8 |       2 |      10 |       0 | on duplicate key update |
|       4 |      10 |      14 |       4 | test_table1             |
|     200 |      10 |     210 |       0 | 1 update z0_col1        |
+---------+---------+---------+---------+-------------------------+
update test_table1 set z0_col0 = 41, txt = '2 update z0_col0' where z0_col3 = 4 order by z0_col3 limit 1;
select z0_col0,z0_col1,z0_col2 col_add,z0_col3 col_mod,txt from test_table1 order by z0_col2;
+---------+---------+---------+---------+-------------------------+
| z0_col0 | z0_col1 | col_add | col_mod | txt                     |
+---------+---------+---------+---------+-------------------------+
|       1 |    NULL |    NULL |    NULL | test_table1             |
|       0 |       0 |       0 |    NULL | test_table1             |
|       2 |       1 |       3 |       0 | test_table1             |
|       3 |       5 |       8 |       3 | test_table1             |
|       8 |       2 |      10 |       0 | on duplicate key update |
|      41 |      10 |      51 |       1 | 2 update z0_col0        |
|     200 |      10 |     210 |       0 | 1 update z0_col1        |
+---------+---------+---------+---------+-------------------------+
update test_table1 set z0_col0 = 4, txt = '3 update z0_col0' where abs(z0_col2) = 3 order by z0_col3 limit 1;
select z0_col0,z0_col1,z0_col2 col_add,z0_col3 col_mod,txt from test_table1 order by z0_col2;
+---------+---------+---------+---------+-------------------------+
| z0_col0 | z0_col1 | col_add | col_mod | txt                     |
+---------+---------+---------+---------+-------------------------+
|       1 |    NULL |    NULL |    NULL | test_table1             |
|       0 |       0 |       0 |    NULL | test_table1             |
|       4 |       1 |       5 |       0 | 3 update z0_col0        |
|       3 |       5 |       8 |       3 | test_table1             |
|       8 |       2 |      10 |       0 | on duplicate key update |
|      41 |      10 |      51 |       1 | 2 update z0_col0        |
|     200 |      10 |     210 |       0 | 1 update z0_col1        |
+---------+---------+---------+---------+-------------------------+
update test_table1 set z0_col1 = 200 where z0_col2 > 10 order by z0_col3 limit z0_col3;
ERROR 42000: You have an error in your SQL syntax; check the manual that corresponds to your OceanBase version for the right syntax to use near 'z0_col3' at line 1
select z0_col0,z0_col1,z0_col2 col_add,z0_col3 col_mod,txt from test_table1 order by z0_col2;
+---------+---------+---------+---------+-------------------------+
| z0_col0 | z0_col1 | col_add | col_mod | txt                     |
+---------+---------+---------+---------+-------------------------+
|       1 |    NULL |    NULL |    NULL | test_table1             |
|       0 |       0 |       0 |    NULL | test_table1             |
|       4 |       1 |       5 |       0 | 3 update z0_col0        |
|       3 |       5 |       8 |       3 | test_table1             |
|       8 |       2 |      10 |       0 | on duplicate key update |
|      41 |      10 |      51 |       1 | 2 update z0_col0        |
|     200 |      10 |     210 |       0 | 1 update z0_col1        |
+---------+---------+---------+---------+-------------------------+
update test_table1 set z0_col2 = 20 where z0_col3 = 4 order by z0_col3 limit 1;
ERROR HY000: The value specified for generated column 'z0_col2' in table 'test_table1' is not allowed
select z0_col0,z0_col1,z0_col2 col_add,z0_col3 col_mod,txt from test_table1 order by z0_col2;
+---------+---------+---------+---------+-------------------------+
| z0_col0 | z0_col1 | col_add | col_mod | txt                     |
+---------+---------+---------+---------+-------------------------+
|       1 |    NULL |    NULL |    NULL | test_table1             |
|       0 |       0 |       0 |    NULL | test_table1             |
|       4 |       1 |       5 |       0 | 3 update z0_col0        |
|       3 |       5 |       8 |       3 | test_table1             |
|       8 |       2 |      10 |       0 | on duplicate key update |
|      41 |      10 |      51 |       1 | 2 update z0_col0        |
|     200 |      10 |     210 |       0 | 1 update z0_col1        |
+---------+---------+---------+---------+-------------------------+
###  REPLACE  语句
select z0_col0,z0_col1,z0_col2 col_add,z0_col3 col_mod,txt from test_table1 order by z0_col2;
+---------+---------+---------+---------+-------------------------+
| z0_col0 | z0_col1 | col_add | col_mod | txt                     |
+---------+---------+---------+---------+-------------------------+
|       1 |    NULL |    NULL |    NULL | test_table1             |
|       0 |       0 |       0 |    NULL | test_table1             |
|       4 |       1 |       5 |       0 | 3 update z0_col0        |
|       3 |       5 |       8 |       3 | test_table1             |
|       8 |       2 |      10 |       0 | on duplicate key update |
|      41 |      10 |      51 |       1 | 2 update z0_col0        |
|     200 |      10 |     210 |       0 | 1 update z0_col1        |
+---------+---------+---------+---------+-------------------------+
replace into test_table1 (z0_col0,z0_col1,txt) values (200,21,'1 replace test_table1');
select z0_col0,z0_col1,z0_col2 col_add,z0_col3 col_mod,txt from test_table1 order by z0_col2;
+---------+---------+---------+---------+-------------------------+
| z0_col0 | z0_col1 | col_add | col_mod | txt                     |
+---------+---------+---------+---------+-------------------------+
|       1 |    NULL |    NULL |    NULL | test_table1             |
|       0 |       0 |       0 |    NULL | test_table1             |
|       4 |       1 |       5 |       0 | 3 update z0_col0        |
|       3 |       5 |       8 |       3 | test_table1             |
|       8 |       2 |      10 |       0 | on duplicate key update |
|      41 |      10 |      51 |       1 | 2 update z0_col0        |
|     200 |      21 |     221 |      11 | 1 replace test_table1   |
+---------+---------+---------+---------+-------------------------+
replace into test_table1 values (3,20,30,10,'2 replace test_table1');
ERROR HY000: The value specified for generated column 'z0_col2' in table 'test_table1' is not allowed
###  TRUNCATE TABLE语句
drop table test_table1;
create table test_table1(
z0_col0 int primary key,
z0_col1 int,
z0_col2 int as(z0_col0+z0_col1) virtual,
z0_col3 int as(z0_col0*z0_col1) stored,
txt char(200) default 'test_table1'
);
insert into test_table1 (z0_col0,z0_col1) values (0,0),(1,NULL),(2,1),(3,5);
select z0_col0,z0_col1,z0_col2 col_vir,z0_col3 col_sto,txt from test_table1 order by z0_col2;
+---------+---------+---------+---------+-------------+
| z0_col0 | z0_col1 | col_vir | col_sto | txt         |
+---------+---------+---------+---------+-------------+
|       1 |    NULL |    NULL |    NULL | test_table1 |
|       0 |       0 |       0 |       0 | test_table1 |
|       2 |       1 |       3 |       2 | test_table1 |
|       3 |       5 |       8 |      15 | test_table1 |
+---------+---------+---------+---------+-------------+
truncate table test_table1;
insert into test_table1 (z0_col0,z0_col1) values (10,10),(20,10),(30,50);
select z0_col0,z0_col1,z0_col2 col_add,z0_col3 col_mod,txt from test_table1 order by z0_col2;
+---------+---------+---------+---------+-------------+
| z0_col0 | z0_col1 | col_add | col_mod | txt         |
+---------+---------+---------+---------+-------------+
|      10 |      10 |      20 |     100 | test_table1 |
|      20 |      10 |      30 |     200 | test_table1 |
|      30 |      50 |      80 |    1500 | test_table1 |
+---------+---------+---------+---------+-------------+
desc test_table1;
+---------+-----------+------+-----+-------------------------+-------------------+
| Field   | Type      | Null | Key | Default                 | Extra             |
+---------+-----------+------+-----+-------------------------+-------------------+
| z0_col0 | int(11)   | NO   | PRI | NULL                    |                   |
| z0_col1 | int(11)   | YES  |     | NULL                    |                   |
| z0_col2 | int(11)   | YES  |     | (`z0_col0` + `z0_col1`) | VIRTUAL GENERATED |
| z0_col3 | int(11)   | YES  |     | (`z0_col0` * `z0_col1`) | STORED GENERATED  |
| txt     | char(200) | YES  |     | test_table1             |                   |
+---------+-----------+------+-----+-------------------------+-------------------+
############ mysql_genrate-1-5 PL/SQL
### 函数
drop table test_table1;
create table test_table1(
z0_col0 int primary key,
z0_col1 int,
z0_col2 int as(z0_col0+z0_col1) virtual,
z0_col3 int as(z0_col0*z0_col1) stored
);
insert into test_table1 (z0_col0,z0_col1) values (0,0),(1,1),(2,2),(3,3);
select z0_col0,z0_col1,z0_col2 col_vir,z0_col3 col_sto from test_table1 order by z0_col2;
+---------+---------+---------+---------+
| z0_col0 | z0_col1 | col_vir | col_sto |
+---------+---------+---------+---------+
|       0 |       0 |       0 |       0 |
|       1 |       1 |       2 |       1 |
|       2 |       2 |       4 |       4 |
|       3 |       3 |       6 |       9 |
+---------+---------+---------+---------+
drop table test_table2;
create table test_table2(
z0_col0 int primary key,
z0_col1 int,
z0_col2 int as(z0_col0+z0_col1) virtual,
z0_col3 int as(z0_col0*z0_col1) stored
);
insert into test_table2 (z0_col0,z0_col1) values (10,0),(11,1),(12,2),(13,3);
select z0_col0,z0_col1,z0_col2 col_vir,z0_col3 col_sto from test_table2 order by z0_col2;
+---------+---------+---------+---------+
| z0_col0 | z0_col1 | col_vir | col_sto |
+---------+---------+---------+---------+
|      10 |       0 |      10 |       0 |
|      11 |       1 |      12 |      11 |
|      12 |       2 |      14 |      24 |
|      13 |       3 |      16 |      39 |
+---------+---------+---------+---------+
# 生成列作为函数参数
drop function fun1;//
create function fun1(num2 int,num3 int) returns varchar(100)
begin  
  insert into test_table1 (z0_col0,z0_col1) values (num2,num3); 
  delete from test_table1 where z0_col2 = 0; 
  update test_table1 set z0_col0 = 9 where z0_col2 = 2;
  return 'fun1 ok';
end;
//
select fun1(z0_col2,z0_col3) from test_table2 where z0_col2 < 14 order by z0_col2;//
+-----------------------+
| fun1(z0_col2,z0_col3) |
+-----------------------+
| fun1 ok               |
| fun1 ok               |
+-----------------------+
select z0_col0,z0_col1,z0_col2 col_vir,z0_col3 col_sto from test_table1 order by z0_col2;//
+---------+---------+---------+---------+
| z0_col0 | z0_col1 | col_vir | col_sto |
+---------+---------+---------+---------+
|       2 |       2 |       4 |       4 |
|       3 |       3 |       6 |       9 |
|       9 |       1 |      10 |       9 |
|      10 |       0 |      10 |       0 |
|      12 |      11 |      23 |     132 |
+---------+---------+---------+---------+
# 虚拟列表达式是自定义函数
drop function fun1;//
create function fun1() returns int
begin
  return 10;
end;
//
drop table test_table222;//
create table test_table222(
z0_col0 int primary key,
z0_col1 int,
z0_col2 int as(fun1()) virtual,
z0_col3 int as(fun1()) stored
);//
ERROR 42S22: Unknown column '' in 'generated column function'
### 存储过程
DROP PROCEDURE IF EXISTS pro1;//
CREATE PROCEDURE pro1(in num1 int,in num2 int)
BEGIN
  alter table test_table2 add z0_col4 varchar(100) as (concat(z0_col0,z0_col1)) virtual;
  alter table test_table2 add z0_col5 varchar(100) as (z0_col0) stored;
  insert into test_table2 (z0_col0,z0_col1) values (num1,num2),(num1+1,num2+1); 
  delete from test_table2 where z0_col2 = num1+num2; 
  update test_table2 set z0_col1 = 0 where z0_col3 = 36;
END;
//
call pro1(5,5);//
select * from test_table2 order by z0_col2;//
+---------+---------+---------+---------+---------+---------+
| z0_col0 | z0_col1 | z0_col2 | z0_col3 | z0_col4 | z0_col5 |
+---------+---------+---------+---------+---------+---------+
|       6 |       0 |       6 |       0 | 60      | 6       |
|      11 |       1 |      12 |      11 | 111     | 11      |
|      12 |       2 |      14 |      24 | 122     | 12      |
|      13 |       3 |      16 |      39 | 133     | 13      |
+---------+---------+---------+---------+---------+---------+
desc test_table2;//
+---------+--------------+------+-----+-----------------------------+-------------------+
| Field   | Type         | Null | Key | Default                     | Extra             |
+---------+--------------+------+-----+-----------------------------+-------------------+
| z0_col0 | int(11)      | NO   | PRI | NULL                        |                   |
| z0_col1 | int(11)      | YES  |     | NULL                        |                   |
| z0_col2 | int(11)      | YES  |     | (`z0_col0` + `z0_col1`)     | VIRTUAL GENERATED |
| z0_col3 | int(11)      | YES  |     | (`z0_col0` * `z0_col1`)     | STORED GENERATED  |
| z0_col4 | varchar(100) | YES  |     | concat(`z0_col0`,`z0_col1`) | VIRTUAL GENERATED |
| z0_col5 | varchar(100) | YES  |     | `z0_col0`                   | STORED GENERATED  |
+---------+--------------+------+-----+-----------------------------+-------------------+
############ mysql_genrate-1-6 其他场景
### 生成列：常量
# null
drop table test_table1;
create table test_table1(
z0_col0 int,
z0_col1 int,
z0_col2 int as (null) virtual,
z0_col3 int as (null) stored
);
insert into test_table1 (z0_col0,z0_col1) values (1,1),(2,2);
select z0_col0,z0_col1,z0_col2 col_vir,z0_col3 col_sto from test_table1 order by z0_col2;
+---------+---------+---------+---------+
| z0_col0 | z0_col1 | col_vir | col_sto |
+---------+---------+---------+---------+
|       1 |       1 |    NULL |    NULL |
|       2 |       2 |    NULL |    NULL |
+---------+---------+---------+---------+
select max(z0_col2),min(z0_col3) from test_table1 order by z0_col2;
+--------------+--------------+
| max(z0_col2) | min(z0_col3) |
+--------------+--------------+
|         NULL |         NULL |
+--------------+--------------+
# ''/' '
drop table test_table1;
create table test_table1(
z0_col0 int,
z0_col1 int,
z0_col2 char(200) as ('') virtual,
z0_col3 char(200) as (' ') stored
);
insert into test_table1 (z0_col0,z0_col1) values (1,1),(2,2);
select z0_col0,z0_col1,z0_col2 col_vir,z0_col3 col_sto from test_table1 order by z0_col2;
+---------+---------+---------+---------+
| z0_col0 | z0_col1 | col_vir | col_sto |
+---------+---------+---------+---------+
|       1 |       1 |         |         |
|       2 |       2 |         |         |
+---------+---------+---------+---------+
select max(z0_col2),min(z0_col3) from test_table1 order by z0_col2;
+--------------+--------------+
| max(z0_col2) | min(z0_col3) |
+--------------+--------------+
|              |              |
+--------------+--------------+
# 0，小数，负数，日期
drop table test_table1;
create table test_table1(
z0_col0 int,
z0_col1 int,
z0_col2 int as (0) virtual,
z0_col3 int as (3.1415926) stored,
z0_col4 int as (-100) virtual,
z0_col5 date as ('2020/06/22') stored
);
select * from test_table1 order by z0_col2;
+---------+---------+---------+---------+---------+---------+
| z0_col0 | z0_col1 | z0_col2 | z0_col3 | z0_col4 | z0_col5 |
+---------+---------+---------+---------+---------+---------+
+---------+---------+---------+---------+---------+---------+
insert into test_table1 (z0_col0,z0_col1) values (1,1),(2,2);
select * from test_table1 order by z0_col2;
+---------+---------+---------+---------+---------+------------+
| z0_col0 | z0_col1 | z0_col2 | z0_col3 | z0_col4 | z0_col5    |
+---------+---------+---------+---------+---------+------------+
|       1 |       1 |       0 |       3 |    -100 | 2020-06-22 |
|       2 |       2 |       0 |       3 |    -100 | 2020-06-22 |
+---------+---------+---------+---------+---------+------------+
select max(z0_col2),min(z0_col3) from test_table1 order by z0_col2;
+--------------+--------------+
| max(z0_col2) | min(z0_col3) |
+--------------+--------------+
|            0 |            3 |
+--------------+--------------+
# 特殊字符 ' ！@#￥%……&*（）-+'
drop table test_table1;
create table test_table1(
z0_col0 int,
z0_col1 int,
z0_col2 char(200) as (' ！@#￥%……&*（）-+') virtual,
z0_col3 char(200) as (',./?;:|[]{}~$%^&') stored
);
select * from test_table1 order by z0_col2;
+---------+---------+---------+---------+
| z0_col0 | z0_col1 | z0_col2 | z0_col3 |
+---------+---------+---------+---------+
+---------+---------+---------+---------+
insert into test_table1 (z0_col0,z0_col1) values (1,1),(2,2);
select * from test_table1 order by z0_col2;
+---------+---------+----------------------------+------------------+
| z0_col0 | z0_col1 | z0_col2                    | z0_col3          |
+---------+---------+----------------------------+------------------+
|       1 |       1 |  ！@#￥%……&*（）-+         | ,./?;:|[]{}~$%^& |
|       2 |       2 |  ！@#￥%……&*（）-+         | ,./?;:|[]{}~$%^& |
+---------+---------+----------------------------+------------------+
select max(z0_col2),min(z0_col3) from test_table1 order by z0_col2;
+----------------------------+------------------+
| max(z0_col2)               | min(z0_col3)     |
+----------------------------+------------------+
|  ！@#￥%……&*（）-+         | ,./?;:|[]{}~$%^& |
+----------------------------+------------------+
# 汉字，换行,\n,\t,\r
drop table test_table1;
create table test_table1(
z0_col0 int,
z0_col1 int,
z0_col2 char(200) as ('虚拟列') virtual,
z0_col3 char(200) as ('生成列') stored,
z0_col4 char(200) as ('虚拟列\n\t\r转换符') virtual,
z0_col5 char(200) as ('生成列\n\t\r转换符') stored,
z0_col6 char(200) as ('虚拟列
第二行') virtual,
z0_col7 char(200) as ('生成列
第二行') stored
);
select * from test_table1 order by z0_col2;
+---------+---------+---------+---------+---------+---------+---------+---------+
| z0_col0 | z0_col1 | z0_col2 | z0_col3 | z0_col4 | z0_col5 | z0_col6 | z0_col7 |
+---------+---------+---------+---------+---------+---------+---------+---------+
+---------+---------+---------+---------+---------+---------+---------+---------+
insert into test_table1 (z0_col0,z0_col1) values (1,1),(2,2);
select * from test_table1 order by z0_col2;
+---------+---------+-----------+-----------+-----------------------+-----------------------+---------------------+---------------------+
| z0_col0 | z0_col1 | z0_col2   | z0_col3   | z0_col4               | z0_col5               | z0_col6             | z0_col7             |
+---------+---------+-----------+-----------+-----------------------+-----------------------+---------------------+---------------------+
|       1 |       1 | 虚拟列    | 生成列    | 虚拟列
	转换符       | 生成列
	转换符       | 虚拟列
第二行       | 生成列
第二行       |
|       2 |       2 | 虚拟列    | 生成列    | 虚拟列
	转换符       | 生成列
	转换符       | 虚拟列
第二行       | 生成列
第二行       |
+---------+---------+-----------+-----------+-----------------------+-----------------------+---------------------+---------------------+
select max(z0_col2),min(z0_col3) from test_table1 order by z0_col2;
+--------------+--------------+
| max(z0_col2) | min(z0_col3) |
+--------------+--------------+
| 虚拟列       | 生成列       |
+--------------+--------------+
### 生成列：生成列上加默认值
drop table test_table1;
create table test_table1(
id int,
z0_col0 int,
z0_col1 int,
z0_col2 int as(z0_col0/z0_col1) virtual default '0',
z0_col3 int as(z0_col1*z0_col1) stored  default '0'
);
ERROR 42000: You have an error in your SQL syntax; check the manual that corresponds to your OceanBase version for the right syntax to use near 'default '0',
z0_col3 int as(z0_col1*z0_col1) stored  default '0'
)' at line 5
### 生成列：生成列引用生成列     ob不兼容MySQL
drop table test_table1;
create table test_table1(
z0_col0 int,
z0_col1 int,
z0_col2 int as(z0_col1) virtual,
z0_col3 int as(z0_col2) virtual
);
ERROR HY000: 'Defining a generated column on generated column(s)' is not supported for generated columns.
insert into test_table1 (z0_col0,z0_col1) values (10,10),(20,20),(30,30);
ERROR 42S02: Table 'whh.test_table1' doesn't exist
select * from test_table1 order by z0_col2;
ERROR 42S02: Table 'whh.test_table1' doesn't exist
### 表达式：生成列表达式 column / 0
drop table test_table1;
create table test_table1(
id int,
z0_col0 char(200) default '1',
z0_col1 char(200) default '2',
z0_col2 int as(z0_col0/0) virtual,
z0_col3 int as(z0_col1) stored
);
insert into test_table1 (id) values (1);
select z0_col0,z0_col1,z0_col2 col_vir,z0_col3 col_sto from test_table1 order by z0_col2;
+---------+---------+---------+---------+
| z0_col0 | z0_col1 | col_vir | col_sto |
+---------+---------+---------+---------+
| 1       | 2       |    NULL |       2 |
+---------+---------+---------+---------+
select max(z0_col2),min(z0_col3) from test_table1 order by z0_col2;
+--------------+--------------+
| max(z0_col2) | min(z0_col3) |
+--------------+--------------+
|         NULL |            2 |
+--------------+--------------+
### 表达式：生成列引用的普通列使用默认值
drop table test_table1;
create table test_table1(
id int,
z0_col0 int default 30,
z0_col1 int default 5,
z0_col2 int as(z0_col0/z0_col1) virtual,
z0_col3 int as(z0_col1*z0_col1) stored
);
insert into test_table1 (id) values (1);
select z0_col0,z0_col1,z0_col2 col_vir,z0_col3 col_sto from test_table1 order by z0_col2;
+---------+---------+---------+---------+
| z0_col0 | z0_col1 | col_vir | col_sto |
+---------+---------+---------+---------+
|      30 |       5 |       6 |      25 |
+---------+---------+---------+---------+
select max(z0_col2),min(z0_col3) from test_table1 order by z0_col2;
+--------------+--------------+
| max(z0_col2) | min(z0_col3) |
+--------------+--------------+
|            6 |           25 |
+--------------+--------------+
### 事务：向表中插入/删除数据，添加生成列等，再回滚
SET @@AUTOCOMMIT=0;
drop table test_table1;
create table test_table1(
z0_col0 int,
z0_col1 int,
z0_col2 int as(z0_col0/z0_col1) virtual,
z0_col3 int as(z0_col1*z0_col1) stored
);
insert into test_table1 (z0_col0,z0_col1) values (10,10),(20,20),(30,30);
select * from test_table1 order by z0_col2;
+---------+---------+---------+---------+
| z0_col0 | z0_col1 | z0_col2 | z0_col3 |
+---------+---------+---------+---------+
|      10 |      10 |       1 |     100 |
|      20 |      20 |       1 |     400 |
|      30 |      30 |       1 |     900 |
+---------+---------+---------+---------+
# 插入数据再回滚
start transaction;
insert into test_table1 (z0_col0,z0_col1) values (40,40);
select * from test_table1 order by z0_col2;
+---------+---------+---------+---------+
| z0_col0 | z0_col1 | z0_col2 | z0_col3 |
+---------+---------+---------+---------+
|      10 |      10 |       1 |     100 |
|      20 |      20 |       1 |     400 |
|      30 |      30 |       1 |     900 |
|      40 |      40 |       1 |    1600 |
+---------+---------+---------+---------+
rollback;
select z0_col0,z0_col1,z0_col2 col_vir,z0_col3 col_sto from test_table1 order by z0_col2;
+---------+---------+---------+---------+
| z0_col0 | z0_col1 | col_vir | col_sto |
+---------+---------+---------+---------+
|      10 |      10 |       1 |     100 |
|      20 |      20 |       1 |     400 |
|      30 |      30 |       1 |     900 |
+---------+---------+---------+---------+
select max(z0_col2),min(z0_col3) from test_table1 order by z0_col2;
+--------------+--------------+
| max(z0_col2) | min(z0_col3) |
+--------------+--------------+
|            1 |          100 |
+--------------+--------------+
# 删除数据再回滚
start transaction;
delete from test_table1 where z0_col3 = 900;
select * from test_table1 order by z0_col2;
+---------+---------+---------+---------+
| z0_col0 | z0_col1 | z0_col2 | z0_col3 |
+---------+---------+---------+---------+
|      10 |      10 |       1 |     100 |
|      20 |      20 |       1 |     400 |
+---------+---------+---------+---------+
rollback;
select z0_col0,z0_col1,z0_col2 col_vir,z0_col3 col_sto from test_table1 order by z0_col2;
+---------+---------+---------+---------+
| z0_col0 | z0_col1 | col_vir | col_sto |
+---------+---------+---------+---------+
|      10 |      10 |       1 |     100 |
|      20 |      20 |       1 |     400 |
|      30 |      30 |       1 |     900 |
+---------+---------+---------+---------+
select max(z0_col2),min(z0_col3) from test_table1 order by z0_col2;
+--------------+--------------+
| max(z0_col2) | min(z0_col3) |
+--------------+--------------+
|            1 |          100 |
+--------------+--------------+
# 添加生成列再回滚
start transaction;
alter table test_table1 add z0_col4 varchar(100) as (concat(z0_col0,z0_col1)) virtual;
select * from test_table1 order by z0_col2;
+---------+---------+---------+---------+---------+
| z0_col0 | z0_col1 | z0_col2 | z0_col3 | z0_col4 |
+---------+---------+---------+---------+---------+
|      10 |      10 |       1 |     100 | 1010    |
|      20 |      20 |       1 |     400 | 2020    |
|      30 |      30 |       1 |     900 | 3030    |
+---------+---------+---------+---------+---------+
rollback;
select z0_col0,z0_col1,z0_col2 col_vir,z0_col3 col_sto from test_table1 order by z0_col2;
+---------+---------+---------+---------+
| z0_col0 | z0_col1 | col_vir | col_sto |
+---------+---------+---------+---------+
|      10 |      10 |       1 |     100 |
|      20 |      20 |       1 |     400 |
|      30 |      30 |       1 |     900 |
+---------+---------+---------+---------+
select max(z0_col2),min(z0_col3) from test_table1 order by z0_col2;
+--------------+--------------+
| max(z0_col2) | min(z0_col3) |
+--------------+--------------+
|            1 |          100 |
+--------------+--------------+
SET @@AUTOCOMMIT=1;
### 一个表中含有多个虚拟列/存储列(6,7,8...)
drop table test_table1;
create table test_table1(
z0_col0 int,
z0_col1 int,
z0_col2 int as(z0_col0*1) virtual,
z0_col3 int as(z0_col0*2) virtual,
z0_col4 int as(z0_col0*3) virtual,
z0_col5 int as(z0_col0*4) virtual,
z0_col6 int as(z0_col0*5) virtual,
z0_col7 int as(z0_col0*6) virtual,
z0_col10 int as(z0_col1*1) stored,
z0_col11 int as(z0_col1*2) stored,
z0_col12 int as(z0_col1*3) stored,
z0_col13 int as(z0_col1*4) stored,
z0_col14 int as(z0_col1*5) stored,
z0_col15 int as(z0_col1*6) stored
);
insert into test_table1 (z0_col0,z0_col1) values (10,10),(20,20),(30,30);
select * from test_table1 order by z0_col2;
+---------+---------+---------+---------+---------+---------+---------+---------+----------+----------+----------+----------+----------+----------+
| z0_col0 | z0_col1 | z0_col2 | z0_col3 | z0_col4 | z0_col5 | z0_col6 | z0_col7 | z0_col10 | z0_col11 | z0_col12 | z0_col13 | z0_col14 | z0_col15 |
+---------+---------+---------+---------+---------+---------+---------+---------+----------+----------+----------+----------+----------+----------+
|      10 |      10 |      10 |      20 |      30 |      40 |      50 |      60 |       10 |       20 |       30 |       40 |       50 |       60 |
|      20 |      20 |      20 |      40 |      60 |      80 |     100 |     120 |       20 |       40 |       60 |       80 |      100 |      120 |
|      30 |      30 |      30 |      60 |      90 |     120 |     150 |     180 |       30 |       60 |       90 |      120 |      150 |      180 |
+---------+---------+---------+---------+---------+---------+---------+---------+----------+----------+----------+----------+----------+----------+
alter table test_table1 add z0_col8 int as (z0_col0*7) virtual;
alter table test_table1 add z0_col9 int as (z0_col0*8) virtual;
alter table test_table1 add z0_col16 int as (z0_col1*7) stored;
alter table test_table1 add z0_col17 int as (z0_col1*8) stored;
insert into test_table1 (z0_col0,z0_col1) values (10,10),(20,20),(30,30);
select * from test_table1 order by z0_col2;
+---------+---------+---------+---------+---------+---------+---------+---------+----------+----------+----------+----------+----------+----------+---------+---------+----------+----------+
| z0_col0 | z0_col1 | z0_col2 | z0_col3 | z0_col4 | z0_col5 | z0_col6 | z0_col7 | z0_col10 | z0_col11 | z0_col12 | z0_col13 | z0_col14 | z0_col15 | z0_col8 | z0_col9 | z0_col16 | z0_col17 |
+---------+---------+---------+---------+---------+---------+---------+---------+----------+----------+----------+----------+----------+----------+---------+---------+----------+----------+
|      10 |      10 |      10 |      20 |      30 |      40 |      50 |      60 |       10 |       20 |       30 |       40 |       50 |       60 |      70 |      80 |       70 |       80 |
|      10 |      10 |      10 |      20 |      30 |      40 |      50 |      60 |       10 |       20 |       30 |       40 |       50 |       60 |      70 |      80 |       70 |       80 |
|      20 |      20 |      20 |      40 |      60 |      80 |     100 |     120 |       20 |       40 |       60 |       80 |      100 |      120 |     140 |     160 |      140 |      160 |
|      20 |      20 |      20 |      40 |      60 |      80 |     100 |     120 |       20 |       40 |       60 |       80 |      100 |      120 |     140 |     160 |      140 |      160 |
|      30 |      30 |      30 |      60 |      90 |     120 |     150 |     180 |       30 |       60 |       90 |      120 |      150 |      180 |     210 |     240 |      210 |      240 |
|      30 |      30 |      30 |      60 |      90 |     120 |     150 |     180 |       30 |       60 |       90 |      120 |      150 |      180 |     210 |     240 |      210 |      240 |
+---------+---------+---------+---------+---------+---------+---------+---------+----------+----------+----------+----------+----------+----------+---------+---------+----------+----------+
desc test_table1;
+----------+---------+------+-----+-----------------+-------------------+
| Field    | Type    | Null | Key | Default         | Extra             |
+----------+---------+------+-----+-----------------+-------------------+
| z0_col0  | int(11) | YES  |     | NULL            |                   |
| z0_col1  | int(11) | YES  |     | NULL            |                   |
| z0_col2  | int(11) | YES  |     | (`z0_col0` * 1) | VIRTUAL GENERATED |
| z0_col3  | int(11) | YES  |     | (`z0_col0` * 2) | VIRTUAL GENERATED |
| z0_col4  | int(11) | YES  |     | (`z0_col0` * 3) | VIRTUAL GENERATED |
| z0_col5  | int(11) | YES  |     | (`z0_col0` * 4) | VIRTUAL GENERATED |
| z0_col6  | int(11) | YES  |     | (`z0_col0` * 5) | VIRTUAL GENERATED |
| z0_col7  | int(11) | YES  |     | (`z0_col0` * 6) | VIRTUAL GENERATED |
| z0_col10 | int(11) | YES  |     | (`z0_col1` * 1) | STORED GENERATED  |
| z0_col11 | int(11) | YES  |     | (`z0_col1` * 2) | STORED GENERATED  |
| z0_col12 | int(11) | YES  |     | (`z0_col1` * 3) | STORED GENERATED  |
| z0_col13 | int(11) | YES  |     | (`z0_col1` * 4) | STORED GENERATED  |
| z0_col14 | int(11) | YES  |     | (`z0_col1` * 5) | STORED GENERATED  |
| z0_col15 | int(11) | YES  |     | (`z0_col1` * 6) | STORED GENERATED  |
| z0_col8  | int(11) | YES  |     | (`z0_col0` * 7) | VIRTUAL GENERATED |
| z0_col9  | int(11) | YES  |     | (`z0_col0` * 8) | VIRTUAL GENERATED |
| z0_col16 | int(11) | YES  |     | (`z0_col1` * 7) | STORED GENERATED  |
| z0_col17 | int(11) | YES  |     | (`z0_col1` * 8) | STORED GENERATED  |
+----------+---------+------+-----+-----------------+-------------------+
drop user whh@'%';
drop database IF EXISTS whh ;
PURGE RECYCLEBIN;
# oracle_genrate-1-1 系统租户下修改配置 _rowsets_max_rows = 4
alter system set _rowsets_enabled = true tenant sys;
alter system set _rowsets_enabled = true tenant all_user;
alter system set _rowsets_enabled = true tenant all_meta;
alter system set _rowsets_max_rows = 4 tenant sys;
alter system set _rowsets_max_rows = 4 tenant all_user;
alter system set _rowsets_max_rows = 4 tenant all_meta;
alter system flush plan cache global;
# 环境清理
purge recyclebin;
result_format: 4
drop user whh@'%';
drop database if exists whh ;
create user whh identified by 'whh';
create database whh ;
grant all on *.* to whh WITH GRANT OPTION;


#############################################################################################
############ mysql_genrate-1-2 作为分区键
### key分区
drop table virtual_table;
create table virtual_table(
z0_col0 int, 
z0_col1 int,
z0_col2 int as(z0_col0+z0_col1)) 
partition by key(z0_col2) partitions 2;
insert into virtual_table (z0_col0,z0_col1) values (0,0),(NULL,NULL),(1.111,222),(10,10);
select z0_col0,z0_col1,z0_col2 from virtual_table partition(p0) order by z0_col2;
+---------+---------+---------+
| z0_col0 | z0_col1 | z0_col2 |
+---------+---------+---------+
|      10 |      10 |      20 |
|       1 |     222 |     223 |
+---------+---------+---------+
select z0_col0,z0_col1,z0_col2 from virtual_table partition(p1) order by z0_col2;
+---------+---------+---------+
| z0_col0 | z0_col1 | z0_col2 |
+---------+---------+---------+
|    NULL |    NULL |    NULL |
|       0 |       0 |       0 |
+---------+---------+---------+
explain select z0_col0,z0_col1,z0_col2 from virtual_table where z0_col2 = 0 order by z0_col2;
Query Plan
========================================================
|ID|OPERATOR       |NAME         |EST.ROWS|EST.TIME(us)|
--------------------------------------------------------
|0 |TABLE FULL SCAN|virtual_table|1       |3           |
========================================================
Outputs & filters:
-------------------------------------
  0 - output([virtual_table.z0_col0], [virtual_table.z0_col1], [column_conv(INT,PS:(11,0),NULL,cast(virtual_table.z0_col0 + virtual_table.z0_col1, INT(-1,
       0)))]), filter([column_conv(INT,PS:(11,0),NULL,cast(virtual_table.z0_col0 + virtual_table.z0_col1, INT(-1, 0))) = 0]), rowset=4
      access([virtual_table.z0_col0], [virtual_table.z0_col1]), partitions(p1)
      is_index_back=false, is_global_index=false, filter_before_indexback[false], 
      range_key([virtual_table.__pk_increment]), range(MIN ; MAX)always true
explain select z0_col0,z0_col1,z0_col2 from virtual_table where z0_col0+z0_col1 = 0 order by z0_col2;
Query Plan
====================================================================
|ID|OPERATOR                   |NAME         |EST.ROWS|EST.TIME(us)|
--------------------------------------------------------------------
|0 |PX COORDINATOR MERGE SORT  |             |1       |7           |
|1 |└─EXCHANGE OUT DISTR       |:EX10000     |1       |6           |
|2 |  └─SORT                   |             |1       |5           |
|3 |    └─PX PARTITION ITERATOR|             |1       |5           |
|4 |      └─TABLE FULL SCAN    |virtual_table|1       |5           |
====================================================================
Outputs & filters:
-------------------------------------
  0 - output([INTERNAL_FUNCTION(virtual_table.z0_col0, virtual_table.z0_col1, column_conv(INT,PS:(11,0),NULL,cast(virtual_table.z0_col0 + virtual_table.z0_col1,
       INT(-1, 0))))]), filter(nil), rowset=4
      sort_keys([column_conv(INT,PS:(11,0),NULL,cast(virtual_table.z0_col0 + virtual_table.z0_col1, INT(-1, 0))), ASC])
  1 - output([column_conv(INT,PS:(11,0),NULL,cast(virtual_table.z0_col0 + virtual_table.z0_col1, INT(-1, 0)))], [INTERNAL_FUNCTION(virtual_table.z0_col0,
       virtual_table.z0_col1, column_conv(INT,PS:(11,0),NULL,cast(virtual_table.z0_col0 + virtual_table.z0_col1, INT(-1, 0))))]), filter(nil), rowset=4
      dop=1
  2 - output([column_conv(INT,PS:(11,0),NULL,cast(virtual_table.z0_col0 + virtual_table.z0_col1, INT(-1, 0)))], [virtual_table.z0_col0], [virtual_table.z0_col1]), filter(nil), rowset=4
      sort_keys([column_conv(INT,PS:(11,0),NULL,cast(virtual_table.z0_col0 + virtual_table.z0_col1, INT(-1, 0))), ASC])
  3 - output([virtual_table.z0_col0], [virtual_table.z0_col1], [column_conv(INT,PS:(11,0),NULL,cast(virtual_table.z0_col0 + virtual_table.z0_col1, INT(-1,
       0)))]), filter(nil), rowset=4
      force partition granule
  4 - output([virtual_table.z0_col0], [virtual_table.z0_col1], [column_conv(INT,PS:(11,0),NULL,cast(virtual_table.z0_col0 + virtual_table.z0_col1, INT(-1,
       0)))]), filter([virtual_table.z0_col0 + virtual_table.z0_col1 = 0]), rowset=4
      access([virtual_table.z0_col0], [virtual_table.z0_col1]), partitions(p[0-1])
      is_index_back=false, is_global_index=false, filter_before_indexback[false], 
      range_key([virtual_table.__pk_increment]), range(MIN ; MAX)always true
drop table stored_table;
create table stored_table(
z0_col0 int, 
z0_col1 int,
z0_col2 int as(z0_col0+z0_col1) stored) 
partition by key(z0_col2) partitions 3;
insert into stored_table (z0_col0,z0_col1) values (0,0),(NULL,NULL),(1.111,222),(10,10);
select z0_col0,z0_col1,z0_col2 from stored_table partition(p0) order by z0_col2;
+---------+---------+---------+
| z0_col0 | z0_col1 | z0_col2 |
+---------+---------+---------+
|      10 |      10 |      20 |
+---------+---------+---------+
select z0_col0,z0_col1,z0_col2 from stored_table partition(p1) order by z0_col2;
+---------+---------+---------+
| z0_col0 | z0_col1 | z0_col2 |
+---------+---------+---------+
|       1 |     222 |     223 |
+---------+---------+---------+
select z0_col0,z0_col1,z0_col2 from stored_table partition(p2) order by z0_col2;
+---------+---------+---------+
| z0_col0 | z0_col1 | z0_col2 |
+---------+---------+---------+
|    NULL |    NULL |    NULL |
|       0 |       0 |       0 |
+---------+---------+---------+
explain select z0_col0,z0_col1,z0_col2 from stored_table where z0_col2 = 0 order by z0_col2;
Query Plan
=======================================================
|ID|OPERATOR       |NAME        |EST.ROWS|EST.TIME(us)|
-------------------------------------------------------
|0 |TABLE FULL SCAN|stored_table|1       |3           |
=======================================================
Outputs & filters:
-------------------------------------
  0 - output([stored_table.z0_col0], [stored_table.z0_col1], [stored_table.z0_col2]), filter([stored_table.z0_col2 = 0]), rowset=4
      access([stored_table.z0_col0], [stored_table.z0_col1], [stored_table.z0_col2]), partitions(p2)
      is_index_back=false, is_global_index=false, filter_before_indexback[false], 
      range_key([stored_table.__pk_increment]), range(MIN ; MAX)always true
explain select z0_col0,z0_col1,z0_col2 from stored_table where z0_col0+z0_col1 = 0 order by z0_col2;
Query Plan
===================================================================
|ID|OPERATOR                   |NAME        |EST.ROWS|EST.TIME(us)|
-------------------------------------------------------------------
|0 |PX COORDINATOR MERGE SORT  |            |1       |9           |
|1 |└─EXCHANGE OUT DISTR       |:EX10000    |1       |8           |
|2 |  └─SORT                   |            |1       |7           |
|3 |    └─PX PARTITION ITERATOR|            |1       |7           |
|4 |      └─TABLE FULL SCAN    |stored_table|1       |7           |
===================================================================
Outputs & filters:
-------------------------------------
  0 - output([INTERNAL_FUNCTION(stored_table.z0_col0, stored_table.z0_col1, stored_table.z0_col2)]), filter(nil), rowset=4
      sort_keys([stored_table.z0_col2, ASC])
  1 - output([stored_table.z0_col2], [INTERNAL_FUNCTION(stored_table.z0_col0, stored_table.z0_col1, stored_table.z0_col2)]), filter(nil), rowset=4
      dop=1
  2 - output([stored_table.z0_col2], [stored_table.z0_col0], [stored_table.z0_col1]), filter(nil), rowset=4
      sort_keys([stored_table.z0_col2, ASC])
  3 - output([stored_table.z0_col0], [stored_table.z0_col1], [stored_table.z0_col2]), filter(nil), rowset=4
      force partition granule
  4 - output([stored_table.z0_col0], [stored_table.z0_col1], [stored_table.z0_col2]), filter([stored_table.z0_col0 + stored_table.z0_col1 = 0]), rowset=4
      access([stored_table.z0_col0], [stored_table.z0_col1], [stored_table.z0_col2]), partitions(p[0-2])
      is_index_back=false, is_global_index=false, filter_before_indexback[false], 
      range_key([stored_table.__pk_increment]), range(MIN ; MAX)always true
### COLUMNS分区
drop table virtual_table;
create table virtual_table(
z0_col0 int, 
z0_col1 int,
z0_col2 int as (abs(z0_col0-z0_col1)))
partition by range columns(z0_col2) (
partition p0 values less than (10),
partition p1 values less than (20),
partition p2 values less than maxvalue);
insert into virtual_table (z0_col0,z0_col1) values (0,0),(NULL,NULL),(5,25),(20,30),(100,10);
select z0_col0,z0_col1,z0_col2 from virtual_table partition(p0) order by z0_col2;
+---------+---------+---------+
| z0_col0 | z0_col1 | z0_col2 |
+---------+---------+---------+
|    NULL |    NULL |    NULL |
|       0 |       0 |       0 |
+---------+---------+---------+
select z0_col0,z0_col1,z0_col2 from virtual_table partition(p1) order by z0_col2;
+---------+---------+---------+
| z0_col0 | z0_col1 | z0_col2 |
+---------+---------+---------+
|      20 |      30 |      10 |
+---------+---------+---------+
select z0_col0,z0_col1,z0_col2 from virtual_table partition(p2) order by z0_col2;
+---------+---------+---------+
| z0_col0 | z0_col1 | z0_col2 |
+---------+---------+---------+
|       5 |      25 |      20 |
|     100 |      10 |      90 |
+---------+---------+---------+
explain select z0_col0,z0_col1,z0_col2 from virtual_table where z0_col2 = 0 order by z0_col2;
Query Plan
========================================================
|ID|OPERATOR       |NAME         |EST.ROWS|EST.TIME(us)|
--------------------------------------------------------
|0 |TABLE FULL SCAN|virtual_table|1       |3           |
========================================================
Outputs & filters:
-------------------------------------
  0 - output([virtual_table.z0_col0], [virtual_table.z0_col1], [column_conv(INT,PS:(11,0),NULL,cast(abs(virtual_table.z0_col0 - virtual_table.z0_col1), 
      INT(-1, 0)))]), filter([column_conv(INT,PS:(11,0),NULL,cast(abs(virtual_table.z0_col0 - virtual_table.z0_col1), INT(-1, 0))) = 0]), rowset=4
      access([virtual_table.z0_col0], [virtual_table.z0_col1]), partitions(p0)
      is_index_back=false, is_global_index=false, filter_before_indexback[false], 
      range_key([virtual_table.__pk_increment]), range(MIN ; MAX)always true
explain select z0_col0,z0_col1,z0_col2 from virtual_table where abs(z0_col0-z0_col1) = 0 order by z0_col2;
Query Plan
====================================================================
|ID|OPERATOR                   |NAME         |EST.ROWS|EST.TIME(us)|
--------------------------------------------------------------------
|0 |PX COORDINATOR MERGE SORT  |             |1       |9           |
|1 |└─EXCHANGE OUT DISTR       |:EX10000     |1       |8           |
|2 |  └─SORT                   |             |1       |7           |
|3 |    └─PX PARTITION ITERATOR|             |1       |7           |
|4 |      └─TABLE FULL SCAN    |virtual_table|1       |7           |
====================================================================
Outputs & filters:
-------------------------------------
  0 - output([INTERNAL_FUNCTION(virtual_table.z0_col0, virtual_table.z0_col1, column_conv(INT,PS:(11,0),NULL,cast(abs(virtual_table.z0_col0 - virtual_table.z0_col1),
       INT(-1, 0))))]), filter(nil), rowset=4
      sort_keys([column_conv(INT,PS:(11,0),NULL,cast(abs(virtual_table.z0_col0 - virtual_table.z0_col1), INT(-1, 0))), ASC])
  1 - output([column_conv(INT,PS:(11,0),NULL,cast(abs(virtual_table.z0_col0 - virtual_table.z0_col1), INT(-1, 0)))], [INTERNAL_FUNCTION(virtual_table.z0_col0,
       virtual_table.z0_col1, column_conv(INT,PS:(11,0),NULL,cast(abs(virtual_table.z0_col0 - virtual_table.z0_col1), INT(-1, 0))))]), filter(nil), rowset=4
      dop=1
  2 - output([column_conv(INT,PS:(11,0),NULL,cast(abs(virtual_table.z0_col0 - virtual_table.z0_col1), INT(-1, 0)))], [virtual_table.z0_col0], [virtual_table.z0_col1]), filter(nil), rowset=4
      sort_keys([column_conv(INT,PS:(11,0),NULL,cast(abs(virtual_table.z0_col0 - virtual_table.z0_col1), INT(-1, 0))), ASC])
  3 - output([virtual_table.z0_col0], [virtual_table.z0_col1], [column_conv(INT,PS:(11,0),NULL,cast(abs(virtual_table.z0_col0 - virtual_table.z0_col1), 
      INT(-1, 0)))]), filter(nil), rowset=4
      force partition granule
  4 - output([virtual_table.z0_col0], [virtual_table.z0_col1], [column_conv(INT,PS:(11,0),NULL,cast(abs(virtual_table.z0_col0 - virtual_table.z0_col1), 
      INT(-1, 0)))]), filter([abs(virtual_table.z0_col0 - virtual_table.z0_col1) = 0]), rowset=4
      access([virtual_table.z0_col0], [virtual_table.z0_col1]), partitions(p[0-2])
      is_index_back=false, is_global_index=false, filter_before_indexback[false], 
      range_key([virtual_table.__pk_increment]), range(MIN ; MAX)always true
drop table stored_table;
create table stored_table(
z0_col0 int,
z0_col1 int,
z0_col2 int as (abs(z0_col0-z0_col1)) stored)
partition by range columns(z0_col2) (
partition p0 values less than (10),
partition p1 values less than (20),
partition p2 values less than maxvalue);
insert into stored_table (z0_col0,z0_col1) values (0,0),(NULL,NULL),(5,25),(20,30),(100,10);
select z0_col0,z0_col1,z0_col2 from stored_table partition(p0) order by z0_col2;
+---------+---------+---------+
| z0_col0 | z0_col1 | z0_col2 |
+---------+---------+---------+
|    NULL |    NULL |    NULL |
|       0 |       0 |       0 |
+---------+---------+---------+
select z0_col0,z0_col1,z0_col2 from stored_table partition(p1) order by z0_col2;
+---------+---------+---------+
| z0_col0 | z0_col1 | z0_col2 |
+---------+---------+---------+
|      20 |      30 |      10 |
+---------+---------+---------+
select z0_col0,z0_col1,z0_col2 from stored_table partition(p2) order by z0_col2;
+---------+---------+---------+
| z0_col0 | z0_col1 | z0_col2 |
+---------+---------+---------+
|       5 |      25 |      20 |
|     100 |      10 |      90 |
+---------+---------+---------+
explain select z0_col0,z0_col1,z0_col2 from stored_table where z0_col2 = 0 order by z0_col2;
Query Plan
=======================================================
|ID|OPERATOR       |NAME        |EST.ROWS|EST.TIME(us)|
-------------------------------------------------------
|0 |TABLE FULL SCAN|stored_table|1       |3           |
=======================================================
Outputs & filters:
-------------------------------------
  0 - output([stored_table.z0_col0], [stored_table.z0_col1], [stored_table.z0_col2]), filter([stored_table.z0_col2 = 0]), rowset=4
      access([stored_table.z0_col0], [stored_table.z0_col1], [stored_table.z0_col2]), partitions(p0)
      is_index_back=false, is_global_index=false, filter_before_indexback[false], 
      range_key([stored_table.__pk_increment]), range(MIN ; MAX)always true
explain select z0_col0,z0_col1,z0_col2 from stored_table where abs(z0_col0-z0_col1) = 0 order by z0_col2;
Query Plan
===================================================================
|ID|OPERATOR                   |NAME        |EST.ROWS|EST.TIME(us)|
-------------------------------------------------------------------
|0 |PX COORDINATOR MERGE SORT  |            |1       |9           |
|1 |└─EXCHANGE OUT DISTR       |:EX10000    |1       |8           |
|2 |  └─SORT                   |            |1       |7           |
|3 |    └─PX PARTITION ITERATOR|            |1       |7           |
|4 |      └─TABLE FULL SCAN    |stored_table|1       |7           |
===================================================================
Outputs & filters:
-------------------------------------
  0 - output([INTERNAL_FUNCTION(stored_table.z0_col0, stored_table.z0_col1, stored_table.z0_col2)]), filter(nil), rowset=4
      sort_keys([stored_table.z0_col2, ASC])
  1 - output([stored_table.z0_col2], [INTERNAL_FUNCTION(stored_table.z0_col0, stored_table.z0_col1, stored_table.z0_col2)]), filter(nil), rowset=4
      dop=1
  2 - output([stored_table.z0_col2], [stored_table.z0_col0], [stored_table.z0_col1]), filter(nil), rowset=4
      sort_keys([stored_table.z0_col2, ASC])
  3 - output([stored_table.z0_col0], [stored_table.z0_col1], [stored_table.z0_col2]), filter(nil), rowset=4
      force partition granule
  4 - output([stored_table.z0_col0], [stored_table.z0_col1], [stored_table.z0_col2]), filter([abs(stored_table.z0_col0 - stored_table.z0_col1) = 0]), rowset=4
      access([stored_table.z0_col0], [stored_table.z0_col1], [stored_table.z0_col2]), partitions(p[0-2])
      is_index_back=false, is_global_index=false, filter_before_indexback[false], 
      range_key([stored_table.__pk_increment]), range(MIN ; MAX)always true
### 视图
# 单基表 含有虚拟列(VIRTUAL)的表
drop table virtual_table;
create table virtual_table(
z0_col0 char(100), 
z0_col1 varchar(100),
z0_col2 varchar(100) as (concat(z0_col0,z0_col1)) virtual);
insert into virtual_table (z0_col0,z0_col1) values (0,0),(NULL,NULL),('2022-06-21','ten'),(100,10.00);
select z0_col0,z0_col1,z0_col2 from virtual_table order by z0_col2;
+------------+---------+---------------+
| z0_col0    | z0_col1 | z0_col2       |
+------------+---------+---------------+
| NULL       | NULL    | NULL          |
| 0          | 0       | 00            |
| 100        | 10.00   | 10010.00      |
| 2022-06-21 | ten     | 2022-06-21ten |
+------------+---------+---------------+
drop view view1;
create view view1 as select z0_col0,z0_col1,z0_col2 from virtual_table where length(z0_col2)>1 order by 1;
select * from view1 order by 1;
+------------+---------+---------------+
| z0_col0    | z0_col1 | z0_col2       |
+------------+---------+---------------+
| 0          | 0       | 00            |
| 100        | 10.00   | 10010.00      |
| 2022-06-21 | ten     | 2022-06-21ten |
+------------+---------+---------------+
insert into view1 (z0_col0,z0_col1) values ('view-','-insert');
select * from view1 order by 1;
+------------+---------+---------------+
| z0_col0    | z0_col1 | z0_col2       |
+------------+---------+---------------+
| 0          | 0       | 00            |
| 100        | 10.00   | 10010.00      |
| 2022-06-21 | ten     | 2022-06-21ten |
| view-      | -insert | view--insert  |
+------------+---------+---------------+
update  view1 set z0_col2=0 where 1=1;
ERROR HY000: The value specified for generated column 'z0_col2' in table 'view1' is not allowed
# 单基表 含有生成列(STORED)的表
drop table stored_table;
create table stored_table (
z0_col0 char(100), 
z0_col1 varchar(100),
z0_col2 varchar(100) as (concat(z0_col0,z0_col1)) stored);
insert into stored_table (z0_col0,z0_col1) values (0,0),(NULL,NULL),('2022-06-21','ten'),(100,10.00);
select z0_col0,z0_col1,z0_col2 from stored_table order by z0_col2;
+------------+---------+---------------+
| z0_col0    | z0_col1 | z0_col2       |
+------------+---------+---------------+
| NULL       | NULL    | NULL          |
| 0          | 0       | 00            |
| 100        | 10.00   | 10010.00      |
| 2022-06-21 | ten     | 2022-06-21ten |
+------------+---------+---------------+
drop view view1;
create view view1 as select z0_col0,z0_col1,z0_col2 from stored_table where length(z0_col2)>1 order by 1;
select * from view1 order by z0_col2;
+------------+---------+---------------+
| z0_col0    | z0_col1 | z0_col2       |
+------------+---------+---------------+
| 0          | 0       | 00            |
| 100        | 10.00   | 10010.00      |
| 2022-06-21 | ten     | 2022-06-21ten |
+------------+---------+---------------+
insert into view1 (z0_col0,z0_col1) values ('view-','-insert');
select * from view1 order by z0_col2;
+------------+---------+---------------+
| z0_col0    | z0_col1 | z0_col2       |
+------------+---------+---------------+
| 0          | 0       | 00            |
| 100        | 10.00   | 10010.00      |
| 2022-06-21 | ten     | 2022-06-21ten |
| view-      | -insert | view--insert  |
+------------+---------+---------------+
update  view1 set z0_col2=0 where 1=1;
ERROR HY000: The value specified for generated column 'z0_col2' in table 'view1' is not allowed
# 单基表 普通的表，后追加生成列(VIRTUAL/STORED)
drop table stored_table;
create table stored_table (
z0_col0 char(100), 
z0_col1 varchar(100));
alter table stored_table add z0_col2 varchar(100) as (concat(z0_col0,z0_col1)) virtual;
alter table stored_table add z0_col3 varchar(100) as (lower(concat(z0_col0,z0_col1))) stored;
insert into stored_table (z0_col0,z0_col1) values (0,0),(NULL,NULL),('2022-06-21','ten'),('WANGHUANHUAN ','CHINA');
select z0_col0,z0_col1,z0_col2,z0_col3 from stored_table order by z0_col1;
+--------------+---------+-------------------+-------------------+
| z0_col0      | z0_col1 | z0_col2           | z0_col3           |
+--------------+---------+-------------------+-------------------+
| NULL         | NULL    | NULL              | NULL              |
| 0            | 0       | 00                | 00                |
| WANGHUANHUAN | CHINA   | WANGHUANHUANCHINA | wanghuanhuanchina |
| 2022-06-21   | ten     | 2022-06-21ten     | 2022-06-21ten     |
+--------------+---------+-------------------+-------------------+
drop view view1;
create view view1 as select * from stored_table;
select * from view1 order by z0_col2;
+--------------+---------+-------------------+-------------------+
| z0_col0      | z0_col1 | z0_col2           | z0_col3           |
+--------------+---------+-------------------+-------------------+
| NULL         | NULL    | NULL              | NULL              |
| 0            | 0       | 00                | 00                |
| 2022-06-21   | ten     | 2022-06-21ten     | 2022-06-21ten     |
| WANGHUANHUAN | CHINA   | WANGHUANHUANCHINA | wanghuanhuanchina |
+--------------+---------+-------------------+-------------------+
update  view1 set z0_col2=0 where 1=1;
ERROR HY000: The value specified for generated column 'z0_col2' in table 'view1' is not allowed
# 单基表 两个含有虚拟列(VIRTUAL)的表
drop table virtual_table1;
create  table virtual_table1 (
id int,
z0_col0 char(100), 
z0_col1 varchar(100),
z0_col2 varchar(100) as (concat(z0_col0,z0_col1)) virtual);
insert into virtual_table1 (id,z0_col0,z0_col1) values (0,0,0),(1,NULL,NULL),(2,'virtual_table1','one'),(3,100,10.00);
select id,z0_col0,z0_col1,z0_col2 from virtual_table1 order by z0_col2;
+------+----------------+---------+-------------------+
| id   | z0_col0        | z0_col1 | z0_col2           |
+------+----------------+---------+-------------------+
|    1 | NULL           | NULL    | NULL              |
|    0 | 0              | 0       | 00                |
|    3 | 100            | 10.00   | 10010.00          |
|    2 | virtual_table1 | one     | virtual_table1one |
+------+----------------+---------+-------------------+
drop table virtual_table2;
create  table virtual_table2 (
id int,
z1_col0 char(100), 
z1_col1 varchar(100),
z1_col2 varchar(100) as (concat(z1_col0,z1_col1)) virtual);
insert into virtual_table2 (id,z1_col0,z1_col1) values (0,0,0),(1,NULL,NULL),(2,'virtual_table2','two'),(3,200,20.00);
select id,z1_col0,z1_col1,z1_col2 from virtual_table2 order by z1_col2;
+------+----------------+---------+-------------------+
| id   | z1_col0        | z1_col1 | z1_col2           |
+------+----------------+---------+-------------------+
|    1 | NULL           | NULL    | NULL              |
|    0 | 0              | 0       | 00                |
|    3 | 200            | 20.00   | 20020.00          |
|    2 | virtual_table2 | two     | virtual_table2two |
+------+----------------+---------+-------------------+
drop view view1;
create view view1 as select t1.z0_col0,t1.z0_col1,t1.z0_col2,t2.z1_col0,t2.z1_col1,t2.z1_col2 from virtual_table1 t1 inner join virtual_table2 t2 on t1.id=t2.id order by 1;
select * from view1 order by 1;
+----------------+---------+-------------------+----------------+---------+-------------------+
| z0_col0        | z0_col1 | z0_col2           | z1_col0        | z1_col1 | z1_col2           |
+----------------+---------+-------------------+----------------+---------+-------------------+
| NULL           | NULL    | NULL              | NULL           | NULL    | NULL              |
| 0              | 0       | 00                | 0              | 0       | 00                |
| 100            | 10.00   | 10010.00          | 200            | 20.00   | 20020.00          |
| virtual_table1 | one     | virtual_table1one | virtual_table2 | two     | virtual_table2two |
+----------------+---------+-------------------+----------------+---------+-------------------+
insert into view1 (z0_col0,z0_col1,z1_col0,z1_col1) values ('view-','-insert1','view-','-insert2');
ERROR HY000: Can not modify more than one base table through a join view 'whh.view1'
# 单基表 两个含有生成列(STORED)的表
drop table stored_table1;
create  table stored_table1 (
id int,
z0_col0 char(100), 
z0_col1 varchar(100),
z0_col2 varchar(100) as (concat(z0_col0,z0_col1)) stored);
insert into stored_table1 (id,z0_col0,z0_col1) values (0,0,0),(1,NULL,NULL),(2,'stored_table1','one'),(3,100,10.00);
select id,z0_col0,z0_col1,z0_col2 from stored_table1 order by z0_col2;
+------+---------------+---------+------------------+
| id   | z0_col0       | z0_col1 | z0_col2          |
+------+---------------+---------+------------------+
|    1 | NULL          | NULL    | NULL             |
|    0 | 0             | 0       | 00               |
|    3 | 100           | 10.00   | 10010.00         |
|    2 | stored_table1 | one     | stored_table1one |
+------+---------------+---------+------------------+
drop table stored_table2;
create  table stored_table2 (
id int,
z1_col0 char(100), 
z1_col1 varchar(100),
z1_col2 varchar(100) as (concat(z1_col0,z1_col1)) stored);
insert into stored_table2 (id,z1_col0,z1_col1) values (0,0,0),(1,NULL,NULL),(2,'stored_table2','two'),(3,200,20.00);
select id,z1_col0,z1_col1,z1_col2 from stored_table2 order by z1_col2;
+------+---------------+---------+------------------+
| id   | z1_col0       | z1_col1 | z1_col2          |
+------+---------------+---------+------------------+
|    1 | NULL          | NULL    | NULL             |
|    0 | 0             | 0       | 00               |
|    3 | 200           | 20.00   | 20020.00         |
|    2 | stored_table2 | two     | stored_table2two |
+------+---------------+---------+------------------+
drop view view1;
create view view1 as select t1.z0_col0,t1.z0_col1,t1.z0_col2,t2.z1_col0,t2.z1_col1,t2.z1_col2 from stored_table1 t1 inner join stored_table2 t2 on t1.id=t2.id order by 1;
select * from view1 order by z0_col2;
+---------------+---------+------------------+---------------+---------+------------------+
| z0_col0       | z0_col1 | z0_col2          | z1_col0       | z1_col1 | z1_col2          |
+---------------+---------+------------------+---------------+---------+------------------+
| NULL          | NULL    | NULL             | NULL          | NULL    | NULL             |
| 0             | 0       | 00               | 0             | 0       | 00               |
| 100           | 10.00   | 10010.00         | 200           | 20.00   | 20020.00         |
| stored_table1 | one     | stored_table1one | stored_table2 | two     | stored_table2two |
+---------------+---------+------------------+---------------+---------+------------------+
insert into view1 (z0_col0,z0_col1,z1_col0,z1_col1) values ('view-','-insert1','view-','-insert2');
ERROR HY000: Can not modify more than one base table through a join view 'whh.view1'
# 单基表 一个含有虚拟列(VIRTUAL)的表，一个含有生成列(STORED)的表
drop table virtual_table1;
create  table virtual_table1 (
id int,
z0_col0 char(100), 
z0_col1 varchar(100),
z0_col2 varchar(100) as (concat(z0_col0,z0_col1)) virtual);
insert into virtual_table1 (id,z0_col0,z0_col1) values (0,0,0),(1,NULL,NULL),(2,'virtual_table1','one'),(3,100,10.00);
select id,z0_col0,z0_col1,z0_col2 from virtual_table1 order by z0_col2;
+------+----------------+---------+-------------------+
| id   | z0_col0        | z0_col1 | z0_col2           |
+------+----------------+---------+-------------------+
|    1 | NULL           | NULL    | NULL              |
|    0 | 0              | 0       | 00                |
|    3 | 100            | 10.00   | 10010.00          |
|    2 | virtual_table1 | one     | virtual_table1one |
+------+----------------+---------+-------------------+
drop table stored_table2;
create  table stored_table2 (
id int,
z1_col0 char(100), 
z1_col1 varchar(100),
z1_col2 varchar(100) as (concat(z1_col0,z1_col1)) stored);
insert into stored_table2 (id,z1_col0,z1_col1) values (0,0,0),(1,NULL,NULL),(2,'stored_table2','two'),(3,200,20.00);
select id,z1_col0,z1_col1,z1_col2 from stored_table2 order by z1_col2;
+------+---------------+---------+------------------+
| id   | z1_col0       | z1_col1 | z1_col2          |
+------+---------------+---------+------------------+
|    1 | NULL          | NULL    | NULL             |
|    0 | 0             | 0       | 00               |
|    3 | 200           | 20.00   | 20020.00         |
|    2 | stored_table2 | two     | stored_table2two |
+------+---------------+---------+------------------+
drop view view1;
create view view1 as select t1.z0_col0,t1.z0_col1,t1.z0_col2,t2.z1_col0,t2.z1_col1,t2.z1_col2 from virtual_table1 t1 inner join stored_table2 t2 on t1.id=t2.id order by 1;
select * from view1 order by z0_col2;
+----------------+---------+-------------------+---------------+---------+------------------+
| z0_col0        | z0_col1 | z0_col2           | z1_col0       | z1_col1 | z1_col2          |
+----------------+---------+-------------------+---------------+---------+------------------+
| NULL           | NULL    | NULL              | NULL          | NULL    | NULL             |
| 0              | 0       | 00                | 0             | 0       | 00               |
| 100            | 10.00   | 10010.00          | 200           | 20.00   | 20020.00         |
| virtual_table1 | one     | virtual_table1one | stored_table2 | two     | stored_table2two |
+----------------+---------+-------------------+---------------+---------+------------------+
insert into view1 (z0_col0,z0_col1,z1_col0,z1_col1) values ('view-','-insert1','view-','-insert2');
ERROR HY000: Can not modify more than one base table through a join view 'whh.view1'
### ALTER TABLE 语句
# RENAME 重命名表
drop table test_table;
create table test_table(
z0_col0 float, 
z0_col1 float,
z0_col2 float as(z0_col0+z0_col1) virtual,
z0_col3 float as(floor(z0_col0+z0_col1)) stored
);
insert into test_table (z0_col0,z0_col1) values (0,0),(NULL,NULL),(1.111,22.2),(10.5,10.9),(-100.5,20.9);
select z0_col0,z0_col1,z0_col2,abs(z0_col3) from test_table order by z0_col2;
+---------+---------+---------+--------------+
| z0_col0 | z0_col1 | z0_col2 | abs(z0_col3) |
+---------+---------+---------+--------------+
|    NULL |    NULL |    NULL |         NULL |
|  -100.5 |    20.9 |   -79.6 |           80 |
|       0 |       0 |       0 |            0 |
|    10.5 |    10.9 |    21.4 |           21 |
|   1.111 |    22.2 |  23.311 |           23 |
+---------+---------+---------+--------------+
select max(z0_col2),min(z0_col3) from test_table order by z0_col2;
+--------------+--------------+
| max(z0_col2) | min(z0_col3) |
+--------------+--------------+
|       23.311 |          -80 |
+--------------+--------------+
drop table new_test_table;
alter table test_table rename to new_test_table;
insert into new_test_table (z0_col0,z0_col1) values (100,200);
select z0_col0,z0_col1,z0_col2,abs(z0_col3) from new_test_table order by z0_col2;
+---------+---------+---------+--------------+
| z0_col0 | z0_col1 | z0_col2 | abs(z0_col3) |
+---------+---------+---------+--------------+
|    NULL |    NULL |    NULL |         NULL |
|  -100.5 |    20.9 |   -79.6 |           80 |
|       0 |       0 |       0 |            0 |
|    10.5 |    10.9 |    21.4 |           21 |
|   1.111 |    22.2 |  23.311 |           23 |
|     100 |     200 |     300 |          300 |
+---------+---------+---------+--------------+
# RENAME COLUMN 重命名生成列 ob不支持重命名列名，报ERROR 1064.
drop table test_table1;
create table test_table1(
z0_col0 int,
z0_col1 int,
z0_col2 int as(abs(z0_col0)) virtual,
z0_col3 int as(power(z0_col1,2)) stored
);
insert into test_table1 (z0_col0,z0_col1) values (0,10),(-20,20),(3.50,30);
select * from test_table1 order by z0_col2;
+---------+---------+---------+---------+
| z0_col0 | z0_col1 | z0_col2 | z0_col3 |
+---------+---------+---------+---------+
|       0 |      10 |       0 |     100 |
|       4 |      30 |       4 |     900 |
|     -20 |      20 |      20 |     400 |
+---------+---------+---------+---------+
alter table test_table1 rename column z0_col2 to new_z0_col2;
alter table test_table1 rename column z0_col3 to new_z0_col3;
insert into new_test_table (z0_col0,z0_col1) values (5.5,10.6);
select z0_col0,z0_col1,z0_col2,abs(z0_col3) from new_test_table order by z0_col2;
+---------+---------+---------+--------------+
| z0_col0 | z0_col1 | z0_col2 | abs(z0_col3) |
+---------+---------+---------+--------------+
|    NULL |    NULL |    NULL |         NULL |
|  -100.5 |    20.9 |   -79.6 |           80 |
|       0 |       0 |       0 |            0 |
|     5.5 |    10.6 |    16.1 |           16 |
|    10.5 |    10.9 |    21.4 |           21 |
|   1.111 |    22.2 |  23.311 |           23 |
|     100 |     200 |     300 |          300 |
+---------+---------+---------+--------------+
# RENAME COLUMN 重命名生成列引用的普通列
alter table test_table1 rename column z0_col0 to new_z0_col0;
ERROR HY000: Column 'z0_col0' has a generated column dependency
insert into new_test_table (z0_col0,z0_col1) values (-40,5);
select z0_col0,z0_col1,z0_col2,abs(z0_col3) from new_test_table order by z0_col2;
+---------+---------+---------+--------------+
| z0_col0 | z0_col1 | z0_col2 | abs(z0_col3) |
+---------+---------+---------+--------------+
|    NULL |    NULL |    NULL |         NULL |
|  -100.5 |    20.9 |   -79.6 |           80 |
|     -40 |       5 |     -35 |           35 |
|       0 |       0 |       0 |            0 |
|     5.5 |    10.6 |    16.1 |           16 |
|    10.5 |    10.9 |    21.4 |           21 |
|   1.111 |    22.2 |  23.311 |           23 |
|     100 |     200 |     300 |          300 |
+---------+---------+---------+--------------+
# MODIFY 修改生成列 虚拟生成列-》存储生成列
drop table test_table;
create table test_table(
z0_col0 float, 
z0_col1 float,
z0_col2 float as(z0_col0/z0_col1) virtual
);
insert into test_table (z0_col0,z0_col1) values (0,0),(NULL,NULL),(1.111,22.2),(10.5,10.9),(-100.5,20.9);
select z0_col0,z0_col1,z0_col2 from test_table order by z0_col2;
+---------+---------+----------+
| z0_col0 | z0_col1 | z0_col2  |
+---------+---------+----------+
|       0 |       0 |     NULL |
|    NULL |    NULL |     NULL |
|  -100.5 |    20.9 | -4.80861 |
|   1.111 |    22.2 | 0.050045 |
|    10.5 |    10.9 | 0.963303 |
+---------+---------+----------+
alter table test_table modify z0_col2 float as(z0_col0/z0_col1) stored;
Got one of the listed errors
# MODIFY 修改生成列 虚拟生成列-》普通列
drop table test_table;
create table test_table(
z0_col0 float, 
z0_col1 float,
z0_col2 float as(z0_col0/z0_col1) virtual
);
insert into test_table (z0_col0,z0_col1) values (0,0),(NULL,NULL),(1.111,22.2),(10.5,10.9),(-100.5,20.9);
select z0_col0,z0_col1,z0_col2 from test_table order by z0_col2;
+---------+---------+----------+
| z0_col0 | z0_col1 | z0_col2  |
+---------+---------+----------+
|       0 |       0 |     NULL |
|    NULL |    NULL |     NULL |
|  -100.5 |    20.9 | -4.80861 |
|   1.111 |    22.2 | 0.050045 |
|    10.5 |    10.9 | 0.963303 |
+---------+---------+----------+
alter table test_table modify z0_col2 float;
Got one of the listed errors
# MODIFY 修改生成列 存储生成列-》虚拟生成列
drop table test_table;
create table test_table(
z0_col0 float, 
z0_col1 float,
z0_col2 float as(z0_col0/z0_col1) stored
);
insert into test_table (z0_col0,z0_col1) values (0,0),(NULL,NULL),(1.111,22.2),(10.5,10.9),(-100.5,20.9);
select z0_col0,z0_col1,z0_col2 from test_table order by z0_col2;
+---------+---------+----------+
| z0_col0 | z0_col1 | z0_col2  |
+---------+---------+----------+
|       0 |       0 |     NULL |
|    NULL |    NULL |     NULL |
|  -100.5 |    20.9 | -4.80861 |
|   1.111 |    22.2 | 0.050045 |
|    10.5 |    10.9 | 0.963303 |
+---------+---------+----------+
alter table test_table modify z0_col2 float as(z0_col0/z0_col1) virtual;
Got one of the listed errors
show create table test_table;
Table	Create Table
test_table	CREATE TABLE `test_table` (
  `z0_col0` float DEFAULT NULL,
  `z0_col1` float DEFAULT NULL,
  `z0_col2` float GENERATED ALWAYS AS ((`z0_col0` / `z0_col1`)) STORED
) ORGANIZATION INDEX DEFAULT CHARSET = utf8mb4 ROW_FORMAT = DYNAMIC COMPRESSION = 'zstd_1.3.8' REPLICA_NUM = 1 BLOCK_SIZE = 16384 USE_BLOOM_FILTER = FALSE ENABLE_MACRO_BLOCK_BLOOM_FILTER = FALSE TABLET_SIZE = 134217728 PCTFREE = 0
# MODIFY 修改生成列 存储生成列-》普通列
# bug1:【Generated Columns】OB Mysql模式，将存储生成列更改为普通列,mysql成功，ob失败。
drop table test_table;
create table test_table(
z0_col0 float, 
z0_col1 float,
z0_col2 float as(z0_col0/z0_col1) stored
);
insert into test_table (z0_col0,z0_col1) values (0,0),(NULL,NULL),(1.111,22.2),(10.5,10.9),(-100.5,20.9);
select z0_col0,z0_col1,z0_col2 from test_table order by z0_col2;
+---------+---------+----------+
| z0_col0 | z0_col1 | z0_col2  |
+---------+---------+----------+
|       0 |       0 |     NULL |
|    NULL |    NULL |     NULL |
|  -100.5 |    20.9 | -4.80861 |
|   1.111 |    22.2 | 0.050045 |
|    10.5 |    10.9 | 0.963303 |
+---------+---------+----------+
alter table test_table modify z0_col2 float;
Got one of the listed errors
select z0_col0,z0_col1,z0_col2 from test_table order by z0_col2;
+---------+---------+----------+
| z0_col0 | z0_col1 | z0_col2  |
+---------+---------+----------+
|       0 |       0 |     NULL |
|    NULL |    NULL |     NULL |
|  -100.5 |    20.9 | -4.80861 |
|   1.111 |    22.2 | 0.050045 |
|    10.5 |    10.9 | 0.963303 |
+---------+---------+----------+
show create table test_table;
Table	Create Table
test_table	CREATE TABLE `test_table` (
  `z0_col0` float DEFAULT NULL,
  `z0_col1` float DEFAULT NULL,
  `z0_col2` float GENERATED ALWAYS AS ((`z0_col0` / `z0_col1`)) STORED
) ORGANIZATION INDEX DEFAULT CHARSET = utf8mb4 ROW_FORMAT = DYNAMIC COMPRESSION = 'zstd_1.3.8' REPLICA_NUM = 1 BLOCK_SIZE = 16384 USE_BLOOM_FILTER = FALSE ENABLE_MACRO_BLOCK_BLOOM_FILTER = FALSE TABLET_SIZE = 134217728 PCTFREE = 0
# MODIFY 修改生成列 普通列-》虚拟生成列
drop table test_table;
create table test_table(
z0_col0 float, 
z0_col1 float,
z0_col2 float
);
insert into test_table (z0_col0,z0_col1) values (0,0),(NULL,NULL),(1.111,22.2),(10.5,10.9),(-100.5,20.9);
select z0_col0,z0_col1,z0_col2 from test_table order by z0_col2;
+---------+---------+---------+
| z0_col0 | z0_col1 | z0_col2 |
+---------+---------+---------+
|       0 |       0 |    NULL |
|    NULL |    NULL |    NULL |
|   1.111 |    22.2 |    NULL |
|    10.5 |    10.9 |    NULL |
|  -100.5 |    20.9 |    NULL |
+---------+---------+---------+
alter table test_table modify z0_col2 float as(z0_col0/z0_col1) virtual;
Got one of the listed errors
select z0_col0,z0_col1,z0_col2 from test_table order by z0_col2;
+---------+---------+---------+
| z0_col0 | z0_col1 | z0_col2 |
+---------+---------+---------+
|       0 |       0 |    NULL |
|    NULL |    NULL |    NULL |
|   1.111 |    22.2 |    NULL |
|    10.5 |    10.9 |    NULL |
|  -100.5 |    20.9 |    NULL |
+---------+---------+---------+
show create table test_table;
Table	Create Table
test_table	CREATE TABLE `test_table` (
  `z0_col0` float DEFAULT NULL,
  `z0_col1` float DEFAULT NULL,
  `z0_col2` float DEFAULT NULL
) ORGANIZATION INDEX DEFAULT CHARSET = utf8mb4 ROW_FORMAT = DYNAMIC COMPRESSION = 'zstd_1.3.8' REPLICA_NUM = 1 BLOCK_SIZE = 16384 USE_BLOOM_FILTER = FALSE ENABLE_MACRO_BLOCK_BLOOM_FILTER = FALSE TABLET_SIZE = 134217728 PCTFREE = 0
# MODIFY 修改生成列 普通列-》存储生成列
# bug2:【Generated Columns】OB Mysql模式，将普通列更改为存储生成列,mysql成功，ob失败。
drop table test_table;
create table test_table(
z0_col0 float, 
z0_col1 float,
z0_col2 float
);
insert into test_table (z0_col0,z0_col1) values (0,0),(NULL,NULL),(1.111,22.2),(10.5,10.9),(-100.5,20.9);
select z0_col0,z0_col1,z0_col2 from test_table order by z0_col2;
+---------+---------+---------+
| z0_col0 | z0_col1 | z0_col2 |
+---------+---------+---------+
|       0 |       0 |    NULL |
|    NULL |    NULL |    NULL |
|   1.111 |    22.2 |    NULL |
|    10.5 |    10.9 |    NULL |
|  -100.5 |    20.9 |    NULL |
+---------+---------+---------+
alter table test_table modify z0_col2 float as(z0_col0/z0_col1) stored;
Got one of the listed errors
insert into test_table (z0_col0,z0_col1) values (10,40);
select z0_col0,z0_col1,z0_col2 from test_table order by z0_col2;
+---------+---------+---------+
| z0_col0 | z0_col1 | z0_col2 |
+---------+---------+---------+
|       0 |       0 |    NULL |
|    NULL |    NULL |    NULL |
|   1.111 |    22.2 |    NULL |
|    10.5 |    10.9 |    NULL |
|  -100.5 |    20.9 |    NULL |
|      10 |      40 |    NULL |
+---------+---------+---------+
show create table test_table;
Table	Create Table
test_table	CREATE TABLE `test_table` (
  `z0_col0` float DEFAULT NULL,
  `z0_col1` float DEFAULT NULL,
  `z0_col2` float DEFAULT NULL
) ORGANIZATION INDEX DEFAULT CHARSET = utf8mb4 ROW_FORMAT = DYNAMIC COMPRESSION = 'zstd_1.3.8' REPLICA_NUM = 1 BLOCK_SIZE = 16384 USE_BLOOM_FILTER = FALSE ENABLE_MACRO_BLOCK_BLOOM_FILTER = FALSE TABLET_SIZE = 134217728 PCTFREE = 0
# MODIFY 修改生成列的数据类型
# bug3:【Generated Columns】OB Mysql模式，修改生成列的数据类型（modify/change）,mysql成功，ob失败。
drop table test_table1;
create table test_table1(
z0_col0 float,
z0_col1 float,
z0_col2 int as(floor(z0_col0)) virtual,
z0_col3 int as(ceiling(z0_col1)) stored
);
insert into test_table1 (z0_col0,z0_col1) values (1.2,1.8),(2.4,2.6),(3.5,3.3);
select * from test_table1 order by z0_col2;
+---------+---------+---------+---------+
| z0_col0 | z0_col1 | z0_col2 | z0_col3 |
+---------+---------+---------+---------+
|     1.2 |     1.8 |       1 |       2 |
|     2.4 |     2.6 |       2 |       3 |
|     3.5 |     3.3 |       3 |       4 |
+---------+---------+---------+---------+
alter table test_table1 modify z0_col2 double as(floor(z0_col0)) virtual;
alter table test_table1 modify z0_col3 double as(ceiling(z0_col0)) stored;
Got one of the listed errors
insert into test_table1 (z0_col0,z0_col1) values (5.123,5.678);
select * from test_table1 order by z0_col2;
+---------+---------+---------+---------+
| z0_col0 | z0_col1 | z0_col2 | z0_col3 |
+---------+---------+---------+---------+
|     1.2 |     1.8 |       1 |       2 |
|     2.4 |     2.6 |       2 |       3 |
|     3.5 |     3.3 |       3 |       4 |
|   5.123 |   5.678 |       5 |       6 |
+---------+---------+---------+---------+
# MODIFY 修改生成列引用的普通列
alter table test_table1 modify z0_col0 double;
alter table test_table1 modify z0_col1 double;
insert into test_table1 (z0_col0,z0_col1) values (4.123,4.678);
select * from test_table1 order by z0_col2;
+--------------------+--------------------+---------+---------+
| z0_col0            | z0_col1            | z0_col2 | z0_col3 |
+--------------------+--------------------+---------+---------+
| 1.2000000476837158 | 1.7999999523162842 |       1 |       2 |
| 2.4000000953674316 | 2.5999999046325684 |       2 |       3 |
|                3.5 |  3.299999952316284 |       3 |       4 |
|              4.123 |              4.678 |       4 |       5 |
|  5.123000144958496 |  5.677999973297119 |       5 |       6 |
+--------------------+--------------------+---------+---------+
# CHANGE 修改生成列
# bug3:【Generated Columns】OB Mysql模式，修改生成列的数据类型（modify/change）,mysql成功，ob失败。
drop table test_table1;
create table test_table1(
z0_col0 char(200),
z0_col1 char(200),
z0_col2 char(200) as(upper(z0_col0)) virtual,
z0_col3 char(200) as(concat(z0_col0,z0_col1)) stored
);
insert into test_table1 (z0_col0,z0_col1) values ('mysql 8.0 ',' one'),('oracle 11g ',' two'),('oceanbase 4.0 ',' three');
select * from test_table1 order by z0_col2;
+---------------+---------+---------------+---------------------+
| z0_col0       | z0_col1 | z0_col2       | z0_col3             |
+---------------+---------+---------------+---------------------+
| mysql 8.0     |  one    | MYSQL 8.0     | mysql 8.0 one       |
| oceanbase 4.0 |  three  | OCEANBASE 4.0 | oceanbase 4.0 three |
| oracle 11g    |  two    | ORACLE 11G    | oracle 11g two      |
+---------------+---------+---------------+---------------------+
alter table test_table1 change z0_col2 z0_col22 varchar(200) as(upper(z0_col0)) virtual;
alter table test_table1 change z0_col3 z0_col33 varchar(200) as(concat(z0_col0,z0_col1)) stored;
insert into test_table1 (z0_col0,z0_col1) values (5,5);
select * from test_table1 order by z0_col22;
+---------------+---------+---------------+---------------------+
| z0_col0       | z0_col1 | z0_col22      | z0_col33            |
+---------------+---------+---------------+---------------------+
| 5             | 5       | 5             | 55                  |
| mysql 8.0     |  one    | MYSQL 8.0     | mysql 8.0 one       |
| oceanbase 4.0 |  three  | OCEANBASE 4.0 | oceanbase 4.0 three |
| oracle 11g    |  two    | ORACLE 11G    | oracle 11g two      |
+---------------+---------+---------------+---------------------+
show create table test_table1;
Table	Create Table
test_table1	CREATE TABLE `test_table1` (
  `z0_col0` char(200) DEFAULT NULL,
  `z0_col1` char(200) DEFAULT NULL,
  `z0_col22` varchar(200) GENERATED ALWAYS AS (upper(`z0_col0`)) VIRTUAL,
  `z0_col33` varchar(200) GENERATED ALWAYS AS (concat(`z0_col0`,`z0_col1`)) STORED
) ORGANIZATION INDEX DEFAULT CHARSET = utf8mb4 ROW_FORMAT = DYNAMIC COMPRESSION = 'zstd_1.3.8' REPLICA_NUM = 1 BLOCK_SIZE = 16384 USE_BLOOM_FILTER = FALSE ENABLE_MACRO_BLOCK_BLOOM_FILTER = FALSE TABLET_SIZE = 134217728 PCTFREE = 0
# CHANGE 修改生成列引用的普通列
# bug4:【Generated Columns】OB Mysql模式，修改生成列引用的普通列（change）,mysql失败，ob成功。
drop table test_table1;
create table test_table1(
z0_col0 char(200),
z0_col1 char(200),
z0_col2 char(200) as(upper(z0_col0)) virtual,
z0_col3 char(200) as(concat(z0_col0,z0_col1)) stored
);
insert into test_table1 (z0_col0,z0_col1) values ('mysql 8.0 ',' one'),('oracle 11g ',' two'),('oceanbase 4.0 ',' three');
select * from test_table1 order by z0_col2;
+---------------+---------+---------------+---------------------+
| z0_col0       | z0_col1 | z0_col2       | z0_col3             |
+---------------+---------+---------------+---------------------+
| mysql 8.0     |  one    | MYSQL 8.0     | mysql 8.0 one       |
| oceanbase 4.0 |  three  | OCEANBASE 4.0 | oceanbase 4.0 three |
| oracle 11g    |  two    | ORACLE 11G    | oracle 11g two      |
+---------------+---------+---------------+---------------------+
alter table test_table1 change z0_col0 z0_col00 varchar(200);
alter table test_table1 change z0_col1 z0_col11 varchar(200);
insert into test_table1 (z0_col00,z0_col11) values ('pl/sql ',' add');
select * from test_table1 order by z0_col2;
+---------------+----------+---------------+---------------------+
| z0_col00      | z0_col11 | z0_col2       | z0_col3             |
+---------------+----------+---------------+---------------------+
| mysql 8.0     |  one     | MYSQL 8.0     | mysql 8.0 one       |
| oceanbase 4.0 |  three   | OCEANBASE 4.0 | oceanbase 4.0 three |
| oracle 11g    |  two     | ORACLE 11G    | oracle 11g two      |
| pl/sql        |  add     | PL/SQL        | pl/sql  add         |
+---------------+----------+---------------+---------------------+
show create table test_table1;
Table	Create Table
test_table1	CREATE TABLE `test_table1` (
  `z0_col00` varchar(200) DEFAULT NULL,
  `z0_col11` varchar(200) DEFAULT NULL,
  `z0_col2` char(200) GENERATED ALWAYS AS (upper(`z0_col00`)) VIRTUAL,
  `z0_col3` char(200) GENERATED ALWAYS AS (concat(`z0_col00`,`z0_col11`)) STORED
) ORGANIZATION INDEX DEFAULT CHARSET = utf8mb4 ROW_FORMAT = DYNAMIC COMPRESSION = 'zstd_1.3.8' REPLICA_NUM = 1 BLOCK_SIZE = 16384 USE_BLOOM_FILTER = FALSE ENABLE_MACRO_BLOCK_BLOOM_FILTER = FALSE TABLET_SIZE = 134217728 PCTFREE = 0
# DROP 删除生成列
drop table test_table1;
create table test_table1(
z0_col0 char(200),
z0_col1 char(200),
z0_col2 char(200) as(upper(z0_col0)) virtual,
z0_col3 char(200) as(concat(z0_col0,z0_col1)) stored
);
insert into test_table1 (z0_col0,z0_col1) values ('mysql 8.0 ',' one'),('oracle 11g ',' two'),('oceanbase 4.0 ',' three');
select * from test_table1 order by z0_col2;
+---------------+---------+---------------+---------------------+
| z0_col0       | z0_col1 | z0_col2       | z0_col3             |
+---------------+---------+---------------+---------------------+
| mysql 8.0     |  one    | MYSQL 8.0     | mysql 8.0 one       |
| oceanbase 4.0 |  three  | OCEANBASE 4.0 | oceanbase 4.0 three |
| oracle 11g    |  two    | ORACLE 11G    | oracle 11g two      |
+---------------+---------+---------------+---------------------+
alter table test_table1 drop z0_col2;
alter table test_table1 drop z0_col3;
insert into test_table1 (z0_col0,z0_col1) values ('pl/sql ',' add');
select * from test_table1 order by z0_col0;
+---------------+---------+
| z0_col0       | z0_col1 |
+---------------+---------+
| mysql 8.0     |  one    |
| oceanbase 4.0 |  three  |
| oracle 11g    |  two    |
| pl/sql        |  add    |
+---------------+---------+
show create table test_table1;
Table	Create Table
test_table1	CREATE TABLE `test_table1` (
  `z0_col0` char(200) DEFAULT NULL,
  `z0_col1` char(200) DEFAULT NULL
) ORGANIZATION INDEX DEFAULT CHARSET = utf8mb4 ROW_FORMAT = DYNAMIC COMPRESSION = 'zstd_1.3.8' REPLICA_NUM = 1 BLOCK_SIZE = 16384 USE_BLOOM_FILTER = FALSE ENABLE_MACRO_BLOCK_BLOOM_FILTER = FALSE TABLET_SIZE = 134217728 PCTFREE = 0
# DROP 删除生成列引用的普通列
drop table test_table1;
create table test_table1(
z0_col0 char(200),
z0_col1 char(200),
z0_col2 char(200) as(upper(z0_col0)) virtual,
z0_col3 char(200) as(concat(z0_col0,z0_col1)) stored
);
insert into test_table1 (z0_col0,z0_col1) values ('mysql 8.0 ',' one'),('oracle 11g ',' two'),('oceanbase 4.0 ',' three');
select * from test_table1 order by z0_col2;
+---------------+---------+---------------+---------------------+
| z0_col0       | z0_col1 | z0_col2       | z0_col3             |
+---------------+---------+---------------+---------------------+
| mysql 8.0     |  one    | MYSQL 8.0     | mysql 8.0 one       |
| oceanbase 4.0 |  three  | OCEANBASE 4.0 | oceanbase 4.0 three |
| oracle 11g    |  two    | ORACLE 11G    | oracle 11g two      |
+---------------+---------+---------------+---------------------+
alter table test_table1 drop z0_col0;
ERROR HY000: Column 'z0_col0' has a generated column dependency
alter table test_table1 drop z0_col1;
ERROR HY000: Column 'z0_col1' has a generated column dependency
insert into test_table1 (z0_col0,z0_col1) values ('pl/sql ',' add');
select * from test_table1 order by z0_col0;
+---------------+---------+---------------+---------------------+
| z0_col0       | z0_col1 | z0_col2       | z0_col3             |
+---------------+---------+---------------+---------------------+
| mysql 8.0     |  one    | MYSQL 8.0     | mysql 8.0 one       |
| oceanbase 4.0 |  three  | OCEANBASE 4.0 | oceanbase 4.0 three |
| oracle 11g    |  two    | ORACLE 11G    | oracle 11g two      |
| pl/sql        |  add    | PL/SQL        | pl/sql add          |
+---------------+---------+---------------+---------------------+
show create table test_table1;
Table	Create Table
test_table1	CREATE TABLE `test_table1` (
  `z0_col0` char(200) DEFAULT NULL,
  `z0_col1` char(200) DEFAULT NULL,
  `z0_col2` char(200) GENERATED ALWAYS AS (upper(`z0_col0`)) VIRTUAL,
  `z0_col3` char(200) GENERATED ALWAYS AS (concat(`z0_col0`,`z0_col1`)) STORED
) ORGANIZATION INDEX DEFAULT CHARSET = utf8mb4 ROW_FORMAT = DYNAMIC COMPRESSION = 'zstd_1.3.8' REPLICA_NUM = 1 BLOCK_SIZE = 16384 USE_BLOOM_FILTER = FALSE ENABLE_MACRO_BLOCK_BLOOM_FILTER = FALSE TABLET_SIZE = 134217728 PCTFREE = 0
############ mysql_genrate-1-4 DML
### SELECT 语句
# LIMIT 子句
drop table test_table;
create table test_table(
z0_col0 float, 
z0_col1 float,
z0_col2 float as(z0_col0+z0_col1) virtual,
z0_col3 float as(z0_col0*z0_col1) stored
);
insert into test_table (z0_col0,z0_col1) values (0,0),(NULL,NULL),(2,9),(10,15),(-100,20);
select z0_col0,z0_col1,z0_col2,z0_col3 from test_table order by z0_col2 limit z0_col2;
ERROR 42000: You have an error in your SQL syntax; check the manual that corresponds to your OceanBase version for the right syntax to use near 'z0_col2' at line 1
select z0_col0,z0_col1,z0_col2,z0_col3 from test_table order by z0_col2 limit z0_col3;
ERROR 42000: You have an error in your SQL syntax; check the manual that corresponds to your OceanBase version for the right syntax to use near 'z0_col3' at line 1
select z0_col0,z0_col1,z0_col2,z0_col3 from test_table order by z0_col2 limit 5;
+---------+---------+---------+---------+
| z0_col0 | z0_col1 | z0_col2 | z0_col3 |
+---------+---------+---------+---------+
|    NULL |    NULL |    NULL |    NULL |
|    -100 |      20 |     -80 |   -2000 |
|       0 |       0 |       0 |       0 |
|       2 |       9 |      11 |      18 |
|      10 |      15 |      25 |     150 |
+---------+---------+---------+---------+
select z0_col0,z0_col1,abs(z0_col2),z0_col3 from test_table order by z0_col2 limit 5;
+---------+---------+--------------+---------+
| z0_col0 | z0_col1 | abs(z0_col2) | z0_col3 |
+---------+---------+--------------+---------+
|    NULL |    NULL |         NULL |    NULL |
|    -100 |      20 |           80 |   -2000 |
|       0 |       0 |            0 |       0 |
|       2 |       9 |           11 |      18 |
|      10 |      15 |           25 |     150 |
+---------+---------+--------------+---------+
# SELECT ... INTO 语句
drop table test_table;
create table test_table(
z0_col0 float, 
z0_col1 float,
z0_col2 float as(z0_col0+z0_col1) virtual,
z0_col3 float as(z0_col0*z0_col1) stored
);
insert into test_table (z0_col0,z0_col1) values (0,0),(NULL,NULL),(2,9),(10,15),(-100,20);
select z0_col2,z0_col3 into @p1,@p2 from test_table where abs(z0_col2) > 50 and z0_col3 != 0 order by z0_col2;
select @p1,@p2;
+------+-------+
| @p1  | @p2   |
+------+-------+
|  -80 | -2000 |
+------+-------+
# select 生成列间运算 from table;
drop table test_table;
create table test_table(
z0_col0 float, 
z0_col1 float,
z0_col2 float as(z0_col0+z0_col1) virtual,
z0_col3 float as(z0_col0*z0_col1) stored
);
select avg(z0_col2),sum(z0_col3) from test_table;
+--------------+--------------+
| avg(z0_col2) | sum(z0_col3) |
+--------------+--------------+
|         NULL |         NULL |
+--------------+--------------+
insert into test_table (z0_col0,z0_col1) values (0,0),(NULL,NULL),(2,9),(10,15),(-100,20);
select z0_col0,z0_col1,z0_col2+2*9-1/2,z0_col3+2*9-1/2 from test_table order by z0_col2;
+---------+---------+-----------------+-----------------+
| z0_col0 | z0_col1 | z0_col2+2*9-1/2 | z0_col3+2*9-1/2 |
+---------+---------+-----------------+-----------------+
|    NULL |    NULL |            NULL |            NULL |
|    -100 |      20 |           -62.5 |         -1982.5 |
|       0 |       0 |            17.5 |            17.5 |
|       2 |       9 |            28.5 |            35.5 |
|      10 |      15 |            42.5 |           167.5 |
+---------+---------+-----------------+-----------------+
select z0_col0,z0_col1,z0_col2,z0_col3 from test_table order by z0_col2;
+---------+---------+---------+---------+
| z0_col0 | z0_col1 | z0_col2 | z0_col3 |
+---------+---------+---------+---------+
|    NULL |    NULL |    NULL |    NULL |
|    -100 |      20 |     -80 |   -2000 |
|       0 |       0 |       0 |       0 |
|       2 |       9 |      11 |      18 |
|      10 |      15 |      25 |     150 |
+---------+---------+---------+---------+
select z0_col0,z0_col1,z0_col2+z0_col3 from test_table order by z0_col2;
+---------+---------+-----------------+
| z0_col0 | z0_col1 | z0_col2+z0_col3 |
+---------+---------+-----------------+
|    NULL |    NULL |            NULL |
|    -100 |      20 |           -2080 |
|       0 |       0 |               0 |
|       2 |       9 |              29 |
|      10 |      15 |             175 |
+---------+---------+-----------------+
select z0_col0,z0_col1+z0_col2,z0_col3 from test_table order by z0_col2;
+---------+-----------------+---------+
| z0_col0 | z0_col1+z0_col2 | z0_col3 |
+---------+-----------------+---------+
|    NULL |            NULL |    NULL |
|    -100 |             -60 |   -2000 |
|       0 |               0 |       0 |
|       2 |              20 |      18 |
|      10 |              40 |     150 |
+---------+-----------------+---------+
select avg(z0_col2),sum(z0_col3) from test_table where z0_col2 > 0 order by z0_col2;
+--------------+--------------+
| avg(z0_col2) | sum(z0_col3) |
+--------------+--------------+
|           18 |          168 |
+--------------+--------------+
select z0_col2 > z0_col3 from test_table order by z0_col2;
+-------------------+
| z0_col2 > z0_col3 |
+-------------------+
|              NULL |
|                 1 |
|                 0 |
|                 0 |
|                 0 |
+-------------------+
select z0_col2 and z0_col3 from test_table order by z0_col2;
+---------------------+
| z0_col2 and z0_col3 |
+---------------------+
|                NULL |
|                   1 |
|                   0 |
|                   1 |
|                   1 |
+---------------------+
# 子查询 作为标量操作数的子查询
drop table test_table1;
create table test_table1(
z0_col0 double, 
z0_col1 double,
z0_col2 double as(z0_col0+z0_col1) virtual,
z0_col3 double as(z0_col0*z0_col1) stored
);
select (select z0_col2 from test_table1);
+-----------------------------------+
| (select z0_col2 from test_table1) |
+-----------------------------------+
|                              NULL |
+-----------------------------------+
insert into test_table1 (z0_col0,z0_col1) values (0,0),(NULL,NULL),(2.5,9.9),(-10,15),(1.0E+10,2.0E+10);
select z0_col0,z0_col1,z0_col2,z0_col3 from test_table1 order by z0_col2;
+-------------+-------------+-------------+---------+
| z0_col0     | z0_col1     | z0_col2     | z0_col3 |
+-------------+-------------+-------------+---------+
|        NULL |        NULL |        NULL |    NULL |
|           0 |           0 |           0 |       0 |
|         -10 |          15 |           5 |    -150 |
|         2.5 |         9.9 |        12.4 |   24.75 |
| 10000000000 | 20000000000 | 30000000000 |    2e20 |
+-------------+-------------+-------------+---------+
drop table test_table2;
create table test_table2(
z0_col0 char(200), 
z0_col1 char(200), 
z0_col2 char(200) as(concat(z0_col0,z0_col1)) virtual,
z0_col3 char(200) as(upper(concat(z0_col0,z0_col1))) stored
);
select (select z0_col2 from test_table2);
+-----------------------------------+
| (select z0_col2 from test_table2) |
+-----------------------------------+
| NULL                              |
+-----------------------------------+
insert into test_table2 (z0_col0,z0_col1) values (0,0),(NULL,NULL),(2022,0621),('2022-06-21 ',' 14:30:00'),('welloe come to ',' beijing');
select z0_col0,z0_col1,z0_col2,z0_col3 from test_table2 order by z0_col2;
+----------------+-----------+------------------------+------------------------+
| z0_col0        | z0_col1   | z0_col2                | z0_col3                |
+----------------+-----------+------------------------+------------------------+
| NULL           | NULL      | NULL                   | NULL                   |
| 0              | 0         | 00                     | 00                     |
| 2022-06-21     |  14:30:00 | 2022-06-21 14:30:00    | 2022-06-21 14:30:00    |
| 2022           | 621       | 2022621                | 2022621                |
| welloe come to |  beijing  | welloe come to beijing | WELLOE COME TO BEIJING |
+----------------+-----------+------------------------+------------------------+
select (select z0_col2 from test_table1 where z0_col2 > 20 order by 1);
+-----------------------------------------------------------------+
| (select z0_col2 from test_table1 where z0_col2 > 20 order by 1) |
+-----------------------------------------------------------------+
|                                                     30000000000 |
+-----------------------------------------------------------------+
select (select z0_col3 from test_table1 where z0_col3 between 20 and 30 order by 1);
+------------------------------------------------------------------------------+
| (select z0_col3 from test_table1 where z0_col3 between 20 and 30 order by 1) |
+------------------------------------------------------------------------------+
|                                                                        24.75 |
+------------------------------------------------------------------------------+
select (select z0_col2 from test_table2 where z0_col2 like '%to%' order by 1);
+------------------------------------------------------------------------+
| (select z0_col2 from test_table2 where z0_col2 like '%to%' order by 1) |
+------------------------------------------------------------------------+
| welloe come to beijing                                                 |
+------------------------------------------------------------------------+
select (select z0_col3 from test_table2 where z0_col3 like '%TO%' order by 1);
+------------------------------------------------------------------------+
| (select z0_col3 from test_table2 where z0_col3 like '%TO%' order by 1) |
+------------------------------------------------------------------------+
| WELLOE COME TO BEIJING                                                 |
+------------------------------------------------------------------------+
select (select z0_col2 from test_table1 where z0_col2 > 20) from test_table2 order by z0_col2;
+------------------------------------------------------+
| (select z0_col2 from test_table1 where z0_col2 > 20) |
+------------------------------------------------------+
|                                          30000000000 |
|                                          30000000000 |
|                                          30000000000 |
|                                          30000000000 |
|                                          30000000000 |
+------------------------------------------------------+
select lower((select z0_col3 from test_table2 where z0_col3 like '%TO%')) from test_table1 order by z0_col2;
+--------------------------------------------------------------------+
| lower((select z0_col3 from test_table2 where z0_col3 like '%TO%')) |
+--------------------------------------------------------------------+
| welloe come to beijing                                             |
| welloe come to beijing                                             |
| welloe come to beijing                                             |
| welloe come to beijing                                             |
| welloe come to beijing                                             |
+--------------------------------------------------------------------+
# 子查询 使用子查询进行比较
drop table test_table1;
create table test_table1(
z0_col0 int, 
z0_col1 int,
z0_col2 int as(z0_col0+z0_col1) virtual,
z0_col3 int as(z0_col0-z0_col1) stored
);
insert into test_table1 (z0_col0,z0_col1) values (0,0),(NULL,NULL),(1,1),(1,2),(42.5,9.9),(-10,15),(2.0E+2,1.0E+2);
select z0_col0,z0_col1,z0_col2,z0_col3 from test_table1 order by z0_col2;
+---------+---------+---------+---------+
| z0_col0 | z0_col1 | z0_col2 | z0_col3 |
+---------+---------+---------+---------+
|    NULL |    NULL |    NULL |    NULL |
|       0 |       0 |       0 |       0 |
|       1 |       1 |       2 |       0 |
|       1 |       2 |       3 |      -1 |
|     -10 |      15 |       5 |     -25 |
|      43 |      10 |      53 |      33 |
|     200 |     100 |     300 |     100 |
+---------+---------+---------+---------+
drop table test_table2;
create table test_table2(
z0_col0 int, 
z0_col1 int,
z0_col2 int as(z0_col0*z0_col1) virtual,
z0_col3 int as(z0_col0/z0_col1) stored
);
insert into test_table2 (z0_col0,z0_col1) values (0,0),(0,0),(1,1),(NULL,NULL),(29.5,9.9),(-10,15),(2.0E+2,1.0E+2);
select z0_col0,z0_col1,z0_col2,z0_col3 from test_table2 order by z0_col2;
+---------+---------+---------+---------+
| z0_col0 | z0_col1 | z0_col2 | z0_col3 |
+---------+---------+---------+---------+
|    NULL |    NULL |    NULL |    NULL |
|     -10 |      15 |    -150 |      -1 |
|       0 |       0 |       0 |    NULL |
|       0 |       0 |       0 |    NULL |
|       1 |       1 |       1 |       1 |
|      30 |      10 |     300 |       3 |
|     200 |     100 |   20000 |       2 |
+---------+---------+---------+---------+
select * from test_table1 where z0_col2 < (select max(z0_col2) from test_table2 where z0_col3 > 2) order by 1;
+---------+---------+---------+---------+
| z0_col0 | z0_col1 | z0_col2 | z0_col3 |
+---------+---------+---------+---------+
|     -10 |      15 |       5 |     -25 |
|       0 |       0 |       0 |       0 |
|       1 |       1 |       2 |       0 |
|       1 |       2 |       3 |      -1 |
|      43 |      10 |      53 |      33 |
+---------+---------+---------+---------+
select * from test_table1 where z0_col2 >= (select max(z0_col2) from test_table2 where z0_col3 > 2) order by 1;
+---------+---------+---------+---------+
| z0_col0 | z0_col1 | z0_col2 | z0_col3 |
+---------+---------+---------+---------+
|     200 |     100 |     300 |     100 |
+---------+---------+---------+---------+
select * from test_table2 where z0_col1 = (select max(z0_col3) from test_table1) order by 1;
+---------+---------+---------+---------+
| z0_col0 | z0_col1 | z0_col2 | z0_col3 |
+---------+---------+---------+---------+
|     200 |     100 |   20000 |       2 |
+---------+---------+---------+---------+
select * from test_table2 where z0_col1 != (select min(z0_col3) from test_table1) order by 1;
+---------+---------+---------+---------+
| z0_col0 | z0_col1 | z0_col2 | z0_col3 |
+---------+---------+---------+---------+
|     -10 |      15 |    -150 |      -1 |
|       0 |       0 |       0 |    NULL |
|       0 |       0 |       0 |    NULL |
|       1 |       1 |       1 |       1 |
|      30 |      10 |     300 |       3 |
|     200 |     100 |   20000 |       2 |
+---------+---------+---------+---------+
select * from test_table1 where 2 = (select count(*) from test_table2 where test_table2.z0_col0 = test_table1.z0_col0) order by 1;
+---------+---------+---------+---------+
| z0_col0 | z0_col1 | z0_col2 | z0_col3 |
+---------+---------+---------+---------+
|       0 |       0 |       0 |       0 |
+---------+---------+---------+---------+
# 带有 ANY、IN 或 SOME 的子查询
select * from test_table1 where z0_col2 > any (select z0_col3 from test_table2 where z0_col2 > 0) order by 1;
+---------+---------+---------+---------+
| z0_col0 | z0_col1 | z0_col2 | z0_col3 |
+---------+---------+---------+---------+
|     -10 |      15 |       5 |     -25 |
|       1 |       1 |       2 |       0 |
|       1 |       2 |       3 |      -1 |
|      43 |      10 |      53 |      33 |
|     200 |     100 |     300 |     100 |
+---------+---------+---------+---------+
select * from test_table1 where z0_col2 = any (select z0_col3 from test_table2 where z0_col2 > 0) order by 1;
+---------+---------+---------+---------+
| z0_col0 | z0_col1 | z0_col2 | z0_col3 |
+---------+---------+---------+---------+
|       1 |       1 |       2 |       0 |
|       1 |       2 |       3 |      -1 |
+---------+---------+---------+---------+
select * from test_table1 where z0_col2 < any (select z0_col3 from test_table2 where z0_col2 > 0) order by 1;
+---------+---------+---------+---------+
| z0_col0 | z0_col1 | z0_col2 | z0_col3 |
+---------+---------+---------+---------+
|       0 |       0 |       0 |       0 |
|       1 |       1 |       2 |       0 |
+---------+---------+---------+---------+
select * from test_table1 where z0_col2 != any (select z0_col3 from test_table2 where z0_col2 > 0) order by 1;
+---------+---------+---------+---------+
| z0_col0 | z0_col1 | z0_col2 | z0_col3 |
+---------+---------+---------+---------+
|     -10 |      15 |       5 |     -25 |
|       0 |       0 |       0 |       0 |
|       1 |       1 |       2 |       0 |
|       1 |       2 |       3 |      -1 |
|      43 |      10 |      53 |      33 |
|     200 |     100 |     300 |     100 |
+---------+---------+---------+---------+
select * from test_table1 where z0_col2 <> any (select z0_col3 from test_table2 where z0_col2 > 0) order by 1;
+---------+---------+---------+---------+
| z0_col0 | z0_col1 | z0_col2 | z0_col3 |
+---------+---------+---------+---------+
|     -10 |      15 |       5 |     -25 |
|       0 |       0 |       0 |       0 |
|       1 |       1 |       2 |       0 |
|       1 |       2 |       3 |      -1 |
|      43 |      10 |      53 |      33 |
|     200 |     100 |     300 |     100 |
+---------+---------+---------+---------+
select max(z0_col2) from test_table1 where z0_col2 in (select z0_col3 from test_table2 where z0_col2 > 0) order by 1;
+--------------+
| max(z0_col2) |
+--------------+
|            3 |
+--------------+
select * from test_table1 where z0_col3 >= some (select z0_col3 from test_table2 where z0_col3 > 0) order by 1;
+---------+---------+---------+---------+
| z0_col0 | z0_col1 | z0_col2 | z0_col3 |
+---------+---------+---------+---------+
|      43 |      10 |      53 |      33 |
|     200 |     100 |     300 |     100 |
+---------+---------+---------+---------+
select * from test_table1 where z0_col3 = some (select z0_col3 from test_table2 where z0_col3 > 0) order by 1;
+---------+---------+---------+---------+
| z0_col0 | z0_col1 | z0_col2 | z0_col3 |
+---------+---------+---------+---------+
+---------+---------+---------+---------+
select * from test_table1 where z0_col3 <= some (select z0_col3 from test_table2 where z0_col3 > 0) order by 1;
+---------+---------+---------+---------+
| z0_col0 | z0_col1 | z0_col2 | z0_col3 |
+---------+---------+---------+---------+
|     -10 |      15 |       5 |     -25 |
|       0 |       0 |       0 |       0 |
|       1 |       1 |       2 |       0 |
|       1 |       2 |       3 |      -1 |
+---------+---------+---------+---------+
select * from test_table1 where z0_col3 != some (select z0_col3 from test_table2 where z0_col3 > 0) order by 1;
+---------+---------+---------+---------+
| z0_col0 | z0_col1 | z0_col2 | z0_col3 |
+---------+---------+---------+---------+
|     -10 |      15 |       5 |     -25 |
|       0 |       0 |       0 |       0 |
|       1 |       1 |       2 |       0 |
|       1 |       2 |       3 |      -1 |
|      43 |      10 |      53 |      33 |
|     200 |     100 |     300 |     100 |
+---------+---------+---------+---------+
# ALL 子查询
select z0_col0,z0_col1,abs(z0_col2),abs(z0_col3) from test_table1 where z0_col2 >= all (select z0_col3 from test_table2 where z0_col2 <> 0);
+---------+---------+--------------+--------------+
| z0_col0 | z0_col1 | abs(z0_col2) | abs(z0_col3) |
+---------+---------+--------------+--------------+
|       1 |       2 |            3 |            1 |
|      43 |      10 |           53 |           33 |
|     -10 |      15 |            5 |           25 |
|     200 |     100 |          300 |          100 |
+---------+---------+--------------+--------------+
select z0_col0,z0_col1,max(z0_col2),max(z0_col3) from test_table1 where z0_col2 = all (select z0_col3 from test_table2 where z0_col2 <> 0);
+---------+---------+--------------+--------------+
| z0_col0 | z0_col1 | max(z0_col2) | max(z0_col3) |
+---------+---------+--------------+--------------+
|    NULL |    NULL |         NULL |         NULL |
+---------+---------+--------------+--------------+
select z0_col0,z0_col1,min(z0_col2),min(z0_col3) from test_table1 where z0_col2 <= all (select z0_col3 from test_table2 where z0_col2 <> 0);
+---------+---------+--------------+--------------+
| z0_col0 | z0_col1 | min(z0_col2) | min(z0_col3) |
+---------+---------+--------------+--------------+
|    NULL |    NULL |         NULL |         NULL |
+---------+---------+--------------+--------------+
select z0_col0,z0_col1,avg(z0_col2),avg(z0_col3) from test_table1 where z0_col2 <> all (select z0_col3 from test_table2 where z0_col2 <> 0);
+---------+---------+--------------+--------------+
| z0_col0 | z0_col1 | avg(z0_col2) | avg(z0_col3) |
+---------+---------+--------------+--------------+
|       0 |       0 |      89.5000 |      27.0000 |
+---------+---------+--------------+--------------+
# 行子查询
select * from test_table1 where (z0_col2,z0_col3) = (select z0_col2, z0_col3 from test_table2 where z0_col2 is null) order by 1;
+---------+---------+---------+---------+
| z0_col0 | z0_col1 | z0_col2 | z0_col3 |
+---------+---------+---------+---------+
+---------+---------+---------+---------+
select * from test_table2 where row(z0_col2,z0_col3) = (select z0_col0, z0_col1 from test_table1 where z0_col2 = 2) order by 1;
+---------+---------+---------+---------+
| z0_col0 | z0_col1 | z0_col2 | z0_col3 |
+---------+---------+---------+---------+
|       1 |       1 |       1 |       1 |
+---------+---------+---------+---------+
# 具有 EXISTS 或 NOT EXISTS 的子查询
select z0_col2,z0_col3 from test_table1 where exists (select * from test_table2 where z0_col3 is not null) order by 1;
+---------+---------+
| z0_col2 | z0_col3 |
+---------+---------+
|    NULL |    NULL |
|       0 |       0 |
|       2 |       0 |
|       3 |      -1 |
|       5 |     -25 |
|      53 |      33 |
|     300 |     100 |
+---------+---------+
select z0_col2,z0_col3 from test_table1 where not exists (select * from test_table2 where z0_col3 > 10) order by 1;
+---------+---------+
| z0_col2 | z0_col3 |
+---------+---------+
|    NULL |    NULL |
|       0 |       0 |
|       2 |       0 |
|       3 |      -1 |
|       5 |     -25 |
|      53 |      33 |
|     300 |     100 |
+---------+---------+
select count(z0_col2),max(z0_col3) from test_table1 where exists (select * from test_table2 where z0_col3 is not null) order by 1;
+----------------+--------------+
| count(z0_col2) | max(z0_col3) |
+----------------+--------------+
|              6 |          100 |
+----------------+--------------+
select distinct z0_col2,z0_col3 from test_table1 where not exists (select * from test_table2 where z0_col3 > 10) order by 1;
+---------+---------+
| z0_col2 | z0_col3 |
+---------+---------+
|    NULL |    NULL |
|       0 |       0 |
|       2 |       0 |
|       3 |      -1 |
|       5 |     -25 |
|      53 |      33 |
|     300 |     100 |
+---------+---------+
# 相关子查询
select * from test_table1 t1 where z0_col2 = any (select z0_col2 from test_table2 t2 where t2.z0_col0 = t1.z0_col0 ) order by 1;
+---------+---------+---------+---------+
| z0_col0 | z0_col1 | z0_col2 | z0_col3 |
+---------+---------+---------+---------+
|       0 |       0 |       0 |       0 |
+---------+---------+---------+---------+
select * from test_table1 t1 where (select z0_col2 from test_table2 t2 where t2.z0_col1 = t1.z0_col1 and t2.z0_col3 = 3 ) > 0 order by 1;
+---------+---------+---------+---------+
| z0_col0 | z0_col1 | z0_col2 | z0_col3 |
+---------+---------+---------+---------+
|      43 |      10 |      53 |      33 |
+---------+---------+---------+---------+
# 派生表
select avg(sum_column1) from (select sum(z0_col2) as sum_column1 from test_table1 group by z0_col3) as t1;
+------------------+
| avg(sum_column1) |
+------------------+
|          72.6000 |
+------------------+
select avg(sum_column1) from (select sum(z0_col3) as sum_column1 from test_table2 group by z0_col2) as t1;
+------------------+
| avg(sum_column1) |
+------------------+
|           1.2500 |
+------------------+
###  INSERT 语句
drop table test_table1;
create table test_table1(
z0_col0 int primary key,
z0_col1 int,
z0_col2 int as(z0_col0+z0_col1) virtual,
z0_col3 int as(mod(z0_col0,z0_col1)) stored,
txt char(200) default 'test_table1'
);
insert into test_table1 (z0_col0,z0_col1) values (0,0),(1,NULL),(2,1),(3,5),(4,9.9),(5,2),(2.0E+2,1.0E+2);
select z0_col0,z0_col1,z0_col2 col_add,z0_col3 col_mod,txt from test_table1 order by z0_col2;
+---------+---------+---------+---------+-------------+
| z0_col0 | z0_col1 | col_add | col_mod | txt         |
+---------+---------+---------+---------+-------------+
|       1 |    NULL |    NULL |    NULL | test_table1 |
|       0 |       0 |       0 |    NULL | test_table1 |
|       2 |       1 |       3 |       0 | test_table1 |
|       5 |       2 |       7 |       1 | test_table1 |
|       3 |       5 |       8 |       3 | test_table1 |
|       4 |      10 |      14 |       4 | test_table1 |
|     200 |     100 |     300 |       0 | test_table1 |
+---------+---------+---------+---------+-------------+
insert into test_table1 (z0_col0,z0_col1) values (5,5) on duplicate key update z0_col0=z0_col0+3,z0_col2=1;
ERROR HY000: The value specified for generated column 'z0_col2' in table 'test_table1' is not allowed
insert into test_table1 (z0_col0,z0_col1) values (5,5) on duplicate key update z0_col0=z0_col0+3,txt = 'on duplicate key update';
select z0_col0,z0_col1,z0_col2 col_add,z0_col3 col_mod,txt from test_table1 order by z0_col2;
+---------+---------+---------+---------+-------------------------+
| z0_col0 | z0_col1 | col_add | col_mod | txt                     |
+---------+---------+---------+---------+-------------------------+
|       1 |    NULL |    NULL |    NULL | test_table1             |
|       0 |       0 |       0 |    NULL | test_table1             |
|       2 |       1 |       3 |       0 | test_table1             |
|       3 |       5 |       8 |       3 | test_table1             |
|       8 |       2 |      10 |       0 | on duplicate key update |
|       4 |      10 |      14 |       4 | test_table1             |
|     200 |     100 |     300 |       0 | test_table1             |
+---------+---------+---------+---------+-------------------------+
###  UPDATE  语句
update test_table1 set z0_col1 = 10, txt = '1 update z0_col1' where z0_col2 > 100;
select z0_col0,z0_col1,z0_col2 col_add,z0_col3 col_mod,txt from test_table1 order by z0_col2;
+---------+---------+---------+---------+-------------------------+
| z0_col0 | z0_col1 | col_add | col_mod | txt                     |
+---------+---------+---------+---------+-------------------------+
|       1 |    NULL |    NULL |    NULL | test_table1             |
|       0 |       0 |       0 |    NULL | test_table1             |
|       2 |       1 |       3 |       0 | test_table1             |
|       3 |       5 |       8 |       3 | test_table1             |
|       8 |       2 |      10 |       0 | on duplicate key update |
|       4 |      10 |      14 |       4 | test_table1             |
|     200 |      10 |     210 |       0 | 1 update z0_col1        |
+---------+---------+---------+---------+-------------------------+
update test_table1 set z0_col0 = 41, txt = '2 update z0_col0' where z0_col3 = 4 order by z0_col3 limit 1;
select z0_col0,z0_col1,z0_col2 col_add,z0_col3 col_mod,txt from test_table1 order by z0_col2;
+---------+---------+---------+---------+-------------------------+
| z0_col0 | z0_col1 | col_add | col_mod | txt                     |
+---------+---------+---------+---------+-------------------------+
|       1 |    NULL |    NULL |    NULL | test_table1             |
|       0 |       0 |       0 |    NULL | test_table1             |
|       2 |       1 |       3 |       0 | test_table1             |
|       3 |       5 |       8 |       3 | test_table1             |
|       8 |       2 |      10 |       0 | on duplicate key update |
|      41 |      10 |      51 |       1 | 2 update z0_col0        |
|     200 |      10 |     210 |       0 | 1 update z0_col1        |
+---------+---------+---------+---------+-------------------------+
update test_table1 set z0_col0 = 4, txt = '3 update z0_col0' where abs(z0_col2) = 3 order by z0_col3 limit 1;
select z0_col0,z0_col1,z0_col2 col_add,z0_col3 col_mod,txt from test_table1 order by z0_col2;
+---------+---------+---------+---------+-------------------------+
| z0_col0 | z0_col1 | col_add | col_mod | txt                     |
+---------+---------+---------+---------+-------------------------+
|       1 |    NULL |    NULL |    NULL | test_table1             |
|       0 |       0 |       0 |    NULL | test_table1             |
|       4 |       1 |       5 |       0 | 3 update z0_col0        |
|       3 |       5 |       8 |       3 | test_table1             |
|       8 |       2 |      10 |       0 | on duplicate key update |
|      41 |      10 |      51 |       1 | 2 update z0_col0        |
|     200 |      10 |     210 |       0 | 1 update z0_col1        |
+---------+---------+---------+---------+-------------------------+
update test_table1 set z0_col1 = 200 where z0_col2 > 10 order by z0_col3 limit z0_col3;
ERROR 42000: You have an error in your SQL syntax; check the manual that corresponds to your OceanBase version for the right syntax to use near 'z0_col3' at line 1
select z0_col0,z0_col1,z0_col2 col_add,z0_col3 col_mod,txt from test_table1 order by z0_col2;
+---------+---------+---------+---------+-------------------------+
| z0_col0 | z0_col1 | col_add | col_mod | txt                     |
+---------+---------+---------+---------+-------------------------+
|       1 |    NULL |    NULL |    NULL | test_table1             |
|       0 |       0 |       0 |    NULL | test_table1             |
|       4 |       1 |       5 |       0 | 3 update z0_col0        |
|       3 |       5 |       8 |       3 | test_table1             |
|       8 |       2 |      10 |       0 | on duplicate key update |
|      41 |      10 |      51 |       1 | 2 update z0_col0        |
|     200 |      10 |     210 |       0 | 1 update z0_col1        |
+---------+---------+---------+---------+-------------------------+
update test_table1 set z0_col2 = 20 where z0_col3 = 4 order by z0_col3 limit 1;
ERROR HY000: The value specified for generated column 'z0_col2' in table 'test_table1' is not allowed
select z0_col0,z0_col1,z0_col2 col_add,z0_col3 col_mod,txt from test_table1 order by z0_col2;
+---------+---------+---------+---------+-------------------------+
| z0_col0 | z0_col1 | col_add | col_mod | txt                     |
+---------+---------+---------+---------+-------------------------+
|       1 |    NULL |    NULL |    NULL | test_table1             |
|       0 |       0 |       0 |    NULL | test_table1             |
|       4 |       1 |       5 |       0 | 3 update z0_col0        |
|       3 |       5 |       8 |       3 | test_table1             |
|       8 |       2 |      10 |       0 | on duplicate key update |
|      41 |      10 |      51 |       1 | 2 update z0_col0        |
|     200 |      10 |     210 |       0 | 1 update z0_col1        |
+---------+---------+---------+---------+-------------------------+
###  REPLACE  语句
select z0_col0,z0_col1,z0_col2 col_add,z0_col3 col_mod,txt from test_table1 order by z0_col2;
+---------+---------+---------+---------+-------------------------+
| z0_col0 | z0_col1 | col_add | col_mod | txt                     |
+---------+---------+---------+---------+-------------------------+
|       1 |    NULL |    NULL |    NULL | test_table1             |
|       0 |       0 |       0 |    NULL | test_table1             |
|       4 |       1 |       5 |       0 | 3 update z0_col0        |
|       3 |       5 |       8 |       3 | test_table1             |
|       8 |       2 |      10 |       0 | on duplicate key update |
|      41 |      10 |      51 |       1 | 2 update z0_col0        |
|     200 |      10 |     210 |       0 | 1 update z0_col1        |
+---------+---------+---------+---------+-------------------------+
replace into test_table1 (z0_col0,z0_col1,txt) values (200,21,'1 replace test_table1');
select z0_col0,z0_col1,z0_col2 col_add,z0_col3 col_mod,txt from test_table1 order by z0_col2;
+---------+---------+---------+---------+-------------------------+
| z0_col0 | z0_col1 | col_add | col_mod | txt                     |
+---------+---------+---------+---------+-------------------------+
|       1 |    NULL |    NULL |    NULL | test_table1             |
|       0 |       0 |       0 |    NULL | test_table1             |
|       4 |       1 |       5 |       0 | 3 update z0_col0        |
|       3 |       5 |       8 |       3 | test_table1             |
|       8 |       2 |      10 |       0 | on duplicate key update |
|      41 |      10 |      51 |       1 | 2 update z0_col0        |
|     200 |      21 |     221 |      11 | 1 replace test_table1   |
+---------+---------+---------+---------+-------------------------+
replace into test_table1 values (3,20,30,10,'2 replace test_table1');
ERROR HY000: The value specified for generated column 'z0_col2' in table 'test_table1' is not allowed
###  TRUNCATE TABLE语句
drop table test_table1;
create table test_table1(
z0_col0 int primary key,
z0_col1 int,
z0_col2 int as(z0_col0+z0_col1) virtual,
z0_col3 int as(z0_col0*z0_col1) stored,
txt char(200) default 'test_table1'
);
insert into test_table1 (z0_col0,z0_col1) values (0,0),(1,NULL),(2,1),(3,5);
select z0_col0,z0_col1,z0_col2 col_vir,z0_col3 col_sto,txt from test_table1 order by z0_col2;
+---------+---------+---------+---------+-------------+
| z0_col0 | z0_col1 | col_vir | col_sto | txt         |
+---------+---------+---------+---------+-------------+
|       1 |    NULL |    NULL |    NULL | test_table1 |
|       0 |       0 |       0 |       0 | test_table1 |
|       2 |       1 |       3 |       2 | test_table1 |
|       3 |       5 |       8 |      15 | test_table1 |
+---------+---------+---------+---------+-------------+
truncate table test_table1;
insert into test_table1 (z0_col0,z0_col1) values (10,10),(20,10),(30,50);
select z0_col0,z0_col1,z0_col2 col_add,z0_col3 col_mod,txt from test_table1 order by z0_col2;
+---------+---------+---------+---------+-------------+
| z0_col0 | z0_col1 | col_add | col_mod | txt         |
+---------+---------+---------+---------+-------------+
|      10 |      10 |      20 |     100 | test_table1 |
|      20 |      10 |      30 |     200 | test_table1 |
|      30 |      50 |      80 |    1500 | test_table1 |
+---------+---------+---------+---------+-------------+
desc test_table1;
+---------+-----------+------+-----+-------------------------+-------------------+
| Field   | Type      | Null | Key | Default                 | Extra             |
+---------+-----------+------+-----+-------------------------+-------------------+
| z0_col0 | int(11)   | NO   | PRI | NULL                    |                   |
| z0_col1 | int(11)   | YES  |     | NULL                    |                   |
| z0_col2 | int(11)   | YES  |     | (`z0_col0` + `z0_col1`) | VIRTUAL GENERATED |
| z0_col3 | int(11)   | YES  |     | (`z0_col0` * `z0_col1`) | STORED GENERATED  |
| txt     | char(200) | YES  |     | test_table1             |                   |
+---------+-----------+------+-----+-------------------------+-------------------+
############ mysql_genrate-1-5 PL/SQL
### 函数
drop table test_table1;
create table test_table1(
z0_col0 int primary key,
z0_col1 int,
z0_col2 int as(z0_col0+z0_col1) virtual,
z0_col3 int as(z0_col0*z0_col1) stored
);
insert into test_table1 (z0_col0,z0_col1) values (0,0),(1,1),(2,2),(3,3);
select z0_col0,z0_col1,z0_col2 col_vir,z0_col3 col_sto from test_table1 order by z0_col2;
+---------+---------+---------+---------+
| z0_col0 | z0_col1 | col_vir | col_sto |
+---------+---------+---------+---------+
|       0 |       0 |       0 |       0 |
|       1 |       1 |       2 |       1 |
|       2 |       2 |       4 |       4 |
|       3 |       3 |       6 |       9 |
+---------+---------+---------+---------+
drop table test_table2;
create table test_table2(
z0_col0 int primary key,
z0_col1 int,
z0_col2 int as(z0_col0+z0_col1) virtual,
z0_col3 int as(z0_col0*z0_col1) stored
);
insert into test_table2 (z0_col0,z0_col1) values (10,0),(11,1),(12,2),(13,3);
select z0_col0,z0_col1,z0_col2 col_vir,z0_col3 col_sto from test_table2 order by z0_col2;
+---------+---------+---------+---------+
| z0_col0 | z0_col1 | col_vir | col_sto |
+---------+---------+---------+---------+
|      10 |       0 |      10 |       0 |
|      11 |       1 |      12 |      11 |
|      12 |       2 |      14 |      24 |
|      13 |       3 |      16 |      39 |
+---------+---------+---------+---------+
# 生成列作为函数参数
drop function fun1;//
create function fun1(num2 int,num3 int) returns varchar(100)
begin  
  insert into test_table1 (z0_col0,z0_col1) values (num2,num3); 
  delete from test_table1 where z0_col2 = 0; 
  update test_table1 set z0_col0 = 9 where z0_col2 = 2;
  return 'fun1 ok';
end;
//
select fun1(z0_col2,z0_col3) from test_table2 where z0_col2 < 14 order by z0_col2;//
+-----------------------+
| fun1(z0_col2,z0_col3) |
+-----------------------+
| fun1 ok               |
| fun1 ok               |
+-----------------------+
select z0_col0,z0_col1,z0_col2 col_vir,z0_col3 col_sto from test_table1 order by z0_col2;//
+---------+---------+---------+---------+
| z0_col0 | z0_col1 | col_vir | col_sto |
+---------+---------+---------+---------+
|       2 |       2 |       4 |       4 |
|       3 |       3 |       6 |       9 |
|       9 |       1 |      10 |       9 |
|      10 |       0 |      10 |       0 |
|      12 |      11 |      23 |     132 |
+---------+---------+---------+---------+
# 虚拟列表达式是自定义函数
drop function fun1;//
create function fun1() returns int
begin
  return 10;
end;
//
drop table test_table222;//
create table test_table222(
z0_col0 int primary key,
z0_col1 int,
z0_col2 int as(fun1()) virtual,
z0_col3 int as(fun1()) stored
);//
ERROR 42S22: Unknown column '' in 'generated column function'
### 存储过程
DROP PROCEDURE IF EXISTS pro1;//
CREATE PROCEDURE pro1(in num1 int,in num2 int)
BEGIN
  alter table test_table2 add z0_col4 varchar(100) as (concat(z0_col0,z0_col1)) virtual;
  alter table test_table2 add z0_col5 varchar(100) as (z0_col0) stored;
  insert into test_table2 (z0_col0,z0_col1) values (num1,num2),(num1+1,num2+1); 
  delete from test_table2 where z0_col2 = num1+num2; 
  update test_table2 set z0_col1 = 0 where z0_col3 = 36;
END;
//
call pro1(5,5);//
select * from test_table2 order by z0_col2;//
+---------+---------+---------+---------+---------+---------+
| z0_col0 | z0_col1 | z0_col2 | z0_col3 | z0_col4 | z0_col5 |
+---------+---------+---------+---------+---------+---------+
|       6 |       0 |       6 |       0 | 60      | 6       |
|      11 |       1 |      12 |      11 | 111     | 11      |
|      12 |       2 |      14 |      24 | 122     | 12      |
|      13 |       3 |      16 |      39 | 133     | 13      |
+---------+---------+---------+---------+---------+---------+
desc test_table2;//
+---------+--------------+------+-----+-----------------------------+-------------------+
| Field   | Type         | Null | Key | Default                     | Extra             |
+---------+--------------+------+-----+-----------------------------+-------------------+
| z0_col0 | int(11)      | NO   | PRI | NULL                        |                   |
| z0_col1 | int(11)      | YES  |     | NULL                        |                   |
| z0_col2 | int(11)      | YES  |     | (`z0_col0` + `z0_col1`)     | VIRTUAL GENERATED |
| z0_col3 | int(11)      | YES  |     | (`z0_col0` * `z0_col1`)     | STORED GENERATED  |
| z0_col4 | varchar(100) | YES  |     | concat(`z0_col0`,`z0_col1`) | VIRTUAL GENERATED |
| z0_col5 | varchar(100) | YES  |     | `z0_col0`                   | STORED GENERATED  |
+---------+--------------+------+-----+-----------------------------+-------------------+
############ mysql_genrate-1-6 其他场景
### 生成列：常量
# null
drop table test_table1;
create table test_table1(
z0_col0 int,
z0_col1 int,
z0_col2 int as (null) virtual,
z0_col3 int as (null) stored
);
insert into test_table1 (z0_col0,z0_col1) values (1,1),(2,2);
select z0_col0,z0_col1,z0_col2 col_vir,z0_col3 col_sto from test_table1 order by z0_col2;
+---------+---------+---------+---------+
| z0_col0 | z0_col1 | col_vir | col_sto |
+---------+---------+---------+---------+
|       1 |       1 |    NULL |    NULL |
|       2 |       2 |    NULL |    NULL |
+---------+---------+---------+---------+
select max(z0_col2),min(z0_col3) from test_table1 order by z0_col2;
+--------------+--------------+
| max(z0_col2) | min(z0_col3) |
+--------------+--------------+
|         NULL |         NULL |
+--------------+--------------+
# ''/' '
drop table test_table1;
create table test_table1(
z0_col0 int,
z0_col1 int,
z0_col2 char(200) as ('') virtual,
z0_col3 char(200) as (' ') stored
);
insert into test_table1 (z0_col0,z0_col1) values (1,1),(2,2);
select z0_col0,z0_col1,z0_col2 col_vir,z0_col3 col_sto from test_table1 order by z0_col2;
+---------+---------+---------+---------+
| z0_col0 | z0_col1 | col_vir | col_sto |
+---------+---------+---------+---------+
|       1 |       1 |         |         |
|       2 |       2 |         |         |
+---------+---------+---------+---------+
select max(z0_col2),min(z0_col3) from test_table1 order by z0_col2;
+--------------+--------------+
| max(z0_col2) | min(z0_col3) |
+--------------+--------------+
|              |              |
+--------------+--------------+
# 0，小数，负数，日期
drop table test_table1;
create table test_table1(
z0_col0 int,
z0_col1 int,
z0_col2 int as (0) virtual,
z0_col3 int as (3.1415926) stored,
z0_col4 int as (-100) virtual,
z0_col5 date as ('2020/06/22') stored
);
select * from test_table1 order by z0_col2;
+---------+---------+---------+---------+---------+---------+
| z0_col0 | z0_col1 | z0_col2 | z0_col3 | z0_col4 | z0_col5 |
+---------+---------+---------+---------+---------+---------+
+---------+---------+---------+---------+---------+---------+
insert into test_table1 (z0_col0,z0_col1) values (1,1),(2,2);
select * from test_table1 order by z0_col2;
+---------+---------+---------+---------+---------+------------+
| z0_col0 | z0_col1 | z0_col2 | z0_col3 | z0_col4 | z0_col5    |
+---------+---------+---------+---------+---------+------------+
|       1 |       1 |       0 |       3 |    -100 | 2020-06-22 |
|       2 |       2 |       0 |       3 |    -100 | 2020-06-22 |
+---------+---------+---------+---------+---------+------------+
select max(z0_col2),min(z0_col3) from test_table1 order by z0_col2;
+--------------+--------------+
| max(z0_col2) | min(z0_col3) |
+--------------+--------------+
|            0 |            3 |
+--------------+--------------+
# 特殊字符 ' ！@#￥%……&*（）-+'
drop table test_table1;
create table test_table1(
z0_col0 int,
z0_col1 int,
z0_col2 char(200) as (' ！@#￥%……&*（）-+') virtual,
z0_col3 char(200) as (',./?;:|[]{}~$%^&') stored
);
select * from test_table1 order by z0_col2;
+---------+---------+---------+---------+
| z0_col0 | z0_col1 | z0_col2 | z0_col3 |
+---------+---------+---------+---------+
+---------+---------+---------+---------+
insert into test_table1 (z0_col0,z0_col1) values (1,1),(2,2);
select * from test_table1 order by z0_col2;
+---------+---------+----------------------------+------------------+
| z0_col0 | z0_col1 | z0_col2                    | z0_col3          |
+---------+---------+----------------------------+------------------+
|       1 |       1 |  ！@#￥%……&*（）-+         | ,./?;:|[]{}~$%^& |
|       2 |       2 |  ！@#￥%……&*（）-+         | ,./?;:|[]{}~$%^& |
+---------+---------+----------------------------+------------------+
select max(z0_col2),min(z0_col3) from test_table1 order by z0_col2;
+----------------------------+------------------+
| max(z0_col2)               | min(z0_col3)     |
+----------------------------+------------------+
|  ！@#￥%……&*（）-+         | ,./?;:|[]{}~$%^& |
+----------------------------+------------------+
# 汉字，换行,\n,\t,\r
drop table test_table1;
create table test_table1(
z0_col0 int,
z0_col1 int,
z0_col2 char(200) as ('虚拟列') virtual,
z0_col3 char(200) as ('生成列') stored,
z0_col4 char(200) as ('虚拟列\n\t\r转换符') virtual,
z0_col5 char(200) as ('生成列\n\t\r转换符') stored,
z0_col6 char(200) as ('虚拟列
第二行') virtual,
z0_col7 char(200) as ('生成列
第二行') stored
);
select * from test_table1 order by z0_col2;
+---------+---------+---------+---------+---------+---------+---------+---------+
| z0_col0 | z0_col1 | z0_col2 | z0_col3 | z0_col4 | z0_col5 | z0_col6 | z0_col7 |
+---------+---------+---------+---------+---------+---------+---------+---------+
+---------+---------+---------+---------+---------+---------+---------+---------+
insert into test_table1 (z0_col0,z0_col1) values (1,1),(2,2);
select * from test_table1 order by z0_col2;
+---------+---------+-----------+-----------+-----------------------+-----------------------+---------------------+---------------------+
| z0_col0 | z0_col1 | z0_col2   | z0_col3   | z0_col4               | z0_col5               | z0_col6             | z0_col7             |
+---------+---------+-----------+-----------+-----------------------+-----------------------+---------------------+---------------------+
|       1 |       1 | 虚拟列    | 生成列    | 虚拟列
	转换符       | 生成列
	转换符       | 虚拟列
第二行       | 生成列
第二行       |
|       2 |       2 | 虚拟列    | 生成列    | 虚拟列
	转换符       | 生成列
	转换符       | 虚拟列
第二行       | 生成列
第二行       |
+---------+---------+-----------+-----------+-----------------------+-----------------------+---------------------+---------------------+
select max(z0_col2),min(z0_col3) from test_table1 order by z0_col2;
+--------------+--------------+
| max(z0_col2) | min(z0_col3) |
+--------------+--------------+
| 虚拟列       | 生成列       |
+--------------+--------------+
### 生成列：生成列上加默认值
drop table test_table1;
create table test_table1(
id int,
z0_col0 int,
z0_col1 int,
z0_col2 int as(z0_col0/z0_col1) virtual default '0',
z0_col3 int as(z0_col1*z0_col1) stored  default '0'
);
ERROR 42000: You have an error in your SQL syntax; check the manual that corresponds to your OceanBase version for the right syntax to use near 'default '0',
z0_col3 int as(z0_col1*z0_col1) stored  default '0'
)' at line 5
### 生成列：生成列引用生成列     ob不兼容MySQL
drop table test_table1;
create table test_table1(
z0_col0 int,
z0_col1 int,
z0_col2 int as(z0_col1) virtual,
z0_col3 int as(z0_col2) virtual
);
ERROR HY000: 'Defining a generated column on generated column(s)' is not supported for generated columns.
insert into test_table1 (z0_col0,z0_col1) values (10,10),(20,20),(30,30);
ERROR 42S02: Table 'whh.test_table1' doesn't exist
select * from test_table1 order by z0_col2;
ERROR 42S02: Table 'whh.test_table1' doesn't exist
### 表达式：生成列表达式 column / 0
drop table test_table1;
create table test_table1(
id int,
z0_col0 char(200) default '1',
z0_col1 char(200) default '2',
z0_col2 int as(z0_col0/0) virtual,
z0_col3 int as(z0_col1) stored
);
insert into test_table1 (id) values (1);
select z0_col0,z0_col1,z0_col2 col_vir,z0_col3 col_sto from test_table1 order by z0_col2;
+---------+---------+---------+---------+
| z0_col0 | z0_col1 | col_vir | col_sto |
+---------+---------+---------+---------+
| 1       | 2       |    NULL |       2 |
+---------+---------+---------+---------+
select max(z0_col2),min(z0_col3) from test_table1 order by z0_col2;
+--------------+--------------+
| max(z0_col2) | min(z0_col3) |
+--------------+--------------+
|         NULL |            2 |
+--------------+--------------+
### 表达式：生成列引用的普通列使用默认值
drop table test_table1;
create table test_table1(
id int,
z0_col0 int default 30,
z0_col1 int default 5,
z0_col2 int as(z0_col0/z0_col1) virtual,
z0_col3 int as(z0_col1*z0_col1) stored
);
insert into test_table1 (id) values (1);
select z0_col0,z0_col1,z0_col2 col_vir,z0_col3 col_sto from test_table1 order by z0_col2;
+---------+---------+---------+---------+
| z0_col0 | z0_col1 | col_vir | col_sto |
+---------+---------+---------+---------+
|      30 |       5 |       6 |      25 |
+---------+---------+---------+---------+
select max(z0_col2),min(z0_col3) from test_table1 order by z0_col2;
+--------------+--------------+
| max(z0_col2) | min(z0_col3) |
+--------------+--------------+
|            6 |           25 |
+--------------+--------------+
### 事务：向表中插入/删除数据，添加生成列等，再回滚
SET @@AUTOCOMMIT=0;
drop table test_table1;
create table test_table1(
z0_col0 int,
z0_col1 int,
z0_col2 int as(z0_col0/z0_col1) virtual,
z0_col3 int as(z0_col1*z0_col1) stored
);
insert into test_table1 (z0_col0,z0_col1) values (10,10),(20,20),(30,30);
select * from test_table1 order by z0_col2;
+---------+---------+---------+---------+
| z0_col0 | z0_col1 | z0_col2 | z0_col3 |
+---------+---------+---------+---------+
|      10 |      10 |       1 |     100 |
|      20 |      20 |       1 |     400 |
|      30 |      30 |       1 |     900 |
+---------+---------+---------+---------+
# 插入数据再回滚
start transaction;
insert into test_table1 (z0_col0,z0_col1) values (40,40);
select * from test_table1 order by z0_col2;
+---------+---------+---------+---------+
| z0_col0 | z0_col1 | z0_col2 | z0_col3 |
+---------+---------+---------+---------+
|      10 |      10 |       1 |     100 |
|      20 |      20 |       1 |     400 |
|      30 |      30 |       1 |     900 |
|      40 |      40 |       1 |    1600 |
+---------+---------+---------+---------+
rollback;
select z0_col0,z0_col1,z0_col2 col_vir,z0_col3 col_sto from test_table1 order by z0_col2;
+---------+---------+---------+---------+
| z0_col0 | z0_col1 | col_vir | col_sto |
+---------+---------+---------+---------+
|      10 |      10 |       1 |     100 |
|      20 |      20 |       1 |     400 |
|      30 |      30 |       1 |     900 |
+---------+---------+---------+---------+
select max(z0_col2),min(z0_col3) from test_table1 order by z0_col2;
+--------------+--------------+
| max(z0_col2) | min(z0_col3) |
+--------------+--------------+
|            1 |          100 |
+--------------+--------------+
# 删除数据再回滚
start transaction;
delete from test_table1 where z0_col3 = 900;
select * from test_table1 order by z0_col2;
+---------+---------+---------+---------+
| z0_col0 | z0_col1 | z0_col2 | z0_col3 |
+---------+---------+---------+---------+
|      10 |      10 |       1 |     100 |
|      20 |      20 |       1 |     400 |
+---------+---------+---------+---------+
rollback;
select z0_col0,z0_col1,z0_col2 col_vir,z0_col3 col_sto from test_table1 order by z0_col2;
+---------+---------+---------+---------+
| z0_col0 | z0_col1 | col_vir | col_sto |
+---------+---------+---------+---------+
|      10 |      10 |       1 |     100 |
|      20 |      20 |       1 |     400 |
|      30 |      30 |       1 |     900 |
+---------+---------+---------+---------+
select max(z0_col2),min(z0_col3) from test_table1 order by z0_col2;
+--------------+--------------+
| max(z0_col2) | min(z0_col3) |
+--------------+--------------+
|            1 |          100 |
+--------------+--------------+
# 添加生成列再回滚
start transaction;
alter table test_table1 add z0_col4 varchar(100) as (concat(z0_col0,z0_col1)) virtual;
select * from test_table1 order by z0_col2;
+---------+---------+---------+---------+---------+
| z0_col0 | z0_col1 | z0_col2 | z0_col3 | z0_col4 |
+---------+---------+---------+---------+---------+
|      10 |      10 |       1 |     100 | 1010    |
|      20 |      20 |       1 |     400 | 2020    |
|      30 |      30 |       1 |     900 | 3030    |
+---------+---------+---------+---------+---------+
rollback;
select z0_col0,z0_col1,z0_col2 col_vir,z0_col3 col_sto from test_table1 order by z0_col2;
+---------+---------+---------+---------+
| z0_col0 | z0_col1 | col_vir | col_sto |
+---------+---------+---------+---------+
|      10 |      10 |       1 |     100 |
|      20 |      20 |       1 |     400 |
|      30 |      30 |       1 |     900 |
+---------+---------+---------+---------+
select max(z0_col2),min(z0_col3) from test_table1 order by z0_col2;
+--------------+--------------+
| max(z0_col2) | min(z0_col3) |
+--------------+--------------+
|            1 |          100 |
+--------------+--------------+
SET @@AUTOCOMMIT=1;
### 一个表中含有多个虚拟列/存储列(6,7,8...)
drop table test_table1;
create table test_table1(
z0_col0 int,
z0_col1 int,
z0_col2 int as(z0_col0*1) virtual,
z0_col3 int as(z0_col0*2) virtual,
z0_col4 int as(z0_col0*3) virtual,
z0_col5 int as(z0_col0*4) virtual,
z0_col6 int as(z0_col0*5) virtual,
z0_col7 int as(z0_col0*6) virtual,
z0_col10 int as(z0_col1*1) stored,
z0_col11 int as(z0_col1*2) stored,
z0_col12 int as(z0_col1*3) stored,
z0_col13 int as(z0_col1*4) stored,
z0_col14 int as(z0_col1*5) stored,
z0_col15 int as(z0_col1*6) stored
);
insert into test_table1 (z0_col0,z0_col1) values (10,10),(20,20),(30,30);
select * from test_table1 order by z0_col2;
+---------+---------+---------+---------+---------+---------+---------+---------+----------+----------+----------+----------+----------+----------+
| z0_col0 | z0_col1 | z0_col2 | z0_col3 | z0_col4 | z0_col5 | z0_col6 | z0_col7 | z0_col10 | z0_col11 | z0_col12 | z0_col13 | z0_col14 | z0_col15 |
+---------+---------+---------+---------+---------+---------+---------+---------+----------+----------+----------+----------+----------+----------+
|      10 |      10 |      10 |      20 |      30 |      40 |      50 |      60 |       10 |       20 |       30 |       40 |       50 |       60 |
|      20 |      20 |      20 |      40 |      60 |      80 |     100 |     120 |       20 |       40 |       60 |       80 |      100 |      120 |
|      30 |      30 |      30 |      60 |      90 |     120 |     150 |     180 |       30 |       60 |       90 |      120 |      150 |      180 |
+---------+---------+---------+---------+---------+---------+---------+---------+----------+----------+----------+----------+----------+----------+
alter table test_table1 add z0_col8 int as (z0_col0*7) virtual;
alter table test_table1 add z0_col9 int as (z0_col0*8) virtual;
alter table test_table1 add z0_col16 int as (z0_col1*7) stored;
alter table test_table1 add z0_col17 int as (z0_col1*8) stored;
insert into test_table1 (z0_col0,z0_col1) values (10,10),(20,20),(30,30);
select * from test_table1 order by z0_col2;
+---------+---------+---------+---------+---------+---------+---------+---------+----------+----------+----------+----------+----------+----------+---------+---------+----------+----------+
| z0_col0 | z0_col1 | z0_col2 | z0_col3 | z0_col4 | z0_col5 | z0_col6 | z0_col7 | z0_col10 | z0_col11 | z0_col12 | z0_col13 | z0_col14 | z0_col15 | z0_col8 | z0_col9 | z0_col16 | z0_col17 |
+---------+---------+---------+---------+---------+---------+---------+---------+----------+----------+----------+----------+----------+----------+---------+---------+----------+----------+
|      10 |      10 |      10 |      20 |      30 |      40 |      50 |      60 |       10 |       20 |       30 |       40 |       50 |       60 |      70 |      80 |       70 |       80 |
|      10 |      10 |      10 |      20 |      30 |      40 |      50 |      60 |       10 |       20 |       30 |       40 |       50 |       60 |      70 |      80 |       70 |       80 |
|      20 |      20 |      20 |      40 |      60 |      80 |     100 |     120 |       20 |       40 |       60 |       80 |      100 |      120 |     140 |     160 |      140 |      160 |
|      20 |      20 |      20 |      40 |      60 |      80 |     100 |     120 |       20 |       40 |       60 |       80 |      100 |      120 |     140 |     160 |      140 |      160 |
|      30 |      30 |      30 |      60 |      90 |     120 |     150 |     180 |       30 |       60 |       90 |      120 |      150 |      180 |     210 |     240 |      210 |      240 |
|      30 |      30 |      30 |      60 |      90 |     120 |     150 |     180 |       30 |       60 |       90 |      120 |      150 |      180 |     210 |     240 |      210 |      240 |
+---------+---------+---------+---------+---------+---------+---------+---------+----------+----------+----------+----------+----------+----------+---------+---------+----------+----------+
desc test_table1;
+----------+---------+------+-----+-----------------+-------------------+
| Field    | Type    | Null | Key | Default         | Extra             |
+----------+---------+------+-----+-----------------+-------------------+
| z0_col0  | int(11) | YES  |     | NULL            |                   |
| z0_col1  | int(11) | YES  |     | NULL            |                   |
| z0_col2  | int(11) | YES  |     | (`z0_col0` * 1) | VIRTUAL GENERATED |
| z0_col3  | int(11) | YES  |     | (`z0_col0` * 2) | VIRTUAL GENERATED |
| z0_col4  | int(11) | YES  |     | (`z0_col0` * 3) | VIRTUAL GENERATED |
| z0_col5  | int(11) | YES  |     | (`z0_col0` * 4) | VIRTUAL GENERATED |
| z0_col6  | int(11) | YES  |     | (`z0_col0` * 5) | VIRTUAL GENERATED |
| z0_col7  | int(11) | YES  |     | (`z0_col0` * 6) | VIRTUAL GENERATED |
| z0_col10 | int(11) | YES  |     | (`z0_col1` * 1) | STORED GENERATED  |
| z0_col11 | int(11) | YES  |     | (`z0_col1` * 2) | STORED GENERATED  |
| z0_col12 | int(11) | YES  |     | (`z0_col1` * 3) | STORED GENERATED  |
| z0_col13 | int(11) | YES  |     | (`z0_col1` * 4) | STORED GENERATED  |
| z0_col14 | int(11) | YES  |     | (`z0_col1` * 5) | STORED GENERATED  |
| z0_col15 | int(11) | YES  |     | (`z0_col1` * 6) | STORED GENERATED  |
| z0_col8  | int(11) | YES  |     | (`z0_col0` * 7) | VIRTUAL GENERATED |
| z0_col9  | int(11) | YES  |     | (`z0_col0` * 8) | VIRTUAL GENERATED |
| z0_col16 | int(11) | YES  |     | (`z0_col1` * 7) | STORED GENERATED  |
| z0_col17 | int(11) | YES  |     | (`z0_col1` * 8) | STORED GENERATED  |
+----------+---------+------+-----+-----------------+-------------------+
drop user whh@'%';
drop database IF EXISTS whh ;
PURGE RECYCLEBIN;
# oracle_genrate-1-1 系统租户下修改配置 _rowsets_max_rows = 8
alter system set _rowsets_enabled = true tenant sys;
alter system set _rowsets_enabled = true tenant all_user;
alter system set _rowsets_enabled = true tenant all_meta;
alter system set _rowsets_max_rows = 8 tenant sys;
alter system set _rowsets_max_rows = 8 tenant all_user;
alter system set _rowsets_max_rows = 8 tenant all_meta;
alter system flush plan cache global;
# 环境清理
purge recyclebin;
result_format: 4
drop user whh@'%';
drop database if exists whh ;
create user whh identified by 'whh';
create database whh ;
grant all on *.* to whh WITH GRANT OPTION;


#############################################################################################
############ mysql_genrate-1-2 作为分区键
### key分区
drop table virtual_table;
create table virtual_table(
z0_col0 int, 
z0_col1 int,
z0_col2 int as(z0_col0+z0_col1)) 
partition by key(z0_col2) partitions 2;
insert into virtual_table (z0_col0,z0_col1) values (0,0),(NULL,NULL),(1.111,222),(10,10);
select z0_col0,z0_col1,z0_col2 from virtual_table partition(p0) order by z0_col2;
+---------+---------+---------+
| z0_col0 | z0_col1 | z0_col2 |
+---------+---------+---------+
|      10 |      10 |      20 |
|       1 |     222 |     223 |
+---------+---------+---------+
select z0_col0,z0_col1,z0_col2 from virtual_table partition(p1) order by z0_col2;
+---------+---------+---------+
| z0_col0 | z0_col1 | z0_col2 |
+---------+---------+---------+
|    NULL |    NULL |    NULL |
|       0 |       0 |       0 |
+---------+---------+---------+
explain select z0_col0,z0_col1,z0_col2 from virtual_table where z0_col2 = 0 order by z0_col2;
Query Plan
========================================================
|ID|OPERATOR       |NAME         |EST.ROWS|EST.TIME(us)|
--------------------------------------------------------
|0 |TABLE FULL SCAN|virtual_table|1       |3           |
========================================================
Outputs & filters:
-------------------------------------
  0 - output([virtual_table.z0_col0], [virtual_table.z0_col1], [column_conv(INT,PS:(11,0),NULL,cast(virtual_table.z0_col0 + virtual_table.z0_col1, INT(-1,
       0)))]), filter([column_conv(INT,PS:(11,0),NULL,cast(virtual_table.z0_col0 + virtual_table.z0_col1, INT(-1, 0))) = 0]), rowset=8
      access([virtual_table.z0_col0], [virtual_table.z0_col1]), partitions(p1)
      is_index_back=false, is_global_index=false, filter_before_indexback[false], 
      range_key([virtual_table.__pk_increment]), range(MIN ; MAX)always true
explain select z0_col0,z0_col1,z0_col2 from virtual_table where z0_col0+z0_col1 = 0 order by z0_col2;
Query Plan
====================================================================
|ID|OPERATOR                   |NAME         |EST.ROWS|EST.TIME(us)|
--------------------------------------------------------------------
|0 |PX COORDINATOR MERGE SORT  |             |1       |7           |
|1 |└─EXCHANGE OUT DISTR       |:EX10000     |1       |6           |
|2 |  └─SORT                   |             |1       |5           |
|3 |    └─PX PARTITION ITERATOR|             |1       |5           |
|4 |      └─TABLE FULL SCAN    |virtual_table|1       |5           |
====================================================================
Outputs & filters:
-------------------------------------
  0 - output([INTERNAL_FUNCTION(virtual_table.z0_col0, virtual_table.z0_col1, column_conv(INT,PS:(11,0),NULL,cast(virtual_table.z0_col0 + virtual_table.z0_col1,
       INT(-1, 0))))]), filter(nil), rowset=8
      sort_keys([column_conv(INT,PS:(11,0),NULL,cast(virtual_table.z0_col0 + virtual_table.z0_col1, INT(-1, 0))), ASC])
  1 - output([column_conv(INT,PS:(11,0),NULL,cast(virtual_table.z0_col0 + virtual_table.z0_col1, INT(-1, 0)))], [INTERNAL_FUNCTION(virtual_table.z0_col0,
       virtual_table.z0_col1, column_conv(INT,PS:(11,0),NULL,cast(virtual_table.z0_col0 + virtual_table.z0_col1, INT(-1, 0))))]), filter(nil), rowset=8
      dop=1
  2 - output([column_conv(INT,PS:(11,0),NULL,cast(virtual_table.z0_col0 + virtual_table.z0_col1, INT(-1, 0)))], [virtual_table.z0_col0], [virtual_table.z0_col1]), filter(nil), rowset=8
      sort_keys([column_conv(INT,PS:(11,0),NULL,cast(virtual_table.z0_col0 + virtual_table.z0_col1, INT(-1, 0))), ASC])
  3 - output([virtual_table.z0_col0], [virtual_table.z0_col1], [column_conv(INT,PS:(11,0),NULL,cast(virtual_table.z0_col0 + virtual_table.z0_col1, INT(-1,
       0)))]), filter(nil), rowset=8
      force partition granule
  4 - output([virtual_table.z0_col0], [virtual_table.z0_col1], [column_conv(INT,PS:(11,0),NULL,cast(virtual_table.z0_col0 + virtual_table.z0_col1, INT(-1,
       0)))]), filter([virtual_table.z0_col0 + virtual_table.z0_col1 = 0]), rowset=8
      access([virtual_table.z0_col0], [virtual_table.z0_col1]), partitions(p[0-1])
      is_index_back=false, is_global_index=false, filter_before_indexback[false], 
      range_key([virtual_table.__pk_increment]), range(MIN ; MAX)always true
drop table stored_table;
create table stored_table(
z0_col0 int, 
z0_col1 int,
z0_col2 int as(z0_col0+z0_col1) stored) 
partition by key(z0_col2) partitions 3;
insert into stored_table (z0_col0,z0_col1) values (0,0),(NULL,NULL),(1.111,222),(10,10);
select z0_col0,z0_col1,z0_col2 from stored_table partition(p0) order by z0_col2;
+---------+---------+---------+
| z0_col0 | z0_col1 | z0_col2 |
+---------+---------+---------+
|      10 |      10 |      20 |
+---------+---------+---------+
select z0_col0,z0_col1,z0_col2 from stored_table partition(p1) order by z0_col2;
+---------+---------+---------+
| z0_col0 | z0_col1 | z0_col2 |
+---------+---------+---------+
|       1 |     222 |     223 |
+---------+---------+---------+
select z0_col0,z0_col1,z0_col2 from stored_table partition(p2) order by z0_col2;
+---------+---------+---------+
| z0_col0 | z0_col1 | z0_col2 |
+---------+---------+---------+
|    NULL |    NULL |    NULL |
|       0 |       0 |       0 |
+---------+---------+---------+
explain select z0_col0,z0_col1,z0_col2 from stored_table where z0_col2 = 0 order by z0_col2;
Query Plan
=======================================================
|ID|OPERATOR       |NAME        |EST.ROWS|EST.TIME(us)|
-------------------------------------------------------
|0 |TABLE FULL SCAN|stored_table|1       |3           |
=======================================================
Outputs & filters:
-------------------------------------
  0 - output([stored_table.z0_col0], [stored_table.z0_col1], [stored_table.z0_col2]), filter([stored_table.z0_col2 = 0]), rowset=8
      access([stored_table.z0_col0], [stored_table.z0_col1], [stored_table.z0_col2]), partitions(p2)
      is_index_back=false, is_global_index=false, filter_before_indexback[false], 
      range_key([stored_table.__pk_increment]), range(MIN ; MAX)always true
explain select z0_col0,z0_col1,z0_col2 from stored_table where z0_col0+z0_col1 = 0 order by z0_col2;
Query Plan
===================================================================
|ID|OPERATOR                   |NAME        |EST.ROWS|EST.TIME(us)|
-------------------------------------------------------------------
|0 |PX COORDINATOR MERGE SORT  |            |1       |9           |
|1 |└─EXCHANGE OUT DISTR       |:EX10000    |1       |8           |
|2 |  └─SORT                   |            |1       |7           |
|3 |    └─PX PARTITION ITERATOR|            |1       |7           |
|4 |      └─TABLE FULL SCAN    |stored_table|1       |7           |
===================================================================
Outputs & filters:
-------------------------------------
  0 - output([INTERNAL_FUNCTION(stored_table.z0_col0, stored_table.z0_col1, stored_table.z0_col2)]), filter(nil), rowset=8
      sort_keys([stored_table.z0_col2, ASC])
  1 - output([stored_table.z0_col2], [INTERNAL_FUNCTION(stored_table.z0_col0, stored_table.z0_col1, stored_table.z0_col2)]), filter(nil), rowset=8
      dop=1
  2 - output([stored_table.z0_col2], [stored_table.z0_col0], [stored_table.z0_col1]), filter(nil), rowset=8
      sort_keys([stored_table.z0_col2, ASC])
  3 - output([stored_table.z0_col0], [stored_table.z0_col1], [stored_table.z0_col2]), filter(nil), rowset=8
      force partition granule
  4 - output([stored_table.z0_col0], [stored_table.z0_col1], [stored_table.z0_col2]), filter([stored_table.z0_col0 + stored_table.z0_col1 = 0]), rowset=8
      access([stored_table.z0_col0], [stored_table.z0_col1], [stored_table.z0_col2]), partitions(p[0-2])
      is_index_back=false, is_global_index=false, filter_before_indexback[false], 
      range_key([stored_table.__pk_increment]), range(MIN ; MAX)always true
### COLUMNS分区
drop table virtual_table;
create table virtual_table(
z0_col0 int, 
z0_col1 int,
z0_col2 int as (abs(z0_col0-z0_col1)))
partition by range columns(z0_col2) (
partition p0 values less than (10),
partition p1 values less than (20),
partition p2 values less than maxvalue);
insert into virtual_table (z0_col0,z0_col1) values (0,0),(NULL,NULL),(5,25),(20,30),(100,10);
select z0_col0,z0_col1,z0_col2 from virtual_table partition(p0) order by z0_col2;
+---------+---------+---------+
| z0_col0 | z0_col1 | z0_col2 |
+---------+---------+---------+
|    NULL |    NULL |    NULL |
|       0 |       0 |       0 |
+---------+---------+---------+
select z0_col0,z0_col1,z0_col2 from virtual_table partition(p1) order by z0_col2;
+---------+---------+---------+
| z0_col0 | z0_col1 | z0_col2 |
+---------+---------+---------+
|      20 |      30 |      10 |
+---------+---------+---------+
select z0_col0,z0_col1,z0_col2 from virtual_table partition(p2) order by z0_col2;
+---------+---------+---------+
| z0_col0 | z0_col1 | z0_col2 |
+---------+---------+---------+
|       5 |      25 |      20 |
|     100 |      10 |      90 |
+---------+---------+---------+
explain select z0_col0,z0_col1,z0_col2 from virtual_table where z0_col2 = 0 order by z0_col2;
Query Plan
========================================================
|ID|OPERATOR       |NAME         |EST.ROWS|EST.TIME(us)|
--------------------------------------------------------
|0 |TABLE FULL SCAN|virtual_table|1       |3           |
========================================================
Outputs & filters:
-------------------------------------
  0 - output([virtual_table.z0_col0], [virtual_table.z0_col1], [column_conv(INT,PS:(11,0),NULL,cast(abs(virtual_table.z0_col0 - virtual_table.z0_col1), 
      INT(-1, 0)))]), filter([column_conv(INT,PS:(11,0),NULL,cast(abs(virtual_table.z0_col0 - virtual_table.z0_col1), INT(-1, 0))) = 0]), rowset=8
      access([virtual_table.z0_col0], [virtual_table.z0_col1]), partitions(p0)
      is_index_back=false, is_global_index=false, filter_before_indexback[false], 
      range_key([virtual_table.__pk_increment]), range(MIN ; MAX)always true
explain select z0_col0,z0_col1,z0_col2 from virtual_table where abs(z0_col0-z0_col1) = 0 order by z0_col2;
Query Plan
====================================================================
|ID|OPERATOR                   |NAME         |EST.ROWS|EST.TIME(us)|
--------------------------------------------------------------------
|0 |PX COORDINATOR MERGE SORT  |             |1       |9           |
|1 |└─EXCHANGE OUT DISTR       |:EX10000     |1       |8           |
|2 |  └─SORT                   |             |1       |7           |
|3 |    └─PX PARTITION ITERATOR|             |1       |7           |
|4 |      └─TABLE FULL SCAN    |virtual_table|1       |7           |
====================================================================
Outputs & filters:
-------------------------------------
  0 - output([INTERNAL_FUNCTION(virtual_table.z0_col0, virtual_table.z0_col1, column_conv(INT,PS:(11,0),NULL,cast(abs(virtual_table.z0_col0 - virtual_table.z0_col1),
       INT(-1, 0))))]), filter(nil), rowset=8
      sort_keys([column_conv(INT,PS:(11,0),NULL,cast(abs(virtual_table.z0_col0 - virtual_table.z0_col1), INT(-1, 0))), ASC])
  1 - output([column_conv(INT,PS:(11,0),NULL,cast(abs(virtual_table.z0_col0 - virtual_table.z0_col1), INT(-1, 0)))], [INTERNAL_FUNCTION(virtual_table.z0_col0,
       virtual_table.z0_col1, column_conv(INT,PS:(11,0),NULL,cast(abs(virtual_table.z0_col0 - virtual_table.z0_col1), INT(-1, 0))))]), filter(nil), rowset=8
      dop=1
  2 - output([column_conv(INT,PS:(11,0),NULL,cast(abs(virtual_table.z0_col0 - virtual_table.z0_col1), INT(-1, 0)))], [virtual_table.z0_col0], [virtual_table.z0_col1]), filter(nil), rowset=8
      sort_keys([column_conv(INT,PS:(11,0),NULL,cast(abs(virtual_table.z0_col0 - virtual_table.z0_col1), INT(-1, 0))), ASC])
  3 - output([virtual_table.z0_col0], [virtual_table.z0_col1], [column_conv(INT,PS:(11,0),NULL,cast(abs(virtual_table.z0_col0 - virtual_table.z0_col1), 
      INT(-1, 0)))]), filter(nil), rowset=8
      force partition granule
  4 - output([virtual_table.z0_col0], [virtual_table.z0_col1], [column_conv(INT,PS:(11,0),NULL,cast(abs(virtual_table.z0_col0 - virtual_table.z0_col1), 
      INT(-1, 0)))]), filter([abs(virtual_table.z0_col0 - virtual_table.z0_col1) = 0]), rowset=8
      access([virtual_table.z0_col0], [virtual_table.z0_col1]), partitions(p[0-2])
      is_index_back=false, is_global_index=false, filter_before_indexback[false], 
      range_key([virtual_table.__pk_increment]), range(MIN ; MAX)always true
drop table stored_table;
create table stored_table(
z0_col0 int,
z0_col1 int,
z0_col2 int as (abs(z0_col0-z0_col1)) stored)
partition by range columns(z0_col2) (
partition p0 values less than (10),
partition p1 values less than (20),
partition p2 values less than maxvalue);
insert into stored_table (z0_col0,z0_col1) values (0,0),(NULL,NULL),(5,25),(20,30),(100,10);
select z0_col0,z0_col1,z0_col2 from stored_table partition(p0) order by z0_col2;
+---------+---------+---------+
| z0_col0 | z0_col1 | z0_col2 |
+---------+---------+---------+
|    NULL |    NULL |    NULL |
|       0 |       0 |       0 |
+---------+---------+---------+
select z0_col0,z0_col1,z0_col2 from stored_table partition(p1) order by z0_col2;
+---------+---------+---------+
| z0_col0 | z0_col1 | z0_col2 |
+---------+---------+---------+
|      20 |      30 |      10 |
+---------+---------+---------+
select z0_col0,z0_col1,z0_col2 from stored_table partition(p2) order by z0_col2;
+---------+---------+---------+
| z0_col0 | z0_col1 | z0_col2 |
+---------+---------+---------+
|       5 |      25 |      20 |
|     100 |      10 |      90 |
+---------+---------+---------+
explain select z0_col0,z0_col1,z0_col2 from stored_table where z0_col2 = 0 order by z0_col2;
Query Plan
=======================================================
|ID|OPERATOR       |NAME        |EST.ROWS|EST.TIME(us)|
-------------------------------------------------------
|0 |TABLE FULL SCAN|stored_table|1       |3           |
=======================================================
Outputs & filters:
-------------------------------------
  0 - output([stored_table.z0_col0], [stored_table.z0_col1], [stored_table.z0_col2]), filter([stored_table.z0_col2 = 0]), rowset=8
      access([stored_table.z0_col0], [stored_table.z0_col1], [stored_table.z0_col2]), partitions(p0)
      is_index_back=false, is_global_index=false, filter_before_indexback[false], 
      range_key([stored_table.__pk_increment]), range(MIN ; MAX)always true
explain select z0_col0,z0_col1,z0_col2 from stored_table where abs(z0_col0-z0_col1) = 0 order by z0_col2;
Query Plan
===================================================================
|ID|OPERATOR                   |NAME        |EST.ROWS|EST.TIME(us)|
-------------------------------------------------------------------
|0 |PX COORDINATOR MERGE SORT  |            |1       |9           |
|1 |└─EXCHANGE OUT DISTR       |:EX10000    |1       |8           |
|2 |  └─SORT                   |            |1       |7           |
|3 |    └─PX PARTITION ITERATOR|            |1       |7           |
|4 |      └─TABLE FULL SCAN    |stored_table|1       |7           |
===================================================================
Outputs & filters:
-------------------------------------
  0 - output([INTERNAL_FUNCTION(stored_table.z0_col0, stored_table.z0_col1, stored_table.z0_col2)]), filter(nil), rowset=8
      sort_keys([stored_table.z0_col2, ASC])
  1 - output([stored_table.z0_col2], [INTERNAL_FUNCTION(stored_table.z0_col0, stored_table.z0_col1, stored_table.z0_col2)]), filter(nil), rowset=8
      dop=1
  2 - output([stored_table.z0_col2], [stored_table.z0_col0], [stored_table.z0_col1]), filter(nil), rowset=8
      sort_keys([stored_table.z0_col2, ASC])
  3 - output([stored_table.z0_col0], [stored_table.z0_col1], [stored_table.z0_col2]), filter(nil), rowset=8
      force partition granule
  4 - output([stored_table.z0_col0], [stored_table.z0_col1], [stored_table.z0_col2]), filter([abs(stored_table.z0_col0 - stored_table.z0_col1) = 0]), rowset=8
      access([stored_table.z0_col0], [stored_table.z0_col1], [stored_table.z0_col2]), partitions(p[0-2])
      is_index_back=false, is_global_index=false, filter_before_indexback[false], 
      range_key([stored_table.__pk_increment]), range(MIN ; MAX)always true
### 视图
# 单基表 含有虚拟列(VIRTUAL)的表
drop table virtual_table;
create table virtual_table(
z0_col0 char(100), 
z0_col1 varchar(100),
z0_col2 varchar(100) as (concat(z0_col0,z0_col1)) virtual);
insert into virtual_table (z0_col0,z0_col1) values (0,0),(NULL,NULL),('2022-06-21','ten'),(100,10.00);
select z0_col0,z0_col1,z0_col2 from virtual_table order by z0_col2;
+------------+---------+---------------+
| z0_col0    | z0_col1 | z0_col2       |
+------------+---------+---------------+
| NULL       | NULL    | NULL          |
| 0          | 0       | 00            |
| 100        | 10.00   | 10010.00      |
| 2022-06-21 | ten     | 2022-06-21ten |
+------------+---------+---------------+
drop view view1;
create view view1 as select z0_col0,z0_col1,z0_col2 from virtual_table where length(z0_col2)>1 order by 1;
select * from view1 order by 1;
+------------+---------+---------------+
| z0_col0    | z0_col1 | z0_col2       |
+------------+---------+---------------+
| 0          | 0       | 00            |
| 100        | 10.00   | 10010.00      |
| 2022-06-21 | ten     | 2022-06-21ten |
+------------+---------+---------------+
insert into view1 (z0_col0,z0_col1) values ('view-','-insert');
select * from view1 order by 1;
+------------+---------+---------------+
| z0_col0    | z0_col1 | z0_col2       |
+------------+---------+---------------+
| 0          | 0       | 00            |
| 100        | 10.00   | 10010.00      |
| 2022-06-21 | ten     | 2022-06-21ten |
| view-      | -insert | view--insert  |
+------------+---------+---------------+
update  view1 set z0_col2=0 where 1=1;
ERROR HY000: The value specified for generated column 'z0_col2' in table 'view1' is not allowed
# 单基表 含有生成列(STORED)的表
drop table stored_table;
create table stored_table (
z0_col0 char(100), 
z0_col1 varchar(100),
z0_col2 varchar(100) as (concat(z0_col0,z0_col1)) stored);
insert into stored_table (z0_col0,z0_col1) values (0,0),(NULL,NULL),('2022-06-21','ten'),(100,10.00);
select z0_col0,z0_col1,z0_col2 from stored_table order by z0_col2;
+------------+---------+---------------+
| z0_col0    | z0_col1 | z0_col2       |
+------------+---------+---------------+
| NULL       | NULL    | NULL          |
| 0          | 0       | 00            |
| 100        | 10.00   | 10010.00      |
| 2022-06-21 | ten     | 2022-06-21ten |
+------------+---------+---------------+
drop view view1;
create view view1 as select z0_col0,z0_col1,z0_col2 from stored_table where length(z0_col2)>1 order by 1;
select * from view1 order by z0_col2;
+------------+---------+---------------+
| z0_col0    | z0_col1 | z0_col2       |
+------------+---------+---------------+
| 0          | 0       | 00            |
| 100        | 10.00   | 10010.00      |
| 2022-06-21 | ten     | 2022-06-21ten |
+------------+---------+---------------+
insert into view1 (z0_col0,z0_col1) values ('view-','-insert');
select * from view1 order by z0_col2;
+------------+---------+---------------+
| z0_col0    | z0_col1 | z0_col2       |
+------------+---------+---------------+
| 0          | 0       | 00            |
| 100        | 10.00   | 10010.00      |
| 2022-06-21 | ten     | 2022-06-21ten |
| view-      | -insert | view--insert  |
+------------+---------+---------------+
update  view1 set z0_col2=0 where 1=1;
ERROR HY000: The value specified for generated column 'z0_col2' in table 'view1' is not allowed
# 单基表 普通的表，后追加生成列(VIRTUAL/STORED)
drop table stored_table;
create table stored_table (
z0_col0 char(100), 
z0_col1 varchar(100));
alter table stored_table add z0_col2 varchar(100) as (concat(z0_col0,z0_col1)) virtual;
alter table stored_table add z0_col3 varchar(100) as (lower(concat(z0_col0,z0_col1))) stored;
insert into stored_table (z0_col0,z0_col1) values (0,0),(NULL,NULL),('2022-06-21','ten'),('WANGHUANHUAN ','CHINA');
select z0_col0,z0_col1,z0_col2,z0_col3 from stored_table order by z0_col1;
+--------------+---------+-------------------+-------------------+
| z0_col0      | z0_col1 | z0_col2           | z0_col3           |
+--------------+---------+-------------------+-------------------+
| NULL         | NULL    | NULL              | NULL              |
| 0            | 0       | 00                | 00                |
| WANGHUANHUAN | CHINA   | WANGHUANHUANCHINA | wanghuanhuanchina |
| 2022-06-21   | ten     | 2022-06-21ten     | 2022-06-21ten     |
+--------------+---------+-------------------+-------------------+
drop view view1;
create view view1 as select * from stored_table;
select * from view1 order by z0_col2;
+--------------+---------+-------------------+-------------------+
| z0_col0      | z0_col1 | z0_col2           | z0_col3           |
+--------------+---------+-------------------+-------------------+
| NULL         | NULL    | NULL              | NULL              |
| 0            | 0       | 00                | 00                |
| 2022-06-21   | ten     | 2022-06-21ten     | 2022-06-21ten     |
| WANGHUANHUAN | CHINA   | WANGHUANHUANCHINA | wanghuanhuanchina |
+--------------+---------+-------------------+-------------------+
update  view1 set z0_col2=0 where 1=1;
ERROR HY000: The value specified for generated column 'z0_col2' in table 'view1' is not allowed
# 单基表 两个含有虚拟列(VIRTUAL)的表
drop table virtual_table1;
create  table virtual_table1 (
id int,
z0_col0 char(100), 
z0_col1 varchar(100),
z0_col2 varchar(100) as (concat(z0_col0,z0_col1)) virtual);
insert into virtual_table1 (id,z0_col0,z0_col1) values (0,0,0),(1,NULL,NULL),(2,'virtual_table1','one'),(3,100,10.00);
select id,z0_col0,z0_col1,z0_col2 from virtual_table1 order by z0_col2;
+------+----------------+---------+-------------------+
| id   | z0_col0        | z0_col1 | z0_col2           |
+------+----------------+---------+-------------------+
|    1 | NULL           | NULL    | NULL              |
|    0 | 0              | 0       | 00                |
|    3 | 100            | 10.00   | 10010.00          |
|    2 | virtual_table1 | one     | virtual_table1one |
+------+----------------+---------+-------------------+
drop table virtual_table2;
create  table virtual_table2 (
id int,
z1_col0 char(100), 
z1_col1 varchar(100),
z1_col2 varchar(100) as (concat(z1_col0,z1_col1)) virtual);
insert into virtual_table2 (id,z1_col0,z1_col1) values (0,0,0),(1,NULL,NULL),(2,'virtual_table2','two'),(3,200,20.00);
select id,z1_col0,z1_col1,z1_col2 from virtual_table2 order by z1_col2;
+------+----------------+---------+-------------------+
| id   | z1_col0        | z1_col1 | z1_col2           |
+------+----------------+---------+-------------------+
|    1 | NULL           | NULL    | NULL              |
|    0 | 0              | 0       | 00                |
|    3 | 200            | 20.00   | 20020.00          |
|    2 | virtual_table2 | two     | virtual_table2two |
+------+----------------+---------+-------------------+
drop view view1;
create view view1 as select t1.z0_col0,t1.z0_col1,t1.z0_col2,t2.z1_col0,t2.z1_col1,t2.z1_col2 from virtual_table1 t1 inner join virtual_table2 t2 on t1.id=t2.id order by 1;
select * from view1 order by 1;
+----------------+---------+-------------------+----------------+---------+-------------------+
| z0_col0        | z0_col1 | z0_col2           | z1_col0        | z1_col1 | z1_col2           |
+----------------+---------+-------------------+----------------+---------+-------------------+
| NULL           | NULL    | NULL              | NULL           | NULL    | NULL              |
| 0              | 0       | 00                | 0              | 0       | 00                |
| 100            | 10.00   | 10010.00          | 200            | 20.00   | 20020.00          |
| virtual_table1 | one     | virtual_table1one | virtual_table2 | two     | virtual_table2two |
+----------------+---------+-------------------+----------------+---------+-------------------+
insert into view1 (z0_col0,z0_col1,z1_col0,z1_col1) values ('view-','-insert1','view-','-insert2');
ERROR HY000: Can not modify more than one base table through a join view 'whh.view1'
# 单基表 两个含有生成列(STORED)的表
drop table stored_table1;
create  table stored_table1 (
id int,
z0_col0 char(100), 
z0_col1 varchar(100),
z0_col2 varchar(100) as (concat(z0_col0,z0_col1)) stored);
insert into stored_table1 (id,z0_col0,z0_col1) values (0,0,0),(1,NULL,NULL),(2,'stored_table1','one'),(3,100,10.00);
select id,z0_col0,z0_col1,z0_col2 from stored_table1 order by z0_col2;
+------+---------------+---------+------------------+
| id   | z0_col0       | z0_col1 | z0_col2          |
+------+---------------+---------+------------------+
|    1 | NULL          | NULL    | NULL             |
|    0 | 0             | 0       | 00               |
|    3 | 100           | 10.00   | 10010.00         |
|    2 | stored_table1 | one     | stored_table1one |
+------+---------------+---------+------------------+
drop table stored_table2;
create  table stored_table2 (
id int,
z1_col0 char(100), 
z1_col1 varchar(100),
z1_col2 varchar(100) as (concat(z1_col0,z1_col1)) stored);
insert into stored_table2 (id,z1_col0,z1_col1) values (0,0,0),(1,NULL,NULL),(2,'stored_table2','two'),(3,200,20.00);
select id,z1_col0,z1_col1,z1_col2 from stored_table2 order by z1_col2;
+------+---------------+---------+------------------+
| id   | z1_col0       | z1_col1 | z1_col2          |
+------+---------------+---------+------------------+
|    1 | NULL          | NULL    | NULL             |
|    0 | 0             | 0       | 00               |
|    3 | 200           | 20.00   | 20020.00         |
|    2 | stored_table2 | two     | stored_table2two |
+------+---------------+---------+------------------+
drop view view1;
create view view1 as select t1.z0_col0,t1.z0_col1,t1.z0_col2,t2.z1_col0,t2.z1_col1,t2.z1_col2 from stored_table1 t1 inner join stored_table2 t2 on t1.id=t2.id order by 1;
select * from view1 order by z0_col2;
+---------------+---------+------------------+---------------+---------+------------------+
| z0_col0       | z0_col1 | z0_col2          | z1_col0       | z1_col1 | z1_col2          |
+---------------+---------+------------------+---------------+---------+------------------+
| NULL          | NULL    | NULL             | NULL          | NULL    | NULL             |
| 0             | 0       | 00               | 0             | 0       | 00               |
| 100           | 10.00   | 10010.00         | 200           | 20.00   | 20020.00         |
| stored_table1 | one     | stored_table1one | stored_table2 | two     | stored_table2two |
+---------------+---------+------------------+---------------+---------+------------------+
insert into view1 (z0_col0,z0_col1,z1_col0,z1_col1) values ('view-','-insert1','view-','-insert2');
ERROR HY000: Can not modify more than one base table through a join view 'whh.view1'
# 单基表 一个含有虚拟列(VIRTUAL)的表，一个含有生成列(STORED)的表
drop table virtual_table1;
create  table virtual_table1 (
id int,
z0_col0 char(100), 
z0_col1 varchar(100),
z0_col2 varchar(100) as (concat(z0_col0,z0_col1)) virtual);
insert into virtual_table1 (id,z0_col0,z0_col1) values (0,0,0),(1,NULL,NULL),(2,'virtual_table1','one'),(3,100,10.00);
select id,z0_col0,z0_col1,z0_col2 from virtual_table1 order by z0_col2;
+------+----------------+---------+-------------------+
| id   | z0_col0        | z0_col1 | z0_col2           |
+------+----------------+---------+-------------------+
|    1 | NULL           | NULL    | NULL              |
|    0 | 0              | 0       | 00                |
|    3 | 100            | 10.00   | 10010.00          |
|    2 | virtual_table1 | one     | virtual_table1one |
+------+----------------+---------+-------------------+
drop table stored_table2;
create  table stored_table2 (
id int,
z1_col0 char(100), 
z1_col1 varchar(100),
z1_col2 varchar(100) as (concat(z1_col0,z1_col1)) stored);
insert into stored_table2 (id,z1_col0,z1_col1) values (0,0,0),(1,NULL,NULL),(2,'stored_table2','two'),(3,200,20.00);
select id,z1_col0,z1_col1,z1_col2 from stored_table2 order by z1_col2;
+------+---------------+---------+------------------+
| id   | z1_col0       | z1_col1 | z1_col2          |
+------+---------------+---------+------------------+
|    1 | NULL          | NULL    | NULL             |
|    0 | 0             | 0       | 00               |
|    3 | 200           | 20.00   | 20020.00         |
|    2 | stored_table2 | two     | stored_table2two |
+------+---------------+---------+------------------+
drop view view1;
create view view1 as select t1.z0_col0,t1.z0_col1,t1.z0_col2,t2.z1_col0,t2.z1_col1,t2.z1_col2 from virtual_table1 t1 inner join stored_table2 t2 on t1.id=t2.id order by 1;
select * from view1 order by z0_col2;
+----------------+---------+-------------------+---------------+---------+------------------+
| z0_col0        | z0_col1 | z0_col2           | z1_col0       | z1_col1 | z1_col2          |
+----------------+---------+-------------------+---------------+---------+------------------+
| NULL           | NULL    | NULL              | NULL          | NULL    | NULL             |
| 0              | 0       | 00                | 0             | 0       | 00               |
| 100            | 10.00   | 10010.00          | 200           | 20.00   | 20020.00         |
| virtual_table1 | one     | virtual_table1one | stored_table2 | two     | stored_table2two |
+----------------+---------+-------------------+---------------+---------+------------------+
insert into view1 (z0_col0,z0_col1,z1_col0,z1_col1) values ('view-','-insert1','view-','-insert2');
ERROR HY000: Can not modify more than one base table through a join view 'whh.view1'
### ALTER TABLE 语句
# RENAME 重命名表
drop table test_table;
create table test_table(
z0_col0 float, 
z0_col1 float,
z0_col2 float as(z0_col0+z0_col1) virtual,
z0_col3 float as(floor(z0_col0+z0_col1)) stored
);
insert into test_table (z0_col0,z0_col1) values (0,0),(NULL,NULL),(1.111,22.2),(10.5,10.9),(-100.5,20.9);
select z0_col0,z0_col1,z0_col2,abs(z0_col3) from test_table order by z0_col2;
+---------+---------+---------+--------------+
| z0_col0 | z0_col1 | z0_col2 | abs(z0_col3) |
+---------+---------+---------+--------------+
|    NULL |    NULL |    NULL |         NULL |
|  -100.5 |    20.9 |   -79.6 |           80 |
|       0 |       0 |       0 |            0 |
|    10.5 |    10.9 |    21.4 |           21 |
|   1.111 |    22.2 |  23.311 |           23 |
+---------+---------+---------+--------------+
select max(z0_col2),min(z0_col3) from test_table order by z0_col2;
+--------------+--------------+
| max(z0_col2) | min(z0_col3) |
+--------------+--------------+
|       23.311 |          -80 |
+--------------+--------------+
drop table new_test_table;
alter table test_table rename to new_test_table;
insert into new_test_table (z0_col0,z0_col1) values (100,200);
select z0_col0,z0_col1,z0_col2,abs(z0_col3) from new_test_table order by z0_col2;
+---------+---------+---------+--------------+
| z0_col0 | z0_col1 | z0_col2 | abs(z0_col3) |
+---------+---------+---------+--------------+
|    NULL |    NULL |    NULL |         NULL |
|  -100.5 |    20.9 |   -79.6 |           80 |
|       0 |       0 |       0 |            0 |
|    10.5 |    10.9 |    21.4 |           21 |
|   1.111 |    22.2 |  23.311 |           23 |
|     100 |     200 |     300 |          300 |
+---------+---------+---------+--------------+
# RENAME COLUMN 重命名生成列 ob不支持重命名列名，报ERROR 1064.
drop table test_table1;
create table test_table1(
z0_col0 int,
z0_col1 int,
z0_col2 int as(abs(z0_col0)) virtual,
z0_col3 int as(power(z0_col1,2)) stored
);
insert into test_table1 (z0_col0,z0_col1) values (0,10),(-20,20),(3.50,30);
select * from test_table1 order by z0_col2;
+---------+---------+---------+---------+
| z0_col0 | z0_col1 | z0_col2 | z0_col3 |
+---------+---------+---------+---------+
|       0 |      10 |       0 |     100 |
|       4 |      30 |       4 |     900 |
|     -20 |      20 |      20 |     400 |
+---------+---------+---------+---------+
alter table test_table1 rename column z0_col2 to new_z0_col2;
alter table test_table1 rename column z0_col3 to new_z0_col3;
insert into new_test_table (z0_col0,z0_col1) values (5.5,10.6);
select z0_col0,z0_col1,z0_col2,abs(z0_col3) from new_test_table order by z0_col2;
+---------+---------+---------+--------------+
| z0_col0 | z0_col1 | z0_col2 | abs(z0_col3) |
+---------+---------+---------+--------------+
|    NULL |    NULL |    NULL |         NULL |
|  -100.5 |    20.9 |   -79.6 |           80 |
|       0 |       0 |       0 |            0 |
|     5.5 |    10.6 |    16.1 |           16 |
|    10.5 |    10.9 |    21.4 |           21 |
|   1.111 |    22.2 |  23.311 |           23 |
|     100 |     200 |     300 |          300 |
+---------+---------+---------+--------------+
# RENAME COLUMN 重命名生成列引用的普通列
alter table test_table1 rename column z0_col0 to new_z0_col0;
ERROR HY000: Column 'z0_col0' has a generated column dependency
insert into new_test_table (z0_col0,z0_col1) values (-40,5);
select z0_col0,z0_col1,z0_col2,abs(z0_col3) from new_test_table order by z0_col2;
+---------+---------+---------+--------------+
| z0_col0 | z0_col1 | z0_col2 | abs(z0_col3) |
+---------+---------+---------+--------------+
|    NULL |    NULL |    NULL |         NULL |
|  -100.5 |    20.9 |   -79.6 |           80 |
|     -40 |       5 |     -35 |           35 |
|       0 |       0 |       0 |            0 |
|     5.5 |    10.6 |    16.1 |           16 |
|    10.5 |    10.9 |    21.4 |           21 |
|   1.111 |    22.2 |  23.311 |           23 |
|     100 |     200 |     300 |          300 |
+---------+---------+---------+--------------+
# MODIFY 修改生成列 虚拟生成列-》存储生成列
drop table test_table;
create table test_table(
z0_col0 float, 
z0_col1 float,
z0_col2 float as(z0_col0/z0_col1) virtual
);
insert into test_table (z0_col0,z0_col1) values (0,0),(NULL,NULL),(1.111,22.2),(10.5,10.9),(-100.5,20.9);
select z0_col0,z0_col1,z0_col2 from test_table order by z0_col2;
+---------+---------+----------+
| z0_col0 | z0_col1 | z0_col2  |
+---------+---------+----------+
|       0 |       0 |     NULL |
|    NULL |    NULL |     NULL |
|  -100.5 |    20.9 | -4.80861 |
|   1.111 |    22.2 | 0.050045 |
|    10.5 |    10.9 | 0.963303 |
+---------+---------+----------+
alter table test_table modify z0_col2 float as(z0_col0/z0_col1) stored;
Got one of the listed errors
# MODIFY 修改生成列 虚拟生成列-》普通列
drop table test_table;
create table test_table(
z0_col0 float, 
z0_col1 float,
z0_col2 float as(z0_col0/z0_col1) virtual
);
insert into test_table (z0_col0,z0_col1) values (0,0),(NULL,NULL),(1.111,22.2),(10.5,10.9),(-100.5,20.9);
select z0_col0,z0_col1,z0_col2 from test_table order by z0_col2;
+---------+---------+----------+
| z0_col0 | z0_col1 | z0_col2  |
+---------+---------+----------+
|       0 |       0 |     NULL |
|    NULL |    NULL |     NULL |
|  -100.5 |    20.9 | -4.80861 |
|   1.111 |    22.2 | 0.050045 |
|    10.5 |    10.9 | 0.963303 |
+---------+---------+----------+
alter table test_table modify z0_col2 float;
Got one of the listed errors
# MODIFY 修改生成列 存储生成列-》虚拟生成列
drop table test_table;
create table test_table(
z0_col0 float, 
z0_col1 float,
z0_col2 float as(z0_col0/z0_col1) stored
);
insert into test_table (z0_col0,z0_col1) values (0,0),(NULL,NULL),(1.111,22.2),(10.5,10.9),(-100.5,20.9);
select z0_col0,z0_col1,z0_col2 from test_table order by z0_col2;
+---------+---------+----------+
| z0_col0 | z0_col1 | z0_col2  |
+---------+---------+----------+
|       0 |       0 |     NULL |
|    NULL |    NULL |     NULL |
|  -100.5 |    20.9 | -4.80861 |
|   1.111 |    22.2 | 0.050045 |
|    10.5 |    10.9 | 0.963303 |
+---------+---------+----------+
alter table test_table modify z0_col2 float as(z0_col0/z0_col1) virtual;
Got one of the listed errors
show create table test_table;
Table	Create Table
test_table	CREATE TABLE `test_table` (
  `z0_col0` float DEFAULT NULL,
  `z0_col1` float DEFAULT NULL,
  `z0_col2` float GENERATED ALWAYS AS ((`z0_col0` / `z0_col1`)) STORED
) ORGANIZATION INDEX DEFAULT CHARSET = utf8mb4 ROW_FORMAT = DYNAMIC COMPRESSION = 'zstd_1.3.8' REPLICA_NUM = 1 BLOCK_SIZE = 16384 USE_BLOOM_FILTER = FALSE ENABLE_MACRO_BLOCK_BLOOM_FILTER = FALSE TABLET_SIZE = 134217728 PCTFREE = 0
# MODIFY 修改生成列 存储生成列-》普通列
# bug1:【Generated Columns】OB Mysql模式，将存储生成列更改为普通列,mysql成功，ob失败。
drop table test_table;
create table test_table(
z0_col0 float, 
z0_col1 float,
z0_col2 float as(z0_col0/z0_col1) stored
);
insert into test_table (z0_col0,z0_col1) values (0,0),(NULL,NULL),(1.111,22.2),(10.5,10.9),(-100.5,20.9);
select z0_col0,z0_col1,z0_col2 from test_table order by z0_col2;
+---------+---------+----------+
| z0_col0 | z0_col1 | z0_col2  |
+---------+---------+----------+
|       0 |       0 |     NULL |
|    NULL |    NULL |     NULL |
|  -100.5 |    20.9 | -4.80861 |
|   1.111 |    22.2 | 0.050045 |
|    10.5 |    10.9 | 0.963303 |
+---------+---------+----------+
alter table test_table modify z0_col2 float;
Got one of the listed errors
select z0_col0,z0_col1,z0_col2 from test_table order by z0_col2;
+---------+---------+----------+
| z0_col0 | z0_col1 | z0_col2  |
+---------+---------+----------+
|       0 |       0 |     NULL |
|    NULL |    NULL |     NULL |
|  -100.5 |    20.9 | -4.80861 |
|   1.111 |    22.2 | 0.050045 |
|    10.5 |    10.9 | 0.963303 |
+---------+---------+----------+
show create table test_table;
Table	Create Table
test_table	CREATE TABLE `test_table` (
  `z0_col0` float DEFAULT NULL,
  `z0_col1` float DEFAULT NULL,
  `z0_col2` float GENERATED ALWAYS AS ((`z0_col0` / `z0_col1`)) STORED
) ORGANIZATION INDEX DEFAULT CHARSET = utf8mb4 ROW_FORMAT = DYNAMIC COMPRESSION = 'zstd_1.3.8' REPLICA_NUM = 1 BLOCK_SIZE = 16384 USE_BLOOM_FILTER = FALSE ENABLE_MACRO_BLOCK_BLOOM_FILTER = FALSE TABLET_SIZE = 134217728 PCTFREE = 0
# MODIFY 修改生成列 普通列-》虚拟生成列
drop table test_table;
create table test_table(
z0_col0 float, 
z0_col1 float,
z0_col2 float
);
insert into test_table (z0_col0,z0_col1) values (0,0),(NULL,NULL),(1.111,22.2),(10.5,10.9),(-100.5,20.9);
select z0_col0,z0_col1,z0_col2 from test_table order by z0_col2;
+---------+---------+---------+
| z0_col0 | z0_col1 | z0_col2 |
+---------+---------+---------+
|       0 |       0 |    NULL |
|    NULL |    NULL |    NULL |
|   1.111 |    22.2 |    NULL |
|    10.5 |    10.9 |    NULL |
|  -100.5 |    20.9 |    NULL |
+---------+---------+---------+
alter table test_table modify z0_col2 float as(z0_col0/z0_col1) virtual;
Got one of the listed errors
select z0_col0,z0_col1,z0_col2 from test_table order by z0_col2;
+---------+---------+---------+
| z0_col0 | z0_col1 | z0_col2 |
+---------+---------+---------+
|       0 |       0 |    NULL |
|    NULL |    NULL |    NULL |
|   1.111 |    22.2 |    NULL |
|    10.5 |    10.9 |    NULL |
|  -100.5 |    20.9 |    NULL |
+---------+---------+---------+
show create table test_table;
Table	Create Table
test_table	CREATE TABLE `test_table` (
  `z0_col0` float DEFAULT NULL,
  `z0_col1` float DEFAULT NULL,
  `z0_col2` float DEFAULT NULL
) ORGANIZATION INDEX DEFAULT CHARSET = utf8mb4 ROW_FORMAT = DYNAMIC COMPRESSION = 'zstd_1.3.8' REPLICA_NUM = 1 BLOCK_SIZE = 16384 USE_BLOOM_FILTER = FALSE ENABLE_MACRO_BLOCK_BLOOM_FILTER = FALSE TABLET_SIZE = 134217728 PCTFREE = 0
# MODIFY 修改生成列 普通列-》存储生成列
# bug2:【Generated Columns】OB Mysql模式，将普通列更改为存储生成列,mysql成功，ob失败。
drop table test_table;
create table test_table(
z0_col0 float, 
z0_col1 float,
z0_col2 float
);
insert into test_table (z0_col0,z0_col1) values (0,0),(NULL,NULL),(1.111,22.2),(10.5,10.9),(-100.5,20.9);
select z0_col0,z0_col1,z0_col2 from test_table order by z0_col2;
+---------+---------+---------+
| z0_col0 | z0_col1 | z0_col2 |
+---------+---------+---------+
|       0 |       0 |    NULL |
|    NULL |    NULL |    NULL |
|   1.111 |    22.2 |    NULL |
|    10.5 |    10.9 |    NULL |
|  -100.5 |    20.9 |    NULL |
+---------+---------+---------+
alter table test_table modify z0_col2 float as(z0_col0/z0_col1) stored;
Got one of the listed errors
insert into test_table (z0_col0,z0_col1) values (10,40);
select z0_col0,z0_col1,z0_col2 from test_table order by z0_col2;
+---------+---------+---------+
| z0_col0 | z0_col1 | z0_col2 |
+---------+---------+---------+
|       0 |       0 |    NULL |
|    NULL |    NULL |    NULL |
|   1.111 |    22.2 |    NULL |
|    10.5 |    10.9 |    NULL |
|  -100.5 |    20.9 |    NULL |
|      10 |      40 |    NULL |
+---------+---------+---------+
show create table test_table;
Table	Create Table
test_table	CREATE TABLE `test_table` (
  `z0_col0` float DEFAULT NULL,
  `z0_col1` float DEFAULT NULL,
  `z0_col2` float DEFAULT NULL
) ORGANIZATION INDEX DEFAULT CHARSET = utf8mb4 ROW_FORMAT = DYNAMIC COMPRESSION = 'zstd_1.3.8' REPLICA_NUM = 1 BLOCK_SIZE = 16384 USE_BLOOM_FILTER = FALSE ENABLE_MACRO_BLOCK_BLOOM_FILTER = FALSE TABLET_SIZE = 134217728 PCTFREE = 0
# MODIFY 修改生成列的数据类型
# bug3:【Generated Columns】OB Mysql模式，修改生成列的数据类型（modify/change）,mysql成功，ob失败。
drop table test_table1;
create table test_table1(
z0_col0 float,
z0_col1 float,
z0_col2 int as(floor(z0_col0)) virtual,
z0_col3 int as(ceiling(z0_col1)) stored
);
insert into test_table1 (z0_col0,z0_col1) values (1.2,1.8),(2.4,2.6),(3.5,3.3);
select * from test_table1 order by z0_col2;
+---------+---------+---------+---------+
| z0_col0 | z0_col1 | z0_col2 | z0_col3 |
+---------+---------+---------+---------+
|     1.2 |     1.8 |       1 |       2 |
|     2.4 |     2.6 |       2 |       3 |
|     3.5 |     3.3 |       3 |       4 |
+---------+---------+---------+---------+
alter table test_table1 modify z0_col2 double as(floor(z0_col0)) virtual;
alter table test_table1 modify z0_col3 double as(ceiling(z0_col0)) stored;
Got one of the listed errors
insert into test_table1 (z0_col0,z0_col1) values (5.123,5.678);
select * from test_table1 order by z0_col2;
+---------+---------+---------+---------+
| z0_col0 | z0_col1 | z0_col2 | z0_col3 |
+---------+---------+---------+---------+
|     1.2 |     1.8 |       1 |       2 |
|     2.4 |     2.6 |       2 |       3 |
|     3.5 |     3.3 |       3 |       4 |
|   5.123 |   5.678 |       5 |       6 |
+---------+---------+---------+---------+
# MODIFY 修改生成列引用的普通列
alter table test_table1 modify z0_col0 double;
alter table test_table1 modify z0_col1 double;
insert into test_table1 (z0_col0,z0_col1) values (4.123,4.678);
select * from test_table1 order by z0_col2;
+--------------------+--------------------+---------+---------+
| z0_col0            | z0_col1            | z0_col2 | z0_col3 |
+--------------------+--------------------+---------+---------+
| 1.2000000476837158 | 1.7999999523162842 |       1 |       2 |
| 2.4000000953674316 | 2.5999999046325684 |       2 |       3 |
|                3.5 |  3.299999952316284 |       3 |       4 |
|              4.123 |              4.678 |       4 |       5 |
|  5.123000144958496 |  5.677999973297119 |       5 |       6 |
+--------------------+--------------------+---------+---------+
# CHANGE 修改生成列
# bug3:【Generated Columns】OB Mysql模式，修改生成列的数据类型（modify/change）,mysql成功，ob失败。
drop table test_table1;
create table test_table1(
z0_col0 char(200),
z0_col1 char(200),
z0_col2 char(200) as(upper(z0_col0)) virtual,
z0_col3 char(200) as(concat(z0_col0,z0_col1)) stored
);
insert into test_table1 (z0_col0,z0_col1) values ('mysql 8.0 ',' one'),('oracle 11g ',' two'),('oceanbase 4.0 ',' three');
select * from test_table1 order by z0_col2;
+---------------+---------+---------------+---------------------+
| z0_col0       | z0_col1 | z0_col2       | z0_col3             |
+---------------+---------+---------------+---------------------+
| mysql 8.0     |  one    | MYSQL 8.0     | mysql 8.0 one       |
| oceanbase 4.0 |  three  | OCEANBASE 4.0 | oceanbase 4.0 three |
| oracle 11g    |  two    | ORACLE 11G    | oracle 11g two      |
+---------------+---------+---------------+---------------------+
alter table test_table1 change z0_col2 z0_col22 varchar(200) as(upper(z0_col0)) virtual;
alter table test_table1 change z0_col3 z0_col33 varchar(200) as(concat(z0_col0,z0_col1)) stored;
insert into test_table1 (z0_col0,z0_col1) values (5,5);
select * from test_table1 order by z0_col22;
+---------------+---------+---------------+---------------------+
| z0_col0       | z0_col1 | z0_col22      | z0_col33            |
+---------------+---------+---------------+---------------------+
| 5             | 5       | 5             | 55                  |
| mysql 8.0     |  one    | MYSQL 8.0     | mysql 8.0 one       |
| oceanbase 4.0 |  three  | OCEANBASE 4.0 | oceanbase 4.0 three |
| oracle 11g    |  two    | ORACLE 11G    | oracle 11g two      |
+---------------+---------+---------------+---------------------+
show create table test_table1;
Table	Create Table
test_table1	CREATE TABLE `test_table1` (
  `z0_col0` char(200) DEFAULT NULL,
  `z0_col1` char(200) DEFAULT NULL,
  `z0_col22` varchar(200) GENERATED ALWAYS AS (upper(`z0_col0`)) VIRTUAL,
  `z0_col33` varchar(200) GENERATED ALWAYS AS (concat(`z0_col0`,`z0_col1`)) STORED
) ORGANIZATION INDEX DEFAULT CHARSET = utf8mb4 ROW_FORMAT = DYNAMIC COMPRESSION = 'zstd_1.3.8' REPLICA_NUM = 1 BLOCK_SIZE = 16384 USE_BLOOM_FILTER = FALSE ENABLE_MACRO_BLOCK_BLOOM_FILTER = FALSE TABLET_SIZE = 134217728 PCTFREE = 0
# CHANGE 修改生成列引用的普通列
# bug4:【Generated Columns】OB Mysql模式，修改生成列引用的普通列（change）,mysql失败，ob成功。
drop table test_table1;
create table test_table1(
z0_col0 char(200),
z0_col1 char(200),
z0_col2 char(200) as(upper(z0_col0)) virtual,
z0_col3 char(200) as(concat(z0_col0,z0_col1)) stored
);
insert into test_table1 (z0_col0,z0_col1) values ('mysql 8.0 ',' one'),('oracle 11g ',' two'),('oceanbase 4.0 ',' three');
select * from test_table1 order by z0_col2;
+---------------+---------+---------------+---------------------+
| z0_col0       | z0_col1 | z0_col2       | z0_col3             |
+---------------+---------+---------------+---------------------+
| mysql 8.0     |  one    | MYSQL 8.0     | mysql 8.0 one       |
| oceanbase 4.0 |  three  | OCEANBASE 4.0 | oceanbase 4.0 three |
| oracle 11g    |  two    | ORACLE 11G    | oracle 11g two      |
+---------------+---------+---------------+---------------------+
alter table test_table1 change z0_col0 z0_col00 varchar(200);
alter table test_table1 change z0_col1 z0_col11 varchar(200);
insert into test_table1 (z0_col00,z0_col11) values ('pl/sql ',' add');
select * from test_table1 order by z0_col2;
+---------------+----------+---------------+---------------------+
| z0_col00      | z0_col11 | z0_col2       | z0_col3             |
+---------------+----------+---------------+---------------------+
| mysql 8.0     |  one     | MYSQL 8.0     | mysql 8.0 one       |
| oceanbase 4.0 |  three   | OCEANBASE 4.0 | oceanbase 4.0 three |
| oracle 11g    |  two     | ORACLE 11G    | oracle 11g two      |
| pl/sql        |  add     | PL/SQL        | pl/sql  add         |
+---------------+----------+---------------+---------------------+
show create table test_table1;
Table	Create Table
test_table1	CREATE TABLE `test_table1` (
  `z0_col00` varchar(200) DEFAULT NULL,
  `z0_col11` varchar(200) DEFAULT NULL,
  `z0_col2` char(200) GENERATED ALWAYS AS (upper(`z0_col00`)) VIRTUAL,
  `z0_col3` char(200) GENERATED ALWAYS AS (concat(`z0_col00`,`z0_col11`)) STORED
) ORGANIZATION INDEX DEFAULT CHARSET = utf8mb4 ROW_FORMAT = DYNAMIC COMPRESSION = 'zstd_1.3.8' REPLICA_NUM = 1 BLOCK_SIZE = 16384 USE_BLOOM_FILTER = FALSE ENABLE_MACRO_BLOCK_BLOOM_FILTER = FALSE TABLET_SIZE = 134217728 PCTFREE = 0
# DROP 删除生成列
drop table test_table1;
create table test_table1(
z0_col0 char(200),
z0_col1 char(200),
z0_col2 char(200) as(upper(z0_col0)) virtual,
z0_col3 char(200) as(concat(z0_col0,z0_col1)) stored
);
insert into test_table1 (z0_col0,z0_col1) values ('mysql 8.0 ',' one'),('oracle 11g ',' two'),('oceanbase 4.0 ',' three');
select * from test_table1 order by z0_col2;
+---------------+---------+---------------+---------------------+
| z0_col0       | z0_col1 | z0_col2       | z0_col3             |
+---------------+---------+---------------+---------------------+
| mysql 8.0     |  one    | MYSQL 8.0     | mysql 8.0 one       |
| oceanbase 4.0 |  three  | OCEANBASE 4.0 | oceanbase 4.0 three |
| oracle 11g    |  two    | ORACLE 11G    | oracle 11g two      |
+---------------+---------+---------------+---------------------+
alter table test_table1 drop z0_col2;
alter table test_table1 drop z0_col3;
insert into test_table1 (z0_col0,z0_col1) values ('pl/sql ',' add');
select * from test_table1 order by z0_col0;
+---------------+---------+
| z0_col0       | z0_col1 |
+---------------+---------+
| mysql 8.0     |  one    |
| oceanbase 4.0 |  three  |
| oracle 11g    |  two    |
| pl/sql        |  add    |
+---------------+---------+
show create table test_table1;
Table	Create Table
test_table1	CREATE TABLE `test_table1` (
  `z0_col0` char(200) DEFAULT NULL,
  `z0_col1` char(200) DEFAULT NULL
) ORGANIZATION INDEX DEFAULT CHARSET = utf8mb4 ROW_FORMAT = DYNAMIC COMPRESSION = 'zstd_1.3.8' REPLICA_NUM = 1 BLOCK_SIZE = 16384 USE_BLOOM_FILTER = FALSE ENABLE_MACRO_BLOCK_BLOOM_FILTER = FALSE TABLET_SIZE = 134217728 PCTFREE = 0
# DROP 删除生成列引用的普通列
drop table test_table1;
create table test_table1(
z0_col0 char(200),
z0_col1 char(200),
z0_col2 char(200) as(upper(z0_col0)) virtual,
z0_col3 char(200) as(concat(z0_col0,z0_col1)) stored
);
insert into test_table1 (z0_col0,z0_col1) values ('mysql 8.0 ',' one'),('oracle 11g ',' two'),('oceanbase 4.0 ',' three');
select * from test_table1 order by z0_col2;
+---------------+---------+---------------+---------------------+
| z0_col0       | z0_col1 | z0_col2       | z0_col3             |
+---------------+---------+---------------+---------------------+
| mysql 8.0     |  one    | MYSQL 8.0     | mysql 8.0 one       |
| oceanbase 4.0 |  three  | OCEANBASE 4.0 | oceanbase 4.0 three |
| oracle 11g    |  two    | ORACLE 11G    | oracle 11g two      |
+---------------+---------+---------------+---------------------+
alter table test_table1 drop z0_col0;
ERROR HY000: Column 'z0_col0' has a generated column dependency
alter table test_table1 drop z0_col1;
ERROR HY000: Column 'z0_col1' has a generated column dependency
insert into test_table1 (z0_col0,z0_col1) values ('pl/sql ',' add');
select * from test_table1 order by z0_col0;
+---------------+---------+---------------+---------------------+
| z0_col0       | z0_col1 | z0_col2       | z0_col3             |
+---------------+---------+---------------+---------------------+
| mysql 8.0     |  one    | MYSQL 8.0     | mysql 8.0 one       |
| oceanbase 4.0 |  three  | OCEANBASE 4.0 | oceanbase 4.0 three |
| oracle 11g    |  two    | ORACLE 11G    | oracle 11g two      |
| pl/sql        |  add    | PL/SQL        | pl/sql add          |
+---------------+---------+---------------+---------------------+
show create table test_table1;
Table	Create Table
test_table1	CREATE TABLE `test_table1` (
  `z0_col0` char(200) DEFAULT NULL,
  `z0_col1` char(200) DEFAULT NULL,
  `z0_col2` char(200) GENERATED ALWAYS AS (upper(`z0_col0`)) VIRTUAL,
  `z0_col3` char(200) GENERATED ALWAYS AS (concat(`z0_col0`,`z0_col1`)) STORED
) ORGANIZATION INDEX DEFAULT CHARSET = utf8mb4 ROW_FORMAT = DYNAMIC COMPRESSION = 'zstd_1.3.8' REPLICA_NUM = 1 BLOCK_SIZE = 16384 USE_BLOOM_FILTER = FALSE ENABLE_MACRO_BLOCK_BLOOM_FILTER = FALSE TABLET_SIZE = 134217728 PCTFREE = 0
############ mysql_genrate-1-4 DML
### SELECT 语句
# LIMIT 子句
drop table test_table;
create table test_table(
z0_col0 float, 
z0_col1 float,
z0_col2 float as(z0_col0+z0_col1) virtual,
z0_col3 float as(z0_col0*z0_col1) stored
);
insert into test_table (z0_col0,z0_col1) values (0,0),(NULL,NULL),(2,9),(10,15),(-100,20);
select z0_col0,z0_col1,z0_col2,z0_col3 from test_table order by z0_col2 limit z0_col2;
ERROR 42000: You have an error in your SQL syntax; check the manual that corresponds to your OceanBase version for the right syntax to use near 'z0_col2' at line 1
select z0_col0,z0_col1,z0_col2,z0_col3 from test_table order by z0_col2 limit z0_col3;
ERROR 42000: You have an error in your SQL syntax; check the manual that corresponds to your OceanBase version for the right syntax to use near 'z0_col3' at line 1
select z0_col0,z0_col1,z0_col2,z0_col3 from test_table order by z0_col2 limit 5;
+---------+---------+---------+---------+
| z0_col0 | z0_col1 | z0_col2 | z0_col3 |
+---------+---------+---------+---------+
|    NULL |    NULL |    NULL |    NULL |
|    -100 |      20 |     -80 |   -2000 |
|       0 |       0 |       0 |       0 |
|       2 |       9 |      11 |      18 |
|      10 |      15 |      25 |     150 |
+---------+---------+---------+---------+
select z0_col0,z0_col1,abs(z0_col2),z0_col3 from test_table order by z0_col2 limit 5;
+---------+---------+--------------+---------+
| z0_col0 | z0_col1 | abs(z0_col2) | z0_col3 |
+---------+---------+--------------+---------+
|    NULL |    NULL |         NULL |    NULL |
|    -100 |      20 |           80 |   -2000 |
|       0 |       0 |            0 |       0 |
|       2 |       9 |           11 |      18 |
|      10 |      15 |           25 |     150 |
+---------+---------+--------------+---------+
# SELECT ... INTO 语句
drop table test_table;
create table test_table(
z0_col0 float, 
z0_col1 float,
z0_col2 float as(z0_col0+z0_col1) virtual,
z0_col3 float as(z0_col0*z0_col1) stored
);
insert into test_table (z0_col0,z0_col1) values (0,0),(NULL,NULL),(2,9),(10,15),(-100,20);
select z0_col2,z0_col3 into @p1,@p2 from test_table where abs(z0_col2) > 50 and z0_col3 != 0 order by z0_col2;
select @p1,@p2;
+------+-------+
| @p1  | @p2   |
+------+-------+
|  -80 | -2000 |
+------+-------+
# select 生成列间运算 from table;
drop table test_table;
create table test_table(
z0_col0 float, 
z0_col1 float,
z0_col2 float as(z0_col0+z0_col1) virtual,
z0_col3 float as(z0_col0*z0_col1) stored
);
select avg(z0_col2),sum(z0_col3) from test_table;
+--------------+--------------+
| avg(z0_col2) | sum(z0_col3) |
+--------------+--------------+
|         NULL |         NULL |
+--------------+--------------+
insert into test_table (z0_col0,z0_col1) values (0,0),(NULL,NULL),(2,9),(10,15),(-100,20);
select z0_col0,z0_col1,z0_col2+2*9-1/2,z0_col3+2*9-1/2 from test_table order by z0_col2;
+---------+---------+-----------------+-----------------+
| z0_col0 | z0_col1 | z0_col2+2*9-1/2 | z0_col3+2*9-1/2 |
+---------+---------+-----------------+-----------------+
|    NULL |    NULL |            NULL |            NULL |
|    -100 |      20 |           -62.5 |         -1982.5 |
|       0 |       0 |            17.5 |            17.5 |
|       2 |       9 |            28.5 |            35.5 |
|      10 |      15 |            42.5 |           167.5 |
+---------+---------+-----------------+-----------------+
select z0_col0,z0_col1,z0_col2,z0_col3 from test_table order by z0_col2;
+---------+---------+---------+---------+
| z0_col0 | z0_col1 | z0_col2 | z0_col3 |
+---------+---------+---------+---------+
|    NULL |    NULL |    NULL |    NULL |
|    -100 |      20 |     -80 |   -2000 |
|       0 |       0 |       0 |       0 |
|       2 |       9 |      11 |      18 |
|      10 |      15 |      25 |     150 |
+---------+---------+---------+---------+
select z0_col0,z0_col1,z0_col2+z0_col3 from test_table order by z0_col2;
+---------+---------+-----------------+
| z0_col0 | z0_col1 | z0_col2+z0_col3 |
+---------+---------+-----------------+
|    NULL |    NULL |            NULL |
|    -100 |      20 |           -2080 |
|       0 |       0 |               0 |
|       2 |       9 |              29 |
|      10 |      15 |             175 |
+---------+---------+-----------------+
select z0_col0,z0_col1+z0_col2,z0_col3 from test_table order by z0_col2;
+---------+-----------------+---------+
| z0_col0 | z0_col1+z0_col2 | z0_col3 |
+---------+-----------------+---------+
|    NULL |            NULL |    NULL |
|    -100 |             -60 |   -2000 |
|       0 |               0 |       0 |
|       2 |              20 |      18 |
|      10 |              40 |     150 |
+---------+-----------------+---------+
select avg(z0_col2),sum(z0_col3) from test_table where z0_col2 > 0 order by z0_col2;
+--------------+--------------+
| avg(z0_col2) | sum(z0_col3) |
+--------------+--------------+
|           18 |          168 |
+--------------+--------------+
select z0_col2 > z0_col3 from test_table order by z0_col2;
+-------------------+
| z0_col2 > z0_col3 |
+-------------------+
|              NULL |
|                 1 |
|                 0 |
|                 0 |
|                 0 |
+-------------------+
select z0_col2 and z0_col3 from test_table order by z0_col2;
+---------------------+
| z0_col2 and z0_col3 |
+---------------------+
|                NULL |
|                   1 |
|                   0 |
|                   1 |
|                   1 |
+---------------------+
# 子查询 作为标量操作数的子查询
drop table test_table1;
create table test_table1(
z0_col0 double, 
z0_col1 double,
z0_col2 double as(z0_col0+z0_col1) virtual,
z0_col3 double as(z0_col0*z0_col1) stored
);
select (select z0_col2 from test_table1);
+-----------------------------------+
| (select z0_col2 from test_table1) |
+-----------------------------------+
|                              NULL |
+-----------------------------------+
insert into test_table1 (z0_col0,z0_col1) values (0,0),(NULL,NULL),(2.5,9.9),(-10,15),(1.0E+10,2.0E+10);
select z0_col0,z0_col1,z0_col2,z0_col3 from test_table1 order by z0_col2;
+-------------+-------------+-------------+---------+
| z0_col0     | z0_col1     | z0_col2     | z0_col3 |
+-------------+-------------+-------------+---------+
|        NULL |        NULL |        NULL |    NULL |
|           0 |           0 |           0 |       0 |
|         -10 |          15 |           5 |    -150 |
|         2.5 |         9.9 |        12.4 |   24.75 |
| 10000000000 | 20000000000 | 30000000000 |    2e20 |
+-------------+-------------+-------------+---------+
drop table test_table2;
create table test_table2(
z0_col0 char(200), 
z0_col1 char(200), 
z0_col2 char(200) as(concat(z0_col0,z0_col1)) virtual,
z0_col3 char(200) as(upper(concat(z0_col0,z0_col1))) stored
);
select (select z0_col2 from test_table2);
+-----------------------------------+
| (select z0_col2 from test_table2) |
+-----------------------------------+
| NULL                              |
+-----------------------------------+
insert into test_table2 (z0_col0,z0_col1) values (0,0),(NULL,NULL),(2022,0621),('2022-06-21 ',' 14:30:00'),('welloe come to ',' beijing');
select z0_col0,z0_col1,z0_col2,z0_col3 from test_table2 order by z0_col2;
+----------------+-----------+------------------------+------------------------+
| z0_col0        | z0_col1   | z0_col2                | z0_col3                |
+----------------+-----------+------------------------+------------------------+
| NULL           | NULL      | NULL                   | NULL                   |
| 0              | 0         | 00                     | 00                     |
| 2022-06-21     |  14:30:00 | 2022-06-21 14:30:00    | 2022-06-21 14:30:00    |
| 2022           | 621       | 2022621                | 2022621                |
| welloe come to |  beijing  | welloe come to beijing | WELLOE COME TO BEIJING |
+----------------+-----------+------------------------+------------------------+
select (select z0_col2 from test_table1 where z0_col2 > 20 order by 1);
+-----------------------------------------------------------------+
| (select z0_col2 from test_table1 where z0_col2 > 20 order by 1) |
+-----------------------------------------------------------------+
|                                                     30000000000 |
+-----------------------------------------------------------------+
select (select z0_col3 from test_table1 where z0_col3 between 20 and 30 order by 1);
+------------------------------------------------------------------------------+
| (select z0_col3 from test_table1 where z0_col3 between 20 and 30 order by 1) |
+------------------------------------------------------------------------------+
|                                                                        24.75 |
+------------------------------------------------------------------------------+
select (select z0_col2 from test_table2 where z0_col2 like '%to%' order by 1);
+------------------------------------------------------------------------+
| (select z0_col2 from test_table2 where z0_col2 like '%to%' order by 1) |
+------------------------------------------------------------------------+
| welloe come to beijing                                                 |
+------------------------------------------------------------------------+
select (select z0_col3 from test_table2 where z0_col3 like '%TO%' order by 1);
+------------------------------------------------------------------------+
| (select z0_col3 from test_table2 where z0_col3 like '%TO%' order by 1) |
+------------------------------------------------------------------------+
| WELLOE COME TO BEIJING                                                 |
+------------------------------------------------------------------------+
select (select z0_col2 from test_table1 where z0_col2 > 20) from test_table2 order by z0_col2;
+------------------------------------------------------+
| (select z0_col2 from test_table1 where z0_col2 > 20) |
+------------------------------------------------------+
|                                          30000000000 |
|                                          30000000000 |
|                                          30000000000 |
|                                          30000000000 |
|                                          30000000000 |
+------------------------------------------------------+
select lower((select z0_col3 from test_table2 where z0_col3 like '%TO%')) from test_table1 order by z0_col2;
+--------------------------------------------------------------------+
| lower((select z0_col3 from test_table2 where z0_col3 like '%TO%')) |
+--------------------------------------------------------------------+
| welloe come to beijing                                             |
| welloe come to beijing                                             |
| welloe come to beijing                                             |
| welloe come to beijing                                             |
| welloe come to beijing                                             |
+--------------------------------------------------------------------+
# 子查询 使用子查询进行比较
drop table test_table1;
create table test_table1(
z0_col0 int, 
z0_col1 int,
z0_col2 int as(z0_col0+z0_col1) virtual,
z0_col3 int as(z0_col0-z0_col1) stored
);
insert into test_table1 (z0_col0,z0_col1) values (0,0),(NULL,NULL),(1,1),(1,2),(42.5,9.9),(-10,15),(2.0E+2,1.0E+2);
select z0_col0,z0_col1,z0_col2,z0_col3 from test_table1 order by z0_col2;
+---------+---------+---------+---------+
| z0_col0 | z0_col1 | z0_col2 | z0_col3 |
+---------+---------+---------+---------+
|    NULL |    NULL |    NULL |    NULL |
|       0 |       0 |       0 |       0 |
|       1 |       1 |       2 |       0 |
|       1 |       2 |       3 |      -1 |
|     -10 |      15 |       5 |     -25 |
|      43 |      10 |      53 |      33 |
|     200 |     100 |     300 |     100 |
+---------+---------+---------+---------+
drop table test_table2;
create table test_table2(
z0_col0 int, 
z0_col1 int,
z0_col2 int as(z0_col0*z0_col1) virtual,
z0_col3 int as(z0_col0/z0_col1) stored
);
insert into test_table2 (z0_col0,z0_col1) values (0,0),(0,0),(1,1),(NULL,NULL),(29.5,9.9),(-10,15),(2.0E+2,1.0E+2);
select z0_col0,z0_col1,z0_col2,z0_col3 from test_table2 order by z0_col2;
+---------+---------+---------+---------+
| z0_col0 | z0_col1 | z0_col2 | z0_col3 |
+---------+---------+---------+---------+
|    NULL |    NULL |    NULL |    NULL |
|     -10 |      15 |    -150 |      -1 |
|       0 |       0 |       0 |    NULL |
|       0 |       0 |       0 |    NULL |
|       1 |       1 |       1 |       1 |
|      30 |      10 |     300 |       3 |
|     200 |     100 |   20000 |       2 |
+---------+---------+---------+---------+
select * from test_table1 where z0_col2 < (select max(z0_col2) from test_table2 where z0_col3 > 2) order by 1;
+---------+---------+---------+---------+
| z0_col0 | z0_col1 | z0_col2 | z0_col3 |
+---------+---------+---------+---------+
|     -10 |      15 |       5 |     -25 |
|       0 |       0 |       0 |       0 |
|       1 |       1 |       2 |       0 |
|       1 |       2 |       3 |      -1 |
|      43 |      10 |      53 |      33 |
+---------+---------+---------+---------+
select * from test_table1 where z0_col2 >= (select max(z0_col2) from test_table2 where z0_col3 > 2) order by 1;
+---------+---------+---------+---------+
| z0_col0 | z0_col1 | z0_col2 | z0_col3 |
+---------+---------+---------+---------+
|     200 |     100 |     300 |     100 |
+---------+---------+---------+---------+
select * from test_table2 where z0_col1 = (select max(z0_col3) from test_table1) order by 1;
+---------+---------+---------+---------+
| z0_col0 | z0_col1 | z0_col2 | z0_col3 |
+---------+---------+---------+---------+
|     200 |     100 |   20000 |       2 |
+---------+---------+---------+---------+
select * from test_table2 where z0_col1 != (select min(z0_col3) from test_table1) order by 1;
+---------+---------+---------+---------+
| z0_col0 | z0_col1 | z0_col2 | z0_col3 |
+---------+---------+---------+---------+
|     -10 |      15 |    -150 |      -1 |
|       0 |       0 |       0 |    NULL |
|       0 |       0 |       0 |    NULL |
|       1 |       1 |       1 |       1 |
|      30 |      10 |     300 |       3 |
|     200 |     100 |   20000 |       2 |
+---------+---------+---------+---------+
select * from test_table1 where 2 = (select count(*) from test_table2 where test_table2.z0_col0 = test_table1.z0_col0) order by 1;
+---------+---------+---------+---------+
| z0_col0 | z0_col1 | z0_col2 | z0_col3 |
+---------+---------+---------+---------+
|       0 |       0 |       0 |       0 |
+---------+---------+---------+---------+
# 带有 ANY、IN 或 SOME 的子查询
select * from test_table1 where z0_col2 > any (select z0_col3 from test_table2 where z0_col2 > 0) order by 1;
+---------+---------+---------+---------+
| z0_col0 | z0_col1 | z0_col2 | z0_col3 |
+---------+---------+---------+---------+
|     -10 |      15 |       5 |     -25 |
|       1 |       1 |       2 |       0 |
|       1 |       2 |       3 |      -1 |
|      43 |      10 |      53 |      33 |
|     200 |     100 |     300 |     100 |
+---------+---------+---------+---------+
select * from test_table1 where z0_col2 = any (select z0_col3 from test_table2 where z0_col2 > 0) order by 1;
+---------+---------+---------+---------+
| z0_col0 | z0_col1 | z0_col2 | z0_col3 |
+---------+---------+---------+---------+
|       1 |       1 |       2 |       0 |
|       1 |       2 |       3 |      -1 |
+---------+---------+---------+---------+
select * from test_table1 where z0_col2 < any (select z0_col3 from test_table2 where z0_col2 > 0) order by 1;
+---------+---------+---------+---------+
| z0_col0 | z0_col1 | z0_col2 | z0_col3 |
+---------+---------+---------+---------+
|       0 |       0 |       0 |       0 |
|       1 |       1 |       2 |       0 |
+---------+---------+---------+---------+
select * from test_table1 where z0_col2 != any (select z0_col3 from test_table2 where z0_col2 > 0) order by 1;
+---------+---------+---------+---------+
| z0_col0 | z0_col1 | z0_col2 | z0_col3 |
+---------+---------+---------+---------+
|     -10 |      15 |       5 |     -25 |
|       0 |       0 |       0 |       0 |
|       1 |       1 |       2 |       0 |
|       1 |       2 |       3 |      -1 |
|      43 |      10 |      53 |      33 |
|     200 |     100 |     300 |     100 |
+---------+---------+---------+---------+
select * from test_table1 where z0_col2 <> any (select z0_col3 from test_table2 where z0_col2 > 0) order by 1;
+---------+---------+---------+---------+
| z0_col0 | z0_col1 | z0_col2 | z0_col3 |
+---------+---------+---------+---------+
|     -10 |      15 |       5 |     -25 |
|       0 |       0 |       0 |       0 |
|       1 |       1 |       2 |       0 |
|       1 |       2 |       3 |      -1 |
|      43 |      10 |      53 |      33 |
|     200 |     100 |     300 |     100 |
+---------+---------+---------+---------+
select max(z0_col2) from test_table1 where z0_col2 in (select z0_col3 from test_table2 where z0_col2 > 0) order by 1;
+--------------+
| max(z0_col2) |
+--------------+
|            3 |
+--------------+
select * from test_table1 where z0_col3 >= some (select z0_col3 from test_table2 where z0_col3 > 0) order by 1;
+---------+---------+---------+---------+
| z0_col0 | z0_col1 | z0_col2 | z0_col3 |
+---------+---------+---------+---------+
|      43 |      10 |      53 |      33 |
|     200 |     100 |     300 |     100 |
+---------+---------+---------+---------+
select * from test_table1 where z0_col3 = some (select z0_col3 from test_table2 where z0_col3 > 0) order by 1;
+---------+---------+---------+---------+
| z0_col0 | z0_col1 | z0_col2 | z0_col3 |
+---------+---------+---------+---------+
+---------+---------+---------+---------+
select * from test_table1 where z0_col3 <= some (select z0_col3 from test_table2 where z0_col3 > 0) order by 1;
+---------+---------+---------+---------+
| z0_col0 | z0_col1 | z0_col2 | z0_col3 |
+---------+---------+---------+---------+
|     -10 |      15 |       5 |     -25 |
|       0 |       0 |       0 |       0 |
|       1 |       1 |       2 |       0 |
|       1 |       2 |       3 |      -1 |
+---------+---------+---------+---------+
select * from test_table1 where z0_col3 != some (select z0_col3 from test_table2 where z0_col3 > 0) order by 1;
+---------+---------+---------+---------+
| z0_col0 | z0_col1 | z0_col2 | z0_col3 |
+---------+---------+---------+---------+
|     -10 |      15 |       5 |     -25 |
|       0 |       0 |       0 |       0 |
|       1 |       1 |       2 |       0 |
|       1 |       2 |       3 |      -1 |
|      43 |      10 |      53 |      33 |
|     200 |     100 |     300 |     100 |
+---------+---------+---------+---------+
# ALL 子查询
select z0_col0,z0_col1,abs(z0_col2),abs(z0_col3) from test_table1 where z0_col2 >= all (select z0_col3 from test_table2 where z0_col2 <> 0);
+---------+---------+--------------+--------------+
| z0_col0 | z0_col1 | abs(z0_col2) | abs(z0_col3) |
+---------+---------+--------------+--------------+
|       1 |       2 |            3 |            1 |
|      43 |      10 |           53 |           33 |
|     -10 |      15 |            5 |           25 |
|     200 |     100 |          300 |          100 |
+---------+---------+--------------+--------------+
select z0_col0,z0_col1,max(z0_col2),max(z0_col3) from test_table1 where z0_col2 = all (select z0_col3 from test_table2 where z0_col2 <> 0);
+---------+---------+--------------+--------------+
| z0_col0 | z0_col1 | max(z0_col2) | max(z0_col3) |
+---------+---------+--------------+--------------+
|    NULL |    NULL |         NULL |         NULL |
+---------+---------+--------------+--------------+
select z0_col0,z0_col1,min(z0_col2),min(z0_col3) from test_table1 where z0_col2 <= all (select z0_col3 from test_table2 where z0_col2 <> 0);
+---------+---------+--------------+--------------+
| z0_col0 | z0_col1 | min(z0_col2) | min(z0_col3) |
+---------+---------+--------------+--------------+
|    NULL |    NULL |         NULL |         NULL |
+---------+---------+--------------+--------------+
select z0_col0,z0_col1,avg(z0_col2),avg(z0_col3) from test_table1 where z0_col2 <> all (select z0_col3 from test_table2 where z0_col2 <> 0);
+---------+---------+--------------+--------------+
| z0_col0 | z0_col1 | avg(z0_col2) | avg(z0_col3) |
+---------+---------+--------------+--------------+
|       0 |       0 |      89.5000 |      27.0000 |
+---------+---------+--------------+--------------+
# 行子查询
select * from test_table1 where (z0_col2,z0_col3) = (select z0_col2, z0_col3 from test_table2 where z0_col2 is null) order by 1;
+---------+---------+---------+---------+
| z0_col0 | z0_col1 | z0_col2 | z0_col3 |
+---------+---------+---------+---------+
+---------+---------+---------+---------+
select * from test_table2 where row(z0_col2,z0_col3) = (select z0_col0, z0_col1 from test_table1 where z0_col2 = 2) order by 1;
+---------+---------+---------+---------+
| z0_col0 | z0_col1 | z0_col2 | z0_col3 |
+---------+---------+---------+---------+
|       1 |       1 |       1 |       1 |
+---------+---------+---------+---------+
# 具有 EXISTS 或 NOT EXISTS 的子查询
select z0_col2,z0_col3 from test_table1 where exists (select * from test_table2 where z0_col3 is not null) order by 1;
+---------+---------+
| z0_col2 | z0_col3 |
+---------+---------+
|    NULL |    NULL |
|       0 |       0 |
|       2 |       0 |
|       3 |      -1 |
|       5 |     -25 |
|      53 |      33 |
|     300 |     100 |
+---------+---------+
select z0_col2,z0_col3 from test_table1 where not exists (select * from test_table2 where z0_col3 > 10) order by 1;
+---------+---------+
| z0_col2 | z0_col3 |
+---------+---------+
|    NULL |    NULL |
|       0 |       0 |
|       2 |       0 |
|       3 |      -1 |
|       5 |     -25 |
|      53 |      33 |
|     300 |     100 |
+---------+---------+
select count(z0_col2),max(z0_col3) from test_table1 where exists (select * from test_table2 where z0_col3 is not null) order by 1;
+----------------+--------------+
| count(z0_col2) | max(z0_col3) |
+----------------+--------------+
|              6 |          100 |
+----------------+--------------+
select distinct z0_col2,z0_col3 from test_table1 where not exists (select * from test_table2 where z0_col3 > 10) order by 1;
+---------+---------+
| z0_col2 | z0_col3 |
+---------+---------+
|    NULL |    NULL |
|       0 |       0 |
|       2 |       0 |
|       3 |      -1 |
|       5 |     -25 |
|      53 |      33 |
|     300 |     100 |
+---------+---------+
# 相关子查询
select * from test_table1 t1 where z0_col2 = any (select z0_col2 from test_table2 t2 where t2.z0_col0 = t1.z0_col0 ) order by 1;
+---------+---------+---------+---------+
| z0_col0 | z0_col1 | z0_col2 | z0_col3 |
+---------+---------+---------+---------+
|       0 |       0 |       0 |       0 |
+---------+---------+---------+---------+
select * from test_table1 t1 where (select z0_col2 from test_table2 t2 where t2.z0_col1 = t1.z0_col1 and t2.z0_col3 = 3 ) > 0 order by 1;
+---------+---------+---------+---------+
| z0_col0 | z0_col1 | z0_col2 | z0_col3 |
+---------+---------+---------+---------+
|      43 |      10 |      53 |      33 |
+---------+---------+---------+---------+
# 派生表
select avg(sum_column1) from (select sum(z0_col2) as sum_column1 from test_table1 group by z0_col3) as t1;
+------------------+
| avg(sum_column1) |
+------------------+
|          72.6000 |
+------------------+
select avg(sum_column1) from (select sum(z0_col3) as sum_column1 from test_table2 group by z0_col2) as t1;
+------------------+
| avg(sum_column1) |
+------------------+
|           1.2500 |
+------------------+
###  INSERT 语句
drop table test_table1;
create table test_table1(
z0_col0 int primary key,
z0_col1 int,
z0_col2 int as(z0_col0+z0_col1) virtual,
z0_col3 int as(mod(z0_col0,z0_col1)) stored,
txt char(200) default 'test_table1'
);
insert into test_table1 (z0_col0,z0_col1) values (0,0),(1,NULL),(2,1),(3,5),(4,9.9),(5,2),(2.0E+2,1.0E+2);
select z0_col0,z0_col1,z0_col2 col_add,z0_col3 col_mod,txt from test_table1 order by z0_col2;
+---------+---------+---------+---------+-------------+
| z0_col0 | z0_col1 | col_add | col_mod | txt         |
+---------+---------+---------+---------+-------------+
|       1 |    NULL |    NULL |    NULL | test_table1 |
|       0 |       0 |       0 |    NULL | test_table1 |
|       2 |       1 |       3 |       0 | test_table1 |
|       5 |       2 |       7 |       1 | test_table1 |
|       3 |       5 |       8 |       3 | test_table1 |
|       4 |      10 |      14 |       4 | test_table1 |
|     200 |     100 |     300 |       0 | test_table1 |
+---------+---------+---------+---------+-------------+
insert into test_table1 (z0_col0,z0_col1) values (5,5) on duplicate key update z0_col0=z0_col0+3,z0_col2=1;
ERROR HY000: The value specified for generated column 'z0_col2' in table 'test_table1' is not allowed
insert into test_table1 (z0_col0,z0_col1) values (5,5) on duplicate key update z0_col0=z0_col0+3,txt = 'on duplicate key update';
select z0_col0,z0_col1,z0_col2 col_add,z0_col3 col_mod,txt from test_table1 order by z0_col2;
+---------+---------+---------+---------+-------------------------+
| z0_col0 | z0_col1 | col_add | col_mod | txt                     |
+---------+---------+---------+---------+-------------------------+
|       1 |    NULL |    NULL |    NULL | test_table1             |
|       0 |       0 |       0 |    NULL | test_table1             |
|       2 |       1 |       3 |       0 | test_table1             |
|       3 |       5 |       8 |       3 | test_table1             |
|       8 |       2 |      10 |       0 | on duplicate key update |
|       4 |      10 |      14 |       4 | test_table1             |
|     200 |     100 |     300 |       0 | test_table1             |
+---------+---------+---------+---------+-------------------------+
###  UPDATE  语句
update test_table1 set z0_col1 = 10, txt = '1 update z0_col1' where z0_col2 > 100;
select z0_col0,z0_col1,z0_col2 col_add,z0_col3 col_mod,txt from test_table1 order by z0_col2;
+---------+---------+---------+---------+-------------------------+
| z0_col0 | z0_col1 | col_add | col_mod | txt                     |
+---------+---------+---------+---------+-------------------------+
|       1 |    NULL |    NULL |    NULL | test_table1             |
|       0 |       0 |       0 |    NULL | test_table1             |
|       2 |       1 |       3 |       0 | test_table1             |
|       3 |       5 |       8 |       3 | test_table1             |
|       8 |       2 |      10 |       0 | on duplicate key update |
|       4 |      10 |      14 |       4 | test_table1             |
|     200 |      10 |     210 |       0 | 1 update z0_col1        |
+---------+---------+---------+---------+-------------------------+
update test_table1 set z0_col0 = 41, txt = '2 update z0_col0' where z0_col3 = 4 order by z0_col3 limit 1;
select z0_col0,z0_col1,z0_col2 col_add,z0_col3 col_mod,txt from test_table1 order by z0_col2;
+---------+---------+---------+---------+-------------------------+
| z0_col0 | z0_col1 | col_add | col_mod | txt                     |
+---------+---------+---------+---------+-------------------------+
|       1 |    NULL |    NULL |    NULL | test_table1             |
|       0 |       0 |       0 |    NULL | test_table1             |
|       2 |       1 |       3 |       0 | test_table1             |
|       3 |       5 |       8 |       3 | test_table1             |
|       8 |       2 |      10 |       0 | on duplicate key update |
|      41 |      10 |      51 |       1 | 2 update z0_col0        |
|     200 |      10 |     210 |       0 | 1 update z0_col1        |
+---------+---------+---------+---------+-------------------------+
update test_table1 set z0_col0 = 4, txt = '3 update z0_col0' where abs(z0_col2) = 3 order by z0_col3 limit 1;
select z0_col0,z0_col1,z0_col2 col_add,z0_col3 col_mod,txt from test_table1 order by z0_col2;
+---------+---------+---------+---------+-------------------------+
| z0_col0 | z0_col1 | col_add | col_mod | txt                     |
+---------+---------+---------+---------+-------------------------+
|       1 |    NULL |    NULL |    NULL | test_table1             |
|       0 |       0 |       0 |    NULL | test_table1             |
|       4 |       1 |       5 |       0 | 3 update z0_col0        |
|       3 |       5 |       8 |       3 | test_table1             |
|       8 |       2 |      10 |       0 | on duplicate key update |
|      41 |      10 |      51 |       1 | 2 update z0_col0        |
|     200 |      10 |     210 |       0 | 1 update z0_col1        |
+---------+---------+---------+---------+-------------------------+
update test_table1 set z0_col1 = 200 where z0_col2 > 10 order by z0_col3 limit z0_col3;
ERROR 42000: You have an error in your SQL syntax; check the manual that corresponds to your OceanBase version for the right syntax to use near 'z0_col3' at line 1
select z0_col0,z0_col1,z0_col2 col_add,z0_col3 col_mod,txt from test_table1 order by z0_col2;
+---------+---------+---------+---------+-------------------------+
| z0_col0 | z0_col1 | col_add | col_mod | txt                     |
+---------+---------+---------+---------+-------------------------+
|       1 |    NULL |    NULL |    NULL | test_table1             |
|       0 |       0 |       0 |    NULL | test_table1             |
|       4 |       1 |       5 |       0 | 3 update z0_col0        |
|       3 |       5 |       8 |       3 | test_table1             |
|       8 |       2 |      10 |       0 | on duplicate key update |
|      41 |      10 |      51 |       1 | 2 update z0_col0        |
|     200 |      10 |     210 |       0 | 1 update z0_col1        |
+---------+---------+---------+---------+-------------------------+
update test_table1 set z0_col2 = 20 where z0_col3 = 4 order by z0_col3 limit 1;
ERROR HY000: The value specified for generated column 'z0_col2' in table 'test_table1' is not allowed
select z0_col0,z0_col1,z0_col2 col_add,z0_col3 col_mod,txt from test_table1 order by z0_col2;
+---------+---------+---------+---------+-------------------------+
| z0_col0 | z0_col1 | col_add | col_mod | txt                     |
+---------+---------+---------+---------+-------------------------+
|       1 |    NULL |    NULL |    NULL | test_table1             |
|       0 |       0 |       0 |    NULL | test_table1             |
|       4 |       1 |       5 |       0 | 3 update z0_col0        |
|       3 |       5 |       8 |       3 | test_table1             |
|       8 |       2 |      10 |       0 | on duplicate key update |
|      41 |      10 |      51 |       1 | 2 update z0_col0        |
|     200 |      10 |     210 |       0 | 1 update z0_col1        |
+---------+---------+---------+---------+-------------------------+
###  REPLACE  语句
select z0_col0,z0_col1,z0_col2 col_add,z0_col3 col_mod,txt from test_table1 order by z0_col2;
+---------+---------+---------+---------+-------------------------+
| z0_col0 | z0_col1 | col_add | col_mod | txt                     |
+---------+---------+---------+---------+-------------------------+
|       1 |    NULL |    NULL |    NULL | test_table1             |
|       0 |       0 |       0 |    NULL | test_table1             |
|       4 |       1 |       5 |       0 | 3 update z0_col0        |
|       3 |       5 |       8 |       3 | test_table1             |
|       8 |       2 |      10 |       0 | on duplicate key update |
|      41 |      10 |      51 |       1 | 2 update z0_col0        |
|     200 |      10 |     210 |       0 | 1 update z0_col1        |
+---------+---------+---------+---------+-------------------------+
replace into test_table1 (z0_col0,z0_col1,txt) values (200,21,'1 replace test_table1');
select z0_col0,z0_col1,z0_col2 col_add,z0_col3 col_mod,txt from test_table1 order by z0_col2;
+---------+---------+---------+---------+-------------------------+
| z0_col0 | z0_col1 | col_add | col_mod | txt                     |
+---------+---------+---------+---------+-------------------------+
|       1 |    NULL |    NULL |    NULL | test_table1             |
|       0 |       0 |       0 |    NULL | test_table1             |
|       4 |       1 |       5 |       0 | 3 update z0_col0        |
|       3 |       5 |       8 |       3 | test_table1             |
|       8 |       2 |      10 |       0 | on duplicate key update |
|      41 |      10 |      51 |       1 | 2 update z0_col0        |
|     200 |      21 |     221 |      11 | 1 replace test_table1   |
+---------+---------+---------+---------+-------------------------+
replace into test_table1 values (3,20,30,10,'2 replace test_table1');
ERROR HY000: The value specified for generated column 'z0_col2' in table 'test_table1' is not allowed
###  TRUNCATE TABLE语句
drop table test_table1;
create table test_table1(
z0_col0 int primary key,
z0_col1 int,
z0_col2 int as(z0_col0+z0_col1) virtual,
z0_col3 int as(z0_col0*z0_col1) stored,
txt char(200) default 'test_table1'
);
insert into test_table1 (z0_col0,z0_col1) values (0,0),(1,NULL),(2,1),(3,5);
select z0_col0,z0_col1,z0_col2 col_vir,z0_col3 col_sto,txt from test_table1 order by z0_col2;
+---------+---------+---------+---------+-------------+
| z0_col0 | z0_col1 | col_vir | col_sto | txt         |
+---------+---------+---------+---------+-------------+
|       1 |    NULL |    NULL |    NULL | test_table1 |
|       0 |       0 |       0 |       0 | test_table1 |
|       2 |       1 |       3 |       2 | test_table1 |
|       3 |       5 |       8 |      15 | test_table1 |
+---------+---------+---------+---------+-------------+
truncate table test_table1;
insert into test_table1 (z0_col0,z0_col1) values (10,10),(20,10),(30,50);
select z0_col0,z0_col1,z0_col2 col_add,z0_col3 col_mod,txt from test_table1 order by z0_col2;
+---------+---------+---------+---------+-------------+
| z0_col0 | z0_col1 | col_add | col_mod | txt         |
+---------+---------+---------+---------+-------------+
|      10 |      10 |      20 |     100 | test_table1 |
|      20 |      10 |      30 |     200 | test_table1 |
|      30 |      50 |      80 |    1500 | test_table1 |
+---------+---------+---------+---------+-------------+
desc test_table1;
+---------+-----------+------+-----+-------------------------+-------------------+
| Field   | Type      | Null | Key | Default                 | Extra             |
+---------+-----------+------+-----+-------------------------+-------------------+
| z0_col0 | int(11)   | NO   | PRI | NULL                    |                   |
| z0_col1 | int(11)   | YES  |     | NULL                    |                   |
| z0_col2 | int(11)   | YES  |     | (`z0_col0` + `z0_col1`) | VIRTUAL GENERATED |
| z0_col3 | int(11)   | YES  |     | (`z0_col0` * `z0_col1`) | STORED GENERATED  |
| txt     | char(200) | YES  |     | test_table1             |                   |
+---------+-----------+------+-----+-------------------------+-------------------+
############ mysql_genrate-1-5 PL/SQL
### 函数
drop table test_table1;
create table test_table1(
z0_col0 int primary key,
z0_col1 int,
z0_col2 int as(z0_col0+z0_col1) virtual,
z0_col3 int as(z0_col0*z0_col1) stored
);
insert into test_table1 (z0_col0,z0_col1) values (0,0),(1,1),(2,2),(3,3);
select z0_col0,z0_col1,z0_col2 col_vir,z0_col3 col_sto from test_table1 order by z0_col2;
+---------+---------+---------+---------+
| z0_col0 | z0_col1 | col_vir | col_sto |
+---------+---------+---------+---------+
|       0 |       0 |       0 |       0 |
|       1 |       1 |       2 |       1 |
|       2 |       2 |       4 |       4 |
|       3 |       3 |       6 |       9 |
+---------+---------+---------+---------+
drop table test_table2;
create table test_table2(
z0_col0 int primary key,
z0_col1 int,
z0_col2 int as(z0_col0+z0_col1) virtual,
z0_col3 int as(z0_col0*z0_col1) stored
);
insert into test_table2 (z0_col0,z0_col1) values (10,0),(11,1),(12,2),(13,3);
select z0_col0,z0_col1,z0_col2 col_vir,z0_col3 col_sto from test_table2 order by z0_col2;
+---------+---------+---------+---------+
| z0_col0 | z0_col1 | col_vir | col_sto |
+---------+---------+---------+---------+
|      10 |       0 |      10 |       0 |
|      11 |       1 |      12 |      11 |
|      12 |       2 |      14 |      24 |
|      13 |       3 |      16 |      39 |
+---------+---------+---------+---------+
# 生成列作为函数参数
drop function fun1;//
create function fun1(num2 int,num3 int) returns varchar(100)
begin  
  insert into test_table1 (z0_col0,z0_col1) values (num2,num3); 
  delete from test_table1 where z0_col2 = 0; 
  update test_table1 set z0_col0 = 9 where z0_col2 = 2;
  return 'fun1 ok';
end;
//
select fun1(z0_col2,z0_col3) from test_table2 where z0_col2 < 14 order by z0_col2;//
+-----------------------+
| fun1(z0_col2,z0_col3) |
+-----------------------+
| fun1 ok               |
| fun1 ok               |
+-----------------------+
select z0_col0,z0_col1,z0_col2 col_vir,z0_col3 col_sto from test_table1 order by z0_col2;//
+---------+---------+---------+---------+
| z0_col0 | z0_col1 | col_vir | col_sto |
+---------+---------+---------+---------+
|       2 |       2 |       4 |       4 |
|       3 |       3 |       6 |       9 |
|       9 |       1 |      10 |       9 |
|      10 |       0 |      10 |       0 |
|      12 |      11 |      23 |     132 |
+---------+---------+---------+---------+
# 虚拟列表达式是自定义函数
drop function fun1;//
create function fun1() returns int
begin
  return 10;
end;
//
drop table test_table222;//
create table test_table222(
z0_col0 int primary key,
z0_col1 int,
z0_col2 int as(fun1()) virtual,
z0_col3 int as(fun1()) stored
);//
ERROR 42S22: Unknown column '' in 'generated column function'
### 存储过程
DROP PROCEDURE IF EXISTS pro1;//
CREATE PROCEDURE pro1(in num1 int,in num2 int)
BEGIN
  alter table test_table2 add z0_col4 varchar(100) as (concat(z0_col0,z0_col1)) virtual;
  alter table test_table2 add z0_col5 varchar(100) as (z0_col0) stored;
  insert into test_table2 (z0_col0,z0_col1) values (num1,num2),(num1+1,num2+1); 
  delete from test_table2 where z0_col2 = num1+num2; 
  update test_table2 set z0_col1 = 0 where z0_col3 = 36;
END;
//
call pro1(5,5);//
select * from test_table2 order by z0_col2;//
+---------+---------+---------+---------+---------+---------+
| z0_col0 | z0_col1 | z0_col2 | z0_col3 | z0_col4 | z0_col5 |
+---------+---------+---------+---------+---------+---------+
|       6 |       0 |       6 |       0 | 60      | 6       |
|      11 |       1 |      12 |      11 | 111     | 11      |
|      12 |       2 |      14 |      24 | 122     | 12      |
|      13 |       3 |      16 |      39 | 133     | 13      |
+---------+---------+---------+---------+---------+---------+
desc test_table2;//
+---------+--------------+------+-----+-----------------------------+-------------------+
| Field   | Type         | Null | Key | Default                     | Extra             |
+---------+--------------+------+-----+-----------------------------+-------------------+
| z0_col0 | int(11)      | NO   | PRI | NULL                        |                   |
| z0_col1 | int(11)      | YES  |     | NULL                        |                   |
| z0_col2 | int(11)      | YES  |     | (`z0_col0` + `z0_col1`)     | VIRTUAL GENERATED |
| z0_col3 | int(11)      | YES  |     | (`z0_col0` * `z0_col1`)     | STORED GENERATED  |
| z0_col4 | varchar(100) | YES  |     | concat(`z0_col0`,`z0_col1`) | VIRTUAL GENERATED |
| z0_col5 | varchar(100) | YES  |     | `z0_col0`                   | STORED GENERATED  |
+---------+--------------+------+-----+-----------------------------+-------------------+
############ mysql_genrate-1-6 其他场景
### 生成列：常量
# null
drop table test_table1;
create table test_table1(
z0_col0 int,
z0_col1 int,
z0_col2 int as (null) virtual,
z0_col3 int as (null) stored
);
insert into test_table1 (z0_col0,z0_col1) values (1,1),(2,2);
select z0_col0,z0_col1,z0_col2 col_vir,z0_col3 col_sto from test_table1 order by z0_col2;
+---------+---------+---------+---------+
| z0_col0 | z0_col1 | col_vir | col_sto |
+---------+---------+---------+---------+
|       1 |       1 |    NULL |    NULL |
|       2 |       2 |    NULL |    NULL |
+---------+---------+---------+---------+
select max(z0_col2),min(z0_col3) from test_table1 order by z0_col2;
+--------------+--------------+
| max(z0_col2) | min(z0_col3) |
+--------------+--------------+
|         NULL |         NULL |
+--------------+--------------+
# ''/' '
drop table test_table1;
create table test_table1(
z0_col0 int,
z0_col1 int,
z0_col2 char(200) as ('') virtual,
z0_col3 char(200) as (' ') stored
);
insert into test_table1 (z0_col0,z0_col1) values (1,1),(2,2);
select z0_col0,z0_col1,z0_col2 col_vir,z0_col3 col_sto from test_table1 order by z0_col2;
+---------+---------+---------+---------+
| z0_col0 | z0_col1 | col_vir | col_sto |
+---------+---------+---------+---------+
|       1 |       1 |         |         |
|       2 |       2 |         |         |
+---------+---------+---------+---------+
select max(z0_col2),min(z0_col3) from test_table1 order by z0_col2;
+--------------+--------------+
| max(z0_col2) | min(z0_col3) |
+--------------+--------------+
|              |              |
+--------------+--------------+
# 0，小数，负数，日期
drop table test_table1;
create table test_table1(
z0_col0 int,
z0_col1 int,
z0_col2 int as (0) virtual,
z0_col3 int as (3.1415926) stored,
z0_col4 int as (-100) virtual,
z0_col5 date as ('2020/06/22') stored
);
select * from test_table1 order by z0_col2;
+---------+---------+---------+---------+---------+---------+
| z0_col0 | z0_col1 | z0_col2 | z0_col3 | z0_col4 | z0_col5 |
+---------+---------+---------+---------+---------+---------+
+---------+---------+---------+---------+---------+---------+
insert into test_table1 (z0_col0,z0_col1) values (1,1),(2,2);
select * from test_table1 order by z0_col2;
+---------+---------+---------+---------+---------+------------+
| z0_col0 | z0_col1 | z0_col2 | z0_col3 | z0_col4 | z0_col5    |
+---------+---------+---------+---------+---------+------------+
|       1 |       1 |       0 |       3 |    -100 | 2020-06-22 |
|       2 |       2 |       0 |       3 |    -100 | 2020-06-22 |
+---------+---------+---------+---------+---------+------------+
select max(z0_col2),min(z0_col3) from test_table1 order by z0_col2;
+--------------+--------------+
| max(z0_col2) | min(z0_col3) |
+--------------+--------------+
|            0 |            3 |
+--------------+--------------+
# 特殊字符 ' ！@#￥%……&*（）-+'
drop table test_table1;
create table test_table1(
z0_col0 int,
z0_col1 int,
z0_col2 char(200) as (' ！@#￥%……&*（）-+') virtual,
z0_col3 char(200) as (',./?;:|[]{}~$%^&') stored
);
select * from test_table1 order by z0_col2;
+---------+---------+---------+---------+
| z0_col0 | z0_col1 | z0_col2 | z0_col3 |
+---------+---------+---------+---------+
+---------+---------+---------+---------+
insert into test_table1 (z0_col0,z0_col1) values (1,1),(2,2);
select * from test_table1 order by z0_col2;
+---------+---------+----------------------------+------------------+
| z0_col0 | z0_col1 | z0_col2                    | z0_col3          |
+---------+---------+----------------------------+------------------+
|       1 |       1 |  ！@#￥%……&*（）-+         | ,./?;:|[]{}~$%^& |
|       2 |       2 |  ！@#￥%……&*（）-+         | ,./?;:|[]{}~$%^& |
+---------+---------+----------------------------+------------------+
select max(z0_col2),min(z0_col3) from test_table1 order by z0_col2;
+----------------------------+------------------+
| max(z0_col2)               | min(z0_col3)     |
+----------------------------+------------------+
|  ！@#￥%……&*（）-+         | ,./?;:|[]{}~$%^& |
+----------------------------+------------------+
# 汉字，换行,\n,\t,\r
drop table test_table1;
create table test_table1(
z0_col0 int,
z0_col1 int,
z0_col2 char(200) as ('虚拟列') virtual,
z0_col3 char(200) as ('生成列') stored,
z0_col4 char(200) as ('虚拟列\n\t\r转换符') virtual,
z0_col5 char(200) as ('生成列\n\t\r转换符') stored,
z0_col6 char(200) as ('虚拟列
第二行') virtual,
z0_col7 char(200) as ('生成列
第二行') stored
);
select * from test_table1 order by z0_col2;
+---------+---------+---------+---------+---------+---------+---------+---------+
| z0_col0 | z0_col1 | z0_col2 | z0_col3 | z0_col4 | z0_col5 | z0_col6 | z0_col7 |
+---------+---------+---------+---------+---------+---------+---------+---------+
+---------+---------+---------+---------+---------+---------+---------+---------+
insert into test_table1 (z0_col0,z0_col1) values (1,1),(2,2);
select * from test_table1 order by z0_col2;
+---------+---------+-----------+-----------+-----------------------+-----------------------+---------------------+---------------------+
| z0_col0 | z0_col1 | z0_col2   | z0_col3   | z0_col4               | z0_col5               | z0_col6             | z0_col7             |
+---------+---------+-----------+-----------+-----------------------+-----------------------+---------------------+---------------------+
|       1 |       1 | 虚拟列    | 生成列    | 虚拟列
	转换符       | 生成列
	转换符       | 虚拟列
第二行       | 生成列
第二行       |
|       2 |       2 | 虚拟列    | 生成列    | 虚拟列
	转换符       | 生成列
	转换符       | 虚拟列
第二行       | 生成列
第二行       |
+---------+---------+-----------+-----------+-----------------------+-----------------------+---------------------+---------------------+
select max(z0_col2),min(z0_col3) from test_table1 order by z0_col2;
+--------------+--------------+
| max(z0_col2) | min(z0_col3) |
+--------------+--------------+
| 虚拟列       | 生成列       |
+--------------+--------------+
### 生成列：生成列上加默认值
drop table test_table1;
create table test_table1(
id int,
z0_col0 int,
z0_col1 int,
z0_col2 int as(z0_col0/z0_col1) virtual default '0',
z0_col3 int as(z0_col1*z0_col1) stored  default '0'
);
ERROR 42000: You have an error in your SQL syntax; check the manual that corresponds to your OceanBase version for the right syntax to use near 'default '0',
z0_col3 int as(z0_col1*z0_col1) stored  default '0'
)' at line 5
### 生成列：生成列引用生成列     ob不兼容MySQL
drop table test_table1;
create table test_table1(
z0_col0 int,
z0_col1 int,
z0_col2 int as(z0_col1) virtual,
z0_col3 int as(z0_col2) virtual
);
ERROR HY000: 'Defining a generated column on generated column(s)' is not supported for generated columns.
insert into test_table1 (z0_col0,z0_col1) values (10,10),(20,20),(30,30);
ERROR 42S02: Table 'whh.test_table1' doesn't exist
select * from test_table1 order by z0_col2;
ERROR 42S02: Table 'whh.test_table1' doesn't exist
### 表达式：生成列表达式 column / 0
drop table test_table1;
create table test_table1(
id int,
z0_col0 char(200) default '1',
z0_col1 char(200) default '2',
z0_col2 int as(z0_col0/0) virtual,
z0_col3 int as(z0_col1) stored
);
insert into test_table1 (id) values (1);
select z0_col0,z0_col1,z0_col2 col_vir,z0_col3 col_sto from test_table1 order by z0_col2;
+---------+---------+---------+---------+
| z0_col0 | z0_col1 | col_vir | col_sto |
+---------+---------+---------+---------+
| 1       | 2       |    NULL |       2 |
+---------+---------+---------+---------+
select max(z0_col2),min(z0_col3) from test_table1 order by z0_col2;
+--------------+--------------+
| max(z0_col2) | min(z0_col3) |
+--------------+--------------+
|         NULL |            2 |
+--------------+--------------+
### 表达式：生成列引用的普通列使用默认值
drop table test_table1;
create table test_table1(
id int,
z0_col0 int default 30,
z0_col1 int default 5,
z0_col2 int as(z0_col0/z0_col1) virtual,
z0_col3 int as(z0_col1*z0_col1) stored
);
insert into test_table1 (id) values (1);
select z0_col0,z0_col1,z0_col2 col_vir,z0_col3 col_sto from test_table1 order by z0_col2;
+---------+---------+---------+---------+
| z0_col0 | z0_col1 | col_vir | col_sto |
+---------+---------+---------+---------+
|      30 |       5 |       6 |      25 |
+---------+---------+---------+---------+
select max(z0_col2),min(z0_col3) from test_table1 order by z0_col2;
+--------------+--------------+
| max(z0_col2) | min(z0_col3) |
+--------------+--------------+
|            6 |           25 |
+--------------+--------------+
### 事务：向表中插入/删除数据，添加生成列等，再回滚
SET @@AUTOCOMMIT=0;
drop table test_table1;
create table test_table1(
z0_col0 int,
z0_col1 int,
z0_col2 int as(z0_col0/z0_col1) virtual,
z0_col3 int as(z0_col1*z0_col1) stored
);
insert into test_table1 (z0_col0,z0_col1) values (10,10),(20,20),(30,30);
select * from test_table1 order by z0_col2;
+---------+---------+---------+---------+
| z0_col0 | z0_col1 | z0_col2 | z0_col3 |
+---------+---------+---------+---------+
|      10 |      10 |       1 |     100 |
|      20 |      20 |       1 |     400 |
|      30 |      30 |       1 |     900 |
+---------+---------+---------+---------+
# 插入数据再回滚
start transaction;
insert into test_table1 (z0_col0,z0_col1) values (40,40);
select * from test_table1 order by z0_col2;
+---------+---------+---------+---------+
| z0_col0 | z0_col1 | z0_col2 | z0_col3 |
+---------+---------+---------+---------+
|      10 |      10 |       1 |     100 |
|      20 |      20 |       1 |     400 |
|      30 |      30 |       1 |     900 |
|      40 |      40 |       1 |    1600 |
+---------+---------+---------+---------+
rollback;
select z0_col0,z0_col1,z0_col2 col_vir,z0_col3 col_sto from test_table1 order by z0_col2;
+---------+---------+---------+---------+
| z0_col0 | z0_col1 | col_vir | col_sto |
+---------+---------+---------+---------+
|      10 |      10 |       1 |     100 |
|      20 |      20 |       1 |     400 |
|      30 |      30 |       1 |     900 |
+---------+---------+---------+---------+
select max(z0_col2),min(z0_col3) from test_table1 order by z0_col2;
+--------------+--------------+
| max(z0_col2) | min(z0_col3) |
+--------------+--------------+
|            1 |          100 |
+--------------+--------------+
# 删除数据再回滚
start transaction;
delete from test_table1 where z0_col3 = 900;
select * from test_table1 order by z0_col2;
+---------+---------+---------+---------+
| z0_col0 | z0_col1 | z0_col2 | z0_col3 |
+---------+---------+---------+---------+
|      10 |      10 |       1 |     100 |
|      20 |      20 |       1 |     400 |
+---------+---------+---------+---------+
rollback;
select z0_col0,z0_col1,z0_col2 col_vir,z0_col3 col_sto from test_table1 order by z0_col2;
+---------+---------+---------+---------+
| z0_col0 | z0_col1 | col_vir | col_sto |
+---------+---------+---------+---------+
|      10 |      10 |       1 |     100 |
|      20 |      20 |       1 |     400 |
|      30 |      30 |       1 |     900 |
+---------+---------+---------+---------+
select max(z0_col2),min(z0_col3) from test_table1 order by z0_col2;
+--------------+--------------+
| max(z0_col2) | min(z0_col3) |
+--------------+--------------+
|            1 |          100 |
+--------------+--------------+
# 添加生成列再回滚
start transaction;
alter table test_table1 add z0_col4 varchar(100) as (concat(z0_col0,z0_col1)) virtual;
select * from test_table1 order by z0_col2;
+---------+---------+---------+---------+---------+
| z0_col0 | z0_col1 | z0_col2 | z0_col3 | z0_col4 |
+---------+---------+---------+---------+---------+
|      10 |      10 |       1 |     100 | 1010    |
|      20 |      20 |       1 |     400 | 2020    |
|      30 |      30 |       1 |     900 | 3030    |
+---------+---------+---------+---------+---------+
rollback;
select z0_col0,z0_col1,z0_col2 col_vir,z0_col3 col_sto from test_table1 order by z0_col2;
+---------+---------+---------+---------+
| z0_col0 | z0_col1 | col_vir | col_sto |
+---------+---------+---------+---------+
|      10 |      10 |       1 |     100 |
|      20 |      20 |       1 |     400 |
|      30 |      30 |       1 |     900 |
+---------+---------+---------+---------+
select max(z0_col2),min(z0_col3) from test_table1 order by z0_col2;
+--------------+--------------+
| max(z0_col2) | min(z0_col3) |
+--------------+--------------+
|            1 |          100 |
+--------------+--------------+
SET @@AUTOCOMMIT=1;
### 一个表中含有多个虚拟列/存储列(6,7,8...)
drop table test_table1;
create table test_table1(
z0_col0 int,
z0_col1 int,
z0_col2 int as(z0_col0*1) virtual,
z0_col3 int as(z0_col0*2) virtual,
z0_col4 int as(z0_col0*3) virtual,
z0_col5 int as(z0_col0*4) virtual,
z0_col6 int as(z0_col0*5) virtual,
z0_col7 int as(z0_col0*6) virtual,
z0_col10 int as(z0_col1*1) stored,
z0_col11 int as(z0_col1*2) stored,
z0_col12 int as(z0_col1*3) stored,
z0_col13 int as(z0_col1*4) stored,
z0_col14 int as(z0_col1*5) stored,
z0_col15 int as(z0_col1*6) stored
);
insert into test_table1 (z0_col0,z0_col1) values (10,10),(20,20),(30,30);
select * from test_table1 order by z0_col2;
+---------+---------+---------+---------+---------+---------+---------+---------+----------+----------+----------+----------+----------+----------+
| z0_col0 | z0_col1 | z0_col2 | z0_col3 | z0_col4 | z0_col5 | z0_col6 | z0_col7 | z0_col10 | z0_col11 | z0_col12 | z0_col13 | z0_col14 | z0_col15 |
+---------+---------+---------+---------+---------+---------+---------+---------+----------+----------+----------+----------+----------+----------+
|      10 |      10 |      10 |      20 |      30 |      40 |      50 |      60 |       10 |       20 |       30 |       40 |       50 |       60 |
|      20 |      20 |      20 |      40 |      60 |      80 |     100 |     120 |       20 |       40 |       60 |       80 |      100 |      120 |
|      30 |      30 |      30 |      60 |      90 |     120 |     150 |     180 |       30 |       60 |       90 |      120 |      150 |      180 |
+---------+---------+---------+---------+---------+---------+---------+---------+----------+----------+----------+----------+----------+----------+
alter table test_table1 add z0_col8 int as (z0_col0*7) virtual;
alter table test_table1 add z0_col9 int as (z0_col0*8) virtual;
alter table test_table1 add z0_col16 int as (z0_col1*7) stored;
alter table test_table1 add z0_col17 int as (z0_col1*8) stored;
insert into test_table1 (z0_col0,z0_col1) values (10,10),(20,20),(30,30);
select * from test_table1 order by z0_col2;
+---------+---------+---------+---------+---------+---------+---------+---------+----------+----------+----------+----------+----------+----------+---------+---------+----------+----------+
| z0_col0 | z0_col1 | z0_col2 | z0_col3 | z0_col4 | z0_col5 | z0_col6 | z0_col7 | z0_col10 | z0_col11 | z0_col12 | z0_col13 | z0_col14 | z0_col15 | z0_col8 | z0_col9 | z0_col16 | z0_col17 |
+---------+---------+---------+---------+---------+---------+---------+---------+----------+----------+----------+----------+----------+----------+---------+---------+----------+----------+
|      10 |      10 |      10 |      20 |      30 |      40 |      50 |      60 |       10 |       20 |       30 |       40 |       50 |       60 |      70 |      80 |       70 |       80 |
|      10 |      10 |      10 |      20 |      30 |      40 |      50 |      60 |       10 |       20 |       30 |       40 |       50 |       60 |      70 |      80 |       70 |       80 |
|      20 |      20 |      20 |      40 |      60 |      80 |     100 |     120 |       20 |       40 |       60 |       80 |      100 |      120 |     140 |     160 |      140 |      160 |
|      20 |      20 |      20 |      40 |      60 |      80 |     100 |     120 |       20 |       40 |       60 |       80 |      100 |      120 |     140 |     160 |      140 |      160 |
|      30 |      30 |      30 |      60 |      90 |     120 |     150 |     180 |       30 |       60 |       90 |      120 |      150 |      180 |     210 |     240 |      210 |      240 |
|      30 |      30 |      30 |      60 |      90 |     120 |     150 |     180 |       30 |       60 |       90 |      120 |      150 |      180 |     210 |     240 |      210 |      240 |
+---------+---------+---------+---------+---------+---------+---------+---------+----------+----------+----------+----------+----------+----------+---------+---------+----------+----------+
desc test_table1;
+----------+---------+------+-----+-----------------+-------------------+
| Field    | Type    | Null | Key | Default         | Extra             |
+----------+---------+------+-----+-----------------+-------------------+
| z0_col0  | int(11) | YES  |     | NULL            |                   |
| z0_col1  | int(11) | YES  |     | NULL            |                   |
| z0_col2  | int(11) | YES  |     | (`z0_col0` * 1) | VIRTUAL GENERATED |
| z0_col3  | int(11) | YES  |     | (`z0_col0` * 2) | VIRTUAL GENERATED |
| z0_col4  | int(11) | YES  |     | (`z0_col0` * 3) | VIRTUAL GENERATED |
| z0_col5  | int(11) | YES  |     | (`z0_col0` * 4) | VIRTUAL GENERATED |
| z0_col6  | int(11) | YES  |     | (`z0_col0` * 5) | VIRTUAL GENERATED |
| z0_col7  | int(11) | YES  |     | (`z0_col0` * 6) | VIRTUAL GENERATED |
| z0_col10 | int(11) | YES  |     | (`z0_col1` * 1) | STORED GENERATED  |
| z0_col11 | int(11) | YES  |     | (`z0_col1` * 2) | STORED GENERATED  |
| z0_col12 | int(11) | YES  |     | (`z0_col1` * 3) | STORED GENERATED  |
| z0_col13 | int(11) | YES  |     | (`z0_col1` * 4) | STORED GENERATED  |
| z0_col14 | int(11) | YES  |     | (`z0_col1` * 5) | STORED GENERATED  |
| z0_col15 | int(11) | YES  |     | (`z0_col1` * 6) | STORED GENERATED  |
| z0_col8  | int(11) | YES  |     | (`z0_col0` * 7) | VIRTUAL GENERATED |
| z0_col9  | int(11) | YES  |     | (`z0_col0` * 8) | VIRTUAL GENERATED |
| z0_col16 | int(11) | YES  |     | (`z0_col1` * 7) | STORED GENERATED  |
| z0_col17 | int(11) | YES  |     | (`z0_col1` * 8) | STORED GENERATED  |
+----------+---------+------+-----+-----------------+-------------------+
drop user whh@'%';
drop database IF EXISTS whh ;
PURGE RECYCLEBIN;
# oracle_genrate-1-1 系统租户下修改配置 _rowsets_max_rows = 16
alter system set _rowsets_enabled = true tenant sys;
alter system set _rowsets_enabled = true tenant all_user;
alter system set _rowsets_enabled = true tenant all_meta;
alter system set _rowsets_max_rows = 16 tenant sys;
alter system set _rowsets_max_rows = 16 tenant all_user;
alter system set _rowsets_max_rows = 16 tenant all_meta;
alter system flush plan cache global;
# 环境清理
purge recyclebin;
result_format: 4
drop user whh@'%';
drop database if exists whh ;
create user whh identified by 'whh';
create database whh ;
grant all on *.* to whh WITH GRANT OPTION;


#############################################################################################
############ mysql_genrate-1-2 作为分区键
### key分区
drop table virtual_table;
create table virtual_table(
z0_col0 int, 
z0_col1 int,
z0_col2 int as(z0_col0+z0_col1)) 
partition by key(z0_col2) partitions 2;
insert into virtual_table (z0_col0,z0_col1) values (0,0),(NULL,NULL),(1.111,222),(10,10);
select z0_col0,z0_col1,z0_col2 from virtual_table partition(p0) order by z0_col2;
+---------+---------+---------+
| z0_col0 | z0_col1 | z0_col2 |
+---------+---------+---------+
|      10 |      10 |      20 |
|       1 |     222 |     223 |
+---------+---------+---------+
select z0_col0,z0_col1,z0_col2 from virtual_table partition(p1) order by z0_col2;
+---------+---------+---------+
| z0_col0 | z0_col1 | z0_col2 |
+---------+---------+---------+
|    NULL |    NULL |    NULL |
|       0 |       0 |       0 |
+---------+---------+---------+
explain select z0_col0,z0_col1,z0_col2 from virtual_table where z0_col2 = 0 order by z0_col2;
Query Plan
========================================================
|ID|OPERATOR       |NAME         |EST.ROWS|EST.TIME(us)|
--------------------------------------------------------
|0 |TABLE FULL SCAN|virtual_table|1       |3           |
========================================================
Outputs & filters:
-------------------------------------
  0 - output([virtual_table.z0_col0], [virtual_table.z0_col1], [column_conv(INT,PS:(11,0),NULL,cast(virtual_table.z0_col0 + virtual_table.z0_col1, INT(-1,
       0)))]), filter([column_conv(INT,PS:(11,0),NULL,cast(virtual_table.z0_col0 + virtual_table.z0_col1, INT(-1, 0))) = 0]), rowset=16
      access([virtual_table.z0_col0], [virtual_table.z0_col1]), partitions(p1)
      is_index_back=false, is_global_index=false, filter_before_indexback[false], 
      range_key([virtual_table.__pk_increment]), range(MIN ; MAX)always true
explain select z0_col0,z0_col1,z0_col2 from virtual_table where z0_col0+z0_col1 = 0 order by z0_col2;
Query Plan
====================================================================
|ID|OPERATOR                   |NAME         |EST.ROWS|EST.TIME(us)|
--------------------------------------------------------------------
|0 |PX COORDINATOR MERGE SORT  |             |1       |7           |
|1 |└─EXCHANGE OUT DISTR       |:EX10000     |1       |6           |
|2 |  └─SORT                   |             |1       |5           |
|3 |    └─PX PARTITION ITERATOR|             |1       |5           |
|4 |      └─TABLE FULL SCAN    |virtual_table|1       |5           |
====================================================================
Outputs & filters:
-------------------------------------
  0 - output([INTERNAL_FUNCTION(virtual_table.z0_col0, virtual_table.z0_col1, column_conv(INT,PS:(11,0),NULL,cast(virtual_table.z0_col0 + virtual_table.z0_col1,
       INT(-1, 0))))]), filter(nil), rowset=16
      sort_keys([column_conv(INT,PS:(11,0),NULL,cast(virtual_table.z0_col0 + virtual_table.z0_col1, INT(-1, 0))), ASC])
  1 - output([column_conv(INT,PS:(11,0),NULL,cast(virtual_table.z0_col0 + virtual_table.z0_col1, INT(-1, 0)))], [INTERNAL_FUNCTION(virtual_table.z0_col0,
       virtual_table.z0_col1, column_conv(INT,PS:(11,0),NULL,cast(virtual_table.z0_col0 + virtual_table.z0_col1, INT(-1, 0))))]), filter(nil), rowset=16
      dop=1
  2 - output([column_conv(INT,PS:(11,0),NULL,cast(virtual_table.z0_col0 + virtual_table.z0_col1, INT(-1, 0)))], [virtual_table.z0_col0], [virtual_table.z0_col1]), filter(nil), rowset=16
      sort_keys([column_conv(INT,PS:(11,0),NULL,cast(virtual_table.z0_col0 + virtual_table.z0_col1, INT(-1, 0))), ASC])
  3 - output([virtual_table.z0_col0], [virtual_table.z0_col1], [column_conv(INT,PS:(11,0),NULL,cast(virtual_table.z0_col0 + virtual_table.z0_col1, INT(-1,
       0)))]), filter(nil), rowset=16
      force partition granule
  4 - output([virtual_table.z0_col0], [virtual_table.z0_col1], [column_conv(INT,PS:(11,0),NULL,cast(virtual_table.z0_col0 + virtual_table.z0_col1, INT(-1,
       0)))]), filter([virtual_table.z0_col0 + virtual_table.z0_col1 = 0]), rowset=16
      access([virtual_table.z0_col0], [virtual_table.z0_col1]), partitions(p[0-1])
      is_index_back=false, is_global_index=false, filter_before_indexback[false], 
      range_key([virtual_table.__pk_increment]), range(MIN ; MAX)always true
drop table stored_table;
create table stored_table(
z0_col0 int, 
z0_col1 int,
z0_col2 int as(z0_col0+z0_col1) stored) 
partition by key(z0_col2) partitions 3;
insert into stored_table (z0_col0,z0_col1) values (0,0),(NULL,NULL),(1.111,222),(10,10);
select z0_col0,z0_col1,z0_col2 from stored_table partition(p0) order by z0_col2;
+---------+---------+---------+
| z0_col0 | z0_col1 | z0_col2 |
+---------+---------+---------+
|      10 |      10 |      20 |
+---------+---------+---------+
select z0_col0,z0_col1,z0_col2 from stored_table partition(p1) order by z0_col2;
+---------+---------+---------+
| z0_col0 | z0_col1 | z0_col2 |
+---------+---------+---------+
|       1 |     222 |     223 |
+---------+---------+---------+
select z0_col0,z0_col1,z0_col2 from stored_table partition(p2) order by z0_col2;
+---------+---------+---------+
| z0_col0 | z0_col1 | z0_col2 |
+---------+---------+---------+
|    NULL |    NULL |    NULL |
|       0 |       0 |       0 |
+---------+---------+---------+
explain select z0_col0,z0_col1,z0_col2 from stored_table where z0_col2 = 0 order by z0_col2;
Query Plan
=======================================================
|ID|OPERATOR       |NAME        |EST.ROWS|EST.TIME(us)|
-------------------------------------------------------
|0 |TABLE FULL SCAN|stored_table|1       |3           |
=======================================================
Outputs & filters:
-------------------------------------
  0 - output([stored_table.z0_col0], [stored_table.z0_col1], [stored_table.z0_col2]), filter([stored_table.z0_col2 = 0]), rowset=16
      access([stored_table.z0_col0], [stored_table.z0_col1], [stored_table.z0_col2]), partitions(p2)
      is_index_back=false, is_global_index=false, filter_before_indexback[false], 
      range_key([stored_table.__pk_increment]), range(MIN ; MAX)always true
explain select z0_col0,z0_col1,z0_col2 from stored_table where z0_col0+z0_col1 = 0 order by z0_col2;
Query Plan
===================================================================
|ID|OPERATOR                   |NAME        |EST.ROWS|EST.TIME(us)|
-------------------------------------------------------------------
|0 |PX COORDINATOR MERGE SORT  |            |1       |9           |
|1 |└─EXCHANGE OUT DISTR       |:EX10000    |1       |8           |
|2 |  └─SORT                   |            |1       |7           |
|3 |    └─PX PARTITION ITERATOR|            |1       |7           |
|4 |      └─TABLE FULL SCAN    |stored_table|1       |7           |
===================================================================
Outputs & filters:
-------------------------------------
  0 - output([INTERNAL_FUNCTION(stored_table.z0_col0, stored_table.z0_col1, stored_table.z0_col2)]), filter(nil), rowset=16
      sort_keys([stored_table.z0_col2, ASC])
  1 - output([stored_table.z0_col2], [INTERNAL_FUNCTION(stored_table.z0_col0, stored_table.z0_col1, stored_table.z0_col2)]), filter(nil), rowset=16
      dop=1
  2 - output([stored_table.z0_col2], [stored_table.z0_col0], [stored_table.z0_col1]), filter(nil), rowset=16
      sort_keys([stored_table.z0_col2, ASC])
  3 - output([stored_table.z0_col0], [stored_table.z0_col1], [stored_table.z0_col2]), filter(nil), rowset=16
      force partition granule
  4 - output([stored_table.z0_col0], [stored_table.z0_col1], [stored_table.z0_col2]), filter([stored_table.z0_col0 + stored_table.z0_col1 = 0]), rowset=16
      access([stored_table.z0_col0], [stored_table.z0_col1], [stored_table.z0_col2]), partitions(p[0-2])
      is_index_back=false, is_global_index=false, filter_before_indexback[false], 
      range_key([stored_table.__pk_increment]), range(MIN ; MAX)always true
### COLUMNS分区
drop table virtual_table;
create table virtual_table(
z0_col0 int, 
z0_col1 int,
z0_col2 int as (abs(z0_col0-z0_col1)))
partition by range columns(z0_col2) (
partition p0 values less than (10),
partition p1 values less than (20),
partition p2 values less than maxvalue);
insert into virtual_table (z0_col0,z0_col1) values (0,0),(NULL,NULL),(5,25),(20,30),(100,10);
select z0_col0,z0_col1,z0_col2 from virtual_table partition(p0) order by z0_col2;
+---------+---------+---------+
| z0_col0 | z0_col1 | z0_col2 |
+---------+---------+---------+
|    NULL |    NULL |    NULL |
|       0 |       0 |       0 |
+---------+---------+---------+
select z0_col0,z0_col1,z0_col2 from virtual_table partition(p1) order by z0_col2;
+---------+---------+---------+
| z0_col0 | z0_col1 | z0_col2 |
+---------+---------+---------+
|      20 |      30 |      10 |
+---------+---------+---------+
select z0_col0,z0_col1,z0_col2 from virtual_table partition(p2) order by z0_col2;
+---------+---------+---------+
| z0_col0 | z0_col1 | z0_col2 |
+---------+---------+---------+
|       5 |      25 |      20 |
|     100 |      10 |      90 |
+---------+---------+---------+
explain select z0_col0,z0_col1,z0_col2 from virtual_table where z0_col2 = 0 order by z0_col2;
Query Plan
========================================================
|ID|OPERATOR       |NAME         |EST.ROWS|EST.TIME(us)|
--------------------------------------------------------
|0 |TABLE FULL SCAN|virtual_table|1       |3           |
========================================================
Outputs & filters:
-------------------------------------
  0 - output([virtual_table.z0_col0], [virtual_table.z0_col1], [column_conv(INT,PS:(11,0),NULL,cast(abs(virtual_table.z0_col0 - virtual_table.z0_col1), 
      INT(-1, 0)))]), filter([column_conv(INT,PS:(11,0),NULL,cast(abs(virtual_table.z0_col0 - virtual_table.z0_col1), INT(-1, 0))) = 0]), rowset=16
      access([virtual_table.z0_col0], [virtual_table.z0_col1]), partitions(p0)
      is_index_back=false, is_global_index=false, filter_before_indexback[false], 
      range_key([virtual_table.__pk_increment]), range(MIN ; MAX)always true
explain select z0_col0,z0_col1,z0_col2 from virtual_table where abs(z0_col0-z0_col1) = 0 order by z0_col2;
Query Plan
====================================================================
|ID|OPERATOR                   |NAME         |EST.ROWS|EST.TIME(us)|
--------------------------------------------------------------------
|0 |PX COORDINATOR MERGE SORT  |             |1       |9           |
|1 |└─EXCHANGE OUT DISTR       |:EX10000     |1       |8           |
|2 |  └─SORT                   |             |1       |7           |
|3 |    └─PX PARTITION ITERATOR|             |1       |7           |
|4 |      └─TABLE FULL SCAN    |virtual_table|1       |7           |
====================================================================
Outputs & filters:
-------------------------------------
  0 - output([INTERNAL_FUNCTION(virtual_table.z0_col0, virtual_table.z0_col1, column_conv(INT,PS:(11,0),NULL,cast(abs(virtual_table.z0_col0 - virtual_table.z0_col1),
       INT(-1, 0))))]), filter(nil), rowset=16
      sort_keys([column_conv(INT,PS:(11,0),NULL,cast(abs(virtual_table.z0_col0 - virtual_table.z0_col1), INT(-1, 0))), ASC])
  1 - output([column_conv(INT,PS:(11,0),NULL,cast(abs(virtual_table.z0_col0 - virtual_table.z0_col1), INT(-1, 0)))], [INTERNAL_FUNCTION(virtual_table.z0_col0,
       virtual_table.z0_col1, column_conv(INT,PS:(11,0),NULL,cast(abs(virtual_table.z0_col0 - virtual_table.z0_col1), INT(-1, 0))))]), filter(nil), rowset=16
      dop=1
  2 - output([column_conv(INT,PS:(11,0),NULL,cast(abs(virtual_table.z0_col0 - virtual_table.z0_col1), INT(-1, 0)))], [virtual_table.z0_col0], [virtual_table.z0_col1]), filter(nil), rowset=16
      sort_keys([column_conv(INT,PS:(11,0),NULL,cast(abs(virtual_table.z0_col0 - virtual_table.z0_col1), INT(-1, 0))), ASC])
  3 - output([virtual_table.z0_col0], [virtual_table.z0_col1], [column_conv(INT,PS:(11,0),NULL,cast(abs(virtual_table.z0_col0 - virtual_table.z0_col1), 
      INT(-1, 0)))]), filter(nil), rowset=16
      force partition granule
  4 - output([virtual_table.z0_col0], [virtual_table.z0_col1], [column_conv(INT,PS:(11,0),NULL,cast(abs(virtual_table.z0_col0 - virtual_table.z0_col1), 
      INT(-1, 0)))]), filter([abs(virtual_table.z0_col0 - virtual_table.z0_col1) = 0]), rowset=16
      access([virtual_table.z0_col0], [virtual_table.z0_col1]), partitions(p[0-2])
      is_index_back=false, is_global_index=false, filter_before_indexback[false], 
      range_key([virtual_table.__pk_increment]), range(MIN ; MAX)always true
drop table stored_table;
create table stored_table(
z0_col0 int,
z0_col1 int,
z0_col2 int as (abs(z0_col0-z0_col1)) stored)
partition by range columns(z0_col2) (
partition p0 values less than (10),
partition p1 values less than (20),
partition p2 values less than maxvalue);
insert into stored_table (z0_col0,z0_col1) values (0,0),(NULL,NULL),(5,25),(20,30),(100,10);
select z0_col0,z0_col1,z0_col2 from stored_table partition(p0) order by z0_col2;
+---------+---------+---------+
| z0_col0 | z0_col1 | z0_col2 |
+---------+---------+---------+
|    NULL |    NULL |    NULL |
|       0 |       0 |       0 |
+---------+---------+---------+
select z0_col0,z0_col1,z0_col2 from stored_table partition(p1) order by z0_col2;
+---------+---------+---------+
| z0_col0 | z0_col1 | z0_col2 |
+---------+---------+---------+
|      20 |      30 |      10 |
+---------+---------+---------+
select z0_col0,z0_col1,z0_col2 from stored_table partition(p2) order by z0_col2;
+---------+---------+---------+
| z0_col0 | z0_col1 | z0_col2 |
+---------+---------+---------+
|       5 |      25 |      20 |
|     100 |      10 |      90 |
+---------+---------+---------+
explain select z0_col0,z0_col1,z0_col2 from stored_table where z0_col2 = 0 order by z0_col2;
Query Plan
=======================================================
|ID|OPERATOR       |NAME        |EST.ROWS|EST.TIME(us)|
-------------------------------------------------------
|0 |TABLE FULL SCAN|stored_table|1       |3           |
=======================================================
Outputs & filters:
-------------------------------------
  0 - output([stored_table.z0_col0], [stored_table.z0_col1], [stored_table.z0_col2]), filter([stored_table.z0_col2 = 0]), rowset=16
      access([stored_table.z0_col0], [stored_table.z0_col1], [stored_table.z0_col2]), partitions(p0)
      is_index_back=false, is_global_index=false, filter_before_indexback[false], 
      range_key([stored_table.__pk_increment]), range(MIN ; MAX)always true
explain select z0_col0,z0_col1,z0_col2 from stored_table where abs(z0_col0-z0_col1) = 0 order by z0_col2;
Query Plan
===================================================================
|ID|OPERATOR                   |NAME        |EST.ROWS|EST.TIME(us)|
-------------------------------------------------------------------
|0 |PX COORDINATOR MERGE SORT  |            |1       |9           |
|1 |└─EXCHANGE OUT DISTR       |:EX10000    |1       |8           |
|2 |  └─SORT                   |            |1       |7           |
|3 |    └─PX PARTITION ITERATOR|            |1       |7           |
|4 |      └─TABLE FULL SCAN    |stored_table|1       |7           |
===================================================================
Outputs & filters:
-------------------------------------
  0 - output([INTERNAL_FUNCTION(stored_table.z0_col0, stored_table.z0_col1, stored_table.z0_col2)]), filter(nil), rowset=16
      sort_keys([stored_table.z0_col2, ASC])
  1 - output([stored_table.z0_col2], [INTERNAL_FUNCTION(stored_table.z0_col0, stored_table.z0_col1, stored_table.z0_col2)]), filter(nil), rowset=16
      dop=1
  2 - output([stored_table.z0_col2], [stored_table.z0_col0], [stored_table.z0_col1]), filter(nil), rowset=16
      sort_keys([stored_table.z0_col2, ASC])
  3 - output([stored_table.z0_col0], [stored_table.z0_col1], [stored_table.z0_col2]), filter(nil), rowset=16
      force partition granule
  4 - output([stored_table.z0_col0], [stored_table.z0_col1], [stored_table.z0_col2]), filter([abs(stored_table.z0_col0 - stored_table.z0_col1) = 0]), rowset=16
      access([stored_table.z0_col0], [stored_table.z0_col1], [stored_table.z0_col2]), partitions(p[0-2])
      is_index_back=false, is_global_index=false, filter_before_indexback[false], 
      range_key([stored_table.__pk_increment]), range(MIN ; MAX)always true
### 视图
# 单基表 含有虚拟列(VIRTUAL)的表
drop table virtual_table;
create table virtual_table(
z0_col0 char(100), 
z0_col1 varchar(100),
z0_col2 varchar(100) as (concat(z0_col0,z0_col1)) virtual);
insert into virtual_table (z0_col0,z0_col1) values (0,0),(NULL,NULL),('2022-06-21','ten'),(100,10.00);
select z0_col0,z0_col1,z0_col2 from virtual_table order by z0_col2;
+------------+---------+---------------+
| z0_col0    | z0_col1 | z0_col2       |
+------------+---------+---------------+
| NULL       | NULL    | NULL          |
| 0          | 0       | 00            |
| 100        | 10.00   | 10010.00      |
| 2022-06-21 | ten     | 2022-06-21ten |
+------------+---------+---------------+
drop view view1;
create view view1 as select z0_col0,z0_col1,z0_col2 from virtual_table where length(z0_col2)>1 order by 1;
select * from view1 order by 1;
+------------+---------+---------------+
| z0_col0    | z0_col1 | z0_col2       |
+------------+---------+---------------+
| 0          | 0       | 00            |
| 100        | 10.00   | 10010.00      |
| 2022-06-21 | ten     | 2022-06-21ten |
+------------+---------+---------------+
insert into view1 (z0_col0,z0_col1) values ('view-','-insert');
select * from view1 order by 1;
+------------+---------+---------------+
| z0_col0    | z0_col1 | z0_col2       |
+------------+---------+---------------+
| 0          | 0       | 00            |
| 100        | 10.00   | 10010.00      |
| 2022-06-21 | ten     | 2022-06-21ten |
| view-      | -insert | view--insert  |
+------------+---------+---------------+
update  view1 set z0_col2=0 where 1=1;
ERROR HY000: The value specified for generated column 'z0_col2' in table 'view1' is not allowed
# 单基表 含有生成列(STORED)的表
drop table stored_table;
create table stored_table (
z0_col0 char(100), 
z0_col1 varchar(100),
z0_col2 varchar(100) as (concat(z0_col0,z0_col1)) stored);
insert into stored_table (z0_col0,z0_col1) values (0,0),(NULL,NULL),('2022-06-21','ten'),(100,10.00);
select z0_col0,z0_col1,z0_col2 from stored_table order by z0_col2;
+------------+---------+---------------+
| z0_col0    | z0_col1 | z0_col2       |
+------------+---------+---------------+
| NULL       | NULL    | NULL          |
| 0          | 0       | 00            |
| 100        | 10.00   | 10010.00      |
| 2022-06-21 | ten     | 2022-06-21ten |
+------------+---------+---------------+
drop view view1;
create view view1 as select z0_col0,z0_col1,z0_col2 from stored_table where length(z0_col2)>1 order by 1;
select * from view1 order by z0_col2;
+------------+---------+---------------+
| z0_col0    | z0_col1 | z0_col2       |
+------------+---------+---------------+
| 0          | 0       | 00            |
| 100        | 10.00   | 10010.00      |
| 2022-06-21 | ten     | 2022-06-21ten |
+------------+---------+---------------+
insert into view1 (z0_col0,z0_col1) values ('view-','-insert');
select * from view1 order by z0_col2;
+------------+---------+---------------+
| z0_col0    | z0_col1 | z0_col2       |
+------------+---------+---------------+
| 0          | 0       | 00            |
| 100        | 10.00   | 10010.00      |
| 2022-06-21 | ten     | 2022-06-21ten |
| view-      | -insert | view--insert  |
+------------+---------+---------------+
update  view1 set z0_col2=0 where 1=1;
ERROR HY000: The value specified for generated column 'z0_col2' in table 'view1' is not allowed
# 单基表 普通的表，后追加生成列(VIRTUAL/STORED)
drop table stored_table;
create table stored_table (
z0_col0 char(100), 
z0_col1 varchar(100));
alter table stored_table add z0_col2 varchar(100) as (concat(z0_col0,z0_col1)) virtual;
alter table stored_table add z0_col3 varchar(100) as (lower(concat(z0_col0,z0_col1))) stored;
insert into stored_table (z0_col0,z0_col1) values (0,0),(NULL,NULL),('2022-06-21','ten'),('WANGHUANHUAN ','CHINA');
select z0_col0,z0_col1,z0_col2,z0_col3 from stored_table order by z0_col1;
+--------------+---------+-------------------+-------------------+
| z0_col0      | z0_col1 | z0_col2           | z0_col3           |
+--------------+---------+-------------------+-------------------+
| NULL         | NULL    | NULL              | NULL              |
| 0            | 0       | 00                | 00                |
| WANGHUANHUAN | CHINA   | WANGHUANHUANCHINA | wanghuanhuanchina |
| 2022-06-21   | ten     | 2022-06-21ten     | 2022-06-21ten     |
+--------------+---------+-------------------+-------------------+
drop view view1;
create view view1 as select * from stored_table;
select * from view1 order by z0_col2;
+--------------+---------+-------------------+-------------------+
| z0_col0      | z0_col1 | z0_col2           | z0_col3           |
+--------------+---------+-------------------+-------------------+
| NULL         | NULL    | NULL              | NULL              |
| 0            | 0       | 00                | 00                |
| 2022-06-21   | ten     | 2022-06-21ten     | 2022-06-21ten     |
| WANGHUANHUAN | CHINA   | WANGHUANHUANCHINA | wanghuanhuanchina |
+--------------+---------+-------------------+-------------------+
update  view1 set z0_col2=0 where 1=1;
ERROR HY000: The value specified for generated column 'z0_col2' in table 'view1' is not allowed
# 单基表 两个含有虚拟列(VIRTUAL)的表
drop table virtual_table1;
create  table virtual_table1 (
id int,
z0_col0 char(100), 
z0_col1 varchar(100),
z0_col2 varchar(100) as (concat(z0_col0,z0_col1)) virtual);
insert into virtual_table1 (id,z0_col0,z0_col1) values (0,0,0),(1,NULL,NULL),(2,'virtual_table1','one'),(3,100,10.00);
select id,z0_col0,z0_col1,z0_col2 from virtual_table1 order by z0_col2;
+------+----------------+---------+-------------------+
| id   | z0_col0        | z0_col1 | z0_col2           |
+------+----------------+---------+-------------------+
|    1 | NULL           | NULL    | NULL              |
|    0 | 0              | 0       | 00                |
|    3 | 100            | 10.00   | 10010.00          |
|    2 | virtual_table1 | one     | virtual_table1one |
+------+----------------+---------+-------------------+
drop table virtual_table2;
create  table virtual_table2 (
id int,
z1_col0 char(100), 
z1_col1 varchar(100),
z1_col2 varchar(100) as (concat(z1_col0,z1_col1)) virtual);
insert into virtual_table2 (id,z1_col0,z1_col1) values (0,0,0),(1,NULL,NULL),(2,'virtual_table2','two'),(3,200,20.00);
select id,z1_col0,z1_col1,z1_col2 from virtual_table2 order by z1_col2;
+------+----------------+---------+-------------------+
| id   | z1_col0        | z1_col1 | z1_col2           |
+------+----------------+---------+-------------------+
|    1 | NULL           | NULL    | NULL              |
|    0 | 0              | 0       | 00                |
|    3 | 200            | 20.00   | 20020.00          |
|    2 | virtual_table2 | two     | virtual_table2two |
+------+----------------+---------+-------------------+
drop view view1;
create view view1 as select t1.z0_col0,t1.z0_col1,t1.z0_col2,t2.z1_col0,t2.z1_col1,t2.z1_col2 from virtual_table1 t1 inner join virtual_table2 t2 on t1.id=t2.id order by 1;
select * from view1 order by 1;
+----------------+---------+-------------------+----------------+---------+-------------------+
| z0_col0        | z0_col1 | z0_col2           | z1_col0        | z1_col1 | z1_col2           |
+----------------+---------+-------------------+----------------+---------+-------------------+
| NULL           | NULL    | NULL              | NULL           | NULL    | NULL              |
| 0              | 0       | 00                | 0              | 0       | 00                |
| 100            | 10.00   | 10010.00          | 200            | 20.00   | 20020.00          |
| virtual_table1 | one     | virtual_table1one | virtual_table2 | two     | virtual_table2two |
+----------------+---------+-------------------+----------------+---------+-------------------+
insert into view1 (z0_col0,z0_col1,z1_col0,z1_col1) values ('view-','-insert1','view-','-insert2');
ERROR HY000: Can not modify more than one base table through a join view 'whh.view1'
# 单基表 两个含有生成列(STORED)的表
drop table stored_table1;
create  table stored_table1 (
id int,
z0_col0 char(100), 
z0_col1 varchar(100),
z0_col2 varchar(100) as (concat(z0_col0,z0_col1)) stored);
insert into stored_table1 (id,z0_col0,z0_col1) values (0,0,0),(1,NULL,NULL),(2,'stored_table1','one'),(3,100,10.00);
select id,z0_col0,z0_col1,z0_col2 from stored_table1 order by z0_col2;
+------+---------------+---------+------------------+
| id   | z0_col0       | z0_col1 | z0_col2          |
+------+---------------+---------+------------------+
|    1 | NULL          | NULL    | NULL             |
|    0 | 0             | 0       | 00               |
|    3 | 100           | 10.00   | 10010.00         |
|    2 | stored_table1 | one     | stored_table1one |
+------+---------------+---------+------------------+
drop table stored_table2;
create  table stored_table2 (
id int,
z1_col0 char(100), 
z1_col1 varchar(100),
z1_col2 varchar(100) as (concat(z1_col0,z1_col1)) stored);
insert into stored_table2 (id,z1_col0,z1_col1) values (0,0,0),(1,NULL,NULL),(2,'stored_table2','two'),(3,200,20.00);
select id,z1_col0,z1_col1,z1_col2 from stored_table2 order by z1_col2;
+------+---------------+---------+------------------+
| id   | z1_col0       | z1_col1 | z1_col2          |
+------+---------------+---------+------------------+
|    1 | NULL          | NULL    | NULL             |
|    0 | 0             | 0       | 00               |
|    3 | 200           | 20.00   | 20020.00         |
|    2 | stored_table2 | two     | stored_table2two |
+------+---------------+---------+------------------+
drop view view1;
create view view1 as select t1.z0_col0,t1.z0_col1,t1.z0_col2,t2.z1_col0,t2.z1_col1,t2.z1_col2 from stored_table1 t1 inner join stored_table2 t2 on t1.id=t2.id order by 1;
select * from view1 order by z0_col2;
+---------------+---------+------------------+---------------+---------+------------------+
| z0_col0       | z0_col1 | z0_col2          | z1_col0       | z1_col1 | z1_col2          |
+---------------+---------+------------------+---------------+---------+------------------+
| NULL          | NULL    | NULL             | NULL          | NULL    | NULL             |
| 0             | 0       | 00               | 0             | 0       | 00               |
| 100           | 10.00   | 10010.00         | 200           | 20.00   | 20020.00         |
| stored_table1 | one     | stored_table1one | stored_table2 | two     | stored_table2two |
+---------------+---------+------------------+---------------+---------+------------------+
insert into view1 (z0_col0,z0_col1,z1_col0,z1_col1) values ('view-','-insert1','view-','-insert2');
ERROR HY000: Can not modify more than one base table through a join view 'whh.view1'
# 单基表 一个含有虚拟列(VIRTUAL)的表，一个含有生成列(STORED)的表
drop table virtual_table1;
create  table virtual_table1 (
id int,
z0_col0 char(100), 
z0_col1 varchar(100),
z0_col2 varchar(100) as (concat(z0_col0,z0_col1)) virtual);
insert into virtual_table1 (id,z0_col0,z0_col1) values (0,0,0),(1,NULL,NULL),(2,'virtual_table1','one'),(3,100,10.00);
select id,z0_col0,z0_col1,z0_col2 from virtual_table1 order by z0_col2;
+------+----------------+---------+-------------------+
| id   | z0_col0        | z0_col1 | z0_col2           |
+------+----------------+---------+-------------------+
|    1 | NULL           | NULL    | NULL              |
|    0 | 0              | 0       | 00                |
|    3 | 100            | 10.00   | 10010.00          |
|    2 | virtual_table1 | one     | virtual_table1one |
+------+----------------+---------+-------------------+
drop table stored_table2;
create  table stored_table2 (
id int,
z1_col0 char(100), 
z1_col1 varchar(100),
z1_col2 varchar(100) as (concat(z1_col0,z1_col1)) stored);
insert into stored_table2 (id,z1_col0,z1_col1) values (0,0,0),(1,NULL,NULL),(2,'stored_table2','two'),(3,200,20.00);
select id,z1_col0,z1_col1,z1_col2 from stored_table2 order by z1_col2;
+------+---------------+---------+------------------+
| id   | z1_col0       | z1_col1 | z1_col2          |
+------+---------------+---------+------------------+
|    1 | NULL          | NULL    | NULL             |
|    0 | 0             | 0       | 00               |
|    3 | 200           | 20.00   | 20020.00         |
|    2 | stored_table2 | two     | stored_table2two |
+------+---------------+---------+------------------+
drop view view1;
create view view1 as select t1.z0_col0,t1.z0_col1,t1.z0_col2,t2.z1_col0,t2.z1_col1,t2.z1_col2 from virtual_table1 t1 inner join stored_table2 t2 on t1.id=t2.id order by 1;
select * from view1 order by z0_col2;
+----------------+---------+-------------------+---------------+---------+------------------+
| z0_col0        | z0_col1 | z0_col2           | z1_col0       | z1_col1 | z1_col2          |
+----------------+---------+-------------------+---------------+---------+------------------+
| NULL           | NULL    | NULL              | NULL          | NULL    | NULL             |
| 0              | 0       | 00                | 0             | 0       | 00               |
| 100            | 10.00   | 10010.00          | 200           | 20.00   | 20020.00         |
| virtual_table1 | one     | virtual_table1one | stored_table2 | two     | stored_table2two |
+----------------+---------+-------------------+---------------+---------+------------------+
insert into view1 (z0_col0,z0_col1,z1_col0,z1_col1) values ('view-','-insert1','view-','-insert2');
ERROR HY000: Can not modify more than one base table through a join view 'whh.view1'
### ALTER TABLE 语句
# RENAME 重命名表
drop table test_table;
create table test_table(
z0_col0 float, 
z0_col1 float,
z0_col2 float as(z0_col0+z0_col1) virtual,
z0_col3 float as(floor(z0_col0+z0_col1)) stored
);
insert into test_table (z0_col0,z0_col1) values (0,0),(NULL,NULL),(1.111,22.2),(10.5,10.9),(-100.5,20.9);
select z0_col0,z0_col1,z0_col2,abs(z0_col3) from test_table order by z0_col2;
+---------+---------+---------+--------------+
| z0_col0 | z0_col1 | z0_col2 | abs(z0_col3) |
+---------+---------+---------+--------------+
|    NULL |    NULL |    NULL |         NULL |
|  -100.5 |    20.9 |   -79.6 |           80 |
|       0 |       0 |       0 |            0 |
|    10.5 |    10.9 |    21.4 |           21 |
|   1.111 |    22.2 |  23.311 |           23 |
+---------+---------+---------+--------------+
select max(z0_col2),min(z0_col3) from test_table order by z0_col2;
+--------------+--------------+
| max(z0_col2) | min(z0_col3) |
+--------------+--------------+
|       23.311 |          -80 |
+--------------+--------------+
drop table new_test_table;
alter table test_table rename to new_test_table;
insert into new_test_table (z0_col0,z0_col1) values (100,200);
select z0_col0,z0_col1,z0_col2,abs(z0_col3) from new_test_table order by z0_col2;
+---------+---------+---------+--------------+
| z0_col0 | z0_col1 | z0_col2 | abs(z0_col3) |
+---------+---------+---------+--------------+
|    NULL |    NULL |    NULL |         NULL |
|  -100.5 |    20.9 |   -79.6 |           80 |
|       0 |       0 |       0 |            0 |
|    10.5 |    10.9 |    21.4 |           21 |
|   1.111 |    22.2 |  23.311 |           23 |
|     100 |     200 |     300 |          300 |
+---------+---------+---------+--------------+
# RENAME COLUMN 重命名生成列 ob不支持重命名列名，报ERROR 1064.
drop table test_table1;
create table test_table1(
z0_col0 int,
z0_col1 int,
z0_col2 int as(abs(z0_col0)) virtual,
z0_col3 int as(power(z0_col1,2)) stored
);
insert into test_table1 (z0_col0,z0_col1) values (0,10),(-20,20),(3.50,30);
select * from test_table1 order by z0_col2;
+---------+---------+---------+---------+
| z0_col0 | z0_col1 | z0_col2 | z0_col3 |
+---------+---------+---------+---------+
|       0 |      10 |       0 |     100 |
|       4 |      30 |       4 |     900 |
|     -20 |      20 |      20 |     400 |
+---------+---------+---------+---------+
alter table test_table1 rename column z0_col2 to new_z0_col2;
alter table test_table1 rename column z0_col3 to new_z0_col3;
insert into new_test_table (z0_col0,z0_col1) values (5.5,10.6);
select z0_col0,z0_col1,z0_col2,abs(z0_col3) from new_test_table order by z0_col2;
+---------+---------+---------+--------------+
| z0_col0 | z0_col1 | z0_col2 | abs(z0_col3) |
+---------+---------+---------+--------------+
|    NULL |    NULL |    NULL |         NULL |
|  -100.5 |    20.9 |   -79.6 |           80 |
|       0 |       0 |       0 |            0 |
|     5.5 |    10.6 |    16.1 |           16 |
|    10.5 |    10.9 |    21.4 |           21 |
|   1.111 |    22.2 |  23.311 |           23 |
|     100 |     200 |     300 |          300 |
+---------+---------+---------+--------------+
# RENAME COLUMN 重命名生成列引用的普通列
alter table test_table1 rename column z0_col0 to new_z0_col0;
ERROR HY000: Column 'z0_col0' has a generated column dependency
insert into new_test_table (z0_col0,z0_col1) values (-40,5);
select z0_col0,z0_col1,z0_col2,abs(z0_col3) from new_test_table order by z0_col2;
+---------+---------+---------+--------------+
| z0_col0 | z0_col1 | z0_col2 | abs(z0_col3) |
+---------+---------+---------+--------------+
|    NULL |    NULL |    NULL |         NULL |
|  -100.5 |    20.9 |   -79.6 |           80 |
|     -40 |       5 |     -35 |           35 |
|       0 |       0 |       0 |            0 |
|     5.5 |    10.6 |    16.1 |           16 |
|    10.5 |    10.9 |    21.4 |           21 |
|   1.111 |    22.2 |  23.311 |           23 |
|     100 |     200 |     300 |          300 |
+---------+---------+---------+--------------+
# MODIFY 修改生成列 虚拟生成列-》存储生成列
drop table test_table;
create table test_table(
z0_col0 float, 
z0_col1 float,
z0_col2 float as(z0_col0/z0_col1) virtual
);
insert into test_table (z0_col0,z0_col1) values (0,0),(NULL,NULL),(1.111,22.2),(10.5,10.9),(-100.5,20.9);
select z0_col0,z0_col1,z0_col2 from test_table order by z0_col2;
+---------+---------+----------+
| z0_col0 | z0_col1 | z0_col2  |
+---------+---------+----------+
|       0 |       0 |     NULL |
|    NULL |    NULL |     NULL |
|  -100.5 |    20.9 | -4.80861 |
|   1.111 |    22.2 | 0.050045 |
|    10.5 |    10.9 | 0.963303 |
+---------+---------+----------+
alter table test_table modify z0_col2 float as(z0_col0/z0_col1) stored;
Got one of the listed errors
# MODIFY 修改生成列 虚拟生成列-》普通列
drop table test_table;
create table test_table(
z0_col0 float, 
z0_col1 float,
z0_col2 float as(z0_col0/z0_col1) virtual
);
insert into test_table (z0_col0,z0_col1) values (0,0),(NULL,NULL),(1.111,22.2),(10.5,10.9),(-100.5,20.9);
select z0_col0,z0_col1,z0_col2 from test_table order by z0_col2;
+---------+---------+----------+
| z0_col0 | z0_col1 | z0_col2  |
+---------+---------+----------+
|       0 |       0 |     NULL |
|    NULL |    NULL |     NULL |
|  -100.5 |    20.9 | -4.80861 |
|   1.111 |    22.2 | 0.050045 |
|    10.5 |    10.9 | 0.963303 |
+---------+---------+----------+
alter table test_table modify z0_col2 float;
Got one of the listed errors
# MODIFY 修改生成列 存储生成列-》虚拟生成列
drop table test_table;
create table test_table(
z0_col0 float, 
z0_col1 float,
z0_col2 float as(z0_col0/z0_col1) stored
);
insert into test_table (z0_col0,z0_col1) values (0,0),(NULL,NULL),(1.111,22.2),(10.5,10.9),(-100.5,20.9);
select z0_col0,z0_col1,z0_col2 from test_table order by z0_col2;
+---------+---------+----------+
| z0_col0 | z0_col1 | z0_col2  |
+---------+---------+----------+
|       0 |       0 |     NULL |
|    NULL |    NULL |     NULL |
|  -100.5 |    20.9 | -4.80861 |
|   1.111 |    22.2 | 0.050045 |
|    10.5 |    10.9 | 0.963303 |
+---------+---------+----------+
alter table test_table modify z0_col2 float as(z0_col0/z0_col1) virtual;
Got one of the listed errors
show create table test_table;
Table	Create Table
test_table	CREATE TABLE `test_table` (
  `z0_col0` float DEFAULT NULL,
  `z0_col1` float DEFAULT NULL,
  `z0_col2` float GENERATED ALWAYS AS ((`z0_col0` / `z0_col1`)) STORED
) ORGANIZATION INDEX DEFAULT CHARSET = utf8mb4 ROW_FORMAT = DYNAMIC COMPRESSION = 'zstd_1.3.8' REPLICA_NUM = 1 BLOCK_SIZE = 16384 USE_BLOOM_FILTER = FALSE ENABLE_MACRO_BLOCK_BLOOM_FILTER = FALSE TABLET_SIZE = 134217728 PCTFREE = 0
# MODIFY 修改生成列 存储生成列-》普通列
# bug1:【Generated Columns】OB Mysql模式，将存储生成列更改为普通列,mysql成功，ob失败。
drop table test_table;
create table test_table(
z0_col0 float, 
z0_col1 float,
z0_col2 float as(z0_col0/z0_col1) stored
);
insert into test_table (z0_col0,z0_col1) values (0,0),(NULL,NULL),(1.111,22.2),(10.5,10.9),(-100.5,20.9);
select z0_col0,z0_col1,z0_col2 from test_table order by z0_col2;
+---------+---------+----------+
| z0_col0 | z0_col1 | z0_col2  |
+---------+---------+----------+
|       0 |       0 |     NULL |
|    NULL |    NULL |     NULL |
|  -100.5 |    20.9 | -4.80861 |
|   1.111 |    22.2 | 0.050045 |
|    10.5 |    10.9 | 0.963303 |
+---------+---------+----------+
alter table test_table modify z0_col2 float;
Got one of the listed errors
select z0_col0,z0_col1,z0_col2 from test_table order by z0_col2;
+---------+---------+----------+
| z0_col0 | z0_col1 | z0_col2  |
+---------+---------+----------+
|       0 |       0 |     NULL |
|    NULL |    NULL |     NULL |
|  -100.5 |    20.9 | -4.80861 |
|   1.111 |    22.2 | 0.050045 |
|    10.5 |    10.9 | 0.963303 |
+---------+---------+----------+
show create table test_table;
Table	Create Table
test_table	CREATE TABLE `test_table` (
  `z0_col0` float DEFAULT NULL,
  `z0_col1` float DEFAULT NULL,
  `z0_col2` float GENERATED ALWAYS AS ((`z0_col0` / `z0_col1`)) STORED
) ORGANIZATION INDEX DEFAULT CHARSET = utf8mb4 ROW_FORMAT = DYNAMIC COMPRESSION = 'zstd_1.3.8' REPLICA_NUM = 1 BLOCK_SIZE = 16384 USE_BLOOM_FILTER = FALSE ENABLE_MACRO_BLOCK_BLOOM_FILTER = FALSE TABLET_SIZE = 134217728 PCTFREE = 0
# MODIFY 修改生成列 普通列-》虚拟生成列
drop table test_table;
create table test_table(
z0_col0 float, 
z0_col1 float,
z0_col2 float
);
insert into test_table (z0_col0,z0_col1) values (0,0),(NULL,NULL),(1.111,22.2),(10.5,10.9),(-100.5,20.9);
select z0_col0,z0_col1,z0_col2 from test_table order by z0_col2;
+---------+---------+---------+
| z0_col0 | z0_col1 | z0_col2 |
+---------+---------+---------+
|       0 |       0 |    NULL |
|    NULL |    NULL |    NULL |
|   1.111 |    22.2 |    NULL |
|    10.5 |    10.9 |    NULL |
|  -100.5 |    20.9 |    NULL |
+---------+---------+---------+
alter table test_table modify z0_col2 float as(z0_col0/z0_col1) virtual;
Got one of the listed errors
select z0_col0,z0_col1,z0_col2 from test_table order by z0_col2;
+---------+---------+---------+
| z0_col0 | z0_col1 | z0_col2 |
+---------+---------+---------+
|       0 |       0 |    NULL |
|    NULL |    NULL |    NULL |
|   1.111 |    22.2 |    NULL |
|    10.5 |    10.9 |    NULL |
|  -100.5 |    20.9 |    NULL |
+---------+---------+---------+
show create table test_table;
Table	Create Table
test_table	CREATE TABLE `test_table` (
  `z0_col0` float DEFAULT NULL,
  `z0_col1` float DEFAULT NULL,
  `z0_col2` float DEFAULT NULL
) ORGANIZATION INDEX DEFAULT CHARSET = utf8mb4 ROW_FORMAT = DYNAMIC COMPRESSION = 'zstd_1.3.8' REPLICA_NUM = 1 BLOCK_SIZE = 16384 USE_BLOOM_FILTER = FALSE ENABLE_MACRO_BLOCK_BLOOM_FILTER = FALSE TABLET_SIZE = 134217728 PCTFREE = 0
# MODIFY 修改生成列 普通列-》存储生成列
# bug2:【Generated Columns】OB Mysql模式，将普通列更改为存储生成列,mysql成功，ob失败。
drop table test_table;
create table test_table(
z0_col0 float, 
z0_col1 float,
z0_col2 float
);
insert into test_table (z0_col0,z0_col1) values (0,0),(NULL,NULL),(1.111,22.2),(10.5,10.9),(-100.5,20.9);
select z0_col0,z0_col1,z0_col2 from test_table order by z0_col2;
+---------+---------+---------+
| z0_col0 | z0_col1 | z0_col2 |
+---------+---------+---------+
|       0 |       0 |    NULL |
|    NULL |    NULL |    NULL |
|   1.111 |    22.2 |    NULL |
|    10.5 |    10.9 |    NULL |
|  -100.5 |    20.9 |    NULL |
+---------+---------+---------+
alter table test_table modify z0_col2 float as(z0_col0/z0_col1) stored;
Got one of the listed errors
insert into test_table (z0_col0,z0_col1) values (10,40);
select z0_col0,z0_col1,z0_col2 from test_table order by z0_col2;
+---------+---------+---------+
| z0_col0 | z0_col1 | z0_col2 |
+---------+---------+---------+
|       0 |       0 |    NULL |
|    NULL |    NULL |    NULL |
|   1.111 |    22.2 |    NULL |
|    10.5 |    10.9 |    NULL |
|  -100.5 |    20.9 |    NULL |
|      10 |      40 |    NULL |
+---------+---------+---------+
show create table test_table;
Table	Create Table
test_table	CREATE TABLE `test_table` (
  `z0_col0` float DEFAULT NULL,
  `z0_col1` float DEFAULT NULL,
  `z0_col2` float DEFAULT NULL
) ORGANIZATION INDEX DEFAULT CHARSET = utf8mb4 ROW_FORMAT = DYNAMIC COMPRESSION = 'zstd_1.3.8' REPLICA_NUM = 1 BLOCK_SIZE = 16384 USE_BLOOM_FILTER = FALSE ENABLE_MACRO_BLOCK_BLOOM_FILTER = FALSE TABLET_SIZE = 134217728 PCTFREE = 0
# MODIFY 修改生成列的数据类型
# bug3:【Generated Columns】OB Mysql模式，修改生成列的数据类型（modify/change）,mysql成功，ob失败。
drop table test_table1;
create table test_table1(
z0_col0 float,
z0_col1 float,
z0_col2 int as(floor(z0_col0)) virtual,
z0_col3 int as(ceiling(z0_col1)) stored
);
insert into test_table1 (z0_col0,z0_col1) values (1.2,1.8),(2.4,2.6),(3.5,3.3);
select * from test_table1 order by z0_col2;
+---------+---------+---------+---------+
| z0_col0 | z0_col1 | z0_col2 | z0_col3 |
+---------+---------+---------+---------+
|     1.2 |     1.8 |       1 |       2 |
|     2.4 |     2.6 |       2 |       3 |
|     3.5 |     3.3 |       3 |       4 |
+---------+---------+---------+---------+
alter table test_table1 modify z0_col2 double as(floor(z0_col0)) virtual;
alter table test_table1 modify z0_col3 double as(ceiling(z0_col0)) stored;
Got one of the listed errors
insert into test_table1 (z0_col0,z0_col1) values (5.123,5.678);
select * from test_table1 order by z0_col2;
+---------+---------+---------+---------+
| z0_col0 | z0_col1 | z0_col2 | z0_col3 |
+---------+---------+---------+---------+
|     1.2 |     1.8 |       1 |       2 |
|     2.4 |     2.6 |       2 |       3 |
|     3.5 |     3.3 |       3 |       4 |
|   5.123 |   5.678 |       5 |       6 |
+---------+---------+---------+---------+
# MODIFY 修改生成列引用的普通列
alter table test_table1 modify z0_col0 double;
alter table test_table1 modify z0_col1 double;
insert into test_table1 (z0_col0,z0_col1) values (4.123,4.678);
select * from test_table1 order by z0_col2;
+--------------------+--------------------+---------+---------+
| z0_col0            | z0_col1            | z0_col2 | z0_col3 |
+--------------------+--------------------+---------+---------+
| 1.2000000476837158 | 1.7999999523162842 |       1 |       2 |
| 2.4000000953674316 | 2.5999999046325684 |       2 |       3 |
|                3.5 |  3.299999952316284 |       3 |       4 |
|              4.123 |              4.678 |       4 |       5 |
|  5.123000144958496 |  5.677999973297119 |       5 |       6 |
+--------------------+--------------------+---------+---------+
# CHANGE 修改生成列
# bug3:【Generated Columns】OB Mysql模式，修改生成列的数据类型（modify/change）,mysql成功，ob失败。
drop table test_table1;
create table test_table1(
z0_col0 char(200),
z0_col1 char(200),
z0_col2 char(200) as(upper(z0_col0)) virtual,
z0_col3 char(200) as(concat(z0_col0,z0_col1)) stored
);
insert into test_table1 (z0_col0,z0_col1) values ('mysql 8.0 ',' one'),('oracle 11g ',' two'),('oceanbase 4.0 ',' three');
select * from test_table1 order by z0_col2;
+---------------+---------+---------------+---------------------+
| z0_col0       | z0_col1 | z0_col2       | z0_col3             |
+---------------+---------+---------------+---------------------+
| mysql 8.0     |  one    | MYSQL 8.0     | mysql 8.0 one       |
| oceanbase 4.0 |  three  | OCEANBASE 4.0 | oceanbase 4.0 three |
| oracle 11g    |  two    | ORACLE 11G    | oracle 11g two      |
+---------------+---------+---------------+---------------------+
alter table test_table1 change z0_col2 z0_col22 varchar(200) as(upper(z0_col0)) virtual;
alter table test_table1 change z0_col3 z0_col33 varchar(200) as(concat(z0_col0,z0_col1)) stored;
insert into test_table1 (z0_col0,z0_col1) values (5,5);
select * from test_table1 order by z0_col22;
+---------------+---------+---------------+---------------------+
| z0_col0       | z0_col1 | z0_col22      | z0_col33            |
+---------------+---------+---------------+---------------------+
| 5             | 5       | 5             | 55                  |
| mysql 8.0     |  one    | MYSQL 8.0     | mysql 8.0 one       |
| oceanbase 4.0 |  three  | OCEANBASE 4.0 | oceanbase 4.0 three |
| oracle 11g    |  two    | ORACLE 11G    | oracle 11g two      |
+---------------+---------+---------------+---------------------+
show create table test_table1;
Table	Create Table
test_table1	CREATE TABLE `test_table1` (
  `z0_col0` char(200) DEFAULT NULL,
  `z0_col1` char(200) DEFAULT NULL,
  `z0_col22` varchar(200) GENERATED ALWAYS AS (upper(`z0_col0`)) VIRTUAL,
  `z0_col33` varchar(200) GENERATED ALWAYS AS (concat(`z0_col0`,`z0_col1`)) STORED
) ORGANIZATION INDEX DEFAULT CHARSET = utf8mb4 ROW_FORMAT = DYNAMIC COMPRESSION = 'zstd_1.3.8' REPLICA_NUM = 1 BLOCK_SIZE = 16384 USE_BLOOM_FILTER = FALSE ENABLE_MACRO_BLOCK_BLOOM_FILTER = FALSE TABLET_SIZE = 134217728 PCTFREE = 0
# CHANGE 修改生成列引用的普通列
# bug4:【Generated Columns】OB Mysql模式，修改生成列引用的普通列（change）,mysql失败，ob成功。
drop table test_table1;
create table test_table1(
z0_col0 char(200),
z0_col1 char(200),
z0_col2 char(200) as(upper(z0_col0)) virtual,
z0_col3 char(200) as(concat(z0_col0,z0_col1)) stored
);
insert into test_table1 (z0_col0,z0_col1) values ('mysql 8.0 ',' one'),('oracle 11g ',' two'),('oceanbase 4.0 ',' three');
select * from test_table1 order by z0_col2;
+---------------+---------+---------------+---------------------+
| z0_col0       | z0_col1 | z0_col2       | z0_col3             |
+---------------+---------+---------------+---------------------+
| mysql 8.0     |  one    | MYSQL 8.0     | mysql 8.0 one       |
| oceanbase 4.0 |  three  | OCEANBASE 4.0 | oceanbase 4.0 three |
| oracle 11g    |  two    | ORACLE 11G    | oracle 11g two      |
+---------------+---------+---------------+---------------------+
alter table test_table1 change z0_col0 z0_col00 varchar(200);
alter table test_table1 change z0_col1 z0_col11 varchar(200);
insert into test_table1 (z0_col00,z0_col11) values ('pl/sql ',' add');
select * from test_table1 order by z0_col2;
+---------------+----------+---------------+---------------------+
| z0_col00      | z0_col11 | z0_col2       | z0_col3             |
+---------------+----------+---------------+---------------------+
| mysql 8.0     |  one     | MYSQL 8.0     | mysql 8.0 one       |
| oceanbase 4.0 |  three   | OCEANBASE 4.0 | oceanbase 4.0 three |
| oracle 11g    |  two     | ORACLE 11G    | oracle 11g two      |
| pl/sql        |  add     | PL/SQL        | pl/sql  add         |
+---------------+----------+---------------+---------------------+
show create table test_table1;
Table	Create Table
test_table1	CREATE TABLE `test_table1` (
  `z0_col00` varchar(200) DEFAULT NULL,
  `z0_col11` varchar(200) DEFAULT NULL,
  `z0_col2` char(200) GENERATED ALWAYS AS (upper(`z0_col00`)) VIRTUAL,
  `z0_col3` char(200) GENERATED ALWAYS AS (concat(`z0_col00`,`z0_col11`)) STORED
) ORGANIZATION INDEX DEFAULT CHARSET = utf8mb4 ROW_FORMAT = DYNAMIC COMPRESSION = 'zstd_1.3.8' REPLICA_NUM = 1 BLOCK_SIZE = 16384 USE_BLOOM_FILTER = FALSE ENABLE_MACRO_BLOCK_BLOOM_FILTER = FALSE TABLET_SIZE = 134217728 PCTFREE = 0
# DROP 删除生成列
drop table test_table1;
create table test_table1(
z0_col0 char(200),
z0_col1 char(200),
z0_col2 char(200) as(upper(z0_col0)) virtual,
z0_col3 char(200) as(concat(z0_col0,z0_col1)) stored
);
insert into test_table1 (z0_col0,z0_col1) values ('mysql 8.0 ',' one'),('oracle 11g ',' two'),('oceanbase 4.0 ',' three');
select * from test_table1 order by z0_col2;
+---------------+---------+---------------+---------------------+
| z0_col0       | z0_col1 | z0_col2       | z0_col3             |
+---------------+---------+---------------+---------------------+
| mysql 8.0     |  one    | MYSQL 8.0     | mysql 8.0 one       |
| oceanbase 4.0 |  three  | OCEANBASE 4.0 | oceanbase 4.0 three |
| oracle 11g    |  two    | ORACLE 11G    | oracle 11g two      |
+---------------+---------+---------------+---------------------+
alter table test_table1 drop z0_col2;
alter table test_table1 drop z0_col3;
insert into test_table1 (z0_col0,z0_col1) values ('pl/sql ',' add');
select * from test_table1 order by z0_col0;
+---------------+---------+
| z0_col0       | z0_col1 |
+---------------+---------+
| mysql 8.0     |  one    |
| oceanbase 4.0 |  three  |
| oracle 11g    |  two    |
| pl/sql        |  add    |
+---------------+---------+
show create table test_table1;
Table	Create Table
test_table1	CREATE TABLE `test_table1` (
  `z0_col0` char(200) DEFAULT NULL,
  `z0_col1` char(200) DEFAULT NULL
) ORGANIZATION INDEX DEFAULT CHARSET = utf8mb4 ROW_FORMAT = DYNAMIC COMPRESSION = 'zstd_1.3.8' REPLICA_NUM = 1 BLOCK_SIZE = 16384 USE_BLOOM_FILTER = FALSE ENABLE_MACRO_BLOCK_BLOOM_FILTER = FALSE TABLET_SIZE = 134217728 PCTFREE = 0
# DROP 删除生成列引用的普通列
drop table test_table1;
create table test_table1(
z0_col0 char(200),
z0_col1 char(200),
z0_col2 char(200) as(upper(z0_col0)) virtual,
z0_col3 char(200) as(concat(z0_col0,z0_col1)) stored
);
insert into test_table1 (z0_col0,z0_col1) values ('mysql 8.0 ',' one'),('oracle 11g ',' two'),('oceanbase 4.0 ',' three');
select * from test_table1 order by z0_col2;
+---------------+---------+---------------+---------------------+
| z0_col0       | z0_col1 | z0_col2       | z0_col3             |
+---------------+---------+---------------+---------------------+
| mysql 8.0     |  one    | MYSQL 8.0     | mysql 8.0 one       |
| oceanbase 4.0 |  three  | OCEANBASE 4.0 | oceanbase 4.0 three |
| oracle 11g    |  two    | ORACLE 11G    | oracle 11g two      |
+---------------+---------+---------------+---------------------+
alter table test_table1 drop z0_col0;
ERROR HY000: Column 'z0_col0' has a generated column dependency
alter table test_table1 drop z0_col1;
ERROR HY000: Column 'z0_col1' has a generated column dependency
insert into test_table1 (z0_col0,z0_col1) values ('pl/sql ',' add');
select * from test_table1 order by z0_col0;
+---------------+---------+---------------+---------------------+
| z0_col0       | z0_col1 | z0_col2       | z0_col3             |
+---------------+---------+---------------+---------------------+
| mysql 8.0     |  one    | MYSQL 8.0     | mysql 8.0 one       |
| oceanbase 4.0 |  three  | OCEANBASE 4.0 | oceanbase 4.0 three |
| oracle 11g    |  two    | ORACLE 11G    | oracle 11g two      |
| pl/sql        |  add    | PL/SQL        | pl/sql add          |
+---------------+---------+---------------+---------------------+
show create table test_table1;
Table	Create Table
test_table1	CREATE TABLE `test_table1` (
  `z0_col0` char(200) DEFAULT NULL,
  `z0_col1` char(200) DEFAULT NULL,
  `z0_col2` char(200) GENERATED ALWAYS AS (upper(`z0_col0`)) VIRTUAL,
  `z0_col3` char(200) GENERATED ALWAYS AS (concat(`z0_col0`,`z0_col1`)) STORED
) ORGANIZATION INDEX DEFAULT CHARSET = utf8mb4 ROW_FORMAT = DYNAMIC COMPRESSION = 'zstd_1.3.8' REPLICA_NUM = 1 BLOCK_SIZE = 16384 USE_BLOOM_FILTER = FALSE ENABLE_MACRO_BLOCK_BLOOM_FILTER = FALSE TABLET_SIZE = 134217728 PCTFREE = 0
############ mysql_genrate-1-4 DML
### SELECT 语句
# LIMIT 子句
drop table test_table;
create table test_table(
z0_col0 float, 
z0_col1 float,
z0_col2 float as(z0_col0+z0_col1) virtual,
z0_col3 float as(z0_col0*z0_col1) stored
);
insert into test_table (z0_col0,z0_col1) values (0,0),(NULL,NULL),(2,9),(10,15),(-100,20);
select z0_col0,z0_col1,z0_col2,z0_col3 from test_table order by z0_col2 limit z0_col2;
ERROR 42000: You have an error in your SQL syntax; check the manual that corresponds to your OceanBase version for the right syntax to use near 'z0_col2' at line 1
select z0_col0,z0_col1,z0_col2,z0_col3 from test_table order by z0_col2 limit z0_col3;
ERROR 42000: You have an error in your SQL syntax; check the manual that corresponds to your OceanBase version for the right syntax to use near 'z0_col3' at line 1
select z0_col0,z0_col1,z0_col2,z0_col3 from test_table order by z0_col2 limit 5;
+---------+---------+---------+---------+
| z0_col0 | z0_col1 | z0_col2 | z0_col3 |
+---------+---------+---------+---------+
|    NULL |    NULL |    NULL |    NULL |
|    -100 |      20 |     -80 |   -2000 |
|       0 |       0 |       0 |       0 |
|       2 |       9 |      11 |      18 |
|      10 |      15 |      25 |     150 |
+---------+---------+---------+---------+
select z0_col0,z0_col1,abs(z0_col2),z0_col3 from test_table order by z0_col2 limit 5;
+---------+---------+--------------+---------+
| z0_col0 | z0_col1 | abs(z0_col2) | z0_col3 |
+---------+---------+--------------+---------+
|    NULL |    NULL |         NULL |    NULL |
|    -100 |      20 |           80 |   -2000 |
|       0 |       0 |            0 |       0 |
|       2 |       9 |           11 |      18 |
|      10 |      15 |           25 |     150 |
+---------+---------+--------------+---------+
# SELECT ... INTO 语句
drop table test_table;
create table test_table(
z0_col0 float, 
z0_col1 float,
z0_col2 float as(z0_col0+z0_col1) virtual,
z0_col3 float as(z0_col0*z0_col1) stored
);
insert into test_table (z0_col0,z0_col1) values (0,0),(NULL,NULL),(2,9),(10,15),(-100,20);
select z0_col2,z0_col3 into @p1,@p2 from test_table where abs(z0_col2) > 50 and z0_col3 != 0 order by z0_col2;
select @p1,@p2;
+------+-------+
| @p1  | @p2   |
+------+-------+
|  -80 | -2000 |
+------+-------+
# select 生成列间运算 from table;
drop table test_table;
create table test_table(
z0_col0 float, 
z0_col1 float,
z0_col2 float as(z0_col0+z0_col1) virtual,
z0_col3 float as(z0_col0*z0_col1) stored
);
select avg(z0_col2),sum(z0_col3) from test_table;
+--------------+--------------+
| avg(z0_col2) | sum(z0_col3) |
+--------------+--------------+
|         NULL |         NULL |
+--------------+--------------+
insert into test_table (z0_col0,z0_col1) values (0,0),(NULL,NULL),(2,9),(10,15),(-100,20);
select z0_col0,z0_col1,z0_col2+2*9-1/2,z0_col3+2*9-1/2 from test_table order by z0_col2;
+---------+---------+-----------------+-----------------+
| z0_col0 | z0_col1 | z0_col2+2*9-1/2 | z0_col3+2*9-1/2 |
+---------+---------+-----------------+-----------------+
|    NULL |    NULL |            NULL |            NULL |
|    -100 |      20 |           -62.5 |         -1982.5 |
|       0 |       0 |            17.5 |            17.5 |
|       2 |       9 |            28.5 |            35.5 |
|      10 |      15 |            42.5 |           167.5 |
+---------+---------+-----------------+-----------------+
select z0_col0,z0_col1,z0_col2,z0_col3 from test_table order by z0_col2;
+---------+---------+---------+---------+
| z0_col0 | z0_col1 | z0_col2 | z0_col3 |
+---------+---------+---------+---------+
|    NULL |    NULL |    NULL |    NULL |
|    -100 |      20 |     -80 |   -2000 |
|       0 |       0 |       0 |       0 |
|       2 |       9 |      11 |      18 |
|      10 |      15 |      25 |     150 |
+---------+---------+---------+---------+
select z0_col0,z0_col1,z0_col2+z0_col3 from test_table order by z0_col2;
+---------+---------+-----------------+
| z0_col0 | z0_col1 | z0_col2+z0_col3 |
+---------+---------+-----------------+
|    NULL |    NULL |            NULL |
|    -100 |      20 |           -2080 |
|       0 |       0 |               0 |
|       2 |       9 |              29 |
|      10 |      15 |             175 |
+---------+---------+-----------------+
select z0_col0,z0_col1+z0_col2,z0_col3 from test_table order by z0_col2;
+---------+-----------------+---------+
| z0_col0 | z0_col1+z0_col2 | z0_col3 |
+---------+-----------------+---------+
|    NULL |            NULL |    NULL |
|    -100 |             -60 |   -2000 |
|       0 |               0 |       0 |
|       2 |              20 |      18 |
|      10 |              40 |     150 |
+---------+-----------------+---------+
select avg(z0_col2),sum(z0_col3) from test_table where z0_col2 > 0 order by z0_col2;
+--------------+--------------+
| avg(z0_col2) | sum(z0_col3) |
+--------------+--------------+
|           18 |          168 |
+--------------+--------------+
select z0_col2 > z0_col3 from test_table order by z0_col2;
+-------------------+
| z0_col2 > z0_col3 |
+-------------------+
|              NULL |
|                 1 |
|                 0 |
|                 0 |
|                 0 |
+-------------------+
select z0_col2 and z0_col3 from test_table order by z0_col2;
+---------------------+
| z0_col2 and z0_col3 |
+---------------------+
|                NULL |
|                   1 |
|                   0 |
|                   1 |
|                   1 |
+---------------------+
# 子查询 作为标量操作数的子查询
drop table test_table1;
create table test_table1(
z0_col0 double, 
z0_col1 double,
z0_col2 double as(z0_col0+z0_col1) virtual,
z0_col3 double as(z0_col0*z0_col1) stored
);
select (select z0_col2 from test_table1);
+-----------------------------------+
| (select z0_col2 from test_table1) |
+-----------------------------------+
|                              NULL |
+-----------------------------------+
insert into test_table1 (z0_col0,z0_col1) values (0,0),(NULL,NULL),(2.5,9.9),(-10,15),(1.0E+10,2.0E+10);
select z0_col0,z0_col1,z0_col2,z0_col3 from test_table1 order by z0_col2;
+-------------+-------------+-------------+---------+
| z0_col0     | z0_col1     | z0_col2     | z0_col3 |
+-------------+-------------+-------------+---------+
|        NULL |        NULL |        NULL |    NULL |
|           0 |           0 |           0 |       0 |
|         -10 |          15 |           5 |    -150 |
|         2.5 |         9.9 |        12.4 |   24.75 |
| 10000000000 | 20000000000 | 30000000000 |    2e20 |
+-------------+-------------+-------------+---------+
drop table test_table2;
create table test_table2(
z0_col0 char(200), 
z0_col1 char(200), 
z0_col2 char(200) as(concat(z0_col0,z0_col1)) virtual,
z0_col3 char(200) as(upper(concat(z0_col0,z0_col1))) stored
);
select (select z0_col2 from test_table2);
+-----------------------------------+
| (select z0_col2 from test_table2) |
+-----------------------------------+
| NULL                              |
+-----------------------------------+
insert into test_table2 (z0_col0,z0_col1) values (0,0),(NULL,NULL),(2022,0621),('2022-06-21 ',' 14:30:00'),('welloe come to ',' beijing');
select z0_col0,z0_col1,z0_col2,z0_col3 from test_table2 order by z0_col2;
+----------------+-----------+------------------------+------------------------+
| z0_col0        | z0_col1   | z0_col2                | z0_col3                |
+----------------+-----------+------------------------+------------------------+
| NULL           | NULL      | NULL                   | NULL                   |
| 0              | 0         | 00                     | 00                     |
| 2022-06-21     |  14:30:00 | 2022-06-21 14:30:00    | 2022-06-21 14:30:00    |
| 2022           | 621       | 2022621                | 2022621                |
| welloe come to |  beijing  | welloe come to beijing | WELLOE COME TO BEIJING |
+----------------+-----------+------------------------+------------------------+
select (select z0_col2 from test_table1 where z0_col2 > 20 order by 1);
+-----------------------------------------------------------------+
| (select z0_col2 from test_table1 where z0_col2 > 20 order by 1) |
+-----------------------------------------------------------------+
|                                                     30000000000 |
+-----------------------------------------------------------------+
select (select z0_col3 from test_table1 where z0_col3 between 20 and 30 order by 1);
+------------------------------------------------------------------------------+
| (select z0_col3 from test_table1 where z0_col3 between 20 and 30 order by 1) |
+------------------------------------------------------------------------------+
|                                                                        24.75 |
+------------------------------------------------------------------------------+
select (select z0_col2 from test_table2 where z0_col2 like '%to%' order by 1);
+------------------------------------------------------------------------+
| (select z0_col2 from test_table2 where z0_col2 like '%to%' order by 1) |
+------------------------------------------------------------------------+
| welloe come to beijing                                                 |
+------------------------------------------------------------------------+
select (select z0_col3 from test_table2 where z0_col3 like '%TO%' order by 1);
+------------------------------------------------------------------------+
| (select z0_col3 from test_table2 where z0_col3 like '%TO%' order by 1) |
+------------------------------------------------------------------------+
| WELLOE COME TO BEIJING                                                 |
+------------------------------------------------------------------------+
select (select z0_col2 from test_table1 where z0_col2 > 20) from test_table2 order by z0_col2;
+------------------------------------------------------+
| (select z0_col2 from test_table1 where z0_col2 > 20) |
+------------------------------------------------------+
|                                          30000000000 |
|                                          30000000000 |
|                                          30000000000 |
|                                          30000000000 |
|                                          30000000000 |
+------------------------------------------------------+
select lower((select z0_col3 from test_table2 where z0_col3 like '%TO%')) from test_table1 order by z0_col2;
+--------------------------------------------------------------------+
| lower((select z0_col3 from test_table2 where z0_col3 like '%TO%')) |
+--------------------------------------------------------------------+
| welloe come to beijing                                             |
| welloe come to beijing                                             |
| welloe come to beijing                                             |
| welloe come to beijing                                             |
| welloe come to beijing                                             |
+--------------------------------------------------------------------+
# 子查询 使用子查询进行比较
drop table test_table1;
create table test_table1(
z0_col0 int, 
z0_col1 int,
z0_col2 int as(z0_col0+z0_col1) virtual,
z0_col3 int as(z0_col0-z0_col1) stored
);
insert into test_table1 (z0_col0,z0_col1) values (0,0),(NULL,NULL),(1,1),(1,2),(42.5,9.9),(-10,15),(2.0E+2,1.0E+2);
select z0_col0,z0_col1,z0_col2,z0_col3 from test_table1 order by z0_col2;
+---------+---------+---------+---------+
| z0_col0 | z0_col1 | z0_col2 | z0_col3 |
+---------+---------+---------+---------+
|    NULL |    NULL |    NULL |    NULL |
|       0 |       0 |       0 |       0 |
|       1 |       1 |       2 |       0 |
|       1 |       2 |       3 |      -1 |
|     -10 |      15 |       5 |     -25 |
|      43 |      10 |      53 |      33 |
|     200 |     100 |     300 |     100 |
+---------+---------+---------+---------+
drop table test_table2;
create table test_table2(
z0_col0 int, 
z0_col1 int,
z0_col2 int as(z0_col0*z0_col1) virtual,
z0_col3 int as(z0_col0/z0_col1) stored
);
insert into test_table2 (z0_col0,z0_col1) values (0,0),(0,0),(1,1),(NULL,NULL),(29.5,9.9),(-10,15),(2.0E+2,1.0E+2);
select z0_col0,z0_col1,z0_col2,z0_col3 from test_table2 order by z0_col2;
+---------+---------+---------+---------+
| z0_col0 | z0_col1 | z0_col2 | z0_col3 |
+---------+---------+---------+---------+
|    NULL |    NULL |    NULL |    NULL |
|     -10 |      15 |    -150 |      -1 |
|       0 |       0 |       0 |    NULL |
|       0 |       0 |       0 |    NULL |
|       1 |       1 |       1 |       1 |
|      30 |      10 |     300 |       3 |
|     200 |     100 |   20000 |       2 |
+---------+---------+---------+---------+
select * from test_table1 where z0_col2 < (select max(z0_col2) from test_table2 where z0_col3 > 2) order by 1;
+---------+---------+---------+---------+
| z0_col0 | z0_col1 | z0_col2 | z0_col3 |
+---------+---------+---------+---------+
|     -10 |      15 |       5 |     -25 |
|       0 |       0 |       0 |       0 |
|       1 |       1 |       2 |       0 |
|       1 |       2 |       3 |      -1 |
|      43 |      10 |      53 |      33 |
+---------+---------+---------+---------+
select * from test_table1 where z0_col2 >= (select max(z0_col2) from test_table2 where z0_col3 > 2) order by 1;
+---------+---------+---------+---------+
| z0_col0 | z0_col1 | z0_col2 | z0_col3 |
+---------+---------+---------+---------+
|     200 |     100 |     300 |     100 |
+---------+---------+---------+---------+
select * from test_table2 where z0_col1 = (select max(z0_col3) from test_table1) order by 1;
+---------+---------+---------+---------+
| z0_col0 | z0_col1 | z0_col2 | z0_col3 |
+---------+---------+---------+---------+
|     200 |     100 |   20000 |       2 |
+---------+---------+---------+---------+
select * from test_table2 where z0_col1 != (select min(z0_col3) from test_table1) order by 1;
+---------+---------+---------+---------+
| z0_col0 | z0_col1 | z0_col2 | z0_col3 |
+---------+---------+---------+---------+
|     -10 |      15 |    -150 |      -1 |
|       0 |       0 |       0 |    NULL |
|       0 |       0 |       0 |    NULL |
|       1 |       1 |       1 |       1 |
|      30 |      10 |     300 |       3 |
|     200 |     100 |   20000 |       2 |
+---------+---------+---------+---------+
select * from test_table1 where 2 = (select count(*) from test_table2 where test_table2.z0_col0 = test_table1.z0_col0) order by 1;
+---------+---------+---------+---------+
| z0_col0 | z0_col1 | z0_col2 | z0_col3 |
+---------+---------+---------+---------+
|       0 |       0 |       0 |       0 |
+---------+---------+---------+---------+
# 带有 ANY、IN 或 SOME 的子查询
select * from test_table1 where z0_col2 > any (select z0_col3 from test_table2 where z0_col2 > 0) order by 1;
+---------+---------+---------+---------+
| z0_col0 | z0_col1 | z0_col2 | z0_col3 |
+---------+---------+---------+---------+
|     -10 |      15 |       5 |     -25 |
|       1 |       1 |       2 |       0 |
|       1 |       2 |       3 |      -1 |
|      43 |      10 |      53 |      33 |
|     200 |     100 |     300 |     100 |
+---------+---------+---------+---------+
select * from test_table1 where z0_col2 = any (select z0_col3 from test_table2 where z0_col2 > 0) order by 1;
+---------+---------+---------+---------+
| z0_col0 | z0_col1 | z0_col2 | z0_col3 |
+---------+---------+---------+---------+
|       1 |       1 |       2 |       0 |
|       1 |       2 |       3 |      -1 |
+---------+---------+---------+---------+
select * from test_table1 where z0_col2 < any (select z0_col3 from test_table2 where z0_col2 > 0) order by 1;
+---------+---------+---------+---------+
| z0_col0 | z0_col1 | z0_col2 | z0_col3 |
+---------+---------+---------+---------+
|       0 |       0 |       0 |       0 |
|       1 |       1 |       2 |       0 |
+---------+---------+---------+---------+
select * from test_table1 where z0_col2 != any (select z0_col3 from test_table2 where z0_col2 > 0) order by 1;
+---------+---------+---------+---------+
| z0_col0 | z0_col1 | z0_col2 | z0_col3 |
+---------+---------+---------+---------+
|     -10 |      15 |       5 |     -25 |
|       0 |       0 |       0 |       0 |
|       1 |       1 |       2 |       0 |
|       1 |       2 |       3 |      -1 |
|      43 |      10 |      53 |      33 |
|     200 |     100 |     300 |     100 |
+---------+---------+---------+---------+
select * from test_table1 where z0_col2 <> any (select z0_col3 from test_table2 where z0_col2 > 0) order by 1;
+---------+---------+---------+---------+
| z0_col0 | z0_col1 | z0_col2 | z0_col3 |
+---------+---------+---------+---------+
|     -10 |      15 |       5 |     -25 |
|       0 |       0 |       0 |       0 |
|       1 |       1 |       2 |       0 |
|       1 |       2 |       3 |      -1 |
|      43 |      10 |      53 |      33 |
|     200 |     100 |     300 |     100 |
+---------+---------+---------+---------+
select max(z0_col2) from test_table1 where z0_col2 in (select z0_col3 from test_table2 where z0_col2 > 0) order by 1;
+--------------+
| max(z0_col2) |
+--------------+
|            3 |
+--------------+
select * from test_table1 where z0_col3 >= some (select z0_col3 from test_table2 where z0_col3 > 0) order by 1;
+---------+---------+---------+---------+
| z0_col0 | z0_col1 | z0_col2 | z0_col3 |
+---------+---------+---------+---------+
|      43 |      10 |      53 |      33 |
|     200 |     100 |     300 |     100 |
+---------+---------+---------+---------+
select * from test_table1 where z0_col3 = some (select z0_col3 from test_table2 where z0_col3 > 0) order by 1;
+---------+---------+---------+---------+
| z0_col0 | z0_col1 | z0_col2 | z0_col3 |
+---------+---------+---------+---------+
+---------+---------+---------+---------+
select * from test_table1 where z0_col3 <= some (select z0_col3 from test_table2 where z0_col3 > 0) order by 1;
+---------+---------+---------+---------+
| z0_col0 | z0_col1 | z0_col2 | z0_col3 |
+---------+---------+---------+---------+
|     -10 |      15 |       5 |     -25 |
|       0 |       0 |       0 |       0 |
|       1 |       1 |       2 |       0 |
|       1 |       2 |       3 |      -1 |
+---------+---------+---------+---------+
select * from test_table1 where z0_col3 != some (select z0_col3 from test_table2 where z0_col3 > 0) order by 1;
+---------+---------+---------+---------+
| z0_col0 | z0_col1 | z0_col2 | z0_col3 |
+---------+---------+---------+---------+
|     -10 |      15 |       5 |     -25 |
|       0 |       0 |       0 |       0 |
|       1 |       1 |       2 |       0 |
|       1 |       2 |       3 |      -1 |
|      43 |      10 |      53 |      33 |
|     200 |     100 |     300 |     100 |
+---------+---------+---------+---------+
# ALL 子查询
select z0_col0,z0_col1,abs(z0_col2),abs(z0_col3) from test_table1 where z0_col2 >= all (select z0_col3 from test_table2 where z0_col2 <> 0);
+---------+---------+--------------+--------------+
| z0_col0 | z0_col1 | abs(z0_col2) | abs(z0_col3) |
+---------+---------+--------------+--------------+
|       1 |       2 |            3 |            1 |
|      43 |      10 |           53 |           33 |
|     -10 |      15 |            5 |           25 |
|     200 |     100 |          300 |          100 |
+---------+---------+--------------+--------------+
select z0_col0,z0_col1,max(z0_col2),max(z0_col3) from test_table1 where z0_col2 = all (select z0_col3 from test_table2 where z0_col2 <> 0);
+---------+---------+--------------+--------------+
| z0_col0 | z0_col1 | max(z0_col2) | max(z0_col3) |
+---------+---------+--------------+--------------+
|    NULL |    NULL |         NULL |         NULL |
+---------+---------+--------------+--------------+
select z0_col0,z0_col1,min(z0_col2),min(z0_col3) from test_table1 where z0_col2 <= all (select z0_col3 from test_table2 where z0_col2 <> 0);
+---------+---------+--------------+--------------+
| z0_col0 | z0_col1 | min(z0_col2) | min(z0_col3) |
+---------+---------+--------------+--------------+
|    NULL |    NULL |         NULL |         NULL |
+---------+---------+--------------+--------------+
select z0_col0,z0_col1,avg(z0_col2),avg(z0_col3) from test_table1 where z0_col2 <> all (select z0_col3 from test_table2 where z0_col2 <> 0);
+---------+---------+--------------+--------------+
| z0_col0 | z0_col1 | avg(z0_col2) | avg(z0_col3) |
+---------+---------+--------------+--------------+
|       0 |       0 |      89.5000 |      27.0000 |
+---------+---------+--------------+--------------+
# 行子查询
select * from test_table1 where (z0_col2,z0_col3) = (select z0_col2, z0_col3 from test_table2 where z0_col2 is null) order by 1;
+---------+---------+---------+---------+
| z0_col0 | z0_col1 | z0_col2 | z0_col3 |
+---------+---------+---------+---------+
+---------+---------+---------+---------+
select * from test_table2 where row(z0_col2,z0_col3) = (select z0_col0, z0_col1 from test_table1 where z0_col2 = 2) order by 1;
+---------+---------+---------+---------+
| z0_col0 | z0_col1 | z0_col2 | z0_col3 |
+---------+---------+---------+---------+
|       1 |       1 |       1 |       1 |
+---------+---------+---------+---------+
# 具有 EXISTS 或 NOT EXISTS 的子查询
select z0_col2,z0_col3 from test_table1 where exists (select * from test_table2 where z0_col3 is not null) order by 1;
+---------+---------+
| z0_col2 | z0_col3 |
+---------+---------+
|    NULL |    NULL |
|       0 |       0 |
|       2 |       0 |
|       3 |      -1 |
|       5 |     -25 |
|      53 |      33 |
|     300 |     100 |
+---------+---------+
select z0_col2,z0_col3 from test_table1 where not exists (select * from test_table2 where z0_col3 > 10) order by 1;
+---------+---------+
| z0_col2 | z0_col3 |
+---------+---------+
|    NULL |    NULL |
|       0 |       0 |
|       2 |       0 |
|       3 |      -1 |
|       5 |     -25 |
|      53 |      33 |
|     300 |     100 |
+---------+---------+
select count(z0_col2),max(z0_col3) from test_table1 where exists (select * from test_table2 where z0_col3 is not null) order by 1;
+----------------+--------------+
| count(z0_col2) | max(z0_col3) |
+----------------+--------------+
|              6 |          100 |
+----------------+--------------+
select distinct z0_col2,z0_col3 from test_table1 where not exists (select * from test_table2 where z0_col3 > 10) order by 1;
+---------+---------+
| z0_col2 | z0_col3 |
+---------+---------+
|    NULL |    NULL |
|       0 |       0 |
|       2 |       0 |
|       3 |      -1 |
|       5 |     -25 |
|      53 |      33 |
|     300 |     100 |
+---------+---------+
# 相关子查询
select * from test_table1 t1 where z0_col2 = any (select z0_col2 from test_table2 t2 where t2.z0_col0 = t1.z0_col0 ) order by 1;
+---------+---------+---------+---------+
| z0_col0 | z0_col1 | z0_col2 | z0_col3 |
+---------+---------+---------+---------+
|       0 |       0 |       0 |       0 |
+---------+---------+---------+---------+
select * from test_table1 t1 where (select z0_col2 from test_table2 t2 where t2.z0_col1 = t1.z0_col1 and t2.z0_col3 = 3 ) > 0 order by 1;
+---------+---------+---------+---------+
| z0_col0 | z0_col1 | z0_col2 | z0_col3 |
+---------+---------+---------+---------+
|      43 |      10 |      53 |      33 |
+---------+---------+---------+---------+
# 派生表
select avg(sum_column1) from (select sum(z0_col2) as sum_column1 from test_table1 group by z0_col3) as t1;
+------------------+
| avg(sum_column1) |
+------------------+
|          72.6000 |
+------------------+
select avg(sum_column1) from (select sum(z0_col3) as sum_column1 from test_table2 group by z0_col2) as t1;
+------------------+
| avg(sum_column1) |
+------------------+
|           1.2500 |
+------------------+
###  INSERT 语句
drop table test_table1;
create table test_table1(
z0_col0 int primary key,
z0_col1 int,
z0_col2 int as(z0_col0+z0_col1) virtual,
z0_col3 int as(mod(z0_col0,z0_col1)) stored,
txt char(200) default 'test_table1'
);
insert into test_table1 (z0_col0,z0_col1) values (0,0),(1,NULL),(2,1),(3,5),(4,9.9),(5,2),(2.0E+2,1.0E+2);
select z0_col0,z0_col1,z0_col2 col_add,z0_col3 col_mod,txt from test_table1 order by z0_col2;
+---------+---------+---------+---------+-------------+
| z0_col0 | z0_col1 | col_add | col_mod | txt         |
+---------+---------+---------+---------+-------------+
|       1 |    NULL |    NULL |    NULL | test_table1 |
|       0 |       0 |       0 |    NULL | test_table1 |
|       2 |       1 |       3 |       0 | test_table1 |
|       5 |       2 |       7 |       1 | test_table1 |
|       3 |       5 |       8 |       3 | test_table1 |
|       4 |      10 |      14 |       4 | test_table1 |
|     200 |     100 |     300 |       0 | test_table1 |
+---------+---------+---------+---------+-------------+
insert into test_table1 (z0_col0,z0_col1) values (5,5) on duplicate key update z0_col0=z0_col0+3,z0_col2=1;
ERROR HY000: The value specified for generated column 'z0_col2' in table 'test_table1' is not allowed
insert into test_table1 (z0_col0,z0_col1) values (5,5) on duplicate key update z0_col0=z0_col0+3,txt = 'on duplicate key update';
select z0_col0,z0_col1,z0_col2 col_add,z0_col3 col_mod,txt from test_table1 order by z0_col2;
+---------+---------+---------+---------+-------------------------+
| z0_col0 | z0_col1 | col_add | col_mod | txt                     |
+---------+---------+---------+---------+-------------------------+
|       1 |    NULL |    NULL |    NULL | test_table1             |
|       0 |       0 |       0 |    NULL | test_table1             |
|       2 |       1 |       3 |       0 | test_table1             |
|       3 |       5 |       8 |       3 | test_table1             |
|       8 |       2 |      10 |       0 | on duplicate key update |
|       4 |      10 |      14 |       4 | test_table1             |
|     200 |     100 |     300 |       0 | test_table1             |
+---------+---------+---------+---------+-------------------------+
###  UPDATE  语句
update test_table1 set z0_col1 = 10, txt = '1 update z0_col1' where z0_col2 > 100;
select z0_col0,z0_col1,z0_col2 col_add,z0_col3 col_mod,txt from test_table1 order by z0_col2;
+---------+---------+---------+---------+-------------------------+
| z0_col0 | z0_col1 | col_add | col_mod | txt                     |
+---------+---------+---------+---------+-------------------------+
|       1 |    NULL |    NULL |    NULL | test_table1             |
|       0 |       0 |       0 |    NULL | test_table1             |
|       2 |       1 |       3 |       0 | test_table1             |
|       3 |       5 |       8 |       3 | test_table1             |
|       8 |       2 |      10 |       0 | on duplicate key update |
|       4 |      10 |      14 |       4 | test_table1             |
|     200 |      10 |     210 |       0 | 1 update z0_col1        |
+---------+---------+---------+---------+-------------------------+
update test_table1 set z0_col0 = 41, txt = '2 update z0_col0' where z0_col3 = 4 order by z0_col3 limit 1;
select z0_col0,z0_col1,z0_col2 col_add,z0_col3 col_mod,txt from test_table1 order by z0_col2;
+---------+---------+---------+---------+-------------------------+
| z0_col0 | z0_col1 | col_add | col_mod | txt                     |
+---------+---------+---------+---------+-------------------------+
|       1 |    NULL |    NULL |    NULL | test_table1             |
|       0 |       0 |       0 |    NULL | test_table1             |
|       2 |       1 |       3 |       0 | test_table1             |
|       3 |       5 |       8 |       3 | test_table1             |
|       8 |       2 |      10 |       0 | on duplicate key update |
|      41 |      10 |      51 |       1 | 2 update z0_col0        |
|     200 |      10 |     210 |       0 | 1 update z0_col1        |
+---------+---------+---------+---------+-------------------------+
update test_table1 set z0_col0 = 4, txt = '3 update z0_col0' where abs(z0_col2) = 3 order by z0_col3 limit 1;
select z0_col0,z0_col1,z0_col2 col_add,z0_col3 col_mod,txt from test_table1 order by z0_col2;
+---------+---------+---------+---------+-------------------------+
| z0_col0 | z0_col1 | col_add | col_mod | txt                     |
+---------+---------+---------+---------+-------------------------+
|       1 |    NULL |    NULL |    NULL | test_table1             |
|       0 |       0 |       0 |    NULL | test_table1             |
|       4 |       1 |       5 |       0 | 3 update z0_col0        |
|       3 |       5 |       8 |       3 | test_table1             |
|       8 |       2 |      10 |       0 | on duplicate key update |
|      41 |      10 |      51 |       1 | 2 update z0_col0        |
|     200 |      10 |     210 |       0 | 1 update z0_col1        |
+---------+---------+---------+---------+-------------------------+
update test_table1 set z0_col1 = 200 where z0_col2 > 10 order by z0_col3 limit z0_col3;
ERROR 42000: You have an error in your SQL syntax; check the manual that corresponds to your OceanBase version for the right syntax to use near 'z0_col3' at line 1
select z0_col0,z0_col1,z0_col2 col_add,z0_col3 col_mod,txt from test_table1 order by z0_col2;
+---------+---------+---------+---------+-------------------------+
| z0_col0 | z0_col1 | col_add | col_mod | txt                     |
+---------+---------+---------+---------+-------------------------+
|       1 |    NULL |    NULL |    NULL | test_table1             |
|       0 |       0 |       0 |    NULL | test_table1             |
|       4 |       1 |       5 |       0 | 3 update z0_col0        |
|       3 |       5 |       8 |       3 | test_table1             |
|       8 |       2 |      10 |       0 | on duplicate key update |
|      41 |      10 |      51 |       1 | 2 update z0_col0        |
|     200 |      10 |     210 |       0 | 1 update z0_col1        |
+---------+---------+---------+---------+-------------------------+
update test_table1 set z0_col2 = 20 where z0_col3 = 4 order by z0_col3 limit 1;
ERROR HY000: The value specified for generated column 'z0_col2' in table 'test_table1' is not allowed
select z0_col0,z0_col1,z0_col2 col_add,z0_col3 col_mod,txt from test_table1 order by z0_col2;
+---------+---------+---------+---------+-------------------------+
| z0_col0 | z0_col1 | col_add | col_mod | txt                     |
+---------+---------+---------+---------+-------------------------+
|       1 |    NULL |    NULL |    NULL | test_table1             |
|       0 |       0 |       0 |    NULL | test_table1             |
|       4 |       1 |       5 |       0 | 3 update z0_col0        |
|       3 |       5 |       8 |       3 | test_table1             |
|       8 |       2 |      10 |       0 | on duplicate key update |
|      41 |      10 |      51 |       1 | 2 update z0_col0        |
|     200 |      10 |     210 |       0 | 1 update z0_col1        |
+---------+---------+---------+---------+-------------------------+
###  REPLACE  语句
select z0_col0,z0_col1,z0_col2 col_add,z0_col3 col_mod,txt from test_table1 order by z0_col2;
+---------+---------+---------+---------+-------------------------+
| z0_col0 | z0_col1 | col_add | col_mod | txt                     |
+---------+---------+---------+---------+-------------------------+
|       1 |    NULL |    NULL |    NULL | test_table1             |
|       0 |       0 |       0 |    NULL | test_table1             |
|       4 |       1 |       5 |       0 | 3 update z0_col0        |
|       3 |       5 |       8 |       3 | test_table1             |
|       8 |       2 |      10 |       0 | on duplicate key update |
|      41 |      10 |      51 |       1 | 2 update z0_col0        |
|     200 |      10 |     210 |       0 | 1 update z0_col1        |
+---------+---------+---------+---------+-------------------------+
replace into test_table1 (z0_col0,z0_col1,txt) values (200,21,'1 replace test_table1');
select z0_col0,z0_col1,z0_col2 col_add,z0_col3 col_mod,txt from test_table1 order by z0_col2;
+---------+---------+---------+---------+-------------------------+
| z0_col0 | z0_col1 | col_add | col_mod | txt                     |
+---------+---------+---------+---------+-------------------------+
|       1 |    NULL |    NULL |    NULL | test_table1             |
|       0 |       0 |       0 |    NULL | test_table1             |
|       4 |       1 |       5 |       0 | 3 update z0_col0        |
|       3 |       5 |       8 |       3 | test_table1             |
|       8 |       2 |      10 |       0 | on duplicate key update |
|      41 |      10 |      51 |       1 | 2 update z0_col0        |
|     200 |      21 |     221 |      11 | 1 replace test_table1   |
+---------+---------+---------+---------+-------------------------+
replace into test_table1 values (3,20,30,10,'2 replace test_table1');
ERROR HY000: The value specified for generated column 'z0_col2' in table 'test_table1' is not allowed
###  TRUNCATE TABLE语句
drop table test_table1;
create table test_table1(
z0_col0 int primary key,
z0_col1 int,
z0_col2 int as(z0_col0+z0_col1) virtual,
z0_col3 int as(z0_col0*z0_col1) stored,
txt char(200) default 'test_table1'
);
insert into test_table1 (z0_col0,z0_col1) values (0,0),(1,NULL),(2,1),(3,5);
select z0_col0,z0_col1,z0_col2 col_vir,z0_col3 col_sto,txt from test_table1 order by z0_col2;
+---------+---------+---------+---------+-------------+
| z0_col0 | z0_col1 | col_vir | col_sto | txt         |
+---------+---------+---------+---------+-------------+
|       1 |    NULL |    NULL |    NULL | test_table1 |
|       0 |       0 |       0 |       0 | test_table1 |
|       2 |       1 |       3 |       2 | test_table1 |
|       3 |       5 |       8 |      15 | test_table1 |
+---------+---------+---------+---------+-------------+
truncate table test_table1;
insert into test_table1 (z0_col0,z0_col1) values (10,10),(20,10),(30,50);
select z0_col0,z0_col1,z0_col2 col_add,z0_col3 col_mod,txt from test_table1 order by z0_col2;
+---------+---------+---------+---------+-------------+
| z0_col0 | z0_col1 | col_add | col_mod | txt         |
+---------+---------+---------+---------+-------------+
|      10 |      10 |      20 |     100 | test_table1 |
|      20 |      10 |      30 |     200 | test_table1 |
|      30 |      50 |      80 |    1500 | test_table1 |
+---------+---------+---------+---------+-------------+
desc test_table1;
+---------+-----------+------+-----+-------------------------+-------------------+
| Field   | Type      | Null | Key | Default                 | Extra             |
+---------+-----------+------+-----+-------------------------+-------------------+
| z0_col0 | int(11)   | NO   | PRI | NULL                    |                   |
| z0_col1 | int(11)   | YES  |     | NULL                    |                   |
| z0_col2 | int(11)   | YES  |     | (`z0_col0` + `z0_col1`) | VIRTUAL GENERATED |
| z0_col3 | int(11)   | YES  |     | (`z0_col0` * `z0_col1`) | STORED GENERATED  |
| txt     | char(200) | YES  |     | test_table1             |                   |
+---------+-----------+------+-----+-------------------------+-------------------+
############ mysql_genrate-1-5 PL/SQL
### 函数
drop table test_table1;
create table test_table1(
z0_col0 int primary key,
z0_col1 int,
z0_col2 int as(z0_col0+z0_col1) virtual,
z0_col3 int as(z0_col0*z0_col1) stored
);
insert into test_table1 (z0_col0,z0_col1) values (0,0),(1,1),(2,2),(3,3);
select z0_col0,z0_col1,z0_col2 col_vir,z0_col3 col_sto from test_table1 order by z0_col2;
+---------+---------+---------+---------+
| z0_col0 | z0_col1 | col_vir | col_sto |
+---------+---------+---------+---------+
|       0 |       0 |       0 |       0 |
|       1 |       1 |       2 |       1 |
|       2 |       2 |       4 |       4 |
|       3 |       3 |       6 |       9 |
+---------+---------+---------+---------+
drop table test_table2;
create table test_table2(
z0_col0 int primary key,
z0_col1 int,
z0_col2 int as(z0_col0+z0_col1) virtual,
z0_col3 int as(z0_col0*z0_col1) stored
);
insert into test_table2 (z0_col0,z0_col1) values (10,0),(11,1),(12,2),(13,3);
select z0_col0,z0_col1,z0_col2 col_vir,z0_col3 col_sto from test_table2 order by z0_col2;
+---------+---------+---------+---------+
| z0_col0 | z0_col1 | col_vir | col_sto |
+---------+---------+---------+---------+
|      10 |       0 |      10 |       0 |
|      11 |       1 |      12 |      11 |
|      12 |       2 |      14 |      24 |
|      13 |       3 |      16 |      39 |
+---------+---------+---------+---------+
# 生成列作为函数参数
drop function fun1;//
create function fun1(num2 int,num3 int) returns varchar(100)
begin  
  insert into test_table1 (z0_col0,z0_col1) values (num2,num3); 
  delete from test_table1 where z0_col2 = 0; 
  update test_table1 set z0_col0 = 9 where z0_col2 = 2;
  return 'fun1 ok';
end;
//
select fun1(z0_col2,z0_col3) from test_table2 where z0_col2 < 14 order by z0_col2;//
+-----------------------+
| fun1(z0_col2,z0_col3) |
+-----------------------+
| fun1 ok               |
| fun1 ok               |
+-----------------------+
select z0_col0,z0_col1,z0_col2 col_vir,z0_col3 col_sto from test_table1 order by z0_col2;//
+---------+---------+---------+---------+
| z0_col0 | z0_col1 | col_vir | col_sto |
+---------+---------+---------+---------+
|       2 |       2 |       4 |       4 |
|       3 |       3 |       6 |       9 |
|       9 |       1 |      10 |       9 |
|      10 |       0 |      10 |       0 |
|      12 |      11 |      23 |     132 |
+---------+---------+---------+---------+
# 虚拟列表达式是自定义函数
drop function fun1;//
create function fun1() returns int
begin
  return 10;
end;
//
drop table test_table222;//
create table test_table222(
z0_col0 int primary key,
z0_col1 int,
z0_col2 int as(fun1()) virtual,
z0_col3 int as(fun1()) stored
);//
ERROR 42S22: Unknown column '' in 'generated column function'
### 存储过程
DROP PROCEDURE IF EXISTS pro1;//
CREATE PROCEDURE pro1(in num1 int,in num2 int)
BEGIN
  alter table test_table2 add z0_col4 varchar(100) as (concat(z0_col0,z0_col1)) virtual;
  alter table test_table2 add z0_col5 varchar(100) as (z0_col0) stored;
  insert into test_table2 (z0_col0,z0_col1) values (num1,num2),(num1+1,num2+1); 
  delete from test_table2 where z0_col2 = num1+num2; 
  update test_table2 set z0_col1 = 0 where z0_col3 = 36;
END;
//
call pro1(5,5);//
select * from test_table2 order by z0_col2;//
+---------+---------+---------+---------+---------+---------+
| z0_col0 | z0_col1 | z0_col2 | z0_col3 | z0_col4 | z0_col5 |
+---------+---------+---------+---------+---------+---------+
|       6 |       0 |       6 |       0 | 60      | 6       |
|      11 |       1 |      12 |      11 | 111     | 11      |
|      12 |       2 |      14 |      24 | 122     | 12      |
|      13 |       3 |      16 |      39 | 133     | 13      |
+---------+---------+---------+---------+---------+---------+
desc test_table2;//
+---------+--------------+------+-----+-----------------------------+-------------------+
| Field   | Type         | Null | Key | Default                     | Extra             |
+---------+--------------+------+-----+-----------------------------+-------------------+
| z0_col0 | int(11)      | NO   | PRI | NULL                        |                   |
| z0_col1 | int(11)      | YES  |     | NULL                        |                   |
| z0_col2 | int(11)      | YES  |     | (`z0_col0` + `z0_col1`)     | VIRTUAL GENERATED |
| z0_col3 | int(11)      | YES  |     | (`z0_col0` * `z0_col1`)     | STORED GENERATED  |
| z0_col4 | varchar(100) | YES  |     | concat(`z0_col0`,`z0_col1`) | VIRTUAL GENERATED |
| z0_col5 | varchar(100) | YES  |     | `z0_col0`                   | STORED GENERATED  |
+---------+--------------+------+-----+-----------------------------+-------------------+
############ mysql_genrate-1-6 其他场景
### 生成列：常量
# null
drop table test_table1;
create table test_table1(
z0_col0 int,
z0_col1 int,
z0_col2 int as (null) virtual,
z0_col3 int as (null) stored
);
insert into test_table1 (z0_col0,z0_col1) values (1,1),(2,2);
select z0_col0,z0_col1,z0_col2 col_vir,z0_col3 col_sto from test_table1 order by z0_col2;
+---------+---------+---------+---------+
| z0_col0 | z0_col1 | col_vir | col_sto |
+---------+---------+---------+---------+
|       1 |       1 |    NULL |    NULL |
|       2 |       2 |    NULL |    NULL |
+---------+---------+---------+---------+
select max(z0_col2),min(z0_col3) from test_table1 order by z0_col2;
+--------------+--------------+
| max(z0_col2) | min(z0_col3) |
+--------------+--------------+
|         NULL |         NULL |
+--------------+--------------+
# ''/' '
drop table test_table1;
create table test_table1(
z0_col0 int,
z0_col1 int,
z0_col2 char(200) as ('') virtual,
z0_col3 char(200) as (' ') stored
);
insert into test_table1 (z0_col0,z0_col1) values (1,1),(2,2);
select z0_col0,z0_col1,z0_col2 col_vir,z0_col3 col_sto from test_table1 order by z0_col2;
+---------+---------+---------+---------+
| z0_col0 | z0_col1 | col_vir | col_sto |
+---------+---------+---------+---------+
|       1 |       1 |         |         |
|       2 |       2 |         |         |
+---------+---------+---------+---------+
select max(z0_col2),min(z0_col3) from test_table1 order by z0_col2;
+--------------+--------------+
| max(z0_col2) | min(z0_col3) |
+--------------+--------------+
|              |              |
+--------------+--------------+
# 0，小数，负数，日期
drop table test_table1;
create table test_table1(
z0_col0 int,
z0_col1 int,
z0_col2 int as (0) virtual,
z0_col3 int as (3.1415926) stored,
z0_col4 int as (-100) virtual,
z0_col5 date as ('2020/06/22') stored
);
select * from test_table1 order by z0_col2;
+---------+---------+---------+---------+---------+---------+
| z0_col0 | z0_col1 | z0_col2 | z0_col3 | z0_col4 | z0_col5 |
+---------+---------+---------+---------+---------+---------+
+---------+---------+---------+---------+---------+---------+
insert into test_table1 (z0_col0,z0_col1) values (1,1),(2,2);
select * from test_table1 order by z0_col2;
+---------+---------+---------+---------+---------+------------+
| z0_col0 | z0_col1 | z0_col2 | z0_col3 | z0_col4 | z0_col5    |
+---------+---------+---------+---------+---------+------------+
|       1 |       1 |       0 |       3 |    -100 | 2020-06-22 |
|       2 |       2 |       0 |       3 |    -100 | 2020-06-22 |
+---------+---------+---------+---------+---------+------------+
select max(z0_col2),min(z0_col3) from test_table1 order by z0_col2;
+--------------+--------------+
| max(z0_col2) | min(z0_col3) |
+--------------+--------------+
|            0 |            3 |
+--------------+--------------+
# 特殊字符 ' ！@#￥%……&*（）-+'
drop table test_table1;
create table test_table1(
z0_col0 int,
z0_col1 int,
z0_col2 char(200) as (' ！@#￥%……&*（）-+') virtual,
z0_col3 char(200) as (',./?;:|[]{}~$%^&') stored
);
select * from test_table1 order by z0_col2;
+---------+---------+---------+---------+
| z0_col0 | z0_col1 | z0_col2 | z0_col3 |
+---------+---------+---------+---------+
+---------+---------+---------+---------+
insert into test_table1 (z0_col0,z0_col1) values (1,1),(2,2);
select * from test_table1 order by z0_col2;
+---------+---------+----------------------------+------------------+
| z0_col0 | z0_col1 | z0_col2                    | z0_col3          |
+---------+---------+----------------------------+------------------+
|       1 |       1 |  ！@#￥%……&*（）-+         | ,./?;:|[]{}~$%^& |
|       2 |       2 |  ！@#￥%……&*（）-+         | ,./?;:|[]{}~$%^& |
+---------+---------+----------------------------+------------------+
select max(z0_col2),min(z0_col3) from test_table1 order by z0_col2;
+----------------------------+------------------+
| max(z0_col2)               | min(z0_col3)     |
+----------------------------+------------------+
|  ！@#￥%……&*（）-+         | ,./?;:|[]{}~$%^& |
+----------------------------+------------------+
# 汉字，换行,\n,\t,\r
drop table test_table1;
create table test_table1(
z0_col0 int,
z0_col1 int,
z0_col2 char(200) as ('虚拟列') virtual,
z0_col3 char(200) as ('生成列') stored,
z0_col4 char(200) as ('虚拟列\n\t\r转换符') virtual,
z0_col5 char(200) as ('生成列\n\t\r转换符') stored,
z0_col6 char(200) as ('虚拟列
第二行') virtual,
z0_col7 char(200) as ('生成列
第二行') stored
);
select * from test_table1 order by z0_col2;
+---------+---------+---------+---------+---------+---------+---------+---------+
| z0_col0 | z0_col1 | z0_col2 | z0_col3 | z0_col4 | z0_col5 | z0_col6 | z0_col7 |
+---------+---------+---------+---------+---------+---------+---------+---------+
+---------+---------+---------+---------+---------+---------+---------+---------+
insert into test_table1 (z0_col0,z0_col1) values (1,1),(2,2);
select * from test_table1 order by z0_col2;
+---------+---------+-----------+-----------+-----------------------+-----------------------+---------------------+---------------------+
| z0_col0 | z0_col1 | z0_col2   | z0_col3   | z0_col4               | z0_col5               | z0_col6             | z0_col7             |
+---------+---------+-----------+-----------+-----------------------+-----------------------+---------------------+---------------------+
|       1 |       1 | 虚拟列    | 生成列    | 虚拟列
	转换符       | 生成列
	转换符       | 虚拟列
第二行       | 生成列
第二行       |
|       2 |       2 | 虚拟列    | 生成列    | 虚拟列
	转换符       | 生成列
	转换符       | 虚拟列
第二行       | 生成列
第二行       |
+---------+---------+-----------+-----------+-----------------------+-----------------------+---------------------+---------------------+
select max(z0_col2),min(z0_col3) from test_table1 order by z0_col2;
+--------------+--------------+
| max(z0_col2) | min(z0_col3) |
+--------------+--------------+
| 虚拟列       | 生成列       |
+--------------+--------------+
### 生成列：生成列上加默认值
drop table test_table1;
create table test_table1(
id int,
z0_col0 int,
z0_col1 int,
z0_col2 int as(z0_col0/z0_col1) virtual default '0',
z0_col3 int as(z0_col1*z0_col1) stored  default '0'
);
ERROR 42000: You have an error in your SQL syntax; check the manual that corresponds to your OceanBase version for the right syntax to use near 'default '0',
z0_col3 int as(z0_col1*z0_col1) stored  default '0'
)' at line 5
### 生成列：生成列引用生成列     ob不兼容MySQL
drop table test_table1;
create table test_table1(
z0_col0 int,
z0_col1 int,
z0_col2 int as(z0_col1) virtual,
z0_col3 int as(z0_col2) virtual
);
ERROR HY000: 'Defining a generated column on generated column(s)' is not supported for generated columns.
insert into test_table1 (z0_col0,z0_col1) values (10,10),(20,20),(30,30);
ERROR 42S02: Table 'whh.test_table1' doesn't exist
select * from test_table1 order by z0_col2;
ERROR 42S02: Table 'whh.test_table1' doesn't exist
### 表达式：生成列表达式 column / 0
drop table test_table1;
create table test_table1(
id int,
z0_col0 char(200) default '1',
z0_col1 char(200) default '2',
z0_col2 int as(z0_col0/0) virtual,
z0_col3 int as(z0_col1) stored
);
insert into test_table1 (id) values (1);
select z0_col0,z0_col1,z0_col2 col_vir,z0_col3 col_sto from test_table1 order by z0_col2;
+---------+---------+---------+---------+
| z0_col0 | z0_col1 | col_vir | col_sto |
+---------+---------+---------+---------+
| 1       | 2       |    NULL |       2 |
+---------+---------+---------+---------+
select max(z0_col2),min(z0_col3) from test_table1 order by z0_col2;
+--------------+--------------+
| max(z0_col2) | min(z0_col3) |
+--------------+--------------+
|         NULL |            2 |
+--------------+--------------+
### 表达式：生成列引用的普通列使用默认值
drop table test_table1;
create table test_table1(
id int,
z0_col0 int default 30,
z0_col1 int default 5,
z0_col2 int as(z0_col0/z0_col1) virtual,
z0_col3 int as(z0_col1*z0_col1) stored
);
insert into test_table1 (id) values (1);
select z0_col0,z0_col1,z0_col2 col_vir,z0_col3 col_sto from test_table1 order by z0_col2;
+---------+---------+---------+---------+
| z0_col0 | z0_col1 | col_vir | col_sto |
+---------+---------+---------+---------+
|      30 |       5 |       6 |      25 |
+---------+---------+---------+---------+
select max(z0_col2),min(z0_col3) from test_table1 order by z0_col2;
+--------------+--------------+
| max(z0_col2) | min(z0_col3) |
+--------------+--------------+
|            6 |           25 |
+--------------+--------------+
### 事务：向表中插入/删除数据，添加生成列等，再回滚
SET @@AUTOCOMMIT=0;
drop table test_table1;
create table test_table1(
z0_col0 int,
z0_col1 int,
z0_col2 int as(z0_col0/z0_col1) virtual,
z0_col3 int as(z0_col1*z0_col1) stored
);
insert into test_table1 (z0_col0,z0_col1) values (10,10),(20,20),(30,30);
select * from test_table1 order by z0_col2;
+---------+---------+---------+---------+
| z0_col0 | z0_col1 | z0_col2 | z0_col3 |
+---------+---------+---------+---------+
|      10 |      10 |       1 |     100 |
|      20 |      20 |       1 |     400 |
|      30 |      30 |       1 |     900 |
+---------+---------+---------+---------+
# 插入数据再回滚
start transaction;
insert into test_table1 (z0_col0,z0_col1) values (40,40);
select * from test_table1 order by z0_col2;
+---------+---------+---------+---------+
| z0_col0 | z0_col1 | z0_col2 | z0_col3 |
+---------+---------+---------+---------+
|      10 |      10 |       1 |     100 |
|      20 |      20 |       1 |     400 |
|      30 |      30 |       1 |     900 |
|      40 |      40 |       1 |    1600 |
+---------+---------+---------+---------+
rollback;
select z0_col0,z0_col1,z0_col2 col_vir,z0_col3 col_sto from test_table1 order by z0_col2;
+---------+---------+---------+---------+
| z0_col0 | z0_col1 | col_vir | col_sto |
+---------+---------+---------+---------+
|      10 |      10 |       1 |     100 |
|      20 |      20 |       1 |     400 |
|      30 |      30 |       1 |     900 |
+---------+---------+---------+---------+
select max(z0_col2),min(z0_col3) from test_table1 order by z0_col2;
+--------------+--------------+
| max(z0_col2) | min(z0_col3) |
+--------------+--------------+
|            1 |          100 |
+--------------+--------------+
# 删除数据再回滚
start transaction;
delete from test_table1 where z0_col3 = 900;
select * from test_table1 order by z0_col2;
+---------+---------+---------+---------+
| z0_col0 | z0_col1 | z0_col2 | z0_col3 |
+---------+---------+---------+---------+
|      10 |      10 |       1 |     100 |
|      20 |      20 |       1 |     400 |
+---------+---------+---------+---------+
rollback;
select z0_col0,z0_col1,z0_col2 col_vir,z0_col3 col_sto from test_table1 order by z0_col2;
+---------+---------+---------+---------+
| z0_col0 | z0_col1 | col_vir | col_sto |
+---------+---------+---------+---------+
|      10 |      10 |       1 |     100 |
|      20 |      20 |       1 |     400 |
|      30 |      30 |       1 |     900 |
+---------+---------+---------+---------+
select max(z0_col2),min(z0_col3) from test_table1 order by z0_col2;
+--------------+--------------+
| max(z0_col2) | min(z0_col3) |
+--------------+--------------+
|            1 |          100 |
+--------------+--------------+
# 添加生成列再回滚
start transaction;
alter table test_table1 add z0_col4 varchar(100) as (concat(z0_col0,z0_col1)) virtual;
select * from test_table1 order by z0_col2;
+---------+---------+---------+---------+---------+
| z0_col0 | z0_col1 | z0_col2 | z0_col3 | z0_col4 |
+---------+---------+---------+---------+---------+
|      10 |      10 |       1 |     100 | 1010    |
|      20 |      20 |       1 |     400 | 2020    |
|      30 |      30 |       1 |     900 | 3030    |
+---------+---------+---------+---------+---------+
rollback;
select z0_col0,z0_col1,z0_col2 col_vir,z0_col3 col_sto from test_table1 order by z0_col2;
+---------+---------+---------+---------+
| z0_col0 | z0_col1 | col_vir | col_sto |
+---------+---------+---------+---------+
|      10 |      10 |       1 |     100 |
|      20 |      20 |       1 |     400 |
|      30 |      30 |       1 |     900 |
+---------+---------+---------+---------+
select max(z0_col2),min(z0_col3) from test_table1 order by z0_col2;
+--------------+--------------+
| max(z0_col2) | min(z0_col3) |
+--------------+--------------+
|            1 |          100 |
+--------------+--------------+
SET @@AUTOCOMMIT=1;
### 一个表中含有多个虚拟列/存储列(6,7,8...)
drop table test_table1;
create table test_table1(
z0_col0 int,
z0_col1 int,
z0_col2 int as(z0_col0*1) virtual,
z0_col3 int as(z0_col0*2) virtual,
z0_col4 int as(z0_col0*3) virtual,
z0_col5 int as(z0_col0*4) virtual,
z0_col6 int as(z0_col0*5) virtual,
z0_col7 int as(z0_col0*6) virtual,
z0_col10 int as(z0_col1*1) stored,
z0_col11 int as(z0_col1*2) stored,
z0_col12 int as(z0_col1*3) stored,
z0_col13 int as(z0_col1*4) stored,
z0_col14 int as(z0_col1*5) stored,
z0_col15 int as(z0_col1*6) stored
);
insert into test_table1 (z0_col0,z0_col1) values (10,10),(20,20),(30,30);
select * from test_table1 order by z0_col2;
+---------+---------+---------+---------+---------+---------+---------+---------+----------+----------+----------+----------+----------+----------+
| z0_col0 | z0_col1 | z0_col2 | z0_col3 | z0_col4 | z0_col5 | z0_col6 | z0_col7 | z0_col10 | z0_col11 | z0_col12 | z0_col13 | z0_col14 | z0_col15 |
+---------+---------+---------+---------+---------+---------+---------+---------+----------+----------+----------+----------+----------+----------+
|      10 |      10 |      10 |      20 |      30 |      40 |      50 |      60 |       10 |       20 |       30 |       40 |       50 |       60 |
|      20 |      20 |      20 |      40 |      60 |      80 |     100 |     120 |       20 |       40 |       60 |       80 |      100 |      120 |
|      30 |      30 |      30 |      60 |      90 |     120 |     150 |     180 |       30 |       60 |       90 |      120 |      150 |      180 |
+---------+---------+---------+---------+---------+---------+---------+---------+----------+----------+----------+----------+----------+----------+
alter table test_table1 add z0_col8 int as (z0_col0*7) virtual;
alter table test_table1 add z0_col9 int as (z0_col0*8) virtual;
alter table test_table1 add z0_col16 int as (z0_col1*7) stored;
alter table test_table1 add z0_col17 int as (z0_col1*8) stored;
insert into test_table1 (z0_col0,z0_col1) values (10,10),(20,20),(30,30);
select * from test_table1 order by z0_col2;
+---------+---------+---------+---------+---------+---------+---------+---------+----------+----------+----------+----------+----------+----------+---------+---------+----------+----------+
| z0_col0 | z0_col1 | z0_col2 | z0_col3 | z0_col4 | z0_col5 | z0_col6 | z0_col7 | z0_col10 | z0_col11 | z0_col12 | z0_col13 | z0_col14 | z0_col15 | z0_col8 | z0_col9 | z0_col16 | z0_col17 |
+---------+---------+---------+---------+---------+---------+---------+---------+----------+----------+----------+----------+----------+----------+---------+---------+----------+----------+
|      10 |      10 |      10 |      20 |      30 |      40 |      50 |      60 |       10 |       20 |       30 |       40 |       50 |       60 |      70 |      80 |       70 |       80 |
|      10 |      10 |      10 |      20 |      30 |      40 |      50 |      60 |       10 |       20 |       30 |       40 |       50 |       60 |      70 |      80 |       70 |       80 |
|      20 |      20 |      20 |      40 |      60 |      80 |     100 |     120 |       20 |       40 |       60 |       80 |      100 |      120 |     140 |     160 |      140 |      160 |
|      20 |      20 |      20 |      40 |      60 |      80 |     100 |     120 |       20 |       40 |       60 |       80 |      100 |      120 |     140 |     160 |      140 |      160 |
|      30 |      30 |      30 |      60 |      90 |     120 |     150 |     180 |       30 |       60 |       90 |      120 |      150 |      180 |     210 |     240 |      210 |      240 |
|      30 |      30 |      30 |      60 |      90 |     120 |     150 |     180 |       30 |       60 |       90 |      120 |      150 |      180 |     210 |     240 |      210 |      240 |
+---------+---------+---------+---------+---------+---------+---------+---------+----------+----------+----------+----------+----------+----------+---------+---------+----------+----------+
desc test_table1;
+----------+---------+------+-----+-----------------+-------------------+
| Field    | Type    | Null | Key | Default         | Extra             |
+----------+---------+------+-----+-----------------+-------------------+
| z0_col0  | int(11) | YES  |     | NULL            |                   |
| z0_col1  | int(11) | YES  |     | NULL            |                   |
| z0_col2  | int(11) | YES  |     | (`z0_col0` * 1) | VIRTUAL GENERATED |
| z0_col3  | int(11) | YES  |     | (`z0_col0` * 2) | VIRTUAL GENERATED |
| z0_col4  | int(11) | YES  |     | (`z0_col0` * 3) | VIRTUAL GENERATED |
| z0_col5  | int(11) | YES  |     | (`z0_col0` * 4) | VIRTUAL GENERATED |
| z0_col6  | int(11) | YES  |     | (`z0_col0` * 5) | VIRTUAL GENERATED |
| z0_col7  | int(11) | YES  |     | (`z0_col0` * 6) | VIRTUAL GENERATED |
| z0_col10 | int(11) | YES  |     | (`z0_col1` * 1) | STORED GENERATED  |
| z0_col11 | int(11) | YES  |     | (`z0_col1` * 2) | STORED GENERATED  |
| z0_col12 | int(11) | YES  |     | (`z0_col1` * 3) | STORED GENERATED  |
| z0_col13 | int(11) | YES  |     | (`z0_col1` * 4) | STORED GENERATED  |
| z0_col14 | int(11) | YES  |     | (`z0_col1` * 5) | STORED GENERATED  |
| z0_col15 | int(11) | YES  |     | (`z0_col1` * 6) | STORED GENERATED  |
| z0_col8  | int(11) | YES  |     | (`z0_col0` * 7) | VIRTUAL GENERATED |
| z0_col9  | int(11) | YES  |     | (`z0_col0` * 8) | VIRTUAL GENERATED |
| z0_col16 | int(11) | YES  |     | (`z0_col1` * 7) | STORED GENERATED  |
| z0_col17 | int(11) | YES  |     | (`z0_col1` * 8) | STORED GENERATED  |
+----------+---------+------+-----+-----------------+-------------------+
drop user whh@'%';
drop database IF EXISTS whh ;
PURGE RECYCLEBIN;
purge recyclebin;
alter system set _rowsets_max_rows = 256 tenant sys;
alter system set _rowsets_max_rows = 256 tenant all_user;
alter system set _rowsets_max_rows = 256 tenant all_meta;
