drop database  IF EXISTS  db1;
create database db1;
use db1;
SET wait_timeout=30000000;
SET ob_trx_timeout = 30000000;
SET ob_query_timeout = 30000000;
##设置相同sql_mode;
SET @@sql_mode='STRICT_TRANS_TABLES,NO_ENGINE_SUBSTITUTION,no_zero_date,no_zero_in_date,PIPES_AS_CONCAT';
##使用场景 
##表table
##create as select
create table t1 (c1 int primary key,c2 varchar(20),c3 float(10,3) not null);
insert into t1 values(1,'test01',1.123456231);
insert into t1 values(2,'test02',3.12);
insert into t1 values(3,'test03',4.123);
insert into t1 values(4,'test04',8.999);
insert into t1 values(5,'test05',8.998);
insert into t1 values(8,'test06',round(false,false));
select round(c3) as a from t1 order by round(a);
a
0
1
3
4
9
9
create table t2 as select round(c3) a from t1;
select * from t2 order by round(a);
a
0
1
3
4
9
9
drop table t2;
select DATEDIFF(round(c3)-1,round(c3)) from t1;
DATEDIFF(round(c3)-1,round(c3))
NULL
NULL
NULL
NULL
NULL
NULL
select MOD(round(c3)+5,round(c1)) from t1;
MOD(round(c3)+5,round(c1))
0
0
0
2
4
5
select time(round(c3)),COALESCE(round(c1)) from t1;
time(round(c3))	COALESCE(round(c1))
00:00:01	1
00:00:03	2
00:00:04	3
00:00:09	4
00:00:09	5
00:00:00	8
SELECT INSTR(round(c3,c1),round(c1)) from t1;
INSTR(round(c3,c1),round(c1))
1
4
5
0
0
0
select LENGTH(round(c3))+1,LENGTH(round(c3)) from t1;
LENGTH(round(c3))+1	LENGTH(round(c3))
2	1
2	1
2	1
2	1
2	1
2	1
SELECT LOCATE(2,round(c3)+0,round(c1)-2) from t1;
LOCATE(2,round(c3)+0,round(c1)-2)
0
0
0
0
0
0
select MD5(round(c1)),MD5(round(c3)+1) from t1;
MD5(round(c1))	MD5(round(c3)+1)
c4ca4238a0b923820dcc509a6f75849b	c81e728d9d4c2f636f067f89cc14862c
c81e728d9d4c2f636f067f89cc14862c	a87ff679a2f3e71d9181a67b7542122c
eccbc87e4b5ce2fe28308fd9f2a7baf3	e4da3b7fbbce2345d7772b0674a318d5
a87ff679a2f3e71d9181a67b7542122c	d3d9446802a44259755d38e6d163e820
e4da3b7fbbce2345d7772b0674a318d5	d3d9446802a44259755d38e6d163e820
c9f0f895fb98ab9159f51fd0297e236d	c4ca4238a0b923820dcc509a6f75849b
##聚合函数
select count(round(c3)) from t1;
count(round(c3))
6
select sum(round(c3)) from t1;
sum(round(c3))
26
select avg(round(c3)) from t1;
avg(round(c3))
4.3333
select min(round(c3)) from t1;
min(round(c3))
0
select max(round(c3)) from t1;
max(round(c3))
9
select GROUP_CONCAT(round(c3)) from t1;
GROUP_CONCAT(round(c3))
1,3,4,9,9,0
##where子句
select t1.*, round(c3) from t1 where round(c1)=8 order by round(c3,3);
c1	c2	c3	round(c3)
8	test06	0.000	0
select t1.*, round(c3) from t1 where round(c3,2)>=8.99 order by round(c3,3);
c1	c2	c3	round(c3)
5	test05	8.998	9
4	test04	8.999	9
select t1.*, round(c3) from t1 where round(c3,2)<=8.99 order by round(c3,3);
c1	c2	c3	round(c3)
8	test06	0.000	0
1	test01	1.123	1
2	test02	3.120	3
3	test03	4.123	4
select t1.*, round(c3) from t1 where round(c3,3)=8.998 order by round(c3,3);
c1	c2	c3	round(c3)
5	test05	8.998	9
select t1.*, round(c3) from t1 where round(c3,2)<8 order by round(c3,3);
c1	c2	c3	round(c3)
8	test06	0.000	0
1	test01	1.123	1
2	test02	3.120	3
3	test03	4.123	4
select t1.*, round(c3) from t1 where round(c3,2)>8 order by round(c3,3);
c1	c2	c3	round(c3)
5	test05	8.998	9
4	test04	8.999	9
select t1.*, round(c3) from t1 where round(c3,2) between 9 and 7 order by round(c3,3);
c1	c2	c3	round(c3)
select t1.*, round(c3) from t1 where round(c3,2) like '7%' order by round(c3,3);
c1	c2	c3	round(c3)
select t1.*, round(c3) from t1 where exists (select round(c3)) order by round(c3,3);
c1	c2	c3	round(c3)
8	test06	0.000	0
1	test01	1.123	1
2	test02	3.120	3
3	test03	4.123	4
5	test05	8.998	9
4	test04	8.999	9
select t1.*, round(c3) from t1 where 7 in  (select round(c3)) order by round(c3,3);
c1	c2	c3	round(c3)
select t1.*, round(c3) from t1 where 50 > all(select round(c3)) order by round(c3,3);
c1	c2	c3	round(c3)
8	test06	0.000	0
1	test01	1.123	1
2	test02	3.120	3
3	test03	4.123	4
5	test05	8.998	9
4	test04	8.999	9
select t1.*, round(c3) from t1 where c1 =2 or c2 ='test03' order by round(c3,3);
c1	c2	c3	round(c3)
2	test02	3.120	3
3	test03	4.123	4
select t1.*, round(c3) from t1 where c1 =2 and c2 ='test02' order by round(c3,3);
c1	c2	c3	round(c3)
2	test02	3.120	3
create table t2(a1 int ,a2 int);
insert into t2 values(1,1);
insert into t2 values(2,2);
insert into t2 values(3,3);
select t1.*,round(c3) from t1 inner join t2 on round(t1.c1)=round(t2.a1) order by round(c3,3);
c1	c2	c3	round(c3)
1	test01	1.123	1
2	test02	3.120	3
3	test03	4.123	4
select t1.*,round(c3) from t1 left join t2 on round(t1.c1)=round(t2.a1) order by round(c3,3);
c1	c2	c3	round(c3)
8	test06	0.000	0
1	test01	1.123	1
2	test02	3.120	3
3	test03	4.123	4
5	test05	8.998	9
4	test04	8.999	9
select t1.*,round(c3) from t1 right join t2 on round(t1.c1)=round(t2.a1) order by round(c3,3);
c1	c2	c3	round(c3)
1	test01	1.123	1
2	test02	3.120	3
3	test03	4.123	4
mysql5.7不支持
with tt as (select round(c3)  from t1)  select * from tt;
round(c3)
1
3
4
9
9
0
select round(c3)+round(c3) from t1 where c1>3;
round(c3)+round(c3)
18
18
0
select round(c3)-round(c3) from t1;
round(c3)-round(c3)
0
0
0
0
0
0
select round(c3)*round(c3) from t1;
round(c3)*round(c3)
1
9
16
81
81
0
select round(c3)/round(c3) from t1;
round(c3)/round(c3)
1.0000
1.0000
1.0000
1.0000
1.0000
NULL
select round(c3)%round(c3) from t1;
round(c3)%round(c3)
0
0
0
0
0
NULL
select round(c3) div round(c3) from t1;
round(c3) div round(c3)
1
1
1
1
1
NULL
select round(c3) mod round(c3) from t1;
round(c3) mod round(c3)
0
0
0
0
0
NULL
select -round(c3) from t1;
-round(c3)
-1
-3
-4
-9
-9
-0
select +round(c3) from t1;
+round(c3)
1
3
4
9
9
0
select round(c3)+0+round(c3) from t1 where c1>3;
round(c3)+0+round(c3)
18
18
0
select round(c3)-round(c3)+0 from t1;
round(c3)-round(c3)+0
0
0
0
0
0
0
select round(c3)*round(c3)+0 from t1;
round(c3)*round(c3)+0
1
9
16
81
81
0
select round(c3)+0/round(c3) from t1;
round(c3)+0/round(c3)
1.0000
3.0000
4.0000
9.0000
9.0000
NULL
select round(c3)%round(c3)+0 from t1;
round(c3)%round(c3)+0
0
0
0
0
0
NULL
select round(c3)+0 div round(c3) from t1;
round(c3)+0 div round(c3)
1
3
4
9
9
NULL
select round(c3) mod round(c3)+0 from t1;
round(c3) mod round(c3)+0
0
0
0
0
0
NULL
select -round(c3)+0 from t1;
-round(c3)+0
-1
-3
-4
-9
-9
0
select +round(c3)+0 from t1;
+round(c3)+0
1
3
4
9
9
0
select round(c3)+0+round(c3)+0 from t1 where c1=3;
round(c3)+0+round(c3)+0
8
select round(c3)+0-round(c3)+0 from t1;
round(c3)+0-round(c3)+0
0
0
0
0
0
0
select round(c3)+0*round(c3)+0 from t1;
round(c3)+0*round(c3)+0
1
3
4
9
9
0
select round(c3)+0/round(c3)+0 from t1;
round(c3)+0/round(c3)+0
1.0000
3.0000
4.0000
9.0000
9.0000
NULL
select round(c3)+0%round(c3)+0 from t1;
round(c3)+0%round(c3)+0
1
3
4
9
9
NULL
select round(c3)+0 div round(c3)+0 from t1;
round(c3)+0 div round(c3)+0
1
3
4
9
9
NULL
select round(c3)+0 mod round(c3)+0 from t1;
round(c3)+0 mod round(c3)+0
1
3
4
9
9
NULL
select distinct round(c3) from t1;
round(c3)
1
3
4
9
0
select distinct round(c3)+20 from t1;
round(c3)+20
21
23
24
29
20
select  round(c3) from t1;
round(c3)
1
3
4
9
9
0
select  round(c3)+1 from t1;
round(c3)+1
2
4
5
10
10
1
select t1.*,round(c3)-0, round(c3) from t1 group by c1;
c1	c2	c3	round(c3)-0	round(c3)
1	test01	1.123	1	1
2	test02	3.120	3	3
3	test03	4.123	4	4
4	test04	8.999	9	9
5	test05	8.998	9	9
8	test06	0.000	0	0
select t1.*,round(c3)-0, round(c3) from t1 group by round(c3),round(c3)+0;
c1	c2	c3	round(c3)-0	round(c3)
1	test01	1.123	1	1
2	test02	3.120	3	3
3	test03	4.123	4	4
4	test04	8.999	9	9
8	test06	0.000	0	0
select t1.*,round(c3)-0, round(c3) from t1 group by round(c3) having round(c3)>=5;
c1	c2	c3	round(c3)-0	round(c3)
4	test04	8.999	9	9
select t1.*,round(c3)-0, round(c3) from t1 group by round(c3) having round(c3)-0>=3;
c1	c2	c3	round(c3)-0	round(c3)
2	test02	3.120	3	3
3	test03	4.123	4	4
4	test04	8.999	9	9
select t1.*,round(c3)-0, round(c3) from t1 order by round(c3);
c1	c2	c3	round(c3)-0	round(c3)
8	test06	0.000	0	0
1	test01	1.123	1	1
2	test02	3.120	3	3
3	test03	4.123	4	4
4	test04	8.999	9	9
5	test05	8.998	9	9
select t1.*,round(c3)-0, round(c3) from t1 order by round(c3)+0;
c1	c2	c3	round(c3)-0	round(c3)
8	test06	0.000	0	0
1	test01	1.123	1	1
2	test02	3.120	3	3
3	test03	4.123	4	4
4	test04	8.999	9	9
5	test05	8.998	9	9
select t1.*,round(c3)-0, round(c3) from t1  where 9 =round(c3) order by round(c3);
c1	c2	c3	round(c3)-0	round(c3)
4	test04	8.999	9	9
5	test05	8.998	9	9
select t1.*,round(c3)-0, round(c3) from t1 where 9 =round(c3)+0 order by round(c3)+0;
c1	c2	c3	round(c3)-0	round(c3)
4	test04	8.999	9	9
5	test05	8.998	9	9
select t1.* , case round(c3)  when round(c3)  then round(c3)  when round(c3)+1  then    round(c3)+1  end as a  from t1;
c1	c2	c3	a
1	test01	1.123	1
2	test02	3.120	3
3	test03	4.123	4
4	test04	8.999	9
5	test05	8.998	9
8	test06	0.000	0
select t1.* , case round(c3)+1  when round(c3)  then round(c3)  when round(c3)+1  then    round(c3)+1  end as a  from t1;
c1	c2	c3	a
1	test01	1.123	2
2	test02	3.120	4
3	test03	4.123	5
4	test04	8.999	10
5	test05	8.998	10
8	test06	0.000	1
select count(round(c3,c1)) from t1;
count(round(c3,c1))
6
select count(round(c3,c1)+0) from t1;
count(round(c3,c1)+0)
6
select sum(round(c3,c1)) from t1;
sum(round(c3,c1))
26.340
select sum(round(c3,c1)+0) from t1;
sum(round(c3,c1)+0)
26.340
select avg(round(c3,c1)) from t1;
avg(round(c3,c1))
4.3900000
select avg(round(c3,c1)) from t1;
avg(round(c3,c1))
4.3900000
select min(round(c3,c1)) from t1;
min(round(c3,c1))
0.000
select min(round(c3,c1)+0) from t1;
min(round(c3,c1)+0)
0.000
select max(round(c3,c1)) from t1;
max(round(c3,c1))
8.999
select max(round(c3,c1)+0) from t1;
max(round(c3,c1)+0)
8.999
select GROUP_CONCAT(round(c3)) from t1;
GROUP_CONCAT(round(c3))
1,3,4,9,9,0
select GROUP_CONCAT(round(c3)+0) from t1;
GROUP_CONCAT(round(c3)+0)
1,3,4,9,9,0
drop table t2;
drop table t1;
create table t1(c1 int,c2 varchar(20),c3 float);
create table t2(a1 int,a2 varchar(20),a3 float);
insert into t1 values(1,'1.99',1.99);
insert into t1 values(2,'2.99',2.99);
insert into t1 values(3,'3.99',3.99);
insert into t2 values(1,'3.99',3.99);
select round(c3,c1),round(c1)+0 from t1 union select round(a3),round(a1)+0 from t2;
round(c3,c1)	round(c1)+0
2	1
2.99	2
3.99	3
4	1
select round(c3,c1),round(c1)+0 from t1 union all select round(a3),round(a1)+0 from t2;
round(c3,c1)	round(c1)+0
2	1
2.99	2
3.99	3
4	1
select round(c3,c1),round(c1)+0 from t1 intersect select round(a3),round(a1)+0 from t2;
round(c3,c1)	round(c1)+0
select round(c3,c1),round(c1)+1 from t1 except select round(a3),round(a1)+0 from t2;
round(c3,c1)	round(c1)+1
2	2
2.99	3
3.99	4
select round(c3,c1),round(c1)+2 from t1 minus select round(a3),round(a1)+0 from t2;
round(c3,c1)	round(c1)+2
2	3
2.99	4
3.99	5
drop table t2;
drop table t1;
##insert into
create table t1(a bool primary key,b bool);
insert into t1 values(111,111.999999);
insert into t1 values(round(111.9,1),round(111.999999,9.9));
insert into t1 values(round(false),round(true-1));
insert into t1 values(round(false+1),round(1.123456231,9.9));
select round(a,b) from t1 order by round(a);
round(a,b)
0
1
111
112
select round(b,a) from t1 order by round(a);
round(b,a)
0
1
112
112
drop table t1;
create table t1(a BOOLEAN primary key,b BOOLEAN);
insert into t1 values(111,111.999999);
insert into t1 values(round(111.9,1),round(111.999999,9.9));
insert into t1 values(round(false),round(true-1));
insert into t1 values(round(false+1),round(1.123456231,9.9));
select round(a,b) from t1 order by round(a);
round(a,b)
0
1
111
112
select round(b,a) from t1 order by round(a);
round(b,a)
0
1
112
112
drop table t1;
create table t1(a TINYINT primary key,b TINYINT);
insert into t1 values(111,111.999999);
insert into t1 values(round(111.9,1),round(111.999999,9.9));
insert into t1 values(round(false),round(true-1));
insert into t1 values(round(false+1),round(1.123456231,9.9));
select round(a,b) from t1 order by round(a);
round(a,b)
0
1
111
112
select round(b,a) from t1 order by round(a);
round(b,a)
0
1
112
112
drop table t1;
create table t1(a SMALLINT primary key,b SMALLINT);
insert into t1 values(111,111.999999);
insert into t1 values(round(111.9,1),round(111.999999,9.9));
insert into t1 values(round(false),round(true-1));
insert into t1 values(round(false+1),round(1.123456231,9.9));
select round(a,b) from t1 order by round(a);
round(a,b)
0
1
111
112
select round(b,a) from t1 order by round(a);
round(b,a)
0
1
112
112
drop table t1;
create table t1(a MEDIUMINT primary key,b MEDIUMINT);
insert into t1 values(111,111.999999);
insert into t1 values(round(111.9,1),round(111.999999,9.9));
insert into t1 values(round(false),round(true-1));
insert into t1 values(round(false+1),round(1.123456231,9.9));
select round(a,b) from t1 order by round(a);
round(a,b)
0
1
111
112
select round(b,a) from t1 order by round(a);
round(b,a)
0
1
112
112
drop table t1;
create table t1(a INT primary key,b int);
insert into t1 values(111,111.999999);
insert into t1 values(round(111.9,1),round(111.999999,9.9));
insert into t1 values(round(false),round(true-1));
insert into t1 values(round(false+1),round(1.123456231,9.9));
select round(a,b) from t1 order by round(a);
round(a,b)
0
1
111
112
select round(b,a) from t1 order by round(a);
round(b,a)
0
1
112
112
drop table t1;
create table t1(a INTEGER primary key,b INTEGER);
insert into t1 values(220913.999999,220927.1111);
insert into t1 values(round(111.9,1),round(111.999999,9.9));
insert into t1 values(round(false),round(true-1));
insert into t1 values(round(false+1),round(1.123456231,9.9));
select round(a,b) from t1 order by round(a);
round(a,b)
0
1
112
220914
select round(b,a) from t1 order by round(a);
round(b,a)
0
1
112
220927
drop table t1;
create table t1(a BIGINT primary key,b BIGINT);
insert into t1 values(111,111.999999);
insert into t1 values(round(111.9,1),round(111.999999,9.9));
insert into t1 values(round(false),round(true-1));
insert into t1 values(round(false+1),round(1.123456231,9.9));
select round(a,b) from t1 order by round(a);
round(a,b)
0
1
111
112
select round(b,a) from t1 order by round(a);
round(b,a)
0
1
112
112
drop table t1;
create table t1(a DECIMAL primary key,b DECIMAL);
insert into t1 values(220913.999999,220927.1111);
Warnings:
Warning	1265	Data truncated for column 'a' at row 1
Warning	1265	Data truncated for column 'b' at row 1
insert into t1 values(round(111.9,1),round(111.999999,9.9));
Warnings:
Warning	1265	Data truncated for column 'a' at row 1
Warning	1265	Data truncated for column 'b' at row 1
insert into t1 values(round(false),round(true-1));
insert into t1 values(round(false+1),round(1.123456231,9.9));
Warnings:
Warning	1265	Data truncated for column 'b' at row 1
select round(a,b) from t1 order by round(a);
round(a,b)
0
1
112
220914
select round(b,a) from t1 order by round(a);
round(b,a)
0
1
112
220927
drop table t1;
create table t1(a NUMERIC primary key,b NUMERIC);
insert into t1 values(220913.999999,220927.1111);
Warnings:
Warning	1265	Data truncated for column 'a' at row 1
Warning	1265	Data truncated for column 'b' at row 1
insert into t1 values(round(111.9,1),round(111.999999,9.9));
Warnings:
Warning	1265	Data truncated for column 'a' at row 1
Warning	1265	Data truncated for column 'b' at row 1
insert into t1 values(round(false),round(true-1));
insert into t1 values(round(false+1),round(1.123456231,9.9));
Warnings:
Warning	1265	Data truncated for column 'b' at row 1
select round(a,b) from t1 order by round(a);
round(a,b)
0
1
112
220914
select round(b,a) from t1 order by round(a);
round(b,a)
0
1
112
220927
drop table t1;
create table t1(a FLOAT primary key,b FLOAT);
insert into t1 values(220913.999999,220927.1111);
insert into t1 values(round(111.9,1),round(111.999999,9.9));
insert into t1 values(round(false),round(true-1));
insert into t1 values(round(false+1),round(1.123456231,9.9));
select round(a,b) from t1 order by round(a);
round(a,b)
0
1
111.9000015258789
220914
select round(b,a) from t1 order by round(a);
round(b,a)
0
1.1
112
220927.109375
drop table t1;
create table t1(a DOUBLE primary key,b DOUBLE);
insert into t1 values(220913.999999,220927.1111);
insert into t1 values(round(111.9,1),round(111.999999,9.9));
insert into t1 values(round(false),round(true-1));
insert into t1 values(round(false+1),round(1.123456231,9.9));
select round(a,b) from t1 order by round(a);
round(a,b)
0
1
111.9
220913.999999
select round(b,a) from t1 order by round(a);
round(b,a)
0
1.1
111.999999
220927.1111
drop table t1;
create table t1(a BIT primary key,b bit);
insert into t1 values(round(false),round(true-1));
insert into t1 values(round(false+1),round(1.123456231,9.9));
select round(a,b) from t1 order by round(a);
round(a,b)
0
1
select round(b,a) from t1 order by round(a);
round(b,a)
0
1
drop table t1;
create table t1(a DATETIME primary key,b DATETIME);
insert into t1 values('2022-09-13 ','2038-01-19');
select round(a,b) from t1 order by round(a);
round(a,b)
20220913000000
select round(b,a) from t1 order by round(a);
round(b,a)
20380119000000
drop table t1;
create table t1(a TIMESTAMP,b TIMESTAMP DEFAULT CURRENT_TIMESTAMP ON UPDATE CURRENT_TIMESTAMP);
insert into t1 values('2022-09-13 23:59:59.999999','2038-01-19 03:14:07.999999');
select round(a,b) from t1;
round(a,b)
20220914000000
select round(b,a) from t1;
round(b,a)
20380119031408
drop table t1;
create table t1(a DATE,b DATE);
insert into t1 values('1970-01-01 23:59:59','2038-01-19 03:14:07');
select round(a,b) from t1;
round(a,b)
19700101
select round(b,a) from t1;
round(b,a)
20380119
drop table t1;
create table t1(a TIME,b TIME);
insert into t1 values('23:59:59.999999','2038-01-19 23:59:59.999999');
select round(a,b) from t1;
round(a,b)
240000
select round(b,a) from t1;
round(b,a)
240000
drop table t1;
create table t1(a YEAR,b year);
insert into t1 values('2022','2038');
select round(a,b) from t1;
round(a,b)
2022
select round(b,a) from t1;
round(b,a)
2038
drop table t1;
create table t1(a VARCHAR(50) primary key,b VARCHAR(50));
insert into t1 values(220913.999999,220927.1111);
insert into t1 values(round(111.9,1),round(111.999999,9.9));
insert into t1 values(round(false),round(true-1));
insert into t1 values(round(false+1),round(1.123456231,9.9));
select round(a,9.9) from t1 order by round(a);
round(a,9.9)
0.0000000000
1.0000000000
111.9000000000
220913.9999990000
select round(b,9.9) from t1 order by round(a);
round(b,9.9)
0.0000000000
1.1234562310
111.9999990000
220927.1111000000
drop table t1;
create table t1(a VARBINARY(50) primary key,b VARBINARY(50));
insert into t1 values(220913.999999,220927.1111);
insert into t1 values(round(111.9,1),round(111.999999,9.9));
insert into t1 values(round(false),round(true-1));
insert into t1 values(round(false+1),round(1.123456231,9.9));
select round(a,9.9) from t1 order by round(a);
round(a,9.9)
0.0000000000
1.0000000000
111.9000000000
220913.9999990000
select round(b,9.9) from t1 order by round(a);
round(b,9.9)
0.0000000000
1.1234562310
111.9999990000
220927.1111000000
drop table t1;
create table t1(a CHAR(50) primary key,b CHAR(50));
insert into t1 values(220913.999999,220927.1111);
insert into t1 values(round(111.9,1),round(111.999999,9.9));
insert into t1 values(round(false),round(true-1));
insert into t1 values(round(false+1),round(1.123456231,9.9));
select round(a,9.9) from t1 order by round(a);
round(a,9.9)
0.0000000000
1.0000000000
111.9000000000
220913.9999990000
select round(b,9.9) from t1 order by round(a);
round(b,9.9)
0.0000000000
1.1234562310
111.9999990000
220927.1111000000
drop table t1;
create table t1(a BINARY(10) primary key,b BINARY(10));
insert into t1 values(round('10111101'),'11111011');
select round(a,9.9) from t1 order by round(a);
round(a,9.9)
10111101.0000000000
Warnings:
Warning	1292	Truncated incorrect DOUBLE value: '10111101'
Warning	1292	Truncated incorrect DOUBLE value: '10111101'
select round(b,9.9) from t1 order by round(a);
round(b,9.9)
11111011.0000000000
Warnings:
Warning	1292	Truncated incorrect DOUBLE value: '10111101'
Warning	1292	Truncated incorrect DOUBLE value: '11111011'
drop table t1;
create table t1(a enum ('2022-09-27 23:59:59.999999','2038-01-19 23:59:59.999999') primary key,b enum ('10111101','11111011'));
insert into t1 values('2022-09-27 23:59:59.999999','10111101');
select round(a,9.9) from t1 order by round(a);
round(a,9.9)
1.0000000000
select round(b,9.9) from t1 order by round(a);
round(b,9.9)
1.0000000000
drop table t1;
create table t1(a set ('1.12345685','1.123456857'),b set ('9.899995288','9.8999952889'));
insert into t1 values(round('1.12345685'),'9.899995288');
select round(a,9.9) from t1 order by round(a);
round(a,9.9)
1.0000000000
select round(b,9.9) from t1 order by round(a);
round(b,9.9)
1.0000000000
drop table t1;
create table t1(a TINYTEXT ,b TINYTEXT);
insert into t1 values(round('1.12345685'),'9.899995288');
select round(a,9.9) from t1 order by round(a);
round(a,9.9)
1.0000000000
select round(b,9.9) from t1 order by round(a);
round(b,9.9)
9.8999952880
drop table t1;
create table t1(a TINYBLOB,b TINYBLOB);
insert into t1 values(round('1.12345685'),'9.899995288');
select round(a,9.9) from t1 order by round(a);
round(a,9.9)
1.0000000000
select round(b,9.9) from t1 order by round(a);
round(b,9.9)
9.8999952880
drop table t1;
create table t1(a TEXT,b TEXT);
insert into t1 values(round('1.12345685'),9.899995288);
select round(a,9.9) from t1 order by round(a);
round(a,9.9)
1.0000000000
select round(b,9.9) from t1 order by round(a);
round(b,9.9)
9.8999952880
drop table t1;
create table t1(a BLOB,b BLOB);
insert into t1 values(round('1.12345685'),9.899995288);
select round(a,9.9) from t1 order by round(a);
round(a,9.9)
1.0000000000
select round(b,9.9) from t1 order by round(a);
round(b,9.9)
9.8999952880
drop table t1;
create table t1(a MEDIUMTEXT,b MEDIUMTEXT);
insert into t1 values(round('1.12345685'),9.899995288);
select round(a,9.9) from t1 order by round(a);
round(a,9.9)
1.0000000000
select round(b,9.9) from t1 order by round(a);
round(b,9.9)
9.8999952880
drop table t1;
create table t1(a MEDIUMBLOB,b MEDIUMBLOB);
insert into t1 values(round('1.12345685'),9.899995288);
select round(a,9.9) from t1 order by round(a);
round(a,9.9)
1.0000000000
select round(b,9.9) from t1 order by round(a);
round(b,9.9)
9.8999952880
drop table t1;
create table t1(a LONGTEXT,b LONGTEXT);
insert into t1 values(round('1.12345685'),9.899995288);
select round(a,9.9) from t1 order by round(a);
round(a,9.9)
1.0000000000
select round(b,9.9) from t1 order by round(a);
round(b,9.9)
9.8999952880
drop table t1;
create table t1(a LONGBLOB,b LONGBLOB);
insert into t1 values(round('1.12345685'),9.899995288);
select round(a,9.9) from t1 order by round(a);
round(a,9.9)
1.0000000000
select round(b,9.9) from t1 order by round(a);
round(b,9.9)
9.8999952880
drop table t1;
create table t1 (c1 int ,c2 varchar(40),c3 float);
insert into t1 values(1,'test01',round(1.123456231,9.9));
insert into t1 values(2,'test02',round(3.12,3));
insert into t1 values(3,'test03',round(4.123,3));
insert into t1 values(4,'test04',round(8.999,3));
insert into t1 values(5,'test05',round(8.998,3));
insert into t1 values(8,'test06',round(false,false));
select * from t1;
c1	c2	c3
1	test01	1.12346
2	test02	3.12
3	test03	4.123
4	test04	8.999
5	test05	8.998
8	test06	0
drop table t2;
create table t2 (a1 int ,a2 float);
insert into t2(a1, a2)  select 1,round(1.1235557777111,9.9);
select * from t2;
a1	a2
1	1.12356
drop table t2;
insert into t1(c3) values(-round(2.55552,3));
insert into t1(c3) values(+round(3.555523,9.9));
insert into t1(c3) values(-round(5.222229,9.9));
insert into t1(c3) values(round(2.55552,3)+round(3.555523,9.9));
insert into t1(c3) values(round(3.555523,9.9)*round(2.55552,3));
insert into t1(c3) values(round(5.222229,9.9)/1);
insert into t1 values(round(-1.12345658,9.9)%1,round(-1.123456589,9.9)%1,round(-1.123456587,9.9)%1);
insert into t1 values(round(-1.12345658,9.9) mod 1,round(-1.123456589,9.9) mod 1,round(-1.123456587,9.9) mod 1);
insert into t1 values(round(-1.12345658,9.9) div 1,round(-1.123456589,9.9) div 1,round(-1.123456587,9.9) div 1);
insert into t1 values(round(-1.12345658,9.9)+0%1,round(-1.123456589,9.9)+1%1,round(-1.123456587,9.9)+1%1);
insert into t1 values(round(-1.12345658,9.9)-1 div 1,round(-1.123456589,9.9)-2 div 1,round(-1.123456587,9.9)-1 div 1);
insert into t1 values(round(-1.12345658,9.9)-1 mod 1,round(-1.123456589,9.9)-1 mod 1,round(-1.123456587,9.9)-1 mod 1);
insert into t1 values(round(-1.12345658,9.9)-1 * 1,round(-1.123456589,9.9)-1 * 1,round(-1.123456587,9.9)-1 * 1);
select count(*) from t1;
count(*)
19
## update
drop table t1;
create table t1 (c1 int ,c2 varchar(20),c3 float);
insert into t1 values(1,'test01',round(2.55552,3));
insert into t1 values(2,'test02',round(3.555523,9.9));
insert into t1 values(3,'test03',round(5.222229,9.9));
insert into t1 values(4,'test04',round(1.1235557777111,9.9));
update t1 set c3= round(-1.123456589,9.9) where c2='test01';
update t1 set c3= round(-2.123456587,9.9)+0 where c2='test01';
update t1 set c3= round(-3.12345658,9.9) where c2 in ('test01','test02');
update t1 set c3= round(-4.12345658,9.9) where c1 in (round(1.0,4));
update t1 set c1= round(1.2345678,9),c3=round(null) where c2 in ('test01');
update t1 set c1= round(3.123456,8),c3=3.12345925 where c3 is null;
update t1 set c3= round(-9.9,9.2229)  where c1<round(2.99,9.9);
update t1 set c3= round(6.99,-9.9) where c3 between round('') and round(1.12356,6) ;
update t1 set c3= round(3/round(3),1)+0 where c3 = round('')  or c1>round(3,1) ;
update t1 set c1= round(20220811)+0 where c2 like '%4%' ;
update t1 set c3= round(20220812) where c3>any(select round(null));
update t1 set c1= round(20220811)+1 where c3<all(select round(20220811));
update t1 set c1= abs(round(20220811));
update t1 set c1= TO_DAYS(round(20220811));
update t1 set c1= LOCATE(round(20220811)-1,round(20220811));
select * from t1;
c1	c2	c3
0	test01	3.12346
0	test02	-9.9
0	test03	5.22223
0	test04	1
drop table t1;
##delete
create table t1 (c1 int ,c2 varchar(20),c3 float);
insert into t1 values(1,round(20220907),-1.123456589);
insert into t1 values(2,round(20220909),-2.123456587);
insert into t1 values(3,round(2022-08-20),-3.12345658);
insert into t1 values(4,round(2022-09-15),-4.12345658);
insert into t1 values(5,round(2022-09-16),3.123456);
delete from t1 where c2 = round(2022-09-16);
delete from t1 where c3 = round(-4.12345658,5);
select * from t1;
c1	c2	c3
1	20220907	-1.12346
2	20220909	-2.12346
3	1994	-3.12346
4	1998	-4.12346
drop table t1;
create table t1(c1 int, c2 float);
alter  table t1 modify  column c1 int(round(2022-09-13));
ERROR 42000: You have an error in your SQL syntax; check the manual that corresponds to your OceanBase version for the right syntax to use near 'round(2022-09-13))' at line 1
alter  table t1 modify  column c2 double  DEFAULT round(1.1111,3);
ERROR 42000: You have an error in your SQL syntax; check the manual that corresponds to your OceanBase version for the right syntax to use near 'round(1.1111,3)' at line 1
目前 OB 不支持这样改变列类型。小类型可以改大，大的不能改小。也不能跨大类型改。
alter  table t1 modify  column c2 double  GENERATED ALWAYS AS (round(9.9,9.9)) STORED NOT NULL COMMENT '日期';
ERROR HY000: 'Changing the STORED status' is not supported for generated columns.
########清空回收站，删除测试数据库，表等 ##########
drop database  IF EXISTS db1;
