drop database  IF EXISTS  db1;
create database db1;
use db1;
SET wait_timeout=30000000;
SET ob_trx_timeout = 30000000;
SET ob_query_timeout = 30000000;
##设置相同sql_mode;
SET @@sql_mode='STRICT_TRANS_TABLES,NO_ENGINE_SUBSTITUTION,no_zero_date,no_zero_in_date,PIPES_AS_CONCAT';
create table t1 (c1 int primary key, c2 float(10,9)) partition by hash(round(c1)) partitions 3;
ERROR HY000: This partition function is not allowed
drop table t1;
Got one of the listed errors
create table t1 (c1 int primary key, c2 float(10,9)) partition by hash(c1) partitions 3;
insert into t1 values(1,round(-1.123456589,9.9));
insert into t1 values(2,round(-2.123456587,9.9));
insert into t1 values(3,round(-3.12345658,9.9));
insert into t1 values(4,round(-4.12345658,9.9));
select * from t1 order by round(c2);
c1	c2
4	-4.123456478
3	-3.123456478
2	-2.123456478
1	-1.123456597
update t1 set c2 =round(-1.123456597,9.9);
delete from t1 where c2 =round(-1.123456597,9);
select * from t1;
c1	c2
drop table t1;
create table t1 (c1 int primary key, c2 float(10,9)) partition by range(c1) (
PARTITION p0 VALUES LESS THAN (2),
PARTITION p1 VALUES LESS THAN (4),
PARTITION p2 VALUES LESS THAN (6)
);
insert into t1 values(1,round(-1.123456589,9.9));
insert into t1 values(2,round(-2.123456587,9.9));
insert into t1 values(3,round(-3.12345658,9.9));
insert into t1 values(4,round(-4.12345658,9.9));
select * from t1 order by round(c2);
c1	c2
4	-4.123456478
3	-3.123456478
2	-2.123456478
1	-1.123456597
update t1 set c2 =round(-1.123456597,9.9);
delete from t1 where c2 =round(-1.123456597,9);
select * from t1;
c1	c2
drop table t1;
create table t1 (c1 int primary key, c2 float(10,9)) partition by list(c1) (
PARTITION p0 VALUES IN (1,2),
PARTITION p1 VALUES IN (3,4),
PARTITION p2 VALUES IN (5,6)
);
insert into t1 values(1,round(-1.123456589,9.9));
insert into t1 values(2,round(-2.123456587,9.9));
insert into t1 values(3,round(-3.12345658,9.9));
insert into t1 values(4,round(-4.12345658,9.9));
select * from t1 order by round(c2);
c1	c2
4	-4.123456478
3	-3.123456478
2	-2.123456478
1	-1.123456597
update t1 set c2 =round(-1.123456597,9.9);
delete from t1 where c2 =round(-1.123456597,9);
select * from t1;
c1	c2
drop table t1;
create table t1 (c1 int primary key, c2 float(10,9)) partition by key(round(c1)) partitions 3;
ERROR 42000: You have an error in your SQL syntax; check the manual that corresponds to your OceanBase version for the right syntax to use near '(c1)) partitions 3' at line 1
create table t1 (c1 int primary key, c2 float(10,9)) partition by key(c1) partitions 3;
insert into t1 values(1,round(-1.123456589,9.9));
insert into t1 values(2,round(-2.123456587,9.9));
insert into t1 values(3,round(-3.12345658,9.9));
insert into t1 values(4,round(-4.12345658,9.9));
select * from t1 order by round(c2);
c1	c2
4	-4.123456478
3	-3.123456478
2	-2.123456478
1	-1.123456597
update t1 set c2 =round(-1.123456597,9.9);
delete from t1 where c2 =round(-1.123456597,9);
select * from t1;
c1	c2
## 视图
drop table t1;
create table t1 (c1 int ,c2 varchar(20),c3 float(10,3));
insert into t1 values(1,round(20220907),-1.123456589);
insert into t1 values(2,round(20220909),-2.123456587);
insert into t1 values(3,round(2022-08-20),-3.12345658);
insert into t1 values(4,round(2022-09-15),-4.12345658);
insert into t1 values(5,round(2022-09-16),3.123456);
drop view v1;
create view v1 as select * from t1 where c3<round('');
select * from v1 order by round(c1,9.9);
c1	c2	c3
1	20220907	-1.123
2	20220909	-2.123
3	1994	-3.123
4	1998	-4.123
select v1.*, round(c3,9.9) from v1 where round(c3)=round(-1);
c1	c2	c3	round(c3,9.9)
1	20220907	-1.123	-1.1230000257
select v1.*, round(c3,9.9) from v1 where round(c3)>=round(-2.1,9.9) order by round(c1) limit 1;
c1	c2	c3	round(c3,9.9)
1	20220907	-1.123	-1.1230000257
select v1.*, round(c3,9.9) from v1 where round(c3,9.9)<=round(-3.1,9.9) order by round(c1) limit 1;
c1	c2	c3	round(c3,9.9)
3	1994	-3.123	-3.1229999065
select v1.*, round(c3,9.9) from v1 where round(c3)=round(-1,9.9);
c1	c2	c3	round(c3,9.9)
1	20220907	-1.123	-1.1230000257
select v1.*, round(c3,9.9) from v1 where round(c3)<round(-2,9.9);
c1	c2	c3	round(c3,9.9)
3	1994	-3.123	-3.1229999065
4	1998	-4.123	-4.1230001450
select v1.*, round(c3,9.9) from v1 where round(c3)>round(-3,9.9);
c1	c2	c3	round(c3,9.9)
1	20220907	-1.123	-1.1230000257
2	20220909	-2.123	-2.1229999065
select v1.*, round(c3,9.9) from v1 where round(c3) between round(-3,9.9) and round(-1,9.9) order by round(c1) limit 1;
c1	c2	c3	round(c3,9.9)
1	20220907	-1.123	-1.1230000257
select v1.*, round(c3,9.9) from v1 where round(c3) like '%1%';
c1	c2	c3	round(c3,9.9)
1	20220907	-1.123	-1.1230000257
select v1.*, round(c3,9.9),max(round(c3,9.9))+min(round(c3,9.9)) from v1 where exists (select round(c3),round(c3));
c1	c2	c3	round(c3,9.9)	max(round(c3,9.9))+min(round(c3,9.9))
1	20220907	-1.123	-1.1230000257	-5.2460001707
select v1.*, round(c3,9.9) from v1 where round(-1,9) in  (select round(c3));
c1	c2	c3	round(c3,9.9)
1	20220907	-1.123	-1.1230000257
select v1.*, round(c3,9.9) from v1 where round(-3,9) > all(select round(c3));
c1	c2	c3	round(c3,9.9)
4	1998	-4.123	-4.1230001450
select v1.*, round(c3,9.9) from v1 where c1 =2 or c2 ='test03';
c1	c2	c3	round(c3,9.9)
2	20220909	-2.123	-2.1229999065
select v1.*, round(c3,9.9) from v1 where c1 =2 and c2 ='test02';
c1	c2	c3	round(c3,9.9)
insert into v1(c3) values(round('2022.09167',8.9));
insert into v1(c1,c2,c3) values(0,round('200914'),20.0914);
insert into v1(c1,c2,c3) values(6,round('200918'),20.0918);
delete from t1 where c2 is null;
delete from t1 where c2=round(200918);
delete from t1 where c3=round(-1.123);
drop table t1;
drop view v1;
##PL块
drop table t1;
drop table t2;
DROP PROCEDURE pro1;
CREATE  PROCEDURE pro1( out a int)
begin
select round('1.999999999','9')/round('1.999999999','9') into a;
end;
//
CALL pro1(@aa);
select @aa;
@aa
1
DROP PROCEDURE pro1;
DROP PROCEDURE pro2;
CREATE  PROCEDURE pro2( out b varchar(30))
begin
select round(2022-09-14) into b;
end;
//
CALL pro2(@bb);
select @bb;
@bb
1999
DROP PROCEDURE pro2;
drop table t1;
create table t1(c1 int,c2 varchar(20));
DROP PROCEDURE pro3;
CREATE PROCEDURE pro3(in a int)
begin
declare i int;
set i=3.9;
while i <=20  DO
if a > i then
select round(i,9.9);
end if;
insert into t1 values(i,round(i,9.9));
set i = i + 1;
end WHILE;
end;
//
CALL pro3(round(12));
round(i,9.9)
round(i,9.9)
round(i,9.9)
round(i,9.9)
round(i,9.9)
round(i,9.9)
round(i,9.9)
round(i,9.9)
4
5
6
7
8
9
10
11
DROP PROCEDURE pro3;
drop table t1;
create table t1(c1 int,c2 varchar(30));
DROP PROCEDURE pro4;
CREATE PROCEDURE pro4(in a int)
begin
declare i int;
declare b int;
set i=round(3.9,9.9);
while i <=round(8.888,3)  DO
if a =round(15,null) then
select round(a);
end if;
insert into t1 values(a ,round(a));
set i = i + 1;
end WHILE;
select a into b;
end;
//
CALL pro4(15);
select * from t1;
c1	c2
15	15
15	15
15	15
15	15
15	15
DROP PROCEDURE pro4;
drop table t1;
create table t1(c1 int,c2 varchar(30));
drop function  f1;
create function f1(aa  int) returns varchar(30)
begin
return round(aa,9.9);
end;
//
select f1(round('9.99',9.9));
f1(round('9.99',9.9))
10
drop table t1;
drop function  f1;
##insert型触发器
drop table t1;
drop table t2;
drop trigger t1_trigger;
create table t1 (c1 int ,c2 varchar(20),c3 float);
insert into t1 values(1,'test01',round(1.23456,9.9));
insert into t1 values(2,'test02',round(2.123456,9.9));
insert into t1 values(3,'test03',round(3.456278,9.9));
insert into t1 values(4,'test04',round(4.35621,null));
insert into t1 values(5,'test05',round(5.012345,3.0));
create table t2 (a1 int ,a2 float);
insert into t2 values(1,9.9);
insert into t2 values(2,1.22222);
select * from t2;
a1	a2
1	9.9
2	1.22222
create trigger t1_trigger after insert on  t2
for each row
begin 
update t1 set c3 = round(2.39852,3.2) where c3 is null ;
end //
insert into t2 values(3,9.99);
select * from t1;
c1	c2	c3
1	test01	1.23456
2	test02	2.12346
3	test03	3.45628
4	test04	2.399
5	test05	5.012
##update型触发器
drop table t1;
drop table t2;
drop trigger t1_trigger;
create table t1 (c1 int ,c2 varchar(20),c3 float);
insert into t1 values(1,'test01',round(1.23456,9.9));
insert into t1 values(2,'test02',round(2.123456,9.9));
insert into t1 values(3,'test03',round(3.456278,9.9));
insert into t1 values(4,'test04',round(4.35621,null));
insert into t1 values(5,'test05',round(5.012345,3.0));
create table t2 (a1 int ,a2 float);
insert into t2 values(1,9.9);
insert into t2 values(2,1.22222);
select * from t2;
a1	a2
1	9.9
2	1.22222
create trigger t1_trigger after update on  t2
for each row
begin 
update t1 set c3 = round(2.39852,3.2) where c3 is null ;
end //
update t2 set a2=round(1.123,9.9) where a1=1;
select * from t1;
c1	c2	c3
1	test01	1.23456
2	test02	2.12346
3	test03	3.45628
4	test04	2.399
5	test05	5.012
##delete型触发器
drop table t1;
drop table t2;
drop trigger t1_trigger;
create table t1 (c1 int ,c2 varchar(20),c3 float);
insert into t1 values(1,'test01',round(1.23456,9.9));
insert into t1 values(2,'test02',round(2.123456,9.9));
insert into t1 values(3,'test03',round(3.456278,9.9));
insert into t1 values(4,'test04',round(4.35621,null));
insert into t1 values(5,'test05',round(5.012345,3.0));
create table t2 (a1 int ,a2 float);
insert into t2 values(1,9.9);
insert into t2 values(2,1.22222);
select * from t2;
a1	a2
1	9.9
2	1.22222
create trigger t1_trigger after delete on  t2
for each row
begin 
update t1 set c3 = round(2.39852,3.2) where c3 is null ;
end //
delete from t2 where a1=round(2,10);
select * from t1;
c1	c2	c3
1	test01	1.23456
2	test02	2.12346
3	test03	3.45628
4	test04	2.399
5	test05	5.012
drop table t1;
drop table t2;
drop trigger t1_trigger;
##约束
drop table t1;
create table t1(c1 float(20,10) primary key,c2 int default '10');
drop table t2;
create table t2(a1 int unique key ,a2 varchar(20),a3 float(30,10),CONSTRAINT for_key FOREIGN KEY (a3) REFERENCES  t1 (c1));
drop table t3;
create table t3(b1 int not null ,b2 float not null);
insert into t3 values(10,round(9.9));
insert into t1 values(round(1.123456,9.9),round(2,1));
insert into t1(c1) values(1.123450);
insert into t1(c1) values(round(10,10));
update t1 set c1=round(3.123456,6),c2=round(3.1234560,1) where c2=round(9.9,10);
select * from t1;
c1	c2
1.1234500408	10
1.1234560013	2
10.0000000000	10
insert into t2 values(round(3,1),round('9.9'),round(10,9));
select * from t2;
a1	a2	a3
3	10	10.0000000000
update t2 set a1=round(4.1415926,10) where a3=round(10,9.9);
update t2 set a3=round(9.9,0.1);
update t3 set b1=round(null);
ERROR 23000: Column 'b1' cannot be null
update t3 set b2=round(null);
ERROR 23000: Column 'b2' cannot be null
insert into t3 values(round(2022),round(2022,null));
ERROR 23000: Column 'b2' cannot be null
select * from t3;
b1	b2
10	10
##索引
CREATE INDEX indexName ON t1 (c1);
insert into t1 values(round(8.9,1),round(9.2,1));
update t1 set c1=round(3.12)  where c1=round(8.9,1);
select * from t1 ;
c1	c2
1.1234500408	10
1.1234560013	2
8.8999996185	9
10.0000000000	10
########清空回收站，删除测试数据库，表等 ##########
drop database  IF EXISTS db1;
