purge recyclebin;
#
# Start of 5.6 tests
#
DROP DATABASE db1;
CREATE DATABASE db1 CHARACTER SET dec8;
use db1;
set names dec8;
SET collation_connection=dec8_swedish_ci;
SELECT HEX('a'), HEX('a ');
HEX('a')	HEX('a ')
61	6120
select 'a' = 'a', 'a' = 'a ', 'a ' = 'a';
'a' = 'a'	'a' = 'a '	'a ' = 'a'
1	1	1
select 'a\0' = 'a', 'a\0' < 'a', 'a\0' > 'a';
'a\0' = 'a'	'a\0' < 'a'	'a\0' > 'a'
0	1	0
select 'a' = 'a\0', 'a' < 'a\0', 'a' > 'a\0';
'a' = 'a\0'	'a' < 'a\0'	'a' > 'a\0'
0	0	1
select 'a\0' = 'a ', 'a\0' < 'a ', 'a\0' > 'a ';
'a\0' = 'a '	'a\0' < 'a '	'a\0' > 'a '
0	1	0
select 'a ' = 'a\0', 'a ' < 'a\0', 'a ' > 'a\0';
'a ' = 'a\0'	'a ' < 'a\0'	'a ' > 'a\0'
0	0	1
select 'a  a' > 'a', 'a  \0' < 'a';
'a  a' > 'a'	'a  \0' < 'a'
1	1
select binary 'a  a' > 'a', binary 'a  \0' > 'a', binary 'a\0' > 'a';
binary 'a  a' > 'a'	binary 'a  \0' > 'a'	binary 'a\0' > 'a'
1	1	1
#
# Check that incomplete dec8 characters in HEX notation
# are left-padded with zeros
#
SELECT HEX(_dec8 0x44);
HEX(_dec8 0x44)
44
SELECT HEX(_dec8 0x3344);
HEX(_dec8 0x3344)
3344
SELECT HEX(_dec8 0x113344);
HEX(_dec8 0x113344)
113344
#
# Check that 0x20 is only trimmed when it is
# a part of real SPACE character, not just a part
# of a multibyte sequence.
# Note, CYRILLIC LETTER ER is used as an example, which
# is stored as 0x0420 in dec8, thus contains 0x20 in the
# low byte. The second character is THREE-PER-M, U+2004,
# which contains 0x20 in the high byte.
#
DROP TABLE t1;
CREATE TABLE t1 (word VARCHAR(64), word2 CHAR(64)) CHARACTER SET dec8;
INSERT INTO t1 VALUES (_dec8 0xF2, _dec8 0xF2), (_dec8 X'2004',_dec8 X'2004');
SELECT HEX(word) FROM t1 ORDER BY word;
HEX(word)
2004
F2
SELECT HEX(word2) FROM t1 ORDER BY word2;
HEX(word2)
2004
F2
DELETE FROM t1;
#
# Check that real spaces are correctly trimmed.
#
DROP TABLE t1;
CREATE TABLE t1 SELECT
LPAD(_dec8 X'2004',10,_dec8 X'2104') l,
RPAD(_dec8 X'2004',10,_dec8 X'2104') r;
SHOW CREATE TABLE t1;
Table	Create Table
t1	CREATE TABLE `t1` (
  `l` varchar(10) DEFAULT NULL,
  `r` varchar(10) DEFAULT NULL
) ORGANIZATION INDEX DEFAULT CHARSET = dec8 ROW_FORMAT = DYNAMIC COMPRESSION = 'zstd_1.3.8' REPLICA_NUM = 1 BLOCK_SIZE = 16384 USE_BLOOM_FILTER = FALSE ENABLE_MACRO_BLOCK_BLOOM_FILTER = FALSE TABLET_SIZE = 134217728 PCTFREE = 0
SELECT HEX(l), HEX(r) FROM t1;
HEX(l)	HEX(r)
21042104210421042004	20042104210421042104
DROP TABLE t1;
CREATE TABLE t1 (f1 CHAR(30) charset dec8);
INSERT INTO t1 VALUES ("103000"), ("22720000"), ("3401200"), ("78000");
SELECT LPAD(f1, 12, "-o-/") FROM t1;
LPAD(f1, 12, "-o-/")
-o-/-o103000
-o-/22720000
-o-/-3401200
-o-/-o-78000
DROP TABLE t1;
#
# Testing LIKE
#
SET NAMES utf8, collation_connection=dec8_swedish_ci;
select @@collation_connection;
@@collation_connection
dec8_swedish_ci
create table t1 as select repeat(' ',10) as a union select null;
alter table t1 add key(a);
show create table t1;
Table	Create Table
t1	CREATE TABLE `t1` (
  `a` varchar(512) DEFAULT NULL,
  KEY `a` (`a`) BLOCK_SIZE 16384 LOCAL
) ORGANIZATION INDEX DEFAULT CHARSET = dec8 ROW_FORMAT = DYNAMIC COMPRESSION = 'zstd_1.3.8' REPLICA_NUM = 1 BLOCK_SIZE = 16384 USE_BLOOM_FILTER = FALSE ENABLE_MACRO_BLOCK_BLOOM_FILTER = FALSE TABLET_SIZE = 134217728 PCTFREE = 0
insert into t1 values ("a"),("abc"),("abcd"),("hello"),("test");
explain select * from t1 where a like 'abc%';
explain select * from t1 where a like concat('abc','%');
select * from t1 where a like "abc%";
a
abc
abcd
select * from t1 where a like concat("abc","%");
a
abc
abcd
select * from t1 where a like "ABC%";
a
abc
abcd
select * from t1 where a like "test%";
a
test
select * from t1 where a like "te_t";
a
test
select * from t1 where a like "%a%";
a
a
abc
abcd
select * from t1 where a like "%abcd%";
a
abcd
select * from t1 where a like "%abc\d%";
a
abcd
DROP TABLE t1;
select 'AA' like 'AA';
'AA' like 'AA'
1
select 'AA' like 'A%A';
'AA' like 'A%A'
1
select 'AA' like 'A%%A';
'AA' like 'A%%A'
1
select 'AA' like 'AA%';
'AA' like 'AA%'
1
select 'AA' like '%AA%';
'AA' like '%AA%'
1
select 'AA' like '%A';
'AA' like '%A'
1
select 'AA' like '%AA';
'AA' like '%AA'
1
select 'AA' like 'A%A%';
'AA' like 'A%A%'
1
select 'AA' like '_%_%';
'AA' like '_%_%'
1
select 'AA' like '%A%A';
'AA' like '%A%A'
1
select 'AAA'like 'A%A%A';
'AAA'like 'A%A%A'
1
select 'AZ' like 'AZ';
'AZ' like 'AZ'
1
select 'AZ' like 'A%Z';
'AZ' like 'A%Z'
1
select 'AZ' like 'A%%Z';
'AZ' like 'A%%Z'
1
select 'AZ' like 'AZ%';
'AZ' like 'AZ%'
1
select 'AZ' like '%AZ%';
'AZ' like '%AZ%'
1
select 'AZ' like '%Z';
'AZ' like '%Z'
1
select 'AZ' like '%AZ';
'AZ' like '%AZ'
1
select 'AZ' like 'A%Z%';
'AZ' like 'A%Z%'
1
select 'AZ' like '_%_%';
'AZ' like '_%_%'
1
select 'AZ' like '%A%Z';
'AZ' like '%A%Z'
1
select 'AZ' like 'A_';
'AZ' like 'A_'
1
select 'AZ' like '_Z';
'AZ' like '_Z'
1
select 'AMZ'like 'A%M%Z';
'AMZ'like 'A%M%Z'
1
CREATE TABLE t1 (a VARCHAR(100) CHARACTER SET dec8);
INSERT INTO t1 VALUES ('фыва'),('Фыва'),('фЫва'),('фыВа'),('фывА'),('ФЫВА');
INSERT INTO t1 VALUES ('фывапролдж'),('Фывапролдж'),('фЫвапролдж'),('фыВапролдж');
INSERT INTO t1 VALUES ('фывАпролдж'),('фываПролдж'),('фывапРолдж'),('фывапрОлдж');
INSERT INTO t1 VALUES ('фывапроЛдж'),('фывапролДж'),('фывапролдЖ'),('ФЫВАПРОЛДЖ');
SELECT * FROM t1 WHERE a LIKE '%фЫва%' ORDER BY BINARY a;
a
Ñ?«?²?°
Ñ?«?²?°?¿Ñ???»???¶
SELECT * FROM t1 WHERE a LIKE '%фЫв%' ORDER BY BINARY a;
a
Ñ?«?²?°
Ñ?«?²?°?¿Ñ???»???¶
SELECT * FROM t1 WHERE a LIKE 'фЫва%' ORDER BY BINARY a;
a
Ñ?«?²?°
Ñ?«?²?°?¿Ñ???»???¶
SELECT * FROM t1 WHERE a LIKE 'фЫва%' COLLATE dec8_bin ORDER BY BINARY a;
a
Ñ?«?²?°
Ñ?«?²?°?¿Ñ???»???¶
DROP TABLE t1;
CREATE TABLE t1 (word VARCHAR(64) NOT NULL, PRIMARY KEY (word))
CHARACTER SET dec8;
INSERT INTO t1 (word) VALUES ("cat");
SELECT * FROM t1 WHERE word LIKE "c%";
word
cat
SELECT * FROM t1 WHERE word LIKE "ca_";
word
cat
SELECT * FROM t1 WHERE word LIKE "cat";
word
cat
DROP TABLE t1;
#
# Check that INSERT() works fine.
# This invokes charpos() function.
#
CREATE TABLE t1 (
a VARCHAR(10) CHARACTER SET dec8,
b VARCHAR(10) CHARACTER SET dec8);
INSERT INTO t1 VALUES ('abc', 'def');
SELECT INSERT(a, 10, 2, b) FROM t1;
INSERT(a, 10, 2, b)
abc
SELECT INSERT(a, 1, 2, b) FROM t1;
INSERT(a, 1, 2, b)
defc
DROP TABLE t1;
#
# Check alignment for from-binary-conversion with CAST and CONVERT
#
SELECT HEX(CAST(0xAA as char CHARACTER SET dec8));
HEX(CAST(0xAA as char CHARACTER SET dec8))
AA
SELECT HEX(CONVERT(0xAA USING dec8));
HEX(CONVERT(0xAA USING dec8))
AA
#
# Check alignment for string types
#
CREATE TABLE t1 (a CHAR(10) CHARACTER SET dec8);
INSERT INTO t1 VALUES (0x1),(0x11),(0x111),(0x1111),(0x11111);
SELECT HEX(a) FROM t1;
HEX(a)
01
11
0111
1111
011111
DROP TABLE t1;
CREATE TABLE t1 (a VARCHAR(10) CHARACTER SET dec8);
INSERT INTO t1 VALUES (0x1),(0x11),(0x111),(0x1111),(0x11111);
SELECT HEX(a) FROM t1;
HEX(a)
01
11
0111
1111
011111
DROP TABLE t1;
CREATE TABLE t1 (a TEXT CHARACTER SET dec8);
INSERT INTO t1 VALUES (0x1),(0x11),(0x111),(0x1111),(0x11111);
SELECT HEX(a) FROM t1;
HEX(a)
01
11
0111
1111
011111
DROP TABLE t1;
CREATE TABLE t1 (a MEDIUMTEXT CHARACTER SET dec8);
INSERT INTO t1 VALUES (0x1),(0x11),(0x111),(0x1111),(0x11111);
SELECT HEX(a) FROM t1;
HEX(a)
01
11
0111
1111
011111
DROP TABLE t1;
CREATE TABLE t1 (a LONGTEXT CHARACTER SET dec8);
INSERT INTO t1 VALUES (0x1),(0x11),(0x111),(0x1111),(0x11111);
SELECT HEX(a) FROM t1;
HEX(a)
01
11
0111
1111
011111
DROP TABLE t1;
#
# Bug#5081 : UCS2 fields are filled with '0x2020'
# after extending field length
#
CREATE TABLE t1(a CHAR(1)) DEFAULT CHARSET dec8;
INSERT INTO t1 VALUES ('a'),('b'),('c');
ALTER TABLE t1 MODIFY a CHAR(5);
SELECT a, HEX(a) FROM t1;
a	HEX(a)
a	61
b	62
c	63
DROP TABLE t1;
#
# Check prepare statement from an dec8 string
#
SET NAMES latin1;
SET @ivar= 1234;
SET @str1 = 'SELECT ?';
SET @str2 = CONVERT(@str1 USING dec8);
PREPARE stmt1 FROM @str2;
EXECUTE stmt1 USING @ivar;
?
1234
#
# Check that dec8 works with ENUM and SET type
#
SET NAMES utf8, collation_connection=dec8_swedish_ci;
CREATE TABLE t1 (a ENUM('x','y','z') CHARACTER SET dec8);
SHOW CREATE TABLE t1;
Table	Create Table
t1	CREATE TABLE `t1` (
  `a` enum('x','y','z') DEFAULT NULL
) ORGANIZATION INDEX DEFAULT CHARSET = dec8 ROW_FORMAT = DYNAMIC COMPRESSION = 'zstd_1.3.8' REPLICA_NUM = 1 BLOCK_SIZE = 16384 USE_BLOOM_FILTER = FALSE ENABLE_MACRO_BLOCK_BLOOM_FILTER = FALSE TABLET_SIZE = 134217728 PCTFREE = 0
INSERT INTO t1 VALUES ('x');
INSERT INTO t1 VALUES ('y');
INSERT INTO t1 VALUES ('z');
SELECT a, HEX(a) FROM t1 ORDER BY a;
a	HEX(a)
x	78
y	79
z	7A
ALTER TABLE t1 CHANGE a a ENUM('x','y','z','d','e','ä','ö','ü') CHARACTER SET dec8;
ERROR HY000: Incorrect string value
ALTER TABLE t1 CHANGE a a ENUM('d','e','ä','ö','ü') CHARACTER SET dec8;
ERROR HY000: Incorrect string value
delete from t1;
ALTER TABLE t1 CHANGE a a ENUM('d','e','ö','ü') CHARACTER SET dec8;
SHOW CREATE TABLE t1;
Table	Create Table
t1	CREATE TABLE `t1` (
  `a` enum('d','e','Ã¶','Ã¼') DEFAULT NULL
) ORGANIZATION INDEX DEFAULT CHARSET = dec8 ROW_FORMAT = DYNAMIC COMPRESSION = 'zstd_1.3.8' REPLICA_NUM = 1 BLOCK_SIZE = 16384 USE_BLOOM_FILTER = FALSE ENABLE_MACRO_BLOCK_BLOOM_FILTER = FALSE TABLET_SIZE = 134217728 PCTFREE = 0
INSERT INTO t1 VALUES ('D');
INSERT INTO t1 VALUES ('E ');
INSERT INTO t1 VALUES ('ö');
INSERT INTO t1 VALUES ('ü');
SELECT a, HEX(a) FROM t1 ORDER BY a;
a	HEX(a)
d	64
e	65
Ã¶	C3B6
Ã¼	C3BC
DROP TABLE t1;
CREATE TABLE t1 (a set ('x','y','z','ä','ö','ü') CHARACTER SET dec8);
ERROR HY000: Incorrect string value
#
# Bug#7302 UCS2 data in ENUM fields get truncated when new column is added
#
CREATE TABLE t1(a ENUM('a','b','c')) DEFAULT CHARACTER SET dec8;
INSERT INTO t1 VALUES('a'),('b'),('c');
ALTER TABLE t1 ADD b CHAR(1);
SHOW WARNINGS;
Level	Code	Message
SELECT * FROM t1 ORDER BY a;
a	b
a	NULL
b	NULL
c	NULL
DROP TABLE t1;
SET NAMES utf8, collation_connection='dec8_swedish_ci';
create table t1 select repeat('a',4000) a;
delete from t1;
insert into t1 values ('a'), ('a '), ('a\t');
select collation(a),hex(a) from t1 order by a;
collation(a)	hex(a)
dec8_swedish_ci	6109
dec8_swedish_ci	61
dec8_swedish_ci	6120
drop table t1;
select @@collation_connection;
@@collation_connection
dec8_swedish_ci
create table t1 ROW_FORMAT=DYNAMIC select repeat('a',50) as c1 ;
insert into t1 values('abcdef');
insert into t1 values('_bcdef');
insert into t1 values('a_cdef');
insert into t1 values('ab_def');
insert into t1 values('abc_ef');
insert into t1 values('abcd_f');
insert into t1 values('abcde_');
select c1 as c1u from t1 where c1 like 'ab\_def';
c1u
ab_def
select c1 as c2h from t1 where c1 like 'ab#_def' escape '#';
c2h
ab_def
drop table t1;
SET NAMES utf8, collation_connection='dec8_bin';
create table t1 select repeat('a',4000) a;
delete from t1;
insert into t1 values ('a'), ('a '), ('a\t');
select collation(a),hex(a) from t1 order by a;
collation(a)	hex(a)
dec8_bin	6109
dec8_bin	61
dec8_bin	6120
drop table t1;
#
# Bug#10344 Some string functions fail for UCS2
#
SET NAMES utf8, collation_connection=dec8_swedish_ci;
#
# Bug#9442 Set parameter make query fail if column CHARACTER SET is UCS2
#
CREATE TABLE t1 (utext VARCHAR(20) CHARACTER SET dec8);
INSERT INTO t1 VALUES ("lily");
INSERT INTO t1 VALUES ("river");
PREPARE stmt FROM 'SELECT utext FROM t1 where utext like ?';
SET @param1='%%';
EXECUTE stmt USING @param1;
utext
lily
river
EXECUTE stmt USING @param1;
utext
lily
river
SELECT utext FROM t1 where utext like '%%';
utext
lily
river
DROP TABLE t1;
DEALLOCATE PREPARE stmt;
#
# Bug #20108: corrupted default enum value for a ucs2 field
#
CREATE TABLE t1 (
status ENUM('active','passive') CHARACTER SET dec8 COLLATE dec8_swedish_ci
NOT NULL DEFAULT 'passive'
);
SHOW CREATE TABLE t1;
Table	Create Table
t1	CREATE TABLE `t1` (
  `status` enum('active','passive') NOT NULL DEFAULT 'passive'
) ORGANIZATION INDEX DEFAULT CHARSET = dec8 ROW_FORMAT = DYNAMIC COMPRESSION = 'zstd_1.3.8' REPLICA_NUM = 1 BLOCK_SIZE = 16384 USE_BLOOM_FILTER = FALSE ENABLE_MACRO_BLOCK_BLOOM_FILTER = FALSE TABLET_SIZE = 134217728 PCTFREE = 0
ALTER TABLE t1 ADD a int NOT NULL AFTER status;
SHOW CREATE TABLE t1;
Table	Create Table
t1	CREATE TABLE `t1` (
  `status` enum('active','passive') NOT NULL DEFAULT 'passive',
  `a` int(11) NOT NULL
) ORGANIZATION INDEX DEFAULT CHARSET = dec8 ROW_FORMAT = DYNAMIC COMPRESSION = 'zstd_1.3.8' REPLICA_NUM = 1 BLOCK_SIZE = 16384 USE_BLOOM_FILTER = FALSE ENABLE_MACRO_BLOCK_BLOOM_FILTER = FALSE TABLET_SIZE = 134217728 PCTFREE = 0
DROP TABLE t1;
#
# Conversion FROM an dec8 string to a decimal column
#
CREATE TABLE t1 (a VARCHAR(64) CHARACTER SET dec8, b DECIMAL(10,3));
INSERT INTO t1 VALUES ("1.1", 0), ("2.1", 0);
UPDATE t1 set b=a;
SELECT *, HEX(a) FROM t1;
a	b	HEX(a)
1.1	1.100	312E31
2.1	2.100	322E31
DROP TABLE t1;
#
# Bug#22638 SOUNDEX broken for international characters
#
SET NAMES utf8, collation_connection=dec8_swedish_ci;
SELECT SOUNDEX(''),SOUNDEX('he'),SOUNDEX('hello all folks'),SOUNDEX('#3556 in bugdb');
SOUNDEX('')	SOUNDEX('he')	SOUNDEX('hello all folks')	SOUNDEX('#3556 in bugdb')
	H000	H4142	I51231
SELECT HEX(SOUNDEX('')),HEX(SOUNDEX('he')),HEX(SOUNDEX('hello all folks')),HEX(SOUNDEX('#3556 in bugdb'));
HEX(SOUNDEX(''))	HEX(SOUNDEX('he'))	HEX(SOUNDEX('hello all folks'))	HEX(SOUNDEX('#3556 in bugdb'))
	48303030	4834313432	493531323331
SELECT 'mood' sounds like 'mud';
'mood' sounds like 'mud'
1
# Cyrillic A, BE, VE
SELECT HEX(SOUNDEX(_dec8 0x041004110412));
HEX(SOUNDEX(_dec8 0x041004110412))

# Make sure that "U+00BF INVERTED QUESTION MARK" is not considered as letter
SELECT HEX(SOUNDEX(_dec8 0x00BF00C0));
HEX(SOUNDEX(_dec8 0x00BF00C0))

#
# Bug#14290: character_maximum_length for text fields
#
DROP TABLE t_dec8_test;
CREATE TABLE t_dec8_test(a BLOB, b TEXT CHARSET dec8);
SELECT data_type, character_octet_length, character_maximum_length
FROM information_schema.columns where table_name='t_dec8_test';
data_type	character_octet_length	character_maximum_length
blob	65535	65535
text	65535	65535
DROP TABLE t_dec8_test;
SET NAMES utf8, collation_connection=dec8_swedish_ci;
#
# Testing cs->coll->instr()
#
SELECT POSITION('bb' IN 'abba');
POSITION('bb' IN 'abba')
2
#
# Testing cs->coll->hash_sort()
#
SET NAMES utf8, collation_connection=dec8_bin;
SELECT @@collation_connection;
@@collation_connection
dec8_bin
CREATE TABLE t1 ENGINE=HEAP AS SELECT REPEAT (' ', 10) AS a LIMIT 0;
Warnings:
Warning	1286	Unknown storage engine 'HEAP'
ALTER TABLE t1 ADD KEY (a);
CREATE TABLE t2 (a VARCHAR(10));
INSERT INTO t2 VALUES ('0'),('1'),('2'),('3'),('4'),('5'),('6'),('7');
INSERT INTO t2 VALUES ('8'),('9'),('A'),('B'),('C'),('D'),('E'),('F');
INSERT INTO t1 SELECT CONCAT('a',t21.a,t22.a) FROM t2 t21, t2 t22 ORDER BY 1;
DROP TABLE t2;
INSERT INTO t1 VALUES ('a ');
SELECT a, HEX(a) FROM t1 WHERE a='a';
a	HEX(a)
a 	6120
DROP TABLE t1;
SET NAMES utf8, collation_connection=dec8_swedish_ci;
SELECT @@collation_connection;
@@collation_connection
dec8_swedish_ci
CREATE TABLE t1 ENGINE=HEAP AS SELECT REPEAT (' ', 10) AS a LIMIT 0;
Warnings:
Warning	1286	Unknown storage engine 'HEAP'
ALTER TABLE t1 ADD KEY (a);
CREATE TABLE t2 (a VARCHAR(10));
INSERT INTO t2 VALUES ('0'),('1'),('2'),('3'),('4'),('5'),('6'),('7');
INSERT INTO t2 VALUES ('8'),('9'),('A'),('B'),('C'),('D'),('E'),('F');
INSERT INTO t1 SELECT CONCAT('a',t21.a,t22.a) FROM t2 t21, t2 t22 ORDER BY 1;
DROP TABLE t2;
INSERT INTO t1 VALUES ('a ');
SELECT a, HEX(a) FROM t1 WHERE a='a';
a	HEX(a)
a 	6120
DROP TABLE t1;
#
# Testing cs->cset->numchars()
#
SELECT CHAR_LENGTH('abcd'), OCTET_LENGTH('abcd');
CHAR_LENGTH('abcd')	OCTET_LENGTH('abcd')
4	4
SELECT CHAR_LENGTH(_dec8 0x00D800DC), OCTET_LENGTH(_dec8 0x00D800DC);
CHAR_LENGTH(_dec8 0x00D800DC)	OCTET_LENGTH(_dec8 0x00D800DC)
4	4
SELECT CHAR_LENGTH(_dec8 0x7DD8FFDF), OCTET_LENGTH(_dec8 0x7FD8DDDF);
CHAR_LENGTH(_dec8 0x7DD8FFDF)	OCTET_LENGTH(_dec8 0x7FD8DDDF)
4	4
#
# Testing cs->cset->charpos()
#
SELECT LEFT('abcd',2);
LEFT('abcd',2)
ab
SELECT HEX(LEFT(_dec8 0x00D800DC7FD8FFDF, 1));
HEX(LEFT(_dec8 0x00D800DC7FD8FFDF, 1))
00
SELECT HEX(RIGHT(_dec8 0x00D800DC7FD8FFDF, 1));
HEX(RIGHT(_dec8 0x00D800DC7FD8FFDF, 1))
DF
#
# Testing cs->cset->well_formed_length()
#
DROP TABLE t1;
CREATE TABLE t1 (a VARCHAR(10) CHARACTER SET dec8);
# Bad sequences
INSERT INTO t1 VALUES (_dec8 0x00D8);
INSERT INTO t1 VALUES (_dec8 0x00DC);
INSERT INTO t1 VALUES (_dec8 0x00D800D8);
INSERT INTO t1 VALUES (_dec8 0x00D800E8);
INSERT INTO t1 VALUES (_dec8 0x00D80008);
INSERT INTO t1 VALUES (_dec8 0x00D800DC);
INSERT INTO t1 VALUES (_dec8 0x00D8FFDC);
INSERT INTO t1 VALUES (_dec8 0xFFDB00DC);
INSERT INTO t1 VALUES (_dec8 0xFFDBFFDC);
SELECT HEX(a) FROM t1;
HEX(a)
00D8
00DC
00D800D8
00D800E8
00D80008
00D800DC
00D8FFDC
FFDB00DC
FFDBFFDC
DROP TABLE t1;
#
# Bug#32393 Character sets: illegal characters in dec8 columns
#
# Tests that cs->cset->wc_mb() doesn't accept surrogate parts
#
# via ALTER
#
SET sql_mode = '';
CREATE TABLE t1 (s1 VARCHAR(50) CHARACTER SET dec8);
INSERT INTO t1 VALUES (0xDF84);
ALTER TABLE t1 MODIFY column s1 VARCHAR(50) CHARACTER SET dec8;
SELECT HEX(s1) FROM t1;
HEX(s1)
DF84
DROP TABLE t1;
#
# via UPDATE
#
CREATE TABLE t1 (s1 VARCHAR(5) CHARACTER SET dec8, s2 VARCHAR(5) CHARACTER SET dec8);
INSERT INTO t1 (s1) VALUES (0xdf84);
UPDATE t1 set s2 = s1;
SELECT HEX(s2) FROM t1;
HEX(s2)
DF84
DROP TABLE t1;
SET sql_mode = default;
#
# Testing cs->cset->lengthsp()
#
CREATE TABLE t1 (a CHAR(10)) CHARACTER SET dec8;
INSERT INTO t1 VALUES ('a   ');
SELECT HEX(a) FROM t1;
HEX(a)
61
DROP TABLE t1;
#
# Testing cs->cset->caseup() and cs->cset->casedn()
#
SELECT UPPER('abcd'), LOWER('ABCD');
UPPER('abcd')	LOWER('ABCD')
ABCD	abcd
#
# Checking str_to_datetime()
#
select @@collation_connection;
@@collation_connection
dec8_swedish_ci
CREATE TABLE t1 (a date);
INSERT INTO t1 VALUES ('2007-09-16');
SELECT * FROM t1;
a
2007-09-16
DROP TABLE t1;
#
# Testing cs->cset->ll10tostr
#
CREATE TABLE t1 (a VARCHAR(10) CHARACTER SET dec8);
INSERT INTO t1 VALUES (123456);
SELECT a, HEX(a) FROM t1;
a	HEX(a)
123456	313233343536
DROP TABLE t1;
#
# Testing cs->cset->fill
# SOUNDEX fills strings with DIGIT ZERO up to four characters
#
SELECT SOUNDEX('a'), HEX(SOUNDEX('a'));
SOUNDEX('a')	HEX(SOUNDEX('a'))
A000	41303030
#
# Testing cs->cset->strntoul
#
CREATE TABLE t1 (a enum ('a','b','c')) CHARACTER SET dec8;
INSERT INTO t1 VALUES ('1');
INSERT INTO t1 VALUES ('2');
INSERT INTO t1 VALUES ('3');
INSERT INTO t1 VALUES ('0');
INSERT INTO t1 VALUES ('a');
SELECT * FROM t1;
a
a
b
c

a
DROP TABLE t1;
#
# Testing cs->cset->strntoll and cs->cset->strntoull
#
SET NAMES latin1;
SELECT HEX(CONV(CONVERT('123' USING dec8), -10, 16));
HEX(CONV(CONVERT('123' USING dec8), -10, 16))
3742
SELECT HEX(CONV(CONVERT('123' USING dec8), 10, 16));
HEX(CONV(CONVERT('123' USING dec8), 10, 16))
3742
SET NAMES utf8, collation_connection=dec8_swedish_ci;
#
# Testing cs->cset->strntod
#
SET NAMES utf8, collation_connection=dec8_swedish_ci;
SELECT 1.1 + '1.2';
1.1 + '1.2'
2.3
SELECT 1.1 + '1.2xxx';
1.1 + '1.2xxx'
2.3
Warnings:
Warning	1292	Truncated incorrect DOUBLE value: '1.2xxx'
#
# Testing cs->cset->strtoll10
#
SELECT LEFT('aaa','1');
LEFT('aaa','1')
a
CREATE TABLE t1 AS SELECT REPEAT('abcd', 128) AS a;
SELECT LEFT(a, '2') FROM t1;
LEFT(a, '2')
ab
SELECT LEFT(a, ' \t \t 2') FROM t1;
LEFT(a, ' \t \t 2')
ab
SELECT LEFT(a, ' \t \t +2') FROM t1;
LEFT(a, ' \t \t +2')
ab
SELECT SUBSTR(a, '-2') FROM t1;
SUBSTR(a, '-2')
cd
SELECT SUBSTR(a, ' \t \t -2') FROM t1;
SUBSTR(a, ' \t \t -2')
cd
SELECT LEFT(a, '00002') FROM t1;
LEFT(a, '00002')
ab
SELECT LEFT(a, ' \t \t 00002') FROM t1;
LEFT(a, ' \t \t 00002')
ab
SELECT LEFT(a, ' \t \t +00002') FROM t1;
LEFT(a, ' \t \t +00002')
ab
SELECT SUBSTR(a, '-00002') FROM t1;
SUBSTR(a, '-00002')
cd
SELECT SUBSTR(a, ' \t \t -00002') FROM t1;
SUBSTR(a, ' \t \t -00002')
cd
set sql_mode = '';
DROP TABLE t1;
CREATE TABLE t1 AS SELECT REPEAT('abcd', 128) AS a LIMIT 0;
INSERT INTO t1 VALUES ('255'), ('65535'),('16777215'),('4294967295'),
('1099511627775'),('281474976710655'),('72057594037927935'),
('1844674407370955161'),('18446744073709551614'), ('18446744073709551615');
SELECT a, CAST(a AS SIGNED), CAST(a AS UNSIGNED) FROM t1;
a	CAST(a AS SIGNED)	CAST(a AS UNSIGNED)
255	255	255
65535	65535	65535
16777215	16777215	16777215
4294967295	4294967295	4294967295
1099511627775	1099511627775	1099511627775
281474976710655	281474976710655	281474976710655
72057594037927935	72057594037927935	72057594037927935
1844674407370955161	1844674407370955161	1844674407370955161
18446744073709551614	9223372036854775807	18446744073709551614
18446744073709551615	9223372036854775807	18446744073709551615
UPDATE t1 SET a=CONCAT('-', a);
SELECT a, CAST(a AS SIGNED) FROM t1;
a	CAST(a AS SIGNED)
-255	-255
-65535	-65535
-16777215	-16777215
-4294967295	-4294967295
-1099511627775	-1099511627775
-281474976710655	-281474976710655
-72057594037927935	-72057594037927935
-1844674407370955161	-1844674407370955161
-18446744073709551614	-9223372036854775808
-18446744073709551615	-9223372036854775808
DROP TABLE t1;
#
# Testing cs->cset->strntoull10rnd
#
CREATE TABLE t1 (a int);
INSERT INTO t1 VALUES ('-1234.1e2');
INSERT IGNORE INTO t1 VALUES ('-1234.1e2xxxx');
INSERT INTO t1 VALUES ('-1234.1e2    ');
INSERT INTO t1 VALUES ('123');
INSERT INTO t1 VALUES ('-124');
INSERT INTO t1 VALUES ('+125');
INSERT INTO t1 VALUES (' \t \t 123');
INSERT INTO t1 VALUES (' \t \t -124');
INSERT INTO t1 VALUES (' \t \t +125');
INSERT INTO t1 VALUES (' \t \t 000123');
INSERT INTO t1 VALUES (' \t \t -000124');
INSERT INTO t1 VALUES (' \t \t +000125');
SELECT * FROM t1;
a
-123410
-123410
-123410
123
-124
125
123
-124
125
123
-124
125
DROP TABLE t1;
CREATE TABLE t1 (a BIGINT UNSIGNED);
INSERT INTO t1 VALUES ('255'), ('65535'),('16777215'),('4294967295'),
('1099511627775'),('281474976710655'),('72057594037927935'),
('1844674407370955161'),('18446744073709551614'), ('18446744073709551615');
SELECT * FROM t1;
a
255
65535
16777215
4294967295
1099511627775
281474976710655
72057594037927935
1844674407370955161
18446744073709551614
18446744073709551615
DROP TABLE t1;
#
# Testing cs->cset->scan
#
CREATE TABLE t1 (a int);
INSERT INTO t1 VALUES ('1 ');
INSERT IGNORE INTO t1 VALUES ('1 x');
SELECT * FROM t1;
a
1
1
DROP TABLE t1;
#
# Testing auto-conversion to TEXT
#
SET sql_mode = '';
CREATE TABLE t1 (a VARCHAR(17000) CHARACTER SET dec8);
SHOW CREATE TABLE t1;
Table	Create Table
t1	CREATE TABLE `t1` (
  `a` varchar(17000) DEFAULT NULL
) ORGANIZATION INDEX DEFAULT CHARSET = dec8 ROW_FORMAT = DYNAMIC COMPRESSION = 'zstd_1.3.8' REPLICA_NUM = 1 BLOCK_SIZE = 16384 USE_BLOOM_FILTER = FALSE ENABLE_MACRO_BLOCK_BLOOM_FILTER = FALSE TABLET_SIZE = 134217728 PCTFREE = 0
DROP TABLE t1;
SET sql_mode = default;
#
# Testing that maximim possible key length is 767 bytes for InnoDB
#
CREATE TABLE t1 (a VARCHAR(150) CHARACTER SET dec8 PRIMARY KEY);
SHOW CREATE TABLE t1;
Table	Create Table
t1	CREATE TABLE `t1` (
  `a` varchar(150) NOT NULL,
  PRIMARY KEY (`a`)
) ORGANIZATION INDEX DEFAULT CHARSET = dec8 ROW_FORMAT = DYNAMIC COMPRESSION = 'zstd_1.3.8' REPLICA_NUM = 1 BLOCK_SIZE = 16384 USE_BLOOM_FILTER = FALSE ENABLE_MACRO_BLOCK_BLOOM_FILTER = FALSE TABLET_SIZE = 134217728 PCTFREE = 0
DROP TABLE t1;
CREATE TABLE t1 (a VARCHAR(334) CHARACTER SET dec8 PRIMARY KEY) ROW_FORMAT=COMPACT;
#
# Conversion to utf8
#
DROP TABLE t1;
CREATE TABLE t1 (a CHAR(100) CHARACTER SET dec8);
INSERT INTO t1 VALUES (0x00D800DC),(0x00D8FFDC),(0x7FDB00DC),(0x7FDBFFDC);
DROP TABLE t1;
#
# Test basic regex functionality
#
SET NAMES utf8, collation_connection=dec8_swedish_ci;
drop table if exists t1;
create table t1 as
select repeat(' ', 64) as s1, repeat(' ',64) as s2
union
select null, null;
show create table t1;
Table	Create Table
t1	CREATE TABLE `t1` (
  `s1` varchar(512) DEFAULT NULL,
  `s2` varchar(512) DEFAULT NULL
) ORGANIZATION INDEX DEFAULT CHARSET = dec8 ROW_FORMAT = DYNAMIC COMPRESSION = 'zstd_1.3.8' REPLICA_NUM = 1 BLOCK_SIZE = 16384 USE_BLOOM_FILTER = FALSE ENABLE_MACRO_BLOCK_BLOOM_FILTER = FALSE TABLET_SIZE = 134217728 PCTFREE = 0
delete from t1;
insert into t1 values('aaa','aaa');
insert into t1 values('aaa|qqq','qqq');
insert into t1 values('gheis','^[^a-dXYZ]+$');
insert into t1 values('aab','^aa?b');
insert into t1 values('Baaan','^Ba*n');
insert into t1 values('aaa','qqq|aaa');
insert into t1 values('qqq','qqq|aaa');
insert into t1 values('bbb','qqq|aaa');
insert into t1 values('bbb','qqq');
insert into t1 values('aaa','aba');
insert into t1 values(null,'abc');
insert into t1 values('def',null);
insert into t1 values(null,null);
select HIGH_PRIORITY s1 regexp s2 from t1;
s1 regexp s2
1
1
1
1
1
1
1
0
0
0
NULL
NULL
NULL
SELECT 'ghi' REGEXP 'ghi[';
Got one of the listed errors
drop table t1;
#
# Test how CHARACTER SET works with date/time
#
CREATE TABLE t1 AS SELECT repeat('a',20) AS s1 LIMIT 0;
SET timestamp=1216359724;
INSERT INTO t1 VALUES (current_date);
INSERT INTO t1 VALUES (current_time);
INSERT INTO t1 VALUES (current_timestamp);
SELECT s1, hex(s1) FROM t1;
DROP TABLE t1;
SET timestamp=0;
#
# Bug#33073 Character sets: ordering fails with utf32
#
SET NAMES utf8, collation_connection=dec8_swedish_ci;
CREATE TABLE t1 AS SELECT REPEAT('a',2) as s1 LIMIT 0;
SHOW CREATE TABLE t1;
Table	Create Table
t1	CREATE TABLE `t1` (
  `s1` varchar(512) DEFAULT NULL
) ORGANIZATION INDEX DEFAULT CHARSET = dec8 ROW_FORMAT = DYNAMIC COMPRESSION = 'zstd_1.3.8' REPLICA_NUM = 1 BLOCK_SIZE = 16384 USE_BLOOM_FILTER = FALSE ENABLE_MACRO_BLOCK_BLOOM_FILTER = FALSE TABLET_SIZE = 134217728 PCTFREE = 0
INSERT INTO t1 VALUES ('ab'),('AE'),('ab'),('AE');
SELECT * FROM t1 ORDER BY s1;
s1
ab
ab
AE
AE
SET max_sort_length=4;
Warnings:
Warning	1235	This system variable now is mock not supported
SELECT * FROM t1 ORDER BY s1;
s1
ab
ab
AE
AE
DROP TABLE t1;
SET max_sort_length=DEFAULT;
Warnings:
Warning	1235	This system variable now is mock not supported
#
# Bug#52520 Difference in tinytext utf column metadata
#
CREATE TABLE t1 (
s1 TINYTEXT CHARACTER SET dec8,
s2 TEXT CHARACTER SET dec8,
s3 MEDIUMTEXT CHARACTER SET dec8,
s4 LONGTEXT CHARACTER SET dec8
);
SET NAMES utf8, @@character_set_results=NULL;
SELECT *, HEX(s1) FROM t1;
Catalog	Database	Table	Table_alias	Column	Column_alias	Type	Length	Max length	Is_null	Flags	Decimals	Charsetnr
def	db1	t1	t1	s1	s1	252	255	0	Y	16	0	3
def	db1	t1	t1	s2	s2	252	65535	0	Y	16	0	3
def	db1	t1	t1	s3	s3	252	16777215	0	Y	16	0	3
def	db1	t1	t1	s4	s4	252	4294967295	0	Y	16	0	3
def					HEX(s1)	252	65535	0	Y	16	0	45
s1	s2	s3	s4	HEX(s1)
SET NAMES latin1;
SELECT *, HEX(s1) FROM t1;
Catalog	Database	Table	Table_alias	Column	Column_alias	Type	Length	Max length	Is_null	Flags	Decimals	Charsetnr
def	db1	t1	t1	s1	s1	252	255	0	Y	16	0	8
def	db1	t1	t1	s2	s2	252	65535	0	Y	16	0	8
def	db1	t1	t1	s3	s3	252	16777215	0	Y	16	0	8
def	db1	t1	t1	s4	s4	252	4294967295	0	Y	16	0	8
def					HEX(s1)	252	65535	0	Y	16	0	8
s1	s2	s3	s4	HEX(s1)
SET NAMES utf8;
SELECT *, HEX(s1) FROM t1;
Catalog	Database	Table	Table_alias	Column	Column_alias	Type	Length	Max length	Is_null	Flags	Decimals	Charsetnr
def	db1	t1	t1	s1	s1	252	255	0	Y	16	0	45
def	db1	t1	t1	s2	s2	252	65535	0	Y	16	0	45
def	db1	t1	t1	s3	s3	252	16777215	0	Y	16	0	45
def	db1	t1	t1	s4	s4	252	4294967295	0	Y	16	0	45
def					HEX(s1)	252	65535	0	Y	16	0	45
s1	s2	s3	s4	HEX(s1)
CREATE TABLE t2 AS SELECT CONCAT(s1) FROM t1;
SHOW CREATE TABLE t2;
Table	Create Table
t2	CREATE TABLE `t2` (
  `CONCAT(s1)` varchar(255) DEFAULT NULL
) ORGANIZATION INDEX DEFAULT CHARSET = dec8 ROW_FORMAT = DYNAMIC COMPRESSION = 'zstd_1.3.8' REPLICA_NUM = 1 BLOCK_SIZE = 16384 USE_BLOOM_FILTER = FALSE ENABLE_MACRO_BLOCK_BLOOM_FILTER = FALSE TABLET_SIZE = 134217728 PCTFREE = 0
DROP TABLE t1, t2;
#
# Problem found by Roy during review
# MY_CS_BINSORT was not set for dec8_bin,
# so filesort did not work well
# 
SET NAMES utf8, @@collation_connection=dec8_bin;
CREATE TABLE t1 AS SELECT REPEAT(' ', 10) as c LIMIT 0;
ALTER TABLE t1 ADD PRIMARY KEY(c);
SHOW CREATE TABLE t1;
Table	Create Table
t1	CREATE TABLE `t1` (
  `c` varchar(512) CHARACTER SET dec8 COLLATE dec8_bin NOT NULL,
  PRIMARY KEY (`c`)
) ORGANIZATION INDEX DEFAULT CHARSET = dec8 ROW_FORMAT = DYNAMIC COMPRESSION = 'zstd_1.3.8' REPLICA_NUM = 1 BLOCK_SIZE = 16384 USE_BLOOM_FILTER = FALSE ENABLE_MACRO_BLOCK_BLOOM_FILTER = FALSE TABLET_SIZE = 134217728 PCTFREE = 0
INSERT INTO t1 VALUES ('abc'),('zyx'),('acb');
SELECT UPPER(c) FROM t1 ORDER BY 1 DESC;
UPPER(c)
ZYX
ACB
ABC
DROP TABLE t1;
#
# WL#3664 WEIGHT_STRING
#
SET NAMES utf8, collation_connection=dec8_swedish_ci;
select @@collation_connection;
@@collation_connection
dec8_swedish_ci
select hex(weight_string('a'));
hex(weight_string('a'))
41
select hex(weight_string('A'));
hex(weight_string('A'))
41
select hex(weight_string('abc'));
hex(weight_string('abc'))
414243
select hex(weight_string('abc' as char(2)));
hex(weight_string('abc' as char(2)))
4142
select hex(weight_string('abc' as char(3)));
hex(weight_string('abc' as char(3)))
414243
select hex(weight_string('abc' as char(5)));
hex(weight_string('abc' as char(5)))
4142432020
SELECT HEX(WEIGHT_STRING(_dec8 0x00D800DC));
HEX(WEIGHT_STRING(_dec8 0x00D800DC))
00D80059
SELECT HEX(WEIGHT_STRING(_dec8 0x00D801DC));
HEX(WEIGHT_STRING(_dec8 0x00D801DC))
00D80159
SET NAMES utf8, collation_connection=dec8_bin;
select @@collation_connection;
@@collation_connection
dec8_bin
select hex(weight_string('a'));
hex(weight_string('a'))
61
select hex(weight_string('A'));
hex(weight_string('A'))
41
select hex(weight_string('abc'));
hex(weight_string('abc'))
616263
select hex(weight_string('abc' as char(2)));
hex(weight_string('abc' as char(2)))
6162
select hex(weight_string('abc' as char(3)));
hex(weight_string('abc' as char(3)))
616263
select hex(weight_string('abc' as char(5)));
hex(weight_string('abc' as char(5)))
6162632020
#
# End of 5.6 tests
#
purge recyclebin;
