drop database  IF EXISTS  db1;
create database db1;
use db1;
SET wait_timeout=30000000;
SET ob_trx_timeout = 30000000;
SET ob_query_timeout = 30000000;
##设置相同sql_mode;
SET @@sql_mode='';
##基表为普通表指定主键
CREATE TABLE t1 (c1 number , c2 varchar(100)) ;
create materialized view log on t1 with rowid, sequence (c1,c2) including new values ;
create materialized view mv1(primary key(c2)) refresh fast on demand as select c2 as c2 ,count(*) as cnt from t1 group by c2;
insert into t1(c2) values('{"name": "John Doe", "age": 999}');
insert into t1(c1,c2) values(1,'"age": 999}');
update t1 set c2 = 'ssa' where c1 is null;
delete from t1 where c2 ='ssa';
show index from mv1;
Table	Non_unique	Key_name	Seq_in_index	Column_name	Collation	Cardinality	Sub_part	Packed	Null	Index_type	Comment	Index_comment	Visible	Expression
mv1	0	PRIMARY	1	c2	A	NULL	NULL	NULL		BTREE	available		YES	NULL
desc mv1;
Field	Type	Null	Key	Default	Extra
c2	varchar(100)	NO	PRI	NULL	
cnt	bigint(20)	YES		NULL	
CALL DBMS_MVIEW.REFRESH('mv1','f');
select * from mv1;
c2	cnt
"age": 999}	1
show create table mv1;
View	Create View	character_set_client	collation_connection
mv1	CREATE MATERIALIZED VIEW `mv1` (PRIMARY KEY (c2)) DEFAULT CHARSET = utf8mb4 ROW_FORMAT = DYNAMIC COMPRESSION = 'zstd_1.3.8' REPLICA_NUM = 1 BLOCK_SIZE = 16384 USE_BLOOM_FILTER = FALSE ENABLE_MACRO_BLOCK_BLOOM_FILTER = FALSE TABLET_SIZE = 134217728 PCTFREE = 10 REFRESH FAST ON DEMAND  AS select `db1`.`t1`.`c2` AS `c2`,count(*) AS `cnt` from `db1`.`t1` group by `db1`.`t1`.`c2`	utf8mb4	utf8mb4_general_ci
##基表为分区表指定主键
DROP MATERIALIZED VIEW LOG ON  t1;
drop table t1;
drop materialized view mv1;
CREATE TABLE t1 (c1 int , c2 varchar(100)) PARTITION BY HASH(c1) PARTITIONS 8;
create materialized view log on t1 with rowid, sequence (c1,c2) including new values ;
create materialized view mv1(primary key(c2)) refresh fast on demand as select c2 as c2 ,count(*) as cnt from t1 group by c2;
insert into t1(c2) values('{"name": "John Doe", "age": 999}');
insert into t1(c1,c2) values(1,'"age": 999}');
update t1 set c2 = 'ssa' where c1 is null;
delete from t1 where c2 ='ssa';
show index from mv1;
Table	Non_unique	Key_name	Seq_in_index	Column_name	Collation	Cardinality	Sub_part	Packed	Null	Index_type	Comment	Index_comment	Visible	Expression
mv1	0	PRIMARY	1	c2	A	NULL	NULL	NULL		BTREE	available		YES	NULL
desc mv1;
Field	Type	Null	Key	Default	Extra
c2	varchar(100)	NO	PRI	NULL	
cnt	bigint(20)	YES		NULL	
CALL DBMS_MVIEW.REFRESH('mv1','f');
select * from mv1;
c2	cnt
"age": 999}	1
show create table mv1;
View	Create View	character_set_client	collation_connection
mv1	CREATE MATERIALIZED VIEW `mv1` (PRIMARY KEY (c2)) DEFAULT CHARSET = utf8mb4 ROW_FORMAT = DYNAMIC COMPRESSION = 'zstd_1.3.8' REPLICA_NUM = 1 BLOCK_SIZE = 16384 USE_BLOOM_FILTER = FALSE ENABLE_MACRO_BLOCK_BLOOM_FILTER = FALSE TABLET_SIZE = 134217728 PCTFREE = 10 REFRESH FAST ON DEMAND  AS select `db1`.`t1`.`c2` AS `c2`,count(*) AS `cnt` from `db1`.`t1` group by `db1`.`t1`.`c2`	utf8mb4	utf8mb4_general_ci
##基表为视图指定主键
DROP MATERIALIZED VIEW LOG ON  t1;
drop table t1;
drop materialized view mv1;
CREATE TABLE t1 (c1 int primary key, c2 varchar(100)) PARTITION BY HASH(c1) PARTITIONS 8;
create view v1 as select * from t1;
create materialized view log on t1 with rowid, sequence (c2) including new values ;
create materialized view mv1(primary key(c2))  refresh fast on demand as select c2 as c2 ,count(*) as cnt from v1 group by c2;
ERROR HY000: cannot fast refresh materialized view mv1: query has invalid table type(GENERATED_TABLE). only basic table and materialized view are supported
insert into t1(c1,c2) values(1,'"age": 999}');
update t1 set c2 = 'ssa' where c1 is null;
delete from t1 where c2 ='ssa';
##两表连接
DROP MATERIALIZED VIEW LOG ON  t1;
drop table t1;
CREATE TABLE t1 (c1 number , c2 varchar(100) primary key, check(c2 <> c1)) ;
create materialized view log on t1 with rowid, sequence (c1) including new values ;
create materialized view mv1(primary key(ac2,bc2)) refresh fast on demand  enable on query computation  as select a.c2 as ac2, b.c2 as bc2  from t1 a ,t1 b ;
insert into t1(c1,c2) values(1,'11');
update t1 set c2 = '2' where c1 =1;
delete from t1 where c2 ='ssa';
select * from mv1;
ac2	bc2
2	2
DROP MATERIALIZED VIEW LOG ON  t1;
drop table t1;
drop materialized view mv1;
CREATE TABLE t1 (c1 number , c2 varchar(100) primary key, check(c2 <> c1)) ;
create materialized view log on t1 with rowid, sequence (c1) including new values ;
create materialized view mv1(primary key(c2,cnt)) refresh fast on demand   as select c2 as c2 ,count(*) as cnt from t1 group by c2;
insert into t1(c1,c2) values(1,'11');
update t1 set c2 = '2' where c1 =1;
delete from t1 where c2 ='ssa';
CALL DBMS_MVIEW.REFRESH('mv1','f');
select * from mv1 order by c2;
c2	cnt
2	1
DROP MATERIALIZED VIEW LOG ON t1;
DROP TABLE t1;
drop materialized view mv1;
create table t1 (c1 number(10) primary key,c2 number(10), c3 number, c4 number);
create table t2 (a1 number(10) primary key,a2 number(10), a3 number, a4 number);
create materialized view log on t1 parallel 2 with primary key, rowid, sequence (c2,c3,c4) including new values;
create materialized view log on t2 parallel 2 with primary key, rowid, sequence (a2,a3,a4) including new values;
create materialized view mv1(primary key(c1))  parallel 2 refresh fast on demand  as select c1 as c1,a1 as a1 from t1,t2 where t1.c1 = t2.a1 ;
insert into t1 values(1,2,3,4);
insert into t2 values(1,1,3,4);
CALL DBMS_MVIEW.REFRESH('mv1','f');
select * from mv1;
c1	a1
1	1
##rtmv join 增量mv
DROP MATERIALIZED VIEW LOG ON  t1;
drop table t1;
drop materialized view mv1;
create table t1 (c1 int primary key, c2 int) ;
create materialized view log on t1 with PRIMARY KEY,rowid, sequence (c2) including new values;
create materialized view mv1(c1,c2) refresh fast on demand as select count(*) as cnt,c1 as c1 from t1 group by c1;
create materialized view mv2(c1,c2) refresh fast on demand enable on query computation as select count(*) as cnt,c1 as c1 from t1 group by c1;
insert into t1 values(1,1);
insert into t1 values(2,2);
insert into t1 values(3,3);
insert into t1 values(5,3);
CALL DBMS_MVIEW.REFRESH('mv1','f');
select * from mv1 order by c2;
c1	c2
1	1
1	2
1	3
1	5
select * from mv1 a ,mv2 b where a.c2=b.c2 order by a.c2,b.c2;
c1	c2	c1	c2
1	1	1	1
1	2	1	2
1	3	1	3
1	5	1	5
##都存在主键rtmv join 增量mv
DROP MATERIALIZED VIEW LOG ON  t1;
drop table t1;
drop materialized view mv1;
drop materialized view mv2;
create table t1 (c1 int primary key, c2 int) ;
create materialized view log on t1 with PRIMARY KEY,rowid, sequence (c2) including new values;
create materialized view mv1(primary key(cnt,c1)) refresh fast on demand as select count(*) as cnt,c1 as c1 from t1 group by c1;
create materialized view mv2(primary key(cnt,c1)) refresh fast on demand enable on query computation as select count(*) as cnt,c1 as c1 from t1 group by c1;
insert into t1 values(1,1);
insert into t1 values(2,2);
insert into t1 values(3,3);
insert into t1 values(5,3);
CALL DBMS_MVIEW.REFRESH('mv1','f');
select * from mv1 order by c1;
cnt	c1
1	1
1	2
1	3
1	5
select count(*) from mv1 a ,mv2 b ;
count(*)
16
##指定rtmv主键后与基表join
DROP MATERIALIZED VIEW LOG ON  t1;
drop table t1;
drop materialized view mv1;
CREATE TABLE t1 (c1 number , c2 varchar(100) primary key) ;
create materialized view log on t1 with rowid, sequence (c1) including new values ;
create materialized view mv1 refresh fast on demand  enable on query computation as select c2 as c2 ,count(*) as cnt from t1 group by c2;
insert into t1(c1,c2) values(1,'11');
select * from t1,mv1;
c1	c2	c2	cnt
1	11	11	1
##不同数据类型
DROP MATERIALIZED VIEW LOG ON t1;
drop table t1;
drop materialized view mv1;
CREATE TABLE t1 (
c1 INT PRIMARY KEY,
c2 INT,
c3 FLOAT,
c4 DECIMAL(10, 2),
c5 CHAR(10),
c6 VARCHAR(50),
c7 DATE
);
INSERT INTO t1  VALUES (1, 100, 123.456, 789.01, 'Text1    ', 'Sample text', '2023-04-01');
INSERT INTO t1  VALUES (2, 200, 654.321, 210.98, 'Text2    ', 'Another sample', '2023-04-02');
create materialized view log on t1 parallel 9 with PRIMARY KEY,rowid,sequence(c2,c3,c4,c6,c7) including new values ;
create materialized view mv1(primary key(sum_c))  parallel 9 refresh fast on demand enable on query  computation as select sum(c2 * c3) sum_c, count(c2 * c3) count, count(*) as c, c6 from t1 group by c6;
select * from mv1 order by c6;
sum_c	count	c	c6
130864.19677734375	1	1	Another sample
12345.600128173828	1	1	Sample text
##指定常量作为主键
DROP MATERIALIZED VIEW LOG ON t1;
drop table t1;
drop materialized view mv1;
create table t1(c1 number primary key, c2 int, c3 number, c4 number);
create materialized view log on t1 parallel 9 with primary key,rowid, sequence (c2,c3,c4) including new values ;
create materialized view mv1(primary key(a)) refresh fast on demand enable on query  computation as select c2 as c2,count(*) cnt,10 as a  from t1 group by c2;
insert into t1 values(1,3,4,5);
insert into t1 values(2,3,4,5);
select * from mv1;
c2	cnt	a
3	2	10
##使用运算符
DROP MATERIALIZED VIEW LOG ON t1;
drop table t1;
drop materialized view mv1;
create table t1(c1 number primary key, c2 number, c3 number, c4 number);
insert into t1 values(1,3,4,5);
insert into t1 values(2,0,4,5);
insert into t1 values(3,100,4,5);
create materialized view log on t1 parallel 9 with primary key,rowid, sequence (c2,c3,c4) including new values ;
create materialized view mv1(primary key(c2,cnt,a)) refresh fast on demand enable on query  computation as select c2 as c2,count(*) cnt, c2*2+3/1-1+c2  as a  from t1 group by c2;
delete from t1 where c2 >0;
select * from mv1 where c2 in (null,0,1,2,3,4,5);
c2	cnt	a
0	1	2.0000
select * from mv1 a ,t1 b;
c2	cnt	a	c1	c2	c3	c4
0	1	2.0000	2	0	4	5
##多主键进行运算
DROP MATERIALIZED VIEW LOG ON t1;
drop table t1;
drop materialized view mv1;
create table t1(c1 number primary key, c2 number, c3 number, c4 number);
insert into t1 values(1,3,4,5);
insert into t1 values(2,0,2,5);
insert into t1 values(3,100,4,5);
create materialized view log on t1 parallel 9 with primary key,rowid, sequence (c2,c3,c4) including new values ;
create materialized view mv1(primary key(c3,cnt,sum_cc,count_cc)) refresh fast on demand  as select c3 as c3,count(*) cnt, sum(c1*c2) sum_cc,count(c1*c2) count_cc  from t1 group by c3;
insert into t1 values(0,null,4,5);
update t1 set c1=9,c2=9 where c2 is null;
delete from t1 where c2 >=100;
CALL DBMS_MVIEW.REFRESH('mv1','f');
select * from t1 order by c1;
c1	c2	c3	c4
1	3	4	5
2	0	2	5
9	9	4	5
select * from mv1 order by c3;
c3	cnt	sum_cc	count_cc
2	1	0	1
4	2	84	2
select * from mlog$_t1;
c1	c2	c3	c4	SEQUENCE$$	DMLTYPE$$	OLD_NEW$$
##指定sum列主键
DROP MATERIALIZED VIEW LOG ON t1;
drop table t1;
drop materialized view mv1;
create table t1(c1 number primary key, c2 varchar(10), c3 varchar(10), c4 number);
insert into t1 values(1,3,4,5);
insert into t1 values(2,0,2,5);
insert into t1 values(3,100,4,5);
create materialized view log on t1 parallel 9 with primary key,rowid, sequence (c2,c3,c4) including new values ;
create materialized view mv1(primary key(sum_cc)) refresh fast on demand  as select c2 as c2,count(*) cnt, sum(c1*c4) sum_cc,count(c1*c4) count_cc  from t1 group by c2;
insert into t1 values(0,2,4,5);
update t1 set c1=9,c2=9 where c2 =2;
delete from t1 where c2 >=100;
CALL DBMS_MVIEW.REFRESH('mv1','f');
ERROR 23000: Column 'sum_cc' cannot be null
select * from t1 order by c1;
c1	c2	c3	c4
1	3	4	5
2	0	2	5
9	9	4	5
select * from mv1 order by sum_cc;
c2	cnt	sum_cc	count_cc
3	1	5	1
0	1	10	1
100	1	15	1
##修改主键列
DROP MATERIALIZED VIEW LOG ON t1;
drop table t1;
drop materialized view mv1;
create table t1(c1 varchar(10) primary key, c2 varchar(10), c3 varchar(10), c4 number);
insert into t1 values(1,3,4,5);
insert into t1 values(2,0,2,5);
insert into t1 values(3,100,4,5);
create materialized view log on t1 parallel 9 with primary key,rowid, sequence (c2,c3,c4) including new values ;
create materialized view mv1(primary key(c2)) refresh fast on demand  as select c2 as c2,count(*) cnt, sum(c1*c4) sum_cc,count(c1*c4) count_cc  from t1 group by c2;
update t1 set c2='蘩騠字' where c1 not in (1,3,4) ;
select * from mlog$_t1 order by c2;
c1	c2	c3	c4	SEQUENCE$$	DMLTYPE$$	OLD_NEW$$
2	0	2	5	1	U	O
2	蘩騠字	2	5	2	U	N
CALL DBMS_MVIEW.REFRESH('mv1','f');
select * from t1 order by c1;
c1	c2	c3	c4
1	3	4	5
2	蘩騠字	2	5
3	100	4	5
select * from mv1 order by sum_cc;
c2	cnt	sum_cc	count_cc
3	1	5	1
蘩騠字	1	10	1
100	1	15	1
##枚举类型指定主键hang
DROP MATERIALIZED VIEW LOG ON t1;
drop table t1;
drop  materialized view mv1;
create table t1 (c1 ENUM('中文ing123','蘩騠字','蘩騠字ss'), c2 ENUM('null','@!#%$','kasdhka'));
create materialized view mv1(primary key(c1))  parallel 9 refresh complete on demand  as select c1 as c1, count(*) cnt from t1 group by c1;
insert into t1 values('中文ing123','null');
insert into t1 values('蘩騠字','@!#%$');
insert into t1 values('蘩騠字ss',null);
CALL DBMS_MVIEW.REFRESH('mv1','c');
select * from t1 order by c1;
c1	c2
中文ing123	null
蘩騠字	@!#%$
蘩騠字ss	NULL
select * from mv1 order by c1;
c1	cnt
中文ing123	1
蘩騠字	1
蘩騠字ss	1
##全量刷新指定主键
drop table t1;
drop  materialized view mv1;
create table t1 (c1 int, c2 int);
create materialized view mv1(primary key(c1)) parallel 9 refresh complete on demand  as select c1 as c1, count(*) cnt from t1 group by c1;
insert into t1 values(1,1);
insert into t1 values(1,null);
insert into t1 values(null,1);
select * from t1 order by c1,c2;
c1	c2
NULL	1
1	NULL
1	1
CALL DBMS_MVIEW.REFRESH('mv1','c');
ERROR 23000: Column cannot be null
select * from mv1 order by c1;
c1	cnt
drop table t1;
drop  materialized view mv1;
create table t1 (c1 int, c2 int);
insert into t1 values(1,1);
insert into t1 values(1,null);
insert into t1 values(null,1);
create materialized view mv1(primary key(c1)) parallel 9 refresh complete on demand  as select c1 as c1, count(*) cnt from t1 group by c1;
ERROR 23000: Column cannot be null
select * from t1 order by c1,c2;
c1	c2
NULL	1
1	NULL
1	1
drop table t1;
create table t1 (c1 json, c2 json);
insert into t1(c1) values('{"key":[1,0,false,true]}');
create materialized view mv1(primary key(c1)) parallel 9 refresh complete on demand  as select * from t1 ;
ERROR 42000: JSON column 'c1' cannot be used in key specification.
drop table t1;
create table t1 (c1 blob, c2 blob);
insert into t1(c1) values('{"key":[1,0,false,true]}');
create materialized view mv1(primary key(c1)) parallel 9 refresh complete on demand  as select * from t1 ;
ERROR 42000: The used storage engine can't index column 'c1'
##json列join --oracle不支持
DROP MATERIALIZED VIEW LOG ON t2;
drop table t1;
drop table t2;
drop  materialized view mv2;
create table t1 (c1 json, c2 json);
insert into t1(c1) values('{"key":[1,0,false,true]}');
create table t2(c1 int primary key, c2 int, c3 int, c4 json);
insert into t2 values(1,null,null,'{"key":[1,0,false,true]}');
create materialized view mv1 parallel 9 refresh complete on demand  as select * from t1 ;
select * from mv1,t2 where mv1.c2=t2.c4;
c1	c2	c1	c2	c3	c4
##full outer join
drop table t1;
drop table t2;
drop  materialized view mv1;
create table t1(pk int primary key, c1 int);
create table t2(c1 int);
create materialized view log on t1 with primary key, rowid, sequence ( c1) including new values;
create materialized view log on t2 with primary key, rowid, sequence ( c1) including new values;
create materialized view mv1(primary key(c1)) refresh fast on demand  enable on query computation  as select c1 as c1,count(*) cnt from t1 group by c1;
create materialized view mv2(primary key(cnt_c1)) refresh fast on demand  enable on query computation as select count(c1) cnt_c1, sum(c1) sum_c1 from t2;
insert into t1 values(1, null);
insert into t2 values(2);
select v.* from mv2 full outer join (select c1, 1 as c2 from mv1) v on mv2.cnt_c1 = v.c1 order by c1,c2;
c1	c2
NULL	NULL
NULL	1
##全量mv与rt_mv连接
DROP MATERIALIZED VIEW LOG ON t1;
DROP MATERIALIZED VIEW LOG ON t2;
drop table t1;
drop table t2;
drop  materialized view mv1;
drop  materialized view mv2;
create table t1 (c1 json, c2 json);
insert into t1(c1) values('{"bh": 12345, "xxmc": "北京大学"}');
create table t2(c1 int primary key, c2 int, c3 int, c4 int);
insert into t2 values(1,null,null,1);
create materialized view log on t2 with primary key, rowid, sequence ( c2, c3) including new values;
create materialized view mv1 parallel 9 refresh complete on demand  as select * from t1 ;
create materialized view mv2 refresh fast on demand  enable on query computation as select count(c3) cnt_c3, sum(c3) sum_c3 from t2;
select * from mv1,mv2;
c1	c2	cnt_c3	sum_c3
{"bh": 12345, "xxmc": "北京大学"}	NULL	0	NULL
##存在lob列和其他类型列join
DROP MATERIALIZED VIEW LOG ON t2;
drop table t1;
drop table t2;
drop  materialized view mv1;
drop  materialized view mv2;
create table t1 (c1 blob, c2 blob);
insert into t1(c1) values('1');
create table t2(c1 int primary key, c2 varchar(40), c3 int, c4 blob);
insert into t2 values(1,'1',null,'1');
create materialized view log on t2 with primary key, rowid, sequence ( c2, c3) including new values;
create materialized view mv1 parallel 9 refresh complete on demand  as select * from t1 ;
create materialized view mv2(primary key(c2)) refresh fast on demand   as select c2,count(*) cnt,count(c3) cnt_c3, sum(c3) sum_c3 from t2 group by c2;
select * from mv1,mv2 where mv1.c1=mv2.c2;
c1	c2	c2	cnt	cnt_c3	sum_c3
1	NULL	1	1	0	NULL
########清空回收站，删除测试数据库，表等 ##########
drop database  IF EXISTS db1;
