drop database  IF EXISTS  db1;
create database db1;
use db1;
SET wait_timeout=30000000;
SET ob_trx_timeout = 30000000;
SET ob_query_timeout = 30000000;
##单表简单查询
create table t1 (c1 number(10) ,c2 number(10), c3 number, c4 number);
create materialized view log on t1 parallel 9 with rowid, sequence (c1,c2,c3,c4) including new values;
create materialized view mv1  parallel 9 refresh complete on demand enable on query  computation as select c1 as c1, count(*) cnt from t1 group by c1;
insert into t1 values(1,1,1,1);
insert into t1 values(null,1,1,1);
select c1 *12-1/1 from mv1 where c1 in (null,1,2,3,4 ) or c1 not in (null,1,2,3,4 ) order by c1;
c1 *12-1/1
11.0000
select max(c1) * max(c1)* max(c1)from mv1;
max(c1) * max(c1)* max(c1)
1
select min(c1) * min(c1)* min(c1)from mv1;
min(c1) * min(c1)* min(c1)
1
select avg(c1) * avg(c1)* avg(c1)from mv1;
avg(c1) * avg(c1)* avg(c1)
1.000000000000
select sum(c1) * sum(c1)* sum(c1)from mv1;
sum(c1) * sum(c1)* sum(c1)
1
select count(c1) * count(c1) * count(c1)from mv1;
count(c1) * count(c1) * count(c1)
1
##增加start with
##不加including new values
DROP MATERIALIZED VIEW LOG ON t1;
DROP TABLE t1;
drop materialized view mv1;
create table t1 (c1 number(10) ,c2 number(10), c3 number, c4 number);
create materialized view log on t1 parallel 9 with rowid, sequence (c1,c2,c3,c4) ;
create materialized view mv1  parallel 9 refresh complete on demand enable on query  computation as select c1 as c1, count(*) cnt from t1 group by c1;
insert into t1 values(1,1,1,1);
insert into t1 values(null,1,1,1);
select * from mv1 order by c1;
c1	cnt
NULL	1
1	1
select * from t1 order by c1;
c1	c2	c3	c4
NULL	1	1	1
1	1	1	1
truncate table t1;
ERROR 0A000: truncate table with materialized view log is not supported
##增加外键
DROP MATERIALIZED VIEW LOG ON t1;
DROP TABLE t1;
drop materialized view mv1;
create table t1 (c1 number(10) primary key,c2 number(10), c3 number, c4 number);
create materialized view log on t1 parallel 9 with rowid, sequence (c2,c3,c4) including new values;
create materialized view mv1  parallel 9 refresh complete on demand enable on query  computation as select c1 as c1, count(*) cnt from t1 group by c1;
insert into t1 values(1,1,1,1);
insert into t1 values(2,1,1,1);
insert into t1 values(3,3,1,1);
insert into t1 values(4,2,1,1);
insert into t1 values(5,4,1,1);
insert into t1 values(6,null,1,1);
ALTER TABLE t1 ADD CONSTRAINT fk_c2 FOREIGN KEY (c2) REFERENCES t1(c1);
select * from mv1 a,t1 b  where a.c1=b.c2 and b.c2 is not null order by b.c1;
c1	cnt	c1	c2	c3	c4
1	1	1	1	1	1
1	1	2	1	1	1
3	1	3	3	1	1
2	1	4	2	1	1
4	1	5	4	1	1
select count(*) from mv1 a,t1 b  where a.c1!=b.c2;
count(*)
25
select count(*) from mv1 a,t1 b  where a.c1>b.c2;
count(*)
19
select count(*) from mv1 a,t1 b  where a.c1<b.c2;
count(*)
6
select count(*) from mv1 a,t1 b  where a.c1<>b.c2;
count(*)
25
select count(*) from mv1 a,t1 b  where a.c1=b.c2;
count(*)
5
ALTER TABLE t1 DROP  CONSTRAINT fk_c2 ;
##插入值验证
DROP MATERIALIZED VIEW LOG ON t1;
DROP TABLE t1;
drop materialized view mv1;
create table t1 (c1 number(10) ,c2 number(10), c3 number, c4 number);
create materialized view log on t1 parallel 9 with rowid, sequence (c1,c2,c3,c4) including new values;
create materialized view mv1  parallel 9 refresh complete on demand enable on query  computation as select c1 as c1, count(*) cnt from t1 group by c1;
create materialized view mv2  parallel 9 refresh complete on demand enable on query  computation as select c1 as c1, count(*) cnt from t1 group by c1;
insert into t1 values(2,1,null,1);
insert into t1 values(null,1,null,1);
INSERT INTO t1 SELECT c1 + 4, c1,cnt,c1+1 FROM mv1;
select mv1.c1 from mv1,t1  WHERE mv1.c1 <> ANY (SELECT  1 FROM dual) ORDER BY mv1.c1;
c1
2
2
2
2
6
6
6
6
SELECT * FROM mv1 a JOIN mv2 b ON a.c1=b.c1 ORDER BY a.c1;
c1	cnt	c1	cnt
2	1	2	1
6	1	6	1
SELECT * FROM mv1 a JOIN mv2 b ON a.c1=b.c1 where a.c1= ''or b.c1=1 ORDER BY a.c1;
c1	cnt	c1	cnt
SELECT * FROM mv1 a JOIN mv2 b ON a.c1>b.c1 ORDER BY a.c1;
c1	cnt	c1	cnt
6	1	2	1
SELECT * FROM mv1 a JOIN mv2 b ON a.c1<b.c1 ORDER BY a.c1;
c1	cnt	c1	cnt
2	1	6	1
SELECT * FROM mv1 a JOIN mv2 b ON a.c1<=>b.c1 ORDER BY a.c1,b.c1;
c1	cnt	c1	cnt
NULL	2	NULL	2
2	1	2	1
6	1	6	1
SELECT * FROM mv1, mv1 mv2, mv1 mv3  WHERE ((mv1.c1 = 5 AND mv3.c1 <> mv1.c1) OR mv1.c1 > 0) AND mv3.c1 < mv2.c1 order by 1,2,3;
c1	cnt	c1	cnt	c1	cnt
2	1	6	1	2	1
6	1	6	1	2	1
##两个不同数据类型
DROP MATERIALIZED VIEW LOG ON t1;
DROP TABLE t1;
drop materialized view mv1;
drop materialized view mv2;
create table t1 (c1 number(10) ,c2 varchar(120), c3 date, c4 varchar(120));
insert into t1 values(1,'as','2024-03-25','{"name": "John", "age": 30, "city": "New York"}');
insert into t1 values(null,'qqw中','2022-03-25','{"name": "John", "age": 30, "city": "New York"}');
create materialized view log on t1 parallel 9 with rowid, sequence (c1,c2,c3) including new values;
create materialized view mv1  parallel 9 refresh complete on demand enable on query  computation as select c1 as c1, count(*) cnt from t1 group by c1;
create materialized view mv2  parallel 9 refresh complete on demand enable on query  computation as select c2 as c2, count(*) cnt from t1 group by c2;
create materialized view mv3  parallel 9 refresh complete on demand enable on query  computation as select c3 as c3, count(*) cnt from t1 group by c3;
select count(*) from mv1,mv2 ;
count(*)
4
select count(*) from mv2,mv3 ;
count(*)
4
select count(*) from mv3,mv1 ;
count(*)
4
select count(*) from mv3,t1 where t1.c4=mv3.c3;
count(*)
0
select count(*) from mv2,t1 where t1.c4=mv2.c2;
count(*)
0
select count(*) from mv1,t1 where t1.c4=mv1.c1;
count(*)
0
Warnings:
Warning	1292	Truncated incorrect DECIMAL value: '{"name": "John", "age": 30, "city": "New York"}'
Warning	1292	Truncated incorrect DECIMAL value: '{"name": "John", "age": 30, "city": "New York"}'
select count(*) from mv1,t1 ;
count(*)
4
select count(*) from mv2,t1 ;
count(*)
4
##复合主键
DROP MATERIALIZED VIEW LOG ON t1;
DROP TABLE t1;
drop materialized view mv1;
create table t1 (c1 number(10) ,c2 varchar(120) , c3 date, c4 number(10) not null,c5 varchar(120),c6 number(10));
ALTER TABLE t1 ADD CONSTRAINT constraint_name PRIMARY KEY (c2,c3);
create materialized view log on t1 parallel 9 with PRIMARY KEY,rowid, sequence(c1,c4,c5,c6)  including new values;
create materialized view mv1  parallel 9 refresh complete on demand enable on query  computation  as select c2 as c2, count(*) cnt from t1 group by c2;
insert into t1 values(1,'{"name": "John", "age": 30, "city": "New York"}','2024-03-25',2,4,6);
insert into t1 values(null,'{"name": "John", "age": 31, "city": "New York"}','2022-03-25',1,3,5);
select mv1.c2,count(*) from mv1,t1,mlog$_t1 where t1.c2=mv1.c2 and mv1.c2=mlog$_t1.c2 group by mv1.c2 order by c2;
c2	count(*)
{"name": "John", "age": 30, "city": "New York"}	1
{"name": "John", "age": 31, "city": "New York"}	1
select mv1.c2,count(*) from mv1,mlog$_t1 where  mv1.cnt=mlog$_t1.c1 group by mv1.c2 order by c2;
c2	count(*)
{"name": "John", "age": 30, "city": "New York"}	1
{"name": "John", "age": 31, "city": "New York"}	1
select mv1.c2,count(*) from mv1,mlog$_t1 where  mv1.c2<>mlog$_t1.c5 group by mv1.c2 order by c2;
c2	count(*)
{"name": "John", "age": 30, "city": "New York"}	2
{"name": "John", "age": 31, "city": "New York"}	2
select mv1.c2,count(*) from mv1,t1 where  mv1.c2<>t1.c5 group by mv1.c2 order by c2;
c2	count(*)
{"name": "John", "age": 30, "city": "New York"}	2
{"name": "John", "age": 31, "city": "New York"}	2
##not null
DROP MATERIALIZED VIEW LOG ON t1;
DROP TABLE t1;
drop materialized view mv1;
create table t1 (c1 number(10) ,c2 varchar(120), c3 date, c4 number(10) not null);
create materialized view log on t1 parallel 9 with rowid, sequence (c1,c2,c3) including new values;
create materialized view mv1  parallel 9 refresh complete on demand enable on query  computation  as select c1 as c1, count(*) cnt from t1 group by c1;
insert into t1 values(1,'as','2024-03-25',2);
insert into t1 values(null,'qqw中','2022-03-25',1);
select * from mv1 order by c1;
c1	cnt
NULL	1
1	1
##存在check约束
DROP MATERIALIZED VIEW LOG ON t1;
DROP TABLE t1;
drop materialized view mv1;
create table t1 (c1 number(10) ,c2 varchar(120), c3 date, c4 number(10) check(c4 >1));
create materialized view log on t1 parallel 9 with rowid, sequence (c2,c3,c4) including new values;
create materialized view mv1  parallel 9 refresh fast on demand enable on query  computation  as select c4 as c4, count(*) cnt from t1 group by c4;
insert into t1 values(1,'as','2024-03-25',2);
update t1 set c4=3 where c1 =1;
select * from mv1 order by c4;
c4	cnt
3	1
##复合查询，UNION 和 UNION ALL 运算符
DROP MATERIALIZED VIEW LOG ON t1;
DROP TABLE t1;
drop materialized view mv1;
create table t1 (c1 number(10) ,c2 number(10), c3 number, c4 number);
create materialized view log on t1 parallel 9 with rowid, sequence (c1,c2,c3,c4) including new values;
create materialized view mv1  parallel 9 refresh complete on demand enable on query  computation as select c1 as c1, count(*) cnt from t1 group by c1;
insert into t1 values(1,1,1,1);
insert into t1 values(null,null,null,null);
select c1 from mv1 union select cnt from mv1 order by c1;
c1
NULL
1
select c1 from mv1 union all select cnt from mv1 order by c1;
c1
NULL
1
1
1
select c1 from mv1 union select cnt from mv1 order by c1;
c1
NULL
1
select c1 from mv1 union all select cnt from mv1 order by c1;
c1
NULL
1
1
1
select c1 from mv1 union select null from dual order by c1;
c1
NULL
1
select c1 from mv1 union all select null from dual order by c1;
c1
NULL
NULL
1
##子查询（select子句,where子句,having子句）
DROP MATERIALIZED VIEW LOG ON t1;
DROP TABLE t1;
drop materialized view mv1;
create table t1 (c1 number(10) ,c2 number(10), c3 number, c4 number);
create materialized view log on t1 parallel 9 with rowid, sequence (c1,c2,c3,c4) including new values;
create materialized view mv1  parallel 9 refresh complete on demand enable on query  computation as select c1 as c1, count(*) cnt from t1 group by c1;
insert into t1 values(1,1,1,1);
insert into t1 values(3,1,11,1);
insert into t1 values(122,1,null,1);
insert into t1 values(100,1,1,1);
select a.c1,(select t1.c1 from t1 where t1.c1 =1)b from mv1 a order by a.c1;
c1	b
1	1
3	1
100	1
122	1
select a.c1,(select t1.c3 from t1 where t1.c3 is null)b from mv1 a order by a.c1;
c1	b
1	NULL
3	NULL
100	NULL
122	NULL
select a.c1,(select mlog$_t1.c3 from mlog$_t1 where mlog$_t1.c3 > 10)b from mv1 a order by a.c1;
c1	b
1	11
3	11
100	11
122	11
select a.c1 from mv1 a where cnt < (select avg(c1) from t1)order by a.c1;
c1
1
3
100
122
select a.c1 from mv1 a where cnt < (select avg(c3) from t1)order by a.c1;
c1
1
3
100
122
select a.c1 from mv1 a where cnt > (select avg(c1) from mlog$_t1)order by a.c1;
c1
select a.c1 from mv1 a where exists (select avg(c1) from mlog$_t1)order by a.c1;
c1
1
3
100
122
select a.c1 from mv1 a where cnt in (select avg(c1) from mlog$_t1)order by a.c1;
c1
select c1,avg(cnt) from mv1 group by c1 having avg(cnt) >1 order by c1;
c1	avg(cnt)
select c1,avg(cnt) from mv1 group by c1 having avg(cnt) is not null order by c1;
c1	avg(cnt)
1	1.0000
3	1.0000
100	1.0000
122	1.0000
##SELECT FOR UPDATE
SET AUTOCOMMIT=1;
DROP MATERIALIZED VIEW LOG ON t1;
DROP TABLE t1;
drop materialized view mv1;
create table t1 (c1 number(10) ,c2 number(10), c3 number, c4 number);
insert into t1 values(1,1,1,1);
insert into t1 values(3,1,11,1);
insert into t1 values(122,1,null,1);
insert into t1 values(100,1,1,1);
create materialized view log on t1 parallel 9 with rowid, sequence (c1,c2,c3,c4) including new values;
create materialized view mv1  parallel 9 refresh complete on demand enable on query  computation as select c1 as c1, count(*) cnt from t1 group by c1;
SET AUTOCOMMIT=0;
select c1 from mv1 where c1 =1 for update;
c1
1
update t1 set c1=99 where c1 =1;
commit;
select * from mv1 order by c1;
c1	cnt
3	1
99	1
100	1
122	1
##rt_mv和基表join
DROP MATERIALIZED VIEW LOG ON t1;
DROP TABLE t1;
drop materialized view mv1;
create table t1 (c1 int ,c2 int, c3 int, c4 int);
create materialized view log on t1 parallel 9 with rowid, sequence (c1,c2,c3,c4) including new values;
create materialized view mv1  parallel 9 refresh complete on demand enable on query  computation as select c1 as c1, count(*) cnt from t1 group by c1;
insert into t1 values(1,1,1,1);
insert into t1 values(3,1,11,1);
insert into t1 values(122,1,null,1);
insert into t1 values(100,1,1,1);
create table t2 (c1 int ,c2 int, c3 int, c4 int);
insert into t1 values(1,1,1,1);
select count(*) from t1, mv1 ;
count(*)
20
select count(*) from t1 left join mv1 on t1.c1=mv1.c1 ;
count(*)
5
select count(*) from t2 left join mv1 on t2.c1=mv1.c1 ;
count(*)
0
select count(*) from t1 right join mv1 on t1.c1=mv1.c1 ;
count(*)
5
select count(*) from t1 inner join mv1 on t1.c1=mv1.c1 ;
count(*)
5
##连接视图
DROP MATERIALIZED VIEW LOG ON t1;
DROP TABLE t1;
DROP TABLE t2;
drop materialized view mv1;
create table t1 (c1 number(10) ,c2 number(10), c3 number, c4 number);
create view v1 as select * from t1;
create materialized view log on t1 parallel 9 with rowid, sequence (c1,c2,c3,c4) including new values;
create materialized view mv1  parallel 9 refresh complete on demand enable on query  computation as select c1 as c1, count(*) cnt from t1 group by c1;
insert into t1 values(1,1,1,1);
insert into t1 values(3,1,11,1);
insert into t1 values(122,1,null,1);
select count(*) from mv1,v1;
count(*)
9
select count(*) from mv1,(select 1 from v1);
count(*)
9
##连接虚拟表
DROP MATERIALIZED VIEW LOG ON t1;
DROP TABLE t1;
drop materialized view mv1;
create table t1 (c1 number(10) ,c2 number(10), c3 number, c4 number);
create materialized view log on t1 parallel 9 with rowid, sequence (c1,c2,c3,c4) including new values;
create materialized view mv1  parallel 9 refresh complete on demand enable on query  computation as select c1 as c1, count(*) cnt from t1 group by c1;
insert into t1 values(1,1,1,1);
insert into t1 values(null,1,1,1);
insert into t1 values(2,1,1,1);
insert into t1 values(3,1,1,1);
select * from mv1,(select null from dual)a order by 1,2,3;
c1	cnt	NULL
NULL	1	NULL
1	1	NULL
2	1	NULL
3	1	NULL
select * from (select null from dual)a,mv1 order by 1,2,3;
NULL	c1	cnt
NULL	NULL	1
NULL	1	1
NULL	2	1
NULL	3	1
select * from mv1,(select 1 from dual)a order by 1,2,3;
c1	cnt	1
NULL	1	1
1	1	1
2	1	1
3	1	1
select * from mv1,(select 1,1,1,1 from dual)a order by 1,2,3;
ERROR 42S21: Duplicate column name '1'
##五表连接
DROP MATERIALIZED VIEW LOG ON t1;
DROP TABLE t1;
drop materialized view mv1;
drop materialized view mv2;
drop materialized view mv3;
purge recyclebin;
create table t1 (c1 number(10) primary key,c2 number(10), c3 number, c4 number);
create table t2 (a1 number(10) primary key,a2 number(10), a3 number, a4 number);
create table t3 (b1 number(10) primary key,b2 number(10), b3 number, b4 number);
create table t4 (d1 number(10) primary key,d2 number(10), d3 number, d4 number);
create table t5 (h1 number(10) primary key,h2 number(10), h3 number, h4 number);
create materialized view log on t1 parallel 9 with rowid, sequence (c2,c3,c4) including new values;
create materialized view log on t2 parallel 9 with rowid, sequence (a2,a3,a4) including new values;
create materialized view log on t3 parallel 9 with rowid, sequence (b2,b3,b4) including new values;
create materialized view log on t4 parallel 9 with rowid, sequence (d2,d3,d4) including new values;
create materialized view log on t5 parallel 9 with rowid, sequence (h2,h3,h4) including new values;
create materialized view mv1 refresh complete on demand enable on query  computation as select c1 as c1 ,a1 as a1,b1 as b1,d1 as d1,h1 as h1 from t1,t2,t3,t4,t5 where c1=a1 and a1=b1 and b1=d1 and d1=h1;
create materialized view mv2 refresh complete on demand enable on query  computation as select c1 as c1, a1 as a1 from t1, t2 where c1=a1;
insert into t1 values(1,null,1,1);
insert into t2 values(1,null,2,2);
insert into t3 values(1,null,3,3);
insert into t4 values(1,null,4,4);
insert into t5 values(1,null,5,5);
select * from mv1;
c1	a1	b1	d1	h1
1	1	1	1	1
CREATE INDEX idx ON mv1 (c1,a1,b1,d1,h1) parallel 10;
##rt_mv连接不同rt_mv
##使用普通视图
DROP MATERIALIZED VIEW LOG ON t1;
drop table t1;
drop view v1;
drop materialized view mv1;
create table t1 (c1 number , c2 varchar(200));
create view v1 as select c2 as c2, count(*) cnt from t1 group by c2;
INSERT INTO t1 VALUES (1, '{"name": "John Doe", "age": 30}');
INSERT INTO t1 VALUES (null, '{"name": "John Doe", "age": 30}');
create materialized view log on t1  with rowid, sequence(c2) including new values;
create materialized view mv1  parallel 9 refresh complete on demand enable on query  computation   as select c2 as c2, count(*) cnt from t1 group by c2;
select * from mv1,v1,t1 order by c1;
c2	cnt	c2	cnt	c1	c2
{"name": "John Doe", "age": 30}	2	{"name": "John Doe", "age": 30}	2	NULL	{"name": "John Doe", "age": 30}
{"name": "John Doe", "age": 30}	2	{"name": "John Doe", "age": 30}	2	1	{"name": "John Doe", "age": 30}
##验证增加check约束
DROP MATERIALIZED VIEW LOG ON t1;
DROP MATERIALIZED VIEW LOG ON t2;
DROP TABLE t1;
DROP TABLE t2;
drop materialized view mv1;
create table t1 (c1 number(10) ,c2 number(10), c3 number, c4 number);
create materialized view log on t1 parallel 9 with rowid, sequence (c1,c2,c3,c4) including new values;
create materialized view mv1  parallel 9 refresh fast on demand  enable on query  computation    as select c1 as c1, count(*) cnt from t1 group by c1;
ALTER TABLE mv1 ADD CONSTRAINT check1 CHECK (c1>1);
ERROR 0A000: alter materialized view is not supported
ALTER TABLE mv1 drop CONSTRAINT check1 ;
ERROR HY000: Constraint 'check1' does not exist.
insert into t1 values(0,1,1,1);
select * from mv1;
c1	cnt
0	1
select * from t1;
c1	c2	c3	c4
0	1	1	1
##连接子查询
DROP MATERIALIZED VIEW LOG ON t1;
DROP TABLE t1;
drop materialized view mv1;
create table t1 (c1 number(10) ,c2 number(10), c3 number, c4 number);
create materialized view log on t1 parallel 9 with rowid, sequence (c1,c2,c3,c4) including new values;
create materialized view mv1  parallel 9 refresh complete on demand enable on query  computation  as select c1 as c1, count(*) cnt from t1 group by c1;
insert into t1 values(1,1,1,1);
select * from mv1 left join (select c1 from mv1)a on a.c1=mv1.c1 ;
c1	cnt	c1
1	1	1
select * from mv1 right join (select c1 from mv1)a on a.c1=mv1.c1 ;
c1	cnt	c1
1	1	1
select * from mv1 inner join (select c1 from mv1)a on a.c1=mv1.c1 ;
c1	cnt	c1
1	1	1
##rt_mv连接rt_mv
DROP MATERIALIZED VIEW LOG ON t1;
DROP TABLE t1;
drop materialized view mv1;
create table t1 (c1 number(10) ,c2 number(10), c3 number, c4 number);
create materialized view log on t1 parallel 9 with rowid, sequence (c1,c2,c3,c4) including new values;
create materialized view mv1  parallel 9 refresh complete on demand enable on query  computation as select c1 as c1, count(*) cnt from t1 group by c1;
insert into t1 values(1,1,1,1);
select * from mv1 a left join mv1 b on a.cnt=b.c1 ;
c1	cnt	c1	cnt
1	1	1	1
select * from mv1 right join (select c1 from mv1)a on a.c1=mv1.c1 ;
c1	cnt	c1
1	1	1
select * from mv1 inner join (select c1 from mv1)a on a.c1=mv1.c1 ;
c1	cnt	c1
1	1	1
##正交分区表
DROP MATERIALIZED VIEW LOG ON t1;
DROP TABLE t1;
drop materialized view mv1;
create table t1 (c1 number(10) ,c2 number(10), c3 number, c4 number);
insert into t1 values(1,1,1,1);
create materialized view log on t1 parallel 9 with rowid, sequence (c1,c2,c3,c4) including new values;
create materialized view mv1  parallel 9 refresh complete on demand enable on query  computation as select c1 as c1, count(*) cnt from t1 group by c1;
CREATE TABLE t2 (c1 int PRIMARY KEY, c2 VARCHAR(999) not null) PARTITION BY HASH(c1) PARTITIONS 8;
select * from mv1 a left join  t2 b on a.cnt=b.c1 ;
c1	cnt	c1	c2
1	1	NULL	NULL
select * from mv1 a right join  t2 b on a.cnt=b.c1 ;
c1	cnt	c1	c2
select * from mv1 a inner join  t2 b on a.cnt=b.c1 ;
c1	cnt	c1	c2
##使用聚合函数
DROP MATERIALIZED VIEW LOG ON t1;
DROP TABLE t1;
drop materialized view mv1;
create table t1 (c1 number(10) ,c2 number(10), c3 number, c4 number);
create materialized view log on t1 parallel 9 with rowid, sequence (c1,c2,c3,c4) including new values;
create materialized view mv1  parallel 9 refresh complete on demand enable on query  computation as select c1 as c1, count(*) cnt from t1 group by c1;
insert into t1 values(1,1,1,1);
CALL DBMS_MVIEW.REFRESH('mv1','f');
select count(distinct c1) a from mv1;
a
1
select sum(c1+cnt) from mv1;
sum(c1+cnt)
2
select avg(c1+cnt) from mv1;
avg(c1+cnt)
2.0000
select min(c1+cnt) from mv1;
min(c1+cnt)
2
select max(c1+cnt)+max(c1+cnt) from mv1;
max(c1+cnt)+max(c1+cnt)
4
select * from mv1;
c1	cnt
1	1
##使用group by
DROP MATERIALIZED VIEW LOG ON t1;
DROP TABLE t1;
DROP TABLE t2;
drop materialized view mv1;
create table t1 (c1 number(10) ,c2 number(10), c3 number, c4 number);
create materialized view log on t1 parallel 9 with rowid, sequence (c1,c2,c3,c4) including new values;
insert into t1 values(1,5,8,12);
insert into t1 values(2,3,3,3);
create materialized view mv1  parallel 9 refresh complete on demand enable on query  computation as select c1 as c1, count(*) cnt from t1 group by c1;
select * from mv1 order by c1;
c1	cnt
1	1
2	1
##事务中使用
DROP MATERIALIZED VIEW LOG ON t1;
DROP TABLE t1;
drop materialized view mv1;
create table t1 (c1 number(10) ,c2 number(10), c3 number, c4 number);
create materialized view log on t1 parallel 9 with rowid, sequence (c1,c2,c3,c4) including new values;
create materialized view mv1  parallel 9 refresh complete on demand enable on query  computation as select c1 as c1, count(*) cnt from t1 group by c1;
START TRANSACTION;
insert into t1 values(1,4,8,12);
insert into t1 values(3,5,3,12);
SAVEPOINT my_savepoint1;
update t1 set c1=11 where c2=5;
insert into t1 values(2,3,3,3);
SAVEPOINT my_savepoint2;
delete from t1 where c1=1;
SAVEPOINT my_savepoint3;
select * from mv1 order by c1;
c1	cnt
2	1
11	1
select * from t1 order by c1;
c1	c2	c3	c4
2	3	3	3
11	5	3	12
ROLLBACK TO my_savepoint3;
select * from t1 order by c1;
c1	c2	c3	c4
2	3	3	3
11	5	3	12
select * from mv1 order by c1;
c1	cnt
2	1
11	1
ROLLBACK TO my_savepoint2;
select * from t1 order by c1;
c1	c2	c3	c4
1	4	8	12
2	3	3	3
11	5	3	12
select * from mv1 order by c1;
c1	cnt
1	1
2	1
11	1
ROLLBACK TO my_savepoint1;
select * from t1 order by c1;
c1	c2	c3	c4
1	4	8	12
3	5	3	12
select * from mv1 order by c1;
c1	cnt
1	1
3	1
##数据类型验证
##char
DROP MATERIALIZED VIEW LOG ON t1;
drop table t1;
drop materialized view mv1;
drop materialized view mv2;
create table t1 (c1 char(20) primary key, c2 char(20));
create materialized view log on t1 parallel 9 with PRIMARY KEY,rowid,sequence(c2) including new values  ;
create materialized view mv1  parallel 9 never refresh   enable on query  computation as select c1 as c1, count(*) cnt from t1 group by c1;
insert into t1 values('null','中文ing123');
insert into t1 values('nas','中文ing123');
insert into t1 values('false','999abc');
insert into t1 values('蘩騠字','21311111111111111111');
update t1 set c2='' where c1='null';
delete from t1 where c1 is null;
select * from mv1 a,t1 b where a.c1=b.c1 order by a.c1;
c1	cnt	c1	c2
false	1	false	999abc
nas	1	nas	中文ing123
null	1	null	
蘩騠字	1	蘩騠字	21311111111111111111
select * from mv1 a,mv1 b where a.c1=b.cnt;
c1	cnt	c1	cnt
Warnings:
Warning	1292	Truncated incorrect DECIMAL value: 'nas'
Warning	1292	Truncated incorrect DECIMAL value: 'null'
Warning	1292	Truncated incorrect DECIMAL value: 'false'
Warning	1292	Truncated incorrect DECIMAL value: '蘩騠字'
##NCHAR
DROP MATERIALIZED VIEW LOG ON t1;
drop table t1;
drop materialized view mv1;
create table t1 (c1 NCHAR(20) primary key, c2 NCHAR(20));
create materialized view log on t1 parallel 9 with PRIMARY KEY,rowid,sequence(c2) including new values  ;
create materialized view mv1  parallel 9 refresh complete on demand enable on query  computation as select c1 as c1, count(*) cnt from t1 group by c1;
insert into t1 values('null','中文ing123');
insert into t1 values('false','999abc');
insert into t1 values('蘩騠字','21311111111111111111');
update t1 set c2='' where c1='null';
delete from t1 where c1 is null;
select * from mv1 order by c1;
c1	cnt
false	1
null	1
蘩騠字	1
select * from mv1 a,t1 b where a.c1=b.c1 order by a.c1;
c1	cnt	c1	c2
false	1	false	999abc
null	1	null	
蘩騠字	1	蘩騠字	21311111111111111111
##DATE
DROP MATERIALIZED VIEW LOG ON t1;
drop table t1;
drop materialized view mv1;
create table t1 (c1 DATE primary key, c2 DATE);
INSERT INTO t1 (c1, c2) VALUES ('2022-01-01',  '2022-01-01');
INSERT INTO t1 (c1, c2) VALUES ('2022-01-02',  '2022-01-02');
UPDATE t1 SET c2 = '2022-01-03' WHERE c1 = '2022-01-01';
DELETE FROM t1 WHERE c1 = '2022-01-02';
create materialized view log on t1 parallel 9 with PRIMARY KEY,rowid,sequence(c2) including new values  ;
create materialized view mv1  parallel 9 refresh complete on demand enable on query  computation as select c1 as c1, count(*) cnt from t1 group by c1;
select * from mv1 order by c1;
c1	cnt
2022-01-01	1
select * from mv1 a,t1 b where a.c1=b.c1;
c1	cnt	c1	c2
2022-01-01	1	2022-01-01	2022-01-03
select * from mv1 a,mv1 b where a.c1=b.cnt;
c1	cnt	c1	cnt
##time
DROP MATERIALIZED VIEW LOG ON t1;
drop table t1;
drop materialized view mv1;
create table t1 (c1 time primary key, c2 time);
create materialized view log on t1 parallel 9 with PRIMARY KEY,rowid,sequence(c2) including new values ;
create materialized view mv1  parallel 9 refresh complete on demand enable on query  computation as select c1 as c1, count(*) cnt from t1 group by c1;
INSERT INTO t1 (c1, c2) VALUES (time '2022-01-01 23:00:00', time '2022-01-01 11:00:00');
INSERT INTO t1 (c1, c2) VALUES (time '2022-01-02 22:00:00', time '2022-01-02 22:00:00');
UPDATE t1 SET c2 = time '2022-01-03 13:00:00' WHERE c1 = time '2022-01-01 00:00:00';
DELETE FROM t1 WHERE c1 = time '2022-01-02 22:00:00';
select * from mv1 order by c1;
c1	cnt
23:00:00	1
select * from mv1 a,t1 b where a.c1=b.c1;
c1	cnt	c1	c2
23:00:00	1	23:00:00	11:00:00
##timestamp
DROP MATERIALIZED VIEW LOG ON t1;
drop table t1;
drop materialized view mv1;
create table t1 (c1 timestamp primary key, c2 timestamp);
INSERT INTO t1 (c1, c2) VALUES (TIMESTAMP '2022-01-01 00:00:00', TIMESTAMP '2022-01-01 00:00:00');
INSERT INTO t1 (c1, c2) VALUES (TIMESTAMP '2022-01-02 00:00:00', TIMESTAMP '2022-01-02 00:00:00');
UPDATE t1 SET c2 = TIMESTAMP '2022-01-03 00:00:00' WHERE c1 = TIMESTAMP '2022-01-01 00:00:00';
DELETE FROM t1 WHERE c1 = TIMESTAMP '2022-01-02 00:00:00';
create materialized view log on t1 parallel 9 with PRIMARY KEY,rowid,sequence(c2) including new values ;
create materialized view mv1  parallel 9 refresh complete on demand enable on query  computation as select c1 as c1, count(*) cnt from t1 group by c1;
select * from mv1 order by c1;
c1	cnt
2022-01-01 00:00:00	1
select * from mv1 a,t1 b where a.c1=b.c1;
c1	cnt	c1	c2
2022-01-01 00:00:00	1	2022-01-01 00:00:00	2022-01-03 00:00:00
##year
DROP MATERIALIZED VIEW LOG ON t1;
drop table t1;
drop materialized view mv1;
create table t1 (c1 year primary key, c2 year);
create materialized view log on t1 parallel 9 with PRIMARY KEY,rowid,sequence(c2) including new values ;
create materialized view mv1  parallel 9 refresh complete on demand enable on query  computation as select c1 as c1, count(*) cnt from t1 group by c1;
insert into t1 values(1969,1946);
insert into t1 values(2023,2024);
select * from mv1 order by c1;
c1	cnt
1969	1
2023	1
select * from mv1 a,t1 b where a.c1=b.c1 order by a.c1;
c1	cnt	c1	c2
1969	1	1969	1946
2023	1	2023	2024
##bit
DROP MATERIALIZED VIEW LOG ON t1;
drop table t1;
drop materialized view mv1;
create table t1 (c1 bit primary key, c2 bit);
INSERT INTO t1 (c1, c2) VALUES (0, 1);
INSERT INTO t1 (c1, c2) VALUES (1, 0);
UPDATE t1 SET c2 =  1 WHERE c1 =  0;
DELETE FROM t1 WHERE c1 = 1;
create materialized view log on t1 parallel 9 with PRIMARY KEY,rowid,sequence(c2) including new values ;
create materialized view mv1  parallel 9 refresh complete on demand enable on query  computation as select c1 as c1, count(*) cnt from t1 group by c1;
select * from mv1 order by c1;
c1	cnt
 	1
select * from mv1 a,t1 b where a.c1=b.c1;
c1	cnt	c1	c2
 	1	 	
##bool
DROP MATERIALIZED VIEW LOG ON t1;
drop table t1;
drop materialized view mv1;
create table t1 (c1 bool primary key, c2 bool);
create materialized view log on t1 parallel 9 with PRIMARY KEY,rowid,sequence(c2) including new values ;
create materialized view mv1  parallel 9 refresh complete on demand enable on query  computation as select c1 as c1, count(*) cnt from t1 group by c1;
INSERT INTO t1 (c1, c2) VALUES (0, 1);
INSERT INTO t1 (c1, c2) VALUES (1, 0);
UPDATE t1 SET c2 =  3 WHERE c1 =  0;
DELETE FROM t1 WHERE c1 = 1;
select * from mv1 order by c1;
c1	cnt
0	1
select * from mv1 a,t1 b where a.c1=b.c1;
c1	cnt	c1	c2
0	1	0	3
##TINYINT(1)
DROP MATERIALIZED VIEW LOG ON t1;
drop table t1;
drop materialized view mv1;
create table t1 (c1 TINYINT(1) primary key, c2 TINYINT(1));
INSERT INTO t1 (c1, c2) VALUES (0, 1);
INSERT INTO t1 (c1, c2) VALUES (1, 0);
UPDATE t1 SET c2 =  3 WHERE c1 =  0;
DELETE FROM t1 WHERE c1 = 1;
create materialized view log on t1 parallel 9 with PRIMARY KEY,rowid,sequence(c2) including new values ;
create materialized view mv1  parallel 9 refresh complete on demand enable on query  computation as select c1 as c1, count(*) cnt from t1 group by c1;
select * from mv1 order by c1;
c1	cnt
0	1
select * from mv1 a,t1 b where a.c1=b.c1;
c1	cnt	c1	c2
0	1	0	3
##BIGINT
DROP MATERIALIZED VIEW LOG ON t1;
drop table t1;
drop materialized view mv1;
create table t1 (c1 BIGINT primary key, c2 BIGINT);
create materialized view log on t1 parallel 9 with PRIMARY KEY,rowid,sequence(c2) including new values ;
create materialized view mv1  parallel 9 refresh complete on demand enable on query  computation as select c1 as c1, count(*) cnt from t1 group by c1;
INSERT INTO t1 (c1, c2) VALUES (9223372036854775807, 199999999999999990);
INSERT INTO t1 (c1, c2) VALUES (9223372036854775806, 199999999999999990);
UPDATE t1 SET c2 =  19999999999999999 WHERE c1 =  9223372036854775806;
select * from mv1 order by c1;
c1	cnt
9223372036854775806	1
9223372036854775807	1
select * from mv1 a,t1 b where a.c1=b.c1 order by a.c1;
c1	cnt	c1	c2
9223372036854775806	1	9223372036854775806	19999999999999999
9223372036854775807	1	9223372036854775807	199999999999999990
##number
DROP MATERIALIZED VIEW LOG ON t1;
drop table t1;
drop materialized view mv1;
create table t1 (c1 number(20) primary key, c2 number(20));
create materialized view log on t1 parallel 9 with PRIMARY KEY,rowid,sequence(c2) including new values;
create materialized view mv1  parallel 9 refresh complete on demand enable on query  computation as select c1 as c1, count(*) cnt from t1 group by c1;
INSERT INTO t1 (c1, c2) VALUES (12345678901234567890, 98765432109876543210);
INSERT INTO t1 (c1, c2) VALUES (11111111111111111111, 22222222222222222222);
UPDATE t1 SET c2 = 33333333333333333333 WHERE c1 = 11111111111111111111;
DELETE FROM t1 WHERE c1 = 12345678901234567890;
select * from mv1 order by c1;
c1	cnt
11111111111111111111	1
select * from mv1 a,t1 b where a.c1=b.c1;
c1	cnt	c1	c2
11111111111111111111	1	11111111111111111111	33333333333333333333
##FLOAT
DROP MATERIALIZED VIEW LOG ON t1;
drop table t1;
drop materialized view mv1;
create table t1 (c1 FLOAT(20) primary key, c2 FLOAT(20));
create materialized view log on t1 parallel 9 with PRIMARY KEY,rowid,sequence(c2) including new values  ;
create materialized view mv1  parallel 9 refresh complete on demand enable on query  computation as select c1 as c1, count(*) cnt from t1 group by c1;
INSERT INTO t1 (c1, c2) VALUES (1.23, 4.56);
INSERT INTO t1 (c1, c2) VALUES (7.89, 10.11);
UPDATE t1 SET c2 = 12.34 WHERE c1 = 7.89;
DELETE FROM t1 WHERE c1 = 1.23;
select * from mv1 order by c1;
c1	cnt
1.23	1
7.89	1
select * from mv1 a,t1 b where a.c1=b.c1 order by a.c1;
c1	cnt	c1	c2
1.23	1	1.23	4.56
7.89	1	7.89	10.11
##double
DROP MATERIALIZED VIEW LOG ON t1;
drop table t1;
drop materialized view mv1;
create table t1 (c1 double primary key, c2 double);
create materialized view log on t1 parallel 9 with PRIMARY KEY,rowid,sequence(c2) including new values  ;
create materialized view mv1  parallel 9 refresh complete on demand enable on query  computation as select c1 as c1, count(*) cnt from t1 group by c1;
INSERT INTO t1 (c1, c2) VALUES (1.23, 4.56);
INSERT INTO t1 (c1, c2) VALUES (7.89, 10.11);
UPDATE t1 SET c2 = 12.34 WHERE c1 = 7.89;
DELETE FROM t1 WHERE c1 = 1.23;
select * from mv1 order by c1;
c1	cnt
7.89	1
select * from mv1 a,t1 b where a.c1=b.c1 order by a.c1;
c1	cnt	c1	c2
7.89	1	7.89	12.34
##blob
DROP MATERIALIZED VIEW LOG ON t1;
drop table t1;
drop materialized view mv1;
create table t1 (c1 blob(20) , c2 blob(20));
create materialized view log on t1 parallel 9 with PRIMARY KEY,rowid,sequence(c1,c2) including new values ;
##ENUM
drop materialized view log on t1;
drop table t1;
create table t1 (c1 ENUM('中文ing123','蘩騠字','蘩騠字ss'), c2 ENUM('null','@!#%$','kasdhka'));
create materialized view log on t1 parallel 9 with rowid, sequence (c1) including new values;
create materialized view mv1  parallel 9 refresh fast on demand enable on query  computation as select c1 as c1, count(*) cnt from t1 group by c1;
ERROR 0A000: on query computation mview use enum type not supported
##TEXT
DROP MATERIALIZED VIEW LOG ON t1;
drop table t1;
create table t1 (c1 TEXT, c2 TEXT);
create materialized view log on t1 parallel 9 with rowid, sequence (c1) including new values;
##set
drop materialized view log on t1;
drop table t1;
create table t1 (c1 set('中文ing123','蘩騠字','蘩騠字ss'), c2 set('null','@!#%$','kasdhka'));
create materialized view log on t1 parallel 9 with rowid, sequence (c1) including new values;
create materialized view mv1  parallel 9 refresh fast on demand enable on query  computation as select c1 as c1, count(*) cnt from t1 group by c1;
ERROR 0A000: on query computation mview use enum type not supported
##json
DROP MATERIALIZED VIEW LOG ON t1;
drop table t1;
create table t1 (c1 json, c2 json);
create materialized view log on t1 parallel 9 with rowid, sequence (c1) including new values;
##连接类型为枚举类型
drop materialized view log on t1;
drop table t1;
create table t1 (c1 ENUM('中文ing123','蘩騠字','蘩騠字ss'), c2 ENUM('null','@!#%$','kasdhka'),c3 varchar(20) primary key);
create materialized view log on t1 parallel 9 with rowid, sequence(c1,c2)  including new values;
create materialized view mv1  parallel 9 refresh fast on demand enable on query  computation as select a.c3 as ac3, b.c3 as bc3 from t1 a,t1 b where a.c1=b.c3;
ERROR 0A000: on query computation mview use enum type not supported
##多数据类型验证
DROP MATERIALIZED VIEW LOG ON t1;
drop table t1;
CREATE TABLE t1 (
c1 INT PRIMARY KEY,
c2 INT,
c3 FLOAT,
c4 DECIMAL(10, 2),
c5 CHAR(100),
c6 VARCHAR(500),
c7 DATE,
c8 ENUM('中文ing123','蘩騠字','蘩騠字ss'),
c9 year,
c10 json ,
c11 bit
);
INSERT INTO t1 VALUES (1, 100, 3.14, 1234.56, 'Sample Text', 'Variable Length Text', '2023-10-01', '中文ing123', 2024, '{"key": "value"}', b'1');
INSERT INTO t1 VALUES (3, 0, 1.618, 0.00, 'Empty Char', 'Longest String Possible Within Limit', '1999-12-31', '蘩騠字ss', 1998, 'null', b'1');
create materialized view log on t1 parallel 9 with PRIMARY KEY,rowid,sequence(c2,c3,c4,c6,c7) including new values ;
create materialized view mv1  parallel 9 refresh fast on demand enable on query  computation as select sum(c2 * c3) sum_c, count(c2 * c3) count, count(*) as c, c6 from t1 group by c6;
update t1 set c3 =9.99 where c1 = 1;
delete from t1 where c1=3;
INSERT INTO t1  VALUES (2, -200, 5.2, 9876.54, 'AnhSle', 'Shorter String', '2022-01-01', '蘩騠字', 2023, '{"another": {"nested": "object"}}', b'1');
select * from mv1 order by c6;
sum_c	count	c	c6
-1039.9999618530273	1	1	Shorter String
998.9999771118164	1	1	Variable Length Text
select * from mlog$_t1 order by c2;
c1	c2	c3	c4	c6	c7	SEQUENCE$$	DMLTYPE$$	OLD_NEW$$
2	-200	5.2	9876.54	Shorter String	2022-01-01	4	I	N
3	0	1.618	0.00	Longest String Possible Within Limit	1999-12-31	3	D	O
1	100	3.14	1234.56	Variable Length Text	2023-10-01	1	U	O
1	100	9.99	1234.56	Variable Length Text	2023-10-01	2	U	N
select * from mv1 a,t1 b where a.c6=b.c6 order by sum_c;
sum_c	count	c	c6	c1	c2	c3	c4	c5	c6	c7	c8	c9	c10	c11
-1039.9999618530273	1	1	Shorter String	2	-200	5.2	9876.54	AnhSle	Shorter String	2022-01-01	蘩騠字	2023	{"another": {"nested": "object"}}	
998.9999771118164	1	1	Variable Length Text	1	100	9.99	1234.56	Sample Text	Variable Length Text	2023-10-01	中文ing123	2024	{"key": "value"}	
########清空回收站，删除测试数据库，表等 ##########
drop database  IF EXISTS db1;
purge recyclebin;
