drop database  IF EXISTS  db1;
create database db1;
use db1;
SET wait_timeout=30000000;
SET ob_trx_timeout = 30000000;
SET ob_query_timeout = 30000000;
##设置相同sql_mode;
SET @@sql_mode='';
##增量刷新验证
create table t1(c1 int primary key, c2 int, c3 int, c4 int);
create table t2(c1 int, c2 int, c3 int, c4 int);
insert into t1 values(1,1,1,1);
insert into t2 values(1,1,1,1);
create materialized view log on t1 with primary key, rowid, sequence (c2, c3) including new values;
create materialized view log on t2 with primary key, rowid, sequence (c2, c3) including new values;
create materialized view t1_mv1 refresh fast on demand enable on query  computation as select c2 as c2, count(*) cnt, count(c3) cnt_c3, avg(c3) avg_c3, avg(c3) * sum(c3)/c2 calc1, c2+sum(c3) calc2 from t1 group by c2;
ERROR HY000: cannot ENABLE ON QUERY COMPUTATION for the materialized view t1_mv1: a standalone sum expression is required in the select item list when using expressions that derive from that sum operation
create materialized view t1_mv1 refresh fast on demand enable on query  computation as select c2 as c2, count(*) cnt, avg(c3) avg_c3, avg(c3) * sum(c3)/c2 calc1, c2+sum(c3) calc2 from t1 group by c2;
ERROR HY000: cannot ENABLE ON QUERY COMPUTATION for the materialized view t1_mv1: when using sum/avg/stddev/variance functions, a standalone count function of the corresponding column is required in the select item list
create materialized view t1_mv1 refresh fast on demand enable on query  computation as select c2 as c2, count(*) cnt, count(c4) cnt_c4, sum(c3) sum_c3 from t1 group by c2;
ERROR HY000: cannot ENABLE ON QUERY COMPUTATION for the materialized view t1_mv1: column c4 of table t1 used in mv is required in the corresponding mlog table
create materialized view t1_mv1 refresh fast on demand enable on query  computation as select c4 as c4, count(*) cnt, count(c3) cnt_c3, sum(c3) sum_c3 from t1 group by c4;
ERROR HY000: cannot ENABLE ON QUERY COMPUTATION for the materialized view t1_mv1: column c4 of table t1 used in mv is required in the corresponding mlog table
create materialized view t1_mv1 refresh fast on demand enable on query  computation as select c2 as c2, count(*) cnt, count(c3) cnt_c3, sum(c3) sum_c3 from t1 group by c2;
create materialized view t1_mv2 refresh fast on demand enable on query  computation as select count(*) cnt, count(c3) cnt_c3, sum(c3) sum_c3 from t1;
create materialized view t1_mv3 refresh fast on demand enable on query  computation as select count(c3) cnt_c3, sum(c3) sum_c3 from t1;
create materialized view t1_mv4 refresh fast on demand enable on query  computation as select c2 as c2, c3 as c3, count(*) cnt, count(c3) cnt_c3, sum(c3) sum_c3 from t1 group by c2, c3;
create materialized view t1_mv5 refresh fast on demand enable on query  computation as select c2 as c2, count(*) cnt, count(c3) cnt_c3, sum(c3) sum_c3, avg(c3) avg_c3, avg(c3) * sum(c3)/c2 calc1, c2+sum(c3) calc2 from t1 group by c2;
insert into t1 values(2,2,3,4);
insert into t1 values(3,2,3,4);
insert into t1 values(4,2,3,4);
insert into t1 values(5,2,3,4);
CALL DBMS_MVIEW.REFRESH('t1_mv1','f');
CALL DBMS_MVIEW.REFRESH('t1_mv2','f');
CALL DBMS_MVIEW.REFRESH('t1_mv3','f');
CALL DBMS_MVIEW.REFRESH('t1_mv4','f');
CALL DBMS_MVIEW.REFRESH('t1_mv5','f');
select * from t1_mv1 order by c2;
c2	cnt	cnt_c3	sum_c3
1	1	1	1
2	4	4	12
select * from t1_mv2;
cnt	cnt_c3	sum_c3
5	5	13
select * from t1_mv3;
cnt_c3	sum_c3
5	13
select * from t1_mv4 order by c2;
c2	c3	cnt	cnt_c3	sum_c3
1	1	1	1	1
2	3	4	4	12
select * from t1_mv5 order by c2;
c2	cnt	cnt_c3	sum_c3	avg_c3	calc1	calc2
1	1	1	1	1.0000	1.00000000	2
2	4	4	12	3.0000	18.00000000	14
DROP MATERIALIZED VIEW LOG ON t1;
DROP MATERIALIZED VIEW LOG ON t2;
drop table t1;
drop table t2;
drop materialized view t1_mv1;
drop materialized view t1_mv2;
drop materialized view t1_mv3;
drop materialized view t1_mv4;
drop materialized view t1_mv5;
##针对空表进行验证
##物化视图中存在数据,进行刷新
##边界条件测试：测试在边界条件下的增量更新行为，例如测试在分区切换、分区维护、索引重建等情况下的表现。
##重复执行测试：多次执行增量更新操作，以确保在重复执行过程中不会出现数据重复、丢失或不一致的情况。
##dml操作验证
create table t1(c1 int primary key, c2 int, c3 int, c4 int);
create materialized view log on t1 parallel 9 with rowid, sequence (c2,c3,c4) including new values ;
create materialized view mv1 refresh fast on demand enable on query  computation  as select c2 as c2, count(*) cnt, count(c3) cnt_c3, sum(c3) sum_c3 from t1 group by c2;
insert into t1 values(2,3,3,4);
update t1 set c2 = 1 where c1=2;
select * from mv1;
c2	cnt	cnt_c3	sum_c3
1	1	1	3
delete from t1 where c1 =2;
select * from mv1;
c2	cnt	cnt_c3	sum_c3
DROP MATERIALIZED VIEW LOG ON t1;
drop table t1;
drop materialized view mv1;
create table t1(c1 number primary key, c2 number, c3 number, c4 number);
create materialized view log on t1 parallel 9 with rowid, sequence (c2,c3,c4) including new values ;
create materialized view mv1 refresh complete on demand enable on query  computation as select c2 as c2, count(*) cnt, count(c3) cnt_c3, sum(c3) sum_c3 from t1 group by c2;
insert into t1 values(2,3,3,4);
update t1 set c2 = 1 where c1=2;
select * from mv1;
c2	cnt	cnt_c3	sum_c3
1	1	1	3
delete from t1 where c1 =2;
select * from mv1;
c2	cnt	cnt_c3	sum_c3
##表中存在空值进行验证
DROP MATERIALIZED VIEW LOG ON t1;
drop table t1;
drop materialized view mv1;
create table t1(c1 number primary key, c2 number, c3 number, c4 number);
create materialized view log on t1 parallel 9 with rowid, sequence (c2,c3,c4) including new values ;
create materialized view mv1 refresh fast on demand enable on query  computation as select c2 as c2, count(*) cnt, count(c3) cnt_c3, sum(c3) sum_c3 from t1 group by c2;
##insert
insert into t1 values(2,null,3,4);
insert into t1 values(3,2,null,null);
insert into t1 values(4,2,null,4);
insert into t1 values(5,2,null,0);
##delete
delete from t1 where c3 is null;
select * from mv1;
c2	cnt	cnt_c3	sum_c3
NULL	1	1	3
select * from t1;
c1	c2	c3	c4
2	NULL	3	4
##重命名列
DROP MATERIALIZED VIEW LOG ON t1;
drop table t1;
drop materialized view mv1;
create table t1(c1 int primary key, c2 int, c3 int, c4 int);
create materialized view log on t1 parallel 9 with rowid, sequence (c2,c3,c4) including new values ;
create materialized view mv1 refresh fast on demand enable on query  computation as select c2 as c2, count(*) cnt, count(c3) cnt_c3, sum(c3) sum_c3 from t1 group by c2;
ALTER TABLE t1 RENAME COLUMN c1 TO new_c1;
ERROR 0A000: modify column to table with materialized view log is not supported
##重命名表
DROP MATERIALIZED VIEW LOG ON t1;
drop table t1;
drop materialized view mv1;
create table t1(c1 int primary key, c2 int, c3 int, c4 int);
create materialized view log on t1 parallel 9 with rowid, sequence (c2,c3,c4) including new values ;
create materialized view mv1 refresh fast on demand enable on query  computation as select c2 as c2, count(*) cnt, count(c3) cnt_c3, sum(c3) sum_c3 from t1 group by c2;
alter table t1 rename to t_t1;
ERROR 0A000: this alter table to table with materialized view log is not supported
##非空表验证
DROP MATERIALIZED VIEW LOG ON t1;
drop table t1;
drop materialized view mv1;
create table t1(c1 int primary key, c2 int, c3 int, c4 int);
insert into t1 values(2,2,3,4);
insert into t1 values(3,2,3,4);
insert into t1 values(4,2,3,4);
insert into t1 values(5,2,3,4);
create materialized view log on t1 parallel 9 with rowid, sequence (c2,c3,c4) including new values;
create materialized view mv1 refresh fast on demand enable on query  computation as select c2 as c2, count(*) cnt, count(c3) cnt_c3, sum(c3) sum_c3 from t1 group by c2;
select * from mv1 order by c2;
c2	cnt	cnt_c3	sum_c3
2	4	4	12
##增加外键索引
DROP MATERIALIZED VIEW LOG ON t1;
drop table t1;
drop materialized view mv1;
create table t1(c1 int primary key, c2 int, c3 int, c4 int);
insert into t1 values(2,2,3,4);
insert into t1 values(3,2,3,4);
insert into t1 values(4,2,3,4);
insert into t1 values(5,2,3,4);
create materialized view log on t1 parallel 9 with rowid, sequence (c2,c3,c4) including new values;
create materialized view mv1 refresh fast on demand enable on query  computation as select c2 as c2, count(*) cnt, count(c3) cnt_c3, sum(c3) sum_c3 from t1 group by c2;
alter table t1 add constraint fk_c2 foreign key(c2) references t1(c1);
CALL DBMS_MVIEW.REFRESH('mv1');
insert into t1 values(0,null,null,4);
CALL DBMS_MVIEW.REFRESH('mv1');
select * from mv1 order by c2;
c2	cnt	cnt_c3	sum_c3
NULL	1	0	NULL
2	4	4	12
select * from t1 order by c1;
c1	c2	c3	c4
0	NULL	NULL	4
2	2	3	4
3	2	3	4
4	2	3	4
5	2	3	4
##删除外键约束
DROP MATERIALIZED VIEW LOG ON t1;
DROP TABLE t1;
DROP MATERIALIZED VIEW mv1;
CREATE TABLE t1 (c1 number(10) primary key,c2 number(10), c3 number, c4 number,constraint fk_c2 foreign key(c2) references t1(c1));
insert into t1 values(2,2,3,4);
create materialized view log on t1 parallel 9 with rowid, sequence (c2,c4,c3) including new values;
create materialized view mv1 refresh fast on demand enable on query  computation as select c2 as c2, count(*) cnt, count(c3) cnt_c3, sum(c3) sum_c3 from t1 group by c2;
alter table  t1 drop constraint fk_c2;
insert into t1 values(0,null,null,4);
delete from t1 where c1 =2 ;
insert into t1 values(2,2,3,4);
select * from mv1 order by c2;
c2	cnt	cnt_c3	sum_c3
NULL	1	0	NULL
2	1	1	3
select * from t1 order by c1;
c1	c2	c3	c4
0	NULL	NULL	4
2	2	3	4
##创建唯一索引
DROP MATERIALIZED VIEW LOG ON t1;
DROP TABLE t1;
DROP MATERIALIZED VIEW mv1;
CREATE TABLE t1 (c1 number(10) ,c2 number(10), c3 number, c4 number);
insert into t1 values(1,2,3,4);
insert into t1 values(null,2,3,4);
create materialized view log on t1 parallel 9 with rowid, sequence (c1,c2,c4,c3) including new values;
create materialized view mv1 refresh fast on demand enable on query  computation as select c2 as c2, count(*) cnt, count(c3) cnt_c3, sum(c3) sum_c3 from t1 group by c2;
CREATE UNIQUE INDEX index_name ON mv1 (cnt);
insert into t1 values(2,2,3,4);
insert into t1 values(null,null,null,null);
select * from mv1 order by cnt;
c2	cnt	cnt_c3	sum_c3
NULL	1	0	NULL
2	3	3	9
##创建普通索引
DROP MATERIALIZED VIEW LOG ON t1;
DROP TABLE t1;
DROP MATERIALIZED VIEW mv1;
CREATE TABLE t1 (c1 int ,c2 int, c3 int, c4 int);
insert into t1 values(1,2,3,4);
create materialized view log on t1 parallel 9 with rowid, sequence (c1,c2,c4,c3) including new values;
create materialized view mv1 refresh fast on demand enable on query  computation as select c2 as c2, count(*) cnt, count(c3) cnt_c3, sum(c3) sum_c3 from t1 group by c2;
CREATE  INDEX index_name ON mv1 (c2);
insert into t1 values(2,2,3,4);
select * from mv1 order by c2;
c2	cnt	cnt_c3	sum_c3
2	2	2	6
select * from t1 order by c1;
c1	c2	c3	c4
1	2	3	4
2	2	3	4
##创建函数索引  
DROP MATERIALIZED VIEW LOG ON t1;
DROP TABLE t1;
DROP MATERIALIZED VIEW mv1;
CREATE TABLE t1 (c1 int ,c2 int, c3 int, c4 int);
insert into t1 values(1,2,3,4);
create materialized view log on t1 parallel 9 with rowid, sequence (c1,c2,c4,c3) including new values;
create materialized view mv1 refresh fast on demand enable on query  computation as select c2 as c2, count(*) cnt, count(c3) cnt_c3, sum(c3) sum_c3 from t1 group by c2;
CREATE INDEX idx_name_abscase ON t1 ((abs(c2)));
CREATE INDEX idx_name_abscase1 ON mv1 ((abs(c2)));
ERROR 0A000: use functional index on materialized view not supported
insert into t1 values(2,2,3,4);
CALL DBMS_MVIEW.REFRESH('mv1','f');
select * from mv1 order by c2;
c2	cnt	cnt_c3	sum_c3
2	2	2	6
select * from t1 order by c1;
c1	c2	c3	c4
1	2	3	4
2	2	3	4
##创建前缀索引
DROP MATERIALIZED VIEW LOG ON t1;
DROP TABLE t1;
DROP MATERIALIZED VIEW mv1;
CREATE TABLE t1 (c1 char(10) ,c2 int, c3 int, c4 int);
insert into t1 values(1,2,3,4);
create materialized view log on t1 parallel 9 with rowid, sequence (c1,c2,c4,c3) including new values;
create materialized view mv1 refresh fast on demand enable on query  computation as select c2 as c2, count(*) cnt, count(c3) cnt_c3, sum(c3) sum_c3 from t1 group by c2;
CREATE INDEX idx_name ON t1 (c1(4));
insert into t1 values('aass',2,3,4);
CALL DBMS_MVIEW.REFRESH('mv1');
select * from mv1 order by c2;
c2	cnt	cnt_c3	sum_c3
2	2	2	6
select * from t1 order by c1;
c1	c2	c3	c4
1	2	3	4
aass	2	3	4
##删除mlog后重建
DROP MATERIALIZED VIEW LOG ON t1;
DROP TABLE t1;
DROP MATERIALIZED VIEW mv1;
CREATE TABLE t1 (c1 number(10) primary key,c2 number(10), c3 number, c4 number,constraint fk_c2 foreign key(c2) references t1(c1));
create materialized view log on t1 parallel 9 with rowid, sequence (c2,c4,c3) including new values;
create materialized view mv1 refresh fast on demand enable on query  computation as select c2 as c2, count(*) cnt, count(c3) cnt_c3, sum(c3) sum_c3 from t1 group by c2;
insert into t1 values(2,2,3,4);
insert into t1 values(3,2,3,4);
insert into t1 values(4,2,3,4);
insert into t1 values(5,2,3,4);
DROP MATERIALIZED VIEW LOG ON t1;
create materialized view log on t1 parallel 9 with rowid, sequence (c2,c4,c3) including new values;
CALL DBMS_MVIEW.REFRESH('mv1','c');
CALL DBMS_MVIEW.REFRESH('mv1','f');
select * from mv1;
c2	cnt	cnt_c3	sum_c3
2	4	4	12
select * from t1 order by c1;
c1	c2	c3	c4
2	2	3	4
3	2	3	4
4	2	3	4
5	2	3	4
##删除mlog和基表后重建 
##issue：
DROP MATERIALIZED VIEW LOG ON t1;
DROP TABLE t1;
DROP MATERIALIZED VIEW mv1;
CREATE TABLE t1 (c1 number(10) primary key,c2 number(10), c3 number, c4 number,constraint fk_c2 foreign key(c2) references t1(c1));
create materialized view log on t1 parallel 9 with rowid, sequence (c2,c4,c3) including new values;
create materialized view mv1 refresh fast on demand enable on query  computation  as select c2 as c2, count(*) cnt, count(c3) cnt_c3, sum(c3) sum_c3 from t1 group by c2;
insert into t1 values(2,2,3,4);
insert into t1 values(3,2,3,4);
insert into t1 values(4,2,3,4);
insert into t1 values(5,2,3,4);
DROP MATERIALIZED VIEW LOG ON t1;
DROP TABLE t1;
CREATE TABLE t1 (c1 number(10) primary key,c2 number(10), c3 number, c4 number,constraint fk_c2 foreign key(c2) references t1(c1));
create materialized view log on t1 parallel 9 with rowid, sequence (c2,c4,c3) including new values;
insert into t1 values(2,2,3,4);
insert into t1 values(3,2,3,4);
insert into t1 values(4,2,3,4);
insert into t1 values(5,2,3,4);
CALL DBMS_MVIEW.REFRESH('mv1','c');
CALL DBMS_MVIEW.REFRESH('mv1','f');
select * from mv1;
c2	cnt	cnt_c3	sum_c3
2	4	4	12
select * from t1 order by c1;
c1	c2	c3	c4
2	2	3	4
3	2	3	4
4	2	3	4
5	2	3	4
##删除mlog,基表,mv后重建 
DROP MATERIALIZED VIEW LOG ON t1;
DROP TABLE t1;
DROP MATERIALIZED VIEW mv1;
CREATE TABLE t1 (c1 number(10) primary key,c2 number(10), c3 number, c4 number,constraint fk_c2 foreign key(c2) references t1(c1));
create materialized view log on t1 parallel 9 with rowid, sequence (c2,c4,c3) including new values;
create materialized view mv1 refresh fast on demand enable on query  computation  as select c2 as c2, count(*) cnt, count(c3) cnt_c3, sum(c3) sum_c3 from t1 group by c2;
insert into t1 values(2,2,3,4);
insert into t1 values(3,2,3,4);
insert into t1 values(4,2,3,4);
insert into t1 values(5,2,3,4);
DROP MATERIALIZED VIEW LOG ON t1;
DROP TABLE t1;
DROP MATERIALIZED VIEW mv1;
CREATE TABLE t1 (c1 number(10) primary key,c2 number(10), c3 number, c4 number,constraint fk_c2 foreign key(c2) references t1(c1));
create materialized view log on t1 parallel 9 with rowid, sequence (c2,c4,c3) including new values;
create materialized view mv1 refresh fast on demand enable on query  computation  as select c2 as c2, count(*) cnt, count(c3) cnt_c3, sum(c3) sum_c3 from t1 group by c2;
insert into t1 values(2,2,3,4);
insert into t1 values(3,2,3,4);
insert into t1 values(4,2,3,4);
insert into t1 values(5,2,3,4);
select * from mv1;
c2	cnt	cnt_c3	sum_c3
2	4	4	12
select * from t1 order by c1;
c1	c2	c3	c4
2	2	3	4
3	2	3	4
4	2	3	4
5	2	3	4
##删除mv后重建 
DROP MATERIALIZED VIEW LOG ON t1;
DROP TABLE t1;
DROP MATERIALIZED VIEW mv1;
CREATE TABLE t1 (c1 number(10) primary key,c2 number(10), c3 number, c4 number,constraint fk_c2 foreign key(c2) references t1(c1));
create materialized view log on t1 parallel 9 with rowid, sequence (c2,c4,c3) including new values;
create materialized view mv1 refresh fast on demand enable on query  computation  as select c2 as c2, count(*) cnt, count(c3) cnt_c3, sum(c3) sum_c3 from t1 group by c2;
insert into t1 values(2,2,3,4);
insert into t1 values(3,2,3,4);
insert into t1 values(4,2,3,4);
insert into t1 values(5,2,3,4);
DROP MATERIALIZED VIEW mv1;
create materialized view mv1 refresh fast on demand enable on query  computation  as select c2 as c2, count(*) cnt, count(c3) cnt_c3, sum(c3) sum_c3 from t1 group by c2;
select * from mv1;
c2	cnt	cnt_c3	sum_c3
2	4	4	12
select * from t1 order by c1;
c1	c2	c3	c4
2	2	3	4
3	2	3	4
4	2	3	4
5	2	3	4
##删除指定行
DROP MATERIALIZED VIEW LOG ON t1;
DROP TABLE t1;
DROP MATERIALIZED VIEW mv1;
CREATE TABLE t1 (c1 number(10) primary key,c2 number(10), c3 number, c4 number,constraint fk_c2 foreign key(c2) references t1(c1));
create materialized view log on t1 parallel 9 with rowid, sequence (c2,c4,c3) including new values;
create materialized view mv1 refresh fast on demand enable on query  computation  as select c1 as c1, count(*) cnt, count(c3) cnt_c3, sum(c3) sum_c3 from t1 group by c1;
insert into t1 values(2,2,3,4);
insert into t1 values(3,2,3,4);
insert into t1 values(4,2,3,4);
insert into t1 values(5,2,3,4);
insert into t1 values(6,null,3,4);
select * from mv1 order by c1;
c1	cnt	cnt_c3	sum_c3
2	1	1	3
3	1	1	3
4	1	1	3
5	1	1	3
6	1	1	3
select * from t1 order by c1;
c1	c2	c3	c4
2	2	3	4
3	2	3	4
4	2	3	4
5	2	3	4
6	NULL	3	4
delete from t1 where c2 is null;
select * from mv1 order by c1;
c1	cnt	cnt_c3	sum_c3
2	1	1	3
3	1	1	3
4	1	1	3
5	1	1	3
select * from t1 order by c1;
c1	c2	c3	c4
2	2	3	4
3	2	3	4
4	2	3	4
5	2	3	4
##更新指定行
DROP MATERIALIZED VIEW LOG ON t1;
DROP TABLE t1;
DROP MATERIALIZED VIEW mv1;
CREATE TABLE t1 (c1 number(10) primary key,c2 number(10), c3 number, c4 number,constraint fk_c2 foreign key(c2) references t1(c1));
create materialized view log on t1 parallel 9 with rowid, sequence (c2,c4,c3) including new values;
create materialized view mv1 refresh fast on demand enable on query  computation  as select c2 as c2, count(*) cnt, count(c3) cnt_c3, sum(c3) sum_c3 from t1 group by c2;
insert into t1 values(2,2,3,4);
insert into t1 values(3,2,3,4);
insert into t1 values(4,2,3,4);
insert into t1 values(5,2,3,4);
insert into t1 values(6,null,3,4);
select * from mv1 order by c2;
c2	cnt	cnt_c3	sum_c3
NULL	1	1	3
2	4	4	12
select * from t1 order by c2;
c1	c2	c3	c4
6	NULL	3	4
2	2	3	4
3	2	3	4
4	2	3	4
5	2	3	4
update t1 set c2 =abs(-3) where c2 is null;
select * from mv1 order by c2;
c2	cnt	cnt_c3	sum_c3
2	4	4	12
3	1	1	3
select * from t1 order by c2;
c1	c2	c3	c4
2	2	3	4
3	2	3	4
4	2	3	4
5	2	3	4
6	3	3	4
##创建存在虚拟列的mv
DROP MATERIALIZED VIEW LOG ON t1;
DROP TABLE t1;
DROP MATERIALIZED VIEW mv1;
CREATE TABLE t1 (
c1 INT,
c2 VARCHAR(50),
c3 VARCHAR(50),
c2_c3 VARCHAR(100) AS (CONCAT(c2, ' ', c3)) VIRTUAL
);
insert into t1(c1,c2,c3) values(11,'zhongwen','中文');
create materialized view log on t1 parallel 9 with rowid, sequence (c1,c2,c3) including new values;
create materialized view mv1 refresh fast on demand enable on query  computation  as select c2_c3 as c2_c3, count(*) cnt, count(c2_c3) cnt_c23 from t1 group by c2_c3;
ERROR HY000: cannot ENABLE ON QUERY COMPUTATION for the materialized view mv1: column c2_c3 of table t1 used in mv is required in the corresponding mlog table
##创建使用存储列的mv
DROP MATERIALIZED VIEW LOG ON t1;
DROP TABLE t1;
CREATE TABLE t1 (
c1 INT,
c2 VARCHAR(50),
c3 VARCHAR(50),
c2_c3 VARCHAR(100) AS (CONCAT(c2, ' ', c3)) STORED
);
insert into t1(c1,c2,c3) values(11,'zhongwen','中文');
create materialized view log on t1 parallel 9 with rowid, sequence (c1,c2,c3) including new values;
create materialized view mv1 refresh fast on demand enable on query  computation  as select c2_c3 as c2_c3, count(*) cnt, count(c2_c3) cnt_c23 from t1 group by c2_c3;
ERROR HY000: cannot ENABLE ON QUERY COMPUTATION for the materialized view mv1: column c2_c3 of table t1 used in mv is required in the corresponding mlog table
##边界值验证
##字符类型的边界值
DROP MATERIALIZED VIEW LOG ON t1;
DROP TABLE t1;
CREATE TABLE t1 (c1 char(10) primary key,c2 char(10), c3 char(20), c4 char(20));
insert into t1 values('ab','中文','123','中文ing123');
create materialized view log on t1 parallel 9 with rowid, sequence (c2,c4,c3) including new values;
create materialized view mv1 refresh fast on demand enable on query  computation  as select c1 as c1, count(*) cnt, count(c3) cnt_c3, sum(c3) sum_c3 from t1 group by c1;
insert into t1 values(lpad('a',10,'b'),lpad('a',10,'b'),lpad('3',2,'1'),lpad('a',20,'b'));
select * from mv1 order by c1;
c1	cnt	cnt_c3	sum_c3
ab	1	1	123
bbbbbbbbba	1	1	13
select * from t1 order by c1;
c1	c2	c3	c4
ab	中文	123	中文ing123
bbbbbbbbba	bbbbbbbbba	13	bbbbbbbbbbbbbbbbbbba
##空值验证
DROP MATERIALIZED VIEW LOG ON t1;
DROP TABLE t1;
DROP MATERIALIZED VIEW mv1;
CREATE TABLE t1 (c1 number ,c2 char(10), c3 char(20), c4 char(20));
create materialized view log on t1 parallel 9 with rowid, sequence (c1,c2,c4,c3) including new values;
create materialized view mv1 refresh fast on demand enable on query  computation  as select c1 as c1, count(*) cnt, count(c3) cnt_c3 from t1 group by c1;
insert into t1 values(1,lpad('a',10,'b'),lpad('a',20,'b'),lpad('a',20,'b'));
insert into t1 values(null,null,lpad('a',20,null),lpad('a',20,null));
select * from mv1 order by c1;
c1	cnt	cnt_c3
NULL	1	0
1	1	1
select * from t1 order by c1;
c1	c2	c3	c4
NULL	NULL	NULL	NULL
1	bbbbbbbbba	bbbbbbbbbbbbbbbbbbba	bbbbbbbbbbbbbbbbbbba
##重复值验证
DROP MATERIALIZED VIEW LOG ON t1;
DROP TABLE t1;
DROP MATERIALIZED VIEW mv1;
CREATE TABLE t1 (c1 number ,c2 char(10), c3 char(20), c4 char(20));
insert into t1 values(null,'null','null',null);
create materialized view log on t1 parallel 9 with rowid, sequence (c1,c2,c4,c3) including new values;
create materialized view mv1 refresh fast on demand enable on query  computation  as select c1 as c1, count(*) cnt, count(c3) cnt_c3 from t1 group by c1;
insert into t1 values(1,lpad('a',10,'b'),lpad('a',20,'b'),lpad('a',20,'b'));
insert into t1 values(1,lpad('a',10,'b'),lpad('a',20,'b'),lpad('a',20,'b'));
CALL DBMS_MVIEW.REFRESH('mv1','f');
select * from mv1 order by c1;
c1	cnt	cnt_c3
NULL	1	1
1	2	2
delete from t1 where c1 is not null;
##异常情况验证
DROP MATERIALIZED VIEW LOG ON t1;
DROP TABLE t1;
DROP MATERIALIZED VIEW mv1;
CREATE TABLE t1 (c1 number ,c2 char(10) default 'zhongwen', c3 char(20), c4 char(20));
create materialized view log on t1 parallel 9 with rowid, sequence (c1,c2,c4,c3) including new values;
create materialized view mv1 refresh fast on demand enable on query  computation as select c1 as c1, count(*) cnt, count(c3) cnt_c3 from t1 group by c1;
insert into t1 values(null,null,lpad('a',22,''),lpad('a',22,''));
insert into t1(c1,c3) values(99,'true');
select * from mv1 order by c1;
c1	cnt	cnt_c3
NULL	1	0
99	1	1
select * from t1 order by c1;
c1	c2	c3	c4
NULL	NULL	NULL	NULL
99	zhongwen	true	NULL
##基表存在约束验证
##主键约束
DROP MATERIALIZED VIEW LOG ON t1;
DROP TABLE t1;
DROP MATERIALIZED VIEW mv1;
CREATE TABLE t1 (c1 number primary key,c2 char(10) default 'zhongwen', c3 char(20), c4 char(20));
insert into t1 values(1,'null','null',null);
insert into t1 values(2,'null','null',null);
create materialized view log on t1 parallel 9 with rowid, sequence (c2,c4,c3) including new values;
create materialized view mv1 refresh fast on demand enable on query  computation  as select c1 as c1, count(*) cnt, count(c3) cnt_c3 from t1 group by c1;
insert into t1 values('1',null,lpad('a',-1,'1'),lpad('a',20,'1'));
ERROR 23000: Duplicate entry '1' for key 'PRIMARY'
select ROUND(min(cnt),5) from mv1;
ROUND(min(cnt),5)
1
select * from t1 order by c1;
c1	c2	c3	c4
1	null	null	NULL
2	null	null	NULL
##唯一约束
DROP MATERIALIZED VIEW LOG ON t1;
DROP TABLE t1;
DROP MATERIALIZED VIEW mv1;
CREATE TABLE t1 (c1 number ,c2 char(10) default 'zhongwen', c3 char(20), c4 char(20),UNIQUE (c1, c2));
insert into t1 values(1,'null','null',null);
insert into t1 values(2,'null','null',null);
create materialized view log on t1 parallel 9 with rowid, sequence (c1,c2,c4,c3) including new values;
create materialized view mv1 refresh fast on demand enable on query  computation  as select c1 as c1, count(*) cnt, count(c3) cnt_c3 from t1 group by c1;
insert into t1 values(2,'null','null',null);
ERROR 23000: Duplicate entry '2-null' for key 'c1'
select * from mv1 order by c1;
c1	cnt	cnt_c3
1	1	1
2	1	1
select * from t1 order by c1;
c1	c2	c3	c4
1	null	null	NULL
2	null	null	NULL
##not null
DROP MATERIALIZED VIEW LOG ON t1;
DROP TABLE t1;
DROP MATERIALIZED VIEW mv1;
CREATE TABLE t1 (c1 number not null ,c2 char(10) default 'zhongwen', c3 char(20), c4 char(20));
insert into t1 values(1,'zhongwen','中文','中文ing12');
create materialized view log on t1 parallel 9 with rowid, sequence (c1,c2,c4,c3) including new values;
create materialized view mv1 refresh fast on demand enable on query  computation  as select c1 as c1, count(*) cnt, count(c3) cnt_c3 from t1 group by c1;
insert into t1 values(lpad('',null,'1'),'null','null',null);
ERROR 23000: Column 'c1' cannot be null
select * from mv1;
c1	cnt	cnt_c3
1	1	1
select * from t1;
c1	c2	c3	c4
1	zhongwen	中文	中文ing12
##check
DROP MATERIALIZED VIEW LOG ON t1;
DROP TABLE t1;
DROP MATERIALIZED VIEW mv1;
CREATE TABLE t1 (c1 number check (c1>10 and c1<100) ,c2 char(10) default 'zhongwen', c3 char(20), c4 char(20));
insert into t1 values(11,'zhongwen','中文','中文ing12');
create materialized view log on t1 parallel 9 with rowid, sequence (c1,c2,c4,c3) including new values;
create materialized view mv1 refresh fast on demand enable on query  computation  as select c1 as c1, count(*) cnt, count(c3) cnt_c3 from t1 group by c1;
insert into t1 values(lpad('1',2,'1'),'null','null',null);
select * from mv1;
c1	cnt	cnt_c3
11	2	2
select * from t1 order by c2;
c1	c2	c3	c4
11	null	null	NULL
11	zhongwen	中文	中文ing12
##FOREIGN KEY
DROP MATERIALIZED VIEW LOG ON t1;
DROP TABLE t1;
DROP MATERIALIZED VIEW mv1;
CREATE TABLE t1 (c1 number(10) primary key,c2 number(10), c3 number, c4 number,constraint fk_c2 foreign key(c2) references t1(c1));
create materialized view log on t1 parallel 9 with rowid, sequence (c2,c4,c3) including new values;
create materialized view mv1 refresh fast on demand enable on query  computation as select c2 as c2, count(*) cnt, count(c2) cnt_c2, sum(c2) sum_c3 ,avg(c2) avg_c3  from t1 group by c2;
insert into t1 values(1,null,3,4);
insert into t1(c1,c3,c4) values(2,3,4);
insert into t1(c1,c3,c4) values(5,5,4);
insert into t1 values(-1,-1,3,4);
insert into t1 values(-321,-321,3,4);
insert into t1 values(0,0,3,4);
delete from t1 where c2 is null;
select * from mv1 order by c2;
c2	cnt	cnt_c2	sum_c3	avg_c3
-321	1	1	-321	-321.0000
-1	1	1	-1	-1.0000
0	1	1	0	0.0000
select * from t1 order by c2;
c1	c2	c3	c4
-321	-321	3	4
-1	-1	3	4
0	0	3	4
##基表join 暂不支持
DROP MATERIALIZED VIEW LOG ON t1;
DROP TABLE t1;
DROP MATERIALIZED VIEW mv1;
CREATE TABLE t1 (c1 number(10) primary key,c2 number(10), c3 number, c4 number,constraint fk_c2 foreign key(c2) references t1(c1));
CREATE TABLE t2 (a1 number(10) primary key,a2 number(10), a3 number, a4 number,constraint fk_a2 foreign key(a2) references t2(a1));
create materialized view log on t1 parallel 9 with rowid, sequence (c2,c4,c3) including new values;
create materialized view log on t2 parallel 9 with rowid, sequence (a2,a4,a3) including new values;
create materialized view mv1 refresh fast start with sysdate() + interval 1 second next sysdate() + interval 10 second as select c2 as c2, count(*) cnt, count(c2) cnt_c2  from t1,t2  group by c2;
##验证多个mv连接
DROP MATERIALIZED VIEW LOG ON t1;
DROP TABLE t1;
DROP MATERIALIZED VIEW mv1;
CREATE TABLE t1 (c1 number(10) ,c2 number(10), c3 number, c4 number);
create materialized view log on t1 parallel 9 with rowid, sequence (c1,c2,c4,c3) including new values;
create materialized view mv1 parallel 9 refresh fast on demand enable on query  computation as select c2 as c2, count(*) cnt, count(c2) cnt_c2, sum(c2) sum_c3 ,avg(c2) avg_c3  from t1 group by c2;
create materialized view mv2 parallel 9 refresh fast on demand enable on query  computation as select c2 as c2, count(*) cnt, count(c2) cnt_c2, sum(c2) sum_c3 ,avg(c2) avg_c3  from t1 group by c2;
insert into t1 values(2,2,3,4);
insert into t1 values(3,2,3,4);
insert into t1 values(4,2,3,4);
insert into t1 values(5,2,3,4);
insert into t1 values(6,2,3,4);
insert into t1 values(7,2,3,4);
insert into t1 values(8,null,3,4);
insert into t1 values(0,0,3,4);
select * from mv1 order by c2;
c2	cnt	cnt_c2	sum_c3	avg_c3
NULL	1	0	NULL	NULL
0	1	1	0	0.0000
2	6	6	12	2.0000
select * from mv2 order by c2;
c2	cnt	cnt_c2	sum_c3	avg_c3
NULL	1	0	NULL	NULL
0	1	1	0	0.0000
2	6	6	12	2.0000
select max(c2),min(c2),sum(c2),avg(c2),count(c2) from mv2;
max(c2)	min(c2)	sum(c2)	avg(c2)	count(c2)
2	0	2	1.0000	2
select mv1.CNT from mv1 inner join mv2 on mv1.avg_c3=mv2.c2 where mv2.c2 in (select c2 from mv2)  order by cnt;
CNT
1
6
##多个mv共享一个mlog
DROP MATERIALIZED VIEW LOG ON t1;
DROP TABLE t1;
DROP MATERIALIZED VIEW mv1;
DROP MATERIALIZED VIEW mv2;
CREATE TABLE t1 (c1 number(10) primary key,c2 number(10), c3 number, c4 number,constraint fk_c2 foreign key(c2) references t1(c1));
create materialized view log on t1 parallel 9 with rowid, sequence (c2,c4,c3) including new values;
create materialized view mv1 parallel 9 refresh fast on demand enable on query  computation as select c2 as c2, count(*) cnt, count(c2) cnt_c2, sum(c2) sum_c3 ,avg(c2) avg_c3  from t1 group by c2;
create materialized view mv2 parallel 9 refresh fast on demand enable on query  computation as select c2 as c2, count(*) cnt, count(c2) cnt_c2, sum(c2) sum_c3 ,avg(c2) avg_c3  from t1 group by c2;
create materialized view mv3 parallel 9 refresh fast on demand enable on query  computation as select c2 as c2, count(*) cnt, count(c2) cnt_c2, sum(c2) sum_c3 ,avg(c2) avg_c3  from t1 group by c2;
create materialized view mv4 parallel 9 refresh fast on demand enable on query  computation as select c2 as c2, count(*) cnt, count(c2) cnt_c2, sum(c2) sum_c3 ,avg(c2) avg_c3  from t1 group by c2;
create materialized view mv5 parallel 9 refresh fast on demand enable on query  computation as select c2 as c2, count(*) cnt, count(c2) cnt_c2, sum(c2) sum_c3 ,avg(c2) avg_c3  from t1 group by c2;
create materialized view mv6 parallel 9 refresh fast on demand enable on query  computation as select c2 as c2, count(*) cnt, count(c2) cnt_c2, sum(c2) sum_c3 ,avg(c2) avg_c3  from t1 group by c2;
create materialized view mv7 parallel 9 refresh fast on demand enable on query  computation as select c2 as c2, count(*) cnt, count(c2) cnt_c2, sum(c2) sum_c3 ,avg(c2) avg_c3  from t1 group by c2;
create materialized view mv8 parallel 9 refresh fast on demand enable on query  computation as select c2 as c2, count(*) cnt, count(c2) cnt_c2, sum(c2) sum_c3 ,avg(c2) avg_c3  from t1 group by c2;
create materialized view mv9 parallel 9 refresh fast on demand enable on query  computation as select c2 as c2, count(*) cnt, count(c2) cnt_c2, sum(c2) sum_c3 ,avg(c2) avg_c3  from t1 group by c2;
create materialized view mv10 parallel 9 refresh fast on demand enable on query  computation as select c2 as c2, count(*) cnt, count(c2) cnt_c2, sum(c2) sum_c3 ,avg(c2) avg_c3  from t1 group by c2;
create materialized view mv11 parallel 9 refresh fast on demand enable on query  computation as select c2 as c2, count(*) cnt, count(c2) cnt_c2, sum(c2) sum_c3 ,avg(c2) avg_c3  from t1 group by c2;
create materialized view mv12 parallel 9 refresh fast on demand enable on query  computation as select c2 as c2, count(*) cnt, count(c2) cnt_c2, sum(c2) sum_c3 ,avg(c2) avg_c3  from t1 group by c2;
create materialized view mv13 parallel 9 refresh fast on demand enable on query  computation as select c2 as c2, count(*) cnt, count(c2) cnt_c2, sum(c2) sum_c3 ,avg(c2) avg_c3  from t1 group by c2;
create materialized view mv14 parallel 9 refresh fast on demand enable on query  computation as select c2 as c2, count(*) cnt, count(c2) cnt_c2, sum(c2) sum_c3 ,avg(c2) avg_c3  from t1 group by c2;
create materialized view mv15 parallel 9 refresh fast on demand enable on query  computation as select c2 as c2, count(*) cnt, count(c2) cnt_c2, sum(c2) sum_c3 ,avg(c2) avg_c3  from t1 group by c2;
insert into t1 values(2,2,3,4);
insert into t1 values(3,2,3,4);
insert into t1 values(4,2,3,4);
insert into t1 values(5,2,3,4);
insert into t1 values(6,2,3,4);
insert into t1 values(7,2,3,4);
insert into t1 values(8,null,3,4);
insert into t1 values(0,0,3,4);
CALL DBMS_MVIEW.REFRESH('mv1','f');
select * from mlog$_t1 order by SEQUENCE$$;
c1	c2	c3	c4	SEQUENCE$$	DMLTYPE$$	OLD_NEW$$
2	2	3	4	1	I	N
3	2	3	4	2	I	N
4	2	3	4	3	I	N
5	2	3	4	4	I	N
6	2	3	4	5	I	N
7	2	3	4	6	I	N
8	NULL	3	4	7	I	N
0	0	3	4	8	I	N
##增量更新hash分区 
DROP MATERIALIZED VIEW LOG ON  t1;
drop table t1;
drop materialized view mv1;
create table t1 (c1 int primary key,c2 int, c3 int, c4 int) partition by hash(c1) partitions 5;
create materialized view log on t1 parallel 9 with rowid, sequence (c2,c3,c4) including new values;
create materialized view mv1 partition by hash(c1) partitions 10  refresh fast on demand enable on query  computation as select c1 as c1, count(*) cnt, count(c1) cnt_c1, sum(c1) sum_c1 ,avg(c1) avg_c1 from t1 group by c1;
insert into t1 values(8,null,3,4);
insert into t1 values(0,0,3,4);
delete from t1 where c2 is null ;
update t1 set c2=abs(-999) where c1=0;
select * from mv1;
c1	cnt	cnt_c1	sum_c1	avg_c1
0	1	1	0	0.0000
select * from t1;
c1	c2	c3	c4
0	999	3	4
##增量更新range分区 
DROP MATERIALIZED VIEW LOG ON  t1;
drop table t1;
drop materialized view mv1;
create table t1 (c1 int primary key,c2 int, c3 int, c4 int) ;
create materialized view log on t1 parallel 9 with rowid, sequence (c2,c3,c4) including new values;
create materialized view mv1 partition by range(c1) (PARTITION partition_1 VALUES LESS THAN (2), PARTITION partition_2 VALUES LESS THAN (4)) refresh fast on demand enable on query  computation as select c1 as c1, count(*) cnt, count(c1) cnt_c1, sum(c1) sum_c1 ,avg(c1) avg_c1 from t1 group by c1;
insert into t1 values(8,null,3,4);
insert into t1 values(0,0,3,4);
delete from t1 where c2 is null ;
update t1 set c2=abs(-999) where c1=0;
select * from mv1;
c1	cnt	cnt_c1	sum_c1	avg_c1
0	1	1	0	0.0000
select * from t1;
c1	c2	c3	c4
0	999	3	4
##增量更新list分区 
DROP MATERIALIZED VIEW LOG ON  t1;
drop table t1;
drop materialized view mv1;
create table t1 (c1 int primary key,c2 int, c3 int, c4 int) ;
create materialized view log on t1 parallel 9 with rowid, sequence (c2,c3,c4) including new values;
create materialized view mv1 partition by list(c1) (PARTITION p1 VALUES in(1,null,3),PARTITION p2 VALUES in(4,5)) refresh fast on demand enable on query  computation as select c1 as c1, count(*) cnt, count(c1) cnt_c1, sum(c1) sum_c1 ,avg(c1) avg_c1 from t1 group by c1;
##list分区中若不存在的值,刷新时报错4014;
insert into t1 values(1,2,3,4);
CALL DBMS_MVIEW.REFRESH('mv1');
select * from mv1;
c1	cnt	cnt_c1	sum_c1	avg_c1
1	1	1	1	1.0000
select * from t1;
c1	c2	c3	c4
1	2	3	4
##同时指定分区和并行度有语法错误
DROP MATERIALIZED VIEW LOG ON  t1;
drop table t1;
drop materialized view mv1;
create table t1 (c1 int primary key,c2 int, c3 int, c4 int) partition by hash(c1) partitions 5;
create materialized view log on t1 parallel 9 with rowid, sequence (c2,c3,c4) including new values;
create materialized view mv1 partition by hash(c1) partitions 10 parallel 9 refresh fast on demand enable on query  computation as select c1 as c1, count(*) cnt from t1 group by c1;
ERROR 42000: You have an error in your SQL syntax; check the manual that corresponds to your OceanBase version for the right syntax to use near 'parallel 9 refresh fast on demand enable on query  computation as select c1 as c' at line 1
########清空回收站，删除测试数据库，表等 ##########
drop database  IF EXISTS db1;
purge recyclebin;
