select cast('9.5' as signed int);
cast('9.5' as signed int)
9
Warnings:
Warning	1292	Truncated incorrect INTEGER value: '9.5'
select cast('-9.5' as signed int);
cast('-9.5' as signed int)
-9
Warnings:
Warning	1292	Truncated incorrect INTEGER value: '-9.5'
select cast('9.4' as signed int);
cast('9.4' as signed int)
9
Warnings:
Warning	1292	Truncated incorrect INTEGER value: '9.4'
select cast('-9.4' as signed int);
cast('-9.4' as signed int)
-9
Warnings:
Warning	1292	Truncated incorrect INTEGER value: '-9.4'
select cast(9.5 as signed int);
cast(9.5 as signed int)
10
select cast(-9.5 as signed int);
cast(-9.5 as signed int)
-10
select cast(9.4 as signed int);
cast(9.4 as signed int)
9
select cast(-9.4 as signed int);
cast(-9.4 as signed int)
-9
select cast('9223372036854775807' as signed int);
cast('9223372036854775807' as signed int)
9223372036854775807
select cast('9223372036854775807.4' as signed int);
cast('9223372036854775807.4' as signed int)
9223372036854775807
Warnings:
Warning	1292	Truncated incorrect INTEGER value: '9223372036854775807.4'
select cast('9223372036854775807.5' as signed int);
cast('9223372036854775807.5' as signed int)
9223372036854775807
Warnings:
Warning	1292	Truncated incorrect INTEGER value: '9223372036854775807.5'
select cast('9223372036854775808' as signed int);
cast('9223372036854775808' as signed int)
9223372036854775807
select cast(9223372036854775807 as signed int);
cast(9223372036854775807 as signed int)
9223372036854775807
select cast(9223372036854775807.4 as signed int);
cast(9223372036854775807.4 as signed int)
9223372036854775807
select cast(9223372036854775807.5 as signed int);
cast(9223372036854775807.5 as signed int)
9223372036854775807
select cast(9223372036854775808 as signed int);
cast(9223372036854775808 as signed int)
-9223372036854775808
select cast('-9223372036854775808' as signed int);
cast('-9223372036854775808' as signed int)
-9223372036854775808
select cast('-9223372036854775808.4' as signed int);
cast('-9223372036854775808.4' as signed int)
-9223372036854775808
Warnings:
Warning	1292	Truncated incorrect INTEGER value: '-9223372036854775808.4'
select cast('-9223372036854775808.5' as signed int);
cast('-9223372036854775808.5' as signed int)
-9223372036854775808
Warnings:
Warning	1292	Truncated incorrect INTEGER value: '-9223372036854775808.5'
select cast('-9223372036854775809' as signed int);
cast('-9223372036854775809' as signed int)
-9223372036854775808
select cast(-9223372036854775808 as signed int);
cast(-9223372036854775808 as signed int)
-9223372036854775808
select cast(-9223372036854775808.4 as signed int);
cast(-9223372036854775808.4 as signed int)
-9223372036854775808
select cast(-9223372036854775808.5 as signed int);
cast(-9223372036854775808.5 as signed int)
-9223372036854775808
select cast(-9223372036854775809 as signed int);
cast(-9223372036854775809 as signed int)
-9223372036854775808
select cast(' 9' as signed int);
cast(' 9' as signed int)
9
select cast('9 ' as signed int);
cast('9 ' as signed int)
9
Warnings:
Warning	1292	Truncated incorrect INTEGER value: '9 '
select cast(' 9 ' as signed int);
cast(' 9 ' as signed int)
9
Warnings:
Warning	1292	Truncated incorrect INTEGER value: ' 9 '
select cast(' 9.9' as signed int);
cast(' 9.9' as signed int)
9
Warnings:
Warning	1292	Truncated incorrect INTEGER value: ' 9.9'
select cast('9.9 ' as signed int);
cast('9.9 ' as signed int)
9
Warnings:
Warning	1292	Truncated incorrect INTEGER value: '9.9 '
select cast(' 9.9 ' as signed int);
cast(' 9.9 ' as signed int)
9
Warnings:
Warning	1292	Truncated incorrect INTEGER value: ' 9.9 '
select cast(9 as signed int);
cast(9 as signed int)
9
select cast(9.9 as signed int);
cast(9.9 as signed int)
10
select cast('1.123456789123456789123456789123456789123456789123456789123456789123456789123456789123456789123456789123456789123456789123456789123456789123456789123456789123456789123456789123456789123456789123456789123456789123456789123456789123456789123456789123456789123456789123456789' as signed int);
cast('1.1234567891234567891234567891234567891234567891234567891234567891234567891234567891234567891234567891234567891234567891234567891234567891234567891234567891234567891234567891234567891234567891234567891234567891234567891234567891234567891234567891234
1
Warnings:
Warning	1292	Truncated incorrect INTEGER value: '1.123456789123456789123456789123456789123456789123456789123456789123456789123456789123456789123456789123456789123456789123456789123456789123456789123456789123456789123456789123456789123456789123456789123456789123456789123456789123456789123456789123456789123456789123456789'
select cast('-1.123456789123456789123456789123456789123456789123456789123456789123456789123456789123456789123456789123456789123456789123456789123456789123456789123456789123456789123456789123456789123456789123456789123456789123456789123456789123456789123456789123456789123456789123456789' as signed int);
cast('-1.123456789123456789123456789123456789123456789123456789123456789123456789123456789123456789123456789123456789123456789123456789123456789123456789123456789123456789123456789123456789123456789123456789123456789123456789123456789123456789123456789123
-1
Warnings:
Warning	1292	Truncated incorrect INTEGER value: '-1.123456789123456789123456789123456789123456789123456789123456789123456789123456789123456789123456789123456789123456789123456789123456789123456789123456789123456789123456789123456789123456789123456789123456789123456789123456789123456789123456789123456789123456789123456789'
select cast('123456789.123456789123456789123456789123456789123456789123456789123456789123456789123456789123456789123456789123456789123456789123456789123456789123456789123456789123456789123456789123456789123456789123456789123456789123456789123456789123456789123456789123456789123456789123456789' as signed int);
cast('123456789.12345678912345678912345678912345678912345678912345678912345678912345678912345678912345678912345678912345678912345678912345678912345678912345678912345678912345678912345678912345678912345678912345678912345678912345678912345678912345678912345
123456789
Warnings:
Warning	1292	Truncated incorrect INTEGER value: '123456789.123456789123456789123456789123456789123456789123456789123456789123456789123456789123456789123456789123456789123456789123456789123456789123456789123456789123456789123456789123456789123456789123456789123456789123456789123456789123456789123456789123456789123456789123456789'
select cast('-123456789.123456789123456789123456789123456789123456789123456789123456789123456789123456789123456789123456789123456789123456789123456789123456789123456789123456789123456789123456789123456789123456789123456789123456789123456789123456789123456789123456789123456789123456789123456789' as signed int);
cast('-123456789.1234567891234567891234567891234567891234567891234567891234567891234567891234567891234567891234567891234567891234567891234567891234567891234567891234567891234567891234567891234567891234567891234567891234567891234567891234567891234567891234
-123456789
Warnings:
Warning	1292	Truncated incorrect INTEGER value: '-123456789.123456789123456789123456789123456789123456789123456789123456789123456789123456789123456789123456789123456789123456789123456789123456789123456789123456789123456789123456789123456789123456789123456789123456789123456789123456789123456789123456789123456789123456789123456789'
select cast('1.1234567891234567891234567891234567891234567891234567891234567891234567891234567891234567891234567891234567891234567891234567891234567891234567891234567891234567891234567891234567891234567891234567891234567891234567891234567891234567891234567891234567891234567891234567891' as signed int);
cast('1.1234567891234567891234567891234567891234567891234567891234567891234567891234567891234567891234567891234567891234567891234567891234567891234567891234567891234567891234567891234567891234567891234567891234567891234567891234567891234567891234567891234
1
Warnings:
Warning	1292	Truncated incorrect INTEGER value: '1.1234567891234567891234567891234567891234567891234567891234567891234567891234567891234567891234567891234567891234567891234567891234567891234567891234567891234567891234567891234567891234567891234567891234567891234567891234567891234567891234567891234567891234567891234567891'
select cast('-1.1234567891234567891234567891234567891234567891234567891234567891234567891234567891234567891234567891234567891234567891234567891234567891234567891234567891234567891234567891234567891234567891234567891234567891234567891234567891234567891234567891234567891234567891234567891' as signed int);
cast('-1.123456789123456789123456789123456789123456789123456789123456789123456789123456789123456789123456789123456789123456789123456789123456789123456789123456789123456789123456789123456789123456789123456789123456789123456789123456789123456789123456789123
-1
Warnings:
Warning	1292	Truncated incorrect INTEGER value: '-1.1234567891234567891234567891234567891234567891234567891234567891234567891234567891234567891234567891234567891234567891234567891234567891234567891234567891234567891234567891234567891234567891234567891234567891234567891234567891234567891234567891234567891234567891234567891'
select cast('123456789.1234567891234567891234567891234567891234567891234567891234567891234567891234567891234567891234567891234567891234567891234567891234567891234567891234567891234567891234567891234567891234567891234567891234567891234567891234567891234567891234567891234567891234567891234567891' as signed int);
cast('123456789.12345678912345678912345678912345678912345678912345678912345678912345678912345678912345678912345678912345678912345678912345678912345678912345678912345678912345678912345678912345678912345678912345678912345678912345678912345678912345678912345
123456789
Warnings:
Warning	1292	Truncated incorrect INTEGER value: '123456789.1234567891234567891234567891234567891234567891234567891234567891234567891234567891234567891234567891234567891234567891234567891234567891234567891234567891234567891234567891234567891234567891234567891234567891234567891234567891234567891234567891234567891234567891234567891'
select cast('-123456789.1234567891234567891234567891234567891234567891234567891234567891234567891234567891234567891234567891234567891234567891234567891234567891234567891234567891234567891234567891234567891234567891234567891234567891234567891234567891234567891234567891234567891234567891234567891' as signed int);
cast('-123456789.1234567891234567891234567891234567891234567891234567891234567891234567891234567891234567891234567891234567891234567891234567891234567891234567891234567891234567891234567891234567891234567891234567891234567891234567891234567891234567891234
-123456789
Warnings:
Warning	1292	Truncated incorrect INTEGER value: '-123456789.1234567891234567891234567891234567891234567891234567891234567891234567891234567891234567891234567891234567891234567891234567891234567891234567891234567891234567891234567891234567891234567891234567891234567891234567891234567891234567891234567891234567891234567891234567891'
select cast(1.123456789123456789123456789123456789123456789123456789123456789123456789123456789123456789123456789123456789123456789123456789123456789123456789123456789123456789123456789123456789123456789123456789123456789123456789123456789123456789123456789123456789123456789123456789 as signed int);
cast(1.12345678912345678912345678912345678912345678912345678912345678912345678912345678912345678912345678912345678912345678912345678912345678912345678912345678912345678912345678912345678912345678912345678912345678912345678912345678912345678912345678912345
1
select cast(-1.123456789123456789123456789123456789123456789123456789123456789123456789123456789123456789123456789123456789123456789123456789123456789123456789123456789123456789123456789123456789123456789123456789123456789123456789123456789123456789123456789123456789123456789123456789 as signed int);
cast(-1.1234567891234567891234567891234567891234567891234567891234567891234567891234567891234567891234567891234567891234567891234567891234567891234567891234567891234567891234567891234567891234567891234567891234567891234567891234567891234567891234567891234
-1
select cast(123456789.123456789123456789123456789123456789123456789123456789123456789123456789123456789123456789123456789123456789123456789123456789123456789123456789123456789123456789123456789123456789123456789123456789123456789123456789123456789123456789123456789123456789123456789123456789 as signed int);
cast(123456789.123456789123456789123456789123456789123456789123456789123456789123456789123456789123456789123456789123456789123456789123456789123456789123456789123456789123456789123456789123456789123456789123456789123456789123456789123456789123456789123456
123456789
select cast(-123456789.123456789123456789123456789123456789123456789123456789123456789123456789123456789123456789123456789123456789123456789123456789123456789123456789123456789123456789123456789123456789123456789123456789123456789123456789123456789123456789123456789123456789123456789123456789 as signed int);
cast(-123456789.12345678912345678912345678912345678912345678912345678912345678912345678912345678912345678912345678912345678912345678912345678912345678912345678912345678912345678912345678912345678912345678912345678912345678912345678912345678912345678912345
-123456789
select cast(1.1234567891234567891234567891234567891234567891234567891234567891234567891234567891234567891234567891234567891234567891234567891234567891234567891234567891234567891234567891234567891234567891234567891234567891234567891234567891234567891234567891234567891234567891234567891 as signed int);
cast(1.12345678912345678912345678912345678912345678912345678912345678912345678912345678912345678912345678912345678912345678912345678912345678912345678912345678912345678912345678912345678912345678912345678912345678912345678912345678912345678912345678912345
1
select cast(-1.1234567891234567891234567891234567891234567891234567891234567891234567891234567891234567891234567891234567891234567891234567891234567891234567891234567891234567891234567891234567891234567891234567891234567891234567891234567891234567891234567891234567891234567891234567891 as signed int);
cast(-1.1234567891234567891234567891234567891234567891234567891234567891234567891234567891234567891234567891234567891234567891234567891234567891234567891234567891234567891234567891234567891234567891234567891234567891234567891234567891234567891234567891234
-1
select cast(123456789.1234567891234567891234567891234567891234567891234567891234567891234567891234567891234567891234567891234567891234567891234567891234567891234567891234567891234567891234567891234567891234567891234567891234567891234567891234567891234567891234567891234567891234567891234567891 as signed int);
cast(123456789.123456789123456789123456789123456789123456789123456789123456789123456789123456789123456789123456789123456789123456789123456789123456789123456789123456789123456789123456789123456789123456789123456789123456789123456789123456789123456789123456
123456789
select cast(-123456789.1234567891234567891234567891234567891234567891234567891234567891234567891234567891234567891234567891234567891234567891234567891234567891234567891234567891234567891234567891234567891234567891234567891234567891234567891234567891234567891234567891234567891234567891234567891 as signed int);
cast(-123456789.12345678912345678912345678912345678912345678912345678912345678912345678912345678912345678912345678912345678912345678912345678912345678912345678912345678912345678912345678912345678912345678912345678912345678912345678912345678912345678912345
-123456789
select cast(123.23456789 as decimal(38,2));
cast(123.23456789 as decimal(38,2))
123.23
select cast(123.23456789 as decimal(38,2));
cast(123.23456789 as decimal(38,2))
123.23
select cast(0.23456789 as decimal(100,1));
ERROR 42000: Too big precision 100 specified for column '0.23456789'. Maximum is 65.
drop table if exists t1;
select cast(sum(0) as datetime);
cast(sum(0) as datetime)
0000-00-00 00:00:00
create table t1(a decimal(30,6), b datetime(4));
insert into t1(a) values(20150407120309.23456789);
Warnings:
Warning	1265	Data truncated for column 'a' at row 1
insert into t1(a) values(20150407120309.23);
insert into t1(a) values(20150407120309);
update t1 set b = a;
select * from t1;
a	b
20150407120309.234568	2015-04-07 12:03:09.2346
20150407120309.230000	2015-04-07 12:03:09.2300
20150407120309.000000	2015-04-07 12:03:09.0000
drop table if exists t1;
select cast(sum(0) as datetime);
cast(sum(0) as datetime)
0000-00-00 00:00:00
create table t1(a decimal(30,3), b datetime(6));
insert into t1(a) values(20150407120309.23456789);
Warnings:
Warning	1265	Data truncated for column 'a' at row 1
insert into t1(a) values(20150407120309.23);
insert into t1(a) values(20150407120309);
update t1 set b = a;
select * from t1;
a	b
20150407120309.235	2015-04-07 12:03:09.235000
20150407120309.230	2015-04-07 12:03:09.230000
20150407120309.000	2015-04-07 12:03:09.000000
drop table if exists t1;
select cast(sum(0) as datetime);
cast(sum(0) as datetime)
0000-00-00 00:00:00
create table t1(a decimal(30,3), b datetime(3));
insert into t1(a) values(20150407120309.23456789);
Warnings:
Warning	1265	Data truncated for column 'a' at row 1
insert into t1(a) values(20150407120309.23);
insert into t1(a) values(20150407120309);
insert into t1(a) values(0.23);
insert into t1(a) values(0.2388888);
Warnings:
Warning	1265	Data truncated for column 'a' at row 1
update t1 set b = a;
select * from t1;
a	b
20150407120309.235	2015-04-07 12:03:09.235
20150407120309.230	2015-04-07 12:03:09.230
20150407120309.000	2015-04-07 12:03:09.000
0.230	0000-00-00 00:00:00.000
0.239	0000-00-00 00:00:00.000
insert into t1(a) values(10.23);
insert into t1(a) values(23);
select cast(a as datetime) from t1;
cast(a as datetime)
2015-04-07 12:03:09
2015-04-07 12:03:09
2015-04-07 12:03:09
0000-00-00 00:00:00
0000-00-00 00:00:00
NULL
NULL
