drop table if exists t1;
create table t1 (a bigint, b decimal(35,10));
insert into t1 values(100, 100),(100, 100.1),(10000000000, 10000000000),(10000000000,100000000000),(10000000000,10000000000.000000000001),(100000000000000000,10000000000000000000),(10000000000000000,10000000000000000000.2),(123456789123456789,1234567891234567891),(123456789123456789,1234567891234567891.000000000000001),(1234567891234567899,-123456789123456789999);
Warnings:
Warning	1265	Data truncated for column 'b' at row 5
Warning	1265	Data truncated for column 'b' at row 9
select a < b , a = b , a > b, a >= b , a <= b , a != b from t1;
a < b	a = b	a > b	a >= b	a <= b	a != b
0	1	0	1	1	0
1	0	0	0	1	1
0	1	0	1	1	0
1	0	0	0	1	1
0	1	0	1	1	0
1	0	0	0	1	1
1	0	0	0	1	1
1	0	0	0	1	1
1	0	0	0	1	1
0	0	1	1	0	1
delete from t1;
insert into t1 values(-100, -100),(-100, -100.1),(-10000000000, -10000000000),(-10000000000,-100000000000),(-10000000000,-10000000000.000000000001),(-100000000000000000,-10000000000000000000),(-10000000000000000,-10000000000000000000.2),(-123456789123456789,-1234567891234567891),(-123456789123456789,-1234567891234567891.000000000000001),(-1234567891234567899,123456789123456789999);
Warnings:
Warning	1265	Data truncated for column 'b' at row 5
Warning	1265	Data truncated for column 'b' at row 9
select a < b , a = b , a > b, a >= b , a <= b , a != b from t1;
a < b	a = b	a > b	a >= b	a <= b	a != b
0	1	0	1	1	0
0	0	1	1	0	1
0	1	0	1	1	0
0	0	1	1	0	1
0	1	0	1	1	0
0	0	1	1	0	1
0	0	1	1	0	1
0	0	1	1	0	1
0	0	1	1	0	1
1	0	0	0	1	1
delete from t1;
insert into t1 values(-100, 0),(0, -100.1),(-10000000000, -1),(-10000000000,900000),(-10000000000,10000000000.000000000001),(100000000000000000,-10000000000000000000),(-10000000000000000,-1000000000000000000.2),(-123456789123456789,-1234567891234567891),(-123456789123456789,-1234567891234567891.000000000000001),(1234567891234567899,-123456789123456789999);
Warnings:
Warning	1265	Data truncated for column 'b' at row 5
Warning	1265	Data truncated for column 'b' at row 9
select a < b , a = b , a > b, a >= b , a <= b , a != b from t1;
a < b	a = b	a > b	a >= b	a <= b	a != b
1	0	0	0	1	1
0	0	1	1	0	1
1	0	0	0	1	1
1	0	0	0	1	1
1	0	0	0	1	1
0	0	1	1	0	1
0	0	1	1	0	1
0	0	1	1	0	1
0	0	1	1	0	1
0	0	1	1	0	1
drop table if exists t1;
create table t1 (a bigint unsigned, b decimal(35,10));
insert into t1 values(100, 100),(100, 100.1),(10000000000, 10000000000),(10000000000,100000000000),(10000000000,10000000000.000000000001),(10000000000000000000,10000000000000000000),(10000000000000000000,10000000000000000000.2),(1234567891234567891,1234567891234567891),(1234567891234567891,1234567891234567891.000000000000001),(17666000000000000000, 17666000000000000000),(17666000000000000000,17666000000000000000.0000009);
Warnings:
Warning	1265	Data truncated for column 'b' at row 5
Warning	1265	Data truncated for column 'b' at row 9
select a < b , a = b , a > b, a >= b , a <= b , a != b from t1;
a < b	a = b	a > b	a >= b	a <= b	a != b
0	1	0	1	1	0
1	0	0	0	1	1
0	1	0	1	1	0
1	0	0	0	1	1
0	1	0	1	1	0
0	1	0	1	1	0
1	0	0	0	1	1
0	1	0	1	1	0
0	1	0	1	1	0
0	1	0	1	1	0
1	0	0	0	1	1
drop table t1;
