result_format: 4
drop table molly_nn;
#const numbers
create table molly_nn as select 1.00 as b, 0.035 as c, 0.8376439437 as d, 3.8237438E10 as e, 3472891678543.89302418 as f from dual;
desc molly_nn;
+-------+----------------+------+-----+--------------+-------+
| Field | Type           | Null | Key | Default      | Extra |
+-------+----------------+------+-----+--------------+-------+
| b     | decimal(3,2)   | NO   |     | 0.00         |       |
| c     | decimal(4,3)   | NO   |     | 0.000        |       |
| d     | decimal(11,10) | NO   |     | 0.0000000000 |       |
| e     | double         | NO   |     | 0            |       |
| f     | decimal(21,8)  | NO   |     | 0.00000000   |       |
+-------+----------------+------+-----+--------------+-------+
#double 3.8237438E10 is not correct for now bug#18360384
select * from molly_nn;
+------+-------+--------------+-------------+------------------------+
| b    | c     | d            | e           | f                      |
+------+-------+--------------+-------------+------------------------+
| 1.00 | 0.035 | 0.8376439437 | 38237438000 | 3472891678543.89302418 |
+------+-------+--------------+-------------+------------------------+
drop table molly_nn;

===== more case for insert number
drop table t_number;
drop table stu;
drop table t1;
drop table t2;
create table t_number(id int, c1 decimal(0, 3));
ERROR 42000: For float(M,D), double(M,D) or decimal(M,D), M must be >= D (column 'c1').
create table t_number(id int, c1 decimal(66, 3));
ERROR 42000: Too big precision 66 specified for column 'c1'. Maximum is 65.
create table t_number(id int, c1 decimal(3, -1));
ERROR 42000: You have an error in your SQL syntax; check the manual that corresponds to your OceanBase version for the right syntax to use near '-1))' at line 1
create table t_number(id int, c1 decimal(3, 31));
ERROR 42000: Too big scale 31 specified for column 'c1'. Maximum is 30.

create table t_number(id int, c1 decimal(5, 3));
desc t_number;
+-------+--------------+------+-----+---------+-------+
| Field | Type         | Null | Key | Default | Extra |
+-------+--------------+------+-----+---------+-------+
| id    | int(11)      | YES  |     | NULL    |       |
| c1    | decimal(5,3) | YES  |     | NULL    |       |
+-------+--------------+------+-----+---------+-------+
insert into t_number values (1, 99.999491234567890123456789);
Warnings:
Warning	1265	Data truncated for column 'c1' at row 1
insert into t_number values (2, -99.999491234567890123456789);
Warnings:
Warning	1265	Data truncated for column 'c1' at row 1
insert into t_number values (3, 0);
insert into t_number values (4, 99.999);
insert into t_number values (5, -99.999);
insert into t_number values (6, 99.9995);
ERROR 22003: Out of range value for column 'c1' at row 1
insert into t_number values (7, -99.9995);
ERROR 22003: Out of range value for column 'c1' at row 1
select * from t_number order by id;
+------+---------+
| id   | c1      |
+------+---------+
|    1 |  99.999 |
|    2 | -99.999 |
|    3 |   0.000 |
|    4 |  99.999 |
|    5 | -99.999 |
+------+---------+
drop table t_number;

create table t_number(id int, c1 decimal(5, 5));
desc t_number;
+-------+--------------+------+-----+---------+-------+
| Field | Type         | Null | Key | Default | Extra |
+-------+--------------+------+-----+---------+-------+
| id    | int(11)      | YES  |     | NULL    |       |
| c1    | decimal(5,5) | YES  |     | NULL    |       |
+-------+--------------+------+-----+---------+-------+
insert into t_number values (1, 0.99999491234567890123456789);
Warnings:
Warning	1265	Data truncated for column 'c1' at row 1
insert into t_number values (2, -0.99999491234567890123456789);
Warnings:
Warning	1265	Data truncated for column 'c1' at row 1
insert into t_number values (3, 0);
insert into t_number values (4, 0.99999);
insert into t_number values (5, -0.99999);
insert into t_number values (6, 0.999995);
ERROR 22003: Out of range value for column 'c1' at row 1
insert into t_number values (7, -0.999995);
ERROR 22003: Out of range value for column 'c1' at row 1
select * from t_number order by id;
+------+----------+
| id   | c1       |
+------+----------+
|    1 |  0.99999 |
|    2 | -0.99999 |
|    3 |  0.00000 |
|    4 |  0.99999 |
|    5 | -0.99999 |
+------+----------+
drop table t_number;

create table t_number(id int, c1 decimal(0, 0));
desc t_number;
+-------+---------------+------+-----+---------+-------+
| Field | Type          | Null | Key | Default | Extra |
+-------+---------------+------+-----+---------+-------+
| id    | int(11)       | YES  |     | NULL    |       |
| c1    | decimal(10,0) | YES  |     | NULL    |       |
+-------+---------------+------+-----+---------+-------+
insert into t_number values (1, 9999999999.491234567890123456789);
Warnings:
Warning	1265	Data truncated for column 'c1' at row 1
insert into t_number values (2, -9999999999.491234567890123456789);
Warnings:
Warning	1265	Data truncated for column 'c1' at row 1
insert into t_number values (3, 0);
insert into t_number values (4, 9999999999);
insert into t_number values (5, -9999999999);
insert into t_number values (6, 9999999999.5);
ERROR 22003: Out of range value for column 'c1' at row 1
insert into t_number values (7, -9999999999.5);
ERROR 22003: Out of range value for column 'c1' at row 1
select * from t_number order by id;
+------+-------------+
| id   | c1          |
+------+-------------+
|    1 |  9999999999 |
|    2 | -9999999999 |
|    3 |           0 |
|    4 |  9999999999 |
|    5 | -9999999999 |
+------+-------------+
drop table t_number;

create table t_number(id int, c1 decimal(1, 0));
desc t_number;
+-------+--------------+------+-----+---------+-------+
| Field | Type         | Null | Key | Default | Extra |
+-------+--------------+------+-----+---------+-------+
| id    | int(11)      | YES  |     | NULL    |       |
| c1    | decimal(1,0) | YES  |     | NULL    |       |
+-------+--------------+------+-----+---------+-------+
insert into t_number values (1, 9.491234567890123456789);
Warnings:
Warning	1265	Data truncated for column 'c1' at row 1
insert into t_number values (2, -9.491234567890123456789);
Warnings:
Warning	1265	Data truncated for column 'c1' at row 1
insert into t_number values (3, 0);
insert into t_number values (4, 9);
insert into t_number values (5, -9);
insert into t_number values (6, 9.5);
ERROR 22003: Out of range value for column 'c1' at row 1
insert into t_number values (7, -9.5);
ERROR 22003: Out of range value for column 'c1' at row 1
select * from t_number order by id;
+------+------+
| id   | c1   |
+------+------+
|    1 |    9 |
|    2 |   -9 |
|    3 |    0 |
|    4 |    9 |
|    5 |   -9 |
+------+------+
drop table t_number;

create table t_number(id int, c1 decimal(65, 0));
desc t_number;
+-------+---------------+------+-----+---------+-------+
| Field | Type          | Null | Key | Default | Extra |
+-------+---------------+------+-----+---------+-------+
| id    | int(11)       | YES  |     | NULL    |       |
| c1    | decimal(65,0) | YES  |     | NULL    |       |
+-------+---------------+------+-----+---------+-------+
insert into t_number values (1, 99999999999999999999999999999999999999999999999999999999999999999.4912345678901234567890123456789);
Warnings:
Warning	1265	Data truncated for column 'c1' at row 1
insert into t_number values (2, -99999999999999999999999999999999999999999999999999999999999999999.4912345678901234567890123456789);
Warnings:
Warning	1265	Data truncated for column 'c1' at row 1
insert into t_number values (3, 0);
insert into t_number values (4, 99999999999999999999999999999999999999999999999999999999999999999);
insert into t_number values (5, -99999999999999999999999999999999999999999999999999999999999999999);
insert into t_number values (6, 99999999999999999999999999999999999999999999999999999999999999999.5012345678901234567890123456789);
ERROR 22003: Out of range value for column 'c1' at row 1
insert into t_number values (7, -99999999999999999999999999999999999999999999999999999999999999999.5012345678901234567890123456789);
ERROR 22003: Out of range value for column 'c1' at row 1
select * from t_number order by id;
+------+--------------------------------------------------------------------+
| id   | c1                                                                 |
+------+--------------------------------------------------------------------+
|    1 |  99999999999999999999999999999999999999999999999999999999999999999 |
|    2 | -99999999999999999999999999999999999999999999999999999999999999999 |
|    3 |                                                                  0 |
|    4 |  99999999999999999999999999999999999999999999999999999999999999999 |
|    5 | -99999999999999999999999999999999999999999999999999999999999999999 |
+------+--------------------------------------------------------------------+
drop table t_number;

create table t_number(id int, c1 decimal(65, 30));
desc t_number;
+-------+----------------+------+-----+---------+-------+
| Field | Type           | Null | Key | Default | Extra |
+-------+----------------+------+-----+---------+-------+
| id    | int(11)        | YES  |     | NULL    |       |
| c1    | decimal(65,30) | YES  |     | NULL    |       |
+-------+----------------+------+-----+---------+-------+
insert into t_number values (1, 99999999999999999999999999999999999.9999999999999999999999999999994912345678901234567890123456789);
Warnings:
Warning	1265	Data truncated for column 'c1' at row 1
insert into t_number values (2, -99999999999999999999999999999999999.9999999999999999999999999999994912345678901234567890123456789);
Warnings:
Warning	1265	Data truncated for column 'c1' at row 1
insert into t_number values (3, 0);
insert into t_number values (4, 99999999999999999999999999999999999.999999999999999999999999999999);
insert into t_number values (5, -99999999999999999999999999999999999.999999999999999999999999999999);
insert into t_number values (6, 99999999999999999999999999999999999.9999999999999999999999999999995012345678901234567890123456789);
ERROR 22003: Out of range value for column 'c1' at row 1
insert into t_number values (7, -99999999999999999999999999999999999.9999999999999999999999999999995012345678901234567890123456789);
ERROR 22003: Out of range value for column 'c1' at row 1
select * from t_number order by id;
+------+---------------------------------------------------------------------+
| id   | c1                                                                  |
+------+---------------------------------------------------------------------+
|    1 |  99999999999999999999999999999999999.999999999999999999999999999999 |
|    2 | -99999999999999999999999999999999999.999999999999999999999999999999 |
|    3 |                                    0.000000000000000000000000000000 |
|    4 |  99999999999999999999999999999999999.999999999999999999999999999999 |
|    5 | -99999999999999999999999999999999999.999999999999999999999999999999 |
+------+---------------------------------------------------------------------+
drop table t_number;

create table t_number(c1 decimal(4,0) default value 12345.6);
ERROR 42000: You have an error in your SQL syntax; check the manual that corresponds to your OceanBase version for the right syntax to use near 'value 12345.6)' at line 1

create table t_number (c1 number(10, 2));
alter table t_number modify c1 number(10, 1);
alter table t_number modify c1 number(5, 2);
drop table t_number;

create table t_number (c1 decimal(10, 2));
alter table t_number modify c1 decimal(10, 1);
alter table t_number modify c1 decimal(5, 2);
alter table t_number change column c1 c1 decimal(5, 2);
drop table t_number;

#
select 18 <= '0.0018e' from dual;
+-----------------+
| 18 <= '0.0018e' |
+-----------------+
|               0 |
+-----------------+
Warnings:
Warning	1292	Truncated incorrect DECIMAL value: '0.0018e'

#
select cast("0.00e129" as decimal(10,2)) from dual;
+-----------------------------------+
| cast("0.00e129" as decimal(10,2)) |
+-----------------------------------+
|                              0.00 |
+-----------------------------------+
select cast("0.00e128" as decimal(10,2)) from dual;
+-----------------------------------+
| cast("0.00e128" as decimal(10,2)) |
+-----------------------------------+
|                              0.00 |
+-----------------------------------+
select cast("0.00e200" as decimal(10,2)) from dual;
+-----------------------------------+
| cast("0.00e200" as decimal(10,2)) |
+-----------------------------------+
|                              0.00 |
+-----------------------------------+
select cast("0e200" as decimal(10,2)) from dual;
+--------------------------------+
| cast("0e200" as decimal(10,2)) |
+--------------------------------+
|                           0.00 |
+--------------------------------+

set div_precision_increment = 0;
create table stu(s1 decimal(2), s2 decimal(20) generated always as(s1/5));
insert into stu(s1) values (99);
select * from stu;
+------+------+
| s1   | s2   |
+------+------+
|   99 |   19 |
+------+------+
select 99/5 from dual;
+------+
| 99/5 |
+------+
|   19 |
+------+
set div_precision_increment = 1;
insert into stu(s1) values (99);
Warnings:
Warning	1265	Data truncated for column 's2' at row 1
select * from stu;
+------+------+
| s1   | s2   |
+------+------+
|   99 |   20 |
|   99 |   20 |
+------+------+
select 99/5 from dual;
+------+
| 99/5 |
+------+
| 19.8 |
+------+
set div_precision_increment = 4;
insert into stu(s1) values (99);
Warnings:
Warning	1265	Data truncated for column 's2' at row 1
select * from stu;
+------+------+
| s1   | s2   |
+------+------+
|   99 |   20 |
|   99 |   20 |
|   99 |   20 |
+------+------+
select 99/5 from dual;
+---------+
| 99/5    |
+---------+
| 19.8000 |
+---------+
drop table stu;

set sql_mode = '';
create table t1 (c1 decimal(5,2));
insert into t1 values (1.234);
Warnings:
Warning	1265	Data truncated for column 'c1' at row 1
insert into t1 values (1234.4321);
Warnings:
Warning	1265	Data truncated for column 'c1' at row 1
insert into t1 values ('1.234');
Warnings:
Warning	1265	Data truncated for column 'c1' at row 1

create table t2 (c1 decimal(5, 3), c2 double(5,3));
insert into t2 values (1.234, 1.2345);
insert into t1 select c1 from t2;
Warnings:
Warning	1265	Data truncated for column 'c1' at row 1
insert into t1 select c2 from t2;
Warnings:
Warning	1265	Data truncated for column 'c1' at row 1

select * from t1;
+--------+
| c1     |
+--------+
|   1.23 |
| 999.99 |
|   1.23 |
|   1.23 |
|   1.23 |
+--------+
drop table t1, t2;

set sql_mode = 'STRICT_ALL_TABLES';

create table t1 (c1 decimal(5,2));
insert into t1 values (1.234);
Warnings:
Warning	1265	Data truncated for column 'c1' at row 1
insert into t1 values (1234.4321);
ERROR 22003: Out of range value for column 'c1' at row 1
insert into t1 values ('1.234');
Warnings:
Warning	1265	Data truncated for column 'c1' at row 1

create table t2 (c1 decimal(5, 3), c2 double(5,3));
insert into t2 values (1.234, 1.2345);
insert into t1 select c1 from t2;
Warnings:
Warning	1265	Data truncated for column 'c1' at row 1
insert into t1 select c2 from t2;
Warnings:
Warning	1265	Data truncated for column 'c1' at row 1

select * from t1;
+------+
| c1   |
+------+
| 1.23 |
| 1.23 |
| 1.23 |
| 1.23 |
+------+
drop table t1, t2;

set sql_mode = '';
create table t1 (c1 decimal(10, 2) unsigned);
insert into t1 values (1);
update t1 set c1 = -1.66e0;
select * from t1;
+------+
| c1   |
+------+
| 0.00 |
+------+
drop table t1;

set sql_mode = 'STRICT_ALL_TABLES';
CREATE TABLE t1(c1 TIME NULL, c2 CHAR(25) NOT NULL, c3 INTEGER(4) NULL, c4 CHAR(15) NOT NULL PRIMARY KEY, c5 TIME NOT NULL UNIQUE KEY,c6 DEC(10,8) NOT NULL DEFAULT 3.141592);
insert INTO t1  values (-10,2,3,4,5,6);
ALTER TABLE t1 CHANGE c1 c1 DECIMAL(23,11) UNSIGNED, CHANGE c2 c2 DECIMAL(23,11) ;
ERROR 22003: Out of range value for column
ALTER TABLE t1 MODIFY c1 DOUBLE UNSIGNED ZEROFILL NULL;
ERROR 22003: Out of range value for column
set sql_mode = '';
ALTER TABLE t1 CHANGE c1 c1 DECIMAL(23,11) UNSIGNED, CHANGE c2 c2 DECIMAL(23,11) ;
select * from t1;
+---------------+---------------+------+----+----------+------------+
| c1            | c2            | c3   | c4 | c5       | c6         |
+---------------+---------------+------+----+----------+------------+
| 0.00000000000 | 2.00000000000 |    3 | 4  | 00:00:05 | 6.00000000 |
+---------------+---------------+------+----+----------+------------+
ALTER TABLE t1 MODIFY c1 DOUBLE UNSIGNED ZEROFILL NULL;
select * from t1;
+-------------------------+---------------+------+----+----------+------------+
| c1                      | c2            | c3   | c4 | c5       | c6         |
+-------------------------+---------------+------+----+----------+------------+
| 00000000000000000000000 | 2.00000000000 |    3 | 4  | 00:00:05 | 6.00000000 |
+-------------------------+---------------+------+----+----------+------------+
drop table t1;

select cast( '303030303030303030303030303030303030303030303030303030303030303030303030303030303030303030303030303030303030303030303030303030303639320444' as decimal(10, 0)) ;
+-----------------------------------------------------------------------------------------------------------------------------------------------------------------------+
| cast( '303030303030303030303030303030303030303030303030303030303030303030303030303030303030303030303030303030303030303030303030303030303639320444' as decimal(10, 0)) |
+-----------------------------------------------------------------------------------------------------------------------------------------------------------------------+
|                                                                                                                                                            9999999999 |
+-----------------------------------------------------------------------------------------------------------------------------------------------------------------------+
select '303030303030303030303030303030303030303030303030303030303030303030303030303030303030303030303030303030303030303030303030303030303639320444' is true;
+------------------------------------------------------------------------------------------------------------------------------------------------------+
| '303030303030303030303030303030303030303030303030303030303030303030303030303030303030303030303030303030303030303030303030303030303639320444' is true |
+------------------------------------------------------------------------------------------------------------------------------------------------------+
|                                                                                                                                                    1 |
+------------------------------------------------------------------------------------------------------------------------------------------------------+
select cast('303030303030303030303030303030303030303030303030303030303030303030303030303030303030303030303030303030303030303030303030303030303639320444' as decimal(10, 0)) is true;
+------------------------------------------------------------------------------------------------------------------------------------------------------------------------------+
| cast('303030303030303030303030303030303030303030303030303030303030303030303030303030303030303030303030303030303030303030303030303030303639320444' as decimal(10, 0)) is true |
+------------------------------------------------------------------------------------------------------------------------------------------------------------------------------+
|                                                                                                                                                                            1 |
+------------------------------------------------------------------------------------------------------------------------------------------------------------------------------+

CREATE TABLE t1 (
    c0 INT(100) ZEROFILL UNIQUE
) PARTITION BY HASH (c0) partitions 1 WITH COLUMN GROUP (all columns, each column);

INSERT INTO t1 (c0) VALUES (64804693);

SELECT true FROM t1 WHERE HEX(concat(t1.c0, ''));
+------+
| true |
+------+
|    1 |
+------+
SELECT true FROM t1 WHERE HEX(concat(t1.c0, '')) IS TRUE;
+------+
| true |
+------+
|    1 |
+------+

drop table t1;
CREATE TABLE t1 (c1 varchar(10), pk int(11), PRIMARY KEY (pk)) ;
UPDATE t1 SET c1 = 1 WHERE pk IN (REPEAT( 0x3835 , 156 ) );
drop table t1;
