drop table if exists t1,t2;
SELECT 10,10.0,10.,.1e+2,100.0e-1;
10	10.0	10.	.1e+2	100.0e-1
10	10.0	10	10	10
SELECT 6e-16, -6e-16, --6e-16, -6e-16+1.000000;
6e-16	-6e-16	--6e-16	-6e-16+1.000000
6e-16	-6e-16	6e-16	0.9999999999999994
SELECT 1e1,1.e1,1.0e1,1e+1,1.e+1,1.0e+1,1e-1,1.e-1,1.0e-1;
1e1	1.e1	1.0e1	1e+1	1.e+1	1.0e+1	1e-1	1.e-1	1.0e-1
10	10	10	10	10	10	0.1	0.1	0.1
SELECT 0.001e+1,0.001e-1, -0.001e+01,-0.001e-01;
0.001e+1	0.001e-1	-0.001e+01	-0.001e-01
0.01	0.0001	-0.01	-0.0001
SELECT 123.23E+02,-123.23E-02,'123.23E+02'+0.0,'-123.23E-02'+0.0;
123.23E+02	-123.23E-02	'123.23E+02'+0.0	'-123.23E-02'+0.0
12323	-1.2323	12323	-1.2323
SELECT 2147483647E+02,21474836.47E+06;
2147483647E+02	21474836.47E+06
214748364700	21474836470000
create table t1 (f1 float(24),f2 float(52),id int primary key auto_increment);
show full columns from t1;
Field	Type	Collation	Null	Key	Default	Extra	Privileges	Comment
f1	float	NULL	YES		NULL		#	
f2	double	NULL	YES		NULL		#	
id	int(11)	NULL	NO	PRI	NULL	auto_increment	#	
insert into t1 (f1,f2) values(10,10),(1e+5,1e+5),(1234567890,1234567890),(1e+10,1e+10),(1e+15,1e+15),(1e+20,1e+20);
insert into t1 (f1,f2) values(1e+50,1e+50),(1e+150,1e+150);
ERROR 22003: Out of range value for column 'f1' at row 1
insert into t1 (f1,f2) values(-10,-10),(1e-5,1e-5),(1e-10,1e-10),(1e-15,1e-15),(1e-20,1e-20),(1e-50,1e-50),(1e-150,1e-150);
select * from t1;
f1	f2	id
10	10	1
100000	100000	2
1234570000	1234567890	3
10000000000	10000000000	4
1e15	1e15	5
1e20	1e20	6
-10	-10	7
0.00001	0.00001	8
0.0000000001	0.0000000001	9
0.000000000000001	0.000000000000001	10
1e-20	1e-20	11
0	1e-50	12
0	1e-150	13
drop table t1;
create table t1 (datum double);
insert into t1 values (0.5),(1.0),(1.5),(2.0),(2.5);
select * from t1;
datum
0.5
1
1.5
2
2.5
select * from t1 where datum < 1.5;
datum
0.5
1
select * from t1 where datum > 1.5;
datum
2
2.5
select * from t1 where datum = 1.5;
datum
1.5
drop table t1;
create table t1 (a  decimal(7,3) not null, key (a));
insert into t1 values ('0'),('-0.00'),('-0.01'),('-0.002'),('1');
select a from t1 order by a;
a
-0.010
-0.002
0.000
0.000
1.000
select min(a) from t1;
min(a)
-0.010
drop table t1;
create table t1 (c1 double, c2 varchar(20));
insert t1 values (121,'16');
select c1 + c1 * (c2 / 100) as col from t1;
col
140.36
drop table t1;
create table t1 (a float);
insert into t1 values (1);
select max(a),min(a),avg(a) from t1;
max(a)	min(a)	avg(a)
1	1	1
drop table t1;
create table t1 (f float, f2 float(24), f3 float(6,2), d double, d2 float(53), d3 double(10,3), de decimal, de2 decimal(6), de3 decimal(5,2), n numeric, n2 numeric(8), n3 numeric(7,6));
show full columns from t1;
Field	Type	Collation	Null	Key	Default	Extra	Privileges	Comment
f	float	NULL	YES		NULL		#	
f2	float	NULL	YES		NULL		#	
f3	float(6,2)	NULL	YES		NULL		#	
d	double	NULL	YES		NULL		#	
d2	double	NULL	YES		NULL		#	
d3	double(10,3)	NULL	YES		NULL		#	
de	decimal(10,0)	NULL	YES		NULL		#	
de2	decimal(6,0)	NULL	YES		NULL		#	
de3	decimal(5,2)	NULL	YES		NULL		#	
n	decimal(10,0)	NULL	YES		NULL		#	
n2	decimal(8,0)	NULL	YES		NULL		#	
n3	decimal(7,6)	NULL	YES		NULL		#	
drop table t1;
create table t1 (a  decimal(7,3) not null, key (a));
insert into t1 values ('0'),('-0.00'),('-0.01'),('-0.002'),('1');
select a from t1 order by a;
a
-0.010
-0.002
0.000
0.000
1.000
select min(a) from t1;
min(a)
-0.010
drop table t1;
set sql_mode='';
create table t1 (c20 char);
insert into t1 values (5000.0);
Warnings:
Warning	1265	Data truncated for column '"test"."t1"."c20"' at row 1
insert into t1 values (0.5e4);
drop table t1;
set sql_mode='STRICT_TRANS_TABLES';
drop table if exists t1;
create table t1 (d1 double, d2 double unsigned);
insert into t1 set d1 = -1.0;
select * from t1;
d1	d2
-1	NULL
drop table t1;
create table t1 (f float(4,3));
insert into t1 values (-1.10),(-1.1),('-1.1'),(1.10),(1.1),('1.1');
select * from t1;
f
-1.100
-1.100
-1.100
1.100
1.100
1.100
drop table if exists t1;
create table t1 (f double(4,3));
insert into t1 values (-1.10),(-1.1),('-1.1'),(1.10),(1.1),('1.1');
select * from t1;
f
-1.100
-1.100
-1.100
1.100
1.100
1.100
drop table if exists t1;
CREATE TABLE t1 (
reckey int unsigned NOT NULL,
recdesc varchar(50) NOT NULL,
PRIMARY KEY  (reckey)
) ;
INSERT INTO t1 VALUES (108, 'Has 108 as key');
INSERT INTO t1 VALUES (109, 'Has 109 as key');
select * from t1 where reckey=108;
reckey	recdesc
108	Has 108 as key
select * from t1 where reckey=1.08E2;
reckey	recdesc
108	Has 108 as key
select * from t1 where reckey=109;
reckey	recdesc
109	Has 109 as key
select * from t1 where reckey=1.09E2;
reckey	recdesc
109	Has 109 as key
drop table t1;
create table t1 (d double(10,1));
create table t2 (d double(10,9));
insert into t1 values ('100000000.0');
insert into t2 values ('1.23456780');
select * from t2 union select * from t1;
d
1.234567800
100000000.000000000
drop table t1, t2;
select 1e-308, 1.00000001e-300, 100000000e-300;
1e-308	1.00000001e-300	100000000e-300
1e-308	1.00000001e-300	1e-292
select 10e307;
10e307
1e308
create table t1(a int, b double(8, 2));
insert into t1 values
(1, 28.50), (1, 121.85), (1, 157.23), (1, 1351.00), (1, -1965.35), (1, 81.75),
(1, 217.08), (1, 7.94), (4, 96.07), (4, 6404.65), (4, -6500.72), (2, 100.00),
(5, 5.00), (5, -2104.80), (5, 2033.80), (5, 0.07), (5, 65.93),
(3, -4986.24), (3, 5.00), (3, 4857.34), (3, 123.74), (3,  0.16),
(6, -1695.31), (6, 1003.77), (6, 499.72), (6, 191.82);
select a, sum(b) s from t1 group by a order by a;
a	s
1	0.00
2	100.00
3	0.00
4	-0.00
5	-0.00
6	0.00
select a, sum(b) s from t1 group by a having s <> 0 order by a;
a	s
2	100.00
select a, sum(b) s from t1 group by a having s <> 0 order by s;
a	s
2	100.00
select a, sum(b) s from t1 group by a having s <=> 0 order by a;
a	s
1	0.00
3	0.00
4	-0.00
5	-0.00
6	0.00
select a, sum(b) s from t1 group by a having s <=> 0 order by s;
a	s
4	-0.00
5	-0.00
1	0.00
6	0.00
3	0.00
alter table t1 add key (a, b);
select a, sum(b) s from t1 group by a order by a;
a	s
1	0.00
2	100.00
3	0.00
4	-0.00
5	0.00
6	0.00
select a, sum(b) s from t1 group by a having s <> 0 order by a;
a	s
2	100.00
select a, sum(b) s from t1 group by a having s <> 0 order by s;
a	s
2	100.00
select a, sum(b) s from t1 group by a having s <=> 0 order by a;
a	s
1	0.00
3	0.00
4	-0.00
5	0.00
6	0.00
select a, sum(b) s from t1 group by a having s <=> 0 order by s;
a	s
4	-0.00
1	0.00
3	0.00
5	0.00
6	0.00
drop table t1;
End of 4.1 tests
create table t1 (s1 float(0,2));
ERROR 42000: For float(M,D), double(M,D) or decimal(M,D), M must be >= D (column 's1').
create table t1 (s1 float(1,2));
ERROR 42000: For float(M,D), double(M,D) or decimal(M,D), M must be >= D (column 's1').
CREATE TABLE t1 (
f1 real zerofill,
f2 double zerofill,
f3 float zerofill);
INSERT INTO t1 VALUES ( 0.314152e+1, 0.314152e+1, 0.314152e+1);
select f1, f2, f3 FROM t1;
f1	f2	f3
00000000000000003.14152	00000000000000003.14152	000003.14152
select f1, f2, f3 FROM t1;
f1	f2	f3
00000000000000003.14152	00000000000000003.14152	000003.14152
DROP TABLE t1;
create table t1 (a char(20));
insert into t1 values (1.225e-05);
select a+0 from t1;
a+0
0.00001225
drop table t1;
create table t1(d double, u bigint unsigned);
insert into t1(d) values (9.22337203685479e18),
(1.84e19);
update t1 set u = d;
select u from t1;
u
9223372036854790144
18400000000000000000
drop table t1;
CREATE TABLE t1 (f1 DOUBLE);
INSERT INTO t1 VALUES(-1.79769313486231e+308);
SELECT f1 FROM t1;
f1
-1.79769313486231e308
DROP TABLE t1;
#
# Bug#12406055 BUFFER OVERFLOW OF VARIABLE 'BUFF' IN STRING::SET_REAL
#
# Ignoring output from misc. float operations
CREATE TABLE t1 (f FLOAT);
INSERT INTO t1 VALUES ('1.');
INSERT INTO t1 VALUES ('.');
SELECT * FROM t1 ORDER BY f;
DROP TABLE t1;
drop table if exists t1,t2,t3;
create table t1(c1 double default 0.7000000007);
create table t2(c1 float default 0.7000000007);
create table t3(c1 double(6,4) default 0.7000000007);
insert into t1 values();
select * from t1;
c1
0.7000000007
insert into t2 values();
select * from t2;
c1
0.7
insert into t3 values();
select * from t3;
c1
0.7000
drop table t1,t2,t3;
