drop table if exists t1;
select 1.1 IN (1.0, 1.2);
1.1 IN (1.0, 1.2)
0
select 1.1 IN (1.0, 1.2, 1.1, 1.4, 0.5);
1.1 IN (1.0, 1.2, 1.1, 1.4, 0.5)
1
select 1.1 IN (1.0, 1.2, NULL, 1.4, 0.5);
1.1 IN (1.0, 1.2, NULL, 1.4, 0.5)
NULL
select 0.5 IN (1.0, 1.2, NULL, 1.4, 0.5);
0.5 IN (1.0, 1.2, NULL, 1.4, 0.5)
1
select 1 IN (1.11, 1.2, 1.1, 1.4, 1, 0.5);
1 IN (1.11, 1.2, 1.1, 1.4, 1, 0.5)
1
select 1 IN (1.11, 1.2, 1.1, 1.4, NULL, 0.5);
1 IN (1.11, 1.2, 1.1, 1.4, NULL, 0.5)
NULL
select case 1.0 when 0.1 then "a" when 1.0 then "b" else "c" END;
case 1.0 when 0.1 then "a" when 1.0 then "b" else "c" END
b
select case 0.1 when 0.1 then "a" when 1.0 then "b" else "c" END;
case 0.1 when 0.1 then "a" when 1.0 then "b" else "c" END
a
select case 1 when 0.1 then "a" when 1.0 then "b" else "c" END;
case 1 when 0.1 then "a" when 1.0 then "b" else "c" END
b
select case 1.0 when 0.1 then "a" when 1 then "b" else "c" END;
case 1.0 when 0.1 then "a" when 1 then "b" else "c" END
b
select case 1.001 when 0.1 then "a" when 1 then "b" else "c" END;
case 1.001 when 0.1 then "a" when 1 then "b" else "c" END
c
create table t1 (a decimal(6,3),id int primary key);
insert into t1 values (1.0,1), (NULL,2), (0.1,3);
select * from t1;
a	id
1.000	1
NULL	2
0.100	3
select 0.1 in (1.0, 1.2, 1.1, a, 1.4, 0.5) from t1;
0.1 in (1.0, 1.2, 1.1, a, 1.4, 0.5)
0
NULL
1
drop table t1;
create table t1 (a decimal(4,2),id int primary key auto_increment);
insert into t1 (a)value (10000), (1.1e10), ("11111"), (100000.1);
ERROR 22003: Out of range value for column 'a' at row 1
insert into t1 (a)value (-10000), (-1.1e10), ("-11111"), (-100000.1);
ERROR 22003: Out of range value for column 'a' at row 1
select a from t1;
a
drop table t1;
set sql_mode='';
create table t1 (a decimal(4,2),id int primary key auto_increment);
insert into t1 (a)value (10000), (1.1e10), ("11111"), (100000.1);
insert into t1 (a)value (-10000), (-1.1e10), ("-11111"), (-100000.1);
select a from t1;
a
99.99
99.99
99.99
99.99
-99.99
-99.99
-99.99
-99.99
drop table t1;
set sql_mode='STRICT_TRANS_TABLES';
create table t1 (a decimal(4,2) unsigned,id int primary key auto_increment);
insert into t1 (a) value (10000), (1.1e10), ("11111"), (100000.1);
ERROR 22003: Out of range value for column 'a' at row 1
insert into t1 (a) value (-10000), (-1.1e10), ("-11111"), (-100000.1);
ERROR 22003: Out of range value for column 'a' at row 1
select a from t1;
a
drop table t1;
select 1e10/0e0;
1e10/0e0
NULL
create table wl1612 (col1 int primary key, col2 decimal(38,10), col3 numeric(38,10));
insert into wl1612 values(1,12345678901234567890.1234567890,12345678901234567890.1234567890);
select * from wl1612;
col1	col2	col3
1	12345678901234567890.1234567890	12345678901234567890.1234567890
insert into wl1612 values(2,01234567890123456789.0123456789,01234567890123456789.0123456789);
select * from wl1612 where col1=2;
col1	col2	col3
2	1234567890123456789.0123456789	1234567890123456789.0123456789
insert into wl1612 values(3,1234567890123456789012345678.0123456789,1234567890123456789012345678.0123456789);
select * from wl1612 where col1=3;
col1	col2	col3
3	1234567890123456789012345678.0123456789	1234567890123456789012345678.0123456789
select col1/0 from wl1612;
col1/0
NULL
NULL
NULL
select col2/0 from wl1612;
col2/0
NULL
NULL
NULL
select col3/0 from wl1612;
col3/0
NULL
NULL
NULL
insert into wl1612 values(5,5000.0005,5000.0005);
insert into wl1612 values(6,5000.0005,5000.0005);
select sum(col2),sum(col3) from wl1612;
sum(col2)	sum(col3)
1234567903703703580370380357.1491481468	1234567903703703580370380357.1491481468
insert into wl1612 values(7,500000.000005,500000.000005);
insert into wl1612 values(8,500000.000005,500000.000005);
select sum(col2),sum(col3) from wl1612 where col1>4;
sum(col2)	sum(col3)
1010000.0010100000	1010000.0010100000
insert into wl1612 (col1, col2) values(9,1.01234567891);
Warnings:
Warning	1265	Data truncated for column 'col2' at row 1
insert into wl1612 (col1, col2) values(10,1.01234567894);
Warnings:
Warning	1265	Data truncated for column 'col2' at row 1
insert into wl1612 (col1, col2) values(11,1.01234567895);
Warnings:
Warning	1265	Data truncated for column 'col2' at row 1
insert into wl1612 (col1, col2) values(12,1.01234567896);
Warnings:
Warning	1265	Data truncated for column 'col2' at row 1
select col1,col2 from wl1612 where col1>8;
col1	col2
9	1.0123456789
10	1.0123456789
11	1.0123456790
12	1.0123456790
insert into wl1612 (col1, col3) values(13,1.01234567891);
Warnings:
Warning	1265	Data truncated for column 'col3' at row 1
insert into wl1612 (col1, col3) values(14,1.01234567894);
Warnings:
Warning	1265	Data truncated for column 'col3' at row 1
insert into wl1612 (col1, col3) values(15,1.01234567895);
Warnings:
Warning	1265	Data truncated for column 'col3' at row 1
insert into wl1612 (col1, col3) values(16,1.01234567896);
Warnings:
Warning	1265	Data truncated for column 'col3' at row 1
select col1,col3 from wl1612 where col1>12;
col1	col3
13	1.0123456789
14	1.0123456789
15	1.0123456790
16	1.0123456790
select col1 from wl1612 where col1>4 and col2=1.01234567891;
col1
select col1 from wl1612 where col1>4 and col2=1.0123456789;
col1
9
10
select col1 from wl1612 where col1>4 and col2<>1.0123456789;
col1
5
6
7
8
11
12
select col1 from wl1612 where col1>4 and col2<1.0123456789;
col1
select col1 from wl1612 where col1>4 and col2<=1.0123456789;
col1
9
10
select col1 from wl1612 where col1>4 and col2>1.0123456789;
col1
5
6
7
8
11
12
select col1 from wl1612 where col1>4 and col2>=1.0123456789;
col1
5
6
7
8
9
10
11
12
select col1 from wl1612 where col1>4 and col2=1.012345679;
col1
11
12
select col1 from wl1612 where col1>4 and col2<>1.012345679;
col1
5
6
7
8
9
10
select col1 from wl1612 where col1>4 and col3=1.01234567891;
col1
select col1 from wl1612 where col1>4 and col3=1.0123456789;
col1
13
14
select col1 from wl1612 where col1>4 and col3<>1.0123456789;
col1
5
6
7
8
15
16
select col1 from wl1612 where col1>4 and col3<1.0123456789;
col1
select col1 from wl1612 where col1>4 and col3<=1.0123456789;
col1
13
14
select col1 from wl1612 where col1>4 and col3>1.0123456789;
col1
5
6
7
8
15
16
select col1 from wl1612 where col1>4 and col3>=1.0123456789;
col1
5
6
7
8
13
14
15
16
select col1 from wl1612 where col1>4 and col3=1.012345679;
col1
15
16
select col1 from wl1612 where col1>4 and col3<>1.012345679;
col1
5
6
7
8
13
14
drop table wl1612;
select 1/3;
1/3
0.3333
select 0.8=0.7+0.1;
0.8=0.7+0.1
1
select 0.7+0.1;
0.7+0.1
0.8
create table wl1612_1 (col1 int primary key);
insert into wl1612_1 values(10);
select * from wl1612_1 where 0.8=0.7+0.1;
col1
10
select 0.07+0.07 from wl1612_1;
0.07+0.07
0.14
select 0.07-0.07 from wl1612_1;
0.07-0.07
0.00
select 0.07*0.07 from wl1612_1;
0.07*0.07
0.0049
select 0.07/0.07 from wl1612_1;
0.07/0.07
1.000000
drop table wl1612_1;
create table wl1612_2 (col1 decimal(10,2), col2 numeric(10,2),id int primary key);
insert into wl1612_2 values(1,1,1);
insert into wl1612_2 values(+1,+1,2);
insert into wl1612_2 values(+01,+01,3);
insert into wl1612_2 values(+001,+001,4);
select col1,count(*) from wl1612_2 group by col1;
col1	count(*)
1.00	4
select col2,count(*) from wl1612_2 group by col2;
col2	count(*)
1.00	4
drop table wl1612_2;
create table wl1612_3 (col1 decimal(10,2), col2 numeric(10,2),id int primary key);
insert into wl1612_3 values('1','1',1);
insert into wl1612_3 values('+1','+1',2);
insert into wl1612_3 values('+01','+01',3);
insert into wl1612_3 values('+001','+001',4);
select col1,count(*) from wl1612_3 group by col1;
col1	count(*)
1.00	4
select col2,count(*) from wl1612_3 group by col2;
col2	count(*)
1.00	4
drop table wl1612_3;
select round(15.1);
round(15.1)
15
select round(15.4);
round(15.4)
15
select round(15.5);
round(15.5)
16
select round(15.6);
round(15.6)
16
select round(15.9);
round(15.9)
16
select round(-15.1);
round(-15.1)
-15
select round(-15.4);
round(-15.4)
-15
select round(-15.5);
round(-15.5)
-16
select round(-15.6);
round(-15.6)
-16
select round(-15.9);
round(-15.9)
-16
select round(15.1,1);
round(15.1,1)
15.1
select round(15.4,1);
round(15.4,1)
15.4
select round(15.5,1);
round(15.5,1)
15.5
select round(15.6,1);
round(15.6,1)
15.6
select round(15.9,1);
round(15.9,1)
15.9
select round(-15.1,1);
round(-15.1,1)
-15.1
select round(-15.4,1);
round(-15.4,1)
-15.4
select round(-15.5,1);
round(-15.5,1)
-15.5
select round(-15.6,1);
round(-15.6,1)
-15.6
select round(-15.9,1);
round(-15.9,1)
-15.9
select round(15.1,0);
round(15.1,0)
15
select round(15.4,0);
round(15.4,0)
15
select round(15.5,0);
round(15.5,0)
16
select round(15.6,0);
round(15.6,0)
16
select round(15.9,0);
round(15.9,0)
16
select round(-15.1,0);
round(-15.1,0)
-15
select round(-15.4,0);
round(-15.4,0)
-15
select round(-15.5,0);
round(-15.5,0)
-16
select round(-15.6,0);
round(-15.6,0)
-16
select round(-15.9,0);
round(-15.9,0)
-16
select round(15.1,-1);
round(15.1,-1)
20
select round(15.4,-1);
round(15.4,-1)
20
select round(15.5,-1);
round(15.5,-1)
20
select round(15.6,-1);
round(15.6,-1)
20
select round(15.9,-1);
round(15.9,-1)
20
select round(-15.1,-1);
round(-15.1,-1)
-20
select round(-15.4,-1);
round(-15.4,-1)
-20
select round(-15.5,-1);
round(-15.5,-1)
-20
select round(-15.6,-1);
round(-15.6,-1)
-20
select round(-15.91,-1);
round(-15.91,-1)
-20
create table wl1612_4 (col1 int primary key, col2 decimal(30,25), col3 numeric(30,25));
insert into wl1612_4 values(1,0.0123456789012345678912345,0.0123456789012345678912345);
select col2/9999999999 from wl1612_4 where col1=1;
col2/9999999999
0.00000000000123456789024691358
select col3/9999999999 from wl1612_4 where col1=1;
col3/9999999999
0.00000000000123456789024691358
select 9999999999/col2 from wl1612_4 where col1=1;
9999999999/col2
810000007209.0001
select 9999999999/col3 from wl1612_4 where col1=1;
9999999999/col3
810000007209.0001
select col2*9999999999 from wl1612_4 where col1=1;
col2*9999999999
123456789.0000000000111104321087655
select col3*9999999999 from wl1612_4 where col1=1;
col3*9999999999
123456789.0000000000111104321087655
insert into wl1612_4 values(2,55555.0123456789012345678912345,55555.0123456789012345678912345);
select col2/9999999999 from wl1612_4 where col1=2;
col2/9999999999
0.00000555550123512344024696913
select col3/9999999999 from wl1612_4 where col1=2;
col3/9999999999
0.00000555550123512344024696913
select 9999999999/col2 from wl1612_4 where col1=2;
9999999999/col2
180001.7600
select 9999999999/col3 from wl1612_4 where col1=2;
9999999999/col3
180001.7600
select col2*9999999999 from wl1612_4 where col1=2;
col2*9999999999
555550123401234.0000000000111104321087655
select col3*9999999999 from wl1612_4 where col1=2;
col3*9999999999
555550123401234.0000000000111104321087655
drop table wl1612_4;
set sql_mode='';
select 23.4 + (-41.7), 23.4 - (41.7) = -18.3;
23.4 + (-41.7)	23.4 - (41.7) = -18.3
-18.3	1
select -18.3=-18.3;
-18.3=-18.3
1
select 18.3=18.3;
18.3=18.3
1
select -18.3=18.3;
-18.3=18.3
0
select 0.8 = 0.7 + 0.1;
0.8 = 0.7 + 0.1
1
drop table if exists t1;
create table t1 (col1 decimal(38) primary key);
insert into t1 values (12345678901234567890123456789012345678);
select * from t1;
col1
12345678901234567890123456789012345678
drop table t1;
create table t1 (col1 decimal(31,30) primary key);
insert into t1 values (0.00000000001);
select * from t1;
col1
0.000000000010000000000000000000
drop table t1;
select 7777777777777777777777777777777777777 * 10;
7777777777777777777777777777777777777 * 10
77777777777777777777777777777777777770
select .7777777777777777777777777777777777777 * 1000000000000000000;
.7777777777777777777777777777777777777 * 1000000000000000000
777777777777777777.777777777777777777700000000000
select .7777777777777777777777777777777777777 - 0.1;
.7777777777777777777777777777777777777 - 0.1
0.6777777777777777777777777777777777777
select .343434343434343434 + .343434343434343434;
.343434343434343434 + .343434343434343434
0.686868686868686868
select abs(9999999999999999999999);
abs(9999999999999999999999)
9999999999999999999999
select abs(-9999999999999999999999);
abs(-9999999999999999999999)
9999999999999999999999
select floor(999999999999999999);
floor(999999999999999999)
999999999999999999
select floor(9999999999999999999999);
floor(9999999999999999999999)
9999999999999999999999
select floor(9.999999999999999999999);
floor(9.999999999999999999999)
9
select floor(-9.999999999999999999999);
floor(-9.999999999999999999999)
-10
select floor(-999999999999999999999.999);
floor(-999999999999999999999.999)
-1000000000000000000000
select 99999999999999999999999999999999999999 mod 3;
99999999999999999999999999999999999999 mod 3
0
select round(99999999999999999.999);
round(99999999999999999.999)
100000000000000000
select round(-99999999999999999.999);
round(-99999999999999999.999)
-100000000000000000
select round(99999999999999999.999,3);
round(99999999999999999.999,3)
99999999999999999.999
select round(-99999999999999999.999,3);
round(-99999999999999999.999,3)
-99999999999999999.999
select round(1.5),round(2.5);
round(1.5)	round(2.5)
2	3
set sql_mode='';
drop table if exists Sow6_2f;
CREATE TABLE Sow6_2f (col1 NUMERIC(4,2),id int primary key);
INSERT INTO Sow6_2f VALUES (10.55,1);
INSERT INTO Sow6_2f VALUES (10.5555,2);
Warnings:
Warning	1265	Data truncated for column 'col1' at row 1
INSERT INTO Sow6_2f VALUES (-10.55,3);
INSERT INTO Sow6_2f VALUES (-10.5555,4);
Warnings:
Warning	1265	Data truncated for column 'col1' at row 1
INSERT INTO Sow6_2f VALUES (11,5);
INSERT INTO Sow6_2f VALUES (101.55,6);
UPDATE Sow6_2f SET col1 = col1 * 50 WHERE col1 = 11;
UPDATE Sow6_2f SET col1 = col1 / 0 WHERE col1 > 0;
INSERT INTO Sow6_2f VALUES ('a59b',7);
Warnings:
Warning	1366	Incorrect decimal value for column 'col1' at row 1
drop table Sow6_2f;
select 10.3330000000000/12.34500000;
10.3330000000000/12.34500000
0.83701903604698258
set sql_mode='';
select 0/0;
0/0
NULL
select 9999999999999999999999999999999999999999999999999999999999999999999999999999999999999999999999999999999999999999999999999999999999 as x;
x
10000000000000000000000000000000000000000000000000000000000000000000000000000000000000000000000000000000000000000000000000000000000
select 9999999999999999999999999999999999999999999999999999999999999999999999999999999999999999999999999999999999999999999999999999999999 + 1 as x;
x
10000000000000000000000000000000000000000000000000000000000000000000000000000000000000000000000000000000000000000000000000000000000
select 0.190287977636363637 + 0.040372670 * 0 -  0;
0.190287977636363637 + 0.040372670 * 0 -  0
0.190287977636363637
select -0.123 * 0;
-0.123 * 0
0.000
CREATE TABLE t1 (f1 DECIMAL (12,9) primary key, f2 DECIMAL(2,2));
INSERT INTO t1 VALUES (10.5, 0);
UPDATE t1 SET f1 = 4.5;
SELECT * FROM t1;
f1	f2
4.500000000	0.00
DROP TABLE t1;
select abs(10/0);
abs(10/0)
NULL
select abs(NULL);
abs(NULL)
NULL
set @@sql_mode='STRICT_TRANS_TABLES';
create table t1( d1 decimal(18) unsigned primary key, d2 decimal(20) unsigned, d3 decimal (22) unsigned);
insert into t1 values(1,-1,-1);
ERROR 22003: Out of range value for column 'd2' at row 1
drop table t1;
create table t1 (col1 decimal(5,2), col2 numeric(5,2) primary key);
insert into t1 values (999.999,999.999);
ERROR 22003: Out of range value for column 'col2' at row 1
insert into t1 values (-999.999,-999.999);
ERROR 22003: Out of range value for column 'col2' at row 1
select * from t1;
col1	col2
drop table t1;
set sql_mode='';
create table t1 (col1 int primary key, col2 decimal(30,25), col3 numeric(30,25));
insert into t1 values (1,0.0123456789012345678912345,0.0123456789012345678912345);
select col2/9999999999 from t1 where col1=1;
col2/9999999999
0.00000000000123456789024691358
select 9999999999/col2 from t1 where col1=1;
9999999999/col2
810000007209.0001
select 77777777/7777777;
77777777/7777777
10.0000
drop table t1;
create table t1 (a decimal(4,2) primary key);
insert into t1 values (0.00);
select * from t1 where a > -0.00;
a
select * from t1 where a = -0.00;
a
0.00
drop table t1;
create table t1 (col1 bigint default -9223372036854775808,id int primary key);
insert into t1 values (default,1);
select * from t1;
col1	id
-9223372036854775808	1
drop table t1;
create table t1 (col1 bigint unsigned default 9223372036854775808, col2 bigint unsigned default 18446744073709551615);
insert into t1 values (default,default);
select * from t1;
col1	col2
9223372036854775808	18446744073709551615
drop table t1;
create table t1 (sl decimal(70,30) primary key);
ERROR 42000: Too big precision 70 specified for column 'sl'. Maximum is 65.
create table t1 (sl decimal(5, 5) primary key);
show create table t1;
Table	Create Table
t1	CREATE TABLE `t1` (
  `sl` decimal(5,5) NOT NULL,
  PRIMARY KEY (`sl`)
) ORGANIZATION INDEX DEFAULT CHARSET = utf8mb4 COMPRESSION = 'lz4_1.0' REPLICA_NUM = NUM BLOCK_SIZE = SIZE USE_BLOOM_FILTER = FALSE ENABLE_MACRO_BLOCK_BLOOM_FILTER = FALSE TABLET_SIZE = SIZE PCTFREE = 10
drop table t1;
create table t1 (
id int primary key,
f1 decimal unsigned not null default 17.49, 
f2 decimal unsigned not null default 17.68, 
f3 decimal unsigned not null default 99.2, 
f4 decimal unsigned not null default 99.7, 
f5 decimal unsigned not null default 104.49, 
f6 decimal unsigned not null default 199.91, 
f7 decimal unsigned not null default 999.9, 
f8 decimal unsigned not null default 9999.99);
insert into t1 (id,f1) values (1,1);
select * from t1;
id	f1	f2	f3	f4	f5	f6	f7	f8
1	1	18	99	100	104	200	1000	10000
drop table t1;
create table t1 (
id int primary key,
f0 decimal (30,30) zerofill not null DEFAULT 0,
f1 decimal (0,0) zerofill not null default 0);
show create table t1;
Table	Create Table
t1	CREATE TABLE `t1` (
  `id` int(11) NOT NULL,
  `f0` decimal(30,30) unsigned zerofill NOT NULL DEFAULT '0.000000000000000000000000000000',
  `f1` decimal(10,0) unsigned zerofill NOT NULL DEFAULT '0',
  PRIMARY KEY (`id`)
) ORGANIZATION INDEX DEFAULT CHARSET = utf8mb4 COMPRESSION = 'lz4_1.0' REPLICA_NUM = NUM BLOCK_SIZE = SIZE USE_BLOOM_FILTER = FALSE ENABLE_MACRO_BLOCK_BLOOM_FILTER = FALSE TABLET_SIZE = SIZE PCTFREE = 10
drop table t1;
create table t1(a decimal(7,2) ,id int primary key);
insert into t1 values(123.12,1);
select * from t1;
a	id
123.12	1
alter table t1 modify a decimal(10,2);
select * from t1;
a	id
123.12	1
drop table t1;
create table t1 (i int, j int primary key);
insert into t1 values (1,1), (1,2), (2,3), (2,4);
select i, count(distinct j) from t1 group by i;
i	count(distinct j)
1	2
2	2
select i+0.0 as i2, count(distinct j) from t1 group by i2;
i2	count(distinct j)
1.0	2
2.0	2
drop table t1;
create table t1(f1 decimal(20,6) primary key);
insert into t1 values (CAST('10:11:12' AS time));
select * from t1;
f1
101112.000000
drop table t1;
select cast(19999999999999999999 as unsigned);
cast(19999999999999999999 as unsigned)
18446744073709551615
create table t1(a decimal(18),id int primary key);
insert into t1 values(123456789012345678,1);
alter table t1 modify column a decimal(19);
select * from t1;
a	id
123456789012345678	1
drop table t1;
select cast(11.1234 as DECIMAL(3,2));
cast(11.1234 as DECIMAL(3,2))
9.99
select * from (select cast(11.1234 as DECIMAL(3,2))) t;
cast(11.1234 as DECIMAL(3,2))
9.99
create table t1 (s varchar(100) primary key);
insert into t1 values (0.00000000010000000000000000364321973154977415791655470655996396089904010295867919921875);
drop table t1;
SELECT 1.000000000000 * 99.999999999998 / 100 a,1.000000000000 * (99.999999999998 / 100) b;
a	b
0.9999999999999800000000000000	0.9999999999999800000000000000
CREATE TABLE t1 (a int primary key, b int DEFAULT NULL);
INSERT INTO t1 VALUES (3,30), (1,10), (2,10);
SELECT a+CAST(1 AS decimal(38,30)) AS aa, SUM(b) FROM t1 GROUP BY aa;
aa	SUM(b)
2.000000000000000000000000000000	10
3.000000000000000000000000000000	10
4.000000000000000000000000000000	30
DROP TABLE t1;
select (1.20396873 * 0.89550000 * 0.68000000 * 1.08721696 * 0.99500000 *
1.01500000 * 1.01500000 * 0.99500000);
(1.20396873 * 0.89550000 * 0.68000000 * 1.08721696 * 0.99500000 *
1.01500000 * 1.01500000 * 0.99500000)
0.812988073953673124592306939480
select cast(143.481 as decimal(4,1));
cast(143.481 as decimal(4,1))
143.5
select cast(143.481 as decimal(4,0));
cast(143.481 as decimal(4,0))
143
select cast(143.481 as decimal(2,1));
cast(143.481 as decimal(2,1))
9.9
select cast(-3.4 as decimal(2,1));
cast(-3.4 as decimal(2,1))
-3.4
select cast(99.6 as decimal(2,0));
cast(99.6 as decimal(2,0))
99
select cast(-13.4 as decimal(2,1));
cast(-13.4 as decimal(2,1))
-9.9
select cast(98.6 as decimal(2,0));
cast(98.6 as decimal(2,0))
99
CREATE TABLE currencies (id int, rate decimal(16,4), 
PRIMARY KEY (id));
INSERT INTO currencies VALUES (11,0.7028);
INSERT INTO currencies VALUES (1,1);
CREATE TABLE payments (
id int,
supplier_id int,
status int,
currency_id int,
vat decimal(7,4),
PRIMARY KEY (id)
);
INSERT INTO payments (id,status,vat,supplier_id,currency_id) VALUES
(3001,2,0.0000,344,11), (1,2,0.0000,1,1);
CREATE TABLE sub_tasks (
id int,
currency_id int,
price decimal(16,4),
discount decimal(10,4),
payment_id int,
PRIMARY KEY (id)
) ;
INSERT INTO sub_tasks (id, price, discount, payment_id, currency_id) VALUES
(52, 12.60, 0, 3001, 11), (56, 14.58, 0, 3001, 11);
DROP TABLE currencies, payments, sub_tasks;
#
# BUG#52171: distinct aggregates on unsigned decimal fields trigger assertions
#
CREATE TABLE t1 (a DECIMAL(4,4) UNSIGNED,id int primary key);
INSERT INTO t1 VALUES (0,1);
SELECT AVG(DISTINCT a) FROM t1;
AVG(DISTINCT a)
0.00000000
SELECT SUM(DISTINCT a) FROM t1;
SUM(DISTINCT a)
0.0000
DROP TABLE t1;
#
# Bug#55436: buffer overflow in debug binary of dbug_buff in
#            Field_new_decimal::store_value
#
CREATE TABLE t1 (a DECIMAL(20,3) NOT NULL primary key);
INSERT INTO t1 VALUES (20000716055804.035);
INSERT INTO t1 VALUES (20080821000000.000);
INSERT INTO t1 VALUES (0);
SELECT GREATEST(a, 1323) FROM t1;
GREATEST(a, 1323)
1323.000
20000716055804.035
20080821000000.000
(SELECT GREATEST(a, 1323) FROM t1) UNION ALL (SELECT GREATEST(a, 1323) FROM t1 LIMIT 0);
GREATEST(a, 1323)
1323.000
20000716055804.035
20080821000000.000
DROP TABLE t1;
#
# End of 5.6 tests
#
