drop table if exists t1;
create table t1 (c1 int);
insert into t1 values (1),(2),(3),(4),(5),(6),(7),(8),(9),(10);
result_format: 4
select * from t1;
+------+
| c1   |
+------+
|    1 |
|    2 |
|    3 |
|    4 |
|    5 |
|    6 |
|    7 |
|    8 |
|    9 |
|   10 |
+------+
update t1 set c1=10 order by c1 limit 2 offset 1;
ERROR 42000: You have an error in your SQL syntax; check the manual that corresponds to your OceanBase version for the right syntax to use near '1' at line 1
update t1 set c1=10 order by c1 limit 2,3;
ERROR 42000: You have an error in your SQL syntax; check the manual that corresponds to your OceanBase version for the right syntax to use near '2' at line 1
update t1 set c1=10 order by c1 limit 2;
select * from t1;
+------+
| c1   |
+------+
|   10 |
|   10 |
|    3 |
|    4 |
|    5 |
|    6 |
|    7 |
|    8 |
|    9 |
|   10 |
+------+

delete from t1 order by c1 limit 2 offset 1;
ERROR 42000: You have an error in your SQL syntax; check the manual that corresponds to your OceanBase version for the right syntax to use near '1' at line 1
delete from t1 order by c1 limit 2,3;
ERROR 42000: You have an error in your SQL syntax; check the manual that corresponds to your OceanBase version for the right syntax to use near '2' at line 1
delete from t1 order by c1 limit 2;
select * from t1;
+------+
| c1   |
+------+
|   10 |
|   10 |
|    5 |
|    6 |
|    7 |
|    8 |
|    9 |
|   10 |
+------+

drop table t1;
