select 1 /*! ,2 */;
1	2
1	2
select 1 /**! ,2 */;
1
1
select 1 /*! ,2 **/;
1
1
select 1 /**! ,2 **/;
1
1
select 1 /*!,2*/;
1	2
1	2
select 1 /*!,2 */;
1	2
1	2
select 1 /*! ,2*/;
1	2
1	2
select 1/*!,2*/,3;
1	2	3
1	2	3
select 1 /*!50600 ,2 */;
1	2
1	2
select 1 /*!80600 ,2 */;
1	2
1	2
select 1 /**!50600 ,2 */;
1
1
select 1 /**!80600 ,2 */;
1
1
select 1 /*!50600 ,2 **/;
1
1
select 1 /*!80600 ,2 **/;
1
1
select 1 /*!506000 ,2 */;
1
1
select 1 /*!5060 ,2 */;
1
1
select 1 /*!5061l ,2 */;
5061l	2
1	2
select 1 /*!50*/l ,2 */;
ERROR 42000: You have an error in your SQL syntax; check the manual that corresponds to your OceanBase version for the right syntax to use near '/' at line 1
select 1 /*!5.6.11 ,2 */;
1
1
drop table t1;
create table t1 (c1 int);
insert into t1 values (1);
select 1 /*! ,* */ from t1;
1	c1
1	1
select 1 /*! ,* */ */ from t1;
ERROR 42000: You have an error in your SQL syntax; check the manual that corresponds to your OceanBase version for the right syntax to use near '/ from t1' at line 1
select 1 /*! ,* ***/ */ from t1;
ERROR 42000: You have an error in your SQL syntax; check the manual that corresponds to your OceanBase version for the right syntax to use near '/ from t1' at line 1
insert into t1 values(1)/*!50000 ,(2),(3) */;
select * from t1;
c1
1
1
2
3
update t1 set c1 = 1 /*!50000 where c1=2 */;
select * from t1;
c1
1
1
1
3
delete from t1 /*!50000 where c1=2 */;
select * from t1;
c1
1
1
1
3
drop table t1;
create table t1 (c1 int /*! primary key*/, c2 int);
desc t1;
Field	Type	Null	Key	Default	Extra
c1	int(11)	NO	PRI	NULL	
c2	int(11)	YES		NULL	
drop table t1;
drop table t2;
create table t1 (c1 int);
create table t2 /*!50000 like t1 */;
desc t2;
Field	Type	Null	Key	Default	Extra
c1	int(11)	YES		NULL	
drop table t1;
drop table t2;
create table t1 (c1 int /*!50000 primary key*/);
create table t2 (c1 int,c2 int,/*! foreign key(c2) references t1(c1)*/);
desc t2;
Field	Type	Null	Key	Default	Extra
c1	int(11)	YES		NULL	
c2	int(11)	YES		NULL	
insert into t2 values (1,1);
ERROR 23000: Cannot add or update a child row: a foreign key constraint fails
drop table t2;
drop table t1;
select 1*/*!2*/;
1*/*!2
2
select 1*/*!2**/3;
1*/*!2**/3
6
select /*!111111 */;
1
1
select /*!111111 */;
1
1
create table t1 (c1 int);
select */*!,2*/ from t1;
c1	2
drop table t1;
