result_format: 4
set _enable_rich_vector_format = false;
drop table if exists t1;
create table t1(a int, b int, c float, d double, e number(10, 2));

insert into t1 values (1, 2, 3.1, 4.5, 6.23);
insert into t1 values (1, 3, 3.1, 4.4, 6.2);
insert into t1 values (2, 4, 4.5, 32.2, 112.2);
insert into t1 values (3, 4, 5, 6, 7);
insert into t1 values (3, NULL, NULL, 123454.33, NULL);

select count(b), sum(b), max(b), min(b), count(c), sum(c), max(c), min(c), count(d), sum(d), max(d), min(d), count(e), sum(e), max(e), min(e), a from t1 group by a;
+----------+--------+--------+--------+----------+-------------------+--------+--------+----------+-----------+-----------+--------+----------+--------+--------+--------+------+
| count(b) | sum(b) | max(b) | min(b) | count(c) | sum(c)            | max(c) | min(c) | count(d) | sum(d)    | max(d)    | min(d) | count(e) | sum(e) | max(e) | min(e) | a    |
+----------+--------+--------+--------+----------+-------------------+--------+--------+----------+-----------+-----------+--------+----------+--------+--------+--------+------+
|        1 |      4 |      4 |      4 |        1 |                 5 |      5 |      5 |        2 | 123460.33 | 123454.33 |      6 |        1 |   7.00 |   7.00 |   7.00 |    3 |
|        1 |      4 |      4 |      4 |        1 |               4.5 |    4.5 |    4.5 |        1 |      32.2 |      32.2 |   32.2 |        1 | 112.20 | 112.20 | 112.20 |    2 |
|        2 |      5 |      3 |      2 |        2 | 6.199999809265137 |    3.1 |    3.1 |        2 |       8.9 |       4.5 |    4.4 |        2 |  12.43 |   6.23 |   6.20 |    1 |
+----------+--------+--------+--------+----------+-------------------+--------+--------+----------+-----------+-----------+--------+----------+--------+--------+--------+------+
select /*+parallel(2)*/ count(b), sum(b), max(b), min(b), count(c), sum(c), max(c), min(c), count(d), sum(d), max(d), min(d), count(e), sum(e), max(e), min(e), a from t1 group by a;
+----------+--------+--------+--------+----------+-------------------+--------+--------+----------+-----------+-----------+--------+----------+--------+--------+--------+------+
| count(b) | sum(b) | max(b) | min(b) | count(c) | sum(c)            | max(c) | min(c) | count(d) | sum(d)    | max(d)    | min(d) | count(e) | sum(e) | max(e) | min(e) | a    |
+----------+--------+--------+--------+----------+-------------------+--------+--------+----------+-----------+-----------+--------+----------+--------+--------+--------+------+
|        1 |      4 |      4 |      4 |        1 |                 5 |      5 |      5 |        2 | 123460.33 | 123454.33 |      6 |        1 |   7.00 |   7.00 |   7.00 |    3 |
|        1 |      4 |      4 |      4 |        1 |               4.5 |    4.5 |    4.5 |        1 |      32.2 |      32.2 |   32.2 |        1 | 112.20 | 112.20 | 112.20 |    2 |
|        2 |      5 |      3 |      2 |        2 | 6.199999809265137 |    3.1 |    3.1 |        2 |       8.9 |       4.5 |    4.4 |        2 |  12.43 |   6.23 |   6.20 |    1 |
+----------+--------+--------+--------+----------+-------------------+--------+--------+----------+-----------+-----------+--------+----------+--------+--------+--------+------+

select /*+parallel(2)*/ count(distinct b), sum(distinct b), min(distinct b), max(distinct b),
                        count(distinct c), sum(distinct c), min(distinct c), max(distinct c),
                        count(distinct d), sum(distinct d), min(distinct d), max(distinct d),
                        count(distinct e), sum(distinct e), min(distinct e), max(distinct e),
                        a from t1 group by a;
+-------------------+-----------------+-----------------+-----------------+-------------------+--------------------+-----------------+-----------------+-------------------+-----------------+-----------------+-----------------+-------------------+-----------------+-----------------+-----------------+------+
| count(distinct b) | sum(distinct b) | min(distinct b) | max(distinct b) | count(distinct c) | sum(distinct c)    | min(distinct c) | max(distinct c) | count(distinct d) | sum(distinct d) | min(distinct d) | max(distinct d) | count(distinct e) | sum(distinct e) | min(distinct e) | max(distinct e) | a    |
+-------------------+-----------------+-----------------+-----------------+-------------------+--------------------+-----------------+-----------------+-------------------+-----------------+-----------------+-----------------+-------------------+-----------------+-----------------+-----------------+------+
|                 1 |               4 |               4 |               4 |                 1 |                  5 |               5 |               5 |                 2 |       123460.33 |               6 |       123454.33 |                 1 |            7.00 |            7.00 |            7.00 |    3 |
|                 1 |               4 |               4 |               4 |                 1 |                4.5 |             4.5 |             4.5 |                 1 |            32.2 |            32.2 |            32.2 |                 1 |          112.20 |          112.20 |          112.20 |    2 |
|                 2 |               5 |               2 |               3 |                 1 | 3.0999999046325684 |             3.1 |             3.1 |                 2 |             8.9 |             4.4 |             4.5 |                 2 |           12.43 |            6.20 |            6.23 |    1 |
+-------------------+-----------------+-----------------+-----------------+-------------------+--------------------+-----------------+-----------------+-------------------+-----------------+-----------------+-----------------+-------------------+-----------------+-----------------+-----------------+------+

delete from t1;
select count(*) from t1;
+----------+
| count(*) |
+----------+
|        0 |
+----------+
select sum(a), sum(b), sum(c), sum(d), sum(e) from t1;
+--------+--------+--------+--------+--------+
| sum(a) | sum(b) | sum(c) | sum(d) | sum(e) |
+--------+--------+--------+--------+--------+
|   NULL |   NULL |   NULL |   NULL |   NULL |
+--------+--------+--------+--------+--------+
select min(a), max(a), min(b), max(b), min(c), max(c), min(d), max(d), min(e), max(e) from t1;
+--------+--------+--------+--------+--------+--------+--------+--------+--------+--------+
| min(a) | max(a) | min(b) | max(b) | min(c) | max(c) | min(d) | max(d) | min(e) | max(e) |
+--------+--------+--------+--------+--------+--------+--------+--------+--------+--------+
|   NULL |   NULL |   NULL |   NULL |   NULL |   NULL |   NULL |   NULL |   NULL |   NULL |
+--------+--------+--------+--------+--------+--------+--------+--------+--------+--------+

insert into t1 values (1, 2, 3.1, 4.5, 6.23);
insert into t1 values (1, 3, 3.1, 4.4, 6.2);
insert into t1 values (2, 4, 4.5, 32.2, 112.2);
insert into t1 values (3, 4, 5, 6, 7);
insert into t1 values (3, NULL, NULL, 123454.33, NULL);

select count(*), count(b), count(c), count(d), count(a), sum(a), sum(b), sum(c), sum(d) from t1;
+----------+----------+----------+----------+----------+--------+--------+--------------------+--------------------+
| count(*) | count(b) | count(c) | count(d) | count(a) | sum(a) | sum(b) | sum(c)             | sum(d)             |
+----------+----------+----------+----------+----------+--------+--------+--------------------+--------------------+
|        5 |        4 |        4 |        5 |        5 |     10 |     13 | 15.699999809265137 | 123501.43000000001 |
+----------+----------+----------+----------+----------+--------+--------+--------------------+--------------------+
select count(*), min(a), max(a), min(b), max(b), min(c), max(c), min(d), max(d), min(e), max(e) from t1;
+----------+--------+--------+--------+--------+--------+--------+--------+-----------+--------+--------+
| count(*) | min(a) | max(a) | min(b) | max(b) | min(c) | max(c) | min(d) | max(d)    | min(e) | max(e) |
+----------+--------+--------+--------+--------+--------+--------+--------+-----------+--------+--------+
|        5 |      1 |      3 |      2 |      4 |    3.1 |      5 |    4.4 | 123454.33 |   6.20 | 112.20 |
+----------+--------+--------+--------+--------+--------+--------+--------+-----------+--------+--------+
select count(distinct a, b, c), count(distinct a), count(distinct b), count(distinct c), sum(distinct a), sum(distinct b), sum(distinct c), sum(distinct d) from t1;
+-------------------------+-------------------+-------------------+-------------------+-----------------+-----------------+--------------------+--------------------+
| count(distinct a, b, c) | count(distinct a) | count(distinct b) | count(distinct c) | sum(distinct a) | sum(distinct b) | sum(distinct c)    | sum(distinct d)    |
+-------------------------+-------------------+-------------------+-------------------+-----------------+-----------------+--------------------+--------------------+
|                       4 |                 3 |                 3 |                 3 |               6 |               9 | 12.599999904632568 | 123501.43000000001 |
+-------------------------+-------------------+-------------------+-------------------+-----------------+-----------------+--------------------+--------------------+

drop table t1;
create table t1(a int, b int, c int);

insert into t1 values (1, 2, 3), (4, 5, 6), (7, 8, 9), (0, 1, 2), (3, 4, 5), (6, 7, 8), (9, 0, 1), (2, 3, 4), (5, 6, 7), (8, 9, 0), (11, 12, 13);

explain select /*+use_hash_aggregation*/min(NULL), max(NULL), sum(NULL), count(NULL) from t1 group by a, b, c order by 1, 2, 3 limit 10;
Query Plan
===================================================
|ID|OPERATOR           |NAME|EST.ROWS|EST.TIME(us)|
---------------------------------------------------
|0 |TOP-N SORT         |    |10      |8           |
|1 |└─HASH GROUP BY    |    |11      |7           |
|2 |  └─TABLE FULL SCAN|t1  |11      |3           |
===================================================
Outputs & filters:
-------------------------------------
  0 - output([NULL], [NULL], [T_FUN_SUM(cast(NULL, DOUBLE(-1, -1)))], [0]), filter(nil), rowset=16
      sort_keys([T_FUN_SUM(cast(NULL, DOUBLE(-1, -1))), ASC]), topn(10)
  1 - output([T_FUN_SUM(cast(NULL, DOUBLE(-1, -1)))]), filter(nil), rowset=16
      group([t1.a], [t1.b], [t1.c]), agg_func([T_FUN_SUM(cast(NULL, DOUBLE(-1, -1)))])
  2 - output([t1.a], [t1.b], [t1.c]), filter(nil), rowset=16
      access([t1.a], [t1.b], [t1.c]), partitions(p0)
      is_index_back=false, is_global_index=false, 
      range_key([t1.__pk_increment]), range(MIN ; MAX)always true
select /*+use_hash_aggregation*/min(NULL), max(NULL), sum(NULL), count(NULL) from t1 group by a, b, c order by 1, 2, 3 limit 10;
+-----------+-----------+-----------+-------------+
| min(NULL) | max(NULL) | sum(NULL) | count(NULL) |
+-----------+-----------+-----------+-------------+
|      NULL |      NULL |      NULL |           0 |
|      NULL |      NULL |      NULL |           0 |
|      NULL |      NULL |      NULL |           0 |
|      NULL |      NULL |      NULL |           0 |
|      NULL |      NULL |      NULL |           0 |
|      NULL |      NULL |      NULL |           0 |
|      NULL |      NULL |      NULL |           0 |
|      NULL |      NULL |      NULL |           0 |
|      NULL |      NULL |      NULL |           0 |
|      NULL |      NULL |      NULL |           0 |
+-----------+-----------+-----------+-------------+
drop table t1;

drop table if exists tbl_214;
drop table if exists tbl_320;
CREATE TABLE `tbl_214` (
  `col_30886` decimal(36,4) DEFAULT NULL,
  `col_30887` decimal(23,11) NOT NULL DEFAULT '1198.33300000000',
  `col_30888` json DEFAULT NULL,
  `col_30889` mediumint(8) unsigned DEFAULT NULL,
  `col_30890` decimal(13,2) DEFAULT '524.00',
  `col_30891` int(10) unsigned DEFAULT '232037091',
  `col_30892` bit(28) DEFAULT b'1100101111011100111110100',
  `col_30893` smallint(6) DEFAULT NULL,
  `col_30894` timestamp NOT NULL,
  `col_30895` mediumint(9) NOT NULL,
  `col_30896` smallint(5) unsigned DEFAULT '47176',
  `col_30897` bit(4) DEFAULT NULL,
  `col_30898` enum('Alice','Bob','Charlie','David') NOT NULL DEFAULT 'Bob',
  `col_30899` json DEFAULT NULL,
  `col_30900` varbinary(163) NOT NULL,
  `col_30901` bit(21) NOT NULL,
  `col_30902` json DEFAULT NULL,
  `col_30903` char(141) NOT NULL,
  `col_30904` bit(35) DEFAULT b'11101110000000111011000011101101',
  `col_30905` year(4) DEFAULT NULL,
  `col_30906` bigint(20) unsigned NOT NULL,
  `col_30907` set('Alice','Bob','Charlie','David') DEFAULT 'David',
  `col_30908` bit(53) DEFAULT NULL,
  `col_30909` char(41) NOT NULL DEFAULT 'HVtj7yR^&anfyLvw*',
  `col_30910` varbinary(303) NOT NULL DEFAULT 'H',
  `col_30911` int(10) unsigned DEFAULT '3853149302',
  `col_30912` mediumint(8) unsigned DEFAULT NULL,
  `col_30913` json DEFAULT NULL,
  `col_30914` double NOT NULL,
  `col_30915` tinyint(3) unsigned DEFAULT '177',
  `col_30916` bigint(20) NOT NULL,
  `col_30917` date DEFAULT NULL,
  `col_30918` bit(30) NOT NULL DEFAULT b'11101011010100001000101100001',
  `col_30919` time NOT NULL,
  `col_30920` int(10) unsigned DEFAULT NULL,
  `col_30921` int(10) unsigned NOT NULL DEFAULT '3777971060',
  `col_30922` set('Alice','Bob','Charlie','David') NOT NULL DEFAULT 'Charlie',
  `col_30923` bit(18) NOT NULL DEFAULT b'111010100100001010',
  `col_30924` mediumint(8) unsigned DEFAULT '11956711',
  `col_30925` mediumint(9) DEFAULT NULL,
  `col_30926` float DEFAULT '1664.14',
  `col_30927` bit(43) DEFAULT b'110101111101110100111011111110101110',
  `col_30928` double NOT NULL DEFAULT '4801.223388218327',
  `col_30929` timestamp NULL DEFAULT NULL,
  `col_30930` time DEFAULT '12:28:36',
  `col_30931` bigint(20) unsigned NOT NULL,
  `col_30932` double NOT NULL,
  `col_30933` decimal(55,2) DEFAULT '3.00',
  `col_30934` json DEFAULT NULL,
  `col_30935` binary(29) NOT NULL DEFAULT 'nhvM7h',
  `col_30936` bit(23) DEFAULT b'10011100101100000010011',
  `col_30937` float NOT NULL,
  `col_30938` varchar(448) NOT NULL,
  `col_30939` varbinary(501) NOT NULL DEFAULT '1R0Ln',
  `col_30940` varbinary(325) NOT NULL DEFAULT 'm#wS_AQf$_u#=ILo',
  `col_30941` tinyint(3) unsigned NOT NULL,
  `col_30942` smallint(6) NOT NULL,
  `col_30943` text NOT NULL,
  `col_30944` binary(105) DEFAULT 'wsLunO8y9D4EJB',
  `col_30945` bigint(20) unsigned NOT NULL DEFAULT '1968270691402337896',
  `col_30946` smallint(6) DEFAULT '15194',
  `col_30947` decimal(55,5) DEFAULT NULL,
  `col_30948` mediumint(9) DEFAULT '-7356012',
  `col_30949` decimal(44,29) DEFAULT NULL,
  `col_30950` datetime DEFAULT '2004-07-25 00:00:00',
  `col_30951` varchar(118) NOT NULL,
  `col_30952` tinyint(1) DEFAULT NULL,
  `col_30953` smallint(6) DEFAULT NULL,
  `col_30954` tinyint(1) DEFAULT '1',
  `col_30955` int(11) NOT NULL DEFAULT '-939582107',
  `col_30956` smallint(6) DEFAULT NULL,
  `col_30957` bit(28) DEFAULT NULL,
  `col_30958` tinyint(1) DEFAULT '0',
  `col_30959` int(10) unsigned NOT NULL DEFAULT '2322641720',
  `col_30960` tinyint(4) DEFAULT '3',
  `col_30961` text DEFAULT NULL,
  `col_30962` text NOT NULL,
  `col_30963` char(53) DEFAULT NULL,
  `col_30964` smallint(5) unsigned DEFAULT '38749',
  `col_30965` int(11) NOT NULL,
  `col_30966` tinytext NOT NULL,
  `col_30967` json NOT NULL,
  `col_30968` float NOT NULL,
  PRIMARY KEY (`col_30965`, `col_30894`, `col_30945`, `col_30932`, `col_30906`)
);

CREATE TABLE `tbl_320` (
  `col_13354` date DEFAULT NULL,
  `col_13355` tinyint(1) DEFAULT NULL,
  `col_13356` json NOT NULL,
  `col_13357` json DEFAULT NULL,
  `col_13358` binary(246) NOT NULL,
  `col_13359` float NOT NULL,
  `col_13360` int(11) DEFAULT NULL,
  `col_13361` bigint(20) NOT NULL,
  `col_13362` tinytext NOT NULL,
  `col_13363` tinytext DEFAULT NULL,
  `col_13364` varchar(350) DEFAULT 'HfdK_WCNqvFm2Z',
  `col_13365` varbinary(386) DEFAULT NULL,
  `col_13366` time NOT NULL DEFAULT '02:03:19',
  `col_13367` char(28) DEFAULT NULL,
  `col_13368` char(97) DEFAULT 'F2%Gu&',
  `col_13369` enum('Alice','Bob','Charlie','David') DEFAULT 'Bob',
  `col_13370` bit(35) DEFAULT b'1111100101101110110011010111001100',
  `col_13371` float DEFAULT '2534.27',
  `col_13372` smallint(6) NOT NULL DEFAULT '28894',
  `col_13373` text NOT NULL,
  `col_13374` text DEFAULT NULL,
  `col_13375` mediumint(8) unsigned NOT NULL DEFAULT '3028409',
  `col_13376` smallint(5) unsigned DEFAULT '18733',
  `col_13377` char(180) DEFAULT '筌稝)蓆^@S_j蝰峙Yh',
  `col_13378` smallint(5) unsigned NOT NULL,
  `col_13379` int(10) unsigned NOT NULL DEFAULT '3780933852',
  `col_13380` bigint(20) NOT NULL DEFAULT '-4144667699997932955',
  `col_13381` time NOT NULL DEFAULT '03:22:28',
  `col_13382` float NOT NULL DEFAULT '5893.04',
  `col_13383` varchar(442) DEFAULT NULL,
  `col_13384` float NOT NULL,
  `col_13385` text DEFAULT NULL,
  `col_13386` tinyint(3) unsigned NOT NULL,
  `col_13387` date DEFAULT NULL,
  `col_13388` bigint(20) unsigned DEFAULT NULL,
  `col_13389` set('Alice','Bob','Charlie','David') NOT NULL DEFAULT 'Charlie',
  `col_13390` binary(171) NOT NULL DEFAULT '%yYzx7FSh',
  `col_13391` char(42) NOT NULL,
  `col_13392` smallint(5) unsigned DEFAULT NULL,
  `col_13393` mediumint(9) DEFAULT NULL,
  `col_13394` binary(23) NOT NULL DEFAULT '&V8!Mo',
  `col_13395` text DEFAULT NULL,
  `col_13396` json NOT NULL,
  `col_13397` tinyint(4) DEFAULT '-81',
  `col_13398` mediumint(9) DEFAULT NULL,
  `col_13399` bigint(20) NOT NULL DEFAULT '4823822899115792712',
  `col_13400` char(76) NOT NULL,
  `col_13401` json NOT NULL,
  `col_13402` blob DEFAULT NULL,
  `col_13403` json DEFAULT NULL,
  `col_13404` varchar(395) NOT NULL DEFAULT '',
  `col_13405` set('Alice','Bob','Charlie','David') NOT NULL,
  `col_13406` mediumint(9) NOT NULL,
  `col_13407` bigint(20) NOT NULL DEFAULT '-7039858127133553067',
  `col_13408` bit(31) NOT NULL DEFAULT b'1001101011100110010110111101',
  `col_13409` time DEFAULT '23:38:01',
  `col_13410` varchar(65) DEFAULT '',
  `col_13411` tinyint(3) unsigned NOT NULL DEFAULT '130',
  `col_13412` mediumint(9) DEFAULT '-5836331',
  `col_13413` tinyint(4) DEFAULT '-94',
  `col_13414` smallint(5) unsigned NOT NULL,
  `col_13415` bigint(20) NOT NULL,
  `col_13416` datetime DEFAULT NULL,
  `col_13417` year(4) DEFAULT NULL,
  `col_13418` set('Alice','Bob','Charlie','David') DEFAULT 'Bob',
  `col_13419` decimal(45,15) DEFAULT '60.132000000000000',
  `col_13420` json NOT NULL,
  `col_13421` enum('Alice','Bob','Charlie','David') NOT NULL,
  `col_13422` tinyint(3) unsigned DEFAULT NULL,
  `col_13423` json NOT NULL,
  `col_13424` binary(159) DEFAULT NULL,
  `col_13425` double DEFAULT '7542.7102839775625',
  `col_13426` varchar(49) DEFAULT 'xn-MyZ@BR!Ya',
  `col_13427` bit(24) DEFAULT NULL,
  `col_13428` bigint(20) unsigned DEFAULT '6436740464081408752',
  `col_13429` tinyblob DEFAULT NULL,
  `col_13430` json NOT NULL,
  `col_13431` smallint(6) NOT NULL,
  `col_13432` blob DEFAULT NULL,
  `col_13433` set('Alice','Bob','Charlie','David') NOT NULL,
  `col_13434` float NOT NULL,
  `col_13435` mediumint(9) DEFAULT NULL,
  `col_13436` bit(27) NOT NULL,
  `col_13437` mediumint(9) NOT NULL,
  `col_13438` enum('Alice','Bob','Charlie','David') DEFAULT 'David',
  `col_13439` enum('Alice','Bob','Charlie','David') NOT NULL DEFAULT 'David',
  `col_13440` tinyint(1) DEFAULT '0',
  `col_13441` enum('Alice','Bob','Charlie','David') DEFAULT NULL,
  `col_13442` tinyint(3) unsigned DEFAULT '72',
  `col_13443` char(29) NOT NULL DEFAULT 'eCxp2#e@HX_W8v+mZHU',
  `col_13444` bigint(20) unsigned DEFAULT '1001182261602730954',
  `col_13445` time DEFAULT NULL,
  `col_13446` bit(30) DEFAULT NULL,
  `col_13447` float NOT NULL,
  `col_13448` tinyblob DEFAULT NULL,
  `col_13449` set('Alice','Bob','Charlie','David') DEFAULT 'David',
  `col_13450` mediumint(9) NOT NULL DEFAULT '448095',
  `col_13451` double NOT NULL DEFAULT '7141.322879079066',
  `col_13452` tinyblob NOT NULL,
  `col_13453` binary(38) DEFAULT NULL,
  `col_13454` bigint(20) unsigned NOT NULL DEFAULT '6614282537193448070',
  `col_13455` varbinary(323) NOT NULL,
  `col_13456` time NOT NULL DEFAULT '18:06:06',
  `col_13457` text NOT NULL,
  `col_13458` set('Alice','Bob','Charlie','David') NOT NULL,
  `col_13459` json NOT NULL,
  `col_13460` timestamp NOT NULL DEFAULT '1980-04-04 00:00:00',
  `col_13461` varchar(61) DEFAULT 'I~1_c軤k囉YTs',
  `col_13462` bit(35) NOT NULL,
  PRIMARY KEY (`col_13450`, `col_13391`, `col_13406`)
) DEFAULT CHARSET = utf8mb4 ROW_FORMAT = CONDENSED COMPRESSION = 'snappy_1.0' REPLICA_NUM = 1 BLOCK_SIZE = 16384 USE_BLOOM_FILTER = FALSE TABLET_SIZE = 134217728 PCTFREE = 0
 partition by hash(col_13450)
(partition `p0`,
partition `p1`,
partition `p2`,
partition `p3`,
partition `p4`,
partition `p5`,
partition `p6`,
partition `p7`,
partition `p8`,
partition `p9`,
partition `p10`,
partition `p11`,
partition `p12`,
partition `p13`,
partition `p14`,
partition `p15`,
partition `p16`,
partition `p17`,
partition `p18`,
partition `p19`,
partition `p20`,
partition `p21`,
partition `p22`,
partition `p23`,
partition `p24`,
partition `p25`,
partition `p26`,
partition `p27`,
partition `p28`,
partition `p29`,
partition `p30`,
partition `p31`,
partition `p32`,
partition `p33`,
partition `p34`,
partition `p35`,
partition `p36`,
partition `p37`,
partition `p38`,
partition `p39`,
partition `p40`,
partition `p41`,
partition `p42`,
partition `p43`,
partition `p44`,
partition `p45`,
partition `p46`,
partition `p47`,
partition `p48`,
partition `p49`,
partition `p50`,
partition `p51`,
partition `p52`,
partition `p53`,
partition `p54`,
partition `p55`,
partition `p56`,
partition `p57`,
partition `p58`,
partition `p59`,
partition `p60`,
partition `p61`,
partition `p62`,
partition `p63`,
partition `p64`,
partition `p65`,
partition `p66`,
partition `p67`,
partition `p68`,
partition `p69`,
partition `p70`,
partition `p71`,
partition `p72`);

select /*+    PARALLEL( 6 ) */ BIT_AND( tbl_320.col_13372 ) as r0 , tbl_214.col_30955 as r1 , tbl_214.col_30918 as r2 , sum( distinct  tbl_214.col_30896 ) as r3 from tbl_320 left join tbl_214 on tbl_320.col_13451 = tbl_214.col_30968    order by r0,r1,r2,r3;
+----------------------+----+----+------+
| r0                   | r1 | r2 | r3   |
+----------------------+----+----+------+
| 18446744073709551615 | NULL | NULL | NULL |
+----------------------+----+----+------+
