drop database  IF EXISTS  db1;
create database db1;
use db1;
SET wait_timeout=30000000;
SET ob_trx_timeout = 30000000;
SET ob_query_timeout = 30000000;
##设置相同sql_mode;
SET @@sql_mode='STRICT_TRANS_TABLES,NO_ENGINE_SUBSTITUTION,no_zero_date,no_zero_in_date,PIPES_AS_CONCAT';
##常量值（M，D）设置
drop table if exists  t1;
Warnings:
Note	1051	Unknown table 'db1.t1'
create table t1 (c1 double(10,2));
desc t1;
Field	Type	Null	Key	Default	Extra
c1	double(10,2)	YES		NULL	
insert into t1 values(10.199);
select * from t1;
c1
10.20
drop table if exists  t1;
create table t1 (c1 double(255,30));
insert into t1 values(123456789123456789123456789123456789123);
insert into t1 values(1234567891234567891234567891234567891234);
desc t1;
Field	Type	Null	Key	Default	Extra
c1	double(255,30)	YES		NULL	
select * from t1;
c1
123456789123456800000000000000000000000.000000000000000000000000000000
1234567891234567900000000000000000000000.000000000000000000000000000000
drop table if exists  t1;
create table t1 (c1 double(100,15));
insert into t1 values(123456789123456789123456789123456789123);
insert into t1 values(1234567891234567891234567891234567891234);
desc t1;
Field	Type	Null	Key	Default	Extra
c1	double(100,15)	YES		NULL	
select * from t1;
c1
123456789123456800000000000000000000000.000000000000000
1234567891234567900000000000000000000000.000000000000000
此处bug,MySQL5.7报错 bug地址:
drop table if exists  t1;
create table t1 (c1 double(0,0));
ERROR 42000: Display width out of range for column 'c1' (max = 255)
drop table if exists  t1;
Warnings:
Note	1051	Unknown table 'db1.t1'
create table t1 (c1 double(255,0));
desc t1;
Field	Type	Null	Key	Default	Extra
c1	double(255,0)	YES		NULL	
insert into t1 values(10),(10.01);
select * from t1;
c1
10
10
drop table if exists  t1;
create table t1 (c1 double(0,30));
ERROR 42000: For float(M,D), double(M,D) or decimal(M,D), M must be >= D (column 'c1').
create table t1 (c1 double(,));
ERROR 42000: You have an error in your SQL syntax; check the manual that corresponds to your OceanBase version for the right syntax to use near ',))' at line 1
create table t1 (c1 double());
ERROR 42000: You have an error in your SQL syntax; check the manual that corresponds to your OceanBase version for the right syntax to use near '))' at line 1
create table t1 (c1 double(null,0));
ERROR 42000: You have an error in your SQL syntax; check the manual that corresponds to your OceanBase version for the right syntax to use near 'null,0))' at line 1
create table t1 (c1 double(0,null));
ERROR 42000: You have an error in your SQL syntax; check the manual that corresponds to your OceanBase version for the right syntax to use near 'null))' at line 1
create table t1 (c1 double(null,null));
ERROR 42000: You have an error in your SQL syntax; check the manual that corresponds to your OceanBase version for the right syntax to use near 'null,null))' at line 1
create table t1 (c1 double(-1,-2));
ERROR 42000: You have an error in your SQL syntax; check the manual that corresponds to your OceanBase version for the right syntax to use near '-1,-2))' at line 1
create table t1 (c1 double(2,1.2));
ERROR 42000: You have an error in your SQL syntax; check the manual that corresponds to your OceanBase version for the right syntax to use near '1.2))' at line 1
create table t1 (c1 double(-2,0));
ERROR 42000: You have an error in your SQL syntax; check the manual that corresponds to your OceanBase version for the right syntax to use near '-2,0))' at line 1
create table t1 (c1 double(0,-1));
ERROR 42000: You have an error in your SQL syntax; check the manual that corresponds to your OceanBase version for the right syntax to use near '-1))' at line 1
create table t1 (c1 double(false,false));
ERROR 42000: You have an error in your SQL syntax; check the manual that corresponds to your OceanBase version for the right syntax to use near 'false,false))' at line 1
create table t1 (c1 double(false,true));
ERROR 42000: You have an error in your SQL syntax; check the manual that corresponds to your OceanBase version for the right syntax to use near 'false,true))' at line 1
create table t1 (c1 double(false,0));
ERROR 42000: You have an error in your SQL syntax; check the manual that corresponds to your OceanBase version for the right syntax to use near 'false,0))' at line 1
create table t1 (c1 double(0,true));
ERROR 42000: You have an error in your SQL syntax; check the manual that corresponds to your OceanBase version for the right syntax to use near 'true))' at line 1
create table t1 (c1 double(2~*,1));
ERROR 42000: You have an error in your SQL syntax; check the manual that corresponds to your OceanBase version for the right syntax to use near '~*,1))' at line 1
create table t1 (c1 double(1+0, 1));
ERROR 42000: You have an error in your SQL syntax; check the manual that corresponds to your OceanBase version for the right syntax to use near '+0, 1))' at line 1
create table t1 (c1 double);
insert into t1 values(-123456789123456789.123456789123456789123);
insert into t1 values(123456789123456789.123456789123456789123456789123456789);
desc t1;
Field	Type	Null	Key	Default	Extra
c1	double	YES		NULL	
select * from t1;
c1
-1.2345678912345678e17
1.2345678912345678e17
drop table if exists  t1;
create table t1 (c1 double(-1);
ERROR 42000: You have an error in your SQL syntax; check the manual that corresponds to your OceanBase version for the right syntax to use near '-1)' at line 1
create table t1 (c1 double(+1));
ERROR 42000: You have an error in your SQL syntax; check the manual that corresponds to your OceanBase version for the right syntax to use near '+1))' at line 1
create table t1 (c1 double(abs(-1)));
ERROR 42000: You have an error in your SQL syntax; check the manual that corresponds to your OceanBase version for the right syntax to use near 'abs(-1)))' at line 1
create table t1 (c1 double(0));
ERROR 42000: You have an error in your SQL syntax; check the manual that corresponds to your OceanBase version for the right syntax to use near '(0))' at line 1
create table t1 (c1 double(10));
ERROR 42000: You have an error in your SQL syntax; check the manual that corresponds to your OceanBase version for the right syntax to use near '(10))' at line 1
create table t1 (c1 double(24));
ERROR 42000: You have an error in your SQL syntax; check the manual that corresponds to your OceanBase version for the right syntax to use near '(24))' at line 1
create table t1 (c1 double(25));
ERROR 42000: You have an error in your SQL syntax; check the manual that corresponds to your OceanBase version for the right syntax to use near '(25))' at line 1
create table t1 (c1 double(54));
ERROR 42000: You have an error in your SQL syntax; check the manual that corresponds to your OceanBase version for the right syntax to use near '(54))' at line 1
##字符集测试
##设置binary
drop table if exists  t1;
Warnings:
Note	1051	Unknown table 'db1.t1'
create table t1 (c1 double(7,2),c2 double(8,2),c3 double(255,30),c4 double(2,0))default character set binary;
insert into t1 values(1023.909,11.591,2.222,-12.123),(123.5,11.5995,556.02,22.45);
##此处更新与8.0结果不一致，5.7与OB结果一致;
update t1 set c1=222.021 where c3=2.222;
delete from t1 where c2=11.59 ;
select sum(c1+c2+c3+c4) from t1 ;
sum(c1+c2+c3+c4)
713.120000000000000000000000000000
desc t1 ;
Field	Type	Null	Key	Default	Extra
c1	double(7,2)	YES		NULL	
c2	double(8,2)	YES		NULL	
c3	double(255,30)	YES		NULL	
c4	double(2,0)	YES		NULL	
##设置utf8mb4
drop table if exists  t1;
create table t1 (c1 double(7,2),c2 double(8,2),c3 double(255,30),c4 double(2,0))default character set utf8mb4;
insert into t1 values(1023.909,11.591,2.222,-12.123),(123.5,11.5995,556.02,22.45);
update t1 set c1=222.021 where c3=2.222;
delete from t1 where c2=11.59 limit 1;
select sum(c1+c2+c3+c4) from t1 ;
sum(c1+c2+c3+c4)
713.120000000000000000000000000000
desc t1 ;
Field	Type	Null	Key	Default	Extra
c1	double(7,2)	YES		NULL	
c2	double(8,2)	YES		NULL	
c3	double(255,30)	YES		NULL	
c4	double(2,0)	YES		NULL	
##设置gbk
drop table if exists  t1;
create table t1 (c1 double(7,2),c2 double(8,2),c3 double(255,30),c4 double(2,0))default character set gbk;
insert into t1 values(1023.909,11.591,2.222,-12.123),(123.5,11.5995,556.02,22.45);
update t1 set c1=222.021 where c3=2.222;
delete from t1 where c2=11.59 limit 1;
select sum(c1+c2+c3+c4) from t1 ;
sum(c1+c2+c3+c4)
713.120000000000000000000000000000
desc t1 ;
Field	Type	Null	Key	Default	Extra
c1	double(7,2)	YES		NULL	
c2	double(8,2)	YES		NULL	
c3	double(255,30)	YES		NULL	
c4	double(2,0)	YES		NULL	
##设置gb18030
drop table if exists  t1;
create table t1 (c1 double(7,2),c2 double(8,2),c3 double(255,30),c4 double(2,0))default character set gb18030;
insert into t1 values(1023.909,11.591,2.222,-12.123),(123.5,11.5995,556.02,22.45);
update t1 set c1=222.021 where c3=2.222;
delete from t1 where c2=11.59 limit 1;
select sum(c1+c2+c3+c4) from t1 ;
sum(c1+c2+c3+c4)
713.120000000000000000000000000000
desc t1 ;
Field	Type	Null	Key	Default	Extra
c1	double(7,2)	YES		NULL	
c2	double(8,2)	YES		NULL	
c3	double(255,30)	YES		NULL	
c4	double(2,0)	YES		NULL	
##修改列类型
##double=>json
drop table if exists  t1;
create table t1 (c1 double(7,2),c2 double(8,2),c3 double(255,30),c4 double);
insert into t1 values(1023.909,11.591,2.222,-12.123),(123.5,11.5995,556.02,22.45);
##不支持修改为json类型,暂停测试;
##不支持修改为json类型,暂停测试;
##json=>double
##修改列类型为字符类型
##double=>char
drop table if exists  t1;
create table t1 (c1 double(7,2),c2 double(8,2),c3 double(255,30),c4 double);
insert into t1 values(1023.909,11.591,2.222,-12.123),(123.5,11.5995,556.02,22.45);
alter table t1 modify column c3 char(255);
select * from t1 where c3=2.2219998836517333000000000000000+0.00000000000000001;
c1	c2	c3	c4
##char=>double
drop table if exists  t1;
create table t1 (c1 char(255),c2 char(30),c3 char(255),c4 char(255));
insert into t1 values(1023.909,11.591,2.222,-12.123),(123.5,11.5995,556.02,22.45);
alter table t1 modify column c3 double;
select * from t1 where c3=2.2219998836517333000000000000000+0.00000000000000001;
c1	c2	c3	c4
##double=>varchar
drop table if exists  t1;
create table t1 (c1 double(7,2),c2 double(8,2),c3 double(255,30),c4 double);
insert into t1 values(1023.909,11.591,2.222,-12.123),(123.5,11.5995,556.02,22.45);
alter table t1 modify column c3 varchar(255);
select * from t1 where c3=2.2219998836517333000000000000000+0.00000000000000001;
c1	c2	c3	c4
##varchar=>double
drop table if exists  t1;
create table t1 (c1 varchar(255),c2 varchar(30),c3 varchar(255),c4 varchar(255));
insert into t1 values(1023.909,11.591,2.222,-12.123),(123.5,11.5995,556.02,22.45);
alter table t1 modify column c3 double(20,10);
select * from t1 where c3=2.2219998836517333000000000000000+0.00000000000000001;
c1	c2	c3	c4
##double=>binary
drop table if exists  t1;
create table t1 (c1 double(7,2),c2 double(8,2),c3 double(255,30),c4 double);
insert into t1 values(1023.909,11.591,2.222,-12.123),(123.5,11.5995,556.02,22.45);
alter table t1 modify column c3 binary(50);
select c1/c2 from t1 order by c3 desc;
c1/c2
10.646552
88.344262
##binary=>double
drop table if exists  t1;
create table t1 (c1 binary(20),c2 binary(20),c3 binary(20),c4 binary(20));
insert into t1 values(1023.909,11.591,2.222,-12.123),(123.5,11.5995,556.02, 22.45);
alter table t1 modify column c3 double(50,10);
ERROR 01000: Data truncated for argument
##double=>VARBINARY
drop table if exists  t1;
create table t1 (c1 double(7,2),c2 double(8,2),c3 double(255,30),c4 double);
insert into t1 values(1023.909,11.591,2.222,-12.123),(123.5,11.5995,556.02,22.45);
alter table t1 modify column c3 VARBINARY(50);
select c1/c2 from t1 order by c3 desc;
c1/c2
10.646552
88.344262
##VARBINARY=>double
drop table if exists  t1;
create table t1 (c1 VARBINARY(30),c2 VARBINARY(40),c3 VARBINARY(50),c4 VARBINARY(60));
insert into t1 values(1023.909,11.591,2.222,-12.123),(123.5,11.5995,556.02,22.45);
alter table t1 modify column c3 double(255,30);
select c1/c2 from t1 order by c3 desc;
c1/c2
10.647010647010646
88.33655422310413
##double=>TINYBLOB
drop table if exists  t1;
create table t1 (c1 double(7,2),c2 double(8,2),c3 double(255,30),c4 double);
insert into t1 values(1023.909,11.591,2.222,-12.123),(123.5,11.5995,556.02,22.45);
alter table t1 modify column c3 TINYBLOB;
select c1/c2 from t1 order by c3 desc;
c1/c2
10.646552
88.344262
##TINYBLOB=>double
drop table if exists  t1;
create table t1 (c1 TINYBLOB,c2 TINYBLOB,c3 TINYBLOB,c4 TINYBLOB);
insert into t1 values(1023.909,11.591,2.222,-12.123),(123.5,11.5995,556.02,22.45);
alter table t1 modify column c3 double(255,30);
select c1/c2 from t1 order by c3 desc;
c1/c2
10.647010647010646
88.33655422310413
##double=>TINYTEXT
drop table if exists  t1;
create table t1 (c1 double(7,2),c2 double(8,2),c3 double(255,30),c4 double);
insert into t1 values(1023.909,11.591,2.222,-12.123),(123.5,11.5995,556.02,22.45);
alter table t1 modify column c3 TINYTEXT;
select c1/c2 from t1 order by c3 desc;
c1/c2
10.646552
88.344262
##TINYTEXT=>double
drop table if exists  t1;
create table t1 (c1 TINYTEXT,c2 TINYTEXT,c3 TINYTEXT,c4 TINYTEXT);
insert into t1 values(1023.909,11.591,2.222,-12.123),(123.5,11.5995,556.02,22.45);
alter table t1 modify column c3 double(255,30);
select c1/c2 from t1 order by c3 desc;
c1/c2
10.647010647010646
88.33655422310413
##double=>BLOB
drop table if exists  t1;
create table t1 (c1 double(7,2),c2 double(8,2),c3 double(255,30),c4 double);
insert into t1 values(1023.909,11.591,2.222,-12.123),(123.5,11.5995,556.02,22.45);
alter table t1 modify column c3 BLOB;
select c1/c2 from t1 order by c3 desc;
c1/c2
10.646552
88.344262
##BLOB=>double
drop table if exists  t1;
create table t1 (c1 BLOB,c2 BLOB,c3 BLOB,c4 BLOB);
insert into t1 values(1023.909,11.591,2.222,-12.123),(123.5,11.5995,556.02,22.45);
alter table t1 modify column c3 double(255,30);
select c1/c2 from t1 order by c3 desc;
c1/c2
10.647010647010646
88.33655422310413
##double=>TEXT
drop table if exists  t1;
create table t1 (c1 double(7,2),c2 double(8,2),c3 double(255,30),c4 double);
insert into t1 values(1023.909,11.591,2.222,-12.123),(123.5,11.5995,556.02,22.45);
alter table t1 modify column c3 TEXT;
select c1/c2 from t1 order by c3 desc;
c1/c2
10.646552
88.344262
##TEXT=>double
drop table if exists  t1;
create table t1 (c1 TEXT,c2 TEXT,c3 TEXT,c4 TEXT);
insert into t1 values(1023.909,11.591,2.222,-12.123),(123.5,11.5995,556.02,22.45);
alter table t1 modify column c3 double(255,30);
select c1/c2 from t1 order by c3 desc;
c1/c2
10.647010647010646
88.33655422310413
##double=>ENUM
drop table if exists  t1;
create table t1 (c1 double(7,2),c2 double(8,2),c3 double(255,30),c4 double);
alter table t1 modify column c3 ENUM('2.222','556.02');
insert into t1 values(1023.909,11.591,'2.222',-12.123),(123.5,11.5995,'556.02',22.45);
select c1/c2 from t1 order by c3 desc;
c1/c2
10.646552
88.344262
##ENUM=>double
drop table if exists  t1;
create table t1 (c1 ENUM('1023.909','123.5'),c2 ENUM('11.591','11.5995'),c3 ENUM('2.222','556.02'),c4 ENUM('-12.123','22.45'));
insert into t1 values('1023.909','11.591','2.222','-12.123'),('123.5','11.5995','556.02','22.45');
alter table t1 modify column c3 double(10,1);
select c1/c2 from t1 order by c3 desc;
c1/c2
1
1
##double=>set
drop table if exists  t1;
create table t1 (c1 double(7,2),c2 double(8,2),c3 double(255,30),c4 double);
alter table t1 modify column c3 set('2.222','556.02');
insert into t1 values(1023.909,11.591,'2.222',-12.123),(123.5,11.5995,'556.02',22.45);
select c1/c2 from t1 order by c3 desc;
c1/c2
10.646552
88.344262
##set=>double
drop table if exists  t1;
create table t1 (c1 set('1023.909','123.5'),c2 set('11.591','11.5995'),c3 set('2.222','556.02'),c4 set('-12.123','22.45'));
insert into t1 values('1023.909','11.591','2.222','-12.123'),('123.5','11.5995','556.02','22.45');
alter table t1 modify column c3 double(10,1);
select c1/c2 from t1 order by c3 desc;
c1/c2
1
1
##修改列类型为数字类型
##double=>bit
drop table if exists  t1;
create table t1 (c1 double(7,2),c2 double(8,2),c3 double(255,30),c4 double);
insert into t1 values(1023.909,11.591,2.222,-12.123),(123.5,11.5995,556.02,22.45);
alter table t1 modify column c3 bit(10);
select c1/c2 from t1 order by c3 desc;
c1/c2
10.646552
88.344262
##bit=>double
drop table if exists  t1;
create table t1 (c1 bit(20),c2 bit(20),c3 bit(20),c4 bit(20));
insert into t1 values(1023.909,11.591,2.222,12.123),(123.5,11.5995,556.02,22.45);
alter table t1 modify column c3 double(23,5);
select c1/c2 from t1 order by c3 desc;
c1/c2
10.3333
85.3333
##double=>int
drop table if exists  t1;
create table t1 (c1 double(7,2),c2 double(8,2),c3 double(255,30),c4 double);
insert into t1 values(1023.909,11.591,2.222,-12.123),(123.5,11.5995,556.02,22.45);
alter table t1 modify column c3 int;
select c1/c2 from t1 order by c3 desc;
c1/c2
10.646552
88.344262
##int=>double
drop table if exists  t1;
create table t1 (c1 int(20),c2 int(20),c3 int(20),c4 int(20));
insert into t1 values(1023.909,11.591,2.222,12.123),(123.5,11.5995,556.02,22.45);
alter table t1 modify column c3 double(23,5);
select c1/c2 from t1 order by c3 desc;
c1/c2
10.3333
85.3333
##double=>double
drop table if exists  t1;
create table t1 (c1 double(7,2),c2 double(8,2),c3 double(255,30),c4 double);
insert into t1 values(1023.909,11.591,2.222,-12.123),(123.5,11.5995,556.02,22.45);
alter table t1 modify column c1 double(20,10);
select * from t1 where c1=123.5;
c1	c2	c3	c4
123.5000000000	11.60	556.020000000000000000000000000000	22.45
##double=>double
drop table if exists  t1;
create table t1 (c1 double(20,10),c2 double(20,10),c3 double(20,10),c4 double(20,10));
insert into t1 values(1023.909,11.591,2.222,12.123),(123.5,11.5995,556.02,22.45);
alter table t1 modify column c3 double(20,10);
select * from t1 where c3=2.222;
c1	c2	c3	c4
1023.9090000000	11.5910000000	2.2220000000	12.1230000000
##double=>double
drop table if exists  t1;
create table t1 (c1 double(7,2),c2 double(8,2),c3 double(255,30),c4 double);
insert into t1 values(1023.909,11.591,2.222,-12.123),(123.5,11.5995,556.02,22.45);
select * from t1 where c3=2.222;
c1	c2	c3	c4
1023.91	11.59	2.222000000000000000000000000000	-12.123
alter table t1 modify column c1 double(20,10);
##double=>bool
drop table if exists  t1;
create table t1 (c1 double(7,2),c2 double(8,2),c3 double(255,30),c4 double);
insert into t1 values(1023.909,11.591,11,-12.123),(123.5,11.5995,10,22.45);
alter table t1 modify column c3 bool;
select if(c3=10,'true', 'false') from t1 order by c3;
if(c3=10,'true', 'false')
true
false
##bool=>double
drop table if exists  t1;
create table t1 (c1 bool,c2 bool,c3 bool,c4 bool);
insert into t1 values(10,20,30,40),(0,10,22,50);
alter table t1 modify column c3 double(20,10);
select if(c3=30,'true', 'false') from t1 order by c3;
if(c3=30,'true', 'false')
false
true
##修改列类型为日期类型
##double=>date
drop table if exists  t1;
create table t1 (c1 double(7,2),c2 double(8,2),c3 double(8,0),c4 double);
insert into t1 values(1023.09,11.59,2011,12.12),(123.5999,11.59,10,22.15);
alter table t1 modify column c3 date;
ERROR 22007: Incorrect value
##date=>double
drop table if exists  t1;
create table t1 (c1 date,c2 date,c3 date,c4 date);
insert into t1 values('2022-10-10','2022-11-11','2011-10-11','2022-12-12');
alter table t1 modify column c3 double(10,2);
select to_days(c3) from t1 ;
to_days(c3)
734786
##double=>datetime
drop table if exists  t1;
create table t1 (c1 double(7,2),c2 double(8,2),c3 double(8,0),c4 double);
insert into t1 values(1023.09,11.59,2011,12.12),(123.5999,11.59,10,22.15);
alter table t1 modify column c3 datetime;
ERROR 22007: Incorrect value
##datetime=>double
drop table if exists  t1;
create table t1 (c1 datetime,c2 datetime,c3 datetime,c4 datetime);
insert into t1 values('2022-10-10','2022-11-11','2011-10-11','2022-12-12');
alter table t1 modify column c3 double(255,0);
select * from t1 where c3='20111011';
c1	c2	c3	c4
##double=>year
drop table if exists  t1;
create table t1 (c1 double(7,2),c2 double(8,2),c3 double(8,0),c4 double);
insert into t1 values(1023.09,11.59,2011,12.12),(123.5999,11.59,10,22.15);
alter table t1 modify column c3 year;
desc t1;
Field	Type	Null	Key	Default	Extra
c1	double(7,2)	YES		NULL	
c2	double(8,2)	YES		NULL	
c3	year(4)	YES		NULL	
c4	double	YES		NULL	
select * from t1;
c1	c2	c3	c4
1023.09	11.59	2011	12.12
123.60	11.59	2010	22.15
##year=>double
drop table if exists  t1;
create table t1 (c1 year,c2 year,c3 year,c4 year);
insert into t1 values('2022','2020','2011','2021');
alter table t1 modify column c3 double(10,2);
select * from t1 where c3=2011;
c1	c2	c3	c4
2022	2020	2011.00	2021
##double=>time
drop table if exists  t1;
create table t1 (c1 double(7,2),c2 double(8,2),c3 double(8,0),c4 double);
insert into t1 values(1023.09,11.59,2011,12.12),(123.5999,11.59,10,22.15);
alter table t1 modify column c3 time;
select * from t1 where c3=2011;
c1	c2	c3	c4
1023.09	11.59	00:20:11	12.12
##time=>double
drop table if exists  t1;
create table t1 (c1 time,c2 time,c3 time,c4 time);
insert into t1 values('2022','2020','2011','2021');
alter table t1 modify column c3 double(10,2);
select sum(c3) as a from t1 ;
a
2011.00
##double=>timestamp
drop table if exists  t1;
create table t1 (c1 double(7,2),c2 double(8,2),c3 double(8,0),c4 double);
insert into t1 values(1023.09,11.59,2011,12.12),(123.5999,11.59,10,22.15);
alter table t1 modify column c3 timestamp;
ERROR 22007: Incorrect value
##timestamp=>double
drop table if exists  t1;
create table t1 (c1 timestamp);
insert into t1 values('2022-10-10 14:15:10.9999999');
alter table t1 modify column c1 double(50,10);
select sum(c1) from t1 ;
sum(c1)
20221010141511.0000000000
##decimal=>double
drop table if exists  t1;
create table t1 (c1 decimal(7,2),c2 decimal(8,2),c3 decimal(65,30),c4 decimal);
insert into t1 values(1023.909,11.591,2.222,-12.123),(123.5,11.5995,556.02,22.45);
Warnings:
Warning	1265	Data truncated for column 'c1' at row 1
Warning	1265	Data truncated for column 'c2' at row 1
Warning	1265	Data truncated for column 'c4' at row 1
Warning	1265	Data truncated for column 'c2' at row 2
Warning	1265	Data truncated for column 'c4' at row 2
alter table t1 modify column c3 double(20,10);
select sum(c3) from t1;
sum(c3)
558.2420000000
##double=>decimal
drop table if exists  t1;
create table t1 (c1 double(7,2),c2 double(8,2),c3 double(65,30),c4 double);
insert into t1 values(1023.909,11.591,2.222,-12.123),(123.5,11.5995,556.02,22.45);
alter table t1 modify column c3 decimal(20,10);
select sum(c3) from t1;
sum(c3)
558.2420000000
##关闭隐藏配置,预期不能转换
alter system set  _enable_convert_real_to_decimal = false;
drop table if exists t1;
create table t1 (c1 double(7,2),c2 double(8,2),c3 double(65,30),c4 double);
##开启隐藏配置,预期转换
alter system set  _enable_convert_real_to_decimal = true;
drop table if exists t1;
create table t1 (c1 double(7,2),c2 double(8,2),c3 double(65,30),c4 double);
drop table if exists t1;
create table t1 (c1 double(7,2),c2 double(8,2),c3 double(65,30),c4 double(64,30));
alter system set  _enable_convert_real_to_decimal = false;
##运算符测试
#算数运算符
drop table t1;
create table t1 (c1 double(7,2),c2 double(8,2),c3 double(10,5),c4 double);
insert into t1 values(1023.909,11.591,2.222,-12.123),(123.5,11.5995,556.02,22.45),(null,0,1.234567894562,10.0000000000002);
create table t2 as select c1+c2 a,c1-c2 b,c1*c2 c,c1/c2 d from t1;
desc t2;
select a+0.02,b+1.09,c+2.36,d+3.00 from t2;
create table t3 as select c2+c3 a,c2-c3 b,c2*c3 c,c2/c3 d from t1;
desc t3;
select a-0.02,b-1.09,c-2.36,d-3.00 from t3;
create table t4 as select c3+c4 a,c3-c4 b,c3*c4 c,c3/c4 d from t1;
desc t4;
select a*0.02,b*1.09,c*2.36,d*3.00 from t4;
create table t5 as select c4+c2 a,c4-c3 b,c4*c2 c,c4/c3 d from t1;
desc t5;
select a/0.02,b/1.09,c/2.36,d/3.00 from t5;
create table t6 as select c1+c2 a,c1-c2 b,c1*c2 c,c1/c2 d from t1;
desc t6;
select a div 0.02,b div 1.09,c div 2.36,d div 3.00 from t6;
create table t7 as select c2+c3 a,c2-c3 b,c2*c3 c,c2/c3 d from t1;
desc t7;
select a mod 0.02,b mod 1.09,c mod 2.36,d mod 3.00 from t7;
create table t8 as select c3+c4 a,c3-c4 b,c3*c4 c,c3/c4 d from t1;
desc t8;
select a % 0.02,b % 1.09,c % 2.36,d % 3.00 from t8;
drop table if exists  t3;
drop table if exists  t4;
drop table if exists  t5;
drop table if exists  t6;
drop table if exists  t7;
drop table if exists  t8;
##比较运算符
drop table if exists  t1;
drop table if exists  t2;
create table t1 (c1 double(7,2),c2 double(8,2),c3 double(10,5),c4 double);
insert into t1 values(1023.909,11.591,2.222,-12.123),(123.5,11.5995,556.02,22.45),(null,0,1.234567894562,10.0000000000002);
select c1=1023.91,c2=11.59,c3=2.222,c4=22.45 from t1;
c1=1023.91	c2=11.59	c3=2.222	c4=22.45
0	0	0	1
1	1	1	0
NULL	0	0	0
select c1>0,c2>0,c3>0,c4>0 from t1;
c1>0	c2>0	c3>0	c4>0
1	1	1	0
1	1	1	1
NULL	0	1	1
select c1>=0,c2>=0,c3>=0,c4>=0 from t1;
c1>=0	c2>=0	c3>=0	c4>=0
1	1	1	0
1	1	1	1
NULL	1	1	1
##已修复,bug地址：
select c1<=>1023.91,c2<=>0,c3<=>0,c4<=>0 from t1;
c1<=>1023.91	c2<=>0	c3<=>0	c4<=>0
0	0	0	0
0	1	0	0
1	0	0	0
select c1<>0,c2<>0,c3<>0,c4<>0 from t1;
c1<>0	c2<>0	c3<>0	c4<>0
1	1	1	1
1	1	1	1
NULL	0	1	1
select c1<=0,c2<=0,c3<=0,c4<=0 from t1;
c1<=0	c2<=0	c3<=0	c4<=0
0	0	0	0
0	0	0	1
NULL	1	0	0
select c1!=0,c2!=0,c3!=0,c4!=0 from t1;
c1!=0	c2!=0	c3!=0	c4!=0
1	1	1	1
1	1	1	1
NULL	0	1	1
select c1!=123.5,c2!=11.59,c3!=2.222,c4!=1.23 from t1;
c1!=123.5	c2!=11.59	c3!=2.222	c4!=1.23
0	1	1	1
1	0	0	1
NULL	1	1	1
select c1 not in (999.9,123.5) from t1;
c1 not in (999.9,123.5)
0
1
NULL
select c1 in (999.9,123.5) from t1;
c1 in (999.9,123.5)
0
1
NULL
select c4 between -13 and 10 from t1;
c4 between -13 and 10
0
0
1
select c4 not between -13 and 10 from t1;
c4 not between -13 and 10
0
1
1
select c2 is not true from t1;
c2 is not true
0
0
1
select c2 is  true from t1;
c2 is  true
0
1
1
select c2 is not false from t1;
c2 is not false
0
1
1
select c2 is  false from t1;
c2 is  false
0
0
1
select c1 is not null from t1;
c1 is not null
0
1
1
select c1 is null from t1;
c1 is null
0
0
1
##位运算符
select c1 & c2,c3 & c4 from t1;
c1 & c2	c3 & c4
0	0
12	4
NULL	0
select c1 | c2,c3 | c4 from t1;
c1 | c2	c3 | c4
1036	18446744073709551606
124	574
NULL	11
select c1 ^ c2,c3 ^ c4 from t1;
c1 ^ c2	c3 ^ c4
1036	18446744073709551606
112	570
NULL	11
select ~ c1,~ c2,~ c3,~ c4 from t1;
~ c1	~ c2	~ c3	~ c4
18446744073709550591	18446744073709551603	18446744073709551613	11
18446744073709551491	18446744073709551603	18446744073709551059	18446744073709551593
NULL	18446744073709551615	18446744073709551614	18446744073709551605
select c1 << c2,c3 >> c4 from t1;
c1 << c2	c3 >> c4
4194304	0
507904	0
NULL	0
select c1 >> c2,c3 << c4 from t1;
c1 >> c2	c3 << c4
0	0
0	2332033024
NULL	1024
##逻辑运算符
select c1 and 0,c2 and 1,c3 and 2.222,c4 and 10 from t1;
c1 and 0	c2 and 1	c3 and 2.222	c4 and 10
0	0	1	1
0	1	1	1
0	1	1	1
select c1 && 0,c2 && 1,c3 && 2.222,c4 && 10 from t1;
c1 && 0	c2 && 1	c3 && 2.222	c4 && 10
0	0	1	1
0	1	1	1
0	1	1	1
select c1 or 0,c2 or 1,c3 or 2.222,c4 or 10 from t1;
c1 or 0	c2 or 1	c3 or 2.222	c4 or 10
1	1	1	1
1	1	1	1
NULL	1	1	1
select c1 || 0,c2 || 1,c3 || 2.222,c4 || 10 from t1;
c1 || 0	c2 || 1	c3 || 2.222	c4 || 10
1023.910	11.591	2.222002.222	-12.12310
123.500	11.601	556.020002.222	22.4510
NULL	0.001	1.234572.222	10.000000000000210
select not null,not 1,not 2.222,not 10 from t1;
not null	not 1	not 2.222	not 10
NULL	0	0	0
NULL	0	0	0
NULL	0	0	0
select ! 0,! 1,! 2.222,! 10 from t1;
! 0	! 1	! 2.222	! 10
1	0	0	0
1	0	0	0
1	0	0	0
select c1 || c2,c3 || c4 from t1;
c1 || c2	c3 || c4
1023.9111.59	2.22200-12.123
123.5011.60	556.0200022.45
NULL	1.2345710.0000000000002
##日期时间函数
drop table if exists  t1;
drop table if exists  t2;
Warnings:
Note	1051	Unknown table 'db1.t2'
create table t1 (c1 float(7,2),c2 float(8,2),c3 float(10,5),c4 float);
insert into t1 values(1023.909,11.591,2.222,-12.123),(123.5,11.5995,556.02,22.45);
SELECT DATE_ADD('2022-10-31 23:59:59',INTERVAL c1 SECOND)  from t1;
DATE_ADD('2022-10-31 23:59:59',INTERVAL c1 SECOND)
2022-11-01 00:02:02.500000
2022-11-01 00:17:02.910000
SELECT DATE_FORMAT('2017-11-15 21:45:00','%y')+c1  from t1;
DATE_FORMAT('2017-11-15 21:45:00','%y')+c1
1040.9099731445312
140.5
SELECT DATE_SUB('2018-01-02',INTERVAL c1 DAY) from t1;
DATE_SUB('2018-01-02',INTERVAL c1 DAY)
2015-03-16
2017-09-01
SELECT DATEDIFF('2017-11-30','2017-11-29')+c4  from t1;
DATEDIFF('2017-11-30','2017-11-29')+c4
-11.123000144958496
23.450000762939453
SELECT EXTRACT(SECOND from c1)  from t1;
EXTRACT(SECOND from c1)
NULL
NULL
SELECT from_days(c1)  from t1;
from_days(c1)
0000-00-00
0002-10-21
SELECT FROM_UNIXTIME(c1)  from t1;
FROM_UNIXTIME(c1)
1970-01-01 08:02:03.50
1970-01-01 08:17:03.91
SELECT month(c1)  from t1;
month(c1)
1
10
SELECT PERIOD_DIFF(c1,c2)  from t1;
PERIOD_DIFF(c1,c2)
132
24
SELECT STR_TO_DATE('25,5,2022','%d,%m,%Y')+c1 from t1;
STR_TO_DATE('25,5,2022','%d,%m,%Y')+c1
20220648.50
20221548.91
SELECT time(c1) from t1;
time(c1)
00:01:23.50
00:10:23.91
SELECT TIME_TO_USEC(c1) from t1;
ERROR 42000: Invalid argument for time_to_usec()
SELECT TIMEDIFF(c1) from t1;
ERROR 42000: Incorrect parameter count in the call to native function 'TIMEDIFF'
SELECT to_days(c1) from t1;
to_days(c1)
730508
730782
SELECT year(c1) from t1;
year(c1)
2000
2000
SELECT UNIX_TIMESTAMP(c1,c2) from t1;
ERROR 42000: Incorrect parameter count in the call to native function 'UNIX_TIMESTAMP'
##字符串函数
drop table if exists  t1;
drop table if exists  t2;
Warnings:
Note	1051	Unknown table 'db1.t2'
create table t1 (c1 double(7,2),c2 double(8,2),c3 double(10,5),c4 double);
insert into t1 values(1023.909,11.591,2.222,-12.123),(123.5,11.5995,556.02,22.45),(null,0,1.234567894562,10.0000000000002);
select CONCAT(max(c1),max(c2),max(c3)) from t1;
CONCAT(max(c1),max(c2),max(c3))
1023.9111.60556.02000
select CONCAT_WS(c1,c2,c3,c4) from t1;
CONCAT_WS(c1,c2,c3,c4)
11.591023.912.222001023.91-12.123
11.60123.50556.02000123.5022.45
NULL
select format(max(c1),15),format(min(c3),15) from t1;
format(max(c1),15)	format(min(c3),15)
1,023.910000000000000	1.234570000000000
select format(max(c1),0),format(min(c3),0) from t1;
format(max(c1),0)	format(min(c3),0)
1,024	1
select SUBSTR(max(c1) from 1 for 2) from t1;
SUBSTR(max(c1) from 1 for 2)
10
select SUBSTR(min(c1),1) from t1;
SUBSTR(min(c1),1)
123.50
select SUBSTR(c1,max(c1)-1022.91,22) from t1;
SUBSTR(c1,max(c1)-1022.91,22)
1023.91
select SUBSTRING(max(c1) from 1 for 2) from t1;
SUBSTRING(max(c1) from 1 for 2)
10
select SUBSTRING(min(c1),1) from t1;
SUBSTRING(min(c1),1)
123.50
select SUBSTRING(c1,max(c1)-1022.91,22) from t1;
SUBSTRING(c1,max(c1)-1022.91,22)
1023.91
SELECT TRIM(LEADING '1' FROM max(c1)) from t1;
TRIM(LEADING '1' FROM max(c1))
023.91
SELECT TRIM(BOTH '12' FROM min(c1)) from t1;
TRIM(BOTH '12' FROM min(c1))
3.50
SELECT TRIM(TRAILING '.91' FROM max(c1)) from t1;
TRIM(TRAILING '.91' FROM max(c1))
1023
SELECT concat(LTRIM(' c 1 '),max(c1)) from t1;
concat(LTRIM(' c 1 '),max(c1))
c 1 1023.91
SELECT concat(RTRIM(' c 1 '),max(c1)) from t1;
concat(RTRIM(' c 1 '),max(c1))
 c 11023.91
SELECT ascii(min(c2)) from t1;
ascii(min(c2))
48
SELECT ord(min(c2)) from t1;
ord(min(c2))
48
SELECT length(concat(min(c2),c1,c3,c4))from t1;
length(concat(min(c2),c1,c3,c4))
25
SELECT CHAR_length(concat(min(c2),c1,c3,c4))from t1;
CHAR_length(concat(min(c2),c1,c3,c4))
25
SELECT UPPER(concat(min(c2),c1,c3,c4))from t1;
UPPER(concat(min(c2),c1,c3,c4))
0.001023.912.22200-12.123
SELECT lower(concat(min(c2),c1,c3,c4))from t1;
lower(concat(min(c2),c1,c3,c4))
0.001023.912.22200-12.123
SELECT HEX(concat(min(c2),c1,c3,c4))from t1;
HEX(concat(min(c2),c1,c3,c4))
302E3030313032332E3931322E32323230302D31322E313233
SELECT UNHEX(concat(min(c2),c1,c3,c4))from t1;
UNHEX(concat(min(c2),c1,c3,c4))
NULL
SELECT MD5(concat(min(c2),c1,c3,c4))from t1;
MD5(concat(min(c2),c1,c3,c4))
2d0b689d3bac6bac9eeadbfec7be306a
SELECT min(c2) FROM t1 where c1 LIKE '%1%';
min(c2)
11.59
SELECT min(c2) FROM t1 where c1 REGEXP '1';
min(c2)
11.59
SELECT REPEAT(c1,min(c2)) from t1;
REPEAT(c1,min(c2))

SELECT space(min(c2)) from t1;
space(min(c2))

SELECT SUBSTRING_INDEX(max(c2),'.',2) from t1;
SUBSTRING_INDEX(max(c2),'.',2)
11.60
SELECT LOCATE(max(c2),0) from t1;
LOCATE(max(c2),0)
0
SELECT POSITION('.' in max(c1)) from t1;
POSITION('.' in max(c1))
5
SELECT instr('%1%',max(c1)) FROM t1;
instr('%1%',max(c1))
0
SELECT REPLACE(max(c1),1023,'咻咻') FROM t1;
REPLACE(max(c1),1023,'咻咻')
咻咻.91
SELECT FIELD(max(c1),c2,c3) FROM t1;
FIELD(max(c1),c2,c3)
0
SELECT ELT(1,MIN(c1),c2,c3) FROM t1;
ELT(1,MIN(c1),c2,c3)
123.50
SELECT INSERT(MAX(c1),2,3,'咻咻') FROM t1;
INSERT(MAX(c1),2,3,'咻咻')
1咻咻.91
SELECT LPAD(MAX(c1),10-1,'咻咻') FROM t1;
LPAD(MAX(c1),10-1,'咻咻')
咻咻1023.91
SELECT RPAD(MAX(c1),10-1,'咻咻') FROM t1;
RPAD(MAX(c1),10-1,'咻咻')
1023.91咻咻
SELECT RPAD(MAX(c1),10-1,'咻咻') FROM t1;
RPAD(MAX(c1),10-1,'咻咻')
1023.91咻咻
SELECT length(uuid()) FROM t1;
length(uuid())
36
36
36
SELECT bin(MAX(c1))+c1 FROM t1;
bin(MAX(c1))+c1
1111112134.91
SELECT quote(MAX(c1)) FROM t1;
quote(MAX(c1))
'1023.91'
SELECT REGEXP_SUBSTR(MAX(c1),c1) FROM t1;
REGEXP_SUBSTR(MAX(c1),c1)
1023.91
##转换函数
#CAST
##char类型
drop table if exists  t1;
create table t1 (c1 double(7,2),c2 double(8,2),c3 double(10,5),c4 double(255,30));
insert into t1 values(1023.909,11.591,2.222,-12.123),(123.5,11.5995,556.02,22.45),(null,0,1.234567894562,10.0000000000002);
create table t2 select cast(min(c1) as char(255)) from t1 ;
create table t3 select cast(min(c2) as char(255)) from t1 ;
create table t4 select cast(min(c3) as char(255)) from t1 ;
create table t5 select cast(min(c4) as char(255)) from t1 ;
##VARCHAR类型
drop table if exists  t1;
drop table if exists  t2;
drop table if exists  t3;
drop table if exists  t4;
drop table if exists  t5;
create table t1 (c1 double(7,2),c2 double(8,2),c3 double(10,5),c4 double(255,30));
insert into t1 values(1023.909,11.591,2.222,-12.123),(123.5,11.5995,556.02,22.45),(null,0,1.234567894562,10.0000000000002);
create table t2 select cast(min(c1) as varchar(10)) from t1 ;
ERROR 42000: You have an error in your SQL syntax; check the manual that corresponds to your OceanBase version for the right syntax to use near 'varchar(10)) from t1' at line 1
create table t3 select cast(min(c2) as varchar(8)) from t1 ;
ERROR 42000: You have an error in your SQL syntax; check the manual that corresponds to your OceanBase version for the right syntax to use near 'varchar(8)) from t1' at line 1
create table t4 select cast(min(c3) as varchar(10)) from t1 ;
ERROR 42000: You have an error in your SQL syntax; check the manual that corresponds to your OceanBase version for the right syntax to use near 'varchar(10)) from t1' at line 1
create table t5 select cast(min(c4) as varchar(255)) from t1 ;
ERROR 42000: You have an error in your SQL syntax; check the manual that corresponds to your OceanBase version for the right syntax to use near 'varchar(255)) from t1' at line 1
##TIME类型
drop table if exists  t1;
drop table if exists  t2;
Warnings:
Note	1051	Unknown table 'db1.t2'
drop table if exists  t3;
Warnings:
Note	1051	Unknown table 'db1.t3'
drop table if exists  t4;
Warnings:
Note	1051	Unknown table 'db1.t4'
drop table if exists  t5;
Warnings:
Note	1051	Unknown table 'db1.t5'
create table t1 (c1 double(7,2),c2 double(8,2),c3 double(10,5),c4 double(255,30));
insert into t1 values(1023.909,11.591,2.222,-12.123),(123.5,11.5995,556.02,22.45),(null,0,1.234567894562,10.0000000000002);
create table t2 select cast(min(c1) as TIME) from t1 ;
create table t3 select cast(min(c2) as TIME) from t1 ;
create table t4 select cast(min(c3) as TIME) from t1 ;
create table t5 select cast(min(c4) as TIME) from t1 ;
##DATE类型
drop table if exists  t1;
drop table if exists  t2;
drop table if exists  t3;
drop table if exists  t4;
drop table if exists  t5;
create table t1 (c1 double(7,2),c2 double(8,2),c3 double(10,5),c4 double(255,30));
insert into t1 values(1023.909,11.591,2.222,-12.123),(123.5,11.5995,556.02,22.45),(null,0,1.234567894562,10.0000000000002);
create table t2 select cast(min(c1) as DATE) from t1 ;
create table t3 select cast(min(c2) as DATE) from t1 ;
create table t4 select cast(min(c3) as DATE) from t1 ;
ERROR 22007: Incorrect value
create table t5 select cast(min(c4) as DATE) from t1 ;
ERROR 22007: Incorrect value
##datetime类型
drop table if exists  t1;
drop table if exists  t2;
drop table if exists  t3;
drop table if exists  t4;
Warnings:
Note	1051	Unknown table 'db1.t4'
drop table if exists  t5;
Warnings:
Note	1051	Unknown table 'db1.t5'
create table t1 (c1 double(7,2),c2 double(8,2),c3 double(10,5),c4 double(255,30));
insert into t1 values(1023.909,11.591,2.222,-12.123),(123.5,11.5995,556.02,22.45),(null,0,1.234567894562,10.0000000000002);
create table t2 select cast(min(c1) as datetime) from t1 ;
create table t3 select cast(min(c2) as datetime) from t1 ;
create table t4 select cast(min(c3) as datetime) from t1 ;
ERROR 22007: Incorrect value
create table t5 select cast(min(c4) as datetime) from t1 ;
ERROR 22007: Incorrect value
##SIGNED类型
drop table if exists  t1;
drop table if exists  t2;
drop table if exists  t3;
drop table if exists  t4;
Warnings:
Note	1051	Unknown table 'db1.t4'
drop table if exists  t5;
Warnings:
Note	1051	Unknown table 'db1.t5'
create table t1 (c1 double(7,2),c2 double(8,2),c3 double(10,5),c4 double(255,30));
insert into t1 values(1023.909,11.591,2.222,-12.123),(123.5,11.5995,556.02,22.45),(null,0,1.234567894562,10.0000000000002);
create table t2 select cast(min(c1) as SIGNED) from t1 ;
desc t2;
Field	Type	Null	Key	Default	Extra
cast(min(c1) as SIGNED)	bigint(21)	YES		NULL	
create table t3 select cast(min(c2) as SIGNED) from t1 ;
create table t4 select cast(min(c3) as SIGNED) from t1 ;
create table t5 select cast(min(c4) as SIGNED) from t1 ;
##UNSIGNED类型
drop table if exists  t1;
drop table if exists  t2;
drop table if exists  t3;
drop table if exists  t4;
drop table if exists  t5;
create table t1 (c1 double(7,2),c2 double(8,2),c3 double(10,5),c4 double(255,30));
insert into t1 values(1023.909,11.591,2.222,-12.123),(123.5,11.5995,556.02,22.45),(null,0,1.234567894562,10.0000000000002);
create table t2 select cast(min(c1) as SIGNED) from t1 ;
desc t2;
Field	Type	Null	Key	Default	Extra
cast(min(c1) as SIGNED)	bigint(21)	YES		NULL	
create table t3 select cast(min(c2) as SIGNED) from t1 ;
create table t4 select cast(min(c3) as SIGNED) from t1 ;
create table t5 select cast(min(c4) as SIGNED) from t1 ;
##DECIMAL
drop table if exists  t1;
drop table if exists  t2;
drop table if exists  t3;
drop table if exists  t4;
drop table if exists  t5;
create table t1 (c1 double(7,2),c2 double(8,2),c3 double(10,5),c4 double(255,30));
insert into t1 values(1023.909,11.591,2.222,-12.123),(123.5,11.5995,556.02,22.45),(null,0,1.234567894562,10.0000000000002);
create table t2 select cast(min(c1) as DECIMAL(5,2)) from t1 ;
desc t2;
Field	Type	Null	Key	Default	Extra
cast(min(c1) as DECIMAL(5,2))	decimal(5,2)	YES		NULL	
create table t3 select cast(min(c2) as DECIMAL(5)) from t1 ;
desc t3;
Field	Type	Null	Key	Default	Extra
cast(min(c2) as DECIMAL(5))	decimal(5,0)	YES		NULL	
create table t4 select cast(min(c3) as DECIMAL(65,30)) from t1 ;
desc t4;
Field	Type	Null	Key	Default	Extra
cast(min(c3) as DECIMAL(65,30))	decimal(65,30)	YES		NULL	
create table t5 select cast(min(c4) as DECIMAL) from t1 ;
desc t5;
Field	Type	Null	Key	Default	Extra
cast(min(c4) as DECIMAL)	decimal(10,0)	YES		NULL	
##BINARY
drop table if exists  t1;
drop table if exists  t2;
drop table if exists  t3;
drop table if exists  t4;
drop table if exists  t5;
create table t1 (c1 double(7,2),c2 double(8,2),c3 double(10,5),c4 double(255,30));
insert into t1 values(1023.909,11.591,2.222,-12.123),(123.5,11.5995,556.02,22.45),(null,0,1.234567894562,10.0000000000002);
create table t2 select cast(min(c1) as BINARY) from t1 ;
desc t2;
Field	Type	Null	Key	Default	Extra
cast(min(c1) as BINARY)	varbinary(23)	YES		NULL	
create table t3 select cast(min(c2) as BINARY) from t1 ;
desc t3;
Field	Type	Null	Key	Default	Extra
cast(min(c2) as BINARY)	varbinary(23)	YES		NULL	
create table t4 select cast(min(c3) as BINARY) from t1 ;
desc t4;
Field	Type	Null	Key	Default	Extra
cast(min(c3) as BINARY)	varbinary(23)	YES		NULL	
create table t5 select cast(min(c4) as BINARY) from t1 ;
ERROR 22001: Data too long for column
##binary函数
drop table if exists  t1;
drop table if exists  t2;
drop table if exists  t3;
drop table if exists  t4;
drop table if exists  t5;
Warnings:
Note	1051	Unknown table 'db1.t5'
create table t1 (c1 double(7,2),c2 double(8,2),c3 double(10,5),c4 double(255,30));
insert into t1 values(1023.909,11.591,2.222,-12.123),(123.5,11.5995,556.02,22.45),(null,0,1.234567894562,10.0000000000002);
create table t2 select binary(min(c1)) from t1 ;
desc t2;
Field	Type	Null	Key	Default	Extra
binary(min(c1))	varbinary(23)	YES		NULL	
create table t3 select binary(min(c2)) from t1 ;
desc t3;
Field	Type	Null	Key	Default	Extra
binary(min(c2))	varbinary(23)	YES		NULL	
create table t4 select binary(min(c3)) from t1 ;
desc t4;
Field	Type	Null	Key	Default	Extra
binary(min(c3))	varbinary(23)	YES		NULL	
create table t5 select binary(min(c4)) from t1 ;
ERROR 22001: Data too long for column
##CONVERT函数
##char类型
drop table if exists  t1;
drop table if exists  t2;
drop table if exists  t3;
drop table if exists  t4;
drop table if exists  t5;
Warnings:
Note	1051	Unknown table 'db1.t5'
create table t1 (c1 double(7,2),c2 double(8,2),c3 double(10,5),c4 double(255,30));
insert into t1 values(1023.909,11.591,2.222,-12.123),(123.5,11.5995,556.02,22.45),(null,0,1.234567894562,10.0000000000002);
create table t2 select CONVERT(min(c1),char(255)) from t1 ;
create table t3 select CONVERT(min(c2),char(255)) from t1 ;
create table t4 select CONVERT(min(c3),char(255)) from t1 ;
create table t5 select CONVERT(min(c4),char(255)) from t1 ;
##VARCHAR类型
drop table if exists  t1;
drop table if exists  t2;
drop table if exists  t3;
drop table if exists  t4;
drop table if exists  t5;
create table t1 (c1 double(7,2),c2 double(8,2),c3 double(10,5),c4 double(255,30));
insert into t1 values(1023.909,11.591,2.222,-12.123),(123.5,11.5995,556.02,22.45),(null,0,1.234567894562,10.0000000000002);
create table t2 select CONVERT(min(c1),varchar(10)) from t1 ;
ERROR 42000: You have an error in your SQL syntax; check the manual that corresponds to your OceanBase version for the right syntax to use near 'varchar(10)) from t1' at line 1
create table t3 select CONVERT(min(c2),varchar(8)) from t1 ;
ERROR 42000: You have an error in your SQL syntax; check the manual that corresponds to your OceanBase version for the right syntax to use near 'varchar(8)) from t1' at line 1
create table t4 select CONVERT(min(c3),varchar(10)) from t1 ;
ERROR 42000: You have an error in your SQL syntax; check the manual that corresponds to your OceanBase version for the right syntax to use near 'varchar(10)) from t1' at line 1
create table t5 select CONVERT(min(c4),varchar(255)) from t1 ;
ERROR 42000: You have an error in your SQL syntax; check the manual that corresponds to your OceanBase version for the right syntax to use near 'varchar(255)) from t1' at line 1
##TIME类型
drop table if exists  t1;
drop table if exists  t2;
Warnings:
Note	1051	Unknown table 'db1.t2'
drop table if exists  t3;
Warnings:
Note	1051	Unknown table 'db1.t3'
drop table if exists  t4;
Warnings:
Note	1051	Unknown table 'db1.t4'
drop table if exists  t5;
Warnings:
Note	1051	Unknown table 'db1.t5'
create table t1 (c1 double(7,2),c2 double(8,2),c3 double(10,5),c4 double(255,30));
insert into t1 values(1023.909,11.591,2.222,-12.123),(123.5,11.5995,556.02,22.45),(null,0,1.234567894562,10.0000000000002);
create table t2 select CONVERT(min(c1),TIME) from t1 ;
create table t3 select CONVERT(min(c2),TIME) from t1 ;
create table t4 select CONVERT(min(c3),TIME) from t1 ;
create table t5 select CONVERT(min(c4),TIME) from t1 ;
##DATE类型
drop table if exists  t1;
drop table if exists  t2;
drop table if exists  t3;
drop table if exists  t4;
drop table if exists  t5;
create table t1 (c1 double(7,2),c2 double(8,2),c3 double(10,5),c4 double(255,30));
insert into t1 values(1023.909,11.591,2.222,-12.123),(123.5,11.5995,556.02,22.45),(null,0,1.234567894562,10.0000000000002);
create table t2 select CONVERT(min(c1),DATE) from t1 ;
create table t3 select CONVERT(min(c2),DATE) from t1 ;
create table t4 select CONVERT(min(c3),DATE) from t1 ;
ERROR 22007: Incorrect value
create table t5 select CONVERT(min(c4),DATE) from t1 ;
ERROR 22007: Incorrect value
##datetime类型
drop table if exists  t1;
drop table if exists  t2;
drop table if exists  t3;
drop table if exists  t4;
Warnings:
Note	1051	Unknown table 'db1.t4'
drop table if exists  t5;
Warnings:
Note	1051	Unknown table 'db1.t5'
create table t1 (c1 double(7,2),c2 double(8,2),c3 double(10,5),c4 double(255,30));
insert into t1 values(1023.909,11.591,2.222,-12.123),(123.5,11.5995,556.02,22.45),(null,0,1.234567894562,10.0000000000002);
create table t2 select CONVERT(min(c1),datetime) from t1 ;
create table t3 select CONVERT(min(c2),datetime) from t1 ;
create table t4 select CONVERT(min(c3),datetime) from t1 ;
ERROR 22007: Incorrect value
create table t5 select CONVERT(min(c4),datetime) from t1 ;
ERROR 22007: Incorrect value
##SIGNED类型
drop table if exists  t1;
drop table if exists  t2;
drop table if exists  t3;
drop table if exists  t4;
Warnings:
Note	1051	Unknown table 'db1.t4'
drop table if exists  t5;
Warnings:
Note	1051	Unknown table 'db1.t5'
create table t1 (c1 double(7,2),c2 double(8,2),c3 double(10,5),c4 double(255,30));
insert into t1 values(1023.909,11.591,2.222,-12.123),(123.5,11.5995,556.02,22.45),(null,0,1.234567894562,10.0000000000002);
create table t2 select CONVERT(min(c1),SIGNED) from t1 ;
desc t2;
Field	Type	Null	Key	Default	Extra
CONVERT(min(c1),SIGNED)	bigint(21)	YES		NULL	
create table t3 select CONVERT(min(c2),SIGNED) from t1 ;
create table t4 select CONVERT(min(c3),SIGNED) from t1 ;
create table t5 select CONVERT(min(c4),SIGNED) from t1 ;
##UNSIGNED类型
drop table if exists  t1;
drop table if exists  t2;
drop table if exists  t3;
drop table if exists  t4;
drop table if exists  t5;
create table t1 (c1 double(7,2),c2 double(8,2),c3 double(10,5),c4 double(255,30));
insert into t1 values(1023.909,11.591,2.222,-12.123),(123.5,11.5995,556.02,22.45),(null,0,1.234567894562,10.0000000000002);
create table t2 select CONVERT(min(c1),SIGNED) from t1 ;
desc t2;
Field	Type	Null	Key	Default	Extra
CONVERT(min(c1),SIGNED)	bigint(21)	YES		NULL	
create table t3 select CONVERT(min(c2),SIGNED) from t1 ;
create table t4 select CONVERT(min(c3),SIGNED) from t1 ;
create table t5 select CONVERT(min(c4),SIGNED) from t1 ;
##DECIMAL
drop table if exists  t1;
drop table if exists  t2;
drop table if exists  t3;
drop table if exists  t4;
drop table if exists  t5;
create table t1 (c1 double(7,2),c2 double(8,2),c3 double(10,5),c4 double(255,30));
insert into t1 values(1023.909,11.591,2.222,-12.123),(123.5,11.5995,556.02,22.45),(null,0,1.234567894562,10.0000000000002);
create table t2 select CONVERT(min(c1),DECIMAL(5,2)) from t1 ;
desc t2;
Field	Type	Null	Key	Default	Extra
CONVERT(min(c1),DECIMAL(5,2))	decimal(5,2)	YES		NULL	
create table t3 select CONVERT(min(c2),DECIMAL(5)) from t1 ;
desc t3;
Field	Type	Null	Key	Default	Extra
CONVERT(min(c2),DECIMAL(5))	decimal(5,0)	YES		NULL	
create table t4 select CONVERT(min(c3),DECIMAL(65,30)) from t1 ;
desc t4;
Field	Type	Null	Key	Default	Extra
CONVERT(min(c3),DECIMAL(65,30))	decimal(65,30)	YES		NULL	
create table t5 select CONVERT(min(c4),DECIMAL) from t1 ;
desc t5;
Field	Type	Null	Key	Default	Extra
CONVERT(min(c4),DECIMAL)	decimal(10,0)	YES		NULL	
##BINARY
drop table if exists  t1;
drop table if exists  t2;
drop table if exists  t3;
drop table if exists  t4;
drop table if exists  t5;
create table t1 (c1 double(7,2),c2 double(8,2),c3 double(10,5),c4 double(255,30));
insert into t1 values(1023.909,11.591,2.222,-12.123),(123.5,11.5995,556.02,22.45),(null,0,1.234567894562,10.0000000000002);
create table t2 select CONVERT(min(c1),BINARY) from t1 ;
desc t2;
Field	Type	Null	Key	Default	Extra
CONVERT(min(c1),BINARY)	varbinary(23)	YES		NULL	
create table t3 select CONVERT(min(c2),BINARY) from t1 ;
desc t3;
Field	Type	Null	Key	Default	Extra
CONVERT(min(c2),BINARY)	varbinary(23)	YES		NULL	
create table t4 select CONVERT(min(c3),BINARY) from t1 ;
desc t4;
Field	Type	Null	Key	Default	Extra
CONVERT(min(c3),BINARY)	varbinary(23)	YES		NULL	
create table t5 select CONVERT(min(c4),BINARY) from t1 ;
ERROR 22001: Data too long for column
##数学函数
##ROUND函数
drop table if exists  t1;
drop table if exists  t2;
drop table if exists  t3;
drop table if exists  t4;
drop table if exists  t5;
Warnings:
Note	1051	Unknown table 'db1.t5'
create table t1 (c1 double(7,2),c2 double(8,2),c3 double(10,5),c4 double(255,30));
insert into t1 values(1023.909,11.591,2.222,-12.123),(123.5,11.5995,556.02,22.45),(null,0,1.234567894562,10.0000000000002);
create table t2 select ROUND(min(c1),2) a from t1 ;
select * from t2 where a =123.5;
a
123.50
desc t2;
Field	Type	Null	Key	Default	Extra
a	double(19,2)	YES		NULL	
create table t3 select ROUND(min(c2),3) b from t1 ;
select * from t3 where b =0;
b
0.000
desc t3;
Field	Type	Null	Key	Default	Extra
b	double(20,3)	YES		NULL	
create table t4 select ROUND(min(c3),10) c from t1 ;
select * from t4 where c =1.234570064;
c
desc t4;
Field	Type	Null	Key	Default	Extra
c	double(27,10)	YES		NULL	
create table t5 select ROUND(min(c4),6) d from t1 ;
select * from t5 where d =-12.123;
d
-12.123000
desc t5;
Field	Type	Null	Key	Default	Extra
d	double(23,6)	YES		NULL	
##CEIL函数
drop table if exists  t1;
drop table if exists  t2;
drop table if exists  t3;
drop table if exists  t4;
drop table if exists  t5;
create table t1 (c1 double(7,2),c2 double(8,2),c3 double(10,5),c4 double(255,30));
insert into t1 values(-1023.909,11.591,2.222,-12.123),(-123.5,11.5995,556.02,22.45),(null,0,1.234567894562,10.0000000000002);
create table t2 select CEIL(min(c1)) a from t1 ;
select * from t2 where a=-1023.0;
a
-1023
desc t2;
Field	Type	Null	Key	Default	Extra
a	double(17,0)	YES		NULL	
create table t3 select CEIL(min(c2)) b from t1 ;
select * from t3 where b =0;
b
0
desc t3;
Field	Type	Null	Key	Default	Extra
b	double(17,0)	YES		NULL	
create table t4 select CEIL(min(c3)) c from t1 ;
select * from t4 where c =2.0;
c
2
desc t4;
Field	Type	Null	Key	Default	Extra
c	double(17,0)	YES		NULL	
create table t5 select CEIL(min(c4)) d from t1 ;
select * from t5 where d =-12.0;
d
-12
desc t5;
Field	Type	Null	Key	Default	Extra
d	double(17,0)	YES		NULL	
##FLOOR函数
drop table if exists  t1;
drop table if exists  t2;
drop table if exists  t3;
drop table if exists  t4;
drop table if exists  t5;
create table t1 (c1 double(7,2),c2 double(8,2),c3 double(10,5),c4 double(255,30));
insert into t1 values(-1023.909,11.591,2.222,-12.123),(-123.5,11.5995,556.02,22.45),(null,0,1.234567894562,10.0000000000002);
create table t2 select FLOOR(min(c1)) a from t1 ;
select * from t2 where a=-1024.0;
a
-1024
desc t2;
Field	Type	Null	Key	Default	Extra
a	double(17,0)	YES		NULL	
create table t3 select FLOOR(min(c2)) b from t1 ;
select * from t3 where b =0;
b
0
desc t3;
Field	Type	Null	Key	Default	Extra
b	double(17,0)	YES		NULL	
create table t4 select FLOOR(min(c3)) c from t1 ;
select * from t4 where c =1.0;
c
1
desc t4;
Field	Type	Null	Key	Default	Extra
c	double(17,0)	YES		NULL	
create table t5 select FLOOR(min(c4)) d from t1 ;
select * from t5 where d =-13.0;
d
-13
desc t5;
Field	Type	Null	Key	Default	Extra
d	double(17,0)	YES		NULL	
##ABS函数
drop table if exists  t1;
drop table if exists  t2;
drop table if exists  t3;
drop table if exists  t4;
drop table if exists  t5;
create table t1 (c1 double(7,2),c2 double(8,2),c3 double(10,5),c4 double(255,30));
insert into t1 values(-1023.909,11.591,2.222,-12.123),(-123.5,11.5995,556.02,22.45),(null,0,1.234567894562,10.0000000000002);
create table t2 select ABS(min(c1)) a from t1 ;
desc t2;
Field	Type	Null	Key	Default	Extra
a	double(19,2)	YES		NULL	
create table t3 select ABS(min(c2)) b from t1 ;
desc t3;
Field	Type	Null	Key	Default	Extra
b	double(19,2)	YES		NULL	
create table t4 select ABS(min(c3)) c from t1 ;
desc t4;
Field	Type	Null	Key	Default	Extra
c	double(22,5)	YES		NULL	
create table t5 select ABS(min(c4)) d from t1 ;
desc t5;
Field	Type	Null	Key	Default	Extra
d	double(47,30)	YES		NULL	
##NEG函数
drop table if exists  t1;
drop table if exists  t2;
drop table if exists  t3;
drop table if exists  t4;
drop table if exists  t5;
create table t1 (c1 double(7,2),c2 double(8,2),c3 double(10,5),c4 double(255,30));
insert into t1 values(-1023.909,11.591,2.222,-12.123),(-123.5,11.5995,556.02,22.45),(null,0,1.234567894562,10.0000000000002);
create table t2 select NEG(min(c1)) a from t1 ;
select * from t2 where a=1023.91;
a
1023.91
desc t2;
Field	Type	Null	Key	Default	Extra
a	double(8,2)	YES		NULL	
create table t3 select NEG(min(c2)) b from t1 ;
select * from t3 where b =0;
b
-0.00
desc t3;
Field	Type	Null	Key	Default	Extra
b	double(9,2)	YES		NULL	
create table t4 select NEG(min(c3)) c from t1 ;
select * from t4 where c =-1.23457;
c
-1.23457
desc t4;
Field	Type	Null	Key	Default	Extra
c	double(11,5)	YES		NULL	
create table t5 select NEG(min(c4)) d from t1 ;
select * from t5 where d =12.123000144958496000000000000000;
d
desc t5;
Field	Type	Null	Key	Default	Extra
d	double(255,30)	YES		NULL	
##SIGN函数
drop table if exists  t1;
drop table if exists  t2;
drop table if exists  t3;
drop table if exists  t4;
drop table if exists  t5;
create table t1 (c1 double(7,2),c2 double(8,2),c3 double(10,5),c4 double(255,30));
insert into t1 values(-1023.909,11.591,2.222,-12.123),(-123.5,11.5995,556.02,22.45),(null,0,1.234567894562,10.0000000000002);
create table t2 select SIGN(min(c1)) a from t1 ;
select * from t2 where a=-1;
a
-1
desc t2;
Field	Type	Null	Key	Default	Extra
a	bigint(20)	YES		NULL	
create table t3 select SIGN(min(c2)) b from t1 ;
select * from t3 where b =0;
b
0
desc t3;
Field	Type	Null	Key	Default	Extra
b	bigint(20)	YES		NULL	
create table t4 select SIGN(min(c3)) c from t1 ;
select * from t4 where c =1;
c
1
desc t4;
Field	Type	Null	Key	Default	Extra
c	bigint(20)	YES		NULL	
create table t5 select SIGN(min(c4)) d from t1 ;
select * from t5 where d =-1;
d
-1
desc t5;
Field	Type	Null	Key	Default	Extra
d	bigint(20)	YES		NULL	
##CONV函数
drop table if exists  t1;
drop table if exists  t2;
drop table if exists  t3;
drop table if exists  t4;
drop table if exists  t5;
create table t1 (c1 double(7,2),c2 double(8,2),c3 double(10,5),c4 double(255,30));
insert into t1 values(-1023.909,11.591,2.222,-12.123),(-123.5,11.5995,556.02,22.45),(null,0,1.234567894562,10.0000000000002);
create table t2 select CONV(min(c1),16,10) a from t1 ;
select * from t2;
a
18446744073709547485
desc t2;
Field	Type	Null	Key	Default	Extra
a	varchar(64)	YES		NULL	
create table t3 select CONV(min(c2),2,10) b from t1 ;
select * from t3;
b
0
desc t3;
Field	Type	Null	Key	Default	Extra
b	varchar(64)	YES		NULL	
create table t4 select CONV(min(c3),10,8) c from t1 ;
select * from t4;
c
1
desc t4;
Field	Type	Null	Key	Default	Extra
c	varchar(64)	YES		NULL	
create table t5 select CONV(min(c4),10,-10) d from t1 ;
select * from t5;
d
-12
desc t5;
Field	Type	Null	Key	Default	Extra
d	varchar(64)	YES		NULL	
##MOD函数,此函数type类型一致;
drop table if exists  t1;
drop table if exists  t2;
drop table if exists  t3;
drop table if exists  t4;
drop table if exists  t5;
create table t1 (c1 double(7,2),c2 double(8,2),c3 double(10,5),c4 double(255,30));
insert into t1 values(-1023.909,11.591,2.222,-12.123),(-123.5,11.5995,556.02,22.45),(null,0,1.234567894562,10.0000000000002);
create table t2 select MOD(min(c1),8) a from t1 ;
select * from t2 ;
a
-7.91
desc t2;
Field	Type	Null	Key	Default	Extra
a	double(19,2)	YES		NULL	
create table t3 select MOD(min(c2),3) b from t1 ;
select * from t3 ;
b
0.00
desc t3;
Field	Type	Null	Key	Default	Extra
b	double(19,2)	YES		NULL	
create table t4 select MOD(min(c3),0.5) c from t1 ;
select * from t4 ;
c
0.23457
desc t4;
Field	Type	Null	Key	Default	Extra
c	double(22,5)	YES		NULL	
create table t5 select MOD(min(c4),2) d from t1 ;
select * from t5 ;
d
-0.122999999999999440000000000000
desc t5;
Field	Type	Null	Key	Default	Extra
d	double(47,30)	YES		NULL	
##POW函数,此函数type类型一致;
drop table if exists  t1;
drop table if exists  t2;
drop table if exists  t3;
drop table if exists  t4;
drop table if exists  t5;
create table t1 (c1 double(7,2),c2 double(8,2),c3 double(10,5),c4 double(255,30));
insert into t1 values(-1023.909,11.591,2.222,-12.123),(-123.5,11.5995,556.02,22.45),(null,0,1.234567894562,10.0000000000002);
create table t2 select POW(min(c1),8) a from t1 ;
select * from t2 ;
a
1.208076055084351e24
desc t2;
Field	Type	Null	Key	Default	Extra
a	double	YES		NULL	
create table t3 select POW(min(c2),3) b from t1 ;
select * from t3 ;
b
0
desc t3;
Field	Type	Null	Key	Default	Extra
b	double	YES		NULL	
create table t4 select POW(min(c3),0.5) c from t1 ;
select * from t4 ;
c
1.1111120555551541
desc t4;
Field	Type	Null	Key	Default	Extra
c	double	YES		NULL	
create table t5 select POW(min(c4),2) d from t1 ;
select * from t5 ;
d
146.96712899999997
desc t5;
Field	Type	Null	Key	Default	Extra
d	double	YES		NULL	
##power函数,此函数type类型一致;
drop table if exists  t1;
drop table if exists  t2;
drop table if exists  t3;
drop table if exists  t4;
drop table if exists  t5;
create table t1 (c1 double(7,2),c2 double(8,2),c3 double(10,5),c4 double(255,30));
insert into t1 values(-1023.909,11.591,2.222,-12.123),(-123.5,11.5995,556.02,22.45),(null,0,1.234567894562,10.0000000000002);
create table t2 select power(min(c1),8) a from t1 ;
select * from t2 ;
a
1.208076055084351e24
desc t2;
Field	Type	Null	Key	Default	Extra
a	double	YES		NULL	
create table t3 select power(min(c2),3) b from t1 ;
select * from t3 ;
b
0
desc t3;
Field	Type	Null	Key	Default	Extra
b	double	YES		NULL	
create table t4 select power(min(c3),0.5) c from t1 ;
select * from t4 ;
c
1.1111120555551541
desc t4;
Field	Type	Null	Key	Default	Extra
c	double	YES		NULL	
create table t5 select power(min(c4),2) d from t1 ;
select * from t5 ;
d
146.96712899999997
desc t5;
Field	Type	Null	Key	Default	Extra
d	double	YES		NULL	
##RAND函数,此函数type类型一致;
drop table if exists  t1;
drop table if exists  t2;
drop table if exists  t3;
drop table if exists  t4;
drop table if exists  t5;
create table t1 (c1 double(7,2),c2 double(8,2),c3 double(10,5),c4 double(255,30));
insert into t1 values(-1023.909,11.591,2.222,-12.123),(-123.5,11.5995,556.02,22.45),(null,0,1.234567894562,10.0000000000002);
create table t2 select RAND(min(c1)) a from t1 ;
select * from t2 ;
a
0.9677166277242047
desc t2;
Field	Type	Null	Key	Default	Extra
a	double	YES		NULL	
create table t3 select RAND(min(c2)) b from t1 ;
select * from t3 ;
b
0.15522042769493574
desc t3;
Field	Type	Null	Key	Default	Extra
b	double	YES		NULL	
create table t4 select RAND(min(c3)) c from t1 ;
select * from t4 ;
c
0.40540353712197724
desc t4;
Field	Type	Null	Key	Default	Extra
c	double	YES		NULL	
create table t5 select RAND(min(c4)) d from t1 ;
select * from t5 ;
d
0.15302311829572834
desc t5;
Field	Type	Null	Key	Default	Extra
d	double	YES		NULL	
##case和if函数会导致scale丢失;
##流程控制函数
##case
drop table if exists  t1;
drop table if exists  t2;
drop table if exists  t3;
drop table if exists  t4;
drop table if exists  t5;
create table t1 (c1 double(7,2),c2 double(8,2),c3 double(10,5),c4 double(20,10));
insert into t1 values(1023.909,11.591,2.222,-12.123),(-123.5,11.5995,556.02,22.45),(null,0,1.234567894562,10.0000000000002);
select (case when c1 < 400 or c1 is null then max(c1) when c2 =0 then false else max(c4) end ) a from t1;
a
22.4500000000
create table t2 select (case when c1 < 400 or c1 is null then max(c1) when c2 =0 then false else max(c4) end ) a from t1;
desc t2;
Field	Type	Null	Key	Default	Extra
a	double(27,10)	YES		NULL	
##IF函数
drop table if exists  t1;
drop table if exists  t2;
create table t1 (c1 double(7,2),c2 double(8,2),c3 double(10,5),c4 double(20,10));
insert into t1 values(1023.909,11.591,2.222,-12.123),(-123.5,11.5995,556.02,22.45),(null,0,1.234567894562,10.0000000000002);
SELECT IF(min(c1)<max(c2),min(c3),max(c4)) a  from t1;
a
1.2345700000
create table t2 select IF(min(c1)<max(c2),min(c3),max(c4)) a  from t1;
desc t2;
Field	Type	Null	Key	Default	Extra
a	double(27,10)	YES		NULL	
##IFNULL函数
drop table if exists  t1;
drop table if exists  t2;
create table t1 (c1 double(7,2),c2 double(8,2),c3 double(10,5),c4 double(20,10));
insert into t1 values(1023.909,11.591,2.222,-12.123),(-123.5,11.5995,556.02,22.45),(null,0,1.234567894562,10.0000000000002);
SELECT IFNULL(min(c2),max(c1)) a ,IFNULL(min(c1),max(c2)) b from t1;
a	b
0.00	-123.50
create table t2 select IFNULL(min(c2),max(c1)) a ,IFNULL(min(c1),max(c2)) b  from t1;
desc t2;
Field	Type	Null	Key	Default	Extra
a	double(19,2)	YES		NULL	
b	double(19,2)	YES		NULL	
##NULLIF函数
drop table if exists  t1;
drop table if exists  t2;
create table t1 (c1 double(7,2),c2 double(8,2),c3 double(10,5),c4 double(20,10));
insert into t1 values(1023.909,11.591,2.222,-12.123),(-123.5,11.5995,556.02,22.45),(null,0,1.234567894562,10.0000000000002);
SELECT NULLIF(min(c2),max(c1)) a ,NULLIF(min(c1),max(c2)) b from t1;
a	b
0.00	-123.50
create table t2 select NULLIF(min(c2),max(c1)) a ,NULLIF(min(c1),max(c2)) b  from t1;
desc t2;
Field	Type	Null	Key	Default	Extra
a	double(19,2)	YES		NULL	
b	double(19,2)	YES		NULL	
##比较函数
##GREATEST函数
drop table if exists  t1;
drop table if exists  t2;
create table t1 (c1 double(7,2),c2 double(8,2),c3 double(10,5),c4 double(20,10));
insert into t1 values(1023.909,11.591,2.222,-12.123),(-123.5,11.5995,556.02,22.45),(null,0,1.234567894562,10.0000000000002);
SELECT GREATEST(max(c1),max(c2),max(c2),max(c3)) a  from t1;
a
1023.91000
create table t2 select GREATEST(max(c1),max(c2),max(c2),max(c3)) a   from t1;
desc t2;
Field	Type	Null	Key	Default	Extra
a	double(22,5)	YES		NULL	
##LEAST函数
drop table if exists  t1;
drop table if exists  t2;
create table t1 (c1 double(7,2),c2 double(8,2),c3 double(10,5),c4 double(20,10));
insert into t1 values(1023.909,11.591,2.222,-12.123),(-123.5,11.5995,556.02,22.45),(null,0,1.234567894562,10.0000000000002);
SELECT LEAST(max(c1),max(c2),max(c2),max(c3)) a  from t1;
a
11.60000
create table t2 select LEAST(max(c1),max(c2),max(c2),max(c3)) a   from t1;
desc t2;
Field	Type	Null	Key	Default	Extra
a	double(22,5)	YES		NULL	
##ISNULL函数
drop table if exists  t1;
drop table if exists  t2;
create table t1 (c1 double(7,2),c2 double(8,2),c3 double(10,5),c4 double(20,10));
insert into t1 values(1023.909,11.591,2.222,-12.123),(-123.5,11.5995,556.02,22.45),(null,0,1.234567894562,10.0000000000002);
SELECT ISNULL(c1) a, ISNULL(min(c1)) b from t1;
a	b
0	0
create table t2 select ISNULL(c1) a, ISNULL(min(c1)) b   from t1;
desc t2;
Field	Type	Null	Key	Default	Extra
a	int(1)	YES		NULL	
b	int(1)	YES		NULL	
########清空回收站，删除测试数据库，表等 ##########
drop database  IF EXISTS db1;
