drop database  IF EXISTS  db1;
create database db1;
use db1;
SET wait_timeout=30000000;
SET ob_trx_timeout = 30000000;
SET ob_query_timeout = 30000000;
##设置相同sql_mode;
SET @@sql_mode='STRICT_TRANS_TABLES,NO_ENGINE_SUBSTITUTION,no_zero_date,no_zero_in_date,PIPES_AS_CONCAT';
##DML操作
##select
##create as select 
drop table if exists  t1;
Warnings:
Note	1051	Unknown table 'db1.t1'
drop table if exists  t2;
Warnings:
Note	1051	Unknown table 'db1.t2'
create table t1 (c1 float(7,2),c2 float(8,2),c3 float(10,5),c4 float(255,30));
insert into t1 values(-1023.909,11.591,2.222,-12.123),(123.5,11.5995,556.02,22.45),(-123.5,11.5995,556.1102,22.999909),(null,0,1.234567894562,10.0000000000002);
create table t2 as select distinct c2 from t1 where c2>=11.60;
select * from t2;
c2
11.60
desc t2;
Field	Type	Null	Key	Default	Extra
c2	float(8,2)	YES		NULL	
##聚合函数
drop table if exists  t1;
drop table if exists  t2;
create table t1 (c1 float(7,2),c2 float(8,2),c3 float(10,5),c4 float(255,30));
insert into t1 values(-1023.909,11.591,2.222,-12.123),(123.5,11.5995,556.02,22.45),(-123.5,11.5995,556.1102,22.999909),(null,0,1.234567894562,10.0000000000002);
create table t2 as select min(c1) a from t1;
desc t2;
Field	Type	Null	Key	Default	Extra
a	float(7,2)	YES		NULL	
create table t3 as select max(c1) a from t1;
desc t3;
Field	Type	Null	Key	Default	Extra
a	float(7,2)	YES		NULL	
create table t4 as select avg(c1) a from t1;
desc t4;
Field	Type	Null	Key	Default	Extra
a	double(11,6)	YES		NULL	
create table t5 as select sum(c1) a from t1;
desc t5;
Field	Type	Null	Key	Default	Extra
a	double(19,2)	YES		NULL	
create table t6 as select count(c1) a from t1;
desc t6;
Field	Type	Null	Key	Default	Extra
a	bigint(20)	NO		NULL	
drop table if exists  t1;
drop table if exists  t2;
drop table if exists  t3;
drop table if exists  t4;
drop table if exists  t5;
drop table if exists  t6;
##where子句
##=,<,<=,>=,<>
drop table if exists  t1;
Warnings:
Note	1051	Unknown table 'db1.t1'
drop table if exists  t2;
Warnings:
Note	1051	Unknown table 'db1.t2'
create table t1 (c1 float(7,2),c2 float(8,2),c3 float(10,5),c4 float(255,30));
insert into t1 values(-1023.909,11.591,2.222,-12.123),(123.5,11.5995,556.02,22.45),(-123.5,11.5995,556.1102,22.999909),(null,0,1.234567894562,10.0000000000002);
select c1 from t1 where c1='-1023.91';
c1
select c1 from t1 where c1>123.5;
c1
select c1 from t1 where c1<-123.5;
c1
-1023.91
select c1 from t1 where c1<=-123.5;
c1
-1023.91
-123.50
select c1 from t1 where c1>=-123.5;
c1
-123.50
123.50
create table t2 as select c1 from t1 where c1<>-123.5;
desc t2;
Field	Type	Null	Key	Default	Extra
c1	float(7,2)	YES		NULL	
##and or
drop table if exists  t1;
drop table if exists  t2;
create table t1 (c1 float(7,2),c2 float(8,2),c3 float(10,5),c4 float(255,30));
insert into t1 values(-1023.909,11.591,2.222,-12.123),(123.5,11.5995,556.02,22.45),(-123.5,11.5995,556.1102,22.999909),(null,0,1.234567894562,10.0000000000002);
select min(c1) from t1 where c2=11.6 and c1 is not null and c3 !=556.11023 ;
min(c1)
123.50
select min(c1) from t1 where c2=11.6 or c1 is not null or c3 !=556.11023 ;
min(c1)
-1023.91
select min(c1) from t1 where c2=11.6 and c1 is not null or c3 !=556.11023 ;
min(c1)
-1023.91
create table t2 as select min(c1) from t1 where c2=11.6 or c1 is null and c3 !=556.11023;
desc t2 ;
Field	Type	Null	Key	Default	Extra
min(c1)	float(7,2)	YES		NULL	
##between and 
drop table if exists  t1;
drop table if exists  t2;
create table t1 (c1 float(7,2),c2 float(8,2),c3 float(10,5),c4 float(255,30));
insert into t1 values(-1023.909,11.591,2.222,-12.123),(123.5,11.5995,556.02,22.45),(-123.5,11.5995,556.1102,22.999909),(null,0,1.234567894562,10.0000000000002);
select c1 from t1 where c1 between  -1023.91 and 123.5;
c1
-1023.91
-123.50
123.50
select c1 from t1 where c2 between 11.59 and 11.60;
c1
-1023.91
-123.50
123.50
create table t2 as select c1 from t1 where c1 between  -1023.91 and 123.5;
desc t2 ;
Field	Type	Null	Key	Default	Extra
c1	float(7,2)	YES		NULL	
##like,not like
drop table if exists  t1;
drop table if exists  t2;
create table t1 (c1 float(7,2),c2 float(8,2),c3 float(10,5),c4 float(255,30));
insert into t1 values(-1023.909,11.591,2.222,-12.123),(123.5,11.5995,556.02,22.45),(-123.5,11.5995,556.1102,22.999909),(null,0,1.234567894562,10.0000000000002);
select min(c1) from t1 where c2 like '%1%' and c1 like '%5%';
min(c1)
-123.50
select min(c1) from t1 where c2 like '%1%' and c1 not like '%5%';
min(c1)
-1023.91
create table t2 as select min(c1) a from t1 where c2 like '%1%' and c1 not like '%5%';
desc t2 ;
Field	Type	Null	Key	Default	Extra
a	float(7,2)	YES		NULL	
##exists,any,all,in
drop table if exists  t1;
drop table if exists  t2;
create table t1 (c1 float(7,3),c2 float(8,2),c3 float(10,5),c4 float(255,30));
insert into t1 values(-1023.909,11.591,2.222,-12.123),(123.5,11.5995,556.02,22.45),(-123.5,11.5995,556.1102,22.999909),(null,0,1.234567894562,10.0000000000002);
create table t2 (a1 float(7,3),a2 float(8,2));
insert into t2 values(-1023.908,11.591),(123.5,11.5995),(-123.5,11.5995);
select avg(c1) from t1 where exists(select a2 from t2) limit 1;
avg(c1)
-341.3029989
select avg(c1) from t1 where -1023.909 < any (select a1 from t2) limit 1;
avg(c1)
-341.3029989
select avg(c1) from t1 where -1023.909 < all(select a1 from t2) limit 1;
avg(c1)
-341.3029989
select avg(c1) from t1 where -1023.908 in (select a1 from t2) ;
avg(c1)
-341.3029989
##多表join
##inner join (float+int)
drop table if exists  t1;
drop table if exists  t2;
drop table if exists  t3;
Warnings:
Note	1051	Unknown table 'db1.t3'
create table t1 (c1 float(7,3),c2 float(8,2),c3 float(10,5),c4 float(255,30));
insert into t1 values(-1023.909,11.591,2.222,-12.123),(123.5,11.5995,556.02,22.45),(-123.5,11.5995,556.1102,22.999909),(null,0,1.234567894562,10.0000000000002);
create table t2 (a1 int,a2 int,a3 int,a4 int);
insert into t2 values(-1023.909,11.59,2.222,-12.123),(123.5,11.60,556.02,22.45),(-123.5,11.5995,556.1102,22.999909),(null,0,1.234567894562,10.0000000000002);
##此处BUG,不显示结果--已修复
select * from t1 inner join t2 on t1.c4=t2.a4;
c1	c2	c3	c4	a1	a2	a3	a4
NULL	0.00	1.23457	10.000000000000000000000000000000	NULL	0	1	10
create table t3 as select * from t1 inner join t2 on t1.c4=t2.a4;
desc t3;
Field	Type	Null	Key	Default	Extra
c1	float(7,3)	YES		NULL	
c2	float(8,2)	YES		NULL	
c3	float(10,5)	YES		NULL	
c4	float(255,30)	YES		NULL	
a1	int(11)	YES		NULL	
a2	int(11)	YES		NULL	
a3	int(11)	YES		NULL	
a4	int(11)	YES		NULL	
##inner join (float+float)
drop table if exists  t1;
drop table if exists  t2;
drop table if exists  t3;
create table t1 (c1 float(7,3),c2 float(8,2),c3 float(10,5),c4 float(255,30));
insert into t1 values(-1023.909,11.591,2.222,-12.123),(123.5,11.5995,556.02,22.45),(-123.5,11.5995,556.1102,22.999909),(null,0,1.234567894562,10.0000000000002);
create table t2 (a1 float(7,3),a2 float(8,2),a3 float(10,5),a4 float(255,30));
insert into t2 values(-1023.909,11.59,2.222,-12.123),(123.5,11.60,556.02,22.45),(-123.5,11.5995,556.1102,22.999909),(null,0,1.234567894562,10.0000000000002);
select * from t1 inner join t2 on t1.c4=t2.a4;
c1	c2	c3	c4	a1	a2	a3	a4
-1023.909	11.59	2.22200	-12.123000144958496000000000000000	-1023.909	11.59	2.22200	-12.123000144958496000000000000000
-123.500	11.60	556.11023	22.999908447265625000000000000000	-123.500	11.60	556.11023	22.999908447265625000000000000000
123.500	11.60	556.02002	22.450000762939453000000000000000	123.500	11.60	556.02002	22.450000762939453000000000000000
NULL	0.00	1.23457	10.000000000000000000000000000000	NULL	0.00	1.23457	10.000000000000000000000000000000
create table t3 as select * from t1 inner join t2 on t1.c4=t2.a4 ;
desc t3;
Field	Type	Null	Key	Default	Extra
c1	float(7,3)	YES		NULL	
c2	float(8,2)	YES		NULL	
c3	float(10,5)	YES		NULL	
c4	float(255,30)	YES		NULL	
a1	float(7,3)	YES		NULL	
a2	float(8,2)	YES		NULL	
a3	float(10,5)	YES		NULL	
a4	float(255,30)	YES		NULL	
##left join (float+int)
drop table if exists  t1;
drop table if exists  t2;
drop table if exists  t3;
create table t1 (c1 float(7,3),c2 float(8,2),c3 float(10,5),c4 float(255,30));
insert into t1 values(-1023.909,11.591,2.222,-12.123),(123.5,11.5995,556.02,22.45),(-123.5,11.5995,556.1102,22.999909),(null,0,1.234567894562,10.0000000000002);
create table t2 (a1 int,a2 int,a3 int,a4 int);
insert into t2 values(-1023.909,11.59,2.222,-12.123),(123.5,11.60,556.02,22.45),(-123.5,11.5995,556.1102,22.999909),(null,0,1.234567894562,10.0000000000002);
select /*+use_nl(t1 t2)*/a2,a3,a4 from t1 left join t2 on t1.c4=t2.a4 order by  c1;
a2	a3	a4
0	1	10
NULL	NULL	NULL
NULL	NULL	NULL
NULL	NULL	NULL
select a2,a3,a4 from t1 left join t2 on t1.c4=t2.a4 order by  c1;
a2	a3	a4
0	1	10
NULL	NULL	NULL
NULL	NULL	NULL
NULL	NULL	NULL
create table t3 as select a2,a3,a4 from t1 left join t2 on t1.c4=t2.a4 order by t1.c3;
desc t3;
Field	Type	Null	Key	Default	Extra
a2	int(11)	YES		NULL	
a3	int(11)	YES		NULL	
a4	int(11)	YES		NULL	
##left join (float+float)
drop table if exists  t1;
drop table if exists  t2;
drop table if exists  t3;
create table t1 (c1 float(7,3),c2 float(8,2),c3 float(10,5),c4 float(255,30));
insert into t1 values(-1023.909,11.591,2.222,-12.123),(123.5,11.5995,556.02,22.45),(-123.5,11.5995,556.1102,22.999909),(null,0,1.234567894562,10.0000000000002);
create table t2 (a1 float(7,3),a2 float(8,2),a3 float(10,5),a4 float(255,30));
insert into t2 values(-1023.909,11.59,2.222,-12.123),(123.5,11.60,556.02,22.45),(-123.5,11.5995,556.1102,22.999909),(null,0,1.234567894562,10.0000000000002);
select a2,a3,a4 from t1 left join t2 on t1.c4=t2.a4 order by  c1;
a2	a3	a4
0.00	1.23457	10.000000000000000000000000000000
11.59	2.22200	-12.123000144958496000000000000000
11.60	556.02002	22.450000762939453000000000000000
11.60	556.11023	22.999908447265625000000000000000
create table t3 as select a2,a3,a4 from t1 left join t2 on t1.c4=t2.a4 order by t1.c3;
desc t3;
Field	Type	Null	Key	Default	Extra
a2	float(8,2)	YES		NULL	
a3	float(10,5)	YES		NULL	
a4	float(255,30)	YES		NULL	
##right join (float+int)
drop table if exists  t1;
drop table if exists  t2;
drop table if exists  t3;
create table t1 (c1 float(7,3),c2 float(8,2),c3 float(10,5),c4 float(255,30));
insert into t1 values(-1023.909,11.591,2.222,-12.123),(123.5,11.5995,556.02,22.45),(-123.5,11.5995,556.1102,22.999909),(null,0,1.234567894562,10.0000000000002);
create table t2 (a1 int,a2 int,a3 int,a4 int);
insert into t2 values(-1023.909,11.59,2.222,-12.123),(123.5,11.60,556.02,22.45),(-123.5,11.5995,556.1102,22.999909),(null,0,1.234567894562,10.0000000000002);
select a2,a3,a4 from t1 right join t2 on t1.c4=t2.a4 order by a1 ;
a2	a3	a4
0	1	10
12	2	-12
12	556	22
12	556	23
create table t3 as select a2 from t1 right join t2 on t1.c4=t2.a4 order by t1.c3;
desc t3;
Field	Type	Null	Key	Default	Extra
a2	int(11)	YES		NULL	
##right join (float+float)
drop table if exists  t1;
drop table if exists  t2;
drop table if exists  t3;
create table t1 (c1 float(7,3),c2 float(8,2),c3 float(10,5),c4 float(255,30));
insert into t1 values(-1023.909,11.591,2.222,-12.123),(123.5,11.5995,556.02,22.45),(-123.5,11.5995,556.1102,22.999909),(null,0,1.234567894562,10.0000000000002);
create table t2 (a1 float(7,3),a2 float(8,2),a3 float(10,5),a4 float(255,30));
insert into t2 values(-1023.909,11.59,2.222,-12.123),(123.5,11.60,556.02,22.45),(-123.5,11.5995,556.1102,22.999909),(null,0,1.234567894562,10.0000000000002);
select a2,a3,a4 from t1 right join t2 on t1.c4=t2.a4 order by a1;
a2	a3	a4
0.00	1.23457	10.000000000000000000000000000000
11.59	2.22200	-12.123000144958496000000000000000
11.60	556.02002	22.450000762939453000000000000000
11.60	556.11023	22.999908447265625000000000000000
create table t3 as select a2 from t1 right join t2 on t1.c4=t2.a4 order by t1.c3;
desc t3;
Field	Type	Null	Key	Default	Extra
a2	float(8,2)	YES		NULL	
##with as
drop table if exists  t1;
drop table if exists  t2;
drop table if exists  t3;
create table t1 (c1 float(7,3),c2 float(8,2),c3 float(10,5),c4 float(255,30));
insert into t1 values(-1023.909,11.591,2.222,-12.123),(123.5,11.5995,556.02,22.45),(-123.5,11.5995,556.1102,22.999909),(null,0,1.234567894562,10.0000000000002);
with a as (select max(c4) from t1) select * from a;
max(c4)
22.999908447265625000000000000000
##运算符
drop table if exists  t1;
create table t1 (c1 float(7,3),c2 float(8,2),c3 float(10,5),c4 float(255,30));
insert into t1 VALUES(-1023.909,11.591,2.222,-12.123),(123.5,11.5995,556.02,22.45),(-123.5,11.5995,556.1102,22.999909),(null,0,1.234567894562,10.0000000000002);
select c1+c2 from t1;
c1+c2
-1012.319
-111.900
135.100
NULL
select c1-c2 from t1;
c1-c2
-1035.499
-135.100
111.900
NULL
select c1*c2 from t1;
c1*c2
-11867.105
-1432.600
1432.600
NULL
select c1/c2 from t1;
c1/c2
-10.6465514
-88.3441746
10.6465514
NULL
drop table if exists  t1;
create table t1 (c1 float(10,3),c2 double);
insert into t1 VALUES(-1023.909,11.591),(123.5,11.5995);
select c2+c1 from t1;
c2+c1
-1012.3179965820312
135.0995
select c2-c1 from t1;
c2-c1
-111.9005
1035.4999965820311
select c2*c1 from t1;
c2*c1
-11868.129179382324
1432.53825
select c1/c2 from t1;
c1/c2
-88.33655392822287
10.647010647010646
drop table if exists  t1;
create table t1 (c1 float(8,2),c2 char(20));
insert into t1 VALUES(-1023.909,11.591),(123.5,11.5995);
select c2+c1 from t1;
c2+c1
-1012.3189731445312
135.0995
select c2-c1 from t1;
c2-c1
-111.9005
1035.5009731445311
select c2*c1 from t1;
c2*c1
-11868.140498718261
1432.53825
select c1/c2 from t1;
c1/c2
-88.33663818001305
10.647010647010646
drop table if exists  t1;
create table t1 (c1 float(255,30),c2 decimal(54,25));
insert into t1 VALUES(-1023.909,11.591),(123.5,11.5995);
select c2+c1 from t1;
c2+c1
-1012.317996582031200000000000000000
135.099500000000000000000000000000
select c2-c1 from t1;
c2-c1
-111.900500000000000000000000000000
1035.499996582031100000000000000000
select c2*c1 from t1;
c2*c1
-11868.129179382324000000000000000000
1432.538250000000000000000000000000
select c1/c2 from t1;
c1/c2
-88.33655392822287
10.647010647010646
##distinct
drop table if exists  t1;
drop table if exists  t2;
Warnings:
Note	1051	Unknown table 'db1.t2'
create table t1 (c1 float(7,3),c2 int,c3 float(10,5),c4 float(255,30));
insert into t1 VALUES(-1023.909,11.591,2.222,-12.123),(123.5,11.5995,556.02,22.45),(-123.5,11.5995,556.1102,22.459909),(null,0,1.234567894562,10.0000000000002);
select distinct  distinct c1,c4,c2,c3 from t1 ;
c1	c4	c2	c3
-1023.909	-12.123000144958496000000000000000	12	2.22200
-123.500	22.459909439086914000000000000000	12	556.11023
123.500	22.450000762939453000000000000000	12	556.02002
NULL	10.000000000000000000000000000000	0	1.23457
create table t2 as select distinct  c4 from t1;
desc t2;
Field	Type	Null	Key	Default	Extra
c4	float(255,30)	YES		NULL	
##group by 
drop table if exists  t1;
drop table if exists  t2;
create table t1 (c1 float(7,3),c2 float(20,10),c3 float(10,5),c4 float(255,30));
insert into t1 VALUES(-1023.909,11.591,2.222,-12.123),(123.5,11.5995,556.02,22.45),(-123.5,11.5995,556.1102,22.459909),(null,0,1.234567894562,10.0000000000002);
select c1 from t1 group BY c2 order by c1;
c1
-1023.909
123.500
NULL
create table t2 as select * from t1 group BY c2  having sum(c1);
##order by 
drop table if exists  t1;
drop table if exists  t2;
create table t1 (c1 float(7,3),c2 float(8,2),c3 float(10,5),c4 float(255,30));
insert into t1 values(-1023.909,11.591,2.222,-12.123),(123.5,11.5995,556.02,22.45),(-123.5,11.5995,556.1102,22.999909),(null,0,1.234567894562,10.0000000000002);
select * from t1 order by c2,c1,c3,c4  ;
c1	c2	c3	c4
-1023.909	11.59	2.22200	-12.123000144958496000000000000000
-123.500	11.60	556.11023	22.999908447265625000000000000000
123.500	11.60	556.02002	22.450000762939453000000000000000
NULL	0.00	1.23457	10.000000000000000000000000000000
##子查询
drop table if exists  t1;
drop table if exists  t2;
Warnings:
Note	1051	Unknown table 'db1.t2'
create table t1 (c1 float(7,3),c2 float(8,2),c3 float(10,5),c4 float(255,30));
insert into t1 values(-1023.909,11.591,2.222,-12.123),(123.5,11.5995,556.02,22.45),(-123.5,11.5995,556.1102,22.999909),(null,0,1.234567894562,10.0000000000002);
create table t2 (a1 float(7,3),a2 float(8,2),a3 float(10,5),a4 float(255,30));
insert into t2 values(-1023.909,11.59,2.222,-12.123),(123.5,11.60,556.02,22.45),(-123.5,11.5995,556.1102,22.999909),(null,0,1.234567894562,10.0000000000002);
select * from t1 where c2 is true;
c1	c2	c3	c4
-1023.909	11.59	2.22200	-12.123000144958496000000000000000
-123.500	11.60	556.11023	22.999908447265625000000000000000
123.500	11.60	556.02002	22.450000762939453000000000000000
select c4 from t1 where c2 > (select c2 from t1 inner join t2 on t1.c4=t2.a4 where c2=11.59 and c4=-12.123000144958496000000000000000) order by c4 limit 1;
c4
22.450000762939453000000000000000
##insert操作
##字符类型
drop table if exists  t1;
drop table if exists  t2;
create table t1 (c1 float(7,3),c2 float(8,2),c3 float(10,5),c4 float(255,30));
insert into t1 values(-1023.909,11.591,2.222,-12.123),(123.5,11.5995,556.02,22.45),(-123.5,11.5995,556.1102,22.999909),(null,0,1.234567894562,10.0000000000002);
create table t2 (a1 char(10),a2 varchar(10));
insert into t2(a1,a2) select c2,c4 from t1 where c1 is null;
ERROR 22001: Data too long for column 'a2' at row 1
drop table if exists  t1;
drop table if exists  t2;
create table t1 (c1 float(7,3),c2 float(8,2),c3 float(10,5),c4 float(255,30));
insert into t1 values(-1023.909,11.591,2.222,-12.123),(123.5,11.5995,556.02,22.45),(-123.5,11.5995,556.1102,22.999909),(null,0,1.234567894562,10.0000000000002);
create table t2 (a1 char(10),a2 varchar(255));
insert into t2(a1,a2) select c2,c4 from t1 where c1 is null;
select * from t2;
a1	a2
0.00	10.000000000000000000000000000000
##数值类型
##int
drop table if exists  t1;
drop table if exists  t2;
create table t1 (c1 float(7,3),c2 float(8,2),c3 float(10,5),c4 float(255,30));
insert into t1 values(-1023.909,11.591,2.222,-12.123),(123.5,11.5995,556.02,22.45),(-123.5,11.5995,556.1102,22.999909),(null,0,1.234567894562,10.0000000000002);
create table t2 (a1 int,a2 int);
insert into t2(a1,a2) select c2,c4 from t1 where c1 is null;
select * from t2;
a1	a2
0	10
##TINYINT
drop table if exists  t1;
drop table if exists  t2;
create table t1 (c1 float(7,3),c2 float(8,2),c3 float(10,5),c4 float(255,30));
insert into t1 values(-1023.909,11.591,2.222,-12.123),(123.5,11.5995,556.02,22.45),(-123.5,11.5995,556.1102,22.999909),(null,0,1.234567894562,10.0000000000002);
create table t2 (a1 TINYINT,a2 TINYINT);
insert into t2(a1,a2) select c2,c4 from t1 where c1 is null;
select * from t2;
a1	a2
0	10
##SMALLINT
drop table if exists  t1;
drop table if exists  t2;
create table t1 (c1 float(7,3),c2 float(8,2),c3 float(10,5),c4 float(255,30));
insert into t1 values(-1023.909,11.591,2.222,-12.123),(123.5,11.5995,556.02,22.45),(-123.5,11.5995,556.1102,22.999909),(null,0,1.234567894562,10.0000000000002);
create table t2 (a1 SMALLINT,a2 SMALLINT);
insert into t2(a1,a2) select c2,c4 from t1 where c1 is null;
select * from t2;
a1	a2
0	10
##MEDIUMINT
drop table if exists  t1;
drop table if exists  t2;
create table t1 (c1 float(7,3),c2 float(8,2),c3 float(10,5),c4 float(255,30));
insert into t1 values(-1023.909,11.591,2.222,-12.123),(123.5,11.5995,556.02,22.45),(-123.5,11.5995,556.1102,22.999909),(null,0,1.234567894562,10.0000000000002);
create table t2 (a1 MEDIUMINT,a2 MEDIUMINT);
insert into t2(a1,a2) select c2,c4 from t1 where c1 is null;
select * from t2;
a1	a2
0	10
##BIGINT
drop table if exists  t1;
drop table if exists  t2;
create table t1 (c1 float(7,3),c2 float(8,2),c3 float(10,5),c4 float(255,30));
insert into t1 values(-1023.909,11.591,2.222,-12.123),(123.5,11.5995,556.02,22.45),(-123.5,11.5995,556.1102,22.999909),(null,0,1.234567894562,10.0000000000002);
create table t2 (a1 BIGINT,a2 BIGINT);
insert into t2(a1,a2) select c2,c4 from t1 where c1 is null;
select * from t2;
a1	a2
0	10
##double
drop table if exists  t1;
drop table if exists  t2;
create table t1 (c1 float(7,3),c2 float(8,2),c3 float(10,5),c4 float(255,30));
insert into t1 values(-1023.909,11.591,2.222,-12.123),(123.5,11.5995,556.02,22.45),(-123.5,11.5995,556.1102,22.999909),(null,0,1.234567894562,10.0000000000002);
create table t2 (a1 double,a2 double);
insert into t2(a1,a2) select c2,c4 from t1 where c1 is null;
select * from t2;
a1	a2
0	10
##decimal
drop table if exists  t1;
drop table if exists  t2;
create table t1 (c1 float(7,3),c2 float(8,2),c3 float(10,5),c4 float(255,30));
insert into t1 values(-1023.909,11.591,2.222,-12.123),(123.5,11.5995,556.02,22.45),(-123.5,11.5995,556.1102,22.999909),(null,0,1.234567894562,10.0000000000002);
create table t2 (a1 decimal,a2 decimal);
insert into t2(a1,a2) select c2,c4 from t1 where c1 is null;
select * from t2;
a1	a2
0	10
##时间类型
##time
drop table if exists  t1;
drop table if exists  t2;
create table t1 (c1 float(7,3),c2 float(8,2),c3 float(10,5),c4 float(255,30));
insert into t1 values(-1023.909,11.591,2.222,-12.123),(123.5,11.5995,556.02,22.45),(-123.5,11.5995,556.1102,22.999909),(null,0,1.234567894562,10.0000000000002);
create table t2 (a1 time,a2 time);
insert into t2(a1,a2) select c2,c4 from t1 where c1 is null;
select * from t2;
a1	a2
00:00:00	00:00:10
##date
drop table if exists  t1;
drop table if exists  t2;
create table t1 (c1 float(7,3),c2 float(8,2),c3 float(10,5),c4 float(255,30));
insert into t1 values(-1023.909,11.591,2.222,-12.123),(123.5,11.5995,556.02,22.45),(-123.5,11.5995,556.1102,22.999909),(null,0,1.234567894562,10.0000000000002);
create table t2 (a1 date,a2 date);
insert into t2(a1,a2) select c2,c4 from t1 where c1 is not null;
ERROR 22007: Incorrect datetime value for column 'a1' at row 1
##datetime
drop table if exists  t1;
drop table if exists  t2;
create table t1 (c1 float(7,3),c2 float(8,2),c3 float(10,5),c4 float(255,30));
insert into t1 values(-1023.909,11.591,2.222,-12.123),(123.5,11.5995,556.02,22.45),(-123.5,11.5995,556.1102,22.999909),(null,0,1.234567894562,10.0000000000002);
create table t2 (a1 datetime,a2 datetime);
insert into t2(a1,a2) select c2,c4 from t1 where c1 is null;
ERROR 22007: Incorrect datetime value for column 'a2' at row 1
##year
drop table if exists  t1;
drop table if exists  t2;
create table t1 (c1 float(7,3),c2 float(8,2),c3 float(10,5),c4 float(255,30));
insert into t1 values(-1023.909,11.591,2.222,-12.123),(123.5,11.5995,556.02,22.45),(-123.5,11.5995,556.1102,22.999909),(null,0,1.234567894562,10.0000000000002);
create table t2 (a1 year,a2 year);
insert into t2(a1,a2) select c2,c4 from t1 where c1 is null;
ERROR 22000: Invalid data type for the operation
select * from t2;
a1	a2
##大对象类型
##text/blob
drop table if exists  t1;
drop table if exists  t2;
create table t1 (c1 float(7,3),c2 float(8,2),c3 float(10,5),c4 float(255,30));
insert into t1 values(-1023.909,11.591,2.222,-12.123),(123.5,11.5995,556.02,22.45),(-123.5,11.5995,556.1102,22.999909),(null,0,1.234567894562,10.0000000000002);
create table t2 (a1 tinytext,a2 tinyblob);
insert into t2(a1,a2) select c2,c4 from t1 where c1 is null;
select * from t2;
a1	a2
0.00	10.000000000000000000000000000000
##value函数
drop table if exists  t1;
drop table if exists  t2;
create table t1 (c1 float(7,3),c2 float(8,2),c3 float(10,5),c4 float(255,30));
insert into t1 values(ROUND(-1023.909),ROUND(11.591),ROUND(2.222),ROUND(-12.123));
select * from t1 where c1=-1024;
c1	c2	c3	c4
-1024.000	12.00	2.00000	-12.000000000000000000000000000000
drop table if exists  t1;
create table t1 (c1 float(7,3),c2 float(8,2),c3 float(10,5),c4 float(255,30));
insert into t1 values(CEIL(-1023.909),CEIL(11.591),CEIL(2.222),CEIL(-12.123));
select * from t1 where c1=-1023;
c1	c2	c3	c4
-1023.000	12.00	3.00000	-12.000000000000000000000000000000
drop table if exists  t1;
create table t1 (c1 float(7,3),c2 float(8,2),c3 float(10,5),c4 float(255,30));
insert into t1 values(FLOOR(-1023.909),FLOOR(11.591),FLOOR(2.222),FLOOR(-12.123));
select * from t1 where c1=-1024;
c1	c2	c3	c4
-1024.000	11.00	2.00000	-13.000000000000000000000000000000
drop table if exists  t1;
create table t1 (c1 float(7,3),c2 float(8,2),c3 float(10,5),c4 float(255,30));
insert into t1 values(ABS(-1023.909),ABS(11.591),ABS(2.222),ABS(-12.123));
select * from t1 where c1=-1024;
c1	c2	c3	c4
drop table if exists  t1;
create table t1 (c1 float(7,3),c2 float(8,2),c3 float(10,5),c4 float(255,30));
insert into t1 values(NEG(-1023.909),NEG(11.591),NEG(2.222),NEG(-12.123));
select * from t1;
c1	c2	c3	c4
1023.909	-11.59	-2.22200	12.123000144958496000000000000000
drop table if exists  t1;
create table t1 (c1 float(7,3),c2 float(8,2),c3 float(10,5),c4 float(255,30));
insert into t1 values(SIGN(-1023.909),SIGN(11.591),SIGN(2.222),SIGN(-12.123));
select * from t1;
c1	c2	c3	c4
-1.000	1.00	1.00000	-1.000000000000000000000000000000
drop table if exists  t1;
create table t1 (c1 float(7,3),c2 float(8,2),c3 float(10,5),c4 float(255,30));
insert into t1 values(RAND(-1023.909),RAND(11.591),RAND(2.222),RAND(-12.123));
select * from t1;
c1	c2	c3	c4
0.968	0.16	0.65559	0.153023123741149900000000000000
##运算符
drop table if exists  t1;
create table t1 (c1 float(7,3),c2 float(8,2),c3 float(10,5),c4 float(255,30));
insert into t1 values(-1023.909+12.012,11.591+4.1225,2.2228+2.131,-12.123+123);
insert into t1 values(-1023.909-12.012,11.591-4.1225,2.2228-2.131,-12.123-123);
insert into t1 values(-10.9*12.02,11.51*4.125,2.228*2.11,-1.13*123);
insert into t1 values(-1023.909/12.012,11.591/4.1225,2.2228/2.131,-12.123/123);
insert into t1 values(-1023.909 DIV 12.012,11.591 DIV 4.1225,2.2228 DIV 2.131,-12.123 DIV 123);
insert into t1 values(-1023.909 MOD 12.012,11.591 MOD 4.1225,2.2228 MOD 2.131,-12.123 MOD 123);
insert into t1 values(-1023.909 % 12.012,11.591 % 4.1225,2.2228 % 2.131,-12.123 % 123);
select sum(c1) from t1;
sum(c1)
-2354.855
select avg(c1) from t1;
avg(c1)
-336.4078565
select min(c1) from t1;
min(c1)
-1035.921
select max(c1) from t1;
max(c1)
-2.889
select count(c1) from t1;
count(c1)
7
##插入多个字段值
drop table if exists  t1;
create table t1 (c1 float(7,3),c2 int,c3 varchar(20),c4 char(20));
insert into t1 values(-1023.909,11.591,2.222,-12.123),(123.5,11.5995,556.02,22.45),(-123.5,11.5995,556.1102,22.999909),(null,0,1.234567894562,10.0000000000002);
select * from t1;
c1	c2	c3	c4
-1023.909	12	2.222	-12.123
-123.500	12	556.1102	22.999909
123.500	12	556.02	22.45
NULL	0	1.234567894562	10.0000000000002
##update操作
##更新不同的数据类型
drop table if exists  t1;
CREATE TABLE t1(c1 float(10,3), c2 smallint);
insert into t1 values(127,32767);
update t1 set c1=c2 ;
select c1 from t1;
c1
32767.000
drop table if exists  t1;
CREATE TABLE t1(c1 float(10,3), c2 mediumint);
insert into t1 values(127,8388607);
update t1 set c1=c2 ;
select c1 from t1;
c1
8388607.000
drop table if exists  t1;
CREATE TABLE t1(c1 float(10,3), c2 int);
insert into t1 values(127,102555.2001);
update t1 set c1=c2 ;
select c1 from t1;
c1
102555.000
drop table if exists  t1;
CREATE TABLE t1(c1 float(10,3), c2 bigint);
insert into t1 values(127,12278.9541);
update t1 set c1=c2 ;
select c1 from t1;
c1
12279.000
drop table if exists  t1;
CREATE TABLE t1(c1 float(10,3), c2 tinyint);
insert into t1 values(127,1.1111);
update t1 set c1=c2 ;
select c1 from t1;
c1
1.000
drop table if exists  t1;
CREATE TABLE t1(c1 float(10,3), c2 double);
insert into t1 values(127,123.1231123);
update t1 set c1=c2 ;
select c1 from t1;
c1
123.123
drop table if exists  t1;
CREATE TABLE t1(c1 float(10,3), c2 DECIMAL(5,2));
insert into t1 values(127,1.1);
update t1 set c1=c2 ;
select c1 from t1;
c1
1.100
drop table if exists  t1;
CREATE TABLE t1(c1 float(10,3), c2 CHAR(10));
insert into t1 values(127,'236568.014');
update t1 set c1=c2 ;
select c1 from t1;
c1
236568.016
drop table if exists  t1;
CREATE TABLE t1(c1 float(10,3), c2 VARCHAR(10));
insert into t1 values(127,'123546');
update t1 set c1=c2 ;
select c1 from t1;
c1
123546.000
drop table if exists  t1;
CREATE TABLE t1(c1 float(10,3), c2 BLOB(100));
insert into t1 values(127,'001103014');
update t1 set c1=c2 ;
select c1 from t1;
c1
1103014.000
drop table if exists  t1;
CREATE TABLE t1(c1 float(10,3), c2 bit (10));
insert into t1 values(127,'1');
update t1 set c1=c2 ;
select c1 from t1;
c1
49.000
##set列名=函数
drop table if exists  t1;
create table t1 (c1 float(7,3),c2 float(8,2),c3 float(10,5),c4 float(255,30));
insert into t1 values(-1023.909,11.591,2.222,-12.123),(123.5,11.5995,556.02,22.45),(-123.5,11.5995,556.1102,22.999909),(null,0,1.234567894562,10.0000000000002);
update t1 set c1=cast(1e3+5 as char(255)) where c1 is null ;
select c1 from t1 where c1=1005;
c1
1005.000
drop table if exists  t1;
create table t1 (c1 float(7,3),c2 float(8,2),c3 float(10,5),c4 float(255,30));
insert into t1 values(-1023.909,11.591,2.222,-12.123),(123.5,11.5995,556.02,22.45),(-123.5,11.5995,556.1102,22.999909),(null,0,1.234567894562,10.0000000000002);
update t1 set c1=round(11,20) where c1 is null ;
select c1 from t1 where c1=11;
c1
11.000
drop table if exists  t1;
create table t1 (c1 float(7,3),c2 float(8,2),c3 float(10,5),c4 float(255,30));
insert into t1 values(-1023.909,11.591,2.222,-12.123),(123.5,11.5995,556.02,22.45),(-123.5,11.5995,556.1102,22.999909),(null,0,1.234567894562,10.0000000000002);
update t1 set c1=ceil(11) where c1 is null ;
select c1 from t1 where c1=11;
c1
11.000
drop table if exists  t1;
create table t1 (c1 float(7,3),c2 float(8,2),c3 float(10,5),c4 float(255,30));
insert into t1 values(-1023.909,11.591,2.222,-12.123),(123.5,11.5995,556.02,22.45),(-123.5,11.5995,556.1102,22.999909),(null,0,1.234567894562,10.0000000000002);
update t1 set c1=abs(-11) where c1 is null ;
select c1 from t1 where c1=11;
c1
11.000
drop table if exists  t1;
create table t1 (c1 float(7,3),c2 float(8,2),c3 float(10,5),c4 float(255,30));
insert into t1 values(-1023.909,11.591,2.222,-12.123),(123.5,11.5995,556.02,22.45),(-123.5,11.5995,556.1102,22.999909),(null,0,1.234567894562,10.0000000000002);
update t1 set c1=mod(-11,0.0) where c1 is null ;
select c1 from t1 where c1 is not null;
c1
-1023.909
-123.500
123.500
drop table if exists  t1;
create table t1 (c1 float(7,3),c2 float(8,2),c3 float(10,5),c4 float(255,30));
insert into t1 values(-1023.909,11.591,2.222,-12.123),(123.5,11.5995,556.02,22.45),(-123.5,11.5995,556.1102,22.999909),(null,0,1.234567894562,10.0000000000002);
update t1 set c1=(case when c1 = -1023.909 or c1 is null then c1=999.9999 when c2 =0 then false else c4 end ) ;
select c1 from t1 where c1 is not null;
c1
0.000
22.450
23.000
drop table if exists  t1;
create table t1 (c1 float(7,3),c2 float(8,2),c3 float(10,5),c4 float(255,30));
insert into t1 values(-1023.909,11.591,2.222,-12.123),(123.5,11.5995,556.02,22.45),(-123.5,11.5995,556.1102,22.999909),(null,0,1.234567894562,10.0000000000002);
update t1 set c1=GREATEST(c1,c2,c2,c3) ;
select c1 from t1 where c1 is not null;
c1
11.590
556.020
556.110
##运算符
drop table if exists  t1;
create table t1 (c1 float(7,3),c2 float(8,2),c3 float(10,5),c4 float(255,30));
insert into t1 values(-1023.909,11.591,2.222,-12.123),(123.5,11.5995,556.02,22.45),(-123.5,11.5995,556.1102,22.999909),(null,0,1.234567894562,10.0000000000002);
update t1 set c1=c1+1.123;
select  c1 from t1;
c1
-1022.786
-122.377
124.623
NULL
drop table if exists  t1;
create table t1 (c1 float(7,3),c2 float(8,2),c3 float(10,5),c4 float(255,30));
insert into t1 values(-1023.909,11.591,2.222,-12.123),(123.5,11.5995,556.02,22.45),(-123.5,11.5995,556.1102,22.999909),(null,0,1.234567894562,10.0000000000002);
update t1 set c1=c1-1.123;
select  c1 from t1;
c1
-1025.032
-124.623
122.377
NULL
drop table if exists  t1;
create table t1 (c1 float(7,3),c2 float(8,2),c3 float(10,5),c4 float(255,30));
insert into t1 values(-1023.909,11.591,2.222,-12.123),(123.5,11.5995,556.02,22.45),(-123.5,11.5995,556.1102,22.999909),(null,0,1.234567894562,10.0000000000002);
update t1 set c1=c1*1.123;
select  c1 from t1;
c1
-1149.850
-138.690
138.690
NULL
drop table if exists  t1;
create table t1 (c1 float(7,3),c2 float(8,2),c3 float(10,5),c4 float(255,30));
insert into t1 values(-1023.909,11.591,2.222,-12.123),(123.5,11.5995,556.02,22.45),(-123.5,11.5995,556.1102,22.999909),(null,0,1.234567894562,10.0000000000002);
update t1 set c1=c1/3.3;
select  c1 from t1;
c1
-310.275
-37.424
37.424
NULL
drop table if exists  t1;
create table t1 (c1 float(7,3),c2 float(8,2),c3 float(10,5),c4 float(255,30));
insert into t1 values(-1023.909,11.591,2.222,-12.123),(123.5,11.5995,556.02,22.45),(-123.5,11.5995,556.1102,22.999909),(null,0,1.234567894562,10.0000000000002);
update t1 set c1=c1 DIV 3.3;
select  c1 from t1;
c1
-310.000
-37.000
37.000
NULL
drop table if exists  t1;
create table t1 (c1 float(7,3),c2 float(8,2),c3 float(10,5),c4 float(255,30));
insert into t1 values(-1023.909,11.591,2.222,-12.123),(123.5,11.5995,556.02,22.45),(-123.5,11.5995,556.1102,22.999909),(null,0,1.234567894562,10.0000000000002);
update t1 set c1=c1 MOD 3.3;
select  c1 from t1;
c1
-0.909
-1.400
1.400
NULL
drop table if exists  t1;
create table t1 (c1 float(7,3),c2 float(8,2),c3 float(10,5),c4 float(255,30));
insert into t1 values(-1023.909,11.591,2.222,-12.123),(123.5,11.5995,556.02,22.45),(-123.5,11.5995,556.1102,22.999909),(null,0,1.234567894562,10.0000000000002);
update t1 set c1=c1 % 3.3;
select  c1 from t1;
c1
-0.909
-1.400
1.400
NULL
##更新多个字段值
drop table if exists  t1;
create table t1 (c1 float(7,3),c2 float(8,2),c3 float(10,5),c4 float(255,30));
insert into t1 values(-1023.909,11.591,2.222,-12.123),(123.5,11.5995,556.02,22.45),(-123.5,11.5995,556.1102,22.999909),(null,0,1.234567894562,10.0000000000002);
update t1 set c1=c1+1.123,c2=c2+1.123;
select  c1,c2 from t1;
c1	c2
-1022.786	12.71
-122.377	12.72
124.623	12.72
NULL	1.12
drop table if exists  t1;
create table t1 (c1 float(7,3),c2 float(8,2),c3 float(10,5),c4 float(255,30));
insert into t1 values(-1023.909,11.591,2.222,-12.123),(123.5,11.5995,556.02,22.45),(-123.5,11.5995,556.1102,22.999909),(null,0,1.234567894562,10.0000000000002);
update t1 set c1=c1-1.123,c2=c2-1.123;
select  c1,c2 from t1;
c1	c2
-1025.032	10.47
-124.623	10.48
122.377	10.48
NULL	-1.12
drop table if exists  t1;
create table t1 (c1 float(7,3),c2 float(8,2),c3 float(10,5),c4 float(255,30));
insert into t1 values(-1023.909,11.591,2.222,-12.123),(123.5,11.5995,556.02,22.45),(-123.5,11.5995,556.1102,22.999909),(null,0,1.234567894562,10.0000000000002);
update t1 set c1=c1*1.123,c2=c2*1.123;
select  c1,c2 from t1;
c1	c2
-1149.850	13.02
-138.690	13.03
138.690	13.03
NULL	0.00
drop table if exists  t1;
create table t1 (c1 float(7,3),c2 float(8,2),c3 float(10,5),c4 float(255,30));
insert into t1 values(-1023.909,11.591,2.222,-12.123),(123.5,11.5995,556.02,22.45),(-123.5,11.5995,556.1102,22.999909),(null,0,1.234567894562,10.0000000000002);
update t1 set c1=c1/1.123,c2=c2/1.123;
select  c1,c2 from t1;
c1	c2
-109.973	10.33
-911.762	10.32
109.973	10.33
NULL	0.00
drop table if exists  t1;
create table t1 (c1 float(7,3),c2 float(8,2),c3 float(10,5),c4 float(255,30));
insert into t1 values(-1023.909,11.591,2.222,-12.123),(123.5,11.5995,556.02,22.45),(-123.5,11.5995,556.1102,22.999909),(null,0,1.234567894562,10.0000000000002);
update t1 set c1=c1 DIV 3.3,c2=c2 DIV 1.123;
select  c1,c2 from t1;
c1	c2
-310.000	10.00
-37.000	10.00
37.000	10.00
NULL	0.00
drop table if exists  t1;
create table t1 (c1 float(7,3),c2 float(8,2),c3 float(10,5),c4 float(255,30));
insert into t1 values(-1023.909,11.591,2.222,-12.123),(123.5,11.5995,556.02,22.45),(-123.5,11.5995,556.1102,22.999909),(null,0,1.234567894562,10.0000000000002);
update t1 set c1=c1 MOD 3.3,c2=c2 MOD 1.123;
select  c1,c2 from t1;
c1	c2
-0.909	0.36
-1.400	0.37
1.400	0.37
NULL	0.00
drop table if exists  t1;
create table t1 (c1 float(7,3),c2 float(8,2),c3 float(10,5),c4 float(255,30));
insert into t1 values(-1023.909,11.591,2.222,-12.123),(123.5,11.5995,556.02,22.45),(-123.5,11.5995,556.1102,22.999909),(null,0,1.234567894562,10.0000000000002);
update t1 set c1=c1 % 3.3,c2=c2 % 1.123;
select  c1,c2 from t1;
c1	c2
-0.909	0.36
-1.400	0.37
1.400	0.37
NULL	0.00
##where子句
drop table if exists  t1;
create table t1 (c1 float(7,3),c2 float(8,2),c3 float(10,5),c4 float(255,30));
insert into t1 values(-1023.909,11.591,2.222,-12.123),(123.5,11.5995,556.02,22.45),(-123.5,11.5995,556.1102,22.999909),(null,0,1.234567894562,10.0000000000002);
update t1 set c1=c1 + 1.123,c2=c3 / 3 where c2 = 0;
update t1 set c1=c1 - 1.123,c2=c2 / 3 where c2 > 0;
update t1 set c1=c1 * 1.123,c2=c2 / 3 where c1 < 0;
update t1 set c1=c1 mod 1.123,c2=c2 / 3 where c2 >= 0.14;
update t1 set c1=c1 div 1.123,c2=c2 / 3 where c2 <> 0;
update t1 set c1=c1 % 1.123,c2=c2 / 3 where c4 <= 0;
select * from t1;
c1	c2	c3	c4
0.000	0.05	2.22200	-12.123000144958496000000000000000
0.000	0.14	556.11023	22.999908447265625000000000000000
0.000	0.43	556.02002	22.450000762939453000000000000000
NULL	0.02	1.23457	10.000000000000000000000000000000
drop table if exists  t1;
create table t1 (c1 float(7,3),c2 float(8,2),c3 float(10,5),c4 float(255,30));
insert into t1 values(-1023.909,11.591,2.222,-12.123),(123.5,11.5995,556.02,22.45),(-123.5,11.5995,556.1102,22.999909),(null,0,1.234567894562,10.0000000000002);
update t1 set c1=9.99 where c2=11.6 and c3> 500 and c1 is not null;
update t1 set c1=9.99 where c2=11.6 and c3> 500 or c1 is not null;
select * from t1;
c1	c2	c3	c4
9.990	11.59	2.22200	-12.123000144958496000000000000000
9.990	11.60	556.02002	22.450000762939453000000000000000
9.990	11.60	556.11023	22.999908447265625000000000000000
NULL	0.00	1.23457	10.000000000000000000000000000000
drop table if exists  t1;
create table t1 (c1 float(7,3),c2 float(8,2),c3 float(10,5),c4 float(255,30));
insert into t1 values(-1023.909,11.591,2.222,-12.123),(123.5,11.5995,556.02,22.45),(-123.5,11.5995,556.1102,22.999909),(null,0,1.234567894562,10.0000000000002);
update t1 set c1=9.99 where c2 between 11.59 and 11.6;
select * from t1;
c1	c2	c3	c4
9.990	11.59	2.22200	-12.123000144958496000000000000000
9.990	11.60	556.02002	22.450000762939453000000000000000
9.990	11.60	556.11023	22.999908447265625000000000000000
NULL	0.00	1.23457	10.000000000000000000000000000000
drop table if exists  t1;
create table t1 (c1 float(7,3),c2 float(8,2),c3 float(10,5),c4 float(255,30));
insert into t1 values(-1023.909,11.591,2.222,-12.123),(123.5,11.5995,556.02,22.45),(-123.5,11.5995,556.1102,22.999909),(null,0,1.234567894562,10.0000000000002);
update t1 set c1=9.99 where c2 like '%1%' and c1 like '%5%';
update t1 set c1=9.999 where c2 like '%1%' and c1 not like '%5%';
select * from t1;
c1	c2	c3	c4
9.999	11.59	2.22200	-12.123000144958496000000000000000
9.999	11.60	556.02002	22.450000762939453000000000000000
9.999	11.60	556.11023	22.999908447265625000000000000000
NULL	0.00	1.23457	10.000000000000000000000000000000
drop table if exists  t1;
drop table if exists  t2;
Warnings:
Note	1051	Unknown table 'db1.t2'
create table t1 (c1 float(7,3),c2 float(8,2),c3 float(10,5),c4 float(255,30));
insert into t1 values(-1023.909,11.591,2.222,-12.123),(123.5,11.5995,556.02,22.45),(-123.5,11.5995,556.1102,22.999909),(null,0,1.234567894562,10.0000000000002);
create table t2 (a1 float(7,3),a2 float(8,2));
insert into t2 values(-1023.908,11.591),(123.5,11.5995),(-123.5,11.5995);
update t1 set c1=9.99 where exists(select a2 from t2) limit 1;
update t1 set c1=8.999 where -1023.909 < any (select a1 from t2) limit 1;
update t1 set c1=7.99 where -1023.909 < all(select a1 from t2) limit 1;
update t1 set c1=6.99 where -1023.908 in (select a1 from t2) ;
select * from t1;
c1	c2	c3	c4
6.990	0.00	1.23457	10.000000000000000000000000000000
6.990	11.59	2.22200	-12.123000144958496000000000000000
6.990	11.60	556.02002	22.450000762939453000000000000000
6.990	11.60	556.11023	22.999908447265625000000000000000
##create
##虚拟列
drop table if exists  t1;
create table t1 (c1 float(7,3),c2 float(8,2),c3 float(10,5),c4 float(255,30) as (sqrt(c1*c2+c2*c3)) virtual );
insert into t1(c1,c2,c3) values(-1023.909,11.591,2.222),(123.5,11.5995,556.02),(-123.5,11.5995,556.1102),(null,0,1.234567894562);
select c4 from t1 where c4 is not null;
c4
70.839813232421880000000000000000
88.783065795898440000000000000000
drop table if exists  t1;
create table t1 (c1 float(7,3),c2 float(8,2),c3 float(10,5),c4 float(255,30) as (sqrt(c1*c2+c2*c3)) stored );
insert into t1(c1,c2,c3) values(-1023.909,11.591,2.222),(123.5,11.5995,556.02),(-123.5,11.5995,556.1102),(null,0,1.234567894562);
select c4 from t1 where c4 is not null;
c4
70.839813232421880000000000000000
88.783065795898440000000000000000
##添加生成列
drop table if exists  t1;
CREATE TABLE t1 (c1 float(255,30));
ALTER TABLE t1 ADD COLUMN c2 float(255,30) GENERATED ALWAYS AS (c1 + 0.875) STORED;
insert into t1(c1) values(0.332);
select * from t1;
c1	c2
0.331999987363815300000000000000	1.207000017166137700000000000000
##alter字段长度
drop table if exists  t1;
create table t1 (c1 float(7,3),c2 float(8,2),c3 float(10,5),c4 float(255,30));
insert into t1 values(-1023.909,11.591,2.222,-12.123),(123.5,11.5995,556.02,22.45),(-123.5,11.5995,556.1102,22.999909),(null,0,1.234567894562,10.0000000000002);
alter table t1 modify column c1 float(99,20);
alter table t1 modify column c2 float(10,0);
alter table t1 modify column c3 float(255,30);
alter table t1 modify column c4 float(10,3);
select * from t1 where c4=10;
c1	c2	c3	c4
NULL	0	1.234570026397705000000000000000	10.000
##分区表
##range分区
drop table if exists  t1;
drop table if exists  t2;
drop table if exists  t3;
Warnings:
Note	1051	Unknown table 'db1.t3'
drop table if exists  t4;
Warnings:
Note	1051	Unknown table 'db1.t4'
drop table if exists  t5;
Warnings:
Note	1051	Unknown table 'db1.t5'
drop table if exists  t6;
Warnings:
Note	1051	Unknown table 'db1.t6'
create table t1 (c1 int primary key, c2 float(30,3)) partition by range(c1) (
PARTITION p0 VALUES LESS THAN (2),
PARTITION p1 VALUES LESS THAN (4),
PARTITION p2 VALUES LESS THAN (6)
);
insert into t1 values(1,15.2302);
insert into t1 values(4,16.69845);
insert into t1 values(3,12.25);
insert into t1 values(5,1.2025);
create table t2 as select c2,count(c2) from t1 ;
select * from t2;
c2	count(c2)
15.230	4
desc t2;
Field	Type	Null	Key	Default	Extra
c2	float(30,3)	YES		NULL	
count(c2)	bigint(20)	NO		NULL	
create table t3 as select c2,sum(c2) from t1 ;
select * from t3;
c2	sum(c2)
15.230	45.380
desc t3;
Field	Type	Null	Key	Default	Extra
c2	float(30,3)	YES		NULL	
sum(c2)	double(20,3)	YES		NULL	
create table t4 as select c2,avg(c2) from t1 ;
select * from t4;
c2	avg(c2)
15.230	11.3449999
desc t4;
Field	Type	Null	Key	Default	Extra
c2	float(30,3)	YES		NULL	
avg(c2)	double(34,7)	YES		NULL	
create table t5 as select c2,min(c2) from t1 ;
select * from t5;
c2	min(c2)
15.230	1.202
desc t5;
Field	Type	Null	Key	Default	Extra
c2	float(30,3)	YES		NULL	
min(c2)	float(30,3)	YES		NULL	
create table t6 as select c2,max(c2) from t1 ;
select * from t6;
c2	max(c2)
15.230	16.698
desc t6;
Field	Type	Null	Key	Default	Extra
c2	float(30,3)	YES		NULL	
max(c2)	float(30,3)	YES		NULL	
##list分区
drop table if exists  t1;
drop table if exists  t2;
drop table if exists  t3;
drop table if exists  t4;
drop table if exists  t5;
drop table if exists  t6;
create table t1 (c1 int primary key, c2 float(15,4)) partition by list(c1) (
PARTITION p0 VALUES IN (1,2),
PARTITION p1 VALUES IN (3,4),
PARTITION p2 VALUES IN (5,6)
);
insert into t1 values(1,15.2302);
insert into t1 values(4,16.69845);
insert into t1 values(3,12.25);
insert into t1 values(5,1.2025);
create table t2 as select c2,count(c2) from t1 ;
select * from t2;
c2	count(c2)
15.2302	4
desc t2;
Field	Type	Null	Key	Default	Extra
c2	float(15,4)	YES		NULL	
count(c2)	bigint(20)	NO		NULL	
create table t3 as select c2,sum(c2) from t1 ;
select * from t3;
c2	sum(c2)
15.2302	45.3812
desc t3;
Field	Type	Null	Key	Default	Extra
c2	float(15,4)	YES		NULL	
sum(c2)	double(21,4)	YES		NULL	
create table t4 as select c2,avg(c2) from t1 ;
select * from t4;
c2	avg(c2)
15.2302	11.34529987
desc t4;
Field	Type	Null	Key	Default	Extra
c2	float(15,4)	YES		NULL	
avg(c2)	double(19,8)	YES		NULL	
create table t5 as select c2,min(c2) from t1 ;
select * from t5;
c2	min(c2)
15.2302	1.2025
desc t5;
Field	Type	Null	Key	Default	Extra
c2	float(15,4)	YES		NULL	
min(c2)	float(15,4)	YES		NULL	
create table t6 as select c2,max(c2) from t1 ;
select * from t6;
c2	max(c2)
15.2302	16.6985
desc t6;
Field	Type	Null	Key	Default	Extra
c2	float(15,4)	YES		NULL	
max(c2)	float(15,4)	YES		NULL	
##hash分区
drop table if exists  t1;
drop table if exists  t2;
drop table if exists  t3;
drop table if exists  t4;
drop table if exists  t5;
drop table if exists  t6;
create table t1 (c1 int primary key, c2 float(10,3)) partition by hash(c1) partitions 3;
insert into t1 values(1,15.2302);
insert into t1 values(4,16.69845);
insert into t1 values(3,12.25);
insert into t1 values(5,1.2025);
create table t2 as select c2,count(c2) from t1 ;
select * from t2;
c2	count(c2)
12.250	4
desc t2;
Field	Type	Null	Key	Default	Extra
c2	float(10,3)	YES		NULL	
count(c2)	bigint(20)	NO		NULL	
create table t3 as select c2,sum(c2) from t1 ;
select * from t3;
c2	sum(c2)
12.250	45.380
desc t3;
Field	Type	Null	Key	Default	Extra
c2	float(10,3)	YES		NULL	
sum(c2)	double(20,3)	YES		NULL	
create table t4 as select c2,avg(c2) from t1 ;
select * from t4;
c2	avg(c2)
12.250	11.3449999
desc t4;
Field	Type	Null	Key	Default	Extra
c2	float(10,3)	YES		NULL	
avg(c2)	double(14,7)	YES		NULL	
create table t5 as select c2,min(c2) from t1 ;
select * from t5;
c2	min(c2)
12.250	1.202
desc t5;
Field	Type	Null	Key	Default	Extra
c2	float(10,3)	YES		NULL	
min(c2)	float(10,3)	YES		NULL	
create table t6 as select c2,max(c2) from t1 ;
select * from t6;
c2	max(c2)
12.250	16.698
desc t6;
Field	Type	Null	Key	Default	Extra
c2	float(10,3)	YES		NULL	
max(c2)	float(10,3)	YES		NULL	
##key分区
drop table if exists  t1;
drop table if exists  t2;
drop table if exists  t3;
drop table if exists  t4;
drop table if exists  t5;
drop table if exists  t6;
create table t1 (c1 int primary key, c2 float(7,3)) partition by key(c1) partitions 3;
insert into t1 values(1,15.2302);
insert into t1 values(4,16.69845);
insert into t1 values(3,12.25);
insert into t1 values(5,1.2025);
create table t2 as select c2,count(c2) from t1 ;
select * from t2;
c2	count(c2)
16.698	4
desc t2;
Field	Type	Null	Key	Default	Extra
c2	float(7,3)	YES		NULL	
count(c2)	bigint(20)	NO		NULL	
create table t3 as select c2,sum(c2) from t1 ;
select * from t3;
c2	sum(c2)
16.698	45.380
desc t3;
Field	Type	Null	Key	Default	Extra
c2	float(7,3)	YES		NULL	
sum(c2)	double(20,3)	YES		NULL	
create table t4 as select c2,avg(c2) from t1 ;
select * from t4;
c2	avg(c2)
16.698	11.3449999
desc t4;
Field	Type	Null	Key	Default	Extra
c2	float(7,3)	YES		NULL	
avg(c2)	double(11,7)	YES		NULL	
create table t5 as select c2,min(c2) from t1 ;
select * from t5;
c2	min(c2)
16.698	1.202
desc t5;
Field	Type	Null	Key	Default	Extra
c2	float(7,3)	YES		NULL	
min(c2)	float(7,3)	YES		NULL	
create table t6 as select c2,max(c2) from t1 ;
select * from t6;
c2	max(c2)
16.698	16.698
desc t6;
Field	Type	Null	Key	Default	Extra
c2	float(7,3)	YES		NULL	
max(c2)	float(7,3)	YES		NULL	
##view
##select 
drop table if exists  t1;
drop table if exists  t2;
drop table if exists  t3;
drop table if exists  t4;
drop table if exists  t5;
drop table if exists  t6;
drop view if exists  v1;
Warnings:
Note	1051	Unknown table 'db1.v1'
create table t1 (c1 float(7,2),c2 float(8,3),c3 float(10,5),c4 float(255,30));
insert into t1 values(-1023.909,11.591,2.222,-12.123),(123.5,11.5995,556.02,22.45),(-123.5,11.5995,556.1102,22.999909),(null,0,1.234567894562,10.0000000000002);
create view v1 as select * from t1;
create table t2 as select * from t1;
select * from v1;
c1	c2	c3	c4
-1023.91	11.591	2.22200	-12.123000144958496000000000000000
-123.50	11.600	556.11023	22.999908447265625000000000000000
123.50	11.600	556.02002	22.450000762939453000000000000000
NULL	0.000	1.23457	10.000000000000000000000000000000
select * from t2;
c1	c2	c3	c4
-1023.91	11.591	2.22200	-12.123000144958496000000000000000
-123.50	11.600	556.11023	22.999908447265625000000000000000
123.50	11.600	556.02002	22.450000762939453000000000000000
NULL	0.000	1.23457	10.000000000000000000000000000000
select distinct c2 from v1 where c2>=11.599;
c2
11.600
select c1 from v1 where c1='-1023.91';
c1
select c1 from v1 where c1>123.5;
c1
select c1 from v1 where c1<-123.5;
c1
-1023.91
select c1 from v1 where c1<=-123.5;
c1
-1023.91
-123.50
select c1 from v1 where c1>=-123.5;
c1
-123.50
123.50
select c1 from v1 where c1 between  -1023.91 and 123.5;
c1
-1023.91
-123.50
123.50
select c1 from v1 where c2 between 11.59 and 11.60;
c1
-1023.91
-123.50
123.50
##insert
insert into v1 values(-1023.909,1.591,2.222,-12.123),(13.5,11.5995,556.02,22.45),(-12.5,11.5995,556.1102,22.999909),(null,0,1.234567894562,10.000000000002);
##update
update v1 set c1=cast(1e3+5 as char(255)) where c1 is null ;
##create
drop table if exists  t1;
drop table if exists  t2;
drop view if exists  v1;
create table t1 (c1 float(7,2),c2 float(8,3),c3 float(10,5),c4 float(255,30));
insert into t1 values(-1023.909,11.591,2.222,-12.123),(123.5,11.5995,556.02,22.45),(-123.5,11.5995,556.1102,22.999909),(null,0,1.234567894562,10.0000000000002);
create view v1 as select * from t1;
create table t2 as select min(c1) from v1;
desc t2;
Field	Type	Null	Key	Default	Extra
min(c1)	float(7,2)	YES		NULL	
create table t3 as select max(c1) from v1;
desc t3;
Field	Type	Null	Key	Default	Extra
max(c1)	float(7,2)	YES		NULL	
##约束
##主键约束
drop table if exists  t1;
drop table if exists  t2;
create table t1 (c1 float(7,2),c2 float(8,3),c3 float(10,5),c4 float(255,30));
alter table t1 add primary key(c1);
desc t1;
Field	Type	Null	Key	Default	Extra
c1	float(7,2)	NO	PRI	NULL	
c2	float(8,3)	YES		NULL	
c3	float(10,5)	YES		NULL	
c4	float(255,30)	YES		NULL	
insert into t1 values(-1023.909,11.591,2.222,-12.123),(223.50,11.5995,556.02,22.45),(223.519,11.5995,556.1102,22.999909),(224.123,0,1.234567894562,10.0000000000002);
select * from t1;
c1	c2	c3	c4
-1023.91	11.591	2.22200	-12.123000144958496000000000000000
223.50	11.600	556.02002	22.450000762939453000000000000000
223.52	11.600	556.11023	22.999908447265625000000000000000
224.12	0.000	1.23457	10.000000000000000000000000000000
create table t2 as select avg(c1) a from t1;
desc t2;
Field	Type	Null	Key	Default	Extra
a	double(11,6)	YES		NULL	
select * from t2;
a
-88.192493
##外键约束
drop table if exists  t1 ;
drop table if exists  t2 ;
drop table if exists  t3 ;
create table t1 (c1 float(54,30) primary key);
create table t2 (a1 float(54,30));
ALTER TABLE t2 ADD CONSTRAINT fk foreign key(a1) references t1(c1);
desc t1;
Field	Type	Null	Key	Default	Extra
c1	float(54,30)	NO	PRI	NULL	
create table t3 as select avg(c1) a from t1;
desc t3;
Field	Type	Null	Key	Default	Extra
a	double	YES		NULL	
##unique
drop table if exists  t2;
drop table if exists  t1;
drop table if exists  t3;
create table t1 (c1 float(7,2),c2 float(8,3),c3 float(10,5),c4 float(255,30));
alter table t1 add unique(c1);
desc t1;
Field	Type	Null	Key	Default	Extra
c1	float(7,2)	YES	UNI	NULL	
c2	float(8,3)	YES		NULL	
c3	float(10,5)	YES		NULL	
c4	float(255,30)	YES		NULL	
##not null
drop table if exists  t1;
create table t1 (c1 float(7,2),c2 float(8,3),c3 float(10,5),c4 float(255,30));
alter table t1 MODIFY c1 float(54,30) not null;
desc t1;
Field	Type	Null	Key	Default	Extra
c1	float(54,30)	NO		NULL	
c2	float(8,3)	YES		NULL	
c3	float(10,5)	YES		NULL	
c4	float(255,30)	YES		NULL	
##CHECK
drop table if exists  t1;
create table t1 (c1 float(7,2),c2 float(8,3),c3 float(10,5),c4 float(255,30));
ALTER TABLE t1 ADD CONSTRAINT check_c1 CHECK(c1>-1023.911);
insert into t1 values(-1023.909,11.591,2.222,-12.123),(123.5,11.5995,556.02,22.45),(-123.5,11.5995,556.1102,22.999909),(null,0,1.234567894562,10.0000000000002);
desc t1;
Field	Type	Null	Key	Default	Extra
c1	float(7,2)	YES		NULL	
c2	float(8,3)	YES		NULL	
c3	float(10,5)	YES		NULL	
c4	float(255,30)	YES		NULL	
##default
drop table if exists  t1;
create table t1 (c1 float(7,2),c2 float(8,3),c3 float(10,5),c4 float(255,30));
##此处bug bug地址:
alter table t1 modify column c1 float(8,7) default 29.8;
ERROR 42000: Invalid default value for 'c1'
desc t1;
Field	Type	Null	Key	Default	Extra
c1	float(7,2)	YES		NULL	
c2	float(8,3)	YES		NULL	
c3	float(10,5)	YES		NULL	
c4	float(255,30)	YES		NULL	
##索引
#普通索引
drop table if exists  t1;
drop table if exists  t2;
Warnings:
Note	1051	Unknown table 'db1.t2'
create table t1 (c1 float(7,2),c2 float(8,3),c3 float(10,5),c4 float(255,30));
alter table t1 add index c1_index(c1);
desc t1;
Field	Type	Null	Key	Default	Extra
c1	float(7,2)	YES	MUL	NULL	
c2	float(8,3)	YES		NULL	
c3	float(10,5)	YES		NULL	
c4	float(255,30)	YES		NULL	
create table t2 as select max(c1) a from t1;
desc t2;
Field	Type	Null	Key	Default	Extra
a	float(7,2)	YES		NULL	
#主键索引
drop table if exists  t1;
drop table if exists  t2;
create table t1 (c1 float(7,2),c2 float(8,3),c3 float(10,5),c4 float(255,30));
insert into t1 values(-1023.909,11.591,2.222,-12.123),(223.50,11.5995,556.02,22.45),(223.519,11.5995,556.1102,22.999909),(224.123,0,1.234567894562,10.0000000000002);
alter table t1 add primary key(c1);
desc t1;
Field	Type	Null	Key	Default	Extra
c1	float(7,2)	NO	PRI	NULL	
c2	float(8,3)	YES		NULL	
c3	float(10,5)	YES		NULL	
c4	float(255,30)	YES		NULL	
create table t2 as select max(c1) a from t1;
desc t2;
Field	Type	Null	Key	Default	Extra
a	float(7,2)	YES		NULL	
#唯一索引
drop table if exists  t1;
drop table if exists  t2;
create table t1 (c1 float(7,2),c2 float(8,3),c3 float(10,5),c4 float(255,30));
insert into t1 values(-1023.909,11.591,2.222,-12.123),(123.5,11.5995,556.02,22.45),(-123.5,11.5995,556.1102,22.999909),(null,0,1.234567894562,10.0000000000002);
alter table t1 add unique index (c1);
desc t1;
Field	Type	Null	Key	Default	Extra
c1	float(7,2)	YES	UNI	NULL	
c2	float(8,3)	YES		NULL	
c3	float(10,5)	YES		NULL	
c4	float(255,30)	YES		NULL	
create table t2 as select max(c1) a from t1;
desc t2;
Field	Type	Null	Key	Default	Extra
a	float(7,2)	YES		NULL	
#组合索引
drop table if exists  t1;
drop table if exists  t2;
create table t1 (c1 float(7,2),c2 float(8,3),c3 float(10,5),c4 float(255,30));
create index index_c1 on t1(c1,c2);
desc t1;
Field	Type	Null	Key	Default	Extra
c1	float(7,2)	YES	MUL	NULL	
c2	float(8,3)	YES		NULL	
c3	float(10,5)	YES		NULL	
c4	float(255,30)	YES		NULL	
create table t2 as select max(c1) a from t1;
desc t2;
Field	Type	Null	Key	Default	Extra
a	float(7,2)	YES		NULL	
########清空回收站，删除测试数据库，表等 ##########
drop database  IF EXISTS db1;
