purge recyclebin;
DROP TABLE IF EXISTS t2;
DROP TABLE IF EXISTS t1;
#mysql_add-6
#PROCEDURE
CREATE TABLE t1(c0 INT(5),
c1 FLOAT ,
c2 DOUBLE NOT NULL,
c3 CHAR(10) DEFAULT 'A',
c4 VARCHAR(10),
c5 CHAR(10),
c6 INT,
c7 TIME,
c8 YEAR);
INSERT INTO t1 VALUES(1,1.0,1.1,'中文','','',0,'11:11:11','2000'),
(2,1.1,1.2,'中!文','A','a',1,'11:11:11','2001'),
(3,1.2,2.2,'中!文','B','a',2,'11:11:11','2002'),
(4,1.3,3.2,'中!文','C','a',3,'11:11:11','2003'),
(5,1.4,4.2,'中!文','D','a',4,'11:11:11','2004'),
(6,1.5,5.2,'中!文','E','a',5,'11:11:11','2005'),
(7,1.6,6.2,'中!文','F','a',6,'11:11:11','2006'),
(8,1.7,7.2,'中!文','G','a',7,'11:11:11','2007'),
(9,1.8,8.2,'中!文','H','a',8,'11:11:11','2011'),
(10,1.9,9.2,'中!文','I','a',9,'11:11:11','2012'),
(11,2.0,1.9,'中!文','J','a',10,'11:11:11','2011'),
(12,2.1,1.8,'中!文','K','a',11,'11:11:11','2012');
CREATE TABLE t2(c0 INT(4),
c1 FLOAT,
c2 DOUBLE,
c3 CHAR(10),
c4 VARCHAR(5),
c5 INT,
c6 TIME);
INSERT INTO t2 VALUES(1,1.0,1.1,'中文','',0,'11:11:11'),
(2,1.1,1.2,'中!文','a',1,'11:11:11'),
(3,1.2,2.2,'中!文','a',2,'11:11:11'),
(4,1.3,3.2,'中!文','a',3,'11:11:11'),
(5,1.4,4.2,'中!文','a',4,'11:11:11');
#使用if...else创建存储过程
DROP PROCEDURE IF EXISTS pro1;
CREATE PROCEDURE pro1(IN v_c0 INT)
BEGIN
IF v_c0 > 10 AND v_c0 <= 15 THEN
INSERT INTO t1(c0,c1,c2,c4,c5,c6,c7,c8) VALUES(v_c0+10,v_c0,v_c0,CONCAT(c5,c6),'b',v_c0,'12:12:12',2020);
ELSEIF v_c0 >= 5 THEN
UPDATE t1 SET c1=0,c2=0,c3='中文',c4=NULL,c5=b,c6=100,c7='00:00:01',c8=2022 WHERE c0=v_c0;
ELSE
DELETE FROM t2 WHERE c5=v_c0;
END IF;
END;
//
#新增列
ALTER TABLE t2 ADD c7 INT(5) ZEROFILL AFTER c5;
CALL pro1(0);
SELECT * FROM t2 ORDER BY 1;
c0	c1	c2	c3	c4	c5	c7	c6
2	1.1	1.2	中!文	a	1	NULL	11:11:11
3	1.2	2.2	中!文	a	2	NULL	11:11:11
4	1.3	3.2	中!文	a	3	NULL	11:11:11
5	1.4	4.2	中!文	a	4	NULL	11:11:11
ALTER TABLE t1 ADD c9 VARCHAR(10) DEFAULT 'TEST';
CALL pro1(11);
SELECT * FROM t1 ORDER BY 1;
c0	c1	c2	c3	c4	c5	c6	c7	c8	c9
1	1	1.1	中文			0	11:11:11	2000	TEST
2	1.1	1.2	中!文	A	a	1	11:11:11	2001	TEST
3	1.2	2.2	中!文	B	a	2	11:11:11	2002	TEST
4	1.3	3.2	中!文	C	a	3	11:11:11	2003	TEST
5	1.4	4.2	中!文	D	a	4	11:11:11	2004	TEST
6	1.5	5.2	中!文	E	a	5	11:11:11	2005	TEST
7	1.6	6.2	中!文	F	a	6	11:11:11	2006	TEST
8	1.7	7.2	中!文	G	a	7	11:11:11	2007	TEST
9	1.8	8.2	中!文	H	a	8	11:11:11	2011	TEST
10	1.9	9.2	中!文	I	a	9	11:11:11	2012	TEST
11	2	1.9	中!文	J	a	10	11:11:11	2011	TEST
12	2.1	1.8	中!文	K	a	11	11:11:11	2012	TEST
21	11	11	A	NULL	b	11	12:12:12	2020	TEST
CALL pro1(6);
ERROR 42S22: Unknown column 'b' in 'field list'
ALTER TABLE t1 ADD c10 VARCHAR(10) NOT NULL;
CALL pro1(12);
ERROR HY000: Field 'c10' doesn't have a default value
DROP PROCEDURE IF EXISTS pro1;
#使用with...on语法创建的存储过程
DROP TABLE IF EXISTS t2;
DROP TABLE IF EXISTS t1;
CREATE TABLE t1(c0 INT(5),
c1 FLOAT ,
c2 DOUBLE NOT NULL,
c3 CHAR(10) DEFAULT 'A',
c4 VARCHAR(10),
c5 CHAR(10),
c6 INT,
c7 TIME,
c8 YEAR);
INSERT INTO t1 VALUES(1,1.0,1.1,'中文','','',0,'11:11:11','2000'),
(2,1.1,1.2,'中!文','A','a',1,'11:11:11','2001'),
(3,1.2,2.2,'中!文','B','a',2,'11:11:11','2002'),
(4,1.3,3.2,'中!文','C','a',3,'11:11:11','2003'),
(5,1.4,4.2,'中!文','D','a',4,'11:11:11','2004'),
(6,1.5,5.2,'中!文','E','a',5,'11:11:11','2005'),
(7,1.6,6.2,'中!文','F','a',6,'11:11:11','2006'),
(8,1.7,7.2,'中!文','G','a',7,'11:11:11','2007'),
(9,1.8,8.2,'中!文','H','a',8,'11:11:11','2011'),
(10,1.9,9.2,'中!文','I','a',9,'11:11:11','2012'),
(11,2.0,1.9,'中!文','J','a',10,'11:11:11','2011'),
(12,2.1,1.8,'中!文','K','a',11,'11:11:11','2012');
CREATE TABLE t2(c0 INT(4),
c1 FLOAT,
c2 DOUBLE,
c3 CHAR(10),
c4 VARCHAR(5),
c5 INT,
c6 TIME);
INSERT INTO t2 VALUES(1,1.0,1.1,'中文','',0,'11:11:11'),
(2,1.1,1.2,'中!文','a',1,'11:11:11'),
(3,1.2,2.2,'中!文','a',2,'11:11:11'),
(4,1.3,3.2,'中!文','a',3,'11:11:11'),
(5,1.4,4.2,'中!文','a',4,'11:11:11');
DROP PROCEDURE IF EXISTS pro2;
CREATE PROCEDURE pro2(IN v_c0 INT)
BEGIN
IF v_c0 <= 5 THEN
INSERT INTO t1
WITH
s1 AS (SELECT t2.* FROM t1 JOIN t2 ON t1.c0=t2.c0 WHERE t2.c1 IN (SELECT c1 FROM t1 WHERE c0 > v_c0)),
s2 AS (SELECT t1.* FROM t1 JOIN t2 ON t1.c0=t2.c0 WHERE t2.c1 IN(SELECT c1 FROM t1 WHERE c0 < v_c0))
SELECT s2.* FROM s1 ,s2 WHERE s2.c1 NOT IN(SELECT c1 FROM s1);
ELSEIF v_c0 <= 10 THEN
UPDATE t1 SET c0=c0+5 WHERE c1 IN (SELECT t2.c1 FROM t1 JOIN t2 ON t1.c0=t2.c0 WHERE t2.c1 NOT IN(SELECT c1 FROM t1 WHERE c0 >= v_c0));
ELSE
DELETE FROM t1 WHERE c0 <>ALL(SELECT t2.c0 FROM t1 JOIN t2 ON t1.c0=t2.c0 WHERE t2.c1 IN(SELECT c1 FROM t1 WHERE t1.c0 < v_c0));
END IF;
END;
//
#新增列
ALTER TABLE t1 ADD c9 INT, ADD c10 VARCHAR(10) NOT NULL;
CALL pro2(5);
SELECT * FROM t1 ORDER BY 1;
c0	c1	c2	c3	c4	c5	c6	c7	c8	c9	c10
1	1	1.1	中文			0	11:11:11	2000	NULL	
2	1.1	1.2	中!文	A	a	1	11:11:11	2001	NULL	
3	1.2	2.2	中!文	B	a	2	11:11:11	2002	NULL	
4	1.3	3.2	中!文	C	a	3	11:11:11	2003	NULL	
5	1.4	4.2	中!文	D	a	4	11:11:11	2004	NULL	
6	1.5	5.2	中!文	E	a	5	11:11:11	2005	NULL	
7	1.6	6.2	中!文	F	a	6	11:11:11	2006	NULL	
8	1.7	7.2	中!文	G	a	7	11:11:11	2007	NULL	
9	1.8	8.2	中!文	H	a	8	11:11:11	2011	NULL	
10	1.9	9.2	中!文	I	a	9	11:11:11	2012	NULL	
11	2	1.9	中!文	J	a	10	11:11:11	2011	NULL	
12	2.1	1.8	中!文	K	a	11	11:11:11	2012	NULL	
CALL pro2(8);
SELECT * FROM t1 ORDER BY 1;
c0	c1	c2	c3	c4	c5	c6	c7	c8	c9	c10
6	1	1.1	中文			0	11:11:11	2000	NULL	
6	1.5	5.2	中!文	E	a	5	11:11:11	2005	NULL	
7	1.1	1.2	中!文	A	a	1	11:11:11	2001	NULL	
7	1.6	6.2	中!文	F	a	6	11:11:11	2006	NULL	
8	1.2	2.2	中!文	B	a	2	11:11:11	2002	NULL	
8	1.7	7.2	中!文	G	a	7	11:11:11	2007	NULL	
9	1.3	3.2	中!文	C	a	3	11:11:11	2003	NULL	
9	1.8	8.2	中!文	H	a	8	11:11:11	2011	NULL	
10	1.4	4.2	中!文	D	a	4	11:11:11	2004	NULL	
10	1.9	9.2	中!文	I	a	9	11:11:11	2012	NULL	
11	2	1.9	中!文	J	a	10	11:11:11	2011	NULL	
12	2.1	1.8	中!文	K	a	11	11:11:11	2012	NULL	
CALL pro2(12);
SELECT * FROM t1 ORDER BY 1;
c0	c1	c2	c3	c4	c5	c6	c7	c8	c9	c10
DROP PROCEDURE IF EXISTS pro2;
#使用WHILE循环创建的存储过程
DROP TABLE IF EXISTS t2;
DROP TABLE IF EXISTS t1;
CREATE TABLE t1(c0 INT(5),
c1 FLOAT ,
c2 DOUBLE,
c3 CHAR(10) DEFAULT 'A',
c4 VARCHAR(10),
c5 CHAR(10),
c6 INT,
c7 TIME,
c8 YEAR);
INSERT INTO t1 VALUES(1,1.0,1.1,'中文','','',0,'11:11:11','2000'),
(2,1.1,1.2,'中!文','A','a',1,'11:11:11','2001'),
(3,1.2,2.2,'中!文','B','a',2,'11:11:11','2002'),
(4,1.3,3.2,'中!文','C','a',3,'11:11:11','2003'),
(5,1.4,4.2,'中!文','D','a',4,'11:11:11','2004'),
(6,1.5,5.2,'中!文','E','a',5,'11:11:11','2005'),
(7,1.6,6.2,'中!文','F','a',6,'11:11:11','2006'),
(8,1.7,7.2,'中!文','G','a',7,'11:11:11','2007'),
(9,1.8,8.2,'中!文','H','a',8,'11:11:11','2011'),
(10,1.9,9.2,'中!文','I','a',9,'11:11:11','2012'),
(11,2.0,1.9,'中!文','J','a',10,'11:11:11','2011'),
(12,2.1,1.8,'中!文','K','a',11,'11:11:11','2012');
CREATE TABLE t2(c0 INT(4),
c1 FLOAT,
c2 DOUBLE,
c3 CHAR(10),
c4 VARCHAR(5),
c5 INT,
c6 TIME);
INSERT INTO t2 VALUES(1,1.0,1.1,'中文','',0,'11:11:11'),
(2,1.1,1.2,'中!文','a',1,'11:11:11'),
(3,1.2,2.2,'中!文','a',2,'11:11:11'),
(4,1.3,3.2,'中!文','a',3,'11:11:11'),
(5,1.4,4.2,'中!文','a',4,'11:11:11');
DROP PROCEDURE IF EXISTS pro3;
CREATE PROCEDURE pro3(IN v_c0 INT)
BEGIN
DECLARE a INT DEFAULT 1;
wh1:WHILE a <=1 DO
INSERT INTO t1 SELECT t1.* FROM t1 RIGHT JOIN t2 ON t1.c0 = t2.c0 WHERE t2.c1 NOT IN(SELECT c1 FROM t1 WHERE c0 > v_c0);COMMIT;
DELETE FROM t1 WHERE c1 NOT IN(SELECT t2.c1 FROM t2 WHERE c1 IN(SELECT c1 FROM t1 WHERE c0 < v_c0));COMMIT;
SET a = a + 1;
END WHILE wh1;
END;
//
#新增列
ALTER TABLE t2 ADD c7 INT DEFAULT 0;
CALL pro3(8);
SELECT * FROM t1 ORDER BY 1;
c0	c1	c2	c3	c4	c5	c6	c7	c8
1	1	1.1	中文			0	11:11:11	2000
1	1	1.1	中文			0	11:11:11	2000
2	1.1	1.2	中!文	A	a	1	11:11:11	2001
2	1.1	1.2	中!文	A	a	1	11:11:11	2001
3	1.2	2.2	中!文	B	a	2	11:11:11	2002
3	1.2	2.2	中!文	B	a	2	11:11:11	2002
4	1.3	3.2	中!文	C	a	3	11:11:11	2003
4	1.3	3.2	中!文	C	a	3	11:11:11	2003
5	1.4	4.2	中!文	D	a	4	11:11:11	2004
5	1.4	4.2	中!文	D	a	4	11:11:11	2004
ALTER TABLE t1 ADD c9 INT NOT NULL;
CALL pro3(3);
SELECT * FROM t1 ORDER BY 1;
c0	c1	c2	c3	c4	c5	c6	c7	c8	c9
1	1	1.1	中文			0	11:11:11	2000	0
1	1	1.1	中文			0	11:11:11	2000	0
1	1	1.1	中文			0	11:11:11	2000	0
1	1	1.1	中文			0	11:11:11	2000	0
2	1.1	1.2	中!文	A	a	1	11:11:11	2001	0
2	1.1	1.2	中!文	A	a	1	11:11:11	2001	0
2	1.1	1.2	中!文	A	a	1	11:11:11	2001	0
2	1.1	1.2	中!文	A	a	1	11:11:11	2001	0
DROP PROCEDURE IF EXISTS pro3;
#使用LOOP循环创建的存储过程
DROP TABLE IF EXISTS t2;
DROP TABLE IF EXISTS t1;
CREATE TABLE t1(c0 INT(5),
c1 FLOAT ,
c2 DOUBLE,
c3 CHAR(10) DEFAULT 'A',
c4 VARCHAR(10),
c5 CHAR(10),
c6 INT,
c7 TIME,
c8 YEAR);
INSERT INTO t1 VALUES(1,1.0,1.1,'中文','','',0,'11:11:11','2000'),
(2,1.1,1.2,'中!文','A','a',1,'11:11:11','2001'),
(3,1.2,2.2,'中!文','B','a',2,'11:11:11','2002'),
(4,1.3,3.2,'中!文','C','a',3,'11:11:11','2003'),
(5,1.4,4.2,'中!文','D','a',4,'11:11:11','2004'),
(6,1.5,5.2,'中!文','E','a',5,'11:11:11','2005'),
(7,1.6,6.2,'中!文','F','a',6,'11:11:11','2006'),
(8,1.7,7.2,'中!文','G','a',7,'11:11:11','2007'),
(9,1.8,8.2,'中!文','H','a',8,'11:11:11','2011'),
(10,1.9,9.2,'中!文','I','a',9,'11:11:11','2012'),
(11,2.0,1.9,'中!文','J','a',10,'11:11:11','2011'),
(12,2.1,1.8,'中!文','K','a',11,'11:11:11','2012');
CREATE TABLE t2(c0 INT(4),
c1 FLOAT,
c2 DOUBLE,
c3 CHAR(10),
c4 VARCHAR(5),
c5 INT,
c6 TIME);
INSERT INTO t2 VALUES(1,1.0,1.1,'中文','',0,'11:11:11'),
(2,1.1,1.2,'中!文','a',1,'11:11:11'),
(3,1.2,2.2,'中!文','a',2,'11:11:11'),
(4,1.3,3.2,'中!文','a',3,'11:11:11'),
(5,1.4,4.2,'中!文','a',4,'11:11:11');
DROP PROCEDURE IF EXISTS pro4;
CREATE PROCEDURE pro4(IN v_c0 INT)
BEGIN
DECLARE a INT DEFAULT 1;
loop1: LOOP
INSERT INTO t1 SELECT t1.* FROM t1 LEFT JOIN t2 ON t1.c0 = t2.c0 WHERE
t2.c1 IN(SELECT c1 FROM t1 WHERE c0 > v_c0);COMMIT;
DELETE FROM t1 WHERE c0=a OR c0=v_c0+5;COMMIT;
IF a = 3 THEN
LEAVE loop1;
END IF;
SET a = a + 1;
END LOOP;
END;
//
#新增列
ALTER TABLE t2 ADD c7 VARCHAR(10) DEFAULT 'A';
CALL pro4(3);
SELECT * FROM t1 ORDER BY 1;
c0	c1	c2	c3	c4	c5	c6	c7	c8
4	1.3	3.2	中!文	C	a	3	11:11:11	2003
4	1.3	3.2	中!文	C	a	3	11:11:11	2003
4	1.3	3.2	中!文	C	a	3	11:11:11	2003
4	1.3	3.2	中!文	C	a	3	11:11:11	2003
4	1.3	3.2	中!文	C	a	3	11:11:11	2003
4	1.3	3.2	中!文	C	a	3	11:11:11	2003
4	1.3	3.2	中!文	C	a	3	11:11:11	2003
4	1.3	3.2	中!文	C	a	3	11:11:11	2003
5	1.4	4.2	中!文	D	a	4	11:11:11	2004
5	1.4	4.2	中!文	D	a	4	11:11:11	2004
5	1.4	4.2	中!文	D	a	4	11:11:11	2004
5	1.4	4.2	中!文	D	a	4	11:11:11	2004
5	1.4	4.2	中!文	D	a	4	11:11:11	2004
5	1.4	4.2	中!文	D	a	4	11:11:11	2004
5	1.4	4.2	中!文	D	a	4	11:11:11	2004
5	1.4	4.2	中!文	D	a	4	11:11:11	2004
6	1.5	5.2	中!文	E	a	5	11:11:11	2005
7	1.6	6.2	中!文	F	a	6	11:11:11	2006
9	1.8	8.2	中!文	H	a	8	11:11:11	2011
10	1.9	9.2	中!文	I	a	9	11:11:11	2012
11	2	1.9	中!文	J	a	10	11:11:11	2011
12	2.1	1.8	中!文	K	a	11	11:11:11	2012
ALTER TABLE t1 ADD c9 INT NOT NULL;
CALL pro4(6);
SELECT * FROM t1 ORDER BY 1;
c0	c1	c2	c3	c4	c5	c6	c7	c8	c9
4	1.3	3.2	中!文	C	a	3	11:11:11	2003	0
4	1.3	3.2	中!文	C	a	3	11:11:11	2003	0
4	1.3	3.2	中!文	C	a	3	11:11:11	2003	0
4	1.3	3.2	中!文	C	a	3	11:11:11	2003	0
4	1.3	3.2	中!文	C	a	3	11:11:11	2003	0
4	1.3	3.2	中!文	C	a	3	11:11:11	2003	0
4	1.3	3.2	中!文	C	a	3	11:11:11	2003	0
4	1.3	3.2	中!文	C	a	3	11:11:11	2003	0
5	1.4	4.2	中!文	D	a	4	11:11:11	2004	0
5	1.4	4.2	中!文	D	a	4	11:11:11	2004	0
5	1.4	4.2	中!文	D	a	4	11:11:11	2004	0
5	1.4	4.2	中!文	D	a	4	11:11:11	2004	0
5	1.4	4.2	中!文	D	a	4	11:11:11	2004	0
5	1.4	4.2	中!文	D	a	4	11:11:11	2004	0
5	1.4	4.2	中!文	D	a	4	11:11:11	2004	0
5	1.4	4.2	中!文	D	a	4	11:11:11	2004	0
6	1.5	5.2	中!文	E	a	5	11:11:11	2005	0
7	1.6	6.2	中!文	F	a	6	11:11:11	2006	0
9	1.8	8.2	中!文	H	a	8	11:11:11	2011	0
10	1.9	9.2	中!文	I	a	9	11:11:11	2012	0
12	2.1	1.8	中!文	K	a	11	11:11:11	2012	0
DROP PROCEDURE IF EXISTS pro4;
#在存储过程中执行alter table语句
#普通列
DROP TABLE IF EXISTS t1;
CREATE TABLE t1(c0 INT(5) ZEROFILL,
c1 FLOAT ,
c2 DOUBLE ,
c3 BIT(20) DEFAULT 0,
c4 BLOB,
c5 TEXT,
c6 VARCHAR(50) ,
c7 CHAR(50),
c8 BINARY(50) ,
c9 VARBINARY(50) ,
c10 ENUM('a','b','c','d','e','f','g','h'),
c11 SET('i','j','k','l','m','n','o','p'),
c12 TIME ,
c13 DATE ,
c14 DATETIME ,
c15 TIMESTAMP ,
c16 YEAR);
INSERT INTO t1 VALUES(1,1.5,1,'',x'89504E470D0A1A0A0000000D4948445206105000000097048597300000EC300000EC301C76FA8640000001','89504E470D0A1A0A00C76FA8640000001E49444154384F6350DAE843','','','teshu*符号@$￥%','SHUZI!1234567','a','i','20:12:12','2000-12-12','2000-01-01 01:01:01','2001-01-01 12:01:01.34567','2000'),
(2,2.5,2,b'110101',x'89504E470D0A1A0A0000000D4997300000EC300000EC301C76FA8640000001E49444154384','89504E470D0A1A0A00C76FA8640000001E49444154384F6350DAE843','中文—汉化','english_language','teshu*符号@$￥%','SHUZI!1234567','b','i','21:12:12','2001-12-22','2001-01-01 13:01:01','2001-11-01 11:01:01.34567','2010'),
(3,3.5,3,b'011101',x'89504E470D0A1A0A00C76FA8640000001E49444154384F6350DAE843126220493550F1A8066242','89504E470D0A1A0A00C76FA8640000001E49444154384F6350DAE843','删除时使用情景','english_language','teshu*符号@$￥%','SHUZI!1234567','c','i','22:12:12','2002-12-02','2002-01-01 14:01:01','2002-12-01 02:01:01.34567','2000'),
(4,4.5,4,b'010111',x'89504E470D0A1A0A00C76FA8640000001E49444154384F6350DAE843126220493550F1A8066242','89504E470D0A1A0A00C76FA8640000001E49444154384F6350DAE843','删除中——汉化','english_language','teshu*符号@$￥%','SHUZI!1234567','d','j','23:12:12','2003-12-11','2003-01-01 15:01:01','2002-11-01 03:01:01.34567','2010'),
(5,5.5,5,b'111101',x'89504E470D0A1A0A00C76FA8640000001E49444154384F6350DAE843126220493550','89504E470D0A1A0A00C76FA8640000001E49444154384F6350DAE843','删除中文*汉化删除','english_language','teshu*符号@$￥%','SHUZI!1234567','e','k','20:22:12','2004-12-12','2004-01-01 16:01:01','2002-02-04 05:01:01.34567','2000'),
(6,6.5,6,b'110111',x'89504E470D0A1A0A00C76FA8640000001E49444154384F6350DAE843126220493550','89504E470D0A1A0A00C76FA8640000001E49444154384F6350DAE843','除列时使用情景','english_language','teshu*符号@$￥%','SHUZI!1234567','f','k','20:32:12','2021-12-13','2010-01-01 21:01:01','2003-03-01 04:01:01.34567','2010');
INSERT INTO t1 VALUES(7,7.5,7,b'01101',x'89504E470D0A1A0A00C76FA8640000001E49444154384F6350DAE843126220493550','89504E470D0A1A0A00C76FA8640000001E49444154384F6350DAE843','删列时使用情景','english_language','teshu*符号@$￥%','SHUZI!1234567','g','l','20:42:12','2020-12-14','2011-01-01 22:01:01','2004-04-01 05:01:01.34567','2000'),
(8,8.5,8,b'01001',x'89504E470D0A1A0A00C76FA8640000001E49444154384F6350DAE843126220493550','89504E470D0A1A0A00C76FA8640000001E49444154384F6350DAE843','删除列使用情景','english_language','teshu*符号@$￥%','SHUZI!1234567','h','l','20:52:12','2015-12-15','2012-01-01 23:01:01','2005-05-01 06:01:01.34567','2020'),
(9,9.5,9,b'10101',x'89504E470D0A1A0A00C76FA8640000001E49444154384F6350DAE843126220493550','89504E470D0A1A0A00C76FA8640000001E49444154384F6350DAE843','删中文——汉化删除','english_language','teshu*符号@$￥%','SHUZI!1234567','a','l','20:12:42','2014-12-16','2013-01-01 20:01:01','2006-06-01 07:01:01.34567','2000'),
(10,10.5,10,b'0010101',x'89504E470D0A1A0A00C76FA8640000001E49444154384F6350DAE843','89504E470D0A1A0A00C76FA8640000001E49444154384F6350DAE843126220493550','删除列时用情景','english_language','teshu*符号@$￥%','SHUZI!1234567','a','m','21:12:52','2013-12-17','2014-01-01 01:11:01','2007-07-01 08:01:01.34567','2020'),
(11,1.15,11,b'0100101',x'89504E470D0A1A0A00C76FA8640000001E49444154384F6350DAE843','89504E470D0A1A0A00C76FA8640000001E49444154384F6350DAE843126220493550','中文——汉化删除','english_language','teshu*符号@$￥%','SHUZI!1234567','b','n','21:12:32','2012-12-18','2011-01-01 01:21:01','2008-08-01 01:01:01.34567','2010'),
(12,1.25,12,b'0101001',x'89504E470D0A1A0A00C76FA8640000001E49444154384F6350DAE843','89504E470D0A1A0A00C76FA8640000001E49444154384F6350DAE843126220493550','删除中文——汉化','english_language','teshu*符号@$￥%','SHUZI!1234567','b','n','22:12:22','2011-12-19','2010-01-01 01:31:01','2009-09-01 01:01:01.34567','2020'),
(13,1.35,13,b'0101010',x'89504E470D0A1A0A00C76FA8640000001E49444154384F6350DAE843','89504E470D0A1A0A00C76FA8640000001E49444154384F6350DAE843126220493550F1','删除列时使情景','english_language','teshu*符号@$￥%','SHUZI!1234567','c','m','22:12:12','2017-12-10','2018-01-01 01:41:01','2010-10-01 01:01:01.34567','2000');
INSERT INTO t1 VALUES(14,1.45,14,b'0101011',x'89504E470D0A1A0A00C76FA8640000001E49444154384F6350DAE843','89504E470D0A1A0A00C76FA8640000001E49444154384F6350DAE843126220493550F1A80662426C34940647','中文—删除化','english_language','teshu*符号@$￥%','SHUZI!1234567','c','o','23:12:02','2016-12-02','2019-01-01 01:01:51','2020-11-01 01:01:01.34567','2020'),
(15,1.55,15,b'0101101',x'89504E470D0A1A0A00C76FA8640000001E49444154384F6350DAE843','89504E470D0A1A0A0009444154384F6350DAE843126220493550F1A80662426C349406472801006AC91F1040F','中删除—汉化','english_language','teshu*符号@$￥%','SHUZI!1234567','d','o','23:12:12','2015-02-12','2020-01-01 01:51:01','2011-12-01 01:01:01.34567','2000'),
(16,1.65,16,b'0110101',x'89504E470D0A1A0A00C76FA8640000001E49444154384F6350DAE843','89504E470D0A1A0A0000049444154384F6350DAE843126220493550F1A80662426C349406472801006AC91F1040F79','删除列时使用景','english_language','teshu*符号@$￥%','SHUZI!1234567','d','p','11:12:12','2014-12-12','2022-01-01 01:41:01','2013-01-01 01:01:01.34567','2010'),
(17,1.75,17,b'1010101',x'89504E470D0A1A0A00C76FA8640000001E49444154384F6350DAE843','89504E470D0A1A0A009444154384F6350DAE843126220493550F1A80662426C349406472801006AC91F1040F796BD','删除——汉化','english_language','teshu*符号@$￥%','SHUZI!1234567','e','o','12:12:12','2013-02-02','2021-01-01 01:31:01','2000-02-01 01:01:01.34567','2000'),
(18,1.85,18,b'11010101',x'89504E470D0A1A0A00C76FA8640000001E49444154384F6350DAE843','89504E470D0A1A0A0000000D4997300000EC300000EC301C76FA8640000001E49444154384F6350DAE843126220493550F1A80662426','删除列时使用情','english_language','teshu*符号@$￥%','SHUZI!1234567','g','i','16:12:12','2012-12-12','2023-01-01 01:21:01','2000-03-01 01:01:01.3','2020'),
(19,1.95,19,b'01110101',x'89504E470D0A1A0A00C76FA8640000001E49444154384F6350DAE843','89504E470D0A1A0A0040000001E49444154384F6350DAE843126220493550F1A80662426C349406472801006AC91F1040F79','中文删除','english_language','teshu*符号@$￥%','SHUZI!1234567','f','l','17:12:12','2011-02-02','2022-01-01 01:11:01','2000-04-01 01:01:01.367','2010'),
(20,1.05,20,b'01010111',x'89504E470D0A1A0A00C76FA8640000001E49444154384F6350DAE843','89504E470D0A1A0A0000970485979444154384F6350DAE843126220493550F1A80662426C349406472801006AC91F1040F796BD','删除列时使用','english_language','teshu*符号@$￥%','SHUZI!1234567','f','i','18:12:12','2001-02-10','2019-01-01 01:11:01','2000-05-01 01:01:01.34','2020'),
(21,2.05,21,b'01011101',x'89504E470D0A1A0A00C76FA8640000001E49444154384F6350DAE843','89504E470D0A1A0A0000000EC300000EC301C76FA8640000001E49444154384F6350DAE843126220493550F','中文删除汉化','english_language','teshu*符号@$￥%','SHUZI!1234567','f','j','19:12:12','2022-12-12','1980-01-01 01:41:01','2000-06-01 01:01:01.34567','2010');
CREATE INDEX ind_1 ON t1(c12);
#存储过程中同时删除新增修改列OB不支持，待支持后执行此存储过程
#带有索引、约束及生成列
DROP TABLE IF EXISTS t1;
CREATE TABLE t1(c0 INT(5) AUTO_INCREMENT PRIMARY KEY,
c1 FLOAT NOT NULL,
c2 DOUBLE UNIQUE,
c3 BIT(20) DEFAULT 0,
c4 BLOB,
c5 TEXT,
c6 VARCHAR(50) ,
c7 CHAR(50) GENERATED ALWAYS AS (CONCAT(c6,'-test')) VIRTUAL NOT NULL COMMENT '字符串生成列',
c8 BINARY(50) NOT NULL,
c9 VARBINARY(50) NOT NULL,
c10 ENUM('a','b','c','d','e','f','g','h'),
c11 SET('i','j','k','l','m','n','o','p'),
c12 TIME NOT NULL,
c13 DATE NOT NULL,
c14 DATETIME NOT NULL,
c15 TIMESTAMP NOT NULL,
c16 YEAR ,CHECK(c16>=c17),
c17 INT DEFAULT 2000);
INSERT INTO t1(c0,c1,c2,c3,c4,c5,c6,c8,c9,c10,c11,c12,c13,c14,c15,c16) VALUES(1,1.5,1,'',x'89504E470D0A1A0A0000000D4948445206105000000097048597300000EC300000EC301C76FA8640000001','89504E470D0A1A0A00C76FA8640000001E49444154384F6350DAE843','','teshu*符号@$￥%','SHUZI!1234567','a','i','20:12:12','2000-12-12','2000-01-01 01:01:01','2001-01-01 12:01:01.34567','2000'),
(2,2.5,2,b'110101',x'89504E470D0A1A0A0000000D4997300000EC300000EC301C76FA8640000001E49444154384','89504E470D0A1A0A00C76FA8640000001E49444154384F6350DAE843','中文—汉化','teshu*符号@$￥%','SHUZI!1234567','b','i','21:12:12','2001-12-22','2001-01-01 13:01:01','2001-11-01 11:01:01.34567','2010'),
(3,3.5,3,b'011101',x'89504E470D0A1A0A00C76FA8640000001E49444154384F6350DAE843126220493550F1A8066242','89504E470D0A1A0A00C76FA8640000001E49444154384F6350DAE843','删除时使用情景','teshu*符号@$￥%','SHUZI!1234567','c','i','22:12:12','2002-12-02','2002-01-01 14:01:01','2002-12-01 02:01:01.34567','2000'),
(4,4.5,4,b'010111',x'89504E470D0A1A0A00C76FA8640000001E49444154384F6350DAE843126220493550F1A8066242','89504E470D0A1A0A00C76FA8640000001E49444154384F6350DAE843','删除中——汉化','teshu*符号@$￥%','SHUZI!1234567','d','j','23:12:12','2003-12-11','2003-01-01 15:01:01','2002-11-01 03:01:01.34567','2010'),
(5,5.5,5,b'111101',x'89504E470D0A1A0A00C76FA8640000001E49444154384F6350DAE843126220493550','89504E470D0A1A0A00C76FA8640000001E49444154384F6350DAE843','删除中文*汉化删除','teshu*符号@$￥%','SHUZI!1234567','e','k','20:22:12','2004-12-12','2004-01-01 16:01:01','2002-02-04 05:01:01.34567','2000'),
(6,6.5,6,b'110111',x'89504E470D0A1A0A00C76FA8640000001E49444154384F6350DAE843126220493550','89504E470D0A1A0A00C76FA8640000001E49444154384F6350DAE843','除列时使用情景','teshu*符号@$￥%','SHUZI!1234567','f','k','20:32:12','2021-12-13','2010-01-01 21:01:01','2003-03-01 04:01:01.34567','2010');
INSERT INTO t1(c0,c1,c2,c3,c4,c5,c6,c8,c9,c10,c11,c12,c13,c14,c15,c16) VALUES(7,7.5,7,b'01101',x'89504E470D0A1A0A00C76FA8640000001E49444154384F6350DAE843126220493550','89504E470D0A1A0A00C76FA8640000001E49444154384F6350DAE843','删列时使用情景','teshu*符号@$￥%','SHUZI!1234567','g','l','20:42:12','2020-12-14','2011-01-01 22:01:01','2004-04-01 05:01:01.34567','2000'),
(8,8.5,8,b'01001',x'89504E470D0A1A0A00C76FA8640000001E49444154384F6350DAE843126220493550','89504E470D0A1A0A00C76FA8640000001E49444154384F6350DAE843','删除列使用情景','teshu*符号@$￥%','SHUZI!1234567','h','l','20:52:12','2015-12-15','2012-01-01 23:01:01','2005-05-01 06:01:01.34567','2020'),
(9,9.5,9,b'10101',x'89504E470D0A1A0A00C76FA8640000001E49444154384F6350DAE843126220493550','89504E470D0A1A0A00C76FA8640000001E49444154384F6350DAE843','删中文——汉化删除','teshu*符号@$￥%','SHUZI!1234567','a','l','20:12:42','2014-12-16','2013-01-01 20:01:01','2006-06-01 07:01:01.34567','2000'),
(10,10.5,10,b'0010101',x'89504E470D0A1A0A00C76FA8640000001E49444154384F6350DAE843','89504E470D0A1A0A00C76FA8640000001E49444154384F6350DAE843126220493550','删除列时用情景','teshu*符号@$￥%','SHUZI!1234567','a','m','21:12:52','2013-12-17','2014-01-01 01:11:01','2007-07-01 08:01:01.34567','2020'),
(11,1.15,11,b'0100101',x'89504E470D0A1A0A00C76FA8640000001E49444154384F6350DAE843','89504E470D0A1A0A00C76FA8640000001E49444154384F6350DAE843126220493550','中文——汉化删除','teshu*符号@$￥%','SHUZI!1234567','b','n','21:12:32','2012-12-18','2011-01-01 01:21:01','2008-08-01 01:01:01.34567','2010'),
(12,1.25,12,b'0101001',x'89504E470D0A1A0A00C76FA8640000001E49444154384F6350DAE843','89504E470D0A1A0A00C76FA8640000001E49444154384F6350DAE843126220493550','删除中文——汉化','teshu*符号@$￥%','SHUZI!1234567','b','n','22:12:22','2011-12-19','2010-01-01 01:31:01','2009-09-01 01:01:01.34567','2020'),
(13,1.35,13,b'0101010',x'89504E470D0A1A0A00C76FA8640000001E49444154384F6350DAE843','89504E470D0A1A0A00C76FA8640000001E49444154384F6350DAE843126220493550F1','删除列时使情景','teshu*符号@$￥%','SHUZI!1234567','c','m','22:12:12','2017-12-10','2018-01-01 01:41:01','2010-10-01 01:01:01.34567','2000');
INSERT INTO t1(c0,c1,c2,c3,c4,c5,c6,c8,c9,c10,c11,c12,c13,c14,c15,c16) VALUES(14,1.45,14,b'0101011',x'89504E470D0A1A0A00C76FA8640000001E49444154384F6350DAE843','89504E470D0A1A0A00C76FA8640000001E49444154384F6350DAE843126220493550F1A80662426C34940647','中文—删除化','teshu*符号@$￥%','SHUZI!1234567','c','o','23:12:02','2016-12-02','2019-01-01 01:01:51','2020-11-01 01:01:01.34567','2020'),
(15,1.55,15,b'0101101',x'89504E470D0A1A0A00C76FA8640000001E49444154384F6350DAE843','89504E470D0A1A0A0009444154384F6350DAE843126220493550F1A80662426C349406472801006AC91F1040F','中删除—汉化','teshu*符号@$￥%','SHUZI!1234567','d','o','23:12:12','2015-02-12','2020-01-01 01:51:01','2011-12-01 01:01:01.34567','2000'),
(16,1.65,16,b'0110101',x'89504E470D0A1A0A00C76FA8640000001E49444154384F6350DAE843','89504E470D0A1A0A0000049444154384F6350DAE843126220493550F1A80662426C349406472801006AC91F1040F79','删除列时使用景','teshu*符号@$￥%','SHUZI!1234567','d','p','11:12:12','2014-12-12','2022-01-01 01:41:01','2013-01-01 01:01:01.34567','2010'),
(17,1.75,17,b'1010101',x'89504E470D0A1A0A00C76FA8640000001E49444154384F6350DAE843','89504E470D0A1A0A009444154384F6350DAE843126220493550F1A80662426C349406472801006AC91F1040F796BD','删除——汉化','teshu*符号@$￥%','SHUZI!1234567','e','o','12:12:12','2013-02-02','2021-01-01 01:31:01','2000-02-01 01:01:01.34567','2000'),
(18,1.85,18,b'11010101',x'89504E470D0A1A0A00C76FA8640000001E49444154384F6350DAE843','89504E470D0A1A0A0000000D4997300000EC300000EC301C76FA8640000001E49444154384F6350DAE843126220493550F1A80662426','删除列时使用情','teshu*符号@$￥%','SHUZI!1234567','g','i','16:12:12','2012-12-12','2023-01-01 01:21:01','2000-03-01 01:01:01.3','2020'),
(19,1.95,19,b'01110101',x'89504E470D0A1A0A00C76FA8640000001E49444154384F6350DAE843','89504E470D0A1A0A0040000001E49444154384F6350DAE843126220493550F1A80662426C349406472801006AC91F1040F79','中文删除','teshu*符号@$￥%','SHUZI!1234567','f','l','17:12:12','2011-02-02','2022-01-01 01:11:01','2000-04-01 01:01:01.367','2010'),
(20,1.05,20,b'01010111',x'89504E470D0A1A0A00C76FA8640000001E49444154384F6350DAE843','89504E470D0A1A0A0000970485979444154384F6350DAE843126220493550F1A80662426C349406472801006AC91F1040F796BD','删除列时使用','teshu*符号@$￥%','SHUZI!1234567','f','i','18:12:12','2001-02-10','2019-01-01 01:11:01','2000-05-01 01:01:01.34','2020'),
(21,2.05,21,b'01011101',x'89504E470D0A1A0A00C76FA8640000001E49444154384F6350DAE843','89504E470D0A1A0A0000000EC300000EC301C76FA8640000001E49444154384F6350DAE843126220493550F','中文删除汉化','teshu*符号@$￥%','SHUZI!1234567','f','j','19:12:12','2022-12-12','1980-01-01 01:41:01','2000-06-01 01:01:01.34567','2010');
CREATE INDEX ind_1 ON t1(c12);
#存储过程中同时删除新增修改列OB不支持，待支持后执行此存储过程
#mysql_add-7
#FUNCTION
#新增列后调用函数
DROP TABLE IF EXISTS t2;
DROP TABLE IF EXISTS t1;
CREATE TABLE t1(c0 INT(5),
c1 FLOAT ,
c2 DOUBLE,
c3 CHAR(10) DEFAULT 'A',
c4 VARCHAR(10),
c5 CHAR(10),
c6 INT,
c7 TIME,
c8 YEAR);
INSERT INTO t1 VALUES(1,1.0,1.1,'中文','','',0,'11:11:11','2000'),
(2,1.1,1.2,'中!文','A','a',1,'11:11:11','2001'),
(3,1.2,2.2,'中!文','B','a',2,'11:11:11','2002'),
(4,1.3,3.2,'中!文','C','a',3,'11:11:11','2003'),
(5,1.4,4.2,'中!文','D','a',4,'11:11:11','2004'),
(6,1.5,5.2,'中!文','E','a',5,'11:11:11','2005'),
(7,1.6,6.2,'中!文','F','a',6,'11:11:11','2006'),
(8,1.7,7.2,'中!文','G','a',7,'11:11:11','2007'),
(9,1.8,8.2,'中!文','H','a',8,'11:11:11','2011'),
(10,1.9,9.2,'中!文','I','a',9,'11:11:11','2012'),
(11,2.0,1.9,'中!文','J','a',10,'11:11:11','2011'),
(12,2.1,1.8,'中!文','K','a',11,'11:11:11','2012');
CREATE TABLE t2(c0 INT(4),
c1 FLOAT,
c2 DOUBLE,
c3 CHAR(10),
c4 VARCHAR(5),
c5 INT,
c6 TIME);
INSERT INTO t2 VALUES(1,1.0,1.1,'中文','',0,'11:11:11'),
(2,1.1,1.2,'中!文','a',1,'11:11:11'),
(3,1.2,2.2,'中!文','a',2,'11:11:11'),
(4,1.3,3.2,'中!文','a',3,'11:11:11'),
(5,1.4,4.2,'中!文','a',4,'11:11:11');
DROP FUNCTION IF EXISTS f_test1;
CREATE FUNCTION f_test1(v_c0 INT)
RETURNS VARCHAR(100)
BEGIN
DECLARE v_count_t1 INT;
DECLARE v_count_t2 INT;
DECLARE v_count_t3 VARCHAR(100);
IF v_c0 <= 10 THEN
INSERT INTO t1 SELECT t1.* FROM t1,t2 WHERE t2.c1 NOT IN(SELECT c1 FROM t1 WHERE c0 > v_c0);
ELSE
DELETE FROM t1 WHERE c1 <>ALL(SELECT t2.c1 FROM t2 WHERE c1 IN(SELECT c1 FROM t2 WHERE c0 < v_c0));
END IF;
SELECT COUNT(c0) INTO v_count_t1 FROM t1;
SET v_count_t3 = CONCAT('t1表执行函数后条目合计：',v_count_t1);
RETURN v_count_t3;
END;
//
#新增列
ALTER TABLE t2 ADD c7 INT DEFAULT 0;
SELECT f_test1(8);
f_test1(8)
t1表执行函数后条目合计：72
SELECT f_test1(11);
f_test1(11)
t1表执行函数后条目合计：30
ALTER TABLE t1 ADD c9 INT NOT NULL;
SELECT f_test1(5);
f_test1(5)
t1表执行函数后条目合计：180
SELECT f_test1(13);
f_test1(13)
t1表执行函数后条目合计：180
DROP FUNCTION IF EXISTS f_test1;
#函数中调用新增列
DROP TABLE IF EXISTS t2;
DROP TABLE IF EXISTS t1;
CREATE TABLE t1(c0 INT(5),
c1 FLOAT ,
c2 DOUBLE,
c3 CHAR(10) DEFAULT 'A',
c4 VARCHAR(10),
c5 CHAR(10),
c6 INT,
c7 TIME,
c8 YEAR);
INSERT INTO t1 VALUES(1,1.0,1.1,'中文','','',0,'11:11:11','2000'),
(2,1.1,1.2,'中!文','A','a',1,'11:11:11','2001'),
(3,1.2,2.2,'中!文','B','a',2,'11:11:11','2002'),
(4,1.3,3.2,'中!文','C','a',3,'11:11:11','2003'),
(5,1.4,4.2,'中!文','D','a',4,'11:11:11','2004'),
(6,1.5,5.2,'中!文','E','a',5,'11:11:11','2005'),
(7,1.6,6.2,'中!文','F','a',6,'11:11:11','2006'),
(8,1.7,7.2,'中!文','G','a',7,'11:11:11','2007'),
(9,1.8,8.2,'中!文','H','a',8,'11:11:11','2011'),
(10,1.9,9.2,'中!文','I','a',9,'11:11:11','2012'),
(11,2.0,1.9,'中!文','J','a',10,'11:11:11','2011'),
(12,2.1,1.8,'中!文','K','a',11,'11:11:11','2012');
CREATE TABLE t2(c0 INT(4),
c1 FLOAT,
c2 DOUBLE,
c3 CHAR(10),
c4 VARCHAR(5),
c5 INT,
c6 TIME);
INSERT INTO t2 VALUES(1,1.0,1.1,'中文','',0,'11:11:11'),
(2,1.1,1.2,'中!文','a',1,'11:11:11'),
(3,1.2,2.2,'中!文','a',2,'11:11:11'),
(4,1.3,3.2,'中!文','a',3,'11:11:11'),
(5,1.4,4.2,'中!文','a',4,'11:11:11');
DROP FUNCTION IF EXISTS f_test2;
CREATE FUNCTION f_test2(v_c0 INT)
RETURNS VARCHAR(100)
BEGIN
DECLARE v_count_t1 INT;
DECLARE v_count_t2 INT;
DECLARE v_count_t3 VARCHAR(100);
IF v_c0 <= 10 THEN
ALTER TABLE t2 ADD c7 INT;
INSERT INTO t1 SELECT t1.* FROM t1,t2 WHERE t2.c1 NOT IN(SELECT c1 FROM t1 WHERE c0 > v_c0);
ELSE
ALTER TABLE t1 ADD c9 VARCHAR(10);
DELETE FROM t1 WHERE c1 <>ALL(SELECT t2.c1 FROM t2 WHERE c1 IN(SELECT c1 FROM t2 WHERE c0 < v_c0));
END IF;
SELECT COUNT(c0) INTO v_count_t1 FROM t1;
SET v_count_t3 = CONCAT('t1表执行函数后条目合计：',v_count_t1);
RETURN v_count_t3;
END;
//
ERROR HY000: Explicit or implicit commit is not allowed in stored function or trigger.
DROP TABLE IF EXISTS t2;
DROP TABLE IF EXISTS t1;
#########Empty recycle bin, delete test database, tables, etc##########
purge recyclebin;
