purge recyclebin;
DROP TABLE IF EXISTS t2;
DROP TABLE IF EXISTS t1;
#已有外键约束，新增列后执行DML操作
CREATE TABLE t1(c0 INT(4) PRIMARY KEY,
c1 FLOAT UNIQUE,
c2 DOUBLE,
c3 CHAR(10),
c4 CHAR(10),
c5 INT,
c6 TIME);
INSERT INTO t1 VALUES(1,1.0,1.1,'中文','',0,'11:11:11'),
(2,1.1,1.2,'中!文','a',1,'11:11:11'),
(3,1.2,2.2,'中!文','a',1,'11:11:11'),
(4,1.3,3.2,'中!文','a',1,'11:11:11'),
(5,1.4,4.2,'中!文','a',1,'11:11:11');
#外键带有ON UPDATE引用行为
#ON UPDATE CASCADE
CREATE TABLE t2(c0 INT(4),
c1 FLOAT UNIQUE,
c2 DOUBLE,
c3 CHAR(10),
c4 CHAR(10),
c5 INT,
c6 TIME,
CONSTRAINT fk_c0_c0 FOREIGN KEY(c0) REFERENCES t1(c0) ON UPDATE CASCADE);
INSERT INTO t2 VALUES(1,1.0,1.1,'中文','',0,'11:11:11'),
(2,1.1,1.2,'中!文','a',1,'11:11:11'),
(3,1.2,2.2,'中!文','a',1,'11:11:11'),
(4,1.3,3.2,'中!文','a',1,'11:11:11'),
(5,1.4,4.2,'中!文','a',1,'11:11:11');
ALTER TABLE t1 ADD c7 INT AFTER c0;
ALTER TABLE t2 ADD c7 INT AFTER c0;
INSERT INTO t1 VALUES(6,1,1.5,5.2,'中!文','b',2,'12:12:12');
SELECT * FROM t1 ORDER BY 1;
c0	c7	c1	c2	c3	c4	c5	c6
1	NULL	1	1.1	中文		0	11:11:11
2	NULL	1.1	1.2	中!文	a	1	11:11:11
3	NULL	1.2	2.2	中!文	a	1	11:11:11
4	NULL	1.3	3.2	中!文	a	1	11:11:11
5	NULL	1.4	4.2	中!文	a	1	11:11:11
6	1	1.5	5.2	中!文	b	2	12:12:12
SELECT * FROM t2 ORDER BY 1;
c0	c7	c1	c2	c3	c4	c5	c6
1	NULL	1	1.1	中文		0	11:11:11
2	NULL	1.1	1.2	中!文	a	1	11:11:11
3	NULL	1.2	2.2	中!文	a	1	11:11:11
4	NULL	1.3	3.2	中!文	a	1	11:11:11
5	NULL	1.4	4.2	中!文	a	1	11:11:11
UPDATE t1 SET c0=10 WHERE c5=0;
SELECT * FROM t1 ORDER BY 1;
c0	c7	c1	c2	c3	c4	c5	c6
2	NULL	1.1	1.2	中!文	a	1	11:11:11
3	NULL	1.2	2.2	中!文	a	1	11:11:11
4	NULL	1.3	3.2	中!文	a	1	11:11:11
5	NULL	1.4	4.2	中!文	a	1	11:11:11
6	1	1.5	5.2	中!文	b	2	12:12:12
10	NULL	1	1.1	中文		0	11:11:11
SELECT * FROM t2 ORDER BY 1;
c0	c7	c1	c2	c3	c4	c5	c6
2	NULL	1.1	1.2	中!文	a	1	11:11:11
3	NULL	1.2	2.2	中!文	a	1	11:11:11
4	NULL	1.3	3.2	中!文	a	1	11:11:11
5	NULL	1.4	4.2	中!文	a	1	11:11:11
10	NULL	1	1.1	中文		0	11:11:11
DELETE FROM t1 WHERE c0=10;
ERROR 23000: Cannot delete or update a parent row: a foreign key constraint fails
SELECT * FROM t1 ORDER BY 1;
c0	c7	c1	c2	c3	c4	c5	c6
2	NULL	1.1	1.2	中!文	a	1	11:11:11
3	NULL	1.2	2.2	中!文	a	1	11:11:11
4	NULL	1.3	3.2	中!文	a	1	11:11:11
5	NULL	1.4	4.2	中!文	a	1	11:11:11
6	1	1.5	5.2	中!文	b	2	12:12:12
10	NULL	1	1.1	中文		0	11:11:11
SELECT * FROM t2 ORDER BY 1;
c0	c7	c1	c2	c3	c4	c5	c6
2	NULL	1.1	1.2	中!文	a	1	11:11:11
3	NULL	1.2	2.2	中!文	a	1	11:11:11
4	NULL	1.3	3.2	中!文	a	1	11:11:11
5	NULL	1.4	4.2	中!文	a	1	11:11:11
10	NULL	1	1.1	中文		0	11:11:11
UPDATE t2 SET c0=11 WHERE c5=0;
ERROR 23000: Cannot add or update a child row: a foreign key constraint fails
SELECT * FROM t1 ORDER BY 1;
c0	c7	c1	c2	c3	c4	c5	c6
2	NULL	1.1	1.2	中!文	a	1	11:11:11
3	NULL	1.2	2.2	中!文	a	1	11:11:11
4	NULL	1.3	3.2	中!文	a	1	11:11:11
5	NULL	1.4	4.2	中!文	a	1	11:11:11
6	1	1.5	5.2	中!文	b	2	12:12:12
10	NULL	1	1.1	中文		0	11:11:11
SELECT * FROM t2 ORDER BY 1;
c0	c7	c1	c2	c3	c4	c5	c6
2	NULL	1.1	1.2	中!文	a	1	11:11:11
3	NULL	1.2	2.2	中!文	a	1	11:11:11
4	NULL	1.3	3.2	中!文	a	1	11:11:11
5	NULL	1.4	4.2	中!文	a	1	11:11:11
10	NULL	1	1.1	中文		0	11:11:11
DELETE FROM t2 WHERE c0=10;
SELECT * FROM t1 ORDER BY 1;
c0	c7	c1	c2	c3	c4	c5	c6
2	NULL	1.1	1.2	中!文	a	1	11:11:11
3	NULL	1.2	2.2	中!文	a	1	11:11:11
4	NULL	1.3	3.2	中!文	a	1	11:11:11
5	NULL	1.4	4.2	中!文	a	1	11:11:11
6	1	1.5	5.2	中!文	b	2	12:12:12
10	NULL	1	1.1	中文		0	11:11:11
SELECT * FROM t2 ORDER BY 1;
c0	c7	c1	c2	c3	c4	c5	c6
2	NULL	1.1	1.2	中!文	a	1	11:11:11
3	NULL	1.2	2.2	中!文	a	1	11:11:11
4	NULL	1.3	3.2	中!文	a	1	11:11:11
5	NULL	1.4	4.2	中!文	a	1	11:11:11
INSERT INTO t2 VALUES(6,2,1.6,6.2,'中!文','c',3,'13:13:13');
SELECT * FROM t1 ORDER BY 1;
c0	c7	c1	c2	c3	c4	c5	c6
2	NULL	1.1	1.2	中!文	a	1	11:11:11
3	NULL	1.2	2.2	中!文	a	1	11:11:11
4	NULL	1.3	3.2	中!文	a	1	11:11:11
5	NULL	1.4	4.2	中!文	a	1	11:11:11
6	1	1.5	5.2	中!文	b	2	12:12:12
10	NULL	1	1.1	中文		0	11:11:11
SELECT * FROM t2 ORDER BY 1;
c0	c7	c1	c2	c3	c4	c5	c6
2	NULL	1.1	1.2	中!文	a	1	11:11:11
3	NULL	1.2	2.2	中!文	a	1	11:11:11
4	NULL	1.3	3.2	中!文	a	1	11:11:11
5	NULL	1.4	4.2	中!文	a	1	11:11:11
6	2	1.6	6.2	中!文	c	3	13:13:13
INSERT INTO t2 VALUES(7,3,1.7,7.2,'中!文','d',4,'14:14:14');
ERROR 23000: Cannot add or update a child row: a foreign key constraint fails
SELECT * FROM t1 ORDER BY 1;
c0	c7	c1	c2	c3	c4	c5	c6
2	NULL	1.1	1.2	中!文	a	1	11:11:11
3	NULL	1.2	2.2	中!文	a	1	11:11:11
4	NULL	1.3	3.2	中!文	a	1	11:11:11
5	NULL	1.4	4.2	中!文	a	1	11:11:11
6	1	1.5	5.2	中!文	b	2	12:12:12
10	NULL	1	1.1	中文		0	11:11:11
SELECT * FROM t2 ORDER BY 1;
c0	c7	c1	c2	c3	c4	c5	c6
2	NULL	1.1	1.2	中!文	a	1	11:11:11
3	NULL	1.2	2.2	中!文	a	1	11:11:11
4	NULL	1.3	3.2	中!文	a	1	11:11:11
5	NULL	1.4	4.2	中!文	a	1	11:11:11
6	2	1.6	6.2	中!文	c	3	13:13:13
#ON UPDATE RESTRICT
DROP TABLE IF EXISTS t2;
DROP TABLE IF EXISTS t1;
CREATE TABLE t1(c0 INT(4) PRIMARY KEY,
c1 FLOAT UNIQUE,
c2 DOUBLE,
c3 CHAR(10),
c4 CHAR(10),
c5 INT,
c6 TIME);
INSERT INTO t1 VALUES(1,1.0,1.1,'中文','',0,'11:11:11'),
(2,1.1,1.2,'中!文','a',1,'11:11:11'),
(3,1.2,2.2,'中!文','a',1,'11:11:11'),
(4,1.3,3.2,'中!文','a',1,'11:11:11'),
(5,1.4,4.2,'中!文','a',1,'11:11:11');
CREATE TABLE t2(c0 INT(4),
c1 FLOAT UNIQUE,
c2 DOUBLE,
c3 CHAR(10),
c4 CHAR(10),
c5 INT,
c6 TIME,
CONSTRAINT fk_c0_c0 FOREIGN KEY(c0) REFERENCES t1(c0) ON UPDATE RESTRICT);
INSERT INTO t2 VALUES(1,1.0,1.1,'中文','',0,'11:11:11'),
(2,1.1,1.2,'中!文','a',1,'11:11:11'),
(3,1.2,2.2,'中!文','a',1,'11:11:11'),
(4,1.3,3.2,'中!文','a',1,'11:11:11'),
(5,1.4,4.2,'中!文','a',1,'11:11:11');
ALTER TABLE t1 ADD c7 INT AFTER c0;
ALTER TABLE t2 ADD c7 INT AFTER c0;
INSERT INTO t1 VALUES(6,1,1.5,5.2,'中!文','b',2,'12:12:12');
SELECT * FROM t1 ORDER BY 1;
c0	c7	c1	c2	c3	c4	c5	c6
1	NULL	1	1.1	中文		0	11:11:11
2	NULL	1.1	1.2	中!文	a	1	11:11:11
3	NULL	1.2	2.2	中!文	a	1	11:11:11
4	NULL	1.3	3.2	中!文	a	1	11:11:11
5	NULL	1.4	4.2	中!文	a	1	11:11:11
6	1	1.5	5.2	中!文	b	2	12:12:12
SELECT * FROM t2 ORDER BY 1;
c0	c7	c1	c2	c3	c4	c5	c6
1	NULL	1	1.1	中文		0	11:11:11
2	NULL	1.1	1.2	中!文	a	1	11:11:11
3	NULL	1.2	2.2	中!文	a	1	11:11:11
4	NULL	1.3	3.2	中!文	a	1	11:11:11
5	NULL	1.4	4.2	中!文	a	1	11:11:11
UPDATE t1 SET c0=10 WHERE c5=0;
ERROR 23000: Cannot delete or update a parent row: a foreign key constraint fails
SELECT * FROM t1 ORDER BY 1;
c0	c7	c1	c2	c3	c4	c5	c6
1	NULL	1	1.1	中文		0	11:11:11
2	NULL	1.1	1.2	中!文	a	1	11:11:11
3	NULL	1.2	2.2	中!文	a	1	11:11:11
4	NULL	1.3	3.2	中!文	a	1	11:11:11
5	NULL	1.4	4.2	中!文	a	1	11:11:11
6	1	1.5	5.2	中!文	b	2	12:12:12
SELECT * FROM t2 ORDER BY 1;
c0	c7	c1	c2	c3	c4	c5	c6
1	NULL	1	1.1	中文		0	11:11:11
2	NULL	1.1	1.2	中!文	a	1	11:11:11
3	NULL	1.2	2.2	中!文	a	1	11:11:11
4	NULL	1.3	3.2	中!文	a	1	11:11:11
5	NULL	1.4	4.2	中!文	a	1	11:11:11
DELETE FROM t1 WHERE c0=1;
ERROR 23000: Cannot delete or update a parent row: a foreign key constraint fails
SELECT * FROM t1 ORDER BY 1;
c0	c7	c1	c2	c3	c4	c5	c6
1	NULL	1	1.1	中文		0	11:11:11
2	NULL	1.1	1.2	中!文	a	1	11:11:11
3	NULL	1.2	2.2	中!文	a	1	11:11:11
4	NULL	1.3	3.2	中!文	a	1	11:11:11
5	NULL	1.4	4.2	中!文	a	1	11:11:11
6	1	1.5	5.2	中!文	b	2	12:12:12
SELECT * FROM t2 ORDER BY 1;
c0	c7	c1	c2	c3	c4	c5	c6
1	NULL	1	1.1	中文		0	11:11:11
2	NULL	1.1	1.2	中!文	a	1	11:11:11
3	NULL	1.2	2.2	中!文	a	1	11:11:11
4	NULL	1.3	3.2	中!文	a	1	11:11:11
5	NULL	1.4	4.2	中!文	a	1	11:11:11
UPDATE t2 SET c0=11 WHERE c5=0;
ERROR 23000: Cannot add or update a child row: a foreign key constraint fails
SELECT * FROM t1 ORDER BY 1;
c0	c7	c1	c2	c3	c4	c5	c6
1	NULL	1	1.1	中文		0	11:11:11
2	NULL	1.1	1.2	中!文	a	1	11:11:11
3	NULL	1.2	2.2	中!文	a	1	11:11:11
4	NULL	1.3	3.2	中!文	a	1	11:11:11
5	NULL	1.4	4.2	中!文	a	1	11:11:11
6	1	1.5	5.2	中!文	b	2	12:12:12
SELECT * FROM t2 ORDER BY 1;
c0	c7	c1	c2	c3	c4	c5	c6
1	NULL	1	1.1	中文		0	11:11:11
2	NULL	1.1	1.2	中!文	a	1	11:11:11
3	NULL	1.2	2.2	中!文	a	1	11:11:11
4	NULL	1.3	3.2	中!文	a	1	11:11:11
5	NULL	1.4	4.2	中!文	a	1	11:11:11
DELETE FROM t2 WHERE c0=1;
SELECT * FROM t1 ORDER BY 1;
c0	c7	c1	c2	c3	c4	c5	c6
1	NULL	1	1.1	中文		0	11:11:11
2	NULL	1.1	1.2	中!文	a	1	11:11:11
3	NULL	1.2	2.2	中!文	a	1	11:11:11
4	NULL	1.3	3.2	中!文	a	1	11:11:11
5	NULL	1.4	4.2	中!文	a	1	11:11:11
6	1	1.5	5.2	中!文	b	2	12:12:12
SELECT * FROM t2 ORDER BY 1;
c0	c7	c1	c2	c3	c4	c5	c6
2	NULL	1.1	1.2	中!文	a	1	11:11:11
3	NULL	1.2	2.2	中!文	a	1	11:11:11
4	NULL	1.3	3.2	中!文	a	1	11:11:11
5	NULL	1.4	4.2	中!文	a	1	11:11:11
INSERT INTO t2 VALUES(6,2,1.6,6.2,'中!文','c',3,'13:13:13');
SELECT * FROM t1 ORDER BY 1;
c0	c7	c1	c2	c3	c4	c5	c6
1	NULL	1	1.1	中文		0	11:11:11
2	NULL	1.1	1.2	中!文	a	1	11:11:11
3	NULL	1.2	2.2	中!文	a	1	11:11:11
4	NULL	1.3	3.2	中!文	a	1	11:11:11
5	NULL	1.4	4.2	中!文	a	1	11:11:11
6	1	1.5	5.2	中!文	b	2	12:12:12
SELECT * FROM t2 ORDER BY 1;
c0	c7	c1	c2	c3	c4	c5	c6
2	NULL	1.1	1.2	中!文	a	1	11:11:11
3	NULL	1.2	2.2	中!文	a	1	11:11:11
4	NULL	1.3	3.2	中!文	a	1	11:11:11
5	NULL	1.4	4.2	中!文	a	1	11:11:11
6	2	1.6	6.2	中!文	c	3	13:13:13
INSERT INTO t2 VALUES(7,3,1.7,7.2,'中!文','d',4,'14:14:14');
ERROR 23000: Cannot add or update a child row: a foreign key constraint fails
SELECT * FROM t1 ORDER BY 1;
c0	c7	c1	c2	c3	c4	c5	c6
1	NULL	1	1.1	中文		0	11:11:11
2	NULL	1.1	1.2	中!文	a	1	11:11:11
3	NULL	1.2	2.2	中!文	a	1	11:11:11
4	NULL	1.3	3.2	中!文	a	1	11:11:11
5	NULL	1.4	4.2	中!文	a	1	11:11:11
6	1	1.5	5.2	中!文	b	2	12:12:12
SELECT * FROM t2 ORDER BY 1;
c0	c7	c1	c2	c3	c4	c5	c6
2	NULL	1.1	1.2	中!文	a	1	11:11:11
3	NULL	1.2	2.2	中!文	a	1	11:11:11
4	NULL	1.3	3.2	中!文	a	1	11:11:11
5	NULL	1.4	4.2	中!文	a	1	11:11:11
6	2	1.6	6.2	中!文	c	3	13:13:13
#外键带有ON DELETE引用行为
DROP TABLE IF EXISTS t2;
DROP TABLE IF EXISTS t1;
CREATE TABLE t1(c0 INT(4) PRIMARY KEY,
c1 FLOAT UNIQUE,
c2 DOUBLE,
c3 CHAR(10),
c4 CHAR(10),
c5 INT,
c6 TIME);
INSERT INTO t1 VALUES(1,1.0,1.1,'中文','',0,'11:11:11'),
(2,1.1,1.2,'中!文','a',1,'11:11:11'),
(3,1.2,2.2,'中!文','a',1,'11:11:11'),
(4,1.3,3.2,'中!文','a',1,'11:11:11'),
(5,1.4,4.2,'中!文','a',1,'11:11:11');
#ON DELETE CASCADE
CREATE TABLE t2(c0 INT(4),
c1 FLOAT UNIQUE,
c2 DOUBLE,
c3 CHAR(10),
c4 CHAR(10),
c5 INT,
c6 TIME,
CONSTRAINT fk_c0_c0 FOREIGN KEY(c0) REFERENCES t1(c0) ON DELETE CASCADE);
INSERT INTO t2 VALUES(1,1.0,1.1,'中文','',0,'11:11:11'),
(2,1.1,1.2,'中!文','a',1,'11:11:11'),
(3,1.2,2.2,'中!文','a',1,'11:11:11'),
(4,1.3,3.2,'中!文','a',1,'11:11:11'),
(5,1.4,4.2,'中!文','a',1,'11:11:11');
ALTER TABLE t1 ADD c7 INT AFTER c0;
ALTER TABLE t2 ADD c7 INT AFTER c0;
INSERT INTO t1 VALUES(6,1,1.5,5.2,'中!文','b',2,'12:12:12');
SELECT * FROM t1 ORDER BY 1;
c0	c7	c1	c2	c3	c4	c5	c6
1	NULL	1	1.1	中文		0	11:11:11
2	NULL	1.1	1.2	中!文	a	1	11:11:11
3	NULL	1.2	2.2	中!文	a	1	11:11:11
4	NULL	1.3	3.2	中!文	a	1	11:11:11
5	NULL	1.4	4.2	中!文	a	1	11:11:11
6	1	1.5	5.2	中!文	b	2	12:12:12
SELECT * FROM t2 ORDER BY 1;
c0	c7	c1	c2	c3	c4	c5	c6
1	NULL	1	1.1	中文		0	11:11:11
2	NULL	1.1	1.2	中!文	a	1	11:11:11
3	NULL	1.2	2.2	中!文	a	1	11:11:11
4	NULL	1.3	3.2	中!文	a	1	11:11:11
5	NULL	1.4	4.2	中!文	a	1	11:11:11
UPDATE t1 SET c0=10 WHERE c5=0;
ERROR 23000: Cannot delete or update a parent row: a foreign key constraint fails
SELECT * FROM t1 ORDER BY 1;
c0	c7	c1	c2	c3	c4	c5	c6
1	NULL	1	1.1	中文		0	11:11:11
2	NULL	1.1	1.2	中!文	a	1	11:11:11
3	NULL	1.2	2.2	中!文	a	1	11:11:11
4	NULL	1.3	3.2	中!文	a	1	11:11:11
5	NULL	1.4	4.2	中!文	a	1	11:11:11
6	1	1.5	5.2	中!文	b	2	12:12:12
SELECT * FROM t2 ORDER BY 1;
c0	c7	c1	c2	c3	c4	c5	c6
1	NULL	1	1.1	中文		0	11:11:11
2	NULL	1.1	1.2	中!文	a	1	11:11:11
3	NULL	1.2	2.2	中!文	a	1	11:11:11
4	NULL	1.3	3.2	中!文	a	1	11:11:11
5	NULL	1.4	4.2	中!文	a	1	11:11:11
DELETE FROM t1 WHERE c0=1;
SELECT * FROM t1 ORDER BY 1;
c0	c7	c1	c2	c3	c4	c5	c6
2	NULL	1.1	1.2	中!文	a	1	11:11:11
3	NULL	1.2	2.2	中!文	a	1	11:11:11
4	NULL	1.3	3.2	中!文	a	1	11:11:11
5	NULL	1.4	4.2	中!文	a	1	11:11:11
6	1	1.5	5.2	中!文	b	2	12:12:12
SELECT * FROM t2 ORDER BY 1;
c0	c7	c1	c2	c3	c4	c5	c6
2	NULL	1.1	1.2	中!文	a	1	11:11:11
3	NULL	1.2	2.2	中!文	a	1	11:11:11
4	NULL	1.3	3.2	中!文	a	1	11:11:11
5	NULL	1.4	4.2	中!文	a	1	11:11:11
UPDATE t2 SET c0=11 WHERE c0=5;
ERROR 23000: Cannot add or update a child row: a foreign key constraint fails
SELECT * FROM t1 ORDER BY 1;
c0	c7	c1	c2	c3	c4	c5	c6
2	NULL	1.1	1.2	中!文	a	1	11:11:11
3	NULL	1.2	2.2	中!文	a	1	11:11:11
4	NULL	1.3	3.2	中!文	a	1	11:11:11
5	NULL	1.4	4.2	中!文	a	1	11:11:11
6	1	1.5	5.2	中!文	b	2	12:12:12
SELECT * FROM t2 ORDER BY 1;
c0	c7	c1	c2	c3	c4	c5	c6
2	NULL	1.1	1.2	中!文	a	1	11:11:11
3	NULL	1.2	2.2	中!文	a	1	11:11:11
4	NULL	1.3	3.2	中!文	a	1	11:11:11
5	NULL	1.4	4.2	中!文	a	1	11:11:11
DELETE FROM t2 WHERE c0=2;
SELECT * FROM t1 ORDER BY 1;
c0	c7	c1	c2	c3	c4	c5	c6
2	NULL	1.1	1.2	中!文	a	1	11:11:11
3	NULL	1.2	2.2	中!文	a	1	11:11:11
4	NULL	1.3	3.2	中!文	a	1	11:11:11
5	NULL	1.4	4.2	中!文	a	1	11:11:11
6	1	1.5	5.2	中!文	b	2	12:12:12
SELECT * FROM t2 ORDER BY 1;
c0	c7	c1	c2	c3	c4	c5	c6
3	NULL	1.2	2.2	中!文	a	1	11:11:11
4	NULL	1.3	3.2	中!文	a	1	11:11:11
5	NULL	1.4	4.2	中!文	a	1	11:11:11
INSERT INTO t2 VALUES(6,2,1.6,6.2,'中!文','c',3,'13:13:13');
SELECT * FROM t1 ORDER BY 1;
c0	c7	c1	c2	c3	c4	c5	c6
2	NULL	1.1	1.2	中!文	a	1	11:11:11
3	NULL	1.2	2.2	中!文	a	1	11:11:11
4	NULL	1.3	3.2	中!文	a	1	11:11:11
5	NULL	1.4	4.2	中!文	a	1	11:11:11
6	1	1.5	5.2	中!文	b	2	12:12:12
SELECT * FROM t2 ORDER BY 1;
c0	c7	c1	c2	c3	c4	c5	c6
3	NULL	1.2	2.2	中!文	a	1	11:11:11
4	NULL	1.3	3.2	中!文	a	1	11:11:11
5	NULL	1.4	4.2	中!文	a	1	11:11:11
6	2	1.6	6.2	中!文	c	3	13:13:13
INSERT INTO t2 VALUES(7,3,1.7,7.2,'中!文','d',4,'14:14:14');
ERROR 23000: Cannot add or update a child row: a foreign key constraint fails
SELECT * FROM t1 ORDER BY 1;
c0	c7	c1	c2	c3	c4	c5	c6
2	NULL	1.1	1.2	中!文	a	1	11:11:11
3	NULL	1.2	2.2	中!文	a	1	11:11:11
4	NULL	1.3	3.2	中!文	a	1	11:11:11
5	NULL	1.4	4.2	中!文	a	1	11:11:11
6	1	1.5	5.2	中!文	b	2	12:12:12
SELECT * FROM t2 ORDER BY 1;
c0	c7	c1	c2	c3	c4	c5	c6
3	NULL	1.2	2.2	中!文	a	1	11:11:11
4	NULL	1.3	3.2	中!文	a	1	11:11:11
5	NULL	1.4	4.2	中!文	a	1	11:11:11
6	2	1.6	6.2	中!文	c	3	13:13:13
#ON DELETE RESTRICT
DROP TABLE IF EXISTS t2;
DROP TABLE IF EXISTS t1;
CREATE TABLE t1(c0 INT(4) PRIMARY KEY,
c1 FLOAT UNIQUE,
c2 DOUBLE,
c3 CHAR(10),
c4 CHAR(10),
c5 INT,
c6 TIME);
INSERT INTO t1 VALUES(1,1.0,1.1,'中文','',0,'11:11:11'),
(2,1.1,1.2,'中!文','a',1,'11:11:11'),
(3,1.2,2.2,'中!文','a',1,'11:11:11'),
(4,1.3,3.2,'中!文','a',1,'11:11:11'),
(5,1.4,4.2,'中!文','a',1,'11:11:11');
CREATE TABLE t2(c0 INT(4),
c1 FLOAT UNIQUE,
c2 DOUBLE,
c3 CHAR(10),
c4 CHAR(10),
c5 INT,
c6 TIME,
CONSTRAINT fk_c0_c0 FOREIGN KEY(c0) REFERENCES t1(c0) ON DELETE RESTRICT);
INSERT INTO t2 VALUES(1,1.0,1.1,'中文','',0,'11:11:11'),
(2,1.1,1.2,'中!文','a',1,'11:11:11'),
(3,1.2,2.2,'中!文','a',1,'11:11:11'),
(4,1.3,3.2,'中!文','a',1,'11:11:11'),
(5,1.4,4.2,'中!文','a',1,'11:11:11');
ALTER TABLE t1 ADD c7 INT AFTER c0;
ALTER TABLE t2 ADD c7 INT AFTER c0;
INSERT INTO t1 VALUES(6,1,1.5,5.2,'中!文','b',2,'12:12:12');
SELECT * FROM t1 ORDER BY 1;
c0	c7	c1	c2	c3	c4	c5	c6
1	NULL	1	1.1	中文		0	11:11:11
2	NULL	1.1	1.2	中!文	a	1	11:11:11
3	NULL	1.2	2.2	中!文	a	1	11:11:11
4	NULL	1.3	3.2	中!文	a	1	11:11:11
5	NULL	1.4	4.2	中!文	a	1	11:11:11
6	1	1.5	5.2	中!文	b	2	12:12:12
SELECT * FROM t2 ORDER BY 1;
c0	c7	c1	c2	c3	c4	c5	c6
1	NULL	1	1.1	中文		0	11:11:11
2	NULL	1.1	1.2	中!文	a	1	11:11:11
3	NULL	1.2	2.2	中!文	a	1	11:11:11
4	NULL	1.3	3.2	中!文	a	1	11:11:11
5	NULL	1.4	4.2	中!文	a	1	11:11:11
UPDATE t1 SET c0=10 WHERE c5=0;
ERROR 23000: Cannot delete or update a parent row: a foreign key constraint fails
SELECT * FROM t1 ORDER BY 1;
c0	c7	c1	c2	c3	c4	c5	c6
1	NULL	1	1.1	中文		0	11:11:11
2	NULL	1.1	1.2	中!文	a	1	11:11:11
3	NULL	1.2	2.2	中!文	a	1	11:11:11
4	NULL	1.3	3.2	中!文	a	1	11:11:11
5	NULL	1.4	4.2	中!文	a	1	11:11:11
6	1	1.5	5.2	中!文	b	2	12:12:12
SELECT * FROM t2 ORDER BY 1;
c0	c7	c1	c2	c3	c4	c5	c6
1	NULL	1	1.1	中文		0	11:11:11
2	NULL	1.1	1.2	中!文	a	1	11:11:11
3	NULL	1.2	2.2	中!文	a	1	11:11:11
4	NULL	1.3	3.2	中!文	a	1	11:11:11
5	NULL	1.4	4.2	中!文	a	1	11:11:11
DELETE FROM t1 WHERE c0=1;
ERROR 23000: Cannot delete or update a parent row: a foreign key constraint fails
SELECT * FROM t1 ORDER BY 1;
c0	c7	c1	c2	c3	c4	c5	c6
1	NULL	1	1.1	中文		0	11:11:11
2	NULL	1.1	1.2	中!文	a	1	11:11:11
3	NULL	1.2	2.2	中!文	a	1	11:11:11
4	NULL	1.3	3.2	中!文	a	1	11:11:11
5	NULL	1.4	4.2	中!文	a	1	11:11:11
6	1	1.5	5.2	中!文	b	2	12:12:12
SELECT * FROM t2 ORDER BY 1;
c0	c7	c1	c2	c3	c4	c5	c6
1	NULL	1	1.1	中文		0	11:11:11
2	NULL	1.1	1.2	中!文	a	1	11:11:11
3	NULL	1.2	2.2	中!文	a	1	11:11:11
4	NULL	1.3	3.2	中!文	a	1	11:11:11
5	NULL	1.4	4.2	中!文	a	1	11:11:11
UPDATE t2 SET c0=11 WHERE c5=0;
ERROR 23000: Cannot add or update a child row: a foreign key constraint fails
SELECT * FROM t1 ORDER BY 1;
c0	c7	c1	c2	c3	c4	c5	c6
1	NULL	1	1.1	中文		0	11:11:11
2	NULL	1.1	1.2	中!文	a	1	11:11:11
3	NULL	1.2	2.2	中!文	a	1	11:11:11
4	NULL	1.3	3.2	中!文	a	1	11:11:11
5	NULL	1.4	4.2	中!文	a	1	11:11:11
6	1	1.5	5.2	中!文	b	2	12:12:12
SELECT * FROM t2 ORDER BY 1;
c0	c7	c1	c2	c3	c4	c5	c6
1	NULL	1	1.1	中文		0	11:11:11
2	NULL	1.1	1.2	中!文	a	1	11:11:11
3	NULL	1.2	2.2	中!文	a	1	11:11:11
4	NULL	1.3	3.2	中!文	a	1	11:11:11
5	NULL	1.4	4.2	中!文	a	1	11:11:11
DELETE FROM t2 WHERE c0=1;
SELECT * FROM t1 ORDER BY 1;
c0	c7	c1	c2	c3	c4	c5	c6
1	NULL	1	1.1	中文		0	11:11:11
2	NULL	1.1	1.2	中!文	a	1	11:11:11
3	NULL	1.2	2.2	中!文	a	1	11:11:11
4	NULL	1.3	3.2	中!文	a	1	11:11:11
5	NULL	1.4	4.2	中!文	a	1	11:11:11
6	1	1.5	5.2	中!文	b	2	12:12:12
SELECT * FROM t2 ORDER BY 1;
c0	c7	c1	c2	c3	c4	c5	c6
2	NULL	1.1	1.2	中!文	a	1	11:11:11
3	NULL	1.2	2.2	中!文	a	1	11:11:11
4	NULL	1.3	3.2	中!文	a	1	11:11:11
5	NULL	1.4	4.2	中!文	a	1	11:11:11
INSERT INTO t2 VALUES(6,2,1.6,6.2,'中!文','c',3,'13:13:13');
SELECT * FROM t1 ORDER BY 1;
c0	c7	c1	c2	c3	c4	c5	c6
1	NULL	1	1.1	中文		0	11:11:11
2	NULL	1.1	1.2	中!文	a	1	11:11:11
3	NULL	1.2	2.2	中!文	a	1	11:11:11
4	NULL	1.3	3.2	中!文	a	1	11:11:11
5	NULL	1.4	4.2	中!文	a	1	11:11:11
6	1	1.5	5.2	中!文	b	2	12:12:12
SELECT * FROM t2 ORDER BY 1;
c0	c7	c1	c2	c3	c4	c5	c6
2	NULL	1.1	1.2	中!文	a	1	11:11:11
3	NULL	1.2	2.2	中!文	a	1	11:11:11
4	NULL	1.3	3.2	中!文	a	1	11:11:11
5	NULL	1.4	4.2	中!文	a	1	11:11:11
6	2	1.6	6.2	中!文	c	3	13:13:13
INSERT INTO t2 VALUES(7,3,1.7,7.2,'中!文','d',4,'14:14:14');
ERROR 23000: Cannot add or update a child row: a foreign key constraint fails
SELECT * FROM t1 ORDER BY 1;
c0	c7	c1	c2	c3	c4	c5	c6
1	NULL	1	1.1	中文		0	11:11:11
2	NULL	1.1	1.2	中!文	a	1	11:11:11
3	NULL	1.2	2.2	中!文	a	1	11:11:11
4	NULL	1.3	3.2	中!文	a	1	11:11:11
5	NULL	1.4	4.2	中!文	a	1	11:11:11
6	1	1.5	5.2	中!文	b	2	12:12:12
SELECT * FROM t2 ORDER BY 1;
c0	c7	c1	c2	c3	c4	c5	c6
2	NULL	1.1	1.2	中!文	a	1	11:11:11
3	NULL	1.2	2.2	中!文	a	1	11:11:11
4	NULL	1.3	3.2	中!文	a	1	11:11:11
5	NULL	1.4	4.2	中!文	a	1	11:11:11
6	2	1.6	6.2	中!文	c	3	13:13:13
#无外键约束，新增列时添加外键约束，然后对表DML操作
#ON UPDATE CASCADE
DROP TABLE IF EXISTS t2;
DROP TABLE IF EXISTS t1;
CREATE TABLE t1(c0 INT(4) PRIMARY KEY,
c1 FLOAT UNIQUE,
c2 DOUBLE,
c3 CHAR(10),
c4 CHAR(10),
c5 INT,
c6 TIME);
INSERT INTO t1 VALUES(1,1.0,1.1,'中文','',0,'11:11:11'),
(2,1.1,1.2,'中!文','a',1,'11:11:11'),
(3,1.2,2.2,'中!文','a',1,'11:11:11'),
(4,1.3,3.2,'中!文','a',1,'11:11:11'),
(5,1.4,4.2,'中!文','a',1,'11:11:11');
CREATE TABLE t2(c0 INT(4),
c1 FLOAT UNIQUE,
c2 DOUBLE,
c3 CHAR(10),
c4 CHAR(10),
c5 INT,
c6 TIME);
INSERT INTO t2 VALUES(1,1.0,1.1,'中文','',0,'11:11:11'),
(2,1.1,1.2,'中!文','a',1,'11:11:11'),
(3,1.2,2.2,'中!文','a',1,'11:11:11'),
(4,1.3,3.2,'中!文','a',1,'11:11:11'),
(5,1.4,4.2,'中!文','a',1,'11:11:11');
#ON UPDATE RESTRICT
DROP TABLE IF EXISTS t2;
DROP TABLE IF EXISTS t1;
CREATE TABLE t1(c0 INT(4) PRIMARY KEY,
c1 FLOAT UNIQUE,
c2 DOUBLE,
c3 CHAR(10),
c4 CHAR(10),
c5 INT,
c6 TIME);
INSERT INTO t1 VALUES(1,1.0,1.1,'中文','',0,'11:11:11'),
(2,1.1,1.2,'中!文','a',1,'11:11:11'),
(3,1.2,2.2,'中!文','a',1,'11:11:11'),
(4,1.3,3.2,'中!文','a',1,'11:11:11'),
(5,1.4,4.2,'中!文','a',1,'11:11:11');
CREATE TABLE t2(c0 INT(4),
c1 FLOAT UNIQUE,
c2 DOUBLE,
c3 CHAR(10),
c4 CHAR(10),
c5 INT,
c6 TIME);
INSERT INTO t2 VALUES(1,1.0,1.1,'中文','',0,'11:11:11'),
(2,1.1,1.2,'中!文','a',1,'11:11:11'),
(3,1.2,2.2,'中!文','a',1,'11:11:11'),
(4,1.3,3.2,'中!文','a',1,'11:11:11'),
(5,1.4,4.2,'中!文','a',1,'11:11:11');
#ON DELETE CASCADE
DROP TABLE IF EXISTS t2;
DROP TABLE IF EXISTS t1;
CREATE TABLE t1(c0 INT(4) PRIMARY KEY,
c1 FLOAT UNIQUE,
c2 DOUBLE,
c3 CHAR(10),
c4 CHAR(10),
c5 INT,
c6 TIME);
INSERT INTO t1 VALUES(1,1.0,1.1,'中文','',0,'11:11:11'),
(2,1.1,1.2,'中!文','a',1,'11:11:11'),
(3,1.2,2.2,'中!文','a',1,'11:11:11'),
(4,1.3,3.2,'中!文','a',1,'11:11:11'),
(5,1.4,4.2,'中!文','a',1,'11:11:11');
CREATE TABLE t2(c0 INT(4),
c1 FLOAT UNIQUE,
c2 DOUBLE,
c3 CHAR(10),
c4 CHAR(10),
c5 INT,
c6 TIME);
INSERT INTO t2 VALUES(1,1.0,1.1,'中文','',0,'11:11:11'),
(2,1.1,1.2,'中!文','a',1,'11:11:11'),
(3,1.2,2.2,'中!文','a',1,'11:11:11'),
(4,1.3,3.2,'中!文','a',1,'11:11:11'),
(5,1.4,4.2,'中!文','a',1,'11:11:11');
#ON DELETE RESTRICT
DROP TABLE IF EXISTS t2;
DROP TABLE IF EXISTS t1;
CREATE TABLE t1(c0 INT(4) PRIMARY KEY,
c1 FLOAT UNIQUE,
c2 DOUBLE,
c3 CHAR(10),
c4 CHAR(10),
c5 INT,
c6 TIME);
INSERT INTO t1 VALUES(1,1.0,1.1,'中文','',0,'11:11:11'),
(2,1.1,1.2,'中!文','a',1,'11:11:11'),
(3,1.2,2.2,'中!文','a',1,'11:11:11'),
(4,1.3,3.2,'中!文','a',1,'11:11:11'),
(5,1.4,4.2,'中!文','a',1,'11:11:11');
CREATE TABLE t2(c0 INT(4),
c1 FLOAT UNIQUE,
c2 DOUBLE,
c3 CHAR(10),
c4 CHAR(10),
c5 INT,
c6 TIME);
INSERT INTO t2 VALUES(1,1.0,1.1,'中文','',0,'11:11:11'),
(2,1.1,1.2,'中!文','a',1,'11:11:11'),
(3,1.2,2.2,'中!文','a',1,'11:11:11'),
(4,1.3,3.2,'中!文','a',1,'11:11:11'),
(5,1.4,4.2,'中!文','a',1,'11:11:11');
#在生成列上创建唯一约束
#表中创建生成列并加上唯一约束，然后新增列后执行DML操作
DROP TABLE IF EXISTS t2;
DROP TABLE IF EXISTS t1;
CREATE TABLE t1(c0 INT(3),
c1 FLOAT,
c2 DOUBLE NOT NULL,
c3 CHAR(10) DEFAULT 'A',
c4 CHAR(10) AS (UPPER(c3)) VIRTUAL COMMENT '字符串生成列' UNIQUE,
c5 INT AS (c0*2) STORED COMMENT '数值生成列' UNIQUE,
c6 TIME);
INSERT INTO t1(c0,c1,c2,c3,c6) VALUES(1,1.0,1.1,'','11:11:11'),
(2,1.1,1.2,'a','11:11:11'),
(3,1.2,2.2,'b','11:11:11'),
(4,1.3,3.2,'c','11:11:11'),
(5,1.4,4.2,'d','11:11:11');
ALTER TABLE t1 ADD c7 VARCHAR(50) AFTER c4;
INSERT INTO t1(c0,c1,c2,c3,c6,c7) VALUES(6,1.5,5.2,'d','12:12:12','test1');
ERROR 23000: Duplicate entry 'D' for key 'c4'
INSERT INTO t1(c0,c1,c2,c3,c6,c7) VALUES(4,1.5,5.2,'e','12:12:12','test1');
ERROR 23000: Duplicate entry '8' for key 'c5'
INSERT INTO t1(c0,c1,c2,c3,c6,c7) VALUES(6,1.5,5.2,'e','12:12:12','test1');
SELECT * FROM t1 ORDER BY 1;
c0	c1	c2	c3	c4	c7	c5	c6
1	1	1.1			NULL	2	11:11:11
2	1.1	1.2	a	A	NULL	4	11:11:11
3	1.2	2.2	b	B	NULL	6	11:11:11
4	1.3	3.2	c	C	NULL	8	11:11:11
5	1.4	4.2	d	D	NULL	10	11:11:11
6	1.5	5.2	e	E	test1	12	12:12:12
UPDATE t1 SET c0=10,c3='f' WHERE c4='A' AND c5=4;
SELECT * FROM t1 ORDER BY 1;
c0	c1	c2	c3	c4	c7	c5	c6
1	1	1.1			NULL	2	11:11:11
3	1.2	2.2	b	B	NULL	6	11:11:11
4	1.3	3.2	c	C	NULL	8	11:11:11
5	1.4	4.2	d	D	NULL	10	11:11:11
6	1.5	5.2	e	E	test1	12	12:12:12
10	1.1	1.2	f	F	NULL	20	11:11:11
DELETE FROM t1 WHERE c4='F' AND c5=20;
SELECT * FROM t1 ORDER BY 1;
c0	c1	c2	c3	c4	c7	c5	c6
1	1	1.1			NULL	2	11:11:11
3	1.2	2.2	b	B	NULL	6	11:11:11
4	1.3	3.2	c	C	NULL	8	11:11:11
5	1.4	4.2	d	D	NULL	10	11:11:11
6	1.5	5.2	e	E	test1	12	12:12:12
#表中无生成列，新增列为生成列并加上唯一约束，然后执行DML操作
DROP TABLE IF EXISTS t1;
CREATE TABLE t1(c0 INT(3),
c1 FLOAT,
c2 DOUBLE NOT NULL,
c3 CHAR(10) DEFAULT 'A',
c4 CHAR(10),
c5 INT,
c6 TIME);
INSERT INTO t1 VALUES(1,1.0,1.1,'AA','a',0,'11:11:11'),
(2,1.1,1.2,'AA','a',1,'11:11:11'),
(3,1.2,2.2,'CC','b',2,'11:11:11'),
(4,1.3,3.2,'DD','c',3,'11:11:11'),
(5,1.4,4.2,'EE','d',4,'11:11:11');
#创建生成列，并在生成列上创建全局唯一索引，然后在新增列后执行DML操作
DROP TABLE IF EXISTS t1;
CREATE TABLE t1(c0 INT(3),
c1 FLOAT,
c2 DOUBLE NOT NULL,
c3 CHAR(10) DEFAULT 'A',
c4 CHAR(10) AS (UPPER(c3)) VIRTUAL COMMENT '字符串生成列',
c5 INT AS (c0*2) STORED COMMENT '数值生成列',
c6 TIME);
INSERT INTO t1(c0,c1,c2,c3,c6) VALUES(1,1.0,1.1,'','11:11:11'),
(2,1.1,1.2,'a','11:11:11'),
(3,1.2,2.2,'b','11:11:11'),
(4,1.3,3.2,'c','11:11:11'),
(5,1.4,4.2,'d','11:11:11');
CREATE UNIQUE INDEX uni_global ON t1(c4,c5) GLOBAL;
ALTER TABLE t1 ADD c7 VARCHAR(10) AFTER c3;
INSERT INTO t1(c0,c1,c2,c3,c6,c7) VALUES(5,1.4,4.2,'d','11:11:11','test1');
SELECT * FROM t1 ORDER BY 1;
c0	c1	c2	c3	c7	c4	c5	c6
1	1	1.1		NULL		2	11:11:11
2	1.1	1.2	a	NULL	A	4	11:11:11
3	1.2	2.2	b	NULL	B	6	11:11:11
4	1.3	3.2	c	NULL	C	8	11:11:11
5	1.4	4.2	d	NULL	D	10	11:11:11
INSERT INTO t1(c0,c1,c2,c3,c6,c7) VALUES(6,1.4,4.2,'d','11:11:11','test1'),(6,1.4,4.2,'e','11:11:11','test1');
SELECT * FROM t1 ORDER BY 1,4;
c0	c1	c2	c3	c7	c4	c5	c6
1	1	1.1		NULL		2	11:11:11
2	1.1	1.2	a	NULL	A	4	11:11:11
3	1.2	2.2	b	NULL	B	6	11:11:11
4	1.3	3.2	c	NULL	C	8	11:11:11
5	1.4	4.2	d	NULL	D	10	11:11:11
6	1.4	4.2	d	test1	D	12	11:11:11
6	1.4	4.2	e	test1	E	12	11:11:11
ALTER TABLE t1 DROP INDEX uni_global;
#在生成列基础上创建局部唯一索引，然后在新增列后执行DML操作
CREATE UNIQUE INDEX uni_local ON t1(c4,c5) LOCAL;
ALTER TABLE t1 ADD c8 INT AFTER c4;
INSERT INTO t1(c0,c1,c2,c3,c6,c7,c8) VALUES(6,1.4,4.2,'e','11:11:11','test1',0);
INSERT INTO t1(c0,c1,c2,c3,c6,c7,c8) VALUES(7,1.4,4.2,'e','11:11:11','test1',0),(7,1.4,4.2,'f','11:11:11','test1',0);
SELECT * FROM t1 ORDER BY 1,4;
c0	c1	c2	c3	c7	c4	c8	c5	c6
1	1	1.1		NULL		NULL	2	11:11:11
2	1.1	1.2	a	NULL	A	NULL	4	11:11:11
3	1.2	2.2	b	NULL	B	NULL	6	11:11:11
4	1.3	3.2	c	NULL	C	NULL	8	11:11:11
5	1.4	4.2	d	NULL	D	NULL	10	11:11:11
6	1.4	4.2	d	test1	D	NULL	12	11:11:11
6	1.4	4.2	e	test1	E	NULL	12	11:11:11
7	1.4	4.2	e	test1	E	0	14	11:11:11
7	1.4	4.2	f	test1	F	0	14	11:11:11
#创建生成列，并创建全局唯一索引，然后执行DML操作
DROP TABLE IF EXISTS t1;
CREATE TABLE t1(c0 INT(3),
c1 FLOAT,
c2 DOUBLE NOT NULL,
c3 CHAR(10) DEFAULT 'A',
c4 TIME);
INSERT INTO t1 VALUES(1,1.0,1.1,'','11:11:11'),
(2,1.1,1.2,'a','11:11:11'),
(3,1.2,2.2,'b','11:11:11'),
(4,1.3,3.2,'c','11:11:11'),
(5,1.4,4.2,'d','11:11:11');
ALTER TABLE t1 ADD c5 VARCHAR(10) AS (UPPER(c3)) VIRTUAL COMMENT '字符串生成列' AFTER c3;
CREATE UNIQUE INDEX uni_global ON t1(c3,c5) GLOBAL;
INSERT INTO t1(c0,c1,c2,c3,c4) VALUES(6,1.5,5.2,'d','15:15:15');
ERROR 23000: Duplicate entry 'd-D' for key 'uni_global'
SELECT * FROM t1 ORDER BY 1,2,3,4;
c0	c1	c2	c3	c5	c4
1	1	1.1			11:11:11
2	1.1	1.2	a	A	11:11:11
3	1.2	2.2	b	B	11:11:11
4	1.3	3.2	c	C	11:11:11
5	1.4	4.2	d	D	11:11:11
INSERT INTO t1(c0,c1,c2,c3,c4) VALUES(6,1.5,5.2,'e','15:15:15');
SELECT * FROM t1 ORDER BY 1,2,3,4;
c0	c1	c2	c3	c5	c4
1	1	1.1			11:11:11
2	1.1	1.2	a	A	11:11:11
3	1.2	2.2	b	B	11:11:11
4	1.3	3.2	c	C	11:11:11
5	1.4	4.2	d	D	11:11:11
6	1.5	5.2	e	E	15:15:15
ALTER TABLE t1 DROP INDEX uni_global;
#在生成列基础上创建局部唯一索引，然后在新增列后执行DML操作
ALTER TABLE t1 ADD c6 INT AS (2*c0) STORED COMMENT '数值生成列' AFTER c0;
#此处创建局部索引报错【ERROR 4103 (42000): Data checksum error】，开发在改，修改后执行
#在生成列上创建全局/局部索引,然后创建新增列
DROP TABLE IF EXISTS t1;
CREATE TABLE t1(c0 INT(3),
c1 FLOAT,
c2 DOUBLE NOT NULL,
c3 CHAR(10) DEFAULT 'A',
c4 CHAR(10) AS (UPPER(c3)) VIRTUAL COMMENT '字符串生成列',
c5 INT AS (c0*2) STORED COMMENT '数值生成列',
c6 TIME);
INSERT INTO t1(c0,c1,c2,c3,c6) VALUES(1,1.0,1.1,'','11:11:11'),
(2,1.1,1.2,'a','11:11:11'),
(3,1.2,2.2,'b','11:11:11'),
(4,1.3,3.2,'c','11:11:11'),
(5,1.4,4.2,'d','11:11:11');
CREATE INDEX global_ind ON t1(c5) GLOBAL
PARTITION BY RANGE(c5)
(PARTITION p1 VALUES LESS THAN(5),
PARTITION p2 VALUES LESS THAN(10),
PARTITION p3 VALUES LESS THAN(15)
);
ALTER TABLE t1 ADD c7 VARCHAR(10) AFTER c5;
INSERT INTO t1(c0,c1,c2,c3,c6,c7) VALUES(8,1.5,4.3,'e','12:12:12','test1');
ERROR HY000: Table has no partition for value
INSERT INTO t1(c0,c1,c2,c3,c6,c7) VALUES(7,1.5,4.3,'e','12:12:12','test1');
SELECT * FROM t1 ORDER BY 1;
c0	c1	c2	c3	c4	c5	c7	c6
1	1	1.1			2	NULL	11:11:11
2	1.1	1.2	a	A	4	NULL	11:11:11
3	1.2	2.2	b	B	6	NULL	11:11:11
4	1.3	3.2	c	C	8	NULL	11:11:11
5	1.4	4.2	d	D	10	NULL	11:11:11
7	1.5	4.3	e	E	14	test1	12:12:12
ALTER TABLE t1 DROP INDEX global_ind;
CREATE INDEX local_ind ON t1(c4) LOCAL;
ALTER TABLE t1 ADD c8 INT AFTER c0;
INSERT INTO t1(c0,c1,c2,c3,c6,c7,c8) VALUES(8,1.6,5.3,'f','13:13:13','test2',0);
SELECT * FROM t1 ORDER BY 1;
c0	c8	c1	c2	c3	c4	c5	c7	c6
1	NULL	1	1.1			2	NULL	11:11:11
2	NULL	1.1	1.2	a	A	4	NULL	11:11:11
3	NULL	1.2	2.2	b	B	6	NULL	11:11:11
4	NULL	1.3	3.2	c	C	8	NULL	11:11:11
5	NULL	1.4	4.2	d	D	10	NULL	11:11:11
7	NULL	1.5	4.3	e	E	14	test1	12:12:12
8	0	1.6	5.3	f	F	16	test2	13:13:13
#创建新增列为生成列，然后在新增列上创建全局/局部索引,最后执行DML操作
DROP TABLE IF EXISTS t1;
CREATE TABLE t1(c0 INT(3),
c1 FLOAT,
c2 DOUBLE NOT NULL,
c3 CHAR(10) DEFAULT 'A',
c4 TIME);
INSERT INTO t1 VALUES(1,1.0,1.1,'','11:11:11'),
(2,1.1,1.2,'a','11:11:11'),
(3,1.2,2.2,'b','11:11:11'),
(4,1.3,3.2,'c','11:11:11'),
(5,1.4,4.2,'d','11:11:11');
ALTER TABLE t1 ADD c5 VARCHAR(10) AS (UPPER(c3)) STORED COMMENT '字符串生成列';
CREATE INDEX global_ind ON t1(c5) GLOBAL
PARTITION BY LIST(c5)
(PARTITION p1 VALUES IN('A','B','C','D','E'),
PARTITION p2 VALUES IN('F','G','H','I','G'),
PARTITION p3 VALUES IN('K','L','M','N','O')
);
ERROR HY000: Field 'c5' is of a not allowed type for this type of partitioning
ALTER TABLE t1 ADD c6 INT AS (2*c0) VIRTUAL COMMENT '数值生成列';
CREATE INDEX global_ind ON t1(c6) GLOBAL
PARTITION BY RANGE(c6)
(PARTITION p1 VALUES LESS THAN(5),
PARTITION p2 VALUES LESS THAN(10),
PARTITION p3 VALUES LESS THAN(15)
);
INSERT INTO t1(c0,c1,c2,c3,c4) VALUES(8,1.5,5.2,'e','13:13:13');
ERROR HY000: Table has no partition for value
INSERT INTO t1(c0,c1,c2,c3,c4) VALUES(6,1.5,5.2,'e','13:13:13');
SELECT * FROM t1 ORDER BY 1;
c0	c1	c2	c3	c4	c5	c6
1	1	1.1		11:11:11		2
2	1.1	1.2	a	11:11:11	A	4
3	1.2	2.2	b	11:11:11	B	6
4	1.3	3.2	c	11:11:11	C	8
5	1.4	4.2	d	11:11:11	D	10
6	1.5	5.2	e	13:13:13	E	12
ALTER TABLE t1 DROP INDEX global_ind;
CREATE INDEX local_ind ON t1(c5,c6) LOCAL;
INSERT INTO t1(c0,c1,c2,c3,c4) VALUES(6,1.5,5.2,'e','13:13:13');
SELECT * FROM t1 ORDER BY 1;
c0	c1	c2	c3	c4	c5	c6
1	1	1.1		11:11:11		2
2	1.1	1.2	a	11:11:11	A	4
3	1.2	2.2	b	11:11:11	B	6
4	1.3	3.2	c	11:11:11	C	8
5	1.4	4.2	d	11:11:11	D	10
6	1.5	5.2	e	13:13:13	E	12
6	1.5	5.2	e	13:13:13	E	12
#不支持OB的MySQL模式创建函数索引，故不测试
#创建局部前缀、非前缀索引和全局前缀索引后，执行DDL操作 【OB目前不支持全局非前缀索引，故不测试】
DROP TABLE IF EXISTS t1;
CREATE TABLE t1(c0 INT,
c1 FLOAT ,
c2 DOUBLE,
c3 CHAR(10),
c4 VARCHAR(10),
c5 CHAR(10),
c6 INT,
c7 DATE,
c8 YEAR)
PARTITION BY RANGE COLUMNS(c4)
(PARTITION p1 VALUES LESS THAN('E'),
PARTITION p2 VALUES LESS THAN('J'),
PARTITION p3 VALUES LESS THAN('O'),
PARTITION p4 VALUES LESS THAN(MAXVALUE)
);
INSERT INTO t1 VALUES(1,1.0,1.1,'中文','','',0,'2010-10-11','1989'),
(2,1.1,1.2,'中!文','A','a',1,'2001-01-11','2001'),
(3,1.2,2.2,'中!文','B','b',2,'2016-02-11','2002'),
(4,1.3,3.2,'中!文','C','c',1,'2021-03-11','2003'),
(5,1.4,4.2,'中!文','D','d',2,'2011-11-01','2004'),
(6,1.5,5.2,'中!文','E','e',1,'2014-01-11','2005'),
(7,1.6,6.2,'中!文','F','f',3,'2011-11-01','2006'),
(8,1.7,7.2,'中!文','G','g',1,'2017-01-11','2007'),
(9,1.8,8.2,'中!文','H','h',4,'2013-11-01','2011'),
(10,1.9,9.2,'中!文','I','i',5,'2011-11-11','2013'),
(11,2.0,1.9,'中!文','J','j',6,'2015-01-01','2016'),
(12,2.1,1.8,'中!文','K','k',7,'2012-12-11','2016');
#创建局部前缀索引
CREATE INDEX loc_ind ON t1(c4,c5) LOCAL
PARTITION BY RANGE COLUMNS(c4)
(PARTITION p1 VALUES LESS THAN('E'),
PARTITION p2 VALUES LESS THAN('J'),
PARTITION p3 VALUES LESS THAN('O'),
PARTITION p4 VALUES LESS THAN(MAXVALUE)
);
ERROR 0A000: local index with partition option not supported
CREATE INDEX loc_ind ON t1(c4,c5) LOCAL;
ALTER TABLE t1 ADD c9 VARCHAR(10) DEFAULT 'AA' AFTER c4;
INSERT INTO t1 VALUES(13,2.2,1.7,'中!文','L','BB','l',8,'2018-12-18','2018');
SELECT /*+INDEX(t1 loc_ind) */ * FROM t1 ORDER BY 1;
c0	c1	c2	c3	c4	c9	c5	c6	c7	c8
1	1	1.1	中文		AA		0	2010-10-11	1989
2	1.1	1.2	中!文	A	AA	a	1	2001-01-11	2001
3	1.2	2.2	中!文	B	AA	b	2	2016-02-11	2002
4	1.3	3.2	中!文	C	AA	c	1	2021-03-11	2003
5	1.4	4.2	中!文	D	AA	d	2	2011-11-01	2004
6	1.5	5.2	中!文	E	AA	e	1	2014-01-11	2005
7	1.6	6.2	中!文	F	AA	f	3	2011-11-01	2006
8	1.7	7.2	中!文	G	AA	g	1	2017-01-11	2007
9	1.8	8.2	中!文	H	AA	h	4	2013-11-01	2011
10	1.9	9.2	中!文	I	AA	i	5	2011-11-11	2013
11	2	1.9	中!文	J	AA	j	6	2015-01-01	2016
12	2.1	1.8	中!文	K	AA	k	7	2012-12-11	2016
13	2.2	1.7	中!文	L	BB	l	8	2018-12-18	2018
ALTER TABLE t1 DROP INDEX loc_ind;
#创建局部非前缀索引
CREATE INDEX loc_non_ind ON t1(c3,c5) LOCAL
PARTITION BY RANGE COLUMNS(c5)
(PARTITION p1 VALUES LESS THAN('f'),
PARTITION p2 VALUES LESS THAN('l'),
PARTITION p3 VALUES LESS THAN('p'),
PARTITION p4 VALUES LESS THAN(MAXVALUE)
);
ERROR 0A000: local index with partition option not supported
CREATE INDEX loc_non_ind ON t1(c3,c5) LOCAL;
ALTER TABLE t1 ADD c10 INT(5) ZEROFILL DEFAULT 0 AFTER c3;
INSERT INTO t1 VALUES(14,2.3,1.6,'中!文',1,'M','CC','m',9,'2019-12-19','2019');
SELECT /*+INDEX(t1 loc_non_ind) */ * FROM t1 ORDER BY 1;
c0	c1	c2	c3	c10	c4	c9	c5	c6	c7	c8
1	1	1.1	中文	00000		AA		0	2010-10-11	1989
2	1.1	1.2	中!文	00000	A	AA	a	1	2001-01-11	2001
3	1.2	2.2	中!文	00000	B	AA	b	2	2016-02-11	2002
4	1.3	3.2	中!文	00000	C	AA	c	1	2021-03-11	2003
5	1.4	4.2	中!文	00000	D	AA	d	2	2011-11-01	2004
6	1.5	5.2	中!文	00000	E	AA	e	1	2014-01-11	2005
7	1.6	6.2	中!文	00000	F	AA	f	3	2011-11-01	2006
8	1.7	7.2	中!文	00000	G	AA	g	1	2017-01-11	2007
9	1.8	8.2	中!文	00000	H	AA	h	4	2013-11-01	2011
10	1.9	9.2	中!文	00000	I	AA	i	5	2011-11-11	2013
11	2	1.9	中!文	00000	J	AA	j	6	2015-01-01	2016
12	2.1	1.8	中!文	00000	K	AA	k	7	2012-12-11	2016
13	2.2	1.7	中!文	00000	L	BB	l	8	2018-12-18	2018
14	2.3	1.6	中!文	00001	M	CC	m	9	2019-12-19	2019
ALTER TABLE t1 DROP INDEX loc_non_ind;
#创建全局前缀索引
CREATE INDEX global_ind ON t1(c4,c5) GLOBAL
PARTITION BY RANGE COLUMNS(c4)
(PARTITION p1 VALUES LESS THAN('E'),
PARTITION p2 VALUES LESS THAN('J'),
PARTITION p3 VALUES LESS THAN('O'),
PARTITION p4 VALUES LESS THAN(MAXVALUE)
);
ALTER TABLE t1 ADD c11 VARCHAR(10) DEFAULT 'A' AFTER c4;
INSERT INTO t1 VALUES(15,2.4,1.5,'中!文',2,'N','B','DD','n',10,'2020-02-20','2020');
SELECT /*+INDEX(t1 global_ind) */ * FROM t1 ORDER BY 1;
c0	c1	c2	c3	c10	c4	c11	c9	c5	c6	c7	c8
1	1	1.1	中文	00000		A	AA		0	2010-10-11	1989
2	1.1	1.2	中!文	00000	A	A	AA	a	1	2001-01-11	2001
3	1.2	2.2	中!文	00000	B	A	AA	b	2	2016-02-11	2002
4	1.3	3.2	中!文	00000	C	A	AA	c	1	2021-03-11	2003
5	1.4	4.2	中!文	00000	D	A	AA	d	2	2011-11-01	2004
6	1.5	5.2	中!文	00000	E	A	AA	e	1	2014-01-11	2005
7	1.6	6.2	中!文	00000	F	A	AA	f	3	2011-11-01	2006
8	1.7	7.2	中!文	00000	G	A	AA	g	1	2017-01-11	2007
9	1.8	8.2	中!文	00000	H	A	AA	h	4	2013-11-01	2011
10	1.9	9.2	中!文	00000	I	A	AA	i	5	2011-11-11	2013
11	2	1.9	中!文	00000	J	A	AA	j	6	2015-01-01	2016
12	2.1	1.8	中!文	00000	K	A	AA	k	7	2012-12-11	2016
13	2.2	1.7	中!文	00000	L	A	BB	l	8	2018-12-18	2018
14	2.3	1.6	中!文	00001	M	A	CC	m	9	2019-12-19	2019
15	2.4	1.5	中!文	00002	N	B	DD	n	10	2020-02-20	2020
ALTER TABLE t1 DROP INDEX global_ind;
#创建唯一全局索引
ALTER TABLE t1 ADD CONSTRAINT uni_key UNIQUE KEY (c1,c4,c5);
CREATE UNIQUE INDEX global_uni_ind ON t1(c4,c5) USING BTREE GLOBAL COMMENT '唯一全局索引'
PARTITION BY RANGE COLUMNS(c4)
(PARTITION p1 VALUES LESS THAN('E'),
PARTITION p2 VALUES LESS THAN('J'),
PARTITION p3 VALUES LESS THAN('O'),
PARTITION p4 VALUES LESS THAN(MAXVALUE)
);
ALTER TABLE t1 ADD c12 INT(5) ZEROFILL AFTER c4;
INSERT INTO t1 VALUES(16,2.5,1.4,'中!文',3,'O',3,'C','EE','n',11,'2021-12-21','2021');
SELECT /*+INDEX(t1 global_uni_ind) */ * FROM t1 ORDER BY 1;
c0	c1	c2	c3	c10	c4	c12	c11	c9	c5	c6	c7	c8
1	1	1.1	中文	00000		NULL	A	AA		0	2010-10-11	1989
2	1.1	1.2	中!文	00000	A	NULL	A	AA	a	1	2001-01-11	2001
3	1.2	2.2	中!文	00000	B	NULL	A	AA	b	2	2016-02-11	2002
4	1.3	3.2	中!文	00000	C	NULL	A	AA	c	1	2021-03-11	2003
5	1.4	4.2	中!文	00000	D	NULL	A	AA	d	2	2011-11-01	2004
6	1.5	5.2	中!文	00000	E	NULL	A	AA	e	1	2014-01-11	2005
7	1.6	6.2	中!文	00000	F	NULL	A	AA	f	3	2011-11-01	2006
8	1.7	7.2	中!文	00000	G	NULL	A	AA	g	1	2017-01-11	2007
9	1.8	8.2	中!文	00000	H	NULL	A	AA	h	4	2013-11-01	2011
10	1.9	9.2	中!文	00000	I	NULL	A	AA	i	5	2011-11-11	2013
11	2	1.9	中!文	00000	J	NULL	A	AA	j	6	2015-01-01	2016
12	2.1	1.8	中!文	00000	K	NULL	A	AA	k	7	2012-12-11	2016
13	2.2	1.7	中!文	00000	L	NULL	A	BB	l	8	2018-12-18	2018
14	2.3	1.6	中!文	00001	M	NULL	A	CC	m	9	2019-12-19	2019
15	2.4	1.5	中!文	00002	N	NULL	B	DD	n	10	2020-02-20	2020
16	2.5	1.4	中!文	00003	O	00003	C	EE	n	11	2021-12-21	2021
INSERT INTO t1 VALUES(17,2.6,1.3,'中!文',4,'O',4,'D','FF','n',12,'2022-12-22','2022');
ERROR 23000: Duplicate entry 'O-n' for key 'global_uni_ind'
#创建唯一局部索引
DROP TABLE IF EXISTS t1;
CREATE TABLE t1(c0 INT,
c1 FLOAT ,
c2 DOUBLE,
c3 CHAR(10),
c4 VARCHAR(10),
c5 CHAR(10),
c6 INT,
c7 DATE,
c8 YEAR)
PARTITION BY RANGE COLUMNS(c4)
(PARTITION p1 VALUES LESS THAN('E'),
PARTITION p2 VALUES LESS THAN('J'),
PARTITION p3 VALUES LESS THAN('O'),
PARTITION p4 VALUES LESS THAN(MAXVALUE)
);
INSERT INTO t1 VALUES(1,1.0,1.1,'中文','','',0,'2010-10-11','1989'),
(2,1.1,1.2,'中!文','A','a',1,'2001-01-11','2001'),
(3,1.2,2.2,'中!文','B','b',2,'2016-02-11','2002'),
(4,1.3,3.2,'中!文','C','c',1,'2021-03-11','2003'),
(5,1.4,4.2,'中!文','D','d',2,'2011-11-01','2004'),
(6,1.5,5.2,'中!文','E','e',1,'2014-01-11','2005'),
(7,1.6,6.2,'中!文','F','f',3,'2011-11-01','2006'),
(8,1.7,7.2,'中!文','G','g',1,'2017-01-11','2007'),
(9,1.8,8.2,'中!文','H','h',4,'2013-11-01','2011'),
(10,1.9,9.2,'中!文','I','i',5,'2011-11-11','2013'),
(11,2.0,1.9,'中!文','J','j',6,'2015-01-01','2016'),
(12,2.1,1.8,'中!文','K','k',7,'2012-12-11','2016');
ALTER TABLE t1 ADD CONSTRAINT uni_key UNIQUE KEY (c1,c4,c5);
CREATE UNIQUE INDEX local_uni_ind ON t1(c4,c5) USING BTREE LOCAL COMMENT '唯一局部索引'
PARTITION BY RANGE COLUMNS(c4)
(PARTITION p1 VALUES LESS THAN('E'),
PARTITION p2 VALUES LESS THAN('J'),
PARTITION p3 VALUES LESS THAN('O'),
PARTITION p4 VALUES LESS THAN(MAXVALUE)
);
ERROR 0A000: local index with partition option not supported
CREATE UNIQUE INDEX local_uni_ind ON t1(c4,c5) USING BTREE LOCAL COMMENT '唯一局部索引';
ALTER TABLE t1 ADD c9 VARCHAR(10) DEFAULT 'AA' AFTER c4;
INSERT INTO t1 VALUES(13,2.2,1.7,'中!文','L','BB','l',8,'2018-12-18','2018');
SELECT /*+INDEX(t1 local_uni_ind) */ * FROM t1 ORDER BY 1;
c0	c1	c2	c3	c4	c9	c5	c6	c7	c8
1	1	1.1	中文		AA		0	2010-10-11	1989
2	1.1	1.2	中!文	A	AA	a	1	2001-01-11	2001
3	1.2	2.2	中!文	B	AA	b	2	2016-02-11	2002
4	1.3	3.2	中!文	C	AA	c	1	2021-03-11	2003
5	1.4	4.2	中!文	D	AA	d	2	2011-11-01	2004
6	1.5	5.2	中!文	E	AA	e	1	2014-01-11	2005
7	1.6	6.2	中!文	F	AA	f	3	2011-11-01	2006
8	1.7	7.2	中!文	G	AA	g	1	2017-01-11	2007
9	1.8	8.2	中!文	H	AA	h	4	2013-11-01	2011
10	1.9	9.2	中!文	I	AA	i	5	2011-11-11	2013
11	2	1.9	中!文	J	AA	j	6	2015-01-01	2016
12	2.1	1.8	中!文	K	AA	k	7	2012-12-11	2016
13	2.2	1.7	中!文	L	BB	l	8	2018-12-18	2018
INSERT INTO t1 VALUES(14,2.3,1.6,'中!文','L','CC','l',9,'2019-12-19','2019');
ERROR 23000: Duplicate entry 'L-l' for key 'local_uni_ind'
#新增列后使用不同的函数/运算符
DROP TABLE IF EXISTS t1;
CREATE TABLE t1(c0 INT,
c1 FLOAT ,
c2 DOUBLE,
c3 CHAR(10),
c4 VARCHAR(10),
c5 CHAR(10),
c6 INT,
c7 DATE,
c8 YEAR)
PARTITION BY RANGE COLUMNS(c4)
(PARTITION p1 VALUES LESS THAN('E'),
PARTITION p2 VALUES LESS THAN('J'),
PARTITION p3 VALUES LESS THAN('O'),
PARTITION p4 VALUES LESS THAN(MAXVALUE)
);
INSERT INTO t1 VALUES(1,1.0,1.1,'中文','','',0,'2010-10-11','1989'),
(2,1.1,1.2,'中!文','A','a',1,'2001-01-11','2001'),
(3,1.2,2.2,'中!文','B','b',2,'2016-02-11','2002'),
(4,1.3,3.2,'中!文','C','c',1,'2021-03-11','2003'),
(5,1.4,4.2,'中!文','D','d',2,'2011-11-01','2004'),
(6,1.5,5.2,'中!文','E','e',1,'2014-01-11','2005'),
(7,1.6,6.2,'中!文','F','f',3,'2011-11-01','2006'),
(8,1.7,7.2,'中!文','G','g',1,'2017-01-11','2007'),
(9,1.8,8.2,'中!文','H','h',4,'2013-11-01','2011'),
(10,1.9,9.2,'中!文','I','i',5,'2011-11-11','2013'),
(11,2.0,1.9,'中!文','J','j',6,'2015-01-01','2016'),
(12,2.1,1.8,'中!文','K','k',7,'2012-12-11','2016');
#修改列属性及顺序后使用函数
ALTER TABLE t1 ADD c10 INT(4) ZEROFILL AS (2*c6) AFTER c0;
SELECT MOD(c10,2) 'c10列取余', 2*c10 'c10列的2倍值', c10 DIV(2) 'c10列的商数' FROM t1 ORDER BY 1,2,3;
c10列取余	c10列的2倍值	c10列的商数
0	0	0
0	4	1
0	4	1
0	4	1
0	4	1
0	8	2
0	8	2
0	12	3
0	16	4
0	20	5
0	24	6
0	28	7
SELECT c10 FROM t1 WHERE c10>3 AND c10 IN(4,6) ORDER BY 1;
c10
0004
0004
0006
SELECT @var1 := MIN(c10) 'c10列赋值给变量var1' FROM t1;
c10列赋值给变量var1
0
SELECT AVG(c10) 'c10列平均值',MAX(c10) 'C6列最大值',SUM(c10) 'c10列合计值' FROM t1;
c10列平均值	C6列最大值	c10列合计值
5.5000	14	66
SELECT TIME(c10) 'c10列使用时间函数1',YEAR(c10) 'c10列使用时间函数2',HOUR(c10) 'c10列使用时间函数3' FROM t1 ORDER BY 1;
c10列使用时间函数1	c10列使用时间函数2	c10列使用时间函数3
00:00:00	0	0
00:00:02	NULL	0
00:00:02	NULL	0
00:00:02	NULL	0
00:00:02	NULL	0
00:00:04	NULL	0
00:00:04	NULL	0
00:00:06	NULL	0
00:00:08	NULL	0
00:00:10	NULL	0
00:00:12	NULL	0
00:00:14	NULL	0
SELECT BIN(c10),ASCII(c10),CONCAT(c10,c5) FROM t1 ORDER BY 1,2,3;
BIN(c10)	ASCII(c10)	CONCAT(c10,c5)
0	48	0000
10	48	0002a
10	48	0002c
10	48	0002e
10	48	0002g
100	48	0004b
100	48	0004d
1000	48	0008h
1010	48	0010i
110	48	0006f
1100	48	0012j
1110	48	0014k
SELECT GREATEST(c10,c0) FROM t1 ORDER BY 1;
GREATEST(c10,c0)
1
2
4
4
5
6
7
8
9
10
12
14
SELECT CASE 1000*c10 WHEN 1000*c10 > 5000 THEN 'A' ELSE 'B' END FROM t1 ORDER BY 1;
CASE 1000*c10 WHEN 1000*c10 > 5000 THEN 'A' ELSE 'B' END
A
B
B
B
B
B
B
B
B
B
B
B
SELECT MD5(c10) 'c10列加密' FROM t1 ORDER BY 1;
c10列加密
29150bb2319c182c944841c74d2f8d75
4a7d1ed414474e4033ac29ccb8653d9b
7f8bb0fe8b33780a08fe6b60ced14529
926abae84a4bd33c834bc6b981b8cf30
95b09698fda1f64af16708ffb859eab9
95b09698fda1f64af16708ffb859eab9
b6fb522815d06fed82b0140be4c74680
fc1198178c3594bfdda3ca2996eb65cb
fcd04e26e900e94b9ed6dd604fed2b64
fcd04e26e900e94b9ed6dd604fed2b64
fcd04e26e900e94b9ed6dd604fed2b64
fcd04e26e900e94b9ed6dd604fed2b64
SELECT CHARSET(c10) FROM t1;
CHARSET(c10)
binary
binary
binary
binary
binary
binary
binary
binary
binary
binary
binary
binary
SELECT ANY_VALUE(c10) FROM t1 GROUP BY c3 ORDER BY 1;
ANY_VALUE(c10)
0
2
DROP TABLE IF EXISTS t2;
DROP TABLE IF EXISTS t1;
#########Empty recycle bin, delete test database, tables, etc##########
purge recyclebin;
