purge recyclebin;
DROP TABLE IF EXISTS t1;
DROP TABLE IF EXISTS t2;
#mysql_add-4
#mysql_add-4-3
#mysql_add-4-3-1
#单基表试图
#基表带有不同类型数据和不同约束以及不同索引
#CREATE DATA (DATA TYPE + INDEX + CONSTRAINT)
CREATE TABLE t1(c0 INT(5) ZEROFILL,
c1 FLOAT AUTO_INCREMENT PRIMARY KEY,
c2 DOUBLE NOT NULL,
c3 CHAR(10) DEFAULT 'A',
c4 VARCHAR(10) UNIQUE,
c5 CHAR(10),
c6 INT,
c7 TIME,
c8 YEAR ,CHECK(c8>=2000));
INSERT INTO t1 VALUES(1,1.0,1.1,'中文','','',0,'11:11:11','2000'),
(2,1.1,1.2,'中!文','A','a',1,'11:11:11','2001'),
(3,1.2,2.2,'中!文','B','a',1,'11:11:11','2002'),
(4,1.3,3.2,'中!文','C','a',1,'11:11:11','2003'),
(5,1.4,4.2,'中!文','D','a',1,'11:11:11','2004'),
(6,1.5,5.2,'中!文','E','a',1,'11:11:11','2005'),
(7,1.6,6.2,'中!文','F','a',1,'11:11:11','2006'),
(8,1.7,7.2,'中!文','G','a',1,'11:11:11','2007'),
(9,1.8,8.2,'中!文','H','a',1,'11:11:11','2011'),
(10,1.9,9.2,'中!文','I','a',1,'11:11:11','2012'),
(11,2.0,1.9,'中!文','J','a',1,'11:11:11','2011'),
(12,2.1,1.8,'中!文','K','a',1,'11:11:11','2012');
drop view v1;
CREATE VIEW v1 AS SELECT * FROM t1;
SELECT * FROM v1 ORDER BY c0;
c0	c1	c2	c3	c4	c5	c6	c7	c8
00001	1	1.1	中文			0	11:11:11	2000
00002	1.1	1.2	中!文	A	a	1	11:11:11	2001
00003	1.2	2.2	中!文	B	a	1	11:11:11	2002
00004	1.3	3.2	中!文	C	a	1	11:11:11	2003
00005	1.4	4.2	中!文	D	a	1	11:11:11	2004
00006	1.5	5.2	中!文	E	a	1	11:11:11	2005
00007	1.6	6.2	中!文	F	a	1	11:11:11	2006
00008	1.7	7.2	中!文	G	a	1	11:11:11	2007
00009	1.8	8.2	中!文	H	a	1	11:11:11	2011
00010	1.9	9.2	中!文	I	a	1	11:11:11	2012
00011	2	1.9	中!文	J	a	1	11:11:11	2011
00012	2.1	1.8	中!文	K	a	1	11:11:11	2012
DESC v1;
Field	Type	Null	Key	Default	Extra
c0	int(5) unsigned	YES		NULL	
c1	float	NO		NULL	
c2	double	NO		NULL	
c3	char(10)	YES			
c4	varchar(10)	YES		NULL	
c5	char(10)	YES		NULL	
c6	int(11)	YES		NULL	
c7	time	YES		NULL	
c8	year(4)	YES		NULL	
SHOW INDEX FROM v1;
Table	Non_unique	Key_name	Seq_in_index	Column_name	Collation	Cardinality	Sub_part	Packed	Null	Index_type	Comment	Index_comment	Visible	Expression
ALTER TABLE v1 ADD c9 INT;
ERROR HY000: 'test.v1' is not BASE TABLE
ALTER TABLE v1 ADD c9 INT,ADD c10 INT,ADD c11 INT,ADD c12 INT,ADD c13 INT;
ERROR HY000: 'test.v1' is not BASE TABLE
ALTER TABLE t1 ADD c9 INT;
DESC v1;
Field	Type	Null	Key	Default	Extra
c0	int(5) unsigned	YES		NULL	
c1	float	NO		NULL	
c2	double	NO		NULL	
c3	char(10)	YES			
c4	varchar(10)	YES		NULL	
c5	char(10)	YES		NULL	
c6	int(11)	YES		NULL	
c7	time	YES		NULL	
c8	year(4)	YES		NULL	
INSERT INTO v1 VALUES(13,2.2,1.7,'中!文','L','b',2,'21:21:21','2013',0);
ERROR 21S01: Column count doesn't match value count at row 1
INSERT INTO v1 VALUES(13,2.2,1.7,'中!文','L','b',2,'21:21:21','2013');
SELECT * FROM v1 ORDER BY c0;
c0	c1	c2	c3	c4	c5	c6	c7	c8
00001	1	1.1	中文			0	11:11:11	2000
00002	1.1	1.2	中!文	A	a	1	11:11:11	2001
00003	1.2	2.2	中!文	B	a	1	11:11:11	2002
00004	1.3	3.2	中!文	C	a	1	11:11:11	2003
00005	1.4	4.2	中!文	D	a	1	11:11:11	2004
00006	1.5	5.2	中!文	E	a	1	11:11:11	2005
00007	1.6	6.2	中!文	F	a	1	11:11:11	2006
00008	1.7	7.2	中!文	G	a	1	11:11:11	2007
00009	1.8	8.2	中!文	H	a	1	11:11:11	2011
00010	1.9	9.2	中!文	I	a	1	11:11:11	2012
00011	2	1.9	中!文	J	a	1	11:11:11	2011
00012	2.1	1.8	中!文	K	a	1	11:11:11	2012
00013	2.2	1.7	中!文	L	b	2	21:21:21	2013
SELECT * FROM t1 ORDER BY c0;
c0	c1	c2	c3	c4	c5	c6	c7	c8	c9
00001	1	1.1	中文			0	11:11:11	2000	NULL
00002	1.1	1.2	中!文	A	a	1	11:11:11	2001	NULL
00003	1.2	2.2	中!文	B	a	1	11:11:11	2002	NULL
00004	1.3	3.2	中!文	C	a	1	11:11:11	2003	NULL
00005	1.4	4.2	中!文	D	a	1	11:11:11	2004	NULL
00006	1.5	5.2	中!文	E	a	1	11:11:11	2005	NULL
00007	1.6	6.2	中!文	F	a	1	11:11:11	2006	NULL
00008	1.7	7.2	中!文	G	a	1	11:11:11	2007	NULL
00009	1.8	8.2	中!文	H	a	1	11:11:11	2011	NULL
00010	1.9	9.2	中!文	I	a	1	11:11:11	2012	NULL
00011	2	1.9	中!文	J	a	1	11:11:11	2011	NULL
00012	2.1	1.8	中!文	K	a	1	11:11:11	2012	NULL
00013	2.2	1.7	中!文	L	b	2	21:21:21	2013	NULL
DROP TABLE t1;
CREATE TABLE t1(c0 INT(5) ZEROFILL,
c1 FLOAT AUTO_INCREMENT PRIMARY KEY,
c2 DOUBLE NOT NULL,
c3 CHAR(10) DEFAULT 'A',
c4 VARCHAR(10) UNIQUE,
c5 CHAR(10),
c6 INT,
c7 TIME,
c8 YEAR ,CHECK(c8>=2000));
INSERT INTO t1 VALUES(1,1.0,1.1,'中文','','',0,'11:11:11','2000'),
(2,1.1,1.2,'中!文','A','a',1,'11:11:11','2001'),
(3,1.2,2.2,'中!文','B','a',1,'11:11:11','2002'),
(4,1.3,3.2,'中!文','C','a',1,'11:11:11','2003'),
(5,1.4,4.2,'中!文','D','a',1,'11:11:11','2004'),
(6,1.5,5.2,'中!文','E','a',1,'11:11:11','2005'),
(7,1.6,6.2,'中!文','F','a',1,'11:11:11','2006'),
(8,1.7,7.2,'中!文','G','a',1,'11:11:11','2007'),
(9,1.8,8.2,'中!文','H','a',1,'11:11:11','2011'),
(10,1.9,9.2,'中!文','I','a',1,'11:11:11','2012'),
(11,2.0,1.9,'中!文','J','a',1,'11:11:11','2011'),
(12,2.1,1.8,'中!文','K','a',1,'11:11:11','2012');
DROP VIEW v1;
CREATE VIEW v1 AS SELECT * FROM t1;
SELECT * FROM v1 ORDER BY c0;
c0	c1	c2	c3	c4	c5	c6	c7	c8
00001	1	1.1	中文			0	11:11:11	2000
00002	1.1	1.2	中!文	A	a	1	11:11:11	2001
00003	1.2	2.2	中!文	B	a	1	11:11:11	2002
00004	1.3	3.2	中!文	C	a	1	11:11:11	2003
00005	1.4	4.2	中!文	D	a	1	11:11:11	2004
00006	1.5	5.2	中!文	E	a	1	11:11:11	2005
00007	1.6	6.2	中!文	F	a	1	11:11:11	2006
00008	1.7	7.2	中!文	G	a	1	11:11:11	2007
00009	1.8	8.2	中!文	H	a	1	11:11:11	2011
00010	1.9	9.2	中!文	I	a	1	11:11:11	2012
00011	2	1.9	中!文	J	a	1	11:11:11	2011
00012	2.1	1.8	中!文	K	a	1	11:11:11	2012
DESC v1;
Field	Type	Null	Key	Default	Extra
c0	int(5) unsigned	YES		NULL	
c1	float	NO		NULL	
c2	double	NO		NULL	
c3	char(10)	YES			
c4	varchar(10)	YES		NULL	
c5	char(10)	YES		NULL	
c6	int(11)	YES		NULL	
c7	time	YES		NULL	
c8	year(4)	YES		NULL	
SHOW INDEX FROM v1;
Table	Non_unique	Key_name	Seq_in_index	Column_name	Collation	Cardinality	Sub_part	Packed	Null	Index_type	Comment	Index_comment	Visible	Expression
#多基表试图
DROP VIEW IF EXISTS v1;
DROP TABLE IF EXISTS t2;
DROP TABLE IF EXISTS t1;
CREATE TABLE t1(c0 INT(5) PRIMARY KEY,
c1 FLOAT ,
c2 DOUBLE NOT NULL,
c3 CHAR(10) DEFAULT 'A',
c4 VARCHAR(10) UNIQUE,
c5 CHAR(10),
c6 INT,
c7 TIME,
c8 YEAR ,CHECK(c8>=2000));
CREATE TABLE t2(c0 INT(5),
c1 FLOAT,
c2 DOUBLE NOT NULL,
c3 CHAR(10) DEFAULT 'A',
c4 VARCHAR(10) UNIQUE,
c5 CHAR(10),
c6 INT,
c7 TIME,
c8 YEAR ,CHECK(c8>=2000),
CONSTRAINT fk_c0_c0 FOREIGN KEY(c0) REFERENCES t1(c0));
INSERT INTO t1 VALUES(1,1.0,1.1,'中文','','',0,'11:11:11','2000'),
(2,1.1,1.2,'中!文','A','a',1,'11:11:11','2001'),
(3,1.2,2.2,'中!文','B','a',1,'11:11:11','2002'),
(4,1.3,3.2,'中!文','C','a',1,'11:11:11','2003'),
(5,1.4,4.2,'中!文','D','a',1,'11:11:11','2004'),
(6,1.5,5.2,'中!文','E','a',1,'11:11:11','2005'),
(7,1.6,6.2,'中!文','F','a',1,'11:11:11','2006'),
(8,1.7,7.2,'中!文','G','a',1,'11:11:11','2007'),
(9,1.8,8.2,'中!文','H','a',1,'11:11:11','2011'),
(10,1.9,9.2,'中!文','I','a',1,'11:11:11','2012'),
(11,2.0,1.9,'中!文','J','a',1,'11:11:11','2011'),
(12,2.1,1.8,'中!文','K','a',1,'11:11:11','2012');
INSERT INTO t2 VALUES(1,1.0,1.1,'中文','','',0,'11:11:11','2000'),
(2,1.1,1.2,'中!文','A','a',1,'11:11:11','2001'),
(3,1.2,2.2,'中!文','B','a',1,'11:11:11','2002'),
(4,1.3,3.2,'中!文','C','a',1,'11:11:11','2003'),
(5,1.4,4.2,'中!文','D','a',1,'11:11:11','2004'),
(6,1.5,5.2,'中!文','E','a',1,'11:11:11','2005'),
(7,1.6,6.2,'中!文','F','a',1,'11:11:11','2006'),
(8,1.7,7.2,'中!文','G','a',1,'11:11:11','2007'),
(9,1.8,8.2,'中!文','H','a',1,'11:11:11','2011'),
(10,1.9,9.2,'中!文','I','a',1,'11:11:11','2012'),
(11,2.0,1.9,'中!文','J','a',1,'11:11:11','2011'),
(12,2.1,1.8,'中!文','K','a',1,'11:11:11','2012');
CREATE INDEX ind_1 ON t1(c5);
CREATE INDEX ind_2 ON t2(c6,c7);
CREATE VIEW v1 AS SELECT t1.c0,t2.c1,t1.c3,t2.c4,t1.c5,t2.c6,t1.c7,t2.c8 FROM t1 JOIN t2 ON t1.c0=t2.c0;
SELECT * FROM v1 ORDER BY 1;
c0	c1	c3	c4	c5	c6	c7	c8
1	1	中文			0	11:11:11	2000
2	1.1	中!文	A	a	1	11:11:11	2001
3	1.2	中!文	B	a	1	11:11:11	2002
4	1.3	中!文	C	a	1	11:11:11	2003
5	1.4	中!文	D	a	1	11:11:11	2004
6	1.5	中!文	E	a	1	11:11:11	2005
7	1.6	中!文	F	a	1	11:11:11	2006
8	1.7	中!文	G	a	1	11:11:11	2007
9	1.8	中!文	H	a	1	11:11:11	2011
10	1.9	中!文	I	a	1	11:11:11	2012
11	2	中!文	J	a	1	11:11:11	2011
12	2.1	中!文	K	a	1	11:11:11	2012
DESC v1;
Field	Type	Null	Key	Default	Extra
c0	int(5)	NO		NULL	
c1	float	YES		NULL	
c3	char(10)	YES			
c4	varchar(10)	YES		NULL	
c5	char(10)	YES		NULL	
c6	int(11)	YES		NULL	
c7	time	YES		NULL	
c8	year(4)	YES		NULL	
SHOW INDEX FROM v1;
Table	Non_unique	Key_name	Seq_in_index	Column_name	Collation	Cardinality	Sub_part	Packed	Null	Index_type	Comment	Index_comment	Visible	Expression
ALTER TABLE v1 ADD c9 INT;
ERROR HY000: 'test.v1' is not BASE TABLE
ALTER TABLE t2 ADD c9 INT NOT NULL;
DESC t2;
Field	Type	Null	Key	Default	Extra
c0	int(5)	YES		NULL	
c1	float	YES		NULL	
c2	double	NO		NULL	
c3	char(10)	YES		A	
c4	varchar(10)	YES	UNI	NULL	
c5	char(10)	YES		NULL	
c6	int(11)	YES	MUL	NULL	
c7	time	YES		NULL	
c8	year(4)	YES		NULL	
c9	int(11)	NO		NULL	
DESC v1;
Field	Type	Null	Key	Default	Extra
c0	int(5)	NO		NULL	
c1	float	YES		NULL	
c3	char(10)	YES			
c4	varchar(10)	YES		NULL	
c5	char(10)	YES		NULL	
c6	int(11)	YES		NULL	
c7	time	YES		NULL	
c8	year(4)	YES		NULL	
SELECT * FROM v1 ORDER BY 1;
c0	c1	c3	c4	c5	c6	c7	c8
1	1	中文			0	11:11:11	2000
2	1.1	中!文	A	a	1	11:11:11	2001
3	1.2	中!文	B	a	1	11:11:11	2002
4	1.3	中!文	C	a	1	11:11:11	2003
5	1.4	中!文	D	a	1	11:11:11	2004
6	1.5	中!文	E	a	1	11:11:11	2005
7	1.6	中!文	F	a	1	11:11:11	2006
8	1.7	中!文	G	a	1	11:11:11	2007
9	1.8	中!文	H	a	1	11:11:11	2011
10	1.9	中!文	I	a	1	11:11:11	2012
11	2	中!文	J	a	1	11:11:11	2011
12	2.1	中!文	K	a	1	11:11:11	2012
UPDATE v1 SET c0=13,c6=10 WHERE c1=1.1;
ERROR HY000: Can not modify more than one base table through a join view 'test.v1'
SELECT * FROM t2 ORDER BY 1;
c0	c1	c2	c3	c4	c5	c6	c7	c8	c9
1	1	1.1	中文			0	11:11:11	2000	0
2	1.1	1.2	中!文	A	a	1	11:11:11	2001	0
3	1.2	2.2	中!文	B	a	1	11:11:11	2002	0
4	1.3	3.2	中!文	C	a	1	11:11:11	2003	0
5	1.4	4.2	中!文	D	a	1	11:11:11	2004	0
6	1.5	5.2	中!文	E	a	1	11:11:11	2005	0
7	1.6	6.2	中!文	F	a	1	11:11:11	2006	0
8	1.7	7.2	中!文	G	a	1	11:11:11	2007	0
9	1.8	8.2	中!文	H	a	1	11:11:11	2011	0
10	1.9	9.2	中!文	I	a	1	11:11:11	2012	0
11	2	1.9	中!文	J	a	1	11:11:11	2011	0
12	2.1	1.8	中!文	K	a	1	11:11:11	2012	0
UPDATE t2 SET c9=13,c6=10 WHERE c1 LIKE'1.1%';
SELECT * FROM t2 ORDER BY 1;
c0	c1	c2	c3	c4	c5	c6	c7	c8	c9
1	1	1.1	中文			0	11:11:11	2000	0
2	1.1	1.2	中!文	A	a	10	11:11:11	2001	13
3	1.2	2.2	中!文	B	a	1	11:11:11	2002	0
4	1.3	3.2	中!文	C	a	1	11:11:11	2003	0
5	1.4	4.2	中!文	D	a	1	11:11:11	2004	0
6	1.5	5.2	中!文	E	a	1	11:11:11	2005	0
7	1.6	6.2	中!文	F	a	1	11:11:11	2006	0
8	1.7	7.2	中!文	G	a	1	11:11:11	2007	0
9	1.8	8.2	中!文	H	a	1	11:11:11	2011	0
10	1.9	9.2	中!文	I	a	1	11:11:11	2012	0
11	2	1.9	中!文	J	a	1	11:11:11	2011	0
12	2.1	1.8	中!文	K	a	1	11:11:11	2012	0
ALTER TABLE t2 DROP c9;
#新增、修改、删除基表列，对视图的影响
DROP VIEW IF EXISTS v1;
CREATE VIEW v1 AS SELECT t1.c0,t2.c2,t1.c3,t2.c4,t1.c5,t2.c6,t1.c7,t2.c8 FROM t1 JOIN t2 ON t1.c0=t2.c0;
SELECT * FROM v1 ORDER BY 1;
c0	c2	c3	c4	c5	c6	c7	c8
1	1.1	中文			0	11:11:11	2000
2	1.2	中!文	A	a	10	11:11:11	2001
3	2.2	中!文	B	a	1	11:11:11	2002
4	3.2	中!文	C	a	1	11:11:11	2003
5	4.2	中!文	D	a	1	11:11:11	2004
6	5.2	中!文	E	a	1	11:11:11	2005
7	6.2	中!文	F	a	1	11:11:11	2006
8	7.2	中!文	G	a	1	11:11:11	2007
9	8.2	中!文	H	a	1	11:11:11	2011
10	9.2	中!文	I	a	1	11:11:11	2012
11	1.9	中!文	J	a	1	11:11:11	2011
12	1.8	中!文	K	a	1	11:11:11	2012
DESC v1;
Field	Type	Null	Key	Default	Extra
c0	int(5)	NO		NULL	
c2	double	NO		NULL	
c3	char(10)	YES			
c4	varchar(10)	YES		NULL	
c5	char(10)	YES		NULL	
c6	int(11)	YES		NULL	
c7	time	YES		NULL	
c8	year(4)	YES		NULL	
SHOW INDEX FROM v1;
Table	Non_unique	Key_name	Seq_in_index	Column_name	Collation	Cardinality	Sub_part	Packed	Null	Index_type	Comment	Index_comment	Visible	Expression
UPDATE v1 SET c0=13,c6=10 WHERE c2=1.1;
ERROR HY000: Can not modify more than one base table through a join view 'test.v1'
UPDATE v1 SET c5='b',c3='中0文' WHERE c2=1.1;
SELECT * FROM v1 ORDER BY 1;
c0	c2	c3	c4	c5	c6	c7	c8
1	1.1	中0文		b	0	11:11:11	2000
2	1.2	中!文	A	a	10	11:11:11	2001
3	2.2	中!文	B	a	1	11:11:11	2002
4	3.2	中!文	C	a	1	11:11:11	2003
5	4.2	中!文	D	a	1	11:11:11	2004
6	5.2	中!文	E	a	1	11:11:11	2005
7	6.2	中!文	F	a	1	11:11:11	2006
8	7.2	中!文	G	a	1	11:11:11	2007
9	8.2	中!文	H	a	1	11:11:11	2011
10	9.2	中!文	I	a	1	11:11:11	2012
11	1.9	中!文	J	a	1	11:11:11	2011
12	1.8	中!文	K	a	1	11:11:11	2012
SELECT * FROM t1 ORDER BY 1;
c0	c1	c2	c3	c4	c5	c6	c7	c8
1	1	1.1	中0文		b	0	11:11:11	2000
2	1.1	1.2	中!文	A	a	1	11:11:11	2001
3	1.2	2.2	中!文	B	a	1	11:11:11	2002
4	1.3	3.2	中!文	C	a	1	11:11:11	2003
5	1.4	4.2	中!文	D	a	1	11:11:11	2004
6	1.5	5.2	中!文	E	a	1	11:11:11	2005
7	1.6	6.2	中!文	F	a	1	11:11:11	2006
8	1.7	7.2	中!文	G	a	1	11:11:11	2007
9	1.8	8.2	中!文	H	a	1	11:11:11	2011
10	1.9	9.2	中!文	I	a	1	11:11:11	2012
11	2	1.9	中!文	J	a	1	11:11:11	2011
12	2.1	1.8	中!文	K	a	1	11:11:11	2012
SELECT * FROM t2 ORDER BY 1;
c0	c1	c2	c3	c4	c5	c6	c7	c8
1	1	1.1	中文			0	11:11:11	2000
2	1.1	1.2	中!文	A	a	10	11:11:11	2001
3	1.2	2.2	中!文	B	a	1	11:11:11	2002
4	1.3	3.2	中!文	C	a	1	11:11:11	2003
5	1.4	4.2	中!文	D	a	1	11:11:11	2004
6	1.5	5.2	中!文	E	a	1	11:11:11	2005
7	1.6	6.2	中!文	F	a	1	11:11:11	2006
8	1.7	7.2	中!文	G	a	1	11:11:11	2007
9	1.8	8.2	中!文	H	a	1	11:11:11	2011
10	1.9	9.2	中!文	I	a	1	11:11:11	2012
11	2	1.9	中!文	J	a	1	11:11:11	2011
12	2.1	1.8	中!文	K	a	1	11:11:11	2012
DROP TABLE IF EXISTS t2;
DROP TABLE IF EXISTS t1;
DROP VIEW IF EXISTS v1;
#########Empty recycle bin, delete test database, tables, etc##########
purge recyclebin;
