purge recyclebin;
DROP TABLE IF EXISTS t1;
DROP TABLE IF EXISTS t2;
#mysql_add-3
#mysql_add-3-1/mysql_add-3-2/mysql_add-3-3
######################PARTITION BY HASH########################
#普通哈希分区表
DROP TABLE IF EXISTS t1;
CREATE TABLE t1(c0 INT,
c1 FLOAT ,
c2 DOUBLE,
c3 CHAR(10),
c4 VARCHAR(10),
c5 CHAR(10),
c6 INT,
c7 DATE,
c8 YEAR)
PARTITION BY HASH(c8) PARTITIONS 3;
INSERT INTO t1 VALUES(1,1.0,1.1,'中文','','',0,'2010-10-11','1989'),
(2,1.1,1.2,'中!文','A','a',1,'2001-01-11','2001'),
(3,1.2,2.2,'中!文','B','a',2,'2016-02-11','2002'),
(4,1.3,3.2,'中!文','C','a',1,'2021-03-11','2003'),
(5,1.4,4.2,'中!文','D','a',2,'2011-11-01','2004'),
(6,1.5,5.2,'中!文','E','a',1,'2014-01-11','2005'),
(7,1.6,6.2,'中!文','F','a',3,'2011-11-01','2006'),
(8,1.7,7.2,'中!文','G','a',1,'2017-01-11','2007'),
(9,1.8,8.2,'中!文','H','a',4,'2013-11-01','2011'),
(10,1.9,9.2,'中!文','I','a',5,'2011-11-11','2013'),
(11,2.0,1.9,'中!文','J','a',6,'2015-01-01','2016'),
(12,2.1,1.8,'中!文','K','a',7,'2012-12-11','2016');
ALTER TABLE t1 ADD c9 INT DEFAULT 0 AFTER c6;
SELECT * FROM t1 ORDER BY 1;
c0	c1	c2	c3	c4	c5	c6	c9	c7	c8
1	1	1.1	中文			0	0	2010-10-11	1989
2	1.1	1.2	中!文	A	a	1	0	2001-01-11	2001
3	1.2	2.2	中!文	B	a	2	0	2016-02-11	2002
4	1.3	3.2	中!文	C	a	1	0	2021-03-11	2003
5	1.4	4.2	中!文	D	a	2	0	2011-11-01	2004
6	1.5	5.2	中!文	E	a	1	0	2014-01-11	2005
7	1.6	6.2	中!文	F	a	3	0	2011-11-01	2006
8	1.7	7.2	中!文	G	a	1	0	2017-01-11	2007
9	1.8	8.2	中!文	H	a	4	0	2013-11-01	2011
10	1.9	9.2	中!文	I	a	5	0	2011-11-11	2013
11	2	1.9	中!文	J	a	6	0	2015-01-01	2016
12	2.1	1.8	中!文	K	a	7	0	2012-12-11	2016
ALTER TABLE t1 ADD c10 INT(4) ZEROFILL AFTER c0,ADD c11 FLOAT(5,0) AFTER c1,ADD c12 TIMESTAMP DEFAULT '2000-01-01 00:00:00';
SELECT * FROM t1 ORDER BY 1;
c0	c10	c1	c11	c2	c3	c4	c5	c6	c9	c7	c8	c12
1	NULL	1	NULL	1.1	中文			0	0	2010-10-11	1989	2000-01-01 00:00:00
2	NULL	1.1	NULL	1.2	中!文	A	a	1	0	2001-01-11	2001	2000-01-01 00:00:00
3	NULL	1.2	NULL	2.2	中!文	B	a	2	0	2016-02-11	2002	2000-01-01 00:00:00
4	NULL	1.3	NULL	3.2	中!文	C	a	1	0	2021-03-11	2003	2000-01-01 00:00:00
5	NULL	1.4	NULL	4.2	中!文	D	a	2	0	2011-11-01	2004	2000-01-01 00:00:00
6	NULL	1.5	NULL	5.2	中!文	E	a	1	0	2014-01-11	2005	2000-01-01 00:00:00
7	NULL	1.6	NULL	6.2	中!文	F	a	3	0	2011-11-01	2006	2000-01-01 00:00:00
8	NULL	1.7	NULL	7.2	中!文	G	a	1	0	2017-01-11	2007	2000-01-01 00:00:00
9	NULL	1.8	NULL	8.2	中!文	H	a	4	0	2013-11-01	2011	2000-01-01 00:00:00
10	NULL	1.9	NULL	9.2	中!文	I	a	5	0	2011-11-11	2013	2000-01-01 00:00:00
11	NULL	2	NULL	1.9	中!文	J	a	6	0	2015-01-01	2016	2000-01-01 00:00:00
12	NULL	2.1	NULL	1.8	中!文	K	a	7	0	2012-12-11	2016	2000-01-01 00:00:00
UPDATE t1 SET c8=2000 WHERE c8=2016;
INSERT INTO t1(c0,c10,c1,c2,c3,c4,c5,c6,c7,c8) VALUES(13,0,2.2,1.7,'中!文','L','a',7,'2012-12-11','2016');
SELECT * FROM t1 WHERE c0=13;
c0	c10	c1	c11	c2	c3	c4	c5	c6	c9	c7	c8	c12
13	0000	2.2	NULL	1.7	中!文	L	a	7	0	2012-12-11	2016	2000-01-01 00:00:00
#新增列与其他操作混用情景
#在分区键上创建普通索引和联合索引，然后新增列
DROP TABLE IF EXISTS t1;
CREATE TABLE t1(c0 INT,
c1 FLOAT ,
c2 DOUBLE,
c3 CHAR(10),
c4 VARCHAR(10),
c5 CHAR(10),
c6 INT,
c7 DATE,
c8 YEAR)
PARTITION BY HASH(c8) PARTITIONS 3;
INSERT INTO t1 VALUES(1,1.0,1.1,'中文','','',0,'2010-10-11','1989'),
(2,1.1,1.2,'中!文','A','a',1,'2001-01-11','2001'),
(3,1.2,2.2,'中!文','B','a',2,'2016-02-11','2002'),
(4,1.3,3.2,'中!文','C','a',1,'2021-03-11','2003'),
(5,1.4,4.2,'中!文','D','a',2,'2011-11-01','2004'),
(6,1.5,5.2,'中!文','E','a',1,'2014-01-11','2005'),
(7,1.6,6.2,'中!文','F','a',3,'2011-11-01','2006'),
(8,1.7,7.2,'中!文','G','a',1,'2017-01-11','2007'),
(9,1.8,8.2,'中!文','H','a',4,'2013-11-01','2011'),
(10,1.9,9.2,'中!文','I','a',5,'2011-11-11','2013'),
(11,2.0,1.9,'中!文','J','a',6,'2015-01-01','2016'),
(12,2.1,1.8,'中!文','K','a',7,'2012-12-11','2016');
ALTER TABLE t1 ADD c9 INT FIRST,ADD c10 BIT(20) AFTER c2,ADD c11 BINARY(10) NOT NULL;
ALTER TABLE t1 ADD c12 BLOB,DROP PARTITION p0;
ERROR 42000: You have an error in your SQL syntax; check the manual that corresponds to your OceanBase version for the right syntax to use near 'PARTITION p0' at line 1
INSERT INTO t1 VALUES(0,14,2.3,1.6,b'0101101','中!文','M','b',8,'2012-12-18','2018','lalalala');
DELETE FROM t1 WHERE c8=2002;
ALTER TABLE t1 DROP INDEX ind_1,ADD c12 VARCHAR(10) DEFAULT 'TEST';
ALTER TABLE t1 ADD c13 CHAR(10) NOT NULL,ADD INDEX ind_3(c13);
#在分区表中新增列并创建分区索引
DROP TABLE IF EXISTS t1;
CREATE TABLE t1(c0 INT,
c1 FLOAT ,
c2 DOUBLE,
c3 CHAR(10),
c4 VARCHAR(10),
c5 CHAR(10),
c6 INT,
c7 DATE,
c8 YEAR)
PARTITION BY HASH(c8) PARTITIONS 3;
INSERT INTO t1 VALUES(1,1.0,1.1,'中文','','',0,'2010-10-11','1989'),
(2,1.1,1.2,'中!文','A','a',1,'2001-01-11','2001'),
(3,1.2,2.2,'中!文','B','a',2,'2016-02-11','2002'),
(4,1.3,3.2,'中!文','C','a',1,'2021-03-11','2003'),
(5,1.4,4.2,'中!文','D','a',2,'2011-11-01','2004'),
(6,1.5,5.2,'中!文','E','a',1,'2014-01-11','2005'),
(7,1.6,6.2,'中!文','F','a',3,'2011-11-01','2006'),
(8,1.7,7.2,'中!文','G','a',1,'2017-01-11','2007'),
(9,1.8,8.2,'中!文','H','a',4,'2013-11-01','2011'),
(10,1.9,9.2,'中!文','I','a',5,'2011-11-11','2013'),
(11,2.0,1.9,'中!文','J','a',6,'2015-01-01','2016'),
(12,2.1,1.8,'中!文','K','a',7,'2012-12-11','2016');
ALTER TABLE t1 ADD c9 INT(5) ZEROFILL DEFAULT 0 FIRST;
#使用新增列创建全局分区索引
CREATE INDEX ind_g ON t1(c8,c9) GLOBAL
PARTITION BY RANGE(c9)
(PARTITION p1 VALUES LESS THAN(4),
PARTITION p2 VALUES LESS THAN(8),
PARTITION p3 VALUES LESS THAN(10),
PARTITION p4 VALUES LESS THAN(MAXVALUE)
);
ERROR 0A000: partition columns not prefix of index columns not supported
CREATE INDEX ind_g ON t1(c8,c9) GLOBAL
PARTITION BY RANGE(c8)
(PARTITION p1 VALUES LESS THAN(4),
PARTITION p2 VALUES LESS THAN(8),
PARTITION p3 VALUES LESS THAN(10),
PARTITION p4 VALUES LESS THAN(MAXVALUE)
);
INSERT INTO t1 VALUES(0,13,2.2,1.7,'中!文','L','b',8,'2018-10-08','2008');
DELETE FROM t1 WHERE c8=2011;
SELECT * FROM t1 ORDER BY 2;
c9	c0	c1	c2	c3	c4	c5	c6	c7	c8
00000	1	1	1.1	中文			0	2010-10-11	1989
00000	2	1.1	1.2	中!文	A	a	1	2001-01-11	2001
00000	3	1.2	2.2	中!文	B	a	2	2016-02-11	2002
00000	4	1.3	3.2	中!文	C	a	1	2021-03-11	2003
00000	5	1.4	4.2	中!文	D	a	2	2011-11-01	2004
00000	6	1.5	5.2	中!文	E	a	1	2014-01-11	2005
00000	7	1.6	6.2	中!文	F	a	3	2011-11-01	2006
00000	8	1.7	7.2	中!文	G	a	1	2017-01-11	2007
00000	10	1.9	9.2	中!文	I	a	5	2011-11-11	2013
00000	11	2	1.9	中!文	J	a	6	2015-01-01	2016
00000	12	2.1	1.8	中!文	K	a	7	2012-12-11	2016
00000	13	2.2	1.7	中!文	L	b	8	2018-10-08	2008
#在分区表中新增列并使用新列和分区键创建唯一索引
DROP TABLE IF EXISTS t1;
CREATE TABLE t1(c0 INT,
c1 FLOAT ,
c2 DOUBLE,
c3 CHAR(10),
c4 VARCHAR(10),
c5 CHAR(10),
c6 INT,
c7 DATE,
c8 YEAR)
PARTITION BY HASH(c8)
(PARTITION p1,PARTITION p2,PARTITION p3);
INSERT INTO t1 VALUES(1,1.0,1.1,'中文','','',0,'2010-10-11','1989'),
(2,1.1,1.2,'中!文','A','a',1,'2001-01-11','2001'),
(3,1.2,2.2,'中!文','B','a',2,'2016-02-11','2002'),
(4,1.3,3.2,'中!文','C','a',1,'2021-03-11','2003'),
(5,1.4,4.2,'中!文','D','a',2,'2011-11-01','2004'),
(6,1.5,5.2,'中!文','E','a',1,'2014-01-11','2005'),
(7,1.6,6.2,'中!文','F','a',3,'2011-11-01','2006'),
(8,1.7,7.2,'中!文','G','a',1,'2017-01-11','2007'),
(9,1.8,8.2,'中!文','H','a',4,'2013-11-01','2011'),
(10,1.9,9.2,'中!文','I','a',5,'2011-11-11','2013'),
(11,2.0,1.9,'中!文','J','a',6,'2015-01-01','2016'),
(12,2.1,1.8,'中!文','K','a',7,'2012-12-11','2017');
ALTER TABLE t1 ADD c9 INT FIRST,DROP PARTITION p1;
ERROR 42000: You have an error in your SQL syntax; check the manual that corresponds to your OceanBase version for the right syntax to use near 'PARTITION p1' at line 1
ALTER TABLE t1 DROP c1, ADD c9 INT FIRST,ADD CONSTRAINT uni_key UNIQUE KEY(c8,c9);
INSERT INTO t1 VALUES(0,13,1.7,'中!文','L','a',8,'2018-12-18','2017');
SELECT * FROM t1 ORDER BY 1;
c0	c1	c2	c3	c4	c5	c6	c7	c8
0	13	1.7	中!文	L	a	8	2018-12-18	2017
1	1	1.1	中文			0	2010-10-11	1989
2	1.1	1.2	中!文	A	a	1	2001-01-11	2001
3	1.2	2.2	中!文	B	a	2	2016-02-11	2002
4	1.3	3.2	中!文	C	a	1	2021-03-11	2003
5	1.4	4.2	中!文	D	a	2	2011-11-01	2004
6	1.5	5.2	中!文	E	a	1	2014-01-11	2005
7	1.6	6.2	中!文	F	a	3	2011-11-01	2006
8	1.7	7.2	中!文	G	a	1	2017-01-11	2007
9	1.8	8.2	中!文	H	a	4	2013-11-01	2011
10	1.9	9.2	中!文	I	a	5	2011-11-11	2013
11	2	1.9	中!文	J	a	6	2015-01-01	2016
12	2.1	1.8	中!文	K	a	7	2012-12-11	2017
INSERT INTO t1 VALUES(0,13,1.7,'中!文','L','a',8,'2018-12-18','2017');
DELETE FROM t1 WHERE c9=0;
SELECT * FROM t1 ORDER BY 1;
c0	c1	c2	c3	c4	c5	c6	c7	c8
0	13	1.7	中!文	L	a	8	2018-12-18	2017
0	13	1.7	中!文	L	a	8	2018-12-18	2017
1	1	1.1	中文			0	2010-10-11	1989
2	1.1	1.2	中!文	A	a	1	2001-01-11	2001
3	1.2	2.2	中!文	B	a	2	2016-02-11	2002
4	1.3	3.2	中!文	C	a	1	2021-03-11	2003
5	1.4	4.2	中!文	D	a	2	2011-11-01	2004
6	1.5	5.2	中!文	E	a	1	2014-01-11	2005
7	1.6	6.2	中!文	F	a	3	2011-11-01	2006
8	1.7	7.2	中!文	G	a	1	2017-01-11	2007
9	1.8	8.2	中!文	H	a	4	2013-11-01	2011
10	1.9	9.2	中!文	I	a	5	2011-11-11	2013
11	2	1.9	中!文	J	a	6	2015-01-01	2016
12	2.1	1.8	中!文	K	a	7	2012-12-11	2017
#分区键带有外键约束(暂不支持)
#分区键带有非空约束
DROP TABLE IF EXISTS t1;
CREATE TABLE t1(c0 INT NOT NULL,
c1 FLOAT DEFAULT 0,
c2 DOUBLE,
c3 CHAR(10),
c4 VARCHAR(10),
c5 CHAR(10),
c6 INT,
c7 DATE,
c8 YEAR )
PARTITION BY HASH(c8)
(PARTITION p1,PARTITION p2,PARTITION p3);
INSERT INTO t1 VALUES(1,1.0,1.1,'中文','','',0,'2010-10-11','1989'),
(2,1.1,1.2,'中!文','A','a',1,'2001-01-11','2001'),
(3,1.2,2.2,'中!文','B','a',2,'2016-02-11','2002'),
(4,1.3,3.2,'中!文','C','a',1,'2021-03-11','2003'),
(5,1.4,4.2,'中!文','D','a',2,'2011-11-01','2004'),
(6,1.5,5.2,'中!文','E','a',1,'2014-01-11','2005'),
(7,1.6,6.2,'中!文','F','a',3,'2011-11-01','2006'),
(8,1.7,7.2,'中!文','G','a',1,'2017-01-11','2007'),
(9,1.8,8.2,'中!文','H','a',4,'2013-11-01','2011'),
(10,1.9,9.2,'中!文','I','a',5,'2011-11-11','2013'),
(11,2.0,1.9,'中!文','J','a',6,'2015-01-01','2016'),
(12,2.1,1.8,'中!文','K','a',7,'2012-12-11','2017');
ALTER TABLE t1 ADD c9 INT AFTER c10,ADD c10 INT AFTER c9;
ERROR 42S22: Unknown column 'c10' in 't1'
ALTER TABLE t1 ADD c9 INT NOT NULL AFTER c0,DROP c1;
INSERT INTO t1 VALUES(13,0,1.7,'中!文','L','a',8,'2012-12-11','2020');
SELECT * FROM t1 ORDER BY 1;
c0	c9	c2	c3	c4	c5	c6	c7	c8
1	0	1.1	中文			0	2010-10-11	1989
2	0	1.2	中!文	A	a	1	2001-01-11	2001
3	0	2.2	中!文	B	a	2	2016-02-11	2002
4	0	3.2	中!文	C	a	1	2021-03-11	2003
5	0	4.2	中!文	D	a	2	2011-11-01	2004
6	0	5.2	中!文	E	a	1	2014-01-11	2005
7	0	6.2	中!文	F	a	3	2011-11-01	2006
8	0	7.2	中!文	G	a	1	2017-01-11	2007
9	0	8.2	中!文	H	a	4	2013-11-01	2011
10	0	9.2	中!文	I	a	5	2011-11-11	2013
11	0	1.9	中!文	J	a	6	2015-01-01	2016
12	0	1.8	中!文	K	a	7	2012-12-11	2017
13	0	1.7	中!文	L	a	8	2012-12-11	2020
INSERT INTO t1 VALUES(NULL,14,1.6,'中!文','M','b',9,'2013-12-13','2021');
ERROR 23000: Column 'c0' cannot be null
DELETE FROM t1 WHERE c9=0;
SELECT * FROM t1 ORDER BY 1;
c0	c9	c2	c3	c4	c5	c6	c7	c8
#新增列带有自增约束
DROP TABLE IF EXISTS t1;
CREATE TABLE t1(c0 INT ,
c1 FLOAT DEFAULT 0,
c2 DOUBLE,
c3 CHAR(10),
c4 VARCHAR(10),
c5 CHAR(10),
c6 INT,
c7 DATE,
c8 YEAR NOT NULL)
PARTITION BY HASH(c0) PARTITIONS 2;
INSERT INTO t1 VALUES(1,1.0,1.1,'中文','','',0,'2010-10-11','1989'),
(2,1.1,1.2,'中!文','A','a',1,'2001-01-11','2001'),
(3,1.2,2.2,'中!文','B','a',2,'2016-02-11','2002'),
(4,1.3,3.2,'中!文','C','a',1,'2021-03-11','2003'),
(5,1.4,4.2,'中!文','D','a',2,'2011-11-01','2004'),
(6,1.5,5.2,'中!文','E','a',1,'2014-01-11','2005'),
(7,1.6,6.2,'中!文','F','a',3,'2011-11-01','2006'),
(8,1.7,7.2,'中!文','G','a',1,'2017-01-11','2007'),
(9,1.8,8.2,'中!文','H','a',4,'2013-11-01','2011'),
(10,1.9,9.2,'中!文','I','a',5,'2011-11-11','2013'),
(11,2.0,1.9,'中!文','J','a',6,'2015-01-01','2016'),
(12,2.1,1.8,'中!文','K','a',7,'2012-12-11','2017');
ALTER TABLE t1 ADD c9 INT AUTO_INCREMENT,DROP c1,ADD c10 CHAR(10),DROP c2;
INSERT INTO t1(c0,c3,c4,c5,c6,c7,c8,c9) VALUES(13,'中!文','L','a',8,'2013-12-13','2013',0);
INSERT INTO t1(c0,c3,c4,c5,c6,c7,c8) VALUES(14,'中!文','M','b',9,'2019-12-19','2014');
DELETE FROM t1 WHERE c9=0;
SELECT * FROM t1 ORDER BY 1;
c0	c3	c4	c5	c6	c7	c8	c9	c10
1	中文			0	2010-10-11	1989	10001	NULL
2	中!文	A	a	1	2001-01-11	2001	1	NULL
3	中!文	B	a	2	2016-02-11	2002	10002	NULL
4	中!文	C	a	1	2021-03-11	2003	2	NULL
5	中!文	D	a	2	2011-11-01	2004	10003	NULL
6	中!文	E	a	1	2014-01-11	2005	3	NULL
7	中!文	F	a	3	2011-11-01	2006	10004	NULL
8	中!文	G	a	1	2017-01-11	2007	4	NULL
9	中!文	H	a	4	2013-11-01	2011	10005	NULL
10	中!文	I	a	5	2011-11-11	2013	5	NULL
11	中!文	J	a	6	2015-01-01	2016	10006	NULL
12	中!文	K	a	7	2012-12-11	2017	6	NULL
13	中!文	L	a	8	2013-12-13	2013	10007	NULL
14	中!文	M	b	9	2019-12-19	2014	10008	NULL
#新增列带有默认值约束
DROP TABLE IF EXISTS t1;
CREATE TABLE t1(c0 INT NOT NULL,
c1 FLOAT ,
c2 DOUBLE,
c3 CHAR(10),
c4 VARCHAR(10),
c5 CHAR(10),
c6 INT,
c7 DATE,
c8 YEAR DEFAULT 2022)
PARTITION BY HASH(c8) PARTITIONS 4;
INSERT INTO t1 VALUES(1,1.0,1.1,'中文','','',0,'2010-10-11','1989'),
(2,1.1,1.2,'中!文','A','a',1,'2001-01-11','2001'),
(3,1.2,2.2,'中!文','B','a',2,'2016-02-11','2002'),
(4,1.3,3.2,'中!文','C','a',1,'2021-03-11','2003'),
(5,1.4,4.2,'中!文','D','a',2,'2011-11-01','2004'),
(6,1.5,5.2,'中!文','E','a',1,'2014-01-11','2005'),
(7,1.6,6.2,'中!文','F','a',3,'2011-11-01','2006'),
(8,1.7,7.2,'中!文','G','a',1,'2017-01-11','2007'),
(9,1.8,8.2,'中!文','H','a',4,'2013-11-01','2011'),
(10,1.9,9.2,'中!文','I','a',5,'2011-11-11','2013'),
(11,2.0,1.9,'中!文','J','a',6,'2015-01-01','2016'),
(12,2.1,1.8,'中!文','K','a',7,'2012-12-11','2017');
ALTER TABLE t1 ADD c9 INT(5) ZEROFILL DEFAULT 0,DROP c1;
INSERT INTO t1(c0,c2,c3,c4,c5,c6,c7) VALUES(13,1.7,'中!文','L','a',8,'2013-12-13');
SELECT * FROM t1 ORDER BY 1;
c0	c2	c3	c4	c5	c6	c7	c8	c9
1	1.1	中文			0	2010-10-11	1989	00000
2	1.2	中!文	A	a	1	2001-01-11	2001	00000
3	2.2	中!文	B	a	2	2016-02-11	2002	00000
4	3.2	中!文	C	a	1	2021-03-11	2003	00000
5	4.2	中!文	D	a	2	2011-11-01	2004	00000
6	5.2	中!文	E	a	1	2014-01-11	2005	00000
7	6.2	中!文	F	a	3	2011-11-01	2006	00000
8	7.2	中!文	G	a	1	2017-01-11	2007	00000
9	8.2	中!文	H	a	4	2013-11-01	2011	00000
10	9.2	中!文	I	a	5	2011-11-11	2013	00000
11	1.9	中!文	J	a	6	2015-01-01	2016	00000
12	1.8	中!文	K	a	7	2012-12-11	2017	00000
13	1.7	中!文	L	a	8	2013-12-13	2022	00000
#新增列为生成列
#STORED/VIRTUAL类型生成列,分区键为生成列的引用列
DROP TABLE IF EXISTS t1;
CREATE TABLE t1(c0 INT ,
c1 FLOAT ,
c2 DOUBLE,
c3 CHAR(10),
c4 VARCHAR(10),
c5 CHAR(10),
c6 INT,
c7 TIME,
c8 YEAR GENERATED ALWAYS AS (c6*2) STORED COMMENT '数值生成列')
PARTITION BY HASH(c8) PARTITIONS 4;
INSERT INTO t1(c0,c1,c2,c3,c4,c5,c6,c7) VALUES(1,1.0,1.1,'中文','','',1000,'11:11:11'),
(2,1.1,1.2,'中!文','A','a',1001,'11:11:11'),
(3,1.2,2.2,'中@文','B','a',1002,'11:11:11'),
(4,1.3,3.2,'中_文','C','a',1003,'11:11:11'),
(5,1.4,4.2,'中$文','D','a',1004,'11:11:11'),
(6,1.5,5.2,'中%文','E','a',1005,'11:11:11'),
(7,1.6,6.2,'中^文','F','a',1006,'11:11:11'),
(8,1.7,7.2,'中&文','G','a',1000,'11:11:11'),
(9,1.8,8.2,'中*文','H','a',1001,'11:11:11'),
(10,1.9,9.2,'中-文','I','a',1002,'11:11:11'),
(11,2.0,1.9,'中=文','J','a',1003,'11:11:11'),
(12,2.1,1.8,'中+文','K','a',1004,'11:11:11');
#新增列为其他新增列的引用列
DROP TABLE IF EXISTS t1;
CREATE TABLE t1(c0 INT ,
c1 FLOAT ,
c2 DOUBLE,
c3 CHAR(10),
c4 VARCHAR(10),
c5 CHAR(10),
c6 INT ,
c7 TIME,
c8 YEAR)
PARTITION BY HASH(c6)
(PARTITION p1,PARTITION p2,PARTITION p3,PARTITION p4);
INSERT INTO t1(c1,c2,c3,c4,c5,c6,c7,c8) VALUES(1.0,1.1,'中文','','',1000,'11:11:11',2000),
(1.1,1.2,'中!文','A','a',1001,'11:11:11',2001),
(1.2,2.2,'中@文','B','a',1002,'11:11:11',2002),
(1.3,3.2,'中_文','C','a',1003,'11:11:11',2003),
(1.4,4.2,'中$文','D','a',1004,'11:11:11',2004),
(1.5,5.2,'中%文','E','a',1005,'11:11:11',2005),
(1.6,6.2,'中^文','F','a',1006,'11:11:11',2006),
(1.7,7.2,'中&文','G','a',1000,'11:11:11',2007),
(1.8,8.2,'中*文','H','a',1001,'11:11:11',2008),
(1.9,9.2,'中-文','I','a',1002,'11:11:11',2009),
(2.0,1.9,'中=文','J','a',1003,'11:11:11',2010),
(2.1,1.8,'中+文','K','a',1004,'11:11:11',2011);
#######################PARTITION BY KEY#########################
#普通KEY分区表
DROP TABLE IF EXISTS t2;
DROP TABLE IF EXISTS t1;
CREATE TABLE t1(c0 INT,
c1 FLOAT ,
c2 DOUBLE,
c3 CHAR(10),
c4 VARCHAR(10),
c5 CHAR(10),
c6 INT,
c7 DATE,
c8 YEAR)
PARTITION BY KEY(c8) PARTITIONS 3;
INSERT INTO t1 VALUES(1,1.0,1.1,'中文','','',0,'2010-10-11','1989'),
(2,1.1,1.2,'中!文','A','a',1,'2001-01-11','2001'),
(3,1.2,2.2,'中!文','B','a',2,'2016-02-11','2002'),
(4,1.3,3.2,'中!文','C','a',1,'2021-03-11','2003'),
(5,1.4,4.2,'中!文','D','a',2,'2011-11-01','2004'),
(6,1.5,5.2,'中!文','E','a',1,'2014-01-11','2005'),
(7,1.6,6.2,'中!文','F','a',3,'2011-11-01','2006'),
(8,1.7,7.2,'中!文','G','a',1,'2017-01-11','2007'),
(9,1.8,8.2,'中!文','H','a',4,'2013-11-01','2011'),
(10,1.9,9.2,'中!文','I','a',5,'2011-11-11','2013'),
(11,2.0,1.9,'中!文','J','a',6,'2015-01-01','2016'),
(12,2.1,1.8,'中!文','K','a',7,'2012-12-11','2016');
ALTER TABLE t1 ADD c9 INT DEFAULT 0 AFTER c6;
SELECT * FROM t1 ORDER BY 1;
c0	c1	c2	c3	c4	c5	c6	c9	c7	c8
1	1	1.1	中文			0	0	2010-10-11	1989
2	1.1	1.2	中!文	A	a	1	0	2001-01-11	2001
3	1.2	2.2	中!文	B	a	2	0	2016-02-11	2002
4	1.3	3.2	中!文	C	a	1	0	2021-03-11	2003
5	1.4	4.2	中!文	D	a	2	0	2011-11-01	2004
6	1.5	5.2	中!文	E	a	1	0	2014-01-11	2005
7	1.6	6.2	中!文	F	a	3	0	2011-11-01	2006
8	1.7	7.2	中!文	G	a	1	0	2017-01-11	2007
9	1.8	8.2	中!文	H	a	4	0	2013-11-01	2011
10	1.9	9.2	中!文	I	a	5	0	2011-11-11	2013
11	2	1.9	中!文	J	a	6	0	2015-01-01	2016
12	2.1	1.8	中!文	K	a	7	0	2012-12-11	2016
ALTER TABLE t1 ADD c10 INT(4) ZEROFILL AFTER c0,ADD c11 FLOAT(5,0) AFTER c1,ADD c12 TIMESTAMP DEFAULT '2000-01-01 00:00:00';
SELECT * FROM t1 ORDER BY 1;
c0	c10	c1	c11	c2	c3	c4	c5	c6	c9	c7	c8	c12
1	NULL	1	NULL	1.1	中文			0	0	2010-10-11	1989	2000-01-01 00:00:00
2	NULL	1.1	NULL	1.2	中!文	A	a	1	0	2001-01-11	2001	2000-01-01 00:00:00
3	NULL	1.2	NULL	2.2	中!文	B	a	2	0	2016-02-11	2002	2000-01-01 00:00:00
4	NULL	1.3	NULL	3.2	中!文	C	a	1	0	2021-03-11	2003	2000-01-01 00:00:00
5	NULL	1.4	NULL	4.2	中!文	D	a	2	0	2011-11-01	2004	2000-01-01 00:00:00
6	NULL	1.5	NULL	5.2	中!文	E	a	1	0	2014-01-11	2005	2000-01-01 00:00:00
7	NULL	1.6	NULL	6.2	中!文	F	a	3	0	2011-11-01	2006	2000-01-01 00:00:00
8	NULL	1.7	NULL	7.2	中!文	G	a	1	0	2017-01-11	2007	2000-01-01 00:00:00
9	NULL	1.8	NULL	8.2	中!文	H	a	4	0	2013-11-01	2011	2000-01-01 00:00:00
10	NULL	1.9	NULL	9.2	中!文	I	a	5	0	2011-11-11	2013	2000-01-01 00:00:00
11	NULL	2	NULL	1.9	中!文	J	a	6	0	2015-01-01	2016	2000-01-01 00:00:00
12	NULL	2.1	NULL	1.8	中!文	K	a	7	0	2012-12-11	2016	2000-01-01 00:00:00
UPDATE t1 SET c8=2000 WHERE c8=2016;
INSERT INTO t1(c0,c10,c1,c2,c3,c4,c5,c6,c7,c8) VALUES(13,0,2.2,1.7,'中!文','L','a',7,'2012-12-11','2016');
SELECT * FROM t1 WHERE c0=13;
c0	c10	c1	c11	c2	c3	c4	c5	c6	c9	c7	c8	c12
13	0000	2.2	NULL	1.7	中!文	L	a	7	0	2012-12-11	2016	2000-01-01 00:00:00
#新增列与其他操作混用情景
#在分区键上创建普通索引和联合索引，然后新增列
DROP TABLE IF EXISTS t1;
CREATE TABLE t1(c0 INT,
c1 FLOAT ,
c2 DOUBLE,
c3 CHAR(10),
c4 VARCHAR(10),
c5 CHAR(10),
c6 INT,
c7 DATE,
c8 YEAR)
PARTITION BY KEY(c8) PARTITIONS 3;
INSERT INTO t1 VALUES(1,1.0,1.1,'中文','','',0,'2010-10-11','1989'),
(2,1.1,1.2,'中!文','A','a',1,'2001-01-11','2001'),
(3,1.2,2.2,'中!文','B','a',2,'2016-02-11','2002'),
(4,1.3,3.2,'中!文','C','a',1,'2021-03-11','2003'),
(5,1.4,4.2,'中!文','D','a',2,'2011-11-01','2004'),
(6,1.5,5.2,'中!文','E','a',1,'2014-01-11','2005'),
(7,1.6,6.2,'中!文','F','a',3,'2011-11-01','2006'),
(8,1.7,7.2,'中!文','G','a',1,'2017-01-11','2007'),
(9,1.8,8.2,'中!文','H','a',4,'2013-11-01','2011'),
(10,1.9,9.2,'中!文','I','a',5,'2011-11-11','2013'),
(11,2.0,1.9,'中!文','J','a',6,'2015-01-01','2016'),
(12,2.1,1.8,'中!文','K','a',7,'2012-12-11','2016');
CREATE INDEX ind_1 ON t1(c7);
CREATE INDEX ind_2 ON t1(c1,c8);
ALTER TABLE t1 ADD c9 INT FIRST,ADD c10 BIT(20) AFTER c2,ADD c11 BINARY(10) NOT NULL;
ALTER TABLE t1 ADD c12 BLOB,DROP PARTITION p0;
ERROR 42000: You have an error in your SQL syntax; check the manual that corresponds to your OceanBase version for the right syntax to use near 'PARTITION p0' at line 1
INSERT INTO t1 VALUES(0,14,2.3,1.6,b'0101101','中!文','M','b',8,'2012-12-18','2018','lalalala');
DELETE FROM t1 WHERE c8=2002;
SELECT * FROM t1 ORDER BY 2;
c9	c0	c1	c2	c10	c3	c4	c5	c6	c7	c8	c11
NULL	1	1	1.1	NULL	中文			0	2010-10-11	1989	          
NULL	2	1.1	1.2	NULL	中!文	A	a	1	2001-01-11	2001	          
NULL	4	1.3	3.2	NULL	中!文	C	a	1	2021-03-11	2003	          
NULL	5	1.4	4.2	NULL	中!文	D	a	2	2011-11-01	2004	          
NULL	6	1.5	5.2	NULL	中!文	E	a	1	2014-01-11	2005	          
NULL	7	1.6	6.2	NULL	中!文	F	a	3	2011-11-01	2006	          
NULL	8	1.7	7.2	NULL	中!文	G	a	1	2017-01-11	2007	          
NULL	9	1.8	8.2	NULL	中!文	H	a	4	2013-11-01	2011	          
NULL	10	1.9	9.2	NULL	中!文	I	a	5	2011-11-11	2013	          
NULL	11	2	1.9	NULL	中!文	J	a	6	2015-01-01	2016	          
NULL	12	2.1	1.8	NULL	中!文	K	a	7	2012-12-11	2016	          
0	14	2.3	1.6	  -	中!文	M	b	8	2012-12-18	2018	lalalala  
ALTER TABLE t1 DROP INDEX ind_1,ADD c12 VARCHAR(10) DEFAULT 'TEST';
#在分区表中新增列并创建分区索引
DROP TABLE IF EXISTS t1;
CREATE TABLE t1(c0 INT,
c1 FLOAT ,
c2 DOUBLE,
c3 CHAR(10),
c4 VARCHAR(10),
c5 CHAR(10),
c6 INT,
c7 DATE,
c8 YEAR)
PARTITION BY KEY(c8) PARTITIONS 3;
INSERT INTO t1 VALUES(1,1.0,1.1,'中文','','',0,'2010-10-11','1989'),
(2,1.1,1.2,'中!文','A','a',1,'2001-01-11','2001'),
(3,1.2,2.2,'中!文','B','a',2,'2016-02-11','2002'),
(4,1.3,3.2,'中!文','C','a',1,'2021-03-11','2003'),
(5,1.4,4.2,'中!文','D','a',2,'2011-11-01','2004'),
(6,1.5,5.2,'中!文','E','a',1,'2014-01-11','2005'),
(7,1.6,6.2,'中!文','F','a',3,'2011-11-01','2006'),
(8,1.7,7.2,'中!文','G','a',1,'2017-01-11','2007'),
(9,1.8,8.2,'中!文','H','a',4,'2013-11-01','2011'),
(10,1.9,9.2,'中!文','I','a',5,'2011-11-11','2013'),
(11,2.0,1.9,'中!文','J','a',6,'2015-01-01','2016'),
(12,2.1,1.8,'中!文','K','a',7,'2012-12-11','2016');
ALTER TABLE t1 ADD c9 INT(5) ZEROFILL DEFAULT 0 FIRST;
#使用新增列创建全局分区索引
CREATE INDEX ind_g ON t1(c8,c9) GLOBAL
PARTITION BY RANGE(c9)
(PARTITION p1 VALUES LESS THAN(4),
PARTITION p2 VALUES LESS THAN(8),
PARTITION p3 VALUES LESS THAN(10),
PARTITION p4 VALUES LESS THAN(MAXVALUE)
);
ERROR 0A000: partition columns not prefix of index columns not supported
CREATE INDEX ind_g ON t1(c8,c9) GLOBAL
PARTITION BY RANGE(c8)
(PARTITION p1 VALUES LESS THAN(4),
PARTITION p2 VALUES LESS THAN(8),
PARTITION p3 VALUES LESS THAN(10),
PARTITION p4 VALUES LESS THAN(MAXVALUE)
);
INSERT INTO t1 VALUES(0,13,2.2,1.7,'中!文','L','b',8,'2018-10-08','2008');
DELETE FROM t1 WHERE c8=2011;
SELECT * FROM t1 ORDER BY 2;
c9	c0	c1	c2	c3	c4	c5	c6	c7	c8
00000	1	1	1.1	中文			0	2010-10-11	1989
00000	2	1.1	1.2	中!文	A	a	1	2001-01-11	2001
00000	3	1.2	2.2	中!文	B	a	2	2016-02-11	2002
00000	4	1.3	3.2	中!文	C	a	1	2021-03-11	2003
00000	5	1.4	4.2	中!文	D	a	2	2011-11-01	2004
00000	6	1.5	5.2	中!文	E	a	1	2014-01-11	2005
00000	7	1.6	6.2	中!文	F	a	3	2011-11-01	2006
00000	8	1.7	7.2	中!文	G	a	1	2017-01-11	2007
00000	10	1.9	9.2	中!文	I	a	5	2011-11-11	2013
00000	11	2	1.9	中!文	J	a	6	2015-01-01	2016
00000	12	2.1	1.8	中!文	K	a	7	2012-12-11	2016
00000	13	2.2	1.7	中!文	L	b	8	2018-10-08	2008
#在分区表中新增列并使用新列和分区键创建唯一索引
DROP TABLE IF EXISTS t1;
CREATE TABLE t1(c0 INT,
c1 FLOAT ,
c2 DOUBLE,
c3 CHAR(10),
c4 VARCHAR(10),
c5 CHAR(10),
c6 INT,
c7 DATE,
c8 YEAR)
PARTITION BY KEY(c8)
(PARTITION p1,PARTITION p2,PARTITION p3);
INSERT INTO t1 VALUES(1,1.0,1.1,'中文','','',0,'2010-10-11','1989'),
(2,1.1,1.2,'中!文','A','a',1,'2001-01-11','2001'),
(3,1.2,2.2,'中!文','B','a',2,'2016-02-11','2002'),
(4,1.3,3.2,'中!文','C','a',1,'2021-03-11','2003'),
(5,1.4,4.2,'中!文','D','a',2,'2011-11-01','2004'),
(6,1.5,5.2,'中!文','E','a',1,'2014-01-11','2005'),
(7,1.6,6.2,'中!文','F','a',3,'2011-11-01','2006'),
(8,1.7,7.2,'中!文','G','a',1,'2017-01-11','2007'),
(9,1.8,8.2,'中!文','H','a',4,'2013-11-01','2011'),
(10,1.9,9.2,'中!文','I','a',5,'2011-11-11','2013'),
(11,2.0,1.9,'中!文','J','a',6,'2015-01-01','2016'),
(12,2.1,1.8,'中!文','K','a',7,'2012-12-11','2017');
ALTER TABLE t1 ADD c9 INT FIRST,DROP PARTITION p1;
ERROR 42000: You have an error in your SQL syntax; check the manual that corresponds to your OceanBase version for the right syntax to use near 'PARTITION p1' at line 1
ALTER TABLE t1 DROP c1, ADD c9 INT FIRST,ADD CONSTRAINT uni_key UNIQUE KEY(c8,c9);
INSERT INTO t1 VALUES(0,13,1.7,'中!文','L','a',8,'2018-12-18','2017');
SELECT * FROM t1 ORDER BY 2;
c0	c1	c2	c3	c4	c5	c6	c7	c8
1	1	1.1	中文			0	2010-10-11	1989
2	1.1	1.2	中!文	A	a	1	2001-01-11	2001
3	1.2	2.2	中!文	B	a	2	2016-02-11	2002
4	1.3	3.2	中!文	C	a	1	2021-03-11	2003
5	1.4	4.2	中!文	D	a	2	2011-11-01	2004
6	1.5	5.2	中!文	E	a	1	2014-01-11	2005
7	1.6	6.2	中!文	F	a	3	2011-11-01	2006
8	1.7	7.2	中!文	G	a	1	2017-01-11	2007
9	1.8	8.2	中!文	H	a	4	2013-11-01	2011
10	1.9	9.2	中!文	I	a	5	2011-11-11	2013
11	2	1.9	中!文	J	a	6	2015-01-01	2016
12	2.1	1.8	中!文	K	a	7	2012-12-11	2017
0	13	1.7	中!文	L	a	8	2018-12-18	2017
INSERT INTO t1 VALUES(0,13,1.7,'中!文','L','a',8,'2018-12-18','2017');
DELETE FROM t1 WHERE c9=0;
SELECT * FROM t1 ORDER BY 2;
c0	c1	c2	c3	c4	c5	c6	c7	c8
1	1	1.1	中文			0	2010-10-11	1989
2	1.1	1.2	中!文	A	a	1	2001-01-11	2001
3	1.2	2.2	中!文	B	a	2	2016-02-11	2002
4	1.3	3.2	中!文	C	a	1	2021-03-11	2003
5	1.4	4.2	中!文	D	a	2	2011-11-01	2004
6	1.5	5.2	中!文	E	a	1	2014-01-11	2005
7	1.6	6.2	中!文	F	a	3	2011-11-01	2006
8	1.7	7.2	中!文	G	a	1	2017-01-11	2007
9	1.8	8.2	中!文	H	a	4	2013-11-01	2011
10	1.9	9.2	中!文	I	a	5	2011-11-11	2013
11	2	1.9	中!文	J	a	6	2015-01-01	2016
12	2.1	1.8	中!文	K	a	7	2012-12-11	2017
0	13	1.7	中!文	L	a	8	2018-12-18	2017
0	13	1.7	中!文	L	a	8	2018-12-18	2017
#分区键带有外键约束(暂不支持)
#分区键带有非空约束
DROP TABLE IF EXISTS t1;
CREATE TABLE t1(c0 INT NOT NULL,
c1 FLOAT DEFAULT 0,
c2 DOUBLE,
c3 CHAR(10),
c4 VARCHAR(10),
c5 CHAR(10),
c6 INT,
c7 DATE,
c8 YEAR )
PARTITION BY KEY(c8)
(PARTITION p1,PARTITION p2,PARTITION p3);
INSERT INTO t1 VALUES(1,1.0,1.1,'中文','','',0,'2010-10-11','1989'),
(2,1.1,1.2,'中!文','A','a',1,'2001-01-11','2001'),
(3,1.2,2.2,'中!文','B','a',2,'2016-02-11','2002'),
(4,1.3,3.2,'中!文','C','a',1,'2021-03-11','2003'),
(5,1.4,4.2,'中!文','D','a',2,'2011-11-01','2004'),
(6,1.5,5.2,'中!文','E','a',1,'2014-01-11','2005'),
(7,1.6,6.2,'中!文','F','a',3,'2011-11-01','2006'),
(8,1.7,7.2,'中!文','G','a',1,'2017-01-11','2007'),
(9,1.8,8.2,'中!文','H','a',4,'2013-11-01','2011'),
(10,1.9,9.2,'中!文','I','a',5,'2011-11-11','2013'),
(11,2.0,1.9,'中!文','J','a',6,'2015-01-01','2016'),
(12,2.1,1.8,'中!文','K','a',7,'2012-12-11','2017');
ALTER TABLE t1 ADD c9 INT AFTER c10,ADD c10 INT AFTER c9;
ERROR 42S22: Unknown column 'c10' in 't1'
ALTER TABLE t1 ADD c9 INT NOT NULL AFTER c0,DROP c1;
INSERT INTO t1 VALUES(13,0,1.7,'中!文','L','a',8,'2012-12-11','2020');
SELECT * FROM t1 ORDER BY 1;
c0	c9	c2	c3	c4	c5	c6	c7	c8
1	0	1.1	中文			0	2010-10-11	1989
2	0	1.2	中!文	A	a	1	2001-01-11	2001
3	0	2.2	中!文	B	a	2	2016-02-11	2002
4	0	3.2	中!文	C	a	1	2021-03-11	2003
5	0	4.2	中!文	D	a	2	2011-11-01	2004
6	0	5.2	中!文	E	a	1	2014-01-11	2005
7	0	6.2	中!文	F	a	3	2011-11-01	2006
8	0	7.2	中!文	G	a	1	2017-01-11	2007
9	0	8.2	中!文	H	a	4	2013-11-01	2011
10	0	9.2	中!文	I	a	5	2011-11-11	2013
11	0	1.9	中!文	J	a	6	2015-01-01	2016
12	0	1.8	中!文	K	a	7	2012-12-11	2017
13	0	1.7	中!文	L	a	8	2012-12-11	2020
INSERT INTO t1 VALUES(NULL,14,1.6,'中!文','M','b',9,'2013-12-13','2021');
ERROR 23000: Column 'c0' cannot be null
DELETE FROM t1 WHERE c9=0;
SELECT * FROM t1 ORDER BY 1;
c0	c9	c2	c3	c4	c5	c6	c7	c8
#新增列带有自增约束
DROP TABLE IF EXISTS t1;
CREATE TABLE t1(c0 INT ,
c1 FLOAT DEFAULT 0,
c2 DOUBLE,
c3 CHAR(10),
c4 VARCHAR(10),
c5 CHAR(10),
c6 INT,
c7 DATE,
c8 YEAR NOT NULL)
PARTITION BY KEY(c0) PARTITIONS 2;
INSERT INTO t1 VALUES(1,1.0,1.1,'中文','','',0,'2010-10-11','1989'),
(2,1.1,1.2,'中!文','A','a',1,'2001-01-11','2001'),
(3,1.2,2.2,'中!文','B','a',2,'2016-02-11','2002'),
(4,1.3,3.2,'中!文','C','a',1,'2021-03-11','2003'),
(5,1.4,4.2,'中!文','D','a',2,'2011-11-01','2004'),
(6,1.5,5.2,'中!文','E','a',1,'2014-01-11','2005'),
(7,1.6,6.2,'中!文','F','a',3,'2011-11-01','2006'),
(8,1.7,7.2,'中!文','G','a',1,'2017-01-11','2007'),
(9,1.8,8.2,'中!文','H','a',4,'2013-11-01','2011'),
(10,1.9,9.2,'中!文','I','a',5,'2011-11-11','2013'),
(11,2.0,1.9,'中!文','J','a',6,'2015-01-01','2016'),
(12,2.1,1.8,'中!文','K','a',7,'2012-12-11','2017');
ALTER TABLE t1 ADD c9 INT AUTO_INCREMENT,DROP c1,ADD c10 CHAR(10),DROP c2;
INSERT INTO t1(c0,c3,c4,c5,c6,c7,c8,c9) VALUES(13,'中!文','L','a',8,'2013-12-13','2013',0);
INSERT INTO t1(c0,c3,c4,c5,c6,c7,c8) VALUES(14,'中!文','M','b',9,'2019-12-19','2014');
DELETE FROM t1 WHERE c9=0;
SELECT * FROM t1 ORDER BY 1;
c0	c3	c4	c5	c6	c7	c8	c9	c10
1	中文			0	2010-10-11	1989	1	NULL
2	中!文	A	a	1	2001-01-11	2001	2	NULL
3	中!文	B	a	2	2016-02-11	2002	3	NULL
4	中!文	C	a	1	2021-03-11	2003	4	NULL
5	中!文	D	a	2	2011-11-01	2004	5	NULL
6	中!文	E	a	1	2014-01-11	2005	6	NULL
7	中!文	F	a	3	2011-11-01	2006	10001	NULL
8	中!文	G	a	1	2017-01-11	2007	10002	NULL
9	中!文	H	a	4	2013-11-01	2011	7	NULL
10	中!文	I	a	5	2011-11-11	2013	10003	NULL
11	中!文	J	a	6	2015-01-01	2016	10004	NULL
12	中!文	K	a	7	2012-12-11	2017	10005	NULL
13	中!文	L	a	8	2013-12-13	2013	10006	NULL
14	中!文	M	b	9	2019-12-19	2014	10007	NULL
#新增列带有默认值约束
DROP TABLE IF EXISTS t1;
CREATE TABLE t1(c0 INT NOT NULL,
c1 FLOAT ,
c2 DOUBLE,
c3 CHAR(10),
c4 VARCHAR(10),
c5 CHAR(10),
c6 INT,
c7 DATE,
c8 YEAR DEFAULT 2022)
PARTITION BY KEY(c8) PARTITIONS 4;
INSERT INTO t1 VALUES(1,1.0,1.1,'中文','','',0,'2010-10-11','1989'),
(2,1.1,1.2,'中!文','A','a',1,'2001-01-11','2001'),
(3,1.2,2.2,'中!文','B','a',2,'2016-02-11','2002'),
(4,1.3,3.2,'中!文','C','a',1,'2021-03-11','2003'),
(5,1.4,4.2,'中!文','D','a',2,'2011-11-01','2004'),
(6,1.5,5.2,'中!文','E','a',1,'2014-01-11','2005'),
(7,1.6,6.2,'中!文','F','a',3,'2011-11-01','2006'),
(8,1.7,7.2,'中!文','G','a',1,'2017-01-11','2007'),
(9,1.8,8.2,'中!文','H','a',4,'2013-11-01','2011'),
(10,1.9,9.2,'中!文','I','a',5,'2011-11-11','2013'),
(11,2.0,1.9,'中!文','J','a',6,'2015-01-01','2016'),
(12,2.1,1.8,'中!文','K','a',7,'2012-12-11','2017');
ALTER TABLE t1 ADD c9 INT(5) ZEROFILL DEFAULT 0,DROP c1;
INSERT INTO t1(c0,c2,c3,c4,c5,c6,c7) VALUES(13,1.7,'中!文','L','a',8,'2013-12-13');
SELECT * FROM t1 ORDER BY 1;
c0	c2	c3	c4	c5	c6	c7	c8	c9
1	1.1	中文			0	2010-10-11	1989	00000
2	1.2	中!文	A	a	1	2001-01-11	2001	00000
3	2.2	中!文	B	a	2	2016-02-11	2002	00000
4	3.2	中!文	C	a	1	2021-03-11	2003	00000
5	4.2	中!文	D	a	2	2011-11-01	2004	00000
6	5.2	中!文	E	a	1	2014-01-11	2005	00000
7	6.2	中!文	F	a	3	2011-11-01	2006	00000
8	7.2	中!文	G	a	1	2017-01-11	2007	00000
9	8.2	中!文	H	a	4	2013-11-01	2011	00000
10	9.2	中!文	I	a	5	2011-11-11	2013	00000
11	1.9	中!文	J	a	6	2015-01-01	2016	00000
12	1.8	中!文	K	a	7	2012-12-11	2017	00000
13	1.7	中!文	L	a	8	2013-12-13	2022	00000
#新增列为生成列
#STORED/VIRTUAL类型生成列,分区键为生成列的引用列
DROP TABLE IF EXISTS t1;
CREATE TABLE t1(c0 INT ,
c1 FLOAT ,
c2 DOUBLE,
c3 CHAR(10),
c4 VARCHAR(10),
c5 CHAR(10),
c6 INT,
c7 TIME,
c8 YEAR GENERATED ALWAYS AS (c6*2) STORED COMMENT '数值生成列')
PARTITION BY KEY(c8) PARTITIONS 4;
INSERT INTO t1(c0,c1,c2,c3,c4,c5,c6,c7) VALUES(1,1.0,1.1,'中文','','',1000,'11:11:11'),
(2,1.1,1.2,'中!文','A','a',1001,'11:11:11'),
(3,1.2,2.2,'中@文','B','a',1002,'11:11:11'),
(4,1.3,3.2,'中_文','C','a',1003,'11:11:11'),
(5,1.4,4.2,'中$文','D','a',1004,'11:11:11'),
(6,1.5,5.2,'中%文','E','a',1005,'11:11:11'),
(7,1.6,6.2,'中^文','F','a',1006,'11:11:11'),
(8,1.7,7.2,'中&文','G','a',1000,'11:11:11'),
(9,1.8,8.2,'中*文','H','a',1001,'11:11:11'),
(10,1.9,9.2,'中-文','I','a',1002,'11:11:11'),
(11,2.0,1.9,'中=文','J','a',1003,'11:11:11'),
(12,2.1,1.8,'中+文','K','a',1004,'11:11:11');
#新增列为其他新增列的引用列
DROP TABLE IF EXISTS t1;
CREATE TABLE t1(c0 INT ,
c1 FLOAT ,
c2 DOUBLE,
c3 CHAR(10),
c4 VARCHAR(10),
c5 CHAR(10),
c6 INT ,
c7 TIME,
c8 YEAR)
PARTITION BY KEY(c6)
(PARTITION p1,PARTITION p2,PARTITION p3,PARTITION p4);
INSERT INTO t1(c1,c2,c3,c4,c5,c6,c7,c8) VALUES(1.0,1.1,'中文','','',1000,'11:11:11',2000),
(1.1,1.2,'中!文','A','a',1001,'11:11:11',2001),
(1.2,2.2,'中@文','B','a',1002,'11:11:11',2002),
(1.3,3.2,'中_文','C','a',1003,'11:11:11',2003),
(1.4,4.2,'中$文','D','a',1004,'11:11:11',2004),
(1.5,5.2,'中%文','E','a',1005,'11:11:11',2005),
(1.6,6.2,'中^文','F','a',1006,'11:11:11',2006),
(1.7,7.2,'中&文','G','a',1000,'11:11:11',2007),
(1.8,8.2,'中*文','H','a',1001,'11:11:11',2008),
(1.9,9.2,'中-文','I','a',1002,'11:11:11',2009),
(2.0,1.9,'中=文','J','a',1003,'11:11:11',2010),
(2.1,1.8,'中+文','K','a',1004,'11:11:11',2011);
DROP VIEW IF EXISTS v1;
DROP TABLE IF EXISTS t2;
DROP TABLE IF EXISTS t1;
#########Empty recycle bin, delete test database, tables, etc##########
purge recyclebin;
