purge recyclebin;
set names gbk;
drop database IF EXISTS oblrp;
create database oblrp character set gbk;
use oblrp;
set timestamp = 1600000000;
set ob_trx_timeout = 10000000000;
set ob_query_timeout = 10000000000;
SET SESSION group_concat_max_len = 100000000;
set ob_default_lob_inrow_threshold = 0;
result_format: 4
set names gbk;
drop table tt1;
create table tt1(id int,a0 varchar(1000),a varbinary(1000),r roaringbitmap,r1 roaringbitmap) character set gbk;
drop view vtt1;
create view vtt1 as select * from tt1;
insert into tt1 values(0,null,rb_build_empty(),rb_build_empty(),rb_build_varbinary(0x01060100000000000000000000003b300000010000ffff0100fffe0f00));
insert into tt1 values(1,'1',rb_from_string('1'),rb_from_string('1'),rb_build_varbinary(x'01053b3000000100000f27010000000f27'));
insert into tt1 values(2,'4294967296',rb_from_string('4294967296'),rb_from_string('4294967296'),rb_from_string('4294967296,4294967297,42949672969,4294967298,42949672961,42949672962,4294967299,4294967297,14294967296,14294967696,14295967296,5294967296,7294967296,9294967296,8294967296,42949617296,42949672916,4294967396,4294967496,
4294967595,4294967696,4294967795,4294968295,4294967995,4294977295,4294987295,4294997295,4294968295,4294969295,4295967295,4296967295,4297967295,4298967295'));
insert into tt1 values(3,'1,2,6,4,5,9',rb_from_string('1,2,6,4,5,9'),rb_from_string('1,2,6,4,5,9'),rb_from_string('1,2,3,4,5,6,7,8,9,10,11,12,13,14,15,16,17,18,19,20,21,22,23,24,25,26,27,28,29,30,31,4294967298,4294967299'));
insert into tt1 values(3,'1,2,6,4,5,9',rb_from_string('1,2,6,4,5,9'),rb_from_string('1,2,6,4,5,9'),rb_from_string('1,2,3,4,5,6,7,8,9,10,11,12,13,14,15,16,17,18,19,20,21,22,23,24,25,26,27,28,29,30,31,65537,65536'));
insert into tt1 values(4,'4294967296,4294967297,4294967298,4294967299',rb_from_string('4294967296,4294967297,4294967298,4294967299'),rb_from_string('4294967296,4294967297,4294967298,4294967299'),rb_from_string('1,2,3,4,5,6,7,8,9,10,11,12,13,14,15,16,17,18,19,20,21,22,23,24,25,26,27,28,29,30,31,65537,65536'));
insert into tt1 values(5,'1,2,3,4,5,6,7,8,9,10,11,12,13,14,15,16,17,18,19,20,21,22,23,24,25,26,27,28,29,30,31,32,33',
rb_from_string('1,2,3,4,5,6,7,8,9,10,11,12,13,14,15,16,17,18,19,20,21,22,23,24,25,26,27,28,29,30,31,32,33'),
rb_from_string('1,2,3,4,5,6,7,8,9,10,11,12,13,14,15,16,17,18,19,20,21,22,23,24,25,26,27,28,29,30,31,32,33'),rb_build_empty());
insert into tt1 values(5,'1,2,3,4,5,6,7,8,9,10,11,12,13,14,15,16,17,18,19,20,21,22,23,24,25,26,27,28,29,30,31,65537,65536',
rb_from_string('1,2,3,4,5,6,7,8,9,10,11,12,13,14,15,16,17,18,19,20,21,22,23,24,25,26,27,28,29,30,31,65537,65536'),
rb_from_string('1,2,3,4,5,6,7,8,9,10,11,12,13,14,15,16,17,18,19,20,21,22,23,24,25,26,27,28,29,30,31,65537,65536'),rb_from_string('1,2,6,4,5,9'));
insert into tt1 values(6,'1,2,3,4,5,6,7,8,9,10,11,12,13,14,15,16,17,18,19,20,21,22,23,24,25,26,27,28,29,30,31,4294967298,65536',
rb_from_string('1,2,3,4,5,6,7,8,9,10,11,12,13,14,15,16,17,18,19,20,21,22,23,24,25,26,27,28,29,30,31,4294967298,4294967299'),
rb_from_string('1,2,3,4,5,6,7,8,9,10,11,12,13,14,15,16,17,18,19,20,21,22,23,24,25,26,27,28,29,30,31,4294967298,4294967299'),rb_from_string('1,2,6,4,5,9'));
insert into tt1 values(6,'4294967296,4294967297,42949672969,4294967298,42949672961,42949672962,4294967299,4294967297,14294967296,14294967696,14295967296,5294967296,7294967296,9294967296,8294967296,42949617296,42949672916,4294967396,4294967496,
4294967595,4294967696,4294967795,4294968295,4294967995,4294977295,4294987295,4294997295,4294968295,4294969295,4295967295,4296967295,4297967295,4298967295',
rb_from_string('4294967296,4294967297,42949672969,4294967298,42949672961,42949672962,4294967299,4294967297,14294967296,14294967696,14295967296,5294967296,7294967296,9294967296,8294967296,42949617296,42949672916,4294967396,4294967496,
4294967595,4294967696,4294967795,4294968295,4294967995,4294977295,4294987295,4294997295,4294968295,4294969295,4295967295,4296967295,4297967295,4298967295'),
rb_from_string('4294967296,4294967297,42949672969,4294967298,42949672961,42949672962,4294967299,4294967297,14294967296,14294967696,14295967296,5294967296,7294967296,9294967296,8294967296,42949617296,42949672916,4294967396,4294967496,
4294967595,4294967696,4294967795,4294968295,4294967995,4294977295,4294987295,4294997295,4294968295,4294969295,4295967295,4296967295,4297967295,4298967295'),rb_from_string('4294967296'));
insert into tt1 values(7,'2542',x'01053b3000000100000f27010000000f27',rb_build_varbinary(x'01053b3000000100000f27010000000f27'),rb_from_string('4294967296'));
insert into tt1 values(8,'56214,-7854',rb_build_varbinary(0x01060100000000000000000000003b300000010000ffff0100fffe0f00),rb_build_varbinary(0x01060100000000000000000000003b300000010000ffff0100fffe0f00),rb_from_string('4294967296'));
select rb_select(r,0),rb_select(r1,1) from tt1;
+----------------+-----------------+
| rb_select(r,0) | rb_select(r1,1) |
+----------------+-----------------+
|               | ˇ˛              |
|               |               |
|               |              |
|               |              |
|               |              |
|               |              |
|               |                |
|               |              |
|               |              |
|               |              |
|               |              |
|               |              |
+----------------+-----------------+
select rb_to_string(rb_select(r,100,32,true))  from tt1 where id=5;
+----------------------------------------+
| rb_to_string(rb_select(r,100,32,true)) |
+----------------------------------------+
| 1                                      |
| 1                                      |
+----------------------------------------+
select rb_to_string(rb_select(r,2)),rb_to_string(rb_select(r1,1)) from vtt1;
+------------------------------+-------------------------------+
| rb_to_string(rb_select(r,2)) | rb_to_string(rb_select(r1,1)) |
+------------------------------+-------------------------------+
|                              | 65279                         |
| 1                            | 0                             |
| 4294967296                   | 4294967296                    |
| 1,2                          | 1                             |
| 1,2                          | 1                             |
| 4294967296,4294967297        | 1                             |
| 1,2                          |                               |
| 1,2                          | 1                             |
| 1,2                          | 1                             |
| 4294967296,4294967297        | 4294967296                    |
| 0,1                          | 4294967296                    |
| 65279,65280                  | 4294967296                    |
+------------------------------+-------------------------------+
select rb_to_string(rb_select(r,2)),rb_to_string(rb_select(r1,1,0,true)) from vtt1;
+------------------------------+--------------------------------------+
| rb_to_string(rb_select(r,2)) | rb_to_string(rb_select(r1,1,0,true)) |
+------------------------------+--------------------------------------+
|                              | 65294                                |
| 1                            | 9999                                 |
| 4294967296                   | 42949672969                          |
| 1,2                          | 4294967299                           |
| 1,2                          | 65537                                |
| 4294967296,4294967297        | 65537                                |
| 1,2                          |                                      |
| 1,2                          | 9                                    |
| 1,2                          | 9                                    |
| 4294967296,4294967297        | 4294967296                           |
| 0,1                          | 4294967296                           |
| 65279,65280                  | 4294967296                           |
+------------------------------+--------------------------------------+
select /*+ ENABLE_PARALLEL_DML parallel(256) */ rb_select(r ,2) from tt1;
+---------------------+
| rb_select(r ,2)     |
+---------------------+
|                    |
|                  |
|                  |
|                |
|                |
|               |
|                |
|                |
|                |
|               |
|                 |
| ˇ˛   ˇ              |
+---------------------+
select rb_to_string(rb_select(r,2)),rb_to_string(rb_select(r1,1)) from tt1 where id in(1,2,3);
+------------------------------+-------------------------------+
| rb_to_string(rb_select(r,2)) | rb_to_string(rb_select(r1,1)) |
+------------------------------+-------------------------------+
| 1                            | 0                             |
| 4294967296                   | 4294967296                    |
| 1,2                          | 1                             |
| 1,2                          | 1                             |
+------------------------------+-------------------------------+
select rb_select('',1);
ERROR HY000: invalid type given for an argument
select rb_select(1,1);
ERROR HY000: invalid type given for an argument
select rb_select('test',1);
ERROR HY000: invalid type given for an argument
select rb_select(null,0);
+-------------------+
| rb_select(null,0) |
+-------------------+
| NULL              |
+-------------------+
select rb_select(true,1);
ERROR HY000: invalid type given for an argument
select rb_select('‰∏≠ÂõΩ',1);
ERROR HY000: invalid type given for an argument
select rb_select(b'11',1);
ERROR HY000: Invalid data
select rb_select(rb_from_string('4294967295,4554784'),10,0,true,0,4294967295,10);
ERROR 42000: Incorrect parameter count in the call to native function 'rb_select'
select rb_select();
ERROR 42000: Incorrect parameter count in the call to native function 'rb_select'
select rb_select(null);
ERROR 42000: Incorrect parameter count in the call to native function 'rb_select'
select rb_select('');
ERROR 42000: Incorrect parameter count in the call to native function 'rb_select'
select rb_select(rb_build_empty(),0);
+-------------------------------+
| rb_select(rb_build_empty(),0) |
+-------------------------------+
|                              |
+-------------------------------+
select rb_to_string(rb_select(rb_build_empty(),1));
+---------------------------------------------+
| rb_to_string(rb_select(rb_build_empty(),1)) |
+---------------------------------------------+
|                                             |
+---------------------------------------------+
select rb_select(rb_build_agg(-1),0);
+-------------------------------+
| rb_select(rb_build_agg(-1),0) |
+-------------------------------+
|                              |
+-------------------------------+
select rb_select(rb_build_agg(-1),1);
+-------------------------------+
| rb_select(rb_build_agg(-1),1) |
+-------------------------------+
| ˇˇˇˇ                            |
+-------------------------------+
select rb_select(rb_build_agg(-1),2);
+-------------------------------+
| rb_select(rb_build_agg(-1),2) |
+-------------------------------+
| ˇˇˇˇ                            |
+-------------------------------+
select rb_select(rb_from_string(null),1);
+-----------------------------------+
| rb_select(rb_from_string(null),1) |
+-----------------------------------+
| NULL                              |
+-----------------------------------+
select rb_select(rb_from_string('1'),1);
+----------------------------------+
| rb_select(rb_from_string('1'),1) |
+----------------------------------+
|                               |
+----------------------------------+
select rb_select(rb_from_string('4294967298'),2);
+-------------------------------------------+
| rb_select(rb_from_string('4294967298'),2) |
+-------------------------------------------+
|                                       |
+-------------------------------------------+
select rb_to_string(rb_select(rb_from_string('4294967295,4554784'),1));
+-----------------------------------------------------------------+
| rb_to_string(rb_select(rb_from_string('4294967295,4554784'),1)) |
+-----------------------------------------------------------------+
| 4554784                                                         |
+-----------------------------------------------------------------+
select rb_to_string(rb_select(rb_from_string('4294967295,4554784'),1,0,true,1,4));
+----------------------------------------------------------------------------+
| rb_to_string(rb_select(rb_from_string('4294967295,4554784'),1,0,true,1,4)) |
+----------------------------------------------------------------------------+
|                                                                            |
+----------------------------------------------------------------------------+
select rb_select(rb_from_string('4294967296,18446744073709551615'),1);
+----------------------------------------------------------------+
| rb_select(rb_from_string('4294967296,18446744073709551615'),1) |
+----------------------------------------------------------------+
|                                                             |
+----------------------------------------------------------------+
select rb_select(rb_from_string('4294967296,18446744073709551615'),1);
+----------------------------------------------------------------+
| rb_select(rb_from_string('4294967296,18446744073709551615'),1) |
+----------------------------------------------------------------+
|                                                             |
+----------------------------------------------------------------+
select rb_to_string(rb_select(rb_from_string('1,2,3,4,5,6,7,8,9,10,11,12,13,14,15,16,17,18,19,20,21,22,23,24,25,26,27,28,29,30,31,4294967295'),8,0,true));
+----------------------------------------------------------------------------------------------------------------------------------------------------+
| rb_to_string(rb_select(rb_from_string('1,2,3,4,5,6,7,8,9,10,11,12,13,14,15,16,17,18,19,20,21,22,23,24,25,26,27,28,29,30,31,4294967295'),8,0,true)) |
+----------------------------------------------------------------------------------------------------------------------------------------------------+
| 25,26,27,28,29,30,31,4294967295                                                                                                                    |
+----------------------------------------------------------------------------------------------------------------------------------------------------+
select rb_select(rb_from_string('2,1,3,4,5,6,7,8,9,10,11,12,13,14,15,16,17,18,19,20,21,23,24,25,26,27,28,29,30,4294967296,18446744073709551615,4294967297'),5);
+---------------------------------------------------------------------------------------------------------------------------------------------------------+
| rb_select(rb_from_string('2,1,3,4,5,6,7,8,9,10,11,12,13,14,15,16,17,18,19,20,21,23,24,25,26,27,28,29,30,4294967296,18446744073709551615,4294967297'),5) |
+---------------------------------------------------------------------------------------------------------------------------------------------------------+
|                                                                                                                                                 |
+---------------------------------------------------------------------------------------------------------------------------------------------------------+
select rb_to_string(rb_select(rb_from_string('1,2,3,4,5,6,7,8,9,10,11,12,13,14,15,16,17,18,19,20,21,22,23,24,25,26,27,28,29,30,31,4294967295,888888888'),40));
+--------------------------------------------------------------------------------------------------------------------------------------------------------+
| rb_to_string(rb_select(rb_from_string('1,2,3,4,5,6,7,8,9,10,11,12,13,14,15,16,17,18,19,20,21,22,23,24,25,26,27,28,29,30,31,4294967295,888888888'),40)) |
+--------------------------------------------------------------------------------------------------------------------------------------------------------+
| 1,2,3,4,5,6,7,8,9,10,11,12,13,14,15,16,17,18,19,20,21,22,23,24,25,26,27,28,29,30,31,888888888,4294967295                                               |
+--------------------------------------------------------------------------------------------------------------------------------------------------------+
select rb_select(rb_from_string('1,2,3,4,5,6,7,8,9,10,11,12,13,14,15,16,17,18,19,20,21,22,23,24,25,26,27,28,29,30,31,4294967295,1,18446744073709551615,4294967296,18446744073709551611,18446744073709551614'),1);
+-----------------------------------------------------------------------------------------------------------------------------------------------------------------------------------------------------------+
| rb_select(rb_from_string('1,2,3,4,5,6,7,8,9,10,11,12,13,14,15,16,17,18,19,20,21,22,23,24,25,26,27,28,29,30,31,4294967295,1,18446744073709551615,4294967296,18446744073709551611,18446744073709551614'),1) |
+-----------------------------------------------------------------------------------------------------------------------------------------------------------------------------------------------------------+
|                                                                                                                                                                                                        |
+-----------------------------------------------------------------------------------------------------------------------------------------------------------------------------------------------------------+
select rb_to_varbinary(rb_select(rb_from_string('4294967295,4554784'),1,0,true,1,4));
+-------------------------------------------------------------------------------+
| rb_to_varbinary(rb_select(rb_from_string('4294967295,4554784'),1,0,true,1,4)) |
+-------------------------------------------------------------------------------+
|                                                                              |
+-------------------------------------------------------------------------------+
select rb_to_string(rb_select(rb_from_string('1,2,3,4,5,6,7,8,9,10,11,12,13,14,15,16,17,18,19,20,21,22,23,24,25,26,27,28,29,30,31,4294967295'),8,0,false,1,1));
+---------------------------------------------------------------------------------------------------------------------------------------------------------+
| rb_to_string(rb_select(rb_from_string('1,2,3,4,5,6,7,8,9,10,11,12,13,14,15,16,17,18,19,20,21,22,23,24,25,26,27,28,29,30,31,4294967295'),8,0,false,1,1)) |
+---------------------------------------------------------------------------------------------------------------------------------------------------------+
|                                                                                                                                                         |
+---------------------------------------------------------------------------------------------------------------------------------------------------------+
select rb_build_varbinary(rb_select(rb_from_string('4294967295,4554784'),1,0,true,1,4));
ERROR HY000: invalid type given for an argument
select rb_select(rb_build_varbinary(0x0100),2);
+-----------------------------------------+
| rb_select(rb_build_varbinary(0x0100),2) |
+-----------------------------------------+
|                                        |
+-----------------------------------------+
select rb_select(rb_build_varbinary(0x01020200000001000000),3);
+---------------------------------------------------------+
| rb_select(rb_build_varbinary(0x01020200000001000000),3) |
+---------------------------------------------------------+
|                                                     |
+---------------------------------------------------------+
select rb_select(rb_build_varbinary(rb_to_varbinary(rb_from_string('4294967295,4554784'))),9);
+----------------------------------------------------------------------------------------+
| rb_select(rb_build_varbinary(rb_to_varbinary(rb_from_string('4294967295,4554784'))),9) |
+----------------------------------------------------------------------------------------+
|  ÄE ˇˇˇˇ                                                                                 |
+----------------------------------------------------------------------------------------+
select rb_select(rb_build_varbinary(rb_to_varbinary(rb_from_string('4294967296,18446744073709551615,1,3,9,4521454414'))),10);
+-----------------------------------------------------------------------------------------------------------------------+
| rb_select(rb_build_varbinary(rb_to_varbinary(rb_from_string('4294967296,18446744073709551615,1,3,9,4521454414'))),10) |
+-----------------------------------------------------------------------------------------------------------------------+
|               	       ˇˇˇˇˇˇˇˇNÎ                                                                                      |
+-----------------------------------------------------------------------------------------------------------------------+
select rb_select(rb_from_string('1,2,3,4,5,6,7,8,9,10,11,12,13,14,15,16,17,18,19,20,21,22,23,24,25,26,27,28,29,30,31,4294967295'),4);
+-------------------------------------------------------------------------------------------------------------------------------+
| rb_select(rb_from_string('1,2,3,4,5,6,7,8,9,10,11,12,13,14,15,16,17,18,19,20,21,22,23,24,25,26,27,28,29,30,31,4294967295'),4) |
+-------------------------------------------------------------------------------------------------------------------------------+
|                                                                                                                        |
+-------------------------------------------------------------------------------------------------------------------------------+
select rb_select(rb_build_varbinary(rb_to_varbinary(rb_from_string('2,1,3,4,5,6,7,8,9,10,11,12,13,14,15,16,17,18,19,20,21,23,24,25,26,27,28,29,30,4294967296,18446744073709551615,4294967297'))),3);
+----------------------------------------------------------------------------------------------------------------------------------------------------------------------------------------------+
| rb_select(rb_build_varbinary(rb_to_varbinary(rb_from_string('2,1,3,4,5,6,7,8,9,10,11,12,13,14,15,16,17,18,19,20,21,23,24,25,26,27,28,29,30,4294967296,18446744073709551615,4294967297'))),3) |
+----------------------------------------------------------------------------------------------------------------------------------------------------------------------------------------------+
|                                                                                                                                                                                        |
+----------------------------------------------------------------------------------------------------------------------------------------------------------------------------------------------+
select rb_select(rb_build_varbinary(rb_to_varbinary(rb_from_string('1,2,3,4,5,6,7,8,9,10,11,12,13,14,15,16,17,18,19,20,21,22,23,24,25,26,27,28,29,30,31,4294967295,888888888'))),5);
+------------------------------------------------------------------------------------------------------------------------------------------------------------------------------+
| rb_select(rb_build_varbinary(rb_to_varbinary(rb_from_string('1,2,3,4,5,6,7,8,9,10,11,12,13,14,15,16,17,18,19,20,21,22,23,24,25,26,27,28,29,30,31,4294967295,888888888'))),5) |
+------------------------------------------------------------------------------------------------------------------------------------------------------------------------------+
|                                                                                                                                                                      |
+------------------------------------------------------------------------------------------------------------------------------------------------------------------------------+
select rb_select(rb_build_varbinary(rb_to_varbinary(rb_from_string('1,2,3,4,5,6,7,8,9,10,11,12,13,14,15,16,17,18,19,20,21,22,23,24,25,26,27,28,29,30,31,4294967295,1,18446744073709551615,4294967296,18446744073709551611,18446744073709551614'))),4);
+------------------------------------------------------------------------------------------------------------------------------------------------------------------------------------------------------------------------------------------------+
| rb_select(rb_build_varbinary(rb_to_varbinary(rb_from_string('1,2,3,4,5,6,7,8,9,10,11,12,13,14,15,16,17,18,19,20,21,22,23,24,25,26,27,28,29,30,31,4294967295,1,18446744073709551615,4294967296,18446744073709551611,18446744073709551614'))),4) |
+------------------------------------------------------------------------------------------------------------------------------------------------------------------------------------------------------------------------------------------------+
|                                                                                                                                                                                                                                         |
+------------------------------------------------------------------------------------------------------------------------------------------------------------------------------------------------------------------------------------------------+
select rb_select(rb_build_agg(1),1);
+------------------------------+
| rb_select(rb_build_agg(1),1) |
+------------------------------+
|                           |
+------------------------------+
select rb_select(rb_build_agg(18446744073709551615),2);
+-------------------------------------------------+
| rb_select(rb_build_agg(18446744073709551615),2) |
+-------------------------------------------------+
| ˇˇˇˇˇˇˇˇ                                              |
+-------------------------------------------------+
select rb_select(rb_to_varbinary(rb_from_string('1,2,3,4,5,6,7,8,9,10,11,12,13,14,15,16,17,18,19,20,21,22,23,24,25,26,27,28,29,30,31,4294967295,1,18446744073709551615,4294967296,18446744073709551611,18446744073709551614')),1);
ERROR HY000: invalid type given for an argument
select rb_select(rb_and(rb_from_string('1,2,3'), rb_from_string('2,3,4')),10);
+------------------------------------------------------------------------+
| rb_select(rb_and(rb_from_string('1,2,3'), rb_from_string('2,3,4')),10) |
+------------------------------------------------------------------------+
|                                                                   |
+------------------------------------------------------------------------+
select rb_and(rb_select(rb_from_string('1,2,3'),3,0,true), rb_select(rb_from_string('2,3,4'),2));
+-------------------------------------------------------------------------------------------+
| rb_and(rb_select(rb_from_string('1,2,3'),3,0,true), rb_select(rb_from_string('2,3,4'),2)) |
+-------------------------------------------------------------------------------------------+
|                                                                                      |
+-------------------------------------------------------------------------------------------+
select rb_select(rb_or(rb_from_string('1,2,3'), rb_from_string('2,3,4')),3,0,true);
+-----------------------------------------------------------------------------+
| rb_select(rb_or(rb_from_string('1,2,3'), rb_from_string('2,3,4')),3,0,true) |
+-----------------------------------------------------------------------------+
|                                                                       |
+-----------------------------------------------------------------------------+
select rb_or(rb_select(rb_from_string('1,2,3'),3),rb_select(rb_from_string('2,3,4'),3));
+----------------------------------------------------------------------------------+
| rb_or(rb_select(rb_from_string('1,2,3'),3),rb_select(rb_from_string('2,3,4'),3)) |
+----------------------------------------------------------------------------------+
|                                                                           |
+----------------------------------------------------------------------------------+
select rb_select(rb_xor(rb_from_string('1,2,3'), rb_from_string('2,3,4')),10);
+------------------------------------------------------------------------+
| rb_select(rb_xor(rb_from_string('1,2,3'), rb_from_string('2,3,4')),10) |
+------------------------------------------------------------------------+
|                                                                   |
+------------------------------------------------------------------------+
select rb_xor(rb_select(rb_from_string('1,2,3'),3), rb_select(rb_from_string('2,3,4'),3));
+------------------------------------------------------------------------------------+
| rb_xor(rb_select(rb_from_string('1,2,3'),3), rb_select(rb_from_string('2,3,4'),3)) |
+------------------------------------------------------------------------------------+
|                                                                               |
+------------------------------------------------------------------------------------+
select  rb_select(rb_xor(rb_from_string('1,2,3'), rb_from_string('2,3,4')),10);
+------------------------------------------------------------------------+
| rb_select(rb_xor(rb_from_string('1,2,3'), rb_from_string('2,3,4')),10) |
+------------------------------------------------------------------------+
|                                                                   |
+------------------------------------------------------------------------+
select rb_xor(rb_select(rb_from_string('1,2,3'),3), rb_select(rb_from_string('2,3,4'),0));
+------------------------------------------------------------------------------------+
| rb_xor(rb_select(rb_from_string('1,2,3'),3), rb_select(rb_from_string('2,3,4'),0)) |
+------------------------------------------------------------------------------------+
|                                                                              |
+------------------------------------------------------------------------------------+
select  rb_select(rb_and_null2empty(rb_from_string('1,2,3'), NULL),12);
+----------------------------------------------------------------+
| rb_select(rb_and_null2empty(rb_from_string('1,2,3'), NULL),12) |
+----------------------------------------------------------------+
|                                                               |
+----------------------------------------------------------------+
select rb_and_null2empty(rb_select(rb_from_string('1,2,3'),3), NULL);
+---------------------------------------------------------------+
| rb_and_null2empty(rb_select(rb_from_string('1,2,3'),3), NULL) |
+---------------------------------------------------------------+
|                                                              |
+---------------------------------------------------------------+
select rb_select(rb_or_null2empty(rb_from_string('1,2,3'), NULL),3);
+--------------------------------------------------------------+
| rb_select(rb_or_null2empty(rb_from_string('1,2,3'), NULL),3) |
+--------------------------------------------------------------+
|                                                        |
+--------------------------------------------------------------+
select rb_or_null2empty(rb_select(rb_from_string('1,2,3'),3), NULL);
+--------------------------------------------------------------+
| rb_or_null2empty(rb_select(rb_from_string('1,2,3'),3), NULL) |
+--------------------------------------------------------------+
|                                                        |
+--------------------------------------------------------------+
select rb_select(rb_andnot_null2empty(rb_from_string('1,2,3'), NULL),10);
+-------------------------------------------------------------------+
| rb_select(rb_andnot_null2empty(rb_from_string('1,2,3'), NULL),10) |
+-------------------------------------------------------------------+
|                                                             |
+-------------------------------------------------------------------+
select rb_andnot_null2empty(rb_select(rb_from_string('1,2,3'),3), NULL);
+------------------------------------------------------------------+
| rb_andnot_null2empty(rb_select(rb_from_string('1,2,3'),3), NULL) |
+------------------------------------------------------------------+
|                                                            |
+------------------------------------------------------------------+
select rb_select(rb_and_agg(r),10) from tt1;
+-----------------------------+
| rb_select(rb_and_agg(r),10) |
+-----------------------------+
|                            |
+-----------------------------+
select rb_and_agg(rb_select(r,10)) from tt1;
+-----------------------------+
| rb_and_agg(rb_select(r,10)) |
+-----------------------------+
|                            |
+-----------------------------+
select rb_select(0x0100,0);
+---------------------+
| rb_select(0x0100,0) |
+---------------------+
|                    |
+---------------------+
select rb_select(0x0100,1);
+---------------------+
| rb_select(0x0100,1) |
+---------------------+
|                    |
+---------------------+
bug 2024091800104495164   „Ää„Äêbitmap‰∏âÊúü„Äërb_select ÂèÇÊï∞1rb‰∏∫ÈîôËØØÁöÑÊï∞ÊçÆ‰∏îÂèÇÊï∞2ËÆæÁΩÆ0Êó∂ÔºåobÊ≤°ÊúâÂà§Êñ≠ÂèÇÊï∞1„Äã
select rb_select(0x0000,0);
ERROR HY000: Invalid data
select rb_select(0x0200,1);
ERROR HY000: Invalid data
bug 2024091800104495164   „Ää„Äêbitmap‰∏âÊúü„Äërb_select ÂèÇÊï∞1rb‰∏∫ÈîôËØØÁöÑÊï∞ÊçÆ‰∏îÂèÇÊï∞2ËÆæÁΩÆ0Êó∂ÔºåobÊ≤°ÊúâÂà§Êñ≠ÂèÇÊï∞1„Äã
select rb_select(0x0200,0,0,true,1,5);
ERROR HY000: Invalid data
select rb_select(0x00,1);
ERROR HY000: Invalid data
select rb_select(0x0101,1);
ERROR HY000: Invalid data
select rb_select(0x0102,1);
ERROR HY000: Invalid data
select rb_select(0x0103,1);
ERROR HY000: Invalid data
select rb_select(0x0104,1);
ERROR HY000: Invalid data
select rb_select(0x0105,1);
ERROR HY000: Invalid data
select rb_select(0x0106,1);
ERROR HY000: Invalid data
select rb_select(0x0107,1);
ERROR HY000: Invalid data
select rb_select(0x01,4);
ERROR HY000: Invalid data
bug 2024091800104495164   „Ää„Äêbitmap‰∏âÊúü„Äërb_select ÂèÇÊï∞1rb‰∏∫ÈîôËØØÁöÑÊï∞ÊçÆ‰∏îÂèÇÊï∞2ËÆæÁΩÆ0Êó∂ÔºåobÊ≤°ÊúâÂà§Êñ≠ÂèÇÊï∞1„Äã
select rb_select(0x584,0);
ERROR HY000: Invalid data
select rb_select(x'010100000100',1);
+------------------------------+
| rb_select(x'010100000100',1) |
+------------------------------+
|                           |
+------------------------------+
select rb_to_string(rb_select(x'010100000100',1));
+--------------------------------------------+
| rb_to_string(rb_select(x'010100000100',1)) |
+--------------------------------------------+
| 65536                                      |
+--------------------------------------------+
select rb_to_string(rb_select(x'010100000100',1,1));
+----------------------------------------------+
| rb_to_string(rb_select(x'010100000100',1,1)) |
+----------------------------------------------+
|                                              |
+----------------------------------------------+
select rb_to_string(rb_select(x'010100000100',0));
+--------------------------------------------+
| rb_to_string(rb_select(x'010100000100',0)) |
+--------------------------------------------+
|                                            |
+--------------------------------------------+
select rb_to_string(rb_select(x'010100000100',1,3));
+----------------------------------------------+
| rb_to_string(rb_select(x'010100000100',1,3)) |
+----------------------------------------------+
|                                              |
+----------------------------------------------+
select rb_to_string(rb_select(x'010100000100',2,1,true,100,100));
+-----------------------------------------------------------+
| rb_to_string(rb_select(x'010100000100',2,1,true,100,100)) |
+-----------------------------------------------------------+
|                                                           |
+-----------------------------------------------------------+
select rb_select(x'010000000100',1);
ERROR HY000: Invalid data
select rb_select(x'010200000100',1);
ERROR HY000: Invalid data
select rb_select(x'010300000100',1);
ERROR HY000: Invalid data
select rb_select(x'010400000100',1);
ERROR HY000: Invalid data
select rb_select(x'010500000100',1);
ERROR HY000: Invalid data
select rb_select(x'010600000100',1);
ERROR HY000: Invalid data
select rb_select(x'010700000100',1);
ERROR HY000: Invalid data
select rb_select(x'01010000',2);
ERROR HY000: Invalid data
select rb_select(0x0102270000000A000000,0);
+-------------------------------------+
| rb_select(0x0102270000000A000000,0) |
+-------------------------------------+
|                                    |
+-------------------------------------+
select rb_select(x'0102270000000A000000',1);
+--------------------------------------+
| rb_select(x'0102270000000A000000',1) |
+--------------------------------------+
| '   
                              |
+--------------------------------------+
select rb_to_string(rb_select(x'0102270000000A000000',2));
+----------------------------------------------------+
| rb_to_string(rb_select(x'0102270000000A000000',2)) |
+----------------------------------------------------+
| 42949672999                                        |
+----------------------------------------------------+
set @a=0x0102270000000A000000;
select rb_select(@a,1);
+-----------------+
| rb_select(@a,1) |
+-----------------+
| '   
         |
+-----------------+
select rb_select(x'010000000100',1);
ERROR HY000: Invalid data
select rb_select(x'010200000100',1);
ERROR HY000: Invalid data
select rb_select(x'010300000100',2);
ERROR HY000: Invalid data
select rb_select(x'010400000100',2);
ERROR HY000: Invalid data
select rb_select(x'010500000100',1);
ERROR HY000: Invalid data
bug 2024091800104495164   „Ää„Äêbitmap‰∏âÊúü„Äërb_select ÂèÇÊï∞1rb‰∏∫ÈîôËØØÁöÑÊï∞ÊçÆ‰∏îÂèÇÊï∞2ËÆæÁΩÆ0Êó∂ÔºåobÊ≤°ÊúâÂà§Êñ≠ÂèÇÊï∞1„Äã
select rb_select(x'010500000100',0);
ERROR HY000: Invalid data
select rb_select(x'010600000100',1);
ERROR HY000: Invalid data
select rb_select(x'010700000100',1);
ERROR HY000: Invalid data
select rb_select(x'01010000',1);
ERROR HY000: Invalid data
select rb_select(x'0102270000000A00000010000000000000000',0);
ERROR 42000: You have an error in your SQL syntax; check the manual that corresponds to your OceanBase version for the right syntax to use near 'x'0102270000000A00000010000000000000000',0)' at line 1
select rb_to_string(rb_select(0x01030220804500FFFFFFFF,3));
+-----------------------------------------------------+
| rb_to_string(rb_select(0x01030220804500FFFFFFFF,3)) |
+-----------------------------------------------------+
| 4554784,4294967295                                  |
+-----------------------------------------------------+
select rb_to_string(rb_select(x'010302FFFFFFFF20804500',2));
+------------------------------------------------------+
| rb_to_string(rb_select(x'010302FFFFFFFF20804500',2)) |
+------------------------------------------------------+
| 4554784,4294967295                                   |
+------------------------------------------------------+
select rb_select(x'010302FFFFFFFFFFFFFFFF',1);
ERROR HY000: Invalid data
select rb_select(x'010002FFFFFFFF20804500',1);
ERROR HY000: Invalid data
select rb_select(x'010102FFFFFFFF20804500',1);
ERROR HY000: Invalid data
select rb_select(x'010202FFFFFFFF20804500',1);
ERROR HY000: Invalid data
select rb_select(x'010402FFFFFFFF20804500',1);
ERROR HY000: Invalid data
select rb_select(x'010502FFFFFFFF20804500',1);
ERROR HY000: Invalid data
select rb_select(x'010602FFFFFFFF20804500',2);
ERROR HY000: Invalid data
select rb_select(x'010702FFFFFFFF20804500',3);
ERROR HY000: Invalid data
select rb_to_string(rb_select(x'0102FFFFFFFF20804500',1));
+----------------------------------------------------+
| rb_to_string(rb_select(x'0102FFFFFFFF20804500',1)) |
+----------------------------------------------------+
| 19562652615311359                                  |
+----------------------------------------------------+
select rb_select(0x01030020804500FFFFFFFF,5);
ERROR HY000: Invalid data
select rb_select(0x01030320804500FFFFFFFF,6);
ERROR HY000: Invalid data
select rb_select(0x010320804500FFFFFFFF,7);
ERROR HY000: Invalid data
select rb_select(x'010302FFFFFFFF',8);
ERROR HY000: Invalid data
select rb_select(x'010302',9);
ERROR HY000: Invalid data
select rb_to_string(rb_select(0x0104200100000000000000020000000000000003000000000000000400000000000000050000000000000006000000000000000700000000000000080000000000000009000000000000000A000000000000000B000000000000000C000000000000000D000000000000000E000000000000000F0000000000000010000000000000001100000000000000120000000000000013000000000000001400000000000000150000000000000016000000000000001700000000000000180000000000000019000000000000001A000000000000001B000000000000001C000000000000001D000000000000001E000000000000001F000000000000000000000001000000,5,3,true,1,10));
+-----------------------------------------------------------------------------------------------------------------------------------------------------------------------------------------------------------------------------------------------------------------+
| rb_to_string(rb_select(0x0104200100000000000000020000000000000003000000000000000400000000000000050000000000000006000000000000000700000000000000080000000000000009000000000000000A000000000000000B000000000000000C000000000000000D000000000000000E00000000000000 |
+-----------------------------------------------------------------------------------------------------------------------------------------------------------------------------------------------------------------------------------------------------------------+
| 2,3,4,5,6                                                                                                                                                                                                                                                       |
+-----------------------------------------------------------------------------------------------------------------------------------------------------------------------------------------------------------------------------------------------------------------+
select rb_select(0x0104200700000000000000020000000000000003000000000000000400000000000000050000000000000006000000000000000700000000000000080000000000000009000000000000000A000000000000000B000000000000000C000000000000000D000000000000000E000000000000000F0000000000000010000000000000001100000000000000120000000000000013000000000000001400000000000000150000000000000016000000000000001700000000000000180000000000000019000000000000001A000000000000001B000000000000001C000000000000001D000000000000001E000000000000001F000000000000000000000001000000,33);
ERROR HY000: Invalid data
select rb_select(0x0102200100000000000000020000000000000003000000000000000400000000000000050000000000000006000000000000000700000000000000080000000000000009000000000000000A000000000000000B000000000000000C000000000000000D000000000000000E000000000000000F0000000000000010000000000000001100000000000000120000000000000013000000000000001400000000000000150000000000000016000000000000001700000000000000180000000000000019000000000000001A000000000000001B000000000000001C000000000000001D000000000000001E000000000000001F000000000000000000000001000000,1);
ERROR HY000: Invalid data
select rb_select(0x0100200100000000000000020000000000000003000000000000000400000000000000050000000000000006000000000000000700000000000000080000000000000009000000000000000A000000000000000B000000000000000C000000000000000D000000000000000E000000000000000F0000000000000010000000000000001100000000000000120000000000000013000000000000001400000000000000150000000000000016000000000000001700000000000000180000000000000019000000000000001A000000000000001B000000000000001C000000000000001D000000000000001E000000000000001F000000000000000000000001000000,1);
ERROR HY000: Invalid data
select rb_select(0x01012200100000000000000020000000000000003000000000000000400000000000000050000000000000006000000000000000700000000000000080000000000000009000000000000000A000000000000000B000000000000000C000000000000000D000000000000000E000000000000000F0000000000000010000000000000001100000000000000120000000000000013000000000000001400000000000000150000000000000016000000000000001700000000000000180000000000000019000000000000001A000000000000001B000000000000001C000000000000001D000000000000001E000000000000001F000000000000000000000001000000,1);
ERROR HY000: Invalid data
select rb_select(0x0103200700000000000000020000000000000003000000000000000400000000000000050000000000000006000000000000000700000000000000080000000000000009000000000000000A000000000000000B000000000000000C000000000000000D000000000000000E000000000000000F0000000000000010000000000000001100000000000000120000000000000013000000000000001400000000000000150000000000000016000000000000001700000000000000180000000000000019000000000000001A000000000000001B000000000000001C000000000000001D000000000000001E000000000000001F000000000000000000000001000000,1);
ERROR HY000: Invalid data
select rb_select(0x0105200700000000000000020000000000000003000000000000000400000000000000050000000000000006000000000000000700000000000000080000000000000009000000000000000A000000000000000B000000000000000C000000000000000D000000000000000E000000000000000F0000000000000010000000000000001100000000000000120000000000000013000000000000001400000000000000150000000000000016000000000000001700000000000000180000000000000019000000000000001A000000000000001B000000000000001C000000000000001D000000000000001E000000000000001F000000000000000000000001000000,1);
ERROR HY000: Invalid data
select rb_select(0x0106200700000000000000020000000000000003000000000000000400000000000000050000000000000006000000000000000700000000000000080000000000000009000000000000000A000000000000000B000000000000000C000000000000000D000000000000000E000000000000000F0000000000000010000000000000001100000000000000120000000000000013000000000000001400000000000000150000000000000016000000000000001700000000000000180000000000000019000000000000001A000000000000001B000000000000001C000000000000001D000000000000001E000000000000001F000000000000000000000001000000,1);
ERROR HY000: Invalid data
select rb_select(0x0107200700000000000000020000000000000003000000000000000400000000000000050000000000000006000000000000000700000000000000080000000000000009000000000000000A000000000000000B000000000000000C000000000000000D000000000000000E000000000000000F0000000000000010000000000000001100000000000000120000000000000013000000000000001400000000000000150000000000000016000000000000001700000000000000180000000000000019000000000000001A000000000000001B000000000000001C000000000000001D000000000000001E000000000000001F000000000000000000000001000000,1);
ERROR HY000: Invalid data
select rb_select(0x01200100000000000000020000000000000003000000000000000400000000000000050000000000000006000000000000000700000000000000080000000000000009000000000000000A000000000000000B000000000000000C000000000000000D000000000000000E000000000000000F0000000000000010000000000000001100000000000000120000000000000013000000000000001400000000000000150000000000000016000000000000001700000000000000180000000000000019000000000000001A000000000000001B000000000000001C000000000000001D000000000000001E000000000000001F000000000000000000000001000000,1);
ERROR HY000: Invalid data
select rb_select(0x0104210100000000000000020000000000000003000000000000000400000000000000050000000000000006000000000000000700000000000000080000000000000009000000000000000A000000000000000B000000000000000C000000000000000D000000000000000E000000000000000F0000000000000010000000000000001100000000000000120000000000000013000000000000001400000000000000150000000000000016000000000000001700000000000000180000000000000019000000000000001A000000000000001B000000000000001C000000000000001D000000000000001E000000000000001F000000000000000000000001000000,1);
ERROR HY000: Invalid data
select rb_select(0x0104190100000000000000020000000000000003000000000000000400000000000000050000000000000006000000000000000700000000000000080000000000000009000000000000000A000000000000000B000000000000000C000000000000000D000000000000000E000000000000000F0000000000000010000000000000001100000000000000120000000000000013000000000000001400000000000000150000000000000016000000000000001700000000000000180000000000000019000000000000001A000000000000001B000000000000001C000000000000001D000000000000001E000000000000001F000000000000000000000001000000,1);
ERROR HY000: Invalid data
select rb_select(0x01040100000000000000020000000000000003000000000000000400000000000000050000000000000006000000000000000700000000000000080000000000000009000000000000000A000000000000000B000000000000000C000000000000000D000000000000000E000000000000000F0000000000000010000000000000001100000000000000120000000000000013000000000000001400000000000000150000000000000016000000000000001700000000000000180000000000000019000000000000001A000000000000001B000000000000001C000000000000001D000000000000001E000000000000001F000000000000000000000001000000,1);
ERROR HY000: Invalid data
select rb_select(0x0104200700000000000000020000000000000003000000000000000400000000000000050000000000000006000000000000000700000000000000080000000000000009000000000000000A000000000000000B000000000000000C000000000000000D000000000000000E000000000000000F0000000000000010000000000000001100000000000000120000000000000013000000000000001400000000000000150000000000000016000000000000001700000000000000180000000000000019000000000000001A000000000000001B000000000000001C000000000000001D000000000000001E000000000000001F00000000000000,1);
ERROR HY000: Invalid data
select rb_to_string(rb_select(X'01053A3000000200000000001F00FFFF010018000000580000000100020003000400050006000700080009000A000B000C000D000E000F0010001100120013001400150016001700180019001A001B001C001D001E001F002000FEFFFFFF',5,1, false,4,16));
+------------------------------------------------------------------------------------------------------------------------------------------------------------------------------------------------------------------------------------------+
| rb_to_string(rb_select(X'01053A3000000200000000001F00FFFF010018000000580000000100020003000400050006000700080009000A000B000C000D000E000F0010001100120013001400150016001700180019001A001B001C001D001E001F002000FEFFFFFF',5,1, false,4,16)) |
+------------------------------------------------------------------------------------------------------------------------------------------------------------------------------------------------------------------------------------------+
| 5,6,7,8,9                                                                                                                                                                                                                                |
+------------------------------------------------------------------------------------------------------------------------------------------------------------------------------------------------------------------------------------------+
select rb_to_string(rb_select(X'01053A3000000200000000001F00FFFF010018000000580000000100020003000400050006000700080009000A000B000C000D000E000F0010001100120013001400150016001700180019001A001B001C001D001E001F002000FEFFFFFF' ,5,1, true,4,16));
+------------------------------------------------------------------------------------------------------------------------------------------------------------------------------------------------------------------------------------------+
| rb_to_string(rb_select(X'01053A3000000200000000001F00FFFF010018000000580000000100020003000400050006000700080009000A000B000C000D000E000F0010001100120013001400150016001700180019001A001B001C001D001E001F002000FEFFFFFF' ,5,1, true,4,16)) |
+------------------------------------------------------------------------------------------------------------------------------------------------------------------------------------------------------------------------------------------+
| 10,11,12,13,14                                                                                                                                                                                                                           |
+------------------------------------------------------------------------------------------------------------------------------------------------------------------------------------------------------------------------------------------+
select rb_to_string(rb_select(X'01053A3000000200000000001F00FFFF010018000000580000000100020003000400050006000700080009000A000B000C000D000E000F0010001100120013001400150016001700180019001A001B001C001D001E001F002000FEFFFFFF' ,100));
+-------------------------------------------------------------------------------------------------------------------------------------------------------------------------------------------------------------------------------+
| rb_to_string(rb_select(X'01053A3000000200000000001F00FFFF010018000000580000000100020003000400050006000700080009000A000B000C000D000E000F0010001100120013001400150016001700180019001A001B001C001D001E001F002000FEFFFFFF' ,100)) |
+-------------------------------------------------------------------------------------------------------------------------------------------------------------------------------------------------------------------------------+
| 1,2,3,4,5,6,7,8,9,10,11,12,13,14,15,16,17,18,19,20,21,22,23,24,25,26,27,28,29,30,31,32,4294967294,4294967295                                                                                                                  |
+-------------------------------------------------------------------------------------------------------------------------------------------------------------------------------------------------------------------------------+
bug 2024092000104516141   „Ää[bitmap‰∏âÊúü]rb_select ÈÄÜÊó∂ËæìÂá∫Ôºåoffset ËæìÂÖ•ÂÄºÂíåvaluesÊï∞ÈáèÁõ∏Â∑Æ1Êó∂ÔºåobÊ≤°ÊúâËæìÂá∫ÂÄºÔºåÂ∫îËØ•ËæìÂá∫1‰∏™value„Äã
select rb_to_string(rb_select(X'01053A3000000200000000001F00FFFF010018000000580000000100020003000400050006000700080009000A000B000C000D000E000F0010001100120013001400150016001700180019001A001B001C001D001E001F002000FEFFFFFF' ,100,33,true));
+---------------------------------------------------------------------------------------------------------------------------------------------------------------------------------------------------------------------------------------+
| rb_to_string(rb_select(X'01053A3000000200000000001F00FFFF010018000000580000000100020003000400050006000700080009000A000B000C000D000E000F0010001100120013001400150016001700180019001A001B001C001D001E001F002000FEFFFFFF' ,100,33,true)) |
+---------------------------------------------------------------------------------------------------------------------------------------------------------------------------------------------------------------------------------------+
| 1                                                                                                                                                                                                                                     |
+---------------------------------------------------------------------------------------------------------------------------------------------------------------------------------------------------------------------------------------+
select rb_to_string(rb_select(X'01053A3000000200000000001F00FFFF010018000000580000000100020003000400050006000700080009000A000B000C000D000E000F0010001100120013001400150016001700180019001A001B001C001D001E001F002000FEFFFFFF' ,100,32,true));
+---------------------------------------------------------------------------------------------------------------------------------------------------------------------------------------------------------------------------------------+
| rb_to_string(rb_select(X'01053A3000000200000000001F00FFFF010018000000580000000100020003000400050006000700080009000A000B000C000D000E000F0010001100120013001400150016001700180019001A001B001C001D001E001F002000FEFFFFFF' ,100,32,true)) |
+---------------------------------------------------------------------------------------------------------------------------------------------------------------------------------------------------------------------------------------+
| 1,2                                                                                                                                                                                                                                   |
+---------------------------------------------------------------------------------------------------------------------------------------------------------------------------------------------------------------------------------------+
select rb_to_string(rb_select(X'01053A3000000200000000001F00FFFF010018000000580000000100020003000400050006000700080009000A000B000C000D000E000F0010001100120013001400150016001700180019001A001B001C001D001E001F002000FEFFFFFF' ,100,33));
+----------------------------------------------------------------------------------------------------------------------------------------------------------------------------------------------------------------------------------+
| rb_to_string(rb_select(X'01053A3000000200000000001F00FFFF010018000000580000000100020003000400050006000700080009000A000B000C000D000E000F0010001100120013001400150016001700180019001A001B001C001D001E001F002000FEFFFFFF' ,100,33)) |
+----------------------------------------------------------------------------------------------------------------------------------------------------------------------------------------------------------------------------------+
| 4294967295                                                                                                                                                                                                                       |
+----------------------------------------------------------------------------------------------------------------------------------------------------------------------------------------------------------------------------------+
select rb_to_string(rb_select(rb_from_string('1,3,8,9,10,79,4,7,66,10,11,12,343,200,790,1000,12023,345,555,19090,23345,7854454') ,2,1, true,7,200));
+----------------------------------------------------------------------------------------------------------------------------------------------+
| rb_to_string(rb_select(rb_from_string('1,3,8,9,10,79,4,7,66,10,11,12,343,200,790,1000,12023,345,555,19090,23345,7854454') ,2,1, true,7,200)) |
+----------------------------------------------------------------------------------------------------------------------------------------------+
| 12,66                                                                                                                                        |
+----------------------------------------------------------------------------------------------------------------------------------------------+
select rb_to_string(rb_select(rb_from_string('1,3,8,9,10,79,4,7,66,10,11,12,343,200,790,1000,12023,345,555,19090,23345,7854454') ,2,1, false,7,200));
+-----------------------------------------------------------------------------------------------------------------------------------------------+
| rb_to_string(rb_select(rb_from_string('1,3,8,9,10,79,4,7,66,10,11,12,343,200,790,1000,12023,345,555,19090,23345,7854454') ,2,1, false,7,200)) |
+-----------------------------------------------------------------------------------------------------------------------------------------------+
| 8,9                                                                                                                                           |
+-----------------------------------------------------------------------------------------------------------------------------------------------+
select rb_to_string(rb_select(rb_from_string('1,3,8,9,10,79,4,7,66,10,11,12,343,200,790,1000,12023,345,555,19090,23345,7854454') ,1,1, false,7,200));
+-----------------------------------------------------------------------------------------------------------------------------------------------+
| rb_to_string(rb_select(rb_from_string('1,3,8,9,10,79,4,7,66,10,11,12,343,200,790,1000,12023,345,555,19090,23345,7854454') ,1,1, false,7,200)) |
+-----------------------------------------------------------------------------------------------------------------------------------------------+
| 8                                                                                                                                             |
+-----------------------------------------------------------------------------------------------------------------------------------------------+
select rb_to_string(rb_select(rb_from_string('1,3,8,9,10,79,4,7,66,10,11,12,343,200,790,1000,12023,345,555,19090,23345,7854454') ,1,1, true,7,200));
+----------------------------------------------------------------------------------------------------------------------------------------------+
| rb_to_string(rb_select(rb_from_string('1,3,8,9,10,79,4,7,66,10,11,12,343,200,790,1000,12023,345,555,19090,23345,7854454') ,1,1, true,7,200)) |
+----------------------------------------------------------------------------------------------------------------------------------------------+
| 66                                                                                                                                           |
+----------------------------------------------------------------------------------------------------------------------------------------------+
select rb_to_string(rb_select(rb_from_string('1,3,8,9,10,79,4,7,66,10,11,12,343,200,790,1000,12023,345,555,19090,23345,7854454') ,5,1, true,7,200));
+----------------------------------------------------------------------------------------------------------------------------------------------+
| rb_to_string(rb_select(rb_from_string('1,3,8,9,10,79,4,7,66,10,11,12,343,200,790,1000,12023,345,555,19090,23345,7854454') ,5,1, true,7,200)) |
+----------------------------------------------------------------------------------------------------------------------------------------------+
| 9,10,11,12,66                                                                                                                                |
+----------------------------------------------------------------------------------------------------------------------------------------------+
select rb_to_string(rb_select(rb_from_string('1,3,8,9,10,79,4,7,66,10,11,12,343,200,790,1000,12023,345,555,19090,23345,7854454') ,5,1, false,7,200));
+-----------------------------------------------------------------------------------------------------------------------------------------------+
| rb_to_string(rb_select(rb_from_string('1,3,8,9,10,79,4,7,66,10,11,12,343,200,790,1000,12023,345,555,19090,23345,7854454') ,5,1, false,7,200)) |
+-----------------------------------------------------------------------------------------------------------------------------------------------+
| 8,9,10,11,12                                                                                                                                  |
+-----------------------------------------------------------------------------------------------------------------------------------------------+
select rb_to_string(rb_select(rb_from_string('1,3,8,9,10,79,4,7,66,10,11,12,343,200,790,1000,12023,345,555,19090,23345,7854454') ,33,1, false,7,200));
+------------------------------------------------------------------------------------------------------------------------------------------------+
| rb_to_string(rb_select(rb_from_string('1,3,8,9,10,79,4,7,66,10,11,12,343,200,790,1000,12023,345,555,19090,23345,7854454') ,33,1, false,7,200)) |
+------------------------------------------------------------------------------------------------------------------------------------------------+
| 8,9,10,11,12,66,79                                                                                                                             |
+------------------------------------------------------------------------------------------------------------------------------------------------+
select rb_select(x'01053A3000000200000000001F00FFFF010018000000580000000100020003000400050007000600080009000A000B000C000D000E000F0010001100120013001400150016001700180019001A001B001C001D001E001F002000FEFFFFFF',1);
ERROR HY000: Invalid data
select rb_select(0x01053A3000000200000001001F00FFFF010018000000580000000100020003000400050006000700080009000A000B000C000D000E000F0010001100120013001400150016001700180019001A001B001C001D001E001F002000FEFFFFFF,6);
+-------------------------------------------------------------------------------------------------------------------------------------------------------------------------------------------------------------+
| rb_select(0x01053A3000000200000001001F00FFFF010018000000580000000100020003000400050006000700080009000A000B000C000D000E000F0010001100120013001400150016001700180019001A001B001C001D001E001F002000FEFFFFFF,6) |
+-------------------------------------------------------------------------------------------------------------------------------------------------------------------------------------------------------------+
|                                                                                                                                                                                              |
+-------------------------------------------------------------------------------------------------------------------------------------------------------------------------------------------------------------+
select rb_select(x'00053A3000000200000000001F00FFFF010018000000580000000100020003000400050007000600080009000A000B000C000D000E000F0010001100120013001400150016001700180019001A001B001C001D001E001F002000FEFFFFFF',20,2,true,4,32);
ERROR HY000: Invalid data
select rb_select(x'02053A3000000200000000001F00FFFF010018000000580000000100020003000400050007000600080009000A000B000C000D000E000F0010001100120013001400150016001700180019001A001B001C001D001E001F002000FEFFFFFF',1);
ERROR HY000: Invalid data
select rb_select(x'053A3000000200000000001F00FFFF010018000000580000000100020003000400050007000600080009000A000B000C000D000E000F0010001100120013001400150016001700180019001A001B001C001D001E001F002000FEFFFFFF',1);
ERROR HY000: Invalid data
select rb_select(x'01003A3000000200000000001F00FFFF010018000000580000000100020003000400050007000600080009000A000B000C000D000E000F0010001100120013001400150016001700180019001A001B001C001D001E001F002000FEFFFFFF',2);
ERROR HY000: Invalid data
select rb_select(x'01013A3000000200000000001F00FFFF010018000000580000000100020003000400050007000600080009000A000B000C000D000E000F0010001100120013001400150016001700180019001A001B001C001D001E001F002000FEFFFFFF',4);
ERROR HY000: Invalid data
select rb_select(x'01023A3000000200000000001F00FFFF010018000000580000000100020003000400050007000600080009000A000B000C000D000E000F0010001100120013001400150016001700180019001A001B001C001D001E001F002000FEFFFFFF',5);
ERROR HY000: Invalid data
select rb_select(x'01033A3000000200000000001F00FFFF010018000000580000000100020003000400050007000600080009000A000B000C000D000E000F0010001100120013001400150016001700180019001A001B001C001D001E001F002000FEFFFFFF',7);
ERROR HY000: Invalid data
select rb_select(x'01043A3000000200000000001F00FFFF010018000000580000000100020003000400050007000600080009000A000B000C000D000E000F0010001100120013001400150016001700180019001A001B001C001D001E001F002000FEFFFFFF',3);
ERROR HY000: Invalid data
select rb_select(x'01063A3000000200000000001F00FFFF010018000000580000000100020003000400050007000600080009000A000B000C000D000E000F0010001100120013001400150016001700180019001A001B001C001D001E001F002000FEFFFFFF',4);
ERROR HY000: Invalid data
select rb_select(x'01073A3000000200000000001F00FFFF010018000000580000000100020003000400050007000600080009000A000B000C000D000E000F0010001100120013001400150016001700180019001A001B001C001D001E001F002000FEFFFFFF',5);
ERROR HY000: Invalid data
select rb_select(x'013A3000000200000000001F00FFFF010018000000580000000100020003000400050007000600080009000A000B000C000D000E000F0010001100120013001400150016001700180019001A001B001C001D001E001F002000FEFFFFFF',1);
ERROR HY000: Invalid data
select rb_select(0x01052A3000000200000000001F00FFFF010018000000580000000100020003000400050006000700080009000A000B000C000D000E000F0010001100120013001400150016001700180019001A001B001C001D001E001F002000FEFFFFFF,5);
ERROR HY000: Invalid data
select rb_select(0x01050200000000001F00FFFF010018000000580000000100020003000400050006000700080009000A000B000C000D000E000F0010001100120013001400150016001700180019001A001B001C001D001E001F002000FEFFFFFF,5);
ERROR HY000: Invalid data
select rb_select(x'01053A3000000200000000001F008F020000FFFF01002000000060000000620000000100020003000400050006000700080009000A000B000C000D000E000F0010001100120013001400150016001700180019001A001B001C001D001E001F002000285CFEFFFFFF',1);
ERROR HY000: Invalid data
select rb_select(x'01053A3000000400000000001F008F020000FFFF01002000000060000000620000000100020003000400050006000700080009000A000B000C000D000E000F0010001100120013001400150016001700180019001A001B001C001D001E001F002000285CFEFFFFFF',10);
ERROR HY000: Invalid data
select rb_select(x'01053A30000000001F008F020000FFFF01002000000060000000620000000100020003000400050006000700080009000A000B000C000D000E000F0010001100120013001400150016001700180019001A001B001C001D001E001F002000285CFEFFFFFF',1);
ERROR HY000: Invalid data
select rb_select(x'01053A3000000300000001001F008F020000FFFF01002000000060000000620000000100020003000400050006000700080009000A000B000C000D000E000F0010001100120013001400150016001700180019001A001B001C001D001E001F002000285CFEFFFFFF',2);
+----------------------------------------------------------------------------------------------------------------------------------------------------------------------------------------------------------------------------------+
| rb_select(x'01053A3000000300000001001F008F020000FFFF01002000000060000000620000000100020003000400050006000700080009000A000B000C000D000E000F0010001100120013001400150016001700180019001A001B001C001D001E001F002000285CFEFFFFFF',2) |
+----------------------------------------------------------------------------------------------------------------------------------------------------------------------------------------------------------------------------------+
|                                                                                                                                                                                                                           |
+----------------------------------------------------------------------------------------------------------------------------------------------------------------------------------------------------------------------------------+
select rb_select(x'01053A300000030000001F008F020000FFFF01002000000060000000620000000100020003000400050006000700080009000A000B000C000D000E000F0010001100120013001400150016001700180019001A001B001C001D001E001F002000285CFEFFFFFF',1);
ERROR HY000: Invalid data
select rb_select(x'01053A3000000300000001001E008F020000FFFF01002000000060000000620000000100020003000400050006000700080009000A000B000C000D000E000F0010001100120013001400150016001700180019001A001B001C001D001E001F002000285CFEFFFFFF',34);
ERROR HY000: Invalid data
select rb_select(x'01053A30000003000000010020008F020000FFFF01002000000060000000620000000100020003000400050006000700080009000A000B000C000D000E000F0010001100120013001400150016001700180019001A001B001C001D001E001F002000285CFEFFFFFF',1);
ERROR HY000: Invalid data
select rb_select(x'01053A300000030000000100ffff8F020000FFFF01002000000060000000620000000100020003000400050006000700080009000A000B000C000D000E000F0010001100120013001400150016001700180019001A001B001C001D001E001F002000285CFEFFFFFF',1);
ERROR HY000: Invalid data
select rb_select(x'01053A3000000300000001008F020000FFFF01002000000060000000620000000100020003000400050006000700080009000A000B000C000D000E000F0010001100120013001400150016001700180019001A001B001C001D001E001F002000285CFEFFFFFF',1);
ERROR HY000: Invalid data
select rb_select(x'01053A3000000300000000001F008F020001FFFF01002000000060000000620000000100020003000400050006000700080009000A000B000C000D000E000F0010001100120013001400150016001700180019001A001B001C001D001E001F002000285CFEFFFFFF',2);
ERROR HY000: Invalid data
select rb_select(x'01053A3000000300000000001F008F020000FFFF00002000000060000000620000000100020003000400050006000700080009000A000B000C000D000E000F0010001100120013001400150016001700180019001A001B001C001D001E001F002000285CFEFFFFFF',5);
ERROR HY000: Invalid data
select rb_select(x'01053A3000000300000000001F008F020000FFFF00002000000060000000620000000100020003000400050006000700080009000A000B000C000D000E000F0010001100120013001400150016001700180019001A001B001C001D001E001F002000285CFEFFFFFF',50);
ERROR HY000: Invalid data
select rb_select(x'01053A3000000300000000001F008F020000FFFF01001000000060000000620000000100020003000400050006000700080009000A000B000C000D000E000F0010001100120013001400150016001700180019001A001B001C001D001E001F002000285CFEFFFFFF',1);
+----------------------------------------------------------------------------------------------------------------------------------------------------------------------------------------------------------------------------------+
| rb_select(x'01053A3000000300000000001F008F020000FFFF01001000000060000000620000000100020003000400050006000700080009000A000B000C000D000E000F0010001100120013001400150016001700180019001A001B001C001D001E001F002000285CFEFFFFFF',1) |
+----------------------------------------------------------------------------------------------------------------------------------------------------------------------------------------------------------------------------------+
|                                                                                                                                                                                                                               |
+----------------------------------------------------------------------------------------------------------------------------------------------------------------------------------------------------------------------------------+
select rb_select(x'01053A3000000300000000001F008F020000FFFF010020000000600000000100020003000400050006000700080009000A000B000C000D000E000F0010001100120013001400150016001700180019001A001B001C001D001E001F002000285CFEFFFFFF',1);
ERROR HY000: Invalid data
select rb_select(x'01053A3000000300000000001F008F020000FFFF0100200000006000000062000000',4,4,true,3,7);
ERROR HY000: Invalid data
select rb_to_string(rb_select(0x01053A3000000200000000001F000010010018000000580000000100020003000400050006000700080009000A000B000C000D000E000F0010001100120013001400150016001700180019001A001B001C001D001E001F002000FEFFFFFF,33));
+----------------------------------------------------------------------------------------------------------------------------------------------------------------------------------------------------------------------------+
| rb_to_string(rb_select(0x01053A3000000200000000001F000010010018000000580000000100020003000400050006000700080009000A000B000C000D000E000F0010001100120013001400150016001700180019001A001B001C001D001E001F002000FEFFFFFF,33)) |
+----------------------------------------------------------------------------------------------------------------------------------------------------------------------------------------------------------------------------+
| 1,2,3,4,5,6,7,8,9,10,11,12,13,14,15,16,17,18,19,20,21,22,23,24,25,26,27,28,29,30,31,32,268500990                                                                                                                           |
+----------------------------------------------------------------------------------------------------------------------------------------------------------------------------------------------------------------------------+
select rb_select(x'01060400000000000000000000003A3000000200000000001F00FFFF010018000000580000000100020003000400050006000700080009000A000B000C000D000E000F0010001100120013001400150016001700180019001A001B001C001D001E001F002000FEFFFFFF010000003A30000001000000000000001000000000000A0000003A3000000100000000000000100000000700FFFFFFFF3A30000001000000FFFF020010000000FDFFFEFFfFFF',33);
+-----------------------------------------------------------------------------------------------------------------------------------------------------------------------------------------------------------------------------------------------------------------+
| rb_select(x'01060400000000000000000000003A3000000200000000001F00FFFF010018000000580000000100020003000400050006000700080009000A000B000C000D000E000F0010001100120013001400150016001700180019001A001B001C001D001E001F002000FEFFFFFF010000003A300000010000000000000 |
+-----------------------------------------------------------------------------------------------------------------------------------------------------------------------------------------------------------------------------------------------------------------+
|            :0        ˇˇ     X           	 
                        ˛ˇ                                                                                                                                                            |
+-----------------------------------------------------------------------------------------------------------------------------------------------------------------------------------------------------------------------------------------------------------------+
select rb_to_string(rb_select(x'01060400000000000000000000003A3000000200000000001F00FFFF010018000000580000000100020003000400050006000700080009000A000B000C000D000E000F0010001100120013001400150016001700180019001A001B001C001D001E001F002000FEFFFFFF010000003A30000001000000000000001000000000000A0000003A3000000100000000000000100000000700FFFFFFFF3A30000001000000FFFF020010000000FDFFFEFFfFFF',abs(-33)));
+-----------------------------------------------------------------------------------------------------------------------------------------------------------------------------------------------------------------------------------------------------------------+
| rb_to_string(rb_select(x'01060400000000000000000000003A3000000200000000001F00FFFF010018000000580000000100020003000400050006000700080009000A000B000C000D000E000F0010001100120013001400150016001700180019001A001B001C001D001E001F002000FEFFFFFF010000003A30000001 |
+-----------------------------------------------------------------------------------------------------------------------------------------------------------------------------------------------------------------------------------------------------------------+
| 1,2,3,4,5,6,7,8,9,10,11,12,13,14,15,16,17,18,19,20,21,22,23,24,25,26,27,28,29,30,31,32,4294967294                                                                                                                                                               |
+-----------------------------------------------------------------------------------------------------------------------------------------------------------------------------------------------------------------------------------------------------------------+
select rb_to_string(rb_select(x'01060400000000000000000000003A3000000200000000001F00FFFF010018000000580000000100020003000400050006000700080009000A000B000C000D000E000F0010001100120013001400150016001700180019001A001B001C001D001E001F002000FEFFFFFF010000003A30000001000000000000001000000000000A0000003A3000000100000000000000100000000700FFFFFFFF3A30000001000000FFFF020010000000FDFFFEFFfFFF',33));
+-----------------------------------------------------------------------------------------------------------------------------------------------------------------------------------------------------------------------------------------------------------------+
| rb_to_string(rb_select(x'01060400000000000000000000003A3000000200000000001F00FFFF010018000000580000000100020003000400050006000700080009000A000B000C000D000E000F0010001100120013001400150016001700180019001A001B001C001D001E001F002000FEFFFFFF010000003A30000001 |
+-----------------------------------------------------------------------------------------------------------------------------------------------------------------------------------------------------------------------------------------------------------------+
| 1,2,3,4,5,6,7,8,9,10,11,12,13,14,15,16,17,18,19,20,21,22,23,24,25,26,27,28,29,30,31,32,4294967294                                                                                                                                                               |
+-----------------------------------------------------------------------------------------------------------------------------------------------------------------------------------------------------------------------------------------------------------------+
select rb_to_string(rb_select(x'01060400000000000000000000003A3000000200000000001F00FFFF010018000000580000000100020003000400050006000700080009000A000B000C000D000E000F0010001100120013001400150016001700180019001A001B001C001D001E001F002000FEFFFFFF010000003A30000001000000000000001000000000000A0000003A3000000100000000000000100000000700FFFFFFFF3A30000001000000FFFF020010000000FDFFFEFFfFFF',100,0,true,2,18446744073709551616-1));
ERROR HY000: invalid type given for an argument
select rb_select(0x01060400000000000000000000003A3000000200000000001F00FFFF010018000000580000000100020003000400050006000700080009000A000B000C000D000E000F0010001100120013001400150016001700180019001A001B001C001D001E001F002000FEFFFFFF010000003A30000001000000000000001000000000000A0000003A3000000100000000000000100000000700FFFFFFFF3A30000001000000FFFF020010000000FDFFFEFFFFFF,35);
+-----------------------------------------------------------------------------------------------------------------------------------------------------------------------------------------------------------------------------------------------------------------+
| rb_select(0x01060400000000000000000000003A3000000200000000001F00FFFF010018000000580000000100020003000400050006000700080009000A000B000C000D000E000F0010001100120013001400150016001700180019001A001B001C001D001E001F002000FEFFFFFF010000003A300000010000000000000 |
+-----------------------------------------------------------------------------------------------------------------------------------------------------------------------------------------------------------------------------------------------------------------+
|            :0        ˇˇ    X           	 
                        ˛ˇˇˇ   :0                                                                                                                                                    |
+-----------------------------------------------------------------------------------------------------------------------------------------------------------------------------------------------------------------------------------------------------------------+
select rb_select(x'01060400000000000000000000003A3000000200000000001F00FFFF010018000000580000000100020003000400050006000700080009000A000B000C000D000E000F0010001100120013001400150016001700180019001A001B001C001D001E001F002000FEFFFFFF010000003A30000001000000000000001000000000000A0000003A3000000100000000000000100000000700FFFFFFFF3A30000001000000FFFF020010000000FDFFFeFFFfFF',32,0,true);
+---------------------------------------------------------------------------------------------------------------------------------------------------------------------------------------------------------------------------------------------------------------------+
| rb_select(x'01060400000000000000000000003A3000000200000000001F00FFFF010018000000580000000100020003000400050006000700080009000A000B000C000D000E000F0010001100120013001400150016001700180019001A001B001C001D001E001F002000FEFFFFFF010000003A300000010000000000000     |
+---------------------------------------------------------------------------------------------------------------------------------------------------------------------------------------------------------------------------------------------------------------------+
|     
          	       
                     ˝ˇˇˇˇˇˇˇ       ˛ˇˇˇˇˇˇˇ       ˇˇˇˇˇˇˇˇ                                                                                                                               ˛ˇˇˇ    ˇˇˇˇ                                            |
+---------------------------------------------------------------------------------------------------------------------------------------------------------------------------------------------------------------------------------------------------------------------+
select rb_to_string(rb_select(0x01060200000000000000000000003A3000000100000000001F00100000000100020003000400050006000700080009000A000B000C000D000E000F0010001100120013001400150016001700180019001A001B001C001D001E001F002100010000003A3000000100000000000000100000000000,2));
+-----------------------------------------------------------------------------------------------------------------------------------------------------------------------------------------------------------------------------------------------------------------+
| rb_to_string(rb_select(0x01060200000000000000000000003A3000000100000000001F00100000000100020003000400050006000700080009000A000B000C000D000E000F0010001100120013001400150016001700180019001A001B001C001D001E001F002100010000003A30000001000000000000001000000000 |
+-----------------------------------------------------------------------------------------------------------------------------------------------------------------------------------------------------------------------------------------------------------------+
| 1,2                                                                                                                                                                                                                                                             |
+-----------------------------------------------------------------------------------------------------------------------------------------------------------------------------------------------------------------------------------------------------------------+
select rb_select(0x01060200000000000000000000003A3000000100000000001F00100000000100020003000400050006000700080009000A000B000C000D000E000F0010001100120013001400150016001700180019001A001B001C001D001E001F002100010000003A3000000100000000000000100000000000,6);
+---------------------------------------------------------------------------------------------------------------------------------------------------------------------------------------------------------------------------------------------------------+
| rb_select(0x01060200000000000000000000003A3000000100000000001F00100000000100020003000400050006000700080009000A000B000C000D000E000F0010001100120013001400150016001700180019001A001B001C001D001E001F002100010000003A3000000100000000000000100000000000,6) |
+---------------------------------------------------------------------------------------------------------------------------------------------------------------------------------------------------------------------------------------------------------+
|                                                                                                                                                                                                                                                |
+---------------------------------------------------------------------------------------------------------------------------------------------------------------------------------------------------------------------------------------------------------+
select rb_select(x'00060400000000000000000000003A3000000200000000001F00FFFF010018000000580000000100020003000400050006000700080009000A000B000C000D000E000F0010001100120013001400150016001700180019001A001B001C001D001E001F002000FEFFFFFF010000003A30000001000000000000001000000000000A0000003A3000000100000000000000100000000700FFFFFFFF3A30000001000000FFFF020010000000FDFFFFFFFEFF',1);
ERROR HY000: Invalid data
select rb_select(x'02060400000000000000000000003A3000000200000000001F00FFFF010018000000580000000100020003000400050006000700080009000A000B000C000D000E000F0010001100120013001400150016001700180019001A001B001C001D001E001F002000FEFFFFFF010000003A30000001000000000000001000000000000A0000003A3000000100000000000000100000000700FFFFFFFF3A30000001000000FFFF020010000000FDFFFFFFFEFF',1);
ERROR HY000: Invalid data
select rb_select(x'060400000000000000000000003A3000000200000000001F00FFFF010018000000580000000100020003000400050006000700080009000A000B000C000D000E000F0010001100120013001400150016001700180019001A001B001C001D001E001F002000FEFFFFFF010000003A30000001000000000000001000000000000A0000003A3000000100000000000000100000000700FFFFFFFF3A30000001000000FFFF020010000000FDFFFFFFFEFF',1);
ERROR HY000: Invalid data
select rb_select(x'01050400000000000000000000003A3000000200000000001F00FFFF010018000000580000000100020003000400050006000700080009000A000B000C000D000E000F0010001100120013001400150016001700180019001A001B001C001D001E001F002000FEFFFFFF010000003A30000001000000000000001000000000000A0000003A3000000100000000000000100000000700FFFFFFFF3A30000001000000FFFF020010000000FDFFFFFFFEFF',1);
ERROR HY000: Invalid data
select rb_select(x'01010400000000000000000000003A3000000200000000001F00FFFF010018000000580000000100020003000400050006000700080009000A000B000C000D000E000F0010001100120013001400150016001700180019001A001B001C001D001E001F002000FEFFFFFF010000003A30000001000000000000001000000000000A0000003A3000000100000000000000100000000700FFFFFFFF3A30000001000000FFFF020010000000FDFFFFFFFEFF',1);
ERROR HY000: Invalid data
select rb_select(x'01020400000000000000000000003A3000000200000000001F00FFFF010018000000580000000100020003000400050006000700080009000A000B000C000D000E000F0010001100120013001400150016001700180019001A001B001C001D001E001F002000FEFFFFFF010000003A30000001000000000000001000000000000A0000003A3000000100000000000000100000000700FFFFFFFF3A30000001000000FFFF020010000000FDFFFFFFFEFF',1);
ERROR HY000: Invalid data
select rb_select(x'01030400000000000000000000003A3000000200000000001F00FFFF010018000000580000000100020003000400050006000700080009000A000B000C000D000E000F0010001100120013001400150016001700180019001A001B001C001D001E001F002000FEFFFFFF010000003A30000001000000000000001000000000000A0000003A3000000100000000000000100000000700FFFFFFFF3A30000001000000FFFF020010000000FDFFFFFFFEFF',1);
ERROR HY000: Invalid data
select rb_select(x'01040400000000000000000000003A3000000200000000001F00FFFF010018000000580000000100020003000400050006000700080009000A000B000C000D000E000F0010001100120013001400150016001700180019001A001B001C001D001E001F002000FEFFFFFF010000003A30000001000000000000001000000000000A0000003A3000000100000000000000100000000700FFFFFFFF3A30000001000000FFFF020010000000FDFFFFFFFEFF',1);
ERROR HY000: Invalid data
select rb_select(x'01070400000000000000000000003A3000000200000000001F00FFFF010018000000580000000100020003000400050006000700080009000A000B000C000D000E000F0010001100120013001400150016001700180019001A001B001C001D001E001F002000FEFFFFFF010000003A30000001000000000000001000000000000A0000003A3000000100000000000000100000000700FFFFFFFF3A30000001000000FFFF020010000000FDFFFFFFFEFF',1,1,true,1,6);
ERROR HY000: Invalid data
select rb_select(x'010400000000000000000000003A3000000200000000001F00FFFF010018000000580000000100020003000400050006000700080009000A000B000C000D000E000F0010001100120013001400150016001700180019001A001B001C001D001E001F002000FEFFFFFF010000003A30000001000000000000001000000000000A0000003A3000000100000000000000100000000700FFFFFFFF3A30000001000000FFFF020010000000FDFFFFFFFEFF',50);
ERROR HY000: Invalid data
select rb_select(x'01060300000000000000000000003A3000000200000000001F00FFFF010018000000580000000100020003000400050006000700080009000A000B000C000D000E000F0010001100120013001400150016001700180019001A001B001C001D001E001F002000FEFFFFFF010000003A30000001000000000000001000000000000A0000003A3000000100000000000000100000000700FFFFFFFF3A30000001000000FFFF020010000000FDFFFFFFFEFF',90);
ERROR HY000: Invalid data
select rb_select(x'01060500000000000000000000003A3000000200000000001F00FFFF010018000000580000000100020003000400050006000700080009000A000B000C000D000E000F0010001100120013001400150016001700180019001A001B001C001D001E001F002000FEFFFFFF010000003A30000001000000000000001000000000000A0000003A3000000100000000000000100000000700FFFFFFFF3A30000001000000FFFF020010000000FDFFFFFFFEFF',1);
ERROR HY000: Invalid data
select rb_select(x'0106000000003A3000000200000000001F00FFFF010018000000580000000100020003000400050006000700080009000A000B000C000D000E000F0010001100120013001400150016001700180019001A001B001C001D001E001F002000FEFFFFFF010000003A30000001000000000000001000000000000A0000003A3000000100000000000000100000000700FFFFFFFF3A30000001000000FFFF020010000000FDFFFFFFFEFF',3);
ERROR HY000: Invalid data
select rb_select(x'01060400000000000000000000003A3000000200000000001F00FFFF010018000000580000000100020003000400050006000700080009000A000B000C000D000E000F0010001100120013001400150016001700180019001A001B001C001D001E001F002000FEFFFFFF010000003A30000001000000000000001000000000000A0000003A3000000100000000000000100000000700FFFFFFFF3A30000001000000FFFF020010000000FDFFFFFFFEFF',4);
ERROR HY000: Invalid data
select rb_select(x'01060400000000000000000000002A3000000200000000001F00FFFF010018000000580000000100020003000400050006000700080009000A000B000C000D000E000F0010001100120013001400150016001700180019001A001B001C001D001E001F002000FEFFFFFF010000003A30000001000000000000001000000000000A0000003A3000000100000000000000100000000700FFFFFFFF3A30000001000000FFFF020010000000FDFFFFFFFEFF',6);
ERROR HY000: Invalid data
select rb_select(x'01060400000000000000000000000200000000001F00FFFF010018000000580000000100020003000400050006000700080009000A000B000C000D000E000F0010001100120013001400150016001700180019001A001B001C001D001E001F002000FEFFFFFF010000003A30000001000000000000001000000000000A0000003A3000000100000000000000100000000700FFFFFFFF3A30000001000000FFFF020010000000FDFFFFFFFEFF',30);
ERROR HY000: Invalid data
select rb_select(x'01060400000000000000000000003A3000000100000000001F00FFFF010018000000580000000100020003000400050006000700080009000A000B000C000D000E000F0010001100120013001400150016001700180019001A001B001C001D001E001F002000FEFFFFFF010000003A30000001000000000000001000000000000A0000003A3000000100000000000000100000000700FFFFFFFF3A30000001000000FFFF020010000000FDFFFFFFFEFF',40);
ERROR HY000: Invalid data
select rb_select(x'01060400000000000000000000003A3000000300000000001F00FFFF010018000000580000000100020003000400050006000700080009000A000B000C000D000E000F0010001100120013001400150016001700180019001A001B001C001D001E001F002000FEFFFFFF010000003A30000001000000000000001000000000000A0000003A3000000100000000000000100000000700FFFFFFFF3A30000001000000FFFF020010000000FDFFFFFFFEFF',1000);
ERROR HY000: Invalid data
select rb_select(x'01060400000000000000000000003A30000000001F00FFFF010018000000580000000100020003000400050006000700080009000A000B000C000D000E000F0010001100120013001400150016001700180019001A001B001C001D001E001F002000FEFFFFFF010000003A30000001000000000000001000000000000A0000003A3000000100000000000000100000000700FFFFFFFF3A30000001000000FFFF020010000000FDFFFFFFFEFF',300);
ERROR HY000: Invalid data
select rb_select(x'01060400000000000000000000003A3000000200000000011F00FFFF010018000000580000000100020003000400050006000700080009000A000B000C000D000E000F0010001100120013001400150016001700180019001A001B001C001D001E001F002000FEFFFFFF010000003A30000001000000000000001000000000000A0000003A3000000100000000000000100000000700FFFFFFFF3A30000001000000FFFF020010000000FDFFFefFFfFF',100);
+-----------------------------------------------------------------------------------------------------------------------------------------------------------------------------------------------------------------------------------------------------------------+
| rb_select(x'01060400000000000000000000003A3000000200000000011F00FFFF010018000000580000000100020003000400050006000700080009000A000B000C000D000E000F0010001100120013001400150016001700180019001A001B001C001D001E001F002000FEFFFFFF010000003A300000010000000000000 |
+-----------------------------------------------------------------------------------------------------------------------------------------------------------------------------------------------------------------------------------------------------------------+
|            :0       ˇˇ    X           	 
                        ˛ˇˇˇ   :0              
   :0             ˇˇˇˇ:0     ˇˇ    ˝ˇ˛ˇˇˇ                                                                                                  |
+-----------------------------------------------------------------------------------------------------------------------------------------------------------------------------------------------------------------------------------------------------------------+
select rb_select(x'01060400000000000000000000003A300000020000001F00FFFF010018000000580000000100020003000400050006000700080009000A000B000C000D000E000F0010001100120013001400150016001700180019001A001B001C001D001E001F002000FEFFFFFF010000003A30000001000000000000001000000000000A0000003A3000000100000000000000100000000700FFFFFFFF3A30000001000000FFFF020010000000FDFFFFFFFEFF',20);
ERROR HY000: Invalid data
select rb_select(x'01060400000000000000000000003A3000000200000000011e00FFFF010018000000580000000100020003000400050006000700080009000A000B000C000D000E000F0010001100120013001400150016001700180019001A001B001C001D001E001F002000FEFFFFFF010000003A30000001000000000000001000000000000A0000003A3000000100000000000000100000000700FFFFFFFF3A30000001000000FFFF020010000000FDFFFFFFFEFF',69);
ERROR HY000: Invalid data
select rb_select(x'01060400000000000000000000003A3000000200000000012000FFFF010018000000580000000100020003000400050006000700080009000A000B000C000D000E000F0010001100120013001400150016001700180019001A001B001C001D001E001F002000FEFFFFFF010000003A30000001000000000000001000000000000A0000003A3000000100000000000000100000000700FFFFFFFF3A30000001000000FFFF020010000000FDFFFFFFFEFF',65);
ERROR HY000: Invalid data
select rb_select(x'01060400000000000000000000003A300000020000000001FFFF010018000000580000000100020003000400050006000700080009000A000B000C000D000E000F0010001100120013001400150016001700180019001A001B001C001D001E001F002000FEFFFFFF010000003A30000001000000000000001000000000000A0000003A3000000100000000000000100000000700FFFFFFFF3A30000001000000FFFF020010000000FDFFFFFFFEFF',78);
ERROR HY000: Invalid data
select rb_select(x'01060400000000000000000000003A3000000200000000011F00FFFF011018000000580000000100020003000400050006000700080009000A000B000C000D000E000F0010001100120013001400150016001700180019001A001B001C001D001E001F002000FEFFFFFF010000003A30000001000000000000001000000000000A0000003A3000000100000000000000100000000700FFFFFFFF3A30000001000000FFFF020010000000FDFFFFFFFEFF',89);
ERROR HY000: Invalid data
select rb_select(x'01060400000000000000000000003A3000000200000000011F00FFFF010008000000580000000100020003000400050006000700080009000A000B000C000D000E000F0010001100120013001400150016001700180019001A001B001C001D001E001F002000FEFFFFFF010000003A30000001000000000000001000000000000A0000003A3000000100000000000000100000000700FFFFFFFF3A30000001000000FFFF020010000000FDFFFEFFFFFF',25);
+-----------------------------------------------------------------------------------------------------------------------------------------------------------------------------------------------------------------------------------------------------------------+
| rb_select(x'01060400000000000000000000003A3000000200000000011F00FFFF010008000000580000000100020003000400050006000700080009000A000B000C000D000E000F0010001100120013001400150016001700180019001A001B001C001D001E001F002000FEFFFFFF010000003A300000010000000000000 |
+-----------------------------------------------------------------------------------------------------------------------------------------------------------------------------------------------------------------------------------------------------------------+
|                 	  
                                                                                                                                                                                         |
+-----------------------------------------------------------------------------------------------------------------------------------------------------------------------------------------------------------------------------------------------------------------+
select rb_to_string(rb_select(x'01060400000000000000000000003A3000000200000000011F00FFFF010008000000590000000100020003000400050006000700080009000A000B000C000D000E000F0010001100120013001400150016001700180019001A001B001C001D001E001F002000FEFFFFFF010000003A30000001000000000000001000000000000A0000003A3000000100000000000000100000000700FFFFFFFF3A30000001000000FFFF020010000000FDFFFEFFFFFF',33,1,true,1));
+-------------------------------------------------------------------------------------------------------------------------------------------------------------------------------------------------------------------------------------------------------------------------------------------------------------------------------------------+
| rb_to_string(rb_select(x'01060400000000000000000000003A3000000200000000011F00FFFF010008000000590000000100020003000400050006000700080009000A000B000C000D000E000F0010001100120013001400150016001700180019001A001B001C001D001E001F002000FEFFFFFF010000003A30000001                                                                           |
+-------------------------------------------------------------------------------------------------------------------------------------------------------------------------------------------------------------------------------------------------------------------------------------------------------------------------------------------+
| 16777222,16777223,16777224,16777225,16777226,16777227,16777228,16777229,16777230,16777231,16777232,16777233,16777234,16777235,16777236,16777237,16777238,16777239,16777240,16777241,16777242,16777243,16777244,16777245,16777246,16777247,16777248,4294967294,4294967295,4294967296,42949672967,18446744073709551613,18446744073709551614 |
+-------------------------------------------------------------------------------------------------------------------------------------------------------------------------------------------------------------------------------------------------------------------------------------------------------------------------------------------+
select rb_to_string(rb_select(rb_from_string('16777217,16777218,16777219,16777220,16777221,16777222,16777223,16777224,16777225,16777226,16777227,16777228,16777229,16777230,16777231,16777232,16777233,16777234,16777235,16777236,16777237,16777238,16777239,16777240,16777241,16777242,16777243,16777244,16777245,16777246,16777247,16777248,4294967294,4294967295,4294967296,42949672967,18446744073709551613,18446744073709551614,18446744073709551615'),33,1,true,1));
+-------------------------------------------------------------------------------------------------------------------------------------------------------------------------------------------------------------------------------------------------------------------------------------------------------------------------------------------+
| rb_to_string(rb_select(rb_from_string('16777217,16777218,16777219,16777220,16777221,16777222,16777223,16777224,16777225,16777226,16777227,16777228,16777229,16777230,16777231,16777232,16777233,16777234,16777235,16777236,16777237,16777238,16777239,16777240,                                                                           |
+-------------------------------------------------------------------------------------------------------------------------------------------------------------------------------------------------------------------------------------------------------------------------------------------------------------------------------------------+
| 16777222,16777223,16777224,16777225,16777226,16777227,16777228,16777229,16777230,16777231,16777232,16777233,16777234,16777235,16777236,16777237,16777238,16777239,16777240,16777241,16777242,16777243,16777244,16777245,16777246,16777247,16777248,4294967294,4294967295,4294967296,42949672967,18446744073709551613,18446744073709551614 |
+-------------------------------------------------------------------------------------------------------------------------------------------------------------------------------------------------------------------------------------------------------------------------------------------------------------------------------------------+
select rb_select(x'01060400000000000000000000003A3000000200000000011F00FFFF0100180000000100020003000400050006000700080009000A000B000C000D000E000F0010001100120013001400150016001700180019001A001B001C001D001E001F002000FEFFFFFF010000003A30000001000000000000001000000000000A0000003A3000000100000000000000100000000700FFFFFFFF3A30000001000000FFFF020010000000FDFFFFFFFEFF',1);
ERROR HY000: Invalid data
select rb_to_string(rb_select(x'01060400000000000000000000003A3000000200000000011F00FFFF010018000000580000000100020003000400050006000700080009000A000B000C000D000E000F0010001100120013001400150016001700180019001A001B001C001D001E001F002000FEFFFFFF010002003A30000001000000000000001000000000000A0000003A3000000100000000000000100000000700FFFFFFFF3A30000001000000FFFF020010000000FDFFFEFFFFFF',52,0,false,0,4294967294));
+-------------------------------------------------------------------------------------------------------------------------------------------------------------------------------------------------------------------------------------------------------------------------------------------------+
| rb_to_string(rb_select(x'01060400000000000000000000003A3000000200000000011F00FFFF010018000000580000000100020003000400050006000700080009000A000B000C000D000E000F0010001100120013001400150016001700180019001A001B001C001D001E001F002000FEFFFFFF010002003A30000001                                 |
+-------------------------------------------------------------------------------------------------------------------------------------------------------------------------------------------------------------------------------------------------------------------------------------------------+
| 16777217,16777218,16777219,16777220,16777221,16777222,16777223,16777224,16777225,16777226,16777227,16777228,16777229,16777230,16777231,16777232,16777233,16777234,16777235,16777236,16777237,16777238,16777239,16777240,16777241,16777242,16777243,16777244,16777245,16777246,16777247,16777248 |
+-------------------------------------------------------------------------------------------------------------------------------------------------------------------------------------------------------------------------------------------------------------------------------------------------+
select rb_select(x'01060400000000000000000000003A3000000200000000011F00FFFF010018000000580000000100020003000400050006000700090008000A000B000C000D000E000F0010001100120013001400150016001700180019001A001B001C001D001E001F002000FEFFFFFF010002003A10000001000000000000001000000000000A0000003A3000000100000000000000100000000700FFFFFFFF3A30000001000000FFFF020010000000FDFFFFFFFEFF',1);
ERROR HY000: Invalid data
select rb_select(x'01060400000000000000000000003A3000000200000000011F00FFFF010018000000580000000100020003000400050006000700090008000A000B000C000D000E000F0010001100120013001400150016001700180019001A001B001C001D001E001F002000FEFFFFFF010002003A30000000000000000000001000000000000A0000003A3000000100000000000000100000000700FFFFFFFF3A30000001000000FFFF020010000000FDFFFFFFFEFF',1);
ERROR HY000: Invalid data
select rb_select(x'01060400000000000000000000003A3000000200000000011F00FFFF010018000000580000000100020003000400050006000700080009000A000B000C000D000E000F0010001100120013001400150016001700180019001A001B001C001D001E001F002000FEFFFFFF010002003A30000002000000000000001000000000000A0000003A3000000100000000000000100000000700FFFFFFFF3A30000001000000FFFF020010000000FDFFFFFFFEFF',1);
ERROR HY000: Invalid data
select rb_select(x'01060400000000000000000000003A3000000200000000011F00FFFF010018000000580000000100020003000400050006000700080009000A000B000C000D000E000F0010001100120013001400150016001700180019001A001B001C001D001E001F002000FEFFFFFF010002003A30000001000000000000011000000000000A0000003A3000000100000000000000100000000700FFFFFFFF3A30000001000000FFFF020010000000FDFFFFFFFEFF',1);
ERROR HY000: Invalid data
select rb_select(x'01060400000000000000000000003A3000000200000000011F00FFFF010018000000580000000100020003000400050006000700080009000A000B000C000D000E000F0010001100120013001400150016001700180019001A001B001C001D001E001F002000FEFFFFFF010002003A30000001000000000000001000000000000A0000003A3000000200000000000000100000000700FFFFFFFF3A30000001000000FFFF020010000000FDFFFFFFFEFF',1);
ERROR HY000: Invalid data
select rb_select(x'01060400000000000000000000003A3000000200000000011F00FFFF010018000000580000000100020003000400050006000700080009000A000B000C000D000E000F0010001100120013001400150016001700180019001A001B001C001D001E001F002000FEFFFFFF010002003A30000001000000000000002000000000000A0000003A3000000100000000000000100000000700FFFFFFFF3A30000001000000FFFF020010000000FDFFFEFFFFFF',1);
+-----------------------------------------------------------------------------------------------------------------------------------------------------------------------------------------------------------------------------------------------------------------+
| rb_select(x'01060400000000000000000000003A3000000200000000011F00FFFF010018000000580000000100020003000400050006000700080009000A000B000C000D000E000F0010001100120013001400150016001700180019001A001B001C001D001E001F002000FEFFFFFF010002003A300000010000000000000 |
+-----------------------------------------------------------------------------------------------------------------------------------------------------------------------------------------------------------------------------------------------------------------+
|                                                                                                                                                                                                                                                             |
+-----------------------------------------------------------------------------------------------------------------------------------------------------------------------------------------------------------------------------------------------------------------+
select rb_select(x'01060400000000000000000000003A3000000200000000011F00FFFF010018000000580000000100020003000400050006000700080009000A000B000C000D000E000F0010001100120013001400150016001700180019001A001B001C001D001E001F002000FEFFFFFF010002003A30000001000000000000000000000000000A0000003A3000000100000000000000100000000700FFFFFFFF3A30000001000000FFFF020010000000FDFFFEFFFFFF',33);
+-----------------------------------------------------------------------------------------------------------------------------------------------------------------------------------------------------------------------------------------------------------------+
| rb_select(x'01060400000000000000000000003A3000000200000000011F00FFFF010018000000580000000100020003000400050006000700080009000A000B000C000D000E000F0010001100120013001400150016001700180019001A001B001C001D001E001F002000FEFFFFFF010002003A300000010000000000000 |
+-----------------------------------------------------------------------------------------------------------------------------------------------------------------------------------------------------------------------------------------------------------------+
|            :0       ˇˇ     X           	 
                        ˛ˇ                                                                                                                                                            |
+-----------------------------------------------------------------------------------------------------------------------------------------------------------------------------------------------------------------------------------------------------------------+
select rb_select(x'01060400000000000000000000003A3000000200000000011F00FFFF010018000000580000000100020003000400050006000700080009000A000B000C000D000E000F0010001100120013001400150016001700180019001A001B001C001D001E001F002000FEFFFFFF010002003A30000001000000000000001000000000000A0000003A2000000100000000000000100000000700FFFFFFFF3A30000001000000FFFF020010000000FDFFFFFFFEFF',1);
ERROR HY000: Invalid data
select rb_select(x'01060400000000000000000000003A3000000200000000011F00FFFF010018000000580000000100020003000400050006000700080009000A000B000C000D000E000F0010001100120013001400150016001700180019001A001B001C001D001E001F002000FEFFFFFF010002003A30000001000000000000001000000000000A0000003A3000000200000000000000100000000700FFFFFFFF3A30000001000000FFFF020010000000FDFFFFFFFEFF',1);
ERROR HY000: Invalid data
select rb_select(x'01060400000000000000000000003A3000000200000000011F00FFFF010018000000580000000100020003000400050006000700080009000A000B000C000D000E000F0010001100120013001400150016001700180019001A001B001C001D001E001F002000FEFFFFFF010002003A30000001000000000000001000000000000A0000003A3000000100000000000001100000000700FFFFFFFF3A30000001000000FFFF020010000000FDFFFFFFFEFF',1);
ERROR HY000: Invalid data
select rb_select(x'01060400000000000000000000003A3000000200000000011F00FFFF010018000000580000000100020003000400050006000700080009000A000B000C000D000E000F0010001100120013001400150016001700180019001A001B001C001D001E001F002000FEFFFFFF010002003A30000001000000000000001000000000000A0000003A3000000100000000000000100000000700FFFFFFFF3A40000001000000FFFF020010000000FDFFFFFFFEFF',1);
ERROR HY000: Invalid data
select rb_select(x'01060400000000000000000000003A3000000200000000011F00FFFF010018000000580000000100020003000400050006000700080009000A000B000C000D000E000F0010001100120013001400150016001700180019001A001B001C001D001E001F002000FEFFFFFF010002003A30000001000000000000001000000000000A0000003A3000000100000000000000100000000700FFFFFFFF3A30000001000000FFFF010010000000FDFFFFFFFEFF',1);
ERROR HY000: Invalid data
select rb_select(x'01060400000000000000000000003A3000000200000000011F00FFFF010018000000580000000100020003000400050006000700080009000A000B000C000D000E000F0010001100120013001400150016001700180019001A001B001C001D001E001F002000FEFFFFFF010002003A30000001000000000000001000000000000A0000003A3000000100000000000000100000000700FFFFFFFF3A30000001000000FFFF010030000000FDFFFFFFFEFF',1);
ERROR HY000: Invalid data
select rb_select(rb_from_string(result),1000000) from (select GROUP_CONCAT(number SEPARATOR ',') AS result
FROM (
    SELECT FLOOR( RAND() * 1000000) AS number
    FROM TABLE(GENERATOR(100000))
) AS random_numbers);
select rb_to_string(rb_select(rb_from_string(result),99999,1,true)) from (select GROUP_CONCAT(number SEPARATOR ',') AS result
FROM (
    SELECT FLOOR( RAND() * 1000000) AS number
    FROM TABLE(GENERATOR(100000))
) AS random_numbers);
select rb_select(rb_from_string(result),100000) from (select GROUP_CONCAT(number SEPARATOR ',') AS result
 FROM (
    SELECT FLOOR( RAND() * 1000000) AS number
        FROM TABLE(GENERATOR(100000))
 ) AS random_numbers);
select rb_to_string(rb_select(x'01053b3000000100000f27010000000f27',5000));
+-----------------------------------------------------------------------------------------------------------------------------------------------------------------------------------------------------------------------------------------------------------------------------------------------------------------------------------------------------------------------------------------------------------------------------------------------------------------------------------------------------------------------------------------------------------------------------------------------------------------------------------------------------------------------------------------------------------------------------------------------------------------------------------------------------------------------------------------------------------------------------------------------------------------------------------------------------------------------------------------------------------------------------------------------------------------------------------------------------------------------------------------------------------------------------------------------------------------------------------------------------------------------------------------------------------------------------------------------------------------------------------------------------------------------------------------------------------------------------------------------------------------------------------------------------------------------------------------------------------------------------------------------------------------------------------------------------------------------------------------------------------------------------------------------------------------------------------------------------------------------------------------------------------------------------------------------------------------------------------------------------------------------------------------------------------------------------------------------------------------------------------------------------------------------------------------------------------------------------------------------------------------------------------------------------------------------------------------------------------------------------------------------------------------------------------------------------------------------------------------------------------------------------------------------------------------------------------------------------------------------------------------------------------------------------------------------------------------------------------------------------------------------------------------------------------------------------------------------------------------------------------------------------------------------------------------------------------------------------------------------------------------------------------------------------------------------------------------------------------------------------------------------------------------------------------------------------------------------------------------------------------------------------------------------------------------------------------------------------------------------------------------------------------------------------------------------------------------------------------------------------------------------------------------------------------------------------------------------------------------------------------------------------------------------------------------------------------------------------------------------------------------------------------------------------------------------------------------------------------------------------------------------------------------------------------------------------------------------------------------------------------------------------------------------------------------------------------------------------------------------------------------------------------------------------------------------------------------------------------------------------------------------------------------------------------------------------------------------------------------------------------------------------------------------------------------------------------------------------------------------------------------------------------------------------------------------------------------------------------------------------------------------------------------------------------------------------------------------------------------------------------------------------------------------------------------------------------------------------------------------------------------------------------------------------------------------------------------------------------------------------------------------------------------------------------------------------------------------------------------------------------------------------------------------------------------------------------------------------------------------------------------------------------------------------------------------------------------------------------------------------------------------------------------------------------------------------------------------------------------------------------------------------------------------------------------------------------------------------------------------------------------------------------------------------------------------------------------------------------------------------------------------------------------------------------------------------------------------------------------------------------------------------------------------------------------------------------------------------------------------------------------------------------------------------------------------------------------------------------------------------------------------------------------------------------------------------------------------------------------------------------------------------------------------------------------------------------------------------------------------------------------------------------------------------------------------------------------------------------------------------------------------------------------------------------------------------------------------------------------------------------------------------------------------------------------------------------------------------------------------------------------------------------------------------------------------------------------------------------------------------------------------------------------------------------------------------------------------------------------------------------------------------------------------------------------------------------------------------------------------------------------------------------------------------------------------------------------------------------------------------------------------------------------------------------------------------------------------------------------------------------------------------------------------------------------------------------------------------------------------------------------------------------------------------------------------------------------------------------------------------------------------------------------------------------------------------------------------------------------------------------------------------------------------------------------------------------------------------------------------------------------------------------------------------------------------------------------------------------------------------------------------------------------------------------------------------------------------------------------------------------------------------------------------------------------------------------------------------------------------------------------------------------------------------------------------------------------------------------------------------------------------------------------------------------------------------------------------------------------------------------------------------------------------------------------------------------------------------------------------------------------------------------------------------------------------------------------------------------------------------------------------------------------------------------------------------------------------------------------------------------------------------------------------------------------------------------------------------------------------------------------------------------------------------------------------------------------------------------------------------------------------------------------------------------------------------------------------------------------------------------------------------------------------------------------------------------------------------------------------------------------------------------------------------------------------------------------------------------------------------------------------------------------------------------------------------------------------------------------------------------------------------------------------------------------------------------------------------------------------------------------------------------------------------------------------------------------------------------------------------------------------------------------------------------------------------------------------------------------------------------------------------------------------------------------------------------------------------------------------------------------------------------------------------------------------------------------------------------------------------------------------------------------------------------------------------------------------------------------------------------------------------------------------------------------------------------------------------------------------------------------------------------------------------------------------------------------------------------------------------------------------------------------------------------------------------------------------------------------------------------------------------------------------------------------------------------------------------------------------------------------------------------------------------------------------------------------------------------------------------------------------------------------------------------------------------------------------------------------------------------------------------------------------------------------------------------------------------------------------------------------------------------------------------------------------------------------------------------------------------------------------------------------------------------------------------------------------------------------------------------------------------------------------------------------------------------------------------------------------------------------------------------------------------------------------------------------------------------------------------------------------------------------------------------------------------------------------------------------------------------------------------------------------------------------------------------------------------------------------------------------------------------------------------------------------------------------------------------------------------------------------------------------------------------------------------------------------------------------------------------------------------------------------------------------------------------------------------------------------------------------------------------------------------------------------------------------------------------------------------------------------------------------------------------------------------------------------------------------------------------------------------------------------------------------------------------------------------------------------------------------------------------------------------------------------------------------------------------------------------------------------------------------------------------------------------------------------------------------------------------------------------------------------------------------------------------------------------------------------------------------------------------------------------------------------------------------------------------------------------------------------------------------------------------------------------------------------------------------------------------------------------------------------------------------------------------------------------------------------------------------------------------------------------------------------------------------------------------------------------------------------------------------------------------------------------------------------------------------------------------------------------------------------------------------------------------------------------------------------------------------------------------------------------------------------------------------------------------------------------------------------------------------------------------------------------------------------------------------------------------------------------------------------------------------------------------------------------------------------------------------------------------------------------------------------------------------------------------------------------------------------------------------------------------------------------------------------------------------------------------------------------------------------------------------------------------------------------------------------------------------------------------------------------------------------------------------------------------------------------------------------------------------------------------------------------------------------------------------------------------------------------------------------------------------------------------------------------------------------------------------------------------------------------------------------------------------------------------------------------------------------------------------------------------------------------------------------------------------------------------------------------------------------------------------------------------------------------------------------------------------------------------------------------------------------------------------------------------------------------------------------------------------------------------------------------------------------------------------------------------------------------------------------------------------------------------------------------------------------------------------------------------------------------------------------------------------------------------------------------------------------------------------------------------------------------------------------------------------------------------------------------------------------------------------------------------------------------------------------------------------------------------------------------------------------------------------------------------------------------------------------------------------------------------------------------------------------------------------------------------------------------------------------------------------------------------------------------------------------------------------------------------------------------------------------------------------------------------------------------------------------------------------------------------------------------------------------------------------------------------------------------------------------------------------------------------------------------------------------------------------------------------------------------------------------------------------------------------------------------------------------------------------------------------------------------------------------------------------------------------------------------------------------------------------------------------------------------------------------------------------------------------------------------------------------------------------------------------------------------------------------------------------------------------------------------------------------------------------------------------------------------------------------------------------------------------------------------------------------------------------------------------------------------------------------------------------------------------------------------------------------------------------------------------------------------------------------------------------------------------------------------------------------------------------------------------------------------------------------------------------------------------------------------------------------------------------------------------------------------------------------------------------------------------------------------------------------------------------------------------------------------------------------------------------------------------------------------------------------------------------------------------------------------------------------------------------------------------------------------------------------------------------------------------------------------------------------------------------------------------------------------------------------------------------------------------------------------------------------------------------------------------------------------------------------------------------------------------------------------------------------------------------------------------------------------------------------------------------------------------------------------------------------------------------------------------------------------------------------------------------------------------------------------------------------------------------------------------------------------------------------------------------------------------------------------------------------------------------------------------------------------------------------------------------------------------------------------------------------------------------------------------------------------------------------------------------------------------------------------------------------------------------------------------------------------------------------------------------------------------------------------------------------------------------------------------------------------------------------------------------------------------------------------------------------------------------------------------------------------------------------------------------------------------------------------------------------------------------------------------------------------------------------------------------------------------------------------------------------------------------------------------------------------------------------------------------------------------------------------------------------------------------------------------------------------------------------------------------------------------------------------------------------------------------------------------------------------------------------------------------------------------------------------------------------------------------------------------------------------------------------------------------------------------------------------------------------------------------------------------------------------------------------------------------------------------------------------------------------------------------------------------------------------------------------------------------------------------------------------------------------------------------------------------------------------------------------------------------------------------------------------------------------------------------------------------------------------------------------------------------------------------------------------------------------------------------------------------------------------------------------------------------------------------------------------------------------------------------------------------------------------------------------------------------------------------------------------------------------------------------------------------------------------------------------------------------------------------------------------------------------------------------------------------------------------------------------------------------------------------------------------------------------------------------------------------------------------------------------------------------------------------------------------------------------------------------------------------------------------------------------------------------------------------------------------------------------------------------------------------------------------------------------------------------------------------------------------------------------------------------------------------------------------------------------------------------------------------------------------------------------------------------------------------------------------------------------------------------------------------------------------------------------------------------------------------------------------------------------------------------------------------------------------------------------------------------------------------------------------------------------------------------------------------------------------------------------------------------------------------------------------------------------------------------------------------------------------------------------------------------------------------------------------------------------------------------------------------------------------------------------------------------------------------------------------------------------------------------------------------------------------------------------------------------------------------------------------------------------------------------------------------------------------------------------------------------------------------------------------------------------------------------------------------------------------------------------------------------------------------------------------------------------------------------------------------------------------------------------------------------------------------------------------------------------------------------------------------------------------------------------------------------------------------------------------------------------------------------------------------------------------------------------------------------------------------------------------------------------------------------------------------------------------------------------------------------------------------------------------------------------------------------------------------------------------------------------------------------------------------------------------------------------------------------------------------------------------------------------------------------------------------------------------------------------------------------------------------------------------------+
| rb_to_string(rb_select(x'01053b3000000100000f27010000000f27',5000))                                                                                                                                                                                                                                                                                                                                                                                                                                                                                                                                                                                                                                                                                                                                                                                                                                                                                                                                                                                              |
+-----------------------------------------------------------------------------------------------------------------------------------------------------------------------------------------------------------------------------------------------------------------------------------------------------------------------------------------------------------------------------------------------------------------------------------------------------------------------------------------------------------------------------------------------------------------------------------------------------------------------------------------------------------------------------------------------------------------------------------------------------------------------------------------------------------------------------------------------------------------------------------------------------------------------------------------------------------------------------------------------------------------------------------------------------------------------------------------------------------------------------------------------------------------------------------------------------------------------------------------------------------------------------------------------------------------------------------------------------------------------------------------------------------------------------------------------------------------------------------------------------------------------------------------------------------------------------------------------------------------------------------------------------------------------------------------------------------------------------------------------------------------------------------------------------------------------------------------------------------------------------------------------------------------------------------------------------------------------------------------------------------------------------------------------------------------------------------------------------------------------------------------------------------------------------------------------------------------------------------------------------------------------------------------------------------------------------------------------------------------------------------------------------------------------------------------------------------------------------------------------------------------------------------------------------------------------------------------------------------------------------------------------------------------------------------------------------------------------------------------------------------------------------------------------------------------------------------------------------------------------------------------------------------------------------------------------------------------------------------------------------------------------------------------------------------------------------------------------------------------------------------------------------------------------------------------------------------------------------------------------------------------------------------------------------------------------------------------------------------------------------------------------------------------------------------------------------------------------------------------------------------------------------------------------------------------------------------------------------------------------------------------------------------------------------------------------------------------------------------------------------------------------------------------------------------------------------------------------------------------------------------------------------------------------------------------------------------------------------------------------------------------------------------------------------------------------------------------------------------------------------------------------------------------------------------------------------------------------------------------------------------------------------------------------------------------------------------------------------------------------------------------------------------------------------------------------------------------------------------------------------------------------------------------------------------------------------------------------------------------------------------------------------------------------------------------------------------------------------------------------------------------------------------------------------------------------------------------------------------------------------------------------------------------------------------------------------------------------------------------------------------------------------------------------------------------------------------------------------------------------------------------------------------------------------------------------------------------------------------------------------------------------------------------------------------------------------------------------------------------------------------------------------------------------------------------------------------------------------------------------------------------------------------------------------------------------------------------------------------------------------------------------------------------------------------------------------------------------------------------------------------------------------------------------------------------------------------------------------------------------------------------------------------------------------------------------------------------------------------------------------------------------------------------------------------------------------------------------------------------------------------------------------------------------------------------------------------------------------------------------------------------------------------------------------------------------------------------------------------------------------------------------------------------------------------------------------------------------------------------------------------------------------------------------------------------------------------------------------------------------------------------------------------------------------------------------------------------------------------------------------------------------------------------------------------------------------------------------------------------------------------------------------------------------------------------------------------------------------------------------------------------------------------------------------------------------------------------------------------------------------------------------------------------------------------------------------------------------------------------------------------------------------------------------------------------------------------------------------------------------------------------------------------------------------------------------------------------------------------------------------------------------------------------------------------------------------------------------------------------------------------------------------------------------------------------------------------------------------------------------------------------------------------------------------------------------------------------------------------------------------------------------------------------------------------------------------------------------------------------------------------------------------------------------------------------------------------------------------------------------------------------------------------------------------------------------------------------------------------------------------------------------------------------------------------------------------------------------------------------------------------------------------------------------------------------------------------------------------------------------------------------------------------------------------------------------------------------------------------------------------------------------------------------------------------------------------------------------------------------------------------------------------------------------------------------------------------------------------------------------------------------------------------------------------------------------------------------------------------------------------------------------------------------------------------------------------------------------------------------------------------------------------------------------------------------------------------------------------------------------------------------------------------------------------------------------------------------------------------------------------------------------------------------------------------------------------------------------------------------------------------------------------------------------------------------------------------------------------------------------------------------------------------------------------------------------------------------------------------------------------------------------------------------------------------------------------------------------------------------------------------------------------------------------------------------------------------------------------------------------------------------------------------------------------------------------------------------------------------------------------------------------------------------------------------------------------------------------------------------------------------------------------------------------------------------------------------------------------------------------------------------------------------------------------------------------------------------------------------------------------------------------------------------------------------------------------------------------------------------------------------------------------------------------------------------------------------------------------------------------------------------------------------------------------------------------------------------------------------------------------------------------------------------------------------------------------------------------------------------------------------------------------------------------------------------------------------------------------------------------------------------------------------------------------------------------------------------------------------------------------------------------------------------------------------------------------------------------------------------------------------------------------------------------------------------------------------------------------------------------------------------------------------------------------------------------------------------------------------------------------------------------------------------------------------------------------------------------------------------------------------------------------------------------------------------------------------------------------------------------------------------------------------------------------------------------------------------------------------------------------------------------------------------------------------------------------------------------------------------------------------------------------------------------------------------------------------------------------------------------------------------------------------------------------------------------------------------------------------------------------------------------------------------------------------------------------------------------------------------------------------------------------------------------------------------------------------------------------------------------------------------------------------------------------------------------------------------------------------------------------------------------------------------------------------------------------------------------------------------------------------------------------------------------------------------------------------------------------------------------------------------------------------------------------------------------------------------------------------------------------------------------------------------------------------------------------------------------------------------------------------------------------------------------------------------------------------------------------------------------------------------------------------------------------------------------------------------------------------------------------------------------------------------------------------------------------------------------------------------------------------------------------------------------------------------------------------------------------------------------------------------------------------------------------------------------------------------------------------------------------------------------------------------------------------------------------------------------------------------------------------------------------------------------------------------------------------------------------------------------------------------------------------------------------------------------------------------------------------------------------------------------------------------------------------------------------------------------------------------------------------------------------------------------------------------------------------------------------------------------------------------------------------------------------------------------------------------------------------------------------------------------------------------------------------------------------------------------------------------------------------------------------------------------------------------------------------------------------------------------------------------------------------------------------------------------------------------------------------------------------------------------------------------------------------------------------------------------------------------------------------------------------------------------------------------------------------------------------------------------------------------------------------------------------------------------------------------------------------------------------------------------------------------------------------------------------------------------------------------------------------------------------------------------------------------------------------------------------------------------------------------------------------------------------------------------------------------------------------------------------------------------------------------------------------------------------------------------------------------------------------------------------------------------------------------------------------------------------------------------------------------------------------------------------------------------------------------------------------------------------------------------------------------------------------------------------------------------------------------------------------------------------------------------------------------------------------------------------------------------------------------------------------------------------------------------------------------------------------------------------------------------------------------------------------------------------------------------------------------------------------------------------------------------------------------------------------------------------------------------------------------------------------------------------------------------------------------------------------------------------------------------------------------------------------------------------------------------------------------------------------------------------------------------------------------------------------------------------------------------------------------------------------------------------------------------------------------------------------------------------------------------------------------------------------------------------------------------------------------------------------------------------------------------------------------------------------------------------------------------------------------------------------------------------------------------------------------------------------------------------------------------------------------------------------------------------------------------------------------------------------------------------------------------------------------------------------------------------------------------------------------------------------------------------------------------------------------------------------------------------------------------------------------------------------------------------------------------------------------------------------------------------------------------------------------------------------------------------------------------------------------------------------------------------------------------------------------------------------------------------------------------------------------------------------------------------------------------------------------------------------------------------------------------------------------------------------------------------------------------------------------------------------------------------------------------------------------------------------------------------------------------------------------------------------------------------------------------------------------------------------------------------------------------------------------------------------------------------------------------------------------------------------------------------------------------------------------------------------------------------------------------------------------------------------------------------------------------------------------------------------------------------------------------------------------------------------------------------------------------------------------------------------------------------------------------------------------------------------------------------------------------------------------------------------------------------------------------------------------------------------------------------------------------------------------------------------------------------------------------------------------------------------------------------------------------------------------------------------------------------------------------------------------------------------------------------------------------------------------------------------------------------------------------------------------------------------------------------------------------------------------------------------------------------------------------------------------------------------------------------------------------------------------------------------------------------------------------------------------------------------------------------------------------------------------------------------------------------------------------------------------------------------------------------------------------------------------------------------------------------------------------------------------------------------------------------------------------------------------------------------------------------------------------------------------------------------------------------------------------------------------------------------------------------------------------------------------------------------------------------------------------------------------------------------------------------------------------------------------------------------------------------------------------------------------------------------------------------------------------------------------------------------------------------------------------------------------------------------------------------------------------------------------------------------------------------------------------------------------------------------------------------------------------------------------------------------------------------------------------------------------------------------------------------------------------------------------------------------------------------------------------------------------------------------------------------------------------------------------------------------------------------------------------------------------------------------------------------------------------------------------------------------------------------------------------------------------------------------------------------------------------------------------------------------------------------------------------------------------------------------------------------------------------------------------------------------------------------------------------------------------------------------------------------------------------------------------------------------------------------------------------------------------------------------------------------------------------------------------------------------------------------------------------------------------------------------------------------------------------------------------------------------------------------------------------------------------------------------------------------------------------------------------------------------------------------------------------------------------------------------------------------------------------------------------------------------------------------------------------------------------------------------------------------------------------------------------------------------------------------------------------------------------------------------------------------------------------------------------------------------------------------------------------------------------------------------------------------------------------------------------------------------------------------------------------------------------------------------------------------------------------------------------------------------------------------------------------------------------------------------------------------------------------------------------------------------------------------------------------------------------------------------------------------------------------------------------------------------------------------------------------------------------------------------------------------------------------------------------------------------------------------------------------------------------------------------------------------------------------------------------------------------------------------------------------------------------------------------------------------------------------------------------------------------------------------------------------------------------------------------------------------------------------------------------------------------------------------------------------------------------------------------------------------------------------------------------------------------------------------------------------------------------------------------------------------------------------------------------------------------+
| 0,1,2,3,4,5,6,7,8,9,10,11,12,13,14,15,16,17,18,19,20,21,22,23,24,25,26,27,28,29,30,31,32,33,34,35,36,37,38,39,40,41,42,43,44,45,46,47,48,49,50,51,52,53,54,55,56,57,58,59,60,61,62,63,64,65,66,67,68,69,70,71,72,73,74,75,76,77,78,79,80,81,82,83,84,85,86,87,88,89,90,91,92,93,94,95,96,97,98,99,100,101,102,103,104,105,106,107,108,109,110,111,112,113,114,115,116,117,118,119,120,121,122,123,124,125,126,127,128,129,130,131,132,133,134,135,136,137,138,139,140,141,142,143,144,145,146,147,148,149,150,151,152,153,154,155,156,157,158,159,160,161,162,163,164,165,166,167,168,169,170,171,172,173,174,175,176,177,178,179,180,181,182,183,184,185,186,187,188,189,190,191,192,193,194,195,196,197,198,199,200,201,202,203,204,205,206,207,208,209,210,211,212,213,214,215,216,217,218,219,220,221,222,223,224,225,226,227,228,229,230,231,232,233,234,235,236,237,238,239,240,241,242,243,244,245,246,247,248,249,250,251,252,253,254,255,256,257,258,259,260,261,262,263,264,265,266,267,268,269,270,271,272,273,274,275,276,277,278,279,280,281,282,283,284,285,286,287,288,289,290,291,292,293,294,295,296,297,298,299,300,301,302,303,304,305,306,307,308,309,310,311,312,313,314,315,316,317,318,319,320,321,322,323,324,325,326,327,328,329,330,331,332,333,334,335,336,337,338,339,340,341,342,343,344,345,346,347,348,349,350,351,352,353,354,355,356,357,358,359,360,361,362,363,364,365,366,367,368,369,370,371,372,373,374,375,376,377,378,379,380,381,382,383,384,385,386,387,388,389,390,391,392,393,394,395,396,397,398,399,400,401,402,403,404,405,406,407,408,409,410,411,412,413,414,415,416,417,418,419,420,421,422,423,424,425,426,427,428,429,430,431,432,433,434,435,436,437,438,439,440,441,442,443,444,445,446,447,448,449,450,451,452,453,454,455,456,457,458,459,460,461,462,463,464,465,466,467,468,469,470,471,472,473,474,475,476,477,478,479,480,481,482,483,484,485,486,487,488,489,490,491,492,493,494,495,496,497,498,499,500,501,502,503,504,505,506,507,508,509,510,511,512,513,514,515,516,517,518,519,520,521,522,523,524,525,526,527,528,529,530,531,532,533,534,535,536,537,538,539,540,541,542,543,544,545,546,547,548,549,550,551,552,553,554,555,556,557,558,559,560,561,562,563,564,565,566,567,568,569,570,571,572,573,574,575,576,577,578,579,580,581,582,583,584,585,586,587,588,589,590,591,592,593,594,595,596,597,598,599,600,601,602,603,604,605,606,607,608,609,610,611,612,613,614,615,616,617,618,619,620,621,622,623,624,625,626,627,628,629,630,631,632,633,634,635,636,637,638,639,640,641,642,643,644,645,646,647,648,649,650,651,652,653,654,655,656,657,658,659,660,661,662,663,664,665,666,667,668,669,670,671,672,673,674,675,676,677,678,679,680,681,682,683,684,685,686,687,688,689,690,691,692,693,694,695,696,697,698,699,700,701,702,703,704,705,706,707,708,709,710,711,712,713,714,715,716,717,718,719,720,721,722,723,724,725,726,727,728,729,730,731,732,733,734,735,736,737,738,739,740,741,742,743,744,745,746,747,748,749,750,751,752,753,754,755,756,757,758,759,760,761,762,763,764,765,766,767,768,769,770,771,772,773,774,775,776,777,778,779,780,781,782,783,784,785,786,787,788,789,790,791,792,793,794,795,796,797,798,799,800,801,802,803,804,805,806,807,808,809,810,811,812,813,814,815,816,817,818,819,820,821,822,823,824,825,826,827,828,829,830,831,832,833,834,835,836,837,838,839,840,841,842,843,844,845,846,847,848,849,850,851,852,853,854,855,856,857,858,859,860,861,862,863,864,865,866,867,868,869,870,871,872,873,874,875,876,877,878,879,880,881,882,883,884,885,886,887,888,889,890,891,892,893,894,895,896,897,898,899,900,901,902,903,904,905,906,907,908,909,910,911,912,913,914,915,916,917,918,919,920,921,922,923,924,925,926,927,928,929,930,931,932,933,934,935,936,937,938,939,940,941,942,943,944,945,946,947,948,949,950,951,952,953,954,955,956,957,958,959,960,961,962,963,964,965,966,967,968,969,970,971,972,973,974,975,976,977,978,979,980,981,982,983,984,985,986,987,988,989,990,991,992,993,994,995,996,997,998,999,1000,1001,1002,1003,1004,1005,1006,1007,1008,1009,1010,1011,1012,1013,1014,1015,1016,1017,1018,1019,1020,1021,1022,1023,1024,1025,1026,1027,1028,1029,1030,1031,1032,1033,1034,1035,1036,1037,1038,1039,1040,1041,1042,1043,1044,1045,1046,1047,1048,1049,1050,1051,1052,1053,1054,1055,1056,1057,1058,1059,1060,1061,1062,1063,1064,1065,1066,1067,1068,1069,1070,1071,1072,1073,1074,1075,1076,1077,1078,1079,1080,1081,1082,1083,1084,1085,1086,1087,1088,1089,1090,1091,1092,1093,1094,1095,1096,1097,1098,1099,1100,1101,1102,1103,1104,1105,1106,1107,1108,1109,1110,1111,1112,1113,1114,1115,1116,1117,1118,1119,1120,1121,1122,1123,1124,1125,1126,1127,1128,1129,1130,1131,1132,1133,1134,1135,1136,1137,1138,1139,1140,1141,1142,1143,1144,1145,1146,1147,1148,1149,1150,1151,1152,1153,1154,1155,1156,1157,1158,1159,1160,1161,1162,1163,1164,1165,1166,1167,1168,1169,1170,1171,1172,1173,1174,1175,1176,1177,1178,1179,1180,1181,1182,1183,1184,1185,1186,1187,1188,1189,1190,1191,1192,1193,1194,1195,1196,1197,1198,1199,1200,1201,1202,1203,1204,1205,1206,1207,1208,1209,1210,1211,1212,1213,1214,1215,1216,1217,1218,1219,1220,1221,1222,1223,1224,1225,1226,1227,1228,1229,1230,1231,1232,1233,1234,1235,1236,1237,1238,1239,1240,1241,1242,1243,1244,1245,1246,1247,1248,1249,1250,1251,1252,1253,1254,1255,1256,1257,1258,1259,1260,1261,1262,1263,1264,1265,1266,1267,1268,1269,1270,1271,1272,1273,1274,1275,1276,1277,1278,1279,1280,1281,1282,1283,1284,1285,1286,1287,1288,1289,1290,1291,1292,1293,1294,1295,1296,1297,1298,1299,1300,1301,1302,1303,1304,1305,1306,1307,1308,1309,1310,1311,1312,1313,1314,1315,1316,1317,1318,1319,1320,1321,1322,1323,1324,1325,1326,1327,1328,1329,1330,1331,1332,1333,1334,1335,1336,1337,1338,1339,1340,1341,1342,1343,1344,1345,1346,1347,1348,1349,1350,1351,1352,1353,1354,1355,1356,1357,1358,1359,1360,1361,1362,1363,1364,1365,1366,1367,1368,1369,1370,1371,1372,1373,1374,1375,1376,1377,1378,1379,1380,1381,1382,1383,1384,1385,1386,1387,1388,1389,1390,1391,1392,1393,1394,1395,1396,1397,1398,1399,1400,1401,1402,1403,1404,1405,1406,1407,1408,1409,1410,1411,1412,1413,1414,1415,1416,1417,1418,1419,1420,1421,1422,1423,1424,1425,1426,1427,1428,1429,1430,1431,1432,1433,1434,1435,1436,1437,1438,1439,1440,1441,1442,1443,1444,1445,1446,1447,1448,1449,1450,1451,1452,1453,1454,1455,1456,1457,1458,1459,1460,1461,1462,1463,1464,1465,1466,1467,1468,1469,1470,1471,1472,1473,1474,1475,1476,1477,1478,1479,1480,1481,1482,1483,1484,1485,1486,1487,1488,1489,1490,1491,1492,1493,1494,1495,1496,1497,1498,1499,1500,1501,1502,1503,1504,1505,1506,1507,1508,1509,1510,1511,1512,1513,1514,1515,1516,1517,1518,1519,1520,1521,1522,1523,1524,1525,1526,1527,1528,1529,1530,1531,1532,1533,1534,1535,1536,1537,1538,1539,1540,1541,1542,1543,1544,1545,1546,1547,1548,1549,1550,1551,1552,1553,1554,1555,1556,1557,1558,1559,1560,1561,1562,1563,1564,1565,1566,1567,1568,1569,1570,1571,1572,1573,1574,1575,1576,1577,1578,1579,1580,1581,1582,1583,1584,1585,1586,1587,1588,1589,1590,1591,1592,1593,1594,1595,1596,1597,1598,1599,1600,1601,1602,1603,1604,1605,1606,1607,1608,1609,1610,1611,1612,1613,1614,1615,1616,1617,1618,1619,1620,1621,1622,1623,1624,1625,1626,1627,1628,1629,1630,1631,1632,1633,1634,1635,1636,1637,1638,1639,1640,1641,1642,1643,1644,1645,1646,1647,1648,1649,1650,1651,1652,1653,1654,1655,1656,1657,1658,1659,1660,1661,1662,1663,1664,1665,1666,1667,1668,1669,1670,1671,1672,1673,1674,1675,1676,1677,1678,1679,1680,1681,1682,1683,1684,1685,1686,1687,1688,1689,1690,1691,1692,1693,1694,1695,1696,1697,1698,1699,1700,1701,1702,1703,1704,1705,1706,1707,1708,1709,1710,1711,1712,1713,1714,1715,1716,1717,1718,1719,1720,1721,1722,1723,1724,1725,1726,1727,1728,1729,1730,1731,1732,1733,1734,1735,1736,1737,1738,1739,1740,1741,1742,1743,1744,1745,1746,1747,1748,1749,1750,1751,1752,1753,1754,1755,1756,1757,1758,1759,1760,1761,1762,1763,1764,1765,1766,1767,1768,1769,1770,1771,1772,1773,1774,1775,1776,1777,1778,1779,1780,1781,1782,1783,1784,1785,1786,1787,1788,1789,1790,1791,1792,1793,1794,1795,1796,1797,1798,1799,1800,1801,1802,1803,1804,1805,1806,1807,1808,1809,1810,1811,1812,1813,1814,1815,1816,1817,1818,1819,1820,1821,1822,1823,1824,1825,1826,1827,1828,1829,1830,1831,1832,1833,1834,1835,1836,1837,1838,1839,1840,1841,1842,1843,1844,1845,1846,1847,1848,1849,1850,1851,1852,1853,1854,1855,1856,1857,1858,1859,1860,1861,1862,1863,1864,1865,1866,1867,1868,1869,1870,1871,1872,1873,1874,1875,1876,1877,1878,1879,1880,1881,1882,1883,1884,1885,1886,1887,1888,1889,1890,1891,1892,1893,1894,1895,1896,1897,1898,1899,1900,1901,1902,1903,1904,1905,1906,1907,1908,1909,1910,1911,1912,1913,1914,1915,1916,1917,1918,1919,1920,1921,1922,1923,1924,1925,1926,1927,1928,1929,1930,1931,1932,1933,1934,1935,1936,1937,1938,1939,1940,1941,1942,1943,1944,1945,1946,1947,1948,1949,1950,1951,1952,1953,1954,1955,1956,1957,1958,1959,1960,1961,1962,1963,1964,1965,1966,1967,1968,1969,1970,1971,1972,1973,1974,1975,1976,1977,1978,1979,1980,1981,1982,1983,1984,1985,1986,1987,1988,1989,1990,1991,1992,1993,1994,1995,1996,1997,1998,1999,2000,2001,2002,2003,2004,2005,2006,2007,2008,2009,2010,2011,2012,2013,2014,2015,2016,2017,2018,2019,2020,2021,2022,2023,2024,2025,2026,2027,2028,2029,2030,2031,2032,2033,2034,2035,2036,2037,2038,2039,2040,2041,2042,2043,2044,2045,2046,2047,2048,2049,2050,2051,2052,2053,2054,2055,2056,2057,2058,2059,2060,2061,2062,2063,2064,2065,2066,2067,2068,2069,2070,2071,2072,2073,2074,2075,2076,2077,2078,2079,2080,2081,2082,2083,2084,2085,2086,2087,2088,2089,2090,2091,2092,2093,2094,2095,2096,2097,2098,2099,2100,2101,2102,2103,2104,2105,2106,2107,2108,2109,2110,2111,2112,2113,2114,2115,2116,2117,2118,2119,2120,2121,2122,2123,2124,2125,2126,2127,2128,2129,2130,2131,2132,2133,2134,2135,2136,2137,2138,2139,2140,2141,2142,2143,2144,2145,2146,2147,2148,2149,2150,2151,2152,2153,2154,2155,2156,2157,2158,2159,2160,2161,2162,2163,2164,2165,2166,2167,2168,2169,2170,2171,2172,2173,2174,2175,2176,2177,2178,2179,2180,2181,2182,2183,2184,2185,2186,2187,2188,2189,2190,2191,2192,2193,2194,2195,2196,2197,2198,2199,2200,2201,2202,2203,2204,2205,2206,2207,2208,2209,2210,2211,2212,2213,2214,2215,2216,2217,2218,2219,2220,2221,2222,2223,2224,2225,2226,2227,2228,2229,2230,2231,2232,2233,2234,2235,2236,2237,2238,2239,2240,2241,2242,2243,2244,2245,2246,2247,2248,2249,2250,2251,2252,2253,2254,2255,2256,2257,2258,2259,2260,2261,2262,2263,2264,2265,2266,2267,2268,2269,2270,2271,2272,2273,2274,2275,2276,2277,2278,2279,2280,2281,2282,2283,2284,2285,2286,2287,2288,2289,2290,2291,2292,2293,2294,2295,2296,2297,2298,2299,2300,2301,2302,2303,2304,2305,2306,2307,2308,2309,2310,2311,2312,2313,2314,2315,2316,2317,2318,2319,2320,2321,2322,2323,2324,2325,2326,2327,2328,2329,2330,2331,2332,2333,2334,2335,2336,2337,2338,2339,2340,2341,2342,2343,2344,2345,2346,2347,2348,2349,2350,2351,2352,2353,2354,2355,2356,2357,2358,2359,2360,2361,2362,2363,2364,2365,2366,2367,2368,2369,2370,2371,2372,2373,2374,2375,2376,2377,2378,2379,2380,2381,2382,2383,2384,2385,2386,2387,2388,2389,2390,2391,2392,2393,2394,2395,2396,2397,2398,2399,2400,2401,2402,2403,2404,2405,2406,2407,2408,2409,2410,2411,2412,2413,2414,2415,2416,2417,2418,2419,2420,2421,2422,2423,2424,2425,2426,2427,2428,2429,2430,2431,2432,2433,2434,2435,2436,2437,2438,2439,2440,2441,2442,2443,2444,2445,2446,2447,2448,2449,2450,2451,2452,2453,2454,2455,2456,2457,2458,2459,2460,2461,2462,2463,2464,2465,2466,2467,2468,2469,2470,2471,2472,2473,2474,2475,2476,2477,2478,2479,2480,2481,2482,2483,2484,2485,2486,2487,2488,2489,2490,2491,2492,2493,2494,2495,2496,2497,2498,2499,2500,2501,2502,2503,2504,2505,2506,2507,2508,2509,2510,2511,2512,2513,2514,2515,2516,2517,2518,2519,2520,2521,2522,2523,2524,2525,2526,2527,2528,2529,2530,2531,2532,2533,2534,2535,2536,2537,2538,2539,2540,2541,2542,2543,2544,2545,2546,2547,2548,2549,2550,2551,2552,2553,2554,2555,2556,2557,2558,2559,2560,2561,2562,2563,2564,2565,2566,2567,2568,2569,2570,2571,2572,2573,2574,2575,2576,2577,2578,2579,2580,2581,2582,2583,2584,2585,2586,2587,2588,2589,2590,2591,2592,2593,2594,2595,2596,2597,2598,2599,2600,2601,2602,2603,2604,2605,2606,2607,2608,2609,2610,2611,2612,2613,2614,2615,2616,2617,2618,2619,2620,2621,2622,2623,2624,2625,2626,2627,2628,2629,2630,2631,2632,2633,2634,2635,2636,2637,2638,2639,2640,2641,2642,2643,2644,2645,2646,2647,2648,2649,2650,2651,2652,2653,2654,2655,2656,2657,2658,2659,2660,2661,2662,2663,2664,2665,2666,2667,2668,2669,2670,2671,2672,2673,2674,2675,2676,2677,2678,2679,2680,2681,2682,2683,2684,2685,2686,2687,2688,2689,2690,2691,2692,2693,2694,2695,2696,2697,2698,2699,2700,2701,2702,2703,2704,2705,2706,2707,2708,2709,2710,2711,2712,2713,2714,2715,2716,2717,2718,2719,2720,2721,2722,2723,2724,2725,2726,2727,2728,2729,2730,2731,2732,2733,2734,2735,2736,2737,2738,2739,2740,2741,2742,2743,2744,2745,2746,2747,2748,2749,2750,2751,2752,2753,2754,2755,2756,2757,2758,2759,2760,2761,2762,2763,2764,2765,2766,2767,2768,2769,2770,2771,2772,2773,2774,2775,2776,2777,2778,2779,2780,2781,2782,2783,2784,2785,2786,2787,2788,2789,2790,2791,2792,2793,2794,2795,2796,2797,2798,2799,2800,2801,2802,2803,2804,2805,2806,2807,2808,2809,2810,2811,2812,2813,2814,2815,2816,2817,2818,2819,2820,2821,2822,2823,2824,2825,2826,2827,2828,2829,2830,2831,2832,2833,2834,2835,2836,2837,2838,2839,2840,2841,2842,2843,2844,2845,2846,2847,2848,2849,2850,2851,2852,2853,2854,2855,2856,2857,2858,2859,2860,2861,2862,2863,2864,2865,2866,2867,2868,2869,2870,2871,2872,2873,2874,2875,2876,2877,2878,2879,2880,2881,2882,2883,2884,2885,2886,2887,2888,2889,2890,2891,2892,2893,2894,2895,2896,2897,2898,2899,2900,2901,2902,2903,2904,2905,2906,2907,2908,2909,2910,2911,2912,2913,2914,2915,2916,2917,2918,2919,2920,2921,2922,2923,2924,2925,2926,2927,2928,2929,2930,2931,2932,2933,2934,2935,2936,2937,2938,2939,2940,2941,2942,2943,2944,2945,2946,2947,2948,2949,2950,2951,2952,2953,2954,2955,2956,2957,2958,2959,2960,2961,2962,2963,2964,2965,2966,2967,2968,2969,2970,2971,2972,2973,2974,2975,2976,2977,2978,2979,2980,2981,2982,2983,2984,2985,2986,2987,2988,2989,2990,2991,2992,2993,2994,2995,2996,2997,2998,2999,3000,3001,3002,3003,3004,3005,3006,3007,3008,3009,3010,3011,3012,3013,3014,3015,3016,3017,3018,3019,3020,3021,3022,3023,3024,3025,3026,3027,3028,3029,3030,3031,3032,3033,3034,3035,3036,3037,3038,3039,3040,3041,3042,3043,3044,3045,3046,3047,3048,3049,3050,3051,3052,3053,3054,3055,3056,3057,3058,3059,3060,3061,3062,3063,3064,3065,3066,3067,3068,3069,3070,3071,3072,3073,3074,3075,3076,3077,3078,3079,3080,3081,3082,3083,3084,3085,3086,3087,3088,3089,3090,3091,3092,3093,3094,3095,3096,3097,3098,3099,3100,3101,3102,3103,3104,3105,3106,3107,3108,3109,3110,3111,3112,3113,3114,3115,3116,3117,3118,3119,3120,3121,3122,3123,3124,3125,3126,3127,3128,3129,3130,3131,3132,3133,3134,3135,3136,3137,3138,3139,3140,3141,3142,3143,3144,3145,3146,3147,3148,3149,3150,3151,3152,3153,3154,3155,3156,3157,3158,3159,3160,3161,3162,3163,3164,3165,3166,3167,3168,3169,3170,3171,3172,3173,3174,3175,3176,3177,3178,3179,3180,3181,3182,3183,3184,3185,3186,3187,3188,3189,3190,3191,3192,3193,3194,3195,3196,3197,3198,3199,3200,3201,3202,3203,3204,3205,3206,3207,3208,3209,3210,3211,3212,3213,3214,3215,3216,3217,3218,3219,3220,3221,3222,3223,3224,3225,3226,3227,3228,3229,3230,3231,3232,3233,3234,3235,3236,3237,3238,3239,3240,3241,3242,3243,3244,3245,3246,3247,3248,3249,3250,3251,3252,3253,3254,3255,3256,3257,3258,3259,3260,3261,3262,3263,3264,3265,3266,3267,3268,3269,3270,3271,3272,3273,3274,3275,3276,3277,3278,3279,3280,3281,3282,3283,3284,3285,3286,3287,3288,3289,3290,3291,3292,3293,3294,3295,3296,3297,3298,3299,3300,3301,3302,3303,3304,3305,3306,3307,3308,3309,3310,3311,3312,3313,3314,3315,3316,3317,3318,3319,3320,3321,3322,3323,3324,3325,3326,3327,3328,3329,3330,3331,3332,3333,3334,3335,3336,3337,3338,3339,3340,3341,3342,3343,3344,3345,3346,3347,3348,3349,3350,3351,3352,3353,3354,3355,3356,3357,3358,3359,3360,3361,3362,3363,3364,3365,3366,3367,3368,3369,3370,3371,3372,3373,3374,3375,3376,3377,3378,3379,3380,3381,3382,3383,3384,3385,3386,3387,3388,3389,3390,3391,3392,3393,3394,3395,3396,3397,3398,3399,3400,3401,3402,3403,3404,3405,3406,3407,3408,3409,3410,3411,3412,3413,3414,3415,3416,3417,3418,3419,3420,3421,3422,3423,3424,3425,3426,3427,3428,3429,3430,3431,3432,3433,3434,3435,3436,3437,3438,3439,3440,3441,3442,3443,3444,3445,3446,3447,3448,3449,3450,3451,3452,3453,3454,3455,3456,3457,3458,3459,3460,3461,3462,3463,3464,3465,3466,3467,3468,3469,3470,3471,3472,3473,3474,3475,3476,3477,3478,3479,3480,3481,3482,3483,3484,3485,3486,3487,3488,3489,3490,3491,3492,3493,3494,3495,3496,3497,3498,3499,3500,3501,3502,3503,3504,3505,3506,3507,3508,3509,3510,3511,3512,3513,3514,3515,3516,3517,3518,3519,3520,3521,3522,3523,3524,3525,3526,3527,3528,3529,3530,3531,3532,3533,3534,3535,3536,3537,3538,3539,3540,3541,3542,3543,3544,3545,3546,3547,3548,3549,3550,3551,3552,3553,3554,3555,3556,3557,3558,3559,3560,3561,3562,3563,3564,3565,3566,3567,3568,3569,3570,3571,3572,3573,3574,3575,3576,3577,3578,3579,3580,3581,3582,3583,3584,3585,3586,3587,3588,3589,3590,3591,3592,3593,3594,3595,3596,3597,3598,3599,3600,3601,3602,3603,3604,3605,3606,3607,3608,3609,3610,3611,3612,3613,3614,3615,3616,3617,3618,3619,3620,3621,3622,3623,3624,3625,3626,3627,3628,3629,3630,3631,3632,3633,3634,3635,3636,3637,3638,3639,3640,3641,3642,3643,3644,3645,3646,3647,3648,3649,3650,3651,3652,3653,3654,3655,3656,3657,3658,3659,3660,3661,3662,3663,3664,3665,3666,3667,3668,3669,3670,3671,3672,3673,3674,3675,3676,3677,3678,3679,3680,3681,3682,3683,3684,3685,3686,3687,3688,3689,3690,3691,3692,3693,3694,3695,3696,3697,3698,3699,3700,3701,3702,3703,3704,3705,3706,3707,3708,3709,3710,3711,3712,3713,3714,3715,3716,3717,3718,3719,3720,3721,3722,3723,3724,3725,3726,3727,3728,3729,3730,3731,3732,3733,3734,3735,3736,3737,3738,3739,3740,3741,3742,3743,3744,3745,3746,3747,3748,3749,3750,3751,3752,3753,3754,3755,3756,3757,3758,3759,3760,3761,3762,3763,3764,3765,3766,3767,3768,3769,3770,3771,3772,3773,3774,3775,3776,3777,3778,3779,3780,3781,3782,3783,3784,3785,3786,3787,3788,3789,3790,3791,3792,3793,3794,3795,3796,3797,3798,3799,3800,3801,3802,3803,3804,3805,3806,3807,3808,3809,3810,3811,3812,3813,3814,3815,3816,3817,3818,3819,3820,3821,3822,3823,3824,3825,3826,3827,3828,3829,3830,3831,3832,3833,3834,3835,3836,3837,3838,3839,3840,3841,3842,3843,3844,3845,3846,3847,3848,3849,3850,3851,3852,3853,3854,3855,3856,3857,3858,3859,3860,3861,3862,3863,3864,3865,3866,3867,3868,3869,3870,3871,3872,3873,3874,3875,3876,3877,3878,3879,3880,3881,3882,3883,3884,3885,3886,3887,3888,3889,3890,3891,3892,3893,3894,3895,3896,3897,3898,3899,3900,3901,3902,3903,3904,3905,3906,3907,3908,3909,3910,3911,3912,3913,3914,3915,3916,3917,3918,3919,3920,3921,3922,3923,3924,3925,3926,3927,3928,3929,3930,3931,3932,3933,3934,3935,3936,3937,3938,3939,3940,3941,3942,3943,3944,3945,3946,3947,3948,3949,3950,3951,3952,3953,3954,3955,3956,3957,3958,3959,3960,3961,3962,3963,3964,3965,3966,3967,3968,3969,3970,3971,3972,3973,3974,3975,3976,3977,3978,3979,3980,3981,3982,3983,3984,3985,3986,3987,3988,3989,3990,3991,3992,3993,3994,3995,3996,3997,3998,3999,4000,4001,4002,4003,4004,4005,4006,4007,4008,4009,4010,4011,4012,4013,4014,4015,4016,4017,4018,4019,4020,4021,4022,4023,4024,4025,4026,4027,4028,4029,4030,4031,4032,4033,4034,4035,4036,4037,4038,4039,4040,4041,4042,4043,4044,4045,4046,4047,4048,4049,4050,4051,4052,4053,4054,4055,4056,4057,4058,4059,4060,4061,4062,4063,4064,4065,4066,4067,4068,4069,4070,4071,4072,4073,4074,4075,4076,4077,4078,4079,4080,4081,4082,4083,4084,4085,4086,4087,4088,4089,4090,4091,4092,4093,4094,4095,4096,4097,4098,4099,4100,4101,4102,4103,4104,4105,4106,4107,4108,4109,4110,4111,4112,4113,4114,4115,4116,4117,4118,4119,4120,4121,4122,4123,4124,4125,4126,4127,4128,4129,4130,4131,4132,4133,4134,4135,4136,4137,4138,4139,4140,4141,4142,4143,4144,4145,4146,4147,4148,4149,4150,4151,4152,4153,4154,4155,4156,4157,4158,4159,4160,4161,4162,4163,4164,4165,4166,4167,4168,4169,4170,4171,4172,4173,4174,4175,4176,4177,4178,4179,4180,4181,4182,4183,4184,4185,4186,4187,4188,4189,4190,4191,4192,4193,4194,4195,4196,4197,4198,4199,4200,4201,4202,4203,4204,4205,4206,4207,4208,4209,4210,4211,4212,4213,4214,4215,4216,4217,4218,4219,4220,4221,4222,4223,4224,4225,4226,4227,4228,4229,4230,4231,4232,4233,4234,4235,4236,4237,4238,4239,4240,4241,4242,4243,4244,4245,4246,4247,4248,4249,4250,4251,4252,4253,4254,4255,4256,4257,4258,4259,4260,4261,4262,4263,4264,4265,4266,4267,4268,4269,4270,4271,4272,4273,4274,4275,4276,4277,4278,4279,4280,4281,4282,4283,4284,4285,4286,4287,4288,4289,4290,4291,4292,4293,4294,4295,4296,4297,4298,4299,4300,4301,4302,4303,4304,4305,4306,4307,4308,4309,4310,4311,4312,4313,4314,4315,4316,4317,4318,4319,4320,4321,4322,4323,4324,4325,4326,4327,4328,4329,4330,4331,4332,4333,4334,4335,4336,4337,4338,4339,4340,4341,4342,4343,4344,4345,4346,4347,4348,4349,4350,4351,4352,4353,4354,4355,4356,4357,4358,4359,4360,4361,4362,4363,4364,4365,4366,4367,4368,4369,4370,4371,4372,4373,4374,4375,4376,4377,4378,4379,4380,4381,4382,4383,4384,4385,4386,4387,4388,4389,4390,4391,4392,4393,4394,4395,4396,4397,4398,4399,4400,4401,4402,4403,4404,4405,4406,4407,4408,4409,4410,4411,4412,4413,4414,4415,4416,4417,4418,4419,4420,4421,4422,4423,4424,4425,4426,4427,4428,4429,4430,4431,4432,4433,4434,4435,4436,4437,4438,4439,4440,4441,4442,4443,4444,4445,4446,4447,4448,4449,4450,4451,4452,4453,4454,4455,4456,4457,4458,4459,4460,4461,4462,4463,4464,4465,4466,4467,4468,4469,4470,4471,4472,4473,4474,4475,4476,4477,4478,4479,4480,4481,4482,4483,4484,4485,4486,4487,4488,4489,4490,4491,4492,4493,4494,4495,4496,4497,4498,4499,4500,4501,4502,4503,4504,4505,4506,4507,4508,4509,4510,4511,4512,4513,4514,4515,4516,4517,4518,4519,4520,4521,4522,4523,4524,4525,4526,4527,4528,4529,4530,4531,4532,4533,4534,4535,4536,4537,4538,4539,4540,4541,4542,4543,4544,4545,4546,4547,4548,4549,4550,4551,4552,4553,4554,4555,4556,4557,4558,4559,4560,4561,4562,4563,4564,4565,4566,4567,4568,4569,4570,4571,4572,4573,4574,4575,4576,4577,4578,4579,4580,4581,4582,4583,4584,4585,4586,4587,4588,4589,4590,4591,4592,4593,4594,4595,4596,4597,4598,4599,4600,4601,4602,4603,4604,4605,4606,4607,4608,4609,4610,4611,4612,4613,4614,4615,4616,4617,4618,4619,4620,4621,4622,4623,4624,4625,4626,4627,4628,4629,4630,4631,4632,4633,4634,4635,4636,4637,4638,4639,4640,4641,4642,4643,4644,4645,4646,4647,4648,4649,4650,4651,4652,4653,4654,4655,4656,4657,4658,4659,4660,4661,4662,4663,4664,4665,4666,4667,4668,4669,4670,4671,4672,4673,4674,4675,4676,4677,4678,4679,4680,4681,4682,4683,4684,4685,4686,4687,4688,4689,4690,4691,4692,4693,4694,4695,4696,4697,4698,4699,4700,4701,4702,4703,4704,4705,4706,4707,4708,4709,4710,4711,4712,4713,4714,4715,4716,4717,4718,4719,4720,4721,4722,4723,4724,4725,4726,4727,4728,4729,4730,4731,4732,4733,4734,4735,4736,4737,4738,4739,4740,4741,4742,4743,4744,4745,4746,4747,4748,4749,4750,4751,4752,4753,4754,4755,4756,4757,4758,4759,4760,4761,4762,4763,4764,4765,4766,4767,4768,4769,4770,4771,4772,4773,4774,4775,4776,4777,4778,4779,4780,4781,4782,4783,4784,4785,4786,4787,4788,4789,4790,4791,4792,4793,4794,4795,4796,4797,4798,4799,4800,4801,4802,4803,4804,4805,4806,4807,4808,4809,4810,4811,4812,4813,4814,4815,4816,4817,4818,4819,4820,4821,4822,4823,4824,4825,4826,4827,4828,4829,4830,4831,4832,4833,4834,4835,4836,4837,4838,4839,4840,4841,4842,4843,4844,4845,4846,4847,4848,4849,4850,4851,4852,4853,4854,4855,4856,4857,4858,4859,4860,4861,4862,4863,4864,4865,4866,4867,4868,4869,4870,4871,4872,4873,4874,4875,4876,4877,4878,4879,4880,4881,4882,4883,4884,4885,4886,4887,4888,4889,4890,4891,4892,4893,4894,4895,4896,4897,4898,4899,4900,4901,4902,4903,4904,4905,4906,4907,4908,4909,4910,4911,4912,4913,4914,4915,4916,4917,4918,4919,4920,4921,4922,4923,4924,4925,4926,4927,4928,4929,4930,4931,4932,4933,4934,4935,4936,4937,4938,4939,4940,4941,4942,4943,4944,4945,4946,4947,4948,4949,4950,4951,4952,4953,4954,4955,4956,4957,4958,4959,4960,4961,4962,4963,4964,4965,4966,4967,4968,4969,4970,4971,4972,4973,4974,4975,4976,4977,4978,4979,4980,4981,4982,4983,4984,4985,4986,4987,4988,4989,4990,4991,4992,4993,4994,4995,4996,4997,4998,4999 |
+-----------------------------------------------------------------------------------------------------------------------------------------------------------------------------------------------------------------------------------------------------------------------------------------------------------------------------------------------------------------------------------------------------------------------------------------------------------------------------------------------------------------------------------------------------------------------------------------------------------------------------------------------------------------------------------------------------------------------------------------------------------------------------------------------------------------------------------------------------------------------------------------------------------------------------------------------------------------------------------------------------------------------------------------------------------------------------------------------------------------------------------------------------------------------------------------------------------------------------------------------------------------------------------------------------------------------------------------------------------------------------------------------------------------------------------------------------------------------------------------------------------------------------------------------------------------------------------------------------------------------------------------------------------------------------------------------------------------------------------------------------------------------------------------------------------------------------------------------------------------------------------------------------------------------------------------------------------------------------------------------------------------------------------------------------------------------------------------------------------------------------------------------------------------------------------------------------------------------------------------------------------------------------------------------------------------------------------------------------------------------------------------------------------------------------------------------------------------------------------------------------------------------------------------------------------------------------------------------------------------------------------------------------------------------------------------------------------------------------------------------------------------------------------------------------------------------------------------------------------------------------------------------------------------------------------------------------------------------------------------------------------------------------------------------------------------------------------------------------------------------------------------------------------------------------------------------------------------------------------------------------------------------------------------------------------------------------------------------------------------------------------------------------------------------------------------------------------------------------------------------------------------------------------------------------------------------------------------------------------------------------------------------------------------------------------------------------------------------------------------------------------------------------------------------------------------------------------------------------------------------------------------------------------------------------------------------------------------------------------------------------------------------------------------------------------------------------------------------------------------------------------------------------------------------------------------------------------------------------------------------------------------------------------------------------------------------------------------------------------------------------------------------------------------------------------------------------------------------------------------------------------------------------------------------------------------------------------------------------------------------------------------------------------------------------------------------------------------------------------------------------------------------------------------------------------------------------------------------------------------------------------------------------------------------------------------------------------------------------------------------------------------------------------------------------------------------------------------------------------------------------------------------------------------------------------------------------------------------------------------------------------------------------------------------------------------------------------------------------------------------------------------------------------------------------------------------------------------------------------------------------------------------------------------------------------------------------------------------------------------------------------------------------------------------------------------------------------------------------------------------------------------------------------------------------------------------------------------------------------------------------------------------------------------------------------------------------------------------------------------------------------------------------------------------------------------------------------------------------------------------------------------------------------------------------------------------------------------------------------------------------------------------------------------------------------------------------------------------------------------------------------------------------------------------------------------------------------------------------------------------------------------------------------------------------------------------------------------------------------------------------------------------------------------------------------------------------------------------------------------------------------------------------------------------------------------------------------------------------------------------------------------------------------------------------------------------------------------------------------------------------------------------------------------------------------------------------------------------------------------------------------------------------------------------------------------------------------------------------------------------------------------------------------------------------------------------------------------------------------------------------------------------------------------------------------------------------------------------------------------------------------------------------------------------------------------------------------------------------------------------------------------------------------------------------------------------------------------------------------------------------------------------------------------------------------------------------------------------------------------------------------------------------------------------------------------------------------------------------------------------------------------------------------------------------------------------------------------------------------------------------------------------------------------------------------------------------------------------------------------------------------------------------------------------------------------------------------------------------------------------------------------------------------------------------------------------------------------------------------------------------------------------------------------------------------------------------------------------------------------------------------------------------------------------------------------------------------------------------------------------------------------------------------------------------------------------------------------------------------------------------------------------------------------------------------------------------------------------------------------------------------------------------------------------------------------------------------------------------------------------------------------------------------------------------------------------------------------------------------------------------------------------------------------------------------------------------------------------------------------------------------------------------------------------------------------------------------------------------------------------------------------------------------------------------------------------------------------------------------------------------------------------------------------------------------------------------------------------------------------------------------------------------------------------------------------------------------------------------------------------------------------------------------------------------------------------------------------------------------------------------------------------------------------------------------------------------------------------------------------------------------------------------------------------------------------------------------------------------------------------------------------------------------------------------------------------------------------------------------------------------------------------------------------------------------------------------------------------------------------------------------------------------------------------------------------------------------------------------------------------------------------------------------------------------------------------------------------------------------------------------------------------------------------------------------------------------------------------------------------------------------------------------------------------------------------------------------------------------------------------------------------------------------------------------------------------------------------------------------------------------------------------------------------------------------------------------------------------------------------------------------------------------------------------------------------------------------------------------------------------------------------------------------------------------------------------------------------------------------------------------------------------------------------------------------------------------------------------------------------------------------------------------------------------------------------------------------------------------------------------------------------------------------------------------------------------------------------------------------------------------------------------------------------------------------------------------------------------------------------------------------------------------------------------------------------------------------------------------------------------------------------------------------------------------------------------------------------------------------------------------------------------------------------------------------------------------------------------------------------------------------------------------------------------------------------------------------------------------------------------------------------------------------------------------------------------------------------------------------------------------------------------------------------------------------------------------------------------------------------------------------------------------------------------------------------------------------------------------------------------------------------------------------------------------------------------------------------------------------------------------------------------------------------------------------------------------------------------------------------------------------------------------------------------------------------------------------------------------------------------------------------------------------------------------------------------------------------------------------------------------------------------------------------------------------------------------------------------------------------------------------------------------------------------------------------------------------------------------------------------------------------------------------------------------------------------------------------------------------------------------------------------------------------------------------------------------------------------------------------------------------------------------------------------------------------------------------------------------------------------------------------------------------------------------------------------------------------------------------------------------------------------------------------------------------------------------------------------------------------------------------------------------------------------------------------------------------------------------------------------------------------------------------------------------------------------------------------------------------------------------------------------------------------------------------------------------------------------------------------------------------------------------------------------------------------------------------------------------------------------------------------------------------------------------------------------------------------------------------------------------------------------------------------------------------------------------------------------------------------------------------------------------------------------------------------------------------------------------------------------------------------------------------------------------------------------------------------------------------------------------------------------------------------------------------------------------------------------------------------------------------------------------------------------------------------------------------------------------------------------------------------------------------------------------------------------------------------------------------------------------------------------------------------------------------------------------------------------------------------------------------------------------------------------------------------------------------------------------------------------------------------------------------------------------------------------------------------------------------------------------------------------------------------------------------------------------------------------------------------------------------------------------------------------------------------------------------------------------------------------------------------------------------------------------------------------------------------------------------------------------------------------------------------------------------------------------------------------------------------------------------------------------------------------------------------------------------------------------------------------------------------------------------------------------------------------------------------------------------------------------------------------------------------------------------------------------------------------------------------------------------------------------------------------------------------------------------------------------------------------------------------------------------------------------------------------------------------------------------------------------------------------------------------------------------------------------------------------------------------------------------------------------------------------------------------------------------------------------------------------------------------------------------------------------------------------------------------------------------------------------------------------------------------------------------------------------------------------------------------------------------------------------------------------------------------------------------------------------------------------------------------------------------------------------------------------------------------------------------------------------------------------------------------------------------------------------------------------------------------------------------------------------------------------------------------------------------------------------------------------------------------------------------------------------------------------------------------------------------------------------------------------------------------------------------------------------------------------------------------------------------------------------------------------------------------------------------------------------------------------------------------------------------------------------------------------------------------------------------------------------------------------------------------------------------------------------------------------------------------------------------------------------------------------------------------------------------------------------------------------------------------------------------------------------------------------------------------------------------------------------------------------------------------------------------------------------------------------------------------------------------------------------------------------------------------------------------------------------------------------------------------------------------------------------------------------------------------------------------------------------------------------------------------------------------------------------------------------------------------------------------------------------------------------------------------------------------------------------------------------------------------------------------------------------------------------------------------------------------------------------------------------------------------------------------------------------------------------------------------------------------------------------------------------------------------------------------------------------------------------------------------------------------------------------------------------------------------------------------------------------------------------------------------------------------------------------------------------------------------------------------------------------------------------------------------------------------------------------------------------------------------------------------------------------------------------------------------------------------------------------------------------------------------------------------------------------------------------------------------------------------------------------------------------------------------------------------------------------------------------------------------------------------------------------------------------------------------------------------------------------------------------------------------------------------------------------------------------------------------------------------------------------------------------------------------------------------------------------------------------------------------------------------------------------------------------------------------------------------------------------------------------------------------------------------------------------------------------------------------------------------------------------------------------------------------------------------------------------------------------------------------------------------------------------------------------------------------------------------------------------------------------------------------------------------------------------------------------------------------------------------------------------------------------------------------------------------------------------------------------------------------------------------------------------------------------------------------------------------------------------------------------------------------------------------------------------------------------------------------------------------------------------------------------------------------------------------------------------------------------------------------------------------------------------------------------------------------------------------------------------------------------------------------------------------------------------------------------------------------------------------------------------------------------------------------------------------------------------------------------------------------------------------------------------------------------------------------------------------------------------------------------------------------------------------------------------------------------------------------------------------------------------------------------------------------------------------------------------------------------------------------------------------------------------------------------------------------------------------------------------------------------------------------------------------------------------------------------------------------------------------------------------------------------------------------------------------------------------------------------------------------------------------------------------------------------------------------------------------------------------------------------------------------------------------------------------------------------------------------------------------------------------------------------------------------------------------------------------------------------------------------------------------------------------------------------------------------------------------------------------------------------------------------------------------------------------------------------------------------------------------------------------------------------------------------------------------------------------------------------------------------------------------------------------------------------------------------------------------------------------------------------------------------------------------------------------------------------------------------------------------------------------------------------------------------------------------------------------------------------------------------------------------------------------------------------------------------------------------------------------------------------------------------------------------------------------------------------------------------------------------------------------------------------------------------------------------------------------------------------------------+
2024091800104495164   „Ää„Äêbitmap‰∏âÊúü„Äërb_select ÂèÇÊï∞1rb‰∏∫ÈîôËØØÁöÑÊï∞ÊçÆ‰∏îÂèÇÊï∞2ËÆæÁΩÆ0Êó∂ÔºåobÊ≤°ÊúâÂà§Êñ≠ÂèÇÊï∞1„Äã
select rb_to_string(rb_select(x'01053b3000000100000f27010000000f00',16,15,true));
+---------------------------------------------------------------------------+
| rb_to_string(rb_select(x'01053b3000000100000f27010000000f00',16,15,true)) |
+---------------------------------------------------------------------------+
| 0                                                                         |
+---------------------------------------------------------------------------+
select rb_to_string(rb_select(x'01053b3000000100000f27010000000f00',16,15));
+----------------------------------------------------------------------+
| rb_to_string(rb_select(x'01053b3000000100000f27010000000f00',16,15)) |
+----------------------------------------------------------------------+
| 15                                                                   |
+----------------------------------------------------------------------+
select rb_to_string(rb_select(x'01053b3000000100000f27010000000f00',16));
+-------------------------------------------------------------------+
| rb_to_string(rb_select(x'01053b3000000100000f27010000000f00',16)) |
+-------------------------------------------------------------------+
| 0,1,2,3,4,5,6,7,8,9,10,11,12,13,14,15                             |
+-------------------------------------------------------------------+
select rb_to_string(rb_select(x'01053b3000000110000f27010000000f27',10,1,true,0));
+---------------------------------------------------------------------------------+
| rb_to_string(rb_select(x'01053b3000000110000f27010000000f27',10,1,true,0))      |
+---------------------------------------------------------------------------------+
| 1058565,1058566,1058567,1058568,1058569,1058570,1058571,1058572,1058573,1058574 |
+---------------------------------------------------------------------------------+
select rb_select(x'01053b3000000110000f27010000000f27',33,1,true,0);
+--------------------------------------------------------------------------------------------------+
| rb_select(x'01053b3000000110000f27010000000f27',33,1,true,0)                                     |
+--------------------------------------------------------------------------------------------------+
|            :0           Ó&Ô&&Ò&Ú&Û&Ù&ı&ˆ&˜&¯&˘&˙&˚&¸&˝&˛&ˇ& '''''''''	'
'''''                   |
+--------------------------------------------------------------------------------------------------+
select rb_select(x'01053a3000000100000f27010000000f27',1);
ERROR HY000: Invalid data
select rb_select(x'01053b3000010100000f27010000000f27',1);
ERROR HY000: Invalid data
select rb_select(x'01053b3000000000000f27010000000f27',1);
ERROR HY000: Invalid data
2024091800104495164   „Ää„Äêbitmap‰∏âÊúü„Äërb_select ÂèÇÊï∞1rb‰∏∫ÈîôËØØÁöÑÊï∞ÊçÆ‰∏îÂèÇÊï∞2ËÆæÁΩÆ0Êó∂ÔºåobÊ≤°ÊúâÂà§Êñ≠ÂèÇÊï∞1„Äã
select rb_select(x'01053b3000000000000f27010000000f27',0);
ERROR HY000: Invalid data
select rb_select(x'01053b3000000000000f27010000000f27',1);
ERROR HY000: Invalid data
select rb_select(x'01053b3000000200000f27010000000f27',1);
ERROR HY000: Invalid data
select rb_select(x'01053b30000000000f27010000000f27',1);
ERROR HY000: Invalid data
select rb_select(x'01053b3000000101000f27010000000f00',1);
+----------------------------------------------------+
| rb_select(x'01053b3000000101000f27010000000f00',1) |
+----------------------------------------------------+
|                                                 |
+----------------------------------------------------+
select rb_select(x'01053b300000010f27010000000f00',1);
ERROR HY000: Invalid data
select rb_select(x'00053b3000000101000f27010000000f00',1);
ERROR HY000: Invalid data
select rb_select(x'053b3000000101000f27010000000f00',1);
ERROR HY000: Invalid data
select rb_select(x'01003b3000000101000f27010000000f00',1);
ERROR HY000: Invalid data
select rb_select(x'01013b3000000101000f27010000000f00',1);
ERROR HY000: Invalid data
select rb_select(x'01023b3000000101000f27010000000f00',1);
ERROR HY000: Invalid data
select rb_select(x'01033b3000000101000f27010000000f00',1);
ERROR HY000: Invalid data
select rb_select(x'01043b3000000101000f27010000000f00',1);
ERROR HY000: Invalid data
select rb_select(x'01063b3000000101000f27010000000f00',1);
ERROR HY000: Invalid data
select rb_select(x'01073b3000000101000f27010000000f00',1);
ERROR HY000: Invalid data
select rb_select(x'013b3000000101000f27010000000f00',1);
ERROR HY000: Invalid data
select rb_from_string(rb_select(x'01053b3000000101000f27010000000f00',1));
ERROR HY000: invalid type given for an argument
select rb_select(x'01053b3000000101000000010000000f00',10);
+-----------------------------------------------------+
| rb_select(x'01053b3000000101000000010000000f00',10) |
+-----------------------------------------------------+
| 
                   	           |
+-----------------------------------------------------+
select rb_select(x'01053b3000000101001111010000000f00',33,0,true);
+---------------------------------------------------------------------+
| rb_select(x'01053b3000000101001111010000000f00',33,0,true)          |
+---------------------------------------------------------------------+
|                    	  
             |
+---------------------------------------------------------------------+
select rb_select(x'01053b300000010100010000000f00',1);
ERROR HY000: Invalid data
select rb_select(x'01053b3000000101000f27000000000f00',1);
ERROR HY000: Invalid data
select rb_select(x'01053b3000000101000f27020000000f00',1);
ERROR HY000: Invalid data
select rb_select(x'01053b3000000101000f2700000f00',1);
ERROR HY000: Invalid data
select rb_select(x'01053b3000000101000f27010000010f00',1);
+----------------------------------------------------+
| rb_select(x'01053b3000000101000f27010000010f00',1) |
+----------------------------------------------------+
|                                                |
+----------------------------------------------------+
select rb_select(x'01053b300000010100ffff0100ffff0f00',1);
ERROR HY000: Invalid data
select rb_select(rb_build_varbinary(x'01053b300000010000ffff0100ffff0f00'),6);
ERROR HY000: Invalid data
select rb_select(x'01053b3000000101000f2701000f00',2);
ERROR HY000: Invalid data
select rb_select(x'01053b3000000101000f2701000000ffff',1);
+----------------------------------------------------+
| rb_select(x'01053b3000000101000f2701000000ffff',1) |
+----------------------------------------------------+
|                                                 |
+----------------------------------------------------+
select rb_select(x'01053b3000000101000f2701000001',7);
ERROR HY000: Invalid data
select rb_select(x'01053b3000000101000f27010000000f00',100);
+---------------------------------------------------------------------+
| rb_select(x'01053b3000000101000f27010000000f00',100)                |
+---------------------------------------------------------------------+
|                    	  
             |
+---------------------------------------------------------------------+
select rb_select(x'01053b300000010001ffff0100feff0000',2);
+----------------------------------------------------+
| rb_select(x'01053b300000010001ffff0100feff0000',2) |
+----------------------------------------------------+
| ˛ˇ                                                |
+----------------------------------------------------+
select rb_select(x'01053a30020001000002000100000099190100010001000200030098999999',1);
ERROR HY000: Invalid data
select rb_select(x'01053b30020001000002000100000099190100010001000200030098999999',100);
+----------------------------------------------------------------------------------+
| rb_select(x'01053b30020001000002000100000099190100010001000200030098999999',100) |
+----------------------------------------------------------------------------------+
|            òôôôôô                                                            |
+----------------------------------------------------------------------------------+
select rb_select(x'01053b30020001000002000100000099190200010001000200030098999999',1);
ERROR HY000: Invalid data
select rb_select(x'01053b30020001000002000100010099190100010001000200030098999999',1);
ERROR HY000: Invalid data
select rb_select(x'01053b3002000100000200010000009919010001000100020003009899',1);
ERROR HY000: Invalid data
select rb_select(x'01053b30020001000002000100000099190100000001000200030098999999',1);
ERROR HY000: Invalid data
select rb_select(x'01053b30020001000002000100000099190100010001000700030098999999',5);
+--------------------------------------------------------------------------------+
| rb_select(x'01053b30020001000002000100000099190100010001000700030098999999',5) |
+--------------------------------------------------------------------------------+
|                                                                        |
+--------------------------------------------------------------------------------+
select rb_select(x'01053b30030001000002000100000099190100010001000200030098999999',1);
ERROR HY000: Invalid data
select rb_select(x'01053b30010001000002000100000099190100010001000700030098999999',3);
ERROR HY000: Invalid data
select rb_select(x'01053b30020000000002000100000099190100010001000700030098999999',5);
ERROR HY000: Invalid data
select rb_select(x'01053b300200000002000100000099190100010001000700030098999999',1);
ERROR HY000: Invalid data
select rb_select(x'01053b30020001010002000100000099190100010001000700030098999999',1);
ERROR HY000: Invalid data
select rb_to_string(rb_select(x'01053b30020001000002000100000099190100010001000200030098999999',2));
+----------------------------------------------------------------------------------------------+
| rb_to_string(rb_select(x'01053b30020001000002000100000099190100010001000200030098999999',2)) |
+----------------------------------------------------------------------------------------------+
| 1,2                                                                                          |
+----------------------------------------------------------------------------------------------+
select rb_select(x'01053b30020001002002000100000099190100010001000200030098999999',1);
+--------------------------------------------------------------------------------+
| rb_select(x'01053b30020001002002000100000099190100010001000200030098999999',1) |
+--------------------------------------------------------------------------------+
|                                                                            |
+--------------------------------------------------------------------------------+
select rb_select(x'01053b30020001000002000100000099190100010001000200030098999999',1);
+--------------------------------------------------------------------------------+
| rb_select(x'01053b30020001000002000100000099190100010001000200030098999999',1) |
+--------------------------------------------------------------------------------+
|                                                                             |
+--------------------------------------------------------------------------------+
select rb_to_string(rb_select(x'01060100000000000000000000003b300000010000ffff0100fffe0f00',50));
+-------------------------------------------------------------------------------------------------+
| rb_to_string(rb_select(x'01060100000000000000000000003b300000010000ffff0100fffe0f00',50))       |
+-------------------------------------------------------------------------------------------------+
| 65279,65280,65281,65282,65283,65284,65285,65286,65287,65288,65289,65290,65291,65292,65293,65294 |
+-------------------------------------------------------------------------------------------------+
bug 2024092000104516141   „Ää[bitmap‰∏âÊúü]rb_select ÈÄÜÊó∂ËæìÂá∫Ôºåoffset ËæìÂÖ•ÂÄºÂíåvaluesÊï∞ÈáèÁõ∏Â∑Æ1Êó∂ÔºåobÊ≤°ÊúâËæìÂá∫ÂÄºÔºåÂ∫îËØ•ËæìÂá∫1‰∏™value„Äã
select rb_to_string(rb_select(x'01060100000000000000000000003b300000010000ffff0100fffe0f00',50,15,true));
+---------------------------------------------------------------------------------------------------+
| rb_to_string(rb_select(x'01060100000000000000000000003b300000010000ffff0100fffe0f00',50,15,true)) |
+---------------------------------------------------------------------------------------------------+
| 65279                                                                                             |
+---------------------------------------------------------------------------------------------------+
select rb_to_string(rb_select(x'01060100000000000000000000003b300000010000ffff0100fffe0f00',50,14,true));
+---------------------------------------------------------------------------------------------------+
| rb_to_string(rb_select(x'01060100000000000000000000003b300000010000ffff0100fffe0f00',50,14,true)) |
+---------------------------------------------------------------------------------------------------+
| 65279,65280                                                                                       |
+---------------------------------------------------------------------------------------------------+
select rb_to_string(rb_select(x'01060100000000000000000000003b300000010000ffff0100fffe0f00',50,15,false));
+----------------------------------------------------------------------------------------------------+
| rb_to_string(rb_select(x'01060100000000000000000000003b300000010000ffff0100fffe0f00',50,15,false)) |
+----------------------------------------------------------------------------------------------------+
| 65294                                                                                              |
+----------------------------------------------------------------------------------------------------+
select rb_select(x'01060100000000000000000000003b3000000100000f27010000000100',1);
+----------------------------------------------------------------------------+
| rb_select(x'01060100000000000000000000003b3000000100000f27010000000100',1) |
+----------------------------------------------------------------------------+
|                                                                          |
+----------------------------------------------------------------------------+
select rb_to_string(rb_select(x'01060200000000000000000000013b3000000100000f27010000000f00ffffffff3a30000001000000ffff000010000000ffff',3,0,true,1100000000,18446744073709551615));
+-----------------------------------------------------------------------------------------------------------------------------------------------------------------------------+
| rb_to_string(rb_select(x'01060200000000000000000000013b3000000100000f27010000000f00ffffffff3a30000001000000ffff000010000000ffff',3,0,true,1100000000,18446744073709551615)) |
+-----------------------------------------------------------------------------------------------------------------------------------------------------------------------------+
| 72057594037927949,72057594037927950,72057594037927951                                                                                                                       |
+-----------------------------------------------------------------------------------------------------------------------------------------------------------------------------+
select rb_select(x'01060200000000000000ffffffff3a30000001000000ffff000010000000ffff000000013b3000000100000f27010000000f00',33);
+---------------------------------------------------------------------------------------------------------------------------------------------+
| rb_select(x'01060200000000000000ffffffff3a30000001000000ffff000010000000ffff000000013b3000000100000f27010000000f00',33)                     |
+---------------------------------------------------------------------------------------------------------------------------------------------+
| ˇˇˇˇˇˇˇˇ                                                       	      
                                             |
+---------------------------------------------------------------------------------------------------------------------------------------------+
select rb_select(x'01060100000000000000000000003b3000000100000f27010000000100',3);
+----------------------------------------------------------------------------+
| rb_select(x'01060100000000000000000000003b3000000100000f27010000000100',3) |
+----------------------------------------------------------------------------+
|                                                                        |
+----------------------------------------------------------------------------+
select rb_select(x'01060200000000000000000000013b3000000100000f27010000000f00ffffffff3a30000001000000ffff000010000000ffff',5);
+------------------------------------------------------------------------------------------------------------------------+
| rb_select(x'01060200000000000000000000013b3000000100000f27010000000f00ffffffff3a30000001000000ffff000010000000ffff',5) |
+------------------------------------------------------------------------------------------------------------------------+
|                                                                                                            |
+------------------------------------------------------------------------------------------------------------------------+
select rb_select(x'01060300000000000000000000003b3000000100000f27010000000f27010000003b3000000100006300010000006300ffffffff3a30000001000000ffff000010000000ffff',32);
+---------------------------------------------------------------------------------------------------------------------------------------------------------------+
| rb_select(x'01060300000000000000000000003b3000000100000f27010000000f27010000003b3000000100006300010000006300ffffffff3a30000001000000ffff000010000000ffff',32) |
+---------------------------------------------------------------------------------------------------------------------------------------------------------------+
|                              	   
                                                                                             |
+---------------------------------------------------------------------------------------------------------------------------------------------------------------+
select rb_select(x'01060300000000000000000000003b3000000110000f27010000000f27010000003b3000000100006300010000006300ffffffff3a30000001000000ffff000010000000ffff',33);
+---------------------------------------------------------------------------------------------------------------------------------------------------------------+
| rb_select(x'01060300000000000000000000003b3000000110000f27010000000f27010000003b3000000100006300010000006300ffffffff3a30000001000000ffff000010000000ffff',33) |
+---------------------------------------------------------------------------------------------------------------------------------------------------------------+
|            :0                     	 
                                                                                      |
+---------------------------------------------------------------------------------------------------------------------------------------------------------------+
select rb_select(x'01060300000000000000000000003b30000001a0000f27010000000f27010000003b3000000100006300010000006300ffffffff3a30000001000000ffff000010000000ffff',100);
+----------------------------------------------------------------------------------------------------------------------------------------------------------------------------------------------------------------------------------------+
| rb_select(x'01060300000000000000000000003b30000001a0000f27010000000f27010000003b3000000100006300010000006300ffffffff3a30000001000000ffff000010000000ffff',100)                                                                         |
+----------------------------------------------------------------------------------------------------------------------------------------------------------------------------------------------------------------------------------------+
|            :0     † c              	 
                        ! " # $ % & ' ( ) * + , - . / 0 1 2 3 4 5 6 7 8 9 : ; < = > ? @ A B C D E F G H I J K L M N O P Q R S T U V W X Y Z [ \ ] ^ _ ` a b c   |
+----------------------------------------------------------------------------------------------------------------------------------------------------------------------------------------------------------------------------------------+
select rb_select(x'01060300000000000000000000003b30000001a0000f27010000000f27010000003b3000000100006300010000006300ffffffff3a30000001000000ffff000010000000ffff',100);
+----------------------------------------------------------------------------------------------------------------------------------------------------------------------------------------------------------------------------------------+
| rb_select(x'01060300000000000000000000003b30000001a0000f27010000000f27010000003b3000000100006300010000006300ffffffff3a30000001000000ffff000010000000ffff',100)                                                                         |
+----------------------------------------------------------------------------------------------------------------------------------------------------------------------------------------------------------------------------------------+
|            :0     † c              	 
                        ! " # $ % & ' ( ) * + , - . / 0 1 2 3 4 5 6 7 8 9 : ; < = > ? @ A B C D E F G H I J K L M N O P Q R S T U V W X Y Z [ \ ] ^ _ ` a b c   |
+----------------------------------------------------------------------------------------------------------------------------------------------------------------------------------------------------------------------------------------+
select rb_to_string(rb_select(x'01060300000000000000ffffffff3a30000001000000ffff000010000000ffff000000003b30000001a0000f27010000000f27010000003b3000000100006300010000006300',4100));
+-------------------------------------------------------------------------------------------------------------------------------------------------------------------------------------------------------------------------------------------------------------------------------------------------------------------------------------------------------------------------------------------------------------------------------------------------------------------------------------------------------------------------------------------------------------------------------------------------------------------------------------------------------------------------------------------------------------------------------------------------------------------------------------------------------------------------------------------------------------------------------------------------------------------------------------------------------------------------------------------------------------------------------------------------------------------------------------------------------------------------------------------------------------------------------------------------------------------------------------------------------------------------------------------------------------------------------------------------------------------------------------------------------------------------------------------------------------------------------------------------------------------------------------------------------------------------------------------------------------------------------------------------------------------------------------------------------------------------------------------------------------------------------------------------------------------------------------------------------------------------------------------------------------------------------------------------------------------------------------------------------------------------------------------------------------------------------------------------------------------------------------------------------------------------------------------------------------------------------------------------------------------------------------------------------------------------------------------------------------------------------------------------------------------------------------------------------------------------------------------------------------------------------------------------------------------------------------------------------------------------------------------------------------------------------------------------------------------------------------------------------------------------------------------------------------------------------------------------------------------------------------------------------------------------------------------------------------------------------------------------------------------------------------------------------------------------------------------------------------------------------------------------------------------------------------------------------------------------------------------------------------------------------------------------------------------------------------------------------------------------------------------------------------------------------------------------------------------------------------------------------------------------------------------------------------------------------------------------------------------------------------------------------------------------------------------------------------------------------------------------------------------------------------------------------------------------------------------------------------------------------------------------------------------------------------------------------------------------------------------------------------------------------------------------------------------------------------------------------------------------------------------------------------------------------------------------------------------------------------------------------------------------------------------------------------------------------------------------------------------------------------------------------------------------------------------------------------------------------------------------------------------------------------------------------------------------------------------------------------------------------------------------------------------------------------------------------------------------------------------------------------------------------------------------------------------------------------------------------------------------------------------------------------------------------------------------------------------------------------------------------------------------------------------------------------------------------------------------------------------------------------------------------------------------------------------------------------------------------------------------------------------------------------------------------------------------------------------------------------------------------------------------------------------------------------------------------------------------------------------------------------------------------------------------------------------------------------------------------------------------------------------------------------------------------------------------------------------------------------------------------------------------------------------------------------------------------------------------------------------------------------------------------------------------------------------------------------------------------------------------------------------------------------------------------------------------------------------------------------------------------------------------------------------------------------------------------------------------------------------------------------------------------------------------------------------------------------------------------------------------------------------------------------------------------------------------------------------------------------------------------------------------------------------------------------------------------------------------------------------------------------------------------------------------------------------------------------------------------------------------------------------------------------------------------------------------------------------------------------------------------------------------------------------------------------------------------------------------------------------------------------------------------------------------------------------------------------------------------------------------------------------------------------------------------------------------------------------------------------------------------------------------------------------------------------------------------------------------------------------------------------------------------------------------------------------------------------------------------------------------------------------------------------------------------------------------------------------------------------------------------------------------------------------------------------------------------------------------------------------------------------------------------------------------------------------------------------------------------------------------------------------------------------------------------------------------------------------------------------------------------------------------------------------------------------------------------------------------------------------------------------------------------------------------------------------------------------------------------------------------------------------------------------------------------------------------------------------------------------------------------------------------------------------------------------------------------------------------------------------------------------------------------------------------------------------------------------------------------------------------------------------------------------------------------------------------------------------------------------------------------------------------------------------------------------------------------------------------------------------------------------------------------------------------------------------------------------------------------------------------------------------------------------------------------------------------------------------------------------------------------------------------------------------------------------------------------------------------------------------------------------------------------------------------------------------------------------------------------------------------------------------------------------------------------------------------------------------------------------------------------------------------------------------------------------------------------------------------------------------------------------------------------------------------------------------------------------------------------------------------------------------------------------------------------------------------------------------------------------------------------------------------------------------------------------------------------------------------------------------------------------------------------------------------------------------------------------------------------------------------------------------------------------------------------------------------------------------------------------------------------------------------------------------------------------------------------------------------------------------------------------------------------------------------------------------------------------------------------------------------------------------------------------------------------------------------------------------------------------------------------------------------------------------------------------------------------------------------------------------------------------------------------------------------------------------------------------------------------------------------------------------------------------------------------------------------------------------------------------------------------------------------------------------------------------------------------------------------------------------------------------------------------------------------------------------------------------------------------------------------------------------------------------------------------------------------------------------------------------------------------------------------------------------------------------------------------------------------------------------------------------------------------------------------------------------------------------------------------------------------------------------------------------------------------------------------------------------------------------------------------------------------------------------------------------------------------------------------------------------------------------------------------------------------------------------------------------------------------------------------------------------------------------------------------------------------------------------------------------------------------------------------------------------------------------------------------------------------------------------------------------------------------------------------------------------------------------------------------------------------------------------------------------------------------------------------------------------------------------------------------------------------------------------------------------------------------------------------------------------------------------------------------------------------------------------------------------------------------------------------------------------------------------------------------------------------------------------------------------------------------------------------------------------------------------------------------------------------------------------------------------------------------------------------------------------------------------------------------------------------------------------------------------------------------------------------------------------------------------------------------------------------------------------------------------------------------------------------------------------------------------------------------------------------------------------------------------------------------------------------------------------------------------------------------------------------------------------------------------------------------------------------------------------------------------------------------------------------------------------------------------------------------------------------------------------------------------------------------------------------------------------------------------------------------------------------------------------------------------------------------------------------------------------------------------------------------------------------------------------------------------------------------------------------------------------------------------------------------------------------------------------------------------------------------------------------------------------------------------------------------------------------------------------------------------------------------------------------------------------------------------------------------------------------------------------------------------------------------------------------------------------------------------------------------------------------------------------------------------------------------------------------------------------------------------------------------------------------------------------------------------------------------------------------------------------------------------------------------------------------------------------------------------------------------------------------------------------------------------------------------------------------------------------------------------------------------------------------------------------------------------------------------------------------------------------------------------------------------------------------------------------------------------------------------------------------------------------------------------------------------------------------------------------------------------------------------------------------------------------------------------------------------------------------------------------------------------------------------------------------------------------------------------------------------------------------------------------------------------------------------------------------------------------------------------------------------------------------------------------------------------------------------------------------------------------------------------------------------------------------------------------------------------------------------------------------------------------------------------------------------------------------------------------------------------------------------------------------------------------------------------------------------------------------------------------------------------------------------------------------------------------------------------------------------------------------------------------------------------------------------------------------------------------------------------------------------------------------------------------------------------------------------------------------------------------------------------------------------------------------------------------------------------------------------------------------------------------------------------------------------------------------------------------------------------------------------------------------------------------------------------------------------------------------------------------------------------------------------------------------------------------------------------------------------------------------------------------------------------------------------------------------------------------------------------------------------------------------------------------------------------------------------------------------------------------------------------------------------------------------------------------------------------------------------------------------------------------------------------------------------------------------------------------------------------------------------------------------------------------------------------------------------------------------------------------------------------------------------------------------------------------------------------------------------------------------------------------------------------------------------------------------------------------------------------------------------------------------------------------------------------------------------------------------------------------------------------------------------------------------------------------------------------------------------------------------------------------------------------------------------------------------------------------------------------------------------------------------------------------------------------------------------------------------------------------------------------------------------------------------------------------------------------------------------------------------------------------------------------------------------------------------------------------------------------------------------------------------------------------------------------------------------------------------------------------------------------------------------------------------------------------------------------------------------------------------------------------------------------------------------------------------------------------------------------------------------------------------------------------------------------------------------------------------------------------------------------------------------------------------------------------------------------------------------------------------------------------------------------------------------------------------------------------------------------------------------------------------------------------------------------------------------------------------------------------------------------------------------------------------------------------------------------------------------------------------------------------------------------------------------------------------------------------------------------------------------------------------------------------------------------------------------------------------------------------------------------------------------------------------------------------------------------------------------------------------------------------------------------------------------------------------------------------------------------------------------------------------------------------------------------------------------------------------------------------------------------------------------------------------------------------------------------------------------------------------------------------------------------------------------------------------------------------------------------------------------------------------------------------------------------------------------------------------------------------------------------------------------------------------------------------------------------------------------------------------------------------------------------------------------------------------------------------------------------------------------------------------------------------------------------------------------------------------------------------------------------------------------------------------------------------------------------------------------------------------------------------------------------------------------------------------------------------------------------------------------------------------------------------------------------------------------------------------------------------------------------------------------------------------------------------------------------------------------------------------------------------------------------------------------------------------------------------------------------------------------------------------------------------------------------------------------------------------------------------------------------------------------------------------------------------------------------------------------------------------------------------------------------------------------------------------------------------------------------------------------------------------------------------------------------------------------------------------------------------------------------------------------------------------------------------------------------------------------------------------------------------------------------------------------------------------------------------------------------------------------------------------------------------------------------------------------------------------------------------------------------------------------------------------------------------------------------------------------------------------------------------------------------------------------------------------------------------------------------------------------------------------------------------------------------------------------------------------------------------------------------------------------------------------------------------------------------------------------------------------------------------------------------------------------------------------------------------------------------------------------------------------------------------------------------------------------------------------------------------------------------------------------------------------------------------------------------------------------------------------------------------------------------------------------------------------------------------------------------------------------------------------------------------------------------------------------------------------------------------------------------------------------------------------------------------------------------------------------------------------------------------------------------------------------------------------------------------------------------------------------------------------------------------------------------------------------------------------------------------------------------------------------------------------------------------------------------------------------------------------------------------------------------------------------------------------------------------------------------------------------------------------------------------------------------------------------------------------------------------------------------------------------------------------------------------------------------------------------------------------------------------------------------------------------------------------------------------------------------------------------------------------------------------------------------------------------------------------------------------------------------------------------------------------------------------------------------------------------------------------------------------------------------------------------------------------------------------------------------------------------------------------------------------------------------------------------------------------------------------------------------------------------------------------------------------------------------------------------------------------------------------------------------------------------------------------------------------------------------------------------------------------------------------------------------------------------------------------------------------------------------------------------------------------------------------------------------------------------------------------------------------------------------------------------------------------------------------------------------------------------------------------------------------------------------------------------------------------------------------------------------------------------------------------------------------------------------------------------------------------------------------------------------------------------------------------------------------------------------------------------------------------------------------------------------------------------------------------------------------------------------------------------------------------------------------------------------------------------------------------------------------------------------------------------------------------------------------------------------------------------------------------------------------------------------------------------------------------------------------------------------------------------------------------------------------------------------------------------------------------------------------------------------------------------------------------------------------------------------------------------------------------------------------------------------------------------------------------------------------------------------------------------------------------------------------------------------------------------------------------------------------------------------------------------------------------------------------------------------------------------------------------------------------------------------------------------------------------------------------------------------------------------------------------------------------------------------------------------------------------------------------------------------------------------------------------------------------------------------------------------------------------------------------------------------------------------------------------------------------------------------------------------------------------------------------------------------------------------------------------------------------------------------------------------------------------------------------------------------------------------------------------------------------------------------------------------------------------------------------------------------------------------------------------------------------------------------------------------------------------------------------------------------------------------------------------------------------------------------------------------------------------------------------------------------------------------------------------------------------------------------------------------------------------------------------------------------------------------------------------------------------------------------------------------------------------------------------------------------------------------------------------------------------------------------------------------------------------------------------------------------------------------------------------------------------------------------------------------------------------------------------------------------------------------------------------------------------------------------------------------------------------------------------------------------------------------------------------------------------------------------------------------------------------------------------------------------------------------------------------------------------------------------------------------------------------------------------------------------------------------------------------------------------------------------------------------------------------------------------------------------------------------------------------------------------------------------------------------------------------------------------------------------------------------------------------------------------------------------------------------------------------------------------------------------------------------------------------------------------------------------------------------------------------------------------------------------------------------------------------------------------------------------------------------------------------------------------------------------------------------------------------------------------------------------------------------------------------------------------------------------------------------------------------------------------------------------------------------------------------------------------------------------------------------------------------------------------------------------------------------------------------------------------------------------------------------------------------------------------------------------------------------------------------------------------------------------------------------------------------------------------------------------------------------------------------------------------------------------------------------------------------------------------------------------------------------------------------------------------------------------------------------------------------------------------------------------------------------------------------------------------------------------------------------------------------------------------------------------------------------------------------------------------------------------------------------------------------------------------------------------------------------------------------------------------------------------------------------------------------------------------------------------------------------------------------------------------------------------------------------------------------------------------------------------------------------------------------------------------------------------------------------------------------------------------------------------------------------------------------------------------------------------------------------------------------------------------------------------------------------------------------------------------------------------------------------------------------------------------------------------------------------------------------------------------------------------------------------------------------------------------------------------------------------------------------------------------------------------------------------------------------------------------------------------------------------------------------------------------------------------------------------------------------------------------------------------------------------------------------------------------------------------------------------------------------------------------------------------------------------------------------------------------------------------------------------------------------------------------------------------------------------------------------------------------------------------------------------------------------------------------------------------------------------------------------------------------------------------------------------------------------------------------------------------------------------------------------------------------------------------------------------------------------------------------------------------------------------------------------------------------------------------------------------------------------------------------------------------------------------------------------------------------------------------------------------------------------------------------------------------------------------------------------------------------------------------------------------------------------------------------------------------------------------------------------------------------------------------------------------------------------------------------------------------------------------------------------------------------------------------------------------------------------------------------------------------------------------------------------------------------------------------------------------------------------------------------------------------------------------------------------------------------------------------------------------------------------------------------------------------------------------------------------------------------------------------------------------------------------------------------------------------------------------------------------------------------------------------------------------------------------------------------------------------------------------------------------------------------------------------------------------------------------------------------------------------------------------------------------------------------------------------------------------------------------------------------------------------------------------------------------------------------------------------------------------------------------------------------------------------------------------------------------------------------------------------------------------------------------------------------------------------------------------------------------------------------------------------------------------------------------------------------------------------------------------------------------------------------------------------------------------------------------------------------------------------------------------------------------------------------------------------------------------------------------------------------------------------------------------------------------------------------------------------------------------------------------------------------------------------------------------------------------------------------------------------------------------------------------------------------------------------------------------------------------------------------------------------------------------------------------------------------------------------------------------------------------------------------------------------------------------------------------------------------------------------------------------------------------------------------------------------------------------------------------------------------------------------------------------------------------------------------------------------------------------------------------------------------------------------------------------------------------------------------------------------------------------------------------------------------------------------------------------------------------------------------------------------------------------------------------------------------------------------------------------------------------------------------------------------------------------------------------------------------------------------------------------------------------------------------------------------------------------------------------------------------------------------------------------------------------------------------------------------------------------------------------------------------------------------------------------------------------------------------------------------------------------------------------------------------------------------------------------------------------------------------------------------------------------------------------------------------------------------------------------------------------------------------------------------------------------------------------------------------------------------------------------------------------------------------------------------------------------------------------------------------------------------+
| rb_to_string(rb_select(x'01060300000000000000ffffffff3a30000001000000ffff000010000000ffff000000003b30000001a0000f27010000000f27010000003b3000000100006300010000006300',4100))                                                                                                                                                                                                                                                                                                                                                                                                                                                                                                                                                                                                                                                                                                                                                                                                                                                                                    |
+-------------------------------------------------------------------------------------------------------------------------------------------------------------------------------------------------------------------------------------------------------------------------------------------------------------------------------------------------------------------------------------------------------------------------------------------------------------------------------------------------------------------------------------------------------------------------------------------------------------------------------------------------------------------------------------------------------------------------------------------------------------------------------------------------------------------------------------------------------------------------------------------------------------------------------------------------------------------------------------------------------------------------------------------------------------------------------------------------------------------------------------------------------------------------------------------------------------------------------------------------------------------------------------------------------------------------------------------------------------------------------------------------------------------------------------------------------------------------------------------------------------------------------------------------------------------------------------------------------------------------------------------------------------------------------------------------------------------------------------------------------------------------------------------------------------------------------------------------------------------------------------------------------------------------------------------------------------------------------------------------------------------------------------------------------------------------------------------------------------------------------------------------------------------------------------------------------------------------------------------------------------------------------------------------------------------------------------------------------------------------------------------------------------------------------------------------------------------------------------------------------------------------------------------------------------------------------------------------------------------------------------------------------------------------------------------------------------------------------------------------------------------------------------------------------------------------------------------------------------------------------------------------------------------------------------------------------------------------------------------------------------------------------------------------------------------------------------------------------------------------------------------------------------------------------------------------------------------------------------------------------------------------------------------------------------------------------------------------------------------------------------------------------------------------------------------------------------------------------------------------------------------------------------------------------------------------------------------------------------------------------------------------------------------------------------------------------------------------------------------------------------------------------------------------------------------------------------------------------------------------------------------------------------------------------------------------------------------------------------------------------------------------------------------------------------------------------------------------------------------------------------------------------------------------------------------------------------------------------------------------------------------------------------------------------------------------------------------------------------------------------------------------------------------------------------------------------------------------------------------------------------------------------------------------------------------------------------------------------------------------------------------------------------------------------------------------------------------------------------------------------------------------------------------------------------------------------------------------------------------------------------------------------------------------------------------------------------------------------------------------------------------------------------------------------------------------------------------------------------------------------------------------------------------------------------------------------------------------------------------------------------------------------------------------------------------------------------------------------------------------------------------------------------------------------------------------------------------------------------------------------------------------------------------------------------------------------------------------------------------------------------------------------------------------------------------------------------------------------------------------------------------------------------------------------------------------------------------------------------------------------------------------------------------------------------------------------------------------------------------------------------------------------------------------------------------------------------------------------------------------------------------------------------------------------------------------------------------------------------------------------------------------------------------------------------------------------------------------------------------------------------------------------------------------------------------------------------------------------------------------------------------------------------------------------------------------------------------------------------------------------------------------------------------------------------------------------------------------------------------------------------------------------------------------------------------------------------------------------------------------------------------------------------------------------------------------------------------------------------------------------------------------------------------------------------------------------------------------------------------------------------------------------------------------------------------------------------------------------------------------------------------------------------------------------------------------------------------------------------------------------------------------------------------------------------------------------------------------------------------------------------------------------------------------------------------------------------------------------------------------------------------------------------------------------------------------------------------------------------------------------------------------------------------------------------------------------------------------------------------------------------------------------------------------------------------------------------------------------------------------------------------------------------------------------------------------------------------------------------------------------------------------------------------------------------------------------------------------------------------------------------------------------------------------------------------------------------------------------------------------------------------------------------------------------------------------------------------------------------------------------------------------------------------------------------------------------------------------------------------------------------------------------------------------------------------------------------------------------------------------------------------------------------------------------------------------------------------------------------------------------------------------------------------------------------------------------------------------------------------------------------------------------------------------------------------------------------------------------------------------------------------------------------------------------------------------------------------------------------------------------------------------------------------------------------------------------------------------------------------------------------------------------------------------------------------------------------------------------------------------------------------------------------------------------------------------------------------------------------------------------------------------------------------------------------------------------------------------------------------------------------------------------------------------------------------------------------------------------------------------------------------------------------------------------------------------------------------------------------------------------------------------------------------------------------------------------------------------------------------------------------------------------------------------------------------------------------------------------------------------------------------------------------------------------------------------------------------------------------------------------------------------------------------------------------------------------------------------------------------------------------------------------------------------------------------------------------------------------------------------------------------------------------------------------------------------------------------------------------------------------------------------------------------------------------------------------------------------------------------------------------------------------------------------------------------------------------------------------------------------------------------------------------------------------------------------------------------------------------------------------------------------------------------------------------------------------------------------------------------------------------------------------------------------------------------------------------------------------------------------------------------------------------------------------------------------------------------------------------------------------------------------------------------------------------------------------------------------------------------------------------------------------------------------------------------------------------------------------------------------------------------------------------------------------------------------------------------------------------------------------------------------------------------------------------------------------------------------------------------------------------------------------------------------------------------------------------------------------------------------------------------------------------------------------------------------------------------------------------------------------------------------------------------------------------------------------------------------------------------------------------------------------------------------------------------------------------------------------------------------------------------------------------------------------------------------------------------------------------------------------------------------------------------------------------------------------------------------------------------------------------------------------------------------------------------------------------------------------------------------------------------------------------------------------------------------------------------------------------------------------------------------------------------------------------------------------------------------------------------------------------------------------------------------------------------------------------------------------------------------------------------------------------------------------------------------------------------------------------------------------------------------------------------------------------------------------------------------------------------------------------------------------------------------------------------------------------------------------------------------------------------------------------------------------------------------------------------------------------------------------------------------------------------------------------------------------------------------------------------------------------------------------------------------------------------------------------------------------------------------------------------------------------------------------------------------------------------------------------------------------------------------------------------------------------------------------------------------------------------------------------------------------------------------------------------------------------------------------------------------------------------------------------------------------------------------------------------------------------------------------------------------------------------------------------------------------------------------------------------------------------------------------------------------------------------------------------------------------------------------------------------------------------------------------------------------------------------------------------------------------------------------------------------------------------------------------------------------------------------------------------------------------------------------------------------------------------------------------------------------------------------------------------------------------------------------------------------------------------------------------------------------------------------------------------------------------------------------------------------------------------------------------------------------------------------------------------------------------------------------------------------------------------------------------------------------------------------------------------------------------------------------------------------------------------------------------------------------------------------------------------------------------------------------------------------------------------------------------------------------------------------------------------------------------------------------------------------------------------------------------------------------------------------------------------------------------------------------------------------------------------------------------------------------------------------------------------------------------------------------------------------------------------------------------------------------------------------------------------------------------------------------------------------------------------------------------------------------------------------------------------------------------------------------------------------------------------------------------------------------------------------------------------------------------------------------------------------------------------------------------------------------------------------------------------------------------------------------------------------------------------------------------------------------------------------------------------------------------------------------------------------------------------------------------------------------------------------------------------------------------------------------------------------------------------------------------------------------------------------------------------------------------------------------------------------------------------------------------------------------------------------------------------------------------------------------------------------------------------------------------------------------------------------------------------------------------------------------------------------------------------------------------------------------------------------------------------------------------------------------------------------------------------------------------------------------------------------------------------------------------------------------------------------------------------------------------------------------------------------------------------------------------------------------------------------------------------------------------------------------------------------------------------------------------------------------------------------------------------------------------------------------------------------------------------------------------------------------------------------------------------------------------------------------------------------------------------------------------------------------------------------------------------------------------------------------------------------------------------------------------------------------------------------------------------------------------------------------------------------------------------------------------------------------------------------------------------------------------------------------------------------------------------------------------------------------------------------------------------------------------------------------------------------------------------------------------------------------------------------------------------------------------------------------------------------------------------------------------------------------------------------------------------------------------------------------------------------------------------------------------------------------------------------------------------------------------------------------------------------------------------------------------------------------------------------------------------------------------------------------------------------------------------------------------------------------------------------------------------------------------------------------------------------------------------------------------------------------------------------------------------------------------------------------------------------------------------------------------------------------------------------------------------------------------------------------------------------------------------------------------------------------------------------------------------------------------------------------------------------------------------------------------------------------------------------------------------------------------------------------------------------------------------------------------------------------------------------------------------------------------------------------------------------------------------------------------------------------------------------------------------------------------------------------------------------------------------------------------------------------------------------------------------------------------------------------------------------------------------------------------------------------------------------------------------------------------------------------------------------------------------------------------------------------------------------------------------------------------------------------------------------------------------------------------------------------------------------------------------------------------------------------------------------------------------------------------------------------------------------------------------------------------------------------------------------------------------------------------------------------------------------------------------------------------------------------------------------------------------------------------------------------------------------------------------------------------------------------------------------------------------------------------------------------------------------------------------------------------------------------------------------------------------------------------------------------------------------------------------------------------------------------------------------------------------------------------------------------------------------------------------------------------------------------------------------------------------------------------------------------------------------------------------------------------------------------------------------------------------------------------------------------------------------------------------------------------------------------------------------------------------------------------------------------------------------------------------------------------------------------------------------------------------------------------------------------------------------------------------------------------------------------------------------------------------------------------------------------------------------------------------------------------------------------------------------------------------------------------------------------------------------------------------------------------------------------------------------------------------------------------------------------------------------------------------------------------------------------------------------------------------------------------------------------------------------------------------------------------------------------------------------------------------------------------------------------------------------------------------------------------------------------------------------------------------------------------------------------------------------------------------------------------------------------------------------------------------------------------------------------------------------------------------------------------------------------------------------------------------------------------------------------------------------------------------------------------------------------------------------------------------------------------------------------------------------------------------------------------------------------------------------------------------------------------------------------------------------------------------------------------------------------------------------------------------------------------------------------------------------------------------------------------------------------------------------------------------------------------------------------------------------------------------------------------------------------------------------------------------------------------------------------------------------------------------------------------------------------------------------------------------------------------------------------------------------------------------------------------------------------------------------------------------------------------------------------------------------------------------------------------------------------------------------------------------------------------------------------------------------------------------------------------------------------------------------------------------------------------------------------------------------------------------------------------------------------------------------------------------------------------------------------------------------------------------------------------------------------------------------------------------------------------------------------------------------------------------------------------------------------------------------------------------------------------------------------------------------------------------------------------------------------------------------------------------------------------------------------------------------------------------------------------------------------------------------------------------------------------------------------------------------------------------------------------------------------------------------------------------------------------------------------------------------------------------------------------------------------------------------------------------------------------------------------------------------------------------------------------------------------------------------------------------------------------------------------------------------------------------------------------------------------------------------------------------------------------------------------------------------------------------------------------------------------------------------------------------------------------------------------------------------------------------------------------------------------------------------------------------------------------------------------------------------------------------------------------------------------------------------------------------------------------------------------------------------------------------------------------------------------------------------------------------------------------------------------------------------------------------------------------------------------------------------------------------------------------------------------------------------------------------------------------------------------------------------------------------------------------------------------------------------------------------------------------------------------------------------------------------------------------------------------------------------------------------------------------------------------------------------------------------------------------------------------------------------------------------------------------------------------------------------------------------------------------------------------------------------------------------------------------------------------------------------------------------------------------------------------------------------------------------------------------------------------------------------------------------------------------------------------------------------------------------------------------------------------------------------------------------------------------------------------------------------------------------------------------------------------------------------------------------------------------------------------------------------------------------------------------------------------------------------------------------------------------------------------------------------------------------------------------------------------------------------------------------------------------------------------------------------------------------------------------------------------------------------------------------------------------------------------------------------------------------------------------------------------------------------------------------------------------------------------------------------------------------------------------------------------------------------------------------------------------------------------------------------------------------------------------------------------------------------------------------------------------------------------------------------------------------------------------------------------------------------------------------------------------------------------------------------------------------------------------------------------------------------------------------------------------------------------------------------------------------------------------------------------------------------------------------------------------------------------------------------------------------------------------------------------------------------------------------------------------------------------------------------------------------------------------------------------------------------------------------------------------------------------------------------------------------------------------------------------------------------------------------------------------------------------------------------------------------------------------------------------------------------------------------------------------------------------------------------------------------------------------------------------------------------------------------------------------------------------------------------------------------------------------------------------------------------------------------------------------------------------------------------------------------------------------------------------------------------------------------------------------------------------------------------------------------------------------------------------------------------------------------------------------------------------------------------------------------------------------------------------------------------------------------------------------------------------------------------------------------------------------------------------------------------------------------------------------------------------------------------------------------------------------------------------------------------------------------------------------------------------------------------------------------------------------------------------------------------------------------------------------------------------------------------------------------------------------------------------------------------------------------------------------------------------------------------------------------------------------------------------------------------------------------------------------------------------------------------------------------------------------------------------------------------------------------------------------------------------------------------------------------------------------------------------------------------------------------------------------------------------------------------------------------------------------------------------------------------------------------------------------------------------------------------------------------------------------------------------------------------------------------------------------------------------------------------------------------------------------------------------------------------------------------------------------------------------------------------------------------------------------------------------------------------------------------------------------------------------------------------------------------------------------------------------------------------------------------------------------------------------------------------------------------------------------------------------------------------------------------------------------------------------------------------------------------------------------------------------------------------------------------------------------------------------------------------------------------------------------------------------------------------------------------------------------------------------------------------------------------------------------------------------------------------------------------------------------------------------------------------------------------------------------------------------------------------------------------------------------------------------------------------------------------------------------------------------------------------------------------------------------------------------------------------------------------------------------------------------------------------------------------------------------------------------------------------------------------------------------------------------------------------------------------------------------------------------------------------------------------------------------------------------------------------------------------------------------------------------------------------------------------------------------------------------------------------------------------------------------------------------------------------------------------------------------------------------------------------------------------------------------------------------------------------------------------------------------------------------------------------------------------------------------------------------------------------------------------------------------------------------------------------------------------------------------------------------------------------------------------------------------------------------------------------------------------------------------------------------------------------------------------------------------------------------------------------------------------------------------------------------------------------------------------------------------------------------------------------------------------------------------------------------------------------------------------------------------------------------------------------------------------------------------------------------------------------------------------------------------------------------------------------------------------------------------------------------------------------------------------------------------------------------------------------------------------------------------------------------------------------------------------------------------------------------------------------------------------------------------------------------------------------------------------------------------------------------------------------------------------------------------------------------------------------------------------------------------------------------------------------------------------------------------------------------------------------------------------------------------------------------------------------------------------------------------------------------------------------------------------------------------------------------------------------------------------------------------------------------------------------------------------------------------------------------------------------------------------------------------------------------------------------------------------------------------------------------------------------------------------------------------------------------------------------------------------------------------------------------------------------------------------------------------------------------------------------------------------------------------------------------------------------------------------------------------------------------------------------------------------------------------------------------------------------------------------------------------------------------------------------------------------------------------------------------------------------------------------------------------------------------------------------------------------------------------------------------------------------------------------------------------------------------------------------------------------------------------------------------------------------------------------------------------------------------------------------------------------------------------------------------------------------------------------------------------------------------------------------------------------------------------------------------------------------------------------------------------------------------------------------------------------------------------------------------------------------------------------------------------------------------------------------------------------------------------------------------------------------------------------------------------------+
| 10485760,10485761,10485762,10485763,10485764,10485765,10485766,10485767,10485768,10485769,10485770,10485771,10485772,10485773,10485774,10485775,10485776,10485777,10485778,10485779,10485780,10485781,10485782,10485783,10485784,10485785,10485786,10485787,10485788,10485789,10485790,10485791,10485792,10485793,10485794,10485795,10485796,10485797,10485798,10485799,10485800,10485801,10485802,10485803,10485804,10485805,10485806,10485807,10485808,10485809,10485810,10485811,10485812,10485813,10485814,10485815,10485816,10485817,10485818,10485819,10485820,10485821,10485822,10485823,10485824,10485825,10485826,10485827,10485828,10485829,10485830,10485831,10485832,10485833,10485834,10485835,10485836,10485837,10485838,10485839,10485840,10485841,10485842,10485843,10485844,10485845,10485846,10485847,10485848,10485849,10485850,10485851,10485852,10485853,10485854,10485855,10485856,10485857,10485858,10485859,10485860,10485861,10485862,10485863,10485864,10485865,10485866,10485867,10485868,10485869,10485870,10485871,10485872,10485873,10485874,10485875,10485876,10485877,10485878,10485879,10485880,10485881,10485882,10485883,10485884,10485885,10485886,10485887,10485888,10485889,10485890,10485891,10485892,10485893,10485894,10485895,10485896,10485897,10485898,10485899,10485900,10485901,10485902,10485903,10485904,10485905,10485906,10485907,10485908,10485909,10485910,10485911,10485912,10485913,10485914,10485915,10485916,10485917,10485918,10485919,10485920,10485921,10485922,10485923,10485924,10485925,10485926,10485927,10485928,10485929,10485930,10485931,10485932,10485933,10485934,10485935,10485936,10485937,10485938,10485939,10485940,10485941,10485942,10485943,10485944,10485945,10485946,10485947,10485948,10485949,10485950,10485951,10485952,10485953,10485954,10485955,10485956,10485957,10485958,10485959,10485960,10485961,10485962,10485963,10485964,10485965,10485966,10485967,10485968,10485969,10485970,10485971,10485972,10485973,10485974,10485975,10485976,10485977,10485978,10485979,10485980,10485981,10485982,10485983,10485984,10485985,10485986,10485987,10485988,10485989,10485990,10485991,10485992,10485993,10485994,10485995,10485996,10485997,10485998,10485999,10486000,10486001,10486002,10486003,10486004,10486005,10486006,10486007,10486008,10486009,10486010,10486011,10486012,10486013,10486014,10486015,10486016,10486017,10486018,10486019,10486020,10486021,10486022,10486023,10486024,10486025,10486026,10486027,10486028,10486029,10486030,10486031,10486032,10486033,10486034,10486035,10486036,10486037,10486038,10486039,10486040,10486041,10486042,10486043,10486044,10486045,10486046,10486047,10486048,10486049,10486050,10486051,10486052,10486053,10486054,10486055,10486056,10486057,10486058,10486059,10486060,10486061,10486062,10486063,10486064,10486065,10486066,10486067,10486068,10486069,10486070,10486071,10486072,10486073,10486074,10486075,10486076,10486077,10486078,10486079,10486080,10486081,10486082,10486083,10486084,10486085,10486086,10486087,10486088,10486089,10486090,10486091,10486092,10486093,10486094,10486095,10486096,10486097,10486098,10486099,10486100,10486101,10486102,10486103,10486104,10486105,10486106,10486107,10486108,10486109,10486110,10486111,10486112,10486113,10486114,10486115,10486116,10486117,10486118,10486119,10486120,10486121,10486122,10486123,10486124,10486125,10486126,10486127,10486128,10486129,10486130,10486131,10486132,10486133,10486134,10486135,10486136,10486137,10486138,10486139,10486140,10486141,10486142,10486143,10486144,10486145,10486146,10486147,10486148,10486149,10486150,10486151,10486152,10486153,10486154,10486155,10486156,10486157,10486158,10486159,10486160,10486161,10486162,10486163,10486164,10486165,10486166,10486167,10486168,10486169,10486170,10486171,10486172,10486173,10486174,10486175,10486176,10486177,10486178,10486179,10486180,10486181,10486182,10486183,10486184,10486185,10486186,10486187,10486188,10486189,10486190,10486191,10486192,10486193,10486194,10486195,10486196,10486197,10486198,10486199,10486200,10486201,10486202,10486203,10486204,10486205,10486206,10486207,10486208,10486209,10486210,10486211,10486212,10486213,10486214,10486215,10486216,10486217,10486218,10486219,10486220,10486221,10486222,10486223,10486224,10486225,10486226,10486227,10486228,10486229,10486230,10486231,10486232,10486233,10486234,10486235,10486236,10486237,10486238,10486239,10486240,10486241,10486242,10486243,10486244,10486245,10486246,10486247,10486248,10486249,10486250,10486251,10486252,10486253,10486254,10486255,10486256,10486257,10486258,10486259,10486260,10486261,10486262,10486263,10486264,10486265,10486266,10486267,10486268,10486269,10486270,10486271,10486272,10486273,10486274,10486275,10486276,10486277,10486278,10486279,10486280,10486281,10486282,10486283,10486284,10486285,10486286,10486287,10486288,10486289,10486290,10486291,10486292,10486293,10486294,10486295,10486296,10486297,10486298,10486299,10486300,10486301,10486302,10486303,10486304,10486305,10486306,10486307,10486308,10486309,10486310,10486311,10486312,10486313,10486314,10486315,10486316,10486317,10486318,10486319,10486320,10486321,10486322,10486323,10486324,10486325,10486326,10486327,10486328,10486329,10486330,10486331,10486332,10486333,10486334,10486335,10486336,10486337,10486338,10486339,10486340,10486341,10486342,10486343,10486344,10486345,10486346,10486347,10486348,10486349,10486350,10486351,10486352,10486353,10486354,10486355,10486356,10486357,10486358,10486359,10486360,10486361,10486362,10486363,10486364,10486365,10486366,10486367,10486368,10486369,10486370,10486371,10486372,10486373,10486374,10486375,10486376,10486377,10486378,10486379,10486380,10486381,10486382,10486383,10486384,10486385,10486386,10486387,10486388,10486389,10486390,10486391,10486392,10486393,10486394,10486395,10486396,10486397,10486398,10486399,10486400,10486401,10486402,10486403,10486404,10486405,10486406,10486407,10486408,10486409,10486410,10486411,10486412,10486413,10486414,10486415,10486416,10486417,10486418,10486419,10486420,10486421,10486422,10486423,10486424,10486425,10486426,10486427,10486428,10486429,10486430,10486431,10486432,10486433,10486434,10486435,10486436,10486437,10486438,10486439,10486440,10486441,10486442,10486443,10486444,10486445,10486446,10486447,10486448,10486449,10486450,10486451,10486452,10486453,10486454,10486455,10486456,10486457,10486458,10486459,10486460,10486461,10486462,10486463,10486464,10486465,10486466,10486467,10486468,10486469,10486470,10486471,10486472,10486473,10486474,10486475,10486476,10486477,10486478,10486479,10486480,10486481,10486482,10486483,10486484,10486485,10486486,10486487,10486488,10486489,10486490,10486491,10486492,10486493,10486494,10486495,10486496,10486497,10486498,10486499,10486500,10486501,10486502,10486503,10486504,10486505,10486506,10486507,10486508,10486509,10486510,10486511,10486512,10486513,10486514,10486515,10486516,10486517,10486518,10486519,10486520,10486521,10486522,10486523,10486524,10486525,10486526,10486527,10486528,10486529,10486530,10486531,10486532,10486533,10486534,10486535,10486536,10486537,10486538,10486539,10486540,10486541,10486542,10486543,10486544,10486545,10486546,10486547,10486548,10486549,10486550,10486551,10486552,10486553,10486554,10486555,10486556,10486557,10486558,10486559,10486560,10486561,10486562,10486563,10486564,10486565,10486566,10486567,10486568,10486569,10486570,10486571,10486572,10486573,10486574,10486575,10486576,10486577,10486578,10486579,10486580,10486581,10486582,10486583,10486584,10486585,10486586,10486587,10486588,10486589,10486590,10486591,10486592,10486593,10486594,10486595,10486596,10486597,10486598,10486599,10486600,10486601,10486602,10486603,10486604,10486605,10486606,10486607,10486608,10486609,10486610,10486611,10486612,10486613,10486614,10486615,10486616,10486617,10486618,10486619,10486620,10486621,10486622,10486623,10486624,10486625,10486626,10486627,10486628,10486629,10486630,10486631,10486632,10486633,10486634,10486635,10486636,10486637,10486638,10486639,10486640,10486641,10486642,10486643,10486644,10486645,10486646,10486647,10486648,10486649,10486650,10486651,10486652,10486653,10486654,10486655,10486656,10486657,10486658,10486659,10486660,10486661,10486662,10486663,10486664,10486665,10486666,10486667,10486668,10486669,10486670,10486671,10486672,10486673,10486674,10486675,10486676,10486677,10486678,10486679,10486680,10486681,10486682,10486683,10486684,10486685,10486686,10486687,10486688,10486689,10486690,10486691,10486692,10486693,10486694,10486695,10486696,10486697,10486698,10486699,10486700,10486701,10486702,10486703,10486704,10486705,10486706,10486707,10486708,10486709,10486710,10486711,10486712,10486713,10486714,10486715,10486716,10486717,10486718,10486719,10486720,10486721,10486722,10486723,10486724,10486725,10486726,10486727,10486728,10486729,10486730,10486731,10486732,10486733,10486734,10486735,10486736,10486737,10486738,10486739,10486740,10486741,10486742,10486743,10486744,10486745,10486746,10486747,10486748,10486749,10486750,10486751,10486752,10486753,10486754,10486755,10486756,10486757,10486758,10486759,10486760,10486761,10486762,10486763,10486764,10486765,10486766,10486767,10486768,10486769,10486770,10486771,10486772,10486773,10486774,10486775,10486776,10486777,10486778,10486779,10486780,10486781,10486782,10486783,10486784,10486785,10486786,10486787,10486788,10486789,10486790,10486791,10486792,10486793,10486794,10486795,10486796,10486797,10486798,10486799,10486800,10486801,10486802,10486803,10486804,10486805,10486806,10486807,10486808,10486809,10486810,10486811,10486812,10486813,10486814,10486815,10486816,10486817,10486818,10486819,10486820,10486821,10486822,10486823,10486824,10486825,10486826,10486827,10486828,10486829,10486830,10486831,10486832,10486833,10486834,10486835,10486836,10486837,10486838,10486839,10486840,10486841,10486842,10486843,10486844,10486845,10486846,10486847,10486848,10486849,10486850,10486851,10486852,10486853,10486854,10486855,10486856,10486857,10486858,10486859,10486860,10486861,10486862,10486863,10486864,10486865,10486866,10486867,10486868,10486869,10486870,10486871,10486872,10486873,10486874,10486875,10486876,10486877,10486878,10486879,10486880,10486881,10486882,10486883,10486884,10486885,10486886,10486887,10486888,10486889,10486890,10486891,10486892,10486893,10486894,10486895,10486896,10486897,10486898,10486899,10486900,10486901,10486902,10486903,10486904,10486905,10486906,10486907,10486908,10486909,10486910,10486911,10486912,10486913,10486914,10486915,10486916,10486917,10486918,10486919,10486920,10486921,10486922,10486923,10486924,10486925,10486926,10486927,10486928,10486929,10486930,10486931,10486932,10486933,10486934,10486935,10486936,10486937,10486938,10486939,10486940,10486941,10486942,10486943,10486944,10486945,10486946,10486947,10486948,10486949,10486950,10486951,10486952,10486953,10486954,10486955,10486956,10486957,10486958,10486959,10486960,10486961,10486962,10486963,10486964,10486965,10486966,10486967,10486968,10486969,10486970,10486971,10486972,10486973,10486974,10486975,10486976,10486977,10486978,10486979,10486980,10486981,10486982,10486983,10486984,10486985,10486986,10486987,10486988,10486989,10486990,10486991,10486992,10486993,10486994,10486995,10486996,10486997,10486998,10486999,10487000,10487001,10487002,10487003,10487004,10487005,10487006,10487007,10487008,10487009,10487010,10487011,10487012,10487013,10487014,10487015,10487016,10487017,10487018,10487019,10487020,10487021,10487022,10487023,10487024,10487025,10487026,10487027,10487028,10487029,10487030,10487031,10487032,10487033,10487034,10487035,10487036,10487037,10487038,10487039,10487040,10487041,10487042,10487043,10487044,10487045,10487046,10487047,10487048,10487049,10487050,10487051,10487052,10487053,10487054,10487055,10487056,10487057,10487058,10487059,10487060,10487061,10487062,10487063,10487064,10487065,10487066,10487067,10487068,10487069,10487070,10487071,10487072,10487073,10487074,10487075,10487076,10487077,10487078,10487079,10487080,10487081,10487082,10487083,10487084,10487085,10487086,10487087,10487088,10487089,10487090,10487091,10487092,10487093,10487094,10487095,10487096,10487097,10487098,10487099,10487100,10487101,10487102,10487103,10487104,10487105,10487106,10487107,10487108,10487109,10487110,10487111,10487112,10487113,10487114,10487115,10487116,10487117,10487118,10487119,10487120,10487121,10487122,10487123,10487124,10487125,10487126,10487127,10487128,10487129,10487130,10487131,10487132,10487133,10487134,10487135,10487136,10487137,10487138,10487139,10487140,10487141,10487142,10487143,10487144,10487145,10487146,10487147,10487148,10487149,10487150,10487151,10487152,10487153,10487154,10487155,10487156,10487157,10487158,10487159,10487160,10487161,10487162,10487163,10487164,10487165,10487166,10487167,10487168,10487169,10487170,10487171,10487172,10487173,10487174,10487175,10487176,10487177,10487178,10487179,10487180,10487181,10487182,10487183,10487184,10487185,10487186,10487187,10487188,10487189,10487190,10487191,10487192,10487193,10487194,10487195,10487196,10487197,10487198,10487199,10487200,10487201,10487202,10487203,10487204,10487205,10487206,10487207,10487208,10487209,10487210,10487211,10487212,10487213,10487214,10487215,10487216,10487217,10487218,10487219,10487220,10487221,10487222,10487223,10487224,10487225,10487226,10487227,10487228,10487229,10487230,10487231,10487232,10487233,10487234,10487235,10487236,10487237,10487238,10487239,10487240,10487241,10487242,10487243,10487244,10487245,10487246,10487247,10487248,10487249,10487250,10487251,10487252,10487253,10487254,10487255,10487256,10487257,10487258,10487259,10487260,10487261,10487262,10487263,10487264,10487265,10487266,10487267,10487268,10487269,10487270,10487271,10487272,10487273,10487274,10487275,10487276,10487277,10487278,10487279,10487280,10487281,10487282,10487283,10487284,10487285,10487286,10487287,10487288,10487289,10487290,10487291,10487292,10487293,10487294,10487295,10487296,10487297,10487298,10487299,10487300,10487301,10487302,10487303,10487304,10487305,10487306,10487307,10487308,10487309,10487310,10487311,10487312,10487313,10487314,10487315,10487316,10487317,10487318,10487319,10487320,10487321,10487322,10487323,10487324,10487325,10487326,10487327,10487328,10487329,10487330,10487331,10487332,10487333,10487334,10487335,10487336,10487337,10487338,10487339,10487340,10487341,10487342,10487343,10487344,10487345,10487346,10487347,10487348,10487349,10487350,10487351,10487352,10487353,10487354,10487355,10487356,10487357,10487358,10487359,10487360,10487361,10487362,10487363,10487364,10487365,10487366,10487367,10487368,10487369,10487370,10487371,10487372,10487373,10487374,10487375,10487376,10487377,10487378,10487379,10487380,10487381,10487382,10487383,10487384,10487385,10487386,10487387,10487388,10487389,10487390,10487391,10487392,10487393,10487394,10487395,10487396,10487397,10487398,10487399,10487400,10487401,10487402,10487403,10487404,10487405,10487406,10487407,10487408,10487409,10487410,10487411,10487412,10487413,10487414,10487415,10487416,10487417,10487418,10487419,10487420,10487421,10487422,10487423,10487424,10487425,10487426,10487427,10487428,10487429,10487430,10487431,10487432,10487433,10487434,10487435,10487436,10487437,10487438,10487439,10487440,10487441,10487442,10487443,10487444,10487445,10487446,10487447,10487448,10487449,10487450,10487451,10487452,10487453,10487454,10487455,10487456,10487457,10487458,10487459,10487460,10487461,10487462,10487463,10487464,10487465,10487466,10487467,10487468,10487469,10487470,10487471,10487472,10487473,10487474,10487475,10487476,10487477,10487478,10487479,10487480,10487481,10487482,10487483,10487484,10487485,10487486,10487487,10487488,10487489,10487490,10487491,10487492,10487493,10487494,10487495,10487496,10487497,10487498,10487499,10487500,10487501,10487502,10487503,10487504,10487505,10487506,10487507,10487508,10487509,10487510,10487511,10487512,10487513,10487514,10487515,10487516,10487517,10487518,10487519,10487520,10487521,10487522,10487523,10487524,10487525,10487526,10487527,10487528,10487529,10487530,10487531,10487532,10487533,10487534,10487535,10487536,10487537,10487538,10487539,10487540,10487541,10487542,10487543,10487544,10487545,10487546,10487547,10487548,10487549,10487550,10487551,10487552,10487553,10487554,10487555,10487556,10487557,10487558,10487559,10487560,10487561,10487562,10487563,10487564,10487565,10487566,10487567,10487568,10487569,10487570,10487571,10487572,10487573,10487574,10487575,10487576,10487577,10487578,10487579,10487580,10487581,10487582,10487583,10487584,10487585,10487586,10487587,10487588,10487589,10487590,10487591,10487592,10487593,10487594,10487595,10487596,10487597,10487598,10487599,10487600,10487601,10487602,10487603,10487604,10487605,10487606,10487607,10487608,10487609,10487610,10487611,10487612,10487613,10487614,10487615,10487616,10487617,10487618,10487619,10487620,10487621,10487622,10487623,10487624,10487625,10487626,10487627,10487628,10487629,10487630,10487631,10487632,10487633,10487634,10487635,10487636,10487637,10487638,10487639,10487640,10487641,10487642,10487643,10487644,10487645,10487646,10487647,10487648,10487649,10487650,10487651,10487652,10487653,10487654,10487655,10487656,10487657,10487658,10487659,10487660,10487661,10487662,10487663,10487664,10487665,10487666,10487667,10487668,10487669,10487670,10487671,10487672,10487673,10487674,10487675,10487676,10487677,10487678,10487679,10487680,10487681,10487682,10487683,10487684,10487685,10487686,10487687,10487688,10487689,10487690,10487691,10487692,10487693,10487694,10487695,10487696,10487697,10487698,10487699,10487700,10487701,10487702,10487703,10487704,10487705,10487706,10487707,10487708,10487709,10487710,10487711,10487712,10487713,10487714,10487715,10487716,10487717,10487718,10487719,10487720,10487721,10487722,10487723,10487724,10487725,10487726,10487727,10487728,10487729,10487730,10487731,10487732,10487733,10487734,10487735,10487736,10487737,10487738,10487739,10487740,10487741,10487742,10487743,10487744,10487745,10487746,10487747,10487748,10487749,10487750,10487751,10487752,10487753,10487754,10487755,10487756,10487757,10487758,10487759,10487760,10487761,10487762,10487763,10487764,10487765,10487766,10487767,10487768,10487769,10487770,10487771,10487772,10487773,10487774,10487775,10487776,10487777,10487778,10487779,10487780,10487781,10487782,10487783,10487784,10487785,10487786,10487787,10487788,10487789,10487790,10487791,10487792,10487793,10487794,10487795,10487796,10487797,10487798,10487799,10487800,10487801,10487802,10487803,10487804,10487805,10487806,10487807,10487808,10487809,10487810,10487811,10487812,10487813,10487814,10487815,10487816,10487817,10487818,10487819,10487820,10487821,10487822,10487823,10487824,10487825,10487826,10487827,10487828,10487829,10487830,10487831,10487832,10487833,10487834,10487835,10487836,10487837,10487838,10487839,10487840,10487841,10487842,10487843,10487844,10487845,10487846,10487847,10487848,10487849,10487850,10487851,10487852,10487853,10487854,10487855,10487856,10487857,10487858,10487859,10487860,10487861,10487862,10487863,10487864,10487865,10487866,10487867,10487868,10487869,10487870,10487871,10487872,10487873,10487874,10487875,10487876,10487877,10487878,10487879,10487880,10487881,10487882,10487883,10487884,10487885,10487886,10487887,10487888,10487889,10487890,10487891,10487892,10487893,10487894,10487895,10487896,10487897,10487898,10487899,10487900,10487901,10487902,10487903,10487904,10487905,10487906,10487907,10487908,10487909,10487910,10487911,10487912,10487913,10487914,10487915,10487916,10487917,10487918,10487919,10487920,10487921,10487922,10487923,10487924,10487925,10487926,10487927,10487928,10487929,10487930,10487931,10487932,10487933,10487934,10487935,10487936,10487937,10487938,10487939,10487940,10487941,10487942,10487943,10487944,10487945,10487946,10487947,10487948,10487949,10487950,10487951,10487952,10487953,10487954,10487955,10487956,10487957,10487958,10487959,10487960,10487961,10487962,10487963,10487964,10487965,10487966,10487967,10487968,10487969,10487970,10487971,10487972,10487973,10487974,10487975,10487976,10487977,10487978,10487979,10487980,10487981,10487982,10487983,10487984,10487985,10487986,10487987,10487988,10487989,10487990,10487991,10487992,10487993,10487994,10487995,10487996,10487997,10487998,10487999,10488000,10488001,10488002,10488003,10488004,10488005,10488006,10488007,10488008,10488009,10488010,10488011,10488012,10488013,10488014,10488015,10488016,10488017,10488018,10488019,10488020,10488021,10488022,10488023,10488024,10488025,10488026,10488027,10488028,10488029,10488030,10488031,10488032,10488033,10488034,10488035,10488036,10488037,10488038,10488039,10488040,10488041,10488042,10488043,10488044,10488045,10488046,10488047,10488048,10488049,10488050,10488051,10488052,10488053,10488054,10488055,10488056,10488057,10488058,10488059,10488060,10488061,10488062,10488063,10488064,10488065,10488066,10488067,10488068,10488069,10488070,10488071,10488072,10488073,10488074,10488075,10488076,10488077,10488078,10488079,10488080,10488081,10488082,10488083,10488084,10488085,10488086,10488087,10488088,10488089,10488090,10488091,10488092,10488093,10488094,10488095,10488096,10488097,10488098,10488099,10488100,10488101,10488102,10488103,10488104,10488105,10488106,10488107,10488108,10488109,10488110,10488111,10488112,10488113,10488114,10488115,10488116,10488117,10488118,10488119,10488120,10488121,10488122,10488123,10488124,10488125,10488126,10488127,10488128,10488129,10488130,10488131,10488132,10488133,10488134,10488135,10488136,10488137,10488138,10488139,10488140,10488141,10488142,10488143,10488144,10488145,10488146,10488147,10488148,10488149,10488150,10488151,10488152,10488153,10488154,10488155,10488156,10488157,10488158,10488159,10488160,10488161,10488162,10488163,10488164,10488165,10488166,10488167,10488168,10488169,10488170,10488171,10488172,10488173,10488174,10488175,10488176,10488177,10488178,10488179,10488180,10488181,10488182,10488183,10488184,10488185,10488186,10488187,10488188,10488189,10488190,10488191,10488192,10488193,10488194,10488195,10488196,10488197,10488198,10488199,10488200,10488201,10488202,10488203,10488204,10488205,10488206,10488207,10488208,10488209,10488210,10488211,10488212,10488213,10488214,10488215,10488216,10488217,10488218,10488219,10488220,10488221,10488222,10488223,10488224,10488225,10488226,10488227,10488228,10488229,10488230,10488231,10488232,10488233,10488234,10488235,10488236,10488237,10488238,10488239,10488240,10488241,10488242,10488243,10488244,10488245,10488246,10488247,10488248,10488249,10488250,10488251,10488252,10488253,10488254,10488255,10488256,10488257,10488258,10488259,10488260,10488261,10488262,10488263,10488264,10488265,10488266,10488267,10488268,10488269,10488270,10488271,10488272,10488273,10488274,10488275,10488276,10488277,10488278,10488279,10488280,10488281,10488282,10488283,10488284,10488285,10488286,10488287,10488288,10488289,10488290,10488291,10488292,10488293,10488294,10488295,10488296,10488297,10488298,10488299,10488300,10488301,10488302,10488303,10488304,10488305,10488306,10488307,10488308,10488309,10488310,10488311,10488312,10488313,10488314,10488315,10488316,10488317,10488318,10488319,10488320,10488321,10488322,10488323,10488324,10488325,10488326,10488327,10488328,10488329,10488330,10488331,10488332,10488333,10488334,10488335,10488336,10488337,10488338,10488339,10488340,10488341,10488342,10488343,10488344,10488345,10488346,10488347,10488348,10488349,10488350,10488351,10488352,10488353,10488354,10488355,10488356,10488357,10488358,10488359,10488360,10488361,10488362,10488363,10488364,10488365,10488366,10488367,10488368,10488369,10488370,10488371,10488372,10488373,10488374,10488375,10488376,10488377,10488378,10488379,10488380,10488381,10488382,10488383,10488384,10488385,10488386,10488387,10488388,10488389,10488390,10488391,10488392,10488393,10488394,10488395,10488396,10488397,10488398,10488399,10488400,10488401,10488402,10488403,10488404,10488405,10488406,10488407,10488408,10488409,10488410,10488411,10488412,10488413,10488414,10488415,10488416,10488417,10488418,10488419,10488420,10488421,10488422,10488423,10488424,10488425,10488426,10488427,10488428,10488429,10488430,10488431,10488432,10488433,10488434,10488435,10488436,10488437,10488438,10488439,10488440,10488441,10488442,10488443,10488444,10488445,10488446,10488447,10488448,10488449,10488450,10488451,10488452,10488453,10488454,10488455,10488456,10488457,10488458,10488459,10488460,10488461,10488462,10488463,10488464,10488465,10488466,10488467,10488468,10488469,10488470,10488471,10488472,10488473,10488474,10488475,10488476,10488477,10488478,10488479,10488480,10488481,10488482,10488483,10488484,10488485,10488486,10488487,10488488,10488489,10488490,10488491,10488492,10488493,10488494,10488495,10488496,10488497,10488498,10488499,10488500,10488501,10488502,10488503,10488504,10488505,10488506,10488507,10488508,10488509,10488510,10488511,10488512,10488513,10488514,10488515,10488516,10488517,10488518,10488519,10488520,10488521,10488522,10488523,10488524,10488525,10488526,10488527,10488528,10488529,10488530,10488531,10488532,10488533,10488534,10488535,10488536,10488537,10488538,10488539,10488540,10488541,10488542,10488543,10488544,10488545,10488546,10488547,10488548,10488549,10488550,10488551,10488552,10488553,10488554,10488555,10488556,10488557,10488558,10488559,10488560,10488561,10488562,10488563,10488564,10488565,10488566,10488567,10488568,10488569,10488570,10488571,10488572,10488573,10488574,10488575,10488576,10488577,10488578,10488579,10488580,10488581,10488582,10488583,10488584,10488585,10488586,10488587,10488588,10488589,10488590,10488591,10488592,10488593,10488594,10488595,10488596,10488597,10488598,10488599,10488600,10488601,10488602,10488603,10488604,10488605,10488606,10488607,10488608,10488609,10488610,10488611,10488612,10488613,10488614,10488615,10488616,10488617,10488618,10488619,10488620,10488621,10488622,10488623,10488624,10488625,10488626,10488627,10488628,10488629,10488630,10488631,10488632,10488633,10488634,10488635,10488636,10488637,10488638,10488639,10488640,10488641,10488642,10488643,10488644,10488645,10488646,10488647,10488648,10488649,10488650,10488651,10488652,10488653,10488654,10488655,10488656,10488657,10488658,10488659,10488660,10488661,10488662,10488663,10488664,10488665,10488666,10488667,10488668,10488669,10488670,10488671,10488672,10488673,10488674,10488675,10488676,10488677,10488678,10488679,10488680,10488681,10488682,10488683,10488684,10488685,10488686,10488687,10488688,10488689,10488690,10488691,10488692,10488693,10488694,10488695,10488696,10488697,10488698,10488699,10488700,10488701,10488702,10488703,10488704,10488705,10488706,10488707,10488708,10488709,10488710,10488711,10488712,10488713,10488714,10488715,10488716,10488717,10488718,10488719,10488720,10488721,10488722,10488723,10488724,10488725,10488726,10488727,10488728,10488729,10488730,10488731,10488732,10488733,10488734,10488735,10488736,10488737,10488738,10488739,10488740,10488741,10488742,10488743,10488744,10488745,10488746,10488747,10488748,10488749,10488750,10488751,10488752,10488753,10488754,10488755,10488756,10488757,10488758,10488759,10488760,10488761,10488762,10488763,10488764,10488765,10488766,10488767,10488768,10488769,10488770,10488771,10488772,10488773,10488774,10488775,10488776,10488777,10488778,10488779,10488780,10488781,10488782,10488783,10488784,10488785,10488786,10488787,10488788,10488789,10488790,10488791,10488792,10488793,10488794,10488795,10488796,10488797,10488798,10488799,10488800,10488801,10488802,10488803,10488804,10488805,10488806,10488807,10488808,10488809,10488810,10488811,10488812,10488813,10488814,10488815,10488816,10488817,10488818,10488819,10488820,10488821,10488822,10488823,10488824,10488825,10488826,10488827,10488828,10488829,10488830,10488831,10488832,10488833,10488834,10488835,10488836,10488837,10488838,10488839,10488840,10488841,10488842,10488843,10488844,10488845,10488846,10488847,10488848,10488849,10488850,10488851,10488852,10488853,10488854,10488855,10488856,10488857,10488858,10488859,10488860,10488861,10488862,10488863,10488864,10488865,10488866,10488867,10488868,10488869,10488870,10488871,10488872,10488873,10488874,10488875,10488876,10488877,10488878,10488879,10488880,10488881,10488882,10488883,10488884,10488885,10488886,10488887,10488888,10488889,10488890,10488891,10488892,10488893,10488894,10488895,10488896,10488897,10488898,10488899,10488900,10488901,10488902,10488903,10488904,10488905,10488906,10488907,10488908,10488909,10488910,10488911,10488912,10488913,10488914,10488915,10488916,10488917,10488918,10488919,10488920,10488921,10488922,10488923,10488924,10488925,10488926,10488927,10488928,10488929,10488930,10488931,10488932,10488933,10488934,10488935,10488936,10488937,10488938,10488939,10488940,10488941,10488942,10488943,10488944,10488945,10488946,10488947,10488948,10488949,10488950,10488951,10488952,10488953,10488954,10488955,10488956,10488957,10488958,10488959,10488960,10488961,10488962,10488963,10488964,10488965,10488966,10488967,10488968,10488969,10488970,10488971,10488972,10488973,10488974,10488975,10488976,10488977,10488978,10488979,10488980,10488981,10488982,10488983,10488984,10488985,10488986,10488987,10488988,10488989,10488990,10488991,10488992,10488993,10488994,10488995,10488996,10488997,10488998,10488999,10489000,10489001,10489002,10489003,10489004,10489005,10489006,10489007,10489008,10489009,10489010,10489011,10489012,10489013,10489014,10489015,10489016,10489017,10489018,10489019,10489020,10489021,10489022,10489023,10489024,10489025,10489026,10489027,10489028,10489029,10489030,10489031,10489032,10489033,10489034,10489035,10489036,10489037,10489038,10489039,10489040,10489041,10489042,10489043,10489044,10489045,10489046,10489047,10489048,10489049,10489050,10489051,10489052,10489053,10489054,10489055,10489056,10489057,10489058,10489059,10489060,10489061,10489062,10489063,10489064,10489065,10489066,10489067,10489068,10489069,10489070,10489071,10489072,10489073,10489074,10489075,10489076,10489077,10489078,10489079,10489080,10489081,10489082,10489083,10489084,10489085,10489086,10489087,10489088,10489089,10489090,10489091,10489092,10489093,10489094,10489095,10489096,10489097,10489098,10489099,10489100,10489101,10489102,10489103,10489104,10489105,10489106,10489107,10489108,10489109,10489110,10489111,10489112,10489113,10489114,10489115,10489116,10489117,10489118,10489119,10489120,10489121,10489122,10489123,10489124,10489125,10489126,10489127,10489128,10489129,10489130,10489131,10489132,10489133,10489134,10489135,10489136,10489137,10489138,10489139,10489140,10489141,10489142,10489143,10489144,10489145,10489146,10489147,10489148,10489149,10489150,10489151,10489152,10489153,10489154,10489155,10489156,10489157,10489158,10489159,10489160,10489161,10489162,10489163,10489164,10489165,10489166,10489167,10489168,10489169,10489170,10489171,10489172,10489173,10489174,10489175,10489176,10489177,10489178,10489179,10489180,10489181,10489182,10489183,10489184,10489185,10489186,10489187,10489188,10489189,10489190,10489191,10489192,10489193,10489194,10489195,10489196,10489197,10489198,10489199,10489200,10489201,10489202,10489203,10489204,10489205,10489206,10489207,10489208,10489209,10489210,10489211,10489212,10489213,10489214,10489215,10489216,10489217,10489218,10489219,10489220,10489221,10489222,10489223,10489224,10489225,10489226,10489227,10489228,10489229,10489230,10489231,10489232,10489233,10489234,10489235,10489236,10489237,10489238,10489239,10489240,10489241,10489242,10489243,10489244,10489245,10489246,10489247,10489248,10489249,10489250,10489251,10489252,10489253,10489254,10489255,10489256,10489257,10489258,10489259,10489260,10489261,10489262,10489263,10489264,10489265,10489266,10489267,10489268,10489269,10489270,10489271,10489272,10489273,10489274,10489275,10489276,10489277,10489278,10489279,10489280,10489281,10489282,10489283,10489284,10489285,10489286,10489287,10489288,10489289,10489290,10489291,10489292,10489293,10489294,10489295,10489296,10489297,10489298,10489299,10489300,10489301,10489302,10489303,10489304,10489305,10489306,10489307,10489308,10489309,10489310,10489311,10489312,10489313,10489314,10489315,10489316,10489317,10489318,10489319,10489320,10489321,10489322,10489323,10489324,10489325,10489326,10489327,10489328,10489329,10489330,10489331,10489332,10489333,10489334,10489335,10489336,10489337,10489338,10489339,10489340,10489341,10489342,10489343,10489344,10489345,10489346,10489347,10489348,10489349,10489350,10489351,10489352,10489353,10489354,10489355,10489356,10489357,10489358,10489359,10489360,10489361,10489362,10489363,10489364,10489365,10489366,10489367,10489368,10489369,10489370,10489371,10489372,10489373,10489374,10489375,10489376,10489377,10489378,10489379,10489380,10489381,10489382,10489383,10489384,10489385,10489386,10489387,10489388,10489389,10489390,10489391,10489392,10489393,10489394,10489395,10489396,10489397,10489398,10489399,10489400,10489401,10489402,10489403,10489404,10489405,10489406,10489407,10489408,10489409,10489410,10489411,10489412,10489413,10489414,10489415,10489416,10489417,10489418,10489419,10489420,10489421,10489422,10489423,10489424,10489425,10489426,10489427,10489428,10489429,10489430,10489431,10489432,10489433,10489434,10489435,10489436,10489437,10489438,10489439,10489440,10489441,10489442,10489443,10489444,10489445,10489446,10489447,10489448,10489449,10489450,10489451,10489452,10489453,10489454,10489455,10489456,10489457,10489458,10489459,10489460,10489461,10489462,10489463,10489464,10489465,10489466,10489467,10489468,10489469,10489470,10489471,10489472,10489473,10489474,10489475,10489476,10489477,10489478,10489479,10489480,10489481,10489482,10489483,10489484,10489485,10489486,10489487,10489488,10489489,10489490,10489491,10489492,10489493,10489494,10489495,10489496,10489497,10489498,10489499,10489500,10489501,10489502,10489503,10489504,10489505,10489506,10489507,10489508,10489509,10489510,10489511,10489512,10489513,10489514,10489515,10489516,10489517,10489518,10489519,10489520,10489521,10489522,10489523,10489524,10489525,10489526,10489527,10489528,10489529,10489530,10489531,10489532,10489533,10489534,10489535,10489536,10489537,10489538,10489539,10489540,10489541,10489542,10489543,10489544,10489545,10489546,10489547,10489548,10489549,10489550,10489551,10489552,10489553,10489554,10489555,10489556,10489557,10489558,10489559,10489560,10489561,10489562,10489563,10489564,10489565,10489566,10489567,10489568,10489569,10489570,10489571,10489572,10489573,10489574,10489575,10489576,10489577,10489578,10489579,10489580,10489581,10489582,10489583,10489584,10489585,10489586,10489587,10489588,10489589,10489590,10489591,10489592,10489593,10489594,10489595,10489596,10489597,10489598,10489599,10489600,10489601,10489602,10489603,10489604,10489605,10489606,10489607,10489608,10489609,10489610,10489611,10489612,10489613,10489614,10489615,10489616,10489617,10489618,10489619,10489620,10489621,10489622,10489623,10489624,10489625,10489626,10489627,10489628,10489629,10489630,10489631,10489632,10489633,10489634,10489635,10489636,10489637,10489638,10489639,10489640,10489641,10489642,10489643,10489644,10489645,10489646,10489647,10489648,10489649,10489650,10489651,10489652,10489653,10489654,10489655,10489656,10489657,10489658,10489659,10489660,10489661,10489662,10489663,10489664,10489665,10489666,10489667,10489668,10489669,10489670,10489671,10489672,10489673,10489674,10489675,10489676,10489677,10489678,10489679,10489680,10489681,10489682,10489683,10489684,10489685,10489686,10489687,10489688,10489689,10489690,10489691,10489692,10489693,10489694,10489695,10489696,10489697,10489698,10489699,10489700,10489701,10489702,10489703,10489704,10489705,10489706,10489707,10489708,10489709,10489710,10489711,10489712,10489713,10489714,10489715,10489716,10489717,10489718,10489719,10489720,10489721,10489722,10489723,10489724,10489725,10489726,10489727,10489728,10489729,10489730,10489731,10489732,10489733,10489734,10489735,10489736,10489737,10489738,10489739,10489740,10489741,10489742,10489743,10489744,10489745,10489746,10489747,10489748,10489749,10489750,10489751,10489752,10489753,10489754,10489755,10489756,10489757,10489758,10489759,10489760,10489761,10489762,10489763,10489764,10489765,10489766,10489767,10489768,10489769,10489770,10489771,10489772,10489773,10489774,10489775,10489776,10489777,10489778,10489779,10489780,10489781,10489782,10489783,10489784,10489785,10489786,10489787,10489788,10489789,10489790,10489791,10489792,10489793,10489794,10489795,10489796,10489797,10489798,10489799,10489800,10489801,10489802,10489803,10489804,10489805,10489806,10489807,10489808,10489809,10489810,10489811,10489812,10489813,10489814,10489815,10489816,10489817,10489818,10489819,10489820,10489821,10489822,10489823,10489824,10489825,10489826,10489827,10489828,10489829,10489830,10489831,10489832,10489833,10489834,10489835,10489836,10489837,10489838,10489839,10489840,10489841,10489842,10489843,10489844,10489845,10489846,10489847,10489848,10489849,10489850,10489851,10489852,10489853,10489854,10489855,10489856,10489857,10489858,10489859 |
+-------------------------------------------------------------------------------------------------------------------------------------------------------------------------------------------------------------------------------------------------------------------------------------------------------------------------------------------------------------------------------------------------------------------------------------------------------------------------------------------------------------------------------------------------------------------------------------------------------------------------------------------------------------------------------------------------------------------------------------------------------------------------------------------------------------------------------------------------------------------------------------------------------------------------------------------------------------------------------------------------------------------------------------------------------------------------------------------------------------------------------------------------------------------------------------------------------------------------------------------------------------------------------------------------------------------------------------------------------------------------------------------------------------------------------------------------------------------------------------------------------------------------------------------------------------------------------------------------------------------------------------------------------------------------------------------------------------------------------------------------------------------------------------------------------------------------------------------------------------------------------------------------------------------------------------------------------------------------------------------------------------------------------------------------------------------------------------------------------------------------------------------------------------------------------------------------------------------------------------------------------------------------------------------------------------------------------------------------------------------------------------------------------------------------------------------------------------------------------------------------------------------------------------------------------------------------------------------------------------------------------------------------------------------------------------------------------------------------------------------------------------------------------------------------------------------------------------------------------------------------------------------------------------------------------------------------------------------------------------------------------------------------------------------------------------------------------------------------------------------------------------------------------------------------------------------------------------------------------------------------------------------------------------------------------------------------------------------------------------------------------------------------------------------------------------------------------------------------------------------------------------------------------------------------------------------------------------------------------------------------------------------------------------------------------------------------------------------------------------------------------------------------------------------------------------------------------------------------------------------------------------------------------------------------------------------------------------------------------------------------------------------------------------------------------------------------------------------------------------------------------------------------------------------------------------------------------------------------------------------------------------------------------------------------------------------------------------------------------------------------------------------------------------------------------------------------------------------------------------------------------------------------------------------------------------------------------------------------------------------------------------------------------------------------------------------------------------------------------------------------------------------------------------------------------------------------------------------------------------------------------------------------------------------------------------------------------------------------------------------------------------------------------------------------------------------------------------------------------------------------------------------------------------------------------------------------------------------------------------------------------------------------------------------------------------------------------------------------------------------------------------------------------------------------------------------------------------------------------------------------------------------------------------------------------------------------------------------------------------------------------------------------------------------------------------------------------------------------------------------------------------------------------------------------------------------------------------------------------------------------------------------------------------------------------------------------------------------------------------------------------------------------------------------------------------------------------------------------------------------------------------------------------------------------------------------------------------------------------------------------------------------------------------------------------------------------------------------------------------------------------------------------------------------------------------------------------------------------------------------------------------------------------------------------------------------------------------------------------------------------------------------------------------------------------------------------------------------------------------------------------------------------------------------------------------------------------------------------------------------------------------------------------------------------------------------------------------------------------------------------------------------------------------------------------------------------------------------------------------------------------------------------------------------------------------------------------------------------------------------------------------------------------------------------------------------------------------------------------------------------------------------------------------------------------------------------------------------------------------------------------------------------------------------------------------------------------------------------------------------------------------------------------------------------------------------------------------------------------------------------------------------------------------------------------------------------------------------------------------------------------------------------------------------------------------------------------------------------------------------------------------------------------------------------------------------------------------------------------------------------------------------------------------------------------------------------------------------------------------------------------------------------------------------------------------------------------------------------------------------------------------------------------------------------------------------------------------------------------------------------------------------------------------------------------------------------------------------------------------------------------------------------------------------------------------------------------------------------------------------------------------------------------------------------------------------------------------------------------------------------------------------------------------------------------------------------------------------------------------------------------------------------------------------------------------------------------------------------------------------------------------------------------------------------------------------------------------------------------------------------------------------------------------------------------------------------------------------------------------------------------------------------------------------------------------------------------------------------------------------------------------------------------------------------------------------------------------------------------------------------------------------------------------------------------------------------------------------------------------------------------------------------------------------------------------------------------------------------------------------------------------------------------------------------------------------------------------------------------------------------------------------------------------------------------------------------------------------------------------------------------------------------------------------------------------------------------------------------------------------------------------------------------------------------------------------------------------------------------------------------------------------------------------------------------------------------------------------------------------------------------------------------------------------------------------------------------------------------------------------------------------------------------------------------------------------------------------------------------------------------------------------------------------------------------------------------------------------------------------------------------------------------------------------------------------------------------------------------------------------------------------------------------------------------------------------------------------------------------------------------------------------------------------------------------------------------------------------------------------------------------------------------------------------------------------------------------------------------------------------------------------------------------------------------------------------------------------------------------------------------------------------------------------------------------------------------------------------------------------------------------------------------------------------------------------------------------------------------------------------------------------------------------------------------------------------------------------------------------------------------------------------------------------------------------------------------------------------------------------------------------------------------------------------------------------------------------------------------------------------------------------------------------------------------------------------------------------------------------------------------------------------------------------------------------------------------------------------------------------------------------------------------------------------------------------------------------------------------------------------------------------------------------------------------------------------------------------------------------------------------------------------------------------------------------------------------------------------------------------------------------------------------------------------------------------------------------------------------------------------------------------------------------------------------------------------------------------------------------------------------------------------------------------------------------------------------------------------------------------------------------------------------------------------------------------------------------------------------------------------------------------------------------------------------------------------------------------------------------------------------------------------------------------------------------------------------------------------------------------------------------------------------------------------------------------------------------------------------------------------------------------------------------------------------------------------------------------------------------------------------------------------------------------------------------------------------------------------------------------------------------------------------------------------------------------------------------------------------------------------------------------------------------------------------------------------------------------------------------------------------------------------------------------------------------------------------------------------------------------------------------------------------------------------------------------------------------------------------------------------------------------------------------------------------------------------------------------------------------------------------------------------------------------------------------------------------------------------------------------------------------------------------------------------------------------------------------------------------------------------------------------------------------------------------------------------------------------------------------------------------------------------------------------------------------------------------------------------------------------------------------------------------------------------------------------------------------------------------------------------------------------------------------------------------------------------------------------------------------------------------------------------------------------------------------------------------------------------------------------------------------------------------------------------------------------------------------------------------------------------------------------------------------------------------------------------------------------------------------------------------------------------------------------------------------------------------------------------------------------------------------------------------------------------------------------------------------------------------------------------------------------------------------------------------------------------------------------------------------------------------------------------------------------------------------------------------------------------------------------------------------------------------------------------------------------------------------------------------------------------------------------------------------------------------------------------------------------------------------------------------------------------------------------------------------------------------------------------------------------------------------------------------------------------------------------------------------------------------------------------------------------------------------------------------------------------------------------------------------------------------------------------------------------------------------------------------------------------------------------------------------------------------------------------------------------------------------------------------------------------------------------------------------------------------------------------------------------------------------------------------------------------------------------------------------------------------------------------------------------------------------------------------------------------------------------------------------------------------------------------------------------------------------------------------------------------------------------------------------------------------------------------------------------------------------------------------------------------------------------------------------------------------------------------------------------------------------------------------------------------------------------------------------------------------------------------------------------------------------------------------------------------------------------------------------------------------------------------------------------------------------------------------------------------------------------------------------------------------------------------------------------------------------------------------------------------------------------------------------------------------------------------------------------------------------------------------------------------------------------------------------------------------------------------------------------------------------------------------------------------------------------------------------------------------------------------------------------------------------------------------------------------------------------------------------------------------------------------------------------------------------------------------------------------------------------------------------------------------------------------------------------------------------------------------------------------------------------------------------------------------------------------------------------------------------------------------------------------------------------------------------------------------------------------------------------------------------------------------------------------------------------------------------------------------------------------------------------------------------------------------------------------------------------------------------------------------------------------------------------------------------------------------------------------------------------------------------------------------------------------------------------------------------------------------------------------------------------------------------------------------------------------------------------------------------------------------------------------------------------------------------------------------------------------------------------------------------------------------------------------------------------------------------------------------------------------------------------------------------------------------------------------------------------------------------------------------------------------------------------------------------------------------------------------------------------------------------------------------------------------------------------------------------------------------------------------------------------------------------------------------------------------------------------------------------------------------------------------------------------------------------------------------------------------------------------------------------------------------------------------------------------------------------------------------------------------------------------------------------------------------------------------------------------------------------------------------------------------------------------------------------------------------------------------------------------------------------------------------------------------------------------------------------------------------------------------------------------------------------------------------------------------------------------------------------------------------------------------------------------------------------------------------------------------------------------------------------------------------------------------------------------------------------------------------------------------------------------------------------------------------------------------------------------------------------------------------------------------------------------------------------------------------------------------------------------------------------------------------------------------------------------------------------------------------------------------------------------------------------------------------------------------------------------------------------------------------------------------------------------------------------------------------------------------------------------------------------------------------------------------------------------------------------------------------------------------------------------------------------------------------------------------------------------------------------------------------------------------------------------------------------------------------------------------------------------------------------------------------------------------------------------------------------------------------------------------------------------------------------------------------------------------------------------------------------------------------------------------------------------------------------------------------------------------------------------------------------------------------------------------------------------------------------------------------------------------------------------------------------------------------------------------------------------------------------------------------------------------------------------------------------------------------------------------------------------------------------------------------------------------------------------------------------------------------------------------------------------------------------------------------------------------------------------------------------------------------------------------------------------------------------------------------------------------------------------------------------------------------------------------------------------------------------------------------------------------------------------------------------------------------------------------------------------------------------------------------------------------------------------------------------------------------------------------------------------------------------------------------------------------------------------------------------------------------------------------------------------------------------------------------------------------------------------------------------------------------------------------------------------------------------------------------------------------------------------------------------------------------------------------------------------------------------------------------------------------------------------------------------------------------------------------------------------------------------------------------------------------------------------------------------------------------------------------------------------------------------------------------------------------------------------------------------------------------------------------------------------------------------------------------------------------------------------------------------------------------------------------------------------------------------------------------------------------------------------------------------------------------------------------------------------------------------------------------------------------------------------------------------------------------------------------------------------------------------------------------------------------------------------------------------------------------------------------------------------------------------------------------------------------------------------------------------------------------------------------------------------------------------------------------------------------------------------------------------------------------------------------------------------------------------------------------------------------------------------------------------------------------------------------------------------------------------------------------------------------------------------------------------------------------------------------------------------------------------------------------------------------------------------------------------------------------------------------------------------------------------------------------------------------------------------------------------------------------------------------------------------------------------------------------------------------------------------------------------------------------------------------------------------------------------------------------------------------------------------------------------------------------------------------------------------------------------------------------------------------------------------------------------------------------------------------------------------------------------------------------------------------------------------------------------------------------------------------------------------------------------------------------------------------------------------------------------------------------------------------------------------------------------------------------------------------------------------------------------------------------------------------------------------------------------------------------------------------------------------------------------------------------------------------------------------------------------------------------------------------------------------------------------------------------------------------------------------------------------------------------------------------------------------------------------------------------------------------------------------------------------------------------------------------------------------------------------------------------------------------------------------------------------------------------------------------------------------------------------------------------------------------------------------------------------------------------------------------------------------------------------------------------------------------------------------------------------------------------------------------------------------------------------------------------------------------------------------------------------------------------------------------------------------------------------------------------------------------------------------------------------------------------------------------------------------------------------------------------------------------------------------------------------------------------------------------------------------------------------------------------------------------------------------------------------------------------------------------------------------------------------------------------------------------------------------------------------------------------------------------------------------------------------------------------------------------------------------------------------------------------------------------------------------------------------------------------------------------------------------------------------------------------------------------------------------------------------------------------------------------------------------------------------------------------------------------------------------------------------------------------------------------------------------------------------------------------------------------------------------------------------------------------------------------------------------------------------------------------------------------------------------------------------------------------------------------------------------------------------------------------------------------------------------------------------------------------------------------------------------------------------------------------------------------------------------------------------------------------------------------------------------------------------------------------------------------------------------------------------------------------------------------------------------------------------------------------------------------------------------------------------------------------------------------------------------------------------------------------------------------------------------------------------------------------------------------------------------------------------------------------------------------------------------------------------------------------------------------------------------------------------------------------------------------------------------------------------------------------------------------------------------------------------------------------------------------------------------------------------------------------------------------------------------------------------------------------------------------------------------------------------------------------------------------------------------------------------------------------------------------------------------------------------------------------------------------------------------------------------------------------------------------------------------------------------------------------------------------------------------------------------------------------------------------------------------------------------------------------------------------------------------------------------------------------------------------------------------------------------------------------------------------------------------------------------------------------------------------------------------------------------------------------------------------------------------------------------------------------------------------------------------------------------------------------------------------------------------------------------------------------------------------------------------------------------------------------------------------------------------------------------------------------------------------------------------------------------------------------------------------------------------------------------------------------------------------------------------------------------------------------------------------------------------------------------------------------------------------------------------------------------------------------------------------------------------------------------------------------------------------------------------------------------------------------------------------------------------------------------------------------------------------------------------------------------------------------------------------------------------------------------------------------------------------------------------------------------------------------------------------------------------------------------------------------------------------------------------------------------------------------------------------------------------------------------------------------------------------------------------------------------------------------------------------------------------------------------------------------------------------------------------------------------------------------------------------------------------------------------------------------------------------------------------------------------------------------------------------------------------------------------------------------------------------------------------------------------------------------------------------------------------------------------------------------------------------------------------------------------------------------------------------------------------------------------------------------------------------------------------------------------------------------------------------------------------------------------------------------------------------------------------------------------------------------------------------------------------------------------------------------------------------------------------------------------------------------------------------------------------------------------------------------------------------------------------------------------------------------------------------------------------------------------------------------------------------------------------------------------------------------------------------------------------------------------------------------------------------------------------------------------------------------------------------------------------------------------------------------------------------------------------------------------------------------------------------------------------------------------------------------------------------------------------------------------------------------------------------------------------------------------------------------------------------------------------------------------------------------------------------------------------------------------------------------------------------------------------------------------------------------------------------------------------------------------------------------------------------------------------------------------------------------------------------------------------------------------------------------------------------------------------------------------------------------------------------------------------------------------------------------------------------------------------------------------------------------------------------------------------------------------------------------------------------------------------------------------------------------------------------------------------------------------------------------------------------------------------------------------------------------------------------------------------------------------------------------------------------------------------------------------------------------------------------------------------------------------------------------------------------------------------------------------------------------------------------------------------------------------------------------------------------------------------------------------------------------------------------------------------------------------------------------------------------------------------------------------------------------------------------------------------------------------------------------------------------------------------------------------------------------------------------------------------------------------------------------------------------------------------------------------------------------------------------------------------------------------------------------------------------------------------------------------------------------------------------------------------------------------------------------------------------------------------------------------------------------------------------------------------------------------------------------------------------------------------------------------------------------------------------------------------------------------------------------------------------------------------------------------------------------------------------------------------------------------------------------------------------------------------------------------------------------------------------------------------------------------------------------------------------------------------------------------------------------------------------------------------------------------------------------------------------------------------------------------------------------------------------------------------------------------------------------------------------------------------------------------------------------------------+
select rb_select(x'00060100000000000000000000003b3000000100000f27010000000100',1);
ERROR HY000: Invalid data
select rb_select(x'02060100000000000000000000003b3000000100000f27010000000100',1);
ERROR HY000: Invalid data
select rb_select(x'01000100000000000000000000003b3000000100000f27010000000100',1);
ERROR HY000: Invalid data
select rb_select(x'01010100000000000000000000003b3000000100000f27010000000100',1);
ERROR HY000: Invalid data
select rb_select(x'01020100000000000000000000003b3000000100000f27010000000100',1);
ERROR HY000: Invalid data
select rb_select(x'01030100000000000000000000003b3000000100000f27010000000100',1);
ERROR HY000: Invalid data
select rb_select(x'01040100000000000000000000003b3000000100000f27010000000100',1);
ERROR HY000: Invalid data
select rb_select(x'01050100000000000000000000003b3000000100000f27010000000100',1);
ERROR HY000: Invalid data
select rb_select(x'01070100000000000000000000003b3000000100000f27010000000100',1);
ERROR HY000: Invalid data
select rb_select(x'010100000000000000000000003b3000000100000f27010000000100',1);
ERROR HY000: Invalid data
select rb_select(x'0100000000000000000000003b3000000100000f27010000000100',1);
ERROR HY000: Invalid data
select rb_select(x'01060200000000000000000000003b3000000100000f27010000000100',1);
ERROR HY000: Invalid data
select rb_select(x'01060000000000000000000000003b3000000100000f27010000000100',1);
ERROR HY000: Invalid data
select rb_select(x'01060100000000000000000000003b3000000100000f27010000000100',2);
+----------------------------------------------------------------------------+
| rb_select(x'01060100000000000000000000003b3000000100000f27010000000100',2) |
+----------------------------------------------------------------------------+
|                                                                        |
+----------------------------------------------------------------------------+
select rb_select(x'0106000000003b3000000100000f27010000000100',1);
ERROR HY000: Invalid data
select rb_select(x'01060100000000000000000000103a3000000100000f27010000000100',1);
ERROR HY000: Invalid data
select rb_select(x'010601000000000000000000001000000100000f27010000000100',1);
ERROR HY000: Invalid data
select rb_select(x'01060100000000000000000000003b3001000100000f27010000000100',1);
ERROR HY000: Invalid data
select rb_select(x'01060100000000000000000000003b300100000f27010000000100',1);
ERROR HY000: Invalid data
select rb_select(x'01060100000000000000000000003b3000000200000f27010000000100',1);
ERROR HY000: Invalid data
select rb_select(x'01060100000000000000000000003b3000000000000f27010000000100',1);
ERROR HY000: Invalid data
select rb_select(x'01060100000000000000000000003b30000000000f27010000000100',1);
ERROR HY000: Invalid data
select rb_select(x'01060100000000000000000000003b300000010f27010000000100',1);
ERROR HY000: Invalid data
select rb_select(x'01060100000000000000000000003b3000000100020f27010000000100',1);
+----------------------------------------------------------------------------+
| rb_select(x'01060100000000000000000000003b3000000100020f27010000000100',1) |
+----------------------------------------------------------------------------+
|                                                                         |
+----------------------------------------------------------------------------+
select rb_to_string(rb_select(x'01060100000000000000000000003b3000000100020000010000000100',33));
+-------------------------------------------------------------------------------------------+
| rb_to_string(rb_select(x'01060100000000000000000000003b3000000100020000010000000100',33)) |
+-------------------------------------------------------------------------------------------+
| 33554432,33554433                                                                         |
+-------------------------------------------------------------------------------------------+
select rb_select(x'01060100000000000000000000003b3000000100020000020000000100',1);
ERROR HY000: Invalid data
select rb_select(x'01060100000000000000000000003b300000010002000002000000010000100100',33);
+-------------------------------------------------------------------------------------+
| rb_select(x'01060100000000000000000000003b300000010002000002000000010000100100',33) |
+-------------------------------------------------------------------------------------+
|                                                                          |
+-------------------------------------------------------------------------------------+
select rb_select(x'01060100000000000000000000003b300000010002000003000000010000000100',1);
ERROR HY000: Invalid data
select rb_select(x'01060100000000000000000000003b300000010002000001000000010000000100',2);
ERROR HY000: Invalid data
select rb_select(x'01060100000000000000000000003b30000001000001000000010000000100',2);
ERROR HY000: Invalid data
select rb_select(x'01060100000000000000000000003b30000001000200000200000001000000',2);
ERROR HY000: Invalid data
select rb_select(x'01060100000000000000000000003b300000010002000001000000',2);
ERROR HY000: Invalid data
select rb_select(x'01060100000000000000000000003b30000001000200000100000001g0',2);
ERROR 42000: Incorrect parameters in the call to native function 'rb_select'
select rb_select(x'01060100000000000000000000003b3000000100020000010000000100 ',2);
ERROR 42000: Incorrect parameters in the call to native function 'rb_select'
select rb_select(rb_from_string('-1'),1);
+-----------------------------------+
| rb_select(rb_from_string('-1'),1) |
+-----------------------------------+
| ˇˇˇˇ                                |
+-----------------------------------+
select rb_select(rb_build_agg(-2),1);
+-------------------------------+
| rb_select(rb_build_agg(-2),1) |
+-------------------------------+
| ˛ˇˇˇ                            |
+-------------------------------+
select rb_select(x'01053b30000001ffff0f270100ffff0f00',33);
ERROR HY000: Invalid data
select rb_to_string(rb_select(0x01053b301800fdffff010000370001000100020013000300190004000f000500140006001e000700190008000600090013000a0018000b0019000c0007000e0013000f0019001000030011000e0013001d0015001d0017001d0019001d00e803160010274c003075080060ea2700d0000000da000000de000000e4000000ee000000f8000000020100000c010000160100001c010000220100002c010000360100003c01000042010000480100004e010000540100005a01000060010000660100006c0100007a010000980100009e010000020000003100faff0500000001000100ecff1300020000001000f7ff0800020000000500f6ff0900020000000900f5ff0a00020000000d00efff1000020000000700eeff11000100000006000100ecff1300020000000800f0ff0f00020000000300eaff15000100000007000100ecff13000100e6ff19000100000003000100e9ff0e000100e2ff1d000100e0ff1d000100deff1d000100dcff1d000300000008000a000400100008000700c8000900d3000700dc000700e5001400ff0009000e010900220109000100660308000100cc062700,100));
+---------------------------------------------------------------------------------------------------------------------------------------------------------------------------------------------------------------------------------------------------------------------------------------------------------------------------------------------------------------------------------------------------------------------------------------------------------------------------------------------------+
| rb_to_string(rb_select(0x01053b301800fdffff010000370001000100020013000300190004000f000500140006001e000700190008000600090013000a0018000b0019000c0007000e0013000f0019001000030011000e0013001d0015001d0017001d0019001d00e803160010274c003075080060ea2700d0000000da                                                                                                                                                                                                                                   |
+---------------------------------------------------------------------------------------------------------------------------------------------------------------------------------------------------------------------------------------------------------------------------------------------------------------------------------------------------------------------------------------------------------------------------------------------------------------------------------------------------+
| 0,1,2,3,4,5,6,7,8,9,10,11,12,13,14,15,16,17,18,19,20,21,22,23,24,25,26,27,28,29,30,31,32,33,34,35,36,37,38,39,40,41,42,43,44,45,46,47,48,49,65530,65531,65532,65533,65534,65535,65536,65537,196588,196589,196590,196591,196592,196593,196594,196595,196596,196597,196598,196599,196600,196601,196602,196603,196604,196605,196606,196607,196608,196609,196610,196611,196612,196613,196614,196615,196616,196617,196618,196619,196620,196621,196622,196623,196624,262135,262136,262137,262138,262139 |
+---------------------------------------------------------------------------------------------------------------------------------------------------------------------------------------------------------------------------------------------------------------------------------------------------------------------------------------------------------------------------------------------------------------------------------------------------------------------------------------------------+
select rb_select(0x01053b301800fdff010000370001000100020013000300190004000f000500140006001e000700190008000600090013000a0018000b0019000c0007000e0013000f0019001000030011000e0013001d0015001d0017001d0019001d00e803160010274c003075080060ea2700d0000000da000000de000000e4000000ee000000f8000000020100000c010000160100001c010000220100002c010000360100003c01000042010000480100004e010000540100005a01000060010000660100006c0100007a010000980100009e010000020000003100faff0500000001000100ecff1300020000001000f7ff0800020000000500f6ff0900020000000900f5ff0a00020000000d00efff1000020000000700eeff11000100000006000100ecff1300020000000800f0ff0f00020000000300eaff15000100000007000100ecff13000100e6ff19000100000003000100e9ff0e000100e2ff1d000100e0ff1d000100deff1d000100dcff1d000300000008000a000400100008000700c8000900d3000700dc000700e5001400ff0009000e010900220109000100660308000100cc062700,1);
ERROR HY000: Invalid data
select rb_select(0x01053b301800fdfeff010000370001000100020013000300190004000f000500140006001e000700190008000600090013000a0018000b0019000c0007000e0013000f0019001000030011000e0013001d0015001d0017001d0019001d00e803160010274c003075080060ea2700d0000000da000000de000000e4000000ee000000f8000000020100000c010000160100001c010000220100002c010000360100003c01000042010000480100004e010000540100005a01000060010000660100006c0100007a010000980100009e010000020000003100faff0500000001000100ecff1300020000001000f7ff0800020000000500f6ff0900020000000900f5ff0a00020000000d00efff1000020000000700eeff11000100000006000100ecff1300020000000800f0ff0f00020000000300eaff15000100000007000100ecff13000100e6ff19000100000003000100e9ff0e000100e2ff1d000100e0ff1d000100deff1d000100dcff1d000300000008000a000400100008000700c8000900d3000700dc000700e5001400ff0009000e010900220109000100660308000100cc062700,1);
ERROR HY000: Invalid data
select  rb_to_string(rb_select(rb_build_varbinary(0x01053b301800fdffff010000370001000100020013000300190004000f000500140006001e000700190008000600090013000a0018000b0019000c0007000e0013000f0019001000030011000e0013001d0015001d0017001d0019001d00e803160010274c003075080060ea2700d0000000da000000de000000e4000000ee000000f8000000020100000c010000160100001c010000220100002c010000360100003c01000042010000480100004e010000540100005a01000060010000660100006c0100007a010000980100009e010000020000003100faff0500000001000100ecff1300020000001000f7ff0800020000000500f6ff0900020000000900f5ff0a00020000000d00efff1000020000000700eeff11000100000006000100ecff1300020000000800f0ff0f00020000000300eaff15000100000007000100ecff13000100e6ff19000100000003000100e9ff0e000100e2ff1d000100e0ff1d000100deff1d000100dcff1d000300000008000a000400100008000700c8000900d3000700dc000700e5001400ff0009000e010900220109000100660308000100cc062700),100));
+---------------------------------------------------------------------------------------------------------------------------------------------------------------------------------------------------------------------------------------------------------------------------------------------------------------------------------------------------------------------------------------------------------------------------------------------------------------------------------------------------+
| rb_to_string(rb_select(rb_build_varbinary(0x01053b301800fdffff010000370001000100020013000300190004000f000500140006001e000700190008000600090013000a0018000b0019000c0007000e0013000f0019001000030011000e0013001d0015001d0017001d0019001d00e803160010274c003075080                                                                                                                                                                                                                                   |
+---------------------------------------------------------------------------------------------------------------------------------------------------------------------------------------------------------------------------------------------------------------------------------------------------------------------------------------------------------------------------------------------------------------------------------------------------------------------------------------------------+
| 0,1,2,3,4,5,6,7,8,9,10,11,12,13,14,15,16,17,18,19,20,21,22,23,24,25,26,27,28,29,30,31,32,33,34,35,36,37,38,39,40,41,42,43,44,45,46,47,48,49,65530,65531,65532,65533,65534,65535,65536,65537,196588,196589,196590,196591,196592,196593,196594,196595,196596,196597,196598,196599,196600,196601,196602,196603,196604,196605,196606,196607,196608,196609,196610,196611,196612,196613,196614,196615,196616,196617,196618,196619,196620,196621,196622,196623,196624,262135,262136,262137,262138,262139 |
+---------------------------------------------------------------------------------------------------------------------------------------------------------------------------------------------------------------------------------------------------------------------------------------------------------------------------------------------------------------------------------------------------------------------------------------------------------------------------------------------------+
select rb_to_string(rb_select(rb_build_empty(),1));
+---------------------------------------------+
| rb_to_string(rb_select(rb_build_empty(),1)) |
+---------------------------------------------+
|                                             |
+---------------------------------------------+
select rb_to_string(rb_select(rb_build_empty(),0));
+---------------------------------------------+
| rb_to_string(rb_select(rb_build_empty(),0)) |
+---------------------------------------------+
|                                             |
+---------------------------------------------+
select rb_to_string(rb_select(rb_build_empty(),0,0,true));
+----------------------------------------------------+
| rb_to_string(rb_select(rb_build_empty(),0,0,true)) |
+----------------------------------------------------+
|                                                    |
+----------------------------------------------------+
select rb_to_string(rb_select(rb_from_string('4294967295'),0,0,true));
+----------------------------------------------------------------+
| rb_to_string(rb_select(rb_from_string('4294967295'),0,0,true)) |
+----------------------------------------------------------------+
|                                                                |
+----------------------------------------------------------------+
select rb_to_string(rb_select(rb_from_string('4294967295'),1,0,true));
+----------------------------------------------------------------+
| rb_to_string(rb_select(rb_from_string('4294967295'),1,0,true)) |
+----------------------------------------------------------------+
| 4294967295                                                     |
+----------------------------------------------------------------+
select rb_to_string(rb_select(rb_from_string('4294967295'),2,0,true));
+----------------------------------------------------------------+
| rb_to_string(rb_select(rb_from_string('4294967295'),2,0,true)) |
+----------------------------------------------------------------+
| 4294967295                                                     |
+----------------------------------------------------------------+
select rb_to_string(rb_select(rb_from_string('4294967295'),-1,0,true));
ERROR 22003: Out of range value for column
select rb_to_string(rb_select(rb_from_string('4294967295'),'1',0,true));
+------------------------------------------------------------------+
| rb_to_string(rb_select(rb_from_string('4294967295'),'1',0,true)) |
+------------------------------------------------------------------+
| 4294967295                                                       |
+------------------------------------------------------------------+
select rb_to_string(rb_select(rb_from_string('4294967295'),'1',0,true));
+------------------------------------------------------------------+
| rb_to_string(rb_select(rb_from_string('4294967295'),'1',0,true)) |
+------------------------------------------------------------------+
| 4294967295                                                       |
+------------------------------------------------------------------+
select rb_to_string(rb_select(rb_from_string('4294967295'),1.0,0,true));
ERROR HY000: invalid type given for an argument
select rb_to_string(rb_select(rb_from_string('4294967295'),'test',0,true));
ERROR 22007: Incorrect value
select rb_to_string(rb_select(rb_from_string('4294967295'),true,0,true));
ERROR HY000: invalid type given for an argument
select rb_to_string(rb_select(rb_from_string('4294967295'),false,0,true));
ERROR HY000: invalid type given for an argument
select rb_to_string(rb_select(rb_from_string('4294967295'),null,0,true));
+-------------------------------------------------------------------+
| rb_to_string(rb_select(rb_from_string('4294967295'),null,0,true)) |
+-------------------------------------------------------------------+
| NULL                                                              |
+-------------------------------------------------------------------+
select rb_to_string(rb_select(rb_from_string('4294967295'),''));
ERROR 22007: Incorrect value
select rb_to_string(rb_select(rb_from_string('4294967295'),' '));
ERROR 22007: Incorrect value
select rb_to_string(rb_select(rb_from_string('4294967296'),1));
+---------------------------------------------------------+
| rb_to_string(rb_select(rb_from_string('4294967296'),1)) |
+---------------------------------------------------------+
| 4294967296                                              |
+---------------------------------------------------------+
select rb_to_string(rb_select(rb_from_string('1,4294967295'),1));
+-----------------------------------------------------------+
| rb_to_string(rb_select(rb_from_string('1,4294967295'),1)) |
+-----------------------------------------------------------+
| 1                                                         |
+-----------------------------------------------------------+
select rb_to_string(rb_select(rb_from_string('1,4294967295'),2,0,true,1,4294967295));
+-------------------------------------------------------------------------------+
| rb_to_string(rb_select(rb_from_string('1,4294967295'),2,0,true,1,4294967295)) |
+-------------------------------------------------------------------------------+
| 1                                                                             |
+-------------------------------------------------------------------------------+
select rb_to_string(rb_select(rb_from_string('1,4294967295'),0));
+-----------------------------------------------------------+
| rb_to_string(rb_select(rb_from_string('1,4294967295'),0)) |
+-----------------------------------------------------------+
|                                                           |
+-----------------------------------------------------------+
select rb_to_string(rb_select(rb_from_string('1,2,3,4,5,6,7,8,9,10,11,12,13,14,15,16,17,18,19,20,21,22,23,24,25,26,27,28,29,30,31,32'),30));
+--------------------------------------------------------------------------------------------------------------------------------------+
| rb_to_string(rb_select(rb_from_string('1,2,3,4,5,6,7,8,9,10,11,12,13,14,15,16,17,18,19,20,21,22,23,24,25,26,27,28,29,30,31,32'),30)) |
+--------------------------------------------------------------------------------------------------------------------------------------+
| 1,2,3,4,5,6,7,8,9,10,11,12,13,14,15,16,17,18,19,20,21,22,23,24,25,26,27,28,29,30                                                     |
+--------------------------------------------------------------------------------------------------------------------------------------+
select rb_to_string(rb_select(rb_from_string('1,2,3,4,5,6,7,8,9,10,11,12,13,14,15,16,17,18,19,20,21,22,23,24,25,26,27,28,29,30,31,32'),32));
+--------------------------------------------------------------------------------------------------------------------------------------+
| rb_to_string(rb_select(rb_from_string('1,2,3,4,5,6,7,8,9,10,11,12,13,14,15,16,17,18,19,20,21,22,23,24,25,26,27,28,29,30,31,32'),32)) |
+--------------------------------------------------------------------------------------------------------------------------------------+
| 1,2,3,4,5,6,7,8,9,10,11,12,13,14,15,16,17,18,19,20,21,22,23,24,25,26,27,28,29,30,31,32                                               |
+--------------------------------------------------------------------------------------------------------------------------------------+
select rb_to_string(rb_select(rb_from_string('1,2,3,4,5,6,7,8,9,10,11,12,13,14,15,16,17,18,19,20,21,22,23,24,25,26,27,28,29,30,31,32'),1));
+-------------------------------------------------------------------------------------------------------------------------------------+
| rb_to_string(rb_select(rb_from_string('1,2,3,4,5,6,7,8,9,10,11,12,13,14,15,16,17,18,19,20,21,22,23,24,25,26,27,28,29,30,31,32'),1)) |
+-------------------------------------------------------------------------------------------------------------------------------------+
| 1                                                                                                                                   |
+-------------------------------------------------------------------------------------------------------------------------------------+
select rb_to_string(rb_select(rb_from_string('1,2,3,4,5,6,7,8,9,10,11,12,13,14,15,16,17,18,19,20,21,22,23,24,25,26,27,28,29,30,31,32,33,80'),1,0,true));
+--------------------------------------------------------------------------------------------------------------------------------------------------+
| rb_to_string(rb_select(rb_from_string('1,2,3,4,5,6,7,8,9,10,11,12,13,14,15,16,17,18,19,20,21,22,23,24,25,26,27,28,29,30,31,32,33,80'),1,0,true)) |
+--------------------------------------------------------------------------------------------------------------------------------------------------+
| 80                                                                                                                                               |
+--------------------------------------------------------------------------------------------------------------------------------------------------+
select rb_to_string(rb_select(rb_from_string('1,2,3,4,5,6,7,8,9,10,11,12,13,14,15,16,17,18,19,20,21,22,23,24,25,26,27,28,29,30,31,32,33,80'),16,0,true));
+---------------------------------------------------------------------------------------------------------------------------------------------------+
| rb_to_string(rb_select(rb_from_string('1,2,3,4,5,6,7,8,9,10,11,12,13,14,15,16,17,18,19,20,21,22,23,24,25,26,27,28,29,30,31,32,33,80'),16,0,true)) |
+---------------------------------------------------------------------------------------------------------------------------------------------------+
| 19,20,21,22,23,24,25,26,27,28,29,30,31,32,33,80                                                                                                   |
+---------------------------------------------------------------------------------------------------------------------------------------------------+
select rb_to_string(rb_select(rb_from_string('1,2,3,4,5,6,7,8,9,10,11,12,13,14,15,16,17,18,19,20,21,22,23,24,25,26,27,28,29,30,31,32,33,80'),18446744073709551615,0,true));
+---------------------------------------------------------------------------------------------------------------------------------------------------------------------+
| rb_to_string(rb_select(rb_from_string('1,2,3,4,5,6,7,8,9,10,11,12,13,14,15,16,17,18,19,20,21,22,23,24,25,26,27,28,29,30,31,32,33,80'),18446744073709551615,0,true)) |
+---------------------------------------------------------------------------------------------------------------------------------------------------------------------+
| 1,2,3,4,5,6,7,8,9,10,11,12,13,14,15,16,17,18,19,20,21,22,23,24,25,26,27,28,29,30,31,32,33,80                                                                        |
+---------------------------------------------------------------------------------------------------------------------------------------------------------------------+
select rb_to_string(rb_select(rb_from_string('1,2,3,4,5,6,7,8,9,10,11,12,13,14,15,16,17,18,19,20,21,22,23,24,25,26,27,28,29,30,31,32,33,18446744073709551615'),18446744073709551615,0,true));
+---------------------------------------------------------------------------------------------------------------------------------------------------------------------------------------+
| rb_to_string(rb_select(rb_from_string('1,2,3,4,5,6,7,8,9,10,11,12,13,14,15,16,17,18,19,20,21,22,23,24,25,26,27,28,29,30,31,32,33,18446744073709551615'),18446744073709551615,0,true)) |
+---------------------------------------------------------------------------------------------------------------------------------------------------------------------------------------+
| 1,2,3,4,5,6,7,8,9,10,11,12,13,14,15,16,17,18,19,20,21,22,23,24,25,26,27,28,29,30,31,32,33,18446744073709551615                                                                        |
+---------------------------------------------------------------------------------------------------------------------------------------------------------------------------------------+
select rb_to_string(rb_select(rb_from_string('1,2,3,4,5,6,7,8,9,10,11,12,13,14,15,16,17,18,19,20,21,22,23,24,25,26,27,28,29,30,31,32,33,80'),18446744073709551616,0,true));
ERROR HY000: invalid type given for an argument
select rb_to_string(rb_select(rb_build_empty(),100,0));
+-------------------------------------------------+
| rb_to_string(rb_select(rb_build_empty(),100,0)) |
+-------------------------------------------------+
|                                                 |
+-------------------------------------------------+
select rb_to_string(rb_select(rb_build_empty(),100,1));
+-------------------------------------------------+
| rb_to_string(rb_select(rb_build_empty(),100,1)) |
+-------------------------------------------------+
|                                                 |
+-------------------------------------------------+
select rb_to_string(rb_select(rb_from_string('4294967295'),100,0));
+-------------------------------------------------------------+
| rb_to_string(rb_select(rb_from_string('4294967295'),100,0)) |
+-------------------------------------------------------------+
| 4294967295                                                  |
+-------------------------------------------------------------+
select rb_to_string(rb_select(rb_from_string('4294967295'),100,true));
ERROR HY000: invalid type given for an argument
select rb_to_string(rb_select(rb_from_string('4294967295'),100,1));
+-------------------------------------------------------------+
| rb_to_string(rb_select(rb_from_string('4294967295'),100,1)) |
+-------------------------------------------------------------+
|                                                             |
+-------------------------------------------------------------+
select rb_to_string(rb_select(rb_from_string('4294967295'),100,1,true));
+------------------------------------------------------------------+
| rb_to_string(rb_select(rb_from_string('4294967295'),100,1,true)) |
+------------------------------------------------------------------+
|                                                                  |
+------------------------------------------------------------------+
select rb_to_string(rb_select(rb_from_string('4294967296'),100,0,true));
+------------------------------------------------------------------+
| rb_to_string(rb_select(rb_from_string('4294967296'),100,0,true)) |
+------------------------------------------------------------------+
| 4294967296                                                       |
+------------------------------------------------------------------+
select rb_to_string(rb_select(rb_from_string('4294967295,1'),100,0));
+---------------------------------------------------------------+
| rb_to_string(rb_select(rb_from_string('4294967295,1'),100,0)) |
+---------------------------------------------------------------+
| 1,4294967295                                                  |
+---------------------------------------------------------------+
select rb_to_string(rb_select(rb_from_string('1,2'),100,1,false));
+------------------------------------------------------------+
| rb_to_string(rb_select(rb_from_string('1,2'),100,1,false)) |
+------------------------------------------------------------+
| 2                                                          |
+------------------------------------------------------------+
select rb_to_string(rb_select(rb_from_string('4294967295,1'),100,2));
+---------------------------------------------------------------+
| rb_to_string(rb_select(rb_from_string('4294967295,1'),100,2)) |
+---------------------------------------------------------------+
|                                                               |
+---------------------------------------------------------------+
select rb_to_string(rb_select(rb_from_string('4294967296,1'),100,2,true));
+--------------------------------------------------------------------+
| rb_to_string(rb_select(rb_from_string('4294967296,1'),100,2,true)) |
+--------------------------------------------------------------------+
|                                                                    |
+--------------------------------------------------------------------+
bug 2024092000104516141   „Ää[bitmap‰∏âÊúü]rb_select ÈÄÜÊó∂ËæìÂá∫Ôºåoffset ËæìÂÖ•ÂÄºÂíåvaluesÊï∞ÈáèÁõ∏Â∑Æ1Êó∂ÔºåobÊ≤°ÊúâËæìÂá∫ÂÄºÔºåÂ∫îËØ•ËæìÂá∫1‰∏™value„Äã
select rb_to_string(rb_select(rb_from_string('1,2'),100,1,true));
+-----------------------------------------------------------+
| rb_to_string(rb_select(rb_from_string('1,2'),100,1,true)) |
+-----------------------------------------------------------+
| 1                                                         |
+-----------------------------------------------------------+
bug 2024092000104516141   „Ää[bitmap‰∏âÊúü]rb_select ÈÄÜÊó∂ËæìÂá∫Ôºåoffset ËæìÂÖ•ÂÄºÂíåvaluesÊï∞ÈáèÁõ∏Â∑Æ1Êó∂ÔºåobÊ≤°ÊúâËæìÂá∫ÂÄºÔºåÂ∫îËØ•ËæìÂá∫1‰∏™value„Äã
select rb_to_string(rb_select(rb_from_string('10,2,3'),1,2,true));
+------------------------------------------------------------+
| rb_to_string(rb_select(rb_from_string('10,2,3'),1,2,true)) |
+------------------------------------------------------------+
| 2                                                          |
+------------------------------------------------------------+
select rb_to_string(rb_select(rb_from_string('10,2,3'),2,1,true));
+------------------------------------------------------------+
| rb_to_string(rb_select(rb_from_string('10,2,3'),2,1,true)) |
+------------------------------------------------------------+
| 2,3                                                        |
+------------------------------------------------------------+
select rb_to_string(rb_select(rb_from_string('10,2,3,4294967296'),10,2,true));
+------------------------------------------------------------------------+
| rb_to_string(rb_select(rb_from_string('10,2,3,4294967296'),10,2,true)) |
+------------------------------------------------------------------------+
| 2,3                                                                    |
+------------------------------------------------------------------------+
select rb_to_string(rb_select(rb_from_string('10,2,3,4294967296'),10,2,false));
+-------------------------------------------------------------------------+
| rb_to_string(rb_select(rb_from_string('10,2,3,4294967296'),10,2,false)) |
+-------------------------------------------------------------------------+
| 10,4294967296                                                           |
+-------------------------------------------------------------------------+
select rb_to_string(rb_select(rb_from_string('10,2,3,4294967296'),10,4,true));
+------------------------------------------------------------------------+
| rb_to_string(rb_select(rb_from_string('10,2,3,4294967296'),10,4,true)) |
+------------------------------------------------------------------------+
|                                                                        |
+------------------------------------------------------------------------+
select rb_to_string(rb_select(rb_from_string('10,2,3,4294967296'),10,4));
+-------------------------------------------------------------------+
| rb_to_string(rb_select(rb_from_string('10,2,3,4294967296'),10,4)) |
+-------------------------------------------------------------------+
|                                                                   |
+-------------------------------------------------------------------+
select rb_to_string(rb_select(rb_from_string('10,2,3,4294967296'),10,3));
+-------------------------------------------------------------------+
| rb_to_string(rb_select(rb_from_string('10,2,3,4294967296'),10,3)) |
+-------------------------------------------------------------------+
| 4294967296                                                        |
+-------------------------------------------------------------------+
select rb_to_string(rb_select(rb_from_string('1,2,3,4,5,6,7,8,9,10,11,12,13,14,15,16,17,18,19,20,21,22,23,24,25,26,27,28,29,30,31,32'),50,31));
+-----------------------------------------------------------------------------------------------------------------------------------------+
| rb_to_string(rb_select(rb_from_string('1,2,3,4,5,6,7,8,9,10,11,12,13,14,15,16,17,18,19,20,21,22,23,24,25,26,27,28,29,30,31,32'),50,31)) |
+-----------------------------------------------------------------------------------------------------------------------------------------+
| 32                                                                                                                                      |
+-----------------------------------------------------------------------------------------------------------------------------------------+
bug 2024092000104516141   „Ää[bitmap‰∏âÊúü]rb_select ÈÄÜÊó∂ËæìÂá∫Ôºåoffset ËæìÂÖ•ÂÄºÂíåvaluesÊï∞ÈáèÁõ∏Â∑Æ1Êó∂ÔºåobÊ≤°ÊúâËæìÂá∫ÂÄºÔºåÂ∫îËØ•ËæìÂá∫1‰∏™value„Äã
select rb_to_string(rb_select(rb_from_string('1,2,3,4,5,6,7,8,9,10,11,12,13,14,15,16,17,18,19,20,21,22,23,24,25,26,27,28,29,30,31,32'),50,31,true));
+----------------------------------------------------------------------------------------------------------------------------------------------+
| rb_to_string(rb_select(rb_from_string('1,2,3,4,5,6,7,8,9,10,11,12,13,14,15,16,17,18,19,20,21,22,23,24,25,26,27,28,29,30,31,32'),50,31,true)) |
+----------------------------------------------------------------------------------------------------------------------------------------------+
| 1                                                                                                                                            |
+----------------------------------------------------------------------------------------------------------------------------------------------+
select rb_to_string(rb_select(rb_from_string('1,2,3,4,5,6,7,8,9,10,11,12,13,14,15,16,17,18,19,20,21,22,23,24,25,26,27,28,29,30,31,32'),50,30,false));
+-----------------------------------------------------------------------------------------------------------------------------------------------+
| rb_to_string(rb_select(rb_from_string('1,2,3,4,5,6,7,8,9,10,11,12,13,14,15,16,17,18,19,20,21,22,23,24,25,26,27,28,29,30,31,32'),50,30,false)) |
+-----------------------------------------------------------------------------------------------------------------------------------------------+
| 31,32                                                                                                                                         |
+-----------------------------------------------------------------------------------------------------------------------------------------------+
select rb_to_string(rb_select(rb_from_string('1,2,3,4,5,6,7,8,9,10,11,12,13,14,15,16,17,18,19,20,21,22,23,24,25,26,27,28,29,30,31,32'),50,30,true));
+----------------------------------------------------------------------------------------------------------------------------------------------+
| rb_to_string(rb_select(rb_from_string('1,2,3,4,5,6,7,8,9,10,11,12,13,14,15,16,17,18,19,20,21,22,23,24,25,26,27,28,29,30,31,32'),50,30,true)) |
+----------------------------------------------------------------------------------------------------------------------------------------------+
| 1,2                                                                                                                                          |
+----------------------------------------------------------------------------------------------------------------------------------------------+
bug 2024092000104516141   „Ää[bitmap‰∏âÊúü]rb_select ÈÄÜÊó∂ËæìÂá∫Ôºåoffset ËæìÂÖ•ÂÄºÂíåvaluesÊï∞ÈáèÁõ∏Â∑Æ1Êó∂ÔºåobÊ≤°ÊúâËæìÂá∫ÂÄºÔºåÂ∫îËØ•ËæìÂá∫1‰∏™value„Äã
select rb_to_string(rb_select(rb_from_string('1,2,3,4,5,6,7,8,9,10,11,12,13,14,15,16,17,18,19,20,21,22,23,24,25,26,27,28,29,30,31,32,4294967296'),50,32,true));
+---------------------------------------------------------------------------------------------------------------------------------------------------------+
| rb_to_string(rb_select(rb_from_string('1,2,3,4,5,6,7,8,9,10,11,12,13,14,15,16,17,18,19,20,21,22,23,24,25,26,27,28,29,30,31,32,4294967296'),50,32,true)) |
+---------------------------------------------------------------------------------------------------------------------------------------------------------+
| 1                                                                                                                                                       |
+---------------------------------------------------------------------------------------------------------------------------------------------------------+
select rb_to_string(rb_select(rb_from_string('1,2,3,4,5,6,7,8,9,10,11,12,13,14,15,16,17,18,19,20,21,22,23,24,25,26,27,28,29,30,31,32,4294967296'),50,32,false));
+----------------------------------------------------------------------------------------------------------------------------------------------------------+
| rb_to_string(rb_select(rb_from_string('1,2,3,4,5,6,7,8,9,10,11,12,13,14,15,16,17,18,19,20,21,22,23,24,25,26,27,28,29,30,31,32,4294967296'),50,32,false)) |
+----------------------------------------------------------------------------------------------------------------------------------------------------------+
| 4294967296                                                                                                                                               |
+----------------------------------------------------------------------------------------------------------------------------------------------------------+
select rb_to_string(rb_select(rb_from_string('1,2,3,4,5,6,7,8,9,10,11,12,13,14,15,16,17,18,19,20,21,22,23,24,25,26,27,28,29,30,31,32,4294967296'),50,33,true));
+---------------------------------------------------------------------------------------------------------------------------------------------------------+
| rb_to_string(rb_select(rb_from_string('1,2,3,4,5,6,7,8,9,10,11,12,13,14,15,16,17,18,19,20,21,22,23,24,25,26,27,28,29,30,31,32,4294967296'),50,33,true)) |
+---------------------------------------------------------------------------------------------------------------------------------------------------------+
|                                                                                                                                                         |
+---------------------------------------------------------------------------------------------------------------------------------------------------------+
select rb_to_string(rb_select(rb_from_string('1,2,3,4,5,6,7,8,9,10,11,12,13,14,15,16,17,18,19,20,21,22,23,24,25,26,27,28,29,30,31,32,4294967296'),50,33,false));
+----------------------------------------------------------------------------------------------------------------------------------------------------------+
| rb_to_string(rb_select(rb_from_string('1,2,3,4,5,6,7,8,9,10,11,12,13,14,15,16,17,18,19,20,21,22,23,24,25,26,27,28,29,30,31,32,4294967296'),50,33,false)) |
+----------------------------------------------------------------------------------------------------------------------------------------------------------+
|                                                                                                                                                          |
+----------------------------------------------------------------------------------------------------------------------------------------------------------+
select rb_to_string(rb_select(rb_from_string('1,2,3,4,5,6,7,8,9,10,11,12,13,14,15,16,17,18,19,20,21,22,23,24,25,26,27,28,29,30,31,32,4294967296'),50,34,true));
+---------------------------------------------------------------------------------------------------------------------------------------------------------+
| rb_to_string(rb_select(rb_from_string('1,2,3,4,5,6,7,8,9,10,11,12,13,14,15,16,17,18,19,20,21,22,23,24,25,26,27,28,29,30,31,32,4294967296'),50,34,true)) |
+---------------------------------------------------------------------------------------------------------------------------------------------------------+
|                                                                                                                                                         |
+---------------------------------------------------------------------------------------------------------------------------------------------------------+
select rb_to_string(rb_select(rb_from_string('1,2,3,4,5,6,7,8,9,10,11,12,13,14,15,16,17,18,19,20,21,22,23,24,25,26,27,28,29,30,31,32,4294967296'),50,34,false));
+----------------------------------------------------------------------------------------------------------------------------------------------------------+
| rb_to_string(rb_select(rb_from_string('1,2,3,4,5,6,7,8,9,10,11,12,13,14,15,16,17,18,19,20,21,22,23,24,25,26,27,28,29,30,31,32,4294967296'),50,34,false)) |
+----------------------------------------------------------------------------------------------------------------------------------------------------------+
|                                                                                                                                                          |
+----------------------------------------------------------------------------------------------------------------------------------------------------------+
select rb_to_string(rb_select(rb_from_string('1,2,3,4,5,6,7,8,9,10,11,12,13,14,15,16,17,18,19,20,21,22,23,24,25,26,27,28,29,30,31,32,4294967296'),50,0,true));
+--------------------------------------------------------------------------------------------------------------------------------------------------------+
| rb_to_string(rb_select(rb_from_string('1,2,3,4,5,6,7,8,9,10,11,12,13,14,15,16,17,18,19,20,21,22,23,24,25,26,27,28,29,30,31,32,4294967296'),50,0,true)) |
+--------------------------------------------------------------------------------------------------------------------------------------------------------+
| 1,2,3,4,5,6,7,8,9,10,11,12,13,14,15,16,17,18,19,20,21,22,23,24,25,26,27,28,29,30,31,32,4294967296                                                      |
+--------------------------------------------------------------------------------------------------------------------------------------------------------+
select rb_to_string(rb_select(rb_from_string('1,2,3,4,5,6,7,8,9,10,11,12,13,14,15,16,17,18,19,20,21,22,23,24,25,26,27,28,29,30,31,32,4294967296'),50,-1,true));
ERROR 22003: Out of range value for column
select rb_to_string(rb_select(rb_from_string('1,2,3,4,5,6,7,8,9,10,11,12,13,14,15,16,17,18,19,20,21,22,23,24,25,26,27,28,29,30,31,32,4294967296'),50,'0',true));
+----------------------------------------------------------------------------------------------------------------------------------------------------------+
| rb_to_string(rb_select(rb_from_string('1,2,3,4,5,6,7,8,9,10,11,12,13,14,15,16,17,18,19,20,21,22,23,24,25,26,27,28,29,30,31,32,4294967296'),50,'0',true)) |
+----------------------------------------------------------------------------------------------------------------------------------------------------------+
| 1,2,3,4,5,6,7,8,9,10,11,12,13,14,15,16,17,18,19,20,21,22,23,24,25,26,27,28,29,30,31,32,4294967296                                                        |
+----------------------------------------------------------------------------------------------------------------------------------------------------------+
select rb_to_string(rb_select(rb_from_string('1,2,3,4,5,6,7,8,9,10,11,12,13,14,15,16,17,18,19,20,21,22,23,24,25,26,27,28,29,30,31,32,4294967296'),50,'test',true));
ERROR 22007: Incorrect value
select rb_to_string(rb_select(rb_from_string('1,2,3,4,5,6,7,8,9,10,11,12,13,14,15,16,17,18,19,20,21,22,23,24,25,26,27,28,29,30,31,32,4294967296'),50,true,true));
ERROR HY000: invalid type given for an argument
select rb_to_string(rb_select(rb_from_string('1,2,3,4,5,6,7,8,9,10,11,12,13,14,15,16,17,18,19,20,21,22,23,24,25,26,27,28,29,30,31,32,4294967296'),50,true,true));
ERROR HY000: invalid type given for an argument
select rb_to_string(rb_select(rb_from_string('1,2,3,4,5,6,7,8,9,10,11,12,13,14,15,16,17,18,19,20,21,22,23,24,25,26,27,28,29,30,31,32,4294967296'),50,null,true));
+-----------------------------------------------------------------------------------------------------------------------------------------------------------+
| rb_to_string(rb_select(rb_from_string('1,2,3,4,5,6,7,8,9,10,11,12,13,14,15,16,17,18,19,20,21,22,23,24,25,26,27,28,29,30,31,32,4294967296'),50,null,true)) |
+-----------------------------------------------------------------------------------------------------------------------------------------------------------+
| NULL                                                                                                                                                      |
+-----------------------------------------------------------------------------------------------------------------------------------------------------------+
select rb_to_string(rb_select(rb_from_string('1,2,3,4,5,6,7,8,9,10,11,12,13,14,15,16,17,18,19,20,21,22,23,24,25,26,27,28,29,30,31,32,4294967296'),50,cast('1' as json),true));
ERROR HY000: invalid type given for an argument
select rb_to_string(rb_select(rb_from_string('1,2,3,4,5,6,7,8,9,10,11,12,13,14,15,16,17,18,19,20,21,22,23,24,25,26,27,28,29,30,31,32,4294967296'),50,18446744073709551615,true));
+---------------------------------------------------------------------------------------------------------------------------------------------------------------------------+
| rb_to_string(rb_select(rb_from_string('1,2,3,4,5,6,7,8,9,10,11,12,13,14,15,16,17,18,19,20,21,22,23,24,25,26,27,28,29,30,31,32,4294967296'),50,18446744073709551615,true)) |
+---------------------------------------------------------------------------------------------------------------------------------------------------------------------------+
|                                                                                                                                                                           |
+---------------------------------------------------------------------------------------------------------------------------------------------------------------------------+
select rb_to_string(rb_select(rb_from_string('1,2,3,4,5,6,7,8,9,10,11,12,13,14,15,16,17,18,19,20,21,22,23,24,25,26,27,28,29,30,31,32,4294967296'),50,18446744073709551616,true));
ERROR HY000: invalid type given for an argument
select rb_to_string(rb_select(rb_from_string('1,2,3,4,5,6,7,8,9,10,11,12,13,14,15,16,17,18,19,20,21,22,23,24,25,26,27,28,29,30,31,32,4294967296'),50,'',true));
ERROR 22007: Incorrect value
select rb_to_string(rb_select(rb_from_string('1,2,3,4,5,6,7,8,9,10,11,12,13,14,15,16,17,18,19,20,21,22,23,24,25,26,27,28,29,30,31,32,4294967296'),50,' '));
ERROR 22007: Incorrect value
select rb_to_string(rb_select(rb_from_string('1,2,3,4,5,6,7,8,9,10,11,12,13,14,15,16,17,18,19,20,21,22,23,24,25,26,27,28,29,30,31,32,4294967296'),50));
+-------------------------------------------------------------------------------------------------------------------------------------------------+
| rb_to_string(rb_select(rb_from_string('1,2,3,4,5,6,7,8,9,10,11,12,13,14,15,16,17,18,19,20,21,22,23,24,25,26,27,28,29,30,31,32,4294967296'),50)) |
+-------------------------------------------------------------------------------------------------------------------------------------------------+
| 1,2,3,4,5,6,7,8,9,10,11,12,13,14,15,16,17,18,19,20,21,22,23,24,25,26,27,28,29,30,31,32,4294967296                                               |
+-------------------------------------------------------------------------------------------------------------------------------------------------+
select rb_to_string(rb_select(rb_from_string(result),10000,5000)) from (select GROUP_CONCAT(number SEPARATOR ',') AS result
FROM (
    SELECT FLOOR( RAND() * 100000) AS number
    FROM TABLE(GENERATOR(10000))
) AS random_numbers);
select rb_to_string(rb_select(rb_build_empty(),10,0,true));
+-----------------------------------------------------+
| rb_to_string(rb_select(rb_build_empty(),10,0,true)) |
+-----------------------------------------------------+
|                                                     |
+-----------------------------------------------------+
select rb_to_string(rb_select(rb_build_empty(),10,0,false));
+------------------------------------------------------+
| rb_to_string(rb_select(rb_build_empty(),10,0,false)) |
+------------------------------------------------------+
|                                                      |
+------------------------------------------------------+
select rb_to_string(rb_select(rb_from_string('4294967295'),100,0,true));
+------------------------------------------------------------------+
| rb_to_string(rb_select(rb_from_string('4294967295'),100,0,true)) |
+------------------------------------------------------------------+
| 4294967295                                                       |
+------------------------------------------------------------------+
select rb_to_string(rb_select(rb_from_string('4294967295'),100,0,false));
+-------------------------------------------------------------------+
| rb_to_string(rb_select(rb_from_string('4294967295'),100,0,false)) |
+-------------------------------------------------------------------+
| 4294967295                                                        |
+-------------------------------------------------------------------+
select rb_to_string(rb_select(rb_from_string('4294967296'),100,0,true));
+------------------------------------------------------------------+
| rb_to_string(rb_select(rb_from_string('4294967296'),100,0,true)) |
+------------------------------------------------------------------+
| 4294967296                                                       |
+------------------------------------------------------------------+
select rb_to_string(rb_select(rb_from_string('4294967296'),100,0,false));
+-------------------------------------------------------------------+
| rb_to_string(rb_select(rb_from_string('4294967296'),100,0,false)) |
+-------------------------------------------------------------------+
| 4294967296                                                        |
+-------------------------------------------------------------------+
select rb_to_string(rb_select(rb_from_string('1,4294967295'),1,0,true));
+------------------------------------------------------------------+
| rb_to_string(rb_select(rb_from_string('1,4294967295'),1,0,true)) |
+------------------------------------------------------------------+
| 4294967295                                                       |
+------------------------------------------------------------------+
select rb_to_string(rb_select(rb_from_string('1,4294967295'),1,0,false));
+-------------------------------------------------------------------+
| rb_to_string(rb_select(rb_from_string('1,4294967295'),1,0,false)) |
+-------------------------------------------------------------------+
| 1                                                                 |
+-------------------------------------------------------------------+
select rb_to_string(rb_select(rb_from_string('4294967296,4294967297'),1,0,false));
+----------------------------------------------------------------------------+
| rb_to_string(rb_select(rb_from_string('4294967296,4294967297'),1,0,false)) |
+----------------------------------------------------------------------------+
| 4294967296                                                                 |
+----------------------------------------------------------------------------+
select rb_to_string(rb_select(rb_from_string('4294967296,4294967297'),1,0,true));
+---------------------------------------------------------------------------+
| rb_to_string(rb_select(rb_from_string('4294967296,4294967297'),1,0,true)) |
+---------------------------------------------------------------------------+
| 4294967297                                                                |
+---------------------------------------------------------------------------+
select rb_to_string(rb_select(rb_from_string('4294967296,4294967297'),1,0));
+----------------------------------------------------------------------+
| rb_to_string(rb_select(rb_from_string('4294967296,4294967297'),1,0)) |
+----------------------------------------------------------------------+
| 4294967296                                                           |
+----------------------------------------------------------------------+
select rb_to_string(rb_select(rb_from_string('1,2,3,4,5,6,7,8,9,10,11,12,13,14,15,16,17,18,19,20,21,22,23,24,25,26,27,28,29,30,31,32'),50,10,true));
+----------------------------------------------------------------------------------------------------------------------------------------------+
| rb_to_string(rb_select(rb_from_string('1,2,3,4,5,6,7,8,9,10,11,12,13,14,15,16,17,18,19,20,21,22,23,24,25,26,27,28,29,30,31,32'),50,10,true)) |
+----------------------------------------------------------------------------------------------------------------------------------------------+
| 1,2,3,4,5,6,7,8,9,10,11,12,13,14,15,16,17,18,19,20,21,22                                                                                     |
+----------------------------------------------------------------------------------------------------------------------------------------------+
select rb_to_string(rb_select(rb_from_string('1,2,3,4,5,6,7,8,9,10,11,12,13,14,15,16,17,18,19,20,21,22,23,24,25,26,27,28,29,30,31,32'),50,10,false));
+-----------------------------------------------------------------------------------------------------------------------------------------------+
| rb_to_string(rb_select(rb_from_string('1,2,3,4,5,6,7,8,9,10,11,12,13,14,15,16,17,18,19,20,21,22,23,24,25,26,27,28,29,30,31,32'),50,10,false)) |
+-----------------------------------------------------------------------------------------------------------------------------------------------+
| 11,12,13,14,15,16,17,18,19,20,21,22,23,24,25,26,27,28,29,30,31,32                                                                             |
+-----------------------------------------------------------------------------------------------------------------------------------------------+
select rb_to_string(rb_select(rb_from_string('1,2,3,4,5,6,7,8,9,10,11,12,13,14,15,16,17,18,19,20,21,22,23,24,25,26,27,28,29,30,31,32'),50,10));
+-----------------------------------------------------------------------------------------------------------------------------------------+
| rb_to_string(rb_select(rb_from_string('1,2,3,4,5,6,7,8,9,10,11,12,13,14,15,16,17,18,19,20,21,22,23,24,25,26,27,28,29,30,31,32'),50,10)) |
+-----------------------------------------------------------------------------------------------------------------------------------------+
| 11,12,13,14,15,16,17,18,19,20,21,22,23,24,25,26,27,28,29,30,31,32                                                                       |
+-----------------------------------------------------------------------------------------------------------------------------------------+
select rb_to_string(rb_select(rb_from_string('1,2,3,4,5,6,7,8,9,10,11,12,13,14,15,16,17,18,19,20,21,22,23,24,25,26,27,28,29,30,31,32,33'),50,10,true));
+-------------------------------------------------------------------------------------------------------------------------------------------------+
| rb_to_string(rb_select(rb_from_string('1,2,3,4,5,6,7,8,9,10,11,12,13,14,15,16,17,18,19,20,21,22,23,24,25,26,27,28,29,30,31,32,33'),50,10,true)) |
+-------------------------------------------------------------------------------------------------------------------------------------------------+
| 1,2,3,4,5,6,7,8,9,10,11,12,13,14,15,16,17,18,19,20,21,22,23                                                                                     |
+-------------------------------------------------------------------------------------------------------------------------------------------------+
select rb_to_string(rb_select(rb_from_string('1,2,3,4,5,6,7,8,9,10,11,12,13,14,15,16,17,18,19,20,21,22,23,24,25,26,27,28,29,30,31,32,33'),50,10,false));
+--------------------------------------------------------------------------------------------------------------------------------------------------+
| rb_to_string(rb_select(rb_from_string('1,2,3,4,5,6,7,8,9,10,11,12,13,14,15,16,17,18,19,20,21,22,23,24,25,26,27,28,29,30,31,32,33'),50,10,false)) |
+--------------------------------------------------------------------------------------------------------------------------------------------------+
| 11,12,13,14,15,16,17,18,19,20,21,22,23,24,25,26,27,28,29,30,31,32,33                                                                             |
+--------------------------------------------------------------------------------------------------------------------------------------------------+
select rb_to_string(rb_select(rb_from_string('1,2,3,4,5,6,7,8,9,10,11,12,13,14,15,16,17,18,19,20,21,22,23,24,25,26,27,28,29,30,31,32,33'),50,10));
+--------------------------------------------------------------------------------------------------------------------------------------------+
| rb_to_string(rb_select(rb_from_string('1,2,3,4,5,6,7,8,9,10,11,12,13,14,15,16,17,18,19,20,21,22,23,24,25,26,27,28,29,30,31,32,33'),50,10)) |
+--------------------------------------------------------------------------------------------------------------------------------------------+
| 11,12,13,14,15,16,17,18,19,20,21,22,23,24,25,26,27,28,29,30,31,32,33                                                                       |
+--------------------------------------------------------------------------------------------------------------------------------------------+
select rb_to_string(rb_select(rb_from_string('1,2,3,4,5,6,7,8,9,10,11,12,13,14,15,16,17,18,19,20,21,22,23,24,25,26,27,28,29,30,31,32,33,4294967296'),50,10,true));
+------------------------------------------------------------------------------------------------------------------------------------------------------------+
| rb_to_string(rb_select(rb_from_string('1,2,3,4,5,6,7,8,9,10,11,12,13,14,15,16,17,18,19,20,21,22,23,24,25,26,27,28,29,30,31,32,33,4294967296'),50,10,true)) |
+------------------------------------------------------------------------------------------------------------------------------------------------------------+
| 1,2,3,4,5,6,7,8,9,10,11,12,13,14,15,16,17,18,19,20,21,22,23,24                                                                                             |
+------------------------------------------------------------------------------------------------------------------------------------------------------------+
select rb_to_string(rb_select(rb_from_string('1,2,3,4,5,6,7,8,9,10,11,12,13,14,15,16,17,18,19,20,21,22,23,24,25,26,27,28,29,30,31,32,33,4294967296'),50,10,false));
+-------------------------------------------------------------------------------------------------------------------------------------------------------------+
| rb_to_string(rb_select(rb_from_string('1,2,3,4,5,6,7,8,9,10,11,12,13,14,15,16,17,18,19,20,21,22,23,24,25,26,27,28,29,30,31,32,33,4294967296'),50,10,false)) |
+-------------------------------------------------------------------------------------------------------------------------------------------------------------+
| 11,12,13,14,15,16,17,18,19,20,21,22,23,24,25,26,27,28,29,30,31,32,33,4294967296                                                                             |
+-------------------------------------------------------------------------------------------------------------------------------------------------------------+
select rb_to_string(rb_select(rb_from_string('1,2,3,4,5,6,7,8,9,10,11,12,13,14,15,16,17,18,19,20,21,22,23,24,25,26,27,28,29,30,31,32,33,4294967296'),50,10));
+-------------------------------------------------------------------------------------------------------------------------------------------------------+
| rb_to_string(rb_select(rb_from_string('1,2,3,4,5,6,7,8,9,10,11,12,13,14,15,16,17,18,19,20,21,22,23,24,25,26,27,28,29,30,31,32,33,4294967296'),50,10)) |
+-------------------------------------------------------------------------------------------------------------------------------------------------------+
| 11,12,13,14,15,16,17,18,19,20,21,22,23,24,25,26,27,28,29,30,31,32,33,4294967296                                                                       |
+-------------------------------------------------------------------------------------------------------------------------------------------------------+
select rb_to_string(rb_select(rb_from_string('1,2,3,4,5,6,7,8,9,10,11,12,13,14,15,16,17,18,19,20,21,22,23,24,25,26,27,28,29,30,31,32,33,4294967296'),50,10,0));
ERROR HY000: invalid type given for an argument
select rb_to_string(rb_select(rb_from_string('1,2,3,4,5,6,7,8,9,10,11,12,13,14,15,16,17,18,19,20,21,22,23,24,25,26,27,28,29,30,31,32,33,4294967296'),50,10,1));
ERROR HY000: invalid type given for an argument
select rb_to_string(rb_select(rb_from_string('1,2,3,4,5,6,7,8,9,10,11,12,13,14,15,16,17,18,19,20,21,22,23,24,25,26,27,28,29,30,31,32,33,4294967296'),50,10,'test'));
ERROR HY000: invalid type given for an argument
select rb_to_string(rb_select(rb_from_string('1,2,3,4,5,6,7,8,9,10,11,12,13,14,15,16,17,18,19,20,21,22,23,24,25,26,27,28,29,30,31,32,33,4294967296'),50,10,null));
+------------------------------------------------------------------------------------------------------------------------------------------------------------+
| rb_to_string(rb_select(rb_from_string('1,2,3,4,5,6,7,8,9,10,11,12,13,14,15,16,17,18,19,20,21,22,23,24,25,26,27,28,29,30,31,32,33,4294967296'),50,10,null)) |
+------------------------------------------------------------------------------------------------------------------------------------------------------------+
| NULL                                                                                                                                                       |
+------------------------------------------------------------------------------------------------------------------------------------------------------------+
select rb_to_string(rb_select(rb_from_string('1,2,3,4,5,6,7,8,9,10,11,12,13,14,15,16,17,18,19,20,21,22,23,24,25,26,27,28,29,30,31,32,33,4294967296'),50,10,'true'));
ERROR HY000: invalid type given for an argument
select rb_to_string(rb_select(rb_from_string('1,2,3,4,5,6,7,8,9,10,11,12,13,14,15,16,17,18,19,20,21,22,23,24,25,26,27,28,29,30,31,32,33,4294967296'),50,10,''));
ERROR HY000: invalid type given for an argument
select rb_to_string(rb_select(rb_build_empty(),10,0,true,0));
+-------------------------------------------------------+
| rb_to_string(rb_select(rb_build_empty(),10,0,true,0)) |
+-------------------------------------------------------+
|                                                       |
+-------------------------------------------------------+
select rb_to_string(rb_select(rb_build_empty(),10,0,false,1));
+--------------------------------------------------------+
| rb_to_string(rb_select(rb_build_empty(),10,0,false,1)) |
+--------------------------------------------------------+
|                                                        |
+--------------------------------------------------------+
select rb_to_string(rb_select(rb_from_string('4294967295'),100,0,true,4294967295));
+-----------------------------------------------------------------------------+
| rb_to_string(rb_select(rb_from_string('4294967295'),100,0,true,4294967295)) |
+-----------------------------------------------------------------------------+
| 4294967295                                                                  |
+-----------------------------------------------------------------------------+
select rb_to_string(rb_select(rb_from_string('4294967295'),100,0,true,4294967294));
+-----------------------------------------------------------------------------+
| rb_to_string(rb_select(rb_from_string('4294967295'),100,0,true,4294967294)) |
+-----------------------------------------------------------------------------+
| 4294967295                                                                  |
+-----------------------------------------------------------------------------+
select rb_to_string(rb_select(rb_from_string('4294967295'),100,0,true,4294967296));
+-----------------------------------------------------------------------------+
| rb_to_string(rb_select(rb_from_string('4294967295'),100,0,true,4294967296)) |
+-----------------------------------------------------------------------------+
|                                                                             |
+-----------------------------------------------------------------------------+
select rb_to_string(rb_select(rb_from_string('4294967295'),100,0,false,4294967295));
+------------------------------------------------------------------------------+
| rb_to_string(rb_select(rb_from_string('4294967295'),100,0,false,4294967295)) |
+------------------------------------------------------------------------------+
| 4294967295                                                                   |
+------------------------------------------------------------------------------+
select rb_to_string(rb_select(rb_from_string('4294967295'),100,0,false,4294967294));
+------------------------------------------------------------------------------+
| rb_to_string(rb_select(rb_from_string('4294967295'),100,0,false,4294967294)) |
+------------------------------------------------------------------------------+
| 4294967295                                                                   |
+------------------------------------------------------------------------------+
select rb_to_string(rb_select(rb_from_string('4294967295'),100,0,false,4294967296));
+------------------------------------------------------------------------------+
| rb_to_string(rb_select(rb_from_string('4294967295'),100,0,false,4294967296)) |
+------------------------------------------------------------------------------+
|                                                                              |
+------------------------------------------------------------------------------+
select rb_to_string(rb_select(rb_from_string('4294967297'),100,0,true,4294967298));
+-----------------------------------------------------------------------------+
| rb_to_string(rb_select(rb_from_string('4294967297'),100,0,true,4294967298)) |
+-----------------------------------------------------------------------------+
|                                                                             |
+-----------------------------------------------------------------------------+
select rb_to_string(rb_select(rb_from_string('4294967297'),100,0,true,4294967296));
+-----------------------------------------------------------------------------+
| rb_to_string(rb_select(rb_from_string('4294967297'),100,0,true,4294967296)) |
+-----------------------------------------------------------------------------+
| 4294967297                                                                  |
+-----------------------------------------------------------------------------+
select rb_to_string(rb_select(rb_from_string('4294967297'),100,0,true,4294967297));
+-----------------------------------------------------------------------------+
| rb_to_string(rb_select(rb_from_string('4294967297'),100,0,true,4294967297)) |
+-----------------------------------------------------------------------------+
| 4294967297                                                                  |
+-----------------------------------------------------------------------------+
select rb_to_string(rb_select(rb_from_string('4294967297'),100,0,false,4294967296));
+------------------------------------------------------------------------------+
| rb_to_string(rb_select(rb_from_string('4294967297'),100,0,false,4294967296)) |
+------------------------------------------------------------------------------+
| 4294967297                                                                   |
+------------------------------------------------------------------------------+
select rb_to_string(rb_select(rb_from_string('4294967297'),100,0,false,4294967297));
+------------------------------------------------------------------------------+
| rb_to_string(rb_select(rb_from_string('4294967297'),100,0,false,4294967297)) |
+------------------------------------------------------------------------------+
| 4294967297                                                                   |
+------------------------------------------------------------------------------+
select rb_to_string(rb_select(rb_from_string('4294967297'),100,0,false,4294967298));
+------------------------------------------------------------------------------+
| rb_to_string(rb_select(rb_from_string('4294967297'),100,0,false,4294967298)) |
+------------------------------------------------------------------------------+
|                                                                              |
+------------------------------------------------------------------------------+
select rb_to_string(rb_select(rb_from_string('0,3'),100,0,false,0));
+--------------------------------------------------------------+
| rb_to_string(rb_select(rb_from_string('0,3'),100,0,false,0)) |
+--------------------------------------------------------------+
| 0,3                                                          |
+--------------------------------------------------------------+
select rb_to_string(rb_select(rb_from_string('1,3'),100,0,false,2));
+--------------------------------------------------------------+
| rb_to_string(rb_select(rb_from_string('1,3'),100,0,false,2)) |
+--------------------------------------------------------------+
| 3                                                            |
+--------------------------------------------------------------+
select rb_to_string(rb_select(rb_from_string('1,3'),100,0,false,3));
+--------------------------------------------------------------+
| rb_to_string(rb_select(rb_from_string('1,3'),100,0,false,3)) |
+--------------------------------------------------------------+
| 3                                                            |
+--------------------------------------------------------------+
select rb_to_string(rb_select(rb_from_string('1,3'),100,0,false,4));
+--------------------------------------------------------------+
| rb_to_string(rb_select(rb_from_string('1,3'),100,0,false,4)) |
+--------------------------------------------------------------+
|                                                              |
+--------------------------------------------------------------+
select rb_to_string(rb_select(rb_from_string('0,3'),100,0,true,0));
+-------------------------------------------------------------+
| rb_to_string(rb_select(rb_from_string('0,3'),100,0,true,0)) |
+-------------------------------------------------------------+
| 0,3                                                         |
+-------------------------------------------------------------+
bug 2024092000104516141   „Ää[bitmap‰∏âÊúü]rb_select ÈÄÜÊó∂ËæìÂá∫Ôºåoffset ËæìÂÖ•ÂÄºÂíåvaluesÊï∞ÈáèÁõ∏Â∑Æ1Êó∂ÔºåobÊ≤°ÊúâËæìÂá∫ÂÄºÔºåÂ∫îËØ•ËæìÂá∫1‰∏™value„Äã
select rb_to_string(rb_select(rb_from_string('1,3'),100,0,true,2));
+-------------------------------------------------------------+
| rb_to_string(rb_select(rb_from_string('1,3'),100,0,true,2)) |
+-------------------------------------------------------------+
| 3                                                           |
+-------------------------------------------------------------+
bug 2024092000104516141   „Ää[bitmap‰∏âÊúü]rb_select ÈÄÜÊó∂ËæìÂá∫Ôºåoffset ËæìÂÖ•ÂÄºÂíåvaluesÊï∞ÈáèÁõ∏Â∑Æ1Êó∂ÔºåobÊ≤°ÊúâËæìÂá∫ÂÄºÔºåÂ∫îËØ•ËæìÂá∫1‰∏™value„Äã
select rb_to_string(rb_select(rb_from_string('1,3'),100,0,true,3));
+-------------------------------------------------------------+
| rb_to_string(rb_select(rb_from_string('1,3'),100,0,true,3)) |
+-------------------------------------------------------------+
| 3                                                           |
+-------------------------------------------------------------+
select rb_to_string(rb_select(rb_from_string('1,3'),100,0,true,4));
+-------------------------------------------------------------+
| rb_to_string(rb_select(rb_from_string('1,3'),100,0,true,4)) |
+-------------------------------------------------------------+
|                                                             |
+-------------------------------------------------------------+
select rb_to_string(rb_select(rb_from_string('1,2,3,4,5,6,7,8,9,10,11,12,13,14,15,16,17,18,19,20,21,22,23,24,25,26,27,28,29,30,31,32'),100,0,false,30));
+--------------------------------------------------------------------------------------------------------------------------------------------------+
| rb_to_string(rb_select(rb_from_string('1,2,3,4,5,6,7,8,9,10,11,12,13,14,15,16,17,18,19,20,21,22,23,24,25,26,27,28,29,30,31,32'),100,0,false,30)) |
+--------------------------------------------------------------------------------------------------------------------------------------------------+
| 30,31,32                                                                                                                                         |
+--------------------------------------------------------------------------------------------------------------------------------------------------+
select rb_to_string(rb_select(rb_from_string('1,2,3,4,5,6,7,8,9,10,11,12,13,14,15,16,17,18,19,20,21,22,23,24,25,26,27,28,30,31,32'),2,0,false,29));
+---------------------------------------------------------------------------------------------------------------------------------------------+
| rb_to_string(rb_select(rb_from_string('1,2,3,4,5,6,7,8,9,10,11,12,13,14,15,16,17,18,19,20,21,22,23,24,25,26,27,28,30,31,32'),2,0,false,29)) |
+---------------------------------------------------------------------------------------------------------------------------------------------+
| 30,31                                                                                                                                       |
+---------------------------------------------------------------------------------------------------------------------------------------------+
select rb_to_string(rb_select(rb_from_string('1,2,3,4,5,6,7,8,9,10,11,12,13,14,15,16,17,18,19,20,21,22,23,24,25,26,27,28,30,31,32'),2,0,false,32));
+---------------------------------------------------------------------------------------------------------------------------------------------+
| rb_to_string(rb_select(rb_from_string('1,2,3,4,5,6,7,8,9,10,11,12,13,14,15,16,17,18,19,20,21,22,23,24,25,26,27,28,30,31,32'),2,0,false,32)) |
+---------------------------------------------------------------------------------------------------------------------------------------------+
| 32                                                                                                                                          |
+---------------------------------------------------------------------------------------------------------------------------------------------+
select rb_to_string(rb_select(rb_from_string('1,2,3,4,5,6,7,8,9,10,11,12,13,14,15,16,17,18,19,20,21,22,23,24,25,26,27,28,30,31,32'),2,0,false,33));
+---------------------------------------------------------------------------------------------------------------------------------------------+
| rb_to_string(rb_select(rb_from_string('1,2,3,4,5,6,7,8,9,10,11,12,13,14,15,16,17,18,19,20,21,22,23,24,25,26,27,28,30,31,32'),2,0,false,33)) |
+---------------------------------------------------------------------------------------------------------------------------------------------+
|                                                                                                                                             |
+---------------------------------------------------------------------------------------------------------------------------------------------+
bug 2024092000104516141   „Ää[bitmap‰∏âÊúü]rb_select ÈÄÜÊó∂ËæìÂá∫Ôºåoffset ËæìÂÖ•ÂÄºÂíåvaluesÊï∞ÈáèÁõ∏Â∑Æ1Êó∂ÔºåobÊ≤°ÊúâËæìÂá∫ÂÄºÔºåÂ∫îËØ•ËæìÂá∫1‰∏™value„Äã
select rb_to_string(rb_select(rb_from_string('1,2,3,4,5,6,7,8,9,10,11,12,13,14,15,16,17,18,19,20,21,22,23,24,25,26,27,28,30,31,32'),2,0,true,32));
+--------------------------------------------------------------------------------------------------------------------------------------------+
| rb_to_string(rb_select(rb_from_string('1,2,3,4,5,6,7,8,9,10,11,12,13,14,15,16,17,18,19,20,21,22,23,24,25,26,27,28,30,31,32'),2,0,true,32)) |
+--------------------------------------------------------------------------------------------------------------------------------------------+
| 32                                                                                                                                         |
+--------------------------------------------------------------------------------------------------------------------------------------------+
select rb_to_string(rb_select(rb_from_string('1,2,3,4,5,6,7,8,9,10,11,12,13,14,15,16,17,18,19,20,21,22,23,24,25,26,27,28,30,31,32'),2,0,true,26));
+--------------------------------------------------------------------------------------------------------------------------------------------+
| rb_to_string(rb_select(rb_from_string('1,2,3,4,5,6,7,8,9,10,11,12,13,14,15,16,17,18,19,20,21,22,23,24,25,26,27,28,30,31,32'),2,0,true,26)) |
+--------------------------------------------------------------------------------------------------------------------------------------------+
| 31,32                                                                                                                                      |
+--------------------------------------------------------------------------------------------------------------------------------------------+
select rb_to_string(rb_select(rb_from_string('1,2,3,4,5,6,7,8,9,10,11,12,13,14,15,16,17,18,19,20,21,22,23,24,25,26,27,28,29,30,31,32'),100,0,true,30));
+-------------------------------------------------------------------------------------------------------------------------------------------------+
| rb_to_string(rb_select(rb_from_string('1,2,3,4,5,6,7,8,9,10,11,12,13,14,15,16,17,18,19,20,21,22,23,24,25,26,27,28,29,30,31,32'),100,0,true,30)) |
+-------------------------------------------------------------------------------------------------------------------------------------------------+
| 30,31,32                                                                                                                                        |
+-------------------------------------------------------------------------------------------------------------------------------------------------+
select rb_to_string(rb_select(rb_from_string('1,2,3,4,5,6,7,8,9,10,11,12,13,14,15,16,17,18,19,20,21,22,23,24,25,26,27,28,30,31,32'),2,0,true,29));
+--------------------------------------------------------------------------------------------------------------------------------------------+
| rb_to_string(rb_select(rb_from_string('1,2,3,4,5,6,7,8,9,10,11,12,13,14,15,16,17,18,19,20,21,22,23,24,25,26,27,28,30,31,32'),2,0,true,29)) |
+--------------------------------------------------------------------------------------------------------------------------------------------+
| 31,32                                                                                                                                      |
+--------------------------------------------------------------------------------------------------------------------------------------------+
select rb_to_string(rb_select(rb_from_string('1,2,3,4,5,6,7,8,9,10,11,12,13,14,15,16,17,18,19,20,21,22,23,24,25,26,27,28,30,31,32'),2,0,true,33));
+--------------------------------------------------------------------------------------------------------------------------------------------+
| rb_to_string(rb_select(rb_from_string('1,2,3,4,5,6,7,8,9,10,11,12,13,14,15,16,17,18,19,20,21,22,23,24,25,26,27,28,30,31,32'),2,0,true,33)) |
+--------------------------------------------------------------------------------------------------------------------------------------------+
|                                                                                                                                            |
+--------------------------------------------------------------------------------------------------------------------------------------------+
select rb_to_string(rb_select(rb_from_string('1,2,3,4,5,6,7,8,9,10,11,12,13,14,15,16,17,18,19,20,21,22,23,24,25,26,27,28,29,30,31,4294967295'),100,0,false,3));
+---------------------------------------------------------------------------------------------------------------------------------------------------------+
| rb_to_string(rb_select(rb_from_string('1,2,3,4,5,6,7,8,9,10,11,12,13,14,15,16,17,18,19,20,21,22,23,24,25,26,27,28,29,30,31,4294967295'),100,0,false,3)) |
+---------------------------------------------------------------------------------------------------------------------------------------------------------+
| 3,4,5,6,7,8,9,10,11,12,13,14,15,16,17,18,19,20,21,22,23,24,25,26,27,28,29,30,31,4294967295                                                              |
+---------------------------------------------------------------------------------------------------------------------------------------------------------+
select rb_to_string(rb_select(rb_from_string('1,2,3,4,5,6,7,8,9,10,11,12,13,14,15,16,17,18,19,20,21,22,23,24,25,26,27,28,30,31,4294967295'),2,0,false,5));
+----------------------------------------------------------------------------------------------------------------------------------------------------+
| rb_to_string(rb_select(rb_from_string('1,2,3,4,5,6,7,8,9,10,11,12,13,14,15,16,17,18,19,20,21,22,23,24,25,26,27,28,30,31,4294967295'),2,0,false,5)) |
+----------------------------------------------------------------------------------------------------------------------------------------------------+
| 5,6                                                                                                                                                |
+----------------------------------------------------------------------------------------------------------------------------------------------------+
select rb_to_string(rb_select(rb_from_string('1,2,3,4,5,6,7,8,9,10,11,12,13,14,15,16,17,18,19,20,21,22,23,24,25,26,27,28,30,31,4294967295'),2,0,false,4294967295));
+-------------------------------------------------------------------------------------------------------------------------------------------------------------+
| rb_to_string(rb_select(rb_from_string('1,2,3,4,5,6,7,8,9,10,11,12,13,14,15,16,17,18,19,20,21,22,23,24,25,26,27,28,30,31,4294967295'),2,0,false,4294967295)) |
+-------------------------------------------------------------------------------------------------------------------------------------------------------------+
| 4294967295                                                                                                                                                  |
+-------------------------------------------------------------------------------------------------------------------------------------------------------------+
select rb_to_string(rb_select(rb_from_string('1,2,3,4,5,6,7,8,9,10,11,12,13,14,15,16,17,18,19,20,21,22,23,24,25,26,27,28,30,31,4294967295'),2,0,false,4294967296));
+-------------------------------------------------------------------------------------------------------------------------------------------------------------+
| rb_to_string(rb_select(rb_from_string('1,2,3,4,5,6,7,8,9,10,11,12,13,14,15,16,17,18,19,20,21,22,23,24,25,26,27,28,30,31,4294967295'),2,0,false,4294967296)) |
+-------------------------------------------------------------------------------------------------------------------------------------------------------------+
|                                                                                                                                                             |
+-------------------------------------------------------------------------------------------------------------------------------------------------------------+
select rb_to_string(rb_select(rb_from_string('1,2,3,4,5,6,7,8,9,10,11,12,13,14,15,16,17,18,19,20,21,22,23,24,25,26,27,28,29,30,31,4294967296'),100,0,true,30));
+---------------------------------------------------------------------------------------------------------------------------------------------------------+
| rb_to_string(rb_select(rb_from_string('1,2,3,4,5,6,7,8,9,10,11,12,13,14,15,16,17,18,19,20,21,22,23,24,25,26,27,28,29,30,31,4294967296'),100,0,true,30)) |
+---------------------------------------------------------------------------------------------------------------------------------------------------------+
| 30,31,4294967296                                                                                                                                        |
+---------------------------------------------------------------------------------------------------------------------------------------------------------+
select rb_to_string(rb_select(rb_from_string('1,2,3,4,5,6,7,8,9,10,11,12,13,14,15,16,17,18,19,20,21,22,23,24,25,26,27,28,30,31,4294967296'),4,0,true,29));
+----------------------------------------------------------------------------------------------------------------------------------------------------+
| rb_to_string(rb_select(rb_from_string('1,2,3,4,5,6,7,8,9,10,11,12,13,14,15,16,17,18,19,20,21,22,23,24,25,26,27,28,30,31,4294967296'),4,0,true,29)) |
+----------------------------------------------------------------------------------------------------------------------------------------------------+
| 30,31,4294967296                                                                                                                                   |
+----------------------------------------------------------------------------------------------------------------------------------------------------+
bug 2024092000104516141   „Ää[bitmap‰∏âÊúü]rb_select ÈÄÜÊó∂ËæìÂá∫Ôºåoffset ËæìÂÖ•ÂÄºÂíåvaluesÊï∞ÈáèÁõ∏Â∑Æ1Êó∂ÔºåobÊ≤°ÊúâËæìÂá∫ÂÄºÔºåÂ∫îËØ•ËæìÂá∫1‰∏™value„Äã
select rb_to_string(rb_select(rb_from_string('1,2,3,4,5,6,7,8,9,10,11,12,13,14,15,16,17,18,19,20,21,22,23,24,25,26,27,28,30,31,4294967296'),4,0,true,4294967296));
+------------------------------------------------------------------------------------------------------------------------------------------------------------+
| rb_to_string(rb_select(rb_from_string('1,2,3,4,5,6,7,8,9,10,11,12,13,14,15,16,17,18,19,20,21,22,23,24,25,26,27,28,30,31,4294967296'),4,0,true,4294967296)) |
+------------------------------------------------------------------------------------------------------------------------------------------------------------+
| 4294967296                                                                                                                                                 |
+------------------------------------------------------------------------------------------------------------------------------------------------------------+
select rb_to_string(rb_select(rb_from_string('1,2,3,4,5,6,7,8,9,10,11,12,13,14,15,16,17,18,19,20,21,22,23,24,25,26,27,28,30,31,4294967296'),2,0,true,4294967297));
+------------------------------------------------------------------------------------------------------------------------------------------------------------+
| rb_to_string(rb_select(rb_from_string('1,2,3,4,5,6,7,8,9,10,11,12,13,14,15,16,17,18,19,20,21,22,23,24,25,26,27,28,30,31,4294967296'),2,0,true,4294967297)) |
+------------------------------------------------------------------------------------------------------------------------------------------------------------+
|                                                                                                                                                            |
+------------------------------------------------------------------------------------------------------------------------------------------------------------+
select rb_to_string(rb_select(rb_from_string('1,2,3,4,5,6,7,8,9,10,11,12,13,14,15,16,17,18,19,20,21,22,23,24,25,26,27,28,29,30,31,4294967295,0'),100,0,false,3));
+-----------------------------------------------------------------------------------------------------------------------------------------------------------+
| rb_to_string(rb_select(rb_from_string('1,2,3,4,5,6,7,8,9,10,11,12,13,14,15,16,17,18,19,20,21,22,23,24,25,26,27,28,29,30,31,4294967295,0'),100,0,false,3)) |
+-----------------------------------------------------------------------------------------------------------------------------------------------------------+
| 3,4,5,6,7,8,9,10,11,12,13,14,15,16,17,18,19,20,21,22,23,24,25,26,27,28,29,30,31,4294967295                                                                |
+-----------------------------------------------------------------------------------------------------------------------------------------------------------+
select rb_to_string(rb_select(rb_from_string('1,2,3,4,5,6,7,8,9,10,11,12,13,14,15,16,17,18,19,20,21,22,23,24,25,26,27,28,30,31,4294967295,0,50'),2,0,false,5));
+---------------------------------------------------------------------------------------------------------------------------------------------------------+
| rb_to_string(rb_select(rb_from_string('1,2,3,4,5,6,7,8,9,10,11,12,13,14,15,16,17,18,19,20,21,22,23,24,25,26,27,28,30,31,4294967295,0,50'),2,0,false,5)) |
+---------------------------------------------------------------------------------------------------------------------------------------------------------+
| 5,6                                                                                                                                                     |
+---------------------------------------------------------------------------------------------------------------------------------------------------------+
select rb_to_string(rb_select(rb_from_string('1,2,3,4,5,6,7,8,9,10,11,12,13,14,15,16,17,18,19,20,21,22,23,24,25,26,27,28,30,31,4294967295,0,50'),2,0,false,4294967295));
+------------------------------------------------------------------------------------------------------------------------------------------------------------------+
| rb_to_string(rb_select(rb_from_string('1,2,3,4,5,6,7,8,9,10,11,12,13,14,15,16,17,18,19,20,21,22,23,24,25,26,27,28,30,31,4294967295,0,50'),2,0,false,4294967295)) |
+------------------------------------------------------------------------------------------------------------------------------------------------------------------+
| 4294967295                                                                                                                                                       |
+------------------------------------------------------------------------------------------------------------------------------------------------------------------+
select rb_to_string(rb_select(rb_from_string('1,2,3,4,5,6,7,8,9,10,11,12,13,14,15,16,17,18,19,20,21,22,23,24,25,26,27,28,30,31,4294967295,0,50'),2,0,false,4294967296));
+------------------------------------------------------------------------------------------------------------------------------------------------------------------+
| rb_to_string(rb_select(rb_from_string('1,2,3,4,5,6,7,8,9,10,11,12,13,14,15,16,17,18,19,20,21,22,23,24,25,26,27,28,30,31,4294967295,0,50'),2,0,false,4294967296)) |
+------------------------------------------------------------------------------------------------------------------------------------------------------------------+
|                                                                                                                                                                  |
+------------------------------------------------------------------------------------------------------------------------------------------------------------------+
select rb_to_string(rb_select(rb_from_string('1,2,3,4,5,6,7,8,9,10,11,12,13,14,15,16,17,18,19,20,21,22,23,24,25,26,27,28,29,30,31,4294967295,0,50'),100,0,true,30));
+--------------------------------------------------------------------------------------------------------------------------------------------------------------+
| rb_to_string(rb_select(rb_from_string('1,2,3,4,5,6,7,8,9,10,11,12,13,14,15,16,17,18,19,20,21,22,23,24,25,26,27,28,29,30,31,4294967295,0,50'),100,0,true,30)) |
+--------------------------------------------------------------------------------------------------------------------------------------------------------------+
| 30,31,50,4294967295                                                                                                                                          |
+--------------------------------------------------------------------------------------------------------------------------------------------------------------+
select rb_to_string(rb_select(rb_from_string('1,2,3,4,5,6,7,8,9,10,11,12,13,14,15,16,17,18,19,20,21,22,23,24,25,26,27,28,30,31,4294967295,0,50'),4,0,true,29));
+---------------------------------------------------------------------------------------------------------------------------------------------------------+
| rb_to_string(rb_select(rb_from_string('1,2,3,4,5,6,7,8,9,10,11,12,13,14,15,16,17,18,19,20,21,22,23,24,25,26,27,28,30,31,4294967295,0,50'),4,0,true,29)) |
+---------------------------------------------------------------------------------------------------------------------------------------------------------+
| 30,31,50,4294967295                                                                                                                                     |
+---------------------------------------------------------------------------------------------------------------------------------------------------------+
bug 2024092000104516141   „Ää[bitmap‰∏âÊúü]rb_select ÈÄÜÊó∂ËæìÂá∫Ôºåoffset ËæìÂÖ•ÂÄºÂíåvaluesÊï∞ÈáèÁõ∏Â∑Æ1Êó∂ÔºåobÊ≤°ÊúâËæìÂá∫ÂÄºÔºåÂ∫îËØ•ËæìÂá∫1‰∏™value„Äã
select rb_to_string(rb_select(rb_from_string('1,2,3,4,5,6,7,8,9,10,11,12,13,14,15,16,17,18,19,20,21,22,23,24,25,26,27,28,30,31,4294967295,0,50'),4,0,true,4294967295));
+-----------------------------------------------------------------------------------------------------------------------------------------------------------------+
| rb_to_string(rb_select(rb_from_string('1,2,3,4,5,6,7,8,9,10,11,12,13,14,15,16,17,18,19,20,21,22,23,24,25,26,27,28,30,31,4294967295,0,50'),4,0,true,4294967295)) |
+-----------------------------------------------------------------------------------------------------------------------------------------------------------------+
| 4294967295                                                                                                                                                      |
+-----------------------------------------------------------------------------------------------------------------------------------------------------------------+
select rb_to_string(rb_select(rb_from_string('1,2,3,4,5,6,7,8,9,10,11,12,13,14,15,16,17,18,19,20,21,22,23,24,25,26,27,28,30,31,4294967295,0,50'),2,0,true,4294967296));
+-----------------------------------------------------------------------------------------------------------------------------------------------------------------+
| rb_to_string(rb_select(rb_from_string('1,2,3,4,5,6,7,8,9,10,11,12,13,14,15,16,17,18,19,20,21,22,23,24,25,26,27,28,30,31,4294967295,0,50'),2,0,true,4294967296)) |
+-----------------------------------------------------------------------------------------------------------------------------------------------------------------+
|                                                                                                                                                                 |
+-----------------------------------------------------------------------------------------------------------------------------------------------------------------+
select rb_to_string(rb_select(rb_from_string('1,2,3,4,5,6,7,8,9,10,11,12,13,14,15,16,17,18,19,20,21,22,23,24,25,26,27,28,29,30,31,4294967297,0'),100,0,false,3));
+-----------------------------------------------------------------------------------------------------------------------------------------------------------+
| rb_to_string(rb_select(rb_from_string('1,2,3,4,5,6,7,8,9,10,11,12,13,14,15,16,17,18,19,20,21,22,23,24,25,26,27,28,29,30,31,4294967297,0'),100,0,false,3)) |
+-----------------------------------------------------------------------------------------------------------------------------------------------------------+
| 3,4,5,6,7,8,9,10,11,12,13,14,15,16,17,18,19,20,21,22,23,24,25,26,27,28,29,30,31,4294967297                                                                |
+-----------------------------------------------------------------------------------------------------------------------------------------------------------+
select rb_to_string(rb_select(rb_from_string('1,2,3,4,5,6,7,8,9,10,11,12,13,14,15,16,17,18,19,20,21,22,23,24,25,26,27,28,30,31,4294967297,0,50'),2,0,false,5));
+---------------------------------------------------------------------------------------------------------------------------------------------------------+
| rb_to_string(rb_select(rb_from_string('1,2,3,4,5,6,7,8,9,10,11,12,13,14,15,16,17,18,19,20,21,22,23,24,25,26,27,28,30,31,4294967297,0,50'),2,0,false,5)) |
+---------------------------------------------------------------------------------------------------------------------------------------------------------+
| 5,6                                                                                                                                                     |
+---------------------------------------------------------------------------------------------------------------------------------------------------------+
select rb_to_string(rb_select(rb_from_string('1,2,3,4,5,6,7,8,9,10,11,12,13,14,15,16,17,18,19,20,21,22,23,24,25,26,27,28,30,31,4294967297,0,50'),2,0,false,4294967297));
+------------------------------------------------------------------------------------------------------------------------------------------------------------------+
| rb_to_string(rb_select(rb_from_string('1,2,3,4,5,6,7,8,9,10,11,12,13,14,15,16,17,18,19,20,21,22,23,24,25,26,27,28,30,31,4294967297,0,50'),2,0,false,4294967297)) |
+------------------------------------------------------------------------------------------------------------------------------------------------------------------+
| 4294967297                                                                                                                                                       |
+------------------------------------------------------------------------------------------------------------------------------------------------------------------+
select rb_to_string(rb_select(rb_from_string('1,2,3,4,5,6,7,8,9,10,11,12,13,14,15,16,17,18,19,20,21,22,23,24,25,26,27,28,30,31,4294967297,0,50'),2,0,false,4294967298));
+------------------------------------------------------------------------------------------------------------------------------------------------------------------+
| rb_to_string(rb_select(rb_from_string('1,2,3,4,5,6,7,8,9,10,11,12,13,14,15,16,17,18,19,20,21,22,23,24,25,26,27,28,30,31,4294967297,0,50'),2,0,false,4294967298)) |
+------------------------------------------------------------------------------------------------------------------------------------------------------------------+
|                                                                                                                                                                  |
+------------------------------------------------------------------------------------------------------------------------------------------------------------------+
select rb_to_string(rb_select(rb_from_string('1,2,3,4,5,6,7,8,9,10,11,12,13,14,15,16,17,18,19,20,21,22,23,24,25,26,27,28,29,30,31,42949672951,0,50'),100,0,true,30));
+---------------------------------------------------------------------------------------------------------------------------------------------------------------+
| rb_to_string(rb_select(rb_from_string('1,2,3,4,5,6,7,8,9,10,11,12,13,14,15,16,17,18,19,20,21,22,23,24,25,26,27,28,29,30,31,42949672951,0,50'),100,0,true,30)) |
+---------------------------------------------------------------------------------------------------------------------------------------------------------------+
| 30,31,50,42949672951                                                                                                                                          |
+---------------------------------------------------------------------------------------------------------------------------------------------------------------+
select rb_to_string(rb_select(rb_from_string('1,2,3,4,5,6,7,8,9,10,11,12,13,14,15,16,17,18,19,20,21,22,23,24,25,26,27,28,30,31,42949672951,0,50'),4,0,true,29));
+----------------------------------------------------------------------------------------------------------------------------------------------------------+
| rb_to_string(rb_select(rb_from_string('1,2,3,4,5,6,7,8,9,10,11,12,13,14,15,16,17,18,19,20,21,22,23,24,25,26,27,28,30,31,42949672951,0,50'),4,0,true,29)) |
+----------------------------------------------------------------------------------------------------------------------------------------------------------+
| 30,31,50,42949672951                                                                                                                                     |
+----------------------------------------------------------------------------------------------------------------------------------------------------------+
bug 2024092000104516141   „Ää[bitmap‰∏âÊúü]rb_select ÈÄÜÊó∂ËæìÂá∫Ôºåoffset ËæìÂÖ•ÂÄºÂíåvaluesÊï∞ÈáèÁõ∏Â∑Æ1Êó∂ÔºåobÊ≤°ÊúâËæìÂá∫ÂÄºÔºåÂ∫îËØ•ËæìÂá∫1‰∏™value„Äã
select rb_to_string(rb_select(rb_from_string('1,2,3,4,5,6,7,8,9,10,11,12,13,14,15,16,17,18,19,20,21,22,23,24,25,26,27,28,30,31,42949672951,0,50'),4,0,true,42949672951));
+-------------------------------------------------------------------------------------------------------------------------------------------------------------------+
| rb_to_string(rb_select(rb_from_string('1,2,3,4,5,6,7,8,9,10,11,12,13,14,15,16,17,18,19,20,21,22,23,24,25,26,27,28,30,31,42949672951,0,50'),4,0,true,42949672951)) |
+-------------------------------------------------------------------------------------------------------------------------------------------------------------------+
| 42949672951                                                                                                                                                       |
+-------------------------------------------------------------------------------------------------------------------------------------------------------------------+
select rb_to_string(rb_select(rb_from_string('1,2,3,4,5,6,7,8,9,10,11,12,13,14,15,16,17,18,19,20,21,22,23,24,25,26,27,28,30,31,42949672951,0,50'),2,0,true,42949672961));
+-------------------------------------------------------------------------------------------------------------------------------------------------------------------+
| rb_to_string(rb_select(rb_from_string('1,2,3,4,5,6,7,8,9,10,11,12,13,14,15,16,17,18,19,20,21,22,23,24,25,26,27,28,30,31,42949672951,0,50'),2,0,true,42949672961)) |
+-------------------------------------------------------------------------------------------------------------------------------------------------------------------+
|                                                                                                                                                                   |
+-------------------------------------------------------------------------------------------------------------------------------------------------------------------+
select rb_to_string(rb_select(rb_from_string('1,2,3,4,5,6,7,8,9,10,11,12,13,14,15,16,17,18,19,20,21,22,23,24,25,26,27,28,29,30,31,4294967297,0'),100,0,false,3,3));
+-------------------------------------------------------------------------------------------------------------------------------------------------------------+
| rb_to_string(rb_select(rb_from_string('1,2,3,4,5,6,7,8,9,10,11,12,13,14,15,16,17,18,19,20,21,22,23,24,25,26,27,28,29,30,31,4294967297,0'),100,0,false,3,3)) |
+-------------------------------------------------------------------------------------------------------------------------------------------------------------+
|                                                                                                                                                             |
+-------------------------------------------------------------------------------------------------------------------------------------------------------------+
select rb_to_string(rb_select(rb_from_string('1,2,3,4,5,6,7,8,9,10,11,12,13,14,15,16,17,18,19,20,21,22,23,24,25,26,27,28,29,30,31,4294967297,0'),100,0,true,3,2));
+------------------------------------------------------------------------------------------------------------------------------------------------------------+
| rb_to_string(rb_select(rb_from_string('1,2,3,4,5,6,7,8,9,10,11,12,13,14,15,16,17,18,19,20,21,22,23,24,25,26,27,28,29,30,31,4294967297,0'),100,0,true,3,2)) |
+------------------------------------------------------------------------------------------------------------------------------------------------------------+
|                                                                                                                                                            |
+------------------------------------------------------------------------------------------------------------------------------------------------------------+
select rb_to_string(rb_select(rb_from_string('1,2,3,4,5,6,7,8,9,10,11,12,13,14,15,16,17,18,19,20,21,22,23,24,25,26,27,28,29,30,31,4294967297,0'),100,0,false,'3'));
+-------------------------------------------------------------------------------------------------------------------------------------------------------------+
| rb_to_string(rb_select(rb_from_string('1,2,3,4,5,6,7,8,9,10,11,12,13,14,15,16,17,18,19,20,21,22,23,24,25,26,27,28,29,30,31,4294967297,0'),100,0,false,'3')) |
+-------------------------------------------------------------------------------------------------------------------------------------------------------------+
| 3,4,5,6,7,8,9,10,11,12,13,14,15,16,17,18,19,20,21,22,23,24,25,26,27,28,29,30,31,4294967297                                                                  |
+-------------------------------------------------------------------------------------------------------------------------------------------------------------+
select rb_to_string(rb_select(rb_from_string('1,2,3,4,5,6,7,8,9,10,11,12,13,14,15,16,17,18,19,20,21,22,23,24,25,26,27,28,29,30,31,4294967297,0'),100,0,false,3.0));
ERROR HY000: invalid type given for an argument
select rb_to_string(rb_select(rb_from_string('1,2,3,4,5,6,7,8,9,10,11,12,13,14,15,16,17,18,19,20,21,22,23,24,25,26,27,28,29,30,31,4294967297,0'),100,0,false,'test'));
ERROR 22007: Incorrect value
select rb_to_string(rb_select(rb_from_string('1,2,3,4,5,6,7,8,9,10,11,12,13,14,15,16,17,18,19,20,21,22,23,24,25,26,27,28,29,30,31,4294967297,0'),100,0,false,''));
ERROR 22007: Incorrect value
select rb_to_string(rb_select(rb_from_string('1,2,3,4,5,6,7,8,9,10,11,12,13,14,15,16,17,18,19,20,21,22,23,24,25,26,27,28,29,30,31,4294967297,0'),100,0,false,true));
ERROR HY000: invalid type given for an argument
select rb_to_string(rb_select(rb_from_string('1,2,3,4,5,6,7,8,9,10,11,12,13,14,15,16,17,18,19,20,21,22,23,24,25,26,27,28,29,30,31,4294967297,0'),100,0,false,false));
ERROR HY000: invalid type given for an argument
select rb_to_string(rb_select(rb_from_string('1,2,3,4,5,6,7,8,9,10,11,12,13,14,15,16,17,18,19,20,21,22,23,24,25,26,27,28,29,30,31,4294967297,0'),100,0,false,null));
+--------------------------------------------------------------------------------------------------------------------------------------------------------------+
| rb_to_string(rb_select(rb_from_string('1,2,3,4,5,6,7,8,9,10,11,12,13,14,15,16,17,18,19,20,21,22,23,24,25,26,27,28,29,30,31,4294967297,0'),100,0,false,null)) |
+--------------------------------------------------------------------------------------------------------------------------------------------------------------+
| NULL                                                                                                                                                         |
+--------------------------------------------------------------------------------------------------------------------------------------------------------------+
select rb_to_string(rb_select(rb_from_string('1,2,3,4,5,6,7,8,9,10,11,12,13,14,15,16,17,18,19,20,21,22,23,24,25,26,27,28,29,30,31,4294967297,0'),100,0,false,18446744073709551616));
ERROR HY000: invalid type given for an argument
select rb_to_string(rb_select(rb_from_string('1,2,3,4,5,6,7,8,9,10,11,12,13,14,15,16,17,18,19,20,21,22,23,24,25,26,27,28,29,30,31,4294967297,0'),100,0,false,18446744073709551615));
+------------------------------------------------------------------------------------------------------------------------------------------------------------------------------+
| rb_to_string(rb_select(rb_from_string('1,2,3,4,5,6,7,8,9,10,11,12,13,14,15,16,17,18,19,20,21,22,23,24,25,26,27,28,29,30,31,4294967297,0'),100,0,false,18446744073709551615)) |
+------------------------------------------------------------------------------------------------------------------------------------------------------------------------------+
|                                                                                                                                                                              |
+------------------------------------------------------------------------------------------------------------------------------------------------------------------------------+
select rb_to_string(rb_select(rb_from_string('1,2,3,4,5,6,7,8,9,10,11,12,13,14,15,16,17,18,19,20,21,22,23,24,25,26,27,28,29,30,31,4294967297,0,18446744073709551615'),100,0,false,18446744073709551615));
+---------------------------------------------------------------------------------------------------------------------------------------------------------------------------------------------------+
| rb_to_string(rb_select(rb_from_string('1,2,3,4,5,6,7,8,9,10,11,12,13,14,15,16,17,18,19,20,21,22,23,24,25,26,27,28,29,30,31,4294967297,0,18446744073709551615'),100,0,false,18446744073709551615)) |
+---------------------------------------------------------------------------------------------------------------------------------------------------------------------------------------------------+
| 18446744073709551615                                                                                                                                                                              |
+---------------------------------------------------------------------------------------------------------------------------------------------------------------------------------------------------+
select rb_to_string(rb_select(rb_from_string('1,2,3,4,5,6,7,8,9,10,11,12,13,14,15,16,17,18,19,20,21,22,23,24,25,26,27,28,29,30,31,4294967297,0,18446744073709551615'),100,0,false,18446744073709551615,18446744073709551615));
+------------------------------------------------------------------------------------------------------------------------------------------------------------------------------------------------------------------------+
| rb_to_string(rb_select(rb_from_string('1,2,3,4,5,6,7,8,9,10,11,12,13,14,15,16,17,18,19,20,21,22,23,24,25,26,27,28,29,30,31,4294967297,0,18446744073709551615'),100,0,false,18446744073709551615,18446744073709551615)) |
+------------------------------------------------------------------------------------------------------------------------------------------------------------------------------------------------------------------------+
|                                                                                                                                                                                                                        |
+------------------------------------------------------------------------------------------------------------------------------------------------------------------------------------------------------------------------+
bug 2024092000104516141   „Ää[bitmap‰∏âÊúü]rb_select ÈÄÜÊó∂ËæìÂá∫Ôºåoffset ËæìÂÖ•ÂÄºÂíåvaluesÊï∞ÈáèÁõ∏Â∑Æ1Êó∂ÔºåobÊ≤°ÊúâËæìÂá∫ÂÄºÔºåÂ∫îËØ•ËæìÂá∫1‰∏™value„Äã
select rb_to_string(rb_select(rb_from_string('1,2,3,4,5,6,7,8,9,10,11,12,13,14,15,16,17,18,19,20,21,22,23,24,25,26,27,28,29,30,31,4294967297,0,18446744073709551615'),100,0,true,18446744073709551615));
+--------------------------------------------------------------------------------------------------------------------------------------------------------------------------------------------------+
| rb_to_string(rb_select(rb_from_string('1,2,3,4,5,6,7,8,9,10,11,12,13,14,15,16,17,18,19,20,21,22,23,24,25,26,27,28,29,30,31,4294967297,0,18446744073709551615'),100,0,true,18446744073709551615)) |
+--------------------------------------------------------------------------------------------------------------------------------------------------------------------------------------------------+
| 18446744073709551615                                                                                                                                                                             |
+--------------------------------------------------------------------------------------------------------------------------------------------------------------------------------------------------+
select rb_to_string(rb_select(rb_build_empty(),10,0,true,0,1));
+---------------------------------------------------------+
| rb_to_string(rb_select(rb_build_empty(),10,0,true,0,1)) |
+---------------------------------------------------------+
|                                                         |
+---------------------------------------------------------+
select rb_to_string(rb_select(rb_build_empty(),10,0,false,0));
+--------------------------------------------------------+
| rb_to_string(rb_select(rb_build_empty(),10,0,false,0)) |
+--------------------------------------------------------+
|                                                        |
+--------------------------------------------------------+
select rb_to_string(rb_select(rb_from_string('4294967295'),100,0,false,1,4294967295));
+--------------------------------------------------------------------------------+
| rb_to_string(rb_select(rb_from_string('4294967295'),100,0,false,1,4294967295)) |
+--------------------------------------------------------------------------------+
|                                                                                |
+--------------------------------------------------------------------------------+
select rb_to_string(rb_select(rb_from_string('4294967295'),100,0,false,1,4294967294));
+--------------------------------------------------------------------------------+
| rb_to_string(rb_select(rb_from_string('4294967295'),100,0,false,1,4294967294)) |
+--------------------------------------------------------------------------------+
|                                                                                |
+--------------------------------------------------------------------------------+
select rb_to_string(rb_select(rb_from_string('4294967295'),100,0,false,1,4294967296));
+--------------------------------------------------------------------------------+
| rb_to_string(rb_select(rb_from_string('4294967295'),100,0,false,1,4294967296)) |
+--------------------------------------------------------------------------------+
| 4294967295                                                                     |
+--------------------------------------------------------------------------------+
select rb_to_string(rb_select(rb_from_string('4294967295'),100,0,true,1,4294967295));
+-------------------------------------------------------------------------------+
| rb_to_string(rb_select(rb_from_string('4294967295'),100,0,true,1,4294967295)) |
+-------------------------------------------------------------------------------+
|                                                                               |
+-------------------------------------------------------------------------------+
select rb_to_string(rb_select(rb_from_string('4294967295'),100,0,true,1,4294967294));
+-------------------------------------------------------------------------------+
| rb_to_string(rb_select(rb_from_string('4294967295'),100,0,true,1,4294967294)) |
+-------------------------------------------------------------------------------+
|                                                                               |
+-------------------------------------------------------------------------------+
select rb_to_string(rb_select(rb_from_string('4294967295'),100,0,true,1,4294967296));
+-------------------------------------------------------------------------------+
| rb_to_string(rb_select(rb_from_string('4294967295'),100,0,true,1,4294967296)) |
+-------------------------------------------------------------------------------+
| 4294967295                                                                    |
+-------------------------------------------------------------------------------+
select rb_to_string(rb_select(rb_from_string('4294967297'),100,0,false,1,4294967297));
+--------------------------------------------------------------------------------+
| rb_to_string(rb_select(rb_from_string('4294967297'),100,0,false,1,4294967297)) |
+--------------------------------------------------------------------------------+
|                                                                                |
+--------------------------------------------------------------------------------+
select rb_to_string(rb_select(rb_from_string('4294967297'),100,0,false,1,4294967296));
+--------------------------------------------------------------------------------+
| rb_to_string(rb_select(rb_from_string('4294967297'),100,0,false,1,4294967296)) |
+--------------------------------------------------------------------------------+
|                                                                                |
+--------------------------------------------------------------------------------+
select rb_to_string(rb_select(rb_from_string('4294967297'),100,0,false,1,4294967298));
+--------------------------------------------------------------------------------+
| rb_to_string(rb_select(rb_from_string('4294967297'),100,0,false,1,4294967298)) |
+--------------------------------------------------------------------------------+
| 4294967297                                                                     |
+--------------------------------------------------------------------------------+
select rb_to_string(rb_select(rb_from_string('4294967297'),100,0,true,1,4294967297));
+-------------------------------------------------------------------------------+
| rb_to_string(rb_select(rb_from_string('4294967297'),100,0,true,1,4294967297)) |
+-------------------------------------------------------------------------------+
|                                                                               |
+-------------------------------------------------------------------------------+
select rb_to_string(rb_select(rb_from_string('4294967297'),100,0,true,1,4294967296));
+-------------------------------------------------------------------------------+
| rb_to_string(rb_select(rb_from_string('4294967297'),100,0,true,1,4294967296)) |
+-------------------------------------------------------------------------------+
|                                                                               |
+-------------------------------------------------------------------------------+
select rb_to_string(rb_select(rb_from_string('4294967297'),100,0,true,4294967297,4294967298));
+----------------------------------------------------------------------------------------+
| rb_to_string(rb_select(rb_from_string('4294967297'),100,0,true,4294967297,4294967298)) |
+----------------------------------------------------------------------------------------+
| 4294967297                                                                             |
+----------------------------------------------------------------------------------------+
select rb_to_string(rb_select(rb_from_string('4294967297'),100,1,true,1,4294967298));
+-------------------------------------------------------------------------------+
| rb_to_string(rb_select(rb_from_string('4294967297'),100,1,true,1,4294967298)) |
+-------------------------------------------------------------------------------+
|                                                                               |
+-------------------------------------------------------------------------------+
select rb_to_string(rb_select(rb_from_string('1,4294967295'),100,0,false,1,4294967295));
+----------------------------------------------------------------------------------+
| rb_to_string(rb_select(rb_from_string('1,4294967295'),100,0,false,1,4294967295)) |
+----------------------------------------------------------------------------------+
| 1                                                                                |
+----------------------------------------------------------------------------------+
select rb_to_string(rb_select(rb_from_string('1,4294967295'),100,0,false,1,4294967294));
+----------------------------------------------------------------------------------+
| rb_to_string(rb_select(rb_from_string('1,4294967295'),100,0,false,1,4294967294)) |
+----------------------------------------------------------------------------------+
| 1                                                                                |
+----------------------------------------------------------------------------------+
select rb_to_string(rb_select(rb_from_string('1,4294967295'),100,0,false,1,4294967296));
+----------------------------------------------------------------------------------+
| rb_to_string(rb_select(rb_from_string('1,4294967295'),100,0,false,1,4294967296)) |
+----------------------------------------------------------------------------------+
| 1,4294967295                                                                     |
+----------------------------------------------------------------------------------+
select rb_to_string(rb_select(rb_from_string('1,4294967295'),100,0,true,1,4294967295));
+---------------------------------------------------------------------------------+
| rb_to_string(rb_select(rb_from_string('1,4294967295'),100,0,true,1,4294967295)) |
+---------------------------------------------------------------------------------+
| 1                                                                               |
+---------------------------------------------------------------------------------+
select rb_to_string(rb_select(rb_from_string('1,4294967295'),100,0,true,1,4294967294));
+---------------------------------------------------------------------------------+
| rb_to_string(rb_select(rb_from_string('1,4294967295'),100,0,true,1,4294967294)) |
+---------------------------------------------------------------------------------+
| 1                                                                               |
+---------------------------------------------------------------------------------+
select rb_to_string(rb_select(rb_from_string('1,4294967295'),100,0,true,1,4294967296));
+---------------------------------------------------------------------------------+
| rb_to_string(rb_select(rb_from_string('1,4294967295'),100,0,true,1,4294967296)) |
+---------------------------------------------------------------------------------+
| 1,4294967295                                                                    |
+---------------------------------------------------------------------------------+
select rb_to_string(rb_select(rb_from_string('1,4294967297'),100,0,false,1,4294967297));
+----------------------------------------------------------------------------------+
| rb_to_string(rb_select(rb_from_string('1,4294967297'),100,0,false,1,4294967297)) |
+----------------------------------------------------------------------------------+
| 1                                                                                |
+----------------------------------------------------------------------------------+
select rb_to_string(rb_select(rb_from_string('1,4294967297'),100,0,false,1,4294967296));
+----------------------------------------------------------------------------------+
| rb_to_string(rb_select(rb_from_string('1,4294967297'),100,0,false,1,4294967296)) |
+----------------------------------------------------------------------------------+
| 1                                                                                |
+----------------------------------------------------------------------------------+
select rb_to_string(rb_select(rb_from_string('1,4294967297'),100,0,false,1,4294967298));
+----------------------------------------------------------------------------------+
| rb_to_string(rb_select(rb_from_string('1,4294967297'),100,0,false,1,4294967298)) |
+----------------------------------------------------------------------------------+
| 1,4294967297                                                                     |
+----------------------------------------------------------------------------------+
select rb_to_string(rb_select(rb_from_string('1,4294967297'),100,0,true,1,4294967297));
+---------------------------------------------------------------------------------+
| rb_to_string(rb_select(rb_from_string('1,4294967297'),100,0,true,1,4294967297)) |
+---------------------------------------------------------------------------------+
| 1                                                                               |
+---------------------------------------------------------------------------------+
select rb_to_string(rb_select(rb_from_string('1,4294967297'),100,0,true,1,4294967296));
+---------------------------------------------------------------------------------+
| rb_to_string(rb_select(rb_from_string('1,4294967297'),100,0,true,1,4294967296)) |
+---------------------------------------------------------------------------------+
| 1                                                                               |
+---------------------------------------------------------------------------------+
bug 2024092000104516141   „Ää[bitmap‰∏âÊúü]rb_select ÈÄÜÊó∂ËæìÂá∫Ôºåoffset ËæìÂÖ•ÂÄºÂíåvaluesÊï∞ÈáèÁõ∏Â∑Æ1Êó∂ÔºåobÊ≤°ÊúâËæìÂá∫ÂÄºÔºåÂ∫îËØ•ËæìÂá∫1‰∏™value„Äã
select rb_to_string(rb_select(rb_from_string('1,4294967297'),100,0,true,4294967297,4294967298));
+------------------------------------------------------------------------------------------+
| rb_to_string(rb_select(rb_from_string('1,4294967297'),100,0,true,4294967297,4294967298)) |
+------------------------------------------------------------------------------------------+
| 4294967297                                                                               |
+------------------------------------------------------------------------------------------+
bug 2024092000104516141   „Ää[bitmap‰∏âÊúü]rb_select ÈÄÜÊó∂ËæìÂá∫Ôºåoffset ËæìÂÖ•ÂÄºÂíåvaluesÊï∞ÈáèÁõ∏Â∑Æ1Êó∂ÔºåobÊ≤°ÊúâËæìÂá∫ÂÄºÔºåÂ∫îËØ•ËæìÂá∫1‰∏™value„Äã
select rb_to_string(rb_select(rb_from_string('1,4294967297'),100,1,true,1,4294967298));
+---------------------------------------------------------------------------------+
| rb_to_string(rb_select(rb_from_string('1,4294967297'),100,1,true,1,4294967298)) |
+---------------------------------------------------------------------------------+
| 1                                                                               |
+---------------------------------------------------------------------------------+
select rb_to_string(rb_select(rb_from_string('1,5,8,4294967295'),2,0,false,1,4294967295));
+------------------------------------------------------------------------------------+
| rb_to_string(rb_select(rb_from_string('1,5,8,4294967295'),2,0,false,1,4294967295)) |
+------------------------------------------------------------------------------------+
| 1,5                                                                                |
+------------------------------------------------------------------------------------+
select rb_to_string(rb_select(rb_from_string('1,5,8,4294967295'),100,0,false,1,4294967294));
+--------------------------------------------------------------------------------------+
| rb_to_string(rb_select(rb_from_string('1,5,8,4294967295'),100,0,false,1,4294967294)) |
+--------------------------------------------------------------------------------------+
| 1,5,8                                                                                |
+--------------------------------------------------------------------------------------+
select rb_to_string(rb_select(rb_from_string('1,5,8,4294967295'),1,0,false,1,4294967296));
+------------------------------------------------------------------------------------+
| rb_to_string(rb_select(rb_from_string('1,5,8,4294967295'),1,0,false,1,4294967296)) |
+------------------------------------------------------------------------------------+
| 1                                                                                  |
+------------------------------------------------------------------------------------+
select rb_to_string(rb_select(rb_from_string('1,5,8,4294967295'),1,0,true,1,4294967295));
+-----------------------------------------------------------------------------------+
| rb_to_string(rb_select(rb_from_string('1,5,8,4294967295'),1,0,true,1,4294967295)) |
+-----------------------------------------------------------------------------------+
| 8                                                                                 |
+-----------------------------------------------------------------------------------+
select rb_to_string(rb_select(rb_from_string('1,5,8,4294967295'),100,0,true,1,4294967294));
+-------------------------------------------------------------------------------------+
| rb_to_string(rb_select(rb_from_string('1,5,8,4294967295'),100,0,true,1,4294967294)) |
+-------------------------------------------------------------------------------------+
| 1,5,8                                                                               |
+-------------------------------------------------------------------------------------+
select rb_to_string(rb_select(rb_from_string('1,5,8,4294967295'),100,0,true,1,4294967296));
+-------------------------------------------------------------------------------------+
| rb_to_string(rb_select(rb_from_string('1,5,8,4294967295'),100,0,true,1,4294967296)) |
+-------------------------------------------------------------------------------------+
| 1,5,8,4294967295                                                                    |
+-------------------------------------------------------------------------------------+
select rb_to_string(rb_select(rb_from_string('1,5,8,4294967299'),100,0,false,1,4294967297));
+--------------------------------------------------------------------------------------+
| rb_to_string(rb_select(rb_from_string('1,5,8,4294967299'),100,0,false,1,4294967297)) |
+--------------------------------------------------------------------------------------+
| 1,5,8                                                                                |
+--------------------------------------------------------------------------------------+
select rb_to_string(rb_select(rb_from_string('1,5,8,4294967299'),100,0,false,1,4294967299));
+--------------------------------------------------------------------------------------+
| rb_to_string(rb_select(rb_from_string('1,5,8,4294967299'),100,0,false,1,4294967299)) |
+--------------------------------------------------------------------------------------+
| 1,5,8                                                                                |
+--------------------------------------------------------------------------------------+
select rb_to_string(rb_select(rb_from_string('1,5,8,4294967299'),100,0,false,1,42949672991));
+---------------------------------------------------------------------------------------+
| rb_to_string(rb_select(rb_from_string('1,5,8,4294967299'),100,0,false,1,42949672991)) |
+---------------------------------------------------------------------------------------+
| 1,5,8,4294967299                                                                      |
+---------------------------------------------------------------------------------------+
select rb_to_string(rb_select(rb_from_string('1,2,3,4,5,6,7,8,9,10,11,12,13,14,15,16,17,18,19,20,21,22,23,24,25,26,27,28,29,30,31,32,33,4294967299'),100,0,true,1,4294967297));
+-------------------------------------------------------------------------------------------------------------------------------------------------------------------------+
| rb_to_string(rb_select(rb_from_string('1,2,3,4,5,6,7,8,9,10,11,12,13,14,15,16,17,18,19,20,21,22,23,24,25,26,27,28,29,30,31,32,33,4294967299'),100,0,true,1,4294967297)) |
+-------------------------------------------------------------------------------------------------------------------------------------------------------------------------+
| 1,2,3,4,5,6,7,8,9,10,11,12,13,14,15,16,17,18,19,20,21,22,23,24,25,26,27,28,29,30,31,32,33                                                                               |
+-------------------------------------------------------------------------------------------------------------------------------------------------------------------------+
select rb_to_string(rb_select(rb_from_string('1,2,3,4,5,6,7,8,9,10,11,12,13,14,15,16,17,18,19,20,21,22,23,24,25,26,27,28,29,30,31,32,33,4294967299'),100,0,true,1,4294967299));
+-------------------------------------------------------------------------------------------------------------------------------------------------------------------------+
| rb_to_string(rb_select(rb_from_string('1,2,3,4,5,6,7,8,9,10,11,12,13,14,15,16,17,18,19,20,21,22,23,24,25,26,27,28,29,30,31,32,33,4294967299'),100,0,true,1,4294967299)) |
+-------------------------------------------------------------------------------------------------------------------------------------------------------------------------+
| 1,2,3,4,5,6,7,8,9,10,11,12,13,14,15,16,17,18,19,20,21,22,23,24,25,26,27,28,29,30,31,32,33                                                                               |
+-------------------------------------------------------------------------------------------------------------------------------------------------------------------------+
select rb_to_string(rb_select(rb_from_string('1,2,3,4,5,6,7,8,9,10,11,12,13,14,15,16,17,18,19,20,21,22,23,24,25,26,27,28,29,30,31,32,33,4294967299'),100,0,true,4294967297,42949672989));
+-----------------------------------------------------------------------------------------------------------------------------------------------------------------------------------+
| rb_to_string(rb_select(rb_from_string('1,2,3,4,5,6,7,8,9,10,11,12,13,14,15,16,17,18,19,20,21,22,23,24,25,26,27,28,29,30,31,32,33,4294967299'),100,0,true,4294967297,42949672989)) |
+-----------------------------------------------------------------------------------------------------------------------------------------------------------------------------------+
| 4294967299                                                                                                                                                                        |
+-----------------------------------------------------------------------------------------------------------------------------------------------------------------------------------+
select rb_to_string(rb_select(rb_from_string('1,2,3,4,5,6,7,8,9,10,11,12,13,14,15,16,17,18,19,20,21,22,23,24,25,26,27,28,29,30,31,32,33,4294967295'),112,0,false,1,4294967295));
+--------------------------------------------------------------------------------------------------------------------------------------------------------------------------+
| rb_to_string(rb_select(rb_from_string('1,2,3,4,5,6,7,8,9,10,11,12,13,14,15,16,17,18,19,20,21,22,23,24,25,26,27,28,29,30,31,32,33,4294967295'),112,0,false,1,4294967295)) |
+--------------------------------------------------------------------------------------------------------------------------------------------------------------------------+
| 1,2,3,4,5,6,7,8,9,10,11,12,13,14,15,16,17,18,19,20,21,22,23,24,25,26,27,28,29,30,31,32,33                                                                                |
+--------------------------------------------------------------------------------------------------------------------------------------------------------------------------+
select rb_to_string(rb_select(rb_from_string('1,2,3,4,5,6,7,8,9,10,11,12,13,14,15,16,17,18,19,20,21,22,23,24,25,26,27,28,29,30,31,32,33,4294967295'),1,0,false,1,4294967294));
+------------------------------------------------------------------------------------------------------------------------------------------------------------------------+
| rb_to_string(rb_select(rb_from_string('1,2,3,4,5,6,7,8,9,10,11,12,13,14,15,16,17,18,19,20,21,22,23,24,25,26,27,28,29,30,31,32,33,4294967295'),1,0,false,1,4294967294)) |
+------------------------------------------------------------------------------------------------------------------------------------------------------------------------+
| 1                                                                                                                                                                      |
+------------------------------------------------------------------------------------------------------------------------------------------------------------------------+
select rb_to_string(rb_select(rb_from_string('1,2,3,4,5,6,7,8,9,10,11,12,13,14,15,16,17,18,19,20,21,22,23,24,25,26,27,28,29,30,31,32,33,4294967295'),100,0,false,1,4294967296));
+--------------------------------------------------------------------------------------------------------------------------------------------------------------------------+
| rb_to_string(rb_select(rb_from_string('1,2,3,4,5,6,7,8,9,10,11,12,13,14,15,16,17,18,19,20,21,22,23,24,25,26,27,28,29,30,31,32,33,4294967295'),100,0,false,1,4294967296)) |
+--------------------------------------------------------------------------------------------------------------------------------------------------------------------------+
| 1,2,3,4,5,6,7,8,9,10,11,12,13,14,15,16,17,18,19,20,21,22,23,24,25,26,27,28,29,30,31,32,33,4294967295                                                                     |
+--------------------------------------------------------------------------------------------------------------------------------------------------------------------------+
select rb_to_string(rb_select(rb_from_string('1,2,3,4,5,6,7,8,9,10,11,12,13,14,15,16,17,18,19,20,21,22,23,24,25,26,27,28,29,30,31,32,33,4294967295'),100,0,true,1,4294967295));
+-------------------------------------------------------------------------------------------------------------------------------------------------------------------------+
| rb_to_string(rb_select(rb_from_string('1,2,3,4,5,6,7,8,9,10,11,12,13,14,15,16,17,18,19,20,21,22,23,24,25,26,27,28,29,30,31,32,33,4294967295'),100,0,true,1,4294967295)) |
+-------------------------------------------------------------------------------------------------------------------------------------------------------------------------+
| 1,2,3,4,5,6,7,8,9,10,11,12,13,14,15,16,17,18,19,20,21,22,23,24,25,26,27,28,29,30,31,32,33                                                                               |
+-------------------------------------------------------------------------------------------------------------------------------------------------------------------------+
select rb_to_string(rb_select(rb_from_string('1,2,3,4,5,6,7,8,9,10,11,12,13,14,15,16,17,18,19,20,21,22,23,24,25,26,27,28,29,30,31,32,33,4294967295'),1,0,true,1,4294967294));
+-----------------------------------------------------------------------------------------------------------------------------------------------------------------------+
| rb_to_string(rb_select(rb_from_string('1,2,3,4,5,6,7,8,9,10,11,12,13,14,15,16,17,18,19,20,21,22,23,24,25,26,27,28,29,30,31,32,33,4294967295'),1,0,true,1,4294967294)) |
+-----------------------------------------------------------------------------------------------------------------------------------------------------------------------+
| 33                                                                                                                                                                    |
+-----------------------------------------------------------------------------------------------------------------------------------------------------------------------+
select rb_to_string(rb_select(rb_from_string('1,2,3,4,5,6,7,8,9,10,11,12,13,14,15,16,17,18,19,20,21,22,23,24,25,26,27,28,29,30,31,32,33,4294967295'),100,0,true,1,4294967296));
+-------------------------------------------------------------------------------------------------------------------------------------------------------------------------+
| rb_to_string(rb_select(rb_from_string('1,2,3,4,5,6,7,8,9,10,11,12,13,14,15,16,17,18,19,20,21,22,23,24,25,26,27,28,29,30,31,32,33,4294967295'),100,0,true,1,4294967296)) |
+-------------------------------------------------------------------------------------------------------------------------------------------------------------------------+
| 1,2,3,4,5,6,7,8,9,10,11,12,13,14,15,16,17,18,19,20,21,22,23,24,25,26,27,28,29,30,31,32,33,4294967295                                                                    |
+-------------------------------------------------------------------------------------------------------------------------------------------------------------------------+
select rb_to_string(rb_select(rb_from_string('1,2,3,4,5,6,7,8,9,10,11,12,13,14,15,16,17,18,19,20,21,22,23,24,25,26,27,28,29,30,31,32,33,4294967299'),100,0,false,1,4294967297));
+--------------------------------------------------------------------------------------------------------------------------------------------------------------------------+
| rb_to_string(rb_select(rb_from_string('1,2,3,4,5,6,7,8,9,10,11,12,13,14,15,16,17,18,19,20,21,22,23,24,25,26,27,28,29,30,31,32,33,4294967299'),100,0,false,1,4294967297)) |
+--------------------------------------------------------------------------------------------------------------------------------------------------------------------------+
| 1,2,3,4,5,6,7,8,9,10,11,12,13,14,15,16,17,18,19,20,21,22,23,24,25,26,27,28,29,30,31,32,33                                                                                |
+--------------------------------------------------------------------------------------------------------------------------------------------------------------------------+
select rb_to_string(rb_select(rb_from_string('1,2,3,4,5,6,7,8,9,10,11,12,13,14,15,16,17,18,19,20,21,22,23,24,25,26,27,28,29,30,31,32,33,4294967299'),1,0,false,1,4294967299));
+------------------------------------------------------------------------------------------------------------------------------------------------------------------------+
| rb_to_string(rb_select(rb_from_string('1,2,3,4,5,6,7,8,9,10,11,12,13,14,15,16,17,18,19,20,21,22,23,24,25,26,27,28,29,30,31,32,33,4294967299'),1,0,false,1,4294967299)) |
+------------------------------------------------------------------------------------------------------------------------------------------------------------------------+
| 1                                                                                                                                                                      |
+------------------------------------------------------------------------------------------------------------------------------------------------------------------------+
select rb_to_string(rb_select(rb_from_string('1,2,3,4,5,6,7,8,9,10,11,12,13,14,15,16,17,18,19,20,21,22,23,24,25,26,27,28,29,30,31,32,33,4294967299'),100,0,false,1,42949672991));
+---------------------------------------------------------------------------------------------------------------------------------------------------------------------------+
| rb_to_string(rb_select(rb_from_string('1,2,3,4,5,6,7,8,9,10,11,12,13,14,15,16,17,18,19,20,21,22,23,24,25,26,27,28,29,30,31,32,33,4294967299'),100,0,false,1,42949672991)) |
+---------------------------------------------------------------------------------------------------------------------------------------------------------------------------+
| 1,2,3,4,5,6,7,8,9,10,11,12,13,14,15,16,17,18,19,20,21,22,23,24,25,26,27,28,29,30,31,32,33,4294967299                                                                      |
+---------------------------------------------------------------------------------------------------------------------------------------------------------------------------+
select rb_to_string(rb_select(rb_from_string('1,2,3,4,5,6,7,8,9,10,11,12,13,14,15,16,17,18,19,20,21,22,23,24,25,26,27,28,29,30,31,32,33,4294967299'),100,10,true,1,4294967297));
+--------------------------------------------------------------------------------------------------------------------------------------------------------------------------+
| rb_to_string(rb_select(rb_from_string('1,2,3,4,5,6,7,8,9,10,11,12,13,14,15,16,17,18,19,20,21,22,23,24,25,26,27,28,29,30,31,32,33,4294967299'),100,10,true,1,4294967297)) |
+--------------------------------------------------------------------------------------------------------------------------------------------------------------------------+
| 1,2,3,4,5,6,7,8,9,10,11,12,13,14,15,16,17,18,19,20,21,22,23                                                                                                              |
+--------------------------------------------------------------------------------------------------------------------------------------------------------------------------+
select rb_to_string(rb_select(rb_from_string('1,2,3,4,5,6,7,8,9,10,11,12,13,14,15,16,17,18,19,20,21,22,23,24,25,26,27,28,29,30,31,32,33,4294967299'),2,0,true,1,4294967299));
+-----------------------------------------------------------------------------------------------------------------------------------------------------------------------+
| rb_to_string(rb_select(rb_from_string('1,2,3,4,5,6,7,8,9,10,11,12,13,14,15,16,17,18,19,20,21,22,23,24,25,26,27,28,29,30,31,32,33,4294967299'),2,0,true,1,4294967299)) |
+-----------------------------------------------------------------------------------------------------------------------------------------------------------------------+
| 32,33                                                                                                                                                                 |
+-----------------------------------------------------------------------------------------------------------------------------------------------------------------------+
bug 2024092000104516141   „Ää[bitmap‰∏âÊúü]rb_select ÈÄÜÊó∂ËæìÂá∫Ôºåoffset ËæìÂÖ•ÂÄºÂíåvaluesÊï∞ÈáèÁõ∏Â∑Æ1Êó∂ÔºåobÊ≤°ÊúâËæìÂá∫ÂÄºÔºåÂ∫îËØ•ËæìÂá∫1‰∏™value„Äã
select rb_to_string(rb_select(rb_from_string('1,2,3,4,5,6,7,8,9,10,11,12,13,14,15,16,17,18,19,20,21,22,23,24,25,26,27,28,29,30,31,32,33,4294967299'),100,0,true,4294967297,42949672989));
+-----------------------------------------------------------------------------------------------------------------------------------------------------------------------------------+
| rb_to_string(rb_select(rb_from_string('1,2,3,4,5,6,7,8,9,10,11,12,13,14,15,16,17,18,19,20,21,22,23,24,25,26,27,28,29,30,31,32,33,4294967299'),100,0,true,4294967297,42949672989)) |
+-----------------------------------------------------------------------------------------------------------------------------------------------------------------------------------+
| 4294967299                                                                                                                                                                        |
+-----------------------------------------------------------------------------------------------------------------------------------------------------------------------------------+
select rb_to_string(rb_select(rb_from_string('1,5,8,4294967295'),2,0,false,1,-1));
ERROR 22003: Out of range value for column
select rb_to_string(rb_select(rb_from_string('1,5,8,4294967295'),2,0,true,1,1.1));
ERROR HY000: invalid type given for an argument
select rb_to_string(rb_select(rb_from_string('1,5,8,4294967295'),2,0,true,1,'test'));
ERROR 22007: Incorrect value
select rb_to_string(rb_select(rb_from_string('1,5,8,4294967295'),2,0,true,1,'8'));
+----------------------------------------------------------------------------+
| rb_to_string(rb_select(rb_from_string('1,5,8,4294967295'),2,0,true,1,'8')) |
+----------------------------------------------------------------------------+
| 1,5                                                                        |
+----------------------------------------------------------------------------+
select rb_to_string(rb_select(rb_from_string('1,5,8,4294967295'),2,0,true,0,false));
ERROR HY000: invalid type given for an argument
select rb_to_string(rb_select(rb_from_string('1,5,8,4294967295'),2,0,true,0,true));
ERROR HY000: invalid type given for an argument
select rb_to_string(rb_select(rb_from_string('1,5,8,4294967295'),2,0,true,0,null));
+-----------------------------------------------------------------------------+
| rb_to_string(rb_select(rb_from_string('1,5,8,4294967295'),2,0,true,0,null)) |
+-----------------------------------------------------------------------------+
| NULL                                                                        |
+-----------------------------------------------------------------------------+
select rb_to_string(rb_select(rb_from_string('1,5,8,4294967295'),2,0,true,0,''));
ERROR 22007: Incorrect value
select rb_to_string(rb_select(rb_from_string('1,5,8,4294967295'),2,0,true,0,18446744073709551616));
ERROR HY000: invalid type given for an argument
select rb_to_string(rb_select(rb_from_string('1,5,8,18446744073709551615'),10,0,false,0,18446744073709551615));
+---------------------------------------------------------------------------------------------------------+
| rb_to_string(rb_select(rb_from_string('1,5,8,18446744073709551615'),10,0,false,0,18446744073709551615)) |
+---------------------------------------------------------------------------------------------------------+
| 1,5,8                                                                                                   |
+---------------------------------------------------------------------------------------------------------+
select rb_to_string(rb_select(rb_from_string('1,5,8,18446744073709551615'),10,1,true,0,18446744073709551615));
+--------------------------------------------------------------------------------------------------------+
| rb_to_string(rb_select(rb_from_string('1,5,8,18446744073709551615'),10,1,true,0,18446744073709551615)) |
+--------------------------------------------------------------------------------------------------------+
| 1,5                                                                                                    |
+--------------------------------------------------------------------------------------------------------+
select rb_to_string(rb_select(rb_from_string('1,5,8,18446744073709551615'),2,0,false,0));
+-----------------------------------------------------------------------------------+
| rb_to_string(rb_select(rb_from_string('1,5,8,18446744073709551615'),2,0,false,0)) |
+-----------------------------------------------------------------------------------+
| 1,5                                                                               |
+-----------------------------------------------------------------------------------+
select rb_to_string(rb_select(rb_from_string('1,5,8,18446744073709551615'),2,0,true,0));
+----------------------------------------------------------------------------------+
| rb_to_string(rb_select(rb_from_string('1,5,8,18446744073709551615'),2,0,true,0)) |
+----------------------------------------------------------------------------------+
| 8,18446744073709551615                                                           |
+----------------------------------------------------------------------------------+
select rb_to_string(rb_select(rb_from_string('1,2,3,4,5,6,7,8,9,10,11,12,13,14,15,16,17,18,19,20,21,22,23,24,25,26,27,28,29,30,31,32,33,18446744073709551615'),34,0));
+----------------------------------------------------------------------------------------------------------------------------------------------------------------+
| rb_to_string(rb_select(rb_from_string('1,2,3,4,5,6,7,8,9,10,11,12,13,14,15,16,17,18,19,20,21,22,23,24,25,26,27,28,29,30,31,32,33,18446744073709551615'),34,0)) |
+----------------------------------------------------------------------------------------------------------------------------------------------------------------+
| 1,2,3,4,5,6,7,8,9,10,11,12,13,14,15,16,17,18,19,20,21,22,23,24,25,26,27,28,29,30,31,32,33,18446744073709551615                                                 |
+----------------------------------------------------------------------------------------------------------------------------------------------------------------+
select cast(rb_select(r,1) as binary) from tt1;
+--------------------------------+
| cast(rb_select(r,1) as binary) |
+--------------------------------+
|                               |
|                             |
|                             |
|                             |
|                             |
|                             |
|                             |
|                             |
|                             |
|                             |
|                              |
| ˇ˛                             |
+--------------------------------+
select cast(rb_select(r,6) as char(1000)) from tt1;
+-----------------------------------------------------+
| cast(rb_select(r,6) as char(1000))                  |
+-----------------------------------------------------+
|                                                    |
|                                                  |
|                                                  |
|                	                            |
|                	                            |
|                                           |
|                                            |
|                                            |
|                                            |
| ?      d                                |
|                                             |
| ??   ?  ?  ?  ?  ?                           |
+-----------------------------------------------------+
select cast(rb_select(r,1) as binary) from vtt1;
+--------------------------------+
| cast(rb_select(r,1) as binary) |
+--------------------------------+
|                               |
|                             |
|                             |
|                             |
|                             |
|                             |
|                             |
|                             |
|                             |
|                             |
|                              |
| ˇ˛                             |
+--------------------------------+
select cast(rb_select(r,6) as char(1000)) from vtt1;
+-----------------------------------------------------+
| cast(rb_select(r,6) as char(1000))                  |
+-----------------------------------------------------+
|                                                    |
|                                                  |
|                                                  |
|                	                            |
|                	                            |
|                                           |
|                                            |
|                                            |
|                                            |
| ?      d                                |
|                                             |
| ??   ?  ?  ?  ?  ?                           |
+-----------------------------------------------------+
select cast(rb_select(rb_from_string('1,2,3,4,5,6,7,8,9,10,11,12,13,14,15,16,17,18,19,20,21,22,23,24,25,26,27,28,29,30,31,32,33,18446744073709551615'),34,0) as binary);
+------------------------------------------------------------------------------------------------------------------------------------------------------------------+
| cast(rb_select(rb_from_string('1,2,3,4,5,6,7,8,9,10,11,12,13,14,15,16,17,18,19,20,21,22,23,24,25,26,27,28,29,30,31,32,33,18446744073709551615'),34,0) as binary) |
+------------------------------------------------------------------------------------------------------------------------------------------------------------------+
|            :0                    	 
                        ! ˇˇˇˇ:0     ˇˇ     ˇˇ                                                   |
+------------------------------------------------------------------------------------------------------------------------------------------------------------------+
select cast(rb_select(rb_from_string('1,2,3,4,5,6,7,8,9,10,11,12,13,14,15,16,17,18,19,20,21,22,23,24,25,26,27,28,29,30,31,32,33,18446744073709551615'),34,0) as char(1000));
+----------------------------------------------------------------------------------------------------------------------------------------------------------------------+
| cast(rb_select(rb_from_string('1,2,3,4,5,6,7,8,9,10,11,12,13,14,15,16,17,18,19,20,21,22,23,24,25,26,27,28,29,30,31,32,33,18446744073709551615'),34,0) as char(1000)) |
+----------------------------------------------------------------------------------------------------------------------------------------------------------------------+
|            :0                    	 
                        ! ????:0     ??     ??                                               |
+----------------------------------------------------------------------------------------------------------------------------------------------------------------------+
select cast(rb_select(rb_from_string('1,2,3,4,5,6,7,8,9,10,11,12,13,14,15,16,17,18,19,20,21,22,23,24,25,26,27,28,29,30,31,32,33,18446744073709551615'),34,0) as binary) ;
+------------------------------------------------------------------------------------------------------------------------------------------------------------------+
| cast(rb_select(rb_from_string('1,2,3,4,5,6,7,8,9,10,11,12,13,14,15,16,17,18,19,20,21,22,23,24,25,26,27,28,29,30,31,32,33,18446744073709551615'),34,0) as binary) |
+------------------------------------------------------------------------------------------------------------------------------------------------------------------+
|            :0                    	 
                        ! ˇˇˇˇ:0     ˇˇ     ˇˇ                                                   |
+------------------------------------------------------------------------------------------------------------------------------------------------------------------+
select cast(rb_select(rb_from_string('1,2,3,4,5,6,7,8,9,10,11,12,13,14,15,16,17,18,19,20,21,22,23,24,25,26,27,28,29,30,31,32,33,18446744073709551615'),34,0) as char(1000));
+----------------------------------------------------------------------------------------------------------------------------------------------------------------------+
| cast(rb_select(rb_from_string('1,2,3,4,5,6,7,8,9,10,11,12,13,14,15,16,17,18,19,20,21,22,23,24,25,26,27,28,29,30,31,32,33,18446744073709551615'),34,0) as char(1000)) |
+----------------------------------------------------------------------------------------------------------------------------------------------------------------------+
|            :0                    	 
                        ! ????:0     ??     ??                                               |
+----------------------------------------------------------------------------------------------------------------------------------------------------------------------+
select cast(rb_select(r,10) as UNSIGNED) from tt1;
ERROR 22000: Invalid data type for the operation
select cast(rb_select(r,20) as SIGNED) from tt1;
ERROR 22000: Invalid data type for the operation
select cast(rb_select(r,1) as date) from tt1;
ERROR 22000: Invalid data type for the operation
select cast(rb_select(r,1) as DATETIME) from tt1;
ERROR 22000: Invalid data type for the operation
select cast(rb_select(r,1) as TIME) from tt1;
ERROR 22000: Invalid data type for the operation
select cast(rb_select(r,1) as FLOAT) from tt1;
ERROR 22000: Invalid data type for the operation
select cast(rb_select(r,1) as year) from tt1;
ERROR 22000: Invalid data type for the operation
select cast(rb_select(r,1) as DOUBLE) from tt1;
ERROR 22000: Invalid data type for the operation
select cast(rb_select(r,1) as DECIMAL) from tt1;
ERROR 22000: Invalid data type for the operation
select cast(rb_select(r,1) as roaringbitmap) from tt1;
+---------------------------------------+
| cast(rb_select(r,1) as roaringbitmap) |
+---------------------------------------+
|                                      |
|                                    |
|                                    |
|                                    |
|                                    |
|                                    |
|                                    |
|                                    |
|                                    |
|                                    |
|                                     |
| ˇ˛                                    |
+---------------------------------------+
select cast(rb_select(r,1) as NUMERIC) from tt1;
ERROR 22000: Invalid data type for the operation
select cast(rb_select(r,1) as dec) from tt1;
ERROR 22000: Invalid data type for the operation
select cast(rb_select(r,1) as FIXED) from tt1;
ERROR 22000: Invalid data type for the operation
select cast(rb_select(r,1) as MULTIPOINT) from tt1;
ERROR 22000: Invalid data type for the operation
drop table tt2;
create table tt2(id int, a binary(6)) ;
drop view vtt2;
create view vtt2 as select * from tt2;
insert into tt2 values(1,rb_from_string('1'));
select rb_select(a,1) from tt2;
ERROR HY000: invalid type given for an argument
select rb_select(id,1) from tt2;
ERROR HY000: invalid type given for an argument
select rb_select(rb_from_string('1,2,3'),a) from tt2;
ERROR 22007: Incorrect value
select rb_select(rb_from_string('1,2,3'),id) from tt2;
+---------------------------------------+
| rb_select(rb_from_string('1,2,3'),id) |
+---------------------------------------+
|                                    |
+---------------------------------------+
select rb_select(a,1) from vtt2;
ERROR HY000: invalid type given for an argument
select rb_select(id,1) from vtt2;
ERROR HY000: invalid type given for an argument
select rb_select(rb_from_string('1,2,3'),a) from vtt2;
ERROR 22007: Incorrect value
select rb_select(rb_from_string('1,2,3'),id) from vtt2;
+---------------------------------------+
| rb_select(rb_from_string('1,2,3'),id) |
+---------------------------------------+
|                                    |
+---------------------------------------+
drop table tt2;
create table tt2(id int, a varbinary(1000));
drop view vtt2;
create view vtt2 as select * from tt2;
insert into tt2 values(0,null);
insert into tt2 values(0,rb_build_empty());
insert into tt2 values(1,rb_from_string('1'));
insert into tt2 values(2,rb_from_string('18446744073709551615'));
insert into tt2 values(3,rb_from_string('1,2,3,4,5,6,7,8,9,10,11,12,13,14,15,16,17,18,19'));
insert into tt2 values(4,rb_from_string('1,2,3,4,5,6,7,8,9,10,11,12,13,14,15,16,17,18,18446744073709551615'));
insert into tt2 values(6,rb_from_string('1,2,3,4,5,6,7,8,9,10,11,12,13,14,15,16,17,18,19,20,21,23,24,25,26,27,28,30,31,32,65536,4294967295'));
insert into tt2 values(7,rb_from_string('1,2,3,4,5,6,7,8,9,10,11,12,13,14,15,16,17,18,19,20,21,23,24,25,26,27,28,30,31,32,65536,4294967295,18446744073709551615'));
select * from tt2;
+------+-------------------------------------------------------------------------------------------------------------------------------------------------------------+
| id   | a                                                                                                                                                           |
+------+-------------------------------------------------------------------------------------------------------------------------------------------------------------+
|    0 | NULL                                                                                                                                                        |
|    0 |                                                                                                                                                            |
|    1 |                                                                                                                                                          |
|    2 | ˇˇˇˇˇˇˇˇ                                                                                                                                                          |
|    3 |                         	   
                                                                                                           |
|    4 |                                                         	       
                            ˇˇˇˇˇˇˇˇ                                            |
|    6 |                          	   
                                                                   ˇˇˇˇ                             |
|    7 |            :0           ˇˇ      \   ^           	 
                        ˇˇˇˇˇˇ:0     ˇˇ     ˇˇ                                    |
+------+-------------------------------------------------------------------------------------------------------------------------------------------------------------+
select rb_select(a,1) from tt2;
ERROR HY000: invalid type given for an argument
select rb_select(a,1) from vtt2;
ERROR HY000: invalid type given for an argument
drop table tt2;
create table tt2(id int, a char(256));
drop view vtt2;
create view vtt2 as select * from tt2;
insert into tt2 values(0,null);
insert into tt2 values(0,rb_build_empty());
insert into tt2 values(1,rb_from_string('1'));
insert into tt2 values(3,rb_from_string('1,2,3,4,5,6,7,8,9,10,11,12,13,14,15,16,17,18,19'));
insert into tt2 values(6,rb_from_string('1,2,3,4,5,6,7,8,9,10,11,12,13,14,15,16,17,18,19,20,21,23,24,25,26,27,28,30,31,32,33'));
insert into tt2 values(7,rb_from_string('1,2,3,4,5,6,7,8,9,10,11,12,13,14,15,16,17,18,19,20,21,23,24,25,26,27,28,30,31,32,65537'));
select rb_select(a,0) from tt2;
ERROR HY000: invalid type given for an argument
select rb_select(a,0) from vtt2;
ERROR HY000: invalid type given for an argument
drop table tt2;
create table tt2(id int, a varchar(1000)) ;
drop view vtt2;
create view vtt2 as select * from tt2;
insert into tt2 values(0,null);
insert into tt2 values(0,rb_build_empty());
insert into tt2 values(1,rb_from_string('1'));
insert into tt2 values(3,rb_from_string('1,2,3,4,5,6,7,8,9,10,11,12,13,14,15,16,17,18,19'));
insert into tt2 values(6,rb_from_string('1,2,3,4,5,6,7,8,9,10,11,12,13,14,15,16,17,18,19,20,21,23,24,25,26,27,28,30,31,32,33'));
insert into tt2 values(7,rb_from_string('1,2,3,4,5,6,7,8,9,10,11,12,13,14,15,16,17,18,19,20,21,23,24,25,26,27,28,30,31,32,65537'));
select rb_select(a,0) from tt2;
ERROR HY000: invalid type given for an argument
select rb_select(a,0) from vtt2;
ERROR HY000: invalid type given for an argument
drop table tt2;
create table tt2(id int, a TINYBLOB);
drop view vtt2;
create view vtt2 as select * from tt2;
insert into tt2 values(0,null);
insert into tt2 values(0,rb_build_empty());
insert into tt2 values(1,rb_from_string('1'));
insert into tt2 values(3,rb_from_string('1,2,3,4,5,6,7,8,9,10,11,12,13,14,15,16,17,18,19'));
insert into tt2 values(6,rb_from_string('1,2,3,4,5,6,7,8,9,10,11,12,13,14,15,16,17,18,19,20,21,23,24,25,26,27,28,30,31,32,33'));
insert into tt2 values(7,rb_from_string('1,2,3,4,5,6,7,8,9,10,11,12,13,14,15,16,17,18,19,20,21,23,24,25,26,27,28,30,31,32,65537'));
insert into tt2 values(7,rb_from_string('1,2,3,4,5,6,7,8,9,10,11,12,13,14,15,16,17,18,19,20,21,23,24,25,26,27,28,30,31,32,65536,4294967295,18446744073709551615'));
select rb_select(a,0) from tt2;
ERROR HY000: invalid type given for an argument
select rb_select(a,0) from vtt2;
ERROR HY000: invalid type given for an argument
drop table tt2;
create table tt2(id int, a blob);
drop view vtt2;
create view vtt2 as select * from tt2;
insert into tt2 values(0,null);
insert into tt2 values(0,rb_build_empty());
insert into tt2 values(1,rb_from_string('1'));
insert into tt2 values(3,rb_from_string('1,2,3,4,5,6,7,8,9,10,11,12,13,14,15,16,17,18,19'));
insert into tt2 values(6,rb_from_string('1,2,3,4,5,6,7,8,9,10,11,12,13,14,15,16,17,18,19,20,21,23,24,25,26,27,28,30,31,32,33'));
insert into tt2 values(7,rb_from_string('1,2,3,4,5,6,7,8,9,10,11,12,13,14,15,16,17,18,19,20,21,23,24,25,26,27,28,30,31,32,65537'));
insert into tt2 values(7,rb_from_string('1,2,3,4,5,6,7,8,9,10,11,12,13,14,15,16,17,18,19,20,21,23,24,25,26,27,28,30,31,32,65536,4294967295,18446744073709551615'));
select rb_select(a,0) from tt2;
ERROR HY000: invalid type given for an argument
select rb_select(a,0) from vtt2;
ERROR HY000: invalid type given for an argument
drop table tt2;
create table tt2(id int, a MEDIUMBLOB);
drop view vtt2;
create view vtt2 as select * from tt2;
insert into tt2 values(0,null);
insert into tt2 values(0,rb_build_empty());
insert into tt2 values(1,rb_from_string('1'));
insert into tt2 values(3,rb_from_string('1,2,3,4,5,6,7,8,9,10,11,12,13,14,15,16,17,18,19'));
insert into tt2 values(6,rb_from_string('1,2,3,4,5,6,7,8,9,10,11,12,13,14,15,16,17,18,19,20,21,23,24,25,26,27,28,30,31,32,33'));
insert into tt2 values(7,rb_from_string('1,2,3,4,5,6,7,8,9,10,11,12,13,14,15,16,17,18,19,20,21,23,24,25,26,27,28,30,31,32,65537'));
insert into tt2 values(7,rb_from_string('1,2,3,4,5,6,7,8,9,10,11,12,13,14,15,16,17,18,19,20,21,23,24,25,26,27,28,30,31,32,65536,4294967295,18446744073709551615'));
select rb_select(a,0) from tt2;
ERROR HY000: invalid type given for an argument
select rb_select(a,0) from vtt2;
ERROR HY000: invalid type given for an argument
drop table tt2;
create table tt2(id int, a LONGBLOB);
drop view vtt2;
create view vtt2 as select * from tt2;
insert into tt2 values(0,null);
insert into tt2 values(0,rb_build_empty());
insert into tt2 values(1,rb_from_string('1'));
insert into tt2 values(3,rb_from_string('1,2,3,4,5,6,7,8,9,10,11,12,13,14,15,16,17,18,19'));
insert into tt2 values(6,rb_from_string('1,2,3,4,5,6,7,8,9,10,11,12,13,14,15,16,17,18,19,20,21,23,24,25,26,27,28,30,31,32,33'));
insert into tt2 values(7,rb_from_string('1,2,3,4,5,6,7,8,9,10,11,12,13,14,15,16,17,18,19,20,21,23,24,25,26,27,28,30,31,32,65537'));
insert into tt2 values(7,rb_from_string('1,2,3,4,5,6,7,8,9,10,11,12,13,14,15,16,17,18,19,20,21,23,24,25,26,27,28,30,31,32,65536,4294967295,18446744073709551615'));
select rb_select(a,0) from tt2;
ERROR HY000: invalid type given for an argument
select rb_select(a,0) from vtt2;
ERROR HY000: invalid type given for an argument
drop table tt2;
create table tt2(id int, a TINYTEXT);
drop view vtt2;
create view vtt2 as select * from tt2;
insert into tt2 values(0,null);
insert into tt2 values(0,rb_build_empty());
insert into tt2 values(1,rb_from_string('1'));
insert into tt2 values(3,rb_from_string('1,2,3,4,5,6,7,8,9,10,11,12,13,14,15,16,17,18,19'));
insert into tt2 values(6,rb_from_string('1,2,3,4,5,6,7,8,9,10,11,12,13,14,15,16,17,18,19,20,21,23,24,25,26,27,28,30,31,32,33'));
insert into tt2 values(7,rb_from_string('1,2,3,4,5,6,7,8,9,10,11,12,13,14,15,16,17,18,19,20,21,23,24,25,26,27,28,30,31,32,65537'));
select rb_select(a,0) from tt2;
ERROR HY000: invalid type given for an argument
select rb_select(a,0) from vtt2;
ERROR HY000: invalid type given for an argument
drop table tt2;
create table tt2(id int, a text);
drop view vtt2;
create view vtt2 as select * from tt2;
insert into tt2 values(0,null);
insert into tt2 values(0,rb_build_empty());
insert into tt2 values(1,rb_from_string('1'));
insert into tt2 values(3,rb_from_string('1,2,3,4,5,6,7,8,9,10,11,12,13,14,15,16,17,18,19'));
insert into tt2 values(6,rb_from_string('1,2,3,4,5,6,7,8,9,10,11,12,13,14,15,16,17,18,19,20,21,23,24,25,26,27,28,30,31,32,33'));
insert into tt2 values(7,rb_from_string('1,2,3,4,5,6,7,8,9,10,11,12,13,14,15,16,17,18,19,20,21,23,24,25,26,27,28,30,31,32,65537'));
select rb_select(a,0) from tt2;
ERROR HY000: invalid type given for an argument
select rb_select(a,0) from vtt2;
ERROR HY000: invalid type given for an argument
drop table tt2;
create table tt2(id int, a MEDIUMTEXT);
drop view vtt2;
create view vtt2 as select * from tt2;
insert into tt2 values(0,null);
insert into tt2 values(0,rb_build_empty());
insert into tt2 values(1,rb_from_string('1'));
insert into tt2 values(3,rb_from_string('1,2,3,4,5,6,7,8,9,10,11,12,13,14,15,16,17,18,19'));
insert into tt2 values(6,rb_from_string('1,2,3,4,5,6,7,8,9,10,11,12,13,14,15,16,17,18,19,20,21,23,24,25,26,27,28,30,31,32,33'));
insert into tt2 values(7,rb_from_string('1,2,3,4,5,6,7,8,9,10,11,12,13,14,15,16,17,18,19,20,21,23,24,25,26,27,29,50,560,28,30,31,32,65537,4294967296'));
select * from tt2;
+------+----------------------------------------------------------------------------------------------------------------------------------+
| id   | a                                                                                                                                |
+------+----------------------------------------------------------------------------------------------------------------------------------+
|    0 | NULL                                                                                                                             |
|    0 |                                                                                                                                 |
|    1 |                                                                                                                               |
|    3 |                         	   
                                                                                |
|    6 |                         	   
                                                                !     |
|    7 |            :0               Z           	 
                       2 0    :0               |
+------+----------------------------------------------------------------------------------------------------------------------------------+
select rb_select(a,0) from tt2;
ERROR HY000: invalid type given for an argument
select rb_select(a,0) from vtt2;
ERROR HY000: invalid type given for an argument
drop table tt2;
create table tt2(id int, a LONGTEXT);
drop view vtt2;
create view vtt2 as select * from tt2;
insert into tt2 values(0,null);
insert into tt2 values(0,rb_build_empty());
insert into tt2 values(1,rb_from_string('1'));
insert into tt2 values(3,rb_from_string('1,2,3,4,5,6,7,8,9,10,11,12,13,14,15,16,17,18,19'));
insert into tt2 values(6,rb_from_string('1,2,3,4,5,6,7,8,9,10,11,12,13,14,15,16,17,18,19,20,21,23,24,25,26,27,28,30,31,32,33'));
insert into tt2 values(7,rb_from_string('1,2,3,4,5,6,7,8,9,10,11,12,13,14,15,16,17,18,19,20,21,23,24,25,26,27,29,50,560,28,30,31,32,65537,4294967296'));
select rb_select(a,0) from tt2;
ERROR HY000: invalid type given for an argument
drop table tt2;
create table tt2(id0 BOOL,id1 BOOLEAN,id2 TINYINT,id3 SMALLINT,id4 MEDIUMINT,id5 INT,id6 INTEGER,id7 BIGINT,id8 SERIAL);
insert into tt2 values(1,1,1,1,1,1,1,1,1);
insert into tt2 values(0,0,0,0,0,0,0,0,0);
insert into tt2 values(5,5,5,5,5,5,5,5,5);
drop view vtt2;
create view vtt2 as select * from tt2;
select rb_select(rb_from_string('1,2,3,4,5,6,7,8,9,10,11,12,13,14,15,16,17,18,19,20,21,23,24,25,26,27,29,50,560,28,30,31,32,65537,4294967296'),id0) from tt2;
ERROR HY000: invalid type given for an argument
select rb_select(rb_from_string('1,2,3,4,5,6,7,8,9,10,11,12,13,14,15,16,17,18,19,20,21,23,24,25,26,27,29,50,560,28,30,31,32,65537,4294967296'),id1) from tt2;
ERROR HY000: invalid type given for an argument
select rb_select(rb_from_string('1,2,3,4,5,6,7,8,9,10,11,12,13,14,15,16,17,18,19,20,21,23,24,25,26,27,29,50,560,28,30,31,32,65537,4294967296'),id2) from tt2;
ERROR HY000: invalid type given for an argument
select rb_select(rb_from_string('1,2,3,4,5,6,7,8,9,10,11,12,13,14,15,16,17,18,19,20,21,23,24,25,26,27,29,50,560,28,30,31,32,65537,4294967296'),id3) from tt2;
+----------------------------------------------------------------------------------------------------------------------------------------------+
| rb_select(rb_from_string('1,2,3,4,5,6,7,8,9,10,11,12,13,14,15,16,17,18,19,20,21,23,24,25,26,27,29,50,560,28,30,31,32,65537,4294967296'),id3) |
+----------------------------------------------------------------------------------------------------------------------------------------------+
|                                                                                                                                           |
|                                                                                                                                             |
|                                                                                                                                      |
+----------------------------------------------------------------------------------------------------------------------------------------------+
select rb_select(rb_from_string('1,2,3,4,5,6,7,8,9,10,11,12,13,14,15,16,17,18,19,20,21,23,24,25,26,27,29,50,560,28,30,31,32,65537,4294967296'),id4) from tt2;
+----------------------------------------------------------------------------------------------------------------------------------------------+
| rb_select(rb_from_string('1,2,3,4,5,6,7,8,9,10,11,12,13,14,15,16,17,18,19,20,21,23,24,25,26,27,29,50,560,28,30,31,32,65537,4294967296'),id4) |
+----------------------------------------------------------------------------------------------------------------------------------------------+
|                                                                                                                                           |
|                                                                                                                                             |
|                                                                                                                                      |
+----------------------------------------------------------------------------------------------------------------------------------------------+
select rb_select(rb_from_string('1,2,3,4,5,6,7,8,9,10,11,12,13,14,15,16,17,18,19,20,21,23,24,25,26,27,29,50,560,28,30,31,32,65537,4294967296'),id5) from tt2;
+----------------------------------------------------------------------------------------------------------------------------------------------+
| rb_select(rb_from_string('1,2,3,4,5,6,7,8,9,10,11,12,13,14,15,16,17,18,19,20,21,23,24,25,26,27,29,50,560,28,30,31,32,65537,4294967296'),id5) |
+----------------------------------------------------------------------------------------------------------------------------------------------+
|                                                                                                                                           |
|                                                                                                                                             |
|                                                                                                                                      |
+----------------------------------------------------------------------------------------------------------------------------------------------+
select rb_select(rb_from_string('1,2,3,4,5,6,7,8,9,10,11,12,13,14,15,16,17,18,19,20,21,23,24,25,26,27,29,50,560,28,30,31,32,65537,4294967296'),id6) from tt2;
+----------------------------------------------------------------------------------------------------------------------------------------------+
| rb_select(rb_from_string('1,2,3,4,5,6,7,8,9,10,11,12,13,14,15,16,17,18,19,20,21,23,24,25,26,27,29,50,560,28,30,31,32,65537,4294967296'),id6) |
+----------------------------------------------------------------------------------------------------------------------------------------------+
|                                                                                                                                           |
|                                                                                                                                             |
|                                                                                                                                      |
+----------------------------------------------------------------------------------------------------------------------------------------------+
select rb_select(rb_from_string('1,2,3,4,5,6,7,8,9,10,11,12,13,14,15,16,17,18,19,20,21,23,24,25,26,27,29,50,560,28,30,31,32,65537,4294967296'),id7) from tt2;
+----------------------------------------------------------------------------------------------------------------------------------------------+
| rb_select(rb_from_string('1,2,3,4,5,6,7,8,9,10,11,12,13,14,15,16,17,18,19,20,21,23,24,25,26,27,29,50,560,28,30,31,32,65537,4294967296'),id7) |
+----------------------------------------------------------------------------------------------------------------------------------------------+
|                                                                                                                                           |
|                                                                                                                                             |
|                                                                                                                                      |
+----------------------------------------------------------------------------------------------------------------------------------------------+
select rb_select(rb_from_string('1,2,3,4,5,6,7,8,9,10,11,12,13,14,15,16,17,18,19,20,21,23,24,25,26,27,29,50,560,28,30,31,32,65537,4294967296'),id8) from tt2;
+----------------------------------------------------------------------------------------------------------------------------------------------+
| rb_select(rb_from_string('1,2,3,4,5,6,7,8,9,10,11,12,13,14,15,16,17,18,19,20,21,23,24,25,26,27,29,50,560,28,30,31,32,65537,4294967296'),id8) |
+----------------------------------------------------------------------------------------------------------------------------------------------+
|                                                                                                                                           |
|                                                                                                                                         |
|                                                                                                                                      |
+----------------------------------------------------------------------------------------------------------------------------------------------+
select rb_select(rb_from_string('1,2,3,4,5,6,7,8,9,10,11,12,13,14,15,16,17,18,19,20,21,23,24,25,26,27,29,50,560,28,30,31,32,65537,4294967296'),0,id0) from tt2;
ERROR HY000: invalid type given for an argument
select rb_select(rb_from_string('1,2,3,4,5,6,7,8,9,10,11,12,13,14,15,16,17,18,19,20,21,23,24,25,26,27,29,50,560,28,30,31,32,65537,4294967296'),0,id1) from tt2;
ERROR HY000: invalid type given for an argument
select rb_select(rb_from_string('1,2,3,4,5,6,7,8,9,10,11,12,13,14,15,16,17,18,19,20,21,23,24,25,26,27,29,50,560,28,30,31,32,65537,4294967296'),0,id2) from tt2;
ERROR HY000: invalid type given for an argument
select rb_select(rb_from_string('1,2,3,4,5,6,7,8,9,10,11,12,13,14,15,16,17,18,19,20,21,23,24,25,26,27,29,50,560,28,30,31,32,65537,4294967296'),0,id3) from tt2;
+------------------------------------------------------------------------------------------------------------------------------------------------+
| rb_select(rb_from_string('1,2,3,4,5,6,7,8,9,10,11,12,13,14,15,16,17,18,19,20,21,23,24,25,26,27,29,50,560,28,30,31,32,65537,4294967296'),0,id3) |
+------------------------------------------------------------------------------------------------------------------------------------------------+
|                                                                                                                                               |
|                                                                                                                                               |
|                                                                                                                                               |
+------------------------------------------------------------------------------------------------------------------------------------------------+
select rb_select(rb_from_string('1,2,3,4,5,6,7,8,9,10,11,12,13,14,15,16,17,18,19,20,21,23,24,25,26,27,29,50,560,28,30,31,32,65537,4294967296'),0,id4) from tt2;
+------------------------------------------------------------------------------------------------------------------------------------------------+
| rb_select(rb_from_string('1,2,3,4,5,6,7,8,9,10,11,12,13,14,15,16,17,18,19,20,21,23,24,25,26,27,29,50,560,28,30,31,32,65537,4294967296'),0,id4) |
+------------------------------------------------------------------------------------------------------------------------------------------------+
|                                                                                                                                               |
|                                                                                                                                               |
|                                                                                                                                               |
+------------------------------------------------------------------------------------------------------------------------------------------------+
select rb_select(rb_from_string('1,2,3,4,5,6,7,8,9,10,11,12,13,14,15,16,17,18,19,20,21,23,24,25,26,27,29,50,560,28,30,31,32,65537,4294967296'),0,id5) from tt2;
+------------------------------------------------------------------------------------------------------------------------------------------------+
| rb_select(rb_from_string('1,2,3,4,5,6,7,8,9,10,11,12,13,14,15,16,17,18,19,20,21,23,24,25,26,27,29,50,560,28,30,31,32,65537,4294967296'),0,id5) |
+------------------------------------------------------------------------------------------------------------------------------------------------+
|                                                                                                                                               |
|                                                                                                                                               |
|                                                                                                                                               |
+------------------------------------------------------------------------------------------------------------------------------------------------+
select rb_select(rb_from_string('1,2,3,4,5,6,7,8,9,10,11,12,13,14,15,16,17,18,19,20,21,23,24,25,26,27,29,50,560,28,30,31,32,65537,4294967296'),0,id6) from tt2;
+------------------------------------------------------------------------------------------------------------------------------------------------+
| rb_select(rb_from_string('1,2,3,4,5,6,7,8,9,10,11,12,13,14,15,16,17,18,19,20,21,23,24,25,26,27,29,50,560,28,30,31,32,65537,4294967296'),0,id6) |
+------------------------------------------------------------------------------------------------------------------------------------------------+
|                                                                                                                                               |
|                                                                                                                                               |
|                                                                                                                                               |
+------------------------------------------------------------------------------------------------------------------------------------------------+
select rb_select(rb_from_string('1,2,3,4,5,6,7,8,9,10,11,12,13,14,15,16,17,18,19,20,21,23,24,25,26,27,29,50,560,28,30,31,32,65537,4294967296'),0,id7) from tt2;
+------------------------------------------------------------------------------------------------------------------------------------------------+
| rb_select(rb_from_string('1,2,3,4,5,6,7,8,9,10,11,12,13,14,15,16,17,18,19,20,21,23,24,25,26,27,29,50,560,28,30,31,32,65537,4294967296'),0,id7) |
+------------------------------------------------------------------------------------------------------------------------------------------------+
|                                                                                                                                               |
|                                                                                                                                               |
|                                                                                                                                               |
+------------------------------------------------------------------------------------------------------------------------------------------------+
select rb_select(rb_from_string('1,2,3,4,5,6,7,8,9,10,11,12,13,14,15,16,17,18,19,20,21,23,24,25,26,27,29,50,560,28,30,31,32,65537,4294967296'),0,id8) from tt2;
+------------------------------------------------------------------------------------------------------------------------------------------------+
| rb_select(rb_from_string('1,2,3,4,5,6,7,8,9,10,11,12,13,14,15,16,17,18,19,20,21,23,24,25,26,27,29,50,560,28,30,31,32,65537,4294967296'),0,id8) |
+------------------------------------------------------------------------------------------------------------------------------------------------+
|                                                                                                                                               |
|                                                                                                                                               |
|                                                                                                                                               |
+------------------------------------------------------------------------------------------------------------------------------------------------+
bug 2024092400104551669   „Ää„Äêbitmap‰∏âÊúü„Äërb_select ÂèÇÊï∞4Â∏ÉÂ∞îÁ±ªÂûãÔºåËØªÂèñboolean/bool/TINYINT,obÊä•5083„Äã
select rb_select(rb_from_string('1,2,3,4,5,6,7,8,9,10,11,12,13,14,15,16,17,18,19,20,21,23,24,25,26,27,29,50,560,28,30,31,32,65537,4294967296'),10,0,id0) from tt2;
+---------------------------------------------------------------------------------------------------------------------------------------------------+
| rb_select(rb_from_string('1,2,3,4,5,6,7,8,9,10,11,12,13,14,15,16,17,18,19,20,21,23,24,25,26,27,29,50,560,28,30,31,32,65537,4294967296'),10,0,id0) |
+---------------------------------------------------------------------------------------------------------------------------------------------------+
| 
                                  0                            2                                                                      |
| 
                        	   
                                                                                                          |
| 
                                  0                            2                                                                      |
+---------------------------------------------------------------------------------------------------------------------------------------------------+
bug 2024092400104551669   „Ää„Äêbitmap‰∏âÊúü„Äërb_select ÂèÇÊï∞4Â∏ÉÂ∞îÁ±ªÂûãÔºåËØªÂèñboolean/bool/TINYINT,obÊä•5083„Äã
select rb_select(rb_from_string('1,2,3,4,5,6,7,8,9,10,11,12,13,14,15,16,17,18,19,20,21,23,24,25,26,27,29,50,560,28,30,31,32,65537,4294967296'),10,0,id1) from tt2;
+---------------------------------------------------------------------------------------------------------------------------------------------------+
| rb_select(rb_from_string('1,2,3,4,5,6,7,8,9,10,11,12,13,14,15,16,17,18,19,20,21,23,24,25,26,27,29,50,560,28,30,31,32,65537,4294967296'),10,0,id1) |
+---------------------------------------------------------------------------------------------------------------------------------------------------+
| 
                                  0                            2                                                                      |
| 
                        	   
                                                                                                          |
| 
                                  0                            2                                                                      |
+---------------------------------------------------------------------------------------------------------------------------------------------------+
bug 2024092400104551669   „Ää„Äêbitmap‰∏âÊúü„Äërb_select ÂèÇÊï∞4Â∏ÉÂ∞îÁ±ªÂûãÔºåËØªÂèñboolean/bool/TINYINT,obÊä•5083„Äã
select rb_select(rb_from_string('1,2,3,4,5,6,7,8,9,10,11,12,13,14,15,16,17,18,19,20,21,23,24,25,26,27,29,50,560,28,30,31,32,65537,4294967296'),10,0,id2) from tt2;
+---------------------------------------------------------------------------------------------------------------------------------------------------+
| rb_select(rb_from_string('1,2,3,4,5,6,7,8,9,10,11,12,13,14,15,16,17,18,19,20,21,23,24,25,26,27,29,50,560,28,30,31,32,65537,4294967296'),10,0,id2) |
+---------------------------------------------------------------------------------------------------------------------------------------------------+
| 
                                  0                            2                                                                      |
| 
                        	   
                                                                                                          |
| 
                                  0                            2                                                                      |
+---------------------------------------------------------------------------------------------------------------------------------------------------+
select rb_select(rb_from_string('1,2,3,4,5,6,7,8,9,10,11,12,13,14,15,16,17,18,19,20,21,23,24,25,26,27,29,50,560,28,30,31,32,65537,4294967296'),10,0,id3) from tt2;
ERROR HY000: invalid type given for an argument
select rb_select(rb_from_string('1,2,3,4,5,6,7,8,9,10,11,12,13,14,15,16,17,18,19,20,21,23,24,25,26,27,29,50,560,28,30,31,32,65537,4294967296'),10,0,id4) from tt2;
ERROR HY000: invalid type given for an argument
select rb_select(rb_from_string('1,2,3,4,5,6,7,8,9,10,11,12,13,14,15,16,17,18,19,20,21,23,24,25,26,27,29,50,560,28,30,31,32,65537,4294967296'),10,0,id5) from tt2;
ERROR HY000: invalid type given for an argument
select rb_select(rb_from_string('1,2,3,4,5,6,7,8,9,10,11,12,13,14,15,16,17,18,19,20,21,23,24,25,26,27,29,50,560,28,30,31,32,65537,4294967296'),10,0,id6) from tt2;
ERROR HY000: invalid type given for an argument
select rb_select(rb_from_string('1,2,3,4,5,6,7,8,9,10,11,12,13,14,15,16,17,18,19,20,21,23,24,25,26,27,29,50,560,28,30,31,32,65537,4294967296'),10,0,id7) from tt2;
ERROR HY000: invalid type given for an argument
select rb_select(rb_from_string('1,2,3,4,5,6,7,8,9,10,11,12,13,14,15,16,17,18,19,20,21,23,24,25,26,27,29,50,560,28,30,31,32,65537,4294967296'),10,0,id8) from tt2;
ERROR HY000: invalid type given for an argument
select rb_select(rb_from_string('1,2,3,4,5,6,7,8,9,10,11,12,13,14,15,16,17,18,19,20,21,23,24,25,26,27,29,50,560,28,30,31,32,65537,4294967296'),10,0,false,id0) from tt2;
ERROR HY000: invalid type given for an argument
select rb_select(rb_from_string('1,2,3,4,5,6,7,8,9,10,11,12,13,14,15,16,17,18,19,20,21,23,24,25,26,27,29,50,560,28,30,31,32,65537,4294967296'),10,0,false,id1) from tt2;
ERROR HY000: invalid type given for an argument
select rb_select(rb_from_string('1,2,3,4,5,6,7,8,9,10,11,12,13,14,15,16,17,18,19,20,21,23,24,25,26,27,29,50,560,28,30,31,32,65537,4294967296'),10,0,false,id2) from tt2;
ERROR HY000: invalid type given for an argument
select rb_select(rb_from_string('1,2,3,4,5,6,7,8,9,10,11,12,13,14,15,16,17,18,19,20,21,23,24,25,26,27,29,50,560,28,30,31,32,65537,4294967296'),10,0,false,id3) from tt2;
+---------------------------------------------------------------------------------------------------------------------------------------------------------+
| rb_select(rb_from_string('1,2,3,4,5,6,7,8,9,10,11,12,13,14,15,16,17,18,19,20,21,23,24,25,26,27,29,50,560,28,30,31,32,65537,4294967296'),10,0,false,id3) |
+---------------------------------------------------------------------------------------------------------------------------------------------------------+
| 
                        	   
                                                                                                                |
| 
                        	   
                                                                                                                |
| 
            	   
                                                                                                                            |
+---------------------------------------------------------------------------------------------------------------------------------------------------------+
select rb_select(rb_from_string('1,2,3,4,5,6,7,8,9,10,11,12,13,14,15,16,17,18,19,20,21,23,24,25,26,27,29,50,560,28,30,31,32,65537,4294967296'),10,0,false,id4) from tt2;
+---------------------------------------------------------------------------------------------------------------------------------------------------------+
| rb_select(rb_from_string('1,2,3,4,5,6,7,8,9,10,11,12,13,14,15,16,17,18,19,20,21,23,24,25,26,27,29,50,560,28,30,31,32,65537,4294967296'),10,0,false,id4) |
+---------------------------------------------------------------------------------------------------------------------------------------------------------+
| 
                        	   
                                                                                                                |
| 
                        	   
                                                                                                                |
| 
            	   
                                                                                                                            |
+---------------------------------------------------------------------------------------------------------------------------------------------------------+
select rb_select(rb_from_string('1,2,3,4,5,6,7,8,9,10,11,12,13,14,15,16,17,18,19,20,21,23,24,25,26,27,29,50,560,28,30,31,32,65537,4294967296'),10,0,false,id5) from tt2;
+---------------------------------------------------------------------------------------------------------------------------------------------------------+
| rb_select(rb_from_string('1,2,3,4,5,6,7,8,9,10,11,12,13,14,15,16,17,18,19,20,21,23,24,25,26,27,29,50,560,28,30,31,32,65537,4294967296'),10,0,false,id5) |
+---------------------------------------------------------------------------------------------------------------------------------------------------------+
| 
                        	   
                                                                                                                |
| 
                        	   
                                                                                                                |
| 
            	   
                                                                                                                            |
+---------------------------------------------------------------------------------------------------------------------------------------------------------+
select rb_select(rb_from_string('1,2,3,4,5,6,7,8,9,10,11,12,13,14,15,16,17,18,19,20,21,23,24,25,26,27,29,50,560,28,30,31,32,65537,4294967296'),10,0,false,id6) from tt2;
+---------------------------------------------------------------------------------------------------------------------------------------------------------+
| rb_select(rb_from_string('1,2,3,4,5,6,7,8,9,10,11,12,13,14,15,16,17,18,19,20,21,23,24,25,26,27,29,50,560,28,30,31,32,65537,4294967296'),10,0,false,id6) |
+---------------------------------------------------------------------------------------------------------------------------------------------------------+
| 
                        	   
                                                                                                                |
| 
                        	   
                                                                                                                |
| 
            	   
                                                                                                                            |
+---------------------------------------------------------------------------------------------------------------------------------------------------------+
select rb_select(rb_from_string('1,2,3,4,5,6,7,8,9,10,11,12,13,14,15,16,17,18,19,20,21,23,24,25,26,27,29,50,560,28,30,31,32,65537,4294967296'),10,0,false,id7) from tt2;
+---------------------------------------------------------------------------------------------------------------------------------------------------------+
| rb_select(rb_from_string('1,2,3,4,5,6,7,8,9,10,11,12,13,14,15,16,17,18,19,20,21,23,24,25,26,27,29,50,560,28,30,31,32,65537,4294967296'),10,0,false,id7) |
+---------------------------------------------------------------------------------------------------------------------------------------------------------+
| 
                        	   
                                                                                                                |
| 
                        	   
                                                                                                                |
| 
            	   
                                                                                                                            |
+---------------------------------------------------------------------------------------------------------------------------------------------------------+
select rb_select(rb_from_string('1,2,3,4,5,6,7,8,9,10,11,12,13,14,15,16,17,18,19,20,21,23,24,25,26,27,29,50,560,28,30,31,32,65537,4294967296'),10,0,false,id8) from tt2;
+---------------------------------------------------------------------------------------------------------------------------------------------------------+
| rb_select(rb_from_string('1,2,3,4,5,6,7,8,9,10,11,12,13,14,15,16,17,18,19,20,21,23,24,25,26,27,29,50,560,28,30,31,32,65537,4294967296'),10,0,false,id8) |
+---------------------------------------------------------------------------------------------------------------------------------------------------------+
| 
                        	   
                                                                                                                |
| 
                     	   
                                                                                                                   |
| 
            	   
                                                                                                                            |
+---------------------------------------------------------------------------------------------------------------------------------------------------------+
select rb_select(rb_from_string('1,2,3,4,5,6,7,8,9,10,11,12,13,14,15,16,17,18,19,20,21,23,24,25,26,27,29,50,560,28,30,31,32,65537,4294967296'),10,0,false,0,id0) from tt2;
ERROR HY000: invalid type given for an argument
select rb_select(rb_from_string('1,2,3,4,5,6,7,8,9,10,11,12,13,14,15,16,17,18,19,20,21,23,24,25,26,27,29,50,560,28,30,31,32,65537,4294967296'),10,0,false,0,id1) from tt2;
ERROR HY000: invalid type given for an argument
select rb_select(rb_from_string('1,2,3,4,5,6,7,8,9,10,11,12,13,14,15,16,17,18,19,20,21,23,24,25,26,27,29,50,560,28,30,31,32,65537,4294967296'),10,0,false,0,id2) from tt2;
ERROR HY000: invalid type given for an argument
select rb_select(rb_from_string('1,2,3,4,5,6,7,8,9,10,11,12,13,14,15,16,17,18,19,20,21,23,24,25,26,27,29,50,560,28,30,31,32,65537,4294967296'),10,0,false,0,id3) from tt2;
+-----------------------------------------------------------------------------------------------------------------------------------------------------------+
| rb_select(rb_from_string('1,2,3,4,5,6,7,8,9,10,11,12,13,14,15,16,17,18,19,20,21,23,24,25,26,27,29,50,560,28,30,31,32,65537,4294967296'),10,0,false,0,id3) |
+-----------------------------------------------------------------------------------------------------------------------------------------------------------+
|                                                                                                                                                          |
|                                                                                                                                                          |
|                                                                                                                                                    |
+-----------------------------------------------------------------------------------------------------------------------------------------------------------+
select rb_select(rb_from_string('1,2,3,4,5,6,7,8,9,10,11,12,13,14,15,16,17,18,19,20,21,23,24,25,26,27,29,50,560,28,30,31,32,65537,4294967296'),10,0,false,0,id4) from tt2;
+-----------------------------------------------------------------------------------------------------------------------------------------------------------+
| rb_select(rb_from_string('1,2,3,4,5,6,7,8,9,10,11,12,13,14,15,16,17,18,19,20,21,23,24,25,26,27,29,50,560,28,30,31,32,65537,4294967296'),10,0,false,0,id4) |
+-----------------------------------------------------------------------------------------------------------------------------------------------------------+
|                                                                                                                                                          |
|                                                                                                                                                          |
|                                                                                                                                                    |
+-----------------------------------------------------------------------------------------------------------------------------------------------------------+
select rb_select(rb_from_string('1,2,3,4,5,6,7,8,9,10,11,12,13,14,15,16,17,18,19,20,21,23,24,25,26,27,29,50,560,28,30,31,32,65537,4294967296'),10,0,false,0,id5) from vtt2;
+-----------------------------------------------------------------------------------------------------------------------------------------------------------+
| rb_select(rb_from_string('1,2,3,4,5,6,7,8,9,10,11,12,13,14,15,16,17,18,19,20,21,23,24,25,26,27,29,50,560,28,30,31,32,65537,4294967296'),10,0,false,0,id5) |
+-----------------------------------------------------------------------------------------------------------------------------------------------------------+
|                                                                                                                                                          |
|                                                                                                                                                          |
|                                                                                                                                                    |
+-----------------------------------------------------------------------------------------------------------------------------------------------------------+
select rb_select(rb_from_string('1,2,3,4,5,6,7,8,9,10,11,12,13,14,15,16,17,18,19,20,21,23,24,25,26,27,29,50,560,28,30,31,32,65537,4294967296'),10,0,false,0,id6) from vtt2;
+-----------------------------------------------------------------------------------------------------------------------------------------------------------+
| rb_select(rb_from_string('1,2,3,4,5,6,7,8,9,10,11,12,13,14,15,16,17,18,19,20,21,23,24,25,26,27,29,50,560,28,30,31,32,65537,4294967296'),10,0,false,0,id6) |
+-----------------------------------------------------------------------------------------------------------------------------------------------------------+
|                                                                                                                                                          |
|                                                                                                                                                          |
|                                                                                                                                                    |
+-----------------------------------------------------------------------------------------------------------------------------------------------------------+
select rb_select(rb_from_string('1,2,3,4,5,6,7,8,9,10,11,12,13,14,15,16,17,18,19,20,21,23,24,25,26,27,29,50,560,28,30,31,32,65537,4294967296'),10,0,false,0,id7) from vtt2;
+-----------------------------------------------------------------------------------------------------------------------------------------------------------+
| rb_select(rb_from_string('1,2,3,4,5,6,7,8,9,10,11,12,13,14,15,16,17,18,19,20,21,23,24,25,26,27,29,50,560,28,30,31,32,65537,4294967296'),10,0,false,0,id7) |
+-----------------------------------------------------------------------------------------------------------------------------------------------------------+
|                                                                                                                                                          |
|                                                                                                                                                          |
|                                                                                                                                                    |
+-----------------------------------------------------------------------------------------------------------------------------------------------------------+
select rb_select(rb_from_string('1,2,3,4,5,6,7,8,9,10,11,12,13,14,15,16,17,18,19,20,21,23,24,25,26,27,29,50,560,28,30,31,32,65537,4294967296'),10,0,false,0,id8) from vtt2;
+-----------------------------------------------------------------------------------------------------------------------------------------------------------+
| rb_select(rb_from_string('1,2,3,4,5,6,7,8,9,10,11,12,13,14,15,16,17,18,19,20,21,23,24,25,26,27,29,50,560,28,30,31,32,65537,4294967296'),10,0,false,0,id8) |
+-----------------------------------------------------------------------------------------------------------------------------------------------------------+
|                                                                                                                                                          |
|                                                                                                                                                        |
|                                                                                                                                                    |
+-----------------------------------------------------------------------------------------------------------------------------------------------------------+
drop table tt2;
create table tt2(a0 char(10),a1 VARCHAR(100),a3 binary(1),a4 VARBINARY(10),a5 set('1','0','5'),a6 ENUM('1','0','-5'));
insert into tt2 values(1,1,1,1,'1','1');
insert into tt2 values(0,0,0,0,'0','0');
insert into tt2 values(5,5,5,5,'5','-5');
drop view vtt2;
create view vtt2 as select * from tt2;
select rb_select(rb_from_string('1,2,3,4,5,6,7,8,9,10,11,12,13,14,15,16,17,18,19,20,21,23,24,25,26,27,29,50,560,28,30,31,32,65537,4294967296'),a0) from tt2;
+---------------------------------------------------------------------------------------------------------------------------------------------+
| rb_select(rb_from_string('1,2,3,4,5,6,7,8,9,10,11,12,13,14,15,16,17,18,19,20,21,23,24,25,26,27,29,50,560,28,30,31,32,65537,4294967296'),a0) |
+---------------------------------------------------------------------------------------------------------------------------------------------+
|                                                                                                                                          |
|                                                                                                                                            |
|                                                                                                                                     |
+---------------------------------------------------------------------------------------------------------------------------------------------+
select rb_select(rb_from_string('1,2,3,4,5,6,7,8,9,10,11,12,13,14,15,16,17,18,19,20,21,23,24,25,26,27,29,50,560,28,30,31,32,65537,4294967296'),a1) from tt2;
+---------------------------------------------------------------------------------------------------------------------------------------------+
| rb_select(rb_from_string('1,2,3,4,5,6,7,8,9,10,11,12,13,14,15,16,17,18,19,20,21,23,24,25,26,27,29,50,560,28,30,31,32,65537,4294967296'),a1) |
+---------------------------------------------------------------------------------------------------------------------------------------------+
|                                                                                                                                          |
|                                                                                                                                            |
|                                                                                                                                     |
+---------------------------------------------------------------------------------------------------------------------------------------------+
select rb_select(rb_from_string('1,2,3,4,5,6,7,8,9,10,11,12,13,14,15,16,17,18,19,20,21,23,24,25,26,27,29,50,560,28,30,31,32,65537,4294967296'),a3) from tt2;
+---------------------------------------------------------------------------------------------------------------------------------------------+
| rb_select(rb_from_string('1,2,3,4,5,6,7,8,9,10,11,12,13,14,15,16,17,18,19,20,21,23,24,25,26,27,29,50,560,28,30,31,32,65537,4294967296'),a3) |
+---------------------------------------------------------------------------------------------------------------------------------------------+
|                                                                                                                                          |
|                                                                                                                                            |
|                                                                                                                                     |
+---------------------------------------------------------------------------------------------------------------------------------------------+
select rb_select(rb_from_string('1,2,3,4,5,6,7,8,9,10,11,12,13,14,15,16,17,18,19,20,21,23,24,25,26,27,29,50,560,28,30,31,32,65537,4294967296'),a4) from tt2;
+---------------------------------------------------------------------------------------------------------------------------------------------+
| rb_select(rb_from_string('1,2,3,4,5,6,7,8,9,10,11,12,13,14,15,16,17,18,19,20,21,23,24,25,26,27,29,50,560,28,30,31,32,65537,4294967296'),a4) |
+---------------------------------------------------------------------------------------------------------------------------------------------+
|                                                                                                                                          |
|                                                                                                                                            |
|                                                                                                                                     |
+---------------------------------------------------------------------------------------------------------------------------------------------+
select rb_select(rb_from_string('1,2,3,4,5,6,7,8,9,10,11,12,13,14,15,16,17,18,19,20,21,23,24,25,26,27,29,50,560,28,30,31,32,65537,4294967296'),a5) from tt2;
ERROR HY000: invalid type given for an argument
select rb_select(rb_from_string('1,2,3,4,5,6,7,8,9,10,11,12,13,14,15,16,17,18,19,20,21,23,24,25,26,27,29,50,560,28,30,31,32,65537,4294967296'),a6) from vtt2;
ERROR HY000: invalid type given for an argument
select rb_select(rb_from_string('1,2,3,4,5,6,7,8,9,10,11,12,13,14,15,16,17,18,19,20,21,23,24,25,26,27,29,50,560,28,30,31,32,65537,4294967296'),10,a0) from tt2;
+------------------------------------------------------------------------------------------------------------------------------------------------+
| rb_select(rb_from_string('1,2,3,4,5,6,7,8,9,10,11,12,13,14,15,16,17,18,19,20,21,23,24,25,26,27,29,50,560,28,30,31,32,65537,4294967296'),10,a0) |
+------------------------------------------------------------------------------------------------------------------------------------------------+
| 
                     	   
                                                                                                          |
| 
                        	   
                                                                                                       |
| 
         	   
                                                                                                                      |
+------------------------------------------------------------------------------------------------------------------------------------------------+
select rb_select(rb_from_string('1,2,3,4,5,6,7,8,9,10,11,12,13,14,15,16,17,18,19,20,21,23,24,25,26,27,29,50,560,28,30,31,32,65537,4294967296'),10,a1) from tt2;
+------------------------------------------------------------------------------------------------------------------------------------------------+
| rb_select(rb_from_string('1,2,3,4,5,6,7,8,9,10,11,12,13,14,15,16,17,18,19,20,21,23,24,25,26,27,29,50,560,28,30,31,32,65537,4294967296'),10,a1) |
+------------------------------------------------------------------------------------------------------------------------------------------------+
| 
                     	   
                                                                                                          |
| 
                        	   
                                                                                                       |
| 
         	   
                                                                                                                      |
+------------------------------------------------------------------------------------------------------------------------------------------------+
select rb_select(rb_from_string('1,2,3,4,5,6,7,8,9,10,11,12,13,14,15,16,17,18,19,20,21,23,24,25,26,27,29,50,560,28,30,31,32,65537,4294967296'),10,a3) from tt2;
+------------------------------------------------------------------------------------------------------------------------------------------------+
| rb_select(rb_from_string('1,2,3,4,5,6,7,8,9,10,11,12,13,14,15,16,17,18,19,20,21,23,24,25,26,27,29,50,560,28,30,31,32,65537,4294967296'),10,a3) |
+------------------------------------------------------------------------------------------------------------------------------------------------+
| 
                     	   
                                                                                                          |
| 
                        	   
                                                                                                       |
| 
         	   
                                                                                                                      |
+------------------------------------------------------------------------------------------------------------------------------------------------+
select rb_select(rb_from_string('1,2,3,4,5,6,7,8,9,10,11,12,13,14,15,16,17,18,19,20,21,23,24,25,26,27,29,50,560,28,30,31,32,65537,4294967296'),10,a4) from tt2;
+------------------------------------------------------------------------------------------------------------------------------------------------+
| rb_select(rb_from_string('1,2,3,4,5,6,7,8,9,10,11,12,13,14,15,16,17,18,19,20,21,23,24,25,26,27,29,50,560,28,30,31,32,65537,4294967296'),10,a4) |
+------------------------------------------------------------------------------------------------------------------------------------------------+
| 
                     	   
                                                                                                          |
| 
                        	   
                                                                                                       |
| 
         	   
                                                                                                                      |
+------------------------------------------------------------------------------------------------------------------------------------------------+
select rb_select(rb_from_string('1,2,3,4,5,6,7,8,9,10,11,12,13,14,15,16,17,18,19,20,21,23,24,25,26,27,29,50,560,28,30,31,32,65537,4294967296'),10,a5) from tt2;
ERROR HY000: invalid type given for an argument
select rb_select(rb_from_string('1,2,3,4,5,6,7,8,9,10,11,12,13,14,15,16,17,18,19,20,21,23,24,25,26,27,29,50,560,28,30,31,32,65537,4294967296'),10,a6) from tt2;
ERROR HY000: invalid type given for an argument
select rb_select(rb_from_string('1,2,3,4,5,6,7,8,9,10,11,12,13,14,15,16,17,18,19,20,21,23,24,25,26,27,29,50,560,28,30,31,32,65537,4294967296'),10,0,a0) from tt2;
ERROR HY000: invalid type given for an argument
select rb_select(rb_from_string('1,2,3,4,5,6,7,8,9,10,11,12,13,14,15,16,17,18,19,20,21,23,24,25,26,27,29,50,560,28,30,31,32,65537,4294967296'),10,0,a1) from tt2;
ERROR HY000: invalid type given for an argument
select rb_select(rb_from_string('1,2,3,4,5,6,7,8,9,10,11,12,13,14,15,16,17,18,19,20,21,23,24,25,26,27,29,50,560,28,30,31,32,65537,4294967296'),10,0,a3) from tt2;
ERROR HY000: invalid type given for an argument
select rb_select(rb_from_string('1,2,3,4,5,6,7,8,9,10,11,12,13,14,15,16,17,18,19,20,21,23,24,25,26,27,29,50,560,28,30,31,32,65537,4294967296'),10,0,a4) from tt2;
ERROR HY000: invalid type given for an argument
select rb_select(rb_from_string('1,2,3,4,5,6,7,8,9,10,11,12,13,14,15,16,17,18,19,20,21,23,24,25,26,27,29,50,560,28,30,31,32,65537,4294967296'),10,0,a5) from tt2;
ERROR HY000: invalid type given for an argument
select rb_select(rb_from_string('1,2,3,4,5,6,7,8,9,10,11,12,13,14,15,16,17,18,19,20,21,23,24,25,26,27,29,50,560,28,30,31,32,65537,4294967296'),10,0,a6) from tt2;
ERROR HY000: invalid type given for an argument
select rb_select(rb_from_string('1,2,3,4,5,6,7,8,9,10,11,12,13,14,15,16,17,18,19,20,21,23,24,25,26,27,29,50,560,28,30,31,32,65537,4294967296'),10,0,false,a0) from tt2;
+--------------------------------------------------------------------------------------------------------------------------------------------------------+
| rb_select(rb_from_string('1,2,3,4,5,6,7,8,9,10,11,12,13,14,15,16,17,18,19,20,21,23,24,25,26,27,29,50,560,28,30,31,32,65537,4294967296'),10,0,false,a0) |
+--------------------------------------------------------------------------------------------------------------------------------------------------------+
| 
                        	   
                                                                                                               |
| 
                        	   
                                                                                                               |
| 
            	   
                                                                                                                           |
+--------------------------------------------------------------------------------------------------------------------------------------------------------+
select rb_select(rb_from_string('1,2,3,4,5,6,7,8,9,10,11,12,13,14,15,16,17,18,19,20,21,23,24,25,26,27,29,50,560,28,30,31,32,65537,4294967296'),10,0,false,a1) from tt2;
+--------------------------------------------------------------------------------------------------------------------------------------------------------+
| rb_select(rb_from_string('1,2,3,4,5,6,7,8,9,10,11,12,13,14,15,16,17,18,19,20,21,23,24,25,26,27,29,50,560,28,30,31,32,65537,4294967296'),10,0,false,a1) |
+--------------------------------------------------------------------------------------------------------------------------------------------------------+
| 
                        	   
                                                                                                               |
| 
                        	   
                                                                                                               |
| 
            	   
                                                                                                                           |
+--------------------------------------------------------------------------------------------------------------------------------------------------------+
select rb_select(rb_from_string('1,2,3,4,5,6,7,8,9,10,11,12,13,14,15,16,17,18,19,20,21,23,24,25,26,27,29,50,560,28,30,31,32,65537,4294967296'),10,0,false,a3) from tt2;
+--------------------------------------------------------------------------------------------------------------------------------------------------------+
| rb_select(rb_from_string('1,2,3,4,5,6,7,8,9,10,11,12,13,14,15,16,17,18,19,20,21,23,24,25,26,27,29,50,560,28,30,31,32,65537,4294967296'),10,0,false,a3) |
+--------------------------------------------------------------------------------------------------------------------------------------------------------+
| 
                        	   
                                                                                                               |
| 
                        	   
                                                                                                               |
| 
            	   
                                                                                                                           |
+--------------------------------------------------------------------------------------------------------------------------------------------------------+
select rb_select(rb_from_string('1,2,3,4,5,6,7,8,9,10,11,12,13,14,15,16,17,18,19,20,21,23,24,25,26,27,29,50,560,28,30,31,32,65537,4294967296'),10,0,false,a4) from tt2;
+--------------------------------------------------------------------------------------------------------------------------------------------------------+
| rb_select(rb_from_string('1,2,3,4,5,6,7,8,9,10,11,12,13,14,15,16,17,18,19,20,21,23,24,25,26,27,29,50,560,28,30,31,32,65537,4294967296'),10,0,false,a4) |
+--------------------------------------------------------------------------------------------------------------------------------------------------------+
| 
                        	   
                                                                                                               |
| 
                        	   
                                                                                                               |
| 
            	   
                                                                                                                           |
+--------------------------------------------------------------------------------------------------------------------------------------------------------+
select rb_select(rb_from_string('1,2,3,4,5,6,7,8,9,10,11,12,13,14,15,16,17,18,19,20,21,23,24,25,26,27,29,50,560,28,30,31,32,65537,4294967296'),10,0,false,a5) from tt2;
ERROR HY000: invalid type given for an argument
select rb_select(rb_from_string('1,2,3,4,5,6,7,8,9,10,11,12,13,14,15,16,17,18,19,20,21,23,24,25,26,27,29,50,560,28,30,31,32,65537,4294967296'),10,0,false,a6) from tt2;
ERROR HY000: invalid type given for an argument
select rb_select(rb_from_string('1,2,3,4,5,6,7,8,9,10,11,12,13,14,15,16,17,18,19,20,21,23,24,25,26,27,29,50,560,28,30,31,32,65537,4294967296'),10,0,false,0,a0) from tt2;
+----------------------------------------------------------------------------------------------------------------------------------------------------------+
| rb_select(rb_from_string('1,2,3,4,5,6,7,8,9,10,11,12,13,14,15,16,17,18,19,20,21,23,24,25,26,27,29,50,560,28,30,31,32,65537,4294967296'),10,0,false,0,a0) |
+----------------------------------------------------------------------------------------------------------------------------------------------------------+
|                                                                                                                                                         |
|                                                                                                                                                         |
|                                                                                                                                                   |
+----------------------------------------------------------------------------------------------------------------------------------------------------------+
select rb_select(rb_from_string('1,2,3,4,5,6,7,8,9,10,11,12,13,14,15,16,17,18,19,20,21,23,24,25,26,27,29,50,560,28,30,31,32,65537,4294967296'),10,0,false,0,a1) from tt2;
+----------------------------------------------------------------------------------------------------------------------------------------------------------+
| rb_select(rb_from_string('1,2,3,4,5,6,7,8,9,10,11,12,13,14,15,16,17,18,19,20,21,23,24,25,26,27,29,50,560,28,30,31,32,65537,4294967296'),10,0,false,0,a1) |
+----------------------------------------------------------------------------------------------------------------------------------------------------------+
|                                                                                                                                                         |
|                                                                                                                                                         |
|                                                                                                                                                   |
+----------------------------------------------------------------------------------------------------------------------------------------------------------+
select rb_select(rb_from_string('1,2,3,4,5,6,7,8,9,10,11,12,13,14,15,16,17,18,19,20,21,23,24,25,26,27,29,50,560,28,30,31,32,65537,4294967296'),10,0,false,0,a3) from tt2;
+----------------------------------------------------------------------------------------------------------------------------------------------------------+
| rb_select(rb_from_string('1,2,3,4,5,6,7,8,9,10,11,12,13,14,15,16,17,18,19,20,21,23,24,25,26,27,29,50,560,28,30,31,32,65537,4294967296'),10,0,false,0,a3) |
+----------------------------------------------------------------------------------------------------------------------------------------------------------+
|                                                                                                                                                         |
|                                                                                                                                                         |
|                                                                                                                                                   |
+----------------------------------------------------------------------------------------------------------------------------------------------------------+
select rb_select(rb_from_string('1,2,3,4,5,6,7,8,9,10,11,12,13,14,15,16,17,18,19,20,21,23,24,25,26,27,29,50,560,28,30,31,32,65537,4294967296'),10,0,false,0,a4) from tt2;
+----------------------------------------------------------------------------------------------------------------------------------------------------------+
| rb_select(rb_from_string('1,2,3,4,5,6,7,8,9,10,11,12,13,14,15,16,17,18,19,20,21,23,24,25,26,27,29,50,560,28,30,31,32,65537,4294967296'),10,0,false,0,a4) |
+----------------------------------------------------------------------------------------------------------------------------------------------------------+
|                                                                                                                                                         |
|                                                                                                                                                         |
|                                                                                                                                                   |
+----------------------------------------------------------------------------------------------------------------------------------------------------------+
select rb_select(rb_from_string('1,2,3,4,5,6,7,8,9,10,11,12,13,14,15,16,17,18,19,20,21,23,24,25,26,27,29,50,560,28,30,31,32,65537,4294967296'),10,0,false,0,a5) from tt2;
ERROR HY000: invalid type given for an argument
select rb_select(rb_from_string('1,2,3,4,5,6,7,8,9,10,11,12,13,14,15,16,17,18,19,20,21,23,24,25,26,27,29,50,560,28,30,31,32,65537,4294967296'),10,0,false,0,a6) from vtt2;
ERROR HY000: invalid type given for an argument
drop table tt2;
create table tt2(a0 TINYBLOB,a1 BLOB,a3 MEDIUMBLOB,a4 LONGBLOB,a5 TEXT ,a6 TINYTEXT,a7 MEDIUMTEXT,a8 LONGTEXT);
insert into tt2 values(1,1,1,1,'1','1','1','1');
insert into tt2 values(0,0,0,0,'0','0','0',0);
insert into tt2 values(5,5,5,5,'5','-5',5,5);
drop view vtt2;
create view vtt2 as select * from tt2;
select rb_select(rb_from_string('1,2,3,4,5,6,7,8,9,10,11,12,13,14,15,16,17,18,19,20,21,23,24,25,26,27,29,50,560,28,30,31,32,65537,4294967296'),a0) from tt2;
+---------------------------------------------------------------------------------------------------------------------------------------------+
| rb_select(rb_from_string('1,2,3,4,5,6,7,8,9,10,11,12,13,14,15,16,17,18,19,20,21,23,24,25,26,27,29,50,560,28,30,31,32,65537,4294967296'),a0) |
+---------------------------------------------------------------------------------------------------------------------------------------------+
|                                                                                                                                          |
|                                                                                                                                            |
|                                                                                                                                     |
+---------------------------------------------------------------------------------------------------------------------------------------------+
select rb_select(rb_from_string('1,2,3,4,5,6,7,8,9,10,11,12,13,14,15,16,17,18,19,20,21,23,24,25,26,27,29,50,560,28,30,31,32,65537,4294967296'),a1) from tt2;
+---------------------------------------------------------------------------------------------------------------------------------------------+
| rb_select(rb_from_string('1,2,3,4,5,6,7,8,9,10,11,12,13,14,15,16,17,18,19,20,21,23,24,25,26,27,29,50,560,28,30,31,32,65537,4294967296'),a1) |
+---------------------------------------------------------------------------------------------------------------------------------------------+
|                                                                                                                                          |
|                                                                                                                                            |
|                                                                                                                                     |
+---------------------------------------------------------------------------------------------------------------------------------------------+
select rb_select(rb_from_string('1,2,3,4,5,6,7,8,9,10,11,12,13,14,15,16,17,18,19,20,21,23,24,25,26,27,29,50,560,28,30,31,32,65537,4294967296'),a3) from tt2;
+---------------------------------------------------------------------------------------------------------------------------------------------+
| rb_select(rb_from_string('1,2,3,4,5,6,7,8,9,10,11,12,13,14,15,16,17,18,19,20,21,23,24,25,26,27,29,50,560,28,30,31,32,65537,4294967296'),a3) |
+---------------------------------------------------------------------------------------------------------------------------------------------+
|                                                                                                                                          |
|                                                                                                                                            |
|                                                                                                                                     |
+---------------------------------------------------------------------------------------------------------------------------------------------+
select rb_select(rb_from_string('1,2,3,4,5,6,7,8,9,10,11,12,13,14,15,16,17,18,19,20,21,23,24,25,26,27,29,50,560,28,30,31,32,65537,4294967296'),a4) from tt2;
+---------------------------------------------------------------------------------------------------------------------------------------------+
| rb_select(rb_from_string('1,2,3,4,5,6,7,8,9,10,11,12,13,14,15,16,17,18,19,20,21,23,24,25,26,27,29,50,560,28,30,31,32,65537,4294967296'),a4) |
+---------------------------------------------------------------------------------------------------------------------------------------------+
|                                                                                                                                          |
|                                                                                                                                            |
|                                                                                                                                     |
+---------------------------------------------------------------------------------------------------------------------------------------------+
select rb_select(rb_from_string('1,2,3,4,5,6,7,8,9,10,11,12,13,14,15,16,17,18,19,20,21,23,24,25,26,27,29,50,560,28,30,31,32,65537,4294967296'),a5) from tt2;
+---------------------------------------------------------------------------------------------------------------------------------------------+
| rb_select(rb_from_string('1,2,3,4,5,6,7,8,9,10,11,12,13,14,15,16,17,18,19,20,21,23,24,25,26,27,29,50,560,28,30,31,32,65537,4294967296'),a5) |
+---------------------------------------------------------------------------------------------------------------------------------------------+
|                                                                                                                                          |
|                                                                                                                                            |
|                                                                                                                                     |
+---------------------------------------------------------------------------------------------------------------------------------------------+
select rb_select(rb_from_string('1,2,3,4,5,6,7,8,9,10,11,12,13,14,15,16,17,18,19,20,21,23,24,25,26,27,29,50,560,28,30,31,32,65537,4294967296'),a6) from vtt2;
+---------------------------------------------------------------------------------------------------------------------------------------------+
| rb_select(rb_from_string('1,2,3,4,5,6,7,8,9,10,11,12,13,14,15,16,17,18,19,20,21,23,24,25,26,27,29,50,560,28,30,31,32,65537,4294967296'),a6) |
+---------------------------------------------------------------------------------------------------------------------------------------------+
|                                                                                                                                          |
|                                                                                                                                            |
|            :0               Z           	 
                       2 0    :0                          |
+---------------------------------------------------------------------------------------------------------------------------------------------+
select rb_select(rb_from_string('1,2,3,4,5,6,7,8,9,10,11,12,13,14,15,16,17,18,19,20,21,23,24,25,26,27,29,50,560,28,30,31,32,65537,4294967296'),a7) from vtt2;
+---------------------------------------------------------------------------------------------------------------------------------------------+
| rb_select(rb_from_string('1,2,3,4,5,6,7,8,9,10,11,12,13,14,15,16,17,18,19,20,21,23,24,25,26,27,29,50,560,28,30,31,32,65537,4294967296'),a7) |
+---------------------------------------------------------------------------------------------------------------------------------------------+
|                                                                                                                                          |
|                                                                                                                                            |
|                                                                                                                                     |
+---------------------------------------------------------------------------------------------------------------------------------------------+
select rb_select(rb_from_string('1,2,3,4,5,6,7,8,9,10,11,12,13,14,15,16,17,18,19,20,21,23,24,25,26,27,29,50,560,28,30,31,32,65537,4294967296'),a8) from vtt2;
+---------------------------------------------------------------------------------------------------------------------------------------------+
| rb_select(rb_from_string('1,2,3,4,5,6,7,8,9,10,11,12,13,14,15,16,17,18,19,20,21,23,24,25,26,27,29,50,560,28,30,31,32,65537,4294967296'),a8) |
+---------------------------------------------------------------------------------------------------------------------------------------------+
|                                                                                                                                          |
|                                                                                                                                            |
|                                                                                                                                     |
+---------------------------------------------------------------------------------------------------------------------------------------------+
select rb_select(rb_from_string('1,2,3,4,5,6,7,8,9,10,11,12,13,14,15,16,17,18,19,20,21,23,24,25,26,27,29,50,560,28,30,31,32,65537,4294967296'),10,a0) from tt2;
+------------------------------------------------------------------------------------------------------------------------------------------------+
| rb_select(rb_from_string('1,2,3,4,5,6,7,8,9,10,11,12,13,14,15,16,17,18,19,20,21,23,24,25,26,27,29,50,560,28,30,31,32,65537,4294967296'),10,a0) |
+------------------------------------------------------------------------------------------------------------------------------------------------+
| 
                     	   
                                                                                                          |
| 
                        	   
                                                                                                       |
| 
         	   
                                                                                                                      |
+------------------------------------------------------------------------------------------------------------------------------------------------+
select rb_select(rb_from_string('1,2,3,4,5,6,7,8,9,10,11,12,13,14,15,16,17,18,19,20,21,23,24,25,26,27,29,50,560,28,30,31,32,65537,4294967296'),10,a1) from tt2;
+------------------------------------------------------------------------------------------------------------------------------------------------+
| rb_select(rb_from_string('1,2,3,4,5,6,7,8,9,10,11,12,13,14,15,16,17,18,19,20,21,23,24,25,26,27,29,50,560,28,30,31,32,65537,4294967296'),10,a1) |
+------------------------------------------------------------------------------------------------------------------------------------------------+
| 
                     	   
                                                                                                          |
| 
                        	   
                                                                                                       |
| 
         	   
                                                                                                                      |
+------------------------------------------------------------------------------------------------------------------------------------------------+
select rb_select(rb_from_string('1,2,3,4,5,6,7,8,9,10,11,12,13,14,15,16,17,18,19,20,21,23,24,25,26,27,29,50,560,28,30,31,32,65537,4294967296'),10,a3) from tt2;
+------------------------------------------------------------------------------------------------------------------------------------------------+
| rb_select(rb_from_string('1,2,3,4,5,6,7,8,9,10,11,12,13,14,15,16,17,18,19,20,21,23,24,25,26,27,29,50,560,28,30,31,32,65537,4294967296'),10,a3) |
+------------------------------------------------------------------------------------------------------------------------------------------------+
| 
                     	   
                                                                                                          |
| 
                        	   
                                                                                                       |
| 
         	   
                                                                                                                      |
+------------------------------------------------------------------------------------------------------------------------------------------------+
select rb_select(rb_from_string('1,2,3,4,5,6,7,8,9,10,11,12,13,14,15,16,17,18,19,20,21,23,24,25,26,27,29,50,560,28,30,31,32,65537,4294967296'),10,a4) from tt2;
+------------------------------------------------------------------------------------------------------------------------------------------------+
| rb_select(rb_from_string('1,2,3,4,5,6,7,8,9,10,11,12,13,14,15,16,17,18,19,20,21,23,24,25,26,27,29,50,560,28,30,31,32,65537,4294967296'),10,a4) |
+------------------------------------------------------------------------------------------------------------------------------------------------+
| 
                     	   
                                                                                                          |
| 
                        	   
                                                                                                       |
| 
         	   
                                                                                                                      |
+------------------------------------------------------------------------------------------------------------------------------------------------+
select rb_select(rb_from_string('1,2,3,4,5,6,7,8,9,10,11,12,13,14,15,16,17,18,19,20,21,23,24,25,26,27,29,50,560,28,30,31,32,65537,4294967296'),10,a5) from tt2;
+------------------------------------------------------------------------------------------------------------------------------------------------+
| rb_select(rb_from_string('1,2,3,4,5,6,7,8,9,10,11,12,13,14,15,16,17,18,19,20,21,23,24,25,26,27,29,50,560,28,30,31,32,65537,4294967296'),10,a5) |
+------------------------------------------------------------------------------------------------------------------------------------------------+
| 
                     	   
                                                                                                          |
| 
                        	   
                                                                                                       |
| 
         	   
                                                                                                                      |
+------------------------------------------------------------------------------------------------------------------------------------------------+
select rb_select(rb_from_string('1,2,3,4,5,6,7,8,9,10,11,12,13,14,15,16,17,18,19,20,21,23,24,25,26,27,29,50,560,28,30,31,32,65537,4294967296'),10,a6) from tt2;
+------------------------------------------------------------------------------------------------------------------------------------------------+
| rb_select(rb_from_string('1,2,3,4,5,6,7,8,9,10,11,12,13,14,15,16,17,18,19,20,21,23,24,25,26,27,29,50,560,28,30,31,32,65537,4294967296'),10,a6) |
+------------------------------------------------------------------------------------------------------------------------------------------------+
| 
                     	   
                                                                                                          |
| 
                        	   
                                                                                                       |
|                                                                                                                                               |
+------------------------------------------------------------------------------------------------------------------------------------------------+
select rb_select(rb_from_string('1,2,3,4,5,6,7,8,9,10,11,12,13,14,15,16,17,18,19,20,21,23,24,25,26,27,29,50,560,28,30,31,32,65537,4294967296'),10,a7) from tt2;
+------------------------------------------------------------------------------------------------------------------------------------------------+
| rb_select(rb_from_string('1,2,3,4,5,6,7,8,9,10,11,12,13,14,15,16,17,18,19,20,21,23,24,25,26,27,29,50,560,28,30,31,32,65537,4294967296'),10,a7) |
+------------------------------------------------------------------------------------------------------------------------------------------------+
| 
                     	   
                                                                                                          |
| 
                        	   
                                                                                                       |
| 
         	   
                                                                                                                      |
+------------------------------------------------------------------------------------------------------------------------------------------------+
select rb_select(rb_from_string('1,2,3,4,5,6,7,8,9,10,11,12,13,14,15,16,17,18,19,20,21,23,24,25,26,27,29,50,560,28,30,31,32,65537,4294967296'),10,a8) from tt2;
+------------------------------------------------------------------------------------------------------------------------------------------------+
| rb_select(rb_from_string('1,2,3,4,5,6,7,8,9,10,11,12,13,14,15,16,17,18,19,20,21,23,24,25,26,27,29,50,560,28,30,31,32,65537,4294967296'),10,a8) |
+------------------------------------------------------------------------------------------------------------------------------------------------+
| 
                     	   
                                                                                                          |
| 
                        	   
                                                                                                       |
| 
         	   
                                                                                                                      |
+------------------------------------------------------------------------------------------------------------------------------------------------+
select rb_select(rb_from_string('1,2,3,4,5,6,7,8,9,10,11,12,13,14,15,16,17,18,19,20,21,23,24,25,26,27,29,50,560,28,30,31,32,65537,4294967296'),10,0,a0) from tt2;
ERROR HY000: invalid type given for an argument
select rb_select(rb_from_string('1,2,3,4,5,6,7,8,9,10,11,12,13,14,15,16,17,18,19,20,21,23,24,25,26,27,29,50,560,28,30,31,32,65537,4294967296'),10,0,a1) from tt2;
ERROR HY000: invalid type given for an argument
select rb_select(rb_from_string('1,2,3,4,5,6,7,8,9,10,11,12,13,14,15,16,17,18,19,20,21,23,24,25,26,27,29,50,560,28,30,31,32,65537,4294967296'),10,0,a3) from tt2;
ERROR HY000: invalid type given for an argument
select rb_select(rb_from_string('1,2,3,4,5,6,7,8,9,10,11,12,13,14,15,16,17,18,19,20,21,23,24,25,26,27,29,50,560,28,30,31,32,65537,4294967296'),10,0,a4) from tt2;
ERROR HY000: invalid type given for an argument
select rb_select(rb_from_string('1,2,3,4,5,6,7,8,9,10,11,12,13,14,15,16,17,18,19,20,21,23,24,25,26,27,29,50,560,28,30,31,32,65537,4294967296'),10,0,a5) from tt2;
ERROR HY000: invalid type given for an argument
select rb_select(rb_from_string('1,2,3,4,5,6,7,8,9,10,11,12,13,14,15,16,17,18,19,20,21,23,24,25,26,27,29,50,560,28,30,31,32,65537,4294967296'),10,0,a6) from tt2;
ERROR HY000: invalid type given for an argument
select rb_select(rb_from_string('1,2,3,4,5,6,7,8,9,10,11,12,13,14,15,16,17,18,19,20,21,23,24,25,26,27,29,50,560,28,30,31,32,65537,4294967296'),10,0,a7) from tt2;
ERROR HY000: invalid type given for an argument
select rb_select(rb_from_string('1,2,3,4,5,6,7,8,9,10,11,12,13,14,15,16,17,18,19,20,21,23,24,25,26,27,29,50,560,28,30,31,32,65537,4294967296'),10,0,a8) from tt2;
ERROR HY000: invalid type given for an argument
select rb_select(rb_from_string('1,2,3,4,5,6,7,8,9,10,11,12,13,14,15,16,17,18,19,20,21,23,24,25,26,27,29,50,560,28,30,31,32,65537,4294967296'),10,0,false,a0) from tt2;
+--------------------------------------------------------------------------------------------------------------------------------------------------------+
| rb_select(rb_from_string('1,2,3,4,5,6,7,8,9,10,11,12,13,14,15,16,17,18,19,20,21,23,24,25,26,27,29,50,560,28,30,31,32,65537,4294967296'),10,0,false,a0) |
+--------------------------------------------------------------------------------------------------------------------------------------------------------+
| 
                        	   
                                                                                                               |
| 
                        	   
                                                                                                               |
| 
            	   
                                                                                                                           |
+--------------------------------------------------------------------------------------------------------------------------------------------------------+
select rb_select(rb_from_string('1,2,3,4,5,6,7,8,9,10,11,12,13,14,15,16,17,18,19,20,21,23,24,25,26,27,29,50,560,28,30,31,32,65537,4294967296'),10,0,false,a1) from tt2;
+--------------------------------------------------------------------------------------------------------------------------------------------------------+
| rb_select(rb_from_string('1,2,3,4,5,6,7,8,9,10,11,12,13,14,15,16,17,18,19,20,21,23,24,25,26,27,29,50,560,28,30,31,32,65537,4294967296'),10,0,false,a1) |
+--------------------------------------------------------------------------------------------------------------------------------------------------------+
| 
                        	   
                                                                                                               |
| 
                        	   
                                                                                                               |
| 
            	   
                                                                                                                           |
+--------------------------------------------------------------------------------------------------------------------------------------------------------+
select rb_select(rb_from_string('1,2,3,4,5,6,7,8,9,10,11,12,13,14,15,16,17,18,19,20,21,23,24,25,26,27,29,50,560,28,30,31,32,65537,4294967296'),10,0,false,a3) from tt2;
+--------------------------------------------------------------------------------------------------------------------------------------------------------+
| rb_select(rb_from_string('1,2,3,4,5,6,7,8,9,10,11,12,13,14,15,16,17,18,19,20,21,23,24,25,26,27,29,50,560,28,30,31,32,65537,4294967296'),10,0,false,a3) |
+--------------------------------------------------------------------------------------------------------------------------------------------------------+
| 
                        	   
                                                                                                               |
| 
                        	   
                                                                                                               |
| 
            	   
                                                                                                                           |
+--------------------------------------------------------------------------------------------------------------------------------------------------------+
select rb_select(rb_from_string('1,2,3,4,5,6,7,8,9,10,11,12,13,14,15,16,17,18,19,20,21,23,24,25,26,27,29,50,560,28,30,31,32,65537,4294967296'),10,0,false,a4) from tt2;
+--------------------------------------------------------------------------------------------------------------------------------------------------------+
| rb_select(rb_from_string('1,2,3,4,5,6,7,8,9,10,11,12,13,14,15,16,17,18,19,20,21,23,24,25,26,27,29,50,560,28,30,31,32,65537,4294967296'),10,0,false,a4) |
+--------------------------------------------------------------------------------------------------------------------------------------------------------+
| 
                        	   
                                                                                                               |
| 
                        	   
                                                                                                               |
| 
            	   
                                                                                                                           |
+--------------------------------------------------------------------------------------------------------------------------------------------------------+
select rb_select(rb_from_string('1,2,3,4,5,6,7,8,9,10,11,12,13,14,15,16,17,18,19,20,21,23,24,25,26,27,29,50,560,28,30,31,32,65537,4294967296'),10,0,false,a5) from tt2;
+--------------------------------------------------------------------------------------------------------------------------------------------------------+
| rb_select(rb_from_string('1,2,3,4,5,6,7,8,9,10,11,12,13,14,15,16,17,18,19,20,21,23,24,25,26,27,29,50,560,28,30,31,32,65537,4294967296'),10,0,false,a5) |
+--------------------------------------------------------------------------------------------------------------------------------------------------------+
| 
                        	   
                                                                                                               |
| 
                        	   
                                                                                                               |
| 
            	   
                                                                                                                           |
+--------------------------------------------------------------------------------------------------------------------------------------------------------+
select rb_select(rb_from_string('1,2,3,4,5,6,7,8,9,10,11,12,13,14,15,16,17,18,19,20,21,23,24,25,26,27,29,50,560,28,30,31,32,65537,4294967296'),10,0,false,a6) from tt2;
+--------------------------------------------------------------------------------------------------------------------------------------------------------+
| rb_select(rb_from_string('1,2,3,4,5,6,7,8,9,10,11,12,13,14,15,16,17,18,19,20,21,23,24,25,26,27,29,50,560,28,30,31,32,65537,4294967296'),10,0,false,a6) |
+--------------------------------------------------------------------------------------------------------------------------------------------------------+
| 
                        	   
                                                                                                               |
| 
                        	   
                                                                                                               |
|                                                                                                                                                       |
+--------------------------------------------------------------------------------------------------------------------------------------------------------+
select rb_select(rb_from_string('1,2,3,4,5,6,7,8,9,10,11,12,13,14,15,16,17,18,19,20,21,23,24,25,26,27,29,50,560,28,30,31,32,65537,4294967296'),10,0,false,a7) from tt2;
+--------------------------------------------------------------------------------------------------------------------------------------------------------+
| rb_select(rb_from_string('1,2,3,4,5,6,7,8,9,10,11,12,13,14,15,16,17,18,19,20,21,23,24,25,26,27,29,50,560,28,30,31,32,65537,4294967296'),10,0,false,a7) |
+--------------------------------------------------------------------------------------------------------------------------------------------------------+
| 
                        	   
                                                                                                               |
| 
                        	   
                                                                                                               |
| 
            	   
                                                                                                                           |
+--------------------------------------------------------------------------------------------------------------------------------------------------------+
select rb_select(rb_from_string('1,2,3,4,5,6,7,8,9,10,11,12,13,14,15,16,17,18,19,20,21,23,24,25,26,27,29,50,560,28,30,31,32,65537,4294967296'),10,0,true,a8) from tt2;
+-------------------------------------------------------------------------------------------------------------------------------------------------------+
| rb_select(rb_from_string('1,2,3,4,5,6,7,8,9,10,11,12,13,14,15,16,17,18,19,20,21,23,24,25,26,27,29,50,560,28,30,31,32,65537,4294967296'),10,0,true,a8) |
+-------------------------------------------------------------------------------------------------------------------------------------------------------+
| 
                                  0                            2                                                                          |
| 
                                  0                            2                                                                          |
| 
                                  0                            2                                                                          |
+-------------------------------------------------------------------------------------------------------------------------------------------------------+
select rb_select(rb_from_string('1,2,3,4,5,6,7,8,9,10,11,12,13,14,15,16,17,18,19,20,21,23,24,25,26,27,29,50,560,28,30,31,32,65537,4294967296'),10,0,false,0,a0) from tt2;
+----------------------------------------------------------------------------------------------------------------------------------------------------------+
| rb_select(rb_from_string('1,2,3,4,5,6,7,8,9,10,11,12,13,14,15,16,17,18,19,20,21,23,24,25,26,27,29,50,560,28,30,31,32,65537,4294967296'),10,0,false,0,a0) |
+----------------------------------------------------------------------------------------------------------------------------------------------------------+
|                                                                                                                                                         |
|                                                                                                                                                         |
|                                                                                                                                                   |
+----------------------------------------------------------------------------------------------------------------------------------------------------------+
select rb_select(rb_from_string('1,2,3,4,5,6,7,8,9,10,11,12,13,14,15,16,17,18,19,20,21,23,24,25,26,27,29,50,560,28,30,31,32,65537,4294967296'),10,0,false,0,a1) from tt2;
+----------------------------------------------------------------------------------------------------------------------------------------------------------+
| rb_select(rb_from_string('1,2,3,4,5,6,7,8,9,10,11,12,13,14,15,16,17,18,19,20,21,23,24,25,26,27,29,50,560,28,30,31,32,65537,4294967296'),10,0,false,0,a1) |
+----------------------------------------------------------------------------------------------------------------------------------------------------------+
|                                                                                                                                                         |
|                                                                                                                                                         |
|                                                                                                                                                   |
+----------------------------------------------------------------------------------------------------------------------------------------------------------+
select rb_select(rb_from_string('1,2,3,4,5,6,7,8,9,10,11,12,13,14,15,16,17,18,19,20,21,23,24,25,26,27,29,50,560,28,30,31,32,65537,4294967296'),10,0,false,0,a3) from tt2;
+----------------------------------------------------------------------------------------------------------------------------------------------------------+
| rb_select(rb_from_string('1,2,3,4,5,6,7,8,9,10,11,12,13,14,15,16,17,18,19,20,21,23,24,25,26,27,29,50,560,28,30,31,32,65537,4294967296'),10,0,false,0,a3) |
+----------------------------------------------------------------------------------------------------------------------------------------------------------+
|                                                                                                                                                         |
|                                                                                                                                                         |
|                                                                                                                                                   |
+----------------------------------------------------------------------------------------------------------------------------------------------------------+
select rb_select(rb_from_string('1,2,3,4,5,6,7,8,9,10,11,12,13,14,15,16,17,18,19,20,21,23,24,25,26,27,29,50,560,28,30,31,32,65537,4294967296'),10,0,false,0,a4) from tt2;
+----------------------------------------------------------------------------------------------------------------------------------------------------------+
| rb_select(rb_from_string('1,2,3,4,5,6,7,8,9,10,11,12,13,14,15,16,17,18,19,20,21,23,24,25,26,27,29,50,560,28,30,31,32,65537,4294967296'),10,0,false,0,a4) |
+----------------------------------------------------------------------------------------------------------------------------------------------------------+
|                                                                                                                                                         |
|                                                                                                                                                         |
|                                                                                                                                                   |
+----------------------------------------------------------------------------------------------------------------------------------------------------------+
select rb_select(rb_from_string('1,2,3,4,5,6,7,8,9,10,11,12,13,14,15,16,17,18,19,20,21,23,24,25,26,27,29,50,560,28,30,31,32,65537,4294967296'),10,0,false,0,a5) from tt2;
+----------------------------------------------------------------------------------------------------------------------------------------------------------+
| rb_select(rb_from_string('1,2,3,4,5,6,7,8,9,10,11,12,13,14,15,16,17,18,19,20,21,23,24,25,26,27,29,50,560,28,30,31,32,65537,4294967296'),10,0,false,0,a5) |
+----------------------------------------------------------------------------------------------------------------------------------------------------------+
|                                                                                                                                                         |
|                                                                                                                                                         |
|                                                                                                                                                   |
+----------------------------------------------------------------------------------------------------------------------------------------------------------+
select rb_select(rb_from_string('1,2,3,4,5,6,7,8,9,10,11,12,13,14,15,16,17,18,19,20,21,23,24,25,26,27,29,50,560,28,30,31,32,65537,4294967296'),10,0,false,0,a6) from vtt2;
+----------------------------------------------------------------------------------------------------------------------------------------------------------+
| rb_select(rb_from_string('1,2,3,4,5,6,7,8,9,10,11,12,13,14,15,16,17,18,19,20,21,23,24,25,26,27,29,50,560,28,30,31,32,65537,4294967296'),10,0,false,0,a6) |
+----------------------------------------------------------------------------------------------------------------------------------------------------------+
|                                                                                                                                                         |
|                                                                                                                                                         |
| 
                        	   
                                                                                                                 |
+----------------------------------------------------------------------------------------------------------------------------------------------------------+
select rb_select(rb_from_string('1,2,3,4,5,6,7,8,9,10,11,12,13,14,15,16,17,18,19,20,21,23,24,25,26,27,29,50,560,28,30,31,32,65537,4294967296'),10,0,false,0,a7) from tt2;
+----------------------------------------------------------------------------------------------------------------------------------------------------------+
| rb_select(rb_from_string('1,2,3,4,5,6,7,8,9,10,11,12,13,14,15,16,17,18,19,20,21,23,24,25,26,27,29,50,560,28,30,31,32,65537,4294967296'),10,0,false,0,a7) |
+----------------------------------------------------------------------------------------------------------------------------------------------------------+
|                                                                                                                                                         |
|                                                                                                                                                         |
|                                                                                                                                                   |
+----------------------------------------------------------------------------------------------------------------------------------------------------------+
select rb_select(rb_from_string('1,2,3,4,5,6,7,8,9,10,11,12,13,14,15,16,17,18,19,20,21,23,24,25,26,27,29,50,560,28,30,31,32,65537,4294967296'),10,0,false,0,a8) from vtt2;
+----------------------------------------------------------------------------------------------------------------------------------------------------------+
| rb_select(rb_from_string('1,2,3,4,5,6,7,8,9,10,11,12,13,14,15,16,17,18,19,20,21,23,24,25,26,27,29,50,560,28,30,31,32,65537,4294967296'),10,0,false,0,a8) |
+----------------------------------------------------------------------------------------------------------------------------------------------------------+
|                                                                                                                                                         |
|                                                                                                                                                         |
|                                                                                                                                                   |
+----------------------------------------------------------------------------------------------------------------------------------------------------------+
drop table tt2;
create table tt2(a0 date,a1 json,a3 POINT);
drop view vtt2;
create view vtt2 as select * from tt2;
select rb_select(rb_from_string('1,2,3,4,5,6,7,8,9,10,11,12,13,14,15,16,17,18,19,20,21,23,24,25,26,27,29,50,560,28,30,31,32,65537,4294967296'),a0) from tt2;
ERROR HY000: invalid type given for an argument
select rb_select(rb_from_string('1,2,3,4,5,6,7,8,9,10,11,12,13,14,15,16,17,18,19,20,21,23,24,25,26,27,29,50,560,28,30,31,32,65537,4294967296'),a1) from tt2;
ERROR HY000: invalid type given for an argument
select rb_select(rb_from_string('1,2,3,4,5,6,7,8,9,10,11,12,13,14,15,16,17,18,19,20,21,23,24,25,26,27,29,50,560,28,30,31,32,65537,4294967296'),a3) from tt2;
ERROR HY000: invalid type given for an argument
select rb_select(rb_from_string('1,2,3,4,5,6,7,8,9,10,11,12,13,14,15,16,17,18,19,20,21,23,24,25,26,27,29,50,560,28,30,31,32,65537,4294967296'),10,a0) from tt2;
ERROR HY000: invalid type given for an argument
select rb_select(rb_from_string('1,2,3,4,5,6,7,8,9,10,11,12,13,14,15,16,17,18,19,20,21,23,24,25,26,27,29,50,560,28,30,31,32,65537,4294967296'),10,a1) from tt2;
ERROR HY000: invalid type given for an argument
select rb_select(rb_from_string('1,2,3,4,5,6,7,8,9,10,11,12,13,14,15,16,17,18,19,20,21,23,24,25,26,27,29,50,560,28,30,31,32,65537,4294967296'),10,a3) from tt2;
ERROR HY000: invalid type given for an argument
select rb_select(rb_from_string('1,2,3,4,5,6,7,8,9,10,11,12,13,14,15,16,17,18,19,20,21,23,24,25,26,27,29,50,560,28,30,31,32,65537,4294967296'),10,0,a0) from tt2;
ERROR HY000: invalid type given for an argument
select rb_select(rb_from_string('1,2,3,4,5,6,7,8,9,10,11,12,13,14,15,16,17,18,19,20,21,23,24,25,26,27,29,50,560,28,30,31,32,65537,4294967296'),10,0,a1) from tt2;
ERROR HY000: invalid type given for an argument
select rb_select(rb_from_string('1,2,3,4,5,6,7,8,9,10,11,12,13,14,15,16,17,18,19,20,21,23,24,25,26,27,29,50,560,28,30,31,32,65537,4294967296'),10,0,a3) from tt2;
ERROR HY000: invalid type given for an argument
select rb_select(rb_from_string('1,2,3,4,5,6,7,8,9,10,11,12,13,14,15,16,17,18,19,20,21,23,24,25,26,27,29,50,560,28,30,31,32,65537,4294967296'),10,0,false,a0) from tt2;
ERROR HY000: invalid type given for an argument
select rb_select(rb_from_string('1,2,3,4,5,6,7,8,9,10,11,12,13,14,15,16,17,18,19,20,21,23,24,25,26,27,29,50,560,28,30,31,32,65537,4294967296'),10,0,false,a1) from tt2;
ERROR HY000: invalid type given for an argument
select rb_select(rb_from_string('1,2,3,4,5,6,7,8,9,10,11,12,13,14,15,16,17,18,19,20,21,23,24,25,26,27,29,50,560,28,30,31,32,65537,4294967296'),10,0,false,a3) from tt2;
ERROR HY000: invalid type given for an argument
select rb_select(rb_from_string('1,2,3,4,5,6,7,8,9,10,11,12,13,14,15,16,17,18,19,20,21,23,24,25,26,27,29,50,560,28,30,31,32,65537,4294967296'),10,0,false,0,a0) from tt2;
ERROR HY000: invalid type given for an argument
select rb_select(rb_from_string('1,2,3,4,5,6,7,8,9,10,11,12,13,14,15,16,17,18,19,20,21,23,24,25,26,27,29,50,560,28,30,31,32,65537,4294967296'),10,0,false,0,a1) from tt2;
ERROR HY000: invalid type given for an argument
select rb_select(rb_from_string('1,2,3,4,5,6,7,8,9,10,11,12,13,14,15,16,17,18,19,20,21,23,24,25,26,27,29,50,560,28,30,31,32,65537,4294967296'),10,0,false,0,a3) from tt2;
ERROR HY000: invalid type given for an argument
drop table tt2;
create table tt2(id int , b boolean,r roaringbitmap) partition by list columns (id)(
  PARTITION p0 VALUES in(10,1,2,3),
  PARTITION p1 VALUES in(50,25,12,20)
);
drop view vtt2;
create view vtt2 as select * from tt2;
insert into tt2 values(1,1,rb_from_string('1,2,3,4,5,6,7'));
insert into tt2 values(50,0,rb_from_string('60,70,80,90'));
bug 2024092400104551669   „Ää„Äêbitmap‰∏âÊúü„Äërb_select ÂèÇÊï∞4Â∏ÉÂ∞îÁ±ªÂûãÔºåËØªÂèñboolean/bool/TINYINT,obÊä•5083„Äã
select rb_select(r,id,id,b,id,id) from tt2;
+----------------------------+
| rb_select(r,id,id,b,id,id) |
+----------------------------+
|                           |
|                           |
+----------------------------+
select rb_select(r,id,id,true,id,id) from tt2;
+-------------------------------+
| rb_select(r,id,id,true,id,id) |
+-------------------------------+
|                              |
|                              |
+-------------------------------+
bug 2024092400104551669   „Ää„Äêbitmap‰∏âÊúü„Äërb_select ÂèÇÊï∞4Â∏ÉÂ∞îÁ±ªÂûãÔºåËØªÂèñboolean/bool/TINYINT,obÊä•5083„Äã
select rb_select(r,id,id,b,id,id) from vtt2;
+----------------------------+
| rb_select(r,id,id,b,id,id) |
+----------------------------+
|                           |
|                           |
+----------------------------+
select rb_select(r,id,id,true,id,id) from vtt2;
+-------------------------------+
| rb_select(r,id,id,true,id,id) |
+-------------------------------+
|                              |
|                              |
+-------------------------------+
select rb_select(r,id,id,true,0,id) from vtt2;
+------------------------------+
| rb_select(r,id,id,true,0,id) |
+------------------------------+
|                             |
|                             |
+------------------------------+
select rb_select(r,id,id,true,id,33) from vtt2;
+-------------------------------+
| rb_select(r,id,id,true,id,33) |
+-------------------------------+
|                            |
|                              |
+-------------------------------+
drop table tt2;
create table tt2(id int , b bool,r roaringbitmap) partition by list columns (id)(
  PARTITION p0 VALUES in(10,1,2,3),
  PARTITION p1 VALUES in(50,25,12,20)
);
drop view vtt2;
create view vtt2 as select * from tt2;
insert into tt2 values(1,1,rb_from_string('1,2,3,4,5,6,7'));
insert into tt2 values(50,0,rb_from_string('60,70,80,90'));
bug 2024092400104551669   „Ää„Äêbitmap‰∏âÊúü„Äërb_select ÂèÇÊï∞4Â∏ÉÂ∞îÁ±ªÂûãÔºåËØªÂèñboolean/bool/TINYINT,obÊä•5083„Äã
select rb_select(r,id,id,b,id,id) from tt2;
+----------------------------+
| rb_select(r,id,id,b,id,id) |
+----------------------------+
|                           |
|                           |
+----------------------------+
select rb_select(r,id,id,true,id,id) from tt2;
+-------------------------------+
| rb_select(r,id,id,true,id,id) |
+-------------------------------+
|                              |
|                              |
+-------------------------------+
bug 2024092400104551669   „Ää„Äêbitmap‰∏âÊúü„Äërb_select ÂèÇÊï∞4Â∏ÉÂ∞îÁ±ªÂûãÔºåËØªÂèñboolean/bool/TINYINT,obÊä•5083„Äã
select rb_select(r,id,id,b,id,id) from vtt2;
+----------------------------+
| rb_select(r,id,id,b,id,id) |
+----------------------------+
|                           |
|                           |
+----------------------------+
select rb_select(r,id,id,true,id,id) from vtt2;
+-------------------------------+
| rb_select(r,id,id,true,id,id) |
+-------------------------------+
|                              |
|                              |
+-------------------------------+
select rb_select(r,id,id,true,0,id) from vtt2;
+------------------------------+
| rb_select(r,id,id,true,0,id) |
+------------------------------+
|                             |
|                             |
+------------------------------+
select rb_select(r,id,id,true,id,33) from vtt2;
+-------------------------------+
| rb_select(r,id,id,true,id,33) |
+-------------------------------+
|                            |
|                              |
+-------------------------------+
drop table tt2;
create table tt2(id BIGINT , b TINYINT,r roaringbitmap) partition by list columns (id)(
  PARTITION p0 VALUES in(10,1,2,3),
  PARTITION p1 VALUES in(50,25,12,20)
);
drop view vtt2;
create view vtt2 as select * from tt2;
insert into tt2 values(1,1,rb_from_string('1,2,3,4,5,6,7'));
insert into tt2 values(50,0,rb_from_string('60,70,80,90'));
bug 2024092400104551669   „Ää„Äêbitmap‰∏âÊúü„Äërb_select ÂèÇÊï∞4Â∏ÉÂ∞îÁ±ªÂûãÔºåËØªÂèñboolean/bool/TINYINT,obÊä•5083„Äã
select rb_select(r,id,id,b,id,id) from tt2;
+----------------------------+
| rb_select(r,id,id,b,id,id) |
+----------------------------+
|                           |
|                           |
+----------------------------+
select rb_select(r,id,id,true,id,id) from tt2;
+-------------------------------+
| rb_select(r,id,id,true,id,id) |
+-------------------------------+
|                              |
|                              |
+-------------------------------+
bug 2024092400104551669   „Ää„Äêbitmap‰∏âÊúü„Äërb_select ÂèÇÊï∞4Â∏ÉÂ∞îÁ±ªÂûãÔºåËØªÂèñboolean/bool/TINYINT,obÊä•5083„Äã
select rb_select(r,id,id,b,id,id) from vtt2;
+----------------------------+
| rb_select(r,id,id,b,id,id) |
+----------------------------+
|                           |
|                           |
+----------------------------+
select rb_select(r,id,id,true,id,id) from vtt2;
+-------------------------------+
| rb_select(r,id,id,true,id,id) |
+-------------------------------+
|                              |
|                              |
+-------------------------------+
select rb_select(r,id,id,true,0,id) from vtt2;
+------------------------------+
| rb_select(r,id,id,true,0,id) |
+------------------------------+
|                             |
|                             |
+------------------------------+
select rb_select(r,id,id,true,id,33) from vtt2;
+-------------------------------+
| rb_select(r,id,id,true,id,33) |
+-------------------------------+
|                            |
|                              |
+-------------------------------+
select distinct rb_select(r,1) from tt1;
ERROR 22000: Invalid data type for the operation
select rb_select(rb_from_string('1'),2) as a from vtt1;
+--------+
| a      |
+--------+
|     |
|     |
|     |
|     |
|     |
|     |
|     |
|     |
|     |
|     |
|     |
|     |
+--------+
select *from tt1  order by rb_select(r,3) asc ;
ERROR 22000: Invalid data type for the operation
select *from tt1  order by rb_select(r,3) desc ;
ERROR 22000: Invalid data type for the operation
select *,rb_select(r,1) from tt1  group by rb_select(r,1) ;
ERROR 22000: Invalid data type for the operation
select *,rb_select(r,3) from tt1  group by id having rb_select(r,3) =rb_select(r,3) ;
ERROR 22000: Invalid data type for the operation
select * from tt1  group by id having rb_from_string('1') >rb_select(r,3);
ERROR 22000: Invalid data type for the operation
select * from tt1  group by id having rb_select(rb_from_string('1'),1) <>r  ;
ERROR 22000: Invalid data type for the operation
select *,rb_from_string('1') from tt1  group by id having rb_select(r,3) =1 ;
ERROR 22000: Invalid data type for the operation
select *,rb_from_string('1') from tt1  group by id having rb_select(r,3) ='test' ;
ERROR 22000: Invalid data type for the operation
select *,rb_from_string('1') from vtt1  group by id having  'test'<rb_select(r,3) ;
ERROR 22000: Invalid data type for the operation
WITH Alice_Students AS (
    SELECT rb_from_string('1')
)
SELECT * FROM Alice_Students;
+---------------------+
| rb_from_string('1') |
+---------------------+
|                  |
+---------------------+
WITH Alice_Students AS (
    SELECT rb_select(r,10) from tt1
)
SELECT * FROM Alice_Students;
+-------------------------------------------------------------------------------------+
| rb_select(r,10)                                                                     |
+-------------------------------------------------------------------------------------+
|                                                                                    |
|                                                                                  |
|                                                                                  |
|                	                                                            |
|                	                                                            |
|                                                                           |
| 
                        	   
                                            |
| 
                        	   
                                            |
| 
                        	   
                                            |
| 
Û     ê     +     »      d                               ª          |
| 
                            	                                            |
| 
ˇ˛   ˇ  ˇ  ˇ  ˇ  ˇ  ˇ  ˇ  ˇ  ˇ                                                      |
+-------------------------------------------------------------------------------------+
SELECT CASE rb_select(r,3) WHEN rb_select(r,3) THEN 1 WHEN rb_select(r,3) THEN 2 END from tt1;
ERROR 22000: Invalid data type for the operation
SELECT CASE rb_select(r,4) WHEN rb_select(r,3) THEN 1 WHEN rb_select(r,3) THEN 2 END from tt1;
ERROR 22000: Invalid data type for the operation
SELECT CASE 1 WHEN 1 THEN rb_select(r,3) WHEN 2 THEN rb_select(r,4) END from tt1;
+------------------------------------------------------------------+
| CASE 1 WHEN 1 THEN rb_select(r,3) WHEN 2 THEN rb_select(r,4) END |
+------------------------------------------------------------------+
|                                                                 |
|                                                               |
|                                                               |
|                                                            |
|                                                            |
|                                                          |
|                                                            |
|                                                            |
|                                                            |
|                                                          |
|                                                             |
| ˇ˛   ˇ  ˇ                                                        |
+------------------------------------------------------------------+
SELECT CASE 2 WHEN 1 THEN rb_select(r,3) WHEN 2 THEN rb_select(r,4) END from tt1;
+------------------------------------------------------------------+
| CASE 2 WHEN 1 THEN rb_select(r,3) WHEN 2 THEN rb_select(r,4) END |
+------------------------------------------------------------------+
|                                                                 |
|                                                               |
|                                                               |
|                                                           |
|                                                           |
|                                                        |
|                                                           |
|                                                           |
|                                                           |
|                                                        |
|                                                            |
| ˇ˛   ˇ  ˇ  ˇ                                                     |
+------------------------------------------------------------------+
SELECT CASE 2 WHEN 1 THEN rb_select(rb_from_string('1'),3) WHEN 2 THEN rb_select(rb_from_string('1,2,3,4,5,6,7'),4) END;
+------------------------------------------------------------------------------------------------------------------+
| CASE 2 WHEN 1 THEN rb_select(rb_from_string('1'),3) WHEN 2 THEN rb_select(rb_from_string('1,2,3,4,5,6,7'),4) END |
+------------------------------------------------------------------------------------------------------------------+
|                                                                                                           |
+------------------------------------------------------------------------------------------------------------------+
select * from tt1 where rb_select(r,3)=1;
ERROR 22000: Invalid data type for the operation
select * from tt1 where rb_select(r,3)='1';
ERROR 22000: Invalid data type for the operation
select * from tt1 where rb_select(rb_from_string('1'),0)=rb_select(rb_from_string('1'),0);
ERROR 22000: Invalid data type for the operation
select * from tt1 where rb_select(r,3)>rb_select(r,3);
ERROR 22000: Invalid data type for the operation
select * from tt1 where rb_select(r,3)<'test';
ERROR 22000: Invalid data type for the operation
select *,rb_from_string('1') from tt1  group by id having rb_select(r,3) ='test' ;
ERROR 22000: Invalid data type for the operation
select * from tt1 where rb_select(r,3)<=>r;
ERROR 22000: Invalid data type for the operation
select * from tt1 where rb_select(r,3)!= rb_from_string('1,2,3,4');
ERROR 22000: Invalid data type for the operation
bug 2024092300104536901   „Ää[bitmap‰∏âÊúü]bitmapÁ±ªÂûãÂú®BETWEEN and ÊØîËæÉÔºåÈÉ®ÂàÜÊÉÖÂÜµobÊä•1210„Äã
select * from tt1 where rb_select(r,3) BETWEEN rb_select(r,3) AND rb_select(r,3);
ERROR 22000: Invalid data type for the operation
select * from tt1 where rb_select(r,3) not in(rb_select(r,3));
ERROR 22000: Invalid data type for the operation
select * from tt1 where rb_select(r,3) like rb_select(r,3);
+------+-------------------------------------------------------------------------------------------------------------------------------------------------------------------------------------------------------------------------------------------------------------------------------------------------------------------------------------------------------------------------------------+-------------------------------------------------------------------------------------------------------------------------------------------------------------------------------------------------------------------------------------------------------------+-------------------------------------------------------------------------------------------------------------------------------------------------------------------------------------------------------------------------------------------------------------+-------------------------------------------------------------------------------------------------------------------------------------------------------------------------------------------------------------------------------------------------------------+
| id   | a0                                                                                                                                                                                                                                                                                                                                                                                  | a                                                                                                                                                                                                                                                           | r                                                                                                                                                                                                                                                           | r1                                                                                                                                                                                                                                                          |
+------+-------------------------------------------------------------------------------------------------------------------------------------------------------------------------------------------------------------------------------------------------------------------------------------------------------------------------------------------------------------------------------------+-------------------------------------------------------------------------------------------------------------------------------------------------------------------------------------------------------------------------------------------------------------+-------------------------------------------------------------------------------------------------------------------------------------------------------------------------------------------------------------------------------------------------------------+-------------------------------------------------------------------------------------------------------------------------------------------------------------------------------------------------------------------------------------------------------------+
|    0 | NULL                                                                                                                                                                                                                                                                                                                                                                                |                                                                                                                                                                                                                                                            |                                                                                                                                                                                                                                                            | ˇ˛   ˇ  ˇ  ˇ  ˇ  ˇ  ˇ  ˇ  ˇ  ˇ  	ˇ  
ˇ  ˇ  ˇ  ˇ  ˇ                                                                                                                                                                                                            |
|    1 | 1                                                                                                                                                                                                                                                                                                                                                                                   |                                                                                                                                                                                                                                                          |                                                                                                                                                                                                                                                          |            ;0    '   '                                                                                                                                                                                                                               |
|    2 | 4294967296                                                                                                                                                                                                                                                                                                                                                                          |                                                                                                                                                                                                                                                          |                                                                                                                                                                                                                                                          | @&T    ‰T   ‘ˇˇˇ	   	   
   N     Û       ö;   ê      ^–≤   +      Ú*   '     ˇ=    œ     ø∆-    »      Ñ    êÂT   Á     ê&ˇˇ	   d      ?B           /u                        (kÓ      
      
   ª                              |
|    3 | 1,2,6,4,5,9                                                                                                                                                                                                                                                                                                                                                                         |                	                                                                                                                                                                                                                                    |                	                                                                                                                                                                                                                                    |            :0                   	 
                         :0                                                                                                                                                     |
|    3 | 1,2,6,4,5,9                                                                                                                                                                                                                                                                                                                                                                         |                	                                                                                                                                                                                                                                    |                	                                                                                                                                                                                                                                    |            :0             V           	 
                                                                                                                                                                             |
|    4 | 4294967296,4294967297,4294967298,4294967299                                                                                                                                                                                                                                                                                                                                         |                                                                                                                                                                                                                                                   |                                                                                                                                                                                                                                                   |            :0             V           	 
                                                                                                                                                                             |
|    5 | 1,2,3,4,5,6,7,8,9,10,11,12,13,14,15,16,17,18,19,20,21,22,23,24,25,26,27,28,29,30,31,32,33                                                                                                                                                                                                                                                                                           |            :0                    	 
                        !                                                                                                                                                             |            :0                    	 
                        !                                                                                                                                                             |                                                                                                                                                                                                                                                            |
|    5 | 1,2,3,4,5,6,7,8,9,10,11,12,13,14,15,16,17,18,19,20,21,22,23,24,25,26,27,28,29,30,31,65537,65536                                                                                                                                                                                                                                                                                     |            :0             V           	 
                                                                                                                                                                             |            :0             V           	 
                                                                                                                                                                             |                	                                                                                                                                                                                                                                    |
|    6 | 1,2,3,4,5,6,7,8,9,10,11,12,13,14,15,16,17,18,19,20,21,22,23,24,25,26,27,28,29,30,31,4294967298,65536                                                                                                                                                                                                                                                                                |            :0                   	 
                         :0                                                                                                                                                     |            :0                   	 
                         :0                                                                                                                                                     |                	                                                                                                                                                                                                                                    |
|    6 | 4294967296,4294967297,42949672969,4294967298,42949672961,42949672962,4294967299,4294967297,14294967296,14294967696,14295967296,5294967296,7294967296,9294967296,8294967296,42949617296,42949672916,4294967396,4294967496,
4294967595,4294967696,4294967795,4294968295,4294967995,4294977295,4294987295,4294997295,4294968295,4294969295,4295967295,4296967295,4297967295,4298967295 | @&T    ‰T   ‘ˇˇˇ	   	   
   N     Û       ö;   ê      ^–≤   +      Ú*   '     ˇ=    œ     ø∆-    »      Ñ    êÂT   Á     ê&ˇˇ	   d      ?B           /u                        (kÓ      
      
   ª                              | @&T    ‰T   ‘ˇˇˇ	   	   
   N     Û       ö;   ê      ^–≤   +      Ú*   '     ˇ=    œ     ø∆-    »      Ñ    êÂT   Á     ê&ˇˇ	   d      ?B           /u                        (kÓ      
      
   ª                              |                                                                                                                                                                                                                                                          |
|    7 | 2542                                                                                                                                                                                                                                                                                                                                                                                | ;0    '   '                                                                                                                                                                                                                                           |            ;0    '   '                                                                                                                                                                                                                               |                                                                                                                                                                                                                                                          |
|    8 | 56214,-7854                                                                                                                                                                                                                                                                                                                                                                         | ˇ˛   ˇ  ˇ  ˇ  ˇ  ˇ  ˇ  ˇ  ˇ  ˇ  	ˇ  
ˇ  ˇ  ˇ  ˇ  ˇ                                                                                                                                                                                                            | ˇ˛   ˇ  ˇ  ˇ  ˇ  ˇ  ˇ  ˇ  ˇ  ˇ  	ˇ  
ˇ  ˇ  ˇ  ˇ  ˇ                                                                                                                                                                                                            |                                                                                                                                                                                                                                                          |
+------+-------------------------------------------------------------------------------------------------------------------------------------------------------------------------------------------------------------------------------------------------------------------------------------------------------------------------------------------------------------------------------------+-------------------------------------------------------------------------------------------------------------------------------------------------------------------------------------------------------------------------------------------------------------+-------------------------------------------------------------------------------------------------------------------------------------------------------------------------------------------------------------------------------------------------------------+-------------------------------------------------------------------------------------------------------------------------------------------------------------------------------------------------------------------------------------------------------------+
select * from tt1 where rb_select(r,3) not like(rb_select(r,3));
+------+------+------+------+------+
| id   | a0   | a    | r    | r1   |
+------+------+------+------+------+
+------+------+------+------+------+
select * from tt1 where rb_select(r,3) is true;
ERROR 22000: Invalid data type for the operation
select * from tt1 where rb_select(r,3) is not false;
ERROR 22000: Invalid data type for the operation
select * from tt1 where rb_select(rb_from_string('1'),1) is  false;
ERROR 22000: Invalid data type for the operation
select * from tt1 where rb_select(r,3)  is not null;
+------+-------------------------------------------------------------------------------------------------------------------------------------------------------------------------------------------------------------------------------------------------------------------------------------------------------------------------------------------------------------------------------------+-------------------------------------------------------------------------------------------------------------------------------------------------------------------------------------------------------------------------------------------------------------+-------------------------------------------------------------------------------------------------------------------------------------------------------------------------------------------------------------------------------------------------------------+-------------------------------------------------------------------------------------------------------------------------------------------------------------------------------------------------------------------------------------------------------------+
| id   | a0                                                                                                                                                                                                                                                                                                                                                                                  | a                                                                                                                                                                                                                                                           | r                                                                                                                                                                                                                                                           | r1                                                                                                                                                                                                                                                          |
+------+-------------------------------------------------------------------------------------------------------------------------------------------------------------------------------------------------------------------------------------------------------------------------------------------------------------------------------------------------------------------------------------+-------------------------------------------------------------------------------------------------------------------------------------------------------------------------------------------------------------------------------------------------------------+-------------------------------------------------------------------------------------------------------------------------------------------------------------------------------------------------------------------------------------------------------------+-------------------------------------------------------------------------------------------------------------------------------------------------------------------------------------------------------------------------------------------------------------+
|    0 | NULL                                                                                                                                                                                                                                                                                                                                                                                |                                                                                                                                                                                                                                                            |                                                                                                                                                                                                                                                            | ˇ˛   ˇ  ˇ  ˇ  ˇ  ˇ  ˇ  ˇ  ˇ  ˇ  	ˇ  
ˇ  ˇ  ˇ  ˇ  ˇ                                                                                                                                                                                                            |
|    1 | 1                                                                                                                                                                                                                                                                                                                                                                                   |                                                                                                                                                                                                                                                          |                                                                                                                                                                                                                                                          |            ;0    '   '                                                                                                                                                                                                                               |
|    2 | 4294967296                                                                                                                                                                                                                                                                                                                                                                          |                                                                                                                                                                                                                                                          |                                                                                                                                                                                                                                                          | @&T    ‰T   ‘ˇˇˇ	   	   
   N     Û       ö;   ê      ^–≤   +      Ú*   '     ˇ=    œ     ø∆-    »      Ñ    êÂT   Á     ê&ˇˇ	   d      ?B           /u                        (kÓ      
      
   ª                              |
|    3 | 1,2,6,4,5,9                                                                                                                                                                                                                                                                                                                                                                         |                	                                                                                                                                                                                                                                    |                	                                                                                                                                                                                                                                    |            :0                   	 
                         :0                                                                                                                                                     |
|    3 | 1,2,6,4,5,9                                                                                                                                                                                                                                                                                                                                                                         |                	                                                                                                                                                                                                                                    |                	                                                                                                                                                                                                                                    |            :0             V           	 
                                                                                                                                                                             |
|    4 | 4294967296,4294967297,4294967298,4294967299                                                                                                                                                                                                                                                                                                                                         |                                                                                                                                                                                                                                                   |                                                                                                                                                                                                                                                   |            :0             V           	 
                                                                                                                                                                             |
|    5 | 1,2,3,4,5,6,7,8,9,10,11,12,13,14,15,16,17,18,19,20,21,22,23,24,25,26,27,28,29,30,31,32,33                                                                                                                                                                                                                                                                                           |            :0                    	 
                        !                                                                                                                                                             |            :0                    	 
                        !                                                                                                                                                             |                                                                                                                                                                                                                                                            |
|    5 | 1,2,3,4,5,6,7,8,9,10,11,12,13,14,15,16,17,18,19,20,21,22,23,24,25,26,27,28,29,30,31,65537,65536                                                                                                                                                                                                                                                                                     |            :0             V           	 
                                                                                                                                                                             |            :0             V           	 
                                                                                                                                                                             |                	                                                                                                                                                                                                                                    |
|    6 | 1,2,3,4,5,6,7,8,9,10,11,12,13,14,15,16,17,18,19,20,21,22,23,24,25,26,27,28,29,30,31,4294967298,65536                                                                                                                                                                                                                                                                                |            :0                   	 
                         :0                                                                                                                                                     |            :0                   	 
                         :0                                                                                                                                                     |                	                                                                                                                                                                                                                                    |
|    6 | 4294967296,4294967297,42949672969,4294967298,42949672961,42949672962,4294967299,4294967297,14294967296,14294967696,14295967296,5294967296,7294967296,9294967296,8294967296,42949617296,42949672916,4294967396,4294967496,
4294967595,4294967696,4294967795,4294968295,4294967995,4294977295,4294987295,4294997295,4294968295,4294969295,4295967295,4296967295,4297967295,4298967295 | @&T    ‰T   ‘ˇˇˇ	   	   
   N     Û       ö;   ê      ^–≤   +      Ú*   '     ˇ=    œ     ø∆-    »      Ñ    êÂT   Á     ê&ˇˇ	   d      ?B           /u                        (kÓ      
      
   ª                              | @&T    ‰T   ‘ˇˇˇ	   	   
   N     Û       ö;   ê      ^–≤   +      Ú*   '     ˇ=    œ     ø∆-    »      Ñ    êÂT   Á     ê&ˇˇ	   d      ?B           /u                        (kÓ      
      
   ª                              |                                                                                                                                                                                                                                                          |
|    7 | 2542                                                                                                                                                                                                                                                                                                                                                                                | ;0    '   '                                                                                                                                                                                                                                           |            ;0    '   '                                                                                                                                                                                                                               |                                                                                                                                                                                                                                                          |
|    8 | 56214,-7854                                                                                                                                                                                                                                                                                                                                                                         | ˇ˛   ˇ  ˇ  ˇ  ˇ  ˇ  ˇ  ˇ  ˇ  ˇ  	ˇ  
ˇ  ˇ  ˇ  ˇ  ˇ                                                                                                                                                                                                            | ˇ˛   ˇ  ˇ  ˇ  ˇ  ˇ  ˇ  ˇ  ˇ  ˇ  	ˇ  
ˇ  ˇ  ˇ  ˇ  ˇ                                                                                                                                                                                                            |                                                                                                                                                                                                                                                          |
+------+-------------------------------------------------------------------------------------------------------------------------------------------------------------------------------------------------------------------------------------------------------------------------------------------------------------------------------------------------------------------------------------+-------------------------------------------------------------------------------------------------------------------------------------------------------------------------------------------------------------------------------------------------------------+-------------------------------------------------------------------------------------------------------------------------------------------------------------------------------------------------------------------------------------------------------------+-------------------------------------------------------------------------------------------------------------------------------------------------------------------------------------------------------------------------------------------------------------+
select * from tt1 where rb_select(r,3)  is  null;
+------+------+------+------+------+
| id   | a0   | a    | r    | r1   |
+------+------+------+------+------+
+------+------+------+------+------+
select * from tt1 where  rb_select(r,3)  =1;
ERROR 22000: Invalid data type for the operation
drop table tt2;
create table tt2(id int,r roaringbitmap);
insert into tt2 select id ,r from tt1;
select t2.* from tt2 t2 inner join tt1 t1 on t2.r=rb_select(x'010101000000',1);
ERROR 22000: Invalid data type for the operation
select t2.* from tt2 t2 inner join tt1 t1 on rb_select(x'010101000000',1)!=t1.r;
ERROR 22000: Invalid data type for the operation
select t2.* from tt2 t2 inner join tt1 t1 on rb_select(t2.r,3)=rb_select(x'010101000000',1);
ERROR 22000: Invalid data type for the operation
select * from tt2 t2 inner join tt1 t1 on t2.r!=rb_select(t1.r,10);
ERROR 22000: Invalid data type for the operation
select * from tt2 t2 inner join tt1 t1 on t2.r>rb_select(t1.r,6);
ERROR 22000: Invalid data type for the operation
select * from (select rb_select(r,10) from tt1);
+-------------------------------------------------------------------------------------+
| rb_select(r,10)                                                                     |
+-------------------------------------------------------------------------------------+
|                                                                                    |
|                                                                                  |
|                                                                                  |
|                	                                                            |
|                	                                                            |
|                                                                           |
| 
                        	   
                                            |
| 
                        	   
                                            |
| 
                        	   
                                            |
| 
Û     ê     +     »      d                               ª          |
| 
                            	                                            |
| 
ˇ˛   ˇ  ˇ  ˇ  ˇ  ˇ  ˇ  ˇ  ˇ  ˇ                                                      |
+-------------------------------------------------------------------------------------+
select * from tt1 where exists(select rb_select(r,10) from tt1);
+------+-------------------------------------------------------------------------------------------------------------------------------------------------------------------------------------------------------------------------------------------------------------------------------------------------------------------------------------------------------------------------------------+-------------------------------------------------------------------------------------------------------------------------------------------------------------------------------------------------------------------------------------------------------------+-------------------------------------------------------------------------------------------------------------------------------------------------------------------------------------------------------------------------------------------------------------+-------------------------------------------------------------------------------------------------------------------------------------------------------------------------------------------------------------------------------------------------------------+
| id   | a0                                                                                                                                                                                                                                                                                                                                                                                  | a                                                                                                                                                                                                                                                           | r                                                                                                                                                                                                                                                           | r1                                                                                                                                                                                                                                                          |
+------+-------------------------------------------------------------------------------------------------------------------------------------------------------------------------------------------------------------------------------------------------------------------------------------------------------------------------------------------------------------------------------------+-------------------------------------------------------------------------------------------------------------------------------------------------------------------------------------------------------------------------------------------------------------+-------------------------------------------------------------------------------------------------------------------------------------------------------------------------------------------------------------------------------------------------------------+-------------------------------------------------------------------------------------------------------------------------------------------------------------------------------------------------------------------------------------------------------------+
|    0 | NULL                                                                                                                                                                                                                                                                                                                                                                                |                                                                                                                                                                                                                                                            |                                                                                                                                                                                                                                                            | ˇ˛   ˇ  ˇ  ˇ  ˇ  ˇ  ˇ  ˇ  ˇ  ˇ  	ˇ  
ˇ  ˇ  ˇ  ˇ  ˇ                                                                                                                                                                                                            |
|    1 | 1                                                                                                                                                                                                                                                                                                                                                                                   |                                                                                                                                                                                                                                                          |                                                                                                                                                                                                                                                          |            ;0    '   '                                                                                                                                                                                                                               |
|    2 | 4294967296                                                                                                                                                                                                                                                                                                                                                                          |                                                                                                                                                                                                                                                          |                                                                                                                                                                                                                                                          | @&T    ‰T   ‘ˇˇˇ	   	   
   N     Û       ö;   ê      ^–≤   +      Ú*   '     ˇ=    œ     ø∆-    »      Ñ    êÂT   Á     ê&ˇˇ	   d      ?B           /u                        (kÓ      
      
   ª                              |
|    3 | 1,2,6,4,5,9                                                                                                                                                                                                                                                                                                                                                                         |                	                                                                                                                                                                                                                                    |                	                                                                                                                                                                                                                                    |            :0                   	 
                         :0                                                                                                                                                     |
|    3 | 1,2,6,4,5,9                                                                                                                                                                                                                                                                                                                                                                         |                	                                                                                                                                                                                                                                    |                	                                                                                                                                                                                                                                    |            :0             V           	 
                                                                                                                                                                             |
|    4 | 4294967296,4294967297,4294967298,4294967299                                                                                                                                                                                                                                                                                                                                         |                                                                                                                                                                                                                                                   |                                                                                                                                                                                                                                                   |            :0             V           	 
                                                                                                                                                                             |
|    5 | 1,2,3,4,5,6,7,8,9,10,11,12,13,14,15,16,17,18,19,20,21,22,23,24,25,26,27,28,29,30,31,32,33                                                                                                                                                                                                                                                                                           |            :0                    	 
                        !                                                                                                                                                             |            :0                    	 
                        !                                                                                                                                                             |                                                                                                                                                                                                                                                            |
|    5 | 1,2,3,4,5,6,7,8,9,10,11,12,13,14,15,16,17,18,19,20,21,22,23,24,25,26,27,28,29,30,31,65537,65536                                                                                                                                                                                                                                                                                     |            :0             V           	 
                                                                                                                                                                             |            :0             V           	 
                                                                                                                                                                             |                	                                                                                                                                                                                                                                    |
|    6 | 1,2,3,4,5,6,7,8,9,10,11,12,13,14,15,16,17,18,19,20,21,22,23,24,25,26,27,28,29,30,31,4294967298,65536                                                                                                                                                                                                                                                                                |            :0                   	 
                         :0                                                                                                                                                     |            :0                   	 
                         :0                                                                                                                                                     |                	                                                                                                                                                                                                                                    |
|    6 | 4294967296,4294967297,42949672969,4294967298,42949672961,42949672962,4294967299,4294967297,14294967296,14294967696,14295967296,5294967296,7294967296,9294967296,8294967296,42949617296,42949672916,4294967396,4294967496,
4294967595,4294967696,4294967795,4294968295,4294967995,4294977295,4294987295,4294997295,4294968295,4294969295,4295967295,4296967295,4297967295,4298967295 | @&T    ‰T   ‘ˇˇˇ	   	   
   N     Û       ö;   ê      ^–≤   +      Ú*   '     ˇ=    œ     ø∆-    »      Ñ    êÂT   Á     ê&ˇˇ	   d      ?B           /u                        (kÓ      
      
   ª                              | @&T    ‰T   ‘ˇˇˇ	   	   
   N     Û       ö;   ê      ^–≤   +      Ú*   '     ˇ=    œ     ø∆-    »      Ñ    êÂT   Á     ê&ˇˇ	   d      ?B           /u                        (kÓ      
      
   ª                              |                                                                                                                                                                                                                                                          |
|    7 | 2542                                                                                                                                                                                                                                                                                                                                                                                | ;0    '   '                                                                                                                                                                                                                                           |            ;0    '   '                                                                                                                                                                                                                               |                                                                                                                                                                                                                                                          |
|    8 | 56214,-7854                                                                                                                                                                                                                                                                                                                                                                         | ˇ˛   ˇ  ˇ  ˇ  ˇ  ˇ  ˇ  ˇ  ˇ  ˇ  	ˇ  
ˇ  ˇ  ˇ  ˇ  ˇ                                                                                                                                                                                                            | ˇ˛   ˇ  ˇ  ˇ  ˇ  ˇ  ˇ  ˇ  ˇ  ˇ  	ˇ  
ˇ  ˇ  ˇ  ˇ  ˇ                                                                                                                                                                                                            |                                                                                                                                                                                                                                                          |
+------+-------------------------------------------------------------------------------------------------------------------------------------------------------------------------------------------------------------------------------------------------------------------------------------------------------------------------------------------------------------------------------------+-------------------------------------------------------------------------------------------------------------------------------------------------------------------------------------------------------------------------------------------------------------+-------------------------------------------------------------------------------------------------------------------------------------------------------------------------------------------------------------------------------------------------------------+-------------------------------------------------------------------------------------------------------------------------------------------------------------------------------------------------------------------------------------------------------------+
select rb_build_agg(id)>rb_select(rb_from_string('1,2,3,4,5,6,7,8,9,10,11,12,13,14,15,16,17,18,19,20,21,22,23,24,25,26,27,28,29,30,31,4294967296,33'),33) from tt1;
ERROR 22000: Invalid data type for the operation
select rb_select(rb_from_string('1,2,3,4,5,6,7,8,9,10,11,12,13,14,15,16,17,18,19,20,21,22,23,24,25,26,27,28,29,30,31,4294967296,33'),33)=rb_select(rb_from_string('1,2,3,4,5,6,7,8,9,10,11,12,13,14,15,16,17,18,19,20,21,22,23,24,25,26,27,28,29,30,31,4294967296,33'),33) ;
ERROR 22000: Invalid data type for the operation
select rb_select(rb_from_string('1,2,3,4,5,6,7,8,9,10,11,12,13,14,15,16,17,18,19,20,21,22,23,24,25,26,27,28,29,30,31,4294967296,33'),33)!=rb_select(rb_from_string('1,2,3,4,5,6,7,8,9,10,11,12,13,14,15,16,17,18,19,20,21,22,23,24,25,26,27,28,29,30,31,4294967296,33'),33) ;
ERROR 22000: Invalid data type for the operation
select rb_select(rb_from_string('1,2,3,4,5,6,7,8,9,10,11,12,13,14,15,16,17,18,19,20,21,22,23,24,25,26,27,28,29,30,31,4294967296,33'),33)<>rb_select(rb_from_string('1,2,3,4,5,6,7,8,9,10,11,12,13,14,15,16,17,18,19,20,21,22,23,24,25,26,27,28,29,30,31,4294967296,33'),33) ;
ERROR 22000: Invalid data type for the operation
select rb_select(rb_from_string('1,2,3,4,5,6,7,8,9,10,11,12,13,14,15,16,17,18,19,20,21,22,23,24,25,26,27,28,29,30,31,4294967296,33'),33)<=>rb_select(rb_from_string('1,2,3,4,5,6,7,8,9,10,11,12,13,14,15,16,17,18,19,20,21,22,23,24,25,26,27,28,29,30,31,4294967296,33'),33) ;
ERROR 22000: Invalid data type for the operation
select rb_select(rb_from_string('1,2,3,4,5,6,7,8,9,10,11,12,13,14,15,16,17,18,19,20,21,22,23,24,25,26,27,28,29,30,31,4294967296,33'),33)=rb_build_agg(1);
ERROR 22000: Invalid data type for the operation
select rb_select(rb_from_string('1,2,3,4,5,6,7,8,9,10,11,12,13,14,15,16,17,18,19,20,21,22,23,24,25,26,27,28,29,30,31,4294967296,33'),33)=rb_build_empty();
ERROR 22000: Invalid data type for the operation
select rb_select(rb_from_string('1,2,3,4,5,6,7,8,9,10,11,12,13,14,15,16,17,18,19,20,21,22,23,24,25,26,27,28,29,30,31,4294967296,33'),33)=rb_to_varbinary(rb_build_empty());
ERROR 22000: Invalid data type for the operation
select rb_select(rb_from_string('1,2,3,4,5,6,7,8,9,10,11,12,13,14,15,16,17,18,19,20,21,22,23,24,25,26,27,28,29,30,31,4294967296,33'),33)=rb_to_string(rb_build_empty());
ERROR 22000: Invalid data type for the operation
select rb_select(rb_from_string('1,2,3,4,5,6,7,8,9,10,11,12,13,14,15,16,17,18,19,20,21,22,23,24,25,26,27,28,29,30,31,4294967296,33'),33)=rb_to_string(rb_build_empty());
ERROR 22000: Invalid data type for the operation
select rb_select(r,32)=rb_select(r,32) from tt1;
ERROR 22000: Invalid data type for the operation
select rb_select(r,32)!='test' from tt1;
ERROR 22000: Invalid data type for the operation
select rb_select(rb_from_string('1,2,3,4,5,6,7,8,9,10,11,12,13,14,15,16,17,18,19,20,21,22,23,24,25,26,27,28,29,30,31,4294967296,33'),33)<'test';
ERROR 22000: Invalid data type for the operation
select rb_select(rb_from_string('1,2,3,4,5,6,7,8,9,10,11,12,13,14,15,16,17,18,19,20,21,22,23,24,25,26,27,28,29,30,31,4294967296,33'),33)=1 ;
ERROR 22000: Invalid data type for the operation
select rb_select(rb_from_string('1,2,3,4,5,6,7,8,9,10,11,12,13,14,15,16,17,18,19,20,21,22,23,24,25,26,27,28,29,30,31,4294967296,33'),33)<>1 ;
ERROR 22000: Invalid data type for the operation
select +rb_select(r,32) from tt1;
+---------------------------------------------------------------------------------------------------------------------------------------------------------------------------------------------------------------------------------------------------------------------+
| +rb_select(r,32)                                                                                                                                                                                                                                                    |
+---------------------------------------------------------------------------------------------------------------------------------------------------------------------------------------------------------------------------------------------------------------------+
|                                                                                                                                                                                                                                                                    |
|                                                                                                                                                                                                                                                                  |
|                                                                                                                                                                                                                                                                  |
|                	                                                                                                                                                                                                                                            |
|                	                                                                                                                                                                                                                                            |
|                                                                                                                                                                                                                                                           |
|                          	   
                                                                                                                                                                                                       |
|                          	   
                                                                                                                                                                                                      |
|                                                          	       
                                                                                                                                                                 |
| @&T    ‰T   	   
   ‘ˇˇˇ	   N     Û       ö;   ê      ^–≤    Ú*   +     '     ˇ=    œ     ø∆-    »      êÂT   Ñ    Á     ê&ˇˇ	   d      ?B           /u                        (kÓ      
      
   ª                                      |
|                              	   
                                                                                                                                                                                                   |
| ˇ˛   ˇ  ˇ  ˇ  ˇ  ˇ  ˇ  ˇ  ˇ  ˇ  	ˇ  
ˇ  ˇ  ˇ  ˇ  ˇ                                                                                                                                                                                                                    |
+---------------------------------------------------------------------------------------------------------------------------------------------------------------------------------------------------------------------------------------------------------------------+
select +rb_select(r,32) from vtt1;
+---------------------------------------------------------------------------------------------------------------------------------------------------------------------------------------------------------------------------------------------------------------------+
| +rb_select(r,32)                                                                                                                                                                                                                                                    |
+---------------------------------------------------------------------------------------------------------------------------------------------------------------------------------------------------------------------------------------------------------------------+
|                                                                                                                                                                                                                                                                    |
|                                                                                                                                                                                                                                                                  |
|                                                                                                                                                                                                                                                                  |
|                	                                                                                                                                                                                                                                            |
|                	                                                                                                                                                                                                                                            |
|                                                                                                                                                                                                                                                           |
|                          	   
                                                                                                                                                                                                       |
|                          	   
                                                                                                                                                                                                      |
|                                                          	       
                                                                                                                                                                 |
| @&T    ‰T   	   
   ‘ˇˇˇ	   N     Û       ö;   ê      ^–≤    Ú*   +     '     ˇ=    œ     ø∆-    »      êÂT   Ñ    Á     ê&ˇˇ	   d      ?B           /u                        (kÓ      
      
   ª                                      |
|                              	   
                                                                                                                                                                                                   |
| ˇ˛   ˇ  ˇ  ˇ  ˇ  ˇ  ˇ  ˇ  ˇ  ˇ  	ˇ  
ˇ  ˇ  ˇ  ˇ  ˇ                                                                                                                                                                                                                    |
+---------------------------------------------------------------------------------------------------------------------------------------------------------------------------------------------------------------------------------------------------------------------+
select -rb_select(r,32) from tt1;
ERROR 22000: Invalid data type for the operation
select rb_select(r,32)+rb_select(r,32) from tt1;
ERROR 22000: Invalid data type for the operation
select rb_select(r,32)+1 from tt1;
ERROR 22000: Invalid data type for the operation
select rb_select(r,32)+'test' from tt1;
ERROR 22000: Invalid data type for the operation
select rb_select(r,32)+null from tt1;
ERROR 22000: Invalid data type for the operation
select rb_select(r,32)+false from tt1;
ERROR 22000: Invalid data type for the operation
select rb_select(r,32)+true from tt1;
ERROR 22000: Invalid data type for the operation
select rb_select(r,32)-rb_select(r,32) from tt1;
ERROR 22000: Invalid data type for the operation
select rb_select(r,32)-1 from tt1;
ERROR 22000: Invalid data type for the operation
select rb_select(r,32)-'test' from tt1;
ERROR 22000: Invalid data type for the operation
select rb_select(r,32)-null from tt1;
ERROR 22000: Invalid data type for the operation
select rb_select(r,32)-false from tt1;
ERROR 22000: Invalid data type for the operation
select rb_select(r,32)-true from tt1;
ERROR 22000: Invalid data type for the operation
select rb_select(r,32)*rb_select(r,32) from tt1;
ERROR 22000: Invalid data type for the operation
select rb_select(r,32)*1 from tt1;
ERROR 22000: Invalid data type for the operation
select rb_select(r,32)*'test' from tt1;
ERROR 22000: Invalid data type for the operation
select rb_select(r,32)*null from tt1;
ERROR 22000: Invalid data type for the operation
select rb_select(r,32)*false from tt1;
ERROR 22000: Invalid data type for the operation
select rb_select(r,32)*true from tt1;
ERROR 22000: Invalid data type for the operation
select rb_select(r,32)*rb_select(r,32) from tt1;
ERROR 22000: Invalid data type for the operation
select rb_select(r,32)*1 from tt1;
ERROR 22000: Invalid data type for the operation
select rb_select(r,32)*'test' from tt1;
ERROR 22000: Invalid data type for the operation
select rb_select(r,32)*null from tt1;
ERROR 22000: Invalid data type for the operation
select rb_select(r,32)*false from tt1;
ERROR 22000: Invalid data type for the operation
select rb_select(r,32)*true from tt1;
ERROR 22000: Invalid data type for the operation
select rb_select(r,32)/rb_select(r,32) from tt1;
ERROR 22000: Invalid data type for the operation
select rb_select(r,32)/1 from tt1;
ERROR 22000: Invalid data type for the operation
select rb_select(r,32)/'test' from tt1;
ERROR 22000: Invalid data type for the operation
select rb_select(r,32)/null from tt1;
ERROR 22000: Invalid data type for the operation
select rb_select(r,32)/false from tt1;
ERROR 22000: Invalid data type for the operation
select rb_select(r,32)/true from tt1;
ERROR 22000: Invalid data type for the operation
select rb_select(r,32) div rb_select(r,32) from tt1;
ERROR 22000: Invalid data type for the operation
select rb_select(r,32) div 1 from tt1;
ERROR 22000: Invalid data type for the operation
select rb_select(r,32) div 'test' from tt1;
ERROR 22000: Invalid data type for the operation
select rb_select(r,32) div null from tt1;
ERROR 22000: Invalid data type for the operation
select rb_select(r,32) div false from tt1;
ERROR 22000: Invalid data type for the operation
select rb_select(r,32) div true from tt1;
ERROR 22000: Invalid data type for the operation
select rb_select(r,32) % rb_select(r,32) from tt1;
ERROR 22000: Invalid data type for the operation
select rb_select(r,32) % 1 from tt1;
ERROR 22000: Invalid data type for the operation
select rb_select(r,32) % 'test' from tt1;
ERROR 22000: Invalid data type for the operation
select rb_select(r,32) % null from tt1;
ERROR 22000: Invalid data type for the operation
select rb_select(r,32) % false from tt1;
ERROR 22000: Invalid data type for the operation
select rb_select(r,32) % true from tt1;
ERROR 22000: Invalid data type for the operation
select rb_select(r,32) mod rb_select(r,32) from tt1;
ERROR 22000: Invalid data type for the operation
select rb_select(r,32) mod 1 from tt1;
ERROR 22000: Invalid data type for the operation
select rb_select(r,32) mod 'test' from tt1;
ERROR 22000: Invalid data type for the operation
select rb_select(r,32) mod null from tt1;
ERROR 22000: Invalid data type for the operation
select rb_select(r,32) mod false from tt1;
ERROR 22000: Invalid data type for the operation
select rb_select(r,32) mod true from tt1;
ERROR 22000: Invalid data type for the operation
select rb_select(r,32) & rb_select(r,32) from tt1;
ERROR 22000: Invalid data type for the operation
select rb_select(r,32) & 1 from tt1;
ERROR 22000: Invalid data type for the operation
select rb_select(r,32) & 'test' from tt1;
ERROR 22000: Invalid data type for the operation
select rb_select(r,32) & null from tt1;
ERROR 22000: Invalid data type for the operation
select rb_select(r,32) & false from tt1;
ERROR 22000: Invalid data type for the operation
select rb_select(r,32) & true from tt1;
ERROR 22000: Invalid data type for the operation
select rb_select(r,32) | rb_select(r,32) from tt1;
ERROR 22000: Invalid data type for the operation
select rb_select(r,32) | 1 from tt1;
ERROR 22000: Invalid data type for the operation
select rb_select(r,32) | 'test' from tt1;
ERROR 22000: Invalid data type for the operation
select rb_select(r,32) | null from tt1;
ERROR 22000: Invalid data type for the operation
select rb_select(r,32) | false from tt1;
ERROR 22000: Invalid data type for the operation
select rb_select(r,32) | true from tt1;
ERROR 22000: Invalid data type for the operation
select ~rb_select(r,32)from tt1;
ERROR 22000: Invalid data type for the operation
select rb_select(r,32) ^ rb_select(r,32) from tt1;
ERROR 22000: Invalid data type for the operation
select rb_select(r,32) ^ 1 from tt1;
ERROR 22000: Invalid data type for the operation
select rb_select(r,32) ^ 'test' from tt1;
ERROR 22000: Invalid data type for the operation
select rb_select(r,32) ^ null from tt1;
ERROR 22000: Invalid data type for the operation
select rb_select(r,32) ^ false from tt1;
ERROR 22000: Invalid data type for the operation
select rb_select(r,32) ^ true from tt1;
ERROR 22000: Invalid data type for the operation
select rb_select(r,32) << rb_build_agg(1) from tt1;
ERROR 22000: Invalid data type for the operation
select rb_select(r,32) << 1 from tt1;
ERROR 22000: Invalid data type for the operation
select rb_select(r,32) << 'test' from tt1;
ERROR 22000: Invalid data type for the operation
select rb_select(r,32) << null from tt1;
ERROR 22000: Invalid data type for the operation
select rb_select(r,32) << false from tt1;
ERROR 22000: Invalid data type for the operation
select rb_select(r,32) << true from tt1;
ERROR 22000: Invalid data type for the operation
select rb_select(r,32) >> rb_build_agg(1) from tt1;
ERROR 22000: Invalid data type for the operation
select rb_select(r,32) >> 1 from tt1;
ERROR 22000: Invalid data type for the operation
select rb_select(r,32) >> 'test' from tt1;
ERROR 22000: Invalid data type for the operation
select rb_select(r,32) >> null from tt1;
ERROR 22000: Invalid data type for the operation
select rb_select(r,32) >> false from tt1;
ERROR 22000: Invalid data type for the operation
select rb_select(r,32) >> true from tt1;
ERROR 22000: Invalid data type for the operation
select rb_select(r,32) is true from tt1;
ERROR 22000: Invalid data type for the operation
select rb_select(r,32) in (rb_build_agg(1)) from tt1;
ERROR 22000: Invalid data type for the operation
select rb_select(r,32) not in (rb_build_agg(1)) from tt1;
ERROR 22000: Invalid data type for the operation
select rb_select(r,32) like (rb_build_agg(1)) from tt1;
+----------------------------------------+
| rb_select(r,32) like (rb_build_agg(1)) |
+----------------------------------------+
|                                      0 |
+----------------------------------------+
select rb_select(r,32) like 1 from tt1;
+------------------------+
| rb_select(r,32) like 1 |
+------------------------+
|                      0 |
|                      0 |
|                      0 |
|                      0 |
|                      0 |
|                      0 |
|                      0 |
|                      0 |
|                      0 |
|                      0 |
|                      0 |
|                      0 |
+------------------------+
select  rb_select(r,32) BETWEEN rb_select(r,32) and rb_select(r,32) from tt1;
ERROR 22000: Invalid data type for the operation
select  rb_select(r,32) is null from tt1;
+-------------------------+
| rb_select(r,32) is null |
+-------------------------+
|                       0 |
|                       0 |
|                       0 |
|                       0 |
|                       0 |
|                       0 |
|                       0 |
|                       0 |
|                       0 |
|                       0 |
|                       0 |
|                       0 |
+-------------------------+
select  rb_select(r,32) is not null from tt1;
+-----------------------------+
| rb_select(r,32) is not null |
+-----------------------------+
|                           1 |
|                           1 |
|                           1 |
|                           1 |
|                           1 |
|                           1 |
|                           1 |
|                           1 |
|                           1 |
|                           1 |
|                           1 |
|                           1 |
+-----------------------------+
select  rb_select(r,32) is false from tt1;
ERROR 22000: Invalid data type for the operation
select not rb_select(r,32) from tt1;
ERROR 22000: Invalid data type for the operation
select  rb_select(r,32) and rb_select(r,32)  from tt1;
ERROR 22000: Invalid data type for the operation
select  rb_select(r,32) && rb_select(r,32)  from tt1;
ERROR 22000: Invalid data type for the operation
select  rb_select(r,32) or rb_select(r,32)  from tt1;
ERROR 22000: Invalid data type for the operation
select  rb_select(r,32) || rb_select(r,32)  from tt1;
ERROR 22000: Invalid data type for the operation
select  rb_select(r,32) || 1 from tt1;
ERROR 22000: Invalid data type for the operation
select  rb_select(r,32) XOR rb_select(r,32)  from tt1;
ERROR 22000: Invalid data type for the operation
select  rb_select(r,32) XOR 1 from tt1;
ERROR 22000: Invalid data type for the operation
select  'test' XOR rb_select(r,32) from tt1;
ERROR 22000: Invalid data type for the operation
SELECT BINARY rb_select(r,32) = rb_select(r,32) from tt1;
ERROR 22000: Invalid data type for the operation
select CONVERT(rb_select(r,32) USING BINARY) from tt1;
+---------------------------------------------------------------------------------------------------------------------------------------------------------------------------------------------------------------------------------------------------------------------+
| CONVERT(rb_select(r,32) USING BINARY)                                                                                                                                                                                                                               |
+---------------------------------------------------------------------------------------------------------------------------------------------------------------------------------------------------------------------------------------------------------------------+
|                                                                                                                                                                                                                                                                    |
|                                                                                                                                                                                                                                                                  |
|                                                                                                                                                                                                                                                                  |
|                	                                                                                                                                                                                                                                            |
|                	                                                                                                                                                                                                                                            |
|                                                                                                                                                                                                                                                           |
|                          	   
                                                                                                                                                                                                       |
|                          	   
                                                                                                                                                                                                      |
|                                                          	       
                                                                                                                                                                 |
| @&T    ‰T   	   
   ‘ˇˇˇ	   N     Û       ö;   ê      ^–≤    Ú*   +     '     ˇ=    œ     ø∆-    »      êÂT   Ñ    Á     ê&ˇˇ	   d      ?B           /u                        (kÓ      
      
   ª                                      |
|                              	   
                                                                                                                                                                                                   |
| ˇ˛   ˇ  ˇ  ˇ  ˇ  ˇ  ˇ  ˇ  ˇ  ˇ  	ˇ  
ˇ  ˇ  ˇ  ˇ  ˇ                                                                                                                                                                                                                    |
+---------------------------------------------------------------------------------------------------------------------------------------------------------------------------------------------------------------------------------------------------------------------+
SELECT CASE rb_select(r,32) WHEN rb_select(r,32) THEN rb_select(r,32) WHEN rb_select(r,32) THEN rb_select(r,32) END from tt1;
ERROR 22000: Invalid data type for the operation
SELECT CASE  WHEN rb_select(r,32) =rb_select(r,32) THEN rb_select(r,32) else  rb_select(r,32) END from vtt1;
ERROR 22000: Invalid data type for the operation
drop table tt2;
create table tt2(id int primary key,a0 roaringbitmap);
drop view vtt2;
create view vtt2 as select * from tt2;
show create table tt2;
Table	Create Table
tt2	CREATE TABLE `tt2` (
  `id` int(11) NOT NULL,
  `a0` roaringbitmap DEFAULT NULL,
  PRIMARY KEY (`id`)
) ORGANIZATION INDEX DEFAULT CHARSET = gbk ROW_FORMAT = DYNAMIC COMPRESSION = 'zstd_1.3.8' REPLICA_NUM = 1 BLOCK_SIZE = 16384 USE_BLOOM_FILTER = FALSE ENABLE_MACRO_BLOCK_BLOOM_FILTER = FALSE TABLET_SIZE = 134217728 PCTFREE = 0 LOB_INROW_THRESHOLD=0
drop table tt2;
CREATE TABLE `tt2` (
  `id` int(11) DEFAULT NULL,
  `a0` roaringbitmap DEFAULT NULL
) DEFAULT CHARSET = utf8mb4 ROW_FORMAT = DYNAMIC COMPRESSION = 'zstd_1.3.8' REPLICA_NUM = 1 BLOCK_SIZE = 16384 USE_BLOOM_FILTER = FALSE TABLET_SIZE = 134217728 PCTFREE = 0;
drop view vtt2;
create view vtt2 as select * from tt2;
insert into tt2 values(1,rb_select(rb_from_string('1'),1)),(2,rb_select(rb_from_string('4294967296'),1)),(3,rb_select(rb_from_string('2,4294967295'),2)),(4,rb_select(rb_from_string('4294967297,4294967296'),2)),
(5,rb_select(rb_from_string('4294967296,4294967297,42949672969,4294967298,42949672961,42949672962,4294967299,4294967297,14294967296,14294967696,14295967296,5294967296,7294967296,9294967296,8294967296,42949617296,42949672916,4294967396,4294967496,
4294967595,4294967696,4294967795,4294968295,4294967995,4294977295,4294987295,4294997295,4294968295,4294969295,4295967295,4296967295,4297967295,4298967295'),33)),(6,rb_select(rb_from_string('1,2,3,4,5,6,7,8,9,10,11,12,13,14,15,16,17,18,19,20,21,22,23,24,25,26,27,28,29,30,31,65537'),32));
select * from tt2;
+------+-------------------------------------------------------------------------------------------------------------------------------------------------------------------------------------------------------------------------------------------------------------+
| id   | a0                                                                                                                                                                                                                                                          |
+------+-------------------------------------------------------------------------------------------------------------------------------------------------------------------------------------------------------------------------------------------------------------+
|    1 |                                                                                                                                                                                                                                                          |
|    2 |                                                                                                                                                                                                                                                          |
|    3 |    ˇˇˇˇ                                                                                                                                                                                                                                                     |
|    4 |                                                                                                                                                                                                                                                       |
|    5 | @&T    ‰T   	   
   ‘ˇˇˇ	   N     Û       ö;   ê      ^–≤    Ú*   +     '     ˇ=    œ     ø∆-    »      êÂT   Ñ    Á     ê&ˇˇ	   d      ?B           /u                        (kÓ      
      
   ª                              |
|    6 |                          	   
                                                                                                                                                                                             |
+------+-------------------------------------------------------------------------------------------------------------------------------------------------------------------------------------------------------------------------------------------------------------+
replace into vtt2 values(1,rb_select(rb_from_string('1'),1)),(2,rb_select(rb_from_string('4294967296'),1)),(3,rb_select(rb_from_string('2,4294967295'),2)),(4,rb_select(rb_from_string('4294967297,4294967296'),2)),
(5,rb_select(rb_from_string('4294967296,4294967297,42949672969,4294967298,42949672961,42949672962,4294967299,4294967297,14294967296,14294967696,14295967296,5294967296,7294967296,9294967296,8294967296,42949617296,42949672916,4294967396,4294967496,
4294967595,4294967696,4294967795,4294968295,4294967995,4294977295,4294987295,4294997295,4294968295,4294969295,4295967295,4296967295,4297967295,4298967295'),33)),(6,rb_select(rb_from_string('1,2,3,4,5,6,7,8,9,10,11,12,13,14,15,16,17,18,19,20,21,22,23,24,25,26,27,28,29,30,31,65537'),32));
insert into tt2 values(1,rb_select(rb_from_string('1'),1)),(2,rb_select(rb_from_string('4294967296'),1)),(3,rb_select(rb_from_string('2,4294967295'),2)),(4,rb_select(rb_from_string('4294967297,4294967296'),2)),
(5,rb_select(rb_from_string('4294967296,4294967297,42949672969,4294967298,42949672961,42949672962,4294967299,4294967297,14294967296,14294967696,14295967296,5294967296,7294967296,9294967296,8294967296,42949617296,42949672916,4294967396,4294967496,
4294967595,4294967696,4294967795,4294968295,4294967995,4294977295,4294987295,4294997295,4294968295,4294969295,4295967295,4296967295,4297967295,4298967295'),33)),(6,rb_select(rb_from_string('1,2,3,4,5,6,7,8,9,10,11,12,13,14,15,16,17,18,19,20,21,22,23,24,25,26,27,28,29,30,31,65537'),32)) ON DUPLICATE KEY UPDATE a0=rb_select(rb_from_string('1,2,3,4,6'),2);
insert into tt2 values(7,(select rb_select(rb_from_string(result),4090) from (select GROUP_CONCAT(number SEPARATOR ',') AS result
FROM (
    SELECT FLOOR(65335+RAND() * 1000000) AS number
    FROM TABLE(GENERATOR(4090))
) AS random_numbers)));
insert into vtt2 values(8,(select rb_select(rb_from_string(result),5000) from (select GROUP_CONCAT(number SEPARATOR ',') AS result
FROM (
    SELECT FLOOR(65335+RAND() * 1000000) AS number
    FROM TABLE(GENERATOR(5000))
) AS random_numbers)));
insert into tt2 values(11,(select rb_select(rb_from_string(result),1000000) from (select GROUP_CONCAT(number SEPARATOR ',') AS result
FROM (
    SELECT FLOOR(65335+RAND() * 1000000) AS number
    FROM TABLE(GENERATOR(10000))
) AS random_numbers)));
insert into tt2 values(12,(select rb_select(rb_from_string(result),1000000) from (select GROUP_CONCAT(number SEPARATOR ',') AS result
FROM (
    SELECT FLOOR(65335+RAND() * 1000000) AS number
    FROM TABLE(GENERATOR(1000000))
) AS random_numbers)));
insert into tt2 values(13,(select rb_select(rb_from_string(result),5000) from (select GROUP_CONCAT(number SEPARATOR ',') AS result
FROM (
    SELECT FLOOR(4294968295+RAND() * 10) AS number
    FROM TABLE(GENERATOR(5000))
) AS random_numbers)));
replace into tt2 values(14,(select rb_select(rb_from_string(result),1000000) from (select GROUP_CONCAT(number SEPARATOR ',') AS result
FROM (
    SELECT FLOOR(65335+RAND() * 1000000) AS number
    FROM TABLE(GENERATOR(100000))
) AS random_numbers)));
select * from tt2;
insert into vtt2 values(1,rb_from_string('1')),(2,rb_from_string('4294967296')),(3,rb_from_string('2,4294967295')),(4,rb_from_string('4294967297,4294967296')),
(5,rb_from_string('4294967296,4294967297,42949672969,4294967298,42949672961,42949672962,4294967299,4294967297,14294967296,14294967696,14295967296,5294967296,7294967296,9294967296,8294967296,42949617296,42949672916,4294967396,4294967496,
4294967595,4294967696,4294967795,4294968295,4294967995,4294977295,4294987295,4294997295,4294968295,4294969295,4295967295,4296967295,4297967295,4298967295')),(6,rb_from_string('1,2,3,4,5,6,7,8,9,10,11,12,13,14,15,16,17,18,19,20,21,22,23,24,25,26,27,28,29,30,31,65537'));
replace into vtt2 values(1,rb_from_string('1')),(2,rb_from_string('4294967296')),(3,rb_from_string('2,4294967295')),(4,rb_from_string('4294967297,4294967296')),
(5,rb_from_string('4294967296,4294967297,42949672969,4294967298,42949672961,42949672962,4294967299,4294967297,14294967296,14294967696,14295967296,5294967296,7294967296,9294967296,8294967296,42949617296,42949672916,4294967396,4294967496,
4294967595,4294967696,4294967795,4294968295,4294967995,4294977295,4294987295,4294997295,4294968295,4294969295,4295967295,4296967295,4297967295,4298967295')),(6,rb_from_string('1,2,3,4,5,6,7,8,9,10,11,12,13,14,15,16,17,18,19,20,21,22,23,24,25,26,27,28,29,30,31,65537'));
select * from tt2;
update tt2 set a0=rb_select(rb_from_string('0'),1) where id in(1,2);
select * from tt2;
update tt2 set a0=rb_select(rb_from_string('4294977296'),1);
select * from tt2;
+------+------------+
| id   | a0         |
+------+------------+
|    1 | '      |
|    2 | '      |
|    3 | '      |
|    4 | '      |
|    5 | '      |
|    6 | '      |
|    1 | '      |
|    2 | '      |
|    3 | '      |
|    4 | '      |
|    5 | '      |
|    6 | '      |
|    1 | '      |
|    2 | '      |
|    3 | '      |
|    4 | '      |
|    5 | '      |
|    6 | '      |
|    7 | '      |
|    8 | '      |
|   11 | '      |
|   12 | '      |
|   13 | '      |
|   14 | '      |
|    1 | '      |
|    2 | '      |
|    3 | '      |
|    4 | '      |
|    5 | '      |
|    6 | '      |
|    1 | '      |
|    2 | '      |
|    3 | '      |
|    4 | '      |
|    5 | '      |
|    6 | '      |
+------+------------+
update tt2 set a0=rb_select(rb_from_string('4294977296,1'),2) where rb_select(rb_from_string('4294977296'),1)=rb_select(rb_from_string('4294977296'),1) ;
ERROR 22000: Invalid data type for the operation
update tt2 set a0=rb_select(rb_from_string('4294977296,1'),2) where rb_select(rb_from_string('4294977296'),1)>rb_select(rb_from_string('4294977296'),2) ;
ERROR 22000: Invalid data type for the operation
update tt2 set a0=rb_select(rb_from_string('4294977296,1'),2) where rb_select(rb_from_string('4294977296,1'),2)!=a0;
ERROR 22000: Invalid data type for the operation
update tt2 set a0=rb_select(rb_from_string('4294977296,1'),2) where rb_select(rb_from_string('4294977296,1'),2)<'test';
ERROR 22000: Invalid data type for the operation
select * from tt2;
+------+------------+
| id   | a0         |
+------+------------+
|    1 | '      |
|    2 | '      |
|    3 | '      |
|    4 | '      |
|    5 | '      |
|    6 | '      |
|    1 | '      |
|    2 | '      |
|    3 | '      |
|    4 | '      |
|    5 | '      |
|    6 | '      |
|    1 | '      |
|    2 | '      |
|    3 | '      |
|    4 | '      |
|    5 | '      |
|    6 | '      |
|    7 | '      |
|    8 | '      |
|   11 | '      |
|   12 | '      |
|   13 | '      |
|   14 | '      |
|    1 | '      |
|    2 | '      |
|    3 | '      |
|    4 | '      |
|    5 | '      |
|    6 | '      |
|    1 | '      |
|    2 | '      |
|    3 | '      |
|    4 | '      |
|    5 | '      |
|    6 | '      |
+------+------------+
update tt2 set a0=rb_select(rb_from_string('4294977296,1'),2);
select * from tt2;
+------+---------------------+
| id   | a0                  |
+------+---------------------+
|    1 |        '      |
|    2 |        '      |
|    3 |        '      |
|    4 |        '      |
|    5 |        '      |
|    6 |        '      |
|    1 |        '      |
|    2 |        '      |
|    3 |        '      |
|    4 |        '      |
|    5 |        '      |
|    6 |        '      |
|    1 |        '      |
|    2 |        '      |
|    3 |        '      |
|    4 |        '      |
|    5 |        '      |
|    6 |        '      |
|    7 |        '      |
|    8 |        '      |
|   11 |        '      |
|   12 |        '      |
|   13 |        '      |
|   14 |        '      |
|    1 |        '      |
|    2 |        '      |
|    3 |        '      |
|    4 |        '      |
|    5 |        '      |
|    6 |        '      |
|    1 |        '      |
|    2 |        '      |
|    3 |        '      |
|    4 |        '      |
|    5 |        '      |
|    6 |        '      |
+------+---------------------+
update tt2 set a0=rb_select(rb_from_string('4294977296,1,6,4,25,26,27,28,29,30,3'),10);
select * from tt2;
+------+---------------------------------------------+
| id   | a0                                          |
+------+---------------------------------------------+
|    1 | 
                               |
|    2 | 
                               |
|    3 | 
                               |
|    4 | 
                               |
|    5 | 
                               |
|    6 | 
                               |
|    1 | 
                               |
|    2 | 
                               |
|    3 | 
                               |
|    4 | 
                               |
|    5 | 
                               |
|    6 | 
                               |
|    1 | 
                               |
|    2 | 
                               |
|    3 | 
                               |
|    4 | 
                               |
|    5 | 
                               |
|    6 | 
                               |
|    7 | 
                               |
|    8 | 
                               |
|   11 | 
                               |
|   12 | 
                               |
|   13 | 
                               |
|   14 | 
                               |
|    1 | 
                               |
|    2 | 
                               |
|    3 | 
                               |
|    4 | 
                               |
|    5 | 
                               |
|    6 | 
                               |
|    1 | 
                               |
|    2 | 
                               |
|    3 | 
                               |
|    4 | 
                               |
|    5 | 
                               |
|    6 | 
                               |
+------+---------------------------------------------+
update tt2 set a0=(select rb_select(rb_from_string(result),100000) from (select GROUP_CONCAT(number SEPARATOR ',') AS result
FROM (
    SELECT FLOOR(65335+RAND() * 1000000) AS number
    FROM TABLE(GENERATOR(100000))
) AS random_numbers)) ,id=100 limit 1;
select * from tt2;
update vtt2 set a0=(select rb_from_string(result) from (select GROUP_CONCAT(number SEPARATOR ',') AS result
FROM (
    SELECT FLOOR(4294977296+RAND() * 4096) AS number
    FROM TABLE(GENERATOR(4096))
) AS random_numbers)) ;
select * from tt2;
truncate tt2;
drop table tt3;
create table tt3(id int,r roaringbitmap);
insert into tt3  select id, rb_select(r,10) from tt1;
replace into tt3  select id, rb_select(r,10) from tt1;
##ÊóÅË∑ØÂØºÂÖ•ÂÖÅËÆ∏ÂõûÈÄÄÈÖçÁΩÆÈ°πdirect_load_allow_fallbackÈªòËÆ§‰∏∫trueÔºåÂç≥ÊóÅË∑Ø‰∏çÊîØÊåÅÂú∫ÊôØ‰∏çÊä•ÈîôÔºåÂõûÈÄÄ‰∏∫ÊôÆÈÄöÂØºÂÖ•ÔºåÂÖà‰øÆÊîπËØ•ÈÖçÁΩÆÈ°π‰∏∫falseÔºåÊ≠£Â∏∏Êä•Èîô
insert /*+ direct(true,100) enable_parallel_dml parallel(2) append*/ into tt3 select id, rb_select(r,10) from tt1;
ERROR 0A000: direct-load does not support table has roaringbitmap column
insert /*+ direct(true,100,'inc') enable_parallel_dml parallel(2) append*/ into tt3 select id, rb_select(r,10) from tt1;
ERROR 0A000: direct-load does not support table has roaringbitmap column
insert /*+ direct(true,100) enable_parallel_dml parallel(2) append*/ into tt3 select id, r from tt1;
ERROR 0A000: direct-load does not support table has roaringbitmap column
drop table tt2;
create table tt2 (id int,r binary(100));
drop view vtt2;
create view vtt2 as select * from tt2;
insert into tt2 values(1,rb_select(rb_from_string('1,2,6,7,8,9,4296967297'),6,0,true));
replace into tt2 values(1,rb_select(rb_from_string('1,2,6,7,8,9,4296967297'),7));
insert into vtt2 values(1,rb_select(rb_from_string('1,2,6,7,8,9,4296967297'),6,0,true));
replace into vtt2 values(1,rb_select(rb_from_string('1,2,6,7,8,9,4296967297'),6,0,true));
replace into tt2 values(1,(select rb_select(rb_from_string('1,2,6,7,8,9,4296967297'),6,0,true)));
replace into vtt2 values(1,(select rb_select(rb_from_string('1,2,6,7,8,9,4296967297'),6,0,true)));
insert into tt2 values(1,rb_select(rb_from_string('1,2,6,7,8,9,4296967297'),6,0,true))  ON DUPLICATE KEY UPDATE id=2,r ='test';
insert into tt2 values(2,rb_select(rb_from_string('1,2'),1));
update tt2 set r=rb_select(rb_from_string('1,2,6,7,8,9,4296967297'),6,0,true) where id=2;
select * from tt2;
+------+------------------------------------------------------------------------------------------------------+
| id   | r                                                                                                    |
+------+------------------------------------------------------------------------------------------------------+
|    1 |                             	       ÅÑ                                                        |
|    1 |                                    	       ÅÑ                                                |
|    1 |                             	       ÅÑ                                                        |
|    1 |                             	       ÅÑ                                                        |
|    1 |                             	       ÅÑ                                                        |
|    1 |                             	       ÅÑ                                                        |
|    1 |                             	       ÅÑ                                                        |
|    2 |                             	       ÅÑ                                                        |
+------+------------------------------------------------------------------------------------------------------+
insert into tt2 values(3,rb_select(rb_from_string('1,2,3'),2));
update vtt2 set r=rb_select(rb_from_string('1,2,6,7,8,9,4296967297'),6,0,true) where id=3;
select * from tt2;
+------+------------------------------------------------------------------------------------------------------+
| id   | r                                                                                                    |
+------+------------------------------------------------------------------------------------------------------+
|    1 |                             	       ÅÑ                                                        |
|    1 |                                    	       ÅÑ                                                |
|    1 |                             	       ÅÑ                                                        |
|    1 |                             	       ÅÑ                                                        |
|    1 |                             	       ÅÑ                                                        |
|    1 |                             	       ÅÑ                                                        |
|    1 |                             	       ÅÑ                                                        |
|    2 |                             	       ÅÑ                                                        |
|    3 |                             	       ÅÑ                                                        |
+------+------------------------------------------------------------------------------------------------------+
update vtt2 set r=rb_select(rb_from_string('1,2,6,7,8,9,4296967297'),6,0,true) where r>rb_select(rb_from_string('1,2,6,7,8,9,4296967297'),6,0,true);
ERROR 22000: Invalid data type for the operation
delete from vtt2 where  r=rb_select(rb_from_string('1,2,6,7,8,9,4296967297'),6,0,true);
ERROR 22000: Invalid data type for the operation
delete from tt2 where  r<rb_select(rb_from_string('1,2,6,7,8,9,4296967297'),6,0,true);
ERROR 22000: Invalid data type for the operation
drop table tt2;
create table tt2 (id int,r varbinary(100));
drop view vtt2;
create view vtt2 as select * from tt2;
insert into tt2 values(1,rb_select(rb_from_string('1,2,6,7,8,9,4296967297'),6,0,true));
replace into tt2 values(1,rb_select(rb_from_string('1,2,6,7,8,9,4296967297'),6,0,true));
insert into vtt2 values(1,rb_select(rb_from_string('1,2,6,7,8,9,4296967297'),6,0,true));
replace into vtt2 values(1,rb_select(rb_from_string('1,2,6,7,8,9,4296967297'),6,0,true));
replace into tt2 values(1,(select rb_select(rb_from_string('1,2,6,7,8,9,4296967297'),6,0,true)));
replace into vtt2 values(1,(select rb_select(rb_from_string('1,2,6,7,8,9,4296967297'),6,0,true)));
insert into tt2 values(1,rb_select(rb_from_string('1,2,6,7,8,9,4296967297'),6,0,true))  ON DUPLICATE KEY UPDATE id=2,r ='test';
select * from tt2;
+------+-----------------------------------------------------+
| id   | r                                                   |
+------+-----------------------------------------------------+
|    1 |                             	       ÅÑ       |
|    1 |                             	       ÅÑ       |
|    1 |                             	       ÅÑ       |
|    1 |                             	       ÅÑ       |
|    1 |                             	       ÅÑ       |
|    1 |                             	       ÅÑ       |
|    1 |                             	       ÅÑ       |
+------+-----------------------------------------------------+
insert into tt2 values(3,rb_from_string('1,2,3'));
update tt2 set r=rb_select(rb_from_string('1,2,6,7,8,9,4296967297'),6,0,true) where id=2;
select * from tt2;
+------+-----------------------------------------------------+
| id   | r                                                   |
+------+-----------------------------------------------------+
|    1 |                             	       ÅÑ       |
|    1 |                             	       ÅÑ       |
|    1 |                             	       ÅÑ       |
|    1 |                             	       ÅÑ       |
|    1 |                             	       ÅÑ       |
|    1 |                             	       ÅÑ       |
|    1 |                             	       ÅÑ       |
|    3 |                                               |
+------+-----------------------------------------------------+
insert into vtt2 values(3,rb_from_string('1,2,3'));
update vtt2 set r=rb_select(rb_from_string('1,2,6,7,8,9,4296967297'),6,0,true) where id=3;
select * from vtt2;
+------+-----------------------------------------------------+
| id   | r                                                   |
+------+-----------------------------------------------------+
|    1 |                             	       ÅÑ       |
|    1 |                             	       ÅÑ       |
|    1 |                             	       ÅÑ       |
|    1 |                             	       ÅÑ       |
|    1 |                             	       ÅÑ       |
|    1 |                             	       ÅÑ       |
|    1 |                             	       ÅÑ       |
|    3 |                             	       ÅÑ       |
|    3 |                             	       ÅÑ       |
+------+-----------------------------------------------------+
drop table tt2;
create table tt2 (id int,r varchar(100));
drop view vtt2;
create view vtt2 as select * from tt2;
insert into tt2 values(1,rb_from_string('1,2,6,7,8,9,10'));
insert into vtt2 values(1,rb_from_string('1,2,6,7,8,9,11'));
insert into tt2 values(1,(select rb_from_string('1,2,6,7,8,9,12')));
insert into vtt2 values(1,(select rb_from_string('1,2,6,7,8,9,13')));
replace into tt2 values(2,rb_from_string('1,2,6,7,8,9,14'));
replace into vtt2 values(2,rb_from_string('1,2,6,7,8,9,15'));
replace into tt2 values(1,(select rb_from_string('1,2,6,7,8,9,16')));
replace into vtt2 values(1,(select rb_from_string('1,2,6,7,8,9,17')));
select * from tt2;
+------+---------------------------------+
| id   | r                               |
+------+---------------------------------+
|    1 |                	   
    |
|    1 |                	       |
|    1 |                	       |
|    1 |                	       |
|    2 |                	       |
|    2 |                	       |
|    1 |                	       |
|    1 |                	       |
+------+---------------------------------+
select * from vtt2;
+------+---------------------------------+
| id   | r                               |
+------+---------------------------------+
|    1 |                	   
    |
|    1 |                	       |
|    1 |                	       |
|    1 |                	       |
|    2 |                	       |
|    2 |                	       |
|    1 |                	       |
|    1 |                	       |
+------+---------------------------------+
insert into tt2 values(3,rb_from_string('1,2,3'));
update tt2 set r=rb_from_string('1,2,6,7,8,9,18') where id=2;
select * from tt2;
+------+---------------------------------+
| id   | r                               |
+------+---------------------------------+
|    1 |                	   
    |
|    1 |                	       |
|    1 |                	       |
|    1 |                	       |
|    2 |                	       |
|    2 |                	       |
|    1 |                	       |
|    1 |                	       |
|    3 |                           |
+------+---------------------------------+
insert into vtt2 values(3,rb_from_string('1,2,3'));
update vtt2 set r=rb_from_string('1,2,6,7,8,9,19') where id=3;
select * from vtt2;
+------+---------------------------------+
| id   | r                               |
+------+---------------------------------+
|    1 |                	   
    |
|    1 |                	       |
|    1 |                	       |
|    1 |                	       |
|    2 |                	       |
|    2 |                	       |
|    1 |                	       |
|    1 |                	       |
|    3 |                	       |
|    3 |                	       |
+------+---------------------------------+
drop table tt2;
create table tt2 (id int,r char(100));
drop view vtt2;
create view vtt2 as select * from tt2;
insert into tt2 values(1,rb_from_string('1,2,6,7,8,9,10'));
insert into vtt2 values(1,rb_from_string('1,2,6,7,8,9,11'));
insert into tt2 values(1,(select rb_from_string('1,2,6,7,8,9,12')));
insert into vtt2 values(1,(select rb_from_string('1,2,6,7,8,9,13')));
replace into tt2 values(2,rb_from_string('1,2,6,7,8,9,14'));
replace into vtt2 values(2,rb_from_string('1,2,6,7,8,9,15'));
replace into tt2 values(1,(select rb_from_string('1,2,6,7,8,9,16')));
replace into vtt2 values(1,(select rb_from_string('1,2,6,7,8,9,17')));
insert into vtt2 values(1,rb_select(rb_from_string('1,2,6,7,8,9'),6,0,true))ON DUPLICATE KEY UPDATE id=2,r ='test';
select * from tt2;
+------+---------------------------------+
| id   | r                               |
+------+---------------------------------+
|    1 |                	   
    |
|    1 |                	       |
|    1 |                	       |
|    1 |                	       |
|    2 |                	       |
|    2 |                	       |
|    1 |                	       |
|    1 |                	       |
|    1 |                	        |
+------+---------------------------------+
select * from vtt2;
+------+---------------------------------+
| id   | r                               |
+------+---------------------------------+
|    1 |                	   
    |
|    1 |                	       |
|    1 |                	       |
|    1 |                	       |
|    2 |                	       |
|    2 |                	       |
|    1 |                	       |
|    1 |                	       |
|    1 |                	        |
+------+---------------------------------+
insert into tt2 values(3,rb_from_string('1,2,3'));
update tt2 set r=rb_from_string('1,2,6,7,8,9,18') where id=2;
select * from tt2;
+------+---------------------------------+
| id   | r                               |
+------+---------------------------------+
|    1 |                	   
    |
|    1 |                	       |
|    1 |                	       |
|    1 |                	       |
|    2 |                	       |
|    2 |                	       |
|    1 |                	       |
|    1 |                	       |
|    1 |                	        |
|    3 |                           |
+------+---------------------------------+
insert into vtt2 values(3,rb_from_string('1,2,3'));
update vtt2 set r=rb_from_string('1,2,6,7,8,9,19') where id=3;
select * from vtt2;
+------+---------------------------------+
| id   | r                               |
+------+---------------------------------+
|    1 |                	   
    |
|    1 |                	       |
|    1 |                	       |
|    1 |                	       |
|    2 |                	       |
|    2 |                	       |
|    1 |                	       |
|    1 |                	       |
|    1 |                	        |
|    3 |                	       |
|    3 |                	       |
+------+---------------------------------+
drop table tt2;
create table tt2 (id int,r tinytext);
drop view vtt2;
create view vtt2 as select * from tt2;
insert into tt2 values(1,rb_from_string('1,2,6,7,8,9,10'));
insert into vtt2 values(1,rb_from_string('1,2,6,7,8,9,11'));
insert into tt2 values(1,(select rb_from_string('1,2,6,7,8,9,12')));
insert into vtt2 values(1,(select rb_from_string('1,2,6,7,8,9,13')));
replace into tt2 values(2,rb_from_string('1,2,6,7,8,9,14'));
replace into vtt2 values(2,rb_from_string('1,2,6,7,8,9,15'));
replace into tt2 values(1,(select rb_from_string('1,2,6,7,8,9,16')));
replace into tt2 values(1,(select rb_from_string('1,2,6,7,8,9,17')));
insert into vtt2 values(1,rb_select(rb_from_string('1,2,6,7,8,9'),6,0,true))  ON DUPLICATE KEY UPDATE id=2,r ='test';
select * from tt2;
+------+---------------------------------+
| id   | r                               |
+------+---------------------------------+
|    1 |                	   
    |
|    1 |                	       |
|    1 |                	       |
|    1 |                	       |
|    2 |                	       |
|    2 |                	       |
|    1 |                	       |
|    1 |                	       |
|    1 |                	        |
+------+---------------------------------+
select * from vtt2;
+------+---------------------------------+
| id   | r                               |
+------+---------------------------------+
|    1 |                	   
    |
|    1 |                	       |
|    1 |                	       |
|    1 |                	       |
|    2 |                	       |
|    2 |                	       |
|    1 |                	       |
|    1 |                	       |
|    1 |                	        |
+------+---------------------------------+
insert into tt2 values(3,rb_from_string('1,2,3'));
update tt2 set r=rb_from_string('1,2,6,7,8,9,18') where id=2;
select * from tt2;
+------+---------------------------------+
| id   | r                               |
+------+---------------------------------+
|    1 |                	   
    |
|    1 |                	       |
|    1 |                	       |
|    1 |                	       |
|    2 |                	       |
|    2 |                	       |
|    1 |                	       |
|    1 |                	       |
|    1 |                	        |
|    3 |                           |
+------+---------------------------------+
insert into vtt2 values(3,rb_from_string('1,2,3'));
update vtt2 set r=rb_from_string('1,2,6,7,8,9,19') where id=3;
select * from vtt2;
+------+---------------------------------+
| id   | r                               |
+------+---------------------------------+
|    1 |                	   
    |
|    1 |                	       |
|    1 |                	       |
|    1 |                	       |
|    2 |                	       |
|    2 |                	       |
|    1 |                	       |
|    1 |                	       |
|    1 |                	        |
|    3 |                	       |
|    3 |                	       |
+------+---------------------------------+
drop table tt2;
create table tt2 (id int,r text);
drop view vtt2;
create view vtt2 as select * from tt2;
insert into tt2 values(1,rb_from_string('1,2,6,7,8,9,10'));
insert into vtt2 values(1,rb_from_string('1,2,6,7,8,9,11'));
insert into tt2 values(1,(select rb_from_string('1,2,6,7,8,9,12')));
insert into vtt2 values(1,(select rb_from_string('1,2,6,7,8,9,13')));
replace into tt2 values(2,rb_from_string('1,2,6,7,8,9,14'));
replace into vtt2 values(2,rb_from_string('1,2,6,7,8,9,15'));
replace into tt2 values(1,(select rb_from_string('1,2,6,7,8,9,16')));
replace into vtt2 values(1,(select rb_from_string('1,2,6,7,8,9,17')));
insert into tt2 values(1,rb_select(rb_from_string('1,2,6,7,8,9'),6,0,true))  ON DUPLICATE KEY UPDATE id=2,r ='test';
select * from tt2;
+------+---------------------------------+
| id   | r                               |
+------+---------------------------------+
|    1 |                	   
    |
|    1 |                	       |
|    1 |                	       |
|    1 |                	       |
|    2 |                	       |
|    2 |                	       |
|    1 |                	       |
|    1 |                	       |
|    1 |                	        |
+------+---------------------------------+
select * from vtt2;
+------+---------------------------------+
| id   | r                               |
+------+---------------------------------+
|    1 |                	   
    |
|    1 |                	       |
|    1 |                	       |
|    1 |                	       |
|    2 |                	       |
|    2 |                	       |
|    1 |                	       |
|    1 |                	       |
|    1 |                	        |
+------+---------------------------------+
insert into tt2 values(3,rb_from_string('1,2,3'));
update tt2 set r=rb_from_string('1,2,6,7,8,9,18') where id=2;
select * from tt2;
+------+---------------------------------+
| id   | r                               |
+------+---------------------------------+
|    1 |                	   
    |
|    1 |                	       |
|    1 |                	       |
|    1 |                	       |
|    2 |                	       |
|    2 |                	       |
|    1 |                	       |
|    1 |                	       |
|    1 |                	        |
|    3 |                           |
+------+---------------------------------+
insert into vtt2 values(3,rb_from_string('1,2,3'));
update vtt2 set r=rb_from_string('1,2,6,7,8,9,19') where id=3;
select * from vtt2;
+------+---------------------------------+
| id   | r                               |
+------+---------------------------------+
|    1 |                	   
    |
|    1 |                	       |
|    1 |                	       |
|    1 |                	       |
|    2 |                	       |
|    2 |                	       |
|    1 |                	       |
|    1 |                	       |
|    1 |                	        |
|    3 |                	       |
|    3 |                	       |
+------+---------------------------------+
drop table tt2;
create table tt2 (id int,r mediumtext);
drop view vtt2;
create view vtt2 as select * from tt2;
insert into tt2 values(1,rb_from_string('1,2,6,7,8,9,10'));
insert into vtt2 values(1,rb_from_string('1,2,6,7,8,9,11'));
insert into tt2 values(1,(select rb_from_string('1,2,6,7,8,9,12')));
insert into vtt2 values(1,(select rb_from_string('1,2,6,7,8,9,13')));
replace into tt2 values(2,rb_from_string('1,2,6,7,8,9,14'));
replace into vtt2 values(2,rb_from_string('1,2,6,7,8,9,15'));
replace into tt2 values(1,(select rb_from_string('1,2,6,7,8,9,16')));
replace into vtt2 values(1,(select rb_from_string('1,2,6,7,8,9,17')));
insert into tt2 values(1,rb_select(rb_from_string('1,2,6,7,8,9'),6,0,true))  ON DUPLICATE KEY UPDATE id=2,r ='test';
select * from tt2;
+------+---------------------------------+
| id   | r                               |
+------+---------------------------------+
|    1 |                	   
    |
|    1 |                	       |
|    1 |                	       |
|    1 |                	       |
|    2 |                	       |
|    2 |                	       |
|    1 |                	       |
|    1 |                	       |
|    1 |                	        |
+------+---------------------------------+
select * from vtt2;
+------+---------------------------------+
| id   | r                               |
+------+---------------------------------+
|    1 |                	   
    |
|    1 |                	       |
|    1 |                	       |
|    1 |                	       |
|    2 |                	       |
|    2 |                	       |
|    1 |                	       |
|    1 |                	       |
|    1 |                	        |
+------+---------------------------------+
insert into tt2 values(3,rb_from_string('1,2,3'));
update tt2 set r=rb_from_string('1,2,6,7,8,9,18') where id=2;
select * from tt2;
+------+---------------------------------+
| id   | r                               |
+------+---------------------------------+
|    1 |                	   
    |
|    1 |                	       |
|    1 |                	       |
|    1 |                	       |
|    2 |                	       |
|    2 |                	       |
|    1 |                	       |
|    1 |                	       |
|    1 |                	        |
|    3 |                           |
+------+---------------------------------+
insert into vtt2 values(3,rb_from_string('1,2,3'));
update vtt2 set r=rb_from_string('1,2,6,7,8,9,19') where id=3;
select * from vtt2;
+------+---------------------------------+
| id   | r                               |
+------+---------------------------------+
|    1 |                	   
    |
|    1 |                	       |
|    1 |                	       |
|    1 |                	       |
|    2 |                	       |
|    2 |                	       |
|    1 |                	       |
|    1 |                	       |
|    1 |                	        |
|    3 |                	       |
|    3 |                	       |
+------+---------------------------------+
drop table tt2;
create table tt2 (id int,r LONGTEXT);
drop view vtt2;
create view vtt2 as select * from tt2;
insert into tt2 values(1,rb_from_string('1,2,6,7,8,9,10'));
insert into vtt2 values(1,rb_from_string('1,2,6,7,8,9,11'));
insert into tt2 values(1,(select rb_from_string('1,2,6,7,8,9,12')));
insert into vtt2 values(1,(select rb_from_string('1,2,6,7,8,9,13')));
replace into tt2 values(2,rb_from_string('1,2,6,7,8,9,14'));
replace into vtt2 values(2,rb_from_string('1,2,6,7,8,9,15'));
replace into tt2 values(1,(select rb_from_string('1,2,6,7,8,9,16')));
replace into vtt2 values(1,(select rb_from_string('1,2,6,7,8,9,17')));
insert into tt2 values(1,rb_select(rb_from_string('1,2,6,7,8,9'),6,0,true))  ON DUPLICATE KEY UPDATE id=2,r ='test';
select * from tt2;
+------+---------------------------------+
| id   | r                               |
+------+---------------------------------+
|    1 |                	   
    |
|    1 |                	       |
|    1 |                	       |
|    1 |                	       |
|    2 |                	       |
|    2 |                	       |
|    1 |                	       |
|    1 |                	       |
|    1 |                	        |
+------+---------------------------------+
select * from vtt2;
+------+---------------------------------+
| id   | r                               |
+------+---------------------------------+
|    1 |                	   
    |
|    1 |                	       |
|    1 |                	       |
|    1 |                	       |
|    2 |                	       |
|    2 |                	       |
|    1 |                	       |
|    1 |                	       |
|    1 |                	        |
+------+---------------------------------+
insert into tt2 values(3,rb_from_string('1,2,3'));
update tt2 set r=rb_from_string('1,2,6,7,8,9,19') where id=2;
select * from tt2;
+------+---------------------------------+
| id   | r                               |
+------+---------------------------------+
|    1 |                	   
    |
|    1 |                	       |
|    1 |                	       |
|    1 |                	       |
|    2 |                	       |
|    2 |                	       |
|    1 |                	       |
|    1 |                	       |
|    1 |                	        |
|    3 |                           |
+------+---------------------------------+
insert into vtt2 values(3,rb_from_string('1,2,3'));
update vtt2 set r=rb_from_string('1,2,6,7,8,9,20') where id=3;
select * from vtt2;
+------+---------------------------------+
| id   | r                               |
+------+---------------------------------+
|    1 |                	   
    |
|    1 |                	       |
|    1 |                	       |
|    1 |                	       |
|    2 |                	       |
|    2 |                	       |
|    1 |                	       |
|    1 |                	       |
|    1 |                	        |
|    3 |                	       |
|    3 |                	       |
+------+---------------------------------+
drop table tt2;
create table tt2 (id int,r tinyblob);
drop view vtt2;
create view vtt2 as select * from tt2;
insert into tt2 values(1,rb_select(rb_from_string('1,2,6,7,8,9,4296967297'),6,0,true));
insert into vtt2 values(1,rb_select(rb_from_string('1,2,6,7,8,9,4296967297'),6,0,true));
insert into tt2 values(1,(select rb_select(rb_from_string('1,2,6,7,8,9,4296967297'),6,0,true)));
insert into vtt2 values(1,(select rb_select(rb_from_string('1,2,6,7,8,9,4296967297'),6,0,true)));
replace into tt2 values(2,rb_select(rb_from_string('1,2,6,7,8,9,4296967297'),6,0,true));
replace into vtt2 values(2,rb_select(rb_from_string('1,2,6,7,8,9,4296967297'),6,0,true));
replace into tt2 values(1,(select rb_select(rb_from_string('1,2,6,7,8,9,4296967297'),6,0,true)));
replace into vtt2 values(1,(select rb_select(rb_from_string('1,2,6,7,8,9,4296967297'),6,0,true)));
insert into tt2 values(1,rb_select(rb_from_string('1,2,6,7,8,9'),6,0,true))  ON DUPLICATE KEY UPDATE id=2,r ='test';
select * from tt2;
+------+-----------------------------------------------------+
| id   | r                                                   |
+------+-----------------------------------------------------+
|    1 |                             	       ÅÑ       |
|    1 |                             	       ÅÑ       |
|    1 |                             	       ÅÑ       |
|    1 |                             	       ÅÑ       |
|    2 |                             	       ÅÑ       |
|    2 |                             	       ÅÑ       |
|    1 |                             	       ÅÑ       |
|    1 |                             	       ÅÑ       |
|    1 |                	                            |
+------+-----------------------------------------------------+
select * from vtt2;
+------+-----------------------------------------------------+
| id   | r                                                   |
+------+-----------------------------------------------------+
|    1 |                             	       ÅÑ       |
|    1 |                             	       ÅÑ       |
|    1 |                             	       ÅÑ       |
|    1 |                             	       ÅÑ       |
|    2 |                             	       ÅÑ       |
|    2 |                             	       ÅÑ       |
|    1 |                             	       ÅÑ       |
|    1 |                             	       ÅÑ       |
|    1 |                	                            |
+------+-----------------------------------------------------+
insert into tt2 values(3,rb_from_string('1,2,3'));
update tt2 set r=rb_select(rb_from_string('1,2,6,7,8,9,4296967297'),6,0,true) where id=2;
select * from tt2;
+------+-----------------------------------------------------+
| id   | r                                                   |
+------+-----------------------------------------------------+
|    1 |                             	       ÅÑ       |
|    1 |                             	       ÅÑ       |
|    1 |                             	       ÅÑ       |
|    1 |                             	       ÅÑ       |
|    2 |                             	       ÅÑ       |
|    2 |                             	       ÅÑ       |
|    1 |                             	       ÅÑ       |
|    1 |                             	       ÅÑ       |
|    1 |                	                            |
|    3 |                                               |
+------+-----------------------------------------------------+
insert into vtt2 values(3,rb_from_string('1,2,3'));
update vtt2 set r=rb_select(rb_from_string('1,2,6,7,8,9,4296967297'),6,0,true) where id=3;
select * from vtt2;
+------+-----------------------------------------------------+
| id   | r                                                   |
+------+-----------------------------------------------------+
|    1 |                             	       ÅÑ       |
|    1 |                             	       ÅÑ       |
|    1 |                             	       ÅÑ       |
|    1 |                             	       ÅÑ       |
|    2 |                             	       ÅÑ       |
|    2 |                             	       ÅÑ       |
|    1 |                             	       ÅÑ       |
|    1 |                             	       ÅÑ       |
|    1 |                	                            |
|    3 |                             	       ÅÑ       |
|    3 |                             	       ÅÑ       |
+------+-----------------------------------------------------+
drop table tt2;
create table tt2 (id int,r mediumblob);
drop view vtt2;
create view vtt2 as select * from tt2;
insert into tt2 values(1,rb_select(rb_from_string('1,2,6,7,8,9,4296967297'),6,0,true));
insert into vtt2 values(1,rb_select(rb_from_string('1,2,6,7,8,9,4296967297'),6,0,true));
insert into tt2 values(1,(select rb_select(rb_from_string('1,2,6,7,8,9,4296967297'),6,0,true)));
insert into vtt2 values(1,(select rb_select(rb_from_string('1,2,6,7,8,9,4296967297'),6,0,true)));
replace into tt2 values(2,rb_select(rb_from_string('1,2,6,7,8,9,4296967297'),6,0,true));
replace into vtt2 values(2,rb_select(rb_from_string('1,2,6,7,8,9,4296967297'),6,0,true));
replace into tt2 values(1,(select rb_select(rb_from_string('1,2,6,7,8,9,4296967297'),6,0,true)));
replace into vtt2 values(1,(select rb_select(rb_from_string('1,2,6,7,8,9,4296967297'),6,0,true)));
insert into tt2 values(1,rb_select(rb_from_string('1,2,6,7,8,9'),6,0,true))  ON DUPLICATE KEY UPDATE id=2,r ='test';
select * from tt2;
+------+-----------------------------------------------------+
| id   | r                                                   |
+------+-----------------------------------------------------+
|    1 |                             	       ÅÑ       |
|    1 |                             	       ÅÑ       |
|    1 |                             	       ÅÑ       |
|    1 |                             	       ÅÑ       |
|    2 |                             	       ÅÑ       |
|    2 |                             	       ÅÑ       |
|    1 |                             	       ÅÑ       |
|    1 |                             	       ÅÑ       |
|    1 |                	                            |
+------+-----------------------------------------------------+
select * from vtt2;
+------+-----------------------------------------------------+
| id   | r                                                   |
+------+-----------------------------------------------------+
|    1 |                             	       ÅÑ       |
|    1 |                             	       ÅÑ       |
|    1 |                             	       ÅÑ       |
|    1 |                             	       ÅÑ       |
|    2 |                             	       ÅÑ       |
|    2 |                             	       ÅÑ       |
|    1 |                             	       ÅÑ       |
|    1 |                             	       ÅÑ       |
|    1 |                	                            |
+------+-----------------------------------------------------+
insert into tt2 values(3,rb_from_string('1,2,3'));
update tt2 set r=rb_select(rb_from_string('1,2,6,7,8,9,4296967297'),6,0,true) where id=2;
select * from tt2;
+------+-----------------------------------------------------+
| id   | r                                                   |
+------+-----------------------------------------------------+
|    1 |                             	       ÅÑ       |
|    1 |                             	       ÅÑ       |
|    1 |                             	       ÅÑ       |
|    1 |                             	       ÅÑ       |
|    2 |                             	       ÅÑ       |
|    2 |                             	       ÅÑ       |
|    1 |                             	       ÅÑ       |
|    1 |                             	       ÅÑ       |
|    1 |                	                            |
|    3 |                                               |
+------+-----------------------------------------------------+
insert into vtt2 values(3,rb_from_string('1,2,3'));
update vtt2 set r=rb_select(rb_from_string('1,2,6,7,8,9,4296967297'),6,0,true) where id=3;
select * from vtt2;
+------+-----------------------------------------------------+
| id   | r                                                   |
+------+-----------------------------------------------------+
|    1 |                             	       ÅÑ       |
|    1 |                             	       ÅÑ       |
|    1 |                             	       ÅÑ       |
|    1 |                             	       ÅÑ       |
|    2 |                             	       ÅÑ       |
|    2 |                             	       ÅÑ       |
|    1 |                             	       ÅÑ       |
|    1 |                             	       ÅÑ       |
|    1 |                	                            |
|    3 |                             	       ÅÑ       |
|    3 |                             	       ÅÑ       |
+------+-----------------------------------------------------+
drop table tt2;
create table tt2 (id int,r longblob);
drop view vtt2;
create view vtt2 as select * from tt2;
insert into tt2 values(1,rb_select(rb_from_string('1,2,6,7,8,9,4296967297'),6,0,true));
insert into vtt2 values(1,rb_select(rb_from_string('1,2,6,7,8,9,4296967297'),6,0,true));
insert into tt2 values(1,(select rb_select(rb_from_string('1,2,6,7,8,9,4296967297'),6,0,true)));
insert into vtt2 values(1,(select rb_select(rb_from_string('1,2,6,7,8,9,4296967297'),6,0,true)));
replace into tt2 values(2,rb_select(rb_from_string('1,2,6,7,8,9,4296967297'),6,0,true));
replace into vtt2 values(2,rb_select(rb_from_string('1,2,6,7,8,9,4296967297'),6,0,true));
replace into tt2 values(1,(select rb_select(rb_from_string('1,2,6,7,8,9,4296967297'),6,0,true)));
replace into vtt2 values(1,(select rb_select(rb_from_string('1,2,6,7,8,9,4296967297'),6,0,true)));
insert into tt2 values(1,rb_select(rb_from_string('1,2,6,7,8,9'),6,0,true))  ON DUPLICATE KEY UPDATE id=2,r ='test';
select * from tt2;
+------+-----------------------------------------------------+
| id   | r                                                   |
+------+-----------------------------------------------------+
|    1 |                             	       ÅÑ       |
|    1 |                             	       ÅÑ       |
|    1 |                             	       ÅÑ       |
|    1 |                             	       ÅÑ       |
|    2 |                             	       ÅÑ       |
|    2 |                             	       ÅÑ       |
|    1 |                             	       ÅÑ       |
|    1 |                             	       ÅÑ       |
|    1 |                	                            |
+------+-----------------------------------------------------+
select * from vtt2;
+------+-----------------------------------------------------+
| id   | r                                                   |
+------+-----------------------------------------------------+
|    1 |                             	       ÅÑ       |
|    1 |                             	       ÅÑ       |
|    1 |                             	       ÅÑ       |
|    1 |                             	       ÅÑ       |
|    2 |                             	       ÅÑ       |
|    2 |                             	       ÅÑ       |
|    1 |                             	       ÅÑ       |
|    1 |                             	       ÅÑ       |
|    1 |                	                            |
+------+-----------------------------------------------------+
insert into tt2 values(3,rb_from_string('1,2,3'));
update tt2 set r=rb_select(rb_from_string('1,2,6,7,8,9,4296967297'),6,0,true) where id=2;
select * from tt2;
+------+-----------------------------------------------------+
| id   | r                                                   |
+------+-----------------------------------------------------+
|    1 |                             	       ÅÑ       |
|    1 |                             	       ÅÑ       |
|    1 |                             	       ÅÑ       |
|    1 |                             	       ÅÑ       |
|    2 |                             	       ÅÑ       |
|    2 |                             	       ÅÑ       |
|    1 |                             	       ÅÑ       |
|    1 |                             	       ÅÑ       |
|    1 |                	                            |
|    3 |                                               |
+------+-----------------------------------------------------+
insert into vtt2 values(3,rb_from_string('1,2,3'));
update vtt2 set r=rb_select(rb_from_string('1,2,6,7,8,9,4296967297'),6,0,true) where id=3;
select * from vtt2;
+------+-----------------------------------------------------+
| id   | r                                                   |
+------+-----------------------------------------------------+
|    1 |                             	       ÅÑ       |
|    1 |                             	       ÅÑ       |
|    1 |                             	       ÅÑ       |
|    1 |                             	       ÅÑ       |
|    2 |                             	       ÅÑ       |
|    2 |                             	       ÅÑ       |
|    1 |                             	       ÅÑ       |
|    1 |                             	       ÅÑ       |
|    1 |                	                            |
|    3 |                             	       ÅÑ       |
|    3 |                             	       ÅÑ       |
+------+-----------------------------------------------------+
drop table tt2;
create table tt2 (id int,r geometry);
drop view vtt2;
create view vtt2 as select * from tt2;
insert into tt2 values(1,rb_select(rb_from_string('1,2,6,7,8,9,4296967297'),6,0,true));
ERROR 0A000: type casting not supported
replace into tt2 values(1,(select rb_select(rb_from_string('1,2,6,7,8,9,4296967297'),6,0,true)));
ERROR 0A000: type casting not supported
replace into vtt2 values(1,rb_select(rb_from_string('1,2,6,7,8,9,4296967297'),6,0,true));
ERROR 0A000: type casting not supported
insert into vtt2 values(1,(select rb_select(rb_from_string('1,2,6,7,8,9,4296967297'),6,0,true)));
ERROR 0A000: type casting not supported
insert into tt2 values(3,rb_from_string('1,2,3'));
ERROR 0A000: type casting not supported
update tt2 set r=rb_select(rb_from_string('1,2,6,7,8,9,4296967297'),6,0,true) where id=2;
ERROR 22000: Invalid data type for the operation
select * from tt2;
+------+------+
| id   | r    |
+------+------+
+------+------+
insert into vtt2 values(3,rb_from_string('1,2,3'));
ERROR 0A000: type casting not supported
update vtt2 set r=rb_select(rb_from_string('1,2,6,7,8,9,4296967297'),6,0,true) where id=3;
ERROR 22000: Invalid data type for the operation
select * from vtt2;
+------+------+
| id   | r    |
+------+------+
+------+------+
drop table tt2;
create table tt2 (id int,r json);
drop view vtt2;
create view vtt2 as select * from tt2;
insert into tt2 values(1,rb_select(rb_from_string('1,2,6,7,8,9,4296967297'),6,0,true));
ERROR 0A000: type casting not supported
replace into tt2 values(1,(select rb_select(rb_from_string('1,2,6,7,8,9,4296967297'),6,0,true)));
ERROR 0A000: type casting not supported
replace into vtt2 values(1,rb_select(rb_from_string('1,2,6,7,8,9,4296967297'),6,0,true));
ERROR 0A000: type casting not supported
insert into vtt2 values(1,(select rb_select(rb_from_string('1,2,6,7,8,9,4296967297'),6,0,true)));
ERROR 0A000: type casting not supported
insert into tt2 values(3,rb_from_string('1,2,3'));
ERROR 0A000: type casting not supported
update tt2 set r=rb_select(rb_from_string('1,2,6,7,8,9,4296967297'),6,0,true) where id=2;
ERROR 22000: Invalid data type for the operation
select * from tt2;
+------+------+
| id   | r    |
+------+------+
+------+------+
insert into vtt2 values(3,rb_from_string('1,2,3'));
ERROR 0A000: type casting not supported
update vtt2 set r=rb_select(rb_from_string('1,2,6,7,8,9,4296967297'),6,0,true) where id=3;
ERROR 22000: Invalid data type for the operation
select * from vtt2;
+------+------+
| id   | r    |
+------+------+
+------+------+
drop table tt2;
create table tt2 (id int,r int);
drop view vtt2;
create view vtt2 as select * from tt2;
insert into tt2 values(1,rb_select(rb_from_string('1,2,6,7,8,9,4296967297'),6,0,true));
ERROR 0A000: type casting not supported
replace into tt2 values(1,(select rb_select(rb_from_string('1,2,6,7,8,9,4296967297'),6,0,true)));
ERROR 0A000: type casting not supported
replace into vtt2 values(1,rb_select(rb_from_string('1,2,6,7,8,9,4296967297'),6,0,true));
ERROR 0A000: type casting not supported
insert into vtt2 values(1,(select rb_select(rb_from_string('1,2,6,7,8,9,4296967297'),6,0,true)));
ERROR 0A000: type casting not supported
drop table tt2;
create table tt2 (id int,r date);
drop view vtt2;
create view vtt2 as select * from tt2;
insert into tt2 values(1,rb_select(rb_from_string('1,2,6,7,8,9,4296967297'),6,0,true));
ERROR 0A000: type casting not supported
replace into tt2 values(1,(select rb_select(rb_from_string('1,2,6,7,8,9,4296967297'),6,0,true)));
ERROR 0A000: type casting not supported
replace into vtt2 values(1,rb_select(rb_from_string('1,2,6,7,8,9,4296967297'),6,0,true));
ERROR 0A000: type casting not supported
insert into vtt2 values(1,(select rb_select(rb_from_string('1,2,6,7,8,9,4296967297'),6,0,true)));
ERROR 0A000: type casting not supported
drop table tt2;
create table tt2 (id int,r set(0x0100,0x0101));
drop view vtt2;
create view vtt2 as select * from tt2;
insert into tt2 values(1,rb_select(rb_from_string('1,2,6,7,8,9,4296967297'),6,0,true));
ERROR 0A000: cast to enum or set type not supported
replace into tt2 values(1,(select rb_select(rb_from_string('1,2,6,7,8,9,4296967297'),6,0,true)));
ERROR 0A000: cast to enum or set type not supported
replace into vtt2 values(1,rb_select(rb_from_string('1,2,6,7,8,9,4296967297'),6,0,true));
ERROR 0A000: cast to enum or set type not supported
insert into vtt2 values(1,(select rb_select(rb_from_string('1,2,6,7,8,9,4296967297'),6,0,true)));
ERROR 0A000: cast to enum or set type not supported
drop table tt2;
create table tt2 (id int,r ENUM(0x0100,0x0101));
drop view vtt2;
create view vtt2 as select * from tt2;
insert into tt2 values(1,rb_select(rb_from_string('1,2,6,7,8,9,4296967297'),6,0,true));
ERROR 0A000: cast to enum or set type not supported
replace into tt2 values(1,(select rb_select(rb_from_string('1,2,6,7,8,9,4296967297'),6,0,true)));
ERROR 0A000: cast to enum or set type not supported
replace into vtt2 values(1,rb_select(rb_from_string('1,2,6,7,8,9,4296967297'),6,0,true));
ERROR 0A000: cast to enum or set type not supported
insert into vtt2 values(1,(select rb_select(rb_from_string('1,2,6,7,8,9,4296967297'),6,0,true)));
ERROR 0A000: cast to enum or set type not supported
drop table tt2;
create table tt2(id int,r roaringbitmap);
drop view vtt2;
create view vtt2 as select * from tt2;
insert into tt2 select 2,rb_select(rb_from_string('1,2,6,7,8,9,4296967297'),6,0,true);
replace into vtt2 select 3,rb_select(rb_from_string('1,2,6,7,8,9,4296967297'),6,0,true);
select * from tt2;
+------+-----------------------------------------------------+
| id   | r                                                   |
+------+-----------------------------------------------------+
|    2 |                             	       ÅÑ       |
|    3 |                             	       ÅÑ       |
+------+-----------------------------------------------------+
drop table tt2;
create table tt2(id int,r roaringbitmap);
drop view vtt2;
create view vtt2 as select * from tt2;
insert into vtt2 select id,r from tt1;
update tt2 set r=rb_select(rb_from_string('1,2,6,7,8,9,4296967297'),6,0,true) where id=2;
update vtt2 set r=rb_select(rb_from_string('1,2,6,7,8,9,4296967297'),6,0,true) where id=3;
select * from tt2;
+------+-------------------------------------------------------------------------------------------------------------------------------------------------------------------------------------------------------------------------------------------------------------+
| id   | r                                                                                                                                                                                                                                                           |
+------+-------------------------------------------------------------------------------------------------------------------------------------------------------------------------------------------------------------------------------------------------------------+
|    0 |                                                                                                                                                                                                                                                            |
|    1 |                                                                                                                                                                                                                                                          |
|    2 |                             	       ÅÑ                                                                                                                                                                                                               |
|    3 |                             	       ÅÑ                                                                                                                                                                                                               |
|    3 |                             	       ÅÑ                                                                                                                                                                                                               |
|    4 |                                                                                                                                                                                                                                                   |
|    5 |            :0                    	 
                        !                                                                                                                                                             |
|    5 |            :0             V           	 
                                                                                                                                                                             |
|    6 |            :0                   	 
                         :0                                                                                                                                                     |
|    6 | @&T    ‰T   ‘ˇˇˇ	   	   
   N     Û       ö;   ê      ^–≤   +      Ú*   '     ˇ=    œ     ø∆-    »      Ñ    êÂT   Á     ê&ˇˇ	   d      ?B           /u                        (kÓ      
      
   ª                              |
|    7 |            ;0    '   '                                                                                                                                                                                                                               |
|    8 | ˇ˛   ˇ  ˇ  ˇ  ˇ  ˇ  ˇ  ˇ  ˇ  ˇ  	ˇ  
ˇ  ˇ  ˇ  ˇ  ˇ                                                                                                                                                                                                            |
+------+-------------------------------------------------------------------------------------------------------------------------------------------------------------------------------------------------------------------------------------------------------------+
update tt2 set r=rb_select(rb_from_string('1,2,6,7,8,9,4296967297'),6,0,true) where rb_select(rb_from_string('1,2,6,7,8,9,4296967297'),6,0,true)=2;
ERROR 22000: Invalid data type for the operation
update tt2 set r=rb_select(rb_from_string('1,2,6,7,8,9,4296967297'),6,0,true) where rb_select(rb_from_string('1,2,6,7,8,9,4296967297'),6,0,true)=rb_select(rb_from_string('1,2,6,7,8,9,4296967297'),6,0,true);
ERROR 22000: Invalid data type for the operation
update vtt2 set r=rb_from_string('1');
select * from vtt2;
+------+--------+
| id   | r      |
+------+--------+
|    0 |     |
|    1 |     |
|    2 |     |
|    3 |     |
|    3 |     |
|    4 |     |
|    5 |     |
|    5 |     |
|    6 |     |
|    6 |     |
|    7 |     |
|    8 |     |
+------+--------+
update tt2 inner join tt1 on tt2.id=tt1.id set tt2.r =rb_select(rb_from_string('1,2,6,7,8,9,4296967297'),6,0,true);
update tt2 inner join tt1 on tt2.r=rb_select(rb_from_string('1,2,6,7,8,9,4296967297'),6,0,true) set tt2.id =10;
ERROR 22000: Invalid data type for the operation
select * from tt2;
+------+-----------------------------------------------------+
| id   | r                                                   |
+------+-----------------------------------------------------+
|    0 |                             	       ÅÑ       |
|    1 |                             	       ÅÑ       |
|    2 |                             	       ÅÑ       |
|    3 |                             	       ÅÑ       |
|    3 |                             	       ÅÑ       |
|    4 |                             	       ÅÑ       |
|    5 |                             	       ÅÑ       |
|    5 |                             	       ÅÑ       |
|    6 |                             	       ÅÑ       |
|    6 |                             	       ÅÑ       |
|    7 |                             	       ÅÑ       |
|    8 |                             	       ÅÑ       |
+------+-----------------------------------------------------+
drop table tt3;
create table tt3 as select rb_select(rb_from_string('1,2,3,4,5,6,7,8,9,10,11,12,13,14,15,16,17,18,19,20,21,22,23,24,25,26,27,28,29,30,31,4294967296,4294967295'),32) a;
desc tt3;
+-------+---------------+------+-----+---------+-------+
| Field | Type          | Null | Key | Default | Extra |
+-------+---------------+------+-----+---------+-------+
| a     | roaringbitmap | YES  |     | NULL    |       |
+-------+---------------+------+-----+---------+-------+
show create table tt3;
Table	Create Table
tt3	CREATE TABLE `tt3` (
  `a` roaringbitmap DEFAULT NULL
) ORGANIZATION INDEX DEFAULT CHARSET = gbk ROW_FORMAT = DYNAMIC COMPRESSION = 'zstd_1.3.8' REPLICA_NUM = 1 BLOCK_SIZE = 16384 USE_BLOOM_FILTER = FALSE ENABLE_MACRO_BLOCK_BLOOM_FILTER = FALSE TABLET_SIZE = 134217728 PCTFREE = 0 LOB_INROW_THRESHOLD=0
insert into tt3 values((select rb_select(rb_from_string('1,2,3,4,5,6,7,8,9,10,11,12,13,14,15,16,17,18,19,20,21,22,23,24,25,26,27,28,29,30,31,4294967294,4294967295'),33)));
select * from tt3;
+-------------------------------------------------------------------------------------------------------------------------------------+
| a                                                                                                                                   |
+-------------------------------------------------------------------------------------------------------------------------------------+
|                          	   
                                                                  ˇˇˇˇ     |
|            :0        ˇˇ    V           	 
                      ˛ˇˇˇ                                  |
+-------------------------------------------------------------------------------------------------------------------------------------+
drop table tt3;
create table tt3 as select rb_select(r,33) r from tt1;
desc tt3;
+-------+---------------+------+-----+---------+-------+
| Field | Type          | Null | Key | Default | Extra |
+-------+---------------+------+-----+---------+-------+
| r     | roaringbitmap | YES  |     | NULL    |       |
+-------+---------------+------+-----+---------+-------+
show create table tt3;
Table	Create Table
tt3	CREATE TABLE `tt3` (
  `r` roaringbitmap DEFAULT NULL
) ORGANIZATION INDEX DEFAULT CHARSET = gbk ROW_FORMAT = DYNAMIC COMPRESSION = 'zstd_1.3.8' REPLICA_NUM = 1 BLOCK_SIZE = 16384 USE_BLOOM_FILTER = FALSE ENABLE_MACRO_BLOCK_BLOOM_FILTER = FALSE TABLET_SIZE = 134217728 PCTFREE = 0 LOB_INROW_THRESHOLD=0
insert into tt3 values((select rb_select(rb_from_string('1,2,3,4,5,6,7,8,9,10,11,12,13,14,15,16,17,18,19,20,21,22,23,24,25,26,27,28,29,30,31,4294967296,4294967295'),30)));
replace into tt3 values((select rb_from_string('1,2,3,4,5,6,7,8,9,10,11,12,13,14,15,16,17,18,19,20,21,22,23,24,25,26,27,28,29,30,31,4294967296,4294967295')));
update tt3 set r=rb_select(rb_from_string('1,2,4294967296,4294967295'),3,0,true);
select * from tt3;
+-----------------------------+
| r                           |
+-----------------------------+
|        ˇˇˇˇ                |
|        ˇˇˇˇ                |
|        ˇˇˇˇ                |
|        ˇˇˇˇ                |
|        ˇˇˇˇ                |
|        ˇˇˇˇ                |
|        ˇˇˇˇ                |
|        ˇˇˇˇ                |
|        ˇˇˇˇ                |
|        ˇˇˇˇ                |
|        ˇˇˇˇ                |
|        ˇˇˇˇ                |
|        ˇˇˇˇ                |
|        ˇˇˇˇ                |
+-----------------------------+
delete from tt3;
drop view vtt3;
create view vtt3 as select rb_select(r,33) r from tt1;
select * from vtt3;
+-------------------------------------------------------------------------------------------------------------------------------------------------------------------------------------------------------------------------------------------------------------+
| r                                                                                                                                                                                                                                                           |
+-------------------------------------------------------------------------------------------------------------------------------------------------------------------------------------------------------------------------------------------------------------+
|                                                                                                                                                                                                                                                            |
|                                                                                                                                                                                                                                                          |
|                                                                                                                                                                                                                                                          |
|                	                                                                                                                                                                                                                                    |
|                	                                                                                                                                                                                                                                    |
|                                                                                                                                                                                                                                                   |
|            :0                    	 
                        !                                                                                                                                                             |
|            :0             V           	 
                                                                                                                                                                             |
|            :0                   	 
                         :0                                                                                                                                                     |
| @&T    ‰T   	   
   ‘ˇˇˇ	   N     Û       ö;   ê      ^–≤    Ú*   +     '     ˇ=    œ     ø∆-    »      êÂT   Ñ    Á     ê&ˇˇ	   d      ?B           /u                        (kÓ      
      
   ª                              |
|            :0                      	 
                                                                                                                                                                                    |
| ˇ˛   ˇ  ˇ  ˇ  ˇ  ˇ  ˇ  ˇ  ˇ  ˇ  	ˇ  
ˇ  ˇ  ˇ  ˇ  ˇ                                                                                                                                                                                                            |
+-------------------------------------------------------------------------------------------------------------------------------------------------------------------------------------------------------------------------------------------------------------+
desc vtt3;
+-------+---------------+------+-----+---------+-------+
| Field | Type          | Null | Key | Default | Extra |
+-------+---------------+------+-----+---------+-------+
| r     | roaringbitmap | YES  |     | NULL    |       |
+-------+---------------+------+-----+---------+-------+
drop table tt3;
create table tt3(id int, r roaringbitmap as (rb_select(rb_from_string('1,2,3,4,5,6,7,8,9,10,11,12,13,14,15,16,17,18,19,20,21,22,23,24,25,26,27,28,29,30,31,32,4294967296,4294967295'),33)) STORED);
desc tt3;
+-------+---------------+------+-----+----------------------------------------------------------------------------------------------------------------------------------------------+------------------+
| Field | Type          | Null | Key | Default                                                                                                                                      | Extra            |
+-------+---------------+------+-----+----------------------------------------------------------------------------------------------------------------------------------------------+------------------+
| id    | int(11)       | YES  |     | NULL                                                                                                                                         |                  |
| r     | roaringbitmap | YES  |     | rb_select(rb_from_string('1,2,3,4,5,6,7,8,9,10,11,12,13,14,15,16,17,18,19,20,21,22,23,24,25,26,27,28,29,30,31,32,4294967296,4294967295'),33) | STORED GENERATED |
+-------+---------------+------+-----+----------------------------------------------------------------------------------------------------------------------------------------------+------------------+
insert into  tt3(id) values(1);
select * from tt3;
+------+----------------------------------------------------------------------------------------------------------+
| id   | r                                                                                                        |
+------+----------------------------------------------------------------------------------------------------------+
|    1 |            :0        ˇˇ     X           	 
                        ˇˇ     |
+------+----------------------------------------------------------------------------------------------------------+
delete from tt3;
insert into  tt3(id) values(1);
truncate tt3;
select * from tt3;
+------+------+
| id   | r    |
+------+------+
+------+------+
drop table tt3;
create table tt3(id int, r roaringbitmap as (rb_select(rb_from_string('1,2,3,4,5,6,7,8,9,10,11,12,13,14,15,16,17,18,19,20,21,22,23,24,25,26,27,28,29,30,31,32,4294967296,4294967295'),30)) VIRTUAL);
desc tt3;
+-------+---------------+------+-----+----------------------------------------------------------------------------------------------------------------------------------------------+-------------------+
| Field | Type          | Null | Key | Default                                                                                                                                      | Extra             |
+-------+---------------+------+-----+----------------------------------------------------------------------------------------------------------------------------------------------+-------------------+
| id    | int(11)       | YES  |     | NULL                                                                                                                                         |                   |
| r     | roaringbitmap | YES  |     | rb_select(rb_from_string('1,2,3,4,5,6,7,8,9,10,11,12,13,14,15,16,17,18,19,20,21,22,23,24,25,26,27,28,29,30,31,32,4294967296,4294967295'),30) | VIRTUAL GENERATED |
+-------+---------------+------+-----+----------------------------------------------------------------------------------------------------------------------------------------------+-------------------+
insert into  tt3(id) values(1);
select * from tt3;
+------+-----------------------------------------------------------------------------------------------------------------------------+
| id   | r                                                                                                                           |
+------+-----------------------------------------------------------------------------------------------------------------------------+
|    1 |                         	   
                                                                |
+------+-----------------------------------------------------------------------------------------------------------------------------+
drop table tt3;
create table tt3(id int);
ALTER TABLE tt3
ADD COLUMN r roaringbitmap AS (rb_select(rb_from_string('1,2,3,4,5,6,7,8,9,10,11,12,13,14,15,16,17,18,19,20,21,22,23,24,25,26,27,28,29,30,31,32,4294967296,4294967295'),30)) STORED;
desc tt3;
+-------+---------------+------+-----+----------------------------------------------------------------------------------------------------------------------------------------------+------------------+
| Field | Type          | Null | Key | Default                                                                                                                                      | Extra            |
+-------+---------------+------+-----+----------------------------------------------------------------------------------------------------------------------------------------------+------------------+
| id    | int(11)       | YES  |     | NULL                                                                                                                                         |                  |
| r     | roaringbitmap | YES  |     | rb_select(rb_from_string('1,2,3,4,5,6,7,8,9,10,11,12,13,14,15,16,17,18,19,20,21,22,23,24,25,26,27,28,29,30,31,32,4294967296,4294967295'),30) | STORED GENERATED |
+-------+---------------+------+-----+----------------------------------------------------------------------------------------------------------------------------------------------+------------------+
insert into  tt3(id) values(1);
select * from tt3;
+------+-----------------------------------------------------------------------------------------------------------------------------+
| id   | r                                                                                                                           |
+------+-----------------------------------------------------------------------------------------------------------------------------+
|    1 |                         	   
                                                                |
+------+-----------------------------------------------------------------------------------------------------------------------------+
delete from tt3;
insert into  tt3(id) values(1);
truncate tt3;
select * from tt3;
+------+------+
| id   | r    |
+------+------+
+------+------+
drop table tt3;
create table tt3(id int);
ALTER TABLE tt3
ADD COLUMN r roaringbitmap AS (rb_select(rb_from_string('1,2,3,4,5,6,7,8,9,10,11,12,13,14,15,16,17,18,19,20,21,22,23,24,25,26,27,28,29,30,31,32,4294967296,4294967295'),33)) VIRTUAL;
desc tt3;
+-------+---------------+------+-----+----------------------------------------------------------------------------------------------------------------------------------------------+-------------------+
| Field | Type          | Null | Key | Default                                                                                                                                      | Extra             |
+-------+---------------+------+-----+----------------------------------------------------------------------------------------------------------------------------------------------+-------------------+
| id    | int(11)       | YES  |     | NULL                                                                                                                                         |                   |
| r     | roaringbitmap | YES  |     | rb_select(rb_from_string('1,2,3,4,5,6,7,8,9,10,11,12,13,14,15,16,17,18,19,20,21,22,23,24,25,26,27,28,29,30,31,32,4294967296,4294967295'),33) | VIRTUAL GENERATED |
+-------+---------------+------+-----+----------------------------------------------------------------------------------------------------------------------------------------------+-------------------+
insert into  tt3(id) values(1);
select * from tt3;
+------+----------------------------------------------------------------------------------------------------------+
| id   | r                                                                                                        |
+------+----------------------------------------------------------------------------------------------------------+
|    1 |            :0        ˇˇ     X           	 
                        ˇˇ     |
+------+----------------------------------------------------------------------------------------------------------+
delete from tt3;
insert into  tt3(id) values(1);
truncate tt3;
select * from tt3;
+------+------+
| id   | r    |
+------+------+
+------+------+
drop table tt2;
create table tt2(id int,a varchar(50),r roaringbitmap, INDEX index_1((rb_select(rb_from_string('1,2'),1))));
ERROR 42000: The used storage engine can't index column 'SYS_NC19$'
drop table tt2;
create table tt2(id int,a varchar(50),r roaringbitmap);
CREATE INDEX index_1 ON tt2 ((rb_select(rb_from_string('1,2'),1)));
ERROR 42000: The used storage engine can't index column 'SYS_NC19$'
alter table tt2 add index index_1((rb_select(rb_from_string('1,2'),1)));
ERROR 42000: The used storage engine can't index column 'SYS_NC19$'
select count(rb_select(r,33)) from tt1;
+------------------------+
| count(rb_select(r,33)) |
+------------------------+
|                     12 |
+------------------------+
select sum(rb_select(r,33)) from tt1;
ERROR HY000: Invalid argument
select min(rb_select(r,33)) from tt1;
ERROR HY000: Invalid argument
select max(rb_select(r,33)) from tt1;
ERROR HY000: Invalid argument
select avg(rb_select(r,33)) from tt1;
ERROR HY000: Invalid argument
select avg(rb_select(r,33)) from tt1;
ERROR HY000: Invalid argument
select sum(rb_select(r,33)) from tt1;
ERROR HY000: Invalid argument
select min(rb_select(r,33)) from tt1;
ERROR HY000: Invalid argument
select max(rb_select(r,33)) from tt1;
ERROR HY000: Invalid argument
select max(rb_select(rb_from_string('1,2,3,4'),3,0,true));
ERROR HY000: Invalid argument
select min(rb_select(rb_build_varbinary(0x01030401000000020000000300000004000000),3));
ERROR HY000: Invalid argument
########Ê∏ÖÁ©∫ÂõûÊî∂Á´ôÔºåÂà†Èô§ÊµãËØïÊï∞ÊçÆÂ∫ìÔºåË°®Á≠â ##########
drop database  IF EXISTS  oblrp;
purge recyclebin;
