--echo #Environmental cleaning
drop user lina@'%';
create user lina identified by 'lina';
grant all on *.* to lina WITH GRANT OPTION;
DROP TABLE t1;
DROP TABLE t2;
DROP TABLE t3;
CREATE TABLE t1(id int,consumer char(20), brand varchar(20),sal int);
INSERT INTO t1 VALUES(1,'苹果','apple',5000);
INSERT INTO t1 VALUES(2,'小米','xiaomi',4000);
INSERT INTO t1 VALUES(3,'OPPO','oppo',3000);
INSERT INTO t1 VALUES(4,'华为','huawei',6000);
CREATE TABLE t2(id int,model varchar(200),price int);
INSERT INTO t2 VALUES(1,'apple 12',6500);
INSERT INTO t2 VALUES(2,'xiaomi 9',5000);
INSERT INTO t2 VALUES(3,'oppo findx',6000);
INSERT INTO t2 VALUES(4,'huawei mata30',8000);
obmysql-rpad-3
obmysql-rpad-3-1
#SELECT
SELECT rpad(e.id,20,e.sal) FROM t1 e;
rpad(e.id,20,e.sal)
15000500050005000500
24000400040004000400
33000300030003000300
46000600060006000600
SELECT rpad(e.consumer,e.id,e.brand) FROM t1 e;
rpad(e.consumer,e.id,e.brand)
苹
小米
OPP
华为hu
SELECT rpad(e.sal,20,p.price) money,rpad(e.brand,20,p.model) model FROM t1 e LEFT JOIN t2 p ON e.id = p.id ORDER BY e.id DESC;
money	model
60008000800080008000	huaweihuawei mata30h
30006000600060006000	oppooppo findxoppo f
40005000500050005000	xiaomixiaomi 9xiaomi
50006500650065006500	appleapple 12apple 1
SELECT rpad(e.sal,20,p.price) money,rpad(e.brand,20,p.model) model FROM t1 e RIGHT JOIN t2 p ON e.id = p.id ORDER BY e.id DESC;
money	model
60008000800080008000	huaweihuawei mata30h
30006000600060006000	oppooppo findxoppo f
40005000500050005000	xiaomixiaomi 9xiaomi
50006500650065006500	appleapple 12apple 1
SELECT rpad(e.sal,20,p.price) money,rpad(e.brand,20,p.model) model FROM t1 e INNER JOIN t2 p ON e.id = p.id ORDER BY e.id DESC;
money	model
60008000800080008000	huaweihuawei mata30h
30006000600060006000	oppooppo findxoppo f
40005000500050005000	xiaomixiaomi 9xiaomi
50006500650065006500	appleapple 12apple 1
SELECT * FROM (SELECT e.id,rpad(e.sal,20,p.price) price,rpad(e.brand,20,p.model)model FROM t1 e LEFT JOIN t2 p ON e.id = p.id ) e ORDER BY e.id;
id	price	model
1	50006500650065006500	appleapple 12apple 1
2	40005000500050005000	xiaomixiaomi 9xiaomi
3	30006000600060006000	oppooppo findxoppo f
4	60008000800080008000	huaweihuawei mata30h
#ANY
SELECT *  FROM t1 e WHERE rpad(e.id,20,e.sal) = ANY (SELECT rpad(p.id,20,p.price) FROM t2 p ) ORDER BY e.id;
id	consumer	brand	sal
SELECT *  FROM t1 e WHERE rpad(e.id,20,e.sal) < ANY (SELECT rpad(p.id,20,p.price) FROM t2 p) ORDER BY e.id;
id	consumer	brand	sal
1	苹果	apple	5000
2	小米	xiaomi	4000
3	OPPO	oppo	3000
4	华为	huawei	6000
SELECT *  FROM t1 e WHERE rpad(e.consumer,20,e.sal) > ANY (SELECT rpad(p.model,20,p.price) FROM t2 p) ORDER BY e.id;
id	consumer	brand	sal
1	苹果	apple	5000
2	小米	xiaomi	4000
3	OPPO	oppo	3000
4	华为	huawei	6000
#ALL 
SELECT *  FROM t1 e WHERE rpad(e.id,20,e.sal) < ALL (SELECT rpad(p.id,20,p.price) FROM t2 p) ORDER BY e.id;
id	consumer	brand	sal
1	苹果	apple	5000
SELECT *  FROM t1 e WHERE rpad(e.consumer,20,e.sal) > ALL (SELECT rpad(p.model,20,p.price) FROM t2 p) ORDER BY e.id;
id	consumer	brand	sal
1	苹果	apple	5000
2	小米	xiaomi	4000
4	华为	huawei	6000
SELECT *  FROM t1 e WHERE rpad(e.id,20,e.sal) = ALL (SELECT rpad(p.id,20,p.price) FROM t2 p WHERE p.model = 'oppo findx') ORDER BY e.id;
id	consumer	brand	sal
#EXISTS AND NOT EXISTS
SELECT *  FROM t1 e WHERE EXISTS (SELECT rpad(p.id,20,p.price) FROM t2 p ) ORDER BY e.id;
id	consumer	brand	sal
1	苹果	apple	5000
2	小米	xiaomi	4000
3	OPPO	oppo	3000
4	华为	huawei	6000
SELECT *  FROM t1 e WHERE EXISTS (SELECT rpad(p.model,20,p.price) FROM t2 p) ORDER BY e.id;
id	consumer	brand	sal
1	苹果	apple	5000
2	小米	xiaomi	4000
3	OPPO	oppo	3000
4	华为	huawei	6000
SELECT *  FROM t1 e WHERE EXISTS (SELECT rpad(p.model,p.id,p.price) FROM t2 p) ORDER BY e.id;
id	consumer	brand	sal
1	苹果	apple	5000
2	小米	xiaomi	4000
3	OPPO	oppo	3000
4	华为	huawei	6000
SELECT rpad(e.consumer,20,e.sal)  FROM t1 e WHERE NOT EXISTS (SELECT p.id,p.price FROM t2 p WHERE rpad(p.id,20,p.price) = 7500 ) ORDER BY e.id;
rpad(e.consumer,20,e.sal)
苹果500050005000500050
小米400040004000400040
OPPO3000300030003000
华为600060006000600060
SELECT rpad(e.consumer,20,e.sal)  FROM t1 e WHERE NOT EXISTS (SELECT p.id,p.price FROM t2 p WHERE rpad(p.model,20,p.price) like '%apple 12%' ) ORDER BY e.id;
rpad(e.consumer,20,e.sal)
SELECT rpad(e.consumer,20,e.sal)  FROM t1 e WHERE NOT EXISTS (SELECT p.id,p.price FROM t2 p WHERE rpad(p.model,20,p.price) like '%apple 12%' ) ORDER BY e.id;
rpad(e.consumer,20,e.sal)
#CREATE AS 
CREATE TABLE t3 AS SELECT rpad(e.consumer,20,e.brand)  FROM t1 e WHERE rpad(e.id,20,e.sal) like '%6000%';
select * from t3;
rpad(e.consumer,20,e.brand)
华为huaweihuaweihuawei
drop table t3;
CREATE TABLE t3 AS SELECT rpad(e.consumer,20,e.brand) name  FROM t1 e WHERE rpad(e.id,20,e.sal) like '%6000%';
SELECT *  FROM t3;
name
华为huaweihuaweihuawei
#LIKE 
SELECT rpad(e.brand,20,e.consumer) FROM t1 e WHERE rpad(e.brand,20,e.consumer) LIKE '%米%';
rpad(e.brand,20,e.consumer)
xiaomi小米小米小米小米小米小米小米
SELECT rpad(e.sal,20,p.price) FROM t1 e LEFT JOIN t2 p ON e.id = p.id WHERE rpad(e.sal,20,p.price) LIKE '%00%';
rpad(e.sal,20,p.price)
50006500650065006500
40005000500050005000
30006000600060006000
60008000800080008000
#WHERE
SELECT * FROM t1 e WHERE rpad(e.consumer,20,e.brand) like '%苹果%';
id	consumer	brand	sal
1	苹果	apple	5000
SELECT * FROM t1 e WHERE rpad(e.consumer,20,e.brand) like '%小米%';
id	consumer	brand	sal
2	小米	xiaomi	4000
SELECT * FROM t1 e WHERE rpad(e.id,20,e.sal) > 4000 ORDER BY e.id;
id	consumer	brand	sal
1	苹果	apple	5000
2	小米	xiaomi	4000
3	OPPO	oppo	3000
4	华为	huawei	6000
SELECT * FROM t1 e WHERE rpad(e.id,20,e.sal) < 5000 ORDER BY e.id;
id	consumer	brand	sal
SELECT * FROM t1 e WHERE rpad(e.id,20,e.sal) = 3000 ORDER BY e.id;
id	consumer	brand	sal
#ORDER BY 
SELECT e.id,rpad(e.brand,20,e.consumer) FROM t1 e WHERE rpad(e.id,20,e.sal) like '%4000%' ORDER BY rpad(e.id,20,e.sal);
id	rpad(e.brand,20,e.consumer)
2	xiaomi小米小米小米小米小米小米小米
SELECT e.id,rpad(e.brand,20,e.consumer) FROM t1 e WHERE rpad(e.id,20,e.sal) like '%4000%' ORDER BY rpad(e.id,20,e.sal) DESC;
id	rpad(e.brand,20,e.consumer)
2	xiaomi小米小米小米小米小米小米小米
SELECT e.id,rpad(e.brand,20,e.consumer) FROM t1 e WHERE rpad(e.id,20,e.sal) like '%4000%' ORDER BY rpad(e.brand,20,e.consumer);
id	rpad(e.brand,20,e.consumer)
2	xiaomi小米小米小米小米小米小米小米
SELECT e.id,rpad(e.brand,20,e.consumer) FROM t1 e WHERE rpad(e.id,20,e.sal) like '%4000%' ORDER BY rpad(e.brand,20,e.consumer) DESC;
id	rpad(e.brand,20,e.consumer)
2	xiaomi小米小米小米小米小米小米小米
#GROUP BY HAVING
SELECT SUM(rpad(e.sal,20,p.price)) FROM t1 e LEFT JOIN t2 p ON e.id = p.id GROUP BY rpad(e.sal,20,p.price),e.id ORDER BY e.id ;
SUM(rpad(e.sal,20,p.price))
5.0006500650065e19
4.000500050005e19
3.0006000600060006e19
6.000800080008001e19
SELECT SUM(rpad(e.sal,20,p.price)) FROM t1 e LEFT JOIN t2 p ON e.id = p.id GROUP BY rpad(e.sal,20,p.price),e.id HAVING SUM(rpad(e.sal,20,p.price)) > 5000 ORDER BY e.id;
SUM(rpad(e.sal,20,p.price))
5.0006500650065e19
4.000500050005e19
3.0006000600060006e19
6.000800080008001e19
#CASE WHEN
SELECT id,rpad(consumer,20,CASE WHEN sal < 4000 THEN NULL ELSE sal END) name FROM t1 ORDER BY id;
id	name
1	苹果500050005000500050
2	小米400040004000400040
3	NULL
4	华为600060006000600060
SELECT id,CASE rpad(id,20,sal) WHEN 3000 THEN '低' WHEN 4000 THEN '一般' ELSE '高' END FROM t1 ORDER BY id;
id	CASE rpad(id,20,sal) WHEN 3000 THEN '低' WHEN 4000 THEN '一般' ELSE '高' END
1	高
2	高
3	高
4	高
SELECT (CASE rpad(id,20,sal) WHEN 3000 THEN '低' WHEN 4000 THEN '一般' ELSE '高' END) FROM t1 GROUP BY (CASE rpad(id,20,sal) WHEN 3000 THEN '低' WHEN 4000 THEN '一般' ELSE '高' END),id ORDER BY id ;
(CASE rpad(id,20,sal) WHEN 3000 THEN '低' WHEN 4000 THEN '一般' ELSE '高' END)
高
高
高
高
obmysql-rpad-3-2
#INSERT 
INSERT INTO t2 SELECT *  FROM t2 WHERE rpad(id,20,price) LIKE '%5000%';
SELECT COUNT(*) FROM t2;
COUNT(*)
5
INSERT INTO t2 SELECT *  FROM t2 WHERE rpad(id,20,price) > 6000;
SELECT COUNT(*) FROM t2;
COUNT(*)
10
INSERT INTO t3 SELECT rpad(model,20,price) FROM t2 WHERE price > 6500 ORDER BY rpad(model,20,price) DESC;
SELECT *  FROM  t3;
name
华为huaweihuaweihuawei
huawei mata308000800
huawei mata308000800
obmysql-rpad-3-3
#UPDATE
UPDATE t2 SET MODEL = 'xiaomi 10' WHERE rpad(id,20,price) LIKE '%5000%';
SELECT model FROM t2;
model
apple 12
xiaomi 10
oppo findx
huawei mata30
xiaomi 10
apple 12
xiaomi 10
oppo findx
huawei mata30
xiaomi 10
UPDATE t2 SET price = '9000' WHERE rpad(id,20,price) < 6500;
SELECT price FROM t2;
price
6500
5000
6000
8000
5000
6500
5000
6000
8000
5000
UPDATE t2 SET price = (SELECT rpad(id,20,sal) FROM t1 WHERE rpad(id,20,sal) > 5000) WHERE id = 1 ;
ERROR 21000: Subquery returns more than 1 row
SELECT price FROM t2;
price
6500
5000
6000
8000
5000
6500
5000
6000
8000
5000
obmysql-rpad-3-4
#DELETE 
DELETE FROM t2 WHERE rpad(model,20,price) like 'oppo findx';
SELECT COUNT(*) FROM t2;
COUNT(*)
10
DELETE FROM t2 WHERE rpad(id,20,price) like '%9000%';
SELECT COUNT(*) FROM t2;
COUNT(*)
10
DELETE FROM t2 WHERE rpad(id,20,price) <= 8000 ;
SELECT COUNT(*) FROM t2;
COUNT(*)
10
DROP TABLE t1;
DROP TABLE t2;
DROP TABLE t3;
obmysql-rpad-5
obmysql-rpad-5-1
DROP TABLE t1;
DROP TABLE t2;
DROP TABLE t3;
DROP VIEW t1_view;
DROP VIEW t2_view;
CREATE TABLE t1(id int,consumer char(20), brand varchar(20),sal int);
INSERT INTO t1 VALUES(1,'苹果','apple',5000);
INSERT INTO t1 VALUES(2,'小米','xiaomi',4000);
INSERT INTO t1 VALUES(3,'OPPO','oppo',3000);
INSERT INTO t1 VALUES(4,'华为','huawei',6000);
CREATE TABLE t2(id int,model varchar(200),price int);
INSERT INTO t2 VALUES(1,'apple 12',6500);
INSERT INTO t2 VALUES(2,'xiaomi 9',5000);
INSERT INTO t2 VALUES(3,'oppo findx',6000);
INSERT INTO t2 VALUES(4,'huawei mata30',8000);
CREATE VIEW t1_view AS SELECT *  FROM t1;
CREATE VIEW t2_view AS SELECT *  FROM t2;
#SELECT
SELECT rpad(e.id,e.consumer,e.brand,e.sal) FROM t1_view e;
ERROR 42000: Incorrect parameter count in the call to native function 'rpad'
SELECT rpad(e.consumer,e.id,e.sal) FROM t1_view e;
rpad(e.consumer,e.id,e.sal)
苹
小米
OPP
华为60
SELECT rpad(e.sal,20,p.price) money,rpad(e.brand,20,p.model) model FROM t1_view e LEFT JOIN t2_view p ON e.id = p.id ORDER BY e.id DESC;
money	model
60008000800080008000	huaweihuawei mata30h
30006000600060006000	oppooppo findxoppo f
40005000500050005000	xiaomixiaomi 9xiaomi
50006500650065006500	appleapple 12apple 1
SELECT rpad(e.sal,20,p.price) money,rpad(e.brand,20,p.model) model FROM t1_view e RIGHT JOIN t2_view p ON e.id = p.id ORDER BY e.id DESC;
money	model
60008000800080008000	huaweihuawei mata30h
30006000600060006000	oppooppo findxoppo f
40005000500050005000	xiaomixiaomi 9xiaomi
50006500650065006500	appleapple 12apple 1
SELECT rpad(e.sal,20,p.price) money,rpad(e.brand,20,p.model) model FROM t1_view e INNER JOIN t2_view p ON e.id = p.id ORDER BY e.id DESC;
money	model
60008000800080008000	huaweihuawei mata30h
30006000600060006000	oppooppo findxoppo f
40005000500050005000	xiaomixiaomi 9xiaomi
50006500650065006500	appleapple 12apple 1
SELECT * FROM (SELECT e.id,rpad(e.sal,20,p.price) price,rpad(e.brand,20,p.model)model FROM t1_view e LEFT JOIN t2_view p ON e.id = p.id ) e ORDER BY e.id;
id	price	model
1	50006500650065006500	appleapple 12apple 1
2	40005000500050005000	xiaomixiaomi 9xiaomi
3	30006000600060006000	oppooppo findxoppo f
4	60008000800080008000	huaweihuawei mata30h
#ANY
SELECT *  FROM t1_view e WHERE rpad(e.id,20,e.sal) < ANY (SELECT rpad(p.id,20,p.price) FROM t2_view p) ORDER BY e.id;
id	consumer	brand	sal
1	苹果	apple	5000
2	小米	xiaomi	4000
3	OPPO	oppo	3000
4	华为	huawei	6000
SELECT *  FROM t1_view e WHERE rpad(e.id,20,e.sal) = ANY (SELECT rpad(p.id,20,p.price) FROM t2_view p ) ORDER BY e.id;
id	consumer	brand	sal
SELECT *  FROM t1_view e WHERE rpad(e.consumer,20,e.sal) > ANY (SELECT rpad(p.model,20,p.price) FROM t2_view p) ORDER BY e.id;
id	consumer	brand	sal
1	苹果	apple	5000
2	小米	xiaomi	4000
3	OPPO	oppo	3000
4	华为	huawei	6000
#ALL 
SELECT *  FROM t1_view e WHERE rpad(e.id,20,e.sal) < ALL (SELECT rpad(p.id,20,p.price) FROM t2_view p) ORDER BY e.id;
id	consumer	brand	sal
1	苹果	apple	5000
SELECT *  FROM t1_view e WHERE rpad(e.consumer,20,e.sal) > ALL (SELECT rpad(p.model,20,p.price) FROM t2_view p) ORDER BY e.id;
id	consumer	brand	sal
1	苹果	apple	5000
2	小米	xiaomi	4000
4	华为	huawei	6000
SELECT *  FROM t1_view e WHERE rpad(e.id,20,e.sal) = ALL (SELECT rpad(p.id,20,p.price) FROM t2_view p WHERE p.model = 'oppo findx') ORDER BY e.id;
id	consumer	brand	sal
#EXISTS AND NOT EXISTS
SELECT *  FROM t1_view e WHERE EXISTS (SELECT rpad(p.id,20,p.price) FROM t2_view p ) ORDER BY e.id;
id	consumer	brand	sal
1	苹果	apple	5000
2	小米	xiaomi	4000
3	OPPO	oppo	3000
4	华为	huawei	6000
SELECT *  FROM t1_view e WHERE EXISTS (SELECT rpad(p.model,20,p.price) FROM t2_view p) ORDER BY e.id;
id	consumer	brand	sal
1	苹果	apple	5000
2	小米	xiaomi	4000
3	OPPO	oppo	3000
4	华为	huawei	6000
SELECT *  FROM t1_view e WHERE EXISTS (SELECT rpad(p.model,p.id,p.price) FROM t2_view p) ORDER BY e.id;
id	consumer	brand	sal
1	苹果	apple	5000
2	小米	xiaomi	4000
3	OPPO	oppo	3000
4	华为	huawei	6000
SELECT rpad(e.consumer,20,e.sal)  FROM t1_view e WHERE NOT EXISTS (SELECT p.id,p.price FROM t2_view p WHERE rpad(p.id,20,p.price) like '%6500%') ORDER BY e.id;
rpad(e.consumer,20,e.sal)
SELECT rpad(e.consumer,20,e.sal)  FROM t1_view e WHERE NOT EXISTS (SELECT p.id,p.price FROM t2_view p WHERE rpad(p.model,20,p.price) like 'apple 12' ) ORDER BY e.id;
rpad(e.consumer,20,e.sal)
苹果500050005000500050
小米400040004000400040
OPPO3000300030003000
华为600060006000600060
SELECT rpad(e.consumer,20,e.sal)  FROM t1_view e WHERE NOT EXISTS (SELECT p.id,p.price FROM t2_view p WHERE rpad(p.model,20,p.price) like 'apple 12 ' ) ORDER BY e.id;
rpad(e.consumer,20,e.sal)
苹果500050005000500050
小米400040004000400040
OPPO3000300030003000
华为600060006000600060
#CREATE AS 
CREATE TABLE t3 AS SELECT rpad(e.consumer,20,e.brand)  FROM t1_view e WHERE rpad(e.id,20,e.sal) like  '%6000%';
SELECT *  FROM t3;
rpad(e.consumer,20,e.brand)
华为huaweihuaweihuawei
drop table t3;
CREATE TABLE t3 AS SELECT rpad(e.consumer,20,e.brand) name  FROM t1_view e WHERE rpad(e.id,20,e.sal) like  '%6000%';
SELECT *  FROM t3;
name
华为huaweihuaweihuawei
#LIKE 
SELECT rpad(e.brand,20,e.consumer) FROM t1_view e WHERE rpad(e.brand,20,e.consumer) LIKE '%米%';
rpad(e.brand,20,e.consumer)
xiaomi小米小米小米小米小米小米小米
SELECT rpad(e.sal,20,p.price) FROM t1_view e LEFT JOIN t2_view p ON e.id = p.id WHERE rpad(e.sal,20,p.price) LIKE '%00%';
rpad(e.sal,20,p.price)
50006500650065006500
40005000500050005000
30006000600060006000
60008000800080008000
#WHERE
SELECT * FROM t1_view e WHERE rpad(e.consumer,20,e.brand) like '%苹果%';
id	consumer	brand	sal
1	苹果	apple	5000
SELECT * FROM t1_view e WHERE rpad(e.consumer,20,e.brand) like '%小米%';
id	consumer	brand	sal
2	小米	xiaomi	4000
SELECT * FROM t1_view e WHERE rpad(e.id,20,e.sal) > 4000 ORDER BY e.id;
id	consumer	brand	sal
1	苹果	apple	5000
2	小米	xiaomi	4000
3	OPPO	oppo	3000
4	华为	huawei	6000
SELECT * FROM t1_view e WHERE rpad(e.id,20,e.sal) < 5000 ORDER BY e.id;
id	consumer	brand	sal
SELECT * FROM t1_view e WHERE rpad(e.id,20,e.sal) = 3000 ORDER BY e.id;
id	consumer	brand	sal
#ORDER BY 
SELECT e.id,rpad(e.brand,20,e.consumer) FROM t1_view e WHERE rpad(e.id,20,e.sal) > 4000 ORDER BY rpad(e.id,20,e.sal);
id	rpad(e.brand,20,e.consumer)
1	apple苹果苹果苹果苹果苹果苹果苹果苹
2	xiaomi小米小米小米小米小米小米小米
3	oppoOPPOOPPOOPPOOPPO
4	huawei华为华为华为华为华为华为华为
SELECT e.id,rpad(e.brand,20,e.consumer) FROM t1_view e WHERE rpad(e.id,20,e.sal) > 4000 ORDER BY rpad(e.id,20,e.sal) DESC;
id	rpad(e.brand,20,e.consumer)
4	huawei华为华为华为华为华为华为华为
3	oppoOPPOOPPOOPPOOPPO
2	xiaomi小米小米小米小米小米小米小米
1	apple苹果苹果苹果苹果苹果苹果苹果苹
SELECT e.id,rpad(e.brand,20,e.consumer) FROM t1_view e WHERE rpad(e.id,20,e.sal) > 4000 ORDER BY rpad(e.brand,20,e.consumer);
id	rpad(e.brand,20,e.consumer)
1	apple苹果苹果苹果苹果苹果苹果苹果苹
4	huawei华为华为华为华为华为华为华为
3	oppoOPPOOPPOOPPOOPPO
2	xiaomi小米小米小米小米小米小米小米
SELECT e.id,rpad(e.brand,20,e.consumer) FROM t1_view e WHERE rpad(e.id,20,e.sal) > 4000 ORDER BY rpad(e.brand,20,e.consumer) DESC;
id	rpad(e.brand,20,e.consumer)
2	xiaomi小米小米小米小米小米小米小米
3	oppoOPPOOPPOOPPOOPPO
4	huawei华为华为华为华为华为华为华为
1	apple苹果苹果苹果苹果苹果苹果苹果苹
#GROUP BY HAVING
SELECT SUM(rpad(e.sal,20,p.price)) FROM t1_view e LEFT JOIN t2_view p ON e.id = p.id GROUP BY rpad(e.sal,20,p.price),e.id ORDER BY e.id;
SUM(rpad(e.sal,20,p.price))
5.0006500650065e19
4.000500050005e19
3.0006000600060006e19
6.000800080008001e19
SELECT SUM(rpad(e.sal,20,p.price)) FROM t1_view e LEFT JOIN t2_view p ON e.id = p.id GROUP BY rpad(e.sal,20,p.price),e.id HAVING SUM(rpad(e.sal,20,p.price)) > 6000 ORDER BY e.id;
SUM(rpad(e.sal,20,p.price))
5.0006500650065e19
4.000500050005e19
3.0006000600060006e19
6.000800080008001e19
#CASE WHEN
SELECT id,rpad(consumer,20,CASE WHEN sal < 4000 THEN NULL ELSE sal END) name FROM t1_view ORDER BY id;
id	name
1	苹果500050005000500050
2	小米400040004000400040
3	NULL
4	华为600060006000600060
SELECT id,CASE rpad(id,20,sal) WHEN 3000 THEN '低' WHEN 4000 THEN '一般' ELSE '高' END FROM t1_view ORDER BY id;
id	CASE rpad(id,20,sal) WHEN 3000 THEN '低' WHEN 4000 THEN '一般' ELSE '高' END
1	高
2	高
3	高
4	高
SELECT (CASE rpad(id,20,sal) WHEN 3000 THEN '低' WHEN 4000 THEN '一般' ELSE '高' END) FROM t1_view GROUP BY (CASE rpad(id,20,sal) WHEN 3000 THEN '低' WHEN 4000 THEN '一般' ELSE '高' END),id ORDER BY id;
(CASE rpad(id,20,sal) WHEN 3000 THEN '低' WHEN 4000 THEN '一般' ELSE '高' END)
高
高
高
高
#INSERT 
INSERT INTO t2 SELECT *  FROM t2_view WHERE rpad(id,20,price)  LIKE '%5000%';
SELECT COUNT(*) FROM t2;
COUNT(*)
5
INSERT INTO t2 SELECT *  FROM t2_view WHERE rpad(id,20,price) > 6000;
SELECT COUNT(*) FROM t2;
COUNT(*)
10
INSERT INTO t3 SELECT rpad(model,20,price) FROM t2_view WHERE price > 6500 ORDER BY rpad(model,20,price) DESC;
SELECT *  FROM  t3;
name
华为huaweihuaweihuawei
huawei mata308000800
huawei mata308000800
#UPDATE
UPDATE t2_view SET MODEL = 'xiaomi 10' WHERE rpad(id,20,price)  LIKE '%5000%';
SELECT model FROM t2_view;
model
apple 12
xiaomi 10
oppo findx
huawei mata30
xiaomi 10
apple 12
xiaomi 10
oppo findx
huawei mata30
xiaomi 10
UPDATE t2_view SET price = '9000' WHERE rpad(id,20,price) < 6500;
SELECT price FROM t2_view;
price
6500
5000
6000
8000
5000
6500
5000
6000
8000
5000
UPDATE t2_view SET price = (SELECT rpad(id,20,sal) FROM t1 WHERE rpad(id,20,sal) > 5000) WHERE id = 1 ;
ERROR 21000: Subquery returns more than 1 row
SELECT price FROM t2_view;
price
6500
5000
6000
8000
5000
6500
5000
6000
8000
5000
#DELETE 
DELETE FROM t2_view WHERE rpad(model,20,price) like 'oppo findx';
SELECT COUNT(*) FROM t2_view;
COUNT(*)
10
DELETE FROM t2_view WHERE rpad(id,20,price) LIKE '%9000%';
SELECT COUNT(*) FROM t2_view;
COUNT(*)
10
DELETE FROM t2_view WHERE rpad(id,20,price) <= 8000 ;
SELECT COUNT(*) FROM t2_view;
COUNT(*)
10
obmysql-rpad-5-2
DROP TABLE t1;
CREATE TABLE t1(id int,consumer char(20), price varchar(20),sal int,datetime1 DATE,datetime2 bigint);
INSERT INTO t1 VALUES(1,'苹果','6500',5000,'2020-09-22',20200923121200);
INSERT INTO t1 VALUES(2,'小米','3000',4000,'2020-09-21',20200921101159);
INSERT INTO t1 VALUES(3,'OPPO','5000',3000,'2020-08-21',20190821101159);
INSERT INTO t1 VALUES(4,'华为','9111',10000,'2020-02-29',20200228101159);
#index dml 
CREATE INDEX index_test ON t1(sal);
CREATE INDEX index_test1 ON t1(price);
CREATE INDEX index_test2 ON t1(consumer);
CREATE INDEX index_test3 ON t1(datetime1);
CREATE INDEX index_test4 ON t1(datetime2);
#select 
SELECT rpad(consumer,40,datetime2)name,rpad(price,20,sal)sal FROM t1;
name	sal
苹果20200923121200202009231212002020092312	65005000500050005000
小米20200921101159202009211011592020092110	30004000400040004000
OPPO201908211011592019082110115920190821	50003000300030003000
华为20200228101159202002281011592020022810	91111000010000100001
SELECT id,consumer,rpad(price,20,sal) FROM t1 WHERE rpad(price,20,sal) like '%6500%' ORDER BY id DESC;
id	consumer	rpad(price,20,sal)
1	苹果	65005000500050005000
SELECT id,consumer,rpad(price,20,sal) FROM t1 WHERE rpad(price,20,sal) > 5000 ORDER BY rpad(price,20,sal);
id	consumer	rpad(price,20,sal)
2	小米	30004000400040004000
3	OPPO	50003000300030003000
1	苹果	65005000500050005000
4	华为	91111000010000100001
SELECT id,SUM(rpad(price,20,sal)) FROM t1 WHERE  rpad(price,20,sal) > 5000 GROUP BY id HAVING SUM(rpad(price,20,sal)) > 5000 ORDER BY id;
id	SUM(rpad(price,20,sal))
1	6.500500050005e19
2	3.0004000400040006e19
3	5.000300030003e19
4	9.11110000100001e19
#update 
UPDATE t1 SET sal = rpad(1000,10,6500) WHERE rpad(price,20,sal) like '%6500%';
SELECT sal FROM t1;
sal
1000650065
4000
3000
10000
UPDATE t1 SET sal = (SELECT rpad(price,20,sal) FROM t1 WHERE rpad(price,20,sal) like '%4000%') WHERE rpad(price,20,sal) like '%5000%';
ERROR 22003: Out of range value for column 'sal' at row 1
SELECT sal  FROM t1;
sal
1000650065
4000
3000
10000
#insert 
INSERT INTO t1 SELECT *  FROM t1 WHERE rpad(price,20,sal) like '%4000%';
SELECT COUNT(*) FROM t1;
COUNT(*)
5
INSERT INTO t1 VALUES(8,'华为','9111',rpad(55,5,2),'2020-02-29 10:11:59',20200228101159);
INSERT INTO t1 VALUES(7,rpad('原始天尊',20,'哮天犬'),'5000',3000,'2020-08-21 10:11:59',20190821101159);
SELECT COUNT(*)  FROM t1;
COUNT(*)
7
#delete
DELETE FROM t1 WHERE rpad(price,20,sal) like '%4000%';
SELECT COUNT(*)  FROM t1;
COUNT(*)
5
obmysql-rpad-5-3
DROP TABLE t1;
CREATE TABLE t1(id int PRIMARY KEY,consumer char(20) NOT NULL, price varchar(20),sal int  ,datetime1 DATE,datetime2 bigint,CONSTRAINT t1_name_uk UNIQUE(price));
INSERT INTO t1 VALUES(1,'苹果','6500',5000,'2020-09-22 12:11:59',20200923121200);
INSERT INTO t1 VALUES(2,'小米','3000',4000,'2020-09-21 10:11:59',20200921101159);
INSERT INTO t1 VALUES(3,'OPPO','5000',3000,'2020-08-21 10:11:59',20190821101159);
INSERT INTO t1 VALUES(4,'华为','9111',10000,'2020-02-29 10:11:59',20200228101159);
#select 
SELECT rpad(id,price,sal),rpad(consumer,40,datetime2) FROM t1;
rpad(id,price,sal)	rpad(consumer,40,datetime2)
15000500050005000500050005000500050005000500050005000500050005000500050005000500050005000500050005000500050005000500050005000500050005000500050005000500050005000500050005000500050005000500050005000500050005000500050005000500050005000500050005000500050005000500050005000500050005000500050005000500050005000500050005000500050005000500050005000500050005000500050005000500050005000500050005000500050005000500050005000500050005000500050005000500050005000500050005000500050005000500050005000500050005000500050005000500050005000500050005000500050005000500050005000500050005000500050005000500050005000500050005000500050005000500050005000500050005000500050005000500050005000500050005000500050005000500050005000500050005000500050005000500050005000500050005000500050005000500050005000500050005000500050005000500050005000500050005000500050005000500050005000500050005000500050005000500050005000500050005000500050005000500050005000500050005000500050005000500050005000500050005000500050005000500050005000500050005000500050005000500050005000500050005000500050005000500050005000500050005000500050005000500050005000500050005000500050005000500050005000500050005000500050005000500050005000500050005000500050005000500050005000500050005000500050005000500050005000500050005000500050005000500050005000500050005000500050005000500050005000500050005000500050005000500050005000500050005000500050005000500050005000500050005000500050005000500050005000500050005000500050005000500050005000500050005000500050005000500050005000500050005000500050005000500050005000500050005000500050005000500050005000500050005000500050005000500050005000500050005000500050005000500050005000500050005000500050005000500050005000500050005000500050005000500050005000500050005000500050005000500050005000500050005000500050005000500050005000500050005000500050005000500050005000500050005000500050005000500050005000500050005000500050005000500050005000500050005000500050005000500050005000500050005000500050005000500050005000500050005000500050005000500050005000500050005000500050005000500050005000500050005000500050005000500050005000500050005000500050005000500050005000500050005000500050005000500050005000500050005000500050005000500050005000500050005000500050005000500050005000500050005000500050005000500050005000500050005000500050005000500050005000500050005000500050005000500050005000500050005000500050005000500050005000500050005000500050005000500050005000500050005000500050005000500050005000500050005000500050005000500050005000500050005000500050005000500050005000500050005000500050005000500050005000500050005000500050005000500050005000500050005000500050005000500050005000500050005000500050005000500050005000500050005000500050005000500050005000500050005000500050005000500050005000500050005000500050005000500050005000500050005000500050005000500050005000500050005000500050005000500050005000500050005000500050005000500050005000500050005000500050005000500050005000500050005000500050005000500050005000500050005000500050005000500050005000500050005000500050005000500050005000500050005000500050005000500050005000500050005000500050005000500050005000500050005000500050005000500050005000500050005000500050005000500050005000500050005000500050005000500050005000500050005000500050005000500050005000500050005000500050005000500050005000500050005000500050005000500050005000500050005000500050005000500050005000500050005000500050005000500050005000500050005000500050005000500050005000500050005000500050005000500050005000500050005000500050005000500050005000500050005000500050005000500050005000500050005000500050005000500050005000500050005000500050005000500050005000500050005000500050005000500050005000500050005000500050005000500050005000500050005000500050005000500050005000500050005000500050005000500050005000500050005000500050005000500050005000500050005000500050005000500050005000500050005000500050005000500050005000500050005000500050005000500050005000500050005000500050005000500050005000500050005000500050005000500050005000500050005000500050005000500050005000500050005000500050005000500050005000500050005000500050005000500050005000500050005000500050005000500050005000500050005000500050005000500050005000500050005000500050005000500050005000500050005000500050005000500050005000500050005000500050005000500050005000500050005000500050005000500050005000500050005000500050005000500050005000500050005000500050005000500050005000500050005000500050005000500050005000500050005000500050005000500050005000500050005000500050005000500050005000500050005000500050005000500050005000500050005000500050005000500050005000500050005000500050005000500050005000500050005000500050005000500050005000500050005000500050005000500050005000500050005000500050005000500050005000500050005000500050005000500050005000500050005000500050005000500050005000500050005000500050005000500050005000500050005000500050005000500050005000500050005000500050005000500050005000500050005000500050005000500050005000500050005000500050005000500050005000500050005000500050005000500050005000500050005000500050005000500050005000500050005000500050005000500050005000500050005000500050005000500050005000500050005000500050005000500050005000500050005000500050005000500050005000500050005000500050005000500050005000500050005000500050005000500050005000500050005000500050005000500050005000500050005000500050005000500050005000500050005000500050005000500050005000500050005000500050005000500050005000500050005000500050005000500050005000500050005000500050005000500050005000500050005000500050005000500050005000500050005000500050005000500050005000500050005000500050005000500050005000500050005000500050005000500050005000500050005000500050005000500050005000500050005000500050005000500050005000500050005000500050005000500050005000500050005000500050005000500050005000500050005000500050005000500050005000500050005000500050005000500050005000500050005000500050005000500050005000500050005000500050005000500050005000500050005000500050005000500050005000500050005000500050005000500050005000500050005000500050005000500050005000500050005000500050005000500050005000500050005000500050005000500050005000500050005000500050005000500050005000500050005000500050005000500050005000500050005000500050005000500050005000500050005000500050005000500050005000500050005000500050005000500050005000500050005000500050005000500050005000500050005000500050005000500050005000500050005000500050005000500050005000500050005000500050005000500050005000500050005000500050005000500050005000500050005000500050005000500050005000500050005000500050005000500050005000500050005000500050005000500050005000500	苹果20200923121200202009231212002020092312
240004000400040004000400040004000400040004000400040004000400040004000400040004000400040004000400040004000400040004000400040004000400040004000400040004000400040004000400040004000400040004000400040004000400040004000400040004000400040004000400040004000400040004000400040004000400040004000400040004000400040004000400040004000400040004000400040004000400040004000400040004000400040004000400040004000400040004000400040004000400040004000400040004000400040004000400040004000400040004000400040004000400040004000400040004000400040004000400040004000400040004000400040004000400040004000400040004000400040004000400040004000400040004000400040004000400040004000400040004000400040004000400040004000400040004000400040004000400040004000400040004000400040004000400040004000400040004000400040004000400040004000400040004000400040004000400040004000400040004000400040004000400040004000400040004000400040004000400040004000400040004000400040004000400040004000400040004000400040004000400040004000400040004000400040004000400040004000400040004000400040004000400040004000400040004000400040004000400040004000400040004000400040004000400040004000400040004000400040004000400040004000400040004000400040004000400040004000400040004000400040004000400040004000400040004000400040004000400040004000400040004000400040004000400040004000400040004000400040004000400040004000400040004000400040004000400040004000400040004000400040004000400040004000400040004000400040004000400040004000400040004000400040004000400040004000400040004000400040004000400040004000400040004000400040004000400040004000400040004000400040004000400040004000400040004000400040004000400040004000400040004000400040004000400040004000400040004000400040004000400040004000400040004000400040004000400040004000400040004000400040004000400040004000400040004000400040004000400040004000400040004000400040004000400040004000400040004000400040004000400040004000400040004000400040004000400040004000400040004000400040004000400040004000400040004000400040004000400040004000400040004000400040004000400040004000400040004000400040004000400040004000400040004000400040004000400040004000400040004000400040004000400040004000400040004000400040004000400040004000400040004000400040004000400040004000400040004000400040004000400040004000400040004000400040004000400040004000400040004000400040004000400040004000400040004000400040004000400040004000400040004000400040004000400040004000400040004000400040004000400040004000400040004000400040004000400040004000400040004000400040004000400040004000400040004000400040004000400040004000400040004000400040004000400040004000400040004000400040004000400040004000400040004000400040004000400040004000400040004000400040004000400040004000400040004000400040004000400040004000400040004000400040004000400040004000400040004000400040004000400040004000400040004000400040004000400040004000400040004000400040004000400040004000400040004000400040004000400040004000400040004000400040004000400040004000400040004000400040004000400040004000400040004000400040004000400040004000400040004000400	小米20200921101159202009211011592020092110
33000300030003000300030003000300030003000300030003000300030003000300030003000300030003000300030003000300030003000300030003000300030003000300030003000300030003000300030003000300030003000300030003000300030003000300030003000300030003000300030003000300030003000300030003000300030003000300030003000300030003000300030003000300030003000300030003000300030003000300030003000300030003000300030003000300030003000300030003000300030003000300030003000300030003000300030003000300030003000300030003000300030003000300030003000300030003000300030003000300030003000300030003000300030003000300030003000300030003000300030003000300030003000300030003000300030003000300030003000300030003000300030003000300030003000300030003000300030003000300030003000300030003000300030003000300030003000300030003000300030003000300030003000300030003000300030003000300030003000300030003000300030003000300030003000300030003000300030003000300030003000300030003000300030003000300030003000300030003000300030003000300030003000300030003000300030003000300030003000300030003000300030003000300030003000300030003000300030003000300030003000300030003000300030003000300030003000300030003000300030003000300030003000300030003000300030003000300030003000300030003000300030003000300030003000300030003000300030003000300030003000300030003000300030003000300030003000300030003000300030003000300030003000300030003000300030003000300030003000300030003000300030003000300030003000300030003000300030003000300030003000300030003000300030003000300030003000300030003000300030003000300030003000300030003000300030003000300030003000300030003000300030003000300030003000300030003000300030003000300030003000300030003000300030003000300030003000300030003000300030003000300030003000300030003000300030003000300030003000300030003000300030003000300030003000300030003000300030003000300030003000300030003000300030003000300030003000300030003000300030003000300030003000300030003000300030003000300030003000300030003000300030003000300030003000300030003000300030003000300030003000300030003000300030003000300030003000300030003000300030003000300030003000300030003000300030003000300030003000300030003000300030003000300030003000300030003000300030003000300030003000300030003000300030003000300030003000300030003000300030003000300030003000300030003000300030003000300030003000300030003000300030003000300030003000300030003000300030003000300030003000300030003000300030003000300030003000300030003000300030003000300030003000300030003000300030003000300030003000300030003000300030003000300030003000300030003000300030003000300030003000300030003000300030003000300030003000300030003000300030003000300030003000300030003000300030003000300030003000300030003000300030003000300030003000300030003000300030003000300030003000300030003000300030003000300030003000300030003000300030003000300030003000300030003000300030003000300030003000300030003000300030003000300030003000300030003000300030003000300030003000300030003000300030003000300030003000300030003000300030003000300030003000300030003000300030003000300030003000300030003000300030003000300030003000300030003000300030003000300030003000300030003000300030003000300030003000300030003000300030003000300030003000300030003000300030003000300030003000300030003000300030003000300030003000300030003000300030003000300030003000300030003000300030003000300030003000300030003000300030003000300030003000300030003000300030003000300030003000300030003000300030003000300030003000300030003000300030003000300030003000300030003000300030003000300030003000300030003000300030003000300030003000300030003000300030003000300030003000300030003000300030003000300030003000300030003000300030003000300030003000300030003000300030003000300030003000300030003000300030003000300030003000300030003000300030003000300030003000300030003000300030003000300030003000300030003000300030003000300030003000300030003000300030003000300030003000300030003000300030003000300030003000300030003000300030003000300030003000300030003000300030003000300030003000300030003000300030003000300030003000300030003000300030003000300030003000300030003000300030003000300030003000300030003000300030003000300030003000300030003000300030003000300030003000300030003000300030003000300030003000300030003000300030003000300030003000300030003000300030003000300030003000300030003000300030003000300030003000300030003000300030003000300030003000300030003000300030003000300030003000300030003000300030003000300030003000300030003000300030003000300030003000300030003000300030003000300030003000300030003000300030003000300030003000300030003000300030003000300030003000300030003000300030003000300030003000300030003000300030003000300030003000300030003000300030003000300030003000300030003000300030003000300030003000300030003000300030003000300030003000300030003000300030003000300030003000300030003000300030003000300030003000300030003000300030003000300030003000300030003000300030003000300030003000300030003000300030003000300030003000300030003000300030003000300030003000300030003000300030003000300030003000300030003000300030003000300030003000300030003000300030003000300	OPPO201908211011592019082110115920190821
410000100001000010000100001000010000100001000010000100001000010000100001000010000100001000010000100001000010000100001000010000100001000010000100001000010000100001000010000100001000010000100001000010000100001000010000100001000010000100001000010000100001000010000100001000010000100001000010000100001000010000100001000010000100001000010000100001000010000100001000010000100001000010000100001000010000100001000010000100001000010000100001000010000100001000010000100001000010000100001000010000100001000010000100001000010000100001000010000100001000010000100001000010000100001000010000100001000010000100001000010000100001000010000100001000010000100001000010000100001000010000100001000010000100001000010000100001000010000100001000010000100001000010000100001000010000100001000010000100001000010000100001000010000100001000010000100001000010000100001000010000100001000010000100001000010000100001000010000100001000010000100001000010000100001000010000100001000010000100001000010000100001000010000100001000010000100001000010000100001000010000100001000010000100001000010000100001000010000100001000010000100001000010000100001000010000100001000010000100001000010000100001000010000100001000010000100001000010000100001000010000100001000010000100001000010000100001000010000100001000010000100001000010000100001000010000100001000010000100001000010000100001000010000100001000010000100001000010000100001000010000100001000010000100001000010000100001000010000100001000010000100001000010000100001000010000100001000010000100001000010000100001000010000100001000010000100001000010000100001000010000100001000010000100001000010000100001000010000100001000010000100001000010000100001000010000100001000010000100001000010000100001000010000100001000010000100001000010000100001000010000100001000010000100001000010000100001000010000100001000010000100001000010000100001000010000100001000010000100001000010000100001000010000100001000010000100001000010000100001000010000100001000010000100001000010000100001000010000100001000010000100001000010000100001000010000100001000010000100001000010000100001000010000100001000010000100001000010000100001000010000100001000010000100001000010000100001000010000100001000010000100001000010000100001000010000100001000010000100001000010000100001000010000100001000010000100001000010000100001000010000100001000010000100001000010000100001000010000100001000010000100001000010000100001000010000100001000010000100001000010000100001000010000100001000010000100001000010000100001000010000100001000010000100001000010000100001000010000100001000010000100001000010000100001000010000100001000010000100001000010000100001000010000100001000010000100001000010000100001000010000100001000010000100001000010000100001000010000100001000010000100001000010000100001000010000100001000010000100001000010000100001000010000100001000010000100001000010000100001000010000100001000010000100001000010000100001000010000100001000010000100001000010000100001000010000100001000010000100001000010000100001000010000100001000010000100001000010000100001000010000100001000010000100001000010000100001000010000100001000010000100001000010000100001000010000100001000010000100001000010000100001000010000100001000010000100001000010000100001000010000100001000010000100001000010000100001000010000100001000010000100001000010000100001000010000100001000010000100001000010000100001000010000100001000010000100001000010000100001000010000100001000010000100001000010000100001000010000100001000010000100001000010000100001000010000100001000010000100001000010000100001000010000100001000010000100001000010000100001000010000100001000010000100001000010000100001000010000100001000010000100001000010000100001000010000100001000010000100001000010000100001000010000100001000010000100001000010000100001000010000100001000010000100001000010000100001000010000100001000010000100001000010000100001000010000100001000010000100001000010000100001000010000100001000010000100001000010000100001000010000100001000010000100001000010000100001000010000100001000010000100001000010000100001000010000100001000010000100001000010000100001000010000100001000010000100001000010000100001000010000100001000010000100001000010000100001000010000100001000010000100001000010000100001000010000100001000010000100001000010000100001000010000100001000010000100001000010000100001000010000100001000010000100001000010000100001000010000100001000010000100001000010000100001000010000100001000010000100001000010000100001000010000100001000010000100001000010000100001000010000100001000010000100001000010000100001000010000100001000010000100001000010000100001000010000100001000010000100001000010000100001000010000100001000010000100001000010000100001000010000100001000010000100001000010000100001000010000100001000010000100001000010000100001000010000100001000010000100001000010000100001000010000100001000010000100001000010000100001000010000100001000010000100001000010000100001000010000100001000010000100001000010000100001000010000100001000010000100001000010000100001000010000100001000010000100001000010000100001000010000100001000010000100001000010000100001000010000100001000010000100001000010000100001000010000100001000010000100001000010000100001000010000100001000010000100001000010000100001000010000100001000010000100001000010000100001000010000100001000010000100001000010000100001000010000100001000010000100001000010000100001000010000100001000010000100001000010000100001000010000100001000010000100001000010000100001000010000100001000010000100001000010000100001000010000100001000010000100001000010000100001000010000100001000010000100001000010000100001000010000100001000010000100001000010000100001000010000100001000010000100001000010000100001000010000100001000010000100001000010000100001000010000100001000010000100001000010000100001000010000100001000010000100001000010000100001000010000100001000010000100001000010000100001000010000100001000010000100001000010000100001000010000100001000010000100001000010000100001000010000100001000010000100001000010000100001000010000100001000010000100001000010000100001000010000100001000010000100001000010000100001000010000100001000010000100001000010000100001000010000100001000010000100001000010000100001000010000100001000010000100001000010000100001000010000100001000010000100001000010000100001000010000100001000010000100001000010000100001000010000100001000010000100001000010000100001000010000100001000010000100001000010000100001000010000100001000010000100001000010000100001000010000100001000010000100001000010000100001000010000100001000010000100001000010000100001000010000100001000010000100001000010000100001000010000100001000010000100001000010000100001000010000100001000010000100001000010000100001000010000100001000010000100001000010000100001000010000100001000010000100001000010000100001000010000100001000010000100001000010000100001000010000100001000010000100001000010000100001000010000100001000010000100001000010000100001000010000100001000010000100001000010000100001000010000100001000010000100001000010000100001000010000100001000010000100001000010000100001000010000100001000010000100001000010000100001000010000100001000010000100001000010000100001000010000100001000010000100001000010000100001000010000100001000010000100001000010000100001000010000100001000010000100001000010000100001000010000100001000010000100001000010000100001000010000100001000010000100001000010000100001000010000100001000010000100001000010000100001000010000100001000010000100001000010000100001000010000100001000010000100001000010000100001000010000100001000010000100001000010000100001000010000100001000010000100001000010000100001000010000100001000010000100001000010000100001000010000100001000010000100001000010000100001000010000100001000010000100001000010000100001000010000100001000010000100001000010000100001000010000100001000010000100001000010000100001000010000100001000010000100001000010000100001000010000100001000010000100001000010000100001000010000100001000010000100001000010000100001000010000100001000010000100001000010000100001000010000100001000010000100001000010000100001000010000100001000010000100001000010000100001000010000100001000010000100001000010000100001000010000100001000010000100001000010000100001000010000100001000010000100001000010000100001000010000100001000010000100001000010000100001000010000100001000010000100001000010000100001000010000100001000010000100001000010000100001000010000100001000010000100001000010000100001000010000100001000010000100001000010000100001000010000100001000010000100001000010000100001000010000100001000010000100001000010000100001000010000100001000010000100001000010000100001000010000100001000010000100001000010000100001000010000100001000010000100001000010000100001000010000100001000010000100001000010000100001000010000100001000010000100001000010000100001000010000100001000010000100001000010000100001000010000100001000010000100001000010000100001000010000100001000010000100001000010000100001000010000100001000010000100001000010000100001000010000100001000010000100001000010000100001000010000100001000010000100001000010000100001000010000100001000010000100001000010000100001000010000100001000010000100001000010000100001000010000100001000010000100001000010000100001000010000100001000010000100001000010000	华为20200228101159202002281011592020022810
SELECT rpad(consumer,40,datetime2) name,rpad(price,20,sal) sal FROM t1;
name	sal
苹果20200923121200202009231212002020092312	65005000500050005000
小米20200921101159202009211011592020092110	30004000400040004000
OPPO201908211011592019082110115920190821	50003000300030003000
华为20200228101159202002281011592020022810	91111000010000100001
SELECT id,consumer,rpad(price,20,sal) FROM t1 WHERE rpad(price,20,sal) like '%6500%' ORDER BY id DESC;
id	consumer	rpad(price,20,sal)
1	苹果	65005000500050005000
SELECT id,consumer,rpad(price,20,sal) FROM t1 WHERE rpad(price,20,sal) like '%5000%' ORDER BY rpad(price,20,sal);
id	consumer	rpad(price,20,sal)
3	OPPO	50003000300030003000
1	苹果	65005000500050005000
SELECT id,SUM(rpad(price,20,sal)) FROM t1 WHERE  rpad(price,20,sal) like '%5000%' GROUP BY id HAVING SUM(rpad(price,20,sal)) > 5000 ORDER BY id;
id	SUM(rpad(price,20,sal))
1	6.500500050005e19
3	5.000300030003e19
#update 
UPDATE t1 SET sal = rpad(1000,5,5665) WHERE rpad(price,20,sal) like '%6500%' ;
SELECT sal FROM t1;
sal
10005
4000
3000
10000
UPDATE t1 SET sal = (SELECT rpad(price,20,sal) FROM t1 WHERE rpad(price,20,sal) LIKE '%4000%') WHERE rpad(price,20,sal) LIKE '%5000%';
ERROR 22003: Out of range value for column 'sal' at row 1
SELECT sal  FROM t1;
sal
10005
4000
3000
10000
#insert 
INSERT INTO t1 VALUES(8,'华为','8111',rpad(555,5,7988),'2020-02-29 10:11:59',20200228101159);
INSERT INTO t1 VALUES(7,rpad('原始天尊',20,'哼哈二将'),'11110',3000,'2020-08-21 10:11:59',20190821101159);
SELECT COUNT(*)  FROM t1;
COUNT(*)
6
#delete
DELETE FROM t1 WHERE rpad(price,20,sal) like '%4000%';
SELECT COUNT(*)  FROM t1;
COUNT(*)
5
DROP VIEW t2_view;
DROP VIEW t1_view;
DROP TABLE t1;
DROP TABLE t2;
DROP TABLE t3;
DROP TABLE t1;
CREATE TABLE t1(id int,consumer char(20), price varchar(20),sal int,datetime1 DATE,datetime2 bigint);
INSERT INTO t1 VALUES(1,'苹果','6500',5000,'2020-09-22 12:11:59',20200923121200);
INSERT INTO t1 VALUES(2,'小米','3000',4000,'2020-09-21 10:11:59',20200921101159);
INSERT INTO t1 VALUES(3,'OPPO','5000',3000,'2020-08-21 10:11:59',20190821101159);
INSERT INTO t1 VALUES(4,'华为','9111',10000,'2020-02-29 10:11:59',20200228101159);
obmysql-rpad-6
#函数嵌套
SELECT rpad(rpad(consumer,20,price),40,datetime1) FROM t1;
rpad(rpad(consumer,20,price),40,datetime1)
苹果6500650065006500652020-09-222020-09-22
小米3000300030003000302020-09-212020-09-21
OPPO50005000500050002020-08-212020-08-21
华为9111911191119111912020-02-292020-02-29
SELECT rpad(rpad(rpad(consumer,20,price),40,datetime1),40,datetime2) FROM t1;
rpad(rpad(rpad(consumer,20,price),40,datetime1),40,datetime2)
苹果6500650065006500652020-09-222020-09-22
小米3000300030003000302020-09-212020-09-21
OPPO50005000500050002020-08-212020-08-21
华为9111911191119111912020-02-292020-02-29
SELECT SUM(rpad(price,20,sal)) FROM t1 ORDER BY id;
SUM(rpad(price,20,sal))
2.361230012101201e20
SELECT rpad(sal,20,SUM(price)) FROM t1 ORDER BY id;
rpad(sal,20,SUM(price))
50002361123611236112
SELECT rpad(SUM(sal),20,SUM(price)) FROM t1 ORDER BY id;
rpad(SUM(sal),20,SUM(price))
22000236112361123611
SELECT COUNT(rpad(price,20,sal)) FROM t1 ORDER BY id;
COUNT(rpad(price,20,sal))
4
SELECT rpad(COUNT(sal),20,COUNT(price)) FROM t1 ORDER BY id;
rpad(COUNT(sal),20,COUNT(price))
44444444444444444444
SELECT MAX(rpad(price,20,sal)) FROM t1 ORDER BY id;
MAX(rpad(price,20,sal))
91111000010000100001
SELECT rpad(MAX(sal),20,MAX(price)) FROM t1 ORDER BY id;
rpad(MAX(sal),20,MAX(price))
10000911191119111911
SELECT MIN(rpad(price,20,sal)) FROM t1 ORDER BY id;
MIN(rpad(price,20,sal))
30004000400040004000
SELECT rpad(MIN(sal),20,MIN(price)) FROM t1 ORDER BY id;
rpad(MIN(sal),20,MIN(price))
30003000300030003000
SELECT AVG(rpad(price,20,sal)) FROM t1 ORDER BY id;
AVG(rpad(price,20,sal))
5.903075030253003e19
SELECT rpad(AVG(sal),20,AVG(price)) FROM t1 ORDER BY id;
rpad(AVG(sal),20,AVG(price))
5500.00005902.755902
SELECT ABS(rpad(price,20,sal)) FROM t1 ORDER BY id;
ABS(rpad(price,20,sal))
6.500500050005e19
3.0004000400040006e19
5.000300030003e19
9.11110000100001e19
SELECT rpad(ABS(sal),20,ABS(price)) FROM t1 ORDER BY id;
rpad(ABS(sal),20,ABS(price))
50006500650065006500
40003000300030003000
30005000500050005000
10000911191119111911
SELECT CEIL(rpad(price,20,sal)) FROM t1 ORDER BY id;
CEIL(rpad(price,20,sal))
65005000500050000000
30004000400040006000
50003000300030000000
91111000010000100000
SELECT rpad(CEIL(sal),20,CEIL(price)) FROM t1 ORDER BY id;
rpad(CEIL(sal),20,CEIL(price))
50006500650065006500
40003000300030003000
30005000500050005000
10000911191119111911
SELECT FLOOR(rpad(price,20,sal)) FROM t1 ORDER BY id;
FLOOR(rpad(price,20,sal))
65005000500050000000
30004000400040006000
50003000300030000000
91111000010000100000
SELECT rpad(FLOOR(sal),20,FLOOR(price)) FROM t1 ORDER BY id;
rpad(FLOOR(sal),20,FLOOR(price))
50006500650065006500
40003000300030003000
30005000500050005000
10000911191119111911
SELECT MOD(rpad(price,20,sal),33) FROM t1 ORDER BY id;
MOD(rpad(price,20,sal),33)
23
7
5
18
SELECT rpad(MOD(sal,3),20,MOD(price,7)) FROM t1 ORDER BY id;
rpad(MOD(sal,3),20,MOD(price,7))
24444444444444444444
14444444444444444444
02222222222222222222
14444444444444444444
SELECT LENGTH(rpad(consumer,40,datetime2)) FROM t1;
LENGTH(rpad(consumer,40,datetime2))
44
44
40
44
SELECT rpad(LENGTH(consumer),40,LENGTH(datetime1)) FROM t1;
rpad(LENGTH(consumer),40,LENGTH(datetime1))
6101010101010101010101010101010101010101
6101010101010101010101010101010101010101
4101010101010101010101010101010101010101
6101010101010101010101010101010101010101
SELECT INSTR(rpad(consumer,40,datetime2),'米') FROM t1;
INSTR(rpad(consumer,40,datetime2),'米')
0
2
0
0
SELECT rpad(INSTR(consumer,'米'),40,INSTR(datetime1,'2')) FROM t1;
rpad(INSTR(consumer,'米'),40,INSTR(datetime1,'2'))
0111111111111111111111111111111111111111
2111111111111111111111111111111111111111
0111111111111111111111111111111111111111
0111111111111111111111111111111111111111
SELECT rpad(consumer,40,CAST(datetime1 AS CHAR(200))) FROM t1;
rpad(consumer,40,CAST(datetime1 AS CHAR(200)))
苹果2020-09-222020-09-222020-09-222020-09-
小米2020-09-212020-09-212020-09-212020-09-
OPPO2020-08-212020-08-212020-08-212020-0
华为2020-02-292020-02-292020-02-292020-02-
SELECT CAST(rpad(consumer,40,datetime2) AS CHAR(200)) FROM t1;
CAST(rpad(consumer,40,datetime2) AS CHAR(200))
苹果20200923121200202009231212002020092312
小米20200921101159202009211011592020092110
OPPO201908211011592019082110115920190821
华为20200228101159202002281011592020022810
obmysql-rpad-7
#运算符
SELECT rpad(price * 10,20,sal / 21) FROM t1;
rpad(price * 10,20,sal / 21)
65000238.0952238.095
30000190.4762190.476
50000142.8571142.857
91110476.1905476.190
SELECT rpad(price + 1500,20,sal - 1000) FROM t1;
rpad(price + 1500,20,sal - 1000)
80004000400040004000
45003000300030003000
65002000200020002000
10611900090009000900
SELECT rpad(price + 1500 * 10,20,sal - 1000 *20) FROM t1;
rpad(price + 1500 * 10,20,sal - 1000 *20)
21500-15000-15000-15
18000-16000-16000-16
20000-17000-17000-17
24111-10000-10000-10
SELECT rpad(price * 10 - 10000,20,sal / 21 + 1000) FROM t1;
rpad(price * 10 - 10000,20,sal / 21 + 1000)
550001238.09521238.0
200001190.47621190.4
400001142.85711142.8
811101476.19051476.1
SELECT rpad(consumer||price,40,datetime1 || datetime2) FROM t1;
rpad(consumer||price,40,datetime1 || datetime2)
1111111111111111111111111111111111111111
1111111111111111111111111111111111111111
1111111111111111111111111111111111111111
1111111111111111111111111111111111111111
Warnings:
Warning	1292	Truncated incorrect DOUBLE value: '苹果'
Warning	1292	Truncated incorrect DOUBLE value: '小米'
Warning	1292	Truncated incorrect DOUBLE value: 'OPPO'
Warning	1292	Truncated incorrect DOUBLE value: '华为'
SELECT rpad(price,20,sal) FROM t1;
rpad(price,20,sal)
65005000500050005000
30004000400040004000
50003000300030003000
91111000010000100001
SELECT rpad(consumer,40,datetime2) FROM t1;
rpad(consumer,40,datetime2)
苹果20200923121200202009231212002020092312
小米20200921101159202009211011592020092110
OPPO201908211011592019082110115920190821
华为20200228101159202002281011592020022810
SELECT id,sal,datetime1 FROM t1 WHERE rpad(price,20,sal) = 6500;
id	sal	datetime1
SELECT id,sal,datetime1 FROM t1 WHERE rpad(price,20,sal) < 6500;
id	sal	datetime1
SELECT id,sal,datetime1 FROM t1 WHERE rpad(price,20,sal) > 6500;
id	sal	datetime1
1	5000	2020-09-22
2	4000	2020-09-21
3	3000	2020-08-21
4	10000	2020-02-29
SELECT id,sal,datetime1 FROM t1 WHERE rpad(price,20,sal) >= 6500;
id	sal	datetime1
1	5000	2020-09-22
2	4000	2020-09-21
3	3000	2020-08-21
4	10000	2020-02-29
SELECT id,sal,datetime1 FROM t1 WHERE rpad(price,20,sal) <= 6500;
id	sal	datetime1
SELECT id,sal,datetime1 FROM t1 WHERE rpad(price,20,sal) != 6500;
id	sal	datetime1
1	5000	2020-09-22
2	4000	2020-09-21
3	3000	2020-08-21
4	10000	2020-02-29
SELECT id,sal,datetime1 FROM t1 WHERE rpad(price,20,sal) <> 6500;
id	sal	datetime1
1	5000	2020-09-22
2	4000	2020-09-21
3	3000	2020-08-21
4	10000	2020-02-29
SELECT id,sal,datetime1 FROM t1 WHERE rpad(price,20,sal) = 6500 OR  rpad(consumer,40,datetime2) like '%OPPO%';
id	sal	datetime1
3	3000	2020-08-21
SELECT id,sal,datetime1 FROM t1 WHERE rpad(price,20,sal) = 6500 AND rpad(consumer,40,datetime2) like '%苹果%';
id	sal	datetime1
SELECT id,sal,datetime1 FROM t1 WHERE rpad(price,20,sal) = 6500  OR  rpad(consumer,40,datetime2) like '%OPPO%' AND rpad(consumer,40,datetime2) like '%苹果%';
id	sal	datetime1
SELECT LPAD('',10,'') ;
LPAD('',10,'')
NULL
SELECT RPAD('',10,'') ;
RPAD('',10,'')
NULL
drop table t1;
--echo # Clean up users
drop user lina@'%' ;
