drop table if exists t1,t2,t3;
create table t1(i1 int, s1 char(124), d1 datetime(6),i2 int, primary key(i2));
insert into t1 values(NULL,'s1','2013-1-25',1);
insert into t1 values(1,NULL,'2013-1-25',2);
insert into t1 values(1,'s1',NULL,3);
insert into t1 values(NULL,'s1',NULL,4);
insert into t1 values(NULL,NULL,'2013-1-25',5);
insert into t1 values(1,NULL,NULL,6);
insert into t1 values(NULL,NULL,NULL,7);
select * from t1;
i1	s1	d1	i2
NULL	s1	2013-01-25 00:00:00.000000	1
1	NULL	2013-01-25 00:00:00.000000	2
1	s1	NULL	3
NULL	s1	NULL	4
NULL	NULL	2013-01-25 00:00:00.000000	5
1	NULL	NULL	6
NULL	NULL	NULL	7
insert into t1 values(NULL,NULL,'2013-1-26',8);
insert into t1 values(NULL,NULL,NULL,NULL);
ERROR 23000: Column 'i2' cannot be null
insert into t1 values(NULL,NULL,NULL,NULL);
ERROR 23000: Column 'i2' cannot be null
update t1 set i2=1 where i1=NULL and s1=NULL;
select * from t1;
i1	s1	d1	i2
NULL	s1	2013-01-25 00:00:00.000000	1
1	NULL	2013-01-25 00:00:00.000000	2
1	s1	NULL	3
NULL	s1	NULL	4
NULL	NULL	2013-01-25 00:00:00.000000	5
1	NULL	NULL	6
NULL	NULL	NULL	7
NULL	NULL	2013-01-26 00:00:00.000000	8
update t1 set i2=1 where i1=NULL and s1=NULL and d1=NULL;
select * from t1;
i1	s1	d1	i2
NULL	s1	2013-01-25 00:00:00.000000	1
1	NULL	2013-01-25 00:00:00.000000	2
1	s1	NULL	3
NULL	s1	NULL	4
NULL	NULL	2013-01-25 00:00:00.000000	5
1	NULL	NULL	6
NULL	NULL	NULL	7
NULL	NULL	2013-01-26 00:00:00.000000	8
delete from t1 where i1=NULL and s1=NULL and d1=NULL;
delete from t1 where i1=NULL and s1='s1' and d1=NULL;
delete from t1 where i1=1 and s1='s1' and d1=NULL;
select * from t1;
i1	s1	d1	i2
NULL	s1	2013-01-25 00:00:00.000000	1
1	NULL	2013-01-25 00:00:00.000000	2
1	s1	NULL	3
NULL	s1	NULL	4
NULL	NULL	2013-01-25 00:00:00.000000	5
1	NULL	NULL	6
NULL	NULL	NULL	7
NULL	NULL	2013-01-26 00:00:00.000000	8
delete from t1 where i1 is NULL and s1 is NULL and d1 is NULL;
delete from t1 where i1 is NULL and s1='s1' and d1 is NULL;
delete from t1 where i1=1 and s1='s1' and d1 is NULL;
select * from t1;
i1	s1	d1	i2
NULL	s1	2013-01-25 00:00:00.000000	1
1	NULL	2013-01-25 00:00:00.000000	2
NULL	NULL	2013-01-25 00:00:00.000000	5
1	NULL	NULL	6
NULL	NULL	2013-01-26 00:00:00.000000	8
insert into t1 values(NULL,'s2',NULL,10);
insert into t1 values(NULL,'s1',NULL,11);
select * from t1;
i1	s1	d1	i2
NULL	s1	2013-01-25 00:00:00.000000	1
1	NULL	2013-01-25 00:00:00.000000	2
NULL	NULL	2013-01-25 00:00:00.000000	5
1	NULL	NULL	6
NULL	NULL	2013-01-26 00:00:00.000000	8
NULL	s2	NULL	10
NULL	s1	NULL	11
alter system major freeze tenant = sys;
alter system major freeze tenant = all_user;
alter system major freeze tenant = all_meta;
select * from t1;
i1	s1	d1	i2
NULL	s1	2013-01-25 00:00:00.000000	1
1	NULL	2013-01-25 00:00:00.000000	2
NULL	NULL	2013-01-25 00:00:00.000000	5
1	NULL	NULL	6
NULL	NULL	2013-01-26 00:00:00.000000	8
NULL	s2	NULL	10
NULL	s1	NULL	11
select * from t1;
i1	s1	d1	i2
NULL	s1	2013-01-25 00:00:00.000000	1
1	NULL	2013-01-25 00:00:00.000000	2
NULL	NULL	2013-01-25 00:00:00.000000	5
1	NULL	NULL	6
NULL	NULL	2013-01-26 00:00:00.000000	8
NULL	s2	NULL	10
NULL	s1	NULL	11
insert into t1 values(NULL,'s2',NULL,100);
insert into t1 values(NULL,'s1',NULL,101);
insert into t1 values(1,'s1',NULL,102);
select * from t1;
i1	s1	d1	i2
NULL	s1	2013-01-25 00:00:00.000000	1
1	NULL	2013-01-25 00:00:00.000000	2
NULL	NULL	2013-01-25 00:00:00.000000	5
1	NULL	NULL	6
NULL	NULL	2013-01-26 00:00:00.000000	8
NULL	s2	NULL	10
NULL	s1	NULL	11
NULL	s2	NULL	100
NULL	s1	NULL	101
1	s1	NULL	102
alter system major freeze tenant = sys;
alter system major freeze tenant = all_user;
alter system major freeze tenant = all_meta;
select * from t1;
i1	s1	d1	i2
NULL	s1	2013-01-25 00:00:00.000000	1
1	NULL	2013-01-25 00:00:00.000000	2
NULL	NULL	2013-01-25 00:00:00.000000	5
1	NULL	NULL	6
NULL	NULL	2013-01-26 00:00:00.000000	8
NULL	s2	NULL	10
NULL	s1	NULL	11
NULL	s2	NULL	100
NULL	s1	NULL	101
1	s1	NULL	102
select * from t1;
i1	s1	d1	i2
NULL	s1	2013-01-25 00:00:00.000000	1
1	NULL	2013-01-25 00:00:00.000000	2
NULL	NULL	2013-01-25 00:00:00.000000	5
1	NULL	NULL	6
NULL	NULL	2013-01-26 00:00:00.000000	8
NULL	s2	NULL	10
NULL	s1	NULL	11
NULL	s2	NULL	100
NULL	s1	NULL	101
1	s1	NULL	102
insert into t1 values(NULL,'s2',NULL,106);
insert into t1 values(NULL,'s1',NULL,107);
insert into t1 values(1,'s1',NULL,108);
select * from t1;
i1	s1	d1	i2
NULL	s1	2013-01-25 00:00:00.000000	1
1	NULL	2013-01-25 00:00:00.000000	2
NULL	NULL	2013-01-25 00:00:00.000000	5
1	NULL	NULL	6
NULL	NULL	2013-01-26 00:00:00.000000	8
NULL	s2	NULL	10
NULL	s1	NULL	11
NULL	s2	NULL	100
NULL	s1	NULL	101
1	s1	NULL	102
NULL	s2	NULL	106
NULL	s1	NULL	107
1	s1	NULL	108
drop table t1;
