SET timestamp=UNIX_TIMESTAMP('2001-01-01 00:00:00');
drop table if exists t1;
CREATE TABLE t1 (a timestamp(6));
INSERT INTO t1 (a) VALUES (time '10:10:10.999999');
set time_zone ="+8:00";
select * , now() from t1;
a	now()
2001-01-01 10:10:10.999999	2001-01-01 00:00:00
set time_zone ="-8:00";
select * , now() from t1;
a	now()
2000-12-31 18:10:10.999999	2000-12-31 08:00:00
set time_zone ="-0:00";
select * , now() from t1;
a	now()
2001-01-01 02:10:10.999999	2000-12-31 16:00:00
set time_zone ="+0:00";
select * , now() from t1;
a	now()
2001-01-01 02:10:10.999999	2000-12-31 16:00:00
set time_zone ="+8:00";
SET timestamp=UNIX_TIMESTAMP('2001-01-01 12:00:00');
drop table if exists t1;
CREATE TABLE t1 (a timestamp(6));
INSERT INTO t1 (a) VALUES (time '10:10:10.999999');
set time_zone ="+8:00";
select * , now() from t1;
a	now()
2001-01-01 10:10:10.999999	2001-01-01 12:00:00
set time_zone ="-8:00";
select * , now() from t1;
a	now()
2000-12-31 18:10:10.999999	2000-12-31 20:00:00
set time_zone ="-0:00";
select * , now() from t1;
a	now()
2001-01-01 02:10:10.999999	2001-01-01 04:00:00
set time_zone ="+0:00";
select * , now() from t1;
a	now()
2001-01-01 02:10:10.999999	2001-01-01 04:00:00
SET timestamp=UNIX_TIMESTAMP('2001-01-01 18:00:00');
drop table if exists t1;
CREATE TABLE t1 (a timestamp(6));
INSERT INTO t1 (a) VALUES (time '10:10:10.999999');
set time_zone ="+8:00";
select * , now() from t1;
a	now()
2001-01-01 18:10:10.999999	2001-01-02 02:00:00
set time_zone ="-8:00";
select * , now() from t1;
a	now()
2001-01-01 02:10:10.999999	2001-01-01 10:00:00
set time_zone ="-0:00";
select * , now() from t1;
a	now()
2001-01-01 10:10:10.999999	2001-01-01 18:00:00
set time_zone ="+0:00";
select * , now() from t1;
a	now()
2001-01-01 10:10:10.999999	2001-01-01 18:00:00
drop table if exists t3k;
create table t3k(c1 timestamp(6));
set timestamp = 1455486192;
insert into t3k values(time '23:13:30');
select * from t3k;
c1
2016-02-14 23:13:30.000000
drop table if exists t3k;
create table t3k(c1 timestamp(6));
set timestamp = 145549000;
insert into t3k values(time '23:13:30');
select * from t3k;
c1
1974-08-12 23:13:30.000000
drop table if exists t3k;
create table t3k(c1 timestamp(6));
set timestamp = 1455486192;
insert into t3k values(time '23:13:30');
select * , now() from t3k;
c1	now()
2016-02-14 23:13:30.000000	2016-02-14 21:43:12
drop table if exists t3k;
create table t3k(c1 timestamp(6));
set timestamp = 145549000;
insert into t3k values(time '23:13:30');
select *  from t3k;
c1
1974-08-12 23:13:30.000000
drop table if exists t3k;
create table t3k(c1 timestamp(6));
set timestamp = 145549000;
insert into t3k values(time '15:13:30');
select *  from t3k;
c1
1974-08-12 15:13:30.000000
drop table if exists t3k;
create table t3k(c1 timestamp(6));
set timestamp = 1455486192;
insert into t3k values(time '15:13:30');
select * , now() from t3k;
c1	now()
2016-02-14 15:13:30.000000	2016-02-14 21:43:12
drop table t1,t3k;
select CAST(-9223372036854775808 AS TIME);
CAST(-9223372036854775808 AS TIME)
-838:59:59
set time_zone = '+8:00';
create table t1(c1 timestamp);
insert into t1 values('9999-12-30 15:00:00');
insert into t1 values('9999-12-30 20:20:20');
insert into t1 values('9999-12-30 23:59:59');
insert into t1 values('9999-12-31 00:00:00');
insert into t1 values('9999-12-31 00:00:01');
insert into t1 values('9999-12-31 05:22:33');
insert into t1 values('9999-12-31 07:59:59');
insert into t1 values('9999-12-31 08:00:00');
insert into t1 values('9999-12-31 08:22:33');
insert into t1 values('9999-12-31 12:12:12');
insert into t1 values('9999-12-31 16:45:56');
insert into t1 values('9999-12-31 23:00:00');
insert into t1 values('9999-12-31 23:59:59');
insert into t1 values('10000-01-01 00:00:00');
ERROR 22007: Incorrect datetime value for column 'c1' at row 1
select * from t1;
c1
9999-12-30 15:00:00
9999-12-30 20:20:20
9999-12-30 23:59:59
9999-12-31 00:00:00
9999-12-31 00:00:01
9999-12-31 05:22:33
9999-12-31 07:59:59
9999-12-31 08:00:00
9999-12-31 08:22:33
9999-12-31 12:12:12
9999-12-31 16:45:56
9999-12-31 23:00:00
9999-12-31 23:59:59
set time_zone = '+12:00';
select * from t1;
ERROR HY000: Datetime/Interval internal error
set time_zone = '+0:00';
delete from t1;
insert into t1 values('9999-12-30 15:00:00');
insert into t1 values('9999-12-30 20:20:20');
insert into t1 values('9999-12-30 23:59:59');
insert into t1 values('9999-12-31 00:00:00');
insert into t1 values('9999-12-31 00:00:01');
insert into t1 values('9999-12-31 05:22:33');
insert into t1 values('9999-12-31 07:59:59');
insert into t1 values('9999-12-31 08:00:00');
insert into t1 values('9999-12-31 08:22:33');
insert into t1 values('9999-12-31 12:12:12');
insert into t1 values('9999-12-31 16:45:56');
insert into t1 values('9999-12-31 23:00:00');
insert into t1 values('9999-12-31 23:59:59');
insert into t1 values('10000-01-01 00:00:00');
ERROR 22007: Incorrect datetime value for column 'c1' at row 1
select * from t1;
c1
9999-12-30 15:00:00
9999-12-30 20:20:20
9999-12-30 23:59:59
9999-12-31 00:00:00
9999-12-31 00:00:01
9999-12-31 05:22:33
9999-12-31 07:59:59
9999-12-31 08:00:00
9999-12-31 08:22:33
9999-12-31 12:12:12
9999-12-31 16:45:56
9999-12-31 23:00:00
9999-12-31 23:59:59
set time_zone = '+12:00';
select * from t1;
ERROR HY000: Datetime/Interval internal error
set time_zone = '+8:00';
