DROP TABLE IF EXISTS t, t1, t2;
SET NAMES utf8mb4;
SET SQL_MODE='';
set timestamp = 1600000000;
#
# Testing functions CURRENT_TIME and CURRENT_TIMESTAMP
#
SELECT CURRENT_TIME(6) RLIKE '^[0-9]{2}:[0-9]{2}:[0-9]{2}.[0-9]{6}$';
CURRENT_TIME(6) RLIKE '^[0-9]{2}:[0-9]{2}:[0-9]{2}.[0-9]{6}$'
1
SELECT CURRENT_TIMESTAMP(6) RLIKE '^[0-9]{4}-[0-9]{2}-[0-9]{2} [0-9]{2}:[0-9]{2}:[0-9]{2}.[0-9]{6}$';
CURRENT_TIMESTAMP(6) RLIKE '^[0-9]{4}-[0-9]{2}-[0-9]{2} [0-9]{2}:[0-9]{2}:[0-9]{2}.[0-9]{6}$'
1
SELECT CURRENT_TIMESTAMP(6)=NOW(6);
CURRENT_TIMESTAMP(6)=NOW(6)
1
SELECT CURRENT_TIMESTAMP(6)=LOCALTIME(6);
CURRENT_TIMESTAMP(6)=LOCALTIME(6)
1
SELECT CURRENT_TIMESTAMP(6)=LOCALTIMESTAMP(6);
CURRENT_TIMESTAMP(6)=LOCALTIMESTAMP(6)
1
#
# Testing rounding from VARCHAR and TIME(6) to TIME(N)
#
CREATE TABLE t1 (a VARCHAR(32),t6 TIME(6), t5 TIME(5), t4 TIME(4), t3 TIME(3), t2 TIME(2), t1 TIME(1), t0 TIME);
INSERT INTO t1 (a) VALUES ('10:10:10.999999');
INSERT INTO t1 (a) VALUES ('10:10:10.999994');
INSERT INTO t1 (a) VALUES ('10:10:10.999949');
INSERT INTO t1 (a) VALUES ('10:10:10.999499');
INSERT INTO t1 (a) VALUES ('10:10:10.994999');
INSERT INTO t1 (a) VALUES ('10:10:10.949999');
INSERT INTO t1 (a) VALUES ('10:10:10.499999');
UPDATE t1 SET t0=a, t1=a, t2=a, t3=a, t4=a, t5=a, t6=a;
SELECT * FROM t1 order by a;
a	t6	t5	t4	t3	t2	t1	t0
10:10:10.499999	10:10:10.499999	10:10:10.50000	10:10:10.5000	10:10:10.500	10:10:10.50	10:10:10.5	10:10:10
10:10:10.949999	10:10:10.949999	10:10:10.95000	10:10:10.9500	10:10:10.950	10:10:10.95	10:10:10.9	10:10:11
10:10:10.994999	10:10:10.994999	10:10:10.99500	10:10:10.9950	10:10:10.995	10:10:10.99	10:10:11.0	10:10:11
10:10:10.999499	10:10:10.999499	10:10:10.99950	10:10:10.9995	10:10:10.999	10:10:11.00	10:10:11.0	10:10:11
10:10:10.999949	10:10:10.999949	10:10:10.99995	10:10:10.9999	10:10:11.000	10:10:11.00	10:10:11.0	10:10:11
10:10:10.999994	10:10:10.999994	10:10:10.99999	10:10:11.0000	10:10:11.000	10:10:11.00	10:10:11.0	10:10:11
10:10:10.999999	10:10:10.999999	10:10:11.00000	10:10:11.0000	10:10:11.000	10:10:11.00	10:10:11.0	10:10:11
DROP TABLE t1;
#
# Testing rounding from TIME(N) to INT
#
CREATE TABLE t1 (a INT, b TIME(6));
INSERT INTO t1 (b) VALUES ('10:10:59.500000');
INSERT INTO t1 (b) VALUES ('10:10:10.500000');
INSERT INTO t1 (b) VALUES ('10:10:10.499999');
INSERT INTO t1 (b) VALUES ('-10:10:59.500000');
INSERT INTO t1 (b) VALUES ('-10:10:10.500000');
INSERT INTO t1 (b) VALUES ('-10:10:10.499999');
UPDATE t1 SET a=b;
SELECT * FROM t1 order by a;
a	b
-101059	-10:10:59.500000
-101010	-10:10:10.500000
-101010	-10:10:10.499999
101010	10:10:10.500000
101010	10:10:10.499999
101059	10:10:59.500000
DROP TABLE t1;
CREATE TABLE t1 (a INT);
INSERT INTO t1 VALUES (TIME'01:59:59.499999');
INSERT INTO t1 VALUES (TIME'01:59:59.500000');
SELECT * FROM t1 order by a;
a
15959
15959
DROP TABLE t1;
#
# Inserting TIME into a REAL column
#
CREATE TABLE t1 (a REAL);
INSERT INTO t1 VALUES (TIME'01:02:03.123');
SELECT * FROM t1;
a
10203.123
DROP TABLE t1;
#
# Testing rounding when altering TIME(N) to a smaller size
#
CREATE TABLE t1 (a TIME(6));
INSERT INTO t1 VALUES ('10:10:10.999999');
ALTER TABLE t1 MODIFY a TIME(5);
SELECT * FROM t1;
a
10:10:11.00000
DROP TABLE t1;
CREATE TABLE t1 (a TIME(6));
INSERT INTO t1 VALUES ('10:10:10.999999');
ALTER TABLE t1 MODIFY a TIME;
SELECT * FROM t1;
a
10:10:11
DROP TABLE t1;
#
# Testing rounding from DATETIME(6) to TIME(N)
#
CREATE TABLE t1 (a DATETIME(6), t6 TIME(6), t5 TIME(5), t4 TIME(4), t3 TIME(3), t2 TIME(2), t1 TIME(1), t0 TIME);
INSERT INTO t1 (a) VALUES ('2001-01-01 10:10:10.999999');
INSERT INTO t1 (a) VALUES ('2001-01-01 10:10:10.999994');
INSERT INTO t1 (a) VALUES ('2001-01-01 10:10:10.999949');
INSERT INTO t1 (a) VALUES ('2001-01-01 10:10:10.999499');
INSERT INTO t1 (a) VALUES ('2001-01-01 10:10:10.994999');
INSERT INTO t1 (a) VALUES ('2001-01-01 10:10:10.949999');
INSERT INTO t1 (a) VALUES ('2001-01-01 10:10:10.499999');
UPDATE t1 SET t0=a, t1=a, t2=a, t3=a, t4=a, t5=a, t6=a;
SELECT * FROM t1 order by a;
a	t6	t5	t4	t3	t2	t1	t0
2001-01-01 10:10:10.499999	10:10:10.499999	10:10:10.50000	10:10:10.5000	10:10:10.500	10:10:10.50	10:10:10.5	10:10:10
2001-01-01 10:10:10.949999	10:10:10.949999	10:10:10.95000	10:10:10.9500	10:10:10.950	10:10:10.95	10:10:10.9	10:10:11
2001-01-01 10:10:10.994999	10:10:10.994999	10:10:10.99500	10:10:10.9950	10:10:10.995	10:10:10.99	10:10:11.0	10:10:11
2001-01-01 10:10:10.999499	10:10:10.999499	10:10:10.99950	10:10:10.9995	10:10:10.999	10:10:11.00	10:10:11.0	10:10:11
2001-01-01 10:10:10.999949	10:10:10.999949	10:10:10.99995	10:10:10.9999	10:10:11.000	10:10:11.00	10:10:11.0	10:10:11
2001-01-01 10:10:10.999994	10:10:10.999994	10:10:10.99999	10:10:11.0000	10:10:11.000	10:10:11.00	10:10:11.0	10:10:11
2001-01-01 10:10:10.999999	10:10:10.999999	10:10:11.00000	10:10:11.0000	10:10:11.000	10:10:11.00	10:10:11.0	10:10:11
DROP TABLE t1;
#
# Testing rounding from DECIMAL and DOUBLE to TIME(N)
#
CREATE TABLE t1 (a DECIMAL(30,6), t6 TIME(6), t5 TIME(5), t4 TIME(4), t3 TIME(3), t2 TIME(2), t1 TIME(1),t0 TIME);
INSERT INTO t1 (a) VALUES (101010.999999);
INSERT INTO t1 (a) VALUES (101010.999994);
INSERT INTO t1 (a) VALUES (101010.999949);
INSERT INTO t1 (a) VALUES (101010.999499);
INSERT INTO t1 (a) VALUES (101010.994999);
INSERT INTO t1 (a) VALUES (101010.949999);
INSERT INTO t1 (a) VALUES (101010.499999);
UPDATE t1 SET t0=a, t1=a, t2=a, t3=a, t4=a, t5=a, t6=a;
SELECT * FROM t1 order by a;
a	t6	t5	t4	t3	t2	t1	t0
101010.499999	10:10:10.499999	10:10:10.50000	10:10:10.5000	10:10:10.500	10:10:10.50	10:10:10.5	10:10:10
101010.949999	10:10:10.949999	10:10:10.95000	10:10:10.9500	10:10:10.950	10:10:10.95	10:10:10.9	10:10:11
101010.994999	10:10:10.994999	10:10:10.99500	10:10:10.9950	10:10:10.995	10:10:10.99	10:10:11.0	10:10:11
101010.999499	10:10:10.999499	10:10:10.99950	10:10:10.9995	10:10:10.999	10:10:11.00	10:10:11.0	10:10:11
101010.999949	10:10:10.999949	10:10:10.99995	10:10:10.9999	10:10:11.000	10:10:11.00	10:10:11.0	10:10:11
101010.999994	10:10:10.999994	10:10:10.99999	10:10:11.0000	10:10:11.000	10:10:11.00	10:10:11.0	10:10:11
101010.999999	10:10:10.999999	10:10:11.00000	10:10:11.0000	10:10:11.000	10:10:11.00	10:10:11.0	10:10:11
DROP TABLE t1;
#
# Testing rounding when casting from DECIMAL to TIME(N)
#
CREATE TABLE t1 (a DECIMAL(23,4));
INSERT INTO t1 VALUES (NULL),(101010.9999),(-101010.9999);
INSERT INTO t1 VALUES (9999999999999999999999.1), (999999.1);
SELECT a, CAST(a AS TIME) FROM t1 order by a;
a	CAST(a AS TIME)
NULL	NULL
-101010.9999	-10:10:11
101010.9999	10:10:11
999999.1000	NULL
9999999999999999999.9999	NULL
DROP TABLE t1;
#
# Testing that CAST converts days to hours, while EXTRACT/HOUR do not
#
SELECT CAST('1 00:00:00' as TIME), EXTRACT(HOUR FROM '1 00:00:00');
CAST('1 00:00:00' as TIME)	EXTRACT(HOUR FROM '1 00:00:00')
24:00:00	24
CREATE TABLE t1 (a VARCHAR(30));
INSERT INTO t1 VALUES ('1 00:00:00');
SELECT CAST(a AS TIME), EXTRACT(HOUR FROM a) FROM t1 order by a;
CAST(a AS TIME)	EXTRACT(HOUR FROM a)
24:00:00	24
DROP TABLE t1;
#
# Testing rounding with CAST
#
CREATE TABLE t1 (a TIME(6));
INSERT INTO t1 VALUES ('10:10:10.999999');
INSERT INTO t1 VALUES ('10:10:10.999998');
INSERT INTO t1 VALUES ('10:10:10.999997');
INSERT INTO t1 VALUES ('10:10:10.999996');
INSERT INTO t1 VALUES ('10:10:10.999995');
INSERT INTO t1 VALUES ('10:10:10.999994');
INSERT INTO t1 VALUES ('10:10:10.999993');
INSERT INTO t1 VALUES ('10:10:10.999992');
INSERT INTO t1 VALUES ('10:10:10.999991');
INSERT INTO t1 VALUES ('10:10:10.999990');
SELECT a, CAST(a AS TIME) FROM t1 order by a;
a	CAST(a AS TIME)
10:10:10.999990	10:10:11
10:10:10.999991	10:10:11
10:10:10.999992	10:10:11
10:10:10.999993	10:10:11
10:10:10.999994	10:10:11
10:10:10.999995	10:10:11
10:10:10.999996	10:10:11
10:10:10.999997	10:10:11
10:10:10.999998	10:10:11
10:10:10.999999	10:10:11
UPDATE t1 SET a=-a;
SELECT a, CAST(a AS TIME) FROM t1 order by a;
a	CAST(a AS TIME)
-10:10:10.999999	-10:10:11
-10:10:10.999998	-10:10:11
-10:10:10.999997	-10:10:11
-10:10:10.999996	-10:10:11
-10:10:10.999995	-10:10:11
-10:10:10.999994	-10:10:11
-10:10:10.999993	-10:10:11
-10:10:10.999992	-10:10:11
-10:10:10.999991	-10:10:11
-10:10:10.999990	-10:10:11
DROP TABLE t1;
#
# Testing that TIME(0) is a synonym to non-fractional TIME
#
CREATE TABLE t1 (a TIME(0) NOT NULL);
SHOW CREATE TABLE t1;
Table	Create Table
t1	CREATE TABLE `t1` (
  `a` time NOT NULL
) ORGANIZATION INDEX DEFAULT CHARSET = utf8mb4 COMPRESSION = 'lz4_1.0' REPLICA_NUM = 1 BLOCK_SIZE = 16384 USE_BLOOM_FILTER = FALSE ENABLE_MACRO_BLOCK_BLOOM_FILTER = FALSE TABLET_SIZE = 134217728 PCTFREE = 10
DROP TABLE t1;
#
# Testing bad FSPs
#
CREATE TABLE t1 (a TIME(-1));
ERROR 42000: You have an error in your SQL syntax; check the manual that corresponds to your OceanBase version for the right syntax to use near '-1))' at line 1
CREATE TABLE t1 (a TIME(7));
ERROR 42000: Too big precision 7 specified for column 'a'. Maximum is 6.
CREATE TABLE t1 (a TIME(31));
ERROR 42000: Too big precision 31 specified for column 'a'. Maximum is 6.
#
# Testing bad FSPs with TIME functions
#
SELECT CURTIME(-1);
ERROR 42000: You have an error in your SQL syntax; check the manual that corresponds to your OceanBase version for the right syntax to use near '-1)' at line 1
SELECT CURTIME(7);
ERROR 42000: Too big precision 7 specified for column 'current_time'. Maximum is 6.
SELECT CURTIME(31);
ERROR 42000: Too big precision 31 specified for column 'current_time'. Maximum is 6.
#
# Testing INSERT, ORDER, KEY, BETWEEN, comparison
#
CREATE TABLE t1 (a TIME(6) NOT NULL);
INSERT INTO t1 VALUES ('-838:59:59.000000');
INSERT INTO t1 VALUES ('-01:00:00.999999');
INSERT INTO t1 VALUES ('-01:00:00.000001');
INSERT INTO t1 VALUES ('-01:00:00.000000');
INSERT INTO t1 VALUES ('-00:00:00.000001');
INSERT INTO t1 VALUES ('00:00:00.000000');
INSERT INTO t1 VALUES ('23:59:59.999999');
INSERT INTO t1 VALUES ('01:02:03');
INSERT INTO t1 VALUES ('01:02:03.4');
INSERT INTO t1 VALUES ('01:02:03.45');
INSERT INTO t1 VALUES ('01:02:03.456');
INSERT INTO t1 VALUES ('01:02:03.4567');
INSERT INTO t1 VALUES ('01:02:03.45678');
INSERT INTO t1 VALUES ('01:02:03.4567891');
INSERT INTO t1 VALUES ('838:59:59.000000');
SELECT * FROM t1;
a
-838:59:59.000000
-01:00:00.999999
-01:00:00.000001
-01:00:00.000000
-00:00:00.000001
00:00:00.000000
23:59:59.999999
01:02:03.000000
01:02:03.400000
01:02:03.450000
01:02:03.456000
01:02:03.456700
01:02:03.456780
01:02:03.456789
838:59:59.000000
SELECT * FROM t1 ORDER BY a DESC;
a
838:59:59.000000
23:59:59.999999
01:02:03.456789
01:02:03.456780
01:02:03.456700
01:02:03.456000
01:02:03.450000
01:02:03.400000
01:02:03.000000
00:00:00.000000
-00:00:00.000001
-01:00:00.000000
-01:00:00.000001
-01:00:00.999999
-838:59:59.000000
SELECT * FROM t1 WHERE a='01:02:03.45';
a
01:02:03.450000
SELECT * FROM t1 WHERE a='01:02:03.4567';
a
01:02:03.456700
SELECT * FROM t1 WHERE a='01:02:03.45670';
a
01:02:03.456700
SELECT * FROM t1 WHERE a='01:02:03.456700';
a
01:02:03.456700
SELECT * FROM t1 WHERE a BETWEEN '01:02:00' AND '01:03:00';
a
01:02:03.000000
01:02:03.400000
01:02:03.450000
01:02:03.456000
01:02:03.456700
01:02:03.456780
01:02:03.456789
SELECT * FROM t1 WHERE a BETWEEN TIME'01:02:03.456' AND TIME'01:02:03.45678';
a
01:02:03.456000
01:02:03.456700
01:02:03.456780
ALTER TABLE t1 ADD KEY(a);
SELECT * FROM t1 ORDER BY a;
a
-838:59:59.000000
-01:00:00.999999
-01:00:00.000001
-01:00:00.000000
-00:00:00.000001
00:00:00.000000
01:02:03.000000
01:02:03.400000
01:02:03.450000
01:02:03.456000
01:02:03.456700
01:02:03.456780
01:02:03.456789
23:59:59.999999
838:59:59.000000
SELECT * FROM t1 ORDER BY a DESC;
a
838:59:59.000000
23:59:59.999999
01:02:03.456789
01:02:03.456780
01:02:03.456700
01:02:03.456000
01:02:03.450000
01:02:03.400000
01:02:03.000000
00:00:00.000000
-00:00:00.000001
-01:00:00.000000
-01:00:00.000001
-01:00:00.999999
-838:59:59.000000
SELECT * FROM t1 WHERE a='01:02:03.456700';
a
01:02:03.456700
SELECT * FROM t1 WHERE a BETWEEN '01:02:00' AND '01:03:00';
a
01:02:03.000000
01:02:03.400000
01:02:03.450000
01:02:03.456000
01:02:03.456700
01:02:03.456780
01:02:03.456789
SELECT * FROM t1 WHERE a BETWEEN TIME'01:02:03.456' AND TIME'01:02:03.45678';
a
01:02:03.456000
01:02:03.456700
01:02:03.456780
DROP TABLE t1;
#
# Testing TIME with days
#
CREATE TABLE t1 (a TIME(6));
INSERT INTO t1 VALUES ('00:00:00');
INSERT INTO t1 VALUES ('-24:00:00'), ('24:00:00');
INSERT INTO t1 VALUES ('-1 00:00:00'), ('1 00:00:00');
INSERT INTO t1 VALUES ('-10 00:00:00'), ('10 00:00:00');
SELECT * FROM t1 ORDER BY a;
a
-240:00:00.000000
-24:00:00.000000
-24:00:00.000000
00:00:00.000000
24:00:00.000000
24:00:00.000000
240:00:00.000000
DROP TABLE t1;
#
# Testing rare formats
#
CREATE TABLE t1 (a TIME(6));
INSERT INTO t1 VALUES (1122), ('1:2:3'), ('112233'),('-00:00:00'),('-00:00:00.000000');
SELECT * FROM t1 ORDER BY a;
a
00:00:00.000000
00:00:00.000000
00:11:22.000000
01:02:03.000000
11:22:33.000000
DROP TABLE t1;
#
# Testing bad values
#
CREATE TABLE t1 (a TIME(6));
INSERT INTO t1 VALUES (106060);
INSERT INTO t1 VALUES (106060.0);
INSERT INTO t1 VALUES (106060e0);
INSERT INTO t1 VALUES ('106060');
SELECT * FROM t1;
a
00:00:00.000000
00:00:00.000000
00:00:00.000000
00:00:00.000000
DROP TABLE t1;
#
# Testing bad values with TRADITIONAL mode
#
SET SQL_MODE='strict_all_tables';
CREATE TABLE t1 (a TIME(6));
INSERT INTO t1 VALUES (106060);
ERROR 22007: Incorrect datetime value for column 'a' at row 1
INSERT INTO t1 VALUES (106060.0);
ERROR 22007: Incorrect datetime value for column 'a' at row 1
INSERT INTO t1 VALUES (106060e0);
ERROR 22007: Incorrect datetime value for column 'a' at row 1
INSERT INTO t1 VALUES ('106060');
ERROR 22007: Incorrect datetime value for column 'a' at row 1
INSERT INTO t1 VALUES ('838:59:59.0000009');
ERROR 22007: Incorrect value
INSERT INTO t1 VALUES ('-838:59:59.0000009');
ERROR 22007: Incorrect value
INSERT INTO t1 VALUES (CAST(0xFFFFFFFF00000000 AS SIGNED));
ERROR 22007: Incorrect datetime value for column 'a' at row 1
SELECT * FROM t1;
a
DROP TABLE t1;
SET SQL_MODE='';
#
# Testing rounding
#
CREATE TABLE t1 (a TIME(6));
INSERT INTO t1 VALUES (105959.1234567);
INSERT INTO t1 VALUES ('00:00:00.1111110');
INSERT INTO t1 VALUES ('00:00:00.1111111');
INSERT INTO t1 VALUES ('00:00:00.1111114');
INSERT INTO t1 VALUES ('00:00:00.1111115');
INSERT INTO t1 VALUES ('00:00:00.1111119');
SELECT * FROM t1;
a
10:59:59.123457
00:00:00.111111
00:00:00.111111
00:00:00.111111
00:00:00.111112
00:00:00.111112
DELETE FROM t1;
INSERT INTO t1 VALUES (0.1111110);
INSERT INTO t1 VALUES (0.1111111);
INSERT INTO t1 VALUES (0.1111114);
INSERT INTO t1 VALUES (0.1111115);
INSERT INTO t1 VALUES (0.1111119);
SELECT * FROM t1;
a
00:00:00.111111
00:00:00.111111
00:00:00.111111
00:00:00.111112
00:00:00.111112
DELETE FROM t1;
INSERT INTO t1 VALUES (0.1111110e0);
INSERT INTO t1 VALUES (0.1111111e0);
INSERT INTO t1 VALUES (0.1111114e0);
INSERT INTO t1 VALUES (0.1111115e0);
INSERT INTO t1 VALUES (0.1111119e0);
SELECT * FROM t1;
a
00:00:00.111111
00:00:00.111111
00:00:00.111111
00:00:00.111112
00:00:00.111112
DROP TABLE t1;
SET SQL_MODE='';
#
# Testing truncation warnings
#
CREATE TABLE t1 (a TIME(6));
INSERT INTO t1 VALUES ('00:00:00.111111 xxx');
SELECT * FROM t1;
a
00:00:00.111111
DROP TABLE t1;
#
# Testing IN
#
CREATE TABLE t1 (a TIME(6));
INSERT INTO t1 VALUES ('-99:00:00.000000');
INSERT INTO t1 VALUES ('-99:00:00.000001');
INSERT INTO t1 VALUES ('-99:00:00.000002');
INSERT INTO t1 VALUES ('-00:00:00.000001');
INSERT INTO t1 VALUES ('-00:00:00.000002');
INSERT INTO t1 VALUES ('00:00:00.000000');
INSERT INTO t1 VALUES ('00:00:00.000001');
INSERT INTO t1 VALUES ('00:00:00.000002');
INSERT INTO t1 VALUES ('10:00:00.000000');
INSERT INTO t1 VALUES ('10:00:00.000001');
INSERT INTO t1 VALUES ('10:00:00.000002');
INSERT INTO t1 VALUES ('99:00:00.000000');
INSERT INTO t1 VALUES ('99:00:00.000001');
INSERT INTO t1 VALUES ('99:00:00.000002');
SELECT * FROM t1 WHERE a IN ('00:00:00', '-99:00:00.000001', '99:00:00.000002');
a
-99:00:00.000001
00:00:00.000000
99:00:00.000002
SELECT * FROM t1 WHERE a IN (0, -990000, 990000);
a
-99:00:00.000000
00:00:00.000000
99:00:00.000000
SELECT * FROM t1 WHERE a IN (0.000001, -990000.000001, 990000.000001);
a
-99:00:00.000001
00:00:00.000001
99:00:00.000001
#
# Testing Item_temporal_with_ref::print
#
#
# Testing IN with index: field->store_packed
#
ALTER TABLE t1 ADD KEY(a);
SELECT * FROM t1 WHERE a IN ('00:00:00', '-99:00:00.000001', '99:00:00.000002');
a
-99:00:00.000001
00:00:00.000000
99:00:00.000002
SELECT * FROM t1 WHERE a IN (0, -990000, 990000);
a
-99:00:00.000000
00:00:00.000000
99:00:00.000000
SELECT * FROM t1 WHERE a IN (0.000001, -990000.000001, 990000.000001);
a
-99:00:00.000001
00:00:00.000001
99:00:00.000001
DROP TABLE t1;
#
# Testing CREATE TABLE LIKE
#
CREATE TABLE t1 (a TIME(6));
CREATE TABLE t2 LIKE t1;
SHOW CREATE TABLE t2;
Table	Create Table
t2	CREATE TABLE `t2` (
  `a` time(6) DEFAULT NULL
) ORGANIZATION INDEX DEFAULT CHARSET = utf8mb4 COMPRESSION = 'lz4_1.0' REPLICA_NUM = 1 BLOCK_SIZE = 16384 USE_BLOOM_FILTER = FALSE ENABLE_MACRO_BLOCK_BLOOM_FILTER = FALSE TABLET_SIZE = 134217728 PCTFREE = 10
DROP TABLE t2, t1;
#
# Testing JOIN between TIME(6) and TIME(6)
#
CREATE TABLE t1 (a TIME(6));
INSERT INTO t1 VALUES ('00:01:03.1');
INSERT INTO t1 VALUES ('00:01:03.12');
INSERT INTO t1 VALUES ('00:01:03.123');
INSERT INTO t1 VALUES ('00:01:03.1234');
INSERT INTO t1 VALUES ('00:01:03.12345');
INSERT INTO t1 VALUES ('00:01:03.123456');
CREATE TABLE t2 (a TIME(6));
INSERT INTO t2 VALUES ('00:01:03.1');
INSERT INTO t2 VALUES ('00:01:03.12');
INSERT INTO t2 VALUES ('00:01:03.123');
INSERT INTO t2 VALUES ('00:01:03.1234');
INSERT INTO t2 VALUES ('00:01:03.12345');
INSERT INTO t2 VALUES ('00:01:03.123456');
SELECT * FROM t1, t2 WHERE t1.a=t2.a ORDER BY t1.a, t2.a;
a	a
00:01:03.100000	00:01:03.100000
00:01:03.120000	00:01:03.120000
00:01:03.123000	00:01:03.123000
00:01:03.123400	00:01:03.123400
00:01:03.123450	00:01:03.123450
00:01:03.123456	00:01:03.123456
ALTER TABLE t1 ADD KEY(a);
SELECT * FROM t1, t2 WHERE t1.a=t2.a ORDER BY t1.a, t2.a;
a	a
00:01:03.100000	00:01:03.100000
00:01:03.120000	00:01:03.120000
00:01:03.123000	00:01:03.123000
00:01:03.123400	00:01:03.123400
00:01:03.123450	00:01:03.123450
00:01:03.123456	00:01:03.123456
ALTER TABLE t2 ADD KEY(a);
SELECT * FROM t1, t2 WHERE t1.a=t2.a ORDER BY t1.a, t2.a;
a	a
00:01:03.100000	00:01:03.100000
00:01:03.120000	00:01:03.120000
00:01:03.123000	00:01:03.123000
00:01:03.123400	00:01:03.123400
00:01:03.123450	00:01:03.123450
00:01:03.123456	00:01:03.123456
ALTER TABLE t1 DROP KEY a;
SELECT * FROM t1, t2 WHERE t1.a=t2.a ORDER BY t1.a, t2.a;
a	a
00:01:03.100000	00:01:03.100000
00:01:03.120000	00:01:03.120000
00:01:03.123000	00:01:03.123000
00:01:03.123400	00:01:03.123400
00:01:03.123450	00:01:03.123450
00:01:03.123456	00:01:03.123456
DROP TABLE t2;
DROP TABLE t1;
#
# Testing JOIN between TIME and TIME(6)
#
CREATE TABLE t1 (a TIME(6));
INSERT INTO t1 VALUES ('-836:59:59.000000');
INSERT INTO t1 VALUES ('10:11:12.000000');
INSERT INTO t1 VALUES ('10:11:12.000001');
INSERT INTO t1 VALUES ('10:11:12.000002');
INSERT INTO t1 VALUES ('10:11:13.000000');
INSERT INTO t1 VALUES ('10:11:13.000001');
INSERT INTO t1 VALUES ('10:11:13.000002');
INSERT INTO t1 VALUES ('835:59:59.999999');
INSERT INTO t1 VALUES ('836:59:59.000000');
CREATE TABLE t2 (a TIME);
INSERT INTO t2 VALUES ('10:11:12');
INSERT INTO t2 VALUES ('10:11:13');
INSERT INTO t2 VALUES ('-836:59:59');
INSERT INTO t2 VALUES ('836:59:59');
SELECT * FROM t1, t2 WHERE t1.a=t2.a ORDER BY t1.a, t2.a;
a	a
-836:59:59.000000	-836:59:59
10:11:12.000000	10:11:12
10:11:13.000000	10:11:13
836:59:59.000000	836:59:59
ALTER TABLE t1 ADD KEY(a);
ALTER TABLE t2 ADD KEY(a);
SELECT * FROM t1, t2 WHERE t1.a=t2.a ORDER BY t1.a, t2.a;
a	a
-836:59:59.000000	-836:59:59
10:11:12.000000	10:11:12
10:11:13.000000	10:11:13
836:59:59.000000	836:59:59
DROP TABLE t2, t1;
#
# Testing unique index
#
CREATE TABLE t1 (a TIME(6), UNIQUE(a));
INSERT INTO t1 VALUES ('00:01:02');
INSERT INTO t1 VALUES ('00:01:02.1');
INSERT INTO t1 VALUES ('00:01:02.12');
INSERT INTO t1 VALUES ('00:01:02.123');
INSERT INTO t1 VALUES ('00:01:02.1234');
INSERT INTO t1 VALUES ('00:01:02.12345');
INSERT INTO t1 VALUES ('00:01:02.12345');
ERROR 23000: Duplicate entry '00:01:02.123450' for key 'a'
DROP TABLE t1;
#
# Testing GROUP BY
#
CREATE TABLE t1 (a TIME(6));
INSERT INTO t1 VALUES ('00:01:02');
INSERT INTO t1 VALUES ('00:01:02.0');
INSERT INTO t1 VALUES ('00:01:02.01');
INSERT INTO t1 VALUES ('00:01:02.010');
INSERT INTO t1 VALUES ('00:01:02.02');
INSERT INTO t1 VALUES ('00:01:02.020');
SELECT a, COUNT(*) FROM t1 GROUP BY a;
a	COUNT(*)
00:01:02.000000	2
00:01:02.010000	2
00:01:02.020000	2
DROP TABLE t1;
#
# Testing MIN() and MAX()
#
CREATE TABLE t1 (a INT, b TIME(6));
INSERT INTO t1 VALUES (1, '00:01:02.000001');
INSERT INTO t1 VALUES (1, '00:01:02');
INSERT INTO t1 VALUES (2, '10:01:02');
INSERT INTO t1 VALUES (2, '10:01:02.000001');
INSERT INTO t1 VALUES (3, '10:11:02');
INSERT INTO t1 VALUES (3, '10:11:02.000001');
SELECT MIN(b), MAX(b) FROM t1;
MIN(b)	MAX(b)
00:01:02.000000	10:11:02.000001
SELECT a, MIN(b), MAX(b) FROM t1 GROUP BY a;
a	MIN(b)	MAX(b)
1	00:01:02.000000	00:01:02.000001
2	10:01:02.000000	10:01:02.000001
3	10:11:02.000000	10:11:02.000001
UPDATE t1 SET b=-b;
SELECT MIN(b), MAX(b) FROM t1;
MIN(b)	MAX(b)
-10:11:02.000001	-00:01:02.000000
SELECT a, MIN(b), MAX(b) FROM t1 GROUP BY a;
a	MIN(b)	MAX(b)
1	-00:01:02.000001	-00:01:02.000000
2	-10:01:02.000001	-10:01:02.000000
3	-10:11:02.000001	-10:11:02.000000
DROP TABLE t1;
#
# Testing integer INSERT value
#
CREATE TABLE t1 (a TIME(6));
INSERT INTO t1 VALUES (20203);
INSERT INTO t1 VALUES (8385959);
INSERT INTO t1 VALUES (8390000);
INSERT INTO t1 VALUES (-8385959);
INSERT INTO t1 VALUES (-8390000);
SELECT * FROM t1;
a
02:02:03.000000
838:59:59.000000
838:59:59.000000
-838:59:59.000000
-838:59:59.000000
DROP TABLE t1;
#
# Testing decimal INSERT values
#
CREATE TABLE t1 (a TIME(6));
INSERT INTO t1 VALUES (20203.4);
INSERT INTO t1 VALUES (20203.45);
INSERT INTO t1 VALUES (20203.456);
INSERT INTO t1 VALUES (20203.4567);
INSERT INTO t1 VALUES (20203.45678);
INSERT INTO t1 VALUES (20203.456789);
INSERT INTO t1 VALUES (20203.4567894);
INSERT INTO t1 VALUES (20203.4567895);
INSERT INTO t1 VALUES (20203.4567896);
INSERT INTO t1 VALUES (20203.456789678);
INSERT INTO t1 VALUES (8385959.999999);
INSERT INTO t1 VALUES (8385959.000000);
INSERT INTO t1 VALUES (8385959.0000001);
INSERT INTO t1 VALUES (8385959.0000002);
INSERT INTO t1 VALUES (8385959.0000003);
INSERT INTO t1 VALUES (8385959.0000004);
INSERT INTO t1 VALUES (8385959.0000005);
INSERT INTO t1 VALUES (8385959.0000006);
INSERT INTO t1 VALUES (8385959.0000007);
INSERT INTO t1 VALUES (8385959.0000008);
INSERT INTO t1 VALUES (8385959.0000009);
INSERT INTO t1 VALUES (8385959.000001);
INSERT INTO t1 VALUES (8390000.000000);
INSERT INTO t1 VALUES (-8385959.000000);
INSERT INTO t1 VALUES (-8385959.0000001);
INSERT INTO t1 VALUES (-8385959.0000002);
INSERT INTO t1 VALUES (-8385959.0000003);
INSERT INTO t1 VALUES (-8385959.0000004);
INSERT INTO t1 VALUES (-8385959.0000005);
INSERT INTO t1 VALUES (-8385959.0000006);
INSERT INTO t1 VALUES (-8385959.0000007);
INSERT INTO t1 VALUES (-8385959.0000008);
INSERT INTO t1 VALUES (-8385959.0000009);
INSERT INTO t1 VALUES (-8385959.000001);
INSERT INTO t1 VALUES (-8390000.000000);
INSERT INTO t1 VALUES (-8385959.999999);
SELECT * FROM t1;
a
02:02:03.400000
02:02:03.450000
02:02:03.456000
02:02:03.456700
02:02:03.456780
02:02:03.456789
02:02:03.456789
02:02:03.456790
02:02:03.456790
02:02:03.456790
838:59:59.000000
838:59:59.000000
838:59:59.000000
838:59:59.000000
838:59:59.000000
838:59:59.000000
838:59:59.000000
838:59:59.000000
838:59:59.000000
838:59:59.000000
838:59:59.000000
838:59:59.000000
838:59:59.000000
-838:59:59.000000
-838:59:59.000000
-838:59:59.000000
-838:59:59.000000
-838:59:59.000000
-838:59:59.000000
-838:59:59.000000
-838:59:59.000000
-838:59:59.000000
-838:59:59.000000
-838:59:59.000000
-838:59:59.000000
-838:59:59.000000
DROP TABLE t1;
#
# Testing double INSERT values
#
CREATE TABLE t1 (a TIME(6));
INSERT INTO t1 VALUES (123.4567e-3);
INSERT INTO t1 VALUES (123.4567e-2);
INSERT INTO t1 VALUES (123.4567e-1);
INSERT INTO t1 VALUES (123.4567e0);
INSERT INTO t1 VALUES (123.4567e1);
INSERT INTO t1 VALUES (123.4567e2);
INSERT INTO t1 VALUES (123.4567e3);
INSERT INTO t1 VALUES (8385959.999999e0);
INSERT INTO t1 VALUES (8385959e0);
INSERT INTO t1 VALUES (8385959.1e0);
INSERT INTO t1 VALUES (8390000.0e0);
INSERT INTO t1 VALUES (-8385959.0e0);
INSERT INTO t1 VALUES (-8385959.1e0);
INSERT INTO t1 VALUES (-8385959.999999e0);
INSERT INTO t1 VALUES (-8390000.0e0);
SELECT * FROM t1;
a
00:00:00.123457
00:00:01.234567
00:00:12.345670
00:01:23.456700
00:12:34.567000
01:23:45.670000
12:34:56.700000
838:59:59.000000
838:59:59.000000
838:59:59.000000
838:59:59.000000
-838:59:59.000000
-838:59:59.000000
-838:59:59.000000
-838:59:59.000000
DROP TABLE t1;
#
# Testing UPDATE between TIME(6) and TIME/INT/DECIMAL/FLOAT
#
CREATE TABLE t1 (t0 TIME, t6 TIME(6), i INT, d DECIMAL(20,6), f DOUBLE);
INSERT INTO t1 (t0) VALUES ('11:22:33');
UPDATE t1 SET t6=t0, i=t0, d=t0, f=t0;
SELECT * FROM t1;
t0	t6	i	d	f
11:22:33	11:22:33.000000	112233	112233.000000	112233
UPDATE t1 SET t6='11:22:33.123';
UPDATE t1 SET t0=t6, i=t6, d=t6, f=t6;
SELECT * FROM t1;
t0	t6	i	d	f
11:22:33	11:22:33.123000	112233	112233.123000	112233.123
UPDATE t1 SET i=112233, d=112233.123, f=112233.123;
UPDATE t1 SET t6=i;
SELECT t6 FROM t1;
t6
11:22:33.000000
UPDATE t1 SET t6=d;
SELECT t6 FROM t1;
t6
11:22:33.123000
UPDATE t1 SET t6=f;
SELECT t6 FROM t1;
t6
11:22:33.123000
DROP TABLE t1;
#
# Testing JOIN with comparison between TIME(6) and INT
#
CREATE TABLE t1 (a TIME(6));
INSERT INTO t1 VALUES ('11:22:33');
INSERT INTO t1 VALUES ('11:22:33.123');
INSERT INTO t1 VALUES ('-11:22:33');
INSERT INTO t1 VALUES ('-11:22:33.123456');
CREATE TABLE t2 (b INT);
INSERT INTO t2 VALUES (112233);
INSERT INTO t2 VALUES (-112233);
SELECT * FROM t1, t2 WHERE a=b;
a	b
-11:22:33.000000	-112233
11:22:33.000000	112233
DROP TABLE t1, t2;
#
# Testing JOIN with comparison between TIME(6) and DECIMAL(20,6)
#
CREATE TABLE t1 (a TIME(6));
INSERT INTO t1 VALUES ('11:22:33');
INSERT INTO t1 VALUES ('11:22:33.123');
INSERT INTO t1 VALUES ('-11:22:33');
INSERT INTO t1 VALUES ('-11:22:33.123456');
CREATE TABLE t2 (b DECIMAL(20,6));
INSERT INTO t2 VALUES (112233.123);
INSERT INTO t2 VALUES (-112233.123456);
SELECT * FROM t1, t2 WHERE a=b;
a	b
11:22:33.123000	112233.123000
-11:22:33.123456	-112233.123456
DROP TABLE t1, t2;
#
# Testing JOIN with comparison between TIME(6) and DECIMAL(20,3)
#
CREATE TABLE t1 (a TIME(6));
INSERT INTO t1 VALUES ('11:22:33');
INSERT INTO t1 VALUES ('11:22:33.123');
INSERT INTO t1 VALUES ('-11:22:33');
INSERT INTO t1 VALUES ('-11:22:33.123456');
CREATE TABLE t2 (b DECIMAL(20,3));
INSERT INTO t2 VALUES (112233.123);
INSERT INTO t2 VALUES (-112233.123456);
Warnings:
Warning	1265	Data truncated for column 'b' at row 1
SELECT * FROM t1, t2 WHERE a=b;
a	b
11:22:33.123000	112233.123
DROP TABLE t1, t2;
#
# Testing JOIN with comparison between TIME(6) and DOUBLE
#
CREATE TABLE t1 (a TIME(6));
INSERT INTO t1 VALUES ('11:22:33');
INSERT INTO t1 VALUES ('11:22:33.123');
INSERT INTO t1 VALUES ('-11:22:33');
INSERT INTO t1 VALUES ('-11:22:33.123456');
CREATE TABLE t2 (b DOUBLE);
INSERT INTO t2 VALUES (112233.123);
INSERT INTO t2 VALUES (-112233.123456);
SELECT * FROM t1, t2 WHERE a=b;
a	b
11:22:33.123000	112233.123
-11:22:33.123456	-112233.123456
DROP TABLE t1, t2;
SELECT TIMEDIFF(TIME'00:00:00', TIME'00:00:00');
TIMEDIFF(TIME'00:00:00', TIME'00:00:00')
00:00:00
SELECT TIMEDIFF(TIME'00:00:00', TIME'00:00:00.0');
TIMEDIFF(TIME'00:00:00', TIME'00:00:00.0')
00:00:00.0
SELECT TIMEDIFF(TIME'00:00:00', TIME'00:00:00.00');
TIMEDIFF(TIME'00:00:00', TIME'00:00:00.00')
00:00:00.00
SELECT TIMEDIFF(TIME'00:00:00', TIME'00:00:00.000');
TIMEDIFF(TIME'00:00:00', TIME'00:00:00.000')
00:00:00.000
SELECT TIMEDIFF(TIME'00:00:00', TIME'00:00:00.0000');
TIMEDIFF(TIME'00:00:00', TIME'00:00:00.0000')
00:00:00.0000
SELECT TIMEDIFF(TIME'00:00:00', TIME'00:00:00.00000');
TIMEDIFF(TIME'00:00:00', TIME'00:00:00.00000')
00:00:00.00000
SELECT TIMEDIFF(TIME'00:00:00', TIME'00:00:00.000000');
TIMEDIFF(TIME'00:00:00', TIME'00:00:00.000000')
00:00:00.000000
SELECT TIMEDIFF(TIME'00:00:00.0', TIME'00:00:00');
TIMEDIFF(TIME'00:00:00.0', TIME'00:00:00')
00:00:00.0
SELECT TIMEDIFF(TIME'00:00:00.00', TIME'00:00:00');
TIMEDIFF(TIME'00:00:00.00', TIME'00:00:00')
00:00:00.00
SELECT TIMEDIFF(TIME'00:00:00.000', TIME'00:00:00');
TIMEDIFF(TIME'00:00:00.000', TIME'00:00:00')
00:00:00.000
SELECT TIMEDIFF(TIME'00:00:00.0000', TIME'00:00:00');
TIMEDIFF(TIME'00:00:00.0000', TIME'00:00:00')
00:00:00.0000
SELECT TIMEDIFF(TIME'00:00:00.00000', TIME'00:00:00');
TIMEDIFF(TIME'00:00:00.00000', TIME'00:00:00')
00:00:00.00000
SELECT TIMEDIFF(TIME'00:00:00.000000', TIME'00:00:00');
TIMEDIFF(TIME'00:00:00.000000', TIME'00:00:00')
00:00:00.000000
#
# Testing copy from TIME to TIME(6) and vice versa
#
CREATE TABLE t1 (a TIME(6), b TIME);
INSERT INTO t1 VALUES ('01:02:03.123456', '00:00:00');
UPDATE t1 SET b=a;
SELECT * FROM t1;
a	b
01:02:03.123456	01:02:03
UPDATE t1 SET b='10:11:12';
UPDATE t1 SET a=b;
SELECT * FROM t1;
a	b
10:11:12.000000	10:11:12
DROP TABLE t1;
#
# Testing ALTER from TIME(6) to TIME and vice versa
#
CREATE TABLE t1 (a TIME);
INSERT INTO t1 VALUES ('01:02:03');
ALTER TABLE t1 MODIFY a TIME(6);
SELECT * FROM t1;
a
01:02:03.000000
UPDATE t1 SET a='01:03:03.456';
SELECT * FROM t1;
a
01:03:03.456000
ALTER TABLE t1 MODIFY a TIME;
SELECT * FROM t1;
a
01:03:03
DROP TABLE t1;
#
# Testing EXPLAIN EXTENDED SELECT for CAST(TIME(N))
#
#
# Testing DEFAULT value
#
CREATE TABLE t1 (a TIME(6) NOT NULL DEFAULT '11:22:33.123456');
SHOW CREATE TABLE t1;
Table	Create Table
t1	CREATE TABLE `t1` (
  `a` time(6) NOT NULL DEFAULT '11:22:33.123456'
) ORGANIZATION INDEX DEFAULT CHARSET = utf8mb4 COMPRESSION = 'lz4_1.0' REPLICA_NUM = 1 BLOCK_SIZE = 16384 USE_BLOOM_FILTER = FALSE ENABLE_MACRO_BLOCK_BLOOM_FILTER = FALSE TABLET_SIZE = 134217728 PCTFREE = 10
DROP TABLE t1;
#
# Testing TIME(6) field in combination with TIME type functions
#
CREATE TABLE t1 (a TIME(6), b TIME(6));
INSERT INTO t1 VALUES ('10:00:00.123456', '00:00:00.123456');
INSERT INTO t1 VALUES ('10:00:00', '00:00:00');
SELECT * FROM t1 WHERE b=TIMEDIFF(a, '10:00:00');
a	b
10:00:00.123456	00:00:00.123456
10:00:00.000000	00:00:00.000000
DELETE FROM t1;
INSERT INTO t1 VALUES (CURTIME(), CURTIME());
SELECT COUNT(*) FROM t1 WHERE a <= CURTIME();
COUNT(*)
1
DROP TABLE t1;
#
# ORDER BY a TIME(6) function
#
CREATE TABLE t1(a TIME(6));
INSERT INTO t1 (a) VALUES ('835:00:00.000002');
INSERT INTO t1 (a) VALUES ('835:00:00.000000');
INSERT INTO t1 (a) VALUES ('835:00:00.000001');
INSERT INTO t1 (a) VALUES ('00:00:00.000003');
INSERT INTO t1 (a) VALUES ('00:00:00.000000');
INSERT INTO t1 (a) VALUES ('00:00:00.000001');
INSERT INTO t1 (a) VALUES ('-836:00:00.000000');
INSERT INTO t1 (a) VALUES ('-836:00:00.000001');
INSERT INTO t1 (a) VALUES ('-836:00:00.000002');
SELECT * FROM t1 ORDER BY TIMEDIFF(a, '00:00:00');
a
00:00:00.000000
00:00:00.000001
00:00:00.000003
835:00:00.000000
835:00:00.000001
835:00:00.000002
-836:00:00.000000
-836:00:00.000001
-836:00:00.000002
SELECT * FROM t1 ORDER BY TIMEDIFF(a, '00:00:00') DESC;
a
-836:00:00.000002
-836:00:00.000001
-836:00:00.000000
835:00:00.000002
835:00:00.000001
835:00:00.000000
00:00:00.000003
00:00:00.000001
00:00:00.000000
DROP TABLE t1;
#
# Testing partitions
#
CREATE TABLE t1 (a TIME(6)) PARTITION BY KEY(a) PARTITIONS 4;
INSERT INTO t1 VALUES ('00:00:00.000000');
INSERT INTO t1 VALUES ('00:00:00.000001');
INSERT INTO t1 VALUES ('00:00:00.000002');
INSERT INTO t1 VALUES ('00:00:00.000003');
INSERT INTO t1 VALUES ('00:00:00.000004');
INSERT INTO t1 VALUES ('00:00:00.000005');
INSERT INTO t1 VALUES ('00:00:00.000006');
INSERT INTO t1 VALUES ('00:00:00.000010');
INSERT INTO t1 VALUES ('00:00:00.000011');
INSERT INTO t1 VALUES ('00:00:00.000012');
INSERT INTO t1 VALUES ('00:00:00.000013');
INSERT INTO t1 VALUES ('00:00:00.000014');
INSERT INTO t1 VALUES ('00:00:00.000015');
INSERT INTO t1 VALUES ('00:00:00.000016');
INSERT INTO t1 VALUES ('00:00:00.000110');
INSERT INTO t1 VALUES ('00:00:00.000111');
INSERT INTO t1 VALUES ('00:00:00.000112');
INSERT INTO t1 VALUES ('00:00:00.000113');
INSERT INTO t1 VALUES ('00:00:00.000114');
INSERT INTO t1 VALUES ('00:00:00.000115');
INSERT INTO t1 VALUES ('00:00:00.000116');
INSERT INTO t1 VALUES ('00:00:00.000210');
INSERT INTO t1 VALUES ('00:00:00.000211');
INSERT INTO t1 VALUES ('00:00:00.000212');
INSERT INTO t1 VALUES ('00:00:00.000213');
INSERT INTO t1 VALUES ('00:00:00.000214');
INSERT INTO t1 VALUES ('00:00:00.000215');
INSERT INTO t1 VALUES ('00:00:00.000216');
INSERT INTO t1 VALUES ('00:00:01.000000');
INSERT INTO t1 VALUES ('00:00:01.000001');
INSERT INTO t1 VALUES ('00:00:01.000002');
INSERT INTO t1 VALUES ('00:00:01.000003');
INSERT INTO t1 VALUES ('00:00:01.000004');
INSERT INTO t1 VALUES ('00:00:01.000005');
INSERT INTO t1 VALUES ('00:00:01.000006');
INSERT INTO t1 VALUES ('00:00:02.000000');
INSERT INTO t1 VALUES ('00:00:02.000001');
INSERT INTO t1 VALUES ('00:00:02.000002');
INSERT INTO t1 VALUES ('00:00:02.000003');
INSERT INTO t1 VALUES ('00:00:02.000004');
INSERT INTO t1 VALUES ('00:00:02.000005');
INSERT INTO t1 VALUES ('00:00:02.000006');
SELECT * FROM t1 PARTITION(p0);
a
00:00:00.000005
00:00:00.000006
00:00:00.000013
00:00:00.000110
00:00:00.000111
00:00:00.000211
00:00:00.000212
00:00:00.000213
00:00:00.000215
00:00:01.000005
SELECT * FROM t1 PARTITION(p1);
a
00:00:00.000000
00:00:00.000010
00:00:00.000011
00:00:00.000012
00:00:00.000016
00:00:00.000116
00:00:01.000003
00:00:01.000006
00:00:02.000004
SELECT * FROM t1 PARTITION(p2);
a
00:00:00.000001
00:00:00.000002
00:00:00.000003
00:00:00.000004
00:00:00.000014
00:00:00.000115
00:00:02.000000
00:00:02.000003
00:00:02.000006
SELECT * FROM t1 PARTITION(p3);
a
00:00:00.000015
00:00:00.000112
00:00:00.000113
00:00:00.000114
00:00:00.000210
00:00:00.000214
00:00:00.000216
00:00:01.000000
00:00:01.000001
00:00:01.000002
00:00:01.000004
00:00:02.000001
00:00:02.000002
00:00:02.000005
DROP TABLE t1;
#
# Testing TIME(6) and user variables
#
CREATE TABLE t1 (a TIME(6));
INSERT INTO t1 VALUES ('11:22:33.123456');
SET @a='11:22:33.123456';
SELECT * FROM t1 WHERE a=@a;
a
11:22:33.123456
SET @a=112233.123456;
SELECT * FROM t1 WHERE a=@a;
a
11:22:33.123456
SET @a=112233.123456e0;
SELECT * FROM t1 WHERE a=@a;
a
11:22:33.123456
DROP TABLE t1;
#
# Testing INFORMATION_SCHEMA.COLUMNS
#
CREATE TABLE t1 (a TIME(6));
DROP TABLE t1;
#
# SELECT from a subquery
#
CREATE TABLE t1 (a TIME(6));
INSERT INTO t1 VALUES ('00:00:00.123456'), ('11:11:11.123456');
SELECT * FROM (SELECT * FROM t1) t12;
a
00:00:00.123456
11:11:11.123456
DROP TABLE t1;
#
# Testing IN and = subqueries
#
CREATE TABLE t1 (a TIME(6));
INSERT INTO t1 VALUES ('00:00:00.123456'), ('11:11:11.123456');
SELECT * FROM t1 WHERE a IN (SELECT MIN(a) FROM t1);
a
00:00:00.123456
SELECT * FROM t1 WHERE a = (SELECT a FROM t1 ORDER BY a DESC LIMIT 1);
a
11:11:11.123456
DROP TABLE t1;
#
# Testing IN subquery + GROUP
#
CREATE TABLE t1 (id INT, a TIME(6));
INSERT INTO t1 VALUES (1,'00:00:00.123456'), (1,'11:00:00.123456');
INSERT INTO t1 VALUES (2,'00:01:00.123456'), (2,'11:01:00.123456');
INSERT INTO t1 VALUES (3, NULL);
SELECT * FROM t1 WHERE a IN (SELECT MAX(a) FROM t1 GROUP BY id);
id	a
1	11:00:00.123456
2	11:01:00.123456
DROP TABLE t1;
#
# Testing VIEW
#
CREATE TABLE t1 (a TIME(6));
INSERT INTO t1 VALUES ('00:00:00.123456'), ('11:11:11.123456');
CREATE VIEW v1 AS SELECT a FROM t1;
SELECT * FROM v1 WHERE a='00:00:00.123456';
a
00:00:00.123456
SELECT MIN(a), MAX(a) FROM v1;
MIN(a)	MAX(a)
00:00:00.123456	11:11:11.123456
SELECT * FROM t1 WHERE a IN (SELECT MAX(a) FROM v1);
a
11:11:11.123456
DROP VIEW v1;
CREATE VIEW v1 AS SELECT MAX(a) AS a FROM t1;
SELECT * FROM v1;
a
11:11:11.123456
SELECT * FROM t1 WHERE a=(SELECT a FROM v1);
a
11:11:11.123456
DROP VIEW v1;
DROP TABLE t1;
#
# Testing hybrid functions in TIME context
#
#
# Testing that CAST from various fields to TIME rounds.
# This tests Field::get_time().
CREATE TABLE t1 (a VARCHAR(32));
INSERT INTO t1 VALUES
('838:59:58.0000009'), ('838:59:58.9'),
('-838:59:58.0000009'), ('-838:59:58.9'),
('10:10:10.9999994'), ('10:10:10.9999995'),
('-10:10:10.9999994'), ('-10:10:10.9999995');
SELECT a, CAST(a AS TIME) FROM t1;
a	CAST(a AS TIME)
838:59:58.0000009	838:59:58
838:59:58.9	838:59:59
-838:59:58.0000009	-838:59:58
-838:59:58.9	-838:59:59
10:10:10.9999994	10:10:11
10:10:10.9999995	10:10:11
-10:10:10.9999994	-10:10:11
-10:10:10.9999995	-10:10:11
DROP TABLE t1;
CREATE TABLE t1 (a DECIMAL(30,7));
INSERT INTO t1 VALUES (8385958.0000009), (8385958.9),(-8385958.0000009), (-8385958.9),(101010.9999994), (101010.9999995),(-101010.9999994), (-101010.9999995);
SELECT a, CAST(a AS TIME) FROM t1;
a	CAST(a AS TIME)
8385958.0000009	838:59:58
8385958.9000000	838:59:59
-8385958.0000009	-838:59:58
-8385958.9000000	-838:59:59
101010.9999994	10:10:11
101010.9999995	10:10:11
-101010.9999994	-10:10:11
-101010.9999995	-10:10:11
DROP TABLE t1;
#
# Testing that Item::get_time() rounds
#
SELECT CAST('10:10:10.9999994' AS TIME), CAST('10:10:10.9999995' AS TIME), CAST(101010.9999994 AS TIME), CAST(101010.9999995 AS TIME);
CAST('10:10:10.9999994' AS TIME)	CAST('10:10:10.9999995' AS TIME)	CAST(101010.9999994 AS TIME)	CAST(101010.9999995 AS TIME)
10:10:11	10:10:11	10:10:11	10:10:11
#
# Testing that comparison rounds
#
CREATE TABLE t1 (t0 TIME, t6 TIME(6));
INSERT INTO t1 VALUES ('00:00:00', '00:00:00.999999');
INSERT INTO t1 VALUES ('00:00:01', '00:00:01.000000');
SELECT t0 FROM t1 WHERE t6='00:00:00.9999998';
t0
00:00:01
SELECT t6 FROM t1 WHERE t6='00:00:00.9999998';
t6
00:00:01.000000
DROP TABLE t1;
#
# Testing that DATETIME(0) is a synonym to non-fractional DATETIME
#
CREATE TABLE t1 (a DATETIME(0) NOT NULL);
SHOW CREATE TABLE t1;
Table	Create Table
t1	CREATE TABLE `t1` (
  `a` datetime NOT NULL
) ORGANIZATION INDEX DEFAULT CHARSET = utf8mb4 COMPRESSION = 'lz4_1.0' REPLICA_NUM = 1 BLOCK_SIZE = 16384 USE_BLOOM_FILTER = FALSE ENABLE_MACRO_BLOCK_BLOOM_FILTER = FALSE TABLET_SIZE = 134217728 PCTFREE = 10
DROP TABLE t1;
#
# Testing bad FSPs
#
CREATE TABLE t1 (a DATETIME(-1));
ERROR 42000: You have an error in your SQL syntax; check the manual that corresponds to your OceanBase version for the right syntax to use near '-1))' at line 1
CREATE TABLE t1 (a DATETIME(7));
ERROR 42000: Too big precision 7 specified for column 'a'. Maximum is 6.
CREATE TABLE t1 (a DATETIME(31));
ERROR 42000: Too big precision 31 specified for column 'a'. Maximum is 6.
#
# Testing bad FSPs with DATETIME functions
#
SELECT NOW(-1);
ERROR 42000: You have an error in your SQL syntax; check the manual that corresponds to your OceanBase version for the right syntax to use near '-1)' at line 1
SELECT NOW(7);
ERROR 42000: Too big precision 7 specified for column 'now'. Maximum is 6.
SELECT NOW(31);
ERROR 42000: Too big precision 31 specified for column 'now'. Maximum is 6.
#
# Tesint range: stored_field_cmp_to_item
#
CREATE TABLE t1 (a datetime(6), key(a));
INSERT INTO t1 VALUES
('2000-01-01 00:00:00'), ('2000-01-01 00:00:00'),
('2000-01-01 00:00:01'), ('2000-01-01 00:00:01');
SELECT * FROM t1 WHERE a >= 20000101000000;
a
2000-01-01 00:00:00.000000
2000-01-01 00:00:00.000000
2000-01-01 00:00:01.000000
2000-01-01 00:00:01.000000
SELECT * FROM t1 WHERE a >= 20000101000000.0;
a
2000-01-01 00:00:00.000000
2000-01-01 00:00:00.000000
2000-01-01 00:00:01.000000
2000-01-01 00:00:01.000000
DROP TABLE t1;
#
# Rare DATETIME formats
#
CREATE TABLE t1 (a DATETIME(6));
INSERT INTO t1 VALUES (101.101);
INSERT INTO t1 VALUES (990101.102);
INSERT INTO t1 VALUES ('990101.103');
INSERT INTO t1 VALUES (131.104);
INSERT INTO t1 VALUES ('000131.105');
SELECT * FROM t1;
a
2000-01-01 00:00:00.000000
1999-01-01 00:00:00.000000
1999-01-01 10:03:00.000000
2000-01-31 00:00:00.000000
2000-01-31 10:05:00.000000
DROP TABLE t1;
#
# Testing bad values
#
CREATE TABLE t1 (a DATETIME(6));
INSERT INTO t1 VALUES ('xxxx');
INSERT INTO t1 VALUES ('1999-01-01 00:00:00.123456 xxx');
INSERT INTO t1 VALUES ('1999-01-01 00:00:00 xxx');
INSERT INTO t1 VALUES ('1999-01-01 xxx');
INSERT INTO t1 VALUES ('1999-00-00 00:00:00');
INSERT INTO t1 VALUES ('-0000-00-00');
INSERT INTO t1 VALUES ('-0000-00-00 00:00:00');
INSERT INTO t1 VALUES ('-0000-00-00 00:00:00.000000');
INSERT INTO t1 VALUES (-0.1);
INSERT INTO t1 VALUES (-1.0);
INSERT INTO t1 VALUES (-1.1);
INSERT INTO t1 VALUES (-0.1e0);
INSERT INTO t1 VALUES (-1.0e0);
INSERT INTO t1 VALUES (-1.1e0);
SELECT * FROM t1;
a
0000-00-00 00:00:00.000000
1999-01-01 00:00:00.123456
1999-01-01 00:00:00.000000
1999-01-01 00:00:00.000000
1999-00-00 00:00:00.000000
0000-00-00 00:00:00.000000
0000-00-00 00:00:00.000000
0000-00-00 00:00:00.000000
0000-00-00 00:00:00.000000
0000-00-00 00:00:00.000000
0000-00-00 00:00:00.000000
0000-00-00 00:00:00.000000
0000-00-00 00:00:00.000000
0000-00-00 00:00:00.000000
DROP TABLE t1;
#
# Testing huge values
#
CREATE TABLE t1 (a DATETIME(6));
INSERT INTO t1 VALUES (CAST(0xFFFFFFFF00000000 AS SIGNED));
INSERT INTO t1 VALUES (CAST(0xFFFFFFFF00000000 AS UNSIGNED));
INSERT INTO t1 VALUES ( 100000000000000000.1);
INSERT INTO t1 VALUES ( 100000000000000000.1e0);
INSERT INTO t1 VALUES (-100000000000000000.1);
INSERT INTO t1 VALUES (-100000000000000000.1e0);
SELECT * FROM t1;
a
0000-00-00 00:00:00.000000
0000-00-00 00:00:00.000000
0000-00-00 00:00:00.000000
0000-00-00 00:00:00.000000
0000-00-00 00:00:00.000000
0000-00-00 00:00:00.000000
DROP TABLE t1;
#
# Testing bad values with TRADITIONAL mode
#
SET SQL_MODE='strict_all_tables';
CREATE TABLE t1 (a DATETIME, b DATETIME(6));
INSERT INTO t1 VALUES ('xxx', NULL);
ERROR 22007: Incorrect datetime value for column 'a' at row 1
INSERT INTO t1 VALUES (NULL,'xxx');
ERROR 22007: Incorrect datetime value for column 'b' at row 1
INSERT INTO t1 VALUES ('1999-01-01 00:00:00 xxx', NULL);
ERROR 22007: Incorrect datetime value for column 'a' at row 1
INSERT INTO t1 VALUES ('1999-00-00 00:00:00 xxx', NULL);
ERROR 22007: Incorrect datetime value for column 'a' at row 1
INSERT INTO t1 VALUES (NULL, '1999-00-00 00:00:00 xxx');
ERROR 22007: Incorrect datetime value for column 'b' at row 1
INSERT INTO t1 VALUES ('1999-00-00 xxx', NULL);
INSERT INTO t1 VALUES (NULL, '1999-00-00 xxx');
INSERT INTO t1 VALUES (NULL, 199991231000000);
ERROR 22007: Incorrect datetime value for column 'b' at row 1
INSERT INTO t1 VALUES (NULL, -0.1);
ERROR 22007: Incorrect datetime value for column 'b' at row 1
INSERT INTO t1 VALUES (NULL, -1.0);
ERROR 22007: Incorrect datetime value for column 'b' at row 1
INSERT INTO t1 VALUES (NULL, -1.1);
ERROR 22007: Incorrect datetime value for column 'b' at row 1
INSERT INTO t1 VALUES (NULL, -0.1e0);
ERROR 22007: Incorrect datetime value for column 'b' at row 1
INSERT INTO t1 VALUES (NULL, -1.0e0);
ERROR 22007: Incorrect datetime value for column 'b' at row 1
INSERT INTO t1 VALUES (NULL, -1.1e0);
ERROR 22007: Incorrect datetime value for column 'b' at row 1
INSERT INTO t1 VALUES (NULL, CAST(0xFFFFFFFF00000000 AS SIGNED));
ERROR 22007: Incorrect datetime value for column 'b' at row 1
SELECT * FROM t1;
a	b
1999-00-00 00:00:00	NULL
NULL	1999-00-00 00:00:00.000000
DROP TABLE t1;
SET SQL_MODE='';
#
# Testing rounding
#
CREATE TABLE t1 (a DATETIME(6));
INSERT INTO t1 VALUES (20010101100000.1234567);
INSERT INTO t1 VALUES (20010228235959.9999997);
INSERT INTO t1 VALUES (99990228235959.9999997);
INSERT INTO t1 VALUES (99991231235959.9999997);
INSERT INTO t1 VALUES ('2001-01-01 10:00:00.1234567');
INSERT INTO t1 VALUES ('2001-02-28 23:59:59.9999997');
INSERT INTO t1 VALUES ('9999-02-28 23:59:59.9999997');
INSERT INTO t1 VALUES ('9999-12-31 23:59:59.9999997');
SELECT * FROM t1;
a
2001-01-01 10:00:00.123457
2001-03-01 00:00:00.000000
9999-03-01 00:00:00.000000
0000-00-00 00:00:00.000000
2001-01-01 10:00:00.123457
2001-03-01 00:00:00.000000
9999-03-01 00:00:00.000000
0000-00-00 00:00:00.000000
DROP TABLE t1;
#
# Testing rounding when altering DATETIME(N) to a smaller size
#
CREATE TABLE t1 (a DATETIME(6));
INSERT INTO t1 VALUES ('2001-01-01 10:10:10.999999');
ALTER TABLE t1 MODIFY a DATETIME(5);
SELECT * FROM t1;
a
2001-01-01 10:10:11.00000
DROP TABLE t1;
#
# Testing rounding from VARCHAR and DATETIME(6) to DATETIME(N)
#
CREATE TABLE t1 (a VARCHAR(32),
t6 DATETIME(6), t5 DATETIME(5), t4 DATETIME(4),
t3 DATETIME(3), t2 DATETIME(2), t1 DATETIME(1),
t0 DATETIME);
INSERT INTO t1 (a) VALUES ('2001-01-01 10:10:10.999999');
INSERT INTO t1 (a) VALUES ('2001-01-01 10:10:10.999994');
INSERT INTO t1 (a) VALUES ('2001-01-01 10:10:10.999949');
INSERT INTO t1 (a) VALUES ('2001-01-01 10:10:10.999499');
INSERT INTO t1 (a) VALUES ('2001-01-01 10:10:10.994999');
INSERT INTO t1 (a) VALUES ('2001-01-01 10:10:10.949999');
INSERT INTO t1 (a) VALUES ('2001-01-01 10:10:10.499999');
UPDATE t1 SET t0=a, t1=a, t2=a, t3=a, t4=a, t5=a, t6=a;
SELECT * FROM t1;
a	t6	t5	t4	t3	t2	t1	t0
2001-01-01 10:10:10.999999	2001-01-01 10:10:10.999999	2001-01-01 10:10:11.00000	2001-01-01 10:10:11.0000	2001-01-01 10:10:11.000	2001-01-01 10:10:11.00	2001-01-01 10:10:11.0	2001-01-01 10:10:11
2001-01-01 10:10:10.999994	2001-01-01 10:10:10.999994	2001-01-01 10:10:10.99999	2001-01-01 10:10:11.0000	2001-01-01 10:10:11.000	2001-01-01 10:10:11.00	2001-01-01 10:10:11.0	2001-01-01 10:10:11
2001-01-01 10:10:10.999949	2001-01-01 10:10:10.999949	2001-01-01 10:10:10.99995	2001-01-01 10:10:10.9999	2001-01-01 10:10:11.000	2001-01-01 10:10:11.00	2001-01-01 10:10:11.0	2001-01-01 10:10:11
2001-01-01 10:10:10.999499	2001-01-01 10:10:10.999499	2001-01-01 10:10:10.99950	2001-01-01 10:10:10.9995	2001-01-01 10:10:10.999	2001-01-01 10:10:11.00	2001-01-01 10:10:11.0	2001-01-01 10:10:11
2001-01-01 10:10:10.994999	2001-01-01 10:10:10.994999	2001-01-01 10:10:10.99500	2001-01-01 10:10:10.9950	2001-01-01 10:10:10.995	2001-01-01 10:10:10.99	2001-01-01 10:10:11.0	2001-01-01 10:10:11
2001-01-01 10:10:10.949999	2001-01-01 10:10:10.949999	2001-01-01 10:10:10.95000	2001-01-01 10:10:10.9500	2001-01-01 10:10:10.950	2001-01-01 10:10:10.95	2001-01-01 10:10:10.9	2001-01-01 10:10:11
2001-01-01 10:10:10.499999	2001-01-01 10:10:10.499999	2001-01-01 10:10:10.50000	2001-01-01 10:10:10.5000	2001-01-01 10:10:10.500	2001-01-01 10:10:10.50	2001-01-01 10:10:10.5	2001-01-01 10:10:10
DROP TABLE t1;
#
# Testing rounding from DATETIME(N) to BIGINT
#
CREATE TABLE t1 (a BIGINT, b DATETIME(6));
INSERT INTO t1 (b) VALUES ('2001-01-01 10:10:59.500000');
INSERT INTO t1 (b) VALUES ('2001-01-01 10:10:10.500000');
INSERT INTO t1 (b) VALUES ('2001-01-01 10:10:10.499999');
UPDATE t1 SET a=b;
SELECT * FROM t1;
a	b
20010101101059	2001-01-01 10:10:59.500000
20010101101010	2001-01-01 10:10:10.500000
20010101101010	2001-01-01 10:10:10.499999
DROP TABLE t1;
#
# Testing rounding from DECIMAL to DATETIME(N)
#
CREATE TABLE t1 (a DECIMAL(30,6),t6 DATETIME(6), t5 DATETIME(5), t4 DATETIME(4),  t3 DATETIME(3), t2 DATETIME(2), t1 DATETIME(1),t0 DATETIME);
INSERT INTO t1 (a) VALUES (20010101101010.999999);
INSERT INTO t1 (a) VALUES (20010101101010.999994);
INSERT INTO t1 (a) VALUES (20010101101010.999949);
INSERT INTO t1 (a) VALUES (20010101101010.999499);
INSERT INTO t1 (a) VALUES (20010101101010.994999);
INSERT INTO t1 (a) VALUES (20010101101010.949999);
INSERT INTO t1 (a) VALUES (20010101101010.499999);
UPDATE t1 SET t0=a, t1=a, t2=a, t3=a, t4=a, t5=a, t6=a;
SELECT * FROM t1;
a	t6	t5	t4	t3	t2	t1	t0
20010101101010.999999	2001-01-01 10:10:10.999999	2001-01-01 10:10:11.00000	2001-01-01 10:10:11.0000	2001-01-01 10:10:11.000	2001-01-01 10:10:11.00	2001-01-01 10:10:11.0	2001-01-01 10:10:11
20010101101010.999994	2001-01-01 10:10:10.999994	2001-01-01 10:10:10.99999	2001-01-01 10:10:11.0000	2001-01-01 10:10:11.000	2001-01-01 10:10:11.00	2001-01-01 10:10:11.0	2001-01-01 10:10:11
20010101101010.999949	2001-01-01 10:10:10.999949	2001-01-01 10:10:10.99995	2001-01-01 10:10:10.9999	2001-01-01 10:10:11.000	2001-01-01 10:10:11.00	2001-01-01 10:10:11.0	2001-01-01 10:10:11
20010101101010.999499	2001-01-01 10:10:10.999499	2001-01-01 10:10:10.99950	2001-01-01 10:10:10.9995	2001-01-01 10:10:10.999	2001-01-01 10:10:11.00	2001-01-01 10:10:11.0	2001-01-01 10:10:11
20010101101010.994999	2001-01-01 10:10:10.994999	2001-01-01 10:10:10.99500	2001-01-01 10:10:10.9950	2001-01-01 10:10:10.995	2001-01-01 10:10:10.99	2001-01-01 10:10:11.0	2001-01-01 10:10:11
20010101101010.949999	2001-01-01 10:10:10.949999	2001-01-01 10:10:10.95000	2001-01-01 10:10:10.9500	2001-01-01 10:10:10.950	2001-01-01 10:10:10.95	2001-01-01 10:10:10.9	2001-01-01 10:10:11
20010101101010.499999	2001-01-01 10:10:10.499999	2001-01-01 10:10:10.50000	2001-01-01 10:10:10.5000	2001-01-01 10:10:10.500	2001-01-01 10:10:10.50	2001-01-01 10:10:10.5	2001-01-01 10:10:10
DROP TABLE t1;
#
# Testing truncation warnings
#
CREATE TABLE t1 (a DATETIME(6));
INSERT INTO t1 VALUES ('0000-00-00 00:00:00.111111 xxx');
INSERT INTO t1 VALUES ('0000-00-00 00:00:00.1111110');
INSERT INTO t1 VALUES ('0000-00-00 00:00:00.1111111');
INSERT INTO t1 VALUES ('0000-00-00 00:00:00.1111114');
INSERT INTO t1 VALUES ('0000-00-00 00:00:00.1111115');
INSERT INTO t1 VALUES ('0000-00-00 00:00:00.1111119');
SELECT * FROM t1;
a
0000-00-00 00:00:00.111111
0000-00-00 00:00:00.111111
0000-00-00 00:00:00.111111
0000-00-00 00:00:00.111111
0000-00-00 00:00:00.111112
0000-00-00 00:00:00.111112
DELETE FROM t1;
INSERT INTO t1 VALUES (0.1111110);
INSERT INTO t1 VALUES (0.1111111);
INSERT INTO t1 VALUES (0.1111114);
INSERT INTO t1 VALUES (0.1111115);
INSERT INTO t1 VALUES (0.1111119);
SELECT * FROM t1;
a
0000-00-00 00:00:00.000000
0000-00-00 00:00:00.000000
0000-00-00 00:00:00.000000
0000-00-00 00:00:00.000000
0000-00-00 00:00:00.000000
DELETE FROM t1;
INSERT INTO t1 VALUES (0.1111110e0);
INSERT INTO t1 VALUES (0.1111111e0);
INSERT INTO t1 VALUES (0.1111114e0);
INSERT INTO t1 VALUES (0.1111115e0);
INSERT INTO t1 VALUES (0.1111119e0);
SELECT * FROM t1;
a
0000-00-00 00:00:00.000000
0000-00-00 00:00:00.000000
0000-00-00 00:00:00.000000
0000-00-00 00:00:00.000000
0000-00-00 00:00:00.000000
DROP TABLE t1;
#
# Testing implicit CAST from TIME to DATETIME
#
SET @@timestamp=UNIX_TIMESTAMP('2008-01-03 10:20:30.1');
CREATE TABLE t1 (a DATETIME(6));
INSERT INTO t1 VALUES (CURRENT_TIME), (CURRENT_TIME(6));
INSERT INTO t1 VALUES (TIME'08:00:00.123456'), (TIME'240:00:00.000001');
INSERT INTO t1 VALUES (TIME'-10:00:00.000001'), (TIME'-240:00:00.000001');
SELECT * FROM t1;
a
2008-01-03 10:20:30.000000
2008-01-03 10:20:30.100000
2008-01-03 08:00:00.123456
2008-01-13 00:00:00.000001
2008-01-02 13:59:59.999999
2007-12-23 23:59:59.999999
DROP TABLE t1;
SET @@timestamp=default;
#
# Testing IN
#
CREATE TABLE t1 (a DATETIME(6));
INSERT INTO t1 VALUES ('0000-00-00 00:00:00.000000');
INSERT INTO t1 VALUES ('0000-00-00 00:00:00.000001');
INSERT INTO t1 VALUES ('2000-01-01 00:00:00.000000');
INSERT INTO t1 VALUES ('2000-01-01 00:00:00.000001');
INSERT INTO t1 VALUES ('2000-01-01 00:00:00.000002');
INSERT INTO t1 VALUES ('2000-01-01 10:00:00.000000');
INSERT INTO t1 VALUES ('2000-01-01 10:00:00.000001');
INSERT INTO t1 VALUES ('2000-01-01 10:00:00.000002');
INSERT INTO t1 VALUES ('2000-01-01 23:00:00.000000');
INSERT INTO t1 VALUES ('2000-01-01 23:00:00.000001');
INSERT INTO t1 VALUES ('2000-01-01 23:00:00.000002');
SELECT * FROM t1 WHERE a IN ('2000-01-01 00:00:00', '0000-00-00 00:00:00.000001', '2000-01-01 23:00:00.000002');
a
0000-00-00 00:00:00.000001
2000-01-01 00:00:00.000000
2000-01-01 23:00:00.000002
SELECT * FROM t1 WHERE a IN (0, 20000101000000, 20000101230000);
a
0000-00-00 00:00:00.000000
2000-01-01 00:00:00.000000
2000-01-01 23:00:00.000000
SELECT * FROM t1 WHERE a IN (0.000001, 20000101000000.000001, 20000101230000.000001);
a
0000-00-00 00:00:00.000000
2000-01-01 00:00:00.000001
2000-01-01 23:00:00.000001
SELECT * FROM t1 WHERE a IN (0e0, 0.000001e0);
a
0000-00-00 00:00:00.000000
#
# Testing Item_temporal_with_ref::print
#
#
# Testing IN with index: involves field->store_packed()
#
ALTER TABLE t1 ADD KEY(a);
SELECT * FROM t1 WHERE a IN ('2000-01-01 00:00:00', '0000-00-00 00:00:00.000001','2000-01-01 23:00:00.000002');
a
0000-00-00 00:00:00.000001
2000-01-01 00:00:00.000000
2000-01-01 23:00:00.000002
SELECT * FROM t1 WHERE a IN (0, 20000101000000, 20000101230000);
a
0000-00-00 00:00:00.000000
2000-01-01 00:00:00.000000
2000-01-01 23:00:00.000000
SELECT * FROM t1 WHERE a IN (0.000001, 20000101000000.000001, 20000101230000.000001);
a
0000-00-00 00:00:00.000000
2000-01-01 00:00:00.000001
2000-01-01 23:00:00.000001
SELECT * FROM t1 WHERE a IN (0e0, 0.000001e0);
a
0000-00-00 00:00:00.000000
DROP TABLE t1;
#
# Testing CREATE TABLE LIKE
#
CREATE TABLE t1 (a DATETIME(6));
CREATE TABLE t2 LIKE t1;
SHOW CREATE TABLE t2;
Table	Create Table
t2	CREATE TABLE `t2` (
  `a` datetime(6) DEFAULT NULL
) ORGANIZATION INDEX DEFAULT CHARSET = utf8mb4 COMPRESSION = 'lz4_1.0' REPLICA_NUM = 1 BLOCK_SIZE = 16384 USE_BLOOM_FILTER = FALSE ENABLE_MACRO_BLOCK_BLOOM_FILTER = FALSE TABLET_SIZE = 134217728 PCTFREE = 10
DROP TABLE t2, t1;
#
# Testing JOIN between DATETIME(6) and DATETIME(6)
#
CREATE TABLE t1 (a DATETIME(6));
INSERT INTO t1 VALUES ('2000-01-01 00:01:03.1');
INSERT INTO t1 VALUES ('2000-01-01 00:01:03.12');
INSERT INTO t1 VALUES ('2000-01-01 00:01:03.123');
INSERT INTO t1 VALUES ('2000-01-01 00:01:03.1234');
INSERT INTO t1 VALUES ('2000-01-01 00:01:03.12345');
INSERT INTO t1 VALUES ('2000-01-01 00:01:03.123456');
CREATE TABLE t2 (a DATETIME(6));
INSERT INTO t2 VALUES ('2000-01-01 00:01:03.1');
INSERT INTO t2 VALUES ('2000-01-01 00:01:03.12');
INSERT INTO t2 VALUES ('2000-01-01 00:01:03.123');
INSERT INTO t2 VALUES ('2000-01-01 00:01:03.1234');
INSERT INTO t2 VALUES ('2000-01-01 00:01:03.12345');
INSERT INTO t2 VALUES ('2000-01-01 00:01:03.123456');
SELECT * FROM t1, t2 WHERE t1.a=t2.a ORDER BY t1.a, t2.a;
a	a
2000-01-01 00:01:03.100000	2000-01-01 00:01:03.100000
2000-01-01 00:01:03.120000	2000-01-01 00:01:03.120000
2000-01-01 00:01:03.123000	2000-01-01 00:01:03.123000
2000-01-01 00:01:03.123400	2000-01-01 00:01:03.123400
2000-01-01 00:01:03.123450	2000-01-01 00:01:03.123450
2000-01-01 00:01:03.123456	2000-01-01 00:01:03.123456
ALTER TABLE t1 ADD KEY(a);
SELECT * FROM t1, t2 WHERE t1.a=t2.a ORDER BY t1.a, t2.a;
a	a
2000-01-01 00:01:03.100000	2000-01-01 00:01:03.100000
2000-01-01 00:01:03.120000	2000-01-01 00:01:03.120000
2000-01-01 00:01:03.123000	2000-01-01 00:01:03.123000
2000-01-01 00:01:03.123400	2000-01-01 00:01:03.123400
2000-01-01 00:01:03.123450	2000-01-01 00:01:03.123450
2000-01-01 00:01:03.123456	2000-01-01 00:01:03.123456
ALTER TABLE t2 ADD KEY(a);
SELECT * FROM t1, t2 WHERE t1.a=t2.a ORDER BY t1.a, t2.a;
a	a
2000-01-01 00:01:03.100000	2000-01-01 00:01:03.100000
2000-01-01 00:01:03.120000	2000-01-01 00:01:03.120000
2000-01-01 00:01:03.123000	2000-01-01 00:01:03.123000
2000-01-01 00:01:03.123400	2000-01-01 00:01:03.123400
2000-01-01 00:01:03.123450	2000-01-01 00:01:03.123450
2000-01-01 00:01:03.123456	2000-01-01 00:01:03.123456
ALTER TABLE t1 DROP KEY a;
SELECT * FROM t1, t2 WHERE t1.a=t2.a ORDER BY t1.a, t2.a;
a	a
2000-01-01 00:01:03.100000	2000-01-01 00:01:03.100000
2000-01-01 00:01:03.120000	2000-01-01 00:01:03.120000
2000-01-01 00:01:03.123000	2000-01-01 00:01:03.123000
2000-01-01 00:01:03.123400	2000-01-01 00:01:03.123400
2000-01-01 00:01:03.123450	2000-01-01 00:01:03.123450
2000-01-01 00:01:03.123456	2000-01-01 00:01:03.123456
DROP TABLE t2;
DROP TABLE t1;
#
# Testing JOIN between DATETIME and DATETIME(6)
#
CREATE TABLE t1 (a DATETIME(6));
INSERT INTO t1 VALUES ('0000-00-00 23:59:59.000000');
INSERT INTO t1 VALUES ('2000-01-01 10:11:12.000000');
INSERT INTO t1 VALUES ('2000-01-01 10:11:12.000001');
INSERT INTO t1 VALUES ('2000-01-01 10:11:12.000002');
INSERT INTO t1 VALUES ('2000-01-01 10:11:13.000000');
INSERT INTO t1 VALUES ('2000-01-01 10:11:13.000001');
INSERT INTO t1 VALUES ('2000-01-01 10:11:13.000002');
INSERT INTO t1 VALUES ('2000-01-01 23:59:59.999999');
INSERT INTO t1 VALUES ('2000-01-01 23:59:59.000000');
CREATE TABLE t2 (a DATETIME);
INSERT INTO t2 VALUES ('2000-01-01 10:11:12');
INSERT INTO t2 VALUES ('2000-01-01 10:11:13');
INSERT INTO t2 VALUES ('0000-00-00 23:59:59');
INSERT INTO t2 VALUES ('2000-01-01 23:59:59');
SELECT * FROM t1, t2 WHERE t1.a=t2.a ORDER BY t1.a, t2.a;
a	a
0000-00-00 23:59:59.000000	0000-00-00 23:59:59
2000-01-01 10:11:12.000000	2000-01-01 10:11:12
2000-01-01 10:11:13.000000	2000-01-01 10:11:13
2000-01-01 23:59:59.000000	2000-01-01 23:59:59
ALTER TABLE t1 ADD KEY(a);
ALTER TABLE t2 ADD KEY(a);
SELECT * FROM t1, t2 WHERE t1.a=t2.a ORDER BY t1.a, t2.a;
a	a
0000-00-00 23:59:59.000000	0000-00-00 23:59:59
2000-01-01 10:11:12.000000	2000-01-01 10:11:12
2000-01-01 10:11:13.000000	2000-01-01 10:11:13
2000-01-01 23:59:59.000000	2000-01-01 23:59:59
DROP TABLE t2, t1;
#
# Testing unique index
#
CREATE TABLE t1 (a DATETIME(6), UNIQUE(a));
INSERT INTO t1 VALUES ('2000-01-01 00:01:02');
INSERT INTO t1 VALUES ('2000-01-01 00:01:02.1');
INSERT INTO t1 VALUES ('2000-01-01 00:01:02.12');
INSERT INTO t1 VALUES ('2000-01-01 00:01:02.123');
INSERT INTO t1 VALUES ('2000-01-01 00:01:02.1234');
INSERT INTO t1 VALUES ('2000-01-01 00:01:02.12345');
INSERT INTO t1 VALUES ('2000-01-01 00:01:02.12345');
ERROR 23000: Duplicate entry '2000-01-01 00:01:02.123450' for key 'a'
DROP TABLE t1;
#
# Testing GROUP BY
#
CREATE TABLE t1 (a DATETIME(6));
INSERT INTO t1 VALUES ('2000-01-01 00:01:02');
INSERT INTO t1 VALUES ('2000-01-01 00:01:02.0');
INSERT INTO t1 VALUES ('2000-01-01 00:01:02.01');
INSERT INTO t1 VALUES ('2000-01-01 00:01:02.010');
INSERT INTO t1 VALUES ('2000-01-01 00:01:02.02');
INSERT INTO t1 VALUES ('2000-01-01 00:01:02.020');
SELECT a, COUNT(*) FROM t1 GROUP BY a;
a	COUNT(*)
2000-01-01 00:01:02.000000	2
2000-01-01 00:01:02.010000	2
2000-01-01 00:01:02.020000	2
DROP TABLE t1;
#
# Testing MIN() and MAX()
#
CREATE TABLE t1 (a INT, b DATETIME(6));
INSERT INTO t1 VALUES (1, '2001-01-01 00:01:02.000001');
INSERT INTO t1 VALUES (1, '2001-01-01 00:01:02');
INSERT INTO t1 VALUES (2, '2001-01-01 10:01:02');
INSERT INTO t1 VALUES (2, '2001-01-01 10:01:02.000001');
INSERT INTO t1 VALUES (3, '2001-01-01 10:11:02');
INSERT INTO t1 VALUES (3, '2001-01-01 10:11:02.000001');
SELECT MIN(b), MAX(b) FROM t1;
MIN(b)	MAX(b)
2001-01-01 00:01:02.000000	2001-01-01 10:11:02.000001
SELECT a, MIN(b), MAX(b) FROM t1 GROUP BY a;
a	MIN(b)	MAX(b)
1	2001-01-01 00:01:02.000000	2001-01-01 00:01:02.000001
2	2001-01-01 10:01:02.000000	2001-01-01 10:01:02.000001
3	2001-01-01 10:11:02.000000	2001-01-01 10:11:02.000001
DROP TABLE t1;
#
# Testing INSERT, MAX and MIN values
#
CREATE TABLE t1 (a DATETIME(6));
INSERT INTO t1 VALUES ('9999-12-31 23:59:59');
INSERT INTO t1 VALUES ('9999-12-31 23:59:59.1');
INSERT INTO t1 VALUES ('9999-12-31 24:00:00');
SELECT * FROM t1;
a
9999-12-31 23:59:59.000000
9999-12-31 23:59:59.100000
0000-00-00 00:00:00.000000
DROP TABLE t1;
#
# Testing integer INSERT values
#
CREATE TABLE t1 (a DATETIME(6));
INSERT INTO t1 VALUES (19990102);
INSERT INTO t1 VALUES (19990102112233);
INSERT INTO t1 VALUES (100000101112233);
INSERT INTO t1 VALUES (0);
INSERT INTO t1 VALUES (-1);
SELECT * FROM t1;
a
1999-01-02 00:00:00.000000
1999-01-02 11:22:33.000000
0000-00-00 00:00:00.000000
0000-00-00 00:00:00.000000
0000-00-00 00:00:00.000000
DROP TABLE t1;
#
# Testing decimal INSERT values
#
CREATE TABLE t1 (a DATETIME(6));
INSERT INTO t1 VALUES (20010101223344.4);
INSERT INTO t1 VALUES (20010101223344.45);
INSERT INTO t1 VALUES (20010101223344.456);
INSERT INTO t1 VALUES (20010101223344.4567);
INSERT INTO t1 VALUES (20010101223344.45678);
INSERT INTO t1 VALUES (20010101223344.456789);
INSERT INTO t1 VALUES (2001010120203.4567894);
INSERT INTO t1 VALUES (2001010120203.4567895);
INSERT INTO t1 VALUES (2001010120203.4567896);
INSERT INTO t1 VALUES (2001010120203.456789678);
INSERT INTO t1 VALUES (200101018385959.000000);
INSERT INTO t1 VALUES (-200101018385959.000000);
SELECT * FROM t1;
a
2001-01-01 22:33:44.400000
2001-01-01 22:33:44.450000
2001-01-01 22:33:44.456000
2001-01-01 22:33:44.456700
2001-01-01 22:33:44.456780
2001-01-01 22:33:44.456789
0200-10-10 12:02:03.456789
0200-10-10 12:02:03.456790
0200-10-10 12:02:03.456790
0200-10-10 12:02:03.456790
0000-00-00 00:00:00.000000
0000-00-00 00:00:00.000000
DROP TABLE t1;
#
# Testing double INSERT values
#
CREATE TABLE t1 (a DATETIME(6));
INSERT INTO t1 VALUES (112.233e-3);
INSERT INTO t1 VALUES (112.223e-2);
INSERT INTO t1 VALUES (112.233e-1);
INSERT INTO t1 VALUES (112.233e0);
INSERT INTO t1 VALUES (112.233e1);
INSERT INTO t1 VALUES (112.233e2);
INSERT INTO t1 VALUES (112.233e3);
INSERT INTO t1 VALUES (112.233e4);
INSERT INTO t1 VALUES (-123.456e0);
SELECT * FROM t1;
a
0000-00-00 00:00:00.000000
0000-00-00 00:00:00.000000
0000-00-00 00:00:00.000000
2000-01-12 00:00:00.000000
2000-11-22 00:00:00.000000
2001-12-23 00:00:00.000000
0000-00-00 00:00:00.000000
0000-00-00 00:00:00.000000
0000-00-00 00:00:00.000000
DROP TABLE t1;
#
# Testing UPDATE between DATETIME(6) and DATETIME/BIGINT/DECIMAL/DOUBLE
#
CREATE TABLE t1 (t0 DATETIME, t6 DATETIME(6), i BIGINT, d DECIMAL(20,6), f DOUBLE);
INSERT INTO t1 (t0) VALUES ('0000-00-00 11:22:33');
UPDATE t1 SET t6=t0, i=t0, d=t0, f=t0;
SELECT * FROM t1;
t0	t6	i	d	f
0000-00-00 11:22:33	0000-00-00 11:22:33.000000	112233	112233.000000	112233
UPDATE t1 SET t6='0000-00-00 11:22:33.1';
UPDATE t1 SET t0=t6, i=t6, d=t6, f=t6;
SELECT * FROM t1;
t0	t6	i	d	f
0000-00-00 11:22:33	0000-00-00 11:22:33.100000	112233	112233.100000	112233.1
UPDATE t1 SET i=20000101112233, d=20001010112233.1, f=00001010112233.1;
UPDATE t1 SET t6=i;
SELECT t6 FROM t1;
t6
2000-01-01 11:22:33.000000
UPDATE t1 SET t6=d;
SELECT t6 FROM t1;
t6
2000-10-10 11:22:33.100000
UPDATE t1 SET t6=f;
SELECT t6 FROM t1;
t6
2000-10-10 11:22:33.100000
DROP TABLE t1;
#
# Testing JOIN with comparison between DATETIME(6) and DATE
#
CREATE TABLE t1 (a DATETIME(6));
INSERT INTO t1 VALUES ('2000-01-01 00:00:00.000000');
INSERT INTO t1 VALUES ('2000-01-01 00:00:00.000001');
INSERT INTO t1 VALUES ('2000-01-02 00:00:00.000000');
CREATE TABLE t2 (a DATE);
INSERT INTO t2 VALUES ('2000-01-01');
INSERT INTO t2 VALUES ('2000-01-02');
SELECT * FROM t1, t2 WHERE t1.a=t2.a ORDER BY t1.a, t2.a;
a	a
2000-01-01 00:00:00.000000	2000-01-01
2000-01-02 00:00:00.000000	2000-01-02
DROP TABLE t2;
DROP TABLE t1;
#
# Testing JOIN with comparison between DATETIME(6) and BIGINT
#
CREATE TABLE t1 (a DATETIME(6));
INSERT INTO t1 VALUES ('2000-01-01 00:00:00');
INSERT INTO t1 VALUES ('2000-01-01 11:22:33');
INSERT INTO t1 VALUES ('2000-01-01 11:22:33.123');
CREATE TABLE t2 (b BIGINT);
INSERT INTO t2 VALUES (20000101);
INSERT INTO t2 VALUES (20000101112233);
SELECT * FROM t1, t2 WHERE a=b;
a	b
2000-01-01 00:00:00.000000	20000101
2000-01-01 11:22:33.000000	20000101112233
DROP TABLE t1, t2;
#
# Testing JOIN with comparison between DATETIME(6) and DECIMAL(20,6)
#
CREATE TABLE t1 (a DATETIME(6));
INSERT INTO t1 VALUES ('2001-01-01 11:22:33');
INSERT INTO t1 VALUES ('2001-01-01 11:22:33.123');
INSERT INTO t1 VALUES ('2001-01-01 11:22:33.123456');
CREATE TABLE t2 (b DECIMAL(20,6));
INSERT INTO t2 VALUES (20010101112233);
INSERT INTO t2 VALUES (20010101112233.123);
INSERT INTO t2 VALUES (20010101112233.123456);
SELECT * FROM t1, t2 WHERE a=b;
a	b
2001-01-01 11:22:33.000000	20010101112233.000000
2001-01-01 11:22:33.123000	20010101112233.123000
2001-01-01 11:22:33.123456	20010101112233.123456
DROP TABLE t1, t2;
#
# Testing JOIN with comparison between DATETIME(6) and DECIMAL(20,3)
#
CREATE TABLE t1 (a DATETIME(6));
INSERT INTO t1 VALUES ('2001-01-01 11:22:33');
INSERT INTO t1 VALUES ('2001-01-01 11:22:33.123');
INSERT INTO t1 VALUES ('2001-01-01 11:22:33.123456');
CREATE TABLE t2 (b DECIMAL(20,3));
INSERT INTO t2 VALUES (20010101112233);
INSERT INTO t2 VALUES (20010101112233.123);
SELECT * FROM t1, t2 WHERE a=b;
a	b
2001-01-01 11:22:33.000000	20010101112233.000
2001-01-01 11:22:33.123000	20010101112233.123
DROP TABLE t1, t2;
#
# Testing JOIN with comparison between DATETIME(6) and DOUBLE
#
CREATE TABLE t1 (a DATETIME(6));
INSERT INTO t1 VALUES ('0000-00-00 11:22:33');
INSERT INTO t1 VALUES ('0000-00-00 11:22:33.123');
INSERT INTO t1 VALUES ('0000-00-00 11:22:33.123456');
CREATE TABLE t2 (b DOUBLE);
INSERT INTO t2 VALUES (112233);
INSERT INTO t2 VALUES (112233.123);
INSERT INTO t2 VALUES (112233.123456);
SELECT * FROM t1, t2 WHERE a=b;
a	b
DROP TABLE t1, t2;
#
# Testing JOIN with comparison between DATETIME(6) and VARCHAR
#
CREATE TABLE t1 (a DATETIME(6));
INSERT INTO t1 VALUES ('2001-01-01 11:22:33');
INSERT INTO t1 VALUES ('2001-01-01 11:22:33.123');
CREATE TABLE t2 (b VARCHAR(64));
INSERT INTO t2 VALUES ('2001-01-01 11:22:33.123');
INSERT INTO t2 VALUES ('2001-01-01 11:22:33.1230');
INSERT INTO t2 VALUES ('2001-01-01 11:22:33.12300');
INSERT INTO t2 VALUES ('2001-01-01 11:22:33.123000');
INSERT INTO t2 VALUES ('2001-01-01 11:22:33');
INSERT INTO t2 VALUES ('2001-01-01 11:22:33.');
INSERT INTO t2 VALUES ('2001-01-01 11:22:33.0');
INSERT INTO t2 VALUES ('2001-01-01 11:22:33.00');
INSERT INTO t2 VALUES ('2001-01-01 11:22:33.000');
INSERT INTO t2 VALUES ('2001-01-01 11:22:33.0000');
INSERT INTO t2 VALUES ('2001-01-01 11:22:33.00000');
INSERT INTO t2 VALUES ('2001-01-01 11:22:33.000000');
SELECT * FROM t1, t2 WHERE a=b ORDER BY BINARY a, BINARY b;
a	b
2001-01-01 11:22:33.000000	2001-01-01 11:22:33
2001-01-01 11:22:33.000000	2001-01-01 11:22:33.
2001-01-01 11:22:33.000000	2001-01-01 11:22:33.0
2001-01-01 11:22:33.000000	2001-01-01 11:22:33.00
2001-01-01 11:22:33.000000	2001-01-01 11:22:33.000
2001-01-01 11:22:33.000000	2001-01-01 11:22:33.0000
2001-01-01 11:22:33.000000	2001-01-01 11:22:33.00000
2001-01-01 11:22:33.000000	2001-01-01 11:22:33.000000
2001-01-01 11:22:33.123000	2001-01-01 11:22:33.123
2001-01-01 11:22:33.123000	2001-01-01 11:22:33.1230
2001-01-01 11:22:33.123000	2001-01-01 11:22:33.12300
2001-01-01 11:22:33.123000	2001-01-01 11:22:33.123000
ALTER TABLE t1 ADD KEY (a);
SELECT * FROM t1, t2 WHERE a=b ORDER BY BINARY a, BINARY b;
a	b
2001-01-01 11:22:33.000000	2001-01-01 11:22:33
2001-01-01 11:22:33.000000	2001-01-01 11:22:33.
2001-01-01 11:22:33.000000	2001-01-01 11:22:33.0
2001-01-01 11:22:33.000000	2001-01-01 11:22:33.00
2001-01-01 11:22:33.000000	2001-01-01 11:22:33.000
2001-01-01 11:22:33.000000	2001-01-01 11:22:33.0000
2001-01-01 11:22:33.000000	2001-01-01 11:22:33.00000
2001-01-01 11:22:33.000000	2001-01-01 11:22:33.000000
2001-01-01 11:22:33.123000	2001-01-01 11:22:33.123
2001-01-01 11:22:33.123000	2001-01-01 11:22:33.1230
2001-01-01 11:22:33.123000	2001-01-01 11:22:33.12300
2001-01-01 11:22:33.123000	2001-01-01 11:22:33.123000
ALTER TABLE t2 ADD KEY(b);
SELECT * FROM t1, t2 WHERE a=b ORDER BY BINARY a, BINARY b;
a	b
2001-01-01 11:22:33.000000	2001-01-01 11:22:33
2001-01-01 11:22:33.000000	2001-01-01 11:22:33.
2001-01-01 11:22:33.000000	2001-01-01 11:22:33.0
2001-01-01 11:22:33.000000	2001-01-01 11:22:33.00
2001-01-01 11:22:33.000000	2001-01-01 11:22:33.000
2001-01-01 11:22:33.000000	2001-01-01 11:22:33.0000
2001-01-01 11:22:33.000000	2001-01-01 11:22:33.00000
2001-01-01 11:22:33.000000	2001-01-01 11:22:33.000000
2001-01-01 11:22:33.123000	2001-01-01 11:22:33.123
2001-01-01 11:22:33.123000	2001-01-01 11:22:33.1230
2001-01-01 11:22:33.123000	2001-01-01 11:22:33.12300
2001-01-01 11:22:33.123000	2001-01-01 11:22:33.123000
ALTER TABLE t1 DROP KEY a;
SELECT * FROM t1, t2 WHERE a=b ORDER BY BINARY a, BINARY b;
a	b
2001-01-01 11:22:33.000000	2001-01-01 11:22:33
2001-01-01 11:22:33.000000	2001-01-01 11:22:33.
2001-01-01 11:22:33.000000	2001-01-01 11:22:33.0
2001-01-01 11:22:33.000000	2001-01-01 11:22:33.00
2001-01-01 11:22:33.000000	2001-01-01 11:22:33.000
2001-01-01 11:22:33.000000	2001-01-01 11:22:33.0000
2001-01-01 11:22:33.000000	2001-01-01 11:22:33.00000
2001-01-01 11:22:33.000000	2001-01-01 11:22:33.000000
2001-01-01 11:22:33.123000	2001-01-01 11:22:33.123
2001-01-01 11:22:33.123000	2001-01-01 11:22:33.1230
2001-01-01 11:22:33.123000	2001-01-01 11:22:33.12300
2001-01-01 11:22:33.123000	2001-01-01 11:22:33.123000
DROP TABLE t1, t2;
#
# Testing copy from DATETIME to DATETIME(6) and vice versa
#
CREATE TABLE t1 (a DATETIME(6), b DATETIME);
INSERT INTO t1 VALUES ('2001-01-01 01:02:03.123456','0000-00-00 00:00:00');
UPDATE t1 SET b=a;
SELECT * FROM t1;
a	b
2001-01-01 01:02:03.123456	2001-01-01 01:02:03
UPDATE t1 SET b='2002-02-02 10:11:12';
UPDATE t1 SET a=b;
SELECT * FROM t1;
a	b
2002-02-02 10:11:12.000000	2002-02-02 10:11:12
DROP TABLE t1;
#
# Testing ALTER from DATETIME(6) to DATETIME and vice versa
#
CREATE TABLE t1 (a DATETIME);
INSERT INTO t1 VALUES ('2000-01-01 01:02:03');
ALTER TABLE t1 MODIFY a DATETIME(6);
SELECT * FROM t1;
a
2000-01-01 01:02:03.000000
UPDATE t1 SET a='2000-01-01 01:03:03.456';
SELECT * FROM t1;
a
2000-01-01 01:03:03.456000
ALTER TABLE t1 MODIFY a DATETIME;
SELECT * FROM t1;
a
2000-01-01 01:03:03
DROP TABLE t1;
#
# Testing INT value and CAST of DATETIME(6) to various other types
#
CREATE TABLE t1 (a DATETIME(6));
INSERT INTO t1 VALUES ('2001-01-01 11:22:33.123');
INSERT INTO t1 VALUES ('2001-01-01 11:22:33.999');
INSERT INTO t1 VALUES ('2001-12-31 23:59:58.499');
INSERT INTO t1 VALUES ('2001-12-31 23:59:58.999');
INSERT INTO t1 VALUES ('2001-12-31 23:59:59.499');
INSERT INTO t1 VALUES ('2001-12-31 23:59:59.999');
SELECT a << 0 FROM t1;
a << 0
20010101112233
20010101112233
20011231235958
20011231235958
20011231235959
20011231235959
SELECT CAST(a AS SIGNED) FROM t1;
CAST(a AS SIGNED)
20010101112233
20010101112233
20011231235958
20011231235958
20011231235959
20011231235959
SELECT CAST(a AS UNSIGNED) FROM t1;
CAST(a AS UNSIGNED)
20010101112233
20010101112233
20011231235958
20011231235958
20011231235959
20011231235959
SELECT CAST(a AS DECIMAL(30,6)) FROM t1;
CAST(a AS DECIMAL(30,6))
20010101112233.123000
20010101112233.999000
20011231235958.499000
20011231235958.999000
20011231235959.499000
20011231235959.999000
SELECT CAST(a AS DECIMAL(30,3)) FROM t1;
CAST(a AS DECIMAL(30,3))
20010101112233.123
20010101112233.999
20011231235958.499
20011231235958.999
20011231235959.499
20011231235959.999
SELECT CAST(a AS CHAR) FROM t1;
CAST(a AS CHAR)
2001-01-01 11:22:33.123000
2001-01-01 11:22:33.999000
2001-12-31 23:59:58.499000
2001-12-31 23:59:58.999000
2001-12-31 23:59:59.499000
2001-12-31 23:59:59.999000
SELECT CAST(a AS CHAR(6)) FROM t1;
CAST(a AS CHAR(6))
2001-0
2001-0
2001-1
2001-1
2001-1
2001-1
DROP TABLE t1;
#
# Testing comparison between TIME and DATETIME
# This tests Field_time[f]::val_date_temporal()
#
SET @@timestamp=UNIX_TIMESTAMP('2001-01-01 10:20:30.123');
CREATE TABLE t1 (a TIME, b DATETIME, a6 TIME(6), b6 DATETIME(6));
INSERT INTO t1 VALUES
(current_time, current_timestamp, current_time(6), current_timestamp(6));
SELECT a, b FROM t1 WHERE a=b;
a	b
10:20:30	2001-01-01 10:20:30
SELECT a6, b6 FROM t1 WHERE a6=b6;
a6	b6
10:20:30.123000	2001-01-01 10:20:30.123000
# In this query both expressions make DATETIME data type
SELECT LEAST(a,b), LEAST(b,a) FROM t1;
LEAST(a,b)	LEAST(b,a)
2001-01-01 10:20:30	2001-01-01 10:20:30
SELECT CONCAT(LEAST(a,b)), CONCAT(LEAST(b,a)) FROM t1;
CONCAT(LEAST(a,b))	CONCAT(LEAST(b,a))
2001-01-01 10:20:30	2001-01-01 10:20:30
# In this query all expressions make VARCHAR data type
# So the result format depends on which value wins, with the first value having higher precedence:
SELECT LEAST(a,b,'2001-01-02'), LEAST(b,a,'2001-01-02'), LEAST(a,b,'2000-01-01') FROM t1;
LEAST(a,b,'2001-01-02')	LEAST(b,a,'2001-01-02')	LEAST(a,b,'2000-01-01')
10:20:30	2001-01-01 10:20:30	2000-01-01
# More tests with LEAST:
SELECT a, b FROM t1 WHERE a=LEAST(a,a);
a	b
10:20:30	2001-01-01 10:20:30
SELECT a, b FROM t1 WHERE a=LEAST(a,b);
a	b
10:20:30	2001-01-01 10:20:30
DROP TABLE t1;
SET @@timestamp=DEFAULT;
#
# Comparison between DATETIME column and constant TIME epxression
#
CREATE TABLE t1 (a DATETIME(6));
SET @@timestamp=UNIX_TIMESTAMP('2010-01-01 10:50:50.123');
SELECT NOW(6);
NOW(6)
2010-01-01 10:50:50.123000
INSERT INTO t1 VALUES (CURRENT_TIMESTAMP(6)), ('2010-01-01 00:00:00');
SELECT * FROM t1 WHERE a=TIME'10:50:50.123';
a
2010-01-01 10:50:50.123000
SELECT * FROM t1 WHERE a=CURRENT_TIME(6);
a
2010-01-01 10:50:50.123000
SELECT * FROM t1 WHERE TIME'10:50:50.123'=a;
a
2010-01-01 10:50:50.123000
SELECT * FROM t1 WHERE CURRENT_TIME(6)=a;
a
2010-01-01 10:50:50.123000
DROP TABLE t1;
SET @@timestamp=DEFAULT;
#
# BETWEEN for combinations of DATETIME and TIME
#
SET @@timestamp=UNIX_TIMESTAMP('2010-01-01 10:50:50.123');
CREATE TABLE t1 (a DATETIME(6));
INSERT INTO t1 VALUES
('2010-01-01 10:50:50.100'), ('2010-01-01 10:50:50.123'), ('2010-01-01 10:50:50.200');
SELECT * FROM t1 WHERE a BETWEEN TIME'10:50:50.120' AND TIME'10:50:50.123';
a
2010-01-01 10:50:50.123000
SELECT * FROM t1 WHERE a BETWEEN TIMESTAMP'2010-01-01 10:50:50.120' AND TIME'10:50:50.123';
a
2010-01-01 10:50:50.123000
SELECT * FROM t1 WHERE a BETWEEN TIME'10:50:50.120' AND TIMESTAMP'2010-01-01 10:50:50.123';
a
2010-01-01 10:50:50.123000
DROP TABLE t1;
SET @@timestamp=DEFAULT;
#
# Testing DEFAULT value
#
CREATE TABLE t1 (a DATETIME(6) NOT NULL DEFAULT '2000-01-01 11:22:33.123456');
SHOW CREATE TABLE t1;
Table	Create Table
t1	CREATE TABLE `t1` (
  `a` datetime(6) NOT NULL DEFAULT '2000-01-01 11:22:33.123456'
) ORGANIZATION INDEX DEFAULT CHARSET = utf8mb4 COMPRESSION = 'lz4_1.0' REPLICA_NUM = 1 BLOCK_SIZE = 16384 USE_BLOOM_FILTER = FALSE ENABLE_MACRO_BLOCK_BLOOM_FILTER = FALSE TABLET_SIZE = 134217728 PCTFREE = 10
DROP TABLE t1;
#
# Testing DATETIME(6) field in combination with DATETIME type functions
#
CREATE TABLE t1 (a DATETIME(6), b TIME(6));
INSERT INTO t1 VALUES ('2001-01-01 10:00:00.123456', '10:00:00.123456');
INSERT INTO t1 VALUES ('2001-01-01 10:00:00', '10:00:00');
DELETE FROM t1;
INSERT INTO t1 VALUES (CURRENT_TIMESTAMP, CURRENT_TIME);
SELECT COUNT(*) FROM t1 WHERE a <= CURRENT_TIMESTAMP;
COUNT(*)
1
DROP TABLE t1;
#
# Testing partitions
#
CREATE TABLE t1 (a DATETIME(6)) PARTITION BY KEY(a) PARTITIONS 4;
INSERT INTO t1 VALUES ('2001-01-01 00:00:00.000000');
INSERT INTO t1 VALUES ('2001-01-01 00:00:00.000001');
INSERT INTO t1 VALUES ('2001-01-01 00:00:00.000002');
INSERT INTO t1 VALUES ('2001-01-01 00:00:00.000003');
INSERT INTO t1 VALUES ('2001-01-01 00:00:00.000004');
INSERT INTO t1 VALUES ('2001-01-01 00:00:00.000005');
INSERT INTO t1 VALUES ('2001-01-01 00:00:00.000006');
INSERT INTO t1 VALUES ('2001-01-01 00:00:00.000010');
INSERT INTO t1 VALUES ('2001-01-01 00:00:00.000011');
INSERT INTO t1 VALUES ('2001-01-01 00:00:00.000012');
INSERT INTO t1 VALUES ('2001-01-01 00:00:00.000013');
INSERT INTO t1 VALUES ('2001-01-01 00:00:00.000014');
INSERT INTO t1 VALUES ('2001-01-01 00:00:00.000015');
INSERT INTO t1 VALUES ('2001-01-01 00:00:00.000016');
INSERT INTO t1 VALUES ('2001-01-01 00:00:00.000110');
INSERT INTO t1 VALUES ('2001-01-01 00:00:00.000111');
INSERT INTO t1 VALUES ('2001-01-01 00:00:00.000112');
INSERT INTO t1 VALUES ('2001-01-01 00:00:00.000113');
INSERT INTO t1 VALUES ('2001-01-01 00:00:00.000114');
INSERT INTO t1 VALUES ('2001-01-01 00:00:00.000115');
INSERT INTO t1 VALUES ('2001-01-01 00:00:00.000116');
INSERT INTO t1 VALUES ('2001-01-01 00:00:00.000210');
INSERT INTO t1 VALUES ('2001-01-01 00:00:00.000211');
INSERT INTO t1 VALUES ('2001-01-01 00:00:00.000212');
INSERT INTO t1 VALUES ('2001-01-01 00:00:00.000213');
INSERT INTO t1 VALUES ('2001-01-01 00:00:00.000214');
INSERT INTO t1 VALUES ('2001-01-01 00:00:00.000215');
INSERT INTO t1 VALUES ('2001-01-01 00:00:00.000216');
INSERT INTO t1 VALUES ('2001-01-01 00:00:01.000000');
INSERT INTO t1 VALUES ('2001-01-01 00:00:01.000001');
INSERT INTO t1 VALUES ('2001-01-01 00:00:01.000002');
INSERT INTO t1 VALUES ('2001-01-01 00:00:01.000003');
INSERT INTO t1 VALUES ('2001-01-01 00:00:01.000004');
INSERT INTO t1 VALUES ('2001-01-01 00:00:01.000005');
INSERT INTO t1 VALUES ('2001-01-01 00:00:01.000006');
INSERT INTO t1 VALUES ('2001-01-01 00:00:02.000000');
INSERT INTO t1 VALUES ('2001-01-01 00:00:02.000001');
INSERT INTO t1 VALUES ('2001-01-01 00:00:02.000002');
INSERT INTO t1 VALUES ('2001-01-01 00:00:02.000003');
INSERT INTO t1 VALUES ('2001-01-01 00:00:02.000004');
INSERT INTO t1 VALUES ('2001-01-01 00:00:02.000005');
INSERT INTO t1 VALUES ('2001-01-01 00:00:02.000006');
SELECT * FROM t1 PARTITION(p0) order by a;
a
2001-01-01 00:00:00.000004
2001-01-01 00:00:00.000006
2001-01-01 00:00:00.000014
2001-01-01 00:00:00.000015
2001-01-01 00:00:00.000016
2001-01-01 00:00:00.000113
2001-01-01 00:00:00.000115
2001-01-01 00:00:00.000214
2001-01-01 00:00:00.000215
2001-01-01 00:00:01.000005
2001-01-01 00:00:02.000001
2001-01-01 00:00:02.000002
2001-01-01 00:00:02.000006
SELECT * FROM t1 PARTITION(p1) order by a;
a
2001-01-01 00:00:00.000000
2001-01-01 00:00:00.000010
2001-01-01 00:00:00.000011
2001-01-01 00:00:00.000110
2001-01-01 00:00:00.000213
2001-01-01 00:00:01.000001
2001-01-01 00:00:02.000000
2001-01-01 00:00:02.000003
SELECT * FROM t1 PARTITION(p2) order by a;
a
2001-01-01 00:00:00.000001
2001-01-01 00:00:00.000003
2001-01-01 00:00:00.000111
2001-01-01 00:00:00.000116
2001-01-01 00:00:00.000210
2001-01-01 00:00:00.000211
2001-01-01 00:00:01.000002
2001-01-01 00:00:01.000004
2001-01-01 00:00:02.000004
SELECT * FROM t1 PARTITION(p3) order by a;
a
2001-01-01 00:00:00.000002
2001-01-01 00:00:00.000005
2001-01-01 00:00:00.000012
2001-01-01 00:00:00.000013
2001-01-01 00:00:00.000112
2001-01-01 00:00:00.000114
2001-01-01 00:00:00.000212
2001-01-01 00:00:00.000216
2001-01-01 00:00:01.000000
2001-01-01 00:00:01.000003
2001-01-01 00:00:01.000006
2001-01-01 00:00:02.000005
DROP TABLE t1;
SELECT CAST(1e300 AS DATETIME);
CAST(1e300 AS DATETIME)
NULL
SELECT CAST(999999999999999999999999.999 AS DATETIME);
CAST(999999999999999999999999.999 AS DATETIME)
NULL
SELECT CAST(9223372036854775807 AS DATETIME);
CAST(9223372036854775807 AS DATETIME)
NULL
#
# Testing Item_time_typecast::val_int_packed()
#
CREATE TABLE t1 (a DATETIME, b DATETIME(6));
INSERT INTO t1 VALUES ('2001-01-01 23:00:00', '2001-01-01 23:00:00.123456');
SELECT CAST('2001-01-01 23:00:00' AS DATETIME) = (SELECT a FROM t1);
CAST('2001-01-01 23:00:00' AS DATETIME) = (SELECT a FROM t1)
1
DROP TABLE t1;
#
# Testing function MICROSECOND
#
CREATE TABLE t1 (a DATETIME(6));
INSERT INTO t1 VALUES ('2001-01-01 11:12:13.000001');
INSERT INTO t1 VALUES ('2001-01-01 11:12:13.100001');
INSERT INTO t1 VALUES ('2001-01-01 11:12:13.999999');
SELECT a, EXTRACT(MICROSECOND FROM a) FROM t1;
a	EXTRACT(MICROSECOND FROM a)
2001-01-01 11:12:13.000001	1
2001-01-01 11:12:13.100001	100001
2001-01-01 11:12:13.999999	999999
DROP TABLE t1;
#
# Testing DATETIME(6) and user variables
#
CREATE TABLE t1 (a DATETIME(6));
INSERT INTO t1 VALUES ('2001-01-01 11:22:33.123456');
INSERT INTO t1 VALUES ('0000-00-00 00:00:00.123456');
SET @a='2001-01-01 11:22:33.123456';
SELECT * FROM t1 WHERE a=@a;
a
2001-01-01 11:22:33.123456
SET @a=20010101112233.123456;
SELECT * FROM t1 WHERE a=@a;
a
2001-01-01 11:22:33.123456
SET @a=0.123456e0;
SELECT * FROM t1 WHERE a=@a;
a
DROP TABLE t1;
#
# Testing INFORMATION_SCHEMA.COLUMNS
#
CREATE TABLE t1 (a DATETIME(6));
DROP TABLE t1;
#
# SELECT from a subquery
#
CREATE TABLE t1 (a DATETIME(6));
INSERT INTO t1 VALUES ('2001-01-01 00:00:00.123456'), ('2001-01-01 11:11:11.123456');
SELECT * FROM (SELECT * FROM t1) t12;
a
2001-01-01 00:00:00.123456
2001-01-01 11:11:11.123456
DROP TABLE t1;
#
# Testing IN and = subqueries
#
CREATE TABLE t1 (a DATETIME(6));
INSERT INTO t1 VALUES ('2001-01-01 00:00:00.123456'), ('2001-01-01 11:11:11.123456');
SELECT * FROM t1 WHERE a IN (SELECT MIN(a) FROM t1);
a
2001-01-01 00:00:00.123456
SELECT * FROM t1 WHERE a = (SELECT a FROM t1 ORDER BY a DESC LIMIT 1);
a
2001-01-01 11:11:11.123456
DROP TABLE t1;
#
# Testing IN subquery + GROUP
#
CREATE TABLE t1 (id INT, a DATETIME(6));
INSERT INTO t1 VALUES (1, '2001-01-01 00:00:00.123456'), (1, '2001-01-01 11:00:00.123456');
INSERT INTO t1 VALUES (2, '2001-01-01 00:01:00.123456'), (2, '2001-01-01 11:01:00.123456');
INSERT INTO t1 VALUES (3, NULL);
SELECT * FROM t1 WHERE a IN (SELECT MAX(a) FROM t1 GROUP BY id);
id	a
1	2001-01-01 11:00:00.123456
2	2001-01-01 11:01:00.123456
DROP TABLE t1;
#
# Testing VIEW
#
CREATE TABLE t1 (a DATETIME(6));
INSERT INTO t1 VALUES ('2001-01-01 00:00:00.123456'), ('2001-01-01 11:11:11.123456');
CREATE VIEW v1 AS SELECT a FROM t1;
SELECT * FROM v1 WHERE a='2001-01-01 00:00:00.123456';
a
2001-01-01 00:00:00.123456
SELECT MIN(a), MAX(a) FROM v1;
MIN(a)	MAX(a)
2001-01-01 00:00:00.123456	2001-01-01 11:11:11.123456
SELECT * FROM t1 WHERE a IN (SELECT MAX(a) FROM v1);
a
2001-01-01 11:11:11.123456
DROP VIEW v1;
CREATE VIEW v1 AS SELECT MAX(a) AS a FROM t1;
SELECT * FROM v1;
a
2001-01-01 11:11:11.123456
SELECT * FROM t1 WHERE a=(SELECT a FROM v1);
a
2001-01-01 11:11:11.123456
DROP VIEW v1;
DROP TABLE t1;
#
# Testing that CAST from various fields to DATETIME rounds.
# This tests Field::get_date().
#
CREATE TABLE t1 (a VARCHAR(32));
INSERT INTO t1 VALUES('9999-12-31 23:59:59.0000009'), ('9999-12-31 23:59:59.9'),('2001-01-01 10:10:10.9999994'), ('2001-01-01 10:10:10.9999995');
SELECT a, CAST(a AS DATETIME) FROM t1;
a	CAST(a AS DATETIME)
9999-12-31 23:59:59.0000009	9999-12-31 23:59:59
9999-12-31 23:59:59.9	NULL
2001-01-01 10:10:10.9999994	2001-01-01 10:10:11
2001-01-01 10:10:10.9999995	2001-01-01 10:10:11
DROP TABLE t1;
CREATE TABLE t1 (a DECIMAL(30, 7));
INSERT INTO t1 VALUES  (99991231235959.0000009), (99991231235959.9), (20010101101010.9999994), (20010101101010.9999995);
SELECT a, CAST(a AS DATETIME) FROM t1;
a	CAST(a AS DATETIME)
99991231235959.0000009	9999-12-31 23:59:59
99991231235959.9000000	NULL
20010101101010.9999994	2001-01-01 10:10:11
20010101101010.9999995	2001-01-01 10:10:11
DROP TABLE t1;
#
# Testing that comparison rounds
#
CREATE TABLE t1 (t0 DATETIME, t6 DATETIME(6));
INSERT INTO t1 VALUES ('2001-01-01 00:00:00', '2001-01-01 00:00:00.999999');
INSERT INTO t1 VALUES ('2001-01-01 00:00:01', '2001-01-01 00:00:01.000000');
SELECT t0 FROM t1 WHERE t6='2001-01-01 00:00:00.9999998';
t0
2001-01-01 00:00:01
SELECT t6 FROM t1 WHERE t6='2001-01-01 00:00:00.9999998';
t6
2001-01-01 00:00:01.000000
DROP TABLE t1;
#
# Testing that EXTRACT rounds
SELECT EXTRACT(MICROSECOND FROM '2001-01-01 00:00:00.9999994'), EXTRACT(MICROSECOND FROM '2001-01-01 00:00:00.9999995'),  EXTRACT(MICROSECOND FROM 20010101000000.9999994),EXTRACT(MICROSECOND FROM 20010101000000.9999995);
EXTRACT(MICROSECOND FROM '2001-01-01 00:00:00.9999994')	EXTRACT(MICROSECOND FROM '2001-01-01 00:00:00.9999995')	EXTRACT(MICROSECOND FROM 20010101000000.9999994)	EXTRACT(MICROSECOND FROM 20010101000000.9999995)
999999	0	999999	0
#
# Testing that TIMESTAMP(0) is a synonym to non-fractional TIMESTAMP
#
CREATE TABLE t1 (a TIMESTAMP(0) NOT NULL DEFAULT CURRENT_TIMESTAMP(0) ON UPDATE CURRENT_TIMESTAMP(0));
SHOW CREATE TABLE t1;
Table	Create Table
t1	CREATE TABLE `t1` (
  `a` timestamp NOT NULL DEFAULT CURRENT_TIMESTAMP ON UPDATE CURRENT_TIMESTAMP
) ORGANIZATION INDEX DEFAULT CHARSET = utf8mb4 COMPRESSION = 'lz4_1.0' REPLICA_NUM = 1 BLOCK_SIZE = 16384 USE_BLOOM_FILTER = FALSE ENABLE_MACRO_BLOCK_BLOOM_FILTER = FALSE TABLET_SIZE = 134217728 PCTFREE = 10
DROP TABLE t1;
#
# Testing bad FSPs
#
CREATE TABLE t1 (a TIMESTAMP(-1));
ERROR 42000: You have an error in your SQL syntax; check the manual that corresponds to your OceanBase version for the right syntax to use near '-1))' at line 1
CREATE TABLE t1 (a TIMESTAMP(7));
ERROR 42000: Too big precision 7 specified for column 'a'. Maximum is 6.
CREATE TABLE t1 (a TIMESTAMP(31));
ERROR 42000: Too big precision 31 specified for column 'a'. Maximum is 6.
#
# Testing rounding when altering TIMESTAMP(N) to a smaller size
#
CREATE TABLE t1 (a TIMESTAMP(6) NOT NULL DEFAULT CURRENT_TIMESTAMP(6) ON UPDATE CURRENT_TIMESTAMP(6));
INSERT INTO t1 VALUES ('2001-01-01 10:10:10.999999');
ALTER TABLE t1 MODIFY a TIMESTAMP(5);
SELECT * FROM t1;
a
2001-01-01 10:10:11.00000
DROP TABLE t1;
#
# Testing rounding from VARCHAR and DATETIME(6) to TIMESTAMP(N)
#
CREATE TABLE t1 (a VARCHAR(32), t6 TIMESTAMP(6) NULL DEFAULT NULL, t5 TIMESTAMP(5) NULL DEFAULT NULL, t4 TIMESTAMP(4) NULL DEFAULT NULL, t3 TIMESTAMP(3) NULL DEFAULT NULL, t2 TIMESTAMP(2) NULL DEFAULT NULL, t1 TIMESTAMP(1) NULL DEFAULT NULL,t0 TIMESTAMP    NULL DEFAULT NULL);
INSERT INTO t1 (a) VALUES ('2001-01-01 10:10:10.999999');
INSERT INTO t1 (a) VALUES ('2001-01-01 10:10:10.999994');
INSERT INTO t1 (a) VALUES ('2001-01-01 10:10:10.999949');
INSERT INTO t1 (a) VALUES ('2001-01-01 10:10:10.999499');
INSERT INTO t1 (a) VALUES ('2001-01-01 10:10:10.994999');
INSERT INTO t1 (a) VALUES ('2001-01-01 10:10:10.949999');
INSERT INTO t1 (a) VALUES ('2001-01-01 10:10:10.499999');
UPDATE t1 SET t0=a, t1=a, t2=a, t3=a, t4=a, t5=a, t6=a;
SELECT * FROM t1;
a	t6	t5	t4	t3	t2	t1	t0
2001-01-01 10:10:10.999999	2001-01-01 10:10:10.999999	2001-01-01 10:10:11.00000	2001-01-01 10:10:11.0000	2001-01-01 10:10:11.000	2001-01-01 10:10:11.00	2001-01-01 10:10:11.0	2001-01-01 10:10:11
2001-01-01 10:10:10.999994	2001-01-01 10:10:10.999994	2001-01-01 10:10:10.99999	2001-01-01 10:10:11.0000	2001-01-01 10:10:11.000	2001-01-01 10:10:11.00	2001-01-01 10:10:11.0	2001-01-01 10:10:11
2001-01-01 10:10:10.999949	2001-01-01 10:10:10.999949	2001-01-01 10:10:10.99995	2001-01-01 10:10:10.9999	2001-01-01 10:10:11.000	2001-01-01 10:10:11.00	2001-01-01 10:10:11.0	2001-01-01 10:10:11
2001-01-01 10:10:10.999499	2001-01-01 10:10:10.999499	2001-01-01 10:10:10.99950	2001-01-01 10:10:10.9995	2001-01-01 10:10:10.999	2001-01-01 10:10:11.00	2001-01-01 10:10:11.0	2001-01-01 10:10:11
2001-01-01 10:10:10.994999	2001-01-01 10:10:10.994999	2001-01-01 10:10:10.99500	2001-01-01 10:10:10.9950	2001-01-01 10:10:10.995	2001-01-01 10:10:10.99	2001-01-01 10:10:11.0	2001-01-01 10:10:11
2001-01-01 10:10:10.949999	2001-01-01 10:10:10.949999	2001-01-01 10:10:10.95000	2001-01-01 10:10:10.9500	2001-01-01 10:10:10.950	2001-01-01 10:10:10.95	2001-01-01 10:10:10.9	2001-01-01 10:10:11
2001-01-01 10:10:10.499999	2001-01-01 10:10:10.499999	2001-01-01 10:10:10.50000	2001-01-01 10:10:10.5000	2001-01-01 10:10:10.500	2001-01-01 10:10:10.50	2001-01-01 10:10:10.5	2001-01-01 10:10:10
DROP TABLE t1;
#
# Testing rounding from TIMESTAMP(N) to BIGINT
#
CREATE TABLE t1 (a BIGINT, b TIMESTAMP(6) NULL DEFAULT NULL);
INSERT INTO t1 (b) VALUES ('2001-01-01 10:10:59.500000');
INSERT INTO t1 (b) VALUES ('2001-01-01 10:10:10.500000');
INSERT INTO t1 (b) VALUES ('2001-01-01 10:10:10.499999');
UPDATE t1 SET a=b;
SELECT * FROM t1;
a	b
20010101101059	2001-01-01 10:10:59.500000
20010101101010	2001-01-01 10:10:10.500000
20010101101010	2001-01-01 10:10:10.499999
DROP TABLE t1;
#
# Testing rounding from DECIMAL to TIMESTAMP(N)
#
CREATE TABLE t1 (a DECIMAL(30,6), t6 TIMESTAMP(6), t5 TIMESTAMP(5), t4 TIMESTAMP(4), t3 TIMESTAMP(3), t2 TIMESTAMP(2), t1 TIMESTAMP(1),t0 TIMESTAMP);
INSERT INTO t1 (a) VALUES (20010101101010.999999);
INSERT INTO t1 (a) VALUES (20010101101010.999994);
INSERT INTO t1 (a) VALUES (20010101101010.999949);
INSERT INTO t1 (a) VALUES (20010101101010.999499);
INSERT INTO t1 (a) VALUES (20010101101010.994999);
INSERT INTO t1 (a) VALUES (20010101101010.949999);
INSERT INTO t1 (a) VALUES (20010101101010.499999);
UPDATE t1 SET t0=a, t1=a, t2=a, t3=a, t4=a, t5=a, t6=a;
SELECT * FROM t1;
a	t6	t5	t4	t3	t2	t1	t0
20010101101010.999999	2001-01-01 10:10:10.999999	2001-01-01 10:10:11.00000	2001-01-01 10:10:11.0000	2001-01-01 10:10:11.000	2001-01-01 10:10:11.00	2001-01-01 10:10:11.0	2001-01-01 10:10:11
20010101101010.999994	2001-01-01 10:10:10.999994	2001-01-01 10:10:10.99999	2001-01-01 10:10:11.0000	2001-01-01 10:10:11.000	2001-01-01 10:10:11.00	2001-01-01 10:10:11.0	2001-01-01 10:10:11
20010101101010.999949	2001-01-01 10:10:10.999949	2001-01-01 10:10:10.99995	2001-01-01 10:10:10.9999	2001-01-01 10:10:11.000	2001-01-01 10:10:11.00	2001-01-01 10:10:11.0	2001-01-01 10:10:11
20010101101010.999499	2001-01-01 10:10:10.999499	2001-01-01 10:10:10.99950	2001-01-01 10:10:10.9995	2001-01-01 10:10:10.999	2001-01-01 10:10:11.00	2001-01-01 10:10:11.0	2001-01-01 10:10:11
20010101101010.994999	2001-01-01 10:10:10.994999	2001-01-01 10:10:10.99500	2001-01-01 10:10:10.9950	2001-01-01 10:10:10.995	2001-01-01 10:10:10.99	2001-01-01 10:10:11.0	2001-01-01 10:10:11
20010101101010.949999	2001-01-01 10:10:10.949999	2001-01-01 10:10:10.95000	2001-01-01 10:10:10.9500	2001-01-01 10:10:10.950	2001-01-01 10:10:10.95	2001-01-01 10:10:10.9	2001-01-01 10:10:11
20010101101010.499999	2001-01-01 10:10:10.499999	2001-01-01 10:10:10.50000	2001-01-01 10:10:10.5000	2001-01-01 10:10:10.500	2001-01-01 10:10:10.50	2001-01-01 10:10:10.5	2001-01-01 10:10:10
DROP TABLE t1;
#
# Testing INSERT, ORDER, KEY, BETWEEN, comparison
#
CREATE TABLE t1 (a TIMESTAMP(6) NOT NULL);
INSERT INTO t1 VALUES ('0000-00-00 00:00:00.000000');
INSERT INTO t1 VALUES ('0000-00-00 23:59:59.999999');
INSERT INTO t1 VALUES ('2000-01-01 01:02:03');
INSERT INTO t1 VALUES ('2000-01-01 01:02:03.4');
INSERT INTO t1 VALUES ('2000-01-01 01:02:03.45');
INSERT INTO t1 VALUES ('2000-01-01 01:02:03.456');
INSERT INTO t1 VALUES ('2000-01-01 01:02:03.4567');
INSERT INTO t1 VALUES ('2000-01-01 01:02:03.45678');
INSERT INTO t1 VALUES ('2000-01-01 01:02:03.4567891');
INSERT INTO t1 VALUES ('9999-12-31 23:59:59.000000');
set @@time_zone = '+8:00';
select @@time_zone;
@@time_zone
+08:00
SELECT * FROM t1;
a
0000-00-00 00:00:00.000000
0000-00-00 00:00:00.000000
2000-01-01 01:02:03.000000
2000-01-01 01:02:03.400000
2000-01-01 01:02:03.450000
2000-01-01 01:02:03.456000
2000-01-01 01:02:03.456700
2000-01-01 01:02:03.456780
2000-01-01 01:02:03.456789
9999-12-31 23:59:59.000000
SELECT * FROM t1 ORDER BY a DESC;
a
9999-12-31 23:59:59.000000
2000-01-01 01:02:03.456789
2000-01-01 01:02:03.456780
2000-01-01 01:02:03.456700
2000-01-01 01:02:03.456000
2000-01-01 01:02:03.450000
2000-01-01 01:02:03.400000
2000-01-01 01:02:03.000000
0000-00-00 00:00:00.000000
0000-00-00 00:00:00.000000
SELECT * FROM t1 WHERE a='2000-01-01 01:02:03.45';
a
2000-01-01 01:02:03.450000
SELECT * FROM t1 WHERE a='2000-01-01 01:02:03.4567';
a
2000-01-01 01:02:03.456700
SELECT * FROM t1 WHERE a='2000-01-01 01:02:03.45670';
a
2000-01-01 01:02:03.456700
SELECT * FROM t1 WHERE a='2000-01-01 01:02:03.456700';
a
2000-01-01 01:02:03.456700
SELECT * FROM t1 WHERE a BETWEEN '2000-01-01 01:02:00' AND '2000-01-01 01:03:00';
a
2000-01-01 01:02:03.000000
2000-01-01 01:02:03.400000
2000-01-01 01:02:03.450000
2000-01-01 01:02:03.456000
2000-01-01 01:02:03.456700
2000-01-01 01:02:03.456780
2000-01-01 01:02:03.456789
ALTER TABLE t1 ADD KEY(a);
SELECT * FROM t1 ORDER BY a;
a
0000-00-00 00:00:00.000000
0000-00-00 00:00:00.000000
2000-01-01 01:02:03.000000
2000-01-01 01:02:03.400000
2000-01-01 01:02:03.450000
2000-01-01 01:02:03.456000
2000-01-01 01:02:03.456700
2000-01-01 01:02:03.456780
2000-01-01 01:02:03.456789
9999-12-31 23:59:59.000000
SELECT * FROM t1 ORDER BY a DESC;
a
9999-12-31 23:59:59.000000
2000-01-01 01:02:03.456789
2000-01-01 01:02:03.456780
2000-01-01 01:02:03.456700
2000-01-01 01:02:03.456000
2000-01-01 01:02:03.450000
2000-01-01 01:02:03.400000
2000-01-01 01:02:03.000000
0000-00-00 00:00:00.000000
0000-00-00 00:00:00.000000
SELECT * FROM t1 WHERE a='2000-01-01 01:02:03.456700';
a
2000-01-01 01:02:03.456700
SELECT * FROM t1 WHERE a BETWEEN '2000-01-01 01:02:00' AND '2000-01-01 01:03:00';
a
2000-01-01 01:02:03.000000
2000-01-01 01:02:03.400000
2000-01-01 01:02:03.450000
2000-01-01 01:02:03.456000
2000-01-01 01:02:03.456700
2000-01-01 01:02:03.456780
2000-01-01 01:02:03.456789
SELECT * FROM t1 WHERE a BETWEEN TIMESTAMP'2000-01-01 01:02:03.456' AND '2000-01-01 01:02:03.45678';
a
2000-01-01 01:02:03.456000
2000-01-01 01:02:03.456700
2000-01-01 01:02:03.456780
DROP TABLE t1;
#
# Testing range: stored_field_cmp_to_item
#
CREATE TABLE t1 (a datetime(6), key(a));
INSERT INTO t1 VALUES
('2000-01-01 00:00:00'), ('2000-01-01 00:00:00'),
('2000-01-01 00:00:01'), ('2000-01-01 00:00:01');
SELECT * FROM t1 WHERE a >= 20000101000000;
a
2000-01-01 00:00:00.000000
2000-01-01 00:00:00.000000
2000-01-01 00:00:01.000000
2000-01-01 00:00:01.000000
SELECT * FROM t1 WHERE a >= 20000101000000.0;
a
2000-01-01 00:00:00.000000
2000-01-01 00:00:00.000000
2000-01-01 00:00:01.000000
2000-01-01 00:00:01.000000
DROP TABLE t1;
#
# Rare TIMESTAMP formats
#
CREATE TABLE t1 (a TIMESTAMP(6) NOT NULL DEFAULT CURRENT_TIMESTAMP(6) ON UPDATE CURRENT_TIMESTAMP(6));
INSERT INTO t1 VALUES (101.101);
INSERT INTO t1 VALUES (990101.102);
INSERT INTO t1 VALUES ('990101.103');
INSERT INTO t1 VALUES (131.104);
INSERT INTO t1 VALUES ('000131.105');
SELECT * FROM t1;
a
2000-01-01 00:00:00.000000
1999-01-01 00:00:00.000000
1999-01-01 10:03:00.000000
2000-01-31 00:00:00.000000
2000-01-31 10:05:00.000000
DROP TABLE t1;
#
# Testing bad values
#
CREATE TABLE t1 (a TIMESTAMP(6) NOT NULL DEFAULT CURRENT_TIMESTAMP(6) ON UPDATE CURRENT_TIMESTAMP(6));
INSERT INTO t1 VALUES ('xxxx');
INSERT INTO t1 VALUES ('1999-01-01 00:00:00.123456 xxx');
ERROR 22007: Incorrect datetime value for column 'a' at row 1
INSERT INTO t1 VALUES ('1999-01-01 00:00:00 xxx');
ERROR 22007: Incorrect datetime value for column 'a' at row 1
INSERT INTO t1 VALUES ('1999-01-01 xxx');
INSERT INTO t1 VALUES ('0000-00-00 00:00:00.123');
SELECT * FROM t1;
a
0000-00-00 00:00:00.000000
1999-01-01 00:00:00.000000
0000-00-00 00:00:00.000000
DROP TABLE t1;
#
# Testing huge values
#
CREATE TABLE t1 (a TIMESTAMP(6) NOT NULL DEFAULT CURRENT_TIMESTAMP(6) ON UPDATE CURRENT_TIMESTAMP(6));
INSERT INTO t1 VALUES ( 100000000000000000.1);
INSERT INTO t1 VALUES ( 100000000000000000.1e0);
INSERT INTO t1 VALUES (-100000000000000000.1);
INSERT INTO t1 VALUES (-100000000000000000.1e0);
INSERT INTO t1 VALUES (CAST(0xFFFFFFFF00000000 AS SIGNED));
INSERT INTO t1 VALUES (CAST(0xFFFFFFFF00000000 AS UNSIGNED));
SELECT * FROM t1;
a
0000-00-00 00:00:00.000000
0000-00-00 00:00:00.000000
0000-00-00 00:00:00.000000
0000-00-00 00:00:00.000000
0000-00-00 00:00:00.000000
0000-00-00 00:00:00.000000
DROP TABLE t1;
#
# Testing IN
#
CREATE TABLE t1 (a TIMESTAMP(6) NOT NULL DEFAULT CURRENT_TIMESTAMP(6) ON UPDATE CURRENT_TIMESTAMP(6));
INSERT INTO t1 VALUES ('0000-00-00 00:00:00.000000');
INSERT INTO t1 VALUES ('0000-00-00 00:00:00.000001');
INSERT INTO t1 VALUES ('2000-01-01 00:00:00.000000');
INSERT INTO t1 VALUES ('2000-01-01 00:00:00.000001');
INSERT INTO t1 VALUES ('2000-01-01 00:00:00.000002');
INSERT INTO t1 VALUES ('2000-01-01 10:00:00.000000');
INSERT INTO t1 VALUES ('2000-01-01 10:00:00.000001');
INSERT INTO t1 VALUES ('2000-01-01 10:00:00.000002');
INSERT INTO t1 VALUES ('2000-01-01 23:00:00.000000');
INSERT INTO t1 VALUES ('2000-01-01 23:00:00.000001');
INSERT INTO t1 VALUES ('2000-01-01 23:00:00.000002');
SELECT * FROM t1;
a
0000-00-00 00:00:00.000000
0000-00-00 00:00:00.000000
2000-01-01 00:00:00.000000
2000-01-01 00:00:00.000001
2000-01-01 00:00:00.000002
2000-01-01 10:00:00.000000
2000-01-01 10:00:00.000001
2000-01-01 10:00:00.000002
2000-01-01 23:00:00.000000
2000-01-01 23:00:00.000001
2000-01-01 23:00:00.000002
SELECT * FROM t1 WHERE a IN ('2000-01-01 00:00:00', '0000-00-00 00:00:00.000001', '2000-01-01 23:00:00.000002');
a
0000-00-00 00:00:00.000000
0000-00-00 00:00:00.000000
2000-01-01 00:00:00.000000
2000-01-01 23:00:00.000002
SELECT * FROM t1 WHERE a IN (0, 20000101000000, 20000101230000);
a
0000-00-00 00:00:00.000000
0000-00-00 00:00:00.000000
2000-01-01 00:00:00.000000
2000-01-01 23:00:00.000000
SELECT * FROM t1 WHERE a IN (20000101000000.000001, 20000101230000.000001);
a
2000-01-01 00:00:00.000001
2000-01-01 23:00:00.000001
#
# Testing IN with index: involves field->store_packed()
#
ALTER TABLE t1 ADD KEY(a);
SELECT * FROM t1 WHERE a IN ('2000-01-01 00:00:00', '0000-00-00 00:00:00.000001', '2000-01-01 23:00:00.000002');
a
0000-00-00 00:00:00.000000
0000-00-00 00:00:00.000000
2000-01-01 00:00:00.000000
2000-01-01 23:00:00.000002
SELECT * FROM t1 WHERE a IN (0, 20000101000000, 20000101230000);
a
0000-00-00 00:00:00.000000
0000-00-00 00:00:00.000000
2000-01-01 00:00:00.000000
2000-01-01 23:00:00.000000
SELECT * FROM t1 WHERE a IN (20000101000000.000001, 20000101230000.000001);
a
2000-01-01 00:00:00.000001
2000-01-01 23:00:00.000001
DROP TABLE t1;
#
# Testing CREATE TABLE LIKE
#
CREATE TABLE t1 (a TIMESTAMP(6) NOT NULL DEFAULT CURRENT_TIMESTAMP(6) ON UPDATE CURRENT_TIMESTAMP(6));
CREATE TABLE t2 LIKE t1;
SHOW CREATE TABLE t2;
Table	Create Table
t2	CREATE TABLE `t2` (
  `a` timestamp(6) NOT NULL DEFAULT CURRENT_TIMESTAMP(6) ON UPDATE CURRENT_TIMESTAMP(6)
) ORGANIZATION INDEX DEFAULT CHARSET = utf8mb4 COMPRESSION = 'lz4_1.0' REPLICA_NUM = 1 BLOCK_SIZE = 16384 USE_BLOOM_FILTER = FALSE ENABLE_MACRO_BLOCK_BLOOM_FILTER = FALSE TABLET_SIZE = 134217728 PCTFREE = 10
DROP TABLE t2, t1;
#
# Testing JOIN between TIMESTAMP(6) and TIMESTAMP(6)
#
CREATE TABLE t1 (a TIMESTAMP(6) NOT NULL DEFAULT CURRENT_TIMESTAMP(6) ON UPDATE CURRENT_TIMESTAMP(6));
INSERT INTO t1 VALUES ('2000-01-01 00:01:03.1');
INSERT INTO t1 VALUES ('2000-01-01 00:01:03.12');
INSERT INTO t1 VALUES ('2000-01-01 00:01:03.123');
INSERT INTO t1 VALUES ('2000-01-01 00:01:03.1234');
INSERT INTO t1 VALUES ('2000-01-01 00:01:03.12345');
INSERT INTO t1 VALUES ('2000-01-01 00:01:03.123456');
CREATE TABLE t2 (a TIMESTAMP(6) NOT NULL DEFAULT CURRENT_TIMESTAMP(6) ON UPDATE CURRENT_TIMESTAMP(6));
INSERT INTO t2 SELECT * FROM t1;
SELECT * FROM t1, t2 WHERE t1.a=t2.a ORDER BY t1.a, t2.a;
a	a
2000-01-01 00:01:03.100000	2000-01-01 00:01:03.100000
2000-01-01 00:01:03.120000	2000-01-01 00:01:03.120000
2000-01-01 00:01:03.123000	2000-01-01 00:01:03.123000
2000-01-01 00:01:03.123400	2000-01-01 00:01:03.123400
2000-01-01 00:01:03.123450	2000-01-01 00:01:03.123450
2000-01-01 00:01:03.123456	2000-01-01 00:01:03.123456
ALTER TABLE t1 ADD KEY(a);
SELECT * FROM t1, t2 WHERE t1.a=t2.a ORDER BY t1.a, t2.a;
a	a
2000-01-01 00:01:03.100000	2000-01-01 00:01:03.100000
2000-01-01 00:01:03.120000	2000-01-01 00:01:03.120000
2000-01-01 00:01:03.123000	2000-01-01 00:01:03.123000
2000-01-01 00:01:03.123400	2000-01-01 00:01:03.123400
2000-01-01 00:01:03.123450	2000-01-01 00:01:03.123450
2000-01-01 00:01:03.123456	2000-01-01 00:01:03.123456
ALTER TABLE t2 ADD KEY(a);
SELECT * FROM t1, t2 WHERE t1.a=t2.a ORDER BY t1.a, t2.a;
a	a
2000-01-01 00:01:03.100000	2000-01-01 00:01:03.100000
2000-01-01 00:01:03.120000	2000-01-01 00:01:03.120000
2000-01-01 00:01:03.123000	2000-01-01 00:01:03.123000
2000-01-01 00:01:03.123400	2000-01-01 00:01:03.123400
2000-01-01 00:01:03.123450	2000-01-01 00:01:03.123450
2000-01-01 00:01:03.123456	2000-01-01 00:01:03.123456
ALTER TABLE t1 DROP KEY a;
SELECT * FROM t1, t2 WHERE t1.a=t2.a ORDER BY t1.a, t2.a;
a	a
2000-01-01 00:01:03.100000	2000-01-01 00:01:03.100000
2000-01-01 00:01:03.120000	2000-01-01 00:01:03.120000
2000-01-01 00:01:03.123000	2000-01-01 00:01:03.123000
2000-01-01 00:01:03.123400	2000-01-01 00:01:03.123400
2000-01-01 00:01:03.123450	2000-01-01 00:01:03.123450
2000-01-01 00:01:03.123456	2000-01-01 00:01:03.123456
DROP TABLE t2;
DROP TABLE t1;
#
# Testing JOIN between TIMESTAMP and TIMESTAMP(6)
#
CREATE TABLE t1 (a TIMESTAMP(6) NOT NULL DEFAULT CURRENT_TIMESTAMP(6) ON UPDATE CURRENT_TIMESTAMP(6));
INSERT INTO t1 VALUES ('0000-00-00 23:59:59.000000');
INSERT INTO t1 VALUES ('2000-01-01 10:11:12.000000');
INSERT INTO t1 VALUES ('2000-01-01 10:11:12.000001');
INSERT INTO t1 VALUES ('2000-01-01 10:11:12.000002');
INSERT INTO t1 VALUES ('2000-01-01 10:11:13.000000');
INSERT INTO t1 VALUES ('2000-01-01 10:11:13.000001');
INSERT INTO t1 VALUES ('2000-01-01 10:11:13.000002');
INSERT INTO t1 VALUES ('2000-01-01 23:59:59.999999');
INSERT INTO t1 VALUES ('2000-01-01 23:59:59.000000');
CREATE TABLE t2 (a TIMESTAMP NOT NULL DEFAULT CURRENT_TIMESTAMP ON UPDATE CURRENT_TIMESTAMP);
INSERT INTO t2 VALUES ('2000-01-01 10:11:12');
INSERT INTO t2 VALUES ('2000-01-01 10:11:13');
INSERT INTO t2 VALUES ('0000-00-00 23:59:59');
INSERT INTO t2 VALUES ('2000-01-01 23:59:59');
SELECT * FROM t1, t2 WHERE t1.a=t2.a ORDER BY t1.a, t2.a;
a	a
0000-00-00 00:00:00.000000	0000-00-00 00:00:00
2000-01-01 10:11:12.000000	2000-01-01 10:11:12
2000-01-01 10:11:13.000000	2000-01-01 10:11:13
2000-01-01 23:59:59.000000	2000-01-01 23:59:59
ALTER TABLE t1 ADD KEY(a);
ALTER TABLE t2 ADD KEY(a);
SELECT * FROM t1, t2 WHERE t1.a=t2.a ORDER BY t1.a, t2.a;
a	a
0000-00-00 00:00:00.000000	0000-00-00 00:00:00
2000-01-01 10:11:12.000000	2000-01-01 10:11:12
2000-01-01 10:11:13.000000	2000-01-01 10:11:13
2000-01-01 23:59:59.000000	2000-01-01 23:59:59
DROP TABLE t2, t1;
#
# Testing unique index
#
CREATE TABLE t1 (a TIMESTAMP(6) NOT NULL DEFAULT CURRENT_TIMESTAMP(6) ON UPDATE CURRENT_TIMESTAMP(6), UNIQUE(a));
INSERT INTO t1 VALUES ('2000-01-01 00:01:02');
INSERT INTO t1 VALUES ('2000-01-01 00:01:02.1');
INSERT INTO t1 VALUES ('2000-01-01 00:01:02.12');
INSERT INTO t1 VALUES ('2000-01-01 00:01:02.123');
INSERT INTO t1 VALUES ('2000-01-01 00:01:02.1234');
INSERT INTO t1 VALUES ('2000-01-01 00:01:02.12345');
INSERT INTO t1 VALUES ('2000-01-01 00:01:02.12345');
ERROR 23000: Duplicate entry '2000-01-01 00:01:02.123450' for key 'a'
DROP TABLE t1;
#
# Testing GROUP BY
#
CREATE TABLE t1 (a TIMESTAMP(6) NOT NULL DEFAULT CURRENT_TIMESTAMP(6) ON UPDATE CURRENT_TIMESTAMP(6));
INSERT INTO t1 VALUES ('2000-01-01 00:01:02');
INSERT INTO t1 VALUES ('2000-01-01 00:01:02.0');
INSERT INTO t1 VALUES ('2000-01-01 00:01:02.01');
INSERT INTO t1 VALUES ('2000-01-01 00:01:02.010');
INSERT INTO t1 VALUES ('2000-01-01 00:01:02.02');
INSERT INTO t1 VALUES ('2000-01-01 00:01:02.020');
SELECT a, COUNT(*) FROM t1 GROUP BY a;
a	COUNT(*)
2000-01-01 00:01:02.000000	2
2000-01-01 00:01:02.010000	2
2000-01-01 00:01:02.020000	2
DROP TABLE t1;
#
# Testing MIN() and MAX()
#
CREATE TABLE t1 (a INT, b TIMESTAMP(6) NOT NULL DEFAULT CURRENT_TIMESTAMP(6) ON UPDATE CURRENT_TIMESTAMP(6));
INSERT INTO t1 VALUES (1, '2001-01-01 00:01:02.000001');
INSERT INTO t1 VALUES (1, '2001-01-01 00:01:02');
INSERT INTO t1 VALUES (2, '2001-01-01 10:01:02');
INSERT INTO t1 VALUES (2, '2001-01-01 10:01:02.000001');
INSERT INTO t1 VALUES (3, '2001-01-01 10:11:02');
INSERT INTO t1 VALUES (3, '2001-01-01 10:11:02.000001');
SELECT MIN(b), MAX(b) FROM t1;
MIN(b)	MAX(b)
2001-01-01 00:01:02.000000	2001-01-01 10:11:02.000001
SELECT a, MIN(b), MAX(b) FROM t1 GROUP BY a;
a	MIN(b)	MAX(b)
1	2001-01-01 00:01:02.000000	2001-01-01 00:01:02.000001
2	2001-01-01 10:01:02.000000	2001-01-01 10:01:02.000001
3	2001-01-01 10:11:02.000000	2001-01-01 10:11:02.000001
DROP TABLE t1;
#
# Testing LEAST
#
CREATE TABLE t1 (a TIMESTAMP(6) NOT NULL DEFAULT CURRENT_TIMESTAMP(6) ON UPDATE CURRENT_TIMESTAMP(6));
INSERT INTO t1 VALUES ('2001-01-01 00:00:00.1');
SELECT LEAST(a, '2001-01-02 00:00:00.1') AS a FROM t1;
a
2001-01-01 00:00:00.100000
SELECT LEAST(a, '2001-01-02 00:00:00.1') + 0 AS a FROM t1;
a
2001
Warnings:
Warning	1292	Truncated incorrect DOUBLE value: '2001-01-01 00:00:00.100000'
SELECT CAST(LEAST(a, '2001-01-02 00:00:00.1') AS SIGNED) AS a FROM t1;
a
2001
Warnings:
Warning	1292	Truncated incorrect INTEGER value: '2001-01-01 00:00:00.100000'
SELECT CAST(LEAST(a, '2001-01-02 00:00:00.1') AS DECIMAL(30,6)) AS a FROM t1;
a
2001.000000
Warnings:
Warning	1292	Truncated incorrect DECIMAL value: '2001-01-01 00:00:00.100000'
SELECT GREATEST(a, '2001-01-02 00:00:00.1') AS a FROM t1;
a
2001-01-02 00:00:00.1
SELECT GREATEST(a, '2001-01-02 00:00:00.1') + 0 AS a FROM t1;
a
2001
Warnings:
Warning	1292	Truncated incorrect DOUBLE value: '2001-01-02 00:00:00.1'
SELECT CAST(GREATEST(a, '2001-01-02 00:00:00.1') AS SIGNED) AS a FROM t1;
a
2001
Warnings:
Warning	1292	Truncated incorrect INTEGER value: '2001-01-02 00:00:00.1'
SELECT CAST(GREATEST(a, '2001-01-02 00:00:00.1') AS DECIMAL(30,6)) AS a FROM t1;
a
2001.000000
Warnings:
Warning	1292	Truncated incorrect DECIMAL value: '2001-01-02 00:00:00.1'
DROP TABLE t1;
#
# Testing INSERT, MAX and MIN values
# '1970-01-01 00:00:01.000000' UTC to '2038-01-19 03:14:07.999999' UTC
#
SET time_zone='+00:00';
CREATE TABLE t1 (a TIMESTAMP(6) NOT NULL DEFAULT CURRENT_TIMESTAMP(6) ON UPDATE CURRENT_TIMESTAMP(6));
INSERT INTO t1 VALUES ('2038-01-19 03:14:07');
INSERT INTO t1 VALUES ('2038-01-19 03:14:07.999999');
INSERT INTO t1 VALUES ('2038-01-19 03:14:08');
INSERT INTO t1 VALUES ('1970-01-01 00:00:00');
INSERT INTO t1 VALUES ('1970-01-01 00:00:00.999999');
INSERT INTO t1 VALUES ('1970-01-01 00:00:01');
SELECT * FROM t1;
a
2038-01-19 03:14:07.000000
2038-01-19 03:14:07.999999
2038-01-19 03:14:08.000000
1970-01-01 00:00:00.000000
1970-01-01 00:00:00.999999
1970-01-01 00:00:01.000000
DROP TABLE t1;
#
# Testing integer INSERT value
#
CREATE TABLE t1 (a TIMESTAMP(6) NOT NULL DEFAULT CURRENT_TIMESTAMP(6) ON UPDATE CURRENT_TIMESTAMP(6));
INSERT INTO t1 VALUES (19990102);
INSERT INTO t1 VALUES (19990102112233);
INSERT INTO t1 VALUES (100000101112233);
INSERT INTO t1 VALUES (0);
INSERT INTO t1 VALUES (-1);
SELECT * FROM t1;
a
1999-01-02 00:00:00.000000
1999-01-02 11:22:33.000000
0000-00-00 00:00:00.000000
0000-00-00 00:00:00.000000
0000-00-00 00:00:00.000000
DROP TABLE t1;
#
# Testing decimal INSERT values
#
CREATE TABLE t1 (a TIMESTAMP(6) NOT NULL DEFAULT CURRENT_TIMESTAMP(6) ON UPDATE CURRENT_TIMESTAMP(6));
INSERT INTO t1 VALUES (20010101223344.4);
INSERT INTO t1 VALUES (20010101223344.45);
INSERT INTO t1 VALUES (20010101223344.456);
INSERT INTO t1 VALUES (20010101223344.4567);
INSERT INTO t1 VALUES (20010101223344.45678);
INSERT INTO t1 VALUES (20010101223344.456789);
INSERT INTO t1 VALUES (20010101202030.4567894);
INSERT INTO t1 VALUES (20010101202030.4567895);
INSERT INTO t1 VALUES (20010101202030.4567896);
INSERT INTO t1 VALUES (20010101202030.456789678);
INSERT INTO t1 VALUES (200101018385959.000000);
INSERT INTO t1 VALUES (-200101018385959.000000);
SELECT * FROM t1;
a
2001-01-01 22:33:44.400000
2001-01-01 22:33:44.450000
2001-01-01 22:33:44.456000
2001-01-01 22:33:44.456700
2001-01-01 22:33:44.456780
2001-01-01 22:33:44.456789
2001-01-01 20:20:30.456789
2001-01-01 20:20:30.456790
2001-01-01 20:20:30.456790
2001-01-01 20:20:30.456790
0000-00-00 00:00:00.000000
0000-00-00 00:00:00.000000
DROP TABLE t1;
#
# Testing double INSERT values
#
CREATE TABLE t1 (a TIMESTAMP(6) NOT NULL DEFAULT CURRENT_TIMESTAMP(6) ON UPDATE CURRENT_TIMESTAMP(6));
INSERT INTO t1 VALUES (112.233e-3);
INSERT INTO t1 VALUES (112.223e-2);
INSERT INTO t1 VALUES (112.233e-1);
INSERT INTO t1 VALUES (112.233e0);
INSERT INTO t1 VALUES (112.233e1);
INSERT INTO t1 VALUES (112.233e2);
INSERT INTO t1 VALUES (112.233e3);
INSERT INTO t1 VALUES (112.233e4);
INSERT INTO t1 VALUES (-123.456e0);
SELECT * FROM t1;
a
0000-00-00 00:00:00.000000
0000-00-00 00:00:00.000000
0000-00-00 00:00:00.000000
2000-01-12 00:00:00.000000
2000-11-22 00:00:00.000000
2001-12-23 00:00:00.000000
0000-00-00 00:00:00.000000
0000-00-00 00:00:00.000000
0000-00-00 00:00:00.000000
DROP TABLE t1;
#
# Testing UPDATE between TIMESTAMP(6) and TIMESTAMP/BIGINT/DECIMAL/DOUBLE
#
CREATE TABLE t1 (t0 TIMESTAMP, t6 TIMESTAMP(6), i BIGINT, d DECIMAL(20,6), f DOUBLE);
INSERT INTO t1 (t0) VALUES ('2000-01-01 11:22:33');
UPDATE t1 SET t6=t0, i=t0, d=t0, f=t0;
SELECT t6, i, d FROM t1;
t6	i	d
2000-01-01 11:22:33.000000	20000101112233	20000101112233.000000
UPDATE t1 SET t6='2001-02-02 11:22:33.1';
UPDATE t1 SET t0=t6, i=t6, d=t6, f=t6;
SELECT * FROM t1;
t0	t6	i	d	f
2001-02-02 11:22:33	2001-02-02 11:22:33.100000	20010202112233	20010202112233.100000	20010202112233.1
UPDATE t1 SET i=20000101112233, d=20001010112233.1, f=00001010112233.1;
UPDATE t1 SET t6=i;
SELECT t6 FROM t1;
t6
2000-01-01 11:22:33.000000
UPDATE t1 SET t6=d;
SELECT t6 FROM t1;
t6
2000-10-10 11:22:33.100000
UPDATE t1 SET t6=f;
SELECT t6 FROM t1;
t6
2000-10-10 11:22:33.100000
DROP TABLE t1;
#
# Testing JOIN with comparison between TIMESTAMP(6) and DATE
#
CREATE TABLE t1 (a TIMESTAMP(6) NOT NULL DEFAULT CURRENT_TIMESTAMP(6) ON UPDATE CURRENT_TIMESTAMP(6));
INSERT INTO t1 VALUES ('2000-01-01 00:00:00.000000');
INSERT INTO t1 VALUES ('2000-01-01 00:00:00.000001');
INSERT INTO t1 VALUES ('2000-01-02 00:00:00.000000');
CREATE TABLE t2 (a DATE);
INSERT INTO t2 VALUES ('2000-01-01');
INSERT INTO t2 VALUES ('2000-01-02');
SELECT * FROM t1, t2 WHERE t1.a=t2.a ORDER BY t1.a, t2.a;
a	a
2000-01-01 00:00:00.000000	2000-01-01
2000-01-02 00:00:00.000000	2000-01-02
DROP TABLE t2;
DROP TABLE t1;
#
# Testing JOIN with comparison between TIMESTAMP(6) and BIGINT
#
CREATE TABLE t1 (a TIMESTAMP(6) NOT NULL DEFAULT CURRENT_TIMESTAMP(6) ON UPDATE CURRENT_TIMESTAMP(6));
INSERT INTO t1 VALUES ('2000-01-01 00:00:00');
INSERT INTO t1 VALUES ('2000-01-01 11:22:33');
INSERT INTO t1 VALUES ('2000-01-01 11:22:33.123');
CREATE TABLE t2 (b BIGINT);
INSERT INTO t2 VALUES (20000101);
INSERT INTO t2 VALUES (20000101112233);
SELECT * FROM t1, t2 WHERE a=b;
a	b
2000-01-01 00:00:00.000000	20000101
2000-01-01 11:22:33.000000	20000101112233
DROP TABLE t1, t2;
#
# Testing JOIN with comparison between TIMESTAMP(6) and DECIMAL(20,6)
#
CREATE TABLE t1 (a TIMESTAMP(6) NOT NULL DEFAULT CURRENT_TIMESTAMP(6) ON UPDATE CURRENT_TIMESTAMP(6));
INSERT INTO t1 VALUES ('2001-01-01 11:22:33');
INSERT INTO t1 VALUES ('2001-01-01 11:22:33.123');
INSERT INTO t1 VALUES ('2001-01-01 11:22:33.123456');
CREATE TABLE t2 (b DECIMAL(20,6));
INSERT INTO t2 VALUES (20010101112233);
INSERT INTO t2 VALUES (20010101112233.123);
INSERT INTO t2 VALUES (20010101112233.123456);
SELECT * FROM t1, t2 WHERE a=b;
a	b
2001-01-01 11:22:33.000000	20010101112233.000000
2001-01-01 11:22:33.123000	20010101112233.123000
2001-01-01 11:22:33.123456	20010101112233.123456
DROP TABLE t1, t2;
#
# Testing JOIN with comparison between TIMESTAMP(6) and DECIMAL(20,3)
#
CREATE TABLE t1 (a TIMESTAMP(6) NOT NULL DEFAULT CURRENT_TIMESTAMP(6) ON UPDATE CURRENT_TIMESTAMP(6));
INSERT INTO t1 VALUES ('2001-01-01 11:22:33');
INSERT INTO t1 VALUES ('2001-01-01 11:22:33.123');
INSERT INTO t1 VALUES ('2001-01-01 11:22:33.123456');
CREATE TABLE t2 (b DECIMAL(20,3));
INSERT INTO t2 VALUES (20010101112233);
INSERT INTO t2 VALUES (20010101112233.123);
SELECT * FROM t1, t2 WHERE a=b;
a	b
2001-01-01 11:22:33.000000	20010101112233.000
2001-01-01 11:22:33.123000	20010101112233.123
DROP TABLE t1, t2;
#
# Testing JOIN with comparison between TIMESTAMP(6) and DOUBLE
#
CREATE TABLE t1 (a TIMESTAMP(6) NOT NULL DEFAULT CURRENT_TIMESTAMP(6) ON UPDATE CURRENT_TIMESTAMP(6));
INSERT INTO t1 VALUES ('2000-01-01 11:22:33');
INSERT INTO t1 VALUES ('2000-01-01 11:22:33.1');
INSERT INTO t1 VALUES ('2000-01-01 11:22:33.12');
CREATE TABLE t2 (b DOUBLE);
INSERT INTO t2 VALUES (20000101112233);
INSERT INTO t2 VALUES (20000101112233.1);
INSERT INTO t2 VALUES (20000101112233.12);
SELECT * FROM t2;
b
20000101112233
20000101112233.1
20000101112233.12
SELECT * FROM t1, t2 WHERE a=b;
a	b
2000-01-01 11:22:33.000000	20000101112233
2000-01-01 11:22:33.100000	20000101112233.1
2000-01-01 11:22:33.120000	20000101112233.12
DROP TABLE t1, t2;
#
# Testing JOIN with comparison between TIMESTAMP(6) and VARCHAR
#
CREATE TABLE t1 (a TIMESTAMP(6) NOT NULL DEFAULT CURRENT_TIMESTAMP(6) ON UPDATE CURRENT_TIMESTAMP(6));
INSERT INTO t1 VALUES ('2001-01-01 11:22:33');
INSERT INTO t1 VALUES ('2001-01-01 11:22:33.123');
CREATE TABLE t2 (b VARCHAR(64));
INSERT INTO t2 VALUES ('2001-01-01 11:22:33.123');
INSERT INTO t2 VALUES ('2001-01-01 11:22:33.1230');
INSERT INTO t2 VALUES ('2001-01-01 11:22:33.12300');
INSERT INTO t2 VALUES ('2001-01-01 11:22:33.123000');
INSERT INTO t2 VALUES ('2001-01-01 11:22:33');
INSERT INTO t2 VALUES ('2001-01-01 11:22:33.');
INSERT INTO t2 VALUES ('2001-01-01 11:22:33.0');
INSERT INTO t2 VALUES ('2001-01-01 11:22:33.00');
INSERT INTO t2 VALUES ('2001-01-01 11:22:33.000');
INSERT INTO t2 VALUES ('2001-01-01 11:22:33.0000');
INSERT INTO t2 VALUES ('2001-01-01 11:22:33.00000');
INSERT INTO t2 VALUES ('2001-01-01 11:22:33.000000');
SELECT * FROM t1, t2 WHERE a=b ORDER BY BINARY a, BINARY b;
a	b
2001-01-01 11:22:33.000000	2001-01-01 11:22:33
2001-01-01 11:22:33.000000	2001-01-01 11:22:33.
2001-01-01 11:22:33.000000	2001-01-01 11:22:33.0
2001-01-01 11:22:33.000000	2001-01-01 11:22:33.00
2001-01-01 11:22:33.000000	2001-01-01 11:22:33.000
2001-01-01 11:22:33.000000	2001-01-01 11:22:33.0000
2001-01-01 11:22:33.000000	2001-01-01 11:22:33.00000
2001-01-01 11:22:33.000000	2001-01-01 11:22:33.000000
2001-01-01 11:22:33.123000	2001-01-01 11:22:33.123
2001-01-01 11:22:33.123000	2001-01-01 11:22:33.1230
2001-01-01 11:22:33.123000	2001-01-01 11:22:33.12300
2001-01-01 11:22:33.123000	2001-01-01 11:22:33.123000
ALTER TABLE t1 ADD KEY (a);
SELECT * FROM t1, t2 WHERE a=b ORDER BY BINARY a, BINARY b;
a	b
2001-01-01 11:22:33.000000	2001-01-01 11:22:33
2001-01-01 11:22:33.000000	2001-01-01 11:22:33.
2001-01-01 11:22:33.000000	2001-01-01 11:22:33.0
2001-01-01 11:22:33.000000	2001-01-01 11:22:33.00
2001-01-01 11:22:33.000000	2001-01-01 11:22:33.000
2001-01-01 11:22:33.000000	2001-01-01 11:22:33.0000
2001-01-01 11:22:33.000000	2001-01-01 11:22:33.00000
2001-01-01 11:22:33.000000	2001-01-01 11:22:33.000000
2001-01-01 11:22:33.123000	2001-01-01 11:22:33.123
2001-01-01 11:22:33.123000	2001-01-01 11:22:33.1230
2001-01-01 11:22:33.123000	2001-01-01 11:22:33.12300
2001-01-01 11:22:33.123000	2001-01-01 11:22:33.123000
ALTER TABLE t2 ADD KEY (b);
SELECT * FROM t1, t2 WHERE a=b ORDER BY BINARY a, BINARY b;
a	b
2001-01-01 11:22:33.000000	2001-01-01 11:22:33
2001-01-01 11:22:33.000000	2001-01-01 11:22:33.
2001-01-01 11:22:33.000000	2001-01-01 11:22:33.0
2001-01-01 11:22:33.000000	2001-01-01 11:22:33.00
2001-01-01 11:22:33.000000	2001-01-01 11:22:33.000
2001-01-01 11:22:33.000000	2001-01-01 11:22:33.0000
2001-01-01 11:22:33.000000	2001-01-01 11:22:33.00000
2001-01-01 11:22:33.000000	2001-01-01 11:22:33.000000
2001-01-01 11:22:33.123000	2001-01-01 11:22:33.123
2001-01-01 11:22:33.123000	2001-01-01 11:22:33.1230
2001-01-01 11:22:33.123000	2001-01-01 11:22:33.12300
2001-01-01 11:22:33.123000	2001-01-01 11:22:33.123000
ALTER TABLE t1 DROP KEY a;
SELECT * FROM t1, t2 WHERE a=b ORDER BY BINARY a, BINARY b;
a	b
2001-01-01 11:22:33.000000	2001-01-01 11:22:33
2001-01-01 11:22:33.000000	2001-01-01 11:22:33.
2001-01-01 11:22:33.000000	2001-01-01 11:22:33.0
2001-01-01 11:22:33.000000	2001-01-01 11:22:33.00
2001-01-01 11:22:33.000000	2001-01-01 11:22:33.000
2001-01-01 11:22:33.000000	2001-01-01 11:22:33.0000
2001-01-01 11:22:33.000000	2001-01-01 11:22:33.00000
2001-01-01 11:22:33.000000	2001-01-01 11:22:33.000000
2001-01-01 11:22:33.123000	2001-01-01 11:22:33.123
2001-01-01 11:22:33.123000	2001-01-01 11:22:33.1230
2001-01-01 11:22:33.123000	2001-01-01 11:22:33.12300
2001-01-01 11:22:33.123000	2001-01-01 11:22:33.123000
DROP TABLE t1, t2;
#
# Testing arithmetic with INT, DECIMAL, FLOAT
#
CREATE TABLE t1 (a TIMESTAMP(6) NOT NULL DEFAULT CURRENT_TIMESTAMP(6) ON UPDATE CURRENT_TIMESTAMP(6));
INSERT INTO t1 VALUES ('2001-01-01 00:00:00.000000');
INSERT INTO t1 VALUES ('2001-01-01 00:00:00.000001');
SELECT a, a + 0, a + 1, a + 1.0, a + 1e0 FROM t1;
a	a + 0	a + 1	a + 1.0	a + 1e0
2001-01-01 00:00:00.000000	20010101000000.000000	20010101000001.000000	20010101000001.000000	20010101000001
2001-01-01 00:00:00.000001	20010101000000.000001	20010101000001.000001	20010101000001.000001	20010101000001
DROP TABLE t1;
#
# Testing that TIMESTAMP behaves as DECIMAL for SUM() and AVG()
#
SET @t='2010-01-01 00:11:12.123456';
CREATE TABLE t1 (t0 DATETIME, t3 DATETIME(3), t6 DATETIME(6));
INSERT INTO t1 VALUES (@t, @t, @t);
SELECT MIN(t0), MAX(t0), AVG(t0), SUM(t0) FROM t1;
MIN(t0)	MAX(t0)	AVG(t0)	SUM(t0)
2010-01-01 00:11:12	2010-01-01 00:11:12	20100101001112.0000	20100101001112
SELECT MIN(t3), MAX(t3), AVG(t3), SUM(t3) FROM t1;
MIN(t3)	MAX(t3)	AVG(t3)	SUM(t3)
2010-01-01 00:11:12.123	2010-01-01 00:11:12.123	20100101001112.1230000	20100101001112.123
SELECT MIN(t6), MAX(t6), AVG(t6), SUM(t6) FROM t1;
MIN(t6)	MAX(t6)	AVG(t6)	SUM(t6)
2010-01-01 00:11:12.123456	2010-01-01 00:11:12.123456	20100101001112.1234560000	20100101001112.123456
SET @t='2010-01-01 00:11:12.000000';
INSERT INTO t1 VALUES (@t, @t, @t);
SELECT MIN(t0), MAX(t0), AVG(t0), SUM(t0) FROM t1;
MIN(t0)	MAX(t0)	AVG(t0)	SUM(t0)
2010-01-01 00:11:12	2010-01-01 00:11:12	20100101001112.0000	40200202002224
SELECT MIN(t3), MAX(t3), AVG(t3), SUM(t3) FROM t1;
MIN(t3)	MAX(t3)	AVG(t3)	SUM(t3)
2010-01-01 00:11:12.000	2010-01-01 00:11:12.123	20100101001112.0615000	40200202002224.123
SELECT MIN(t6), MAX(t6), AVG(t6), SUM(t6) FROM t1;
MIN(t6)	MAX(t6)	AVG(t6)	SUM(t6)
2010-01-01 00:11:12.000000	2010-01-01 00:11:12.123456	20100101001112.0617280000	40200202002224.123456
DROP TABLE t1;
#
# Testing copy from TIMESTAMP to TIMESTAMP(6) and vice versa
#
CREATE TABLE t1 (a TIMESTAMP(6) NOT NULL DEFAULT CURRENT_TIMESTAMP(6) ON UPDATE CURRENT_TIMESTAMP(6), b TIMESTAMP NOT NULL DEFAULT '0000-00-00 00:00:00.000000');
INSERT INTO t1 VALUES ('2001-01-01 01:02:03.123456', '0000-00-00 00:00:00');
UPDATE t1 SET b=a;
SELECT b FROM t1;
b
2001-01-01 01:02:03
UPDATE t1 SET b='2002-02-02 10:11:12';
UPDATE t1 SET a=b;
SELECT a FROM t1;
a
2002-02-02 10:11:12.000000
DROP TABLE t1;
#
# Testing ALTER from TIMESTAMP(6) to TIMESTAMP and vice versa
#
CREATE TABLE t1 (a TIMESTAMP NOT NULL DEFAULT CURRENT_TIMESTAMP ON UPDATE CURRENT_TIMESTAMP);
INSERT INTO t1 VALUES ('2000-01-01 01:02:03');
ALTER TABLE t1 MODIFY a TIMESTAMP(6);
SELECT * FROM t1;
a
2000-01-01 01:02:03.000000
UPDATE t1 SET a='2000-01-01 01:03:03.456';
SELECT * FROM t1;
a
2000-01-01 01:03:03.456000
ALTER TABLE t1 MODIFY a TIMESTAMP;
SELECT * FROM t1;
a
2000-01-01 01:03:03
DROP TABLE t1;
#
# Testing INT value and CAST of TIMESTAMP(6) to various other types
#
CREATE TABLE t1 (a TIMESTAMP(6) NOT NULL DEFAULT CURRENT_TIMESTAMP(6) ON UPDATE CURRENT_TIMESTAMP(6));
INSERT INTO t1 VALUES ('2001-01-01 11:22:33.123');
SELECT CAST(a AS DATETIME) FROM t1;
CAST(a AS DATETIME)
2001-01-01 11:22:33
SELECT CAST(a AS TIME) FROM t1;
CAST(a AS TIME)
11:22:33
SELECT a << 0 FROM t1;
a << 0
20010101112233
SELECT CAST(a AS SIGNED) FROM t1;
CAST(a AS SIGNED)
20010101112233
SELECT CAST(a AS UNSIGNED) FROM t1;
CAST(a AS UNSIGNED)
20010101112233
SELECT CAST(a AS DECIMAL(30,6)) FROM t1;
CAST(a AS DECIMAL(30,6))
20010101112233.123000
SELECT CAST(a AS DECIMAL(30,3)) FROM t1;
CAST(a AS DECIMAL(30,3))
20010101112233.123
SELECT CAST(a AS CHAR) FROM t1;
CAST(a AS CHAR)
2001-01-01 11:22:33.123000
SELECT CAST(a AS CHAR(6)) FROM t1;
CAST(a AS CHAR(6))
2001-0
DROP TABLE t1;
#
# Testing that default precision in 'DEFAULT CURRENT_TIMESTAMP(N)'
# and 'ON UPDATE CURRENT_TIMESTAMP(N)' is the same to the precision
# of the field itself.
#
CREATE TABLE t1 (a TIMESTAMP(1) NOT NULL DEFAULT CURRENT_TIMESTAMP(1) ON UPDATE CURRENT_TIMESTAMP(1));
SHOW CREATE TABLE t1;
Table	Create Table
t1	CREATE TABLE `t1` (
  `a` timestamp(1) NOT NULL DEFAULT CURRENT_TIMESTAMP(1) ON UPDATE CURRENT_TIMESTAMP(1)
) ORGANIZATION INDEX DEFAULT CHARSET = utf8mb4 COMPRESSION = 'lz4_1.0' REPLICA_NUM = 1 BLOCK_SIZE = 16384 USE_BLOOM_FILTER = FALSE ENABLE_MACRO_BLOCK_BLOOM_FILTER = FALSE TABLET_SIZE = 134217728 PCTFREE = 10
DROP TABLE t1;
CREATE TABLE t1 (a TIMESTAMP(2) NOT NULL DEFAULT CURRENT_TIMESTAMP(2) ON UPDATE CURRENT_TIMESTAMP(2));
SHOW CREATE TABLE t1;
Table	Create Table
t1	CREATE TABLE `t1` (
  `a` timestamp(2) NOT NULL DEFAULT CURRENT_TIMESTAMP(2) ON UPDATE CURRENT_TIMESTAMP(2)
) ORGANIZATION INDEX DEFAULT CHARSET = utf8mb4 COMPRESSION = 'lz4_1.0' REPLICA_NUM = 1 BLOCK_SIZE = 16384 USE_BLOOM_FILTER = FALSE ENABLE_MACRO_BLOCK_BLOOM_FILTER = FALSE TABLET_SIZE = 134217728 PCTFREE = 10
DROP TABLE t1;
CREATE TABLE t1 (a TIMESTAMP(3) NOT NULL DEFAULT CURRENT_TIMESTAMP(3) ON UPDATE CURRENT_TIMESTAMP(3));
SHOW CREATE TABLE t1;
Table	Create Table
t1	CREATE TABLE `t1` (
  `a` timestamp(3) NOT NULL DEFAULT CURRENT_TIMESTAMP(3) ON UPDATE CURRENT_TIMESTAMP(3)
) ORGANIZATION INDEX DEFAULT CHARSET = utf8mb4 COMPRESSION = 'lz4_1.0' REPLICA_NUM = 1 BLOCK_SIZE = 16384 USE_BLOOM_FILTER = FALSE ENABLE_MACRO_BLOCK_BLOOM_FILTER = FALSE TABLET_SIZE = 134217728 PCTFREE = 10
DROP TABLE t1;
CREATE TABLE t1 (a TIMESTAMP(4) NOT NULL DEFAULT CURRENT_TIMESTAMP(4) ON UPDATE CURRENT_TIMESTAMP(4));
SHOW CREATE TABLE t1;
Table	Create Table
t1	CREATE TABLE `t1` (
  `a` timestamp(4) NOT NULL DEFAULT CURRENT_TIMESTAMP(4) ON UPDATE CURRENT_TIMESTAMP(4)
) ORGANIZATION INDEX DEFAULT CHARSET = utf8mb4 COMPRESSION = 'lz4_1.0' REPLICA_NUM = 1 BLOCK_SIZE = 16384 USE_BLOOM_FILTER = FALSE ENABLE_MACRO_BLOCK_BLOOM_FILTER = FALSE TABLET_SIZE = 134217728 PCTFREE = 10
DROP TABLE t1;
CREATE TABLE t1 (a TIMESTAMP(5) NOT NULL DEFAULT CURRENT_TIMESTAMP(5) ON UPDATE CURRENT_TIMESTAMP(5));
SHOW CREATE TABLE t1;
Table	Create Table
t1	CREATE TABLE `t1` (
  `a` timestamp(5) NOT NULL DEFAULT CURRENT_TIMESTAMP(5) ON UPDATE CURRENT_TIMESTAMP(5)
) ORGANIZATION INDEX DEFAULT CHARSET = utf8mb4 COMPRESSION = 'lz4_1.0' REPLICA_NUM = 1 BLOCK_SIZE = 16384 USE_BLOOM_FILTER = FALSE ENABLE_MACRO_BLOCK_BLOOM_FILTER = FALSE TABLET_SIZE = 134217728 PCTFREE = 10
DROP TABLE t1;
CREATE TABLE t1 (a TIMESTAMP(6) NOT NULL DEFAULT CURRENT_TIMESTAMP(6) ON UPDATE CURRENT_TIMESTAMP(6));
SHOW CREATE TABLE t1;
Table	Create Table
t1	CREATE TABLE `t1` (
  `a` timestamp(6) NOT NULL DEFAULT CURRENT_TIMESTAMP(6) ON UPDATE CURRENT_TIMESTAMP(6)
) ORGANIZATION INDEX DEFAULT CHARSET = utf8mb4 COMPRESSION = 'lz4_1.0' REPLICA_NUM = 1 BLOCK_SIZE = 16384 USE_BLOOM_FILTER = FALSE ENABLE_MACRO_BLOCK_BLOOM_FILTER = FALSE TABLET_SIZE = 134217728 PCTFREE = 10
DROP TABLE t1;
#
# Testing DEFAULT value
#
CREATE TABLE t1 (a TIMESTAMP(6) NOT NULL DEFAULT '2000-01-01 11:22:33.123456');
SHOW CREATE TABLE t1;
Table	Create Table
t1	CREATE TABLE `t1` (
  `a` timestamp(6) NOT NULL DEFAULT '2000-01-01 11:22:33.123456'
) ORGANIZATION INDEX DEFAULT CHARSET = utf8mb4 COMPRESSION = 'lz4_1.0' REPLICA_NUM = 1 BLOCK_SIZE = 16384 USE_BLOOM_FILTER = FALSE ENABLE_MACRO_BLOCK_BLOOM_FILTER = FALSE TABLET_SIZE = 134217728 PCTFREE = 10
DROP TABLE t1;
#
# Testing DEFAULT CURRENT_TIMESTAMP
#
CREATE TABLE t1 (a TIMESTAMP NOT NULL DEFAULT CURRENT_TIMESTAMP(0));
DROP TABLE t1;
CREATE TABLE t1 (a TIMESTAMP DEFAULT CURRENT_TIMESTAMP(1));
ERROR 42000: Invalid default value for 'a'
CREATE TABLE t1 (a TIMESTAMP DEFAULT CURRENT_TIMESTAMP(2));
ERROR 42000: Invalid default value for 'a'
CREATE TABLE t1 (a TIMESTAMP DEFAULT CURRENT_TIMESTAMP(3));
ERROR 42000: Invalid default value for 'a'
CREATE TABLE t1 (a TIMESTAMP DEFAULT CURRENT_TIMESTAMP(4));
ERROR 42000: Invalid default value for 'a'
CREATE TABLE t1 (a TIMESTAMP DEFAULT CURRENT_TIMESTAMP(5));
ERROR 42000: Invalid default value for 'a'
CREATE TABLE t1 (a TIMESTAMP DEFAULT CURRENT_TIMESTAMP(6));
ERROR 42000: Invalid default value for 'a'
CREATE TABLE t1 (a TIMESTAMP(3) DEFAULT CURRENT_TIMESTAMP);
ERROR 42000: Invalid default value for 'a'
CREATE TABLE t1 (a TIMESTAMP(3) DEFAULT CURRENT_TIMESTAMP(0));
ERROR 42000: Invalid default value for 'a'
CREATE TABLE t1 (a TIMESTAMP(3) DEFAULT CURRENT_TIMESTAMP(1));
ERROR 42000: Invalid default value for 'a'
CREATE TABLE t1 (a TIMESTAMP(3) DEFAULT CURRENT_TIMESTAMP(2));
ERROR 42000: Invalid default value for 'a'
CREATE TABLE t1 (a TIMESTAMP(3) NOT NULL DEFAULT CURRENT_TIMESTAMP(3));
SHOW COLUMNS FROM t1;
Field	Type	Null	Key	Default	Extra
a	timestamp(3)	NO		CURRENT_TIMESTAMP(3)	
DROP TABLE t1;
CREATE TABLE t1 (a TIMESTAMP(3) DEFAULT CURRENT_TIMESTAMP(4));
ERROR 42000: Invalid default value for 'a'
CREATE TABLE t1 (a TIMESTAMP(3) DEFAULT CURRENT_TIMESTAMP(5));
ERROR 42000: Invalid default value for 'a'
CREATE TABLE t1 (a TIMESTAMP(3) DEFAULT CURRENT_TIMESTAMP(6));
ERROR 42000: Invalid default value for 'a'
CREATE TABLE t1 (a TIMESTAMP(6) DEFAULT CURRENT_TIMESTAMP);
ERROR 42000: Invalid default value for 'a'
CREATE TABLE t1 (a TIMESTAMP(6) DEFAULT CURRENT_TIMESTAMP(0));
ERROR 42000: Invalid default value for 'a'
CREATE TABLE t1 (a TIMESTAMP(6) DEFAULT CURRENT_TIMESTAMP(1));
ERROR 42000: Invalid default value for 'a'
CREATE TABLE t1 (a TIMESTAMP(6) DEFAULT CURRENT_TIMESTAMP(2));
ERROR 42000: Invalid default value for 'a'
CREATE TABLE t1 (a TIMESTAMP(6) DEFAULT CURRENT_TIMESTAMP(4));
ERROR 42000: Invalid default value for 'a'
CREATE TABLE t1 (a TIMESTAMP(6) DEFAULT CURRENT_TIMESTAMP(5));
ERROR 42000: Invalid default value for 'a'
CREATE TABLE t1 (a TIMESTAMP(6) NOT NULL DEFAULT CURRENT_TIMESTAMP(6));
SHOW COLUMNS FROM t1;
Field	Type	Null	Key	Default	Extra
a	timestamp(6)	NO		CURRENT_TIMESTAMP(6)	
DROP TABLE t1;
CREATE TABLE t1 (a DATETIME DEFAULT CURRENT_TIMESTAMP(0));
DROP TABLE t1;
CREATE TABLE t1 (a DATETIME DEFAULT CURRENT_TIMESTAMP(1));
ERROR 42000: Invalid default value for 'a'
CREATE TABLE t1 (a DATETIME DEFAULT CURRENT_TIMESTAMP(2));
ERROR 42000: Invalid default value for 'a'
CREATE TABLE t1 (a DATETIME DEFAULT CURRENT_TIMESTAMP(3));
ERROR 42000: Invalid default value for 'a'
CREATE TABLE t1 (a DATETIME DEFAULT CURRENT_TIMESTAMP(4));
ERROR 42000: Invalid default value for 'a'
CREATE TABLE t1 (a DATETIME DEFAULT CURRENT_TIMESTAMP(5));
ERROR 42000: Invalid default value for 'a'
CREATE TABLE t1 (a DATETIME DEFAULT CURRENT_TIMESTAMP(6));
ERROR 42000: Invalid default value for 'a'
CREATE TABLE t1 (a DATETIME(3) DEFAULT CURRENT_TIMESTAMP);
ERROR 42000: Invalid default value for 'a'
CREATE TABLE t1 (a DATETIME(3) DEFAULT CURRENT_TIMESTAMP(0));
ERROR 42000: Invalid default value for 'a'
CREATE TABLE t1 (a DATETIME(3) DEFAULT CURRENT_TIMESTAMP(1));
ERROR 42000: Invalid default value for 'a'
CREATE TABLE t1 (a DATETIME(3) DEFAULT CURRENT_TIMESTAMP(2));
ERROR 42000: Invalid default value for 'a'
CREATE TABLE t1 (a DATETIME(3) DEFAULT CURRENT_TIMESTAMP(3));
SHOW COLUMNS FROM t1;
Field	Type	Null	Key	Default	Extra
a	datetime(3)	YES		CURRENT_TIMESTAMP(3)	
DROP TABLE t1;
CREATE TABLE t1 (a DATETIME(3) DEFAULT CURRENT_TIMESTAMP(4));
ERROR 42000: Invalid default value for 'a'
CREATE TABLE t1 (a DATETIME(3) DEFAULT CURRENT_TIMESTAMP(5));
ERROR 42000: Invalid default value for 'a'
CREATE TABLE t1 (a DATETIME(3) DEFAULT CURRENT_TIMESTAMP(6));
ERROR 42000: Invalid default value for 'a'
CREATE TABLE t1 (a DATETIME(6) DEFAULT CURRENT_TIMESTAMP);
ERROR 42000: Invalid default value for 'a'
CREATE TABLE t1 (a DATETIME(6) DEFAULT CURRENT_TIMESTAMP(0));
ERROR 42000: Invalid default value for 'a'
CREATE TABLE t1 (a DATETIME(6) DEFAULT CURRENT_TIMESTAMP(1));
ERROR 42000: Invalid default value for 'a'
CREATE TABLE t1 (a DATETIME(6) DEFAULT CURRENT_TIMESTAMP(2));
ERROR 42000: Invalid default value for 'a'
CREATE TABLE t1 (a DATETIME(6) DEFAULT CURRENT_TIMESTAMP(4));
ERROR 42000: Invalid default value for 'a'
CREATE TABLE t1 (a DATETIME(6) DEFAULT CURRENT_TIMESTAMP(5));
ERROR 42000: Invalid default value for 'a'
CREATE TABLE t1 (a DATETIME(6) DEFAULT CURRENT_TIMESTAMP(6));
SHOW COLUMNS FROM t1;
Field	Type	Null	Key	Default	Extra
a	datetime(6)	YES		CURRENT_TIMESTAMP(6)	
DROP TABLE t1;
#
# Testing ON UPDATE CURRENT_TIMESTAMP
#
CREATE TABLE t1 (a TIMESTAMP(6) ON UPDATE CURRENT_TIMESTAMP);
ERROR HY000: Invalid ON UPDATE clause for 'a' column
CREATE TABLE t1 (a TIMESTAMP(6) ON UPDATE CURRENT_TIMESTAMP(0));
ERROR HY000: Invalid ON UPDATE clause for 'a' column
CREATE TABLE t1 (a TIMESTAMP(6) ON UPDATE CURRENT_TIMESTAMP(1));
ERROR HY000: Invalid ON UPDATE clause for 'a' column
CREATE TABLE t1 (a TIMESTAMP(6) ON UPDATE CURRENT_TIMESTAMP(2));
ERROR HY000: Invalid ON UPDATE clause for 'a' column
CREATE TABLE t1 (a TIMESTAMP(6) ON UPDATE CURRENT_TIMESTAMP(4));
ERROR HY000: Invalid ON UPDATE clause for 'a' column
CREATE TABLE t1 (a TIMESTAMP(6) ON UPDATE CURRENT_TIMESTAMP(5));
ERROR HY000: Invalid ON UPDATE clause for 'a' column
CREATE TABLE t1 (a TIMESTAMP(6) NOT NULL DEFAULT '0000-00-00 00:00:00.000000' ON UPDATE CURRENT_TIMESTAMP(6));
SHOW COLUMNS FROM t1;
Field	Type	Null	Key	Default	Extra
a	timestamp(6)	NO		0000-00-00 00:00:00.000000	ON UPDATE CURRENT_TIMESTAMP(6)
SHOW CREATE TABLE t1;
Table	Create Table
t1	CREATE TABLE `t1` (
  `a` timestamp(6) NOT NULL DEFAULT '0000-00-00 00:00:00.000000' ON UPDATE CURRENT_TIMESTAMP(6)
) ORGANIZATION INDEX DEFAULT CHARSET = utf8mb4 COMPRESSION = 'lz4_1.0' REPLICA_NUM = 1 BLOCK_SIZE = 16384 USE_BLOOM_FILTER = FALSE ENABLE_MACRO_BLOCK_BLOOM_FILTER = FALSE TABLET_SIZE = 134217728 PCTFREE = 10
DROP TABLE t1;
CREATE TABLE t1 (a DATETIME(6) ON UPDATE CURRENT_TIMESTAMP);
ERROR HY000: Invalid ON UPDATE clause for 'a' column
CREATE TABLE t1 (a DATETIME(6) ON UPDATE CURRENT_TIMESTAMP(0));
ERROR HY000: Invalid ON UPDATE clause for 'a' column
CREATE TABLE t1 (a DATETIME(6) ON UPDATE CURRENT_TIMESTAMP(1));
ERROR HY000: Invalid ON UPDATE clause for 'a' column
CREATE TABLE t1 (a DATETIME(6) ON UPDATE CURRENT_TIMESTAMP(2));
ERROR HY000: Invalid ON UPDATE clause for 'a' column
CREATE TABLE t1 (a DATETIME(6) ON UPDATE CURRENT_TIMESTAMP(4));
ERROR HY000: Invalid ON UPDATE clause for 'a' column
CREATE TABLE t1 (a DATETIME(6) ON UPDATE CURRENT_TIMESTAMP(5));
ERROR HY000: Invalid ON UPDATE clause for 'a' column
CREATE TABLE t1 (a DATETIME(6) ON UPDATE CURRENT_TIMESTAMP(6));
SHOW COLUMNS FROM t1;
Field	Type	Null	Key	Default	Extra
a	datetime(6)	YES		NULL	ON UPDATE CURRENT_TIMESTAMP(6)
SHOW CREATE TABLE t1;
Table	Create Table
t1	CREATE TABLE `t1` (
  `a` datetime(6) DEFAULT NULL ON UPDATE CURRENT_TIMESTAMP(6)
) ORGANIZATION INDEX DEFAULT CHARSET = utf8mb4 COMPRESSION = 'lz4_1.0' REPLICA_NUM = 1 BLOCK_SIZE = 16384 USE_BLOOM_FILTER = FALSE ENABLE_MACRO_BLOCK_BLOOM_FILTER = FALSE TABLET_SIZE = 134217728 PCTFREE = 10
DROP TABLE t1;
#
# Testing TIMESTAMP(6) field in combination with DATETIME type functions
#
CREATE TABLE t1 (a TIMESTAMP(6) NOT NULL DEFAULT CURRENT_TIMESTAMP(6) ON UPDATE CURRENT_TIMESTAMP(6), b TIME(6));
INSERT INTO t1 VALUES (CURRENT_TIMESTAMP, CURRENT_TIME);
SELECT COUNT(*) FROM t1 WHERE a <= CURRENT_TIMESTAMP;
COUNT(*)
1
DROP TABLE t1;
#
# Testing partitions
#
CREATE TABLE t1 (a TIMESTAMP(6) NOT NULL DEFAULT CURRENT_TIMESTAMP(6) ON UPDATE CURRENT_TIMESTAMP(6)) PARTITION BY KEY(a) PARTITIONS 4;
INSERT INTO t1 VALUES ('2001-01-01 00:00:00.000000');
INSERT INTO t1 VALUES ('2001-01-01 00:00:00.000001');
INSERT INTO t1 VALUES ('2001-01-01 00:00:00.000002');
INSERT INTO t1 VALUES ('2001-01-01 00:00:00.000003');
INSERT INTO t1 VALUES ('2001-01-01 00:00:00.000004');
INSERT INTO t1 VALUES ('2001-01-01 00:00:00.000005');
INSERT INTO t1 VALUES ('2001-01-01 00:00:00.000006');
INSERT INTO t1 VALUES ('2001-01-01 00:00:00.000010');
INSERT INTO t1 VALUES ('2001-01-01 00:00:00.000011');
INSERT INTO t1 VALUES ('2001-01-01 00:00:00.000012');
INSERT INTO t1 VALUES ('2001-01-01 00:00:00.000013');
INSERT INTO t1 VALUES ('2001-01-01 00:00:00.000014');
INSERT INTO t1 VALUES ('2001-01-01 00:00:00.000015');
INSERT INTO t1 VALUES ('2001-01-01 00:00:00.000016');
INSERT INTO t1 VALUES ('2001-01-01 00:00:00.000110');
INSERT INTO t1 VALUES ('2001-01-01 00:00:00.000111');
INSERT INTO t1 VALUES ('2001-01-01 00:00:00.000112');
INSERT INTO t1 VALUES ('2001-01-01 00:00:00.000113');
INSERT INTO t1 VALUES ('2001-01-01 00:00:00.000114');
INSERT INTO t1 VALUES ('2001-01-01 00:00:00.000115');
INSERT INTO t1 VALUES ('2001-01-01 00:00:00.000116');
INSERT INTO t1 VALUES ('2001-01-01 00:00:00.000210');
INSERT INTO t1 VALUES ('2001-01-01 00:00:00.000211');
INSERT INTO t1 VALUES ('2001-01-01 00:00:00.000212');
INSERT INTO t1 VALUES ('2001-01-01 00:00:00.000213');
INSERT INTO t1 VALUES ('2001-01-01 00:00:00.000214');
INSERT INTO t1 VALUES ('2001-01-01 00:00:00.000215');
INSERT INTO t1 VALUES ('2001-01-01 00:00:00.000216');
INSERT INTO t1 VALUES ('2001-01-01 00:00:01.000000');
INSERT INTO t1 VALUES ('2001-01-01 00:00:01.000001');
INSERT INTO t1 VALUES ('2001-01-01 00:00:01.000002');
INSERT INTO t1 VALUES ('2001-01-01 00:00:01.000003');
INSERT INTO t1 VALUES ('2001-01-01 00:00:01.000004');
INSERT INTO t1 VALUES ('2001-01-01 00:00:01.000005');
INSERT INTO t1 VALUES ('2001-01-01 00:00:01.000006');
INSERT INTO t1 VALUES ('2001-01-01 00:00:02.000000');
INSERT INTO t1 VALUES ('2001-01-01 00:00:02.000001');
INSERT INTO t1 VALUES ('2001-01-01 00:00:02.000002');
INSERT INTO t1 VALUES ('2001-01-01 00:00:02.000003');
INSERT INTO t1 VALUES ('2001-01-01 00:00:02.000004');
INSERT INTO t1 VALUES ('2001-01-01 00:00:02.000005');
INSERT INTO t1 VALUES ('2001-01-01 00:00:02.000006');
SELECT * FROM t1 PARTITION(p0);
a
2001-01-01 00:00:00.000006
2001-01-01 00:00:00.000012
2001-01-01 00:00:00.000110
2001-01-01 00:00:00.000210
2001-01-01 00:00:00.000214
2001-01-01 00:00:01.000001
2001-01-01 00:00:01.000006
2001-01-01 00:00:02.000000
2001-01-01 00:00:02.000001
2001-01-01 00:00:02.000004
SELECT * FROM t1 PARTITION(p1);
a
2001-01-01 00:00:00.000001
2001-01-01 00:00:00.000004
2001-01-01 00:00:00.000014
2001-01-01 00:00:00.000016
2001-01-01 00:00:00.000111
2001-01-01 00:00:00.000113
2001-01-01 00:00:00.000115
2001-01-01 00:00:00.000213
2001-01-01 00:00:01.000000
2001-01-01 00:00:01.000004
2001-01-01 00:00:02.000002
2001-01-01 00:00:02.000003
SELECT * FROM t1 PARTITION(p2);
a
2001-01-01 00:00:00.000000
2001-01-01 00:00:00.000005
2001-01-01 00:00:00.000011
2001-01-01 00:00:00.000013
2001-01-01 00:00:00.000112
2001-01-01 00:00:00.000114
2001-01-01 00:00:00.000211
2001-01-01 00:00:00.000212
2001-01-01 00:00:00.000215
2001-01-01 00:00:01.000002
2001-01-01 00:00:01.000003
2001-01-01 00:00:01.000005
2001-01-01 00:00:02.000005
SELECT * FROM t1 PARTITION(p3);
a
2001-01-01 00:00:00.000002
2001-01-01 00:00:00.000003
2001-01-01 00:00:00.000010
2001-01-01 00:00:00.000015
2001-01-01 00:00:00.000116
2001-01-01 00:00:00.000216
2001-01-01 00:00:02.000006
DROP TABLE t1;
#
# Testing TIMESTAMP column with function MICROSECOND
#
CREATE TABLE t1 (a TIMESTAMP(6) NOT NULL DEFAULT CURRENT_TIMESTAMP(6) ON UPDATE CURRENT_TIMESTAMP(6));
INSERT INTO t1 VALUES ('2001-01-01 11:12:13.000001');
INSERT INTO t1 VALUES ('2001-01-01 11:12:13.100001');
INSERT INTO t1 VALUES ('2001-01-01 11:12:13.999999');
SELECT a, EXTRACT(MICROSECOND FROM a) FROM t1;
a	EXTRACT(MICROSECOND FROM a)
2001-01-01 11:12:13.000001	1
2001-01-01 11:12:13.100001	100001
2001-01-01 11:12:13.999999	999999
DROP TABLE t1;
#
# Testing TIMESTAMP(6) and user variables
#
CREATE TABLE t1 (a TIMESTAMP(6) NOT NULL DEFAULT CURRENT_TIMESTAMP(6) ON UPDATE CURRENT_TIMESTAMP(6));
INSERT INTO t1 VALUES ('2001-01-01 11:22:33.123456');
INSERT INTO t1 VALUES ('2001-01-01 00:00:00.100000');
SELECT * FROM t1;
a
2001-01-01 11:22:33.123456
2001-01-01 00:00:00.100000
SET @a='2001-01-01 11:22:33.123456';
SELECT * FROM t1 WHERE a=@a;
a
2001-01-01 11:22:33.123456
SET @a=20010101112233.123456;
SELECT * FROM t1 WHERE a=@a;
a
2001-01-01 11:22:33.123456
SET @a=20010101000000.1e0;
SELECT @a;
@a
20010101000000.1
SELECT * FROM t1 WHERE a=@a;
a
2001-01-01 00:00:00.100000
DROP TABLE t1;
#
# Testing INFORMATION_SCHEMA.COLUMNS
#
CREATE TABLE t1 (a TIMESTAMP(6) NOT NULL DEFAULT CURRENT_TIMESTAMP(6) ON UPDATE CURRENT_TIMESTAMP(6));
DROP TABLE t1;
#
# SELECT from a subquery
#
CREATE TABLE t1 (a TIMESTAMP(6) NOT NULL DEFAULT CURRENT_TIMESTAMP(6) ON UPDATE CURRENT_TIMESTAMP(6));
INSERT INTO t1 VALUES ('2001-01-01 00:00:00.123456'), ('2001-01-01 11:11:11.123456');
SELECT * FROM (SELECT * FROM t1) t12;
a
2001-01-01 00:00:00.123456
2001-01-01 11:11:11.123456
DROP TABLE t1;
#
# Testing IN and = subqueries
#
CREATE TABLE t1 (a TIMESTAMP(6) NOT NULL DEFAULT CURRENT_TIMESTAMP(6) ON UPDATE CURRENT_TIMESTAMP(6));
INSERT INTO t1 VALUES ('2001-01-01 00:00:00.123456'), ('2001-01-01 11:11:11.123456');
SELECT * FROM t1 WHERE a IN (SELECT MIN(a) FROM t1);
a
2001-01-01 00:00:00.123456
SELECT * FROM t1 WHERE a = (SELECT a FROM t1 ORDER BY a DESC LIMIT 1);
a
2001-01-01 11:11:11.123456
DROP TABLE t1;
#
# Testing IN subquery + GROUP
#
CREATE TABLE t1 (id INT, a TIMESTAMP(6) NOT NULL DEFAULT CURRENT_TIMESTAMP(6) ON UPDATE CURRENT_TIMESTAMP(6));
INSERT INTO t1 VALUES (1, '2001-01-01 00:00:00.123456'), (1, '2001-01-01 11:00:00.123456');
INSERT INTO t1 VALUES (2, '2001-01-01 00:01:00.123456'), (2, '2001-01-01 11:01:00.123456');
SELECT * FROM t1 WHERE a IN (SELECT MAX(a) FROM t1 GROUP BY id);
id	a
1	2001-01-01 11:00:00.123456
2	2001-01-01 11:01:00.123456
DROP TABLE t1;
#
# Testing VIEW
#
CREATE TABLE t1 (a TIMESTAMP(6) NOT NULL DEFAULT CURRENT_TIMESTAMP(6) ON UPDATE CURRENT_TIMESTAMP(6));
INSERT INTO t1 VALUES ('2001-01-01 00:00:00.123456'), ('2001-01-01 11:11:11.123456');
CREATE VIEW v1 AS SELECT a FROM t1;
SELECT * FROM v1 WHERE a='2001-01-01 00:00:00.123456';
a
2001-01-01 00:00:00.123456
SELECT MIN(a), MAX(a) FROM v1;
MIN(a)	MAX(a)
2001-01-01 00:00:00.123456	2001-01-01 11:11:11.123456
SELECT * FROM t1 WHERE a IN (SELECT MAX(a) FROM v1);
a
2001-01-01 11:11:11.123456
DROP VIEW v1;
CREATE VIEW v1 AS SELECT MAX(a) AS a FROM t1;
SELECT * FROM v1;
a
2001-01-01 11:11:11.123456
SELECT * FROM t1 WHERE a=(SELECT a FROM v1);
a
2001-01-01 11:11:11.123456
DROP VIEW v1;
DROP TABLE t1;
#
# Testing default value
#
CREATE TABLE t1 (a DATETIME(6), b TIMESTAMP(6) NOT NULL DEFAULT CURRENT_TIMESTAMP(6) ON UPDATE CURRENT_TIMESTAMP(6));
INSERT INTO t1 (a) VALUES (CURRENT_TIMESTAMP(6));
SELECT a=b FROM t1;
a=b
1
DROP TABLE t1;
SET time_zone=DEFAULT;
CREATE TABLE t1 (a DATETIME(6), b TIME(6));
INSERT INTO t1 VALUES ('1212-12-12 21:21:21.555555', '00:00:00.21');
INSERT INTO t1 VALUES ('9999-12-31 23:59:59.999999', '00:00:00.000001');
SELECT a + b FROM t1;
a + b
12121212212121.765555
99991231235960.000000
DROP TABLE t1;
#
# Examples from the WL#946 section 'Literals'
#
CREATE TABLE t1 (datetime_column DATETIME(1));
INSERT INTO t1 VALUES ('0000/1/1T1.23');
SELECT * FROM t1;
datetime_column
0000-01-01 01:23:00.0
DROP TABLE t1;
CREATE TABLE t1 (datetime_column DATETIME(1));
INSERT INTO t1 VALUES ('1111.11.11 11.11.11.55');
SELECT * FROM t1;
datetime_column
1111-11-11 11:11:11.6
DROP TABLE t1;
CREATE TABLE t1 (time_column TIME(1));
INSERT INTO t1 VALUES ('1.1');
SELECT * FROM t1;
time_column
00:00:01.1
DROP TABLE t1;
CREATE TABLE t1 (time_column TIME(1));
INSERT INTO t1 VALUES ('1:2:3:4');
SELECT * FROM t1;
time_column
01:02:03.0
DROP TABLE t1;
CREATE TABLE t1 (datetime_column DATETIME(2));
INSERT INTO t1 VALUES ('73-1-1 1:1:1.2');
SELECT * FROM t1;
datetime_column
1973-01-01 01:01:01.20
DROP TABLE t1;
CREATE TABLE t1 (datetime_column DATETIME(2));
INSERT INTO t1 VALUES (1101010101.55);
SELECT * FROM t1;
datetime_column
2000-11-01 01:01:01.55
DROP TABLE t1;
SELECT TIMEDIFF('00:00:00.1', '00:00:00.3');
TIMEDIFF('00:00:00.1', '00:00:00.3')
-00:00:00.200000
#
# Examples from the WL#946 section 'Treat like decimals'
#
CREATE TABLE t1 (time_column TIME(6));
INSERT INTO t1 SET time_column=TIME'1.000001';
SELECT * FROM t1;
time_column
00:00:01.000001
DROP TABLE t1;
CREATE TABLE t1 (time_column TIME(6));
INSERT INTO t1 SET time_column=TIME'1.0000005';
SELECT * FROM t1;
time_column
00:00:01.000001
DROP TABLE t1;
CREATE TABLE t1 (time_column TIME(6));
INSERT INTO t1 SET time_column=TIME'1.0000005' + 0.000001;
SELECT * FROM t1;
time_column
00:00:01.000002
DROP TABLE t1;
SELECT TIME'00:00:00.1' = TIME'00:00:00.100';
TIME'00:00:00.1' = TIME'00:00:00.100'
1
CREATE TABLE t1 (timestamp_column TIMESTAMP(0));
INSERT INTO t1 SET timestamp_column = '2005-01-01 23:59:59.9';
SELECT * FROM t1;
timestamp_column
2005-01-02 00:00:00
DROP TABLE t1;
#
# Examples from the WL#946 section 'Behaviour changes'
#
SET timestamp=UNIX_TIMESTAMP('2001-01-01 10:20:30');
SELECT CURRENT_TIME(6), CURRENT_TIME;
CURRENT_TIME(6)	CURRENT_TIME
10:20:30.000000	10:20:30
SET timestamp=DEFAULT;
CREATE TABLE t1 (s1 DATETIME);
INSERT INTO t1 VALUES ('2000-12-31 23:59:59.9');
SELECT * FROM t1;
s1
2001-01-01 00:00:00
DROP TABLE t1;
#
# Examples from the WL#946 section 'Metadata'
#
CREATE TABLE t1 (a TIME(3));
SHOW COLUMNS FROM t1;
Field	Type	Null	Key	Default	Extra
a	time(3)	YES		NULL	
DESC t1;
Field	Type	Null	Key	Default	Extra
a	time(3)	YES		NULL	
SHOW FIELDS FROM t1;
Field	Type	Null	Key	Default	Extra
a	time(3)	YES		NULL	
SHOW CREATE TABLE t1;
Table	Create Table
t1	CREATE TABLE `t1` (
  `a` time(3) DEFAULT NULL
) ORGANIZATION INDEX DEFAULT CHARSET = utf8mb4 COMPRESSION = 'lz4_1.0' REPLICA_NUM = 1 BLOCK_SIZE = 16384 USE_BLOOM_FILTER = FALSE ENABLE_MACRO_BLOCK_BLOOM_FILTER = FALSE TABLET_SIZE = 134217728 PCTFREE = 10
DROP TABLE t1;
#
# Bug#12546965 - 60990: INCORRECT DATE COMPARISON
#
CREATE TABLE t1 (first_usage DATE, last_recharge DATETIME, life_time SMALLINT(4) UNSIGNED);
INSERT INTO t1 VALUES ('2011-04-27', null, 900);
SELECT DATE_ADD(GREATEST(first_usage, IFNULL(last_recharge, first_usage)), INTERVAL life_time DAY ) as dt, DATE_ADD(GREATEST(first_usage, IFNULL(last_recharge, first_usage)), INTERVAL life_time DAY ) < DATE('2011-04-28') as exp FROM t1;
dt	exp
2013-10-13 00:00:00	0
DROP TABLE t1;
#
# 'SELECT 3 IN (SELECT MAX(a) FROM t1)' returned 0 instead of NULL
# at some point of WL#946 development.
# This case is not covered elsewhere in the tests.
#
CREATE TABLE t1 (a INT);
SELECT 3 IN (SELECT MAX(a) FROM t1);
3 IN (SELECT MAX(a) FROM t1)
NULL
DROP TABLE t1;
CREATE TABLE t1(s1 DATETIME(6), s2 TIME(6));
INSERT INTO t1 VALUES ('1212-12-12 21:21:21.555555', '00:00:00.21');
SELECT s1 + s2 FROM t1;
s1 + s2
12121212212121.765555
DROP TABLE t1;
CREATE TABLE t1 (s1 TIMESTAMP(6) NOT NULL DEFAULT CURRENT_TIMESTAMP(6) ON UPDATE CURRENT_TIMESTAMP(6));
INSERT INTO t1 VALUES ('1971-01-01 00:00:00.0000099');
SELECT * FROM t1;
s1
1971-01-01 00:00:00.000010
DROP TABLE t1;
CREATE TABLE t1 (s1 DATETIME(2));
INSERT INTO t1 VALUES ('1970-01-01 11:11:11.1234');
SELECT * FROM t1;
s1
1970-01-01 11:11:11.12
DROP TABLE t1;
CREATE TABLE t1 (s1 datetime(6));
INSERT INTO t1 VALUES ('2011-05-18 16:17:11.291816');
SELECT MAX(s1), MAX(s1 + 0), MAX(s1) FROM t1;
MAX(s1)	MAX(s1 + 0)	MAX(s1)
2011-05-18 16:17:11.291816	20110518161711.291816	2011-05-18 16:17:11.291816
DROP TABLE t1;
SELECT TIMESTAMP'2011-05-18 16:17:11.';
TIMESTAMP'2011-05-18 16:17:11.'
2011-05-18 16:17:11
SELECT DATE_ADD('2011-05-18 16:17:11.0', INTERVAL 1 SECOND);
DATE_ADD('2011-05-18 16:17:11.0', INTERVAL 1 SECOND)
2011-05-18 16:17:12
SELECT DATE_ADD('2011-05-18 16:17:11.0', INTERVAL 1.1 SECOND);
DATE_ADD('2011-05-18 16:17:11.0', INTERVAL 1.1 SECOND)
2011-05-18 16:17:12.100000
CREATE TABLE t1 (time_column TIME(6));
INSERT INTO t1 VALUES (0);
UPDATE t1 SET time_column=TIME '1.0000005';
SELECT * FROM t1;
time_column
00:00:01.000001
DROP TABLE t1;
CREATE TABLE t1 (time_column TIME(6));
INSERT INTO t1 VALUES (0);
UPDATE t1 SET time_column=TIME '1.0000005' + 0.000001;
SELECT * FROM t1;
time_column
00:00:01.000002
DROP TABLE t1;
CREATE TABLE t1 (timestamp_column TIMESTAMP(0));
INSERT INTO t1 VALUES (DEFAULT);
UPDATE t1 SET timestamp_column = '2005-01-01 23:59:59.9';
SELECT * FROM t1;
timestamp_column
2005-01-02 00:00:00
DROP TABLE t1;
CREATE TABLE t1 (a TIME(1));
INSERT INTO t1 VALUES ('1.1');
SELECT * FROM t1;
a
00:00:01.1
DROP TABLE t1;
#
# bug7
#
CREATE TABLE t1 (col_timestamp_2_not_null_key timestamp(2) NULL DEFAULT '0000-00-00 00:00:00.00', col_datetime_4_not_null_key datetime(4) NOT NULL, KEY col_timestamp_2_not_null_key (col_timestamp_2_not_null_key),KEY col_datetime_4_not_null_key (col_datetime_4_not_null_key));
UPDATE t1 SET col_datetime_4_not_null_key = 9 WHERE col_timestamp_2_not_null_key !=9;
DROP TABLE t1;
#
# bug8
#
CREATE TABLE t1 (
col_time_3_not_null_key time(3) NOT NULL, col_datetime_4_not_null_key datetime(4) NOT NULL, KEY col_time_3_not_null_key (col_time_3_not_null_key),KEY col_datetime_4_not_null_key (col_datetime_4_not_null_key));
SELECT col_time_3_not_null_key FROM t1 WHERE col_datetime_4_not_null_key > 7;
col_time_3_not_null_key
DROP TABLE t1;
#
# bug10
#
CREATE TABLE t1 ( col_time_1_not_null_key time(1) NOT NULL, col_time_2_key time(2) DEFAULT NULL, col_datetime_6_not_null_key datetime(6) NOT NULL, col_datetime_4_not_null_key datetime(4) NOT NULL, col_datetime_6_key datetime(6) DEFAULT NULL, col_timestamp_4_key timestamp(4) NULL DEFAULT '0000-00-00 00:00:00.0000', col_timestamp_5_key timestamp(5) NULL DEFAULT '0000-00-00 00:00:00.00000', col_datetime_key datetime DEFAULT NULL, col_datetime_5_not_null_key datetime(5) NOT NULL, col_time_5_key time(5) DEFAULT NULL, col_datetime_3_key datetime(3) DEFAULT NULL, pk datetime NOT NULL DEFAULT '0000-00-00 00:00:00', col_time_not_null_key time NOT NULL, col_time_4_not_null_key time(4) NOT NULL, PRIMARY KEY (pk), KEY col_time_1_not_null_key (col_time_1_not_null_key), KEY col_time_2_key (col_time_2_key), KEY col_datetime_6_not_null_key (col_datetime_6_not_null_key), KEY col_datetime_4_not_null_key (col_datetime_4_not_null_key), KEY col_datetime_6_key (col_datetime_6_key), KEY col_timestamp_4_key (col_timestamp_4_key), KEY col_timestamp_5_key (col_timestamp_5_key), KEY col_datetime_key (col_datetime_key), KEY col_datetime_5_not_null_key (col_datetime_5_not_null_key),  KEY col_time_5_key (col_time_5_key), KEY col_datetime_3_key (col_datetime_3_key), KEY col_time_not_null_key (col_time_not_null_key), KEY col_time_4_not_null_key (col_time_4_not_null_key))/*!50100 PARTITION BY KEY (pk)PARTITIONS 2 */;
SELECT col_datetime_3_key , COUNT( col_timestamp_5_key )FROM t1 FORCE KEY (PRIMARY, col_datetime_5_not_null_key, col_datetime_6_key, col_time_5_key, col_time_2_key)  wHERE (col_time_4_not_null_key NOT  BETWEEN '2002-01-01 21:50:38.023562' AND '20090504151448.022774'  AND col_time_1_not_null_key IN ('2000-07-13 21:35:51.034786', '2004-10-13 19:51:18.029716', '2001-11-23 10:22:42.001689', '2001-12-07 06:56:47.034426','20081109153313.042580' ))AND (col_timestamp_4_key BETWEEN '0000-00-00 00:00:00' AND '2008-06-16 10:42:11.032174' OR col_time_not_null_key BETWEEN '2007-02-13 14:29:42.008072' AND '2009-05-18 17:06:18.036503' )AND ((col_datetime_key <> '2004-09-06 19:57:07.024714') AND col_datetime_5_not_null_key NOT IN ('20061212182915.005997','0000-00-00 00:00:00', '20000920051358.001283', '2000-09-03 00:07:36.061713' )) AND (col_datetime_4_not_null_key IS NULL OR col_time_5_key BETWEEN '20051201163954.001782' AND '0000-00-00 00:00:00') GROUP BY col_datetime_6_not_null_key;
col_datetime_3_key	COUNT( col_timestamp_5_key )
DROP TABLE t1;
#
# bug11
#
#
# bug13
#
SET timestamp=UNIX_TIMESTAMP('2011-07-31 10:00:00');
CREATE TABLE t1 ( col_datetime_2_not_null_key datetime(2) NOT NULL, col_datetime_5 datetime(5) DEFAULT NULL, col_time_key time DEFAULT NULL, col_time_not_null time NOT NULL, pk datetime(5) NOT NULL DEFAULT '0000-00-00 00:00:00.00000', PRIMARY KEY (pk), KEY col_datetime_2_not_null_key (col_datetime_2_not_null_key),KEY col_time_key (col_time_key));
INSERT INTO t1 VALUES
('2001-10-20 00:00:00.00','2001-09-20 11:18:18.03630','03:00:10','00:20:01','2011-07-19 17:37:06.26725'), ('0000-00-00 00:00:00.00','0000-00-00 00:00:00.00000','08:30:41','00:20:01','2011-07-19 17:37:07.26725'), ('0000-00-00 00:00:00.00','0000-00-00 00:00:00.00000','20:07:31','01:12:26','2011-07-19 17:37:08.26725'), ('2000-01-14 17:55:57.03','0000-00-00 00:00:00.00000','00:20:04','14:35:10','2011-07-19 17:37:09.26725'), ('2006-12-27 07:25:14.04',NULL,'08:07:59','07:58:50','2011-07-19 17:37:10.26725'), ('2000-10-17 22:03:12.01','0000-00-00 00:00:00.00000','00:20:02','23:21:51','2011-07-19 17:37:11.26725'), ('0000-00-00 00:00:00.00','0000-00-00 00:00:00.00000','00:20:05','00:20:04','2011-07-19 17:37:12.26725'), ('0000-00-00 00:00:00.00','0000-00-00 00:00:00.00000','00:20:04','23:19:52','2011-07-19 17:37:13.26725'), ('0000-00-00 00:00:00.00','2008-06-04 23:05:50.03642','00:20:03','22:28:03','2011-07-19 17:37:14.26725'),('2000-10-22 23:52:09.01',NULL,'00:20:07','00:20:07','2011-07-19 17:37:15.26725');
SELECT col_datetime_2_not_null_key AS c1, col_time_not_null AS c2 FROM t1 WHERE pk = LEAST(STR_TO_DATE(DATE_FORMAT(col_time_key, CONCAT_WS( ':','%I','%m' )) , CONCAT_WS('-','%y','%H','%V','%k','%k' )), '0000-00-00') OR col_datetime_5 = CURRENT_DATE() ORDER BY 1;
c1	c2
DROP TABLE t1;
SET timestamp=DEFAULT;
#
# bug15
#
CREATE TABLE t1 ( col_datetime_5 datetime(5) DEFAULT NULL, col_timestamp_6_key timestamp(6) NOT NULL DEFAULT '0000-00-00 00:00:00.000000', col_time_2_not_null time(2) NOT NULL,KEY col_timestamp_6_key (col_timestamp_6_key));
INSERT INTO t1 VALUES (current_timestamp(5),current_timestamp(6),current_time(6));
SELECT col_datetime_5 AS c1 FROM t1 WHERE col_time_2_not_null = GREATEST(CURRENT_DATE(),col_timestamp_6_key) ORDER BY 1;
c1
DROP TABLE t1;
SET @@time_zone='+00:00';
CREATE TABLE t1 (col_datetime_4_not_null DATETIME(4) NOT NULL);
INSERT INTO t1 VALUES
('0000-00-00 00:00:00.0000'),('2006-05-12 07:06:44.0441'),('2007-11-08 00:00:00.0000'), ('2007-07-23 00:00:00.0000'),('2006-01-10 22:19:14.0158'),('2006-09-13 18:54:05.0013'), ('2002-03-26 00:00:00.0000'),('2002-10-22 10:53:06.0151'),('0000-00-00 00:00:00.0000'),('2001-06-04 00:00:00.0000'),('0000-00-00 00:00:00.0000'),('2000-12-11 10:47:58.0505'), ('2009-04-21 20:01:40.0570'),('2007-03-12 10:48:41.0031'),('0000-00-00 00:00:00.0000'), ('2009-06-22 00:00:00.0000'),('2008-01-21 15:28:44.0592'),('2003-10-05 00:43:55.0577'), ('2002-11-04 00:46:30.0630'),('2006-01-19 11:38:03.0378'),('0000-00-00 00:00:00.0000'), ('2001-02-04 00:00:00.0000'),('2004-10-22 21:59:04.0394'),('2006-03-20 18:54:13.0139'), ('2004-06-09 03:17:31.0403'),('0000-00-00 00:00:00.0000'),('2003-06-01 17:59:12.0365'), ('0000-00-00 00:00:00.0000'),('2009-06-15 08:58:58.0329'),('0000-00-00 00:00:00.0000'), ('2004-03-26 00:00:00.0000'),('2009-04-27 00:00:00.0000'),('2000-09-07 00:00:00.0000'), ('2006-11-04 00:51:03.0501'),('2005-02-20 00:30:47.0647'),('0000-00-00 00:00:00.0000'), ('2004-12-07 00:00:00.0000'),('0000-00-00 00:00:00.0000'),('0000-00-00 00:00:00.0000'), ('2002-08-17 00:27:20.0536'),('2006-10-12 12:12:28.0337'),('0000-00-00 00:00:00.0000'), ('0000-00-00 00:00:00.0000'),('2009-09-09 14:16:05.0354'),('2000-02-25 00:00:00.0000'), ('2003-12-16 05:38:37.0626'),('2000-10-05 03:46:43.0067'),('0000-00-00 00:00:00.0000'), ('2000-10-08 06:45:51.0547'),('0000-00-00 00:00:00.0000'),('2000-04-06 01:46:21.0620'), ('2001-08-10 23:15:40.0304'),('2001-06-24 10:14:00.0497'),('0000-00-00 00:00:00.0000'), ('0000-00-00 00:00:00.0000'),('2004-10-22 00:00:00.0000'),('0000-00-00 00:00:00.0000'), ('0000-00-00 00:00:00.0000'),('2005-08-23 06:34:23.0058'),('2005-03-28 18:34:18.0138'),('2004-05-18 00:00:00.0000');
SELECT UNIX_TIMESTAMP(col_datetime_4_not_null) FROM t1 ORDER BY 1;
UNIX_TIMESTAMP(col_datetime_4_not_null)
0.0000
0.0000
0.0000
0.0000
0.0000
0.0000
0.0000
0.0000
0.0000
0.0000
0.0000
0.0000
0.0000
0.0000
0.0000
0.0000
0.0000
0.0000
0.0000
951436800.0000
954985581.0620
968284800.0000
970717603.0067
970987551.0547
976531678.0505
981244800.0000
991612800.0000
993377640.0497
997485340.0304
1017100800.0000
1029544040.0536
1035283986.0151
1036370790.0630
1054490352.0365
1065314635.0577
1071553117.0626
1080259200.0000
1084838400.0000
1086751051.0403
1098403200.0000
1098482344.0394
1102377600.0000
1108859447.0647
1112034858.0138
1124778863.0058
1136931554.0158
1137670683.0378
1142880853.0139
1147417604.0441
1158173645.0013
1160655148.0337
1162601463.0501
1173696521.0031
1185148800.0000
1194480000.0000
1200929324.0592
1240344100.0570
1240790400.0000
1245056338.0329
1245628800.0000
1252505765.0354
DROP TABLE t1;
SET @@time_zone=DEFAULT;
SET @@timestamp=UNIX_TIMESTAMP('2011-09-21 10:20:30');
CREATE TABLE t1 ( col_time_6_not_null_key TIME(6) NOT NULL, col_time_not_null TIME NOT NULL, pk TIME(4) NOT NULL DEFAULT '00:00:00.0000', col_time_key TIME DEFAULT NULL, col_time_2_not_null_key TIME(2) NOT NULL, col_time_4 TIME(4) DEFAULT NULL,col_time_3_not_null TIME(3) NOT NULL, col_datetime_2 DATETIME(2) DEFAULT NULL, PRIMARY KEY (pk), KEY col_time_6_not_null_key (col_time_6_not_null_key), KEY col_time_key (col_time_key), KEY col_time_2_not_null_key (col_time_2_not_null_key)) /*!50100 PARTITION BY KEY (pk)PARTITIONS 2 */;
INSERT INTO t1 VALUES ( CURRENT_TIME(4), CURRENT_TIME(), CURRENT_TIME(4), CURRENT_TIME(), CURRENT_TIME(2), CURRENT_TIME(4), CURRENT_TIME(3),CURRENT_TIMESTAMP(2));
SELECT col_datetime_2 AS c1, col_time_not_null AS c2 FROM t1 WHERE col_time_6_not_null_key > COALESCE(col_time_2_not_null_key, col_time_4, col_time_not_null, col_time_3_not_null) ORDER BY 1;
c1	c2
DROP TABLE t1;
SET @@timestamp=DEFAULT;
CREATE TABLE t1 ( col_time_1_not_null_key time(1) NOT NULL, pk timestamp NOT NULL DEFAULT '0000-00-00 00:00:00',  col_datetime_3_not_null_key datetime(3) NOT NULL, col_time_2_key time(2) DEFAULT NULL, PRIMARY KEY (pk), KEY col_time_1_not_null_key (col_time_1_not_null_key), KEY col_datetime_3_not_null_key (col_datetime_3_not_null_key),KEY col_time_2_key (col_time_2_key));
INSERT INTO t1 VALUES ('00:20:05.0','1999-12-31 21:00:01','0000-00-00 00:00:00.000','04:25:59.01');
INSERT INTO t1 VALUES ('00:15:56.0','1999-12-31 21:00:03','0000-00-00 00:00:00.000','00:20:06.00');
INSERT INTO t1 VALUES ('00:20:03.0','1999-12-31 21:00:05','2002-10-18 16:08:58.006','00:20:00.00');
INSERT INTO t1 VALUES ('00:20:09.0','1999-12-31 21:00:07','2002-11-11 17:21:02.045','18:39:12.05');
INSERT INTO t1 VALUES ('13:51:22.0','1999-12-31 21:00:09','2002-08-07 10:27:35.055','00:20:07.00');
INSERT INTO t1 VALUES ('00:20:06.0','0000-00-00 00:00:00','2003-08-12 00:00:00.000','20:35:34.01');
SELECT col_time_1_not_null_key AS c1 FROM t1 WHERE col_datetime_3_not_null_key NOT IN (LEAST( DATE('0000-00-00 00:00:00'), CURDATE()), col_time_2_key);
DROP TABLE t1;
#
# Bug#13359097 ASSERT FAILURE IN MAKE_SORTKEY
#
SET timestamp=UNIX_TIMESTAMP('2011-11-01 17:48:00');
CREATE TABLE t1 (
pk time(6) NOT NULL DEFAULT '00:00:00.000000',
col_date_not_null date NOT NULL,
PRIMARY KEY (pk)
);
INSERT INTO t1 VALUES ('00:00:00.000000','2001-09-10');
INSERT INTO t1 VALUES ('12:07:41.148239','2000-05-23');
SELECT GREATEST('2004-04-07', COALESCE (pk, col_date_not_null)) FROM  t1 ORDER BY 1;
GREATEST('2004-04-07', COALESCE (pk, col_date_not_null))
2011-11-01 00:00:00.000000
2011-11-01 12:07:41.148239
DROP TABLE t1;
SET timestamp=DEFAULT;
#
# BUG#13386657 ASSERT FAILURE IN ITEM::GET_DATE_FROM_NON_TEMPORAL
#
CREATE TABLE t1 (
col_time_5_not_null_key time(5) NOT NULL,
col_datetime_4 datetime(4) DEFAULT NULL,
col_timestamp_1_not_null_key timestamp(1) NULL DEFAULT '0000-00-00 00:00:00.0',
col_datetime_3_not_null_key datetime(3) NOT NULL,
KEY col_time_5_not_null_key (col_time_5_not_null_key),
KEY col_timestamp_1_not_null_key (col_timestamp_1_not_null_key),
KEY col_datetime_3_not_null_key (col_datetime_3_not_null_key));
INSERT INTO t1 VALUES ('15:01:38.00004','0000-00-00 00:00:00.0000','2005-06-08 16:51:23.0','0000-00-00 00:00:00.000');
SELECT col_datetime_4
FROM t1
WHERE col_datetime_3_not_null_key IN
(COALESCE (col_timestamp_1_not_null_key), col_time_5_not_null_key);
col_datetime_4
DROP TABLE t1;
CREATE TABLE t1 (a TIMESTAMP(3) NOT NULL DEFAULT CURRENT_TIMESTAMP(3) ON UPDATE CURRENT_TIMESTAMP(3));
INSERT INTO t1 VALUES ('2001-01-01 10:20:30.999');
SELECT CAST(COALESCE(a,a) AS CHAR) FROM t1;
CAST(COALESCE(a,a) AS CHAR)
2001-01-01 10:20:30.999
SELECT CAST(COALESCE(a,a) AS SIGNED) FROM t1;
CAST(COALESCE(a,a) AS SIGNED)
20010101102030
SELECT CAST(COALESCE(a,a) AS DECIMAL(25,3)) FROM t1;
CAST(COALESCE(a,a) AS DECIMAL(25,3))
20010101102030.999
SELECT ROUND(COALESCE(a,a)) FROM t1;
ROUND(COALESCE(a,a))
20010101102031
DROP TABLE t1;
CREATE TABLE t1 (a DATE);
INSERT INTO t1 VALUES ('0000-00-00');
SELECT CAST(COALESCE(a,a) AS SIGNED) FROM t1;
CAST(COALESCE(a,a) AS SIGNED)
0
SELECT CAST(COALESCE(a,a) AS CHAR) FROM t1;
CAST(COALESCE(a,a) AS CHAR)
0000-00-00
SELECT CAST(COALESCE(a,a) AS DECIMAL(25,3)) FROM t1;
CAST(COALESCE(a,a) AS DECIMAL(25,3))
0.000
SELECT ROUND(COALESCE(a,a)) FROM t1;
ROUND(COALESCE(a,a))
0
DROP TABLE t1;
CREATE TABLE t1 (a DATETIME);
INSERT INTO t1 VALUES ('0000-00-00 00:00:00');
SELECT CAST(COALESCE(a,a) AS SIGNED) FROM t1;
CAST(COALESCE(a,a) AS SIGNED)
0
SELECT CAST(COALESCE(a,a) AS CHAR) FROM t1;
CAST(COALESCE(a,a) AS CHAR)
0000-00-00 00:00:00
SELECT CAST(COALESCE(a,a) AS DECIMAL(25,3)) FROM t1;
CAST(COALESCE(a,a) AS DECIMAL(25,3))
0.000
SELECT ROUND(COALESCE(a,a)) FROM t1;
ROUND(COALESCE(a,a))
0
DROP TABLE t1;
#
# Bug#13399082 - ASSERTION `MON > 0 && MON < 13' FAILED IN TZTIME.CC | SEC_SINCE_EPOCH
#
SET TIME_ZONE='+02:00';
SELECT UNIX_TIMESTAMP(STR_TO_DATE('2020','%Y'));
UNIX_TIMESTAMP(STR_TO_DATE('2020','%Y'))
0
SET TIME_ZONE=DEFAULT;
# This should return NULL
CREATE TABLE t1 (a INT);
INSERT INTO t1 VALUES(NULL);
SELECT UNIX_TIMESTAMP(a) FROM t1;
UNIX_TIMESTAMP(a)
NULL
DROP TABLE t1;
SELECT UNIX_TIMESTAMP(NULL);
UNIX_TIMESTAMP(NULL)
NULL
SELECT UNIX_TIMESTAMP(DATE(NULL));
UNIX_TIMESTAMP(DATE(NULL))
NULL
SELECT CONCAT(UNIX_TIMESTAMP(NULL));
CONCAT(UNIX_TIMESTAMP(NULL))
NULL
SELECT CAST(UNIX_TIMESTAMP(NULL) AS SIGNED);
CAST(UNIX_TIMESTAMP(NULL) AS SIGNED)
NULL
SELECT CAST(UNIX_TIMESTAMP(NULL) AS DECIMAL(23,6));
CAST(UNIX_TIMESTAMP(NULL) AS DECIMAL(23,6))
NULL
# This should return 0
CREATE TABLE t1 (a VARCHAR(30));
INSERT INTO t1 VALUES
('0000-01-01 00:00:00'),('2001-00-01 00:00:01'),('2001-01-00 00:00:00'),
('0000-00-00 00:00:01'),('0000-00-00 00:00:00.1');
SELECT UNIX_TIMESTAMP(a) FROM t1;
UNIX_TIMESTAMP(a)
0.000000
0.000000
0.000000
0.000000
0.000000
DROP TABLE t1;
SELECT UNIX_TIMESTAMP('0000-01-01 00:00:00');
UNIX_TIMESTAMP('0000-01-01 00:00:00')
0
SELECT UNIX_TIMESTAMP('2001-00-01 00:00:00');
UNIX_TIMESTAMP('2001-00-01 00:00:00')
0.000000
SELECT UNIX_TIMESTAMP('2001-01-00 00:00:00');
UNIX_TIMESTAMP('2001-01-00 00:00:00')
0.000000
SELECT UNIX_TIMESTAMP('0000-00-00 10:10:20');
UNIX_TIMESTAMP('0000-00-00 10:10:20')
0.000000
SELECT UNIX_TIMESTAMP('0000-00-00 00:00:00.1');
UNIX_TIMESTAMP('0000-00-00 00:00:00.1')
0.000000
#
# Bug#13354387 - CRASH IN IN MY_DECIMAL::OPERATOR FOR VIEW AND FUNCTION UNIX_TIMESTAMP
#
SET timestamp=UNIX_TIMESTAMP('2011-11-18 14:36:00');
CREATE TABLE t1 (
pk time(2) NOT NULL DEFAULT '00:00:00.00',
col_timestamp_3_not_null timestamp(3) NULL DEFAULT '0000-00-00 00:00:00.000',
col_datetime_1_key datetime(1) DEFAULT NULL,
col_datetime_6_not_null_key datetime(6) NOT NULL,
col_datetime_2_not_null datetime(2) NOT NULL,
PRIMARY KEY (pk),
KEY col_datetime_1_key (col_datetime_1_key),
KEY col_datetime_6_not_null_key (col_datetime_6_not_null_key));
INSERT INTO t1 VALUES ('19:14:35.36','0000-00-00 00:00:00.000','0000-00-00 00:00:00.0','2000-08-28 07:34:20.051690','2009-09-20 07:32:39.06');
INSERT INTO t1 VALUES ('19:14:37.36','2005-07-04 08:03:50.051','0000-00-00 00:00:00.0','0000-00-00 00:00:00.000000','0000-00-00 00:00:00.00');
INSERT INTO t1 VALUES ('19:14:39.36','0000-00-00 00:00:00.000',NULL,'2005-10-11 07:24:45.059064','2009-11-19 00:00:00.00');
INSERT INTO t1 VALUES ('19:14:41.36','2005-11-22 21:00:00.000',NULL,'0000-00-00 00:00:00.000000','0000-00-00 00:00:00.00');
INSERT INTO t1 VALUES ('19:14:43.36','2009-11-06 21:00:00.000','2007-07-03 11:13:08.0','2002-09-02 00:17:37.037583','2003-09-25 09:29:41.00');
INSERT INTO t1 VALUES ('19:14:36.36','2009-08-15 05:43:18.029','2009-01-18 00:00:00.0','0000-00-00 00:00:00.000000','2007-07-20 08:31:37.02');
INSERT INTO t1 VALUES ('19:14:38.36','0000-00-00 00:00:00.000','0000-00-00 00:00:00.0','0000-00-00 00:00:00.000000','2004-08-16 05:11:47.04');
INSERT INTO t1 VALUES ('19:14:40.36','2000-04-16 21:00:00.000',NULL,'2004-04-27 00:00:00.000000','2009-06-03 00:18:49.04');
INSERT INTO t1 VALUES ('19:14:42.36','2009-01-18 20:46:41.035','2003-03-23 11:37:04.0','0000-00-00 00:00:00.000000','2009-12-26 00:00:00.00');
INSERT INTO t1 VALUES ('19:14:44.36','0000-00-00 00:00:00.000','0000-00-00 00:00:00.0','2005-09-14 15:13:53.062460','0000-00-00 00:00:00.00');
CREATE OR REPLACE VIEW v1 AS SELECT * FROM t1;
SELECT UNIX_TIMESTAMP(col_datetime_2_not_null) AS c1
FROM  v1
WHERE col_datetime_6_not_null_key > col_datetime_1_key
AND col_timestamp_3_not_null IS NOT NULL
ORDER BY 1;
c1
0.00
1253403159.06
DROP VIEW v1;
DROP TABLE t1;
SET timestamp=DEFAULT;
#
# Various tests for better gcov coverage
#
#
# BUG#13450867 - CRASH ON UPDATE A TIME COLUMN
#
CREATE TABLE t1 (a TIME(6), b TIME(6), c TIME(6), d TIME(6));
INSERT INTO t1 VALUES
('-838:59:59.999999', '-838:59:59.000001',
'838:59:59.999999', '838:59:59.000001');
SELECT * FROM t1;
a	b	c	d
-838:59:59.000000	-838:59:59.000000	838:59:59.000000	838:59:59.000000
UPDATE t1 SET
a= a - INTERVAL 999999 MICROSECOND, b= b - INTERVAL 1 MICROSECOND,
c= c + INTERVAL 999999 MICROSECOND, d= d + INTERVAL 1 MICROSECOND;
SELECT * FROM t1;
a	b	c	d
01:00:00.000001	01:00:00.999999	22:59:59.999999	22:59:59.000001
DROP TABLE t1;
#
# BUG#13451866 - DIFFERENCE IN RESULTS WHEN USING
# EXTRACT( MINUTE_MICROSECOND )
#
CREATE TABLE t1 (a DATETIME(6) DEFAULT NULL);
INSERT INTO t1 VALUES ('0000-00-00 00:00:00.000000');
SELECT * FROM t1;
a
0000-00-00 00:00:00.000000
SELECT EXTRACT(MINUTE_MICROSECOND FROM a) FROM t1;
EXTRACT(MINUTE_MICROSECOND FROM a)
0
SELECT EXTRACT(MINUTE_MICROSECOND FROM '0000-00-00 00:00:00.000000');
EXTRACT(MINUTE_MICROSECOND FROM '0000-00-00 00:00:00.000000')
0
DROP TABLE t1;
#
# BUG#13436875 - ASSERTION '!ARGS[0]->IS_TEMPORAL() ||
# !ARGS[1]->IS_TEMPORAL()'
#
CREATE TABLE t1 (a DATETIME NOT NULL);
SELECT 1 FROM t1 WHERE GREATEST(a, a) / a;
1
SELECT 1 FROM t1 WHERE LEAST(a, a) / a;
1
SELECT 1 FROM t1 WHERE COALESCE(a, a) / a;
1
SELECT 1 FROM t1 WHERE IF(0, a, a) / a;
1
SELECT 1 FROM t1 WHERE IFNULL(a, a) / a;
1
SELECT 1 FROM t1 WHERE CASE WHEN 0 then a ELSE a END / a;
1
SELECT 1 FROM t1 WHERE (SELECT a FROM t1) / a;
1
DROP TABLE t1;
#
# Bug#13375823 - FSP(DECIMAL) RESULT DIFFERENCE WITH QUERY USING UNION ALL
#
CREATE TABLE t1 (a DATETIME(3) NOT NULL);
INSERT INTO t1 VALUES ('2000-07-16 05:58:04.035');
INSERT INTO t1 VALUES ('2008-08-21 00:00:00.000');
INSERT INTO t1 VALUES ('0000-00-00 00:00:00.000');
# Testing INT number
SELECT GREATEST(a, 1323) FROM t1;
GREATEST(a, 1323)
20000716055804.035
20080821000000.000
0.000
(SELECT GREATEST(a, 1323) FROM t1) UNION ALL (SELECT GREATEST(a, 1323) FROM t1 LIMIT 0);
GREATEST(a, 1323)
20000716055804.035
20080821000000.000
0.000
SELECT LEAST(a, 1323) FROM t1;
LEAST(a, 1323)
1323.000
1323.000
0.000
(SELECT LEAST(a, 1323) FROM t1) UNION ALL (SELECT LEAST(a, 1323) FROM t1 LIMIT 0);
LEAST(a, 1323)
1323.000
1323.000
0.000
# Testing DECIMAL number
SELECT GREATEST(a, 1323.123456) FROM t1;
GREATEST(a, 1323.123456)
20000716055804.035000
20080821000000.000000
0.000000
(SELECT GREATEST(a, 1323.123456) FROM t1) UNION ALL (SELECT GREATEST(a, 1323.123456) FROM t1 LIMIT 0);
GREATEST(a, 1323.123456)
20000716055804.035000
20080821000000.000000
0.000000
SELECT LEAST(a, 1323.123456) FROM t1;
LEAST(a, 1323.123456)
1323.123456
1323.123456
0.000000
(SELECT LEAST(a, 1323.123456) FROM t1) UNION ALL (SELECT LEAST(a, 1323.123456) FROM t1 LIMIT 0);
LEAST(a, 1323.123456)
1323.123456
1323.123456
0.000000
# Testing REAL number
SELECT GREATEST(a, 1323e0) FROM t1;
GREATEST(a, 1323e0)
20000716055804.035
20080821000000
0
(SELECT GREATEST(a, 1323e0) FROM t1) UNION ALL (SELECT GREATEST(a, 1323e0) FROM t1 LIMIT 0);
GREATEST(a, 1323e0)
20000716055804.035
20080821000000
0
SELECT LEAST(a, 1323e0) FROM t1;
LEAST(a, 1323e0)
1323
1323
0
(SELECT LEAST(a, 1323e0) FROM t1) UNION ALL (SELECT LEAST(a, 1323e0) FROM t1 LIMIT 0);
LEAST(a, 1323e0)
1323
1323
0
DROP TABLE t1;
# Make sure precision of 6 fractional digits does not get lost
CREATE TABLE t1 (a DATETIME(6));
INSERT INTO t1 VALUES ('2001-01-01 01:01:01.123456');
SELECT GREATEST(a,10), LEAST(a,10) FROM t1;
GREATEST(a,10)	LEAST(a,10)
20010101010101.123456	10.000000
DROP TABLE t1;
# Test for invalid seconds >= 60 properly separated by decimal point with fractions.
SELECT TIMESTAMP '2013:07:10 01.02.131';
ERROR HY000: Incorrect DATETIME value: '2013:07:10 01.02.131'
SELECT TIMESTAMP '2013:07:10 01.02.131.2';
ERROR HY000: Incorrect DATETIME value: '2013:07:10 01.02.131.2'
SELECT TIMESTAMP '2013:07:10 01.02.0312.3';
ERROR HY000: Incorrect DATETIME value: '2013:07:10 01.02.0312.3'
# Test for valid seconds properly separated by decimal point with fractions.
SELECT TIMESTAMP '2013:07:10 01.02.0.31';
TIMESTAMP '2013:07:10 01.02.0.31'
2013-07-10 01:02:00.31
SELECT TIMESTAMP '20130710010203.';
TIMESTAMP '20130710010203.'
2013-07-10 01:02:03
# Test for valid seconds properly separated by decimal point with fractions.
SELECT TIMESTAMP '20130710010203.1';
TIMESTAMP '20130710010203.1'
2013-07-10 01:02:03.1
SELECT TIMESTAMP '20130710010203.12';
TIMESTAMP '20130710010203.12'
2013-07-10 01:02:03.12
SELECT TIMESTAMP '20130710010203.123';
TIMESTAMP '20130710010203.123'
2013-07-10 01:02:03.123
SELECT TIMESTAMP '20130710010203.1234';
TIMESTAMP '20130710010203.1234'
2013-07-10 01:02:03.1234
SELECT TIMESTAMP '20130710010203.12345';
TIMESTAMP '20130710010203.12345'
2013-07-10 01:02:03.12345
SELECT TIMESTAMP '20130710010203.123456';
TIMESTAMP '20130710010203.123456'
2013-07-10 01:02:03.123456
SELECT TIMESTAMP '20130710010203.1234567';
TIMESTAMP '20130710010203.1234567'
2013-07-10 01:02:03.123457
# Test for DATETIME datatype.
# Test for TIME datatype.
SELECT TIME '010203';
TIME '010203'
01:02:03
SELECT TIME '1010203';
TIME '1010203'
101:02:03
SELECT TIME '01010203';
TIME '01010203'
101:02:03
SELECT TIME '10102031';
ERROR HY000: Incorrect TIME value: '10102031'
SELECT TIME '101020312';
ERROR HY000: Incorrect TIME value: '101020312'
SELECT TIME '1010203123';
ERROR HY000: Incorrect TIME value: '1010203123'
SELECT TIME '10102031234';
ERROR HY000: Incorrect TIME value: '10102031234'
SELECT TIME '101020312345';
ERROR HY000: Incorrect TIME value: '101020312345'
SELECT TIME '1010203123456';
ERROR HY000: Incorrect TIME value: '1010203123456'
# Test non decimal point as delimiter for fractional seconds.
# Test for invalid seconds >= 60 properly separated by decimal point with fractions.
SELECT TIME '01:02:131';
ERROR HY000: Incorrect TIME value: '01:02:131'
SELECT TIME '01:02:131.2';
ERROR HY000: Incorrect TIME value: '01:02:131.2'
SELECT TIME '01:02:0312.3';
ERROR HY000: Incorrect TIME value: '01:02:0312.3'
SELECT TIME '01:02:131.23456';
ERROR HY000: Incorrect TIME value: '01:02:131.23456'
SELECT TIME '11102031.';
ERROR HY000: Incorrect TIME value: '11102031.'
# Test for valid seconds properly separated by decimal point with fractions.
SELECT TIME '01:02:0.31';
TIME '01:02:0.31'
01:02:00.31
SELECT TIME '010203.';
TIME '010203.'
01:02:03
# Test for valid seconds properly separated by decimal point with fractions.
SELECT TIME '110203.1';
TIME '110203.1'
11:02:03.1
SELECT TIME '010203.12';
TIME '010203.12'
01:02:03.12
SELECT TIME '010203.123';
TIME '010203.123'
01:02:03.123
SELECT TIME '010203.1234';
TIME '010203.1234'
01:02:03.1234
SELECT TIME '010203.12345';
TIME '010203.12345'
01:02:03.12345
SELECT TIME '010203.123456';
TIME '010203.123456'
01:02:03.123456
SELECT TIME '010203.1234567';
TIME '010203.1234567'
01:02:03.123457
SELECT TIME '01021.1';
TIME '01021.1'
00:10:21.1
# End of 5.6 tests
