drop table if exists t1, t2;
create table t1 (pk int primary key, v varchar(30), c char(3), e char(20), t varchar(256));
insert into t1 values (1,'abc', 'de', 'ghi', 'jkl');
insert into t1 values (2,'abc ', 'de ', 'ghi', 'jkl ');
insert into t1 values (3,'abc    ', 'd  ', 'ghi', 'jkl    ');
select length(v),length(c),length(e),length(t) from t1;
length(v)	length(c)	length(e)	length(t)
3	2	3	3
4	2	3	4
7	1	3	7
drop table t1;
create table t1 (pk int primary key, v varchar(20));
insert into t1 values(1, 'a ');
select v='a' from t1;
v='a'
1
select v='a ' from t1;
v='a '
1
drop table if exists t1;
create table t1 (pkcol varchar(16), othercol varchar(16), primary key (pkcol));
insert into t1 values ('test', 'something');
update t1 set othercol='somethingelse' where pkcol='test';
select * from t1;
pkcol	othercol
test	somethingelse
drop table t1;
create table t1 (a int primary key, b varchar(12));
insert into t1 values (1, 'A'), (22, NULL);
create table t2 (pk int primary key, a int);
insert into t2 values (1,22), (2,22);
select t1.a, t1.b, min(t1.b) from t1 inner join t2 ON t2.a = t1.a
group by t1.b, t1.a;
a	b	min(t1.b)
22	NULL	NULL
drop table t1, t2;
create table t1 (f1 varchar(4096) primary key);
create index index1 on t1(f1);
show create table t1;
Table	Create Table
t1	CREATE TABLE `t1` (
  `f1` varchar(4096) NOT NULL,
  PRIMARY KEY (`f1`),
  KEY `index1` (`f1`) BLOCK_SIZE 16384 LOCAL
) ORGANIZATION INDEX DEFAULT CHARSET = utf8mb4 COMPRESSION = 'lz4_1.0' REPLICA_NUM = NUM BLOCK_SIZE = SIZE USE_BLOOM_FILTER = FALSE ENABLE_MACRO_BLOCK_BLOOM_FILTER = FALSE TABLET_SIZE = SIZE PCTFREE = 10
alter table t1 add c2 varchar(500);
desc t1;
Field	Type	Null	Key	Default	Extra
f1	varchar(4096)	NO	PRI	NULL	
c2	varchar(500)	YES		NULL	
alter table t1 drop c2 ;
alter table t1 add c2 varchar(65535);
desc t1;
Field	Type	Null	Key	Default	Extra
f1	varchar(4096)	NO	PRI	NULL	
c2	varchar(65535)	YES		NULL	
insert into t1 values('agagafgfdgadfg','adgagafgfdgdfgdf');
select * from t1;
f1	c2
agagafgfdgadfg	adgagafgfdgdfgdf
alter table t1 drop c2;
select * from t1;
f1
agagafgfdgadfg
drop table if exists t1;
CREATE TABLE t1 (a VARCHAR(16) primary key);
INSERT INTO t1 VALUES ('5'), ('s'), ('');
SELECT '5' = a FROM t1;
'5' = a
0
1
0
DROP TABLE t1;
