ob1=OBI(cluster=3:1:1,proxy_num=0,memory_size_limit='25G');
ob1.z1.obs2.set status=disable;
ob1.z3.obs0.set status=disable;
ob1.reboot;
ob1.check_until_timeout select count(*) from __all_server where start_service_time = 0, 0, 60;
ob1.mysql alter system set debug_sync_timeout = '100000s';
ob1.mysql alter system set enable_rebalance=FALSE;
alter system set_tp tp_name = ALL_SERVER_SCHEDULE_ERROR, error_code = 4016, frequency = 1;
ob1.mysql alter tenant sys PRIMARY_ZONE='z2';
ob1.check_until_timeout select count(*) from __all_server where svr_ip='$z2_ip' and svr_port=$z2_port and with_rootserver=1,1,120;
update oceanbase.__all_sys_stat set value = 4095 where name = "ob_max_used_server_id";
select id from oceanbase.__all_server order by id;
id
1
2
3
ob1.z1.obs2.set status=enable;
ob1.z1.obs2.start;
ob1.z1.obs2.add;
id
4100
ob1.z1.obs2.delete;
ob1.check_until_timeout select count(*) from __all_server where svr_ip='$obs2_ip' and svr_port=$obs2_port,0,60;
ob1.z1.obs1.delete;
ob1.check_until_timeout select count(*) from __all_server where svr_ip='$obs1_ip' and svr_port=$obs1_port,0,30;
ob1.check_until_timeout select count(*) from __all_rootservice_job where svr_ip='$obs1_ip' and svr_port=$obs1_port and job_type = 'DELETE_SERVER' and job_status = 'SUCCESS',1,60;
ob1.z1.obs1.force_stop;
ob1.z1.obs1.rmdir;
ob1.z1.obs1.mkdir;
ob1.z1.obs1.rsync;
ob1.z1.obs1.start;
alter system set_tp tp_name = ALL_SERVER_LIST_ERROR, error_code = 4016, frequency = 1;
ob1.check_until_timeout select count(*) from __all_virtual_sys_parameter_stat where name like "%all_server_list%" and value like '%$obs0_ip:$obs0_port%',2,30;
ob1.check_until_timeout select count(*) from __all_virtual_sys_parameter_stat where name like "%all_server_list%" and value like '%$z2_ip:$z2_port%',2,30;
ob1.check_until_timeout select count(*) from __all_virtual_sys_parameter_stat where name like "%all_server_list%" and value like '%$obs1_ip:$obs1_port%',0,30;
ob1.z1.obs1.add;
id
4101
ob1.check_until_timeout select count(*) from __all_server where svr_ip='$obs1_ip' and svr_port=$obs1_port and status='ACTIVE' and start_service_time > 0 and last_offline_time = 0,1,120;
alter system set_tp tp_name = ALL_SERVER_LIST_ERROR, error_code = 4016, frequency = 0;
ob1.check_until_timeout select count(*) from __all_virtual_sys_parameter_stat where name like "%all_server_list%" and value like '%$obs0_ip:$obs0_port%',3,30;
ob1.check_until_timeout select count(*) from __all_virtual_sys_parameter_stat where name like "%all_server_list%" and value like '%$z2_ip:$z2_port%',3,30;
ob1.check_until_timeout select count(*) from __all_virtual_sys_parameter_stat where name like "%all_server_list%" and value like '%$obs1_ip:$obs1_port%',0,30;
ob1.check_until_timeout select count(*) from __all_virtual_sys_parameter_stat where name like "%all_server_list%" and value like '%$obs1_ip:$obs1_port%',3,630;
ob1.check_until_timeout select count(*) from __all_virtual_sys_parameter_stat where name like "%all_server_list%" and value like '%$obs0_ip:$obs0_port%',3,30;
ob1.check_until_timeout select count(*) from __all_virtual_sys_parameter_stat where name like "%all_server_list%" and value like '%$z2_ip:$z2_port%',3,30;
ob1.mysql CREATE RESOURCE UNIT 1c5g MAX_CPU 1, MEMORY_SIZE '5G';
ob1.mysql CREATE RESOURCE POOL pool1 UNIT='1c5g',UNIT_NUM=1,ZONE_LIST=('z1');
ob1.mysql CREATE TENANT IF NOT EXISTS test_tenant ZONE_LIST=('z1'), RESOURCE_POOL_LIST=('pool1');
ob1.check_until_timeout select count(*) from __all_virtual_unit where TENANT_ID = $tid, 1, 240;
ob1.check_until_timeout select count(*) from __all_virtual_unit where svr_ip = '$obs1_ip' and svr_port = $obs1_port and unit_id = $uid, 2, 240;
ob1.mysql set ob_global_debug_sync = 'END_DELETE_SERVER_BEFORE_CHECK_META_TABLE wait_for signal';
ob1.z1.obs1.delete;
ob1.check_until_timeout select count(*) from __all_server where svr_ip='$obs1_ip' and svr_port=$obs1_port and status = 'DELETING' and start_service_time > 0 and last_offline_time = 0,1,60;
ob1.check_until_timeout select count(*) from __all_rootservice_job where svr_ip='$obs1_ip' and svr_port=$obs1_port and job_type = 'DELETE_SERVER' and job_status = 'INPROGRESS',1,60;
ERROR HY000: server has already been deleted
ob1.mysql delete from oceanbase.__all_rootservice_job WHERE job_id = $job_id;
ob1.check_until_timeout select count(*) from __all_rootservice_job where job_id = $job_id,0,5;
ob1.mysql set ob_global_debug_sync = 'now signal signal';
ob1.mysql set ob_global_debug_sync = 'END_DELETE_SERVER_BEFORE_CHECK_META_TABLE clear';
ob1.check_until_timeout select count(*) from oceanbase.__all_server where svr_ip='$obs1_ip' and svr_port=$obs1_port,0,100;
ERROR HY000: server not in server white list
ob1.z1.obs2.force_stop;
ob1.z1.obs2.rmdir;
ob1.z1.obs2.mkdir;
ob1.z1.obs2.rsync;
ob1.z1.obs2.start;
ob1.z1.obs2.add;
id
4102
ob1.check_until_timeout select count(*) from __all_server where svr_ip='$obs2_ip' and svr_port=$obs2_port and status='ACTIVE' and start_service_time > 0 and last_offline_time = 0,1,120;
ob1.mysql CREATE RESOURCE UNIT 1c17g MAX_CPU 1, MEMORY_SIZE '17G', LOG_DISK_SIZE='2G';
ob1.mysql CREATE RESOURCE POOL pool2 UNIT='1c17g',UNIT_NUM=1,ZONE_LIST=('z1');
ob1.mysql CREATE TENANT IF NOT EXISTS test_tenant2 ZONE_LIST=('z1'), RESOURCE_POOL_LIST=('pool2') set ob_tcp_invited_nodes='%', ob_compatibility_mode='mysql';
ob1.check_until_timeout select count(*) from __all_virtual_unit where TENANT_ID = $tid, 1, 240;
ob1.check_until_timeout select count(*) from __all_virtual_unit where svr_ip = '$obs2_ip' and svr_port = $obs2_port and unit_id = $uid, 2, 240;
select tenant_name from DBA_OB_TENANTS;
tenant_name
test_tenant2
ob1.z1.obs1.force_stop;
ob1.z1.obs1.rmdir;
ob1.z1.obs1.mkdir;
ob1.z1.obs1.rsync;
ob1.z1.obs1.start;
ob1.z1.obs1.add;
ob1.check_until_timeout select count(*) from __all_server where svr_ip='$obs1_ip' and svr_port=$obs1_port and status='ACTIVE' and start_service_time > 0 and last_offline_time = 0,1,120;
ob1.mysql set ob_global_debug_sync = 'END_DELETE_SERVER_BEFORE_CHECK_META_TABLE wait_for signal';
ob1.z1.obs1.delete;
ob1.check_until_timeout select count(*) from __all_server where svr_ip='$obs1_ip' and svr_port=$obs1_port and status = 'DELETING' and start_service_time > 0 and last_offline_time = 0,1,60;
ob1.check_until_timeout select count(*) from __all_rootservice_job where svr_ip='$obs1_ip' and svr_port=$obs1_port and job_type = 'DELETE_SERVER' and job_status = 'INPROGRESS',1,60;
ob1.z1.obs1.cancel_delete;
ob1.check_until_timeout select count(*) from __all_server where svr_ip='$obs1_ip' and svr_port=$obs1_port and status = 'ACTIVE' and start_service_time > 0 and last_offline_time = 0,1,60;
ob1.check_until_timeout select count(*) from __all_rootservice_job where svr_ip='$obs1_ip' and svr_port=$obs1_port and job_type = 'DELETE_SERVER' and job_status = 'FAILED' and result_code = -4072,1,60;
ob1.z1.obs1.force_stop;
ob1.check_until_timeout select count(*) from __all_server where svr_ip='$obs1_ip' and svr_port=$obs1_port and status = 'INACTIVE' and start_service_time = 0 and last_offline_time > 0,1,60;
ob1.z1.obs1.delete;
ob1.check_until_timeout select count(*) from __all_server where svr_ip='$obs1_ip' and svr_port=$obs1_port and status = 'DELETING' and start_service_time = 0 and last_offline_time > 0,1,60;
ob1.check_until_timeout select count(*) from __all_rootservice_job where svr_ip='$obs1_ip' and svr_port=$obs1_port and job_type = 'DELETE_SERVER' and job_status = 'INPROGRESS',1,60;
ob1.mysql delete from oceanbase.__all_rootservice_job WHERE job_id = $job_id;
ob1.check_until_timeout select count(*) from __all_rootservice_job where job_id = $job_id,0,5;
ob1.z1.obs1.cancel_delete;
ob1.check_until_timeout select count(*) from __all_server where svr_ip='$obs1_ip' and svr_port=$obs1_port and status = 'INACTIVE' and start_service_time = 0 and last_offline_time > 0,1,60;
ob1.mysql set ob_global_debug_sync = 'now signal signal';
ob1.mysql set ob_global_debug_sync = 'END_DELETE_SERVER_BEFORE_CHECK_META_TABLE clear';
ob1.z3.obs0.set status=enable;
ob1.z3.obs0.start;
ob1.mysql alter system add zone 'z3';
ob1.mysql alter system start zone 'z3';
ob1.z3.obs0.add;
ob1.check_until_timeout select count(*) from __all_server where svr_ip='$z3_ip' and svr_port=$z3_port and status='ACTIVE' and start_service_time > 0 and last_offline_time = 0,1,120;
ob1.mysql alter resource pool sys_pool zone_list = ('z1','z2','z3');
ob1.mysql alter tenant sys locality="F@z1,F@z2,F@z3";
ob1.check_until_timeout select count(*) from DBA_OB_TENANT_JOBS where job_type = 'ALTER_TENANT_LOCALITY' and job_status = 'INPROGRESS',1,60;
ob1.check_until_timeout select count(*) from DBA_OB_TENANT_JOBS where job_id = $job_id and job_status = 'SUCCESS',1,180;
ob1.z3.obs0.force_stop;
ob1.check_until_timeout select count(*) from __all_server where svr_ip='$z3_ip' and svr_port=$z3_port and status='INACTIVE',1,15;
ob1.mysql alter tenant sys locality="F@z1,F@z2";
ob1.check_until_timeout select count(*) from DBA_OB_TENANT_JOBS where job_type = 'ALTER_TENANT_LOCALITY' and job_status = 'INPROGRESS',1,60;
ob1.check_until_timeout select count(*) from DBA_OB_TENANT_JOBS where job_id = $job_id and job_status = 'SUCCESS',1,180;
ob1.mysql alter resource pool sys_pool zone_list = ('z1','z2');
ob1.check_until_timeout select count(*) from __all_unit where zone='z3',0,5;
ob1.mysql alter system delete server '$z3_ip:$z3_port';
ob1.check_until_timeout select count(*) from __all_server where svr_ip='$z3_ip' and svr_port=$z3_port,0,120;
ob1.z3.obs0.rmdir;
ob1.z3.obs0.mkdir;
ob1.z3.obs0.rsync;
ob1.z3.obs0.start;
ob1.z1.obs1.start;
ob1.z3.obs0.add;
ob1.check_until_timeout select count(*) from __all_server where svr_ip='$obs1_ip' and svr_port=$obs1_port and status='ACTIVE' and start_service_time > 0 and last_offline_time = 0,1,120;
ob1.check_until_timeout select count(*) from __all_server where svr_ip='$z3_ip' and svr_port=$z3_port and status='ACTIVE' and start_service_time > 0 and last_offline_time = 0,1,120;
ob1.mysql alter resource pool pool1 zone_list = ('z1','z2','z3');
ob1.mysql alter tenant test_tenant locality="F@z1,F@z2";
ob1.check_until_timeout select count(*) from DBA_OB_TENANT_JOBS where job_type = 'ALTER_TENANT_LOCALITY' and job_status = 'INPROGRESS',1,60;
ob1.check_until_timeout select count(*) from DBA_OB_TENANT_JOBS where job_id = $job_id and job_status = 'SUCCESS',1,180;
ob1.mysql alter tenant test_tenant locality="F@z1,F@z2,F@z3";
ob1.check_until_timeout select count(*) from DBA_OB_TENANT_JOBS where job_type = 'ALTER_TENANT_LOCALITY' and job_status = 'INPROGRESS',1,60;
ob1.check_until_timeout select count(*) from DBA_OB_TENANT_JOBS where job_id = $job_id and job_status = 'SUCCESS',1,180;
ob1.mysql alter resource pool sys_pool zone_list = ('z1','z2','z3');
ob1.mysql alter tenant sys locality="F@z1,F@z2,F@z3";
ob1.check_until_timeout select count(*) from DBA_OB_TENANT_JOBS where job_type = 'ALTER_TENANT_LOCALITY' and job_status = 'INPROGRESS',1,60;
ob1.check_until_timeout select count(*) from DBA_OB_TENANT_JOBS where job_id = $job_id and job_status = 'SUCCESS',1,180;
ob1.z1.obs0.force_stop;
ob1.z2.obs0.check_until_timeout select count(*) from oceanbase.__all_virtual_ls_meta_table where svr_port=$obs0_port and svr_ip='$obs0_ip',6,10;
ob1.z2.obs0.mysql alter system delete server '$obs0_ip:$obs0_port';
ob1.z2.obs0.check_until_timeout select count(*) from oceanbase.__all_unit where svr_ip='$obs0_ip' and svr_port=$obs0_port, 0,120;
ob1.z2.obs0.check_until_timeout select count(*) from oceanbase.__all_unit where migrate_from_svr_ip='$obs0_ip' and migrate_from_svr_port=$obs0_port, 0,240;
ob1.z2.obs0.check_rs_log_until_success "Deleting server is temporary offline and empty(server=.*$obs0_ip:$obs0_port.*)";
ob1.z2.obs0.check_until_timeout select count(*) from oceanbase.__all_virtual_ls_meta_table where svr_port=$obs0_port and svr_ip='$obs0_ip',0,100;
ob1.z2.obs0.mysql alter system enable_rebalance = false tenant = 'sys';
ob1.z2.obs0.mysql alter system set syslog_level="DEBUG";
ob1.z2.obs0.check_until_timeout select count(*) from oceanbase.__all_server where svr_ip='$obs0_ip' and svr_port=$obs0_port,0,30;
ob1.z1.obs0.rmdir;
ob1.z1.obs0.mkdir;
ob1.z1.obs0.rsync;
ob1.z1.obs0.start;
select max(id) from oceanbase.__all_server order by id;
max(id)
4105
ob1.z2.obs0.mysql set ob_global_debug_sync = 'BEFORE_ADD_SERVER_TRANS wait_for signal_add';
set ob_query_timeout = 30000000;
update oceanbase.__all_server set id = (4105 + 1) where id = 4105;
select max(id) from oceanbase.__all_server order by id;
max(id)
4106
set ob_global_debug_sync = 'now signal signal_add';
set ob_global_debug_sync = 'BEFORE_ADD_SERVER_TRANS clear';
ob1.z2.obs0.check_rs_log_until_success "server index is outdated due to concurrent operations";
select max(id) from oceanbase.__all_server order by id;
max(id)
4106
ob1.z1.obs0.force_stop;
ob1.z1.obs0.rmdir;
ob1.z1.obs0.mkdir;
ob1.z1.obs0.rsync;
ob1.z1.obs0.start;
ob1.z2.obs0.mysql alter system add server '$obs0_ip:$obs0_port' ZONE='z1';
id
4107
ob1.z2.obs0.check_until_timeout select count(*) from oceanbase.__all_server where svr_ip='$obs0_ip' and svr_port=$obs0_port and status='ACTIVE' and start_service_time > 0 and last_offline_time = 0,1,120;
ob1.z2.obs0.mysql update oceanbase.__all_unit set migrate_from_svr_ip = '$obs0_ip', migrate_from_svr_port=$obs0_port where unit_id=$uid;
ob1.z2.obs0.check_until_timeout select count(*) from oceanbase.__all_unit where migrate_from_svr_ip='$obs0_ip' and migrate_from_svr_port=$obs0_port, 1,2;
ob1.z2.obs0.check_until_timeout select count(*) from oceanbase.__all_unit where svr_ip='$obs0_ip' and svr_port=$obs0_port, 0,2;
