ob1=OBI(cluster=1:1:1:1:1,proxy_num=0,init_unit_cpu=0);
ob1.set extra_config=$mini_ob_config;
ob1.reboot;
ob1.mysql alter system set debug_sync_timeout = '1000s';
ob1.mysql ALTER SYSTEM SET enable_rebalance = 'true';
ob1.mysql ALTER SYSTEM SET enable_rereplication = 'true';
=========================================
construct initial parameters
=========================================
=========================================
create mysql tenant
=========================================
set @@session.ob_query_timeout = 200000000;
alter system set __min_full_resource_pool_memory=1073741824;
use oceanbase;
ob1.mysql CREATE RESOURCE POOL mysql_pool UNIT = "2c2g", UNIT_NUM = 1, ZONE_LIST = ('z1', 'z2', 'z3', 'z4', 'z5');
ob1.mysql CREATE TENANT mysql RESOURCE_POOL_LIST=('mysql_pool'), LOCALITY = "F@z1, F@z2, F@z3", PRIMARY_ZONE = "z3" SET ob_tcp_invited_nodes='%';
=========================================
switch RS to z2 and hang RS
=========================================
make sure RS on z1 on begining
alter tenant sys primary_zone = 'z1;z2;z3;z4;z5';
ob1.check_until_timeout select count(*) as cnt from oceanbase.CDB_OB_LS_LOCATIONS where tenant_id = 1 and ls_id = 1 and role = "LEADER" and zone = "z1", 1, 30;
ob1.mysql alter system set_tp tp_name = ERRSIM_RS_STOP_ERROR, error_code = 4002, frequency = 1;
ob1.mysql alter system set_tp tp_name = ERRSIM_RS_START_SERVICE_ERROR, error_code = 4002, frequency = 1;
make sure RS on z2
update __all_server set stop_time = time_to_usec(now()) where zone = 'z1';
ob1.check_until_timeout select count(*) as cnt from oceanbase.GV\$OB_LOG_STAT where tenant_id = 1 and ls_id = 1 and role = "LEADER" and svr_ip = "$z2_dst_ip" and svr_port = $z2_dst_port, 1, 30;
=========================================
creata table and index in zone2
=========================================
create table t3(c1 int);
create table t4(c1 int);
insert into t3 values (1), (2), (3);
insert into t4 values (1), (2), (3);
expect 3 lines
select * from t3 order by c1 desc;
c1
3
2
1
expect 3 lines
select * from t4 order by c1 desc;
c1
3
2
1
create index t3_index1 on t3(c1);
create index t4_index1 on t4(c1);
insert into t3 values (4), (5), (6);
insert into t4 values (4), (5), (6);
expect 6 lines
select * from t3 order by c1 desc;
c1
6
5
4
3
2
1
expect 6 lines
select * from t4 order by c1 desc;
c1
6
5
4
3
2
1
=========================================
creata table and index in zone3
=========================================
create table t5(c1 int);
create table t6(c1 int);
insert into t5 values (1), (2), (3);
insert into t6 values (1), (2), (3);
expect 3 lines
select * from t5 order by c1 desc;
c1
3
2
1
expect 3 lines
select * from t6 order by c1 desc;
c1
3
2
1
create index t5_index1 on t5(c1);
create index t6_index1 on t6(c1);
insert into t5 values (4), (5), (6);
insert into t6 values (4), (5), (6);
expect 6 lines
select * from t5 order by c1 desc;
c1
6
5
4
3
2
1
expect 6 lines
select * from t6 order by c1 desc;
c1
6
5
4
3
2
1
=========================================
test zone2 can refresh schema
=========================================
expect 6 lines
select * from t3 order by c1 desc;
c1
6
5
4
3
2
1
select * from t4 order by c1 desc;
c1
6
5
4
3
2
1
select * from t5 order by c1 desc;
c1
6
5
4
3
2
1
select * from t6 order by c1 desc;
c1
6
5
4
3
2
1
=========================================
test zone3 can refresh schema
=========================================
expect 6 lines
select * from t3 order by c1 desc;
c1
6
5
4
3
2
1
select * from t4 order by c1 desc;
c1
6
5
4
3
2
1
select * from t5 order by c1 desc;
c1
6
5
4
3
2
1
select * from t6 order by c1 desc;
c1
6
5
4
3
2
1
=========================================
test zone4 can refresh schema
=========================================
expect 6 lines
select * from t3 order by c1 desc;
c1
6
5
4
3
2
1
select * from t4 order by c1 desc;
c1
6
5
4
3
2
1
select * from t5 order by c1 desc;
c1
6
5
4
3
2
1
select * from t6 order by c1 desc;
c1
6
5
4
3
2
1
=========================================
test zone5 can refresh schema
=========================================
expect 6 lines
select * from t3 order by c1 desc;
c1
6
5
4
3
2
1
select * from t4 order by c1 desc;
c1
6
5
4
3
2
1
select * from t5 order by c1 desc;
c1
6
5
4
3
2
1
select * from t6 order by c1 desc;
c1
6
5
4
3
2
1
=============================================
revoke RS in z2 and hang RS again
=============================================
make sure RS on z1 again
update __all_server set stop_time = 0 where zone = 'z1';
ob1.check_until_timeout select count(*) as cnt from oceanbase.GV\$OB_LOG_STAT where tenant_id = 1 and ls_id = 1 and role = "LEADER" and svr_ip = "$z1_dst_ip" and svr_port = $z1_dst_port, 1, 30;
===============================================
creata table and index in zone1 again
===============================================
create table r2_t1(c1 int);
create table r2_t2(c1 int);
insert into r2_t1 values (1), (2), (3);
insert into r2_t2 values (1), (2), (3);
expect 3 lines
select * from r2_t1 order by c1 desc;
c1
3
2
1
expect 3 lines
select * from r2_t2 order by c1 desc;
c1
3
2
1
create index r2_t1_index1 on r2_t1(c1);
create index r2_t2_index1 on r2_t2(c1);
insert into r2_t1 values (4), (5), (6);
insert into r2_t2 values (4), (5), (6);
expect 6 lines
select * from r2_t1 order by c1 desc;
c1
6
5
4
3
2
1
expect 6 lines
select * from r2_t2 order by c1 desc;
c1
6
5
4
3
2
1
===============================================
creata table and index in zone2 again
===============================================
create table r2_t3(c1 int);
create table r2_t4(c1 int);
insert into r2_t3 values (1), (2), (3);
insert into r2_t4 values (1), (2), (3);
expect 3 lines
select * from r2_t3 order by c1 desc;
c1
3
2
1
expect 3 lines
select * from r2_t4 order by c1 desc;
c1
3
2
1
create index r2_t3_index1 on r2_t3(c1);
create index r2_t4_index1 on r2_t4(c1);
insert into r2_t3 values (4), (5), (6);
insert into r2_t4 values (4), (5), (6);
expect 6 lines
select * from r2_t3 order by c1 desc;
c1
6
5
4
3
2
1
expect 6 lines
select * from r2_t4 order by c1 desc;
c1
6
5
4
3
2
1
===============================================
creata table and index in zone3 again
===============================================
create table r2_t5(c1 int);
create table r2_t6(c1 int);
insert into r2_t5 values (1), (2), (3);
insert into r2_t6 values (1), (2), (3);
expect 3 lines
select * from r2_t5 order by c1 desc;
c1
3
2
1
expect 3 lines
select * from r2_t6 order by c1 desc;
c1
3
2
1
create index r2_t5_index1 on r2_t5(c1);
create index r2_t6_index1 on r2_t6(c1);
insert into r2_t5 values (4), (5), (6);
insert into r2_t6 values (4), (5), (6);
expect 6 lines
select * from r2_t5 order by c1 desc;
c1
6
5
4
3
2
1
expect 6 lines
select * from r2_t6 order by c1 desc;
c1
6
5
4
3
2
1
==============================================
test zone1 can refresh schema again
==============================================
expect 6 lines
select * from t3 order by c1 desc;
c1
6
5
4
3
2
1
select * from t4 order by c1 desc;
c1
6
5
4
3
2
1
select * from t5 order by c1 desc;
c1
6
5
4
3
2
1
select * from t6 order by c1 desc;
c1
6
5
4
3
2
1
select * from r2_t1 order by c1 desc;
c1
6
5
4
3
2
1
select * from r2_t2 order by c1 desc;
c1
6
5
4
3
2
1
select * from r2_t3 order by c1 desc;
c1
6
5
4
3
2
1
select * from r2_t4 order by c1 desc;
c1
6
5
4
3
2
1
select * from r2_t5 order by c1 desc;
c1
6
5
4
3
2
1
select * from r2_t6 order by c1 desc;
c1
6
5
4
3
2
1
==============================================
test zone2 can refresh schema again
==============================================
expect 6 lines
select * from t3 order by c1 desc;
c1
6
5
4
3
2
1
select * from t4 order by c1 desc;
c1
6
5
4
3
2
1
select * from t5 order by c1 desc;
c1
6
5
4
3
2
1
select * from t6 order by c1 desc;
c1
6
5
4
3
2
1
select * from r2_t1 order by c1 desc;
c1
6
5
4
3
2
1
select * from r2_t2 order by c1 desc;
c1
6
5
4
3
2
1
select * from r2_t3 order by c1 desc;
c1
6
5
4
3
2
1
select * from r2_t4 order by c1 desc;
c1
6
5
4
3
2
1
select * from r2_t5 order by c1 desc;
c1
6
5
4
3
2
1
select * from r2_t6 order by c1 desc;
c1
6
5
4
3
2
1
==============================================
test zone3 can refresh schema again
==============================================
expect 6 lines
select * from t3 order by c1 desc;
c1
6
5
4
3
2
1
select * from t4 order by c1 desc;
c1
6
5
4
3
2
1
select * from t5 order by c1 desc;
c1
6
5
4
3
2
1
select * from t6 order by c1 desc;
c1
6
5
4
3
2
1
select * from r2_t1 order by c1 desc;
c1
6
5
4
3
2
1
select * from r2_t2 order by c1 desc;
c1
6
5
4
3
2
1
select * from r2_t3 order by c1 desc;
c1
6
5
4
3
2
1
select * from r2_t4 order by c1 desc;
c1
6
5
4
3
2
1
select * from r2_t5 order by c1 desc;
c1
6
5
4
3
2
1
select * from r2_t6 order by c1 desc;
c1
6
5
4
3
2
1
==============================================
test zone4 can refresh schema again
==============================================
expect 6 lines
select * from t3 order by c1 desc;
c1
6
5
4
3
2
1
select * from t4 order by c1 desc;
c1
6
5
4
3
2
1
select * from t5 order by c1 desc;
c1
6
5
4
3
2
1
select * from t6 order by c1 desc;
c1
6
5
4
3
2
1
select * from r2_t1 order by c1 desc;
c1
6
5
4
3
2
1
select * from r2_t2 order by c1 desc;
c1
6
5
4
3
2
1
select * from r2_t3 order by c1 desc;
c1
6
5
4
3
2
1
select * from r2_t4 order by c1 desc;
c1
6
5
4
3
2
1
select * from r2_t5 order by c1 desc;
c1
6
5
4
3
2
1
select * from r2_t6 order by c1 desc;
c1
6
5
4
3
2
1
==============================================
test zone5 can refresh schema again
==============================================
expect 6 lines
select * from t3 order by c1 desc;
c1
6
5
4
3
2
1
select * from t4 order by c1 desc;
c1
6
5
4
3
2
1
select * from t5 order by c1 desc;
c1
6
5
4
3
2
1
select * from t6 order by c1 desc;
c1
6
5
4
3
2
1
select * from r2_t1 order by c1 desc;
c1
6
5
4
3
2
1
select * from r2_t2 order by c1 desc;
c1
6
5
4
3
2
1
select * from r2_t3 order by c1 desc;
c1
6
5
4
3
2
1
select * from r2_t4 order by c1 desc;
c1
6
5
4
3
2
1
select * from r2_t5 order by c1 desc;
c1
6
5
4
3
2
1
select * from r2_t6 order by c1 desc;
c1
6
5
4
3
2
1
=====================================
switch RS to zone2 again
=====================================
make sure RS on zone2 again
update __all_server set stop_time = time_to_usec(now()) where zone = 'z1';
ob1.check_until_timeout select count(*) as cnt from oceanbase.GV\$OB_LOG_STAT where tenant_id = 1 and ls_id = 1 and role = "LEADER" and svr_ip = "$z2_dst_ip" and svr_port = $z2_dst_port, 1, 30;
================================================================
creata table and index in zone2 with RS in zone2 again
================================================================
create table r3_t3(c1 int);
create table r3_t4(c1 int);
insert into r3_t3 values (1), (2), (3);
insert into r3_t4 values (1), (2), (3);
expect 3 lines
select * from r3_t3 order by c1 desc;
c1
3
2
1
expect 3 lines
select * from r3_t4 order by c1 desc;
c1
3
2
1
create index r3_t3_index1 on r3_t3(c1);
create index r3_t4_index1 on r3_t4(c1);
insert into r3_t3 values (4), (5), (6);
insert into r3_t4 values (4), (5), (6);
expect 6 lines
select * from r3_t3 order by c1 desc;
c1
6
5
4
3
2
1
expect 6 lines
select * from r3_t4 order by c1 desc;
c1
6
5
4
3
2
1
================================================================
creata table and index in zone3 with RS in zone2 again
================================================================
create table r3_t5(c1 int);
create table r3_t6(c1 int);
insert into r3_t5 values (1), (2), (3);
insert into r3_t6 values (1), (2), (3);
expect 3 lines
select * from r3_t5 order by c1 desc;
c1
3
2
1
expect 3 lines
select * from r3_t6 order by c1 desc;
c1
3
2
1
create index r3_t5_index1 on r3_t5(c1);
create index r3_t6_index1 on r3_t6(c1);
insert into r3_t5 values (4), (5), (6);
insert into r3_t6 values (4), (5), (6);
expect 6 lines
select * from r3_t5 order by c1 desc;
c1
6
5
4
3
2
1
expect 6 lines
select * from r3_t6 order by c1 desc;
c1
6
5
4
3
2
1
==============================================
test zone2 can refresh schema again
==============================================
expect 6 lines
select * from t3 order by c1 desc;
c1
6
5
4
3
2
1
select * from t4 order by c1 desc;
c1
6
5
4
3
2
1
select * from t5 order by c1 desc;
c1
6
5
4
3
2
1
select * from t6 order by c1 desc;
c1
6
5
4
3
2
1
select * from r2_t1 order by c1 desc;
c1
6
5
4
3
2
1
select * from r2_t2 order by c1 desc;
c1
6
5
4
3
2
1
select * from r2_t3 order by c1 desc;
c1
6
5
4
3
2
1
select * from r2_t4 order by c1 desc;
c1
6
5
4
3
2
1
select * from r2_t5 order by c1 desc;
c1
6
5
4
3
2
1
select * from r2_t6 order by c1 desc;
c1
6
5
4
3
2
1
select * from r3_t3 order by c1 desc;
c1
6
5
4
3
2
1
select * from r3_t4 order by c1 desc;
c1
6
5
4
3
2
1
select * from r3_t5 order by c1 desc;
c1
6
5
4
3
2
1
select * from r3_t6 order by c1 desc;
c1
6
5
4
3
2
1
==============================================
test zone3 can refresh schema again
==============================================
expect 6 lines
select * from t3 order by c1 desc;
c1
6
5
4
3
2
1
select * from t4 order by c1 desc;
c1
6
5
4
3
2
1
select * from t5 order by c1 desc;
c1
6
5
4
3
2
1
select * from t6 order by c1 desc;
c1
6
5
4
3
2
1
select * from r2_t1 order by c1 desc;
c1
6
5
4
3
2
1
select * from r2_t2 order by c1 desc;
c1
6
5
4
3
2
1
select * from r2_t3 order by c1 desc;
c1
6
5
4
3
2
1
select * from r2_t4 order by c1 desc;
c1
6
5
4
3
2
1
select * from r2_t5 order by c1 desc;
c1
6
5
4
3
2
1
select * from r2_t6 order by c1 desc;
c1
6
5
4
3
2
1
select * from r3_t3 order by c1 desc;
c1
6
5
4
3
2
1
select * from r3_t4 order by c1 desc;
c1
6
5
4
3
2
1
select * from r3_t5 order by c1 desc;
c1
6
5
4
3
2
1
select * from r3_t6 order by c1 desc;
c1
6
5
4
3
2
1
