=====================================================================
create inital objects
=====================================================================
ob1=OBI(cluster=2:2:2,proxy_num=0,init_unit_cpu=0);
ob1.set extra_config=$mini_ob_config;
ob1.reboot;
ob1.mysql alter system set debug_sync_timeout = '1000s';
ob1.mysql ALTER SYSTEM SET enable_rebalance = 'false';
ob1.mysql ALTER SYSTEM SET enable_rereplication = 'true';
set @@session.ob_query_timeout = 200000000;
alter system set __min_full_resource_pool_memory=1073741824;
use oceanbase;
ob1.mysql CREATE RESOURCE POOL tenant_pool UNIT = "2c2g", UNIT_NUM = 2, ZONE_LIST = ('z1', 'z2', 'z3');
ob1.mysql CREATE TENANT tenant_for_duplicate RESOURCE_POOL_LIST=('tenant_pool'), LOCALITY = "F@z1, F@z2", PRIMARY_ZONE = "z1" SET ob_tcp_invited_nodes='%';
create table t1_no_pk (c1 int);
create table t1_dup_no_pk (c1 int) duplicate_scope = 'CLUSTER';
insert into t1_no_pk values (1), (2), (3);
insert into t1_dup_no_pk values (1), (2), (3);
select * from t1_no_pk order by c1 asc;
c1
1
2
3
select * from t1_dup_no_pk order by c1 asc;
c1
1
2
3
update t1_no_pk set c1=c1+10;
update t1_dup_no_pk set c1=c1+10;
select * from t1_no_pk order by c1 asc;
c1
11
12
13
select * from t1_dup_no_pk order by c1 asc;
c1
11
12
13
create table t1_pk (c1 int primary key);
create table t1_dup_pk (c1 int primary key) duplicate_scope = 'CLUSTER';
insert into t1_pk values (1), (2), (3);
insert into t1_dup_pk values (1), (2), (3);
select * from t1_pk order by c1 asc;
c1
1
2
3
select * from t1_dup_pk order by c1 asc;
c1
1
2
3
update t1_pk set c1=c1+10;
update t1_dup_pk set c1=c1+10;
select * from t1_pk order by c1 asc;
c1
11
12
13
select * from t1_dup_pk order by c1 asc;
c1
11
12
13
create table t1_part (c1 int primary key) partition by hash(c1) partitions 4;
create table t1_dup_part (c1 int primary key) duplicate_scope = 'CLUSTER' partition by hash(c1) partitions 4;
insert into t1_part values (1), (2), (3), (4);
insert into t1_dup_part values (1), (2), (3), (4);
select * from t1_part order by c1 asc;
c1
1
2
3
4
select * from t1_dup_part order by c1 asc;
c1
1
2
3
4
update t1_part set c1=c1+10;
update t1_dup_part set c1=c1+10;
select * from t1_part order by c1 asc;
c1
11
12
13
14
select * from t1_dup_part order by c1 asc;
c1
11
12
13
14
alter system minor freeze tenant tenant_for_duplicate;
ob1.z1.obs0.check_log_until_success -c "succeed to release head data memtable";
ob1.z2.obs0.check_log_until_success -c "succeed to release head data memtable";
insert into t1_no_pk values (4), (5), (6);
insert into t1_no_pk values (7), (8), (9);
insert into t1_no_pk values (10), (11), (12);
insert into t1_dup_no_pk values (4), (5), (6);
insert into t1_dup_no_pk values (7), (8), (9);
insert into t1_dup_no_pk values (10), (11), (12);
insert into t1_pk values (4), (5), (6);
insert into t1_pk values (7), (8), (9);
insert into t1_pk values (10);
insert into t1_dup_pk values (4), (5), (6);
insert into t1_dup_pk values (7), (8), (9);
insert into t1_dup_pk values (10);
insert into t1_part values (5), (6), (7), (8);
insert into t1_part values (9), (10), (21), (22);
insert into t1_dup_part values (5), (6), (7), (8);
insert into t1_dup_part values (9), (10), (21), (22);
alter system minor freeze tenant tenant_for_duplicate;
ob1.z1.obs0.check_log_until_success -c "succeed to release head data memtable";
ob1.z2.obs0.check_log_until_success -c "succeed to release head data memtable";
'prepare finished'
======================================================================
0. check duplicate log stream in meta table
======================================================================
ob1.check_until_timeout select count(*) as ls_cnt from oceanbase.CDB_OB_LS where tenant_id = $tenant_id and flag like "%DUPLICATE%", 1, 5;
ob1.check_until_timeout select ls_id from oceanbase.CDB_OB_LS where tenant_id = $tenant_id and flag like "%DUPLICATE%", $duplicate_ls_id, 5;
ob1.check_until_timeout select count(*) as ls_cnt from oceanbase.CDB_OB_LS where tenant_id = $tenant_id and flag not like "%DUPLICATE%", 3, 5;
check meta tenant has expected member_list and learner_list
ob1.check_until_timeout select count(*) as check_members_list from oceanbase.__all_virtual_log_stat where tenant_id = $meta_tenant_id and ls_id = $sys_ls_id and role like "%LEADER%" and (paxos_member_list like "%$z1_dst0%" or paxos_member_list like "%$z1_dst1%") and (paxos_member_list like "%$z2_dst0%" or paxos_member_list like "%$z2_dst1%") and (paxos_member_list not like "%$z3_dst0%" and paxos_member_list not like "%$z3_dst1%") and paxos_replica_num = 2 and learner_list = "", 1, 5;
ob1.check_until_timeout select count(*) as check_members_list from oceanbase.CDB_OB_LS_LOCATIONS where tenant_id = $meta_tenant_id and ls_id = $sys_ls_id and role like "%LEADER%" and (member_list like "%$z1_dst0%" or member_list like "%$z1_dst1%") and (member_list like "%$z2_dst0%" or member_list like "%$z2_dst1%") and (member_list not like "%$z3_dst0%" and member_list not like "%$z3_dst1%") and learner_list = "", 1, 5;
check user tenant has expected member_list and learner_list
check user tenant sys ls
ob1.check_until_timeout select count(*) as check_members_list from oceanbase.__all_virtual_log_stat where tenant_id = $tenant_id and ls_id = $sys_ls_id and role like "%LEADER%" and (paxos_member_list like "%$z1_dst0%" or paxos_member_list like "%$z1_dst1%") and (paxos_member_list like "%$z2_dst0%" or paxos_member_list like "%$z2_dst1%") and (paxos_member_list not like "%$z3_dst0%" and paxos_member_list not like "%$z3_dst1%") and paxos_replica_num = 2 and learner_list = "", 1, 5;
ob1.check_until_timeout select count(*) as check_members_list from oceanbase.CDB_OB_LS_LOCATIONS where tenant_id = $tenant_id and ls_id = $sys_ls_id and role like "%LEADER%" and (member_list like "%$z1_dst0%" or member_list like "%$z1_dst1%") and (member_list like "%$z2_dst0%" or member_list like "%$z2_dst1%") and (member_list not like "%$z3_dst0%" and member_list not like "%$z3_dst1%") and learner_list = "", 1, 5;
check user tenant normal_ls_id_min ls
ob1.check_until_timeout select count(*) as check_members_list from oceanbase.__all_virtual_log_stat where tenant_id = $tenant_id and ls_id = $normal_ls_id_min and role like "%LEADER%" and (paxos_member_list like "%$z1_dst0%" or paxos_member_list like "%$z1_dst1%") and (paxos_member_list like "%$z2_dst0%" or paxos_member_list like "%$z2_dst1%") and (paxos_member_list not like "%$z3_dst0%" and paxos_member_list not like "%$z3_dst1%") and paxos_replica_num = 2 and learner_list = "", 1, 5;
ob1.check_until_timeout select count(*) as check_members_list from oceanbase.CDB_OB_LS_LOCATIONS where tenant_id = $tenant_id and ls_id = $normal_ls_id_min and role like "%LEADER%" and (member_list like "%$z1_dst0%" or member_list like "%$z1_dst1%") and (member_list like "%$z2_dst0%" or member_list like "%$z2_dst1%") and (member_list not like "%$z3_dst0%" and member_list not like "%$z3_dst1%") and learner_list = "", 1, 5;
check user tenant normal_ls_id_max ls
ob1.check_until_timeout select count(*) as check_members_list from oceanbase.__all_virtual_log_stat where tenant_id = $tenant_id and ls_id = $normal_ls_id_max and role like "%LEADER%" and (paxos_member_list like "%$z1_dst0%" or paxos_member_list like "%$z1_dst1%") and (paxos_member_list like "%$z2_dst0%" or paxos_member_list like "%$z2_dst1%") and (paxos_member_list not like "%$z3_dst0%" and paxos_member_list not like "%$z3_dst1%") and paxos_replica_num = 2 and learner_list = "", 1, 5;
ob1.check_until_timeout select count(*) as check_members_list from oceanbase.CDB_OB_LS_LOCATIONS where tenant_id = $tenant_id and ls_id = $normal_ls_id_max and role like "%LEADER%" and (member_list like "%$z1_dst0%" or member_list like "%$z1_dst1%") and (member_list like "%$z2_dst0%" or member_list like "%$z2_dst1%") and (member_list not like "%$z3_dst0%" and member_list not like "%$z3_dst1%") and learner_list = "", 1, 5;
check user tenant duplicate_ls_id ls
ob1.check_until_timeout select count(*) as check_members_list from oceanbase.__all_virtual_log_stat where tenant_id = $tenant_id and ls_id = $duplicate_ls_id and role like "%LEADER%" and (paxos_member_list like "%$z1_dst0%" or paxos_member_list like "%$z1_dst1%") and (paxos_member_list like "%$z2_dst0%" or paxos_member_list like "%$z2_dst1%") and (paxos_member_list not like "%$z3_dst0%" and paxos_member_list not like "%$z3_dst1%") and paxos_replica_num = 2 and (learner_list like "%$z1_dst0%" or learner_list like "%$z1_dst1%") and (learner_list like "%$z2_dst0%" or learner_list like "%$z2_dst1%") and (learner_list not like "%$z3_dst0%" and learner_list not like "%$z3_dst1%"), 1, 5;
ob1.check_until_timeout select count(*) as check_members_list from oceanbase.CDB_OB_LS_LOCATIONS where tenant_id = $tenant_id and ls_id = $duplicate_ls_id and role like "%LEADER%" and (member_list like "%$z1_dst0%" or member_list like "%$z1_dst1%") and (member_list like "%$z2_dst0%" or member_list like "%$z2_dst1%") and (member_list not like "%$z3_dst0%" and member_list not like "%$z3_dst1%") and (learner_list like "%$z1_dst0%" or learner_list like "%$z1_dst1%") and (learner_list like "%$z2_dst0%" or learner_list like "%$z2_dst1%") and (learner_list not like "%$z3_dst0%" and learner_list not like "%$z3_dst1%"), 1, 5;
=====================================================================
1. alter locality from FF to FFR
=====================================================================
ob1.mysql set ob_global_debug_sync = 'BEFORE_SEND_DRTASK_RPC wait_for signal execute 10000';
ALTER TENANT tenant_for_duplicate LOCALITY = 'F@z1,F@z2,R@z3';
ob1.mysql set ob_global_debug_sync = 'now signal signal';
ob1.mysql set ob_global_debug_sync = 'now signal signal';
ob1.mysql set ob_global_debug_sync = 'now signal signal';
ob1.mysql set ob_global_debug_sync = 'now signal signal';
ob1.check_until_timeout select count(*) from oceanbase.CDB_OB_LS_LOCATIONS where tenant_id = $tenant_id and ls_id != $duplicate_ls_id, 9, 120;
ob1.check_until_timeout select count(*) from oceanbase.CDB_OB_LS_LOCATIONS where tenant_id = $tenant_id and ls_id = $duplicate_ls_id, 4, 1;
ob1.check_until_timeout select count(*) from oceanbase.DBA_OB_TENANTS where tenant_id = $tenant_id and previous_locality is not NULL, 1, 1;
ob1.mysql set ob_global_debug_sync = 'now signal signal';
ob1.mysql set ob_global_debug_sync = 'now signal signal';
ob1.mysql set ob_global_debug_sync = 'BEFORE_SEND_DRTASK_RPC clear';
ob1.check_until_timeout select count(*) from oceanbase.DBA_OB_TENANTS where tenant_id = $tenant_id and previous_locality is NULL and locality like "%FULL{1}@z1, FULL{1}@z2, READONLY{1}@z3%", 1, 120;
check task generated
ob1.check_until_timeout select count(*) as task_cnt from oceanbase.DBA_OB_ROOTSERVICE_EVENT_HISTORY where module like "%disaster%" and value1 = $meta_tenant_id and value2 = $sys_ls_id and event like "%start_add_ls_replica%" and value6 like "%add non-paxos replica according to locality%", 1, 5;
ob1.check_until_timeout select count(*) as task_cnt from oceanbase.DBA_OB_ROOTSERVICE_EVENT_HISTORY where module like "%disaster%" and value1 = $tenant_id and value2 = $sys_ls_id and event like "%start_add_ls_replica%" and value6 like "%add non-paxos replica according to locality%", 1, 5;
ob1.check_until_timeout select count(*) as task_cnt from oceanbase.DBA_OB_ROOTSERVICE_EVENT_HISTORY where module like "%disaster%" and value1 = $tenant_id and value2 = $normal_ls_id_min and event like "%start_add_ls_replica%" and value6 like "%add non-paxos replica according to locality%", 1, 5;
ob1.check_until_timeout select count(*) as task_cnt from oceanbase.DBA_OB_ROOTSERVICE_EVENT_HISTORY where module like "%disaster%" and value1 = $tenant_id and value2 = $normal_ls_id_max and event like "%start_add_ls_replica%" and value6 like "%add non-paxos replica according to locality%", 1, 5;
ob1.check_until_timeout select count(*) as task_cnt from oceanbase.DBA_OB_ROOTSERVICE_EVENT_HISTORY where module like "%disaster%" and value1 = $tenant_id and value2 = $duplicate_ls_id and event like "%start_add_ls_replica%" and value4 like "%$z3_dst0%" and value6 like "%add non-paxos replica according to locality%", 1, 5;
ob1.check_until_timeout select count(*) as task_cnt from oceanbase.DBA_OB_ROOTSERVICE_EVENT_HISTORY where module like "%disaster%" and value1 = $tenant_id and value2 = $duplicate_ls_id and event like "%start_add_ls_replica%" and value4 like "%$z3_dst1%" and value6 like "%add non-paxos replica according to locality%", 1, 5;
check meta tenant has expected member_list and learner_list
ob1.check_until_timeout select count(*) as check_members_list from oceanbase.__all_virtual_log_stat where tenant_id = $meta_tenant_id and ls_id = $sys_ls_id and role like "%LEADER%" and (paxos_member_list like "%$z1_dst0%" or paxos_member_list like "%$z1_dst1%") and (paxos_member_list like "%$z2_dst0%" or paxos_member_list like "%$z2_dst1%") and (paxos_member_list not like "%$z3_dst0%" and paxos_member_list not like "%$z3_dst1%") and paxos_replica_num = 2 and (learner_list not like "%$z1_dst0%" and learner_list not like "%$z1_dst1%") and (learner_list not like "%$z2_dst0%" and learner_list not like "%$z2_dst1%") and (learner_list like "%$z3_dst0%" or learner_list like "%$z3_dst1%"), 1, 5;
ob1.check_until_timeout select count(*) as check_members_list from oceanbase.CDB_OB_LS_LOCATIONS where tenant_id = $meta_tenant_id and ls_id = $sys_ls_id and role like "%LEADER%" and (member_list like "%$z1_dst0%" or member_list like "%$z1_dst1%") and (member_list like "%$z2_dst0%" or member_list like "%$z2_dst1%") and (member_list not like "%$z3_dst0%" and member_list not like "%$z3_dst1%") and (learner_list not like "%$z1_dst0%" and learner_list not like "%$z1_dst1%") and (learner_list not like "%$z2_dst0%" and learner_list not like "%$z2_dst1%") and (learner_list like "%$z3_dst0%" or learner_list like "%$z3_dst1%"), 1, 5;
check user tenant has expected member_list and learner_list
check user tenant sys ls
ob1.check_until_timeout select count(*) as check_members_list from oceanbase.__all_virtual_log_stat where tenant_id = $tenant_id and ls_id = $sys_ls_id and role like "%LEADER%" and (paxos_member_list like "%$z1_dst0%" or paxos_member_list like "%$z1_dst1%") and (paxos_member_list like "%$z2_dst0%" or paxos_member_list like "%$z2_dst1%") and (paxos_member_list not like "%$z3_dst0%" and paxos_member_list not like "%$z3_dst1%") and paxos_replica_num = 2 and (learner_list not like "%$z1_dst0%" and learner_list not like "%$z1_dst1%") and (learner_list not like "%$z2_dst0%" and learner_list not like "%$z2_dst1%") and (learner_list like "%$z3_dst0%" or learner_list like "%$z3_dst1%"), 1, 5;
ob1.check_until_timeout select count(*) as check_members_list from oceanbase.CDB_OB_LS_LOCATIONS where tenant_id = $tenant_id and ls_id = $sys_ls_id and role like "%LEADER%" and (member_list like "%$z1_dst0%" or member_list like "%$z1_dst1%") and (member_list like "%$z2_dst0%" or member_list like "%$z2_dst1%") and (member_list not like "%$z3_dst0%" and member_list not like "%$z3_dst1%") and (learner_list not like "%$z1_dst0%" and learner_list not like "%$z1_dst1%") and (learner_list not like "%$z2_dst0%" and learner_list not like "%$z2_dst1%") and (learner_list like "%$z3_dst0%" or learner_list like "%$z3_dst1%"), 1, 5;
check user tenant normal_ls_id_min ls
ob1.check_until_timeout select count(*) as check_members_list from oceanbase.__all_virtual_log_stat where tenant_id = $tenant_id and ls_id = $normal_ls_id_min and role like "%LEADER%" and (paxos_member_list like "%$z1_dst0%" or paxos_member_list like "%$z1_dst1%") and (paxos_member_list like "%$z2_dst0%" or paxos_member_list like "%$z2_dst1%") and (paxos_member_list not like "%$z3_dst0%" and paxos_member_list not like "%$z3_dst1%") and paxos_replica_num = 2 and (learner_list not like "%$z1_dst0%" and learner_list not like "%$z1_dst1%") and (learner_list not like "%$z2_dst0%" and learner_list not like "%$z2_dst1%") and (learner_list like "%$z3_dst0%" or learner_list like "%$z3_dst1%"), 1, 5;
ob1.check_until_timeout select count(*) as check_members_list from oceanbase.CDB_OB_LS_LOCATIONS where tenant_id = $tenant_id and ls_id = $normal_ls_id_min and role like "%LEADER%" and (member_list like "%$z1_dst0%" or member_list like "%$z1_dst1%") and (member_list like "%$z2_dst0%" or member_list like "%$z2_dst1%") and (member_list not like "%$z3_dst0%" and member_list not like "%$z3_dst1%") and (learner_list not like "%$z1_dst0%" and learner_list not like "%$z1_dst1%") and (learner_list not like "%$z2_dst0%" and learner_list not like "%$z2_dst1%") and (learner_list like "%$z3_dst0%" or learner_list like "%$z3_dst1%"), 1, 5;
check user tenant normal_ls_id_max ls
ob1.check_until_timeout select count(*) as check_members_list from oceanbase.__all_virtual_log_stat where tenant_id = $tenant_id and ls_id = $normal_ls_id_max and role like "%LEADER%" and (paxos_member_list like "%$z1_dst0%" or paxos_member_list like "%$z1_dst1%") and (paxos_member_list like "%$z2_dst0%" or paxos_member_list like "%$z2_dst1%") and (paxos_member_list not like "%$z3_dst0%" and paxos_member_list not like "%$z3_dst1%") and paxos_replica_num = 2 and (learner_list not like "%$z1_dst0%" and learner_list not like "%$z1_dst1%") and (learner_list not like "%$z2_dst0%" and learner_list not like "%$z2_dst1%") and (learner_list like "%$z3_dst0%" or learner_list like "%$z3_dst1%"), 1, 5;
ob1.check_until_timeout select count(*) as check_members_list from oceanbase.CDB_OB_LS_LOCATIONS where tenant_id = $tenant_id and ls_id = $normal_ls_id_max and role like "%LEADER%" and (member_list like "%$z1_dst0%" or member_list like "%$z1_dst1%") and (member_list like "%$z2_dst0%" or member_list like "%$z2_dst1%") and (member_list not like "%$z3_dst0%" and member_list not like "%$z3_dst1%") and (learner_list not like "%$z1_dst0%" and learner_list not like "%$z1_dst1%") and (learner_list not like "%$z2_dst0%" and learner_list not like "%$z2_dst1%") and (learner_list like "%$z3_dst0%" or learner_list like "%$z3_dst1%"), 1, 5;
check user tenant duplicate_ls_id ls
ob1.check_until_timeout select count(*) as check_members_list from oceanbase.__all_virtual_log_stat where tenant_id = $tenant_id and ls_id = $duplicate_ls_id and role like "%LEADER%" and (paxos_member_list like "%$z1_dst0%" or paxos_member_list like "%$z1_dst1%") and (paxos_member_list like "%$z2_dst0%" or paxos_member_list like "%$z2_dst1%") and (paxos_member_list not like "%$z3_dst0%" and paxos_member_list not like "%$z3_dst1%") and paxos_replica_num = 2 and (learner_list like "%$z1_dst0%" or learner_list like "%$z1_dst1%") and (learner_list like "%$z2_dst0%" or learner_list like "%$z2_dst1%") and (learner_list like "%$z3_dst0%" and learner_list like "%$z3_dst1%"), 1, 5;
ob1.check_until_timeout select count(*) as check_members_list from oceanbase.CDB_OB_LS_LOCATIONS where tenant_id = $tenant_id and ls_id = $duplicate_ls_id and role like "%LEADER%" and (member_list like "%$z1_dst0%" or member_list like "%$z1_dst1%") and (member_list like "%$z2_dst0%" or member_list like "%$z2_dst1%") and (member_list not like "%$z3_dst0%" and member_list not like "%$z3_dst1%") and (learner_list like "%$z1_dst0%" or learner_list like "%$z1_dst1%") and (learner_list like "%$z2_dst0%" or learner_list like "%$z2_dst1%") and (learner_list like "%$z3_dst0%" and learner_list like "%$z3_dst1%"), 1, 5;
=====================================================================
2. alter locality from FFR to FFF
=====================================================================
ALTER TENANT tenant_for_duplicate LOCALITY = 'F@z1,F@z2,F@z3';
ob1.check_until_timeout select count(*) from oceanbase.DBA_OB_TENANTS where tenant_id = $tenant_id and previous_locality is NULL and locality like "%FULL{1}@z1, FULL{1}@z2, FULL{1}@z3%", 1, 120;
check task generated
ob1.check_until_timeout select count(*) as task_cnt from oceanbase.DBA_OB_ROOTSERVICE_EVENT_HISTORY where module like "%disaster%" and value1 = $meta_tenant_id and value2 = $sys_ls_id and event like "%start_type_transform_ls_replica%" and value6 like "%type transform according to locality%" and value5 like "%replica_type:16%", 1, 5;
ob1.check_until_timeout select count(*) as task_cnt from oceanbase.DBA_OB_ROOTSERVICE_EVENT_HISTORY where module like "%disaster%" and value1 = $tenant_id and value2 = $sys_ls_id and event like "%start_type_transform_ls_replica%" and value6 like "%type transform according to locality%" and value5 like "%replica_type:16%", 1, 5;
ob1.check_until_timeout select count(*) as task_cnt from oceanbase.DBA_OB_ROOTSERVICE_EVENT_HISTORY where module like "%disaster%" and value1 = $tenant_id and value2 = $normal_ls_id_min and event like "%start_type_transform_ls_replica%" and value6 like "%type transform according to locality%" and value5 like "%replica_type:16%", 1, 5;
ob1.check_until_timeout select count(*) as task_cnt from oceanbase.DBA_OB_ROOTSERVICE_EVENT_HISTORY where module like "%disaster%" and value1 = $tenant_id and value2 = $normal_ls_id_max and event like "%start_type_transform_ls_replica%" and value6 like "%type transform according to locality%" and value5 like "%replica_type:16%", 1, 5;
ob1.check_until_timeout select count(*) as task_cnt from oceanbase.DBA_OB_ROOTSERVICE_EVENT_HISTORY where module like "%disaster%" and value1 = $tenant_id and value2 = $duplicate_ls_id and event like "%start_type_transform_ls_replica%" and value6 like "%type transform according to locality%" and value5 like "%replica_type:16%", 1, 5;
check meta tenant has expected member_list and learner_list
ob1.check_until_timeout select count(*) as check_members_list from oceanbase.__all_virtual_log_stat where tenant_id = $meta_tenant_id and ls_id = $sys_ls_id and role like "%LEADER%" and (paxos_member_list like "%$z1_dst0%" or paxos_member_list like "%$z1_dst1%") and (paxos_member_list like "%$z2_dst0%" or paxos_member_list like "%$z2_dst1%") and (paxos_member_list like "%$z3_dst0%" or paxos_member_list like "%$z3_dst1%") and paxos_replica_num = 3 and learner_list = "", 1, 5;
ob1.check_until_timeout select count(*) as check_members_list from oceanbase.CDB_OB_LS_LOCATIONS where tenant_id = $meta_tenant_id and ls_id = $sys_ls_id and role like "%LEADER%" and (member_list like "%$z1_dst0%" or member_list like "%$z1_dst1%") and (member_list like "%$z2_dst0%" or member_list like "%$z2_dst1%") and (member_list like "%$z3_dst0%" or member_list like "%$z3_dst1%") and learner_list = "", 1, 5;
check user tenant has expected member_list and learner_list
check user tenant sys ls
ob1.check_until_timeout select count(*) as check_members_list from oceanbase.__all_virtual_log_stat where tenant_id = $tenant_id and ls_id = $sys_ls_id and role like "%LEADER%" and (paxos_member_list like "%$z1_dst0%" or paxos_member_list like "%$z1_dst1%") and (paxos_member_list like "%$z2_dst0%" or paxos_member_list like "%$z2_dst1%") and (paxos_member_list like "%$z3_dst0%" or paxos_member_list like "%$z3_dst1%") and paxos_replica_num = 3 and learner_list = "", 1, 5;
ob1.check_until_timeout select count(*) as check_members_list from oceanbase.CDB_OB_LS_LOCATIONS where tenant_id = $tenant_id and ls_id = $sys_ls_id and role like "%LEADER%" and (member_list like "%$z1_dst0%" or member_list like "%$z1_dst1%") and (member_list like "%$z2_dst0%" or member_list like "%$z2_dst1%") and (member_list like "%$z3_dst0%" or member_list like "%$z3_dst1%") and learner_list = "", 1, 5;
check user tenant normal_ls_id_min ls
ob1.check_until_timeout select count(*) as check_members_list from oceanbase.__all_virtual_log_stat where tenant_id = $tenant_id and ls_id = $normal_ls_id_min and role like "%LEADER%" and (paxos_member_list like "%$z1_dst0%" or paxos_member_list like "%$z1_dst1%") and (paxos_member_list like "%$z2_dst0%" or paxos_member_list like "%$z2_dst1%") and (paxos_member_list like "%$z3_dst0%" or paxos_member_list like "%$z3_dst1%") and paxos_replica_num = 3 and learner_list = "", 1, 5;
ob1.check_until_timeout select count(*) as check_members_list from oceanbase.CDB_OB_LS_LOCATIONS where tenant_id = $tenant_id and ls_id = $normal_ls_id_min and role like "%LEADER%" and (member_list like "%$z1_dst0%" or member_list like "%$z1_dst1%") and (member_list like "%$z2_dst0%" or member_list like "%$z2_dst1%") and (member_list like "%$z3_dst0%" or member_list like "%$z3_dst1%") and learner_list = "", 1, 5;
check user tenant normal_ls_id_max ls
ob1.check_until_timeout select count(*) as check_members_list from oceanbase.__all_virtual_log_stat where tenant_id = $tenant_id and ls_id = $normal_ls_id_max and role like "%LEADER%" and (paxos_member_list like "%$z1_dst0%" or paxos_member_list like "%$z1_dst1%") and (paxos_member_list like "%$z2_dst0%" or paxos_member_list like "%$z2_dst1%") and (paxos_member_list like "%$z3_dst0%" or paxos_member_list like "%$z3_dst1%") and paxos_replica_num = 3 and learner_list = "", 1, 5;
ob1.check_until_timeout select count(*) as check_members_list from oceanbase.CDB_OB_LS_LOCATIONS where tenant_id = $tenant_id and ls_id = $normal_ls_id_max and role like "%LEADER%" and (member_list like "%$z1_dst0%" or member_list like "%$z1_dst1%") and (member_list like "%$z2_dst0%" or member_list like "%$z2_dst1%") and (member_list like "%$z3_dst0%" or member_list like "%$z3_dst1%") and learner_list = "", 1, 5;
check user tenant duplicate_ls_id ls
ob1.check_until_timeout select count(*) as check_members_list from oceanbase.__all_virtual_log_stat where tenant_id = $tenant_id and ls_id = $duplicate_ls_id and role like "%LEADER%" and (paxos_member_list like "%$z1_dst0%" or paxos_member_list like "%$z1_dst1%") and (paxos_member_list like "%$z2_dst0%" or paxos_member_list like "%$z2_dst1%") and (paxos_member_list like "%$z3_dst0%" or paxos_member_list like "%$z3_dst1%") and paxos_replica_num = 3 and (learner_list like "%$z1_dst0%" or learner_list like "%$z1_dst1%") and (learner_list like "%$z2_dst0%" or learner_list like "%$z2_dst1%") and (learner_list like "%$z3_dst0%" or learner_list like "%$z3_dst1%"), 1, 5;
ob1.check_until_timeout select count(*) as check_members_list from oceanbase.CDB_OB_LS_LOCATIONS where tenant_id = $tenant_id and ls_id = $duplicate_ls_id and role like "%LEADER%" and (member_list like "%$z1_dst0%" or member_list like "%$z1_dst1%") and (member_list like "%$z2_dst0%" or member_list like "%$z2_dst1%") and (member_list like "%$z3_dst0%" or member_list like "%$z3_dst1%") and (learner_list like "%$z1_dst0%" or learner_list like "%$z1_dst1%") and (learner_list like "%$z2_dst0%" or learner_list like "%$z2_dst1%") and (learner_list like "%$z3_dst0%" or learner_list like "%$z3_dst1%"), 1, 5;
=====================================================================
3. alter locality from FFF to FRR
=====================================================================
ALTER TENANT tenant_for_duplicate LOCALITY = 'F@z1,R@z2,R@z3';
ERROR HY000: violate locality principal not allowed
=====================================================================
4. alter locality from FFF to FFR
=====================================================================
ALTER TENANT tenant_for_duplicate LOCALITY = 'F@z1,F@z2,R@z3';
ob1.check_until_timeout select count(*) from oceanbase.DBA_OB_TENANTS where tenant_id = $tenant_id and previous_locality is NULL and locality like "%FULL{1}@z1, FULL{1}@z2, READONLY{1}@z3%", 1, 120;
check task generated
ob1.check_until_timeout select count(*) as task_cnt from oceanbase.DBA_OB_ROOTSERVICE_EVENT_HISTORY where module like "%disaster%" and value1 = $meta_tenant_id and value2 = $sys_ls_id and event like "%start_type_transform_ls_replica%" and value6 like "%type transform according to locality%" and value5 like "%replica_type:0%", 1, 5;
ob1.check_until_timeout select count(*) as task_cnt from oceanbase.DBA_OB_ROOTSERVICE_EVENT_HISTORY where module like "%disaster%" and value1 = $tenant_id and value2 = $sys_ls_id and event like "%start_type_transform_ls_replica%" and value6 like "%type transform according to locality%" and value5 like "%replica_type:0%", 1, 5;
ob1.check_until_timeout select count(*) as task_cnt from oceanbase.DBA_OB_ROOTSERVICE_EVENT_HISTORY where module like "%disaster%" and value1 = $tenant_id and value2 = $normal_ls_id_min and event like "%start_type_transform_ls_replica%" and value6 like "%type transform according to locality%" and value5 like "%replica_type:0%", 1, 5;
ob1.check_until_timeout select count(*) as task_cnt from oceanbase.DBA_OB_ROOTSERVICE_EVENT_HISTORY where module like "%disaster%" and value1 = $tenant_id and value2 = $normal_ls_id_max and event like "%start_type_transform_ls_replica%" and value6 like "%type transform according to locality%" and value5 like "%replica_type:0%", 1, 5;
ob1.check_until_timeout select count(*) as task_cnt from oceanbase.DBA_OB_ROOTSERVICE_EVENT_HISTORY where module like "%disaster%" and value1 = $tenant_id and value2 = $duplicate_ls_id and event like "%start_type_transform_ls_replica%" and value6 like "%type transform according to locality%" and value5 like "%replica_type:0%", 1, 5;
check meta tenant has expected member_list and learner_list
ob1.check_until_timeout select count(*) as check_members_list from oceanbase.__all_virtual_log_stat where tenant_id = $meta_tenant_id and ls_id = $sys_ls_id and role like "%LEADER%" and (paxos_member_list like "%$z1_dst0%" or paxos_member_list like "%$z1_dst1%") and (paxos_member_list like "%$z2_dst0%" or paxos_member_list like "%$z2_dst1%") and (paxos_member_list not like "%$z3_dst0%" and paxos_member_list not like "%$z3_dst1%") and paxos_replica_num = 2 and (learner_list not like "%$z1_dst0%" and learner_list not like "%$z1_dst1%") and (learner_list not like "%$z2_dst0%" and learner_list not like "%$z2_dst1%") and (learner_list like "%$z3_dst0%" or learner_list like "%$z3_dst1%"), 1, 5;
ob1.check_until_timeout select count(*) as check_members_list from oceanbase.CDB_OB_LS_LOCATIONS where tenant_id = $meta_tenant_id and ls_id = $sys_ls_id and role like "%LEADER%" and (member_list like "%$z1_dst0%" or member_list like "%$z1_dst1%") and (member_list like "%$z2_dst0%" or member_list like "%$z2_dst1%") and (member_list not like "%$z3_dst0%" and member_list not like "%$z3_dst1%") and (learner_list not like "%$z1_dst0%" and learner_list not like "%$z1_dst1%") and (learner_list not like "%$z2_dst0%" and learner_list not like "%$z2_dst1%") and (learner_list like "%$z3_dst0%" or learner_list like "%$z3_dst1%"), 1, 5;
check user tenant has expected member_list and learner_list
check user tenant sys ls
ob1.check_until_timeout select count(*) as check_members_list from oceanbase.__all_virtual_log_stat where tenant_id = $tenant_id and ls_id = $sys_ls_id and role like "%LEADER%" and (paxos_member_list like "%$z1_dst0%" or paxos_member_list like "%$z1_dst1%") and (paxos_member_list like "%$z2_dst0%" or paxos_member_list like "%$z2_dst1%") and (paxos_member_list not like "%$z3_dst0%" and paxos_member_list not like "%$z3_dst1%") and paxos_replica_num = 2 and (learner_list not like "%$z1_dst0%" and learner_list not like "%$z1_dst1%") and (learner_list not like "%$z2_dst0%" and learner_list not like "%$z2_dst1%") and (learner_list like "%$z3_dst0%" or learner_list like "%$z3_dst1%"), 1, 5;
ob1.check_until_timeout select count(*) as check_members_list from oceanbase.CDB_OB_LS_LOCATIONS where tenant_id = $tenant_id and ls_id = $sys_ls_id and role like "%LEADER%" and (member_list like "%$z1_dst0%" or member_list like "%$z1_dst1%") and (member_list like "%$z2_dst0%" or member_list like "%$z2_dst1%") and (member_list not like "%$z3_dst0%" and member_list not like "%$z3_dst1%") and (learner_list not like "%$z1_dst0%" and learner_list not like "%$z1_dst1%") and (learner_list not like "%$z2_dst0%" and learner_list not like "%$z2_dst1%") and (learner_list like "%$z3_dst0%" or learner_list like "%$z3_dst1%"), 1, 5;
check user tenant normal_ls_id_min ls
ob1.check_until_timeout select count(*) as check_members_list from oceanbase.__all_virtual_log_stat where tenant_id = $tenant_id and ls_id = $normal_ls_id_min and role like "%LEADER%" and (paxos_member_list like "%$z1_dst0%" or paxos_member_list like "%$z1_dst1%") and (paxos_member_list like "%$z2_dst0%" or paxos_member_list like "%$z2_dst1%") and (paxos_member_list not like "%$z3_dst0%" and paxos_member_list not like "%$z3_dst1%") and paxos_replica_num = 2 and (learner_list not like "%$z1_dst0%" and learner_list not like "%$z1_dst1%") and (learner_list not like "%$z2_dst0%" and learner_list not like "%$z2_dst1%") and (learner_list like "%$z3_dst0%" or learner_list like "%$z3_dst1%"), 1, 5;
ob1.check_until_timeout select count(*) as check_members_list from oceanbase.CDB_OB_LS_LOCATIONS where tenant_id = $tenant_id and ls_id = $normal_ls_id_min and role like "%LEADER%" and (member_list like "%$z1_dst0%" or member_list like "%$z1_dst1%") and (member_list like "%$z2_dst0%" or member_list like "%$z2_dst1%") and (member_list not like "%$z3_dst0%" and member_list not like "%$z3_dst1%") and (learner_list not like "%$z1_dst0%" and learner_list not like "%$z1_dst1%") and (learner_list not like "%$z2_dst0%" and learner_list not like "%$z2_dst1%") and (learner_list like "%$z3_dst0%" or learner_list like "%$z3_dst1%"), 1, 5;
check user tenant normal_ls_id_max ls
ob1.check_until_timeout select count(*) as check_members_list from oceanbase.__all_virtual_log_stat where tenant_id = $tenant_id and ls_id = $normal_ls_id_max and role like "%LEADER%" and (paxos_member_list like "%$z1_dst0%" or paxos_member_list like "%$z1_dst1%") and (paxos_member_list like "%$z2_dst0%" or paxos_member_list like "%$z2_dst1%") and (paxos_member_list not like "%$z3_dst0%" and paxos_member_list not like "%$z3_dst1%") and paxos_replica_num = 2 and (learner_list not like "%$z1_dst0%" and learner_list not like "%$z1_dst1%") and (learner_list not like "%$z2_dst0%" and learner_list not like "%$z2_dst1%") and (learner_list like "%$z3_dst0%" or learner_list like "%$z3_dst1%"), 1, 5;
ob1.check_until_timeout select count(*) as check_members_list from oceanbase.CDB_OB_LS_LOCATIONS where tenant_id = $tenant_id and ls_id = $normal_ls_id_max and role like "%LEADER%" and (member_list like "%$z1_dst0%" or member_list like "%$z1_dst1%") and (member_list like "%$z2_dst0%" or member_list like "%$z2_dst1%") and (member_list not like "%$z3_dst0%" and member_list not like "%$z3_dst1%") and (learner_list not like "%$z1_dst0%" and learner_list not like "%$z1_dst1%") and (learner_list not like "%$z2_dst0%" and learner_list not like "%$z2_dst1%") and (learner_list like "%$z3_dst0%" or learner_list like "%$z3_dst1%"), 1, 5;
check user tenant duplicate_ls_id ls
ob1.check_until_timeout select count(*) as check_members_list from oceanbase.__all_virtual_log_stat where tenant_id = $tenant_id and ls_id = $duplicate_ls_id and role like "%LEADER%" and (paxos_member_list like "%$z1_dst0%" or paxos_member_list like "%$z1_dst1%") and (paxos_member_list like "%$z2_dst0%" or paxos_member_list like "%$z2_dst1%") and (paxos_member_list not like "%$z3_dst0%" and paxos_member_list not like "%$z3_dst1%") and paxos_replica_num = 2 and (learner_list like "%$z1_dst0%" or learner_list like "%$z1_dst1%") and (learner_list like "%$z2_dst0%" or learner_list like "%$z2_dst1%") and (learner_list like "%$z3_dst0%" and learner_list like "%$z3_dst1%"), 1, 5;
ob1.check_until_timeout select count(*) as check_members_list from oceanbase.CDB_OB_LS_LOCATIONS where tenant_id = $tenant_id and ls_id = $duplicate_ls_id and role like "%LEADER%" and (member_list like "%$z1_dst0%" or member_list like "%$z1_dst1%") and (member_list like "%$z2_dst0%" or member_list like "%$z2_dst1%") and (member_list not like "%$z3_dst0%" and member_list not like "%$z3_dst1%") and (learner_list like "%$z1_dst0%" or learner_list like "%$z1_dst1%") and (learner_list like "%$z2_dst0%" or learner_list like "%$z2_dst1%") and (learner_list like "%$z3_dst0%" and learner_list like "%$z3_dst1%"), 1, 5;
=====================================================================
5. alter locality from FFF to FF
=====================================================================
ALTER TENANT tenant_for_duplicate LOCALITY = 'F@z1,F@z2';
ob1.check_until_timeout select count(*) from oceanbase.DBA_OB_TENANTS where tenant_id = $tenant_id and previous_locality is NULL and locality like "%FULL{1}@z1, FULL{1}@z2%" and locality not like "%READONLY%", 1, 120;
check task generated
ob1.check_until_timeout select count(*) as task_cnt from oceanbase.DBA_OB_ROOTSERVICE_EVENT_HISTORY where module like "%disaster%" and value1 = $meta_tenant_id and value2 = $sys_ls_id and event like "%start_remove_ls_non_paxos_replica%" and value6 like "%remove redundant non-paxos replica according to locality%" and value5 like "%replica_type:16%", 1, 5;
ob1.check_until_timeout select count(*) as task_cnt from oceanbase.DBA_OB_ROOTSERVICE_EVENT_HISTORY where module like "%disaster%" and value1 = $tenant_id and value2 = $sys_ls_id and event like "%start_remove_ls_non_paxos_replica%" and value6 like "%remove redundant non-paxos replica according to locality%" and value5 like "%replica_type:16%", 1, 5;
ob1.check_until_timeout select count(*) as task_cnt from oceanbase.DBA_OB_ROOTSERVICE_EVENT_HISTORY where module like "%disaster%" and value1 = $tenant_id and value2 = $normal_ls_id_min and event like "%start_remove_ls_non_paxos_replica%" and value6 like "%remove redundant non-paxos replica according to locality%" and value5 like "%replica_type:16%", 1, 5;
ob1.check_until_timeout select count(*) as task_cnt from oceanbase.DBA_OB_ROOTSERVICE_EVENT_HISTORY where module like "%disaster%" and value1 = $tenant_id and value2 = $normal_ls_id_max and event like "%start_remove_ls_non_paxos_replica%" and value6 like "%remove redundant non-paxos replica according to locality%" and value5 like "%replica_type:16%", 1, 5;
ob1.check_until_timeout select count(*) as task_cnt from oceanbase.DBA_OB_ROOTSERVICE_EVENT_HISTORY where module like "%disaster%" and value1 = $tenant_id and value2 = $duplicate_ls_id and event like "%start_remove_ls_non_paxos_replica%" and value6 like "%remove redundant non-paxos replica according to locality%" and value5 like "%$z3_dst0%" and value5 like "%replica_type:16%", 1, 5;
ob1.check_until_timeout select count(*) as task_cnt from oceanbase.DBA_OB_ROOTSERVICE_EVENT_HISTORY where module like "%disaster%" and value1 = $tenant_id and value2 = $duplicate_ls_id and event like "%start_remove_ls_non_paxos_replica%" and value6 like "%remove redundant non-paxos replica according to locality%" and value5 like "%$z3_dst1%" and value5 like "%replica_type:16%", 1, 5;
check meta tenant has expected member_list and learner_list
ob1.check_until_timeout select count(*) as check_members_list from oceanbase.__all_virtual_log_stat where tenant_id = $meta_tenant_id and ls_id = $sys_ls_id and role like "%LEADER%" and (paxos_member_list like "%$z1_dst0%" or paxos_member_list like "%$z1_dst1%") and (paxos_member_list like "%$z2_dst0%" or paxos_member_list like "%$z2_dst1%") and (paxos_member_list not like "%$z3_dst0%" and paxos_member_list not like "%$z3_dst1%") and paxos_replica_num = 2 and learner_list = "", 1, 5;
ob1.check_until_timeout select count(*) as check_members_list from oceanbase.CDB_OB_LS_LOCATIONS where tenant_id = $meta_tenant_id and ls_id = $sys_ls_id and role like "%LEADER%" and (member_list like "%$z1_dst0%" or member_list like "%$z1_dst1%") and (member_list like "%$z2_dst0%" or member_list like "%$z2_dst1%") and (member_list not like "%$z3_dst0%" and member_list not like "%$z3_dst1%") and learner_list = "", 1, 5;
check user tenant has expected member_list and learner_list
check user tenant sys ls
ob1.check_until_timeout select count(*) as check_members_list from oceanbase.__all_virtual_log_stat where tenant_id = $tenant_id and ls_id = $sys_ls_id and role like "%LEADER%" and (paxos_member_list like "%$z1_dst0%" or paxos_member_list like "%$z1_dst1%") and (paxos_member_list like "%$z2_dst0%" or paxos_member_list like "%$z2_dst1%") and (paxos_member_list not like "%$z3_dst0%" and paxos_member_list not like "%$z3_dst1%") and paxos_replica_num = 2 and learner_list = "", 1, 5;
ob1.check_until_timeout select count(*) as check_members_list from oceanbase.CDB_OB_LS_LOCATIONS where tenant_id = $tenant_id and ls_id = $sys_ls_id and role like "%LEADER%" and (member_list like "%$z1_dst0%" or member_list like "%$z1_dst1%") and (member_list like "%$z2_dst0%" or member_list like "%$z2_dst1%") and (member_list not like "%$z3_dst0%" and member_list not like "%$z3_dst1%") and learner_list = "", 1, 5;
check user tenant normal_ls_id_min ls
ob1.check_until_timeout select count(*) as check_members_list from oceanbase.__all_virtual_log_stat where tenant_id = $tenant_id and ls_id = $normal_ls_id_min and role like "%LEADER%" and (paxos_member_list like "%$z1_dst0%" or paxos_member_list like "%$z1_dst1%") and (paxos_member_list like "%$z2_dst0%" or paxos_member_list like "%$z2_dst1%") and (paxos_member_list not like "%$z3_dst0%" and paxos_member_list not like "%$z3_dst1%") and paxos_replica_num = 2 and learner_list = "", 1, 5;
ob1.check_until_timeout select count(*) as check_members_list from oceanbase.CDB_OB_LS_LOCATIONS where tenant_id = $tenant_id and ls_id = $normal_ls_id_min and role like "%LEADER%" and (member_list like "%$z1_dst0%" or member_list like "%$z1_dst1%") and (member_list like "%$z2_dst0%" or member_list like "%$z2_dst1%") and (member_list not like "%$z3_dst0%" and member_list not like "%$z3_dst1%") and learner_list = "", 1, 5;
check user tenant normal_ls_id_max ls
ob1.check_until_timeout select count(*) as check_members_list from oceanbase.__all_virtual_log_stat where tenant_id = $tenant_id and ls_id = $normal_ls_id_max and role like "%LEADER%" and (paxos_member_list like "%$z1_dst0%" or paxos_member_list like "%$z1_dst1%") and (paxos_member_list like "%$z2_dst0%" or paxos_member_list like "%$z2_dst1%") and (paxos_member_list not like "%$z3_dst0%" and paxos_member_list not like "%$z3_dst1%") and paxos_replica_num = 2 and learner_list = "", 1, 5;
ob1.check_until_timeout select count(*) as check_members_list from oceanbase.CDB_OB_LS_LOCATIONS where tenant_id = $tenant_id and ls_id = $normal_ls_id_max and role like "%LEADER%" and (member_list like "%$z1_dst0%" or member_list like "%$z1_dst1%") and (member_list like "%$z2_dst0%" or member_list like "%$z2_dst1%") and (member_list not like "%$z3_dst0%" and member_list not like "%$z3_dst1%") and learner_list = "", 1, 5;
check user tenant duplicate_ls_id ls
ob1.check_until_timeout select count(*) as check_members_list from oceanbase.__all_virtual_log_stat where tenant_id = $tenant_id and ls_id = $duplicate_ls_id and role like "%LEADER%" and (paxos_member_list like "%$z1_dst0%" or paxos_member_list like "%$z1_dst1%") and (paxos_member_list like "%$z2_dst0%" or paxos_member_list like "%$z2_dst1%") and (paxos_member_list not like "%$z3_dst0%" and paxos_member_list not like "%$z3_dst1%") and paxos_replica_num = 2 and (learner_list like "%$z1_dst0%" or learner_list like "%$z1_dst1%") and (learner_list like "%$z2_dst0%" or learner_list like "%$z2_dst1%") and (learner_list not like "%$z3_dst0%" and learner_list not like "%$z3_dst1%"), 1, 5;
ob1.check_until_timeout select count(*) as check_members_list from oceanbase.CDB_OB_LS_LOCATIONS where tenant_id = $tenant_id and ls_id = $duplicate_ls_id and role like "%LEADER%" and (member_list like "%$z1_dst0%" or member_list like "%$z1_dst1%") and (member_list like "%$z2_dst0%" or member_list like "%$z2_dst1%") and (member_list not like "%$z3_dst0%" and member_list not like "%$z3_dst1%") and (learner_list like "%$z1_dst0%" or learner_list like "%$z1_dst1%") and (learner_list like "%$z2_dst0%" or learner_list like "%$z2_dst1%") and (learner_list not like "%$z3_dst0%" and learner_list not like "%$z3_dst1%"), 1, 5;
