ob1=OBI(cluster=1:1:2,proxy_num=0,init_unit_cpu=0);
ob1.set extra_config=$mini_ob_config;
ob1.reboot;
ob1.mysql alter system set debug_sync_timeout = '1000s';
ob1.mysql ALTER SYSTEM SET enable_rebalance = 'false';
ob1.mysql ALTER SYSTEM SET enable_rereplication = 'true';
============================================
create mysql tenant
============================================
set @@session.ob_query_timeout = 200000000;
alter system set __min_full_resource_pool_memory=1073741824;
use oceanbase;
ob1.mysql CREATE RESOURCE POOL tenant_pool UNIT = "2c2g", UNIT_NUM = 1, ZONE_LIST = ('z1', 'z2', 'z3');
ob1.mysql CREATE TENANT mysql RESOURCE_POOL_LIST=('tenant_pool'), LOCALITY = "F@z1, F@z2, F@z3", PRIMARY_ZONE = "z1,z2,z3" SET ob_tcp_invited_nodes='%';
create table t1_no_pk (c1 int);
insert into t1_no_pk values (1), (2), (3);
select * from t1_no_pk order by c1 asc;
c1
1
2
3
update t1_no_pk set c1=c1+10;
select * from t1_no_pk order by c1 asc;
c1
11
12
13
create table t1_pk (c1 int primary key);
insert into t1_pk values (1), (2), (3);
select * from t1_pk order by c1 asc;
c1
1
2
3
update t1_pk set c1=c1+10;
select * from t1_pk order by c1 asc;
c1
11
12
13
create table t1_part (c1 int primary key) partition by hash(c1) partitions 4;
insert into t1_part values (1), (2), (3), (4);
select * from t1_part order by c1 asc;
c1
1
2
3
4
update t1_part set c1=c1+10;
select * from t1_part order by c1 asc;
c1
11
12
13
14
alter system minor freeze tenant mysql;
ob1.z1.obs0.check_log_until_success -c "succeed to release head data memtable";
ob1.z2.obs0.check_log_until_success -c "succeed to release head data memtable";
insert into t1_no_pk values (4), (5), (6);
insert into t1_no_pk values (7), (8), (9);
insert into t1_no_pk values (10), (11), (12);
insert into t1_pk values (4), (5), (6);
insert into t1_pk values (7), (8), (9);
insert into t1_pk values (10);
insert into t1_part values (5), (6), (7), (8);
insert into t1_part values (9), (10), (21), (22);
alter system minor freeze tenant mysql;
ob1.z1.obs0.check_log_until_success -c "succeed to release head data memtable";
ob1.z2.obs0.check_log_until_success -c "succeed to release head data memtable";
=============================================
check __all_virtal_ls_info
=============================================
ob1.check_until_timeout select count(*) as cnt from oceanbase.__all_virtual_ls_info where required_data_disk_size = 0, 0, 30;
=============================================
trigger migrate replcia task
=============================================
ob1.check_until_timeout select count(*) > 0 from oceanbase.DBA_OB_ROOTSERVICE_EVENT_HISTORY where event like "%finish_mig%", 1, 60;
ob1.check_until_timeout select count(*) as cnt from oceanbase.DBA_OB_UNITS where migrate_from_svr_ip is not null, 0, 300;
